Bluetooth monitor ver 5.72
= Note: Linux version 6.14.0-36-generic (x86_64)                       0.666860
= Note: Bluetooth subsystem version 2.22                               0.666861
= New Index: 00:00:00:00:00:00 (Primary,UART,hci1)              [hci1] 0.666862
= New Index: 48:5F:99:8E:E0:64 (Primary,USB,hci0)               [hci0] 0.666863
= Open Index: 00:00:00:00:00:00                                 [hci1] 0.780562
= Index Info: 00:00:00:00:00:00 (Nordic Semiconductor ASA)      [hci1] 0.780576
@ USER Open: main (privileged) version 2.22            {0x0001} [hci1] 0.780586
< HCI Command: Reset (0x03|0x0003) plen 0                    #1 [hci1] 0.781841
> HCI Event: Command Complete (0x0e) plen 4                  #2 [hci1] 0.782340
      Reset (0x03|0x0003) ncmd 1
        Status: Success (0x00)
< HCI Command: Read Local Supported... (0x04|0x0003) plen 0  #3 [hci1] 0.800359
> HCI Event: Command Complete (0x0e) plen 12                 #4 [hci1] 0.800863
      Read Local Supported Features (0x04|0x0003) ncmd 1
        Status: Success (0x00)
        Features: 0x00 0x00 0x00 0x00 0x60 0x00 0x00 0x00
          BR/EDR Not Supported
          LE Supported (Controller)
< HCI Command: Read Local Version In.. (0x04|0x0001) plen 0  #5 [hci1] 0.820047
> HCI Event: Command Complete (0x0e) plen 12                 #6 [hci1] 0.820563
      Read Local Version Information (0x04|0x0001) ncmd 1
        Status: Success (0x00)
        HCI version: Reserved (0x0f) - Revision 12393 (0x3069)
        LMP version: Reserved (0x0f) - Subversion 12393 (0x3069)
        Manufacturer: Nordic Semiconductor ASA (89)
< HCI Command: Read Local Supported... (0x04|0x0002) plen 0  #7 [hci1] 0.840004
> HCI Event: Command Complete (0x0e) plen 68                 #8 [hci1] 0.841072
      Read Local Supported Commands (0x04|0x0002) ncmd 1
        Status: Success (0x00)
        Commands: 119 entries
          Disconnect (Octet 0 - Bit 5)
          Read Remote Version Information (Octet 2 - Bit 7)
          Set Event Mask (Octet 5 - Bit 6)
          Reset (Octet 5 - Bit 7)
          Read Connection Accept Timeout (Octet 7 - Bit 2)
          Write Connection Accept Timeout (Octet 7 - Bit 3)
          Read Transmit Power Level (Octet 10 - Bit 2)
          Set Controller To Host Flow Control (Octet 10 - Bit 5)
          Host Buffer Size (Octet 10 - Bit 6)
          Host Number of Completed Packets (Octet 10 - Bit 7)
          Read Local Version Information (Octet 14 - Bit 3)
          Read Local Supported Features (Octet 14 - Bit 5)
          Read BD ADDR (Octet 15 - Bit 1)
          Read RSSI (Octet 15 - Bit 5)
          Set Event Mask Page 2 (Octet 22 - Bit 2)
          LE Set Event Mask (Octet 25 - Bit 0)
          LE Read Buffer Size (Octet 25 - Bit 1)
          LE Read Local Supported Features (Octet 25 - Bit 2)
          LE Set Random Address (Octet 25 - Bit 4)
          LE Set Advertising Parameters (Octet 25 - Bit 5)
          LE Read Advertising Channel TX Power (Octet 25 - Bit 6)
          LE Set Advertising Data (Octet 25 - Bit 7)
          LE Set Scan Response Data (Octet 26 - Bit 0)
          LE Set Advertise Enable (Octet 26 - Bit 1)
          LE Set Scan Parameters (Octet 26 - Bit 2)
          LE Set Scan Enable (Octet 26 - Bit 3)
          LE Create Connection (Octet 26 - Bit 4)
          LE Create Connection Cancel (Octet 26 - Bit 5)
          LE Read Accept List Size (Octet 26 - Bit 6)
          LE Clear Accept List (Octet 26 - Bit 7)
          LE Add Device To Accept List (Octet 27 - Bit 0)
          LE Remove Device From Accept List (Octet 27 - Bit 1)
          LE Connection Update (Octet 27 - Bit 2)
          LE Set Host Channel Classification (Octet 27 - Bit 3)
          LE Read Channel Map (Octet 27 - Bit 4)
          LE Read Remote Used Features (Octet 27 - Bit 5)
          LE Encrypt (Octet 27 - Bit 6)
          LE Rand (Octet 27 - Bit 7)
          LE Start Encryption (Octet 28 - Bit 0)
          LE Long Term Key Request Reply (Octet 28 - Bit 1)
          LE Long Term Key Request Neg Reply (Octet 28 - Bit 2)
          LE Read Supported States (Octet 28 - Bit 3)
          LE Receiver Test (Octet 28 - Bit 4)
          LE Transmitter Test (Octet 28 - Bit 5)
          LE Test End (Octet 28 - Bit 6)
          Read Authenticated Payload Timeout (Octet 32 - Bit 4)
          Write Authenticated Payload Timeout (Octet 32 - Bit 5)
          LE Set Data Length (Octet 33 - Bit 6)
          LE Read Suggested Default Data Length (Octet 33 - Bit 7)
          LE Write Suggested Default Data Length (Octet 34 - Bit 0)
          LE Add Device To Resolving List (Octet 34 - Bit 3)
          LE Remove Device From Resolving List (Octet 34 - Bit 4)
          LE Clear Resolving List (Octet 34 - Bit 5)
          LE Read Resolving List Size (Octet 34 - Bit 6)
          LE Set Address Resolution Enable (Octet 35 - Bit 1)
          LE Set Resolvable Private Address Timeout (Octet 35 - Bit 2)
          LE Read Maximum Data Length (Octet 35 - Bit 3)
          LE Read PHY (Octet 35 - Bit 4)
          LE Set Default PHY (Octet 35 - Bit 5)
          LE Set PHY (Octet 35 - Bit 6)
          LE Enhanced Receiver Test (Octet 35 - Bit 7)
          LE Enhanced Transmitter Test (Octet 36 - Bit 0)
          LE Set Advertising Set Random Address (Octet 36 - Bit 1)
          LE Set Extended Advertising Parameters (Octet 36 - Bit 2)
          LE Set Extended Advertising Data (Octet 36 - Bit 3)
          LE Set Extended Scan Response Data (Octet 36 - Bit 4)
          LE Set Extended Advertising Enable (Octet 36 - Bit 5)
          LE Read Maximum Advertising Data Length (Octet 36 - Bit 6)
          LE Read Number of Supported Advertising Sets (Octet 36 - Bit 7)
          LE Remove Advertising Set (Octet 37 - Bit 0)
          LE Clear Advertising Sets (Octet 37 - Bit 1)
          LE Set Periodic Advertising Parameters (Octet 37 - Bit 2)
          LE Set Periodic Advertising Data (Octet 37 - Bit 3)
          LE Set Periodic Advertising Enable (Octet 37 - Bit 4)
          LE Set Extended Scan Parameters (Octet 37 - Bit 5)
          LE Set Extended Scan Enable (Octet 37 - Bit 6)
          LE Extended Create Connection (Octet 37 - Bit 7)
          LE Periodic Advertising Create Sync (Octet 38 - Bit 0)
          LE Periodic Advertising Create Sync Cancel (Octet 38 - Bit 1)
          LE Periodic Advertising Terminate Sync (Octet 38 - Bit 2)
          LE Add Device To Periodic Advertiser List (Octet 38 - Bit 3)
          LE Remove Device From Periodic Advertiser List (Octet 38 - Bit 4)
          LE Clear Periodic Advertiser List (Octet 38 - Bit 5)
          LE Read Periodic Advertiser List Size (Octet 38 - Bit 6)
          LE Read Transmit Power (Octet 38 - Bit 7)
          LE Read RF Path Compensation (Octet 39 - Bit 0)
          LE Write RF Path Compensation (Octet 39 - Bit 1)
          LE Set Privacy Mode (Octet 39 - Bit 2)
          LE Periodic Advertising Receive Enable (Octet 40 - Bit 5)
          LE Periodic Advertising Sync Transfer (Octet 40 - Bit 6)
          LE Periodic Advertising Set Info Transfer (Octet 40 - Bit 7)
          LE Periodic Advertising Sync Transfer Parameters (Octet 41 - Bit 0)
          LE Set Default Periodic Advertisng Sync Transfer Parameters (Octet 41 - Bit 1)
          LE Read Buffer v2 (Octet 41 - Bit 5)
          LE Read ISO TX Sync (Octet 41 - Bit 6)
          LE Set Connected Isochronous Group Parameters (Octet 41 - Bit 7)
          LE Set Connected Isochronous Group Parameters Test (Octet 42 - Bit 0)
          LE Create Connected Isochronous Stream (Octet 42 - Bit 1)
          LE Remove Connected Isochronous Group (Octet 42 - Bit 2)
          LE Accept Connected Isochronous Stream Request (Octet 42 - Bit 3)
          LE Reject Connected Isochronous Stream Request (Octet 42 - Bit 4)
          LE Create Broadcast Isochronous Group (Octet 42 - Bit 5)
          LE Create Broadcast Isochronous Group Test (Octet 42 - Bit 6)
          LE Terminate Broadcast Isochronous Group (Octet 42 - Bit 7)
          LE Broadcast Isochronous Group Create Sync (Octet 43 - Bit 0)
          LE Broadcast Isochronous Group Terminate Sync (Octet 43 - Bit 1)
          LE Request Peer SCA (Octet 43 - Bit 2)
          LE Setup Isochronous Data Path (Octet 43 - Bit 3)
          LE Remove Isochronous Data Path (Octet 43 - Bit 4)
          LE Isochronous Transmit Test (Octet 43 - Bit 5)
          LE Isochronous Receive Test (Octet 43 - Bit 6)
          LE Isochronous Read Test Counters (Octet 43 - Bit 7)
          LE Isochronous Read Test Counters (Octet 44 - Bit 0)
          LE Set Host Feature (Octet 44 - Bit 1)
          Octet 44 - Bit 2 
          Octet 45 - Bit 6 
          Octet 46 - Bit 0 
          Octet 46 - Bit 1 
          Octet 46 - Bit 2 
< HCI Command: Host Buffer Size (0x03|0x0033) plen 7         #9 [hci1] 0.860042
        ACL MTU: 255  ACL max packet: 16
        SCO MTU: 0    SCO max packet: 0
> HCI Event: Command Complete (0x0e) plen 4                 #10 [hci1] 0.860546
      Host Buffer Size (0x03|0x0033) ncmd 1
        Status: Success (0x00)
< HCI Command: Set Controller To Ho.. (0x03|0x0031) plen 1  #11 [hci1] 0.880009
        Flow control: ACL Data Packets (0x01)
> HCI Event: Command Complete (0x0e) plen 4                 #12 [hci1] 0.880489
      Set Controller To Host Flow Control (0x03|0x0031) ncmd 1
        Status: Success (0x00)
< HCI Command: LE Read Local Suppor.. (0x08|0x0003) plen 0  #13 [hci1] 0.900037
> HCI Event: Command Complete (0x0e) plen 12                #14 [hci1] 0.900491
      LE Read Local Supported Features (0x08|0x0003) ncmd 1
        Status: Success (0x00)
        Features: 0xfd 0x79 0x00 0xf7 0x30 0x01 0x00 0x00
          LE Encryption
          Extended Reject Indication
          Peripheral-initiated Features Exchange
          LE Ping
          LE Data Packet Length Extension
          LL Privacy
          Extended Scanner Filter Policies
          LE 2M PHY
          LE Coded PHY
          LE Extended Advertising
          LE Periodic Advertising
          Channel Selection Algorithm #2
          Periodic Advertising Sync Transfer - Sender
          Periodic Advertising Sync Transfer - Recipient
          Sleep Clock Accuracy Updates
          Connected Isochronous Stream - Central
          Connected Isochronous Stream - Peripheral
          Isochronous Broadcaster
          Synchronized Receiver
          Periodic Advertising ADI support
          Connection Subrating
          Unknown features (0x0000010000000000)
< HCI Command: LE Set Host Feature (0x08|0x0074) plen 2     #15 [hci1] 0.920037
        Bit Number: 32
          Connected Isochronous Stream (Host Support)
        Bit Value: 1
> HCI Event: Command Complete (0x0e) plen 4                 #16 [hci1] 0.920528
      LE Set Host Feature (0x08|0x0074) ncmd 1
        Status: Success (0x00)
< HCI Command: LE Read Buffer v2 (0x08|0x0060) plen 0       #17 [hci1] 0.940035
> HCI Event: Command Complete (0x0e) plen 10                #18 [hci1] 0.940471
      LE Read Buffer v2 (0x08|0x0060) ncmd 1
        Status: Success (0x00)
        ACL MTU: 27
        ACL max packet: 3
        ISO MTU: 318
        ISO max packet: 3
< HCI Command: LE Read Maximum Adve.. (0x08|0x003a) plen 0  #19 [hci1] 0.959964
> HCI Event: Command Complete (0x0e) plen 6                 #20 [hci1] 0.960448
      LE Read Maximum Advertising Data Length (0x08|0x003a) ncmd 1
        Status: Success (0x00)
        Max length: 1650
< HCI Command: LE Read Supported St.. (0x08|0x001c) plen 0  #21 [hci1] 0.980025
> HCI Event: Command Complete (0x0e) plen 12                #22 [hci1] 0.980515
      LE Read Supported States (0x08|0x001c) ncmd 1
        Status: Success (0x00)
        States: 0x000003ff3e0306ff
          Non-connectable Advertising State
          Scannable Advertising State
          Connectable Advertising State
          High Duty Cycle Directed Advertising State
          Passive Scanning State
          Active Scanning State
          Initiating State
            and Connection State (Central Role)
          Connection State (Peripheral Role)
          Scannable Advertising State
            and Passive Scanning State
          Connectable Advertising State
            and Passive Scanning State
          Non-connectable Advertising State
            and Initiating State
          Scannable Advertising State
            and Initiating State
          Active Scanning State
            and Connection State (Central Role)
          Passive Scanning State
            and Connection State (Peripheral Role)
          Active Scanning State
            and Connection State (Peripheral Role)
          Initiating State
            and Connection State (Central Role)
            and Central Role & Central Role
          Low Duty Cycle Directed Advertising State
          Connectable Advertising State
            and Initiating State
            and Central Role & Peripheral Role
          High Duty Cycle Directed Advertising State
            and Initiating State
            and Central Role & Peripheral Role
          Low Duty Cycle Directed Advertising State
            and Initiating State
            and Central Role & Peripheral Role
          Connectable Advertising State
            and Connection State (Central Role)
            and Central Role & Peripheral Role
          High Duty Cycle Directed Advertising State
            and Connection State (Central Role)
            and Central Role & Peripheral Role
          Low Duty Cycle Directed Advertising State
            and Connection State (Central Role)
            and Central Role & Peripheral Role
          Connectable Advertising State
            and Connection State (Peripheral Role)
            and Central Role & Peripheral Role
          High Duty Cycle Directed Advertising State
            and Connection State (Peripheral Role)
            and Peripheral Role & Peripheral Role
          Low Duty Cycle Directed Advertising State
            and Connection State (Peripheral Role)
            and Peripheral Role & Peripheral Role
          Initiating State
            and Connection State (Peripheral Role)
            and Central Role & Peripheral Role
< HCI Command: LE Read Maximum Data.. (0x08|0x002f) plen 0  #23 [hci1] 1.000034
> HCI Event: Command Complete (0x0e) plen 12                #24 [hci1] 1.000559
      LE Read Maximum Data Length (0x08|0x002f) ncmd 1
        Status: Success (0x00)
        Max TX octets: 251
        Max TX time: 2704
        Max RX octets: 251
        Max RX time: 2704
< HCI Command: LE Write Suggested D.. (0x08|0x0024) plen 4  #25 [hci1] 1.020022
        TX octets: 251
        TX time: 2704
> HCI Event: Command Complete (0x0e) plen 4                 #26 [hci1] 1.020483
      LE Write Suggested Default Data Length (0x08|0x0024) ncmd 1
        Status: Success (0x00)
< HCI Command: LE Read Resolving Li.. (0x08|0x002a) plen 0  #27 [hci1] 1.040036
> HCI Event: Command Complete (0x0e) plen 5                 #28 [hci1] 1.040439
      LE Read Resolving List Size (0x08|0x002a) ncmd 1
        Status: Success (0x00)
        Size: 8
< HCI Command: LE Set Event Mask (0x08|0x0001) plen 8       #29 [hci1] 1.060039
        Mask: 0x000002023f87fa5e
          LE Advertising Report
          LE Connection Update Complete
          LE Read Remote Used Features Complete
          LE Long Term Key Request
          LE Data Length Change
          LE Enhanced Connection Complete
          LE PHY Update Complete
          LE Extended Advertising Report
          LE Periodic Advertising Sync Established
          LE Periodic Advertising Report
          LE Periodic Advertising Sync Lost
          LE Extended Scan Timeout
          LE Extended Advertising Set Terminated
          LE Scan Request Received
          LE Periodic Advertising Sync Transfer Rvc
          LE CIS Established
          LE CIS Request
          LE Create BIG Complete
          LE Terminate BIG Complete
          LE BIG Sync Estabilished Complete
          LE BIG Sync Lost
          LE BIG Info Advertising Report
          Unknown mask (0x0000020000000000)
> HCI Event: Command Complete (0x0e) plen 4                 #30 [hci1] 1.060492
      LE Set Event Mask (0x08|0x0001) ncmd 1
        Status: Success (0x00)
< HCI Command: Set Event Mask (0x03|0x0001) plen 8          #31 [hci1] 1.080029
        Mask: 0x2000800002008890
          Disconnection Complete
          Encryption Change
          Read Remote Version Information Complete
          Hardware Error
          Data Buffer Overflow
          Encryption Key Refresh Complete
          LE Meta
> HCI Event: Command Complete (0x0e) plen 4                 #32 [hci1] 1.080544
      Set Event Mask (0x03|0x0001) ncmd 1
        Status: Success (0x00)
< HCI Command: Read BD ADDR (0x04|0x0009) plen 0            #33 [hci1] 1.100042
> HCI Event: Command Complete (0x0e) plen 10                #34 [hci1] 1.100517
      Read BD ADDR (0x04|0x0009) ncmd 1
        Status: Success (0x00)
        Address: 00:00:00:00:00:00 (OUI 00-00-00)
< HCI Command: LE Set Random Address (0x08|0x0005) plen 6   #35 [hci1] 1.120039
        Address: D5:B6:CC:31:DB:3B (Static)
> HCI Event: Command Complete (0x0e) plen 4                 #36 [hci1] 1.120501
      LE Set Random Address (0x08|0x0005) ncmd 1
        Status: Success (0x00)
< HCI Command: LE Set Extended Adv.. (0x08|0x0036) plen 25  #37 [hci1] 3.710094
        Handle: 0x00
        Properties: 0x0013
          Connectable
          Scannable
          Use legacy advertising PDUs: ADV_IND
        Min advertising interval: 100.000 msec (0x00a0)
        Max advertising interval: 150.000 msec (0x00f0)
        Channel map: 37, 38, 39 (0x07)
        Own address type: Random (0x01)
        Peer address type: Public (0x00)
        Peer address: 00:00:00:00:00:00 (OUI 00-00-00)
        Filter policy: Allow Scan Request from Any, Allow Connect Request from Any (0x00)
        TX power: Host has no preference (0x7f)
        Primary PHY: LE 1M (0x01)
        Secondary max skip: 0x00
        Secondary PHY: LE 1M (0x01)
        SID: 0x00
        Scan request notifications: Disabled (0x00)
> HCI Event: Command Complete (0x0e) plen 5                 #38 [hci1] 3.710878
      LE Set Extended Advertising Parameters (0x08|0x0036) ncmd 1
        Status: Success (0x00)
        TX power (selected): 0 dbm (0x00)
< HCI Command: LE Set Advertising S.. (0x08|0x0035) plen 7  #39 [hci1] 3.720070
        Advertising handle: 0x00
        Advertising random address: D5:B6:CC:31:DB:3B (Static)
> HCI Event: Command Complete (0x0e) plen 4                 #40 [hci1] 3.720591
      LE Set Advertising Set Random Address (0x08|0x0035) ncmd 1
        Status: Success (0x00)
< HCI Command: LE Set Extended Adv.. (0x08|0x0037) plen 22  #41 [hci1] 3.740062
        Handle: 0x00
        Operation: Complete extended advertising data (0x03)
        Fragment preference: Minimize fragmentation (0x01)
        Data length: 0x12
        Flags: 0x06
          LE General Discoverable Mode
          BR/EDR Not Supported
        Name (complete): Tester_F6B11A
> HCI Event: Command Complete (0x0e) plen 4                 #42 [hci1] 3.740825
      LE Set Extended Advertising Data (0x08|0x0037) ncmd 1
        Status: Success (0x00)
< HCI Command: LE Set Extended Scan.. (0x08|0x0038) plen 4  #43 [hci1] 3.760029
        Handle: 0x00
        Operation: Complete scan response data (0x03)
        Fragment preference: Minimize fragmentation (0x01)
        Data length: 0x00
> HCI Event: Command Complete (0x0e) plen 4                 #44 [hci1] 3.760480
      LE Set Extended Scan Response Data (0x08|0x0038) ncmd 1
        Status: Success (0x00)
< HCI Command: LE Set Extended Adve.. (0x08|0x0039) plen 6  #45 [hci1] 3.780088
        Extended advertising: Enabled (0x01)
        Number of sets: 1 (0x01)
        Entry 0
          Handle: 0x00
          Duration: 0 ms (0x00)
          Max ext adv events: 0
> HCI Event: Command Complete (0x0e) plen 4                 #46 [hci1] 3.780684
      LE Set Extended Advertising Enable (0x08|0x0039) ncmd 1
        Status: Success (0x00)
> HCI Event: LE Meta Event (0x3e) plen 31                   #47 [hci1] 3.884757
      LE Enhanced Connection Complete (0x0a)
        Status: Success (0x00)
        Handle: 2091
        Role: Peripheral (0x01)
        Peer address type: Public (0x00)
        Peer address: DF:A9:FF:F6:B1:1A (OUI DF-A9-FF)
        Local resolvable private address: 00:00:00:00:00:00 (Non-Resolvable)
        Peer resolvable private address: 00:00:00:00:00:00 (Non-Resolvable)
        Connection interval: 87.50 msec (0x0046)
        Connection latency: 0 (0x0000)
        Supervision timeout: 25120 msec (0x09d0)
        Central clock accuracy: 0x01
> HCI Event: LE Meta Event (0x3e) plen 6                    #48 [hci1] 3.884931
      LE Advertising Set Terminated (0x12)
        Status: Success (0x00)
        Handle: 0
        Connection handle: 2091
        Number of completed extended advertising events: 0
< HCI Command: LE Read Remote Used... (0x08|0x0016) plen 2  #49 [hci1] 3.901059
        Handle: 2091 Address: DF:A9:FF:F6:B1:1A (OUI DF-A9-FF)
< ACL Data TX: Handle 2091 flags 0x00 dlen 7                #50 [hci1] 3.901083
      ATT: Exchange MTU Request (0x02) len 2
        Client RX MTU: 251
> HCI Event: Command Status (0x0f) plen 4                   #51 [hci1] 3.901543
      LE Read Remote Used Features (0x08|0x0016) ncmd 1
        Status: Success (0x00)
> HCI Event: Number of Completed Packets (0x13) plen 5      #52 [hci1] 4.060768
        Num handles: 1
        Handle: 2091 Address: DF:A9:FF:F6:B1:1A (OUI DF-A9-FF)
        Count: 1
        #50: len 7 (0 Kb/s)
        Latency: 159 msec (159-159 msec ~159 msec)
> HCI Event: LE Meta Event (0x3e) plen 12                   #53 [hci1] 4.148673
      LE Read Remote Used Features (0x04)
        Status: Success (0x00)
        Handle: 2091 Address: DF:A9:FF:F6:B1:1A (OUI DF-A9-FF)
        Features: 0x2d 0x49 0x00 0xf7 0x67 0xd9 0x00 0x80
          LE Encryption
          Extended Reject Indication
          Peripheral-initiated Features Exchange
          LE Data Packet Length Extension
          LE 2M PHY
          LE Coded PHY
          Channel Selection Algorithm #2
          Periodic Advertising Sync Transfer - Sender
          Periodic Advertising Sync Transfer - Recipient
          Sleep Clock Accuracy Updates
          Connected Isochronous Stream - Central
          Connected Isochronous Stream - Peripheral
          Isochronous Broadcaster
          Synchronized Receiver
          Connected Isochronous Stream (Host Support)
          LE Power Control Request
          LE Power Control Request
          Connection Subrating
          Connection Subrating (Host Support)
          Unknown features (0x8000d90000000000)
> ACL Data RX: Handle 2091 flags 0x02 dlen 11               #54 [hci1] 6.598409
      SMP: Pairing Request (0x01) len 6
        IO capability: KeyboardDisplay (0x04)
        OOB data: Authentication data not present (0x00)
        Authentication requirement: Bonding, No MITM, SC, No Keypresses (0x09)
        Max encryption key size: 16
        Initiator key distribution: EncKey IdKey (0x03)
        Responder key distribution: EncKey IdKey Sign (0x07)
> ACL Data RX: Handle 2091 flags 0x02 dlen 7                #55 [hci1] 6.598952
      ATT: Exchange MTU Response (0x03) len 2
        Server RX MTU: 23
< HCI Command: Host Number of Compl.. (0x03|0x0035) plen 5  #56 [hci1] 6.600526
        Num handles: 1
        Handle: 2091 Address: DF:A9:FF:F6:B1:1A (OUI DF-A9-FF)
        Count: 1
< ACL Data TX: Handle 2091 flags 0x00 dlen 11               #57 [hci1] 6.600648
      SMP: Pairing Response (0x02) len 6
        IO capability: NoInputNoOutput (0x03)
        OOB data: Authentication data not present (0x00)
        Authentication requirement: Bonding, No MITM, SC, No Keypresses (0x09)
        Max encryption key size: 16
        Initiator key distribution: IdKey (0x02)
        Responder key distribution: <none> (0x00)
< HCI Command: Host Number of Compl.. (0x03|0x0035) plen 5  #58 [hci1] 6.601023
        Num handles: 1
        Handle: 2091 Address: DF:A9:FF:F6:B1:1A (OUI DF-A9-FF)
        Count: 1
> HCI Event: Number of Completed Packets (0x13) plen 5      #59 [hci1] 6.773523
        Num handles: 1
        Handle: 2091 Address: DF:A9:FF:F6:B1:1A (OUI DF-A9-FF)
        Count: 1
        #57: len 11 (0 Kb/s)
        Latency: 172 msec (159-172 msec ~166 msec)
> ACL Data RX: Handle 2091 flags 0x02 dlen 27               #60 [hci1] 6.773879
> ACL Data RX: Handle 2091 flags 0x01 dlen 27               #61 [hci1] 6.774358
> ACL Data RX: Handle 2091 flags 0x01 dlen 15               #62 [hci1] 6.774836
      SMP: Pairing Public Key (0x0c) len 64
        X: 34807d7ac52d210e8da1b0b026ed37fba000be32620b52ee7a5f1597901746a2
        Y: 6aa9f7b8b9671e0458ef81e3a645732b80061ee74a21f2c3ad1d4ce5867796c3
< HCI Command: Host Number of Compl.. (0x03|0x0035) plen 5  #63 [hci1] 6.781000
        Num handles: 1
        Handle: 2091 Address: DF:A9:FF:F6:B1:1A (OUI DF-A9-FF)
        Count: 1
< HCI Command: Host Number of Compl.. (0x03|0x0035) plen 5  #64 [hci1] 6.781226
        Num handles: 1
        Handle: 2091 Address: DF:A9:FF:F6:B1:1A (OUI DF-A9-FF)
        Count: 1
< HCI Command: Host Number of Compl.. (0x03|0x0035) plen 5  #65 [hci1] 6.781563
        Num handles: 1
        Handle: 2091 Address: DF:A9:FF:F6:B1:1A (OUI DF-A9-FF)
        Count: 1
< ACL Data TX: Handle 2091 flags 0x00 dlen 27               #66 [hci1] 6.781652
< ACL Data TX: Handle 2091 flags 0x01 dlen 27               #67 [hci1] 6.781662
< ACL Data TX: Handle 2091 flags 0x01 dlen 15               #68 [hci1] 6.781686
      SMP: Pairing Public Key (0x0c) len 64
        X: 98308440221e2d910f0e54b71e7ec652857aa9b5a0dc65028824cc19db1226e9
        Y: 67a4816bcb62efb21701e31fdb27561a6217575fb007a8bbdabe7e28b6f68482
> HCI Event: Number of Completed Packets (0x13) plen 5      #69 [hci1] 6.861326
        Num handles: 1
        Handle: 2091 Address: DF:A9:FF:F6:B1:1A (OUI DF-A9-FF)
        Count: 1
        #66: len 27 (2 Kb/s)
        Latency: 79 msec (79-172 msec ~122 msec)
> HCI Event: Number of Completed Packets (0x13) plen 5      #70 [hci1] 6.862023
        Num handles: 1
        Handle: 2091 Address: DF:A9:FF:F6:B1:1A (OUI DF-A9-FF)
        Count: 1
        #67: len 27 (2 Kb/s)
        Latency: 80 msec (79-172 msec ~101 msec)
< ACL Data TX: Handle 2091 flags 0x00 dlen 21               #71 [hci1] 6.880440
      SMP: Pairing Confirm (0x03) len 16
        Confim value: 32fb565dbbf9a98ea5fec8fbdf03461d
> HCI Event: Number of Completed Packets (0x13) plen 5      #72 [hci1] 6.948195
        Num handles: 1
        Handle: 2091 Address: DF:A9:FF:F6:B1:1A (OUI DF-A9-FF)
        Count: 1
        #68: len 15 (0 Kb/s)
        Latency: 166 msec (79-172 msec ~134 msec)
> HCI Event: Number of Completed Packets (0x13) plen 5      #73 [hci1] 7.035861
        Num handles: 1
        Handle: 2091 Address: DF:A9:FF:F6:B1:1A (OUI DF-A9-FF)
        Count: 1
        #71: len 21 (1 Kb/s)
        Latency: 155 msec (79-172 msec ~144 msec)
> ACL Data RX: Handle 2091 flags 0x02 dlen 21               #74 [hci1] 7.036263
      SMP: Pairing Random (0x04) len 16
        Random value: 2de58f9b18b92ea20000000000000000
< HCI Command: Host Number of Compl.. (0x03|0x0035) plen 5  #75 [hci1] 7.040783
        Num handles: 1
        Handle: 2091 Address: DF:A9:FF:F6:B1:1A (OUI DF-A9-FF)
        Count: 1
< ACL Data TX: Handle 2091 flags 0x00 dlen 21               #76 [hci1] 7.040896
      SMP: Pairing Random (0x04) len 16
        Random value: 8e6108f966a694cbe26df70bb96773e6
> HCI Event: Number of Completed Packets (0x13) plen 5      #77 [hci1] 7.210684
        Num handles: 1
        Handle: 2091 Address: DF:A9:FF:F6:B1:1A (OUI DF-A9-FF)
        Count: 1
        #76: len 21 (0 Kb/s)
        Latency: 169 msec (79-172 msec ~157 msec)
> ACL Data RX: Handle 2091 flags 0x02 dlen 21               #78 [hci1] 7.386065
      SMP: Pairing DHKey Check (0x0d) len 16
        E: 688000e9ca7f0861d517e8002c51c6a7
< HCI Command: Host Number of Compl.. (0x03|0x0035) plen 5  #79 [hci1] 7.400872
        Num handles: 1
        Handle: 2091 Address: DF:A9:FF:F6:B1:1A (OUI DF-A9-FF)
        Count: 1
< ACL Data TX: Handle 2091 flags 0x00 dlen 21               #80 [hci1] 7.401087
      SMP: Pairing DHKey Check (0x0d) len 16
        E: 824aa03910eed1c760b0e348d28630ed
> HCI Event: Number of Completed Packets (0x13) plen 5      #81 [hci1] 7.560787
        Num handles: 1
        Handle: 2091 Address: DF:A9:FF:F6:B1:1A (OUI DF-A9-FF)
        Count: 1
        #80: len 21 (1 Kb/s)
        Latency: 159 msec (79-172 msec ~158 msec)
> HCI Event: LE Meta Event (0x3e) plen 13                   #82 [hci1] 7.648891
      LE Long Term Key Request (0x05)
        Handle: 2091 Address: DF:A9:FF:F6:B1:1A (OUI DF-A9-FF)
        Random number: 0x0000000000000000
        Encrypted diversifier: 0x0000
< HCI Command: LE Long Term Key Re.. (0x08|0x001a) plen 18  #83 [hci1] 7.660412
        Handle: 2091 Address: DF:A9:FF:F6:B1:1A (OUI DF-A9-FF)
        Long term key: d22c3a4b47ff670cd907bc4849805a6a
> HCI Event: Command Complete (0x0e) plen 6                 #84 [hci1] 7.661121
      LE Long Term Key Request Reply (0x08|0x001a) ncmd 1
        Status: Success (0x00)
        Handle: 2091 Address: DF:A9:FF:F6:B1:1A (OUI DF-A9-FF)
> HCI Event: Encryption Change (0x08) plen 4                #85 [hci1] 8.086022
        Status: Success (0x00)
        Handle: 2091 Address: DF:A9:FF:F6:B1:1A (OUI DF-A9-FF)
        Encryption: Enabled with AES-CCM (0x01)
> ACL Data RX: Handle 2091 flags 0x02 dlen 21               #86 [hci1] 8.173612
      SMP: Identity Information (0x08) len 16
        Identity resolving key: 228e426c90ef5e9bb897478066b1c8cb
< HCI Command: Host Number of Compl.. (0x03|0x0035) plen 5  #87 [hci1] 8.210963
        Num handles: 1
        Handle: 2091 Address: DF:A9:FF:F6:B1:1A (OUI DF-A9-FF)
        Count: 1
> ACL Data RX: Handle 2091 flags 0x02 dlen 12               #88 [hci1] 8.348400
      SMP: Identity Address Information (0x09) len 7
        Address: DF:A9:FF:F6:B1:1A (OUI DF-A9-FF)
< HCI Command: LE Add Device To Re.. (0x08|0x0027) plen 39  #89 [hci1] 8.360644
        Address type: Public (0x00)
        Address: DF:A9:FF:F6:B1:1A (OUI DF-A9-FF)
        Peer identity resolving key: 228e426c90ef5e9bb897478066b1c8cb
        Local identity resolving key: 00000000000000000000000000000000
> HCI Event: Command Complete (0x0e) plen 4                 #90 [hci1] 8.361642
      LE Add Device To Resolving List (0x08|0x0027) ncmd 1
        Status: Success (0x00)
< HCI Command: LE Set Privacy Mode (0x08|0x004e) plen 8     #91 [hci1] 8.380508
        Peer Identity address type: Public (0x00)
        Peer Identity address: DF:A9:FF:F6:B1:1A (OUI DF-A9-FF)
        Privacy Mode: Use Device Privacy (0x01)
> HCI Event: Command Complete (0x0e) plen 4                 #92 [hci1] 8.380997
      LE Set Privacy Mode (0x08|0x004e) ncmd 1
        Status: Success (0x00)
< HCI Command: LE Set Address Resol.. (0x08|0x002d) plen 1  #93 [hci1] 8.400463
        Address resolution: Enabled (0x01)
> HCI Event: Command Complete (0x0e) plen 4                 #94 [hci1] 8.400894
      LE Set Address Resolution Enable (0x08|0x002d) ncmd 1
        Status: Success (0x00)
< HCI Command: Host Number of Compl.. (0x03|0x0035) plen 5  #95 [hci1] 8.420405
        Num handles: 1
        Handle: 2091 Address: DF:A9:FF:F6:B1:1A (OUI DF-A9-FF)
        Count: 1
> ACL Data RX: Handle 2091 flags 0x02 dlen 13               #96 [hci1] 8.435895
      ATT: Find By Type Value Request (0x06) len 8
        Handle range: 0x0001-0xffff
        Attribute type: Primary Service (0x2800)
          UUID: Volume Offset Control (0x1845)
< HCI Command: Host Number of Compl.. (0x03|0x0035) plen 5  #97 [hci1] 8.440766
        Num handles: 1
        Handle: 2091 Address: DF:A9:FF:F6:B1:1A (OUI DF-A9-FF)
        Count: 1
< ACL Data TX: Handle 2091 flags 0x00 dlen 9                #98 [hci1] 8.441017
      ATT: Error Response (0x01) len 4
        Find By Type Value Request (0x06)
        Handle: 0x0001
        Error: Attribute Not Found (0x0a)
> HCI Event: Number of Completed Packets (0x13) plen 5      #99 [hci1] 8.610826
        Num handles: 1
        Handle: 2091 Address: DF:A9:FF:F6:B1:1A (OUI DF-A9-FF)
        Count: 1
        #98: len 9 (0 Kb/s)
        Latency: 169 msec (79-172 msec ~164 msec)
> ACL Data RX: Handle 2091 flags 0x02 dlen 11              #100 [hci1] 8.611115
      ATT: Read By Type Request (0x08) len 6
        Handle range: 0x0001-0xffff
        Attribute type: Include (0x2802)
< HCI Command: Host Number of Comp.. (0x03|0x0035) plen 5  #101 [hci1] 8.620418
        Num handles: 1
        Handle: 2091 Address: DF:A9:FF:F6:B1:1A (OUI DF-A9-FF)
        Count: 1
< ACL Data TX: Handle 2091 flags 0x00 dlen 22              #102 [hci1] 8.620466
      ATT: Read By Type Response (0x09) len 17
        Attribute data length: 8
        Attribute data list: 2 entries
        Handle: 0x005d
        Value: 24002f004518
        Handle: 0x005e
        Value: 30003b004518
> HCI Event: Number of Completed Packets (0x13) plen 5     #103 [hci1] 8.785887
        Num handles: 1
        Handle: 2091 Address: DF:A9:FF:F6:B1:1A (OUI DF-A9-FF)
        Count: 1
        #102: len 22 (1 Kb/s)
        Latency: 165 msec (79-172 msec ~164 msec)
> ACL Data RX: Handle 2091 flags 0x02 dlen 11              #104 [hci1] 8.786091
      ATT: Read By Type Request (0x08) len 6
        Handle range: 0x005f-0xffff
        Attribute type: Include (0x2802)
< HCI Command: Host Number of Comp.. (0x03|0x0035) plen 5  #105 [hci1] 8.800316
        Num handles: 1
        Handle: 2091 Address: DF:A9:FF:F6:B1:1A (OUI DF-A9-FF)
        Count: 1
< ACL Data TX: Handle 2091 flags 0x00 dlen 22              #106 [hci1] 8.800352
      ATT: Read By Type Response (0x09) len 17
        Attribute data length: 8
        Attribute data list: 2 entries
        Handle: 0x005f
        Value: 3c004b004318
        Handle: 0x0060
        Value: 4c005b004318
> HCI Event: Number of Completed Packets (0x13) plen 5     #107 [hci1] 8.960872
        Num handles: 1
        Handle: 2091 Address: DF:A9:FF:F6:B1:1A (OUI DF-A9-FF)
        Count: 1
        #106: len 22 (1 Kb/s)
        Latency: 160 msec (79-172 msec ~162 msec)
> ACL Data RX: Handle 2091 flags 0x02 dlen 11              #108 [hci1] 8.961134
      ATT: Read By Type Request (0x08) len 6
        Handle range: 0x0061-0xffff
        Attribute type: Include (0x2802)
< HCI Command: Host Number of Comp.. (0x03|0x0035) plen 5  #109 [hci1] 8.980791
        Num handles: 1
        Handle: 2091 Address: DF:A9:FF:F6:B1:1A (OUI DF-A9-FF)
        Count: 1
< ACL Data TX: Handle 2091 flags 0x00 dlen 9               #110 [hci1] 8.980993
      ATT: Error Response (0x01) len 4
        Read By Type Request (0x08)
        Handle: 0x0061
        Error: Attribute Not Found (0x0a)
> HCI Event: Number of Completed Packets (0x13) plen 5     #111 [hci1] 9.135839
        Num handles: 1
        Handle: 2091 Address: DF:A9:FF:F6:B1:1A (OUI DF-A9-FF)
        Count: 1
        #110: len 9 (0 Kb/s)
        Latency: 154 msec (79-172 msec ~158 msec)
> ACL Data RX: Handle 2091 flags 0x02 dlen 11              #112 [hci1] 9.136089
      ATT: Read By Type Request (0x08) len 6
        Handle range: 0x0024-0x002f
        Attribute type: Characteristic (0x2803)
< HCI Command: Host Number of Comp.. (0x03|0x0035) plen 5  #113 [hci1] 9.140321
        Num handles: 1
        Handle: 2091 Address: DF:A9:FF:F6:B1:1A (OUI DF-A9-FF)
        Count: 1
< ACL Data TX: Handle 2091 flags 0x00 dlen 20              #114 [hci1] 9.140344
      ATT: Read By Type Response (0x09) len 15
        Attribute data length: 7
        Attribute data list: 2 entries
        Handle: 0x0025
        Value: 122600802b
            Properties: 0x12
              Read (0x02)
              Notify (0x10)
            Value Handle: 0x0026
            Value UUID: Offset State (0x2b80)
        Handle: 0x0028
        Value: 162900812b
            Properties: 0x16
              Read (0x02)
              Write Without Response (0x04)
              Notify (0x10)
            Value Handle: 0x0029
            Value UUID: Audio Location (0x2b81)
> HCI Event: Number of Completed Packets (0x13) plen 5     #115 [hci1] 9.310817
        Num handles: 1
        Handle: 2091 Address: DF:A9:FF:F6:B1:1A (OUI DF-A9-FF)
        Count: 1
        #114: len 20 (0 Kb/s)
        Latency: 170 msec (79-172 msec ~164 msec)
> ACL Data RX: Handle 2091 flags 0x02 dlen 11              #116 [hci1] 9.311110
      ATT: Read By Type Request (0x08) len 6
        Handle range: 0x0029-0x002f
        Attribute type: Characteristic (0x2803)
< HCI Command: Host Number of Comp.. (0x03|0x0035) plen 5  #117 [hci1] 9.320761
        Num handles: 1
        Handle: 2091 Address: DF:A9:FF:F6:B1:1A (OUI DF-A9-FF)
        Count: 1
< ACL Data TX: Handle 2091 flags 0x00 dlen 20              #118 [hci1] 9.320860
      ATT: Read By Type Response (0x09) len 15
        Attribute data length: 7
        Attribute data list: 2 entries
        Handle: 0x002b
        Value: 082c00822b
            Properties: 0x08
              Write (0x08)
            Value Handle: 0x002c
            Value UUID: Volume Offset Control Point (0x2b82)
        Handle: 0x002d
        Value: 162e00832b
            Properties: 0x16
              Read (0x02)
              Write Without Response (0x04)
              Notify (0x10)
            Value Handle: 0x002e
            Value UUID: Audio Output Description (0x2b83)
> HCI Event: Number of Completed Packets (0x13) plen 5     #119 [hci1] 9.485867
        Num handles: 1
        Handle: 2091 Address: DF:A9:FF:F6:B1:1A (OUI DF-A9-FF)
        Count: 1
        #118: len 20 (0 Kb/s)
        Latency: 165 msec (79-172 msec ~164 msec)
> ACL Data RX: Handle 2091 flags 0x02 dlen 11              #120 [hci1] 9.486061
      ATT: Read By Type Request (0x08) len 6
        Handle range: 0x002e-0x002f
        Attribute type: Characteristic (0x2803)
< HCI Command: Host Number of Comp.. (0x03|0x0035) plen 5  #121 [hci1] 9.500789
        Num handles: 1
        Handle: 2091 Address: DF:A9:FF:F6:B1:1A (OUI DF-A9-FF)
        Count: 1
< ACL Data TX: Handle 2091 flags 0x00 dlen 9               #122 [hci1] 9.500988
      ATT: Error Response (0x01) len 4
        Read By Type Request (0x08)
        Handle: 0x002e
        Error: Attribute Not Found (0x0a)
> HCI Event: Number of Completed Packets (0x13) plen 5     #123 [hci1] 9.660772
        Num handles: 1
        Handle: 2091 Address: DF:A9:FF:F6:B1:1A (OUI DF-A9-FF)
        Count: 1
        #122: len 9 (0 Kb/s)
        Latency: 159 msec (79-172 msec ~162 msec)
> ACL Data RX: Handle 2091 flags 0x02 dlen 9               #124 [hci1] 9.661023
      ATT: Find Information Request (0x04) len 4
        Handle range: 0x0027-0x0027
< HCI Command: Host Number of Comp.. (0x03|0x0035) plen 5  #125 [hci1] 9.680829
        Num handles: 1
        Handle: 2091 Address: DF:A9:FF:F6:B1:1A (OUI DF-A9-FF)
        Count: 1
< ACL Data TX: Handle 2091 flags 0x00 dlen 10              #126 [hci1] 9.680930
      ATT: Find Information Response (0x05) len 5
        Format: UUID-16 (0x01)
        Handle: 0x0027
        UUID: Client Characteristic Configuration (0x2902)
> HCI Event: Number of Completed Packets (0x13) plen 5     #127 [hci1] 9.835776
        Num handles: 1
        Handle: 2091 Address: DF:A9:FF:F6:B1:1A (OUI DF-A9-FF)
        Count: 1
        #126: len 10 (0 Kb/s)
        Latency: 154 msec (79-172 msec ~158 msec)
> ACL Data RX: Handle 2091 flags 0x02 dlen 9               #128 [hci1] 9.836094
      ATT: Find Information Request (0x04) len 4
        Handle range: 0x002a-0x002a
< HCI Command: Host Number of Comp.. (0x03|0x0035) plen 5  #129 [hci1] 9.840793
        Num handles: 1
        Handle: 2091 Address: DF:A9:FF:F6:B1:1A (OUI DF-A9-FF)
        Count: 1
< ACL Data TX: Handle 2091 flags 0x00 dlen 10              #130 [hci1] 9.840918
      ATT: Find Information Response (0x05) len 5
        Format: UUID-16 (0x01)
        Handle: 0x002a
        UUID: Client Characteristic Configuration (0x2902)
> HCI Event: Number of Completed Packets (0x13) plen 5    #131 [hci1] 10.010892
        Num handles: 1
        Handle: 2091 Address: DF:A9:FF:F6:B1:1A (OUI DF-A9-FF)
        Count: 1
        #130: len 10 (0 Kb/s)
        Latency: 169 msec (79-172 msec ~164 msec)
> ACL Data RX: Handle 2091 flags 0x02 dlen 9              #132 [hci1] 10.011089
      ATT: Find Information Request (0x04) len 4
        Handle range: 0x002f-0x002f
< HCI Command: Host Number of Com.. (0x03|0x0035) plen 5  #133 [hci1] 10.020810
        Num handles: 1
        Handle: 2091 Address: DF:A9:FF:F6:B1:1A (OUI DF-A9-FF)
        Count: 1
< ACL Data TX: Handle 2091 flags 0x00 dlen 10             #134 [hci1] 10.020964
      ATT: Find Information Response (0x05) len 5
        Format: UUID-16 (0x01)
        Handle: 0x002f
        UUID: Client Characteristic Configuration (0x2902)
> HCI Event: Number of Completed Packets (0x13) plen 5    #135 [hci1] 10.185832
        Num handles: 1
        Handle: 2091 Address: DF:A9:FF:F6:B1:1A (OUI DF-A9-FF)
        Count: 1
        #134: len 10 (0 Kb/s)
        Latency: 164 msec (79-172 msec ~164 msec)
> ACL Data RX: Handle 2091 flags 0x02 dlen 11             #136 [hci1] 10.186068
      ATT: Read By Type Request (0x08) len 6
        Handle range: 0x0030-0x003b
        Attribute type: Characteristic (0x2803)
< HCI Command: Host Number of Com.. (0x03|0x0035) plen 5  #137 [hci1] 10.200665
        Num handles: 1
        Handle: 2091 Address: DF:A9:FF:F6:B1:1A (OUI DF-A9-FF)
        Count: 1
< ACL Data TX: Handle 2091 flags 0x00 dlen 20             #138 [hci1] 10.200810
      ATT: Read By Type Response (0x09) len 15
        Attribute data length: 7
        Attribute data list: 2 entries
        Handle: 0x0031
        Value: 123200802b
            Properties: 0x12
              Read (0x02)
              Notify (0x10)
            Value Handle: 0x0032
            Value UUID: Offset State (0x2b80)
        Handle: 0x0034
        Value: 163500812b
            Properties: 0x16
              Read (0x02)
              Write Without Response (0x04)
              Notify (0x10)
            Value Handle: 0x0035
            Value UUID: Audio Location (0x2b81)
> HCI Event: Number of Completed Packets (0x13) plen 5    #139 [hci1] 10.360868
        Num handles: 1
        Handle: 2091 Address: DF:A9:FF:F6:B1:1A (OUI DF-A9-FF)
        Count: 1
        #138: len 20 (1 Kb/s)
        Latency: 160 msec (79-172 msec ~162 msec)
> ACL Data RX: Handle 2091 flags 0x02 dlen 11             #140 [hci1] 10.361072
      ATT: Read By Type Request (0x08) len 6
        Handle range: 0x0035-0x003b
        Attribute type: Characteristic (0x2803)
< HCI Command: Host Number of Com.. (0x03|0x0035) plen 5  #141 [hci1] 10.380798
        Num handles: 1
        Handle: 2091 Address: DF:A9:FF:F6:B1:1A (OUI DF-A9-FF)
        Count: 1
< ACL Data TX: Handle 2091 flags 0x00 dlen 20             #142 [hci1] 10.380851
      ATT: Read By Type Response (0x09) len 15
        Attribute data length: 7
        Attribute data list: 2 entries
        Handle: 0x0037
        Value: 083800822b
            Properties: 0x08
              Write (0x08)
            Value Handle: 0x0038
            Value UUID: Volume Offset Control Point (0x2b82)
        Handle: 0x0039
        Value: 163a00832b
            Properties: 0x16
              Read (0x02)
              Write Without Response (0x04)
              Notify (0x10)
            Value Handle: 0x003a
            Value UUID: Audio Output Description (0x2b83)
> HCI Event: Number of Completed Packets (0x13) plen 5    #143 [hci1] 10.535856
        Num handles: 1
        Handle: 2091 Address: DF:A9:FF:F6:B1:1A (OUI DF-A9-FF)
        Count: 1
        #142: len 20 (1 Kb/s)
        Latency: 155 msec (79-172 msec ~158 msec)
> ACL Data RX: Handle 2091 flags 0x02 dlen 11             #144 [hci1] 10.536071
      ATT: Read By Type Request (0x08) len 6
        Handle range: 0x003a-0x003b
        Attribute type: Characteristic (0x2803)
< HCI Command: Host Number of Com.. (0x03|0x0035) plen 5  #145 [hci1] 10.540751
        Num handles: 1
        Handle: 2091 Address: DF:A9:FF:F6:B1:1A (OUI DF-A9-FF)
        Count: 1
< ACL Data TX: Handle 2091 flags 0x00 dlen 9              #146 [hci1] 10.540953
      ATT: Error Response (0x01) len 4
        Read By Type Request (0x08)
        Handle: 0x003a
        Error: Attribute Not Found (0x0a)
> HCI Event: Number of Completed Packets (0x13) plen 5    #147 [hci1] 10.710795
        Num handles: 1
        Handle: 2091 Address: DF:A9:FF:F6:B1:1A (OUI DF-A9-FF)
        Count: 1
        #146: len 9 (0 Kb/s)
        Latency: 169 msec (79-172 msec ~164 msec)
> ACL Data RX: Handle 2091 flags 0x02 dlen 9              #148 [hci1] 10.710985
      ATT: Find Information Request (0x04) len 4
        Handle range: 0x0033-0x0033
< HCI Command: Host Number of Com.. (0x03|0x0035) plen 5  #149 [hci1] 10.720822
        Num handles: 1
        Handle: 2091 Address: DF:A9:FF:F6:B1:1A (OUI DF-A9-FF)
        Count: 1
< ACL Data TX: Handle 2091 flags 0x00 dlen 10             #150 [hci1] 10.720895
      ATT: Find Information Response (0x05) len 5
        Format: UUID-16 (0x01)
        Handle: 0x0033
        UUID: Client Characteristic Configuration (0x2902)
> HCI Event: Number of Completed Packets (0x13) plen 5    #151 [hci1] 10.885836
        Num handles: 1
        Handle: 2091 Address: DF:A9:FF:F6:B1:1A (OUI DF-A9-FF)
        Count: 1
        #150: len 10 (0 Kb/s)
        Latency: 164 msec (79-172 msec ~164 msec)
> ACL Data RX: Handle 2091 flags 0x02 dlen 9              #152 [hci1] 10.885994
      ATT: Find Information Request (0x04) len 4
        Handle range: 0x0036-0x0036
< HCI Command: Host Number of Com.. (0x03|0x0035) plen 5  #153 [hci1] 10.900760
        Num handles: 1
        Handle: 2091 Address: DF:A9:FF:F6:B1:1A (OUI DF-A9-FF)
        Count: 1
< ACL Data TX: Handle 2091 flags 0x00 dlen 10             #154 [hci1] 10.900846
      ATT: Find Information Response (0x05) len 5
        Format: UUID-16 (0x01)
        Handle: 0x0036
        UUID: Client Characteristic Configuration (0x2902)
> HCI Event: Number of Completed Packets (0x13) plen 5    #155 [hci1] 11.060788
        Num handles: 1
        Handle: 2091 Address: DF:A9:FF:F6:B1:1A (OUI DF-A9-FF)
        Count: 1
        #154: len 10 (0 Kb/s)
        Latency: 159 msec (79-172 msec ~162 msec)
> ACL Data RX: Handle 2091 flags 0x02 dlen 9              #156 [hci1] 11.060991
      ATT: Find Information Request (0x04) len 4
        Handle range: 0x003b-0x003b
< HCI Command: Host Number of Com.. (0x03|0x0035) plen 5  #157 [hci1] 11.080837
        Num handles: 1
        Handle: 2091 Address: DF:A9:FF:F6:B1:1A (OUI DF-A9-FF)
        Count: 1
< ACL Data TX: Handle 2091 flags 0x00 dlen 10             #158 [hci1] 11.080983
      ATT: Find Information Response (0x05) len 5
        Format: UUID-16 (0x01)
        Handle: 0x003b
        UUID: Client Characteristic Configuration (0x2902)
> HCI Event: Number of Completed Packets (0x13) plen 5    #159 [hci1] 11.235794
        Num handles: 1
        Handle: 2091 Address: DF:A9:FF:F6:B1:1A (OUI DF-A9-FF)
        Count: 1
        #158: len 10 (0 Kb/s)
        Latency: 154 msec (79-172 msec ~158 msec)
> ACL Data RX: Handle 2091 flags 0x02 dlen 9              #160 [hci1] 11.236032
      ATT: Write Request (0x12) len 4
        Handle: 0x0027
          Data: 0000
< HCI Command: Host Number of Com.. (0x03|0x0035) plen 5  #161 [hci1] 11.240699
        Num handles: 1
        Handle: 2091 Address: DF:A9:FF:F6:B1:1A (OUI DF-A9-FF)
        Count: 1
< ACL Data TX: Handle 2091 flags 0x00 dlen 5              #162 [hci1] 11.240759
      ATT: Write Response (0x13) len 0
> HCI Event: Number of Completed Packets (0x13) plen 5    #163 [hci1] 11.410777
        Num handles: 1
        Handle: 2091 Address: DF:A9:FF:F6:B1:1A (OUI DF-A9-FF)
        Count: 1
        #162: len 5 (0 Kb/s)
        Latency: 170 msec (79-172 msec ~164 msec)
> ACL Data RX: Handle 2091 flags 0x02 dlen 9              #164 [hci1] 11.411006
      ATT: Write Request (0x12) len 4
        Handle: 0x0027
          Data: 0100
< HCI Command: Host Number of Com.. (0x03|0x0035) plen 5  #165 [hci1] 11.420841
        Num handles: 1
        Handle: 2091 Address: DF:A9:FF:F6:B1:1A (OUI DF-A9-FF)
        Count: 1
< ACL Data TX: Handle 2091 flags 0x00 dlen 5              #166 [hci1] 11.420955
      ATT: Write Response (0x13) len 0
> HCI Event: Number of Completed Packets (0x13) plen 5    #167 [hci1] 11.585698
        Num handles: 1
        Handle: 2091 Address: DF:A9:FF:F6:B1:1A (OUI DF-A9-FF)
        Count: 1
        #166: len 5 (0 Kb/s)
        Latency: 164 msec (79-172 msec ~164 msec)
> ACL Data RX: Handle 2091 flags 0x02 dlen 9              #168 [hci1] 11.585974
      ATT: Write Request (0x12) len 4
        Handle: 0x0033
          Data: 0000
< HCI Command: Host Number of Com.. (0x03|0x0035) plen 5  #169 [hci1] 11.600279
        Num handles: 1
        Handle: 2091 Address: DF:A9:FF:F6:B1:1A (OUI DF-A9-FF)
        Count: 1
< ACL Data TX: Handle 2091 flags 0x00 dlen 5              #170 [hci1] 11.600304
      ATT: Write Response (0x13) len 0
> HCI Event: Number of Completed Packets (0x13) plen 5    #171 [hci1] 11.760744
        Num handles: 1
        Handle: 2091 Address: DF:A9:FF:F6:B1:1A (OUI DF-A9-FF)
        Count: 1
        #170: len 5 (0 Kb/s)
        Latency: 160 msec (79-172 msec ~162 msec)
> ACL Data RX: Handle 2091 flags 0x02 dlen 9              #172 [hci1] 11.760975
      ATT: Write Request (0x12) len 4
        Handle: 0x0033
          Data: 0100
< HCI Command: Host Number of Com.. (0x03|0x0035) plen 5  #173 [hci1] 11.780442
        Num handles: 1
        Handle: 2091 Address: DF:A9:FF:F6:B1:1A (OUI DF-A9-FF)
        Count: 1
< ACL Data TX: Handle 2091 flags 0x00 dlen 5              #174 [hci1] 11.780454
      ATT: Write Response (0x13) len 0
> HCI Event: Number of Completed Packets (0x13) plen 5    #175 [hci1] 11.935711
        Num handles: 1
        Handle: 2091 Address: DF:A9:FF:F6:B1:1A (OUI DF-A9-FF)
        Count: 1
        #174: len 5 (0 Kb/s)
        Latency: 155 msec (79-172 msec ~158 msec)
> ACL Data RX: Handle 2091 flags 0x02 dlen 7              #176 [hci1] 11.935933
      ATT: Read Request (0x0a) len 2
        Handle: 0x0026
< HCI Command: Host Number of Com.. (0x03|0x0035) plen 5  #177 [hci1] 11.940282
        Num handles: 1
        Handle: 2091 Address: DF:A9:FF:F6:B1:1A (OUI DF-A9-FF)
        Count: 1
< ACL Data TX: Handle 2091 flags 0x00 dlen 8              #178 [hci1] 11.940310
      ATT: Read Response (0x0b) len 3
> HCI Event: Number of Completed Packets (0x13) plen 5    #179 [hci1] 12.110788
        Num handles: 1
        Handle: 2091 Address: DF:A9:FF:F6:B1:1A (OUI DF-A9-FF)
        Count: 1
        #178: len 8 (0 Kb/s)
        Latency: 170 msec (79-172 msec ~164 msec)
> ACL Data RX: Handle 2091 flags 0x02 dlen 11             #180 [hci1] 12.111118
      ATT: Write Request (0x12) len 6
        Handle: 0x002c
          Data: 01000e01
< HCI Command: Host Number of Com.. (0x03|0x0035) plen 5  #181 [hci1] 12.120781
        Num handles: 1
        Handle: 2091 Address: DF:A9:FF:F6:B1:1A (OUI DF-A9-FF)
        Count: 1
< ACL Data TX: Handle 2091 flags 0x00 dlen 9              #182 [hci1] 12.120951
      ATT: Error Response (0x01) len 4
        Write Request (0x12)
        Handle: 0x002c
        Error: Reserved (0x82)
> HCI Event: Number of Completed Packets (0x13) plen 5    #183 [hci1] 12.285732
        Num handles: 1
        Handle: 2091 Address: DF:A9:FF:F6:B1:1A (OUI DF-A9-FF)
        Count: 1
        #182: len 9 (0 Kb/s)
        Latency: 164 msec (79-172 msec ~164 msec)
> ACL Data RX: Handle 2091 flags 0x02 dlen 11             #184 [hci1] 12.285991
      ATT: Write Request (0x12) len 6
        Handle: 0x002c
          Data: 0100f2fe
< HCI Command: Host Number of Com.. (0x03|0x0035) plen 5  #185 [hci1] 12.300301
        Num handles: 1
        Handle: 2091 Address: DF:A9:FF:F6:B1:1A (OUI DF-A9-FF)
        Count: 1
< ACL Data TX: Handle 2091 flags 0x00 dlen 9              #186 [hci1] 12.300358
      ATT: Error Response (0x01) len 4
        Write Request (0x12)
        Handle: 0x002c
        Error: Reserved (0x82)
> HCI Event: Number of Completed Packets (0x13) plen 5    #187 [hci1] 12.460583
        Num handles: 1
        Handle: 2091 Address: DF:A9:FF:F6:B1:1A (OUI DF-A9-FF)
        Count: 1
        #186: len 9 (0 Kb/s)
        Latency: 160 msec (79-172 msec ~162 msec)
> HCI Event: Disconnect Complete (0x05) plen 4            #188 [hci1] 13.860858
        Status: Success (0x00)
        Handle: 2091 Address: DF:A9:FF:F6:B1:1A (OUI DF-A9-FF)
        Reason: Remote User Terminated Connection (0x13)
< HCI Command: Reset (0x03|0x0003) plen 0                 #189 [hci1] 17.340260
> HCI Event: Command Complete (0x0e) plen 4               #190 [hci1] 17.340772
      Reset (0x03|0x0003) ncmd 1
        Status: Success (0x00)
@ USER Close: main                                    {0x0001} [hci1] 17.360154
= Close Index: 00:00:00:00:00:00                               [hci1] 17.360162
