Bluetooth monitor ver 5.72
= Note: Linux version 6.14.0-36-generic (x86_64)                       0.585674
= Note: Bluetooth subsystem version 2.22                               0.585676
= New Index: 00:00:00:00:00:00 (Primary,UART,hci1)              [hci1] 0.585678
= New Index: 48:5F:99:8E:E0:64 (Primary,USB,hci0)               [hci0] 0.585679
= Open Index: 00:00:00:00:00:00                                 [hci1] 0.698872
= Index Info: 00:00:00:00:00:00 (Nordic Semiconductor ASA)      [hci1] 0.698876
@ USER Open: main (privileged) version 2.22            {0x0001} [hci1] 0.698879
< HCI Command: Reset (0x03|0x0003) plen 0                    #1 [hci1] 0.699240
> HCI Event: Command Complete (0x0e) plen 4                  #2 [hci1] 0.699676
      Reset (0x03|0x0003) ncmd 1
        Status: Success (0x00)
< HCI Command: Read Local Supported... (0x04|0x0003) plen 0  #3 [hci1] 0.718847
> HCI Event: Command Complete (0x0e) plen 12                 #4 [hci1] 0.719302
      Read Local Supported Features (0x04|0x0003) ncmd 1
        Status: Success (0x00)
        Features: 0x00 0x00 0x00 0x00 0x60 0x00 0x00 0x00
          BR/EDR Not Supported
          LE Supported (Controller)
< HCI Command: Read Local Version In.. (0x04|0x0001) plen 0  #5 [hci1] 0.738867
> HCI Event: Command Complete (0x0e) plen 12                 #6 [hci1] 0.739319
      Read Local Version Information (0x04|0x0001) ncmd 1
        Status: Success (0x00)
        HCI version: Reserved (0x0f) - Revision 12393 (0x3069)
        LMP version: Reserved (0x0f) - Subversion 12393 (0x3069)
        Manufacturer: Nordic Semiconductor ASA (89)
< HCI Command: Read Local Supported... (0x04|0x0002) plen 0  #7 [hci1] 0.758843
> HCI Event: Command Complete (0x0e) plen 68                 #8 [hci1] 0.759913
      Read Local Supported Commands (0x04|0x0002) ncmd 1
        Status: Success (0x00)
        Commands: 119 entries
          Disconnect (Octet 0 - Bit 5)
          Read Remote Version Information (Octet 2 - Bit 7)
          Set Event Mask (Octet 5 - Bit 6)
          Reset (Octet 5 - Bit 7)
          Read Connection Accept Timeout (Octet 7 - Bit 2)
          Write Connection Accept Timeout (Octet 7 - Bit 3)
          Read Transmit Power Level (Octet 10 - Bit 2)
          Set Controller To Host Flow Control (Octet 10 - Bit 5)
          Host Buffer Size (Octet 10 - Bit 6)
          Host Number of Completed Packets (Octet 10 - Bit 7)
          Read Local Version Information (Octet 14 - Bit 3)
          Read Local Supported Features (Octet 14 - Bit 5)
          Read BD ADDR (Octet 15 - Bit 1)
          Read RSSI (Octet 15 - Bit 5)
          Set Event Mask Page 2 (Octet 22 - Bit 2)
          LE Set Event Mask (Octet 25 - Bit 0)
          LE Read Buffer Size (Octet 25 - Bit 1)
          LE Read Local Supported Features (Octet 25 - Bit 2)
          LE Set Random Address (Octet 25 - Bit 4)
          LE Set Advertising Parameters (Octet 25 - Bit 5)
          LE Read Advertising Channel TX Power (Octet 25 - Bit 6)
          LE Set Advertising Data (Octet 25 - Bit 7)
          LE Set Scan Response Data (Octet 26 - Bit 0)
          LE Set Advertise Enable (Octet 26 - Bit 1)
          LE Set Scan Parameters (Octet 26 - Bit 2)
          LE Set Scan Enable (Octet 26 - Bit 3)
          LE Create Connection (Octet 26 - Bit 4)
          LE Create Connection Cancel (Octet 26 - Bit 5)
          LE Read Accept List Size (Octet 26 - Bit 6)
          LE Clear Accept List (Octet 26 - Bit 7)
          LE Add Device To Accept List (Octet 27 - Bit 0)
          LE Remove Device From Accept List (Octet 27 - Bit 1)
          LE Connection Update (Octet 27 - Bit 2)
          LE Set Host Channel Classification (Octet 27 - Bit 3)
          LE Read Channel Map (Octet 27 - Bit 4)
          LE Read Remote Used Features (Octet 27 - Bit 5)
          LE Encrypt (Octet 27 - Bit 6)
          LE Rand (Octet 27 - Bit 7)
          LE Start Encryption (Octet 28 - Bit 0)
          LE Long Term Key Request Reply (Octet 28 - Bit 1)
          LE Long Term Key Request Neg Reply (Octet 28 - Bit 2)
          LE Read Supported States (Octet 28 - Bit 3)
          LE Receiver Test (Octet 28 - Bit 4)
          LE Transmitter Test (Octet 28 - Bit 5)
          LE Test End (Octet 28 - Bit 6)
          Read Authenticated Payload Timeout (Octet 32 - Bit 4)
          Write Authenticated Payload Timeout (Octet 32 - Bit 5)
          LE Set Data Length (Octet 33 - Bit 6)
          LE Read Suggested Default Data Length (Octet 33 - Bit 7)
          LE Write Suggested Default Data Length (Octet 34 - Bit 0)
          LE Add Device To Resolving List (Octet 34 - Bit 3)
          LE Remove Device From Resolving List (Octet 34 - Bit 4)
          LE Clear Resolving List (Octet 34 - Bit 5)
          LE Read Resolving List Size (Octet 34 - Bit 6)
          LE Set Address Resolution Enable (Octet 35 - Bit 1)
          LE Set Resolvable Private Address Timeout (Octet 35 - Bit 2)
          LE Read Maximum Data Length (Octet 35 - Bit 3)
          LE Read PHY (Octet 35 - Bit 4)
          LE Set Default PHY (Octet 35 - Bit 5)
          LE Set PHY (Octet 35 - Bit 6)
          LE Enhanced Receiver Test (Octet 35 - Bit 7)
          LE Enhanced Transmitter Test (Octet 36 - Bit 0)
          LE Set Advertising Set Random Address (Octet 36 - Bit 1)
          LE Set Extended Advertising Parameters (Octet 36 - Bit 2)
          LE Set Extended Advertising Data (Octet 36 - Bit 3)
          LE Set Extended Scan Response Data (Octet 36 - Bit 4)
          LE Set Extended Advertising Enable (Octet 36 - Bit 5)
          LE Read Maximum Advertising Data Length (Octet 36 - Bit 6)
          LE Read Number of Supported Advertising Sets (Octet 36 - Bit 7)
          LE Remove Advertising Set (Octet 37 - Bit 0)
          LE Clear Advertising Sets (Octet 37 - Bit 1)
          LE Set Periodic Advertising Parameters (Octet 37 - Bit 2)
          LE Set Periodic Advertising Data (Octet 37 - Bit 3)
          LE Set Periodic Advertising Enable (Octet 37 - Bit 4)
          LE Set Extended Scan Parameters (Octet 37 - Bit 5)
          LE Set Extended Scan Enable (Octet 37 - Bit 6)
          LE Extended Create Connection (Octet 37 - Bit 7)
          LE Periodic Advertising Create Sync (Octet 38 - Bit 0)
          LE Periodic Advertising Create Sync Cancel (Octet 38 - Bit 1)
          LE Periodic Advertising Terminate Sync (Octet 38 - Bit 2)
          LE Add Device To Periodic Advertiser List (Octet 38 - Bit 3)
          LE Remove Device From Periodic Advertiser List (Octet 38 - Bit 4)
          LE Clear Periodic Advertiser List (Octet 38 - Bit 5)
          LE Read Periodic Advertiser List Size (Octet 38 - Bit 6)
          LE Read Transmit Power (Octet 38 - Bit 7)
          LE Read RF Path Compensation (Octet 39 - Bit 0)
          LE Write RF Path Compensation (Octet 39 - Bit 1)
          LE Set Privacy Mode (Octet 39 - Bit 2)
          LE Periodic Advertising Receive Enable (Octet 40 - Bit 5)
          LE Periodic Advertising Sync Transfer (Octet 40 - Bit 6)
          LE Periodic Advertising Set Info Transfer (Octet 40 - Bit 7)
          LE Periodic Advertising Sync Transfer Parameters (Octet 41 - Bit 0)
          LE Set Default Periodic Advertisng Sync Transfer Parameters (Octet 41 - Bit 1)
          LE Read Buffer v2 (Octet 41 - Bit 5)
          LE Read ISO TX Sync (Octet 41 - Bit 6)
          LE Set Connected Isochronous Group Parameters (Octet 41 - Bit 7)
          LE Set Connected Isochronous Group Parameters Test (Octet 42 - Bit 0)
          LE Create Connected Isochronous Stream (Octet 42 - Bit 1)
          LE Remove Connected Isochronous Group (Octet 42 - Bit 2)
          LE Accept Connected Isochronous Stream Request (Octet 42 - Bit 3)
          LE Reject Connected Isochronous Stream Request (Octet 42 - Bit 4)
          LE Create Broadcast Isochronous Group (Octet 42 - Bit 5)
          LE Create Broadcast Isochronous Group Test (Octet 42 - Bit 6)
          LE Terminate Broadcast Isochronous Group (Octet 42 - Bit 7)
          LE Broadcast Isochronous Group Create Sync (Octet 43 - Bit 0)
          LE Broadcast Isochronous Group Terminate Sync (Octet 43 - Bit 1)
          LE Request Peer SCA (Octet 43 - Bit 2)
          LE Setup Isochronous Data Path (Octet 43 - Bit 3)
          LE Remove Isochronous Data Path (Octet 43 - Bit 4)
          LE Isochronous Transmit Test (Octet 43 - Bit 5)
          LE Isochronous Receive Test (Octet 43 - Bit 6)
          LE Isochronous Read Test Counters (Octet 43 - Bit 7)
          LE Isochronous Read Test Counters (Octet 44 - Bit 0)
          LE Set Host Feature (Octet 44 - Bit 1)
          Octet 44 - Bit 2 
          Octet 45 - Bit 6 
          Octet 46 - Bit 0 
          Octet 46 - Bit 1 
          Octet 46 - Bit 2 
< HCI Command: Host Buffer Size (0x03|0x0033) plen 7         #9 [hci1] 0.778833
        ACL MTU: 255  ACL max packet: 16
        SCO MTU: 0    SCO max packet: 0
> HCI Event: Command Complete (0x0e) plen 4                 #10 [hci1] 0.779324
      Host Buffer Size (0x03|0x0033) ncmd 1
        Status: Success (0x00)
< HCI Command: Set Controller To Ho.. (0x03|0x0031) plen 1  #11 [hci1] 0.798869
        Flow control: ACL Data Packets (0x01)
> HCI Event: Command Complete (0x0e) plen 4                 #12 [hci1] 0.799281
      Set Controller To Host Flow Control (0x03|0x0031) ncmd 1
        Status: Success (0x00)
< HCI Command: LE Read Local Suppor.. (0x08|0x0003) plen 0  #13 [hci1] 0.818859
> HCI Event: Command Complete (0x0e) plen 12                #14 [hci1] 0.819382
      LE Read Local Supported Features (0x08|0x0003) ncmd 1
        Status: Success (0x00)
        Features: 0xfd 0x79 0x00 0xf7 0x30 0x01 0x00 0x00
          LE Encryption
          Extended Reject Indication
          Peripheral-initiated Features Exchange
          LE Ping
          LE Data Packet Length Extension
          LL Privacy
          Extended Scanner Filter Policies
          LE 2M PHY
          LE Coded PHY
          LE Extended Advertising
          LE Periodic Advertising
          Channel Selection Algorithm #2
          Periodic Advertising Sync Transfer - Sender
          Periodic Advertising Sync Transfer - Recipient
          Sleep Clock Accuracy Updates
          Connected Isochronous Stream - Central
          Connected Isochronous Stream - Peripheral
          Isochronous Broadcaster
          Synchronized Receiver
          Periodic Advertising ADI support
          Connection Subrating
          Unknown features (0x0000010000000000)
< HCI Command: LE Set Host Feature (0x08|0x0074) plen 2     #15 [hci1] 0.838882
        Bit Number: 32
          Connected Isochronous Stream (Host Support)
        Bit Value: 1
> HCI Event: Command Complete (0x0e) plen 4                 #16 [hci1] 0.839265
      LE Set Host Feature (0x08|0x0074) ncmd 1
        Status: Success (0x00)
< HCI Command: LE Read Buffer v2 (0x08|0x0060) plen 0       #17 [hci1] 0.858833
> HCI Event: Command Complete (0x0e) plen 10                #18 [hci1] 0.859299
      LE Read Buffer v2 (0x08|0x0060) ncmd 1
        Status: Success (0x00)
        ACL MTU: 27
        ACL max packet: 3
        ISO MTU: 318
        ISO max packet: 3
< HCI Command: LE Read Maximum Adve.. (0x08|0x003a) plen 0  #19 [hci1] 0.878891
> HCI Event: Command Complete (0x0e) plen 6                 #20 [hci1] 0.879458
      LE Read Maximum Advertising Data Length (0x08|0x003a) ncmd 1
        Status: Success (0x00)
        Max length: 1650
< HCI Command: LE Read Supported St.. (0x08|0x001c) plen 0  #21 [hci1] 0.898881
> HCI Event: Command Complete (0x0e) plen 12                #22 [hci1] 0.899355
      LE Read Supported States (0x08|0x001c) ncmd 1
        Status: Success (0x00)
        States: 0x000003ff3e0306ff
          Non-connectable Advertising State
          Scannable Advertising State
          Connectable Advertising State
          High Duty Cycle Directed Advertising State
          Passive Scanning State
          Active Scanning State
          Initiating State
            and Connection State (Central Role)
          Connection State (Peripheral Role)
          Scannable Advertising State
            and Passive Scanning State
          Connectable Advertising State
            and Passive Scanning State
          Non-connectable Advertising State
            and Initiating State
          Scannable Advertising State
            and Initiating State
          Active Scanning State
            and Connection State (Central Role)
          Passive Scanning State
            and Connection State (Peripheral Role)
          Active Scanning State
            and Connection State (Peripheral Role)
          Initiating State
            and Connection State (Central Role)
            and Central Role & Central Role
          Low Duty Cycle Directed Advertising State
          Connectable Advertising State
            and Initiating State
            and Central Role & Peripheral Role
          High Duty Cycle Directed Advertising State
            and Initiating State
            and Central Role & Peripheral Role
          Low Duty Cycle Directed Advertising State
            and Initiating State
            and Central Role & Peripheral Role
          Connectable Advertising State
            and Connection State (Central Role)
            and Central Role & Peripheral Role
          High Duty Cycle Directed Advertising State
            and Connection State (Central Role)
            and Central Role & Peripheral Role
          Low Duty Cycle Directed Advertising State
            and Connection State (Central Role)
            and Central Role & Peripheral Role
          Connectable Advertising State
            and Connection State (Peripheral Role)
            and Central Role & Peripheral Role
          High Duty Cycle Directed Advertising State
            and Connection State (Peripheral Role)
            and Peripheral Role & Peripheral Role
          Low Duty Cycle Directed Advertising State
            and Connection State (Peripheral Role)
            and Peripheral Role & Peripheral Role
          Initiating State
            and Connection State (Peripheral Role)
            and Central Role & Peripheral Role
< HCI Command: LE Read Maximum Data.. (0x08|0x002f) plen 0  #23 [hci1] 0.918828
> HCI Event: Command Complete (0x0e) plen 12                #24 [hci1] 0.919268
      LE Read Maximum Data Length (0x08|0x002f) ncmd 1
        Status: Success (0x00)
        Max TX octets: 251
        Max TX time: 2704
        Max RX octets: 251
        Max RX time: 2704
< HCI Command: LE Write Suggested D.. (0x08|0x0024) plen 4  #25 [hci1] 0.938874
        TX octets: 251
        TX time: 2704
> HCI Event: Command Complete (0x0e) plen 4                 #26 [hci1] 0.939301
      LE Write Suggested Default Data Length (0x08|0x0024) ncmd 1
        Status: Success (0x00)
< HCI Command: LE Read Resolving Li.. (0x08|0x002a) plen 0  #27 [hci1] 0.958873
> HCI Event: Command Complete (0x0e) plen 5                 #28 [hci1] 0.959261
      LE Read Resolving List Size (0x08|0x002a) ncmd 1
        Status: Success (0x00)
        Size: 8
< HCI Command: LE Set Event Mask (0x08|0x0001) plen 8       #29 [hci1] 0.978858
        Mask: 0x000002023f87fa5e
          LE Advertising Report
          LE Connection Update Complete
          LE Read Remote Used Features Complete
          LE Long Term Key Request
          LE Data Length Change
          LE Enhanced Connection Complete
          LE PHY Update Complete
          LE Extended Advertising Report
          LE Periodic Advertising Sync Established
          LE Periodic Advertising Report
          LE Periodic Advertising Sync Lost
          LE Extended Scan Timeout
          LE Extended Advertising Set Terminated
          LE Scan Request Received
          LE Periodic Advertising Sync Transfer Rvc
          LE CIS Established
          LE CIS Request
          LE Create BIG Complete
          LE Terminate BIG Complete
          LE BIG Sync Estabilished Complete
          LE BIG Sync Lost
          LE BIG Info Advertising Report
          Unknown mask (0x0000020000000000)
> HCI Event: Command Complete (0x0e) plen 4                 #30 [hci1] 0.979338
      LE Set Event Mask (0x08|0x0001) ncmd 1
        Status: Success (0x00)
< HCI Command: Set Event Mask (0x03|0x0001) plen 8          #31 [hci1] 0.998872
        Mask: 0x2000800002008890
          Disconnection Complete
          Encryption Change
          Read Remote Version Information Complete
          Hardware Error
          Data Buffer Overflow
          Encryption Key Refresh Complete
          LE Meta
> HCI Event: Command Complete (0x0e) plen 4                 #32 [hci1] 0.999375
      Set Event Mask (0x03|0x0001) ncmd 1
        Status: Success (0x00)
< HCI Command: Read BD ADDR (0x04|0x0009) plen 0            #33 [hci1] 1.018871
> HCI Event: Command Complete (0x0e) plen 10                #34 [hci1] 1.019347
      Read BD ADDR (0x04|0x0009) ncmd 1
        Status: Success (0x00)
        Address: 00:00:00:00:00:00 (OUI 00-00-00)
< HCI Command: LE Set Random Address (0x08|0x0005) plen 6   #35 [hci1] 1.038865
        Address: D5:B6:CC:31:DB:3B (Static)
> HCI Event: Command Complete (0x0e) plen 4                 #36 [hci1] 1.039492
      LE Set Random Address (0x08|0x0005) ncmd 1
        Status: Success (0x00)
< HCI Command: LE Set Extended Adv.. (0x08|0x0036) plen 25  #37 [hci1] 3.559571
        Handle: 0x00
        Properties: 0x0013
          Connectable
          Scannable
          Use legacy advertising PDUs: ADV_IND
        Min advertising interval: 100.000 msec (0x00a0)
        Max advertising interval: 150.000 msec (0x00f0)
        Channel map: 37, 38, 39 (0x07)
        Own address type: Random (0x01)
        Peer address type: Public (0x00)
        Peer address: 00:00:00:00:00:00 (OUI 00-00-00)
        Filter policy: Allow Scan Request from Any, Allow Connect Request from Any (0x00)
        TX power: Host has no preference (0x7f)
        Primary PHY: LE 1M (0x01)
        Secondary max skip: 0x00
        Secondary PHY: LE 1M (0x01)
        SID: 0x00
        Scan request notifications: Disabled (0x00)
> HCI Event: Command Complete (0x0e) plen 5                 #38 [hci1] 3.560467
      LE Set Extended Advertising Parameters (0x08|0x0036) ncmd 1
        Status: Success (0x00)
        TX power (selected): 0 dbm (0x00)
< HCI Command: LE Set Advertising S.. (0x08|0x0035) plen 7  #39 [hci1] 3.579057
        Advertising handle: 0x00
        Advertising random address: D5:B6:CC:31:DB:3B (Static)
> HCI Event: Command Complete (0x0e) plen 4                 #40 [hci1] 3.579586
      LE Set Advertising Set Random Address (0x08|0x0035) ncmd 1
        Status: Success (0x00)
< HCI Command: LE Set Extended Adv.. (0x08|0x0037) plen 22  #41 [hci1] 3.598921
        Handle: 0x00
        Operation: Complete extended advertising data (0x03)
        Fragment preference: Minimize fragmentation (0x01)
        Data length: 0x12
        Flags: 0x06
          LE General Discoverable Mode
          BR/EDR Not Supported
        Name (complete): Tester_F6B11A
> HCI Event: Command Complete (0x0e) plen 4                 #42 [hci1] 3.599602
      LE Set Extended Advertising Data (0x08|0x0037) ncmd 1
        Status: Success (0x00)
< HCI Command: LE Set Extended Scan.. (0x08|0x0038) plen 4  #43 [hci1] 3.618895
        Handle: 0x00
        Operation: Complete scan response data (0x03)
        Fragment preference: Minimize fragmentation (0x01)
        Data length: 0x00
> HCI Event: Command Complete (0x0e) plen 4                 #44 [hci1] 3.619373
      LE Set Extended Scan Response Data (0x08|0x0038) ncmd 1
        Status: Success (0x00)
< HCI Command: LE Set Extended Adve.. (0x08|0x0039) plen 6  #45 [hci1] 3.638913
        Extended advertising: Enabled (0x01)
        Number of sets: 1 (0x01)
        Entry 0
          Handle: 0x00
          Duration: 0 ms (0x00)
          Max ext adv events: 0
> HCI Event: Command Complete (0x0e) plen 4                 #46 [hci1] 3.639466
      LE Set Extended Advertising Enable (0x08|0x0039) ncmd 1
        Status: Success (0x00)
> HCI Event: LE Meta Event (0x3e) plen 31                   #47 [hci1] 3.754020
      LE Enhanced Connection Complete (0x0a)
        Status: Success (0x00)
        Handle: 1209
        Role: Peripheral (0x01)
        Peer address type: Public (0x00)
        Peer address: DF:A9:FF:F6:B1:1A (OUI DF-A9-FF)
        Local resolvable private address: 00:00:00:00:00:00 (Non-Resolvable)
        Peer resolvable private address: 00:00:00:00:00:00 (Non-Resolvable)
        Connection interval: 87.50 msec (0x0046)
        Connection latency: 0 (0x0000)
        Supervision timeout: 25120 msec (0x09d0)
        Central clock accuracy: 0x01
> HCI Event: LE Meta Event (0x3e) plen 6                    #48 [hci1] 3.754113
      LE Advertising Set Terminated (0x12)
        Status: Success (0x00)
        Handle: 0
        Connection handle: 1209
        Number of completed extended advertising events: 0
< HCI Command: LE Read Remote Used... (0x08|0x0016) plen 2  #49 [hci1] 3.759234
        Handle: 1209 Address: DF:A9:FF:F6:B1:1A (OUI DF-A9-FF)
< ACL Data TX: Handle 1209 flags 0x00 dlen 7                #50 [hci1] 3.759245
      ATT: Exchange MTU Request (0x02) len 2
        Client RX MTU: 251
> HCI Event: Command Status (0x0f) plen 4                   #51 [hci1] 3.759596
      LE Read Remote Used Features (0x08|0x0016) ncmd 1
        Status: Success (0x00)
> HCI Event: Number of Completed Packets (0x13) plen 5      #52 [hci1] 3.930029
        Num handles: 1
        Handle: 1209 Address: DF:A9:FF:F6:B1:1A (OUI DF-A9-FF)
        Count: 1
        #50: len 7 (0 Kb/s)
        Latency: 170 msec (170-170 msec ~170 msec)
> HCI Event: LE Meta Event (0x3e) plen 12                   #53 [hci1] 4.017983
      LE Read Remote Used Features (0x04)
        Status: Success (0x00)
        Handle: 1209 Address: DF:A9:FF:F6:B1:1A (OUI DF-A9-FF)
        Features: 0x2d 0x49 0x00 0xf7 0x67 0xd9 0x00 0x80
          LE Encryption
          Extended Reject Indication
          Peripheral-initiated Features Exchange
          LE Data Packet Length Extension
          LE 2M PHY
          LE Coded PHY
          Channel Selection Algorithm #2
          Periodic Advertising Sync Transfer - Sender
          Periodic Advertising Sync Transfer - Recipient
          Sleep Clock Accuracy Updates
          Connected Isochronous Stream - Central
          Connected Isochronous Stream - Peripheral
          Isochronous Broadcaster
          Synchronized Receiver
          Connected Isochronous Stream (Host Support)
          LE Power Control Request
          LE Power Control Request
          Connection Subrating
          Connection Subrating (Host Support)
          Unknown features (0x8000d90000000000)
> ACL Data RX: Handle 1209 flags 0x02 dlen 11               #54 [hci1] 6.467669
      SMP: Pairing Request (0x01) len 6
        IO capability: KeyboardDisplay (0x04)
        OOB data: Authentication data not present (0x00)
        Authentication requirement: Bonding, MITM, SC, No Keypresses (0x0d)
        Max encryption key size: 16
        Initiator key distribution: EncKey IdKey (0x03)
        Responder key distribution: EncKey IdKey Sign (0x07)
> ACL Data RX: Handle 1209 flags 0x02 dlen 7                #55 [hci1] 6.468101
      ATT: Exchange MTU Response (0x03) len 2
        Server RX MTU: 23
< HCI Command: Host Number of Compl.. (0x03|0x0035) plen 5  #56 [hci1] 6.480423
        Num handles: 1
        Handle: 1209 Address: DF:A9:FF:F6:B1:1A (OUI DF-A9-FF)
        Count: 1
< ACL Data TX: Handle 1209 flags 0x00 dlen 11               #57 [hci1] 6.480449
      SMP: Pairing Response (0x02) len 6
        IO capability: DisplayOnly (0x00)
        OOB data: Authentication data not present (0x00)
        Authentication requirement: Bonding, No MITM, SC, No Keypresses (0x09)
        Max encryption key size: 16
        Initiator key distribution: IdKey (0x02)
        Responder key distribution: <none> (0x00)
< HCI Command: Host Number of Compl.. (0x03|0x0035) plen 5  #58 [hci1] 6.480486
        Num handles: 1
        Handle: 1209 Address: DF:A9:FF:F6:B1:1A (OUI DF-A9-FF)
        Count: 1
> HCI Event: Number of Completed Packets (0x13) plen 5      #59 [hci1] 6.642795
        Num handles: 1
        Handle: 1209 Address: DF:A9:FF:F6:B1:1A (OUI DF-A9-FF)
        Count: 1
        #57: len 11 (0 Kb/s)
        Latency: 162 msec (162-170 msec ~166 msec)
> ACL Data RX: Handle 1209 flags 0x02 dlen 27               #60 [hci1] 6.643005
> ACL Data RX: Handle 1209 flags 0x01 dlen 27               #61 [hci1] 6.643635
> ACL Data RX: Handle 1209 flags 0x01 dlen 15               #62 [hci1] 6.644040
      SMP: Pairing Public Key (0x0c) len 64
        X: ec802c6a8befa1924a12a538933cf015be016a46eaeb53099301f1211dfa0d52
        Y: 00cb80312d99145932052254ea602499fd9c944348440eabc0adb64fd188585a
< HCI Command: Host Number of Compl.. (0x03|0x0035) plen 5  #63 [hci1] 6.660003
        Num handles: 1
        Handle: 1209 Address: DF:A9:FF:F6:B1:1A (OUI DF-A9-FF)
        Count: 1
< HCI Command: Host Number of Compl.. (0x03|0x0035) plen 5  #64 [hci1] 6.660311
        Num handles: 1
        Handle: 1209 Address: DF:A9:FF:F6:B1:1A (OUI DF-A9-FF)
        Count: 1
< HCI Command: Host Number of Compl.. (0x03|0x0035) plen 5  #65 [hci1] 6.660734
        Num handles: 1
        Handle: 1209 Address: DF:A9:FF:F6:B1:1A (OUI DF-A9-FF)
        Count: 1
< ACL Data TX: Handle 1209 flags 0x00 dlen 27               #66 [hci1] 6.660869
< ACL Data TX: Handle 1209 flags 0x01 dlen 27               #67 [hci1] 6.660887
< ACL Data TX: Handle 1209 flags 0x01 dlen 15               #68 [hci1] 6.660917
      SMP: Pairing Public Key (0x0c) len 64
        X: 98308440221e2d910f0e54b71e7ec652857aa9b5a0dc65028824cc19db1226e9
        Y: 67a4816bcb62efb21701e31fdb27561a6217575fb007a8bbdabe7e28b6f68482
> HCI Event: Number of Completed Packets (0x13) plen 5      #69 [hci1] 6.730661
        Num handles: 1
        Handle: 1209 Address: DF:A9:FF:F6:B1:1A (OUI DF-A9-FF)
        Count: 1
        #66: len 27 (3 Kb/s)
        Latency: 69 msec (69-170 msec ~118 msec)
> HCI Event: Number of Completed Packets (0x13) plen 5      #70 [hci1] 6.731292
        Num handles: 1
        Handle: 1209 Address: DF:A9:FF:F6:B1:1A (OUI DF-A9-FF)
        Count: 1
        #67: len 27 (3 Kb/s)
        Latency: 70 msec (69-170 msec ~94 msec)
> HCI Event: Number of Completed Packets (0x13) plen 5      #71 [hci1] 6.817457
        Num handles: 1
        Handle: 1209 Address: DF:A9:FF:F6:B1:1A (OUI DF-A9-FF)
        Count: 1
        #68: len 15 (0 Kb/s)
        Latency: 156 msec (69-170 msec ~125 msec)
> ACL Data RX: Handle 1209 flags 0x02 dlen 21               #72 [hci1] 7.780300
      SMP: Pairing Confirm (0x03) len 16
        Confim value: 4dcb3f63f5b4ecb21e6f14c31d513ca5
< HCI Command: Host Number of Compl.. (0x03|0x0035) plen 5  #73 [hci1] 7.799675
        Num handles: 1
        Handle: 1209 Address: DF:A9:FF:F6:B1:1A (OUI DF-A9-FF)
        Count: 1
< ACL Data TX: Handle 1209 flags 0x00 dlen 21               #74 [hci1] 7.799826
      SMP: Pairing Confirm (0x03) len 16
        Confim value: 17fba91f4f2b7a3aaf1db34381345bdf
> HCI Event: Number of Completed Packets (0x13) plen 5      #75 [hci1] 7.955157
        Num handles: 1
        Handle: 1209 Address: DF:A9:FF:F6:B1:1A (OUI DF-A9-FF)
        Count: 1
        #74: len 21 (1 Kb/s)
        Latency: 155 msec (69-170 msec ~140 msec)
> ACL Data RX: Handle 1209 flags 0x02 dlen 21               #76 [hci1] 7.955527
      SMP: Pairing Random (0x04) len 16
        Random value: dc3f781f225cd94f0000000000000000
< HCI Command: Host Number of Compl.. (0x03|0x0035) plen 5  #77 [hci1] 7.959818
        Num handles: 1
        Handle: 1209 Address: DF:A9:FF:F6:B1:1A (OUI DF-A9-FF)
        Count: 1
< ACL Data TX: Handle 1209 flags 0x00 dlen 21               #78 [hci1] 7.959921
      SMP: Pairing Random (0x04) len 16
        Random value: 8e6108f966a694cbe26df70bb96773e6
> HCI Event: Number of Completed Packets (0x13) plen 5      #79 [hci1] 8.129906
        Num handles: 1
        Handle: 1209 Address: DF:A9:FF:F6:B1:1A (OUI DF-A9-FF)
        Count: 1
        #78: len 21 (0 Kb/s)
        Latency: 169 msec (69-170 msec ~155 msec)
> ACL Data RX: Handle 1209 flags 0x02 dlen 21               #80 [hci1] 8.217774
      SMP: Pairing Confirm (0x03) len 16
        Confim value: af7ff3a32ee5f3b7d2b1da2c5c5a600e
< HCI Command: Host Number of Compl.. (0x03|0x0035) plen 5  #81 [hci1] 8.219579
        Num handles: 1
        Handle: 1209 Address: DF:A9:FF:F6:B1:1A (OUI DF-A9-FF)
        Count: 1
< ACL Data TX: Handle 1209 flags 0x00 dlen 21               #82 [hci1] 8.219731
      SMP: Pairing Confirm (0x03) len 16
        Confim value: 9b17d367a4857a086dc69026e9a60e96
> HCI Event: Number of Completed Packets (0x13) plen 5      #83 [hci1] 8.392624
        Num handles: 1
        Handle: 1209 Address: DF:A9:FF:F6:B1:1A (OUI DF-A9-FF)
        Count: 1
        #82: len 21 (0 Kb/s)
        Latency: 172 msec (69-172 msec ~164 msec)
> ACL Data RX: Handle 1209 flags 0x02 dlen 21               #84 [hci1] 8.392969
      SMP: Pairing Random (0x04) len 16
        Random value: d729793aa22362430000000000000000
< HCI Command: Host Number of Compl.. (0x03|0x0035) plen 5  #85 [hci1] 8.399795
        Num handles: 1
        Handle: 1209 Address: DF:A9:FF:F6:B1:1A (OUI DF-A9-FF)
        Count: 1
< ACL Data TX: Handle 1209 flags 0x00 dlen 21               #86 [hci1] 8.399941
      SMP: Pairing Random (0x04) len 16
        Random value: 4d02679f89a05211af56d8b3da64d21e
> HCI Event: Number of Completed Packets (0x13) plen 5      #87 [hci1] 8.567547
        Num handles: 1
        Handle: 1209 Address: DF:A9:FF:F6:B1:1A (OUI DF-A9-FF)
        Count: 1
        #86: len 21 (1 Kb/s)
        Latency: 167 msec (69-172 msec ~165 msec)
> ACL Data RX: Handle 1209 flags 0x02 dlen 21               #88 [hci1] 8.655361
      SMP: Pairing Confirm (0x03) len 16
        Confim value: a14271784bcdd4e58b44a73061633cb4
< HCI Command: Host Number of Compl.. (0x03|0x0035) plen 5  #89 [hci1] 8.659223
        Num handles: 1
        Handle: 1209 Address: DF:A9:FF:F6:B1:1A (OUI DF-A9-FF)
        Count: 1
< ACL Data TX: Handle 1209 flags 0x00 dlen 21               #90 [hci1] 8.659275
      SMP: Pairing Confirm (0x03) len 16
        Confim value: 8b77d24c1414bb641f002903a24dad7c
> HCI Event: Number of Completed Packets (0x13) plen 5      #91 [hci1] 8.830192
        Num handles: 1
        Handle: 1209 Address: DF:A9:FF:F6:B1:1A (OUI DF-A9-FF)
        Count: 1
        #90: len 21 (0 Kb/s)
        Latency: 170 msec (69-172 msec ~168 msec)
> ACL Data RX: Handle 1209 flags 0x02 dlen 21               #92 [hci1] 8.830500
      SMP: Pairing Random (0x04) len 16
        Random value: d112fcbff279115d0000000000000000
< HCI Command: Host Number of Compl.. (0x03|0x0035) plen 5  #93 [hci1] 8.839858
        Num handles: 1
        Handle: 1209 Address: DF:A9:FF:F6:B1:1A (OUI DF-A9-FF)
        Count: 1
< ACL Data TX: Handle 1209 flags 0x00 dlen 21               #94 [hci1] 8.840000
      SMP: Pairing Random (0x04) len 16
        Random value: 5e8286bc235a02440d0c3424a2acf8fd
> HCI Event: Number of Completed Packets (0x13) plen 5      #95 [hci1] 9.004938
        Num handles: 1
        Handle: 1209 Address: DF:A9:FF:F6:B1:1A (OUI DF-A9-FF)
        Count: 1
        #94: len 21 (1 Kb/s)
        Latency: 164 msec (69-172 msec ~166 msec)
> ACL Data RX: Handle 1209 flags 0x02 dlen 21               #96 [hci1] 9.092765
      SMP: Pairing Confirm (0x03) len 16
        Confim value: 26684b1265952edc4d437a59f78d2bf1
< HCI Command: Host Number of Compl.. (0x03|0x0035) plen 5  #97 [hci1] 9.099478
        Num handles: 1
        Handle: 1209 Address: DF:A9:FF:F6:B1:1A (OUI DF-A9-FF)
        Count: 1
< ACL Data TX: Handle 1209 flags 0x00 dlen 21               #98 [hci1] 9.099617
      SMP: Pairing Confirm (0x03) len 16
        Confim value: d4f26bad3b95285817f8956983a28edd
> HCI Event: Number of Completed Packets (0x13) plen 5      #99 [hci1] 9.267663
        Num handles: 1
        Handle: 1209 Address: DF:A9:FF:F6:B1:1A (OUI DF-A9-FF)
        Count: 1
        #98: len 21 (1 Kb/s)
        Latency: 168 msec (69-172 msec ~167 msec)
> ACL Data RX: Handle 1209 flags 0x02 dlen 21              #100 [hci1] 9.268036
      SMP: Pairing Random (0x04) len 16
        Random value: 1b0614545786c5140000000000000000
< HCI Command: Host Number of Comp.. (0x03|0x0035) plen 5  #101 [hci1] 9.279757
        Num handles: 1
        Handle: 1209 Address: DF:A9:FF:F6:B1:1A (OUI DF-A9-FF)
        Count: 1
< ACL Data TX: Handle 1209 flags 0x00 dlen 21              #102 [hci1] 9.279927
      SMP: Pairing Random (0x04) len 16
        Random value: 5c4a1bcadd27bd58e945097b00bad7ac
> HCI Event: Number of Completed Packets (0x13) plen 5     #103 [hci1] 9.442429
        Num handles: 1
        Handle: 1209 Address: DF:A9:FF:F6:B1:1A (OUI DF-A9-FF)
        Count: 1
        #102: len 21 (1 Kb/s)
        Latency: 162 msec (69-172 msec ~164 msec)
> ACL Data RX: Handle 1209 flags 0x02 dlen 21              #104 [hci1] 9.530381
      SMP: Pairing Confirm (0x03) len 16
        Confim value: c42b1fd9ab2d8bc72827da6cb787120a
< HCI Command: Host Number of Comp.. (0x03|0x0035) plen 5  #105 [hci1] 9.539543
        Num handles: 1
        Handle: 1209 Address: DF:A9:FF:F6:B1:1A (OUI DF-A9-FF)
        Count: 1
< ACL Data TX: Handle 1209 flags 0x00 dlen 21              #106 [hci1] 9.539623
      SMP: Pairing Confirm (0x03) len 16
        Confim value: 183d73b58c22e35673359dca7b5a5a88
> HCI Event: Number of Completed Packets (0x13) plen 5     #107 [hci1] 9.705113
        Num handles: 1
        Handle: 1209 Address: DF:A9:FF:F6:B1:1A (OUI DF-A9-FF)
        Count: 1
        #106: len 21 (1 Kb/s)
        Latency: 165 msec (69-172 msec ~165 msec)
> ACL Data RX: Handle 1209 flags 0x02 dlen 21              #108 [hci1] 9.705613
      SMP: Pairing Random (0x04) len 16
        Random value: 49657cb606c4760b0000000000000000
< HCI Command: Host Number of Comp.. (0x03|0x0035) plen 5  #109 [hci1] 9.719844
        Num handles: 1
        Handle: 1209 Address: DF:A9:FF:F6:B1:1A (OUI DF-A9-FF)
        Count: 1
< ACL Data TX: Handle 1209 flags 0x00 dlen 21              #110 [hci1] 9.719951
      SMP: Pairing Random (0x04) len 16
        Random value: 32527e6e64e79f33b2e374394db8ab2d
> HCI Event: Number of Completed Packets (0x13) plen 5     #111 [hci1] 9.880209
        Num handles: 1
        Handle: 1209 Address: DF:A9:FF:F6:B1:1A (OUI DF-A9-FF)
        Count: 1
        #110: len 21 (1 Kb/s)
        Latency: 160 msec (69-172 msec ~162 msec)
> ACL Data RX: Handle 1209 flags 0x02 dlen 21              #112 [hci1] 9.880398
      SMP: Pairing Confirm (0x03) len 16
        Confim value: 2de60be71ffa57cf7cd4d4042aa09e65
< HCI Command: Host Number of Comp.. (0x03|0x0035) plen 5  #113 [hci1] 9.899853
        Num handles: 1
        Handle: 1209 Address: DF:A9:FF:F6:B1:1A (OUI DF-A9-FF)
        Count: 1
< ACL Data TX: Handle 1209 flags 0x00 dlen 21              #114 [hci1] 9.900011
      SMP: Pairing Confirm (0x03) len 16
        Confim value: f5954d50374055ec86103db7db9443bb
> HCI Event: Number of Completed Packets (0x13) plen 5    #115 [hci1] 10.055122
        Num handles: 1
        Handle: 1209 Address: DF:A9:FF:F6:B1:1A (OUI DF-A9-FF)
        Count: 1
        #114: len 21 (1 Kb/s)
        Latency: 155 msec (69-172 msec ~158 msec)
> ACL Data RX: Handle 1209 flags 0x02 dlen 21             #116 [hci1] 10.055462
      SMP: Pairing Random (0x04) len 16
        Random value: 0bee4fc3fac897500000000000000000
< HCI Command: Host Number of Com.. (0x03|0x0035) plen 5  #117 [hci1] 10.059848
        Num handles: 1
        Handle: 1209 Address: DF:A9:FF:F6:B1:1A (OUI DF-A9-FF)
        Count: 1
< ACL Data TX: Handle 1209 flags 0x00 dlen 21             #118 [hci1] 10.060011
      SMP: Pairing Random (0x04) len 16
        Random value: dddbdfe2838e9a8cc6964353c850fef7
> HCI Event: Number of Completed Packets (0x13) plen 5    #119 [hci1] 10.229909
        Num handles: 1
        Handle: 1209 Address: DF:A9:FF:F6:B1:1A (OUI DF-A9-FF)
        Count: 1
        #118: len 21 (0 Kb/s)
        Latency: 169 msec (69-172 msec ~164 msec)
> ACL Data RX: Handle 1209 flags 0x02 dlen 21             #120 [hci1] 10.317773
      SMP: Pairing Confirm (0x03) len 16
        Confim value: a05ed34a10487024cff629879f2a7315
< HCI Command: Host Number of Com.. (0x03|0x0035) plen 5  #121 [hci1] 10.319156
        Num handles: 1
        Handle: 1209 Address: DF:A9:FF:F6:B1:1A (OUI DF-A9-FF)
        Count: 1
< ACL Data TX: Handle 1209 flags 0x00 dlen 21             #122 [hci1] 10.319235
      SMP: Pairing Confirm (0x03) len 16
        Confim value: 05d5e96c201f3fa29e693b651c9ba384
> HCI Event: Number of Completed Packets (0x13) plen 5    #123 [hci1] 10.492694
        Num handles: 1
        Handle: 1209 Address: DF:A9:FF:F6:B1:1A (OUI DF-A9-FF)
        Count: 1
        #122: len 21 (0 Kb/s)
        Latency: 173 msec (69-173 msec ~168 msec)
> ACL Data RX: Handle 1209 flags 0x02 dlen 21             #124 [hci1] 10.492975
      SMP: Pairing Random (0x04) len 16
        Random value: d1163fc66d4934a90000000000000000
< HCI Command: Host Number of Com.. (0x03|0x0035) plen 5  #125 [hci1] 10.499739
        Num handles: 1
        Handle: 1209 Address: DF:A9:FF:F6:B1:1A (OUI DF-A9-FF)
        Count: 1
< ACL Data TX: Handle 1209 flags 0x00 dlen 21             #126 [hci1] 10.499893
      SMP: Pairing Random (0x04) len 16
        Random value: eb9f1915536596b6fc3db1c86b2b1970
> HCI Event: Number of Completed Packets (0x13) plen 5    #127 [hci1] 10.667439
        Num handles: 1
        Handle: 1209 Address: DF:A9:FF:F6:B1:1A (OUI DF-A9-FF)
        Count: 1
        #126: len 21 (1 Kb/s)
        Latency: 167 msec (69-173 msec ~168 msec)
> ACL Data RX: Handle 1209 flags 0x02 dlen 21             #128 [hci1] 10.755240
      SMP: Pairing Confirm (0x03) len 16
        Confim value: 5fedce47f8ebdc498004e68edcff6b7a
< HCI Command: Host Number of Com.. (0x03|0x0035) plen 5  #129 [hci1] 10.759513
        Num handles: 1
        Handle: 1209 Address: DF:A9:FF:F6:B1:1A (OUI DF-A9-FF)
        Count: 1
< ACL Data TX: Handle 1209 flags 0x00 dlen 21             #130 [hci1] 10.759593
      SMP: Pairing Confirm (0x03) len 16
        Confim value: 8d510c84972f867a5ac2e831b5287012
> HCI Event: Number of Completed Packets (0x13) plen 5    #131 [hci1] 10.930169
        Num handles: 1
        Handle: 1209 Address: DF:A9:FF:F6:B1:1A (OUI DF-A9-FF)
        Count: 1
        #130: len 21 (0 Kb/s)
        Latency: 170 msec (69-173 msec ~169 msec)
> ACL Data RX: Handle 1209 flags 0x02 dlen 21             #132 [hci1] 10.930485
      SMP: Pairing Random (0x04) len 16
        Random value: acc48e7e4bbccbe90000000000000000
< HCI Command: Host Number of Com.. (0x03|0x0035) plen 5  #133 [hci1] 10.939810
        Num handles: 1
        Handle: 1209 Address: DF:A9:FF:F6:B1:1A (OUI DF-A9-FF)
        Count: 1
< ACL Data TX: Handle 1209 flags 0x00 dlen 21             #134 [hci1] 10.939922
      SMP: Pairing Random (0x04) len 16
        Random value: 5c794dc9ad9f2c3f295ebd5ad5e1c3cf
> HCI Event: Number of Completed Packets (0x13) plen 5    #135 [hci1] 11.104920
        Num handles: 1
        Handle: 1209 Address: DF:A9:FF:F6:B1:1A (OUI DF-A9-FF)
        Count: 1
        #134: len 21 (1 Kb/s)
        Latency: 164 msec (69-173 msec ~167 msec)
> ACL Data RX: Handle 1209 flags 0x02 dlen 21             #136 [hci1] 11.192823
      SMP: Pairing Confirm (0x03) len 16
        Confim value: b31e9733ed10f2367af8f33df0379502
< HCI Command: Host Number of Com.. (0x03|0x0035) plen 5  #137 [hci1] 11.199567
        Num handles: 1
        Handle: 1209 Address: DF:A9:FF:F6:B1:1A (OUI DF-A9-FF)
        Count: 1
< ACL Data TX: Handle 1209 flags 0x00 dlen 21             #138 [hci1] 11.199617
      SMP: Pairing Confirm (0x03) len 16
        Confim value: e23b3b8528ed63e3f033de1014d95272
> HCI Event: Number of Completed Packets (0x13) plen 5    #139 [hci1] 11.367608
        Num handles: 1
        Handle: 1209 Address: DF:A9:FF:F6:B1:1A (OUI DF-A9-FF)
        Count: 1
        #138: len 21 (1 Kb/s)
        Latency: 167 msec (69-173 msec ~167 msec)
> ACL Data RX: Handle 1209 flags 0x02 dlen 21             #140 [hci1] 11.367990
      SMP: Pairing Random (0x04) len 16
        Random value: a8b55abf6235511f0000000000000000
< HCI Command: Host Number of Com.. (0x03|0x0035) plen 5  #141 [hci1] 11.379809
        Num handles: 1
        Handle: 1209 Address: DF:A9:FF:F6:B1:1A (OUI DF-A9-FF)
        Count: 1
< ACL Data TX: Handle 1209 flags 0x00 dlen 21             #142 [hci1] 11.379959
      SMP: Pairing Random (0x04) len 16
        Random value: 5c2fff312cdf99c9491988e877355a9a
> HCI Event: Number of Completed Packets (0x13) plen 5    #143 [hci1] 11.542359
        Num handles: 1
        Handle: 1209 Address: DF:A9:FF:F6:B1:1A (OUI DF-A9-FF)
        Count: 1
        #142: len 21 (1 Kb/s)
        Latency: 162 msec (69-173 msec ~164 msec)
> ACL Data RX: Handle 1209 flags 0x02 dlen 21             #144 [hci1] 11.630228
      SMP: Pairing Confirm (0x03) len 16
        Confim value: 5102d5a92869e511bda43e69d369ff9f
< HCI Command: Host Number of Com.. (0x03|0x0035) plen 5  #145 [hci1] 11.639489
        Num handles: 1
        Handle: 1209 Address: DF:A9:FF:F6:B1:1A (OUI DF-A9-FF)
        Count: 1
< ACL Data TX: Handle 1209 flags 0x00 dlen 21             #146 [hci1] 11.639608
      SMP: Pairing Confirm (0x03) len 16
        Confim value: f613aaeb9deaca12250cef6cb2d154a3
> HCI Event: Number of Completed Packets (0x13) plen 5    #147 [hci1] 11.805082
        Num handles: 1
        Handle: 1209 Address: DF:A9:FF:F6:B1:1A (OUI DF-A9-FF)
        Count: 1
        #146: len 21 (1 Kb/s)
        Latency: 165 msec (69-173 msec ~165 msec)
> ACL Data RX: Handle 1209 flags 0x02 dlen 21             #148 [hci1] 11.805489
      SMP: Pairing Random (0x04) len 16
        Random value: c264eeb5bce5fa170000000000000000
< HCI Command: Host Number of Com.. (0x03|0x0035) plen 5  #149 [hci1] 11.819806
        Num handles: 1
        Handle: 1209 Address: DF:A9:FF:F6:B1:1A (OUI DF-A9-FF)
        Count: 1
< ACL Data TX: Handle 1209 flags 0x00 dlen 21             #150 [hci1] 11.819968
      SMP: Pairing Random (0x04) len 16
        Random value: c629a3a987d808e808655d558dfc1155
> HCI Event: Number of Completed Packets (0x13) plen 5    #151 [hci1] 11.979851
        Num handles: 1
        Handle: 1209 Address: DF:A9:FF:F6:B1:1A (OUI DF-A9-FF)
        Count: 1
        #150: len 21 (1 Kb/s)
        Latency: 159 msec (69-173 msec ~162 msec)
> ACL Data RX: Handle 1209 flags 0x02 dlen 21             #152 [hci1] 12.067727
      SMP: Pairing Confirm (0x03) len 16
        Confim value: e1ae549e18f03f0702ff117e77f31540
< HCI Command: Host Number of Com.. (0x03|0x0035) plen 5  #153 [hci1] 12.079265
        Num handles: 1
        Handle: 1209 Address: DF:A9:FF:F6:B1:1A (OUI DF-A9-FF)
        Count: 1
< ACL Data TX: Handle 1209 flags 0x00 dlen 21             #154 [hci1] 12.079327
      SMP: Pairing Confirm (0x03) len 16
        Confim value: cb7beb9fac4b25027952363cb68209e7
> HCI Event: Number of Completed Packets (0x13) plen 5    #155 [hci1] 12.242704
        Num handles: 1
        Handle: 1209 Address: DF:A9:FF:F6:B1:1A (OUI DF-A9-FF)
        Count: 1
        #154: len 21 (1 Kb/s)
        Latency: 163 msec (69-173 msec ~162 msec)
> ACL Data RX: Handle 1209 flags 0x02 dlen 21             #156 [hci1] 12.242975
      SMP: Pairing Random (0x04) len 16
        Random value: 9dcd4c412a30bc510000000000000000
< HCI Command: Host Number of Com.. (0x03|0x0035) plen 5  #157 [hci1] 12.259815
        Num handles: 1
        Handle: 1209 Address: DF:A9:FF:F6:B1:1A (OUI DF-A9-FF)
        Count: 1
< ACL Data TX: Handle 1209 flags 0x00 dlen 21             #158 [hci1] 12.259916
      SMP: Pairing Random (0x04) len 16
        Random value: 92f20f6ad8f13724432c7fd6001c45ff
> HCI Event: Number of Completed Packets (0x13) plen 5    #159 [hci1] 12.417377
        Num handles: 1
        Handle: 1209 Address: DF:A9:FF:F6:B1:1A (OUI DF-A9-FF)
        Count: 1
        #158: len 21 (1 Kb/s)
        Latency: 157 msec (69-173 msec ~160 msec)
> ACL Data RX: Handle 1209 flags 0x02 dlen 21             #160 [hci1] 12.505298
      SMP: Pairing Confirm (0x03) len 16
        Confim value: a37cae804c6ecdaab7ff874de9bb5523
< HCI Command: Host Number of Com.. (0x03|0x0035) plen 5  #161 [hci1] 12.519579
        Num handles: 1
        Handle: 1209 Address: DF:A9:FF:F6:B1:1A (OUI DF-A9-FF)
        Count: 1
< ACL Data TX: Handle 1209 flags 0x00 dlen 21             #162 [hci1] 12.519715
      SMP: Pairing Confirm (0x03) len 16
        Confim value: 419d2b5dedd8a2107f92cb445cc426ff
> HCI Event: Number of Completed Packets (0x13) plen 5    #163 [hci1] 12.680189
        Num handles: 1
        Handle: 1209 Address: DF:A9:FF:F6:B1:1A (OUI DF-A9-FF)
        Count: 1
        #162: len 21 (1 Kb/s)
        Latency: 160 msec (69-173 msec ~160 msec)
> ACL Data RX: Handle 1209 flags 0x02 dlen 21             #164 [hci1] 12.680498
      SMP: Pairing Random (0x04) len 16
        Random value: 2ee1ae6de70337b20000000000000000
< HCI Command: Host Number of Com.. (0x03|0x0035) plen 5  #165 [hci1] 12.700025
        Num handles: 1
        Handle: 1209 Address: DF:A9:FF:F6:B1:1A (OUI DF-A9-FF)
        Count: 1
< ACL Data TX: Handle 1209 flags 0x00 dlen 21             #166 [hci1] 12.700258
      SMP: Pairing Random (0x04) len 16
        Random value: 23ac32ebbb5e14c8a6b9622f296d277f
> HCI Event: Number of Completed Packets (0x13) plen 5    #167 [hci1] 12.854914
        Num handles: 1
        Handle: 1209 Address: DF:A9:FF:F6:B1:1A (OUI DF-A9-FF)
        Count: 1
        #166: len 21 (1 Kb/s)
        Latency: 154 msec (69-173 msec ~157 msec)
> ACL Data RX: Handle 1209 flags 0x02 dlen 21             #168 [hci1] 12.942858
      SMP: Pairing Confirm (0x03) len 16
        Confim value: d7131a446976f41afe8fc2b2ebcf011d
< HCI Command: Host Number of Com.. (0x03|0x0035) plen 5  #169 [hci1] 12.959589
        Num handles: 1
        Handle: 1209 Address: DF:A9:FF:F6:B1:1A (OUI DF-A9-FF)
        Count: 1
< ACL Data TX: Handle 1209 flags 0x00 dlen 21             #170 [hci1] 12.959674
      SMP: Pairing Confirm (0x03) len 16
        Confim value: 37567e9930ac372948b49eb5e7a52465
> HCI Event: Number of Completed Packets (0x13) plen 5    #171 [hci1] 13.117629
        Num handles: 1
        Handle: 1209 Address: DF:A9:FF:F6:B1:1A (OUI DF-A9-FF)
        Count: 1
        #170: len 21 (1 Kb/s)
        Latency: 157 msec (69-173 msec ~157 msec)
> ACL Data RX: Handle 1209 flags 0x02 dlen 21             #172 [hci1] 13.117864
      SMP: Pairing Random (0x04) len 16
        Random value: 70e8491a79b05c480000000000000000
< HCI Command: Host Number of Com.. (0x03|0x0035) plen 5  #173 [hci1] 13.119691
        Num handles: 1
        Handle: 1209 Address: DF:A9:FF:F6:B1:1A (OUI DF-A9-FF)
        Count: 1
< ACL Data TX: Handle 1209 flags 0x00 dlen 21             #174 [hci1] 13.119858
      SMP: Pairing Random (0x04) len 16
        Random value: 297efe85e67448a15f56bd27e3a3cf1d
> HCI Event: Number of Completed Packets (0x13) plen 5    #175 [hci1] 13.292390
        Num handles: 1
        Handle: 1209 Address: DF:A9:FF:F6:B1:1A (OUI DF-A9-FF)
        Count: 1
        #174: len 21 (0 Kb/s)
        Latency: 172 msec (69-173 msec ~165 msec)
> ACL Data RX: Handle 1209 flags 0x02 dlen 21             #176 [hci1] 13.380257
      SMP: Pairing Confirm (0x03) len 16
        Confim value: 136f5283e2b67db84260a64c800d2a3d
< HCI Command: Host Number of Com.. (0x03|0x0035) plen 5  #177 [hci1] 13.399691
        Num handles: 1
        Handle: 1209 Address: DF:A9:FF:F6:B1:1A (OUI DF-A9-FF)
        Count: 1
< ACL Data TX: Handle 1209 flags 0x00 dlen 21             #178 [hci1] 13.399868
      SMP: Pairing Confirm (0x03) len 16
        Confim value: f6a5e372c74e1c8a3cd32ad863e56129
> HCI Event: Number of Completed Packets (0x13) plen 5    #179 [hci1] 13.555119
        Num handles: 1
        Handle: 1209 Address: DF:A9:FF:F6:B1:1A (OUI DF-A9-FF)
        Count: 1
        #178: len 21 (1 Kb/s)
        Latency: 155 msec (69-173 msec ~160 msec)
> ACL Data RX: Handle 1209 flags 0x02 dlen 21             #180 [hci1] 13.555510
      SMP: Pairing Random (0x04) len 16
        Random value: e210782834a291f00000000000000000
< HCI Command: Host Number of Com.. (0x03|0x0035) plen 5  #181 [hci1] 13.559808
        Num handles: 1
        Handle: 1209 Address: DF:A9:FF:F6:B1:1A (OUI DF-A9-FF)
        Count: 1
< ACL Data TX: Handle 1209 flags 0x00 dlen 21             #182 [hci1] 13.559980
      SMP: Pairing Random (0x04) len 16
        Random value: 25a9493fd3ce4faf02be7293595bb7c6
> HCI Event: Number of Completed Packets (0x13) plen 5    #183 [hci1] 13.729837
        Num handles: 1
        Handle: 1209 Address: DF:A9:FF:F6:B1:1A (OUI DF-A9-FF)
        Count: 1
        #182: len 21 (0 Kb/s)
        Latency: 169 msec (69-173 msec ~165 msec)
> ACL Data RX: Handle 1209 flags 0x02 dlen 21             #184 [hci1] 13.817739
      SMP: Pairing Confirm (0x03) len 16
        Confim value: d123cfb1d9882ef7575bcb93f14889bc
< HCI Command: Host Number of Com.. (0x03|0x0035) plen 5  #185 [hci1] 13.819173
        Num handles: 1
        Handle: 1209 Address: DF:A9:FF:F6:B1:1A (OUI DF-A9-FF)
        Count: 1
< ACL Data TX: Handle 1209 flags 0x00 dlen 21             #186 [hci1] 13.819219
      SMP: Pairing Confirm (0x03) len 16
        Confim value: 25698f3839802906e78750996776aa3f
> HCI Event: Number of Completed Packets (0x13) plen 5    #187 [hci1] 13.992536
        Num handles: 1
        Handle: 1209 Address: DF:A9:FF:F6:B1:1A (OUI DF-A9-FF)
        Count: 1
        #186: len 21 (0 Kb/s)
        Latency: 173 msec (69-173 msec ~169 msec)
> ACL Data RX: Handle 1209 flags 0x02 dlen 21             #188 [hci1] 13.992929
      SMP: Pairing Random (0x04) len 16
        Random value: 1b83f687cac8a9360000000000000000
< HCI Command: Host Number of Com.. (0x03|0x0035) plen 5  #189 [hci1] 13.999837
        Num handles: 1
        Handle: 1209 Address: DF:A9:FF:F6:B1:1A (OUI DF-A9-FF)
        Count: 1
< ACL Data TX: Handle 1209 flags 0x00 dlen 21             #190 [hci1] 14.000004
      SMP: Pairing Random (0x04) len 16
        Random value: 58f6b41f855a6f6c3560debd84e2affc
> HCI Event: Number of Completed Packets (0x13) plen 5    #191 [hci1] 14.167388
        Num handles: 1
        Handle: 1209 Address: DF:A9:FF:F6:B1:1A (OUI DF-A9-FF)
        Count: 1
        #190: len 21 (1 Kb/s)
        Latency: 167 msec (69-173 msec ~168 msec)
> ACL Data RX: Handle 1209 flags 0x02 dlen 21             #192 [hci1] 14.255241
      SMP: Pairing Confirm (0x03) len 16
        Confim value: 2160e4c2e512e63c6186be04aa48bb3a
< HCI Command: Host Number of Com.. (0x03|0x0035) plen 5  #193 [hci1] 14.259412
        Num handles: 1
        Handle: 1209 Address: DF:A9:FF:F6:B1:1A (OUI DF-A9-FF)
        Count: 1
< ACL Data TX: Handle 1209 flags 0x00 dlen 21             #194 [hci1] 14.259507
      SMP: Pairing Confirm (0x03) len 16
        Confim value: 96e198ed32d2bf86d7d36e51537545b5
> HCI Event: Number of Completed Packets (0x13) plen 5    #195 [hci1] 14.430059
        Num handles: 1
        Handle: 1209 Address: DF:A9:FF:F6:B1:1A (OUI DF-A9-FF)
        Count: 1
        #194: len 21 (0 Kb/s)
        Latency: 170 msec (69-173 msec ~169 msec)
> ACL Data RX: Handle 1209 flags 0x02 dlen 21             #196 [hci1] 14.430419
      SMP: Pairing Random (0x04) len 16
        Random value: a3986b148110637d0000000000000000
< HCI Command: Host Number of Com.. (0x03|0x0035) plen 5  #197 [hci1] 14.439893
        Num handles: 1
        Handle: 1209 Address: DF:A9:FF:F6:B1:1A (OUI DF-A9-FF)
        Count: 1
< ACL Data TX: Handle 1209 flags 0x00 dlen 21             #198 [hci1] 14.440099
      SMP: Pairing Random (0x04) len 16
        Random value: b67e7216d5bf664139eda2b542549666
> HCI Event: Number of Completed Packets (0x13) plen 5    #199 [hci1] 14.604872
        Num handles: 1
        Handle: 1209 Address: DF:A9:FF:F6:B1:1A (OUI DF-A9-FF)
        Count: 1
        #198: len 21 (1 Kb/s)
        Latency: 164 msec (69-173 msec ~167 msec)
> ACL Data RX: Handle 1209 flags 0x02 dlen 21             #200 [hci1] 14.692771
      SMP: Pairing Confirm (0x03) len 16
        Confim value: 795e9f50117dd7dd9de3d20c49fee2bd
< HCI Command: Host Number of Com.. (0x03|0x0035) plen 5  #201 [hci1] 14.699272
        Num handles: 1
        Handle: 1209 Address: DF:A9:FF:F6:B1:1A (OUI DF-A9-FF)
        Count: 1
< ACL Data TX: Handle 1209 flags 0x00 dlen 21             #202 [hci1] 14.699334
      SMP: Pairing Confirm (0x03) len 16
        Confim value: c81343047689c84603c4c60ec7f3cf18
> HCI Event: Number of Completed Packets (0x13) plen 5    #203 [hci1] 14.867572
        Num handles: 1
        Handle: 1209 Address: DF:A9:FF:F6:B1:1A (OUI DF-A9-FF)
        Count: 1
        #202: len 21 (1 Kb/s)
        Latency: 168 msec (69-173 msec ~167 msec)
> ACL Data RX: Handle 1209 flags 0x02 dlen 21             #204 [hci1] 14.867938
      SMP: Pairing Random (0x04) len 16
        Random value: bcb86698a39bf0990000000000000000
< HCI Command: Host Number of Com.. (0x03|0x0035) plen 5  #205 [hci1] 14.879307
        Num handles: 1
        Handle: 1209 Address: DF:A9:FF:F6:B1:1A (OUI DF-A9-FF)
        Count: 1
< ACL Data TX: Handle 1209 flags 0x00 dlen 21             #206 [hci1] 14.879348
      SMP: Pairing Random (0x04) len 16
        Random value: ed17f76500c95219dd01e09d1e63f87b
> HCI Event: Number of Completed Packets (0x13) plen 5    #207 [hci1] 15.042595
        Num handles: 1
        Handle: 1209 Address: DF:A9:FF:F6:B1:1A (OUI DF-A9-FF)
        Count: 1
        #206: len 21 (1 Kb/s)
        Latency: 163 msec (69-173 msec ~165 msec)
> ACL Data RX: Handle 1209 flags 0x02 dlen 21             #208 [hci1] 15.130216
      SMP: Pairing Confirm (0x03) len 16
        Confim value: 3ad1486979b19109f3c86f5e2f5934ef
< HCI Command: Host Number of Com.. (0x03|0x0035) plen 5  #209 [hci1] 15.139621
        Num handles: 1
        Handle: 1209 Address: DF:A9:FF:F6:B1:1A (OUI DF-A9-FF)
        Count: 1
< ACL Data TX: Handle 1209 flags 0x00 dlen 21             #210 [hci1] 15.139778
      SMP: Pairing Confirm (0x03) len 16
        Confim value: 248f45eb9647275a145589537f202cbf
> HCI Event: Number of Completed Packets (0x13) plen 5    #211 [hci1] 15.305029
        Num handles: 1
        Handle: 1209 Address: DF:A9:FF:F6:B1:1A (OUI DF-A9-FF)
        Count: 1
        #210: len 21 (1 Kb/s)
        Latency: 165 msec (69-173 msec ~165 msec)
> ACL Data RX: Handle 1209 flags 0x02 dlen 21             #212 [hci1] 15.305412
      SMP: Pairing Random (0x04) len 16
        Random value: 08a174019b0361d60000000000000000
< HCI Command: Host Number of Com.. (0x03|0x0035) plen 5  #213 [hci1] 15.319896
        Num handles: 1
        Handle: 1209 Address: DF:A9:FF:F6:B1:1A (OUI DF-A9-FF)
        Count: 1
< ACL Data TX: Handle 1209 flags 0x00 dlen 21             #214 [hci1] 15.320056
      SMP: Pairing Random (0x04) len 16
        Random value: 81d35d47e1f6006d79c974bd9d9e1ee3
> HCI Event: Number of Completed Packets (0x13) plen 5    #215 [hci1] 15.479905
        Num handles: 1
        Handle: 1209 Address: DF:A9:FF:F6:B1:1A (OUI DF-A9-FF)
        Count: 1
        #214: len 21 (1 Kb/s)
        Latency: 159 msec (69-173 msec ~162 msec)
> ACL Data RX: Handle 1209 flags 0x02 dlen 21             #216 [hci1] 15.567656
      SMP: Pairing Confirm (0x03) len 16
        Confim value: 3bb24d379d69ef3265cdf6de8888cdff
< HCI Command: Host Number of Com.. (0x03|0x0035) plen 5  #217 [hci1] 15.579636
        Num handles: 1
        Handle: 1209 Address: DF:A9:FF:F6:B1:1A (OUI DF-A9-FF)
        Count: 1
< ACL Data TX: Handle 1209 flags 0x00 dlen 21             #218 [hci1] 15.579801
      SMP: Pairing Confirm (0x03) len 16
        Confim value: 72ffb978db6845ab22298af27e9de60e
> HCI Event: Number of Completed Packets (0x13) plen 5    #219 [hci1] 15.742551
        Num handles: 1
        Handle: 1209 Address: DF:A9:FF:F6:B1:1A (OUI DF-A9-FF)
        Count: 1
        #218: len 21 (1 Kb/s)
        Latency: 162 msec (69-173 msec ~162 msec)
> ACL Data RX: Handle 1209 flags 0x02 dlen 21             #220 [hci1] 15.742926
      SMP: Pairing Random (0x04) len 16
        Random value: 6833463c3f964d1f0000000000000000
< HCI Command: Host Number of Com.. (0x03|0x0035) plen 5  #221 [hci1] 15.760005
        Num handles: 1
        Handle: 1209 Address: DF:A9:FF:F6:B1:1A (OUI DF-A9-FF)
        Count: 1
< ACL Data TX: Handle 1209 flags 0x00 dlen 21             #222 [hci1] 15.760060
      SMP: Pairing Random (0x04) len 16
        Random value: e7f7e0c2476823e41736a7e381bafb7c
> HCI Event: Number of Completed Packets (0x13) plen 5    #223 [hci1] 15.917403
        Num handles: 1
        Handle: 1209 Address: DF:A9:FF:F6:B1:1A (OUI DF-A9-FF)
        Count: 1
        #222: len 21 (1 Kb/s)
        Latency: 157 msec (69-173 msec ~160 msec)
> ACL Data RX: Handle 1209 flags 0x02 dlen 21             #224 [hci1] 16.005126
      SMP: Pairing Confirm (0x03) len 16
        Confim value: cc5bddf1ffce60a0200c3472275e0f08
< HCI Command: Host Number of Com.. (0x03|0x0035) plen 5  #225 [hci1] 16.019666
        Num handles: 1
        Handle: 1209 Address: DF:A9:FF:F6:B1:1A (OUI DF-A9-FF)
        Count: 1
< ACL Data TX: Handle 1209 flags 0x00 dlen 21             #226 [hci1] 16.019811
      SMP: Pairing Confirm (0x03) len 16
        Confim value: 0fa9eed49b21620ffcf1853787030692
> HCI Event: Number of Completed Packets (0x13) plen 5    #227 [hci1] 16.180068
        Num handles: 1
        Handle: 1209 Address: DF:A9:FF:F6:B1:1A (OUI DF-A9-FF)
        Count: 1
        #226: len 21 (1 Kb/s)
        Latency: 160 msec (69-173 msec ~160 msec)
> ACL Data RX: Handle 1209 flags 0x02 dlen 21             #228 [hci1] 16.180459
      SMP: Pairing Random (0x04) len 16
        Random value: e73895f37c35d6490000000000000000
