Bluetooth monitor ver 5.84
btmon[1327470]: = Note: Linux version 6.8.0-83-generic (x86_64)                                                          0.232634
btmon[1327470]: = Note: Bluetooth subsystem version 2.22                                                                 0.232636
= New Index: 00:00:00:00:00:00 (Primary,UART,hci0)                                                                       0.232637
= Open Index: 00:00:00:00:00:00                                                                                          0.737084
= Index Info: 00:00:00:00:00:00 (Nordic Semiconductor ASA)                                                               0.737114
zephyr.exe[1327472]: @ USER Open: main (privileged) version 2.22                                                {0x0001} 0.737117
zephyr.exe[1327472]: < HCI Command: Reset (0x03|0x0003) plen 0                                                        #1 0.737433
> HCI Event: Command Complete (0x0e) plen 4                                                                           #2 0.737939
      Reset (0x03|0x0003) ncmd 1
        Status: Success (0x00)
zephyr.exe[1327472]: < HCI Command: Read Local Supported Features (0x04|0x0003) plen 0                                #3 0.757087
> HCI Event: Command Complete (0x0e) plen 12                                                                          #4 0.757600
      Read Local Supported Features (0x04|0x0003) ncmd 1
        Status: Success (0x00)
        Features: 0x00 0x00 0x00 0x00 0x60 0x00 0x00 0x00
          BR/EDR Not Supported
          LE Supported (Controller)
zephyr.exe[1327472]: < HCI Command: Read Local Version Information (0x04|0x0001) plen 0                               #5 0.777088
> HCI Event: Command Complete (0x0e) plen 12                                                                          #6 0.777580
      Read Local Version Information (0x04|0x0001) ncmd 1
        Status: Success (0x00)
        HCI version: Reserved (0x0e) - Revision 12520 (0x30e8)
        LMP version: Reserved (0x0e) - Subversion 12520 (0x30e8)
        Manufacturer: Nordic Semiconductor ASA (89)
zephyr.exe[1327472]: < HCI Command: Read Local Supported Commands (0x04|0x0002) plen 0                                #7 0.797087
> HCI Event: Command Complete (0x0e) plen 68                                                                          #8 0.798229
      Read Local Supported Commands (0x04|0x0002) ncmd 1
        Status: Success (0x00)
        Commands: 119 entries
          Disconnect (Octet 0 - Bit 5)
          Read Remote Version Information (Octet 2 - Bit 7)
          Set Event Mask (Octet 5 - Bit 6)
          Reset (Octet 5 - Bit 7)
          Read Connection Accept Timeout (Octet 7 - Bit 2)
          Write Connection Accept Timeout (Octet 7 - Bit 3)
          Read Transmit Power Level (Octet 10 - Bit 2)
          Set Controller To Host Flow Control (Octet 10 - Bit 5)
          Host Buffer Size (Octet 10 - Bit 6)
          Host Number of Completed Packets (Octet 10 - Bit 7)
          Read Local Version Information (Octet 14 - Bit 3)
          Read Local Supported Features (Octet 14 - Bit 5)
          Read BD ADDR (Octet 15 - Bit 1)
          Read RSSI (Octet 15 - Bit 5)
          Set Event Mask Page 2 (Octet 22 - Bit 2)
          LE Set Event Mask (Octet 25 - Bit 0)
          LE Read Buffer Size (Octet 25 - Bit 1)
          LE Read Local Supported Features (Octet 25 - Bit 2)
          LE Set Random Address (Octet 25 - Bit 4)
          LE Set Advertising Parameters (Octet 25 - Bit 5)
          LE Read Advertising Channel TX Power (Octet 25 - Bit 6)
          LE Set Advertising Data (Octet 25 - Bit 7)
          LE Set Scan Response Data (Octet 26 - Bit 0)
          LE Set Advertise Enable (Octet 26 - Bit 1)
          LE Set Scan Parameters (Octet 26 - Bit 2)
          LE Set Scan Enable (Octet 26 - Bit 3)
          LE Create Connection (Octet 26 - Bit 4)
          LE Create Connection Cancel (Octet 26 - Bit 5)
          LE Read Accept List Size (Octet 26 - Bit 6)
          LE Clear Accept List (Octet 26 - Bit 7)
          LE Add Device To Accept List (Octet 27 - Bit 0)
          LE Remove Device From Accept List (Octet 27 - Bit 1)
          LE Connection Update (Octet 27 - Bit 2)
          LE Set Host Channel Classification (Octet 27 - Bit 3)
          LE Read Channel Map (Octet 27 - Bit 4)
          LE Read Remote Used Features (Octet 27 - Bit 5)
          LE Encrypt (Octet 27 - Bit 6)
          LE Rand (Octet 27 - Bit 7)
          LE Start Encryption (Octet 28 - Bit 0)
          LE Long Term Key Request Reply (Octet 28 - Bit 1)
          LE Long Term Key Request Neg Reply (Octet 28 - Bit 2)
          LE Read Supported States (Octet 28 - Bit 3)
          LE Receiver Test (Octet 28 - Bit 4)
          LE Transmitter Test (Octet 28 - Bit 5)
          LE Test End (Octet 28 - Bit 6)
          Read Authenticated Payload Timeout (Octet 32 - Bit 4)
          Write Authenticated Payload Timeout (Octet 32 - Bit 5)
          LE Set Data Length (Octet 33 - Bit 6)
          LE Read Suggested Default Data Length (Octet 33 - Bit 7)
          LE Write Suggested Default Data Length (Octet 34 - Bit 0)
          LE Add Device To Resolving List (Octet 34 - Bit 3)
          LE Remove Device From Resolving List (Octet 34 - Bit 4)
          LE Clear Resolving List (Octet 34 - Bit 5)
          LE Read Resolving List Size (Octet 34 - Bit 6)
          LE Set Address Resolution Enable (Octet 35 - Bit 1)
          LE Set Resolvable Private Address Timeout (Octet 35 - Bit 2)
          LE Read Maximum Data Length (Octet 35 - Bit 3)
          LE Read PHY (Octet 35 - Bit 4)
          LE Set Default PHY (Octet 35 - Bit 5)
          LE Set PHY (Octet 35 - Bit 6)
          LE Enhanced Receiver Test (Octet 35 - Bit 7)
          LE Enhanced Transmitter Test (Octet 36 - Bit 0)
          LE Set Advertising Set Random Address (Octet 36 - Bit 1)
          LE Set Extended Advertising Parameters (Octet 36 - Bit 2)
          LE Set Extended Advertising Data (Octet 36 - Bit 3)
          LE Set Extended Scan Response Data (Octet 36 - Bit 4)
          LE Set Extended Advertising Enable (Octet 36 - Bit 5)
          LE Read Maximum Advertising Data Length (Octet 36 - Bit 6)
          LE Read Number of Supported Advertising Sets (Octet 36 - Bit 7)
          LE Remove Advertising Set (Octet 37 - Bit 0)
          LE Clear Advertising Sets (Octet 37 - Bit 1)
          LE Set Periodic Advertising Parameters (Octet 37 - Bit 2)
          LE Set Periodic Advertising Data (Octet 37 - Bit 3)
          LE Set Periodic Advertising Enable (Octet 37 - Bit 4)
          LE Set Extended Scan Parameters (Octet 37 - Bit 5)
          LE Set Extended Scan Enable (Octet 37 - Bit 6)
          LE Extended Create Connection (Octet 37 - Bit 7)
          LE Periodic Advertising Create Sync (Octet 38 - Bit 0)
          LE Periodic Advertising Create Sync Cancel (Octet 38 - Bit 1)
          LE Periodic Advertising Terminate Sync (Octet 38 - Bit 2)
          LE Add Device To Periodic Advertiser List (Octet 38 - Bit 3)
          LE Remove Device From Periodic Advertiser List (Octet 38 - Bit 4)
          LE Clear Periodic Advertiser List (Octet 38 - Bit 5)
          LE Read Periodic Advertiser List Size (Octet 38 - Bit 6)
          LE Read Transmit Power (Octet 38 - Bit 7)
          LE Read RF Path Compensation (Octet 39 - Bit 0)
          LE Write RF Path Compensation (Octet 39 - Bit 1)
          LE Set Privacy Mode (Octet 39 - Bit 2)
          LE Periodic Advertising Receive Enable (Octet 40 - Bit 5)
          LE Periodic Advertising Sync Transfer (Octet 40 - Bit 6)
          LE Periodic Advertising Set Info Transfer (Octet 40 - Bit 7)
          LE Periodic Advertising Sync Transfer Parameters (Octet 41 - Bit 0)
          LE Set Default Periodic Advertisng Sync Transfer Parameters (Octet 41 - Bit 1)
          LE Read Buffer v2 (Octet 41 - Bit 5)
          LE Read ISO TX Sync (Octet 41 - Bit 6)
          LE Set Connected Isochronous Group Parameters (Octet 41 - Bit 7)
          LE Set Connected Isochronous Group Parameters Test (Octet 42 - Bit 0)
          LE Create Connected Isochronous Stream (Octet 42 - Bit 1)
          LE Remove Connected Isochronous Group (Octet 42 - Bit 2)
          LE Accept Connected Isochronous Stream Request (Octet 42 - Bit 3)
          LE Reject Connected Isochronous Stream Request (Octet 42 - Bit 4)
          LE Create Broadcast Isochronous Group (Octet 42 - Bit 5)
          LE Create Broadcast Isochronous Group Test (Octet 42 - Bit 6)
          LE Terminate Broadcast Isochronous Group (Octet 42 - Bit 7)
          LE Broadcast Isochronous Group Create Sync (Octet 43 - Bit 0)
          LE Broadcast Isochronous Group Terminate Sync (Octet 43 - Bit 1)
          LE Request Peer SCA (Octet 43 - Bit 2)
          LE Setup Isochronous Data Path (Octet 43 - Bit 3)
          LE Remove Isochronous Data Path (Octet 43 - Bit 4)
          LE Isochronous Transmit Test (Octet 43 - Bit 5)
          LE Isochronous Receive Test (Octet 43 - Bit 6)
          LE Isochronous Read Test Counters (Octet 43 - Bit 7)
          LE Isochronous Read Test Counters (Octet 44 - Bit 0)
          LE Set Host Feature (Octet 44 - Bit 1)
          LE Read ISO link quality (Octet 44 - Bit 2)
          Octet 45 - Bit 6 
          Octet 46 - Bit 0 
          Octet 46 - Bit 1 
          Octet 46 - Bit 2 
zephyr.exe[1327472]: < HCI Command: Host Buffer Size (0x03|0x0033) plen 7                                             #9 0.817020
        ACL MTU: 255  ACL max packet: 16
        SCO MTU: 0    SCO max packet: 0
> HCI Event: Command Complete (0x0e) plen 4                                                                          #10 0.817510
      Host Buffer Size (0x03|0x0033) ncmd 1
        Status: Success (0x00)
zephyr.exe[1327472]: < HCI Command: Set Controller To Host Flow Control (0x03|0x0031) plen 1                         #11 0.837090
        Flow control: ACL Data Packets (0x01)
> HCI Event: Command Complete (0x0e) plen 4                                                                          #12 0.837554
      Set Controller To Host Flow Control (0x03|0x0031) ncmd 1
        Status: Success (0x00)
zephyr.exe[1327472]: < HCI Command: LE Read Local Supported Features (0x08|0x0003) plen 0                            #13 0.857093
> HCI Event: Command Complete (0x0e) plen 12                                                                         #14 0.857676
      LE Read Local Supported Features (0x08|0x0003) ncmd 1
        Status: Success (0x00)
        Features: 0xfd 0x79 0x00 0xf7 0x30 0x01 0x00 0x00
          LE Encryption
          Extended Reject Indication
          Peripheral-initiated Features Exchange
          LE Ping
          LE Data Packet Length Extension
          LL Privacy
          Extended Scanner Filter Policies
          LE 2M PHY
          LE Coded PHY
          LE Extended Advertising
          LE Periodic Advertising
          Channel Selection Algorithm #2
          Periodic Advertising Sync Transfer - Sender
          Periodic Advertising Sync Transfer - Recipient
          Sleep Clock Accuracy Updates
          Connected Isochronous Stream - Central
          Connected Isochronous Stream - Peripheral
          Isochronous Broadcaster
          Synchronized Receiver
          Periodic Advertising ADI support
          Connection Subrating
          Unknown features (0x0000010000000000)
zephyr.exe[1327472]: < HCI Command: LE Set Host Feature (0x08|0x0074) plen 2                                         #15 0.877084
        Bit Number: 32
          Connected Isochronous Stream (Host Support)
        Bit Value: 1
> HCI Event: Command Complete (0x0e) plen 4                                                                          #16 0.877625
      LE Set Host Feature (0x08|0x0074) ncmd 1
        Status: Success (0x00)
zephyr.exe[1327472]: < HCI Command: LE Read Buffer v2 (0x08|0x0060) plen 0                                           #17 0.897085
> HCI Event: Command Complete (0x0e) plen 10                                                                         #18 0.897581
      LE Read Buffer v2 (0x08|0x0060) ncmd 1
        Status: Success (0x00)
        ACL MTU: 27
        ACL max packet: 3
        ISO MTU: 318
        ISO max packet: 3
zephyr.exe[1327472]: < HCI Command: LE Read Maximum Advertising Data Length (0x08|0x003a) plen 0                     #19 0.917106
> HCI Event: Command Complete (0x0e) plen 6                                                                          #20 0.917618
      LE Read Maximum Advertising Data Length (0x08|0x003a) ncmd 1
        Status: Success (0x00)
        Max length: 1650
zephyr.exe[1327472]: < HCI Command: LE Read Supported States (0x08|0x001c) plen 0                                    #21 0.937029
> HCI Event: Command Complete (0x0e) plen 12                                                                         #22 0.937554
      LE Read Supported States (0x08|0x001c) ncmd 1
        Status: Success (0x00)
        States: 0x000003ff3e0306ff
          Non-connectable Advertising State
          Scannable Advertising State
          Connectable Advertising State
          High Duty Cycle Directed Advertising State
          Passive Scanning State
          Active Scanning State
          Initiating State
            and Connection State (Central Role)
          Connection State (Peripheral Role)
          Scannable Advertising State
            and Passive Scanning State
          Connectable Advertising State
            and Passive Scanning State
          Non-connectable Advertising State
            and Initiating State
          Scannable Advertising State
            and Initiating State
          Active Scanning State
            and Connection State (Central Role)
          Passive Scanning State
            and Connection State (Peripheral Role)
          Active Scanning State
            and Connection State (Peripheral Role)
          Initiating State
            and Connection State (Central Role)
            and Central Role & Central Role
          Low Duty Cycle Directed Advertising State
          Connectable Advertising State
            and Initiating State
            and Central Role & Peripheral Role
          High Duty Cycle Directed Advertising State
            and Initiating State
            and Central Role & Peripheral Role
          Low Duty Cycle Directed Advertising State
            and Initiating State
            and Central Role & Peripheral Role
          Connectable Advertising State
            and Connection State (Central Role)
            and Central Role & Peripheral Role
          High Duty Cycle Directed Advertising State
            and Connection State (Central Role)
            and Central Role & Peripheral Role
          Low Duty Cycle Directed Advertising State
            and Connection State (Central Role)
            and Central Role & Peripheral Role
          Connectable Advertising State
            and Connection State (Peripheral Role)
            and Central Role & Peripheral Role
          High Duty Cycle Directed Advertising State
            and Connection State (Peripheral Role)
            and Peripheral Role & Peripheral Role
          Low Duty Cycle Directed Advertising State
            and Connection State (Peripheral Role)
            and Peripheral Role & Peripheral Role
          Initiating State
            and Connection State (Peripheral Role)
            and Central Role & Peripheral Role
zephyr.exe[1327472]: < HCI Command: LE Read Maximum Data Length (0x08|0x002f) plen 0                                 #23 0.957092
> HCI Event: Command Complete (0x0e) plen 12                                                                         #24 0.957703
      LE Read Maximum Data Length (0x08|0x002f) ncmd 1
        Status: Success (0x00)
        Max TX octets: 251
        Max TX time: 2704
        Max RX octets: 251
        Max RX time: 2704
zephyr.exe[1327472]: < HCI Command: LE Write Suggested Default Data Length (0x08|0x0024) plen 4                      #25 0.977082
        TX octets: 251
        TX time: 2704
> HCI Event: Command Complete (0x0e) plen 4                                                                          #26 0.977571
      LE Write Suggested Default Data Length (0x08|0x0024) ncmd 1
        Status: Success (0x00)
zephyr.exe[1327472]: < HCI Command: LE Set Resolvable Private Address Timeout (0x08|0x002e) plen 2                   #27 0.997089
        Timeout: 900 seconds
> HCI Event: Command Complete (0x0e) plen 4                                                                          #28 0.997641
      LE Set Resolvable Private Address Timeout (0x08|0x002e) ncmd 1
        Status: Success (0x00)
zephyr.exe[1327472]: < HCI Command: LE Read Resolving List Size (0x08|0x002a) plen 0                                 #29 1.017061
> HCI Event: Command Complete (0x0e) plen 5                                                                          #30 1.017548
      LE Read Resolving List Size (0x08|0x002a) ncmd 1
        Status: Success (0x00)
        Size: 8
zephyr.exe[1327472]: < HCI Command: LE Set Event Mask (0x08|0x0001) plen 8                                           #31 1.037088
        Mask: 0x000002023f87fa5e
          LE Advertising Report
          LE Connection Update Complete
          LE Read Remote Used Features Complete
          LE Long Term Key Request
          LE Data Length Change
          LE Enhanced Connection Complete
          LE PHY Update Complete
          LE Extended Advertising Report
          LE Periodic Advertising Sync Established
          LE Periodic Advertising Report
          LE Periodic Advertising Sync Lost
          LE Extended Scan Timeout
          LE Extended Advertising Set Terminated
          LE Scan Request Received
          LE Periodic Advertising Sync Transfer Rvc
          LE CIS Established
          LE CIS Request
          LE Create BIG Complete
          LE Terminate BIG Complete
          LE BIG Sync Established Complete
          LE BIG Sync Lost
          LE BIG Info Advertising Report
          Unknown mask (0x0000020000000000)
> HCI Event: Command Complete (0x0e) plen 4                                                                          #32 1.037674
      LE Set Event Mask (0x08|0x0001) ncmd 1
        Status: Success (0x00)
zephyr.exe[1327472]: < HCI Command: Set Event Mask (0x03|0x0001) plen 8                                              #33 1.057092
        Mask: 0x2000800002008890
          Disconnection Complete
          Encryption Change
          Read Remote Version Information Complete
          Hardware Error
          Data Buffer Overflow
          Encryption Key Refresh Complete
          LE Meta
> HCI Event: Command Complete (0x0e) plen 4                                                                          #34 1.057605
      Set Event Mask (0x03|0x0001) ncmd 1
        Status: Success (0x00)
zephyr.exe[1327472]: < HCI Command: Read BD ADDR (0x04|0x0009) plen 0                                                #35 1.077081
> HCI Event: Command Complete (0x0e) plen 10                                                                         #36 1.077637
      Read BD ADDR (0x04|0x0009) ncmd 1
        Status: Success (0x00)
        Address: 00:00:00:00:00:00 (OUI 00-00-00)
zephyr.exe[1327472]: < HCI Command: LE Set Random Address (0x08|0x0005) plen 6                                       #37 1.097081
        Address: D5:B6:CC:31:DB:3B (Static)
> HCI Event: Command Complete (0x0e) plen 4                                                                          #38 1.097626
      LE Set Random Address (0x08|0x0005) ncmd 1
        Status: Success (0x00)
zephyr.exe[1327472]: < HCI Command: LE Set Random Address (0x08|0x0005) plen 6                                       #39 1.197043
        Address: 48:61:8E:DB:C6:F9 (Resolvable)
> HCI Event: Command Complete (0x0e) plen 4                                                                          #40 1.199468
      LE Set Random Address (0x08|0x0005) ncmd 1
        Status: Success (0x00)
zephyr.exe[1327472]: < HCI Command: LE Set Extended Advertising Parameters (0x08|0x0036) plen 25                     #41 6.057187
        Handle: 0x00
        Properties: 0x0013
          Connectable
          Scannable
          Use legacy advertising PDUs: ADV_IND
        Min advertising interval: 100.000 msec (0x00a0)
        Max advertising interval: 150.000 msec (0x00f0)
        Channel map: 37, 38, 39 (0x07)
        Own address type: Random (0x01)
        Peer address type: Public (0x00)
        Peer address: 00:00:00:00:00:00 (OUI 00-00-00)
        Filter policy: Allow Scan Request from Any, Allow Connect Request from Any (0x00)
        TX power: Host has no preference (0x7f)
        Primary PHY: LE 1M (0x01)
        Secondary max skip: 0x00
        Secondary PHY: LE 1M (0x01)
        SID: 0x00
        Scan request notifications: Disabled (0x00)
> HCI Event: Command Complete (0x0e) plen 5                                                                          #42 6.058132
      LE Set Extended Advertising Parameters (0x08|0x0036) ncmd 1
        Status: Success (0x00)
        TX power (selected): 0 dbm (0x00)
zephyr.exe[1327472]: < HCI Command: LE Set Advertising Set Random Address (0x08|0x0035) plen 7                       #43 6.077155
        Advertising handle: 0x00
        Advertising random address: D5:B6:CC:31:DB:3B (Static)
> HCI Event: Command Complete (0x0e) plen 4                                                                          #44 6.077650
      LE Set Advertising Set Random Address (0x08|0x0035) ncmd 1
        Status: Success (0x00)
zephyr.exe[1327472]: < HCI Command: LE Set Extended Advertising Data (0x08|0x0037) plen 22                           #45 6.097148
        Handle: 0x00
        Operation: Complete extended advertising data (0x03)
        Fragment preference: Minimize fragmentation (0x01)
        Data length: 0x12
        Flags: 0x04
          BR/EDR Not Supported
        Name (complete): Tester_2CB6EE
> HCI Event: Command Complete (0x0e) plen 4                                                                          #46 6.097800
      LE Set Extended Advertising Data (0x08|0x0037) ncmd 1
        Status: Success (0x00)
zephyr.exe[1327472]: < HCI Command: LE Set Extended Scan Response Data (0x08|0x0038) plen 4                          #47 6.117179
        Handle: 0x00
        Operation: Complete scan response data (0x03)
        Fragment preference: Minimize fragmentation (0x01)
        Data length: 0x00
> HCI Event: Command Complete (0x0e) plen 4                                                                          #48 6.117667
      LE Set Extended Scan Response Data (0x08|0x0038) ncmd 1
        Status: Success (0x00)
zephyr.exe[1327472]: < HCI Command: LE Set Extended Advertising Enable (0x08|0x0039) plen 6                          #49 6.137170
        Extended advertising: Enabled (0x01)
        Number of sets: 1 (0x01)
        Entry 0
          Handle: 0x00
          Duration: 0 ms (0x00)
          Max ext adv events: 0
> HCI Event: Command Complete (0x0e) plen 4                                                                          #50 6.137762
      LE Set Extended Advertising Enable (0x08|0x0039) ncmd 1
        Status: Success (0x00)
> HCI Event: LE Meta Event (0x3e) plen 31                                                                            #51 6.248379
      LE Enhanced Connection Complete (0x0a)
        Status: Success (0x00)
        Handle: 1047
        Role: Peripheral (0x01)
        Peer address type: Public (0x00)
        Peer address: C0:07:E8:2C:B6:EE (OUI C0-07-E8)
        Local resolvable private address: 00:00:00:00:00:00 (Non-Resolvable)
        Peer resolvable private address: 00:00:00:00:00:00 (Non-Resolvable)
        Connection interval: 62.50 msec (0x0032)
        Connection latency: 0 (0x0000)
        Supervision timeout: 20000 msec (0x07d0)
        Central clock accuracy: 0x07
> HCI Event: LE Meta Event (0x3e) plen 6                                                                             #52 6.248384
      LE Advertising Set Terminated (0x12)
        Status: Success (0x00)
        Handle: 0
        Connection handle: 1047
        Number of completed extended advertising events: 0
zephyr.exe[1327472]: < HCI Command: LE Read Remote Used Features (0x08|0x0016) plen 2                                #53 6.257261
        Handle: 1047 Address: C0:07:E8:2C:B6:EE (OUI C0-07-E8)
> HCI Event: Command Status (0x0f) plen 4                                                                            #54 6.257887
      LE Read Remote Used Features (0x08|0x0016) ncmd 1
        Status: Success (0x00)
zephyr.exe[1327472]: < HCI Command: LE Set PHY (0x08|0x0032) plen 7                                                  #55 6.277162
        Handle: 1047 Address: C0:07:E8:2C:B6:EE (OUI C0-07-E8)
        All PHYs preference: 0x00
        TX PHYs preference: 0x02
          LE 2M
        RX PHYs preference: 0x02
          LE 2M
        PHY options preference: Reserved (0x0000)
> HCI Event: Command Status (0x0f) plen 4                                                                            #56 6.277796
      LE Set PHY (0x08|0x0032) ncmd 1
        Status: Success (0x00)
> HCI Event: LE Meta Event (0x3e) plen 12                                                                            #57 6.437206
      LE Read Remote Used Features (0x04)
        Status: Success (0x00)
        Handle: 1047 Address: C0:07:E8:2C:B6:EE (OUI C0-07-E8)
        Features: 0x2d 0x49 0x01 0xf7 0xef 0x39 0x00 0x80
          LE Encryption
          Extended Reject Indication
          Peripheral-initiated Features Exchange
          LE Data Packet Length Extension
          LE 2M PHY
          LE Coded PHY
          Channel Selection Algorithm #2
          Minimum Number of Used Channels Procedure
          Periodic Advertising Sync Transfer - Sender
          Periodic Advertising Sync Transfer - Recipient
          Sleep Clock Accuracy Updates
          Connected Isochronous Stream - Central
          Connected Isochronous Stream - Peripheral
          Isochronous Broadcaster
          Synchronized Receiver
          Connected Isochronous Stream (Host Support)
          LE Power Control Request
          LE Power Control Request
          LE Path Loss Monitoring
          Connection Subrating
          Connection Subrating (Host Support)
          Channel Classification
          Unknown features (0x8000390000000000)
> HCI Event: LE Meta Event (0x3e) plen 6                                                                             #58 6.936510
      LE PHY Update Complete (0x0c)
        Status: Success (0x00)
        Handle: 1047 Address: C0:07:E8:2C:B6:EE (OUI C0-07-E8)
        TX PHY: LE 2M (0x02)
        RX PHY: LE 2M (0x02)
> ACL Data RX: Handle 1047 flags 0x02 dlen 11                                                                        #59 7.186880
      SMP: Pairing Request (0x01) len 6
        IO capability: KeyboardDisplay (0x04)
        OOB data: Authentication data not present (0x00)
        Authentication requirement: Bonding, MITM, SC, No Keypresses (0x0d)
        Max encryption key size: 16
        Initiator key distribution: IdKey (0x02)
        Responder key distribution: IdKey (0x02)
zephyr.exe[1327472]: < HCI Command: Host Number of Completed Packets (0x03|0x0035) plen 5                            #60 7.197305
        Num handles: 1
        Handle: 1047 Address: C0:07:E8:2C:B6:EE (OUI C0-07-E8)
        Count: 1
zephyr.exe[1327472]: < ACL Data TX: Handle 1047 [1/3] flags 0x00 dlen 11                                             #61 7.197326
      SMP: Pairing Response (0x02) len 6
        IO capability: KeyboardDisplay (0x04)
        OOB data: Authentication data not present (0x00)
        Authentication requirement: Bonding, MITM, SC, No Keypresses (0x0d)
        Max encryption key size: 16
        Initiator key distribution: IdKey (0x02)
        Responder key distribution: IdKey (0x02)
> HCI Event: Number of Completed Packets (0x13) plen 5                                                               #62 7.311884
        Num handles: 1
        Handle: 1047 Address: C0:07:E8:2C:B6:EE (OUI C0-07-E8)
        Count: 1
        Buffers: 0/3
        #61: len 11 (0 Kb/s)
        Latency: 114 msec (114-114 msec ~114 msec)
> ACL Data RX: Handle 1047 flags 0x02 dlen 27                                                                        #63 7.312237
> ACL Data RX: Handle 1047 flags 0x01 dlen 27                                                                        #64 7.312592
> ACL Data RX: Handle 1047 flags 0x01 dlen 15                                                                        #65 7.312917
      SMP: Pairing Public Key (0x0c) len 64
        X[32]: f4a1ae14646c5f7b0f54ab84e2cc975d6c43e59fa65931026ae03f0acfeeb13f
        Y[32]: 544661a0b57f59eeaa2417c825d9c0d4a68893eb352c97675c0a90f3a2a5ad96
zephyr.exe[1327472]: < HCI Command: Host Number of Completed Packets (0x03|0x0035) plen 5                            #66 7.317327
        Num handles: 1
        Handle: 1047 Address: C0:07:E8:2C:B6:EE (OUI C0-07-E8)
        Count: 1
zephyr.exe[1327472]: < HCI Command: Host Number of Completed Packets (0x03|0x0035) plen 5                            #67 7.317543
        Num handles: 1
        Handle: 1047 Address: C0:07:E8:2C:B6:EE (OUI C0-07-E8)
        Count: 1
zephyr.exe[1327472]: < HCI Command: Host Number of Completed Packets (0x03|0x0035) plen 5                            #68 7.317565
        Num handles: 1
        Handle: 1047 Address: C0:07:E8:2C:B6:EE (OUI C0-07-E8)
        Count: 1
zephyr.exe[1327472]: < ACL Data TX: Handle 1047 [1/3] flags 0x00 dlen 27                                             #69 7.317807
zephyr.exe[1327472]: < ACL Data TX: Handle 1047 flags 0x01 dlen 27                                                   #70 7.317815
zephyr.exe[1327472]: < ACL Data TX: Handle 1047 flags 0x01 dlen 15                                                   #71 7.317883
      SMP: Pairing Public Key (0x0c) len 64
        X[32]: 68f6ada634ce84d11617383d57f070fe3445c38b33b569efa5eb771a0dc8aea5
        Y[32]: 83c407aaa8337331fdc418e55085d75e6c1c6e5d42f8bf9c18fb5a2a7d4f31aa
> HCI Event: Number of Completed Packets (0x13) plen 5                                                               #72 7.374715
        Num handles: 1
        Handle: 1047 Address: C0:07:E8:2C:B6:EE (OUI C0-07-E8)
        Count: 1
        Buffers: 0/3
        #69: len 27 (3 Kb/s)
        Latency: 56 msec (56-114 msec ~85 msec)
> HCI Event: Number of Completed Packets (0x13) plen 5                                                               #73 7.375279
        Num handles: 1
        Handle: 1047 Address: C0:07:E8:2C:B6:EE (OUI C0-07-E8)
        Count: 1
        Buffers: underflow/3
        #70: len 27 (3 Kb/s)
        Latency: 57 msec (56-114 msec ~71 msec)
zephyr.exe[1327472]: < ACL Data TX: Handle 1047 [1/3] flags 0x00 dlen 21                                             #74 7.377095
      SMP: Pairing Confirm (0x03) len 16
        Confirm value[16]: abc9ed023a16a00b5bac1b8edeabfe01
> HCI Event: Number of Completed Packets (0x13) plen 5                                                               #75 7.436813
        Num handles: 1
        Handle: 1047 Address: C0:07:E8:2C:B6:EE (OUI C0-07-E8)
        Count: 1
        Buffers: 0/3
        #71: len 15 (1 Kb/s)
        Latency: 118 msec (56-118 msec ~95 msec)
> HCI Event: Number of Completed Packets (0x13) plen 5                                                               #76 7.499367
        Num handles: 1
        Handle: 1047 Address: C0:07:E8:2C:B6:EE (OUI C0-07-E8)
        Count: 1
        Buffers: underflow/3
        #74: len 21 (1 Kb/s)
        Latency: 122 msec (56-122 msec ~108 msec)
> ACL Data RX: Handle 1047 flags 0x02 dlen 21                                                                        #77 7.499697
      SMP: Pairing Random (0x04) len 16
        Random value[16]: 8fb2c058484b94084217218cd44be734
zephyr.exe[1327472]: < HCI Command: Host Number of Completed Packets (0x03|0x0035) plen 5                            #78 7.517341
        Num handles: 1
        Handle: 1047 Address: C0:07:E8:2C:B6:EE (OUI C0-07-E8)
        Count: 1
zephyr.exe[1327472]: < ACL Data TX: Handle 1047 [1/3] flags 0x00 dlen 21                                             #79 7.517516
      SMP: Pairing Random (0x04) len 16
        Random value[16]: 555cc64d02679f89a05211af56d8b3da
> HCI Event: Number of Completed Packets (0x13) plen 5                                                               #80 7.624240
        Num handles: 1
        Handle: 1047 Address: C0:07:E8:2C:B6:EE (OUI C0-07-E8)
        Count: 1
        Buffers: 0/3
        #79: len 21 (1 Kb/s)
        Latency: 106 msec (56-122 msec ~107 msec)
> ACL Data RX: Handle 1047 flags 0x02 dlen 21                                                                        #81 8.187026
      SMP: Pairing DHKey Check (0x0d) len 16
        E[16]: 72caaf639d6d2723f8491b5e43ce5ee5
zephyr.exe[1327472]: < HCI Command: Host Number of Completed Packets (0x03|0x0035) plen 5                            #82 8.197203
        Num handles: 1
        Handle: 1047 Address: C0:07:E8:2C:B6:EE (OUI C0-07-E8)
        Count: 1
zephyr.exe[1327472]: < ACL Data TX: Handle 1047 [1/3] flags 0x00 dlen 21                                             #83 8.197398
      SMP: Pairing DHKey Check (0x0d) len 16
        E[16]: aa8c313fa2b1fe6bd99f901ac4d663c3
> HCI Event: Number of Completed Packets (0x13) plen 5                                                               #84 8.311814
        Num handles: 1
        Handle: 1047 Address: C0:07:E8:2C:B6:EE (OUI C0-07-E8)
        Count: 1
        Buffers: 0/3
        #83: len 21 (1 Kb/s)
        Latency: 114 msec (56-122 msec ~111 msec)
> HCI Event: LE Meta Event (0x3e) plen 13                                                                            #85 8.374794
      LE Long Term Key Request (0x05)
        Handle: 1047 Address: C0:07:E8:2C:B6:EE (OUI C0-07-E8)
        Random number: 0x0000000000000000
        Encrypted diversifier: 0x0000
zephyr.exe[1327472]: < HCI Command: LE Long Term Key Request Reply (0x08|0x001a) plen 18                             #86 8.377282
        Handle: 1047 Address: C0:07:E8:2C:B6:EE (OUI C0-07-E8)
        Long term key[16]: 36005a28cfba5996b9db7dac7cabd281
> HCI Event: Command Complete (0x0e) plen 6                                                                          #87 8.377951
      LE Long Term Key Request Reply (0x08|0x001a) ncmd 1
        Status: Success (0x00)
        Handle: 1047 Address: C0:07:E8:2C:B6:EE (OUI C0-07-E8)
> HCI Event: Encryption Change (0x08) plen 4                                                                         #88 8.687028
        Status: Success (0x00)
        Handle: 1047 Address: C0:07:E8:2C:B6:EE (OUI C0-07-E8)
        Encryption: Enabled with AES-CCM (0x01)
zephyr.exe[1327472]: < ACL Data TX: Handle 1047 [1/3] flags 0x00 dlen 21                                             #89 8.807281
      SMP: Identity Information (0x08) len 16
        Identity resolving key[16]: 08aad2e1be87e47b88aeb19de6889efb
zephyr.exe[1327472]: < ACL Data TX: Handle 1047 [2/3] flags 0x00 dlen 12                                             #90 8.807299
      SMP: Identity Address Information (0x09) len 7
        Address: D5:B6:CC:31:DB:3B (Static)
> HCI Event: Number of Completed Packets (0x13) plen 5                                                               #91 8.812265
        Num handles: 1
        Handle: 1047 Address: C0:07:E8:2C:B6:EE (OUI C0-07-E8)
        Count: 1
        Buffers: 1/3
        #89: len 21 (42 Kb/s)
        Latency: 4 msec (4-122 msec ~58 msec)
> HCI Event: Number of Completed Packets (0x13) plen 5                                                               #92 8.874459
        Num handles: 1
        Handle: 1047 Address: C0:07:E8:2C:B6:EE (OUI C0-07-E8)
        Count: 1
        Buffers: 0/3
        #90: len 12 (1 Kb/s)
        Latency: 67 msec (4-122 msec ~62 msec)
> ACL Data RX: Handle 1047 flags 0x02 dlen 21                                                                        #93 8.874791
      SMP: Identity Information (0x08) len 16
        Identity resolving key[16]: 6cf0d45ffcfbbc186cdd142739e03843
zephyr.exe[1327472]: < HCI Command: Host Number of Completed Packets (0x03|0x0035) plen 5                            #94 8.877213
        Num handles: 1
        Handle: 1047 Address: C0:07:E8:2C:B6:EE (OUI C0-07-E8)
        Count: 1
> ACL Data RX: Handle 1047 flags 0x02 dlen 12                                                                        #95 8.937034
      SMP: Identity Address Information (0x09) len 7
        Address: C0:07:E8:2C:B6:EE (OUI C0-07-E8)
zephyr.exe[1327472]: < HCI Command: LE Add Device To Resolving List (0x08|0x0027) plen 39                            #96 8.957384
        Address type: Public (0x00)
        Address: C0:07:E8:2C:B6:EE (OUI C0-07-E8)
        Peer identity resolving key[16]: 6cf0d45ffcfbbc186cdd142739e03843
        Local identity resolving key[16]: 08aad2e1be87e47b88aeb19de6889efb
> HCI Event: Command Complete (0x0e) plen 4                                                                          #97 8.958259
      LE Add Device To Resolving List (0x08|0x0027) ncmd 1
        Status: Success (0x00)
zephyr.exe[1327472]: < HCI Command: LE Set Privacy Mode (0x08|0x004e) plen 8                                         #98 8.977182
        Peer Identity address type: Public (0x00)
        Peer Identity address: C0:07:E8:2C:B6:EE (OUI C0-07-E8)
        Privacy Mode: Use Device Privacy (0x01)
> HCI Event: Command Complete (0x0e) plen 4                                                                          #99 8.977838
      LE Set Privacy Mode (0x08|0x004e) ncmd 1
        Status: Success (0x00)
zephyr.exe[1327472]: < HCI Command: LE Set Address Resolution Enable (0x08|0x002d) plen 1                           #100 8.997190
        Address resolution: Enabled (0x01)
> HCI Event: Command Complete (0x0e) plen 4                                                                         #101 8.997834
      LE Set Address Resolution Enable (0x08|0x002d) ncmd 1
        Status: Success (0x00)
zephyr.exe[1327472]: < HCI Command: Host Number of Completed Packets (0x03|0x0035) plen 5                           #102 9.017218
        Num handles: 1
        Handle: 1047 Address: C0:07:E8:2C:B6:EE (OUI C0-07-E8)
        Count: 1
zephyr.exe[1327472]: < ACL Data TX: Handle 1047 [1/3] flags 0x00 dlen 11                                            #103 9.017247
      ATT: Read By Type Request (0x08) len 6
        Handle range: 0x0001-0xffff
        Attribute type: Central Address Resolution (0x2aa6)
> HCI Event: Number of Completed Packets (0x13) plen 5                                                              #104 9.124406
        Num handles: 1
        Handle: 1047 Address: C0:07:E8:2C:B6:EE (OUI C0-07-E8)
        Count: 1
        Buffers: 0/3
        #103: len 11 (0 Kb/s)
        Latency: 107 msec (4-122 msec ~84 msec)
> ACL Data RX: Handle 1047 flags 0x02 dlen 9                                                                        #105 9.124583
      ATT: Read By Type Response (0x09) len 4
        Attribute data length: 3
        Attribute data list: 1 entry
        Handle: 0x000f
        Value[1]: 01
zephyr.exe[1327472]: < HCI Command: Host Number of Completed Packets (0x03|0x0035) plen 5                           #106 9.137297
        Num handles: 1
        Handle: 1047 Address: C0:07:E8:2C:B6:EE (OUI C0-07-E8)
        Count: 1
zephyr.exe[1327472]: < ACL Data TX: Handle 1047 [1/3] flags 0x00 dlen 11                                            #107 9.187191
      ATT: Read By Type Request (0x08) len 6
        Handle range: 0x0001-0x000d
        Attribute type: Characteristic (0x2803)
> HCI Event: Number of Completed Packets (0x13) plen 5                                                              #108 9.311907
        Num handles: 1
        Handle: 1047 Address: C0:07:E8:2C:B6:EE (OUI C0-07-E8)
        Count: 1
        Buffers: 0/3
        #107: len 11 (0 Kb/s)
        Latency: 124 msec (4-124 msec ~104 msec)
> ACL Data RX: Handle 1047 flags 0x02 dlen 27                                                                       #109 9.312275
      ATT: Read By Type Response (0x09) len 22
        Attribute data length: 7
        Attribute data list: 3 entries
        Handle: 0x0002
        Value[5]: 0a0300002a
            Properties: 0x0a
              Read (0x02)
              Write (0x08)
            Value Handle: 0x0003
            Value UUID: Device Name (0x2a00)
        Handle: 0x0004
        Value[5]: 0a0500012a
            Properties: 0x0a
              Read (0x02)
              Write (0x08)
            Value Handle: 0x0005
            Value UUID: Appearance (0x2a01)
        Handle: 0x0006
        Value[5]: 4e07000945
            Properties: 0x4e
              Read (0x02)
              Write Without Response (0x04)
              Write (0x08)
              Authorize (0x40)
              Extended Properties (0x80)
            Value Handle: 0x0007
            Value UUID: Unknown (0x4509)
zephyr.exe[1327472]: < HCI Command: Host Number of Completed Packets (0x03|0x0035) plen 5                           #110 9.317085
        Num handles: 1
        Handle: 1047 Address: C0:07:E8:2C:B6:EE (OUI C0-07-E8)
        Count: 1
zephyr.exe[1327472]: < ACL Data TX: Handle 1047 [1/3] flags 0x00 dlen 11                                            #111 9.317096
      ATT: Read By Type Request (0x08) len 6
        Handle range: 0x0007-0x000d
        Attribute type: Characteristic (0x2803)
> HCI Event: Number of Completed Packets (0x13) plen 5                                                              #112 9.436963
        Num handles: 1
        Handle: 1047 Address: C0:07:E8:2C:B6:EE (OUI C0-07-E8)
        Count: 1
        Buffers: 0/3
        #111: len 11 (0 Kb/s)
        Latency: 119 msec (4-124 msec ~112 msec)
> ACL Data RX: Handle 1047 flags 0x02 dlen 20                                                                       #113 9.437224
      ATT: Read By Type Response (0x09) len 15
        Attribute data length: 7
        Attribute data list: 2 entries
        Handle: 0x0008
        Value[5]: 020900042a
            Properties: 0x02
              Read (0x02)
            Value Handle: 0x0009
            Value UUID: Peripheral Preferred Connection Parameters (0x2a04)
        Handle: 0x000a
        Value[5]: 320b00192a
            Properties: 0x32
              Read (0x02)
              Notify (0x10)
              Indicate (0x20)
            Value Handle: 0x000b
            Value UUID: Battery Level (0x2a19)
zephyr.exe[1327472]: < HCI Command: Host Number of Completed Packets (0x03|0x0035) plen 5                           #114 9.457270
        Num handles: 1
        Handle: 1047 Address: C0:07:E8:2C:B6:EE (OUI C0-07-E8)
        Count: 1
zephyr.exe[1327472]: < ACL Data TX: Handle 1047 [1/3] flags 0x00 dlen 11                                            #115 9.457288
      ATT: Read By Type Request (0x08) len 6
        Handle range: 0x000b-0x000d
        Attribute type: Characteristic (0x2803)
> HCI Event: Number of Completed Packets (0x13) plen 5                                                              #116 9.561912
        Num handles: 1
        Handle: 1047 Address: C0:07:E8:2C:B6:EE (OUI C0-07-E8)
        Count: 1
        Buffers: 0/3
        #115: len 11 (0 Kb/s)
        Latency: 104 msec (4-124 msec ~108 msec)
> ACL Data RX: Handle 1047 flags 0x02 dlen 9                                                                        #117 9.562030
      ATT: Error Response (0x01) len 4
        Read By Type Request (0x08)
        Handle: 0x000b
        Error: Attribute Not Found (0x0a)
zephyr.exe[1327472]: < HCI Command: Host Number of Completed Packets (0x03|0x0035) plen 5                           #118 9.577301
        Num handles: 1
        Handle: 1047 Address: C0:07:E8:2C:B6:EE (OUI C0-07-E8)
        Count: 1
zephyr.exe[1327472]: < ACL Data TX: Handle 1047 [1/3] flags 0x00 dlen 9                                             #119 9.577336
      ATT: Write Request (0x12) len 4
        Handle: 0x000d
          Data[2]: 0200
> HCI Event: Number of Completed Packets (0x13) plen 5                                                              #120 9.686866
        Num handles: 1
        Handle: 1047 Address: C0:07:E8:2C:B6:EE (OUI C0-07-E8)
        Count: 1
        Buffers: 0/3
        #119: len 9 (0 Kb/s)
        Latency: 109 msec (4-124 msec ~109 msec)
> ACL Data RX: Handle 1047 flags 0x02 dlen 5                                                                        #121 9.687097
      ATT: Write Response (0x13) len 0
zephyr.exe[1327472]: < HCI Command: Host Number of Completed Packets (0x03|0x0035) plen 5                           #122 9.697356
        Num handles: 1
        Handle: 1047 Address: C0:07:E8:2C:B6:EE (OUI C0-07-E8)
        Count: 1
> HCI Event: Disconnect Complete (0x05) plen 4                                                                     #123 10.874533
        Status: Success (0x00)
        Handle: 1047 Address: C0:07:E8:2C:B6:EE (OUI C0-07-E8)
        Reason: Remote User Terminated Connection (0x13)
zephyr.exe[1327472]: < HCI Command: LE Set Extended Advertising Parameters (0x08|0x0036) plen 25                   #124 11.627222
        Handle: 0x00
        Properties: 0x0013
          Connectable
          Scannable
          Use legacy advertising PDUs: ADV_IND
        Min advertising interval: 100.000 msec (0x00a0)
        Max advertising interval: 150.000 msec (0x00f0)
        Channel map: 37, 38, 39 (0x07)
        Own address type: Random (0x01)
        Peer address type: Public (0x00)
        Peer address: 00:00:00:00:00:00 (OUI 00-00-00)
        Filter policy: Allow Scan Request from Any, Allow Connect Request from Any (0x00)
        TX power: Host has no preference (0x7f)
        Primary PHY: LE 1M (0x01)
        Secondary max skip: 0x00
        Secondary PHY: LE 1M (0x01)
        SID: 0x00
        Scan request notifications: Disabled (0x00)
> HCI Event: Command Complete (0x0e) plen 5                                                                        #125 11.628014
      LE Set Extended Advertising Parameters (0x08|0x0036) ncmd 1
        Status: Success (0x00)
        TX power (selected): 0 dbm (0x00)
zephyr.exe[1327472]: < HCI Command: LE Set Advertising Set Random Address (0x08|0x0035) plen 7                     #126 11.637195
        Advertising handle: 0x00
        Advertising random address: D5:B6:CC:31:DB:3B (Static)
> HCI Event: Command Complete (0x0e) plen 4                                                                        #127 11.637695
      LE Set Advertising Set Random Address (0x08|0x0035) ncmd 1
        Status: Success (0x00)
zephyr.exe[1327472]: < HCI Command: LE Set Extended Advertising Data (0x08|0x0037) plen 22                         #128 11.657168
        Handle: 0x00
        Operation: Complete extended advertising data (0x03)
        Fragment preference: Minimize fragmentation (0x01)
        Data length: 0x12
        Flags: 0x04
          BR/EDR Not Supported
        Name (complete): Tester_2CB6EE
> HCI Event: Command Complete (0x0e) plen 4                                                                        #129 11.657853
      LE Set Extended Advertising Data (0x08|0x0037) ncmd 1
        Status: Success (0x00)
zephyr.exe[1327472]: < HCI Command: LE Set Extended Scan Response Data (0x08|0x0038) plen 4                        #130 11.677173
        Handle: 0x00
        Operation: Complete scan response data (0x03)
        Fragment preference: Minimize fragmentation (0x01)
        Data length: 0x00
> HCI Event: Command Complete (0x0e) plen 4                                                                        #131 11.677588
      LE Set Extended Scan Response Data (0x08|0x0038) ncmd 1
        Status: Success (0x00)
zephyr.exe[1327472]: < HCI Command: LE Set Extended Advertising Enable (0x08|0x0039) plen 6                        #132 11.697231
        Extended advertising: Enabled (0x01)
        Number of sets: 1 (0x01)
        Entry 0
          Handle: 0x00
          Duration: 0 ms (0x00)
          Max ext adv events: 0
> HCI Event: Command Complete (0x0e) plen 4                                                                        #133 11.697858
      LE Set Extended Advertising Enable (0x08|0x0039) ncmd 1
        Status: Success (0x00)
> HCI Event: LE Meta Event (0x3e) plen 31                                                                          #134 11.813380
      LE Enhanced Connection Complete (0x0a)
        Status: Success (0x00)
        Handle: 1065
        Role: Peripheral (0x01)
        Peer address type: Public (0x00)
        Peer address: C0:07:E8:2C:B6:EE (OUI C0-07-E8)
        Local resolvable private address: 00:00:00:00:00:00 (Non-Resolvable)
        Peer resolvable private address: 00:00:00:00:00:00 (Non-Resolvable)
        Connection interval: 62.50 msec (0x0032)
        Connection latency: 0 (0x0000)
        Supervision timeout: 20000 msec (0x07d0)
        Central clock accuracy: 0x07
> HCI Event: LE Meta Event (0x3e) plen 6                                                                           #135 11.813645
      LE Advertising Set Terminated (0x12)
        Status: Success (0x00)
        Handle: 0
        Connection handle: 1065
        Number of completed extended advertising events: 0
zephyr.exe[1327472]: < HCI Command: LE Read Remote Used Features (0x08|0x0016) plen 2                              #136 11.817374
        Handle: 1065 Address: C0:07:E8:2C:B6:EE (OUI C0-07-E8)
> HCI Event: Command Status (0x0f) plen 4                                                                          #137 11.817929
      LE Read Remote Used Features (0x08|0x0016) ncmd 1
        Status: Success (0x00)
zephyr.exe[1327472]: < HCI Command: LE Set PHY (0x08|0x0032) plen 7                                                #138 11.837274
        Handle: 1065 Address: C0:07:E8:2C:B6:EE (OUI C0-07-E8)
        All PHYs preference: 0x00
        TX PHYs preference: 0x02
          LE 2M
        RX PHYs preference: 0x02
          LE 2M
        PHY options preference: Reserved (0x0000)
> HCI Event: Command Status (0x0f) plen 4                                                                          #139 11.837866
      LE Set PHY (0x08|0x0032) ncmd 1
        Status: Success (0x00)
> HCI Event: LE Meta Event (0x3e) plen 12                                                                          #140 12.002374
      LE Read Remote Used Features (0x04)
        Status: Success (0x00)
        Handle: 1065 Address: C0:07:E8:2C:B6:EE (OUI C0-07-E8)
        Features: 0x2d 0x49 0x01 0xf7 0xef 0x39 0x00 0x80
          LE Encryption
          Extended Reject Indication
          Peripheral-initiated Features Exchange
          LE Data Packet Length Extension
          LE 2M PHY
          LE Coded PHY
          Channel Selection Algorithm #2
          Minimum Number of Used Channels Procedure
          Periodic Advertising Sync Transfer - Sender
          Periodic Advertising Sync Transfer - Recipient
          Sleep Clock Accuracy Updates
          Connected Isochronous Stream - Central
          Connected Isochronous Stream - Peripheral
          Isochronous Broadcaster
          Synchronized Receiver
          Connected Isochronous Stream (Host Support)
          LE Power Control Request
          LE Power Control Request
          LE Path Loss Monitoring
          Connection Subrating
          Connection Subrating (Host Support)
          Channel Classification
          Unknown features (0x8000390000000000)
> ACL Data RX: Handle 1065 flags 0x02 dlen 8                                                                       #141 12.314447
      ATT: Handle Value Indication (0x1d) len 3
        Handle: 0x000b
          Data[1]: 63
zephyr.exe[1327472]: < HCI Command: Host Number of Completed Packets (0x03|0x0035) plen 5                          #142 12.317088
        Num handles: 1
        Handle: 1065 Address: C0:07:E8:2C:B6:EE (OUI C0-07-E8)
        Count: 1
zephyr.exe[1327472]: < ACL Data TX: Handle 1065 [1/3] flags 0x00 dlen 5                                            #143 12.317099
      ATT: Handle Value Confirmation (0x1e) len 0
> HCI Event: Number of Completed Packets (0x13) plen 5                                                             #144 12.439343
        Num handles: 1
        Handle: 1065 Address: C0:07:E8:2C:B6:EE (OUI C0-07-E8)
        Count: 1
        Buffers: 0/3
        #143: len 5 (0 Kb/s)
        Latency: 122 msec (122-122 msec ~122 msec)
> HCI Event: LE Meta Event (0x3e) plen 6                                                                           #145 12.501557
      LE PHY Update Complete (0x0c)
        Status: Success (0x00)
        Handle: 1065 Address: C0:07:E8:2C:B6:EE (OUI C0-07-E8)
        TX PHY: LE 2M (0x02)
        RX PHY: LE 2M (0x02)
zephyr.exe[1327472]: < ACL Data TX: Handle 1065 [1/3]