Bluetooth monitor ver 5.72
btmon[2337457]: = Note: Linux version 6.14.0-36-generic (x86_64)                                                         0.860936
btmon[2337457]: = Note: Bluetooth subsystem version 2.22                                                                 0.860938
= New Index: 00:00:00:00:00:00 (Primary,UART,hci1)                                                                       0.860939
= New Index: 48:5F:99:8E:E0:64 (Primary,USB,hci0)                                                                        0.860939
= Open Index: 00:00:00:00:00:00                                                                                          0.873982
= Index Info: 00:00:00:00:00:00 (Nordic Semiconductor ASA)                                                               0.873987
zephyr.exe[2337459]: @ USER Open: main (privileged) version 2.22                                                {0x0001} 0.873990
zephyr.exe[2337459]: < HCI Command: Reset (0x03|0x0003) plen 0                                                        #1 0.874313
> HCI Event: Command Complete (0x0e) plen 4                                                                           #2 0.874816
      Reset (0x03|0x0003) ncmd 1
        Status: Success (0x00)
zephyr.exe[2337459]: < HCI Command: Read Local Supported Features (0x04|0x0003) plen 0                                #3 0.893980
> HCI Event: Command Complete (0x0e) plen 12                                                                          #4 0.894560
      Read Local Supported Features (0x04|0x0003) ncmd 1
        Status: Success (0x00)
        Features: 0x00 0x00 0x00 0x00 0x60 0x00 0x00 0x00
          BR/EDR Not Supported
          LE Supported (Controller)
zephyr.exe[2337459]: < HCI Command: Read Local Version Information (0x04|0x0001) plen 0                               #5 0.913988
> HCI Event: Command Complete (0x0e) plen 12                                                                          #6 0.914508
      Read Local Version Information (0x04|0x0001) ncmd 1
        Status: Success (0x00)
        HCI version: Reserved (0x0f) - Revision 12393 (0x3069)
        LMP version: Reserved (0x0f) - Subversion 12393 (0x3069)
        Manufacturer: Nordic Semiconductor ASA (89)
zephyr.exe[2337459]: < HCI Command: Read Local Supported Commands (0x04|0x0002) plen 0                                #7 0.933979
> HCI Event: Command Complete (0x0e) plen 68                                                                          #8 0.935109
      Read Local Supported Commands (0x04|0x0002) ncmd 1
        Status: Success (0x00)
        Commands: 119 entries
          Disconnect (Octet 0 - Bit 5)
          Read Remote Version Information (Octet 2 - Bit 7)
          Set Event Mask (Octet 5 - Bit 6)
          Reset (Octet 5 - Bit 7)
          Read Connection Accept Timeout (Octet 7 - Bit 2)
          Write Connection Accept Timeout (Octet 7 - Bit 3)
          Read Transmit Power Level (Octet 10 - Bit 2)
          Set Controller To Host Flow Control (Octet 10 - Bit 5)
          Host Buffer Size (Octet 10 - Bit 6)
          Host Number of Completed Packets (Octet 10 - Bit 7)
          Read Local Version Information (Octet 14 - Bit 3)
          Read Local Supported Features (Octet 14 - Bit 5)
          Read BD ADDR (Octet 15 - Bit 1)
          Read RSSI (Octet 15 - Bit 5)
          Set Event Mask Page 2 (Octet 22 - Bit 2)
          LE Set Event Mask (Octet 25 - Bit 0)
          LE Read Buffer Size (Octet 25 - Bit 1)
          LE Read Local Supported Features (Octet 25 - Bit 2)
          LE Set Random Address (Octet 25 - Bit 4)
          LE Set Advertising Parameters (Octet 25 - Bit 5)
          LE Read Advertising Channel TX Power (Octet 25 - Bit 6)
          LE Set Advertising Data (Octet 25 - Bit 7)
          LE Set Scan Response Data (Octet 26 - Bit 0)
          LE Set Advertise Enable (Octet 26 - Bit 1)
          LE Set Scan Parameters (Octet 26 - Bit 2)
          LE Set Scan Enable (Octet 26 - Bit 3)
          LE Create Connection (Octet 26 - Bit 4)
          LE Create Connection Cancel (Octet 26 - Bit 5)
          LE Read Accept List Size (Octet 26 - Bit 6)
          LE Clear Accept List (Octet 26 - Bit 7)
          LE Add Device To Accept List (Octet 27 - Bit 0)
          LE Remove Device From Accept List (Octet 27 - Bit 1)
          LE Connection Update (Octet 27 - Bit 2)
          LE Set Host Channel Classification (Octet 27 - Bit 3)
          LE Read Channel Map (Octet 27 - Bit 4)
          LE Read Remote Used Features (Octet 27 - Bit 5)
          LE Encrypt (Octet 27 - Bit 6)
          LE Rand (Octet 27 - Bit 7)
          LE Start Encryption (Octet 28 - Bit 0)
          LE Long Term Key Request Reply (Octet 28 - Bit 1)
          LE Long Term Key Request Neg Reply (Octet 28 - Bit 2)
          LE Read Supported States (Octet 28 - Bit 3)
          LE Receiver Test (Octet 28 - Bit 4)
          LE Transmitter Test (Octet 28 - Bit 5)
          LE Test End (Octet 28 - Bit 6)
          Read Authenticated Payload Timeout (Octet 32 - Bit 4)
          Write Authenticated Payload Timeout (Octet 32 - Bit 5)
          LE Set Data Length (Octet 33 - Bit 6)
          LE Read Suggested Default Data Length (Octet 33 - Bit 7)
          LE Write Suggested Default Data Length (Octet 34 - Bit 0)
          LE Add Device To Resolving List (Octet 34 - Bit 3)
          LE Remove Device From Resolving List (Octet 34 - Bit 4)
          LE Clear Resolving List (Octet 34 - Bit 5)
          LE Read Resolving List Size (Octet 34 - Bit 6)
          LE Set Address Resolution Enable (Octet 35 - Bit 1)
          LE Set Resolvable Private Address Timeout (Octet 35 - Bit 2)
          LE Read Maximum Data Length (Octet 35 - Bit 3)
          LE Read PHY (Octet 35 - Bit 4)
          LE Set Default PHY (Octet 35 - Bit 5)
          LE Set PHY (Octet 35 - Bit 6)
          LE Enhanced Receiver Test (Octet 35 - Bit 7)
          LE Enhanced Transmitter Test (Octet 36 - Bit 0)
          LE Set Advertising Set Random Address (Octet 36 - Bit 1)
          LE Set Extended Advertising Parameters (Octet 36 - Bit 2)
          LE Set Extended Advertising Data (Octet 36 - Bit 3)
          LE Set Extended Scan Response Data (Octet 36 - Bit 4)
          LE Set Extended Advertising Enable (Octet 36 - Bit 5)
          LE Read Maximum Advertising Data Length (Octet 36 - Bit 6)
          LE Read Number of Supported Advertising Sets (Octet 36 - Bit 7)
          LE Remove Advertising Set (Octet 37 - Bit 0)
          LE Clear Advertising Sets (Octet 37 - Bit 1)
          LE Set Periodic Advertising Parameters (Octet 37 - Bit 2)
          LE Set Periodic Advertising Data (Octet 37 - Bit 3)
          LE Set Periodic Advertising Enable (Octet 37 - Bit 4)
          LE Set Extended Scan Parameters (Octet 37 - Bit 5)
          LE Set Extended Scan Enable (Octet 37 - Bit 6)
          LE Extended Create Connection (Octet 37 - Bit 7)
          LE Periodic Advertising Create Sync (Octet 38 - Bit 0)
          LE Periodic Advertising Create Sync Cancel (Octet 38 - Bit 1)
          LE Periodic Advertising Terminate Sync (Octet 38 - Bit 2)
          LE Add Device To Periodic Advertiser List (Octet 38 - Bit 3)
          LE Remove Device From Periodic Advertiser List (Octet 38 - Bit 4)
          LE Clear Periodic Advertiser List (Octet 38 - Bit 5)
          LE Read Periodic Advertiser List Size (Octet 38 - Bit 6)
          LE Read Transmit Power (Octet 38 - Bit 7)
          LE Read RF Path Compensation (Octet 39 - Bit 0)
          LE Write RF Path Compensation (Octet 39 - Bit 1)
          LE Set Privacy Mode (Octet 39 - Bit 2)
          LE Periodic Advertising Receive Enable (Octet 40 - Bit 5)
          LE Periodic Advertising Sync Transfer (Octet 40 - Bit 6)
          LE Periodic Advertising Set Info Transfer (Octet 40 - Bit 7)
          LE Periodic Advertising Sync Transfer Parameters (Octet 41 - Bit 0)
          LE Set Default Periodic Advertisng Sync Transfer Parameters (Octet 41 - Bit 1)
          LE Read Buffer v2 (Octet 41 - Bit 5)
          LE Read ISO TX Sync (Octet 41 - Bit 6)
          LE Set Connected Isochronous Group Parameters (Octet 41 - Bit 7)
          LE Set Connected Isochronous Group Parameters Test (Octet 42 - Bit 0)
          LE Create Connected Isochronous Stream (Octet 42 - Bit 1)
          LE Remove Connected Isochronous Group (Octet 42 - Bit 2)
          LE Accept Connected Isochronous Stream Request (Octet 42 - Bit 3)
          LE Reject Connected Isochronous Stream Request (Octet 42 - Bit 4)
          LE Create Broadcast Isochronous Group (Octet 42 - Bit 5)
          LE Create Broadcast Isochronous Group Test (Octet 42 - Bit 6)
          LE Terminate Broadcast Isochronous Group (Octet 42 - Bit 7)
          LE Broadcast Isochronous Group Create Sync (Octet 43 - Bit 0)
          LE Broadcast Isochronous Group Terminate Sync (Octet 43 - Bit 1)
          LE Request Peer SCA (Octet 43 - Bit 2)
          LE Setup Isochronous Data Path (Octet 43 - Bit 3)
          LE Remove Isochronous Data Path (Octet 43 - Bit 4)
          LE Isochronous Transmit Test (Octet 43 - Bit 5)
          LE Isochronous Receive Test (Octet 43 - Bit 6)
          LE Isochronous Read Test Counters (Octet 43 - Bit 7)
          LE Isochronous Read Test Counters (Octet 44 - Bit 0)
          LE Set Host Feature (Octet 44 - Bit 1)
          Octet 44 - Bit 2 
          Octet 45 - Bit 6 
          Octet 46 - Bit 0 
          Octet 46 - Bit 1 
          Octet 46 - Bit 2 
zephyr.exe[2337459]: < HCI Command: Host Buffer Size (0x03|0x0033) plen 7                                             #9 0.953986
        ACL MTU: 255  ACL max packet: 16
        SCO MTU: 0    SCO max packet: 0
> HCI Event: Command Complete (0x0e) plen 4                                                                          #10 0.954546
      Host Buffer Size (0x03|0x0033) ncmd 1
        Status: Success (0x00)
zephyr.exe[2337459]: < HCI Command: Set Controller To Host Flow Control (0x03|0x0031) plen 1                         #11 0.973981
        Flow control: ACL Data Packets (0x01)
> HCI Event: Command Complete (0x0e) plen 4                                                                          #12 0.974337
      Set Controller To Host Flow Control (0x03|0x0031) ncmd 1
        Status: Success (0x00)
zephyr.exe[2337459]: < HCI Command: LE Read Local Supported Features (0x08|0x0003) plen 0                            #13 0.993997
> HCI Event: Command Complete (0x0e) plen 12                                                                         #14 0.994435
      LE Read Local Supported Features (0x08|0x0003) ncmd 1
        Status: Success (0x00)
        Features: 0xfd 0x79 0x00 0xf7 0x30 0x01 0x00 0x00
          LE Encryption
          Extended Reject Indication
          Peripheral-initiated Features Exchange
          LE Ping
          LE Data Packet Length Extension
          LL Privacy
          Extended Scanner Filter Policies
          LE 2M PHY
          LE Coded PHY
          LE Extended Advertising
          LE Periodic Advertising
          Channel Selection Algorithm #2
          Periodic Advertising Sync Transfer - Sender
          Periodic Advertising Sync Transfer - Recipient
          Sleep Clock Accuracy Updates
          Connected Isochronous Stream - Central
          Connected Isochronous Stream - Peripheral
          Isochronous Broadcaster
          Synchronized Receiver
          Periodic Advertising ADI support
          Connection Subrating
          Unknown features (0x0000010000000000)
zephyr.exe[2337459]: < HCI Command: LE Set Host Feature (0x08|0x0074) plen 2                                         #15 1.013998
        Bit Number: 32
          Connected Isochronous Stream (Host Support)
        Bit Value: 1
> HCI Event: Command Complete (0x0e) plen 4                                                                          #16 1.014468
      LE Set Host Feature (0x08|0x0074) ncmd 1
        Status: Success (0x00)
zephyr.exe[2337459]: < HCI Command: LE Read Buffer v2 (0x08|0x0060) plen 0                                           #17 1.033980
> HCI Event: Command Complete (0x0e) plen 10                                                                         #18 1.034514
      LE Read Buffer v2 (0x08|0x0060) ncmd 1
        Status: Success (0x00)
        ACL MTU: 27
        ACL max packet: 3
        ISO MTU: 318
        ISO max packet: 3
zephyr.exe[2337459]: < HCI Command: LE Read Maximum Advertising Data Length (0x08|0x003a) plen 0                     #19 1.054004
> HCI Event: Command Complete (0x0e) plen 6                                                                          #20 1.054597
      LE Read Maximum Advertising Data Length (0x08|0x003a) ncmd 1
        Status: Success (0x00)
        Max length: 1650
zephyr.exe[2337459]: < HCI Command: LE Read Supported States (0x08|0x001c) plen 0                                    #21 1.073984
> HCI Event: Command Complete (0x0e) plen 12                                                                         #22 1.074507
      LE Read Supported States (0x08|0x001c) ncmd 1
        Status: Success (0x00)
        States: 0x000003ff3e0306ff
          Non-connectable Advertising State
          Scannable Advertising State
          Connectable Advertising State
          High Duty Cycle Directed Advertising State
          Passive Scanning State
          Active Scanning State
          Initiating State
            and Connection State (Central Role)
          Connection State (Peripheral Role)
          Scannable Advertising State
            and Passive Scanning State
          Connectable Advertising State
            and Passive Scanning State
          Non-connectable Advertising State
            and Initiating State
          Scannable Advertising State
            and Initiating State
          Active Scanning State
            and Connection State (Central Role)
          Passive Scanning State
            and Connection State (Peripheral Role)
          Active Scanning State
            and Connection State (Peripheral Role)
          Initiating State
            and Connection State (Central Role)
            and Central Role & Central Role
          Low Duty Cycle Directed Advertising State
          Connectable Advertising State
            and Initiating State
            and Central Role & Peripheral Role
          High Duty Cycle Directed Advertising State
            and Initiating State
            and Central Role & Peripheral Role
          Low Duty Cycle Directed Advertising State
            and Initiating State
            and Central Role & Peripheral Role
          Connectable Advertising State
            and Connection State (Central Role)
            and Central Role & Peripheral Role
          High Duty Cycle Directed Advertising State
            and Connection State (Central Role)
            and Central Role & Peripheral Role
          Low Duty Cycle Directed Advertising State
            and Connection State (Central Role)
            and Central Role & Peripheral Role
          Connectable Advertising State
            and Connection State (Peripheral Role)
            and Central Role & Peripheral Role
          High Duty Cycle Directed Advertising State
            and Connection State (Peripheral Role)
            and Peripheral Role & Peripheral Role
          Low Duty Cycle Directed Advertising State
            and Connection State (Peripheral Role)
            and Peripheral Role & Peripheral Role
          Initiating State
            and Connection State (Peripheral Role)
            and Central Role & Peripheral Role
zephyr.exe[2337459]: < HCI Command: LE Read Maximum Data Length (0x08|0x002f) plen 0                                 #23 1.093977
> HCI Event: Command Complete (0x0e) plen 12                                                                         #24 1.094486
      LE Read Maximum Data Length (0x08|0x002f) ncmd 1
        Status: Success (0x00)
        Max TX octets: 251
        Max TX time: 2704
        Max RX octets: 251
        Max RX time: 2704
zephyr.exe[2337459]: < HCI Command: LE Write Suggested Default Data Length (0x08|0x0024) plen 4                      #25 1.113955
        TX octets: 251
        TX time: 2704
> HCI Event: Command Complete (0x0e) plen 4                                                                          #26 1.114384
      LE Write Suggested Default Data Length (0x08|0x0024) ncmd 1
        Status: Success (0x00)
zephyr.exe[2337459]: < HCI Command: LE Read Resolving List Size (0x08|0x002a) plen 0                                 #27 1.133986
> HCI Event: Command Complete (0x0e) plen 5                                                                          #28 1.134479
      LE Read Resolving List Size (0x08|0x002a) ncmd 1
        Status: Success (0x00)
        Size: 8
zephyr.exe[2337459]: < HCI Command: LE Set Event Mask (0x08|0x0001) plen 8                                           #29 1.153980
        Mask: 0x000002023f87fa5e
          LE Advertising Report
          LE Connection Update Complete
          LE Read Remote Used Features Complete
          LE Long Term Key Request
          LE Data Length Change
          LE Enhanced Connection Complete
          LE PHY Update Complete
          LE Extended Advertising Report
          LE Periodic Advertising Sync Established
          LE Periodic Advertising Report
          LE Periodic Advertising Sync Lost
          LE Extended Scan Timeout
          LE Extended Advertising Set Terminated
          LE Scan Request Received
          LE Periodic Advertising Sync Transfer Rvc
          LE CIS Established
          LE CIS Request
          LE Create BIG Complete
          LE Terminate BIG Complete
          LE BIG Sync Estabilished Complete
          LE BIG Sync Lost
          LE BIG Info Advertising Report
          Unknown mask (0x0000020000000000)
> HCI Event: Command Complete (0x0e) plen 4                                                                          #30 1.154489
      LE Set Event Mask (0x08|0x0001) ncmd 1
        Status: Success (0x00)
zephyr.exe[2337459]: < HCI Command: Set Event Mask (0x03|0x0001) plen 8                                              #31 1.173984
        Mask: 0x2000800002008890
          Disconnection Complete
          Encryption Change
          Read Remote Version Information Complete
          Hardware Error
          Data Buffer Overflow
          Encryption Key Refresh Complete
          LE Meta
> HCI Event: Command Complete (0x0e) plen 4                                                                          #32 1.174613
      Set Event Mask (0x03|0x0001) ncmd 1
        Status: Success (0x00)
zephyr.exe[2337459]: < HCI Command: Read BD ADDR (0x04|0x0009) plen 0                                                #33 1.193907
> HCI Event: Command Complete (0x0e) plen 10                                                                         #34 1.194428
      Read BD ADDR (0x04|0x0009) ncmd 1
        Status: Success (0x00)
        Address: 00:00:00:00:00:00 (OUI 00-00-00)
zephyr.exe[2337459]: < HCI Command: LE Set Random Address (0x08|0x0005) plen 6                                       #35 1.213994
        Address: D5:B6:CC:31:DB:3B (Static)
> HCI Event: Command Complete (0x0e) plen 4                                                                          #36 1.214589
      LE Set Random Address (0x08|0x0005) ncmd 1
        Status: Success (0x00)
zephyr.exe[2337459]: < HCI Command: LE Set Extended Advertising Parameters (0x08|0x0036) plen 25                     #37 3.644038
        Handle: 0x00
        Properties: 0x0013
          Connectable
          Scannable
          Use legacy advertising PDUs: ADV_IND
        Min advertising interval: 100.000 msec (0x00a0)
        Max advertising interval: 150.000 msec (0x00f0)
        Channel map: 37, 38, 39 (0x07)
        Own address type: Random (0x01)
        Peer address type: Public (0x00)
        Peer address: 00:00:00:00:00:00 (OUI 00-00-00)
        Filter policy: Allow Scan Request from Any, Allow Connect Request from Any (0x00)
        TX power: Host has no preference (0x7f)
        Primary PHY: LE 1M (0x01)
        Secondary max skip: 0x00
        Secondary PHY: LE 1M (0x01)
        SID: 0x00
        Scan request notifications: Disabled (0x00)
> HCI Event: Command Complete (0x0e) plen 5                                                                          #38 3.644833
      LE Set Extended Advertising Parameters (0x08|0x0036) ncmd 1
        Status: Success (0x00)
        TX power (selected): 0 dbm (0x00)
zephyr.exe[2337459]: < HCI Command: LE Set Advertising Set Random Address (0x08|0x0035) plen 7                       #39 3.654010
        Advertising handle: 0x00
        Advertising random address: D5:B6:CC:31:DB:3B (Static)
> HCI Event: Command Complete (0x0e) plen 4                                                                          #40 3.654655
      LE Set Advertising Set Random Address (0x08|0x0035) ncmd 1
        Status: Success (0x00)
zephyr.exe[2337459]: < HCI Command: LE Set Extended Advertising Data (0x08|0x0037) plen 22                           #41 3.674013
        Handle: 0x00
        Operation: Complete extended advertising data (0x03)
        Fragment preference: Minimize fragmentation (0x01)
        Data length: 0x12
        Flags: 0x04
          BR/EDR Not Supported
        Name (complete): Tester_F6B11A
> HCI Event: Command Complete (0x0e) plen 4                                                                          #42 3.674755
      LE Set Extended Advertising Data (0x08|0x0037) ncmd 1
        Status: Success (0x00)
zephyr.exe[2337459]: < HCI Command: LE Set Extended Scan Response Data (0x08|0x0038) plen 4                          #43 3.694009
        Handle: 0x00
        Operation: Complete scan response data (0x03)
        Fragment preference: Minimize fragmentation (0x01)
        Data length: 0x00
> HCI Event: Command Complete (0x0e) plen 4                                                                          #44 3.694527
      LE Set Extended Scan Response Data (0x08|0x0038) ncmd 1
        Status: Success (0x00)
zephyr.exe[2337459]: < HCI Command: LE Set Extended Advertising Enable (0x08|0x0039) plen 6                          #45 3.714031
        Extended advertising: Enabled (0x01)
        Number of sets: 1 (0x01)
        Entry 0
          Handle: 0x00
          Duration: 0 ms (0x00)
          Max ext adv events: 0
> HCI Event: Command Complete (0x0e) plen 4                                                                          #46 3.714609
      LE Set Extended Advertising Enable (0x08|0x0039) ncmd 1
        Status: Success (0x00)
> HCI Event: LE Meta Event (0x3e) plen 31                                                                            #47 4.145315
      LE Enhanced Connection Complete (0x0a)
        Status: Success (0x00)
        Handle: 39
        Role: Peripheral (0x01)
        Peer address type: Public (0x00)
        Peer address: DF:A9:FF:F6:B1:1A (OUI DF-A9-FF)
        Local resolvable private address: 00:00:00:00:00:00 (Non-Resolvable)
        Peer resolvable private address: 00:00:00:00:00:00 (Non-Resolvable)
        Connection interval: 87.50 msec (0x0046)
        Connection latency: 0 (0x0000)
        Supervision timeout: 20000 msec (0x07d0)
        Central clock accuracy: 0x01
> HCI Event: LE Meta Event (0x3e) plen 6                                                                             #48 4.145497
      LE Advertising Set Terminated (0x12)
        Status: Success (0x00)
        Handle: 0
        Connection handle: 39
        Number of completed extended advertising events: 0
zephyr.exe[2337459]: < HCI Command: LE Read Remote Used Features (0x08|0x0016) plen 2                                #49 4.154912
        Handle: 39 Address: DF:A9:FF:F6:B1:1A (OUI DF-A9-FF)
> HCI Event: Command Status (0x0f) plen 4                                                                            #50 4.155365
      LE Read Remote Used Features (0x08|0x0016) ncmd 1
        Status: Success (0x00)
> HCI Event: LE Meta Event (0x3e) plen 12                                                                            #51 4.409304
      LE Read Remote Used Features (0x04)
        Status: Success (0x00)
        Handle: 39 Address: DF:A9:FF:F6:B1:1A (OUI DF-A9-FF)
        Features: 0x2d 0x49 0x00 0xf7 0x67 0xd8 0x00 0x00
          LE Encryption
          Extended Reject Indication
          Peripheral-initiated Features Exchange
          LE Data Packet Length Extension
          LE 2M PHY
          LE Coded PHY
          Channel Selection Algorithm #2
          Periodic Advertising Sync Transfer - Sender
          Periodic Advertising Sync Transfer - Recipient
          Sleep Clock Accuracy Updates
          Connected Isochronous Stream - Central
          Connected Isochronous Stream - Peripheral
          Isochronous Broadcaster
          Synchronized Receiver
          Connected Isochronous Stream (Host Support)
          LE Power Control Request
          LE Power Control Request
          Connection Subrating
          Connection Subrating (Host Support)
          Unknown features (0x0000d80000000000)
> ACL Data RX: Handle 39 flags 0x02 dlen 11                                                                          #52 6.946407
      SMP: Pairing Request (0x01) len 6
        IO capability: KeyboardDisplay (0x04)
        OOB data: Authentication data not present (0x00)
        Authentication requirement: Bonding, No MITM, SC, No Keypresses (0x09)
        Max encryption key size: 16
        Initiator key distribution: EncKey IdKey Sign (0x07)
        Responder key distribution: EncKey IdKey Sign (0x07)
zephyr.exe[2337459]: < HCI Command: Host Number of Completed Packets (0x03|0x0035) plen 5                            #53 6.954340
        Num handles: 1
        Handle: 39 Address: DF:A9:FF:F6:B1:1A (OUI DF-A9-FF)
        Count: 1
zephyr.exe[2337459]: < ACL Data TX: Handle 39 flags 0x00 dlen 11                                                     #54 6.954540
      SMP: Pairing Response (0x02) len 6
        IO capability: NoInputNoOutput (0x03)
        OOB data: Authentication data not present (0x00)
        Authentication requirement: Bonding, No MITM, SC, No Keypresses (0x09)
        Max encryption key size: 16
        Initiator key distribution: IdKey (0x02)
        Responder key distribution: <none> (0x00)
> HCI Event: Number of Completed Packets (0x13) plen 5                                                               #55 7.121515
        Num handles: 1
        Handle: 39 Address: DF:A9:FF:F6:B1:1A (OUI DF-A9-FF)
        Count: 1
        #54: len 11 (0 Kb/s)
        Latency: 166 msec (166-166 msec ~166 msec)
> ACL Data RX: Handle 39 flags 0x02 dlen 27                                                                          #56 7.121810
> ACL Data RX: Handle 39 flags 0x01 dlen 27                                                                          #57 7.122379
> ACL Data RX: Handle 39 flags 0x01 dlen 15                                                                          #58 7.122746
      SMP: Pairing Public Key (0x0c) len 64
        X: 086a32139c410d2f3651152b0aae722087aa83115eeea2ce01142ab2909576bb
        Y: daea46d030fc79d229506b9fa56b3d7929ef92e5b28e47948d3ad8b01dde1908
zephyr.exe[2337459]: < HCI Command: Host Number of Completed Packets (0x03|0x0035) plen 5                            #59 7.134461
        Num handles: 1
        Handle: 39 Address: DF:A9:FF:F6:B1:1A (OUI DF-A9-FF)
        Count: 1
zephyr.exe[2337459]: < HCI Command: Host Number of Completed Packets (0x03|0x0035) plen 5                            #60 7.134571
        Num handles: 1
        Handle: 39 Address: DF:A9:FF:F6:B1:1A (OUI DF-A9-FF)
        Count: 1
zephyr.exe[2337459]: < HCI Command: Host Number of Completed Packets (0x03|0x0035) plen 5                            #61 7.134716
        Num handles: 1
        Handle: 39 Address: DF:A9:FF:F6:B1:1A (OUI DF-A9-FF)
        Count: 1
zephyr.exe[2337459]: < ACL Data TX: Handle 39 flags 0x00 dlen 27                                                     #62 7.134851
zephyr.exe[2337459]: < ACL Data TX: Handle 39 flags 0x01 dlen 27                                                     #63 7.134858
zephyr.exe[2337459]: < ACL Data TX: Handle 39 flags 0x01 dlen 15                                                     #64 7.134871
      SMP: Pairing Public Key (0x0c) len 64
        X: 98308440221e2d910f0e54b71e7ec652857aa9b5a0dc65028824cc19db1226e9
        Y: 67a4816bcb62efb21701e31fdb27561a6217575fb007a8bbdabe7e28b6f68482
> HCI Event: Number of Completed Packets (0x13) plen 5                                                               #65 7.209388
        Num handles: 1
        Handle: 39 Address: DF:A9:FF:F6:B1:1A (OUI DF-A9-FF)
        Count: 1
        #62: len 27 (2 Kb/s)
        Latency: 74 msec (74-166 msec ~120 msec)
> HCI Event: Number of Completed Packets (0x13) plen 5                                                               #66 7.210148
        Num handles: 1
        Handle: 39 Address: DF:A9:FF:F6:B1:1A (OUI DF-A9-FF)
        Count: 1
        #63: len 27 (2 Kb/s)
        Latency: 75 msec (74-166 msec ~98 msec)
zephyr.exe[2337459]: < ACL Data TX: Handle 39 flags 0x00 dlen 21                                                     #67 7.214203
      SMP: Pairing Confirm (0x03) len 16
        Confim value: 195c2e8caa5d6ff5ea33a5f00b033fdb
> HCI Event: Number of Completed Packets (0x13) plen 5                                                               #68 7.296257
        Num handles: 1
        Handle: 39 Address: DF:A9:FF:F6:B1:1A (OUI DF-A9-FF)
        Count: 1
        #64: len 15 (0 Kb/s)
        Latency: 161 msec (74-166 msec ~129 msec)
> HCI Event: Number of Completed Packets (0x13) plen 5                                                               #69 7.383949
        Num handles: 1
        Handle: 39 Address: DF:A9:FF:F6:B1:1A (OUI DF-A9-FF)
        Count: 1
        #67: len 21 (0 Kb/s)
        Latency: 169 msec (74-169 msec ~149 msec)
> ACL Data RX: Handle 39 flags 0x02 dlen 21                                                                          #70 7.384353
      SMP: Pairing Random (0x04) len 16
        Random value: 12223f3985b0d5420000000000000000
zephyr.exe[2337459]: < HCI Command: Host Number of Completed Packets (0x03|0x0035) plen 5                            #71 7.394223
        Num handles: 1
        Handle: 39 Address: DF:A9:FF:F6:B1:1A (OUI DF-A9-FF)
        Count: 1
zephyr.exe[2337459]: < ACL Data TX: Handle 39 flags 0x00 dlen 21                                                     #72 7.394242
      SMP: Pairing Random (0x04) len 16
        Random value: 8e6108f966a694cbe26df70bb96773e6
> HCI Event: Number of Completed Packets (0x13) plen 5                                                               #73 7.558799
        Num handles: 1
        Handle: 39 Address: DF:A9:FF:F6:B1:1A (OUI DF-A9-FF)
        Count: 1
        #72: len 21 (1 Kb/s)
        Latency: 164 msec (74-169 msec ~157 msec)
> ACL Data RX: Handle 39 flags 0x02 dlen 21                                                                          #74 7.734085
      SMP: Pairing DHKey Check (0x0d) len 16
        E: c2ccb0bda853c2d32080c1cc02ec3d03
zephyr.exe[2337459]: < HCI Command: Host Number of Completed Packets (0x03|0x0035) plen 5                            #75 7.754171
        Num handles: 1
        Handle: 39 Address: DF:A9:FF:F6:B1:1A (OUI DF-A9-FF)
        Count: 1
zephyr.exe[2337459]: < ACL Data TX: Handle 39 flags 0x00 dlen 21                                                     #76 7.754309
      SMP: Pairing DHKey Check (0x0d) len 16
        E: c620338e68f05d043441ab449fd9e3d7
> HCI Event: Number of Completed Packets (0x13) plen 5                                                               #77 7.908699
        Num handles: 1
        Handle: 39 Address: DF:A9:FF:F6:B1:1A (OUI DF-A9-FF)
        Count: 1
        #76: len 21 (1 Kb/s)
        Latency: 154 msec (74-169 msec ~155 msec)
> HCI Event: LE Meta Event (0x3e) plen 13                                                                            #78 7.996837
      LE Long Term Key Request (0x05)
        Handle: 39 Address: DF:A9:FF:F6:B1:1A (OUI DF-A9-FF)
        Random number: 0x0000000000000000
        Encrypted diversifier: 0x0000
zephyr.exe[2337459]: < HCI Command: LE Long Term Key Request Reply (0x08|0x001a) plen 18                             #79 8.014310
        Handle: 39 Address: DF:A9:FF:F6:B1:1A (OUI DF-A9-FF)
        Long term key: be301604cc10395c77c2e537f6a76c06
> HCI Event: Command Complete (0x0e) plen 6                                                                          #80 8.015040
      LE Long Term Key Request Reply (0x08|0x001a) ncmd 1
        Status: Success (0x00)
        Handle: 39 Address: DF:A9:FF:F6:B1:1A (OUI DF-A9-FF)
> HCI Event: Encryption Change (0x08) plen 4                                                                         #81 8.434004
        Status: Success (0x00)
        Handle: 39 Address: DF:A9:FF:F6:B1:1A (OUI DF-A9-FF)
        Encryption: Enabled with AES-CCM (0x01)
> ACL Data RX: Handle 39 flags 0x02 dlen 21                                                                          #82 8.521732
      SMP: Identity Information (0x08) len 16
        Identity resolving key: 17abb382d25851f5cfa6de2adbb93c88
zephyr.exe[2337459]: < HCI Command: Host Number of Completed Packets (0x03|0x0035) plen 5                            #83 8.544802
        Num handles: 1
        Handle: 39 Address: DF:A9:FF:F6:B1:1A (OUI DF-A9-FF)
        Count: 1
> ACL Data RX: Handle 39 flags 0x02 dlen 12                                                                          #84 8.608890
      SMP: Identity Address Information (0x09) len 7
        Address: DF:A9:FF:F6:B1:1A (OUI DF-A9-FF)
zephyr.exe[2337459]: < HCI Command: LE Add Device To Resolving List (0x08|0x0027) plen 39                            #85 8.614699
        Address type: Public (0x00)
        Address: DF:A9:FF:F6:B1:1A (OUI DF-A9-FF)
        Peer identity resolving key: 17abb382d25851f5cfa6de2adbb93c88
        Local identity resolving key: 00000000000000000000000000000000
> HCI Event: Command Complete (0x0e) plen 4                                                                          #86 8.615738
      LE Add Device To Resolving List (0x08|0x0027) ncmd 1
        Status: Success (0x00)
zephyr.exe[2337459]: < HCI Command: LE Set Privacy Mode (0x08|0x004e) plen 8                                         #87 8.634409
        Peer Identity address type: Public (0x00)
        Peer Identity address: DF:A9:FF:F6:B1:1A (OUI DF-A9-FF)
        Privacy Mode: Use Device Privacy (0x01)
> HCI Event: Command Complete (0x0e) plen 4                                                                          #88 8.635029
      LE Set Privacy Mode (0x08|0x004e) ncmd 1
        Status: Success (0x00)
zephyr.exe[2337459]: < HCI Command: LE Set Address Resolution Enable (0x08|0x002d) plen 1                            #89 8.654357
        Address resolution: Enabled (0x01)
> HCI Event: Command Complete (0x0e) plen 4                                                                          #90 8.654850
      LE Set Address Resolution Enable (0x08|0x002d) ncmd 1
        Status: Success (0x00)
zephyr.exe[2337459]: < HCI Command: Host Number of Completed Packets (0x03|0x0035) plen 5                            #91 8.674098
        Num handles: 1
        Handle: 39 Address: DF:A9:FF:F6:B1:1A (OUI DF-A9-FF)
        Count: 1
> ACL Data RX: Handle 39 flags 0x02 dlen 11                                                                          #92 8.696399
      ATT: Read By Group Type Request (0x10) len 6
        Handle range: 0x0001-0xffff
        Attribute group type: Primary Service (0x2800)
zephyr.exe[2337459]: < HCI Command: Host Number of Completed Packets (0x03|0x0035) plen 5                            #93 8.714204
        Num handles: 1
        Handle: 39 Address: DF:A9:FF:F6:B1:1A (OUI DF-A9-FF)
        Count: 1
zephyr.exe[2337459]: < ACL Data TX: Handle 39 flags 0x00 dlen 24                                                     #94 8.714339
      ATT: Read By Group Type Response (0x11) len 19
        Attribute data length: 6
        Attribute group list: 3 entries
        Handle range: 0x0001-0x000a
        UUID: Generic Attribute Profile (0x1801)
        Handle range: 0x000b-0x0011
        UUID: Generic Access Profile (0x1800)
        Handle range: 0x0012-0x0020
        UUID: Device Information (0x180a)
> HCI Event: Number of Completed Packets (0x13) plen 5                                                               #95 8.871368
        Num handles: 1
        Handle: 39 Address: DF:A9:FF:F6:B1:1A (OUI DF-A9-FF)
        Count: 1
        #94: len 24 (1 Kb/s)
        Latency: 157 msec (74-169 msec ~156 msec)
> ACL Data RX: Handle 39 flags 0x02 dlen 11                                                                          #96 8.871533
      ATT: Read By Group Type Request (0x10) len 6
        Handle range: 0x0021-0xffff
        Attribute group type: Primary Service (0x2800)
zephyr.exe[2337459]: < HCI Command: Host Number of Completed Packets (0x03|0x0035) plen 5                            #97 8.874321
        Num handles: 1
        Handle: 39 Address: DF:A9:FF:F6:B1:1A (OUI DF-A9-FF)
        Count: 1
zephyr.exe[2337459]: < ACL Data TX: Handle 39 flags 0x00 dlen 12                                                     #98 8.874339
      ATT: Read By Group Type Response (0x11) len 7
        Attribute data length: 6
        Attribute group list: 1 entry
        Handle range: 0x0021-0x0033
        UUID: Object Transfer (0x1825)
> HCI Event: Number of Completed Packets (0x13) plen 5                                                               #99 9.046295
        Num handles: 1
        Handle: 39 Address: DF:A9:FF:F6:B1:1A (OUI DF-A9-FF)
        Count: 1
        #98: len 12 (0 Kb/s)
        Latency: 171 msec (74-171 msec ~164 msec)
> ACL Data RX: Handle 39 flags 0x02 dlen 11                                                                         #100 9.046602
      ATT: Read By Group Type Request (0x10) len 6
        Handle range: 0x0034-0xffff
        Attribute group type: Primary Service (0x2800)
zephyr.exe[2337459]: < HCI Command: Host Number of Completed Packets (0x03|0x0035) plen 5                           #101 9.054113
        Num handles: 1
        Handle: 39 Address: DF:A9:FF:F6:B1:1A (OUI DF-A9-FF)
        Count: 1
zephyr.exe[2337459]: < ACL Data TX: Handle 39 flags 0x00 dlen 9                                                     #102 9.054155
      ATT: Error Response (0x01) len 4
        Read By Group Type Request (0x10)
        Handle: 0x0034
        Error: Attribute Not Found (0x0a)
zephyr.exe[2337459]: < ACL Data TX: Handle 39 flags 0x00 dlen 16                                                    #103 9.164087
      LE L2CAP: Connection Parameter Update Request (0x12) ident 1 len 8
        Min interval: 24
        Max interval: 40
        Peripheral latency: 0
        Timeout multiplier: 42
> HCI Event: Number of Completed Packets (0x13) plen 5                                                              #104 9.221339
        Num handles: 1
        Handle: 39 Address: DF:A9:FF:F6:B1:1A (OUI DF-A9-FF)
        Count: 1
        #102: len 9 (0 Kb/s)
        Latency: 167 msec (74-171 msec ~165 msec)
> ACL Data RX: Handle 39 flags 0x02 dlen 13                                                                         #105 9.221529
      ATT: Find By Type Value Request (0x06) len 8
        Handle range: 0x0001-0xffff
        Attribute type: Primary Service (0x2800)
          UUID: Object Transfer (0x1825)
zephyr.exe[2337459]: < HCI Command: Host Number of Completed Packets (0x03|0x0035) plen 5                           #106 9.234157
        Num handles: 1
        Handle: 39 Address: DF:A9:FF:F6:B1:1A (OUI DF-A9-FF)
        Count: 1
zephyr.exe[2337459]: < ACL Data TX: Handle 39 flags 0x00 dlen 9                                                     #107 9.234180
      ATT: Find By Type Value Response (0x07) len 4
        Handle range: 0x0021-0x0033
> HCI Event: Number of Completed Packets (0x13) plen 5                                                              #108 9.308890
        Num handles: 1
        Handle: 39 Address: DF:A9:FF:F6:B1:1A (OUI DF-A9-FF)
        Count: 1
        #103: len 16 (0 Kb/s)
        Latency: 144 msec (74-171 msec ~155 msec)
> ACL Data RX: Handle 39 flags 0x02 dlen 10                                                                         #109 9.309109
      LE L2CAP: Connection Parameter Update Response (0x13) ident 1 len 2
        Result: Connection Parameters accepted (0x0000)
zephyr.exe[2337459]: < HCI Command: Host Number of Completed Packets (0x03|0x0035) plen 5                           #110 9.314692
        Num handles: 1
        Handle: 39 Address: DF:A9:FF:F6:B1:1A (OUI DF-A9-FF)
        Count: 1
> HCI Event: Number of Completed Packets (0x13) plen 5                                                              #111 9.396304
        Num handles: 1
        Handle: 39 Address: DF:A9:FF:F6:B1:1A (OUI DF-A9-FF)
        Count: 1
        #107: len 9 (0 Kb/s)
        Latency: 162 msec (74-171 msec ~158 msec)
> ACL Data RX: Handle 39 flags 0x02 dlen 13                                                                         #112 9.396656
      ATT: Find By Type Value Request (0x06) len 8
        Handle range: 0x0034-0xffff
        Attribute type: Primary Service (0x2800)
          UUID: Object Transfer (0x1825)
zephyr.exe[2337459]: < HCI Command: Host Number of Completed Packets (0x03|0x0035) plen 5                           #113 9.414762
        Num handles: 1
        Handle: 39 Address: DF:A9:FF:F6:B1:1A (OUI DF-A9-FF)
        Count: 1
zephyr.exe[2337459]: < ACL Data TX: Handle 39 flags 0x00 dlen 9                                                     #114 9.414873
      ATT: Error Response (0x01) len 4
        Find By Type Value Request (0x06)
        Handle: 0x0034
        Error: Attribute Not Found (0x0a)
> HCI Event: Number of Completed Packets (0x13) plen 5                                                              #115 9.571339
        Num handles: 1
        Handle: 39 Address: DF:A9:FF:F6:B1:1A (OUI DF-A9-FF)
        Count: 1
        #114: len 9 (0 Kb/s)
        Latency: 156 msec (74-171 msec ~157 msec)
> ACL Data RX: Handle 39 flags 0x02 dlen 11                                                                         #116 9.571522
      ATT: Read By Group Type Request (0x10) len 6
        Handle range: 0x0001-0xffff
        Attribute group type: Primary Service (0x2800)
zephyr.exe[2337459]: < HCI Command: Host Number of Completed Packets (0x03|0x0035) plen 5                           #117 9.574827
        Num handles: 1
        Handle: 39 Address: DF:A9:FF:F6:B1:1A (OUI DF-A9-FF)
        Count: 1
zephyr.exe[2337459]: < ACL Data TX: Handle 39 flags 0x00 dlen 24                                                    #118 9.574913
      ATT: Read By Group Type Response (0x11) len 19
        Attribute data length: 6
        Attribute group list: 3 entries
        Handle range: 0x0001-0x000a
        UUID: Generic Attribute Profile (0x1801)
        Handle range: 0x000b-0x0011
        UUID: Generic Access Profile (0x1800)
        Handle range: 0x0012-0x0020
        UUID: Device Information (0x180a)
> HCI Event: Number of Completed Packets (0x13) plen 5                                                              #119 9.746309
        Num handles: 1
        Handle: 39 Address: DF:A9:FF:F6:B1:1A (OUI DF-A9-FF)
        Count: 1
        #118: len 24 (1 Kb/s)
        Latency: 171 msec (74-171 msec ~164 msec)
> ACL Data RX: Handle 39 flags 0x02 dlen 11                                                                         #120 9.746490
      ATT: Read By Group Type Request (0x10) len 6
        Handle range: 0x0021-0xffff
        Attribute group type: Primary Service (0x2800)
zephyr.exe[2337459]: < HCI Command: Host Number of Completed Packets (0x03|0x0035) plen 5                           #121 9.754291
        Num handles: 1
        Handle: 39 Address: DF:A9:FF:F6:B1:1A (OUI DF-A9-FF)
        Count: 1
zephyr.exe[2337459]: < ACL Data TX: Handle 39 flags 0x00 dlen 12                                                    #122 9.754335
      ATT: Read By Group Type Response (0x11) len 7
        Attribute data length: 6
        Attribute group list: 1 entry
        Handle range: 0x0021-0x0033
        UUID: Object Transfer (0x1825)
> HCI Event: Number of Completed Packets (0x13) plen 5                                                              #123 9.921269
        Num handles: 1
        Handle: 39 Address: DF:A9:FF:F6:B1:1A (OUI DF-A9-FF)
        Count: 1
        #122: len 12 (0 Kb/s)
        Latency: 166 msec (74-171 msec ~165 msec)
> ACL Data RX: Handle 39 flags 0x02 dlen 11                                                                         #124 9.921663
      ATT: Read By Group Type Request (0x10) len 6
        Handle range: 0x0034-0xffff
        Attribute group type: Primary Service (0x2800)
zephyr.exe[2337459]: < HCI Command: Host Number of Completed Packets (0x03|0x0035) plen 5                           #125 9.934724
        Num handles: 1
        Handle: 39 Address: DF:A9:FF:F6:B1:1A (OUI DF-A9-FF)
        Count: 1
zephyr.exe[2337459]: < ACL Data TX: Handle 39 flags 0x00 dlen 9                                                     #126 9.934824
      ATT: Error Response (0x01) len 4
        Read By Group Type Request (0x10)
        Handle: 0x0034
        Error: Attribute Not Found (0x0a)
> HCI Event: Number of Completed Packets (0x13) plen 5                                                             #127 10.096389
        Num handles: 1
        Handle: 39 Address: DF:A9:FF:F6:B1:1A (OUI DF-A9-FF)
        Count: 1
        #126: len 9 (0 Kb/s)
        Latency: 161 msec (74-171 msec ~163 msec)
> ACL Data RX: Handle 39 flags 0x02 dlen 11                                                                        #128 10.096496
      ATT: Read By Type Request (0x08) len 6
        Handle range: 0x0001-0x000a
        Attribute type: Include (0x2802)
zephyr.exe[2337459]: < HCI Command: Host Number of Completed Packets (0x03|0x0035) plen 5                          #129 10.114238
        Num handles: 1
        Handle: 39 Address: DF:A9:FF:F6:B1:1A (OUI DF-A9-FF)
        Count: 1
zephyr.exe[2337459]: < ACL Data TX: Handle 39 flags 0x00 dlen 9                                                    #130 10.114330
      ATT: Error Response (0x01) len 4
        Read By Type Request (0x08)
        Handle: 0x0001
        Error: Attribute Not Found (0x0a)
> HCI Event: Number of Completed Packets (0x13) plen 5                                                             #131 10.271309
        Num handles: 1
        Handle: 39 Address: DF:A9:FF:F6:B1:1A (OUI DF-A9-FF)
        Count: 1
        #130: len 9 (0 Kb/s)
        Latency: 156 msec (74-171 msec ~160 msec)
> ACL Data RX: Handle 39 flags 0x02 dlen 11                                                                        #132 10.271480
      ATT: Read By Type Request (0x08) len 6
        Handle range: 0x000b-0x0011
        Attribute type: Include (0x2802)
zephyr.exe[2337459]: < HCI Command: Host Number of Completed Packets (0x03|0x0035) plen 5                          #133 10.274257
        Num handles: 1
        Handle: 39 Address: DF:A9:FF:F6:B1:1A (OUI DF-A9-FF)
        Count: 1
zephyr.exe[2337459]: < ACL Data TX: Handle 39 flags 0x00 dlen 9                                                    #134 10.274300
      ATT: Error Response (0x01) len 4
        Read By Type Request (0x08)
        Handle: 0x000b
        Error: Attribute Not Found (0x0a)
> HCI Event: Number of Completed Packets (0x13) plen 5                                                             #135 10.446308
        Num handles: 1
        Handle: 39 Address: DF:A9:FF:F6:B1:1A (OUI DF-A9-FF)
        Count: 1
        #134: len 9 (0 Kb/s)
        Latency: 172 msec (74-172 msec ~166 msec)
> ACL Data RX: Handle 39 flags 0x02 dlen 11                                                                        #136 10.446524
      ATT: Read By Type Request (0x08) len 6
        Handle range: 0x0012-0x0020
        Attribute type: Include (0x2802)
zephyr.exe[2337459]: < HCI Command: Host Number of Completed Packets (0x03|0x0035) plen 5                          #137 10.454408
        Num handles: 1
        Handle: 39 Address: DF:A9:FF:F6:B1:1A (OUI DF-A9-FF)
        Count: 1
zephyr.exe[2337459]: < ACL Data TX: Handle 39 flags 0x00 dlen 9                                                    #138 10.454447
      ATT: Error Response (0x01) len 4
        Read By Type Request (0x08)
        Handle: 0x0012
        Error: Attribute Not Found (0x0a)
> HCI Event: Number of Completed Packets (0x13) plen 5                                                             #139 10.621385
        Num handles: 1
        Handle: 39 Address: DF:A9:FF:F6:B1:1A (OUI DF-A9-FF)
        Count: 1
        #138: len 9 (0 Kb/s)
        Latency: 166 msec (74-172 msec ~166 msec)
> ACL Data RX: Handle 39 flags 0x02 dlen 11                                                                        #140 10.621545
      ATT: Read By Type Request (0x08) len 6
        Handle range: 0x0021-0x0033
        Attribute type: Include (0x2802)
zephyr.exe[2337459]: < HCI Command: Host Number of Completed Packets (0x03|0x0035) plen 5                          #141 10.634797
        Num handles: 1
        Handle: 39 Address: DF:A9:FF:F6:B1:1A (OUI DF-A9-FF)
        Count: 1
zephyr.exe[2337459]: < ACL Data TX: Handle 39 flags 0x00 dlen 9                                                    #142 10.634953
      ATT: Error Response (0x01) len 4
        Read By Type Request (0x08)
        Handle: 0x0021
        Error: Attribute Not Found (0x0a)
> HCI Event: Number of Completed Packets (0x13) plen 5                                                             #143 10.796264
        Num handles: 1
        Handle: 39 Address: DF:A9:FF:F6:B1:1A (OUI DF-A9-FF)
        Count: 1
        #142: len 9 (0 Kb/s)
        Latency: 161 msec (74-172 msec ~163 msec)
> ACL Data RX: Handle 39 flags 0x02 dlen 11                                                                        #144 10.796516
      ATT: Read By Type Request (0x08) len 6
        Handle range: 0x0021-0x0033
        Attribute type: Characteristic (0x2803)
zephyr.exe[2337459]: < HCI Command: Host Number of Completed Packets (0x03|0x0035) plen 5                          #145 10.814420
        Num handles: 1
        Handle: 39 Address: DF:A9:FF:F6:B1:1A (OUI DF-A9-FF)
        Count: 1
zephyr.exe[2337459]: < ACL Data TX: Handle 39 flags 0x00 dlen 20                                                   #146 10.814506
      ATT: Read By Type Response (0x09) len 15
        Attribute data length: 7
        Attribute data list: 2 entries
        Handle: 0x0022
        Value: 022300bd2a
            Properties: 0x02
              Read (0x02)
            Value Handle: 0x0023
            Value UUID: OTS Feature (0x2abd)
        Handle: 0x0024
        Value: 0a2500be2a
            Properties: 0x0a
              Read (0x02)
              Write (0x08)
            Value Handle: 0x0025
            Value UUID: Object Name (0x2abe)
> HCI Event: Number of Completed Packets (0x13) plen 5                                                             #147 10.971274
        Num handles: 1
        Handle: 39 Address: DF:A9:FF:F6:B1:1A (OUI DF-A9-FF)
        Count: 1
        #146: len 20 (1 Kb/s)
        Latency: 156 msec (74-172 msec ~160 msec)
> ACL Data RX: Handle 39 flags 0x02 dlen 11                                                                        #148 10.971559
      ATT: Read By Type Request (0x08) len 6
        Handle range: 0x0025-0x0033
        Attribute type: Characteristic (0x2803)
zephyr.exe[2337459]: < HCI Command: Host Number of Completed Packets (0x03|0x0035) plen 5                          #149 10.974770
        Num handles: 1
        Handle: 39 Address: DF:A9:FF:F6:B1:1A (OUI DF-A9-FF)
        Count: 1
zephyr.exe[2337459]: < ACL Data TX: Handle 39 flags 0x00 dlen 20                                                   #150 10.974847
      ATT: Read By Type Response (0x09) len 15
        Attribute data length: 7
        Attribute data list: 2 entries
        Handle: 0x0026
        Value: 022700bf2a
            Properties: 0x02
              Read (0x02)
            Value Handle: 0x0027
            Value UUID: Object Type (0x2abf)
        Handle: 0x0028
        Value: 022900c02a
            Properties: 0x02
              Read (0x02)
            Value Handle: 0x0029
            Value UUID: Object Size (0x2ac0)
> HCI Event: Number of Completed Packets (0x13) plen 5                                                             #151 11.146258
        Num handles: 1
        Handle: 39 Address: DF:A9:FF:F6:B1:1A (OUI DF-A9-FF)
        Count: 1
        #150: len 20 (0 Kb/s)
        Latency: 171 msec (74-172 msec ~165 msec)
> ACL Data RX: Handle 39 flags 0x02 dlen 11                                                                        #152 11.146522
      ATT: Read By Type 