Bluetooth monitor ver 5.84
btmon[3890095]: = Note: Linux version 6.8.0-83-generic (x86_64)                                                          0.400847
btmon[3890095]: = Note: Bluetooth subsystem version 2.22                                                                 0.400849
= New Index: 00:00:00:00:00:00 (Primary,UART,hci0)                                                                       0.400850
= Open Index: 00:00:00:00:00:00                                                                                          0.908406
= Index Info: 00:00:00:00:00:00 (Nordic Semiconductor ASA)                                                               0.908409
zephyr.exe[3890097]: @ USER Open: main (privileged) version 2.22                                                {0x0001} 0.908411
zephyr.exe[3890097]: < HCI Command: Reset (0x03|0x0003) plen 0                                                        #1 0.908670
> HCI Event: Command Complete (0x0e) plen 4                                                                           #2 0.909217
      Reset (0x03|0x0003) ncmd 1
        Status: Success (0x00)
zephyr.exe[3890097]: < HCI Command: Read Local Supported Features (0x04|0x0003) plen 0                                #3 0.928335
> HCI Event: Command Complete (0x0e) plen 12                                                                          #4 0.929182
      Read Local Supported Features (0x04|0x0003) ncmd 1
        Status: Success (0x00)
        Features: 0x00 0x00 0x00 0x00 0x60 0x00 0x00 0x00
          BR/EDR Not Supported
          LE Supported (Controller)
zephyr.exe[3890097]: < HCI Command: Read Local Version Information (0x04|0x0001) plen 0                               #5 0.948346
> HCI Event: Command Complete (0x0e) plen 12                                                                          #6 0.949325
      Read Local Version Information (0x04|0x0001) ncmd 1
        Status: Success (0x00)
        HCI version: Reserved (0x0e) - Revision 12520 (0x30e8)
        LMP version: Reserved (0x0e) - Subversion 12520 (0x30e8)
        Manufacturer: Nordic Semiconductor ASA (89)
zephyr.exe[3890097]: < HCI Command: Read Local Supported Commands (0x04|0x0002) plen 0                                #7 0.968341
> HCI Event: Command Complete (0x0e) plen 68                                                                          #8 0.969466
      Read Local Supported Commands (0x04|0x0002) ncmd 1
        Status: Success (0x00)
        Commands: 119 entries
          Disconnect (Octet 0 - Bit 5)
          Read Remote Version Information (Octet 2 - Bit 7)
          Set Event Mask (Octet 5 - Bit 6)
          Reset (Octet 5 - Bit 7)
          Read Connection Accept Timeout (Octet 7 - Bit 2)
          Write Connection Accept Timeout (Octet 7 - Bit 3)
          Read Transmit Power Level (Octet 10 - Bit 2)
          Set Controller To Host Flow Control (Octet 10 - Bit 5)
          Host Buffer Size (Octet 10 - Bit 6)
          Host Number of Completed Packets (Octet 10 - Bit 7)
          Read Local Version Information (Octet 14 - Bit 3)
          Read Local Supported Features (Octet 14 - Bit 5)
          Read BD ADDR (Octet 15 - Bit 1)
          Read RSSI (Octet 15 - Bit 5)
          Set Event Mask Page 2 (Octet 22 - Bit 2)
          LE Set Event Mask (Octet 25 - Bit 0)
          LE Read Buffer Size (Octet 25 - Bit 1)
          LE Read Local Supported Features (Octet 25 - Bit 2)
          LE Set Random Address (Octet 25 - Bit 4)
          LE Set Advertising Parameters (Octet 25 - Bit 5)
          LE Read Advertising Channel TX Power (Octet 25 - Bit 6)
          LE Set Advertising Data (Octet 25 - Bit 7)
          LE Set Scan Response Data (Octet 26 - Bit 0)
          LE Set Advertise Enable (Octet 26 - Bit 1)
          LE Set Scan Parameters (Octet 26 - Bit 2)
          LE Set Scan Enable (Octet 26 - Bit 3)
          LE Create Connection (Octet 26 - Bit 4)
          LE Create Connection Cancel (Octet 26 - Bit 5)
          LE Read Accept List Size (Octet 26 - Bit 6)
          LE Clear Accept List (Octet 26 - Bit 7)
          LE Add Device To Accept List (Octet 27 - Bit 0)
          LE Remove Device From Accept List (Octet 27 - Bit 1)
          LE Connection Update (Octet 27 - Bit 2)
          LE Set Host Channel Classification (Octet 27 - Bit 3)
          LE Read Channel Map (Octet 27 - Bit 4)
          LE Read Remote Used Features (Octet 27 - Bit 5)
          LE Encrypt (Octet 27 - Bit 6)
          LE Rand (Octet 27 - Bit 7)
          LE Start Encryption (Octet 28 - Bit 0)
          LE Long Term Key Request Reply (Octet 28 - Bit 1)
          LE Long Term Key Request Neg Reply (Octet 28 - Bit 2)
          LE Read Supported States (Octet 28 - Bit 3)
          LE Receiver Test (Octet 28 - Bit 4)
          LE Transmitter Test (Octet 28 - Bit 5)
          LE Test End (Octet 28 - Bit 6)
          Read Authenticated Payload Timeout (Octet 32 - Bit 4)
          Write Authenticated Payload Timeout (Octet 32 - Bit 5)
          LE Set Data Length (Octet 33 - Bit 6)
          LE Read Suggested Default Data Length (Octet 33 - Bit 7)
          LE Write Suggested Default Data Length (Octet 34 - Bit 0)
          LE Add Device To Resolving List (Octet 34 - Bit 3)
          LE Remove Device From Resolving List (Octet 34 - Bit 4)
          LE Clear Resolving List (Octet 34 - Bit 5)
          LE Read Resolving List Size (Octet 34 - Bit 6)
          LE Set Address Resolution Enable (Octet 35 - Bit 1)
          LE Set Resolvable Private Address Timeout (Octet 35 - Bit 2)
          LE Read Maximum Data Length (Octet 35 - Bit 3)
          LE Read PHY (Octet 35 - Bit 4)
          LE Set Default PHY (Octet 35 - Bit 5)
          LE Set PHY (Octet 35 - Bit 6)
          LE Enhanced Receiver Test (Octet 35 - Bit 7)
          LE Enhanced Transmitter Test (Octet 36 - Bit 0)
          LE Set Advertising Set Random Address (Octet 36 - Bit 1)
          LE Set Extended Advertising Parameters (Octet 36 - Bit 2)
          LE Set Extended Advertising Data (Octet 36 - Bit 3)
          LE Set Extended Scan Response Data (Octet 36 - Bit 4)
          LE Set Extended Advertising Enable (Octet 36 - Bit 5)
          LE Read Maximum Advertising Data Length (Octet 36 - Bit 6)
          LE Read Number of Supported Advertising Sets (Octet 36 - Bit 7)
          LE Remove Advertising Set (Octet 37 - Bit 0)
          LE Clear Advertising Sets (Octet 37 - Bit 1)
          LE Set Periodic Advertising Parameters (Octet 37 - Bit 2)
          LE Set Periodic Advertising Data (Octet 37 - Bit 3)
          LE Set Periodic Advertising Enable (Octet 37 - Bit 4)
          LE Set Extended Scan Parameters (Octet 37 - Bit 5)
          LE Set Extended Scan Enable (Octet 37 - Bit 6)
          LE Extended Create Connection (Octet 37 - Bit 7)
          LE Periodic Advertising Create Sync (Octet 38 - Bit 0)
          LE Periodic Advertising Create Sync Cancel (Octet 38 - Bit 1)
          LE Periodic Advertising Terminate Sync (Octet 38 - Bit 2)
          LE Add Device To Periodic Advertiser List (Octet 38 - Bit 3)
          LE Remove Device From Periodic Advertiser List (Octet 38 - Bit 4)
          LE Clear Periodic Advertiser List (Octet 38 - Bit 5)
          LE Read Periodic Advertiser List Size (Octet 38 - Bit 6)
          LE Read Transmit Power (Octet 38 - Bit 7)
          LE Read RF Path Compensation (Octet 39 - Bit 0)
          LE Write RF Path Compensation (Octet 39 - Bit 1)
          LE Set Privacy Mode (Octet 39 - Bit 2)
          LE Periodic Advertising Receive Enable (Octet 40 - Bit 5)
          LE Periodic Advertising Sync Transfer (Octet 40 - Bit 6)
          LE Periodic Advertising Set Info Transfer (Octet 40 - Bit 7)
          LE Periodic Advertising Sync Transfer Parameters (Octet 41 - Bit 0)
          LE Set Default Periodic Advertisng Sync Transfer Parameters (Octet 41 - Bit 1)
          LE Read Buffer v2 (Octet 41 - Bit 5)
          LE Read ISO TX Sync (Octet 41 - Bit 6)
          LE Set Connected Isochronous Group Parameters (Octet 41 - Bit 7)
          LE Set Connected Isochronous Group Parameters Test (Octet 42 - Bit 0)
          LE Create Connected Isochronous Stream (Octet 42 - Bit 1)
          LE Remove Connected Isochronous Group (Octet 42 - Bit 2)
          LE Accept Connected Isochronous Stream Request (Octet 42 - Bit 3)
          LE Reject Connected Isochronous Stream Request (Octet 42 - Bit 4)
          LE Create Broadcast Isochronous Group (Octet 42 - Bit 5)
          LE Create Broadcast Isochronous Group Test (Octet 42 - Bit 6)
          LE Terminate Broadcast Isochronous Group (Octet 42 - Bit 7)
          LE Broadcast Isochronous Group Create Sync (Octet 43 - Bit 0)
          LE Broadcast Isochronous Group Terminate Sync (Octet 43 - Bit 1)
          LE Request Peer SCA (Octet 43 - Bit 2)
          LE Setup Isochronous Data Path (Octet 43 - Bit 3)
          LE Remove Isochronous Data Path (Octet 43 - Bit 4)
          LE Isochronous Transmit Test (Octet 43 - Bit 5)
          LE Isochronous Receive Test (Octet 43 - Bit 6)
          LE Isochronous Read Test Counters (Octet 43 - Bit 7)
          LE Isochronous Read Test Counters (Octet 44 - Bit 0)
          LE Set Host Feature (Octet 44 - Bit 1)
          LE Read ISO link quality (Octet 44 - Bit 2)
          Octet 45 - Bit 6 
          Octet 46 - Bit 0 
          Octet 46 - Bit 1 
          Octet 46 - Bit 2 
zephyr.exe[3890097]: < HCI Command: Host Buffer Size (0x03|0x0033) plen 7                                             #9 0.988329
        ACL MTU: 255  ACL max packet: 16
        SCO MTU: 0    SCO max packet: 0
> HCI Event: Command Complete (0x0e) plen 4                                                                          #10 0.988900
      Host Buffer Size (0x03|0x0033) ncmd 1
        Status: Success (0x00)
zephyr.exe[3890097]: < HCI Command: Set Controller To Host Flow Control (0x03|0x0031) plen 1                         #11 1.008367
        Flow control: ACL Data Packets (0x01)
> HCI Event: Command Complete (0x0e) plen 4                                                                          #12 1.009205
      Set Controller To Host Flow Control (0x03|0x0031) ncmd 1
        Status: Success (0x00)
zephyr.exe[3890097]: < HCI Command: LE Read Local Supported Features (0x08|0x0003) plen 0                            #13 1.028336
> HCI Event: Command Complete (0x0e) plen 12                                                                         #14 1.029418
      LE Read Local Supported Features (0x08|0x0003) ncmd 1
        Status: Success (0x00)
        Features: 0xfd 0x79 0x00 0xf7 0x30 0x01 0x00 0x00
          LE Encryption
          Extended Reject Indication
          Peripheral-initiated Features Exchange
          LE Ping
          LE Data Packet Length Extension
          LL Privacy
          Extended Scanner Filter Policies
          LE 2M PHY
          LE Coded PHY
          LE Extended Advertising
          LE Periodic Advertising
          Channel Selection Algorithm #2
          Periodic Advertising Sync Transfer - Sender
          Periodic Advertising Sync Transfer - Recipient
          Sleep Clock Accuracy Updates
          Connected Isochronous Stream - Central
          Connected Isochronous Stream - Peripheral
          Isochronous Broadcaster
          Synchronized Receiver
          Periodic Advertising ADI support
          Connection Subrating
          Unknown features (0x0000010000000000)
zephyr.exe[3890097]: < HCI Command: LE Set Host Feature (0x08|0x0074) plen 2                                         #15 1.048344
        Bit Number: 32
          Connected Isochronous Stream (Host Support)
        Bit Value: 1
> HCI Event: Command Complete (0x0e) plen 4                                                                          #16 1.049020
      LE Set Host Feature (0x08|0x0074) ncmd 1
        Status: Success (0x00)
zephyr.exe[3890097]: < HCI Command: LE Read Buffer v2 (0x08|0x0060) plen 0                                           #17 1.068312
> HCI Event: Command Complete (0x0e) plen 10                                                                         #18 1.069002
      LE Read Buffer v2 (0x08|0x0060) ncmd 1
        Status: Success (0x00)
        ACL MTU: 27
        ACL max packet: 3
        ISO MTU: 318
        ISO max packet: 3
zephyr.exe[3890097]: < HCI Command: LE Read Maximum Advertising Data Length (0x08|0x003a) plen 0                     #19 1.088353
> HCI Event: Command Complete (0x0e) plen 6                                                                          #20 1.088986
      LE Read Maximum Advertising Data Length (0x08|0x003a) ncmd 1
        Status: Success (0x00)
        Max length: 1650
zephyr.exe[3890097]: < HCI Command: LE Read Supported States (0x08|0x001c) plen 0                                    #21 1.108337
> HCI Event: Command Complete (0x0e) plen 12                                                                         #22 1.108984
      LE Read Supported States (0x08|0x001c) ncmd 1
        Status: Success (0x00)
        States: 0x000003ff3e0306ff
          Non-connectable Advertising State
          Scannable Advertising State
          Connectable Advertising State
          High Duty Cycle Directed Advertising State
          Passive Scanning State
          Active Scanning State
          Initiating State
            and Connection State (Central Role)
          Connection State (Peripheral Role)
          Scannable Advertising State
            and Passive Scanning State
          Connectable Advertising State
            and Passive Scanning State
          Non-connectable Advertising State
            and Initiating State
          Scannable Advertising State
            and Initiating State
          Active Scanning State
            and Connection State (Central Role)
          Passive Scanning State
            and Connection State (Peripheral Role)
          Active Scanning State
            and Connection State (Peripheral Role)
          Initiating State
            and Connection State (Central Role)
            and Central Role & Central Role
          Low Duty Cycle Directed Advertising State
          Connectable Advertising State
            and Initiating State
            and Central Role & Peripheral Role
          High Duty Cycle Directed Advertising State
            and Initiating State
            and Central Role & Peripheral Role
          Low Duty Cycle Directed Advertising State
            and Initiating State
            and Central Role & Peripheral Role
          Connectable Advertising State
            and Connection State (Central Role)
            and Central Role & Peripheral Role
          High Duty Cycle Directed Advertising State
            and Connection State (Central Role)
            and Central Role & Peripheral Role
          Low Duty Cycle Directed Advertising State
            and Connection State (Central Role)
            and Central Role & Peripheral Role
          Connectable Advertising State
            and Connection State (Peripheral Role)
            and Central Role & Peripheral Role
          High Duty Cycle Directed Advertising State
            and Connection State (Peripheral Role)
            and Peripheral Role & Peripheral Role
          Low Duty Cycle Directed Advertising State
            and Connection State (Peripheral Role)
            and Peripheral Role & Peripheral Role
          Initiating State
            and Connection State (Peripheral Role)
            and Central Role & Peripheral Role
zephyr.exe[3890097]: < HCI Command: LE Read Maximum Data Length (0x08|0x002f) plen 0                                 #23 1.128329
> HCI Event: Command Complete (0x0e) plen 12                                                                         #24 1.129593
      LE Read Maximum Data Length (0x08|0x002f) ncmd 1
        Status: Success (0x00)
        Max TX octets: 251
        Max TX time: 2704
        Max RX octets: 251
        Max RX time: 2704
zephyr.exe[3890097]: < HCI Command: LE Write Suggested Default Data Length (0x08|0x0024) plen 4                      #25 1.148319
        TX octets: 251
        TX time: 2704
> HCI Event: Command Complete (0x0e) plen 4                                                                          #26 1.149021
      LE Write Suggested Default Data Length (0x08|0x0024) ncmd 1
        Status: Success (0x00)
zephyr.exe[3890097]: < HCI Command: LE Read Resolving List Size (0x08|0x002a) plen 0                                 #27 1.168327
> HCI Event: Command Complete (0x0e) plen 5                                                                          #28 1.168857
      LE Read Resolving List Size (0x08|0x002a) ncmd 1
        Status: Success (0x00)
        Size: 8
zephyr.exe[3890097]: < HCI Command: LE Set Event Mask (0x08|0x0001) plen 8                                           #29 1.188322
        Mask: 0x000002023f87fa5e
          LE Advertising Report
          LE Connection Update Complete
          LE Read Remote Used Features Complete
          LE Long Term Key Request
          LE Data Length Change
          LE Enhanced Connection Complete
          LE PHY Update Complete
          LE Extended Advertising Report
          LE Periodic Advertising Sync Established
          LE Periodic Advertising Report
          LE Periodic Advertising Sync Lost
          LE Extended Scan Timeout
          LE Extended Advertising Set Terminated
          LE Scan Request Received
          LE Periodic Advertising Sync Transfer Rvc
          LE CIS Established
          LE CIS Request
          LE Create BIG Complete
          LE Terminate BIG Complete
          LE BIG Sync Established Complete
          LE BIG Sync Lost
          LE BIG Info Advertising Report
          Unknown mask (0x0000020000000000)
> HCI Event: Command Complete (0x0e) plen 4                                                                          #30 1.189093
      LE Set Event Mask (0x08|0x0001) ncmd 1
        Status: Success (0x00)
zephyr.exe[3890097]: < HCI Command: Set Event Mask (0x03|0x0001) plen 8                                              #31 1.208350
        Mask: 0x2000800002008890
          Disconnection Complete
          Encryption Change
          Read Remote Version Information Complete
          Hardware Error
          Data Buffer Overflow
          Encryption Key Refresh Complete
          LE Meta
> HCI Event: Command Complete (0x0e) plen 4                                                                          #32 1.209151
      Set Event Mask (0x03|0x0001) ncmd 1
        Status: Success (0x00)
zephyr.exe[3890097]: < HCI Command: Read BD ADDR (0x04|0x0009) plen 0                                                #33 1.228354
> HCI Event: Command Complete (0x0e) plen 10                                                                         #34 1.229031
      Read BD ADDR (0x04|0x0009) ncmd 1
        Status: Success (0x00)
        Address: 00:00:00:00:00:00 (OUI 00-00-00)
zephyr.exe[3890097]: < HCI Command: LE Set Random Address (0x08|0x0005) plen 6                                       #35 1.248305
        Address: D5:B6:CC:31:DB:3B (Static)
> HCI Event: Command Complete (0x0e) plen 4                                                                          #36 1.249041
      LE Set Random Address (0x08|0x0005) ncmd 1
        Status: Success (0x00)
zephyr.exe[3890097]: < HCI Command: LE Set Extended Advertising Parameters (0x08|0x0036) plen 25                     #37 6.538365
        Handle: 0x00
        Properties: 0x0013
          Connectable
          Scannable
          Use legacy advertising PDUs: ADV_IND
        Min advertising interval: 100.000 msec (0x00a0)
        Max advertising interval: 150.000 msec (0x00f0)
        Channel map: 37, 38, 39 (0x07)
        Own address type: Random (0x01)
        Peer address type: Public (0x00)
        Peer address: 00:00:00:00:00:00 (OUI 00-00-00)
        Filter policy: Allow Scan Request from Any, Allow Connect Request from Any (0x00)
        TX power: Host has no preference (0x7f)
        Primary PHY: LE 1M (0x01)
        Secondary max skip: 0x00
        Secondary PHY: LE 1M (0x01)
        SID: 0x00
        Scan request notifications: Disabled (0x00)
> HCI Event: Command Complete (0x0e) plen 5                                                                          #38 6.539122
      LE Set Extended Advertising Parameters (0x08|0x0036) ncmd 1
        Status: Success (0x00)
        TX power (selected): 0 dbm (0x00)
zephyr.exe[3890097]: < HCI Command: LE Set Advertising Set Random Address (0x08|0x0035) plen 7                       #39 6.548395
        Advertising handle: 0x00
        Advertising random address: D5:B6:CC:31:DB:3B (Static)
> HCI Event: Command Complete (0x0e) plen 4                                                                          #40 6.549207
      LE Set Advertising Set Random Address (0x08|0x0035) ncmd 1
        Status: Success (0x00)
zephyr.exe[3890097]: < HCI Command: LE Set Extended Advertising Data (0x08|0x0037) plen 22                           #41 6.568404
        Handle: 0x00
        Operation: Complete extended advertising data (0x03)
        Fragment preference: Minimize fragmentation (0x01)
        Data length: 0x12
        Flags: 0x06
          LE General Discoverable Mode
          BR/EDR Not Supported
        Name (complete): Tester_F6B11A
> HCI Event: Command Complete (0x0e) plen 4                                                                          #42 6.569704
      LE Set Extended Advertising Data (0x08|0x0037) ncmd 1
        Status: Success (0x00)
zephyr.exe[3890097]: < HCI Command: LE Set Extended Scan Response Data (0x08|0x0038) plen 4                          #43 6.588344
        Handle: 0x00
        Operation: Complete scan response data (0x03)
        Fragment preference: Minimize fragmentation (0x01)
        Data length: 0x00
> HCI Event: Command Complete (0x0e) plen 4                                                                          #44 6.589084
      LE Set Extended Scan Response Data (0x08|0x0038) ncmd 1
        Status: Success (0x00)
zephyr.exe[3890097]: < HCI Command: LE Set Extended Advertising Enable (0x08|0x0039) plen 6                          #45 6.608398
        Extended advertising: Enabled (0x01)
        Number of sets: 1 (0x01)
        Entry 0
          Handle: 0x00
          Duration: 0 ms (0x00)
          Max ext adv events: 0
> HCI Event: Command Complete (0x0e) plen 4                                                                          #46 6.609002
      LE Set Extended Advertising Enable (0x08|0x0039) ncmd 1
        Status: Success (0x00)
> HCI Event: LE Meta Event (0x3e) plen 31                                                                            #47 6.940771
      LE Enhanced Connection Complete (0x0a)
        Status: Success (0x00)
        Handle: 543
        Role: Peripheral (0x01)
        Peer address type: Public (0x00)
        Peer address: DF:A9:FF:F6:B1:1A (OUI DF-A9-FF)
        Local resolvable private address: 00:00:00:00:00:00 (Non-Resolvable)
        Peer resolvable private address: 00:00:00:00:00:00 (Non-Resolvable)
        Connection interval: 87.50 msec (0x0046)
        Connection latency: 0 (0x0000)
        Supervision timeout: 20000 msec (0x07d0)
        Central clock accuracy: 0x01
> HCI Event: LE Meta Event (0x3e) plen 6                                                                             #48 6.941070
      LE Advertising Set Terminated (0x12)
        Status: Success (0x00)
        Handle: 0
        Connection handle: 543
        Number of completed extended advertising events: 0
zephyr.exe[3890097]: < HCI Command: LE Read Remote Used Features (0x08|0x0016) plen 2                                #49 6.948573
        Handle: 543 Address: DF:A9:FF:F6:B1:1A (OUI DF-A9-FF)
> HCI Event: Command Status (0x0f) plen 4                                                                            #50 6.949329
      LE Read Remote Used Features (0x08|0x0016) ncmd 1
        Status: Success (0x00)
> HCI Event: LE Meta Event (0x3e) plen 12                                                                            #51 7.205001
      LE Read Remote Used Features (0x04)
        Status: Success (0x00)
        Handle: 543 Address: DF:A9:FF:F6:B1:1A (OUI DF-A9-FF)
        Features: 0x2d 0x49 0x00 0xf7 0x67 0xd8 0x00 0x00
          LE Encryption
          Extended Reject Indication
          Peripheral-initiated Features Exchange
          LE Data Packet Length Extension
          LE 2M PHY
          LE Coded PHY
          Channel Selection Algorithm #2
          Periodic Advertising Sync Transfer - Sender
          Periodic Advertising Sync Transfer - Recipient
          Sleep Clock Accuracy Updates
          Connected Isochronous Stream - Central
          Connected Isochronous Stream - Peripheral
          Isochronous Broadcaster
          Synchronized Receiver
          Connected Isochronous Stream (Host Support)
          LE Power Control Request
          LE Power Control Request
          Connection Subrating
          Connection Subrating (Host Support)
          Unknown features (0x0000d80000000000)
> ACL Data RX: Handle 543 flags 0x02 dlen 11                                                                         #52 7.641977
      SMP: Pairing Request (0x01) len 6
        IO capability: KeyboardDisplay (0x04)
        OOB data: Authentication data from remote device present (0x01)
        Authentication requirement: No bonding, MITM, SC, No Keypresses (0x0c)
        Max encryption key size: 16
        Initiator key distribution: <none> (0x00)
        Responder key distribution: <none> (0x00)
zephyr.exe[3890097]: < HCI Command: Host Number of Completed Packets (0x03|0x0035) plen 5                            #53 7.648495
        Num handles: 1
        Handle: 543 Address: DF:A9:FF:F6:B1:1A (OUI DF-A9-FF)
        Count: 1
zephyr.exe[3890097]: < ACL Data TX: Handle 543 [1/3] flags 0x00 dlen 11                                              #54 7.648544
      SMP: Pairing Response (0x02) len 6
        IO capability: DisplayOnly (0x00)
        OOB data: Authentication data not present (0x00)
        Authentication requirement: Bonding, No MITM, SC, No Keypresses (0x09)
        Max encryption key size: 16
        Initiator key distribution: <none> (0x00)
        Responder key distribution: <none> (0x00)
> HCI Event: Number of Completed Packets (0x13) plen 5                                                               #55 7.817015
        Num handles: 1
        Handle: 543 Address: DF:A9:FF:F6:B1:1A (OUI DF-A9-FF)
        Count: 1
        Buffers: 0/3
        #54: len 11 (0 Kb/s)
        Latency: 168 msec (168-168 msec ~168 msec)
> ACL Data RX: Handle 543 flags 0x02 dlen 27                                                                         #56 7.817594
> ACL Data RX: Handle 543 flags 0x01 dlen 27                                                                         #57 7.817902
> ACL Data RX: Handle 543 flags 0x01 dlen 15                                                                         #58 7.818439
      SMP: Pairing Public Key (0x0c) len 64
        X[32]: 9f5dd85547a37ebdde1193dbc47d6adae6417144305a2262fd54be728025823a
        Y[32]: 17555df14360b4517a87063454561f480fccf491b59da04c441cbfca4f22cb82
zephyr.exe[3890097]: < HCI Command: Host Number of Completed Packets (0x03|0x0035) plen 5                            #59 7.828509
        Num handles: 1
        Handle: 543 Address: DF:A9:FF:F6:B1:1A (OUI DF-A9-FF)
        Count: 1
zephyr.exe[3890097]: < HCI Command: Host Number of Completed Packets (0x03|0x0035) plen 5                            #60 7.828661
        Num handles: 1
        Handle: 543 Address: DF:A9:FF:F6:B1:1A (OUI DF-A9-FF)
        Count: 1
zephyr.exe[3890097]: < HCI Command: Host Number of Completed Packets (0x03|0x0035) plen 5                            #61 7.828664
        Num handles: 1
        Handle: 543 Address: DF:A9:FF:F6:B1:1A (OUI DF-A9-FF)
        Count: 1
zephyr.exe[3890097]: < ACL Data TX: Handle 543 [1/3] flags 0x00 dlen 27                                              #62 7.828685
zephyr.exe[3890097]: < ACL Data TX: Handle 543 flags 0x01 dlen 27                                                    #63 7.828687
zephyr.exe[3890097]: < ACL Data TX: Handle 543 flags 0x01 dlen 15                                                    #64 7.828692
      SMP: Pairing Public Key (0x0c) len 64
        X[32]: 98308440221e2d910f0e54b71e7ec652857aa9b5a0dc65028824cc19db1226e9
        Y[32]: 67a4816bcb62efb21701e31fdb27561a6217575fb007a8bbdabe7e28b6f68482
> HCI Event: Number of Completed Packets (0x13) plen 5                                                               #65 7.905064
        Num handles: 1
        Handle: 543 Address: DF:A9:FF:F6:B1:1A (OUI DF-A9-FF)
        Count: 1
        Buffers: 0/3
        #62: len 27 (2 Kb/s)
        Latency: 76 msec (76-168 msec ~122 msec)
> HCI Event: Number of Completed Packets (0x13) plen 5                                                               #66 7.905504
        Num handles: 1
        Handle: 543 Address: DF:A9:FF:F6:B1:1A (OUI DF-A9-FF)
        Count: 1
        Buffers: underflow/3
        #63: len 27 (2 Kb/s)
        Latency: 76 msec (76-168 msec ~99 msec)
> HCI Event: Number of Completed Packets (0x13) plen 5                                                               #67 7.991838
        Num handles: 1
        Handle: 543 Address: DF:A9:FF:F6:B1:1A (OUI DF-A9-FF)
        Count: 1
        Buffers: underflow/3
        #64: len 15 (0 Kb/s)
        Latency: 163 msec (76-168 msec ~131 msec)
> ACL Data RX: Handle 543 flags 0x02 dlen 21                                                                         #68 7.992239
      SMP: Pairing Random (0x04) len 16
        Random value[16]: 6b87f27894895683d092d19a1dc7bb47
zephyr.exe[3890097]: < HCI Command: Host Number of Completed Packets (0x03|0x0035) plen 5                            #69 8.008496
        Num handles: 1
        Handle: 543 Address: DF:A9:FF:F6:B1:1A (OUI DF-A9-FF)
        Count: 1
zephyr.exe[3890097]: < ACL Data TX: Handle 543 [1/3] flags 0x00 dlen 21                                              #70 8.008524
      SMP: Pairing Random (0x04) len 16
        Random value[16]: 5da095555cc64d02679f89a05211af56
> HCI Event: Number of Completed Packets (0x13) plen 5                                                               #71 8.166979
        Num handles: 1
        Handle: 543 Address: DF:A9:FF:F6:B1:1A (OUI DF-A9-FF)
        Count: 1
        Buffers: 0/3
        #70: len 21 (1 Kb/s)
        Latency: 158 msec (76-168 msec ~144 msec)
> ACL Data RX: Handle 543 flags 0x02 dlen 21                                                                         #72 8.167195
      SMP: Pairing DHKey Check (0x0d) len 16
        E[16]: 98722608dae050151b251e5fea2955cd
zephyr.exe[3890097]: < HCI Command: Host Number of Completed Packets (0x03|0x0035) plen 5                            #73 8.168594
        Num handles: 1
        Handle: 543 Address: DF:A9:FF:F6:B1:1A (OUI DF-A9-FF)
        Count: 1
zephyr.exe[3890097]: < ACL Data TX: Handle 543 [1/3] flags 0x00 dlen 21                                              #74 8.168617
      SMP: Pairing DHKey Check (0x0d) len 16
        E[16]: ae294dbc0d3d9bbf13d06ebd7694b75e
> HCI Event: Number of Completed Packets (0x13) plen 5                                                               #75 8.341870
        Num handles: 1
        Handle: 543 Address: DF:A9:FF:F6:B1:1A (OUI DF-A9-FF)
        Count: 1
        Buffers: 0/3
        #74: len 21 (0 Kb/s)
        Latency: 173 msec (76-173 msec ~159 msec)
> HCI Event: LE Meta Event (0x3e) plen 13                                                                            #76 8.430062
      LE Long Term Key Request (0x05)
        Handle: 543 Address: DF:A9:FF:F6:B1:1A (OUI DF-A9-FF)
        Random number: 0x0000000000000000
        Encrypted diversifier: 0x0000
zephyr.exe[3890097]: < HCI Command: LE Long Term Key Request Reply (0x08|0x001a) plen 18                             #77 8.448431
        Handle: 543 Address: DF:A9:FF:F6:B1:1A (OUI DF-A9-FF)
        Long term key[16]: d54fe99632ed3ada598b9f84cae415b2
> HCI Event: Command Complete (0x0e) plen 6                                                                          #78 8.449611
      LE Long Term Key Request Reply (0x08|0x001a) ncmd 1
        Status: Success (0x00)
        Handle: 543 Address: DF:A9:FF:F6:B1:1A (OUI DF-A9-FF)
> HCI Event: Encryption Change (0x08) plen 4                                                                         #79 8.867175
        Status: Success (0x00)
        Handle: 543 Address: DF:A9:FF:F6:B1:1A (OUI DF-A9-FF)
        Encryption: Enabled with AES-CCM (0x01)
zephyr.exe[3890097]: < ACL Data TX: Handle 543 [1/3] flags 0x00 dlen 16                                             #80 11.959080
      LE L2CAP: Connection Parameter Update Request (0x12) ident 1 len 8
        Min interval: 24
        Max interval: 40
        Peripheral latency: 0
        Timeout multiplier: 42
> HCI Event: Number of Completed Packets (0x13) plen 5                                                              #81 12.017034
        Num handles: 1
        Handle: 543 Address: DF:A9:FF:F6:B1:1A (OUI DF-A9-FF)
        Count: 1
        Buffers: 0/3
        #80: len 16 (2 Kb/s)
        Latency: 57 msec (57-173 msec ~108 msec)
> HCI Event: Disconnect Complete (0x05) plen 4                                                                      #82 12.017037
        Status: Success (0x00)
        Handle: 543 Address: DF:A9:FF:F6:B1:1A (OUI DF-A9-FF)
        Reason: Remote User Terminated Connection (0x13)
zephyr.exe[3890097]: < HCI Command: LE Set Extended Advertising Parameters (0x08|0x0036) plen 25                    #83 14.748537
        Handle: 0x00
        Properties: 0x0013
          Connectable
          Scannable
          Use legacy advertising PDUs: ADV_IND
        Min advertising interval: 100.000 msec (0x00a0)
        Max advertising interval: 150.000 msec (0x00f0)
        Channel map: 37, 38, 39 (0x07)
        Own address type: Random (0x01)
        Peer address type: Public (0x00)
        Peer address: 00:00:00:00:00:00 (OUI 00-00-00)
        Filter policy: Allow Scan Request from Any, Allow Connect Request from Any (0x00)
        TX power: Host has no preference (0x7f)
        Primary PHY: LE 1M (0x01)
        Secondary max skip: 0x00
        Secondary PHY: LE 1M (0x01)
        SID: 0x00
        Scan request notifications: Disabled (0x00)
> HCI Event: Command Complete (0x0e) plen 5                                                                         #84 14.749387
      LE Set Extended Advertising Parameters (0x08|0x0036) ncmd 1
        Status: Success (0x00)
        TX power (selected): 0 dbm (0x00)
zephyr.exe[3890097]: < HCI Command: LE Set Advertising Set Random Address (0x08|0x0035) plen 7                      #85 14.768501
        Advertising handle: 0x00
        Advertising random address: D5:B6:CC:31:DB:3B (Static)
> HCI Event: Command Complete (0x0e) plen 4                                                                         #86 14.769109
      LE Set Advertising Set Random Address (0x08|0x0035) ncmd 1
        Status: Success (0x00)
zephyr.exe[3890097]: < HCI Command: LE Set Extended Advertising Data (0x08|0x0037) plen 22                          #87 14.788461
        Handle: 0x00
        Operation: Complete extended advertising data (0x03)
        Fragment preference: Minimize fragmentation (0x01)
        Data length: 0x12
        Flags: 0x06
          LE General Discoverable Mode
          BR/EDR Not Supported
        Name (complete): Tester_F6B11A
> HCI Event: Command Complete (0x0e) plen 4                                                                         #88 14.789324
      LE Set Extended Advertising Data (0x08|0x0037) ncmd 1
        Status: Success (0x00)
zephyr.exe[3890097]: < HCI Command: LE Set Extended Scan Response Data (0x08|0x0038) plen 4                         #89 14.808503
        Handle: 0x00
        Operation: Complete scan response data (0x03)
        Fragment preference: Minimize fragmentation (0x01)
        Data length: 0x00
> HCI Event: Command Complete (0x0e) plen 4                                                                         #90 14.809410
      LE Set Extended Scan Response Data (0x08|0x0038) ncmd 1
        Status: Success (0x00)
zephyr.exe[3890097]: < HCI Command: LE Set Extended Advertising Enable (0x08|0x0039) plen 6                         #91 14.828470
        Extended advertising: Enabled (0x01)
        Number of sets: 1 (0x01)
        Entry 0
          Handle: 0x00
          Duration: 0 ms (0x00)
          Max ext adv events: 0
> HCI Event: Command Complete (0x0e) plen 4                                                                         #92 14.829227
      LE Set Extended Advertising Enable (0x08|0x0039) ncmd 1
        Status: Success (0x00)
> HCI Event: LE Meta Event (0x3e) plen 31                                                                           #93 15.047171
      LE Enhanced Connection Complete (0x0a)
        Status: Success (0x00)
        Handle: 561
        Role: Peripheral (0x01)
        Peer address type: Public (0x00)
        Peer address: DF:A9:FF:F6:B1:1A (OUI DF-A9-FF)
        Local resolvable private address: 00:00:00:00:00:00 (Non-Resolvable)
        Peer resolvable private address: 00:00:00:00:00:00 (Non-Resolvable)
        Connection interval: 87.50 msec (0x0046)
        Connection latency: 0 (0x0000)
        Supervision timeout: 20000 msec (0x07d0)
        Central clock accuracy: 0x01
> HCI Event: LE Meta Event (0x3e) plen 6                                                                            #94 15.047310
      LE Advertising Set Terminated (0x12)
        Status: Success (0x00)
        Handle: 0
        Connection handle: 561
        Number of completed extended advertising events: 0
zephyr.exe[3890097]: < HCI Command: LE Read Remote Used Features (0x08|0x0016) plen 2                               #95 15.048617
        Handle: 561 Address: DF:A9:FF:F6:B1:1A (OUI DF-A9-FF)
> HCI Event: Command Status (0x0f) plen 4                                                                           #96 15.049172
      LE Read Remote Used Features (0x08|0x0016) ncmd 1
        Status: Success (0x00)
> HCI Event: LE Meta Event (0x3e) plen 12                                                                           #97 15.311313
      LE Read Remote Used Features (0x04)
        Status: Success (0x00)
        Handle: 561 Address: DF:A9:FF:F6:B1:1A (OUI DF-A9-FF)
        Features: 0x2d 0x49 0x00 0xf7 0x67 0xd8 0x00 0x00
          LE Encryption
          Extended Reject Indication
          Peripheral-initiated Features Exchange
          LE Data Packet Length Extension
          LE 2M PHY
          LE Coded PHY
          Channel Selection Algorithm #2
          Periodic Advertising Sync Transfer - Sender
          Periodic Advertising Sync Transfer - Recipient
          Sleep Clock Accuracy Updates
          Connected Isochronous Stream - Central
          Connected Isochronous Stream - Peripheral
          Isochronous Broadcaster
          Synchronized Receiver
          Connected Isochronous Stream (Host Support)
          LE Power Control Request
          LE Power Control Request
          Connection Subrating
          Connection Subrating (Host Support)
          Unknown features (0x0000d80000000000)
> ACL Data RX: Handle 561 flags 0x02 dlen 11                                                                        #98 15.748532
      SMP: Pairing Request (0x01) len 6
        IO capability: KeyboardDisplay (0x04)
        OOB data: Authentication data not present (0x00)
        Authentication requirement: No bonding, MITM, SC, No Keypresses (0x0c)
        Max encryption key size: 16
        Initiator key distribution: <none> (0x00)
        Responder key distribution: <none> (0x00)
zephyr.exe[3890097]: < HCI Command: Host Number of Completed Packets (0x03|0x0035) plen 5                           #99 15.768577
        Num handles: 1
        Handle: 561 Address: DF:A9:FF:F6:B1:1A (OUI DF-A9-FF)
        Count: 1
zephyr.exe[3890097]: < ACL Data TX: Handle 561 [1/3] flags 0x00 dlen 11                                            #100 15.768646
      SMP: Pairing Response (0x02) len 6
        IO capability: DisplayOnly (0x00)
        OOB data: Authentication data from remote device present (0x01)
        Authentication requirement: Bonding, No MITM, SC, No Keypresses (0x09)
        Max encryption key size: 16
        Initiator key distribution: <none> (0x00)
        Responder key distribution: <none> (0x00)
> HCI Event: Number of Completed Packets (0x13) plen 5                                                             #101 15.923826
        Num handles: 1
        Handle: 561 Address: DF:A9:FF:F6:B1:1A (OUI DF-A9-FF)
        Count: 1
        Buffers: 0/3
        #100: len 11 (0 Kb/s)
        Latency: 155 msec (155-155 msec ~155 msec)
> ACL Data RX: Handle 561 flags 0x02 dlen 27                                                                       #102 15.924190
> ACL Data RX: Handle 561 flags 0x01 dlen 27                                                                       #103 15.924300
> ACL Data RX: Handle 561 flags 0x01 dlen 15                                                                       #104 15.925913
      SMP: Pairing Public Key (0x0c) len 64
        X[32]: 852c863011f901bc75002699faee88cb2a6a09fcfc0bd74ccba8f56de0a0ceb6
        Y[32]: 73c9f1f6b760ef3af96087bc27620174cff4ccfa66345288d490294aea8a6bf6
zephyr.exe[3890097]: < HCI Command: Host Number of Completed Packets (0x03|0x0035) plen 5                          #105 15.928656
        Num handles: 1
        Handle: 561 Address: DF:A9:FF:F6:B1:1A (OUI DF-A9-FF)
        Count: 1
zephyr.exe[3890097]: < HCI Command: Host Number of Completed Packets (0x03|0x0035) plen 5                          #106 15.928720
        Num handles: 1
        Handle: 561 Address: DF:A9:FF:F6:B1:1A (OUI DF-A9-FF)
        Count: 1
zephyr.exe[3890097]: < HCI Command: Host Number of Completed Packets (0x03|0x0035) plen 5                          #107 15.928725
        Num handles: 1
        Handle: 561 Address: DF:A9:FF:F6:B1:1A (OUI DF-A9-FF)
        Count: 1
zephyr.exe[3890097]: < ACL Data TX: Handle 561 [1/3] flags 0x00 dlen 27                                            #108 15.928789
zephyr.exe[3890097]: < ACL Data TX: Handle 561 flags 0x01 dlen 27                                                  #109 15.928792
zephyr.exe[3890097]: < ACL Data TX: Handle 561 flags 0x01 dlen 15                                                  #110 15.928793
      SMP: Pairing Public Key (0x0c) len 64
        X[32]: 98308440221e2d910f0e54b71e7ec652857aa9b5a0dc65028824cc19db1226e9
        Y[32]: 67a4816bcb62efb21701e31fdb27561a6217575fb007a8bbdabe7e28b6f68482
> HCI Event: Number of Completed Packets (0x13) plen 5                                                             #111 16.011362
        Num handles: 1
        Handle: 561 Address: DF:A9:FF:F6:B1:1A (OUI DF-A9-FF)
        Count: 1
        Buffers: 0/3
        #108: len 27 (2 Kb/s)
        Latency: 82 msec (82-155 msec ~118 msec)
> HCI Event: Number of Completed Packets (0x13) plen 5                                                             #112 16.011973
        Num handles: 1
        Handle: 561 Address: DF:A9:FF:F6:B1:1A (OUI DF-A9-FF)
        Count: 1
        Buffers: underflow/3
        #109: len 27 (2 Kb/s)
        Latency: 83 msec (82-155 msec ~101 msec)
> HCI Event: Number of Completed Packets (0x13) plen 5                                                             #113 16.098592
        Num handles: 1
        Handle: 561 Address: DF:A9:FF:F6:B1:1A (OUI DF-A9-FF)
        Count: 1
        Buffers: underflow/3
        #110: len 15 (0 Kb/s)
        Latency: 169 msec (82-169 msec ~135 msec)
> ACL Data RX: Handle 561 flags 0x02 dlen 21                                                                       #114 16.098698
      SMP: Pairing Random (0x04) len 16
        Random value[16]: 6abaf4944ff43aad13a1e4e9d2dbf641
zephyr.exe[3890097]: < HCI Command: Host Number of Completed Packets (0x03|0x0035) plen 5                          #115 16.108647
        Num handles: 1
        Handle: 561 Address: DF:A9:FF:F6:B1:1A (OUI DF-A9-FF)
        Count: 1
zephyr.exe[3890097]: < ACL Data TX: Handle 561 [1/3] flags 0x00 dlen 21                                            #116 16.108716
      SMP: Pairing Random (0x04) len 16
        Random value[16]: a2acf8fd71a45c4a1bcadd27bd58e945
> HCI Event: Number of Completed Packets (0x13) plen 5                                                             #117 16.273556
        Num handles: 1
        Handle: 561 Address: DF:A9:FF:F6:B1:1A (OUI DF-A9-FF)
        Count: 1
        Buffers: 0/3
        #116: len 21 (1 Kb/s)
        Latency: 164 msec (82-169 msec ~150 msec)
> ACL Data RX: Handle 561 flags 0x02 dlen 21                                                                       #118 16.273762
      SMP: Pairing DHKey Check (0x0d) len 16
        E[16]: 5ada8481171446eb185fa1ae5056adf5
zephyr.exe[3890097]: < HCI Command: Host Number of Completed Packets (0x03|0x0035) plen 5                          #119 16.288622
        Num handles: 1
        Handle: 561 Address: DF:A9:FF:F6:B1:1A (OUI DF-A9-FF)
        Count: 1
zephyr.exe[3890097]: < ACL Data TX: Handle 561 [1/3] flags 0x00 dlen 21                                            #120 16.288685
      SMP: Pairing DHKey Check (0x0d) len 16
        E[16]: 2a8886276ac1442ba54c4bd5f2023e19
> HCI Event: Number of Completed Packets (0x13) plen 5                                                             #121 16.448292
        Num handles: 1
        Handle: 561 Address: DF:A9:FF:F6:B1:1A (OUI DF-A9-FF)
        Count: 1
        Buffers: 0/3
        #120: len 21 (1 Kb/s)
        Latency: 159 msec (82-169 msec ~154 msec)
> HCI Event: LE Meta Event (0x3e) plen 13                                                                          #122 16.536674
      LE Long Term Key Request (0x05)
        Handle: 561 Address: DF:A9:FF:F6:B1:1A (OUI DF-A9-FF)
        Random number: 0x0000000000000000
        Encrypted diversifier: 0x0000
zephyr.exe[3890097]: < HCI Command: LE Long Term Key Request Reply (0x08|0x001a) plen 18                           #123 16.548527
        Handle: 561 Address: DF:A9:FF:F6:B1:1A (OUI DF-A9-FF)
        Long term key[16]: c2c689083e04c125dd9db0f9c9c30b66
> HCI Event: Command Complete (0x0e) plen 6                                                                        #124 16.549849
      LE Long Term Key Request Reply (0x08|0x001a) ncmd 1
        Status: Success (0x00)
        Handle: 561 Address: DF:A9:FF:F6:B1:1A (OUI DF-A9-FF)
> HCI Event: Encryption Change (0x08) plen 4                                                                       #125 16.973656
        Status: Success (0x00)
        Handle: 561 Address: DF:A9:FF:F6:B1:1A (OUI DF-A9-FF)
        Encryption: Enabled with AES-CCM (0x01)
zephyr.exe[3890097]: < ACL Data TX: Handle 561 [1/3] flags 0x00 dlen 16                                            #126 20.058573
      LE L2CAP: Connection Parameter Update Request (0x12) ident 2 len 8
        Min interval: 24
        Max interval: 40
        Peripheral latency: 0
        Timeout multiplier: 42
> HCI Event: Number of Completed Packets (0x13) plen 5                                                             #127 20.123479
        Num handles: 1
        Handle: 561 Address: DF:A9:FF:F6:B1:1A (OUI DF-A9-FF)
        Count: 1
        Buffers: 0/3
        #126: len 16 (2 Kb/s)
        Latency: 64 msec (64-169 msec ~109 msec)
> HCI Event: Disconnect Complete (0x05) plen 4                                                                     #128 20.123601
        Status: Success (0x00)
        Handle: 561 Address: DF:A9:FF:F6:B1:1A (OUI DF-A9-FF)
        Reason: Remote User Terminated Connection (0x13)
zephyr.exe[3890097]: < HCI Command: LE Set Extended Advertising Parameters (0x08|0x0036) plen 25                   #129 24.958645
        Handle: 0x00
        Properties: 0x0013
          Connectable
          Scannable
          Use legacy advertising PDUs: ADV_IND
        Min advertising interval: 100.000 msec (0x00a0)
        Max advertising interval: 150.000 msec (0x00f0)
        Channel map: 37, 38, 39 (0x07)
        Own address type: Random (0x01)
        Peer address type: Public (0x00)
        Peer address: 00:00:00:00:00:00 (OUI 00-00-00)
        Filter policy: Allow Scan Request from Any, Allow Connect Request from Any (0x00)
        TX power: Host has no preference (0x7f)
        Primary PHY: LE 1M (0x01)
        Secondary max skip: 0x00
        Secondary PHY: LE 1M (0x01)
        SID: 0x00
        Scan request notifications: Disabled (0x00)
> HCI Event: Command Complete (0x0e) plen 5                                                                        #130 24.959696
      LE Set Extended Advertising Parameters (0x08|0x0036) ncmd 1
        Status: Success (0x00)
        TX power (selected): 0 dbm (0x00)
zephyr.exe[3890097]: < HCI Command: LE Set Advertising Set Random Address (0x08|0x0035) plen 7                     #131 24.968643
        Advertising handle: 0x00
        Advertising random address: D5:B6:CC:31:DB:3B (Static)
> HCI Event: Command Complete (0x0e) plen 4                                                                        #132 24.969771
      LE Set Advertising Set Random Address (0x08|0x0035) ncmd 1
        Status: Success (0x00)
zephyr.exe[3890097]: < HCI Command: LE Set Extended Advertising Data (0x08|0x0037) plen 22                         #133 24.988657
        Handle: 0x00
        Operation: Complete extended advertising data (0x03)
        Fragment preference: Minimize fragmentation (0x01)
        Data length: 0x12
        Flags: 0x06
          LE General Discoverable Mode
          BR/EDR Not Supported
        Name (complete): Tester_F6B11A
> HCI Event: Command Complete (0x0e) plen 4                                                                        #134 24.989805
      LE Set Extended Advertising Data (0x08|0x0037) ncmd 1
        Status: Success (0x00)
zephyr.exe[3890097]: < HCI Command: LE Set Extended Scan Response Data (0x08|0x0038) plen 4                        #135 25.008640
        Handle: 0x00
        Operation: Complete scan response data (0x03)
        Fragment preference: Minimize fragmentation (0x01)
        Data length: 0x00
> HCI Event: Command Complete (0x0e) plen 4                                                                        #136 25.009185
      LE Set Extended Scan Response Data (0x08|0x0038) ncmd 1
        Status: Success (0x00)
zephyr.exe[3890097]: < HCI Command: LE Set Extended Advertising Enable (0x08|0x0039) plen 6                        #137 25.028645
        Extended advertising: Enabled (0x01)
        Number of sets: 1 (0x01)
        Entry 0
          Handle: 0x00
          Duration: 0 ms (0x00)
          Max ext adv events: 0
> HCI Event: Command Complete (0x0e) plen 4                                                                        #138 25.029582
      LE Set Extended Advertising Enable (0x08|0x0039) ncmd 1
        Status: Success (0x00)
> HCI Event: LE Meta Event (0x3e) plen 31                                                                          #139 25.144238
      LE Enhanced Connection Complete (0x0a)
        Status: Success (0x00)
        Handle: 579
        Role: Peripheral (0x01)
        Peer address type: Public (0x00)
        Peer address: DF:A9:FF:F6:B1:1A (OUI DF-A9-FF)
        Local resolvable private address: 00:00:00:00:00:00 (Non-Resolvable)
        Peer resolvable private address: 00:00:00:00:00:00 (Non-Resolvable)
        Connection interval: 87.50 msec (0x0046)
        Connection latency: 0 (0x0000)
        Supervision timeout: 20000 msec (0x07d0)
        Central clock accuracy: 0x01
> HCI Event: LE Meta Event (0x3e) plen 6                                                                           #140 25.144254
      LE Advertising Set Terminated (0x12)
        Status: Success (0x00)
        Handle: 0
        Connection handle: 579
        Number of completed extended advertising events: 0
zephyr.exe[3890097]: < HCI Command: LE Read Remote Used Features (0x08|0x0016) plen 2                              #141 25.148789
        Handle: 579 Address: DF:A9:FF:F6:B1:1A (OUI DF-A9-FF)
> HCI Event: Command Status (0x0f) plen 4                                                                          #142 25.149283
      LE Read Remote Used Features (0x08|0x0016) ncmd 1
        Status: Success (0x00)
> HCI Event: LE Meta Event (0x3e) plen 12                                                                          #143 25.408470
      LE Read Remote Used Features (0x04)
        Status: Success (0x00)
        Handle: 579 Address: DF:A9:FF:F6:B1:1A (OUI DF-A9-FF)
        Features: 0x2d 0x49 0x00 0xf7 0x67 0xd8 0x00 0x00
          LE Encryption
          Extended Reject Indication
          Peripheral-initiated Features Exchange
          LE Data Packet Length Extension
          LE 2M PHY
          LE Coded PHY
          Channel Selection Algorithm #2
          Periodic Advertising Sync Transfer - Sender
          Periodic Advertising Sync Transfer - Recipient
          Sleep Clock Accuracy Updates
          Connected Isochronous Stream - Central
          Connected Isochronous Stream - Peripheral
          Isochronous Broadcaster
          Synchronized Receiver
          Connected Isochronous Stream (Host Support)
          LE Power Control Request
          LE Power Control Request
          Connection Subrating
          Connection Subrating (Host Support)
          Unknown features (0x0000d80000000000)
> ACL Data RX: Handle 579 flags 0x02 dlen 11                                                                       #144 25.845620
      SMP: Pairing Request (0x01) len 6
        IO capability: KeyboardDisplay (0x04)
        OOB data: Authentication data from remote device present (0x01)
        Authentication requirement: No bonding, MITM, SC, No Keypresses (0x0c)
        Max encryption key size: 16
        Initiator key distribution: <none> (0x00)
        Responder key distribution: <none> (0x00)
zephyr.exe[3890097]: < HCI Command: Host Number of Completed Packets (0x03|0x0035) plen 5                          #145 25.848697
        Num handles: 1
        Handle: 579 Address: DF:A9:FF:F6:B1:1A (OUI DF-A9-FF)
        Count: 1
zephyr.exe[3890097]: < ACL Data TX: Handle 579 [1/3] flags 0x00 dlen 11                                            #146 25.848721
      SMP: Pairing Response (0x02) len 6
        IO capability: DisplayOnly (0x00)
        OOB data: Authentication data from remote device present (0x01)
        Authentication requirement: Bonding, No MITM, SC, No Keypresses (0x09)
        Max encryption key size: 16
        Initiator key distribution: <none> (0x00)
        Responder key distribution: <none> (0x00)
> HCI Event: Number of Completed Packets (0x13) plen 5                                                             #147 26.020907
        Num handles: 1
        Handle: 579 Address: DF:A9:FF:F6:B1:1A (OUI DF-A9-FF)
        Count: 1
        Buffers: 0/3
        #146: len 11 (0 Kb/s)
        Latency: 172 msec (172-172 msec ~172 msec)
> ACL Data RX: Handle 579 flags 0x02 dlen 27                                                                       #148 26.021052
> ACL Data RX: Handle 579 flags 0x01 dlen 27                                                                       #149 26.021370
> ACL Data RX: Handle 579 flags 0x01 dlen 15                                                                       #150 26.021743
      SMP: Pairing Public Key (0x0c) len 64
        X[32]: ccae4229a07aca6d2a57ac017def0428138676e01ece0e7e968ecfe6be386489
        Y[32]: 7cd03f04bbe5ec7ec7f564645c1c6c5c23114127b6d45b3505d7580a148fe884
zephyr.exe[3890097]: < HCI Command: Host Number of Completed Packets (0x03|0x0035) plen 5                          #151 26.028790
        Num handles: 1
        Handle: 579 Address: DF:A9:FF:F6:B1:1A (OUI DF-A9-FF)
        Count: 1
zephyr.exe[3890097]: < HCI Command: Host Number of Completed Packets (0x03|0x0035) plen 5                          #152 26.028873
        Num handles: 1
        Handle: 579 Address: DF:A9:FF:F6:B1:1A (OUI DF-A9-FF)
        Count: 1
zephyr.exe[3890097]: < HCI Command: Host Number of Completed Packets (0x03|0x0035) plen 5                          #153 26.028877
        Num handles: 1
        Handle: 579 Address: DF:A9:FF:F6:B1:1A (OUI DF-A9-FF)
        Count: 1
zephyr.exe[3890097]: < ACL Data TX: Handle 579 [1/3] flags 0x00 dlen 27                                            #154 26.028933
zephyr.exe[3890097]: < ACL Data TX: Handle 579 flags 0x01 dlen 27                                                  #155 26.028935
zephyr.exe[3890097]: < ACL Data TX: Handle 579 flags 0x01 dlen 15                                                  #156 26.028935
      SMP: Pairing Public Key (0x0c) len 64
        X[32]: 98308440221e2d910f0e54b71e7ec652857aa9b5a0dc65028824cc19db1226e9
        Y[32]: 67a4816bcb62efb21701e31fdb27561a6217575fb007a8bbdabe7e28b6f68482
> HCI Event: Number of Completed Packets (0x13) plen 5   