Bluetooth monitor ver 5.72
= Note: Linux version 6.14.0-36-generic (x86_64)                       0.312546
= Note: Bluetooth subsystem version 2.22                               0.312548
= New Index: 00:00:00:00:00:00 (Primary,UART,hci1)              [hci1] 0.312549
= New Index: 48:5F:99:8E:E0:64 (Primary,USB,hci0)               [hci0] 0.312550
= Open Index: 00:00:00:00:00:00                                 [hci1] 0.825939
= Index Info: 00:00:00:00:00:00 (Nordic Semiconductor ASA)      [hci1] 0.825947
@ USER Open: main (privileged) version 2.22            {0x0001} [hci1] 0.825950
< HCI Command: Reset (0x03|0x0003) plen 0                    #1 [hci1] 0.826454
> HCI Event: Command Complete (0x0e) plen 4                  #2 [hci1] 0.827100
      Reset (0x03|0x0003) ncmd 1
        Status: Success (0x00)
< HCI Command: Read Local Supported... (0x04|0x0003) plen 0  #3 [hci1] 0.845870
> HCI Event: Command Complete (0x0e) plen 12                 #4 [hci1] 0.846332
      Read Local Supported Features (0x04|0x0003) ncmd 1
        Status: Success (0x00)
        Features: 0x00 0x00 0x00 0x00 0x60 0x00 0x00 0x00
          BR/EDR Not Supported
          LE Supported (Controller)
< HCI Command: Read Local Version In.. (0x04|0x0001) plen 0  #5 [hci1] 0.865824
> HCI Event: Command Complete (0x0e) plen 12                 #6 [hci1] 0.866360
      Read Local Version Information (0x04|0x0001) ncmd 1
        Status: Success (0x00)
        HCI version: Reserved (0x0f) - Revision 12393 (0x3069)
        LMP version: Reserved (0x0f) - Subversion 12393 (0x3069)
        Manufacturer: Nordic Semiconductor ASA (89)
< HCI Command: Read Local Supported... (0x04|0x0002) plen 0  #7 [hci1] 0.885831
> HCI Event: Command Complete (0x0e) plen 68                 #8 [hci1] 0.886970
      Read Local Supported Commands (0x04|0x0002) ncmd 1
        Status: Success (0x00)
        Commands: 119 entries
          Disconnect (Octet 0 - Bit 5)
          Read Remote Version Information (Octet 2 - Bit 7)
          Set Event Mask (Octet 5 - Bit 6)
          Reset (Octet 5 - Bit 7)
          Read Connection Accept Timeout (Octet 7 - Bit 2)
          Write Connection Accept Timeout (Octet 7 - Bit 3)
          Read Transmit Power Level (Octet 10 - Bit 2)
          Set Controller To Host Flow Control (Octet 10 - Bit 5)
          Host Buffer Size (Octet 10 - Bit 6)
          Host Number of Completed Packets (Octet 10 - Bit 7)
          Read Local Version Information (Octet 14 - Bit 3)
          Read Local Supported Features (Octet 14 - Bit 5)
          Read BD ADDR (Octet 15 - Bit 1)
          Read RSSI (Octet 15 - Bit 5)
          Set Event Mask Page 2 (Octet 22 - Bit 2)
          LE Set Event Mask (Octet 25 - Bit 0)
          LE Read Buffer Size (Octet 25 - Bit 1)
          LE Read Local Supported Features (Octet 25 - Bit 2)
          LE Set Random Address (Octet 25 - Bit 4)
          LE Set Advertising Parameters (Octet 25 - Bit 5)
          LE Read Advertising Channel TX Power (Octet 25 - Bit 6)
          LE Set Advertising Data (Octet 25 - Bit 7)
          LE Set Scan Response Data (Octet 26 - Bit 0)
          LE Set Advertise Enable (Octet 26 - Bit 1)
          LE Set Scan Parameters (Octet 26 - Bit 2)
          LE Set Scan Enable (Octet 26 - Bit 3)
          LE Create Connection (Octet 26 - Bit 4)
          LE Create Connection Cancel (Octet 26 - Bit 5)
          LE Read Accept List Size (Octet 26 - Bit 6)
          LE Clear Accept List (Octet 26 - Bit 7)
          LE Add Device To Accept List (Octet 27 - Bit 0)
          LE Remove Device From Accept List (Octet 27 - Bit 1)
          LE Connection Update (Octet 27 - Bit 2)
          LE Set Host Channel Classification (Octet 27 - Bit 3)
          LE Read Channel Map (Octet 27 - Bit 4)
          LE Read Remote Used Features (Octet 27 - Bit 5)
          LE Encrypt (Octet 27 - Bit 6)
          LE Rand (Octet 27 - Bit 7)
          LE Start Encryption (Octet 28 - Bit 0)
          LE Long Term Key Request Reply (Octet 28 - Bit 1)
          LE Long Term Key Request Neg Reply (Octet 28 - Bit 2)
          LE Read Supported States (Octet 28 - Bit 3)
          LE Receiver Test (Octet 28 - Bit 4)
          LE Transmitter Test (Octet 28 - Bit 5)
          LE Test End (Octet 28 - Bit 6)
          Read Authenticated Payload Timeout (Octet 32 - Bit 4)
          Write Authenticated Payload Timeout (Octet 32 - Bit 5)
          LE Set Data Length (Octet 33 - Bit 6)
          LE Read Suggested Default Data Length (Octet 33 - Bit 7)
          LE Write Suggested Default Data Length (Octet 34 - Bit 0)
          LE Add Device To Resolving List (Octet 34 - Bit 3)
          LE Remove Device From Resolving List (Octet 34 - Bit 4)
          LE Clear Resolving List (Octet 34 - Bit 5)
          LE Read Resolving List Size (Octet 34 - Bit 6)
          LE Set Address Resolution Enable (Octet 35 - Bit 1)
          LE Set Resolvable Private Address Timeout (Octet 35 - Bit 2)
          LE Read Maximum Data Length (Octet 35 - Bit 3)
          LE Read PHY (Octet 35 - Bit 4)
          LE Set Default PHY (Octet 35 - Bit 5)
          LE Set PHY (Octet 35 - Bit 6)
          LE Enhanced Receiver Test (Octet 35 - Bit 7)
          LE Enhanced Transmitter Test (Octet 36 - Bit 0)
          LE Set Advertising Set Random Address (Octet 36 - Bit 1)
          LE Set Extended Advertising Parameters (Octet 36 - Bit 2)
          LE Set Extended Advertising Data (Octet 36 - Bit 3)
          LE Set Extended Scan Response Data (Octet 36 - Bit 4)
          LE Set Extended Advertising Enable (Octet 36 - Bit 5)
          LE Read Maximum Advertising Data Length (Octet 36 - Bit 6)
          LE Read Number of Supported Advertising Sets (Octet 36 - Bit 7)
          LE Remove Advertising Set (Octet 37 - Bit 0)
          LE Clear Advertising Sets (Octet 37 - Bit 1)
          LE Set Periodic Advertising Parameters (Octet 37 - Bit 2)
          LE Set Periodic Advertising Data (Octet 37 - Bit 3)
          LE Set Periodic Advertising Enable (Octet 37 - Bit 4)
          LE Set Extended Scan Parameters (Octet 37 - Bit 5)
          LE Set Extended Scan Enable (Octet 37 - Bit 6)
          LE Extended Create Connection (Octet 37 - Bit 7)
          LE Periodic Advertising Create Sync (Octet 38 - Bit 0)
          LE Periodic Advertising Create Sync Cancel (Octet 38 - Bit 1)
          LE Periodic Advertising Terminate Sync (Octet 38 - Bit 2)
          LE Add Device To Periodic Advertiser List (Octet 38 - Bit 3)
          LE Remove Device From Periodic Advertiser List (Octet 38 - Bit 4)
          LE Clear Periodic Advertiser List (Octet 38 - Bit 5)
          LE Read Periodic Advertiser List Size (Octet 38 - Bit 6)
          LE Read Transmit Power (Octet 38 - Bit 7)
          LE Read RF Path Compensation (Octet 39 - Bit 0)
          LE Write RF Path Compensation (Octet 39 - Bit 1)
          LE Set Privacy Mode (Octet 39 - Bit 2)
          LE Periodic Advertising Receive Enable (Octet 40 - Bit 5)
          LE Periodic Advertising Sync Transfer (Octet 40 - Bit 6)
          LE Periodic Advertising Set Info Transfer (Octet 40 - Bit 7)
          LE Periodic Advertising Sync Transfer Parameters (Octet 41 - Bit 0)
          LE Set Default Periodic Advertisng Sync Transfer Parameters (Octet 41 - Bit 1)
          LE Read Buffer v2 (Octet 41 - Bit 5)
          LE Read ISO TX Sync (Octet 41 - Bit 6)
          LE Set Connected Isochronous Group Parameters (Octet 41 - Bit 7)
          LE Set Connected Isochronous Group Parameters Test (Octet 42 - Bit 0)
          LE Create Connected Isochronous Stream (Octet 42 - Bit 1)
          LE Remove Connected Isochronous Group (Octet 42 - Bit 2)
          LE Accept Connected Isochronous Stream Request (Octet 42 - Bit 3)
          LE Reject Connected Isochronous Stream Request (Octet 42 - Bit 4)
          LE Create Broadcast Isochronous Group (Octet 42 - Bit 5)
          LE Create Broadcast Isochronous Group Test (Octet 42 - Bit 6)
          LE Terminate Broadcast Isochronous Group (Octet 42 - Bit 7)
          LE Broadcast Isochronous Group Create Sync (Octet 43 - Bit 0)
          LE Broadcast Isochronous Group Terminate Sync (Octet 43 - Bit 1)
          LE Request Peer SCA (Octet 43 - Bit 2)
          LE Setup Isochronous Data Path (Octet 43 - Bit 3)
          LE Remove Isochronous Data Path (Octet 43 - Bit 4)
          LE Isochronous Transmit Test (Octet 43 - Bit 5)
          LE Isochronous Receive Test (Octet 43 - Bit 6)
          LE Isochronous Read Test Counters (Octet 43 - Bit 7)
          LE Isochronous Read Test Counters (Octet 44 - Bit 0)
          LE Set Host Feature (Octet 44 - Bit 1)
          Octet 44 - Bit 2 
          Octet 45 - Bit 6 
          Octet 46 - Bit 0 
          Octet 46 - Bit 1 
          Octet 46 - Bit 2 
< HCI Command: Host Buffer Size (0x03|0x0033) plen 7         #9 [hci1] 0.905855
        ACL MTU: 255  ACL max packet: 16
        SCO MTU: 0    SCO max packet: 0
> HCI Event: Command Complete (0x0e) plen 4                 #10 [hci1] 0.906531
      Host Buffer Size (0x03|0x0033) ncmd 1
        Status: Success (0x00)
< HCI Command: Set Controller To Ho.. (0x03|0x0031) plen 1  #11 [hci1] 0.925869
        Flow control: ACL Data Packets (0x01)
> HCI Event: Command Complete (0x0e) plen 4                 #12 [hci1] 0.926297
      Set Controller To Host Flow Control (0x03|0x0031) ncmd 1
        Status: Success (0x00)
< HCI Command: LE Read Local Suppor.. (0x08|0x0003) plen 0  #13 [hci1] 0.945866
> HCI Event: Command Complete (0x0e) plen 12                #14 [hci1] 0.946350
      LE Read Local Supported Features (0x08|0x0003) ncmd 1
        Status: Success (0x00)
        Features: 0xfd 0x79 0x00 0xf7 0x30 0x01 0x00 0x00
          LE Encryption
          Extended Reject Indication
          Peripheral-initiated Features Exchange
          LE Ping
          LE Data Packet Length Extension
          LL Privacy
          Extended Scanner Filter Policies
          LE 2M PHY
          LE Coded PHY
          LE Extended Advertising
          LE Periodic Advertising
          Channel Selection Algorithm #2
          Periodic Advertising Sync Transfer - Sender
          Periodic Advertising Sync Transfer - Recipient
          Sleep Clock Accuracy Updates
          Connected Isochronous Stream - Central
          Connected Isochronous Stream - Peripheral
          Isochronous Broadcaster
          Synchronized Receiver
          Periodic Advertising ADI support
          Connection Subrating
          Unknown features (0x0000010000000000)
< HCI Command: LE Set Host Feature (0x08|0x0074) plen 2     #15 [hci1] 0.965789
        Bit Number: 32
          Connected Isochronous Stream (Host Support)
        Bit Value: 1
> HCI Event: Command Complete (0x0e) plen 4                 #16 [hci1] 0.966197
      LE Set Host Feature (0x08|0x0074) ncmd 1
        Status: Success (0x00)
< HCI Command: LE Read Buffer v2 (0x08|0x0060) plen 0       #17 [hci1] 0.985824
> HCI Event: Command Complete (0x0e) plen 10                #18 [hci1] 0.986395
      LE Read Buffer v2 (0x08|0x0060) ncmd 1
        Status: Success (0x00)
        ACL MTU: 27
        ACL max packet: 3
        ISO MTU: 318
        ISO max packet: 3
< HCI Command: LE Read Maximum Adve.. (0x08|0x003a) plen 0  #19 [hci1] 1.005871
> HCI Event: Command Complete (0x0e) plen 6                 #20 [hci1] 1.006382
      LE Read Maximum Advertising Data Length (0x08|0x003a) ncmd 1
        Status: Success (0x00)
        Max length: 1650
< HCI Command: LE Read Supported St.. (0x08|0x001c) plen 0  #21 [hci1] 1.025864
> HCI Event: Command Complete (0x0e) plen 12                #22 [hci1] 1.026482
      LE Read Supported States (0x08|0x001c) ncmd 1
        Status: Success (0x00)
        States: 0x000003ff3e0306ff
          Non-connectable Advertising State
          Scannable Advertising State
          Connectable Advertising State
          High Duty Cycle Directed Advertising State
          Passive Scanning State
          Active Scanning State
          Initiating State
            and Connection State (Central Role)
          Connection State (Peripheral Role)
          Scannable Advertising State
            and Passive Scanning State
          Connectable Advertising State
            and Passive Scanning State
          Non-connectable Advertising State
            and Initiating State
          Scannable Advertising State
            and Initiating State
          Active Scanning State
            and Connection State (Central Role)
          Passive Scanning State
            and Connection State (Peripheral Role)
          Active Scanning State
            and Connection State (Peripheral Role)
          Initiating State
            and Connection State (Central Role)
            and Central Role & Central Role
          Low Duty Cycle Directed Advertising State
          Connectable Advertising State
            and Initiating State
            and Central Role & Peripheral Role
          High Duty Cycle Directed Advertising State
            and Initiating State
            and Central Role & Peripheral Role
          Low Duty Cycle Directed Advertising State
            and Initiating State
            and Central Role & Peripheral Role
          Connectable Advertising State
            and Connection State (Central Role)
            and Central Role & Peripheral Role
          High Duty Cycle Directed Advertising State
            and Connection State (Central Role)
            and Central Role & Peripheral Role
          Low Duty Cycle Directed Advertising State
            and Connection State (Central Role)
            and Central Role & Peripheral Role
          Connectable Advertising State
            and Connection State (Peripheral Role)
            and Central Role & Peripheral Role
          High Duty Cycle Directed Advertising State
            and Connection State (Peripheral Role)
            and Peripheral Role & Peripheral Role
          Low Duty Cycle Directed Advertising State
            and Connection State (Peripheral Role)
            and Peripheral Role & Peripheral Role
          Initiating State
            and Connection State (Peripheral Role)
            and Central Role & Peripheral Role
< HCI Command: LE Read Maximum Data.. (0x08|0x002f) plen 0  #23 [hci1] 1.045781
> HCI Event: Command Complete (0x0e) plen 12                #24 [hci1] 1.046316
      LE Read Maximum Data Length (0x08|0x002f) ncmd 1
        Status: Success (0x00)
        Max TX octets: 251
        Max TX time: 2704
        Max RX octets: 251
        Max RX time: 2704
< HCI Command: LE Write Suggested D.. (0x08|0x0024) plen 4  #25 [hci1] 1.065849
        TX octets: 251
        TX time: 2704
> HCI Event: Command Complete (0x0e) plen 4                 #26 [hci1] 1.066348
      LE Write Suggested Default Data Length (0x08|0x0024) ncmd 1
        Status: Success (0x00)
< HCI Command: LE Read Resolving Li.. (0x08|0x002a) plen 0  #27 [hci1] 1.085872
> HCI Event: Command Complete (0x0e) plen 5                 #28 [hci1] 1.086302
      LE Read Resolving List Size (0x08|0x002a) ncmd 1
        Status: Success (0x00)
        Size: 8
< HCI Command: LE Set Event Mask (0x08|0x0001) plen 8       #29 [hci1] 1.105856
        Mask: 0x000002023f87fa5e
          LE Advertising Report
          LE Connection Update Complete
          LE Read Remote Used Features Complete
          LE Long Term Key Request
          LE Data Length Change
          LE Enhanced Connection Complete
          LE PHY Update Complete
          LE Extended Advertising Report
          LE Periodic Advertising Sync Established
          LE Periodic Advertising Report
          LE Periodic Advertising Sync Lost
          LE Extended Scan Timeout
          LE Extended Advertising Set Terminated
          LE Scan Request Received
          LE Periodic Advertising Sync Transfer Rvc
          LE CIS Established
          LE CIS Request
          LE Create BIG Complete
          LE Terminate BIG Complete
          LE BIG Sync Estabilished Complete
          LE BIG Sync Lost
          LE BIG Info Advertising Report
          Unknown mask (0x0000020000000000)
> HCI Event: Command Complete (0x0e) plen 4                 #30 [hci1] 1.106466
      LE Set Event Mask (0x08|0x0001) ncmd 1
        Status: Success (0x00)
< HCI Command: Set Event Mask (0x03|0x0001) plen 8          #31 [hci1] 1.125844
        Mask: 0x2000800002008890
          Disconnection Complete
          Encryption Change
          Read Remote Version Information Complete
          Hardware Error
          Data Buffer Overflow
          Encryption Key Refresh Complete
          LE Meta
> HCI Event: Command Complete (0x0e) plen 4                 #32 [hci1] 1.126459
      Set Event Mask (0x03|0x0001) ncmd 1
        Status: Success (0x00)
< HCI Command: Read BD ADDR (0x04|0x0009) plen 0            #33 [hci1] 1.145843
> HCI Event: Command Complete (0x0e) plen 10                #34 [hci1] 1.146447
      Read BD ADDR (0x04|0x0009) ncmd 1
        Status: Success (0x00)
        Address: 00:00:00:00:00:00 (OUI 00-00-00)
< HCI Command: LE Set Random Address (0x08|0x0005) plen 6   #35 [hci1] 1.165843
        Address: D5:B6:CC:31:DB:3B (Static)
> HCI Event: Command Complete (0x0e) plen 4                 #36 [hci1] 1.166450
      LE Set Random Address (0x08|0x0005) ncmd 1
        Status: Success (0x00)
< HCI Command: LE Set Random Address (0x08|0x0005) plen 6   #37 [hci1] 3.876218
        Address: 26:66:F9:08:61:8E (Non-Resolvable)
> HCI Event: Command Complete (0x0e) plen 4                 #38 [hci1] 3.876771
      LE Set Random Address (0x08|0x0005) ncmd 1
        Status: Success (0x00)
< HCI Command: LE Set Extended Scan.. (0x08|0x0041) plen 8  #39 [hci1] 3.886114
        Own address type: Random (0x01)
        Filter policy: Accept all advertisement (0x00)
        PHYs: 0x01
        Entry 0: LE 1M
          Type: Active (0x01)
          Interval: 60.000 msec (0x0060)
          Window: 30.000 msec (0x0030)
> HCI Event: Command Complete (0x0e) plen 4                 #40 [hci1] 3.886690
      LE Set Extended Scan Parameters (0x08|0x0041) ncmd 1
        Status: Success (0x00)
< HCI Command: LE Set Extended Scan.. (0x08|0x0042) plen 6  #41 [hci1] 3.906012
        Extended scan: Enabled (0x01)
        Filter duplicates: Enabled (0x01)
        Duration: 0 msec (0x0000)
        Period: 0.00 sec (0x0000)
> HCI Event: Command Complete (0x0e) plen 4                 #42 [hci1] 3.906578
      LE Set Extended Scan Enable (0x08|0x0042) ncmd 1
        Status: Success (0x00)
> HCI Event: LE Meta Event (0x3e) plen 57                   #43 [hci1] 3.912918
      LE Extended Advertising Report (0x0d)
        Num reports: 1
        Entry 0
          Event type: 0x0010
            Props: 0x0010
              Use legacy advertising PDUs
            Data status: [0;32mComplete[0m
          Legacy PDU Type: ADV_NONCONN_IND (0x0010)
          Address type: Random (0x01)
          Address: 13:C6:44:4F:8F:9C (Non-Resolvable)
          Primary PHY: LE 1M
          Secondary PHY: No packets
          SID: no ADI field (0xff)
          TX power: 127 dBm
          RSSI: -92 dBm (0xa4)
          Periodic advertising interval: 0.00 msec (0x0000)
          Direct address type: Reserved (0xff)
          Direct address: 00-00-00-00-00-00
          Data length: 0x1f
        1e ff 06 00 01 09 20 22 e2 a7 13 b9 f5 25 5e 53  ...... ".....%^S
        ca 67 b1 a9 22 27 e7 1b ec 33 ec 54 b0 01 19     .g.."'...3.T... 
        Company: Microsoft (6)
          Data: 01092022e2a713b9f5255e53ca67b1a92227e71bec33ec54b00119
> HCI Event: LE Meta Event (0x3e) plen 52                   #44 [hci1] 3.919623
      LE Extended Advertising Report (0x0d)
        Num reports: 1
        Entry 0
          Event type: 0x0010
            Props: 0x0010
              Use legacy advertising PDUs
            Data status: [0;32mComplete[0m
          Legacy PDU Type: ADV_NONCONN_IND (0x0010)
          Address type: Random (0x01)
          Address: 11:92:7C:FF:25:78 (Non-Resolvable)
          Primary PHY: LE 1M
          Secondary PHY: No packets
          SID: no ADI field (0xff)
          TX power: 127 dBm
          RSSI: -83 dBm (0xad)
          Periodic advertising interval: 0.00 msec (0x0000)
          Direct address type: Reserved (0xff)
          Direct address: 00-00-00-00-00-00
          Data length: 0x1a
        19 ff 06 00 01 0f 21 2a 54 d1 1a d2 c5 28 43 43  ......!*T....(CC
        50 31 34 53 2d 4a 45 52 5a 59                    P14S-JERZY      
        Company: Microsoft (6)
          Data: 010f212a54d11ad2c5284343503134532d4a45525a59
> HCI Event: LE Meta Event (0x3e) plen 38                   #45 [hci1] 3.996064
      LE Extended Advertising Report (0x0d)
        Num reports: 1
        Entry 0
          Event type: 0x0012
            Props: 0x0012
              Scannable
              Use legacy advertising PDUs
            Data status: [0;32mComplete[0m
          Legacy PDU Type: ADV_SCAN_IND (0x0012)
          Address type: Random (0x01)
          Address: 5E:20:AE:0F:68:64 (Resolvable)
          Primary PHY: LE 1M
          Secondary PHY: No packets
          SID: no ADI field (0xff)
          TX power: 127 dBm
          RSSI: -87 dBm (0xa9)
          Periodic advertising interval: 0.00 msec (0x0000)
          Direct address type: Reserved (0xff)
          Direct address: 00-00-00-00-00-00
          Data length: 0x0c
        0b ff 4c 00 09 06 03 00 0a 03 07 11              ..L.........    
        Company: Apple, Inc. (76)
          Type: Apple TV (9)
          Data: 03000a030711
> HCI Event: LE Meta Event (0x3e) plen 26                   #46 [hci1] 3.996455
      LE Extended Advertising Report (0x0d)
        Num reports: 1
        Entry 0
          Event type: 0x001a
            Props: 0x001a
              Scannable
              Scan response
              Use legacy advertising PDUs
            Data status: [0;32mComplete[0m
          Legacy PDU Type: SCAN_RSP to an ADV_IND (0x001a)
          Address type: Random (0x01)
          Address: 5E:20:AE:0F:68:64 (Resolvable)
          Primary PHY: LE 1M
          Secondary PHY: No packets
          SID: no ADI field (0xff)
          TX power: 127 dBm
          RSSI: -87 dBm (0xa9)
          Periodic advertising interval: 0.00 msec (0x0000)
          Direct address type: Reserved (0xff)
          Direct address: 00-00-00-00-00-00
          Data length: 0x00
> HCI Event: LE Meta Event (0x3e) plen 54                   #47 [hci1] 4.059034
      LE Extended Advertising Report (0x0d)
        Num reports: 1
        Entry 0
          Event type: 0x0010
            Props: 0x0010
              Use legacy advertising PDUs
            Data status: [0;32mComplete[0m
          Legacy PDU Type: ADV_NONCONN_IND (0x0010)
          Address type: Public (0x00)
          Address: A4:30:7A:95:74:FB (Samsung Electronics Co.,Ltd)
          Primary PHY: LE 1M
          Secondary PHY: No packets
          SID: no ADI field (0xff)
          TX power: 127 dBm
          RSSI: -91 dBm (0xa5)
          Periodic advertising interval: 0.00 msec (0x0000)
          Direct address type: Reserved (0xff)
          Direct address: 00-00-00-00-00-00
          Data length: 0x1c
        1b ff 75 00 42 04 01 80 6e a4 30 7a 95 74 fb a6  ..u.B...n.0z.t..
        30 7a 95 74 fa 01 d8 41 c5 d9 00 00              0z.t...A....    
        Company: Samsung Electronics Co. Ltd. (117)
          Data: 420401806ea4307a9574fba6307a9574fa01d841c5d90000
> HCI Event: LE Meta Event (0x3e) plen 57                   #48 [hci1] 4.116095
      LE Extended Advertising Report (0x0d)
        Num reports: 1
        Entry 0
          Event type: 0x0010
            Props: 0x0010
              Use legacy advertising PDUs
            Data status: [0;32mComplete[0m
          Legacy PDU Type: ADV_NONCONN_IND (0x0010)
          Address type: Random (0x01)
          Address: 13:C6:44:4F:8F:9C (Non-Resolvable)
          Primary PHY: LE 1M
          Secondary PHY: No packets
          SID: no ADI field (0xff)
          TX power: 127 dBm
          RSSI: -91 dBm (0xa5)
          Periodic advertising interval: 0.00 msec (0x0000)
          Direct address type: Reserved (0xff)
          Direct address: 00-00-00-00-00-00
          Data length: 0x1f
        1e ff 06 00 01 09 20 22 e2 a7 13 b9 f5 25 5e 53  ...... ".....%^S
        ca 67 b1 a9 22 27 e7 1b ec 33 ec 54 b0 01 19     .g.."'...3.T... 
        Company: Microsoft (6)
          Data: 01092022e2a713b9f5255e53ca67b1a92227e71bec33ec54b00119
> HCI Event: LE Meta Event (0x3e) plen 29                   #49 [hci1] 4.217264
      LE Extended Advertising Report (0x0d)
        Num reports: 1
        Entry 0
          Event type: 0x0013
            Props: 0x0013
              Connectable
              Scannable
              Use legacy advertising PDUs
            Data status: [0;32mComplete[0m
          Legacy PDU Type: ADV_IND (0x0013)
          Address type: Random (0x01)
          Address: 75:D4:08:27:A1:27 (Resolvable)
          Primary PHY: LE 1M
          Secondary PHY: No packets
          SID: no ADI field (0xff)
          TX power: 127 dBm
          RSSI: -94 dBm (0xa2)
          Periodic advertising interval: 0.00 msec (0x0000)
          Direct address type: Reserved (0xff)
          Direct address: 00-00-00-00-00-00
          Data length: 0x03
        02 01 06                                         ...             
        Flags: 0x06
          LE General Discoverable Mode
          BR/EDR Not Supported
> HCI Event: LE Meta Event (0x3e) plen 26                   #50 [hci1] 4.217732
      LE Extended Advertising Report (0x0d)
        Num reports: 1
        Entry 0
          Event type: 0x001b
            Props: 0x001b
              Connectable
              Scannable
              Scan response
              Use legacy advertising PDUs
            Data status: [0;32mComplete[0m
          Legacy PDU Type: SCAN_RSP to an ADV_SCAN_IND (0x001b)
          Address type: Random (0x01)
          Address: 75:D4:08:27:A1:27 (Resolvable)
          Primary PHY: LE 1M
          Secondary PHY: No packets
          SID: no ADI field (0xff)
          TX power: 127 dBm
          RSSI: -93 dBm (0xa3)
          Periodic advertising interval: 0.00 msec (0x0000)
          Direct address type: Reserved (0xff)
          Direct address: 00-00-00-00-00-00
          Data length: 0x00
> HCI Event: LE Meta Event (0x3e) plen 57                   #51 [hci1] 4.288186
      LE Extended Advertising Report (0x0d)
        Num reports: 1
        Entry 0
          Event type: 0x0010
            Props: 0x0010
              Use legacy advertising PDUs
            Data status: [0;32mComplete[0m
          Legacy PDU Type: ADV_NONCONN_IND (0x0010)
          Address type: Random (0x01)
          Address: 03:96:0E:24:11:E8 (Non-Resolvable)
          Primary PHY: LE 1M
          Secondary PHY: No packets
          SID: no ADI field (0xff)
          TX power: 127 dBm
          RSSI: -92 dBm (0xa4)
          Periodic advertising interval: 0.00 msec (0x0000)
          Direct address type: Reserved (0xff)
          Direct address: 00-00-00-00-00-00
          Data length: 0x1f
        1e ff 06 00 01 09 20 22 0c c1 18 90 1b d9 9c 7d  ...... ".......}
        83 1f aa 53 45 03 15 ba 07 44 58 bd 8b d2 4b     ...SE....DX...K 
        Company: Microsoft (6)
          Data: 010920220cc118901bd99c7d831faa53450315ba074458bd8bd24b
> HCI Event: LE Meta Event (0x3e) plen 52                   #52 [hci1] 4.341495
      LE Extended Advertising Report (0x0d)
        Num reports: 1
        Entry 0
          Event type: 0x0010
            Props: 0x0010
              Use legacy advertising PDUs
            Data status: [0;32mComplete[0m
          Legacy PDU Type: ADV_NONCONN_IND (0x0010)
          Address type: Random (0x01)
          Address: 11:92:7C:FF:25:78 (Non-Resolvable)
          Primary PHY: LE 1M
          Secondary PHY: No packets
          SID: no ADI field (0xff)
          TX power: 127 dBm
          RSSI: -84 dBm (0xac)
          Periodic advertising interval: 0.00 msec (0x0000)
          Direct address type: Reserved (0xff)
          Direct address: 00-00-00-00-00-00
          Data length: 0x1a
        19 ff 06 00 01 0f 21 2a 54 d1 1a d2 c5 28 43 43  ......!*T....(CC
        50 31 34 53 2d 4a 45 52 5a 59                    P14S-JERZY      
        Company: Microsoft (6)
          Data: 010f212a54d11ad2c5284343503134532d4a45525a59
> HCI Event: LE Meta Event (0x3e) plen 55                   #53 [hci1] 4.345734
      LE Extended Advertising Report (0x0d)
        Num reports: 1
        Entry 0
          Event type: 0x0010
            Props: 0x0010
              Use legacy advertising PDUs
            Data status: [0;32mComplete[0m
          Legacy PDU Type: ADV_NONCONN_IND (0x0010)
          Address type: Random (0x01)
          Address: 05:A2:F8:EA:22:0B (Non-Resolvable)
          Primary PHY: LE 1M
          Secondary PHY: No packets
          SID: no ADI field (0xff)
          TX power: 127 dBm
          RSSI: -85 dBm (0xab)
          Periodic advertising interval: 0.00 msec (0x0000)
          Direct address type: Reserved (0xff)
          Direct address: 00-00-00-00-00-00
          Data length: 0x1d
        1c ff 06 00 01 09 21 0a 4d e0 8a 52 d2 d4 4c 41  ......!.M..R..LA
        50 54 4f 50 2d 45 35 32 45 4f 44 32 49           PTOP-E52EOD2I   
        Company: Microsoft (6)
          Data: 0109210a4de08a52d2d44c4150544f502d453532454f443249
> HCI Event: LE Meta Event (0x3e) plen 57                   #54 [hci1] 4.394469
      LE Extended Advertising Report (0x0d)
        Num reports: 1
        Entry 0
          Event type: 0x0010
            Props: 0x0010
              Use legacy advertising PDUs
            Data status: [0;32mComplete[0m
          Legacy PDU Type: ADV_NONCONN_IND (0x0010)
          Address type: Random (0x01)
          Address: 03:96:0E:24:11:E8 (Non-Resolvable)
          Primary PHY: LE 1M
          Secondary PHY: No packets
          SID: no ADI field (0xff)
          TX power: 127 dBm
          RSSI: -89 dBm (0xa7)
          Periodic advertising interval: 0.00 msec (0x0000)
          Direct address type: Reserved (0xff)
          Direct address: 00-00-00-00-00-00
          Data length: 0x1f
        1e ff 06 00 01 09 20 22 0c c1 18 90 1b d9 9c 7d  ...... ".......}
        83 1f aa 53 45 03 15 ba 07 44 58 bd 8b d2 4b     ...SE....DX...K 
        Company: Microsoft (6)
          Data: 010920220cc118901bd99c7d831faa53450315ba074458bd8bd24b
> HCI Event: LE Meta Event (0x3e) plen 57                   #55 [hci1] 4.398161
      LE Extended Advertising Report (0x0d)
        Num reports: 1
        Entry 0
          Event type: 0x0013
            Props: 0x0013
              Connectable
              Scannable
              Use legacy advertising PDUs
            Data status: [0;32mComplete[0m
          Legacy PDU Type: ADV_IND (0x0013)
          Address type: Random (0x01)
          Address: C1:E3:95:67:AC:55 (Static)
          Primary PHY: LE 1M
          Secondary PHY: No packets
          SID: no ADI field (0xff)
          TX power: 127 dBm
          RSSI: -93 dBm (0xa3)
          Periodic advertising interval: 0.00 msec (0x0000)
          Direct address type: Reserved (0xff)
          Direct address: 00-00-00-00-00-00
          Data length: 0x1f
        02 01 06 1b ff 99 04 05 10 54 29 1a bf 0e 03 c8  .........T).....
        01 00 00 28 ae 76 5d b2 3a c1 e3 95 67 ac 55     ...(.v].:...g.U 
        Flags: 0x06
          LE General Discoverable Mode
          BR/EDR Not Supported
        Company: Ruuvi Innovations Ltd. (1177)
          Data: 051054291abf0e03c801000028ae765db23ac1e39567ac55
> HCI Event: LE Meta Event (0x3e) plen 38                   #56 [hci1] 4.403467
      LE Extended Advertising Report (0x0d)
        Num reports: 1
        Entry 0
          Event type: 0x0012
            Props: 0x0012
              Scannable
              Use legacy advertising PDUs
            Data status: [0;32mComplete[0m
          Legacy PDU Type: ADV_SCAN_IND (0x0012)
          Address type: Random (0x01)
          Address: 5E:20:AE:0F:68:64 (Resolvable)
          Primary PHY: LE 1M
          Secondary PHY: No packets
          SID: no ADI field (0xff)
          TX power: 127 dBm
          RSSI: -90 dBm (0xa6)
          Periodic advertising interval: 0.00 msec (0x0000)
          Direct address type: Reserved (0xff)
          Direct address: 00-00-00-00-00-00
          Data length: 0x0c
        0b ff 4c 00 09 06 03 00 0a 03 07 11              ..L.........    
        Company: Apple, Inc. (76)
          Type: Apple TV (9)
          Data: 03000a030711
> HCI Event: LE Meta Event (0x3e) plen 26                   #57 [hci1] 4.403890
      LE Extended Advertising Report (0x0d)
        Num reports: 1
        Entry 0
          Event type: 0x001a
            Props: 0x001a
              Scannable
              Scan response
              Use legacy advertising PDUs
            Data status: [0;32mComplete[0m
          Legacy PDU Type: SCAN_RSP to an ADV_IND (0x001a)
          Address type: Random (0x01)
          Address: 5E:20:AE:0F:68:64 (Resolvable)
          Primary PHY: LE 1M
          Secondary PHY: No packets
          SID: no ADI field (0xff)
          TX power: 127 dBm
          RSSI: -90 dBm (0xa6)
          Periodic advertising interval: 0.00 msec (0x0000)
          Direct address type: Reserved (0xff)
          Direct address: 00-00-00-00-00-00
          Data length: 0x00
> HCI Event: LE Meta Event (0x3e) plen 55                   #58 [hci1] 4.452144
      LE Extended Advertising Report (0x0d)
        Num reports: 1
        Entry 0
          Event type: 0x0010
            Props: 0x0010
              Use legacy advertising PDUs
            Data status: [0;32mComplete[0m
          Legacy PDU Type: ADV_NONCONN_IND (0x0010)
          Address type: Random (0x01)
          Address: 05:A2:F8:EA:22:0B (Non-Resolvable)
          Primary PHY: LE 1M
          Secondary PHY: No packets
          SID: no ADI field (0xff)
          TX power: 127 dBm
          RSSI: -79 dBm (0xb1)
          Periodic advertising interval: 0.00 msec (0x0000)
          Direct address type: Reserved (0xff)
          Direct address: 00-00-00-00-00-00
          Data length: 0x1d
        1c ff 06 00 01 09 21 0a 4d e0 8a 52 d2 d4 4c 41  ......!.M..R..LA
        50 54 4f 50 2d 45 35 32 45 4f 44 32 49           PTOP-E52EOD2I   
        Company: Microsoft (6)
          Data: 0109210a4de08a52d2d44c4150544f502d453532454f443249
> HCI Event: LE Meta Event (0x3e) plen 54                   #59 [hci1] 4.523860
      LE Extended Advertising Report (0x0d)
        Num reports: 1
        Entry 0
          Event type: 0x0010
            Props: 0x0010
              Use legacy advertising PDUs
            Data status: [0;32mComplete[0m
          Legacy PDU Type: ADV_NONCONN_IND (0x0010)
          Address type: Public (0x00)
          Address: A4:30:7A:95:74:FB (Samsung Electronics Co.,Ltd)
          Primary PHY: LE 1M
          Secondary PHY: No packets
          SID: no ADI field (0xff)
          TX power: 127 dBm
          RSSI: -91 dBm (0xa5)
          Periodic advertising interval: 0.00 msec (0x0000)
          Direct address type: Reserved (0xff)
          Direct address: 00-00-00-00-00-00
          Data length: 0x1c
        1b ff 75 00 42 04 01 80 6e a4 30 7a 95 74 fb a6  ..u.B...n.0z.t..
        30 7a 95 74 fa 01 d8 41 c5 d9 00 00              0z.t...A....    
        Company: Samsung Electronics Co. Ltd. (117)
          Data: 420401806ea4307a9574fba6307a9574fa01d841c5d90000
> HCI Event: LE Meta Event (0x3e) plen 57                   #60 [hci1] 4.529167
      LE Extended Advertising Report (0x0d)
        Num reports: 1
        Entry 0
          Event type: 0x0010
            Props: 0x0010
              Use legacy advertising PDUs
            Data status: [0;32mComplete[0m
          Legacy PDU Type: ADV_NONCONN_IND (0x0010)
          Address type: Random (0x01)
          Address: 13:C6:44:4F:8F:9C (Non-Resolvable)
          Primary PHY: LE 1M
          Secondary PHY: No packets
          SID: no ADI field (0xff)
          TX power: 127 dBm
          RSSI: -95 dBm (0xa1)
          Periodic advertising interval: 0.00 msec (0x0000)
          Direct address type: Reserved (0xff)
          Direct address: 00-00-00-00-00-00
          Data length: 0x1f
        1e ff 06 00 01 09 20 22 e2 a7 13 b9 f5 25 5e 53  ...... ".....%^S
        ca 67 b1 a9 22 27 e7 1b ec 33 ec 54 b0 01 19     .g.."'...3.T... 
        Company: Microsoft (6)
          Data: 01092022e2a713b9f5255e53ca67b1a92227e71bec33ec54b00119
> HCI Event: LE Meta Event (0x3e) plen 57                   #61 [hci1] 4.716410
      LE Extended Advertising Report (0x0d)
        Num reports: 1
        Entry 0
          Event type: 0x0010
            Props: 0x0010
              Use legacy advertising PDUs
            Data status: [0;32mComplete[0m
          Legacy PDU Type: ADV_NONCONN_IND (0x0010)
          Address type: Random (0x01)
          Address: 03:96:0E:24:11:E8 (Non-Resolvable)
          Primary PHY: LE 1M
          Secondary PHY: No packets
          SID: no ADI field (0xff)
          TX power: 127 dBm
          RSSI: -93 dBm (0xa3)
          Periodic advertising interval: 0.00 msec (0x0000)
          Direct address type: Reserved (0xff)
          Direct address: 00-00-00-00-00-00
          Data length: 0x1f
        1e ff 06 00 01 09 20 22 0c c1 18 90 1b d9 9c 7d  ...... ".......}
        83 1f aa 53 45 03 15 ba 07 44 58 bd 8b d2 4b     ...SE....DX...K 
        Company: Microsoft (6)
          Data: 010920220cc118901bd99c7d831faa53450315ba074458bd8bd24b
> HCI Event: LE Meta Event (0x3e) plen 52                   #62 [hci1] 4.761430
      LE Extended Advertising Report (0x0d)
        Num reports: 1
        Entry 0
          Event type: 0x0010
            Props: 0x0010
              Use legacy advertising PDUs
            Data status: [0;32mComplete[0m
          Legacy PDU Type: ADV_NONCONN_IND (0x0010)
          Address type: Random (0x01)
          Address: 11:92:7C:FF:25:78 (Non-Resolvable)
          Primary PHY: LE 1M
          Secondary PHY: No packets
          SID: no ADI field (0xff)
          TX power: 127 dBm
          RSSI: -84 dBm (0xac)
          Periodic advertising interval: 0.00 msec (0x0000)
          Direct address type: Reserved (0xff)
          Direct address: 00-00-00-00-00-00
          Data length: 0x1a
        19 ff 06 00 01 0f 21 2a 54 d1 1a d2 c5 28 43 43  ......!*T....(CC
        50 31 34 53 2d 4a 45 52 5a 59                    P14S-JERZY      
        Company: Microsoft (6)
          Data: 010f212a54d11ad2c5284343503134532d4a45525a59
> HCI Event: LE Meta Event (0x3e) plen 55                   #63 [hci1] 4.768840
      LE Extended Advertising Report (0x0d)
        Num reports: 1
        Entry 0
          Event type: 0x0010
            Props: 0x0010
              Use legacy advertising PDUs
            Data status: [0;32mComplete[0m
          Legacy PDU Type: ADV_NONCONN_IND (0x0010)
          Address type: Random (0x01)
          Address: 05:A2:F8:EA:22:0B (Non-Resolvable)
          Primary PHY: LE 1M
          Secondary PHY: No packets
          SID: no ADI field (0xff)
          TX power: 127 dBm
          RSSI: -85 dBm (0xab)
          Periodic advertising interval: 0.00 msec (0x0000)
          Direct address type: Reserved (0xff)
          Direct address: 00-00-00-00-00-00
          Data length: 0x1d
        1c ff 06 00 01 09 21 0a 4d e0 8a 52 d2 d4 4c 41  ......!.M..R..LA
        50 54 4f 50 2d 45 35 32 45 4f 44 32 49           PTOP-E52EOD2I   
        Company: Microsoft (6)
          Data: 0109210a4de08a52d2d44c4150544f502d453532454f443249
> HCI Event: LE Meta Event (0x3e) plen 38                   #64 [hci1] 4.814670
      LE Extended Advertising Report (0x0d)
        Num reports: 1
        Entry 0
          Event type: 0x0012
            Props: 0x0012
              Scannable
              Use legacy advertising PDUs
            Data status: [0;32mComplete[0m
          Legacy PDU Type: ADV_SCAN_IND (0x0012)
          Address type: Random (0x01)
          Address: 5E:20:AE:0F:68:64 (Resolvable)
          Primary PHY: LE 1M
          Secondary PHY: No packets
          SID: no ADI field (0xff)
          TX power: 127 dBm
          RSSI: -90 dBm (0xa6)
          Periodic advertising interval: 0.00 msec (0x0000)
          Direct address type: Reserved (0xff)
          Direct address: 00-00-00-00-00-00
          Data length: 0x0c
        0b ff 4c 00 09 06 03 00 0a 03 07 11              ..L.........    
        Company: Apple, Inc. (76)
          Type: Apple TV (9)
          Data: 03000a030711
> HCI Event: LE Meta Event (0x3e) plen 54                   #65 [hci1] 4.832610
      LE Extended Advertising Report (0x0d)
        Num reports: 1
        Entry 0
          Event type: 0x0010
            Props: 0x0010
              Use legacy advertising PDUs
            Data status: [0;32mComplete[0m
          Legacy PDU Type: ADV_NONCONN_IND (0x0010)
          Address type: Public (0x00)
          Address: A4:30:7A:95:74:FB (Samsung Electronics Co.,Ltd)
          Primary PHY: LE 1M
          Secondary PHY: No packets
          SID: no ADI field (0xff)
          TX power: 127 dBm
          RSSI: -92 dBm (0xa4)
          Periodic advertising interval: 0.00 msec (0x0000)
          Direct address type: Reserved (0xff)
          Direct address: 00-00-00-00-00-00
          Data length: 0x1c
        1b ff 75 00 42 04 01 80 6e a4 30 7a 95 74 fb a6  ..u.B...n.0z.t..
        30 7a 95 74 fa 01 d8 41 c5 d9 00 00              0z.t...A....    
        Company: Samsung Electronics Co. Ltd. (117)
          Data: 420401806ea4307a9574fba6307a9574fa01d841c5d90000
> HCI Event: LE Meta Event (0x3e) plen 57                   #66 [hci1] 4.945328
      LE Extended Advertising Report (0x0d)
        Num reports: 1
        Entry 0
          Event type: 0x0010
            Props: 0x0010
              Use legacy advertising PDUs
            Data status: [0;32mComplete[0m
          Legacy PDU Type: ADV_NONCONN_IND (0x0010)
          Address type: Random (0x01)
          Address: 13:C6:44:4F:8F:9C (Non-Resolvable)
          Primary PHY: LE 1M
          Secondary PHY: No packets
          SID: no ADI field (0xff)
          TX power: 127 dBm
          RSSI: -94 dBm (0xa2)
          Periodic advertising interval: 0.00 msec (0x0000)
          Direct address type: Reserved (0xff)
          Direct address: 00-00-00-00-00-00
          Data length: 0x1f
        1e ff 06 00 01 09 20 22 e2 a7 13 b9 f5 25 5e 53  ...... ".....%^S
        ca 67 b1 a9 22 27 e7 1b ec 33 ec 54 b0 01 19     .g.."'...3.T... 
        Company: Microsoft (6)
          Data: 01092022e2a713b9f5255e53ca67b1a92227e71bec33ec54b00119
> HCI Event: LE Meta Event (0x3e) plen 38                   #67 [hci1] 4.950411
      LE Extended Advertising Report (0x0d)
        Num reports: 1
        Entry 0
          Event type: 0x0012
            Props: 0x0012
              Scannable
              Use legacy advertising PDUs
            Data status: [0;32mComplete[0m
          Legacy PDU Type: ADV_SCAN_IND (0x0012)
          Address type: Random (0x01)
          Address: 5E:20:AE:0F:68:64 (Resolvable)
          Primary PHY: LE 1M
          Secondary PHY: No packets
          SID: no ADI field (0xff)
          TX power: 127 dBm
          RSSI: -87 dBm (0xa9)
          Periodic advertising interval: 0.00 msec (0x0000)
          Direct address type: Reserved (0xff)
          Direct address: 00-00-00-00-00-00
          Data length: 0x0c
        0b ff 4c 00 09 06 03 00 0a 03 07 11              ..L.........    
        Company: Apple, Inc. (76)
          Type: Apple TV (9)
          Data: 03000a030711
> HCI Event: LE Meta Event (0x3e) plen 54                   #68 [hci1] 5.009828
      LE Extended Advertising Report (0x0d)
        Num reports: 1
        Entry 0
          Event type: 0x0010
            Props: 0x0010
              Use legacy advertising PDUs
            Data status: [0;32mComplete[0m
          Legacy PDU Type: ADV_NONCONN_IND (0x0010)
          Address type: Public (0x00)
          Address: A4:30:7A:95:74:FB (Samsung Electronics Co.,Ltd)
          Primary PHY: LE 1M
          Secondary PHY: No packets
          SID: no ADI field (0xff)
          TX power: 127 dBm
          RSSI: -92 dBm (0xa4)
          Periodic advertising interval: 0.00 msec (0x0000)
          Direct address type: Reserved (0xff)
          Direct address: 00-00-00-00-00-00
          Data length: 0x1c
        1b ff 75 00 42 04 01 80 6e a4 30 7a 95 74 fb a6  ..u.B...n.0z.t..
        30 7a 95 74 fa 01 d8 41 c5 d9 00 00              0z.t...A....    
        Company: Samsung Electronics Co. Ltd. (117)
          Data: 420401806ea4307a9574fba6307a9574fa01d841c5d90000
> HCI Event: LE Meta Event (0x3e) plen 57                   #69 [hci1] 5.050454
      LE Extended Advertising Report (0x0d)
        Num reports: 1
        Entry 0
          Event type: 0x0010
            Props: 0x0010
              Use legacy advertising PDUs
            Data status: [0;32mComplete[0m
          Legacy PDU Type: ADV_NONCONN_IND (0x0010)
          Address type: Random (0x01)
          Address: 13:C6:44:4F:8F:9C (Non-Resolvable)
          Primary PHY: LE 1M
          Secondary PHY: No packets
          SID: no ADI field (0xff)
          TX power: 127 dBm
          RSSI: -92 dBm (0xa4)
          Periodic advertising interval: 0.00 msec (0x0000)
          Direct address type: Reserved (0xff)
          Direct address: 00-00-00-00-00-00
          Data length: 0x1f
        1e ff 06 00 01 09 20 22 e2 a7 13 b9 f5 25 5e 53  ...... ".....%^S
        ca 67 b1 a9 22 27 e7 1b ec 33 ec 54 b0 01 19     .g.."'...3.T... 
        Company: Microsoft (6)
          Data: 01092022e2a713b9f5255e53ca67b1a92227e71bec33ec54b00119
> HCI Event: LE Meta Event (0x3e) plen 29                   #70 [hci1] 5.070142
      LE Extended Advertising Report (0x0d)
        Num reports: 1
        Entry 0
          Event type: 0x0013
            Props: 0x0013
              Connectable
              Scannable
              Use legacy advertising PDUs
            Data status: [0;32mComplete[0m
          Legacy PDU Type: ADV_IND (0x0013)
          Address type: Random (0x01)
          Address: 75:D4:08:27:A1:27 (Resolvable)
          Primary PHY: LE 1M
          Secondary PHY: No packets
          SID: no ADI field (0xff)
          TX power: 127 dBm
          RSSI: -93 dBm (0xa3)
          Periodic advertising interval: 0.00 msec (0x0000)
          Direct address type: Reserved (0xff)
          Direct address: 00-00-00-00-00-00
          Data length: 0x03
        02 01 06                                         ...             
        Flags: 0x06
          LE General Discoverable Mode
          BR/EDR Not Supported
> HCI Event: LE Meta Event (0x3e) plen 26                   #71 [hci1] 5.070586
      LE Extended Advertising Report (0x0d)
        Num reports: 1
        Entry 0
          Event type: 0x001b
            Props: 0x001b
              Connectable
              Scannable
              Scan response
              Use legacy advertising PDUs
            Data status: [0;32mComplete[0m
          Legacy PDU Type: SCAN_RSP to an ADV_SCAN_IND (0x001b)
          Address type: Random (0x01)
          Address: 75:D4:08:27:A1:27 (Resolvable)
          Primary PHY: LE 1M
          Secondary PHY: No packets
          SID: no ADI field (0xff)
          TX power: 127 dBm
          RSSI: -92 dBm (0xa4)
          Periodic advertising interval: 0.00 msec (0x0000)
          Direct address type: Reserved (0xff)
          Direct address: 00-00-00-00-00-00
          Data length: 0x00
> HCI Event: LE Meta Event (0x3e) plen 52                   #72 [hci1] 5.077185
      LE Extended Advertising Report (0x0d)
        Num reports: 1
        Entry 0
          Event type: 0x0010
            Props: 0x0010
              Use legacy advertising PDUs
            Data status: [0;32mComplete[0m
          Legacy PDU Type: ADV_NONCONN_IND (0x0010)
          Address type: Random (0x01)
          Address: 11:92:7C:FF:25:78 (Non-Resolvable)
          Primary PHY: LE 1M
          Secondary PHY: No packets
          SID: no ADI field (0xff)
          TX power: 127 dBm
          RSSI: -83 dBm (0xad)
          Periodic advertising interval: 0.00 msec (0x0000)
          Direct address type: Reserved (0xff)
          Direct address: 00-00-00-00-00-00
          Data length: 0x1a
        19 ff 06 00 01 0f 21 2a 54 d1 1a d2 c5 28 43 43  ......!*T....(CC
        50 31 34 53 2d 4a 45 52 5a 59                    P14S-JERZY      
        Company: Microsoft (6)
          Data: 010f212a54d11ad2c5284343503134532d4a45525a59
> HCI Event: LE Meta Event (0x3e) plen 57                   #73 [hci1] 5.138911
      LE Extended Advertising Report (0x0d)
        Num reports: 1
        Entry 0
          Event type: 0x0010
            Props: 0x0010
              Use legacy advertising PDUs
            Data status: [0;32mComplete[0m
          Legacy PDU Type: ADV_NONCONN_IND (0x0010)
          Address type: Random (0x01)
          Address: 03:96:0E:24:11:E8 (Non-Resolvable)
          Primary PHY: LE 1M
          Secondary PHY: No packets
          SID: no ADI field (0xff)
          TX power: 127 dBm
          RSSI: -90 dBm (0xa6)
          Periodic advertising interval: 0.00 msec (0x0000)
          Direct address type: Reserved (0xff)
          Direct address: 00-00-00-00-00-00
          Data length: 0x1f
        1e ff 06 00 01 09 20 22 0c c1 18 90 1b d9 9c 7d  ...... ".......}
        83 1f aa 53 45 03 15 ba 07 44 58 bd 8b d2 4b     ...SE....DX...K 
        Company: Microsoft (6)
          Data: 010920220cc118901bd99c7d831faa53450315ba074458bd8bd24b
> HCI Event: LE Meta Event (0x3e) plen 52                   #74 [hci1] 5.179095
      LE Extended Advertising Report (0x0d)
        Num reports: 1
        Entry 0
          Event type: 0x0010
            Props: 0x0010
              Use legacy advertising PDUs
            Data status: [0;32mComplete[0m
          Legacy PDU Type: ADV_NONCONN_IND (0x0010)
          Address type: Random (0x01)
          Address: 11:92:7C:FF:25:78 (Non-Resolvable)
          Primary PHY: LE 1M
          Secondary PHY: No packets
          SID: no ADI field (0xff)
          TX power: 127 dBm
          RSSI: -89 dBm (0xa7)
          Periodic advertising interval: 0.00 msec (0x0000)
          Direct address type: Reserved (0xff)
          Direct address: 00-00-00-00-00-00
          Data length: 0x1a
        19 ff 06 00 01 0f 21 2a 54 d1 1a d2 c5 28 43 43  ......!*T....(CC
        50 31 34 53 2d 4a 45 52 5a 59                    P14S-JERZY      
        Company: Microsoft (6)
          Data: 010f212a54d11ad2c5284343503134532d4a45525a59
> HCI Event: LE Meta Event (0x3e) plen 57                   #75 [hci1] 5.183506
      LE Extended Advertising Report (0x0d)
        Num reports: 1
        Entry 0
          Event type: 0x0013
            Props: 0x0013
              Connectable
              Scannable
              Use legacy advertising PDUs
            Data status: [0;32mComplete[0m
          Legacy PDU Type: ADV_IND (0x0013)
          Address type: Random (0x01)
          Address: C4:B6:3F:DD:A5:47 (Static)
          Primary PHY: LE 1M
          Secondary PHY: No packets
          SID: no ADI field (0xff)
          TX power: 127 dBm
          RSSI: -87 dBm (0xa9)
          Periodic advertising interval: 0.00 msec (0x0000)
          Direct address type: Reserved (0xff)
          Direct address: 00-00-00-00-00-00
          Data length: 0x1f
        02 01 06 1b ff 99 04 05 10 2c 28 56 bf 0b 03 d8  .........,(V....
        00 d0 ff e8 af 56 e3 b2 0c c4 b6 3f dd a5 47     .....V.....?..G 
        Flags: 0x06
          LE General Discoverable Mode
          BR/EDR Not Supported
        Company: Ruuvi Innovations Ltd. (1177)
          Data: 05102c2856bf0b03d800d0ffe8af56e3b20cc4b63fdda547
> HCI Event: LE Meta Event (0x3e) plen 56                   #76 [hci1] 5.184365
      LE Extended Advertising Report (0x0d)
        Num reports: 1
        Entry 0
          Event type: 0x001b
            Props: 0x001b
              Connectable
              Scannable
              Scan response
              Use legacy advertising PDUs
            Data status: [0;32mComplete[0m
          Legacy PDU Type: SCAN_RSP to an ADV_SCAN_IND (0x001b)
          Address type: Random (0x01)
          Address: C4:B6:3F:DD:A5:47 (Static)
          Primary PHY: LE 1M
          Secondary PHY: No packets
          SID: no ADI field (0xff)
          TX power: 127 dBm
          RSSI: -87 dBm (0xa9)
          Periodic advertising interval: 0.00 msec (0x0000)
          Direct address type: Reserved (0xff)
          Direct address: 00-00-00-00-00-00
          Data length: 0x1e
        11 07 9e ca dc 24 0e e5 a9 e0 93 f3 a3 b5 01 00  .....$..........
        40 6e 0b 09 52 75 75 76 69 20 41 35 34 37        @n..Ruuvi A547  
        128-bit Service UUIDs (complete): 1 entry
          Nordic UART Service
        Name (complete): Ruuvi A547
> HCI Event: LE Meta Event (0x3e) plen 57                   #77 [hci1] 5.242121
      LE Extended Advertising Report (0x0d)
        Num reports: 1
        Entry 0
          Event type: 0x0010
            Props: 0x0010
              Use legacy advertising PDUs
            Data status: [0;32mComplete[0m
          Legacy PDU Type: ADV_NONCONN_IND (0x0010)
          Address type: Random (0x01)
          Address: 03:96:0E:24:11:E8 (Non-Resolvable)
          Primary PHY: LE 1M
          Secondary PHY: No packets
          SID: no ADI field (0xff)
          TX power: 127 dBm
          RSSI: -92 dBm (0xa4)
          Periodic advertising interval: 0.00 msec (0x0000)
          Direct address type: Reserved (0xff)
          Direct address: 00-00-00-00-00-00
          Data length: 0x1f
        1e ff 06 00 01 09 20 22 0c c1 18 90 1b d9 9c 7d  ...... ".......}
        83 1f aa 53 45 03 15 ba 07 44 58 bd 8b d2 4b     ...SE....DX...K 
        Company: Microsoft (6)
          Data: 010920220cc118901bd99c7d831faa53450315ba074458bd8bd24b
> HCI Event: LE Meta Event (0x3e) plen 44                   #78 [hci1] 5.251115
      LE Extended Advertising Report (0x0d)
        Num reports: 1
        Entry 0
          Event type: 0x0012
            Props: 0x0012
              Scannable
              Use legacy advertising PDUs
            Data status: [0;32mComplete[0m
          Legacy PDU Type: ADV_SCAN_IND (0x0012)
          Address type: Public (0x00)
          Address: DF:A9:FF:F6:B1:1A (OUI DF-A9-FF)
          Primary PHY: LE 1M
          Secondary PHY: No packets
          SID: no ADI field (0xff)
          TX power: 127 dBm
          RSSI: -16 dBm (0xf0)
          Periodic advertising interval: 0.00 msec (0x0000)
          Direct address type: Reserved (0xff)
          Direct address: 00-00-00-00-00-00
          Data length: 0x12
        02 01 04 0e 09 54 65 73 74 65 72 5f 46 36 42 31  .....Tester_F6B1
        31 41                                            1A              
        Flags: 0x04
          BR/EDR Not Supported
        Name (complete): Tester_F6B11A
> HCI Event: LE Meta Event (0x3e) plen 50                   #79 [hci1] 5.251935
      LE Extended Advertising Report (0x0d)
        Num reports: 1
        Entry 0
          Event type: 0x001a
            Props: 0x001a
              Scannable
              Scan response
              Use legacy advertising PDUs
            Data status: [0;32mComplete[0m
          Legacy PDU Type: SCAN_RSP to an ADV_IND (0x001a)
          Address type: Public (0x00)
          Address: DF:A9:FF:F6:B1:1A (OUI DF-A9-FF)
          Primary PHY: LE 1M
          Secondary PHY: No packets
          SID: no ADI field (0xff)
          TX power: 127 dBm
          RSSI: -16 dBm (0xf0)
          Periodic advertising interval: 0.00 msec (0x0000)
          Direct address type: Reserved (0xff)
          Direct address: 00-00-00-00-00-00
          Data length: 0x18
        13 24 16 2f 2f 62 6c 75 65 74 6f 6f 74 68 2e 63  .$.//bluetooth.c
        6f 6d 0d 0a 03 19 00 00                          om......        
        Unknown EIR field 0x24: 162f2f626c7565746f6f74682e636f6d0d0a
        Appearance: Unknown (0x0000)
> HCI Event: LE Meta Event (0x3e) plen 54                   #80 [hci1] 5.291092
      LE Extended Advertising Report (0x0d)
        Num reports: 1
        Entry 0
          Event type: 0x0010
            Props: 0x0010
              Use legacy advertising PDUs
            Data status: [0;32mComplete[0m
          Legacy PDU Type: ADV_NONCONN_IND (0x0010)
          Address type: Public (0x00)
          Address: A4:30:7A:95:74:FB (Samsung Electronics Co.,Ltd)
          Primary PHY: LE 1M
          Secondary PHY: No packets
          SID: no ADI field (0xff)
          TX power: 127 dBm
          RSSI: -90 dBm (0xa6)
          Periodic advertising interval: 0.00 msec (0x0000)
          Direct address type: Reserved (0xff)
          Direct address: 00-00-00-00-00-00
          Data length: 0x1c
        1b ff 75 00 42 04 01 80 6e a4 30 7a 95 74 fb a6  ..u.B...n.0z.t..
        30 7a 95 74 fa 01 d8 41 c5 d9 00 00              0z.t...A....    
        Company: Samsung Electronics Co. Ltd. (117)
          Data: 420401806ea4307a9574fba6307a9574fa01d841c5d90000
> HCI Event: LE Meta Event (0x3e) plen 44                   #81 [hci1] 5.350755
      LE Extended Advertising Report (0x0d)
        Num reports: 1
        Entry 0
          Event type: 0x0012
            Props: 0x0012
              Scannable
              Use legacy advertising PDUs
            Data status: [0;32mComplete[0m
          Legacy PDU Type: ADV_SCAN_IND (0x0012)
          Address type: Public (0x00)
          Address: DF:A9:FF:F6:B1:1A (OUI DF-A9-FF)
          Primary PHY: LE 1M
          Secondary PHY: No packets
          SID: no ADI field (0xff)
          TX power: 127 dBm
          RSSI: -16 dBm (0xf0)
          Periodic advertising interval: 0.00 msec (0x0000)
          Direct address type: Reserved (0xff)
          Direct address: 00-00-00-00-00-00
          Data length: 0x12
        02 01 04 0e 09 54 65 73 74 65 72 5f 46 36 42 31  .....Tester_F6B1
        31 41                                            1A              
        Flags: 0x04
          BR/EDR Not Supported
        Name (complete): Tester_F6B11A
> HCI Event: LE Meta Event (0x3e) plen 50                   #82 [hci1] 5.351551
      LE Extended Advertising Report (0x0d)
        Num reports: 1
        Entry 0
          Event type: 0x001a
            Props: 0x001a
              Scannable
              Scan response
              Use legacy advertising PDUs
            Data status: [0;32mComplete[0m
          Legacy PDU Type: SCAN_RSP to an ADV_IND (0x001a)
          Address type: Public (0x00)
          Address: DF:A9:FF:F6:B1:1A (OUI DF-A9-FF)
          Primary PHY: LE 1M
          Secondary PHY: No packets
          SID: no ADI field (0xff)
          TX power: 127 dBm
          RSSI: -16 dBm (0xf0)
          Periodic advertising interval: 0.00 msec (0x0000)
          Direct address type: Reserved (0xff)
          Direct address: 00-00-00-00-00-00
          Data length: 0x18
        13 24 16 2f 2f 62 6c 75 65 74 6f 6f 74 68 2e 63  .$.//bluetooth.c
        6f 6d 0d 0a 03 19 00 00                          om......        
        Unknown EIR field 0x24: 162f2f626c7565746f6f74682e636f6d0d0a
        Appearance: Unknown (0x0000)
> HCI Event: LE Meta Event (0x3e) plen 38                   #83 [hci1] 5.353530
      LE Extended Advertising Report (0x0d)
        Num reports: 1
        Entry 0
          Event type: 0x0012
            Props: 0x0012
              Scannable
              Use legacy advertising PDUs
            Data status: [0;32mComplete[0m
          Legacy PDU Type: ADV_SCAN_IND (0x0012)
          Address type: Random (0x01)
          Address: 5E:20:AE:0F:68:64 (Resolvable)
          Primary PHY: LE 1M
          Secondary PHY: No packets
          SID: no ADI field (0xff)
          TX power: 127 dBm
          RSSI: -89 dBm (0xa7)
          Periodic advertising interval: 0.00 msec (0x0000)
          Direct address type: Reserved (0xff)
          Direct address: 00-00-00-00-00-00
          Data length: 0x0c
        0b ff 4c 00 09 06 03 00 0a 03 07 11              ..L.........    
        Company: Apple, Inc. (76)
          Type: Apple TV (9)
          Data: 03000a030711
> HCI Event: LE Meta Event (0x3e) plen 26                   #84 [hci1] 5.354025
      LE Extended Advertising Report (0x0d)
        Num reports: 1
        Entry 0
          Event type: 0x001a
            Props: 0x001a
              Scannable
              Scan response
              Use legacy advertising PDUs
            Data status: [0;32mComplete[0m
          Legacy PDU Type: SCAN_RSP to an ADV_IND (0x001a)
          Address type: Random (0x01)
          Address: 5E:20:AE:0F:68:64 (Resolvable)
          Primary PHY: LE 1M
          Secondary PHY: No packets
          SID: no ADI field (0xff)
          TX power: 127 dBm
          RSSI: -90 dBm (0xa6)
          Periodic advertising interval: 0.00 msec (0x0000)
          Direct address type: Reserved (0xff)
          Direct address: 00-00-00-00-00-00
          Data length: 0x00
> HCI Event: LE Meta Event (0x3e) plen 57                   #85 [hci1] 5.473465
      LE Extended Advertising Report (0x0d)
        Num reports: 1
        Entry 0
          Event type: 0x0010
            Props: 0x0010
              Use legacy advertising PDUs
            Data status: [0;32mComplete[0m
          Legacy PDU Type: ADV_NONCONN_IND (0x0010)
          Address type: Random (0x01)
          Address: 13:C6:44:4F:8F:9C (Non-Resolvable)
          Primary PHY: LE 1M
          Secondary PHY: No packets
          SID: no ADI field (0xff)
          TX power: 127 dBm
          RSSI: -94 dBm (0xa2)
          Periodic advertising interval: 0.00 msec (0x0000)
          Direct address type: Reserved (0xff)
          Direct address: 00-00-00-00-00-00
          Data length: 0x1f
        1e ff 06 00 01 09 20 22 e2 a7 13 b9 f5 25 5e 53  ...... ".....%^S
        ca 67 b1 a9 22 27 e7 1b ec 33 ec 54 b0 01 19     .g.."'...3.T... 
        Company: Microsoft (6)
          Data: 01092022e2a713b9f5255e53ca67b1a92227e71bec33ec54b00119
> HCI Event: LE Meta Event (0x3e) plen 52                   #86 [hci1] 5.490795
      LE Extended Advertising Report (0x0d)
        Num reports: 1
        Entry 0
          Event type: 0x0010
            Props: 0x0010
              Use legacy advertising PDUs
            Data status: [0;32mComplete[0m
          Legacy PDU Type: ADV_NONCONN_IND (0x0010)
          Address type: Random (0x01)
          Address: 11:92:7C:FF:25:78 (Non-Resolvable)
          Primary PHY: LE 1M
          Secondary PHY: No packets
          SID: no ADI field (0xff)
          TX power: 127 dBm
          RSSI: -84 dBm (0xac)
          Periodic advertising interval: 0.00 msec (0x0000)
          Direct address type: Reserved (0xff)
          Direct address: 00-00-00-00-00-00
          Data length: 0x1a
        19 ff 06 00 01 0f 21 2a 54 d1 1a d2 c5 28 43 43  ......!*T....(CC
        50 31 34 53 2d 4a 45 52 5a 59                    P14S-JERZY      
        Company: Microsoft (6)
          Data: 010f212a54d11ad2c5284343503134532d4a45525a59
> HCI Event: LE Meta Event (0x3e) plen 55                   #87 [hci1] 5.497742
      LE Extended Advertising Report (0x0d)
        Num reports: 1
        Entry 0
          Event type: 0x0010
            Props: 0x0010
              Use legacy advertising PDUs
            Data status: [0;32mComplete[0m
          Legacy PDU Type: ADV_NONCONN_IND (0x0010)
          Address type: Random (0x01)
          Address: 05:A2:F8:EA:22:0B (Non-Resolvable)
          Primary PHY: LE 1M
          Secondary PHY: No packets
          SID: no ADI field (0xff)
          TX power: 127 dBm
          RSSI: -85 dBm (0xab)
          Periodic advertising interval: 0.00 msec (0x0000)
          Direct address type: Reserved (0xff)
          Direct address: 00-00-00-00-00-00
          Data length: 0x1d
        1c ff 06 00 01 09 21 0a 4d e0 8a 52 d2 d4 4c 41  ......!.M..R..LA
        50 54 4f 50 2d 45 35 32 45 4f 44 32 49           PTOP-E52EOD2I   
        Company: Microsoft (6)
          Data: 0109210a4de08a52d2d44c4150544f502d453532454f443249
> HCI Event: LE Meta Event (0x3e) plen 57                   #88 [hci1] 5.550926
      LE Extended Advertising Report (0x0d)
        Num reports: 1
        Entry 0
          Event type: 0x0010
            Props: 0x0010
              Use legacy advertising PDUs
            Data status: [0;32mComplete[0m
          Legacy PDU Type: ADV_NONCONN_IND (0x0010)
          Address type: Random (0x01)
          Address: 03:96:0E:24:11:E8 (Non-Resolvable)
          Primary PHY: LE 1M
          Secondary PHY: No packets
          SID: no ADI field (0xff)
          TX power: 127 dBm
          RSSI: -89 dBm (0xa7)
          Periodic advertising interval: 0.00 msec (0x0000)
          Direct address type: Reserved (0xff)
          Direct address: 00-00-00-00-00-00
          Data length: 0x1f
        1e ff 06 00 01 09 20 22 0c c1 18 90 1b d9 9c 7d  ...... ".......}
        83 1f aa 53 45 03 15 ba 07 44 58 bd 8b d2 4b     ...SE....DX...K 
        Company: Microsoft (6)
          Data: 010920220cc118901bd99c7d831faa53450315ba074458bd8bd24b
