Bluetooth monitor ver 5.84
btmon[461151]: = Note: Linux version 6.8.0-83-generic (x86_64)                                                           0.921186
btmon[461151]: = Note: Bluetooth subsystem version 2.22                                                                  0.921188
= New Index: 00:00:00:00:00:00 (Primary,UART,hci0)                                                                       0.921188
= Open Index: 00:00:00:00:00:00                                                                                          0.928606
= Index Info: 00:00:00:00:00:00 (Nordic Semiconductor ASA)                                                               0.928611
zephyr.exe[461153]: @ USER Open: main (privileged) version 2.22                                                 {0x0001} 0.928613
zephyr.exe[461153]: < HCI Command: Reset (0x03|0x0003) plen 0                                                         #1 0.928863
> HCI Event: Command Complete (0x0e) plen 4                                                                           #2 0.929791
      Reset (0x03|0x0003) ncmd 1
        Status: Success (0x00)
zephyr.exe[461153]: < HCI Command: Read Local Supported Features (0x04|0x0003) plen 0                                 #3 0.948504
> HCI Event: Command Complete (0x0e) plen 12                                                                          #4 0.949476
      Read Local Supported Features (0x04|0x0003) ncmd 1
        Status: Success (0x00)
        Features: 0x00 0x00 0x00 0x00 0x60 0x00 0x00 0x00
          BR/EDR Not Supported
          LE Supported (Controller)
zephyr.exe[461153]: < HCI Command: Read Local Version Information (0x04|0x0001) plen 0                                #5 0.968509
> HCI Event: Command Complete (0x0e) plen 12                                                                          #6 0.969164
      Read Local Version Information (0x04|0x0001) ncmd 1
        Status: Success (0x00)
        HCI version: Reserved (0x0e) - Revision 12520 (0x30e8)
        LMP version: Reserved (0x0e) - Subversion 12520 (0x30e8)
        Manufacturer: Nordic Semiconductor ASA (89)
zephyr.exe[461153]: < HCI Command: Read Local Supported Commands (0x04|0x0002) plen 0                                 #7 0.988529
> HCI Event: Command Complete (0x0e) plen 68                                                                          #8 0.989949
      Read Local Supported Commands (0x04|0x0002) ncmd 1
        Status: Success (0x00)
        Commands: 119 entries
          Disconnect (Octet 0 - Bit 5)
          Read Remote Version Information (Octet 2 - Bit 7)
          Set Event Mask (Octet 5 - Bit 6)
          Reset (Octet 5 - Bit 7)
          Read Connection Accept Timeout (Octet 7 - Bit 2)
          Write Connection Accept Timeout (Octet 7 - Bit 3)
          Read Transmit Power Level (Octet 10 - Bit 2)
          Set Controller To Host Flow Control (Octet 10 - Bit 5)
          Host Buffer Size (Octet 10 - Bit 6)
          Host Number of Completed Packets (Octet 10 - Bit 7)
          Read Local Version Information (Octet 14 - Bit 3)
          Read Local Supported Features (Octet 14 - Bit 5)
          Read BD ADDR (Octet 15 - Bit 1)
          Read RSSI (Octet 15 - Bit 5)
          Set Event Mask Page 2 (Octet 22 - Bit 2)
          LE Set Event Mask (Octet 25 - Bit 0)
          LE Read Buffer Size (Octet 25 - Bit 1)
          LE Read Local Supported Features (Octet 25 - Bit 2)
          LE Set Random Address (Octet 25 - Bit 4)
          LE Set Advertising Parameters (Octet 25 - Bit 5)
          LE Read Advertising Channel TX Power (Octet 25 - Bit 6)
          LE Set Advertising Data (Octet 25 - Bit 7)
          LE Set Scan Response Data (Octet 26 - Bit 0)
          LE Set Advertise Enable (Octet 26 - Bit 1)
          LE Set Scan Parameters (Octet 26 - Bit 2)
          LE Set Scan Enable (Octet 26 - Bit 3)
          LE Create Connection (Octet 26 - Bit 4)
          LE Create Connection Cancel (Octet 26 - Bit 5)
          LE Read Accept List Size (Octet 26 - Bit 6)
          LE Clear Accept List (Octet 26 - Bit 7)
          LE Add Device To Accept List (Octet 27 - Bit 0)
          LE Remove Device From Accept List (Octet 27 - Bit 1)
          LE Connection Update (Octet 27 - Bit 2)
          LE Set Host Channel Classification (Octet 27 - Bit 3)
          LE Read Channel Map (Octet 27 - Bit 4)
          LE Read Remote Used Features (Octet 27 - Bit 5)
          LE Encrypt (Octet 27 - Bit 6)
          LE Rand (Octet 27 - Bit 7)
          LE Start Encryption (Octet 28 - Bit 0)
          LE Long Term Key Request Reply (Octet 28 - Bit 1)
          LE Long Term Key Request Neg Reply (Octet 28 - Bit 2)
          LE Read Supported States (Octet 28 - Bit 3)
          LE Receiver Test (Octet 28 - Bit 4)
          LE Transmitter Test (Octet 28 - Bit 5)
          LE Test End (Octet 28 - Bit 6)
          Read Authenticated Payload Timeout (Octet 32 - Bit 4)
          Write Authenticated Payload Timeout (Octet 32 - Bit 5)
          LE Set Data Length (Octet 33 - Bit 6)
          LE Read Suggested Default Data Length (Octet 33 - Bit 7)
          LE Write Suggested Default Data Length (Octet 34 - Bit 0)
          LE Add Device To Resolving List (Octet 34 - Bit 3)
          LE Remove Device From Resolving List (Octet 34 - Bit 4)
          LE Clear Resolving List (Octet 34 - Bit 5)
          LE Read Resolving List Size (Octet 34 - Bit 6)
          LE Set Address Resolution Enable (Octet 35 - Bit 1)
          LE Set Resolvable Private Address Timeout (Octet 35 - Bit 2)
          LE Read Maximum Data Length (Octet 35 - Bit 3)
          LE Read PHY (Octet 35 - Bit 4)
          LE Set Default PHY (Octet 35 - Bit 5)
          LE Set PHY (Octet 35 - Bit 6)
          LE Enhanced Receiver Test (Octet 35 - Bit 7)
          LE Enhanced Transmitter Test (Octet 36 - Bit 0)
          LE Set Advertising Set Random Address (Octet 36 - Bit 1)
          LE Set Extended Advertising Parameters (Octet 36 - Bit 2)
          LE Set Extended Advertising Data (Octet 36 - Bit 3)
          LE Set Extended Scan Response Data (Octet 36 - Bit 4)
          LE Set Extended Advertising Enable (Octet 36 - Bit 5)
          LE Read Maximum Advertising Data Length (Octet 36 - Bit 6)
          LE Read Number of Supported Advertising Sets (Octet 36 - Bit 7)
          LE Remove Advertising Set (Octet 37 - Bit 0)
          LE Clear Advertising Sets (Octet 37 - Bit 1)
          LE Set Periodic Advertising Parameters (Octet 37 - Bit 2)
          LE Set Periodic Advertising Data (Octet 37 - Bit 3)
          LE Set Periodic Advertising Enable (Octet 37 - Bit 4)
          LE Set Extended Scan Parameters (Octet 37 - Bit 5)
          LE Set Extended Scan Enable (Octet 37 - Bit 6)
          LE Extended Create Connection (Octet 37 - Bit 7)
          LE Periodic Advertising Create Sync (Octet 38 - Bit 0)
          LE Periodic Advertising Create Sync Cancel (Octet 38 - Bit 1)
          LE Periodic Advertising Terminate Sync (Octet 38 - Bit 2)
          LE Add Device To Periodic Advertiser List (Octet 38 - Bit 3)
          LE Remove Device From Periodic Advertiser List (Octet 38 - Bit 4)
          LE Clear Periodic Advertiser List (Octet 38 - Bit 5)
          LE Read Periodic Advertiser List Size (Octet 38 - Bit 6)
          LE Read Transmit Power (Octet 38 - Bit 7)
          LE Read RF Path Compensation (Octet 39 - Bit 0)
          LE Write RF Path Compensation (Octet 39 - Bit 1)
          LE Set Privacy Mode (Octet 39 - Bit 2)
          LE Periodic Advertising Receive Enable (Octet 40 - Bit 5)
          LE Periodic Advertising Sync Transfer (Octet 40 - Bit 6)
          LE Periodic Advertising Set Info Transfer (Octet 40 - Bit 7)
          LE Periodic Advertising Sync Transfer Parameters (Octet 41 - Bit 0)
          LE Set Default Periodic Advertisng Sync Transfer Parameters (Octet 41 - Bit 1)
          LE Read Buffer v2 (Octet 41 - Bit 5)
          LE Read ISO TX Sync (Octet 41 - Bit 6)
          LE Set Connected Isochronous Group Parameters (Octet 41 - Bit 7)
          LE Set Connected Isochronous Group Parameters Test (Octet 42 - Bit 0)
          LE Create Connected Isochronous Stream (Octet 42 - Bit 1)
          LE Remove Connected Isochronous Group (Octet 42 - Bit 2)
          LE Accept Connected Isochronous Stream Request (Octet 42 - Bit 3)
          LE Reject Connected Isochronous Stream Request (Octet 42 - Bit 4)
          LE Create Broadcast Isochronous Group (Octet 42 - Bit 5)
          LE Create Broadcast Isochronous Group Test (Octet 42 - Bit 6)
          LE Terminate Broadcast Isochronous Group (Octet 42 - Bit 7)
          LE Broadcast Isochronous Group Create Sync (Octet 43 - Bit 0)
          LE Broadcast Isochronous Group Terminate Sync (Octet 43 - Bit 1)
          LE Request Peer SCA (Octet 43 - Bit 2)
          LE Setup Isochronous Data Path (Octet 43 - Bit 3)
          LE Remove Isochronous Data Path (Octet 43 - Bit 4)
          LE Isochronous Transmit Test (Octet 43 - Bit 5)
          LE Isochronous Receive Test (Octet 43 - Bit 6)
          LE Isochronous Read Test Counters (Octet 43 - Bit 7)
          LE Isochronous Read Test Counters (Octet 44 - Bit 0)
          LE Set Host Feature (Octet 44 - Bit 1)
          LE Read ISO link quality (Octet 44 - Bit 2)
          Octet 45 - Bit 6 
          Octet 46 - Bit 0 
          Octet 46 - Bit 1 
          Octet 46 - Bit 2 
zephyr.exe[461153]: < HCI Command: Host Buffer Size (0x03|0x0033) plen 7                                              #9 1.008530
        ACL MTU: 255  ACL max packet: 16
        SCO MTU: 0    SCO max packet: 0
> HCI Event: Command Complete (0x0e) plen 4                                                                          #10 1.009279
      Host Buffer Size (0x03|0x0033) ncmd 1
        Status: Success (0x00)
zephyr.exe[461153]: < HCI Command: Set Controller To Host Flow Control (0x03|0x0031) plen 1                          #11 1.028531
        Flow control: ACL Data Packets (0x01)
> HCI Event: Command Complete (0x0e) plen 4                                                                          #12 1.028996
      Set Controller To Host Flow Control (0x03|0x0031) ncmd 1
        Status: Success (0x00)
zephyr.exe[461153]: < HCI Command: LE Read Local Supported Features (0x08|0x0003) plen 0                             #13 1.048514
> HCI Event: Command Complete (0x0e) plen 12                                                                         #14 1.049157
      LE Read Local Supported Features (0x08|0x0003) ncmd 1
        Status: Success (0x00)
        Features: 0xfd 0x79 0x00 0xf7 0x30 0x01 0x00 0x00
          LE Encryption
          Extended Reject Indication
          Peripheral-initiated Features Exchange
          LE Ping
          LE Data Packet Length Extension
          LL Privacy
          Extended Scanner Filter Policies
          LE 2M PHY
          LE Coded PHY
          LE Extended Advertising
          LE Periodic Advertising
          Channel Selection Algorithm #2
          Periodic Advertising Sync Transfer - Sender
          Periodic Advertising Sync Transfer - Recipient
          Sleep Clock Accuracy Updates
          Connected Isochronous Stream - Central
          Connected Isochronous Stream - Peripheral
          Isochronous Broadcaster
          Synchronized Receiver
          Periodic Advertising ADI support
          Connection Subrating
          Unknown features (0x0000010000000000)
zephyr.exe[461153]: < HCI Command: LE Set Host Feature (0x08|0x0074) plen 2                                          #15 1.068512
        Bit Number: 32
          Connected Isochronous Stream (Host Support)
        Bit Value: 1
> HCI Event: Command Complete (0x0e) plen 4                                                                          #16 1.069353
      LE Set Host Feature (0x08|0x0074) ncmd 1
        Status: Success (0x00)
zephyr.exe[461153]: < HCI Command: LE Read Buffer v2 (0x08|0x0060) plen 0                                            #17 1.088538
> HCI Event: Command Complete (0x0e) plen 10                                                                         #18 1.089210
      LE Read Buffer v2 (0x08|0x0060) ncmd 1
        Status: Success (0x00)
        ACL MTU: 27
        ACL max packet: 3
        ISO MTU: 318
        ISO max packet: 3
zephyr.exe[461153]: < HCI Command: LE Read Maximum Advertising Data Length (0x08|0x003a) plen 0                      #19 1.108523
> HCI Event: Command Complete (0x0e) plen 6                                                                          #20 1.109221
      LE Read Maximum Advertising Data Length (0x08|0x003a) ncmd 1
        Status: Success (0x00)
        Max length: 1650
zephyr.exe[461153]: < HCI Command: LE Read Supported States (0x08|0x001c) plen 0                                     #21 1.128506
> HCI Event: Command Complete (0x0e) plen 12                                                                         #22 1.129587
      LE Read Supported States (0x08|0x001c) ncmd 1
        Status: Success (0x00)
        States: 0x000003ff3e0306ff
          Non-connectable Advertising State
          Scannable Advertising State
          Connectable Advertising State
          High Duty Cycle Directed Advertising State
          Passive Scanning State
          Active Scanning State
          Initiating State
            and Connection State (Central Role)
          Connection State (Peripheral Role)
          Scannable Advertising State
            and Passive Scanning State
          Connectable Advertising State
            and Passive Scanning State
          Non-connectable Advertising State
            and Initiating State
          Scannable Advertising State
            and Initiating State
          Active Scanning State
            and Connection State (Central Role)
          Passive Scanning State
            and Connection State (Peripheral Role)
          Active Scanning State
            and Connection State (Peripheral Role)
          Initiating State
            and Connection State (Central Role)
            and Central Role & Central Role
          Low Duty Cycle Directed Advertising State
          Connectable Advertising State
            and Initiating State
            and Central Role & Peripheral Role
          High Duty Cycle Directed Advertising State
            and Initiating State
            and Central Role & Peripheral Role
          Low Duty Cycle Directed Advertising State
            and Initiating State
            and Central Role & Peripheral Role
          Connectable Advertising State
            and Connection State (Central Role)
            and Central Role & Peripheral Role
          High Duty Cycle Directed Advertising State
            and Connection State (Central Role)
            and Central Role & Peripheral Role
          Low Duty Cycle Directed Advertising State
            and Connection State (Central Role)
            and Central Role & Peripheral Role
          Connectable Advertising State
            and Connection State (Peripheral Role)
            and Central Role & Peripheral Role
          High Duty Cycle Directed Advertising State
            and Connection State (Peripheral Role)
            and Peripheral Role & Peripheral Role
          Low Duty Cycle Directed Advertising State
            and Connection State (Peripheral Role)
            and Peripheral Role & Peripheral Role
          Initiating State
            and Connection State (Peripheral Role)
            and Central Role & Peripheral Role
zephyr.exe[461153]: < HCI Command: LE Read Maximum Data Length (0x08|0x002f) plen 0                                  #23 1.148504
> HCI Event: Command Complete (0x0e) plen 12                                                                         #24 1.149331
      LE Read Maximum Data Length (0x08|0x002f) ncmd 1
        Status: Success (0x00)
        Max TX octets: 251
        Max TX time: 2704
        Max RX octets: 251
        Max RX time: 2704
zephyr.exe[461153]: < HCI Command: LE Write Suggested Default Data Length (0x08|0x0024) plen 4                       #25 1.168505
        TX octets: 251
        TX time: 2704
> HCI Event: Command Complete (0x0e) plen 4                                                                          #26 1.169185
      LE Write Suggested Default Data Length (0x08|0x0024) ncmd 1
        Status: Success (0x00)
zephyr.exe[461153]: < HCI Command: LE Read Resolving List Size (0x08|0x002a) plen 0                                  #27 1.188504
> HCI Event: Command Complete (0x0e) plen 5                                                                          #28 1.189159
      LE Read Resolving List Size (0x08|0x002a) ncmd 1
        Status: Success (0x00)
        Size: 8
zephyr.exe[461153]: < HCI Command: LE Set Event Mask (0x08|0x0001) plen 8                                            #29 1.208535
        Mask: 0x000002023f87fa5e
          LE Advertising Report
          LE Connection Update Complete
          LE Read Remote Used Features Complete
          LE Long Term Key Request
          LE Data Length Change
          LE Enhanced Connection Complete
          LE PHY Update Complete
          LE Extended Advertising Report
          LE Periodic Advertising Sync Established
          LE Periodic Advertising Report
          LE Periodic Advertising Sync Lost
          LE Extended Scan Timeout
          LE Extended Advertising Set Terminated
          LE Scan Request Received
          LE Periodic Advertising Sync Transfer Rvc
          LE CIS Established
          LE CIS Request
          LE Create BIG Complete
          LE Terminate BIG Complete
          LE BIG Sync Established Complete
          LE BIG Sync Lost
          LE BIG Info Advertising Report
          Unknown mask (0x0000020000000000)
> HCI Event: Command Complete (0x0e) plen 4                                                                          #30 1.209441
      LE Set Event Mask (0x08|0x0001) ncmd 1
        Status: Success (0x00)
zephyr.exe[461153]: < HCI Command: Set Event Mask (0x03|0x0001) plen 8                                               #31 1.228502
        Mask: 0x2000800002008890
          Disconnection Complete
          Encryption Change
          Read Remote Version Information Complete
          Hardware Error
          Data Buffer Overflow
          Encryption Key Refresh Complete
          LE Meta
> HCI Event: Command Complete (0x0e) plen 4                                                                          #32 1.228996
      Set Event Mask (0x03|0x0001) ncmd 1
        Status: Success (0x00)
zephyr.exe[461153]: < HCI Command: Read BD ADDR (0x04|0x0009) plen 0                                                 #33 1.248503
> HCI Event: Command Complete (0x0e) plen 10                                                                         #34 1.249410
      Read BD ADDR (0x04|0x0009) ncmd 1
        Status: Success (0x00)
        Address: 00:00:00:00:00:00 (OUI 00-00-00)
zephyr.exe[461153]: < HCI Command: LE Set Random Address (0x08|0x0005) plen 6                                        #35 1.268542
        Address: D5:B6:CC:31:DB:3B (Static)
> HCI Event: Command Complete (0x0e) plen 4                                                                          #36 1.269462
      LE Set Random Address (0x08|0x0005) ncmd 1
        Status: Success (0x00)
zephyr.exe[461153]: < HCI Command: LE Set Extended Advertising Parameters (0x08|0x0036) plen 25                      #37 3.808569
        Handle: 0x00
        Properties: 0x0013
          Connectable
          Scannable
          Use legacy advertising PDUs: ADV_IND
        Min advertising interval: 100.000 msec (0x00a0)
        Max advertising interval: 150.000 msec (0x00f0)
        Channel map: 37, 38, 39 (0x07)
        Own address type: Random (0x01)
        Peer address type: Public (0x00)
        Peer address: 00:00:00:00:00:00 (OUI 00-00-00)
        Filter policy: Allow Scan Request from Any, Allow Connect Request from Any (0x00)
        TX power: Host has no preference (0x7f)
        Primary PHY: LE 1M (0x01)
        Secondary max skip: 0x00
        Secondary PHY: LE 1M (0x01)
        SID: 0x00
        Scan request notifications: Disabled (0x00)
> HCI Event: Command Complete (0x0e) plen 5                                                                          #38 3.809622
      LE Set Extended Advertising Parameters (0x08|0x0036) ncmd 1
        Status: Success (0x00)
        TX power (selected): 0 dbm (0x00)
zephyr.exe[461153]: < HCI Command: LE Set Advertising Set Random Address (0x08|0x0035) plen 7                        #39 3.828522
        Advertising handle: 0x00
        Advertising random address: D5:B6:CC:31:DB:3B (Static)
> HCI Event: Command Complete (0x0e) plen 4                                                                          #40 3.829348
      LE Set Advertising Set Random Address (0x08|0x0035) ncmd 1
        Status: Success (0x00)
zephyr.exe[461153]: < HCI Command: LE Set Extended Advertising Data (0x08|0x0037) plen 22                            #41 3.848520
        Handle: 0x00
        Operation: Complete extended advertising data (0x03)
        Fragment preference: Minimize fragmentation (0x01)
        Data length: 0x12
        Flags: 0x06
          LE General Discoverable Mode
          BR/EDR Not Supported
        Name (complete): Tester_F6B11A
> HCI Event: Command Complete (0x0e) plen 4                                                                          #42 3.849465
      LE Set Extended Advertising Data (0x08|0x0037) ncmd 1
        Status: Success (0x00)
zephyr.exe[461153]: < HCI Command: LE Set Extended Scan Response Data (0x08|0x0038) plen 4                           #43 3.868522
        Handle: 0x00
        Operation: Complete scan response data (0x03)
        Fragment preference: Minimize fragmentation (0x01)
        Data length: 0x00
> HCI Event: Command Complete (0x0e) plen 4                                                                          #44 3.869220
      LE Set Extended Scan Response Data (0x08|0x0038) ncmd 1
        Status: Success (0x00)
zephyr.exe[461153]: < HCI Command: LE Set Extended Advertising Enable (0x08|0x0039) plen 6                           #45 3.888572
        Extended advertising: Enabled (0x01)
        Number of sets: 1 (0x01)
        Entry 0
          Handle: 0x00
          Duration: 0 ms (0x00)
          Max ext adv events: 0
> HCI Event: Command Complete (0x0e) plen 4                                                                          #46 3.889672
      LE Set Extended Advertising Enable (0x08|0x0039) ncmd 1
        Status: Success (0x00)
> HCI Event: LE Meta Event (0x3e) plen 31                                                                            #47 4.002948
      LE Enhanced Connection Complete (0x0a)
        Status: Success (0x00)
        Handle: 147
        Role: Peripheral (0x01)
        Peer address type: Public (0x00)
        Peer address: DF:A9:FF:F6:B1:1A (OUI DF-A9-FF)
        Local resolvable private address: 00:00:00:00:00:00 (Non-Resolvable)
        Peer resolvable private address: 00:00:00:00:00:00 (Non-Resolvable)
        Connection interval: 87.50 msec (0x0046)
        Connection latency: 0 (0x0000)
        Supervision timeout: 25120 msec (0x09d0)
        Central clock accuracy: 0x01
> HCI Event: LE Meta Event (0x3e) plen 6                                                                             #48 4.002950
      LE Advertising Set Terminated (0x12)
        Status: Success (0x00)
        Handle: 0
        Connection handle: 147
        Number of completed extended advertising events: 0
zephyr.exe[461153]: < HCI Command: LE Read Remote Used Features (0x08|0x0016) plen 2                                 #49 4.008711
        Handle: 147 Address: DF:A9:FF:F6:B1:1A (OUI DF-A9-FF)
> HCI Event: Command Status (0x0f) plen 4                                                                            #50 4.009170
      LE Read Remote Used Features (0x08|0x0016) ncmd 1
        Status: Success (0x00)
zephyr.exe[461153]: < ACL Data TX: Handle 147 [1/3] flags 0x00 dlen 7                                                #51 4.028559
      ATT: Exchange MTU Request (0x02) len 2
        Client RX MTU: 251
> HCI Event: Number of Completed Packets (0x13) plen 5                                                               #52 4.179051
        Num handles: 1
        Handle: 147 Address: DF:A9:FF:F6:B1:1A (OUI DF-A9-FF)
        Count: 1
        Buffers: 0/3
        #51: len 7 (0 Kb/s)
        Latency: 150 msec (150-150 msec ~150 msec)
> HCI Event: LE Meta Event (0x3e) plen 12                                                                            #53 4.266782
      LE Read Remote Used Features (0x04)
        Status: Success (0x00)
        Handle: 147 Address: DF:A9:FF:F6:B1:1A (OUI DF-A9-FF)
        Features: 0x2d 0x49 0x00 0xf7 0x67 0xd8 0x00 0x00
          LE Encryption
          Extended Reject Indication
          Peripheral-initiated Features Exchange
          LE Data Packet Length Extension
          LE 2M PHY
          LE Coded PHY
          Channel Selection Algorithm #2
          Periodic Advertising Sync Transfer - Sender
          Periodic Advertising Sync Transfer - Recipient
          Sleep Clock Accuracy Updates
          Connected Isochronous Stream - Central
          Connected Isochronous Stream - Peripheral
          Isochronous Broadcaster
          Synchronized Receiver
          Connected Isochronous Stream (Host Support)
          LE Power Control Request
          LE Power Control Request
          Connection Subrating
          Connection Subrating (Host Support)
          Unknown features (0x0000d80000000000)
> ACL Data RX: Handle 147 flags 0x02 dlen 11                                                                         #54 6.716493
      SMP: Pairing Request (0x01) len 6
        IO capability: KeyboardDisplay (0x04)
        OOB data: Authentication data not present (0x00)
        Authentication requirement: Bonding, No MITM, SC, No Keypresses (0x09)
        Max encryption key size: 16
        Initiator key distribution: EncKey IdKey (0x03)
        Responder key distribution: EncKey IdKey Sign (0x07)
> ACL Data RX: Handle 147 flags 0x02 dlen 7                                                                          #55 6.717008
      ATT: Exchange MTU Response (0x03) len 2
        Server RX MTU: 23
zephyr.exe[461153]: < HCI Command: Host Number of Completed Packets (0x03|0x0035) plen 5                             #56 6.728583
        Num handles: 1
        Handle: 147 Address: DF:A9:FF:F6:B1:1A (OUI DF-A9-FF)
        Count: 1
zephyr.exe[461153]: < ACL Data TX: Handle 147 [1/3] flags 0x00 dlen 11                                               #57 6.728638
      SMP: Pairing Response (0x02) len 6
        IO capability: NoInputNoOutput (0x03)
        OOB data: Authentication data not present (0x00)
        Authentication requirement: Bonding, No MITM, SC, No Keypresses (0x09)
        Max encryption key size: 16
        Initiator key distribution: IdKey (0x02)
        Responder key distribution: Sign (0x04)
zephyr.exe[461153]: < HCI Command: Host Number of Completed Packets (0x03|0x0035) plen 5                             #58 6.728679
        Num handles: 1
        Handle: 147 Address: DF:A9:FF:F6:B1:1A (OUI DF-A9-FF)
        Count: 1
> HCI Event: Number of Completed Packets (0x13) plen 5                                                               #59 6.891666
        Num handles: 1
        Handle: 147 Address: DF:A9:FF:F6:B1:1A (OUI DF-A9-FF)
        Count: 1
        Buffers: 0/3
        #57: len 11 (0 Kb/s)
        Latency: 163 msec (150-163 msec ~156 msec)
> ACL Data RX: Handle 147 flags 0x02 dlen 27                                                                         #60 6.891746
> ACL Data RX: Handle 147 flags 0x01 dlen 27                                                                         #61 6.892665
> ACL Data RX: Handle 147 flags 0x01 dlen 15                                                                         #62 6.892788
      SMP: Pairing Public Key (0x0c) len 64
        X[32]: 1a90af989d7364fce7cf25a56f6cf59c44ea37a2ab0e67c50c23d73b52076bdf
        Y[32]: a105714e4e12b87ed2acc29042888c34820de6fb2089128df23955b7f6e9603e
zephyr.exe[461153]: < HCI Command: Host Number of Completed Packets (0x03|0x0035) plen 5                             #63 6.908689
        Num handles: 1
        Handle: 147 Address: DF:A9:FF:F6:B1:1A (OUI DF-A9-FF)
        Count: 1
zephyr.exe[461153]: < HCI Command: Host Number of Completed Packets (0x03|0x0035) plen 5                             #64 6.908796
        Num handles: 1
        Handle: 147 Address: DF:A9:FF:F6:B1:1A (OUI DF-A9-FF)
        Count: 1
zephyr.exe[461153]: < HCI Command: Host Number of Completed Packets (0x03|0x0035) plen 5                             #65 6.908861
        Num handles: 1
        Handle: 147 Address: DF:A9:FF:F6:B1:1A (OUI DF-A9-FF)
        Count: 1
zephyr.exe[461153]: < ACL Data TX: Handle 147 [1/3] flags 0x00 dlen 27                                               #66 6.908946
zephyr.exe[461153]: < ACL Data TX: Handle 147 flags 0x01 dlen 27                                                     #67 6.908948
zephyr.exe[461153]: < ACL Data TX: Handle 147 flags 0x01 dlen 15                                                     #68 6.908949
      SMP: Pairing Public Key (0x0c) len 64
        X[32]: 98308440221e2d910f0e54b71e7ec652857aa9b5a0dc65028824cc19db1226e9
        Y[32]: 67a4816bcb62efb21701e31fdb27561a6217575fb007a8bbdabe7e28b6f68482
> HCI Event: Number of Completed Packets (0x13) plen 5                                                               #69 6.979412
        Num handles: 1
        Handle: 147 Address: DF:A9:FF:F6:B1:1A (OUI DF-A9-FF)
        Count: 1
        Buffers: 0/3
        #66: len 27 (3 Kb/s)
        Latency: 70 msec (70-163 msec ~113 msec)
> HCI Event: Number of Completed Packets (0x13) plen 5                                                               #70 6.980027
        Num handles: 1
        Handle: 147 Address: DF:A9:FF:F6:B1:1A (OUI DF-A9-FF)
        Count: 1
        Buffers: underflow/3
        #67: len 27 (3 Kb/s)
        Latency: 71 msec (70-163 msec ~92 msec)
zephyr.exe[461153]: < ACL Data TX: Handle 147 [1/3] flags 0x00 dlen 21                                               #71 6.988522
      SMP: Pairing Confirm (0x03) len 16
        Confirm value[16]: 3a8bc86e1c0dbbd6d59a9bb57f406bf6
> HCI Event: Number of Completed Packets (0x13) plen 5                                                               #72 7.066585
        Num handles: 1
        Handle: 147 Address: DF:A9:FF:F6:B1:1A (OUI DF-A9-FF)
        Count: 1
        Buffers: 0/3
        #68: len 15 (0 Kb/s)
        Latency: 157 msec (70-163 msec ~124 msec)
> HCI Event: Number of Completed Packets (0x13) plen 5                                                               #73 7.154149
        Num handles: 1
        Handle: 147 Address: DF:A9:FF:F6:B1:1A (OUI DF-A9-FF)
        Count: 1
        Buffers: underflow/3
        #71: len 21 (1 Kb/s)
        Latency: 165 msec (70-165 msec ~145 msec)
> ACL Data RX: Handle 147 flags 0x02 dlen 21                                                                         #74 7.154193
      SMP: Pairing Random (0x04) len 16
        Random value[16]: 5acbfc792df2dee50000000000000000
zephyr.exe[461153]: < HCI Command: Host Number of Completed Packets (0x03|0x0035) plen 5                             #75 7.168605
        Num handles: 1
        Handle: 147 Address: DF:A9:FF:F6:B1:1A (OUI DF-A9-FF)
        Count: 1
zephyr.exe[461153]: < ACL Data TX: Handle 147 [1/3] flags 0x00 dlen 21                                               #76 7.168628
      SMP: Pairing Random (0x04) len 16
        Random value[16]: 8e6108f966a694cbe26df70bb96773e6
> HCI Event: Number of Completed Packets (0x13) plen 5                                                               #77 7.328777
        Num handles: 1
        Handle: 147 Address: DF:A9:FF:F6:B1:1A (OUI DF-A9-FF)
        Count: 1
        Buffers: 0/3
        #76: len 21 (1 Kb/s)
        Latency: 160 msec (70-165 msec ~152 msec)
> ACL Data RX: Handle 147 flags 0x02 dlen 21                                                                         #78 7.504031
      SMP: Pairing DHKey Check (0x0d) len 16
        E[16]: b44c48aa5df22f69f53bcc755505718f
zephyr.exe[461153]: < HCI Command: Host Number of Completed Packets (0x03|0x0035) plen 5                             #79 7.508695
        Num handles: 1
        Handle: 147 Address: DF:A9:FF:F6:B1:1A (OUI DF-A9-FF)
        Count: 1
zephyr.exe[461153]: < ACL Data TX: Handle 147 [1/3] flags 0x00 dlen 21                                               #80 7.508729
      SMP: Pairing DHKey Check (0x0d) len 16
        E[16]: a92ec699098d47b2d3422aaea1452628
> HCI Event: Number of Completed Packets (0x13) plen 5                                                               #81 7.678949
        Num handles: 1
        Handle: 147 Address: DF:A9:FF:F6:B1:1A (OUI DF-A9-FF)
        Count: 1
        Buffers: 0/3
        #80: len 21 (0 Kb/s)
        Latency: 170 msec (70-170 msec ~161 msec)
> HCI Event: LE Meta Event (0x3e) plen 13                                                                            #82 7.767271
      LE Long Term Key Request (0x05)
        Handle: 147 Address: DF:A9:FF:F6:B1:1A (OUI DF-A9-FF)
        Random number: 0x0000000000000000
        Encrypted diversifier: 0x0000
zephyr.exe[461153]: < HCI Command: LE Long Term Key Request Reply (0x08|0x001a) plen 18                              #83 7.768535
        Handle: 147 Address: DF:A9:FF:F6:B1:1A (OUI DF-A9-FF)
        Long term key[16]: 0e0c589b172f76bbbb6458cbce24540f
> HCI Event: Command Complete (0x0e) plen 6                                                                          #84 7.769658
      LE Long Term Key Request Reply (0x08|0x001a) ncmd 1
        Status: Success (0x00)
        Handle: 147 Address: DF:A9:FF:F6:B1:1A (OUI DF-A9-FF)
> HCI Event: Encryption Change (0x08) plen 4                                                                         #85 8.204034
        Status: Success (0x00)
        Handle: 147 Address: DF:A9:FF:F6:B1:1A (OUI DF-A9-FF)
        Encryption: Enabled with AES-CCM (0x01)
zephyr.exe[461153]: < ACL Data TX: Handle 147 [1/3] flags 0x00 dlen 21                                               #86 8.318645
      SMP: Signing Information (0x0a) len 16
        Signature key[16]: 5da095555cc64d02679f89a05211af56
> HCI Event: Number of Completed Packets (0x13) plen 5                                                               #87 8.467135
        Num handles: 1
        Handle: 147 Address: DF:A9:FF:F6:B1:1A (OUI DF-A9-FF)
        Count: 1
        Buffers: 0/3
        #86: len 21 (1 Kb/s)
        Latency: 148 msec (70-170 msec ~154 msec)
> ACL Data RX: Handle 147 flags 0x02 dlen 21                                                                         #88 8.467139
      SMP: Identity Information (0x08) len 16
        Identity resolving key[16]: a136ac9c01a108ed1f5cd9b26ae73200
> ACL Data RX: Handle 147 flags 0x02 dlen 12                                                                         #89 8.467139
      SMP: Identity Address Information (0x09) len 7
        Address: DF:A9:FF:F6:B1:1A (OUI DF-A9-FF)
zephyr.exe[461153]: < HCI Command: Host Number of Completed Packets (0x03|0x0035) plen 5                             #90 8.468604
        Num handles: 1
        Handle: 147 Address: DF:A9:FF:F6:B1:1A (OUI DF-A9-FF)
        Count: 1
zephyr.exe[461153]: < HCI Command: LE Add Device To Resolving List (0x08|0x0027) plen 39                             #91 8.468767
        Address type: Public (0x00)
        Address: DF:A9:FF:F6:B1:1A (OUI DF-A9-FF)
        Peer identity resolving key[16]: a136ac9c01a108ed1f5cd9b26ae73200
        Local identity resolving key[16]: 00000000000000000000000000000000
> HCI Event: Command Complete (0x0e) plen 4                                                                          #92 8.469833
      LE Add Device To Resolving List (0x08|0x0027) ncmd 1
        Status: Success (0x00)
zephyr.exe[461153]: < HCI Command: LE Set Privacy Mode (0x08|0x004e) plen 8                                          #93 8.488579
        Peer Identity address type: Public (0x00)
        Peer Identity address: DF:A9:FF:F6:B1:1A (OUI DF-A9-FF)
        Privacy Mode: Use Device Privacy (0x01)
> HCI Event: Command Complete (0x0e) plen 4                                                                          #94 8.489437
      LE Set Privacy Mode (0x08|0x004e) ncmd 1
        Status: Success (0x00)
zephyr.exe[461153]: < HCI Command: LE Set Address Resolution Enable (0x08|0x002d) plen 1                             #95 8.508584
        Address resolution: Enabled (0x01)
> HCI Event: Command Complete (0x0e) plen 4                                                                          #96 8.509059
      LE Set Address Resolution Enable (0x08|0x002d) ncmd 1
        Status: Success (0x00)
zephyr.exe[461153]: < HCI Command: Host Number of Completed Packets (0x03|0x0035) plen 5                             #97 8.528541
        Num handles: 1
        Handle: 147 Address: DF:A9:FF:F6:B1:1A (OUI DF-A9-FF)
        Count: 1
> ACL Data RX: Handle 147 flags 0x02 dlen 13                                                                         #98 8.729036
      ATT: Find By Type Value Request (0x06) len 8
        Handle range: 0x0001-0xffff
        Attribute type: Primary Service (0x2800)
          UUID: Volume Offset Control (0x1845)
zephyr.exe[461153]: < HCI Command: Host Number of Completed Packets (0x03|0x0035) plen 5                             #99 8.748627
        Num handles: 1
        Handle: 147 Address: DF:A9:FF:F6:B1:1A (OUI DF-A9-FF)
        Count: 1
zephyr.exe[461153]: < ACL Data TX: Handle 147 [1/3] flags 0x00 dlen 9                                               #100 8.748686
      ATT: Error Response (0x01) len 4
        Find By Type Value Request (0x06)
        Handle: 0x0001
        Error: Attribute Not Found (0x0a)
> HCI Event: Number of Completed Packets (0x13) plen 5                                                              #101 8.903868
        Num handles: 1
        Handle: 147 Address: DF:A9:FF:F6:B1:1A (OUI DF-A9-FF)
        Count: 1
        Buffers: 0/3
        #100: len 9 (0 Kb/s)
        Latency: 155 msec (70-170 msec ~155 msec)
> ACL Data RX: Handle 147 flags 0x02 dlen 11                                                                        #102 8.904133
      ATT: Read By Type Request (0x08) len 6
        Handle range: 0x0001-0xffff
        Attribute type: Include (0x2802)
zephyr.exe[461153]: < HCI Command: Host Number of Completed Packets (0x03|0x0035) plen 5                            #103 8.908635
        Num handles: 1
        Handle: 147 Address: DF:A9:FF:F6:B1:1A (OUI DF-A9-FF)
        Count: 1
zephyr.exe[461153]: < ACL Data TX: Handle 147 [1/3] flags 0x00 dlen 22                                              #104 8.908662
      ATT: Read By Type Response (0x09) len 17
        Attribute data length: 8
        Attribute data list: 2 entries
        Handle: 0x005d
        Value[6]: 24002f004518
        Handle: 0x005e
        Value[6]: 30003b004518
> HCI Event: Number of Completed Packets (0x13) plen 5                                                              #105 9.078981
        Num handles: 1
        Handle: 147 Address: DF:A9:FF:F6:B1:1A (OUI DF-A9-FF)
        Count: 1
        Buffers: 0/3
        #104: len 22 (1 Kb/s)
        Latency: 170 msec (70-170 msec ~162 msec)
> ACL Data RX: Handle 147 flags 0x02 dlen 11                                                                        #106 9.079145
      ATT: Read By Type Request (0x08) len 6
        Handle range: 0x005f-0xffff
        Attribute type: Include (0x2802)
zephyr.exe[461153]: < HCI Command: Host Number of Completed Packets (0x03|0x0035) plen 5                            #107 9.088631
        Num handles: 1
        Handle: 147 Address: DF:A9:FF:F6:B1:1A (OUI DF-A9-FF)
        Count: 1
zephyr.exe[461153]: < ACL Data TX: Handle 147 [1/3] flags 0x00 dlen 22                                              #108 9.088655
      ATT: Read By Type Response (0x09) len 17
        Attribute data length: 8
        Attribute data list: 2 entries
        Handle: 0x005f
        Value[6]: 3c004b004318
        Handle: 0x0060
        Value[6]: 4c005b004318
> HCI Event: Number of Completed Packets (0x13) plen 5                                                              #109 9.254201
        Num handles: 1
        Handle: 147 Address: DF:A9:FF:F6:B1:1A (OUI DF-A9-FF)
        Count: 1
        Buffers: 0/3
        #108: len 22 (1 Kb/s)
        Latency: 165 msec (70-170 msec ~164 msec)
> ACL Data RX: Handle 147 flags 0x02 dlen 11                                                                        #110 9.254446
      ATT: Read By Type Request (0x08) len 6
        Handle range: 0x0061-0xffff
        Attribute type: Include (0x2802)
zephyr.exe[461153]: < HCI Command: Host Number of Completed Packets (0x03|0x0035) plen 5                            #111 9.268631
        Num handles: 1
        Handle: 147 Address: DF:A9:FF:F6:B1:1A (OUI DF-A9-FF)
        Count: 1
zephyr.exe[461153]: < ACL Data TX: Handle 147 [1/3] flags 0x00 dlen 9                                               #112 9.268653
      ATT: Error Response (0x01) len 4
        Read By Type Request (0x08)
        Handle: 0x0061
        Error: Attribute Not Found (0x0a)
> HCI Event: Number of Completed Packets (0x13) plen 5                                                              #113 9.429196
        Num handles: 1
        Handle: 147 Address: DF:A9:FF:F6:B1:1A (OUI DF-A9-FF)
        Count: 1
        Buffers: 0/3
        #112: len 9 (0 Kb/s)
        Latency: 160 msec (70-170 msec ~162 msec)
> ACL Data RX: Handle 147 flags 0x02 dlen 11                                                                        #114 9.429361
      ATT: Read By Type Request (0x08) len 6
        Handle range: 0x0024-0x002f
        Attribute type: Characteristic (0x2803)
zephyr.exe[461153]: < HCI Command: Host Number of Completed Packets (0x03|0x0035) plen 5                            #115 9.448632
        Num handles: 1
        Handle: 147 Address: DF:A9:FF:F6:B1:1A (OUI DF-A9-FF)
        Count: 1
zephyr.exe[461153]: < ACL Data TX: Handle 147 [1/3] flags 0x00 dlen 20                                              #116 9.448697
      ATT: Read By Type Response (0x09) len 15
        Attribute data length: 7
        Attribute data list: 2 entries
        Handle: 0x0025
        Value[5]: 122600802b
            Properties: 0x12
              Read (0x02)
              Notify (0x10)
            Value Handle: 0x0026
            Value UUID: Offset State (0x2b80)
        Handle: 0x0028
        Value[5]: 162900812b
            Properties: 0x16
              Read (0x02)
              Write Without Response (0x04)
              Notify (0x10)
            Value Handle: 0x0029
            Value UUID: Audio Location (0x2b81)
> HCI Event: Number of Completed Packets (0x13) plen 5                                                              #117 9.603898
        Num handles: 1
        Handle: 147 Address: DF:A9:FF:F6:B1:1A (OUI DF-A9-FF)
        Count: 1
        Buffers: 0/3
        #116: len 20 (1 Kb/s)
        Latency: 155 msec (70-170 msec ~158 msec)
> ACL Data RX: Handle 147 flags 0x02 dlen 11                                                                        #118 9.604062
      ATT: Read By Type Request (0x08) len 6
        Handle range: 0x0029-0x002f
        Attribute type: Characteristic (0x2803)
zephyr.exe[461153]: < HCI Command: Host Number of Completed Packets (0x03|0x0035) plen 5                            #119 9.608636
        Num handles: 1
        Handle: 147 Address: DF:A9:FF:F6:B1:1A (OUI DF-A9-FF)
        Count: 1
zephyr.exe[461153]: < ACL Data TX: Handle 147 [1/3] flags 0x00 dlen 20                                              #120 9.608663
      ATT: Read By Type Response (0x09) len 15
        Attribute data length: 7
        Attribute data list: 2 entries
        Handle: 0x002b
        Value[5]: 082c00822b
            Properties: 0x08
              Write (0x08)
            Value Handle: 0x002c
            Value UUID: Volume Offset Control Point (0x2b82)
        Handle: 0x002d
        Value[5]: 162e00832b
            Properties: 0x16
              Read (0x02)
              Write Without Response (0x04)
              Notify (0x10)
            Value Handle: 0x002e
            Value UUID: Audio Output Description (0x2b83)
> HCI Event: Number of Completed Packets (0x13) plen 5                                                              #121 9.778801
        Num handles: 1
        Handle: 147 Address: DF:A9:FF:F6:B1:1A (OUI DF-A9-FF)
        Count: 1
        Buffers: 0/3
        #120: len 20 (0 Kb/s)
        Latency: 170 msec (70-170 msec ~164 msec)
> ACL Data RX: Handle 147 flags 0x02 dlen 11                                                                        #122 9.779018
      ATT: Read By Type Request (0x08) len 6
        Handle range: 0x002e-0x002f
        Attribute type: Characteristic (0x2803)
zephyr.exe[461153]: < HCI Command: Host Number of Completed Packets (0x03|0x0035) plen 5                            #123 9.788621
        Num handles: 1
        Handle: 147 Address: DF:A9:FF:F6:B1:1A (OUI DF-A9-FF)
        Count: 1
zephyr.exe[461153]: < ACL Data TX: Handle 147 [1/3] flags 0x00 dlen 9                                               #124 9.788685
      ATT: Error Response (0x01) len 4
        Read By Type Request (0x08)
        Handle: 0x002e
        Error: Attribute Not Found (0x0a)
> HCI Event: Number of Completed Packets (0x13) plen 5                                                              #125 9.953746
        Num handles: 1
        Handle: 147 Address: DF:A9:FF:F6:B1:1A (OUI DF-A9-FF)
        Count: 1
        Buffers: 0/3
        #124: len 9 (0 Kb/s)
        Latency: 165 msec (70-170 msec ~164 msec)
> ACL Data RX: Handle 147 flags 0x02 dlen 9                                                                         #126 9.954040
      ATT: Find Information Request (0x04) len 4
        Handle range: 0x0027-0x0027
zephyr.exe[461153]: < HCI Command: Host Number of Completed Packets (0x03|0x0035) plen 5                            #127 9.968618
        Num handles: 1
        Handle: 147 Address: DF:A9:FF:F6:B1:1A (OUI DF-A9-FF)
        Count: 1
zephyr.exe[461153]: < ACL Data TX: Handle 147 [1/3] flags 0x00 dlen 10                                              #128 9.968676
      ATT: Find Information Response (0x05) len 5
        Format: UUID-16 (0x01)
        Handle: 0x0027
        UUID: Client Characteristic Configuration (0x2902)
> HCI Event: Number of Completed Packets (0x13) plen 5                                                             #129 10.129033
        Num handles: 1
        Handle: 147 Address: DF:A9:FF:F6:B1:1A (OUI DF-A9-FF)
        Count: 1
        Buffers: 0/3
        #128: len 10 (0 Kb/s)
        Latency: 160 msec (70-170 msec ~162 msec)
> ACL Data RX: Handle 147 flags 0x02 dlen 9                                                                        #130 10.129035
      ATT: Find Information Request (0x04) len 4
        Handle range: 0x002a-0x002a
zephyr.exe[461153]: < HCI Command: Host Number of Completed Packets (0x03|0x0035) plen 5                           #131 10.148708
        Num handles: 1
        Handle: 147 Address: DF:A9:FF:F6:B1:1A (OUI DF-A9-FF)
        Count: 1
zephyr.exe[461153]: < ACL Data TX: Handle 147 [1/3] flags 0x00 dlen 10                                             #132 10.148735
      ATT: Find Information Response (0x05) len 5
        Format: UUID-16 (0x01)
        Handle: 0x002a
        UUID: Client Characteristic Configuration (0x2902)
> HCI Event: Number of Completed Packets (0x13) plen 5                                                             #133 10.303802
        Num handles: 1
        Handle: 147 Address: DF:A9:FF:F6:B1:1A (OUI DF-A9-FF)
        Count: 1
        Buffers: 0/3
        #132: len 10 (0 Kb/s)
        Latency: 155 msec (70-170 msec ~158 msec)
> ACL Data RX: Handle 147 flags 0x02 dlen 9                                                                        #134 10.303950
      ATT: Find Information Request (0x04) len 4
        Handle range: 0x002f-0x002f
zephyr.exe[461153]: < HCI Command: Host Number of Completed Packets (0x03|0x0035) plen 5                           #135 10.308617
        Num handles: 1
        Handle: 147 Address: DF:A9:FF:F6:B1:1A (OUI DF-A9-FF)
        Count: 1
zephyr.exe[461153]: < ACL Data TX: Handle 147 [1/3] flags 0x00 dlen 10                                             #136 10.308668
      ATT: Find Information Response (0x05) len 5
        Format: UUID-16 (0x01)
        Handle: 0x002f
        UUID: Client Characteristic Configuration (0x2902)
> HCI Event: Number of Completed Packets (0x13) plen 5                                                             #137 10.478680
        Num handles: 1
        Handle: 147 Address: DF:A9:FF:F6:B1:1A (OUI DF-A9-FF)
        Count: 1
        Buffers: 0/3
        #136: len 10 (0 Kb/s)
        Latency: 170 msec (70-170 msec ~164 msec)
> ACL Data RX: Handle 147 flags 0x02 dlen 11                                                                       #138 10.478872
      ATT: Read By Type Request (0x08) len 6
        Handle range: 0x0030-0x003b
        Attribute type: Characteristic (0x2803)
zephyr.exe[461153]: < HCI Command: Host Number of Completed Packets (0x03|0x0035) plen 5                           #139 10.488638
        Num handles: 1
        Handle: 147 Address: DF:A9:FF:F6:B1:1A (OUI DF-A9-FF)
        Count: 1
zephyr.exe[461153]: < ACL Data TX: Handle 147 [1/3] flags 0x00 dlen 20                                             #140 10.488665
      ATT: Read By Type Response (0x09) len 15
        Attribute data length: 7
        Attribute data list: 2 entries
        Handle: 0x0031
        Value[5]: 123200802b
            Properties: 0x12
              Read (0x02)
              Notify (0x10)
            Value Handle: 0x0032
            Value UUID: Offset State (0x2b80)
        Handle: 0x0034
        Value[5]: 163500812b
            Properties: 0x16
              Read (0x02)
              Write Without Response (0x04)
              Notify (0x10)
            Value Handle: 0x0035
            Value UUID: Audio Location (0x2b81)
> HCI Event: Number of Completed Packets (0x13) plen 5                                                             #141 10.653821
        Num handles: 1
        Handle: 147 Address: DF:A9:FF:F6:B1:1A (OUI DF-A9-FF)
        Count: 1
        Buffers: 0/3
        #140: len 20 (0 Kb/s)
        Latency: 165 msec (70-170 msec ~164 msec)
> ACL Data RX: Handle 147 flags 0x02 dlen 11                                                                       #142 10.653913
      ATT: Read By Type Request (0x08) len 6
        Handle range: 0x0035-0x003b
        Attribute type: Characteristic (0x2803)
zephyr.exe[461153]: < HCI Command: Host Number of Completed Packets (0x03|0x0035) plen 5                           #143 10.668636
        Num handles: 1
        Handle: 147 Address: DF:A9:FF:F6:B1:1A (OUI DF-A9-FF)
        Count: 1
zephyr.exe[461153]: < ACL Data TX: Handle 147 [1/3] flags 0x00 dlen 20                                             #144 10.668662
      ATT: Read By Type Response (0x09) len 15
        Attribute data length: 7
        Attribute data list: 2 entries
        Handle: 0x0037
        Value[5]: 083800822b
            Properties: 0x08
              Write (0x08)
            Value Handle: 0x0038
            Value UUID: Volume Offset Control Point (0x2b82)
        Handle: 0x0039
        Value[5]: 163a00832b
            Properties: 0x16
              Read (0x02)
              Write Without Response (0x04)
              Notify (0x10)
            Value Handle: 0x003a
            Value UUID: Audio Output Description (0x2b83)
> HCI Event: Number of Completed Packets (0x13) plen 5                                                             #145 10.828856
        Num handles: 1
        Handle: 147 Address: DF:A9:FF:F6:B1:1A (OUI DF-A9-FF)
        Count: 1
        Buffers: 0/3
        #144: len 20 (1 Kb/s)
        Latency: 160 msec (70-170 msec ~162 msec)
> ACL Data RX: Handle 147 flags 0x02 dlen 11                                                                       #146 10.829209
      ATT: Read By Type Request (0x08) len 6
        Handle range: 0x003a-0x003b
        Attribute type: Characteristic (0x2803)
zephyr.exe[461153]: < HCI Command: Host Number of Completed Packets (0x03|0x0035) plen 5                           #147 10.848630
        Num handles: 1
        Handle: 147 Address: DF:A9:FF:F6:B1:1A (OUI DF-A9-FF)
        Count: 1
zephyr.exe[461153]: < ACL Data TX: Handle 147 [1/3] flags 0x00 dlen 9                                              #148 10.848657
      ATT: Error Response (0x01) len 4
        Read By Type Request (0x08)
        Handle: 0x003a
        Error: Attribute Not Found (0x0a)
> HCI Event: Number of Completed Packets (0x13) plen 5                                                             #149 11.003854
        Num handles: 1
        Handle: 147 Address: DF:A9:FF:F6:B1:1A (OUI DF-A9-FF)
        Count: 1
        Buffers: 0/3
        #148: len 9 (0 Kb/s)
        Latency: 155 msec (70-170 msec ~158 msec)
> ACL Data RX: Handle 147 flags 0x02 dlen 9                                                                        #150 11.003926
      ATT: Find Information Request (0x04) len 4
        Handle range: 0x0033-0x0033
zephyr.exe[461153]: < HCI Command: Host Number of Completed Packets (0x03|0x0035) plen 5                           #151 11.008608
        Num handles: 1
        Handle: 147 Address: DF:A9:FF:F6:B1:1A (OUI DF-A9-FF)
        Count: 1
zephyr.exe[461153]: < ACL Data TX: Handle 147 [1/3] flags 0x00 dlen 10                                             #152 11.008636
      ATT: Find Information Response (0x05) len 5
        Format: UUID-16 (0x01)
        Handle: 0x0033
        UUID: Client Characteristic Configuration (0x2902)
> HCI Event: Number of Completed Packets (0x13) plen 5                                                             #153 11.178953
        Num handles: 1
        Handle: 147 Address: DF:A9:FF:F6:B1:1A (OUI DF-A9-FF)
        Count: 1
        Buffers: 0/3
        #152: len 10 (0 Kb/s)
        Latency: 170 msec (70-170 msec ~164 msec)
> ACL Data RX: Handle 147 flags 0x02 dlen 9                                                                        #154 11.179050
      ATT: Find Information Request (0x04) len 4
        Handle range: 0x0036-0x0036
zephyr.exe[461153]: < HCI Command: Host Number of Completed Packets (0x03|0x0035) plen 5                           #155 11.188538
        Num handles: 1
        Handle: 147 Address: DF:A9:FF:F6:B1:1A (OUI DF-A9-FF)
        Count: 1
zephyr.exe[461153]: < ACL Data TX: Handle 147 [1/3] flags 0x00 dlen 10                                             #156 11.188599
      ATT: Find Information Response (0x05) len 5
        Format: UUID-16 (0x01)
        Handle: 0x0036
        UUID: Client Characteristic Configuration (0x2902)
> HCI Event: Number of Completed Packets (0x13) plen 5                                                             #157 11.353973
        Num handles: 1
        Handle: 147 Address: DF:A9:FF:F6:B1:1A (OUI DF-A9-FF)
        Count: 1
        Buffers: 0/3
        #156: len 10 (0 Kb/s)
        Latency: 165 msec (70-170 msec ~164 msec)
> ACL Data RX: Handle 147 flags 0x02 dlen 9                                                                        #158 11.354074
      ATT: Find Information Request (0x04) len 4
        Handle range: 0x003b-0x003b
zephyr.exe[461153]: < HCI Command: Host Number of Completed Packets (0x03|0x0035) plen 5                           #159 11.368640
        Num handles: 1
        Handle: 147 Address: DF:A9:FF:F6:B1:1A (OUI DF-A9-FF)
        Count: 1
zephyr.exe[461153]: < ACL Data TX: Handle 147 [1/3] flags 0x00 dlen 10                                             #160 11.368668
      ATT: Find Information Response (0x05) len 5
        Format: UUID-16 (0x01)
        Handle: 0x003b
        UUID: Client Characteristic Configuration (0x2902)
> HCI Event: Number of Completed Packets (0x13) plen 5                                                             #161 11.528621
        Num handles: 1
        Handle: 147 Address: DF:A9:FF:F6:B1:1A (OUI DF-A9-FF)
        Count: 1
        Buffers: 0/3
        #160: len 10 (0 Kb/s)
        Latency: 159 msec (70-170 msec ~162 msec)
> ACL Data RX: Handle 147 flags 0x02 dlen 9                                                                        #162 11.528910
      ATT: Write Request (0x12) len 4
        Handle: 0x0027
          Data[2]: 0000
zephyr.exe[461153]: < HCI Command: Host Number of Completed Packets (0x03|0x0035) plen 5                           #163 11.548605
        Num handles: 1
        Handle: 147 Address: DF:A9:FF:F6:B1:1A (OUI DF-A9-FF)
        Count: 1
zephyr.exe[461153]: < ACL Data TX: Handle 147 [1/3] flags 0x00 dlen 5                                              #164 11.548657
      ATT: Write Response (0x13) len 0
> HCI Event: Number of Completed Packets 