Bluetooth monitor ver 5.72
= Note: Linux version 6.14.0-36-generic (x86_64)                       0.872491
= Note: Bluetooth subsystem version 2.22                               0.872493
= New Index: 00:00:00:00:00:00 (Primary,UART,hci1)              [hci1] 0.872494
= New Index: 48:5F:99:8E:E0:64 (Primary,USB,hci0)               [hci0] 0.872495
= Open Index: 00:00:00:00:00:00                                 [hci1] 1.004393
= Index Info: 00:00:00:00:00:00 (Nordic Semiconductor ASA)      [hci1] 1.004397
@ USER Open: main (privileged) version 2.22            {0x0001} [hci1] 1.004400
< HCI Command: Reset (0x03|0x0003) plen 0                    #1 [hci1] 1.004765
> HCI Event: Command Complete (0x0e) plen 4                  #2 [hci1] 1.005237
      Reset (0x03|0x0003) ncmd 1
        Status: Success (0x00)
< HCI Command: Read Local Supported... (0x04|0x0003) plen 0  #3 [hci1] 1.024354
> HCI Event: Command Complete (0x0e) plen 12                 #4 [hci1] 1.024829
      Read Local Supported Features (0x04|0x0003) ncmd 1
        Status: Success (0x00)
        Features: 0x00 0x00 0x00 0x00 0x60 0x00 0x00 0x00
          BR/EDR Not Supported
          LE Supported (Controller)
< HCI Command: Read Local Version In.. (0x04|0x0001) plen 0  #5 [hci1] 1.044457
> HCI Event: Command Complete (0x0e) plen 12                 #6 [hci1] 1.044952
      Read Local Version Information (0x04|0x0001) ncmd 1
        Status: Success (0x00)
        HCI version: Reserved (0x0f) - Revision 12393 (0x3069)
        LMP version: Reserved (0x0f) - Subversion 12393 (0x3069)
        Manufacturer: Nordic Semiconductor ASA (89)
< HCI Command: Read Local Supported... (0x04|0x0002) plen 0  #7 [hci1] 1.064320
> HCI Event: Command Complete (0x0e) plen 68                 #8 [hci1] 1.065379
      Read Local Supported Commands (0x04|0x0002) ncmd 1
        Status: Success (0x00)
        Commands: 119 entries
          Disconnect (Octet 0 - Bit 5)
          Read Remote Version Information (Octet 2 - Bit 7)
          Set Event Mask (Octet 5 - Bit 6)
          Reset (Octet 5 - Bit 7)
          Read Connection Accept Timeout (Octet 7 - Bit 2)
          Write Connection Accept Timeout (Octet 7 - Bit 3)
          Read Transmit Power Level (Octet 10 - Bit 2)
          Set Controller To Host Flow Control (Octet 10 - Bit 5)
          Host Buffer Size (Octet 10 - Bit 6)
          Host Number of Completed Packets (Octet 10 - Bit 7)
          Read Local Version Information (Octet 14 - Bit 3)
          Read Local Supported Features (Octet 14 - Bit 5)
          Read BD ADDR (Octet 15 - Bit 1)
          Read RSSI (Octet 15 - Bit 5)
          Set Event Mask Page 2 (Octet 22 - Bit 2)
          LE Set Event Mask (Octet 25 - Bit 0)
          LE Read Buffer Size (Octet 25 - Bit 1)
          LE Read Local Supported Features (Octet 25 - Bit 2)
          LE Set Random Address (Octet 25 - Bit 4)
          LE Set Advertising Parameters (Octet 25 - Bit 5)
          LE Read Advertising Channel TX Power (Octet 25 - Bit 6)
          LE Set Advertising Data (Octet 25 - Bit 7)
          LE Set Scan Response Data (Octet 26 - Bit 0)
          LE Set Advertise Enable (Octet 26 - Bit 1)
          LE Set Scan Parameters (Octet 26 - Bit 2)
          LE Set Scan Enable (Octet 26 - Bit 3)
          LE Create Connection (Octet 26 - Bit 4)
          LE Create Connection Cancel (Octet 26 - Bit 5)
          LE Read Accept List Size (Octet 26 - Bit 6)
          LE Clear Accept List (Octet 26 - Bit 7)
          LE Add Device To Accept List (Octet 27 - Bit 0)
          LE Remove Device From Accept List (Octet 27 - Bit 1)
          LE Connection Update (Octet 27 - Bit 2)
          LE Set Host Channel Classification (Octet 27 - Bit 3)
          LE Read Channel Map (Octet 27 - Bit 4)
          LE Read Remote Used Features (Octet 27 - Bit 5)
          LE Encrypt (Octet 27 - Bit 6)
          LE Rand (Octet 27 - Bit 7)
          LE Start Encryption (Octet 28 - Bit 0)
          LE Long Term Key Request Reply (Octet 28 - Bit 1)
          LE Long Term Key Request Neg Reply (Octet 28 - Bit 2)
          LE Read Supported States (Octet 28 - Bit 3)
          LE Receiver Test (Octet 28 - Bit 4)
          LE Transmitter Test (Octet 28 - Bit 5)
          LE Test End (Octet 28 - Bit 6)
          Read Authenticated Payload Timeout (Octet 32 - Bit 4)
          Write Authenticated Payload Timeout (Octet 32 - Bit 5)
          LE Set Data Length (Octet 33 - Bit 6)
          LE Read Suggested Default Data Length (Octet 33 - Bit 7)
          LE Write Suggested Default Data Length (Octet 34 - Bit 0)
          LE Add Device To Resolving List (Octet 34 - Bit 3)
          LE Remove Device From Resolving List (Octet 34 - Bit 4)
          LE Clear Resolving List (Octet 34 - Bit 5)
          LE Read Resolving List Size (Octet 34 - Bit 6)
          LE Set Address Resolution Enable (Octet 35 - Bit 1)
          LE Set Resolvable Private Address Timeout (Octet 35 - Bit 2)
          LE Read Maximum Data Length (Octet 35 - Bit 3)
          LE Read PHY (Octet 35 - Bit 4)
          LE Set Default PHY (Octet 35 - Bit 5)
          LE Set PHY (Octet 35 - Bit 6)
          LE Enhanced Receiver Test (Octet 35 - Bit 7)
          LE Enhanced Transmitter Test (Octet 36 - Bit 0)
          LE Set Advertising Set Random Address (Octet 36 - Bit 1)
          LE Set Extended Advertising Parameters (Octet 36 - Bit 2)
          LE Set Extended Advertising Data (Octet 36 - Bit 3)
          LE Set Extended Scan Response Data (Octet 36 - Bit 4)
          LE Set Extended Advertising Enable (Octet 36 - Bit 5)
          LE Read Maximum Advertising Data Length (Octet 36 - Bit 6)
          LE Read Number of Supported Advertising Sets (Octet 36 - Bit 7)
          LE Remove Advertising Set (Octet 37 - Bit 0)
          LE Clear Advertising Sets (Octet 37 - Bit 1)
          LE Set Periodic Advertising Parameters (Octet 37 - Bit 2)
          LE Set Periodic Advertising Data (Octet 37 - Bit 3)
          LE Set Periodic Advertising Enable (Octet 37 - Bit 4)
          LE Set Extended Scan Parameters (Octet 37 - Bit 5)
          LE Set Extended Scan Enable (Octet 37 - Bit 6)
          LE Extended Create Connection (Octet 37 - Bit 7)
          LE Periodic Advertising Create Sync (Octet 38 - Bit 0)
          LE Periodic Advertising Create Sync Cancel (Octet 38 - Bit 1)
          LE Periodic Advertising Terminate Sync (Octet 38 - Bit 2)
          LE Add Device To Periodic Advertiser List (Octet 38 - Bit 3)
          LE Remove Device From Periodic Advertiser List (Octet 38 - Bit 4)
          LE Clear Periodic Advertiser List (Octet 38 - Bit 5)
          LE Read Periodic Advertiser List Size (Octet 38 - Bit 6)
          LE Read Transmit Power (Octet 38 - Bit 7)
          LE Read RF Path Compensation (Octet 39 - Bit 0)
          LE Write RF Path Compensation (Octet 39 - Bit 1)
          LE Set Privacy Mode (Octet 39 - Bit 2)
          LE Periodic Advertising Receive Enable (Octet 40 - Bit 5)
          LE Periodic Advertising Sync Transfer (Octet 40 - Bit 6)
          LE Periodic Advertising Set Info Transfer (Octet 40 - Bit 7)
          LE Periodic Advertising Sync Transfer Parameters (Octet 41 - Bit 0)
          LE Set Default Periodic Advertisng Sync Transfer Parameters (Octet 41 - Bit 1)
          LE Read Buffer v2 (Octet 41 - Bit 5)
          LE Read ISO TX Sync (Octet 41 - Bit 6)
          LE Set Connected Isochronous Group Parameters (Octet 41 - Bit 7)
          LE Set Connected Isochronous Group Parameters Test (Octet 42 - Bit 0)
          LE Create Connected Isochronous Stream (Octet 42 - Bit 1)
          LE Remove Connected Isochronous Group (Octet 42 - Bit 2)
          LE Accept Connected Isochronous Stream Request (Octet 42 - Bit 3)
          LE Reject Connected Isochronous Stream Request (Octet 42 - Bit 4)
          LE Create Broadcast Isochronous Group (Octet 42 - Bit 5)
          LE Create Broadcast Isochronous Group Test (Octet 42 - Bit 6)
          LE Terminate Broadcast Isochronous Group (Octet 42 - Bit 7)
          LE Broadcast Isochronous Group Create Sync (Octet 43 - Bit 0)
          LE Broadcast Isochronous Group Terminate Sync (Octet 43 - Bit 1)
          LE Request Peer SCA (Octet 43 - Bit 2)
          LE Setup Isochronous Data Path (Octet 43 - Bit 3)
          LE Remove Isochronous Data Path (Octet 43 - Bit 4)
          LE Isochronous Transmit Test (Octet 43 - Bit 5)
          LE Isochronous Receive Test (Octet 43 - Bit 6)
          LE Isochronous Read Test Counters (Octet 43 - Bit 7)
          LE Isochronous Read Test Counters (Octet 44 - Bit 0)
          LE Set Host Feature (Octet 44 - Bit 1)
          Octet 44 - Bit 2 
          Octet 45 - Bit 6 
          Octet 46 - Bit 0 
          Octet 46 - Bit 1 
          Octet 46 - Bit 2 
< HCI Command: Host Buffer Size (0x03|0x0033) plen 7         #9 [hci1] 1.084330
        ACL MTU: 255  ACL max packet: 16
        SCO MTU: 0    SCO max packet: 0
> HCI Event: Command Complete (0x0e) plen 4                 #10 [hci1] 1.084832
      Host Buffer Size (0x03|0x0033) ncmd 1
        Status: Success (0x00)
< HCI Command: Set Controller To Ho.. (0x03|0x0031) plen 1  #11 [hci1] 1.104263
        Flow control: ACL Data Packets (0x01)
> HCI Event: Command Complete (0x0e) plen 4                 #12 [hci1] 1.104843
      Set Controller To Host Flow Control (0x03|0x0031) ncmd 1
        Status: Success (0x00)
< HCI Command: LE Read Local Suppor.. (0x08|0x0003) plen 0  #13 [hci1] 1.124318
> HCI Event: Command Complete (0x0e) plen 12                #14 [hci1] 1.125038
      LE Read Local Supported Features (0x08|0x0003) ncmd 1
        Status: Success (0x00)
        Features: 0xfd 0x79 0x00 0xf7 0x30 0x01 0x00 0x00
          LE Encryption
          Extended Reject Indication
          Peripheral-initiated Features Exchange
          LE Ping
          LE Data Packet Length Extension
          LL Privacy
          Extended Scanner Filter Policies
          LE 2M PHY
          LE Coded PHY
          LE Extended Advertising
          LE Periodic Advertising
          Channel Selection Algorithm #2
          Periodic Advertising Sync Transfer - Sender
          Periodic Advertising Sync Transfer - Recipient
          Sleep Clock Accuracy Updates
          Connected Isochronous Stream - Central
          Connected Isochronous Stream - Peripheral
          Isochronous Broadcaster
          Synchronized Receiver
          Periodic Advertising ADI support
          Connection Subrating
          Unknown features (0x0000010000000000)
< HCI Command: LE Set Host Feature (0x08|0x0074) plen 2     #15 [hci1] 1.144294
        Bit Number: 32
          Connected Isochronous Stream (Host Support)
        Bit Value: 1
> HCI Event: Command Complete (0x0e) plen 4                 #16 [hci1] 1.144659
      LE Set Host Feature (0x08|0x0074) ncmd 1
        Status: Success (0x00)
< HCI Command: LE Read Buffer v2 (0x08|0x0060) plen 0       #17 [hci1] 1.164238
> HCI Event: Command Complete (0x0e) plen 10                #18 [hci1] 1.164739
      LE Read Buffer v2 (0x08|0x0060) ncmd 1
        Status: Success (0x00)
        ACL MTU: 27
        ACL max packet: 3
        ISO MTU: 318
        ISO max packet: 3
< HCI Command: LE Read Maximum Adve.. (0x08|0x003a) plen 0  #19 [hci1] 1.184305
> HCI Event: Command Complete (0x0e) plen 6                 #20 [hci1] 1.184730
      LE Read Maximum Advertising Data Length (0x08|0x003a) ncmd 1
        Status: Success (0x00)
        Max length: 1650
< HCI Command: LE Read Supported St.. (0x08|0x001c) plen 0  #21 [hci1] 1.204285
> HCI Event: Command Complete (0x0e) plen 12                #22 [hci1] 1.204768
      LE Read Supported States (0x08|0x001c) ncmd 1
        Status: Success (0x00)
        States: 0x000003ff3e0306ff
          Non-connectable Advertising State
          Scannable Advertising State
          Connectable Advertising State
          High Duty Cycle Directed Advertising State
          Passive Scanning State
          Active Scanning State
          Initiating State
            and Connection State (Central Role)
          Connection State (Peripheral Role)
          Scannable Advertising State
            and Passive Scanning State
          Connectable Advertising State
            and Passive Scanning State
          Non-connectable Advertising State
            and Initiating State
          Scannable Advertising State
            and Initiating State
          Active Scanning State
            and Connection State (Central Role)
          Passive Scanning State
            and Connection State (Peripheral Role)
          Active Scanning State
            and Connection State (Peripheral Role)
          Initiating State
            and Connection State (Central Role)
            and Central Role & Central Role
          Low Duty Cycle Directed Advertising State
          Connectable Advertising State
            and Initiating State
            and Central Role & Peripheral Role
          High Duty Cycle Directed Advertising State
            and Initiating State
            and Central Role & Peripheral Role
          Low Duty Cycle Directed Advertising State
            and Initiating State
            and Central Role & Peripheral Role
          Connectable Advertising State
            and Connection State (Central Role)
            and Central Role & Peripheral Role
          High Duty Cycle Directed Advertising State
            and Connection State (Central Role)
            and Central Role & Peripheral Role
          Low Duty Cycle Directed Advertising State
            and Connection State (Central Role)
            and Central Role & Peripheral Role
          Connectable Advertising State
            and Connection State (Peripheral Role)
            and Central Role & Peripheral Role
          High Duty Cycle Directed Advertising State
            and Connection State (Peripheral Role)
            and Peripheral Role & Peripheral Role
          Low Duty Cycle Directed Advertising State
            and Connection State (Peripheral Role)
            and Peripheral Role & Peripheral Role
          Initiating State
            and Connection State (Peripheral Role)
            and Central Role & Peripheral Role
< HCI Command: LE Read Maximum Data.. (0x08|0x002f) plen 0  #23 [hci1] 1.224277
> HCI Event: Command Complete (0x0e) plen 12                #24 [hci1] 1.224776
      LE Read Maximum Data Length (0x08|0x002f) ncmd 1
        Status: Success (0x00)
        Max TX octets: 251
        Max TX time: 2704
        Max RX octets: 251
        Max RX time: 2704
< HCI Command: LE Write Suggested D.. (0x08|0x0024) plen 4  #25 [hci1] 1.244377
        TX octets: 251
        TX time: 2704
> HCI Event: Command Complete (0x0e) plen 4                 #26 [hci1] 1.244810
      LE Write Suggested Default Data Length (0x08|0x0024) ncmd 1
        Status: Success (0x00)
< HCI Command: LE Read Resolving Li.. (0x08|0x002a) plen 0  #27 [hci1] 1.264320
> HCI Event: Command Complete (0x0e) plen 5                 #28 [hci1] 1.264763
      LE Read Resolving List Size (0x08|0x002a) ncmd 1
        Status: Success (0x00)
        Size: 8
< HCI Command: LE Set Event Mask (0x08|0x0001) plen 8       #29 [hci1] 1.284262
        Mask: 0x000002023f87fa5e
          LE Advertising Report
          LE Connection Update Complete
          LE Read Remote Used Features Complete
          LE Long Term Key Request
          LE Data Length Change
          LE Enhanced Connection Complete
          LE PHY Update Complete
          LE Extended Advertising Report
          LE Periodic Advertising Sync Established
          LE Periodic Advertising Report
          LE Periodic Advertising Sync Lost
          LE Extended Scan Timeout
          LE Extended Advertising Set Terminated
          LE Scan Request Received
          LE Periodic Advertising Sync Transfer Rvc
          LE CIS Established
          LE CIS Request
          LE Create BIG Complete
          LE Terminate BIG Complete
          LE BIG Sync Estabilished Complete
          LE BIG Sync Lost
          LE BIG Info Advertising Report
          Unknown mask (0x0000020000000000)
> HCI Event: Command Complete (0x0e) plen 4                 #30 [hci1] 1.284770
      LE Set Event Mask (0x08|0x0001) ncmd 1
        Status: Success (0x00)
< HCI Command: Set Event Mask (0x03|0x0001) plen 8          #31 [hci1] 1.304345
        Mask: 0x2000800002008890
          Disconnection Complete
          Encryption Change
          Read Remote Version Information Complete
          Hardware Error
          Data Buffer Overflow
          Encryption Key Refresh Complete
          LE Meta
> HCI Event: Command Complete (0x0e) plen 4                 #32 [hci1] 1.304891
      Set Event Mask (0x03|0x0001) ncmd 1
        Status: Success (0x00)
< HCI Command: Read BD ADDR (0x04|0x0009) plen 0            #33 [hci1] 1.324337
> HCI Event: Command Complete (0x0e) plen 10                #34 [hci1] 1.324786
      Read BD ADDR (0x04|0x0009) ncmd 1
        Status: Success (0x00)
        Address: 00:00:00:00:00:00 (OUI 00-00-00)
< HCI Command: LE Set Random Address (0x08|0x0005) plen 6   #35 [hci1] 1.344261
        Address: D5:B6:CC:31:DB:3B (Static)
> HCI Event: Command Complete (0x0e) plen 4                 #36 [hci1] 1.345823
      LE Set Random Address (0x08|0x0005) ncmd 1
        Status: Success (0x00)
< HCI Command: LE Extended Create... (0x08|0x0043) plen 26  #37 [hci1] 3.614376
        Filter policy: Accept list is not used (0x00)
        Own address type: Random (0x01)
        Peer address type: Public (0x00)
        Peer address: DF:A9:FF:F6:B1:1A (OUI DF-A9-FF)
        Initiating PHYs: 0x01
        Entry 0: LE 1M
          Scan interval: 60.000 msec (0x0060)
          Scan window: 60.000 msec (0x0060)
          Min connection interval: 30.00 msec (0x0018)
          Max connection interval: 50.00 msec (0x0028)
          Connection latency: 0 (0x0000)
          Supervision timeout: 4000 msec (0x0190)
          Min connection length: 0.000 msec (0x0000)
          Max connection length: 0.000 msec (0x0000)
> HCI Event: Command Status (0x0f) plen 4                   #38 [hci1] 3.615247
      LE Extended Create Connection (0x08|0x0043) ncmd 1
        Status: Success (0x00)
> HCI Event: LE Meta Event (0x3e) plen 31                   #39 [hci1] 3.695112
      LE Enhanced Connection Complete (0x0a)
        Status: Success (0x00)
        Handle: 2304
        Role: Central (0x00)
        Peer address type: Public (0x00)
        Peer address: DF:A9:FF:F6:B1:1A (OUI DF-A9-FF)
        Local resolvable private address: 00:00:00:00:00:00 (Non-Resolvable)
        Peer resolvable private address: 00:00:00:00:00:00 (Non-Resolvable)
        Connection interval: 50.00 msec (0x0028)
        Connection latency: 0 (0x0000)
        Supervision timeout: 4000 msec (0x0190)
        Central clock accuracy: 0x00
< HCI Command: LE Read Remote Used... (0x08|0x0016) plen 2  #40 [hci1] 3.704538
        Handle: 2304 Address: DF:A9:FF:F6:B1:1A (OUI DF-A9-FF)
> HCI Event: Command Status (0x0f) plen 4                   #41 [hci1] 3.704958
      LE Read Remote Used Features (0x08|0x0016) ncmd 1
        Status: Success (0x00)
< HCI Command: LE Set PHY (0x08|0x0032) plen 7              #42 [hci1] 3.724346
        Handle: 2304 Address: DF:A9:FF:F6:B1:1A (OUI DF-A9-FF)
        All PHYs preference: 0x00
        TX PHYs preference: 0x02
          LE 2M
        RX PHYs preference: 0x02
          LE 2M
        PHY options preference: Reserved (0x0000)
> HCI Event: Command Status (0x0f) plen 4                   #43 [hci1] 3.724873
      LE Set PHY (0x08|0x0032) ncmd 1
        Status: Success (0x00)
> HCI Event: LE Meta Event (0x3e) plen 12                   #44 [hci1] 3.846531
      LE Read Remote Used Features (0x04)
        Status: Success (0x00)
        Handle: 2304 Address: DF:A9:FF:F6:B1:1A (OUI DF-A9-FF)
        Features: 0x2d 0x49 0x00 0xf7 0x67 0xd9 0x00 0x80
          LE Encryption
          Extended Reject Indication
          Peripheral-initiated Features Exchange
          LE Data Packet Length Extension
          LE 2M PHY
          LE Coded PHY
          Channel Selection Algorithm #2
          Periodic Advertising Sync Transfer - Sender
          Periodic Advertising Sync Transfer - Recipient
          Sleep Clock Accuracy Updates
          Connected Isochronous Stream - Central
          Connected Isochronous Stream - Peripheral
          Isochronous Broadcaster
          Synchronized Receiver
          Connected Isochronous Stream (Host Support)
          LE Power Control Request
          LE Power Control Request
          Connection Subrating
          Connection Subrating (Host Support)
          Unknown features (0x8000d90000000000)
> HCI Event: LE Meta Event (0x3e) plen 6                    #45 [hci1] 4.345936
      LE PHY Update Complete (0x0c)
        Status: Success (0x00)
        Handle: 2304 Address: DF:A9:FF:F6:B1:1A (OUI DF-A9-FF)
        TX PHY: LE 2M (0x02)
        RX PHY: LE 2M (0x02)
< ACL Data TX: Handle 2304 flags 0x00 dlen 11               #46 [hci1] 4.744417
      SMP: Pairing Request (0x01) len 6
        IO capability: NoInputNoOutput (0x03)
        OOB data: Authentication data not present (0x00)
        Authentication requirement: No bonding, No MITM, SC, No Keypresses (0x08)
        Max encryption key size: 16
        Initiator key distribution: <none> (0x00)
        Responder key distribution: <none> (0x00)
> HCI Event: Number of Completed Packets (0x13) plen 5      #47 [hci1] 4.746241
        Num handles: 1
        Handle: 2304 Address: DF:A9:FF:F6:B1:1A (OUI DF-A9-FF)
        Count: 1
        #46: len 11 (88 Kb/s)
        Latency: 1 msec (1-1 msec ~1 msec)
> ACL Data RX: Handle 2304 flags 0x02 dlen 11               #48 [hci1] 4.796485
      SMP: Pairing Response (0x02) len 6
        IO capability: DisplayYesNo (0x01)
        OOB data: Authentication data not present (0x00)
        Authentication requirement: No bonding, No MITM, SC, No Keypresses (0x08)
        Max encryption key size: 16
        Initiator key distribution: <none> (0x00)
        Responder key distribution: <none> (0x00)
< HCI Command: Host Number of Compl.. (0x03|0x0035) plen 5  #49 [hci1] 4.804365
        Num handles: 1
        Handle: 2304 Address: DF:A9:FF:F6:B1:1A (OUI DF-A9-FF)
        Count: 1
< ACL Data TX: Handle 2304 flags 0x00 dlen 27               #50 [hci1] 4.804390
< ACL Data TX: Handle 2304 flags 0x01 dlen 27               #51 [hci1] 4.804391
< ACL Data TX: Handle 2304 flags 0x01 dlen 15               #52 [hci1] 4.804391
      SMP: Pairing Public Key (0x0c) len 64
        X: 98308440221e2d910f0e54b71e7ec652857aa9b5a0dc65028824cc19db1226e9
        Y: 67a4816bcb62efb21701e31fdb27561a6217575fb007a8bbdabe7e28b6f68482
> HCI Event: Number of Completed Packets (0x13) plen 5      #53 [hci1] 4.846316
        Num handles: 1
        Handle: 2304 Address: DF:A9:FF:F6:B1:1A (OUI DF-A9-FF)
        Count: 1
        #50: len 27 (5 Kb/s)
        Latency: 41 msec (1-41 msec ~21 msec)
> HCI Event: Number of Completed Packets (0x13) plen 5      #54 [hci1] 4.846797
        Num handles: 1
        Handle: 2304 Address: DF:A9:FF:F6:B1:1A (OUI DF-A9-FF)
        Count: 1
        #51: len 27 (5 Kb/s)
        Latency: 42 msec (1-42 msec ~32 msec)
> HCI Event: Number of Completed Packets (0x13) plen 5      #55 [hci1] 4.847279
        Num handles: 1
        Handle: 2304 Address: DF:A9:FF:F6:B1:1A (OUI DF-A9-FF)
        Count: 1
        #52: len 15 (2 Kb/s)
        Latency: 42 msec (1-42 msec ~37 msec)
> ACL Data RX: Handle 2304 flags 0x02 dlen 27               #56 [hci1] 4.896554
> ACL Data RX: Handle 2304 flags 0x01 dlen 27               #57 [hci1] 4.896993
> ACL Data RX: Handle 2304 flags 0x01 dlen 15               #58 [hci1] 4.897389
      SMP: Pairing Public Key (0x0c) len 64
        X: 7eca6d1d4fead9d7a6ec53f4e7c6ffd7105e8e50049d34db409fce36951827cc
        Y: 0c0466f8225c5a2bf9b69906eb78b3e5cdecfbb88ec2f1713bf4682a408d5920
< HCI Command: Host Number of Compl.. (0x03|0x0035) plen 5  #59 [hci1] 4.904376
        Num handles: 1
        Handle: 2304 Address: DF:A9:FF:F6:B1:1A (OUI DF-A9-FF)
        Count: 1
< HCI Command: Host Number of Compl.. (0x03|0x0035) plen 5  #60 [hci1] 4.904400
        Num handles: 1
        Handle: 2304 Address: DF:A9:FF:F6:B1:1A (OUI DF-A9-FF)
        Count: 1
< HCI Command: Host Number of Compl.. (0x03|0x0035) plen 5  #61 [hci1] 4.904486
        Num handles: 1
        Handle: 2304 Address: DF:A9:FF:F6:B1:1A (OUI DF-A9-FF)
        Count: 1
> ACL Data RX: Handle 2304 flags 0x02 dlen 21               #62 [hci1] 4.996532
      SMP: Pairing Confirm (0x03) len 16
        Confim value: a4dbdc9902e4ef1877a3e25211f561bd
< HCI Command: Host Number of Compl.. (0x03|0x0035) plen 5  #63 [hci1] 5.004352
        Num handles: 1
        Handle: 2304 Address: DF:A9:FF:F6:B1:1A (OUI DF-A9-FF)
        Count: 1
< ACL Data TX: Handle 2304 flags 0x00 dlen 21               #64 [hci1] 5.004378
      SMP: Pairing Random (0x04) len 16
        Random value: 8e6108f966a694cbe26df70bb96773e6
> HCI Event: Number of Completed Packets (0x13) plen 5      #65 [hci1] 5.046298
        Num handles: 1
        Handle: 2304 Address: DF:A9:FF:F6:B1:1A (OUI DF-A9-FF)
        Count: 1
        #64: len 21 (4 Kb/s)
        Latency: 41 msec (1-42 msec ~39 msec)
> ACL Data RX: Handle 2304 flags 0x02 dlen 21               #66 [hci1] 5.296485
      SMP: Pairing Random (0x04) len 16
        Random value: 86e6b7b8ccb9fe6af2699a59c8d550e9
< HCI Command: Host Number of Compl.. (0x03|0x0035) plen 5  #67 [hci1] 5.304522
        Num handles: 1
        Handle: 2304 Address: DF:A9:FF:F6:B1:1A (OUI DF-A9-FF)
        Count: 1
< ACL Data TX: Handle 2304 flags 0x00 dlen 21               #68 [hci1] 5.304533
      SMP: Pairing DHKey Check (0x0d) len 16
        E: 5cff39b451537703f83140e6660e8531
> HCI Event: Number of Completed Packets (0x13) plen 5      #69 [hci1] 5.346270
        Num handles: 1
        Handle: 2304 Address: DF:A9:FF:F6:B1:1A (OUI DF-A9-FF)
        Count: 1
        #68: len 21 (4 Kb/s)
        Latency: 41 msec (1-42 msec ~40 msec)
> ACL Data RX: Handle 2304 flags 0x02 dlen 21               #70 [hci1] 5.396515
      SMP: Pairing DHKey Check (0x0d) len 16
        E: ae735a8fece9a113505316ce2651f938
< HCI Command: LE Start Encryption (0x08|0x0019) plen 28    #71 [hci1] 5.404449
        Handle: 2304 Address: DF:A9:FF:F6:B1:1A (OUI DF-A9-FF)
        Random number: 0x0000000000000000
        Encrypted diversifier: 0x0000
        Long term key: edad2084f68ba53853c8af27b921c294
> HCI Event: Command Status (0x0f) plen 4                   #72 [hci1] 5.405302
      LE Start Encryption (0x08|0x0019) ncmd 1
        Status: Success (0x00)
< HCI Command: Host Number of Compl.. (0x03|0x0035) plen 5  #73 [hci1] 5.424336
        Num handles: 1
        Handle: 2304 Address: DF:A9:FF:F6:B1:1A (OUI DF-A9-FF)
        Count: 1
> HCI Event: Encryption Change (0x08) plen 4                #74 [hci1] 5.746274
        Status: Success (0x00)
        Handle: 2304 Address: DF:A9:FF:F6:B1:1A (OUI DF-A9-FF)
        Encryption: Enabled with AES-CCM (0x01)
< HCI Command: Disconnect (0x01|0x0006) plen 3              #75 [hci1] 6.754474
        Handle: 2304 Address: DF:A9:FF:F6:B1:1A (OUI DF-A9-FF)
        Reason: Remote User Terminated Connection (0x13)
> HCI Event: Command Status (0x0f) plen 4                   #76 [hci1] 6.754932
      Disconnect (0x01|0x0006) ncmd 1
        Status: Success (0x00)
> HCI Event: Disconnect Complete (0x05) plen 4              #77 [hci1] 6.846188
        Status: Success (0x00)
        Handle: 2304 Address: DF:A9:FF:F6:B1:1A (OUI DF-A9-FF)
        Reason: Connection Terminated By Local Host (0x16)
< HCI Command: LE Extended Create... (0x08|0x0043) plen 26  #78 [hci1] 7.874338
        Filter policy: Accept list is not used (0x00)
        Own address type: Random (0x01)
        Peer address type: Public (0x00)
        Peer address: DF:A9:FF:F6:B1:1A (OUI DF-A9-FF)
        Initiating PHYs: 0x01
        Entry 0: LE 1M
          Scan interval: 60.000 msec (0x0060)
          Scan window: 60.000 msec (0x0060)
          Min connection interval: 30.00 msec (0x0018)
          Max connection interval: 50.00 msec (0x0028)
          Connection latency: 0 (0x0000)
          Supervision timeout: 4000 msec (0x0190)
          Min connection length: 0.000 msec (0x0000)
          Max connection length: 0.000 msec (0x0000)
> HCI Event: Command Status (0x0f) plen 4                   #79 [hci1] 7.878270
      LE Extended Create Connection (0x08|0x0043) ncmd 1
        Status: Success (0x00)
> HCI Event: LE Meta Event (0x3e) plen 31                   #80 [hci1] 7.929435
      LE Enhanced Connection Complete (0x0a)
        Status: Success (0x00)
        Handle: 2322
        Role: Central (0x00)
        Peer address type: Public (0x00)
        Peer address: DF:A9:FF:F6:B1:1A (OUI DF-A9-FF)
        Local resolvable private address: 00:00:00:00:00:00 (Non-Resolvable)
        Peer resolvable private address: 00:00:00:00:00:00 (Non-Resolvable)
        Connection interval: 50.00 msec (0x0028)
        Connection latency: 0 (0x0000)
        Supervision timeout: 4000 msec (0x0190)
        Central clock accuracy: 0x00
< HCI Command: LE Read Remote Used... (0x08|0x0016) plen 2  #81 [hci1] 7.944477
        Handle: 2322 Address: DF:A9:FF:F6:B1:1A (OUI DF-A9-FF)
> HCI Event: Command Status (0x0f) plen 4                   #82 [hci1] 7.944933
      LE Read Remote Used Features (0x08|0x0016) ncmd 1
        Status: Success (0x00)
< HCI Command: LE Set PHY (0x08|0x0032) plen 7              #83 [hci1] 7.964354
        Handle: 2322 Address: DF:A9:FF:F6:B1:1A (OUI DF-A9-FF)
        All PHYs preference: 0x00
        TX PHYs preference: 0x02
          LE 2M
        RX PHYs preference: 0x02
          LE 2M
        PHY options preference: Reserved (0x0000)
> HCI Event: Command Status (0x0f) plen 4                   #84 [hci1] 7.964849
      LE Set PHY (0x08|0x0032) ncmd 1
        Status: Success (0x00)
> HCI Event: LE Meta Event (0x3e) plen 12                   #85 [hci1] 8.080867
      LE Read Remote Used Features (0x04)
        Status: Success (0x00)
        Handle: 2322 Address: DF:A9:FF:F6:B1:1A (OUI DF-A9-FF)
        Features: 0x2d 0x49 0x00 0xf7 0x67 0xd9 0x00 0x80
          LE Encryption
          Extended Reject Indication
          Peripheral-initiated Features Exchange
          LE Data Packet Length Extension
          LE 2M PHY
          LE Coded PHY
          Channel Selection Algorithm #2
          Periodic Advertising Sync Transfer - Sender
          Periodic Advertising Sync Transfer - Recipient
          Sleep Clock Accuracy Updates
          Connected Isochronous Stream - Central
          Connected Isochronous Stream - Peripheral
          Isochronous Broadcaster
          Synchronized Receiver
          Connected Isochronous Stream (Host Support)
          LE Power Control Request
          LE Power Control Request
          Connection Subrating
          Connection Subrating (Host Support)
          Unknown features (0x8000d90000000000)
> HCI Event: LE Meta Event (0x3e) plen 6                    #86 [hci1] 8.580225
      LE PHY Update Complete (0x0c)
        Status: Success (0x00)
        Handle: 2322 Address: DF:A9:FF:F6:B1:1A (OUI DF-A9-FF)
        TX PHY: LE 2M (0x02)
        RX PHY: LE 2M (0x02)
< ACL Data TX: Handle 2322 flags 0x00 dlen 11               #87 [hci1] 9.024449
      SMP: Pairing Request (0x01) len 6
        IO capability: NoInputNoOutput (0x03)
        OOB data: Authentication data not present (0x00)
        Authentication requirement: No bonding, No MITM, SC, No Keypresses (0x08)
        Max encryption key size: 16
        Initiator key distribution: <none> (0x00)
        Responder key distribution: <none> (0x00)
> HCI Event: Number of Completed Packets (0x13) plen 5      #88 [hci1] 9.030624
        Num handles: 1
        Handle: 2322 Address: DF:A9:FF:F6:B1:1A (OUI DF-A9-FF)
        Count: 1
        #87: len 11 (14 Kb/s)
        Latency: 6 msec (6-6 msec ~6 msec)
> ACL Data RX: Handle 2322 flags 0x02 dlen 11               #89 [hci1] 9.080766
      SMP: Pairing Response (0x02) len 6
        IO capability: DisplayYesNo (0x01)
        OOB data: Authentication data not present (0x00)
        Authentication requirement: No bonding, No MITM, SC, No Keypresses (0x08)
        Max encryption key size: 16
        Initiator key distribution: <none> (0x00)
        Responder key distribution: <none> (0x00)
< HCI Command: Host Number of Compl.. (0x03|0x0035) plen 5  #90 [hci1] 9.084485
        Num handles: 1
        Handle: 2322 Address: DF:A9:FF:F6:B1:1A (OUI DF-A9-FF)
        Count: 1
< ACL Data TX: Handle 2322 flags 0x00 dlen 27               #91 [hci1] 9.084508
< ACL Data TX: Handle 2322 flags 0x01 dlen 27               #92 [hci1] 9.084508
< ACL Data TX: Handle 2322 flags 0x01 dlen 15               #93 [hci1] 9.084514
      SMP: Pairing Public Key (0x0c) len 64
        X: 98308440221e2d910f0e54b71e7ec652857aa9b5a0dc65028824cc19db1226e9
        Y: 67a4816bcb62efb21701e31fdb27561a6217575fb007a8bbdabe7e28b6f68482
> HCI Event: Number of Completed Packets (0x13) plen 5      #94 [hci1] 9.130757
        Num handles: 1
        Handle: 2322 Address: DF:A9:FF:F6:B1:1A (OUI DF-A9-FF)
        Count: 1
        #91: len 27 (4 Kb/s)
        Latency: 46 msec (6-46 msec ~26 msec)
> HCI Event: Number of Completed Packets (0x13) plen 5      #95 [hci1] 9.131189
        Num handles: 1
        Handle: 2322 Address: DF:A9:FF:F6:B1:1A (OUI DF-A9-FF)
        Count: 1
        #92: len 27 (4 Kb/s)
        Latency: 46 msec (6-46 msec ~36 msec)
> HCI Event: Number of Completed Packets (0x13) plen 5      #96 [hci1] 9.131669
        Num handles: 1
        Handle: 2322 Address: DF:A9:FF:F6:B1:1A (OUI DF-A9-FF)
        Count: 1
        #93: len 15 (2 Kb/s)
        Latency: 47 msec (6-47 msec ~41 msec)
> ACL Data RX: Handle 2322 flags 0x02 dlen 27               #97 [hci1] 9.180857
> ACL Data RX: Handle 2322 flags 0x01 dlen 27               #98 [hci1] 9.181385
> ACL Data RX: Handle 2322 flags 0x01 dlen 15               #99 [hci1] 9.181760
      SMP: Pairing Public Key (0x0c) len 64
        X: 69971eebf8e75df095b0492cfd2984665684084e33d3e18388792f0427f97cda
        Y: 8fd8a8dd0b8f3fd0cd4a1f9062a5eaa12bbb518472605d4f30ef149b4137f860
< HCI Command: Host Number of Comp.. (0x03|0x0035) plen 5  #100 [hci1] 9.184375
        Num handles: 1
        Handle: 2322 Address: DF:A9:FF:F6:B1:1A (OUI DF-A9-FF)
        Count: 1
< HCI Command: Host Number of Comp.. (0x03|0x0035) plen 5  #101 [hci1] 9.184496
        Num handles: 1
        Handle: 2322 Address: DF:A9:FF:F6:B1:1A (OUI DF-A9-FF)
        Count: 1
< HCI Command: Host Number of Comp.. (0x03|0x0035) plen 5  #102 [hci1] 9.184501
        Num handles: 1
        Handle: 2322 Address: DF:A9:FF:F6:B1:1A (OUI DF-A9-FF)
        Count: 1
> ACL Data RX: Handle 2322 flags 0x02 dlen 21              #103 [hci1] 9.280932
      SMP: Pairing Confirm (0x03) len 16
        Confim value: b760ecd9b85b9e55125ff20b0c3fbe32
< HCI Command: Host Number of Comp.. (0x03|0x0035) plen 5  #104 [hci1] 9.284397
        Num handles: 1
        Handle: 2322 Address: DF:A9:FF:F6:B1:1A (OUI DF-A9-FF)
        Count: 1
< ACL Data TX: Handle 2322 flags 0x00 dlen 21              #105 [hci1] 9.284440
      SMP: Pairing Random (0x04) len 16
        Random value: 5da095555cc64d02679f89a05211af56
> HCI Event: Number of Completed Packets (0x13) plen 5     #106 [hci1] 9.330669
        Num handles: 1
        Handle: 2322 Address: DF:A9:FF:F6:B1:1A (OUI DF-A9-FF)
        Count: 1
        #105: len 21 (3 Kb/s)
        Latency: 46 msec (6-47 msec ~44 msec)
> ACL Data RX: Handle 2322 flags 0x02 dlen 21              #107 [hci1] 9.580851
      SMP: Pairing Random (0x04) len 16
        Random value: 5f8cc56a3f992bac72f71835849cf732
< HCI Command: Host Number of Comp.. (0x03|0x0035) plen 5  #108 [hci1] 9.584579
        Num handles: 1
        Handle: 2322 Address: DF:A9:FF:F6:B1:1A (OUI DF-A9-FF)
        Count: 1
< ACL Data TX: Handle 2322 flags 0x00 dlen 21              #109 [hci1] 9.584601
      SMP: Pairing DHKey Check (0x0d) len 16
        E: 0fc10c7c17cff22eff2812a7d7f467dd
> HCI Event: Number of Completed Packets (0x13) plen 5     #110 [hci1] 9.630709
        Num handles: 1
        Handle: 2322 Address: DF:A9:FF:F6:B1:1A (OUI DF-A9-FF)
        Count: 1
        #109: len 21 (3 Kb/s)
        Latency: 46 msec (6-47 msec ~45 msec)
> ACL Data RX: Handle 2322 flags 0x02 dlen 21              #111 [hci1] 9.680905
      SMP: Pairing DHKey Check (0x0d) len 16
        E: 2231e6ac10d751f258fb41e3162cc7ba
< HCI Command: LE Start Encryption (0x08|0x0019) plen 28   #112 [hci1] 9.684384
        Handle: 2322 Address: DF:A9:FF:F6:B1:1A (OUI DF-A9-FF)
        Random number: 0x0000000000000000
        Encrypted diversifier: 0x0000
        Long term key: 64346679abd69d27a1354a31d6062f38
> HCI Event: Command Status (0x0f) plen 4                  #113 [hci1] 9.685196
      LE Start Encryption (0x08|0x0019) ncmd 1
        Status: Success (0x00)
< HCI Command: Host Number of Comp.. (0x03|0x0035) plen 5  #114 [hci1] 9.704386
        Num handles: 1
        Handle: 2322 Address: DF:A9:FF:F6:B1:1A (OUI DF-A9-FF)
        Count: 1
> HCI Event: Encryption Change (0x08) plen 4              #115 [hci1] 10.030695
        Status: Success (0x00)
        Handle: 2322 Address: DF:A9:FF:F6:B1:1A (OUI DF-A9-FF)
        Encryption: Enabled with AES-CCM (0x01)
< HCI Command: Disconnect (0x01|0x0006) plen 3            #116 [hci1] 10.074364
        Handle: 2322 Address: DF:A9:FF:F6:B1:1A (OUI DF-A9-FF)
        Reason: Remote User Terminated Connection (0x13)
> HCI Event: Command Status (0x0f) plen 4                 #117 [hci1] 10.074836
      Disconnect (0x01|0x0006) ncmd 1
        Status: Success (0x00)
> HCI Event: Disconnect Complete (0x05) plen 4            #118 [hci1] 10.130637
        Status: Success (0x00)
        Handle: 2322 Address: DF:A9:FF:F6:B1:1A (OUI DF-A9-FF)
        Reason: Connection Terminated By Local Host (0x16)
< HCI Command: LE Extended Creat.. (0x08|0x0043) plen 26  #119 [hci1] 11.224442
        Filter policy: Accept list is not used (0x00)
        Own address type: Random (0x01)
        Peer address type: Public (0x00)
        Peer address: DF:A9:FF:F6:B1:1A (OUI DF-A9-FF)
        Initiating PHYs: 0x01
        Entry 0: LE 1M
          Scan interval: 60.000 msec (0x0060)
          Scan window: 60.000 msec (0x0060)
          Min connection interval: 30.00 msec (0x0018)
          Max connection interval: 50.00 msec (0x0028)
          Connection latency: 0 (0x0000)
          Supervision timeout: 4000 msec (0x0190)
          Min connection length: 0.000 msec (0x0000)
          Max connection length: 0.000 msec (0x0000)
> HCI Event: Command Status (0x0f) plen 4                 #120 [hci1] 11.225326
      LE Extended Create Connection (0x08|0x0043) ncmd 1
        Status: Success (0x00)
> HCI Event: LE Meta Event (0x3e) plen 31                 #121 [hci1] 11.292145
      LE Enhanced Connection Complete (0x0a)
        Status: Success (0x00)
        Handle: 2340
        Role: Central (0x00)
        Peer address type: Public (0x00)
        Peer address: DF:A9:FF:F6:B1:1A (OUI DF-A9-FF)
        Local resolvable private address: 00:00:00:00:00:00 (Non-Resolvable)
        Peer resolvable private address: 00:00:00:00:00:00 (Non-Resolvable)
        Connection interval: 50.00 msec (0x0028)
        Connection latency: 0 (0x0000)
        Supervision timeout: 4000 msec (0x0190)
        Central clock accuracy: 0x00
< HCI Command: LE Read Remote Use.. (0x08|0x0016) plen 2  #122 [hci1] 11.304591
        Handle: 2340 Address: DF:A9:FF:F6:B1:1A (OUI DF-A9-FF)
> HCI Event: Command Status (0x0f) plen 4                 #123 [hci1] 11.305024
      LE Read Remote Used Features (0x08|0x0016) ncmd 1
        Status: Success (0x00)
< HCI Command: LE Set PHY (0x08|0x0032) plen 7            #124 [hci1] 11.324406
        Handle: 2340 Address: DF:A9:FF:F6:B1:1A (OUI DF-A9-FF)
        All PHYs preference: 0x00
        TX PHYs preference: 0x02
          LE 2M
        RX PHYs preference: 0x02
          LE 2M
        PHY options preference: Reserved (0x0000)
> HCI Event: Command Status (0x0f) plen 4                 #125 [hci1] 11.324910
      LE Set PHY (0x08|0x0032) ncmd 1
        Status: Success (0x00)
> HCI Event: LE Meta Event (0x3e) plen 12                 #126 [hci1] 11.443640
      LE Read Remote Used Features (0x04)
        Status: Success (0x00)
        Handle: 2340 Address: DF:A9:FF:F6:B1:1A (OUI DF-A9-FF)
        Features: 0x2d 0x49 0x00 0xf7 0x67 0xd9 0x00 0x80
          LE Encryption
          Extended Reject Indication
          Peripheral-initiated Features Exchange
          LE Data Packet Length Extension
          LE 2M PHY
          LE Coded PHY
          Channel Selection Algorithm #2
          Periodic Advertising Sync Transfer - Sender
          Periodic Advertising Sync Transfer - Recipient
          Sleep Clock Accuracy Updates
          Connected Isochronous Stream - Central
          Connected Isochronous Stream - Peripheral
          Isochronous Broadcaster
          Synchronized Receiver
          Connected Isochronous Stream (Host Support)
          LE Power Control Request
          LE Power Control Request
          Connection Subrating
          Connection Subrating (Host Support)
          Unknown features (0x8000d90000000000)
> HCI Event: LE Meta Event (0x3e) plen 6                  #127 [hci1] 11.942919
      LE PHY Update Complete (0x0c)
        Status: Success (0x00)
        Handle: 2340 Address: DF:A9:FF:F6:B1:1A (OUI DF-A9-FF)
        TX PHY: LE 2M (0x02)
        RX PHY: LE 2M (0x02)
< ACL Data TX: Handle 2340 flags 0x00 dlen 11             #128 [hci1] 12.364624
      SMP: Pairing Request (0x01) len 6
        IO capability: NoInputNoOutput (0x03)
        OOB data: Authentication data not present (0x00)
        Authentication requirement: No bonding, No MITM, SC, No Keypresses (0x08)
        Max encryption key size: 16
        Initiator key distribution: <none> (0x00)
        Responder key distribution: <none> (0x00)
> HCI Event: Number of Completed Packets (0x13) plen 5    #129 [hci1] 12.393355
        Num handles: 1
        Handle: 2340 Address: DF:A9:FF:F6:B1:1A (OUI DF-A9-FF)
        Count: 1
        #128: len 11 (3 Kb/s)
        Latency: 28 msec (28-28 msec ~28 msec)
> ACL Data RX: Handle 2340 flags 0x02 dlen 11             #130 [hci1] 12.443440
      SMP: Pairing Response (0x02) len 6
        IO capability: DisplayYesNo (0x01)
        OOB data: Authentication data not present (0x00)
        Authentication requirement: No bonding, No MITM, SC, No Keypresses (0x08)
        Max encryption key size: 16
        Initiator key distribution: <none> (0x00)
        Responder key distribution: <none> (0x00)
< HCI Command: Host Number of Com.. (0x03|0x0035) plen 5  #131 [hci1] 12.444397
        Num handles: 1
        Handle: 2340 Address: DF:A9:FF:F6:B1:1A (OUI DF-A9-FF)
        Count: 1
< ACL Data TX: Handle 2340 flags 0x00 dlen 27             #132 [hci1] 12.444414
< ACL Data TX: Handle 2340 flags 0x01 dlen 27             #133 [hci1] 12.444424
< ACL Data TX: Handle 2340 flags 0x01 dlen 15             #134 [hci1] 12.444429
      SMP: Pairing Public Key (0x0c) len 64
        X: 98308440221e2d910f0e54b71e7ec652857aa9b5a0dc65028824cc19db1226e9
        Y: 67a4816bcb62efb21701e31fdb27561a6217575fb007a8bbdabe7e28b6f68482
> HCI Event: Number of Completed Packets (0x13) plen 5    #135 [hci1] 12.493366
        Num handles: 1
        Handle: 2340 Address: DF:A9:FF:F6:B1:1A (OUI DF-A9-FF)
        Count: 1
        #132: len 27 (4 Kb/s)
        Latency: 48 msec (28-48 msec ~38 msec)
> HCI Event: Number of Completed Packets (0x13) plen 5    #136 [hci1] 12.493869
        Num handles: 1
        Handle: 2340 Address: DF:A9:FF:F6:B1:1A (OUI DF-A9-FF)
        Count: 1
        #133: len 27 (4 Kb/s)
        Latency: 49 msec (28-49 msec ~44 msec)
> HCI Event: Number of Completed Packets (0x13) plen 5    #137 [hci1] 12.494405
        Num handles: 1
        Handle: 2340 Address: DF:A9:FF:F6:B1:1A (OUI DF-A9-FF)
        Count: 1
        #134: len 15 (2 Kb/s)
        Latency: 49 msec (28-49 msec ~47 msec)
> ACL Data RX: Handle 2340 flags 0x02 dlen 27             #138 [hci1] 12.643615
> ACL Data RX: Handle 2340 flags 0x01 dlen 27             #139 [hci1] 12.644107
< HCI Command: Host Number of Com.. (0x03|0x0035) plen 5  #140 [hci1] 12.644423
        Num handles: 1
        Handle: 2340 Address: DF:A9:FF:F6:B1:1A (OUI DF-A9-FF)
        Count: 1
> ACL Data RX: Handle 2340 flags 0x01 dlen 15             #141 [hci1] 12.644529
      SMP: Pairing Public Key (0x0c) len 64
        X: 9673af7204a9a2d74d74d114eadbb59452004de8ea22a7060f549c5b3327508a
        Y: f2de473b90cc1aa992f654cb720ef6c3d3644c0bf0813ab86683e67bb2769f31
< HCI Command: Host Number of Com.. (0x03|0x0035) plen 5  #142 [hci1] 12.664402
        Num handles: 1
        Handle: 2340 Address: DF:A9:FF:F6:B1:1A (OUI DF-A9-FF)
        Count: 1
< HCI Command: Host Number of Com.. (0x03|0x0035) plen 5  #143 [hci1] 12.664410
        Num handles: 1
        Handle: 2340 Address: DF:A9:FF:F6:B1:1A (OUI DF-A9-FF)
        Count: 1
> ACL Data RX: Handle 2340 flags 0x02 dlen 21             #144 [hci1] 12.743583
      SMP: Pairing Confirm (0x03) len 16
        Confim value: 7000f00623c6b517809a9956193ecde2
< HCI Command: Host Number of Com.. (0x03|0x0035) plen 5  #145 [hci1] 12.744433
        Num handles: 1
        Handle: 2340 Address: DF:A9:FF:F6:B1:1A (OUI DF-A9-FF)
        Count: 1
< ACL Data TX: Handle 2340 flags 0x00 dlen 21             #146 [hci1] 12.744442
      SMP: Pairing Random (0x04) len 16
        Random value: da64d21ec8845e8286bc235a02440d0c
> HCI Event: Number of Completed Packets (0x13) plen 5    #147 [hci1] 12.793399
        Num handles: 1
        Handle: 2340 Address: DF:A9:FF:F6:B1:1A (OUI DF-A9-FF)
        Count: 1
        #146: len 21 (3 Kb/s)
        Latency: 48 msec (28-49 msec ~48 msec)
> ACL Data RX: Handle 2340 flags 0x02 dlen 21             #148 [hci1] 12.993560
      SMP: Pairing Random (0x04) len 16
        Random value: 5917e3f955823f537ae7465835f0cebc
< HCI Command: Host Number of Com.. (0x03|0x0035) plen 5  #149 [hci1] 13.004553
        Num handles: 1
        Handle: 2340 Address: DF:A9:FF:F6:B1:1A (OUI DF-A9-FF)
        Count: 1
< ACL Data TX: Handle 2340 flags 0x00 dlen 21             #150 [hci1] 13.004576
      SMP: Pairing DHKey Check (0x0d) len 16
        E: e5e9671b12057420fab6120d60730d9e
> HCI Event: Number of Completed Packets (0x13) plen 5    #151 [hci1] 13.043435
        Num handles: 1
        Handle: 2340 Address: DF:A9:FF:F6:B1:1A (OUI DF-A9-FF)
        Count: 1
        #150: len 21 (4 Kb/s)
        Latency: 38 msec (28-49 msec ~43 msec)
> ACL Data RX: Handle 2340 flags 0x02 dlen 21             #152 [hci1] 13.093603
      SMP: Pairing DHKey Check (0x0d) len 16
        E: df47451a712026d88e7a7bf5afbc4ba9
< HCI Command: LE Start Encryption (0x08|0x0019) plen 28  #153 [hci1] 13.104566
        Handle: 2340 Address: DF:A9:FF:F6:B1:1A (OUI DF-A9-FF)
        Random number: 0x0000000000000000
        Encrypted diversifier: 0x0000
        Long term key: a223ebbfa0e1513c82620d06fab22d2c
> HCI Event: Command Status (0x0f) plen 4                 #154 [hci1] 13.105423
      LE Start Encryption (0x08|0x0019) ncmd 1
        Status: Success (0x00)
< HCI Command: Host Number of Com.. (0x03|0x0035) plen 5  #155 [hci1] 13.124433
        Num handles: 1
        Handle: 2340 Address: DF:A9:FF:F6:B1:1A (OUI DF-A9-FF)
        Count: 1
> HCI Event: Encryption Change (0x08) plen 4              #156 [hci1] 13.443332
        Status: Success (0x00)
        Handle: 2340 Address: DF:A9:FF:F6:B1:1A (OUI DF-A9-FF)
        Encryption: Enabled with AES-CCM (0x01)
< HCI Command: Disconnect (0x01|0x0006) plen 3            #157 [hci1] 14.374472
        Handle: 2340 Address: DF:A9:FF:F6:B1:1A (OUI DF-A9-FF)
        Reason: Remote User Terminated Connection (0x13)
> HCI Event: Command Status (0x0f) plen 4                 #158 [hci1] 14.374863
      Disconnect (0x01|0x0006) ncmd 1
        Status: Success (0x00)
> HCI Event: Disconnect Complete (0x05) plen 4            #159 [hci1] 14.443261
        Status: Success (0x00)
        Handle: 2340 Address: DF:A9:FF:F6:B1:1A (OUI DF-A9-FF)
        Reason: Connection Terminated By Local Host (0x16)
< HCI Command: Reset (0x03|0x0003) plen 0                 #160 [hci1] 23.314625
> HCI Event: Command Complete (0x0e) plen 4               #161 [hci1] 23.315046
      Reset (0x03|0x0003) ncmd 1
        Status: Success (0x00)
@ USER Close: main                                    {0x0001} [hci1] 23.324449
= Close Index: 00:00:00:00:00:00                               [hci1] 23.324463
