Bluetooth monitor ver 5.84
btmon[837846]: = Note: Linux version 6.8.0-83-generic (x86_64)                                                           0.664852
btmon[837846]: = Note: Bluetooth subsystem version 2.22                                                                  0.664854
= New Index: 00:00:00:00:00:00 (Primary,UART,hci0)                                                                       0.664855
= Open Index: 00:00:00:00:00:00                                                                                          0.672368
= Index Info: 00:00:00:00:00:00 (Nordic Semiconductor ASA)                                                               0.672374
zephyr.exe[837848]: @ USER Open: main (privileged) version 2.22                                                 {0x0001} 0.672376
zephyr.exe[837848]: < HCI Command: Reset (0x03|0x0003) plen 0                                                         #1 0.672614
> HCI Event: Command Complete (0x0e) plen 4                                                                           #2 0.673772
      Reset (0x03|0x0003) ncmd 1
        Status: Success (0x00)
zephyr.exe[837848]: < HCI Command: Read Local Supported Features (0x04|0x0003) plen 0                                 #3 0.692277
> HCI Event: Command Complete (0x0e) plen 12                                                                          #4 0.692926
      Read Local Supported Features (0x04|0x0003) ncmd 1
        Status: Success (0x00)
        Features: 0x00 0x00 0x00 0x00 0x60 0x00 0x00 0x00
          BR/EDR Not Supported
          LE Supported (Controller)
zephyr.exe[837848]: < HCI Command: Read Local Version Information (0x04|0x0001) plen 0                                #5 0.712301
> HCI Event: Command Complete (0x0e) plen 12                                                                          #6 0.712892
      Read Local Version Information (0x04|0x0001) ncmd 1
        Status: Success (0x00)
        HCI version: Reserved (0x0e) - Revision 12520 (0x30e8)
        LMP version: Reserved (0x0e) - Subversion 12520 (0x30e8)
        Manufacturer: Nordic Semiconductor ASA (89)
zephyr.exe[837848]: < HCI Command: Read Local Supported Commands (0x04|0x0002) plen 0                                 #7 0.732323
> HCI Event: Command Complete (0x0e) plen 68                                                                          #8 0.733610
      Read Local Supported Commands (0x04|0x0002) ncmd 1
        Status: Success (0x00)
        Commands: 119 entries
          Disconnect (Octet 0 - Bit 5)
          Read Remote Version Information (Octet 2 - Bit 7)
          Set Event Mask (Octet 5 - Bit 6)
          Reset (Octet 5 - Bit 7)
          Read Connection Accept Timeout (Octet 7 - Bit 2)
          Write Connection Accept Timeout (Octet 7 - Bit 3)
          Read Transmit Power Level (Octet 10 - Bit 2)
          Set Controller To Host Flow Control (Octet 10 - Bit 5)
          Host Buffer Size (Octet 10 - Bit 6)
          Host Number of Completed Packets (Octet 10 - Bit 7)
          Read Local Version Information (Octet 14 - Bit 3)
          Read Local Supported Features (Octet 14 - Bit 5)
          Read BD ADDR (Octet 15 - Bit 1)
          Read RSSI (Octet 15 - Bit 5)
          Set Event Mask Page 2 (Octet 22 - Bit 2)
          LE Set Event Mask (Octet 25 - Bit 0)
          LE Read Buffer Size (Octet 25 - Bit 1)
          LE Read Local Supported Features (Octet 25 - Bit 2)
          LE Set Random Address (Octet 25 - Bit 4)
          LE Set Advertising Parameters (Octet 25 - Bit 5)
          LE Read Advertising Channel TX Power (Octet 25 - Bit 6)
          LE Set Advertising Data (Octet 25 - Bit 7)
          LE Set Scan Response Data (Octet 26 - Bit 0)
          LE Set Advertise Enable (Octet 26 - Bit 1)
          LE Set Scan Parameters (Octet 26 - Bit 2)
          LE Set Scan Enable (Octet 26 - Bit 3)
          LE Create Connection (Octet 26 - Bit 4)
          LE Create Connection Cancel (Octet 26 - Bit 5)
          LE Read Accept List Size (Octet 26 - Bit 6)
          LE Clear Accept List (Octet 26 - Bit 7)
          LE Add Device To Accept List (Octet 27 - Bit 0)
          LE Remove Device From Accept List (Octet 27 - Bit 1)
          LE Connection Update (Octet 27 - Bit 2)
          LE Set Host Channel Classification (Octet 27 - Bit 3)
          LE Read Channel Map (Octet 27 - Bit 4)
          LE Read Remote Used Features (Octet 27 - Bit 5)
          LE Encrypt (Octet 27 - Bit 6)
          LE Rand (Octet 27 - Bit 7)
          LE Start Encryption (Octet 28 - Bit 0)
          LE Long Term Key Request Reply (Octet 28 - Bit 1)
          LE Long Term Key Request Neg Reply (Octet 28 - Bit 2)
          LE Read Supported States (Octet 28 - Bit 3)
          LE Receiver Test (Octet 28 - Bit 4)
          LE Transmitter Test (Octet 28 - Bit 5)
          LE Test End (Octet 28 - Bit 6)
          Read Authenticated Payload Timeout (Octet 32 - Bit 4)
          Write Authenticated Payload Timeout (Octet 32 - Bit 5)
          LE Set Data Length (Octet 33 - Bit 6)
          LE Read Suggested Default Data Length (Octet 33 - Bit 7)
          LE Write Suggested Default Data Length (Octet 34 - Bit 0)
          LE Add Device To Resolving List (Octet 34 - Bit 3)
          LE Remove Device From Resolving List (Octet 34 - Bit 4)
          LE Clear Resolving List (Octet 34 - Bit 5)
          LE Read Resolving List Size (Octet 34 - Bit 6)
          LE Set Address Resolution Enable (Octet 35 - Bit 1)
          LE Set Resolvable Private Address Timeout (Octet 35 - Bit 2)
          LE Read Maximum Data Length (Octet 35 - Bit 3)
          LE Read PHY (Octet 35 - Bit 4)
          LE Set Default PHY (Octet 35 - Bit 5)
          LE Set PHY (Octet 35 - Bit 6)
          LE Enhanced Receiver Test (Octet 35 - Bit 7)
          LE Enhanced Transmitter Test (Octet 36 - Bit 0)
          LE Set Advertising Set Random Address (Octet 36 - Bit 1)
          LE Set Extended Advertising Parameters (Octet 36 - Bit 2)
          LE Set Extended Advertising Data (Octet 36 - Bit 3)
          LE Set Extended Scan Response Data (Octet 36 - Bit 4)
          LE Set Extended Advertising Enable (Octet 36 - Bit 5)
          LE Read Maximum Advertising Data Length (Octet 36 - Bit 6)
          LE Read Number of Supported Advertising Sets (Octet 36 - Bit 7)
          LE Remove Advertising Set (Octet 37 - Bit 0)
          LE Clear Advertising Sets (Octet 37 - Bit 1)
          LE Set Periodic Advertising Parameters (Octet 37 - Bit 2)
          LE Set Periodic Advertising Data (Octet 37 - Bit 3)
          LE Set Periodic Advertising Enable (Octet 37 - Bit 4)
          LE Set Extended Scan Parameters (Octet 37 - Bit 5)
          LE Set Extended Scan Enable (Octet 37 - Bit 6)
          LE Extended Create Connection (Octet 37 - Bit 7)
          LE Periodic Advertising Create Sync (Octet 38 - Bit 0)
          LE Periodic Advertising Create Sync Cancel (Octet 38 - Bit 1)
          LE Periodic Advertising Terminate Sync (Octet 38 - Bit 2)
          LE Add Device To Periodic Advertiser List (Octet 38 - Bit 3)
          LE Remove Device From Periodic Advertiser List (Octet 38 - Bit 4)
          LE Clear Periodic Advertiser List (Octet 38 - Bit 5)
          LE Read Periodic Advertiser List Size (Octet 38 - Bit 6)
          LE Read Transmit Power (Octet 38 - Bit 7)
          LE Read RF Path Compensation (Octet 39 - Bit 0)
          LE Write RF Path Compensation (Octet 39 - Bit 1)
          LE Set Privacy Mode (Octet 39 - Bit 2)
          LE Periodic Advertising Receive Enable (Octet 40 - Bit 5)
          LE Periodic Advertising Sync Transfer (Octet 40 - Bit 6)
          LE Periodic Advertising Set Info Transfer (Octet 40 - Bit 7)
          LE Periodic Advertising Sync Transfer Parameters (Octet 41 - Bit 0)
          LE Set Default Periodic Advertisng Sync Transfer Parameters (Octet 41 - Bit 1)
          LE Read Buffer v2 (Octet 41 - Bit 5)
          LE Read ISO TX Sync (Octet 41 - Bit 6)
          LE Set Connected Isochronous Group Parameters (Octet 41 - Bit 7)
          LE Set Connected Isochronous Group Parameters Test (Octet 42 - Bit 0)
          LE Create Connected Isochronous Stream (Octet 42 - Bit 1)
          LE Remove Connected Isochronous Group (Octet 42 - Bit 2)
          LE Accept Connected Isochronous Stream Request (Octet 42 - Bit 3)
          LE Reject Connected Isochronous Stream Request (Octet 42 - Bit 4)
          LE Create Broadcast Isochronous Group (Octet 42 - Bit 5)
          LE Create Broadcast Isochronous Group Test (Octet 42 - Bit 6)
          LE Terminate Broadcast Isochronous Group (Octet 42 - Bit 7)
          LE Broadcast Isochronous Group Create Sync (Octet 43 - Bit 0)
          LE Broadcast Isochronous Group Terminate Sync (Octet 43 - Bit 1)
          LE Request Peer SCA (Octet 43 - Bit 2)
          LE Setup Isochronous Data Path (Octet 43 - Bit 3)
          LE Remove Isochronous Data Path (Octet 43 - Bit 4)
          LE Isochronous Transmit Test (Octet 43 - Bit 5)
          LE Isochronous Receive Test (Octet 43 - Bit 6)
          LE Isochronous Read Test Counters (Octet 43 - Bit 7)
          LE Isochronous Read Test Counters (Octet 44 - Bit 0)
          LE Set Host Feature (Octet 44 - Bit 1)
          LE Read ISO link quality (Octet 44 - Bit 2)
          Octet 45 - Bit 6 
          Octet 46 - Bit 0 
          Octet 46 - Bit 1 
          Octet 46 - Bit 2 
zephyr.exe[837848]: < HCI Command: Host Buffer Size (0x03|0x0033) plen 7                                              #9 0.752305
        ACL MTU: 255  ACL max packet: 16
        SCO MTU: 0    SCO max packet: 0
> HCI Event: Command Complete (0x0e) plen 4                                                                          #10 0.753281
      Host Buffer Size (0x03|0x0033) ncmd 1
        Status: Success (0x00)
zephyr.exe[837848]: < HCI Command: Set Controller To Host Flow Control (0x03|0x0031) plen 1                          #11 0.772299
        Flow control: ACL Data Packets (0x01)
> HCI Event: Command Complete (0x0e) plen 4                                                                          #12 0.773038
      Set Controller To Host Flow Control (0x03|0x0031) ncmd 1
        Status: Success (0x00)
zephyr.exe[837848]: < HCI Command: LE Read Local Supported Features (0x08|0x0003) plen 0                             #13 0.792299
> HCI Event: Command Complete (0x0e) plen 12                                                                         #14 0.792993
      LE Read Local Supported Features (0x08|0x0003) ncmd 1
        Status: Success (0x00)
        Features: 0xfd 0x79 0x00 0xf7 0x30 0x01 0x00 0x00
          LE Encryption
          Extended Reject Indication
          Peripheral-initiated Features Exchange
          LE Ping
          LE Data Packet Length Extension
          LL Privacy
          Extended Scanner Filter Policies
          LE 2M PHY
          LE Coded PHY
          LE Extended Advertising
          LE Periodic Advertising
          Channel Selection Algorithm #2
          Periodic Advertising Sync Transfer - Sender
          Periodic Advertising Sync Transfer - Recipient
          Sleep Clock Accuracy Updates
          Connected Isochronous Stream - Central
          Connected Isochronous Stream - Peripheral
          Isochronous Broadcaster
          Synchronized Receiver
          Periodic Advertising ADI support
          Connection Subrating
          Unknown features (0x0000010000000000)
zephyr.exe[837848]: < HCI Command: LE Set Host Feature (0x08|0x0074) plen 2                                          #15 0.812301
        Bit Number: 32
          Connected Isochronous Stream (Host Support)
        Bit Value: 1
> HCI Event: Command Complete (0x0e) plen 4                                                                          #16 0.813217
      LE Set Host Feature (0x08|0x0074) ncmd 1
        Status: Success (0x00)
zephyr.exe[837848]: < HCI Command: LE Read Buffer v2 (0x08|0x0060) plen 0                                            #17 0.832305
> HCI Event: Command Complete (0x0e) plen 10                                                                         #18 0.832846
      LE Read Buffer v2 (0x08|0x0060) ncmd 1
        Status: Success (0x00)
        ACL MTU: 27
        ACL max packet: 3
        ISO MTU: 318
        ISO max packet: 3
zephyr.exe[837848]: < HCI Command: LE Read Maximum Advertising Data Length (0x08|0x003a) plen 0                      #19 0.852303
> HCI Event: Command Complete (0x0e) plen 6                                                                          #20 0.853006
      LE Read Maximum Advertising Data Length (0x08|0x003a) ncmd 1
        Status: Success (0x00)
        Max length: 1650
zephyr.exe[837848]: < HCI Command: LE Read Supported States (0x08|0x001c) plen 0                                     #21 0.872309
> HCI Event: Command Complete (0x0e) plen 12                                                                         #22 0.873138
      LE Read Supported States (0x08|0x001c) ncmd 1
        Status: Success (0x00)
        States: 0x000003ff3e0306ff
          Non-connectable Advertising State
          Scannable Advertising State
          Connectable Advertising State
          High Duty Cycle Directed Advertising State
          Passive Scanning State
          Active Scanning State
          Initiating State
            and Connection State (Central Role)
          Connection State (Peripheral Role)
          Scannable Advertising State
            and Passive Scanning State
          Connectable Advertising State
            and Passive Scanning State
          Non-connectable Advertising State
            and Initiating State
          Scannable Advertising State
            and Initiating State
          Active Scanning State
            and Connection State (Central Role)
          Passive Scanning State
            and Connection State (Peripheral Role)
          Active Scanning State
            and Connection State (Peripheral Role)
          Initiating State
            and Connection State (Central Role)
            and Central Role & Central Role
          Low Duty Cycle Directed Advertising State
          Connectable Advertising State
            and Initiating State
            and Central Role & Peripheral Role
          High Duty Cycle Directed Advertising State
            and Initiating State
            and Central Role & Peripheral Role
          Low Duty Cycle Directed Advertising State
            and Initiating State
            and Central Role & Peripheral Role
          Connectable Advertising State
            and Connection State (Central Role)
            and Central Role & Peripheral Role
          High Duty Cycle Directed Advertising State
            and Connection State (Central Role)
            and Central Role & Peripheral Role
          Low Duty Cycle Directed Advertising State
            and Connection State (Central Role)
            and Central Role & Peripheral Role
          Connectable Advertising State
            and Connection State (Peripheral Role)
            and Central Role & Peripheral Role
          High Duty Cycle Directed Advertising State
            and Connection State (Peripheral Role)
            and Peripheral Role & Peripheral Role
          Low Duty Cycle Directed Advertising State
            and Connection State (Peripheral Role)
            and Peripheral Role & Peripheral Role
          Initiating State
            and Connection State (Peripheral Role)
            and Central Role & Peripheral Role
zephyr.exe[837848]: < HCI Command: LE Read Maximum Data Length (0x08|0x002f) plen 0                                  #23 0.892295
> HCI Event: Command Complete (0x0e) plen 12                                                                         #24 0.893360
      LE Read Maximum Data Length (0x08|0x002f) ncmd 1
        Status: Success (0x00)
        Max TX octets: 251
        Max TX time: 2704
        Max RX octets: 251
        Max RX time: 2704
zephyr.exe[837848]: < HCI Command: LE Write Suggested Default Data Length (0x08|0x0024) plen 4                       #25 0.912302
        TX octets: 251
        TX time: 2704
> HCI Event: Command Complete (0x0e) plen 4                                                                          #26 0.912983
      LE Write Suggested Default Data Length (0x08|0x0024) ncmd 1
        Status: Success (0x00)
zephyr.exe[837848]: < HCI Command: LE Read Resolving List Size (0x08|0x002a) plen 0                                  #27 0.932325
> HCI Event: Command Complete (0x0e) plen 5                                                                          #28 0.933341
      LE Read Resolving List Size (0x08|0x002a) ncmd 1
        Status: Success (0x00)
        Size: 8
zephyr.exe[837848]: < HCI Command: LE Set Event Mask (0x08|0x0001) plen 8                                            #29 0.952288
        Mask: 0x000002023f87fa5e
          LE Advertising Report
          LE Connection Update Complete
          LE Read Remote Used Features Complete
          LE Long Term Key Request
          LE Data Length Change
          LE Enhanced Connection Complete
          LE PHY Update Complete
          LE Extended Advertising Report
          LE Periodic Advertising Sync Established
          LE Periodic Advertising Report
          LE Periodic Advertising Sync Lost
          LE Extended Scan Timeout
          LE Extended Advertising Set Terminated
          LE Scan Request Received
          LE Periodic Advertising Sync Transfer Rvc
          LE CIS Established
          LE CIS Request
          LE Create BIG Complete
          LE Terminate BIG Complete
          LE BIG Sync Established Complete
          LE BIG Sync Lost
          LE BIG Info Advertising Report
          Unknown mask (0x0000020000000000)
> HCI Event: Command Complete (0x0e) plen 4                                                                          #30 0.952970
      LE Set Event Mask (0x08|0x0001) ncmd 1
        Status: Success (0x00)
zephyr.exe[837848]: < HCI Command: Set Event Mask (0x03|0x0001) plen 8                                               #31 0.972299
        Mask: 0x2000800002008890
          Disconnection Complete
          Encryption Change
          Read Remote Version Information Complete
          Hardware Error
          Data Buffer Overflow
          Encryption Key Refresh Complete
          LE Meta
> HCI Event: Command Complete (0x0e) plen 4                                                                          #32 0.973268
      Set Event Mask (0x03|0x0001) ncmd 1
        Status: Success (0x00)
zephyr.exe[837848]: < HCI Command: Read BD ADDR (0x04|0x0009) plen 0                                                 #33 0.992306
> HCI Event: Command Complete (0x0e) plen 10                                                                         #34 0.992988
      Read BD ADDR (0x04|0x0009) ncmd 1
        Status: Success (0x00)
        Address: 00:00:00:00:00:00 (OUI 00-00-00)
zephyr.exe[837848]: < HCI Command: LE Set Random Address (0x08|0x0005) plen 6                                        #35 1.012327
        Address: D5:B6:CC:31:DB:3B (Static)
> HCI Event: Command Complete (0x0e) plen 4                                                                          #36 1.013006
      LE Set Random Address (0x08|0x0005) ncmd 1
        Status: Success (0x00)
zephyr.exe[837848]: < HCI Command: LE Set Extended Advertising Parameters (0x08|0x0036) plen 25                      #37 1.592365
        Handle: 0x00
        Properties: 0x0001
          Connectable
        Min advertising interval: 100.000 msec (0x00a0)
        Max advertising interval: 150.000 msec (0x00f0)
        Channel map: 37, 38, 39 (0x07)
        Own address type: Random (0x01)
        Peer address type: Public (0x00)
        Peer address: 00:00:00:00:00:00 (OUI 00-00-00)
        Filter policy: Allow Scan Request from Any, Allow Connect Request from Any (0x00)
        TX power: Host has no preference (0x7f)
        Primary PHY: LE 1M (0x01)
        Secondary max skip: 0x00
        Secondary PHY: LE 2M (0x02)
        SID: 0x00
        Scan request notifications: Disabled (0x00)
> HCI Event: Command Complete (0x0e) plen 5                                                                          #38 1.593627
      LE Set Extended Advertising Parameters (0x08|0x0036) ncmd 1
        Status: Success (0x00)
        TX power (selected): 0 dbm (0x00)
zephyr.exe[837848]: < HCI Command: LE Set Advertising Set Random Address (0x08|0x0035) plen 7                        #39 1.612295
        Advertising handle: 0x00
        Advertising random address: D5:B6:CC:31:DB:3B (Static)
> HCI Event: Command Complete (0x0e) plen 4                                                                          #40 1.612808
      LE Set Advertising Set Random Address (0x08|0x0035) ncmd 1
        Status: Success (0x00)
zephyr.exe[837848]: < HCI Command: LE Set Extended Advertising Data (0x08|0x0037) plen 39                            #41 1.632296
        Handle: 0x00
        Operation: Complete extended advertising data (0x03)
        Fragment preference: Minimize fragmentation (0x01)
        Data length: 0x23
        Flags: 0x06
          LE General Discoverable Mode
          BR/EDR Not Supported
        Name (complete): Tester_F6B11A
        Flags: 0x06
          LE General Discoverable Mode
          BR/EDR Not Supported
        16-bit Service UUIDs (complete): 1 entry
          Audio Stream Control (0x184e)
        Service Data: Audio Stream Control (0x184e)
          Data[6]: 01ff0fff0f00
> HCI Event: Command Complete (0x0e) plen 4                                                                          #42 1.633527
      LE Set Extended Advertising Data (0x08|0x0037) ncmd 1
        Status: Success (0x00)
zephyr.exe[837848]: < HCI Command: LE Set Extended Advertising Enable (0x08|0x0039) plen 6                           #43 1.652366
        Extended advertising: Enabled (0x01)
        Number of sets: 1 (0x01)
        Entry 0
          Handle: 0x00
          Duration: 0 ms (0x00)
          Max ext adv events: 0
> HCI Event: Command Complete (0x0e) plen 4                                                                          #44 1.652997
      LE Set Extended Advertising Enable (0x08|0x0039) ncmd 1
        Status: Success (0x00)
> HCI Event: LE Meta Event (0x3e) plen 31                                                                            #45 3.237661
      LE Enhanced Connection Complete (0x0a)
        Status: Success (0x00)
        Handle: 75
        Role: Peripheral (0x01)
        Peer address type: Public (0x00)
        Peer address: DF:A9:FF:F6:B1:1A (OUI DF-A9-FF)
        Local resolvable private address: 00:00:00:00:00:00 (Non-Resolvable)
        Peer resolvable private address: 00:00:00:00:00:00 (Non-Resolvable)
        Connection interval: 60.00 msec (0x0030)
        Connection latency: 0 (0x0000)
        Supervision timeout: 25120 msec (0x09d0)
        Central clock accuracy: 0x01
> HCI Event: LE Meta Event (0x3e) plen 6                                                                             #46 3.237776
      LE Advertising Set Terminated (0x12)
        Status: Success (0x00)
        Handle: 0
        Connection handle: 75
        Number of completed extended advertising events: 0
zephyr.exe[837848]: < HCI Command: LE Read Remote Used Features (0x08|0x0016) plen 2                                 #47 3.252403
        Handle: 75 Address: DF:A9:FF:F6:B1:1A (OUI DF-A9-FF)
> HCI Event: Command Status (0x0f) plen 4                                                                            #48 3.253051
      LE Read Remote Used Features (0x08|0x0016) ncmd 1
        Status: Success (0x00)
zephyr.exe[837848]: < ACL Data TX: Handle 75 [1/3] flags 0x00 dlen 7                                                 #49 3.272303
      ATT: Exchange MTU Request (0x02) len 2
        Client RX MTU: 251
> HCI Event: Number of Completed Packets (0x13) plen 5                                                               #50 3.359939
        Num handles: 1
        Handle: 75 Address: DF:A9:FF:F6:B1:1A (OUI DF-A9-FF)
        Count: 1
        Buffers: 0/3
        #49: len 7 (0 Kb/s)
        Latency: 87 msec (87-87 msec ~87 msec)
> HCI Event: LE Meta Event (0x3e) plen 12                                                                            #51 3.420185
      LE Read Remote Used Features (0x04)
        Status: Success (0x00)
        Handle: 75 Address: DF:A9:FF:F6:B1:1A (OUI DF-A9-FF)
        Features: 0x2d 0x49 0x00 0xf7 0x67 0xd8 0x00 0x00
          LE Encryption
          Extended Reject Indication
          Peripheral-initiated Features Exchange
          LE Data Packet Length Extension
          LE 2M PHY
          LE Coded PHY
          Channel Selection Algorithm #2
          Periodic Advertising Sync Transfer - Sender
          Periodic Advertising Sync Transfer - Recipient
          Sleep Clock Accuracy Updates
          Connected Isochronous Stream - Central
          Connected Isochronous Stream - Peripheral
          Isochronous Broadcaster
          Synchronized Receiver
          Connected Isochronous Stream (Host Support)
          LE Power Control Request
          LE Power Control Request
          Connection Subrating
          Connection Subrating (Host Support)
          Unknown features (0x0000d80000000000)
> ACL Data RX: Handle 75 flags 0x02 dlen 7                                                                           #52 3.719927
      ATT: Exchange MTU Request (0x02) len 2
        Client RX MTU: 64
> ACL Data RX: Handle 75 flags 0x02 dlen 7                                                                           #53 3.720301
      ATT: Exchange MTU Response (0x03) len 2
        Server RX MTU: 64
zephyr.exe[837848]: < HCI Command: Host Number of Completed Packets (0x03|0x0035) plen 5                             #54 3.732395
        Num handles: 1
        Handle: 75 Address: DF:A9:FF:F6:B1:1A (OUI DF-A9-FF)
        Count: 1
zephyr.exe[837848]: < ACL Data TX: Handle 75 [1/3] flags 0x00 dlen 7                                                 #55 3.732400
      ATT: Exchange MTU Response (0x03) len 2
        Server RX MTU: 251
zephyr.exe[837848]: < HCI Command: Host Number of Completed Packets (0x03|0x0035) plen 5                             #56 3.732485
        Num handles: 1
        Handle: 75 Address: DF:A9:FF:F6:B1:1A (OUI DF-A9-FF)
        Count: 1
zephyr.exe[837848]: < HCI Command: LE Remove Advertising Set (0x08|0x003c) plen 1                                    #57 3.782338
        Handle: 0
> HCI Event: Command Complete (0x0e) plen 4                                                                          #58 3.782927
      LE Remove Advertising Set (0x08|0x003c) ncmd 1
        Status: Success (0x00)
zephyr.exe[837848]: < HCI Command: LE Set Extended Advertising Parameters (0x08|0x0036) plen 25                      #59 3.792253
        Handle: 0x00
        Properties: 0x0001
          Connectable
        Min advertising interval: 100.000 msec (0x00a0)
        Max advertising interval: 150.000 msec (0x00f0)
        Channel map: 37, 38, 39 (0x07)
        Own address type: Random (0x01)
        Peer address type: Public (0x00)
        Peer address: 00:00:00:00:00:00 (OUI 00-00-00)
        Filter policy: Allow Scan Request from Any, Allow Connect Request from Any (0x00)
        TX power: Host has no preference (0x7f)
        Primary PHY: LE 1M (0x01)
        Secondary max skip: 0x00
        Secondary PHY: LE 2M (0x02)
        SID: 0x01
        Scan request notifications: Disabled (0x00)
> HCI Event: Command Complete (0x0e) plen 5                                                                          #60 3.793254
      LE Set Extended Advertising Parameters (0x08|0x0036) ncmd 1
        Status: Success (0x00)
        TX power (selected): 0 dbm (0x00)
zephyr.exe[837848]: < HCI Command: LE Set Advertising Set Random Address (0x08|0x0035) plen 7                        #61 3.812330
        Advertising handle: 0x00
        Advertising random address: D5:B6:CC:31:DB:3B (Static)
> HCI Event: Command Complete (0x0e) plen 4                                                                          #62 3.812980
      LE Set Advertising Set Random Address (0x08|0x0035) ncmd 1
        Status: Success (0x00)
zephyr.exe[837848]: < HCI Command: LE Set Extended Advertising Data (0x08|0x0037) plen 39                            #63 3.832301
        Handle: 0x00
        Operation: Complete extended advertising data (0x03)
        Fragment preference: Minimize fragmentation (0x01)
        Data length: 0x23
        Flags: 0x06
          LE General Discoverable Mode
          BR/EDR Not Supported
        Name (complete): Tester_F6B11A
        Flags: 0x06
          LE General Discoverable Mode
          BR/EDR Not Supported
        16-bit Service UUIDs (complete): 1 entry
          Audio Stream Control (0x184e)
        Service Data: Audio Stream Control (0x184e)
          Data[6]: 01ff0fff0f00
> HCI Event: Command Complete (0x0e) plen 4                                                                          #64 3.833566
      LE Set Extended Advertising Data (0x08|0x0037) ncmd 1
        Status: Success (0x00)
> HCI Event: Number of Completed Packets (0x13) plen 5                                                               #65 3.839909
        Num handles: 1
        Handle: 75 Address: DF:A9:FF:F6:B1:1A (OUI DF-A9-FF)
        Count: 1
        Buffers: 0/3
        #55: len 7 (0 Kb/s)
        Latency: 107 msec (87-107 msec ~97 msec)
zephyr.exe[837848]: < HCI Command: LE Set Extended Advertising Enable (0x08|0x0039) plen 6                           #66 3.852302
        Extended advertising: Enabled (0x01)
        Number of sets: 1 (0x01)
        Entry 0
          Handle: 0x00
          Duration: 0 ms (0x00)
          Max ext adv events: 0
> HCI Event: Command Complete (0x0e) plen 4                                                                          #67 3.853035
      LE Set Extended Advertising Enable (0x08|0x0039) ncmd 1
        Status: Success (0x00)
> ACL Data RX: Handle 75 flags 0x02 dlen 11                                                                          #68 5.819750
      SMP: Pairing Request (0x01) len 6
        IO capability: KeyboardDisplay (0x04)
        OOB data: Authentication data not present (0x00)
        Authentication requirement: Bonding, No MITM, SC, No Keypresses (0x09)
        Max encryption key size: 16
        Initiator key distribution: EncKey IdKey (0x03)
        Responder key distribution: EncKey IdKey Sign (0x07)
zephyr.exe[837848]: < HCI Command: Host Number of Completed Packets (0x03|0x0035) plen 5                             #69 5.832412
        Num handles: 1
        Handle: 75 Address: DF:A9:FF:F6:B1:1A (OUI DF-A9-FF)
        Count: 1
zephyr.exe[837848]: < ACL Data TX: Handle 75 [1/3] flags 0x00 dlen 11                                                #70 5.832463
      SMP: Pairing Response (0x02) len 6
        IO capability: NoInputNoOutput (0x03)
        OOB data: Authentication data not present (0x00)
        Authentication requirement: Bonding, No MITM, SC, No Keypresses (0x09)
        Max encryption key size: 16
        Initiator key distribution: IdKey (0x02)
        Responder key distribution: Sign (0x04)
> HCI Event: Number of Completed Packets (0x13) plen 5                                                               #71 5.939804
        Num handles: 1
        Handle: 75 Address: DF:A9:FF:F6:B1:1A (OUI DF-A9-FF)
        Count: 1
        Buffers: 0/3
        #70: len 11 (0 Kb/s)
        Latency: 107 msec (87-107 msec ~102 msec)
> ACL Data RX: Handle 75 flags 0x02 dlen 27                                                                          #72 5.940193
> ACL Data RX: Handle 75 flags 0x01 dlen 27                                                                          #73 5.940455
> ACL Data RX: Handle 75 flags 0x01 dlen 15                                                                          #74 5.940743
      SMP: Pairing Public Key (0x0c) len 64
        X[32]: 10255a21148af377ca44ce80f0a441156322052d806b0986ab2883c4bdab4ccd
        Y[32]: 3192292eec41e62b461d521629a6bfe0c7d717a15c880cd27a17ef5ecfa6a4ec
zephyr.exe[837848]: < HCI Command: Host Number of Completed Packets (0x03|0x0035) plen 5                             #75 5.952345
        Num handles: 1
        Handle: 75 Address: DF:A9:FF:F6:B1:1A (OUI DF-A9-FF)
        Count: 1
zephyr.exe[837848]: < HCI Command: Host Number of Completed Packets (0x03|0x0035) plen 5                             #76 5.952350
        Num handles: 1
        Handle: 75 Address: DF:A9:FF:F6:B1:1A (OUI DF-A9-FF)
        Count: 1
zephyr.exe[837848]: < HCI Command: Host Number of Completed Packets (0x03|0x0035) plen 5                             #77 5.952419
        Num handles: 1
        Handle: 75 Address: DF:A9:FF:F6:B1:1A (OUI DF-A9-FF)
        Count: 1
zephyr.exe[837848]: < ACL Data TX: Handle 75 [1/3] flags 0x00 dlen 27                                                #78 5.952423
zephyr.exe[837848]: < ACL Data TX: Handle 75 flags 0x01 dlen 27                                                      #79 5.952424
zephyr.exe[837848]: < ACL Data TX: Handle 75 flags 0x01 dlen 15                                                      #80 5.952424
      SMP: Pairing Public Key (0x0c) len 64
        X[32]: 98308440221e2d910f0e54b71e7ec652857aa9b5a0dc65028824cc19db1226e9
        Y[32]: 67a4816bcb62efb21701e31fdb27561a6217575fb007a8bbdabe7e28b6f68482
> HCI Event: Number of Completed Packets (0x13) plen 5                                                               #81 5.999974
        Num handles: 1
        Handle: 75 Address: DF:A9:FF:F6:B1:1A (OUI DF-A9-FF)
        Count: 1
        Buffers: 0/3
        #78: len 27 (4 Kb/s)
        Latency: 47 msec (47-107 msec ~75 msec)
> HCI Event: Number of Completed Packets (0x13) plen 5                                                               #82 6.000504
        Num handles: 1
        Handle: 75 Address: DF:A9:FF:F6:B1:1A (OUI DF-A9-FF)
        Count: 1
        Buffers: underflow/3
        #79: len 27 (4 Kb/s)
        Latency: 48 msec (47-107 msec ~61 msec)
zephyr.exe[837848]: < ACL Data TX: Handle 75 [1/3] flags 0x00 dlen 21                                                #83 6.012389
      SMP: Pairing Confirm (0x03) len 16
        Confirm value[16]: 396640cf43bf696bb19d70103e9655d9
> HCI Event: Number of Completed Packets (0x13) plen 5                                                               #84 6.059789
        Num handles: 1
        Handle: 75 Address: DF:A9:FF:F6:B1:1A (OUI DF-A9-FF)
        Count: 1
        Buffers: 0/3
        #80: len 15 (1 Kb/s)
        Latency: 107 msec (47-107 msec ~84 msec)
> HCI Event: Number of Completed Packets (0x13) plen 5                                                               #85 6.119851
        Num handles: 1
        Handle: 75 Address: DF:A9:FF:F6:B1:1A (OUI DF-A9-FF)
        Count: 1
        Buffers: underflow/3
        #83: len 21 (1 Kb/s)
        Latency: 107 msec (47-107 msec ~95 msec)
> ACL Data RX: Handle 75 flags 0x02 dlen 21                                                                          #86 6.120013
      SMP: Pairing Random (0x04) len 16
        Random value[16]: 3d9555e202045fde0000000000000000
zephyr.exe[837848]: < HCI Command: Host Number of Completed Packets (0x03|0x0035) plen 5                             #87 6.132313
        Num handles: 1
        Handle: 75 Address: DF:A9:FF:F6:B1:1A (OUI DF-A9-FF)
        Count: 1
zephyr.exe[837848]: < ACL Data TX: Handle 75 [1/3] flags 0x00 dlen 21                                                #88 6.132341
      SMP: Pairing Random (0x04) len 16
        Random value[16]: 8e6108f966a694cbe26df70bb96773e6
> HCI Event: Number of Completed Packets (0x13) plen 5                                                               #89 6.239752
        Num handles: 1
        Handle: 75 Address: DF:A9:FF:F6:B1:1A (OUI DF-A9-FF)
        Count: 1
        Buffers: 0/3
        #88: len 21 (1 Kb/s)
        Latency: 107 msec (47-107 msec ~101 msec)
> ACL Data RX: Handle 75 flags 0x02 dlen 21                                                                          #90 6.420350
      SMP: Pairing DHKey Check (0x0d) len 16
        E[16]: ded90a4eec7fbc943f80f3538be7c383
zephyr.exe[837848]: < HCI Command: Host Number of Completed Packets (0x03|0x0035) plen 5                             #91 6.432513
        Num handles: 1
        Handle: 75 Address: DF:A9:FF:F6:B1:1A (OUI DF-A9-FF)
        Count: 1
zephyr.exe[837848]: < ACL Data TX: Handle 75 [1/3] flags 0x00 dlen 21                                                #92 6.432573
      SMP: Pairing DHKey Check (0x0d) len 16
        E[16]: 95676c9751ff475a382da20bbda4ed7f
> HCI Event: Number of Completed Packets (0x13) plen 5                                                               #93 6.540282
        Num handles: 1
        Handle: 75 Address: DF:A9:FF:F6:B1:1A (OUI DF-A9-FF)
        Count: 1
        Buffers: 0/3
        #92: len 21 (1 Kb/s)
        Latency: 107 msec (47-107 msec ~104 msec)
> HCI Event: LE Meta Event (0x3e) plen 13                                                                            #94 6.600009
      LE Long Term Key Request (0x05)
        Handle: 75 Address: DF:A9:FF:F6:B1:1A (OUI DF-A9-FF)
        Random number: 0x0000000000000000
        Encrypted diversifier: 0x0000
zephyr.exe[837848]: < HCI Command: LE Long Term Key Request Reply (0x08|0x001a) plen 18                              #95 6.612332
        Handle: 75 Address: DF:A9:FF:F6:B1:1A (OUI DF-A9-FF)
        Long term key[16]: 73878381433accfb20bc752a7bd60281
> HCI Event: Command Complete (0x0e) plen 6                                                                          #96 6.613360
      LE Long Term Key Request Reply (0x08|0x001a) ncmd 1
        Status: Success (0x00)
        Handle: 75 Address: DF:A9:FF:F6:B1:1A (OUI DF-A9-FF)
> HCI Event: Encryption Change (0x08) plen 4                                                                         #97 6.899927
        Status: Success (0x00)
        Handle: 75 Address: DF:A9:FF:F6:B1:1A (OUI DF-A9-FF)
        Encryption: Enabled with AES-CCM (0x01)
zephyr.exe[837848]: < ACL Data TX: Handle 75 [1/3] flags 0x00 dlen 21                                                #98 7.022390
      SMP: Signing Information (0x0a) len 16
        Signature key[16]: 5da095555cc64d02679f89a05211af56
> HCI Event: Number of Completed Packets (0x13) plen 5                                                               #99 7.139820
        Num handles: 1
        Handle: 75 Address: DF:A9:FF:F6:B1:1A (OUI DF-A9-FF)
        Count: 1
        Buffers: 0/3
        #98: len 21 (1 Kb/s)
        Latency: 117 msec (47-117 msec ~111 msec)
> ACL Data RX: Handle 75 flags 0x02 dlen 21                                                                         #100 7.139944
      SMP: Identity Information (0x08) len 16
        Identity resolving key[16]: 0ab4e6344bf3653fd498f268286f3589
> ACL Data RX: Handle 75 flags 0x02 dlen 12                                                                         #101 7.140197
      SMP: Identity Address Information (0x09) len 7
        Address: DF:A9:FF:F6:B1:1A (OUI DF-A9-FF)
zephyr.exe[837848]: < HCI Command: Host Number of Completed Packets (0x03|0x0035) plen 5                            #102 7.152484
        Num handles: 1
        Handle: 75 Address: DF:A9:FF:F6:B1:1A (OUI DF-A9-FF)
        Count: 1
zephyr.exe[837848]: < HCI Command: LE Set Extended Advertising Enable (0x08|0x0039) plen 6                          #103 7.152613
        Extended advertising: Disabled (0x00)
        Number of sets: 1 (0x01)
        Entry 0
          Handle: 0x00
          Duration: 0 ms (0x00)
          Max ext adv events: 0
> HCI Event: Command Complete (0x0e) plen 4                                                                         #104 7.153569
      LE Set Extended Advertising Enable (0x08|0x0039) ncmd 1
        Status: Success (0x00)
zephyr.exe[837848]: < HCI Command: LE Add Device To Resolving List (0x08|0x0027) plen 39                            #105 7.172400
        Address type: Public (0x00)
        Address: DF:A9:FF:F6:B1:1A (OUI DF-A9-FF)
        Peer identity resolving key[16]: 0ab4e6344bf3653fd498f268286f3589
        Local identity resolving key[16]: 00000000000000000000000000000000
> HCI Event: Command Complete (0x0e) plen 4                                                                         #106 7.173310
      LE Add Device To Resolving List (0x08|0x0027) ncmd 1
        Status: Success (0x00)
zephyr.exe[837848]: < HCI Command: LE Set Privacy Mode (0x08|0x004e) plen 8                                         #107 7.192433
        Peer Identity address type: Public (0x00)
        Peer Identity address: DF:A9:FF:F6:B1:1A (OUI DF-A9-FF)
        Privacy Mode: Use Device Privacy (0x01)
> HCI Event: Command Complete (0x0e) plen 4                                                                         #108 7.193091
      LE Set Privacy Mode (0x08|0x004e) ncmd 1
        Status: Success (0x00)
zephyr.exe[837848]: < HCI Command: LE Set Address Resolution Enable (0x08|0x002d) plen 1                            #109 7.212424
        Address resolution: Enabled (0x01)
> HCI Event: Command Complete (0x0e) plen 4                                                                         #110 7.213218
      LE Set Address Resolution Enable (0x08|0x002d) ncmd 1
        Status: Success (0x00)
zephyr.exe[837848]: < HCI Command: LE Set Extended Advertising Enable (0x08|0x0039) plen 6                          #111 7.232439
        Extended advertising: Enabled (0x01)
        Number of sets: 1 (0x01)
        Entry 0
          Handle: 0x00
          Duration: 0 ms (0x00)
          Max ext adv events: 0
> HCI Event: Command Complete (0x0e) plen 4                                                                         #112 7.233176
      LE Set Extended Advertising Enable (0x08|0x0039) ncmd 1
        Status: Success (0x00)
zephyr.exe[837848]: < HCI Command: Host Number of Completed Packets (0x03|0x0035) plen 5                            #113 7.252398
        Num handles: 1
        Handle: 75 Address: DF:A9:FF:F6:B1:1A (OUI DF-A9-FF)
        Count: 1
> ACL Data RX: Handle 75 flags 0x02 dlen 13                                                                         #114 7.319827
      ATT: Find By Type Value Request (0x06) len 8
        Handle range: 0x0001-0xffff
        Attribute type: Primary Service (0x2800)
          UUID: Broadcast Audio Scan (0x184f)
zephyr.exe[837848]: < HCI Command: Host Number of Completed Packets (0x03|0x0035) plen 5                            #115 7.332418
        Num handles: 1
        Handle: 75 Address: DF:A9:FF:F6:B1:1A (OUI DF-A9-FF)
        Count: 1
zephyr.exe[837848]: < ACL Data TX: Handle 75 [1/3] flags 0x00 dlen 9                                                #116 7.332427
      ATT: Find By Type Value Response (0x07) len 4
        Handle range: 0x0047-0x004c
> HCI Event: Number of Completed Packets (0x13) plen 5                                                              #117 7.439842
        Num handles: 1
        Handle: 75 Address: DF:A9:FF:F6:B1:1A (OUI DF-A9-FF)
        Count: 1
        Buffers: 0/3
        #116: len 9 (0 Kb/s)
        Latency: 107 msec (47-117 msec ~109 msec)
> ACL Data RX: Handle 75 flags 0x02 dlen 13                                                                         #118 7.439844
      ATT: Find By Type Value Request (0x06) len 8
        Handle range: 0x004d-0xffff
        Attribute type: Primary Service (0x2800)
          UUID: Broadcast Audio Scan (0x184f)
zephyr.exe[837848]: < HCI Command: Host Number of Completed Packets (0x03|0x0035) plen 5                            #119 7.452473
        Num handles: 1
        Handle: 75 Address: DF:A9:FF:F6:B1:1A (OUI DF-A9-FF)
        Count: 1
zephyr.exe[837848]: < ACL Data TX: Handle 75 [1/3] flags 0x00 dlen 9                                                #120 7.452499
      ATT: Error Response (0x01) len 4
        Find By Type Value Request (0x06)
        Handle: 0x004d
        Error: Attribute Not Found (0x0a)
> HCI Event: Number of Completed Packets (0x13) plen 5                                                              #121 7.619625
        Num handles: 1
        Handle: 75 Address: DF:A9:FF:F6:B1:1A (OUI DF-A9-FF)
        Count: 1
        Buffers: 0/3
        #120: len 9 (0 Kb/s)
        Latency: 167 msec (47-167 msec ~138 msec)
> ACL Data RX: Handle 75 flags 0x02 dlen 11                                                                         #122 7.619930
      ATT: Read By Type Request (0x08) len 6
        Handle range: 0x0047-0x004c
        Attribute type: Characteristic (0x2803)
zephyr.exe[837848]: < HCI Command: Host Number of Completed Packets (0x03|0x0035) plen 5                            #123 7.632421
        Num handles: 1
        Handle: 75 Address: DF:A9:FF:F6:B1:1A (OUI DF-A9-FF)
        Count: 1
zephyr.exe[837848]: < ACL Data TX: Handle 75 [1/3] flags 0x00 dlen 20                                               #124 7.632427
      ATT: Read By Type Response (0x09) len 15
        Attribute data length: 7
        Attribute data list: 2 entries
        Handle: 0x0048
        Value[5]: 0c4900c72b
            Properties: 0x0c
              Write Without Response (0x04)
              Write (0x08)
            Value Handle: 0x0049
            Value UUID: Broadcast Audio Scan Control Point (0x2bc7)
        Handle: 0x004a
        Value[5]: 124b00c82b
            Properties: 0x12
              Read (0x02)
              Notify (0x10)
            Value Handle: 0x004b
            Value UUID: Broadcast Receive State (0x2bc8)
> HCI Event: Number of Completed Packets (0x13) plen 5                                                              #125 7.739694
        Num handles: 1
        Handle: 75 Address: DF:A9:FF:F6:B1:1A (OUI DF-A9-FF)
        Count: 1
        Buffers: 0/3
        #124: len 20 (1 Kb/s)
        Latency: 107 msec (47-167 msec ~122 msec)
> ACL Data RX: Handle 75 flags 0x02 dlen 11                                                                         #126 7.740383
      ATT: Read By Type Request (0x08) len 6
        Handle range: 0x004b-0x004c
        Attribute type: Characteristic (0x2803)
zephyr.exe[837848]: < HCI Command: Host Number of Completed Packets (0x03|0x0035) plen 5                            #127 7.752332
        Num handles: 1
        Handle: 75 Address: DF:A9:FF:F6:B1:1A (OUI DF-A9-FF)
        Count: 1
zephyr.exe[837848]: < ACL Data TX: Handle 75 [1/3] flags 0x00 dlen 9                                                #128 7.752347
      ATT: Error Response (0x01) len 4
        Read By Type Request (0x08)
        Handle: 0x004b
        Error: Attribute Not Found (0x0a)
> HCI Event: Number of Completed Packets (0x13) plen 5                                                              #129 7.859862
        Num handles: 1
        Handle: 75 Address: DF:A9:FF:F6:B1:1A (OUI DF-A9-FF)
        Count: 1
        Buffers: 0/3
        #128: len 9 (0 Kb/s)
        Latency: 107 msec (47-167 msec ~115 msec)
> ACL Data RX: Handle 75 flags 0x02 dlen 9                                                                          #130 7.859864
      ATT: Find Information Request (0x04) len 4
        Handle range: 0x004c-0x004c
zephyr.exe[837848]: < HCI Command: Host Number of Completed Packets (0x03|0x0035) plen 5                            #131 7.872418
        Num handles: 1
        Handle: 75 Address: DF:A9:FF:F6:B1:1A (OUI DF-A9-FF)
        Count: 1
zephyr.exe[837848]: < ACL Data TX: Handle 75 [1/3] flags 0x00 dlen 10                                               #132 7.872423
      ATT: Find Information Response (0x05) len 5
        Format: UUID-16 (0x01)
        Handle: 0x004c
        UUID: Client Characteristic Configuration (0x2902)
> HCI Event: Number of Completed Packets (0x13) plen 5                                                              #133 7.979766
        Num handles: 1
        Handle: 75 Address: DF:A9:FF:F6:B1:1A (OUI DF-A9-FF)
        Count: 1
        Buffers: 0/3
        #132: len 10 (0 Kb/s)
        Latency: 107 msec (47-167 msec ~111 msec)
> ACL Data RX: Handle 75 flags 0x02 dlen 9                                                                          #134 7.980011
      ATT: Write Request (0x12) len 4
        Handle: 0x004c
          Data[2]: 0000
zephyr.exe[837848]: < HCI Command: Host Number of Completed Packets (0x03|0x0035) plen 5                            #135 7.992347
        Num handles: 1
        Handle: 75 Address: DF:A9:FF:F6:B1:1A (OUI DF-A9-FF)
        Count: 1
zephyr.exe[837848]: < ACL Data TX: Handle 75 [1/3] flags 0x00 dlen 5                                                #136 7.992379
      ATT: Write Response (0x13) len 0
> HCI Event: Number of Completed Packets (0x13) plen 5                                                              #137 8.099882
        Num handles: 1
        Handle: 75 Address: DF:A9:FF:F6:B1:1A (OUI DF-A9-FF)
        Count: 1
        Buffers: 0/3
        #136: len 5 (0 Kb/s)
        Latency: 107 msec (47-167 msec ~109 msec)
> ACL Data RX: Handle 75 flags 0x02 dlen 9                                                                          #138 8.099884
      ATT: Write Request (0x12) len 4
        Handle: 0x004c
          Data[2]: 0100
zephyr.exe[837848]: < HCI Command: Host Number of Completed Packets (0x03|0x0035) plen 5                            #139 8.112375
        Num handles: 1
        Handle: 75 Address: DF:A9:FF:F6:B1:1A (OUI DF-A9-FF)
        Count: 1
zephyr.exe[837848]: < ACL Data TX: Handle 75 [1/3] flags 0x00 dlen 5                                                #140 8.112407
      ATT: Write Response (0x13) len 0
> HCI Event: Number of Completed Packets (0x13) plen 5                                                              #141 8.220083
        Num handles: 1
        Handle: 75 Address: DF:A9:FF:F6:B1:1A (OUI DF-A9-FF)
        Count: 1
        Buffers: 0/3
        #140: len 5 (0 Kb/s)
        Latency: 107 msec (47-167 msec ~108 msec)
zephyr.exe[837848]: < HCI Command: LE Set Random Address (0x08|0x0005) plen 6                                       #142 8.882359
        Address: 04:C8:1E:D2:64:DA (Non-Resolvable)
> HCI Event: Command Complete (0x0e) plen 4                                                                         #143 8.883027
      LE Set Random Address (0x08|0x0005) ncmd 1
        Status: Success (0x00)
zephyr.exe[837848]: < HCI Command: LE Set Extended Scan Parameters (0x08|0x0041) plen 8                             #144 8.892342
        Own address type: Random (0x01)
        Filter policy: Accept all advertisement (0x00)
        PHYs: 0x01
        Entry 0: LE 1M
          Type: Active (0x01)
          Interval: 60.000 msec (0x0060)
          Window: 30.000 msec (0x0030)
> HCI Event: Command Complete (0x0e) plen 4                                                                         #145 8.892953
      LE Set Extended Scan Parameters (0x08|0x0041) ncmd 1
        Status: Success (0x00)
zephyr.exe[837848]: < HCI Command: LE Set Extended Scan Enable (0x08|0x0042) plen 6                                 #146 8.912338
        Extended scan: Enabled (0x01)
        Filter duplicates: Enabled (0x01)
        Duration: 0 msec (0x0000)
        Period: 0.00 sec (0x0000)
> HCI Event: Command Complete (0x0e) plen 4                                                                         #147 8.913340
      LE Set Extended Scan Enable (0x08|0x0042) ncmd 1
        Status: Success (0x00)
> HCI Event: LE Meta Event (0x3e) plen 50                                                                           #148 9.046044
      LE Extended Advertising Report (0x0d)
        Num reports: 1
        Entry 0
          Event type: 0x0013
            Props: 0x0013
              Connectable
              Scannable
              Use legacy advertising PDUs
            Data status: [0;32mComplete[0m
          Legacy PDU Type: ADV_IND (0x0013)
          Address type: Public (0x00)
          Address: 7C:49:EB:2C:13:D2 (XIAOMI Electronics,CO.,LTD)
          Primary PHY: LE 1M
          Secondary PHY: No packets
          SID: no ADI field (0xff)
          TX power: 127 dBm
          RSSI: -95 dBm (0xa1)
          Periodic advertising interval: 0.00 msec (0x0000)
          Direct address type: Reserved (0xff)
          Direct address: 00-00-00-00-00-00
          Data length: 0x18
        02 01 06 14 16 95 fe 71 20 13 01 42 d2 13 2c eb  .......q ..B..,.
        49 7c 09 05 10 02 00 16                          I|......        
        Flags: 0x06
          LE General Discoverable Mode
          BR/EDR Not Supported
        Service Data: Xiaomi Inc. (0xfe95)
          Data[17]: 7120130142d2132ceb497c090510020016
> HCI Event: LE Meta Event (0x3e) plen 54                                                                           #149 9.047017
      LE Extended Advertising Report (0x0d)
        Num reports: 1
        Entry 0
          Event type: 0x001b
            Props: 0x001b
              Connectable
              Scannable
              Scan response
              Use legacy advertising PDUs
            Data status: [0;32mComplete[0m
          Legacy PDU Type: SCAN_RSP to an ADV_SCAN_IND (0x001b)
          Address type: Public (0x00)
          Address: 7C:49:EB:2C:13:D2 (XIAOMI Electronics,CO.,LTD)
          Primary PHY: LE 1M
          Secondary PHY: No packets
          SID: no ADI field (0xff)
          TX power: 127 dBm
          RSSI: -94 dBm (0xa2)
          Periodic advertising interval: 0.00 msec (0x0000)
          Direct address type: Reserved (0xff)
          Direct address: 00-00-00-00-00-00
          Data length: 0x1c
        0b 03 01 aa 02 aa 03 aa 0a 18 e8 fe 05 12 06 00  ................
        80 0c 09 09 4d 69 4b 65 74 74 6c 65              ....MiKettle    
        16-bit Service UUIDs (complete): 5 entries
          Unknown (0xaa01)
          Unknown (0xaa02)
          Unknown (0xaa03)
          Device Information (0x180a)
          Quintic Corp. (0xfee8)
        Peripheral Conn. Interval: 0x0006 - 0x0c80
        Name (complete): MiKettle
> HCI Event: LE Meta Event (0x3e) plen 55                                                                           #150 9.059326
      LE Extended Advertising Report (0x0d)
        Num reports: 1
        Entry 0
          Event type: 0x0013
            Props: 0x0013
              Connectable
              Scannable
              Use legacy advertising PDUs
            Data status: [0;32mComplete[0m
          Legacy PDU Type: ADV_IND (0x0013)
          Address type: Random (0x01)
          Address: 13:56:92:99:94:AA (Non-Resolvable)
          Primary PHY: LE 1M
          Secondary PHY: No packets
          SID: no ADI field (0xff)
          TX power: 127 dBm
          RSSI: -94 dBm (0xa2)
          Periodic advertising interval: 0.00 msec (0x0000)
          Direct address type: Reserved (0xff)
          Direct address: 00-00-00-00-00-00
          Data length: 0x1d
        02 01 02 19 16 f1 fc 04 95 c6 35 3f 4b 6d 87 f1  ..........5?Km..
        ff c9 e6 78 6a 0d 63 83 18 38 5c 74 9b           ...xj.c..8\t.   
        Flags: 0x02
          LE General Discoverable Mode
        Service Data: Unknown (0xfcf1)
          Data[22]: 0495c6353f4b6d87f1ffc9e6786a0d638318385c749b
> HCI Event: LE Meta Event (0x3e) plen 54                                                                           #151 9.162882
      LE Extended Advertising Report (0x0d)
        Num reports: 1
        Entry 0
          Event type: 0x0010
            Props: 0x0010
              Use legacy advertising PDUs
            Data status: [0;32mComplete[0m
          Legacy PDU Type: ADV_NONCONN_IND (0x0010)
          Address type: Public (0x00)
          Address: A4:30:7A:95:74:FB (Samsung Electronics Co.,Ltd)
          Primary PHY: LE 1M
          Secondary PHY: No packets
          SID: no ADI field (0xff)
          TX power: 127 dBm
          RSSI: -89 dBm (0xa7)
          Periodic advertising interval: 0.00 msec (0x0000)
          Direct address type: Reserved (0xff)
          Direct address: 00-00-00-00-00-00
          Data length: 0x1c
        1b ff 75 00 42 04 01 80 6e a4 30 7a 95 74 fb a6  ..u.B...n.0z.t..
        30 7a 95 74 fa 01 d8 41 c5 d9 00 00              0z.t...A....    
        Company: Samsung Electronics Co. Ltd. (117)
          Data[24]: 420401806ea4307a9574fba6307a9574fa01d841c5d90000
> HCI Event: LE Meta Event (0x3e) plen 54                                                                           #152 9.286880
      LE Extended Advertising Report (0x0d)
        Num reports: 1
        Entry 0
          Event type: 0x0010
            Props: 0x0010
              Use legacy advertising PDUs
            Data status: [0;32mComplete[0m
          Legacy PDU Type: ADV_NONCONN_IND (0x0010)
          Address type: Public (0x00)
          Address: A4:30:7A:95:74:FB (Samsung Electronics Co.,Ltd)
          Primary PHY: LE 1M
          Secondary PHY: No packets
          SID: no ADI field (0xff)
          TX power: 127 dBm
          RSSI: -84 dBm (0xac)
          Periodic advertising interval: 0.00 msec (0x0000)
          Direct address type: Reserved (0xff)
          Direct address: 00-00-00-00-00-00
          Data length: 0x1c
        1b ff 75 00 42 04 01 80 6e a4 30 7a 95 74 fb a6  ..u.B...n.0z.t..
        30 7a 95 74 fa 01 d8 41 c5 d9 00 00              0z.t...A....    
        Company: Samsung Electronics Co. Ltd. (117)
          Data[24]: 420401806ea4307a9574fba6307a9574fa01d841c5d90000
> HCI Event: LE Meta Event (0x3e) plen 48                                                                           #153 9.532073
      LE Extended Advertising Report (0x0d)
        Num reports: 1
        Entry 0
          Event type: 0x0000
            Props: 0x0000
            Data status: [0;32mComplete[0m
          Address type: Public (0x00)
          Address: DF:A9:FF:F6:B1:1A (OUI DF-A9-FF)
          Primary PHY: LE 1M
          Secondary PHY: LE 1M
          SID: 0x01
          TX power: 127 dBm
          RSSI: -17 dBm (0xef)
          Periodic advertising interval: 120.00 msec (0x0060)
          Direct address type: Reserved (0xff)
          Direct address: 00-00-00-00-00-00
          Data length: 0x16
        06 16 52 18 30 5b 00 0e 09 50 54 53 2d 42 41 53  ..R.0[...PTS-BAS
        53 2d 42 31 31 41                                S-B11A          
        Service Data: Broadcast Audio Announcement (0x1852)
        Broadcast ID: 23344 (0x005b30)
        Name (complete): PTS-BASS-B11A
> HCI Event: LE Meta Event (0x3e) plen 38                                                                           #154 9.535494
      LE Extended Advertising Report (0x0d)
        Num reports: 1
        Entry 0
          Event type: 0x0012
            Props: 0x0012
              Scannable
              Use legacy advertising PDUs
            Data status: [0;32mComplete[0m
          Legacy PDU Type: ADV_SCAN_IND (0x0012)
          Address type: Random (0x01)
          Address: 6C:75:24:62:C8:22 (Resolvable)
          Primary PHY: LE 1M
          Secondary PHY: No packets
          SID: no ADI field (0xff)
          TX power: 127 dBm
          RSSI: -83 dBm (0xad)
          Periodic advertising interval: 0.00 msec (0x0000)
          Direct address type: Reserved (0xff)
          Direct address: 00-00-00-00-00-00
          Data length: 0x0c
        0b ff 4c 00 09 06 03 00 0a 03 0a 1e              ..L.........    
        Company: Apple, Inc. (76)
          Type: Apple TV (9)
          Data[6]: 03000a030a1e
> HCI Event: LE Meta Event (0x3e) plen 26                                                                           #155 9.536226
      LE Extended Advertising Report (0x0d)
        Num reports: 1
        Entry 0
          Event type: 0x001a
            Props: 0x001a
              Scannable
              Scan response
              Use legacy advertising PDUs
            Data status: [0;32mComplete[0m
          Legacy PDU Type: SCAN_RSP to an ADV_IND (0x001a)
          Address type: Random (0x01)
          Address: 6C:75:24:62:C8:22 (Resolvable)
          Primary PHY: LE 1M
          Secondary PHY: No packets
          SID: no ADI field (0xff)
          TX power: 127 dBm
          RSSI: -82 dBm (0xae)
          Periodic advertising interval: 0.00 msec (0x0000)
          Direct address type: Reserved (0xff)
          Direct address: 00-00-00-00-00-00
          Data length: 0x00
> HCI Event: LE Meta Event (0x3e) plen 26                                                                           #156 9.640808
      LE Extended Advertising Report (0x0d)
        Num reports: 1
        Entry 0
          Event type: 0x0010
            Props: 0x0010
              Use legacy advertising PDUs
            Data status: [0;32mComplete[0m
          Legacy PDU Type: ADV_NONCONN_IND (0x0010)
          Address type: Public (0x00)
          Address: 90:CD:B6:41:AD:52 (Hon Hai Precision Ind. Co.,Ltd.)
          Primary PHY: LE 1M
          Secondary PHY: No packets
          SID: no ADI field (0xff)
          TX power: 127 dBm
          RSSI: -88 dBm (0xa8)
          Periodic advertising interval: 0.00 msec (0x0000)
          Direct address type: Reserved (0xff)
          Direct address: 00-00-00-00-00-00
          Data length: 0x00
> HCI Event: LE Meta Event (0x3e) plen 57                                                                           #157 9.955059
      LE Extended Advertising Report (0x0d)
        Num reports: 1
        Entry 0
          Event type: 0x0010
            Props: 0x0010
              Use legacy advertising PDUs
            Data status: [0;32mComplete[0m
          Legacy PDU Type: ADV_NONCONN_IND (0x0010)
          Address type: Random (0x01)
          Address: 08:A7:72:07:2C:2F (Non-Resolvable)
          Primary PHY: LE 1M
          Secondary PHY: No packets
          SID: no ADI field (0xff)
          TX power: 127 dBm
          RSSI: -91 dBm (0xa5)
          Periodic advertising interval: 0.00 msec (0x0000)
          Direct address type: Reserved (0xff)
          Direct address: 00-00-00-00-00-00
          Data length: 0x1f
        1e ff 06 00 01 09 20 22 e7 a8 e4 37 33 6b 95 43  ...... "...73k.C
        db 2e 4a 60 4c 6f 24 95 2d a3 2b d4 5f d6 57     ..J`Lo$.-.+._.W 
        Company: Microsoft (6)
          Data[27]: 01092022e7a8e437336b9543db2e4a604c6f24952da32bd45fd657
zephyr.exe[837848]: < HCI Command: LE Set Extended Scan Enable (0x08|0x0042) plen 6                                 #158 9.982317
        Extended scan: Disabled (0x00)
        Filter duplicates: Disabled (0x00)
        Duration: 0 msec (0x0000)
        Period: 0.00 sec (0x0000)
> HCI Event: Command Complete (0x0e) plen 4                                                                         #159 9.983267
      LE Set Extended Scan Enable (0x08|0x0042) ncmd 1
        Status: Success (0x00)
zephyr.exe[837848]: < HCI Command: LE Periodic Advertising Create Sync (0x08|0x0044) plen 14                       #160 10.012349
        Options: 0x0000
        Use advertising SID, Advertiser Address Type and address
        Reporting initially enabled
        SID: 0x01
        Adv address type: Public (0x00)
        Adv address: DF:A9:FF:F6:B1:1A (OUI DF-A9-FF)
        Skip: 0x0005
        Sync timeout: 10000 msec (0x03e8)
        Sync CTE type: 0x0000
> HCI Event: Command Status (0x0f) plen 4                                                                          #161 10.013873
      LE Periodic Advertising Create Sync (0x08|0x0044) ncmd 1
        Status: Success (0x00)
zephyr.exe[837848]: < HCI Command: LE Set Random Address (0x08|0x0005) plen 6                                      #162 10.032377
        Address: 1A:23:BC:86:82:5E (Non-Resolvable)
> HCI Event: Command Complete (0x0e) plen 4                                                                        #163 10.033579
      LE Set Random Address (0x08|0x0005) ncmd 1
        Status: Success (0x00)
zephyr.exe[837848]: < HCI Command: LE Set Extended Scan Parameters (0x08|0x0041) plen 13                           #164 10.052349
        Own address type: Random (0x01)
        Filter policy: Accept all advertisement (0x00)
        PHYs: 0x05
        Entry 0: LE 1M
          Type: Passive (0x00)
          Interval: 60.000 msec (0x0060)
          Window: 30.000 msec (0x0030)
        Entry 1: LE Coded
          Type: Passive (0x00)
          Interval: 60.000 msec (0x0060)
          Window: 30.000 msec (0x0030)
> HCI Event: Command Complete (0x0e) plen 4                                                                        #165 10.053349
      LE Set Extended Scan Parameters (0x08|0x0041) ncmd 1
        Status: Success (0x00)
zephyr.exe[837848]: < HCI Command: LE Set Extended Scan Enable (0x08|0x0042) plen 6                                #166 10.072316
        Extended scan: Enabled (0x01)
        Filter duplicates: Enabled (0x01)
        Duration: 0 msec (0x0000)
        Period: 0.00 sec (0x0000)
> HCI Event: Command Complete (0x0e) plen 4                                                                        #167 10.072907
      LE Set Extended Scan Enable (0x08|0x0042) ncmd 1
        Status: Success (0x00)
> HCI Event: LE Meta Event (0x3e) plen 33                                                                          #168 10.201000
      LE Extended Advertising Report (0x0d)
        Num reports: 1
        Entry 0
          Event type: 0x0001
            Props: 0x0001
              Connectable
            Data status: [0;32mComplete[0m
          Address type: Random (0x01)
          Address: F7:78:15:2E:E6:88 (Static)
          Primary PHY: LE 1M
          Secondary PHY: LE 1M
          SID: 0x00
          TX power: 127 dBm
          RSSI: -85 dBm (0xab)
          Periodic advertising interval: 0.00 msec (0x0000)
          Direct address type: Reserved (0xff)
          Direct address: 00-00-00-00-00-00
          Data length: 0x07
        06 08 48 41 4c 53 43                             ..HALSC         
        Name (short): HALSC
> HCI Event: LE Meta Event (0x3e) plen 48                                                                          #169 10.350886
      LE Extended Advertising Report (0x0d)
        Num reports: 1
        Entry 0
          Event type: 0x0000
            Props: 0x0000
            Data status: [0;32mComplete[0m
          Address type: Public (0x00)
          Address: DF:A9:FF:F6:B1:1A (OUI DF-A9-FF)
          Primary PHY: LE 1M
          Secondary PHY: LE 1M
          SID: 0x01
          TX power: 127 dBm
          RSSI: -16 dBm (0xf0)
          Periodic advertising interval: 120.00 msec (0x0060)
          Direct address type: Reserved (0xff)
          Direct address: 00-00-00-00-00-00
          Data length: 0x16
        06 16 52 18 30 5b 00 0e 09 50 54 53 2d 42 41 53  ..R.0[...PTS-BAS
        53 2d 42 31 31 41                                S-B11A          
        Service Data: Broadcast Audio Announcement (0x1852)
        Broadcast ID: 23344 (0x005b30)
        Name (complete): PTS-BASS-B11A
> HCI Event: LE Meta Event (0x3e) plen 54                                                                          #170 10.407252
      LE Extended Advertising Report (0x0d)
        Num reports: 1
        Entry 0
          Event type: 0x0010
            Props: 0x0010
              Use legacy advertising PDUs
            Data status: [0;32mComplete[0m
          Legacy PDU Type: ADV_NONCONN_IND (0x0010)
          Address type: Public (0x00)
          Address: A4:30:7A:95:74:FB (Samsung Electronics Co.,Ltd)
          Primary PHY: LE 1M
          Secondary PHY: No packets
          SID: no ADI field (0xff)
          TX power: 127 dBm
          RSSI: -89 dBm (0xa7)
          Periodic advertising interval: 0.00 msec (0x0000)
          Direct address type: Reserved (0xff)
          Direct address: 00-00-00-00-00-00
          Data length: 0x1c
        1b ff 75 00 42 04 01 80 6e a4 30 7a 95 74 fb a6  ..u.B...n.0z.t..
        30 7a 95 74 fa 01 d8 41 c5 d9 00 00              0z.t...A....    
        Company: Samsung Electronics Co. Ltd. (117)
          Data[24]: 420401806ea4307a9574fba6307a9574fa01d841c5d90000
> HCI Event: LE Meta Event (0x3e) plen 16                                                                          #171 10.410681
      LE Periodic Advertising Sync Established (0x0e)
        Status: Success (0x00)
        Sync handle: 40
        Advertising SID: 0x01
        Advertiser address type: Resolved Public (0x02)
        Advertiser address: DF:A9:FF:F6:B1:1A (OUI DF-A9-FF)
        Advertiser PHY: LE 1M (0x01)
        Periodic advertising interval: 120.00 msec (0x0060)
        Advertiser clock accuracy: 0x01
> HCI Event: LE Meta Event (0x3e) plen 48                                                                          #172 10.411310
      LE Periodic Advertising Report (0x0f)
        Sync handle: 40
        TX power: 127 dbm (0x7f)
        RSSI: -16 dBm (0xf0)
        CTE Type: No Constant Tone Extension (0xff)
        Data status: [0;32mComplete[0m
        Data length: 0x28
        Service Data: Basic Audio Announcement (0x1851)
          Presentation Delay: 40000
          Number of Subgroups: 1
            Subgroup #0:
            Number of BIS(s): 1
            Codec: LC3 (0x06)
            Codec Specific Configuration: #0: len 0x02 type 0x01
            Codec Specific Configuration: Sampling Frequency: 16 Khz (0x03)
            Codec Specific Configuration: #1: len 0x02 type 0x02
            Codec Specific Configuration: Frame Duration: 10 ms (0x01)
            Codec Specific Configuration: #2: len 0x03 type 0x04
            Codec Specific Configuration: Frame Length: 40 (0x0028)
            Metadata: #0: len 0x03 type 0x02
            Metadata: Context: 0x0004
            Metadata: Context	Media (0x0004)
            Metadata: #1: len 0x01 type 0x09
              BIS #0:
              Index: 1
              Codec Specific Configuration: #0: len 0x05 type 0x03
              Codec Specific Configuration: Location: 0x00000001
              Codec Specific Configuration: Location: Front Left (0x00000001)
> HCI Event: LE Meta Event (0x3e) plen 20                                                                          #173 10.411651
      LE Broadcast Isochronous Group Info Advertising Report (0x22)
        Sync Handle: 0x0028
        Number BIS: 1
        NSE: 3
        ISO Interval: 10.00 msec (0x0008)
        BN: 1
        PTO: 1
        IRC: 2
        Maximum PDU: 40
        SDU Interval: 10000 us (0x002710)
        Maximum SDU: 40
        PHY: LE 1M (0x01)
        Framing: Unframed (0x00)
        Encryption: 0x01
zephyr.exe[837848]: < HCI Command: LE Set Extended Scan Enable (0x08|0x0042) plen 6                                #174 10.412459
        Extended scan: Disabled (0x00)
        Filter duplicates: Disabled (0x00)
        Duration: 0 msec (0x0000)
        Period: 0.00 sec (0x0000)
> HCI Event: Command Complete (0x0e) plen 4                                                                        #175 10.415954
      LE Set Extended Scan Enable (0x08|0x0042) ncmd 1
        Status: Success (0x00)
zephyr.exe[837848]: < ACL Data TX: Handle 75 [1/3] flags 0x00 dlen 27                                              #176 10.433043
zephyr.exe[837848]: < ACL Data TX: Handle 75 flags 0x01 dlen 6                                                     #177 10.433048
      ATT: Handle Value Notification (0x1b) len 28
        Handle: 0x004b
          Data[26]: 00001ab1f6ffa9df01305b000201010000000006030204000109
> HCI Event: Number of Completed Packets (0x13) plen 5                                                             #178 10.439901
        Num handles: 1
        Handle: 75 Address: DF:A9:FF:F6:B1:1A (OUI DF-A9-FF)
        Count: 1
        Buffers: 0/3
        #176: len 27 (36 Kb/s)
        Latency: 6 msec (6-167 msec ~57 msec)
> HCI Event: Number of Completed Packets (0x13) plen 5                                                             #179 10.499810
        Num handles: 1
        Handle: 75 Address: DF:A9:FF:F6:B1:1A (OUI DF-A9-FF)
        Count: 1
        Buffers: underflow/3
        #177: len 6 (0 Kb/s)
        Latency: 66 msec (6-167 msec ~62 msec)
> ACL Data RX: Handle 75 flags 0x02 dlen 25                                                                        #180 10.500156
      ATT: Write Command (0x52) len 20
        Handle: 0x0049
          Data[18]: 040047fc153950449a5da5be0eacfa97fdfe
zephyr.exe[837848]: < HCI Command: Host Number of Completed Packets (0x03|0x0035) plen 5                           #181 10.512484
        Num handles: 1
        Handle: 75 Address: DF:A9:FF:F6:B1:1A (OUI DF-A9-FF)
        Count: 1
zephyr.exe[837848]: < HCI Command: LE Broadcast Isochronous Group Create Sync (0x08|0x006b) plen 25                #182 10.632342
        BIG Handle: 0x00
        BIG Sync Handle: 0x0028
        Encryption: Encrypted (0x01)
        Broadcast Code[16]: 47fc153950449a5da5be0eacfa97fdfe
        Maximum Number Subevents: 0x00
        Timeout: 200 ms (0x0014)
        Number of BIS: 1
        BIS ID: 0x01
> HCI Event: Command Status (0x0f) plen 4                                                                          #183 10.633505
      LE Broadcast Isochronous Group Create Sync (0x08|0x006b) ncmd 1
        Status: Success (0x00)
> HCI Event: LE Meta Event (0x3e) plen 48                                                                          #184 11.131007
      LE Periodic Advertising Report (0x0f)
        Sync handle: 40
        TX power: 127 dbm (0x7f)
        RSSI: -16 dBm (0xf0)
        CTE Type: No Constant Tone Extension (0xff)
        Data status: [0;32mComplete[0m
        Data length: 0x28
        Service Data: Basic Audio Announcement (0x1851)
          Presentation Delay: 40000
          Number of Subgroups: 1
            Subgroup #0:
            Number of BIS(s): 1
            Codec: LC3 (0x06)
            Codec Specific Configuration: #0: len 0x02 type 0x01
            Codec Specific Configuration: Sampling Frequency: 16 Khz (0x03)
            Codec Specific Configuration: #1: len 0x02 type 0x02
            Codec Specific Configuration: Frame Duration: 10 ms (0x01)
            Codec Specific Configuration: #2: len 0x03 type 0x04
            Codec Specific Configuration: Frame Length: 40 (0x0028)
            Metadata: #0: len 0x03 type 0x02
            Metadata: Context: 0x0004
            Metadata: Context	Media (0x0004)
            Metadata: #1: len 0x01 type 0x09
              BIS #0:
              Index: 1
              Codec Specific Configuration: #0: len 0x05 type 0x03
              Codec Specific Configuration: Location: 0x00000001
              Codec Specific Configuration: Location: Front Left (0x00000001)
> HCI Event: LE Meta Event (0x3e) plen 20                                                                          #185 11.131132
      LE Broadcast Isochronous Group Info Advertising Report (0x22)
        Sync Handle: 0x0028
        Number BIS: 1
        NSE: 3
        ISO Interval: 10.00 msec (0x0008)
        BN: 1
        PTO: 1
        IRC: 2
        Maximum PDU: 40
        SDU Interval: 10000 us (0x002710)
        Maximum SDU: 40
        PHY: LE 1M (0x01)
        Framing: Unframed (0x00)
        Encryption: 0x01
> HCI Event: LE Meta Event (0x3e) plen 15                                                                          #186 11.137342
      LE Broadcast Isochronous Group Sync Established (0x1d)
        Status: Connection Terminated due to MIC Failure (0x3d)
        BIG Handle: 0x00
        Transport Latency: 525057 us (0x080301)
        NSE: 0
        BN: 1
        PTO: 1
        IRC: 2
        Maximum PDU: 40
        ISO Interval: 12500.00 msec (0x2710)
zephyr.exe[837848]: < ACL Data TX: Handle 75 [1/3] flags 0x00 dlen 27                                              #187 11.152471
zephyr.exe[837848]: < ACL Data TX: Handle 75 flags 0x01 dlen 22                                                    #188 11.152478
      ATT: Handle Value Notification (0x1b) len 44
        Handle: 0x004b
          Data[42]: 00001ab1f6ffa9df01305b000203ffffffffffffffffffffffffffffffff01ffffffff06030204000109
> HCI Event: Number of Completed Packets (0x13) plen 5                                                             #189 11.219817
        Num handles: 1
        Handle: 75 Address: DF:A9:FF:F6:B1:1A (OUI DF-A9-FF)
        Count: 1
        Buffers: 0/3
        #187: len 27 (3 Kb/s)
        Latency: 67 msec (6-167 msec ~64 msec)
> HCI Event: Number of Completed Packets (0x13) plen 5                                                             #190 11.279602
        Num handles: 1
        Handle: 75 Address: DF:A9:FF:F6:B1:1A (OUI DF-A9-FF)
        Count: 1
        Buffers: underflow/3
        #188: len 22 (1 Kb/s)
        Latency: 127 msec (6-167 msec ~95 msec)
> HCI Event: LE Meta Event (0x3e) plen 48                                                                          #191 11.851681
      LE Periodic Advertising Report (0x0f)
        Sync handle: 40
        TX power: 127 dbm (0x7f)
        RSSI: -17 dBm (0xef)
        CTE Type: No Constant Tone Extension (0xff)
        Data status: [0;32mComplete[0m
        Data length: 0x28
        Service Data: Basic Audio Announcement (0x1851)
          Presentation Delay: 40000
          Number of Subgroups: 1
            Subgroup #0:
            Number of BIS(s): 1
            Codec: LC3 (0x06)
            Codec Specific Configuration: #0: len 0x02 type 0x01
            Codec Specific Configuration: Sampling Frequency: 16 Khz (0x03)
            Codec Specific Configuration: #1: len 0x02 type 0x02
            Codec Specific Configuration: Frame Duration: 10 ms (0x01)
            Codec Specific Configuration: #2: len 0x03 type 0x04
            Codec Specific Configuration: Frame Length: 40 (0x0028)
            Metadata: #0: len 0x03 type 0x02
            Metadata: Context: 0x0004
            Metadata: Context	Media (0x0004)
            Metadata: #1: len 0x01 type 0x09
              BIS #0:
              Index: 1
              Codec Specific Configuration: #0: len 0x05 type 0x03
              Codec Specific Configuration: Location: 0x00000001
              Codec Specific Configuration: Location: Front Left (0x00000001)
> HCI Event: LE Meta Event (0x3e) plen 20                                                                          #192 11.851919
      LE Broadcast Isochronous Group Info Advertising Report (0x22)
        Sync Handle: 0x0028
        Number BIS: 1
        NSE: 3
        ISO Interval: 10.00 msec (0x0008)
        BN: 1
        PTO: 1
        IRC: 2
        Maximum PDU: 40
        SDU Interval: 10000 us (0x002710)
        Maximum SDU: 40
        PHY: LE 1M (0x01)
        Framing: Unframed (0x00)
        Encryption: 0x01
zephyr.exe[837848]: < HCI Command: LE Broadcast Isochronous Group Create Sync (0x08|0x006b) plen 25                #193 11.852618
        BIG Handle: 0x00
        BIG Sync Handle: 0x0028
        Encryption: Encrypted (0x01)
        Broadcast Code[16]: 47fc153950449a5da5be0eacfa97fdfe
        Maximum Number Subevents: 0x00
        Timeout: 200 ms (0x0014)
        Number of BIS: 1
        BIS ID: 0x01
> HCI Event: Command Status (0x0f) plen 4                                                                          #194 11.853661
      LE Broadcast Isochronous Group Create Sync (0x08|0x006b) ncmd 1
        Status: Success (0x00)
> HCI Event: LE Meta Event (0x3e) plen 48                                                                          #195 12.570954
      LE Periodic Advertising Report (0x0f)
        Sync handle: 40
        TX power: 127 dbm (0x7f)
        RSSI: -16 dBm (0xf0)
        CTE Type: No Constant Tone Extension (0xff)
        Data status: [0;32mComplete[0m
        Data length: 0x28
        Service Data: Basic Audio Announcement (0x1851)
          Presentation Delay: 40000
          Number of Subgroups: 1
            Subgroup #0:
            Number of BIS(s): 1
            Codec: LC3 (0x06)
            Codec Specific Configuration: #0: len 0x02 type 0x01
            Codec Specific Configuration: Sampling Frequency: 16 Khz (0x03)
            Codec Specific Configuration: #1: len 0x02 type 0x02
            Codec Specific Configuration: Frame Duration: 10 ms (0x01)
            Codec Specific Configuration: #2: len 0x03 type 0x04
            Codec Specific Configuration: Frame Length: 40 (0x0028)
            Metadata: #0: len 0x03 type 0x02
            Metadata: Context: 0x0004
            Metadata: Context	Media (0x0004)
            Metadata: #1: len 0x01 type 0x09
              BIS #0:
              Index: 1
              Codec Specific Configuration: #0: len 0x05 type 0x03
              Codec Specific Configuration: Location: 0x00000001
              Codec Specific Configuration: Location: Front Left (0x00000001)
> HCI Event: LE Meta Event (0x3e) plen 20                                                                          #196 12.571227
      LE Broadcast Isochronous Group Info Advertising Report (0x22)
        Sync Handle: 0x0028
        Number BIS: 1
        NSE: 3
        ISO Interval: 10.00 msec (0x0008)
        BN: 1
        PTO: 1
        IRC: 2
        Maximum PDU: 40
        SDU Interval: 10000 us (0x002710)
        Maximum SDU: 40
        PHY: LE 1M (0x01)
        Framing: Unframed (0x00)
        Encryption: 0x01
> HCI Event: LE Meta Event (0x3e) plen 17                                                                          #197 12.576922
      LE Broadcast Isochronous Group Sync Established (0x1d)
        Status: Success (0x00)
        BIG Handle: 0x00
        Transport Latency: 11596 us (0x002d4c)
        NSE: 3
        BN: 1
        PTO: 1
        IRC: 2
        Maximum PDU: 40
        ISO Interval: 10.00 msec (0x0008)
        Connection Handle #0: 70
zephyr.exe[837848]: < HCI Command: LE Setup Isochronous Data Path (0x08|0x006e) plen 13                            #198 12.592402
        Handle: 70
        Data Path Direction: Output (Controller to Host) (0x01)
        Data Path: HCI (0x00)
        Coding Format: Transparent (0x03)
        Company Codec ID: Ericsson Technology Licensing (0)
        Vendor Codec ID: 0
        Controller Delay: 0 us (0x000000)
        Codec Configuration Length: 0
        Codec Configuration[0]: 
> HCI Event: Command Complete (0x0e) plen 6                                                                        #199 12.593526
      LE Setup Isochronous Data Path (0x08|0x006e) ncmd 1
        Status: Success (0x00)
        Handle: 70
> ISO Data RX: Handle 70 SN 428 flags 0x02 dlen 4 slen 32768                                                       #200 12.596740
> ISO Data RX: Handle 70 SN 429 flags 0x06 dlen 8 slen 32768                                                       #201 12.596919
        invalid packet size (4 != 8)
        ad 01 00 80                                      ....            
> ISO Data RX: Handle 70 SN 430 flags 0x06 dlen 8 slen 32768                                                       #202 12.598405
        invalid packet size (4 != 8)
        ae 01 00 80                                      ....            
> ISO Data RX: Handle 70 SN 431 flags 0x06 dlen 8 slen 32768                                                       #203 12.608441
        invalid packet size (4 != 8)
        af 01 00 80                                      ....            
zephyr.exe[837848]: < ACL Data TX: Handle 75 [1/3] flags 0x00 dlen 27                                              #204 12.612611
zephyr.exe[837848]: < ACL Data TX: Handle 75 flags 0x01 dlen 6                                                     #205 12.612708
      ATT: Handle Value Notification (0x1b) len 28
        Handle: 0x004b
          Data[26]: 00001ab1f6ffa9df01305b000202010100000006030204000109
> ISO Data RX: Handle 70 SN 432 flags 0x06 dlen 8 slen 32768                                                       #206 12.617999
        invalid packet size (4 != 8)
        b0 01 00 80                                      ....            
> ISO Data RX: Handle 70 SN 433 flags 0x06 dlen 8 slen 32768                                                       #207 12.627813
        invalid packet size (4 != 8)
        b1 01 00 80                                      ....            
> ISO Data RX: Handle 70 SN 434 flags 0x06 dlen 8 slen 32768                                                       #208 12.638170
        invalid packet size (4 != 8)
        b2 01 00 80                                      ....            
> ISO Data RX: Handle 70 SN 435 flags 0x06 dlen 8 slen 32768                                                       #209 12.648258
        invalid packet size (4 != 8)
        b3 01 00 80                                      ....            
> ISO Data RX: Handle 70 SN 436 flags 0x06 dlen 8 slen 32768                                                       #210 12.658979
        invalid packet size (4 != 8)
        b4 01 00 80                                      ....            
> HCI Event: Number of Completed Packets (0x13) plen 5                                                             #211 12.659781
        Num handles: 1
        Handle: 75 Address: DF:A9:FF:F6:B1:1A (OUI DF-A9-FF)
        Count: 1
        Buffers: 0/3
        #204: len 27 (4 Kb/s)
        Latency: 47 msec (6-167 msec ~71 msec)
> HCI Event: Number of Completed Packets (0x13) plen 5                                                             #212 12.659962
        Num handles: 1
        Handle: 75 Address: DF:A9:FF:F6:B1:1A (OUI DF-A9-FF)
        Count: 1
        Buffers: underflow/3
        #205: len 6 (1 Kb/s)
        Latency: 47 msec (6-167 msec ~59 msec)
> HCI Event: Disconnect Complete (0x05) plen 4                                                                     #213 12.659963
        Status: Success (0x00)
        Handle: 75 Address: DF:A9:FF:F6:B1: