Bluetooth monitor ver 5.72
btmon[2879450]: = Note: Linux version 6.14.0-36-generic (x86_64)                                                         0.069792
btmon[2879450]: = Note: Bluetooth subsystem version 2.22                                                                 0.069794
= New Index: 00:00:00:00:00:00 (Primary,UART,hci1)                                                                       0.069795
= New Index: 48:5F:99:8E:E0:64 (Primary,USB,hci0)                                                                        0.069795
= Open Index: 00:00:00:00:00:00                                                                                          0.584262
= Index Info: 00:00:00:00:00:00 (Nordic Semiconductor ASA)                                                               0.584286
zephyr.exe[2879452]: @ USER Open: main (privileged) version 2.22                                                {0x0001} 0.584297
zephyr.exe[2879452]: < HCI Command: Reset (0x03|0x0003) plen 0                                                        #1 0.585532
> HCI Event: Command Complete (0x0e) plen 4                                                                           #2 0.586033
      Reset (0x03|0x0003) ncmd 1
        Status: Success (0x00)
zephyr.exe[2879452]: < HCI Command: Read Local Supported Features (0x04|0x0003) plen 0                                #3 0.603731
> HCI Event: Command Complete (0x0e) plen 12                                                                          #4 0.604169
      Read Local Supported Features (0x04|0x0003) ncmd 1
        Status: Success (0x00)
        Features: 0x00 0x00 0x00 0x00 0x60 0x00 0x00 0x00
          BR/EDR Not Supported
          LE Supported (Controller)
zephyr.exe[2879452]: < HCI Command: Read Local Version Information (0x04|0x0001) plen 0                               #5 0.623688
> HCI Event: Command Complete (0x0e) plen 12                                                                          #6 0.624126
      Read Local Version Information (0x04|0x0001) ncmd 1
        Status: Success (0x00)
        HCI version: Reserved (0x0f) - Revision 12393 (0x3069)
        LMP version: Reserved (0x0f) - Subversion 12393 (0x3069)
        Manufacturer: Nordic Semiconductor ASA (89)
zephyr.exe[2879452]: < HCI Command: Read Local Supported Commands (0x04|0x0002) plen 0                                #7 0.643724
> HCI Event: Command Complete (0x0e) plen 68                                                                          #8 0.644839
      Read Local Supported Commands (0x04|0x0002) ncmd 1
        Status: Success (0x00)
        Commands: 119 entries
          Disconnect (Octet 0 - Bit 5)
          Read Remote Version Information (Octet 2 - Bit 7)
          Set Event Mask (Octet 5 - Bit 6)
          Reset (Octet 5 - Bit 7)
          Read Connection Accept Timeout (Octet 7 - Bit 2)
          Write Connection Accept Timeout (Octet 7 - Bit 3)
          Read Transmit Power Level (Octet 10 - Bit 2)
          Set Controller To Host Flow Control (Octet 10 - Bit 5)
          Host Buffer Size (Octet 10 - Bit 6)
          Host Number of Completed Packets (Octet 10 - Bit 7)
          Read Local Version Information (Octet 14 - Bit 3)
          Read Local Supported Features (Octet 14 - Bit 5)
          Read BD ADDR (Octet 15 - Bit 1)
          Read RSSI (Octet 15 - Bit 5)
          Set Event Mask Page 2 (Octet 22 - Bit 2)
          LE Set Event Mask (Octet 25 - Bit 0)
          LE Read Buffer Size (Octet 25 - Bit 1)
          LE Read Local Supported Features (Octet 25 - Bit 2)
          LE Set Random Address (Octet 25 - Bit 4)
          LE Set Advertising Parameters (Octet 25 - Bit 5)
          LE Read Advertising Channel TX Power (Octet 25 - Bit 6)
          LE Set Advertising Data (Octet 25 - Bit 7)
          LE Set Scan Response Data (Octet 26 - Bit 0)
          LE Set Advertise Enable (Octet 26 - Bit 1)
          LE Set Scan Parameters (Octet 26 - Bit 2)
          LE Set Scan Enable (Octet 26 - Bit 3)
          LE Create Connection (Octet 26 - Bit 4)
          LE Create Connection Cancel (Octet 26 - Bit 5)
          LE Read Accept List Size (Octet 26 - Bit 6)
          LE Clear Accept List (Octet 26 - Bit 7)
          LE Add Device To Accept List (Octet 27 - Bit 0)
          LE Remove Device From Accept List (Octet 27 - Bit 1)
          LE Connection Update (Octet 27 - Bit 2)
          LE Set Host Channel Classification (Octet 27 - Bit 3)
          LE Read Channel Map (Octet 27 - Bit 4)
          LE Read Remote Used Features (Octet 27 - Bit 5)
          LE Encrypt (Octet 27 - Bit 6)
          LE Rand (Octet 27 - Bit 7)
          LE Start Encryption (Octet 28 - Bit 0)
          LE Long Term Key Request Reply (Octet 28 - Bit 1)
          LE Long Term Key Request Neg Reply (Octet 28 - Bit 2)
          LE Read Supported States (Octet 28 - Bit 3)
          LE Receiver Test (Octet 28 - Bit 4)
          LE Transmitter Test (Octet 28 - Bit 5)
          LE Test End (Octet 28 - Bit 6)
          Read Authenticated Payload Timeout (Octet 32 - Bit 4)
          Write Authenticated Payload Timeout (Octet 32 - Bit 5)
          LE Set Data Length (Octet 33 - Bit 6)
          LE Read Suggested Default Data Length (Octet 33 - Bit 7)
          LE Write Suggested Default Data Length (Octet 34 - Bit 0)
          LE Add Device To Resolving List (Octet 34 - Bit 3)
          LE Remove Device From Resolving List (Octet 34 - Bit 4)
          LE Clear Resolving List (Octet 34 - Bit 5)
          LE Read Resolving List Size (Octet 34 - Bit 6)
          LE Set Address Resolution Enable (Octet 35 - Bit 1)
          LE Set Resolvable Private Address Timeout (Octet 35 - Bit 2)
          LE Read Maximum Data Length (Octet 35 - Bit 3)
          LE Read PHY (Octet 35 - Bit 4)
          LE Set Default PHY (Octet 35 - Bit 5)
          LE Set PHY (Octet 35 - Bit 6)
          LE Enhanced Receiver Test (Octet 35 - Bit 7)
          LE Enhanced Transmitter Test (Octet 36 - Bit 0)
          LE Set Advertising Set Random Address (Octet 36 - Bit 1)
          LE Set Extended Advertising Parameters (Octet 36 - Bit 2)
          LE Set Extended Advertising Data (Octet 36 - Bit 3)
          LE Set Extended Scan Response Data (Octet 36 - Bit 4)
          LE Set Extended Advertising Enable (Octet 36 - Bit 5)
          LE Read Maximum Advertising Data Length (Octet 36 - Bit 6)
          LE Read Number of Supported Advertising Sets (Octet 36 - Bit 7)
          LE Remove Advertising Set (Octet 37 - Bit 0)
          LE Clear Advertising Sets (Octet 37 - Bit 1)
          LE Set Periodic Advertising Parameters (Octet 37 - Bit 2)
          LE Set Periodic Advertising Data (Octet 37 - Bit 3)
          LE Set Periodic Advertising Enable (Octet 37 - Bit 4)
          LE Set Extended Scan Parameters (Octet 37 - Bit 5)
          LE Set Extended Scan Enable (Octet 37 - Bit 6)
          LE Extended Create Connection (Octet 37 - Bit 7)
          LE Periodic Advertising Create Sync (Octet 38 - Bit 0)
          LE Periodic Advertising Create Sync Cancel (Octet 38 - Bit 1)
          LE Periodic Advertising Terminate Sync (Octet 38 - Bit 2)
          LE Add Device To Periodic Advertiser List (Octet 38 - Bit 3)
          LE Remove Device From Periodic Advertiser List (Octet 38 - Bit 4)
          LE Clear Periodic Advertiser List (Octet 38 - Bit 5)
          LE Read Periodic Advertiser List Size (Octet 38 - Bit 6)
          LE Read Transmit Power (Octet 38 - Bit 7)
          LE Read RF Path Compensation (Octet 39 - Bit 0)
          LE Write RF Path Compensation (Octet 39 - Bit 1)
          LE Set Privacy Mode (Octet 39 - Bit 2)
          LE Periodic Advertising Receive Enable (Octet 40 - Bit 5)
          LE Periodic Advertising Sync Transfer (Octet 40 - Bit 6)
          LE Periodic Advertising Set Info Transfer (Octet 40 - Bit 7)
          LE Periodic Advertising Sync Transfer Parameters (Octet 41 - Bit 0)
          LE Set Default Periodic Advertisng Sync Transfer Parameters (Octet 41 - Bit 1)
          LE Read Buffer v2 (Octet 41 - Bit 5)
          LE Read ISO TX Sync (Octet 41 - Bit 6)
          LE Set Connected Isochronous Group Parameters (Octet 41 - Bit 7)
          LE Set Connected Isochronous Group Parameters Test (Octet 42 - Bit 0)
          LE Create Connected Isochronous Stream (Octet 42 - Bit 1)
          LE Remove Connected Isochronous Group (Octet 42 - Bit 2)
          LE Accept Connected Isochronous Stream Request (Octet 42 - Bit 3)
          LE Reject Connected Isochronous Stream Request (Octet 42 - Bit 4)
          LE Create Broadcast Isochronous Group (Octet 42 - Bit 5)
          LE Create Broadcast Isochronous Group Test (Octet 42 - Bit 6)
          LE Terminate Broadcast Isochronous Group (Octet 42 - Bit 7)
          LE Broadcast Isochronous Group Create Sync (Octet 43 - Bit 0)
          LE Broadcast Isochronous Group Terminate Sync (Octet 43 - Bit 1)
          LE Request Peer SCA (Octet 43 - Bit 2)
          LE Setup Isochronous Data Path (Octet 43 - Bit 3)
          LE Remove Isochronous Data Path (Octet 43 - Bit 4)
          LE Isochronous Transmit Test (Octet 43 - Bit 5)
          LE Isochronous Receive Test (Octet 43 - Bit 6)
          LE Isochronous Read Test Counters (Octet 43 - Bit 7)
          LE Isochronous Read Test Counters (Octet 44 - Bit 0)
          LE Set Host Feature (Octet 44 - Bit 1)
          Octet 44 - Bit 2 
          Octet 45 - Bit 6 
          Octet 46 - Bit 0 
          Octet 46 - Bit 1 
          Octet 46 - Bit 2 
zephyr.exe[2879452]: < HCI Command: Host Buffer Size (0x03|0x0033) plen 7                                             #9 0.663726
        ACL MTU: 255  ACL max packet: 16
        SCO MTU: 0    SCO max packet: 0
> HCI Event: Command Complete (0x0e) plen 4                                                                          #10 0.664336
      Host Buffer Size (0x03|0x0033) ncmd 1
        Status: Success (0x00)
zephyr.exe[2879452]: < HCI Command: Set Controller To Host Flow Control (0x03|0x0031) plen 1                         #11 0.683714
        Flow control: ACL Data Packets (0x01)
> HCI Event: Command Complete (0x0e) plen 4                                                                          #12 0.684137
      Set Controller To Host Flow Control (0x03|0x0031) ncmd 1
        Status: Success (0x00)
zephyr.exe[2879452]: < HCI Command: LE Read Local Supported Features (0x08|0x0003) plen 0                            #13 0.703723
> HCI Event: Command Complete (0x0e) plen 12                                                                         #14 0.704230
      LE Read Local Supported Features (0x08|0x0003) ncmd 1
        Status: Success (0x00)
        Features: 0xfd 0x79 0x00 0xf7 0x30 0x01 0x00 0x00
          LE Encryption
          Extended Reject Indication
          Peripheral-initiated Features Exchange
          LE Ping
          LE Data Packet Length Extension
          LL Privacy
          Extended Scanner Filter Policies
          LE 2M PHY
          LE Coded PHY
          LE Extended Advertising
          LE Periodic Advertising
          Channel Selection Algorithm #2
          Periodic Advertising Sync Transfer - Sender
          Periodic Advertising Sync Transfer - Recipient
          Sleep Clock Accuracy Updates
          Connected Isochronous Stream - Central
          Connected Isochronous Stream - Peripheral
          Isochronous Broadcaster
          Synchronized Receiver
          Periodic Advertising ADI support
          Connection Subrating
          Unknown features (0x0000010000000000)
zephyr.exe[2879452]: < HCI Command: LE Set Host Feature (0x08|0x0074) plen 2                                         #15 0.723714
        Bit Number: 32
          Connected Isochronous Stream (Host Support)
        Bit Value: 1
> HCI Event: Command Complete (0x0e) plen 4                                                                          #16 0.724075
      LE Set Host Feature (0x08|0x0074) ncmd 1
        Status: Success (0x00)
zephyr.exe[2879452]: < HCI Command: LE Read Buffer v2 (0x08|0x0060) plen 0                                           #17 0.743737
> HCI Event: Command Complete (0x0e) plen 10                                                                         #18 0.744277
      LE Read Buffer v2 (0x08|0x0060) ncmd 1
        Status: Success (0x00)
        ACL MTU: 27
        ACL max packet: 3
        ISO MTU: 318
        ISO max packet: 3
zephyr.exe[2879452]: < HCI Command: LE Read Maximum Advertising Data Length (0x08|0x003a) plen 0                     #19 0.763749
> HCI Event: Command Complete (0x0e) plen 6                                                                          #20 0.764189
      LE Read Maximum Advertising Data Length (0x08|0x003a) ncmd 1
        Status: Success (0x00)
        Max length: 1650
zephyr.exe[2879452]: < HCI Command: LE Read Supported States (0x08|0x001c) plen 0                                    #21 0.783672
> HCI Event: Command Complete (0x0e) plen 12                                                                         #22 0.784170
      LE Read Supported States (0x08|0x001c) ncmd 1
        Status: Success (0x00)
        States: 0x000003ff3e0306ff
          Non-connectable Advertising State
          Scannable Advertising State
          Connectable Advertising State
          High Duty Cycle Directed Advertising State
          Passive Scanning State
          Active Scanning State
          Initiating State
            and Connection State (Central Role)
          Connection State (Peripheral Role)
          Scannable Advertising State
            and Passive Scanning State
          Connectable Advertising State
            and Passive Scanning State
          Non-connectable Advertising State
            and Initiating State
          Scannable Advertising State
            and Initiating State
          Active Scanning State
            and Connection State (Central Role)
          Passive Scanning State
            and Connection State (Peripheral Role)
          Active Scanning State
            and Connection State (Peripheral Role)
          Initiating State
            and Connection State (Central Role)
            and Central Role & Central Role
          Low Duty Cycle Directed Advertising State
          Connectable Advertising State
            and Initiating State
            and Central Role & Peripheral Role
          High Duty Cycle Directed Advertising State
            and Initiating State
            and Central Role & Peripheral Role
          Low Duty Cycle Directed Advertising State
            and Initiating State
            and Central Role & Peripheral Role
          Connectable Advertising State
            and Connection State (Central Role)
            and Central Role & Peripheral Role
          High Duty Cycle Directed Advertising State
            and Connection State (Central Role)
            and Central Role & Peripheral Role
          Low Duty Cycle Directed Advertising State
            and Connection State (Central Role)
            and Central Role & Peripheral Role
          Connectable Advertising State
            and Connection State (Peripheral Role)
            and Central Role & Peripheral Role
          High Duty Cycle Directed Advertising State
            and Connection State (Peripheral Role)
            and Peripheral Role & Peripheral Role
          Low Duty Cycle Directed Advertising State
            and Connection State (Peripheral Role)
            and Peripheral Role & Peripheral Role
          Initiating State
            and Connection State (Peripheral Role)
            and Central Role & Peripheral Role
zephyr.exe[2879452]: < HCI Command: LE Read Maximum Data Length (0x08|0x002f) plen 0                                 #23 0.803712
> HCI Event: Command Complete (0x0e) plen 12                                                                         #24 0.804131
      LE Read Maximum Data Length (0x08|0x002f) ncmd 1
        Status: Success (0x00)
        Max TX octets: 251
        Max TX time: 2704
        Max RX octets: 251
        Max RX time: 2704
zephyr.exe[2879452]: < HCI Command: LE Write Suggested Default Data Length (0x08|0x0024) plen 4                      #25 0.823676
        TX octets: 251
        TX time: 2704
> HCI Event: Command Complete (0x0e) plen 4                                                                          #26 0.824174
      LE Write Suggested Default Data Length (0x08|0x0024) ncmd 1
        Status: Success (0x00)
zephyr.exe[2879452]: < HCI Command: LE Read Resolving List Size (0x08|0x002a) plen 0                                 #27 0.843748
> HCI Event: Command Complete (0x0e) plen 5                                                                          #28 0.844121
      LE Read Resolving List Size (0x08|0x002a) ncmd 1
        Status: Success (0x00)
        Size: 8
zephyr.exe[2879452]: < HCI Command: LE Set Event Mask (0x08|0x0001) plen 8                                           #29 0.863724
        Mask: 0x000002023f87fa5e
          LE Advertising Report
          LE Connection Update Complete
          LE Read Remote Used Features Complete
          LE Long Term Key Request
          LE Data Length Change
          LE Enhanced Connection Complete
          LE PHY Update Complete
          LE Extended Advertising Report
          LE Periodic Advertising Sync Established
          LE Periodic Advertising Report
          LE Periodic Advertising Sync Lost
          LE Extended Scan Timeout
          LE Extended Advertising Set Terminated
          LE Scan Request Received
          LE Periodic Advertising Sync Transfer Rvc
          LE CIS Established
          LE CIS Request
          LE Create BIG Complete
          LE Terminate BIG Complete
          LE BIG Sync Estabilished Complete
          LE BIG Sync Lost
          LE BIG Info Advertising Report
          Unknown mask (0x0000020000000000)
> HCI Event: Command Complete (0x0e) plen 4                                                                          #30 0.864192
      LE Set Event Mask (0x08|0x0001) ncmd 1
        Status: Success (0x00)
zephyr.exe[2879452]: < HCI Command: Set Event Mask (0x03|0x0001) plen 8                                              #31 0.883732
        Mask: 0x2000800002008890
          Disconnection Complete
          Encryption Change
          Read Remote Version Information Complete
          Hardware Error
          Data Buffer Overflow
          Encryption Key Refresh Complete
          LE Meta
> HCI Event: Command Complete (0x0e) plen 4                                                                          #32 0.884320
      Set Event Mask (0x03|0x0001) ncmd 1
        Status: Success (0x00)
zephyr.exe[2879452]: < HCI Command: Read BD ADDR (0x04|0x0009) plen 0                                                #33 0.903722
> HCI Event: Command Complete (0x0e) plen 10                                                                         #34 0.904252
      Read BD ADDR (0x04|0x0009) ncmd 1
        Status: Success (0x00)
        Address: 00:00:00:00:00:00 (OUI 00-00-00)
zephyr.exe[2879452]: < HCI Command: LE Set Random Address (0x08|0x0005) plen 6                                       #35 0.923733
        Address: D5:B6:CC:31:DB:3B (Static)
> HCI Event: Command Complete (0x0e) plen 4                                                                          #36 0.924344
      LE Set Random Address (0x08|0x0005) ncmd 1
        Status: Success (0x00)
zephyr.exe[2879452]: < HCI Command: LE Set Extended Advertising Parameters (0x08|0x0036) plen 25                     #37 3.823813
        Handle: 0x00
        Properties: 0x0001
          Connectable
        Min advertising interval: 100.000 msec (0x00a0)
        Max advertising interval: 150.000 msec (0x00f0)
        Channel map: 37, 38, 39 (0x07)
        Own address type: Random (0x01)
        Peer address type: Public (0x00)
        Peer address: 00:00:00:00:00:00 (OUI 00-00-00)
        Filter policy: Allow Scan Request from Any, Allow Connect Request from Any (0x00)
        TX power: Host has no preference (0x7f)
        Primary PHY: LE 1M (0x01)
        Secondary max skip: 0x00
        Secondary PHY: LE 2M (0x02)
        SID: 0x00
        Scan request notifications: Disabled (0x00)
> HCI Event: Command Complete (0x0e) plen 5                                                                          #38 3.824618
      LE Set Extended Advertising Parameters (0x08|0x0036) ncmd 1
        Status: Success (0x00)
        TX power (selected): 0 dbm (0x00)
zephyr.exe[2879452]: < HCI Command: LE Set Advertising Set Random Address (0x08|0x0035) plen 7                       #39 3.843759
        Advertising handle: 0x00
        Advertising random address: D5:B6:CC:31:DB:3B (Static)
> HCI Event: Command Complete (0x0e) plen 4                                                                          #40 3.844325
      LE Set Advertising Set Random Address (0x08|0x0035) ncmd 1
        Status: Success (0x00)
zephyr.exe[2879452]: < HCI Command: LE Set Extended Advertising Data (0x08|0x0037) plen 30                           #41 3.863762
        Handle: 0x00
        Operation: Complete extended advertising data (0x03)
        Fragment preference: Minimize fragmentation (0x01)
        Data length: 0x1a
        Flags: 0x06
          LE General Discoverable Mode
          BR/EDR Not Supported
        Service Data: Common Audio (0x1853)
          Data: 01
        Service Data: Audio Stream Control (0x184e)
          Data: 010000000000
        Resolvable Set Identifier: 48-61-8E-0C-80-97
          Hash: 0x c8097
          Random: 0x48618e
> HCI Event: Command Complete (0x0e) plen 4                                                                          #42 3.864626
      LE Set Extended Advertising Data (0x08|0x0037) ncmd 1
        Status: Success (0x00)
zephyr.exe[2879452]: < HCI Command: LE Set Extended Advertising Enable (0x08|0x0039) plen 6                          #43 3.883748
        Extended advertising: Enabled (0x01)
        Number of sets: 1 (0x01)
        Entry 0
          Handle: 0x00
          Duration: 0 ms (0x00)
          Max ext adv events: 0
> HCI Event: Command Complete (0x0e) plen 4                                                                          #44 3.884363
      LE Set Extended Advertising Enable (0x08|0x0039) ncmd 1
        Status: Success (0x00)
> HCI Event: LE Meta Event (0x3e) plen 31                                                                            #45 5.344120
      LE Enhanced Connection Complete (0x0a)
        Status: Success (0x00)
        Handle: 75
        Role: Peripheral (0x01)
        Peer address type: Public (0x00)
        Peer address: DF:A9:FF:F6:B1:1A (OUI DF-A9-FF)
        Local resolvable private address: 00:00:00:00:00:00 (Non-Resolvable)
        Peer resolvable private address: 00:00:00:00:00:00 (Non-Resolvable)
        Connection interval: 100.00 msec (0x0050)
        Connection latency: 0 (0x0000)
        Supervision timeout: 25120 msec (0x09d0)
        Central clock accuracy: 0x01
> HCI Event: LE Meta Event (0x3e) plen 6                                                                             #46 5.344266
      LE Advertising Set Terminated (0x12)
        Status: Success (0x00)
        Handle: 0
        Connection handle: 75
        Number of completed extended advertising events: 0
zephyr.exe[2879452]: < HCI Command: LE Read Remote Used Features (0x08|0x0016) plen 2                                #47 5.364118
        Handle: 75 Address: DF:A9:FF:F6:B1:1A (OUI DF-A9-FF)
zephyr.exe[2879452]: < ACL Data TX: Handle 75 flags 0x00 dlen 7                                                      #48 5.364125
      ATT: Exchange MTU Request (0x02) len 2
        Client RX MTU: 251
> HCI Event: Command Status (0x0f) plen 4                                                                            #49 5.364676
      LE Read Remote Used Features (0x08|0x0016) ncmd 1
        Status: Success (0x00)
> HCI Event: Number of Completed Packets (0x13) plen 5                                                               #50 5.546084
        Num handles: 1
        Handle: 75 Address: DF:A9:FF:F6:B1:1A (OUI DF-A9-FF)
        Count: 1
        #48: len 7 (0 Kb/s)
        Latency: 181 msec (181-181 msec ~181 msec)
> HCI Event: LE Meta Event (0x3e) plen 12                                                                            #51 5.646438
      LE Read Remote Used Features (0x04)
        Status: Success (0x00)
        Handle: 75 Address: DF:A9:FF:F6:B1:1A (OUI DF-A9-FF)
        Features: 0x2d 0x49 0x00 0xf7 0x67 0xd8 0x00 0x00
          LE Encryption
          Extended Reject Indication
          Peripheral-initiated Features Exchange
          LE Data Packet Length Extension
          LE 2M PHY
          LE Coded PHY
          Channel Selection Algorithm #2
          Periodic Advertising Sync Transfer - Sender
          Periodic Advertising Sync Transfer - Recipient
          Sleep Clock Accuracy Updates
          Connected Isochronous Stream - Central
          Connected Isochronous Stream - Peripheral
          Isochronous Broadcaster
          Synchronized Receiver
          Connected Isochronous Stream (Host Support)
          LE Power Control Request
          LE Power Control Request
          Connection Subrating
          Connection Subrating (Host Support)
          Unknown features (0x0000d80000000000)
> ACL Data RX: Handle 75 flags 0x02 dlen 7                                                                           #52 6.146161
      ATT: Exchange MTU Request (0x02) len 2
        Client RX MTU: 64
> ACL Data RX: Handle 75 flags 0x02 dlen 7                                                                           #53 6.146472
      ATT: Exchange MTU Response (0x03) len 2
        Server RX MTU: 64
zephyr.exe[2879452]: < HCI Command: Host Number of Completed Packets (0x03|0x0035) plen 5                            #54 6.164223
        Num handles: 1
        Handle: 75 Address: DF:A9:FF:F6:B1:1A (OUI DF-A9-FF)
        Count: 1
zephyr.exe[2879452]: < ACL Data TX: Handle 75 flags 0x00 dlen 7                                                      #55 6.164367
      ATT: Exchange MTU Response (0x03) len 2
        Server RX MTU: 251
zephyr.exe[2879452]: < HCI Command: Host Number of Completed Packets (0x03|0x0035) plen 5                            #56 6.164407
        Num handles: 1
        Handle: 75 Address: DF:A9:FF:F6:B1:1A (OUI DF-A9-FF)
        Count: 1
> HCI Event: Number of Completed Packets (0x13) plen 5                                                               #57 6.346064
        Num handles: 1
        Handle: 75 Address: DF:A9:FF:F6:B1:1A (OUI DF-A9-FF)
        Count: 1
        #55: len 7 (0 Kb/s)
        Latency: 181 msec (181-181 msec ~181 msec)
> ACL Data RX: Handle 75 flags 0x02 dlen 11                                                                          #58 8.346099
      SMP: Pairing Request (0x01) len 6
        IO capability: KeyboardDisplay (0x04)
        OOB data: Authentication data not present (0x00)
        Authentication requirement: Bonding, No MITM, SC, No Keypresses (0x09)
        Max encryption key size: 16
        Initiator key distribution: EncKey IdKey Sign (0x07)
        Responder key distribution: EncKey IdKey Sign (0x07)
zephyr.exe[2879452]: < HCI Command: Host Number of Completed Packets (0x03|0x0035) plen 5                            #59 8.364255
        Num handles: 1
        Handle: 75 Address: DF:A9:FF:F6:B1:1A (OUI DF-A9-FF)
        Count: 1
zephyr.exe[2879452]: < ACL Data TX: Handle 75 flags 0x00 dlen 11                                                     #60 8.364431
      SMP: Pairing Response (0x02) len 6
        IO capability: NoInputNoOutput (0x03)
        OOB data: Authentication data not present (0x00)
        Authentication requirement: Bonding, No MITM, SC, No Keypresses (0x09)
        Max encryption key size: 16
        Initiator key distribution: IdKey (0x02)
        Responder key distribution: <none> (0x00)
> HCI Event: Number of Completed Packets (0x13) plen 5                                                               #61 8.546174
        Num handles: 1
        Handle: 75 Address: DF:A9:FF:F6:B1:1A (OUI DF-A9-FF)
        Count: 1
        #60: len 11 (0 Kb/s)
        Latency: 181 msec (181-181 msec ~181 msec)
> ACL Data RX: Handle 75 flags 0x02 dlen 27                                                                          #62 8.546406
> ACL Data RX: Handle 75 flags 0x01 dlen 27                                                                          #63 8.546753
> ACL Data RX: Handle 75 flags 0x01 dlen 15                                                                          #64 8.547091
      SMP: Pairing Public Key (0x0c) len 64
        X: de353bbcb5b11726c42bf1f553141f6616850083eb9d6a93b8096a856a5110bc
        Y: f4518302cd37bdd7723d4ca5f19b1c7e140467855357a8788f9b93dbf0a5e7bd
zephyr.exe[2879452]: < HCI Command: Host Number of Completed Packets (0x03|0x0035) plen 5                            #65 8.564592
        Num handles: 1
        Handle: 75 Address: DF:A9:FF:F6:B1:1A (OUI DF-A9-FF)
        Count: 1
zephyr.exe[2879452]: < HCI Command: Host Number of Completed Packets (0x03|0x0035) plen 5                            #66 8.564781
        Num handles: 1
        Handle: 75 Address: DF:A9:FF:F6:B1:1A (OUI DF-A9-FF)
        Count: 1
zephyr.exe[2879452]: < HCI Command: Host Number of Completed Packets (0x03|0x0035) plen 5                            #67 8.565132
        Num handles: 1
        Handle: 75 Address: DF:A9:FF:F6:B1:1A (OUI DF-A9-FF)
        Count: 1
zephyr.exe[2879452]: < ACL Data TX: Handle 75 flags 0x00 dlen 27                                                     #68 8.565237
zephyr.exe[2879452]: < ACL Data TX: Handle 75 flags 0x01 dlen 27                                                     #69 8.565247
zephyr.exe[2879452]: < ACL Data TX: Handle 75 flags 0x01 dlen 15                                                     #70 8.565283
      SMP: Pairing Public Key (0x0c) len 64
        X: 98308440221e2d910f0e54b71e7ec652857aa9b5a0dc65028824cc19db1226e9
        Y: 67a4816bcb62efb21701e31fdb27561a6217575fb007a8bbdabe7e28b6f68482
> HCI Event: Number of Completed Packets (0x13) plen 5                                                               #71 8.646490
        Num handles: 1
        Handle: 75 Address: DF:A9:FF:F6:B1:1A (OUI DF-A9-FF)
        Count: 1
        #68: len 27 (2 Kb/s)
        Latency: 81 msec (81-181 msec ~131 msec)
> HCI Event: Number of Completed Packets (0x13) plen 5                                                               #72 8.646937
        Num handles: 1
        Handle: 75 Address: DF:A9:FF:F6:B1:1A (OUI DF-A9-FF)
        Count: 1
        #69: len 27 (2 Kb/s)
        Latency: 81 msec (81-181 msec ~106 msec)
zephyr.exe[2879452]: < ACL Data TX: Handle 75 flags 0x00 dlen 21                                                     #73 8.664202
      SMP: Pairing Confirm (0x03) len 16
        Confim value: c168152417e2c9710e88e0bf6d3e6a68
> HCI Event: Number of Completed Packets (0x13) plen 5                                                               #74 8.746119
        Num handles: 1
        Handle: 75 Address: DF:A9:FF:F6:B1:1A (OUI DF-A9-FF)
        Count: 1
        #70: len 15 (0 Kb/s)
        Latency: 180 msec (81-181 msec ~143 msec)
> HCI Event: Number of Completed Packets (0x13) plen 5                                                               #75 8.846134
        Num handles: 1
        Handle: 75 Address: DF:A9:FF:F6:B1:1A (OUI DF-A9-FF)
        Count: 1
        #73: len 21 (0 Kb/s)
        Latency: 181 msec (81-181 msec ~162 msec)
> ACL Data RX: Handle 75 flags 0x02 dlen 21                                                                          #76 8.846368
      SMP: Pairing Random (0x04) len 16
        Random value: e38cd20a3dde6cc10000000000000000
zephyr.exe[2879452]: < HCI Command: Host Number of Completed Packets (0x03|0x0035) plen 5                            #77 8.864351
        Num handles: 1
        Handle: 75 Address: DF:A9:FF:F6:B1:1A (OUI DF-A9-FF)
        Count: 1
zephyr.exe[2879452]: < ACL Data TX: Handle 75 flags 0x00 dlen 21                                                     #78 8.864446
      SMP: Pairing Random (0x04) len 16
        Random value: f966a694cbe26df70bb96773e6cc6f5d
> HCI Event: Number of Completed Packets (0x13) plen 5                                                               #79 9.046042
        Num handles: 1
        Handle: 75 Address: DF:A9:FF:F6:B1:1A (OUI DF-A9-FF)
        Count: 1
        #78: len 21 (0 Kb/s)
        Latency: 181 msec (81-181 msec ~172 msec)
> ACL Data RX: Handle 75 flags 0x02 dlen 21                                                                          #80 9.246267
      SMP: Pairing DHKey Check (0x0d) len 16
        E: 70cf3d0d337b6b60e4df47645e6f3b71
zephyr.exe[2879452]: < HCI Command: Host Number of Completed Packets (0x03|0x0035) plen 5                            #81 9.264685
        Num handles: 1
        Handle: 75 Address: DF:A9:FF:F6:B1:1A (OUI DF-A9-FF)
        Count: 1
zephyr.exe[2879452]: < ACL Data TX: Handle 75 flags 0x00 dlen 21                                                     #82 9.264910
      SMP: Pairing DHKey Check (0x0d) len 16
        E: c244d0b489cc90b2b1cc598fbd1f3576
> HCI Event: Number of Completed Packets (0x13) plen 5                                                               #83 9.445916
        Num handles: 1
        Handle: 75 Address: DF:A9:FF:F6:B1:1A (OUI DF-A9-FF)
        Count: 1
        #82: len 21 (0 Kb/s)
        Latency: 181 msec (81-181 msec ~176 msec)
> HCI Event: LE Meta Event (0x3e) plen 13                                                                            #84 9.546498
      LE Long Term Key Request (0x05)
        Handle: 75 Address: DF:A9:FF:F6:B1:1A (OUI DF-A9-FF)
        Random number: 0x0000000000000000
        Encrypted diversifier: 0x0000
zephyr.exe[2879452]: < HCI Command: LE Long Term Key Request Reply (0x08|0x001a) plen 18                             #85 9.564131
        Handle: 75 Address: DF:A9:FF:F6:B1:1A (OUI DF-A9-FF)
        Long term key: 52a0663bf2aa77faefb1e88e24caa5f5
> HCI Event: Command Complete (0x0e) plen 6                                                                          #86 9.564888
      LE Long Term Key Request Reply (0x08|0x001a) ncmd 1
        Status: Success (0x00)
        Handle: 75 Address: DF:A9:FF:F6:B1:1A (OUI DF-A9-FF)
> HCI Event: Encryption Change (0x08) plen 4                                                                        #87 10.046206
        Status: Success (0x00)
        Handle: 75 Address: DF:A9:FF:F6:B1:1A (OUI DF-A9-FF)
        Encryption: Enabled with AES-CCM (0x01)
> ACL Data RX: Handle 75 flags 0x02 dlen 21                                                                         #88 10.146205
      SMP: Identity Information (0x08) len 16
        Identity resolving key: a92333ff5417be6742216563b5cc9482
zephyr.exe[2879452]: < HCI Command: Host Number of Completed Packets (0x03|0x0035) plen 5                           #89 10.174617
        Num handles: 1
        Handle: 75 Address: DF:A9:FF:F6:B1:1A (OUI DF-A9-FF)
        Count: 1
> ACL Data RX: Handle 75 flags 0x02 dlen 12                                                                         #90 10.346135
      SMP: Identity Address Information (0x09) len 7
        Address: DF:A9:FF:F6:B1:1A (OUI DF-A9-FF)
zephyr.exe[2879452]: < HCI Command: LE Add Device To Resolving List (0x08|0x0027) plen 39                           #91 10.364465
        Address type: Public (0x00)
        Address: DF:A9:FF:F6:B1:1A (OUI DF-A9-FF)
        Peer identity resolving key: a92333ff5417be6742216563b5cc9482
        Local identity resolving key: 00000000000000000000000000000000
> HCI Event: Command Complete (0x0e) plen 4                                                                         #92 10.365537
      LE Add Device To Resolving List (0x08|0x0027) ncmd 1
        Status: Success (0x00)
zephyr.exe[2879452]: < HCI Command: LE Set Privacy Mode (0x08|0x004e) plen 8                                        #93 10.384235
        Peer Identity address type: Public (0x00)
        Peer Identity address: DF:A9:FF:F6:B1:1A (OUI DF-A9-FF)
        Privacy Mode: Use Device Privacy (0x01)
> HCI Event: Command Complete (0x0e) plen 4                                                                         #94 10.384789
      LE Set Privacy Mode (0x08|0x004e) ncmd 1
        Status: Success (0x00)
zephyr.exe[2879452]: < HCI Command: LE Set Address Resolution Enable (0x08|0x002d) plen 1                           #95 10.404156
        Address resolution: Enabled (0x01)
> HCI Event: Command Complete (0x0e) plen 4                                                                         #96 10.404638
      LE Set Address Resolution Enable (0x08|0x002d) ncmd 1
        Status: Success (0x00)
zephyr.exe[2879452]: < HCI Command: Host Number of Completed Packets (0x03|0x0035) plen 5                           #97 10.424084
        Num handles: 1
        Handle: 75 Address: DF:A9:FF:F6:B1:1A (OUI DF-A9-FF)
        Count: 1
> ACL Data RX: Handle 75 flags 0x02 dlen 13                                                                         #98 10.446172
      ATT: Find By Type Value Request (0x06) len 8
        Handle range: 0x0001-0xffff
        Attribute type: Primary Service (0x2800)
          UUID: Published Audio Capabilities (0x1850)
zephyr.exe[2879452]: < HCI Command: Host Number of Completed Packets (0x03|0x0035) plen 5                           #99 10.464928
        Num handles: 1
        Handle: 75 Address: DF:A9:FF:F6:B1:1A (OUI DF-A9-FF)
        Count: 1
zephyr.exe[2879452]: < ACL Data TX: Handle 75 flags 0x00 dlen 9                                                    #100 10.465138
      ATT: Find By Type Value Response (0x07) len 4
        Handle range: 0x012a-0x013c
> HCI Event: Number of Completed Packets (0x13) plen 5                                                             #101 10.646110
        Num handles: 1
        Handle: 75 Address: DF:A9:FF:F6:B1:1A (OUI DF-A9-FF)
        Count: 1
        #100: len 9 (0 Kb/s)
        Latency: 180 msec (81-181 msec ~178 msec)
> ACL Data RX: Handle 75 flags 0x02 dlen 13                                                                        #102 10.646298
      ATT: Find By Type Value Request (0x06) len 8
        Handle range: 0x013d-0xffff
        Attribute type: Primary Service (0x2800)
          UUID: Published Audio Capabilities (0x1850)
zephyr.exe[2879452]: < HCI Command: Host Number of Completed Packets (0x03|0x0035) plen 5                          #103 10.664606
        Num handles: 1
        Handle: 75 Address: DF:A9:FF:F6:B1:1A (OUI DF-A9-FF)
        Count: 1
zephyr.exe[2879452]: < ACL Data TX: Handle 75 flags 0x00 dlen 9                                                    #104 10.664758
      ATT: Error Response (0x01) len 4
        Find By Type Value Request (0x06)
        Handle: 0x013d
        Error: Attribute Not Found (0x0a)
> HCI Event: Number of Completed Packets (0x13) plen 5                                                             #105 10.846007
        Num handles: 1
        Handle: 75 Address: DF:A9:FF:F6:B1:1A (OUI DF-A9-FF)
        Count: 1
        #104: len 9 (0 Kb/s)
        Latency: 181 msec (81-181 msec ~180 msec)
> ACL Data RX: Handle 75 flags 0x02 dlen 11                                                                        #106 10.846163
      ATT: Read By Type Request (0x08) len 6
        Handle range: 0x012a-0x013c
        Attribute type: Characteristic (0x2803)
zephyr.exe[2879452]: < HCI Command: Host Number of Completed Packets (0x03|0x0035) plen 5                          #107 10.864511
        Num handles: 1
        Handle: 75 Address: DF:A9:FF:F6:B1:1A (OUI DF-A9-FF)
        Count: 1
zephyr.exe[2879452]: < ACL Data TX: Handle 75 flags 0x00 dlen 27                                                   #108 10.864631
zephyr.exe[2879452]: < ACL Data TX: Handle 75 flags 0x01 dlen 21                                                   #109 10.864731
      ATT: Read By Type Response (0x09) len 43
        Attribute data length: 7
        Attribute data list: 6 entries
        Handle: 0x012b
        Value: 122c01c92b
            Properties: 0x12
              Read (0x02)
              Notify (0x10)
            Value Handle: 0x012c
            Value UUID: Sink PAC (0x2bc9)
        Handle: 0x012e
        Value: 1a2f01ca2b
            Properties: 0x1a
              Read (0x02)
              Write (0x08)
              Notify (0x10)
            Value Handle: 0x012f
            Value UUID: Sink Audio Locations (0x2bca)
        Handle: 0x0131
        Value: 123201cb2b
            Properties: 0x12
              Read (0x02)
              Notify (0x10)
            Value Handle: 0x0132
            Value UUID: Source PAC (0x2bcb)
        Handle: 0x0134
        Value: 1a3501cc2b
            Properties: 0x1a
              Read (0x02)
              Write (0x08)
              Notify (0x10)
            Value Handle: 0x0135
            Value UUID: Source Audio Locations (0x2bcc)
        Handle: 0x0137
        Value: 123801cd2b
            Properties: 0x12
              Read (0x02)
              Notify (0x10)
            Value Handle: 0x0138
            Value UUID: Available Audio Contexts (0x2bcd)
        Handle: 0x013a
        Value: 123b01ce2b
            Properties: 0x12
              Read (0x02)
              Notify (0x10)
            Value Handle: 0x013b
            Value UUID: Supported Audio Contexts (0x2bce)
> HCI Event: Number of Completed Packets (0x13) plen 5                                                             #110 10.946425
        Num handles: 1
        Handle: 75 Address: DF:A9:FF:F6:B1:1A (OUI DF-A9-FF)
        Count: 1
        #108: len 27 (2 Kb/s)
        Latency: 81 msec (81-181 msec ~130 msec)
> HCI Event: Number of Completed Packets (0x13) plen 5                                                             #111 11.046056
        Num handles: 1
        Handle: 75 Address: DF:A9:FF:F6:B1:1A (OUI DF-A9-FF)
        Count: 1
        #109: len 21 (0 Kb/s)
        Latency: 181 msec (81-181 msec ~156 msec)
> ACL Data RX: Handle 75 flags 0x02 dlen 11                                                                        #112 11.046141
      ATT: Read By Type Request (0x08) len 6
        Handle range: 0x013b-0x013c
        Attribute type: Characteristic (0x2803)
zephyr.exe[2879452]: < HCI Command: Host Number of Completed Packets (0x03|0x0035) plen 5                          #113 11.064452
        Num handles: 1
        Handle: 75 Address: DF:A9:FF:F6:B1:1A (OUI DF-A9-FF)
        Count: 1
zephyr.exe[2879452]: < ACL Data TX: Handle 75 flags 0x00 dlen 9                                                    #114 11.064503
      ATT: Error Response (0x01) len 4
        Read By Type Request (0x08)
        Handle: 0x013b
        Error: Attribute Not Found (0x0a)
> HCI Event: Number of Completed Packets (0x13) plen 5                                                             #115 11.246000
        Num handles: 1
        Handle: 75 Address: DF:A9:FF:F6:B1:1A (OUI DF-A9-FF)
        Count: 1
        #114: len 9 (0 Kb/s)
        Latency: 181 msec (81-181 msec ~168 msec)
> ACL Data RX: Handle 75 flags 0x02 dlen 9                                                                         #116 11.246218
      ATT: Find Information Request (0x04) len 4
        Handle range: 0x012d-0x012d
zephyr.exe[2879452]: < HCI Command: Host Number of Completed Packets (0x03|0x0035) plen 5                          #117 11.264437
        Num handles: 1
        Handle: 75 Address: DF:A9:FF:F6:B1:1A (OUI DF-A9-FF)
        Count: 1
zephyr.exe[2879452]: < ACL Data TX: Handle 75 flags 0x00 dlen 10                                                   #118 11.264495
      ATT: Find Information Response (0x05) len 5
        Format: UUID-16 (0x01)
        Handle: 0x012d
        UUID: Client Characteristic Configuration (0x2902)
> HCI Event: Number of Completed Packets (0x13) plen 5                                                             #119 11.445983
        Num handles: 1
        Handle: 75 Address: DF:A9:FF:F6:B1:1A (OUI DF-A9-FF)
        Count: 1
        #118: len 10 (0 Kb/s)
        Latency: 181 msec (81-181 msec ~175 msec)
> ACL Data RX: Handle 75 flags 0x02 dlen 9                                                                         #120 11.446091
      ATT: Find Information Request (0x04) len 4
        Handle range: 0x0130-0x0130
zephyr.exe[2879452]: < HCI Command: Host Number of Completed Packets (0x03|0x0035) plen 5                          #121 11.464406
        Num handles: 1
        Handle: 75 Address: DF:A9:FF:F6:B1:1A (OUI DF-A9-FF)
        Count: 1
zephyr.exe[2879452]: < ACL Data TX: Handle 75 flags 0x00 dlen 10                                                   #122 11.464560
      ATT: Find Information Response (0x05) len 5
        Format: UUID-16 (0x01)
        Handle: 0x0130
        UUID: Client Characteristic Config