Bluetooth monitor ver 5.72
= Note: Linux version 6.14.0-36-generic (x86_64)                       0.029954
= Note: Bluetooth subsystem version 2.22                               0.029955
= New Index: 00:00:00:00:00:00 (Primary,UART,hci1)              [hci1] 0.029956
= New Index: 48:5F:99:8E:E0:64 (Primary,USB,hci0)               [hci0] 0.029957
= Open Index: 00:00:00:00:00:00                                 [hci1] 0.144965
= Index Info: 00:00:00:00:00:00 (Nordic Semiconductor ASA)      [hci1] 0.144980
@ USER Open: main (privileged) version 2.22            {0x0001} [hci1] 0.144991
< HCI Command: Reset (0x03|0x0003) plen 0                    #1 [hci1] 0.146200
> HCI Event: Command Complete (0x0e) plen 4                  #2 [hci1] 0.146701
      Reset (0x03|0x0003) ncmd 1
        Status: Success (0x00)
< HCI Command: Read Local Supported... (0x04|0x0003) plen 0  #3 [hci1] 0.164776
> HCI Event: Command Complete (0x0e) plen 12                 #4 [hci1] 0.165307
      Read Local Supported Features (0x04|0x0003) ncmd 1
        Status: Success (0x00)
        Features: 0x00 0x00 0x00 0x00 0x60 0x00 0x00 0x00
          BR/EDR Not Supported
          LE Supported (Controller)
< HCI Command: Read Local Version In.. (0x04|0x0001) plen 0  #5 [hci1] 0.184328
> HCI Event: Command Complete (0x0e) plen 12                 #6 [hci1] 0.184890
      Read Local Version Information (0x04|0x0001) ncmd 1
        Status: Success (0x00)
        HCI version: Reserved (0x0f) - Revision 12393 (0x3069)
        LMP version: Reserved (0x0f) - Subversion 12393 (0x3069)
        Manufacturer: Nordic Semiconductor ASA (89)
< HCI Command: Read Local Supported... (0x04|0x0002) plen 0  #7 [hci1] 0.204296
> HCI Event: Command Complete (0x0e) plen 68                 #8 [hci1] 0.205344
      Read Local Supported Commands (0x04|0x0002) ncmd 1
        Status: Success (0x00)
        Commands: 119 entries
          Disconnect (Octet 0 - Bit 5)
          Read Remote Version Information (Octet 2 - Bit 7)
          Set Event Mask (Octet 5 - Bit 6)
          Reset (Octet 5 - Bit 7)
          Read Connection Accept Timeout (Octet 7 - Bit 2)
          Write Connection Accept Timeout (Octet 7 - Bit 3)
          Read Transmit Power Level (Octet 10 - Bit 2)
          Set Controller To Host Flow Control (Octet 10 - Bit 5)
          Host Buffer Size (Octet 10 - Bit 6)
          Host Number of Completed Packets (Octet 10 - Bit 7)
          Read Local Version Information (Octet 14 - Bit 3)
          Read Local Supported Features (Octet 14 - Bit 5)
          Read BD ADDR (Octet 15 - Bit 1)
          Read RSSI (Octet 15 - Bit 5)
          Set Event Mask Page 2 (Octet 22 - Bit 2)
          LE Set Event Mask (Octet 25 - Bit 0)
          LE Read Buffer Size (Octet 25 - Bit 1)
          LE Read Local Supported Features (Octet 25 - Bit 2)
          LE Set Random Address (Octet 25 - Bit 4)
          LE Set Advertising Parameters (Octet 25 - Bit 5)
          LE Read Advertising Channel TX Power (Octet 25 - Bit 6)
          LE Set Advertising Data (Octet 25 - Bit 7)
          LE Set Scan Response Data (Octet 26 - Bit 0)
          LE Set Advertise Enable (Octet 26 - Bit 1)
          LE Set Scan Parameters (Octet 26 - Bit 2)
          LE Set Scan Enable (Octet 26 - Bit 3)
          LE Create Connection (Octet 26 - Bit 4)
          LE Create Connection Cancel (Octet 26 - Bit 5)
          LE Read Accept List Size (Octet 26 - Bit 6)
          LE Clear Accept List (Octet 26 - Bit 7)
          LE Add Device To Accept List (Octet 27 - Bit 0)
          LE Remove Device From Accept List (Octet 27 - Bit 1)
          LE Connection Update (Octet 27 - Bit 2)
          LE Set Host Channel Classification (Octet 27 - Bit 3)
          LE Read Channel Map (Octet 27 - Bit 4)
          LE Read Remote Used Features (Octet 27 - Bit 5)
          LE Encrypt (Octet 27 - Bit 6)
          LE Rand (Octet 27 - Bit 7)
          LE Start Encryption (Octet 28 - Bit 0)
          LE Long Term Key Request Reply (Octet 28 - Bit 1)
          LE Long Term Key Request Neg Reply (Octet 28 - Bit 2)
          LE Read Supported States (Octet 28 - Bit 3)
          LE Receiver Test (Octet 28 - Bit 4)
          LE Transmitter Test (Octet 28 - Bit 5)
          LE Test End (Octet 28 - Bit 6)
          Read Authenticated Payload Timeout (Octet 32 - Bit 4)
          Write Authenticated Payload Timeout (Octet 32 - Bit 5)
          LE Set Data Length (Octet 33 - Bit 6)
          LE Read Suggested Default Data Length (Octet 33 - Bit 7)
          LE Write Suggested Default Data Length (Octet 34 - Bit 0)
          LE Add Device To Resolving List (Octet 34 - Bit 3)
          LE Remove Device From Resolving List (Octet 34 - Bit 4)
          LE Clear Resolving List (Octet 34 - Bit 5)
          LE Read Resolving List Size (Octet 34 - Bit 6)
          LE Set Address Resolution Enable (Octet 35 - Bit 1)
          LE Set Resolvable Private Address Timeout (Octet 35 - Bit 2)
          LE Read Maximum Data Length (Octet 35 - Bit 3)
          LE Read PHY (Octet 35 - Bit 4)
          LE Set Default PHY (Octet 35 - Bit 5)
          LE Set PHY (Octet 35 - Bit 6)
          LE Enhanced Receiver Test (Octet 35 - Bit 7)
          LE Enhanced Transmitter Test (Octet 36 - Bit 0)
          LE Set Advertising Set Random Address (Octet 36 - Bit 1)
          LE Set Extended Advertising Parameters (Octet 36 - Bit 2)
          LE Set Extended Advertising Data (Octet 36 - Bit 3)
          LE Set Extended Scan Response Data (Octet 36 - Bit 4)
          LE Set Extended Advertising Enable (Octet 36 - Bit 5)
          LE Read Maximum Advertising Data Length (Octet 36 - Bit 6)
          LE Read Number of Supported Advertising Sets (Octet 36 - Bit 7)
          LE Remove Advertising Set (Octet 37 - Bit 0)
          LE Clear Advertising Sets (Octet 37 - Bit 1)
          LE Set Periodic Advertising Parameters (Octet 37 - Bit 2)
          LE Set Periodic Advertising Data (Octet 37 - Bit 3)
          LE Set Periodic Advertising Enable (Octet 37 - Bit 4)
          LE Set Extended Scan Parameters (Octet 37 - Bit 5)
          LE Set Extended Scan Enable (Octet 37 - Bit 6)
          LE Extended Create Connection (Octet 37 - Bit 7)
          LE Periodic Advertising Create Sync (Octet 38 - Bit 0)
          LE Periodic Advertising Create Sync Cancel (Octet 38 - Bit 1)
          LE Periodic Advertising Terminate Sync (Octet 38 - Bit 2)
          LE Add Device To Periodic Advertiser List (Octet 38 - Bit 3)
          LE Remove Device From Periodic Advertiser List (Octet 38 - Bit 4)
          LE Clear Periodic Advertiser List (Octet 38 - Bit 5)
          LE Read Periodic Advertiser List Size (Octet 38 - Bit 6)
          LE Read Transmit Power (Octet 38 - Bit 7)
          LE Read RF Path Compensation (Octet 39 - Bit 0)
          LE Write RF Path Compensation (Octet 39 - Bit 1)
          LE Set Privacy Mode (Octet 39 - Bit 2)
          LE Periodic Advertising Receive Enable (Octet 40 - Bit 5)
          LE Periodic Advertising Sync Transfer (Octet 40 - Bit 6)
          LE Periodic Advertising Set Info Transfer (Octet 40 - Bit 7)
          LE Periodic Advertising Sync Transfer Parameters (Octet 41 - Bit 0)
          LE Set Default Periodic Advertisng Sync Transfer Parameters (Octet 41 - Bit 1)
          LE Read Buffer v2 (Octet 41 - Bit 5)
          LE Read ISO TX Sync (Octet 41 - Bit 6)
          LE Set Connected Isochronous Group Parameters (Octet 41 - Bit 7)
          LE Set Connected Isochronous Group Parameters Test (Octet 42 - Bit 0)
          LE Create Connected Isochronous Stream (Octet 42 - Bit 1)
          LE Remove Connected Isochronous Group (Octet 42 - Bit 2)
          LE Accept Connected Isochronous Stream Request (Octet 42 - Bit 3)
          LE Reject Connected Isochronous Stream Request (Octet 42 - Bit 4)
          LE Create Broadcast Isochronous Group (Octet 42 - Bit 5)
          LE Create Broadcast Isochronous Group Test (Octet 42 - Bit 6)
          LE Terminate Broadcast Isochronous Group (Octet 42 - Bit 7)
          LE Broadcast Isochronous Group Create Sync (Octet 43 - Bit 0)
          LE Broadcast Isochronous Group Terminate Sync (Octet 43 - Bit 1)
          LE Request Peer SCA (Octet 43 - Bit 2)
          LE Setup Isochronous Data Path (Octet 43 - Bit 3)
          LE Remove Isochronous Data Path (Octet 43 - Bit 4)
          LE Isochronous Transmit Test (Octet 43 - Bit 5)
          LE Isochronous Receive Test (Octet 43 - Bit 6)
          LE Isochronous Read Test Counters (Octet 43 - Bit 7)
          LE Isochronous Read Test Counters (Octet 44 - Bit 0)
          LE Set Host Feature (Octet 44 - Bit 1)
          Octet 44 - Bit 2 
          Octet 45 - Bit 6 
          Octet 46 - Bit 0 
          Octet 46 - Bit 1 
          Octet 46 - Bit 2 
< HCI Command: Host Buffer Size (0x03|0x0033) plen 7         #9 [hci1] 0.224270
        ACL MTU: 255  ACL max packet: 16
        SCO MTU: 0    SCO max packet: 0
> HCI Event: Command Complete (0x0e) plen 4                 #10 [hci1] 0.224740
      Host Buffer Size (0x03|0x0033) ncmd 1
        Status: Success (0x00)
< HCI Command: Set Controller To Ho.. (0x03|0x0031) plen 1  #11 [hci1] 0.244266
        Flow control: ACL Data Packets (0x01)
> HCI Event: Command Complete (0x0e) plen 4                 #12 [hci1] 0.244714
      Set Controller To Host Flow Control (0x03|0x0031) ncmd 1
        Status: Success (0x00)
< HCI Command: LE Read Local Suppor.. (0x08|0x0003) plen 0  #13 [hci1] 0.264265
> HCI Event: Command Complete (0x0e) plen 12                #14 [hci1] 0.264768
      LE Read Local Supported Features (0x08|0x0003) ncmd 1
        Status: Success (0x00)
        Features: 0xfd 0x79 0x00 0xf7 0x30 0x01 0x00 0x00
          LE Encryption
          Extended Reject Indication
          Peripheral-initiated Features Exchange
          LE Ping
          LE Data Packet Length Extension
          LL Privacy
          Extended Scanner Filter Policies
          LE 2M PHY
          LE Coded PHY
          LE Extended Advertising
          LE Periodic Advertising
          Channel Selection Algorithm #2
          Periodic Advertising Sync Transfer - Sender
          Periodic Advertising Sync Transfer - Recipient
          Sleep Clock Accuracy Updates
          Connected Isochronous Stream - Central
          Connected Isochronous Stream - Peripheral
          Isochronous Broadcaster
          Synchronized Receiver
          Periodic Advertising ADI support
          Connection Subrating
          Unknown features (0x0000010000000000)
< HCI Command: LE Set Host Feature (0x08|0x0074) plen 2     #15 [hci1] 0.284254
        Bit Number: 32
          Connected Isochronous Stream (Host Support)
        Bit Value: 1
> HCI Event: Command Complete (0x0e) plen 4                 #16 [hci1] 0.284633
      LE Set Host Feature (0x08|0x0074) ncmd 1
        Status: Success (0x00)
< HCI Command: LE Read Buffer v2 (0x08|0x0060) plen 0       #17 [hci1] 0.304259
> HCI Event: Command Complete (0x0e) plen 10                #18 [hci1] 0.304739
      LE Read Buffer v2 (0x08|0x0060) ncmd 1
        Status: Success (0x00)
        ACL MTU: 27
        ACL max packet: 3
        ISO MTU: 318
        ISO max packet: 3
< HCI Command: LE Read Maximum Adve.. (0x08|0x003a) plen 0  #19 [hci1] 0.324365
> HCI Event: Command Complete (0x0e) plen 6                 #20 [hci1] 0.324858
      LE Read Maximum Advertising Data Length (0x08|0x003a) ncmd 1
        Status: Success (0x00)
        Max length: 1650
< HCI Command: LE Read Supported St.. (0x08|0x001c) plen 0  #21 [hci1] 0.344286
> HCI Event: Command Complete (0x0e) plen 12                #22 [hci1] 0.344763
      LE Read Supported States (0x08|0x001c) ncmd 1
        Status: Success (0x00)
        States: 0x000003ff3e0306ff
          Non-connectable Advertising State
          Scannable Advertising State
          Connectable Advertising State
          High Duty Cycle Directed Advertising State
          Passive Scanning State
          Active Scanning State
          Initiating State
            and Connection State (Central Role)
          Connection State (Peripheral Role)
          Scannable Advertising State
            and Passive Scanning State
          Connectable Advertising State
            and Passive Scanning State
          Non-connectable Advertising State
            and Initiating State
          Scannable Advertising State
            and Initiating State
          Active Scanning State
            and Connection State (Central Role)
          Passive Scanning State
            and Connection State (Peripheral Role)
          Active Scanning State
            and Connection State (Peripheral Role)
          Initiating State
            and Connection State (Central Role)
            and Central Role & Central Role
          Low Duty Cycle Directed Advertising State
          Connectable Advertising State
            and Initiating State
            and Central Role & Peripheral Role
          High Duty Cycle Directed Advertising State
            and Initiating State
            and Central Role & Peripheral Role
          Low Duty Cycle Directed Advertising State
            and Initiating State
            and Central Role & Peripheral Role
          Connectable Advertising State
            and Connection State (Central Role)
            and Central Role & Peripheral Role
          High Duty Cycle Directed Advertising State
            and Connection State (Central Role)
            and Central Role & Peripheral Role
          Low Duty Cycle Directed Advertising State
            and Connection State (Central Role)
            and Central Role & Peripheral Role
          Connectable Advertising State
            and Connection State (Peripheral Role)
            and Central Role & Peripheral Role
          High Duty Cycle Directed Advertising State
            and Connection State (Peripheral Role)
            and Peripheral Role & Peripheral Role
          Low Duty Cycle Directed Advertising State
            and Connection State (Peripheral Role)
            and Peripheral Role & Peripheral Role
          Initiating State
            and Connection State (Peripheral Role)
            and Central Role & Peripheral Role
< HCI Command: LE Read Maximum Data.. (0x08|0x002f) plen 0  #23 [hci1] 0.364280
> HCI Event: Command Complete (0x0e) plen 12                #24 [hci1] 0.364791
      LE Read Maximum Data Length (0x08|0x002f) ncmd 1
        Status: Success (0x00)
        Max TX octets: 251
        Max TX time: 2704
        Max RX octets: 251
        Max RX time: 2704
< HCI Command: LE Write Suggested D.. (0x08|0x0024) plen 4  #25 [hci1] 0.384266
        TX octets: 251
        TX time: 2704
> HCI Event: Command Complete (0x0e) plen 4                 #26 [hci1] 0.384742
      LE Write Suggested Default Data Length (0x08|0x0024) ncmd 1
        Status: Success (0x00)
< HCI Command: LE Read Resolving Li.. (0x08|0x002a) plen 0  #27 [hci1] 0.404287
> HCI Event: Command Complete (0x0e) plen 5                 #28 [hci1] 0.404721
      LE Read Resolving List Size (0x08|0x002a) ncmd 1
        Status: Success (0x00)
        Size: 8
< HCI Command: LE Set Event Mask (0x08|0x0001) plen 8       #29 [hci1] 0.424301
        Mask: 0x000002023f87fa5e
          LE Advertising Report
          LE Connection Update Complete
          LE Read Remote Used Features Complete
          LE Long Term Key Request
          LE Data Length Change
          LE Enhanced Connection Complete
          LE PHY Update Complete
          LE Extended Advertising Report
          LE Periodic Advertising Sync Established
          LE Periodic Advertising Report
          LE Periodic Advertising Sync Lost
          LE Extended Scan Timeout
          LE Extended Advertising Set Terminated
          LE Scan Request Received
          LE Periodic Advertising Sync Transfer Rvc
          LE CIS Established
          LE CIS Request
          LE Create BIG Complete
          LE Terminate BIG Complete
          LE BIG Sync Estabilished Complete
          LE BIG Sync Lost
          LE BIG Info Advertising Report
          Unknown mask (0x0000020000000000)
> HCI Event: Command Complete (0x0e) plen 4                 #30 [hci1] 0.424814
      LE Set Event Mask (0x08|0x0001) ncmd 1
        Status: Success (0x00)
< HCI Command: Set Event Mask (0x03|0x0001) plen 8          #31 [hci1] 0.444262
        Mask: 0x2000800002008890
          Disconnection Complete
          Encryption Change
          Read Remote Version Information Complete
          Hardware Error
          Data Buffer Overflow
          Encryption Key Refresh Complete
          LE Meta
> HCI Event: Command Complete (0x0e) plen 4                 #32 [hci1] 0.444777
      Set Event Mask (0x03|0x0001) ncmd 1
        Status: Success (0x00)
< HCI Command: Read BD ADDR (0x04|0x0009) plen 0            #33 [hci1] 2.934379
> HCI Event: Command Complete (0x0e) plen 10                #34 [hci1] 2.934828
      Read BD ADDR (0x04|0x0009) ncmd 1
        Status: Success (0x00)
        Address: 00:00:00:00:00:00 (OUI 00-00-00)
< HCI Command: LE Set Extended Adv.. (0x08|0x0036) plen 25  #35 [hci1] 2.944461
        Handle: 0x00
        Properties: 0x0010
          Use legacy advertising PDUs: ADV_NONCONN_IND
        Min advertising interval: 20.000 msec (0x0020)
        Max advertising interval: 20.000 msec (0x0020)
        Channel map: 37, 38, 39 (0x07)
        Own address type: Random (0x01)
        Peer address type: Public (0x00)
        Peer address: 00:00:00:00:00:00 (OUI 00-00-00)
        Filter policy: Allow Scan Request from Any, Allow Connect Request from Any (0x00)
        TX power: Host has no preference (0x7f)
        Primary PHY: LE 1M (0x01)
        Secondary max skip: 0x00
        Secondary PHY: LE 1M (0x01)
        SID: 0x00
        Scan request notifications: Disabled (0x00)
> HCI Event: Command Complete (0x0e) plen 5                 #36 [hci1] 2.945242
      LE Set Extended Advertising Parameters (0x08|0x0036) ncmd 1
        Status: Success (0x00)
        TX power (selected): 0 dbm (0x00)
< HCI Command: LE Set Advertising S.. (0x08|0x0035) plen 7  #37 [hci1] 2.964294
        Advertising handle: 0x00
        Advertising random address: 33:D8:56:AF:11:52 (Non-Resolvable)
> HCI Event: Command Complete (0x0e) plen 4                 #38 [hci1] 2.964861
      LE Set Advertising Set Random Address (0x08|0x0035) ncmd 1
        Status: Success (0x00)
< HCI Command: LE Set Random Address (0x08|0x0005) plen 6   #39 [hci1] 2.984317
        Address: 04:C8:1E:D2:64:DA (Non-Resolvable)
> HCI Event: Command Complete (0x0e) plen 4                 #40 [hci1] 2.984803
      LE Set Random Address (0x08|0x0005) ncmd 1
        Status: Success (0x00)
< HCI Command: LE Set Extended Scan.. (0x08|0x0041) plen 8  #41 [hci1] 3.004379
        Own address type: Random (0x01)
        Filter policy: Accept all advertisement (0x00)
        PHYs: 0x01
        Entry 0: LE 1M
          Type: Passive (0x00)
          Interval: 30.000 msec (0x0030)
          Window: 30.000 msec (0x0030)
> HCI Event: Command Complete (0x0e) plen 4                 #42 [hci1] 3.004918
      LE Set Extended Scan Parameters (0x08|0x0041) ncmd 1
        Status: Success (0x00)
< HCI Command: LE Set Extended Scan.. (0x08|0x0042) plen 6  #43 [hci1] 3.024340
        Extended scan: Enabled (0x01)
        Filter duplicates: Disabled (0x00)
        Duration: 0 msec (0x0000)
        Period: 0.00 sec (0x0000)
> HCI Event: Command Complete (0x0e) plen 4                 #44 [hci1] 3.024925
      LE Set Extended Scan Enable (0x08|0x0042) ncmd 1
        Status: Success (0x00)
< HCI Command: LE Set Advertising S.. (0x08|0x0035) plen 7  #45 [hci1] 3.044499
        Advertising handle: 0x00
        Advertising random address: E0:89:9F:67:02:4D (Static)
> HCI Event: Command Complete (0x0e) plen 4                 #46 [hci1] 3.045072
      LE Set Advertising Set Random Address (0x08|0x0035) ncmd 1
        Status: Success (0x00)
< HCI Command: LE Set Extended Adv.. (0x08|0x0036) plen 25  #47 [hci1] 3.064336
        Handle: 0x00
        Properties: 0x0013
          Connectable
          Scannable
          Use legacy advertising PDUs: ADV_IND
        Min advertising interval: 100.000 msec (0x00a0)
        Max advertising interval: 150.000 msec (0x00f0)
        Channel map: 37, 38, 39 (0x07)
        Own address type: Random (0x01)
        Peer address type: Public (0x00)
        Peer address: 00:00:00:00:00:00 (OUI 00-00-00)
        Filter policy: Allow Scan Request from Any, Allow Connect Request from Any (0x00)
        TX power: Host has no preference (0x7f)
        Primary PHY: LE 1M (0x01)
        Secondary max skip: 0x00
        Secondary PHY: LE 1M (0x01)
        SID: 0x00
        Scan request notifications: Disabled (0x00)
> HCI Event: Command Complete (0x0e) plen 5                 #48 [hci1] 3.065129
      LE Set Extended Advertising Parameters (0x08|0x0036) ncmd 1
        Status: Success (0x00)
        TX power (selected): 0 dbm (0x00)
< HCI Command: LE Set Extended Adv.. (0x08|0x0037) plen 33  #49 [hci1] 3.084299
        Handle: 0x00
        Operation: Complete extended advertising data (0x03)
        Fragment preference: Minimize fragmentation (0x01)
        Data length: 0x1d
        Flags: 0x06
          LE General Discoverable Mode
          BR/EDR Not Supported
        16-bit Service UUIDs (complete): 1 entry
          Mesh Provisioning (0x1827)
        Service Data: Mesh Provisioning (0x1827)
          Data: 812766a5253d40b1864b6da6285fd4b30000
> HCI Event: Command Complete (0x0e) plen 4                 #50 [hci1] 3.085159
      LE Set Extended Advertising Data (0x08|0x0037) ncmd 1
        Status: Success (0x00)
< HCI Command: LE Set Extended Sca.. (0x08|0x0038) plen 20  #51 [hci1] 3.104342
        Handle: 0x00
        Operation: Complete scan response data (0x03)
        Fragment preference: Minimize fragmentation (0x01)
        Data length: 0x10
        Unknown EIR field 0x24: 546573746572
        Name (complete): Tester
> HCI Event: Command Complete (0x0e) plen 4                 #52 [hci1] 3.104956
      LE Set Extended Scan Response Data (0x08|0x0038) ncmd 1
        Status: Success (0x00)
< HCI Command: LE Set Extended Adve.. (0x08|0x0039) plen 6  #53 [hci1] 3.124336
        Extended advertising: Enabled (0x01)
        Number of sets: 1 (0x01)
        Entry 0
          Handle: 0x00
          Duration: 60000 ms (0x1770)
          Max ext adv events: 0
> HCI Event: Command Complete (0x0e) plen 4                 #54 [hci1] 3.124913
      LE Set Extended Advertising Enable (0x08|0x0039) ncmd 1
        Status: Success (0x00)
< HCI Command: LE Set Extended Adve.. (0x08|0x0039) plen 6  #55 [hci1] 3.144364
        Extended advertising: Disabled (0x00)
        Number of sets: 1 (0x01)
        Entry 0
          Handle: 0x00
          Duration: 0 ms (0x00)
          Max ext adv events: 0
> HCI Event: Command Complete (0x0e) plen 4                 #56 [hci1] 3.144955
      LE Set Extended Advertising Enable (0x08|0x0039) ncmd 1
        Status: Success (0x00)
< HCI Command: LE Set Advertising S.. (0x08|0x0035) plen 7  #57 [hci1] 3.164316
        Advertising handle: 0x00
        Advertising random address: 1A:23:BC:86:82:5E (Non-Resolvable)
> HCI Event: Command Complete (0x0e) plen 4                 #58 [hci1] 3.164780
      LE Set Advertising Set Random Address (0x08|0x0035) ncmd 1
        Status: Success (0x00)
< HCI Command: LE Set Extended Adv.. (0x08|0x0036) plen 25  #59 [hci1] 3.184341
        Handle: 0x00
        Properties: 0x0010
          Use legacy advertising PDUs: ADV_NONCONN_IND
        Min advertising interval: 20.000 msec (0x0020)
        Max advertising interval: 20.000 msec (0x0020)
        Channel map: 37, 38, 39 (0x07)
        Own address type: Random (0x01)
        Peer address type: Public (0x00)
        Peer address: 00:00:00:00:00:00 (OUI 00-00-00)
        Filter policy: Allow Scan Request from Any, Allow Connect Request from Any (0x00)
        TX power: Host has no preference (0x7f)
        Primary PHY: LE 1M (0x01)
        Secondary max skip: 0x00
        Secondary PHY: LE 1M (0x01)
        SID: 0x00
        Scan request notifications: Disabled (0x00)
> HCI Event: Command Complete (0x0e) plen 5                 #60 [hci1] 3.185139
      LE Set Extended Advertising Parameters (0x08|0x0036) ncmd 1
        Status: Success (0x00)
        TX power (selected): 0 dbm (0x00)
< HCI Command: LE Set Extended Adv.. (0x08|0x0037) plen 29  #61 [hci1] 3.204327
        Handle: 0x00
        Operation: Complete extended advertising data (0x03)
        Fragment preference: Minimize fragmentation (0x01)
        Data length: 0x19
        Mesh Beacon: 00812766a5253d40b1864b6da6285fd4b30002a30a8708
          Unprovisioned Device Beacon (0x00)
          Device UUID: 812766a5253d40b1864b6da6285fd4b3
          OOB Information: 0x0002
            Electronic / URI
          URI Hash: 0xa30a8708
> HCI Event: Command Complete (0x0e) plen 4                 #62 [hci1] 3.205117
      LE Set Extended Advertising Data (0x08|0x0037) ncmd 1
        Status: Success (0x00)
< HCI Command: LE Set Extended Adve.. (0x08|0x0039) plen 6  #63 [hci1] 3.224319
        Extended advertising: Enabled (0x01)
        Number of sets: 1 (0x01)
        Entry 0
          Handle: 0x00
          Duration: 0 ms (0x00)
          Max ext adv events: 3
> HCI Event: Command Complete (0x0e) plen 4                 #64 [hci1] 3.224873
      LE Set Extended Advertising Enable (0x08|0x0039) ncmd 1
        Status: Success (0x00)
> HCI Event: LE Meta Event (0x3e) plen 50                   #65 [hci1] 3.256948
      LE Extended Advertising Report (0x0d)
        Num reports: 1
        Entry 0
          Event type: 0x0010
            Props: 0x0010
              Use legacy advertising PDUs
            Data status: [0;32mComplete[0m
          Legacy PDU Type: ADV_NONCONN_IND (0x0010)
          Address type: Public (0x00)
          Address: DF:A9:FF:F6:B1:1A (OUI DF-A9-FF)
          Primary PHY: LE 1M
          Secondary PHY: No packets
          SID: no ADI field (0xff)
          TX power: 127 dBm
          RSSI: -26 dBm (0xe6)
          Periodic advertising interval: 0.00 msec (0x0000)
          Direct address type: Reserved (0xff)
          Direct address: 00-00-00-00-00-00
          Data length: 0x18
        17 29 09 7c 92 31 00 03 81 27 66 a5 25 3d 40 b1  .).|.1...'f.%=@.
        86 4b 6d a6 28 5f d4 b3                          .Km.(_..        
        Mesh Provisioning: 097c92310003812766a5253d40b1864b6da6285fd4b3
          Link ID: 0x097c9231
          Transaction Number: 0
          Provisioning Bearer Control (0x03)
          Link Open (0x00)
          Device UUID: 03812766a5253d40b1864b6da6285fd4
> HCI Event: LE Meta Event (0x3e) plen 6                    #66 [hci1] 3.285164
      LE Advertising Set Terminated (0x12)
        Status: Limit Reached (0x43)
        Handle: 0
        Connection handle: 65535
        Number of completed extended advertising events: 3
> HCI Event: LE Meta Event (0x3e) plen 50                   #67 [hci1] 3.288428
      LE Extended Advertising Report (0x0d)
        Num reports: 1
        Entry 0
          Event type: 0x0010
            Props: 0x0010
              Use legacy advertising PDUs
            Data status: [0;32mComplete[0m
          Legacy PDU Type: ADV_NONCONN_IND (0x0010)
          Address type: Public (0x00)
          Address: DF:A9:FF:F6:B1:1A (OUI DF-A9-FF)
          Primary PHY: LE 1M
          Secondary PHY: No packets
          SID: no ADI field (0xff)
          TX power: 127 dBm
          RSSI: -32 dBm (0xe0)
          Periodic advertising interval: 0.00 msec (0x0000)
          Direct address type: Reserved (0xff)
          Direct address: 00-00-00-00-00-00
          Data length: 0x18
        17 29 09 7c 92 31 00 03 81 27 66 a5 25 3d 40 b1  .).|.1...'f.%=@.
        86 4b 6d a6 28 5f d4 b3                          .Km.(_..        
        Mesh Provisioning: 097c92310003812766a5253d40b1864b6da6285fd4b3
          Link ID: 0x097c9231
          Transaction Number: 0
          Provisioning Bearer Control (0x03)
          Link Open (0x00)
          Device UUID: 03812766a5253d40b1864b6da6285fd4
< HCI Command: LE Set Extended Adv.. (0x08|0x0037) plen 12  #68 [hci1] 3.304497
        Handle: 0x00
        Operation: Complete extended advertising data (0x03)
        Fragment preference: Minimize fragmentation (0x01)
        Data length: 0x08
        Unknown EIR field 0x24: 546573746572
> HCI Event: Command Complete (0x0e) plen 4                 #69 [hci1] 3.305135
      LE Set Extended Advertising Data (0x08|0x0037) ncmd 1
        Status: Success (0x00)
> HCI Event: LE Meta Event (0x3e) plen 50                   #70 [hci1] 3.319926
      LE Extended Advertising Report (0x0d)
        Num reports: 1
        Entry 0
          Event type: 0x0010
            Props: 0x0010
              Use legacy advertising PDUs
            Data status: [0;32mComplete[0m
          Legacy PDU Type: ADV_NONCONN_IND (0x0010)
          Address type: Public (0x00)
          Address: DF:A9:FF:F6:B1:1A (OUI DF-A9-FF)
          Primary PHY: LE 1M
          Secondary PHY: No packets
          SID: no ADI field (0xff)
          TX power: 127 dBm
          RSSI: -26 dBm (0xe6)
          Periodic advertising interval: 0.00 msec (0x0000)
          Direct address type: Reserved (0xff)
          Direct address: 00-00-00-00-00-00
          Data length: 0x18
        17 29 09 7c 92 31 00 03 81 27 66 a5 25 3d 40 b1  .).|.1...'f.%=@.
        86 4b 6d a6 28 5f d4 b3                          .Km.(_..        
        Mesh Provisioning: 097c92310003812766a5253d40b1864b6da6285fd4b3
          Link ID: 0x097c9231
          Transaction Number: 0
          Provisioning Bearer Control (0x03)
          Link Open (0x00)
          Device UUID: 03812766a5253d40b1864b6da6285fd4
< HCI Command: LE Set Advertising S.. (0x08|0x0035) plen 7  #71 [hci1] 3.324518
        Advertising handle: 0x00
        Advertising random address: 38:AC:A2:24:34:0C (Non-Resolvable)
> HCI Event: Command Complete (0x0e) plen 4                 #72 [hci1] 3.325059
      LE Set Advertising Set Random Address (0x08|0x0035) ncmd 1
        Status: Success (0x00)
< HCI Command: LE Set Extended Adve.. (0x08|0x0039) plen 6  #73 [hci1] 3.344650
        Extended advertising: Enabled (0x01)
        Number of sets: 1 (0x01)
        Entry 0
          Handle: 0x00
          Duration: 0 ms (0x00)
          Max ext adv events: 3
> HCI Event: Command Complete (0x0e) plen 4                 #74 [hci1] 3.345148
      LE Set Extended Advertising Enable (0x08|0x0039) ncmd 1
        Status: Success (0x00)
> HCI Event: LE Meta Event (0x3e) plen 6                    #75 [hci1] 3.410331
      LE Advertising Set Terminated (0x12)
        Status: Limit Reached (0x43)
        Handle: 0
        Connection handle: 65535
        Number of completed extended advertising events: 3
< HCI Command: LE Set Extended Adv.. (0x08|0x0037) plen 12  #76 [hci1] 3.424358
        Handle: 0x00
        Operation: Complete extended advertising data (0x03)
        Fragment preference: Minimize fragmentation (0x01)
        Data length: 0x08
        Mesh Provisioning: 097c92310007
          Link ID: 0x097c9231
          Transaction Number: 0
          Provisioning Bearer Control (0x03)
          Link Ack (0x01)
> HCI Event: Command Complete (0x0e) plen 4                 #77 [hci1] 3.424947
      LE Set Extended Advertising Data (0x08|0x0037) ncmd 1
        Status: Success (0x00)
< HCI Command: LE Set Advertising S.. (0x08|0x0035) plen 7  #78 [hci1] 3.444341
        Advertising handle: 0x00
        Advertising random address: 1B:4A:5C:A4:71:FD (Non-Resolvable)
> HCI Event: Command Complete (0x0e) plen 4                 #79 [hci1] 3.444828
      LE Set Advertising Set Random Address (0x08|0x0035) ncmd 1
        Status: Success (0x00)
< HCI Command: LE Set Extended Adve.. (0x08|0x0039) plen 6  #80 [hci1] 3.464293
        Extended advertising: Enabled (0x01)
        Number of sets: 1 (0x01)
        Entry 0
          Handle: 0x00
          Duration: 0 ms (0x00)
          Max ext adv events: 3
> HCI Event: Command Complete (0x0e) plen 4                 #81 [hci1] 3.464787
      LE Set Extended Advertising Enable (0x08|0x0039) ncmd 1
        Status: Success (0x00)
> HCI Event: LE Meta Event (0x3e) plen 39                   #82 [hci1] 3.498887
      LE Extended Advertising Report (0x0d)
        Num reports: 1
        Entry 0
          Event type: 0x0010
            Props: 0x0010
              Use legacy advertising PDUs
            Data status: [0;32mComplete[0m
          Legacy PDU Type: ADV_NONCONN_IND (0x0010)
          Address type: Public (0x00)
          Address: DF:A9:FF:F6:B1:1A (OUI DF-A9-FF)
          Primary PHY: LE 1M
          Secondary PHY: No packets
          SID: no ADI field (0xff)
          TX power: 127 dBm
          RSSI: -26 dBm (0xe6)
          Periodic advertising interval: 0.00 msec (0x0000)
          Direct address type: Reserved (0xff)
          Direct address: 00-00-00-00-00-00
          Data length: 0x0d
        0c 29 09 7c 92 31 00 00 00 02 f7 00 02           .).|.1.......   
        Mesh Provisioning: 097c923100000002f70002
          Link ID: 0x097c9231
          Transaction Number: 0
          Transaction Start (0x00)
          SeqN: 0
          TotalLength: 2
          FCS: 0xf7
          Data: 0002
        02                                               .               
> HCI Event: LE Meta Event (0x3e) plen 6                    #83 [hci1] 3.515363
      LE Advertising Set Terminated (0x12)
        Status: Limit Reached (0x43)
        Handle: 0
        Connection handle: 65535
        Number of completed extended advertising events: 3
< HCI Command: LE Set Extended Adv.. (0x08|0x0037) plen 12  #84 [hci1] 3.574330
        Handle: 0x00
        Operation: Complete extended advertising data (0x03)
        Fragment preference: Minimize fragmentation (0x01)
        Data length: 0x08
        Mesh Provisioning: 097c92310001
          Link ID: 0x097c9231
          Transaction Number: 0
          Transaction Acknowledgment (0x01)
> HCI Event: Command Complete (0x0e) plen 4                 #85 [hci1] 3.574889
      LE Set Extended Advertising Data (0x08|0x0037) ncmd 1
        Status: Success (0x00)
< HCI Command: LE Set Advertising S.. (0x08|0x0035) plen 7  #86 [hci1] 3.584260
        Advertising handle: 0x00
        Advertising random address: 3B:09:45:E9:58:BD (Non-Resolvable)
> HCI Event: Command Complete (0x0e) plen 4                 #87 [hci1] 3.584795
      LE Set Advertising Set Random Address (0x08|0x0035) ncmd 1
        Status: Success (0x00)
< HCI Command: LE Set Extended Adve.. (0x08|0x0039) plen 6  #88 [hci1] 3.604328
        Extended advertising: Enabled (0x01)
        Number of sets: 1 (0x01)
        Entry 0
          Handle: 0x00
          Duration: 0 ms (0x00)
          Max ext adv events: 3
> HCI Event: Command Complete (0x0e) plen 4                 #89 [hci1] 3.604889
      LE Set Extended Advertising Enable (0x08|0x0039) ncmd 1
        Status: Success (0x00)
> HCI Event: LE Meta Event (0x3e) plen 6                    #90 [hci1] 3.673878
      LE Advertising Set Terminated (0x12)
        Status: Limit Reached (0x43)
        Handle: 0
        Connection handle: 65535
        Number of completed extended advertising events: 3
< HCI Command: LE Set Extended Adv.. (0x08|0x0037) plen 27  #91 [hci1] 3.724395
        Handle: 0x00
        Operation: Complete extended advertising data (0x03)
        Fragment preference: Minimize fragmentation (0x01)
        Data length: 0x17
        Mesh Provisioning: 097c92318000000c72010300030001010008010004
          Link ID: 0x097c9231
          Transaction Number: 128
          Transaction Start (0x00)
          SeqN: 0
          TotalLength: 12
          FCS: 0x72
          Data: 010300030001010008010004
        03 00 03 00 01 01 00 08 01 00 04                 ...........     
> HCI Event: Command Complete (0x0e) plen 4                 #92 [hci1] 3.725128
      LE Set Extended Advertising Data (0x08|0x0037) ncmd 1
        Status: Success (0x00)
< HCI Command: LE Set Advertising S.. (0x08|0x0035) plen 7  #93 [hci1] 3.744342
        Advertising handle: 0x00
        Advertising random address: 3E:52:32:BA:A1:AC (Non-Resolvable)
> HCI Event: Command Complete (0x0e) plen 4                 #94 [hci1] 3.744815
      LE Set Advertising Set Random Address (0x08|0x0035) ncmd 1
        Status: Success (0x00)
< HCI Command: LE Set Extended Adve.. (0x08|0x0039) plen 6  #95 [hci1] 3.764315
        Extended advertising: Enabled (0x01)
        Number of sets: 1 (0x01)
        Entry 0
          Handle: 0x00
          Duration: 0 ms (0x00)
          Max ext adv events: 1
> HCI Event: Command Complete (0x0e) plen 4                 #96 [hci1] 3.764879
      LE Set Extended Advertising Enable (0x08|0x0039) ncmd 1
        Status: Success (0x00)
> HCI Event: LE Meta Event (0x3e) plen 6                    #97 [hci1] 3.776678
      LE Advertising Set Terminated (0x12)
        Status: Limit Reached (0x43)
        Handle: 0
        Connection handle: 65535
        Number of completed extended advertising events: 1
> HCI Event: LE Meta Event (0x3e) plen 34                   #98 [hci1] 3.865219
      LE Extended Advertising Report (0x0d)
        Num reports: 1
        Entry 0
          Event type: 0x0010
            Props: 0x0010
              Use legacy advertising PDUs
            Data status: [0;32mComplete[0m
          Legacy PDU Type: ADV_NONCONN_IND (0x0010)
          Address type: Public (0x00)
          Address: DF:A9:FF:F6:B1:1A (OUI DF-A9-FF)
          Primary PHY: LE 1M
          Secondary PHY: No packets
          SID: no ADI field (0xff)
          TX power: 127 dBm
          RSSI: -32 dBm (0xe0)
          Periodic advertising interval: 0.00 msec (0x0000)
          Direct address type: Reserved (0xff)
          Direct address: 00-00-00-00-00-00
          Data length: 0x08
        07 29 09 7c 92 31 80 01                          .).|.1..        
        Mesh Provisioning: 097c92318001
          Link ID: 0x097c9231
          Transaction Number: 128
          Transaction Acknowledgment (0x01)
> HCI Event: LE Meta Event (0x3e) plen 34                   #99 [hci1] 3.895979
      LE Extended Advertising Report (0x0d)
        Num reports: 1
        Entry 0
          Event type: 0x0010
            Props: 0x0010
              Use legacy advertising PDUs
            Data status: [0;32mComplete[0m
          Legacy PDU Type: ADV_NONCONN_IND (0x0010)
          Address type: Public (0x00)
          Address: DF:A9:FF:F6:B1:1A (OUI DF-A9-FF)
          Primary PHY: LE 1M
          Secondary PHY: No packets
          SID: no ADI field (0xff)
          TX power: 127 dBm
          RSSI: -26 dBm (0xe6)
          Periodic advertising interval: 0.00 msec (0x0000)
          Direct address type: Reserved (0xff)
          Direct address: 00-00-00-00-00-00
          Data length: 0x08
        07 29 09 7c 92 31 80 01                          .).|.1..        
        Mesh Provisioning: 097c92318001
          Link ID: 0x097c9231
          Transaction Number: 128
          Transaction Acknowledgment (0x01)
> HCI Event: LE Meta Event (0x3e) plen 43                  #100 [hci1] 3.965779
      LE Extended Advertising Report (0x0d)
        Num reports: 1
        Entry 0
          Event type: 0x0010
            Props: 0x0010
              Use legacy advertising PDUs
            Data status: [0;32mComplete[0m
          Legacy PDU Type: ADV_NONCONN_IND (0x0010)
          Address type: Public (0x00)
          Address: DF:A9:FF:F6:B1:1A (OUI DF-A9-FF)
          Primary PHY: LE 1M
          Secondary PHY: No packets
          SID: no ADI field (0xff)
          TX power: 127 dBm
          RSSI: -26 dBm (0xe6)
          Periodic advertising interval: 0.00 msec (0x0000)
          Direct address type: Reserved (0xff)
          Direct address: 00-00-00-00-00-00
          Data length: 0x11
        10 29 09 7c 92 31 01 00 00 06 8d 02 01 00 00 00  .).|.1..........
        00                                               .               
        Mesh Provisioning: 097c9231010000068d020100000000
          Link ID: 0x097c9231
          Transaction Number: 1
          Transaction Start (0x00)
          SeqN: 0
          TotalLength: 6
          FCS: 0x8d
          Data: 020100000000
        01 00 00 00 00                                   .....           
< HCI Command: LE Set Extended Ad.. (0x08|0x0037) plen 12  #101 [hci1] 4.034418
        Handle: 0x00
        Operation: Complete extended advertising data (0x03)
        Fragment preference: Minimize fragmentation (0x01)
        Data length: 0x08
        Mesh Provisioning: 097c92310101
          Link ID: 0x097c9231
          Transaction Number: 1
          Transaction Acknowledgment (0x01)
> HCI Event: Command Complete (0x0e) plen 4                #102 [hci1] 4.035036
      LE Set Extended Advertising Data (0x08|0x0037) ncmd 1
        Status: Success (0x00)
< HCI Command: LE Set Advertising... (0x08|0x0035) plen 7  #103 [hci1] 4.044396
        Advertising handle: 0x00
        Advertising random address: 2B:B8:4D:39:74:E3 (Non-Resolvable)
> HCI Event: Command Complete (0x0e) plen 4                #104 [hci1] 4.044873
      LE Set Advertising Set Random Address (0x08|0x0035) ncmd 1
        Status: Success (0x00)
< HCI Command: LE Set Extended Adv.. (0x08|0x0039) plen 6  #105 [hci1] 4.064381
        Extended advertising: Enabled (0x01)
        Number of sets: 1 (0x01)
        Entry 0
          Handle: 0x00
          Duration: 0 ms (0x00)
          Max ext adv events: 3
> HCI Event: Command Complete (0x0e) plen 4                #106 [hci1] 4.064890
      LE Set Extended Advertising Enable (0x08|0x0039) ncmd 1
        Status: Success (0x00)
> HCI Event: LE Meta Event (0x3e) plen 57                  #107 [hci1] 4.098908
      LE Extended Advertising Report (0x0d)
        Num reports: 1
        Entry 0
          Event type: 0x0010
            Props: 0x0010
              Use legacy advertising PDUs
            Data status: [0;32mComplete[0m
          Legacy PDU Type: ADV_NONCONN_IND (0x0010)
          Address type: Public (0x00)
          Address: DF:A9:FF:F6:B1:1A (OUI DF-A9-FF)
          Primary PHY: LE 1M
          Secondary PHY: No packets
          SID: no ADI field (0xff)
          TX power: 127 dBm
          RSSI: -25 dBm (0xe7)
          Periodic advertising interval: 0.00 msec (0x0000)
          Direct address type: Reserved (0xff)
          Direct address: 00-00-00-00-00-00
          Data length: 0x1f
        1e 29 09 7c 92 31 02 08 00 41 ac 03 87 c6 42 5c  .).|.1...A....B\
        fe a9 02 e5 c1 24 28 e9 31 41 08 ac f6 e3 67     .....$(.1A....g 
        Mesh Provisioning: 097c923102080041ac0387c6425cfea902e5c12428e9314108acf6e367
          Link ID: 0x097c9231
          Transaction Number: 2
          Transaction Start (0x00)
          SeqN: 8
          TotalLength: 65
          FCS: 0xac
          Data: 0387c6425cfea902e5c12428e9314108acf6e367
        87 c6 42 5c fe a9 02 e5 c1 24 28 e9 31 41 08 ac  ..B\.....$(.1A..
        f6 e3 67                                         ..g             
> HCI Event: LE Meta Event (0x3e) plen 6                   #108 [hci1] 4.117199
      LE Advertising Set Terminated (0x12)
        Status: Limit Reached (0x43)
        Handle: 0
        Connection handle: 65535
        Number of completed extended advertising events: 3
> HCI Event: LE Meta Event (0x3e) plen 57                  #109 [hci1] 4.161680
      LE Extended Advertising Report (0x0d)
        Num reports: 1
        Entry 0
          Event type: 0x0010
            Props: 0x0010
              Use legacy advertising PDUs
            Data status: [0;32mComplete[0m
          Legacy PDU Type: ADV_NONCONN_IND (0x0010)
          Address type: Public (0x00)
          Address: DF:A9:FF:F6:B1:1A (OUI DF-A9-FF)
          Primary PHY: LE 1M
          Secondary PHY: No packets
          SID: no ADI field (0xff)
          TX power: 127 dBm
          RSSI: -26 dBm (0xe6)
          Periodic advertising interval: 0.00 msec (0x0000)
          Direct address type: Reserved (0xff)
          Direct address: 00-00-00-00-00-00
          Data length: 0x1f
        1e 29 09 7c 92 31 02 06 af 76 f1 a3 68 ce e4 ef  .).|.1...v..h...
        c0 e2 c3 52 d5 91 71 4f 45 bb 42 b0 6e fc 0b     ...R..qOE.B.n.. 
        Mesh Provisioning: 097c92310206af76f1a368cee4efc0e2c352d591714f45bb42b06efc0b
          Link ID: 0x097c9231
          Transaction Number: 2
          Transaction Continuation (0x02)
          SegmentIndex: 1
          Data: af76f1a368cee4efc0e2c352d591714f45bb42b06efc0b
        76 f1 a3 68 ce e4 ef c0 e2 c3 52 d5 91 71 4f 45  v..h......R..qOE
        bb 42 b0 6e fc 0b                                .B.n..          
> HCI Event: LE Meta Event (0x3e) plen 56                  #110 [hci1] 4.217232
      LE Extended Advertising Report (0x0d)
        Num reports: 1
        Entry 0
          Event type: 0x0010
            Props: 0x0010
              Use legacy advertising PDUs
            Data status: [0;32mComplete[0m
          Legacy PDU Type: ADV_NONCONN_IND (0x0010)
          Address type: Public (0x00)
          Address: DF:A9:FF:F6:B1:1A (OUI DF-A9-FF)
          Primary PHY: LE 1M
          Secondary PHY: No packets
          SID: no ADI field (0xff)
          TX power: 127 dBm
          RSSI: -32 dBm (0xe0)
          Periodic advertising interval: 0.00 msec (0x0000)
          Direct address type: Reserved (0xff)
          Direct address: 00-00-00-00-00-00
          Data length: 0x1e
        1d 29 09 7c 92 31 02 0a 2d ea 0d f1 69 b9 77 24  .).|.1..-...i.w$
        d6 3f 35 c7 71 cf 82 aa ec 37 a8 98 c4 da        .?5.q....7....  
        Mesh Provisioning: 097c9231020a2dea0df169b97724d63f35c771cf82aaec37a898c4da
          Link ID: 0x097c9231
          Transaction Number: 2
          Transaction Continuation (0x02)
          SegmentIndex: 2
          Data: 2dea0df169b97724d63f35c771cf82aaec37a898c4da
        ea 0d f1 69 b9 77 24 d6 3f 35 c7 71 cf 82 aa ec  ...i.w$.?5.q....
        37 a8 98 c4 da                                   7....           
< HCI Command: LE Set Extended Ad.. (0x08|0x0037) plen 12  #111 [hci1] 4.264356
        Handle: 0x00
        Operation: Complete extended advertising data (0x03)
        Fragment preference: Minimize fragmentation (0x01)
        Data length: 0x08
        Mesh Provisioning: 097c92310201
          Link ID: 0x097c9231
          Transaction Number: 2
          Transaction Acknowledgment (0x01)
> HCI Event: Command Complete (0x0e) plen 4                #112 [hci1] 4.264979
      LE Set Extended Advertising Data (0x08|0x0037) ncmd 1
        Status: Success (0x00)
< HCI Command: LE Set Advertising... (0x08|0x0035) plen 7  #113 [hci1] 4.284324
        Advertising handle: 0x00
        Advertising random address: 13:43:96:C6:8C:9A (Non-Resolvable)
> HCI Event: Command Complete (0x0e) plen 4                #114 [hci1] 4.284891
      LE Set Advertising Set Random Address (0x08|0x0035) ncmd 1
        Status: Success (0x00)
< HCI Command: LE Set Extended Adv.. (0x08|0x0039) plen 6  #115 [hci1] 4.304360
        Extended advertising: Enabled (0x01)
        Number of sets: 1 (0x01)
        Entry 0
          Handle: 0x00
          Duration: 0 ms (0x00)
          Max ext adv events: 3
> HCI Event: Command Complete (0x0e) plen 4                #116 [hci1] 4.304893
      LE Set Extended Advertising Enable (0x08|0x0039) ncmd 1
        Status: Success (0x00)
> HCI Event: LE Meta Event (0x3e) plen 6                   #117 [hci1] 4.361651
      LE Advertising Set Terminated (0x12)
        Status: Limit Reached (0x43)
        Handle: 0
        Connection handle: 65535
        Number of completed extended advertising events: 3
< HCI Command: LE Set Extended Ad.. (0x08|0x0037) plen 35  #118 [hci1] 4.404370
        Handle: 0x00
        Operation: Complete extended advertising data (0x03)
        Fragment preference: Minimize fragmentation (0x01)
        Data length: 0x1f
        Mesh Provisioning: 097c923181080041fe0376ecad7147444a56ca7fa3a7a5397af3719c5f
          Link ID: 0x097c9231
          Transaction Number: 129
          Transaction Start (0x00)
          SeqN: 8
          TotalLength: 65
          FCS: 0xfe
          Data: 0376ecad7147444a56ca7fa3a7a5397af3719c5f
        76 ec ad 71 47 44 4a 56 ca 7f a3 a7 a5 39 7a f3  v..qGDJV.....9z.
        71 9c 5f                                         q._             
> HCI Event: Command Complete (0x0e) plen 4                #119 [hci1] 4.405254
      LE Set Extended Advertising Data (0x08|0x0037) ncmd 1
        Status: Success (0x00)
< HCI Command: LE Set Advertising... (0x08|0x0035) plen 7  #120 [hci1] 4.424338
        Advertising handle: 0x00
        Advertising random address: 19:9F:EB:5C:2C:F7 (Non-Resolvable)
> HCI Event: Command Complete (0x0e) plen 4                #121 [hci1] 4.424863
      LE Set Advertising Set Random Address (0x08|0x0035) ncmd 1
        Status: Success (0x00)
< HCI Command: LE Set Extended Adv.. (0x08|0x0039) plen 6  #122 [hci1] 4.444331
        Extended advertising: Enabled (0x01)
        Number of sets: 1 (0x01)
        Entry 0
          Handle: 0x00
          Duration: 0 ms (0x00)
          Max ext adv events: 1
> HCI Event: Command Complete (0x0e) plen 4                #123 [hci1] 4.444840
      LE Set Extended Advertising Enable (0x08|0x0039) ncmd 1
        Status: Success (0x00)
> HCI Event: LE Meta Event (0x3e) plen 6                   #124 [hci1] 4.454963
      LE Advertising Set Terminated (0x12)
        Status: Limit Reached (0x43)
        Handle: 0
        Connection handle: 65535
        Number of completed extended advertising events: 1
< HCI Command: LE Set Extended Ad.. (0x08|0x0037) plen 35  #125 [hci1] 4.524356
        Handle: 0x00
        Operation: Complete extended advertising data (0x03)
        Fragment preference: Minimize fragmentation (0x01)
        Data length: 0x1f
        Mesh Provisioning: 097c923181064acfbb11765919fd6c726c7f21d4432fb3a996ca22f636
          Link ID: 0x097c9231
          Transaction Number: 129
          Transaction Continuation (0x02)
          SegmentIndex: 1
          Data: 4acfbb11765919fd6c726c7f21d4432fb3a996ca22f636
        cf bb 11 76 59 19 fd 6c 72 6c 7f 21 d4 43 2f b3  ...vY..lrl.!.C/.
        a9 96 ca 22 f6 36                                ...".6          
> HCI Event: Command Complete (0x0e) plen 4                #126 [hci1] 4.525167
      LE Set Extended Advertising Data (0x08|0x0037) ncmd 1
        Status: Success (0x00)
< HCI Command: LE Set Advertising... (0x08|0x0035) plen 7  #127 [hci1] 4.544329
        Advertising handle: 0x00
        Advertising random address: 08:B1:3D:FC:B6:96 (Non-Resolvable)
> HCI Event: Command Complete (0x0e) plen 4                #128 [hci1] 4.544826
      LE Set Advertising Set Random Address (0x08|0x0035) ncmd 1
        Status: Success (0x00)
< HCI Command: LE Set Extended Adv.. (0x08|0x0039) plen 6  #129 [hci1] 4.564326
        Extended advertising: Enabled (0x01)
        Number of sets: 1 (0x01)
        Entry 0
          Handle: 0x00
          Duration: 0 ms (0x00)
          Max ext adv events: 1
> HCI Event: Command Complete (0x0e) plen 4                #130 [hci1] 4.564878
      LE Set Extended Advertising Enable (0x08|0x0039) ncmd 1
        Status: Success (0x00)
> HCI Event: LE Meta Event (0x3e) plen 6                   #131 [hci1] 4.574257
      LE Advertising Set Terminated (0x12)
        Status: Limit Reached (0x43)
        Handle: 0
        Connection handle: 65535
        Number of completed extended advertising events: 1
< HCI Command: LE Set Extended Ad.. (0x08|0x0037) plen 34  #132 [hci1] 4.634308
        Handle: 0x00
        Operation: Complete extended advertising data (0x03)
        Fragment preference: Minimize fragmentation (0x01)
        Data length: 0x1e
        Mesh Provisioning: 097c9231810ae27e6505cc71cffa5aa6eb9f91125a9f9bc4ccc54462
          Link ID: 0x097c9231
          Transaction Number: 129
          Transaction Continuation (0x02)
          SegmentIndex: 2
          Data: e27e6505cc71cffa5aa6eb9f91125a9f9bc4ccc54462
        7e 65 05 cc 71 cf fa 5a a6 eb 9f 91 12 5a 9f 9b  ~e..q..Z.....Z..
        c4 cc c5 44 62                                   ...Db           
> HCI Event: Command Complete (0x0e) plen 4                #133 [hci1] 4.635232
      LE Set Extended Advertising Data (0x08|0x0037) ncmd 1
        Status: Success (0x00)
< HCI Command: LE Set Advertising... (0x08|0x0035) plen 7  #134 [hci1] 4.644359
        Advertising handle: 0x00
        Advertising random address: 0D:79:5C:CF:1B:70 (Non-Resolvable)
> HCI Event: Command Complete (0x0e) plen 4                #135 [hci1] 4.644804
      LE Set Advertising Set Random Address (0x08|0x0035) ncmd 1
        Status: Success (0x00)
< HCI Command: LE Set Extended Adv.. (0x08|0x0039) plen 6  #136 [hci1] 4.664294
        Extended advertising: Enabled (0x01)
        Number of sets: 1 (0x01)
        Entry 0
          Handle: 0x00
          Duration: 0 ms (0x00)
          Max ext adv events: 1
> HCI Event: Command Complete (0x0e) plen 4                #137 [hci1] 4.664877
      LE Set Extended Advertising Enable (0x08|0x0039) ncmd 1
        Status: Success (0x00)
> HCI Event: LE Meta Event (0x3e) plen 6                   #138 [hci1] 4.672661
      LE Advertising Set Terminated (0x12)
        Status: Limit Reached (0x43)
        Handle: 0
        Connection handle: 65535
        Number of completed extended advertising events: 1
> HCI Event: LE Meta Event (0x3e) plen 34                  #139 [hci1] 4.723824
      LE Extended Advertising Report (0x0d)
        Num reports: 1
        Entry 0
          Event type: 0x0010
            Props: 0x0010
              Use legacy advertising PDUs
            Data status: [0;32mComplete[0m
          Legacy PDU Type: ADV_NONCONN_IND (0x0010)
          Address type: Public (0x00)
          Address: DF:A9:FF:F6:B1:1A (OUI DF-A9-FF)
          Primary PHY: LE 1M
          Secondary PHY: No packets
          SID: no ADI field (0xff)
          TX power: 127 dBm
          RSSI: -25 dBm (0xe7)
          Periodic advertising interval: 0.00 msec (0x0000)
          Direct address type: Reserved (0xff)
          Direct address: 00-00-00-00-00-00
          Data length: 0x08
        07 29 09 7c 92 31 81 01                          .).|.1..        
        Mesh Provisioning: 097c92318101
          Link ID: 0x097c9231
          Transaction Number: 129
          Transaction Acknowledgment (0x01)
> HCI Event: LE Meta Event (0x3e) plen 34                  #140 [hci1] 4.765635
      LE Extended Advertising Report (0x0d)
        Num reports: 1
        Entry 0
          Event type: 0x0010
            Props: 0x0010
              Use legacy advertising PDUs
            Data status: [0;32mComplete[0m
          Legacy PDU Type: ADV_NONCONN_IND (0x0010)
          Address type: Public (0x00)
          Address: DF:A9:FF:F6:B1:1A (OUI DF-A9-FF)
          Primary PHY: LE 1M
          Secondary PHY: No packets
          SID: no ADI field (0xff)
          TX power: 127 dBm
          RSSI: -32 dBm (0xe0)
          Periodic advertising interval: 0.00 msec (0x0000)
          Direct address type: Reserved (0xff)
          Direct address: 00-00-00-00-00-00
          Data length: 0x08
        07 29 09 7c 92 31 81 01                          .).|.1..        
        Mesh Provisioning: 097c92318101
          Link ID: 0x097c9231
          Transaction Number: 129
          Transaction Acknowledgment (0x01)
> HCI Event: LE Meta Event (0x3e) plen 34                  #141 [hci1] 4.810109
      LE Extended Advertising Report (0x0d)
        Num reports: 1
        Entry 0
          Event type: 0x0010
            Props: 0x0010
              Use legacy advertising PDUs
            Data status: [0;32mComplete[0m
          Legacy PDU Type: ADV_NONCONN_IND (0x0010)
          Address type: Public (0x00)
          Address: DF:A9:FF:F6:B1:1A (OUI DF-A9-FF)
          Primary PHY: LE 1M
          Secondary PHY: No packets
          SID: no ADI field (0xff)
          TX power: 127 dBm
          RSSI: -25 dBm (0xe7)
          Periodic advertising interval: 0.00 msec (0x0000)
          Direct address type: Reserved (0xff)
          Direct address: 00-00-00-00-00-00
          Data length: 0x08
        07 29 09 7c 92 31 81 01                          .).|.1..        
        Mesh Provisioning: 097c92318101
          Link ID: 0x097c9231
          Transaction Number: 129
          Transaction Acknowledgment (0x01)
> HCI Event: LE Meta Event (0x3e) plen 57                  #142 [hci1] 4.873285
      LE Extended Advertising Report (0x0d)
        Num reports: 1
        Entry 0
          Event type: 0x0010
            Props: 0x0010
              Use legacy advertising PDUs
            Data status: [0;32mComplete[0m
          Legacy PDU Type: ADV_NONCONN_IND (0x0010)
          Address type: Public (0x00)
          Address: DF:A9:FF:F6:B1:1A (OUI DF-A9-FF)
          Primary PHY: LE 1M
          Secondary PHY: No packets
          SID: no ADI field (0xff)
          TX power: 127 dBm
          RSSI: -26 dBm (0xe6)
          Periodic advertising interval: 0.00 msec (0x0000)
          Direct address type: Reserved (0xff)
          Direct address: 00-00-00-00-00-00
          Data length: 0x1f
        1e 29 09 7c 92 31 03 04 00 21 f1 05 51 8a 3b 9c  .).|.1...!..Q.;.
        66 43 aa ed 39 4a bf 73 43 b2 c6 e2 68 36 1a     fC..9J.sC...h6. 
        Mesh Provisioning: 097c923103040021f105518a3b9c6643aaed394abf7343b2c6e268361a
          Link ID: 0x097c9231
          Transaction Number: 3
          Transaction Start (0x00)
          SeqN: 4
          TotalLength: 33
          FCS: 0xf1
          Data: 05518a3b9c6643aaed394abf7343b2c6e268361a
        51 8a 3b 9c 66 43 aa ed 39 4a bf 73 43 b2 c6 e2  Q.;.fC..9J.sC...
        68 36 1a                                         h6.             
> HCI Event: LE Meta Event (0x3e) plen 47                  #143 [hci1] 4.919058
      LE Extended Advertising Report (0x0d)
        Num reports: 1
        Entry 0
          Event type: 0x0010
            Props: 0x0010
              Use legacy advertising PDUs
            Data status: [0;32mComplete[0m
          Legacy PDU Type: ADV_NONCONN_IND (0x0010)
          Address type: Public (0x00)
          Address: DF:A9:FF:F6:B1:1A (OUI DF-A9-FF)
          Primary PHY: LE 1M
          Secondary PHY: No packets
          SID: no ADI field (0xff)
          TX power: 127 dBm
          RSSI: -32 dBm (0xe0)
          Periodic advertising interval: 0.00 msec (0x0000)
          Direct address type: Reserved (0xff)
          Direct address: 00-00-00-00-00-00
          Data length: 0x15
        14 29 09 7c 92 31 03 06 25 55 03 d3 0c 8c 67 1a  .).|.1..%U....g.
        f3 9d 74 37 0c                                   ..t7.           
        Mesh Provisioning: 097c92310306255503d30c8c671af39d74370c
          Link ID: 0x097c9231
          Transaction Number: 3
          Transaction Continuation (0x02)
          SegmentIndex: 1
          Data: 255503d30c8c671af39d74370c
        55 03 d3 0c 8c 67 1a f3 9d 74 37 0c              U....g...t7.    
< HCI Command: LE Set Extended Ad.. (0x08|0x0037) plen 12  #144 [hci1] 4.964508
        Handle: 0x00
        Operation: Complete extended advertising data (0x03)
        Fragment preference: Minimize fragmentation (0x01)
        Data length: 0x08
        Mesh Provisioning: 097c92310301
          Link ID: 0x097c9231
          Transaction Number: 3
          Transaction Acknowledgment (0x01)
> HCI Event: Command Complete (0x0e) plen 4                #145 [hci1] 4.965254
      LE Set Extended Advertising Data (0x08|0x0037) ncmd 1
        Status: Success (0x00)
< HCI Command: LE Set Advertising... (0x08|0x0035) plen 7  #146 [hci1] 4.984375
        Advertising handle: 0x00
        Advertising random address: 11:FC:8D:55:5D:65 (Non-Resolvable)
> HCI Event: Command Complete (0x0e) plen 4                #147 [hci1] 4.984893
      LE Set Advertising Set Random Address (0x08|0x0035) ncmd 1
        Status: Success (0x00)
< HCI Command: LE Set Extended Adv.. (0x08|0x0039) plen 6  #148 [hci1] 5.004359
        Extended advertising: Enabled (0x01)
        Number of sets: 1 (0x01)
        Entry 0
          Handle: 0x00
          Duration: 0 ms (0x00)
          Max ext adv events: 3
> HCI Event: Command Complete (0x0e) plen 4                #149 [hci1] 5.004874
      LE Set Extended Advertising Enable (0x08|0x0039) ncmd 1
        Status: Success (0x00)
> HCI Event: LE Meta Event (0x3e) plen 6                   #150 [hci1] 5.056906
      LE Advertising Set Terminated (0x12)
        Status: Limit Reached (0x43)
        Handle: 0
        Connection handle: 65535
        Number of completed extended advertising events: 3
< HCI Command: LE Set Extended Ad.. (0x08|0x0037) plen 35  #151 [hci1] 5.104357
        Handle: 0x00
        Operation: Complete extended advertising data (0x03)
        Fragment preference: Minimize fragmentation (0x01)
        Data length: 0x1f
        Mesh Provisioning: 097c9231820400210a05a0c8be856bf5606163b7980573122df8a9ff37
          Link ID: 0x097c9231
          Transaction Number: 130
          Transaction Start (0x00)
          SeqN: 4
          TotalLength: 33
          FCS: 0x0a
          Data: 05a0c8be856bf5606163b7980573122df8a9ff37
        a0 c8 be 85 6b f5 60 61 63 b7 98 05 73 12 2d f8  ....k.`ac...s.-.
        a9 ff 37                                         ..7             
> HCI Event: Command Complete (0x0e) plen 4                #152 [hci1] 5.105249
      LE Set Extended Advertising Data (0x08|0x0037) ncmd 1
        Status: Success (0x00)
