Bluetooth monitor ver 5.72
btmon[250014]: = Note: Linux version 6.14.0-35-generic (x86_64)                                                          0.503037
btmon[250014]: = Note: Bluetooth subsystem version 2.22                                                                  0.503038
= New Index: 00:00:00:00:00:00 (Primary,UART,hci1)                                                                       0.503039
= New Index: 48:5F:99:8E:E0:64 (Primary,USB,hci0)                                                                        0.503040
= Open Index: 00:00:00:00:00:00                                                                                          1.016615
= Index Info: 00:00:00:00:00:00 (Nordic Semiconductor ASA)                                                               1.016629
zephyr.exe[250016]: @ USER Open: main (privileged) version 2.22                                                 {0x0001} 1.016638
zephyr.exe[250016]: < HCI Command: Reset (0x03|0x0003) plen 0                                                         #1 1.017852
> HCI Event: Command Complete (0x0e) plen 4                                                                           #2 1.018493
      Reset (0x03|0x0003) ncmd 1
        Status: Success (0x00)
zephyr.exe[250016]: < HCI Command: Read Local Supported Features (0x04|0x0003) plen 0                                 #3 1.036339
> HCI Event: Command Complete (0x0e) plen 12                                                                          #4 1.036870
      Read Local Supported Features (0x04|0x0003) ncmd 1
        Status: Success (0x00)
        Features: 0x00 0x00 0x00 0x00 0x60 0x00 0x00 0x00
          BR/EDR Not Supported
          LE Supported (Controller)
zephyr.exe[250016]: < HCI Command: Read Local Version Information (0x04|0x0001) plen 0                                #5 1.056053
> HCI Event: Command Complete (0x0e) plen 12                                                                          #6 1.056518
      Read Local Version Information (0x04|0x0001) ncmd 1
        Status: Success (0x00)
        HCI version: Reserved (0x0e) - Revision 12520 (0x30e8)
        LMP version: Reserved (0x0e) - Subversion 12520 (0x30e8)
        Manufacturer: Nordic Semiconductor ASA (89)
zephyr.exe[250016]: < HCI Command: Read Local Supported Commands (0x04|0x0002) plen 0                                 #7 1.076042
> HCI Event: Command Complete (0x0e) plen 68                                                                          #8 1.077191
      Read Local Supported Commands (0x04|0x0002) ncmd 1
        Status: Success (0x00)
        Commands: 119 entries
          Disconnect (Octet 0 - Bit 5)
          Read Remote Version Information (Octet 2 - Bit 7)
          Set Event Mask (Octet 5 - Bit 6)
          Reset (Octet 5 - Bit 7)
          Read Connection Accept Timeout (Octet 7 - Bit 2)
          Write Connection Accept Timeout (Octet 7 - Bit 3)
          Read Transmit Power Level (Octet 10 - Bit 2)
          Set Controller To Host Flow Control (Octet 10 - Bit 5)
          Host Buffer Size (Octet 10 - Bit 6)
          Host Number of Completed Packets (Octet 10 - Bit 7)
          Read Local Version Information (Octet 14 - Bit 3)
          Read Local Supported Features (Octet 14 - Bit 5)
          Read BD ADDR (Octet 15 - Bit 1)
          Read RSSI (Octet 15 - Bit 5)
          Set Event Mask Page 2 (Octet 22 - Bit 2)
          LE Set Event Mask (Octet 25 - Bit 0)
          LE Read Buffer Size (Octet 25 - Bit 1)
          LE Read Local Supported Features (Octet 25 - Bit 2)
          LE Set Random Address (Octet 25 - Bit 4)
          LE Set Advertising Parameters (Octet 25 - Bit 5)
          LE Read Advertising Channel TX Power (Octet 25 - Bit 6)
          LE Set Advertising Data (Octet 25 - Bit 7)
          LE Set Scan Response Data (Octet 26 - Bit 0)
          LE Set Advertise Enable (Octet 26 - Bit 1)
          LE Set Scan Parameters (Octet 26 - Bit 2)
          LE Set Scan Enable (Octet 26 - Bit 3)
          LE Create Connection (Octet 26 - Bit 4)
          LE Create Connection Cancel (Octet 26 - Bit 5)
          LE Read Accept List Size (Octet 26 - Bit 6)
          LE Clear Accept List (Octet 26 - Bit 7)
          LE Add Device To Accept List (Octet 27 - Bit 0)
          LE Remove Device From Accept List (Octet 27 - Bit 1)
          LE Connection Update (Octet 27 - Bit 2)
          LE Set Host Channel Classification (Octet 27 - Bit 3)
          LE Read Channel Map (Octet 27 - Bit 4)
          LE Read Remote Used Features (Octet 27 - Bit 5)
          LE Encrypt (Octet 27 - Bit 6)
          LE Rand (Octet 27 - Bit 7)
          LE Start Encryption (Octet 28 - Bit 0)
          LE Long Term Key Request Reply (Octet 28 - Bit 1)
          LE Long Term Key Request Neg Reply (Octet 28 - Bit 2)
          LE Read Supported States (Octet 28 - Bit 3)
          LE Receiver Test (Octet 28 - Bit 4)
          LE Transmitter Test (Octet 28 - Bit 5)
          LE Test End (Octet 28 - Bit 6)
          Read Authenticated Payload Timeout (Octet 32 - Bit 4)
          Write Authenticated Payload Timeout (Octet 32 - Bit 5)
          LE Set Data Length (Octet 33 - Bit 6)
          LE Read Suggested Default Data Length (Octet 33 - Bit 7)
          LE Write Suggested Default Data Length (Octet 34 - Bit 0)
          LE Add Device To Resolving List (Octet 34 - Bit 3)
          LE Remove Device From Resolving List (Octet 34 - Bit 4)
          LE Clear Resolving List (Octet 34 - Bit 5)
          LE Read Resolving List Size (Octet 34 - Bit 6)
          LE Set Address Resolution Enable (Octet 35 - Bit 1)
          LE Set Resolvable Private Address Timeout (Octet 35 - Bit 2)
          LE Read Maximum Data Length (Octet 35 - Bit 3)
          LE Read PHY (Octet 35 - Bit 4)
          LE Set Default PHY (Octet 35 - Bit 5)
          LE Set PHY (Octet 35 - Bit 6)
          LE Enhanced Receiver Test (Octet 35 - Bit 7)
          LE Enhanced Transmitter Test (Octet 36 - Bit 0)
          LE Set Advertising Set Random Address (Octet 36 - Bit 1)
          LE Set Extended Advertising Parameters (Octet 36 - Bit 2)
          LE Set Extended Advertising Data (Octet 36 - Bit 3)
          LE Set Extended Scan Response Data (Octet 36 - Bit 4)
          LE Set Extended Advertising Enable (Octet 36 - Bit 5)
          LE Read Maximum Advertising Data Length (Octet 36 - Bit 6)
          LE Read Number of Supported Advertising Sets (Octet 36 - Bit 7)
          LE Remove Advertising Set (Octet 37 - Bit 0)
          LE Clear Advertising Sets (Octet 37 - Bit 1)
          LE Set Periodic Advertising Parameters (Octet 37 - Bit 2)
          LE Set Periodic Advertising Data (Octet 37 - Bit 3)
          LE Set Periodic Advertising Enable (Octet 37 - Bit 4)
          LE Set Extended Scan Parameters (Octet 37 - Bit 5)
          LE Set Extended Scan Enable (Octet 37 - Bit 6)
          LE Extended Create Connection (Octet 37 - Bit 7)
          LE Periodic Advertising Create Sync (Octet 38 - Bit 0)
          LE Periodic Advertising Create Sync Cancel (Octet 38 - Bit 1)
          LE Periodic Advertising Terminate Sync (Octet 38 - Bit 2)
          LE Add Device To Periodic Advertiser List (Octet 38 - Bit 3)
          LE Remove Device From Periodic Advertiser List (Octet 38 - Bit 4)
          LE Clear Periodic Advertiser List (Octet 38 - Bit 5)
          LE Read Periodic Advertiser List Size (Octet 38 - Bit 6)
          LE Read Transmit Power (Octet 38 - Bit 7)
          LE Read RF Path Compensation (Octet 39 - Bit 0)
          LE Write RF Path Compensation (Octet 39 - Bit 1)
          LE Set Privacy Mode (Octet 39 - Bit 2)
          LE Periodic Advertising Receive Enable (Octet 40 - Bit 5)
          LE Periodic Advertising Sync Transfer (Octet 40 - Bit 6)
          LE Periodic Advertising Set Info Transfer (Octet 40 - Bit 7)
          LE Periodic Advertising Sync Transfer Parameters (Octet 41 - Bit 0)
          LE Set Default Periodic Advertisng Sync Transfer Parameters (Octet 41 - Bit 1)
          LE Read Buffer v2 (Octet 41 - Bit 5)
          LE Read ISO TX Sync (Octet 41 - Bit 6)
          LE Set Connected Isochronous Group Parameters (Octet 41 - Bit 7)
          LE Set Connected Isochronous Group Parameters Test (Octet 42 - Bit 0)
          LE Create Connected Isochronous Stream (Octet 42 - Bit 1)
          LE Remove Connected Isochronous Group (Octet 42 - Bit 2)
          LE Accept Connected Isochronous Stream Request (Octet 42 - Bit 3)
          LE Reject Connected Isochronous Stream Request (Octet 42 - Bit 4)
          LE Create Broadcast Isochronous Group (Octet 42 - Bit 5)
          LE Create Broadcast Isochronous Group Test (Octet 42 - Bit 6)
          LE Terminate Broadcast Isochronous Group (Octet 42 - Bit 7)
          LE Broadcast Isochronous Group Create Sync (Octet 43 - Bit 0)
          LE Broadcast Isochronous Group Terminate Sync (Octet 43 - Bit 1)
          LE Request Peer SCA (Octet 43 - Bit 2)
          LE Setup Isochronous Data Path (Octet 43 - Bit 3)
          LE Remove Isochronous Data Path (Octet 43 - Bit 4)
          LE Isochronous Transmit Test (Octet 43 - Bit 5)
          LE Isochronous Receive Test (Octet 43 - Bit 6)
          LE Isochronous Read Test Counters (Octet 43 - Bit 7)
          LE Isochronous Read Test Counters (Octet 44 - Bit 0)
          LE Set Host Feature (Octet 44 - Bit 1)
          Octet 44 - Bit 2 
          Octet 45 - Bit 6 
          Octet 46 - Bit 0 
          Octet 46 - Bit 1 
          Octet 46 - Bit 2 
zephyr.exe[250016]: < HCI Command: Host Buffer Size (0x03|0x0033) plen 7                                              #9 1.096037
        ACL MTU: 255  ACL max packet: 16
        SCO MTU: 0    SCO max packet: 0
> HCI Event: Command Complete (0x0e) plen 4                                                                          #10 1.096635
      Host Buffer Size (0x03|0x0033) ncmd 1
        Status: Success (0x00)
zephyr.exe[250016]: < HCI Command: Set Controller To Host Flow Control (0x03|0x0031) plen 1                          #11 1.116037
        Flow control: ACL Data Packets (0x01)
> HCI Event: Command Complete (0x0e) plen 4                                                                          #12 1.116525
      Set Controller To Host Flow Control (0x03|0x0031) ncmd 1
        Status: Success (0x00)
zephyr.exe[250016]: < HCI Command: LE Read Local Supported Features (0x08|0x0003) plen 0                             #13 1.136040
> HCI Event: Command Complete (0x0e) plen 12                                                                         #14 1.136533
      LE Read Local Supported Features (0x08|0x0003) ncmd 1
        Status: Success (0x00)
        Features: 0xfd 0x79 0x00 0xf7 0x30 0x01 0x00 0x00
          LE Encryption
          Extended Reject Indication
          Peripheral-initiated Features Exchange
          LE Ping
          LE Data Packet Length Extension
          LL Privacy
          Extended Scanner Filter Policies
          LE 2M PHY
          LE Coded PHY
          LE Extended Advertising
          LE Periodic Advertising
          Channel Selection Algorithm #2
          Periodic Advertising Sync Transfer - Sender
          Periodic Advertising Sync Transfer - Recipient
          Sleep Clock Accuracy Updates
          Connected Isochronous Stream - Central
          Connected Isochronous Stream - Peripheral
          Isochronous Broadcaster
          Synchronized Receiver
          Periodic Advertising ADI support
          Connection Subrating
          Unknown features (0x0000010000000000)
zephyr.exe[250016]: < HCI Command: LE Set Host Feature (0x08|0x0074) plen 2                                          #15 1.156046
        Bit Number: 32
          Connected Isochronous Stream (Host Support)
        Bit Value: 1
> HCI Event: Command Complete (0x0e) plen 4                                                                          #16 1.156423
      LE Set Host Feature (0x08|0x0074) ncmd 1
        Status: Success (0x00)
zephyr.exe[250016]: < HCI Command: LE Read Buffer v2 (0x08|0x0060) plen 0                                            #17 1.175999
> HCI Event: Command Complete (0x0e) plen 10                                                                         #18 1.176492
      LE Read Buffer v2 (0x08|0x0060) ncmd 1
        Status: Success (0x00)
        ACL MTU: 27
        ACL max packet: 3
        ISO MTU: 318
        ISO max packet: 3
zephyr.exe[250016]: < HCI Command: LE Read Maximum Advertising Data Length (0x08|0x003a) plen 0                      #19 1.196132
> HCI Event: Command Complete (0x0e) plen 6                                                                          #20 1.196534
      LE Read Maximum Advertising Data Length (0x08|0x003a) ncmd 1
        Status: Success (0x00)
        Max length: 1650
zephyr.exe[250016]: < HCI Command: LE Read Supported States (0x08|0x001c) plen 0                                     #21 1.216046
> HCI Event: Command Complete (0x0e) plen 12                                                                         #22 1.216483
      LE Read Supported States (0x08|0x001c) ncmd 1
        Status: Success (0x00)
        States: 0x000003ff3e0306ff
          Non-connectable Advertising State
          Scannable Advertising State
          Connectable Advertising State
          High Duty Cycle Directed Advertising State
          Passive Scanning State
          Active Scanning State
          Initiating State
            and Connection State (Central Role)
          Connection State (Peripheral Role)
          Scannable Advertising State
            and Passive Scanning State
          Connectable Advertising State
            and Passive Scanning State
          Non-connectable Advertising State
            and Initiating State
          Scannable Advertising State
            and Initiating State
          Active Scanning State
            and Connection State (Central Role)
          Passive Scanning State
            and Connection State (Peripheral Role)
          Active Scanning State
            and Connection State (Peripheral Role)
          Initiating State
            and Connection State (Central Role)
            and Central Role & Central Role
          Low Duty Cycle Directed Advertising State
          Connectable Advertising State
            and Initiating State
            and Central Role & Peripheral Role
          High Duty Cycle Directed Advertising State
            and Initiating State
            and Central Role & Peripheral Role
          Low Duty Cycle Directed Advertising State
            and Initiating State
            and Central Role & Peripheral Role
          Connectable Advertising State
            and Connection State (Central Role)
            and Central Role & Peripheral Role
          High Duty Cycle Directed Advertising State
            and Connection State (Central Role)
            and Central Role & Peripheral Role
          Low Duty Cycle Directed Advertising State
            and Connection State (Central Role)
            and Central Role & Peripheral Role
          Connectable Advertising State
            and Connection State (Peripheral Role)
            and Central Role & Peripheral Role
          High Duty Cycle Directed Advertising State
            and Connection State (Peripheral Role)
            and Peripheral Role & Peripheral Role
          Low Duty Cycle Directed Advertising State
            and Connection State (Peripheral Role)
            and Peripheral Role & Peripheral Role
          Initiating State
            and Connection State (Peripheral Role)
            and Central Role & Peripheral Role
zephyr.exe[250016]: < HCI Command: LE Read Maximum Data Length (0x08|0x002f) plen 0                                  #23 1.236039
> HCI Event: Command Complete (0x0e) plen 12                                                                         #24 1.236540
      LE Read Maximum Data Length (0x08|0x002f) ncmd 1
        Status: Success (0x00)
        Max TX octets: 251
        Max TX time: 2704
        Max RX octets: 251
        Max RX time: 2704
zephyr.exe[250016]: < HCI Command: LE Write Suggested Default Data Length (0x08|0x0024) plen 4                       #25 1.256043
        TX octets: 251
        TX time: 2704
> HCI Event: Command Complete (0x0e) plen 4                                                                          #26 1.256530
      LE Write Suggested Default Data Length (0x08|0x0024) ncmd 1
        Status: Success (0x00)
zephyr.exe[250016]: < HCI Command: LE Read Resolving List Size (0x08|0x002a) plen 0                                  #27 1.276052
> HCI Event: Command Complete (0x0e) plen 5                                                                          #28 1.276526
      LE Read Resolving List Size (0x08|0x002a) ncmd 1
        Status: Success (0x00)
        Size: 8
zephyr.exe[250016]: < HCI Command: LE Set Event Mask (0x08|0x0001) plen 8                                            #29 1.296023
        Mask: 0x000002023f87fa5e
          LE Advertising Report
          LE Connection Update Complete
          LE Read Remote Used Features Complete
          LE Long Term Key Request
          LE Data Length Change
          LE Enhanced Connection Complete
          LE PHY Update Complete
          LE Extended Advertising Report
          LE Periodic Advertising Sync Established
          LE Periodic Advertising Report
          LE Periodic Advertising Sync Lost
          LE Extended Scan Timeout
          LE Extended Advertising Set Terminated
          LE Scan Request Received
          LE Periodic Advertising Sync Transfer Rvc
          LE CIS Established
          LE CIS Request
          LE Create BIG Complete
          LE Terminate BIG Complete
          LE BIG Sync Estabilished Complete
          LE BIG Sync Lost
          LE BIG Info Advertising Report
          Unknown mask (0x0000020000000000)
> HCI Event: Command Complete (0x0e) plen 4                                                                          #30 1.296524
      LE Set Event Mask (0x08|0x0001) ncmd 1
        Status: Success (0x00)
zephyr.exe[250016]: < HCI Command: Set Event Mask (0x03|0x0001) plen 8                                               #31 1.316047
        Mask: 0x2000800002008890
          Disconnection Complete
          Encryption Change
          Read Remote Version Information Complete
          Hardware Error
          Data Buffer Overflow
          Encryption Key Refresh Complete
          LE Meta
> HCI Event: Command Complete (0x0e) plen 4                                                                          #32 1.316502
      Set Event Mask (0x03|0x0001) ncmd 1
        Status: Success (0x00)
zephyr.exe[250016]: < HCI Command: Read BD ADDR (0x04|0x0009) plen 0                                                 #33 1.336042
> HCI Event: Command Complete (0x0e) plen 10                                                                         #34 1.336497
      Read BD ADDR (0x04|0x0009) ncmd 1
        Status: Success (0x00)
        Address: 00:00:00:00:00:00 (OUI 00-00-00)
zephyr.exe[250016]: < HCI Command: LE Set Random Address (0x08|0x0005) plen 6                                        #35 1.356052
        Address: D5:B6:CC:31:DB:3B (Static)
> HCI Event: Command Complete (0x0e) plen 4                                                                          #36 1.356598
      LE Set Random Address (0x08|0x0005) ncmd 1
        Status: Success (0x00)
zephyr.exe[250016]: < HCI Command: LE Set Extended Advertising Parameters (0x08|0x0036) plen 25                      #37 2.026074
        Handle: 0x00
        Properties: 0x0001
          Connectable
        Min advertising interval: 100.000 msec (0x00a0)
        Max advertising interval: 150.000 msec (0x00f0)
        Channel map: 37, 38, 39 (0x07)
        Own address type: Random (0x01)
        Peer address type: Public (0x00)
        Peer address: 00:00:00:00:00:00 (OUI 00-00-00)
        Filter policy: Allow Scan Request from Any, Allow Connect Request from Any (0x00)
        TX power: Host has no preference (0x7f)
        Primary PHY: LE 1M (0x01)
        Secondary max skip: 0x00
        Secondary PHY: LE 2M (0x02)
        SID: 0x00
        Scan request notifications: Disabled (0x00)
> HCI Event: Command Complete (0x0e) plen 5                                                                          #38 2.026915
      LE Set Extended Advertising Parameters (0x08|0x0036) ncmd 1
        Status: Success (0x00)
        TX power (selected): 0 dbm (0x00)
zephyr.exe[250016]: < HCI Command: LE Set Advertising Set Random Address (0x08|0x0035) plen 7                        #39 2.036052
        Advertising handle: 0x00
        Advertising random address: D5:B6:CC:31:DB:3B (Static)
> HCI Event: Command Complete (0x0e) plen 4                                                                          #40 2.036544
      LE Set Advertising Set Random Address (0x08|0x0035) ncmd 1
        Status: Success (0x00)
zephyr.exe[250016]: < HCI Command: LE Set Extended Advertising Data (0x08|0x0037) plen 39                            #41 2.056064
        Handle: 0x00
        Operation: Complete extended advertising data (0x03)
        Fragment preference: Minimize fragmentation (0x01)
        Data length: 0x23
        Flags: 0x06
          LE General Discoverable Mode
          BR/EDR Not Supported
        Name (complete): Tester_F6B11A
        Flags: 0x06
          LE General Discoverable Mode
          BR/EDR Not Supported
        16-bit Service UUIDs (complete): 1 entry
          Audio Stream Control (0x184e)
        Service Data: Audio Stream Control (0x184e)
          Data: 01ff0fff0f00
> HCI Event: Command Complete (0x0e) plen 4                                                                          #42 2.056931
      LE Set Extended Advertising Data (0x08|0x0037) ncmd 1
        Status: Success (0x00)
zephyr.exe[250016]: < HCI Command: LE Set Extended Advertising Enable (0x08|0x0039) plen 6                           #43 2.076051
        Extended advertising: Enabled (0x01)
        Number of sets: 1 (0x01)
        Entry 0
          Handle: 0x00
          Duration: 0 ms (0x00)
          Max ext adv events: 0
> HCI Event: Command Complete (0x0e) plen 4                                                                          #44 2.076599
      LE Set Extended Advertising Enable (0x08|0x0039) ncmd 1
        Status: Success (0x00)
> HCI Event: LE Meta Event (0x3e) plen 31                                                                            #45 4.632568
      LE Enhanced Connection Complete (0x0a)
        Status: Success (0x00)
        Handle: 579
        Role: Peripheral (0x01)
        Peer address type: Public (0x00)
        Peer address: DF:A9:FF:F6:B1:1A (OUI DF-A9-FF)
        Local resolvable private address: 00:00:00:00:00:00 (Non-Resolvable)
        Peer resolvable private address: 00:00:00:00:00:00 (Non-Resolvable)
        Connection interval: 80.00 msec (0x0040)
        Connection latency: 0 (0x0000)
        Supervision timeout: 25120 msec (0x09d0)
        Central clock accuracy: 0x01
> HCI Event: LE Meta Event (0x3e) plen 6                                                                             #46 4.632722
      LE Advertising Set Terminated (0x12)
        Status: Success (0x00)
        Handle: 0
        Connection handle: 579
        Number of completed extended advertising events: 0
zephyr.exe[250016]: < HCI Command: LE Read Remote Used Features (0x08|0x0016) plen 2                                 #47 4.637161
        Handle: 579 Address: DF:A9:FF:F6:B1:1A (OUI DF-A9-FF)
zephyr.exe[250016]: < ACL Data TX: Handle 579 flags 0x00 dlen 7                                                      #48 4.637182
      ATT: Exchange MTU Request (0x02) len 2
        Client RX MTU: 251
> HCI Event: Command Status (0x0f) plen 4                                                                            #49 4.637762
      LE Read Remote Used Features (0x08|0x0016) ncmd 1
        Status: Success (0x00)
> HCI Event: Number of Completed Packets (0x13) plen 5                                                               #50 4.794523
        Num handles: 1
        Handle: 579 Address: DF:A9:FF:F6:B1:1A (OUI DF-A9-FF)
        Count: 1
        #48: len 7 (0 Kb/s)
        Latency: 157 msec (157-157 msec ~157 msec)
> HCI Event: LE Meta Event (0x3e) plen 12                                                                            #51 4.874893
      LE Read Remote Used Features (0x04)
        Status: Success (0x00)
        Handle: 579 Address: DF:A9:FF:F6:B1:1A (OUI DF-A9-FF)
        Features: 0x2d 0x49 0x00 0xf7 0x67 0xd8 0x00 0x00
          LE Encryption
          Extended Reject Indication
          Peripheral-initiated Features Exchange
          LE Data Packet Length Extension
          LE 2M PHY
          LE Coded PHY
          Channel Selection Algorithm #2
          Periodic Advertising Sync Transfer - Sender
          Periodic Advertising Sync Transfer - Recipient
          Sleep Clock Accuracy Updates
          Connected Isochronous Stream - Central
          Connected Isochronous Stream - Peripheral
          Isochronous Broadcaster
          Synchronized Receiver
          Connected Isochronous Stream (Host Support)
          LE Power Control Request
          LE Power Control Request
          Connection Subrating
          Connection Subrating (Host Support)
          Unknown features (0x0000d80000000000)
zephyr.exe[250016]: < HCI Command: LE Remove Advertising Set (0x08|0x003c) plen 1                                    #52 5.166637
        Handle: 0
> HCI Event: Command Complete (0x0e) plen 4                                                                          #53 5.167070
      LE Remove Advertising Set (0x08|0x003c) ncmd 1
        Status: Success (0x00)
zephyr.exe[250016]: < HCI Command: LE Set Extended Advertising Parameters (0x08|0x0036) plen 25                      #54 5.176351
        Handle: 0x00
        Properties: 0x0001
          Connectable
        Min advertising interval: 100.000 msec (0x00a0)
        Max advertising interval: 150.000 msec (0x00f0)
        Channel map: 37, 38, 39 (0x07)
        Own address type: Random (0x01)
        Peer address type: Public (0x00)
        Peer address: 00:00:00:00:00:00 (OUI 00-00-00)
        Filter policy: Allow Scan Request from Any, Allow Connect Request from Any (0x00)
        TX power: Host has no preference (0x7f)
        Primary PHY: LE 1M (0x01)
        Secondary max skip: 0x00
        Secondary PHY: LE 2M (0x02)
        SID: 0x01
        Scan request notifications: Disabled (0x00)
> HCI Event: Command Complete (0x0e) plen 5                                                                          #55 5.177189
      LE Set Extended Advertising Parameters (0x08|0x0036) ncmd 1
        Status: Success (0x00)
        TX power (selected): 0 dbm (0x00)
zephyr.exe[250016]: < HCI Command: LE Set Advertising Set Random Address (0x08|0x0035) plen 7                        #56 5.196215
        Advertising handle: 0x00
        Advertising random address: D5:B6:CC:31:DB:3B (Static)
> HCI Event: Command Complete (0x0e) plen 4                                                                          #57 5.196765
      LE Set Advertising Set Random Address (0x08|0x0035) ncmd 1
        Status: Success (0x00)
zephyr.exe[250016]: < HCI Command: LE Set Extended Advertising Data (0x08|0x0037) plen 39                            #58 5.216113
        Handle: 0x00
        Operation: Complete extended advertising data (0x03)
        Fragment preference: Minimize fragmentation (0x01)
        Data length: 0x23
        Flags: 0x06
          LE General Discoverable Mode
          BR/EDR Not Supported
        Name (complete): Tester_F6B11A
        Flags: 0x06
          LE General Discoverable Mode
          BR/EDR Not Supported
        16-bit Service UUIDs (complete): 1 entry
          Audio Stream Control (0x184e)
        Service Data: Audio Stream Control (0x184e)
          Data: 01ff0fff0f00
> HCI Event: Command Complete (0x0e) plen 4                                                                          #59 5.217174
      LE Set Extended Advertising Data (0x08|0x0037) ncmd 1
        Status: Success (0x00)
zephyr.exe[250016]: < HCI Command: LE Set Extended Advertising Enable (0x08|0x0039) plen 6                           #60 5.236088
        Extended advertising: Enabled (0x01)
        Number of sets: 1 (0x01)
        Entry 0
          Handle: 0x00
          Duration: 0 ms (0x00)
          Max ext adv events: 0
> HCI Event: Command Complete (0x0e) plen 4                                                                          #61 5.236622
      LE Set Extended Advertising Enable (0x08|0x0039) ncmd 1
        Status: Success (0x00)
> ACL Data RX: Handle 579 flags 0x02 dlen 7                                                                          #62 5.274656
      ATT: Exchange MTU Request (0x02) len 2
        Client RX MTU: 64
> ACL Data RX: Handle 579 flags 0x02 dlen 7                                                                          #63 5.274966
      ATT: Exchange MTU Response (0x03) len 2
        Server RX MTU: 64
zephyr.exe[250016]: < HCI Command: Host Number of Completed Packets (0x03|0x0035) plen 5                             #64 5.276087
        Num handles: 1
        Handle: 579 Address: DF:A9:FF:F6:B1:1A (OUI DF-A9-FF)
        Count: 1
zephyr.exe[250016]: < ACL Data TX: Handle 579 flags 0x00 dlen 7                                                      #65 5.276173
      ATT: Exchange MTU Response (0x03) len 2
        Server RX MTU: 251
zephyr.exe[250016]: < HCI Command: Host Number of Completed Packets (0x03|0x0035) plen 5                             #66 5.276217
        Num handles: 1
        Handle: 579 Address: DF:A9:FF:F6:B1:1A (OUI DF-A9-FF)
        Count: 1
> HCI Event: Number of Completed Packets (0x13) plen 5                                                               #67 5.514633
        Num handles: 1
        Handle: 579 Address: DF:A9:FF:F6:B1:1A (OUI DF-A9-FF)
        Count: 1
        #65: len 7 (0 Kb/s)
        Latency: 238 msec (157-238 msec ~197 msec)
> ACL Data RX: Handle 579 flags 0x02 dlen 11                                                                         #68 7.514645
      SMP: Pairing Request (0x01) len 6
        IO capability: KeyboardDisplay (0x04)
        OOB data: Authentication data not present (0x00)
        Authentication requirement: Bonding, No MITM, SC, No Keypresses (0x09)
        Max encryption key size: 16
        Initiator key distribution: EncKey IdKey Sign (0x07)
        Responder key distribution: EncKey IdKey Sign (0x07)
zephyr.exe[250016]: < HCI Command: Host Number of Completed Packets (0x03|0x0035) plen 5                             #69 7.516611
        Num handles: 1
        Handle: 579 Address: DF:A9:FF:F6:B1:1A (OUI DF-A9-FF)
        Count: 1
zephyr.exe[250016]: < ACL Data TX: Handle 579 flags 0x00 dlen 11                                                     #70 7.516810
      SMP: Pairing Response (0x02) len 6
        IO capability: NoInputNoOutput (0x03)
        OOB data: Authentication data not present (0x00)
        Authentication requirement: Bonding, No MITM, SC, No Keypresses (0x09)
        Max encryption key size: 16
        Initiator key distribution: IdKey (0x02)
        Responder key distribution: <none> (0x00)
> HCI Event: Number of Completed Packets (0x13) plen 5                                                               #71 7.754547
        Num handles: 1
        Handle: 579 Address: DF:A9:FF:F6:B1:1A (OUI DF-A9-FF)
        Count: 1
        #70: len 11 (0 Kb/s)
        Latency: 237 msec (157-238 msec ~217 msec)
> ACL Data RX: Handle 579 flags 0x02 dlen 27                                                                         #72 7.754897
> ACL Data RX: Handle 579 flags 0x01 dlen 27                                                                         #73 7.755264
> ACL Data RX: Handle 579 flags 0x01 dlen 15                                                                         #74 7.755606
      SMP: Pairing Public Key (0x0c) len 64
        X: f34d843c627657839e1a2f6aeb01b794df90b36b41d233378d95ba67a723de3a
        Y: 1c94b50876e389b912eede09e87f24370c2d9ba60eafc4018b1384e6276c70a5
zephyr.exe[250016]: < HCI Command: Host Number of Completed Packets (0x03|0x0035) plen 5                             #75 7.756738
        Num handles: 1
        Handle: 579 Address: DF:A9:FF:F6:B1:1A (OUI DF-A9-FF)
        Count: 1
zephyr.exe[250016]: < HCI Command: Host Number of Completed Packets (0x03|0x0035) plen 5                             #76 7.756802
        Num handles: 1
        Handle: 579 Address: DF:A9:FF:F6:B1:1A (OUI DF-A9-FF)
        Count: 1
zephyr.exe[250016]: < HCI Command: Host Number of Completed Packets (0x03|0x0035) plen 5                             #77 7.757060
        Num handles: 1
        Handle: 579 Address: DF:A9:FF:F6:B1:1A (OUI DF-A9-FF)
        Count: 1
zephyr.exe[250016]: < ACL Data TX: Handle 579 flags 0x00 dlen 27                                                     #78 7.757243
zephyr.exe[250016]: < ACL Data TX: Handle 579 flags 0x01 dlen 27                                                     #79 7.757258
zephyr.exe[250016]: < ACL Data TX: Handle 579 flags 0x01 dlen 15                                                     #80 7.757350
      SMP: Pairing Public Key (0x0c) len 64
        X: 98308440221e2d910f0e54b71e7ec652857aa9b5a0dc65028824cc19db1226e9
        Y: 67a4816bcb62efb21701e31fdb27561a6217575fb007a8bbdabe7e28b6f68482
> HCI Event: Number of Completed Packets (0x13) plen 5                                                               #81 7.834902
        Num handles: 1
        Handle: 579 Address: DF:A9:FF:F6:B1:1A (OUI DF-A9-FF)
        Count: 1
        #78: len 27 (2 Kb/s)
        Latency: 77 msec (77-238 msec ~147 msec)
> HCI Event: Number of Completed Packets (0x13) plen 5                                                               #82 7.835486
        Num handles: 1
        Handle: 579 Address: DF:A9:FF:F6:B1:1A (OUI DF-A9-FF)
        Count: 1
        #79: len 27 (2 Kb/s)
        Latency: 78 msec (77-238 msec ~112 msec)
zephyr.exe[250016]: < ACL Data TX: Handle 579 flags 0x00 dlen 21                                                     #83 7.836478
      SMP: Pairing Confirm (0x03) len 16
        Confim value: dae1eea8d59576053de0eab3221d7515
> HCI Event: Number of Completed Packets (0x13) plen 5                                                               #84 7.914584
        Num handles: 1
        Handle: 579 Address: DF:A9:FF:F6:B1:1A (OUI DF-A9-FF)
        Count: 1
        #80: len 15 (0 Kb/s)
        Latency: 157 msec (77-238 msec ~135 msec)
> HCI Event: Number of Completed Packets (0x13) plen 5                                                               #85 7.994698
        Num handles: 1
        Handle: 579 Address: DF:A9:FF:F6:B1:1A (OUI DF-A9-FF)
        Count: 1
        #83: len 21 (1 Kb/s)
        Latency: 158 msec (77-238 msec ~146 msec)
> ACL Data RX: Handle 579 flags 0x02 dlen 21                                                                         #86 7.994974
      SMP: Pairing Random (0x04) len 16
        Random value: 67a17a347096b33b0000000000000000
zephyr.exe[250016]: < HCI Command: Host Number of Completed Packets (0x03|0x0035) plen 5                             #87 7.996644
        Num handles: 1
        Handle: 579 Address: DF:A9:FF:F6:B1:1A (OUI DF-A9-FF)
        Count: 1
zephyr.exe[250016]: < ACL Data TX: Handle 579 flags 0x00 dlen 21                                                     #88 7.996726
      SMP: Pairing Random (0x04) len 16
        Random value: 8e6108f966a694cbe26df70bb96773e6
> HCI Event: Number of Completed Packets (0x13) plen 5                                                               #89 8.154472
        Num handles: 1
        Handle: 579 Address: DF:A9:FF:F6:B1:1A (OUI DF-A9-FF)
        Count: 1
        #88: len 21 (1 Kb/s)
        Latency: 157 msec (77-238 msec ~152 msec)
> ACL Data RX: Handle 579 flags 0x02 dlen 21                                                                         #90 8.394755
      SMP: Pairing DHKey Check (0x0d) len 16
        E: 006e741b1b68d26d5c37a3b69b8c87c1
zephyr.exe[250016]: < HCI Command: Host Number of Completed Packets (0x03|0x0035) plen 5                             #91 8.396810
        Num handles: 1
        Handle: 579 Address: DF:A9:FF:F6:B1:1A (OUI DF-A9-FF)
        Count: 1
zephyr.exe[250016]: < ACL Data TX: Handle 579 flags 0x00 dlen 21                                                     #92 8.396984
      SMP: Pairing DHKey Check (0x0d) len 16
        E: 7be47d6423c9fae878d5786d21592497
> HCI Event: Number of Completed Packets (0x13) plen 5                                                               #93 8.554472
        Num handles: 1
        Handle: 579 Address: DF:A9:FF:F6:B1:1A (OUI DF-A9-FF)
        Count: 1
        #92: len 21 (1 Kb/s)
        Latency: 157 msec (77-238 msec ~154 msec)
> HCI Event: LE Meta Event (0x3e) plen 13                                                                            #94 8.714870
      LE Long Term Key Request (0x05)
        Handle: 579 Address: DF:A9:FF:F6:B1:1A (OUI DF-A9-FF)
        Random number: 0x0000000000000000
        Encrypted diversifier: 0x0000
zephyr.exe[250016]: < HCI Command: LE Long Term Key Request Reply (0x08|0x001a) plen 18                              #95 8.716449
        Handle: 579 Address: DF:A9:FF:F6:B1:1A (OUI DF-A9-FF)
        Long term key: e140ae87588446ddb29c6fb7d2d5dd86
> HCI Event: Command Complete (0x0e) plen 6                                                                          #96 8.717148
      LE Long Term Key Request Reply (0x08|0x001a) ncmd 1
        Status: Success (0x00)
        Handle: 579 Address: DF:A9:FF:F6:B1:1A (OUI DF-A9-FF)
> HCI Event: Encryption Change (0x08) plen 4                                                                         #97 9.114737
        Status: Success (0x00)
        Handle: 579 Address: DF:A9:FF:F6:B1:1A (OUI DF-A9-FF)
        Encryption: Enabled with AES-CCM (0x01)
> ACL Data RX: Handle 579 flags 0x02 dlen 21                                                                         #98 9.194795
      SMP: Identity Information (0x08) len 16
        Identity resolving key: b20598a6d91bf6ed212d3de223c5df00
zephyr.exe[250016]: < HCI Command: Host Number of Completed Packets (0x03|0x0035) plen 5                             #99 9.226911
        Num handles: 1
        Handle: 579 Address: DF:A9:FF:F6:B1:1A (OUI DF-A9-FF)
        Count: 1
> ACL Data RX: Handle 579 flags 0x02 dlen 12                                                                        #100 9.434621
      SMP: Identity Address Information (0x09) len 7
        Address: DF:A9:FF:F6:B1:1A (OUI DF-A9-FF)
zephyr.exe[250016]: < HCI Command: LE Set Extended Advertising Enable (0x08|0x0039) plen 6                          #101 9.436785
        Extended advertising: Disabled (0x00)
        Number of sets: 1 (0x01)
        Entry 0
          Handle: 0x00
          Duration: 0 ms (0x00)
          Max ext adv events: 0
> HCI Event: Command Complete (0x0e) plen 4                                                                         #102 9.437317
      LE Set Extended Advertising Enable (0x08|0x0039) ncmd 1
        Status: Success (0x00)
zephyr.exe[250016]: < HCI Command: LE Add Device To Resolving List (0x08|0x0027) plen 39                            #103 9.456452
        Address type: Public (0x00)
        Address: DF:A9:FF:F6:B1:1A (OUI DF-A9-FF)
        Peer identity resolving key: b20598a6d91bf6ed212d3de223c5df00
        Local identity resolving key: 00000000000000000000000000000000
> HCI Event: Command Complete (0x0e) plen 4                                                                         #104 9.457480
      LE Add Device To Resolving List (0x08|0x0027) ncmd 1
        Status: Success (0x00)
zephyr.exe[250016]: < HCI Command: LE Set Privacy Mode (0x08|0x004e) plen 8                                         #105 9.476455
        Peer Identity address type: Public (0x00)
        Peer Identity address: DF:A9:FF:F6:B1:1A (OUI DF-A9-FF)
        Privacy Mode: Use Device Privacy (0x01)
> HCI Event: Command Complete (0x0e) plen 4                                                                         #106 9.476973
      LE Set Privacy Mode (0x08|0x004e) ncmd 1
        Status: Success (0x00)
zephyr.exe[250016]: < HCI Command: LE Set Address Resolution Enable (0x08|0x002d) plen 1                            #107 9.496220
        Address resolution: Enabled (0x01)
> HCI Event: Command Complete (0x0e) plen 4                                                                         #108 9.496635
      LE Set Address Resolution Enable (0x08|0x002d) ncmd 1
        Status: Success (0x00)
> ACL Data RX: Handle 579 flags 0x02 dlen 13                                                                        #109 9.514535
      ATT: Find By Type Value Request (0x06) len 8
        Handle range: 0x0001-0xffff
        Attribute type: Primary Service (0x2800)
          UUID: Published Audio Capabilities (0x1850)
zephyr.exe[250016]: < HCI Command: LE Set Extended Advertising Enable (0x08|0x0039) plen 6                          #110 9.516212
        Extended advertising: Enabled (0x01)
        Number of sets: 1 (0x01)
        Entry 0
          Handle: 0x00
          Duration: 0 ms (0x00)
          Max ext adv events: 0
> HCI Event: Command Complete (0x0e) plen 4                                                                         #111 9.516798
      LE Set Extended Advertising Enable (0x08|0x0039) ncmd 1
        Status: Success (0x00)
zephyr.exe[250016]: < HCI Command: Host Number of Completed Packets (0x03|0x0035) plen 5                            #112 9.536184
        Num handles: 1
        Handle: 579 Address: DF:A9:FF:F6:B1:1A (OUI DF-A9-FF)
        Count: 1
zephyr.exe[250016]: < HCI Command: Host Number of Completed Packets (0x03|0x0035) plen 5                            #113 9.536460
        Num handles: 1
        Handle: 579 Address: DF:A9:FF:F6:B1:1A (OUI DF-A9-FF)
        Count: 1
zephyr.exe[250016]: < ACL Data TX: Handle 579 flags 0x00 dlen 9                                                     #114 9.536604
      ATT: Find By Type Value Response (0x07) len 4
        Handle range: 0x0024-0x0036
> HCI Event: Number of Completed Packets (0x13) plen 5                                                              #115 9.674545
        Num handles: 1
        Handle: 579 Address: DF:A9:FF:F6:B1:1A (OUI DF-A9-FF)
        Count: 1
        #114: len 9 (0 Kb/s)
        Latency: 137 msec (77-238 msec ~146 msec)
> ACL Data RX: Handle 579 flags 0x02 dlen 13                                                                        #116 9.674840
      ATT: Find By Type Value Request (0x06) len 8
        Handle range: 0x0037-0xffff
        Attribute type: Primary Service (0x2800)
          UUID: Published Audio Capabilities (0x1850)
zephyr.exe[250016]: < HCI Command: Host Number of Completed Packets (0x03|0x0035) plen 5                            #117 9.676837
        Num handles: 1
        Handle: 579 Address: DF:A9:FF:F6:B1:1A (OUI DF-A9-FF)
        Count: 1
zephyr.exe[250016]: < ACL Data TX: Handle 579 flags 0x00 dlen 9                                                     #118 9.676912
      ATT: Error Response (0x01) len 4
        Find By Type Value Request (0x06)
        Handle: 0x0037
        Error: Attribute Not Found (0x0a)
> HCI Event: Number of Completed Packets (0x13) plen 5                                                              #119 9.834497
        Num handles: 1
        Handle: 579 Address: DF:A9:FF:F6:B1:1A (OUI DF-A9-FF)
        Count: 1
        #118: len 9 (0 Kb/s)
        Latency: 157 msec (77-238 msec ~151 msec)
> ACL Data RX: Handle 579 flags 0x02 dlen 11                                                                        #120 9.834708
      ATT: Read By Type Request (0x08) len 6
        Handle range: 0x0024-0x0036
        Attribute type: Characteristic (0x2803)
zephyr.exe[250016]: < HCI Command: Host Number of Completed Packets (0x03|0x0035) plen 5                            #121 9.836798
        Num handles: 1
        Handle: 579 Address: DF:A9:FF:F6:B1:1A (OUI DF-A9-FF)
        Count: 1
zephyr.exe[250016]: < ACL Data TX: Handle 579 flags 0x00 dlen 27                                                    #122 9.836880
zephyr.exe[250016]: < ACL Data TX: Handle 579 flags 0x01 dlen 21                                                    #123 9.837131
      ATT: Read By Type Response (0x09) len 43
        Attribute data length: 7
        Attribute data list: 6 entries
        Handle: 0x0025
        Value: 122600c92b
            Properties: 0x12
              Read (0x02)
              Notify (0x10)
            Value Handle: 0x0026
            Value UUID: Sink PAC (0x2bc9)
        Handle: 0x0028
        Value: 1a2900ca2b
            Properties: 0x1a
              Read (0x02)
              Write (0x08)
              Notify (0x10)
            Value Handle: 0x0029
            Value UUID: Sink Audio Locations (0x2bca)
        Handle: 0x002b
        Value: 122c00cb2b
            Properties: 0x12
              Read (0x02)
              Notify (0x10)
            Value Handle: 0x002c
            Value UUID: Source PAC (0x2bcb)
        Handle: 0x002e
        Value: 1a2f00cc2b
            Properties: 0x1a
              Read (0x02)
              Write (0x08)
              Notify (0x10)
            Value Handle: 0x002f
            Value UUID: Source Audio Locations (0x2bcc)
        Handle: 0x0031
        Value: 123200cd2b
            Properties: 0x12
              Read (0x02)
              Notify (0x10)
            Value Handle: 0x0032
            Value UUID: Available Audio Contexts (0x2bcd)
        Handle: 0x0034
        Value: 123500ce2b
            Properties: 0x12
              Read (0x02)
              Notify (0x10)
            Value Handle: 0x0035
            Value UUID: Supported Audio Contexts (0x2bce)
> HCI Event: Number of Completed Packets (0x13) plen 5                                                              #124 9.914862
        Num handles: 1
        Handle: 579 Address: DF:A9:FF:F6:B1:1A (OUI DF-A9-FF)
        Count: 1
        #122: len 27 (2 Kb/s)
        Latency: 77 msec (77-238 msec ~114 msec)
> HCI Event: Number of Completed Packets (0x13) plen 5                                                              #125 9.994535
        Num handles: 1
        Handle: 579 Address: DF:A9:FF:F6:B1:1A (OUI DF-A9-FF)
        Count: 1
        #123: len 21 (1 Kb/s)
        Latency: 157 msec (77-238 msec ~136 msec)
> ACL Data RX: Handle 579 flags 0x02 dlen 11                                                                        #126 9.994747
      ATT: Read By Type Request (0x08) len 6
        Handle range: 0x0035-0x0036
        Attribute type: Characteristic (0x2803)
zephyr.exe[250016]: < HCI Command: Host Number of Completed Packets (0x03|0x0035) plen 5                            #127 9.996659
        Num handles: 1
        Handle: 579 Address: DF:A9:FF:F6:B1:1A (OUI DF-A9-FF)
        Count: 1
zephyr.exe[250016]: < ACL Data TX: Handle 579 flags 0x00 dlen 9                                                     #128 9.996740
      ATT: Error Response (0x01) len 4
        Read By Type Request (0x08)
        Handle: 0x0035
        Error: Attribute Not Found (0x0a)
> HCI Event: Number of Completed Packets (0x13) plen 5                                                             #129 10.234505
        Num handles: 1
        Handle: 579 Address: DF:A9:FF:F6:B1:1A (OUI DF-A9-FF)
        Count: 1
        #128: len 9 (0 Kb/s)
        Latency: 237 msec (77-238 msec ~186 msec)
> ACL Data RX: Handle 579 flags 0x02 dlen 9                                                                        #130 10.234634
      ATT: Find Information Request (0x04) len 4
        Handle range: 0x0027-0x0027
zephyr.exe[250016]: < HCI Command: Host Number of Completed Packets (0x03|0x0035) plen 5                           #131 10.236736
        Num handles: 1
        Handle: 579 Address: DF:A9:FF:F6:B1:1A (OUI DF-A9-FF)
        Count: 1
zephyr.exe[250016]: < ACL Data TX: Handle 579 flags 0x00 dlen 10                                                   #132 10.236813
      ATT: Find Information Response (0x05) len 5
        Format: UUID-16 (0x01)
        Handle: 0x0027
        UUID: Client Characteristic Configuration (0x2902)
> HCI Event: Number of Completed Packets (0x13) plen 5                                                             #133 10.394550
        Num handles: 1
        Handle: 579 Address: DF:A9:FF:F6:B1:1A (OUI DF-A9-FF)
        Count: 1
        #132: len 10 (0 Kb/s)
        Latency: 157 msec (77-238 msec ~172 msec)
> ACL Data RX: Handle 579 flags 0x02 dlen 9                                                                        #134 10.394666
      ATT: Find Information Request (0x04) len 4
        Handle range: 0x002a-0x002a
zephyr.exe[250016]: < HCI Command: Host Number of Completed Packets (0x03|0x0035) plen 5                           #135 10.396663
        Num handles: 1
        Handle: 579 Address: DF:A9:FF:F6:B1:1A (OUI DF-A9-FF)
        Count: 1
zephyr.exe[250016]: < ACL Data TX: Handle 579 flags 0x00 dlen 10                                                   #136 10.396712
      ATT: Find Information Response (0x05) len 5
        Format: UUID-16 (0x01)
        Handle: 0x002a
        UUID: Client Characteristic Configuration (0x2902)
> HCI Event: Number of Completed Packets (0x13) plen 5                                                             #137 10.554679
        Num handles: 1
        Handle: 579 Address: DF:A9:FF:F6:B1:1A (OUI DF-A9-FF)
        Count: 1
        #136: len 10 (0 Kb/s)
        Latency: 157 msec (77-238 msec ~165 msec)
> ACL Data RX: Handle 579 flags 0x02 dlen 9                                                                        #138 10.554689
      ATT: Find Information Request (0x04) len 4
        Handle range: 0x002d-0x002d
zephyr.exe[250016]: < HCI Command: Host Number of Completed Packets (0x03|0x0035) plen 5                           #139 10.556788
        Num handles: 1
        Handle: 579 Address: DF:A9:FF:F6:B1:1A (OUI DF-A9-FF)
        Count: 1
zephyr.exe[250016]: < ACL Data TX: Handle 579 flags 0x00 dlen 10                                                   #140 10.556868
      ATT: Find Information Response (0x05) len 5
        Format: UUID-16 (0x01)
        Handle: 0x002d
        UUID: Client Characteristic Configuration (0x2902)
> HCI Event: Number of Completed Packets (0x13) plen 5                                                             #141 10.714611
        Num handles: 1
        Handle: 579 Address: DF:A9:FF:F6:B1:1A (OUI DF-A9-FF)
        Count: 1
        #140: len 10 (0 Kb/s)
        Latency: 157 msec (77-238 msec ~161 msec)
> ACL Data RX: Handle 579 flags 0x02 dlen 9                                                                        #142 10.714652
      ATT: Find Information Request (0x04) len 4
        Handle range: 0x0030-0x0030
zephyr.exe[250016]: < HCI Command: Host Number of Completed Packets (0x03|0x0035) plen 5                           #143 10.716675
        Num handles: 1
        Handle: 579 Address: DF:A9:FF:F6:B1:1A (OUI DF-A9-FF)
        Count: 1
zephyr.exe[250016]: < ACL Data TX: Handle 579 flags 0x00 dlen 10                                                   #144 10.716752
      ATT: Find Information Response (0x05) len 5
        Format: UUID-16 (0x01)
        Handle: 0x0030
        UUID: Client Characteristic Configuration (0x2902)
> HCI Event: Number of Completed Packets (0x13) plen 5                                                             #145 10.874440
        Num handles: 1
        Handle: 579 Address: DF:A9:FF:F6:B1:1A (OUI DF-A9-FF)
        Count: 1
        #144: len 10 (0 Kb/s)
        Latency: 157 msec (77-238 msec ~159 msec)
> ACL Data RX: Handle 579 flags 0x02 dlen 9                                                                        #146 10.874658
      ATT: Find Information Request (0x04) len 4
        Handle range: 0x0033-0x0033
zephyr.exe[250016]: < HCI Command: Host Number of Completed Packets (0x03|0x0035) plen 5                           #147 10.876768
        Num handles: 1
        Handle: 579 Address: DF:A9:FF:F6:B1:1A (OUI DF-A9-FF)
        Count: 1
zephyr.exe[250016]: < ACL Data TX: Handle 579 flags 0x00 dlen 10                                                   #148 10.876855
      ATT: Find Information Response (0x05) len 5
        Format: UUID-16 (0x01)
        Handle: 0x0033
        UUID: Client Characteristic Configuration (0x2902)
> HCI Event: Number of Completed Packets (0x13) plen 5                                                             #149 11.034639
        Num handles: 1
        Handle: 579 Address: DF:A9:FF:F6:B1:1A (OUI DF-A9-FF)
        Count: 1
        #148: len 10 (0 Kb/s)
        Latency: 157 msec (77-238 msec ~158 msec)
> ACL Data RX: Handle 579 flags 0x02 dlen 9                                                                        #150 11.034768
      ATT: Find Information Request (0x04) len 4
        Handle range: 0x0036-0x0036
zephyr.exe[250016]: < HCI Command: Host Number of Completed Packets (0x03|0x0035) plen 5                           #151 11.036746
        Num handles: 1
        Handle: 579 Address: DF:A9:FF:F6:B1:1A (OUI DF-A9-FF)
        Count: 1
zephyr.exe[250016]: < ACL Data TX: Handle 579 flags 0x00 dlen 10                                                   #152 11.036907
      ATT: Find Information Response (0x05) len 5
        Format: UUID-16 (0x01)
        Handle: 0x0036
        UUID: Client Characteristic Configuration (0x2902)
> HCI Event: Number of Completed Packets (0x13) plen 5                                                             #153 11.194535
        Num handles: 1
        Handle: 579 Address: DF:A9:FF:F6:B1:1A (OUI DF-A9-FF)
        Count: 1
        #152: len 10 (0 Kb/s)
        Latency: 157 msec (77-238 msec ~158 msec)
> ACL Data RX: Handle 579 flags 0x02 dlen 13                                                                       #154 11.194641
      ATT: Find By Type Value Request (0x06) len 8
        Handle range: 0x0001-0xffff
        Attribute type: Primary Service (0x2800)
          UUID: Audio Stream Control (0x184e)
zephyr.exe[250016]: < HCI Command: Host Number of Completed Packets (0x03|0x0035) plen 5                           #155 11.196407
        Num handles: 1
        Handle: 579 Address: DF:A9:FF:F6:B1:1A (OUI DF-A9-FF)
        Count: 1
zephyr.exe[250016]: < ACL Data TX: Handle 579 flags 0x00 dlen 9                                                    #156 11.196432
      ATT: Find By Type Value Response (0x07) len 4
        Handle range: 0x0037-0x0046
> HCI Event: Number of Completed Packets (0x13) plen 5                                                             #157 11.354470
        Num handles: 1
        Handle: 579 Address: DF:A9:FF:F6:B1:1A (OUI DF-A9-FF)
        Count: 1
        #156: len 9 (0 Kb/s)
        Latency: 158 msec (77-238 msec ~158 msec)
> ACL Data RX: Handle 579 flags 0x02 dlen 13                                                                       #158 11.354676
      ATT: Find By Type Value Request (0x06) len 8
        Handle range: 0x0047-0xffff
        Attribute type: Primary Service (0x2800)
          UUID: Audio Stream Control (0x184e)
zephyr.exe[250016]: < HCI Command: Host Number of Completed Packets (0x03|0x0035) plen 5                           #159 11.356451
        Num handles: 1
        Handle: 579 Address: DF:A9:FF:F6:B1:1A (OUI DF-A9-FF)
        Count: 1
zephyr.exe[250016]: < ACL Data TX: Handle 579 flags 0x00 dlen 9                                                    #160 11.356492
      ATT: Error Response (0x01) len 4
        Find By Type Value Request (0x06)
        Handle: 0x0047
        Error: Attribute Not Found (0x0a)
> HCI Event: Number of Completed Packets (0x13) plen 5                                                             #161 11.514543
        Num handles: 1
        Handle: 579 Address: DF:A9:FF:F6:B1:1A (OUI DF-A9-FF)
        Count: 1
        #160: len 9 (0 Kb/s)
        Latency: 158 msec (77-238 msec ~158 msec)
> ACL Data RX: Handle 579 flags 0x02 dlen 11                                                                       #162 11.514622
      ATT: Read By Type Request (0x08) len 6
        Handle range: 0x0037-0x0046
        Attribute type: Characteristic (0x2803)
zephyr.exe[250016]: < HCI Command: Host Number of Completed Packets (0x03|0x0035) plen 5                           #163 11.516875
        Num handles: 1
        Handle: 579 Address: DF:A9:FF:F6:B1:1A (OUI DF-A9-FF)
        Count: 1
zephyr.exe[250016]: < ACL Data TX: Handle 579 flags 0x00 dlen 27                                                   #164 11.516946
zephyr.exe[250016]: < ACL Data TX: Handle 579 flags 0x01 dlen 14                                                   #165 11.517231
      ATT: Read By Type Response (0x09) len 36
        Attribute data length: 7
        Attribute data list: 5 entries
        Handle: 0x0038
        Value: 1c3900c62b
            Properties: 0x1c
              Write Without Response (0x04)
              Write (0x08)
              Notify (0x10)
            Value Handle: 0x0039
            Value UUID: ASE Control Point (0x2bc6)
        Handle: 0x003b
        Value: 123c00c42b
            Properties: 0x12
              Read (0x02)
              Notify (0x10)
            Value Handle: 0x003c
            Value UUID: Sink ASE (0x2bc4)
        Handle: 0x003e
        Value: 123f00c42b
            Properties: 0x12
              Read (0x02)
              Notify (0x10)
            Value Handle: 0x003f
            Value UUID: Sink ASE (0x2bc4)
        Handle: 0x0041
        Value: 124200c52b
            Properties: 0x12
              Read (0x02)
              Notify (0x10)
            Value Handle: 0x0042
            Value UUID: Source ASE (0x2bc5)
        Handle: 0x0044
        Value: 124500c52b
            Properties: 0x12
              Read (0x02)
              Notify (0x10)
            Value Handle: 0x0045
            Value UUID: Source ASE (0x2bc5)
> HCI Event: Number of Completed Packets (0x13) plen 5                                                             #166 11.594818
        Num handles: 1
        Handle: 579 Address: DF:A9:FF:F6:B1:1A (OUI DF-A9-FF)
        Count: 1
        #164: len 27 (2 Kb/s)
        Latency: 77 msec (77-238 msec ~117 msec)
> HCI Event: Number of Completed Packets (0x13) plen 5                                                             #167 11.674468
        Num handles: 1
        Handle: 579 Address: DF:A9:FF:F6:B1:1A (OUI DF-A9-FF)
        Count: 1
        #165: len 14 (0 Kb/s)
        Latency: 157 msec (77-238 msec ~137 msec)
> ACL Data RX: Handle 579 flags 0x02 dlen 11                                                                       #168 11.674697
      ATT: Read By Type Request (0x08) len 6
        Handle range: 0x0045-0x0046
        Attribute type: Characteristic (0x2803)
zephyr.exe[250016]: < HCI Command: Host Number of Completed Packets (0x03|0x0035) plen 5                           #169 11.676927
        Num handles: 1
        Handle: 579 Address: DF:A9:FF:F6:B1:1A (OUI DF-A9-FF)
        Count: 1
zephyr.exe[250016]: < ACL Data TX: Handle 579 flags 0x00 dlen 9                                                    #170 11.677050
      ATT: Error Response (0x01) len 4
        Read By Type Request (0x08)
        Handle: 0x0045
        Error: Attribute Not Found (0x0a)
> HCI Event: Number of Completed Packets (0x13) plen 5                                                             #171 11.834396
        Num handles: 1
        Handle: 579 Address: DF:A9:FF:F6:B1:1A (OUI DF-A9-FF)
        Count: 1
        #170: len 9 (0 Kb/s)
        Latency: 157 msec (77-238 msec ~147 msec)
> ACL Data RX: Handle 579 flags 0x02 dlen 9                                                                        #172 11.834669
      ATT: Find Information Request (0x04) len 4
        Handle range: 0x003a-0x003a
zephyr.exe[250016]: < HCI Command: Host Number of Completed Packets (0x03|0x0035) plen 5                           #173 11.836763
        Num handles: 1
        Handle: 579 Address: DF:A9:FF:F6:B1:1A (OUI DF-A9-FF)
        Count: 1
zephyr.exe[250016]: < ACL Data TX: Handle 579 flags 0x00 dlen 10                                                   #174 11.836847
      ATT: Find Information Response (0x05) len 5
        Format: UUID-16 (0x01)
        Handle: 0x003a
        UUID: Client Characteristic Configuration (0x2902)
> HCI Event: Number of Completed Packets (0x13) plen 5                                                             #175 11.994571
        Num handles: 1
        Handle: 579 Address: DF:A9:FF:F6:B1:1A (OUI DF-A9-FF)
        Count: 1
        #174: len 10 (0 Kb/s)
        Latency: 157 msec (77-238 msec ~152 msec)
> ACL Data RX: Handle 579 flags 0x02 dlen 9                                                                        #176 11.994621
      ATT: Find Information Request (0x04) len 4
        Handle range: 0x003d-0x003d
zephyr.exe[250016]: < HCI Command: Host Number of Completed Packets (0x03|0x0035) plen 5                           #177 11.996624
        Num handles: 1
        Handle: 579 Address: DF:A9:FF:F6:B1:1A (OUI DF-A9-FF)
        Count: 1
zephyr.exe[250016]: < ACL Data TX: Handle 579 flags 0x00 dlen 10                                                   #178 11.996680
      ATT: Find Information Response (0x05) len 5
        Format: UUID-16 (0x01)
        Handle: 0x003d
        UUID: Client Characteristic Configuration (0x2902)
> HCI Event: Number of Completed Packets (0x13) plen 5                                                             #179 12.154572
        Num handles: 1
        Handle: 579 Address: DF:A9:FF:F6:B1:1A (OUI DF-A9-FF)
        Count: 1
        #178: len 10 (0 Kb/s)
        Latency: 157 msec (77-238 msec ~155 msec)
> ACL Data RX: Handle 579 flags 0x02 dlen 9                                                                        #180 12.154581
      ATT: Find Information Request (0x04) len 4
        Handle range: 0x0040-0x0040
zephyr.exe[250016]: < HCI Command: Host Number of Completed Packets (0x03|0x0035) plen 5                           #181 12.156772
        Num handles: 1
        Handle: 579 Address: DF:A9:FF:F6:B1:1A (OUI DF-A9-FF)
        Count: 1
zephyr.exe[250016]: < ACL Data TX: Handle 579 flags 0x00 dlen 10                                                   #182 12.156823
      ATT: Find Information Response (0x05) len 5
        Format: UUID-16 (0x01)
        Handle: 0x0040
        UUID: Client Characteristic Configuration (0x2902)
> HCI Event: Number of Completed Packets (0x13) plen 5                                                             #183 12.314538
        Num handles: 1
        Handle: 579 Address: DF:A9:FF:F6:B1:1A (OUI DF-A9-FF)
        Count: 1
        #182: len 10 (0 Kb/s)
        Latency: 157 msec (77-238 msec ~156 msec)
> ACL Data RX: Handle 579 flags 0x02 dlen 9                                                                        #184 12.314665
      ATT: Find Information Request (0x04) len 4
        Handle range: 0x0043-0x0043
zephyr.exe[250016]: < HCI Command: Host Number of Completed Packets (0x03|0x0035) plen 5                           #185 12.316786
        Num handles: 1
        Handle: 579 Address: DF:A9:FF:F6:B1:1A (OUI DF-A9-FF)
        Count: 1
zephyr.exe[250016]: < ACL Data TX: Handle 579 flags 0x00 dlen 10                                                   #186 12.316869
      ATT: Find Information Response (0x05) len 5
        Format: UUID-16 (0x01)
        Handle: 0x0043
        UUID: Client Characteristic Configuration (0x2902)
> HCI Event: Number of Completed Packets (0x13) plen 5                                                             #187 12.474454
        Num handles: 1
        Handle: 579 Address: DF:A9:FF:F6:B1:1A (OUI DF-A9-FF)
        Count: 1
        #186: len 10 (0 Kb/s)
        Latency: 157 msec (77-238 msec ~157 msec)
> ACL Data RX: Handle 579 flags 0x02 dlen 9                                                                        #188 12.474601
      ATT: Find Information Request (0x04) len 4
        Handle range: 0x0046-0x0046
zephyr.exe[250016]: < HCI Command: Host Number of Completed Packets (0x03|0x0035) plen 5                           #189 12.476808
        Num handles: 1
        Handle: 579 Address: DF:A9:FF:F6:B1:1A (OUI DF-A9-FF)
        Count: 1
zephyr.exe[250016]: < ACL Data TX: Handle 579 flags 0x00 dlen 10                                                   #190 12.476896
      ATT: Find Information Response (0x05) len 5
        Format: UUID-16 (0x01)
        Handle: 0x0046
        UUID: Client Characteristic Configuration (0x2902)
> HCI Event: Number of Completed Packets (0x13) plen 5                                                             #191 12.634537
        Num handles: 1
        Handle: 579 Address: DF:A9:FF:F6:B1:1A (OUI DF-A9-FF)
        Count: 1
        #190: len 10 (0 Kb/s)
        Latency: 157 msec (77-238 msec ~157 msec)
> ACL Data RX: Handle 579 flags 0x02 dlen 9                                                                        #192 12.634641
      ATT: Write Request (0x12) len 4
        Handle: 0x0033
          Data: 0000
zephyr.exe[250016]: < HCI Command: Host Number of Completed Packets (0x03|0x0035) plen 5                           #193 12.636643
        Num handles: 1
        Handle: 579 Address: DF:A9:FF:F6:B1:1A (OUI DF-A9-FF)
        Count: 1
zephyr.exe[250016]: < ACL Data TX: Handle 579 flags 0x00 dlen 5                                                    #194 12.636723
      ATT: Write Response (0x13) len 0
> HCI Event: Number of Completed Packets (0x13) plen 5                                                             #195 12.794358
        Num handles: 1
        Handle: 579 Address: DF:A9:FF:F6:B1:1A (OUI DF-A9-FF)
        Count: 1
        #194: len 5 (0 Kb/s)
        Latency: 157 msec (77-238 msec ~157 msec)
> ACL Data RX: Handle 579 flags 0x02 dlen 9                                                                        #196 12.794567
      ATT: Write Request (0x12) len 4
        Handle: 0x0033
          Data: 0100
zephyr.exe[250016]: < HCI Command: Host Number of Completed Packets (0x03|0x0035) plen 5                           #197 12.796951
        Num handles: 1
        Handle: 579 Address: DF:A9:FF:F6:B1:1A (OUI DF-A9-FF)
        Count: 1
zephyr.exe[250016]: < ACL Data TX: Handle 579 flags 0x00 dlen 5                                                    #198 12.797041
      ATT: Write Response (0x13) len 0
> HCI Event: Number of Completed Packets (0x13) plen 5                                                             #199 12.954514
        Num handles: 1
        Handle: 579 Address: DF:A9:FF:F6:B1:1A (OUI DF-A9-FF)
        Count: 1
        #198: len 5 (0 Kb/s)
        Latency: 157 msec (77-238 msec ~157 msec)
> ACL Data RX: Handle 579 flags 0x02 dlen 9                                                                        #200 12.954704
      ATT: Write Request (0x12) len 4
        Handle: 0x003a
          Data: 0000
zephyr.exe[250016]: < HCI Command: Host Number of Completed Packets (0x03|0x0035) plen 5                           #201 12.956812
        Num handles: 1
        Handle: 579 Address: DF:A9:FF:F6:B1:1A (OUI DF-A9-FF)
        Count: 1
zephyr.exe[250016]: < ACL Data TX: Handle 579 flags 0x00 dlen 5                                                    #202 12.956832
      ATT: Write Response (0x13) len 0
> HCI Event: Number of Completed Packets (0x13) plen 5                                                             #203 13.114292
        Num handles: 1
        Handle: 579 Address: DF:A9:FF:F6:B1:1A (OUI DF-A9-FF)
        Count: 1
        #202: len 5 (0 Kb/s)
        Latency: 157 msec (77-238 msec ~157 msec)
> ACL Data RX: Handle 579 flags 0x02 dlen 9                                                                        #204 13.114551
      ATT: Write Request (0x12) len 4
        Handle: 0x003a
          Data: 0100
zephyr.exe[250016]: < HCI Command: Host Number of Completed Packets (0x03|0x0035) plen 5                           #205 13.116890
        Num handles: 1
        Handle: 579 Address: DF:A9:FF:F6:B1:1A (OUI DF-A9-FF)
        Count: 1
zephyr.exe[250016]: < ACL Data TX: Handle 579 flags 0x00 dlen 5                                                    #206 13.117034
      ATT: Write Response (0x13) len 0
> HCI Event: Number of Completed Packets (0x13) plen 5                                                             #207 13.274404
        Num handles: 1
        Handle: 579 Address: DF:A9:FF:F6:B1:1A (OUI DF-A9-FF)
        Count: 1
        #206: len 5 (0 Kb/s)
        Latency: 157 msec (77-238 msec ~157 msec)
> ACL Data RX: Handle 579 flags 0x02 dlen 9                                                                        #208 13.274589
      ATT: Write Request (0x12) len 4
        Handle: 0x003d
          Data: 0000
zephyr.exe[250016]: < HCI Command: Host Number of Completed Packets (0x03|0x0035) plen 5                           #209 13.276264
        Num handles: 1
        Handle: 579 Address: DF:A9:FF:F6:B1:1A (OUI DF-A9-FF)
        Count: 1
zephyr.exe[250016]: < ACL Data TX: Handle 579 flags 0x00 dlen 5                                                    #210 13.276269
      ATT: Write Response (0x13) len 0
> HCI Event: Number of Completed Packets (0x13) plen 5                                                             #211 13.434319
        Num handles: 1
        Handle: 579 Address: DF:A9:FF:F6:B1:1A (OUI DF-A9-FF)
        Count: 1
        #210: len 5 (0 Kb/s)
        Latency: 158 msec (77-238 msec ~157 msec)
> ACL Data RX: Handle 579 flags 0x02 dlen 9                                                                        #212 13.434597
      ATT: Write Request (0x12) len 4
        Handle: 0x003d
          Data: 0100
zephyr.exe[250016]: < HCI Command: Host Number of Completed Packets (0x03|0x0035) plen 5                           #213 13.436897
        Num handles: 1
        Handle: 579 Address: DF:A9:FF:F6:B1:1A (OUI DF-A9-FF)
        Count: 1
zephyr.exe[250016]: < ACL Data TX: Handle 579 flags 0x00 dlen 5                                                    #214 13.437003
      ATT: Write Response (0x13) len 0
> HCI Event: Number of Completed Packets (0x13) plen 5                                                             #215 13.594398
        Num handles: 1
        Handle: 579 Address: DF:A9:FF:F6:B1:1A (OUI DF-A9-FF)
        Count: 1
        #214: len 5 (0 Kb/s)
        Latency: 157 msec (77-238 msec ~157 msec)
> ACL Data RX: Handle 579 flags 0x02 dlen 9                                                                        #216 13.594602
      ATT: Write Request (0x12) len 4
        Handle: 0x0040
          Data: 0000
zephyr.exe[250016]: < HCI Command: Host Number of Completed Packets (0x03|0x0035) plen 5                           #217 13.596594
        Num handles: 1
        Handle: 579 Address: DF:A9:FF:F6:B1:1A (OUI DF-A9-FF)
        Count: 1
zephyr.exe[250016]: < ACL Data TX: Handle 579 flags 0x00 dlen 5                                                    #218 13.596698
      ATT: Write Response (0x13) len 0
> HCI Event: Number of Completed Packets (0x13) plen 5                                                             #219 13.754468
        Num handles: 1
        Handle: 579 Address: DF:A9:FF:F6:B1:1A (OUI DF-A9-FF)
        Count: 1
        #218: len 5 (0 Kb/s)
        Latency: 157 msec (77-238 msec ~157 msec)
> ACL Data RX: Handle 579 flags 0x02 dlen 9                                                                        #220 13.754511
      ATT: Write Request (0x12) len 4
        Handle: 0x0040
          Data: 0100
zephyr.exe[250016]: < HCI Command: Host Number of Completed Packets (0x03|0x0035) plen 5                           #221 13.756673
        Num handles: 1
        Handle: 579 Address: DF:A9:FF:F6:B1:1A (OUI DF-A9-FF)
        Count: 1
zephyr.exe[250016]: < ACL Data TX: Handle 579 flags 0x00 dlen 5                                                    #222 13.756749
      ATT: Write Response (0x13) len 0
> HCI Event: Number of Completed Packets (0x13) plen 5                                                             #223 13.914312
        Num handles: 1
        Handle: 579 Address: DF:A9:FF:F6:B1:1A (OUI DF-A9-FF)
        Count: 1
        #222: len 5 (0 Kb/s)
        Latency: 157 msec (77-238 msec ~157 msec)
> ACL Data RX: Handle 579 flags 0x02 dlen 9                                                                        #224 13.914570
      ATT: Write Request (0x12) len 4
        Handle: 0x0043
          Data: 0000
zephyr.exe[250016]: < HCI Command: Host Number of Completed Packets (0x03|0x0035) plen 5                           #225 13.916882
        Num handles: 1
        Handle: 579 Address: DF:A9:FF:F6:B1:1A (OUI DF-A9-FF)
        Count: 1
zephyr.exe[250016]: < ACL Data TX: Handle 579 flags 0x00 dlen 5                                                    #226 13.916980
      ATT: Write Response (0x13) len 0
> HCI Event: Number of Completed Packets (0x13) plen 5                                                             #227 14.074295
        Num handles: 1
        Handle: 579 Address: DF:A9:FF:F6:B1:1A (OUI DF-A9-FF)
        Count: 1
        #226: len 5 (0 Kb/s)
        Latency: 157 msec (77-238 msec ~157 msec)
> ACL Data RX: Handle 579 flags 0x02 dlen 9                                                                        #228 14.074601
      ATT: Write Request (0x12) len 4
        Handle: 0x0043
          Data: 0100
zephyr.exe[250016]: < HCI Command: Host Number of Completed Packets (0x03|0x0035) plen 5                           #229 14.076858
        Num handles: 1
        Handle: 579 Address: DF:A9:FF:F6:B1:1A (OUI DF-A9-FF)
        Count: 1
zephyr.exe[250016]: < ACL Data TX: Handle 579 flags 0x00 dlen 5                                                    #230 14.076982
      ATT: Write Response (0x13) len 0
> HCI Event: Number of Completed Packets (0x13) plen 5                                                             #231 14.234299
        Num handles: 1
        Handle: 579 Address: DF:A9:FF:F6:B1:1A (OUI DF-A9-FF)
        Count: 1
        #230: len 5 (0 Kb/s)
        Latency: 157 msec (77-238 msec ~157 msec)
> ACL Data RX: Handle 579 flags 0x02 dlen 9                                                                        #232 14.235920
      ATT: Write Request (0x12) len 4
        Handle: 0x0046
          Data: 0000
zephyr.exe[250016]: < HCI Command: Host Number of Completed Packets (0x03|0x0035) plen 5                           #233 14.236814
        Num handles: 1
        Handle: 579 Address: DF:A9:FF:F6:B1:1A (OUI DF-A9-FF)
        Count: 1
zephyr.exe[250016]: < ACL Data TX: Handle 579 flags 0x00 dlen 5                                                    #234 14.236932
      ATT: Write Response (0x13) len 0
> HCI Event: Number of Completed Packets (0x13) plen 5                                                             #235 14.394349
        Num handles: 1
        Handle: 579 Address: DF:A9:FF:F6:B1:1A (OUI DF-A9-FF)
        Count: 1
        #234: len 5 (0 Kb/s)
        Latency: 157 msec (77-238 msec ~157 msec)
> ACL Data RX: Handle 579 flags 0x02 dlen 9                                                                        #236 14.394526
      ATT: Write Request (0x12) len 4
        Handle: 0x0046
          Data: 0100
zephyr.exe[250016]: < HCI Command: Host Number of Completed Packets (0x03|0x0035) plen 5                           #237 14.396830
        Num handles: 1
        Handle: 579 Address: DF:A9:FF:F6:B1:1A (OUI DF-A9-FF)
        Count: 1
zephyr.exe[250016]: < ACL Data TX: Handle 579 flags 0x00 dlen 5                                                    #238 14.396906
      ATT: Write Response (0x13) len 0
> HCI Event: Number of Completed Packets (0x13) plen 5                                                             #239 14.554264
        Num handles: 1
        Handle: 579 Address: DF:A9:FF:F6:B1:1A (OUI DF-A9-FF)
        Count: 1
        #238: len 5 (0 Kb/s)
        Latency: 157 msec (77-238 msec ~157 msec)
> ACL Data RX: Handle 579 flags 0x02 dlen 7                                                                        #240 14.554610
      ATT: Read Request (0x0a) len 2
        Handle: 0x003c
zephyr.exe[250016]: < HCI Command: Host Number of Completed Packets (0x03|0x0035) plen 5                           #241 14.556956
        Num handles: 1
        Handle: 579 Address: DF:A9:FF:F6:B1:1A (OUI DF-A9-FF)
        Count: 1
zephyr.exe[250016]: < ACL Data TX: Handle 579 flags 0x00 dlen 7                                                    #242 14.557102
      ATT: Read Response (0x0b) len 2
> HCI Event: Number of Completed Packets (0x13) plen 5                                                             #243 14.714392
        Num handles: 1
        Handle: 579 Address: DF:A9:FF:F6:B1:1A (OUI DF-A9-FF)
        Count: 1
        #242: len 7 (0 Kb/s)
        Latency: 157 msec (77-238 msec ~157 msec)
> ACL Data RX: Handle 579 flags 0x02 dlen 7                                                                        #244 14.714521
      ATT: Read Request (0x0a) len 2
        Handle: 0x003f
zephyr.exe[250016]: < HCI Command: Host Number of Completed Packets (0x03|0x0035) plen 5                           #245 14.716441
        Num handles: 1
        Handle: 579 Address: DF:A9:FF:F6:B1:1A (OUI DF-A9-FF)
        Count: 1
zephyr.exe[250016]: < ACL Data TX: Handle 579 flags 0x00 dlen 7                                                    #246 14.716485
      ATT: Read Response (0x0b) len 2
> HCI Event: Number of Completed Packets (0x13) plen 5                                                             #247 14.874284
        Num handles: 1
        Handle: 579 Address: DF:A9:FF:F6:B1:1A (OUI DF-A9-FF)
        Count: 1
        #246: len 7 (0 Kb/s)
        Latency: 157 msec (77-238 msec ~157 msec)
> ACL Data RX: Handle 579 flags 0x02 dlen 7                                                                        #248 14.874542
      ATT: Read Request (0x0a) len 2
        Handle: 0x0042
zephyr.exe[250016]: < HCI Command: Host Number of Completed Packets (0x03|0x0035) plen 5                           #249 14.876299
        Num handles: 1
        Handle: 579 Address: DF:A9:FF:F6:B1:1A (OUI DF-A9-FF)
        Count: 1
zephyr.exe[250016]: < ACL Data TX: Handle 579 flags 0x00 dlen 7                                                    #250 14.876358
      ATT: Read Response (0x0b) len 2
> HCI Event: Number of Completed Packets (0x13) plen 5                                                             #251 15.034355
        Num handles: 1
        Handle: 579 Address: DF:A9:FF:F6:B1:1A (OUI DF-A9-FF)
        Count: 1
        #250: len 7 (0 Kb/s)
        Latency: 157 msec (77-238 msec ~157 msec)
> ACL Data RX: Handle 579 flags 0x02 dlen 7                                                                        #252 15.034602
      ATT: Read Request (0x0a) len 2
        Handle: 0x0045
zephyr.exe[250016]: < HCI Command: Host Number of Completed Packets (0x03|0x0035) plen 5                           #253 15.036805
        Num handles: 1
        Handle: 579 Address: DF:A9:FF:F6:B1:1A (OUI DF-A9-FF)
        Count: 1
zephyr.exe[250016]: < ACL Data TX: Handle 579 flags 0x00 dlen 7                                                    #254 15.036918
      ATT: Read Response (0x0b) len 2
> HCI Event: Number of Completed Packets (0x13) plen 5                                                             #255 15.194468
        Num handles: 1
        Handle: 579 Address: DF:A9:FF:F6:B1:1A (OUI DF-A9-FF)
        Count: 1
        #254: len 7 (0 Kb/s)
        Latency: 157 msec (77-238 msec ~157 msec)
> ACL Data RX: Handle 579 flags 0x02 dlen 7                                                                        #256 15.194497
      ATT: Read Request (0x0a) len 2
        Handle: 0x0029
zephyr.exe[250016]: < HCI Command: Host Number of Completed Packets (0x03|0x0035) plen 5                           #257 15.196853
        Num handles: 1
        Handle: 579 Address: DF:A9:FF:F6:B1:1A (OUI DF-A9-FF)
        Count: 1
zephyr.exe[250016]: < ACL Data TX: Handle 579 flags 0x00 dlen 9                                                    #258 15.196925
      ATT: Read Response (0x0b) len 4
> HCI Event: Number of Completed Packets (0x13) plen 5                                                             #259 15.354306
        Num handles: 1
        Handle: 579 Address: DF:A9:FF:F6:B1:1A (OUI DF-A9-FF)
        Count: 1
        #258: len 9 (0 Kb/s)
        Latency: 157 msec (77-238 msec ~157 msec)
> ACL Data RX: Handle 579 flags 0x02 dlen 7                                                                        #260 15.354588
      ATT: Read Request (0x0a) len 2
        Handle: 0x0026
zephyr.exe[250016]: < HCI Command: Host Number of Completed Packets (0x03|0x0035) plen 5                           #261 15.356924
        Num handles: 1
        Handle: 579 Address: DF:A9:FF:F6:B1:1A (OUI DF-A9-FF)
        Count: 1
zephyr.exe[250016]: < ACL Data TX: Handle 579 flags 0x00 dlen 27                                                   #262 15.357014
zephyr.exe[250016]: < ACL Data TX: Handle 579 flags 0x01 dlen 27                                                   #263 15.357180
zephyr.exe[250016]: < ACL Data TX: Handle 579 flags 0x01 dlen 12                                                   #264 15.357197
      ATT: Read Response (0x0b) len 61
> HCI Event: Number of Completed Packets (0x13) plen 5                                                             #265 15.434808
        Num handles: 1
        Handle: 579 Address: DF:A9:FF:F6:B1:1A (OUI DF-A9-FF)
        Count: 1
        #262: len 27 (2 Kb/s)
        Latency: 77 msec (77-238 msec ~117 msec)
> HCI Event: Number of Completed Packets (0x13) plen 5                                                             #266 15.435312
        Num handles: 1
        Handle: 579 Address: DF:A9:FF:F6:B1:1A (OUI DF-A9-FF)
        Count: 1
        #263: len 27 (2 Kb/s)
        Latency: 78 msec (77-238 msec ~97 msec)
> HCI Event: Number of Completed Packets (0x13) plen 5                                                             #267 15.514192
        Num handles: 1
        Handle: 579 Address: DF:A9:FF:F6:B1:1A (OUI DF-A9-FF)
        Count: 1
        #264: len 12 (0 Kb/s)
        Latency: 156 msec (77-238 msec ~127 msec)
> ACL Data RX: Handle 579 flags 0x02 dlen 7                                                                        #268 15.594260
      ATT: Read Request (0x0a) len 2
        Handle: 0x002f
zephyr.exe[250016]: < HCI Command: Host Number of Completed Packets (0x03|0x0035) plen 5                           #269 15.596491
        Num handles: 1
        Handle: 579 Address: DF:A9:FF:F6:B1:1A (OUI DF-A9-FF)
        Count: 1
zephyr.exe[250016]: < ACL Data TX: Handle 579 flags 0x00 dlen 9                                                    #270 15.596674
      ATT: Read Response (0x0b) len 4
> HCI Event: Number of Completed Packets (0x13) plen 5                                                             #271 15.754291
        Num handles: 1
        Handle: 579 Address: DF:A9:FF:F6:B1:1A (OUI DF-A9-FF)
        Count: 1
        #270: len 9 (0 Kb/s)
        Latency: 157 msec (77-238 msec ~142 msec)
> ACL Data RX: Handle 579 flags 0x02 dlen 7                                                                        #272 15.754472
      ATT: Read Request (0x0a) len 2
        Handle: 0x002c
zephyr.exe[250016]: < HCI Command: Host Number of Completed Packets (0x03|0x0035) plen 5                           #273 15.756617
        Num handles: 1
        Handle: 579 Address: DF:A9:FF:F6:B1:1A (OUI DF-A9-FF)
        Count: 1
zephyr.exe[250016]: < ACL Data TX: Handle 579 flags 0x00 dlen 27                                                   #274 15.756669
zephyr.exe[250016]: < ACL Data TX: Handle 579 flags 0x01 dlen 27                                                   #275 15.756778
zephyr.exe[250016]: < ACL Data TX: Handle 579 flags 0x01 dlen 12                                                   #276 15.756789
      ATT: Read Response (0x0b) len 61
> HCI Event: Number of Completed Packets (0x13) plen 5                                                             #277 15.834710
        Num handles: 1
        Handle: 579 Address: DF:A9:FF:F6:B1:1A (OUI DF-A9-FF)
        Count: 1
        #274: len 27 (2 Kb/s)
        Latency: 78 msec (77-238 msec ~110 msec)
> HCI Event: Number of Completed Packets (0x13) plen 5                                                             #278 15.835192
        Num handles: 1
        Handle: 579 Address: DF:A9:FF:F6:B1:1A (OUI DF-A9-FF)
        Count: 1
        #275: len 27 (2 Kb/s)
        Latency: 78 msec (77-238 msec ~94 msec)
> HCI Event: Number of Completed Packets (0x13) plen 5                                                             #279 15.914292
        Num handles: 1
        Handle: 579 Address: DF:A9:FF:F6:B1:1A (OUI DF-A9-FF)
        Count: 1
        #276: len 12 (0 Kb/s)
        Latency: 157 msec (77-238 msec ~125 msec)
> ACL Data RX: Handle 579 flags 0x02 dlen 7                                                                        #280 15.914491
      ATT: Read Request (0x0a) len 2
        Handle: 0x0032
zephyr.exe[250016]: < HCI Command: Host Number of Completed Packets (0x03|0x0035) plen 5                           #281 15.916438
        Num handles: 1
        Handle: 579 Address: DF:A9:FF:F6:B1:1A (OUI DF-A9-FF)
        Count: 1
zephyr.exe[250016]: < ACL Data TX: Handle 579 flags 0x00 dlen 9                                                    #282 15.916463
      ATT: Read Response (0x0b) len 4
> HCI Event: Number of Completed Packets (0x13) plen 5                                                             #283 16.074269
        Num handles: 1
        Handle: 579 Address: DF:A9:FF:F6:B1:1A (OUI DF-A9-FF)
        Count: 1
        #282: len 9 (0 Kb/s)
        Latency: 157 msec (77-238 msec ~141 msec)
> ACL Data RX: Handle 579 flags 0x02 dlen 7                                                                        #284 16.074510
      ATT: Read Request (0x0a) len 2
        Handle: 0x0035
zephyr.exe[250016]: < HCI Command: Host Number of Completed Packets (0x03|0x0035) plen 5                           #285 16.076820
        Num handles: 1
        Handle: 579 Address: DF:A9:FF:F6:B1:1A (OUI DF-A9-FF)
        Count: 1
zephyr.exe[250016]: < ACL Data TX: Handle 579 flags 0x00 dlen 9                                                    #286 16.076961
      ATT: Read Response (0x0b) len 4
> HCI Event: Number of Completed Packets (0x13) plen 5                                                             #287 16.234174
        Num handles: 1
        Handle: 579 Address: DF:A9:FF:F6:B1:1A (OUI DF-A9-FF)
        Count: 1
        #286: len 9 (0 Kb/s)
        Latency: 157 msec (77-238 msec ~149 msec)
> ACL Data RX: Handle 579 flags 0x02 dlen 27                                                                       #288 16.314617
> ACL Data RX: Handle 579 flags 0x01 dlen 27                                                                       #289 16.315069
> ACL Data RX: Handle 579 flags 0x01 dlen 5                                                                        #290 16.315227
      ATT: Write Command (0x52) len 54
        Handle: 0x0039
          Data: 01020101020600000000100201030202010304280005030200000003010206000000001002010302020103042800050301000000
zephyr.exe[250016]: < HCI Command: Host Number of Completed Packets (0x03|0x0035) plen 5                           #291 16.316194
        Num handles: 1
        Handle: 579 Address: DF:A9:FF:F6:B1:1A (OUI DF-A9-FF)
        Count: 1
zephyr.exe[250016]: < HCI Command: Host Number of Completed Packets (0x03|0x0035) plen 5                           #292 16.316224
        Num handles: 1
        Handle: 579 Address: DF:A9:FF:F6:B1:1A (OUI DF-A9-FF)
        Count: 1
zephyr.exe[250016]: < HCI Command: Host Number of Completed Packets (0x03|0x0035) plen 5                           #293 16.316887
        Num handles: 1
        Handle: 579 Address: DF:A9:FF:F6:B1:1A (OUI DF-A9-FF)
        Count: 1
zephyr.exe[250016]: < ACL Data TX: Handle 579 flags 0x00 dlen 15                                                   #294 16.317092
      ATT: Handle Value Notification (0x1b) len 10
        Handle: 0x0039
          Data: 0102010000030000
zephyr.exe[250016]: < ACL Data TX: Handle 579 flags 0x00 dlen 27                                                   #295 16.317292
zephyr.exe[250016]: < ACL Data TX: Handle 579 flags 0x01 dlen 21                                                   #296 16.317363
      ATT: Handle Value Notification (0x1b) len 43
        Handle: 0x003c
          Data: 01010002020a00102700409c00102700409c0006000000001002010302020103042800050302000000
> HCI Event: Number of Completed Packets (0x13) plen 5                                                             #297 16.394660
        Num handles: 1
        Handle: 579 Address: DF:A9:FF:F6:B1:1A (OUI DF-A9-FF)
        Count: 1
        #294: len 15 (1 Kb/s)
        Latency: 77 msec (77-238 msec ~113 msec)
> HCI Event: Number of Completed Packets (0x13) plen 5                                                             #298 16.395103
        Num handles: 1
        Handle: 579 Address: DF:A9:FF:F6:B1:1A (OUI DF-A9-FF)
        Count: 1
        #295: len 27 (2 Kb/s)
        Latency: 77 msec (77-238 msec ~95 msec)
zephyr.exe[250016]: < ACL Data TX: Handle 579 flags 0x00 dlen 27                                                   #299 16.396549
zephyr.exe[250016]: < ACL Data TX: Handle 579 flags 0x01 dlen 21                                                   #300 16.396744
      ATT: Handle Value Notification (0x1b) len 43
        Handle: 0x0042
          Data: 03010002020a00102700409c00102700409c0006000000001002010302020103042800050301000000
> HCI Event: Number of Completed Packets (0x13) plen 5                                                             #301 16.474127
        Num handles: 1
        Handle: 579 Address: DF:A9:FF:F6:B1:1A (OUI DF-A9-FF)
        Count: 1
        #296: len 21 (1 Kb/s)
        Latency: 156 msec (77-238 msec ~126 msec)
> HCI Event: Number of Completed Packets (0x13) plen 5                                                             #302 16.474707
        Num handles: 1
        Handle: 579 Address: DF:A9:FF:F6:B1:1A (OUI DF-A9-FF)
        Count: 1
        #299: len 27 (2 Kb/s)
        Latency: 78 msec (77-238 msec ~102 msec)
> HCI Event: Number of Completed Packets (0x13) plen 5                                                             #303 16.554141
        Num handles: 1
        Handle: 579 Address: DF:A9:FF:F6:B1:1A (OUI DF-A9-FF)
        Count: 1
        #300: len 21 (1 Kb/s)
        Latency: 157 msec (77-238 msec ~129 msec)
> ACL Data RX: Handle 579 flags 0x02 dlen 27                                                                       #304 16.634594
> ACL Data RX: Handle 579 flags 0x01 dlen 7                                                                        #305 16.634778
      ATT: Write Command (0x52) len 29
        Handle: 0x0039
          Data: 010102010206000000001002010302020103042800050304000000
zephyr.exe[250016]: < HCI Command: Host Number of Completed Packets (0x03|0x0035) plen 5                           #306 16.636354
        Num handles: 1
        Handle: 579 Address: DF:A9:FF:F6:B1:1A (OUI DF-A9-FF)
        Count: 1
zephyr.exe[250016]: < HCI Command: Host Number of Completed Packets (0x03|0x0035) plen 5                           #307 16.637232
        Num handles: 1
        Handle: 579 Address: DF:A9:FF:F6:B1:1A (OUI DF-A9-FF)
        Count: 1
zephyr.exe[250016]: < ACL Data TX: Handle 579 flags 0x00 dlen 12                                                   #308 16.637549
      ATT: Handle Value Notification (0x1b) len 7
        Handle: 0x0039
          Data: 0101020000
zephyr.exe[250016]: < ACL Data TX: Handle 579 flags 0x00 dlen 27                                                   #309 16.637570
zephyr.exe[250016]: < ACL Data TX: Handle 579 flags 0x01 dlen 21                                                   #310 16.638416
      ATT: Handle Value Notification (0x1b) len 43
        Handle: 0x003f
          Data: 02010002020a00102700409c00102700409c0006000000001002010302020103042800050304000000
> HCI Event: Number of Completed Packets (0x13) plen 5                                                             #311 16.714622
        Num handles: 1
        Handle: 579 Address: DF:A9:FF:F6:B1:1A (OUI DF-A9-FF)
        Count: 1
        #308: len 12 (1 Kb/s)
        Latency: 77 msec (77-238 msec ~103 msec)
> HCI Event: Number of Completed Packets (0x13) plen 5                                                             #312 16.715139
        Num handles: 1
        Handle: 579 Address: DF:A9:FF:F6:B1:1A (OUI DF-A9-FF)
        Count: 1
        #309: len 27 (2 Kb/s)
        Latency: 77 msec (77-238 msec ~90 msec)
> HCI Event: Number of Completed Packets (0x13) plen 5                                                             #313 16.794257
        Num handles: 1
        Handle: 579 Address: DF:A9:FF:F6:B1:1A (OUI DF-A9-FF)
        Count: 1
        #310: len 21 (1 Kb/s)
        Latency: 155 msec (77-238 msec ~123 msec)
> ACL Data RX: Handle 579 flags 0x02 dlen 27                                                                       #314 16.874566
> ACL Data RX: Handle 579 flags 0x01 dlen 27                                                                       #315 16.875005
> ACL Data RX: Handle 579 flags 0x01 dlen 3                                                                        #316 16.875223
      ATT: Write Command (0x52) len 52
        Handle: 0x0039
          Data: 020301010110270000022800020a00a8610003010110270000022800020a00a8610002010210270000022800020a00a86100
zephyr.exe[250016]: < HCI Command: Host Number of Completed Packets (0x03|0x0035) plen 5                           #317 16.876175
        Num handles: 1
        Handle: 579 Address: DF:A9:FF:F6:B1:1A (OUI DF-A9-FF)
        Count: 1
zephyr.exe[250016]: < HCI Command: Host Number of Completed Packets (0x03|0x0035) plen 5                           #318 16.876181
        Num handles: 1
        Handle: 579 Address: DF:A9:FF:F6:B1:1A (OUI DF-A9-FF)
        Count: 1
zephyr.exe[250016]: < HCI Command: Host Number of Completed Packets (0x03|0x0035) plen 5                           #319 16.876359
        Num handles: 1
        Handle: 579 Address: DF:A9:FF:F6:B1:1A (OUI DF-A9-FF)
        Count: 1
zephyr.exe[250016]: < ACL Data TX: Handle 579 flags 0x00 dlen 18                                                   #320 16.876537
      ATT: Handle Value Notification (0x1b) len 13
        Handle: 0x0039
          Data: 0203010000030000020000
zephyr.exe[250016]: < ACL Data TX: Handle 579 flags 0x00 dlen 24                                                   #321 16.876671
      ATT: Handle Value Notification (0x1b) len 19
        Handle: 0x003c
          Data: 0102010110270000022800020a00a86100
zephyr.exe[250016]: < ACL Data TX: Handle 579 flags 0x00 dlen 24                                                   #322 16.876867
      ATT: Handle Value Notification (0x1b) len 19
        Handle: 0x0042
          Data: 0302010110270000022800020a00a86100
> HCI Event: Number of Completed Packets (0x13) plen 5                                                             #323 16.954640
        Num handles: 1
        Handle: 579 Address: DF:A9:FF:F6:B1:1A (OUI DF-A9-FF)
        Count: 1
        #320: len 18 (1 Kb/s)
        Latency: 78 msec (77-238 msec ~100 msec)
> HCI Event: Number of Completed Packets (0x13) plen 5                                                             #324 16.955178
        Num handles: 1
        Handle: 579 Address: DF:A9:FF:F6:B1:1A (OUI DF-A9-FF)
        Count: 1
        #321: len 24 (2 Kb/s)
        Latency: 78 msec (77-238 msec ~89 msec)
zephyr.exe[250016]: < ACL Data TX: Handle 579 flags 0x00 dlen 24                                                   #325 16.956599
      ATT: Handle Value Notification (0x1b) len 19
        Handle: 0x003f
          Data: 0202010210270000022800020a00a86100
> HCI Event: Number of Completed Packets (0x13) plen 5                                                             #326 17.034277
        Num handles: 1
        Handle: 579 Address: DF:A9:FF:F6:B1:1A (OUI DF-A9-FF)
        Count: 1
        #322: len 24 (1 Kb/s)
        Latency: 157 msec (77-238 msec ~123 msec)
> HCI Event: Number of Completed Packets (0x13) plen 5                                                             #327 17.114252
        Num handles: 1
        Handle: 579 Address: DF:A9:FF:F6:B1:1A (OUI DF-A9-FF)
        Count: 1
        #325: len 24 (1 Kb/s)
        Latency: 157 msec (77-238 msec ~140 msec)
> ACL Data RX: Handle 579 flags 0x02 dlen 21                                                                       #328 17.114615
      ATT: Write Command (0x52) len 16
        Handle: 0x0039
          Data: 030201040302ff0f03040302ff0f
zephyr.exe[250016]: < HCI Command: Host Number of Completed Packets (0x03|0x0035) plen 5                           #329 17.116549
        Num handles: 1
        Handle: 579 Address: DF:A9:FF:F6:B1:1A (OUI DF-A9-FF)
        Count: 1
zephyr.exe[250016]: < ACL Data TX: Handle 579 flags 0x00 dlen 15                                                   #330 17.116619
      ATT: Handle Value Notification (0x1b) len 10
        Handle: 0x0039
          Data: 0302010000030000
zephyr.exe[250016]: < ACL Data TX: Handle 579 flags 0x00 dlen 16                                                   #331 17.116839
      ATT: Handle Value Notification (0x1b) len 11
        Handle: 0x003c
          Data: 01030101040302ff0f
zephyr.exe[250016]: < ACL Data TX: Handle 579 flags 0x00 dlen 16                                                   #332 17.117061
      ATT: Handle Value Notification (0x1b) len 11
        Handle: 0x0042
          Data: 03030101040302ff0f
> HCI Event: Number of Completed Packets (0x13) plen 5                                                             #333 17.194607
        Num handles: 1
        Ha