Bluetooth monitor ver 5.72
= Note: Linux version 6.14.0-36-generic (x86_64)                       0.119441
= Note: Bluetooth subsystem version 2.22                               0.119443
= New Index: 00:00:00:00:00:00 (Primary,UART,hci1)              [hci1] 0.119444
= New Index: 48:5F:99:8E:E0:64 (Primary,USB,hci0)               [hci0] 0.119444
= Open Index: 00:00:00:00:00:00                                 [hci1] 0.233159
= Index Info: 00:00:00:00:00:00 (Nordic Semiconductor ASA)      [hci1] 0.233178
@ USER Open: main (privileged) version 2.22            {0x0001} [hci1] 0.233187
< HCI Command: Reset (0x03|0x0003) plen 0                    #1 [hci1] 0.234564
> HCI Event: Command Complete (0x0e) plen 4                  #2 [hci1] 0.235073
      Reset (0x03|0x0003) ncmd 1
        Status: Success (0x00)
< HCI Command: Read Local Supported... (0x04|0x0003) plen 0  #3 [hci1] 0.252990
> HCI Event: Command Complete (0x0e) plen 12                 #4 [hci1] 0.253509
      Read Local Supported Features (0x04|0x0003) ncmd 1
        Status: Success (0x00)
        Features: 0x00 0x00 0x00 0x00 0x60 0x00 0x00 0x00
          BR/EDR Not Supported
          LE Supported (Controller)
< HCI Command: Read Local Version In.. (0x04|0x0001) plen 0  #5 [hci1] 0.272724
> HCI Event: Command Complete (0x0e) plen 12                 #6 [hci1] 0.273220
      Read Local Version Information (0x04|0x0001) ncmd 1
        Status: Success (0x00)
        HCI version: Reserved (0x0f) - Revision 12393 (0x3069)
        LMP version: Reserved (0x0f) - Subversion 12393 (0x3069)
        Manufacturer: Nordic Semiconductor ASA (89)
< HCI Command: Read Local Supported... (0x04|0x0002) plen 0  #7 [hci1] 0.292583
> HCI Event: Command Complete (0x0e) plen 68                 #8 [hci1] 0.293632
      Read Local Supported Commands (0x04|0x0002) ncmd 1
        Status: Success (0x00)
        Commands: 119 entries
          Disconnect (Octet 0 - Bit 5)
          Read Remote Version Information (Octet 2 - Bit 7)
          Set Event Mask (Octet 5 - Bit 6)
          Reset (Octet 5 - Bit 7)
          Read Connection Accept Timeout (Octet 7 - Bit 2)
          Write Connection Accept Timeout (Octet 7 - Bit 3)
          Read Transmit Power Level (Octet 10 - Bit 2)
          Set Controller To Host Flow Control (Octet 10 - Bit 5)
          Host Buffer Size (Octet 10 - Bit 6)
          Host Number of Completed Packets (Octet 10 - Bit 7)
          Read Local Version Information (Octet 14 - Bit 3)
          Read Local Supported Features (Octet 14 - Bit 5)
          Read BD ADDR (Octet 15 - Bit 1)
          Read RSSI (Octet 15 - Bit 5)
          Set Event Mask Page 2 (Octet 22 - Bit 2)
          LE Set Event Mask (Octet 25 - Bit 0)
          LE Read Buffer Size (Octet 25 - Bit 1)
          LE Read Local Supported Features (Octet 25 - Bit 2)
          LE Set Random Address (Octet 25 - Bit 4)
          LE Set Advertising Parameters (Octet 25 - Bit 5)
          LE Read Advertising Channel TX Power (Octet 25 - Bit 6)
          LE Set Advertising Data (Octet 25 - Bit 7)
          LE Set Scan Response Data (Octet 26 - Bit 0)
          LE Set Advertise Enable (Octet 26 - Bit 1)
          LE Set Scan Parameters (Octet 26 - Bit 2)
          LE Set Scan Enable (Octet 26 - Bit 3)
          LE Create Connection (Octet 26 - Bit 4)
          LE Create Connection Cancel (Octet 26 - Bit 5)
          LE Read Accept List Size (Octet 26 - Bit 6)
          LE Clear Accept List (Octet 26 - Bit 7)
          LE Add Device To Accept List (Octet 27 - Bit 0)
          LE Remove Device From Accept List (Octet 27 - Bit 1)
          LE Connection Update (Octet 27 - Bit 2)
          LE Set Host Channel Classification (Octet 27 - Bit 3)
          LE Read Channel Map (Octet 27 - Bit 4)
          LE Read Remote Used Features (Octet 27 - Bit 5)
          LE Encrypt (Octet 27 - Bit 6)
          LE Rand (Octet 27 - Bit 7)
          LE Start Encryption (Octet 28 - Bit 0)
          LE Long Term Key Request Reply (Octet 28 - Bit 1)
          LE Long Term Key Request Neg Reply (Octet 28 - Bit 2)
          LE Read Supported States (Octet 28 - Bit 3)
          LE Receiver Test (Octet 28 - Bit 4)
          LE Transmitter Test (Octet 28 - Bit 5)
          LE Test End (Octet 28 - Bit 6)
          Read Authenticated Payload Timeout (Octet 32 - Bit 4)
          Write Authenticated Payload Timeout (Octet 32 - Bit 5)
          LE Set Data Length (Octet 33 - Bit 6)
          LE Read Suggested Default Data Length (Octet 33 - Bit 7)
          LE Write Suggested Default Data Length (Octet 34 - Bit 0)
          LE Add Device To Resolving List (Octet 34 - Bit 3)
          LE Remove Device From Resolving List (Octet 34 - Bit 4)
          LE Clear Resolving List (Octet 34 - Bit 5)
          LE Read Resolving List Size (Octet 34 - Bit 6)
          LE Set Address Resolution Enable (Octet 35 - Bit 1)
          LE Set Resolvable Private Address Timeout (Octet 35 - Bit 2)
          LE Read Maximum Data Length (Octet 35 - Bit 3)
          LE Read PHY (Octet 35 - Bit 4)
          LE Set Default PHY (Octet 35 - Bit 5)
          LE Set PHY (Octet 35 - Bit 6)
          LE Enhanced Receiver Test (Octet 35 - Bit 7)
          LE Enhanced Transmitter Test (Octet 36 - Bit 0)
          LE Set Advertising Set Random Address (Octet 36 - Bit 1)
          LE Set Extended Advertising Parameters (Octet 36 - Bit 2)
          LE Set Extended Advertising Data (Octet 36 - Bit 3)
          LE Set Extended Scan Response Data (Octet 36 - Bit 4)
          LE Set Extended Advertising Enable (Octet 36 - Bit 5)
          LE Read Maximum Advertising Data Length (Octet 36 - Bit 6)
          LE Read Number of Supported Advertising Sets (Octet 36 - Bit 7)
          LE Remove Advertising Set (Octet 37 - Bit 0)
          LE Clear Advertising Sets (Octet 37 - Bit 1)
          LE Set Periodic Advertising Parameters (Octet 37 - Bit 2)
          LE Set Periodic Advertising Data (Octet 37 - Bit 3)
          LE Set Periodic Advertising Enable (Octet 37 - Bit 4)
          LE Set Extended Scan Parameters (Octet 37 - Bit 5)
          LE Set Extended Scan Enable (Octet 37 - Bit 6)
          LE Extended Create Connection (Octet 37 - Bit 7)
          LE Periodic Advertising Create Sync (Octet 38 - Bit 0)
          LE Periodic Advertising Create Sync Cancel (Octet 38 - Bit 1)
          LE Periodic Advertising Terminate Sync (Octet 38 - Bit 2)
          LE Add Device To Periodic Advertiser List (Octet 38 - Bit 3)
          LE Remove Device From Periodic Advertiser List (Octet 38 - Bit 4)
          LE Clear Periodic Advertiser List (Octet 38 - Bit 5)
          LE Read Periodic Advertiser List Size (Octet 38 - Bit 6)
          LE Read Transmit Power (Octet 38 - Bit 7)
          LE Read RF Path Compensation (Octet 39 - Bit 0)
          LE Write RF Path Compensation (Octet 39 - Bit 1)
          LE Set Privacy Mode (Octet 39 - Bit 2)
          LE Periodic Advertising Receive Enable (Octet 40 - Bit 5)
          LE Periodic Advertising Sync Transfer (Octet 40 - Bit 6)
          LE Periodic Advertising Set Info Transfer (Octet 40 - Bit 7)
          LE Periodic Advertising Sync Transfer Parameters (Octet 41 - Bit 0)
          LE Set Default Periodic Advertisng Sync Transfer Parameters (Octet 41 - Bit 1)
          LE Read Buffer v2 (Octet 41 - Bit 5)
          LE Read ISO TX Sync (Octet 41 - Bit 6)
          LE Set Connected Isochronous Group Parameters (Octet 41 - Bit 7)
          LE Set Connected Isochronous Group Parameters Test (Octet 42 - Bit 0)
          LE Create Connected Isochronous Stream (Octet 42 - Bit 1)
          LE Remove Connected Isochronous Group (Octet 42 - Bit 2)
          LE Accept Connected Isochronous Stream Request (Octet 42 - Bit 3)
          LE Reject Connected Isochronous Stream Request (Octet 42 - Bit 4)
          LE Create Broadcast Isochronous Group (Octet 42 - Bit 5)
          LE Create Broadcast Isochronous Group Test (Octet 42 - Bit 6)
          LE Terminate Broadcast Isochronous Group (Octet 42 - Bit 7)
          LE Broadcast Isochronous Group Create Sync (Octet 43 - Bit 0)
          LE Broadcast Isochronous Group Terminate Sync (Octet 43 - Bit 1)
          LE Request Peer SCA (Octet 43 - Bit 2)
          LE Setup Isochronous Data Path (Octet 43 - Bit 3)
          LE Remove Isochronous Data Path (Octet 43 - Bit 4)
          LE Isochronous Transmit Test (Octet 43 - Bit 5)
          LE Isochronous Receive Test (Octet 43 - Bit 6)
          LE Isochronous Read Test Counters (Octet 43 - Bit 7)
          LE Isochronous Read Test Counters (Octet 44 - Bit 0)
          LE Set Host Feature (Octet 44 - Bit 1)
          Octet 44 - Bit 2 
          Octet 45 - Bit 6 
          Octet 46 - Bit 0 
          Octet 46 - Bit 1 
          Octet 46 - Bit 2 
< HCI Command: Host Buffer Size (0x03|0x0033) plen 7         #9 [hci1] 0.312585
        ACL MTU: 255  ACL max packet: 16
        SCO MTU: 0    SCO max packet: 0
> HCI Event: Command Complete (0x0e) plen 4                 #10 [hci1] 0.313069
      Host Buffer Size (0x03|0x0033) ncmd 1
        Status: Success (0x00)
< HCI Command: Set Controller To Ho.. (0x03|0x0031) plen 1  #11 [hci1] 0.332563
        Flow control: ACL Data Packets (0x01)
> HCI Event: Command Complete (0x0e) plen 4                 #12 [hci1] 0.332983
      Set Controller To Host Flow Control (0x03|0x0031) ncmd 1
        Status: Success (0x00)
< HCI Command: LE Read Local Suppor.. (0x08|0x0003) plen 0  #13 [hci1] 0.352582
> HCI Event: Command Complete (0x0e) plen 12                #14 [hci1] 0.353098
      LE Read Local Supported Features (0x08|0x0003) ncmd 1
        Status: Success (0x00)
        Features: 0xfd 0x79 0x00 0xf7 0x30 0x01 0x00 0x00
          LE Encryption
          Extended Reject Indication
          Peripheral-initiated Features Exchange
          LE Ping
          LE Data Packet Length Extension
          LL Privacy
          Extended Scanner Filter Policies
          LE 2M PHY
          LE Coded PHY
          LE Extended Advertising
          LE Periodic Advertising
          Channel Selection Algorithm #2
          Periodic Advertising Sync Transfer - Sender
          Periodic Advertising Sync Transfer - Recipient
          Sleep Clock Accuracy Updates
          Connected Isochronous Stream - Central
          Connected Isochronous Stream - Peripheral
          Isochronous Broadcaster
          Synchronized Receiver
          Periodic Advertising ADI support
          Connection Subrating
          Unknown features (0x0000010000000000)
< HCI Command: LE Set Host Feature (0x08|0x0074) plen 2     #15 [hci1] 0.372621
        Bit Number: 32
          Connected Isochronous Stream (Host Support)
        Bit Value: 1
> HCI Event: Command Complete (0x0e) plen 4                 #16 [hci1] 0.373032
      LE Set Host Feature (0x08|0x0074) ncmd 1
        Status: Success (0x00)
< HCI Command: LE Read Buffer v2 (0x08|0x0060) plen 0       #17 [hci1] 0.392590
> HCI Event: Command Complete (0x0e) plen 10                #18 [hci1] 0.393052
      LE Read Buffer v2 (0x08|0x0060) ncmd 1
        Status: Success (0x00)
        ACL MTU: 27
        ACL max packet: 3
        ISO MTU: 318
        ISO max packet: 3
< HCI Command: LE Read Maximum Adve.. (0x08|0x003a) plen 0  #19 [hci1] 0.412592
> HCI Event: Command Complete (0x0e) plen 6                 #20 [hci1] 0.413024
      LE Read Maximum Advertising Data Length (0x08|0x003a) ncmd 1
        Status: Success (0x00)
        Max length: 1650
< HCI Command: LE Read Supported St.. (0x08|0x001c) plen 0  #21 [hci1] 0.432622
> HCI Event: Command Complete (0x0e) plen 12                #22 [hci1] 0.433099
      LE Read Supported States (0x08|0x001c) ncmd 1
        Status: Success (0x00)
        States: 0x000003ff3e0306ff
          Non-connectable Advertising State
          Scannable Advertising State
          Connectable Advertising State
          High Duty Cycle Directed Advertising State
          Passive Scanning State
          Active Scanning State
          Initiating State
            and Connection State (Central Role)
          Connection State (Peripheral Role)
          Scannable Advertising State
            and Passive Scanning State
          Connectable Advertising State
            and Passive Scanning State
          Non-connectable Advertising State
            and Initiating State
          Scannable Advertising State
            and Initiating State
          Active Scanning State
            and Connection State (Central Role)
          Passive Scanning State
            and Connection State (Peripheral Role)
          Active Scanning State
            and Connection State (Peripheral Role)
          Initiating State
            and Connection State (Central Role)
            and Central Role & Central Role
          Low Duty Cycle Directed Advertising State
          Connectable Advertising State
            and Initiating State
            and Central Role & Peripheral Role
          High Duty Cycle Directed Advertising State
            and Initiating State
            and Central Role & Peripheral Role
          Low Duty Cycle Directed Advertising State
            and Initiating State
            and Central Role & Peripheral Role
          Connectable Advertising State
            and Connection State (Central Role)
            and Central Role & Peripheral Role
          High Duty Cycle Directed Advertising State
            and Connection State (Central Role)
            and Central Role & Peripheral Role
          Low Duty Cycle Directed Advertising State
            and Connection State (Central Role)
            and Central Role & Peripheral Role
          Connectable Advertising State
            and Connection State (Peripheral Role)
            and Central Role & Peripheral Role
          High Duty Cycle Directed Advertising State
            and Connection State (Peripheral Role)
            and Peripheral Role & Peripheral Role
          Low Duty Cycle Directed Advertising State
            and Connection State (Peripheral Role)
            and Peripheral Role & Peripheral Role
          Initiating State
            and Connection State (Peripheral Role)
            and Central Role & Peripheral Role
< HCI Command: LE Read Maximum Data.. (0x08|0x002f) plen 0  #23 [hci1] 0.452589
> HCI Event: Command Complete (0x0e) plen 12                #24 [hci1] 0.453112
      LE Read Maximum Data Length (0x08|0x002f) ncmd 1
        Status: Success (0x00)
        Max TX octets: 251
        Max TX time: 2704
        Max RX octets: 251
        Max RX time: 2704
< HCI Command: LE Write Suggested D.. (0x08|0x0024) plen 4  #25 [hci1] 0.472606
        TX octets: 251
        TX time: 2704
> HCI Event: Command Complete (0x0e) plen 4                 #26 [hci1] 0.473060
      LE Write Suggested Default Data Length (0x08|0x0024) ncmd 1
        Status: Success (0x00)
< HCI Command: LE Read Resolving Li.. (0x08|0x002a) plen 0  #27 [hci1] 0.492587
> HCI Event: Command Complete (0x0e) plen 5                 #28 [hci1] 0.493030
      LE Read Resolving List Size (0x08|0x002a) ncmd 1
        Status: Success (0x00)
        Size: 8
< HCI Command: LE Set Event Mask (0x08|0x0001) plen 8       #29 [hci1] 0.512588
        Mask: 0x000002023f87fa5e
          LE Advertising Report
          LE Connection Update Complete
          LE Read Remote Used Features Complete
          LE Long Term Key Request
          LE Data Length Change
          LE Enhanced Connection Complete
          LE PHY Update Complete
          LE Extended Advertising Report
          LE Periodic Advertising Sync Established
          LE Periodic Advertising Report
          LE Periodic Advertising Sync Lost
          LE Extended Scan Timeout
          LE Extended Advertising Set Terminated
          LE Scan Request Received
          LE Periodic Advertising Sync Transfer Rvc
          LE CIS Established
          LE CIS Request
          LE Create BIG Complete
          LE Terminate BIG Complete
          LE BIG Sync Estabilished Complete
          LE BIG Sync Lost
          LE BIG Info Advertising Report
          Unknown mask (0x0000020000000000)
> HCI Event: Command Complete (0x0e) plen 4                 #30 [hci1] 0.513129
      LE Set Event Mask (0x08|0x0001) ncmd 1
        Status: Success (0x00)
< HCI Command: Set Event Mask (0x03|0x0001) plen 8          #31 [hci1] 0.532581
        Mask: 0x2000800002008890
          Disconnection Complete
          Encryption Change
          Read Remote Version Information Complete
          Hardware Error
          Data Buffer Overflow
          Encryption Key Refresh Complete
          LE Meta
> HCI Event: Command Complete (0x0e) plen 4                 #32 [hci1] 0.533044
      Set Event Mask (0x03|0x0001) ncmd 1
        Status: Success (0x00)
< HCI Command: Read BD ADDR (0x04|0x0009) plen 0            #33 [hci1] 0.552564
> HCI Event: Command Complete (0x0e) plen 10                #34 [hci1] 0.553038
      Read BD ADDR (0x04|0x0009) ncmd 1
        Status: Success (0x00)
        Address: 00:00:00:00:00:00 (OUI 00-00-00)
< HCI Command: LE Set Random Address (0x08|0x0005) plen 6   #35 [hci1] 0.572608
        Address: D5:B6:CC:31:DB:3B (Static)
> HCI Event: Command Complete (0x0e) plen 4                 #36 [hci1] 0.573141
      LE Set Random Address (0x08|0x0005) ncmd 1
        Status: Success (0x00)
< HCI Command: LE Set Extended Adv.. (0x08|0x0036) plen 25  #37 [hci1] 3.163094
        Handle: 0x00
        Properties: 0x0013
          Connectable
          Scannable
          Use legacy advertising PDUs: ADV_IND
        Min advertising interval: 100.000 msec (0x00a0)
        Max advertising interval: 150.000 msec (0x00f0)
        Channel map: 37, 38, 39 (0x07)
        Own address type: Random (0x01)
        Peer address type: Public (0x00)
        Peer address: 00:00:00:00:00:00 (OUI 00-00-00)
        Filter policy: Allow Scan Request from Any, Allow Connect Request from Any (0x00)
        TX power: Host has no preference (0x7f)
        Primary PHY: LE 1M (0x01)
        Secondary max skip: 0x00
        Secondary PHY: LE 1M (0x01)
        SID: 0x00
        Scan request notifications: Disabled (0x00)
> HCI Event: Command Complete (0x0e) plen 5                 #38 [hci1] 3.163921
      LE Set Extended Advertising Parameters (0x08|0x0036) ncmd 1
        Status: Success (0x00)
        TX power (selected): 0 dbm (0x00)
< HCI Command: LE Set Advertising S.. (0x08|0x0035) plen 7  #39 [hci1] 3.172862
        Advertising handle: 0x00
        Advertising random address: D5:B6:CC:31:DB:3B (Static)
> HCI Event: Command Complete (0x0e) plen 4                 #40 [hci1] 3.173341
      LE Set Advertising Set Random Address (0x08|0x0035) ncmd 1
        Status: Success (0x00)
< HCI Command: LE Set Extended Adv.. (0x08|0x0037) plen 22  #41 [hci1] 3.192649
        Handle: 0x00
        Operation: Complete extended advertising data (0x03)
        Fragment preference: Minimize fragmentation (0x01)
        Data length: 0x12
        Flags: 0x06
          LE General Discoverable Mode
          BR/EDR Not Supported
        Name (complete): Tester_F6B11A
> HCI Event: Command Complete (0x0e) plen 4                 #42 [hci1] 3.193336
      LE Set Extended Advertising Data (0x08|0x0037) ncmd 1
        Status: Success (0x00)
< HCI Command: LE Set Extended Scan.. (0x08|0x0038) plen 4  #43 [hci1] 3.212622
        Handle: 0x00
        Operation: Complete scan response data (0x03)
        Fragment preference: Minimize fragmentation (0x01)
        Data length: 0x00
> HCI Event: Command Complete (0x0e) plen 4                 #44 [hci1] 3.213125
      LE Set Extended Scan Response Data (0x08|0x0038) ncmd 1
        Status: Success (0x00)
< HCI Command: LE Set Extended Adve.. (0x08|0x0039) plen 6  #45 [hci1] 3.232615
        Extended advertising: Enabled (0x01)
        Number of sets: 1 (0x01)
        Entry 0
          Handle: 0x00
          Duration: 0 ms (0x00)
          Max ext adv events: 0
> HCI Event: Command Complete (0x0e) plen 4                 #46 [hci1] 3.233208
      LE Set Extended Advertising Enable (0x08|0x0039) ncmd 1
        Status: Success (0x00)
> HCI Event: LE Meta Event (0x3e) plen 31                   #47 [hci1] 3.351794
      LE Enhanced Connection Complete (0x0a)
        Status: Success (0x00)
        Handle: 3765
        Role: Peripheral (0x01)
        Peer address type: Public (0x00)
        Peer address: DF:A9:FF:F6:B1:1A (OUI DF-A9-FF)
        Local resolvable private address: 00:00:00:00:00:00 (Non-Resolvable)
        Peer resolvable private address: 00:00:00:00:00:00 (Non-Resolvable)
        Connection interval: 87.50 msec (0x0046)
        Connection latency: 0 (0x0000)
        Supervision timeout: 25120 msec (0x09d0)
        Central clock accuracy: 0x01
> HCI Event: LE Meta Event (0x3e) plen 6                    #48 [hci1] 3.351873
      LE Advertising Set Terminated (0x12)
        Status: Success (0x00)
        Handle: 0
        Connection handle: 3765
        Number of completed extended advertising events: 0
< HCI Command: LE Read Remote Used... (0x08|0x0016) plen 2  #49 [hci1] 3.352962
        Handle: 3765 Address: DF:A9:FF:F6:B1:1A (OUI DF-A9-FF)
< ACL Data TX: Handle 3765 flags 0x00 dlen 7                #50 [hci1] 3.352972
      ATT: Exchange MTU Request (0x02) len 2
        Client RX MTU: 251
> HCI Event: Command Status (0x0f) plen 4                   #51 [hci1] 3.353488
      LE Read Remote Used Features (0x08|0x0016) ncmd 1
        Status: Success (0x00)
> HCI Event: Number of Completed Packets (0x13) plen 5      #52 [hci1] 3.527750
        Num handles: 1
        Handle: 3765 Address: DF:A9:FF:F6:B1:1A (OUI DF-A9-FF)
        Count: 1
        #50: len 7 (0 Kb/s)
        Latency: 174 msec (174-174 msec ~174 msec)
> HCI Event: LE Meta Event (0x3e) plen 12                   #53 [hci1] 3.615736
      LE Read Remote Used Features (0x04)
        Status: Success (0x00)
        Handle: 3765 Address: DF:A9:FF:F6:B1:1A (OUI DF-A9-FF)
        Features: 0x2d 0x49 0x00 0xf7 0x67 0xd9 0x00 0x80
          LE Encryption
          Extended Reject Indication
          Peripheral-initiated Features Exchange
          LE Data Packet Length Extension
          LE 2M PHY
          LE Coded PHY
          Channel Selection Algorithm #2
          Periodic Advertising Sync Transfer - Sender
          Periodic Advertising Sync Transfer - Recipient
          Sleep Clock Accuracy Updates
          Connected Isochronous Stream - Central
          Connected Isochronous Stream - Peripheral
          Isochronous Broadcaster
          Synchronized Receiver
          Connected Isochronous Stream (Host Support)
          LE Power Control Request
          LE Power Control Request
          Connection Subrating
          Connection Subrating (Host Support)
          Unknown features (0x8000d90000000000)
> ACL Data RX: Handle 3765 flags 0x02 dlen 11               #54 [hci1] 6.065385
      SMP: Pairing Request (0x01) len 6
        IO capability: KeyboardDisplay (0x04)
        OOB data: Authentication data not present (0x00)
        Authentication requirement: Bonding, MITM, SC, No Keypresses (0x0d)
        Max encryption key size: 16
        Initiator key distribution: EncKey IdKey (0x03)
        Responder key distribution: EncKey IdKey Sign (0x07)
> ACL Data RX: Handle 3765 flags 0x02 dlen 7                #55 [hci1] 6.065955
      ATT: Exchange MTU Response (0x03) len 2
        Server RX MTU: 23
< HCI Command: Host Number of Compl.. (0x03|0x0035) plen 5  #56 [hci1] 6.073262
        Num handles: 1
        Handle: 3765 Address: DF:A9:FF:F6:B1:1A (OUI DF-A9-FF)
        Count: 1
< ACL Data TX: Handle 3765 flags 0x00 dlen 11               #57 [hci1] 6.073368
      SMP: Pairing Response (0x02) len 6
        IO capability: DisplayOnly (0x00)
        OOB data: Authentication data not present (0x00)
        Authentication requirement: Bonding, No MITM, SC, No Keypresses (0x09)
        Max encryption key size: 16
        Initiator key distribution: IdKey (0x02)
        Responder key distribution: <none> (0x00)
< HCI Command: Host Number of Compl.. (0x03|0x0035) plen 5  #58 [hci1] 6.073864
        Num handles: 1
        Handle: 3765 Address: DF:A9:FF:F6:B1:1A (OUI DF-A9-FF)
        Count: 1
> HCI Event: Number of Completed Packets (0x13) plen 5      #59 [hci1] 6.240484
        Num handles: 1
        Handle: 3765 Address: DF:A9:FF:F6:B1:1A (OUI DF-A9-FF)
        Count: 1
        #57: len 11 (0 Kb/s)
        Latency: 167 msec (167-174 msec ~170 msec)
> ACL Data RX: Handle 3765 flags 0x02 dlen 27               #60 [hci1] 6.240834
> ACL Data RX: Handle 3765 flags 0x01 dlen 27               #61 [hci1] 6.241321
> ACL Data RX: Handle 3765 flags 0x01 dlen 15               #62 [hci1] 6.241776
      SMP: Pairing Public Key (0x0c) len 64
        X: cd387802250a9f0e44746e2920dc43a5693a01254ce842a257dc1e07c3b9dabe
        Y: f33b2a3e9a68df0ebe4ac93666ab4e3c5ea2c48295d62a27942159ddf78e0099
< HCI Command: Host Number of Compl.. (0x03|0x0035) plen 5  #63 [hci1] 6.253357
        Num handles: 1
        Handle: 3765 Address: DF:A9:FF:F6:B1:1A (OUI DF-A9-FF)
        Count: 1
< HCI Command: Host Number of Compl.. (0x03|0x0035) plen 5  #64 [hci1] 6.253698
        Num handles: 1
        Handle: 3765 Address: DF:A9:FF:F6:B1:1A (OUI DF-A9-FF)
        Count: 1
< HCI Command: Host Number of Compl.. (0x03|0x0035) plen 5  #65 [hci1] 6.254092
        Num handles: 1
        Handle: 3765 Address: DF:A9:FF:F6:B1:1A (OUI DF-A9-FF)
        Count: 1
< ACL Data TX: Handle 3765 flags 0x00 dlen 27               #66 [hci1] 6.254200
< ACL Data TX: Handle 3765 flags 0x01 dlen 27               #67 [hci1] 6.254214
< ACL Data TX: Handle 3765 flags 0x01 dlen 15               #68 [hci1] 6.254218
      SMP: Pairing Public Key (0x0c) len 64
        X: 98308440221e2d910f0e54b71e7ec652857aa9b5a0dc65028824cc19db1226e9
        Y: 67a4816bcb62efb21701e31fdb27561a6217575fb007a8bbdabe7e28b6f68482
> HCI Event: Number of Completed Packets (0x13) plen 5      #69 [hci1] 6.328428
        Num handles: 1
        Handle: 3765 Address: DF:A9:FF:F6:B1:1A (OUI DF-A9-FF)
        Count: 1
        #66: len 27 (2 Kb/s)
        Latency: 74 msec (74-174 msec ~122 msec)
> HCI Event: Number of Completed Packets (0x13) plen 5      #70 [hci1] 6.329063
        Num handles: 1
        Handle: 3765 Address: DF:A9:FF:F6:B1:1A (OUI DF-A9-FF)
        Count: 1
        #67: len 27 (2 Kb/s)
        Latency: 74 msec (74-174 msec ~98 msec)
> HCI Event: Number of Completed Packets (0x13) plen 5      #71 [hci1] 6.415207
        Num handles: 1
        Handle: 3765 Address: DF:A9:FF:F6:B1:1A (OUI DF-A9-FF)
        Count: 1
        #68: len 15 (0 Kb/s)
        Latency: 160 msec (74-174 msec ~129 msec)
> ACL Data RX: Handle 3765 flags 0x02 dlen 21               #72 [hci1] 7.378064
      SMP: Pairing Confirm (0x03) len 16
        Confim value: cf4cc15b75b237195fd359b8485a1e99
< HCI Command: Host Number of Compl.. (0x03|0x0035) plen 5  #73 [hci1] 7.392875
        Num handles: 1
        Handle: 3765 Address: DF:A9:FF:F6:B1:1A (OUI DF-A9-FF)
        Count: 1
< ACL Data TX: Handle 3765 flags 0x00 dlen 21               #74 [hci1] 7.392977
      SMP: Pairing Confirm (0x03) len 16
        Confim value: d321a64d410448dd75ec35b49c2b3d3a
> HCI Event: Number of Completed Packets (0x13) plen 5      #75 [hci1] 7.552883
        Num handles: 1
        Handle: 3765 Address: DF:A9:FF:F6:B1:1A (OUI DF-A9-FF)
        Count: 1
        #74: len 21 (1 Kb/s)
        Latency: 159 msec (74-174 msec ~144 msec)
> ACL Data RX: Handle 3765 flags 0x02 dlen 21               #76 [hci1] 7.553290
      SMP: Pairing Random (0x04) len 16
        Random value: 4eb8f8c88e57189c0000000000000000
< HCI Command: Host Number of Compl.. (0x03|0x0035) plen 5  #77 [hci1] 7.573277
        Num handles: 1
        Handle: 3765 Address: DF:A9:FF:F6:B1:1A (OUI DF-A9-FF)
        Count: 1
< ACL Data TX: Handle 3765 flags 0x00 dlen 21               #78 [hci1] 7.573346
      SMP: Pairing Random (0x04) len 16
        Random value: 8e6108f966a694cbe26df70bb96773e6
> HCI Event: Number of Completed Packets (0x13) plen 5      #79 [hci1] 7.727755
        Num handles: 1
        Handle: 3765 Address: DF:A9:FF:F6:B1:1A (OUI DF-A9-FF)
        Count: 1
        #78: len 21 (1 Kb/s)
        Latency: 154 msec (74-174 msec ~149 msec)
> ACL Data RX: Handle 3765 flags 0x02 dlen 21               #80 [hci1] 7.815596
      SMP: Pairing Confirm (0x03) len 16
        Confim value: 1f8389c41deb9aab882ed4692c08680a
< HCI Command: Host Number of Compl.. (0x03|0x0035) plen 5  #81 [hci1] 7.833153
        Num handles: 1
        Handle: 3765 Address: DF:A9:FF:F6:B1:1A (OUI DF-A9-FF)
        Count: 1
< ACL Data TX: Handle 3765 flags 0x00 dlen 21               #82 [hci1] 7.833397
      SMP: Pairing Confirm (0x03) len 16
        Confim value: d0a563f9e4fa1aaf38bb71c42e0faf7a
> HCI Event: Number of Completed Packets (0x13) plen 5      #83 [hci1] 7.990363
        Num handles: 1
        Handle: 3765 Address: DF:A9:FF:F6:B1:1A (OUI DF-A9-FF)
        Count: 1
        #82: len 21 (1 Kb/s)
        Latency: 156 msec (74-174 msec ~153 msec)
> ACL Data RX: Handle 3765 flags 0x02 dlen 21               #84 [hci1] 7.990755
      SMP: Pairing Random (0x04) len 16
        Random value: 047395627404a0860000000000000000
< HCI Command: Host Number of Compl.. (0x03|0x0035) plen 5  #85 [hci1] 7.993393
        Num handles: 1
        Handle: 3765 Address: DF:A9:FF:F6:B1:1A (OUI DF-A9-FF)
        Count: 1
< ACL Data TX: Handle 3765 flags 0x00 dlen 21               #86 [hci1] 7.993547
      SMP: Pairing Random (0x04) len 16
        Random value: 4d02679f89a05211af56d8b3da64d21e
> HCI Event: Number of Completed Packets (0x13) plen 5      #87 [hci1] 8.165272
        Num handles: 1
        Handle: 3765 Address: DF:A9:FF:F6:B1:1A (OUI DF-A9-FF)
        Count: 1
        #86: len 21 (0 Kb/s)
        Latency: 171 msec (74-174 msec ~162 msec)
> ACL Data RX: Handle 3765 flags 0x02 dlen 21               #88 [hci1] 8.253151
      SMP: Pairing Confirm (0x03) len 16
        Confim value: 81f7a52d90633b535647fe6c56128166
< HCI Command: Host Number of Compl.. (0x03|0x0035) plen 5  #89 [hci1] 8.273245
        Num handles: 1
        Handle: 3765 Address: DF:A9:FF:F6:B1:1A (OUI DF-A9-FF)
        Count: 1
< ACL Data TX: Handle 3765 flags 0x00 dlen 21               #90 [hci1] 8.273351
      SMP: Pairing Confirm (0x03) len 16
        Confim value: 9161d6308168851681c7ad982034af8b
> HCI Event: Number of Completed Packets (0x13) plen 5      #91 [hci1] 8.427902
        Num handles: 1
        Handle: 3765 Address: DF:A9:FF:F6:B1:1A (OUI DF-A9-FF)
        Count: 1
        #90: len 21 (1 Kb/s)
        Latency: 154 msec (74-174 msec ~158 msec)
> ACL Data RX: Handle 3765 flags 0x02 dlen 21               #92 [hci1] 8.428233
      SMP: Pairing Random (0x04) len 16
        Random value: 5e6e4df5187d95120000000000000000
< HCI Command: Host Number of Compl.. (0x03|0x0035) plen 5  #93 [hci1] 8.433502
        Num handles: 1
        Handle: 3765 Address: DF:A9:FF:F6:B1:1A (OUI DF-A9-FF)
        Count: 1
< ACL Data TX: Handle 3765 flags 0x00 dlen 21               #94 [hci1] 8.433602
      SMP: Pairing Random (0x04) len 16
        Random value: 5e8286bc235a02440d0c3424a2acf8fd
> HCI Event: Number of Completed Packets (0x13) plen 5      #95 [hci1] 8.602766
        Num handles: 1
        Handle: 3765 Address: DF:A9:FF:F6:B1:1A (OUI DF-A9-FF)
        Count: 1
        #94: len 21 (0 Kb/s)
        Latency: 169 msec (74-174 msec ~163 msec)
> ACL Data RX: Handle 3765 flags 0x02 dlen 21               #96 [hci1] 8.690537
      SMP: Pairing Confirm (0x03) len 16
        Confim value: a23790251b0b9bf83d13394886046a90
< HCI Command: Host Number of Compl.. (0x03|0x0035) plen 5  #97 [hci1] 8.693285
        Num handles: 1
        Handle: 3765 Address: DF:A9:FF:F6:B1:1A (OUI DF-A9-FF)
        Count: 1
< ACL Data TX: Handle 3765 flags 0x00 dlen 21               #98 [hci1] 8.693426
      SMP: Pairing Confirm (0x03) len 16
        Confim value: 02e781c96be5e52b98691d2b5f58fd51
> HCI Event: Number of Completed Packets (0x13) plen 5      #99 [hci1] 8.865453
        Num handles: 1
        Handle: 3765 Address: DF:A9:FF:F6:B1:1A (OUI DF-A9-FF)
        Count: 1
        #98: len 21 (0 Kb/s)
        Latency: 172 msec (74-174 msec ~167 msec)
> ACL Data RX: Handle 3765 flags 0x02 dlen 21              #100 [hci1] 8.865771
      SMP: Pairing Random (0x04) len 16
        Random value: 08cb9f8111cedf820000000000000000
< HCI Command: Host Number of Comp.. (0x03|0x0035) plen 5  #101 [hci1] 8.873442
        Num handles: 1
        Handle: 3765 Address: DF:A9:FF:F6:B1:1A (OUI DF-A9-FF)
        Count: 1
< ACL Data TX: Handle 3765 flags 0x00 dlen 21              #102 [hci1] 8.873640
      SMP: Pairing Random (0x04) len 16
        Random value: 5c4a1bcadd27bd58e945097b00bad7ac
> HCI Event: Number of Completed Packets (0x13) plen 5     #103 [hci1] 9.040126
        Num handles: 1
        Handle: 3765 Address: DF:A9:FF:F6:B1:1A (OUI DF-A9-FF)
        Count: 1
        #102: len 21 (1 Kb/s)
        Latency: 166 msec (74-174 msec ~167 msec)
> ACL Data RX: Handle 3765 flags 0x02 dlen 21              #104 [hci1] 9.128003
      SMP: Pairing Confirm (0x03) len 16
        Confim value: dcfa7be7c7c89e428954ba690208a90b
< HCI Command: Host Number of Comp.. (0x03|0x0035) plen 5  #105 [hci1] 9.132938
        Num handles: 1
        Handle: 3765 Address: DF:A9:FF:F6:B1:1A (OUI DF-A9-FF)
        Count: 1
< ACL Data TX: Handle 3765 flags 0x00 dlen 21              #106 [hci1] 9.133027
      SMP: Pairing Confirm (0x03) len 16
        Confim value: 64a82215d4a9c6f09d077cf42863a94d
> HCI Event: Number of Completed Packets (0x13) plen 5     #107 [hci1] 9.302934
        Num handles: 1
        Handle: 3765 Address: DF:A9:FF:F6:B1:1A (OUI DF-A9-FF)
        Count: 1
        #106: len 21 (0 Kb/s)
        Latency: 169 msec (74-174 msec ~168 msec)
> ACL Data RX: Handle 3765 flags 0x02 dlen 21              #108 [hci1] 9.303268
      SMP: Pairing Random (0x04) len 16
        Random value: e43139e4653845de0000000000000000
< HCI Command: Host Number of Comp.. (0x03|0x0035) plen 5  #109 [hci1] 9.313350
        Num handles: 1
        Handle: 3765 Address: DF:A9:FF:F6:B1:1A (OUI DF-A9-FF)
        Count: 1
< ACL Data TX: Handle 3765 flags 0x00 dlen 21              #110 [hci1] 9.313480
      SMP: Pairing Random (0x04) len 16
        Random value: 32527e6e64e79f33b2e374394db8ab2d
> HCI Event: Number of Completed Packets (0x13) plen 5     #111 [hci1] 9.477771
        Num handles: 1
        Handle: 3765 Address: DF:A9:FF:F6:B1:1A (OUI DF-A9-FF)
        Count: 1
        #110: len 21 (1 Kb/s)
        Latency: 164 msec (74-174 msec ~166 msec)
> ACL Data RX: Handle 3765 flags 0x02 dlen 21              #112 [hci1] 9.565493
      SMP: Pairing Confirm (0x03) len 16
        Confim value: c24b7ae840f046e118704befb0152306
< HCI Command: Host Number of Comp.. (0x03|0x0035) plen 5  #113 [hci1] 9.573023
        Num handles: 1
        Handle: 3765 Address: DF:A9:FF:F6:B1:1A (OUI DF-A9-FF)
        Count: 1
< ACL Data TX: Handle 3765 flags 0x00 dlen 21              #114 [hci1] 9.573138
      SMP: Pairing Confirm (0x03) len 16
        Confim value: bfc22d952b00c7c1bfc47b19e3ed4a07
> HCI Event: Number of Completed Packets (0x13) plen 5     #115 [hci1] 9.740464
        Num handles: 1
        Handle: 3765 Address: DF:A9:FF:F6:B1:1A (OUI DF-A9-FF)
        Count: 1
        #114: len 21 (1 Kb/s)
        Latency: 167 msec (74-174 msec ~166 msec)
> ACL Data RX: Handle 3765 flags 0x02 dlen 21              #116 [hci1] 9.740726
      SMP: Pairing Random (0x04) len 16
        Random value: 62788c11619fa8250000000000000000
< HCI Command: Host Number of Comp.. (0x03|0x0035) plen 5  #117 [hci1] 9.753472
        Num handles: 1
        Handle: 3765 Address: DF:A9:FF:F6:B1:1A (OUI DF-A9-FF)
        Count: 1
< ACL Data TX: Handle 3765 flags 0x00 dlen 21              #118 [hci1] 9.753549
      SMP: Pairing Random (0x04) len 16
        Random value: dddbdfe2838e9a8cc6964353c850fef7
> HCI Event: Number of Completed Packets (0x13) plen 5     #119 [hci1] 9.915203
        Num handles: 1
        Handle: 3765 Address: DF:A9:FF:F6:B1:1A (OUI DF-A9-FF)
        Count: 1
        #118: len 21 (1 Kb/s)
        Latency: 161 msec (74-174 msec ~164 msec)
> ACL Data RX: Handle 3765 flags 0x02 dlen 21             #120 [hci1] 10.003029
      SMP: Pairing Confirm (0x03) len 16
        Confim value: 515ddb78e998e661e3121531035ff57b
< HCI Command: Host Number of Com.. (0x03|0x0035) plen 5  #121 [hci1] 10.013278
        Num handles: 1
        Handle: 3765 Address: DF:A9:FF:F6:B1:1A (OUI DF-A9-FF)
        Count: 1
< ACL Data TX: Handle 3765 flags 0x00 dlen 21             #122 [hci1] 10.013395
      SMP: Pairing Confirm (0x03) len 16
        Confim value: 8537d9eb8f2e538b514902761e3d9f2c
> HCI Event: Number of Completed Packets (0x13) plen 5    #123 [hci1] 10.177894
        Num handles: 1
        Handle: 3765 Address: DF:A9:FF:F6:B1:1A (OUI DF-A9-FF)
        Count: 1
        #122: len 21 (1 Kb/s)
        Latency: 164 msec (74-174 msec ~164 msec)
> ACL Data RX: Handle 3765 flags 0x02 dlen 21             #124 [hci1] 10.178224
      SMP: Pairing Random (0x04) len 16
        Random value: 4c28c6392db6807b0000000000000000
< HCI Command: Host Number of Com.. (0x03|0x0035) plen 5  #125 [hci1] 10.193496
        Num handles: 1
        Handle: 3765 Address: DF:A9:FF:F6:B1:1A (OUI DF-A9-FF)
        Count: 1
< ACL Data TX: Handle 3765 flags 0x00 dlen 21             #126 [hci1] 10.193648
      SMP: Pairing Random (0x04) len 16
        Random value: eb9f1915536596b6fc3db1c86b2b1970
> HCI Event: Number of Completed Packets (0x13) plen 5    #127 [hci1] 10.352688
        Num handles: 1
        Handle: 3765 Address: DF:A9:FF:F6:B1:1A (OUI DF-A9-FF)
        Count: 1
        #126: len 21 (1 Kb/s)
        Latency: 159 msec (74-174 msec ~161 msec)
> ACL Data RX: Handle 3765 flags 0x02 dlen 21             #128 [hci1] 10.440525
      SMP: Pairing Confirm (0x03) len 16
        Confim value: 7b5c9f2ec9a2abc82a34fcee83d1adc1
< HCI Command: Host Number of Com.. (0x03|0x0035) plen 5  #129 [hci1] 10.452771
        Num handles: 1
        Handle: 3765 Address: DF:A9:FF:F6:B1:1A (OUI DF-A9-FF)
        Count: 1
< ACL Data TX: Handle 3765 flags 0x00 dlen 21             #130 [hci1] 10.452800
      SMP: Pairing Confirm (0x03) len 16
        Confim value: c2e568189ffff720352f3321086467a4
> HCI Event: Number of Completed Packets (0x13) plen 5    #131 [hci1] 10.615363
        Num handles: 1
        Handle: 3765 Address: DF:A9:FF:F6:B1:1A (OUI DF-A9-FF)
        Count: 1
        #130: len 21 (1 Kb/s)
        Latency: 162 msec (74-174 msec ~162 msec)
> ACL Data RX: Handle 3765 flags 0x02 dlen 21             #132 [hci1] 10.615735
      SMP: Pairing Random (0x04) len 16
        Random value: 507063a9b18a33380000000000000000
< HCI Command: Host Number of Com.. (0x03|0x0035) plen 5  #133 [hci1] 10.633581
        Num handles: 1
        Handle: 3765 Address: DF:A9:FF:F6:B1:1A (OUI DF-A9-FF)
        Count: 1
< ACL Data TX: Handle 3765 flags 0x00 dlen 21             #134 [hci1] 10.633761
      SMP: Pairing Random (0x04) len 16
        Random value: 5c794dc9ad9f2c3f295ebd5ad5e1c3cf
> HCI Event: Number of Completed Packets (0x13) plen 5    #135 [hci1] 10.790168
        Num handles: 1
        Handle: 3765 Address: DF:A9:FF:F6:B1:1A (OUI DF-A9-FF)
        Count: 1
        #134: len 21 (1 Kb/s)
        Latency: 156 msec (74-174 msec ~159 msec)
> ACL Data RX: Handle 3765 flags 0x02 dlen 21             #136 [hci1] 10.878004
      SMP: Pairing Confirm (0x03) len 16
        Confim value: 2ba2d4d0899c16243af06b83ab63a97c
< HCI Command: Host Number of Com.. (0x03|0x0035) plen 5  #137 [hci1] 10.893227
        Num handles: 1
        Handle: 3765 Address: DF:A9:FF:F6:B1:1A (OUI DF-A9-FF)
        Count: 1
< ACL Data TX: Handle 3765 flags 0x00 dlen 21             #138 [hci1] 10.893316
      SMP: Pairing Confirm (0x03) len 16
        Confim value: 7e6ff5c27d4644cc62f1c3e4d2066ebc
> HCI Event: Number of Completed Packets (0x13) plen 5    #139 [hci1] 11.052956
        Num handles: 1
        Handle: 3765 Address: DF:A9:FF:F6:B1:1A (OUI DF-A9-FF)
        Count: 1
        #138: len 21 (1 Kb/s)
        Latency: 159 msec (74-174 msec ~159 msec)
> ACL Data RX: Handle 3765 flags 0x02 dlen 21             #140 [hci1] 11.053198
      SMP: Pairing Random (0x04) len 16
        Random value: 0e26acaeafaa65870000000000000000
< HCI Command: Host Number of Com.. (0x03|0x0035) plen 5  #141 [hci1] 11.073510
        Num handles: 1
        Handle: 3765 Address: DF:A9:FF:F6:B1:1A (OUI DF-A9-FF)
        Count: 1
< ACL Data TX: Handle 3765 flags 0x00 dlen 21             #142 [hci1] 11.073673
      SMP: Pairing Random (0x04) len 16
        Random value: 5c2fff312cdf99c9491988e877355a9a
> HCI Event: Number of Completed Packets (0x13) plen 5    #143 [hci1] 11.227748
        Num handles: 1
        Handle: 3765 Address: DF:A9:FF:F6:B1:1A (OUI DF-A9-FF)
        Count: 1
        #142: len 21 (1 Kb/s)
        Latency: 154 msec (74-174 msec ~156 msec)
> ACL Data RX: Handle 3765 flags 0x02 dlen 21             #144 [hci1] 11.315471
      SMP: Pairing Confirm (0x03) len 16
        Confim value: 9383d1ef807c1a329ca45cf5a3a4716c
< HCI Command: Host Number of Com.. (0x03|0x0035) plen 5  #145 [hci1] 11.333257
        Num handles: 1
        Handle: 3765 Address: DF:A9:FF:F6:B1:1A (OUI DF-A9-FF)
        Count: 1
< ACL Data TX: Handle 3765 flags 0x00 dlen 21             #146 [hci1] 11.333400
      SMP: Pairing Confirm (0x03) len 16
        Confim value: bf810d687eed5c0b013c16a1407c5daf
> HCI Event: Number of Completed Packets (0x13) plen 5    #147 [hci1] 11.490363
        Num handles: 1
        Handle: 3765 Address: DF:A9:FF:F6:B1:1A (OUI DF-A9-FF)
        Count: 1
        #146: len 21 (1 Kb/s)
        Latency: 156 msec (74-174 msec ~156 msec)
> ACL Data RX: Handle 3765 flags 0x02 dlen 21             #148 [hci1] 11.490798
      SMP: Pairing Random (0x04) len 16
        Random value: 299ea2ce6e27ef180000000000000000
< HCI Command: Host Number of Com.. (0x03|0x0035) plen 5  #149 [hci1] 11.493397
        Num handles: 1
        Handle: 3765 Address: DF:A9:FF:F6:B1:1A (OUI DF-A9-FF)
        Count: 1
< ACL Data TX: Handle 3765 flags 0x00 dlen 21             #150 [hci1] 11.493467
      SMP: Pairing Random (0x04) len 16
        Random value: c629a3a987d808e808655d558dfc1155
> HCI Event: Number of Completed Packets (0x13) plen 5    #151 [hci1] 11.665142
        Num handles: 1
        Handle: 3765 Address: DF:A9:FF:F6:B1:1A (OUI DF-A9-FF)
        Count: 1
        #150: len 21 (0 Kb/s)
        Latency: 171 msec (74-174 msec ~164 msec)
> ACL Data RX: Handle 3765 flags 0x02 dlen 21             #152 [hci1] 11.753092
      SMP: Pairing Confirm (0x03) len 16
        Confim value: f87a26c7ca7a665a10fd5d46f175b76a
< HCI Command: Host Number of Com.. (0x03|0x0035) plen 5  #153 [hci1] 11.773368
        Num handles: 1
        Handle: 3765 Address: DF:A9:FF:F6:B1:1A (OUI DF-A9-FF)
        Count: 1
< ACL Data TX: Handle 3765 flags 0x00 dlen 21             #154 [hci1] 11.773539
      SMP: Pairing Confirm (0x03) len 16
        Confim value: 6456d63feb8da07a8c1881ef30811d79
> HCI Event: Number of Completed Packets (0x13) plen 5    #155 [hci1] 11.927798
        Num handles: 1
        Handle: 3765 Address: DF:A9:FF:F6:B1:1A (OUI DF-A9-FF)
        Count: 1
        #154: len 21 (1 Kb/s)
        Latency: 154 msec (74-174 msec ~159 msec)
> ACL Data RX: Handle 3765 flags 0x02 dlen 21             #156 [hci1] 11.928211
      SMP: Pairing Random (0x04) len 16
        Random value: bc5be3e55b134eb10000000000000000
< HCI Command: Host Number of Com.. (0x03|0x0035) plen 5  #157 [hci1] 11.933437
        Num handles: 1
        Handle: 3765 Address: DF:A9:FF:F6:B1:1A (OUI DF-A9-FF)
        Count: 1
< ACL Data TX: Handle 3765 flags 0x00 dlen 21             #158 [hci1] 11.933633
      SMP: Pairing Random (0x04) len 16
        Random value: 92f20f6ad8f13724432c7fd6001c45ff
> HCI Event: Number of Completed Packets (0x13) plen 5    #159 [hci1] 12.102651
        Num handles: 1
        Handle: 3765 Address: DF:A9:FF:F6:B1:1A (OUI DF-A9-FF)
        Count: 1
        #158: len 21 (0 Kb/s)
        Latency: 169 msec (74-174 msec ~164 msec)
> ACL Data RX: Handle 3765 flags 0x02 dlen 21             #160 [hci1] 12.190490
      SMP: Pairing Confirm (0x03) len 16
        Confim value: e04ce906185ef685421d1d3510b130ee
< HCI Command: Host Number of Com.. (0x03|0x0035) plen 5  #161 [hci1] 12.192896
        Num handles: 1
        Handle: 3765 Address: DF:A9:FF:F6:B1:1A (OUI DF-A9-FF)
        Count: 1
< ACL Data TX: Handle 3765 flags 0x00 dlen 21             #162 [hci1] 12.192937
      SMP: Pairing Confirm (0x03) len 16
        Confim value: 60c81e0b8841f3f7129206a7a96264da
> HCI Event: Number of Completed Packets (0x13) plen 5    #163 [hci1] 12.365297
        Num handles: 1
        Handle: 3765 Address: DF:A9:FF:F6:B1:1A (OUI DF-A9-FF)
        Count: 1
        #162: len 21 (0 Kb/s)
        Latency: 172 msec (74-174 msec ~168 msec)
> ACL Data RX: Handle 3765 flags 0x02 dlen 21             #164 [hci1] 12.365761
      SMP: Pairing Random (0x04) len 16
        Random value: 7f0fc3c8dd5b2b100000000000000000
< HCI Command: Host Number of Com.. (0x03|0x0035) plen 5  #165 [hci1] 12.373544
        Num handles: 1
        Handle: 3765 Address: DF:A9:FF:F6:B1:1A (OUI DF-A9-FF)
        Count: 1
< ACL Data TX: Handle 3765 flags 0x00 dlen 21             #166 [hci1] 12.373674
      SMP: Pairing Random (0x04) len 16
        Random value: 23ac32ebbb5e14c8a6b9622f296d277f
> HCI Event: Number of Completed Packets (0x13) plen 5    #167 [hci1] 12.540102
        Num handles: 1
        Handle: 3765 Address: DF:A9:FF:F6:B1:1A (OUI DF-A9-FF)
        Count: 1
        #166: len 21 (1 Kb/s)
        Latency: 166 msec (74-174 msec ~167 msec)
> ACL Data RX: Handle 3765 flags 0x02 dlen 21             #168 [hci1] 12.627960
      SMP: Pairing Confirm (0x03) len 16
        Confim value: aed1b592f620cd859b1aa6c5486c2374
< HCI Command: Host Number of Com.. (0x03|0x0035) plen 5  #169 [hci1] 12.632913
        Num handles: 1
        Handle: 3765 Address: DF:A9:FF:F6:B1:1A (OUI DF-A9-FF)
        Count: 1
< ACL Data TX: Handle 3765 flags 0x00 dlen 21             #170 [hci1] 12.632984
      SMP: Pairing Confirm (0x03) len 16
        Confim value: cf20021f230a96e1bf8084cd5e3517ce
> HCI Event: Number of Completed Packets (0x13) plen 5    #171 [hci1] 12.802789
        Num handles: 1
        Handle: 3765 Address: DF:A9:FF:F6:B1:1A (OUI DF-A9-FF)
        Count: 1
        #170: len 21 (0 Kb/s)
        Latency: 169 msec (74-174 msec ~168 msec)
> ACL Data RX: Handle 3765 flags 0x02 dlen 21             #172 [hci1] 12.803239
      SMP: Pairing Random (0x04) len 16
        Random value: d46bd2aea336b6b20000000000000000
< HCI Command: Host Number of Com.. (0x03|0x0035) plen 5  #173 [hci1] 12.813487
        Num handles: 1
        Handle: 3765 Address: DF:A9:FF:F6:B1:1A (OUI DF-A9-FF)
        Count: 1
< ACL Data TX: Handle 3765 flags 0x00 dlen 21             #174 [hci1] 12.813662
      SMP: Pairing Random (0x04) len 16
        Random value: 297efe85e67448a15f56bd27e3a3cf1d
> HCI Event: Number of Completed Packets (0x13) plen 5    #175 [hci1] 12.977616
        Num handles: 1
        Handle: 3765 Address: DF:A9:FF:F6:B1:1A (OUI DF-A9-FF)
        Count: 1
        #174: len 21 (1 Kb/s)
        Latency: 163 msec (74-174 msec ~166 msec)
> ACL Data RX: Handle 3765 flags 0x02 dlen 21             #176 [hci1] 13.065450
      SMP: Pairing Confirm (0x03) len 16
        Confim value: 3cfbde3d85d34f335fe076a3ceb2aacc
< HCI Command: Host Number of Com.. (0x03|0x0035) plen 5  #177 [hci1] 13.073329
        Num handles: 1
        Handle: 3765 Address: DF:A9:FF:F6:B1:1A (OUI DF-A9-FF)
        Count: 1
< ACL Data TX: Handle 3765 flags 0x00 dlen 21             #178 [hci1] 13.073520
      SMP: Pairing Confirm (0x03) len 16
        Confim value: ae029e18e9187e82e67fe4fbb0b28f69
> HCI Event: Number of Completed Packets (0x13) plen 5    #179 [hci1] 13.240323
        Num handles: 1
        Handle: 3765 Address: DF:A9:FF:F6:B1:1A (OUI DF-A9-FF)
        Count: 1
        #178: len 21 (1 Kb/s)
        Latency: 166 msec (74-174 msec ~166 msec)
> ACL Data RX: Handle 3765 flags 0x02 dlen 21             #180 [hci1] 13.240662
      SMP: Pairing Random (0x04) len 16
        Random value: 82cb73315f0626520000000000000000
< HCI Command: Host Number of Com.. (0x03|0x0035) plen 5  #181 [hci1] 13.253502
        Num handles: 1
        Handle: 3765 Address: DF:A9:FF:F6:B1:1A (OUI DF-A9-FF)
        Count: 1
< ACL Data TX: Handle 3765 flags 0x00 dlen 21             #182 [hci1] 13.253637
      SMP: Pairing Random (0x04) len 16
        Random value: 25a9493fd3ce4faf02be7293595bb7c6
> HCI Event: Number of Completed Packets (0x13) plen 5    #183 [hci1] 13.415139
        Num handles: 1
        Handle: 3765 Address: DF:A9:FF:F6:B1:1A (OUI DF-A9-FF)
        Count: 1
        #182: len 21 (1 Kb/s)
        Latency: 161 msec (74-174 msec ~164 msec)
> ACL Data RX: Handle 3765 flags 0x02 dlen 21             #184 [hci1] 13.502946
      SMP: Pairing Confirm (0x03) len 16
        Confim value: 053a25e9d3857785643bb27144a7ed2f
< HCI Command: Host Number of Com.. (0x03|0x0035) plen 5  #185 [hci1] 13.513206
        Num handles: 1
        Handle: 3765 Address: DF:A9:FF:F6:B1:1A (OUI DF-A9-FF)
        Count: 1
< ACL Data TX: Handle 3765 flags 0x00 dlen 21             #186 [hci1] 13.513294
      SMP: Pairing Confirm (0x03) len 16
        Confim value: 1fef37804a9bfee8bdf1045fc562c5f9
> HCI Event: Number of Completed Packets (0x13) plen 5    #187 [hci1] 13.677828
        Num handles: 1
        Handle: 3765 Address: DF:A9:FF:F6:B1:1A (OUI DF-A9-FF)
        Count: 1
        #186: len 21 (1 Kb/s)
        Latency: 164 msec (74-174 msec ~164 msec)
> ACL Data RX: Handle 3765 flags 0x02 dlen 21             #188 [hci1] 13.678137
      SMP: Pairing Random (0x04) len 16
        Random value: 8d87fe00bd6b0eed0000000000000000
< HCI Command: Host Number of Com.. (0x03|0x0035) plen 5  #189 [hci1] 13.693345
        Num handles: 1
        Handle: 3765 Address: DF:A9:FF:F6:B1:1A (OUI DF-A9-FF)
        Count: 1
< ACL Data TX: Handle 3765 flags 0x00 dlen 21             #190 [hci1] 13.693390
      SMP: Pairing Random (0x04) len 16
        Random value: 58f6b41f855a6f6c3560debd84e2affc
> HCI Event: Number of Completed Packets (0x13) plen 5    #191 [hci1] 13.852663
        Num handles: 1
        Handle: 3765 Address: DF:A9:FF:F6:B1:1A (OUI DF-A9-FF)
        Count: 1
        #190: len 21 (1 Kb/s)
        Latency: 159 msec (74-174 msec ~161 msec)
> ACL Data RX: Handle 3765 flags 0x02 dlen 21             #192 [hci1] 13.940499
      SMP: Pairing Confirm (0x03) len 16
        Confim value: 8883bc3e82fd3da56b67ec5ca76fb5ee
< HCI Command: Host Number of Com.. (0x03|0x0035) plen 5  #193 [hci1] 13.953135
        Num handles: 1
        Handle: 3765 Address: DF:A9:FF:F6:B1:1A (OUI DF-A9-FF)
        Count: 1
< ACL Data TX: Handle 3765 flags 0x00 dlen 21             #194 [hci1] 13.953237
      SMP: Pairing Confirm (0x03) len 16
        Confim value: dc299812a09d96eadeaf6026956da2b3
> HCI Event: Number of Completed Packets (0x13) plen 5    #195 [hci1] 14.115280
        Num handles: 1
        Handle: 3765 Address: DF:A9:FF:F6:B1:1A (OUI DF-A9-FF)
        Count: 1
        #194: len 21 (1 Kb/s)
        Latency: 162 msec (74-174 msec ~161 msec)
> ACL Data RX: Handle 3765 flags 0x02 dlen 21             #196 [hci1] 14.115616
      SMP: Pairing Random (0x04) len 16
        Random value: 557dda85be110f760000000000000000
< HCI Command: Host Number of Com.. (0x03|0x0035) plen 5  #197 [hci1] 14.133586
        Num handles: 1
        Handle: 3765 Address: DF:A9:FF:F6:B1:1A (OUI DF-A9-FF)
        Count: 1
< ACL Data TX: Handle 3765 flags 0x00 dlen 21             #198 [hci1] 14.133637
      SMP: Pairing Random (0x04) len 16
        Random value: b67e7216d5bf664139eda2b542549666
> HCI Event: Number of Completed Packets (0x13) plen 5    #199 [hci1] 14.290093
        Num handles: 1
        Handle: 3765 Address: DF:A9:FF:F6:B1:1A (OUI DF-A9-FF)
        Count: 1
        #198: len 21 (1 Kb/s)
        Latency: 156 msec (74-174 msec ~159 msec)
> ACL Data RX: Handle 3765 flags 0x02 dlen 21             #200 [hci1] 14.377990
      SMP: Pairing Confirm (0x03) len 16
        Confim value: 29df0b0de07b21c0ac10da8a9064d7f5
< HCI Command: Host Number of Com.. (0x03|0x0035) plen 5  #201 [hci1] 14.393299
        Num handles: 1
        Handle: 3765 Address: DF:A9:FF:F6:B1:1A (OUI DF-A9-FF)
        Count: 1
< ACL Data TX: Handle 3765 flags 0x00 dlen 21             #202 [hci1] 14.393480
      SMP: Pairing Confirm (0x03) len 16
        Confim value: ba4d39d27b0391cdf79454f3839ddcc0
> HCI Event: Number of Completed Packets (0x13) plen 5    #203 [hci1] 14.552782
        Num handles: 1
        Handle: 3765 Address: DF:A9:FF:F6:B1:1A (OUI DF-A9-FF)
        Count: 1
        #202: len 21 (1 Kb/s)
        Latency: 159 msec (74-174 msec ~159 msec)
> ACL Data RX: Handle 3765 flags 0x02 dlen 21             #204 [hci1] 14.553269
      SMP: Pairing Random (0x04) len 16
        Random value: d45e9c70e273d2d40000000000000000
< HCI Command: Host Number of Com.. (0x03|0x0035) plen 5  #205 [hci1] 14.573488
        Num handles: 1
        Handle: 3765 Address: DF:A9:FF:F6:B1:1A (OUI DF-A9-FF)
        Count: 1
< ACL Data TX: Handle 3765 flags 0x00 dlen 21             #206 [hci1] 14.573677
      SMP: Pairing Random (0x04) len 16
        Random value: ed17f76500c95219dd01e09d1e63f87b
> HCI Event: Number of Completed Packets (0x13) plen 5    #207 [hci1] 14.727661
        Num handles: 1
        Handle: 3765 Address: DF:A9:FF:F6:B1:1A (OUI DF-A9-FF)
        Count: 1
        #206: len 21 (1 Kb/s)
        Latency: 153 msec (74-174 msec ~156 msec)
> ACL Data RX: Handle 3765 flags 0x02 dlen 21             #208 [hci1] 14.815459
      SMP: Pairing Confirm (0x03) len 16
        Confim value: 108c4377029e6dfd0b7779c85334d876
< HCI Command: Host Number of Com.. (0x03|0x0035) plen 5  #209 [hci1] 14.833317
        Num handles: 1
        Handle: 3765 Address: DF:A9:FF:F6:B1:1A (OUI DF-A9-FF)
        Count: 1
< ACL Data TX: Handle 3765 flags 0x00 dlen 21             #210 [hci1] 14.833514
      SMP: Pairing Confirm (0x03) len 16
        Confim value: 139dd900451d713a3098924316f1c278
> HCI Event: Number of Completed Packets (0x13) plen 5    #211 [hci1] 14.990276
        Num handles: 1
        Handle: 3765 Address: DF:A9:FF:F6:B1:1A (OUI DF-A9-FF)
        Count: 1
        #210: len 21 (1 Kb/s)
        Latency: 156 msec (74-174 msec ~156 msec)
> ACL Data RX: Handle 3765 flags 0x02 dlen 21             #212 [hci1] 14.990649
      SMP: Pairing Random (0x04) len 16
        Random value: 9372fac8fa4519a00000000000000000
< HCI Command: Host Number of Com.. (0x03|0x0035) plen 5  #213 [hci1] 14.993583
        Num handles: 1
        Handle: 3765 Address: DF:A9:FF:F6:B1:1A (OUI DF-A9-FF)
        Count: 1
< ACL Data TX: Handle 3765 flags 0x00 dlen 21             #214 [hci1] 14.993751
      SMP: Pairing Random (0x04) len 16
        Random value: 81d35d47e1f6006d79c974bd9d9e1ee3
> HCI Event: Number of Completed Packets (0x13) plen 5    #215 [hci1] 15.165134
        Num handles: 1
        Handle: 3765 Address: DF:A9:FF:F6:B1:1A (OUI DF-A9-FF)
        Count: 1
        #214: len 21 (0 Kb/s)
        Latency: 171 msec (74-174 msec ~164 msec)
> ACL Data RX: Handle 3765 flags 0x02 dlen 21             #216 [hci1] 15.253027
      SMP: Pairing Confirm (0x03) len 16
        Confim value: 1a5dad4d40d266099c779a38bb2c40a5
< HCI Command: Host Number of Com.. (0x03|0x0035) plen 5  #217 [hci1] 15.273303
        Num handles: 1
        Handle: 3765 Address: DF:A9:FF:F6:B1:1A (OUI DF-A9-FF)
        Count: 1
< ACL Data TX: Handle 3765 flags 0x00 dlen 21             #218 [hci1] 15.273429
      SMP: Pairing Confirm (0x03) len 16
        Confim value: 6f02f935ed1fb471299595bcb879cb3b
> HCI Event: Number of Completed Packets (0x13) plen 5    #219 [hci1] 15.427920
        Num handles: 1
        Handle: 3765 Address: DF:A9:FF:F6:B1:1A (OUI DF-A9-FF)
        Count: 1
        #218: len 21 (1 Kb/s)
        Latency: 154 msec (74-174 msec ~159 msec)
> ACL Data RX: Handle 3765 flags 0x02 dlen 21             #220 [hci1] 15.428110
      SMP: Pairing Random (0x04) len 16
        Random value: 531afb2b2e0f27b10000000000000000
< HCI Command: Host Number of Com.. (0x03|0x0035) plen 5  #221 [hci1] 15.433552
        Num handles: 1
        Handle: 3765 Address: DF:A9:FF:F6:B1:1A (OUI DF-A9-FF)
        Count: 1
< ACL Data TX: Handle 3765 flags 0x00 dlen 21             #222 [hci1] 15.433754
      SMP: Pairing Random (0x04) len 16
        Random value: e7f7e0c2476823e41736a7e381bafb7c
> HCI Event: Number of Completed Packets (0x13) plen 5    #223 [hci1] 15.602544
        Num handles: 1
        Handle: 3765 Address: DF:A9:FF:F6:B1:1A (OUI DF-A9-FF)
        Count: 1
        #222: len 21 (1 Kb/s)
        Latency: 168 msec (74-174 msec ~164 msec)
> ACL Data RX: Handle 3765 flags 0x02 dlen 21             #224 [hci1] 15.690511
      SMP: Pairing Confirm (0x03) len 16
        Confim value: e6138f755dca29e6ecf1de825dbc7466
< HCI Command: Host Number of Com.. (0x03|0x0035) plen 5  #225 [hci1] 15.693281
        Num handles: 1
        Handle: 3765 Address: DF:A9:FF:F6:B1:1A (OUI DF-A9-FF)
        Count: 1
< ACL Data TX: Handle 3765 flags 0x00 dlen 21             #226 [hci1] 15.693331
      SMP: Pairing Confirm (0x03) len 16
        Confim value: 22ae80ae83781482d6e44aad1fbcc9bb
> HCI Event: Number of Completed Packets (0x13) plen 5    #227 [hci1] 15.865292
        Num handles: 1
        Handle: 3765 Address: DF:A9:FF:F6:B1:1A (OUI DF-A9-FF)
        Count: 1
        #226: len 21 (0 Kb/s)
        Latency: 171 msec (74-174 msec ~167 msec)
> ACL Data RX: Handle 3765 flags 0x02 dlen 21             #228 [hci1] 15.865597
      SMP: Pairing Random (0x04) len 16
        Random value: 266f4fc1445fe6df0000000000000000
