Bluetooth monitor ver 5.72
btmon[2259791]: = Note: Linux version 6.14.0-36-generic (x86_64)                                                         0.172085
btmon[2259791]: = Note: Bluetooth subsystem version 2.22                                                                 0.172087
= New Index: 00:00:00:00:00:00 (Primary,UART,hci1)                                                                       0.172088
= New Index: 48:5F:99:8E:E0:64 (Primary,USB,hci0)                                                                        0.172088
= Open Index: 00:00:00:00:00:00                                                                                          0.187293
= Index Info: 00:00:00:00:00:00 (Nordic Semiconductor ASA)                                                               0.187298
zephyr.exe[2259793]: @ USER Open: main (privileged) version 2.22                                                {0x0001} 0.187301
zephyr.exe[2259793]: < HCI Command: Reset (0x03|0x0003) plen 0                                                        #1 0.187971
> HCI Event: Command Complete (0x0e) plen 4                                                                           #2 0.188435
      Reset (0x03|0x0003) ncmd 1
        Status: Success (0x00)
zephyr.exe[2259793]: < HCI Command: Read Local Supported Features (0x04|0x0003) plen 0                                #3 0.207456
> HCI Event: Command Complete (0x0e) plen 12                                                                          #4 0.207992
      Read Local Supported Features (0x04|0x0003) ncmd 1
        Status: Success (0x00)
        Features: 0x00 0x00 0x00 0x00 0x60 0x00 0x00 0x00
          BR/EDR Not Supported
          LE Supported (Controller)
zephyr.exe[2259793]: < HCI Command: Read Local Version Information (0x04|0x0001) plen 0                               #5 0.227130
> HCI Event: Command Complete (0x0e) plen 12                                                                          #6 0.227641
      Read Local Version Information (0x04|0x0001) ncmd 1
        Status: Success (0x00)
        HCI version: Reserved (0x0f) - Revision 12393 (0x3069)
        LMP version: Reserved (0x0f) - Subversion 12393 (0x3069)
        Manufacturer: Nordic Semiconductor ASA (89)
zephyr.exe[2259793]: < HCI Command: Read Local Supported Commands (0x04|0x0002) plen 0                                #7 0.247151
> HCI Event: Command Complete (0x0e) plen 68                                                                          #8 0.248310
      Read Local Supported Commands (0x04|0x0002) ncmd 1
        Status: Success (0x00)
        Commands: 119 entries
          Disconnect (Octet 0 - Bit 5)
          Read Remote Version Information (Octet 2 - Bit 7)
          Set Event Mask (Octet 5 - Bit 6)
          Reset (Octet 5 - Bit 7)
          Read Connection Accept Timeout (Octet 7 - Bit 2)
          Write Connection Accept Timeout (Octet 7 - Bit 3)
          Read Transmit Power Level (Octet 10 - Bit 2)
          Set Controller To Host Flow Control (Octet 10 - Bit 5)
          Host Buffer Size (Octet 10 - Bit 6)
          Host Number of Completed Packets (Octet 10 - Bit 7)
          Read Local Version Information (Octet 14 - Bit 3)
          Read Local Supported Features (Octet 14 - Bit 5)
          Read BD ADDR (Octet 15 - Bit 1)
          Read RSSI (Octet 15 - Bit 5)
          Set Event Mask Page 2 (Octet 22 - Bit 2)
          LE Set Event Mask (Octet 25 - Bit 0)
          LE Read Buffer Size (Octet 25 - Bit 1)
          LE Read Local Supported Features (Octet 25 - Bit 2)
          LE Set Random Address (Octet 25 - Bit 4)
          LE Set Advertising Parameters (Octet 25 - Bit 5)
          LE Read Advertising Channel TX Power (Octet 25 - Bit 6)
          LE Set Advertising Data (Octet 25 - Bit 7)
          LE Set Scan Response Data (Octet 26 - Bit 0)
          LE Set Advertise Enable (Octet 26 - Bit 1)
          LE Set Scan Parameters (Octet 26 - Bit 2)
          LE Set Scan Enable (Octet 26 - Bit 3)
          LE Create Connection (Octet 26 - Bit 4)
          LE Create Connection Cancel (Octet 26 - Bit 5)
          LE Read Accept List Size (Octet 26 - Bit 6)
          LE Clear Accept List (Octet 26 - Bit 7)
          LE Add Device To Accept List (Octet 27 - Bit 0)
          LE Remove Device From Accept List (Octet 27 - Bit 1)
          LE Connection Update (Octet 27 - Bit 2)
          LE Set Host Channel Classification (Octet 27 - Bit 3)
          LE Read Channel Map (Octet 27 - Bit 4)
          LE Read Remote Used Features (Octet 27 - Bit 5)
          LE Encrypt (Octet 27 - Bit 6)
          LE Rand (Octet 27 - Bit 7)
          LE Start Encryption (Octet 28 - Bit 0)
          LE Long Term Key Request Reply (Octet 28 - Bit 1)
          LE Long Term Key Request Neg Reply (Octet 28 - Bit 2)
          LE Read Supported States (Octet 28 - Bit 3)
          LE Receiver Test (Octet 28 - Bit 4)
          LE Transmitter Test (Octet 28 - Bit 5)
          LE Test End (Octet 28 - Bit 6)
          Read Authenticated Payload Timeout (Octet 32 - Bit 4)
          Write Authenticated Payload Timeout (Octet 32 - Bit 5)
          LE Set Data Length (Octet 33 - Bit 6)
          LE Read Suggested Default Data Length (Octet 33 - Bit 7)
          LE Write Suggested Default Data Length (Octet 34 - Bit 0)
          LE Add Device To Resolving List (Octet 34 - Bit 3)
          LE Remove Device From Resolving List (Octet 34 - Bit 4)
          LE Clear Resolving List (Octet 34 - Bit 5)
          LE Read Resolving List Size (Octet 34 - Bit 6)
          LE Set Address Resolution Enable (Octet 35 - Bit 1)
          LE Set Resolvable Private Address Timeout (Octet 35 - Bit 2)
          LE Read Maximum Data Length (Octet 35 - Bit 3)
          LE Read PHY (Octet 35 - Bit 4)
          LE Set Default PHY (Octet 35 - Bit 5)
          LE Set PHY (Octet 35 - Bit 6)
          LE Enhanced Receiver Test (Octet 35 - Bit 7)
          LE Enhanced Transmitter Test (Octet 36 - Bit 0)
          LE Set Advertising Set Random Address (Octet 36 - Bit 1)
          LE Set Extended Advertising Parameters (Octet 36 - Bit 2)
          LE Set Extended Advertising Data (Octet 36 - Bit 3)
          LE Set Extended Scan Response Data (Octet 36 - Bit 4)
          LE Set Extended Advertising Enable (Octet 36 - Bit 5)
          LE Read Maximum Advertising Data Length (Octet 36 - Bit 6)
          LE Read Number of Supported Advertising Sets (Octet 36 - Bit 7)
          LE Remove Advertising Set (Octet 37 - Bit 0)
          LE Clear Advertising Sets (Octet 37 - Bit 1)
          LE Set Periodic Advertising Parameters (Octet 37 - Bit 2)
          LE Set Periodic Advertising Data (Octet 37 - Bit 3)
          LE Set Periodic Advertising Enable (Octet 37 - Bit 4)
          LE Set Extended Scan Parameters (Octet 37 - Bit 5)
          LE Set Extended Scan Enable (Octet 37 - Bit 6)
          LE Extended Create Connection (Octet 37 - Bit 7)
          LE Periodic Advertising Create Sync (Octet 38 - Bit 0)
          LE Periodic Advertising Create Sync Cancel (Octet 38 - Bit 1)
          LE Periodic Advertising Terminate Sync (Octet 38 - Bit 2)
          LE Add Device To Periodic Advertiser List (Octet 38 - Bit 3)
          LE Remove Device From Periodic Advertiser List (Octet 38 - Bit 4)
          LE Clear Periodic Advertiser List (Octet 38 - Bit 5)
          LE Read Periodic Advertiser List Size (Octet 38 - Bit 6)
          LE Read Transmit Power (Octet 38 - Bit 7)
          LE Read RF Path Compensation (Octet 39 - Bit 0)
          LE Write RF Path Compensation (Octet 39 - Bit 1)
          LE Set Privacy Mode (Octet 39 - Bit 2)
          LE Periodic Advertising Receive Enable (Octet 40 - Bit 5)
          LE Periodic Advertising Sync Transfer (Octet 40 - Bit 6)
          LE Periodic Advertising Set Info Transfer (Octet 40 - Bit 7)
          LE Periodic Advertising Sync Transfer Parameters (Octet 41 - Bit 0)
          LE Set Default Periodic Advertisng Sync Transfer Parameters (Octet 41 - Bit 1)
          LE Read Buffer v2 (Octet 41 - Bit 5)
          LE Read ISO TX Sync (Octet 41 - Bit 6)
          LE Set Connected Isochronous Group Parameters (Octet 41 - Bit 7)
          LE Set Connected Isochronous Group Parameters Test (Octet 42 - Bit 0)
          LE Create Connected Isochronous Stream (Octet 42 - Bit 1)
          LE Remove Connected Isochronous Group (Octet 42 - Bit 2)
          LE Accept Connected Isochronous Stream Request (Octet 42 - Bit 3)
          LE Reject Connected Isochronous Stream Request (Octet 42 - Bit 4)
          LE Create Broadcast Isochronous Group (Octet 42 - Bit 5)
          LE Create Broadcast Isochronous Group Test (Octet 42 - Bit 6)
          LE Terminate Broadcast Isochronous Group (Octet 42 - Bit 7)
          LE Broadcast Isochronous Group Create Sync (Octet 43 - Bit 0)
          LE Broadcast Isochronous Group Terminate Sync (Octet 43 - Bit 1)
          LE Request Peer SCA (Octet 43 - Bit 2)
          LE Setup Isochronous Data Path (Octet 43 - Bit 3)
          LE Remove Isochronous Data Path (Octet 43 - Bit 4)
          LE Isochronous Transmit Test (Octet 43 - Bit 5)
          LE Isochronous Receive Test (Octet 43 - Bit 6)
          LE Isochronous Read Test Counters (Octet 43 - Bit 7)
          LE Isochronous Read Test Counters (Octet 44 - Bit 0)
          LE Set Host Feature (Octet 44 - Bit 1)
          Octet 44 - Bit 2 
          Octet 45 - Bit 6 
          Octet 46 - Bit 0 
          Octet 46 - Bit 1 
          Octet 46 - Bit 2 
zephyr.exe[2259793]: < HCI Command: Host Buffer Size (0x03|0x0033) plen 7                                             #9 0.267348
        ACL MTU: 255  ACL max packet: 16
        SCO MTU: 0    SCO max packet: 0
> HCI Event: Command Complete (0x0e) plen 4                                                                          #10 0.267867
      Host Buffer Size (0x03|0x0033) ncmd 1
        Status: Success (0x00)
zephyr.exe[2259793]: < HCI Command: Set Controller To Host Flow Control (0x03|0x0031) plen 1                         #11 0.287128
        Flow control: ACL Data Packets (0x01)
> HCI Event: Command Complete (0x0e) plen 4                                                                          #12 0.287570
      Set Controller To Host Flow Control (0x03|0x0031) ncmd 1
        Status: Success (0x00)
zephyr.exe[2259793]: < HCI Command: LE Read Local Supported Features (0x08|0x0003) plen 0                            #13 0.307130
> HCI Event: Command Complete (0x0e) plen 12                                                                         #14 0.307744
      LE Read Local Supported Features (0x08|0x0003) ncmd 1
        Status: Success (0x00)
        Features: 0xfd 0x79 0x00 0xf7 0x30 0x01 0x00 0x00
          LE Encryption
          Extended Reject Indication
          Peripheral-initiated Features Exchange
          LE Ping
          LE Data Packet Length Extension
          LL Privacy
          Extended Scanner Filter Policies
          LE 2M PHY
          LE Coded PHY
          LE Extended Advertising
          LE Periodic Advertising
          Channel Selection Algorithm #2
          Periodic Advertising Sync Transfer - Sender
          Periodic Advertising Sync Transfer - Recipient
          Sleep Clock Accuracy Updates
          Connected Isochronous Stream - Central
          Connected Isochronous Stream - Peripheral
          Isochronous Broadcaster
          Synchronized Receiver
          Periodic Advertising ADI support
          Connection Subrating
          Unknown features (0x0000010000000000)
zephyr.exe[2259793]: < HCI Command: LE Set Host Feature (0x08|0x0074) plen 2                                         #15 0.327095
        Bit Number: 32
          Connected Isochronous Stream (Host Support)
        Bit Value: 1
> HCI Event: Command Complete (0x0e) plen 4                                                                          #16 0.327513
      LE Set Host Feature (0x08|0x0074) ncmd 1
        Status: Success (0x00)
zephyr.exe[2259793]: < HCI Command: LE Read Buffer v2 (0x08|0x0060) plen 0                                           #17 0.347207
> HCI Event: Command Complete (0x0e) plen 10                                                                         #18 0.347736
      LE Read Buffer v2 (0x08|0x0060) ncmd 1
        Status: Success (0x00)
        ACL MTU: 27
        ACL max packet: 3
        ISO MTU: 318
        ISO max packet: 3
zephyr.exe[2259793]: < HCI Command: LE Read Maximum Advertising Data Length (0x08|0x003a) plen 0                     #19 0.367202
> HCI Event: Command Complete (0x0e) plen 6                                                                          #20 0.367753
      LE Read Maximum Advertising Data Length (0x08|0x003a) ncmd 1
        Status: Success (0x00)
        Max length: 1650
zephyr.exe[2259793]: < HCI Command: LE Read Supported States (0x08|0x001c) plen 0                                    #21 0.387136
> HCI Event: Command Complete (0x0e) plen 12                                                                         #22 0.387596
      LE Read Supported States (0x08|0x001c) ncmd 1
        Status: Success (0x00)
        States: 0x000003ff3e0306ff
          Non-connectable Advertising State
          Scannable Advertising State
          Connectable Advertising State
          High Duty Cycle Directed Advertising State
          Passive Scanning State
          Active Scanning State
          Initiating State
            and Connection State (Central Role)
          Connection State (Peripheral Role)
          Scannable Advertising State
            and Passive Scanning State
          Connectable Advertising State
            and Passive Scanning State
          Non-connectable Advertising State
            and Initiating State
          Scannable Advertising State
            and Initiating State
          Active Scanning State
            and Connection State (Central Role)
          Passive Scanning State
            and Connection State (Peripheral Role)
          Active Scanning State
            and Connection State (Peripheral Role)
          Initiating State
            and Connection State (Central Role)
            and Central Role & Central Role
          Low Duty Cycle Directed Advertising State
          Connectable Advertising State
            and Initiating State
            and Central Role & Peripheral Role
          High Duty Cycle Directed Advertising State
            and Initiating State
            and Central Role & Peripheral Role
          Low Duty Cycle Directed Advertising State
            and Initiating State
            and Central Role & Peripheral Role
          Connectable Advertising State
            and Connection State (Central Role)
            and Central Role & Peripheral Role
          High Duty Cycle Directed Advertising State
            and Connection State (Central Role)
            and Central Role & Peripheral Role
          Low Duty Cycle Directed Advertising State
            and Connection State (Central Role)
            and Central Role & Peripheral Role
          Connectable Advertising State
            and Connection State (Peripheral Role)
            and Central Role & Peripheral Role
          High Duty Cycle Directed Advertising State
            and Connection State (Peripheral Role)
            and Peripheral Role & Peripheral Role
          Low Duty Cycle Directed Advertising State
            and Connection State (Peripheral Role)
            and Peripheral Role & Peripheral Role
          Initiating State
            and Connection State (Peripheral Role)
            and Central Role & Peripheral Role
zephyr.exe[2259793]: < HCI Command: LE Read Maximum Data Length (0x08|0x002f) plen 0                                 #23 0.407127
> HCI Event: Command Complete (0x0e) plen 12                                                                         #24 0.407754
      LE Read Maximum Data Length (0x08|0x002f) ncmd 1
        Status: Success (0x00)
        Max TX octets: 251
        Max TX time: 2704
        Max RX octets: 251
        Max RX time: 2704
zephyr.exe[2259793]: < HCI Command: LE Write Suggested Default Data Length (0x08|0x0024) plen 4                      #25 0.427146
        TX octets: 251
        TX time: 2704
> HCI Event: Command Complete (0x0e) plen 4                                                                          #26 0.427752
      LE Write Suggested Default Data Length (0x08|0x0024) ncmd 1
        Status: Success (0x00)
zephyr.exe[2259793]: < HCI Command: LE Read Resolving List Size (0x08|0x002a) plen 0                                 #27 0.449354
> HCI Event: Command Complete (0x0e) plen 5                                                                          #28 0.449897
      LE Read Resolving List Size (0x08|0x002a) ncmd 1
        Status: Success (0x00)
        Size: 8
zephyr.exe[2259793]: < HCI Command: LE Set Event Mask (0x08|0x0001) plen 8                                           #29 0.467099
        Mask: 0x000002023f87fa5e
          LE Advertising Report
          LE Connection Update Complete
          LE Read Remote Used Features Complete
          LE Long Term Key Request
          LE Data Length Change
          LE Enhanced Connection Complete
          LE PHY Update Complete
          LE Extended Advertising Report
          LE Periodic Advertising Sync Established
          LE Periodic Advertising Report
          LE Periodic Advertising Sync Lost
          LE Extended Scan Timeout
          LE Extended Advertising Set Terminated
          LE Scan Request Received
          LE Periodic Advertising Sync Transfer Rvc
          LE CIS Established
          LE CIS Request
          LE Create BIG Complete
          LE Terminate BIG Complete
          LE BIG Sync Estabilished Complete
          LE BIG Sync Lost
          LE BIG Info Advertising Report
          Unknown mask (0x0000020000000000)
> HCI Event: Command Complete (0x0e) plen 4                                                                          #30 0.467600
      LE Set Event Mask (0x08|0x0001) ncmd 1
        Status: Success (0x00)
zephyr.exe[2259793]: < HCI Command: Set Event Mask (0x03|0x0001) plen 8                                              #31 0.487134
        Mask: 0x2000800002008890
          Disconnection Complete
          Encryption Change
          Read Remote Version Information Complete
          Hardware Error
          Data Buffer Overflow
          Encryption Key Refresh Complete
          LE Meta
> HCI Event: Command Complete (0x0e) plen 4                                                                          #32 0.487763
      Set Event Mask (0x03|0x0001) ncmd 1
        Status: Success (0x00)
zephyr.exe[2259793]: < HCI Command: Read BD ADDR (0x04|0x0009) plen 0                                                #33 0.507115
> HCI Event: Command Complete (0x0e) plen 10                                                                         #34 0.507607
      Read BD ADDR (0x04|0x0009) ncmd 1
        Status: Success (0x00)
        Address: 00:00:00:00:00:00 (OUI 00-00-00)
zephyr.exe[2259793]: < HCI Command: LE Set Random Address (0x08|0x0005) plen 6                                       #35 0.527107
        Address: D5:B6:CC:31:DB:3B (Static)
> HCI Event: Command Complete (0x0e) plen 4                                                                          #36 0.527716
      LE Set Random Address (0x08|0x0005) ncmd 1
        Status: Success (0x00)
zephyr.exe[2259793]: < HCI Command: LE Extended Create Connection (0x08|0x0043) plen 26                              #37 2.767150
        Filter policy: Accept list is not used (0x00)
        Own address type: Random (0x01)
        Peer address type: Public (0x00)
        Peer address: DF:A9:FF:F6:B1:1A (OUI DF-A9-FF)
        Initiating PHYs: 0x01
        Entry 0: LE 1M
          Scan interval: 60.000 msec (0x0060)
          Scan window: 60.000 msec (0x0060)
          Min connection interval: 30.00 msec (0x0018)
          Max connection interval: 50.00 msec (0x0028)
          Connection latency: 0 (0x0000)
          Supervision timeout: 4000 msec (0x0190)
          Min connection length: 0.000 msec (0x0000)
          Max connection length: 0.000 msec (0x0000)
> HCI Event: Command Status (0x0f) plen 4                                                                            #38 2.768023
      LE Extended Create Connection (0x08|0x0043) ncmd 1
        Status: Success (0x00)
> HCI Event: LE Meta Event (0x3e) plen 31                                                                            #39 2.864760
      LE Enhanced Connection Complete (0x0a)
        Status: Success (0x00)
        Handle: 1332
        Role: Central (0x00)
        Peer address type: Public (0x00)
        Peer address: DF:A9:FF:F6:B1:1A (OUI DF-A9-FF)
        Local resolvable private address: 00:00:00:00:00:00 (Non-Resolvable)
        Peer resolvable private address: 00:00:00:00:00:00 (Non-Resolvable)
        Connection interval: 50.00 msec (0x0028)
        Connection latency: 0 (0x0000)
        Supervision timeout: 4000 msec (0x0190)
        Central clock accuracy: 0x00
zephyr.exe[2259793]: < HCI Command: LE Read Remote Used Features (0x08|0x0016) plen 2                                #40 2.867353
        Handle: 1332 Address: DF:A9:FF:F6:B1:1A (OUI DF-A9-FF)
> HCI Event: Command Status (0x0f) plen 4                                                                            #41 2.867819
      LE Read Remote Used Features (0x08|0x0016) ncmd 1
        Status: Success (0x00)
zephyr.exe[2259793]: < HCI Command: LE Set PHY (0x08|0x0032) plen 7                                                  #42 2.887171
        Handle: 1332 Address: DF:A9:FF:F6:B1:1A (OUI DF-A9-FF)
        All PHYs preference: 0x00
        TX PHYs preference: 0x02
          LE 2M
        RX PHYs preference: 0x02
          LE 2M
        PHY options preference: Reserved (0x0000)
> HCI Event: Command Status (0x0f) plen 4                                                                            #43 2.887675
      LE Set PHY (0x08|0x0032) ncmd 1
        Status: Success (0x00)
> HCI Event: LE Meta Event (0x3e) plen 12                                                                            #44 3.016199
      LE Read Remote Used Features (0x04)
        Status: Success (0x00)
        Handle: 1332 Address: DF:A9:FF:F6:B1:1A (OUI DF-A9-FF)
        Features: 0x2d 0x49 0x00 0xf7 0x67 0xd8 0x00 0x00
          LE Encryption
          Extended Reject Indication
          Peripheral-initiated Features Exchange
          LE Data Packet Length Extension
          LE 2M PHY
          LE Coded PHY
          Channel Selection Algorithm #2
          Periodic Advertising Sync Transfer - Sender
          Periodic Advertising Sync Transfer - Recipient
          Sleep Clock Accuracy Updates
          Connected Isochronous Stream - Central
          Connected Isochronous Stream - Peripheral
          Isochronous Broadcaster
          Synchronized Receiver
          Connected Isochronous Stream (Host Support)
          LE Power Control Request
          LE Power Control Request
          Connection Subrating
          Connection Subrating (Host Support)
          Unknown features (0x0000d80000000000)
> HCI Event: LE Meta Event (0x3e) plen 6                                                                             #45 3.515533
      LE PHY Update Complete (0x0c)
        Status: Success (0x00)
        Handle: 1332 Address: DF:A9:FF:F6:B1:1A (OUI DF-A9-FF)
        TX PHY: LE 2M (0x02)
        RX PHY: LE 2M (0x02)
zephyr.exe[2259793]: < ACL Data TX: Handle 1332 flags 0x00 dlen 11                                                   #46 3.947268
      SMP: Pairing Request (0x01) len 6
        IO capability: NoInputNoOutput (0x03)
        OOB data: Authentication data not present (0x00)
        Authentication requirement: No bonding, No MITM, SC, No Keypresses (0x08)
        Max encryption key size: 16
        Initiator key distribution: <none> (0x00)
        Responder key distribution: <none> (0x00)
> HCI Event: Number of Completed Packets (0x13) plen 5                                                               #47 3.965991
        Num handles: 1
        Handle: 1332 Address: DF:A9:FF:F6:B1:1A (OUI DF-A9-FF)
        Count: 1
        #46: len 11 (4 Kb/s)
        Latency: 18 msec (18-18 msec ~18 msec)
> ACL Data RX: Handle 1332 flags 0x02 dlen 11                                                                        #48 4.016062
      SMP: Pairing Response (0x02) len 6
        IO capability: DisplayYesNo (0x01)
        OOB data: Authentication data not present (0x00)
        Authentication requirement: No bonding, No MITM, SC, No Keypresses (0x08)
        Max encryption key size: 16
        Initiator key distribution: <none> (0x00)
        Responder key distribution: <none> (0x00)
zephyr.exe[2259793]: < HCI Command: Host Number of Completed Packets (0x03|0x0035) plen 5                            #49 4.027161
        Num handles: 1
        Handle: 1332 Address: DF:A9:FF:F6:B1:1A (OUI DF-A9-FF)
        Count: 1
zephyr.exe[2259793]: < ACL Data TX: Handle 1332 flags 0x00 dlen 27                                                   #50 4.027187
zephyr.exe[2259793]: < ACL Data TX: Handle 1332 flags 0x01 dlen 27                                                   #51 4.027189
zephyr.exe[2259793]: < ACL Data TX: Handle 1332 flags 0x01 dlen 15                                                   #52 4.027189
      SMP: Pairing Public Key (0x0c) len 64
        X: 98308440221e2d910f0e54b71e7ec652857aa9b5a0dc65028824cc19db1226e9
        Y: 67a4816bcb62efb21701e31fdb27561a6217575fb007a8bbdabe7e28b6f68482
> HCI Event: Number of Completed Packets (0x13) plen 5                                                               #53 4.066069
        Num handles: 1
        Handle: 1332 Address: DF:A9:FF:F6:B1:1A (OUI DF-A9-FF)
        Count: 1
        #50: len 27 (5 Kb/s)
        Latency: 38 msec (18-38 msec ~28 msec)
> HCI Event: Number of Completed Packets (0x13) plen 5                                                               #54 4.066455
        Num handles: 1
        Handle: 1332 Address: DF:A9:FF:F6:B1:1A (OUI DF-A9-FF)
        Count: 1
        #51: len 27 (5 Kb/s)
        Latency: 39 msec (18-39 msec ~34 msec)
> HCI Event: Number of Completed Packets (0x13) plen 5                                                               #55 4.067028
        Num handles: 1
        Handle: 1332 Address: DF:A9:FF:F6:B1:1A (OUI DF-A9-FF)
        Count: 1
        #52: len 15 (3 Kb/s)
        Latency: 39 msec (18-39 msec ~36 msec)
> ACL Data RX: Handle 1332 flags 0x02 dlen 27                                                                        #56 4.116302
> ACL Data RX: Handle 1332 flags 0x01 dlen 27                                                                        #57 4.116664
> ACL Data RX: Handle 1332 flags 0x01 dlen 15                                                                        #58 4.117137
      SMP: Pairing Public Key (0x0c) len 64
        X: 1708f6256380cce3b13852a70c0a132b0b23ea5e23e87e51f438c8c76dd07992
        Y: 07dbd8afe368af420cc81a58b5aeaaa77078cf27fb977647aacef11d68dbd1dd
zephyr.exe[2259793]: < HCI Command: Host Number of Completed Packets (0x03|0x0035) plen 5                            #59 4.127179
        Num handles: 1
        Handle: 1332 Address: DF:A9:FF:F6:B1:1A (OUI DF-A9-FF)
        Count: 1
zephyr.exe[2259793]: < HCI Command: Host Number of Completed Packets (0x03|0x0035) plen 5                            #60 4.127212
        Num handles: 1
        Handle: 1332 Address: DF:A9:FF:F6:B1:1A (OUI DF-A9-FF)
        Count: 1
zephyr.exe[2259793]: < HCI Command: Host Number of Completed Packets (0x03|0x0035) plen 5                            #61 4.127242
        Num handles: 1
        Handle: 1332 Address: DF:A9:FF:F6:B1:1A (OUI DF-A9-FF)
        Count: 1
> ACL Data RX: Handle 1332 flags 0x02 dlen 21                                                                        #62 4.216163
      SMP: Pairing Confirm (0x03) len 16
        Confim value: 23b9a1d8a3385e5904b14d827f0401f5
zephyr.exe[2259793]: < HCI Command: Host Number of Completed Packets (0x03|0x0035) plen 5                            #63 4.227185
        Num handles: 1
        Handle: 1332 Address: DF:A9:FF:F6:B1:1A (OUI DF-A9-FF)
        Count: 1
zephyr.exe[2259793]: < ACL Data TX: Handle 1332 flags 0x00 dlen 21                                                   #64 4.227373
      SMP: Pairing Random (0x04) len 16
        Random value: 8e6108f966a694cbe26df70bb96773e6
> HCI Event: Number of Completed Packets (0x13) plen 5                                                               #65 4.265980
        Num handles: 1
        Handle: 1332 Address: DF:A9:FF:F6:B1:1A (OUI DF-A9-FF)
        Count: 1
        #64: len 21 (4 Kb/s)
        Latency: 38 msec (18-39 msec ~37 msec)
> ACL Data RX: Handle 1332 flags 0x02 dlen 21                                                                        #66 4.516153
      SMP: Pairing Random (0x04) len 16
        Random value: aeaf45dc857eb9ff921585d13ea07fda
zephyr.exe[2259793]: < HCI Command: Host Number of Completed Packets (0x03|0x0035) plen 5                            #67 4.527327
        Num handles: 1
        Handle: 1332 Address: DF:A9:FF:F6:B1:1A (OUI DF-A9-FF)
        Count: 1
zephyr.exe[2259793]: < ACL Data TX: Handle 1332 flags 0x00 dlen 21                                                   #68 4.527507
      SMP: Pairing DHKey Check (0x0d) len 16
        E: a4e8b5d5cbffd01cb0a7f97dbc9290a4
> HCI Event: Number of Completed Packets (0x13) plen 5                                                               #69 4.565953
        Num handles: 1
        Handle: 1332 Address: DF:A9:FF:F6:B1:1A (OUI DF-A9-FF)
        Count: 1
        #68: len 21 (4 Kb/s)
        Latency: 38 msec (18-39 msec ~38 msec)
> ACL Data RX: Handle 1332 flags 0x02 dlen 21                                                                        #70 4.616139
      SMP: Pairing DHKey Check (0x0d) len 16
        E: cd4ee4d1dc9a7ed03d3b88e88026dc04
zephyr.exe[2259793]: < HCI Command: LE Start Encryption (0x08|0x0019) plen 28                                        #71 4.627275
        Handle: 1332 Address: DF:A9:FF:F6:B1:1A (OUI DF-A9-FF)
        Random number: 0x0000000000000000
        Encrypted diversifier: 0x0000
        Long term key: 27164c4d95c466e77729568fc55319ed
> HCI Event: Command Status (0x0f) plen 4                                                                            #72 4.628118
      LE Start Encryption (0x08|0x0019) ncmd 1
        Status: Success (0x00)
zephyr.exe[2259793]: < HCI Command: Host Number of Completed Packets (0x03|0x0035) plen 5                            #73 4.647151
        Num handles: 1
        Handle: 1332 Address: DF:A9:FF:F6:B1:1A (OUI DF-A9-FF)
        Count: 1
> HCI Event: Encryption Change (0x08) plen 4                                                                         #74 4.966012
        Status: Success (0x00)
        Handle: 1332 Address: DF:A9:FF:F6:B1:1A (OUI DF-A9-FF)
        Encryption: Enabled with AES-CCM (0x01)
zephyr.exe[2259793]: < HCI Command: Disconnect (0x01|0x0006) plen 3                                                  #75 5.967287
        Handle: 1332 Address: DF:A9:FF:F6:B1:1A (OUI DF-A9-FF)
        Reason: Remote User Terminated Connection (0x13)
> HCI Event: Command Status (0x0f) plen 4                                                                            #76 5.967781
      Disconnect (0x01|0x0006) ncmd 1
        Status: Success (0x00)
> HCI Event: Disconnect Complete (0x05) plen 4                                                                       #77 6.065911
        Status: Success (0x00)
        Handle: 1332 Address: DF:A9:FF:F6:B1:1A (OUI DF-A9-FF)
        Reason: Connection Terminated By Local Host (0x16)
zephyr.exe[2259793]: < HCI Command: LE Extended Create Connection (0x08|0x0043) plen 26                              #78 7.147184
        Filter policy: Accept list is not used (0x00)
        Own address type: Random (0x01)
        Peer address type: Public (0x00)
        Peer address: DF:A9:FF:F6:B1:1A (OUI DF-A9-FF)
        Initiating PHYs: 0x01
        Entry 0: LE 1M
          Scan interval: 60.000 msec (0x0060)
          Scan window: 60.000 msec (0x0060)
          Min connection interval: 30.00 msec (0x0018)
          Max connection interval: 50.00 msec (0x0028)
          Connection latency: 0 (0x0000)
          Supervision timeout: 4000 msec (0x0190)
          Min connection length: 0.000 msec (0x0000)
          Max connection length: 0.000 msec (0x0000)
> HCI Event: Command Status (0x0f) plen 4                                                                            #79 7.148106
      LE Extended Create Connection (0x08|0x0043) ncmd 1
        Status: Success (0x00)
> HCI Event: LE Meta Event (0x3e) plen 31                                                                            #80 7.181505
      LE Enhanced Connection Complete (0x0a)
        Status: Success (0x00)
        Handle: 1350
        Role: Central (0x00)
        Peer address type: Public (0x00)
        Peer address: DF:A9:FF:F6:B1:1A (OUI DF-A9-FF)
        Local resolvable private address: 00:00:00:00:00:00 (Non-Resolvable)
        Peer resolvable private address: 00:00:00:00:00:00 (Non-Resolvable)
        Connection interval: 50.00 msec (0x0028)
        Connection latency: 0 (0x0000)
        Supervision timeout: 4000 msec (0x0190)
        Central clock accuracy: 0x00
zephyr.exe[2259793]: < HCI Command: LE Read Remote Used Features (0x08|0x0016) plen 2                                #81 7.187365
        Handle: 1350 Address: DF:A9:FF:F6:B1:1A (OUI DF-A9-FF)
> HCI Event: Command Status (0x0f) plen 4                                                                            #82 7.187836
      LE Read Remote Used Features (0x08|0x0016) ncmd 1
        Status: Success (0x00)
zephyr.exe[2259793]: < HCI Command: LE Set PHY (0x08|0x0032) plen 7                                                  #83 7.207180
        Handle: 1350 Address: DF:A9:FF:F6:B1:1A (OUI DF-A9-FF)
        All PHYs preference: 0x00
        TX PHYs preference: 0x02
          LE 2M
        RX PHYs preference: 0x02
          LE 2M
        PHY options preference: Reserved (0x0000)
> HCI Event: Command Status (0x0f) plen 4                                                                            #84 7.207682
      LE Set PHY (0x08|0x0032) ncmd 1
        Status: Success (0x00)
> HCI Event: LE Meta Event (0x3e) plen 12                                                                            #85 7.332929
      LE Read Remote Used Features (0x04)
        Status: Success (0x00)
        Handle: 1350 Address: DF:A9:FF:F6:B1:1A (OUI DF-A9-FF)
        Features: 0x2d 0x49 0x00 0xf7 0x67 0xd8 0x00 0x00
          LE Encryption
          Extended Reject Indication
          Peripheral-initiated Features Exchange
          LE Data Packet Length Extension
          LE 2M PHY
          LE Coded PHY
          Channel Selection Algorithm #2
          Periodic Advertising Sync Transfer - Sender
          Periodic Advertising Sync Transfer - Recipient
          Sleep Clock Accuracy Updates
          Connected Isochronous Stream - Central
          Connected Isochronous Stream - Peripheral
          Isochronous Broadcaster
          Synchronized Receiver
          Connected Isochronous Stream (Host Support)
          LE Power Control Request
          LE Power Control Request
          Connection Subrating
          Connection Subrating (Host Support)
          Unknown features (0x0000d80000000000)
> HCI Event: LE Meta Event (0x3e) plen 6                                                                             #86 7.832274
      LE PHY Update Complete (0x0c)
        Status: Success (0x00)
        Handle: 1350 Address: DF:A9:FF:F6:B1:1A (OUI DF-A9-FF)
        TX PHY: LE 2M (0x02)
        RX PHY: LE 2M (0x02)
zephyr.exe[2259793]: < ACL Data TX: Handle 1350 flags 0x00 dlen 11                                                   #87 8.237288
      SMP: Pairing Request (0x01) len 6
        IO capability: NoInputNoOutput (0x03)
        OOB data: Authentication data not present (0x00)
        Authentication requirement: No bonding, No MITM, SC, No Keypresses (0x08)
        Max encryption key size: 16
        Initiator key distribution: <none> (0x00)
        Responder key distribution: <none> (0x00)
> HCI Event: Number of Completed Packets (0x13) plen 5                                                               #88 8.282712
        Num handles: 1
        Handle: 1350 Address: DF:A9:FF:F6:B1:1A (OUI DF-A9-FF)
        Count: 1
        #87: len 11 (1 Kb/s)
        Latency: 45 msec (45-45 msec ~45 msec)
> ACL Data RX: Handle 1350 flags 0x02 dlen 11                                                                        #89 8.332799
      SMP: Pairing Response (0x02) len 6
        IO capability: DisplayYesNo (0x01)
        OOB data: Authentication data not present (0x00)
        Authentication requirement: No bonding, No MITM, SC, No Keypresses (0x08)
        Max encryption key size: 16
        Initiator key distribution: <none> (0x00)
        Responder key distribution: <none> (0x00)
zephyr.exe[2259793]: < HCI Command: Host Number of Completed Packets (0x03|0x0035) plen 5                            #90 8.347356
        Num handles: 1
        Handle: 1350 Address: DF:A9:FF:F6:B1:1A (OUI DF-A9-FF)
        Count: 1
zephyr.exe[2259793]: < ACL Data TX: Handle 1350 flags 0x00 dlen 27                                                   #91 8.347460
zephyr.exe[2259793]: < ACL Data TX: Handle 1350 flags 0x01 dlen 27                                                   #92 8.347462
zephyr.exe[2259793]: < ACL Data TX: Handle 1350 flags 0x01 dlen 15                                                   #93 8.347480
      SMP: Pairing Public Key (0x0c) len 64
        X: 98308440221e2d910f0e54b71e7ec652857aa9b5a0dc65028824cc19db1226e9
        Y: 67a4816bcb62efb21701e31fdb27561a6217575fb007a8bbdabe7e28b6f68482
> HCI Event: Number of Completed Packets (0x13) plen 5                                                               #94 8.382788
        Num handles: 1
        Handle: 1350 Address: DF:A9:FF:F6:B1:1A (OUI DF-A9-FF)
        Count: 1
        #91: len 27 (6 Kb/s)
        Latency: 35 msec (35-45 msec ~40 msec)
> HCI Event: Number of Completed Packets (0x13) plen 5                                                               #95 8.383177
        Num handles: 1
        Handle: 1350 Address: DF:A9:FF:F6:B1:1A (OUI DF-A9-FF)
        Count: 1
        #92: len 27 (6 Kb/s)
        Latency: 35 msec (35-45 msec ~38 msec)
> HCI Event: Number of Completed Packets (0x13) plen 5                                                               #96 8.383769
        Num handles: 1
        Handle: 1350 Address: DF:A9:FF:F6:B1:1A (OUI DF-A9-FF)
        Count: 1
        #93: len 15 (3 Kb/s)
        Latency: 36 msec (35-45 msec ~37 msec)
> ACL Data RX: Handle 1350 flags 0x02 dlen 27                                                                        #97 8.432952
> ACL Data RX: Handle 1350 flags 0x01 dlen 27                                                                        #98 8.433431
> ACL Data RX: Handle 1350 flags 0x01 dlen 15                                                                        #99 8.433903
      SMP: Pairing Public Key (0x0c) len 64
        X: b39eb9f8f6b91d0f92ec3d3d05a8db86f8736da5a6542537efc6e21ca0df5faa
        Y: e0788bb85baa11010ba87f3e070461858af766be7b2a637fa85392e24c20b068
zephyr.exe[2259793]: < HCI Command: Host Number of Completed Packets (0x03|0x0035) plen 5                           #100 8.447252
        Num handles: 1
        Handle: 1350 Address: DF:A9:FF:F6:B1:1A (OUI DF-A9-FF)
        Count: 1
zephyr.exe[2259793]: < HCI Command: Host Number of Completed Packets (0x03|0x0035) plen 5                           #101 8.447401
        Num handles: 1
        Handle: 1350 Address: DF:A9:FF:F6:B1:1A (OUI DF-A9-FF)
        Count: 1
zephyr.exe[2259793]: < HCI Command: Host Number of Completed Packets (0x03|0x0035) plen 5                           #102 8.447419
        Num handles: 1
        Handle: 1350 Address: DF:A9:FF:F6:B1:1A (OUI DF-A9-FF)
        Count: 1
> ACL Data RX: Handle 1350 flags 0x02 dlen 21                                                                       #103 8.532925
      SMP: Pairing Confirm (0x03) len 16
        Confim value: 055781a59afe13a204ef8c78d0b22b37
zephyr.exe[2259793]: < HCI Command: Host Number of Completed Packets (0x03|0x0035) plen 5                           #104 8.547166
        Num handles: 1
        Handle: 1350 Address: DF:A9:FF:F6:B1:1A (OUI DF-A9-FF)
        Count: 1
zephyr.exe[2259793]: < ACL Data TX: Handle 1350 flags 0x00 dlen 21                                                  #105 8.547190
      SMP: Pairing Random (0x04) len 16
        Random value: 5da095555cc64d02679f89a05211af56
> HCI Event: Number of Completed Packets (0x13) plen 5                                                              #106 8.582814
        Num handles: 1
        Handle: 1350 Address: DF:A9:FF:F6:B1:1A (OUI DF-A9-FF)
        Count: 1
        #105: len 21 (4 Kb/s)
        Latency: 35 msec (35-45 msec ~36 msec)
> ACL Data RX: Handle 1350 flags 0x02 dlen 21                                                                       #107 8.832878
      SMP: Pairing Random (0x04) len 16
        Random value: 4e83cac83567f4e1fc4aea72cfc35f10
zephyr.exe[2259793]: < HCI Command: Host Number of Completed Packets (0x03|0x0035) plen 5                           #108 8.847445
        Num handles: 1
        Handle: 1350 Address: DF:A9:FF:F6:B1:1A (OUI DF-A9-FF)
        Count: 1
zephyr.exe[2259793]: < ACL Data TX: Handle 1350 flags 0x00 dlen 21                                                  #109 8.847535
      SMP: Pairing DHKey Check (0x0d) len 16
        E: 57579a65217838570b89b0f217967e53
> HCI Event: Number of Completed Packets (0x13) plen 5                                                              #110 8.882702
        Num handles: 1
        Handle: 1350 Address: DF:A9:FF:F6:B1:1A (OUI DF-A9-FF)
        Count: 1
        #109: len 21 (4 Kb/s)
        Latency: 35 msec (35-45 msec ~35 msec)
> ACL Data RX: Handle 1350 flags 0x02 dlen 21                                                                       #111 8.932930
      SMP: Pairing DHKey Check (0x0d) len 16
        E: d3738dcb457a11406f01567ad3972bfd
zephyr.exe[2259793]: < HCI Command: LE Start Encryption (0x08|0x0019) plen 28                                       #112 8.947392
        Handle: 1350 Address: DF:A9:FF:F6:B1:1A (OUI DF-A9-FF)
        Random number: 0x0000000000000000
        Encrypted diversifier: 0x0000
        Long term key: 0f63d3f4a732a72f34fa46aecf57b3d8
> HCI Event: Command Status (0x0f) plen 4                                                                           #113 8.948295
      LE Start Encryption (0x08|0x0019) ncmd 1
        Status: Success (0x00)
zephyr.exe[2259793]: < HCI Command: Host Number of Completed Packets (0x03|0x0035) plen 5                           #114 8.967267
        Num handles: 1
        Handle: 1350 Address: DF:A9:FF:F6:B1:1A (OUI DF-A9-FF)
        Count: 1
> HCI Event: Encryption Change (0x08) plen 4                                                                        #115 9.282687
        Status: Success (0x00)
        Handle: 1350 Address: DF:A9:FF:F6:B1:1A (OUI DF-A9-FF)
        Encryption: Enabled with AES-CCM (0x01)
zephyr.exe[2259793]: < HCI Command: Disconnect (0x01|0x0006) plen 3                                                #116 10.257814
        Handle: 1350 Address: DF:A9:FF:F6:B1:1A (OUI DF-A9-FF)
        Reason: Remote User Terminated Connection (0x13)
> HCI Event: Command Status (0x0f) plen 4                                                                          #117 10.258423
      Disconnect (0x01|0x0006) ncmd 1
        Status: Success (0x00)
> HCI Event: Disconnect Complete (0x05) plen 4                                                                     #118 10.332611
        Status: Success (0x00)
        Handle: 1350 Address: DF:A9:FF:F6:B1:1A (OUI DF-A9-FF)
        Reason: Connection Terminated By Local Host (0x16)
zephyr.exe[2259793]: < HCI Command: LE Extended Create Connection (0x08|0x0043) plen 26                            #119 11.427282
        Filter policy: Accept list is not used (0x00)
        Own address type: Random (0x01)
        Peer address type: Public (0x00)
        Peer address: DF:A9:FF:F6:B1:1A (OUI DF-A9-FF)
        Initiating PHYs: 0x01
        Entry 0: LE 1M
          Scan interval: 60.000 msec (0x0060)
          Scan window: 60.000 msec (0x0060)
          Min connection interval: 30.00 msec (0x0018)
          Max connection interval: 50.00 msec (0x0028)
          Connection latency: 0 (0x0000)
          Supervision timeout: 4000 msec (0x0190)
          Min connection length: 0.000 msec (0x0000)
          Max connection length: 0.000 msec (0x0000)
> HCI Event: Command Status (0x0f) plen 4                                                                          #120 11.428208
      LE Extended Create Connection (0x08|0x0043) ncmd 1
        Status: Success (0x00)
> HCI Event: LE Meta Event (0x3e) plen 31                                                                          #121 11.466008
      LE Enhanced Connection Complete (0x0a)
        Status: Success (0x00)
        Handle: 1368
        Role: Central (0x00)
        Peer address type: Public (0x00)
        Peer address: DF:A9:FF:F6:B1:1A (OUI DF-A9-FF)
        Local resolvable private address: 00:00:00:00:00:00 (Non-Resolvable)
        Peer resolvable private address: 00:00:00:00:00:00 (Non-Resolvable)
        Connection interval: 50.00 msec (0x0028)
        Connection latency: 0 (0x0000)
        Supervision timeout: 4000 msec (0x0190)
        Central clock accuracy: 0x00
zephyr.exe[2259793]: < HCI Command: LE Read Remote Used Features (0x08|0x0016) plen 2                              #122 11.467304
        Handle: 1368 Address: DF:A9:FF:F6:B1:1A (OUI DF-A9-FF)
> HCI Event: Command Status (0x0f) plen 4                                                                          #123 11.467743
      LE Read Remote Used Features (0x08|0x0016) ncmd 1
        Status: Success (0x00)
zephyr.exe[2259793]: < HCI Command: LE Set PHY (0x08|0x0032) plen 7                                                #124 11.487313
        Handle: 1368 Address: DF:A9:FF:F6:B1:1A (OUI DF-A9-FF)
        All PHYs preference: 0x00
        TX PHYs preference: 0x02
          LE 2M
        RX PHYs preference: 0x02
          LE 2M
        PHY options preference: Reserved (0x0000)
> HCI Event: Command Status (0x0f) plen 4                                                                          #125 11.487824
      LE Set PHY (0x08|0x0032) ncmd 1
        Status: Success (0x00)
> HCI Event: LE Meta Event (0x3e) plen 12                                                                          #126 11.617478
      LE Read Remote Used Features (0x04)
        Status: Success (0x00)
        Handle: 1368 Address: DF:A9:FF:F6:B1:1A (OUI DF-A9-FF)
        Features: 0x2d 0x49 0x00 0xf7 0x67 0xd8 0x00 0x00
          LE Encryption
          Extended Reject Indication
          Peripheral-initiated Features Exchange
          LE Data Packet Length Extension
          LE 2M PHY
          LE Coded PHY
          Channel Selection Algorithm #2
          Periodic Advertising Sync Transfer - Sender
          Periodic Advertising Sync Transfer - Recipient
          Sleep Clock Accuracy Updates
          Connected Isochronous Stream - Central
          Connected Isochronous Stream - Peripheral
          Isochronous Broadcaster
          Synchronized Receiver
          Connected Isochronous Stream (Host Support)
          LE Power Control Request
          LE Power Control Request
          Connection Subrating
          Connection Subrating (Host Support)
          Unknown features (0x0000d80000000000)
> HCI Event: LE Meta Event (0x3e) plen 6                                                                           #127 12.116889
      LE PHY Update Complete (0x0c)
        Status: Success (0x00)
        Handle: 1368 Address: DF:A9:FF:F6:B1:1A (OUI DF-A9-FF)
        TX PHY: LE 2M (0x02)
        RX PHY: LE 2M (0x02)
zephyr.exe[2259793]: < ACL Data TX: Handle 1368 flags 0x00 dlen 11                                                 #128 12.517351
      SMP: Pairing Request (0x01) len 6
        IO capability: NoInputNoOutput (0x03)
        OOB data: Authentication data not present (0x00)
        Authentication requirement: No bonding, No MITM, SC, No Keypresses (0x08)
        Max encryption key size: 16
        Initiator key distribution: <none> (0x00)
        Responder key distribution: <none> (0x00)
> HCI Event: Number of Completed Packets (0x13) plen 5                                                             #129 12.567307
        Num handles: 1
        Handle: 1368 Address: DF:A9:FF:F6:B1:1A (OUI DF-A9-FF)
        Count: 1
        #128: len 11 (1 Kb/s)
        Latency: 49 msec (49-49 msec ~49 msec)
> ACL D