Bluetooth monitor ver 5.84
btmon[862142]: = Note: Linux version 6.8.0-83-generic (x86_64)                                                           0.549811
btmon[862142]: = Note: Bluetooth subsystem version 2.22                                                                  0.549813
= New Index: 00:00:00:00:00:00 (Primary,UART,hci0)                                                                       0.549814
= Open Index: 00:00:00:00:00:00                                                                                          0.556885
= Index Info: 00:00:00:00:00:00 (Nordic Semiconductor ASA)                                                               0.556890
zephyr.exe[862144]: @ USER Open: main (privileged) version 2.22                                                 {0x0001} 0.556892
zephyr.exe[862144]: < HCI Command: Reset (0x03|0x0003) plen 0                                                         #1 0.557085
> HCI Event: Command Complete (0x0e) plen 4                                                                           #2 0.557790
      Reset (0x03|0x0003) ncmd 1
        Status: Success (0x00)
zephyr.exe[862144]: < HCI Command: Read Local Supported Features (0x04|0x0003) plen 0                                 #3 0.576874
> HCI Event: Command Complete (0x0e) plen 12                                                                          #4 0.577503
      Read Local Supported Features (0x04|0x0003) ncmd 1
        Status: Success (0x00)
        Features: 0x00 0x00 0x00 0x00 0x60 0x00 0x00 0x00
          BR/EDR Not Supported
          LE Supported (Controller)
zephyr.exe[862144]: < HCI Command: Read Local Version Information (0x04|0x0001) plen 0                                #5 0.596797
> HCI Event: Command Complete (0x0e) plen 12                                                                          #6 0.597584
      Read Local Version Information (0x04|0x0001) ncmd 1
        Status: Success (0x00)
        HCI version: Reserved (0x0e) - Revision 12520 (0x30e8)
        LMP version: Reserved (0x0e) - Subversion 12520 (0x30e8)
        Manufacturer: Nordic Semiconductor ASA (89)
zephyr.exe[862144]: < HCI Command: Read Local Supported Commands (0x04|0x0002) plen 0                                 #7 0.616783
> HCI Event: Command Complete (0x0e) plen 68                                                                          #8 0.618269
      Read Local Supported Commands (0x04|0x0002) ncmd 1
        Status: Success (0x00)
        Commands: 119 entries
          Disconnect (Octet 0 - Bit 5)
          Read Remote Version Information (Octet 2 - Bit 7)
          Set Event Mask (Octet 5 - Bit 6)
          Reset (Octet 5 - Bit 7)
          Read Connection Accept Timeout (Octet 7 - Bit 2)
          Write Connection Accept Timeout (Octet 7 - Bit 3)
          Read Transmit Power Level (Octet 10 - Bit 2)
          Set Controller To Host Flow Control (Octet 10 - Bit 5)
          Host Buffer Size (Octet 10 - Bit 6)
          Host Number of Completed Packets (Octet 10 - Bit 7)
          Read Local Version Information (Octet 14 - Bit 3)
          Read Local Supported Features (Octet 14 - Bit 5)
          Read BD ADDR (Octet 15 - Bit 1)
          Read RSSI (Octet 15 - Bit 5)
          Set Event Mask Page 2 (Octet 22 - Bit 2)
          LE Set Event Mask (Octet 25 - Bit 0)
          LE Read Buffer Size (Octet 25 - Bit 1)
          LE Read Local Supported Features (Octet 25 - Bit 2)
          LE Set Random Address (Octet 25 - Bit 4)
          LE Set Advertising Parameters (Octet 25 - Bit 5)
          LE Read Advertising Channel TX Power (Octet 25 - Bit 6)
          LE Set Advertising Data (Octet 25 - Bit 7)
          LE Set Scan Response Data (Octet 26 - Bit 0)
          LE Set Advertise Enable (Octet 26 - Bit 1)
          LE Set Scan Parameters (Octet 26 - Bit 2)
          LE Set Scan Enable (Octet 26 - Bit 3)
          LE Create Connection (Octet 26 - Bit 4)
          LE Create Connection Cancel (Octet 26 - Bit 5)
          LE Read Accept List Size (Octet 26 - Bit 6)
          LE Clear Accept List (Octet 26 - Bit 7)
          LE Add Device To Accept List (Octet 27 - Bit 0)
          LE Remove Device From Accept List (Octet 27 - Bit 1)
          LE Connection Update (Octet 27 - Bit 2)
          LE Set Host Channel Classification (Octet 27 - Bit 3)
          LE Read Channel Map (Octet 27 - Bit 4)
          LE Read Remote Used Features (Octet 27 - Bit 5)
          LE Encrypt (Octet 27 - Bit 6)
          LE Rand (Octet 27 - Bit 7)
          LE Start Encryption (Octet 28 - Bit 0)
          LE Long Term Key Request Reply (Octet 28 - Bit 1)
          LE Long Term Key Request Neg Reply (Octet 28 - Bit 2)
          LE Read Supported States (Octet 28 - Bit 3)
          LE Receiver Test (Octet 28 - Bit 4)
          LE Transmitter Test (Octet 28 - Bit 5)
          LE Test End (Octet 28 - Bit 6)
          Read Authenticated Payload Timeout (Octet 32 - Bit 4)
          Write Authenticated Payload Timeout (Octet 32 - Bit 5)
          LE Set Data Length (Octet 33 - Bit 6)
          LE Read Suggested Default Data Length (Octet 33 - Bit 7)
          LE Write Suggested Default Data Length (Octet 34 - Bit 0)
          LE Add Device To Resolving List (Octet 34 - Bit 3)
          LE Remove Device From Resolving List (Octet 34 - Bit 4)
          LE Clear Resolving List (Octet 34 - Bit 5)
          LE Read Resolving List Size (Octet 34 - Bit 6)
          LE Set Address Resolution Enable (Octet 35 - Bit 1)
          LE Set Resolvable Private Address Timeout (Octet 35 - Bit 2)
          LE Read Maximum Data Length (Octet 35 - Bit 3)
          LE Read PHY (Octet 35 - Bit 4)
          LE Set Default PHY (Octet 35 - Bit 5)
          LE Set PHY (Octet 35 - Bit 6)
          LE Enhanced Receiver Test (Octet 35 - Bit 7)
          LE Enhanced Transmitter Test (Octet 36 - Bit 0)
          LE Set Advertising Set Random Address (Octet 36 - Bit 1)
          LE Set Extended Advertising Parameters (Octet 36 - Bit 2)
          LE Set Extended Advertising Data (Octet 36 - Bit 3)
          LE Set Extended Scan Response Data (Octet 36 - Bit 4)
          LE Set Extended Advertising Enable (Octet 36 - Bit 5)
          LE Read Maximum Advertising Data Length (Octet 36 - Bit 6)
          LE Read Number of Supported Advertising Sets (Octet 36 - Bit 7)
          LE Remove Advertising Set (Octet 37 - Bit 0)
          LE Clear Advertising Sets (Octet 37 - Bit 1)
          LE Set Periodic Advertising Parameters (Octet 37 - Bit 2)
          LE Set Periodic Advertising Data (Octet 37 - Bit 3)
          LE Set Periodic Advertising Enable (Octet 37 - Bit 4)
          LE Set Extended Scan Parameters (Octet 37 - Bit 5)
          LE Set Extended Scan Enable (Octet 37 - Bit 6)
          LE Extended Create Connection (Octet 37 - Bit 7)
          LE Periodic Advertising Create Sync (Octet 38 - Bit 0)
          LE Periodic Advertising Create Sync Cancel (Octet 38 - Bit 1)
          LE Periodic Advertising Terminate Sync (Octet 38 - Bit 2)
          LE Add Device To Periodic Advertiser List (Octet 38 - Bit 3)
          LE Remove Device From Periodic Advertiser List (Octet 38 - Bit 4)
          LE Clear Periodic Advertiser List (Octet 38 - Bit 5)
          LE Read Periodic Advertiser List Size (Octet 38 - Bit 6)
          LE Read Transmit Power (Octet 38 - Bit 7)
          LE Read RF Path Compensation (Octet 39 - Bit 0)
          LE Write RF Path Compensation (Octet 39 - Bit 1)
          LE Set Privacy Mode (Octet 39 - Bit 2)
          LE Periodic Advertising Receive Enable (Octet 40 - Bit 5)
          LE Periodic Advertising Sync Transfer (Octet 40 - Bit 6)
          LE Periodic Advertising Set Info Transfer (Octet 40 - Bit 7)
          LE Periodic Advertising Sync Transfer Parameters (Octet 41 - Bit 0)
          LE Set Default Periodic Advertisng Sync Transfer Parameters (Octet 41 - Bit 1)
          LE Read Buffer v2 (Octet 41 - Bit 5)
          LE Read ISO TX Sync (Octet 41 - Bit 6)
          LE Set Connected Isochronous Group Parameters (Octet 41 - Bit 7)
          LE Set Connected Isochronous Group Parameters Test (Octet 42 - Bit 0)
          LE Create Connected Isochronous Stream (Octet 42 - Bit 1)
          LE Remove Connected Isochronous Group (Octet 42 - Bit 2)
          LE Accept Connected Isochronous Stream Request (Octet 42 - Bit 3)
          LE Reject Connected Isochronous Stream Request (Octet 42 - Bit 4)
          LE Create Broadcast Isochronous Group (Octet 42 - Bit 5)
          LE Create Broadcast Isochronous Group Test (Octet 42 - Bit 6)
          LE Terminate Broadcast Isochronous Group (Octet 42 - Bit 7)
          LE Broadcast Isochronous Group Create Sync (Octet 43 - Bit 0)
          LE Broadcast Isochronous Group Terminate Sync (Octet 43 - Bit 1)
          LE Request Peer SCA (Octet 43 - Bit 2)
          LE Setup Isochronous Data Path (Octet 43 - Bit 3)
          LE Remove Isochronous Data Path (Octet 43 - Bit 4)
          LE Isochronous Transmit Test (Octet 43 - Bit 5)
          LE Isochronous Receive Test (Octet 43 - Bit 6)
          LE Isochronous Read Test Counters (Octet 43 - Bit 7)
          LE Isochronous Read Test Counters (Octet 44 - Bit 0)
          LE Set Host Feature (Octet 44 - Bit 1)
          LE Read ISO link quality (Octet 44 - Bit 2)
          Octet 45 - Bit 6 
          Octet 46 - Bit 0 
          Octet 46 - Bit 1 
          Octet 46 - Bit 2 
zephyr.exe[862144]: < HCI Command: Host Buffer Size (0x03|0x0033) plen 7                                              #9 0.636865
        ACL MTU: 255  ACL max packet: 16
        SCO MTU: 0    SCO max packet: 0
> HCI Event: Command Complete (0x0e) plen 4                                                                          #10 0.637433
      Host Buffer Size (0x03|0x0033) ncmd 1
        Status: Success (0x00)
zephyr.exe[862144]: < HCI Command: Set Controller To Host Flow Control (0x03|0x0031) plen 1                          #11 0.656876
        Flow control: ACL Data Packets (0x01)
> HCI Event: Command Complete (0x0e) plen 4                                                                          #12 0.657983
      Set Controller To Host Flow Control (0x03|0x0031) ncmd 1
        Status: Success (0x00)
zephyr.exe[862144]: < HCI Command: LE Read Local Supported Features (0x08|0x0003) plen 0                             #13 0.676871
> HCI Event: Command Complete (0x0e) plen 12                                                                         #14 0.677961
      LE Read Local Supported Features (0x08|0x0003) ncmd 1
        Status: Success (0x00)
        Features: 0xfd 0x79 0x00 0xf7 0x30 0x01 0x00 0x00
          LE Encryption
          Extended Reject Indication
          Peripheral-initiated Features Exchange
          LE Ping
          LE Data Packet Length Extension
          LL Privacy
          Extended Scanner Filter Policies
          LE 2M PHY
          LE Coded PHY
          LE Extended Advertising
          LE Periodic Advertising
          Channel Selection Algorithm #2
          Periodic Advertising Sync Transfer - Sender
          Periodic Advertising Sync Transfer - Recipient
          Sleep Clock Accuracy Updates
          Connected Isochronous Stream - Central
          Connected Isochronous Stream - Peripheral
          Isochronous Broadcaster
          Synchronized Receiver
          Periodic Advertising ADI support
          Connection Subrating
          Unknown features (0x0000010000000000)
zephyr.exe[862144]: < HCI Command: LE Set Host Feature (0x08|0x0074) plen 2                                          #15 0.696844
        Bit Number: 32
          Connected Isochronous Stream (Host Support)
        Bit Value: 1
> HCI Event: Command Complete (0x0e) plen 4                                                                          #16 0.697312
      LE Set Host Feature (0x08|0x0074) ncmd 1
        Status: Success (0x00)
zephyr.exe[862144]: < HCI Command: LE Read Buffer v2 (0x08|0x0060) plen 0                                            #17 0.716866
> HCI Event: Command Complete (0x0e) plen 10                                                                         #18 0.717960
      LE Read Buffer v2 (0x08|0x0060) ncmd 1
        Status: Success (0x00)
        ACL MTU: 27
        ACL max packet: 3
        ISO MTU: 318
        ISO max packet: 3
zephyr.exe[862144]: < HCI Command: LE Read Maximum Advertising Data Length (0x08|0x003a) plen 0                      #19 0.736891
> HCI Event: Command Complete (0x0e) plen 6                                                                          #20 0.737424
      LE Read Maximum Advertising Data Length (0x08|0x003a) ncmd 1
        Status: Success (0x00)
        Max length: 1650
zephyr.exe[862144]: < HCI Command: LE Read Supported States (0x08|0x001c) plen 0                                     #21 0.756853
> HCI Event: Command Complete (0x0e) plen 12                                                                         #22 0.758033
      LE Read Supported States (0x08|0x001c) ncmd 1
        Status: Success (0x00)
        States: 0x000003ff3e0306ff
          Non-connectable Advertising State
          Scannable Advertising State
          Connectable Advertising State
          High Duty Cycle Directed Advertising State
          Passive Scanning State
          Active Scanning State
          Initiating State
            and Connection State (Central Role)
          Connection State (Peripheral Role)
          Scannable Advertising State
            and Passive Scanning State
          Connectable Advertising State
            and Passive Scanning State
          Non-connectable Advertising State
            and Initiating State
          Scannable Advertising State
            and Initiating State
          Active Scanning State
            and Connection State (Central Role)
          Passive Scanning State
            and Connection State (Peripheral Role)
          Active Scanning State
            and Connection State (Peripheral Role)
          Initiating State
            and Connection State (Central Role)
            and Central Role & Central Role
          Low Duty Cycle Directed Advertising State
          Connectable Advertising State
            and Initiating State
            and Central Role & Peripheral Role
          High Duty Cycle Directed Advertising State
            and Initiating State
            and Central Role & Peripheral Role
          Low Duty Cycle Directed Advertising State
            and Initiating State
            and Central Role & Peripheral Role
          Connectable Advertising State
            and Connection State (Central Role)
            and Central Role & Peripheral Role
          High Duty Cycle Directed Advertising State
            and Connection State (Central Role)
            and Central Role & Peripheral Role
          Low Duty Cycle Directed Advertising State
            and Connection State (Central Role)
            and Central Role & Peripheral Role
          Connectable Advertising State
            and Connection State (Peripheral Role)
            and Central Role & Peripheral Role
          High Duty Cycle Directed Advertising State
            and Connection State (Peripheral Role)
            and Peripheral Role & Peripheral Role
          Low Duty Cycle Directed Advertising State
            and Connection State (Peripheral Role)
            and Peripheral Role & Peripheral Role
          Initiating State
            and Connection State (Peripheral Role)
            and Central Role & Peripheral Role
zephyr.exe[862144]: < HCI Command: LE Read Maximum Data Length (0x08|0x002f) plen 0                                  #23 0.776806
> HCI Event: Command Complete (0x0e) plen 12                                                                         #24 0.777490
      LE Read Maximum Data Length (0x08|0x002f) ncmd 1
        Status: Success (0x00)
        Max TX octets: 251
        Max TX time: 2704
        Max RX octets: 251
        Max RX time: 2704
zephyr.exe[862144]: < HCI Command: LE Write Suggested Default Data Length (0x08|0x0024) plen 4                       #25 0.796864
        TX octets: 251
        TX time: 2704
> HCI Event: Command Complete (0x0e) plen 4                                                                          #26 0.797385
      LE Write Suggested Default Data Length (0x08|0x0024) ncmd 1
        Status: Success (0x00)
zephyr.exe[862144]: < HCI Command: LE Read Resolving List Size (0x08|0x002a) plen 0                                  #27 0.816860
> HCI Event: Command Complete (0x0e) plen 5                                                                          #28 0.817576
      LE Read Resolving List Size (0x08|0x002a) ncmd 1
        Status: Success (0x00)
        Size: 8
zephyr.exe[862144]: < HCI Command: LE Set Event Mask (0x08|0x0001) plen 8                                            #29 0.836861
        Mask: 0x000002023f87fa5e
          LE Advertising Report
          LE Connection Update Complete
          LE Read Remote Used Features Complete
          LE Long Term Key Request
          LE Data Length Change
          LE Enhanced Connection Complete
          LE PHY Update Complete
          LE Extended Advertising Report
          LE Periodic Advertising Sync Established
          LE Periodic Advertising Report
          LE Periodic Advertising Sync Lost
          LE Extended Scan Timeout
          LE Extended Advertising Set Terminated
          LE Scan Request Received
          LE Periodic Advertising Sync Transfer Rvc
          LE CIS Established
          LE CIS Request
          LE Create BIG Complete
          LE Terminate BIG Complete
          LE BIG Sync Established Complete
          LE BIG Sync Lost
          LE BIG Info Advertising Report
          Unknown mask (0x0000020000000000)
> HCI Event: Command Complete (0x0e) plen 4                                                                          #30 0.837637
      LE Set Event Mask (0x08|0x0001) ncmd 1
        Status: Success (0x00)
zephyr.exe[862144]: < HCI Command: Set Event Mask (0x03|0x0001) plen 8                                               #31 0.856866
        Mask: 0x2000800002008890
          Disconnection Complete
          Encryption Change
          Read Remote Version Information Complete
          Hardware Error
          Data Buffer Overflow
          Encryption Key Refresh Complete
          LE Meta
> HCI Event: Command Complete (0x0e) plen 4                                                                          #32 0.857792
      Set Event Mask (0x03|0x0001) ncmd 1
        Status: Success (0x00)
zephyr.exe[862144]: < HCI Command: Read BD ADDR (0x04|0x0009) plen 0                                                 #33 0.876870
> HCI Event: Command Complete (0x0e) plen 10                                                                         #34 0.877686
      Read BD ADDR (0x04|0x0009) ncmd 1
        Status: Success (0x00)
        Address: 00:00:00:00:00:00 (OUI 00-00-00)
zephyr.exe[862144]: < HCI Command: LE Set Random Address (0x08|0x0005) plen 6                                        #35 0.896874
        Address: D5:B6:CC:31:DB:3B (Static)
> HCI Event: Command Complete (0x0e) plen 4                                                                          #36 0.897736
      LE Set Random Address (0x08|0x0005) ncmd 1
        Status: Success (0x00)
zephyr.exe[862144]: < HCI Command: LE Set Extended Advertising Parameters (0x08|0x0036) plen 25                      #37 2.116930
        Handle: 0x00
        Properties: 0x0001
          Connectable
        Min advertising interval: 100.000 msec (0x00a0)
        Max advertising interval: 150.000 msec (0x00f0)
        Channel map: 37, 38, 39 (0x07)
        Own address type: Random (0x01)
        Peer address type: Public (0x00)
        Peer address: 00:00:00:00:00:00 (OUI 00-00-00)
        Filter policy: Allow Scan Request from Any, Allow Connect Request from Any (0x00)
        TX power: Host has no preference (0x7f)
        Primary PHY: LE 1M (0x01)
        Secondary max skip: 0x00
        Secondary PHY: LE 2M (0x02)
        SID: 0x00
        Scan request notifications: Disabled (0x00)
> HCI Event: Command Complete (0x0e) plen 5                                                                          #38 2.118343
      LE Set Extended Advertising Parameters (0x08|0x0036) ncmd 1
        Status: Success (0x00)
        TX power (selected): 0 dbm (0x00)
zephyr.exe[862144]: < HCI Command: LE Set Advertising Set Random Address (0x08|0x0035) plen 7                        #39 2.136881
        Advertising handle: 0x00
        Advertising random address: D5:B6:CC:31:DB:3B (Static)
> HCI Event: Command Complete (0x0e) plen 4                                                                          #40 2.137391
      LE Set Advertising Set Random Address (0x08|0x0035) ncmd 1
        Status: Success (0x00)
zephyr.exe[862144]: < HCI Command: LE Set Extended Advertising Data (0x08|0x0037) plen 30                            #41 2.156887
        Handle: 0x00
        Operation: Complete extended advertising data (0x03)
        Fragment preference: Minimize fragmentation (0x01)
        Data length: 0x1a
        Flags: 0x06
          LE General Discoverable Mode
          BR/EDR Not Supported
        Service Data: Common Audio (0x1853)
          Data[1]: 01
        Service Data: Audio Stream Control (0x184e)
          Data[6]: 014400400000
        Resolvable Set Identifier: 48-61-8E-0C-80-97
          Hash: 0x c8097
          Random: 0x48618e
> HCI Event: Command Complete (0x0e) plen 4                                                                          #42 2.157982
      LE Set Extended Advertising Data (0x08|0x0037) ncmd 1
        Status: Success (0x00)
zephyr.exe[862144]: < HCI Command: LE Set Extended Advertising Enable (0x08|0x0039) plen 6                           #43 2.176883
        Extended advertising: Enabled (0x01)
        Number of sets: 1 (0x01)
        Entry 0
          Handle: 0x00
          Duration: 0 ms (0x00)
          Max ext adv events: 0
> HCI Event: Command Complete (0x0e) plen 4                                                                          #44 2.177660
      LE Set Extended Advertising Enable (0x08|0x0039) ncmd 1
        Status: Success (0x00)
> HCI Event: LE Meta Event (0x3e) plen 31                                                                            #45 3.868054
      LE Enhanced Connection Complete (0x0a)
        Status: Success (0x00)
        Handle: 147
        Role: Peripheral (0x01)
        Peer address type: Public (0x00)
        Peer address: DF:A9:FF:F6:B1:1A (OUI DF-A9-FF)
        Local resolvable private address: 00:00:00:00:00:00 (Non-Resolvable)
        Peer resolvable private address: 00:00:00:00:00:00 (Non-Resolvable)
        Connection interval: 150.00 msec (0x0078)
        Connection latency: 0 (0x0000)
        Supervision timeout: 25120 msec (0x09d0)
        Central clock accuracy: 0x01
> HCI Event: LE Meta Event (0x3e) plen 6                                                                             #46 3.868221
      LE Advertising Set Terminated (0x12)
        Status: Success (0x00)
        Handle: 0
        Connection handle: 147
        Number of completed extended advertising events: 0
zephyr.exe[862144]: < HCI Command: LE Read Remote Used Features (0x08|0x0016) plen 2                                 #47 3.876995
        Handle: 147 Address: DF:A9:FF:F6:B1:1A (OUI DF-A9-FF)
> HCI Event: Command Status (0x0f) plen 4                                                                            #48 3.877724
      LE Read Remote Used Features (0x08|0x0016) ncmd 1
        Status: Success (0x00)
zephyr.exe[862144]: < ACL Data TX: Handle 147 [1/3] flags 0x00 dlen 7                                                #49 3.896884
      ATT: Exchange MTU Request (0x02) len 2
        Client RX MTU: 251
> HCI Event: Number of Completed Packets (0x13) plen 5                                                               #50 4.170519
        Num handles: 1
        Handle: 147 Address: DF:A9:FF:F6:B1:1A (OUI DF-A9-FF)
        Count: 1
        Buffers: 0/3
        #49: len 7 (0 Kb/s)
        Latency: 273 msec (273-273 msec ~273 msec)
zephyr.exe[862144]: < HCI Command: LE Remove Advertising Set (0x08|0x003c) plen 1                                    #51 4.266912
        Handle: 0
> HCI Event: Command Complete (0x0e) plen 4                                                                          #52 4.267805
      LE Remove Advertising Set (0x08|0x003c) ncmd 1
        Status: Success (0x00)
zephyr.exe[862144]: < HCI Command: LE Set Extended Advertising Parameters (0x08|0x0036) plen 25                      #53 4.276915
        Handle: 0x00
        Properties: 0x0001
          Connectable
        Min advertising interval: 100.000 msec (0x00a0)
        Max advertising interval: 150.000 msec (0x00f0)
        Channel map: 37, 38, 39 (0x07)
        Own address type: Random (0x01)
        Peer address type: Public (0x00)
        Peer address: 00:00:00:00:00:00 (OUI 00-00-00)
        Filter policy: Allow Scan Request from Any, Allow Connect Request from Any (0x00)
        TX power: Host has no preference (0x7f)
        Primary PHY: LE 1M (0x01)
        Secondary max skip: 0x00
        Secondary PHY: LE 2M (0x02)
        SID: 0x01
        Scan request notifications: Disabled (0x00)
> HCI Event: Command Complete (0x0e) plen 5                                                                          #54 4.277941
      LE Set Extended Advertising Parameters (0x08|0x0036) ncmd 1
        Status: Success (0x00)
        TX power (selected): 0 dbm (0x00)
zephyr.exe[862144]: < HCI Command: LE Set Advertising Set Random Address (0x08|0x0035) plen 7                        #55 4.296899
        Advertising handle: 0x00
        Advertising random address: D5:B6:CC:31:DB:3B (Static)
> HCI Event: Command Complete (0x0e) plen 4                                                                          #56 4.297718
      LE Set Advertising Set Random Address (0x08|0x0035) ncmd 1
        Status: Success (0x00)
zephyr.exe[862144]: < HCI Command: LE Set Extended Advertising Data (0x08|0x0037) plen 22                            #57 4.316899
        Handle: 0x00
        Operation: Complete extended advertising data (0x03)
        Fragment preference: Minimize fragmentation (0x01)
        Data length: 0x12
        Flags: 0x06
          LE General Discoverable Mode
          BR/EDR Not Supported
        Name (complete): Tester_F6B11A
> HCI Event: Command Complete (0x0e) plen 4                                                                          #58 4.317827
      LE Set Extended Advertising Data (0x08|0x0037) ncmd 1
        Status: Success (0x00)
> HCI Event: LE Meta Event (0x3e) plen 12                                                                            #59 4.320663
      LE Read Remote Used Features (0x04)
        Status: Success (0x00)
        Handle: 147 Address: DF:A9:FF:F6:B1:1A (OUI DF-A9-FF)
        Features: 0x2d 0x49 0x00 0xf7 0x67 0xd8 0x00 0x00
          LE Encryption
          Extended Reject Indication
          Peripheral-initiated Features Exchange
          LE Data Packet Length Extension
          LE 2M PHY
          LE Coded PHY
          Channel Selection Algorithm #2
          Periodic Advertising Sync Transfer - Sender
          Periodic Advertising Sync Transfer - Recipient
          Sleep Clock Accuracy Updates
          Connected Isochronous Stream - Central
          Connected Isochronous Stream - Peripheral
          Isochronous Broadcaster
          Synchronized Receiver
          Connected Isochronous Stream (Host Support)
          LE Power Control Request
          LE Power Control Request
          Connection Subrating
          Connection Subrating (Host Support)
          Unknown features (0x0000d80000000000)
zephyr.exe[862144]: < HCI Command: LE Set Extended Advertising Enable (0x08|0x0039) plen 6                           #60 4.336942
        Extended advertising: Enabled (0x01)
        Number of sets: 1 (0x01)
        Entry 0
          Handle: 0x00
          Duration: 0 ms (0x00)
          Max ext adv events: 0
> HCI Event: Command Complete (0x0e) plen 4                                                                          #61 4.337797
      LE Set Extended Advertising Enable (0x08|0x0039) ncmd 1
        Status: Success (0x00)
> ACL Data RX: Handle 147 flags 0x02 dlen 7                                                                          #62 5.070343
      ATT: Exchange MTU Request (0x02) len 2
        Client RX MTU: 64
> ACL Data RX: Handle 147 flags 0x02 dlen 7                                                                          #63 5.070394
      ATT: Exchange MTU Response (0x03) len 2
        Server RX MTU: 64
zephyr.exe[862144]: < HCI Command: Host Number of Completed Packets (0x03|0x0035) plen 5                             #64 5.077013
        Num handles: 1
        Handle: 147 Address: DF:A9:FF:F6:B1:1A (OUI DF-A9-FF)
        Count: 1
zephyr.exe[862144]: < ACL Data TX: Handle 147 [1/3] flags 0x00 dlen 7                                                #65 5.077018
      ATT: Exchange MTU Response (0x03) len 2
        Server RX MTU: 251
zephyr.exe[862144]: < HCI Command: Host Number of Completed Packets (0x03|0x0035) plen 5                             #66 5.077019
        Num handles: 1
        Handle: 147 Address: DF:A9:FF:F6:B1:1A (OUI DF-A9-FF)
        Count: 1
> HCI Event: Number of Completed Packets (0x13) plen 5                                                               #67 5.371100
        Num handles: 1
        Handle: 147 Address: DF:A9:FF:F6:B1:1A (OUI DF-A9-FF)
        Count: 1
        Buffers: 0/3
        #65: len 7 (0 Kb/s)
        Latency: 294 msec (273-294 msec ~283 msec)
> ACL Data RX: Handle 147 flags 0x02 dlen 11                                                                         #68 7.320121
      SMP: Pairing Request (0x01) len 6
        IO capability: KeyboardDisplay (0x04)
        OOB data: Authentication data not present (0x00)
        Authentication requirement: Bonding, No MITM, SC, No Keypresses (0x09)
        Max encryption key size: 16
        Initiator key distribution: EncKey IdKey Sign (0x07)
        Responder key distribution: EncKey IdKey Sign (0x07)
zephyr.exe[862144]: < HCI Command: Host Number of Completed Packets (0x03|0x0035) plen 5                             #69 7.337036
        Num handles: 1
        Handle: 147 Address: DF:A9:FF:F6:B1:1A (OUI DF-A9-FF)
        Count: 1
zephyr.exe[862144]: < ACL Data TX: Handle 147 [1/3] flags 0x00 dlen 11                                               #70 7.337042
      SMP: Pairing Response (0x02) len 6
        IO capability: NoInputNoOutput (0x03)
        OOB data: Authentication data not present (0x00)
        Authentication requirement: Bonding, No MITM, SC, No Keypresses (0x09)
        Max encryption key size: 16
        Initiator key distribution: IdKey Sign (0x06)
        Responder key distribution: Sign (0x04)
> HCI Event: Number of Completed Packets (0x13) plen 5                                                               #71 7.620292
        Num handles: 1
        Handle: 147 Address: DF:A9:FF:F6:B1:1A (OUI DF-A9-FF)
        Count: 1
        Buffers: 0/3
        #70: len 11 (0 Kb/s)
        Latency: 283 msec (273-294 msec ~283 msec)
> ACL Data RX: Handle 147 flags 0x02 dlen 27                                                                         #72 7.620451
> ACL Data RX: Handle 147 flags 0x01 dlen 27                                                                         #73 7.620910
> ACL Data RX: Handle 147 flags 0x01 dlen 15                                                                         #74 7.621223
      SMP: Pairing Public Key (0x0c) len 64
        X[32]: c1b6d8901e3a5db2c45ce1bfabe40a8bb1a8c597183ef39e02e52348a7691c90
        Y[32]: ad582375dc49bc6496e484f773b46d7edc001c76733a78a0edffcbe9c1b94afa
zephyr.exe[862144]: < HCI Command: Host Number of Completed Packets (0x03|0x0035) plen 5                             #75 7.637008
        Num handles: 1
        Handle: 147 Address: DF:A9:FF:F6:B1:1A (OUI DF-A9-FF)
        Count: 1
zephyr.exe[862144]: < HCI Command: Host Number of Completed Packets (0x03|0x0035) plen 5                             #76 7.637013
        Num handles: 1
        Handle: 147 Address: DF:A9:FF:F6:B1:1A (OUI DF-A9-FF)
        Count: 1
zephyr.exe[862144]: < HCI Command: Host Number of Completed Packets (0x03|0x0035) plen 5                             #77 7.637081
        Num handles: 1
        Handle: 147 Address: DF:A9:FF:F6:B1:1A (OUI DF-A9-FF)
        Count: 1
zephyr.exe[862144]: < ACL Data TX: Handle 147 [1/3] flags 0x00 dlen 27                                               #78 7.637145
zephyr.exe[862144]: < ACL Data TX: Handle 147 flags 0x01 dlen 27                                                     #79 7.637149
zephyr.exe[862144]: < ACL Data TX: Handle 147 flags 0x01 dlen 15                                                     #80 7.637149
      SMP: Pairing Public Key (0x0c) len 64
        X[32]: 98308440221e2d910f0e54b71e7ec652857aa9b5a0dc65028824cc19db1226e9
        Y[32]: 67a4816bcb62efb21701e31fdb27561a6217575fb007a8bbdabe7e28b6f68482
> HCI Event: Number of Completed Packets (0x13) plen 5                                                               #81 7.770511
        Num handles: 1
        Handle: 147 Address: DF:A9:FF:F6:B1:1A (OUI DF-A9-FF)
        Count: 1
        Buffers: 0/3
        #78: len 27 (1 Kb/s)
        Latency: 133 msec (133-294 msec ~208 msec)
> HCI Event: Number of Completed Packets (0x13) plen 5                                                               #82 7.771015
        Num handles: 1
        Handle: 147 Address: DF:A9:FF:F6:B1:1A (OUI DF-A9-FF)
        Count: 1
        Buffers: underflow/3
        #79: len 27 (1 Kb/s)
        Latency: 133 msec (133-294 msec ~171 msec)
zephyr.exe[862144]: < ACL Data TX: Handle 147 [1/3] flags 0x00 dlen 21                                               #83 7.776922
      SMP: Pairing Confirm (0x03) len 16
        Confirm value[16]: 0e85a249063a1a2fd8062151798a383a
> HCI Event: Number of Completed Packets (0x13) plen 5                                                               #84 7.919938
        Num handles: 1
        Handle: 147 Address: DF:A9:FF:F6:B1:1A (OUI DF-A9-FF)
        Count: 1
        Buffers: 0/3
        #80: len 15 (0 Kb/s)
        Latency: 282 msec (133-294 msec ~226 msec)
> HCI Event: Number of Completed Packets (0x13) plen 5                                                               #85 8.070032
        Num handles: 1
        Handle: 147 Address: DF:A9:FF:F6:B1:1A (OUI DF-A9-FF)
        Count: 1
        Buffers: underflow/3
        #83: len 21 (0 Kb/s)
        Latency: 293 msec (133-294 msec ~260 msec)
> ACL Data RX: Handle 147 flags 0x02 dlen 21                                                                         #86 8.070476
      SMP: Pairing Random (0x04) len 16
        Random value[16]: 8c32530caf325bd70000000000000000
zephyr.exe[862144]: < HCI Command: Host Number of Completed Packets (0x03|0x0035) plen 5                             #87 8.077038
        Num handles: 1
        Handle: 147 Address: DF:A9:FF:F6:B1:1A (OUI DF-A9-FF)
        Count: 1
zephyr.exe[862144]: < ACL Data TX: Handle 147 [1/3] flags 0x00 dlen 21                                               #88 8.077058
      SMP: Pairing Random (0x04) len 16
        Random value[16]: f966a694cbe26df70bb96773e6cc6f5d
> HCI Event: Number of Completed Packets (0x13) plen 5                                                               #89 8.369979
        Num handles: 1
        Handle: 147 Address: DF:A9:FF:F6:B1:1A (OUI DF-A9-FF)
        Count: 1
        Buffers: 0/3
        #88: len 21 (0 Kb/s)
        Latency: 292 msec (133-294 msec ~276 msec)
> ACL Data RX: Handle 147 flags 0x02 dlen 21                                                                         #90 8.520063
      SMP: Pairing DHKey Check (0x0d) len 16
        E[16]: 33f8e2e1f34b17ad400e48571e92a9be
zephyr.exe[862144]: < HCI Command: Host Number of Completed Packets (0x03|0x0035) plen 5                             #91 8.537119
        Num handles: 1
        Handle: 147 Address: DF:A9:FF:F6:B1:1A (OUI DF-A9-FF)
        Count: 1
zephyr.exe[862144]: < ACL Data TX: Handle 147 [1/3] flags 0x00 dlen 21                                               #92 8.537190
      SMP: Pairing DHKey Check (0x0d) len 16
        E[16]: fc149d927a7b603f9996aaba95b01d1a
> HCI Event: Number of Completed Packets (0x13) plen 5                                                               #93 8.820399
        Num handles: 1
        Handle: 147 Address: DF:A9:FF:F6:B1:1A (OUI DF-A9-FF)
        Count: 1
        Buffers: 0/3
        #92: len 21 (0 Kb/s)
        Latency: 283 msec (133-294 msec ~279 msec)
> HCI Event: LE Meta Event (0x3e) plen 13                                                                            #94 8.970619
      LE Long Term Key Request (0x05)
        Handle: 147 Address: DF:A9:FF:F6:B1:1A (OUI DF-A9-FF)
        Random number: 0x0000000000000000
        Encrypted diversifier: 0x0000
zephyr.exe[862144]: < HCI Command: LE Long Term Key Request Reply (0x08|0x001a) plen 18                              #95 8.977028
        Handle: 147 Address: DF:A9:FF:F6:B1:1A (OUI DF-A9-FF)
        Long term key[16]: 554710ca8a44188c7c608864e7672393
> HCI Event: Command Complete (0x0e) plen 6                                                                          #96 8.977918
      LE Long Term Key Request Reply (0x08|0x001a) ncmd 1
        Status: Success (0x00)
        Handle: 147 Address: DF:A9:FF:F6:B1:1A (OUI DF-A9-FF)
> HCI Event: Encryption Change (0x08) plen 4                                                                         #97 9.720380
        Status: Success (0x00)
        Handle: 147 Address: DF:A9:FF:F6:B1:1A (OUI DF-A9-FF)
        Encryption: Enabled with AES-CCM (0x01)
zephyr.exe[862144]: < ACL Data TX: Handle 147 [1/3] flags 0x00 dlen 21                                               #98 9.847039
      SMP: Signing Information (0x0a) len 16
        Signature key[16]: 555cc64d02679f89a05211af56d8b3da
> HCI Event: Number of Completed Packets (0x13) plen 5                                                              #99 10.020142
        Num handles: 1
        Handle: 147 Address: DF:A9:FF:F6:B1:1A (OUI DF-A9-FF)
        Count: 1
        Buffers: 0/3
        #98: len 21 (0 Kb/s)
        Latency: 173 msec (133-294 msec ~226 msec)
> ACL Data RX: Handle 147 flags 0x02 dlen 21                                                                       #100 10.020444
      SMP: Identity Information (0x08) len 16
        Identity resolving key[16]: 4008086ec02ced094daa43db9abb6a93
> ACL Data RX: Handle 147 flags 0x02 dlen 12                                                                       #101 10.020771
      SMP: Identity Address Information (0x09) len 7
        Address: DF:A9:FF:F6:B1:1A (OUI DF-A9-FF)
> ACL Data RX: Handle 147 flags 0x02 dlen 21                                                                       #102 10.021036
      SMP: Signing Information (0x0a) len 16
        Signature key[16]: 292527b30617f694b554a2aa6993120a
zephyr.exe[862144]: < HCI Command: Host Number of Completed Packets (0x03|0x0035) plen 5                           #103 10.037062
        Num handles: 1
        Handle: 147 Address: DF:A9:FF:F6:B1:1A (OUI DF-A9-FF)
        Count: 1
zephyr.exe[862144]: < HCI Command: LE Set Extended Advertising Enable (0x08|0x0039) plen 6                         #104 10.037068
        Extended advertising: Disabled (0x00)
        Number of sets: 1 (0x01)
        Entry 0
          Handle: 0x00
          Duration: 0 ms (0x00)
          Max ext adv events: 0
> HCI Event: Command Complete (0x0e) plen 4                                                                        #105 10.037797
      LE Set Extended Advertising Enable (0x08|0x0039) ncmd 1
        Status: Success (0x00)
zephyr.exe[862144]: < HCI Command: LE Add Device To Resolving List (0x08|0x0027) plen 39                           #106 10.057055
        Address type: Public (0x00)
        Address: DF:A9:FF:F6:B1:1A (OUI DF-A9-FF)
        Peer identity resolving key[16]: 4008086ec02ced094daa43db9abb6a93
        Local identity resolving key[16]: 00000000000000000000000000000000
> HCI Event: Command Complete (0x0e) plen 4                                                                        #107 10.058179
      LE Add Device To Resolving List (0x08|0x0027) ncmd 1
        Status: Success (0x00)
zephyr.exe[862144]: < HCI Command: LE Set Privacy Mode (0x08|0x004e) plen 8                                        #108 10.077036
        Peer Identity address type: Public (0x00)
        Peer Identity address: DF:A9:FF:F6:B1:1A (OUI DF-A9-FF)
        Privacy Mode: Use Device Privacy (0x01)
> HCI Event: Command Complete (0x0e) plen 4                                                                        #109 10.077850
      LE Set Privacy Mode (0x08|0x004e) ncmd 1
        Status: Success (0x00)
zephyr.exe[862144]: < HCI Command: LE Set Address Resolution Enable (0x08|0x002d) plen 1                           #110 10.096958
        Address resolution: Enabled (0x01)
> HCI Event: Command Complete (0x0e) plen 4                                                                        #111 10.097775
      LE Set Address Resolution Enable (0x08|0x002d) ncmd 1
        Status: Success (0x00)
zephyr.exe[862144]: < HCI Command: LE Set Extended Advertising Enable (0x08|0x0039) plen 6                         #112 10.117027
        Extended advertising: Enabled (0x01)
        Number of sets: 1 (0x01)
        Entry 0
          Handle: 0x00
          Duration: 0 ms (0x00)
          Max ext adv events: 0
> HCI Event: Command Complete (0x0e) plen 4                                                                        #113 10.118006
      LE Set Extended Advertising Enable (0x08|0x0039) ncmd 1
        Status: Success (0x00)
zephyr.exe[862144]: < HCI Command: Host Number of Completed Packets (0x03|0x0035) plen 5                           #114 10.137012
        Num handles: 1
        Handle: 147 Address: DF:A9:FF:F6:B1:1A (OUI DF-A9-FF)
        Count: 1
zephyr.exe[862144]: < HCI Command: Host Number of Completed Packets (0x03|0x0035) plen 5                           #115 10.137050
        Num handles: 1
        Handle: 147 Address: DF:A9:FF:F6:B1:1A (OUI DF-A9-FF)
        Count: 1
> ACL Data RX: Handle 147 flags 0x02 dlen 13                                                                       #116 10.470160
      ATT: Find By Type Value Request (0x06) len 8
        Handle range: 0x0001-0xffff
        Attribute type: Primary Service (0x2800)
          UUID: Hearing Aid (0x1854)
zephyr.exe[862144]: < HCI Command: Host Number of Completed Packets (0x03|0x0035) plen 5                           #117 10.477015
        Num handles: 1
        Handle: 147 Address: DF:A9:FF:F6:B1:1A (OUI DF-A9-FF)
        Count: 1
zephyr.exe[862144]: < ACL Data TX: Handle 147 [1/3] flags 0x00 dlen 9                                              #118 10.477021
      ATT: Find By Type Value Response (0x07) len 4
        Handle range: 0x00ad-0x00b5
> HCI Event: Number of Completed Packets (0x13) plen 5                                                             #119 10.770034
        Num handles: 1
        Handle: 147 Address: DF:A9:FF:F6:B1:1A (OUI DF-A9-FF)
        Count: 1
        Buffers: 0/3
        #118: len 9 (0 Kb/s)
        Latency: 293 msec (133-294 msec ~259 msec)
> ACL Data RX: Handle 147 flags 0x02 dlen 13                                                                       #120 10.770311
      ATT: Find By Type Value Request (0x06) len 8
        Handle range: 0x00b6-0xffff
        Attribute type: Primary Service (0x2800)
          UUID: Hearing Aid (0x1854)
zephyr.exe[862144]: < HCI Command: Host Number of Completed Packets (0x03|0x0035) plen 5                           #121 10.777040
        Num handles: 1
        Handle: 147 Address: DF:A9:FF:F6:B1:1A (OUI DF-A9-FF)
        Count: 1
zephyr.exe[862144]: < ACL Data TX: Handle 147 [1/3] flags 0x00 dlen 9                                              #122 10.777143
      ATT: Error Response (0x01) len 4
        Find By Type Value Request (0x06)
        Handle: 0x00b6
        Error: Attribute Not Found (0x0a)
> HCI Event: Number of Completed Packets (0x13) plen 5                                                             #123 11.070052
        Num handles: 1
        Handle: 147 Address: DF:A9:FF:F6:B1:1A (OUI DF-A9-FF)
        Count: 1
        Buffers: 0/3
        #122: len 9 (0 Kb/s)
        Latency: 292 msec (133-294 msec ~276 msec)
> ACL Data RX: Handle 147 flags 0x02 dlen 11                                                                       #124 11.070213
      ATT: Read By Type Request (0x08) len 6
        Handle range: 0x00ad-0x00b5
        Attribute type: Characteristic (0x2803)
zephyr.exe[862144]: < HCI Command: Host Number of Completed Packets (0x03|0x0035) plen 5                           #125 11.077005
        Num handles: 1
        Handle: 147 Address: DF:A9:FF:F6:B1:1A (OUI DF-A9-FF)
        Count: 1
zephyr.exe[862144]: < ACL Data TX: Handle 147 [1/3] flags 0x00 dlen 27                                             #126 11.077011
      ATT: Read By Type Response (0x09) len 22
        Attribute data length: 7
        Attribute data list: 3 entries
        Handle: 0x00ae
        Value[5]: 02af00da2b
            Properties: 0x02
              Read (0x02)
            Value Handle: 0x00af
            Value UUID: Hearing Aid Features (0x2bda)
        Handle: 0x00b0
        Value[5]: 28b100db2b
            Properties: 0x28
              Write (0x08)
              Indicate (0x20)
            Value Handle: 0x00b1
            Value UUID: Hearing Aid Preset Control Point (0x2bdb)
        Handle: 0x00b3
        Value[5]: 12b400dc2b
            Properties: 0x12
              Read (0x02)
              Notify (0x10)
            Value Handle: 0x00b4
            Value UUID: Active Preset Index (0x2bdc)
> HCI Event: Number of Completed Packets (0x13) plen 5                                                             #127 11.370254
        Num handles: 1
        Handle: 147 Address: DF:A9:FF:F6:B1:1A (OUI DF-A9-FF)
        Count: 1
        Buffers: 0/3
        #126: len 27 (0 Kb/s)
        Latency: 293 msec (133-294 msec ~284 msec)
> ACL Data RX: Handle 147 flags 0x02 dlen 11                                                                       #128 11.370256
      ATT: Read By Type Request (0x08) len 6
        Handle range: 0x00b4-0x00b5
        Attribute type: Characteristic (0x2803)
zephyr.exe[862144]: < HCI Command: Host Number of Completed Packets (0x03|0x0035) plen 5                           #129 11.377120
        Num handles: 1
        Handle: 147 Address: DF:A9:FF:F6:B1:1A (OUI DF-A9-FF)
        Count: 1
zephyr.exe[862144]: < ACL Data TX: Handle 147 [1/3] flags 0x00 dlen 9                                              #130 11.377190
      ATT: Error Response (0x01) len 4
        Read By Type Request (0x08)
        Handle: 0x00b4
        Error: Attribute Not Found (0x0a)
> HCI Event: Number of Completed Packets (0x13) plen 5                                                             #131 11.669971
        Num handles: 1
        Handle: 147 Address: DF:A9:FF:F6:B1:1A (OUI DF-A9-FF)
        Count: 1
        Buffers: 0/3
        #130: len 9 (0 Kb/s)
        Latency: 292 msec (133-294 msec ~288 msec)
> ACL Data RX: Handle 147 flags 0x02 dlen 9                                                                        #132 11.670055
      ATT: Find Information Request (0x04) len 4
        Handle range: 0x00b2-0x00b2
zephyr.exe[862144]: < HCI Command: Host Number of Completed Packets (0x03|0x0035) plen 5                           #133 11.677061
        Num handles: 1
        Handle: 147 Address: DF:A9:FF:F6:B1:1A (OUI DF-A9-FF)
        Count: 1
zephyr.exe[862144]: < ACL Data TX: Handle 147 [1/3] flags 0x00 dlen 10                                             #134 11.677068
      ATT: Find Information Response (0x05) len 5
        Format: UUID-16 (0x01)
        Handle: 0x00b2
        UUID: Client Characteristic Configuration (0x2902)
> HCI Event: Number of Completed Packets (0x13) plen 5                                                             #135 11.970034
        Num handles: 1
        Handle: 147 Address: DF:A9:FF:F6:B1:1A (OUI DF-A9-FF)
        Count: 1
        Buffers: 0/3
        #134: len 10 (0 Kb/s)
        Latency: 292 msec (133-294 msec ~290 msec)
> ACL Data RX: Handle 147 flags 0x02 dlen 9                                                                        #136 11.970345
      ATT: Find Information Request (0x04) len 4
        Handle range: 0x00b5-0x00b5
zephyr.exe[862144]: < HCI Command: Host Number of Completed Packets (0x03|0x0035) plen 5                           #137 11.977069
        Num handles: 1
        Handle: 147 Address: DF:A9:FF:F6:B1:1A (OUI DF-A9-FF)
        Count: 1
zephyr.exe[862144]: < ACL Data TX: Handle 147 [1/3] flags 0x00 dlen 10                                             #138 11.977075
      ATT: Find Information Response (0x05) len 5
        Format: UUID-16 (0x01)
        Handle: 0x00b5
        UUID: Client Characteristic Configuration (0x2902)
> HCI Event: Number of Completed Packets (0x13) plen 5                                                             #139 12.270085
        Num handles: 1
        Handle: 147 Address: DF:A9:FF:F6:B1:1A (OUI DF-A9-FF)
        Count: 1
        Buffers: 0/3
        #138: len 10 (0 Kb/s)
        Latency: 293 msec (133-294 msec ~291 msec)
> ACL Data RX: Handle 147 flags 0x02 dlen 13                                                                       #140 12.270203
      ATT: Find By Type Value Request (0x06) len 8
        Handle range: 0x0001-0xffff
        Attribute type: Primary Service (0x2800)
          UUID: Published Audio Capabilities (0x1850)
zephyr.exe[862144]: < HCI Command: Host Number of Completed Packets (0x03|0x0035) plen 5                           #141 12.277039
        Num handles: 1
        Handle: 147 Address: DF:A9:FF:F6:B1:1A (OUI DF-A9-FF)
        Count: 1
zephyr.exe[862144]: < ACL Data TX: Handle 147 [1/3] flags 0x00 dlen 9                                              #142 12.277135
      ATT: Find By Type Value Response (0x07) len 4
        Handle range: 0x0039-0x004b
> HCI Event: Number of Completed Packets (0x13) plen 5                                                             #143 12.570313
        Num handles: 1
        Handle: 147 Address: DF:A9:FF:F6:B1:1A (OUI DF-A9-FF)
        Count: 1
        Buffers: 0/3
        #142: len 9 (0 Kb/s)
        Latency: 293 msec (133-294 msec ~292 msec)
> ACL Data RX: Handle 147 flags 0x02 dlen 13                                                                       #144 12.570375
      ATT: Find By Type Value Request (0x06) len 8
        Handle range: 0x004c-0xffff
        Attribute type: Primary Service (0x2800)
          UUID: Published Audio Capabilities (0x1850)
zephyr.exe[862144]: < HCI Command: Host Number of Completed Packets (0x03|0x0035) plen 5                           #145 12.577038
        Num handles: 1
        Handle: 147 Address: DF:A9:FF:F6:B1:1A (OUI DF-A9-FF)
        Count: 1
zephyr.exe[862144]: < ACL Data TX: Handle 147 [1/3] flags 0x00 dlen 9                                              #146 12.577043
      ATT: Error Response (0x01) len 4
        Find By Type Value Request (0x06)
        Handle: 0x004c
        Error: Attribute Not Found (0x0a)
> HCI Event: Number of Completed Packets (0x13) plen 5                                                             #147 12.870056
        Num handles: 1
        Handle: 147 Address: DF:A9:FF:F6:B1:1A (OUI DF-A9-FF)
        Count: 1
        Buffers: 0/3
        #146: len 9 (0 Kb/s)
        Latency: 293 msec (133-294 msec ~292 msec)
> ACL Data RX: Handle 147 flags 0x02 dlen 11                                                                       #148 12.870059
      ATT: Read By Type Request (0x08) len 6
        Handle range: 0x0039-0x004b
        Attribute type: Characteristic (0x2803)
zephyr.exe[862144]: < HCI Command: Host Number of Completed Packets (0x03|0x0035) plen 5                           #149 12.877070
        Num handles: 1
        Handle: 147 Address: DF:A9:FF:F6:B1:1A (OUI DF-A9-FF)
        Count: 1
zephyr.exe[862144]: < ACL Data TX: Handle 147 [1/3] flags 0x00 dlen 27                                             #150 12.877078
zephyr.exe[862144]: < ACL Data TX: Handle 147 flags 0x01 dlen 21                                                   #151 12.877079
      ATT: Read By Type Response (0x09) len 43
        Attribute data length: 7
        Attribute data list: 6 entries
        Handle: 0x003a
        Value[5]: 123b00c92b
            Properties: 0x12
              Read (0x02)
              Notify (0x10)
            Value Handle: 0x003b
            Value UUID: Sink PAC (0x2bc9)
        Handle: 0x003d
        Value[5]: 1a3e00ca2b
            Properties: 0x1a
              Read (0x02)
              Write (0x08)
              Notify (0x10)
            Value Handle: 0x003e
            Value UUID: Sink Audio Locations (0x2bca)
        Handle: 0x0040
        Value[5]: 124100cb2b
            Properties: 0x12
              Read (0x02)
              Notify (0x10)
            Value Handle: 0x0041
            Value UUID: Source PAC (0x2bcb)
        Handle: 0x0043
        Value[5]: 1a4400cc2b
            Properties: 0x1a
              Read (0x02)
              Write (0x08)
              Notify (0x10)
            Value Handle: 0x0044
            Value UUID: Source Audio Locations (0x2bcc)
        Handle: 0x0046
        Value[5]: 124700cd2b
            Properties: 0x12
              Read (0x02)
              Notify (0x10)
            Value Handle: 0x0047
            Value UUID: Available Audio Contexts (0x2bcd)
        Handle: 0x0049
        Value[5]: 124a00ce2b
            Properties: 0x12
              Read (0x02)
              Notify (0x10)
            Value Handle: 0x004a
            Value UUID: Supported Audio Contexts (0x2bce)
> HCI Event: Number of Completed Packets (0x13) plen 5                                                             #152 13.020351
        Num handles: 1
        Handle: 147 Address: DF:A9:FF:F6:B1:1A (OUI DF-A9-FF)
        Count: 1
        Buffers: 0/3
        #150: len 27 (1 Kb/s)
        Latency: 143 msec (133-294 msec ~218 msec)
> HCI Event: Number of Completed Packets (0x13) plen 5                                                             #153 13.170064
        Num handles: 1
        Handle: 147 Address: DF:A9:FF:F6:B1:1A (OUI DF-A9-FF)
        Count: 1
        Buffers: underflow/3
        #151: len 21 (0 Kb/s)
        Latency: 292 msec (133-294 msec ~255 msec)
> ACL Data RX: Handle 147 flags 0x02 dlen 11                                                                       #154 13.170210
      ATT: Read By Type Request (0x08) len 6
        Handle range: 0x004a-0x004b
        Attribute type: Characteristic (0x2803)
zephyr.exe[862144]: < HCI Command: Host Number of Completed Packets (0x03|0x0035) plen 5                           #155 13.177023
        Num handles: 1
        Handle: 147 Address: DF:A9:FF:F6:B1:1A (OUI DF-A9-FF)
        Count: 1
zephyr.exe[862144]: < ACL Data TX: Handle 147 [1/3] flags 0x00 dlen 9                                              #156 13.177068
      ATT: Error Response (0x01) len 4
        Read By Type Request (0x08)
        Handle: 0x004a
        Error: Attribute Not Found (0x0a)
> HCI Event: Number of Completed Packets (0x13) plen 5                                                             #157 13.470715
        Num handles: 1
        Handle: 147 Address: DF:A9:FF:F6:B1:1A (OUI DF-A9-FF)
        Count: 1
        Buffers: 0/3
        #156: len 9 (0 Kb/s)
        Latency: 293 msec (133-294 msec ~274 msec)
> ACL Data RX: Handle 147 flags 0x02 dlen 9                                                                        #158 13.470717
      ATT: Find Information Request (0x04) len 4
        Handle range: 0x003c-0x003c
zephyr.exe[862144]: < HCI Command: Host Number of Completed Packets (0x03|0x0035) plen 5                           #159 13.477080
        Num handles: 1
        Handle: 147 Address: DF:A9:FF:F6:B1:1A (OUI DF-A9-FF)
        Count: 1
zephyr.exe[862144]: < ACL Data TX: Handle 147 [1/3] flags 0x00 dlen 10                                             #160 13.477187
      ATT: Find Information Response (0x05) len 5
        Format: UUID-16 (0x01)
        Handle: 0x003c
        UUID: Client Characteristic Configuration (0x2902)
> HCI Event: Number of Completed Packets (0x13) plen 5                                                             #161 13.770464
        Num handles: 1
        Handle: 147 Address: DF:A9:FF:F6:B1:1A (OUI DF-A9-FF)
        Count: 1
        Buffers: 0/3
        #160: len 10 (0 Kb/s)
        Latency: 293 msec (133-294 msec ~283 msec)
> ACL Data RX: Handle 147 flags 0x02 dlen 9                                                                        #162 13.770466
      ATT: Find Information Request (0x04) len 4
        Handle range: 0x003f-0x003f
zephyr.exe[862144]: < HCI Command: Host Number of Completed Packets (0x03|0x0035) plen 5                           #163 13.777022
        Num handles: 1
        Handle: 147 Address: DF:A9:FF:F6:B1:1A (OUI DF-A9-FF)
        Count: 1
zephyr.exe[862144]: < ACL Data TX: Handle 147 [1/3] flags 0x00 dlen 10                                             #164 13.777049
      ATT: Find Information Response (0x05) len 5
        Format: UUID-16 (0x01)
        Handle: 0x003f
        UUID: Client Characteristic Configuration (0x2902)
> HCI Event: Number of Completed Packets (0x13) plen 5                                                             #165 14.070257
        Num handles: 1
        Handle: 147 Address: DF:A9:FF:F6:B1:1A (OUI DF-A9-FF)
        Count: 1
        Buffers: 0/3
        #164: len 10 (0 Kb/s)
        Latency: 293 msec (133-294 msec ~288 msec)
> ACL Data RX: Handle 147 flags 0x02 dlen 9                                                                        #166 14.070452
      ATT: Find Information Request (0x04) len 4
        Handle range: 0x0042-0x0042
zephyr.exe[862144]: < HCI Command: Host Number of Completed Packets (0x03|0x0035) plen 5                           #167 14.077101
        Num handles: 1
        Handle: 147 Address: DF:A9:FF:F6:B1:1A (OUI DF-A9-FF)
        Count: 1
zephyr.exe[862144]: < ACL Data TX: Handle 147 [1/3] flags 0x00 dlen 10                                             #168 14.077106
      ATT: Find Information Response (0x05) len 5
        Format: UUID-16 (0x01)
        Handle: 0x0042
        UUID: Client Characteristic Configuration (0x2902)
> HCI Event: Number of Completed Packets (0x13) plen 5                                                             #169 14.370003
        Num handles: 1
        Handle: 147 Address: DF:A9:FF:F6:B1:1A (OUI DF-A9-FF)
        Count: 1
        Buffers: 0/3
        #168: len 10 (0 Kb/s)
        Latency: 292 msec (133-294 msec ~290 msec)
> ACL Data RX: Handle 147 flags 0x02 dlen 9                                                                        #170 14.370149
      ATT: Find Information Request (0x04) len 4
        Handle range: 0x0045-0x0045
zephyr.exe[862144]: < HCI Command: Host Number of Completed Packets (0x03|0x0035) plen 5                           #171 14.376999
        Num handles: 1
        Handle: 147 Address: DF:A9:FF:F6:B1:1A (OUI DF-A9-FF)
        Count: 1
zephyr.exe[862144]: < ACL Data TX: Handle 147 [1/3] flags 0x00 dlen 10                                             #172 14.377004
      ATT: Find Information Response (0x05) len 5
        Format: UUID-16 (0x01)
        Handle: 0x0045
        UUID: Client Characteristic Configuration (0x2902)
> HCI Event: Number of Completed Packets (0x13) plen 5                                                             #173 14.669803
        Num handles: 1
        Handle: 147 Address: DF:A9:FF:F6:B1:1A (OUI DF-A9-FF)
        Count: 1
        Buffers: 0/3
        #172: len 10 (0 Kb/s)
        Latency: 292 msec (133-294 msec ~291 msec)
> ACL Data RX: Handle 147 flags 0x02 dlen 9                                                                        #174 14.670317
      ATT: Find Information Request (0x04) len 4
        Handle range: 0x0048-0x0048
zephyr.exe[862144]: < HCI Command: Host Number of Completed Packets (0x03|0x0035) plen 5                           #175 14.677017
        Num handles: 1
        Handle: 147 Address: DF:A9:FF:F6:B1:1A (OUI DF-A9-FF)
        Count: 1
zephyr.exe[862144]: < ACL Data TX: Handle 147 [1/3] flags 0x00 dlen 10                                             #176 14.677024
      ATT: Find Information Response (0x05) len 5
        Format: UUID-16 (0x01)
        Handle: 0x0048
        UUID: Client Characteristic Configuration (0x2902)
> HCI Event: Number of Completed Packets (0x13) plen 5                                                             #177 14.969877
        Num handles: 1
        Handle: 147 Address: DF:A9:FF:F6:B1:1A (OUI DF-A9-FF)
        Count: 1
        Buffers: 0/3
        #176: len 10 (0 Kb/s)
        Latency: 292 msec (133-294 msec ~292 msec)
> ACL Data RX: Handle 147 flags 0x02 dlen 9                                                                        #178 14.970027
      ATT: Find Information Request (0x04) len 4
        Handle range: 0x004b-0x004b
zephyr.exe[862144]: < HCI Command: Host Number of Completed Packets (0x03|0x0035) plen 5                           #179 14.977080
        Num handles: 1
        Handle: 147 Address: DF:A9:FF:F6:B1:1A (OUI DF-A9-FF)
        Count: 1
zephyr.exe[862144]: < ACL Data TX: Handle 147 [1/3] flags 0x00 dlen 10                                             #180 14.977100
      ATT: Find Information Response (0x05) len 5
        Format: UUID-16 (0x01)
        Handle: 0x004b
        UUID: Client Characteristic Configuration (0x2902)
> HCI Event: Number of Completed Packets (0x13) plen 5                                                             #181 15.269928
        Num handles: 1
        Handle: 147 Address: DF:A9:FF:F6:B1:1A (OUI DF-A9-FF)
        Count: 1
        Buffers: 0/3
        #180: len 10 (0 Kb/s)
        Latency: 292 msec (133-294 msec ~292 msec)
> ACL Data RX: Handle 147 flags 0x02 dlen 13                                                                       #182 15.269945
      ATT: Find By Type Value Request (0x06) len 8
        Handle range: 0x0001-0xffff
        Attribute type: Primary Service (0x2800)
          UUID: Audio Stream Control (0x184e)
zephyr.exe[862144]: < HCI Command: Host Number of Completed Packets (0x03|0x0035) plen 5                           #183 15.277065
        Num handles: 1
        Handle: 147 Address: DF:A9:FF:F6:B1:1A (OUI DF-A9-FF)
        Count: 1
zephyr.exe[862144]: < ACL Data TX: Handle 147 [1/3] flags 0x00 dlen 9                                              #184 15.277089
      ATT: Find By Type Value Response (0x07) len 4
        Handle range: 0x004c-0x005b
> HCI Event: Number of Completed Packets (0x13) plen 5                                                             #185 15.570031
        Num handles: 1
        Handle: 147 Address: DF:A9:FF:F6:B1:1A (OUI DF-A9-FF)
        Count: 1
        Buffers: 0/3
        #184: len 9 (0 Kb/s)
        Latency: 292 msec (133-294 msec ~292 msec)
> ACL Data RX: Handle 147 flags 0x02 dlen 13                                                                       #186 15.570033
      ATT: Find By Type Value Request (0x06) len 8
        Handle range: 0x005c-0xffff
        Attribute type: Primary Service (0x2800)
          UUID: Audio Stream Control (0x184e)
zephyr.exe[862144]: < HCI Command: Host Number of Completed Packets (0x03|0x0035) plen 5                           #187 15.577097
        Num handles: 1
        Handle: 147 Address: DF:A9:FF:F6:B1:1A (OUI DF-A9-FF)
        Count: 1
zephyr.exe[862144]: < ACL Data TX: Handle 147 [1/3] flags 0x00 dlen 9                                              #188 15.577102
      ATT: Error Response (0x01) len 4
        Find By Type Value Request (0x06)
        Handle: 0x005c
        Error: Attribute Not Found (0x0a)
> HCI Event: Number of Completed Packets (0x13) plen 5                                                             #189 15.870015
        Num handles: 1
        Handle: 147 Address: DF:A9:FF:F6:B1:1A (OUI DF-A9-FF)
        Count: 1
        Buffers: 0/3
        #188: len 9 (0 Kb/s)
        Latency: 292 msec (133-294 msec ~292 msec)
> ACL Data RX: Handle 147 flags 0x02 dlen 11                                                                       #190 15.870039
      ATT: Read By Type Request (0x08) len 6
        Handle range: 0x004c-0x005b
        Attribute type: Characteristic (0x2803)
zephyr.exe[862144]: < HCI Command: Host Number of Completed Packets (0x03|0x0035) plen 5                           #191 15.877054
        Num handles: 1
        Handle: 147 Address: DF:A9:FF:F6:B1:1A (OUI DF-A9-FF)
        Count: 1
zephyr.exe[862144]: < ACL Data TX: Handle 147 [1/3] flags 0x00 dlen 27                                             #192 15.877068
zephyr.exe[862144]: < ACL Data TX: Handle 147 flags 0x01 dlen 14                                                   #193 15.877072
      ATT: Read By Type Response (0x09) len 36
        Attribute data length: 7
        Attribute data list: 5 entries
        Handle: 0x004d
        Value[5]: 1c4e00c62b
            Properties: 0x1c
              Write Without Response (0x04)
              Write (0x08)
              Notify (0x10)
            Value Handle: 0x004e
            Value UUID: ASE Control Point (0x2bc6)
        Handle: 0x0050
        Value[5]: 125100c42b
            Properties: 0x12
              Read (0x02)
              Notify (0x10)
            Value Handle: 0x0051
            Value UUID: Sink ASE (0x2bc4)
        Handle: 0x0053
        Value[5]: 125400c42b
            Properties: 0x12
              Read (0x02)
              Notify (0x10)
            Value Handle: 0x0054
            Value UUID: Sink ASE (0x2bc4)
        Handle: 0x0056
        Value[5]: 125700c52b
            Properties: 0x12
              Read (0x02)
              Notify (0x10)
            Value Handle: 0x0057
            Value UUID: Source ASE (0x2bc5)
        Handle: 0x0059
        Value[5]: 125a00c52b
            Properties: 0x12
              Read (0x02)
              Notify (0x10)
            Value Handle: 0x005a
            Value UUID: Source ASE (0x2bc5)
> HCI Event: Number of Completed Packets (0x13) plen 5                                                             #194 16.020156
        Num handles: 1
        Handle: 147 Address: DF:A9:FF:F6:B1:1A (OUI DF-A9-FF)
        Count: 1
        Buffers: 0/3
        #192: len 27 (1 Kb/s)
        Latency: 143 msec (133-294 msec ~217 msec)
> HCI Event: Number of Completed Packets (0x13) plen 5                                                             #195 16.169962
        Num handles: 1
        Handle: 147 Address: DF:A9:FF:F6:B1:1A (OUI DF-A9-FF)
        Count: 1
        Buffers: underflow/3
        #193: len 14 (0 Kb/s)
        Latency: 292 msec (133-294 msec ~255 msec)
> ACL Data RX: Handle 147 flags 0x02 dlen 11                                                                       #196 16.169974
      ATT: Read By Type Request (0x08) len 6
        Handle range: 0x005a-0x005b
        Attribute type: Characteristic (0x2803)
zephyr.exe[862144]: < HCI Command: Host Number of Completed Packets (0x03|0x0035) plen 5                           #197 16.176993
        Num handles: 1
        Handle: 147 Address: DF:A9:FF:F6:B1:1A (OUI DF-A9-FF)
        Count: 1
zephyr.exe[862144]: < ACL Data TX: Handle 147 [1/3] flags 0x00 dlen 9                                              #198 16.177008
      ATT: Error Response (0x01) len 4
        Read By Type Request (0x08)
        Handle: 0x005a
        Error: Attribute Not Found (0x0a)
> HCI Event: Number of Completed Packets (0x13) plen 5                                                             #199 16.469884
        Num handles: 1
        Handle: 147 Address: DF:A9:FF:F6:B1:1A (OUI DF-A9-FF)
        Count: 1
        Buffers: 0/3
        #198: len 9 (0 Kb/s)
        Latency: 292 msec (133-294 msec ~274 msec)
> ACL Data RX: Handle 147 flags 0x02 dlen 9                                                                        #200 16.469929
      ATT: Find Information Request (0x04) len 4
        Handle range: 0x004f-0x004f
zephyr.exe[862144]: < HCI Command: Host Number of Completed Packets (0x03|0x0035) plen 5                           #201 16.477092
        Num handles: 1
        Handle: 147 Address: DF:A9:FF:F6:B1:1A (OUI DF-A9-FF)
        Count: 1
zephyr.exe[862144]: < ACL Data TX: Handle 147 [1/3] flags 0x00 dlen 10                                             #202 16.477097
      ATT: Find Information Response (0x05) len 5
        Format: UUID-16 (0x01)
        Handle: 0x004f
        UUID: Client Characteristic Configuration (0x2902)
> HCI Event: Number of Completed Packets (0x13) plen 5                                                             #203 16.769764
        Num handles: 1
        Handle: 147 Address: DF:A9:FF:F6:B1:1A (OUI DF-A9-FF)
        Count: 1
        Buffers: 0/3
        #202: len 10 (0 Kb/s)
        Latency: 292 msec (133-294 msec ~283 msec)
> ACL Data RX: Handle 147 flags 0x02 dlen 9                                                                        #204 16.769953
      ATT: Find Information Request (0x04) len 4
        Handle range: 0x0052-0x0052
zephyr.exe[862144]: < HCI Command: Host Number of Completed Packets (0x03|0x0035) plen 5                           #205 16.777046
        Num handles: 1
        Handle: 147 Address: DF:A9:FF:F6:B1:1A (OUI DF-A9-FF)
        Count: 1
zephyr.exe[862144]: < ACL Data TX: Handle 147 [1/3] flags 0x00 dlen 10                                             #206 16.777092
      ATT: Find Information Response (0x05) len 5
        Format: UUID-16 (0x01)
        Handle: 0x0052
        UUID: Client Characteristic Configuration (0x2902)
> HCI Event: Number of Completed Packets (0x13) plen 5                                                             #207 17.069836
        Num handles: 1
        Handle: 147 Address: DF:A9:FF:F6:B1:1A (OUI DF-A9-FF)
        Count: 1
        Buffers: 0/3
        #206: len 10 (0 Kb/s)
        Latency: 292 msec (133-294 msec ~288 msec)
> ACL Data RX: Handle 147 flags 0x02 dlen 9                                                                        #208 17.069902
      ATT: Find Information Request (0x04) len 4
        Handle range: 0x0055-0x0055
zephyr.exe[862144]: < HCI Command: Host Number of Completed Packets (0x03|0x0035) plen 5                           #209 17.077032
        Num handles: 1
        Handle: 147 Address: DF:A9:FF:F6:B1:1A (OUI DF-A9-FF)
        Count: 1
zephyr.exe[862144]: < ACL Data TX: Handle 147 [1/3] flags 0x00 dlen 10                                             #210 17.077038
      ATT: Find Information Response (0x05) len 5
        Format: UUID-16 (0x01)
        Handle: 0x0055
        UUID: Client Characteristic Configuration (0x2902)
> HCI Event: Number of Completed Packets (0x13) plen 5                                                             #211 17.369873
        Num handles: 1
        Handle: 147 Address: DF:A9:FF:F6:B1:1A (OUI DF-A9-FF)
        Count: 1
        Buffers: 0/3
        #210: len 10 (0 Kb/s)
        Latency: 292 msec (133-294 msec ~290 msec)
> ACL Data RX: Handle 147 flags 0x02 dlen 9                                                                        #212 17.369875
      ATT: Find Information Request (0x04) len 4
        Handle range: 0x0058-0x0058
zephyr.exe[862144]: < HCI Command: Host Number of Completed Packets (0x03|0x0035) plen 5                           #213 17.377061
        Num handles: 1
        Handle: 147 Address: DF:A9:FF:F6:B1:1A (OUI DF-A9-FF)
        Count: 1
zephyr.exe[862144]: < ACL Data TX: Handle 147 [1/3] flags 0x00 dlen 10                                             #214 17.377143
      ATT: Find Information Response (0x05) len 5
        Format: UUID-16 (0x01)
        Handle: 0x0058
        UUID: Client Characteristic Configuration (0x2902)
> HCI Event: Number of Completed Packets (0x13) plen 5                                                             #215 17.669996
        Num handles: 1
        Handle: 147 Address: DF:A9:FF:F6:B1:1A (OUI DF-A9-FF)
        Count: 1
        Buffers: 0/3
        #214: len 10 (0 Kb/s)
        Latency: 292 msec (133-294 msec ~291 msec)
> ACL Data RX: Handle 147 flags 0x02 dlen 9                                                                        #216 17.670001
      ATT: Find Information Request (0x04) len 4
        Handle range: 0x005b-0x005b
zephyr.exe[862144]: < HCI Command: Host Number of Completed Packets (0x03|0x0035) plen 5                           #217 17.677109
        Num handles: 1
        Handle: 147 Address: DF:A9:FF:F6:B1:1A (OUI DF-A9-FF)
        Count: 1
zephyr.exe[862144]: < ACL Data TX: Handle 147 [1/3] flags 0x00 dlen 10                                             #218 17.677177
      ATT: Find Information Response (0x05) len 5
        Format: UUID-16 (0x01)
        Handle: 0x005b
        UUID: Client Characteristic Configuration (0x2902)
> HCI Event: Number of Completed Packets (0x13) plen 5                                                             #219 17.969988
        Num handles: 1
        Handle: 147 Address: DF:A9:FF:F6:B1:1A (OUI DF-A9-FF)
        Count: 1
        Buffers: 0/3
        #218: len 10 (0 Kb/s)
        Latency: 292 msec (133-294 msec ~292 msec)
> ACL Data RX: Handle 147 flags 0x02 dlen 9                                                                        #220 17.969991
      ATT: Write Request (0x12) len 4
        Handle: 0x0048
          Data[2]: 0000
zephyr.exe[862144]: < HCI Command: Host Number of Completed Packets (0x03|0x0035) plen 5                           #221 17.977114
        Num handles: 1
        Handle: 147 Address: DF:A9:FF:F6:B1:1A (OUI DF-A9-FF)
        Count: 1
zephyr.exe[862144]: < ACL Data TX: Handle 147 [1/3] flags 0x00 dlen 5                                              #222 17.977166
      ATT: Write Response (0x13) len 0
> HCI Event: Number of Completed Packets (0x13) plen 5                                                             #223 18.269945
        Num handles: 1
        Handle: 147 Address: DF:A9:FF:F6:B1:1A (OUI DF-A9-FF)
        Count: 1
        Buffers: 0/3
        #222: len 5 (0 Kb/s)
        Latency: 292 msec (133-294 msec ~292 msec)
> ACL Data RX: Handle 147 flags 0x02 dlen 9                                                                        #224 18.269947
      ATT: Write Request (0x12) len 4
        Handle: 0x0048
          Data[2]: 0100
zephyr.exe[862144]: < HCI Command: Host Number of Completed Packets (0x03|0x0035) plen 5                           #225 18.277117
        Num handles: 1
        Handle: 147 Address: DF:A9:FF:F6:B1:1A (OUI DF-A9-FF)
        Count: 1
zephyr.exe[862144]: < ACL Data TX: Handle 147 [1/3] flags 0x00 dlen 5                                              #226 18.277190
      ATT: Write Response (0x13) len 0
> HCI Event: Number of Completed Packets (0x13) plen 5                                                             #227 18.570029
        Num handles: 1
        Handle: 147 Address: DF:A9:FF:F6:B1:1A (OUI DF-A9-FF)
        Count: 1
        Buffers: 0/3
        #226: len 5 (0 Kb/s)
        Latency: 292 msec (133-294 msec ~292 msec)
> ACL Data RX: Handle 147 flags 0x02 dlen 9                                                                        #228 18.570435
      ATT: Write Request (0x12) len 4
        Handle: 0x004f
          Data[2]: 0000
zephyr.exe[862144]: < HCI Command: Host Number of Completed Packets (0x03|0x0035) plen 5                           #229 18.577090
        Num handles: 1
        Handle: 147 Address: DF:A9:FF:F6:B1:1A (OUI DF-A9-FF)
        Count: 1
zephyr.exe[862144]: < ACL Data TX: Handle 147 [1/3] flags 0x00 dlen 5                                              #230 18.577095
      ATT: Write Response (0x13) len 0
> HCI Event: Number of Completed Packets (0x13) plen 5                                                             #231 18.869901
        Num handles: 1
        Handle: 147 Address: DF:A9:FF:F6:B1:1A (OUI DF-A9-FF)
        Count: 1
        Buffers: 0/3
        #230: len 5 (0 Kb/s)
        Latency: 292 msec (133-294 msec ~292 msec)
> ACL Data RX: Handle 147 flags 0x02 dlen 9                                                                        #232 18.870417
      ATT: Write Request (0x12) len 4
        Handle: 0x004f
          Data[2]: 0100
zephyr.exe[862144]: < HCI Command: Host Number of Completed Packets (0x03|0x0035) plen 5                           #233 18.877187
        Num handles: 1
        Handle: 147 Address: DF:A9:FF:F6:B1:1A (OUI DF-A9-FF)
        Count: 1
zephyr.exe[862144]: < ACL Data TX: Handle 147 [1/3] flags 0x00 dlen 5                                              #234 18.877210
      ATT: Write Response (0x13) len 0
> HCI Event: Number of Completed Packets (0x13) plen 5                                                             #235 19.169767
        Num handles: 1
        Handle: 147 Address: DF:A9:FF:F6:B1:1A (OUI DF-A9-FF)
        Count: 1
        Buffers: 0/3
        #234: len 5 (0 Kb/s)
        Latency: 292 msec (133-294 msec ~292 msec)
> ACL Data RX: Handle 147 flags 0x02 dlen 9                                                                        #236 19.170022
      ATT: Write Request (0x12) len 4
        Handle: 0x0052
          Data[2]: 0000
zephyr.exe[862144]: < HCI Command: Host Number of Completed Packets (0x03|0x0035) plen 5                           #237 19.177117
        Num handles: 1
        Handle: 147 Address: DF:A9:FF:F6:B1:1A (OUI DF-A9-FF)
        Count: 1
zephyr.exe[862144]: < ACL Data TX: Handle 147 [1/3] flags 0x00 dlen 5                                              #238 19.177158
      ATT: Write Response (0x13) len 0
> HCI Event: Number of Completed Packets (0x13) plen 5                                                             #239 19.469899
        Num handles: 1
        Handle: 147 Address: DF:A9:FF:F6:B1:1A (OUI DF-A9-FF)
        Count: 1
        Buffers: 0/3
        #238: len 5 (0 Kb/s)
        Latency: 292 msec (133-294 msec ~292 msec)
> ACL Data RX: Handle 147 flags 0x02 dlen 9                                                                        #240 19.469902
      ATT: Write Request (0x12) len 4
        Handle: 0x0052
          Data[2]: 0100
zephyr.exe[862144]: < HCI Command: Host Number of Completed Packets (0x03|0x0035) plen 5                           #241 19.477138
        Num handles: 1
        Handle: 147 Address: DF:A9:FF:F6:B1:1A (OUI DF-A9-FF)
        Count: 1
zephyr.exe[862144]: < ACL Data TX: Handle 147 [1/3] flags 0x00 dlen 5                                              #242 19.477203
      ATT: Write Response (0x13) len 0
> HCI Event: Number of Completed Packets (0x13) plen 5                                                             #243 19.769807
        Num handles: 1
        Handle: 147 Address: DF:A9:FF:F6:B1:1A (OUI DF-A9-FF)
        Count: 1
        Buffers: 0/3
        #242: len 5 (0 Kb/s)
        Latency: 292 msec (133-294 msec ~292 msec)
> ACL Data RX: Handle 147 flags 0x02 dlen 9                                                                        #244 19.769872
      ATT: Write Request (0x12) len 4
        Handle: 0x0055
          Data[2]: 0000
zephyr.exe[862144]: < HCI Command: Host Number of Completed Packets (0x03|0x0035) plen 5                           #245 19.777142
        Num handles: 1
        Handle: 147 Address: DF:A9:FF:F6:B1:1A (OUI DF-A9-FF)
        Count: 1
zephyr.exe[862144]: < ACL Data TX: Handle 147 [1/3] flags 0x00 dlen 5                                              #246 19.777148
      ATT: Write Response (0x13) len 0
> HCI Event: Number of Completed Packets (0x13) plen 5                                                             #247 20.069738
        Num handles: 1
        Handle: 147 Address: DF:A9:FF:F6:B1:1A (OUI DF-A9-FF)
        Count: 1
        Buffers: 0/3
        #246: len 5 (0 Kb/s)
        Latency: 292 msec (133-294 msec ~292 msec)
> ACL Data RX: Handle 147 flags 0x02 dlen 9                                                                        #248 20.069819
      ATT: Write Request (0x12) len 4
        Handle: 0x0055
          Data[2]: 0100
zephyr.exe[862144]: < HCI Command: Host Number of Completed Packets (0x03|0x0035) plen 5                           #249 20.077192
        Num handles: 1
        Handle: 147 Address: DF:A9:FF:F6:B1:1A (OUI DF-A9-FF)
        Count: 1
zephyr.exe[862144]: < ACL Data TX: Handle 147 [1/3] flags 0x00 dlen 5                                              #250 20.077197
      ATT: Write Response (0x13) len 0
> HCI Event: Number of Completed Packets (0x13) plen 5                                                             #251 20.369861
        Num handles: 1
        Handle: 147 Address: DF:A9:FF:F6:B1:1A (OUI DF-A9-FF)
        Count: 1
        Buffers: 0/3
        #250: len 5 (0 Kb/s)
        Latency: 292 msec (133-294 msec ~292 msec)
> ACL Data RX: Handle 147 flags 0x02 dlen 9                                                                        #252 20.370193
      ATT: Write Request (0x12) len 4
        Handle: 0x0058
          Data[2]: 0000
zephyr.exe[862144]: < HCI Command: Host Number of Completed Packets (0x03|0x0035) plen 5                           #253 20.377075
        Num handles: 1
        Handle: 147 Address: DF:A9:FF:F6:B1:1A (OUI DF-A9-FF)
        Count: 1
zephyr.exe[862144]: < ACL Data TX: Handle 147 [1/3] flags 0x00 dlen 5                                              #254 20.377185
      ATT: Write Response (0x13) len 0
> HCI Event: Number of Completed Packets (0x13) plen 5                                                             #255 20.669682
        Num handles: 1
        Handle: 147 Address: DF:A9:FF:F6:B1:1A (OUI DF-A9-FF)
        Count: 1
        Buffers: 0/3
        #254: len 5 (0 Kb/s)
        Latency: 292 msec (133-294 msec ~292 msec)
> ACL Data RX: Handle 147 flags 0x02 dlen 9                                                                        #256 20.669815
      ATT: Write Request (0x12) len 4
        Handle: 0x0058
          Data[2]: 0100
zephyr.exe[862144]: < HCI Command: Host Number of Completed Packets (0x03|0x0035) plen 5                           #257 20.677235
        Num handles: 1
        Handle: 147 Address: DF:A9:FF:F6:B1:1A (OUI DF-A9-FF)
        Count: 1
zephyr.exe[862144]: < ACL Data TX: Handle 147 [1/3] flags 0x00 dlen 5                                              #258 20.677242
      ATT: Write Response (0x13) len 0
> HCI Event: Number of Completed Packets (0x13) plen 5                                                             #259 20.969674
        Num handles: 1
        Handle: 147 Address: DF:A9:FF:F6:B1:1A (OUI DF-A9-FF)
        Count: 1
        Buffers: 0/3
        #258: len 5 (0 Kb/s)
        Latency: 292 msec (133-294 msec ~292 msec)
> ACL Data RX: Handle 147 flags 0x02 dlen 9                                                                        #260 20.969919
      ATT: Write Request (0x12) len 4
        Handle: 0x005b
          Data[2]: 0000
zephyr.exe[862144]: < HCI Command: Host Number of Completed Packets (0x03|0x0035) plen 5                           #261 20.977178
        Num handles: 1
        Handle: 147 Address: DF:A9:FF:F6:B1:1A (OUI DF-A9-FF)
        Count: 1
zephyr.exe[862144]: < ACL Data TX: Handle 147 [1/3] flags 0x00 dlen 5                                              #262 20.977204
      ATT: Write Response (0x13) len 0
> HCI Event: Number of Completed Packets (0x13) plen 5                                                             #263 21.269966
        Num handles: 1
        Handle: 147 Address: DF:A9:FF:F6:B1:1A (OUI DF-A9-FF)
        Count: 1
        Buffers: 0/3
        #262: len 5 (0 Kb/s)
        Latency: 292 msec (133-294 msec ~292 msec)
> ACL Data RX: Handle 147 flags 0x02 dlen 9                                                                        #264 21.270014
      ATT: Write Request (0x12) len 4
        Handle: 0x005b
          Data[2]: 0100
zephyr.exe[862144]: < HCI Command: Host Number of Completed Packets (0x03|0x0035) plen 5                           #265 21.277042
        Num handles: 1
        Handle: 147 Address: DF:A9:FF:F6:B1:1A (OUI DF-A9-FF)
        Count: 1
zephyr.exe[862144]: < ACL Data TX: Handle 147 [1/3] flags 0x00 dlen 5                                              #266 21.277047
      ATT: Write Response (0x13) len 0
> HCI Event: Number of Completed Packets (0x13) plen 5                                                             #267 21.569668
        Num handles: 1
        Handle: 147 Address: DF:A9:FF:F6:B1:1A (OUI DF-A9-FF)
        Count: 1
        Buffers: 0/3
        #266: len 5 (0 Kb/s)
        Latency: 292 msec (133-294 msec ~292 msec)
> ACL Data RX: Handle 147 flags 0x02 dlen 7                                                                        #268 21.569788
      ATT: Read Request (0x0a) len 2
        Handle: 0x0051
zephyr.exe[862144]: < HCI Command: Host Number of Completed Packets (0x03|0x0035) plen 5                           #269 21.577233
        Num handles: 1
        Handle: 147 Address: DF:A9:FF:F6:B1:1A (OUI DF-A9-FF)
        Count: 1
zephyr.exe[862144]: < ACL Data TX: Handle 147 [1/3] flags 0x00 dlen 7                                              #270 21.577286
      ATT: Read Response (0x0b) len 2
        Value[2]: 0100
> HCI Event: Number of Completed Packets (0x13) plen 5                                                             #271 21.869574
        Num handles: 1
        Handle: 147 Address: DF:A9:FF:F6:B1:1A (OUI DF-A9-FF)
        Count: 1
        Buffers: 0/3
        #270: len 7 (0 Kb/s)
        Latency: 292 msec (133-294 msec ~292 msec)
> ACL Data RX: Handle 147 flags 0x02 dlen 7                                                                        #272 21.869872
      ATT: Read Request (0x0a) len 2
        Handle: 0x0054
zephyr.exe[862144]: < HCI Command: Host Number of Completed Packets (0x03|0x0035) plen 5                           #273 21.877110
        Num handles: 1
        Handle: 147 Address: DF:A9:FF:F6:B1:1A (OUI DF-A9-FF)
        Count: 1
zephyr.exe[862144]: < ACL Data TX: Handle 147 [1/3] flags 0x00 dlen 7                                              #274 21.877136
      ATT: Read Response (0x0b) len 2
        Value[2]: 0200
> HCI Event: Number of Completed Packets (0x13) plen 5                                                             #275 22.169805
        Num handles: 1
        Handle: 147 Address: DF:A9:FF:F6:B1:1A (OUI DF-A9-FF)
        Count: 1
        Buffers: 0/3
        #274: len 7 (0 Kb/s)
        Latency: 292 msec (133-294 msec ~292 msec)
> ACL Data RX: Handle 147 flags 0x02 dlen 7                                                                        #276 22.169958
      ATT: Read Request (0x0a) len 2
        Handle: 0x0057
zephyr.exe[862144]: < HCI Command: Host Number of Completed Packets (0x03|0x0035) plen 5                           #277 22.177207
        Num handles: 1
        Handle: 147 Address: DF:A9:FF:F6:B1:1A (OUI DF-A9-FF)
        Count: 1
zephyr.exe[862144]: < ACL Data TX: Handle 147 [1/3] flags 0x00 dlen 7                                              #278 22.177275
      ATT: Read Response (0x0b) len 2
        Value[2]: 0300
> HCI Event: Number of Completed Packets (0x13) plen 5                                                             #279 22.469545
        Num handles: 1
        Handle: 147 Address: DF:A9:FF:F6:B1:1A (OUI DF-A9-FF)
        Count: 1
        Buffers: 0/3
        #278: len 7 (0 Kb/s)
        Latency: 292 msec (133-294 msec ~292 msec)
> ACL Data RX: Handle 147 flags 0x02 dlen 7                                                                        #280 22.469810
      ATT: Read Request (0x0a) len 2
        Handle: 0x005a
zephyr.exe[862144]: < HCI Command: Host Number of Completed Packets (0x03|0x0035) plen 5                           #281 22.477124
        Num handles: 1
        Handle: 147 Address: DF:A9:FF:F6:B1:1A (OUI DF-A9-FF)
        Count: 1
zephyr.exe[862144]: < ACL Data TX: Handle 147 [1/3] flags 0x00 dlen 7                                              #282 22.477192
      ATT: Read Response (0x0b) len 2
        Value[2]: 0400
> HCI Event: Number of Completed Packets (0x13) plen 5                                                             #283 22.769730
        Num handles: 1
        Handle: 147 Address: DF:A9:FF:F6:B1:1A (OUI DF-A9-FF)
        Count: 1
        Buffers: 0/3
        #282: len 7 (0 Kb/s)
        Latency: 292 msec (133-294 msec ~292 msec)
> ACL Data RX: Handle 147 flags 0x02 dlen 7                                                                        #284 22.769732
      ATT: Read Request (0x0a) len 2
        Handle: 0x003e
zephyr.exe[862144]: < HCI Command: Host Number of Completed Packets (0x03|0x0035) plen 5                           #285 22.777125
        Num handles: 1
        Handle: 147 Address: DF:A9:FF:F6:B1:1A (OUI DF-A9-FF)
        Count: 1
zephyr.exe[862144]: < ACL Data TX: Handle 147 [1/3] flags 0x00 dlen 9                                              #286 22.777195
      ATT: Read Response (0x0b) len 4
        Value[4]: 01000000
> HCI Event: Number of Completed Packets (0x13) plen 5                                                             #287 23.069580
        Num handles: 1
        Handle: 147 Address: DF:A9:FF:F6:B1:1A (OUI DF-A9-FF)
        Count: 1
        Buffers: 0/3
        #286: len 9 (0 Kb/s)
        Latency: 292 msec (133-294 msec ~292 msec)
> ACL Data RX: Handle 147 flags 0x02 dlen 7                                                                        #288 23.069702
      ATT: Read Request (0x0a) len 2
        Handle: 0x003b
zephyr.exe[862144]: < HCI Command: Host Number of Completed Packets (0x03|0x0035) plen 5                           #289 23.077132
        Num handles: 1
        Handle: 147 Address: DF:A9:FF:F6:B1:1A (OUI DF-A9-FF)
        Count: 1
zephyr.exe[862144]: < ACL Data TX: Handle 147 [1/3] flags 0x00 dlen 27                                             #290 23.077189
zephyr.exe[862144]: < ACL Data TX: Handle 147 flags 0x01 dlen 27                                                   #291 23.077191
zephyr.exe[862144]: < ACL Data TX: Handle 147 flags 0x01 dlen 12                                                   #292 23.077191
      ATT: Read Response (0x0b) len 61
        Value[61]: 020600000000130301ff1f02020302030305041a009b00020501040301ff0fffffffffff130301ff1f02020302030305041a009b00020501040301ff0f
> HCI Event: Number of Completed Packets (0x13) plen 5                                                             #293 23.369682
        Num handles: 1
        Handle: 147 Address: DF:A9:FF:F6:B1:1A (OUI DF-A9-FF)
        Count: 1
        Buffers: 0/3
        #290: len 27 (0 Kb/s)
        Latency: 292 msec (133-294 msec ~292 msec)
> HCI Event: Number of Completed Packets (0x13) plen 5                                                             #294 23.370047
        Num handles: 1
        Handle: 147 Address: DF:A9:FF:F6:B1:1A (OUI DF-A9-FF)
        Count: 1
        Buffers: underflow/3
        #291: len 27 (0 Kb/s)
        Latency: 292 msec (133-294 msec ~292 msec)
> HCI Event: Number of Completed Packets (0x13) plen 5                                                             #295 23.519675
        Num handles: 1
        Handle: 147 Address: DF:A9:FF:F6:B1:1A (OUI DF-A9-FF)
        Count: 1
        Buffers: underflow/3
        #292: len 12 (0 Kb/s)
        Latency: 442 msec (133-442 msec ~367 msec)
> ACL Data RX: Handle 147 flags 0x02 dlen 7                                                                        #296 23.519677
      ATT: Read Request (0x0a) len 2
        Handle: 0x0044
zephyr.exe[862144]: < HCI Command: Host Number of Completed Packets (0x03|0x0035) plen 5                           #297 23.537174
        Num handles: 1
        Handle: 147 Address: DF:A9:FF:F6:B1:1A (OUI DF-A9-FF)
        Count: 1
zephyr.exe[862144]: < ACL Data TX: Handle 147 [1/3] flags 0x00 dlen 9                                              #298 23.537224
      ATT: Read Response (0x0b) len 4
        Value[4]: 03000000
> HCI Event: Number of Completed Packets (0x13) plen 5                                                             #299 23.819648
        Num handles: 1
        Handle: 147 Address: DF:A9:FF:F6:B1:1A (OUI DF-A9-FF)
        Count: 1
        Buffers: 0/3
        #298: len 9 (0 Kb/s)
        Latency: 282 msec (133-442 msec ~324 msec)
> ACL Data RX: Handle 147 flags 0x02 dlen 7                                                                        #300 23.819749
      ATT: Read Request (0x0a) len 2
        Handle: 0x0041
zephyr.exe[862144]: < HCI Command: Host Number of Completed Packets (0x03|0x0035) plen 5                           #301 23.837236
        Num handles: 1
        Handle: 147 Address: DF:A9:FF:F6:B1:1A (OUI DF-A9-FF)
        Count: 1
zephyr.exe[862144]: < ACL Data TX: Handle 147 [1/3] flags 0x00 dlen 27                                             #302 23.837263
zephyr.exe[862144]: < ACL Data TX: Handle 147 flags 0x01 dlen 27                                                   #303 23.837265
zephyr.exe[862144]: < ACL Data TX: Handle 147 flags 0x01 dlen 12                                                   #304 23.837266
      ATT: Read Response (0x0b) len 61
        Value[61]: 020600000000130301ff1f02020302030305041a009b00020501040301ff0fffffffffff130301ff1f02020302030305041a009b00020501040301ff0f
> HCI Event: Number of Completed Packets (0x13) plen 5                                                             #305 23.970037
        Num handles: 1
        Handle: 147 Address: DF:A9:FF:F6:B1:1A (OUI DF-A9-FF)
        Count: 1
        Buffers: 0/3
        #302: len 27 (1 Kb/s)
        Latency: 132 msec (132-442 msec ~228 mse