Bluetooth monitor ver 5.84
btmon[1714907]: = Note: Linux version 6.8.0-83-generic (x86_64)                                                          0.942347
btmon[1714907]: = Note: Bluetooth subsystem version 2.22                                                                 0.942348
= New Index: 00:00:00:00:00:00 (Primary,UART,hci0)                                                                       0.942349
= Open Index: 00:00:00:00:00:00                                                                                          0.946608
= Index Info: 00:00:00:00:00:00 (Nordic Semiconductor ASA)                                                               0.946778
zephyr.exe[1714909]: @ USER Open: main (privileged) version 2.22                                                {0x0001} 0.946814
zephyr.exe[1714909]: < HCI Command: Reset (0x03|0x0003) plen 0                                                        #1 0.948561
> HCI Event: Command Complete (0x0e) plen 4                                                                           #2 0.949729
      Reset (0x03|0x0003) ncmd 1
        Status: Success (0x00)
zephyr.exe[1714909]: < HCI Command: Read Local Supported Features (0x04|0x0003) plen 0                                #3 0.966589
> HCI Event: Command Complete (0x0e) plen 12                                                                          #4 0.968199
      Read Local Supported Features (0x04|0x0003) ncmd 1
        Status: Success (0x00)
        Features: 0x00 0x00 0x00 0x00 0x60 0x00 0x00 0x00
          BR/EDR Not Supported
          LE Supported (Controller)
zephyr.exe[1714909]: < HCI Command: Read Local Version Information (0x04|0x0001) plen 0                               #5 0.986586
> HCI Event: Command Complete (0x0e) plen 12                                                                          #6 0.987862
      Read Local Version Information (0x04|0x0001) ncmd 1
        Status: Success (0x00)
        HCI version: Reserved (0x0e) - Revision 12520 (0x30e8)
        LMP version: Reserved (0x0e) - Subversion 12520 (0x30e8)
        Manufacturer: Nordic Semiconductor ASA (89)
zephyr.exe[1714909]: < HCI Command: Read Local Supported Commands (0x04|0x0002) plen 0                                #7 1.006553
> HCI Event: Command Complete (0x0e) plen 68                                                                          #8 1.008216
      Read Local Supported Commands (0x04|0x0002) ncmd 1
        Status: Success (0x00)
        Commands: 119 entries
          Disconnect (Octet 0 - Bit 5)
          Read Remote Version Information (Octet 2 - Bit 7)
          Set Event Mask (Octet 5 - Bit 6)
          Reset (Octet 5 - Bit 7)
          Read Connection Accept Timeout (Octet 7 - Bit 2)
          Write Connection Accept Timeout (Octet 7 - Bit 3)
          Read Transmit Power Level (Octet 10 - Bit 2)
          Set Controller To Host Flow Control (Octet 10 - Bit 5)
          Host Buffer Size (Octet 10 - Bit 6)
          Host Number of Completed Packets (Octet 10 - Bit 7)
          Read Local Version Information (Octet 14 - Bit 3)
          Read Local Supported Features (Octet 14 - Bit 5)
          Read BD ADDR (Octet 15 - Bit 1)
          Read RSSI (Octet 15 - Bit 5)
          Set Event Mask Page 2 (Octet 22 - Bit 2)
          LE Set Event Mask (Octet 25 - Bit 0)
          LE Read Buffer Size (Octet 25 - Bit 1)
          LE Read Local Supported Features (Octet 25 - Bit 2)
          LE Set Random Address (Octet 25 - Bit 4)
          LE Set Advertising Parameters (Octet 25 - Bit 5)
          LE Read Advertising Channel TX Power (Octet 25 - Bit 6)
          LE Set Advertising Data (Octet 25 - Bit 7)
          LE Set Scan Response Data (Octet 26 - Bit 0)
          LE Set Advertise Enable (Octet 26 - Bit 1)
          LE Set Scan Parameters (Octet 26 - Bit 2)
          LE Set Scan Enable (Octet 26 - Bit 3)
          LE Create Connection (Octet 26 - Bit 4)
          LE Create Connection Cancel (Octet 26 - Bit 5)
          LE Read Accept List Size (Octet 26 - Bit 6)
          LE Clear Accept List (Octet 26 - Bit 7)
          LE Add Device To Accept List (Octet 27 - Bit 0)
          LE Remove Device From Accept List (Octet 27 - Bit 1)
          LE Connection Update (Octet 27 - Bit 2)
          LE Set Host Channel Classification (Octet 27 - Bit 3)
          LE Read Channel Map (Octet 27 - Bit 4)
          LE Read Remote Used Features (Octet 27 - Bit 5)
          LE Encrypt (Octet 27 - Bit 6)
          LE Rand (Octet 27 - Bit 7)
          LE Start Encryption (Octet 28 - Bit 0)
          LE Long Term Key Request Reply (Octet 28 - Bit 1)
          LE Long Term Key Request Neg Reply (Octet 28 - Bit 2)
          LE Read Supported States (Octet 28 - Bit 3)
          LE Receiver Test (Octet 28 - Bit 4)
          LE Transmitter Test (Octet 28 - Bit 5)
          LE Test End (Octet 28 - Bit 6)
          Read Authenticated Payload Timeout (Octet 32 - Bit 4)
          Write Authenticated Payload Timeout (Octet 32 - Bit 5)
          LE Set Data Length (Octet 33 - Bit 6)
          LE Read Suggested Default Data Length (Octet 33 - Bit 7)
          LE Write Suggested Default Data Length (Octet 34 - Bit 0)
          LE Add Device To Resolving List (Octet 34 - Bit 3)
          LE Remove Device From Resolving List (Octet 34 - Bit 4)
          LE Clear Resolving List (Octet 34 - Bit 5)
          LE Read Resolving List Size (Octet 34 - Bit 6)
          LE Set Address Resolution Enable (Octet 35 - Bit 1)
          LE Set Resolvable Private Address Timeout (Octet 35 - Bit 2)
          LE Read Maximum Data Length (Octet 35 - Bit 3)
          LE Read PHY (Octet 35 - Bit 4)
          LE Set Default PHY (Octet 35 - Bit 5)
          LE Set PHY (Octet 35 - Bit 6)
          LE Enhanced Receiver Test (Octet 35 - Bit 7)
          LE Enhanced Transmitter Test (Octet 36 - Bit 0)
          LE Set Advertising Set Random Address (Octet 36 - Bit 1)
          LE Set Extended Advertising Parameters (Octet 36 - Bit 2)
          LE Set Extended Advertising Data (Octet 36 - Bit 3)
          LE Set Extended Scan Response Data (Octet 36 - Bit 4)
          LE Set Extended Advertising Enable (Octet 36 - Bit 5)
          LE Read Maximum Advertising Data Length (Octet 36 - Bit 6)
          LE Read Number of Supported Advertising Sets (Octet 36 - Bit 7)
          LE Remove Advertising Set (Octet 37 - Bit 0)
          LE Clear Advertising Sets (Octet 37 - Bit 1)
          LE Set Periodic Advertising Parameters (Octet 37 - Bit 2)
          LE Set Periodic Advertising Data (Octet 37 - Bit 3)
          LE Set Periodic Advertising Enable (Octet 37 - Bit 4)
          LE Set Extended Scan Parameters (Octet 37 - Bit 5)
          LE Set Extended Scan Enable (Octet 37 - Bit 6)
          LE Extended Create Connection (Octet 37 - Bit 7)
          LE Periodic Advertising Create Sync (Octet 38 - Bit 0)
          LE Periodic Advertising Create Sync Cancel (Octet 38 - Bit 1)
          LE Periodic Advertising Terminate Sync (Octet 38 - Bit 2)
          LE Add Device To Periodic Advertiser List (Octet 38 - Bit 3)
          LE Remove Device From Periodic Advertiser List (Octet 38 - Bit 4)
          LE Clear Periodic Advertiser List (Octet 38 - Bit 5)
          LE Read Periodic Advertiser List Size (Octet 38 - Bit 6)
          LE Read Transmit Power (Octet 38 - Bit 7)
          LE Read RF Path Compensation (Octet 39 - Bit 0)
          LE Write RF Path Compensation (Octet 39 - Bit 1)
          LE Set Privacy Mode (Octet 39 - Bit 2)
          LE Periodic Advertising Receive Enable (Octet 40 - Bit 5)
          LE Periodic Advertising Sync Transfer (Octet 40 - Bit 6)
          LE Periodic Advertising Set Info Transfer (Octet 40 - Bit 7)
          LE Periodic Advertising Sync Transfer Parameters (Octet 41 - Bit 0)
          LE Set Default Periodic Advertisng Sync Transfer Parameters (Octet 41 - Bit 1)
          LE Read Buffer v2 (Octet 41 - Bit 5)
          LE Read ISO TX Sync (Octet 41 - Bit 6)
          LE Set Connected Isochronous Group Parameters (Octet 41 - Bit 7)
          LE Set Connected Isochronous Group Parameters Test (Octet 42 - Bit 0)
          LE Create Connected Isochronous Stream (Octet 42 - Bit 1)
          LE Remove Connected Isochronous Group (Octet 42 - Bit 2)
          LE Accept Connected Isochronous Stream Request (Octet 42 - Bit 3)
          LE Reject Connected Isochronous Stream Request (Octet 42 - Bit 4)
          LE Create Broadcast Isochronous Group (Octet 42 - Bit 5)
          LE Create Broadcast Isochronous Group Test (Octet 42 - Bit 6)
          LE Terminate Broadcast Isochronous Group (Octet 42 - Bit 7)
          LE Broadcast Isochronous Group Create Sync (Octet 43 - Bit 0)
          LE Broadcast Isochronous Group Terminate Sync (Octet 43 - Bit 1)
          LE Request Peer SCA (Octet 43 - Bit 2)
          LE Setup Isochronous Data Path (Octet 43 - Bit 3)
          LE Remove Isochronous Data Path (Octet 43 - Bit 4)
          LE Isochronous Transmit Test (Octet 43 - Bit 5)
          LE Isochronous Receive Test (Octet 43 - Bit 6)
          LE Isochronous Read Test Counters (Octet 43 - Bit 7)
          LE Isochronous Read Test Counters (Octet 44 - Bit 0)
          LE Set Host Feature (Octet 44 - Bit 1)
          LE Read ISO link quality (Octet 44 - Bit 2)
          Octet 45 - Bit 6 
          Octet 46 - Bit 0 
          Octet 46 - Bit 1 
          Octet 46 - Bit 2 
zephyr.exe[1714909]: < HCI Command: Host Buffer Size (0x03|0x0033) plen 7                                             #9 1.026590
        ACL MTU: 255  ACL max packet: 16
        SCO MTU: 0    SCO max packet: 0
> HCI Event: Command Complete (0x0e) plen 4                                                                          #10 1.027295
      Host Buffer Size (0x03|0x0033) ncmd 1
        Status: Success (0x00)
zephyr.exe[1714909]: < HCI Command: Set Controller To Host Flow Control (0x03|0x0031) plen 1                         #11 1.046589
        Flow control: ACL Data Packets (0x01)
> HCI Event: Command Complete (0x0e) plen 4                                                                          #12 1.047023
      Set Controller To Host Flow Control (0x03|0x0031) ncmd 1
        Status: Success (0x00)
zephyr.exe[1714909]: < HCI Command: LE Read Local Supported Features (0x08|0x0003) plen 0                            #13 1.066587
> HCI Event: Command Complete (0x0e) plen 12                                                                         #14 1.067545
      LE Read Local Supported Features (0x08|0x0003) ncmd 1
        Status: Success (0x00)
        Features: 0xfd 0x79 0x00 0xf7 0x30 0x01 0x00 0x00
          LE Encryption
          Extended Reject Indication
          Peripheral-initiated Features Exchange
          LE Ping
          LE Data Packet Length Extension
          LL Privacy
          Extended Scanner Filter Policies
          LE 2M PHY
          LE Coded PHY
          LE Extended Advertising
          LE Periodic Advertising
          Channel Selection Algorithm #2
          Periodic Advertising Sync Transfer - Sender
          Periodic Advertising Sync Transfer - Recipient
          Sleep Clock Accuracy Updates
          Connected Isochronous Stream - Central
          Connected Isochronous Stream - Peripheral
          Isochronous Broadcaster
          Synchronized Receiver
          Periodic Advertising ADI support
          Connection Subrating
          Unknown features (0x0000010000000000)
zephyr.exe[1714909]: < HCI Command: LE Set Host Feature (0x08|0x0074) plen 2                                         #15 1.086583
        Bit Number: 32
          Connected Isochronous Stream (Host Support)
        Bit Value: 1
> HCI Event: Command Complete (0x0e) plen 4                                                                          #16 1.087358
      LE Set Host Feature (0x08|0x0074) ncmd 1
        Status: Success (0x00)
zephyr.exe[1714909]: < HCI Command: LE Read Buffer v2 (0x08|0x0060) plen 0                                           #17 1.106587
> HCI Event: Command Complete (0x0e) plen 10                                                                         #18 1.107314
      LE Read Buffer v2 (0x08|0x0060) ncmd 1
        Status: Success (0x00)
        ACL MTU: 27
        ACL max packet: 3
        ISO MTU: 318
        ISO max packet: 3
zephyr.exe[1714909]: < HCI Command: LE Read Maximum Advertising Data Length (0x08|0x003a) plen 0                     #19 1.126600
> HCI Event: Command Complete (0x0e) plen 6                                                                          #20 1.127293
      LE Read Maximum Advertising Data Length (0x08|0x003a) ncmd 1
        Status: Success (0x00)
        Max length: 1650
zephyr.exe[1714909]: < HCI Command: LE Read Supported States (0x08|0x001c) plen 0                                    #21 1.146581
> HCI Event: Command Complete (0x0e) plen 12                                                                         #22 1.147222
      LE Read Supported States (0x08|0x001c) ncmd 1
        Status: Success (0x00)
        States: 0x000003ff3e0306ff
          Non-connectable Advertising State
          Scannable Advertising State
          Connectable Advertising State
          High Duty Cycle Directed Advertising State
          Passive Scanning State
          Active Scanning State
          Initiating State
            and Connection State (Central Role)
          Connection State (Peripheral Role)
          Scannable Advertising State
            and Passive Scanning State
          Connectable Advertising State
            and Passive Scanning State
          Non-connectable Advertising State
            and Initiating State
          Scannable Advertising State
            and Initiating State
          Active Scanning State
            and Connection State (Central Role)
          Passive Scanning State
            and Connection State (Peripheral Role)
          Active Scanning State
            and Connection State (Peripheral Role)
          Initiating State
            and Connection State (Central Role)
            and Central Role & Central Role
          Low Duty Cycle Directed Advertising State
          Connectable Advertising State
            and Initiating State
            and Central Role & Peripheral Role
          High Duty Cycle Directed Advertising State
            and Initiating State
            and Central Role & Peripheral Role
          Low Duty Cycle Directed Advertising State
            and Initiating State
            and Central Role & Peripheral Role
          Connectable Advertising State
            and Connection State (Central Role)
            and Central Role & Peripheral Role
          High Duty Cycle Directed Advertising State
            and Connection State (Central Role)
            and Central Role & Peripheral Role
          Low Duty Cycle Directed Advertising State
            and Connection State (Central Role)
            and Central Role & Peripheral Role
          Connectable Advertising State
            and Connection State (Peripheral Role)
            and Central Role & Peripheral Role
          High Duty Cycle Directed Advertising State
            and Connection State (Peripheral Role)
            and Peripheral Role & Peripheral Role
          Low Duty Cycle Directed Advertising State
            and Connection State (Peripheral Role)
            and Peripheral Role & Peripheral Role
          Initiating State
            and Connection State (Peripheral Role)
            and Central Role & Peripheral Role
zephyr.exe[1714909]: < HCI Command: LE Read Maximum Data Length (0x08|0x002f) plen 0                                 #23 1.166589
> HCI Event: Command Complete (0x0e) plen 12                                                                         #24 1.167243
      LE Read Maximum Data Length (0x08|0x002f) ncmd 1
        Status: Success (0x00)
        Max TX octets: 251
        Max TX time: 2704
        Max RX octets: 251
        Max RX time: 2704
zephyr.exe[1714909]: < HCI Command: LE Write Suggested Default Data Length (0x08|0x0024) plen 4                      #25 1.186586
        TX octets: 251
        TX time: 2704
> HCI Event: Command Complete (0x0e) plen 4                                                                          #26 1.187488
      LE Write Suggested Default Data Length (0x08|0x0024) ncmd 1
        Status: Success (0x00)
zephyr.exe[1714909]: < HCI Command: LE Read Resolving List Size (0x08|0x002a) plen 0                                 #27 1.206583
> HCI Event: Command Complete (0x0e) plen 5                                                                          #28 1.207317
      LE Read Resolving List Size (0x08|0x002a) ncmd 1
        Status: Success (0x00)
        Size: 8
zephyr.exe[1714909]: < HCI Command: LE Set Event Mask (0x08|0x0001) plen 8                                           #29 1.226585
        Mask: 0x000002023f87fa5e
          LE Advertising Report
          LE Connection Update Complete
          LE Read Remote Used Features Complete
          LE Long Term Key Request
          LE Data Length Change
          LE Enhanced Connection Complete
          LE PHY Update Complete
          LE Extended Advertising Report
          LE Periodic Advertising Sync Established
          LE Periodic Advertising Report
          LE Periodic Advertising Sync Lost
          LE Extended Scan Timeout
          LE Extended Advertising Set Terminated
          LE Scan Request Received
          LE Periodic Advertising Sync Transfer Rvc
          LE CIS Established
          LE CIS Request
          LE Create BIG Complete
          LE Terminate BIG Complete
          LE BIG Sync Established Complete
          LE BIG Sync Lost
          LE BIG Info Advertising Report
          Unknown mask (0x0000020000000000)
> HCI Event: Command Complete (0x0e) plen 4                                                                          #30 1.227314
      LE Set Event Mask (0x08|0x0001) ncmd 1
        Status: Success (0x00)
zephyr.exe[1714909]: < HCI Command: Set Event Mask (0x03|0x0001) plen 8                                              #31 1.246586
        Mask: 0x2000800002008890
          Disconnection Complete
          Encryption Change
          Read Remote Version Information Complete
          Hardware Error
          Data Buffer Overflow
          Encryption Key Refresh Complete
          LE Meta
> HCI Event: Command Complete (0x0e) plen 4                                                                          #32 1.247476
      Set Event Mask (0x03|0x0001) ncmd 1
        Status: Success (0x00)
zephyr.exe[1714909]: < HCI Command: Read BD ADDR (0x04|0x0009) plen 0                                                #33 1.266586
> HCI Event: Command Complete (0x0e) plen 10                                                                         #34 1.267404
      Read BD ADDR (0x04|0x0009) ncmd 1
        Status: Success (0x00)
        Address: 00:00:00:00:00:00 (OUI 00-00-00)
zephyr.exe[1714909]: < HCI Command: LE Set Random Address (0x08|0x0005) plen 6                                       #35 1.286591
        Address: D5:B6:CC:31:DB:3B (Static)
> HCI Event: Command Complete (0x0e) plen 4                                                                          #36 1.287258
      LE Set Random Address (0x08|0x0005) ncmd 1
        Status: Success (0x00)
zephyr.exe[1714909]: < HCI Command: LE Extended Create Connection (0x08|0x0043) plen 26                              #37 6.736659
        Filter policy: Accept list is not used (0x00)
        Own address type: Random (0x01)
        Peer address type: Public (0x00)
        Peer address: C0:07:E8:2C:B6:EE (OUI C0-07-E8)
        Initiating PHYs: 0x01
        Entry 0: LE 1M
          Scan interval: 60.000 msec (0x0060)
          Scan window: 60.000 msec (0x0060)
          Min connection interval: 50.00 msec (0x0028)
          Max connection interval: 70.00 msec (0x0038)
          Connection latency: 0 (0x0000)
          Supervision timeout: 4000 msec (0x0190)
          Min connection length: 0.000 msec (0x0000)
          Max connection length: 0.000 msec (0x0000)
> HCI Event: Command Status (0x0f) plen 4                                                                            #38 6.738594
      LE Extended Create Connection (0x08|0x0043) ncmd 1
        Status: Success (0x00)
> HCI Event: LE Meta Event (0x3e) plen 31                                                                            #39 6.815483
      LE Enhanced Connection Complete (0x0a)
        Status: Success (0x00)
        Handle: 0
        Role: Central (0x00)
        Peer address type: Public (0x00)
        Peer address: C0:07:E8:2C:B6:EE (OUI C0-07-E8)
        Local resolvable private address: 00:00:00:00:00:00 (Non-Resolvable)
        Peer resolvable private address: 00:00:00:00:00:00 (Non-Resolvable)
        Connection interval: 70.00 msec (0x0038)
        Connection latency: 0 (0x0000)
        Supervision timeout: 4000 msec (0x0190)
        Central clock accuracy: 0x00
zephyr.exe[1714909]: < HCI Command: LE Read Remote Used Features (0x08|0x0016) plen 2                                #40 6.826746
        Handle: 0 Address: C0:07:E8:2C:B6:EE (OUI C0-07-E8)
> HCI Event: Command Status (0x0f) plen 4                                                                            #41 6.827415
      LE Read Remote Used Features (0x08|0x0016) ncmd 1
        Status: Success (0x00)
zephyr.exe[1714909]: < HCI Command: LE Set PHY (0x08|0x0032) plen 7                                                  #42 6.846647
        Handle: 0 Address: C0:07:E8:2C:B6:EE (OUI C0-07-E8)
        All PHYs preference: 0x00
        TX PHYs preference: 0x02
          LE 2M
        RX PHYs preference: 0x02
          LE 2M
        PHY options preference: Reserved (0x0000)
> HCI Event: Command Status (0x0f) plen 4                                                                            #43 6.847266
      LE Set PHY (0x08|0x0032) ncmd 1
        Status: Success (0x00)
zephyr.exe[1714909]: < ACL Data TX: Handle 0 [1/3] flags 0x00 dlen 7                                                 #44 6.866632
      ATT: Exchange MTU Request (0x02) len 2
        Client RX MTU: 251
> HCI Event: Number of Completed Packets (0x13) plen 5                                                               #45 6.887691
        Num handles: 1
        Handle: 0 Address: C0:07:E8:2C:B6:EE (OUI C0-07-E8)
        Count: 1
        Buffers: 0/3
        #44: len 7 (2 Kb/s)
        Latency: 21 msec (21-21 msec ~21 msec)
> HCI Event: LE Meta Event (0x3e) plen 12                                                                            #46 7.027767
      LE Read Remote Used Features (0x04)
        Status: Success (0x00)
        Handle: 0 Address: C0:07:E8:2C:B6:EE (OUI C0-07-E8)
        Features: 0x2d 0x49 0x01 0xf7 0xef 0x39 0x00 0x80
          LE Encryption
          Extended Reject Indication
          Peripheral-initiated Features Exchange
          LE Data Packet Length Extension
          LE 2M PHY
          LE Coded PHY
          Channel Selection Algorithm #2
          Minimum Number of Used Channels Procedure
          Periodic Advertising Sync Transfer - Sender
          Periodic Advertising Sync Transfer - Recipient
          Sleep Clock Accuracy Updates
          Connected Isochronous Stream - Central
          Connected Isochronous Stream - Peripheral
          Isochronous Broadcaster
          Synchronized Receiver
          Connected Isochronous Stream (Host Support)
          LE Power Control Request
          LE Power Control Request
          LE Path Loss Monitoring
          Connection Subrating
          Connection Subrating (Host Support)
          Channel Classification
          Unknown features (0x8000390000000000)
> HCI Event: LE Meta Event (0x3e) plen 6                                                                             #47 7.657138
      LE PHY Update Complete (0x0c)
        Status: Success (0x00)
        Handle: 0 Address: C0:07:E8:2C:B6:EE (OUI C0-07-E8)
        TX PHY: LE 2M (0x02)
        RX PHY: LE 2M (0x02)
> ACL Data RX: Handle 0 flags 0x02 dlen 6                                                                            #48 7.867559
      SMP: Security Request (0x0b) len 1
        Authentication requirement: Bonding, No MITM, SC, No Keypresses (0x09)
> ACL Data RX: Handle 0 flags 0x02 dlen 7                                                                            #49 7.867968
      ATT: Exchange MTU Response (0x03) len 2
        Server RX MTU: 23
zephyr.exe[1714909]: < HCI Command: Host Number of Completed Packets (0x03|0x0035) plen 5                            #50 7.886721
        Num handles: 1
        Handle: 0 Address: C0:07:E8:2C:B6:EE (OUI C0-07-E8)
        Count: 1
zephyr.exe[1714909]: < ACL Data TX: Handle 0 [1/3] flags 0x00 dlen 11                                                #51 7.886835
      SMP: Pairing Request (0x01) len 6
        IO capability: DisplayOnly (0x00)
        OOB data: Authentication data not present (0x00)
        Authentication requirement: Bonding, No MITM, SC, No Keypresses (0x09)
        Max encryption key size: 16
        Initiator key distribution: EncKey Sign (0x05)
        Responder key distribution: EncKey IdKey Sign (0x07)
zephyr.exe[1714909]: < HCI Command: Host Number of Completed Packets (0x03|0x0035) plen 5                            #52 7.887155
        Num handles: 1
        Handle: 0 Address: C0:07:E8:2C:B6:EE (OUI C0-07-E8)
        Count: 1
> HCI Event: Number of Completed Packets (0x13) plen 5                                                               #53 7.937623
        Num handles: 1
        Handle: 0 Address: C0:07:E8:2C:B6:EE (OUI C0-07-E8)
        Count: 1
        Buffers: 0/3
        #51: len 11 (1 Kb/s)
        Latency: 50 msec (21-50 msec ~35 msec)
> ACL Data RX: Handle 0 flags 0x02 dlen 11                                                                           #54 8.007715
      SMP: Pairing Response (0x02) len 6
        IO capability: KeyboardDisplay (0x04)
        OOB data: Authentication data not present (0x00)
        Authentication requirement: Bonding, No MITM, SC, No Keypresses (0x09)
        Max encryption key size: 16
        Initiator key distribution: EncKey Sign (0x05)
        Responder key distribution: EncKey IdKey (0x03)
zephyr.exe[1714909]: < HCI Command: Host Number of Completed Packets (0x03|0x0035) plen 5                            #55 8.026698
        Num handles: 1
        Handle: 0 Address: C0:07:E8:2C:B6:EE (OUI C0-07-E8)
        Count: 1
zephyr.exe[1714909]: < ACL Data TX: Handle 0 [1/3] flags 0x00 dlen 27                                                #56 8.026955
zephyr.exe[1714909]: < ACL Data TX: Handle 0 flags 0x01 dlen 27                                                      #57 8.026993
zephyr.exe[1714909]: < ACL Data TX: Handle 0 flags 0x01 dlen 15                                                      #58 8.027011
      SMP: Pairing Public Key (0x0c) len 64
        X[32]: 98308440221e2d910f0e54b71e7ec652857aa9b5a0dc65028824cc19db1226e9
        Y[32]: 67a4816bcb62efb21701e31fdb27561a6217575fb007a8bbdabe7e28b6f68482
> HCI Event: Number of Completed Packets (0x13) plen 5                                                               #59 8.077570
        Num handles: 1
        Handle: 0 Address: C0:07:E8:2C:B6:EE (OUI C0-07-E8)
        Count: 1
        Buffers: 0/3
        #56: len 27 (4 Kb/s)
        Latency: 50 msec (21-50 msec ~43 msec)
> HCI Event: Number of Completed Packets (0x13) plen 5                                                               #60 8.078046
        Num handles: 1
        Handle: 0 Address: C0:07:E8:2C:B6:EE (OUI C0-07-E8)
        Count: 1
        Buffers: underflow/3
        #57: len 27 (4 Kb/s)
        Latency: 51 msec (21-51 msec ~47 msec)
> HCI Event: Number of Completed Packets (0x13) plen 5                                                               #61 8.078791
        Num handles: 1
        Handle: 0 Address: C0:07:E8:2C:B6:EE (OUI C0-07-E8)
        Count: 1
        Buffers: underflow/3
        #58: len 15 (2 Kb/s)
        Latency: 51 msec (21-51 msec ~49 msec)
> ACL Data RX: Handle 0 flags 0x02 dlen 27                                                                           #62 8.147822
> ACL Data RX: Handle 0 flags 0x01 dlen 27                                                                           #63 8.148296
> ACL Data RX: Handle 0 flags 0x01 dlen 15                                                                           #64 8.148586
      SMP: Pairing Public Key (0x0c) len 64
        X[32]: 10b49e493a5b79003104e471555d59bc5c6e2d78bd84b4e2cc4e886629a190fb
        Y[32]: c1e72a1c446b3098a9b4796f8b45642dd833ff64db507067e6dc34082ce694b0
zephyr.exe[1714909]: < HCI Command: Host Number of Completed Packets (0x03|0x0035) plen 5                            #65 8.166828
        Num handles: 1
        Handle: 0 Address: C0:07:E8:2C:B6:EE (OUI C0-07-E8)
        Count: 1
zephyr.exe[1714909]: < HCI Command: Host Number of Completed Packets (0x03|0x0035) plen 5                            #66 8.167691
        Num handles: 1
        Handle: 0 Address: C0:07:E8:2C:B6:EE (OUI C0-07-E8)
        Count: 1
zephyr.exe[1714909]: < HCI Command: Host Number of Completed Packets (0x03|0x0035) plen 5                            #67 8.168182
        Num handles: 1
        Handle: 0 Address: C0:07:E8:2C:B6:EE (OUI C0-07-E8)
        Count: 1
> ACL Data RX: Handle 0 flags 0x02 dlen 21                                                                           #68 8.167674
      SMP: Pairing Confirm (0x03) len 16
        Confirm value[16]: 56dc88bf1fb86525c530ea7360d76e14
zephyr.exe[1714909]: < HCI Command: Host Number of Completed Packets (0x03|0x0035) plen 5                            #69 8.186730
        Num handles: 1
        Handle: 0 Address: C0:07:E8:2C:B6:EE (OUI C0-07-E8)
        Count: 1
zephyr.exe[1714909]: < ACL Data TX: Handle 0 [1/3] flags 0x00 dlen 21                                                #70 8.186810
      SMP: Pairing Random (0x04) len 16
        Random value[16]: 8e6108f966a694cbe26df70bb96773e6
> HCI Event: Number of Completed Packets (0x13) plen 5                                                               #71 8.217597
        Num handles: 1
        Handle: 0 Address: C0:07:E8:2C:B6:EE (OUI C0-07-E8)
        Count: 1
        Buffers: 0/3
        #70: len 21 (5 Kb/s)
        Latency: 30 msec (21-51 msec ~40 msec)
> ACL Data RX: Handle 0 flags 0x02 dlen 21                                                                           #72 8.287775
      SMP: Pairing Random (0x04) len 16
        Random value[16]: 03e9aa8f38ca96ad0000000000000000
zephyr.exe[1714909]: < HCI Command: Host Number of Completed Packets (0x03|0x0035) plen 5                            #73 8.306702
        Num handles: 1
        Handle: 0 Address: C0:07:E8:2C:B6:EE (OUI C0-07-E8)
        Count: 1
zephyr.exe[1714909]: < ACL Data TX: Handle 0 [1/3] flags 0x00 dlen 21                                                #74 8.306815
      SMP: Pairing DHKey Check (0x0d) len 16
        E[16]: 70e95667f5602a1b741892d9aefbe2f2
> HCI Event: Number of Completed Packets (0x13) plen 5                                                               #75 8.357596
        Num handles: 1
        Handle: 0 Address: C0:07:E8:2C:B6:EE (OUI C0-07-E8)
        Count: 1
        Buffers: 0/3
        #74: len 21 (3 Kb/s)
        Latency: 50 msec (21-51 msec ~45 msec)
> ACL Data RX: Handle 0 flags 0x02 dlen 21                                                                           #76 8.497754
      SMP: Pairing DHKey Check (0x0d) len 16
        E[16]: 72b933437a460f505e97efe1b0844ae9
zephyr.exe[1714909]: < HCI Command: LE Start Encryption (0x08|0x0019) plen 28                                        #77 8.506779
        Handle: 0 Address: C0:07:E8:2C:B6:EE (OUI C0-07-E8)
        Random number: 0x0000000000000000
        Encrypted diversifier: 0x0000
        Long term key[16]: a074de1b587c10258b9474c316dba6f1
> HCI Event: Command Status (0x0f) plen 4                                                                            #78 8.508194
      LE Start Encryption (0x08|0x0019) ncmd 1
        Status: Success (0x00)
zephyr.exe[1714909]: < HCI Command: Host Number of Completed Packets (0x03|0x0035) plen 5                            #79 8.526643
        Num handles: 1
        Handle: 0 Address: C0:07:E8:2C:B6:EE (OUI C0-07-E8)
        Count: 1
> HCI Event: Encryption Change (0x08) plen 4                                                                         #80 8.987522
        Status: Success (0x00)
        Handle: 0 Address: C0:07:E8:2C:B6:EE (OUI C0-07-E8)
        Encryption: Enabled with AES-CCM (0x01)
> ACL Data RX: Handle 0 flags 0x02 dlen 21                                                                           #81 9.057824
      SMP: Identity Information (0x08) len 16
        Identity resolving key[16]: d25b4335d058a63b6fa774dca6f4fc3f
zephyr.exe[1714909]: < HCI Command: Host Number of Completed Packets (0x03|0x0035) plen 5                            #82 9.066698
        Num handles: 1
        Handle: 0 Address: C0:07:E8:2C:B6:EE (OUI C0-07-E8)
        Count: 1
> ACL Data RX: Handle 0 flags 0x02 dlen 12                                                                           #83 9.127694
      SMP: Identity Address Information (0x09) len 7
        Address: C0:07:E8:2C:B6:EE (OUI C0-07-E8)
zephyr.exe[1714909]: < HCI Command: LE Add Device To Resolving List (0x08|0x0027) plen 39                            #84 9.146794
        Address type: Public (0x00)
        Address: C0:07:E8:2C:B6:EE (OUI C0-07-E8)
        Peer identity resolving key[16]: d25b4335d058a63b6fa774dca6f4fc3f
        Local identity resolving key[16]: 00000000000000000000000000000000
> HCI Event: Command Complete (0x0e) plen 4                                                                          #85 9.147968
      LE Add Device To Resolving List (0x08|0x0027) ncmd 1
        Status: Success (0x00)
zephyr.exe[1714909]: < HCI Command: LE Set Privacy Mode (0x08|0x004e) plen 8                                         #86 9.166766
        Peer Identity address type: Public (0x00)
        Peer Identity address: C0:07:E8:2C:B6:EE (OUI C0-07-E8)
        Privacy Mode: Use Device Privacy (0x01)
> HCI Event: Command Complete (0x0e) plen 4                                                                          #87 9.168040
      LE Set Privacy Mode (0x08|0x004e) ncmd 1
        Status: Success (0x00)
zephyr.exe[1714909]: < HCI Command: LE Set Address Resolution Enable (0x08|0x002d) plen 1                            #88 9.186709
        Address resolution: Enabled (0x01)
> HCI Event: Command Complete (0x0e) plen 4                                                                          #89 9.187469
      LE Set Address Resolution Enable (0x08|0x002d) ncmd 1
        Status: Success (0x00)
zephyr.exe[1714909]: < HCI Command: Host Number of Completed Packets (0x03|0x0035) plen 5                            #90 9.206724
        Num handles: 1
        Handle: 0 Address: C0:07:E8:2C:B6:EE (OUI C0-07-E8)
        Count: 1
zephyr.exe[1714909]: < ACL Data TX: Handle 0 [1/3] flags 0x00 dlen 21                                                #91 9.206996
      SMP: Signing Information (0x0a) len 16
        Signature key[16]: 5da095555cc64d02679f89a05211af56
> HCI Event: Number of Completed Packets (0x13) plen 5                                                               #92 9.267591
        Num handles: 1
        Handle: 0 Address: C0:07:E8:2C:B6:EE (OUI C0-07-E8)
        Count: 1
        Buffers: 0/3
        #91: len 21 (2 Kb/s)
        Latency: 60 msec (21-60 msec ~53 msec)
zephyr.exe[1714909]: < ACL Data TX: Handle 0 [1/3] flags 0x00 dlen 13                                               #93 10.126791
      ATT: Find By Type Value Request (0x06) len 8
        Handle range: 0x0001-0xffff
        Attribute type: Primary Service (0x2800)
          UUID: Generic Media Control (0x1849)
> HCI Event: Number of Completed Packets (0x13) plen 5                                                              #94 10.177553
        Num handles: 1
        Handle: 0 Address: C0:07:E8:2C:B6:EE (OUI C0-07-E8)
        Count: 1
        Buffers: 0/3
        #93: len 13 (2 Kb/s)
        Latency: 50 msec (21-60 msec ~51 msec)
> ACL Data RX: Handle 0 flags 0x02 dlen 9                                                                           #95 10.247585
      ATT: Find By Type Value Response (0x07) len 4
        Handle range: 0x0120-0x015e
zephyr.exe[1714909]: < HCI Command: Host Number of Completed Packets (0x03|0x0035) plen 5                           #96 10.266853
        Num handles: 1
        Handle: 0 Address: C0:07:E8:2C:B6:EE (OUI C0-07-E8)
        Count: 1
zephyr.exe[1714909]: < ACL Data TX: Handle 0 [1/3] flags 0x00 dlen 11                                               #97 10.267041
      ATT: Read By Type Request (0x08) len 6
        Handle range: 0x0121-0x015e
        Attribute type: Characteristic (0x2803)
> HCI Event: Number of Completed Packets (0x13) plen 5                                                              #98 10.317493
        Num handles: 1
        Handle: 0 Address: C0:07:E8:2C:B6:EE (OUI C0-07-E8)
        Count: 1
        Buffers: 0/3
        #97: len 11 (1 Kb/s)
        Latency: 50 msec (21-60 msec ~51 msec)
> ACL Data RX: Handle 0 flags 0x02 dlen 27                                                                          #99 10.387856
      ATT: Read By Type Response (0x09) len 22
        Attribute data length: 7
        Attribute data list: 3 entries
        Handle: 0x0122
        Value[5]: 122301932b
            Properties: 0x12
              Read (0x02)
              Notify (0x10)
            Value Handle: 0x0123
            Value UUID: Media Player Name (0x2b93)
        Handle: 0x0125
        Value[5]: 022601942b
            Properties: 0x02
              Read (0x02)
            Value Handle: 0x0126
            Value UUID: Media Player Icon Object ID (0x2b94)
        Handle: 0x0127
        Value[5]: 022801952b
            Properties: 0x02
              Read (0x02)
            Value Handle: 0x0128
            Value UUID: Media Player Icon URL (0x2b95)
zephyr.exe[1714909]: < HCI Command: Host Number of Completed Packets (0x03|0x0035) plen 5                          #100 10.407272
        Num handles: 1
        Handle: 0 Address: C0:07:E8:2C:B6:EE (OUI C0-07-E8)
        Count: 1
zephyr.exe[1714909]: < ACL Data TX: Handle 0 [1/3] flags 0x00 dlen 11                                              #101 10.407396
      ATT: Read By Type Request (0x08) len 6
        Handle range: 0x0128-0x015e
        Attribute type: Characteristic (0x2803)
> HCI Event: Number of Completed Packets (0x13) plen 5                                                             #102 10.457480
        Num handles: 1
        Handle: 0 Address: C0:07:E8:2C:B6:EE (OUI C0-07-E8)
        Count: 1
        Buffers: 0/3
        #101: len 11 (1 Kb/s)
        Latency: 50 msec (21-60 msec ~50 msec)
> ACL Data RX: Handle 0 flags 0x02 dlen 27                                                                         #103 10.527991
      ATT: Read By Type Response (0x09) len 22
        Attribute data length: 7
        Attribute data list: 3 entries
        Handle: 0x0129
        Value[5]: 102a01962b
            Properties: 0x10
              Notify (0x10)
            Value Handle: 0x012a
            Value UUID: Track Changed (0x2b96)
        Handle: 0x012c
        Value[5]: 122d01972b
            Properties: 0x12
              Read (0x02)
              Notify (0x10)
            Value Handle: 0x012d
            Value UUID: Track Title (0x2b97)
        Handle: 0x012f
        Value[5]: 123001982b
            Properties: 0x12
              Read (0x02)
              Notify (0x10)
            Value Handle: 0x0130
            Value UUID: Track Duration (0x2b98)
zephyr.exe[1714909]: < HCI Command: Host Number of Completed Packets (0x03|0x0035) plen 5                          #104 10.546606
        Num handles: 1
        Handle: 0 Address: C0:07:E8:2C:B6:EE (OUI C0-07-E8)
        Count: 1
zephyr.exe[1714909]: < ACL Data TX: Handle 0 [1/3] flags 0x00 dlen 11                                              #105 10.546720
      ATT: Read By Type Request (0x08) len 6
        Handle range: 0x0130-0x015e
        Attribute type: Characteristic (0x2803)
> HCI Event: Number of Completed Packets (0x13) plen 5                                                             #106 10.597548
        Num handles: 1
        Handle: 0 Address: C0:07:E8:2C:B6:EE (OUI C0-07-E8)
        Count: 1
        Buffers: 0/3
        #105: len 11 (1 Kb/s)
        Latency: 50 msec (21-60 msec ~50 msec)
> ACL Data RX: Handle 0 flags 0x02 dlen 27                                                                         #107 10.667891
      ATT: Read By Type Response (0x09) len 22
        Attribute data length: 7
        Attribute data list: 3 entries
        Handle: 0x0132
        Value[5]: 1e3301992b
            Properties: 0x1e
              Read (0x02)
              Write Without Response (0x04)
              Write (0x08)
              Notify (0x10)
            Value Handle: 0x0133
            Value UUID: Track Position (0x2b99)
        Handle: 0x0135
        Value[5]: 1e36019a2b
            Properties: 0x1e
              Read (0x02)
              Write Without Response (0x04)
              Write (0x08)
              Notify (0x10)
            Value Handle: 0x0136
            Value UUID: Playback Speed (0x2b9a)
        Handle: 0x0138
        Value[5]: 1239019b2b
            Properties: 0x12
              Read (0x02)
              Notify (0x10)
            Value Handle: 0x0139
            Value UUID: Seeking Speed (0x2b9b)
zephyr.exe[1714909]: < HCI Command: Host Number of Completed Packets (0x03|0x0035) plen 5                          #108 10.690081
        Num handles: 1
        Handle: 0 Address: C0:07:E8:2C:B6:EE (OUI C0-07-E8)
        Count: 1
zephyr.exe[1714909]: < ACL Data TX: Handle 0 [1/3] flags 0x00 dlen 11                                              #109 10.690206
      ATT: Read By Type Request (0x08) len 6
        Handle range: 0x0139-0x015e
        Attribute type: Characteristic (0x2803)
> HCI Event: Number of Completed Packets (0x13) plen 5                                                             #110 10.737603
        Num handles: 1
        Handle: 0 Address: C0:07:E8:2C:B6:EE (OUI C0-07-E8)
        Count: 1
        Buffers: 0/3
        #109: len 11 (1 Kb/s)
        Latency: 47 msec (21-60 msec ~49 msec)
> ACL Data RX: Handle 0 flags 0x02 dlen 27                                                                         #111 10.807960
      ATT: Read By Type Response (0x09) len 22
        Attribute data length: 7
        Attribute data list: 3 entries
        Handle: 0x013b
        Value[5]: 023c019c2b
            Properties: 0x02
              Read (0x02)
            Value Handle: 0x013c
            Value UUID: Current Track Segments Object ID (0x2b9c)
        Handle: 0x013d
        Value[5]: 1e3e019d2b
            Properties: 0x1e
              Read (0x02)
              Write Without Response (0x04)
              Write (0x08)
              Notify (0x10)
            Value Handle: 0x013e
            Value UUID: Current Track Object ID (0x2b9d)
        Handle: 0x0140
        Value[5]: 0e41019e2b
            Properties: 0x0e
              Read (0x02)
              Write Without Response (0x04)
              Write (0x08)
            Value Handle: 0x0141
            Value UUID: Next Track Object ID (0x2b9e)
zephyr.exe[1714909]: < HCI Command: Host Number of Completed Packets (0x03|0x0035) plen 5                          #112 10.835137
        Num handles: 1
        Handle: 0 Address: C0:07:E8:2C:B6:EE (OUI C0-07-E8)
        Count: 1
zephyr.exe[1714909]: < ACL Data TX: Handle 0 [1/3] flags 0x00 dlen 11                                              #113 10.835947
      ATT: Read By Type Request (0x08) len 6
        Handle range: 0x0141-0x015e
        Attribute type: Characteristic (0x2803)
> HCI Event: Number of Completed Packets (0x13) plen 5                                                             #114 10.877527
        Num handles: 1
        Handle: 0 Address: C0:07:E8:2C:B6:EE (OUI C0-07-E8)
        Count: 1
        Buffers: 0/3
        #113: len 11 (2 Kb/s)
        Latency: 41 msec (21-60 msec ~45 msec)
> ACL Data RX: Handle 0 flags 0x02 dlen 27                                                                         #115 10.947859
      ATT: Read By Type Response (0x09) len 22
        Attribute data length: 7
        Attribute data list: 3 entries
        Handle: 0x0143
        Value[5]: 1e4401a02b
            Properties: 0x1e
              Read (0x02)
              Write Without Response (0x04)
              Write (0x08)
              Notify (0x10)
            Value Handle: 0x0144
            Value UUID: Current Group Object ID (0x2ba0)
        Handle: 0x0146
        Value[5]: 1e4701a12b
            Properties: 0x1e
              Read (0x02)
              Write Without Response (0x04)
              Write (0x08)
              Notify (0x10)
            Value Handle: 0x0147
            Value UUID: Playing Order (0x2ba1)
        Handle: 0x0149
        Value[5]: 024a01a22b
            Properties: 0x02
              Read (0x02)
            Value Handle: 0x014a
            Value UUID: Playing Orders Supported (0x2ba2)
zephyr.exe[1714909]: < HCI Command: Host Number of Completed Packets (0x03|0x0035) plen 5                          #116 10.968223
        Num handles: 1
        Handle: 0 Address: C0:07:E8:2C:B6:EE (OUI C0-07-E8)
        Count: 1
zephyr.exe[1714909]: < ACL Data TX: Handle 0 [1/3] flags 0x00 dlen 11                                              #117 10.972084
      ATT: Read By Type Request (0x08) len 6
        Handle range: 0x014a-0x015e
        Attribute type: Characteristic (0x2803)
> HCI Event: Number of Completed Packets (0x13) plen 5                                                             #118 11.017538
        Num handles: 1
        Handle: 0 Address: C0:07:E8:2C:B6:EE (OUI C0-07-E8)
        Count: 1
        Buffers: 0/3
        #117: len 11 (1 Kb/s)
        Latency: 45 msec (21-60 msec ~45 msec)
> ACL Data RX: Handle 0 flags 0x02 dlen 27                                                                         #119 11.087883
      ATT: Read By Type Response (0x09) len 22
        Attribute data length: 7
        Attribute data list: 3 entries
        Handle: 0x014b
        Value[5]: 124c01a32b
            Properties: 0x12
              Read (0x02)
              Notify (0x10)
            Value Handle: 0x014c
            Value UUID: Media State (0x2ba3)
        Handle: 0x014e
        Value[5]: 1c4f01a42b
            Properties: 0x1c
              Write Without Response (0x04)
              Write (0x08)
              Notify (0x10)
            Value Handle: 0x014f
            Value UUID: Media Control Point (0x2ba4)
        Handle: 0x0151
        Value[5]: 125201a52b
            Properties: 0x12
              Read (0x02)
              Notify (0x10)
            Value Handle: 0x0152
            Value UUID: Media Control Point Opcodes Supported (0x2ba5)
zephyr.exe[1714909]: < HCI Command: Host Number of Completed Packets (0x03|0x0035) plen 5                          #120 11.106900
        Num handles: 1
        Handle: 0 Address: C0:07:E8:2C:B6:EE (OUI C0-07-E8)
        Count: 1
zephyr.exe[1714909]: < ACL Data TX: Handle 0 [1/3] flags 0x00 dlen 11                                              #121 11.108231
      ATT: Read By Type Request (0x08) len 6
        Handle range: 0x0152-0x015e
        Attribute type: Characteristic (0x2803)
> HCI Event: Number of Completed Packets (0x13) plen 5                                                             #122 11.157568
        Num handles: 1
        Handle: 0 Address: C0:07:E8:2C:B6:EE (OUI C0-07-E8)
        Count: 1
        Buffers: 0/3
        #121: len 11 (1 Kb/s)
        Latency: 49 msec (21-60 msec ~47 msec)
> ACL Data RX: Handle 0 flags 0x02 dlen 27                                                                         #123 11.227854
      ATT: Read By Type Response (0x09) len 22
        Attribute data length: 7
        Attribute data list: 3 entries
        Handle: 0x0154
        Value[5]: 125501a62b
            Properties: 0x12
              Read (0x02)
              Notify (0x10)
            Value Handle: 0x0155
            Value UUID: Search Results Object ID (0x2ba6)
        Handle: 0x0157
        Value[5]: 1c5801a72b
            Properties: 0x1c
              Write Without Response (0x04)
              Write (0x08)
              Notify (0x10)
            Value Handle: 0x0158
            Value UUID: Search Control Point (0x2ba7)
        Handle: 0x015a
        Value[5]: 025b01ba2b
            Properties: 0x02
              Read (0x02)
            Value Handle: 0x015b
            Value UUID: Content Control ID (0x2bba)
zephyr.exe[1714909]: < HCI Command: Host Number of Completed Packets (0x03|0x0035) plen 5                          #124 11.253173
        Num handles: 1
        Handle: 0 Address: C0:07:E8:2C:B6:EE (OUI C0-07-E8)
        Count: 1
zephyr.exe[1714909]: < ACL Data TX: Handle 0 [1/3] flags 0x00 dlen 11                                              #125 11.253606
      ATT: Read By Type Request (0x08) len 6
        Handle range: 0x015b-0x015e
        Attribute type: Characteristic (0x2803)
> HCI Event: Number of Completed Packets (0x13) plen 5                                                             #126 11.297536
        Num handles: 1
        Handle: 0 Address: C0:07:E8:2C:B6:EE (OUI C0-07-E8)
        Count: 1
        Buffers: 0/3
        #125: len 11 (2 Kb/s)
        Latency: 43 msec (21-60 msec ~45 msec)
> ACL Data RX: Handle 0 flags 0x02 dlen 13                                                                         #127 11.367684
      ATT: Read By Type Response (0x09) len 8
        Attribute data length: 7
        Attribute data list: 1 entry
        Handle: 0x015c
        Value[5]: 125d019f2b
            Properties: 0x12
              Read (0x02)
              Notify (0x10)
            Value Handle: 0x015d
            Value UUID: Parent Group Object ID (0x2b9f)
zephyr.exe[1714909]: < HCI Command: Host Number of Completed Packets (0x03|0x0035) plen 5                          #128 11.386770
        Num handles: 1
        Handle: 0 Address: C0:07:E8:2C:B6:EE (OUI C0-07-E8)
        Count: 1
zephyr.exe[1714909]: < ACL Data TX: Handle 0 [1/3] flags 0x00 dlen 11                                              #129 11.387022
      ATT: Read By Type Request (0x08) len 6
        Handle range: 0x015d-0x015e
        Attribute type: Characteristic (0x2803)
> HCI Event: Number of Completed Packets (0x13) plen 5                                                             #130 11.437601
        Num handles: 1
        Handle: 0 Address: C0:07:E8:2C:B6:EE (OUI C0-07-E8)
        Count: 1
        Buffers: 0/3
        #129: len 11 (1 Kb/s)
        Latency: 50 msec (21-60 msec ~48 msec)
> ACL Data RX: Handle 0 flags 0x02 dlen 9                                                                          #131 11.507526
      ATT: Error Response (0x01) len 4
        Read By Type Request (0x08)
        Handle: 0x015d
        Error: Attribute Not Found (0x0a)
zephyr.exe[1714909]: < HCI Command: Host Number of Completed Packets (0x03|0x0035) plen 5                          #132 11.526866
        Num handles: 1
        Handle: 0 Address: C0:07:E8:2C:B6:EE (OUI C0-07-E8)
        Count: 1
zephyr.exe[1714909]: < ACL Data TX: Handle 0 [1/3] flags 0x00 dlen 9                                               #133 11.527561
      ATT: Find Information Request (0x04) len 4
        Handle range: 0x0123-0x015e
> HCI Event: Number of Completed Packets (0x13) plen 5                                                             #134 11.577527
        Num handles: 1
        Handle: 0 Address: C0:07:E8:2C:B6:EE (OUI C0-07-E8)
        Count: 1
        Buffers: 0/3
        #133: len 9 (1 Kb/s)
        Latency: 49 msec (21-60 msec ~49 msec)
> ACL Data RX: Handle 0 flags 0x02 dlen 26                                                                         #135 11.647781
      ATT: Find Information Response (0x05) len 21
        Format: UUID-16 (0x01)
        Handle: 0x0123
        UUID: Media Player Name (0x2b93)
        Handle: 0x0124
        UUID: Client Characteristic Configuration (0x2902)
        Handle: 0x0125
        UUID: Characteristic (0x2803)
        Handle: 0x0126
        UUID: Media Player Icon Object ID (0x2b94)
        Handle: 0x0127
        UUID: Characteristic (0x2803)
zephyr.exe[1714909]: < HCI Command: Host Number of Completed Packets (0x03|0x0035) plen 5                          #136 11.666559
        Num handles: 1
        Handle: 0 Address: C0:07:E8:2C:B6:EE (OUI C0-07-E8)
        Count: 1
zephyr.exe[1714909]: < ACL Data TX: Handle 0 [1/3] flags 0x00 dlen 9                                               #137 11.666927
      ATT: Write Request (0x12) len 4
        Handle: 0x0124
          Data[2]: 0100
> HCI Event: Number of Completed Packets (0x13) plen 5                                                             #138 11.719083
        Num handles: 1
        Handle: 0 Address: C0:07:E8:2C:B6:EE (OUI C0-07-E8)
        Count: 1
        Buffers: 0/3
        #137: len 9 (1 Kb/s)
        Latency: 52 msec (21-60 msec ~50 msec)
> ACL Data RX: Handle 0 flags 0x02 dlen 5                                                                          #139 11.787505
      ATT: Write Response (0x13) len 0
zephyr.exe[1714909]: < HCI Command: Host Number of Completed Packets (0x03|0x0035) plen 5                          #140 11.806870
        Num handles: 1
        Handle: 0 Address: C0:07:E8:2C:B6:EE (OUI C0-07-E8)
        Count: 1
zephyr.exe[1714909]: < ACL Data TX: Handle 0 [1/3] flags 0x00 dlen 9                                               #141 11.807566
      ATT: Find Information Request (0x04) len 4
        Handle range: 0x012a-0x015e
> HCI Event: Number of Completed Packets (0x13) plen 5                                                             #142 11.857505
        Num handles: 1
        Handle: 0 Address: C0:07:E8:2C:B6:EE (OUI C0-07-E8)
        Count: 1
        Buffers: 0/3
        #141: len 9 (1 Kb/s)
        Latency: 49 msec (21-60 msec ~50 msec)
> ACL Data RX: Handle 0 flags 0x02 dlen 26                                                                         #143 11.927861
      ATT: Find Information Response (0x05) len 21
        Format: UUID-16 (0x01)
        Handle: 0x012a
        UUID: Track Changed (0x2b96)
        Handle: 0x012b
        UUID: Client Characteristic Configuration (0x2902)
        Handle: 0x012c
        UUID: Characteristic (0x2803)
        Handle: 0x012d
        UUID: Track Title (0x2b97)
        Handle: 0x012e
        UUID: Client Characteristic Configuration (0x2902)
zephyr.exe[1714909]: < HCI Command: Host Number of Completed Packets (0x03|0x0035) plen 5                          #144 11.949081
        Num handles: 1
        Handle: 0 Address: C0:07:E8:2C:B6:EE (OUI C0-07-E8)
        Count: 1
zephyr.exe[1714909]: < ACL Data TX: Handle 0 [1/3] flags 0x00 dlen 9                                               #145 11.950506
      ATT: Write Request (0x12) len 4
        Handle: 0x012b
          Data[2]: 0100
> HCI Event: Number of Completed Packets (0x13) plen 5                                                             #146 11.997436
        Num handles: 1
        Handle: 0 Address: C0:07:E8:2C:B6:EE (OUI C0-07-E8)
        Count: 1
        Buffers: 0/3
        #145: len 9 (1 Kb/s)
        Latency: 46 msec (21-60 msec ~48 msec)
> ACL Data RX: Handle 0 flags 0x02 dlen 5                                                                          #147 12.067494
      ATT: Write Response (0x13) len 0
zephyr.exe[1714909]: < HCI Command: Host Number of Completed Packets (0x03|0x0035) plen 5                          #148 12.086856
        Num handles: 1
        Handle: 0 Address: C0:07:E8:2C:B6:EE (OUI C0-07-E8)
        Count: 1
zephyr.exe[1714909]: < ACL Data TX: Handle 0 [1/3] flags 0x00 dlen 9                                               #149 12.087810
      ATT: Find Information Request (0x04) len 4
        Handle range: 0x0130-0x015e
> HCI Event: Number of Completed Packets (0x13) plen 5                                                             #150 12.137495
        Num handles: 1
        Handle: 0 Address: C0:07:E8:2C:B6:EE (OUI C0-07-E8)
        Count: 1
        Buffers: 0/3
        #149: len 9 (1 Kb/s)
        Latency: 49 msec (21-60 msec ~49 msec)
> ACL Data RX: Handle 0 flags 0x02 dlen 26                                                                         #151 12.207815
      ATT: Find Information Response (0x05) len 21
        Format: UUID-16 (0x01)
        Handle: 0x0130
        UUID: Track Duration (0x2b98)
        Handle: 0x0131
        UUID: Client Characteristic Configuration (0x2902)
        Handle: 0x0132
        UUID: Characteristic (0x2803)
        Handle: 0x0133
        UUID: Track Position (0x2b99)
        Handle: 0x0134
        UUID: Client Characteristic Configuration (0x2902)
zephyr.exe[1714909]: < HCI Command: Host Number of Completed Packets (0x03|0x0035) plen 5                          #152 12.226583
        Num handles: 1
        Handle: 0 Address: C0:07:E8:2C:B6:EE (OUI C0-07-E8)
        Count: 1
zephyr.exe[1714909]: < ACL Data TX: Handle 0 [1/3] flags 0x00 dlen 9                                               #153 12.226701
      ATT: Write Request (0x12) len 4
        Handle: 0x0131
          Data[2]: 0100
> HCI Event: Number of Completed Packets (0x13) plen 5                                                             #154 12.278410
        Num handles: 1
        Handle: 0 Address: C0:07:E8:2C:B6:EE (OUI C0-07-E8)
        Count: 1
        Buffers: 0/3
        #153: len 9 (1 Kb/s)
        Latency: 51 msec (21-60 msec ~50 msec)
> ACL Data RX: Handle 0 flags 0x02 dlen 5                                                                          #155 12.347481
      ATT: Write Response (0x13) len 0
zephyr.exe[1714909]: < HCI Command: Host Number of Completed Packets (0x03|0x0035) plen 5                          #156 12.366881
        Num handles: 1
        Handle: 0 Address: C0:07:E8:2C:B6:EE (OUI C0-07-E8)
        Count: 1
zephyr.exe[1714909]: < ACL Data TX: Handle 0 [1/3] flags 0x00 dlen 9                                               #157 12.367023
      ATT: Find Information Request (0x04) len 4
        Handle range: 0x0133-0x015e
> HCI Event: Number of Completed Packets (0x13) plen 5                                                             #158 12.417496
        Num handles: 1
        Handle: 0 Address: C0:07:E8:2C:B6:EE (OUI C0-07-E8)
        Count: 1
        Buffers: 0/3
        #157: len 9 (1 Kb/s)
        Latency: 50 msec (21-60 msec ~50 msec)
> ACL Data RX: Handle 0 flags 0x02 dlen 26                                                                         #159 12.487756
      ATT: Find Information Response (0x05) len 21
        Format: UUID-16 (0x01)
        Handle: 0x0133
        UUID: Track Position (0x2b99)
        Handle: 0x0134
        UUID: Client Characteristic Configuration (0x2902)
        Handle: 0x0135
        UUID: Characteristic (0x2803)
        Handle: 0x0136
        UUID: Playback Speed (0x2b9a)
        Handle: 0x0137
        UUID: Client Characteristic Configuration (0x2902)
zephyr.exe[1714909]: < HCI Command: Host Number of Completed Packets (0x03|0x0035) plen 5                          #160 12.506570
        Num handles: 1
        Handle: 0 Address: C0:07:E8:2C:B6:EE (OUI C0-07-E8)
        Count: 1
zephyr.exe[1714909]: < ACL Data TX: Handle 0 [1/3] flags 0x00 dlen 9                                               #161 12.507218
      ATT: Write Request (0x12) len 4
        Handle: 0x0134
          Data[2]: 0100
> HCI Event: Number of Completed Packets (0x13) plen 5                                                             #162 12.559187
        Num handles: 1
        Handle: 0 Address: C0:07:E8:2C:B6:EE (OUI C0-07-E8)
        Count: 1
        Buffers: 0/3
        #161: len 9 (1 Kb/s)
        Latency: 51 msec (21-60 msec ~51 msec)
> ACL Data RX: Handle 0 flags 0x02 dlen 5                                                                          #163 12.627526
      ATT: Write Response (0x13) len 0
zephyr.exe[1714909]: < HCI Command: Host Number of Completed Packets (0x03|0x0035) plen 5                          #164 12.646843
        Num handles: 1
        Handle: 0 Address: C0:07:E8:2C:B6:EE (OUI C0-07-E8)
        Count: 1
zephyr.exe[1714909]: < ACL Data TX: Handle 0 [1/3] flags 0x00 dlen 9                                               #165 12.647477
      ATT: Find Information Request (0x04) len 4
        Handle range: 0x0136-0x015e
> HCI Event: Number of Completed Packets (0x13) plen 5                                                             #166 12.697502
        Num handles: 1
        Handle: 0 Address: C0:07:E8:2C:B6:EE (OUI C0-07-E8)
        Count: 1
        Buffers: 0/3
        #165: len 9 (1 Kb/s)
        Latency: 50 msec (21-60 msec ~50 msec)
> ACL Data RX: Handle 0 flags 0x02 dlen 26                                                                         #167 12.767777
      ATT: Find Information Response (0x05) len 21
        Format: UUID-16 (0x01)
        Handle: 0x0136
        UUID: Playback Speed (0x2b9a)
        Handle: 0x0137
        UUID: Client Characteristic Configuration (0x2902)
        Handle: 0x0138
        UUID: Characteristic (0x2803)
        Handle: 0x0139
        UUID: Seeking Speed (0x2b9b)
        Handle: 0x013a
        UUID: Client Characteristic Configuration (0x2902)
zephyr.exe[1714909]: < HCI Command: Host Number of Completed Packets (0x03|0x0035) plen 5                          #168 12.786581
        Num handles: 1
        Handle: 0 Address: C0:07:E8:2C:B6:EE (OUI C0-07-E8)
        Count: 1
zephyr.exe[1714909]: < ACL Data TX: Handle 0 [1/3] flags 0x00 dlen 9                                               #169 12.788108
      ATT: Write Request (0x12) len 4
        Handle: 0x0137
          Data[2]: 0100
> HCI Event: Number of Completed Packets (0x13) plen 5                                                             #170 12.838082
        Num handles: 1
        Handle: 0 Address: C0:07:E8:2C:B6:EE (OUI C0-07-E8)
        Count: 1
        Buffers: 0/3
        #169: len 9 (1 Kb/s)
        Latency: 49 msec (21-60 msec ~50 msec)
> ACL Data RX: Handle 0 flags 0x02 dlen 5                                                                          #171 12.907495
      ATT: Write Response (0x13) len 0
zephyr.exe[1714909]: < HCI Command: Host Number of Completed Packets (0x03|0x0035) plen 5                          #172 12.926882
        Num handles: 1
        Handle: 0 Address: C0:07:E8:2C:B6:EE (OUI C0-07-E8)
        Count: 1
zephyr.exe[1714909]: < ACL Data TX: Handle 0 [1/3] flags 0x00 dlen 9                                               #173 12.927509
      ATT: Find Information Request (0x04) len 4
        Handle range: 0x0139-0x015e
> HCI Event: Number of Completed Packets (0x13) plen 5                                                             #174 12.977471
        Num handles: 1
        Handle: 0 Address: C0:07:E8:2C:B6:EE (OUI C0-07-E8)
        Count: 1
        Buffers: 0/3
        #173: len 9 (1 Kb/s)
        Latency: 49 msec (21-60 msec ~50 msec)
> ACL Data RX: Handle 0 flags 0x02 dlen 26                                                                         #175 13.047738
      ATT: Find Information Response (0x05) len 21
        Format: UUID-16 (0x01)
        Handle: 0x0139
        UUID: Seeking Speed (0x2b9b)
        Handle: 0x013a
        UUID: Client Characteristic Configuration (0x2902)
        Handle: 0x013b
        UUID: Characteristic (0x2803)
        Handle: 0x013c
        UUID: Current Track Segments Object ID (0x2b9c)
        Handle: 0x013d
        UUID: Characteristic (0x2803)
zephyr.exe[1714909]: < HCI Command: Host Number of Completed Packets (0x03|0x0035) plen 5                          #176 13.066580
        Num handles: 1
        Handle: 0 Address: C0:07:E8:2C:B6:EE (OUI C0-07-E8)
        Count: 1
zephyr.exe[1714909]: < ACL Data TX: Handle 0 [1/3] flags 0x00 dlen 9                                               #177 13.067295
      ATT: Write Request (0x12) len 4
        Handle: 0x013a
          Data[2]: 0100
> HCI Event: Number of Completed Packets (0x13) plen 5                                                             #178 13.117400
        Num handles: 1
        Handle: 0 Address: C0:07:E8:2C:B6:EE (OUI C0-07-E8)
        Count: 1
        Buffers: 0/3
        #177: len 9 (1 Kb/s)
        Latency: 50 msec (21-60 msec ~50 msec)
> ACL Data RX: Handle 0 flags 0x02 dlen 5                                                                          #179 13.187455
      ATT: Write Response (0x13) len 0
zephyr.exe[1714909]: < HCI Command: Host Number of Completed Packets (0x03|0x0035) plen 5                          #180 13.206926
        Num handles: 1
        Handle: 0 Address: C0:07:E8:2C:B6:EE (OUI C0-07-E8)
        Count: 1
zephyr.exe[1714909]: < ACL Data TX: Handle 0 [1/3] flags 0x00 dlen 9                                               #181 13.208121
      ATT: Find Information Request (0x04) len 4
        Handle range: 0x013e-0x015e
> HCI Event: Number of Completed Packets (0x13) plen 5                                                             #182 13.257495
        Num handles: 1
        Handle: 0 Address: C0:07:E8:2C:B6:EE (OUI C0-07-E8)
        Count: 1
        Buffers: 0/3
        #181: len 9 (1 Kb/s)
        Latency: 49 msec (21-60 msec ~49 msec)
> ACL Data RX: Handle 0 flags 0x02 dlen 26                                                                         #183 13.327807
      ATT: Find Information Response (0x05) len 21
        Format: UUID-16 (0x01)
        Handle: 0x013e
        UUID: Current Track Object ID (0x2b9d)
        Handle: 0x013f
        UUID: Client Characteristic Configuration (0x2902)
        Handle: 0x0140
        UUID: Characteristic (0x2803)
        Handle: 0x0141
        UUID: Next Track Object ID (0x2b9e)
        Handle: 0x0143
        UUID: Characteristic (0x2803)
zephyr.exe[1714909]: < HCI Command: Host Number of Completed Packets (0x03|0x0035) plen 5                          #184 13.346695
        Num handles: 1
        Handle: 0 Address: C0:07:E8:2C:B6:EE (OUI C0-07-E8)
        Count: 1
zephyr.exe[1714909]: < ACL Data TX: Handle 0 [1/3] flags 0x00 dlen 9                                               #185 13.347267
      ATT: Write Request (0x12) len 4
        Handle: 0x013f
          Data[2]: 0100
> HCI Event: Number of Completed Packets (0x13) plen 5                                                             #186 13.397543
        Num handles: 1
        Handle: 0 Address: C0:07:E8:2C:B6:EE (OUI C0-07-E8)
        Count: 1
        Buffers: 0/3
        #185: len 9 (1 Kb/s)
        Latency: 50 msec (21-60 msec ~50 msec)
> ACL Data RX: Handle 0 flags 0x02 dlen 5                                                                          #187 13.467435
      ATT: Write Response (0x13) len 0
zephyr.exe[1714909]: < HCI Command: Host Number of Completed Packets (0x03|0x0035) plen 5                          #188 13.486872
        Num handles: 1
        Handle: 0 Address: C0:07:E8:2C:B6:EE (OUI C0-07-E8)
        Count: 1
zephyr.exe[1714909]: < ACL Data TX: Handle 0 [1/3] flags 0x00 dlen 9                                               #189 13.486983
      ATT: Find Information Request (0x04) len 4
        Handle range: 0x015d-0x015e
> HCI Event: Number of Completed Packets (0x13) plen 5                                                             #190 13.537465
        Num handles: 1
        Handle: 0 Address: C0:07:E8:2C:B6:EE (OUI C0-07-E8)
        Count: 1
        Buffers: 0/3
        #189: len 9 (1 Kb/s)
        Latency: 50 msec (21-60 msec ~50 msec)
> ACL Data RX: Handle 0 flags 0x02 dlen 14                                                                         #191 13.607596
      ATT: Find Information Response (0x05) len 9
        Format: UUID-16 (0x01)
        Handle: 0x015d
        UUID: Parent Group Object ID (0x2b9f)
        Handle: 0x015e
        UUID: Client Characteristic Configuration (0x2902)
zephyr.exe[1714909]: < HCI Command: Host Number of Completed Packets (0x03|0x0035) plen 5                          #192 13.626586
        Num handles: 1
        Handle: 0 Address: C0:07:E8:2C:B6:EE (OUI C0-07-E8)
        Count: 1
zephyr.exe[1714909]: < ACL Data TX: Handle 0 [1/3] flags 0x00 dlen 9                                               #193 13.627776
      ATT: Write Request (0x12) len 4
        Handle: 0x015e
          Data[2]: 0100
> HCI Event: Number of Completed Packets (0x13) plen 5                                                             #194 13.677407
        Num handles: 1
        Handle: 0 Address: C0:07:E8:2C:B6:EE (OUI C0-07-E8)
        Count: 1
        Buffers: 0/3
        #193: len 9 (1 Kb/s)
        Latency: 49 msec (21-60 msec ~49 msec)
> ACL Data RX: Handle 0 flags 0x02 dlen 5                                                                          #195 13.747456
      ATT: Write Response (0x13) len 0
zephyr.exe[1714909]: < HCI Command: Host Number of Completed Packets (0x03|0x0035) plen 5                          #196 13.766774
        Num handles: 1
        Handle: 0 Address: C0:07:E8:2C:B6:EE (OUI C0-07-E8)
        Count: 1
zephyr.exe[1714909]: < ACL Data TX: Handle 0 [1/3] flags 0x00 dlen 9                                               #197 13.767487
      ATT: Find Information Request (0x04) len 4
        Handle range: 0x0144-0x015e
> HCI Event: Number of Completed Packets (0x13) plen 5                                                             #198 13.817453
        Num handles: 1
        Handle: 0 Address: C0:07:E8:2C:B6:EE (OUI C0-07-E8)
        Count: 1
        Buffers: 0/3
        #197: len 9 (1 Kb/s)
        Latency: 49 msec (21-60 msec ~49 msec)
> ACL Data RX: Handle 0 flags 0x02 dlen 26                                                                         #199 13.887715
      ATT: Find Information Response (0x05) len 21
        Format: UUID-16 (0x01)
        Handle: 0x0144
        UUID: Current Group Object ID (0x2ba0)
        Handle: 0x0145
        UUID: Client Characteristic Configuration (0x2902)
        Handle: 0x0146
        UUID: Characteristic (0x2803)
        Handle: 0x0147
        UUID: Playing Order (0x2ba1)
        Handle: 0x0148
        UUID: Client Characteristic Configuration (0x2902)
zephyr.exe[1714909]: < HCI Command: Host Number of Completed Packets (0x03|0x0035) plen 5                          #200 13.906592
        Num handles: 1
        Handle: 0 Address: C0:07:E8:2C:B6:EE (OUI C0-07-E8)
        Count: 1
zephyr.exe[1714909]: < ACL Data TX: Handle 0 [1/3] flags 0x00 dlen 9                                               #201 13.907728
      ATT: Write Request (0x12) len 4
        Handle: 0x0145
          Data[2]: 0100
> HCI Event: Number of Completed Packets (0x13) plen 5                                                             #202 13.957897
        Num handles: 1
        Handle: 0 Address: C0:07:E8:2C:B6:EE (OUI C0-07-E8)
        Count: 1
        Buffers: 0/3
        #201: len 9 (1 Kb/s)
        Latency: 50 msec (21-60 msec ~50 msec)
> ACL Data RX: Handle 0 flags 0x02 dlen 5                                                                          #203 14.027439
      ATT: Write Response (0x13) len 0
zephyr.exe[1714909]: < HCI Command: Host Number of Completed Packets (0x03|0x0035) plen 5                          #204 14.046813
        Num handles: 1
        Handle: 0 Address: C0:07:E8:2C:B6:EE (OUI C0-07-E8)
        Count: 1
zephyr.exe[1714909]: < ACL Data TX: Handle 0 [1/3] flags 0x00 dlen 9                                               #205 14.048202
      ATT: Find Information Request (0x04) len 4
        Handle range: 0x0147-0x015e
> HCI Event: Number of Completed Packets (0x13) plen 5                                                             #206 14.097440
        Num handles: 1
        Handle: 0 Address: C0:07:E8:2C:B6:EE (OUI C0-07-E8)
        Count: 1
        Buffers: 0/3
        #205: len 9 (1 Kb/s)
        Latency: 49 msec (21-60 msec ~49 msec)
> ACL Data RX: Handle 0 flags 0x02 dlen 26                                                                         #207 14.167735
      ATT: Find Information Response (0x05) len 21
        Format: UUID-16 (0x01)
        Handle: 0x0147
        UUID: Playing Order (0x2ba1)
        Handle: 0x0148
        UUID: Client Characteristic Configuration (0x2902)
        Handle: 0x0149
        UUID: Characteristic (0x2803)
        Handle: 0x014a
        UUID: Playing Orders Supported (0x2ba2)
        Handle: 0x014b
        UUID: Characteristic (0x2803)
zephyr.exe[1714909]: < HCI Command: Host Number of Completed Packets (0x03|0x0035) plen 5                          #208 14.186599
        Num handles: 1
        Handle: 0 Address: C0:07:E8:2C:B6:EE (OUI C0-07-E8)
        Count: 1
zephyr.exe[1714909]: < ACL Data TX: Handle 0 [1/3] flags 0x00 dlen 9                                               #209 14.186827
      ATT: Write Request (0x12) len 4
        Handle: 0x0148
          Data[2]: 0100
> HCI Event: Number of Completed Packets (0x13) plen 5                                                             #210 14.237903
        Num handles: 1
        Handle: 0 Address: C0:07:E8:2C:B6:EE (OUI C0-07-E8)
        Count: 1
        Buffers: 0/3
        #209: len 9 (1 Kb/s)
        Latency: 51 msec (21-60 msec ~50 msec)
> ACL Data RX: Handle 0 flags 0x02 dlen 5                                                                          #211 14.307469
      ATT: Write Response (0x13) len 0
zephyr.exe[1714909]: < HCI Command: Host Number of Completed Packets (0x03|0x0035) plen 5                          #212 14.326908
        Num handles: 1
        Handle: 0 Address: C0:07:E8:2C:B6:EE (OUI C0-07-E8)
        Count: 1
zephyr.exe[1714909]: < ACL Data TX: Handle 0 [1/3] flags 0x00 dlen 9                                               #213 14.327848
      ATT: Find Information Request (0x04) len 4
        Handle range: 0x014c-0x015e
> HCI Event: Number of Completed Packets (0x13) plen 5                                                             #214 14.377461
        Num handles: 1
        Handle: 0 Address: C0:07:E8:2C:B6:EE (OUI C0-07-E8)
        Count: 1
        Buffers: 0/3
        #213: len 9 (1 Kb/s)
        Latency: 49 msec (21-60 msec ~49 msec)
> ACL Data RX: Handle 0 flags 0x02 dlen 26                                                                         #215 14.447778
      ATT: Find Information Response (0x05) len 21
        Format: UUID-16 (0x01)
        Handle: 0x014c
        UUID: Media State (0x2ba3)
        Handle: 0x014d
        UUID: Client Characteristic Configuration (0x2902)
        Handle: 0x014e
        UUID: Characteristic (0x2803)
        Handle: 0x014f
        UUID: Media Control Point (0x2ba4)
        Handle: 0x0150
        UUID: Client Characteristic Configuration (0x2902)
zephyr.exe[1714909]: < HCI Command: Host Number of Completed Packets (0x03|0x0035) plen 5                          #216 14.466601
        Num handles: 1
        Handle: 0 Address: C0:07:E8:2C:B6:EE (OUI C0-07-E8)
        Count: 1
zephyr.exe[1714909]: < ACL Data TX: Handle 0 [1/3] flags 0x00 dlen 9                                               #217 14.466976
      ATT: Write Request (0x12) len 4
        Handle: 0x014d
          Data[2]: 0100
> HCI Event: Number of Completed Packets (0x13) plen 5                                                             #218 14.518084
        Num handles: 1
        Handle: 0 Address: C0:07:E8:2C:B6:EE (OUI C0-07-E8)
        Count: 1
        Buffers: 0/3
        #217: len 9 (1 Kb/s)
        Latency: 51 msec (21-60 msec ~50 msec)
> ACL Data RX: Handle 0 flags 0x02 dlen 5                                                                          #219 14.587427
      ATT: Write Response (0x13) len 0
zephyr.exe[1714909]: < HCI Command: Host Number of Completed Packets (0x03|0x0035) plen 5                          #220 14.606950
        Num handles: 1
        Handle: 0 Address: C0:07:E8:2C:B6:EE (OUI C0-07-E8)
        Count: 1
zephyr.exe[1714909]: < ACL Data TX: Handle 0 [1/3] flags 0x00 dlen 9                                               #221 14.608028
      ATT: Find Information Request (0x04) len 4
        Handle range: 0x014f-0x015e
> HCI Event: Number of Completed Packets (0x13) plen 5                                                             #222 14.657437
        Num handles: 1
        Handle: 0 Address: C0:07:E8:2C:B6:EE (OUI C0-07-E8)
        Count: 1
        Buffers: 0/3
        #221: len 9 (1 Kb/s)
        Latency: 49 msec (21-60 msec ~49 msec)
> ACL Data RX: Handle 0 flags 0x02 dlen 26                                                                         #223 14.727706
      ATT: Find Information Response (0x05) len 21
        Format: UUID-16 (0x01)
        Handle: 0x014f
        UUID: Media Control Point (0x2ba4)
        Handle: 0x0150
        UUID: Client Characteristic Configuration (0x2902)
        Handle: 0x0151
        UUID: Characteristic (0x2803)
        Handle: 0x0152
        UUID: Media Control Point Opcodes Supported (0x2ba5)
        Handle: 0x0153
        UUID: Client Characteristic Configuration (0x2902)
zephyr.exe[1714909]: < HCI Command: Host Number of Completed Packets (0x03|0x0035) plen 5                          #224 14.746608
        Num handles: 1
        Handle: 0 Address: C0:07:E8:2C:B6:EE (OUI C0-07-E8)
        Count: 1
zephyr.exe[1714909]: < ACL Data TX: Handle 0 [1/3] flags 0x00 dlen 9                                               #225 14.747361
      ATT: Write Request (0x12) len 4
        Handle: 0x0150
          Data[2]: 0100
> HCI Event: Number of Completed Packets (0x13) plen 5                                                             #226 14.799086
        Num handles: 1
        Handle: 0 Address: C0:07:E8:2C:B6:EE (OUI C0-07-E8)
        Count: 1
        Buffers: 0/3
        #225: len 9 (1 Kb/s)
        Latency: 51 msec (21-60 msec ~50 msec)
> ACL Data RX: Handle 0 flags 0x02 dlen 5                                                                          #227 14.867437
      ATT: Write Response (0x13) len 0
zephyr.exe[1714909]: < HCI Command: Host Number of Completed Packets (0x03|0x0035) plen 5                          #228 14.886901
        Num handles: 1
        Handle: 0 Address: C0:07:E8:2C:B6:EE (OUI C0-07-E8)
        Count: 1
zephyr.exe[1714909]: < ACL Data TX: Handle 0 [1/3] flags 0x00 dlen 9                                               #229 14.887958
      ATT: Find Information Request (0x04) len 4
        Handle range: 0x0152-0x015e
> HCI Event: Number of Completed Packets (0x13) plen 5                                                             #230 14.937374
        Num handles: 1
        Handle: 0 Address: C0:07:E8:2C:B6:EE (OUI C0-07-E8)
        Count: 1
        Buffers: 0/3
        #229: len 9 (1 Kb/s)
        Latency: 49 msec (21-60 msec ~50 msec)
> ACL Data RX: Handle 0 flags 0x02 dlen 26                                                                         #231 15.007668
      ATT: Find Information Response (0x05) len 21
        Format: UUID-16 (0x01)
        Handle: 0x0152
        UUID: Media Control Point Opcodes Supported (0x2ba5)
        Handle: 0x0153
        UUID: Client Characteristic Configuration (0x2902)
        Handle: 0x0154
        UUID: Characteristic (0x2803)
        Handle: 0x0155
        UUID: Search Results Object ID (0x2ba6)
        Handle: 0x0156
        UUID: Client Characteristic Configuration (0x2902)
zephyr.exe[1714909]: < HCI Command: Host Number of Completed Packets (0x03|0x0035) plen 5                          #232 15.026612
        Num handles: 1
        Handle: 0 Address: C0:07:E8:2C:B6:EE (OUI C0-07-E8)
        Count: 1
zephyr.exe[1714909]: < ACL Data TX: Handle 0 [1/3] flags 0x00 dlen 9                                               #233 15.027885
      ATT: Write Request (0x12) len 4
        Handle: 0x0153
          Data[2]: 0100
> HCI Event: Number of Completed Packets (0x13) plen 5                                                             #234 15.077371
        Num handles: 1
        Handle: 0 Address: C0:07:E8:2C:B6:EE (OUI C0-07-E8)
        Count: 1
        Buffers: 0/3
        #233: len 9 (1 Kb/s)
        Latency: 49 msec (21-60 msec ~49 msec)
> ACL Data RX: Handle 0 flags 0x02 dlen 5                                                                          #235 15.147465
      ATT: Write Response (0x13) len 0
zephyr.exe[1714909]: < HCI Command: Host Number of Completed Packets (0x03|0x0035) plen 5                          #236 15.166916
        Num handles: 1
        Handle: 0 Address: C0:07:E8:2C:B6:EE (OUI C0-07-E8)
        Count: 1
zephyr.exe[1714909]: < ACL Data TX: Handle 0 [1/3] flags 0x00 dlen 9                                               #237 15.167784
      ATT: Find Information Request (0x04) len 4
        Handle range: 0x0158-0x015e
> HCI Event: Number of Completed Packets (0x13) plen 5                                                             #238 15.217465
        Num handles: 1
        Handle: 0 Address: C0:07:E8:2C:B6:EE (OUI C0-07-E8)
        Count: 1
        Buffers: 0/3
        #237: len 9 (1 Kb/s)
        Latency: 49 msec (21-60 msec ~49 msec)
> ACL Data RX: Handle 0 flags 0x02 dlen 26                                                                         #239 15.287795
      ATT: Find Information Response (0x05) len 21
        Format: UUID-16 (0x01)
        Handle: 0x0158
        UUID: Search Control Point (0x2ba7)
        Handle: 0x0159
        UUID: Client Characteristic Configuration (0x2902)
        Handle: 0x015a
        UUID: Characteristic (0x2803)
        Handle: 0x015b
        UUID: Content Control ID (0x2bba)
        Handle: 0x015c
        UUID: Characteristic (0x2803)
zephyr.exe[1714909]: < HCI Command: Host Number of Completed Packets (0x03|0x0035) plen 5                          #240 15.314166
        Num handles: 1
        Handle: 0 Address: C0:07:E8:2C:B6:EE (OUI C0-07-E8)
        Count: 1
zephyr.exe[1714909]: < ACL Data TX: Handle 0 [1/3] flags 0x00 dlen 9                                               #241 15.314339
      ATT: Write Request (0x12) len 4
        Handle: 0x0159
          Data[2]: 0100
> HCI Event: Number of Completed Packets (0x13) plen 5                                                             #242 15.358312
        Num handles: 1
        Handle: 0 Address: C0:07:E8:2C:B6:EE (OUI C0-07-E8)
        Count: 1
        Buffers: 0/3
        #241: len 9 (1 Kb/s)
        Latency: 43 msec (21-60 msec ~46 msec)
> ACL Data RX: Handle 0 flags 0x02 dlen 5                                                                          #243 15.427473
      ATT: Write Response (0x13) len 0
zephyr.exe[1714909]: < HCI Command: Host Number of Completed Packets (0x03|0x0035) plen 5                          #244 15.446869
        Num handles: 1
        Handle: 0 Address: C0:07:E8:2C:B6:EE (OUI C0-07-E8)
        Count: 1
zephyr.exe[1714909]: < ACL Data TX: Handle 0 [1/3] flags 0x00 dlen 9                                               #245 15.447543
      ATT: Find Information Request (0x04) len 4
        Handle range: 0x0155-0x015e
> HCI Event: Number of Completed Packets (0x13) plen 5                                                             #246 15.497407
        Num handles: 1
        Handle: 0 Address: C0:07:E8:2C:B6:EE (OUI C0-07-E8)
        Count: 1
        Buffers: 0/3
        #245: len 9 (1 Kb/s)
        Latency: 49 msec (21-60 msec ~48 msec)
> ACL Data RX: Handle 0 flags 0x02 dlen 26                                                                         #247 15.567670
      ATT: Find Information Response (0x05) len 21
        Format: UUID-16 (0x01)
        Handle: 0x0155
        UUID: Search Results Object ID (0x2ba6)
        Handle: 0x0156
        UUID: Client Characteristic Configuration (0x2902)
        Handle: 0x0157
        UUID: Characteristic (0x2803)
        Handle: 0x0158
        UUID: Search Control Point (0x2ba7)
        Handle: 0x0159
        UUID: Client Characteristic Configuration (0x2902)
zephyr.exe[1714909]: < HCI Command: Host Number of Completed Packets (0x03|0x0035) plen 5                          #248 15.589129
        Num handles: 1
        Handle: 0 Address: C0:07:E8:2C:B6:EE (OUI C0-07-E8)
        Count: 1
zephyr.exe[1714909]: < ACL Data TX: Handle 0 [1/3] flags 0x00 dlen 9                                               #249 15.589506
      ATT: Write Request (0x12) len 4
        Handle: 0x0156
          Data[2]: 0100
> HCI Event: Number of Completed Packets (0x13) plen 5                                                             #250 15.637631
        Num handles: 1
        Handle: 0 Address: C0:07:E8:2C:B6:EE (OUI C0-07-E8)
        Count: 1
        Buffers: 0/3
        #249: len 9 (1 Kb/s)
        Latency: 48 msec (21-60 msec ~48 msec)
> ACL Data RX: Handle 0 flags 0x02 dlen 5                                                                          #251 15.707363
      ATT: Write Response (0x13) len 0
zephyr.exe[1714909]: < HCI Command: Host Number of Completed Packets (0x03|0x0035) plen 5                          #252 15.726914
        Num handles: 1
        Handle: 0 Address: C0:07:E8:2C:B6:EE (OUI C0-07-E8)
        Count: 1
zephyr.exe[1714909]: < ACL Data TX: Handle 0 [1/3] flags 0x00 dlen 11                                              #253 15.727900
      ATT: Read By Type Request (0x08) len 6
        Handle range: 0x0121-0x015e
        Attribute type: Include (0x2802)
> HCI Event: Number of Completed Packets (0x13) plen 5                                                             #254 15.777378
        Num handles: 1
        Handle: 0 Address: C0:07:E8:2C:B6:EE (OUI C0-07-E8)
        Count: 1
        Buffers: 0/3
        #253: len 11 (1 Kb/s)
        Latency: 49 msec (21-60 msec ~48 msec)
> ACL Data RX: Handle 0 flags 0x02 dlen 14                                                                         #255 15.847530
      ATT: Read By Type Response (0x09) len 9
        Attribute data length: 8
        Attribute data list: 1 entry
        Handle: 0x0121
        Value[6]: 70018f012518
zephyr.exe[1714909]: < HCI Command: Host Number of Completed Packets (0x03|0x0035) plen 5                          #256 15.866913
        Num handles: 1
        Handle: 0 Address: C0:07:E8:2C:B6:EE (OUI C0-07-E8)
        Count: 1
zephyr.exe[1714909]: < ACL Data TX: Handle 0 [1/3] flags 0x00 dlen 11                                              #257 15.867568
      ATT: Read By Type Request (0x08) len 6
        Handle range: 0x0170-0x018f
        Attribute type: Characteristic (0x2803)
> HCI Event: Number of Completed Packets (0x13) plen 5                                                             #258 15.917405
        Num handles: 1
        Handle: 0 Address: C0:07:E8:2C:B6:EE (OUI C0-07-E8)
        Count: 1
        Buffers: 0/3
        #257: len 11 (1 Kb/s)
        Latency: 49 msec (21-60 msec ~49 msec)
> ACL Data RX: Handle 0 flags 0x02 dlen 27                                                                         #259 15.987712
      ATT: Read By Type Response (0x09) len 22
        Attribute data length: 7
        Attribute data list: 3 entries
        Handle: 0x0171
        Value[5]: 027201bd2a
            Properties: 0x02
              Read (0x02)
            Value Handle: 0x0172
            Value UUID: OTS Feature (0x2abd)
        Handle: 0x0173
        Value[5]: 0a7401be2a
            Properties: 0x0a
              Read (0x02)
              Write (0x08)
            Value Handle: 0x0174
            Value UUID: Object Name (0x2abe)
        Handle: 0x0175
        Value[5]: 027601bf2a
            Properties: 0x02
              Read (0x02)
            Value Handle: 0x0176
            Value UUID: Object Type (0x2abf)
zephyr.exe[1714909]: < HCI Command: Host Number of Completed Packets (0x03|0x0035) plen 5                          #260 16.006620
        Num handles: 1
        Handle: 0 Address: C0:07:E8:2C:B6:EE (OUI C0-07-E8)
        Count: 1
zephyr.exe[1714909]: < ACL Data TX: Handle 0 [1/3] flags 0x00 dlen 11                                              #261 16.006747
      ATT: Read By Type Request (0x08) len 6
        Handle range: 0x0176-0x018f
        Attribute type: Characteristic (0x2803)
> HCI Event: Number of Completed Packets (0x13) plen 5                                                             #262 16.057419
        Num handles: 1
        Handle: 0 Address: C0:07:E8:2C:B6:EE (OUI C0-07-E8)
        Count: 1
        Buffers: 0/3
        #261: len 11 (1 Kb/s)
        Latency: 50 msec (21-60 msec ~50 msec)
> ACL Data RX: Handle 0 flags 0x02 dlen 27                                                                         #263 16.127612
      ATT: Read By Type Response (0x09) len 22
        Attribute data length: 7
        Attribute data list: 3 entries
        Handle: 0x0177
        Value[5]: 027801c02a
            Properties: 0x02
              Read (0x02)
            Value Handle: 0x0178
            Value UUID: Object Size (0x2ac0)
        Handle: 0x0179
        Value[5]: 0a7a01c12a
            Properties: 0x0a
              Read (0x02)
              Write (0x08)
            Value Handle: 0x017a
            Value UUID: Object First-Created (0x2ac1)
        Handle: 0x017b
        Value[5]: 0a7c01c22a
            Properties: 0x0a
              Read (0x02)
              Write (0x08)
            Value Handle: 0x017c
            Value UUID: Object Last-Modified (0x2ac2)
zephyr.exe[1714909]: < HCI Command: Host Number of Completed Packets (0x03|0x0035) plen 5                          #264 16.149083
        Num handles: 1
        Handle: 0 Address: C0:07:E8:2C:B6:EE (OUI C0-07-E8)
        Count: 1
zephyr.exe[1714909]: < ACL Data TX: Handle 0 [1/3] flags 0x00 dlen 11                                              #265 16.149199
      ATT: Read By Type Request (0x08) len 6
        Handle range: 0x017c-0x018f
        Attribute type: Characteristic (0x2803)
> HCI Event: Number of Completed Packets (0x13) plen 5                                                             #266 16.197418
        Num handles: 1
        Handle: 0 Address: C0:07:E8:2C:B6:EE (OUI C0-07-E8)
        Count: 1
        Buffers: 0/3
        #265: len 11 (1 Kb/s)
        Latency: 48 msec (21-60 msec ~49 msec)
> ACL Data RX: Handle 0 flags 0x02 dlen 27                                                                         #267 16.267638
      ATT: Read By Type Response (0x09) len 22
        Attribute data length: 7
        Attribute data list: 3 entries
        Handle: 0x017d
        Value[5]: 027e01c32a
            Properties: 0x02
              Read (0x02)
            Value Handle: 0x017e
            Value UUID: Object ID (0x2ac3)
        Handle: 0x017f
        Value[5]: 0a8001c42a
            Properties: 0x0a
              Read (0x02)
              Write (0x08)
            Value Handle: 0x0180
            Value UUID: Object Properties (0x2ac4)
        Handle: 0x0181
        Value[5]: 288201c52a
            Properties: 0x28
              Write (0x08)
              Indicate (0x20)
            Value Handle: 0x0182
            Value UUID: Object Action Control Point (0x2ac5)
zephyr.exe[1714909]: < HCI Command: Host Number of Completed Packets (0x03|0x0035) plen 5                          #268 16.289081
        Num handles: 1
        Handle: 0 Address: C0:07:E8:2C:B6:EE (OUI C0-07-E8)
        Count: 1
zephyr.exe[1714909]: < ACL Data TX: Handle 0 [1/3] flags 0x00 dlen 9                                               #269 16.289202
      ATT: Find Information Request (0x04) len 4
        Handle range: 0x0182-0x018f
> HCI Event: Number of Completed Packets (0x13) plen 5                                                             #270 16.337416
        Num handles: 1
        Handle: 0 Address: C0:07:E8:2C:B6:EE (OUI C0-07-E8)
        Count: 1
        Buffers: 0/3
        #269: len 9 (1 Kb/s)
        Latency: 48 msec (21-60 msec ~48 msec)
> ACL Data RX: Handle 0 flags 0x02 dlen 26                                                                         #271 16.407720
      ATT: Find Information Response (0x05) len 21
        Format: UUID-16 (0x01)
        Handle: 0x0182
        UUID: Object Action Control Point (0x2ac5)
        Handle: 0x0183
        UUID: Client Characteristic Configuration (0x2902)
        Handle: 0x0184
        UUID: Characteristic (0x2803)
        Handle: 0x0185
        UUID: Object List Control Point (0x2ac6)
        Handle: 0x0186
        UUID: Client Characteristic Configuration (0x2902)
zephyr.exe[1714909]: < HCI Command: Host Number of Completed Packets (0x03|0x0035) plen 5                          #272 16.426622
        Num handles: 1
        Handle: 0 Address: C0:07:E8:2C:B6:EE (OUI C0-07-E8)
        Count: 1
zephyr.exe[1714909]: < ACL Data TX: Handle 0 [1/3] flags 0x00 dlen 11                                              #273 16.431083
      ATT: Read By Type Request (0x08) len 6
        Handle range: 0x0182-0x018f
        Attribute type: Characteristic (0x2803)
> HCI Event: Number of Completed Packets (0x13) plen 5                                                             #274 16.477964
        Num handles: 1
        Handle: 0 Address: C0:07:E8:2C:B6:EE (OUI C0-07-E8)
        Count: 1
        Buffers: 0/3
        #273: len 11 (1 Kb/s)
        Latency: 46 msec (21-60 msec ~47 msec)
> ACL Data RX: Handle 0 flags 0x02 dlen 27                                                                         #275 16.547655
      ATT: Read By Type Response (0x09) len 22
        Attribute data length: 7
        Attribute data list: 3 entries
        Handle: 0x0184
        Value[5]: 288501c62a
            Properties: 0x28
              Write (0x08)
              Indicate (0x20)
            Value Handle: 0x0185
            Value UUID: Object List Control Point (0x2ac6)
        Handle: 0x0187
        Value[5]: 0a8801c72a
            Properties: 0x0a
              Read (0x02)
              Write (0x08)
            Value Handle: 0x0188
            Value UUID: Object List Filter (0x2ac7)
        Handle: 0x0189
        Value[5]: 208a01c82a
            Properties: 0x20
              Indicate (0x20)
            Value Handle: 0x018a
            Value UUID: Object Changed (0x2ac8)
zephyr.exe[1714909]: < HCI Command: Host Number of Completed Packets (0x03|0x0035) plen 5                          #276 16.566624
        Num handles: 1
        Handle: 0 Address: C0:07:E8:2C:B6:EE (OUI C0-07-E8)
        Count: 1
zephyr.exe[1714909]: < ACL Data TX: Handle 0 [1/3] flags 0x00 dlen 9                                               #277 16.567651
      ATT: Write Request (0x12) len 4
        Handle: 0x0183
          Data[2]: 0200
> HCI Event: Number of Completed Packets (0x13) plen 5                                                             #278 16.618433
        Num handles: 1
        Handle: 0 Address: C0:07:E8:2C:B6:EE (OUI C0-07-E8)
        Count: 1
        Buffers: 0/3
        #277: len 9 (1 Kb/s)
        Latency: 50 msec (21-60 msec ~49 msec)
> ACL Data RX: Handle 0 flags 0x02 dlen 5                                                                          #279 16.687368
      ATT: Write Response (0x13) len 0
zephyr.exe[1714909]: < HCI Command: Host Number of Completed Packets (0x03|0x0035) plen 5                          #280 16.706948
        Num handles: 1
        Handle: 0 Address: C0:07:E8:2C:B6:EE (OUI C0-07-E8)
        Count: 1
zephyr.exe[1714909]: < ACL Data TX: Handle 0 [1/3] flags 0x00 dlen 9                                               #281 16.707636
      ATT: Find Information Request (0x04) len 4
        Handle range: 0x0185-0x018f
> HCI Event: Number of Completed Packets (0x13) plen 5                                                             #282 16.757342
        Num handles: 1
        Handle: 0 Address: C0:07:E8:2C:B6:EE (OUI C0-07-E8)
        Count: 1
        Buffers: 0/3
        #281: len 9 (1 Kb/s)
        Latency: 49 msec (21-60 msec ~49 msec)
> ACL Data RX: Handle 0 flags 0x02 dlen 26                                                                         #283 16.827882
      ATT: Find Information Response (0x05) len 21
        Format: UUID-16 (0x01)
        Handle: 0x0185
        UUID: Object List Control Point (0x2ac6)
        Handle: 0x0186
        UUID: Client Characteristic Configuration (0x2902)
        Handle: 0x0187
        UUID: Characteristic (0x2803)
        Handle: 0x0188
        UUID: Object List Filter (0x2ac7)
        Handle: 0x0189
        UUID: Characteristic (0x2803)
zephyr.exe[1714909]: < HCI Command: Host Number of Completed Packets (0x03|0x0035) plen 5                          #284 16.847151
        Num handles: 1
        Handle: 0 Address: C0:07:E8:2C:B6:EE (OUI C0-07-E8)
        Count: 1
zephyr.exe[1714909]: < ACL Data TX: Handle 0 [1/3] flags 0x00 dlen 11                                              #285 16.848485
      ATT: Read By Type Request (0x08) len 6
        Handle range: 0x018a-0x018f
        Attribute type: Characteristic (0x2803)
> HCI Event: Number of Completed Packets (0x13) plen 5                                                             #286 16.898088
        Num handles: 1
        Handle: 0 Address: C0:07:E8:2C:B6:EE (OUI C0-07-E8)
        Count: 1
        Buffers: 0/3
        #285: len 11 (1 Kb/s)
        Latency: 49 msec (21-60 msec ~49 msec)
> ACL Data RX: Handle 0 flags 0x02 dlen 20                                                                         #287 16.967502
      ATT: Read By Type Response (0x09) len 15
        Attribute data length: 7
        Attribute data list: 2 entries
        Handle: 0x018c
        Value[5]: 0a8d01c72a
            Properties: 0x0a
              Read (0x02)
              Write (0x08)
            Value Handle: 0x018d
            Value UUID: Object List Filter (0x2ac7)
        Handle: 0x018e
        Value[5]: 0a8f01c72a
            Properties: 0x0a
              Read (0x02)
              Write (0x08)
            Value Handle: 0x018f
            Value UUID: Object List Filter (0x2ac7)
zephyr.exe[1714909]: < H