Bluetooth monitor ver 5.72
= Note: Linux version 6.14.0-36-generic (x86_64)                       0.318476
= Note: Bluetooth subsystem version 2.22                               0.318478
= New Index: 00:00:00:00:00:00 (Primary,UART,hci2)              [hci2] 0.318479
= New Index: 00:00:00:00:00:00 (Primary,UART,hci1)              [hci1] 0.318479
= New Index: 48:5F:99:8E:E0:64 (Primary,USB,hci0)               [hci0] 0.318480
= Open Index: 00:00:00:00:00:00                                 [hci1] 0.461885
= Index Info: 00:00:00:00:00:00 (Nordic Semiconductor ASA)      [hci1] 0.461897
@ USER Open: main (privileged) version 2.22            {0x0001} [hci1] 0.461904
< HCI Command: Reset (0x03|0x0003) plen 0                    #1 [hci1] 0.462684
> HCI Event: Command Complete (0x0e) plen 4                  #2 [hci1] 0.463277
      Reset (0x03|0x0003) ncmd 1
        Status: Success (0x00)
< HCI Command: Read Local Supported... (0x04|0x0003) plen 0  #3 [hci1] 0.481643
> HCI Event: Command Complete (0x0e) plen 12                 #4 [hci1] 0.482087
      Read Local Supported Features (0x04|0x0003) ncmd 1
        Status: Success (0x00)
        Features: 0x00 0x00 0x00 0x00 0x60 0x00 0x00 0x00
          BR/EDR Not Supported
          LE Supported (Controller)
< HCI Command: Read Local Version In.. (0x04|0x0001) plen 0  #5 [hci1] 0.501645
> HCI Event: Command Complete (0x0e) plen 12                 #6 [hci1] 0.502172
      Read Local Version Information (0x04|0x0001) ncmd 1
        Status: Success (0x00)
        HCI version: Reserved (0x11) - Revision 12345 (0x3039)
        LMP version: Reserved (0x11) - Subversion 12345 (0x3039)
        Manufacturer: Nordic Semiconductor ASA (89)
< HCI Command: Read Local Supported... (0x04|0x0002) plen 0  #7 [hci1] 0.521629
> HCI Event: Command Complete (0x0e) plen 68                 #8 [hci1] 0.522754
      Read Local Supported Commands (0x04|0x0002) ncmd 1
        Status: Success (0x00)
        Commands: 115 entries
          Disconnect (Octet 0 - Bit 5)
          Read Remote Version Information (Octet 2 - Bit 7)
          Set Event Mask (Octet 5 - Bit 6)
          Reset (Octet 5 - Bit 7)
          Read Connection Accept Timeout (Octet 7 - Bit 2)
          Write Connection Accept Timeout (Octet 7 - Bit 3)
          Read Transmit Power Level (Octet 10 - Bit 2)
          Set Controller To Host Flow Control (Octet 10 - Bit 5)
          Host Buffer Size (Octet 10 - Bit 6)
          Host Number of Completed Packets (Octet 10 - Bit 7)
          Read Local Version Information (Octet 14 - Bit 3)
          Read Local Supported Features (Octet 14 - Bit 5)
          Read BD ADDR (Octet 15 - Bit 1)
          Read RSSI (Octet 15 - Bit 5)
          Set Event Mask Page 2 (Octet 22 - Bit 2)
          LE Set Event Mask (Octet 25 - Bit 0)
          LE Read Buffer Size (Octet 25 - Bit 1)
          LE Read Local Supported Features (Octet 25 - Bit 2)
          LE Set Random Address (Octet 25 - Bit 4)
          LE Set Advertising Parameters (Octet 25 - Bit 5)
          LE Read Advertising Channel TX Power (Octet 25 - Bit 6)
          LE Set Advertising Data (Octet 25 - Bit 7)
          LE Set Scan Response Data (Octet 26 - Bit 0)
          LE Set Advertise Enable (Octet 26 - Bit 1)
          LE Set Scan Parameters (Octet 26 - Bit 2)
          LE Set Scan Enable (Octet 26 - Bit 3)
          LE Create Connection (Octet 26 - Bit 4)
          LE Create Connection Cancel (Octet 26 - Bit 5)
          LE Read Accept List Size (Octet 26 - Bit 6)
          LE Clear Accept List (Octet 26 - Bit 7)
          LE Add Device To Accept List (Octet 27 - Bit 0)
          LE Remove Device From Accept List (Octet 27 - Bit 1)
          LE Connection Update (Octet 27 - Bit 2)
          LE Set Host Channel Classification (Octet 27 - Bit 3)
          LE Read Channel Map (Octet 27 - Bit 4)
          LE Read Remote Used Features (Octet 27 - Bit 5)
          LE Encrypt (Octet 27 - Bit 6)
          LE Rand (Octet 27 - Bit 7)
          LE Start Encryption (Octet 28 - Bit 0)
          LE Long Term Key Request Reply (Octet 28 - Bit 1)
          LE Long Term Key Request Neg Reply (Octet 28 - Bit 2)
          LE Read Supported States (Octet 28 - Bit 3)
          Read Authenticated Payload Timeout (Octet 32 - Bit 4)
          Write Authenticated Payload Timeout (Octet 32 - Bit 5)
          LE Set Data Length (Octet 33 - Bit 6)
          LE Read Suggested Default Data Length (Octet 33 - Bit 7)
          LE Write Suggested Default Data Length (Octet 34 - Bit 0)
          LE Add Device To Resolving List (Octet 34 - Bit 3)
          LE Remove Device From Resolving List (Octet 34 - Bit 4)
          LE Clear Resolving List (Octet 34 - Bit 5)
          LE Read Resolving List Size (Octet 34 - Bit 6)
          LE Set Address Resolution Enable (Octet 35 - Bit 1)
          LE Set Resolvable Private Address Timeout (Octet 35 - Bit 2)
          LE Read Maximum Data Length (Octet 35 - Bit 3)
          LE Read PHY (Octet 35 - Bit 4)
          LE Set Default PHY (Octet 35 - Bit 5)
          LE Set PHY (Octet 35 - Bit 6)
          LE Set Advertising Set Random Address (Octet 36 - Bit 1)
          LE Set Extended Advertising Parameters (Octet 36 - Bit 2)
          LE Set Extended Advertising Data (Octet 36 - Bit 3)
          LE Set Extended Scan Response Data (Octet 36 - Bit 4)
          LE Set Extended Advertising Enable (Octet 36 - Bit 5)
          LE Read Maximum Advertising Data Length (Octet 36 - Bit 6)
          LE Read Number of Supported Advertising Sets (Octet 36 - Bit 7)
          LE Remove Advertising Set (Octet 37 - Bit 0)
          LE Clear Advertising Sets (Octet 37 - Bit 1)
          LE Set Periodic Advertising Parameters (Octet 37 - Bit 2)
          LE Set Periodic Advertising Data (Octet 37 - Bit 3)
          LE Set Periodic Advertising Enable (Octet 37 - Bit 4)
          LE Set Extended Scan Parameters (Octet 37 - Bit 5)
          LE Set Extended Scan Enable (Octet 37 - Bit 6)
          LE Extended Create Connection (Octet 37 - Bit 7)
          LE Periodic Advertising Create Sync (Octet 38 - Bit 0)
          LE Periodic Advertising Create Sync Cancel (Octet 38 - Bit 1)
          LE Periodic Advertising Terminate Sync (Octet 38 - Bit 2)
          LE Add Device To Periodic Advertiser List (Octet 38 - Bit 3)
          LE Remove Device From Periodic Advertiser List (Octet 38 - Bit 4)
          LE Clear Periodic Advertiser List (Octet 38 - Bit 5)
          LE Read Periodic Advertiser List Size (Octet 38 - Bit 6)
          LE Read Transmit Power (Octet 38 - Bit 7)
          LE Read RF Path Compensation (Octet 39 - Bit 0)
          LE Write RF Path Compensation (Octet 39 - Bit 1)
          LE Set Privacy Mode (Octet 39 - Bit 2)
          LE Periodic Advertising Receive Enable (Octet 40 - Bit 5)
          LE Periodic Advertising Sync Transfer (Octet 40 - Bit 6)
          LE Periodic Advertising Set Info Transfer (Octet 40 - Bit 7)
          LE Periodic Advertising Sync Transfer Parameters (Octet 41 - Bit 0)
          LE Set Default Periodic Advertisng Sync Transfer Parameters (Octet 41 - Bit 1)
          LE Read Buffer v2 (Octet 41 - Bit 5)
          LE Read ISO TX Sync (Octet 41 - Bit 6)
          LE Set Connected Isochronous Group Parameters (Octet 41 - Bit 7)
          LE Set Connected Isochronous Group Parameters Test (Octet 42 - Bit 0)
          LE Create Connected Isochronous Stream (Octet 42 - Bit 1)
          LE Remove Connected Isochronous Group (Octet 42 - Bit 2)
          LE Accept Connected Isochronous Stream Request (Octet 42 - Bit 3)
          LE Reject Connected Isochronous Stream Request (Octet 42 - Bit 4)
          LE Create Broadcast Isochronous Group (Octet 42 - Bit 5)
          LE Create Broadcast Isochronous Group Test (Octet 42 - Bit 6)
          LE Terminate Broadcast Isochronous Group (Octet 42 - Bit 7)
          LE Broadcast Isochronous Group Create Sync (Octet 43 - Bit 0)
          LE Broadcast Isochronous Group Terminate Sync (Octet 43 - Bit 1)
          LE Request Peer SCA (Octet 43 - Bit 2)
          LE Setup Isochronous Data Path (Octet 43 - Bit 3)
          LE Remove Isochronous Data Path (Octet 43 - Bit 4)
          LE Isochronous Transmit Test (Octet 43 - Bit 5)
          LE Isochronous Receive Test (Octet 43 - Bit 6)
          LE Isochronous Read Test Counters (Octet 43 - Bit 7)
          LE Isochronous Read Test Counters (Octet 44 - Bit 0)
          LE Set Host Feature (Octet 44 - Bit 1)
          Octet 44 - Bit 2 
          Octet 45 - Bit 6 
          Octet 46 - Bit 0 
          Octet 46 - Bit 1 
          Octet 46 - Bit 2 
          Octet 47 - Bit 4 
< HCI Command: Host Buffer Size (0x03|0x0033) plen 7         #9 [hci1] 0.541658
        ACL MTU: 255  ACL max packet: 16
        SCO MTU: 0    SCO max packet: 0
> HCI Event: Command Complete (0x0e) plen 4                 #10 [hci1] 0.542208
      Host Buffer Size (0x03|0x0033) ncmd 1
        Status: Success (0x00)
< HCI Command: Set Controller To Ho.. (0x03|0x0031) plen 1  #11 [hci1] 0.561608
        Flow control: ACL Data Packets (0x01)
> HCI Event: Command Complete (0x0e) plen 4                 #12 [hci1] 0.562071
      Set Controller To Host Flow Control (0x03|0x0031) ncmd 1
        Status: Success (0x00)
< HCI Command: LE Read Local Suppor.. (0x08|0x0003) plen 0  #13 [hci1] 0.581619
> HCI Event: Command Complete (0x0e) plen 12                #14 [hci1] 0.582257
      LE Read Local Supported Features (0x08|0x0003) ncmd 1
        Status: Success (0x00)
        Features: 0xfd 0x79 0x00 0xf7 0x30 0x01 0x00 0x00
          LE Encryption
          Extended Reject Indication
          Peripheral-initiated Features Exchange
          LE Ping
          LE Data Packet Length Extension
          LL Privacy
          Extended Scanner Filter Policies
          LE 2M PHY
          LE Coded PHY
          LE Extended Advertising
          LE Periodic Advertising
          Channel Selection Algorithm #2
          Periodic Advertising Sync Transfer - Sender
          Periodic Advertising Sync Transfer - Recipient
          Sleep Clock Accuracy Updates
          Connected Isochronous Stream - Central
          Connected Isochronous Stream - Peripheral
          Isochronous Broadcaster
          Synchronized Receiver
          Periodic Advertising ADI support
          Connection Subrating
          Unknown features (0x0000010000000000)
< HCI Command: LE Set Host Feature (0x08|0x0074) plen 2     #15 [hci1] 0.601613
        Bit Number: 32
          Connected Isochronous Stream (Host Support)
        Bit Value: 1
> HCI Event: Command Complete (0x0e) plen 4                 #16 [hci1] 0.602106
      LE Set Host Feature (0x08|0x0074) ncmd 1
        Status: Success (0x00)
< HCI Command: LE Read Buffer v2 (0x08|0x0060) plen 0       #17 [hci1] 0.621612
> HCI Event: Command Complete (0x0e) plen 10                #18 [hci1] 0.622144
      LE Read Buffer v2 (0x08|0x0060) ncmd 1
        Status: Success (0x00)
        ACL MTU: 27
        ACL max packet: 3
        ISO MTU: 318
        ISO max packet: 3
< HCI Command: LE Read Maximum Adve.. (0x08|0x003a) plen 0  #19 [hci1] 0.641638
> HCI Event: Command Complete (0x0e) plen 6                 #20 [hci1] 0.642175
      LE Read Maximum Advertising Data Length (0x08|0x003a) ncmd 1
        Status: Success (0x00)
        Max length: 1650
< HCI Command: LE Read Supported St.. (0x08|0x001c) plen 0  #21 [hci1] 0.661623
> HCI Event: Command Complete (0x0e) plen 12                #22 [hci1] 0.662084
      LE Read Supported States (0x08|0x001c) ncmd 1
        Status: Success (0x00)
        States: 0x000003ff3e0306ff
          Non-connectable Advertising State
          Scannable Advertising State
          Connectable Advertising State
          High Duty Cycle Directed Advertising State
          Passive Scanning State
          Active Scanning State
          Initiating State
            and Connection State (Central Role)
          Connection State (Peripheral Role)
          Scannable Advertising State
            and Passive Scanning State
          Connectable Advertising State
            and Passive Scanning State
          Non-connectable Advertising State
            and Initiating State
          Scannable Advertising State
            and Initiating State
          Active Scanning State
            and Connection State (Central Role)
          Passive Scanning State
            and Connection State (Peripheral Role)
          Active Scanning State
            and Connection State (Peripheral Role)
          Initiating State
            and Connection State (Central Role)
            and Central Role & Central Role
          Low Duty Cycle Directed Advertising State
          Connectable Advertising State
            and Initiating State
            and Central Role & Peripheral Role
          High Duty Cycle Directed Advertising State
            and Initiating State
            and Central Role & Peripheral Role
          Low Duty Cycle Directed Advertising State
            and Initiating State
            and Central Role & Peripheral Role
          Connectable Advertising State
            and Connection State (Central Role)
            and Central Role & Peripheral Role
          High Duty Cycle Directed Advertising State
            and Connection State (Central Role)
            and Central Role & Peripheral Role
          Low Duty Cycle Directed Advertising State
            and Connection State (Central Role)
            and Central Role & Peripheral Role
          Connectable Advertising State
            and Connection State (Peripheral Role)
            and Central Role & Peripheral Role
          High Duty Cycle Directed Advertising State
            and Connection State (Peripheral Role)
            and Peripheral Role & Peripheral Role
          Low Duty Cycle Directed Advertising State
            and Connection State (Peripheral Role)
            and Peripheral Role & Peripheral Role
          Initiating State
            and Connection State (Peripheral Role)
            and Central Role & Peripheral Role
< HCI Command: LE Read Maximum Data.. (0x08|0x002f) plen 0  #23 [hci1] 0.681604
> HCI Event: Command Complete (0x0e) plen 12                #24 [hci1] 0.682167
      LE Read Maximum Data Length (0x08|0x002f) ncmd 1
        Status: Success (0x00)
        Max TX octets: 251
        Max TX time: 2704
        Max RX octets: 251
        Max RX time: 2704
< HCI Command: LE Write Suggested D.. (0x08|0x0024) plen 4  #25 [hci1] 0.701606
        TX octets: 251
        TX time: 2704
> HCI Event: Command Complete (0x0e) plen 4                 #26 [hci1] 0.702134
      LE Write Suggested Default Data Length (0x08|0x0024) ncmd 1
        Status: Success (0x00)
< HCI Command: LE Read Resolving Li.. (0x08|0x002a) plen 0  #27 [hci1] 0.721616
> HCI Event: Command Complete (0x0e) plen 5                 #28 [hci1] 0.722152
      LE Read Resolving List Size (0x08|0x002a) ncmd 1
        Status: Success (0x00)
        Size: 8
< HCI Command: LE Set Host Feature (0x08|0x0074) plen 2     #29 [hci1] 0.741606
        Bit Number: 38
          Connection Subrating (Host Support)
        Bit Value: 1
> HCI Event: Command Complete (0x0e) plen 4                 #30 [hci1] 0.742174
      LE Set Host Feature (0x08|0x0074) ncmd 1
        Status: Success (0x00)
< HCI Command: LE Set Event Mask (0x08|0x0001) plen 8       #31 [hci1] 0.761610
        Mask: 0x000002063f87fa5e
          LE Advertising Report
          LE Connection Update Complete
          LE Read Remote Used Features Complete
          LE Long Term Key Request
          LE Data Length Change
          LE Enhanced Connection Complete
          LE PHY Update Complete
          LE Extended Advertising Report
          LE Periodic Advertising Sync Established
          LE Periodic Advertising Report
          LE Periodic Advertising Sync Lost
          LE Extended Scan Timeout
          LE Extended Advertising Set Terminated
          LE Scan Request Received
          LE Periodic Advertising Sync Transfer Rvc
          LE CIS Established
          LE CIS Request
          LE Create BIG Complete
          LE Terminate BIG Complete
          LE BIG Sync Estabilished Complete
          LE BIG Sync Lost
          LE BIG Info Advertising Report
          LE Subrate Change
          Unknown mask (0x0000020000000000)
> HCI Event: Command Complete (0x0e) plen 4                 #32 [hci1] 0.762106
      LE Set Event Mask (0x08|0x0001) ncmd 1
        Status: Success (0x00)
< HCI Command: Set Event Mask (0x03|0x0001) plen 8          #33 [hci1] 0.781642
        Mask: 0x2000800002008890
          Disconnection Complete
          Encryption Change
          Read Remote Version Information Complete
          Hardware Error
          Data Buffer Overflow
          Encryption Key Refresh Complete
          LE Meta
> HCI Event: Command Complete (0x0e) plen 4                 #34 [hci1] 0.782162
      Set Event Mask (0x03|0x0001) ncmd 1
        Status: Success (0x00)
< HCI Command: Read BD ADDR (0x04|0x0009) plen 0            #35 [hci1] 0.801606
> HCI Event: Command Complete (0x0e) plen 10                #36 [hci1] 0.802163
      Read BD ADDR (0x04|0x0009) ncmd 1
        Status: Success (0x00)
        Address: 00:00:00:00:00:00 (OUI 00-00-00)
< HCI Command: LE Set Random Address (0x08|0x0005) plen 6   #37 [hci1] 0.821607
        Address: D5:B6:CC:31:DB:3B (Static)
> HCI Event: Command Complete (0x0e) plen 4                 #38 [hci1] 0.822168
      LE Set Random Address (0x08|0x0005) ncmd 1
        Status: Success (0x00)
< HCI Command: LE Extended Create... (0x08|0x0043) plen 26  #39 [hci1] 3.161697
        Filter policy: Accept list is not used (0x00)
        Own address type: Random (0x01)
        Peer address type: Public (0x00)
        Peer address: DF:A9:FF:F6:B1:1A (OUI DF-A9-FF)
        Initiating PHYs: 0x01
        Entry 0: LE 1M
          Scan interval: 60.000 msec (0x0060)
          Scan window: 60.000 msec (0x0060)
          Min connection interval: 30.00 msec (0x0018)
          Max connection interval: 50.00 msec (0x0028)
          Connection latency: 0 (0x0000)
          Supervision timeout: 4000 msec (0x0190)
          Min connection length: 0.000 msec (0x0000)
          Max connection length: 0.000 msec (0x0000)
> HCI Event: Command Status (0x0f) plen 4                   #40 [hci1] 3.162619
      LE Extended Create Connection (0x08|0x0043) ncmd 1
        Status: Success (0x00)
> HCI Event: LE Meta Event (0x3e) plen 31                   #41 [hci1] 3.263817
      LE Enhanced Connection Complete (0x0a)
        Status: Success (0x00)
        Handle: 1440
        Role: Central (0x00)
        Peer address type: Public (0x00)
        Peer address: DF:A9:FF:F6:B1:1A (OUI DF-A9-FF)
        Local resolvable private address: 00:00:00:00:00:00 (Non-Resolvable)
        Peer resolvable private address: 00:00:00:00:00:00 (Non-Resolvable)
        Connection interval: 50.00 msec (0x0028)
        Connection latency: 0 (0x0000)
        Supervision timeout: 4000 msec (0x0190)
        Central clock accuracy: 0x00
< HCI Command: LE Read Remote Used... (0x08|0x0016) plen 2  #42 [hci1] 3.281821
        Handle: 1440 Address: DF:A9:FF:F6:B1:1A (OUI DF-A9-FF)
> HCI Event: Command Status (0x0f) plen 4                   #43 [hci1] 3.282245
      LE Read Remote Used Features (0x08|0x0016) ncmd 1
        Status: Success (0x00)
< HCI Command: LE Set PHY (0x08|0x0032) plen 7              #44 [hci1] 3.301676
        Handle: 1440 Address: DF:A9:FF:F6:B1:1A (OUI DF-A9-FF)
        All PHYs preference: 0x00
        TX PHYs preference: 0x02
          LE 2M
        RX PHYs preference: 0x02
          LE 2M
        PHY options preference: Reserved (0x0000)
> HCI Event: Command Status (0x0f) plen 4                   #45 [hci1] 3.302260
      LE Set PHY (0x08|0x0032) ncmd 1
        Status: Success (0x00)
> HCI Event: LE Meta Event (0x3e) plen 12                   #46 [hci1] 3.415274
      LE Read Remote Used Features (0x04)
        Status: Success (0x00)
        Handle: 1440 Address: DF:A9:FF:F6:B1:1A (OUI DF-A9-FF)
        Features: 0x2d 0x49 0x00 0xf7 0x67 0xd9 0x00 0x80
          LE Encryption
          Extended Reject Indication
          Peripheral-initiated Features Exchange
          LE Data Packet Length Extension
          LE 2M PHY
          LE Coded PHY
          Channel Selection Algorithm #2
          Periodic Advertising Sync Transfer - Sender
          Periodic Advertising Sync Transfer - Recipient
          Sleep Clock Accuracy Updates
          Connected Isochronous Stream - Central
          Connected Isochronous Stream - Peripheral
          Isochronous Broadcaster
          Synchronized Receiver
          Connected Isochronous Stream (Host Support)
          LE Power Control Request
          LE Power Control Request
          Connection Subrating
          Connection Subrating (Host Support)
          Unknown features (0x8000d90000000000)
> HCI Event: LE Meta Event (0x3e) plen 6                    #47 [hci1] 3.914626
      LE PHY Update Complete (0x0c)
        Status: Success (0x00)
        Handle: 1440 Address: DF:A9:FF:F6:B1:1A (OUI DF-A9-FF)
        TX PHY: LE 2M (0x02)
        RX PHY: LE 2M (0x02)
> ACL Data RX: Handle 1440 flags 0x02 dlen 8                #48 [hci1] 4.464999
      LE L2CAP: Unknown (0x1b) ident 1 len 0
< HCI Command: Host Number of Compl.. (0x03|0x0035) plen 5  #49 [hci1] 4.481780
        Num handles: 1
        Handle: 1440 Address: DF:A9:FF:F6:B1:1A (OUI DF-A9-FF)
        Count: 1
< ACL Data TX: Handle 1440 flags 0x00 dlen 10               #50 [hci1] 4.481810
      LE L2CAP: Command Reject (0x01) ident 1 len 2
        Reason: Command not understood (0x0000)
> HCI Event: Number of Completed Packets (0x13) plen 5      #51 [hci1] 4.515064
        Num handles: 1
        Handle: 1440 Address: DF:A9:FF:F6:B1:1A (OUI DF-A9-FF)
        Count: 1
        #50: len 10 (2 Kb/s)
        Latency: 33 msec (33-33 msec ~33 msec)
> ACL Data RX: Handle 1440 flags 0x02 dlen 8                #52 [hci1] 4.565144
      LE L2CAP: Unknown (0x1c) ident 2 len 0
< HCI Command: Host Number of Compl.. (0x03|0x0035) plen 5  #53 [hci1] 4.581854
        Num handles: 1
        Handle: 1440 Address: DF:A9:FF:F6:B1:1A (OUI DF-A9-FF)
        Count: 1
< ACL Data TX: Handle 1440 flags 0x00 dlen 10               #54 [hci1] 4.581895
      LE L2CAP: Command Reject (0x01) ident 2 len 2
        Reason: Command not understood (0x0000)
> HCI Event: Number of Completed Packets (0x13) plen 5      #55 [hci1] 4.615194
        Num handles: 1
        Handle: 1440 Address: DF:A9:FF:F6:B1:1A (OUI DF-A9-FF)
        Count: 1
        #54: len 10 (2 Kb/s)
        Latency: 33 msec (33-33 msec ~33 msec)
> ACL Data RX: Handle 1440 flags 0x02 dlen 8                #56 [hci1] 4.665079
      LE L2CAP: Unknown (0x1d) ident 3 len 0
< HCI Command: Host Number of Compl.. (0x03|0x0035) plen 5  #57 [hci1] 4.682193
        Num handles: 1
        Handle: 1440 Address: DF:A9:FF:F6:B1:1A (OUI DF-A9-FF)
        Count: 1
< ACL Data TX: Handle 1440 flags 0x00 dlen 10               #58 [hci1] 4.682324
      LE L2CAP: Command Reject (0x01) ident 3 len 2
        Reason: Command not understood (0x0000)
> HCI Event: Number of Completed Packets (0x13) plen 5      #59 [hci1] 4.715086
        Num handles: 1
        Handle: 1440 Address: DF:A9:FF:F6:B1:1A (OUI DF-A9-FF)
        Count: 1
        #58: len 10 (2 Kb/s)
        Latency: 32 msec (32-33 msec ~33 msec)
> ACL Data RX: Handle 1440 flags 0x02 dlen 8                #60 [hci1] 4.765056
      LE L2CAP: Unknown (0x95) ident 4 len 0
< HCI Command: Host Number of Compl.. (0x03|0x0035) plen 5  #61 [hci1] 4.782214
        Num handles: 1
        Handle: 1440 Address: DF:A9:FF:F6:B1:1A (OUI DF-A9-FF)
        Count: 1
< ACL Data TX: Handle 1440 flags 0x00 dlen 10               #62 [hci1] 4.782332
      LE L2CAP: Command Reject (0x01) ident 4 len 2
        Reason: Command not understood (0x0000)
> HCI Event: Number of Completed Packets (0x13) plen 5      #63 [hci1] 4.814979
        Num handles: 1
        Handle: 1440 Address: DF:A9:FF:F6:B1:1A (OUI DF-A9-FF)
        Count: 1
        #62: len 10 (2 Kb/s)
        Latency: 32 msec (32-33 msec ~32 msec)
> ACL Data RX: Handle 1440 flags 0x02 dlen 8                #64 [hci1] 4.865190
      LE L2CAP: Unknown (0xf7) ident 5 len 0
< HCI Command: Host Number of Compl.. (0x03|0x0035) plen 5  #65 [hci1] 4.882227
        Num handles: 1
        Handle: 1440 Address: DF:A9:FF:F6:B1:1A (OUI DF-A9-FF)
        Count: 1
< ACL Data TX: Handle 1440 flags 0x00 dlen 10               #66 [hci1] 4.882254
      LE L2CAP: Command Reject (0x01) ident 5 len 2
        Reason: Command not understood (0x0000)
> HCI Event: Number of Completed Packets (0x13) plen 5      #67 [hci1] 4.915070
        Num handles: 1
        Handle: 1440 Address: DF:A9:FF:F6:B1:1A (OUI DF-A9-FF)
        Count: 1
        #66: len 10 (2 Kb/s)
        Latency: 32 msec (32-33 msec ~32 msec)
> ACL Data RX: Handle 1440 flags 0x02 dlen 8                #68 [hci1] 4.965095
      LE L2CAP: Unknown (0x54) ident 6 len 0
< HCI Command: Host Number of Compl.. (0x03|0x0035) plen 5  #69 [hci1] 4.981923
        Num handles: 1
        Handle: 1440 Address: DF:A9:FF:F6:B1:1A (OUI DF-A9-FF)
        Count: 1
< ACL Data TX: Handle 1440 flags 0x00 dlen 10               #70 [hci1] 4.981974
      LE L2CAP: Command Reject (0x01) ident 6 len 2
        Reason: Command not understood (0x0000)
> HCI Event: Number of Completed Packets (0x13) plen 5      #71 [hci1] 5.014929
        Num handles: 1
        Handle: 1440 Address: DF:A9:FF:F6:B1:1A (OUI DF-A9-FF)
        Count: 1
        #70: len 10 (2 Kb/s)
        Latency: 32 msec (32-33 msec ~32 msec)
> ACL Data RX: Handle 1440 flags 0x02 dlen 12               #72 [hci1] 5.065044
      LE L2CAP: Unknown (0x02) ident 7 len 4
        01 00 40 00                                      ..@.            
< HCI Command: Host Number of Compl.. (0x03|0x0035) plen 5  #73 [hci1] 5.081961
        Num handles: 1
        Handle: 1440 Address: DF:A9:FF:F6:B1:1A (OUI DF-A9-FF)
        Count: 1
< ACL Data TX: Handle 1440 flags 0x00 dlen 10               #74 [hci1] 5.082078
      LE L2CAP: Command Reject (0x01) ident 7 len 2
        Reason: Command not understood (0x0000)
> HCI Event: Number of Completed Packets (0x13) plen 5      #75 [hci1] 5.114971
        Num handles: 1
        Handle: 1440 Address: DF:A9:FF:F6:B1:1A (OUI DF-A9-FF)
        Count: 1
        #74: len 10 (2 Kb/s)
        Latency: 32 msec (32-33 msec ~32 msec)
> ACL Data RX: Handle 1440 flags 0x02 dlen 16               #76 [hci1] 5.165137
      LE L2CAP: Unknown (0x04) ident 8 len 8
        40 00 00 00 01 02 30 00                          @.....0.        
< HCI Command: Host Number of Compl.. (0x03|0x0035) plen 5  #77 [hci1] 5.182189
        Num handles: 1
        Handle: 1440 Address: DF:A9:FF:F6:B1:1A (OUI DF-A9-FF)
        Count: 1
< ACL Data TX: Handle 1440 flags 0x00 dlen 10               #78 [hci1] 5.182306
      LE L2CAP: Command Reject (0x01) ident 8 len 2
        Reason: Command not understood (0x0000)
> HCI Event: Number of Completed Packets (0x13) plen 5      #79 [hci1] 5.215087
        Num handles: 1
        Handle: 1440 Address: DF:A9:FF:F6:B1:1A (OUI DF-A9-FF)
        Count: 1
        #78: len 10 (2 Kb/s)
        Latency: 32 msec (32-33 msec ~32 msec)
> ACL Data RX: Handle 1440 flags 0x02 dlen 8                #80 [hci1] 5.265006
      LE L2CAP: Unknown (0x08) ident 9 len 0
< HCI Command: Host Number of Compl.. (0x03|0x0035) plen 5  #81 [hci1] 5.281924
        Num handles: 1
        Handle: 1440 Address: DF:A9:FF:F6:B1:1A (OUI DF-A9-FF)
        Count: 1
< ACL Data TX: Handle 1440 flags 0x00 dlen 10               #82 [hci1] 5.282016
      LE L2CAP: Command Reject (0x01) ident 9 len 2
        Reason: Command not understood (0x0000)
> HCI Event: Number of Completed Packets (0x13) plen 5      #83 [hci1] 5.314958
        Num handles: 1
        Handle: 1440 Address: DF:A9:FF:F6:B1:1A (OUI DF-A9-FF)
        Count: 1
        #82: len 10 (2 Kb/s)
        Latency: 32 msec (32-33 msec ~32 msec)
> ACL Data RX: Handle 1440 flags 0x02 dlen 10               #84 [hci1] 5.365099
      LE L2CAP: Unknown (0x0a) ident 10 len 2
        01 00                                            ..              
< HCI Command: Host Number of Compl.. (0x03|0x0035) plen 5  #85 [hci1] 5.381982
        Num handles: 1
        Handle: 1440 Address: DF:A9:FF:F6:B1:1A (OUI DF-A9-FF)
        Count: 1
< ACL Data TX: Handle 1440 flags 0x00 dlen 10               #86 [hci1] 5.382044
      LE L2CAP: Command Reject (0x01) ident 10 len 2
        Reason: Command not understood (0x0000)
> HCI Event: Number of Completed Packets (0x13) plen 5      #87 [hci1] 5.415033
        Num handles: 1
        Handle: 1440 Address: DF:A9:FF:F6:B1:1A (OUI DF-A9-FF)
        Count: 1
        #86: len 10 (2 Kb/s)
        Latency: 32 msec (32-33 msec ~32 msec)
> ACL Data RX: Handle 1440 flags 0x02 dlen 13               #88 [hci1] 5.465154
      LE L2CAP: Unknown (0x0c) ident 11 len 5
        01 00 05 00 00                                   .....           
< HCI Command: Host Number of Compl.. (0x03|0x0035) plen 5  #89 [hci1] 5.481896
        Num handles: 1
        Handle: 1440 Address: DF:A9:FF:F6:B1:1A (OUI DF-A9-FF)
        Count: 1
< ACL Data TX: Handle 1440 flags 0x00 dlen 10               #90 [hci1] 5.481964
      LE L2CAP: Command Reject (0x01) ident 11 len 2
        Reason: Command not understood (0x0000)
> HCI Event: Number of Completed Packets (0x13) plen 5      #91 [hci1] 5.514904
        Num handles: 1
        Handle: 1440 Address: DF:A9:FF:F6:B1:1A (OUI DF-A9-FF)
        Count: 1
        #90: len 10 (2 Kb/s)
        Latency: 32 msec (32-33 msec ~32 msec)
> ACL Data RX: Handle 1440 flags 0x02 dlen 11               #92 [hci1] 5.565039
      LE L2CAP: Unknown (0x0e) ident 12 len 3
        05 00 00                                         ...             
< HCI Command: Host Number of Compl.. (0x03|0x0035) plen 5  #93 [hci1] 5.581878
        Num handles: 1
        Handle: 1440 Address: DF:A9:FF:F6:B1:1A (OUI DF-A9-FF)
        Count: 1
< ACL Data TX: Handle 1440 flags 0x00 dlen 10               #94 [hci1] 5.581927
      LE L2CAP: Command Reject (0x01) ident 12 len 2
        Reason: Command not understood (0x0000)
> HCI Event: Number of Completed Packets (0x13) plen 5      #95 [hci1] 5.614939
        Num handles: 1
        Handle: 1440 Address: DF:A9:FF:F6:B1:1A (OUI DF-A9-FF)
        Count: 1
        #94: len 10 (2 Kb/s)
        Latency: 33 msec (32-33 msec ~32 msec)
> ACL Data RX: Handle 1440 flags 0x02 dlen 12               #96 [hci1] 5.665072
      LE L2CAP: Unknown (0x10) ident 13 len 4
        05 00 00 00                                      ....            
< HCI Command: Host Number of Compl.. (0x03|0x0035) plen 5  #97 [hci1] 5.682303
        Num handles: 1
        Handle: 1440 Address: DF:A9:FF:F6:B1:1A (OUI DF-A9-FF)
        Count: 1
< ACL Data TX: Handle 1440 flags 0x00 dlen 10               #98 [hci1] 5.682424
      LE L2CAP: Command Reject (0x01) ident 13 len 2
        Reason: Command not understood (0x0000)
> HCI Event: Number of Completed Packets (0x13) plen 5      #99 [hci1] 5.715094
        Num handles: 1
        Handle: 1440 Address: DF:A9:FF:F6:B1:1A (OUI DF-A9-FF)
        Count: 1
        #98: len 10 (2 Kb/s)
        Latency: 32 msec (32-33 msec ~32 msec)
> ACL Data RX: Handle 1440 flags 0x02 dlen 16              #100 [hci1] 5.915200
      LE L2CAP: Unknown (0x03) ident 30 len 8
        40 00 40 00 00 00 00 00                          @.@.....        
< HCI Command: Host Number of Comp.. (0x03|0x0035) plen 5  #101 [hci1] 5.921785
        Num handles: 1
        Handle: 1440 Address: DF:A9:FF:F6:B1:1A (OUI DF-A9-FF)
        Count: 1
< ACL Data TX: Handle 1440 flags 0x00 dlen 10              #102 [hci1] 5.921869
      LE L2CAP: Command Reject (0x01) ident 30 len 2
        Reason: Command not understood (0x0000)
> HCI Event: Number of Completed Packets (0x13) plen 5     #103 [hci1] 5.964966
        Num handles: 1
        Handle: 1440 Address: DF:A9:FF:F6:B1:1A (OUI DF-A9-FF)
        Count: 1
        #102: len 10 (1 Kb/s)
        Latency: 43 msec (32-43 msec ~37 msec)
> ACL Data RX: Handle 1440 flags 0x02 dlen 18              #104 [hci1] 6.015168
      LE L2CAP: Unknown (0x05) ident 31 len 10
        40 00 00 00 00 00 01 02 30 00                    @.......0.      
< HCI Command: Host Number of Comp.. (0x03|0x0035) plen 5  #105 [hci1] 6.021853
        Num handles: 1
        Handle: 1440 Address: DF:A9:FF:F6:B1:1A (OUI DF-A9-FF)
        Count: 1
< ACL Data TX: Handle 1440 flags 0x00 dlen 10              #106 [hci1] 6.021919
      LE L2CAP: Command Reject (0x01) ident 31 len 2
        Reason: Command not understood (0x0000)
> HCI Event: Number of Completed Packets (0x13) plen 5     #107 [hci1] 6.065057
        Num handles: 1
        Handle: 1440 Address: DF:A9:FF:F6:B1:1A (OUI DF-A9-FF)
        Count: 1
        #106: len 10 (1 Kb/s)
        Latency: 43 msec (32-43 msec ~40 msec)
> ACL Data RX: Handle 1440 flags 0x02 dlen 8               #108 [hci1] 6.115010
      LE L2CAP: Unknown (0x09) ident 32 len 0
< HCI Command: Host Number of Comp.. (0x03|0x0035) plen 5  #109 [hci1] 6.121887
        Num handles: 1
        Handle: 1440 Address: DF:A9:FF:F6:B1:1A (OUI DF-A9-FF)
        Count: 1
< ACL Data TX: Handle 1440 flags 0x00 dlen 10              #110 [hci1] 6.121930
      LE L2CAP: Command Reject (0x01) ident 32 len 2
        Reason: Command not understood (0x0000)
> HCI Event: Number of Completed Packets (0x13) plen 5     #111 [hci1] 6.164935
        Num handles: 1
        Handle: 1440 Address: DF:A9:FF:F6:B1:1A (OUI DF-A9-FF)
        Count: 1
        #110: len 10 (1 Kb/s)
        Latency: 43 msec (32-43 msec ~41 msec)
> ACL Data RX: Handle 1440 flags 0x02 dlen 12              #112 [hci1] 6.215044
      LE L2CAP: Unknown (0x0b) ident 33 len 4
        01 00 00 00                                      ....            
< HCI Command: Host Number of Comp.. (0x03|0x0035) plen 5  #113 [hci1] 6.221873
        Num handles: 1
        Handle: 1440 Address: DF:A9:FF:F6:B1:1A (OUI DF-A9-FF)
        Count: 1
< ACL Data TX: Handle 1440 flags 0x00 dlen 10              #114 [hci1] 6.221958
      LE L2CAP: Command Reject (0x01) ident 33 len 2
        Reason: Command not understood (0x0000)
> HCI Event: Number of Completed Packets (0x13) plen 5     #115 [hci1] 6.264939
        Num handles: 1
        Handle: 1440 Address: DF:A9:FF:F6:B1:1A (OUI DF-A9-FF)
        Count: 1
        #114: len 10 (1 Kb/s)
        Latency: 42 msec (32-43 msec ~42 msec)
> ACL Data RX: Handle 1440 flags 0x02 dlen 16              #116 [hci1] 6.315190
      LE L2CAP: Unknown (0x0d) ident 34 len 8
        40 00 40 00 00 00 00 00                          @.@.....        
< HCI Command: Host Number of Comp.. (0x03|0x0035) plen 5  #117 [hci1] 6.321894
        Num handles: 1
        Handle: 1440 Address: DF:A9:FF:F6:B1:1A (OUI DF-A9-FF)
        Count: 1
< ACL Data TX: Handle 1440 flags 0x00 dlen 10              #118 [hci1] 6.321947
      LE L2CAP: Command Reject (0x01) ident 34 len 2
        Reason: Command not understood (0x0000)
> HCI Event: Number of Completed Packets (0x13) plen 5     #119 [hci1] 6.365051
        Num handles: 1
        Handle: 1440 Address: DF:A9:FF:F6:B1:1A (OUI DF-A9-FF)
        Count: 1
        #118: len 10 (1 Kb/s)
        Latency: 43 msec (32-43 msec ~42 msec)
> ACL Data RX: Handle 1440 flags 0x02 dlen 12              #120 [hci1] 6.415094
      LE L2CAP: Unknown (0x0f) ident 35 len 4
        40 00 00 00                                      @...            
< HCI Command: Host Number of Comp.. (0x03|0x0035) plen 5  #121 [hci1] 6.422273
        Num handles: 1
        Handle: 1440 Address: DF:A9:FF:F6:B1:1A (OUI DF-A9-FF)
        Count: 1
< ACL Data TX: Handle 1440 flags 0x00 dlen 10              #122 [hci1] 6.422411
      LE L2CAP: Command Reject (0x01) ident 35 len 2
        Reason: Command not understood (0x0000)
> HCI Event: Number of Completed Packets (0x13) plen 5     #123 [hci1] 6.464933
        Num handles: 1
        Handle: 1440 Address: DF:A9:FF:F6:B1:1A (OUI DF-A9-FF)
        Count: 1
        #122: len 10 (1 Kb/s)
        Latency: 42 msec (32-43 msec ~42 msec)
> ACL Data RX: Handle 1440 flags 0x02 dlen 10              #124 [hci1] 6.515134
      LE L2CAP: Unknown (0x11) ident 36 len 2
        40 00                                            @.              
< HCI Command: Host Number of Comp.. (0x03|0x0035) plen 5  #125 [hci1] 6.521813
        Num handles: 1
        Handle: 1440 Address: DF:A9:FF:F6:B1:1A (OUI DF-A9-FF)
        Count: 1
< ACL Data TX: Handle 1440 flags 0x00 dlen 10              #126 [hci1] 6.521875
      LE L2CAP: Command Reject (0x01) ident 36 len 2
        Reason: Command not understood (0x0000)
> HCI Event: Number of Completed Packets (0x13) plen 5     #127 [hci1] 6.564958
        Num handles: 1
        Handle: 1440 Address: DF:A9:FF:F6:B1:1A (OUI DF-A9-FF)
        Count: 1
        #126: len 10 (1 Kb/s)
        Latency: 43 msec (32-43 msec ~42 msec)
> HCI Event: Disconnect Complete (0x05) plen 4            #128 [hci1] 10.764728
        Status: Success (0x00)
        Handle: 1440 Address: DF:A9:FF:F6:B1:1A (OUI DF-A9-FF)
        Reason: Connection Timeout (0x08)
< HCI Command: Reset (0x03|0x0003) plen 0                 #129 [hci1] 11.171739
> HCI Event: Command Complete (0x0e) plen 4               #130 [hci1] 11.172192
      Reset (0x03|0x0003) ncmd 1
        Status: Success (0x00)
@ USER Close: main                                    {0x0001} [hci1] 11.181699
= Close Index: 00:00:00:00:00:00                               [hci1] 11.181707
