Bluetooth monitor ver 5.72
= Note: Linux version 6.14.0-36-generic (x86_64)                       0.350890
= Note: Bluetooth subsystem version 2.22                               0.350892
= New Index: 00:00:00:00:00:00 (Primary,UART,hci1)              [hci1] 0.350893
= New Index: 48:5F:99:8E:E0:64 (Primary,USB,hci0)               [hci0] 0.350894
= Open Index: 00:00:00:00:00:00                                 [hci1] 0.864820
= Index Info: 00:00:00:00:00:00 (Nordic Semiconductor ASA)      [hci1] 0.864841
@ USER Open: main (privileged) version 2.22            {0x0001} [hci1] 0.864850
< HCI Command: Reset (0x03|0x0003) plen 0                    #1 [hci1] 0.866079
> HCI Event: Command Complete (0x0e) plen 4                  #2 [hci1] 0.866608
      Reset (0x03|0x0003) ncmd 1
        Status: Success (0x00)
< HCI Command: Read Local Supported... (0x04|0x0003) plen 0  #3 [hci1] 0.884550
> HCI Event: Command Complete (0x0e) plen 12                 #4 [hci1] 0.885133
      Read Local Supported Features (0x04|0x0003) ncmd 1
        Status: Success (0x00)
        Features: 0x00 0x00 0x00 0x00 0x60 0x00 0x00 0x00
          BR/EDR Not Supported
          LE Supported (Controller)
< HCI Command: Read Local Version In.. (0x04|0x0001) plen 0  #5 [hci1] 0.904235
> HCI Event: Command Complete (0x0e) plen 12                 #6 [hci1] 0.904717
      Read Local Version Information (0x04|0x0001) ncmd 1
        Status: Success (0x00)
        HCI version: Reserved (0x0f) - Revision 12393 (0x3069)
        LMP version: Reserved (0x0f) - Subversion 12393 (0x3069)
        Manufacturer: Nordic Semiconductor ASA (89)
< HCI Command: Read Local Supported... (0x04|0x0002) plen 0  #7 [hci1] 0.924236
> HCI Event: Command Complete (0x0e) plen 68                 #8 [hci1] 0.925353
      Read Local Supported Commands (0x04|0x0002) ncmd 1
        Status: Success (0x00)
        Commands: 119 entries
          Disconnect (Octet 0 - Bit 5)
          Read Remote Version Information (Octet 2 - Bit 7)
          Set Event Mask (Octet 5 - Bit 6)
          Reset (Octet 5 - Bit 7)
          Read Connection Accept Timeout (Octet 7 - Bit 2)
          Write Connection Accept Timeout (Octet 7 - Bit 3)
          Read Transmit Power Level (Octet 10 - Bit 2)
          Set Controller To Host Flow Control (Octet 10 - Bit 5)
          Host Buffer Size (Octet 10 - Bit 6)
          Host Number of Completed Packets (Octet 10 - Bit 7)
          Read Local Version Information (Octet 14 - Bit 3)
          Read Local Supported Features (Octet 14 - Bit 5)
          Read BD ADDR (Octet 15 - Bit 1)
          Read RSSI (Octet 15 - Bit 5)
          Set Event Mask Page 2 (Octet 22 - Bit 2)
          LE Set Event Mask (Octet 25 - Bit 0)
          LE Read Buffer Size (Octet 25 - Bit 1)
          LE Read Local Supported Features (Octet 25 - Bit 2)
          LE Set Random Address (Octet 25 - Bit 4)
          LE Set Advertising Parameters (Octet 25 - Bit 5)
          LE Read Advertising Channel TX Power (Octet 25 - Bit 6)
          LE Set Advertising Data (Octet 25 - Bit 7)
          LE Set Scan Response Data (Octet 26 - Bit 0)
          LE Set Advertise Enable (Octet 26 - Bit 1)
          LE Set Scan Parameters (Octet 26 - Bit 2)
          LE Set Scan Enable (Octet 26 - Bit 3)
          LE Create Connection (Octet 26 - Bit 4)
          LE Create Connection Cancel (Octet 26 - Bit 5)
          LE Read Accept List Size (Octet 26 - Bit 6)
          LE Clear Accept List (Octet 26 - Bit 7)
          LE Add Device To Accept List (Octet 27 - Bit 0)
          LE Remove Device From Accept List (Octet 27 - Bit 1)
          LE Connection Update (Octet 27 - Bit 2)
          LE Set Host Channel Classification (Octet 27 - Bit 3)
          LE Read Channel Map (Octet 27 - Bit 4)
          LE Read Remote Used Features (Octet 27 - Bit 5)
          LE Encrypt (Octet 27 - Bit 6)
          LE Rand (Octet 27 - Bit 7)
          LE Start Encryption (Octet 28 - Bit 0)
          LE Long Term Key Request Reply (Octet 28 - Bit 1)
          LE Long Term Key Request Neg Reply (Octet 28 - Bit 2)
          LE Read Supported States (Octet 28 - Bit 3)
          LE Receiver Test (Octet 28 - Bit 4)
          LE Transmitter Test (Octet 28 - Bit 5)
          LE Test End (Octet 28 - Bit 6)
          Read Authenticated Payload Timeout (Octet 32 - Bit 4)
          Write Authenticated Payload Timeout (Octet 32 - Bit 5)
          LE Set Data Length (Octet 33 - Bit 6)
          LE Read Suggested Default Data Length (Octet 33 - Bit 7)
          LE Write Suggested Default Data Length (Octet 34 - Bit 0)
          LE Add Device To Resolving List (Octet 34 - Bit 3)
          LE Remove Device From Resolving List (Octet 34 - Bit 4)
          LE Clear Resolving List (Octet 34 - Bit 5)
          LE Read Resolving List Size (Octet 34 - Bit 6)
          LE Set Address Resolution Enable (Octet 35 - Bit 1)
          LE Set Resolvable Private Address Timeout (Octet 35 - Bit 2)
          LE Read Maximum Data Length (Octet 35 - Bit 3)
          LE Read PHY (Octet 35 - Bit 4)
          LE Set Default PHY (Octet 35 - Bit 5)
          LE Set PHY (Octet 35 - Bit 6)
          LE Enhanced Receiver Test (Octet 35 - Bit 7)
          LE Enhanced Transmitter Test (Octet 36 - Bit 0)
          LE Set Advertising Set Random Address (Octet 36 - Bit 1)
          LE Set Extended Advertising Parameters (Octet 36 - Bit 2)
          LE Set Extended Advertising Data (Octet 36 - Bit 3)
          LE Set Extended Scan Response Data (Octet 36 - Bit 4)
          LE Set Extended Advertising Enable (Octet 36 - Bit 5)
          LE Read Maximum Advertising Data Length (Octet 36 - Bit 6)
          LE Read Number of Supported Advertising Sets (Octet 36 - Bit 7)
          LE Remove Advertising Set (Octet 37 - Bit 0)
          LE Clear Advertising Sets (Octet 37 - Bit 1)
          LE Set Periodic Advertising Parameters (Octet 37 - Bit 2)
          LE Set Periodic Advertising Data (Octet 37 - Bit 3)
          LE Set Periodic Advertising Enable (Octet 37 - Bit 4)
          LE Set Extended Scan Parameters (Octet 37 - Bit 5)
          LE Set Extended Scan Enable (Octet 37 - Bit 6)
          LE Extended Create Connection (Octet 37 - Bit 7)
          LE Periodic Advertising Create Sync (Octet 38 - Bit 0)
          LE Periodic Advertising Create Sync Cancel (Octet 38 - Bit 1)
          LE Periodic Advertising Terminate Sync (Octet 38 - Bit 2)
          LE Add Device To Periodic Advertiser List (Octet 38 - Bit 3)
          LE Remove Device From Periodic Advertiser List (Octet 38 - Bit 4)
          LE Clear Periodic Advertiser List (Octet 38 - Bit 5)
          LE Read Periodic Advertiser List Size (Octet 38 - Bit 6)
          LE Read Transmit Power (Octet 38 - Bit 7)
          LE Read RF Path Compensation (Octet 39 - Bit 0)
          LE Write RF Path Compensation (Octet 39 - Bit 1)
          LE Set Privacy Mode (Octet 39 - Bit 2)
          LE Periodic Advertising Receive Enable (Octet 40 - Bit 5)
          LE Periodic Advertising Sync Transfer (Octet 40 - Bit 6)
          LE Periodic Advertising Set Info Transfer (Octet 40 - Bit 7)
          LE Periodic Advertising Sync Transfer Parameters (Octet 41 - Bit 0)
          LE Set Default Periodic Advertisng Sync Transfer Parameters (Octet 41 - Bit 1)
          LE Read Buffer v2 (Octet 41 - Bit 5)
          LE Read ISO TX Sync (Octet 41 - Bit 6)
          LE Set Connected Isochronous Group Parameters (Octet 41 - Bit 7)
          LE Set Connected Isochronous Group Parameters Test (Octet 42 - Bit 0)
          LE Create Connected Isochronous Stream (Octet 42 - Bit 1)
          LE Remove Connected Isochronous Group (Octet 42 - Bit 2)
          LE Accept Connected Isochronous Stream Request (Octet 42 - Bit 3)
          LE Reject Connected Isochronous Stream Request (Octet 42 - Bit 4)
          LE Create Broadcast Isochronous Group (Octet 42 - Bit 5)
          LE Create Broadcast Isochronous Group Test (Octet 42 - Bit 6)
          LE Terminate Broadcast Isochronous Group (Octet 42 - Bit 7)
          LE Broadcast Isochronous Group Create Sync (Octet 43 - Bit 0)
          LE Broadcast Isochronous Group Terminate Sync (Octet 43 - Bit 1)
          LE Request Peer SCA (Octet 43 - Bit 2)
          LE Setup Isochronous Data Path (Octet 43 - Bit 3)
          LE Remove Isochronous Data Path (Octet 43 - Bit 4)
          LE Isochronous Transmit Test (Octet 43 - Bit 5)
          LE Isochronous Receive Test (Octet 43 - Bit 6)
          LE Isochronous Read Test Counters (Octet 43 - Bit 7)
          LE Isochronous Read Test Counters (Octet 44 - Bit 0)
          LE Set Host Feature (Octet 44 - Bit 1)
          Octet 44 - Bit 2 
          Octet 45 - Bit 6 
          Octet 46 - Bit 0 
          Octet 46 - Bit 1 
          Octet 46 - Bit 2 
< HCI Command: Host Buffer Size (0x03|0x0033) plen 7         #9 [hci1] 0.944250
        ACL MTU: 255  ACL max packet: 16
        SCO MTU: 0    SCO max packet: 0
> HCI Event: Command Complete (0x0e) plen 4                 #10 [hci1] 0.944749
      Host Buffer Size (0x03|0x0033) ncmd 1
        Status: Success (0x00)
< HCI Command: Set Controller To Ho.. (0x03|0x0031) plen 1  #11 [hci1] 0.964241
        Flow control: ACL Data Packets (0x01)
> HCI Event: Command Complete (0x0e) plen 4                 #12 [hci1] 0.964636
      Set Controller To Host Flow Control (0x03|0x0031) ncmd 1
        Status: Success (0x00)
< HCI Command: LE Read Local Suppor.. (0x08|0x0003) plen 0  #13 [hci1] 0.984245
> HCI Event: Command Complete (0x0e) plen 12                #14 [hci1] 0.984700
      LE Read Local Supported Features (0x08|0x0003) ncmd 1
        Status: Success (0x00)
        Features: 0xfd 0x79 0x00 0xf7 0x30 0x01 0x00 0x00
          LE Encryption
          Extended Reject Indication
          Peripheral-initiated Features Exchange
          LE Ping
          LE Data Packet Length Extension
          LL Privacy
          Extended Scanner Filter Policies
          LE 2M PHY
          LE Coded PHY
          LE Extended Advertising
          LE Periodic Advertising
          Channel Selection Algorithm #2
          Periodic Advertising Sync Transfer - Sender
          Periodic Advertising Sync Transfer - Recipient
          Sleep Clock Accuracy Updates
          Connected Isochronous Stream - Central
          Connected Isochronous Stream - Peripheral
          Isochronous Broadcaster
          Synchronized Receiver
          Periodic Advertising ADI support
          Connection Subrating
          Unknown features (0x0000010000000000)
< HCI Command: LE Set Host Feature (0x08|0x0074) plen 2     #15 [hci1] 1.004248
        Bit Number: 32
          Connected Isochronous Stream (Host Support)
        Bit Value: 1
> HCI Event: Command Complete (0x0e) plen 4                 #16 [hci1] 1.004656
      LE Set Host Feature (0x08|0x0074) ncmd 1
        Status: Success (0x00)
< HCI Command: LE Read Buffer v2 (0x08|0x0060) plen 0       #17 [hci1] 1.024236
> HCI Event: Command Complete (0x0e) plen 10                #18 [hci1] 1.024756
      LE Read Buffer v2 (0x08|0x0060) ncmd 1
        Status: Success (0x00)
        ACL MTU: 27
        ACL max packet: 3
        ISO MTU: 318
        ISO max packet: 3
< HCI Command: LE Read Maximum Adve.. (0x08|0x003a) plen 0  #19 [hci1] 1.044263
> HCI Event: Command Complete (0x0e) plen 6                 #20 [hci1] 1.044766
      LE Read Maximum Advertising Data Length (0x08|0x003a) ncmd 1
        Status: Success (0x00)
        Max length: 1650
< HCI Command: LE Read Supported St.. (0x08|0x001c) plen 0  #21 [hci1] 1.064239
> HCI Event: Command Complete (0x0e) plen 12                #22 [hci1] 1.064742
      LE Read Supported States (0x08|0x001c) ncmd 1
        Status: Success (0x00)
        States: 0x000003ff3e0306ff
          Non-connectable Advertising State
          Scannable Advertising State
          Connectable Advertising State
          High Duty Cycle Directed Advertising State
          Passive Scanning State
          Active Scanning State
          Initiating State
            and Connection State (Central Role)
          Connection State (Peripheral Role)
          Scannable Advertising State
            and Passive Scanning State
          Connectable Advertising State
            and Passive Scanning State
          Non-connectable Advertising State
            and Initiating State
          Scannable Advertising State
            and Initiating State
          Active Scanning State
            and Connection State (Central Role)
          Passive Scanning State
            and Connection State (Peripheral Role)
          Active Scanning State
            and Connection State (Peripheral Role)
          Initiating State
            and Connection State (Central Role)
            and Central Role & Central Role
          Low Duty Cycle Directed Advertising State
          Connectable Advertising State
            and Initiating State
            and Central Role & Peripheral Role
          High Duty Cycle Directed Advertising State
            and Initiating State
            and Central Role & Peripheral Role
          Low Duty Cycle Directed Advertising State
            and Initiating State
            and Central Role & Peripheral Role
          Connectable Advertising State
            and Connection State (Central Role)
            and Central Role & Peripheral Role
          High Duty Cycle Directed Advertising State
            and Connection State (Central Role)
            and Central Role & Peripheral Role
          Low Duty Cycle Directed Advertising State
            and Connection State (Central Role)
            and Central Role & Peripheral Role
          Connectable Advertising State
            and Connection State (Peripheral Role)
            and Central Role & Peripheral Role
          High Duty Cycle Directed Advertising State
            and Connection State (Peripheral Role)
            and Peripheral Role & Peripheral Role
          Low Duty Cycle Directed Advertising State
            and Connection State (Peripheral Role)
            and Peripheral Role & Peripheral Role
          Initiating State
            and Connection State (Peripheral Role)
            and Central Role & Peripheral Role
< HCI Command: LE Read Maximum Data.. (0x08|0x002f) plen 0  #23 [hci1] 1.084242
> HCI Event: Command Complete (0x0e) plen 12                #24 [hci1] 1.084702
      LE Read Maximum Data Length (0x08|0x002f) ncmd 1
        Status: Success (0x00)
        Max TX octets: 251
        Max TX time: 2704
        Max RX octets: 251
        Max RX time: 2704
< HCI Command: LE Write Suggested D.. (0x08|0x0024) plen 4  #25 [hci1] 1.104239
        TX octets: 251
        TX time: 2704
> HCI Event: Command Complete (0x0e) plen 4                 #26 [hci1] 1.104692
      LE Write Suggested Default Data Length (0x08|0x0024) ncmd 1
        Status: Success (0x00)
< HCI Command: LE Read Resolving Li.. (0x08|0x002a) plen 0  #27 [hci1] 1.124255
> HCI Event: Command Complete (0x0e) plen 5                 #28 [hci1] 1.124805
      LE Read Resolving List Size (0x08|0x002a) ncmd 1
        Status: Success (0x00)
        Size: 8
< HCI Command: LE Set Event Mask (0x08|0x0001) plen 8       #29 [hci1] 1.144240
        Mask: 0x000002023f87fa5e
          LE Advertising Report
          LE Connection Update Complete
          LE Read Remote Used Features Complete
          LE Long Term Key Request
          LE Data Length Change
          LE Enhanced Connection Complete
          LE PHY Update Complete
          LE Extended Advertising Report
          LE Periodic Advertising Sync Established
          LE Periodic Advertising Report
          LE Periodic Advertising Sync Lost
          LE Extended Scan Timeout
          LE Extended Advertising Set Terminated
          LE Scan Request Received
          LE Periodic Advertising Sync Transfer Rvc
          LE CIS Established
          LE CIS Request
          LE Create BIG Complete
          LE Terminate BIG Complete
          LE BIG Sync Estabilished Complete
          LE BIG Sync Lost
          LE BIG Info Advertising Report
          Unknown mask (0x0000020000000000)
> HCI Event: Command Complete (0x0e) plen 4                 #30 [hci1] 1.144856
      LE Set Event Mask (0x08|0x0001) ncmd 1
        Status: Success (0x00)
< HCI Command: Set Event Mask (0x03|0x0001) plen 8          #31 [hci1] 1.164249
        Mask: 0x2000800002008890
          Disconnection Complete
          Encryption Change
          Read Remote Version Information Complete
          Hardware Error
          Data Buffer Overflow
          Encryption Key Refresh Complete
          LE Meta
> HCI Event: Command Complete (0x0e) plen 4                 #32 [hci1] 1.164745
      Set Event Mask (0x03|0x0001) ncmd 1
        Status: Success (0x00)
< HCI Command: Read BD ADDR (0x04|0x0009) plen 0            #33 [hci1] 1.184253
> HCI Event: Command Complete (0x0e) plen 10                #34 [hci1] 1.184747
      Read BD ADDR (0x04|0x0009) ncmd 1
        Status: Success (0x00)
        Address: 00:00:00:00:00:00 (OUI 00-00-00)
< HCI Command: LE Set Random Address (0x08|0x0005) plen 6   #35 [hci1] 1.204256
        Address: D5:B6:CC:31:DB:3B (Static)
> HCI Event: Command Complete (0x0e) plen 4                 #36 [hci1] 1.204758
      LE Set Random Address (0x08|0x0005) ncmd 1
        Status: Success (0x00)
< HCI Command: LE Extended Create... (0x08|0x0043) plen 26  #37 [hci1] 3.374637
        Filter policy: Accept list is not used (0x00)
        Own address type: Random (0x01)
        Peer address type: Public (0x00)
        Peer address: DF:A9:FF:F6:B1:1A (OUI DF-A9-FF)
        Initiating PHYs: 0x01
        Entry 0: LE 1M
          Scan interval: 60.000 msec (0x0060)
          Scan window: 60.000 msec (0x0060)
          Min connection interval: 30.00 msec (0x0018)
          Max connection interval: 50.00 msec (0x0028)
          Connection latency: 0 (0x0000)
          Supervision timeout: 4000 msec (0x0190)
          Min connection length: 0.000 msec (0x0000)
          Max connection length: 0.000 msec (0x0000)
> HCI Event: Command Status (0x0f) plen 4                   #38 [hci1] 3.375532
      LE Extended Create Connection (0x08|0x0043) ncmd 1
        Status: Success (0x00)
> HCI Event: LE Meta Event (0x3e) plen 31                   #39 [hci1] 3.416580
      LE Enhanced Connection Complete (0x0a)
        Status: Success (0x00)
        Handle: 486
        Role: Central (0x00)
        Peer address type: Public (0x00)
        Peer address: DF:A9:FF:F6:B1:1A (OUI DF-A9-FF)
        Local resolvable private address: 00:00:00:00:00:00 (Non-Resolvable)
        Peer resolvable private address: 00:00:00:00:00:00 (Non-Resolvable)
        Connection interval: 50.00 msec (0x0028)
        Connection latency: 0 (0x0000)
        Supervision timeout: 4000 msec (0x0190)
        Central clock accuracy: 0x00
< HCI Command: LE Read Remote Used... (0x08|0x0016) plen 2  #40 [hci1] 3.424418
        Handle: 486 Address: DF:A9:FF:F6:B1:1A (OUI DF-A9-FF)
> HCI Event: Command Status (0x0f) plen 4                   #41 [hci1] 3.424922
      LE Read Remote Used Features (0x08|0x0016) ncmd 1
        Status: Success (0x00)
< HCI Command: LE Set PHY (0x08|0x0032) plen 7              #42 [hci1] 3.444290
        Handle: 486 Address: DF:A9:FF:F6:B1:1A (OUI DF-A9-FF)
        All PHYs preference: 0x00
        TX PHYs preference: 0x02
          LE 2M
        RX PHYs preference: 0x02
          LE 2M
        PHY options preference: Reserved (0x0000)
> HCI Event: Command Status (0x0f) plen 4                   #43 [hci1] 3.444861
      LE Set PHY (0x08|0x0032) ncmd 1
        Status: Success (0x00)
> ACL Data RX: Handle 486 flags 0x02 dlen 6                 #44 [hci1] 3.468137
      SMP: Security Request (0x0b) len 1
        Authentication requirement: No bonding, MITM, SC, No Keypresses (0x0c)
< HCI Command: Host Number of Compl.. (0x03|0x0035) plen 5  #45 [hci1] 3.484337
        Num handles: 1
        Handle: 486 Address: DF:A9:FF:F6:B1:1A (OUI DF-A9-FF)
        Count: 1
< ACL Data TX: Handle 486 flags 0x00 dlen 11                #46 [hci1] 3.484400
      SMP: Pairing Request (0x01) len 6
        IO capability: DisplayOnly (0x00)
        OOB data: Authentication data not present (0x00)
        Authentication requirement: Bonding, No MITM, SC, No Keypresses (0x09)
        Max encryption key size: 16
        Initiator key distribution: EncKey (0x01)
        Responder key distribution: EncKey IdKey (0x03)
> HCI Event: Number of Completed Packets (0x13) plen 5      #47 [hci1] 3.568243
        Num handles: 1
        Handle: 486 Address: DF:A9:FF:F6:B1:1A (OUI DF-A9-FF)
        Count: 1
        #46: len 11 (1 Kb/s)
        Latency: 83 msec (83-83 msec ~83 msec)
> HCI Event: LE Meta Event (0x3e) plen 12                   #48 [hci1] 3.568296
      LE Read Remote Used Features (0x04)
        Status: Success (0x00)
        Handle: 486 Address: DF:A9:FF:F6:B1:1A (OUI DF-A9-FF)
        Features: 0x2d 0x49 0x00 0xf7 0x67 0xd8 0x00 0x00
          LE Encryption
          Extended Reject Indication
          Peripheral-initiated Features Exchange
          LE Data Packet Length Extension
          LE 2M PHY
          LE Coded PHY
          Channel Selection Algorithm #2
          Periodic Advertising Sync Transfer - Sender
          Periodic Advertising Sync Transfer - Recipient
          Sleep Clock Accuracy Updates
          Connected Isochronous Stream - Central
          Connected Isochronous Stream - Peripheral
          Isochronous Broadcaster
          Synchronized Receiver
          Connected Isochronous Stream (Host Support)
          LE Power Control Request
          LE Power Control Request
          Connection Subrating
          Connection Subrating (Host Support)
          Unknown features (0x0000d80000000000)
> ACL Data RX: Handle 486 flags 0x02 dlen 11                #49 [hci1] 3.618178
      SMP: Pairing Response (0x02) len 6
        IO capability: KeyboardDisplay (0x04)
        OOB data: Authentication data not present (0x00)
        Authentication requirement: No bonding, MITM, SC, No Keypresses (0x0c)
        Max encryption key size: 16
        Initiator key distribution: <none> (0x00)
        Responder key distribution: <none> (0x00)
< HCI Command: Host Number of Compl.. (0x03|0x0035) plen 5  #50 [hci1] 3.624331
        Num handles: 1
        Handle: 486 Address: DF:A9:FF:F6:B1:1A (OUI DF-A9-FF)
        Count: 1
< ACL Data TX: Handle 486 flags 0x00 dlen 27                #51 [hci1] 3.624403
< ACL Data TX: Handle 486 flags 0x01 dlen 27                #52 [hci1] 3.624413
< ACL Data TX: Handle 486 flags 0x01 dlen 15                #53 [hci1] 3.624420
      SMP: Pairing Public Key (0x0c) len 64
        X: 98308440221e2d910f0e54b71e7ec652857aa9b5a0dc65028824cc19db1226e9
        Y: 67a4816bcb62efb21701e31fdb27561a6217575fb007a8bbdabe7e28b6f68482
> HCI Event: Number of Completed Packets (0x13) plen 5      #54 [hci1] 3.668173
        Num handles: 1
        Handle: 486 Address: DF:A9:FF:F6:B1:1A (OUI DF-A9-FF)
        Count: 1
        #51: len 27 (5 Kb/s)
        Latency: 43 msec (43-83 msec ~63 msec)
> HCI Event: Number of Completed Packets (0x13) plen 5      #55 [hci1] 3.718186
        Num handles: 1
        Handle: 486 Address: DF:A9:FF:F6:B1:1A (OUI DF-A9-FF)
        Count: 1
        #52: len 27 (2 Kb/s)
        Latency: 93 msec (43-93 msec ~78 msec)
> HCI Event: Number of Completed Packets (0x13) plen 5      #56 [hci1] 3.818109
        Num handles: 1
        Handle: 486 Address: DF:A9:FF:F6:B1:1A (OUI DF-A9-FF)
        Count: 1
        #53: len 15 (0 Kb/s)
        Latency: 193 msec (43-193 msec ~136 msec)
> ACL Data RX: Handle 486 flags 0x02 dlen 27                #57 [hci1] 3.868328
> ACL Data RX: Handle 486 flags 0x01 dlen 27                #58 [hci1] 3.868989
> ACL Data RX: Handle 486 flags 0x01 dlen 15                #59 [hci1] 3.869508
      SMP: Pairing Public Key (0x0c) len 64
        X: fdb3408ce29a6b0cf741349c858afc3af9a246b34c520031fa063d6e8e1941f8
        Y: 01102ae51b563dfd4208ee0ccc2e9b594391fd6213b375f430042e10adbef2f8
< HCI Command: Host Number of Compl.. (0x03|0x0035) plen 5  #60 [hci1] 3.885105
        Num handles: 1
        Handle: 486 Address: DF:A9:FF:F6:B1:1A (OUI DF-A9-FF)
        Count: 1
< HCI Command: Host Number of Compl.. (0x03|0x0035) plen 5  #61 [hci1] 3.885307
        Num handles: 1
        Handle: 486 Address: DF:A9:FF:F6:B1:1A (OUI DF-A9-FF)
        Count: 1
< HCI Command: Host Number of Compl.. (0x03|0x0035) plen 5  #62 [hci1] 3.885886
        Num handles: 1
        Handle: 486 Address: DF:A9:FF:F6:B1:1A (OUI DF-A9-FF)
        Count: 1
< ACL Data TX: Handle 486 flags 0x00 dlen 21                #63 [hci1] 3.886085
      SMP: Pairing Confirm (0x03) len 16
        Confim value: 53c58b2eb07bc4169bb09ee1c2b8b3d1
> HCI Event: Number of Completed Packets (0x13) plen 5      #64 [hci1] 3.918154
        Num handles: 1
        Handle: 486 Address: DF:A9:FF:F6:B1:1A (OUI DF-A9-FF)
        Count: 1
        #63: len 21 (5 Kb/s)
        Latency: 32 msec (32-193 msec ~84 msec)
> HCI Event: LE Meta Event (0x3e) plen 6                    #65 [hci1] 4.067467
      LE PHY Update Complete (0x0c)
        Status: Success (0x00)
        Handle: 486 Address: DF:A9:FF:F6:B1:1A (OUI DF-A9-FF)
        TX PHY: LE 2M (0x02)
        RX PHY: LE 2M (0x02)
> ACL Data RX: Handle 486 flags 0x02 dlen 21                #66 [hci1] 4.568103
      SMP: Pairing Confirm (0x03) len 16
        Confim value: fe1c477967fbbd8a363eaa52d8cc50bd
< HCI Command: Host Number of Compl.. (0x03|0x0035) plen 5  #67 [hci1] 4.588546
        Num handles: 1
        Handle: 486 Address: DF:A9:FF:F6:B1:1A (OUI DF-A9-FF)
        Count: 1
< ACL Data TX: Handle 486 flags 0x00 dlen 21                #68 [hci1] 4.589450
      SMP: Pairing Random (0x04) len 16
        Random value: 8e6108f966a694cbe26df70bb96773e6
> HCI Event: Number of Completed Packets (0x13) plen 5      #69 [hci1] 4.617894
        Num handles: 1
        Handle: 486 Address: DF:A9:FF:F6:B1:1A (OUI DF-A9-FF)
        Count: 1
        #68: len 21 (6 Kb/s)
        Latency: 28 msec (28-193 msec ~56 msec)
> ACL Data RX: Handle 486 flags 0x02 dlen 21                #70 [hci1] 4.868074
      SMP: Pairing Random (0x04) len 16
        Random value: c03bc6482b2b139dc6ec5e881a76b852
< HCI Command: Host Number of Compl.. (0x03|0x0035) plen 5  #71 [hci1] 4.884410
        Num handles: 1
        Handle: 486 Address: DF:A9:FF:F6:B1:1A (OUI DF-A9-FF)
        Count: 1
< ACL Data TX: Handle 486 flags 0x00 dlen 21                #72 [hci1] 4.884452
      SMP: Pairing Confirm (0x03) len 16
        Confim value: faf75d0ce99d16eeb75d0940ae3a956b
> HCI Event: Number of Completed Packets (0x13) plen 5      #73 [hci1] 4.917836
        Num handles: 1
        Handle: 486 Address: DF:A9:FF:F6:B1:1A (OUI DF-A9-FF)
        Count: 1
        #72: len 21 (5 Kb/s)
        Latency: 33 msec (28-193 msec ~44 msec)
> ACL Data RX: Handle 486 flags 0x02 dlen 21                #74 [hci1] 4.968178
      SMP: Pairing Confirm (0x03) len 16
        Confim value: f1f1cde6d13a821e1ec57bf74a0468ca
< HCI Command: Host Number of Compl.. (0x03|0x0035) plen 5  #75 [hci1] 4.984358
        Num handles: 1
        Handle: 486 Address: DF:A9:FF:F6:B1:1A (OUI DF-A9-FF)
        Count: 1
< ACL Data TX: Handle 486 flags 0x00 dlen 21                #76 [hci1] 4.984367
      SMP: Pairing Random (0x04) len 16
        Random value: 4d02679f89a05211af56d8b3da64d21e
> HCI Event: Number of Completed Packets (0x13) plen 5      #77 [hci1] 5.017935
        Num handles: 1
        Handle: 486 Address: DF:A9:FF:F6:B1:1A (OUI DF-A9-FF)
        Count: 1
        #76: len 21 (5 Kb/s)
        Latency: 33 msec (28-193 msec ~39 msec)
> ACL Data RX: Handle 486 flags 0x02 dlen 21                #78 [hci1] 5.268115
      SMP: Pairing Random (0x04) len 16
        Random value: 30b088817e986c1df513cce55e05c374
< HCI Command: Host Number of Compl.. (0x03|0x0035) plen 5  #79 [hci1] 5.284826
        Num handles: 1
        Handle: 486 Address: DF:A9:FF:F6:B1:1A (OUI DF-A9-FF)
        Count: 1
< ACL Data TX: Handle 486 flags 0x00 dlen 21                #80 [hci1] 5.285075
      SMP: Pairing Confirm (0x03) len 16
        Confim value: ae5667b1ae5fac612b289050d78c8283
> HCI Event: Number of Completed Packets (0x13) plen 5      #81 [hci1] 5.317961
        Num handles: 1
        Handle: 486 Address: DF:A9:FF:F6:B1:1A (OUI DF-A9-FF)
        Count: 1
        #80: len 21 (5 Kb/s)
        Latency: 32 msec (28-193 msec ~36 msec)
> ACL Data RX: Handle 486 flags 0x02 dlen 21                #82 [hci1] 5.368125
      SMP: Pairing Confirm (0x03) len 16
        Confim value: 28e3b1619e5559d2a0985e55b1f8850b
< HCI Command: Host Number of Compl.. (0x03|0x0035) plen 5  #83 [hci1] 5.384492
        Num handles: 1
        Handle: 486 Address: DF:A9:FF:F6:B1:1A (OUI DF-A9-FF)
        Count: 1
< ACL Data TX: Handle 486 flags 0x00 dlen 21                #84 [hci1] 5.384623
      SMP: Pairing Random (0x04) len 16
        Random value: 5e8286bc235a02440d0c3424a2acf8fd
> HCI Event: Number of Completed Packets (0x13) plen 5      #85 [hci1] 5.417962
        Num handles: 1
        Handle: 486 Address: DF:A9:FF:F6:B1:1A (OUI DF-A9-FF)
        Count: 1
        #84: len 21 (5 Kb/s)
        Latency: 33 msec (28-193 msec ~34 msec)
> ACL Data RX: Handle 486 flags 0x02 dlen 21                #86 [hci1] 5.668170
      SMP: Pairing Random (0x04) len 16
        Random value: dd2bcd285bf151b42201d454f7e837b8
< HCI Command: Host Number of Compl.. (0x03|0x0035) plen 5  #87 [hci1] 5.684711
        Num handles: 1
        Handle: 486 Address: DF:A9:FF:F6:B1:1A (OUI DF-A9-FF)
        Count: 1
< ACL Data TX: Handle 486 flags 0x00 dlen 21                #88 [hci1] 5.684906
      SMP: Pairing Confirm (0x03) len 16
        Confim value: a790a299afc948171a59852003d24197
> HCI Event: Number of Completed Packets (0x13) plen 5      #89 [hci1] 5.717989
        Num handles: 1
        Handle: 486 Address: DF:A9:FF:F6:B1:1A (OUI DF-A9-FF)
        Count: 1
        #88: len 21 (5 Kb/s)
        Latency: 33 msec (28-193 msec ~33 msec)
> ACL Data RX: Handle 486 flags 0x02 dlen 21                #90 [hci1] 5.768176
      SMP: Pairing Confirm (0x03) len 16
        Confim value: 62b67a88978e2e489a8ae7dfcc94e6e6
< HCI Command: Host Number of Compl.. (0x03|0x0035) plen 5  #91 [hci1] 5.784741
        Num handles: 1
        Handle: 486 Address: DF:A9:FF:F6:B1:1A (OUI DF-A9-FF)
        Count: 1
< ACL Data TX: Handle 486 flags 0x00 dlen 21                #92 [hci1] 5.784940
      SMP: Pairing Random (0x04) len 16
        Random value: 5c4a1bcadd27bd58e945097b00bad7ac
> HCI Event: Number of Completed Packets (0x13) plen 5      #93 [hci1] 5.817908
        Num handles: 1
        Handle: 486 Address: DF:A9:FF:F6:B1:1A (OUI DF-A9-FF)
        Count: 1
        #92: len 21 (5 Kb/s)
        Latency: 32 msec (28-193 msec ~33 msec)
> ACL Data RX: Handle 486 flags 0x02 dlen 21                #94 [hci1] 6.068249
      SMP: Pairing Random (0x04) len 16
        Random value: f39e9be8e1d8363a590658dee1206957
< HCI Command: Host Number of Compl.. (0x03|0x0035) plen 5  #95 [hci1] 6.084490
        Num handles: 1
        Handle: 486 Address: DF:A9:FF:F6:B1:1A (OUI DF-A9-FF)
        Count: 1
< ACL Data TX: Handle 486 flags 0x00 dlen 21                #96 [hci1] 6.084590
      SMP: Pairing Confirm (0x03) len 16
        Confim value: 60b7c9058bf74d45aa8193c8ddded07c
> HCI Event: Number of Completed Packets (0x13) plen 5      #97 [hci1] 6.117970
        Num handles: 1
        Handle: 486 Address: DF:A9:FF:F6:B1:1A (OUI DF-A9-FF)
        Count: 1
        #96: len 21 (5 Kb/s)
        Latency: 33 msec (28-193 msec ~33 msec)
> ACL Data RX: Handle 486 flags 0x02 dlen 21                #98 [hci1] 6.168103
      SMP: Pairing Confirm (0x03) len 16
        Confim value: 960fe89d052945b46a434bc48bc93f35
< HCI Command: Host Number of Compl.. (0x03|0x0035) plen 5  #99 [hci1] 6.184826
        Num handles: 1
        Handle: 486 Address: DF:A9:FF:F6:B1:1A (OUI DF-A9-FF)
        Count: 1
< ACL Data TX: Handle 486 flags 0x00 dlen 21               #100 [hci1] 6.185067
      SMP: Pairing Random (0x04) len 16
        Random value: 32527e6e64e79f33b2e374394db8ab2d
> HCI Event: Number of Completed Packets (0x13) plen 5     #101 [hci1] 6.217927
        Num handles: 1
        Handle: 486 Address: DF:A9:FF:F6:B1:1A (OUI DF-A9-FF)
        Count: 1
        #100: len 21 (5 Kb/s)
        Latency: 32 msec (28-193 msec ~33 msec)
> ACL Data RX: Handle 486 flags 0x02 dlen 21               #102 [hci1] 6.468055
      SMP: Pairing Random (0x04) len 16
        Random value: df3936a96c2dd1c9e9b380cd5aeeefca
< HCI Command: Host Number of Comp.. (0x03|0x0035) plen 5  #103 [hci1] 6.484642
        Num handles: 1
        Handle: 486 Address: DF:A9:FF:F6:B1:1A (OUI DF-A9-FF)
        Count: 1
< ACL Data TX: Handle 486 flags 0x00 dlen 21               #104 [hci1] 6.484772
      SMP: Pairing Confirm (0x03) len 16
        Confim value: 26ba7867c26c32a7a7fe0ff912ae22eb
> HCI Event: Number of Completed Packets (0x13) plen 5     #105 [hci1] 6.517930
        Num handles: 1
        Handle: 486 Address: DF:A9:FF:F6:B1:1A (OUI DF-A9-FF)
        Count: 1
        #104: len 21 (5 Kb/s)
        Latency: 33 msec (28-193 msec ~33 msec)
> ACL Data RX: Handle 486 flags 0x02 dlen 21               #106 [hci1] 6.568046
      SMP: Pairing Confirm (0x03) len 16
        Confim value: ab2ee249509f24064c863ea7e040e471
< HCI Command: Host Number of Comp.. (0x03|0x0035) plen 5  #107 [hci1] 6.584824
        Num handles: 1
        Handle: 486 Address: DF:A9:FF:F6:B1:1A (OUI DF-A9-FF)
        Count: 1
< ACL Data TX: Handle 486 flags 0x00 dlen 21               #108 [hci1] 6.585083
      SMP: Pairing Random (0x04) len 16
        Random value: dddbdfe2838e9a8cc6964353c850fef7
> HCI Event: Number of Completed Packets (0x13) plen 5     #109 [hci1] 6.617859
        Num handles: 1
        Handle: 486 Address: DF:A9:FF:F6:B1:1A (OUI DF-A9-FF)
        Count: 1
        #108: len 21 (5 Kb/s)
        Latency: 32 msec (28-193 msec ~32 msec)
> ACL Data RX: Handle 486 flags 0x02 dlen 21               #110 [hci1] 6.868091
      SMP: Pairing Random (0x04) len 16
        Random value: 4e6e2293991118ba5dd9afaaded39dcb
< HCI Command: Host Number of Comp.. (0x03|0x0035) plen 5  #111 [hci1] 6.884422
        Num handles: 1
        Handle: 486 Address: DF:A9:FF:F6:B1:1A (OUI DF-A9-FF)
        Count: 1
< ACL Data TX: Handle 486 flags 0x00 dlen 21               #112 [hci1] 6.884450
      SMP: Pairing Confirm (0x03) len 16
        Confim value: aa74cfc496bfbb3749231d34c7f8940a
> HCI Event: Number of Completed Packets (0x13) plen 5     #113 [hci1] 6.917846
        Num handles: 1
        Handle: 486 Address: DF:A9:FF:F6:B1:1A (OUI DF-A9-FF)
        Count: 1
        #112: len 21 (5 Kb/s)
        Latency: 33 msec (28-193 msec ~33 msec)
> ACL Data RX: Handle 486 flags 0x02 dlen 21               #114 [hci1] 6.967984
      SMP: Pairing Confirm (0x03) len 16
        Confim value: cfbfa9dd8dba59f99d240ae4aa60711d
< HCI Command: Host Number of Comp.. (0x03|0x0035) plen 5  #115 [hci1] 6.984785
        Num handles: 1
        Handle: 486 Address: DF:A9:FF:F6:B1:1A (OUI DF-A9-FF)
        Count: 1
< ACL Data TX: Handle 486 flags 0x00 dlen 21               #116 [hci1] 6.984997
      SMP: Pairing Random (0x04) len 16
        Random value: eb9f1915536596b6fc3db1c86b2b1970
> HCI Event: Number of Completed Packets (0x13) plen 5     #117 [hci1] 7.017945
        Num handles: 1
        Handle: 486 Address: DF:A9:FF:F6:B1:1A (OUI DF-A9-FF)
        Count: 1
        #116: len 21 (5 Kb/s)
        Latency: 32 msec (28-193 msec ~33 msec)
> ACL Data RX: Handle 486 flags 0x02 dlen 21               #118 [hci1] 7.268031
      SMP: Pairing Random (0x04) len 16
        Random value: 2eee261145e63ea583898b3c2b8f8952
< HCI Command: Host Number of Comp.. (0x03|0x0035) plen 5  #119 [hci1] 7.285036
        Num handles: 1
        Handle: 486 Address: DF:A9:FF:F6:B1:1A (OUI DF-A9-FF)
        Count: 1
< ACL Data TX: Handle 486 flags 0x00 dlen 21               #120 [hci1] 7.285230
      SMP: Pairing Confirm (0x03) len 16
        Confim value: 3b47169fe784aa03ee034864a721a8eb
> HCI Event: Number of Completed Packets (0x13) plen 5     #121 [hci1] 7.317996
        Num handles: 1
        Handle: 486 Address: DF:A9:FF:F6:B1:1A (OUI DF-A9-FF)
        Count: 1
        #120: len 21 (5 Kb/s)
        Latency: 32 msec (28-193 msec ~32 msec)
> ACL Data RX: Handle 486 flags 0x02 dlen 21               #122 [hci1] 7.368093
      SMP: Pairing Confirm (0x03) len 16
        Confim value: d5d1831abc3ddc635d50e10e33fd9af0
< HCI Command: Host Number of Comp.. (0x03|0x0035) plen 5  #123 [hci1] 7.384893
        Num handles: 1
        Handle: 486 Address: DF:A9:FF:F6:B1:1A (OUI DF-A9-FF)
        Count: 1
< ACL Data TX: Handle 486 flags 0x00 dlen 21               #124 [hci1] 7.385094
      SMP: Pairing Random (0x04) len 16
        Random value: 5c794dc9ad9f2c3f295ebd5ad5e1c3cf
> HCI Event: Number of Completed Packets (0x13) plen 5     #125 [hci1] 7.417907
        Num handles: 1
        Handle: 486 Address: DF:A9:FF:F6:B1:1A (OUI DF-A9-FF)
        Count: 1
        #124: len 21 (5 Kb/s)
        Latency: 32 msec (28-193 msec ~32 msec)
> ACL Data RX: Handle 486 flags 0x02 dlen 21               #126 [hci1] 7.668082
      SMP: Pairing Random (0x04) len 16
        Random value: aba946ca8d4cb9646814f88f3d250798
< HCI Command: Host Number of Comp.. (0x03|0x0035) plen 5  #127 [hci1] 7.685017
        Num handles: 1
        Handle: 486 Address: DF:A9:FF:F6:B1:1A (OUI DF-A9-FF)
        Count: 1
< ACL Data TX: Handle 486 flags 0x00 dlen 21               #128 [hci1] 7.685237
      SMP: Pairing Confirm (0x03) len 16
        Confim value: f9a1d131643ae569bbb83fcb34f3ed02
> HCI Event: Number of Completed Packets (0x13) plen 5     #129 [hci1] 7.717905
        Num handles: 1
        Handle: 486 Address: DF:A9:FF:F6:B1:1A (OUI DF-A9-FF)
        Count: 1
        #128: len 21 (5 Kb/s)
        Latency: 32 msec (28-193 msec ~32 msec)
> ACL Data RX: Handle 486 flags 0x02 dlen 21               #130 [hci1] 7.768121
      SMP: Pairing Confirm (0x03) len 16
        Confim value: 708003f15f46f90e3b8fbd44f6d9cba9
< HCI Command: Host Number of Comp.. (0x03|0x0035) plen 5  #131 [hci1] 7.784833
        Num handles: 1
        Handle: 486 Address: DF:A9:FF:F6:B1:1A (OUI DF-A9-FF)
        Count: 1
< ACL Data TX: Handle 486 flags 0x00 dlen 21               #132 [hci1] 7.785046
      SMP: Pairing Random (0x04) len 16
        Random value: 5c2fff312cdf99c9491988e877355a9a
> HCI Event: Number of Completed Packets (0x13) plen 5     #133 [hci1] 7.817824
        Num handles: 1
        Handle: 486 Address: DF:A9:FF:F6:B1:1A (OUI DF-A9-FF)
        Count: 1
        #132: len 21 (5 Kb/s)
        Latency: 32 msec (28-193 msec ~32 msec)
> ACL Data RX: Handle 486 flags 0x02 dlen 21               #134 [hci1] 8.068203
      SMP: Pairing Random (0x04) len 16
        Random value: 32d0c7a8ce253e10580b1ce952d4ac16
< HCI Command: Host Number of Comp.. (0x03|0x0035) plen 5  #135 [hci1] 8.084990
        Num handles: 1
        Handle: 486 Address: DF:A9:FF:F6:B1:1A (OUI DF-A9-FF)
        Count: 1
< ACL Data TX: Handle 486 flags 0x00 dlen 21               #136 [hci1] 8.085179
      SMP: Pairing Confirm (0x03) len 16
        Confim value: df26513ad63796fbc1781125f62e793a
> HCI Event: Number of Completed Packets (0x13) plen 5     #137 [hci1] 8.117952
        Num handles: 1
        Handle: 486 Address: DF:A9:FF:F6:B1:1A (OUI DF-A9-FF)
        Count: 1
        #136: len 21 (5 Kb/s)
        Latency: 32 msec (28-193 msec ~32 msec)
> ACL Data RX: Handle 486 flags 0x02 dlen 21               #138 [hci1] 8.168189
      SMP: Pairing Confirm (0x03) len 16
        Confim value: 53afa495c8bd233b53e62d33aac3f2b7
< HCI Command: Host Number of Comp.. (0x03|0x0035) plen 5  #139 [hci1] 8.184846
        Num handles: 1
        Handle: 486 Address: DF:A9:FF:F6:B1:1A (OUI DF-A9-FF)
        Count: 1
< ACL Data TX: Handle 486 flags 0x00 dlen 21               #140 [hci1] 8.185006
      SMP: Pairing Random (0x04) len 16
        Random value: c629a3a987d808e808655d558dfc1155
> HCI Event: Number of Completed Packets (0x13) plen 5     #141 [hci1] 8.217977
        Num handles: 1
        Handle: 486 Address: DF:A9:FF:F6:B1:1A (OUI DF-A9-FF)
        Count: 1
        #140: len 21 (5 Kb/s)
        Latency: 32 msec (28-193 msec ~32 msec)
> ACL Data RX: Handle 486 flags 0x02 dlen 21               #142 [hci1] 8.468003
      SMP: Pairing Random (0x04) len 16
        Random value: 71d62fd5a591c201e1405cd6e61e4e86
< HCI Command: Host Number of Comp.. (0x03|0x0035) plen 5  #143 [hci1] 8.484586
        Num handles: 1
        Handle: 486 Address: DF:A9:FF:F6:B1:1A (OUI DF-A9-FF)
        Count: 1
< ACL Data TX: Handle 486 flags 0x00 dlen 21               #144 [hci1] 8.484700
      SMP: Pairing Confirm (0x03) len 16
        Confim value: 7be214f876f1caac6100495c992bc701
> HCI Event: Number of Completed Packets (0x13) plen 5     #145 [hci1] 8.517893
        Num handles: 1
        Handle: 486 Address: DF:A9:FF:F6:B1:1A (OUI DF-A9-FF)
        Count: 1
        #144: len 21 (5 Kb/s)
        Latency: 33 msec (28-193 msec ~33 msec)
> ACL Data RX: Handle 486 flags 0x02 dlen 21               #146 [hci1] 8.568033
      SMP: Pairing Confirm (0x03) len 16
        Confim value: 75b7abc22439f787563492a0bf2fc6d0
< HCI Command: Host Number of Comp.. (0x03|0x0035) plen 5  #147 [hci1] 8.584683
        Num handles: 1
        Handle: 486 Address: DF:A9:FF:F6:B1:1A (OUI DF-A9-FF)
        Count: 1
< ACL Data TX: Handle 486 flags 0x00 dlen 21               #148 [hci1] 8.584833
      SMP: Pairing Random (0x04) len 16
        Random value: 92f20f6ad8f13724432c7fd6001c45ff
> HCI Event: Number of Completed Packets (0x13) plen 5     #149 [hci1] 8.617993
        Num handles: 1
        Handle: 486 Address: DF:A9:FF:F6:B1:1A (OUI DF-A9-FF)
        Count: 1
        #148: len 21 (5 Kb/s)
        Latency: 33 msec (28-193 msec ~33 msec)
> ACL Data RX: Handle 486 flags 0x02 dlen 21               #150 [hci1] 8.868176
      SMP: Pairing Random (0x04) len 16
        Random value: 546941b8eff179d2d0c25c1cb7c301e0
< HCI Command: Host Number of Comp.. (0x03|0x0035) plen 5  #151 [hci1] 8.884904
        Num handles: 1
        Handle: 486 Address: DF:A9:FF:F6:B1:1A (OUI DF-A9-FF)
        Count: 1
< ACL Data TX: Handle 486 flags 0x00 dlen 21               #152 [hci1] 8.885143
      SMP: Pairing Confirm (0x03) len 16
        Confim value: 0add60f35f5ece692126d79eddf6e816
> HCI Event: Number of Completed Packets (0x13) plen 5     #153 [hci1] 8.917825
        Num handles: 1
        Handle: 486 Address: DF:A9:FF:F6:B1:1A (OUI DF-A9-FF)
        Count: 1
        #152: len 21 (5 Kb/s)
        Latency: 32 msec (28-193 msec ~32 msec)
> ACL Data RX: Handle 486 flags 0x02 dlen 21               #154 [hci1] 8.968164
      SMP: Pairing Confirm (0x03) len 16
        Confim value: 0e753a54fb585a8031de9dc9dd98da76
< HCI Command: Host Number of Comp.. (0x03|0x0035) plen 5  #155 [hci1] 8.984574
        Num handles: 1
        Handle: 486 Address: DF:A9:FF:F6:B1:1A (OUI DF-A9-FF)
        Count: 1
< ACL Data TX: Handle 486 flags 0x00 dlen 21               #156 [hci1] 8.984732
      SMP: Pairing Random (0x04) len 16
        Random value: 23ac32ebbb5e14c8a6b9622f296d277f
> HCI Event: Number of Completed Packets (0x13) plen 5     #157 [hci1] 9.017907
        Num handles: 1
        Handle: 486 Address: DF:A9:FF:F6:B1:1A (OUI DF-A9-FF)
        Count: 1
        #156: len 21 (5 Kb/s)
        Latency: 33 msec (28-193 msec ~33 msec)
> ACL Data RX: Handle 486 flags 0x02 dlen 21               #158 [hci1] 9.268020
      SMP: Pairing Random (0x04) len 16
        Random value: 087d04fbc9e6da5932e402c6c2c61b5c
< HCI Command: Host Number of Comp.. (0x03|0x0035) plen 5  #159 [hci1] 9.285058
        Num handles: 1
        Handle: 486 Address: DF:A9:FF:F6:B1:1A (OUI DF-A9-FF)
        Count: 1
< ACL Data TX: Handle 486 flags 0x00 dlen 21               #160 [hci1] 9.285269
      SMP: Pairing Confirm (0x03) len 16
        Confim value: 8f45eb6e4cfc4ad96f28534330198935
> HCI Event: Number of Completed Packets (0x13) plen 5     #161 [hci1] 9.317964
        Num handles: 1
        Handle: 486 Address: DF:A9:FF:F6:B1:1A (OUI DF-A9-FF)
        Count: 1
        #160: len 21 (5 Kb/s)
        Latency: 32 msec (28-193 msec ~32 msec)
> ACL Data RX: Handle 486 flags 0x02 dlen 21               #162 [hci1] 9.368134
      SMP: Pairing Confirm (0x03) len 16
        Confim value: a343d103d3f33e069ab34b69660c5077
< HCI Command: Host Number of Comp.. (0x03|0x0035) plen 5  #163 [hci1] 9.384824
        Num handles: 1
        Handle: 486 Address: DF:A9:FF:F6:B1:1A (OUI DF-A9-FF)
        Count: 1
< ACL Data TX: Handle 486 flags 0x00 dlen 21               #164 [hci1] 9.385056
      SMP: Pairing Random (0x04) len 16
        Random value: 297efe85e67448a15f56bd27e3a3cf1d
> HCI Event: Number of Completed Packets (0x13) plen 5     #165 [hci1] 9.417878
        Num handles: 1
        Handle: 486 Address: DF:A9:FF:F6:B1:1A (OUI DF-A9-FF)
        Count: 1
        #164: len 21 (5 Kb/s)
        Latency: 32 msec (28-193 msec ~32 msec)
> ACL Data RX: Handle 486 flags 0x02 dlen 21               #166 [hci1] 9.668120
      SMP: Pairing Random (0x04) len 16
        Random value: fa41bc87905299b25435721d43673076
< HCI Command: Host Number of Comp.. (0x03|0x0035) plen 5  #167 [hci1] 9.684969
        Num handles: 1
        Handle: 486 Address: DF:A9:FF:F6:B1:1A (OUI DF-A9-FF)
        Count: 1
< ACL Data TX: Handle 486 flags 0x00 dlen 21               #168 [hci1] 9.685236
      SMP: Pairing Confirm (0x03) len 16
        Confim value: 132079b459b8f7b87a17827ffaacf8e3
> HCI Event: Number of Completed Packets (0x13) plen 5     #169 [hci1] 9.717952
        Num handles: 1
        Handle: 486 Address: DF:A9:FF:F6:B1:1A (OUI DF-A9-FF)
        Count: 1
        #168: len 21 (5 Kb/s)
        Latency: 32 msec (28-193 msec ~32 msec)
> ACL Data RX: Handle 486 flags 0x02 dlen 21               #170 [hci1] 9.767983
      SMP: Pairing Confirm (0x03) len 16
        Confim value: a76e72905702f45a57cb53543072867f
< HCI Command: Host Number of Comp.. (0x03|0x0035) plen 5  #171 [hci1] 9.784845
        Num handles: 1
        Handle: 486 Address: DF:A9:FF:F6:B1:1A (OUI DF-A9-FF)
        Count: 1
< ACL Data TX: Handle 486 flags 0x00 dlen 21               #172 [hci1] 9.785075
      SMP: Pairing Random (0x04) len 16
        Random value: 25a9493fd3ce4faf02be7293595bb7c6
> HCI Event: Number of Completed Packets (0x13) plen 5     #173 [hci1] 9.817868
        Num handles: 1
        Handle: 486 Address: DF:A9:FF:F6:B1:1A (OUI DF-A9-FF)
        Count: 1
        #172: len 21 (5 Kb/s)
        Latency: 32 msec (28-193 msec ~32 msec)
> ACL Data RX: Handle 486 flags 0x02 dlen 21              #174 [hci1] 10.067968
      SMP: Pairing Random (0x04) len 16
        Random value: d826ee85e155aa34c28812a9b72615e4
< HCI Command: Host Number of Com.. (0x03|0x0035) plen 5  #175 [hci1] 10.084784
        Num handles: 1
        Handle: 486 Address: DF:A9:FF:F6:B1:1A (OUI DF-A9-FF)
        Count: 1
< ACL Data TX: Handle 486 flags 0x00 dlen 21              #176 [hci1] 10.085013
      SMP: Pairing Confirm (0x03) len 16
        Confim value: 567d35b630d7c69913afb36b62c3ca1e
> HCI Event: Number of Completed Packets (0x13) plen 5    #177 [hci1] 10.117851
        Num handles: 1
        Handle: 486 Address: DF:A9:FF:F6:B1:1A (OUI DF-A9-FF)
        Count: 1
        #176: len 21 (5 Kb/s)
        Latency: 32 msec (28-193 msec ~32 msec)
> ACL Data RX: Handle 486 flags 0x02 dlen 21              #178 [hci1] 10.167945
      SMP: Pairing Confirm (0x03) len 16
        Confim value: ba21dae930edde307795a962d8c0cb26
< HCI Command: Host Number of Com.. (0x03|0x0035) plen 5  #179 [hci1] 10.184877
        Num handles: 1
        Handle: 486 Address: DF:A9:FF:F6:B1:1A (OUI DF-A9-FF)
        Count: 1
< ACL Data TX: Handle 486 flags 0x00 dlen 21              #180 [hci1] 10.185127
      SMP: Pairing Random (0x04) len 16
        Random value: 58f6b41f855a6f6c3560debd84e2affc
> HCI Event: Number of Completed Packets (0x13) plen 5    #181 [hci1] 10.217863
        Num handles: 1
        Handle: 486 Address: DF:A9:FF:F6:B1:1A (OUI DF-A9-FF)
        Count: 1
        #180: len 21 (5 Kb/s)
        Latency: 32 msec (28-193 msec ~32 msec)
> ACL Data RX: Handle 486 flags 0x02 dlen 21              #182 [hci1] 10.467999
      SMP: Pairing Random (0x04) len 16
        Random value: 8ede5f5e995043794aed8733dcc5e0a0
< HCI Command: Host Number of Com.. (0x03|0x0035) plen 5  #183 [hci1] 10.484862
        Num handles: 1
        Handle: 486 Address: DF:A9:FF:F6:B1:1A (OUI DF-A9-FF)
        Count: 1
< ACL Data TX: Handle 486 flags 0x00 dlen 21              #184 [hci1] 10.485049
      SMP: Pairing Confirm (0x03) len 16
        Confim value: 9d6ca590de12d2ee4e36947900c44cf1
> HCI Event: Number of Completed Packets (0x13) plen 5    #185 [hci1] 10.517915
        Num handles: 1
        Handle: 486 Address: DF:A9:FF:F6:B1:1A (OUI DF-A9-FF)
        Count: 1
        #184: len 21 (5 Kb/s)
        Latency: 32 msec (28-193 msec ~32 msec)
> ACL Data RX: Handle 486 flags 0x02 dlen 21              #186 [hci1] 10.567954
      SMP: Pairing Confirm (0x03) len 16
        Confim value: 9bb18fb35c5f9d21b6d4dd9c10c0a276
< HCI Command: Host Number of Com.. (0x03|0x0035) plen 5  #187 [hci1] 10.584772
        Num handles: 1
        Handle: 486 Address: DF:A9:FF:F6:B1:1A (OUI DF-A9-FF)
        Count: 1
< ACL Data TX: Handle 486 flags 0x00 dlen 21              #188 [hci1] 10.584939
      SMP: Pairing Random (0x04) len 16
        Random value: b67e7216d5bf664139eda2b542549666
> HCI Event: Number of Completed Packets (0x13) plen 5    #189 [hci1] 10.617782
        Num handles: 1
        Handle: 486 Address: DF:A9:FF:F6:B1:1A (OUI DF-A9-FF)
        Count: 1
        #188: len 21 (5 Kb/s)
        Latency: 32 msec (28-193 msec ~32 msec)
> ACL Data RX: Handle 486 flags 0x02 dlen 21              #190 [hci1] 10.867991
      SMP: Pairing Random (0x04) len 16
        Random value: 495a14bbd5e5d95af9b4b6c5ae45e5e4
< HCI Command: Host Number of Com.. (0x03|0x0035) plen 5  #191 [hci1] 10.884969
        Num handles: 1
        Handle: 486 Address: DF:A9:FF:F6:B1:1A (OUI DF-A9-FF)
        Count: 1
< ACL Data TX: Handle 486 flags 0x00 dlen 21              #192 [hci1] 10.885207
      SMP: Pairing Confirm (0x03) len 16
        Confim value: 71e578c432cc8f114498732cf0b9c72c
> HCI Event: Number of Completed Packets (0x13) plen 5    #193 [hci1] 10.917817
        Num handles: 1
        Handle: 486 Address: DF:A9:FF:F6:B1:1A (OUI DF-A9-FF)
        Count: 1
        #192: len 21 (5 Kb/s)
        Latency: 32 msec (28-193 msec ~32 msec)
> ACL Data RX: Handle 486 flags 0x02 dlen 21              #194 [hci1] 10.968004
      SMP: Pairing Confirm (0x03) len 16
        Confim value: bc4a41349872d83804c8ab4c96c73a9f
< HCI Command: Host Number of Com.. (0x03|0x0035) plen 5  #195 [hci1] 10.984940
        Num handles: 1
        Handle: 486 Address: DF:A9:FF:F6:B1:1A (OUI DF-A9-FF)
        Count: 1
< ACL Data TX: Handle 486 flags 0x00 dlen 21              #196 [hci1] 10.985142
      SMP: Pairing Random (0x04) len 16
        Random value: ed17f76500c95219dd01e09d1e63f87b
> HCI Event: Number of Completed Packets (0x13) plen 5    #197 [hci1] 11.017833
        Num handles: 1
        Handle: 486 Address: DF:A9:FF:F6:B1:1A (OUI DF-A9-FF)
        Count: 1
        #196: len 21 (5 Kb/s)
        Latency: 32 msec (28-193 msec ~32 msec)
> ACL Data RX: Handle 486 flags 0x02 dlen 21              #198 [hci1] 11.268076
      SMP: Pairing Random (0x04) len 16
        Random value: 76ca5285f2f421ef1c70c3a86be7b928
< HCI Command: Host Number of Com.. (0x03|0x0035) plen 5  #199 [hci1] 11.284974
        Num handles: 1
        Handle: 486 Address: DF:A9:FF:F6:B1:1A (OUI DF-A9-FF)
        Count: 1
< ACL Data TX: Handle 486 flags 0x00 dlen 21              #200 [hci1] 11.285130
      SMP: Pairing Confirm (0x03) len 16
        Confim value: df6f62ec71f7ce928b3679394c49efd1
> HCI Event: Number of Completed Packets (0x13) plen 5    #201 [hci1] 11.317760
        Num handles: 1
        Handle: 486 Address: DF:A9:FF:F6:B1:1A (OUI DF-A9-FF)
        Count: 1
        #200: len 21 (5 Kb/s)
        Latency: 32 msec (28-193 msec ~32 msec)
> ACL Data RX: Handle 486 flags 0x02 dlen 21              #202 [hci1] 11.368123
      SMP: Pairing Confirm (0x03) len 16
        Confim value: 2902029faca34883495931336a4f186b
< HCI Command: Host Number of Com.. (0x03|0x0035) plen 5  #203 [hci1] 11.384882
        Num handles: 1
        Handle: 486 Address: DF:A9:FF:F6:B1:1A (OUI DF-A9-FF)
        Count: 1
< ACL Data TX: Handle 486 flags 0x00 dlen 21              #204 [hci1] 11.385082
      SMP: Pairing Random (0x04) len 16
        Random value: 81d35d47e1f6006d79c974bd9d9e1ee3
> HCI Event: Number of Completed Packets (0x13) plen 5    #205 [hci1] 11.417780
        Num handles: 1
        Handle: 486 Address: DF:A9:FF:F6:B1:1A (OUI DF-A9-FF)
        Count: 1
        #204: len 21 (5 Kb/s)
        Latency: 32 msec (28-193 msec ~32 msec)
> ACL Data RX: Handle 486 flags 0x02 dlen 21              #206 [hci1] 11.667995
      SMP: Pairing Random (0x04) len 16
        Random value: c3a09fe58d9e10933ff11464902b3225
< HCI Command: Host Number of Com.. (0x03|0x0035) plen 5  #207 [hci1] 11.685020
        Num handles: 1
        Handle: 486 Address: DF:A9:FF:F6:B1:1A (OUI DF-A9-FF)
        Count: 1
< ACL Data TX: Handle 486 flags 0x00 dlen 21              #208 [hci1] 11.685237
      SMP: Pairing Confirm (0x03) len 16
        Confim value: 05fc125ff421d57f536dcf943ad90907
> HCI Event: Number of Completed Packets (0x13) plen 5    #209 [hci1] 11.717801
        Num handles: 1
        Handle: 486 Address: DF:A9:FF:F6:B1:1A (OUI DF-A9-FF)
        Count: 1
        #208: len 21 (5 Kb/s)
        Latency: 32 msec (28-193 msec ~32 msec)
> ACL Data RX: Handle 486 flags 0x02 dlen 21              #210 [hci1] 11.768060
      SMP: Pairing Confirm (0x03) len 16
        Confim value: 0b7c361856204d97e694dea309094d43
< HCI Command: Host Number of Com.. (0x03|0x0035) plen 5  #211 [hci1] 11.784846
        Num handles: 1
        Handle: 486 Address: DF:A9:FF:F6:B1:1A (OUI DF-A9-FF)
        Count: 1
< ACL Data TX: Handle 486 flags 0x00 dlen 21              #212 [hci1] 11.785064
      SMP: Pairing Random (0x04) len 16
        Random value: e7f7e0c2476823e41736a7e381bafb7c
> HCI Event: Number of Completed Packets (0x13) plen 5    #213 [hci1] 11.817844
        Num handles: 1
        Handle: 486 Address: DF:A9:FF:F6:B1:1A (OUI DF-A9-FF)
        Count: 1
        #212: len 21 (5 Kb/s)
        Latency: 32 msec (28-193 msec ~32 msec)
> ACL Data RX: Handle 486 flags 0x02 dlen 21              #214 [hci1] 12.067975
      SMP: Pairing Random (0x04) len 16
        Random value: 1c8dbe448445dbdc30484dc2d9d465d5
< HCI Command: Host Number of Com.. (0x03|0x0035) plen 5  #215 [hci1] 12.084591
        Num handles: 1
        Handle: 486 Address: DF:A9:FF:F6:B1:1A (OUI DF-A9-FF)
        Count: 1
< ACL Data TX: Handle 486 flags 0x00 dlen 21              #216 [hci1] 12.084712
      SMP: Pairing Confirm (0x03) len 16
        Confim value: 2a5708a7ac7b80e688c03faa0a1c4d53
> HCI Event: Number of Completed Packets (0x13) plen 5    #217 [hci1] 12.117794
        Num handles: 1
        Handle: 486 Address: DF:A9:FF:F6:B1:1A (OUI DF-A9-FF)
        Count: 1
        #216: len 21 (5 Kb/s)
        Latency: 33 msec (28-193 msec ~32 msec)
> ACL Data RX: Handle 486 flags 0x02 dlen 21              #218 [hci1] 12.167928
      SMP: Pairing Confirm (0x03) len 16
        Confim value: c282a1c47a793f21850f8b89cc0d32a9
< HCI Command: Host Number of Com.. (0x03|0x0035) plen 5  #219 [hci1] 12.184589
        Num handles: 1
        Handle: 486 Address: DF:A9:FF:F6:B1:1A (OUI DF-A9-FF)
        Count: 1
< ACL Data TX: Handle 486 flags 0x00 dlen 21              #220 [hci1] 12.184598
      SMP: Pairing Random (0x04) len 16
        Random value: fc8b40d9b0b09bc4296bf8753a8f6e1f
> HCI Event: Number of Completed Packets (0x13) plen 5    #221 [hci1] 12.217788
        Num handles: 1
        Handle: 486 Address: DF:A9:FF:F6:B1:1A (OUI DF-A9-FF)
        Count: 1
        #220: len 21 (5 Kb/s)
        Latency: 33 msec (28-193 msec ~33 msec)
> ACL Data RX: Handle 486 flags 0x02 dlen 21              #222 [hci1] 12.467909
      SMP: Pairing Random (0x04) len 16
        Random value: ae81b64bf289f7a6fcc654cc43e1a56f
< HCI Command: Host Number of Com.. (0x03|0x0035) plen 5  #223 [hci1] 12.485275
        Num handles: 1
        Handle: 486 Address: DF:A9:FF:F6:B1:1A (OUI DF-A9-FF)
        Count: 1
< ACL Data TX: Handle 486 flags 0x00 dlen 21              #224 [hci1] 12.485470
      SMP: Pairing DHKey Check (0x0d) len 16
        E: 57df29225604d3c7ef61cf970d0f28d4
> HCI Event: Number of Completed Packets (0x13) plen 5    #225 [hci1] 12.517752
        Num handles: 1
        Handle: 486 Address: DF:A9:FF:F6:B1:1A (OUI DF-A9-FF)
        Count: 1
        #224: len 21 (5 Kb/s)
        Latency: 32 msec (28-193 msec ~32 msec)
> ACL Data RX: Handle 486 flags 0x02 dlen 21              #226 [hci1] 12.567959
      SMP: Pairing DHKey Check (0x0d) len 16
        E: e96cb83044803bcaa2ba1f0c42e4f1f2
< HCI Command: LE Start Encryption (0x08|0x0019) plen 28  #227 [hci1] 12.584616
        Handle: 486 Address: DF:A9:FF:F6:B1:1A (OUI DF-A9-FF)
        Random number: 0x0000000000000000
        Encrypted diversifier: 0x0000
        Long term key: a70b8d0cd4663f01a164526fc418853d
> HCI Event: Command Status (0x0f) plen 4                 #228 [hci1] 12.585504
      LE Start Encryption (0x08|0x0019) ncmd 1
        Status: Success (0x00)
< HCI Command: Host Number of Com.. (0x03|0x0035) plen 5  #229 [hci1] 12.604339
        Num handles: 1
        Handle: 486 Address: DF:A9:FF:F6:B1:1A (OUI DF-A9-FF)
        Count: 1
> HCI Event: Encryption Change (0x08) plen 4              #230 [hci1] 12.917804
        Status: Success (0x00)
        Handle: 486 Address: DF:A9:FF:F6:B1:1A (OUI DF-A9-FF)
        Encryption: Enabled with AES-CCM (0x01)
