Bluetooth monitor ver 5.72
btmon[2863832]: = Note: Linux version 6.14.0-36-generic (x86_64)                                                         0.847701
btmon[2863832]: = Note: Bluetooth subsystem version 2.22                                                                 0.847703
= New Index: 00:00:00:00:00:00 (Primary,UART,hci1)                                                                       0.847704
= New Index: 48:5F:99:8E:E0:64 (Primary,USB,hci0)                                                                        0.847704
= Open Index: 00:00:00:00:00:00                                                                                          1.362118
= Index Info: 00:00:00:00:00:00 (Nordic Semiconductor ASA)                                                               1.362143
zephyr.exe[2863834]: @ USER Open: main (privileged) version 2.22                                                {0x0001} 1.362153
zephyr.exe[2863834]: < HCI Command: Reset (0x03|0x0003) plen 0                                                        #1 1.363420
> HCI Event: Command Complete (0x0e) plen 4                                                                           #2 1.364000
      Reset (0x03|0x0003) ncmd 1
        Status: Success (0x00)
zephyr.exe[2863834]: < HCI Command: Read Local Supported Features (0x04|0x0003) plen 0                                #3 1.381550
> HCI Event: Command Complete (0x0e) plen 12                                                                          #4 1.382079
      Read Local Supported Features (0x04|0x0003) ncmd 1
        Status: Success (0x00)
        Features: 0x00 0x00 0x00 0x00 0x60 0x00 0x00 0x00
          BR/EDR Not Supported
          LE Supported (Controller)
zephyr.exe[2863834]: < HCI Command: Read Local Version Information (0x04|0x0001) plen 0                               #5 1.401573
> HCI Event: Command Complete (0x0e) plen 12                                                                          #6 1.402102
      Read Local Version Information (0x04|0x0001) ncmd 1
        Status: Success (0x00)
        HCI version: Reserved (0x0f) - Revision 12393 (0x3069)
        LMP version: Reserved (0x0f) - Subversion 12393 (0x3069)
        Manufacturer: Nordic Semiconductor ASA (89)
zephyr.exe[2863834]: < HCI Command: Read Local Supported Commands (0x04|0x0002) plen 0                                #7 1.421552
> HCI Event: Command Complete (0x0e) plen 68                                                                          #8 1.422656
      Read Local Supported Commands (0x04|0x0002) ncmd 1
        Status: Success (0x00)
        Commands: 119 entries
          Disconnect (Octet 0 - Bit 5)
          Read Remote Version Information (Octet 2 - Bit 7)
          Set Event Mask (Octet 5 - Bit 6)
          Reset (Octet 5 - Bit 7)
          Read Connection Accept Timeout (Octet 7 - Bit 2)
          Write Connection Accept Timeout (Octet 7 - Bit 3)
          Read Transmit Power Level (Octet 10 - Bit 2)
          Set Controller To Host Flow Control (Octet 10 - Bit 5)
          Host Buffer Size (Octet 10 - Bit 6)
          Host Number of Completed Packets (Octet 10 - Bit 7)
          Read Local Version Information (Octet 14 - Bit 3)
          Read Local Supported Features (Octet 14 - Bit 5)
          Read BD ADDR (Octet 15 - Bit 1)
          Read RSSI (Octet 15 - Bit 5)
          Set Event Mask Page 2 (Octet 22 - Bit 2)
          LE Set Event Mask (Octet 25 - Bit 0)
          LE Read Buffer Size (Octet 25 - Bit 1)
          LE Read Local Supported Features (Octet 25 - Bit 2)
          LE Set Random Address (Octet 25 - Bit 4)
          LE Set Advertising Parameters (Octet 25 - Bit 5)
          LE Read Advertising Channel TX Power (Octet 25 - Bit 6)
          LE Set Advertising Data (Octet 25 - Bit 7)
          LE Set Scan Response Data (Octet 26 - Bit 0)
          LE Set Advertise Enable (Octet 26 - Bit 1)
          LE Set Scan Parameters (Octet 26 - Bit 2)
          LE Set Scan Enable (Octet 26 - Bit 3)
          LE Create Connection (Octet 26 - Bit 4)
          LE Create Connection Cancel (Octet 26 - Bit 5)
          LE Read Accept List Size (Octet 26 - Bit 6)
          LE Clear Accept List (Octet 26 - Bit 7)
          LE Add Device To Accept List (Octet 27 - Bit 0)
          LE Remove Device From Accept List (Octet 27 - Bit 1)
          LE Connection Update (Octet 27 - Bit 2)
          LE Set Host Channel Classification (Octet 27 - Bit 3)
          LE Read Channel Map (Octet 27 - Bit 4)
          LE Read Remote Used Features (Octet 27 - Bit 5)
          LE Encrypt (Octet 27 - Bit 6)
          LE Rand (Octet 27 - Bit 7)
          LE Start Encryption (Octet 28 - Bit 0)
          LE Long Term Key Request Reply (Octet 28 - Bit 1)
          LE Long Term Key Request Neg Reply (Octet 28 - Bit 2)
          LE Read Supported States (Octet 28 - Bit 3)
          LE Receiver Test (Octet 28 - Bit 4)
          LE Transmitter Test (Octet 28 - Bit 5)
          LE Test End (Octet 28 - Bit 6)
          Read Authenticated Payload Timeout (Octet 32 - Bit 4)
          Write Authenticated Payload Timeout (Octet 32 - Bit 5)
          LE Set Data Length (Octet 33 - Bit 6)
          LE Read Suggested Default Data Length (Octet 33 - Bit 7)
          LE Write Suggested Default Data Length (Octet 34 - Bit 0)
          LE Add Device To Resolving List (Octet 34 - Bit 3)
          LE Remove Device From Resolving List (Octet 34 - Bit 4)
          LE Clear Resolving List (Octet 34 - Bit 5)
          LE Read Resolving List Size (Octet 34 - Bit 6)
          LE Set Address Resolution Enable (Octet 35 - Bit 1)
          LE Set Resolvable Private Address Timeout (Octet 35 - Bit 2)
          LE Read Maximum Data Length (Octet 35 - Bit 3)
          LE Read PHY (Octet 35 - Bit 4)
          LE Set Default PHY (Octet 35 - Bit 5)
          LE Set PHY (Octet 35 - Bit 6)
          LE Enhanced Receiver Test (Octet 35 - Bit 7)
          LE Enhanced Transmitter Test (Octet 36 - Bit 0)
          LE Set Advertising Set Random Address (Octet 36 - Bit 1)
          LE Set Extended Advertising Parameters (Octet 36 - Bit 2)
          LE Set Extended Advertising Data (Octet 36 - Bit 3)
          LE Set Extended Scan Response Data (Octet 36 - Bit 4)
          LE Set Extended Advertising Enable (Octet 36 - Bit 5)
          LE Read Maximum Advertising Data Length (Octet 36 - Bit 6)
          LE Read Number of Supported Advertising Sets (Octet 36 - Bit 7)
          LE Remove Advertising Set (Octet 37 - Bit 0)
          LE Clear Advertising Sets (Octet 37 - Bit 1)
          LE Set Periodic Advertising Parameters (Octet 37 - Bit 2)
          LE Set Periodic Advertising Data (Octet 37 - Bit 3)
          LE Set Periodic Advertising Enable (Octet 37 - Bit 4)
          LE Set Extended Scan Parameters (Octet 37 - Bit 5)
          LE Set Extended Scan Enable (Octet 37 - Bit 6)
          LE Extended Create Connection (Octet 37 - Bit 7)
          LE Periodic Advertising Create Sync (Octet 38 - Bit 0)
          LE Periodic Advertising Create Sync Cancel (Octet 38 - Bit 1)
          LE Periodic Advertising Terminate Sync (Octet 38 - Bit 2)
          LE Add Device To Periodic Advertiser List (Octet 38 - Bit 3)
          LE Remove Device From Periodic Advertiser List (Octet 38 - Bit 4)
          LE Clear Periodic Advertiser List (Octet 38 - Bit 5)
          LE Read Periodic Advertiser List Size (Octet 38 - Bit 6)
          LE Read Transmit Power (Octet 38 - Bit 7)
          LE Read RF Path Compensation (Octet 39 - Bit 0)
          LE Write RF Path Compensation (Octet 39 - Bit 1)
          LE Set Privacy Mode (Octet 39 - Bit 2)
          LE Periodic Advertising Receive Enable (Octet 40 - Bit 5)
          LE Periodic Advertising Sync Transfer (Octet 40 - Bit 6)
          LE Periodic Advertising Set Info Transfer (Octet 40 - Bit 7)
          LE Periodic Advertising Sync Transfer Parameters (Octet 41 - Bit 0)
          LE Set Default Periodic Advertisng Sync Transfer Parameters (Octet 41 - Bit 1)
          LE Read Buffer v2 (Octet 41 - Bit 5)
          LE Read ISO TX Sync (Octet 41 - Bit 6)
          LE Set Connected Isochronous Group Parameters (Octet 41 - Bit 7)
          LE Set Connected Isochronous Group Parameters Test (Octet 42 - Bit 0)
          LE Create Connected Isochronous Stream (Octet 42 - Bit 1)
          LE Remove Connected Isochronous Group (Octet 42 - Bit 2)
          LE Accept Connected Isochronous Stream Request (Octet 42 - Bit 3)
          LE Reject Connected Isochronous Stream Request (Octet 42 - Bit 4)
          LE Create Broadcast Isochronous Group (Octet 42 - Bit 5)
          LE Create Broadcast Isochronous Group Test (Octet 42 - Bit 6)
          LE Terminate Broadcast Isochronous Group (Octet 42 - Bit 7)
          LE Broadcast Isochronous Group Create Sync (Octet 43 - Bit 0)
          LE Broadcast Isochronous Group Terminate Sync (Octet 43 - Bit 1)
          LE Request Peer SCA (Octet 43 - Bit 2)
          LE Setup Isochronous Data Path (Octet 43 - Bit 3)
          LE Remove Isochronous Data Path (Octet 43 - Bit 4)
          LE Isochronous Transmit Test (Octet 43 - Bit 5)
          LE Isochronous Receive Test (Octet 43 - Bit 6)
          LE Isochronous Read Test Counters (Octet 43 - Bit 7)
          LE Isochronous Read Test Counters (Octet 44 - Bit 0)
          LE Set Host Feature (Octet 44 - Bit 1)
          Octet 44 - Bit 2 
          Octet 45 - Bit 6 
          Octet 46 - Bit 0 
          Octet 46 - Bit 1 
          Octet 46 - Bit 2 
zephyr.exe[2863834]: < HCI Command: Host Buffer Size (0x03|0x0033) plen 7                                             #9 1.441555
        ACL MTU: 255  ACL max packet: 16
        SCO MTU: 0    SCO max packet: 0
> HCI Event: Command Complete (0x0e) plen 4                                                                          #10 1.442137
      Host Buffer Size (0x03|0x0033) ncmd 1
        Status: Success (0x00)
zephyr.exe[2863834]: < HCI Command: Set Controller To Host Flow Control (0x03|0x0031) plen 1                         #11 1.461553
        Flow control: ACL Data Packets (0x01)
> HCI Event: Command Complete (0x0e) plen 4                                                                          #12 1.461997
      Set Controller To Host Flow Control (0x03|0x0031) ncmd 1
        Status: Success (0x00)
zephyr.exe[2863834]: < HCI Command: LE Read Local Supported Features (0x08|0x0003) plen 0                            #13 1.481562
> HCI Event: Command Complete (0x0e) plen 12                                                                         #14 1.482068
      LE Read Local Supported Features (0x08|0x0003) ncmd 1
        Status: Success (0x00)
        Features: 0xfd 0x79 0x00 0xf7 0x30 0x01 0x00 0x00
          LE Encryption
          Extended Reject Indication
          Peripheral-initiated Features Exchange
          LE Ping
          LE Data Packet Length Extension
          LL Privacy
          Extended Scanner Filter Policies
          LE 2M PHY
          LE Coded PHY
          LE Extended Advertising
          LE Periodic Advertising
          Channel Selection Algorithm #2
          Periodic Advertising Sync Transfer - Sender
          Periodic Advertising Sync Transfer - Recipient
          Sleep Clock Accuracy Updates
          Connected Isochronous Stream - Central
          Connected Isochronous Stream - Peripheral
          Isochronous Broadcaster
          Synchronized Receiver
          Periodic Advertising ADI support
          Connection Subrating
          Unknown features (0x0000010000000000)
zephyr.exe[2863834]: < HCI Command: LE Set Host Feature (0x08|0x0074) plen 2                                         #15 1.501560
        Bit Number: 32
          Connected Isochronous Stream (Host Support)
        Bit Value: 1
> HCI Event: Command Complete (0x0e) plen 4                                                                          #16 1.502066
      LE Set Host Feature (0x08|0x0074) ncmd 1
        Status: Success (0x00)
zephyr.exe[2863834]: < HCI Command: LE Read Buffer v2 (0x08|0x0060) plen 0                                           #17 1.521551
> HCI Event: Command Complete (0x0e) plen 10                                                                         #18 1.522103
      LE Read Buffer v2 (0x08|0x0060) ncmd 1
        Status: Success (0x00)
        ACL MTU: 27
        ACL max packet: 3
        ISO MTU: 318
        ISO max packet: 3
zephyr.exe[2863834]: < HCI Command: LE Read Maximum Advertising Data Length (0x08|0x003a) plen 0                     #19 1.541573
> HCI Event: Command Complete (0x0e) plen 6                                                                          #20 1.542118
      LE Read Maximum Advertising Data Length (0x08|0x003a) ncmd 1
        Status: Success (0x00)
        Max length: 1650
zephyr.exe[2863834]: < HCI Command: LE Read Supported States (0x08|0x001c) plen 0                                    #21 1.561554
> HCI Event: Command Complete (0x0e) plen 12                                                                         #22 1.562133
      LE Read Supported States (0x08|0x001c) ncmd 1
        Status: Success (0x00)
        States: 0x000003ff3e0306ff
          Non-connectable Advertising State
          Scannable Advertising State
          Connectable Advertising State
          High Duty Cycle Directed Advertising State
          Passive Scanning State
          Active Scanning State
          Initiating State
            and Connection State (Central Role)
          Connection State (Peripheral Role)
          Scannable Advertising State
            and Passive Scanning State
          Connectable Advertising State
            and Passive Scanning State
          Non-connectable Advertising State
            and Initiating State
          Scannable Advertising State
            and Initiating State
          Active Scanning State
            and Connection State (Central Role)
          Passive Scanning State
            and Connection State (Peripheral Role)
          Active Scanning State
            and Connection State (Peripheral Role)
          Initiating State
            and Connection State (Central Role)
            and Central Role & Central Role
          Low Duty Cycle Directed Advertising State
          Connectable Advertising State
            and Initiating State
            and Central Role & Peripheral Role
          High Duty Cycle Directed Advertising State
            and Initiating State
            and Central Role & Peripheral Role
          Low Duty Cycle Directed Advertising State
            and Initiating State
            and Central Role & Peripheral Role
          Connectable Advertising State
            and Connection State (Central Role)
            and Central Role & Peripheral Role
          High Duty Cycle Directed Advertising State
            and Connection State (Central Role)
            and Central Role & Peripheral Role
          Low Duty Cycle Directed Advertising State
            and Connection State (Central Role)
            and Central Role & Peripheral Role
          Connectable Advertising State
            and Connection State (Peripheral Role)
            and Central Role & Peripheral Role
          High Duty Cycle Directed Advertising State
            and Connection State (Peripheral Role)
            and Peripheral Role & Peripheral Role
          Low Duty Cycle Directed Advertising State
            and Connection State (Peripheral Role)
            and Peripheral Role & Peripheral Role
          Initiating State
            and Connection State (Peripheral Role)
            and Central Role & Peripheral Role
zephyr.exe[2863834]: < HCI Command: LE Read Maximum Data Length (0x08|0x002f) plen 0                                 #23 1.581552
> HCI Event: Command Complete (0x0e) plen 12                                                                         #24 1.582027
      LE Read Maximum Data Length (0x08|0x002f) ncmd 1
        Status: Success (0x00)
        Max TX octets: 251
        Max TX time: 2704
        Max RX octets: 251
        Max RX time: 2704
zephyr.exe[2863834]: < HCI Command: LE Write Suggested Default Data Length (0x08|0x0024) plen 4                      #25 1.601546
        TX octets: 251
        TX time: 2704
> HCI Event: Command Complete (0x0e) plen 4                                                                          #26 1.601997
      LE Write Suggested Default Data Length (0x08|0x0024) ncmd 1
        Status: Success (0x00)
zephyr.exe[2863834]: < HCI Command: LE Read Resolving List Size (0x08|0x002a) plen 0                                 #27 1.621590
> HCI Event: Command Complete (0x0e) plen 5                                                                          #28 1.621961
      LE Read Resolving List Size (0x08|0x002a) ncmd 1
        Status: Success (0x00)
        Size: 8
zephyr.exe[2863834]: < HCI Command: LE Set Event Mask (0x08|0x0001) plen 8                                           #29 1.641555
        Mask: 0x000002023f87fa5e
          LE Advertising Report
          LE Connection Update Complete
          LE Read Remote Used Features Complete
          LE Long Term Key Request
          LE Data Length Change
          LE Enhanced Connection Complete
          LE PHY Update Complete
          LE Extended Advertising Report
          LE Periodic Advertising Sync Established
          LE Periodic Advertising Report
          LE Periodic Advertising Sync Lost
          LE Extended Scan Timeout
          LE Extended Advertising Set Terminated
          LE Scan Request Received
          LE Periodic Advertising Sync Transfer Rvc
          LE CIS Established
          LE CIS Request
          LE Create BIG Complete
          LE Terminate BIG Complete
          LE BIG Sync Estabilished Complete
          LE BIG Sync Lost
          LE BIG Info Advertising Report
          Unknown mask (0x0000020000000000)
> HCI Event: Command Complete (0x0e) plen 4                                                                          #30 1.642091
      LE Set Event Mask (0x08|0x0001) ncmd 1
        Status: Success (0x00)
zephyr.exe[2863834]: < HCI Command: Set Event Mask (0x03|0x0001) plen 8                                              #31 1.661565
        Mask: 0x2000800002008890
          Disconnection Complete
          Encryption Change
          Read Remote Version Information Complete
          Hardware Error
          Data Buffer Overflow
          Encryption Key Refresh Complete
          LE Meta
> HCI Event: Command Complete (0x0e) plen 4                                                                          #32 1.662186
      Set Event Mask (0x03|0x0001) ncmd 1
        Status: Success (0x00)
zephyr.exe[2863834]: < HCI Command: Read BD ADDR (0x04|0x0009) plen 0                                                #33 1.681586
> HCI Event: Command Complete (0x0e) plen 10                                                                         #34 1.682081
      Read BD ADDR (0x04|0x0009) ncmd 1
        Status: Success (0x00)
        Address: 00:00:00:00:00:00 (OUI 00-00-00)
zephyr.exe[2863834]: < HCI Command: LE Set Random Address (0x08|0x0005) plen 6                                       #35 1.701589
        Address: D5:B6:CC:31:DB:3B (Static)
> HCI Event: Command Complete (0x0e) plen 4                                                                          #36 1.702127
      LE Set Random Address (0x08|0x0005) ncmd 1
        Status: Success (0x00)
zephyr.exe[2863834]: < HCI Command: LE Set Extended Advertising Parameters (0x08|0x0036) plen 25                     #37 4.382136
        Handle: 0x00
        Properties: 0x0001
          Connectable
        Min advertising interval: 100.000 msec (0x00a0)
        Max advertising interval: 150.000 msec (0x00f0)
        Channel map: 37, 38, 39 (0x07)
        Own address type: Random (0x01)
        Peer address type: Public (0x00)
        Peer address: 00:00:00:00:00:00 (OUI 00-00-00)
        Filter policy: Allow Scan Request from Any, Allow Connect Request from Any (0x00)
        TX power: Host has no preference (0x7f)
        Primary PHY: LE 1M (0x01)
        Secondary max skip: 0x00
        Secondary PHY: LE 2M (0x02)
        SID: 0x00
        Scan request notifications: Disabled (0x00)
> HCI Event: Command Complete (0x0e) plen 5                                                                          #38 4.382993
      LE Set Extended Advertising Parameters (0x08|0x0036) ncmd 1
        Status: Success (0x00)
        TX power (selected): 0 dbm (0x00)
zephyr.exe[2863834]: < HCI Command: LE Set Advertising Set Random Address (0x08|0x0035) plen 7                       #39 4.401644
        Advertising handle: 0x00
        Advertising random address: D5:B6:CC:31:DB:3B (Static)
> HCI Event: Command Complete (0x0e) plen 4                                                                          #40 4.402169
      LE Set Advertising Set Random Address (0x08|0x0035) ncmd 1
        Status: Success (0x00)
zephyr.exe[2863834]: < HCI Command: LE Set Extended Advertising Data (0x08|0x0037) plen 39                           #41 4.421581
        Handle: 0x00
        Operation: Complete extended advertising data (0x03)
        Fragment preference: Minimize fragmentation (0x01)
        Data length: 0x23
        Flags: 0x06
          LE General Discoverable Mode
          BR/EDR Not Supported
        Name (complete): Tester_F6B11A
        Flags: 0x06
          LE General Discoverable Mode
          BR/EDR Not Supported
        16-bit Service UUIDs (complete): 1 entry
          Audio Stream Control (0x184e)
        Service Data: Audio Stream Control (0x184e)
          Data: 01ff0fff0f00
> HCI Event: Command Complete (0x0e) plen 4                                                                          #42 4.422604
      LE Set Extended Advertising Data (0x08|0x0037) ncmd 1
        Status: Success (0x00)
zephyr.exe[2863834]: < HCI Command: LE Set Extended Advertising Enable (0x08|0x0039) plen 6                          #43 4.441577
        Extended advertising: Enabled (0x01)
        Number of sets: 1 (0x01)
        Entry 0
          Handle: 0x00
          Duration: 0 ms (0x00)
          Max ext adv events: 0
> HCI Event: Command Complete (0x0e) plen 4                                                                          #44 4.442162
      LE Set Extended Advertising Enable (0x08|0x0039) ncmd 1
        Status: Success (0x00)
> HCI Event: LE Meta Event (0x3e) plen 31                                                                            #45 4.555344
      LE Enhanced Connection Complete (0x0a)
        Status: Success (0x00)
        Handle: 93
        Role: Peripheral (0x01)
        Peer address type: Public (0x00)
        Peer address: DF:A9:FF:F6:B1:1A (OUI DF-A9-FF)
        Local resolvable private address: 00:00:00:00:00:00 (Non-Resolvable)
        Peer resolvable private address: 00:00:00:00:00:00 (Non-Resolvable)
        Connection interval: 87.50 msec (0x0046)
        Connection latency: 0 (0x0000)
        Supervision timeout: 25120 msec (0x09d0)
        Central clock accuracy: 0x01
> HCI Event: LE Meta Event (0x3e) plen 6                                                                             #46 4.555417
      LE Advertising Set Terminated (0x12)
        Status: Success (0x00)
        Handle: 0
        Connection handle: 93
        Number of completed extended advertising events: 0
zephyr.exe[2863834]: < HCI Command: LE Read Remote Used Features (0x08|0x0016) plen 2                                #47 4.561854
        Handle: 93 Address: DF:A9:FF:F6:B1:1A (OUI DF-A9-FF)
zephyr.exe[2863834]: < ACL Data TX: Handle 93 flags 0x00 dlen 7                                                      #48 4.561862
      ATT: Exchange MTU Request (0x02) len 2
        Client RX MTU: 251
> HCI Event: Command Status (0x0f) plen 4                                                                            #49 4.562394
      LE Read Remote Used Features (0x08|0x0016) ncmd 1
        Status: Success (0x00)
> HCI Event: Number of Completed Packets (0x13) plen 5                                                               #50 4.732271
        Num handles: 1
        Handle: 93 Address: DF:A9:FF:F6:B1:1A (OUI DF-A9-FF)
        Count: 1
        #48: len 7 (0 Kb/s)
        Latency: 170 msec (170-170 msec ~170 msec)
> HCI Event: LE Meta Event (0x3e) plen 12                                                                            #51 4.820072
      LE Read Remote Used Features (0x04)
        Status: Success (0x00)
        Handle: 93 Address: DF:A9:FF:F6:B1:1A (OUI DF-A9-FF)
        Features: 0x2d 0x49 0x00 0xf7 0x67 0xd8 0x00 0x00
          LE Encryption
          Extended Reject Indication
          Peripheral-initiated Features Exchange
          LE Data Packet Length Extension
          LE 2M PHY
          LE Coded PHY
          Channel Selection Algorithm #2
          Periodic Advertising Sync Transfer - Sender
          Periodic Advertising Sync Transfer - Recipient
          Sleep Clock Accuracy Updates
          Connected Isochronous Stream - Central
          Connected Isochronous Stream - Peripheral
          Isochronous Broadcaster
          Synchronized Receiver
          Connected Isochronous Stream (Host Support)
          LE Power Control Request
          LE Power Control Request
          Connection Subrating
          Connection Subrating (Host Support)
          Unknown features (0x0000d80000000000)
> ACL Data RX: Handle 93 flags 0x02 dlen 7                                                                           #52 5.257265
      ATT: Exchange MTU Request (0x02) len 2
        Client RX MTU: 64
> ACL Data RX: Handle 93 flags 0x02 dlen 7                                                                           #53 5.257676
      ATT: Exchange MTU Response (0x03) len 2
        Server RX MTU: 64
zephyr.exe[2863834]: < HCI Command: Host Number of Completed Packets (0x03|0x0035) plen 5                            #54 5.262047
        Num handles: 1
        Handle: 93 Address: DF:A9:FF:F6:B1:1A (OUI DF-A9-FF)
        Count: 1
zephyr.exe[2863834]: < ACL Data TX: Handle 93 flags 0x00 dlen 7                                                      #55 5.262157
      ATT: Exchange MTU Response (0x03) len 2
        Server RX MTU: 251
zephyr.exe[2863834]: < HCI Command: Host Number of Completed Packets (0x03|0x0035) plen 5                            #56 5.262343
        Num handles: 1
        Handle: 93 Address: DF:A9:FF:F6:B1:1A (OUI DF-A9-FF)
        Count: 1
> HCI Event: Number of Completed Packets (0x13) plen 5                                                               #57 5.432251
        Num handles: 1
        Handle: 93 Address: DF:A9:FF:F6:B1:1A (OUI DF-A9-FF)
        Count: 1
        #55: len 7 (0 Kb/s)
        Latency: 170 msec (170-170 msec ~170 msec)
> ACL Data RX: Handle 93 flags 0x02 dlen 11                                                                          #58 7.444728
      SMP: Pairing Request (0x01) len 6
        IO capability: KeyboardDisplay (0x04)
        OOB data: Authentication data not present (0x00)
        Authentication requirement: Bonding, No MITM, SC, No Keypresses (0x09)
        Max encryption key size: 16
        Initiator key distribution: EncKey IdKey (0x03)
        Responder key distribution: EncKey IdKey Sign (0x07)
zephyr.exe[2863834]: < HCI Command: Host Number of Completed Packets (0x03|0x0035) plen 5                            #59 7.462079
        Num handles: 1
        Handle: 93 Address: DF:A9:FF:F6:B1:1A (OUI DF-A9-FF)
        Count: 1
zephyr.exe[2863834]: < ACL Data TX: Handle 93 flags 0x00 dlen 11                                                     #60 7.462349
      SMP: Pairing Response (0x02) len 6
        IO capability: NoInputNoOutput (0x03)
        OOB data: Authentication data not present (0x00)
        Authentication requirement: Bonding, No MITM, SC, No Keypresses (0x09)
        Max encryption key size: 16
        Initiator key distribution: IdKey (0x02)
        Responder key distribution: <none> (0x00)
> HCI Event: Number of Completed Packets (0x13) plen 5                                                               #61 7.619841
        Num handles: 1
        Handle: 93 Address: DF:A9:FF:F6:B1:1A (OUI DF-A9-FF)
        Count: 1
        #60: len 11 (0 Kb/s)
        Latency: 157 msec (157-170 msec ~163 msec)
> ACL Data RX: Handle 93 flags 0x02 dlen 27                                                                          #62 7.620074
> ACL Data RX: Handle 93 flags 0x01 dlen 27                                                                          #63 7.620415
> ACL Data RX: Handle 93 flags 0x01 dlen 15                                                                          #64 7.620843
      SMP: Pairing Public Key (0x0c) len 64
        X: 336cb6c5ebc943f02062003320dbe7b437d00209dbcb15bc9d124706f6c7ad44
        Y: d49b7be0988963bc67a2299208e0bf99fef9e5067c6acd741f92de1502afaa5d
zephyr.exe[2863834]: < HCI Command: Host Number of Completed Packets (0x03|0x0035) plen 5                            #65 7.622385
        Num handles: 1
        Handle: 93 Address: DF:A9:FF:F6:B1:1A (OUI DF-A9-FF)
        Count: 1
zephyr.exe[2863834]: < HCI Command: Host Number of Completed Packets (0x03|0x0035) plen 5                            #66 7.622576
        Num handles: 1
        Handle: 93 Address: DF:A9:FF:F6:B1:1A (OUI DF-A9-FF)
        Count: 1
zephyr.exe[2863834]: < HCI Command: Host Number of Completed Packets (0x03|0x0035) plen 5                            #67 7.622847
        Num handles: 1
        Handle: 93 Address: DF:A9:FF:F6:B1:1A (OUI DF-A9-FF)
        Count: 1
zephyr.exe[2863834]: < ACL Data TX: Handle 93 flags 0x00 dlen 27                                                     #68 7.623015
zephyr.exe[2863834]: < ACL Data TX: Handle 93 flags 0x01 dlen 27                                                     #69 7.623033
zephyr.exe[2863834]: < ACL Data TX: Handle 93 flags 0x01 dlen 15                                                     #70 7.623036
      SMP: Pairing Public Key (0x0c) len 64
        X: 98308440221e2d910f0e54b71e7ec652857aa9b5a0dc65028824cc19db1226e9
        Y: 67a4816bcb62efb21701e31fdb27561a6217575fb007a8bbdabe7e28b6f68482
> HCI Event: Number of Completed Packets (0x13) plen 5                                                               #71 7.707658
        Num handles: 1
        Handle: 93 Address: DF:A9:FF:F6:B1:1A (OUI DF-A9-FF)
        Count: 1
        #68: len 27 (2 Kb/s)
        Latency: 84 msec (84-170 msec ~124 msec)
> HCI Event: Number of Completed Packets (0x13) plen 5                                                               #72 7.708061
        Num handles: 1
        Handle: 93 Address: DF:A9:FF:F6:B1:1A (OUI DF-A9-FF)
        Count: 1
        #69: len 27 (2 Kb/s)
        Latency: 85 msec (84-170 msec ~104 msec)
zephyr.exe[2863834]: < ACL Data TX: Handle 93 flags 0x00 dlen 21                                                     #73 7.721989
      SMP: Pairing Confirm (0x03) len 16
        Confim value: 1abc49a47ecf980b68f2603344815c15
> HCI Event: Number of Completed Packets (0x13) plen 5                                                               #74 7.794620
        Num handles: 1
        Handle: 93 Address: DF:A9:FF:F6:B1:1A (OUI DF-A9-FF)
        Count: 1
        #70: len 15 (0 Kb/s)
        Latency: 171 msec (84-171 msec ~138 msec)
> HCI Event: Number of Completed Packets (0x13) plen 5                                                               #75 7.882274
        Num handles: 1
        Handle: 93 Address: DF:A9:FF:F6:B1:1A (OUI DF-A9-FF)
        Count: 1
        #73: len 21 (1 Kb/s)
        Latency: 160 msec (84-171 msec ~149 msec)
> ACL Data RX: Handle 93 flags 0x02 dlen 21                                                                          #76 7.882642
      SMP: Pairing Random (0x04) len 16
        Random value: 721a894ff2a6fe1f0000000000000000
zephyr.exe[2863834]: < HCI Command: Host Number of Completed Packets (0x03|0x0035) plen 5                            #77 7.902030
        Num handles: 1
        Handle: 93 Address: DF:A9:FF:F6:B1:1A (OUI DF-A9-FF)
        Count: 1
zephyr.exe[2863834]: < ACL Data TX: Handle 93 flags 0x00 dlen 21                                                     #78 7.902104
      SMP: Pairing Random (0x04) len 16
        Random value: 8e6108f966a694cbe26df70bb96773e6
> HCI Event: Number of Completed Packets (0x13) plen 5                                                               #79 8.057119
        Num handles: 1
        Handle: 93 Address: DF:A9:FF:F6:B1:1A (OUI DF-A9-FF)
        Count: 1
        #78: len 21 (1 Kb/s)
        Latency: 155 msec (84-171 msec ~152 msec)
> ACL Data RX: Handle 93 flags 0x02 dlen 21                                                                          #80 8.232434
      SMP: Pairing DHKey Check (0x0d) len 16
        E: ecee743bc8c4e55c77a38aae04bd19ef
zephyr.exe[2863834]: < HCI Command: Host Number of Completed Packets (0x03|0x0035) plen 5                            #81 8.242540
        Num handles: 1
        Handle: 93 Address: DF:A9:FF:F6:B1:1A (OUI DF-A9-FF)
        Count: 1
zephyr.exe[2863834]: < ACL Data TX: Handle 93 flags 0x00 dlen 21                                                     #82 8.242734
      SMP: Pairing DHKey Check (0x0d) len 16
        E: ccd9755ddc9130846434334888957592
> HCI Event: Number of Completed Packets (0x13) plen 5                                                               #83 8.407175
        Num handles: 1
        Handle: 93 Address: DF:A9:FF:F6:B1:1A (OUI DF-A9-FF)
        Count: 1
        #82: len 21 (1 Kb/s)
        Latency: 164 msec (84-171 msec ~158 msec)
> HCI Event: LE Meta Event (0x3e) plen 13                                                                            #84 8.495052
      LE Long Term Key Request (0x05)
        Handle: 93 Address: DF:A9:FF:F6:B1:1A (OUI DF-A9-FF)
        Random number: 0x0000000000000000
        Encrypted diversifier: 0x0000
zephyr.exe[2863834]: < HCI Command: LE Long Term Key Request Reply (0x08|0x001a) plen 18                             #85 8.501890
        Handle: 93 Address: DF:A9:FF:F6:B1:1A (OUI DF-A9-FF)
        Long term key: 5c416c5796b81e463aff69db178458d0
> HCI Event: Command Complete (0x0e) plen 6                                                                          #86 8.502595
      LE Long Term Key Request Reply (0x08|0x001a) ncmd 1
        Status: Success (0x00)
        Handle: 93 Address: DF:A9:FF:F6:B1:1A (OUI DF-A9-FF)
> HCI Event: Encryption Change (0x08) plen 4                                                                         #87 8.932315
        Status: Success (0x00)
        Handle: 93 Address: DF:A9:FF:F6:B1:1A (OUI DF-A9-FF)
        Encryption: Enabled with AES-CCM (0x01)
> ACL Data RX: Handle 93 flags 0x02 dlen 21                                                                          #88 9.019938
      SMP: Identity Information (0x08) len 16
        Identity resolving key: d32c12c1ff16497bf40c2fb5c4650ca7
zephyr.exe[2863834]: < HCI Command: Host Number of Completed Packets (0x03|0x0035) plen 5                            #89 9.051788
        Num handles: 1
        Handle: 93 Address: DF:A9:FF:F6:B1:1A (OUI DF-A9-FF)
        Count: 1
> ACL Data RX: Handle 93 flags 0x02 dlen 12                                                                          #90 9.194912
      SMP: Identity Address Information (0x09) len 7
        Address: DF:A9:FF:F6:B1:1A (OUI DF-A9-FF)
zephyr.exe[2863834]: < HCI Command: LE Add Device To Resolving List (0x08|0x0027) plen 39                            #91 9.202167
        Address type: Public (0x00)
        Address: DF:A9:FF:F6:B1:1A (OUI DF-A9-FF)
        Peer identity resolving key: d32c12c1ff16497bf40c2fb5c4650ca7
        Local identity resolving key: 00000000000000000000000000000000
> HCI Event: Command Complete (0x0e) plen 4                                                                          #92 9.203269
      LE Add Device To Resolving List (0x08|0x0027) ncmd 1
        Status: Success (0x00)
zephyr.exe[2863834]: < HCI Command: LE Set Privacy Mode (0x08|0x004e) plen 8                                         #93 9.222030
        Peer Identity address type: Public (0x00)
        Peer Identity address: DF:A9:FF:F6:B1:1A (OUI DF-A9-FF)
        Privacy Mode: Use Device Privacy (0x01)
> HCI Event: Command Complete (0x0e) plen 4                                                                          #94 9.222605
      LE Set Privacy Mode (0x08|0x004e) ncmd 1
        Status: Success (0x00)
zephyr.exe[2863834]: < HCI Command: LE Set Address Resolution Enable (0x08|0x002d) plen 1                            #95 9.241967
        Address resolution: Enabled (0x01)
> HCI Event: Command Complete (0x0e) plen 4                                                                          #96 9.242493
      LE Set Address Resolution Enable (0x08|0x002d) ncmd 1
        Status: Success (0x00)
zephyr.exe[2863834]: < HCI Command: Host Number of Completed Packets (0x03|0x0035) plen 5                            #97 9.261929
        Num handles: 1
        Handle: 93 Address: DF:A9:FF:F6:B1:1A (OUI DF-A9-FF)
        Count: 1
> ACL Data RX: Handle 93 flags 0x02 dlen 13                                                                          #98 9.282308
      ATT: Find By Type Value Request (0x06) len 8
        Handle range: 0x0001-0xffff
        Attribute type: Primary Service (0x2800)
          UUID: Broadcast Audio Scan (0x184f)
zephyr.exe[2863834]: < HCI Command: Host Number of Completed Packets (0x03|0x0035) plen 5                            #99 9.302376
        Num handles: 1
        Handle: 93 Address: DF:A9:FF:F6:B1:1A (OUI DF-A9-FF)
        Count: 1
zephyr.exe[2863834]: < ACL Data TX: Handle 93 flags 0x00 dlen 9                                                     #100 9.302584
      ATT: Find By Type Value Response (0x07) len 4
        Handle range: 0x0047-0x004c
> HCI Event: Number of Completed Packets (0x13) plen 5                                                              #101 9.457360
        Num handles: 1
        Handle: 93 Address: DF:A9:FF:F6:B1:1A (OUI DF-A9-FF)
        Count: 1
        #100: len 9 (0 Kb/s)
        Latency: 154 msec (84-171 msec ~156 msec)
> ACL Data RX: Handle 93 flags 0x02 dlen 13                                                                         #102 9.457369
      ATT: Find By Type Value Request (0x06) len 8
        Handle range: 0x004d-0xffff
        Attribute type: Primary Service (0x2800)
          UUID: Broadcast Audio Scan (0x184f)
zephyr.exe[2863834]: < HCI Command: Host Number of Completed Packets (0x03|0x0035) plen 5                           #103 9.462298
        Num handles: 1
        Handle: 93 Address: DF:A9:FF:F6:B1:1A (OUI DF-A9-FF)
        Count: 1
zephyr.exe[2863834]: < ACL Data TX: Handle 93 flags 0x00 dlen 9                                                     #104 9.462372
      ATT: Error Response (0x01) len 4
        Find By Type Value Request (0x06)
        Handle: 0x004d
        Error: Attribute Not Found (0x0a)
> HCI Event: Number of Completed Packets (0x13) plen 5                                                              #105 9.632247
        Num handles: 1
        Handle: 93 Address: DF:A9:FF:F6:B1:1A (OUI DF-A9-FF)
        Count: 1
        #104: len 9 (0 Kb/s)
        Latency: 169 msec (84-171 msec ~163 msec)
> ACL Data RX: Handle 93 flags 0x02 dlen 11                                                                         #106 9.632320
      ATT: Read By Type Request (0x08) len 6
        Handle range: 0x0047-0x004c
        Attribute type: Characteristic (0x2803)
zephyr.exe[2863834]: < HCI Command: Host Number of Completed Packets (0x03|0x0035) plen 5                           #107 9.642355
        Num handles: 1
        Handle: 93 Address: DF:A9:FF:F6:B1:1A (OUI DF-A9-FF)
        Count: 1
zephyr.exe[2863834]: < ACL Data TX: Handle 93 flags 0x00 dlen 20                                                    #108 9.642527
      ATT: Read By Type Response (0x09) len 15
        Attribute data length: 7
        Attribute data list: 2 entries
        Handle: 0x0048
        Value: 0c4900c72b
            Properties: 0x0c
              Write Without Response (0x04)
              Write (0x08)
            Value Handle: 0x0049
            Value UUID: Broadcast Audio Scan Control Point (0x2bc7)
        Handle: 0x004a
        Value: 124b00c82b
            Properties: 0x12
              Read (0x02)
              Notify (0x10)
            Value Handle: 0x004b
            Value UUID: Broadcast Receive State (0x2bc8)
> HCI Event: Number of Completed Packets (0x13) plen 5                                                              #109 9.807231
        Num handles: 1
        Handle: 93 Address: DF:A9:FF:F6:B1:1A (OUI DF-A9-FF)
        Count: 1
        #108: len 20 (0 Kb/s)
        Latency: 164 msec (84-171 msec ~163 msec)
> ACL Data RX: Handle 93 flags 0x02 dlen 11                                                                         #110 9.807338
      ATT: Read By Type Request (0x08) len 6
        Handle range: 0x004b-0x004c
        Attribute type: Characteristic (0x2803)
zephyr.exe[2863834]: < HCI Command: Host Number of Completed Packets (0x03|0x0035) plen 5                           #111 9.822293
        Num handles: 1
        Handle: 93 Address: DF:A9:FF:F6:B1:1A (OUI DF-A9-FF)
        Count: 1
zephyr.exe[2863834]: < ACL Data TX: Handle 93 flags 0x00 dlen 9                                                     #112 9.822385
      ATT: Error Response (0x01) len 4
        Read By Type Request (0x08)
        Handle: 0x004b
        Error: Attribute Not Found (0x0a)
> HCI Event: Number of Completed Packets (0x13) plen 5                                                              #113 9.982072
        Num handles: 1
        Handle: 93 Address: DF:A9:FF:F6:B1:1A (OUI DF-A9-FF)
        Count: 1
        #112: len 9 (0 Kb/s)
        Latency: 159 msec (84-171 msec ~161 msec)
> ACL Data RX: Handle 93 flags 0x02 dlen 9                                                                          #114 9.982277
      ATT: Find Information Request (0x04) len 4
        Handle range: 0x004c-0x004c
zephyr.exe[2863834]: < HCI Command: Host Number of Completed Packets (0x03|0x0035) plen 5                          #115 10.002225
        Num handles: 1
        Handle: 93 Address: DF:A9:FF:F6:B1:1A (OUI DF-A9-FF)
        Count: 1
zephyr.exe[2863834]: < ACL Data TX: Handle 93 flags 0x00 dlen 10                                                   #116 10.002314
      ATT: Find Information Response (0x05) len 5
        Format: UUID-16 (0x01)
        Handle: 0x004c
        UUID: Client Characteristic Configuration (0x2902)
> HCI Event: Number of Completed Packets (0x13) plen 5                                                             #117 10.157124
        Num handles: 1
        Handle: 93 Address: DF:A9:FF:F6:B1:1A (OUI DF-A9-FF)
        Count: 1
        #116: len 10 (0 Kb/s)
        Latency: 154 msec (84-171 msec ~158 msec)
> ACL Data RX: Handle 93 flags 0x02 dlen 9                                                                         #118 10.157331
      ATT: Write Request (0x12) len 4
        Handle: 0x004c
          Data: 0000
zephyr.exe[2863834]: < HCI Command: Host Number of Completed Packets (0x03|0x0035) plen 5                          #119 10.162202
        Num handles: 1
        Handle: 93 Address: DF:A9:FF:F6:B1:1A (OUI DF-A9-FF)
        Count: 1
zephyr.exe[2863834]: < ACL Data TX: Handle 93 flags 0x00 dlen 5                                                    #120 10.162278
      ATT: Write Response (0x13) len 0
> HCI Event: Number of Completed Packets (0x13) plen 5                                                             #121 10.332170
        Num handles: 1
        Handle: 93 Address: DF:A9:FF:F6:B1:1A (OUI DF-A9-FF)
        Count: 1
        #120: len 5 (0 Kb/s)
        Latency: 169 msec (84-171 msec ~164 msec)
> ACL Data RX: Handle 93 flags 0x02 dlen 9                                                                         #122 10.332402
      ATT: Write Request (0x12) len 4
        Handle: 0x004c
          Data: 0100
zephyr.exe[2863834]: < HCI Command: Host Number of Completed Packets (0x03|0x0035) plen 5                          #123 10.342407
        Num handles: 1
        Handle: 93 Address: DF:A9:FF:F6:B1:1A (OUI DF-A9-FF)
        Count: 1
zephyr.exe[2863834]: < ACL Data TX: Handle 93 flags 0x00 dlen 5                                                    #124 10.342504
      ATT: Write Response (0x13) len 0
> HCI Event: Number of Completed Packets (0x13) plen 5                                                             #125 10.507181
        Num handles: 1
        Handle: 93 Address: DF:A9:FF:F6:B1:1A (OUI DF-A9-FF)
        Count: 1
        #124: len 5 (0 Kb/s)
        Latency: 164 msec (84-171 msec ~164 msec)
> ACL Data RX: Handle 93 flags 0x02 dlen 7                                                                         #126 10.507277
      ATT: Read Request (0x0a) len 2
        Handle: 0x004b
zephyr.exe[2863834]: < HCI Command: Host Number of Completed Packets (0x03|0x0035) plen 5                          #127 10.521834
        Num handles: 1
        Handle: 93 Address: DF:A9:FF:F6:B1:1A (OUI DF-A9-FF)
        Count: 1
zephyr.exe[2863834]: < ACL Data TX: Handle 93 flags 0x00 dlen 5                                                    #128 10.521910
      ATT: Read Response (0x0b) len 0
> HCI Event: Number of Completed Packets (0x13) plen 5                                                             #129 10.682270
        Num handles: 1
        Handle: 93 Address: DF:A9:FF:F6:B1:1A (OUI DF-A9-FF)
        Count: 1
        #128: len 5 (0 Kb/s)
        Latency: 160 msec (84-171 msec ~162 msec)
> ACL Data RX: Handle 93 flags 0x02 dlen 27                                                                        #130 10.682568
> ACL Data RX: Handle 93 flags 0x01 dlen 1                                                                         #131 10.682570
      ATT: Write Request (0x12) len 23
        Handle: 0x0049
          Data: 02001ab1f6ffa9df0a34120000401f010000000000
zephyr.exe[2863834]: < HCI Command: Host Number of Completed Packets (0x03|0x0035) plen 5                          #132 10.702038
        Num handles: 1
        Handle: 93 Address: DF:A9:FF:F6:B1:1A (OUI DF-A9-FF)
        Count: 1
zephyr.exe[2863834]: < HCI Command: Host Number of Completed Packets (0x03|0x0035) plen 5                          #133 10.702262
        Num handles: 1
        Handle: 93 Address: DF:A9:FF:F6:B1:1A (OUI DF-A9-FF)
        Count: 1
zephyr.exe[2863834]: < ACL Data TX: Handle 93 flags 0x00 dlen 5                                                    #134 10.702470
      ATT: Write Response (0x13) len 0
zephyr.exe[2863834]: < ACL Data TX: Handle 93 flags 0x00 dlen 27                                                   #135 10.702583
      ATT: Handle Value Notification (0x1b) len 22
        Handle: 0x004b
          Data: 00001ab1f6ffa9df0a3412000000010000000000
> HCI Event: Number of Completed Packets (0x13) plen 5                                                             #136 10.769911
        Num handles: 1
        Handle: 93 Address: DF:A9:FF:F6:B1:1A (OUI DF-A9-FF)
        Count: 1
        #134: len 5 (0 Kb/s)
        Latency: 67 msec (67-171 msec ~114 msec)
> HCI Event: Number of Completed Packets (0x13) plen 5                                                             #137 10.857122
        Num handles: 1
        Handle: 93 Address: DF:A9:FF:F6:B1:1A (OUI DF-A9-FF)
        Count: 1
        #135: len 27 (1 Kb/s)
        Latency: 154 msec (67-171 msec ~134 msec)
> ACL Data RX: Handle 93 flags 0x02 dlen 9                                                                         #138 12.607113
      ATT: Write Request (0x12) len 4
        Handle: 0x0049
          Data: 0500
zephyr.exe[2863834]: < HCI Command: Host Number of Completed Packets (0x03|0x0035) plen 5                          #139 12.622148
        Num handles: 1
        Handle: 93 Address: DF:A9:FF:F6:B1:1A (OUI DF-A9-FF)
        Count: 1
zephyr.exe[2863834]: < ACL Data TX: Handle 93 flags 0x00 dlen 5                                                    #140 12.622371
      ATT: Write Response (0x13) len 0
zephyr.exe[2863834]: < ACL Data TX: Handle 93 flags 0x00 dlen 7                                                    #141 12.622508
      ATT: Handle Value Notification (0x1b) len 2
        Handle: 0x004b
          Data: 
> HCI Event: Number of Completed Packets (0x13) plen 5                                                             #142 12.694902
        Num handles: 1
        Handle: 93 Address: DF:A9:FF:F6:B1:1A (OUI DF-A9-FF)
        Count: 1
        #140: len 5 (0 Kb/s)
        Latency: 72 msec (67-171 msec ~103 msec)
> HCI Event: Number of Completed Packets (0x13) plen 5                                                             #143 12.782097
        Num handles: 1
        Handle: 93 Address: DF:A9:FF:F6:B1:1A (OUI DF-A9-FF)
        Count: 1
        #141: len 7 (0 Kb/s)
        Latency: 159 msec (67-171 msec ~131 msec)
> ACL Data RX: Handle 93 fl