Bluetooth monitor ver 5.72
= Note: Linux version 6.14.0-36-generic (x86_64)                       0.343473
= Note: Bluetooth subsystem version 2.22                               0.343474
= New Index: 00:00:00:00:00:00 (Primary,UART,hci2)              [hci2] 0.343475
= New Index: 00:00:00:00:00:00 (Primary,UART,hci1)              [hci1] 0.343476
= New Index: 48:5F:99:8E:E0:64 (Primary,USB,hci0)               [hci0] 0.343476
= Open Index: 00:00:00:00:00:00                                 [hci1] 0.497256
= Index Info: 00:00:00:00:00:00 (Nordic Semiconductor ASA)      [hci1] 0.497263
@ USER Open: main (privileged) version 2.22            {0x0001} [hci1] 0.497268
< HCI Command: Reset (0x03|0x0003) plen 0                    #1 [hci1] 0.497834
> HCI Event: Command Complete (0x0e) plen 4                  #2 [hci1] 0.498325
      Reset (0x03|0x0003) ncmd 1
        Status: Success (0x00)
< HCI Command: Read Local Supported... (0x04|0x0003) plen 0  #3 [hci1] 0.517134
> HCI Event: Command Complete (0x0e) plen 12                 #4 [hci1] 0.517717
      Read Local Supported Features (0x04|0x0003) ncmd 1
        Status: Success (0x00)
        Features: 0x00 0x00 0x00 0x00 0x60 0x00 0x00 0x00
          BR/EDR Not Supported
          LE Supported (Controller)
< HCI Command: Read Local Version In.. (0x04|0x0001) plen 0  #5 [hci1] 0.537093
> HCI Event: Command Complete (0x0e) plen 12                 #6 [hci1] 0.537703
      Read Local Version Information (0x04|0x0001) ncmd 1
        Status: Success (0x00)
        HCI version: Reserved (0x0f) - Revision 12393 (0x3069)
        LMP version: Reserved (0x0f) - Subversion 12393 (0x3069)
        Manufacturer: Nordic Semiconductor ASA (89)
< HCI Command: Read Local Supported... (0x04|0x0002) plen 0  #7 [hci1] 0.557100
> HCI Event: Command Complete (0x0e) plen 68                 #8 [hci1] 0.558260
      Read Local Supported Commands (0x04|0x0002) ncmd 1
        Status: Success (0x00)
        Commands: 119 entries
          Disconnect (Octet 0 - Bit 5)
          Read Remote Version Information (Octet 2 - Bit 7)
          Set Event Mask (Octet 5 - Bit 6)
          Reset (Octet 5 - Bit 7)
          Read Connection Accept Timeout (Octet 7 - Bit 2)
          Write Connection Accept Timeout (Octet 7 - Bit 3)
          Read Transmit Power Level (Octet 10 - Bit 2)
          Set Controller To Host Flow Control (Octet 10 - Bit 5)
          Host Buffer Size (Octet 10 - Bit 6)
          Host Number of Completed Packets (Octet 10 - Bit 7)
          Read Local Version Information (Octet 14 - Bit 3)
          Read Local Supported Features (Octet 14 - Bit 5)
          Read BD ADDR (Octet 15 - Bit 1)
          Read RSSI (Octet 15 - Bit 5)
          Set Event Mask Page 2 (Octet 22 - Bit 2)
          LE Set Event Mask (Octet 25 - Bit 0)
          LE Read Buffer Size (Octet 25 - Bit 1)
          LE Read Local Supported Features (Octet 25 - Bit 2)
          LE Set Random Address (Octet 25 - Bit 4)
          LE Set Advertising Parameters (Octet 25 - Bit 5)
          LE Read Advertising Channel TX Power (Octet 25 - Bit 6)
          LE Set Advertising Data (Octet 25 - Bit 7)
          LE Set Scan Response Data (Octet 26 - Bit 0)
          LE Set Advertise Enable (Octet 26 - Bit 1)
          LE Set Scan Parameters (Octet 26 - Bit 2)
          LE Set Scan Enable (Octet 26 - Bit 3)
          LE Create Connection (Octet 26 - Bit 4)
          LE Create Connection Cancel (Octet 26 - Bit 5)
          LE Read Accept List Size (Octet 26 - Bit 6)
          LE Clear Accept List (Octet 26 - Bit 7)
          LE Add Device To Accept List (Octet 27 - Bit 0)
          LE Remove Device From Accept List (Octet 27 - Bit 1)
          LE Connection Update (Octet 27 - Bit 2)
          LE Set Host Channel Classification (Octet 27 - Bit 3)
          LE Read Channel Map (Octet 27 - Bit 4)
          LE Read Remote Used Features (Octet 27 - Bit 5)
          LE Encrypt (Octet 27 - Bit 6)
          LE Rand (Octet 27 - Bit 7)
          LE Start Encryption (Octet 28 - Bit 0)
          LE Long Term Key Request Reply (Octet 28 - Bit 1)
          LE Long Term Key Request Neg Reply (Octet 28 - Bit 2)
          LE Read Supported States (Octet 28 - Bit 3)
          LE Receiver Test (Octet 28 - Bit 4)
          LE Transmitter Test (Octet 28 - Bit 5)
          LE Test End (Octet 28 - Bit 6)
          Read Authenticated Payload Timeout (Octet 32 - Bit 4)
          Write Authenticated Payload Timeout (Octet 32 - Bit 5)
          LE Set Data Length (Octet 33 - Bit 6)
          LE Read Suggested Default Data Length (Octet 33 - Bit 7)
          LE Write Suggested Default Data Length (Octet 34 - Bit 0)
          LE Add Device To Resolving List (Octet 34 - Bit 3)
          LE Remove Device From Resolving List (Octet 34 - Bit 4)
          LE Clear Resolving List (Octet 34 - Bit 5)
          LE Read Resolving List Size (Octet 34 - Bit 6)
          LE Set Address Resolution Enable (Octet 35 - Bit 1)
          LE Set Resolvable Private Address Timeout (Octet 35 - Bit 2)
          LE Read Maximum Data Length (Octet 35 - Bit 3)
          LE Read PHY (Octet 35 - Bit 4)
          LE Set Default PHY (Octet 35 - Bit 5)
          LE Set PHY (Octet 35 - Bit 6)
          LE Enhanced Receiver Test (Octet 35 - Bit 7)
          LE Enhanced Transmitter Test (Octet 36 - Bit 0)
          LE Set Advertising Set Random Address (Octet 36 - Bit 1)
          LE Set Extended Advertising Parameters (Octet 36 - Bit 2)
          LE Set Extended Advertising Data (Octet 36 - Bit 3)
          LE Set Extended Scan Response Data (Octet 36 - Bit 4)
          LE Set Extended Advertising Enable (Octet 36 - Bit 5)
          LE Read Maximum Advertising Data Length (Octet 36 - Bit 6)
          LE Read Number of Supported Advertising Sets (Octet 36 - Bit 7)
          LE Remove Advertising Set (Octet 37 - Bit 0)
          LE Clear Advertising Sets (Octet 37 - Bit 1)
          LE Set Periodic Advertising Parameters (Octet 37 - Bit 2)
          LE Set Periodic Advertising Data (Octet 37 - Bit 3)
          LE Set Periodic Advertising Enable (Octet 37 - Bit 4)
          LE Set Extended Scan Parameters (Octet 37 - Bit 5)
          LE Set Extended Scan Enable (Octet 37 - Bit 6)
          LE Extended Create Connection (Octet 37 - Bit 7)
          LE Periodic Advertising Create Sync (Octet 38 - Bit 0)
          LE Periodic Advertising Create Sync Cancel (Octet 38 - Bit 1)
          LE Periodic Advertising Terminate Sync (Octet 38 - Bit 2)
          LE Add Device To Periodic Advertiser List (Octet 38 - Bit 3)
          LE Remove Device From Periodic Advertiser List (Octet 38 - Bit 4)
          LE Clear Periodic Advertiser List (Octet 38 - Bit 5)
          LE Read Periodic Advertiser List Size (Octet 38 - Bit 6)
          LE Read Transmit Power (Octet 38 - Bit 7)
          LE Read RF Path Compensation (Octet 39 - Bit 0)
          LE Write RF Path Compensation (Octet 39 - Bit 1)
          LE Set Privacy Mode (Octet 39 - Bit 2)
          LE Periodic Advertising Receive Enable (Octet 40 - Bit 5)
          LE Periodic Advertising Sync Transfer (Octet 40 - Bit 6)
          LE Periodic Advertising Set Info Transfer (Octet 40 - Bit 7)
          LE Periodic Advertising Sync Transfer Parameters (Octet 41 - Bit 0)
          LE Set Default Periodic Advertisng Sync Transfer Parameters (Octet 41 - Bit 1)
          LE Read Buffer v2 (Octet 41 - Bit 5)
          LE Read ISO TX Sync (Octet 41 - Bit 6)
          LE Set Connected Isochronous Group Parameters (Octet 41 - Bit 7)
          LE Set Connected Isochronous Group Parameters Test (Octet 42 - Bit 0)
          LE Create Connected Isochronous Stream (Octet 42 - Bit 1)
          LE Remove Connected Isochronous Group (Octet 42 - Bit 2)
          LE Accept Connected Isochronous Stream Request (Octet 42 - Bit 3)
          LE Reject Connected Isochronous Stream Request (Octet 42 - Bit 4)
          LE Create Broadcast Isochronous Group (Octet 42 - Bit 5)
          LE Create Broadcast Isochronous Group Test (Octet 42 - Bit 6)
          LE Terminate Broadcast Isochronous Group (Octet 42 - Bit 7)
          LE Broadcast Isochronous Group Create Sync (Octet 43 - Bit 0)
          LE Broadcast Isochronous Group Terminate Sync (Octet 43 - Bit 1)
          LE Request Peer SCA (Octet 43 - Bit 2)
          LE Setup Isochronous Data Path (Octet 43 - Bit 3)
          LE Remove Isochronous Data Path (Octet 43 - Bit 4)
          LE Isochronous Transmit Test (Octet 43 - Bit 5)
          LE Isochronous Receive Test (Octet 43 - Bit 6)
          LE Isochronous Read Test Counters (Octet 43 - Bit 7)
          LE Isochronous Read Test Counters (Octet 44 - Bit 0)
          LE Set Host Feature (Octet 44 - Bit 1)
          Octet 44 - Bit 2 
          Octet 45 - Bit 6 
          Octet 46 - Bit 0 
          Octet 46 - Bit 1 
          Octet 46 - Bit 2 
< HCI Command: Host Buffer Size (0x03|0x0033) plen 7         #9 [hci1] 0.577122
        ACL MTU: 255  ACL max packet: 16
        SCO MTU: 0    SCO max packet: 0
> HCI Event: Command Complete (0x0e) plen 4                 #10 [hci1] 0.577681
      Host Buffer Size (0x03|0x0033) ncmd 1
        Status: Success (0x00)
< HCI Command: Set Controller To Ho.. (0x03|0x0031) plen 1  #11 [hci1] 0.597099
        Flow control: ACL Data Packets (0x01)
> HCI Event: Command Complete (0x0e) plen 4                 #12 [hci1] 0.597573
      Set Controller To Host Flow Control (0x03|0x0031) ncmd 1
        Status: Success (0x00)
< HCI Command: LE Read Local Suppor.. (0x08|0x0003) plen 0  #13 [hci1] 0.617074
> HCI Event: Command Complete (0x0e) plen 12                #14 [hci1] 0.617732
      LE Read Local Supported Features (0x08|0x0003) ncmd 1
        Status: Success (0x00)
        Features: 0xfd 0x79 0x00 0xf7 0x30 0x01 0x00 0x00
          LE Encryption
          Extended Reject Indication
          Peripheral-initiated Features Exchange
          LE Ping
          LE Data Packet Length Extension
          LL Privacy
          Extended Scanner Filter Policies
          LE 2M PHY
          LE Coded PHY
          LE Extended Advertising
          LE Periodic Advertising
          Channel Selection Algorithm #2
          Periodic Advertising Sync Transfer - Sender
          Periodic Advertising Sync Transfer - Recipient
          Sleep Clock Accuracy Updates
          Connected Isochronous Stream - Central
          Connected Isochronous Stream - Peripheral
          Isochronous Broadcaster
          Synchronized Receiver
          Periodic Advertising ADI support
          Connection Subrating
          Unknown features (0x0000010000000000)
< HCI Command: LE Set Host Feature (0x08|0x0074) plen 2     #15 [hci1] 0.637113
        Bit Number: 32
          Connected Isochronous Stream (Host Support)
        Bit Value: 1
> HCI Event: Command Complete (0x0e) plen 4                 #16 [hci1] 0.637777
      LE Set Host Feature (0x08|0x0074) ncmd 1
        Status: Success (0x00)
< HCI Command: LE Read Buffer v2 (0x08|0x0060) plen 0       #17 [hci1] 0.657092
> HCI Event: Command Complete (0x0e) plen 10                #18 [hci1] 0.657601
      LE Read Buffer v2 (0x08|0x0060) ncmd 1
        Status: Success (0x00)
        ACL MTU: 27
        ACL max packet: 3
        ISO MTU: 318
        ISO max packet: 3
< HCI Command: LE Read Maximum Adve.. (0x08|0x003a) plen 0  #19 [hci1] 0.677129
> HCI Event: Command Complete (0x0e) plen 6                 #20 [hci1] 0.677768
      LE Read Maximum Advertising Data Length (0x08|0x003a) ncmd 1
        Status: Success (0x00)
        Max length: 1650
< HCI Command: LE Read Supported St.. (0x08|0x001c) plen 0  #21 [hci1] 0.697098
> HCI Event: Command Complete (0x0e) plen 12                #22 [hci1] 0.697738
      LE Read Supported States (0x08|0x001c) ncmd 1
        Status: Success (0x00)
        States: 0x000003ff3e0306ff
          Non-connectable Advertising State
          Scannable Advertising State
          Connectable Advertising State
          High Duty Cycle Directed Advertising State
          Passive Scanning State
          Active Scanning State
          Initiating State
            and Connection State (Central Role)
          Connection State (Peripheral Role)
          Scannable Advertising State
            and Passive Scanning State
          Connectable Advertising State
            and Passive Scanning State
          Non-connectable Advertising State
            and Initiating State
          Scannable Advertising State
            and Initiating State
          Active Scanning State
            and Connection State (Central Role)
          Passive Scanning State
            and Connection State (Peripheral Role)
          Active Scanning State
            and Connection State (Peripheral Role)
          Initiating State
            and Connection State (Central Role)
            and Central Role & Central Role
          Low Duty Cycle Directed Advertising State
          Connectable Advertising State
            and Initiating State
            and Central Role & Peripheral Role
          High Duty Cycle Directed Advertising State
            and Initiating State
            and Central Role & Peripheral Role
          Low Duty Cycle Directed Advertising State
            and Initiating State
            and Central Role & Peripheral Role
          Connectable Advertising State
            and Connection State (Central Role)
            and Central Role & Peripheral Role
          High Duty Cycle Directed Advertising State
            and Connection State (Central Role)
            and Central Role & Peripheral Role
          Low Duty Cycle Directed Advertising State
            and Connection State (Central Role)
            and Central Role & Peripheral Role
          Connectable Advertising State
            and Connection State (Peripheral Role)
            and Central Role & Peripheral Role
          High Duty Cycle Directed Advertising State
            and Connection State (Peripheral Role)
            and Peripheral Role & Peripheral Role
          Low Duty Cycle Directed Advertising State
            and Connection State (Peripheral Role)
            and Peripheral Role & Peripheral Role
          Initiating State
            and Connection State (Peripheral Role)
            and Central Role & Peripheral Role
< HCI Command: LE Read Maximum Data.. (0x08|0x002f) plen 0  #23 [hci1] 0.717097
> HCI Event: Command Complete (0x0e) plen 12                #24 [hci1] 0.717708
      LE Read Maximum Data Length (0x08|0x002f) ncmd 1
        Status: Success (0x00)
        Max TX octets: 251
        Max TX time: 2704
        Max RX octets: 251
        Max RX time: 2704
< HCI Command: LE Write Suggested D.. (0x08|0x0024) plen 4  #25 [hci1] 0.737085
        TX octets: 251
        TX time: 2704
> HCI Event: Command Complete (0x0e) plen 4                 #26 [hci1] 0.737636
      LE Write Suggested Default Data Length (0x08|0x0024) ncmd 1
        Status: Success (0x00)
< HCI Command: LE Read Resolving Li.. (0x08|0x002a) plen 0  #27 [hci1] 0.757072
> HCI Event: Command Complete (0x0e) plen 5                 #28 [hci1] 0.757589
      LE Read Resolving List Size (0x08|0x002a) ncmd 1
        Status: Success (0x00)
        Size: 8
< HCI Command: LE Set Event Mask (0x08|0x0001) plen 8       #29 [hci1] 0.777070
        Mask: 0x000002023f87fa5e
          LE Advertising Report
          LE Connection Update Complete
          LE Read Remote Used Features Complete
          LE Long Term Key Request
          LE Data Length Change
          LE Enhanced Connection Complete
          LE PHY Update Complete
          LE Extended Advertising Report
          LE Periodic Advertising Sync Established
          LE Periodic Advertising Report
          LE Periodic Advertising Sync Lost
          LE Extended Scan Timeout
          LE Extended Advertising Set Terminated
          LE Scan Request Received
          LE Periodic Advertising Sync Transfer Rvc
          LE CIS Established
          LE CIS Request
          LE Create BIG Complete
          LE Terminate BIG Complete
          LE BIG Sync Estabilished Complete
          LE BIG Sync Lost
          LE BIG Info Advertising Report
          Unknown mask (0x0000020000000000)
> HCI Event: Command Complete (0x0e) plen 4                 #30 [hci1] 0.777735
      LE Set Event Mask (0x08|0x0001) ncmd 1
        Status: Success (0x00)
< HCI Command: Set Event Mask (0x03|0x0001) plen 8          #31 [hci1] 0.797063
        Mask: 0x2000800002008890
          Disconnection Complete
          Encryption Change
          Read Remote Version Information Complete
          Hardware Error
          Data Buffer Overflow
          Encryption Key Refresh Complete
          LE Meta
> HCI Event: Command Complete (0x0e) plen 4                 #32 [hci1] 0.797642
      Set Event Mask (0x03|0x0001) ncmd 1
        Status: Success (0x00)
< HCI Command: Read BD ADDR (0x04|0x0009) plen 0            #33 [hci1] 0.817059
> HCI Event: Command Complete (0x0e) plen 10                #34 [hci1] 0.817590
      Read BD ADDR (0x04|0x0009) ncmd 1
        Status: Success (0x00)
        Address: 00:00:00:00:00:00 (OUI 00-00-00)
< HCI Command: LE Set Random Address (0x08|0x0005) plen 6   #35 [hci1] 0.837087
        Address: D5:B6:CC:31:DB:3B (Static)
> HCI Event: Command Complete (0x0e) plen 4                 #36 [hci1] 0.837732
      LE Set Random Address (0x08|0x0005) ncmd 1
        Status: Success (0x00)
< HCI Command: LE Extended Create... (0x08|0x0043) plen 26  #37 [hci1] 3.087182
        Filter policy: Accept list is not used (0x00)
        Own address type: Random (0x01)
        Peer address type: Public (0x00)
        Peer address: DF:A9:FF:F6:B1:1A (OUI DF-A9-FF)
        Initiating PHYs: 0x01
        Entry 0: LE 1M
          Scan interval: 60.000 msec (0x0060)
          Scan window: 60.000 msec (0x0060)
          Min connection interval: 30.00 msec (0x0018)
          Max connection interval: 50.00 msec (0x0028)
          Connection latency: 0 (0x0000)
          Supervision timeout: 4000 msec (0x0190)
          Min connection length: 0.000 msec (0x0000)
          Max connection length: 0.000 msec (0x0000)
> HCI Event: Command Status (0x0f) plen 4                   #38 [hci1] 3.088161
      LE Extended Create Connection (0x08|0x0043) ncmd 1
        Status: Success (0x00)
> HCI Event: LE Meta Event (0x3e) plen 31                   #39 [hci1] 3.115978
      LE Enhanced Connection Complete (0x0a)
        Status: Success (0x00)
        Handle: 2376
        Role: Central (0x00)
        Peer address type: Public (0x00)
        Peer address: DF:A9:FF:F6:B1:1A (OUI DF-A9-FF)
        Local resolvable private address: 00:00:00:00:00:00 (Non-Resolvable)
        Peer resolvable private address: 00:00:00:00:00:00 (Non-Resolvable)
        Connection interval: 50.00 msec (0x0028)
        Connection latency: 0 (0x0000)
        Supervision timeout: 4000 msec (0x0190)
        Central clock accuracy: 0x00
< HCI Command: LE Read Remote Used... (0x08|0x0016) plen 2  #40 [hci1] 3.117344
        Handle: 2376 Address: DF:A9:FF:F6:B1:1A (OUI DF-A9-FF)
> HCI Event: Command Status (0x0f) plen 4                   #41 [hci1] 3.117798
      LE Read Remote Used Features (0x08|0x0016) ncmd 1
        Status: Success (0x00)
< HCI Command: LE Set PHY (0x08|0x0032) plen 7              #42 [hci1] 3.137252
        Handle: 2376 Address: DF:A9:FF:F6:B1:1A (OUI DF-A9-FF)
        All PHYs preference: 0x00
        TX PHYs preference: 0x02
          LE 2M
        RX PHYs preference: 0x02
          LE 2M
        PHY options preference: Reserved (0x0000)
> HCI Event: Command Status (0x0f) plen 4                   #43 [hci1] 3.137861
      LE Set PHY (0x08|0x0032) ncmd 1
        Status: Success (0x00)
> ACL Data RX: Handle 2376 flags 0x02 dlen 6                #44 [hci1] 3.167306
      SMP: Security Request (0x0b) len 1
        Authentication requirement: No bonding, MITM, SC, No Keypresses (0x0c)
< HCI Command: Host Number of Compl.. (0x03|0x0035) plen 5  #45 [hci1] 3.177211
        Num handles: 1
        Handle: 2376 Address: DF:A9:FF:F6:B1:1A (OUI DF-A9-FF)
        Count: 1
< ACL Data TX: Handle 2376 flags 0x00 dlen 11               #46 [hci1] 3.177285
      SMP: Pairing Request (0x01) len 6
        IO capability: DisplayOnly (0x00)
        OOB data: Authentication data not present (0x00)
        Authentication requirement: Bonding, No MITM, SC, No Keypresses (0x09)
        Max encryption key size: 16
        Initiator key distribution: EncKey (0x01)
        Responder key distribution: EncKey IdKey (0x03)
> HCI Event: Number of Completed Packets (0x13) plen 5      #47 [hci1] 3.267464
        Num handles: 1
        Handle: 2376 Address: DF:A9:FF:F6:B1:1A (OUI DF-A9-FF)
        Count: 1
        #46: len 11 (0 Kb/s)
        Latency: 90 msec (90-90 msec ~90 msec)
> HCI Event: LE Meta Event (0x3e) plen 12                   #48 [hci1] 3.267466
      LE Read Remote Used Features (0x04)
        Status: Success (0x00)
        Handle: 2376 Address: DF:A9:FF:F6:B1:1A (OUI DF-A9-FF)
        Features: 0x2d 0x49 0x00 0xf7 0x67 0xd9 0x00 0x80
          LE Encryption
          Extended Reject Indication
          Peripheral-initiated Features Exchange
          LE Data Packet Length Extension
          LE 2M PHY
          LE Coded PHY
          Channel Selection Algorithm #2
          Periodic Advertising Sync Transfer - Sender
          Periodic Advertising Sync Transfer - Recipient
          Sleep Clock Accuracy Updates
          Connected Isochronous Stream - Central
          Connected Isochronous Stream - Peripheral
          Isochronous Broadcaster
          Synchronized Receiver
          Connected Isochronous Stream (Host Support)
          LE Power Control Request
          LE Power Control Request
          Connection Subrating
          Connection Subrating (Host Support)
          Unknown features (0x8000d90000000000)
> ACL Data RX: Handle 2376 flags 0x02 dlen 11               #49 [hci1] 3.317456
      SMP: Pairing Response (0x02) len 6
        IO capability: KeyboardDisplay (0x04)
        OOB data: Authentication data not present (0x00)
        Authentication requirement: No bonding, MITM, SC, No Keypresses (0x0c)
        Max encryption key size: 16
        Initiator key distribution: <none> (0x00)
        Responder key distribution: <none> (0x00)
< HCI Command: Host Number of Compl.. (0x03|0x0035) plen 5  #50 [hci1] 3.337480
        Num handles: 1
        Handle: 2376 Address: DF:A9:FF:F6:B1:1A (OUI DF-A9-FF)
        Count: 1
< ACL Data TX: Handle 2376 flags 0x00 dlen 27               #51 [hci1] 3.337583
< ACL Data TX: Handle 2376 flags 0x01 dlen 27               #52 [hci1] 3.337599
< ACL Data TX: Handle 2376 flags 0x01 dlen 15               #53 [hci1] 3.337602
      SMP: Pairing Public Key (0x0c) len 64
        X: 98308440221e2d910f0e54b71e7ec652857aa9b5a0dc65028824cc19db1226e9
        Y: 67a4816bcb62efb21701e31fdb27561a6217575fb007a8bbdabe7e28b6f68482
> HCI Event: Number of Completed Packets (0x13) plen 5      #54 [hci1] 3.367417
        Num handles: 1
        Handle: 2376 Address: DF:A9:FF:F6:B1:1A (OUI DF-A9-FF)
        Count: 1
        #51: len 27 (7 Kb/s)
        Latency: 29 msec (29-90 msec ~60 msec)
> HCI Event: Number of Completed Packets (0x13) plen 5      #55 [hci1] 3.417416
        Num handles: 1
        Handle: 2376 Address: DF:A9:FF:F6:B1:1A (OUI DF-A9-FF)
        Count: 1
        #52: len 27 (2 Kb/s)
        Latency: 79 msec (29-90 msec ~69 msec)
> HCI Event: Number of Completed Packets (0x13) plen 5      #56 [hci1] 3.517374
        Num handles: 1
        Handle: 2376 Address: DF:A9:FF:F6:B1:1A (OUI DF-A9-FF)
        Count: 1
        #53: len 15 (0 Kb/s)
        Latency: 179 msec (29-179 msec ~124 msec)
> ACL Data RX: Handle 2376 flags 0x02 dlen 27               #57 [hci1] 3.567519
> ACL Data RX: Handle 2376 flags 0x01 dlen 27               #58 [hci1] 3.568339
> ACL Data RX: Handle 2376 flags 0x01 dlen 15               #59 [hci1] 3.568814
      SMP: Pairing Public Key (0x0c) len 64
        X: 6ea66baa857dd01a0273f3ae7fe128a4c41e2d1f467b62afa23497cf2d8185fd
        Y: 7af2bb207e6b945a3cd471a4b68b3f3732407c09f6051b633cf149ebe99ac0ef
< HCI Command: Host Number of Compl.. (0x03|0x0035) plen 5  #60 [hci1] 3.577333
        Num handles: 1
        Handle: 2376 Address: DF:A9:FF:F6:B1:1A (OUI DF-A9-FF)
        Count: 1
< HCI Command: Host Number of Compl.. (0x03|0x0035) plen 5  #61 [hci1] 3.577441
        Num handles: 1
        Handle: 2376 Address: DF:A9:FF:F6:B1:1A (OUI DF-A9-FF)
        Count: 1
< HCI Command: Host Number of Compl.. (0x03|0x0035) plen 5  #62 [hci1] 3.577613
        Num handles: 1
        Handle: 2376 Address: DF:A9:FF:F6:B1:1A (OUI DF-A9-FF)
        Count: 1
< ACL Data TX: Handle 2376 flags 0x00 dlen 21               #63 [hci1] 3.577667
      SMP: Pairing Confirm (0x03) len 16
        Confim value: 8b949b159891384c3c29cadd248121c0
> HCI Event: Number of Completed Packets (0x13) plen 5      #64 [hci1] 3.617419
        Num handles: 1
        Handle: 2376 Address: DF:A9:FF:F6:B1:1A (OUI DF-A9-FF)
        Count: 1
        #63: len 21 (4 Kb/s)
        Latency: 39 msec (29-179 msec ~82 msec)
> HCI Event: LE Meta Event (0x3e) plen 6                    #65 [hci1] 3.766751
      LE PHY Update Complete (0x0c)
        Status: Success (0x00)
        Handle: 2376 Address: DF:A9:FF:F6:B1:1A (OUI DF-A9-FF)
        TX PHY: LE 2M (0x02)
        RX PHY: LE 2M (0x02)
> ACL Data RX: Handle 2376 flags 0x02 dlen 21               #66 [hci1] 4.267359
      SMP: Pairing Confirm (0x03) len 16
        Confim value: 73335ca8d6dacb1a980a9c01a511076b
< HCI Command: Host Number of Compl.. (0x03|0x0035) plen 5  #67 [hci1] 4.277309
        Num handles: 1
        Handle: 2376 Address: DF:A9:FF:F6:B1:1A (OUI DF-A9-FF)
        Count: 1
< ACL Data TX: Handle 2376 flags 0x00 dlen 21               #68 [hci1] 4.277343
      SMP: Pairing Random (0x04) len 16
        Random value: 8e6108f966a694cbe26df70bb96773e6
> HCI Event: Number of Completed Packets (0x13) plen 5      #69 [hci1] 4.317350
        Num handles: 1
        Handle: 2376 Address: DF:A9:FF:F6:B1:1A (OUI DF-A9-FF)
        Count: 1
        #68: len 21 (4 Kb/s)
        Latency: 40 msec (29-179 msec ~61 msec)
> ACL Data RX: Handle 2376 flags 0x02 dlen 21               #70 [hci1] 4.567414
      SMP: Pairing Random (0x04) len 16
        Random value: 479ea1557baaa0fa12c709c02e07279d
< HCI Command: Host Number of Compl.. (0x03|0x0035) plen 5  #71 [hci1] 4.577969
        Num handles: 1
        Handle: 2376 Address: DF:A9:FF:F6:B1:1A (OUI DF-A9-FF)
        Count: 1
< ACL Data TX: Handle 2376 flags 0x00 dlen 21               #72 [hci1] 4.578069
      SMP: Pairing Confirm (0x03) len 16
        Confim value: f6eb8f0b237bc96943fdb77100f92216
> HCI Event: Number of Completed Packets (0x13) plen 5      #73 [hci1] 4.617253
        Num handles: 1
        Handle: 2376 Address: DF:A9:FF:F6:B1:1A (OUI DF-A9-FF)
        Count: 1
        #72: len 21 (4 Kb/s)
        Latency: 39 msec (29-179 msec ~50 msec)
> ACL Data RX: Handle 2376 flags 0x02 dlen 21               #74 [hci1] 4.667358
      SMP: Pairing Confirm (0x03) len 16
        Confim value: 1bcebafbcab5715bd8a7c89f94cedbb5
< HCI Command: Host Number of Compl.. (0x03|0x0035) plen 5  #75 [hci1] 4.677697
        Num handles: 1
        Handle: 2376 Address: DF:A9:FF:F6:B1:1A (OUI DF-A9-FF)
        Count: 1
< ACL Data TX: Handle 2376 flags 0x00 dlen 21               #76 [hci1] 4.677828
      SMP: Pairing Random (0x04) len 16
        Random value: 4d02679f89a05211af56d8b3da64d21e
> HCI Event: Number of Completed Packets (0x13) plen 5      #77 [hci1] 4.717138
        Num handles: 1
        Handle: 2376 Address: DF:A9:FF:F6:B1:1A (OUI DF-A9-FF)
        Count: 1
        #76: len 21 (4 Kb/s)
        Latency: 39 msec (29-179 msec ~44 msec)
> ACL Data RX: Handle 2376 flags 0x02 dlen 21               #78 [hci1] 4.967382
      SMP: Pairing Random (0x04) len 16
        Random value: 607e2996fe03aee72d3993a5506c255d
< HCI Command: Host Number of Compl.. (0x03|0x0035) plen 5  #79 [hci1] 4.977742
        Num handles: 1
        Handle: 2376 Address: DF:A9:FF:F6:B1:1A (OUI DF-A9-FF)
        Count: 1
< ACL Data TX: Handle 2376 flags 0x00 dlen 21               #80 [hci1] 4.977837
      SMP: Pairing Confirm (0x03) len 16
        Confim value: 6528452e3dd1181a5bb8a2205880dc81
> HCI Event: Number of Completed Packets (0x13) plen 5      #81 [hci1] 5.017231
        Num handles: 1
        Handle: 2376 Address: DF:A9:FF:F6:B1:1A (OUI DF-A9-FF)
        Count: 1
        #80: len 21 (4 Kb/s)
        Latency: 39 msec (29-179 msec ~42 msec)
> ACL Data RX: Handle 2376 flags 0x02 dlen 21               #82 [hci1] 5.067324
      SMP: Pairing Confirm (0x03) len 16
        Confim value: ae442d1cf82335acd2e4bb36481501cf
< HCI Command: Host Number of Compl.. (0x03|0x0035) plen 5  #83 [hci1] 5.077320
        Num handles: 1
        Handle: 2376 Address: DF:A9:FF:F6:B1:1A (OUI DF-A9-FF)
        Count: 1
< ACL Data TX: Handle 2376 flags 0x00 dlen 21               #84 [hci1] 5.077383
      SMP: Pairing Random (0x04) len 16
        Random value: 5e8286bc235a02440d0c3424a2acf8fd
> HCI Event: Number of Completed Packets (0x13) plen 5      #85 [hci1] 5.117279
        Num handles: 1
        Handle: 2376 Address: DF:A9:FF:F6:B1:1A (OUI DF-A9-FF)
        Count: 1
        #84: len 21 (4 Kb/s)
        Latency: 39 msec (29-179 msec ~40 msec)
> ACL Data RX: Handle 2376 flags 0x02 dlen 21               #86 [hci1] 5.367406
      SMP: Pairing Random (0x04) len 16
        Random value: f3753946d8702f40df211b709f8b3542
< HCI Command: Host Number of Compl.. (0x03|0x0035) plen 5  #87 [hci1] 5.377480
        Num handles: 1
        Handle: 2376 Address: DF:A9:FF:F6:B1:1A (OUI DF-A9-FF)
        Count: 1
< ACL Data TX: Handle 2376 flags 0x00 dlen 21               #88 [hci1] 5.377564
      SMP: Pairing Confirm (0x03) len 16
        Confim value: 7d78c87a25d4606270079fbe3a29d549
> HCI Event: Number of Completed Packets (0x13) plen 5      #89 [hci1] 5.417111
        Num handles: 1
        Handle: 2376 Address: DF:A9:FF:F6:B1:1A (OUI DF-A9-FF)
        Count: 1
        #88: len 21 (4 Kb/s)
        Latency: 39 msec (29-179 msec ~40 msec)
> ACL Data RX: Handle 2376 flags 0x02 dlen 21               #90 [hci1] 5.467344
      SMP: Pairing Confirm (0x03) len 16
        Confim value: f85e1eed67a6f4d65108a74c1e731f0b
< HCI Command: Host Number of Compl.. (0x03|0x0035) plen 5  #91 [hci1] 5.477748
        Num handles: 1
        Handle: 2376 Address: DF:A9:FF:F6:B1:1A (OUI DF-A9-FF)
        Count: 1
< ACL Data TX: Handle 2376 flags 0x00 dlen 21               #92 [hci1] 5.477862
      SMP: Pairing Random (0x04) len 16
        Random value: 5c4a1bcadd27bd58e945097b00bad7ac
> HCI Event: Number of Completed Packets (0x13) plen 5      #93 [hci1] 5.517201
        Num handles: 1
        Handle: 2376 Address: DF:A9:FF:F6:B1:1A (OUI DF-A9-FF)
        Count: 1
        #92: len 21 (4 Kb/s)
        Latency: 39 msec (29-179 msec ~39 msec)
> ACL Data RX: Handle 2376 flags 0x02 dlen 21               #94 [hci1] 5.767443
      SMP: Pairing Random (0x04) len 16
        Random value: f2aa126de19a5f559b3ac844d7347f13
< HCI Command: Host Number of Compl.. (0x03|0x0035) plen 5  #95 [hci1] 5.777397
        Num handles: 1
        Handle: 2376 Address: DF:A9:FF:F6:B1:1A (OUI DF-A9-FF)
        Count: 1
< ACL Data TX: Handle 2376 flags 0x00 dlen 21               #96 [hci1] 5.777451
      SMP: Pairing Confirm (0x03) len 16
        Confim value: b799e9dccb0dcd5b98122525e823456f
> HCI Event: Number of Completed Packets (0x13) plen 5      #97 [hci1] 5.817152
        Num handles: 1
        Handle: 2376 Address: DF:A9:FF:F6:B1:1A (OUI DF-A9-FF)
        Count: 1
        #96: len 21 (4 Kb/s)
        Latency: 39 msec (29-179 msec ~39 msec)
> ACL Data RX: Handle 2376 flags 0x02 dlen 21               #98 [hci1] 5.867500
      SMP: Pairing Confirm (0x03) len 16
        Confim value: b29f68f189fa8ef1f12624a82b50b22f
< HCI Command: Host Number of Compl.. (0x03|0x0035) plen 5  #99 [hci1] 5.877271
        Num handles: 1
        Handle: 2376 Address: DF:A9:FF:F6:B1:1A (OUI DF-A9-FF)
        Count: 1
< ACL Data TX: Handle 2376 flags 0x00 dlen 21              #100 [hci1] 5.877301
      SMP: Pairing Random (0x04) len 16
        Random value: 32527e6e64e79f33b2e374394db8ab2d
> HCI Event: Number of Completed Packets (0x13) plen 5     #101 [hci1] 5.917138
        Num handles: 1
        Handle: 2376 Address: DF:A9:FF:F6:B1:1A (OUI DF-A9-FF)
        Count: 1
        #100: len 21 (4 Kb/s)
        Latency: 39 msec (29-179 msec ~39 msec)
> ACL Data RX: Handle 2376 flags 0x02 dlen 21              #102 [hci1] 6.167375
      SMP: Pairing Random (0x04) len 16
        Random value: c9439efecedecb5b3a0281ba9c1de15d
< HCI Command: Host Number of Comp.. (0x03|0x0035) plen 5  #103 [hci1] 6.177741
        Num handles: 1
        Handle: 2376 Address: DF:A9:FF:F6:B1:1A (OUI DF-A9-FF)
        Count: 1
< ACL Data TX: Handle 2376 flags 0x00 dlen 21              #104 [hci1] 6.177764
      SMP: Pairing Confirm (0x03) len 16
        Confim value: ad67e9a510b266722d3be16aae71b4f7
> HCI Event: Number of Completed Packets (0x13) plen 5     #105 [hci1] 6.217120
        Num handles: 1
        Handle: 2376 Address: DF:A9:FF:F6:B1:1A (OUI DF-A9-FF)
        Count: 1
        #104: len 21 (4 Kb/s)
        Latency: 39 msec (29-179 msec ~39 msec)
> ACL Data RX: Handle 2376 flags 0x02 dlen 21              #106 [hci1] 6.267413
      SMP: Pairing Confirm (0x03) len 16
        Confim value: f56fb4fc1275f3467f8689e9417aafa7
< HCI Command: Host Number of Comp.. (0x03|0x0035) plen 5  #107 [hci1] 6.277626
        Num handles: 1
        Handle: 2376 Address: DF:A9:FF:F6:B1:1A (OUI DF-A9-FF)
        Count: 1
< ACL Data TX: Handle 2376 flags 0x00 dlen 21              #108 [hci1] 6.277728
      SMP: Pairing Random (0x04) len 16
        Random value: dddbdfe2838e9a8cc6964353c850fef7
> HCI Event: Number of Completed Packets (0x13) plen 5     #109 [hci1] 6.317089
        Num handles: 1
        Handle: 2376 Address: DF:A9:FF:F6:B1:1A (OUI DF-A9-FF)
        Count: 1
        #108: len 21 (4 Kb/s)
        Latency: 39 msec (29-179 msec ~39 msec)
> ACL Data RX: Handle 2376 flags 0x02 dlen 21              #110 [hci1] 6.567351
      SMP: Pairing Random (0x04) len 16
        Random value: 2d4cb5a755b50da72cfa63ba3ab2aca2
< HCI Command: Host Number of Comp.. (0x03|0x0035) plen 5  #111 [hci1] 6.577910
        Num handles: 1
        Handle: 2376 Address: DF:A9:FF:F6:B1:1A (OUI DF-A9-FF)
        Count: 1
< ACL Data TX: Handle 2376 flags 0x00 dlen 21              #112 [hci1] 6.578028
      SMP: Pairing Confirm (0x03) len 16
        Confim value: 427224ad4a19d8201e11c8566d86fb3d
> HCI Event: Number of Completed Packets (0x13) plen 5     #113 [hci1] 6.617103
        Num handles: 1
        Handle: 2376 Address: DF:A9:FF:F6:B1:1A (OUI DF-A9-FF)
        Count: 1
        #112: len 21 (4 Kb/s)
        Latency: 39 msec (29-179 msec ~39 msec)
> ACL Data RX: Handle 2376 flags 0x02 dlen 21              #114 [hci1] 6.667394
      SMP: Pairing Confirm (0x03) len 16
        Confim value: 894476582d142a0ae5b93a30c1ec14ab
< HCI Command: Host Number of Comp.. (0x03|0x0035) plen 5  #115 [hci1] 6.677649
        Num handles: 1
        Handle: 2376 Address: DF:A9:FF:F6:B1:1A (OUI DF-A9-FF)
        Count: 1
< ACL Data TX: Handle 2376 flags 0x00 dlen 21              #116 [hci1] 6.677799
      SMP: Pairing Random (0x04) len 16
        Random value: eb9f1915536596b6fc3db1c86b2b1970
> HCI Event: Number of Completed Packets (0x13) plen 5     #117 [hci1] 6.717131
        Num handles: 1
        Handle: 2376 Address: DF:A9:FF:F6:B1:1A (OUI DF-A9-FF)
        Count: 1
        #116: len 21 (4 Kb/s)
        Latency: 39 msec (29-179 msec ~39 msec)
> ACL Data RX: Handle 2376 flags 0x02 dlen 21              #118 [hci1] 6.967275
      SMP: Pairing Random (0x04) len 16
        Random value: 04a1b30d387f2d4b6e2d57f76ee0a743
< HCI Command: Host Number of Comp.. (0x03|0x0035) plen 5  #119 [hci1] 6.977824
        Num handles: 1
        Handle: 2376 Address: DF:A9:FF:F6:B1:1A (OUI DF-A9-FF)
        Count: 1
< ACL Data TX: Handle 2376 flags 0x00 dlen 21              #120 [hci1] 6.977920
      SMP: Pairing Confirm (0x03) len 16
        Confim value: c6086447689108d2d63f1f3ac06bba7a
> HCI Event: Number of Completed Packets (0x13) plen 5     #121 [hci1] 7.017146
        Num handles: 1
        Handle: 2376 Address: DF:A9:FF:F6:B1:1A (OUI DF-A9-FF)
        Count: 1
        #120: len 21 (4 Kb/s)
        Latency: 39 msec (29-179 msec ~39 msec)
> ACL Data RX: Handle 2376 flags 0x02 dlen 21              #122 [hci1] 7.067380
      SMP: Pairing Confirm (0x03) len 16
        Confim value: 98497c92c80324abbbdc9162e47ac1e1
< HCI Command: Host Number of Comp.. (0x03|0x0035) plen 5  #123 [hci1] 7.077643
        Num handles: 1
        Handle: 2376 Address: DF:A9:FF:F6:B1:1A (OUI DF-A9-FF)
        Count: 1
< ACL Data TX: Handle 2376 flags 0x00 dlen 21              #124 [hci1] 7.077750
      SMP: Pairing Random (0x04) len 16
        Random value: 5c794dc9ad9f2c3f295ebd5ad5e1c3cf
> HCI Event: Number of Completed Packets (0x13) plen 5     #125 [hci1] 7.117273
        Num handles: 1
        Handle: 2376 Address: DF:A9:FF:F6:B1:1A (OUI DF-A9-FF)
        Count: 1
        #124: len 21 (4 Kb/s)
        Latency: 39 msec (29-179 msec ~39 msec)
> ACL Data RX: Handle 2376 flags 0x02 dlen 21              #126 [hci1] 7.367388
      SMP: Pairing Random (0x04) len 16
        Random value: 06bed793a30ce741e295a0356074bc80
< HCI Command: Host Number of Comp.. (0x03|0x0035) plen 5  #127 [hci1] 7.377426
        Num handles: 1
        Handle: 2376 Address: DF:A9:FF:F6:B1:1A (OUI DF-A9-FF)
        Count: 1
< ACL Data TX: Handle 2376 flags 0x00 dlen 21              #128 [hci1] 7.377468
      SMP: Pairing Confirm (0x03) len 16
        Confim value: a320efb11fc4068425141a895c0dd450
> HCI Event: Number of Completed Packets (0x13) plen 5     #129 [hci1] 7.417168
        Num handles: 1
        Handle: 2376 Address: DF:A9:FF:F6:B1:1A (OUI DF-A9-FF)
        Count: 1
        #128: len 21 (4 Kb/s)
        Latency: 39 msec (29-179 msec ~39 msec)
> ACL Data RX: Handle 2376 flags 0x02 dlen 21              #130 [hci1] 7.467497
      SMP: Pairing Confirm (0x03) len 16
        Confim value: a3fabd9d44b643339f46a4d5fe6df565
< HCI Command: Host Number of Comp.. (0x03|0x0035) plen 5  #131 [hci1] 7.477566
        Num handles: 1
        Handle: 2376 Address: DF:A9:FF:F6:B1:1A (OUI DF-A9-FF)
        Count: 1
< ACL Data TX: Handle 2376 flags 0x00 dlen 21              #132 [hci1] 7.477704
      SMP: Pairing Random (0x04) len 16
        Random value: 5c2fff312cdf99c9491988e877355a9a
> HCI Event: Number of Completed Packets (0x13) plen 5     #133 [hci1] 7.517200
        Num handles: 1
        Handle: 2376 Address: DF:A9:FF:F6:B1:1A (OUI DF-A9-FF)
        Count: 1
        #132: len 21 (4 Kb/s)
        Latency: 39 msec (29-179 msec ~39 msec)
> ACL Data RX: Handle 2376 flags 0x02 dlen 21              #134 [hci1] 7.767441
      SMP: Pairing Random (0x04) len 16
        Random value: b90d4e585a3a93c0bd091ac6e9eba73e
< HCI Command: Host Number of Comp.. (0x03|0x0035) plen 5  #135 [hci1] 7.777811
        Num handles: 1
        Handle: 2376 Address: DF:A9:FF:F6:B1:1A (OUI DF-A9-FF)
        Count: 1
< ACL Data TX: Handle 2376 flags 0x00 dlen 21              #136 [hci1] 7.777919
      SMP: Pairing Confirm (0x03) len 16
        Confim value: ec47cd7051c7a292f5b8ab6ff3516df4
> HCI Event: Number of Completed Packets (0x13) plen 5     #137 [hci1] 7.817080
        Num handles: 1
        Handle: 2376 Address: DF:A9:FF:F6:B1:1A (OUI DF-A9-FF)
        Count: 1
        #136: len 21 (4 Kb/s)
        Latency: 39 msec (29-179 msec ~39 msec)
> ACL Data RX: Handle 2376 flags 0x02 dlen 21              #138 [hci1] 7.867299
      SMP: Pairing Confirm (0x03) len 16
        Confim value: 01f1cd0d0c1def365d8090dfbd8b3b86
< HCI Command: Host Number of Comp.. (0x03|0x0035) plen 5  #139 [hci1] 7.877398
        Num handles: 1
        Handle: 2376 Address: DF:A9:FF:F6:B1:1A (OUI DF-A9-FF)
        Count: 1
< ACL Data TX: Handle 2376 flags 0x00 dlen 21              #140 [hci1] 7.877438
      SMP: Pairing Random (0x04) len 16
        Random value: c629a3a987d808e808655d558dfc1155
> HCI Event: Number of Completed Packets (0x13) plen 5     #141 [hci1] 7.917223
        Num handles: 1
        Handle: 2376 Address: DF:A9:FF:F6:B1:1A (OUI DF-A9-FF)
        Count: 1
        #140: len 21 (4 Kb/s)
        Latency: 39 msec (29-179 msec ~39 msec)
> ACL Data RX: Handle 2376 flags 0x02 dlen 21              #142 [hci1] 8.167264
      SMP: Pairing Random (0x04) len 16
        Random value: 0d21c0d2d4568f4f3d5c12c32c07b3a2
< HCI Command: Host Number of Comp.. (0x03|0x0035) plen 5  #143 [hci1] 8.177908
        Num handles: 1
        Handle: 2376 Address: DF:A9:FF:F6:B1:1A (OUI DF-A9-FF)
        Count: 1
< ACL Data TX: Handle 2376 flags 0x00 dlen 21              #144 [hci1] 8.178059
      SMP: Pairing Confirm (0x03) len 16
        Confim value: d0c9c7242808dca24d5708b2bab98624
> HCI Event: Number of Completed Packets (0x13) plen 5     #145 [hci1] 8.217238
        Num handles: 1
        Handle: 2376 Address: DF:A9:FF:F6:B1:1A (OUI DF-A9-FF)
        Count: 1
        #144: len 21 (4 Kb/s)
        Latency: 39 msec (29-179 msec ~39 msec)
> ACL Data RX: Handle 2376 flags 0x02 dlen 21              #146 [hci1] 8.267355
      SMP: Pairing Confirm (0x03) len 16
        Confim value: d89df70f216eef060b9fa9d307c71cb7
< HCI Command: Host Number of Comp.. (0x03|0x0035) plen 5  #147 [hci1] 8.277598
        Num handles: 1
        Handle: 2376 Address: DF:A9:FF:F6:B1:1A (OUI DF-A9-FF)
        Count: 1
< ACL Data TX: Handle 2376 flags 0x00 dlen 21              #148 [hci1] 8.277657
      SMP: Pairing Random (0x04) len 16
        Random value: 92f20f6ad8f13724432c7fd6001c45ff
> HCI Event: Number of Completed Packets (0x13) plen 5     #149 [hci1] 8.317076
        Num handles: 1
        Handle: 2376 Address: DF:A9:FF:F6:B1:1A (OUI DF-A9-FF)
        Count: 1
        #148: len 21 (4 Kb/s)
        Latency: 39 msec (29-179 msec ~39 msec)
> ACL Data RX: Handle 2376 flags 0x02 dlen 21              #150 [hci1] 8.567296
      SMP: Pairing Random (0x04) len 16
        Random value: 4b9624591222550b0d198a8589d5a95d
< HCI Command: Host Number of Comp.. (0x03|0x0035) plen 5  #151 [hci1] 8.577904
        Num handles: 1
        Handle: 2376 Address: DF:A9:FF:F6:B1:1A (OUI DF-A9-FF)
        Count: 1
< ACL Data TX: Handle 2376 flags 0x00 dlen 21              #152 [hci1] 8.578033
      SMP: Pairing Confirm (0x03) len 16
        Confim value: 4a2dc71151ad813a768f785f9b15e27c
> HCI Event: Number of Completed Packets (0x13) plen 5     #153 [hci1] 8.617306
        Num handles: 1
        Handle: 2376 Address: DF:A9:FF:F6:B1:1A (OUI DF-A9-FF)
        Count: 1
        #152: len 21 (4 Kb/s)
        Latency: 39 msec (29-179 msec ~39 msec)
> ACL Data RX: Handle 2376 flags 0x02 dlen 21              #154 [hci1] 8.667406
      SMP: Pairing Confirm (0x03) len 16
        Confim value: 9b6ab7747b23bae5642a380e80534e99
< HCI Command: Host Number of Comp.. (0x03|0x0035) plen 5  #155 [hci1] 8.677735
        Num handles: 1
        Handle: 2376 Address: DF:A9:FF:F6:B1:1A (OUI DF-A9-FF)
        Count: 1
< ACL Data TX: Handle 2376 flags 0x00 dlen 21              #156 [hci1] 8.677819
      SMP: Pairing Random (0x04) len 16
        Random value: 23ac32ebbb5e14c8a6b9622f296d277f
> HCI Event: Number of Completed Packets (0x13) plen 5     #157 [hci1] 8.717105
        Num handles: 1
        Handle: 2376 Address: DF:A9:FF:F6:B1:1A (OUI DF-A9-FF)
        Count: 1
        #156: len 21 (4 Kb/s)
        Latency: 39 msec (29-179 msec ~39 msec)
> ACL Data RX: Handle 2376 flags 0x02 dlen 21              #158 [hci1] 8.967285
      SMP: Pairing Random (0x04) len 16
        Random value: 97016bd75f7f7de565fc9c3df241a18b
< HCI Command: Host Number of Comp.. (0x03|0x0035) plen 5  #159 [hci1] 8.977378
        Num handles: 1
        Handle: 2376 Address: DF:A9:FF:F6:B1:1A (OUI DF-A9-FF)
        Count: 1
< ACL Data TX: Handle 2376 flags 0x00 dlen 21              #160 [hci1] 8.977414
      SMP: Pairing Confirm (0x03) len 16
        Confim value: 296ae98c6e3d06a3c824ed41b01f2866
> HCI Event: Number of Completed Packets (0x13) plen 5     #161 [hci1] 9.017086
        Num handles: 1
        Handle: 2376 Address: DF:A9:FF:F6:B1:1A (OUI DF-A9-FF)
        Count: 1
        #160: len 21 (4 Kb/s)
        Latency: 39 msec (29-179 msec ~39 msec)
> ACL Data RX: Handle 2376 flags 0x02 dlen 21              #162 [hci1] 9.067335
      SMP: Pairing Confirm (0x03) len 16
        Confim value: 2524cff7693e45942547aba1199c74a2
< HCI Command: Host Number of Comp.. (0x03|0x0035) plen 5  #163 [hci1] 9.077745
        Num handles: 1
        Handle: 2376 Address: DF:A9:FF:F6:B1:1A (OUI DF-A9-FF)
        Count: 1
< ACL Data TX: Handle 2376 flags 0x00 dlen 21              #164 [hci1] 9.077919
      SMP: Pairing Random (0x04) len 16
        Random value: 297efe85e67448a15f56bd27e3a3cf1d
> HCI Event: Number of Completed Packets (0x13) plen 5     #165 [hci1] 9.117140
        Num handles: 1
        Handle: 2376 Address: DF:A9:FF:F6:B1:1A (OUI DF-A9-FF)
        Count: 1
        #164: len 21 (4 Kb/s)
        Latency: 39 msec (29-179 msec ~39 msec)
> ACL Data RX: Handle 2376 flags 0x02 dlen 21              #166 [hci1] 9.367345
      SMP: Pairing Random (0x04) len 16
        Random value: 503b44d3e82edbda23f6833a96e4d310
< HCI Command: Host Number of Comp.. (0x03|0x0035) plen 5  #167 [hci1] 9.377833
        Num handles: 1
        Handle: 2376 Address: DF:A9:FF:F6:B1:1A (OUI DF-A9-FF)
        Count: 1
< ACL Data TX: Handle 2376 flags 0x00 dlen 21              #168 [hci1] 9.377942
      SMP: Pairing Confirm (0x03) len 16
        Confim value: 0de7e88cdd69f24b445b6d8388187afc
> HCI Event: Number of Completed Packets (0x13) plen 5     #169 [hci1] 9.417077
        Num handles: 1
        Handle: 2376 Address: DF:A9:FF:F6:B1:1A (OUI DF-A9-FF)
        Count: 1
        #168: len 21 (4 Kb/s)
        Latency: 39 msec (29-179 msec ~39 msec)
> ACL Data RX: Handle 2376 flags 0x02 dlen 21              #170 [hci1] 9.467284
      SMP: Pairing Confirm (0x03) len 16
        Confim value: 160102e1b9757be346ea7a53c5ce68e8
< HCI Command: Host Number of Comp.. (0x03|0x0035) plen 5  #171 [hci1] 9.477470
        Num handles: 1
        Handle: 2376 Address: DF:A9:FF:F6:B1:1A (OUI DF-A9-FF)
        Count: 1
< ACL Data TX: Handle 2376 flags 0x00 dlen 21              #172 [hci1] 9.477518
      SMP: Pairing Random (0x04) len 16
        Random value: 25a9493fd3ce4faf02be7293595bb7c6
> HCI Event: Number of Completed Packets (0x13) plen 5     #173 [hci1] 9.517112
        Num handles: 1
        Handle: 2376 Address: DF:A9:FF:F6:B1:1A (OUI DF-A9-FF)
        Count: 1
        #172: len 21 (4 Kb/s)
        Latency: 39 msec (29-179 msec ~39 msec)
> ACL Data RX: Handle 2376 flags 0x02 dlen 21              #174 [hci1] 9.767206
      SMP: Pairing Random (0x04) len 16
        Random value: c0ec2668290e2b5d9af6abcd496a48bb
< HCI Command: Host Number of Comp.. (0x03|0x0035) plen 5  #175 [hci1] 9.777899
        Num handles: 1
        Handle: 2376 Address: DF:A9:FF:F6:B1:1A (OUI DF-A9-FF)
        Count: 1
< ACL Data TX: Handle 2376 flags 0x00 dlen 21              #176 [hci1] 9.778019
      SMP: Pairing Confirm (0x03) len 16
        Confim value: 2b5f4920e68cb80186a56d24235504bf
> HCI Event: Number of Completed Packets (0x13) plen 5     #177 [hci1] 9.817096
        Num handles: 1
        Handle: 2376 Address: DF:A9:FF:F6:B1:1A (OUI DF-A9-FF)
        Count: 1
        #176: len 21 (4 Kb/s)
        Latency: 39 msec (29-179 msec ~39 msec)
> ACL Data RX: Handle 2376 flags 0x02 dlen 21              #178 [hci1] 9.867259
      SMP: Pairing Confirm (0x03) len 16
        Confim value: 460163fc6bf7b64fa9dde2065e4ab8cf
< HCI Command: Host Number of Comp.. (0x03|0x0035) plen 5  #179 [hci1] 9.877801
        Num handles: 1
        Handle: 2376 Address: DF:A9:FF:F6:B1:1A (OUI DF-A9-FF)
        Count: 1
< ACL Data TX: Handle 2376 flags 0x00 dlen 21              #180 [hci1] 9.877925
      SMP: Pairing Random (0x04) len 16
        Random value: 58f6b41f855a6f6c3560debd84e2affc
> HCI Event: Number of Completed Packets (0x13) plen 5     #181 [hci1] 9.917197
        Num handles: 1
        Handle: 2376 Address: DF:A9:FF:F6:B1:1A (OUI DF-A9-FF)
        Count: 1
        #180: len 21 (4 Kb/s)
        Latency: 39 msec (29-179 msec ~39 msec)
> ACL Data RX: Handle 2376 flags 0x02 dlen 21             #182 [hci1] 10.167245
      SMP: Pairing Random (0x04) len 16
        Random value: 817b660b76371e77d24786c28613dc58
< HCI Command: Host Number of Com.. (0x03|0x0035) plen 5  #183 [hci1] 10.177878
        Num handles: 1
        Handle: 2376 Address: DF:A9:FF:F6:B1:1A (OUI DF-A9-FF)
        Count: 1
< ACL Data TX: Handle 2376 flags 0x00 dlen 21             #184 [hci1] 10.178054
      SMP: Pairing Confirm (0x03) len 16
        Confim value: effd95218ca172b6c660a655bfe59299
> HCI Event: Number of Completed Packets (0x13) plen 5    #185 [hci1] 10.217122
        Num handles: 1
        Handle: 2376 Address: DF:A9:FF:F6:B1:1A (OUI DF-A9-FF)
        Count: 1
        #184: len 21 (4 Kb/s)
        Latency: 39 msec (29-179 msec ~39 msec)
> ACL Data RX: Handle 2376 flags 0x02 dlen 21             #186 [hci1] 10.267352
      SMP: Pairing Confirm (0x03) len 16
        Confim value: 792e266b611934f82254d1de5cb474df
< HCI Command: Host Number of Com.. (0x03|0x0035) plen 5  #187 [hci1] 10.277745
        Num handles: 1
        Handle: 2376 Address: DF:A9:FF:F6:B1:1A (OUI DF-A9-FF)
        Count: 1
< ACL Data TX: Handle 2376 flags 0x00 dlen 21             #188 [hci1] 10.277941
      SMP: Pairing Random (0x04) len 16
        Random value: b67e7216d5bf664139eda2b542549666
> HCI Event: Number of Completed Packets (0x13) plen 5    #189 [hci1] 10.317140
        Num handles: 1
        Handle: 2376 Address: DF:A9:FF:F6:B1:1A (OUI DF-A9-FF)
        Count: 1
        #188: len 21 (4 Kb/s)
        Latency: 39 msec (29-179 msec ~39 msec)
> ACL Data RX: Handle 2376 flags 0x02 dlen 21             #190 [hci1] 10.567380
      SMP: Pairing Random (0x04) len 16
        Random value: f3da9c93dcdff4055484c17bc98712cb
< HCI Command: Host Number of Com.. (0x03|0x0035) plen 5  #191 [hci1] 10.577918
        Num handles: 1
        Handle: 2376 Address: DF:A9:FF:F6:B1:1A (OUI DF-A9-FF)
        Count: 1
< ACL Data TX: Handle 2376 flags 0x00 dlen 21             #192 [hci1] 10.578013
      SMP: Pairing Confirm (0x03) len 16
        Confim value: a696a5991b5f9a3226ce71e24c74a8ff
> HCI Event: Number of Completed Packets (0x13) plen 5    #193 [hci1] 10.617174
        Num handles: 1
        Handle: 2376 Address: DF:A9:FF:F6:B1:1A (OUI DF-A9-FF)
        Count: 1
        #192: len 21 (4 Kb/s)
        Latency: 39 msec (29-179 msec ~39 msec)
> ACL Data RX: Handle 2376 flags 0x02 dlen 21             #194 [hci1] 10.667351
      SMP: Pairing Confirm (0x03) len 16
        Confim value: 0a24da05cbd214447fb7a43866035f86
< HCI Command: Host Number of Com.. (0x03|0x0035) plen 5  #195 [hci1] 10.677781
        Num handles: 1
        Handle: 2376 Address: DF:A9:FF:F6:B1:1A (OUI DF-A9-FF)
        Count: 1
< ACL Data TX: Handle 2376 flags 0x00 dlen 21             #196 [hci1] 10.677961
      SMP: Pairing Random (0x04) len 16
        Random value: ed17f76500c95219dd01e09d1e63f87b
> HCI Event: Number of Completed Packets (0x13) plen 5    #197 [hci1] 10.717054
        Num handles: 1
        Handle: 2376 Address: DF:A9:FF:F6:B1:1A (OUI DF-A9-FF)
        Count: 1
        #196: len 21 (4 Kb/s)
        Latency: 39 msec (29-179 msec ~39 msec)
> ACL Data RX: Handle 2376 flags 0x02 dlen 21             #198 [hci1] 10.967321
      SMP: Pairing Random (0x04) len 16
        Random value: 6affef23ba639741bc3e5827a3e927a1
< HCI Command: Host Number of Com.. (0x03|0x0035) plen 5  #199 [hci1] 10.977624
        Num handles: 1
        Handle: 2376 Address: DF:A9:FF:F6:B1:1A (OUI DF-A9-FF)
        Count: 1
< ACL Data TX: Handle 2376 flags 0x00 dlen 21             #200 [hci1] 10.977688
      SMP: Pairing Confirm (0x03) len 16
        Confim value: ba4959540bff6f982bba65f9f57bbdc3
> HCI Event: Number of Completed Packets (0x13) plen 5    #201 [hci1] 11.017162
        Num handles: 1
        Handle: 2376 Address: DF:A9:FF:F6:B1:1A (OUI DF-A9-FF)
        Count: 1
        #200: len 21 (4 Kb/s)
        Latency: 39 msec (29-179 msec ~39 msec)
> ACL Data RX: Handle 2376 flags 0x02 dlen 21             #202 [hci1] 11.067311
      SMP: Pairing Confirm (0x03) len 16
        Confim value: 73e51fbf0704e2a2eb42c099f341068a
< HCI Command: Host Number of Com.. (0x03|0x0035) plen 5  #203 [hci1] 11.077751
        Num handles: 1
        Handle: 2376 Address: DF:A9:FF:F6:B1:1A (OUI DF-A9-FF)
        Count: 1
< ACL Data TX: Handle 2376 flags 0x00 dlen 21             #204 [hci1] 11.077919
      SMP: Pairing Random (0x04) len 16
        Random value: 81d35d47e1f6006d79c974bd9d9e1ee3
> HCI Event: Number of Completed Packets (0x13) plen 5    #205 [hci1] 11.117031
        Num handles: 1
        Handle: 2376 Address: DF:A9:FF:F6:B1:1A (OUI DF-A9-FF)
        Count: 1
        #204: len 21 (4 Kb/s)
        Latency: 39 msec (29-179 msec ~39 msec)
> ACL Data RX: Handle 2376 flags 0x02 dlen 21             #206 [hci1] 11.367310
      SMP: Pairing Random (0x04) len 16
        Random value: 12d9fcd92a96e7fa2c019c6523a6be59
< HCI Command: Host Number of Com.. (0x03|0x0035) plen 5  #207 [hci1] 11.377822
        Num handles: 1
        Handle: 2376 Address: DF:A9:FF:F6:B1:1A (OUI DF-A9-FF)
        Count: 1
< ACL Data TX: Handle 2376 flags 0x00 dlen 21             #208 [hci1] 11.377897
      SMP: Pairing Confirm (0x03) len 16
        Confim value: bb0b62eba0b8ea61cfe156a1b18ce40f
> HCI Event: Number of Completed Packets (0x13) plen 5    #209 [hci1] 11.417143
        Num handles: 1
        Handle: 2376 Address: DF:A9:FF:F6:B1:1A (OUI DF-A9-FF)
        Count: 1
        #208: len 21 (4 Kb/s)
        Latency: 39 msec (29-179 msec ~39 msec)
> ACL Data RX: Handle 2376 flags 0x02 dlen 21             #210 [hci1] 11.467246
      SMP: Pairing Confirm (0x03) len 16
        Confim value: 6b3716a96328d4471f287df18e2aba10
< HCI Command: Host Number of Com.. (0x03|0x0035) plen 5  #211 [hci1] 11.477675
        Num handles: 1
        Handle: 2376 Address: DF:A9:FF:F6:B1:1A (OUI DF-A9-FF)
        Count: 1
< ACL Data TX: Handle 2376 flags 0x00 dlen 21             #212 [hci1] 11.477744
      SMP: Pairing Random (0x04) len 16
        Random value: e7f7e0c2476823e41736a7e381bafb7c
> HCI Event: Number of Completed Packets (0x13) plen 5    #213 [hci1] 11.517056
        Num handles: 1
        Handle: 2376 Address: DF:A9:FF:F6:B1:1A (OUI DF-A9-FF)
        Count: 1
        #212: len 21 (4 Kb/s)
        Latency: 39 msec (29-179 msec ~39 msec)
> ACL Data RX: Handle 2376 flags 0x02 dlen 21             #214 [hci1] 11.767164
      SMP: Pairing Random (0x04) len 16
        Random value: 99a96fec38f914250f6a3659eac68ec8
< HCI Command: Host Number of Com.. (0x03|0x0035) plen 5  #215 [hci1] 11.777900
        Num handles: 1
        Handle: 2376 Address: DF:A9:FF:F6:B1:1A (OUI DF-A9-FF)
        Count: 1
< ACL Data TX: Handle 2376 flags 0x00 dlen 21             #216 [hci1] 11.778046
      SMP: Pairing Confirm (0x03) len 16
        Confim value: 1137c927ad43480438e39d4ced6526e9
> HCI Event: Number of Completed Packets (0x13) plen 5    #217 [hci1] 11.817170
        Num handles: 1
        Handle: 2376 Address: DF:A9:FF:F6:B1:1A (OUI DF-A9-FF)
        Count: 1
        #216: len 21 (4 Kb/s)
        Latency: 39 msec (29-179 msec ~39 msec)
> ACL Data RX: Handle 2376 flags 0x02 dlen 21             #218 [hci1] 11.867264
      SMP: Pairing Confirm (0x03) len 16
        Confim value: 4dc41a17f9f2bc29e1c210eac1ce5520
< HCI Command: Host Number of Com.. (0x03|0x0035) plen 5  #219 [hci1] 11.877843
        Num handles: 1
        Handle: 2376 Address: DF:A9:FF:F6:B1:1A (OUI DF-A9-FF)
        Count: 1
< ACL Data TX: Handle 2376 flags 0x00 dlen 21             #220 [hci1] 11.877997
      SMP: Pairing Random (0x04) len 16
        Random value: fc8b40d9b0b09bc4296bf8753a8f6e1f
> HCI Event: Number of Completed Packets (0x13) plen 5    #221 [hci1] 11.917025
        Num handles: 1
        Handle: 2376 Address: DF:A9:FF:F6:B1:1A (OUI DF-A9-FF)
        Count: 1
        #220: len 21 (4 Kb/s)
        Latency: 39 msec (29-179 msec ~39 msec)
> ACL Data RX: Handle 2376 flags 0x02 dlen 21             #222 [hci1] 12.167116
      SMP: Pairing Random (0x04) len 16
        Random value: 29cffdb497a12e4673ba88f5a3db3f8a
< HCI Command: Host Number of Com.. (0x03|0x0035) plen 5  #223 [hci1] 12.178173
        Num handles: 1
        Handle: 2376 Address: DF:A9:FF:F6:B1:1A (OUI DF-A9-FF)
        Count: 1
< ACL Data TX: Handle 2376 flags 0x00 dlen 21             #224 [hci1] 12.178295
      SMP: Pairing DHKey Check (0x0d) len 16
        E: 4b0ce164e50ddbbe7eb0bbe5f164b263
> HCI Event: Number of Completed Packets (0x13) plen 5    #225 [hci1] 12.217069
        Num handles: 1
        Handle: 2376 Address: DF:A9:FF:F6:B1:1A (OUI DF-A9-FF)
        Count: 1
        #224: len 21 (4 Kb/s)
        Latency: 38 msec (29-179 msec ~38 msec)
> ACL Data RX: Handle 2376 flags 0x02 dlen 21             #226 [hci1] 12.267124
      SMP: Pairing DHKey Check (0x0d) len 16
        E: 068133bf29305971e34169f96394d7fb
< HCI Command: LE Start Encryption (0x08|0x0019) plen 28  #227 [hci1] 12.277389
        Handle: 2376 Address: DF:A9:FF:F6:B1:1A (OUI DF-A9-FF)
        Random number: 0x0000000000000000
        Encrypted diversifier: 0x0000
        Long term key: 9160b4020971b67691b6ff3c63d4bd60
> HCI Event: Command Status (0x0f) plen 4                 #228 [hci1] 12.278426
      LE Start Encryption (0x08|0x0019) ncmd 1
        Status: Success (0x00)
< HCI Command: Host Number of Com.. (0x03|0x0035) plen 5  #229 [hci1] 12.297127
        Num handles: 1
        Handle: 2376 Address: DF:A9:FF:F6:B1:1A (OUI DF-A9-FF)
        Count: 1
> HCI Event: Encryption Change (0x08) plen 4              #230 [hci1] 12.617012
        Status: Success (0x00)
        Handle: 2376 Address: DF:A9:FF:F6:B1:1A (OUI DF-A9-FF)
        Encryption: Enabled with AES-CCM (0x01)
< HCI Command: Disconnect (0x01|0x0006) plen 3            #231 [hci1] 13.217844
        Handle: 2376 Address: DF:A9:FF:F6:B1:1A (OUI DF-A9-FF)
        Reason: Remote User Terminated Connection (0x13)
> HCI Event: Command Status (0x0f) plen 4                 #232 [hci1] 13.218461
      Disconnect (0x01|0x0006) ncmd 1
        Status: Success (0x00)
> HCI Event: Disconnect Complete (0x05) plen 4            #233 [hci1] 13.316988
        Status: Success (0x00)
        Handle: 2376 Address: DF:A9:FF:F6:B1:1A (OUI DF-A9-FF)
        Reason: Connection Terminated By Local Host (0x16)
< HCI Command: Reset (0x03|0x0003) plen 0                 #234 [hci1] 18.977398
> HCI Event: Command Complete (0x0e) plen 4               #235 [hci1] 18.977999
      Reset (0x03|0x0003) ncmd 1
        Status: Success (0x00)
@ USER Close: main                                    {0x0001} [hci1] 18.997318
= Close Index: 00:00:00:00:00:00                               [hci1] 18.997332
