Bluetooth monitor ver 5.84
btmon[1955714]: = Note: Linux version 6.8.0-83-generic (x86_64)                                                          0.185415
btmon[1955714]: = Note: Bluetooth subsystem version 2.22                                                                 0.185417
= New Index: 00:00:00:00:00:00 (Primary,UART,hci0)                                                                       0.185417
= Open Index: 00:00:00:00:00:00                                                                                          0.689595
= Index Info: 00:00:00:00:00:00 (Nordic Semiconductor ASA)                                                               0.689751
zephyr.exe[1955716]: @ USER Open: main (privileged) version 2.22                                                {0x0001} 0.689783
zephyr.exe[1955716]: < HCI Command: Reset (0x03|0x0003) plen 0                                                        #1 0.690498
> HCI Event: Command Complete (0x0e) plen 4                                                                           #2 0.691436
      Reset (0x03|0x0003) ncmd 1
        Status: Success (0x00)
zephyr.exe[1955716]: < HCI Command: Read Local Supported Features (0x04|0x0003) plen 0                                #3 0.709583
> HCI Event: Command Complete (0x0e) plen 12                                                                          #4 0.710490
      Read Local Supported Features (0x04|0x0003) ncmd 1
        Status: Success (0x00)
        Features: 0x00 0x00 0x00 0x00 0x60 0x00 0x00 0x00
          BR/EDR Not Supported
          LE Supported (Controller)
zephyr.exe[1955716]: < HCI Command: Read Local Version Information (0x04|0x0001) plen 0                               #5 0.729596
> HCI Event: Command Complete (0x0e) plen 12                                                                          #6 0.730462
      Read Local Version Information (0x04|0x0001) ncmd 1
        Status: Success (0x00)
        HCI version: Reserved (0x0e) - Revision 12520 (0x30e8)
        LMP version: Reserved (0x0e) - Subversion 12520 (0x30e8)
        Manufacturer: Nordic Semiconductor ASA (89)
zephyr.exe[1955716]: < HCI Command: Read Local Supported Commands (0x04|0x0002) plen 0                                #7 0.749603
> HCI Event: Command Complete (0x0e) plen 68                                                                          #8 0.751125
      Read Local Supported Commands (0x04|0x0002) ncmd 1
        Status: Success (0x00)
        Commands: 119 entries
          Disconnect (Octet 0 - Bit 5)
          Read Remote Version Information (Octet 2 - Bit 7)
          Set Event Mask (Octet 5 - Bit 6)
          Reset (Octet 5 - Bit 7)
          Read Connection Accept Timeout (Octet 7 - Bit 2)
          Write Connection Accept Timeout (Octet 7 - Bit 3)
          Read Transmit Power Level (Octet 10 - Bit 2)
          Set Controller To Host Flow Control (Octet 10 - Bit 5)
          Host Buffer Size (Octet 10 - Bit 6)
          Host Number of Completed Packets (Octet 10 - Bit 7)
          Read Local Version Information (Octet 14 - Bit 3)
          Read Local Supported Features (Octet 14 - Bit 5)
          Read BD ADDR (Octet 15 - Bit 1)
          Read RSSI (Octet 15 - Bit 5)
          Set Event Mask Page 2 (Octet 22 - Bit 2)
          LE Set Event Mask (Octet 25 - Bit 0)
          LE Read Buffer Size (Octet 25 - Bit 1)
          LE Read Local Supported Features (Octet 25 - Bit 2)
          LE Set Random Address (Octet 25 - Bit 4)
          LE Set Advertising Parameters (Octet 25 - Bit 5)
          LE Read Advertising Channel TX Power (Octet 25 - Bit 6)
          LE Set Advertising Data (Octet 25 - Bit 7)
          LE Set Scan Response Data (Octet 26 - Bit 0)
          LE Set Advertise Enable (Octet 26 - Bit 1)
          LE Set Scan Parameters (Octet 26 - Bit 2)
          LE Set Scan Enable (Octet 26 - Bit 3)
          LE Create Connection (Octet 26 - Bit 4)
          LE Create Connection Cancel (Octet 26 - Bit 5)
          LE Read Accept List Size (Octet 26 - Bit 6)
          LE Clear Accept List (Octet 26 - Bit 7)
          LE Add Device To Accept List (Octet 27 - Bit 0)
          LE Remove Device From Accept List (Octet 27 - Bit 1)
          LE Connection Update (Octet 27 - Bit 2)
          LE Set Host Channel Classification (Octet 27 - Bit 3)
          LE Read Channel Map (Octet 27 - Bit 4)
          LE Read Remote Used Features (Octet 27 - Bit 5)
          LE Encrypt (Octet 27 - Bit 6)
          LE Rand (Octet 27 - Bit 7)
          LE Start Encryption (Octet 28 - Bit 0)
          LE Long Term Key Request Reply (Octet 28 - Bit 1)
          LE Long Term Key Request Neg Reply (Octet 28 - Bit 2)
          LE Read Supported States (Octet 28 - Bit 3)
          LE Receiver Test (Octet 28 - Bit 4)
          LE Transmitter Test (Octet 28 - Bit 5)
          LE Test End (Octet 28 - Bit 6)
          Read Authenticated Payload Timeout (Octet 32 - Bit 4)
          Write Authenticated Payload Timeout (Octet 32 - Bit 5)
          LE Set Data Length (Octet 33 - Bit 6)
          LE Read Suggested Default Data Length (Octet 33 - Bit 7)
          LE Write Suggested Default Data Length (Octet 34 - Bit 0)
          LE Add Device To Resolving List (Octet 34 - Bit 3)
          LE Remove Device From Resolving List (Octet 34 - Bit 4)
          LE Clear Resolving List (Octet 34 - Bit 5)
          LE Read Resolving List Size (Octet 34 - Bit 6)
          LE Set Address Resolution Enable (Octet 35 - Bit 1)
          LE Set Resolvable Private Address Timeout (Octet 35 - Bit 2)
          LE Read Maximum Data Length (Octet 35 - Bit 3)
          LE Read PHY (Octet 35 - Bit 4)
          LE Set Default PHY (Octet 35 - Bit 5)
          LE Set PHY (Octet 35 - Bit 6)
          LE Enhanced Receiver Test (Octet 35 - Bit 7)
          LE Enhanced Transmitter Test (Octet 36 - Bit 0)
          LE Set Advertising Set Random Address (Octet 36 - Bit 1)
          LE Set Extended Advertising Parameters (Octet 36 - Bit 2)
          LE Set Extended Advertising Data (Octet 36 - Bit 3)
          LE Set Extended Scan Response Data (Octet 36 - Bit 4)
          LE Set Extended Advertising Enable (Octet 36 - Bit 5)
          LE Read Maximum Advertising Data Length (Octet 36 - Bit 6)
          LE Read Number of Supported Advertising Sets (Octet 36 - Bit 7)
          LE Remove Advertising Set (Octet 37 - Bit 0)
          LE Clear Advertising Sets (Octet 37 - Bit 1)
          LE Set Periodic Advertising Parameters (Octet 37 - Bit 2)
          LE Set Periodic Advertising Data (Octet 37 - Bit 3)
          LE Set Periodic Advertising Enable (Octet 37 - Bit 4)
          LE Set Extended Scan Parameters (Octet 37 - Bit 5)
          LE Set Extended Scan Enable (Octet 37 - Bit 6)
          LE Extended Create Connection (Octet 37 - Bit 7)
          LE Periodic Advertising Create Sync (Octet 38 - Bit 0)
          LE Periodic Advertising Create Sync Cancel (Octet 38 - Bit 1)
          LE Periodic Advertising Terminate Sync (Octet 38 - Bit 2)
          LE Add Device To Periodic Advertiser List (Octet 38 - Bit 3)
          LE Remove Device From Periodic Advertiser List (Octet 38 - Bit 4)
          LE Clear Periodic Advertiser List (Octet 38 - Bit 5)
          LE Read Periodic Advertiser List Size (Octet 38 - Bit 6)
          LE Read Transmit Power (Octet 38 - Bit 7)
          LE Read RF Path Compensation (Octet 39 - Bit 0)
          LE Write RF Path Compensation (Octet 39 - Bit 1)
          LE Set Privacy Mode (Octet 39 - Bit 2)
          LE Periodic Advertising Receive Enable (Octet 40 - Bit 5)
          LE Periodic Advertising Sync Transfer (Octet 40 - Bit 6)
          LE Periodic Advertising Set Info Transfer (Octet 40 - Bit 7)
          LE Periodic Advertising Sync Transfer Parameters (Octet 41 - Bit 0)
          LE Set Default Periodic Advertisng Sync Transfer Parameters (Octet 41 - Bit 1)
          LE Read Buffer v2 (Octet 41 - Bit 5)
          LE Read ISO TX Sync (Octet 41 - Bit 6)
          LE Set Connected Isochronous Group Parameters (Octet 41 - Bit 7)
          LE Set Connected Isochronous Group Parameters Test (Octet 42 - Bit 0)
          LE Create Connected Isochronous Stream (Octet 42 - Bit 1)
          LE Remove Connected Isochronous Group (Octet 42 - Bit 2)
          LE Accept Connected Isochronous Stream Request (Octet 42 - Bit 3)
          LE Reject Connected Isochronous Stream Request (Octet 42 - Bit 4)
          LE Create Broadcast Isochronous Group (Octet 42 - Bit 5)
          LE Create Broadcast Isochronous Group Test (Octet 42 - Bit 6)
          LE Terminate Broadcast Isochronous Group (Octet 42 - Bit 7)
          LE Broadcast Isochronous Group Create Sync (Octet 43 - Bit 0)
          LE Broadcast Isochronous Group Terminate Sync (Octet 43 - Bit 1)
          LE Request Peer SCA (Octet 43 - Bit 2)
          LE Setup Isochronous Data Path (Octet 43 - Bit 3)
          LE Remove Isochronous Data Path (Octet 43 - Bit 4)
          LE Isochronous Transmit Test (Octet 43 - Bit 5)
          LE Isochronous Receive Test (Octet 43 - Bit 6)
          LE Isochronous Read Test Counters (Octet 43 - Bit 7)
          LE Isochronous Read Test Counters (Octet 44 - Bit 0)
          LE Set Host Feature (Octet 44 - Bit 1)
          LE Read ISO link quality (Octet 44 - Bit 2)
          Octet 45 - Bit 6 
          Octet 46 - Bit 0 
          Octet 46 - Bit 1 
          Octet 46 - Bit 2 
zephyr.exe[1955716]: < HCI Command: Host Buffer Size (0x03|0x0033) plen 7                                             #9 0.769599
        ACL MTU: 255  ACL max packet: 16
        SCO MTU: 0    SCO max packet: 0
> HCI Event: Command Complete (0x0e) plen 4                                                                          #10 0.770543
      Host Buffer Size (0x03|0x0033) ncmd 1
        Status: Success (0x00)
zephyr.exe[1955716]: < HCI Command: Set Controller To Host Flow Control (0x03|0x0031) plen 1                         #11 0.789604
        Flow control: ACL Data Packets (0x01)
> HCI Event: Command Complete (0x0e) plen 4                                                                          #12 0.790669
      Set Controller To Host Flow Control (0x03|0x0031) ncmd 1
        Status: Success (0x00)
zephyr.exe[1955716]: < HCI Command: LE Read Local Supported Features (0x08|0x0003) plen 0                            #13 0.809603
> HCI Event: Command Complete (0x0e) plen 12                                                                         #14 0.810953
      LE Read Local Supported Features (0x08|0x0003) ncmd 1
        Status: Success (0x00)
        Features: 0xfd 0x79 0x00 0xf7 0x30 0x01 0x00 0x00
          LE Encryption
          Extended Reject Indication
          Peripheral-initiated Features Exchange
          LE Ping
          LE Data Packet Length Extension
          LL Privacy
          Extended Scanner Filter Policies
          LE 2M PHY
          LE Coded PHY
          LE Extended Advertising
          LE Periodic Advertising
          Channel Selection Algorithm #2
          Periodic Advertising Sync Transfer - Sender
          Periodic Advertising Sync Transfer - Recipient
          Sleep Clock Accuracy Updates
          Connected Isochronous Stream - Central
          Connected Isochronous Stream - Peripheral
          Isochronous Broadcaster
          Synchronized Receiver
          Periodic Advertising ADI support
          Connection Subrating
          Unknown features (0x0000010000000000)
zephyr.exe[1955716]: < HCI Command: LE Set Host Feature (0x08|0x0074) plen 2                                         #15 0.829604
        Bit Number: 32
          Connected Isochronous Stream (Host Support)
        Bit Value: 1
> HCI Event: Command Complete (0x0e) plen 4                                                                          #16 0.830753
      LE Set Host Feature (0x08|0x0074) ncmd 1
        Status: Success (0x00)
zephyr.exe[1955716]: < HCI Command: LE Read Buffer v2 (0x08|0x0060) plen 0                                           #17 0.849603
> HCI Event: Command Complete (0x0e) plen 10                                                                         #18 0.850646
      LE Read Buffer v2 (0x08|0x0060) ncmd 1
        Status: Success (0x00)
        ACL MTU: 27
        ACL max packet: 3
        ISO MTU: 318
        ISO max packet: 3
zephyr.exe[1955716]: < HCI Command: LE Read Maximum Advertising Data Length (0x08|0x003a) plen 0                     #19 0.869622
> HCI Event: Command Complete (0x0e) plen 6                                                                          #20 0.870555
      LE Read Maximum Advertising Data Length (0x08|0x003a) ncmd 1
        Status: Success (0x00)
        Max length: 1650
zephyr.exe[1955716]: < HCI Command: LE Read Supported States (0x08|0x001c) plen 0                                    #21 0.889607
> HCI Event: Command Complete (0x0e) plen 12                                                                         #22 0.890276
      LE Read Supported States (0x08|0x001c) ncmd 1
        Status: Success (0x00)
        States: 0x000003ff3e0306ff
          Non-connectable Advertising State
          Scannable Advertising State
          Connectable Advertising State
          High Duty Cycle Directed Advertising State
          Passive Scanning State
          Active Scanning State
          Initiating State
            and Connection State (Central Role)
          Connection State (Peripheral Role)
          Scannable Advertising State
            and Passive Scanning State
          Connectable Advertising State
            and Passive Scanning State
          Non-connectable Advertising State
            and Initiating State
          Scannable Advertising State
            and Initiating State
          Active Scanning State
            and Connection State (Central Role)
          Passive Scanning State
            and Connection State (Peripheral Role)
          Active Scanning State
            and Connection State (Peripheral Role)
          Initiating State
            and Connection State (Central Role)
            and Central Role & Central Role
          Low Duty Cycle Directed Advertising State
          Connectable Advertising State
            and Initiating State
            and Central Role & Peripheral Role
          High Duty Cycle Directed Advertising State
            and Initiating State
            and Central Role & Peripheral Role
          Low Duty Cycle Directed Advertising State
            and Initiating State
            and Central Role & Peripheral Role
          Connectable Advertising State
            and Connection State (Central Role)
            and Central Role & Peripheral Role
          High Duty Cycle Directed Advertising State
            and Connection State (Central Role)
            and Central Role & Peripheral Role
          Low Duty Cycle Directed Advertising State
            and Connection State (Central Role)
            and Central Role & Peripheral Role
          Connectable Advertising State
            and Connection State (Peripheral Role)
            and Central Role & Peripheral Role
          High Duty Cycle Directed Advertising State
            and Connection State (Peripheral Role)
            and Peripheral Role & Peripheral Role
          Low Duty Cycle Directed Advertising State
            and Connection State (Peripheral Role)
            and Peripheral Role & Peripheral Role
          Initiating State
            and Connection State (Peripheral Role)
            and Central Role & Peripheral Role
zephyr.exe[1955716]: < HCI Command: LE Read Maximum Data Length (0x08|0x002f) plen 0                                 #23 0.909602
> HCI Event: Command Complete (0x0e) plen 12                                                                         #24 0.910247
      LE Read Maximum Data Length (0x08|0x002f) ncmd 1
        Status: Success (0x00)
        Max TX octets: 251
        Max TX time: 2704
        Max RX octets: 251
        Max RX time: 2704
zephyr.exe[1955716]: < HCI Command: LE Write Suggested Default Data Length (0x08|0x0024) plen 4                      #25 0.929602
        TX octets: 251
        TX time: 2704
> HCI Event: Command Complete (0x0e) plen 4                                                                          #26 0.930161
      LE Write Suggested Default Data Length (0x08|0x0024) ncmd 1
        Status: Success (0x00)
zephyr.exe[1955716]: < HCI Command: LE Set Resolvable Private Address Timeout (0x08|0x002e) plen 2                   #27 0.949604
        Timeout: 30 seconds
> HCI Event: Command Complete (0x0e) plen 4                                                                          #28 0.950206
      LE Set Resolvable Private Address Timeout (0x08|0x002e) ncmd 1
        Status: Success (0x00)
zephyr.exe[1955716]: < HCI Command: LE Read Resolving List Size (0x08|0x002a) plen 0                                 #29 0.969606
> HCI Event: Command Complete (0x0e) plen 5                                                                          #30 0.970195
      LE Read Resolving List Size (0x08|0x002a) ncmd 1
        Status: Success (0x00)
        Size: 8
zephyr.exe[1955716]: < HCI Command: LE Set Event Mask (0x08|0x0001) plen 8                                           #31 0.989602
        Mask: 0x000002023f87fa5e
          LE Advertising Report
          LE Connection Update Complete
          LE Read Remote Used Features Complete
          LE Long Term Key Request
          LE Data Length Change
          LE Enhanced Connection Complete
          LE PHY Update Complete
          LE Extended Advertising Report
          LE Periodic Advertising Sync Established
          LE Periodic Advertising Report
          LE Periodic Advertising Sync Lost
          LE Extended Scan Timeout
          LE Extended Advertising Set Terminated
          LE Scan Request Received
          LE Periodic Advertising Sync Transfer Rvc
          LE CIS Established
          LE CIS Request
          LE Create BIG Complete
          LE Terminate BIG Complete
          LE BIG Sync Established Complete
          LE BIG Sync Lost
          LE BIG Info Advertising Report
          Unknown mask (0x0000020000000000)
> HCI Event: Command Complete (0x0e) plen 4                                                                          #32 0.990207
      LE Set Event Mask (0x08|0x0001) ncmd 1
        Status: Success (0x00)
zephyr.exe[1955716]: < HCI Command: Set Event Mask (0x03|0x0001) plen 8                                              #33 1.009612
        Mask: 0x2000800002008890
          Disconnection Complete
          Encryption Change
          Read Remote Version Information Complete
          Hardware Error
          Data Buffer Overflow
          Encryption Key Refresh Complete
          LE Meta
> HCI Event: Command Complete (0x0e) plen 4                                                                          #34 1.010968
      Set Event Mask (0x03|0x0001) ncmd 1
        Status: Success (0x00)
zephyr.exe[1955716]: < HCI Command: Read BD ADDR (0x04|0x0009) plen 0                                                #35 1.029603
> HCI Event: Command Complete (0x0e) plen 10                                                                         #36 1.030498
      Read BD ADDR (0x04|0x0009) ncmd 1
        Status: Success (0x00)
        Address: 00:00:00:00:00:00 (OUI 00-00-00)
zephyr.exe[1955716]: < HCI Command: LE Set Random Address (0x08|0x0005) plen 6                                       #37 1.049612
        Address: D5:B6:CC:31:DB:3B (Static)
> HCI Event: Command Complete (0x0e) plen 4                                                                          #38 1.050331
      LE Set Random Address (0x08|0x0005) ncmd 1
        Status: Success (0x00)
zephyr.exe[1955716]: < HCI Command: LE Set Random Address (0x08|0x0005) plen 6                                       #39 1.129632
        Address: 48:61:8E:DB:C6:F9 (Resolvable)
> HCI Event: Command Complete (0x0e) plen 4                                                                          #40 1.131632
      LE Set Random Address (0x08|0x0005) ncmd 1
        Status: Success (0x00)
zephyr.exe[1955716]: < HCI Command: LE Extended Create Connection (0x08|0x0043) plen 26                              #41 5.069691
        Filter policy: Accept list is not used (0x00)
        Own address type: Random (0x03)
        Peer address type: Random (0x01)
        Peer address: 6D:6A:5A:B9:17:E1 (Resolvable)
        Initiating PHYs: 0x01
        Entry 0: LE 1M
          Scan interval: 60.000 msec (0x0060)
          Scan window: 60.000 msec (0x0060)
          Min connection interval: 30.00 msec (0x0018)
          Max connection interval: 50.00 msec (0x0028)
          Connection latency: 0 (0x0000)
          Supervision timeout: 4000 msec (0x0190)
          Min connection length: 0.000 msec (0x0000)
          Max connection length: 0.000 msec (0x0000)
> HCI Event: Command Status (0x0f) plen 4                                                                            #42 5.115581
      LE Extended Create Connection (0x08|0x0043) ncmd 1
        Status: Success (0x00)
> HCI Event: LE Meta Event (0x3e) plen 31                                                                            #43 5.211425
      LE Enhanced Connection Complete (0x0a)
        Status: Success (0x00)
        Handle: 936
        Role: Central (0x00)
        Peer address type: Random (0x01)
        Peer address: 6D:6A:5A:B9:17:E1 (Resolvable)
        Local resolvable private address: 48:61:8E:DB:C6:F9 (Resolvable)
        Peer resolvable private address: 00:00:00:00:00:00 (Non-Resolvable)
        Connection interval: 50.00 msec (0x0028)
        Connection latency: 0 (0x0000)
        Supervision timeout: 4000 msec (0x0190)
        Central clock accuracy: 0x00
zephyr.exe[1955716]: < HCI Command: LE Read Remote Used Features (0x08|0x0016) plen 2                                #44 5.254063
        Handle: 936 Address: 6D:6A:5A:B9:17:E1 (Resolvable)
> HCI Event: Command Status (0x0f) plen 4                                                                            #45 5.255282
      LE Read Remote Used Features (0x08|0x0016) ncmd 1
        Status: Success (0x00)
zephyr.exe[1955716]: < HCI Command: LE Set PHY (0x08|0x0032) plen 7                                                  #46 5.273086
        Handle: 936 Address: 6D:6A:5A:B9:17:E1 (Resolvable)
        All PHYs preference: 0x00
        TX PHYs preference: 0x02
          LE 2M
        RX PHYs preference: 0x02
          LE 2M
        PHY options preference: Reserved (0x0000)
> HCI Event: Command Status (0x0f) plen 4                                                                            #47 5.278083
      LE Set PHY (0x08|0x0032) ncmd 1
        Status: Success (0x00)
> HCI Event: LE Meta Event (0x3e) plen 12                                                                            #48 5.362883
      LE Read Remote Used Features (0x04)
        Status: Success (0x00)
        Handle: 936 Address: 6D:6A:5A:B9:17:E1 (Resolvable)
        Features: 0x2d 0x49 0x01 0xf7 0xef 0x39 0x00 0x80
          LE Encryption
          Extended Reject Indication
          Peripheral-initiated Features Exchange
          LE Data Packet Length Extension
          LE 2M PHY
          LE Coded PHY
          Channel Selection Algorithm #2
          Minimum Number of Used Channels Procedure
          Periodic Advertising Sync Transfer - Sender
          Periodic Advertising Sync Transfer - Recipient
          Sleep Clock Accuracy Updates
          Connected Isochronous Stream - Central
          Connected Isochronous Stream - Peripheral
          Isochronous Broadcaster
          Synchronized Receiver
          Connected Isochronous Stream (Host Support)
          LE Power Control Request
          LE Power Control Request
          LE Path Loss Monitoring
          Connection Subrating
          Connection Subrating (Host Support)
          Channel Classification
          Unknown features (0x8000390000000000)
> HCI Event: LE Meta Event (0x3e) plen 6                                                                             #49 5.812175
      LE PHY Update Complete (0x0c)
        Status: Success (0x00)
        Handle: 936 Address: 6D:6A:5A:B9:17:E1 (Resolvable)
        TX PHY: LE 2M (0x02)
        RX PHY: LE 2M (0x02)
zephyr.exe[1955716]: < ACL Data TX: Handle 936 [1/3] flags 0x00 dlen 11                                              #50 6.279703
      SMP: Pairing Request (0x01) len 6
        IO capability: KeyboardDisplay (0x04)
        OOB data: Authentication data not present (0x00)
        Authentication requirement: Bonding, No MITM, SC, No Keypresses (0x09)
        Max encryption key size: 16
        Initiator key distribution: EncKey IdKey Sign (0x07)
        Responder key distribution: EncKey IdKey Sign (0x07)
> HCI Event: Number of Completed Packets (0x13) plen 5                                                               #51 6.312662
        Num handles: 1
        Handle: 936 Address: 6D:6A:5A:B9:17:E1 (Resolvable)
        Count: 1
        Buffers: 0/3
        #50: len 11 (2 Kb/s)
        Latency: 32 msec (32-32 msec ~32 msec)
> ACL Data RX: Handle 936 flags 0x02 dlen 11                                                                         #52 6.362778
      SMP: Pairing Response (0x02) len 6
        IO capability: KeyboardDisplay (0x04)
        OOB data: Authentication data not present (0x00)
        Authentication requirement: Bonding, No MITM, SC, No Keypresses (0x09)
        Max encryption key size: 16
        Initiator key distribution: EncKey IdKey Sign (0x07)
        Responder key distribution: EncKey IdKey Sign (0x07)
zephyr.exe[1955716]: < HCI Command: Host Number of Completed Packets (0x03|0x0035) plen 5                            #53 6.369810
        Num handles: 1
        Handle: 936 Address: 6D:6A:5A:B9:17:E1 (Resolvable)
        Count: 1
zephyr.exe[1955716]: < ACL Data TX: Handle 936 [1/3] flags 0x00 dlen 27                                              #54 6.370266
zephyr.exe[1955716]: < ACL Data TX: Handle 936 flags 0x01 dlen 27                                                    #55 6.370554
zephyr.exe[1955716]: < ACL Data TX: Handle 936 flags 0x01 dlen 15                                                    #56 6.370901
      SMP: Pairing Public Key (0x0c) len 64
        X[32]: 68f6ada634ce84d11617383d57f070fe3445c38b33b569efa5eb771a0dc8aea5
        Y[32]: 83c407aaa8337331fdc418e55085d75e6c1c6e5d42f8bf9c18fb5a2a7d4f31aa
> HCI Event: Number of Completed Packets (0x13) plen 5                                                               #57 6.412631
        Num handles: 1
        Handle: 936 Address: 6D:6A:5A:B9:17:E1 (Resolvable)
        Count: 1
        Buffers: 0/3
        #54: len 27 (5 Kb/s)
        Latency: 42 msec (32-42 msec ~37 msec)
> HCI Event: Number of Completed Packets (0x13) plen 5                                                               #58 6.413146
        Num handles: 1
        Handle: 936 Address: 6D:6A:5A:B9:17:E1 (Resolvable)
        Count: 1
        Buffers: underflow/3
        #55: len 27 (5 Kb/s)
        Latency: 42 msec (32-42 msec ~40 msec)
> HCI Event: Number of Completed Packets (0x13) plen 5                                                               #59 6.413610
        Num handles: 1
        Handle: 936 Address: 6D:6A:5A:B9:17:E1 (Resolvable)
        Count: 1
        Buffers: underflow/3
        #56: len 15 (2 Kb/s)
        Latency: 42 msec (32-42 msec ~41 msec)
> ACL Data RX: Handle 936 flags 0x02 dlen 27                                                                         #60 6.463037
> ACL Data RX: Handle 936 flags 0x01 dlen 27                                                                         #61 6.463399
> ACL Data RX: Handle 936 flags 0x01 dlen 15                                                                         #62 6.463660
      SMP: Pairing Public Key (0x0c) len 64
        X[32]: 4fbceaf8a72f7de79a6ad68f199cdbc3c937108e5cc54eefc37d16fc1d341636
        Y[32]: 04c9f8df8eeb2883a3aa40e39ab4708a22863e11b393c03a08a33f363fdf7c10
zephyr.exe[1955716]: < HCI Command: Host Number of Completed Packets (0x03|0x0035) plen 5                            #63 6.469807
        Num handles: 1
        Handle: 936 Address: 6D:6A:5A:B9:17:E1 (Resolvable)
        Count: 1
zephyr.exe[1955716]: < HCI Command: Host Number of Completed Packets (0x03|0x0035) plen 5                            #64 6.470393
        Num handles: 1
        Handle: 936 Address: 6D:6A:5A:B9:17:E1 (Resolvable)
        Count: 1
zephyr.exe[1955716]: < HCI Command: Host Number of Completed Packets (0x03|0x0035) plen 5                            #65 6.470798
        Num handles: 1
        Handle: 936 Address: 6D:6A:5A:B9:17:E1 (Resolvable)
        Count: 1
> ACL Data RX: Handle 936 flags 0x02 dlen 21                                                                         #66 6.471470
      SMP: Pairing Confirm (0x03) len 16
        Confirm value[16]: 61e1828647e489e0e320240d4b940983
zephyr.exe[1955716]: < HCI Command: Host Number of Completed Packets (0x03|0x0035) plen 5                            #67 6.489796
        Num handles: 1
        Handle: 936 Address: 6D:6A:5A:B9:17:E1 (Resolvable)
        Count: 1
zephyr.exe[1955716]: < ACL Data TX: Handle 936 [1/3] flags 0x00 dlen 21                                              #68 6.490250
      SMP: Pairing Random (0x04) len 16
        Random value[16]: 555cc64d02679f89a05211af56d8b3da
> HCI Event: Number of Completed Packets (0x13) plen 5                                                               #69 6.512695
        Num handles: 1
        Handle: 936 Address: 6D:6A:5A:B9:17:E1 (Resolvable)
        Count: 1
        Buffers: 0/3
        #68: len 21 (7 Kb/s)
        Latency: 22 msec (22-42 msec ~31 msec)
> ACL Data RX: Handle 936 flags 0x02 dlen 21                                                                         #70 6.562840
      SMP: Pairing Random (0x04) len 16
        Random value[16]: ed51a2f3f1d5d1630000000000000000
zephyr.exe[1955716]: < HCI Command: Host Number of Completed Packets (0x03|0x0035) plen 5                            #71 6.569786
        Num handles: 1
        Handle: 936 Address: 6D:6A:5A:B9:17:E1 (Resolvable)
        Count: 1
zephyr.exe[1955716]: < ACL Data TX: Handle 936 [1/3] flags 0x00 dlen 21                                              #72 6.570210
      SMP: Pairing DHKey Check (0x0d) len 16
        E[16]: b6778cade924fd169629ab6bdf6695f2
> HCI Event: Number of Completed Packets (0x13) plen 5                                                               #73 6.612642
        Num handles: 1
        Handle: 936 Address: 6D:6A:5A:B9:17:E1 (Resolvable)
        Count: 1
        Buffers: 0/3
        #72: len 21 (4 Kb/s)
        Latency: 42 msec (22-42 msec ~37 msec)
> ACL Data RX: Handle 936 flags 0x02 dlen 21                                                                         #74 6.712846
      SMP: Pairing DHKey Check (0x0d) len 16
        E[16]: 7e957925751445fc352e67a32d91af68
zephyr.exe[1955716]: < HCI Command: LE Start Encryption (0x08|0x0019) plen 28                                        #75 6.729768
        Handle: 936 Address: 6D:6A:5A:B9:17:E1 (Resolvable)
        Random number: 0x0000000000000000
        Encrypted diversifier: 0x0000
        Long term key[16]: 68233554053fd90ee5ea53dfa808a83f
> HCI Event: Command Status (0x0f) plen 4                                                                            #76 6.731137
      LE Start Encryption (0x08|0x0019) ncmd 1
        Status: Success (0x00)
zephyr.exe[1955716]: < HCI Command: Host Number of Completed Packets (0x03|0x0035) plen 5                            #77 6.749664
        Num handles: 1
        Handle: 936 Address: 6D:6A:5A:B9:17:E1 (Resolvable)
        Count: 1
> HCI Event: Encryption Change (0x08) plen 4                                                                         #78 7.012591
        Status: Success (0x00)
        Handle: 936 Address: 6D:6A:5A:B9:17:E1 (Resolvable)
        Encryption: Enabled with AES-CCM (0x01)
> ACL Data RX: Handle 936 flags 0x02 dlen 21                                                                         #79 7.062871
      SMP: Identity Information (0x08) len 16
        Identity resolving key[16]: 8651ba04336332ad3cac64b55a6a24ce
zephyr.exe[1955716]: < HCI Command: Host Number of Completed Packets (0x03|0x0035) plen 5                            #80 7.069746
        Num handles: 1
        Handle: 936 Address: 6D:6A:5A:B9:17:E1 (Resolvable)
          Identity type: Public (0x00)
          Identity: 00:00:00:00:00:00 (OUI 00-00-00)
        Count: 1
> ACL Data RX: Handle 936 flags 0x02 dlen 12                                                                         #81 7.112645
      SMP: Identity Address Information (0x09) len 7
        Address: C0:07:E8:2C:B6:EE (OUI C0-07-E8)
> ACL Data RX: Handle 936 flags 0x02 dlen 21                                                                         #82 7.113653
      SMP: Signing Information (0x0a) len 16
        Signature key[16]: 045b1f29ffcedbf3e0ab03806bb912ee
zephyr.exe[1955716]: < HCI Command: LE Add Device To Resolving List (0x08|0x0027) plen 39                            #83 7.129838
        Address type: Public (0x00)
        Address: C0:07:E8:2C:B6:EE (OUI C0-07-E8)
        Peer identity resolving key[16]: 8651ba04336332ad3cac64b55a6a24ce
        Local identity resolving key[16]: 08aad2e1be87e47b88aeb19de6889efb
> HCI Event: Command Complete (0x0e) plen 4                                                                          #84 7.131990
      LE Add Device To Resolving List (0x08|0x0027) ncmd 1
        Status: Success (0x00)
zephyr.exe[1955716]: < HCI Command: LE Set Privacy Mode (0x08|0x004e) plen 8                                         #85 7.149661
        Peer Identity address type: Public (0x00)
        Peer Identity address: C0:07:E8:2C:B6:EE (OUI C0-07-E8)
        Privacy Mode: Use Device Privacy (0x01)
> HCI Event: Command Complete (0x0e) plen 4                                                                          #86 7.151130
      LE Set Privacy Mode (0x08|0x004e) ncmd 1
        Status: Success (0x00)
zephyr.exe[1955716]: < HCI Command: LE Set Address Resolution Enable (0x08|0x002d) plen 1                            #87 7.169749
        Address resolution: Enabled (0x01)
> HCI Event: Command Complete (0x0e) plen 4                                                                          #88 7.170400
      LE Set Address Resolution Enable (0x08|0x002d) ncmd 1
        Status: Success (0x00)
zephyr.exe[1955716]: < HCI Command: Host Number of Completed Packets (0x03|0x0035) plen 5                            #89 7.189644
        Num handles: 1
        Handle: 936 Address: 6D:6A:5A:B9:17:E1 (Resolvable)
          Identity type: Public (0x00)
          Identity: C0:07:E8:2C:B6:EE (OUI C0-07-E8)
        Count: 1
zephyr.exe[1955716]: < HCI Command: Host Number of Completed Packets (0x03|0x0035) plen 5                            #90 7.190161
        Num handles: 1
        Handle: 936 Address: 6D:6A:5A:B9:17:E1 (Resolvable)
          Identity type: Public (0x00)
          Identity: C0:07:E8:2C:B6:EE (OUI C0-07-E8)
        Count: 1
zephyr.exe[1955716]: < ACL Data TX: Handle 936 [1/3] flags 0x00 dlen 21                                              #91 7.190281
      SMP: Identity Information (0x08) len 16
        Identity resolving key[16]: 08aad2e1be87e47b88aeb19de6889efb
zephyr.exe[1955716]: < ACL Data TX: Handle 936 [2/3] flags 0x00 dlen 12                                              #92 7.190305
      SMP: Identity Address Information (0x09) len 7
        Address: D5:B6:CC:31:DB:3B (Static)
zephyr.exe[1955716]: < ACL Data TX: Handle 936 [3/3] flags 0x00 dlen 21                                              #93 7.190321
      SMP: Signing Information (0x0a) len 16
        Signature key[16]: 1ec8845e8286bc235a02440d0c3424a2
> HCI Event: Number of Completed Packets (0x13) plen 5                                                               #94 7.212608
        Num handles: 1
        Handle: 936 Address: 6D:6A:5A:B9:17:E1 (Resolvable)
          Identity type: Public (0x00)
          Identity: C0:07:E8:2C:B6:EE (OUI C0-07-E8)
        Count: 1
        Buffers: 2/3
        #91: len 21 (7 Kb/s)
        Latency: 22 msec (22-42 msec ~29 msec)
> HCI Event: Number of Completed Packets (0x13) plen 5                                                               #95 7.213248
        Num handles: 1
        Handle: 936 Address: 6D:6A:5A:B9:17:E1 (Resolvable)
          Identity type: Public (0x00)
          Identity: C0:07:E8:2C:B6:EE (OUI C0-07-E8)
        Count: 1
        Buffers: 1/3
        #92: len 12 (4 Kb/s)
        Latency: 22 msec (22-42 msec ~26 msec)
> HCI Event: Number of Completed Packets (0x13) plen 5                                                               #96 7.214125
        Num handles: 1
        Handle: 936 Address: 6D:6A:5A:B9:17:E1 (Resolvable)
          Identity type: Public (0x00)
          Identity: C0:07:E8:2C:B6:EE (OUI C0-07-E8)
        Count: 1
        Buffers: 0/3
        #93: len 21 (7 Kb/s)
        Latency: 23 msec (22-42 msec ~25 msec)
zephyr.exe[1955716]: < ACL Data TX: Handle 936 [1/3] flags 0x00 dlen 11                                              #97 7.229662
      ATT: Read By Type Request (0x08) len 6
        Handle range: 0x0001-0xffff
        Attribute type: Central Address Resolution (0x2aa6)
> HCI Event: Number of Completed Packets (0x13) plen 5                                                               #98 7.262603
        Num handles: 1
        Handle: 936 Address: 6D:6A:5A:B9:17:E1 (Resolvable)
          Identity type: Public (0x00)
          Identity: C0:07:E8:2C:B6:EE (OUI C0-07-E8)
        Count: 1
        Buffers: 0/3
        #97: len 11 (2 Kb/s)
        Latency: 32 msec (22-42 msec ~29 msec)
> ACL Data RX: Handle 936 flags 0x02 dlen 9                                                                          #99 7.312704
      ATT: Read By Type Response (0x09) len 4
        Attribute data length: 3
        Attribute data list: 1 entry
        Handle: 0x000f
        Value[1]: 01
zephyr.exe[1955716]: < HCI Command: Host Number of Completed Packets (0x03|0x0035) plen 5                           #100 7.329815
        Num handles: 1
        Handle: 936 Address: 6D:6A:5A:B9:17:E1 (Resolvable)
          Identity type: Public (0x00)
          Identity: C0:07:E8:2C:B6:EE (OUI C0-07-E8)
        Count: 1
> HCI Event: Disconnect Complete (0x05) plen 4                                                                      #101 9.312334
        Status: Success (0x00)
        Handle: 936 Address: 6D:6A:5A:B9:17:E1 (Resolvable)
          Identity type: Public (0x00)
          Identity: C0:07:E8:2C:B6:EE (OUI C0-07-E8)
        Reason: Remote User Terminated Connection (0x13)
zephyr.exe[1955716]: < HCI Command: LE Extended Create Connection (0x08|0x0043) plen 26                            #102 10.299708
        Filter policy: Accept list is not used (0x00)
        Own address type: Random (0x03)
        Peer address type: Public (0x00)
        Peer address: C0:07:E8:2C:B6:EE (OUI C0-07-E8)
        Initiating PHYs: 0x01
        Entry 0: LE 1M
          Scan interval: 60.000 msec (0x0060)
          Scan window: 60.000 msec (0x0060)
          Min connection interval: 30.00 msec (0x0018)
          Max connection interval: 50.00 msec (0x0028)
          Connection latency: 0 (0x0000)
          Supervision timeout: 4000 msec (0x0190)
          Min connection length: 0.000 msec (0x0000)
          Max connection length: 0.000 msec (0x0000)
> HCI Event: Command Status (0x0f) plen 4                                                                          #103 10.301837
      LE Extended Create Connection (0x08|0x0043) ncmd 1
        Status: Success (0x00)
> HCI Event: LE Meta Event (0x3e) plen 31                                                                          #104 10.402195
      LE Enhanced Connection Complete (0x0a)
        Status: Success (0x00)
        Handle: 954
        Role: Central (0x00)
        Peer address type: Resolved Public (0x02)
        Peer address: C0:07:E8:2C:B6:EE (OUI C0-07-E8)
        Local resolvable private address: 65:98:D8:65:96:59 (Resolvable)
          Identity type: Random (0x01)
          Identity: D5:B6:CC:31:DB:3B (Static)
        Peer resolvable private address: 40:9C:C0:91:95:C2 (Resolvable)
          Identity type: Public (0x00)
          Identity: C0:07:E8:2C:B6:EE (OUI C0-07-E8)
        Connection interval: 50.00 msec (0x0028)
        Connection latency: 0 (0x0000)
        Supervision timeout: 4000 msec (0x0190)
        Central clock accuracy: 0x00
zephyr.exe[1955716]: < HCI Command: LE Read Remote Used Features (0x08|0x0016) plen 2                              #105 10.432199
        Handle: 954 Address: C0:07:E8:2C:B6:EE (OUI C0-07-E8)
> HCI Event: Command Status (0x0f) plen 4           