Bluetooth monitor ver 5.72
btmon[123208]: = Note: Linux version 6.14.0-35-generic (x86_64)                                                          0.138262
btmon[123208]: = Note: Bluetooth subsystem version 2.22                                                                  0.138265
= New Index: 00:00:00:00:00:00 (Primary,UART,hci1)                                                                       0.138266
= New Index: 48:5F:99:8E:E0:64 (Primary,USB,hci0)                                                                        0.138267
= Open Index: 00:00:00:00:00:00                                                                                          0.152845
= Index Info: 00:00:00:00:00:00 (Nordic Semiconductor ASA)                                                               0.152850
zephyr.exe[123210]: @ USER Open: main (privileged) version 2.22                                                 {0x0001} 0.152853
zephyr.exe[123210]: < HCI Command: Reset (0x03|0x0003) plen 0                                                         #1 0.153238
> HCI Event: Command Complete (0x0e) plen 4                                                                           #2 0.153757
      Reset (0x03|0x0003) ncmd 1
        Status: Success (0x00)
zephyr.exe[123210]: < HCI Command: Read Local Supported Features (0x04|0x0003) plen 0                                 #3 0.172762
> HCI Event: Command Complete (0x0e) plen 12                                                                          #4 0.173287
      Read Local Supported Features (0x04|0x0003) ncmd 1
        Status: Success (0x00)
        Features: 0x00 0x00 0x00 0x00 0x60 0x00 0x00 0x00
          BR/EDR Not Supported
          LE Supported (Controller)
zephyr.exe[123210]: < HCI Command: Read Local Version Information (0x04|0x0001) plen 0                                #5 0.192707
> HCI Event: Command Complete (0x0e) plen 12                                                                          #6 0.193259
      Read Local Version Information (0x04|0x0001) ncmd 1
        Status: Success (0x00)
        HCI version: Reserved (0x0e) - Revision 12520 (0x30e8)
        LMP version: Reserved (0x0e) - Subversion 12520 (0x30e8)
        Manufacturer: Nordic Semiconductor ASA (89)
zephyr.exe[123210]: < HCI Command: Read Local Supported Commands (0x04|0x0002) plen 0                                 #7 0.212694
> HCI Event: Command Complete (0x0e) plen 68                                                                          #8 0.213798
      Read Local Supported Commands (0x04|0x0002) ncmd 1
        Status: Success (0x00)
        Commands: 119 entries
          Disconnect (Octet 0 - Bit 5)
          Read Remote Version Information (Octet 2 - Bit 7)
          Set Event Mask (Octet 5 - Bit 6)
          Reset (Octet 5 - Bit 7)
          Read Connection Accept Timeout (Octet 7 - Bit 2)
          Write Connection Accept Timeout (Octet 7 - Bit 3)
          Read Transmit Power Level (Octet 10 - Bit 2)
          Set Controller To Host Flow Control (Octet 10 - Bit 5)
          Host Buffer Size (Octet 10 - Bit 6)
          Host Number of Completed Packets (Octet 10 - Bit 7)
          Read Local Version Information (Octet 14 - Bit 3)
          Read Local Supported Features (Octet 14 - Bit 5)
          Read BD ADDR (Octet 15 - Bit 1)
          Read RSSI (Octet 15 - Bit 5)
          Set Event Mask Page 2 (Octet 22 - Bit 2)
          LE Set Event Mask (Octet 25 - Bit 0)
          LE Read Buffer Size (Octet 25 - Bit 1)
          LE Read Local Supported Features (Octet 25 - Bit 2)
          LE Set Random Address (Octet 25 - Bit 4)
          LE Set Advertising Parameters (Octet 25 - Bit 5)
          LE Read Advertising Channel TX Power (Octet 25 - Bit 6)
          LE Set Advertising Data (Octet 25 - Bit 7)
          LE Set Scan Response Data (Octet 26 - Bit 0)
          LE Set Advertise Enable (Octet 26 - Bit 1)
          LE Set Scan Parameters (Octet 26 - Bit 2)
          LE Set Scan Enable (Octet 26 - Bit 3)
          LE Create Connection (Octet 26 - Bit 4)
          LE Create Connection Cancel (Octet 26 - Bit 5)
          LE Read Accept List Size (Octet 26 - Bit 6)
          LE Clear Accept List (Octet 26 - Bit 7)
          LE Add Device To Accept List (Octet 27 - Bit 0)
          LE Remove Device From Accept List (Octet 27 - Bit 1)
          LE Connection Update (Octet 27 - Bit 2)
          LE Set Host Channel Classification (Octet 27 - Bit 3)
          LE Read Channel Map (Octet 27 - Bit 4)
          LE Read Remote Used Features (Octet 27 - Bit 5)
          LE Encrypt (Octet 27 - Bit 6)
          LE Rand (Octet 27 - Bit 7)
          LE Start Encryption (Octet 28 - Bit 0)
          LE Long Term Key Request Reply (Octet 28 - Bit 1)
          LE Long Term Key Request Neg Reply (Octet 28 - Bit 2)
          LE Read Supported States (Octet 28 - Bit 3)
          LE Receiver Test (Octet 28 - Bit 4)
          LE Transmitter Test (Octet 28 - Bit 5)
          LE Test End (Octet 28 - Bit 6)
          Read Authenticated Payload Timeout (Octet 32 - Bit 4)
          Write Authenticated Payload Timeout (Octet 32 - Bit 5)
          LE Set Data Length (Octet 33 - Bit 6)
          LE Read Suggested Default Data Length (Octet 33 - Bit 7)
          LE Write Suggested Default Data Length (Octet 34 - Bit 0)
          LE Add Device To Resolving List (Octet 34 - Bit 3)
          LE Remove Device From Resolving List (Octet 34 - Bit 4)
          LE Clear Resolving List (Octet 34 - Bit 5)
          LE Read Resolving List Size (Octet 34 - Bit 6)
          LE Set Address Resolution Enable (Octet 35 - Bit 1)
          LE Set Resolvable Private Address Timeout (Octet 35 - Bit 2)
          LE Read Maximum Data Length (Octet 35 - Bit 3)
          LE Read PHY (Octet 35 - Bit 4)
          LE Set Default PHY (Octet 35 - Bit 5)
          LE Set PHY (Octet 35 - Bit 6)
          LE Enhanced Receiver Test (Octet 35 - Bit 7)
          LE Enhanced Transmitter Test (Octet 36 - Bit 0)
          LE Set Advertising Set Random Address (Octet 36 - Bit 1)
          LE Set Extended Advertising Parameters (Octet 36 - Bit 2)
          LE Set Extended Advertising Data (Octet 36 - Bit 3)
          LE Set Extended Scan Response Data (Octet 36 - Bit 4)
          LE Set Extended Advertising Enable (Octet 36 - Bit 5)
          LE Read Maximum Advertising Data Length (Octet 36 - Bit 6)
          LE Read Number of Supported Advertising Sets (Octet 36 - Bit 7)
          LE Remove Advertising Set (Octet 37 - Bit 0)
          LE Clear Advertising Sets (Octet 37 - Bit 1)
          LE Set Periodic Advertising Parameters (Octet 37 - Bit 2)
          LE Set Periodic Advertising Data (Octet 37 - Bit 3)
          LE Set Periodic Advertising Enable (Octet 37 - Bit 4)
          LE Set Extended Scan Parameters (Octet 37 - Bit 5)
          LE Set Extended Scan Enable (Octet 37 - Bit 6)
          LE Extended Create Connection (Octet 37 - Bit 7)
          LE Periodic Advertising Create Sync (Octet 38 - Bit 0)
          LE Periodic Advertising Create Sync Cancel (Octet 38 - Bit 1)
          LE Periodic Advertising Terminate Sync (Octet 38 - Bit 2)
          LE Add Device To Periodic Advertiser List (Octet 38 - Bit 3)
          LE Remove Device From Periodic Advertiser List (Octet 38 - Bit 4)
          LE Clear Periodic Advertiser List (Octet 38 - Bit 5)
          LE Read Periodic Advertiser List Size (Octet 38 - Bit 6)
          LE Read Transmit Power (Octet 38 - Bit 7)
          LE Read RF Path Compensation (Octet 39 - Bit 0)
          LE Write RF Path Compensation (Octet 39 - Bit 1)
          LE Set Privacy Mode (Octet 39 - Bit 2)
          LE Periodic Advertising Receive Enable (Octet 40 - Bit 5)
          LE Periodic Advertising Sync Transfer (Octet 40 - Bit 6)
          LE Periodic Advertising Set Info Transfer (Octet 40 - Bit 7)
          LE Periodic Advertising Sync Transfer Parameters (Octet 41 - Bit 0)
          LE Set Default Periodic Advertisng Sync Transfer Parameters (Octet 41 - Bit 1)
          LE Read Buffer v2 (Octet 41 - Bit 5)
          LE Read ISO TX Sync (Octet 41 - Bit 6)
          LE Set Connected Isochronous Group Parameters (Octet 41 - Bit 7)
          LE Set Connected Isochronous Group Parameters Test (Octet 42 - Bit 0)
          LE Create Connected Isochronous Stream (Octet 42 - Bit 1)
          LE Remove Connected Isochronous Group (Octet 42 - Bit 2)
          LE Accept Connected Isochronous Stream Request (Octet 42 - Bit 3)
          LE Reject Connected Isochronous Stream Request (Octet 42 - Bit 4)
          LE Create Broadcast Isochronous Group (Octet 42 - Bit 5)
          LE Create Broadcast Isochronous Group Test (Octet 42 - Bit 6)
          LE Terminate Broadcast Isochronous Group (Octet 42 - Bit 7)
          LE Broadcast Isochronous Group Create Sync (Octet 43 - Bit 0)
          LE Broadcast Isochronous Group Terminate Sync (Octet 43 - Bit 1)
          LE Request Peer SCA (Octet 43 - Bit 2)
          LE Setup Isochronous Data Path (Octet 43 - Bit 3)
          LE Remove Isochronous Data Path (Octet 43 - Bit 4)
          LE Isochronous Transmit Test (Octet 43 - Bit 5)
          LE Isochronous Receive Test (Octet 43 - Bit 6)
          LE Isochronous Read Test Counters (Octet 43 - Bit 7)
          LE Isochronous Read Test Counters (Octet 44 - Bit 0)
          LE Set Host Feature (Octet 44 - Bit 1)
          Octet 44 - Bit 2 
          Octet 45 - Bit 6 
          Octet 46 - Bit 0 
          Octet 46 - Bit 1 
          Octet 46 - Bit 2 
zephyr.exe[123210]: < HCI Command: Host Buffer Size (0x03|0x0033) plen 7                                              #9 0.232706
        ACL MTU: 255  ACL max packet: 16
        SCO MTU: 0    SCO max packet: 0
> HCI Event: Command Complete (0x0e) plen 4                                                                          #10 0.233254
      Host Buffer Size (0x03|0x0033) ncmd 1
        Status: Success (0x00)
zephyr.exe[123210]: < HCI Command: Set Controller To Host Flow Control (0x03|0x0031) plen 1                          #11 0.252729
        Flow control: ACL Data Packets (0x01)
> HCI Event: Command Complete (0x0e) plen 4                                                                          #12 0.253259
      Set Controller To Host Flow Control (0x03|0x0031) ncmd 1
        Status: Success (0x00)
zephyr.exe[123210]: < HCI Command: LE Read Local Supported Features (0x08|0x0003) plen 0                             #13 0.272715
> HCI Event: Command Complete (0x0e) plen 12                                                                         #14 0.273175
      LE Read Local Supported Features (0x08|0x0003) ncmd 1
        Status: Success (0x00)
        Features: 0xfd 0x79 0x00 0xf7 0x30 0x01 0x00 0x00
          LE Encryption
          Extended Reject Indication
          Peripheral-initiated Features Exchange
          LE Ping
          LE Data Packet Length Extension
          LL Privacy
          Extended Scanner Filter Policies
          LE 2M PHY
          LE Coded PHY
          LE Extended Advertising
          LE Periodic Advertising
          Channel Selection Algorithm #2
          Periodic Advertising Sync Transfer - Sender
          Periodic Advertising Sync Transfer - Recipient
          Sleep Clock Accuracy Updates
          Connected Isochronous Stream - Central
          Connected Isochronous Stream - Peripheral
          Isochronous Broadcaster
          Synchronized Receiver
          Periodic Advertising ADI support
          Connection Subrating
          Unknown features (0x0000010000000000)
zephyr.exe[123210]: < HCI Command: LE Set Host Feature (0x08|0x0074) plen 2                                          #15 0.292743
        Bit Number: 32
          Connected Isochronous Stream (Host Support)
        Bit Value: 1
> HCI Event: Command Complete (0x0e) plen 4                                                                          #16 0.293222
      LE Set Host Feature (0x08|0x0074) ncmd 1
        Status: Success (0x00)
zephyr.exe[123210]: < HCI Command: LE Read Buffer v2 (0x08|0x0060) plen 0                                            #17 0.312760
> HCI Event: Command Complete (0x0e) plen 10                                                                         #18 0.313222
      LE Read Buffer v2 (0x08|0x0060) ncmd 1
        Status: Success (0x00)
        ACL MTU: 27
        ACL max packet: 3
        ISO MTU: 318
        ISO max packet: 3
zephyr.exe[123210]: < HCI Command: LE Read Maximum Advertising Data Length (0x08|0x003a) plen 0                      #19 0.332761
> HCI Event: Command Complete (0x0e) plen 6                                                                          #20 0.333239
      LE Read Maximum Advertising Data Length (0x08|0x003a) ncmd 1
        Status: Success (0x00)
        Max length: 1650
zephyr.exe[123210]: < HCI Command: LE Read Supported States (0x08|0x001c) plen 0                                     #21 0.352731
> HCI Event: Command Complete (0x0e) plen 12                                                                         #22 0.353217
      LE Read Supported States (0x08|0x001c) ncmd 1
        Status: Success (0x00)
        States: 0x000003ff3e0306ff
          Non-connectable Advertising State
          Scannable Advertising State
          Connectable Advertising State
          High Duty Cycle Directed Advertising State
          Passive Scanning State
          Active Scanning State
          Initiating State
            and Connection State (Central Role)
          Connection State (Peripheral Role)
          Scannable Advertising State
            and Passive Scanning State
          Connectable Advertising State
            and Passive Scanning State
          Non-connectable Advertising State
            and Initiating State
          Scannable Advertising State
            and Initiating State
          Active Scanning State
            and Connection State (Central Role)
          Passive Scanning State
            and Connection State (Peripheral Role)
          Active Scanning State
            and Connection State (Peripheral Role)
          Initiating State
            and Connection State (Central Role)
            and Central Role & Central Role
          Low Duty Cycle Directed Advertising State
          Connectable Advertising State
            and Initiating State
            and Central Role & Peripheral Role
          High Duty Cycle Directed Advertising State
            and Initiating State
            and Central Role & Peripheral Role
          Low Duty Cycle Directed Advertising State
            and Initiating State
            and Central Role & Peripheral Role
          Connectable Advertising State
            and Connection State (Central Role)
            and Central Role & Peripheral Role
          High Duty Cycle Directed Advertising State
            and Connection State (Central Role)
            and Central Role & Peripheral Role
          Low Duty Cycle Directed Advertising State
            and Connection State (Central Role)
            and Central Role & Peripheral Role
          Connectable Advertising State
            and Connection State (Peripheral Role)
            and Central Role & Peripheral Role
          High Duty Cycle Directed Advertising State
            and Connection State (Peripheral Role)
            and Peripheral Role & Peripheral Role
          Low Duty Cycle Directed Advertising State
            and Connection State (Peripheral Role)
            and Peripheral Role & Peripheral Role
          Initiating State
            and Connection State (Peripheral Role)
            and Central Role & Peripheral Role
zephyr.exe[123210]: < HCI Command: LE Read Maximum Data Length (0x08|0x002f) plen 0                                  #23 0.372737
> HCI Event: Command Complete (0x0e) plen 12                                                                         #24 0.373223
      LE Read Maximum Data Length (0x08|0x002f) ncmd 1
        Status: Success (0x00)
        Max TX octets: 251
        Max TX time: 2704
        Max RX octets: 251
        Max RX time: 2704
zephyr.exe[123210]: < HCI Command: LE Write Suggested Default Data Length (0x08|0x0024) plen 4                       #25 0.392701
        TX octets: 251
        TX time: 2704
> HCI Event: Command Complete (0x0e) plen 4                                                                          #26 0.393195
      LE Write Suggested Default Data Length (0x08|0x0024) ncmd 1
        Status: Success (0x00)
zephyr.exe[123210]: < HCI Command: LE Read Resolving List Size (0x08|0x002a) plen 0                                  #27 0.412717
> HCI Event: Command Complete (0x0e) plen 5                                                                          #28 0.413181
      LE Read Resolving List Size (0x08|0x002a) ncmd 1
        Status: Success (0x00)
        Size: 8
zephyr.exe[123210]: < HCI Command: LE Set Event Mask (0x08|0x0001) plen 8                                            #29 0.432709
        Mask: 0x000002023f87fa5e
          LE Advertising Report
          LE Connection Update Complete
          LE Read Remote Used Features Complete
          LE Long Term Key Request
          LE Data Length Change
          LE Enhanced Connection Complete
          LE PHY Update Complete
          LE Extended Advertising Report
          LE Periodic Advertising Sync Established
          LE Periodic Advertising Report
          LE Periodic Advertising Sync Lost
          LE Extended Scan Timeout
          LE Extended Advertising Set Terminated
          LE Scan Request Received
          LE Periodic Advertising Sync Transfer Rvc
          LE CIS Established
          LE CIS Request
          LE Create BIG Complete
          LE Terminate BIG Complete
          LE BIG Sync Estabilished Complete
          LE BIG Sync Lost
          LE BIG Info Advertising Report
          Unknown mask (0x0000020000000000)
> HCI Event: Command Complete (0x0e) plen 4                                                                          #30 0.433215
      LE Set Event Mask (0x08|0x0001) ncmd 1
        Status: Success (0x00)
zephyr.exe[123210]: < HCI Command: Set Event Mask (0x03|0x0001) plen 8                                               #31 0.452708
        Mask: 0x2000800002008890
          Disconnection Complete
          Encryption Change
          Read Remote Version Information Complete
          Hardware Error
          Data Buffer Overflow
          Encryption Key Refresh Complete
          LE Meta
> HCI Event: Command Complete (0x0e) plen 4                                                                          #32 0.453187
      Set Event Mask (0x03|0x0001) ncmd 1
        Status: Success (0x00)
zephyr.exe[123210]: < HCI Command: Read BD ADDR (0x04|0x0009) plen 0                                                 #33 0.472715
> HCI Event: Command Complete (0x0e) plen 10                                                                         #34 0.473254
      Read BD ADDR (0x04|0x0009) ncmd 1
        Status: Success (0x00)
        Address: 00:00:00:00:00:00 (OUI 00-00-00)
zephyr.exe[123210]: < HCI Command: LE Set Random Address (0x08|0x0005) plen 6                                        #35 0.492739
        Address: D5:B6:CC:31:DB:3B (Static)
> HCI Event: Command Complete (0x0e) plen 4                                                                          #36 0.493257
      LE Set Random Address (0x08|0x0005) ncmd 1
        Status: Success (0x00)
zephyr.exe[123210]: < HCI Command: LE Set Extended Advertising Parameters (0x08|0x0036) plen 25                      #37 7.392862
        Handle: 0x00
        Properties: 0x0013
          Connectable
          Scannable
          Use legacy advertising PDUs: ADV_IND
        Min advertising interval: 100.000 msec (0x00a0)
        Max advertising interval: 150.000 msec (0x00f0)
        Channel map: 37, 38, 39 (0x07)
        Own address type: Random (0x01)
        Peer address type: Public (0x00)
        Peer address: 00:00:00:00:00:00 (OUI 00-00-00)
        Filter policy: Allow Scan Request from Any, Allow Connect Request from Any (0x00)
        TX power: Host has no preference (0x7f)
        Primary PHY: LE 1M (0x01)
        Secondary max skip: 0x00
        Secondary PHY: LE 1M (0x01)
        SID: 0x00
        Scan request notifications: Disabled (0x00)
> HCI Event: Command Complete (0x0e) plen 5                                                                          #38 7.393674
      LE Set Extended Advertising Parameters (0x08|0x0036) ncmd 1
        Status: Success (0x00)
        TX power (selected): 0 dbm (0x00)
zephyr.exe[123210]: < HCI Command: LE Set Advertising Set Random Address (0x08|0x0035) plen 7                        #39 7.412813
        Advertising handle: 0x00
        Advertising random address: D5:B6:CC:31:DB:3B (Static)
> HCI Event: Command Complete (0x0e) plen 4                                                                          #40 7.413378
      LE Set Advertising Set Random Address (0x08|0x0035) ncmd 1
        Status: Success (0x00)
zephyr.exe[123210]: < HCI Command: LE Set Extended Advertising Data (0x08|0x0037) plen 22                            #41 7.432812
        Handle: 0x00
        Operation: Complete extended advertising data (0x03)
        Fragment preference: Minimize fragmentation (0x01)
        Data length: 0x12
        Flags: 0x06
          LE General Discoverable Mode
          BR/EDR Not Supported
        Name (complete): Tester_F6B11A
> HCI Event: Command Complete (0x0e) plen 4                                                                          #42 7.433483
      LE Set Extended Advertising Data (0x08|0x0037) ncmd 1
        Status: Success (0x00)
zephyr.exe[123210]: < HCI Command: LE Set Extended Scan Response Data (0x08|0x0038) plen 4                           #43 7.452805
        Handle: 0x00
        Operation: Complete scan response data (0x03)
        Fragment preference: Minimize fragmentation (0x01)
        Data length: 0x00
> HCI Event: Command Complete (0x0e) plen 4                                                                          #44 7.453342
      LE Set Extended Scan Response Data (0x08|0x0038) ncmd 1
        Status: Success (0x00)
zephyr.exe[123210]: < HCI Command: LE Set Extended Advertising Enable (0x08|0x0039) plen 6                           #45 7.472827
        Extended advertising: Enabled (0x01)
        Number of sets: 1 (0x01)
        Entry 0
          Handle: 0x00
          Duration: 0 ms (0x00)
          Max ext adv events: 0
> HCI Event: Command Complete (0x0e) plen 4                                                                          #46 7.473395
      LE Set Extended Advertising Enable (0x08|0x0039) ncmd 1
        Status: Success (0x00)
> HCI Event: LE Meta Event (0x3e) plen 31                                                                            #47 7.793536
      LE Enhanced Connection Complete (0x0a)
        Status: Success (0x00)
        Handle: 255
        Role: Peripheral (0x01)
        Peer address type: Public (0x00)
        Peer address: DF:A9:FF:F6:B1:1A (OUI DF-A9-FF)
        Local resolvable private address: 00:00:00:00:00:00 (Non-Resolvable)
        Peer resolvable private address: 00:00:00:00:00:00 (Non-Resolvable)
        Connection interval: 87.50 msec (0x0046)
        Connection latency: 0 (0x0000)
        Supervision timeout: 20000 msec (0x07d0)
        Central clock accuracy: 0x01
> HCI Event: LE Meta Event (0x3e) plen 6                                                                             #48 7.793677
      LE Advertising Set Terminated (0x12)
        Status: Success (0x00)
        Handle: 0
        Connection handle: 255
        Number of completed extended advertising events: 0
zephyr.exe[123210]: < HCI Command: LE Read Remote Used Features (0x08|0x0016) plen 2                                 #49 7.813043
        Handle: 255 Address: DF:A9:FF:F6:B1:1A (OUI DF-A9-FF)
> HCI Event: Command Status (0x0f) plen 4                                                                            #50 7.813463
      LE Read Remote Used Features (0x08|0x0016) ncmd 1
        Status: Success (0x00)
> HCI Event: LE Meta Event (0x3e) plen 12                                                                            #51 8.057630
      LE Read Remote Used Features (0x04)
        Status: Success (0x00)
        Handle: 255 Address: DF:A9:FF:F6:B1:1A (OUI DF-A9-FF)
        Features: 0x2d 0x49 0x00 0xf7 0x67 0xd8 0x00 0x00
          LE Encryption
          Extended Reject Indication
          Peripheral-initiated Features Exchange
          LE Data Packet Length Extension
          LE 2M PHY
          LE Coded PHY
          Channel Selection Algorithm #2
          Periodic Advertising Sync Transfer - Sender
          Periodic Advertising Sync Transfer - Recipient
          Sleep Clock Accuracy Updates
          Connected Isochronous Stream - Central
          Connected Isochronous Stream - Peripheral
          Isochronous Broadcaster
          Synchronized Receiver
          Connected Isochronous Stream (Host Support)
          LE Power Control Request
          LE Power Control Request
          Connection Subrating
          Connection Subrating (Host Support)
          Unknown features (0x0000d80000000000)
> ACL Data RX: Handle 255 flags 0x02 dlen 11                                                                         #52 9.019712
      ATT: Read By Type Request (0x08) len 6
        Handle range: 0x0001-0xffff
        Attribute type: Characteristic (0x2803)
zephyr.exe[123210]: < HCI Command: Host Number of Completed Packets (0x03|0x0035) plen 5                             #53 9.033254
        Num handles: 1
        Handle: 255 Address: DF:A9:FF:F6:B1:1A (OUI DF-A9-FF)
        Count: 1
zephyr.exe[123210]: < ACL Data TX: Handle 255 flags 0x00 dlen 20                                                     #54 9.033511
      ATT: Read By Type Response (0x09) len 15
        Attribute data length: 7
        Attribute data list: 2 entries
        Handle: 0x0002
        Value: 200300052a
            Properties: 0x20
              Indicate (0x20)
            Value Handle: 0x0003
            Value UUID: Service Changed (0x2a05)
        Handle: 0x0005
        Value: 0a0600292b
            Properties: 0x0a
              Read (0x02)
              Write (0x08)
            Value Handle: 0x0006
            Value UUID: Client Supported Features (0x2b29)
> HCI Event: Number of Completed Packets (0x13) plen 5                                                               #55 9.194638
        Num handles: 1
        Handle: 255 Address: DF:A9:FF:F6:B1:1A (OUI DF-A9-FF)
        Count: 1
        #54: len 20 (0 Kb/s)
        Latency: 161 msec (161-161 msec ~161 msec)
> ACL Data RX: Handle 255 flags 0x02 dlen 11                                                                         #56 9.194906
      ATT: Read By Type Request (0x08) len 6
        Handle range: 0x0006-0xffff
        Attribute type: Characteristic (0x2803)
zephyr.exe[123210]: < HCI Command: Host Number of Completed Packets (0x03|0x0035) plen 5                             #57 9.213112
        Num handles: 1
        Handle: 255 Address: DF:A9:FF:F6:B1:1A (OUI DF-A9-FF)
        Count: 1
zephyr.exe[123210]: < ACL Data TX: Handle 255 flags 0x00 dlen 20                                                     #58 9.213138
      ATT: Read By Type Response (0x09) len 15
        Attribute data length: 7
        Attribute data list: 2 entries
        Handle: 0x0007
        Value: 0208002a2b
            Properties: 0x02
              Read (0x02)
            Value Handle: 0x0008
            Value UUID: Database Hash (0x2b2a)
        Handle: 0x0009
        Value: 020a003a2b
            Properties: 0x02
              Read (0x02)
            Value Handle: 0x000a
            Value UUID: Server Supported Features (0x2b3a)
> HCI Event: Number of Completed Packets (0x13) plen 5                                                               #59 9.369630
        Num handles: 1
        Handle: 255 Address: DF:A9:FF:F6:B1:1A (OUI DF-A9-FF)
        Count: 1
        #58: len 20 (1 Kb/s)
        Latency: 156 msec (156-161 msec ~158 msec)
> ACL Data RX: Handle 255 flags 0x02 dlen 11                                                                         #60 9.369916
      ATT: Read By Type Request (0x08) len 6
        Handle range: 0x000a-0xffff
        Attribute type: Characteristic (0x2803)
zephyr.exe[123210]: < HCI Command: Host Number of Completed Packets (0x03|0x0035) plen 5                             #61 9.373508
        Num handles: 1
        Handle: 255 Address: DF:A9:FF:F6:B1:1A (OUI DF-A9-FF)
        Count: 1
zephyr.exe[123210]: < ACL Data TX: Handle 255 flags 0x00 dlen 20                                                     #62 9.373645
      ATT: Read By Type Response (0x09) len 15
        Attribute data length: 7
        Attribute data list: 2 entries
        Handle: 0x000c
        Value: 0a0d00002a
            Properties: 0x0a
              Read (0x02)
              Write (0x08)
            Value Handle: 0x000d
            Value UUID: Device Name (0x2a00)
        Handle: 0x000e
        Value: 0a0f00012a
            Properties: 0x0a
              Read (0x02)
              Write (0x08)
            Value Handle: 0x000f
            Value UUID: Appearance (0x2a01)
> HCI Event: Number of Completed Packets (0x13) plen 5                                                               #63 9.544629
        Num handles: 1
        Handle: 255 Address: DF:A9:FF:F6:B1:1A (OUI DF-A9-FF)
        Count: 1
        #62: len 20 (0 Kb/s)
        Latency: 170 msec (156-170 msec ~164 msec)
> ACL Data RX: Handle 255 flags 0x02 dlen 11                                                                         #64 9.544921
      ATT: Read By Type Request (0x08) len 6
        Handle range: 0x000f-0xffff
        Attribute type: Characteristic (0x2803)
zephyr.exe[123210]: < HCI Command: Host Number of Completed Packets (0x03|0x0035) plen 5                             #65 9.552949
        Num handles: 1
        Handle: 255 Address: DF:A9:FF:F6:B1:1A (OUI DF-A9-FF)
        Count: 1
zephyr.exe[123210]: < ACL Data TX: Handle 255 flags 0x00 dlen 20                                                     #66 9.552956
      ATT: Read By Type Response (0x09) len 15
        Attribute data length: 7
        Attribute data list: 2 entries
        Handle: 0x0010
        Value: 021100042a
            Properties: 0x02
              Read (0x02)
            Value Handle: 0x0011
            Value UUID: Peripheral Preferred Connection Parameters (0x2a04)
        Handle: 0x0013
        Value: 021400242a
            Properties: 0x02
              Read (0x02)
            Value Handle: 0x0014
            Value UUID: Model Number String (0x2a24)
> HCI Event: Number of Completed Packets (0x13) plen 5                                                               #67 9.719609
        Num handles: 1
        Handle: 255 Address: DF:A9:FF:F6:B1:1A (OUI DF-A9-FF)
        Count: 1
        #66: len 20 (0 Kb/s)
        Latency: 166 msec (156-170 msec ~165 msec)
> ACL Data RX: Handle 255 flags 0x02 dlen 11                                                                         #68 9.719864
      ATT: Read By Type Request (0x08) len 6
        Handle range: 0x0014-0xffff
        Attribute type: Characteristic (0x2803)
zephyr.exe[123210]: < HCI Command: Host Number of Completed Packets (0x03|0x0035) plen 5                             #69 9.733146
        Num handles: 1
        Handle: 255 Address: DF:A9:FF:F6:B1:1A (OUI DF-A9-FF)
        Count: 1
zephyr.exe[123210]: < ACL Data TX: Handle 255 flags 0x00 dlen 20                                                     #70 9.733185
      ATT: Read By Type Response (0x09) len 15
        Attribute data length: 7
        Attribute data list: 2 entries
        Handle: 0x0015
        Value: 021600292a
            Properties: 0x02
              Read (0x02)
            Value Handle: 0x0016
            Value UUID: Manufacturer Name String (0x2a29)
        Handle: 0x0017
        Value: 021800502a
            Properties: 0x02
              Read (0x02)
            Value Handle: 0x0018
            Value UUID: PnP ID (0x2a50)
> HCI Event: Number of Completed Packets (0x13) plen 5                                                               #71 9.894681
        Num handles: 1
        Handle: 255 Address: DF:A9:FF:F6:B1:1A (OUI DF-A9-FF)
        Count: 1
        #70: len 20 (0 Kb/s)
        Latency: 161 msec (156-170 msec ~163 msec)
> ACL Data RX: Handle 255 flags 0x02 dlen 11                                                                         #72 9.894930
      ATT: Read By Type Request (0x08) len 6
        Handle range: 0x0018-0xffff
        Attribute type: Characteristic (0x2803)
zephyr.exe[123210]: < HCI Command: Host Number of Completed Packets (0x03|0x0035) plen 5                             #73 9.913525
        Num handles: 1
        Handle: 255 Address: DF:A9:FF:F6:B1:1A (OUI DF-A9-FF)
        Count: 1
zephyr.exe[123210]: < ACL Data TX: Handle 255 flags 0x00 dlen 20                                                     #74 9.913668
      ATT: Read By Type Response (0x09) len 15
        Attribute data length: 7
        Attribute data list: 2 entries
        Handle: 0x0019
        Value: 021a00252a
            Properties: 0x02
              Read (0x02)
            Value Handle: 0x001a
            Value UUID: Serial Number String (0x2a25)
        Handle: 0x001b
        Value: 021c00262a
            Properties: 0x02
              Read (0x02)
            Value Handle: 0x001c
            Value UUID: Firmware Revision String (0x2a26)
> HCI Event: Number of Completed Packets (0x13) plen 5                                                              #75 10.069600
        Num handles: 1
        Handle: 255 Address: DF:A9:FF:F6:B1:1A (OUI DF-A9-FF)
        Count: 1
        #74: len 20 (1 Kb/s)
        Latency: 155 msec (155-170 msec ~159 msec)
> ACL Data RX: Handle 255 flags 0x02 dlen 11                                                                        #76 10.069918
      ATT: Read By Type Request (0x08) len 6
        Handle range: 0x001c-0xffff
        Attribute type: Characteristic (0x2803)
zephyr.exe[123210]: < HCI Command: Host Number of Completed Packets (0x03|0x0035) plen 5                            #77 10.073433
        Num handles: 1
        Handle: 255 Address: DF:A9:FF:F6:B1:1A (OUI DF-A9-FF)
        Count: 1
zephyr.exe[123210]: < ACL Data TX: Handle 255 flags 0x00 dlen 20                                                    #78 10.073550
      ATT: Read By Type Response (0x09) len 15
        Attribute data length: 7
        Attribute data list: 2 entries
        Handle: 0x001d
        Value: 021e00272a
            Properties: 0x02
              Read (0x02)
            Value Handle: 0x001e
            Value UUID: Hardware Revision String (0x2a27)
        Handle: 0x001f
        Value: 022000282a
            Properties: 0x02
              Read (0x02)
            Value Handle: 0x0020
            Value UUID: Software Revision String (0x2a28)
> HCI Event: Number of Completed Packets (0x13) plen 5                                                              #79 10.244692
        Num handles: 1
        Handle: 255 Address: DF:A9:FF:F6:B1:1A (OUI DF-A9-FF)
        Count: 1
        #78: len 20 (0 Kb/s)
        Latency: 171 msec (155-171 msec ~165 msec)
> ACL Data RX: Handle 255 flags 0x02 dlen 11                                                                        #80 10.244851
      ATT: Read By Type Request (0x08) len 6
        Handle range: 0x0020-0xffff
        Attribute type: Characteristic (0x2803)
zephyr.exe[123210]: < HCI Command: Host Number of Completed Packets (0x03|0x0035) plen 5                            #81 10.253083
        Num handles: 1
        Handle: 255 Address: DF:A9:FF:F6:B1:1A (OUI DF-A9-FF)
        Count: 1
zephyr.exe[123210]: < ACL Data TX: Handle 255 flags 0x00 dlen 20                                                    #82 10.253111
      ATT: Read By Type Response (0x09) len 15
        Attribute data length: 7
        Attribute data list: 2 entries
        Handle: 0x0022
        Value: 0a2300aa50
            Properties: 0x0a
              Read (0x02)
              Write (0x08)
            Value Handle: 0x0023
            Value UUID: Unknown (0x50aa)
        Handle: 0x0024
        Value: 0a2500aa51
            Properties: 0x0a
              Read (0x02)
              Write (0x08)
            Value Handle: 0x0025
            Value UUID: Unknown (0x51aa)
> HCI Event: Number of Completed Packets (0x13) plen 5                                                              #83 10.419752
        Num handles: 1
        Handle: 255 Address: DF:A9:FF:F6:B1:1A (OUI DF-A9-FF)
        Count: 1
        #82: len 20 (0 Kb/s)
        Latency: 166 msec (155-171 msec ~166 msec)
> ACL Data RX: Handle 255 flags 0x02 dlen 11                                                                        #84 10.419896
      ATT: Read By Type Request (0x08) len 6
        Handle range: 0x0025-0xffff
        Attribute type: Characteristic (0x2803)
zephyr.exe[123210]: < HCI Command: Host Number of Completed Packets (0x03|0x0035) plen 5                            #85 10.433643
        Num handles: 1
        Handle: 255 Address: DF:A9:FF:F6:B1:1A (OUI DF-A9-FF)
        Count: 1
zephyr.exe[123210]: < ACL Data TX: Handle 255 flags 0x00 dlen 20                                                    #86 10.433742
      ATT: Read By Type Response (0x09) len 15
        Attribute data length: 7
        Attribute data list: 2 entries
        Handle: 0x0026
        Value: 0a2700aa52
            Properties: 0x0a
              Read (0x02)
              Write (0x08)
            Value Handle: 0x0027
            Value UUID: Unknown (0x52aa)
        Handle: 0x0028
        Value: 0a2900aa53
            Properties: 0x0a
              Read (0x02)
              Write (0x08)
            Value Handle: 0x0029
            Value UUID: Unknown (0x53aa)
> HCI Event: Number of Completed Packets (0x13) plen 5                                                              #87 10.594568
        Num handles: 1
        Handle: 255 Address: DF:A9:FF:F6:B1:1A (OUI DF-A9-FF)
        Count: 1
        #86: len 20 (1 Kb/s)
        Latency: 160 msec (155-171 msec ~163 msec)
> ACL Data RX: Handle 255 flags 0x02 dlen 11                                                                        #88 10.594825
      ATT: Read By Type Request (0x08) len 6
        Handle range: 0x0029-0xffff
        Attribute type: Characteristic (0x2803)
zephyr.exe[123210]: < HCI Command: Host Number of Completed Packets (0x03|0x0035) plen 5                            #89 10.613651
        Num handles: 1
        Handle: 255 Address: DF:A9:FF:F6:B1:1A (OUI DF-A9-FF)
        Count: 1
zephyr.exe[123210]: < ACL Data TX: Handle 255 flags 0x00 dlen 20                                                    #90 10.613772
      ATT: Read By Type Response (0x09) len 15
        Attribute data length: 7
        Attribute data list: 2 entries
        Handle: 0x002a
        Value: 3a2b00aa54
            Properties: 0x3a
              Read (0x02)
              Write (0x08)
              Notify (0x10)
              Indicate (0x20)
            Value Handle: 0x002b
            Value UUID: Unknown (0x54aa)
        Handle: 0x002d
        Value: 3a2e00aa55
            Properties: 0x3a
              Read (0x02)
              Write (0x08)
              Notify (0x10)
              Indicate (0x20)
            Value Handle: 0x002e
            Value UUID: Unknown (0x55aa)
> HCI Event: Number of Completed Packets (0x13) plen 5                                                              #91 10.769633
        Num handles: 1
        Handle: 255 Address: DF:A9:FF:F6:B1:1A (OUI DF-A9-FF)
        Count: 1
        #90: len 20 (1 Kb/s)
        Latency: 155 msec (155-171 msec ~159 msec)
> ACL Data RX: Handle 255 flags 0x02 dlen 11                                                                        #92 10.769898
      ATT: Read By Type Request (0x08) len 6
        Handle range: 0x002e-0xffff
        Attribute type: Characteristic (0x2803)
zephyr.exe[123210]: < HCI Command: Host Number of Completed Packets (0x03|0x0035) plen 5                            #93 10.773121
        Num handles: 1
        Handle: 255 Address: DF:A9:FF:F6:B1:1A (OUI DF-A9-FF)
        Count: 1
zephyr.exe[123210]: < ACL Data TX: Handle 255 flags 0x00 dlen 20                                                    #94 10.773190
      ATT: Read By Type Response (0x09) len 15
        Attribute data length: 7
        Attribute data list: 2 entries
        Handle: 0x0030
        Value: 463100aa56
            Properties: 0x46
              Read (0x02)
              Write Without Response (0x04)
              Authorize (0x40)
              Extended Properties (0x80)
            Value Handle: 0x0031
            Value UUID: Unknown (0x56aa)
        Handle: 0x0032
        Value: 463300aa57
            Properties: 0x46
              Read (0x02)
              Write Without Response (0x04)
              Authorize (0x40)
              Extended Properties (0x80)
            Value Handle: 0x0033
            Value UUID: Unknown (0x57aa)
> HCI Event: Number of Completed Packets (0x13) plen 5                                                              #95 10.944738
        Num handles: 1
        Handle: 255 Address: DF:A9:FF:F6:B1:1A (OUI DF-A9-FF)
        Count: 1
        #94: len 20 (0 Kb/s)
        Latency: 171 msec (155-171 msec ~165 msec)
> ACL Data RX: Handle 255 flags 0x02 dlen 11                                                                        #96 10.944848
      ATT: Read By Type Request (0x08) len 6
        Handle range: 0x0033-0xffff
        Attribute type: Characteristic (0x2803)
zephyr.exe[123210]: < HCI Command: Host Number of Completed Packets (0x03|0x0035) plen 5                            #97 10.953421
        Num handles: 1
        Handle: 255 Address: DF:A9:FF:F6:B1:1A (OUI DF-A9-FF)
        Count: 1
zephyr.exe[123210]: < ACL Data TX: Handle 255 flags 0x00 dlen 20                                                    #98 10.953490
      ATT: Read By Type Response (0x09) len 15
        Attribute data length: 7
        Attribute data list: 2 entries
        Handle: 0x0034
        Value: 8a3500aa58
            Properties: 0x8a
              Read (0x02)
              Write (0x08)
            Unknown fields (0x80)
            Value Handle: 0x0035
            Value UUID: Unknown (0x58aa)
        Handle: 0x0037
        Value: 0a3800aa59
            Properties: 0x0a
              Read (0x02)
              Write (0x08)
            Value Handle: 0x0038
            Value UUID: Unknown (0x59aa)
> HCI Event: Number of Completed Packets (0x13) plen 5                                                              #99 11.119674
        Num handles: 1
        Handle: 255 Address: DF:A9:FF:F6:B1:1A (OUI DF-A9-FF)
        Count: 1
        #98: len 20 (0 Kb/s)
        Latency: 166 msec (155-171 msec ~165 msec)
> ACL Data RX: Handle 255 flags 0x02 dlen 11                                                                       #100 11.119898
      ATT: Read By Type Request (0x08) len 6
        Handle range: 0x0038-0xffff
        Attribute type: Characteristic (0x2803)
zephyr.exe[123210]: < HCI Command: Host Number of Completed Packets (0x03|0x0035) plen 5                           #101 11.133563
        Num handles: 1
        Handle: 255 Address: DF:A9:FF:F6:B1:1A (OUI DF-A9-FF)
        Count: 1
zephyr.exe[123210]: < ACL Data TX: Handle 255 flags 0x00 dlen 13                                                   #102 11.133587
      ATT: Read By Type Response (0x09) len 8
        Attribute data length: 7
        Attribute data list: 1 entry
        Handle: 0x0039
        Value: 0a3a00aa5a
            Properties: 0x0a
              Read (0x02)
              Write (0x08)
            Value Handle: 0x003a
            Value UUID: Unknown (0x5aaa)
> HCI Event: Number of Completed Packets (0x13) plen 5                                                             #103 11.294621
        Num handles: 1
        Handle: 255 Address: DF:A9:FF:F6:B1:1A (OUI DF-A9-FF)
        Count: 1
        #102: len 13 (0 Kb/s)
        Latency: 161 msec (155-171 msec ~163 msec)
> ACL Data RX: Handle 255 flags 0x02 dlen 11                                                                       #104 11.294831
      ATT: Read By Type Request (0x08) len 6
        Handle range: 0x003a-0xffff
        Attribute type: Characteristic (0x2803)
zephyr.exe[123210]: < HCI Command: Host Number of Completed Packets (0x03|0x0035) plen 5                           #105 11.313173
        Num handles: 1
        Handle: 255 Address: DF:A9:FF:F6:B1:1A (OUI DF-A9-FF)
        Count: 1
zephyr.exe[123210]: < ACL Data TX: Handle 255 flags 0x00 dlen 27                                                   #106 11.313228
      ATT: Read By Type Response (0x09) len 22
        Attribute data length: 21
        Attribute data list: 1 entry
        Handle: 0x003b
        Value: 0a3c00f000bb5004514000b123456789abcdef
            Properties: 0x0a
              Read (0x02)
              Write (0x08)
            Value Handle: 0x003c
            Value UUID: Vendor specific (efcdab89-6745-23b1-0040-510450bb00f0)
> HCI Event: Number of Completed Packets (0x13) plen 5                                                             #107 11.469723
        Num handles: 1
        Handle: 255 Address: DF:A9:FF:F6:B1:1A (OUI DF-A9-FF)
        Count: 1
        #106: len 27 (1 Kb/s)
        Latency: 156 msec (155-171 msec ~159 msec)
> ACL Data RX: Handle 255 flags 0x02 dlen 11                                                                       #108 11.469799
      ATT: Read By Type Request (0x08) len 6
        Handle range: 0x003c-0xffff
        Attribute type: Characteristic (0x2803)
zephyr.exe[123210]: < HCI Command: Host Number of Completed Packets (0x03|0x0035) plen 5                           #109 11.473667
        Num handles: 1
        Handle: 255 Address: DF:A9:FF:F6:B1:1A (OUI DF-A9-FF)
        Count: 1
zephyr.exe[123210]: < ACL Data TX: Handle 255 flags 0x00 dlen 20                                                   #110 11.473750
      ATT: Read By Type Response (0x09) len 15
        Attribute data length: 7
        Attribute data list: 2 entries
        Handle: 0x003f
        Value: 0a4000aa50
            Properties: 0x0a
              Read (0x02)
              Write (0x08)
            Value Handle: 0x0040
            Value UUID: Unknown (0x50aa)
        Handle: 0x0041
        Value: 0a4200aa51
            Properties: 0x0a
              Read (0x02)
              Write (0x08)
            Value Handle: 0x0042
            Value UUID: Unknown (0x51aa)
> HCI Event: Number of Completed Packets (0x13) plen 5                                                             #111 11.644630
        Num handles: 1
        Handle: 255 Address: DF:A9:FF:F6:B1:1A (OUI DF-A9-FF)
        Count: 1
        #110: len 20 (0 Kb/s)
        Latency: 170 msec (155-171 msec ~165 msec)
> ACL Data RX: Handle 255 flags 0x02 dlen 11                                                                       #112 11.644793
      ATT: Read By Type Request (0x08) len 6
        Handle range: 0x0042-0xffff
        Attribute type: Characteristic (0x2803)
zephyr.exe[123210]: < HCI Command: Host Number of Completed Packets (0x03|0x0035) plen 5                           #113 11.653441
        Num handles: 1
        Handle: 255 Address: DF:A9:FF:F6:B1:1A (OUI DF-A9-FF)
        Count: 1
zephyr.exe[123210]: < ACL Data TX: Handle 255 flags 0x00 dlen 20                                                   #114 11.653529
      ATT: Read By Type Response (0x09) len 15
        Attribute data length: 7
        Attribute data list: 2 entries
        Handle: 0x0043
        Value: 0a4400aa52
            Properties: 0x0a
              Read (0x02)
              Write (0x08)
            Value Handle: 0x0044
            Value UUID: Unknown (0x52aa)
        Handle: 0x0045
        Value: 024600aa53
            Properties: 0x02
              Read (0x02)
            Value Handle: 0x0046
            Value UUID: Unknown (0x53aa)
> HCI Event: Number of Completed Packets (0x13) plen 5                                                             #115 11.819496
        Num handles: 1
        Handle: 255 Address: DF:A9:FF:F6:B1:1A (OUI DF-A9-FF)
        Count: 1
        #114: len 20 (0 Kb/s)
        Latency: 165 msec (155-171 msec ~165 msec)
> ACL Data RX: Handle 255 flags 0x02 dlen 11                                                                       #116 11.819933
      ATT: Read By Type Request (0x08) len 6
        Handle range: 0x0046-0xffff
        Attribute type: Characteristic (0x2803)
zephyr.exe[123210]: < HCI Command: Host Number of Completed Packets (0x03|0x0035) plen 5                           #117 11.833606
        Num handles: 1
        Handle: 255 Address: DF:A9:FF:F6:B1:1A (OUI DF-A9-FF)
        Count: 1
zephyr.exe[123210]: < ACL Data TX: Handle 255 flags 0x00 dlen 20                                                   #118 11.833686
      ATT: Read By Type Response (0x09) len 15
        Attribute data length: 7
        Attribute data list: 2 entries
        Handle: 0x0048
        Value: 0a4900aa55
            Properties: 0x0a
              Read (0x02)
              Write (0x08)
            Value Handle: 0x0049
            Value UUID: Unknown (0x55aa)
        Handle: 0x004a
        Value: 0a4b00aa56
            Properties: 0x0a
              Read (0x02)
              Write (0x08)
            Value Handle: 0x004b
            Value UUID: Unknown (0x56aa)
> HCI Event: Number of Completed Packets (0x13) plen 5                                                             #119 11.994563
        Num handles: 1
        Handle: 255 Address: DF:A9:FF:F6:B1:1A (OUI DF-A9-FF)
        Count: 1
        #118: len 20 (1 Kb/s)
        Latency: 160 msec (155-171 msec ~163 msec)
> ACL Data RX: Handle 255 flags 0x02 dlen 11                                                                       #120 11.994778
      ATT: Read By Type Request (0x08) len 6
        Handle range: 0x004b-0xffff
        Attribute type: Characteristic (0x2803)
zephyr.exe[123210]: < HCI Command: Host Number of Completed Packets (0x03|0x0035) plen 5                           #121 12.013380
        Num handles: 1
        Handle: 255 Address: DF:A9:FF:F6:B1:1A (OUI DF-A9-FF)
        Count: 1
zephyr.exe[123210]: < ACL Data TX: Handle 255 flags 0x00 dlen 9                                                    #122 12.013462
      ATT: Error Response (0x01) len 4
        Read By Type Request (0x08)
        Handle: 0x004b
        Error: Attribute Not Found (0x0a)
> HCI Event: Number of Completed Packets (0x13) plen 5                                                             #123 12.169599
        Num handles: 1
        Handle: 255 Address: DF:A9:FF:F6:B1:1A (OUI DF-A9-FF)
        Count: 1
        #122: len 9 (0 Kb/s)
        Latency: 156 msec (155-171 msec ~159 msec)
> ACL Data RX: Handle 255 flags 0x02 dlen 7                                                                        #124 12.169848
      ATT: Read Request (0x0a) len 2
        Handle: 0x000a
zephyr.exe[123210]: < HCI Command: Host Number of Completed Packets (0x03|0x0035) plen 5                           #125 12.173556
        Num handles: 1
        Handle: 255 Address: DF:A9:FF:F6:B1:1A (OUI DF-A9-FF)
        Count: 1
zephyr.exe[123210]: < ACL Data TX: Handle 255 flags 0x00 dlen 6                                                    #126 12.173657
      ATT: Read Response (0x0b) len 1
> HCI Event: Number of Completed Packets (0x13) plen 5                                                             #127 12.344697
        Num handles: 1
        Handle: 255 Address: DF:A9:FF:F6:B1:1A (OUI DF-A9-FF)
        Count: 1
        #126: len 6 (0 Kb/s)
        Latency: 171 msec (155-171 msec ~165 msec)
> ACL Data RX: Handle 255 flags 0x02 dlen 11                                                                       #128 12.344782
      ATT: Read By Type Request (0x08) len 6
        Handle range: 0x0001-0xffff
        Attribute type: Characteristic (0x2803)
zephyr.exe[123210]: < HCI Command: Host Number of Completed Packets (0x03|0x0035) plen 5                           #129 12.353547
        Num handles: 1
        Handle: 255 Address: DF:A9:FF:F6:B1:1A (OUI DF-A9-FF)
        Count: 1
zephyr.exe[123210]: < ACL Data TX: Handle 255 flags 0x00 dlen 20                                                   #130 12.353620
      ATT: Read By Type Response (0x09) len 15
        Attribute data length: 7
        Attribute data list: 2 entries
        Handle: 0x0002
        Value: 200300052a
            Properties: 0x20
              Indicate (0x20)
            Value Handle: 0x0003
            Value UUID: Service Changed (0x2a05)
        Handle: 0x0005
        Value: 0a0600292b
            Properties: 0x0a
              Read (0x02)
              Write (0x08)
            Value Handle: 0x0006
            Value UUID: Client Supported Features (0x2b29)
> HCI Event: Number of Completed Packets (0x13) plen 5                                                             #131 12.519500
        Num handles: 1
        Handle: 255 Address: DF:A9:FF:F6:B1:1A (OUI DF-A9-FF)
        Count: 1
        #130: len 20 (0 Kb/s)
        Latency: 165 msec (155-171 msec ~165 msec)
> ACL Data RX: Handle 255 flags 0x02 dlen 11                                                                       #132 12.519788
      ATT: Read By Type Request (0x08) len 6
        Handle range: 0x0006-0xffff
        Attribute type: Characteristic (0x2803)
zephyr.exe[123210]: < HCI Command: Host Number of Completed Packets (0x03|0x0035) plen 5                           #133 12.533250
        Num handles: 1
        Handle: 255 Address: DF:A9:FF:F6:B1:1A (OUI DF-A9-FF)
        Count: 1
zephyr.exe[123210]: < ACL Data TX: Handle 255 flags 0x00 dlen 20                                                   #134 12.533314
      ATT: Read By Type Response (0x09) len 15
        Attribute data length: 7
        Attribute data list: 2 entries
        Handle: 0x0007
        Value: 0208002a2b
            Properties: 0x02
              Read (0x02)
            Value Handle: 0x0008
            Value UUID: Database Hash (0x2b2a)
        Handle: 0x0009
        Value: 020a003a2b
            Properties: 0x02
              Read (0x02)
            Value Handle: 0x000a
            Value UUID: Server Supported Features (0x2b3a)
> HCI Event: Number of Completed Packets (0x13) plen 5                                                             #135 12.694613
        Num handles: 1
        Handle: 255 Address: DF:A9:FF:F6:B1:1A (OUI DF-A9-FF)
        Count: 1
        #134: len 20 (0 Kb/s)
        Latency: 161 msec (155-171 msec ~163 msec)
> ACL Data RX: Handle 255 flags 0x02 dlen 11                                                                       #136 12.694823
      ATT: Read By Type Request (0x08) len 6
        Handle range: 0x000a-0xffff
        Attribute type: Characteristic (0x2803)
zephyr.exe[123210]: < HCI Command: Host Number of Completed Packets (0x03|0x0035) plen 5                           #137 12.713212
        Num handles: 1
        Handle: 255 Address: DF:A9:FF:F6:B1:1A (OUI DF-A9-FF)
        Count: 1
zephyr.exe[123210]: < ACL Data TX: Handle 255 flags 0x00 dlen 20                                                   #138 12.713258
      ATT: Read By Type Response (0x09) len 15
        Attribute data length: 7
        Attribute data list: 2 entries
        Handle: 0x000c
        Value: 0a0d00002a
            Properties: 0x0a
              Read (0x02)
              Write (0x08)
            Value Handle: 0x000d
            Value UUID: Device Name (0x2a00)
        Handle: 0x000e
        Value: 0a0f00012a
            Properties: 0x0a
              Read (0x02)
              Write (0x08)
            Value Handle: 0x000f
            Value UUID: Appearance (0x2a01)
zephyr.exe[123210]: < ACL Data TX: Handle 255 flags 0x00 dlen 16                                                   #139 12.823191
      LE L2CAP: Connection Parameter Update Request (0x12) ident 1 len 8
        Min interval: 24
        Max interval: 40
        Peripheral latency: 0
        Timeout multiplier: 42
> HCI Event: Number of Completed Packets (0x13) plen 5                                                             #140 12.869555
        Num handles: 1
        Handle: 255 Address: DF:A9:FF:F6:B1:1A (OUI DF-A9-FF)
        Count: 1
        #138: len 20 (1 Kb/s)
        Latency: 156 msec (155-171 msec ~159 msec)
> ACL Data RX: Handle 255 flags 0x02 dlen 11                                                                       #141 12.869682
      ATT: Read By Type Request (0x08) len 6
        Handle range: 0x000f-0xffff
        Attribute type: Characteristic (0x2803)
zephyr.exe[123210]: < HCI Command: Host Number of Completed Packets (0x03|0x0035) plen 5                           #142 12.872984
        Num handles: 1
        Handle: 255 Address: DF:A9:FF:F6:B1:1A (OUI DF-A9-FF)
        Count: 1
zephyr.exe[123210]: < ACL Data TX: Handle 255 flags 0x00 dlen 20                                                   #143 12.873024
      ATT: Read By Type Response (0x09) len 15
        Attribute data length: 7
        Attribute data list: 2 entries
        Handle: 0x0010
        Value: 021100042a
            Properties: 0x02
              Read (0x02)
            Value Handle: 0x0011
            Value UUID: Peripheral Preferred Connection Parameters (0x2a04)
        Handle: 0x0013
        Value: 021400242a
            Properties: 0x02
              Read (0x02)
            Value Handle: 0x0014
            Value UUID: Model Number String (0x2a24)
> HCI Event: Number of Completed Packets (0x13) plen 5                                                             #144 12.957044
        Num handles: 1
        Handle: 255 Address: DF:A9:FF:F6:B1:1A (OUI DF-A9-FF)
        Count: 1
        #139: len 16 (0 Kb/s)
        Latency: 133 msec (133-171 msec ~146 msec)
> ACL Data RX: Handle 255 flags 0x02 dlen 10                                                                       #145 12.957185
      LE L2CAP: Connection Parameter Update Response (0x13) ident 1 len 2
        Result: Connection Parameters accepted (0x0000)
zephyr.exe[123210]: < HCI Command: Host Number of Completed Packets (0x03|0x0035) plen 5                           #146 12.973584
        Num handles: 1
        Handle: 255 Address: DF:A9:FF:F6:B1:1A (OUI DF-A9-FF)
        Count: 1
> HCI Event: Number of Completed Packets (0x13) plen 5                                                             #147 13.044557
        Num handles: 1
        Handle: 255 Address: DF:A9:FF:F6:B1:1A (OUI DF-A9-FF)
        Count: 1
        #143: len 20 (0 Kb/s)
        Latency: 171 msec (133-171 msec ~159 msec)
> ACL Data RX: Handle 255 flags 0x02 dlen 11                                                                       #148 13.044819
      ATT: Read By Type Request (0x08) len 6
        Handle range: 0x0014-0xffff
        Attribute type: Characteristic (0x2803)
zephyr.exe[123210]: < HCI Command: Host Number of Completed Packets (0x03|0x0035) plen 5                           #149 13.053285
        Num handles: 1
        Handle: 255 Address: DF:A9:FF:F6:B1:1A (OUI DF-A9-FF)
        Count: 1
zephyr.exe[123210]: < ACL Data TX: Handle 255 flags 0x00 dlen 20                                                   #150 13.053389
      ATT: Read By Type Response (0x09) len 15
        Attribute data length: 7
        Attribute data list: 2 entries
        Handle: 0x0015
        Value: 021600292a
            Properties: 0x02
              Read (0x02)
            Value Handle: 0x0016
            Value UUID: Manufacturer Name String (0x2a29)
        Handle: 0x0017
        Value: 021800502a
            Properties: 0x02
              Read (0x02)
            Value Handle: 0x0018
            Value UUID: PnP ID (0x2a50)
> HCI Event: Number of Completed Packets (0x13) plen 5                                                             #151 13.219516
        Num handles: 1
        Handle: 255 Address: DF:A9:FF:F6:B1:1A (OUI DF-A9-FF)
        Count: 1
        #150: len 20 (0 Kb/s)
        Latency: 166 msec (133-171 msec ~162 msec)
> ACL Data RX: Handle 255 flags 0x02 dlen 11                                                                       #152 13.219704
      ATT: Read By Type Request (0x08) len 6
        Handle range: 0x0018-0xffff
        Attribute type: Characteristic (0x2803)
zephyr.exe[123210]: < HCI Command: Host Number of Completed Packets (0x03|0x0035) plen 5                           #153 13.233135
        Num handles: 1
        Handle: 255 Address: DF:A9:FF:F6:B1:1A (OUI DF-A9-FF)
        Count: 1
zephyr.exe[123210]: < ACL Data TX: Handle 255 flags 0x00 dlen 20                                                   #154 13.233169
      ATT: Read By Type Response (0x09) len 15
        Attribute data length: 7
        Attribute data list: 2 entries
        Handle: 0x0019
        Value: 021a00252a
            Properties: 0x02
              Read (0x02)
            Value Handle: 0x001a
            Value UUID: Serial Number String (0x2a25)
        Handle: 0x001b
        Value: 021c00262a
            Properties: 0x02
              Read (0x02)
            Value Handle: 0x001c
            Value UUID: Firmware Revision String (0x2a26)
> HCI Event: Number of Completed Packets (0x13) plen 5                                                             #155 13.394643
        Num handles: 1
        Handle: 255 Address: DF:A9:FF:F6:B1:1A (OUI DF-A9-FF)
        Count: 1
        #154: len 20 (0 Kb/s)
        Latency: 161 msec (133-171 msec ~162 msec)
> ACL Data RX: Handle 255 flags 0x02 dlen 11                                                                       #156 13.394866
      ATT: Read By Type Request (0x08) len 6
        Handle range: 0x001c-0xffff
        Attribute type: Characteristic (0x2803)
zephyr.exe[123210]: < HCI Command: Host Number of Completed Packets (0x03|0x0035) plen 5                           #157 13.413600
        Num handles: 1
        Handle: 255 Address: DF:A9:FF:F6:B1:1A (OUI DF-A9-FF)
        Count: 1
zephyr.exe[123210]: < ACL Data TX: Handle 255 flags 0x00 dlen 20                                                   #158 13.413670
      ATT: Read By Type Response (0x09) len 15
        Attribute data length: 7
        Attribute data list: 2 entries
        Handle: 0x001d
        Value: 021e00272a
            Properties: 0x02
              Read (0x02)
            Value Handle: 0x001e
            Value UUID: Hardware Revision String (0x2a27)
        Handle: 0x001f
        Value: 022000282a
            Properties: 0x02
              Read (0x02)
            Value Handle: 0x0020
            Value UUID: Software Revision String (0x2a28)
> HCI Event: Number of Completed Packets (0x13) plen 5                                                             #159 13.569443
        Num handles: 1
        Handle: 255 Address: DF:A9:FF:F6:B1:1A (OUI DF-A9-FF)
        Count: 1
        #158: len 20 (1 Kb/s)
        Latency: 155 msec (133-171 msec ~158 msec)
> ACL Data RX: Handle 255 flags 0x02 dlen 11                                                                       #160 13.569746
      ATT: Read By Type Request (0x08) len 6
        Handle range: 0x0020-0xffff
        Attribute type: Characteristic (0x2803)
zephyr.exe[123210]: < HCI Command: Host Number of Completed Packets (0x03|0x0035) plen 5                           #161 13.573577
        Num handles: 1
        Handle: 255 Address: DF:A9:FF:F6:B1:1A (OUI DF-A9-FF)
        Count: 1
zephyr.exe[123210]: < ACL Data TX: Handle 255 flags 0x00 dlen 20                                                   #162 13.573648
      ATT: Read By Type Response (0x09) len 15
        Attribute data length: 7
        Attribute data list: 2 entries
        Handle: 0x0022
        Value: 0a2300aa50
            Properties: 0x0a
              Read (0x02)
              Write (0x08)
            Value Handle: 0x0023
            Value UUID: Unknown (0x50aa)
        Handle: 0x0024
        Value: 0a2500aa51
            Properties: 0x0a
              Read (0x02)
              Write (0x08)
            Value Handle: 0x0025
            Value UUID: Unknown (0x51aa)
> HCI Event: Number of Completed Packets (0x13) plen 5                                                             #163 13.744497
        Num handles: 1
        Handle: 255 Address: DF:A9:FF:F6:B1:1A (OUI DF-A9-FF)
        Count: 1
        #162: len 20 (0 Kb/s)
        Latency: 170 msec (133-171 msec ~164 msec)
> ACL Data RX: Handle 255 flags 0x02 dlen 11                                                                       #164 13.744749
      ATT: Read By Type Request (0x08) len 6
        Handle range: 0x0025-0xffff
        Attribute type: Characteristic (0x2803)
zephyr.exe[123210]: < HCI Command: Host Number of Completed Packets (0x03|0x0035) plen 5                           #165 13.753126
        Num handles: 1
        Handle: 255 Address: DF:A9:FF:F6:B1:1A (OUI DF-A9-FF)
        Count: 1
zephyr.exe[123210]: < ACL Data TX: Handle 255 flags 0x00 dlen 20                                                   #166 13.753148
      ATT: Read By Type Response (0x09) len 15
        Attribute data length: 7
        Attribute data list: 2 entries
        Handle: 0x0026
        Value: 0a2700aa52
            Properties: 0x0a
              Read (0x02)
              Write (0x08)
            Value Handle: 0x0027
            Value UUID: Unknown (0x52aa)
        Handle: 0x0028
        Value: 0a2900aa53
            Properties: 0x0a
              Read (0x02)
              Write (0x08)
            Value Handle: 0x0029
            Value UUID: Unknown (0x53aa)
> HCI Event: Number of Completed Packets (0x13) plen 5                                                             #167 13.919453
        Num handles: 1
        Handle: 255 Address: DF:A9:FF:F6:B1:1A (OUI DF-A9-FF)
        Count: 1
        #166: len 20 (0 Kb/s)
        Latency: 166 msec (133-171 msec ~165 msec)
> ACL Data RX: Handle 255 flags 0x02 dlen 11                                                                       #168 13.919771
      ATT: Read By Type Request (0x08) len 6
        Handle range: 0x0029-0xffff
        Attribute type: Characteristic (0x2803)
zephyr.exe[123210]: < HCI Command: Host Number of Completed Packets (0x03|0x0035) plen 5                           #169 13.933407
        Num handles: 1
        Handle: 255 Address: DF:A9:FF:F6:B1:1A (OUI DF-A9-FF)
        Count: 1
zephyr.exe[123210]: < ACL Data TX: Handle 255 flags 0x00 dlen 20                                                   #170 13.933503
      ATT: Read By Type Response (0x09) len 15
        Attribute data length: 7
        Attribute data list: 2 entries
        Handle: 0x002a
        Value: 3a2b00aa54
            Properties: 0x3a
              Read (0x02)
              Write (0x08)
              Notify (0x10)
              Indicate (0x20)
            Value Handle: 0x002b
            Value UUID: Unknown (0x54aa)
        Handle: 0x002d
        Value: 3a2e00aa55
            Properties: 0x3a
              Read (0x02)
              Write (0x08)
              Notify (0x10)
              Indicate (0x20)
            Value Handle: 0x002e
            Value UUID: Unknown (0x55aa)
> HCI Event: Number of Completed Packets (0x13) plen 5                                                             #171 14.094540
        Num handles: 1
        Handle: 255 Address: DF:A9:FF:F6:B1:1A (OUI DF-A9-FF)
        Count: 1
        #170: len 20 (0 Kb/s)
        Latency: 161 msec (133-171 msec ~163 msec)
> ACL Data RX: Handle 255 flags 0x02 dlen 11                                                                       #172 14.094688
      ATT: Read By Type Request (0x08) len 6
        Handle range: 0x002e-0xffff
        Attribute type: Characteristic (0x2803)
zephyr.exe[123210]: < HCI Command: Host Number of Completed Packets (0x03|0x0035) plen 5                           #173 14.113412
        Num handles: 1
        Handle: 255 Address: DF:A9:FF:F6:B1:1A (OUI DF-A9-FF)
        Count: 1
zephyr.exe[123210]: < ACL Data TX: Handle 255 flags 0x00 dlen 20                                                   #174 14.113495
      ATT: Read By Type Response (0x09) len 15
        Attribute data length: 7
        Attribute data list: 2 entries
        Handle: 0x0030
        Value: 463100aa56
            Properties: 0x46
              Read (0x02)
              Write Without Response (0x04)
              Authorize (0x40)
              Extended Properties (0x80)
            Value Handle: 0x0031
            Value UUID: Unknown (0x56aa)
        Handle: 0x0032
        Value: 463300aa57
            Properties: 0x46
              Read (0x02)
              Write Without Response (0x04)
              Authorize (0x40)
              Extended Properties (0x80)
            Value Handle: 0x0033
            Value UUID: Unknown (0x57aa)
> HCI Event: Number of Completed Packets (0x13) plen 5                                                             #175 14.269507
        Num handles: 1
        Handle: 255 Address: DF:A9:FF:F6:B1:1A (OUI DF-A9-FF)
        Count: 1
        #174: len 20 (1 Kb/s)
        Latency: 156 msec (133-171 msec ~159 msec)
> ACL Data RX: Handle 255 flags 0x02 dlen 11                                                                       #176 14.269779
      ATT: Read By Type Request (0x08) len 6
        Handle range: 0x0033-0xffff
        Attribute type: Characteristic (0x2803)
zephyr.exe[123210]: < HCI Command: Host Number of Completed Packets (0x03|0x0035) plen 5                           #177 14.273073
        Num handles: 1
        Handle: 255 Address: DF:A9:FF:F6:B1:1A (OUI DF-A9-FF)
        Count: 1
zephyr.exe[123210]: < ACL Data TX: Handle 255 flags 0x00 dlen 20                                                   #178 14.273098
      ATT: Read By Type Response (0x09) len 15
        Attribute data length: 7
        Attribute data list: 2 entries
        Handle: 0x0034
        Value: 8a3500aa58
            Properties: 0x8a
              Read (0x02)
              Write (0x08)
            Unknown fields (0x80)
            Value Handle: 0x0035
            Value UUID: Unknown (0x58aa)
        Handle: 0x0037
        Value: 0a3800aa59
            Properties: 0x0a
              Read (0x02)
              Write (0x08)
            Value Handle: 0x0038
            Value UUID: Unknown (0x59aa)
> HCI Event: Number of Completed Packets (0x13) plen 5                                                             #179 14.444572
        Num handles: 1
        Handle: 255 Address: DF:A9:FF:F6:B1:1A (OUI DF-A9-FF)
        Count: 1
        #178: len 20 (0 Kb/s)
        Latency: 171 msec (133-171 msec ~165 msec)
> ACL Data RX: Handle 255 flags 0x02 dlen 11                                                                       #180 14.444768
      ATT: Read By Type Request (0x08) len 6
        Handle range: 0x0038-0xffff
        Attribute type: Characteristic (0x2803)
zephyr.exe[123210]: < HCI Command: Host Number of Completed Packets (0x03|0x0035) plen 5                           #181 14.453576
        Num handles: 1
        Handle: 255 Address: DF:A9:FF:F6:B1:1A (OUI DF-A9-FF)
        Count: 1
zephyr.exe[123210]: < ACL Data TX: Handle 255 flags 0x00 dlen 13                                                   #182 14.453665
      ATT: Read By Type Response (0x09) len 8
        Attribute data length: 7
        Attribute data list: 1 entry
        Handle: 0x0039
        Value: 0a3a00aa5a
            Properties: 0x0a
              Read (0x02)
              Write (0x08)
            Value Handle: 0x003a
            Value UUID: Unknown (0x5aaa)
> HCI Event: Number of Completed Packets (0x13) plen 5                                                             #183 14.619490
        Num handles: 1
        Handle: 255 Address: DF:A9:FF:F6:B1:1A (OUI DF-A9-FF)
        Count: 1
        #182: len 13 (0 Kb/s)
        Latency: 165 msec (133-171 msec ~165 msec)
> ACL Data RX: Handle 255 flags 0x02 dlen 11                                                                       #184 14.619717
      ATT: Read By Type Request (0x08) len 6
        Handle range: 0x003a-0xffff
        Attribute type: Characteristic (0x2803)
zephyr.exe[123210]: < HCI Command: Host Number of Completed Packets (0x03|0x0035) plen 5                           #185 14.633146
        Num handles: 1
        Handle: 255 Address: DF:A9:FF:F6:B1:1A (OUI DF-A9-FF)
        Count: 1
zephyr.exe[123210]: < ACL Data TX: Handle 255 flags 0x00 dlen 27                                                   #186 14.633173
      ATT: Read By Type Response (0x09) len 22
        Attribute data length: 21
        Attribute data list: 1 entry
        Handle: 0x003b
        Value: 0a3c00f000bb5004514000b123456789abcdef
            Properties: 0x0a
              Read (0x02)
              Write (0x08)
            Value Handle: 0x003c
            Value UUID: Vendor specific (efcdab89-6745-23b1-0040-510450bb00f0)
> HCI Event: Number of Completed Packets (0x13) plen 5                                                             #187 14.794496
        Num handles: 1
        Handle: 255 Address: DF:A9:FF:F6:B1:1A (OUI DF-A9-FF)
        Count: 1
        #186: len 27 (1 Kb/s)
        Latency: 161 msec (133-171 msec ~163 msec)
> ACL Data RX: Handle 255 flags 0x02 dlen 11                                                                       #188 14.794851
      ATT: Read By Type Request (0x08) len 6
        Handle range: 0x003c-0xffff
        Attribute type: Characteristic (0x2803)
zephyr.exe[123210]: < HCI Command: Host Number of Completed Packets (0x03|0x0035) plen 5                           #189 14.813095
        Num handles: 1
        Handle: 255 Address: DF:A9:FF:F6:B1:1A (OUI DF-A9-FF)
        Count: 1
zephyr.exe[123210]: < ACL Data TX: Handle 255 flags 0x00 dlen 20                                                   #190 14.813161
      ATT: Read By Type Response (0x09) len 15
        Attribute data length: 7
        Attribute data list: 2 entries
        Handle: 0x003f
        Value: 0a4000aa50
            Properties: 0x0a
              Read (0x02)
              Write (0x08)
            Value Handle: 0x0040
            Value UUID: Unknown (0x50aa)
        Handle: 0x0041
        Value: 0a4200aa51
            Properties: 0x0a
              Read (0x02)
              Write (0x08)
            Value Handle: 0x0042
            Value UUID: Unknown (0x51aa)
> HCI Event: Number of Completed Packets (0x13) plen 5                                                             #191 14.969405
        Num handles: 1
        Handle: 255 Address: DF:A9:FF:F6:B1:1A (OUI DF-A9-FF)
        Count: 1
        #190: len 20 (1 Kb/s)
        Latency: 156 msec (133-171 msec ~159 msec)
> ACL Data RX: Handle 255 flags 0x02 dlen 11                                                                       #192 14.969670
      ATT: Read By Type Request (0x08) len 6
        Handle range: 0x0042-0xffff
        Attribute type: Characteristic (0x2803)
zephyr.exe[123210]: < HCI Command: Host Number of Completed Packets (0x03|0x0035) plen 5                           #193 14.973102
        Num handles: 1
        Handle: 255 Address: DF:A9:FF:F6:B1:1A (OUI DF-A9-FF)
        Count: 1
zephyr.exe[123210]: < ACL Data TX: Handle 255 flags 0x00 dlen 20                                                   #194 14.973132
      ATT: Read By Type Response (0x09) len 15
        Attribute data length: 7
        Attribute data list: 2 entries
        Handle: 0x0043
        Value: 0a4400aa52
            Properties: 0x0a
              Read (0x02)
              Write (0x08)
            Value Handle: 0x0044
            Value UUID: Unknown (0x52aa)
        Handle: 0x0045
        Value: 024600aa53
            Properties: 0x02
              Read (0x02)
            Value Handle: 0x0046
            Value UUID: Unknown (0x53aa)
> HCI Event: Number of Completed Packets (0x13) plen 5                                                             #195 15.144475
        Num handles: 1
        Handle: 255 Address: DF:A9:FF:F6:B1:1A (OUI DF-A9-FF)
        Count: 1
        #194: len 20 (0 Kb/s)
        Latency: 171 msec (133-171 msec ~165 msec)
> ACL Data RX: Handle 255 flags 0x02 dlen 11                                                                       #196 15.144700
      ATT: Read By Type Request (0x08) len 6
        Handle range: 0x0046-0xffff
        Attribute type: Characteristic (0x2803)
zephyr.exe[123210]: < HCI Command: Host Number of Completed Packets (0x03|0x0035) plen 5                           #197 15.153562
        Num handles: 1
        Handle: 255 Address: DF:A9:FF:F6:B1:1A (OUI DF-A9-FF)
        Count: 1
zephyr.exe[123210]: < ACL Data TX: Handle 255 flags 0x00 dlen 20                                                   #198 15.153717
      ATT: Read By Type Response (0x09) len 15
        Attribute data length: 7
        Attribute data list: 2 entries
        Handle: 0x0048
        Value: 0a4900aa55
            Properties: 0x0a
              Read (0x02)
              Write (0x08)
            Value Handle: 0x0049
            Value UUID: Unknown (0x55aa)
        Handle: 0x004a
        Value: 0a4b00aa56
            Properties: 0x0a
              Read (0x02)
              Write (0x08)
            Value Handle: 0x004b
            Value UUID: Unknown (0x56aa)
> HCI Event: Number of Completed Packets (0x13) plen 5                                                             #199 15.319551
        Num handles: 1
        Handle: 255 Address: DF:A9:FF:F6:B1:1A (OUI DF-A9-FF)
        Count: 1
        #198: len 20 (0 Kb/s)
        Latency: 165 msec (133-171 msec ~165 msec)
> ACL Data RX: Handle 255 flags 0x02 dlen 11                                                                       #200 15.319745
      ATT: Read By Type Request (0x08) len 6
        Handle range: 0x004b-0xffff
        Attribute type: Characteristic (0x2803)
zephyr.exe[123210]: < HCI Command: Host Number of Completed Packets (0x03|0x0035) plen 5                           #201 15.333145
        Num handles: 1
        Handle: 255 Address: DF:A9:FF:F6:B1:1A (OUI DF-A9-FF)
        Count: 1
zephyr.exe[123210]: < ACL Data TX: Handle 255 flags 0x00 dlen 9                                                    #202 15.333180
      ATT: Error Response (0x01) len 4
        Read By Type Request (0x08)
        Handle: 0x004b
        Error: Attribute Not Found (0x0a)
> HCI Event: Number of Completed Packets (0x13) plen 5                                                             #203 15.494452
        Num handles: 1
        Handle: 255 Address: DF:A9:FF:F6:B1:1A (OUI DF-A9-FF)
        Count: 1
        #202: len 9 (0 Kb/s)
        Latency: 161 msec (133-171 msec ~163 msec)
> ACL Data RX: Handle 255 flags 0x02 dlen 7                                                                        #204 15.494696
      ATT: Read Request (0x0a) len 2
        Handle: 0x0006
zephyr.exe[123210]: < HCI Command: Host Number of Completed Packets (0x03|0x0035) plen 5                           #205 15.513596
        Num handles: 1
        Handle: 255 Address: DF:A9:FF:F6:B1:1A (OUI DF-A9-FF)
        Count: 1
zephyr.exe[123210]: < ACL Data TX: Handle 255 flags 0x00 dlen 6                                                    #206 15.513620
      ATT: Read Response (0x0b) len 1
> HCI Event: Number of Completed Packets (0x13) plen 5                                                             #207 15.669456
        Num handles: 1
        Handle: 255 Address: DF:A9:FF:F6:B1:1A (OUI DF-A9-FF)
        Count: 1
        #206: len 6 (0 Kb/s)
        Latency: 155 msec (133-171 msec ~159 msec)
> ACL Data RX: Handle 255 flags 0x02 dlen 8                                                                        #208 15.669652
      ATT: Write Request (0x12) len 3
        Handle: 0x0006
          Data: 02
zephyr.exe[123210]: < HCI Command: Host Number of Completed Packets (0x03|0x0035) plen 5                           #209 15.673542
        Num handles: 1
        Handle: 255 Address: DF:A9:FF:F6:B1:1A (OUI DF-A9-FF)
        Count: 1
zephyr.exe[123210]: < ACL Data TX: Handle 255 flags 0x00 dlen 5                                                    #210 15.673632
      ATT: Write Response (0x13) len 0
> HCI Event: Number of Completed Packets (0x13) plen 5                                                             #211 15.844356
        Num handles: 1
        Handle: 255 Address: DF:A9:FF:F6:B1:1A (OUI DF-A9-FF)
        Count: 1
        #210: len 5 (0 Kb/s)
        Latency: 170 msec (133-171 msec ~165 msec)
> ACL Data RX: Handle 255 flags 0x02 dlen 11                                                                       #212 18.381855
      SMP: Pairing Request (0x01) len 6
        IO capability: KeyboardDisplay (0x04)
        OOB data: Authentication data not present (0x00)
        Authentication requirement: Bonding, No MITM, Legacy, No Keypresses (0x01)
        Max encryption key size: 16
        Initiator key distribution: EncKey IdKey Sign (0x07)
        Responder key distribution: EncKey IdKey Sign (0x07)
zephyr.exe[123210]: < HCI Command: Host Number of Completed Packets (0x03|0x0035) plen 5                           #213 18.393153
        Num handles: 1
        Handle: 255 Address: DF:A9:FF:F6:B1:1A (OUI DF-A9-FF)
        Count: 1
zephyr.exe[123210]: < ACL Data TX: Handle 255 flags 0x00 dlen 11                                                   #214 18.393267
      SMP: Pairing Response (0x02) len 6
        IO capability: DisplayOnly (0x00)
        OOB data: Authentication data not present (0x00)
        Authentication requirement: Bonding, No MITM, Legacy, No Keypresses (0x01)
        Max encryption key size: 16
        Initiator key distribution: EncKey IdKey (0x03)
        Responder key distribution: EncKey (0x01)
> HCI Event: Number of Completed Packets (0x13) plen 5                                                             #215 18.556987
        Num handles: 1
        Handle: 255 Address: DF:A9:FF:F6:B1:1A (OUI DF-A9-FF)
        Count: 1
        #214: len 11 (0 Kb/s)
        Latency: 163 msec (133-171 msec ~164 msec)
> ACL Data RX: Handle 255 flags 0x02 dlen 21                                                                       #216 18.557356
      SMP: Pairing Confirm (0x03) len 16
        Confim value: 313404c7ec5c995adde8ba5120d4b2c2
zephyr.exe[123210]: < HCI Command: Host Number of Completed Packets (0x03|0x0035) plen 5                           #217 18.573744
        Num handles: 1
        Handle: 255 Address: DF:A9:FF:F6:B1:1A (OUI DF-A9-FF)
        Count: 1
zephyr.exe[123210]: < ACL Data TX: Handle 255 flags 0x00 dlen 21                                                   #218 18.573811
      SMP: Pairing Confirm (0x03) len 16
        Confim value: 8969af0e8f23031861649695c246fddc
> HCI Event: Number of Completed Packets (0x13) plen 5                                                             #219 18.731936
        Num handles: 1
        Handle: 255 Address: DF:A9:FF:F6:B1:1A (OUI DF-A9-FF)
        Count: 1
        #218: len 21 (1 Kb/s)
        Latency: 158 msec (133-171 msec ~161 msec)
> ACL Data RX: Handle 255 flags 0x02 dlen 21                                                                       #220 18.732250
      SMP: Pairing Random (0x04) len 16
        Random value: 9aa4934babc73c030000000000000000
zephyr.exe[123210]: < HCI Command: Host Number of Completed Packets (0x03|0x0035) plen 5                           #221 18.733687
        Num handles: 1
        Handle: 255 Address: DF:A9:FF:F6:B1:1A (OUI DF-A9-FF)
        Count: 1
zephyr.exe[123210]: < ACL Data TX: Handle 255 flags 0x00 dlen 21                                                   #222 18.733776
      SMP: Pairing Random (0x04) len 16
        Random value: 8e6108f966a694cbe26df70bb96773e6
> HCI Event: Number of Completed Packets (0x13) plen 5                                                             #223 18.906818
        Num handles: 1
        Handle: 255 Address: DF:A9:FF:F6:B1:1A (OUI DF-A9-FF)
        Count: 1
        #222: len 21 (0 Kb/s)
        Latency: 173 msec (133-173 msec ~167 msec)
> HCI Event: LE Meta Event (0x3e) plen 13                                                                          #224 18.994818
      LE Long Term Key Request (0x05)
        Handle: 255 Address: DF:A9:FF:F6:B1:1A (OUI DF-A9-FF)
        Random number: 0x0000000000000000
        Encrypted diversifier: 0x0000
zephyr.exe[123210]: < HCI Command: LE Long Term Key Request Reply (0x08|0x001a) plen 18                            #225 19.013134
        Handle: 255 Address: DF:A9:FF:F6:B1:1A (OUI DF-A9-FF)
        Long term key: 28d2f4864fda7fd2ab23019f28712d0d
> HCI Event: Command Complete (0x0e) plen 6                                                                        #226 19.013893
      LE Long Term Key Request Reply (0x08|0x001a) ncmd 1
        Status: Success (0x00)
        Handle: 255 Address: DF:A9:FF:F6:B1:1A (OUI DF-A9-FF)
> HCI Event: Encryption Change (0x08) plen 4                                                                       #227 19.432035
        Status: Success (0x00)
        Handle: 255 Address: DF:A9:FF:F6:B1:1A (OUI DF-A9-FF)
        Encryption: Enabled with AES-CCM (0x01)
zephyr.exe[123210]: < ACL Data TX: Handle 255 flags 0x00 dlen 21                                                   #228 19.543081
      SMP: Encryption Information (0x06) len 16
        Long term key: 5da095555cc64d02679f89a05211af56
zephyr.exe[123210]: < ACL Data TX: Handle 255 flags 0x00 dlen 15                                                   #229 19.543090
      SMP: Central Identification (0x07) len 10
        EDIV: 0x825e
        Rand: 0x84c81ed264dab3d8
> HCI Event: Number of Completed Packets (0x13) plen 5                                                             #230 19.607461
        Num handles: 1
        Handle: 255 Address: DF:A9:FF:F6:B1:1A (OUI DF-A9-FF)
        Count: 1
        #228: len 21 (2 Kb/s)
        Latency: 64 msec (64-173 msec ~115 msec)
> HCI Event: Number of Completed Packets (0x13) plen 5                                                             #231 19.694438
        Num handles: 1
        Handle: 255 Address: DF:A9:FF:F6:B1:1A (OUI DF-A9-FF)
        Count: 1
        #229: len 15 (0 Kb/s)
        Latency: 151 msec (64-173 msec ~133 msec)
> ACL Data RX: Handle 255 flags 0x02 dlen 21                                                                       #232 19.694719
      SMP: Encryption Information (0x06) len 16
        Long term key: 48f0df9361e57f73bf1269a1ac24e260
> ACL Data RX: Handle 255 flags 0x02 dlen 15                                                                       #233 19.695128
      SMP: Central Identification (0x07) len 10
        EDIV: 0x7311
        Rand: 0xf420328e34c49a2f
> ACL Data RX: Handle 255 flags 0x02 dlen 21                                                                       #234 19.695788
      SMP: Identity Information (0x08) len 16
        Identity resolving key: a1271f09874b7311a2a1bc94428aeb8f
zephyr.exe[123210]: < HCI Command: Host Number of Completed Packets (0x03|0x0035) plen 5                           #235 19.713207
        Num handles: 1
        Handle: 255 Address: DF:A9:FF:F6:B1:1A (OUI DF-A9-FF)
        Count: 1
zephyr.exe[123210]: < HCI Command: Host Number of Completed Packets (0x03|0x0035) plen 5                           #236 19.713325
        Num handles: 1
        Handle: 255 Address: DF:A9:FF:F6:B1:1A (OUI DF-A9-FF)
        Count: 1
zephyr.exe[123210]: < HCI Command: Host Number of Completed Packets (0x03|0x0035) plen 5                           #237 19.713329
        Num handles: 1
        Handle: 255 Address: DF:A9:FF:F6:B1:1A (OUI DF-A9-FF)
        Count: 1
> ACL Data RX: Handle 255 flags 0x02 dlen 12                                                                       #238 19.781898
      SMP: Identity Address Information (0x09) len 7
        Address: DF:A9:FF:F6:B1:1A (OUI DF-A9-FF)
> ACL Data RX: Handle 255 flags 0x02 dlen 26                                                                       #239 19.782746
      LE L2CAP: Enhanced Credit Connection Request (0x17) ident 1 len 18
        PSM: 39 (0x0027)
        MTU: 64
        MPS: 64
        Credits: 5
        Source CID: 84
        Source CID: 83
        Source CID: 82
        Source CID: 81
        Source CID: 80
zephyr.exe[123210]: < HCI Command: LE Add Device To Resolving List (0x08|0x0027) plen 39                           #240 19.793544
        Address type: Public (0x00)
        Address: DF:A9:FF:F6:B1:1A (OUI DF-A9-FF)
        Peer identity resolving key: a1271f09874b7311a2a1bc94428aeb8f
        Local identity resolving key: 00000000000000000000000000000000
> HCI Event: Command Complete (0x0e) plen 4                                                                        #241 19.794503
      LE Add Device To Resolving List (0x08|0x0027) ncmd 1
        Status: Success (0x00)
zephyr.exe[123210]: < HCI Command: LE Set Privacy Mode (0x08|0x004e) plen 8                                        #242 19.813250
        Peer Identity address type: Public (0x00)
        Peer Identity address: DF:A9:FF:F6:B1:1A (OUI DF-A9-FF)
        Privacy Mode: Use Device Privacy (0x01)
> HCI Event: Command Complete (0x0e) plen 4                                                                        #243 19.813837
      LE Set Privacy Mode (0x08|0x004e) ncmd 1
        Status: Success (0x00)
zephyr.exe[123210]: < HCI Command: LE Set Address Resolution Enable (0x08|0x002d) plen 1                           #244 19.833300
        Address resolution: Enabled (0x01)
> HCI Event: Command Complete (0x0e) plen 4                                                                        #245 19.833757
      LE Set Address Resolution Enable (0x08|0x002d) ncmd 1
        Status: Success (0x00)
zephyr.exe[123210]: < HCI Command: Host Number of Completed Packets (0x03|0x0035) plen 5                           #246 19.852998
        Num handles: 1
        Handle: 255 Address: DF:A9:FF:F6:B1:1A (OUI DF-A9-FF)
        Count: 1
zephyr.exe[123210]: < HCI Command: Host Number of Completed Packets (0x03|0x0035) plen 5                           #247 19.853264
        Num handles: 1
        Handle: 255 Address: DF:A9:FF:F6:B1:1A (OUI DF-A9-FF)
        Count: 1
zephyr.exe[123210]: < ACL Data TX: Handle 255 flags 0x00 dlen 26                                                   #248 19.853291
      LE L2CAP: Enhanced Credit Connection Response (0x18) ident 1 len 18
        MTU: 249
        MPS: 251
        Credits: 1
        Result: Connection successful (0x0000)
        Destination CID: 64
        Destination CID: 65
        Destination CID: 66
        Destination CID: 67
        Destination CID: 68
> HCI Event: Number of Completed Packets (0x13) plen 5                                                             #249 19.956770
        Num handles: 1
        Handle: 255 Address: DF:A9:FF:F6:B1:1A (OUI DF-A9-FF)
        Count: 1
        #248: len 26 (2 Kb/s)
        Latency: 103 msec (64-173 msec ~118 msec)
> ACL Data RX: Handle 255 flags 0x02 dlen 13                                                                       #250 21.881982
      Channel: 68 len 9 sdu 7 [PSM 39 mode Enhanced Credit (0x81)] {chan 4}
      ATT: Read By Group Type Request (0x10) len 6
        Handle range: 0x0001-0xffff
        Attribute group type: Primary Service (0x2800)
zephyr.exe[123210]: < HCI Command: Host Number of Completed Packets (0x03|0x0035) plen 5                           #251 21.893553
        Num handles: 1
        Handle: 255 Address: DF:A9:FF:F6:B1:1A (OUI DF-A9-FF)
        Count: 1
zephyr.exe[123210]: < ACL Data TX: Handle 255 flags 0x00 dlen 27                                                   #252 21.893826
zephyr.exe[123210]: < ACL Data TX: Handle 255 flags 0x01 dlen 5                                                    #253 21.893843
      Channel: 80 len 28 sdu 26 [PSM 39 mode Enhanced Credit (0x81)] {chan 4}
      ATT: Read By Group Type Response (0x11) len 25
        Attribute data length: 6
        Attribute group list: 4 entries
        Handle range: 0x0001-0x000a
        UUID: Generic Attribute Profile (0x1801)
        Handle range: 0x000b-0x0011
        UUID: Generic Access Profile (0x1800)
        Handle range: 0x0012-0x0020
        UUID: Device Information (0x180a)
        Handle range: 0x003d-0x004b
        UUID: Unknown (0x41aa)
zephyr.exe[123210]: < ACL Data TX: Handle 255 flags 0x00 dlen 12                                                   #254 21.894054
      LE L2CAP: LE Flow Control Credit (0x16) ident 2 len 4
        Source CID: 68
        Credits: 1
> HCI Event: Number of Completed Packets (0x13) plen 5                                                             #255 21.969847
        Num handles: 1
        Handle: 255 Address: DF:A9:FF:F6:B1:1A (OUI DF-A9-FF)
        Count: 1
        #252: len 27 (2 Kb/s)
        Latency: 76 msec (64-173 msec ~97 msec)
        Channel: 80 [PSM 39 mode Enhanced Credit (0x81)] {chan 4}
        Channel Latency: 76 msec (76-76 msec ~76 msec)
> HCI Event: Number of Completed Packets (0x13) plen 5                                                             #256 21.970320
        Num handles: 1
        Handle: 255 Address: DF:A9:FF:F6:B1:1A (OUI DF-A9-FF)
        Count: 1
        #253: len 5 (0 Kb/s)
        Latency: 76 msec (64-173 msec ~86 msec)
        Channel: 80 [PSM 39 mode Enhanced Credit (0x81)] {chan 4}
        Channel Latency: 76 msec (76-76 msec ~76 msec)
> HCI Event: Number of Completed Packets (0x13) plen 5                                                             #257 22.057016
        Num handles: 1
        Handle: 255 Address: DF:A9:FF:F6:B1:1A (OUI DF-A9-FF)
        Count: 1
        #254: len 12 (0 Kb/s)
        Latency: 162 msec (64-173 msec ~124 msec)
> ACL Data RX: Handle 255 flags 0x02 dlen 13                                                                       #258 22.057164
      Channel: 68 len 9 sdu 7 [PSM 39 mode Enhanced Credit (0x81)] {chan 4}
      ATT: Read By Group Type Request (0x10) len 6
        Handle range: 0x004c-0xffff
        Attribute group type: Primary Service (0x2800)
zephyr.exe[123210]: < HCI Command: Host Number of Completed Packets (0x03|0x0035) plen 5                           #259 22.073673
        Num handles: 1
        Handle: 255 Address: DF:A9:FF:F6:B1:1A (OUI DF-A9-FF)
        Count: 1
zephyr.exe[123210]: < ACL Data TX: Handle 255 flags 0x00 dlen 11                                                   #260 22.073825
      Channel: 80 len 7 sdu 5 [PSM 39 mode Enhanced Credit (0x81)] {chan 4}
      ATT: Error Response (0x01) len 4
        Read By Group Type Request (0x10)
        Handle: 0x004c
        Error: Attribute Not Found (0x0a)
zephyr.exe[123210]: < ACL Data TX: Handle 255 flags 0x00 dlen 12                                                   #261 22.074019
      LE L2CAP: LE Flow Control Credit (0x16) ident 3 len 4
        Source CID: 68
        Credits: 1
> HCI Event: Number of Completed Packets (0x13) plen 5                                                             #262 22.144753
        Num handles: 1
        Handle: 255 Address: DF:A9:FF:F6:B1:1A (OUI DF-A9-FF)
        Count: 1
        #260: len 11 (1 Kb/s)
        Latency: 70 msec (64-173 msec ~97 msec)
        Channel: 80 [PSM 39 mode Enhanced Credit (0x81)] {chan 4}
        Channel Latency: 70 msec (70-76 msec ~73 msec)
> HCI Event: Number of Completed Packets (0x13) plen 5                                                             #263 22.231727
        Num handles: 1
        Handle: 255 Address: DF:A9:FF:F6:B1:1A (OUI DF-A9-FF)
        Count: 1
        #261: len 12 (0 Kb/s)
        Latency: 157 msec (64-173 msec ~127 msec)
        Channel: 80 [PSM 39 mode Enhanced Credit (0x81)] {chan 4}
        Channel Latency: 157 msec (70-157 msec ~115 msec)
> ACL Data RX: Handle 255 flags 0x02 dlen 13                                                                       #264 22.232024
      Channel: 68 len 9 sdu 7 [PSM 39 mode Enhanced Credit (0x81)] {chan 4}
      ATT: Read By Type Request (0x08) len 6
        Handle range: 0x0001-0x000a
        Attribute type: Characteristic (0x2803)
zephyr.exe[123210]: < HCI Command: Host Number of Completed Packets (0x03|0x0035) plen 5                           #265 22.233512
        Num handles: 1
        Handle: 255 Address: DF:A9:FF:F6:B1:1A (OUI DF-A9-FF)
        Count: 1
zephyr.exe[123210]: < ACL Data TX: Handle 255 flags 0x00 dlen 27                                                   #266 22.233611
zephyr.exe[123210]: < ACL Data TX: Handle 255 flags 0x01 dlen 9                                                    #267 22.233742
      Channel: 80 len 32 sdu 30 [PSM 39 mode Enhanced Credit (0x81)] {chan 4}
      ATT: Read By Type Response (0x09) len 29
        Attribute data length: 7
        Attribute data list: 4 entries
        Handle: 0x0002
        Value: 200300052a
            Properties: 0x20
              Indicate (0x20)
            Value Handle: 0x0003
            Value UUID: Service Changed (0x2a05)
        Handle: 0x0005
        Value: 0a0600292b
            Properties: 0x0a
              Read (0x02)
              Write (0x08)
            Value Handle: 0x0006
            Value UUID: Client Supported Features (0x2b29)
        Handle: 0x0007
        Value: 0208002a2b
            Properties: 0x02
              Read (0x02)
            Value Handle: 0x0008
            Value UUID: Database Hash (0x2b2a)
        Handle: 0x0009
        Value: 020a003a2b
            Properties: 0x02
              Read (0x02)
            Value Handle: 0x000a
            Value UUID: Server Supported Features (0x2b3a)
zephyr.exe[123210]: < ACL Data TX: Handle 255 flags 0x00 dlen 12                                                   #268 22.233886
      LE L2CAP: LE Flow Control Credit (0x16) ident 4 len 4
        Source CID: 68
        Credits: 1
> HCI Event: Number of Completed Packets (0x13) plen 5                                                             #269 22.319867
        Num handles: 1
        Handle: 255 Address: DF:A9:FF:F6:B1:1A (OUI DF-A9-FF)
        Count: 1
        #266: len 27 (2 Kb/s)
        Latency: 86 msec (64-173 msec ~107