Bluetooth monitor ver 5.72
btmon[2478699]: = Note: Linux version 6.14.0-36-generic (x86_64)                                                         0.567394
btmon[2478699]: = Note: Bluetooth subsystem version 2.22                                                                 0.567397
= New Index: 00:00:00:00:00:00 (Primary,UART,hci1)                                                                       0.567398
= New Index: 48:5F:99:8E:E0:64 (Primary,USB,hci0)                                                                        0.567398
= Open Index: 00:00:00:00:00:00                                                                                          1.082646
= Index Info: 00:00:00:00:00:00 (Nordic Semiconductor ASA)                                                               1.082663
zephyr.exe[2478701]: @ USER Open: main (privileged) version 2.22                                                {0x0001} 1.082673
zephyr.exe[2478701]: < HCI Command: Reset (0x03|0x0003) plen 0                                                        #1 1.083790
> HCI Event: Command Complete (0x0e) plen 4                                                                           #2 1.084285
      Reset (0x03|0x0003) ncmd 1
        Status: Success (0x00)
zephyr.exe[2478701]: < HCI Command: Read Local Supported Features (0x04|0x0003) plen 0                                #3 1.102522
> HCI Event: Command Complete (0x0e) plen 12                                                                          #4 1.102973
      Read Local Supported Features (0x04|0x0003) ncmd 1
        Status: Success (0x00)
        Features: 0x00 0x00 0x00 0x00 0x60 0x00 0x00 0x00
          BR/EDR Not Supported
          LE Supported (Controller)
zephyr.exe[2478701]: < HCI Command: Read Local Version Information (0x04|0x0001) plen 0                               #5 1.122203
> HCI Event: Command Complete (0x0e) plen 12                                                                          #6 1.122707
      Read Local Version Information (0x04|0x0001) ncmd 1
        Status: Success (0x00)
        HCI version: Reserved (0x0f) - Revision 12393 (0x3069)
        LMP version: Reserved (0x0f) - Subversion 12393 (0x3069)
        Manufacturer: Nordic Semiconductor ASA (89)
zephyr.exe[2478701]: < HCI Command: Read Local Supported Commands (0x04|0x0002) plen 0                                #7 1.142164
> HCI Event: Command Complete (0x0e) plen 68                                                                          #8 1.143229
      Read Local Supported Commands (0x04|0x0002) ncmd 1
        Status: Success (0x00)
        Commands: 119 entries
          Disconnect (Octet 0 - Bit 5)
          Read Remote Version Information (Octet 2 - Bit 7)
          Set Event Mask (Octet 5 - Bit 6)
          Reset (Octet 5 - Bit 7)
          Read Connection Accept Timeout (Octet 7 - Bit 2)
          Write Connection Accept Timeout (Octet 7 - Bit 3)
          Read Transmit Power Level (Octet 10 - Bit 2)
          Set Controller To Host Flow Control (Octet 10 - Bit 5)
          Host Buffer Size (Octet 10 - Bit 6)
          Host Number of Completed Packets (Octet 10 - Bit 7)
          Read Local Version Information (Octet 14 - Bit 3)
          Read Local Supported Features (Octet 14 - Bit 5)
          Read BD ADDR (Octet 15 - Bit 1)
          Read RSSI (Octet 15 - Bit 5)
          Set Event Mask Page 2 (Octet 22 - Bit 2)
          LE Set Event Mask (Octet 25 - Bit 0)
          LE Read Buffer Size (Octet 25 - Bit 1)
          LE Read Local Supported Features (Octet 25 - Bit 2)
          LE Set Random Address (Octet 25 - Bit 4)
          LE Set Advertising Parameters (Octet 25 - Bit 5)
          LE Read Advertising Channel TX Power (Octet 25 - Bit 6)
          LE Set Advertising Data (Octet 25 - Bit 7)
          LE Set Scan Response Data (Octet 26 - Bit 0)
          LE Set Advertise Enable (Octet 26 - Bit 1)
          LE Set Scan Parameters (Octet 26 - Bit 2)
          LE Set Scan Enable (Octet 26 - Bit 3)
          LE Create Connection (Octet 26 - Bit 4)
          LE Create Connection Cancel (Octet 26 - Bit 5)
          LE Read Accept List Size (Octet 26 - Bit 6)
          LE Clear Accept List (Octet 26 - Bit 7)
          LE Add Device To Accept List (Octet 27 - Bit 0)
          LE Remove Device From Accept List (Octet 27 - Bit 1)
          LE Connection Update (Octet 27 - Bit 2)
          LE Set Host Channel Classification (Octet 27 - Bit 3)
          LE Read Channel Map (Octet 27 - Bit 4)
          LE Read Remote Used Features (Octet 27 - Bit 5)
          LE Encrypt (Octet 27 - Bit 6)
          LE Rand (Octet 27 - Bit 7)
          LE Start Encryption (Octet 28 - Bit 0)
          LE Long Term Key Request Reply (Octet 28 - Bit 1)
          LE Long Term Key Request Neg Reply (Octet 28 - Bit 2)
          LE Read Supported States (Octet 28 - Bit 3)
          LE Receiver Test (Octet 28 - Bit 4)
          LE Transmitter Test (Octet 28 - Bit 5)
          LE Test End (Octet 28 - Bit 6)
          Read Authenticated Payload Timeout (Octet 32 - Bit 4)
          Write Authenticated Payload Timeout (Octet 32 - Bit 5)
          LE Set Data Length (Octet 33 - Bit 6)
          LE Read Suggested Default Data Length (Octet 33 - Bit 7)
          LE Write Suggested Default Data Length (Octet 34 - Bit 0)
          LE Add Device To Resolving List (Octet 34 - Bit 3)
          LE Remove Device From Resolving List (Octet 34 - Bit 4)
          LE Clear Resolving List (Octet 34 - Bit 5)
          LE Read Resolving List Size (Octet 34 - Bit 6)
          LE Set Address Resolution Enable (Octet 35 - Bit 1)
          LE Set Resolvable Private Address Timeout (Octet 35 - Bit 2)
          LE Read Maximum Data Length (Octet 35 - Bit 3)
          LE Read PHY (Octet 35 - Bit 4)
          LE Set Default PHY (Octet 35 - Bit 5)
          LE Set PHY (Octet 35 - Bit 6)
          LE Enhanced Receiver Test (Octet 35 - Bit 7)
          LE Enhanced Transmitter Test (Octet 36 - Bit 0)
          LE Set Advertising Set Random Address (Octet 36 - Bit 1)
          LE Set Extended Advertising Parameters (Octet 36 - Bit 2)
          LE Set Extended Advertising Data (Octet 36 - Bit 3)
          LE Set Extended Scan Response Data (Octet 36 - Bit 4)
          LE Set Extended Advertising Enable (Octet 36 - Bit 5)
          LE Read Maximum Advertising Data Length (Octet 36 - Bit 6)
          LE Read Number of Supported Advertising Sets (Octet 36 - Bit 7)
          LE Remove Advertising Set (Octet 37 - Bit 0)
          LE Clear Advertising Sets (Octet 37 - Bit 1)
          LE Set Periodic Advertising Parameters (Octet 37 - Bit 2)
          LE Set Periodic Advertising Data (Octet 37 - Bit 3)
          LE Set Periodic Advertising Enable (Octet 37 - Bit 4)
          LE Set Extended Scan Parameters (Octet 37 - Bit 5)
          LE Set Extended Scan Enable (Octet 37 - Bit 6)
          LE Extended Create Connection (Octet 37 - Bit 7)
          LE Periodic Advertising Create Sync (Octet 38 - Bit 0)
          LE Periodic Advertising Create Sync Cancel (Octet 38 - Bit 1)
          LE Periodic Advertising Terminate Sync (Octet 38 - Bit 2)
          LE Add Device To Periodic Advertiser List (Octet 38 - Bit 3)
          LE Remove Device From Periodic Advertiser List (Octet 38 - Bit 4)
          LE Clear Periodic Advertiser List (Octet 38 - Bit 5)
          LE Read Periodic Advertiser List Size (Octet 38 - Bit 6)
          LE Read Transmit Power (Octet 38 - Bit 7)
          LE Read RF Path Compensation (Octet 39 - Bit 0)
          LE Write RF Path Compensation (Octet 39 - Bit 1)
          LE Set Privacy Mode (Octet 39 - Bit 2)
          LE Periodic Advertising Receive Enable (Octet 40 - Bit 5)
          LE Periodic Advertising Sync Transfer (Octet 40 - Bit 6)
          LE Periodic Advertising Set Info Transfer (Octet 40 - Bit 7)
          LE Periodic Advertising Sync Transfer Parameters (Octet 41 - Bit 0)
          LE Set Default Periodic Advertisng Sync Transfer Parameters (Octet 41 - Bit 1)
          LE Read Buffer v2 (Octet 41 - Bit 5)
          LE Read ISO TX Sync (Octet 41 - Bit 6)
          LE Set Connected Isochronous Group Parameters (Octet 41 - Bit 7)
          LE Set Connected Isochronous Group Parameters Test (Octet 42 - Bit 0)
          LE Create Connected Isochronous Stream (Octet 42 - Bit 1)
          LE Remove Connected Isochronous Group (Octet 42 - Bit 2)
          LE Accept Connected Isochronous Stream Request (Octet 42 - Bit 3)
          LE Reject Connected Isochronous Stream Request (Octet 42 - Bit 4)
          LE Create Broadcast Isochronous Group (Octet 42 - Bit 5)
          LE Create Broadcast Isochronous Group Test (Octet 42 - Bit 6)
          LE Terminate Broadcast Isochronous Group (Octet 42 - Bit 7)
          LE Broadcast Isochronous Group Create Sync (Octet 43 - Bit 0)
          LE Broadcast Isochronous Group Terminate Sync (Octet 43 - Bit 1)
          LE Request Peer SCA (Octet 43 - Bit 2)
          LE Setup Isochronous Data Path (Octet 43 - Bit 3)
          LE Remove Isochronous Data Path (Octet 43 - Bit 4)
          LE Isochronous Transmit Test (Octet 43 - Bit 5)
          LE Isochronous Receive Test (Octet 43 - Bit 6)
          LE Isochronous Read Test Counters (Octet 43 - Bit 7)
          LE Isochronous Read Test Counters (Octet 44 - Bit 0)
          LE Set Host Feature (Octet 44 - Bit 1)
          Octet 44 - Bit 2 
          Octet 45 - Bit 6 
          Octet 46 - Bit 0 
          Octet 46 - Bit 1 
          Octet 46 - Bit 2 
zephyr.exe[2478701]: < HCI Command: Host Buffer Size (0x03|0x0033) plen 7                                             #9 1.162168
        ACL MTU: 255  ACL max packet: 16
        SCO MTU: 0    SCO max packet: 0
> HCI Event: Command Complete (0x0e) plen 4                                                                          #10 1.162716
      Host Buffer Size (0x03|0x0033) ncmd 1
        Status: Success (0x00)
zephyr.exe[2478701]: < HCI Command: Set Controller To Host Flow Control (0x03|0x0031) plen 1                         #11 1.182162
        Flow control: ACL Data Packets (0x01)
> HCI Event: Command Complete (0x0e) plen 4                                                                          #12 1.182556
      Set Controller To Host Flow Control (0x03|0x0031) ncmd 1
        Status: Success (0x00)
zephyr.exe[2478701]: < HCI Command: LE Read Local Supported Features (0x08|0x0003) plen 0                            #13 1.202167
> HCI Event: Command Complete (0x0e) plen 12                                                                         #14 1.202636
      LE Read Local Supported Features (0x08|0x0003) ncmd 1
        Status: Success (0x00)
        Features: 0xfd 0x79 0x00 0xf7 0x30 0x01 0x00 0x00
          LE Encryption
          Extended Reject Indication
          Peripheral-initiated Features Exchange
          LE Ping
          LE Data Packet Length Extension
          LL Privacy
          Extended Scanner Filter Policies
          LE 2M PHY
          LE Coded PHY
          LE Extended Advertising
          LE Periodic Advertising
          Channel Selection Algorithm #2
          Periodic Advertising Sync Transfer - Sender
          Periodic Advertising Sync Transfer - Recipient
          Sleep Clock Accuracy Updates
          Connected Isochronous Stream - Central
          Connected Isochronous Stream - Peripheral
          Isochronous Broadcaster
          Synchronized Receiver
          Periodic Advertising ADI support
          Connection Subrating
          Unknown features (0x0000010000000000)
zephyr.exe[2478701]: < HCI Command: LE Set Host Feature (0x08|0x0074) plen 2                                         #15 1.222192
        Bit Number: 32
          Connected Isochronous Stream (Host Support)
        Bit Value: 1
> HCI Event: Command Complete (0x0e) plen 4                                                                          #16 1.222669
      LE Set Host Feature (0x08|0x0074) ncmd 1
        Status: Success (0x00)
zephyr.exe[2478701]: < HCI Command: LE Read Buffer v2 (0x08|0x0060) plen 0                                           #17 1.242131
> HCI Event: Command Complete (0x0e) plen 10                                                                         #18 1.242566
      LE Read Buffer v2 (0x08|0x0060) ncmd 1
        Status: Success (0x00)
        ACL MTU: 27
        ACL max packet: 3
        ISO MTU: 318
        ISO max packet: 3
zephyr.exe[2478701]: < HCI Command: LE Read Maximum Advertising Data Length (0x08|0x003a) plen 0                     #19 1.262172
> HCI Event: Command Complete (0x0e) plen 6                                                                          #20 1.262746
      LE Read Maximum Advertising Data Length (0x08|0x003a) ncmd 1
        Status: Success (0x00)
        Max length: 1650
zephyr.exe[2478701]: < HCI Command: LE Read Supported States (0x08|0x001c) plen 0                                    #21 1.282160
> HCI Event: Command Complete (0x0e) plen 12                                                                         #22 1.282658
      LE Read Supported States (0x08|0x001c) ncmd 1
        Status: Success (0x00)
        States: 0x000003ff3e0306ff
          Non-connectable Advertising State
          Scannable Advertising State
          Connectable Advertising State
          High Duty Cycle Directed Advertising State
          Passive Scanning State
          Active Scanning State
          Initiating State
            and Connection State (Central Role)
          Connection State (Peripheral Role)
          Scannable Advertising State
            and Passive Scanning State
          Connectable Advertising State
            and Passive Scanning State
          Non-connectable Advertising State
            and Initiating State
          Scannable Advertising State
            and Initiating State
          Active Scanning State
            and Connection State (Central Role)
          Passive Scanning State
            and Connection State (Peripheral Role)
          Active Scanning State
            and Connection State (Peripheral Role)
          Initiating State
            and Connection State (Central Role)
            and Central Role & Central Role
          Low Duty Cycle Directed Advertising State
          Connectable Advertising State
            and Initiating State
            and Central Role & Peripheral Role
          High Duty Cycle Directed Advertising State
            and Initiating State
            and Central Role & Peripheral Role
          Low Duty Cycle Directed Advertising State
            and Initiating State
            and Central Role & Peripheral Role
          Connectable Advertising State
            and Connection State (Central Role)
            and Central Role & Peripheral Role
          High Duty Cycle Directed Advertising State
            and Connection State (Central Role)
            and Central Role & Peripheral Role
          Low Duty Cycle Directed Advertising State
            and Connection State (Central Role)
            and Central Role & Peripheral Role
          Connectable Advertising State
            and Connection State (Peripheral Role)
            and Central Role & Peripheral Role
          High Duty Cycle Directed Advertising State
            and Connection State (Peripheral Role)
            and Peripheral Role & Peripheral Role
          Low Duty Cycle Directed Advertising State
            and Connection State (Peripheral Role)
            and Peripheral Role & Peripheral Role
          Initiating State
            and Connection State (Peripheral Role)
            and Central Role & Peripheral Role
zephyr.exe[2478701]: < HCI Command: LE Read Maximum Data Length (0x08|0x002f) plen 0                                 #23 1.302166
> HCI Event: Command Complete (0x0e) plen 12                                                                         #24 1.302647
      LE Read Maximum Data Length (0x08|0x002f) ncmd 1
        Status: Success (0x00)
        Max TX octets: 251
        Max TX time: 2704
        Max RX octets: 251
        Max RX time: 2704
zephyr.exe[2478701]: < HCI Command: LE Write Suggested Default Data Length (0x08|0x0024) plen 4                      #25 1.322165
        TX octets: 251
        TX time: 2704
> HCI Event: Command Complete (0x0e) plen 4                                                                          #26 1.322660
      LE Write Suggested Default Data Length (0x08|0x0024) ncmd 1
        Status: Success (0x00)
zephyr.exe[2478701]: < HCI Command: LE Read Resolving List Size (0x08|0x002a) plen 0                                 #27 1.342174
> HCI Event: Command Complete (0x0e) plen 5                                                                          #28 1.342620
      LE Read Resolving List Size (0x08|0x002a) ncmd 1
        Status: Success (0x00)
        Size: 8
zephyr.exe[2478701]: < HCI Command: LE Set Event Mask (0x08|0x0001) plen 8                                           #29 1.362167
        Mask: 0x000002023f87fa5e
          LE Advertising Report
          LE Connection Update Complete
          LE Read Remote Used Features Complete
          LE Long Term Key Request
          LE Data Length Change
          LE Enhanced Connection Complete
          LE PHY Update Complete
          LE Extended Advertising Report
          LE Periodic Advertising Sync Established
          LE Periodic Advertising Report
          LE Periodic Advertising Sync Lost
          LE Extended Scan Timeout
          LE Extended Advertising Set Terminated
          LE Scan Request Received
          LE Periodic Advertising Sync Transfer Rvc
          LE CIS Established
          LE CIS Request
          LE Create BIG Complete
          LE Terminate BIG Complete
          LE BIG Sync Estabilished Complete
          LE BIG Sync Lost
          LE BIG Info Advertising Report
          Unknown mask (0x0000020000000000)
> HCI Event: Command Complete (0x0e) plen 4                                                                          #30 1.362668
      LE Set Event Mask (0x08|0x0001) ncmd 1
        Status: Success (0x00)
zephyr.exe[2478701]: < HCI Command: Set Event Mask (0x03|0x0001) plen 8                                              #31 1.382172
        Mask: 0x2000800002008890
          Disconnection Complete
          Encryption Change
          Read Remote Version Information Complete
          Hardware Error
          Data Buffer Overflow
          Encryption Key Refresh Complete
          LE Meta
> HCI Event: Command Complete (0x0e) plen 4                                                                          #32 1.382727
      Set Event Mask (0x03|0x0001) ncmd 1
        Status: Success (0x00)
zephyr.exe[2478701]: < HCI Command: Read BD ADDR (0x04|0x0009) plen 0                                                #33 1.402166
> HCI Event: Command Complete (0x0e) plen 10                                                                         #34 1.402723
      Read BD ADDR (0x04|0x0009) ncmd 1
        Status: Success (0x00)
        Address: 00:00:00:00:00:00 (OUI 00-00-00)
zephyr.exe[2478701]: < HCI Command: LE Set Random Address (0x08|0x0005) plen 6                                       #35 1.422157
        Address: D5:B6:CC:31:DB:3B (Static)
> HCI Event: Command Complete (0x0e) plen 4                                                                          #36 1.422691
      LE Set Random Address (0x08|0x0005) ncmd 1
        Status: Success (0x00)
zephyr.exe[2478701]: < HCI Command: LE Set Extended Advertising Parameters (0x08|0x0036) plen 25                     #37 3.262177
        Handle: 0x00
        Properties: 0x0001
          Connectable
        Min advertising interval: 100.000 msec (0x00a0)
        Max advertising interval: 150.000 msec (0x00f0)
        Channel map: 37, 38, 39 (0x07)
        Own address type: Random (0x01)
        Peer address type: Public (0x00)
        Peer address: 00:00:00:00:00:00 (OUI 00-00-00)
        Filter policy: Allow Scan Request from Any, Allow Connect Request from Any (0x00)
        TX power: Host has no preference (0x7f)
        Primary PHY: LE 1M (0x01)
        Secondary max skip: 0x00
        Secondary PHY: LE 2M (0x02)
        SID: 0x00
        Scan request notifications: Disabled (0x00)
> HCI Event: Command Complete (0x0e) plen 5                                                                          #38 3.262896
      LE Set Extended Advertising Parameters (0x08|0x0036) ncmd 1
        Status: Success (0x00)
        TX power (selected): 0 dbm (0x00)
zephyr.exe[2478701]: < HCI Command: LE Set Advertising Set Random Address (0x08|0x0035) plen 7                       #39 3.282134
        Advertising handle: 0x00
        Advertising random address: D5:B6:CC:31:DB:3B (Static)
> HCI Event: Command Complete (0x0e) plen 4                                                                          #40 3.282654
      LE Set Advertising Set Random Address (0x08|0x0035) ncmd 1
        Status: Success (0x00)
zephyr.exe[2478701]: < HCI Command: LE Set Extended Advertising Data (0x08|0x0037) plen 30                           #41 3.302140
        Handle: 0x00
        Operation: Complete extended advertising data (0x03)
        Fragment preference: Minimize fragmentation (0x01)
        Data length: 0x1a
        Flags: 0x06
          LE General Discoverable Mode
          BR/EDR Not Supported
        Service Data: Common Audio (0x1853)
          Data: 01
        Service Data: Audio Stream Control (0x184e)
          Data: 014602420000
        Resolvable Set Identifier: 48-61-8E-0C-80-97
          Hash: 0x c8097
          Random: 0x48618e
> HCI Event: Command Complete (0x0e) plen 4                                                                          #42 3.303059
      LE Set Extended Advertising Data (0x08|0x0037) ncmd 1
        Status: Success (0x00)
zephyr.exe[2478701]: < HCI Command: LE Set Extended Advertising Enable (0x08|0x0039) plen 6                          #43 3.322166
        Extended advertising: Enabled (0x01)
        Number of sets: 1 (0x01)
        Entry 0
          Handle: 0x00
          Duration: 0 ms (0x00)
          Max ext adv events: 0
> HCI Event: Command Complete (0x0e) plen 4                                                                          #44 3.322720
      LE Set Extended Advertising Enable (0x08|0x0039) ncmd 1
        Status: Success (0x00)
> HCI Event: LE Meta Event (0x3e) plen 31                                                                            #45 5.312324
      LE Enhanced Connection Complete (0x0a)
        Status: Success (0x00)
        Handle: 57
        Role: Peripheral (0x01)
        Peer address type: Public (0x00)
        Peer address: DF:A9:FF:F6:B1:1A (OUI DF-A9-FF)
        Local resolvable private address: 00:00:00:00:00:00 (Non-Resolvable)
        Peer resolvable private address: 00:00:00:00:00:00 (Non-Resolvable)
        Connection interval: 100.00 msec (0x0050)
        Connection latency: 0 (0x0000)
        Supervision timeout: 25120 msec (0x09d0)
        Central clock accuracy: 0x01
> HCI Event: LE Meta Event (0x3e) plen 6                                                                             #46 5.312355
      LE Advertising Set Terminated (0x12)
        Status: Success (0x00)
        Handle: 0
        Connection handle: 57
        Number of completed extended advertising events: 0
zephyr.exe[2478701]: < HCI Command: LE Read Remote Used Features (0x08|0x0016) plen 2                                #47 5.323310
        Handle: 57 Address: DF:A9:FF:F6:B1:1A (OUI DF-A9-FF)
zephyr.exe[2478701]: < ACL Data TX: Handle 57 flags 0x00 dlen 7                                                      #48 5.323358
      ATT: Exchange MTU Request (0x02) len 2
        Client RX MTU: 251
> HCI Event: Command Status (0x0f) plen 4                                                                            #49 5.323980
      LE Read Remote Used Features (0x08|0x0016) ncmd 1
        Status: Success (0x00)
> HCI Event: Number of Completed Packets (0x13) plen 5                                                               #50 5.514213
        Num handles: 1
        Handle: 57 Address: DF:A9:FF:F6:B1:1A (OUI DF-A9-FF)
        Count: 1
        #48: len 7 (0 Kb/s)
        Latency: 190 msec (190-190 msec ~190 msec)
> HCI Event: LE Meta Event (0x3e) plen 12                                                                            #51 5.614667
      LE Read Remote Used Features (0x04)
        Status: Success (0x00)
        Handle: 57 Address: DF:A9:FF:F6:B1:1A (OUI DF-A9-FF)
        Features: 0x2d 0x49 0x00 0xf7 0x67 0xd8 0x00 0x00
          LE Encryption
          Extended Reject Indication
          Peripheral-initiated Features Exchange
          LE Data Packet Length Extension
          LE 2M PHY
          LE Coded PHY
          Channel Selection Algorithm #2
          Periodic Advertising Sync Transfer - Sender
          Periodic Advertising Sync Transfer - Recipient
          Sleep Clock Accuracy Updates
          Connected Isochronous Stream - Central
          Connected Isochronous Stream - Peripheral
          Isochronous Broadcaster
          Synchronized Receiver
          Connected Isochronous Stream (Host Support)
          LE Power Control Request
          LE Power Control Request
          Connection Subrating
          Connection Subrating (Host Support)
          Unknown features (0x0000d80000000000)
> ACL Data RX: Handle 57 flags 0x02 dlen 7                                                                           #52 6.114277
      ATT: Exchange MTU Request (0x02) len 2
        Client RX MTU: 64
> ACL Data RX: Handle 57 flags 0x02 dlen 7                                                                           #53 6.114739
      ATT: Exchange MTU Response (0x03) len 2
        Server RX MTU: 64
zephyr.exe[2478701]: < HCI Command: Host Number of Completed Packets (0x03|0x0035) plen 5                            #54 6.122671
        Num handles: 1
        Handle: 57 Address: DF:A9:FF:F6:B1:1A (OUI DF-A9-FF)
        Count: 1
zephyr.exe[2478701]: < ACL Data TX: Handle 57 flags 0x00 dlen 7                                                      #55 6.122824
      ATT: Exchange MTU Response (0x03) len 2
        Server RX MTU: 251
zephyr.exe[2478701]: < HCI Command: Host Number of Completed Packets (0x03|0x0035) plen 5                            #56 6.123075
        Num handles: 1
        Handle: 57 Address: DF:A9:FF:F6:B1:1A (OUI DF-A9-FF)
        Count: 1
> HCI Event: Number of Completed Packets (0x13) plen 5                                                               #57 6.314221
        Num handles: 1
        Handle: 57 Address: DF:A9:FF:F6:B1:1A (OUI DF-A9-FF)
        Count: 1
        #55: len 7 (0 Kb/s)
        Latency: 191 msec (190-191 msec ~191 msec)
> ACL Data RX: Handle 57 flags 0x02 dlen 11                                                                          #58 8.314214
      SMP: Pairing Request (0x01) len 6
        IO capability: KeyboardDisplay (0x04)
        OOB data: Authentication data not present (0x00)
        Authentication requirement: Bonding, No MITM, SC, No Keypresses (0x09)
        Max encryption key size: 16
        Initiator key distribution: EncKey IdKey Sign (0x07)
        Responder key distribution: EncKey IdKey Sign (0x07)
zephyr.exe[2478701]: < HCI Command: Host Number of Completed Packets (0x03|0x0035) plen 5                            #59 8.322653
        Num handles: 1
        Handle: 57 Address: DF:A9:FF:F6:B1:1A (OUI DF-A9-FF)
        Count: 1
zephyr.exe[2478701]: < ACL Data TX: Handle 57 flags 0x00 dlen 11                                                     #60 8.322858
      SMP: Pairing Response (0x02) len 6
        IO capability: NoInputNoOutput (0x03)
        OOB data: Authentication data not present (0x00)
        Authentication requirement: Bonding, No MITM, SC, No Keypresses (0x09)
        Max encryption key size: 16
        Initiator key distribution: IdKey (0x02)
        Responder key distribution: <none> (0x00)
> HCI Event: Number of Completed Packets (0x13) plen 5                                                               #61 8.514312
        Num handles: 1
        Handle: 57 Address: DF:A9:FF:F6:B1:1A (OUI DF-A9-FF)
        Count: 1
        #60: len 11 (0 Kb/s)
        Latency: 191 msec (190-191 msec ~191 msec)
> ACL Data RX: Handle 57 flags 0x02 dlen 27                                                                          #62 8.514666
> ACL Data RX: Handle 57 flags 0x01 dlen 27                                                                          #63 8.514935
> ACL Data RX: Handle 57 flags 0x01 dlen 15                                                                          #64 8.515356
      SMP: Pairing Public Key (0x0c) len 64
        X: 28f58c3267c376092673b7457b5e11a9e84ab7c3ed6ac528cdd6a6cb548dfa0a
        Y: 357f00413a643ab612db7359c01fd97f76ce5ff35293045fc0fa4b1b3aec5631
zephyr.exe[2478701]: < HCI Command: Host Number of Completed Packets (0x03|0x0035) plen 5                            #65 8.523099
        Num handles: 1
        Handle: 57 Address: DF:A9:FF:F6:B1:1A (OUI DF-A9-FF)
        Count: 1
zephyr.exe[2478701]: < HCI Command: Host Number of Completed Packets (0x03|0x0035) plen 5                            #66 8.523323
        Num handles: 1
        Handle: 57 Address: DF:A9:FF:F6:B1:1A (OUI DF-A9-FF)
        Count: 1
zephyr.exe[2478701]: < HCI Command: Host Number of Completed Packets (0x03|0x0035) plen 5                            #67 8.523653
        Num handles: 1
        Handle: 57 Address: DF:A9:FF:F6:B1:1A (OUI DF-A9-FF)
        Count: 1
zephyr.exe[2478701]: < ACL Data TX: Handle 57 flags 0x00 dlen 27                                                     #68 8.523805
zephyr.exe[2478701]: < ACL Data TX: Handle 57 flags 0x01 dlen 27                                                     #69 8.523813
zephyr.exe[2478701]: < ACL Data TX: Handle 57 flags 0x01 dlen 15                                                     #70 8.523896
      SMP: Pairing Public Key (0x0c) len 64
        X: 98308440221e2d910f0e54b71e7ec652857aa9b5a0dc65028824cc19db1226e9
        Y: 67a4816bcb62efb21701e31fdb27561a6217575fb007a8bbdabe7e28b6f68482
> HCI Event: Number of Completed Packets (0x13) plen 5                                                               #71 8.614690
        Num handles: 1
        Handle: 57 Address: DF:A9:FF:F6:B1:1A (OUI DF-A9-FF)
        Count: 1
        #68: len 27 (2 Kb/s)
        Latency: 90 msec (90-191 msec ~141 msec)
> HCI Event: Number of Completed Packets (0x13) plen 5                                                               #72 8.615123
        Num handles: 1
        Handle: 57 Address: DF:A9:FF:F6:B1:1A (OUI DF-A9-FF)
        Count: 1
        #69: len 27 (2 Kb/s)
        Latency: 91 msec (90-191 msec ~116 msec)
zephyr.exe[2478701]: < ACL Data TX: Handle 57 flags 0x00 dlen 21                                                     #73 8.622527
      SMP: Pairing Confirm (0x03) len 16
        Confim value: 78fd07eed47894f116cf16dadc7b7236
> HCI Event: Number of Completed Packets (0x13) plen 5                                                               #74 8.714150
        Num handles: 1
        Handle: 57 Address: DF:A9:FF:F6:B1:1A (OUI DF-A9-FF)
        Count: 1
        #70: len 15 (0 Kb/s)
        Latency: 190 msec (90-191 msec ~153 msec)
> HCI Event: Number of Completed Packets (0x13) plen 5                                                               #75 8.814273
        Num handles: 1
        Handle: 57 Address: DF:A9:FF:F6:B1:1A (OUI DF-A9-FF)
        Count: 1
        #73: len 21 (0 Kb/s)
        Latency: 191 msec (90-191 msec ~172 msec)
> ACL Data RX: Handle 57 flags 0x02 dlen 21                                                                          #76 8.814619
      SMP: Pairing Random (0x04) len 16
        Random value: d105853c424a17cc0000000000000000
zephyr.exe[2478701]: < HCI Command: Host Number of Completed Packets (0x03|0x0035) plen 5                            #77 8.822893
        Num handles: 1
        Handle: 57 Address: DF:A9:FF:F6:B1:1A (OUI DF-A9-FF)
        Count: 1
zephyr.exe[2478701]: < ACL Data TX: Handle 57 flags 0x00 dlen 21                                                     #78 8.823011
      SMP: Pairing Random (0x04) len 16
        Random value: f966a694cbe26df70bb96773e6cc6f5d
> HCI Event: Number of Completed Packets (0x13) plen 5                                                               #79 9.014073
        Num handles: 1
        Handle: 57 Address: DF:A9:FF:F6:B1:1A (OUI DF-A9-FF)
        Count: 1
        #78: len 21 (0 Kb/s)
        Latency: 191 msec (90-191 msec ~181 msec)
> ACL Data RX: Handle 57 flags 0x02 dlen 21                                                                          #80 9.214430
      SMP: Pairing DHKey Check (0x0d) len 16
        E: c351f682b0bdf0a3c0e6b2be63925c8c
zephyr.exe[2478701]: < HCI Command: Host Number of Completed Packets (0x03|0x0035) plen 5                            #81 9.223170
        Num handles: 1
        Handle: 57 Address: DF:A9:FF:F6:B1:1A (OUI DF-A9-FF)
        Count: 1
zephyr.exe[2478701]: < ACL Data TX: Handle 57 flags 0x00 dlen 21                                                     #82 9.223396
      SMP: Pairing DHKey Check (0x0d) len 16
        E: 88003998ee6f208ebfc9975e4f75965f
> HCI Event: Number of Completed Packets (0x13) plen 5                                                               #83 9.414166
        Num handles: 1
        Handle: 57 Address: DF:A9:FF:F6:B1:1A (OUI DF-A9-FF)
        Count: 1
        #82: len 21 (0 Kb/s)
        Latency: 190 msec (90-191 msec ~186 msec)
> HCI Event: LE Meta Event (0x3e) plen 13                                                                            #84 9.514594
      LE Long Term Key Request (0x05)
        Handle: 57 Address: DF:A9:FF:F6:B1:1A (OUI DF-A9-FF)
        Random number: 0x0000000000000000
        Encrypted diversifier: 0x0000
zephyr.exe[2478701]: < HCI Command: LE Long Term Key Request Reply (0x08|0x001a) plen 18                             #85 9.522617
        Handle: 57 Address: DF:A9:FF:F6:B1:1A (OUI DF-A9-FF)
        Long term key: a2b7509a2d279c4a5ae42b388c1dffac
> HCI Event: Command Complete (0x0e) plen 6                                                                          #86 9.523460
      LE Long Term Key Request Reply (0x08|0x001a) ncmd 1
        Status: Success (0x00)
        Handle: 57 Address: DF:A9:FF:F6:B1:1A (OUI DF-A9-FF)
> HCI Event: Encryption Change (0x08) plen 4                                                                        #87 10.014356
        Status: Success (0x00)
        Handle: 57 Address: DF:A9:FF:F6:B1:1A (OUI DF-A9-FF)
        Encryption: Enabled with AES-CCM (0x01)
> ACL Data RX: Handle 57 flags 0x02 dlen 21                                                                         #88 10.114399
      SMP: Identity Information (0x08) len 16
        Identity resolving key: bc588e3de7b6130d9d65d59ea55ff06e
zephyr.exe[2478701]: < HCI Command: Host Number of Completed Packets (0x03|0x0035) plen 5                           #89 10.133075
        Num handles: 1
        Handle: 57 Address: DF:A9:FF:F6:B1:1A (OUI DF-A9-FF)
        Count: 1
> ACL Data RX: Handle 57 flags 0x02 dlen 12                                                                         #90 10.314205
      SMP: Identity Address Information (0x09) len 7
        Address: DF:A9:FF:F6:B1:1A (OUI DF-A9-FF)
zephyr.exe[2478701]: < HCI Command: LE Add Device To Resolving List (0x08|0x0027) plen 39                           #91 10.322870
        Address type: Public (0x00)
        Address: DF:A9:FF:F6:B1:1A (OUI DF-A9-FF)
        Peer identity resolving key: bc588e3de7b6130d9d65d59ea55ff06e
        Local identity resolving key: 00000000000000000000000000000000
> HCI Event: Command Complete (0x0e) plen 4                                                                         #92 10.323938
      LE Add Device To Resolving List (0x08|0x0027) ncmd 1
        Status: Success (0x00)
zephyr.exe[2478701]: < HCI Command: LE Set Privacy Mode (0x08|0x004e) plen 8                                        #93 10.342609
        Peer Identity address type: Public (0x00)
        Peer Identity address: DF:A9:FF:F6:B1:1A (OUI DF-A9-FF)
        Privacy Mode: Use Device Privacy (0x01)
> HCI Event: Command Complete (0x0e) plen 4                                                                         #94 10.343233
      LE Set Privacy Mode (0x08|0x004e) ncmd 1
        Status: Success (0x00)
zephyr.exe[2478701]: < HCI Command: LE Set Address Resolution Enable (0x08|0x002d) plen 1                           #95 10.362726
        Address resolution: Enabled (0x01)
> HCI Event: Command Complete (0x0e) plen 4                                                                         #96 10.363277
      LE Set Address Resolution Enable (0x08|0x002d) ncmd 1
        Status: Success (0x00)
zephyr.exe[2478701]: < HCI Command: Host Number of Completed Packets (0x03|0x0035) plen 5                           #97 10.382513
        Num handles: 1
        Handle: 57 Address: DF:A9:FF:F6:B1:1A (OUI DF-A9-FF)
        Count: 1
> ACL Data RX: Handle 57 flags 0x02 dlen 13                                                                         #98 10.414236
      ATT: Find By Type Value Request (0x06) len 8
        Handle range: 0x0001-0xffff
        Attribute type: Primary Service (0x2800)
          UUID: Published Audio Capabilities (0x1850)
zephyr.exe[2478701]: < HCI Command: Host Number of Completed Packets (0x03|0x0035) plen 5                           #99 10.423384
        Num handles: 1
        Handle: 57 Address: DF:A9:FF:F6:B1:1A (OUI DF-A9-FF)
        Count: 1
zephyr.exe[2478701]: < ACL Data TX: Handle 57 flags 0x00 dlen 9                                                    #100 10.423588
      ATT: Find By Type Value Response (0x07) len 4
        Handle range: 0x012a-0x013c
> HCI Event: Number of Completed Packets (0x13) plen 5                                                             #101 10.614202
        Num handles: 1
        Handle: 57 Address: DF:A9:FF:F6:B1:1A (OUI DF-A9-FF)
        Count: 1
        #100: len 9 (0 Kb/s)
        Latency: 190 msec (90-191 msec ~188 msec)
> ACL Data RX: Handle 57 flags 0x02 dlen 13                                                                        #102 10.614450
      ATT: Find By Type Value Request (0x06) len 8
        Handle range: 0x013d-0xffff
        Attribute type: Primary Service (0x2800)
          UUID: Published Audio Capabilities (0x1850)
zephyr.exe[2478701]: < HCI Command: Host Number of Completed Packets (0x03|0x0035) plen 5                          #103 10.623045
        Num handles: 1
        Handle: 57 Address: DF:A9:FF:F6:B1:1A (OUI DF-A9-FF)
        Count: 1
zephyr.exe[2478701]: < ACL Data TX: Handle 57 flags 0x00 dlen 9                                                    #104 10.623156
      ATT: Error Response (0x01) len 4
        Find By Type Value Request (0x06)
        Handle: 0x013d
        Error: Attribute Not Found (0x0a)
> HCI Event: Number of Completed Packets (0x13) plen 5                                                             #105 10.814210
        Num handles: 1
        Handle: 57 Address: DF:A9:FF:F6:B1:1A (OUI DF-A9-FF)
        Count: 1
        #104: len 9 (0 Kb/s)
        Latency: 191 msec (90-191 msec ~189 msec)
> ACL Data RX: Handle 57 flags 0x02 dlen 11                                                                        #106 10.814399
      ATT: Read By Type Request (0x08) len 6
        Handle range: 0x012a-0x013c
        Attribute type: Characteristic (0x2803)
zephyr.exe[2478701]: < HCI Command: Host Number of Completed Packets (0x03|0x0035) plen 5                          #107 10.822548
        Num handles: 1
        Handle: 57 Address: DF:A9:FF:F6:B1:1A (OUI DF-A9-FF)
        Count: 1
zephyr.exe[2478701]: < ACL Data TX: Handle 57 flags 0x00 dlen 27                                                   #108 10.822611
zephyr.exe[2478701]: < ACL Data TX: Handle 57 flags 0x01 dlen 21                                                   #109 10.822721
      ATT: Read By Type Response (0x09) len 43
        Attribute data length: 7
        Attribute data list: 6 entries
        Handle: 0x012b
        Value: 122c01c92b
            Properties: 0x12
              Read (0x02)
              Notify (0x10)
            Value Handle: 0x012c
            Value UUID: Sink PAC (0x2bc9)
        Handle: 0x012e
        Value: 1a2f01ca2b
            Properties: 0x1a
              Read (0x02)
              Write (0x08)
              Notify (0x10)
            Value Handle: 0x012f
            Value UUID: Sink Audio Locations (0x2bca)
        Handle: 0x0131
        Value: 123201cb2b
            Properties: 0x12
              Read (0x02)
              Notify (0x10)
            Value Handle: 0x0132
            Value UUID: Source PAC (0x2bcb)
        Handle: 0x0134
        Value: 1a3501cc2b
            Properties: 0x1a
              Read (0x02)
              Write (0x08)
              Notify (0x10)
            Value Handle: 0x0135
            Value UUID: Source Audio Locations (0x2bcc)
        Handle: 0x0137
        Value: 123801cd2b
            Properties: 0x12
              Read (0x02)
              Notify (0x10)
            Value Handle: 0x0138
            Value UUID: Available Audio Contexts (0x2bcd)
        Handle: 0x013a
        Value: 123b01ce2b
            Properties: 0x12
              Read (0x02)
              Notify (0x10)
            Value Handle: 0x013b
            Value UUID: Supported Audio Contexts (0x2bce)
> HCI Event: Number of Completed Packets (0x13) plen 5                                                             #110 10.914638
        Num handles: 1
        Handle: 57 Address: DF:A9:FF:F6:B1:1A (OUI DF-A9-FF)
        Count: 1
        #108: len 27 (2 Kb/s)
        Latency: 92 msec (90-191 msec ~140 msec)
> HCI Event: Number of Completed Packets (0x13) plen 5                                                             #111 11.014197
        Num handles: 1
        Handle: 57 Address: DF:A9:FF:F6:B1:1A (OUI DF-A9-FF)
        Count: 1
        #109: len 21 (0 Kb/s)
        Latency: 191 msec (90-191 msec ~166 msec)
> ACL Data RX: Handle 57 flags 0x02 dlen 11                                                                        #112 11.014379
      ATT: Read By Type Request (0x08) len 6
        Handle range: 0x013b-0x013c
        Attribute type: Characteristic (0x2803)
zephyr.exe[2478701]: < HCI Command: Host Number of Completed Packets (0x03|0x0035) plen 5                          #113 11.022890
        Num handles: 1
        Handle: 57 Address: DF:A9:FF:F6:B1:1A (OUI DF-A9-FF)
        Count: 1
zephyr.exe[2478701]: < ACL Data TX: Handle 57 flags 0x00 dlen 9                                                    #114 11.022984
      ATT: Error Response (0x01) len 4
        Read By Type Request (0x08)
        Handle: 0x013b
        Error: Attribute Not Found (0x0a)
> HCI Event: Number of Completed Packets (0x13) plen 5                                                             #115 11.214207
        Num handles: 1
        Handle: 57 Address: DF:A9:FF:F6:B1:1A (OUI DF-A9-FF)
        Count: 1
        #114: len 9 (0 Kb/s)
        Latency: 191 msec (90-191 msec ~178 msec)
> ACL Data RX: Handle 57 flags 0x02 dlen 9                                                                         #116 11.214493
      ATT: Find Information Request (0x04) len 4
        Handle range: 0x012d-0x012d
zephyr.exe[2478701]: < HCI Command: Host Number of Completed Packets (0x03|0x0035) plen 5                          #117 11.222684
        Num handles: 1
        Handle: 57 Address: DF:A9:FF:F6:B1:1A (OUI DF-A9-FF)
        Count: 1
zephyr.exe[2478701]: < ACL Data TX: Handle 57 flags 0x00 dlen 10                                                   #118 11.222780
      ATT: Find Information Response (0x05) len 5
        Format: UUID-16 (0x01)
        Handle: 0x012d
        UUID: Client Characteristic Configuration (0x2902)
> HCI Event: Number of Completed Packets (0x13) plen 5                                                             #119 11.414170
        Num handles: 1
        Handle: 57 Address: DF:A9:FF:F6:B1:1A (OUI DF-A9-FF)
        Count: 1
        #118: len 10 (0 Kb/s)
        Latency: 191 msec (90-191 msec ~185 msec)
> ACL Data RX: Handle 57 flags 0x02 dlen 9                                                                         #120 11.414302
      ATT: Find Information Request (0x04) len 4
        Handle range: 0x0130-0x0130
zephyr.exe[2478701]: < HCI Command: Host Number of Completed Packets (0x03|0x0035) plen 5                          #121 11.422678
        Num handles: 1
        Handle: 57 Address: DF:A9:FF:F6:B1:1A (OUI DF-A9-FF)
        Count: 1
zephyr.exe[2478701]: < ACL Data TX: Handle 57 flags 0x00 dlen 10                                                   #122 11.422816
      ATT: Find Information Response (0x05) len 5
        Format: UUID-16 (0x01)
        Handle: 0x0130
        UUID: Client Characteristic Configuration (0x2902)
> HCI Event: Number of Completed Packets (0x13) plen 5                                                             #123 11.614138
        Num handles: 1
        Handle: 57 Address: DF:A9:FF:F6:B1:1A (OUI DF-A9-FF)
        Count: 1
        #122: len 10 (0 Kb/s)
        Latency: 191 msec (90-191 msec ~188 msec)
> ACL Data RX: Handle 57 flags 0x02 dlen 9                                                                         #124 11.614276
      ATT: Find Information Request (0x04) len 4
        Handle range: 0x0133-0x0133
zephyr.exe[2478701]: < HCI Command: Host Number of Completed Packets (0x03|0x0035) plen 5                          #125 11.622929
        Num handles: 1
        Handle: 57 Address: DF:A9:FF:F6:B1:1A (OUI DF-A9-FF)
        Count: 1
zephyr.exe[2478701]: < ACL Data TX: Handle 57 flags 0x00 dlen 10                                                   #126 11.623046
      ATT: Find Information Response (0x05) len 5
        Format: UUID-16 (0x01)
        Handle: 0x0133
        UUID: Client Characteristic Configuration (0x2902)
> HCI Event: Number of Completed Packets (0x13) plen 5                                                             #127 11.814178
        Num handles: 1
        Handle: 57 Address: DF:A9:FF:F6:B1:1A (OUI DF-A9-FF)
        Count: 1
        #126: len 10 (0 Kb/s)
        Latency: 191 msec (90-191 msec ~189 msec)
> ACL Data RX: Handle 57 flags 0x02 dlen 9                                                                         #128 11.814311
      ATT: Find Information Request (0x04) len 4
        Handle range: 0x0136-0x0136
zephyr.exe[2478701]: < HCI Command: Host Number of Completed Packets (0x03|0x0035) plen 5                          #129 11.822995
        Num handles: 1
        Handle: 57 Address: DF:A9:FF:F6:B1:1A (OUI DF-A9-FF)
        Count: 1
zephyr.exe[2478701]: < ACL Data TX: Handle 57 flags 0x00 dlen 10                                                   #130 11.823098
      ATT: Find Information Response (0x05) len 5
        Format: UUID-16 (0x01)
        Handle: 0x0136
        UUID: Client Characteristic Configuration (0x2902)
> HCI Event: Number of Completed Packets (0x13) plen 5                                                             #131 12.014204
        Num handles: 1
        Handle: 57 Address: DF:A9:FF:F6:B1:1A (OUI DF-A9-FF)
        Count: 1
        #130: len 10 (0 Kb/s)
        Latency: 191 msec (90-191 msec ~190 msec)
> ACL Data RX: Handle 57 flags 0x02 dlen 9                                                                         #132 12.014362
      ATT: Find Information Request (0x04) len 4
        Handle range: 0x0139-0x0139
zephyr.exe[2478701]: < HCI Command: Host Number of Completed Packets (0x03|0x0035) plen 5                          #133 12.022887
        Num handles: 1
        Handle: 57 Address: DF:A9:FF:F6:B1:1A (OUI DF-A9-FF)
        Count: 1
zephyr.exe[2478701]: < ACL Data TX: Handle 57 flags 0x00 dlen 10                                                   #134 12.022979
      ATT: Find Information Response (0x05) len 5
        Format: UUID-16 (0x01)
        Handle: 0x0139
        UUID: Client Characteristic Configuration (0x2902)
> HCI Event: Number of Completed Packets (0x13) plen 5                                                             #135 12.214107
        Num handles: 1
        Handle: 57 Address: DF:A9:FF:F6:B1:1A (OUI DF-A9-FF)
        Count: 1
        #134: len 10 (0 Kb/s)
        Latency: 191 msec (90-191 msec ~190 msec)
> ACL Data RX: Handle 57 flags 0x02 dlen 9                                                                         #136 12.214315
      ATT: Find Information Request (0x04) len 4
        Handle range: 0x013c-0x013c
zephyr.exe[2478701]: < HCI Command: Host Number of Completed Packets (0x03|0x0035) plen 5                          #137 12.223031
        Num handles: 1
        Handle: 57 Address: DF:A9:FF:F6:B1:1A (OUI DF-A9-FF)
        Count: 1
zephyr.exe[2478701]: < ACL Data TX: Handle 57 flags 0x00 dlen 10                                                   #138 12.223156
      ATT: Find Information Response (0x05) len 5
        Format: UUID-16 (0x01)
        Handle: 0x013c
        UUID: Client Characteristic Configuration (0x2902)
> HCI Event: Number of Completed Packets (0x13) plen 5                                                             #139 12.414143
        Num handles: 1
        Handle: 57 Address: DF:A9:FF:F6:B1:1A (OUI DF-A9-FF)
        Count: 1
        #138: len 10 (0 Kb/s)
        Latency: 190 msec (90-191 msec ~190 msec)
> ACL Data RX: Handle 57 flags 0x02 dlen 13                                                                        #140 12.414443
      ATT: Find By Type Value Request (0x06) len 8
        Handle range: 0x0001-0xffff
        Attribute type: Primary Service (0x2800)
          UUID: Audio Stream Control (0x184e)
zephyr.exe[2478701]: < HCI Command: Host Number of Completed Packets (0x03|0x0035) plen 5                          #141 12.423537
        Num handles: 1
        Handle: 57 Address: DF:A9:FF:F6:B1:1A (OUI DF-A9-FF)
        Count: 1
zephyr.exe[2478701]: < ACL Data TX: Handle 57 flags 0x00 dlen 9                                                    #142 12.423629
      ATT: Find By Type Value Response (0x07) len 4
        Handle range: 0x013d-0x014c
> HCI Event: Number of Completed Packets (0x13) plen 5                                                             #143 12.614149
        Num handles: 1
        Handle: 57 Address: DF:A9:FF:F6:B1:1A (OUI DF-A9-FF)
        Count: 1
        #142: len 9 (0 Kb/s)
        Latency: 190 msec (90-191 msec ~190 msec)
> ACL Data RX: Handle 57 flags 0x02 dlen 13                                                                        #144 12.614423
      ATT: Find By Type Value Request (0x06) len 8
        Handle range: 0x014d-0xffff
        Attribute type: Primary Service (0x2800)
          UUID: Audio Stream Control (0x184e)
zephyr.exe[2478701]: < HCI Command: Host Number of Completed Packets (0x03|0x0035) plen 5                          #145 12.622992
        Num handles: 1
        Handle: 57 Address: DF:A9:FF:F6:B1:1A (OUI DF-A9-FF)
        Count: 1
zephyr.exe[2478701]: < ACL Data TX: Handle 57 flags 0x00 dlen 9                                                    #146 12.623014
      ATT: Error Response (0x01) len 4
        Find By Type Value Request (0x06)
        Handle: 0x014d
        Error: Attribute Not Found (0x0a)
> HCI Event: Number of Completed Packets (0x13) plen 5                                                             #147 12.814108
        Num handles: 1
        Handle: 57 Address: DF:A9:FF:F6:B1:1A (OUI DF-A9-FF)
        Count: 1
        #146: len 9 (0 Kb/s)
        Latency: 191 msec (90-191 msec ~190 msec)
> ACL Data RX: Handle 57 flags 0x02 dlen 11                                                                        #148 12.814305
      ATT: Read By Type Request (0x08) len 6
        Handle range: 0x013d-0x014c
        Attribute type: Characteristic (0x2803)
zephyr.exe[2478701]: < HCI Command: Host Number of Completed Packets (0x03|0x0035) plen 5                          #149 12.822988
        Num handles: 1
        Handle: 57 Address: DF:A9:FF:F6:B1:1A (OUI DF-A9-FF)
        Count: 1
zephyr.exe[2478701]: < ACL Data TX: Handle 57 flags 0x00 dlen 27                                                   #150 12.823088
zephyr.exe[2478701]: < ACL Data TX: Handle 57 flags 0x01 dlen 14                                                   #151 12.823243
      ATT: Read By Type Response (0x09) len 36
        Attribute data length: 7
        Attribute data list: 5 entries
        Handle: 0x013e
        Value: 1c3f01c62b
            Properties: 0x1c
              Write Without Response (0x04)
              Write (0x08)
              Notify (0x10)
            Value Handle: 0x013f
            Value UUID: ASE Control Point (0x2bc6)
        Handle: 0x0141
        Value: 124201c42b
            Properties: 0x12
              Read (0x02)
              Notify (0x10)
            Value Handle: 0x0142
            Value UUID: Sink ASE (0x2bc4)
        Handle: 0x0144
        Value: 124501c42b
            Properties: 0x12
              Read (0x02)
              Notify (0x10)
            Value Handle: 0x0145
            Value UUID: Sink ASE (0x2bc4)
        Handle: 0x0147
        Value: 124801c52b
            Properties: 0x12
              Read (0x02)
              Notify (0x10)
            Value Handle: 0x0148
            Value UUID: Source ASE (0x2bc5)
        Handle: 0x014a
        Value: 124b01c52b
            Properties: 0x12
              Read (0x02)
              Notify (0x10)
            Value Handle: 0x014b
            Value UUID: Source ASE (0x2bc5)
> HCI Event: Number of Completed Packets (0x13) plen 5                                                             #152 12.914500
        Num handles: 1
        Handle: 57 Address: DF:A9:FF:F6:B1:1A (OUI DF-A9-FF)
        Count: 1
        #150: len 27 (2 Kb/s)
        Latency: 91 msec (90-191 msec ~141 msec)
> HCI Event: Number of Completed Packets (0x13) plen 5                                                             #153 13.014142
        Num handles: 1
        Handle: 57 Address: DF:A9:FF:F6:B1:1A (OUI DF-A9-FF)
        Count: 1
        #151: len 14 (0 Kb/s)
        Latency: 190 msec (90-191 msec ~166 msec)
> ACL Data RX: Handle 57 flags 0x02 dlen 11                                                                        #154 13.014316
      ATT: Read By Type Request (0x08) len 6
        Handle range: 0x014b-0x014c
        Attribute type: Characteristic (0x2803)
zephyr.exe[2478701]: < HCI Command: Host Number of Completed Packets (0x03|0x0035) plen 5                          #155 13.022969
        Num handles: 1
        Handle: 57 Address: DF:A9:FF:F6:B1:1A (OUI DF-A9-FF)
        Count: 1
zephyr.exe[2478701]: < ACL Data TX: Handle 57 flags 0x00 dlen 9                                                    #156 13.023048
      ATT: Error Response (0x01) len 4
        Read By Type Request (0x08)
        Handle: 0x014b
        Error: Attribute Not Found (0x0a)
> HCI Event: Number of Completed Packets (0x13) plen 5                                                             #157 13.214056
        Num handles: 1
        Handle: 57 Address: DF:A9:FF:F6:B1:1A (OUI DF-A9-FF)
        Count: 1
        #156: len 9 (0 Kb/s)
        Latency: 191 msec (90-191 msec ~178 msec)
> ACL Data RX: Handle 57 flags 0x02 dlen 9                                                                         #158 13.214313
      ATT: Find Information Request (0x04) len 4
        Handle range: 0x0140-0x0140
zephyr.exe[2478701]: < HCI Command: Host Number of Completed Packets (0x03|0x0035) plen 5                          #159 13.222996
        Num handles: 1
        Handle: 57 Address: DF:A9:FF:F6:B1:1A (OUI DF-A9-FF)
        Count: 1
zephyr.exe[2478701]: < ACL Data TX: Handle 57 flags 0x00 dlen 10                                                   #160 13.223116
      ATT: Find Information Response (0x05) len 5
        Format: UUID-16 (0x01)
        Handle: 0x0140
        UUID: Client Characteristic Configuration (0x2902)
> HCI Event: Number of Completed Packets (0x13) plen 5                                                             #161 13.414146
        Num handles: 1
        Handle: 57 Address: DF:A9:FF:F6:B1:1A (OUI DF-A9-FF)
        Count: 1
        #160: len 10 (0 Kb/s)
        Latency: 191 msec (90-191 msec ~184 msec)
> ACL Data RX: Handle 57 flags 0x02 dlen 9                                                                         #162 13.414263
      ATT: Find Information Request (0x04) len 4
        Handle range: 0x0143-0x0143
zephyr.exe[2478701]: < HCI Command: Host Number of Completed Packets (0x03|0x0035) plen 5                          #163 13.422583
        Num handles: 1
        Handle: 57 Address: DF:A9:FF:F6:B1:1A (OUI DF-A9-FF)
        Count: 1
zephyr.exe[2478701]: < ACL Data TX: Handle 57 flags 0x00 dlen 10                                                   #164 13.422678
      ATT: Find Information Response (0x05) len 5
        Format: UUID-16 (0x01)
        Handle: 0x0143
        UUID: Client Characteristic Configuration (0x2902)
> HCI Event: Number of Completed Packets (0x13) plen 5                                                             #165 13.614087
        Num handles: 1
        Handle: 57 Address: DF:A9:FF:F6:B1:1A (OUI DF-A9-FF)
        Count: 1
        #164: len 10 (0 Kb/s)
        Latency: 191 msec (90-191 msec ~188 msec)
> ACL Data RX: Handle 57 flags 0x02 dlen 9                                                                         #166 13.614304
      ATT: Find Information Request (0x04) len 4
        Handle range: 0x0146-0x0146
zephyr.exe[2478701]: < HCI Command: Host Number of Completed Packets (0x03|0x0035) plen 5                          #167 13.622951
        Num handles: 1
        Handle: 57 Address: DF:A9:FF:F6:B1:1A (OUI DF-A9-FF)
        Count: 1
zephyr.exe[2478701]: < ACL Data TX: Handle 57 flags 0x00 dlen 10                                                   #168 13.623087
      ATT: Find Information Response (0x05) len 5
        Format: UUID-16 (0x01)
        Handle: 0x0146
        UUID: Client Characteristic Configuration (0x2902)
> HCI Event: Number of Completed Packets (0x13) plen 5                                                             #169 13.814102
        Num handles: 1
        Handle: 57 Address: DF:A9:FF:F6:B1:1A (OUI DF-A9-FF)
        Count: 1
        #168: len 10 (0 Kb/s)
        Latency: 191 msec (90-191 msec ~189 msec)
> ACL Data RX: Handle 57 flags 0x02 dlen 9                                                                         #170 13.814320
      ATT: Find Information Request (0x04) len 4
        Handle range: 0x0149-0x0149
zephyr.exe[2478701]: < HCI Command: Host Number of Completed Packets (0x03|0x0035) plen 5                          #171 13.822694
        Num handles: 1
        Handle: 57 Address: DF:A9:FF:F6:B1:1A (OUI DF-A9-FF)
        Count: 1
zephyr.exe[2478701]: < ACL Data TX: Handle 57 flags 0x00 dlen 10                                                   #172 13.822745
      ATT: Find Information Response (0x05) len 5
        Format: UUID-16 (0x01)
        Handle: 0x0149
        UUID: Client Characteristic Configuration (0x2902)
> HCI Event: Number of Completed Packets (0x13) plen 5                                                             #173 14.014097
        Num handles: 1
        Handle: 57 Address: DF:A9:FF:F6:B1:1A (OUI DF-A9-FF)
        Count: 1
        #172: len 10 (0 Kb/s)
        Latency: 191 msec (90-191 msec ~190 msec)
> ACL Data RX: Handle 57 flags 0x02 dlen 9                                                                         #174 14.014248
      ATT: Find Information Request (0x04) len 4
        Handle range: 0x014c-0x014c
zephyr.exe[2478701]: < HCI Command: Host Number of Completed Packets (0x03|0x0035) plen 5                          #175 14.022832
        Num handles: 1
        Handle: 57 Address: DF:A9:FF:F6:B1:1A (OUI DF-A9-FF)
        Count: 1
zephyr.exe[2478701]: < ACL Data TX: Handle 57 flags 0x00 dlen 10                                                   #176 14.022899
      ATT: Find Information Response (0x05) len 5
        Format: UUID-16 (0x01)
        Handle: 0x014c
        UUID: Client Characteristic Configuration (0x2902)
> HCI Event: Number of Completed Packets (0x13) plen 5                                                             #177 14.214083
        Num handles: 1
        Handle: 57 Address: DF:A9:FF:F6:B1:1A (OUI DF-A9-FF)
        Count: 1
        #176: len 10 (0 Kb/s)
        Latency: 191 msec (90-191 msec ~190 msec)
> ACL Data RX: Handle 57 flags 0x02 dlen 13                                                                        #178 14.214320
      ATT: Find By Type Value Request (0x06) len 8
        Handle range: 0x0001-0xffff
        Attribute type: Primary Service (0x2800)
          UUID: Common Audio (0x1853)
zephyr.exe[2478701]: < HCI Command: Host Number of Completed Packets (0x03|0x0035) plen 5                          #179 14.223760
        Num handles: 1
        Handle: 57 Address: DF:A9:FF:F6:B1:1A (OUI DF-A9-FF)
        Count: 1
zephyr.exe[2478701]: < ACL Data TX: Handle 57 flags 0x00 dlen 9                                                    #180 14.223875
      ATT: Find By Type Value Response (0x07) len 4
        Handle range: 0x0159-0x015a
> HCI Event: Number of Completed Packets (0x13) plen 5                                                             #181 14.414065
        Num handles: 1
        Handle: 57 Address: DF:A9:FF:F6:B1:1A (OUI DF-A9-FF)
        Count: 1
        #180: len 9 (0 Kb/s)
        Latency: 190 msec (90-191 msec ~190 msec)
> ACL Data RX: Handle 57 flags 0x02 dlen 13                                                                        #182 14.414302
      ATT: Find By Type Value Request (0x06) len 8
        Handle range: 0x015b-0xffff
        Attribute type: Primary Service (0x2800)
          UUID: Common Audio (0x1853)
zephyr.exe[2478701]: < HCI Command: Host Number of Completed Packets (0x03|0x0035) plen 5                          #183 14.422997
        Num handles: 1
        Handle: 57 Address: DF:A9:FF:F6:B1:1A (OUI DF-A9-FF)
        Count: 1
zephyr.exe[2478701]: < ACL Data TX: Handle 57 flags 0x00 dlen 9                                                    #184 14.423091
      ATT: Error Response (0x01) len 4
        Find By Type Value Request (0x06)
        Handle: 0x015b
        Error: Attribute Not Found (0x0a)
> HCI Event: Number of Completed Packets (0x13) plen 5                                                             #185 14.614065
        Num handles: 1
        Handle: 57 Address: DF:A9:FF:F6:B1:1A (OUI DF-A9-FF)
        Count: 1
        #184: len 9 (0 Kb/s)
        Latency: 190 msec (90-191 msec ~190 msec)
> ACL Data RX: Handle 57 flags 0x02 dlen 11                                                                        #186 14.614212
      ATT: Read By Type Request (0x08) len 6
        Handle range: 0x0159-0x015a
        Attribute type: Include (0x2802)
zephyr.exe[2478701]: < HCI Command: Host Number of Completed Packets (0x03|0x0035) plen 5                          #187 14.623007
        Num handles: 1
        Handle: 57 Address: DF:A9:FF:F6:B1:1A (OUI DF-A9-FF)
        Count: 1
zephyr.exe[2478701]: < ACL Data TX: Handle 57 flags 0x00 dlen 14                                                   #188 14.623077
      ATT: Read By Type Response (0x09) len 9
        Attribute data length: 8
        Attribute data list: 1 entry
        Handle: 0x015a
        Value: 4d0158014618
> HCI Event: Number of Completed Packets (0x13) plen 5                                                             #189 14.814013
        Num handles: 1
        Handle: 57 Address: DF:A9:FF:F6:B1:1A (OUI DF-A9-FF)
        Count: 1
        #188: len 14 (0 Kb/s)
        Latency: 190 msec (90-191 msec ~190 msec)
> ACL Data RX: Handle 57 flags 0x02 dlen 11                                                                        #190 14.814280
      ATT: Read By Type Request (0x08) len 6
        Handle range: 0x014d-0x0158
        Attribute type: Characteristic (0x2803)
zephyr.exe[2478701]: < HCI Command: Host Number of Completed Packets (0x03|0x0035) plen 5                          #191 14.823016
        Num handles: 1
        Handle: 57 Address: DF:A9:FF:F6:B1:1A (OUI DF-A9-FF)
        Count: 1
zephyr.exe[2478701]: < ACL Data TX: Handle 57 flags 0x00 dlen 27                                                   #192 14.823104
zephyr.exe[2478701]: < ACL Data TX: Handle 57 flags 0x01 dlen 7                                                    #193 14.823305
      ATT: Read By Type Response (0x09) len 29
        Attribute data length: 7
        Attribute data list: 4 entries
        Handle: 0x014e
        Value: 124f01842b
            Properties: 0x12
              Read (0x02)
              Notify (0x10)
            Value Handle: 0x014f
            Value UUID: Set Identity Resolving Key (0x2b84)
        Handle: 0x0151
        Value: 125201852b
            Properties: 0x12
              Read (0x02)
              Notify (0x10)
            Value Handle: 0x0152
            Value UUID: Coordinated Set Size (0x2b85)
        Handle: 0x0154
        Value: 1a5501862b
            Properties: 0x1a
              Read (0x02)
              Write (0x08)
              Notify (0x10)
            Value Handle: 0x0155
            Value UUID: Set Member Lock (0x2b86)
        Handle: 0x0157
        Value: 025801872b
            Properties: 0x02
              Read (0x02)
            Value Handle: 0x0158
            Value UUID: Set Member Rank (0x2b87)
> HCI Event: Number of Completed Packets (0x13) plen 5                                                             #194 14.914516
        Num handles: 1
        Handle: 57 Address: DF:A9:FF:F6:B1:1A (OUI DF-A9-FF)
        Count: 1
        #192: len 27 (2 Kb/s)
        Latency: 91 msec (90-191 msec ~141 msec)
> HCI Event: Number of Completed Packets (0x13) plen 5                                                             #195 15.014029
        Num handles: 1
        Handle: 57 Address: DF:A9:FF:F6:B1:1A (OUI DF-A9-FF)
        Count: 1
        #193: len 7 (0 Kb/s)
        Latency: 190 msec (90-191 msec ~165 msec)
> ACL Data RX: Handle 57 flags 0x02 dlen 11                                                                        #196 15.014208
      ATT: Read By Type Request (0x08) len 6
        Handle range: 0x0158-0x0158
        Attribute type: Characteristic (0x2803)
zephyr.exe[2478701]: < HCI Command: Host Number of Completed Packets (0x03|0x0035) plen 5                          #197 15.022981
        Num handles: 1
        Handle: 57 Address: DF:A9:FF:F6:B1:1A (OUI DF-A9-FF)
        Count: 1
zephyr.exe[2478701]: < ACL Data TX: Handle 57 flags 0x00 dlen 9                                                    #198 15.023033
      ATT: Error Response (0x01) len 4
        Read By Type Request (0x08)
        Handle: 0x0158
        Error: Attribute Not Found (0x0a)
> HCI Event: Number of Completed Packets (0x13) plen 5                                                             #199 15.214106
        Num handles: 1
        Handle: 57 Address: DF:A9:FF:F6:B1:1A (OUI DF-A9-FF)
        Count: 1
        #198: len 9 (0 Kb/s)
        Latency: 191 msec (90-191 msec ~178 msec)
> ACL Data RX: Handle 57 flags 0x02 dlen 9                                                                         #200 15.214204
      ATT: Find Information Request (0x04) len 4
        Handle range: 0x0150-0x0150
zephyr.exe[2478701]: < HCI Command: Host Number of Completed Packets (0x03|0x0035) plen 5                          #201 15.223003
        Num handles: 1
        Handle: 57 Address: DF:A9:FF:F6:B1:1A (OUI DF-A9-FF)
        Count: 1
zephyr.exe[2478701]: < ACL Data TX: Handle 57 flags 0x00 dlen 10                                                   #202 15.223225
      ATT: Find Information Response (0x05) len 5
        Format: UUID-16 (0x01)
        Handle: 0x0150
        UUID: Client Characteristic Configuration (0x2902)
> HCI Event: Number of Completed Packets (0x13) plen 5                                                             #203 15.413967
        Num handles: 1
        Handle: 57 Address: DF:A9:FF:F6:B1:1A (OUI DF-A9-FF)
        Count: 1
        #202: len 10 (0 Kb/s)
        Latency: 190 msec (90-191 msec ~184 msec)
> ACL Data RX: Handle 57 flags 0x02 dlen 9                                                                         #204 15.414274
      ATT: Find Information Request (0x04) len 4
        Handle range: 0x0153-0x0153
zephyr.exe[2478701]: < HCI Command: Host Number of Completed Packets (0x03|0x0035) plen 5                          #205 15.422988
        Num handles: 1
        Handle: 57 Address: DF:A9:FF:F6:B1:1A (OUI DF-A9-FF)
        Count: 1
zephyr.exe[2478701]: < ACL Data TX: Handle 57 flags 0x00 dlen 10                                                   #206 15.423036
      ATT: Find Information Response (0x05) len 5
        Format: UUID-16 (0x01)
        Handle: 0x0153
        UUID: Client Characteristic Configuration (0x2902)
> HCI Event: Number of Completed Packets (0x13) plen 5                                                             #207 15.614021
        Num handles: 1
        Handle: 57 Address: DF:A9:FF:F6:B1:1A (OUI DF-A9-FF)
        Count: 1
        #206: len 10 (0 Kb/s)
        Latency: 190 msec (90-191 msec ~187 msec)
> ACL Data RX: Handle 57 flags 0x02 dlen 9                                                                         #208 15.614271
      ATT: Find Information Request (0x04) len 4
        Handle range: 0x0156-0x0156
zephyr.exe[2478701]: < HCI Command: Host Number of Completed Packets (0x03|0x0035) plen 5                          #209 15.622936
        Num handles: 1
        Handle: 57 Address: DF:A9:FF:F6:B1:1A (OUI DF-A9-FF)
        Count: 1
zephyr.exe[2478701]: < ACL Data TX: Handle 57 flags 0x00 dlen 10                                                   #210 15.623046
      ATT: Find Information Response (0x05) len 5
        Format: UUID-16 (0x01)
        Handle: 0x0156
        UUID: Client Characteristic Configuration (0x2902)
> HCI Event: Number of Completed Packets (0x13) plen 5                                                             #211 15.814080
        Num handles: 1
        Handle: 57 Address: DF:A9:FF:F6:B1:1A (OUI DF-A9-FF)
        Count: 1
        #210: len 10 (0 Kb/s)
        Latency: 191 msec (90-191 msec ~189 msec)
> ACL Data RX: Handle 57 flags 0x02 dlen 9                                                                         #212 15.814238
      ATT: Write Request (0x12) len 4
        Handle: 0x0139
          Data: 0000
zephyr.exe[2478701]: < HCI Command: Host Number of Completed Packets (0x03|0x0035) plen 5                          #213 15.822661
        Num handles: 1
        Handle: 57 Address: DF:A9:FF:F6:B1:1A (OUI DF-A9-FF)
        Count: 1
zephyr.exe[2478701]: < ACL Data TX: Handle 57 flags 0x00 dlen 5                                                    #214 15.822715
      ATT: Write Response (0x13) len 0
> HCI Event: Number of Completed Packets (0x13) plen 5                                                             #215 16.014059
        Num handles: 1
        Handle: 57 Address: DF:A9:FF:F6:B1:1A (OUI DF-A9-FF)
        Count: 1
        #214: len 5 (0 Kb/s)
        Latency: 191 msec (90-191 msec ~190 msec)
> ACL Data RX: Handle 57 flags 0x02 dlen 9                                                                         #216 16.014205
      ATT: Write Request (0x12) len 4
        Handle: 0x0139
          Data: 0100
zephyr.exe[2478701]: < HCI Command: Host Number of Completed Packets (0x03|0x0035) plen 5                          #217 16.022918
        Num handles: 1
        Handle: 57 Address: DF:A9:FF:F6:B1:1A (OUI DF-A9-FF)
        Count: 1
zephyr.exe[2478701]: < ACL Data TX: Handle 57 flags 0x00 dlen 5                                                    #218 16.023013
      ATT: Write Response (0x13) len 0
> HCI Event: Number of Completed Packets (0x13) plen 5                                                             #219 16.213991
        Num handles: 1
        Handle: 57 Address: DF:A9:FF:F6:B1:1A (OUI DF-A9-FF)
        Count: 1
        #218: len 5 (0 Kb/s)
        Latency: 190 msec (90-191 msec ~190 msec)
> ACL Data RX: Handle 57 flags 0x02 dlen 9                                                                         #220 16.214196
      ATT: Write Request (0x12) len 4
        Handle: 0x0140
          Data: 0000
zephyr.exe[2478701]: < HCI Command: Host Number of Completed Packets (0x03|0x0035) plen 5                          #221 16.222994
        Num handles: 1
        Handle: 57 Address: DF:A9:FF:F6:B1:1A (OUI DF-A9-FF)
        Count: 1
zephyr.exe[2478701]: < ACL Data TX: Handle 57 flags 0x00 dlen 5                                                    #222 16.223104
      ATT: Write Response (0x13) len 0
> HCI Event: Number of Completed Packets (0x13) plen 5                                                             #223 16.413992
        Num handles: 1
        Handle: 57 Address: DF:A9:FF:F6:B1:1A (OUI DF-A9-FF)
        Count: 1
        #222: len 5 (0 Kb/s)
        Latency: 190 msec (90-191 msec ~190 msec)
> ACL Data RX: Handle 57 flags 0x02 dlen 9                                                                         #224 16.414174
      ATT: Write Request (0x12) len 4
        Handle: 0x0140
          Data: 0100
zephyr.exe[2478701]: < HCI Command: Host Number of Completed Packets (0x03|0x0035) plen 5                          #225 16.422962
        Num handles: 1
        Handle: 57 Address: DF:A9:FF:F6:B1:1A (OUI DF-A9-FF)
        Count: 1
zephyr.exe[2478701]: < ACL Data TX: Handle 57 flags 0x00 dlen 5                                                    #226 16.423074
      ATT: Write Response (0x13) len 0
> HCI Event: Number of Completed Packets (0x13) plen 5                                                             #227 16.613957
        Num handles: 1
        Handle: 57 Address: DF:A9:FF:F6:B1:1A (OUI DF-A9-FF)
        Count: 1
        #226: len 5 (0 Kb/s)
        Latency: 190 msec (90-191 msec ~190 msec)
> ACL Data RX: Handle 57 flags 0x02 dlen 9                                                                         #228 16.614138
      ATT: Write Request (0x12) len 4
        Handle: 0x0143
          Data: 0000
zephyr.exe[2478701]: < HCI Command: Host Number of Completed Packets (0x03|0x0035) plen 5                          #229 16.622976
        Num handles: 1
        Handle: 57 Address: DF:A9:FF:F6:B1:1A (OUI DF-A9-FF)
        Count: 1
zephyr.exe[2478701]: < ACL Data TX: Handle 57 flags 0x00 dlen 5                                                    #230 16.623087
      ATT: Write Response (0x13) len 0
> HCI Event: Number of Completed Packets (0x13) plen 5                                                             #231 16.813961
        Num handles: 1
        Handle: 57 Address: DF:A9:FF:F6:B1:1A (OUI DF-A9-FF)
        Count: 1
        #230: len 5 (0 Kb/s)
        Latency: 190 msec (90-191 msec ~190 msec)
> ACL Data RX: Handle 57 flags 0x02 dlen 9                                                                         #232 16.814220
      ATT: Write Request (0x12) len 4
        Handle: 0x0143
          Data: 0100
zephyr.exe[2478701]: < HCI Command: Host Number of Completed Packets (0x03|0x0035) plen 5                          #233 16.823090
        Num handles: 1
        Handle: 57 Address: DF:A9:FF:F6:B1:1A (OUI DF-A9-FF)
        Count: 1
zephyr.exe[2478701]: < ACL Data TX: Handle 57 flags 0x00 dlen 5                                                    #234 16.823222
      ATT: Write Response (0x13) len 0
> HCI Event: Number of Completed Packets (0x13) plen 5                                                             #235 17.014080
        Num handles: 1
        Handle: 57 Address: DF:A9:FF:F6:B1:1A (OUI DF-A9-FF)
        Count: 1
        #234: len 5 (0 Kb/s)
        Latency: 190 msec (90-191 msec ~190 msec)
> ACL Data RX: Handle 57 flags 0x02 dlen 9                                                                         #236 17.014124
      ATT: Write Request (0x12) len 4
        Handle: 0x0146
          Data: 0000
zephyr.exe[2478701]: < HCI Command: Host Number of Completed Packets (0x03|0x0035) plen 5                          #237 17.022947
        Num handles: 1
        Handle: 57 Address: DF:A9:FF:F6:B1:1A (OUI DF-A9-FF)
        Count: 1
zephyr.exe[2478701]: < ACL Data TX: Handle 57 flags 0x00 dlen 5                                                    #238 17.023016
      ATT: Write Response (0x13) len 0
> HCI Event: Number of Completed Packets (0x13) plen 5                                                             #239 17.213990
        Num handles: 1
        Handle: 57 Address: DF:A9:FF:F6:B1:1A (OUI DF-A9-FF)
        Count: 1
        #238: len 5 (0 Kb/s)
        Latency: 190 msec (90-191 msec ~190 msec)
> ACL Data RX: Handle 57 flags 0x02 dlen 9                                                                         #240 17.214147
      ATT: Write Request (0x12) len 4
        Handle: 0x0146
          Data: 0100
zephyr.exe[2478701]: < HCI Command: Host Number of Completed Packets (0x03|0x0035) plen 5                          #241 17.222988
        Num handles: 1
        Handle: 57 Address: DF:A9:FF:F6:B1:1A (OUI DF-A9-FF)
        Count: 1
zephyr.exe[2478701]: < ACL Data TX: Handle 57 flags 0x00 dlen 5                                                    #242 17.223077
      ATT: Write Response (0x13) len 0
> HCI Event: Number of Completed Packets (0x13) plen 5                                                             #243 17.413955
        Num handles: 1
        Handle: 57 Address: DF:A9:FF:F6:B1:1A (OUI DF-A9-FF)
        Count: 1
        #242: len 5 (0 Kb/s)
        Latency: 190 msec (90-191 msec ~190 msec)
> ACL Data RX: Handle 57 flags 0x02 dlen 9                                                                         #244 17.414129
      ATT: Write Request (0x12) len 4
        Handle: 0x0149
          Data: 0000
zephyr.exe[2478701]: < HCI Command: Host Number of Completed Packets (0x03|0x0035) plen 5                          #245 17.422953
        Num handles: 1
        Handle: 57 Address: DF:A9:FF:F6:B1:1A (OUI DF-A9-FF)
        Count: 1
zephyr.exe[2478701]: < ACL Data TX: Handle 57 flags 0x00 dlen 5                                                    #246 17.423039
      ATT: Write Response (0x13) len 0
> HCI Event: Number of Completed Packets (0x13) plen 5                                                             #247 17.613953
        Num handles: 1
        Handle: 57 Address: DF:A9:FF:F6:B1:1A (OUI DF-A9-FF)
        Count: 1
        #246: len 5 (0 Kb/s)
        Latency: 190 msec (90-191 msec ~190 msec)
> ACL Data RX: Handle 57 flags 0x02 dlen 9                                                                         #248 17.614117
      ATT: Write Request (0x12) len 4
        Handle: 0x0149
          Data: 0100
zephyr.exe[2478701]: < HCI Command: Host Number of Completed Packets (0x03|0x0035) plen 5                          #249 17.622986
        Num handles: 1
        Handle: 57 Address: DF:A9:FF:F6:B1:1A (OUI DF-A9-FF)
        Count: 1
zephyr.exe[2478701]: < ACL Data TX: Handle 57 flags 0x00 dlen 5                                                    #250 17.623060
      ATT: Write Response (0x13) len 0
> HCI Event: Number of Completed Packets (0x13) plen 5                                                             #251 17.813951
        Num handles: 1
        Handle: 57 Address: DF:A9:FF:F6:B1:1A (OUI DF-A9-FF)
        Count: 1
        #250: len 5 (0 Kb/s)
        Latency: 190 msec (90-191 msec ~190 msec)
> ACL Data RX: Handle 57 flags 0x02 dlen 9                                                                         #252 17.814118
      ATT: Write Request (0x12) len 4
        Handle: 0x014c
          Data: 0000
zephyr.exe[2478701]: < HCI Command: Host Number of Completed Packets (0x03|0x0035) plen 5                          #253 17.823082
        Num handles: 1
        Handle: 57 Address: DF:A9:FF:F6:B1:1A (OUI DF-A9-FF)
        Count: 1
zephyr.exe[2478701]: < ACL Data TX: Handle 57 flags 0x00 dlen 5                                                    #254 17.823195
      ATT: Write Response (0x13) len 0
> HCI Event: Number of Completed Packets (0x13) plen 5                                                             #255 18.013955
        Num handles: 1
        Handle: 57 Address: DF:A9:FF:F6:B1:1A (OUI DF-A9-FF)
        Count: 1
        #254: len 5 (0 Kb/s)
        Latency: 190 msec (90-191 msec ~190 msec)
> ACL Data RX: Handle 57 flags 0x02 dlen 9                                                                         #256 18.014110
      ATT: Write Request (0x12) len 4
        Handle: 0x014c
          Data: 0100
zephyr.exe[2478701]: < HCI Command: Host Number of Completed Packets (0x03|0x0035) plen 5                          #257 18.023025
        Num handles: 1
        Handle: 57 Address: DF:A9:FF:F6:B1:1A (OUI DF-A9-FF)
        Count: 1
zephyr.exe[2478701]: < ACL Data TX: Handle 57 flags 0x00 dlen 5                                                    #258 18.023154
      ATT: Write Response (0x13) len 0
> HCI Event: Number of Completed Packets (0x13) plen 5                                                             #259 18.213910
        Num handles: 1
        Handle: 57 Address: DF:A9:FF:F6:B1:1A (OUI DF-A9-FF)
        Count: 1
        #258: len 5 (0 Kb/s)
        Latency: 190 msec (90-191 msec ~190 msec)
> ACL Data RX: Handle 57 flags 0x02 dlen 7                                                                         #260 18.214067
      ATT: Read Request (0x0a) len 2
        Handle: 0x0142
zephyr.exe[2478701]: < HCI Command: Host Number of Completed Packets (0x03|0x0035) plen 5                          #261 18.223027
        Num handles: 1
        Handle: 57 Address: DF:A9:FF:F6:B1:1A (OUI DF-A9-FF)
        Count: 1
zephyr.exe[2478701]: < ACL Data TX: Handle 57 flags 0x00 dlen 7                                                    #262 18.223148
      ATT: Read Response (0x0b) len 2
> HCI Event: Number of Completed Packets (0x13) plen 5                                                             #263 18.413954
        Num handles: 1
        Handle: 57 Address: DF:A9:FF:F6:B1:1A (OUI DF-A9-FF)
        Count: 1
        #262: len 7 (0 Kb/s)
        Latency: 190 msec (90-191 msec ~190 msec)
> ACL Data RX: Handle 57 flags 0x02 dlen 7                                                                         #264 18.414154
      ATT: Read Request (0x0a) len 2
        Handle: 0x0145
zephyr.exe[2478701]: < HCI Command: Host Number of Completed Packets (0x03|0x0035) plen 5                          #265 18.423029
        Num handles: 1
        Handle: 57 Address: DF:A9:FF:F6:B1:1A (OUI DF-A9-FF)
        Count: 1
zephyr.exe[2478701]: < ACL Data TX: Handle 57 flags 0x00 dlen 7                                                    #266 18.423140
      ATT: Read Response (0x0b) len 2
> HCI Event: Number of Completed Packets (0x13) plen 5                                                             #267 18.613968
        Num handles: 1
        Handle: 57 Address: DF:A9:FF:F6:B1:1A (OUI DF-A9-FF)
        Count: 1
        #266: len 7 (0 Kb/s)
        Latency: 190 msec (90-191 msec ~190 msec)
> ACL Data RX: Handle 57 flags 0x02 dlen 7                                                                         #268 18.614086
      ATT: Read Request (0x0a) len 2
        Handle: 0x0148
zephyr.exe[2478701]: < HCI Command: Host Number of Completed Packets (0x03|0x0035) plen 5                          #269 18.622622
        Num handles: 1
        Handle: 57 Address: DF:A9:FF:F6:B1:1A (OUI DF-A9-FF)
        Count: 1
zephyr.exe[2478701]: < ACL Data TX: Handle 57 flags 0x00 dlen 7                                                    #270 18.622722
      ATT: Read Response (0x0b) len 2
> HCI Event: Number of Completed Packets (0x13) plen 5                                                             #271 18.813912
        Num handles: 1
        Handle: 57 Address: DF:A9:FF:F6:B1:1A (OUI DF-A9-FF)
        Count: 1
        #270: len 7 (0 Kb/s)
        Latency: 191 msec (90-191 msec ~191 msec)
> ACL Data RX: Handle 57 flags 0x02 dlen 7                                                                         #272 18.814013
      ATT: Read Request (0x0a) len 2
        Handle: 0x014b
zephyr.exe[2478701]: < HCI Command: Host Number of Completed Packets (0x03|0x0035) plen 5                          #273 18.823040
        Num handles: 1
        Handle: 57 Address: DF:A9:FF:F6:B1:1A (OUI DF-A9-FF)
        Count: 1
zephyr.exe[2478701]: < ACL Data TX: Handle 57 flags 0x00 dlen 7                                                    #274 18.823133
      ATT: Read Response (0x0b) len 2
> HCI Event: Number of Completed Packets (0x13) plen 5                                                             #275 19.013942
        Num handles: 1
        Handle: 57 Address: DF:A9:FF:F6:B1:1A (OUI DF-A9-FF)
        Count: 1
        #274: len 7 (0 Kb/s)
        Latency: 190 msec (90-191 msec ~190 msec)
> ACL Data RX: Handle 57 flags 0x02 dlen 9                                                                         #276 19.014070
      ATT: Write Request (0x12) len 4
        Handle: 0x0156
          Data: 0000
zephyr.exe[2478701]: < HCI Command: Host Number of Completed Packets (0x03|0x0035) plen 5                          #277 19.022998
        Num handles: 1
        Handle: 57 Address: DF:A9:FF:F6:B1:1A (OUI DF-A9-FF)
        Count: 1
zephyr.exe[2478701]: < ACL Data TX: Handle 57 flags 0x00 dlen 5                                                    #278 19.023076
      ATT: Write Response (0x13) len 0
> HCI Event: Number of Completed Packets (0x13) plen 5                                                             #279 19.213976
        Num handles: 1
        Handle: 57 Address: DF:A9:FF:F6:B1:1A (OUI DF-A9-FF)
        Count: 1
        #278: len 5 (0 Kb/s)
        Latency: 190 msec (90-191 msec ~190 msec)
> ACL Data RX: Handle 57 flags 0x02 dlen 9                                                                         #280 19.214178
      ATT: Write Request (0x12) len 4
        Handle: 0x0156
          Data: 0100
zephyr.exe[2478701]: < HCI Command: Host Number of Completed Packets (0x03|0x0035) plen 5                          #281 19.222942
        Num handles: 1
        Handle: 57 Address: DF:A9:FF:F6:B1:1A (OUI DF-A9-FF)
        Count: 1
zephyr.exe[2478701]: < ACL Data TX: Handle 57 flags 0x00 dlen 5                                                    #282 19.223024
      ATT: Write Response (0x13) len 0
> HCI Event: Number of Completed Packets (0x13) plen 5                                                             #283 19.413886
        Num handles: 1
        Handle: 57 Address: DF:A9:FF:F6:B1:1A (OUI DF-A9-FF)
        Count: 1
        #282: len 5 (0 Kb/s)
        Latency: 190 msec (90-191 msec ~190 msec)
> ACL Data RX: Handle 57 flags 0x02 dlen 7                                                                         #284 19.414030
      ATT: Read Request (0x0a) len 2
        Handle: 0x0135
zephyr.exe[2478701]: < HCI Command: Host Number of Completed Packets (0x03|0x0035) plen 5                          #285 19.423064
        Num handles: 1
        Handle: 57 Address: DF:A9:FF:F6:B1:1A (OUI DF-A9-FF)
        Count: 1
zephyr.exe[2478701]: < ACL Data TX: Handle 57 flags 0x00 dlen 9                                                    #286 19.423154
      ATT: Read Response (0x0b) len 4
> HCI Event: Number of Completed Packets (0x13) plen 5                                                             #287 19.614004
        Num handles: 1
        Handle: 57 Address: DF:A9:FF:F6:B1:1A (OUI DF-A9-FF)
        Count: 1
        #286: len 9 (0 Kb/s)
        Latency: 190 msec (90-191 msec ~190 msec)
> ACL Data RX: Handle 57 flags 0x02 dlen 7                                                                         #288 19.614062
      ATT: Read Request (0x0a) len 2
        Handle: 0x0132
zephyr.exe[2478701]: < HCI Command: Host Number of Completed Packets (0x03|0x0035) plen 5                          #289 19.623068
        Num handles: 1
        Handle: 57 Address: DF:A9:FF:F6:B1:1A (OUI DF-A9-FF)
        Count: 1
zephyr.exe[2478701]: < ACL Data TX: Handle 57 flags 0x00 dlen 27                                                   #290 19.623234
zephyr.exe[2478701]: < ACL Data TX: Handle 57 flags 0x01 dlen 27                                                   #291 19.623328
zephyr.exe[2478701]: < ACL Data TX: Handle 57 flags 0x01 dlen 12                                                   #292 19.623340
      ATT: Read Response (0x0b) len 61
> HCI Event: Number of Completed Packets (0x13) plen 5                                                             #293 19.714256
        Num handles: 1
        Handle: 57 Address: DF:A9:FF:F6:B1:1A (OUI DF-A9-FF)
        Count: 1
        #290: len 27 (2 Kb/s)
        Latency: 91 msec (90-191 msec ~140 msec)
> HCI Event: Number of Completed Packets (0x13) plen 5                                                             #294 19.714831
        Num handles: 1
        Handle: 57 Address: DF:A9:FF:F6:B1:1A (OUI DF-A9-FF)
        Count: 1
        #291: len 27 (2 Kb/s)
        Latency: 91 msec (90-191 msec ~116 msec)
> HCI Event: Number of Completed Packets (0x13) plen 5                                                             #295 19.813896
        Num handles: 1
        Handle: 57 Address: DF:A9:FF:F6:B1:1A (OUI DF-A9-FF)
        Count: 1
        #292: len 12 (0 Kb/s)
        Latency: 190 msec (90-191 msec ~153 msec)
> ACL Data RX: Handle 57 flags 0x02 dlen 7                                                                         #296 19.814069
      ATT: Read Request (0x0a) len 2
        Handle: 0x0138
zephyr.exe[2478701]: < HCI Command: Host Number of Completed Packets (0x03|0x0035) plen 5                          #297 19.822493
        Num handles: 1
        Handle: 57 Address: DF:A9:FF:F6:B1:1A (OUI DF-A9-FF)
        Count: 1
zephyr.exe[2478701]: < ACL Data TX: Handle 57 flags 0x00 dlen 9                                                    #298 19.822522
      ATT: Read Response (0x0b) len 4
> HCI Event: Number of Completed Packets (0x13) plen 5                                                             #299 20.014114
        Num handles: 1
        Handle: 57 Address: DF:A9:FF:F6:B1:1A (OUI DF-A9-FF)
        Count: 1
        #298: len 9 (0 Kb/s)
        Latency: 191 msec (90-191 msec ~172 msec)
> ACL Data RX: Handle 57 flags 0x02 dlen 7                                                                         #300 20.014122
      ATT: Read Request (0x0a) len 2
        Handle: 0x013b
zephyr.exe[2478701]: < HCI Command: Host Number of Completed Packets (0x03|0x0035) plen 5                          #301 20.022982
        Num handles: 1
        Handle: 57 Address: DF:A9:FF:F6:B1:1A (OUI DF-A9-FF)
        Count: 1
zephyr.exe[2478701]: < ACL Data TX: Handle 57 flags 0x00 dlen 9                                                    #302 20.023056
      ATT: Read Response (0x0b) len 4
> HCI Event: Number of Completed Packets (0x13) plen 5                                                             #303 20.213899
        Num handles: 1
        Handle: 57 Address: DF:A9:FF:F6:B1:1A (OUI DF-A9-FF)
        Count: 1
        #302: len 9 (0 Kb/s)
        Latency: 190 msec (90-191 msec ~181 msec)
> ACL Data RX: Handle 57 flags 0x02 dlen 7                                                                         #304 20.214069
      ATT: Read Request (0x0a) len 2
        Handle: 0x0155
zephyr.exe[2478701]: < HCI Command: Host Number of Completed Packets (0x03|0x0035) plen 5                          #305 20.223235
        Num handles: 1
        Handle: 57 Address: DF:A9:FF:F6:B1:1A (OUI DF-A9-FF)
        Count: 1
zephyr.exe[2478701]: < ACL Data TX: Handle 57 flags 0x00 dlen 6                                                    #306 20.223361
      ATT: Read Response (0x0b) len 1
> HCI Event: Number of Completed Packets (0x13) plen 5                                                             #307 20.413996
        Num handles: 1
        Handle: 57 Address: DF:A9:FF:F6:B1:1A (OUI DF-A9-FF)
        Count: 1
        #306: len 6 (0 Kb/s)
        Latency: 190 msec (90-191 msec ~186 msec)
> ACL Data RX: Handle 57 flags 0x02 dlen 27                                                                        #308 20.414350
> ACL Data RX: Handle 57 flags 0x01 dlen 7                                                                         #309 20.414366
      ATT: Write Command (0x52) len 29
        Handle: 0x013f
          Data: 010103020206000000001002010302020103042800050301000000
zephyr.exe[2478701]: < HCI Command: Host Number of Completed Packets (0x03|0x0035) plen 5                          #310 20.422731
        Num handles: 1
        Handle: 57 Address: DF:A9:FF:F6:B1:1A (OUI DF-A9-FF)
        Count: 1
zephyr.exe[2478701]: < HCI Command: Host Number of Completed Packets (0x03|0x0035) plen 5                          #311 20.423137
        Num handles: 1
        Handle: 57 Address: DF:A9:FF:F6:B1:1A (OUI DF-A9-FF)
        Count: 1
zephyr.exe[2478701]: < ACL Data TX: Handle 57 flags 0x00 dlen 12                                                   #312 20.423388
      ATT: Handle Value Notification (0x1b) len 7
        Handle: 0x013f
          Data: 0101030000
zephyr.exe[2478701]: < ACL Data TX: Handle 57 flags 0x00 dlen 27                                                   #313 20.423428
zephyr.exe[2478701]: < ACL Data TX: Handle 57 flags 0x01 dlen 21                                                   #314 20.423522
      ATT: Handle Value Notification (0x1b) len 43
        Handle: 0x0148
          Data: 03010002020a00102700409c00102700409c0006000000001002010302020103042800050301000000
> HCI Event: Number of Completed Packets (0x13) plen 5                                                             #315 20.514275
        Num handles: 1
        Handle: 57 Address: DF:A9:FF:F6:B1:1A (OUI DF-A9-FF)
        Count: 1
        #312: len 12 (1 Kb/s)
      