Bluetooth monitor ver 5.84
btmon[4083509]: = Note: Linux version 6.8.0-83-generic (x86_64)                                                          0.783585
btmon[4083509]: = Note: Bluetooth subsystem version 2.22                                                                 0.783587
= New Index: 00:00:00:00:00:00 (Primary,UART,hci0)                                                                       0.783588
= Open Index: 00:00:00:00:00:00                                                                                          1.290843
= Index Info: 00:00:00:00:00:00 (Nordic Semiconductor ASA)                                                               1.290847
zephyr.exe[4083511]: @ USER Open: main (privileged) version 2.22                                                {0x0001} 1.290849
zephyr.exe[4083511]: < HCI Command: Reset (0x03|0x0003) plen 0                                                        #1 1.291055
> HCI Event: Command Complete (0x0e) plen 4                                                                           #2 1.291718
      Reset (0x03|0x0003) ncmd 1
        Status: Success (0x00)
zephyr.exe[4083511]: < HCI Command: Read Local Supported Features (0x04|0x0003) plen 0                                #3 1.310792
> HCI Event: Command Complete (0x0e) plen 12                                                                          #4 1.311605
      Read Local Supported Features (0x04|0x0003) ncmd 1
        Status: Success (0x00)
        Features: 0x00 0x00 0x00 0x00 0x60 0x00 0x00 0x00
          BR/EDR Not Supported
          LE Supported (Controller)
zephyr.exe[4083511]: < HCI Command: Read Local Version Information (0x04|0x0001) plen 0                               #5 1.330776
> HCI Event: Command Complete (0x0e) plen 12                                                                          #6 1.332043
      Read Local Version Information (0x04|0x0001) ncmd 1
        Status: Success (0x00)
        HCI version: Reserved (0x0e) - Revision 12520 (0x30e8)
        LMP version: Reserved (0x0e) - Subversion 12520 (0x30e8)
        Manufacturer: Nordic Semiconductor ASA (89)
zephyr.exe[4083511]: < HCI Command: Read Local Supported Commands (0x04|0x0002) plen 0                                #7 1.350751
> HCI Event: Command Complete (0x0e) plen 68                                                                          #8 1.352008
      Read Local Supported Commands (0x04|0x0002) ncmd 1
        Status: Success (0x00)
        Commands: 119 entries
          Disconnect (Octet 0 - Bit 5)
          Read Remote Version Information (Octet 2 - Bit 7)
          Set Event Mask (Octet 5 - Bit 6)
          Reset (Octet 5 - Bit 7)
          Read Connection Accept Timeout (Octet 7 - Bit 2)
          Write Connection Accept Timeout (Octet 7 - Bit 3)
          Read Transmit Power Level (Octet 10 - Bit 2)
          Set Controller To Host Flow Control (Octet 10 - Bit 5)
          Host Buffer Size (Octet 10 - Bit 6)
          Host Number of Completed Packets (Octet 10 - Bit 7)
          Read Local Version Information (Octet 14 - Bit 3)
          Read Local Supported Features (Octet 14 - Bit 5)
          Read BD ADDR (Octet 15 - Bit 1)
          Read RSSI (Octet 15 - Bit 5)
          Set Event Mask Page 2 (Octet 22 - Bit 2)
          LE Set Event Mask (Octet 25 - Bit 0)
          LE Read Buffer Size (Octet 25 - Bit 1)
          LE Read Local Supported Features (Octet 25 - Bit 2)
          LE Set Random Address (Octet 25 - Bit 4)
          LE Set Advertising Parameters (Octet 25 - Bit 5)
          LE Read Advertising Channel TX Power (Octet 25 - Bit 6)
          LE Set Advertising Data (Octet 25 - Bit 7)
          LE Set Scan Response Data (Octet 26 - Bit 0)
          LE Set Advertise Enable (Octet 26 - Bit 1)
          LE Set Scan Parameters (Octet 26 - Bit 2)
          LE Set Scan Enable (Octet 26 - Bit 3)
          LE Create Connection (Octet 26 - Bit 4)
          LE Create Connection Cancel (Octet 26 - Bit 5)
          LE Read Accept List Size (Octet 26 - Bit 6)
          LE Clear Accept List (Octet 26 - Bit 7)
          LE Add Device To Accept List (Octet 27 - Bit 0)
          LE Remove Device From Accept List (Octet 27 - Bit 1)
          LE Connection Update (Octet 27 - Bit 2)
          LE Set Host Channel Classification (Octet 27 - Bit 3)
          LE Read Channel Map (Octet 27 - Bit 4)
          LE Read Remote Used Features (Octet 27 - Bit 5)
          LE Encrypt (Octet 27 - Bit 6)
          LE Rand (Octet 27 - Bit 7)
          LE Start Encryption (Octet 28 - Bit 0)
          LE Long Term Key Request Reply (Octet 28 - Bit 1)
          LE Long Term Key Request Neg Reply (Octet 28 - Bit 2)
          LE Read Supported States (Octet 28 - Bit 3)
          LE Receiver Test (Octet 28 - Bit 4)
          LE Transmitter Test (Octet 28 - Bit 5)
          LE Test End (Octet 28 - Bit 6)
          Read Authenticated Payload Timeout (Octet 32 - Bit 4)
          Write Authenticated Payload Timeout (Octet 32 - Bit 5)
          LE Set Data Length (Octet 33 - Bit 6)
          LE Read Suggested Default Data Length (Octet 33 - Bit 7)
          LE Write Suggested Default Data Length (Octet 34 - Bit 0)
          LE Add Device To Resolving List (Octet 34 - Bit 3)
          LE Remove Device From Resolving List (Octet 34 - Bit 4)
          LE Clear Resolving List (Octet 34 - Bit 5)
          LE Read Resolving List Size (Octet 34 - Bit 6)
          LE Set Address Resolution Enable (Octet 35 - Bit 1)
          LE Set Resolvable Private Address Timeout (Octet 35 - Bit 2)
          LE Read Maximum Data Length (Octet 35 - Bit 3)
          LE Read PHY (Octet 35 - Bit 4)
          LE Set Default PHY (Octet 35 - Bit 5)
          LE Set PHY (Octet 35 - Bit 6)
          LE Enhanced Receiver Test (Octet 35 - Bit 7)
          LE Enhanced Transmitter Test (Octet 36 - Bit 0)
          LE Set Advertising Set Random Address (Octet 36 - Bit 1)
          LE Set Extended Advertising Parameters (Octet 36 - Bit 2)
          LE Set Extended Advertising Data (Octet 36 - Bit 3)
          LE Set Extended Scan Response Data (Octet 36 - Bit 4)
          LE Set Extended Advertising Enable (Octet 36 - Bit 5)
          LE Read Maximum Advertising Data Length (Octet 36 - Bit 6)
          LE Read Number of Supported Advertising Sets (Octet 36 - Bit 7)
          LE Remove Advertising Set (Octet 37 - Bit 0)
          LE Clear Advertising Sets (Octet 37 - Bit 1)
          LE Set Periodic Advertising Parameters (Octet 37 - Bit 2)
          LE Set Periodic Advertising Data (Octet 37 - Bit 3)
          LE Set Periodic Advertising Enable (Octet 37 - Bit 4)
          LE Set Extended Scan Parameters (Octet 37 - Bit 5)
          LE Set Extended Scan Enable (Octet 37 - Bit 6)
          LE Extended Create Connection (Octet 37 - Bit 7)
          LE Periodic Advertising Create Sync (Octet 38 - Bit 0)
          LE Periodic Advertising Create Sync Cancel (Octet 38 - Bit 1)
          LE Periodic Advertising Terminate Sync (Octet 38 - Bit 2)
          LE Add Device To Periodic Advertiser List (Octet 38 - Bit 3)
          LE Remove Device From Periodic Advertiser List (Octet 38 - Bit 4)
          LE Clear Periodic Advertiser List (Octet 38 - Bit 5)
          LE Read Periodic Advertiser List Size (Octet 38 - Bit 6)
          LE Read Transmit Power (Octet 38 - Bit 7)
          LE Read RF Path Compensation (Octet 39 - Bit 0)
          LE Write RF Path Compensation (Octet 39 - Bit 1)
          LE Set Privacy Mode (Octet 39 - Bit 2)
          LE Periodic Advertising Receive Enable (Octet 40 - Bit 5)
          LE Periodic Advertising Sync Transfer (Octet 40 - Bit 6)
          LE Periodic Advertising Set Info Transfer (Octet 40 - Bit 7)
          LE Periodic Advertising Sync Transfer Parameters (Octet 41 - Bit 0)
          LE Set Default Periodic Advertisng Sync Transfer Parameters (Octet 41 - Bit 1)
          LE Read Buffer v2 (Octet 41 - Bit 5)
          LE Read ISO TX Sync (Octet 41 - Bit 6)
          LE Set Connected Isochronous Group Parameters (Octet 41 - Bit 7)
          LE Set Connected Isochronous Group Parameters Test (Octet 42 - Bit 0)
          LE Create Connected Isochronous Stream (Octet 42 - Bit 1)
          LE Remove Connected Isochronous Group (Octet 42 - Bit 2)
          LE Accept Connected Isochronous Stream Request (Octet 42 - Bit 3)
          LE Reject Connected Isochronous Stream Request (Octet 42 - Bit 4)
          LE Create Broadcast Isochronous Group (Octet 42 - Bit 5)
          LE Create Broadcast Isochronous Group Test (Octet 42 - Bit 6)
          LE Terminate Broadcast Isochronous Group (Octet 42 - Bit 7)
          LE Broadcast Isochronous Group Create Sync (Octet 43 - Bit 0)
          LE Broadcast Isochronous Group Terminate Sync (Octet 43 - Bit 1)
          LE Request Peer SCA (Octet 43 - Bit 2)
          LE Setup Isochronous Data Path (Octet 43 - Bit 3)
          LE Remove Isochronous Data Path (Octet 43 - Bit 4)
          LE Isochronous Transmit Test (Octet 43 - Bit 5)
          LE Isochronous Receive Test (Octet 43 - Bit 6)
          LE Isochronous Read Test Counters (Octet 43 - Bit 7)
          LE Isochronous Read Test Counters (Octet 44 - Bit 0)
          LE Set Host Feature (Octet 44 - Bit 1)
          LE Read ISO link quality (Octet 44 - Bit 2)
          Octet 45 - Bit 6 
          Octet 46 - Bit 0 
          Octet 46 - Bit 1 
          Octet 46 - Bit 2 
zephyr.exe[4083511]: < HCI Command: Host Buffer Size (0x03|0x0033) plen 7                                             #9 1.370752
        ACL MTU: 255  ACL max packet: 16
        SCO MTU: 0    SCO max packet: 0
> HCI Event: Command Complete (0x0e) plen 4                                                                          #10 1.371404
      Host Buffer Size (0x03|0x0033) ncmd 1
        Status: Success (0x00)
zephyr.exe[4083511]: < HCI Command: Set Controller To Host Flow Control (0x03|0x0031) plen 1                         #11 1.390774
        Flow control: ACL Data Packets (0x01)
> HCI Event: Command Complete (0x0e) plen 4                                                                          #12 1.391323
      Set Controller To Host Flow Control (0x03|0x0031) ncmd 1
        Status: Success (0x00)
zephyr.exe[4083511]: < HCI Command: LE Read Local Supported Features (0x08|0x0003) plen 0                            #13 1.410778
> HCI Event: Command Complete (0x0e) plen 12                                                                         #14 1.411510
      LE Read Local Supported Features (0x08|0x0003) ncmd 1
        Status: Success (0x00)
        Features: 0xfd 0x79 0x00 0xf7 0x30 0x01 0x00 0x00
          LE Encryption
          Extended Reject Indication
          Peripheral-initiated Features Exchange
          LE Ping
          LE Data Packet Length Extension
          LL Privacy
          Extended Scanner Filter Policies
          LE 2M PHY
          LE Coded PHY
          LE Extended Advertising
          LE Periodic Advertising
          Channel Selection Algorithm #2
          Periodic Advertising Sync Transfer - Sender
          Periodic Advertising Sync Transfer - Recipient
          Sleep Clock Accuracy Updates
          Connected Isochronous Stream - Central
          Connected Isochronous Stream - Peripheral
          Isochronous Broadcaster
          Synchronized Receiver
          Periodic Advertising ADI support
          Connection Subrating
          Unknown features (0x0000010000000000)
zephyr.exe[4083511]: < HCI Command: LE Set Host Feature (0x08|0x0074) plen 2                                         #15 1.430765
        Bit Number: 32
          Connected Isochronous Stream (Host Support)
        Bit Value: 1
> HCI Event: Command Complete (0x0e) plen 4                                                                          #16 1.431560
      LE Set Host Feature (0x08|0x0074) ncmd 1
        Status: Success (0x00)
zephyr.exe[4083511]: < HCI Command: LE Read Buffer v2 (0x08|0x0060) plen 0                                           #17 1.450692
> HCI Event: Command Complete (0x0e) plen 10                                                                         #18 1.451601
      LE Read Buffer v2 (0x08|0x0060) ncmd 1
        Status: Success (0x00)
        ACL MTU: 27
        ACL max packet: 3
        ISO MTU: 318
        ISO max packet: 3
zephyr.exe[4083511]: < HCI Command: LE Read Maximum Advertising Data Length (0x08|0x003a) plen 0                     #19 1.470745
> HCI Event: Command Complete (0x0e) plen 6                                                                          #20 1.471256
      LE Read Maximum Advertising Data Length (0x08|0x003a) ncmd 1
        Status: Success (0x00)
        Max length: 1650
zephyr.exe[4083511]: < HCI Command: LE Read Supported States (0x08|0x001c) plen 0                                    #21 1.490697
> HCI Event: Command Complete (0x0e) plen 12                                                                         #22 1.491247
      LE Read Supported States (0x08|0x001c) ncmd 1
        Status: Success (0x00)
        States: 0x000003ff3e0306ff
          Non-connectable Advertising State
          Scannable Advertising State
          Connectable Advertising State
          High Duty Cycle Directed Advertising State
          Passive Scanning State
          Active Scanning State
          Initiating State
            and Connection State (Central Role)
          Connection State (Peripheral Role)
          Scannable Advertising State
            and Passive Scanning State
          Connectable Advertising State
            and Passive Scanning State
          Non-connectable Advertising State
            and Initiating State
          Scannable Advertising State
            and Initiating State
          Active Scanning State
            and Connection State (Central Role)
          Passive Scanning State
            and Connection State (Peripheral Role)
          Active Scanning State
            and Connection State (Peripheral Role)
          Initiating State
            and Connection State (Central Role)
            and Central Role & Central Role
          Low Duty Cycle Directed Advertising State
          Connectable Advertising State
            and Initiating State
            and Central Role & Peripheral Role
          High Duty Cycle Directed Advertising State
            and Initiating State
            and Central Role & Peripheral Role
          Low Duty Cycle Directed Advertising State
            and Initiating State
            and Central Role & Peripheral Role
          Connectable Advertising State
            and Connection State (Central Role)
            and Central Role & Peripheral Role
          High Duty Cycle Directed Advertising State
            and Connection State (Central Role)
            and Central Role & Peripheral Role
          Low Duty Cycle Directed Advertising State
            and Connection State (Central Role)
            and Central Role & Peripheral Role
          Connectable Advertising State
            and Connection State (Peripheral Role)
            and Central Role & Peripheral Role
          High Duty Cycle Directed Advertising State
            and Connection State (Peripheral Role)
            and Peripheral Role & Peripheral Role
          Low Duty Cycle Directed Advertising State
            and Connection State (Peripheral Role)
            and Peripheral Role & Peripheral Role
          Initiating State
            and Connection State (Peripheral Role)
            and Central Role & Peripheral Role
zephyr.exe[4083511]: < HCI Command: LE Read Maximum Data Length (0x08|0x002f) plen 0                                 #23 1.510699
> HCI Event: Command Complete (0x0e) plen 12                                                                         #24 1.511509
      LE Read Maximum Data Length (0x08|0x002f) ncmd 1
        Status: Success (0x00)
        Max TX octets: 251
        Max TX time: 2704
        Max RX octets: 251
        Max RX time: 2704
zephyr.exe[4083511]: < HCI Command: LE Write Suggested Default Data Length (0x08|0x0024) plen 4                      #25 1.530681
        TX octets: 251
        TX time: 2704
> HCI Event: Command Complete (0x0e) plen 4                                                                          #26 1.531464
      LE Write Suggested Default Data Length (0x08|0x0024) ncmd 1
        Status: Success (0x00)
zephyr.exe[4083511]: < HCI Command: LE Read Resolving List Size (0x08|0x002a) plen 0                                 #27 1.550700
> HCI Event: Command Complete (0x0e) plen 5                                                                          #28 1.551479
      LE Read Resolving List Size (0x08|0x002a) ncmd 1
        Status: Success (0x00)
        Size: 8
zephyr.exe[4083511]: < HCI Command: LE Set Event Mask (0x08|0x0001) plen 8                                           #29 1.570702
        Mask: 0x000002023f87fa5e
          LE Advertising Report
          LE Connection Update Complete
          LE Read Remote Used Features Complete
          LE Long Term Key Request
          LE Data Length Change
          LE Enhanced Connection Complete
          LE PHY Update Complete
          LE Extended Advertising Report
          LE Periodic Advertising Sync Established
          LE Periodic Advertising Report
          LE Periodic Advertising Sync Lost
          LE Extended Scan Timeout
          LE Extended Advertising Set Terminated
          LE Scan Request Received
          LE Periodic Advertising Sync Transfer Rvc
          LE CIS Established
          LE CIS Request
          LE Create BIG Complete
          LE Terminate BIG Complete
          LE BIG Sync Established Complete
          LE BIG Sync Lost
          LE BIG Info Advertising Report
          Unknown mask (0x0000020000000000)
> HCI Event: Command Complete (0x0e) plen 4                                                                          #30 1.571665
      LE Set Event Mask (0x08|0x0001) ncmd 1
        Status: Success (0x00)
zephyr.exe[4083511]: < HCI Command: Set Event Mask (0x03|0x0001) plen 8                                              #31 1.590773
        Mask: 0x2000800002008890
          Disconnection Complete
          Encryption Change
          Read Remote Version Information Complete
          Hardware Error
          Data Buffer Overflow
          Encryption Key Refresh Complete
          LE Meta
> HCI Event: Command Complete (0x0e) plen 4                                                                          #32 1.591686
      Set Event Mask (0x03|0x0001) ncmd 1
        Status: Success (0x00)
zephyr.exe[4083511]: < HCI Command: Read BD ADDR (0x04|0x0009) plen 0                                                #33 1.610757
> HCI Event: Command Complete (0x0e) plen 10                                                                         #34 1.611567
      Read BD ADDR (0x04|0x0009) ncmd 1
        Status: Success (0x00)
        Address: 00:00:00:00:00:00 (OUI 00-00-00)
zephyr.exe[4083511]: < HCI Command: LE Set Random Address (0x08|0x0005) plen 6                                       #35 1.630790
        Address: D5:B6:CC:31:DB:3B (Static)
> HCI Event: Command Complete (0x0e) plen 4                                                                          #36 1.631550
      LE Set Random Address (0x08|0x0005) ncmd 1
        Status: Success (0x00)
zephyr.exe[4083511]: < HCI Command: LE Set Extended Advertising Parameters (0x08|0x0036) plen 25                     #37 4.170851
        Handle: 0x00
        Properties: 0x0013
          Connectable
          Scannable
          Use legacy advertising PDUs: ADV_IND
        Min advertising interval: 100.000 msec (0x00a0)
        Max advertising interval: 150.000 msec (0x00f0)
        Channel map: 37, 38, 39 (0x07)
        Own address type: Random (0x01)
        Peer address type: Public (0x00)
        Peer address: 00:00:00:00:00:00 (OUI 00-00-00)
        Filter policy: Allow Scan Request from Any, Allow Connect Request from Any (0x00)
        TX power: Host has no preference (0x7f)
        Primary PHY: LE 1M (0x01)
        Secondary max skip: 0x00
        Secondary PHY: LE 1M (0x01)
        SID: 0x00
        Scan request notifications: Disabled (0x00)
> HCI Event: Command Complete (0x0e) plen 5                                                                          #38 4.171717
      LE Set Extended Advertising Parameters (0x08|0x0036) ncmd 1
        Status: Success (0x00)
        TX power (selected): 0 dbm (0x00)
zephyr.exe[4083511]: < HCI Command: LE Set Advertising Set Random Address (0x08|0x0035) plen 7                       #39 4.190816
        Advertising handle: 0x00
        Advertising random address: D5:B6:CC:31:DB:3B (Static)
> HCI Event: Command Complete (0x0e) plen 4                                                                          #40 4.191440
      LE Set Advertising Set Random Address (0x08|0x0035) ncmd 1
        Status: Success (0x00)
zephyr.exe[4083511]: < HCI Command: LE Set Extended Advertising Data (0x08|0x0037) plen 22                           #41 4.210814
        Handle: 0x00
        Operation: Complete extended advertising data (0x03)
        Fragment preference: Minimize fragmentation (0x01)
        Data length: 0x12
        Flags: 0x06
          LE General Discoverable Mode
          BR/EDR Not Supported
        Name (complete): Tester_F6B11A
> HCI Event: Command Complete (0x0e) plen 4                                                                          #42 4.211662
      LE Set Extended Advertising Data (0x08|0x0037) ncmd 1
        Status: Success (0x00)
zephyr.exe[4083511]: < HCI Command: LE Set Extended Scan Response Data (0x08|0x0038) plen 4                          #43 4.230834
        Handle: 0x00
        Operation: Complete scan response data (0x03)
        Fragment preference: Minimize fragmentation (0x01)
        Data length: 0x00
> HCI Event: Command Complete (0x0e) plen 4                                                                          #44 4.231777
      LE Set Extended Scan Response Data (0x08|0x0038) ncmd 1
        Status: Success (0x00)
zephyr.exe[4083511]: < HCI Command: LE Set Extended Advertising Enable (0x08|0x0039) plen 6                          #45 4.250825
        Extended advertising: Enabled (0x01)
        Number of sets: 1 (0x01)
        Entry 0
          Handle: 0x00
          Duration: 0 ms (0x00)
          Max ext adv events: 0
> HCI Event: Command Complete (0x0e) plen 4                                                                          #46 4.251775
      LE Set Extended Advertising Enable (0x08|0x0039) ncmd 1
        Status: Success (0x00)
> HCI Event: LE Meta Event (0x3e) plen 31                                                                            #47 4.364192
      LE Enhanced Connection Complete (0x0a)
        Status: Success (0x00)
        Handle: 435
        Role: Peripheral (0x01)
        Peer address type: Public (0x00)
        Peer address: DF:A9:FF:F6:B1:1A (OUI DF-A9-FF)
        Local resolvable private address: 00:00:00:00:00:00 (Non-Resolvable)
        Peer resolvable private address: 00:00:00:00:00:00 (Non-Resolvable)
        Connection interval: 150.00 msec (0x0078)
        Connection latency: 0 (0x0000)
        Supervision timeout: 25120 msec (0x09d0)
        Central clock accuracy: 0x01
> HCI Event: LE Meta Event (0x3e) plen 6                                                                             #48 4.364357
      LE Advertising Set Terminated (0x12)
        Status: Success (0x00)
        Handle: 0
        Connection handle: 435
        Number of completed extended advertising events: 0
zephyr.exe[4083511]: < HCI Command: LE Read Remote Used Features (0x08|0x0016) plen 2                                #49 4.370918
        Handle: 435 Address: DF:A9:FF:F6:B1:1A (OUI DF-A9-FF)
> HCI Event: Command Status (0x0f) plen 4                                                                            #50 4.371543
      LE Read Remote Used Features (0x08|0x0016) ncmd 1
        Status: Success (0x00)
zephyr.exe[4083511]: < ACL Data TX: Handle 435 [1/3] flags 0x00 dlen 7                                               #51 4.390873
      ATT: Exchange MTU Request (0x02) len 2
        Client RX MTU: 251
> HCI Event: Number of Completed Packets (0x13) plen 5                                                               #52 4.665465
        Num handles: 1
        Handle: 435 Address: DF:A9:FF:F6:B1:1A (OUI DF-A9-FF)
        Count: 1
        Buffers: 0/3
        #51: len 7 (0 Kb/s)
        Latency: 274 msec (274-274 msec ~274 msec)
> HCI Event: LE Meta Event (0x3e) plen 12                                                                            #53 4.815934
      LE Read Remote Used Features (0x04)
        Status: Success (0x00)
        Handle: 435 Address: DF:A9:FF:F6:B1:1A (OUI DF-A9-FF)
        Features: 0x2d 0x49 0x00 0xf7 0x67 0xd8 0x00 0x00
          LE Encryption
          Extended Reject Indication
          Peripheral-initiated Features Exchange
          LE Data Packet Length Extension
          LE 2M PHY
          LE Coded PHY
          Channel Selection Algorithm #2
          Periodic Advertising Sync Transfer - Sender
          Periodic Advertising Sync Transfer - Recipient
          Sleep Clock Accuracy Updates
          Connected Isochronous Stream - Central
          Connected Isochronous Stream - Peripheral
          Isochronous Broadcaster
          Synchronized Receiver
          Connected Isochronous Stream (Host Support)
          LE Power Control Request
          LE Power Control Request
          Connection Subrating
          Connection Subrating (Host Support)
          Unknown features (0x0000d80000000000)
> ACL Data RX: Handle 435 flags 0x02 dlen 7                                                                          #54 5.565318
      ATT: Exchange MTU Request (0x02) len 2
        Client RX MTU: 49
> ACL Data RX: Handle 435 flags 0x02 dlen 7                                                                          #55 5.566098
      ATT: Exchange MTU Response (0x03) len 2
        Server RX MTU: 49
zephyr.exe[4083511]: < HCI Command: Host Number of Completed Packets (0x03|0x0035) plen 5                            #56 5.570910
        Num handles: 1
        Handle: 435 Address: DF:A9:FF:F6:B1:1A (OUI DF-A9-FF)
        Count: 1
zephyr.exe[4083511]: < ACL Data TX: Handle 435 [1/3] flags 0x00 dlen 7                                               #57 5.570939
      ATT: Exchange MTU Response (0x03) len 2
        Server RX MTU: 251
zephyr.exe[4083511]: < HCI Command: Host Number of Completed Packets (0x03|0x0035) plen 5                            #58 5.570976
        Num handles: 1
        Handle: 435 Address: DF:A9:FF:F6:B1:1A (OUI DF-A9-FF)
        Count: 1
> HCI Event: Number of Completed Packets (0x13) plen 5                                                               #59 5.865342
        Num handles: 1
        Handle: 435 Address: DF:A9:FF:F6:B1:1A (OUI DF-A9-FF)
        Count: 1
        Buffers: 0/3
        #57: len 7 (0 Kb/s)
        Latency: 294 msec (274-294 msec ~284 msec)
> ACL Data RX: Handle 435 flags 0x02 dlen 11                                                                         #60 7.815173
      SMP: Pairing Request (0x01) len 6
        IO capability: KeyboardDisplay (0x04)
        OOB data: Authentication data not present (0x00)
        Authentication requirement: Bonding, No MITM, SC, No Keypresses (0x09)
        Max encryption key size: 16
        Initiator key distribution: EncKey IdKey Sign (0x07)
        Responder key distribution: EncKey IdKey Sign (0x07)
zephyr.exe[4083511]: < HCI Command: Host Number of Completed Packets (0x03|0x0035) plen 5                            #61 7.830973
        Num handles: 1
        Handle: 435 Address: DF:A9:FF:F6:B1:1A (OUI DF-A9-FF)
        Count: 1
zephyr.exe[4083511]: < ACL Data TX: Handle 435 [1/3] flags 0x00 dlen 11                                              #62 7.830980
      SMP: Pairing Response (0x02) len 6
        IO capability: NoInputNoOutput (0x03)
        OOB data: Authentication data not present (0x00)
        Authentication requirement: Bonding, No MITM, SC, No Keypresses (0x09)
        Max encryption key size: 16
        Initiator key distribution: IdKey Sign (0x06)
        Responder key distribution: Sign (0x04)
> HCI Event: Number of Completed Packets (0x13) plen 5                                                               #63 8.115262
        Num handles: 1
        Handle: 435 Address: DF:A9:FF:F6:B1:1A (OUI DF-A9-FF)
        Count: 1
        Buffers: 0/3
        #62: len 11 (0 Kb/s)
        Latency: 284 msec (274-294 msec ~284 msec)
> ACL Data RX: Handle 435 flags 0x02 dlen 27                                                                         #64 8.115612
> ACL Data RX: Handle 435 flags 0x01 dlen 27                                                                         #65 8.116166
> ACL Data RX: Handle 435 flags 0x01 dlen 15                                                                         #66 8.116684
      SMP: Pairing Public Key (0x0c) len 64
        X[32]: d1259ae5f186d571fd7f72c5119b73f746269786ff5c0e711cd057d1bd7d7e94
        Y[32]: 999c0cc937459717079a3959184e2c0693b51d68fb9ec60c1907f2bf0b8c9e67
zephyr.exe[4083511]: < HCI Command: Host Number of Completed Packets (0x03|0x0035) plen 5                            #67 8.131005
        Num handles: 1
        Handle: 435 Address: DF:A9:FF:F6:B1:1A (OUI DF-A9-FF)
        Count: 1
zephyr.exe[4083511]: < HCI Command: Host Number of Completed Packets (0x03|0x0035) plen 5                            #68 8.131012
        Num handles: 1
        Handle: 435 Address: DF:A9:FF:F6:B1:1A (OUI DF-A9-FF)
        Count: 1
zephyr.exe[4083511]: < HCI Command: Host Number of Completed Packets (0x03|0x0035) plen 5                            #69 8.131049
        Num handles: 1
        Handle: 435 Address: DF:A9:FF:F6:B1:1A (OUI DF-A9-FF)
        Count: 1
zephyr.exe[4083511]: < ACL Data TX: Handle 435 [1/3] flags 0x00 dlen 27                                              #70 8.131162
zephyr.exe[4083511]: < ACL Data TX: Handle 435 flags 0x01 dlen 27                                                    #71 8.131181
zephyr.exe[4083511]: < ACL Data TX: Handle 435 flags 0x01 dlen 15                                                    #72 8.131182
      SMP: Pairing Public Key (0x0c) len 64
        X[32]: 98308440221e2d910f0e54b71e7ec652857aa9b5a0dc65028824cc19db1226e9
        Y[32]: 67a4816bcb62efb21701e31fdb27561a6217575fb007a8bbdabe7e28b6f68482
> HCI Event: Number of Completed Packets (0x13) plen 5                                                               #73 8.265935
        Num handles: 1
        Handle: 435 Address: DF:A9:FF:F6:B1:1A (OUI DF-A9-FF)
        Count: 1
        Buffers: 0/3
        #70: len 27 (1 Kb/s)
        Latency: 134 msec (134-294 msec ~209 msec)
> HCI Event: Number of Completed Packets (0x13) plen 5                                                               #74 8.266351
        Num handles: 1
        Handle: 435 Address: DF:A9:FF:F6:B1:1A (OUI DF-A9-FF)
        Count: 1
        Buffers: underflow/3
        #71: len 27 (1 Kb/s)
        Latency: 135 msec (134-294 msec ~172 msec)
zephyr.exe[4083511]: < ACL Data TX: Handle 435 [1/3] flags 0x00 dlen 21                                              #75 8.270918
      SMP: Pairing Confirm (0x03) len 16
        Confirm value[16]: 99c247cdbb6574d44c79059f5dec87d6
> HCI Event: Number of Completed Packets (0x13) plen 5                                                               #76 8.415073
        Num handles: 1
        Handle: 435 Address: DF:A9:FF:F6:B1:1A (OUI DF-A9-FF)
        Count: 1
        Buffers: 0/3
        #72: len 15 (0 Kb/s)
        Latency: 283 msec (134-294 msec ~228 msec)
> HCI Event: Number of Completed Packets (0x13) plen 5                                                               #77 8.565205
        Num handles: 1
        Handle: 435 Address: DF:A9:FF:F6:B1:1A (OUI DF-A9-FF)
        Count: 1
        Buffers: underflow/3
        #75: len 21 (0 Kb/s)
        Latency: 294 msec (134-294 msec ~261 msec)
> ACL Data RX: Handle 435 flags 0x02 dlen 21                                                                         #78 8.565685
      SMP: Pairing Random (0x04) len 16
        Random value[16]: dd04f5d8193f1a790000000000000000
zephyr.exe[4083511]: < HCI Command: Host Number of Completed Packets (0x03|0x0035) plen 5                            #79 8.570938
        Num handles: 1
        Handle: 435 Address: DF:A9:FF:F6:B1:1A (OUI DF-A9-FF)
        Count: 1
zephyr.exe[4083511]: < ACL Data TX: Handle 435 [1/3] flags 0x00 dlen 21                                              #80 8.570969
      SMP: Pairing Random (0x04) len 16
        Random value[16]: 8e6108f966a694cbe26df70bb96773e6
> HCI Event: Number of Completed Packets (0x13) plen 5                                                               #81 8.864958
        Num handles: 1
        Handle: 435 Address: DF:A9:FF:F6:B1:1A (OUI DF-A9-FF)
        Count: 1
        Buffers: 0/3
        #80: len 21 (0 Kb/s)
        Latency: 293 msec (134-294 msec ~277 msec)
> ACL Data RX: Handle 435 flags 0x02 dlen 21                                                                         #82 9.015557
      SMP: Pairing DHKey Check (0x0d) len 16
        E[16]: abc44fd6944ce3bfa064317d5ad63031
zephyr.exe[4083511]: < HCI Command: Host Number of Completed Packets (0x03|0x0035) plen 5                            #83 9.031025
        Num handles: 1
        Handle: 435 Address: DF:A9:FF:F6:B1:1A (OUI DF-A9-FF)
        Count: 1
zephyr.exe[4083511]: < ACL Data TX: Handle 435 [1/3] flags 0x00 dlen 21                                              #84 9.031082
      SMP: Pairing DHKey Check (0x0d) len 16
        E[16]: f196e742ed55be2b313df6f726e9a0a1
> HCI Event: Number of Completed Packets (0x13) plen 5                                                               #85 9.315033
        Num handles: 1
        Handle: 435 Address: DF:A9:FF:F6:B1:1A (OUI DF-A9-FF)
        Count: 1
        Buffers: 0/3
        #84: len 21 (0 Kb/s)
        Latency: 283 msec (134-294 msec ~280 msec)
> HCI Event: LE Meta Event (0x3e) plen 13                                                                            #86 9.465645
      LE Long Term Key Request (0x05)
        Handle: 435 Address: DF:A9:FF:F6:B1:1A (OUI DF-A9-FF)
        Random number: 0x0000000000000000
        Encrypted diversifier: 0x0000
zephyr.exe[4083511]: < HCI Command: LE Long Term Key Request Reply (0x08|0x001a) plen 18                             #87 9.470893
        Handle: 435 Address: DF:A9:FF:F6:B1:1A (OUI DF-A9-FF)
        Long term key[16]: 8eaf3e65923d2b4e699b5750dd46a540
> HCI Event: Command Complete (0x0e) plen 6                                                                          #88 9.472359
      LE Long Term Key Request Reply (0x08|0x001a) ncmd 1
        Status: Success (0x00)
        Handle: 435 Address: DF:A9:FF:F6:B1:1A (OUI DF-A9-FF)
> HCI Event: Encryption Change (0x08) plen 4                                                                        #89 10.215108
        Status: Success (0x00)
        Handle: 435 Address: DF:A9:FF:F6:B1:1A (OUI DF-A9-FF)
        Encryption: Enabled with AES-CCM (0x01)
zephyr.exe[4083511]: < ACL Data TX: Handle 435 [1/3] flags 0x00 dlen 21                                             #90 10.340944
      SMP: Signing Information (0x0a) len 16
        Signature key[16]: 5da095555cc64d02679f89a05211af56
> HCI Event: Number of Completed Packets (0x13) plen 5                                                              #91 10.515293
        Num handles: 1
        Handle: 435 Address: DF:A9:FF:F6:B1:1A (OUI DF-A9-FF)
        Count: 1
        Buffers: 0/3
        #90: len 21 (0 Kb/s)
        Latency: 174 msec (134-294 msec ~227 msec)
> ACL Data RX: Handle 435 flags 0x02 dlen 21                                                                        #92 10.515508
      SMP: Identity Information (0x08) len 16
        Identity resolving key[16]: b79a6df219712f0ddd245eec3a5a101c
> ACL Data RX: Handle 435 flags 0x02 dlen 12                                                                        #93 10.515789
      SMP: Identity Address Information (0x09) len 7
        Address: DF:A9:FF:F6:B1:1A (OUI DF-A9-FF)
> ACL Data RX: Handle 435 flags 0x02 dlen 21                                                                        #94 10.516566
      SMP: Signing Information (0x0a) len 16
        Signature key[16]: 1ca5a05cd26400a306e85064f3d5af10
zephyr.exe[4083511]: < HCI Command: Host Number of Completed Packets (0x03|0x0035) plen 5                           #95 10.530951
        Num handles: 1
        Handle: 435 Address: DF:A9:FF:F6:B1:1A (OUI DF-A9-FF)
        Count: 1
zephyr.exe[4083511]: < HCI Command: LE Add Device To Resolving List (0x08|0x0027) plen 39                           #96 10.530986
        Address type: Public (0x00)
        Address: DF:A9:FF:F6:B1:1A (OUI DF-A9-FF)
        Peer identity resolving key[16]: b79a6df219712f0ddd245eec3a5a101c
        Local identity resolving key[16]: 00000000000000000000000000000000
> HCI Event: Command Complete (0x0e) plen 4                                                                         #97 10.532223
      LE Add Device To Resolving List (0x08|0x0027) ncmd 1
        Status: Success (0x00)
zephyr.exe[4083511]: < HCI Command: LE Set Privacy Mode (0x08|0x004e) plen 8                                        #98 10.550969
        Peer Identity address type: Public (0x00)
        Peer Identity address: DF:A9:FF:F6:B1:1A (OUI DF-A9-FF)
        Privacy Mode: Use Device Privacy (0x01)
> HCI Event: Command Complete (0x0e) plen 4                                                                         #99 10.552136
      LE Set Privacy Mode (0x08|0x004e) ncmd 1
        Status: Success (0x00)
zephyr.exe[4083511]: < HCI Command: LE Set Address Resolution Enable (0x08|0x002d) plen 1                          #100 10.570967
        Address resolution: Enabled (0x01)
> HCI Event: Command Complete (0x0e) plen 4                                                                        #101 10.571514
      LE Set Address Resolution Enable (0x08|0x002d) ncmd 1
        Status: Success (0x00)
zephyr.exe[4083511]: < HCI Command: Host Number of Completed Packets (0x03|0x0035) plen 5                          #102 10.590867
        Num handles: 1
        Handle: 435 Address: DF:A9:FF:F6:B1:1A (OUI DF-A9-FF)
        Count: 1
zephyr.exe[4083511]: < HCI Command: Host Number of Completed Packets (0x03|0x0035) plen 5                          #103 10.590953
        Num handles: 1
        Handle: 435 Address: DF:A9:FF:F6:B1:1A (OUI DF-A9-FF)
        Count: 1
> ACL Data RX: Handle 435 flags 0x02 dlen 13                                                                       #104 10.965371
      ATT: Find By Type Value Request (0x06) len 8
        Handle range: 0x0001-0xffff
        Attribute type: Primary Service (0x2800)
          UUID: Hearing Aid (0x1854)
zephyr.exe[4083511]: < HCI Command: Host Number of Completed Packets (0x03|0x0035) plen 5                          #105 10.971011
        Num handles: 1
        Handle: 435 Address: DF:A9:FF:F6:B1:1A (OUI DF-A9-FF)
        Count: 1
zephyr.exe[4083511]: < ACL Data TX: Handle 435 [1/3] flags 0x00 dlen 9                                             #106 10.971016
      ATT: Find By Type Value Response (0x07) len 4
        Handle range: 0x0024-0x002c
> HCI Event: Number of Completed Packets (0x13) plen 5                                                             #107 11.265181
        Num handles: 1
        Handle: 435 Address: DF:A9:FF:F6:B1:1A (OUI DF-A9-FF)
        Count: 1
        Buffers: 0/3
        #106: len 9 (0 Kb/s)
        Latency: 294 msec (134-294 msec ~260 msec)
> ACL Data RX: Handle 435 flags 0x02 dlen 13                                                                       #108 11.265364
      ATT: Find By Type Value Request (0x06) len 8
        Handle range: 0x002d-0xffff
        Attribute type: Primary Service (0x2800)
          UUID: Hearing Aid (0x1854)
zephyr.exe[4083511]: < HCI Command: Host Number of Completed Packets (0x03|0x0035) plen 5                          #109 11.270951
        Num handles: 1
        Handle: 435 Address: DF:A9:FF:F6:B1:1A (OUI DF-A9-FF)
        Count: 1
zephyr.exe[4083511]: < ACL Data TX: Handle 435 [1/3] flags 0x00 dlen 9                                             #110 11.270972
      ATT: Error Response (0x01) len 4
        Find By Type Value Request (0x06)
        Handle: 0x002d
        Error: Attribute Not Found (0x0a)
> HCI Event: Number of Completed Packets (0x13) plen 5                                                             #111 11.565356
        Num handles: 1
        Handle: 435 Address: DF:A9:FF:F6:B1:1A (OUI DF-A9-FF)
        Count: 1
        Buffers: 0/3
        #110: len 9 (0 Kb/s)
        Latency: 294 msec (134-294 msec ~277 msec)
> ACL Data RX: Handle 435 flags 0x02 dlen 11                                                                       #112 11.565359
      ATT: Read By Type Request (0x08) len 6
        Handle range: 0x0024-0x002c
        Attribute type: Characteristic (0x2803)
zephyr.exe[4083511]: < HCI Command: Host Number of Completed Packets (0x03|0x0035) plen 5                          #113 11.570984
        Num handles: 1
        Handle: 435 Address: DF:A9:FF:F6:B1:1A (OUI DF-A9-FF)
        Count: 1
zephyr.exe[4083511]: < ACL Data TX: Handle 435 [1/3] flags 0x00 dlen 27                                            #114 11.570999
      ATT: Read By Type Response (0x09) len 22
        Attribute data length: 7
        Attribute data list: 3 entries
        Handle: 0x0025
        Value[5]: 022600da2b
            Properties: 0x02
              Read (0x02)
            Value Handle: 0x0026
            Value UUID: Hearing Aid Features (0x2bda)
        Handle: 0x0027
        Value[5]: 282800db2b
            Properties: 0x28
              Write (0x08)
              Indicate (0x20)
            Value Handle: 0x0028
            Value UUID: Hearing Aid Preset Control Point (0x2bdb)
        Handle: 0x002a
        Value[5]: 122b00dc2b
            Properties: 0x12
              Read (0x02)
              Notify (0x10)
            Value Handle: 0x002b
            Value UUID: Active Preset Index (0x2bdc)
> HCI Event: Number of Completed Packets (0x13) plen 5                                                             #115 11.865180
        Num handles: 1
        Handle: 435 Address: DF:A9:FF:F6:B1:1A (OUI DF-A9-FF)
        Count: 1
        Buffers: 0/3
        #114: len 27 (0 Kb/s)
        Latency: 294 msec (134-294 msec ~285 msec)
> ACL Data RX: Handle 435 flags 0x02 dlen 11                                                                       #116 11.865595
      ATT: Read By Type Request (0x08) len 6
        Handle range: 0x002b-0x002c
        Attribute type: Characteristic (0x2803)
zephyr.exe[4083511]: < HCI Command: Host Number of Completed Packets (0x03|0x0035) plen 5                          #117 11.870986
        Num handles: 1
        Handle: 435 Address: DF:A9:FF:F6:B1:1A (OUI DF-A9-FF)
        Count: 1
zephyr.exe[4083511]: < ACL Data TX: Handle 435 [1/3] flags 0x00 dlen 9                                             #118 11.870991
      ATT: Error Response (0x01) len 4
        Read By Type Request (0x08)
        Handle: 0x002b
        Error: Attribute Not Found (0x0a)
> HCI Event: Number of Completed Packets (0x13) plen 5                                                             #119 12.165128
        Num handles: 1
        Handle: 435 Address: DF:A9:FF:F6:B1:1A (OUI DF-A9-FF)
        Count: 1
        Buffers: 0/3
        #118: len 9 (0 Kb/s)
        Latency: 294 msec (134-294 msec ~290 msec)
> ACL Data RX: Handle 435 flags 0x02 dlen 9                                                                        #120 12.165319
      ATT: Find Information Request (0x04) len 4
        Handle range: 0x0029-0x0029
zephyr.exe[4083511]: < HCI Command: Host Number of Completed Packets (0x03|0x0035) plen 5                          #121 12.171013
        Num handles: 1
        Handle: 435 Address: DF:A9:FF:F6:B1:1A (OUI DF-A9-FF)
        Count: 1
zephyr.exe[4083511]: < ACL Data TX: Handle 435 [1/3] flags 0x00 dlen 10                                            #122 12.171018
      ATT: Find Information Response (0x05) len 5
        Format: UUID-16 (0x01)
        Handle: 0x0029
        UUID: Client Characteristic Configuration (0x2902)
> HCI Event: Number of Completed Packets (0x13) plen 5                                                             #123 12.465218
        Num handles: 1
        Handle: 435 Address: DF:A9:FF:F6:B1:1A (OUI DF-A9-FF)
        Count: 1
        Buffers: 0/3
        #122: len 10 (0 Kb/s)
        Latency: 294 msec (134-294 msec ~292 msec)
> ACL Data RX: Handle 435 flags 0x02 dlen 9                                                                        #124 12.465364
      ATT: Find Information Request (0x04) len 4
        Handle range: 0x002c-0x002c
zephyr.exe[4083511]: < HCI Command: Host Number of Completed Packets (0x03|0x0035) plen 5                          #125 12.470955
        Num handles: 1
        Handle: 435 Address: DF:A9:FF:F6:B1:1A (OUI DF-A9-FF)
        Count: 1
zephyr.exe[4083511]: < ACL Data TX: Handle 435 [1/3] flags 0x00 dlen 10                                            #126 12.470985
      ATT: Find Information Response (0x05) len 5
        Format: UUID-16 (0x01)
        Handle: 0x002c
        UUID: Client Characteristic Configuration (0x2902)
> HCI Event: Number of Completed Packets (0x13) plen 5                                                             #127 12.765053
        Num handles: 1
        Handle: 435 Address: DF:A9:FF:F6:B1:1A (OUI DF-A9-FF)
        Count: 1
        Buffers: 0/3
        #126: len 10 (0 Kb/s)
        Latency: 294 msec (134-294 msec ~293 msec)
> ACL Data RX: Handle 435 flags 0x02 dlen 9                                                                        #128 12.765150
      ATT: Write Request (0x12) len 4
        Handle: 0x0029
          Data[2]: 0000
zephyr.exe[4083511]: < HCI Command: Host Number of Completed Packets (0x03|0x0035) plen 5                          #129 12.770918
        Num handles: 1
        Handle: 435 Address: DF:A9:FF:F6:B1:1A (OUI DF-A9-FF)
        Count: 1
zephyr.exe[4083511]: < ACL Data TX: Handle 435 [1/3] flags 0x00 dlen 5                                             #130 12.770955
      ATT: Write Response (0x13) len 0
> HCI Event: Number of Completed Packets (0x13) plen 5                                                             #131 13.065069
        Num handles: 1
        Handle: 435 Address: DF:A9:FF:F6:B1:1A (OUI DF-A9-FF)
        Count: 1
        Buffers: 0/3
        #130: len 5 (0 Kb/s)
        Latency: 294 msec (134-294 msec ~293 msec)
> ACL Data RX: Handle 435 flags 0x02 dlen 9                                                                        #132 13.065235
      ATT: Write Request (0x12) len 4
        Handle: 0x0029
          Data[2]: 0200
zephyr.exe[4083511]: < HCI Command: Host Number of Completed Packets (0x03|0x0035) plen 5                          #133 13.071036
        Num handles: 1
        Handle: 435 Address: DF:A9:FF:F6:B1:1A (OUI DF-A9-FF)
        Count: 1
zephyr.exe[4083511]: < ACL Data TX: Handle 435 [1/3] flags 0x00 dlen 5                                             #134 13.071041
      ATT: Write Response (0x13) len 0
> HCI Event: Number of Completed Packets (0x13) plen 5                                                             #135 13.364911
        Num handles: 1
        Handle: 435 Address: DF:A9:FF:F6:B1:1A (OUI DF-A9-FF)
        Count: 1
        Buffers: 0/3
        #134: len 5 (0 Kb/s)
        Latency: 293 msec (134-294 msec ~293 msec)
> ACL Data RX: Handle 435 flags 0x02 dlen 9                                                                        #136 13.365173
      ATT: Write Request (0x12) len 4
        Handle: 0x002c
          Data[2]: 0000
zephyr.exe[4083511]: < HCI Command: Host Number of Completed Packets (0x03|0x0035) plen 5                          #137 13.370819
        Num handles: 1
        Handle: 435 Address: DF:A9:FF:F6:B1:1A (OUI DF-A9-FF)
        Count: 1
zephyr.exe[4083511]: < ACL Data TX: Handle 435 [1/3] flags 0x00 dlen 5                                             #138 13.370828
      ATT: Write Response (0x13) len 0
> HCI Event: Number of Completed Packets (0x13) plen 5                                                             #139 13.665051
        Num handles: 1
        Handle: 435 Address: DF:A9:FF:F6:B1:1A (OUI DF-A9-FF)
        Count: 1
        Buffers: 0/3
        #138: len 5 (0 Kb/s)
        Latency: 294 msec (134-294 msec ~293 msec)
> ACL Data RX: Handle 435 flags 0x02 dlen 9                                                                        #140 13.665161
      ATT: Write Request (0x12) len 4
        Handle: 0x002c
          Data[2]: 0100
zephyr.exe[4083511]: < HCI Command: Host Number of Completed Packets (0x03|0x0035) plen 5                          #141 13.670819
        Num handles: 1
        Handle: 435 Address: DF:A9:FF:F6:B1:1A (OUI DF-A9-FF)
        Count: 1
zephyr.exe[4083511]: < ACL Data TX: Handle 435 [1/3] flags 0x00 dlen 5                                             #142 13.670829
      ATT: Write Response (0x13) len 0
> HCI Event: Number of Completed Packets (0x13) plen 5                                                             #143 13.965094
        Num handles: 1
        Handle: 435 Address: DF:A9:FF:F6:B1:1A (OUI DF-A9-FF)
        Count: 1
        Buffers: 0/3
        #142: len 5 (0 Kb/s)
        Latency: 294 msec (134-294 msec ~294 msec)
> ACL Data RX: Handle 435 flags 0x02 dlen 7                                                                        #144 13.965193
      ATT: Read Request (0x0a) len 2
        Handle: 0x0026
zephyr.exe[4083511]: < HCI Command: Host Number of Completed Packets (0x03|0x0035) plen 5                          #145 13.970993
        Num handles: 1
        Handle: 435 Address: DF:A9:FF:F6:B1:1A (OUI DF-A9-FF)
        Count: 1
zephyr.exe[4083511]: < ACL Data TX: Handle 435 [1/3] flags 0x00 dlen 6                                             #146 13.970998
      ATT: Read Response (0x0b) len 1
        Value[1]: 38
> HCI Event: Number of Completed Packets (0x13) plen 5                                                             #147 14.264776
        Num handles: 1
        Handle: 435 Address: DF:A9:FF:F6:B1:1A (OUI DF-A9-FF)
        Count: 1
        Buffers: 0/3
        #146: len 6 (0 Kb/s)
        Latency: 293 msec (134-294 msec ~293 msec)
> HCI Event: Disconnect Complete (0x05) plen 4                                                                     #148 14.415181
        Status: Success (0x00)
        Handle: 435 Address: DF:A9:FF:F6:B1:1A (OUI DF-A9-FF)
        Reason: Remote User Terminated Connection (0x13)
zephyr.exe[4083511]: < HCI Command: LE Set Extended Advertising Parameters (0x08|0x0036) plen 25                   #149 17.520989
        Handle: 0x00
        Properties: 0x0013
          Connectable
          Scannable
          Use legacy advertising PDUs: ADV_IND
        Min advertising interval: 100.000 msec (0x00a0)
        Max advertising interval: 150.000 msec (0x00f0)
        Channel map: 37, 38, 39 (0x07)
        Own address type: Random (0x01)
        Peer address type: Public (0x00)
        Peer address: 00:00:00:00:00:00 (OUI 00-00-00)
        Filter policy: Allow Scan Request from Any, Allow Connect Request from Any (0x00)
        TX power: Host has no preference (0x7f)
        Primary PHY: LE 1M (0x01)
        Secondary max skip: 0x00
        Secondary PHY: LE 1M (0x01)
        SID: 0x00
        Scan request notifications: Disabled (0x00)
> HCI Event: Command Complete (0x0e) plen 5                                                                        #150 17.522342
      LE Set Extended Advertising Parameters (0x08|0x0036) ncmd 1
        Status: Success (0x00)
        TX power (selected): 0 dbm (0x00)
zephyr.exe[4083511]: < HCI Command: LE Set Advertising Set Random Address (0x08|0x0035) plen 7                     #151 17.530976
        Advertising handle: 0x00
        Advertising random address: D5:B6:CC:31:DB:3B (Static)
> HCI Event: Command Complete (0x0e) plen 4                                                                        #152 17.531724
      LE Set Advertising Set Random Address (0x08|0x0035) ncmd 1
        Status: Success (0x00)
zephyr.exe[4083511]: < HCI Command: LE Set Extended Advertising Data (0x08|0x0037) plen 22                         #153 17.550965
        Handle: 0x00
        Operation: Complete extended advertising data (0x03)
        Fragment preference: Minimize fragmentation (0x01)
        Data length: 0x12
        Flags: 0x06
          LE General Discoverable Mode
          BR/EDR Not Supported
        Name (complete): Tester_F6B11A
> HCI Event: Command Complete (0x0e) plen 4                                                                        #154 17.551916
      LE Set Extended Advertising Data (0x08|0x0037) ncmd 1
        Status: Success (0x00)
zephyr.exe[4083511]: < HCI Command: LE Set Extended Scan Response Data (0x08|0x0038) plen 4                        #155 17.570965
        Handle: 0x00
        Operation: Complete scan response data (0x03)
        Fragment preference: Minimize fragmentation (0x01)
        Data length: 0x00
> HCI Event: Command Complete (0x0e) plen 4                                                                        #156 17.571473
      LE Set Extended Scan Response Data (0x08|0x0038) ncmd 1
        Status: Success (0x00)
zephyr.exe[4083511]: < HCI Command: LE Set Extended Advertising Enable (0x08|0x0039) plen 6                        #157 17.590948
        Extended advertising: Enabled (0x01)
        Number of sets: 1 (0x01)
        Entry 0
          Handle: 0x00
          Duration: 0 ms (0x00)
          Max ext adv events: 0
> HCI Event: Command Complete (0x0e) plen 4                                                                        #158 17.592065
      LE Set Extended Advertising Enable (0x08|0x0039) ncmd 1
        Status: Success (0x00)
> HCI Event: LE Meta Event (0x3e) plen 31                                                                          #159 17.712135
      LE Enhanced Connection Complete (0x0a)
        Status: Success (0x00)
        Handle: 453
        Role: Peripheral (0x01)
        Peer address type: Public (0x00)
        Peer address: DF:A9:FF:F6:B1:1A (OUI DF-A9-FF)
        Local resolvable private address: 00:00:00:00:00:00 (Non-Resolvable)
        Peer resolvable private address: 00:00:00:00:00:00 (Non-Resolvable)
        Connection interval: 87.50 msec (0x0046)
        Connection latency: 0 (0x0000)
        Supervision timeout: 25120 msec (0x09d0)
        Central clock accuracy: 0x01
> HCI Event: LE Meta Event (0x3e) plen 6                                                                           #160 17.712209
      LE Advertising Set Terminated (0x12)
        Status: Success (0x00)
        Handle: 0
        Connection handle: 453
        Number of completed extended advertising events: 0
zephyr.exe[4083511]: < HCI Command: LE Read Remote Used Features (0x08|0x0016) plen 2                              #161 17.731075
        Handle: 453 Address: DF:A9:FF:F6:B1:1A (OUI DF-A9-FF)
> HCI Event: Command Status (0x0f) plen 4                                                                          #162 17.731670
      LE Read Remote Used Features (0x08|0x0016) ncmd 1
        Status: Success (0x00)
zephyr.exe[4083511]: < ACL Data TX: Handle 453 [1/3] flags 0x00 dlen 6                                             #163 17.750952
      SMP: Security Request (0x0b) len 1
        Authentication requirement: Bonding, No MITM, SC, No Keypresses (0x09)
zephyr.exe[4083511]: < ACL Data TX: Handle 453 [2/3] flags 0x00 dlen 7                                             #164 17.750957
      ATT: Exchange MTU Request (0x02) len 2
        Client RX MTU: 251
> HCI Event: Number of Completed Packets (0x13) plen 5                                                             #165 17.801026
        Num handles: 1
        Handle: 453 Address: DF:A9:FF:F6:B1:1A (OUI DF-A9-FF)
        Count: 1
        Buffers: 1/3
        #163: len 6 (0 Kb/s)
        Latency: 50 msec (50-50 msec ~50 msec)
> HCI Event: Number of Completed Packets (0x13) plen 5                                                             #166 17.888317
        Num handles: 1
        Handle: 453 Address: DF:A9:FF:F6:B1:1A (OUI DF-A9-FF)
        Count: 1
        Buffers: 0/3
        #164: len 7 (0 Kb/s)
        Latency: 137 msec (50-137 msec ~93 msec)
> HCI Event: LE Meta Event (0x3e) plen 12                                                                          #167 17.975976
      LE Read Remote Used Features (0x04)
        Status: Success (0x00)
        Handle: 453 Address: DF:A9:FF:F6:B1:1A (OUI DF-A9-FF)
        Features: 0x2d 0x49 0x00 0xf7 0x67 0xd8 0x00 0x00
          LE Encryption
          Extended Reject Indication
          Peripheral-initiated Features Exchange
          LE Data Packet Length Extension
          LE 2M PHY
          LE Coded PHY
          Channel Selection Algorithm #2
          Periodic Advertising Sync Transfer - Sender
          Periodic Advertising Sync Transfer - Recipient
          Sleep Clock Accuracy Updates
          Connected Isochronous Stream - Central
          Connected Isochronous Stream - Peripheral
          Isochronous Broadcaster
          Synchronized Receiver
          Connected Isochronous Stream (Host Support)
          LE Power Control Request
          LE Power Control Request
          Connection Subrating
          Connection Subrating (Host Support)
          Unknown features (0x0000d80000000000)
> ACL Data RX: Handle 453 flags 0x02 dlen 7                                                                        #168 18.413194
      ATT: Exchange MTU Request (0x02) len 2
        Client RX MTU: 49
> ACL Data RX: Handle 453 flags 0x02 dlen 7                                                                        #169 18.413785
      ATT: Exchange MTU Response (0x03) len 2
        Server RX MTU: 49
zephyr.exe[4083511]: < HCI Command: Host Number of Completed Packets (0x03|0x0035) plen 5                          #170 18.431010
        Num handles: 1
        Handle: 453 Address: DF:A9:FF:F6:B1:1A (OUI DF-A9-FF)
        Count: 1
zephyr.exe[4083511]: < ACL Data TX: Handle 453 [1/3] flags 0x00 dlen 7                                             #171 18.431037
      ATT: Exchange MTU Response (0x03) len 2
        Server RX MTU: 251
zephyr.exe[4083511]: < HCI Command: Host Number of Completed Packets (0x03|0x0035) plen 5                          #172 18.431054
        Num handles: 1
        Handle: 453 Address: DF:A9:FF:F6:B1:1A (OUI DF-A9-FF)
        Count: 1
> HCI Event: LE Meta Event (0x3e) plen 13                                                                          #173 18.501194
      LE Long Term Key Request (0x05)
        Handle: 453 Address: DF:A9:FF:F6:B1:1A (OUI DF-A9-FF)
        Random number: 0x0000000000000000
        Encrypted diversifier: 0x0000
zephyr.exe[4083511]: < HCI Command: LE Long Term Key Request Reply (0x08|0x001a) plen 18                           #174 18.511061
        Handle: 453 Address: DF:A9:FF:F6:B1:1A (OUI DF-A9-FF)
        Long term key[16]: 8eaf3e65923d2b4e699b5750dd46a540
> HCI Event: Command Complete (0x0e) plen 6                                                                        #175 18.511963
      LE Long Term Key Request Reply (0x08|0x001a) ncmd 1
        Status: Success (0x00)
        Handle: 453 Address: DF:A9:FF:F6:B1:1A (OUI DF-A9-FF)
> HCI Event: Number of Completed Packets (0x13) plen 5                                                             #176 18.588631
        Num handles: 1
        Handle: 453 Address: DF:A9:FF:F6:B1:1A (OUI DF-A9-FF)
        Count: 1
        Buffers: 0/3
        #171: len 7 (0 Kb/s)
        Latency: 157 msec (50-157 msec ~125 msec)
> HCI Event: Encryption Change (0x08) plen 4                                                                       #177 18.938354
        Status: Success (0x00)
        Handle: 453 Address: DF:A9:FF:F6:B1:1A (OUI DF-A9-FF)
        Encryption: Enabled with AES-CCM (0x01)
zephyr.exe[4083511]: < ACL Data TX: Handle 453 [1/3] flags 0x00 dlen 21                                            #178 18.951185
      ATT: Handle Value Indication (0x1d) len 16
        Handle: 0x0028
          Data[14]: 03000000010352414e444f4d5f31
zephyr.exe[4083511]: < ACL Data TX: Handle 453 [2/3] flags 0x00 dlen 8                                             #179 18.951192
      ATT: Handle Value Notification (0x1b) len 3
        Handle: 0x002b
          Data[1]: 08
> HCI Event: Number of Completed Packets (0x13) plen 5                                                             #180 19.113341
        Num handles: 1
        Handle: 453 Address: DF:A9:FF:F6:B1:1A (OUI DF-A9-FF)
        Count: 1
        Buffers: 1/3
        #178: len 21 (1 Kb/s)
        Latency: 162 msec (50-162 msec ~143 msec)
> ACL Data RX: Handle 453 flags 0x02 dlen 5                                                                        #181 19.113719
      ATT: Handle Value Confirmation (0x1e) len 0
zephyr.exe[4083511]: < HCI Command: Host Number of