Bluetooth monitor ver 5.72
= Note: Linux version 6.14.0-36-generic (x86_64)                       0.907005
= Note: Bluetooth subsystem version 2.22                               0.907008
= New Index: 00:00:00:00:00:00 (Primary,UART,hci1)              [hci1] 0.907009
= New Index: 48:5F:99:8E:E0:64 (Primary,USB,hci0)               [hci0] 0.907009
= Open Index: 00:00:00:00:00:00                                 [hci1] 0.920639
= Index Info: 00:00:00:00:00:00 (Nordic Semiconductor ASA)      [hci1] 0.920644
@ USER Open: main (privileged) version 2.22            {0x0001} [hci1] 0.920647
< HCI Command: Reset (0x03|0x0003) plen 0                    #1 [hci1] 0.921007
> HCI Event: Command Complete (0x0e) plen 4                  #2 [hci1] 0.921536
      Reset (0x03|0x0003) ncmd 1
        Status: Success (0x00)
< HCI Command: Read Local Supported... (0x04|0x0003) plen 0  #3 [hci1] 0.940443
> HCI Event: Command Complete (0x0e) plen 12                 #4 [hci1] 0.940892
      Read Local Supported Features (0x04|0x0003) ncmd 1
        Status: Success (0x00)
        Features: 0x00 0x00 0x00 0x00 0x60 0x00 0x00 0x00
          BR/EDR Not Supported
          LE Supported (Controller)
< HCI Command: Read Local Version In.. (0x04|0x0001) plen 0  #5 [hci1] 0.960592
> HCI Event: Command Complete (0x0e) plen 12                 #6 [hci1] 0.961152
      Read Local Version Information (0x04|0x0001) ncmd 1
        Status: Success (0x00)
        HCI version: Reserved (0x0f) - Revision 12393 (0x3069)
        LMP version: Reserved (0x0f) - Subversion 12393 (0x3069)
        Manufacturer: Nordic Semiconductor ASA (89)
< HCI Command: Read Local Supported... (0x04|0x0002) plen 0  #7 [hci1] 0.980580
> HCI Event: Command Complete (0x0e) plen 68                 #8 [hci1] 0.981684
      Read Local Supported Commands (0x04|0x0002) ncmd 1
        Status: Success (0x00)
        Commands: 119 entries
          Disconnect (Octet 0 - Bit 5)
          Read Remote Version Information (Octet 2 - Bit 7)
          Set Event Mask (Octet 5 - Bit 6)
          Reset (Octet 5 - Bit 7)
          Read Connection Accept Timeout (Octet 7 - Bit 2)
          Write Connection Accept Timeout (Octet 7 - Bit 3)
          Read Transmit Power Level (Octet 10 - Bit 2)
          Set Controller To Host Flow Control (Octet 10 - Bit 5)
          Host Buffer Size (Octet 10 - Bit 6)
          Host Number of Completed Packets (Octet 10 - Bit 7)
          Read Local Version Information (Octet 14 - Bit 3)
          Read Local Supported Features (Octet 14 - Bit 5)
          Read BD ADDR (Octet 15 - Bit 1)
          Read RSSI (Octet 15 - Bit 5)
          Set Event Mask Page 2 (Octet 22 - Bit 2)
          LE Set Event Mask (Octet 25 - Bit 0)
          LE Read Buffer Size (Octet 25 - Bit 1)
          LE Read Local Supported Features (Octet 25 - Bit 2)
          LE Set Random Address (Octet 25 - Bit 4)
          LE Set Advertising Parameters (Octet 25 - Bit 5)
          LE Read Advertising Channel TX Power (Octet 25 - Bit 6)
          LE Set Advertising Data (Octet 25 - Bit 7)
          LE Set Scan Response Data (Octet 26 - Bit 0)
          LE Set Advertise Enable (Octet 26 - Bit 1)
          LE Set Scan Parameters (Octet 26 - Bit 2)
          LE Set Scan Enable (Octet 26 - Bit 3)
          LE Create Connection (Octet 26 - Bit 4)
          LE Create Connection Cancel (Octet 26 - Bit 5)
          LE Read Accept List Size (Octet 26 - Bit 6)
          LE Clear Accept List (Octet 26 - Bit 7)
          LE Add Device To Accept List (Octet 27 - Bit 0)
          LE Remove Device From Accept List (Octet 27 - Bit 1)
          LE Connection Update (Octet 27 - Bit 2)
          LE Set Host Channel Classification (Octet 27 - Bit 3)
          LE Read Channel Map (Octet 27 - Bit 4)
          LE Read Remote Used Features (Octet 27 - Bit 5)
          LE Encrypt (Octet 27 - Bit 6)
          LE Rand (Octet 27 - Bit 7)
          LE Start Encryption (Octet 28 - Bit 0)
          LE Long Term Key Request Reply (Octet 28 - Bit 1)
          LE Long Term Key Request Neg Reply (Octet 28 - Bit 2)
          LE Read Supported States (Octet 28 - Bit 3)
          LE Receiver Test (Octet 28 - Bit 4)
          LE Transmitter Test (Octet 28 - Bit 5)
          LE Test End (Octet 28 - Bit 6)
          Read Authenticated Payload Timeout (Octet 32 - Bit 4)
          Write Authenticated Payload Timeout (Octet 32 - Bit 5)
          LE Set Data Length (Octet 33 - Bit 6)
          LE Read Suggested Default Data Length (Octet 33 - Bit 7)
          LE Write Suggested Default Data Length (Octet 34 - Bit 0)
          LE Add Device To Resolving List (Octet 34 - Bit 3)
          LE Remove Device From Resolving List (Octet 34 - Bit 4)
          LE Clear Resolving List (Octet 34 - Bit 5)
          LE Read Resolving List Size (Octet 34 - Bit 6)
          LE Set Address Resolution Enable (Octet 35 - Bit 1)
          LE Set Resolvable Private Address Timeout (Octet 35 - Bit 2)
          LE Read Maximum Data Length (Octet 35 - Bit 3)
          LE Read PHY (Octet 35 - Bit 4)
          LE Set Default PHY (Octet 35 - Bit 5)
          LE Set PHY (Octet 35 - Bit 6)
          LE Enhanced Receiver Test (Octet 35 - Bit 7)
          LE Enhanced Transmitter Test (Octet 36 - Bit 0)
          LE Set Advertising Set Random Address (Octet 36 - Bit 1)
          LE Set Extended Advertising Parameters (Octet 36 - Bit 2)
          LE Set Extended Advertising Data (Octet 36 - Bit 3)
          LE Set Extended Scan Response Data (Octet 36 - Bit 4)
          LE Set Extended Advertising Enable (Octet 36 - Bit 5)
          LE Read Maximum Advertising Data Length (Octet 36 - Bit 6)
          LE Read Number of Supported Advertising Sets (Octet 36 - Bit 7)
          LE Remove Advertising Set (Octet 37 - Bit 0)
          LE Clear Advertising Sets (Octet 37 - Bit 1)
          LE Set Periodic Advertising Parameters (Octet 37 - Bit 2)
          LE Set Periodic Advertising Data (Octet 37 - Bit 3)
          LE Set Periodic Advertising Enable (Octet 37 - Bit 4)
          LE Set Extended Scan Parameters (Octet 37 - Bit 5)
          LE Set Extended Scan Enable (Octet 37 - Bit 6)
          LE Extended Create Connection (Octet 37 - Bit 7)
          LE Periodic Advertising Create Sync (Octet 38 - Bit 0)
          LE Periodic Advertising Create Sync Cancel (Octet 38 - Bit 1)
          LE Periodic Advertising Terminate Sync (Octet 38 - Bit 2)
          LE Add Device To Periodic Advertiser List (Octet 38 - Bit 3)
          LE Remove Device From Periodic Advertiser List (Octet 38 - Bit 4)
          LE Clear Periodic Advertiser List (Octet 38 - Bit 5)
          LE Read Periodic Advertiser List Size (Octet 38 - Bit 6)
          LE Read Transmit Power (Octet 38 - Bit 7)
          LE Read RF Path Compensation (Octet 39 - Bit 0)
          LE Write RF Path Compensation (Octet 39 - Bit 1)
          LE Set Privacy Mode (Octet 39 - Bit 2)
          LE Periodic Advertising Receive Enable (Octet 40 - Bit 5)
          LE Periodic Advertising Sync Transfer (Octet 40 - Bit 6)
          LE Periodic Advertising Set Info Transfer (Octet 40 - Bit 7)
          LE Periodic Advertising Sync Transfer Parameters (Octet 41 - Bit 0)
          LE Set Default Periodic Advertisng Sync Transfer Parameters (Octet 41 - Bit 1)
          LE Read Buffer v2 (Octet 41 - Bit 5)
          LE Read ISO TX Sync (Octet 41 - Bit 6)
          LE Set Connected Isochronous Group Parameters (Octet 41 - Bit 7)
          LE Set Connected Isochronous Group Parameters Test (Octet 42 - Bit 0)
          LE Create Connected Isochronous Stream (Octet 42 - Bit 1)
          LE Remove Connected Isochronous Group (Octet 42 - Bit 2)
          LE Accept Connected Isochronous Stream Request (Octet 42 - Bit 3)
          LE Reject Connected Isochronous Stream Request (Octet 42 - Bit 4)
          LE Create Broadcast Isochronous Group (Octet 42 - Bit 5)
          LE Create Broadcast Isochronous Group Test (Octet 42 - Bit 6)
          LE Terminate Broadcast Isochronous Group (Octet 42 - Bit 7)
          LE Broadcast Isochronous Group Create Sync (Octet 43 - Bit 0)
          LE Broadcast Isochronous Group Terminate Sync (Octet 43 - Bit 1)
          LE Request Peer SCA (Octet 43 - Bit 2)
          LE Setup Isochronous Data Path (Octet 43 - Bit 3)
          LE Remove Isochronous Data Path (Octet 43 - Bit 4)
          LE Isochronous Transmit Test (Octet 43 - Bit 5)
          LE Isochronous Receive Test (Octet 43 - Bit 6)
          LE Isochronous Read Test Counters (Octet 43 - Bit 7)
          LE Isochronous Read Test Counters (Octet 44 - Bit 0)
          LE Set Host Feature (Octet 44 - Bit 1)
          Octet 44 - Bit 2 
          Octet 45 - Bit 6 
          Octet 46 - Bit 0 
          Octet 46 - Bit 1 
          Octet 46 - Bit 2 
< HCI Command: Host Buffer Size (0x03|0x0033) plen 7         #9 [hci1] 1.000577
        ACL MTU: 255  ACL max packet: 16
        SCO MTU: 0    SCO max packet: 0
> HCI Event: Command Complete (0x0e) plen 4                 #10 [hci1] 1.001218
      Host Buffer Size (0x03|0x0033) ncmd 1
        Status: Success (0x00)
< HCI Command: Set Controller To Ho.. (0x03|0x0031) plen 1  #11 [hci1] 1.020470
        Flow control: ACL Data Packets (0x01)
> HCI Event: Command Complete (0x0e) plen 4                 #12 [hci1] 1.020872
      Set Controller To Host Flow Control (0x03|0x0031) ncmd 1
        Status: Success (0x00)
< HCI Command: LE Read Local Suppor.. (0x08|0x0003) plen 0  #13 [hci1] 1.040571
> HCI Event: Command Complete (0x0e) plen 12                #14 [hci1] 1.041128
      LE Read Local Supported Features (0x08|0x0003) ncmd 1
        Status: Success (0x00)
        Features: 0xfd 0x79 0x00 0xf7 0x30 0x01 0x00 0x00
          LE Encryption
          Extended Reject Indication
          Peripheral-initiated Features Exchange
          LE Ping
          LE Data Packet Length Extension
          LL Privacy
          Extended Scanner Filter Policies
          LE 2M PHY
          LE Coded PHY
          LE Extended Advertising
          LE Periodic Advertising
          Channel Selection Algorithm #2
          Periodic Advertising Sync Transfer - Sender
          Periodic Advertising Sync Transfer - Recipient
          Sleep Clock Accuracy Updates
          Connected Isochronous Stream - Central
          Connected Isochronous Stream - Peripheral
          Isochronous Broadcaster
          Synchronized Receiver
          Periodic Advertising ADI support
          Connection Subrating
          Unknown features (0x0000010000000000)
< HCI Command: LE Set Host Feature (0x08|0x0074) plen 2     #15 [hci1] 1.060596
        Bit Number: 32
          Connected Isochronous Stream (Host Support)
        Bit Value: 1
> HCI Event: Command Complete (0x0e) plen 4                 #16 [hci1] 1.061057
      LE Set Host Feature (0x08|0x0074) ncmd 1
        Status: Success (0x00)
< HCI Command: LE Read Buffer v2 (0x08|0x0060) plen 0       #17 [hci1] 1.080589
> HCI Event: Command Complete (0x0e) plen 10                #18 [hci1] 1.081110
      LE Read Buffer v2 (0x08|0x0060) ncmd 1
        Status: Success (0x00)
        ACL MTU: 27
        ACL max packet: 3
        ISO MTU: 318
        ISO max packet: 3
< HCI Command: LE Read Maximum Adve.. (0x08|0x003a) plen 0  #19 [hci1] 1.100607
> HCI Event: Command Complete (0x0e) plen 6                 #20 [hci1] 1.101114
      LE Read Maximum Advertising Data Length (0x08|0x003a) ncmd 1
        Status: Success (0x00)
        Max length: 1650
< HCI Command: LE Read Supported St.. (0x08|0x001c) plen 0  #21 [hci1] 1.120584
> HCI Event: Command Complete (0x0e) plen 12                #22 [hci1] 1.121085
      LE Read Supported States (0x08|0x001c) ncmd 1
        Status: Success (0x00)
        States: 0x000003ff3e0306ff
          Non-connectable Advertising State
          Scannable Advertising State
          Connectable Advertising State
          High Duty Cycle Directed Advertising State
          Passive Scanning State
          Active Scanning State
          Initiating State
            and Connection State (Central Role)
          Connection State (Peripheral Role)
          Scannable Advertising State
            and Passive Scanning State
          Connectable Advertising State
            and Passive Scanning State
          Non-connectable Advertising State
            and Initiating State
          Scannable Advertising State
            and Initiating State
          Active Scanning State
            and Connection State (Central Role)
          Passive Scanning State
            and Connection State (Peripheral Role)
          Active Scanning State
            and Connection State (Peripheral Role)
          Initiating State
            and Connection State (Central Role)
            and Central Role & Central Role
          Low Duty Cycle Directed Advertising State
          Connectable Advertising State
            and Initiating State
            and Central Role & Peripheral Role
          High Duty Cycle Directed Advertising State
            and Initiating State
            and Central Role & Peripheral Role
          Low Duty Cycle Directed Advertising State
            and Initiating State
            and Central Role & Peripheral Role
          Connectable Advertising State
            and Connection State (Central Role)
            and Central Role & Peripheral Role
          High Duty Cycle Directed Advertising State
            and Connection State (Central Role)
            and Central Role & Peripheral Role
          Low Duty Cycle Directed Advertising State
            and Connection State (Central Role)
            and Central Role & Peripheral Role
          Connectable Advertising State
            and Connection State (Peripheral Role)
            and Central Role & Peripheral Role
          High Duty Cycle Directed Advertising State
            and Connection State (Peripheral Role)
            and Peripheral Role & Peripheral Role
          Low Duty Cycle Directed Advertising State
            and Connection State (Peripheral Role)
            and Peripheral Role & Peripheral Role
          Initiating State
            and Connection State (Peripheral Role)
            and Central Role & Peripheral Role
< HCI Command: LE Read Maximum Data.. (0x08|0x002f) plen 0  #23 [hci1] 1.140578
> HCI Event: Command Complete (0x0e) plen 12                #24 [hci1] 1.141051
      LE Read Maximum Data Length (0x08|0x002f) ncmd 1
        Status: Success (0x00)
        Max TX octets: 251
        Max TX time: 2704
        Max RX octets: 251
        Max RX time: 2704
< HCI Command: LE Write Suggested D.. (0x08|0x0024) plen 4  #25 [hci1] 1.160591
        TX octets: 251
        TX time: 2704
> HCI Event: Command Complete (0x0e) plen 4                 #26 [hci1] 1.161108
      LE Write Suggested Default Data Length (0x08|0x0024) ncmd 1
        Status: Success (0x00)
< HCI Command: LE Read Resolving Li.. (0x08|0x002a) plen 0  #27 [hci1] 1.180597
> HCI Event: Command Complete (0x0e) plen 5                 #28 [hci1] 1.181050
      LE Read Resolving List Size (0x08|0x002a) ncmd 1
        Status: Success (0x00)
        Size: 8
< HCI Command: LE Set Event Mask (0x08|0x0001) plen 8       #29 [hci1] 1.200578
        Mask: 0x000002023f87fa5e
          LE Advertising Report
          LE Connection Update Complete
          LE Read Remote Used Features Complete
          LE Long Term Key Request
          LE Data Length Change
          LE Enhanced Connection Complete
          LE PHY Update Complete
          LE Extended Advertising Report
          LE Periodic Advertising Sync Established
          LE Periodic Advertising Report
          LE Periodic Advertising Sync Lost
          LE Extended Scan Timeout
          LE Extended Advertising Set Terminated
          LE Scan Request Received
          LE Periodic Advertising Sync Transfer Rvc
          LE CIS Established
          LE CIS Request
          LE Create BIG Complete
          LE Terminate BIG Complete
          LE BIG Sync Estabilished Complete
          LE BIG Sync Lost
          LE BIG Info Advertising Report
          Unknown mask (0x0000020000000000)
> HCI Event: Command Complete (0x0e) plen 4                 #30 [hci1] 1.201159
      LE Set Event Mask (0x08|0x0001) ncmd 1
        Status: Success (0x00)
< HCI Command: Set Event Mask (0x03|0x0001) plen 8          #31 [hci1] 1.220575
        Mask: 0x2000800002008890
          Disconnection Complete
          Encryption Change
          Read Remote Version Information Complete
          Hardware Error
          Data Buffer Overflow
          Encryption Key Refresh Complete
          LE Meta
> HCI Event: Command Complete (0x0e) plen 4                 #32 [hci1] 1.221116
      Set Event Mask (0x03|0x0001) ncmd 1
        Status: Success (0x00)
< HCI Command: Read BD ADDR (0x04|0x0009) plen 0            #33 [hci1] 1.240616
> HCI Event: Command Complete (0x0e) plen 10                #34 [hci1] 1.241209
      Read BD ADDR (0x04|0x0009) ncmd 1
        Status: Success (0x00)
        Address: 00:00:00:00:00:00 (OUI 00-00-00)
< HCI Command: LE Set Random Address (0x08|0x0005) plen 6   #35 [hci1] 1.260603
        Address: D5:B6:CC:31:DB:3B (Static)
> HCI Event: Command Complete (0x0e) plen 4                 #36 [hci1] 1.261179
      LE Set Random Address (0x08|0x0005) ncmd 1
        Status: Success (0x00)
< HCI Command: LE Set Extended Adv.. (0x08|0x0036) plen 25  #37 [hci1] 8.970709
        Handle: 0x00
        Properties: 0x0013
          Connectable
          Scannable
          Use legacy advertising PDUs: ADV_IND
        Min advertising interval: 100.000 msec (0x00a0)
        Max advertising interval: 150.000 msec (0x00f0)
        Channel map: 37, 38, 39 (0x07)
        Own address type: Random (0x01)
        Peer address type: Public (0x00)
        Peer address: 00:00:00:00:00:00 (OUI 00-00-00)
        Filter policy: Allow Scan Request from Any, Allow Connect Request from Any (0x00)
        TX power: Host has no preference (0x7f)
        Primary PHY: LE 1M (0x01)
        Secondary max skip: 0x00
        Secondary PHY: LE 1M (0x01)
        SID: 0x00
        Scan request notifications: Disabled (0x00)
> HCI Event: Command Complete (0x0e) plen 5                 #38 [hci1] 8.971476
      LE Set Extended Advertising Parameters (0x08|0x0036) ncmd 1
        Status: Success (0x00)
        TX power (selected): 0 dbm (0x00)
< HCI Command: LE Set Advertising S.. (0x08|0x0035) plen 7  #39 [hci1] 8.980659
        Advertising handle: 0x00
        Advertising random address: D5:B6:CC:31:DB:3B (Static)
> HCI Event: Command Complete (0x0e) plen 4                 #40 [hci1] 8.981133
      LE Set Advertising Set Random Address (0x08|0x0035) ncmd 1
        Status: Success (0x00)
< HCI Command: LE Set Extended Adv.. (0x08|0x0037) plen 22  #41 [hci1] 9.000632
        Handle: 0x00
        Operation: Complete extended advertising data (0x03)
        Fragment preference: Minimize fragmentation (0x01)
        Data length: 0x12
        Flags: 0x06
          LE General Discoverable Mode
          BR/EDR Not Supported
        Name (complete): Tester_F6B11A
> HCI Event: Command Complete (0x0e) plen 4                 #42 [hci1] 9.001362
      LE Set Extended Advertising Data (0x08|0x0037) ncmd 1
        Status: Success (0x00)
< HCI Command: LE Set Extended Scan.. (0x08|0x0038) plen 4  #43 [hci1] 9.020639
        Handle: 0x00
        Operation: Complete scan response data (0x03)
        Fragment preference: Minimize fragmentation (0x01)
        Data length: 0x00
> HCI Event: Command Complete (0x0e) plen 4                 #44 [hci1] 9.021139
      LE Set Extended Scan Response Data (0x08|0x0038) ncmd 1
        Status: Success (0x00)
< HCI Command: LE Set Extended Adve.. (0x08|0x0039) plen 6  #45 [hci1] 9.040678
        Extended advertising: Enabled (0x01)
        Number of sets: 1 (0x01)
        Entry 0
          Handle: 0x00
          Duration: 0 ms (0x00)
          Max ext adv events: 0
> HCI Event: Command Complete (0x0e) plen 4                 #46 [hci1] 9.041264
      LE Set Extended Advertising Enable (0x08|0x0039) ncmd 1
        Status: Success (0x00)
> HCI Event: LE Meta Event (0x3e) plen 31                   #47 [hci1] 9.361728
      LE Enhanced Connection Complete (0x0a)
        Status: Success (0x00)
        Handle: 1965
        Role: Peripheral (0x01)
        Peer address type: Public (0x00)
        Peer address: DF:A9:FF:F6:B1:1A (OUI DF-A9-FF)
        Local resolvable private address: 00:00:00:00:00:00 (Non-Resolvable)
        Peer resolvable private address: 00:00:00:00:00:00 (Non-Resolvable)
        Connection interval: 87.50 msec (0x0046)
        Connection latency: 0 (0x0000)
        Supervision timeout: 20000 msec (0x07d0)
        Central clock accuracy: 0x01
> HCI Event: LE Meta Event (0x3e) plen 6                    #48 [hci1] 9.361824
      LE Advertising Set Terminated (0x12)
        Status: Success (0x00)
        Handle: 0
        Connection handle: 1965
        Number of completed extended advertising events: 0
< HCI Command: LE Read Remote Used... (0x08|0x0016) plen 2  #49 [hci1] 9.380807
        Handle: 1965 Address: DF:A9:FF:F6:B1:1A (OUI DF-A9-FF)
> HCI Event: Command Status (0x0f) plen 4                   #50 [hci1] 9.381252
      LE Read Remote Used Features (0x08|0x0016) ncmd 1
        Status: Success (0x00)
< HCI Command: LE Set Extended Adv.. (0x08|0x0036) plen 25  #51 [hci1] 9.540694
        Handle: 0x00
        Properties: 0x0013
          Connectable
          Scannable
          Use legacy advertising PDUs: ADV_IND
        Min advertising interval: 100.000 msec (0x00a0)
        Max advertising interval: 150.000 msec (0x00f0)
        Channel map: 37, 38, 39 (0x07)
        Own address type: Random (0x01)
        Peer address type: Public (0x00)
        Peer address: 00:00:00:00:00:00 (OUI 00-00-00)
        Filter policy: Allow Scan Request from Any, Allow Connect Request from Any (0x00)
        TX power: Host has no preference (0x7f)
        Primary PHY: LE 1M (0x01)
        Secondary max skip: 0x00
        Secondary PHY: LE 1M (0x01)
        SID: 0x00
        Scan request notifications: Disabled (0x00)
> HCI Event: Command Complete (0x0e) plen 5                 #52 [hci1] 9.541469
      LE Set Extended Advertising Parameters (0x08|0x0036) ncmd 1
        Status: Success (0x00)
        TX power (selected): 0 dbm (0x00)
< HCI Command: LE Set Advertising S.. (0x08|0x0035) plen 7  #53 [hci1] 9.560652
        Advertising handle: 0x00
        Advertising random address: D5:B6:CC:31:DB:3B (Static)
> HCI Event: Command Complete (0x0e) plen 4                 #54 [hci1] 9.561121
      LE Set Advertising Set Random Address (0x08|0x0035) ncmd 1
        Status: Success (0x00)
< HCI Command: LE Set Extended Adv.. (0x08|0x0037) plen 22  #55 [hci1] 9.580602
        Handle: 0x00
        Operation: Complete extended advertising data (0x03)
        Fragment preference: Minimize fragmentation (0x01)
        Data length: 0x12
        Flags: 0x06
          LE General Discoverable Mode
          BR/EDR Not Supported
        Name (complete): Tester_F6B11A
> HCI Event: Command Complete (0x0e) plen 4                 #56 [hci1] 9.581334
      LE Set Extended Advertising Data (0x08|0x0037) ncmd 1
        Status: Success (0x00)
< HCI Command: LE Set Extended Scan.. (0x08|0x0038) plen 4  #57 [hci1] 9.600672
        Handle: 0x00
        Operation: Complete scan response data (0x03)
        Fragment preference: Minimize fragmentation (0x01)
        Data length: 0x00
> HCI Event: Command Complete (0x0e) plen 4                 #58 [hci1] 9.601114
      LE Set Extended Scan Response Data (0x08|0x0038) ncmd 1
        Status: Success (0x00)
< HCI Command: LE Set Extended Adve.. (0x08|0x0039) plen 6  #59 [hci1] 9.620634
        Extended advertising: Enabled (0x01)
        Number of sets: 1 (0x01)
        Entry 0
          Handle: 0x00
          Duration: 0 ms (0x00)
          Max ext adv events: 0
> HCI Event: Command Complete (0x0e) plen 4                 #60 [hci1] 9.621249
      LE Set Extended Advertising Enable (0x08|0x0039) ncmd 1
        Status: Success (0x00)
> HCI Event: LE Meta Event (0x3e) plen 12                   #61 [hci1] 9.625507
      LE Read Remote Used Features (0x04)
        Status: Success (0x00)
        Handle: 1965 Address: DF:A9:FF:F6:B1:1A (OUI DF-A9-FF)
        Features: 0x2d 0x49 0x00 0xf7 0x67 0xd8 0x00 0x00
          LE Encryption
          Extended Reject Indication
          Peripheral-initiated Features Exchange
          LE Data Packet Length Extension
          LE 2M PHY
          LE Coded PHY
          Channel Selection Algorithm #2
          Periodic Advertising Sync Transfer - Sender
          Periodic Advertising Sync Transfer - Recipient
          Sleep Clock Accuracy Updates
          Connected Isochronous Stream - Central
          Connected Isochronous Stream - Peripheral
          Isochronous Broadcaster
          Synchronized Receiver
          Connected Isochronous Stream (Host Support)
          LE Power Control Request
          LE Power Control Request
          Connection Subrating
          Connection Subrating (Host Support)
          Unknown features (0x0000d80000000000)
> HCI Event: LE Meta Event (0x3e) plen 31                   #62 [hci1] 9.833933
      LE Enhanced Connection Complete (0x0a)
        Status: Success (0x00)
        Handle: 4
        Role: Peripheral (0x01)
        Peer address type: Public (0x00)
        Peer address: 64:23:B5:94:C5:F1 (OUI 64-23-B5)
        Local resolvable private address: 00:00:00:00:00:00 (Non-Resolvable)
        Peer resolvable private address: 00:00:00:00:00:00 (Non-Resolvable)
        Connection interval: 87.50 msec (0x0046)
        Connection latency: 0 (0x0000)
        Supervision timeout: 20000 msec (0x07d0)
        Central clock accuracy: 0x01
> HCI Event: LE Meta Event (0x3e) plen 6                    #63 [hci1] 9.834048
      LE Advertising Set Terminated (0x12)
        Status: Success (0x00)
        Handle: 0
        Connection handle: 4
        Number of completed extended advertising events: 0
< HCI Command: LE Read Remote Used... (0x08|0x0016) plen 2  #64 [hci1] 9.841901
        Handle: 4 Address: 64:23:B5:94:C5:F1 (OUI 64-23-B5)
> HCI Event: Command Status (0x0f) plen 4                   #65 [hci1] 9.842326
      LE Read Remote Used Features (0x08|0x0016) ncmd 1
        Status: Success (0x00)
> HCI Event: LE Meta Event (0x3e) plen 12                  #66 [hci1] 10.097845
      LE Read Remote Used Features (0x04)
        Status: Success (0x00)
        Handle: 4 Address: 64:23:B5:94:C5:F1 (OUI 64-23-B5)
        Features: 0x2d 0x49 0x00 0xf7 0x67 0xd8 0x00 0x00
          LE Encryption
          Extended Reject Indication
          Peripheral-initiated Features Exchange
          LE Data Packet Length Extension
          LE 2M PHY
          LE Coded PHY
          Channel Selection Algorithm #2
          Periodic Advertising Sync Transfer - Sender
          Periodic Advertising Sync Transfer - Recipient
          Sleep Clock Accuracy Updates
          Connected Isochronous Stream - Central
          Connected Isochronous Stream - Peripheral
          Isochronous Broadcaster
          Synchronized Receiver
          Connected Isochronous Stream (Host Support)
          LE Power Control Request
          LE Power Control Request
          Connection Subrating
          Connection Subrating (Host Support)
          Unknown features (0x0000d80000000000)
> ACL Data RX: Handle 1965 flags 0x02 dlen 11              #67 [hci1] 12.075128
      SMP: Pairing Request (0x01) len 6
        IO capability: KeyboardDisplay (0x04)
        OOB data: Authentication data not present (0x00)
        Authentication requirement: Bonding, No MITM, Legacy, No Keypresses (0x01)
        Max encryption key size: 16
        Initiator key distribution: EncKey IdKey Sign (0x07)
        Responder key distribution: EncKey IdKey Sign (0x07)
< HCI Command: Host Number of Comp.. (0x03|0x0035) plen 5  #68 [hci1] 12.080724
        Num handles: 1
        Handle: 1965 Address: DF:A9:FF:F6:B1:1A (OUI DF-A9-FF)
        Count: 1
< ACL Data TX: Handle 1965 flags 0x00 dlen 11              #69 [hci1] 12.080823
      SMP: Pairing Response (0x02) len 6
        IO capability: DisplayOnly (0x00)
        OOB data: Authentication data not present (0x00)
        Authentication requirement: Bonding, No MITM, Legacy, No Keypresses (0x01)
        Max encryption key size: 16
        Initiator key distribution: EncKey IdKey (0x03)
        Responder key distribution: EncKey (0x01)
> HCI Event: Number of Completed Packets (0x13) plen 5     #70 [hci1] 12.250321
        Num handles: 1
        Handle: 1965 Address: DF:A9:FF:F6:B1:1A (OUI DF-A9-FF)
        Count: 1
        #69: len 11 (0 Kb/s)
        Latency: 169 msec (169-169 msec ~169 msec)
> ACL Data RX: Handle 1965 flags 0x02 dlen 21              #71 [hci1] 12.250584
      SMP: Pairing Confirm (0x03) len 16
        Confim value: 5e4bee19cc96ebc64804c9c244e3a896
< HCI Command: Host Number of Comp.. (0x03|0x0035) plen 5  #72 [hci1] 12.260856
        Num handles: 1
        Handle: 1965 Address: DF:A9:FF:F6:B1:1A (OUI DF-A9-FF)
        Count: 1
< ACL Data TX: Handle 1965 flags 0x00 dlen 21              #73 [hci1] 12.260912
      SMP: Pairing Confirm (0x03) len 16
        Confim value: 8969af0e8f23031861649695c246fddc
> HCI Event: Number of Completed Packets (0x13) plen 5     #74 [hci1] 12.425227
        Num handles: 1
        Handle: 1965 Address: DF:A9:FF:F6:B1:1A (OUI DF-A9-FF)
        Count: 1
        #73: len 21 (1 Kb/s)
        Latency: 164 msec (164-169 msec ~166 msec)
> ACL Data RX: Handle 1965 flags 0x02 dlen 21              #75 [hci1] 12.425568
      SMP: Pairing Random (0x04) len 16
        Random value: 02b80a17acfb5e320000000000000000
< HCI Command: Host Number of Comp.. (0x03|0x0035) plen 5  #76 [hci1] 12.440856
        Num handles: 1
        Handle: 1965 Address: DF:A9:FF:F6:B1:1A (OUI DF-A9-FF)
        Count: 1
< ACL Data TX: Handle 1965 flags 0x00 dlen 21              #77 [hci1] 12.440887
      SMP: Pairing Random (0x04) len 16
        Random value: 8e6108f966a694cbe26df70bb96773e6
> ACL Data RX: Handle 4 flags 0x02 dlen 11                 #78 [hci1] 12.547446
      SMP: Pairing Request (0x01) len 6
        IO capability: KeyboardDisplay (0x04)
        OOB data: Authentication data not present (0x00)
        Authentication requirement: Bonding, No MITM, Legacy, No Keypresses (0x01)
        Max encryption key size: 16
        Initiator key distribution: EncKey IdKey Sign (0x07)
        Responder key distribution: EncKey IdKey Sign (0x07)
< HCI Command: Host Number of Comp.. (0x03|0x0035) plen 5  #79 [hci1] 12.560723
        Num handles: 1
        Handle: 4 Address: 64:23:B5:94:C5:F1 (OUI 64-23-B5)
        Count: 1
< ACL Data TX: Handle 4 flags 0x00 dlen 11                 #80 [hci1] 12.560820
      SMP: Pairing Response (0x02) len 6
        IO capability: DisplayOnly (0x00)
        OOB data: Authentication data not present (0x00)
        Authentication requirement: Bonding, No MITM, Legacy, No Keypresses (0x01)
        Max encryption key size: 16
        Initiator key distribution: EncKey IdKey (0x03)
        Responder key distribution: EncKey (0x01)
> HCI Event: Number of Completed Packets (0x13) plen 5     #81 [hci1] 12.600027
        Num handles: 1
        Handle: 1965 Address: DF:A9:FF:F6:B1:1A (OUI DF-A9-FF)
        Count: 1
        #77: len 21 (1 Kb/s)
        Latency: 159 msec (159-169 msec ~163 msec)
> HCI Event: LE Meta Event (0x3e) plen 13                  #82 [hci1] 12.688106
      LE Long Term Key Request (0x05)
        Handle: 1965 Address: DF:A9:FF:F6:B1:1A (OUI DF-A9-FF)
        Random number: 0x0000000000000000
        Encrypted diversifier: 0x0000
< HCI Command: LE Long Term Key R.. (0x08|0x001a) plen 18  #83 [hci1] 12.700642
        Handle: 1965 Address: DF:A9:FF:F6:B1:1A (OUI DF-A9-FF)
        Long term key: 3fb1219679c283bb5d32d9a234e07d01
> HCI Event: Command Complete (0x0e) plen 6                #84 [hci1] 12.701287
      LE Long Term Key Request Reply (0x08|0x001a) ncmd 1
        Status: Success (0x00)
        Handle: 1965 Address: DF:A9:FF:F6:B1:1A (OUI DF-A9-FF)
> HCI Event: Number of Completed Packets (0x13) plen 5     #85 [hci1] 12.722485
        Num handles: 1
        Handle: 4 Address: 64:23:B5:94:C5:F1 (OUI 64-23-B5)
        Count: 1
        #80: len 11 (0 Kb/s)
        Latency: 161 msec (161-161 msec ~161 msec)
> ACL Data RX: Handle 4 flags 0x02 dlen 21                 #86 [hci1] 12.722802
      SMP: Pairing Confirm (0x03) len 16
        Confim value: 1e517366d63c0604f26f904e7074364f
< HCI Command: Host Number of Comp.. (0x03|0x0035) plen 5  #87 [hci1] 12.740846
        Num handles: 1
        Handle: 4 Address: 64:23:B5:94:C5:F1 (OUI 64-23-B5)
        Count: 1
< ACL Data TX: Handle 4 flags 0x00 dlen 21                 #88 [hci1] 12.740913
      SMP: Pairing Confirm (0x03) len 16
        Confim value: 9726468c3f9b4a34122bdb596de54356
> HCI Event: Number of Completed Packets (0x13) plen 5     #89 [hci1] 12.897460
        Num handles: 1
        Handle: 4 Address: 64:23:B5:94:C5:F1 (OUI 64-23-B5)
        Count: 1
        #88: len 21 (1 Kb/s)
        Latency: 156 msec (156-161 msec ~159 msec)
> ACL Data RX: Handle 4 flags 0x02 dlen 21                 #90 [hci1] 12.897800
      SMP: Pairing Random (0x04) len 16
        Random value: 4df66a31f3eae6b20000000000000000
< HCI Command: Host Number of Comp.. (0x03|0x0035) plen 5  #91 [hci1] 12.900871
        Num handles: 1
        Handle: 4 Address: 64:23:B5:94:C5:F1 (OUI 64-23-B5)
        Count: 1
< ACL Data TX: Handle 4 flags 0x00 dlen 21                 #92 [hci1] 12.900916
      SMP: Pairing Random (0x04) len 16
        Random value: 5da095555cc64d02679f89a05211af56
> HCI Event: Number of Completed Packets (0x13) plen 5     #93 [hci1] 13.072311
        Num handles: 1
        Handle: 4 Address: 64:23:B5:94:C5:F1 (OUI 64-23-B5)
        Count: 1
        #92: len 21 (0 Kb/s)
        Latency: 171 msec (156-171 msec ~165 msec)
> HCI Event: Encryption Change (0x08) plen 4               #94 [hci1] 13.125454
        Status: Success (0x00)
        Handle: 1965 Address: DF:A9:FF:F6:B1:1A (OUI DF-A9-FF)
        Encryption: Enabled with AES-CCM (0x01)
> HCI Event: LE Meta Event (0x3e) plen 13                  #95 [hci1] 13.160375
      LE Long Term Key Request (0x05)
        Handle: 4 Address: 64:23:B5:94:C5:F1 (OUI 64-23-B5)
        Random number: 0x0000000000000000
        Encrypted diversifier: 0x0000
< HCI Command: LE Long Term Key R.. (0x08|0x001a) plen 18  #96 [hci1] 13.250779
        Handle: 4 Address: 64:23:B5:94:C5:F1 (OUI 64-23-B5)
        Long term key: c17215b2abfe43414e565964a6d3b2cb
< ACL Data TX: Handle 1965 flags 0x00 dlen 21              #97 [hci1] 13.250788
      SMP: Encryption Information (0x06) len 16
        Long term key: da64d21ec8845e8286bc235a02440d0c
< ACL Data TX: Handle 1965 flags 0x00 dlen 15              #98 [hci1] 13.250789
      SMP: Central Identification (0x07) len 10
        EDIV: 0x4a5c
        Rand: 0xa471fdf8aca22434
> HCI Event: Command Complete (0x0e) plen 6                #99 [hci1] 13.251564
      LE Long Term Key Request Reply (0x08|0x001a) ncmd 1
        Status: Success (0x00)
        Handle: 4 Address: 64:23:B5:94:C5:F1 (OUI 64-23-B5)
> HCI Event: Number of Completed Packets (0x13) plen 5    #100 [hci1] 13.300708
        Num handles: 1
        Handle: 1965 Address: DF:A9:FF:F6:B1:1A (OUI DF-A9-FF)
        Count: 1
        #97: len 21 (3 Kb/s)
        Latency: 49 msec (49-169 msec ~106 msec)
> HCI Event: Number of Completed Packets (0x13) plen 5    #101 [hci1] 13.387758
        Num handles: 1
        Handle: 1965 Address: DF:A9:FF:F6:B1:1A (OUI DF-A9-FF)
        Count: 1
        #98: len 15 (0 Kb/s)
        Latency: 136 msec (49-169 msec ~121 msec)
> ACL Data RX: Handle 1965 flags 0x02 dlen 21             #102 [hci1] 13.387986
      SMP: Encryption Information (0x06) len 16
        Long term key: 6a808319287458c8d09dba489c9bdada
> ACL Data RX: Handle 1965 flags 0x02 dlen 15             #103 [hci1] 13.388416
      SMP: Central Identification (0x07) len 10
        EDIV: 0x1d6e
        Rand: 0x0021e7c5c0e56454
> ACL Data RX: Handle 1965 flags 0x02 dlen 21             #104 [hci1] 13.389145
      SMP: Identity Information (0x08) len 16
        Identity resolving key: f038667c4cd4c8f92d6b8d40d05d70b4
< HCI Command: Host Number of Com.. (0x03|0x0035) plen 5  #105 [hci1] 13.400860
        Num handles: 1
        Handle: 1965 Address: DF:A9:FF:F6:B1:1A (OUI DF-A9-FF)
        Count: 1
< HCI Command: Host Number of Com.. (0x03|0x0035) plen 5  #106 [hci1] 13.400990
        Num handles: 1
        Handle: 1965 Address: DF:A9:FF:F6:B1:1A (OUI DF-A9-FF)
        Count: 1
< HCI Command: Host Number of Com.. (0x03|0x0035) plen 5  #107 [hci1] 13.401094
        Num handles: 1
        Handle: 1965 Address: DF:A9:FF:F6:B1:1A (OUI DF-A9-FF)
        Count: 1
> ACL Data RX: Handle 1965 flags 0x02 dlen 12             #108 [hci1] 13.475180
      SMP: Identity Address Information (0x09) len 7
        Address: DF:A9:FF:F6:B1:1A (OUI DF-A9-FF)
< HCI Command: LE Add Device To... (0x08|0x0027) plen 39  #109 [hci1] 13.480815
        Address type: Public (0x00)
        Address: DF:A9:FF:F6:B1:1A (OUI DF-A9-FF)
        Peer identity resolving key: f038667c4cd4c8f92d6b8d40d05d70b4
        Local identity resolving key: 00000000000000000000000000000000
> HCI Event: Command Complete (0x0e) plen 4               #110 [hci1] 13.481709
      LE Add Device To Resolving List (0x08|0x0027) ncmd 1
        Status: Success (0x00)
< HCI Command: LE Set Privacy Mode (0x08|0x004e) plen 8   #111 [hci1] 13.500693
        Peer Identity address type: Public (0x00)
        Peer Identity address: DF:A9:FF:F6:B1:1A (OUI DF-A9-FF)
        Privacy Mode: Use Device Privacy (0x01)
> HCI Event: Command Complete (0x0e) plen 4               #112 [hci1] 13.501222
      LE Set Privacy Mode (0x08|0x004e) ncmd 1
        Status: Success (0x00)
< HCI Command: LE Set Address Res.. (0x08|0x002d) plen 1  #113 [hci1] 13.520633
        Address resolution: Enabled (0x01)
> HCI Event: Command Complete (0x0e) plen 4               #114 [hci1] 13.521065
      LE Set Address Resolution Enable (0x08|0x002d) ncmd 1
        Status: Success (0x00)
< HCI Command: Host Number of Com.. (0x03|0x0035) plen 5  #115 [hci1] 13.540657
        Num handles: 1
        Handle: 1965 Address: DF:A9:FF:F6:B1:1A (OUI DF-A9-FF)
        Count: 1
> HCI Event: Encryption Change (0x08) plen 4              #116 [hci1] 13.597520
        Status: Success (0x00)
        Handle: 4 Address: 64:23:B5:94:C5:F1 (OUI 64-23-B5)
        Encryption: Enabled with AES-CCM (0x01)
< ACL Data TX: Handle 4 flags 0x00 dlen 21                #117 [hci1] 13.710693
      SMP: Encryption Information (0x06) len 16
        Long term key: cadd27bd58e945097b00bad7aca1ba32
< ACL Data TX: Handle 4 flags 0x00 dlen 15                #118 [hci1] 13.710702
      SMP: Central Identification (0x07) len 10
        EDIV: 0x74e3
        Rand: 0xb2339fe7646e7e52
> HCI Event: Number of Completed Packets (0x13) plen 5    #119 [hci1] 13.772849
        Num handles: 1
        Handle: 4 Address: 64:23:B5:94:C5:F1 (OUI 64-23-B5)
        Count: 1
        #117: len 21 (2 Kb/s)
        Latency: 62 msec (62-171 msec ~113 msec)
> ACL Data RX: Handle 1965 flags 0x02 dlen 11             #120 [hci1] 13.825256
      ATT: Read By Type Request (0x08) len 6
        Handle range: 0x0001-0xffff
        Attribute type: Characteristic (0x2803)
< HCI Command: Host Number of Com.. (0x03|0x0035) plen 5  #121 [hci1] 13.840786
        Num handles: 1
        Handle: 1965 Address: DF:A9:FF:F6:B1:1A (OUI DF-A9-FF)
        Count: 1
< ACL Data TX: Handle 1965 flags 0x00 dlen 20             #122 [hci1] 13.840885
      ATT: Read By Type Response (0x09) len 15
        Attribute data length: 7
        Attribute data list: 2 entries
        Handle: 0x0002
        Value: 200300052a
            Properties: 0x20
              Indicate (0x20)
            Value Handle: 0x0003
            Value UUID: Service Changed (0x2a05)
        Handle: 0x0005
        Value: 0a0600292b
            Properties: 0x0a
              Read (0x02)
              Write (0x08)
            Value Handle: 0x0006
            Value UUID: Client Supported Features (0x2b29)
> HCI Event: Number of Completed Packets (0x13) plen 5    #123 [hci1] 13.859998
        Num handles: 1
        Handle: 4 Address: 64:23:B5:94:C5:F1 (OUI 64-23-B5)
        Count: 1
        #118: len 15 (0 Kb/s)
        Latency: 149 msec (62-171 msec ~131 msec)
> ACL Data RX: Handle 4 flags 0x02 dlen 21                #124 [hci1] 13.860192
      SMP: Encryption Information (0x06) len 16
        Long term key: 6d7c4b1873ca805950992674173d8a94
> ACL Data RX: Handle 4 flags 0x02 dlen 15                #125 [hci1] 13.860663
      SMP: Central Identification (0x07) len 10
        EDIV: 0x5679
        Rand: 0x67c8605ca50c5e16
< HCI Command: Host Number of Com.. (0x03|0x0035) plen 5  #126 [hci1] 13.860707
        Num handles: 1
        Handle: 4 Address: 64:23:B5:94:C5:F1 (OUI 64-23-B5)
        Count: 1
> ACL Data RX: Handle 4 flags 0x02 dlen 21                #127 [hci1] 13.861370
      SMP: Identity Information (0x08) len 16
        Identity resolving key: 2375c185ed8c5964a4ad61474140b476
< HCI Command: Host Number of Com.. (0x03|0x0035) plen 5  #128 [hci1] 13.880782
        Num handles: 1
        Handle: 4 Address: 64:23:B5:94:C5:F1 (OUI 64-23-B5)
        Count: 1
< HCI Command: Host Number of Com.. (0x03|0x0035) plen 5  #129 [hci1] 13.880897
        Num handles: 1
        Handle: 4 Address: 64:23:B5:94:C5:F1 (OUI 64-23-B5)
        Count: 1
> ACL Data RX: Handle 4 flags 0x02 dlen 12                #130 [hci1] 13.947470
      SMP: Identity Address Information (0x09) len 7
        Address: 64:23:B5:94:C5:F1 (OUI 64-23-B5)
< HCI Command: LE Set Address Res.. (0x08|0x002d) plen 1  #131 [hci1] 13.960819
        Address resolution: Disabled (0x00)
> HCI Event: Command Complete (0x0e) plen 4               #132 [hci1] 13.961319
      LE Set Address Resolution Enable (0x08|0x002d) ncmd 1
        Status: Success (0x00)
< HCI Command: LE Add Device To... (0x08|0x0027) plen 39  #133 [hci1] 13.980699
        Address type: Public (0x00)
        Address: 64:23:B5:94:C5:F1 (OUI 64-23-B5)
        Peer identity resolving key: 2375c185ed8c5964a4ad61474140b476
        Local identity resolving key: 00000000000000000000000000000000
> HCI Event: Command Complete (0x0e) plen 4               #134 [hci1] 13.981753
      LE Add Device To Resolving List (0x08|0x0027) ncmd 1
        Status: Success (0x00)
> HCI Event: Number of Completed Packets (0x13) plen 5    #135 [hci1] 14.000168
        Num handles: 1
        Handle: 1965 Address: DF:A9:FF:F6:B1:1A (OUI DF-A9-FF)
        Count: 1
        #122: len 20 (1 Kb/s)
        Latency: 159 msec (49-169 msec ~140 msec)
> ACL Data RX: Handle 1965 flags 0x02 dlen 11             #136 [hci1] 14.000442
      ATT: Read By Type Request (0x08) len 6
        Handle range: 0x0006-0xffff
        Attribute type: Characteristic (0x2803)
< HCI Command: LE Set Privacy Mode (0x08|0x004e) plen 8   #137 [hci1] 14.000665
        Peer Identity address type: Public (0x00)
        Peer Identity address: 64:23:B5:94:C5:F1 (OUI 64-23-B5)
        Privacy Mode: Use Device Privacy (0x01)
> HCI Event: Command Complete (0x0e) plen 4               #138 [hci1] 14.001183
      LE Set Privacy Mode (0x08|0x004e) ncmd 1
        Status: Success (0x00)
< HCI Command: LE Set Address Res.. (0x08|0x002d) plen 1  #139 [hci1] 14.020699
        Address resolution: Enabled (0x01)
> HCI Event: Command Complete (0x0e) plen 4               #140 [hci1] 14.021084
      LE Set Address Resolution Enable (0x08|0x002d) ncmd 1
        Status: Success (0x00)
< HCI Command: Host Number of Com.. (0x03|0x0035) plen 5  #141 [hci1] 14.040655
        Num handles: 1
        Handle: 4 Address: 64:23:B5:94:C5:F1 (OUI 64-23-B5)
        Count: 1
< HCI Command: Host Number of Com.. (0x03|0x0035) plen 5  #142 [hci1] 14.040840
        Num handles: 1
        Handle: 1965 Address: DF:A9:FF:F6:B1:1A (OUI DF-A9-FF)
        Count: 1
< ACL Data TX: Handle 1965 flags 0x00 dlen 20             #143 [hci1] 14.040869
      ATT: Read By Type Response (0x09) len 15
        Attribute data length: 7
        Attribute data list: 2 entries
        Handle: 0x0007
        Value: 0208002a2b
            Properties: 0x02
              Read (0x02)
            Value Handle: 0x0008
            Value UUID: Database Hash (0x2b2a)
        Handle: 0x0009
        Value: 020a003a2b
            Properties: 0x02
              Read (0x02)
            Value Handle: 0x000a
            Value UUID: Server Supported Features (0x2b3a)
> HCI Event: Number of Completed Packets (0x13) plen 5    #144 [hci1] 14.175096
        Num handles: 1
        Handle: 1965 Address: DF:A9:FF:F6:B1:1A (OUI DF-A9-FF)
        Count: 1
        #143: len 20 (1 Kb/s)
        Latency: 134 msec (49-169 msec ~137 msec)
> ACL Data RX: Handle 1965 flags 0x02 dlen 11             #145 [hci1] 14.175345
      ATT: Read By Type Request (0x08) len 6
        Handle range: 0x000a-0xffff
        Attribute type: Characteristic (0x2803)
< HCI Command: Host Number of Com.. (0x03|0x0035) plen 5  #146 [hci1] 14.180856
        Num handles: 1
        Handle: 1965 Address: DF:A9:FF:F6:B1:1A (OUI DF-A9-FF)
        Count: 1
< ACL Data TX: Handle 1965 flags 0x00 dlen 20             #147 [hci1] 14.180923
      ATT: Read By Type Response (0x09) len 15
        Attribute data length: 7
        Attribute data list: 2 entries
        Handle: 0x000c
        Value: 0a0d00002a
            Properties: 0x0a
              Read (0x02)
              Write (0x08)
            Value Handle: 0x000d
            Value UUID: Device Name (0x2a00)
        Handle: 0x000e
        Value: 0a0f00012a
            Properties: 0x0a
              Read (0x02)
              Write (0x08)
            Value Handle: 0x000f
            Value UUID: Appearance (0x2a01)
> HCI Event: Number of Completed Packets (0x13) plen 5    #148 [hci1] 14.350161
        Num handles: 1
        Handle: 1965 Address: DF:A9:FF:F6:B1:1A (OUI DF-A9-FF)
        Count: 1
        #147: len 20 (0 Kb/s)
        Latency: 169 msec (49-169 msec ~153 msec)
> ACL Data RX: Handle 1965 flags 0x02 dlen 11             #149 [hci1] 14.350336
      ATT: Read By Type Request (0x08) len 6
        Handle range: 0x000f-0xffff
        Attribute type: Characteristic (0x2803)
< HCI Command: Host Number of Com.. (0x03|0x0035) plen 5  #150 [hci1] 14.360679
        Num handles: 1
        Handle: 1965 Address: DF:A9:FF:F6:B1:1A (OUI DF-A9-FF)
        Count: 1
< ACL Data TX: Handle 1965 flags 0x00 dlen 20             #151 [hci1] 14.360753
      ATT: Read By Type Response (0x09) len 15
        Attribute data length: 7
        Attribute data list: 2 entries
        Handle: 0x0010
        Value: 021100042a
            Properties: 0x02
              Read (0x02)
            Value Handle: 0x0011
            Value UUID: Peripheral Preferred Connection Parameters (0x2a04)
        Handle: 0x0013
        Value: 021400242a
            Properties: 0x02
              Read (0x02)
            Value Handle: 0x0014
            Value UUID: Model Number String (0x2a24)
> ACL Data RX: Handle 4 flags 0x02 dlen 11                #152 [hci1] 14.384933
      ATT: Read By Type Request (0x08) len 6
        Handle range: 0x0001-0xffff
        Attribute type: Characteristic (0x2803)
< ACL Data TX: Handle 1965 flags 0x00 dlen 16             #153 [hci1] 14.390676
      LE L2CAP: Connection Parameter Update Request (0x12) ident 1 len 8
        Min interval: 24
        Max interval: 40
        Peripheral latency: 0
        Timeout multiplier: 42
< HCI Command: Host Number of Com.. (0x03|0x0035) plen 5  #154 [hci1] 14.400794
        Num handles: 1
        Handle: 4 Address: 64:23:B5:94:C5:F1 (OUI 64-23-B5)
        Count: 1
< ACL Data TX: Handle 4 flags 0x00 dlen 20                #155 [hci1] 14.400916
      ATT: Read By Type Response (0x09) len 15
        Attribute data length: 7
        Attribute data list: 2 entries
        Handle: 0x0002
        Value: 200300052a
            Properties: 0x20
              Indicate (0x20)
            Value Handle: 0x0003
            Value UUID: Service Changed (0x2a05)
        Handle: 0x0005
        Value: 0a0600292b
            Properties: 0x0a
              Read (0x02)
              Write (0x08)
            Value Handle: 0x0006
            Value UUID: Client Supported Features (0x2b29)
> HCI Event: Number of Completed Packets (0x13) plen 5    #156 [hci1] 14.438176
        Num handles: 1
        Handle: 1965 Address: DF:A9:FF:F6:B1:1A (OUI DF-A9-FF)
        Count: 1
        #151: len 20 (2 Kb/s)
        Latency: 77 msec (49-169 msec ~115 msec)
> HCI Event: Number of Completed Packets (0x13) plen 5    #157 [hci1] 14.525111
        Num handles: 1
        Handle: 1965 Address: DF:A9:FF:F6:B1:1A (OUI DF-A9-FF)
        Count: 1
        #153: len 16 (0 Kb/s)
        Latency: 134 msec (49-169 msec ~124 msec)
> ACL Data RX: Handle 1965 flags 0x02 dlen 11             #158 [hci1] 14.525248
      ATT: Read By Type Request (0x08) len 6
        Handle range: 0x0014-0xffff
        Attribute type: Characteristic (0x2803)
> ACL Data RX: Handle 1965 flags 0x02 dlen 10             #159 [hci1] 14.525761
      LE L2CAP: Connection Parameter Update Response (0x13) ident 1 len 2
        Result: Connection Parameters accepted (0x0000)
< HCI Command: Host Number of Com.. (0x03|0x0035) plen 5  #160 [hci1] 14.540770
        Num handles: 1
        Handle: 1965 Address: DF:A9:FF:F6:B1:1A (OUI DF-A9-FF)
        Count: 1
< ACL Data TX: Handle 1965 flags 0x00 dlen 20             #161 [hci1] 14.540778
      ATT: Read By Type Response (0x09) len 15
        Attribute data length: 7
        Attribute data list: 2 entries
        Handle: 0x0015
        Value: 021600292a
            Properties: 0x02
              Read (0x02)
            Value Handle: 0x0016
            Value UUID: Manufacturer Name String (0x2a29)
        Handle: 0x0017
        Value: 021800502a
            Properties: 0x02
              Read (0x02)
            Value Handle: 0x0018
            Value UUID: PnP ID (0x2a50)
< HCI Command: Host Number of Com.. (0x03|0x0035) plen 5  #162 [hci1] 14.540779
        Num handles: 1
        Handle: 1965 Address: DF:A9:FF:F6:B1:1A (OUI DF-A9-FF)
        Count: 1
> HCI Event: Number of Completed Packets (0x13) plen 5    #163 [hci1] 14.559861
        Num handles: 1
        Handle: 4 Address: 64:23:B5:94:C5:F1 (OUI 64-23-B5)
        Count: 1
        #155: len 20 (1 Kb/s)
        Latency: 158 msec (62-171 msec ~145 msec)
> ACL Data RX: Handle 4 flags 0x02 dlen 11                #164 [hci1] 14.560064
      ATT: Read By Type Request (0x08) len 6
        Handle range: 0x0006-0xffff
        Attribute type: Characteristic (0x2803)
< HCI Command: Host Number of Com.. (0x03|0x0035) plen 5  #165 [hci1] 14.560803
        Num handles: 1
        Handle: 4 Address: 64:23:B5:94:C5:F1 (OUI 64-23-B5)
        Count: 1
< ACL Data TX: Handle 4 flags 0x00 dlen 20                #166 [hci1] 14.560864
      ATT: Read By Type Response (0x09) len 15
        Attribute data length: 7
        Attribute data list: 2 entries
        Handle: 0x0007
        Value: 0208002a2b
            Properties: 0x02
              Read (0x02)
            Value Handle: 0x0008
            Value UUID: Database Hash (0x2b2a)
        Handle: 0x0009
        Value: 020a003a2b
            Properties: 0x02
              Read (0x02)
            Value Handle: 0x000a
            Value UUID: Server Supported Features (0x2b3a)
> HCI Event: Number of Completed Packets (0x13) plen 5    #167 [hci1] 14.700092
        Num handles: 1
        Handle: 1965 Address: DF:A9:FF:F6:B1:1A (OUI DF-A9-FF)
        Count: 1
        #161: len 20 (1 Kb/s)
        Latency: 159 msec (49-169 msec ~142 msec)
> ACL Data RX: Handle 1965 flags 0x02 dlen 11             #168 [hci1] 14.700278
      ATT: Read By Type Request (0x08) len 6
        Handle range: 0x0018-0xffff
        Attribute type: Characteristic (0x2803)
< HCI Command: Host Number of Com.. (0x03|0x0035) plen 5  #169 [hci1] 14.700714
        Num handles: 1
        Handle: 1965 Address: DF:A9:FF:F6:B1:1A (OUI DF-A9-FF)
        Count: 1
< ACL Data TX: Handle 1965 flags 0x00 dlen 20             #170 [hci1] 14.700736
      ATT: Read By Type Response (0x09) len 15
        Attribute data length: 7
        Attribute data list: 2 entries
        Handle: 0x0019
        Value: 021a00252a
            Properties: 0x02
              Read (0x02)
            Value Handle: 0x001a
            Value UUID: Serial Number String (0x2a25)
        Handle: 0x001b
        Value: 021c00262a
            Properties: 0x02
              Read (0x02)
            Value Handle: 0x001c
            Value UUID: Firmware Revision String (0x2a26)
> HCI Event: Number of Completed Packets (0x13) plen 5    #171 [hci1] 14.734815
        Num handles: 1
        Handle: 4 Address: 64:23:B5:94:C5:F1 (OUI 64-23-B5)
        Count: 1
        #166: len 20 (0 Kb/s)
        Latency: 173 msec (62-173 msec ~159 msec)
> ACL Data RX: Handle 4 flags 0x02 dlen 11                #172 [hci1] 14.735161
      ATT: Read By Type Request (0x08) len 6
        Handle range: 0x000a-0xffff
        Attribute type: Characteristic (0x2803)
< HCI Command: Host Number of Com.. (0x03|0x0035) plen 5  #173 [hci1] 14.740845
        Num handles: 1
        Handle: 4 Address: 64:23:B5:94:C5:F1 (OUI 64-23-B5)
        Count: 1
< ACL Data TX: Handle 4 flags 0x00 dlen 20                #174 [hci1] 14.740874
      ATT: Read By Type Response (0x09) len 15
        Attribute data length: 7
        Attribute data list: 2 entries
        Handle: 0x000c
        Value: 0a0d00002a
            Properties: 0x0a
              Read (0x02)
              Write (0x08)
            Value Handle: 0x000d
            Value UUID: Device Name (0x2a00)
        Handle: 0x000e
        Value: 0a0f00012a
            Properties: 0x0a
              Read (0x02)
              Write (0x08)
            Value Handle: 0x000f
            Value UUID: Appearance (0x2a01)
< ACL Data TX: Handle 4 flags 0x00 dlen 16                #175 [hci1] 14.850677
      LE L2CAP: Connection Parameter Update Request (0x12) ident 2 len 8
        Min interval: 24
        Max interval: 40
        Peripheral latency: 0
        Timeout multiplier: 42
> HCI Event: Number of Completed Packets (0x13) plen 5    #176 [hci1] 14.875111
        Num handles: 1
        Handle: 1965 Address: DF:A9:FF:F6:B1:1A (OUI DF-A9-FF)
        Count: 1
        #170: len 20 (0 Kb/s)
        Latency: 174 msec (49-174 msec ~158 msec)
> ACL Data RX: Handle 1965 flags 0x02 dlen 11             #177 [hci1] 14.875308
      ATT: Read By Type Request (0x08) len 6
        Handle range: 0x001c-0xffff
        Attribute type: Characteristic (0x2803)
< HCI Command: Host Number of Com.. (0x03|0x0035) plen 5  #178 [hci1] 14.880833
        Num handles: 1
        Handle: 1965 Address: DF:A9:FF:F6:B1:1A (OUI DF-A9-FF)
        Count: 1
< ACL Data TX: Handle 1965 flags 0x00 dlen 20             #179 [hci1] 14.880865
      ATT: Read By Type Response (0x09) len 15
        Attribute data length: 7
        Attribute data list: 2 entries
        Handle: 0x001d
        Value: 021e00272a
            Properties: 0x02
              Read (0x02)
            Value Handle: 0x001e
            Value UUID: Hardware Revision String (0x2a27)
        Handle: 0x001f
        Value: 022000282a
            Properties: 0x02
              Read (0x02)
            Value Handle: 0x0020
            Value UUID: Software Revision String (0x2a28)
> HCI Event: Number of Completed Packets (0x13) plen 5    #180 [hci1] 14.909853
        Num handles: 1
        Handle: 4 Address: 64:23:B5:94:C5:F1 (OUI 64-23-B5)
        Count: 1
        #174: len 20 (0 Kb/s)
        Latency: 168 msec (62-173 msec ~164 msec)
> ACL Data RX: Handle 4 flags 0x02 dlen 11                #181 [hci1] 14.910045
      ATT: Read By Type Request (0x08) len 6
        Handle range: 0x000f-0xffff
        Attribute type: Characteristic (0x2803)
< HCI Command: Host Number of Com.. (0x03|0x0035) plen 5  #182 [hci1] 14.920829
        Num handles: 1
        Handle: 4 Address: 64:23:B5:94:C5:F1 (OUI 64-23-B5)
        Count: 1
< ACL Data TX: Handle 4 flags 0x00 dlen 20                #183 [hci1] 14.920900
      ATT: Read By Type Response (0x09) len 15
        Attribute data length: 7
        Attribute data list: 2 entries
        Handle: 0x0010
        Value: 021100042a
            Properties: 0x02
              Read (0x02)
            Value Handle: 0x0011
            Value UUID: Peripheral Preferred Connection Parameters (0x2a04)
        Handle: 0x0013
        Value: 021400242a
            Properties: 0x02
              Read (0x02)
            Value Handle: 0x0014
            Value UUID: Model Number String (0x2a24)
> HCI Event: Number of Completed Packets (0x13) plen 5    #184 [hci1] 14.997356
        Num handles: 1
        Handle: 4 Address: 64:23:B5:94:C5:F1 (OUI 64-23-B5)
        Count: 1
        #175: len 16 (0 Kb/s)
        Latency: 146 msec (62-173 msec ~155 msec)
> ACL Data RX: Handle 4 flags 0x02 dlen 10                #185 [hci1] 14.997445
      LE L2CAP: Connection Parameter Update Response (0x13) ident 2 len 2
        Result: Connection Parameters accepted (0x0000)
< HCI Command: Host Number of Com.. (0x03|0x0035) plen 5  #186 [hci1] 15.000792
        Num handles: 1
        Handle: 4 Address: 64:23:B5:94:C5:F1 (OUI 64-23-B5)
        Count: 1
> HCI Event: Number of Completed Packets (0x13) plen 5    #187 [hci1] 15.050120
        Num handles: 1
        Handle: 1965 Address: DF:A9:FF:F6:B1:1A (OUI DF-A9-FF)
        Count: 1
        #179: len 20 (0 Kb/s)
        Latency: 169 msec (49-174 msec ~163 msec)
> ACL Data RX: Handle 1965 flags 0x02 dlen 11             #188 [hci1] 15.050361
      ATT: Read By Type Request (0x08) len 6
        Handle range: 0x0020-0xffff
        Attribute type: Characteristic (0x2803)
< HCI Command: Host Number of Com.. (0x03|0x0035) plen 5  #189 [hci1] 15.060890
        Num handles: 1
        Handle: 1965 Address: DF:A9:FF:F6:B1:1A (OUI DF-A9-FF)
        Count: 1
< ACL Data TX: Handle 1965 flags 0x00 dlen 20             #190 [hci1] 15.060978
      ATT: Read By Type Response (0x09) len 15
        Attribute data length: 7
        Attribute data list: 2 entries
        Handle: 0x0022
        Value: 0a230050aa
            Properties: 0x0a
              Read (0x02)
              Write (0x08)
            Value Handle: 0x0023
            Value UUID: Unknown (0xaa50)
        Handle: 0x0024
        Value: 0a250051aa
            Properties: 0x0a
              Read (0x02)
              Write (0x08)
            Value Handle: 0x0025
            Value UUID: Unknown (0xaa51)
> HCI Event: Number of Completed Packets (0x13) plen 5    #191 [hci1] 15.084902
        Num handles: 1
        Handle: 4 Address: 64:23:B5:94:C5:F1 (OUI 64-23-B5)
        Count: 1
        #183: len 20 (0 Kb/s)
        Latency: 164 msec (62-173 msec ~159 msec)
> ACL Data RX: Handle 4 flags 0x02 dlen 11                #192 [hci1] 15.085118
      ATT: Read By Type Request (0x08) len 6
        Handle range: 0x0014-0xffff
        Attribute type: Characteristic (0x2803)
< HCI Command: Host Number of Com.. (0x03|0x0035) plen 5  #193 [hci1] 15.100860
        Num handles: 1
        Handle: 4 Address: 64:23:B5:94:C5:F1 (OUI 64-23-B5)
        Count: 1
< ACL Data TX: Handle 4 flags 0x00 dlen 20                #194 [hci1] 15.100884
      ATT: Read By Type Response (0x09) len 15
        Attribute data length: 7
        Attribute data list: 2 entries
        Handle: 0x0015
        Value: 021600292a
            Properties: 0x02
              Read (0x02)
            Value Handle: 0x0016
            Value UUID: Manufacturer Name String (0x2a29)
        Handle: 0x0017
        Value: 021800502a
            Properties: 0x02
              Read (0x02)
            Value Handle: 0x0018
            Value UUID: PnP ID (0x2a50)
