Bluetooth monitor ver 5.84
btmon[1604996]: = Note: Linux version 6.8.0-83-generic (x86_64)                                                          0.087330
btmon[1604996]: = Note: Bluetooth subsystem version 2.22                                                                 0.087332
= New Index: 00:00:00:00:00:00 (Primary,UART,hci0)                                                                       0.087333
= Open Index: 00:00:00:00:00:00                                                                                          0.094761
= Index Info: 00:00:00:00:00:00 (Nordic Semiconductor ASA)                                                               0.094765
zephyr.exe[1604998]: @ USER Open: main (privileged) version 2.22                                                {0x0001} 0.094767
zephyr.exe[1604998]: < HCI Command: Reset (0x03|0x0003) plen 0                                                        #1 0.094962
> HCI Event: Command Complete (0x0e) plen 4                                                                           #2 0.095471
      Reset (0x03|0x0003) ncmd 1
        Status: Success (0x00)
zephyr.exe[1604998]: < HCI Command: Read Local Supported Features (0x04|0x0003) plen 0                                #3 0.114634
> HCI Event: Command Complete (0x0e) plen 12                                                                          #4 0.115273
      Read Local Supported Features (0x04|0x0003) ncmd 1
        Status: Success (0x00)
        Features: 0x00 0x00 0x00 0x00 0x60 0x00 0x00 0x00
          BR/EDR Not Supported
          LE Supported (Controller)
zephyr.exe[1604998]: < HCI Command: Read Local Version Information (0x04|0x0001) plen 0                               #5 0.134671
> HCI Event: Command Complete (0x0e) plen 12                                                                          #6 0.135335
      Read Local Version Information (0x04|0x0001) ncmd 1
        Status: Success (0x00)
        HCI version: Reserved (0x0e) - Revision 12520 (0x30e8)
        LMP version: Reserved (0x0e) - Subversion 12520 (0x30e8)
        Manufacturer: Nordic Semiconductor ASA (89)
zephyr.exe[1604998]: < HCI Command: Read Local Supported Commands (0x04|0x0002) plen 0                                #7 0.154631
> HCI Event: Command Complete (0x0e) plen 68                                                                          #8 0.155732
      Read Local Supported Commands (0x04|0x0002) ncmd 1
        Status: Success (0x00)
        Commands: 119 entries
          Disconnect (Octet 0 - Bit 5)
          Read Remote Version Information (Octet 2 - Bit 7)
          Set Event Mask (Octet 5 - Bit 6)
          Reset (Octet 5 - Bit 7)
          Read Connection Accept Timeout (Octet 7 - Bit 2)
          Write Connection Accept Timeout (Octet 7 - Bit 3)
          Read Transmit Power Level (Octet 10 - Bit 2)
          Set Controller To Host Flow Control (Octet 10 - Bit 5)
          Host Buffer Size (Octet 10 - Bit 6)
          Host Number of Completed Packets (Octet 10 - Bit 7)
          Read Local Version Information (Octet 14 - Bit 3)
          Read Local Supported Features (Octet 14 - Bit 5)
          Read BD ADDR (Octet 15 - Bit 1)
          Read RSSI (Octet 15 - Bit 5)
          Set Event Mask Page 2 (Octet 22 - Bit 2)
          LE Set Event Mask (Octet 25 - Bit 0)
          LE Read Buffer Size (Octet 25 - Bit 1)
          LE Read Local Supported Features (Octet 25 - Bit 2)
          LE Set Random Address (Octet 25 - Bit 4)
          LE Set Advertising Parameters (Octet 25 - Bit 5)
          LE Read Advertising Channel TX Power (Octet 25 - Bit 6)
          LE Set Advertising Data (Octet 25 - Bit 7)
          LE Set Scan Response Data (Octet 26 - Bit 0)
          LE Set Advertise Enable (Octet 26 - Bit 1)
          LE Set Scan Parameters (Octet 26 - Bit 2)
          LE Set Scan Enable (Octet 26 - Bit 3)
          LE Create Connection (Octet 26 - Bit 4)
          LE Create Connection Cancel (Octet 26 - Bit 5)
          LE Read Accept List Size (Octet 26 - Bit 6)
          LE Clear Accept List (Octet 26 - Bit 7)
          LE Add Device To Accept List (Octet 27 - Bit 0)
          LE Remove Device From Accept List (Octet 27 - Bit 1)
          LE Connection Update (Octet 27 - Bit 2)
          LE Set Host Channel Classification (Octet 27 - Bit 3)
          LE Read Channel Map (Octet 27 - Bit 4)
          LE Read Remote Used Features (Octet 27 - Bit 5)
          LE Encrypt (Octet 27 - Bit 6)
          LE Rand (Octet 27 - Bit 7)
          LE Start Encryption (Octet 28 - Bit 0)
          LE Long Term Key Request Reply (Octet 28 - Bit 1)
          LE Long Term Key Request Neg Reply (Octet 28 - Bit 2)
          LE Read Supported States (Octet 28 - Bit 3)
          LE Receiver Test (Octet 28 - Bit 4)
          LE Transmitter Test (Octet 28 - Bit 5)
          LE Test End (Octet 28 - Bit 6)
          Read Authenticated Payload Timeout (Octet 32 - Bit 4)
          Write Authenticated Payload Timeout (Octet 32 - Bit 5)
          LE Set Data Length (Octet 33 - Bit 6)
          LE Read Suggested Default Data Length (Octet 33 - Bit 7)
          LE Write Suggested Default Data Length (Octet 34 - Bit 0)
          LE Add Device To Resolving List (Octet 34 - Bit 3)
          LE Remove Device From Resolving List (Octet 34 - Bit 4)
          LE Clear Resolving List (Octet 34 - Bit 5)
          LE Read Resolving List Size (Octet 34 - Bit 6)
          LE Set Address Resolution Enable (Octet 35 - Bit 1)
          LE Set Resolvable Private Address Timeout (Octet 35 - Bit 2)
          LE Read Maximum Data Length (Octet 35 - Bit 3)
          LE Read PHY (Octet 35 - Bit 4)
          LE Set Default PHY (Octet 35 - Bit 5)
          LE Set PHY (Octet 35 - Bit 6)
          LE Enhanced Receiver Test (Octet 35 - Bit 7)
          LE Enhanced Transmitter Test (Octet 36 - Bit 0)
          LE Set Advertising Set Random Address (Octet 36 - Bit 1)
          LE Set Extended Advertising Parameters (Octet 36 - Bit 2)
          LE Set Extended Advertising Data (Octet 36 - Bit 3)
          LE Set Extended Scan Response Data (Octet 36 - Bit 4)
          LE Set Extended Advertising Enable (Octet 36 - Bit 5)
          LE Read Maximum Advertising Data Length (Octet 36 - Bit 6)
          LE Read Number of Supported Advertising Sets (Octet 36 - Bit 7)
          LE Remove Advertising Set (Octet 37 - Bit 0)
          LE Clear Advertising Sets (Octet 37 - Bit 1)
          LE Set Periodic Advertising Parameters (Octet 37 - Bit 2)
          LE Set Periodic Advertising Data (Octet 37 - Bit 3)
          LE Set Periodic Advertising Enable (Octet 37 - Bit 4)
          LE Set Extended Scan Parameters (Octet 37 - Bit 5)
          LE Set Extended Scan Enable (Octet 37 - Bit 6)
          LE Extended Create Connection (Octet 37 - Bit 7)
          LE Periodic Advertising Create Sync (Octet 38 - Bit 0)
          LE Periodic Advertising Create Sync Cancel (Octet 38 - Bit 1)
          LE Periodic Advertising Terminate Sync (Octet 38 - Bit 2)
          LE Add Device To Periodic Advertiser List (Octet 38 - Bit 3)
          LE Remove Device From Periodic Advertiser List (Octet 38 - Bit 4)
          LE Clear Periodic Advertiser List (Octet 38 - Bit 5)
          LE Read Periodic Advertiser List Size (Octet 38 - Bit 6)
          LE Read Transmit Power (Octet 38 - Bit 7)
          LE Read RF Path Compensation (Octet 39 - Bit 0)
          LE Write RF Path Compensation (Octet 39 - Bit 1)
          LE Set Privacy Mode (Octet 39 - Bit 2)
          LE Periodic Advertising Receive Enable (Octet 40 - Bit 5)
          LE Periodic Advertising Sync Transfer (Octet 40 - Bit 6)
          LE Periodic Advertising Set Info Transfer (Octet 40 - Bit 7)
          LE Periodic Advertising Sync Transfer Parameters (Octet 41 - Bit 0)
          LE Set Default Periodic Advertisng Sync Transfer Parameters (Octet 41 - Bit 1)
          LE Read Buffer v2 (Octet 41 - Bit 5)
          LE Read ISO TX Sync (Octet 41 - Bit 6)
          LE Set Connected Isochronous Group Parameters (Octet 41 - Bit 7)
          LE Set Connected Isochronous Group Parameters Test (Octet 42 - Bit 0)
          LE Create Connected Isochronous Stream (Octet 42 - Bit 1)
          LE Remove Connected Isochronous Group (Octet 42 - Bit 2)
          LE Accept Connected Isochronous Stream Request (Octet 42 - Bit 3)
          LE Reject Connected Isochronous Stream Request (Octet 42 - Bit 4)
          LE Create Broadcast Isochronous Group (Octet 42 - Bit 5)
          LE Create Broadcast Isochronous Group Test (Octet 42 - Bit 6)
          LE Terminate Broadcast Isochronous Group (Octet 42 - Bit 7)
          LE Broadcast Isochronous Group Create Sync (Octet 43 - Bit 0)
          LE Broadcast Isochronous Group Terminate Sync (Octet 43 - Bit 1)
          LE Request Peer SCA (Octet 43 - Bit 2)
          LE Setup Isochronous Data Path (Octet 43 - Bit 3)
          LE Remove Isochronous Data Path (Octet 43 - Bit 4)
          LE Isochronous Transmit Test (Octet 43 - Bit 5)
          LE Isochronous Receive Test (Octet 43 - Bit 6)
          LE Isochronous Read Test Counters (Octet 43 - Bit 7)
          LE Isochronous Read Test Counters (Octet 44 - Bit 0)
          LE Set Host Feature (Octet 44 - Bit 1)
          LE Read ISO link quality (Octet 44 - Bit 2)
          Octet 45 - Bit 6 
          Octet 46 - Bit 0 
          Octet 46 - Bit 1 
          Octet 46 - Bit 2 
zephyr.exe[1604998]: < HCI Command: Host Buffer Size (0x03|0x0033) plen 7                                             #9 0.174680
        ACL MTU: 255  ACL max packet: 16
        SCO MTU: 0    SCO max packet: 0
> HCI Event: Command Complete (0x0e) plen 4                                                                          #10 0.175970
      Host Buffer Size (0x03|0x0033) ncmd 1
        Status: Success (0x00)
zephyr.exe[1604998]: < HCI Command: Set Controller To Host Flow Control (0x03|0x0031) plen 1                         #11 0.194680
        Flow control: ACL Data Packets (0x01)
> HCI Event: Command Complete (0x0e) plen 4                                                                          #12 0.195370
      Set Controller To Host Flow Control (0x03|0x0031) ncmd 1
        Status: Success (0x00)
zephyr.exe[1604998]: < HCI Command: LE Read Local Supported Features (0x08|0x0003) plen 0                            #13 0.214633
> HCI Event: Command Complete (0x0e) plen 12                                                                         #14 0.215320
      LE Read Local Supported Features (0x08|0x0003) ncmd 1
        Status: Success (0x00)
        Features: 0xfd 0x79 0x00 0xf7 0x30 0x01 0x00 0x00
          LE Encryption
          Extended Reject Indication
          Peripheral-initiated Features Exchange
          LE Ping
          LE Data Packet Length Extension
          LL Privacy
          Extended Scanner Filter Policies
          LE 2M PHY
          LE Coded PHY
          LE Extended Advertising
          LE Periodic Advertising
          Channel Selection Algorithm #2
          Periodic Advertising Sync Transfer - Sender
          Periodic Advertising Sync Transfer - Recipient
          Sleep Clock Accuracy Updates
          Connected Isochronous Stream - Central
          Connected Isochronous Stream - Peripheral
          Isochronous Broadcaster
          Synchronized Receiver
          Periodic Advertising ADI support
          Connection Subrating
          Unknown features (0x0000010000000000)
zephyr.exe[1604998]: < HCI Command: LE Set Host Feature (0x08|0x0074) plen 2                                         #15 0.234629
        Bit Number: 32
          Connected Isochronous Stream (Host Support)
        Bit Value: 1
> HCI Event: Command Complete (0x0e) plen 4                                                                          #16 0.235337
      LE Set Host Feature (0x08|0x0074) ncmd 1
        Status: Success (0x00)
zephyr.exe[1604998]: < HCI Command: LE Read Buffer v2 (0x08|0x0060) plen 0                                           #17 0.254627
> HCI Event: Command Complete (0x0e) plen 10                                                                         #18 0.255040
      LE Read Buffer v2 (0x08|0x0060) ncmd 1
        Status: Success (0x00)
        ACL MTU: 27
        ACL max packet: 3
        ISO MTU: 318
        ISO max packet: 3
zephyr.exe[1604998]: < HCI Command: LE Read Maximum Advertising Data Length (0x08|0x003a) plen 0                     #19 0.274645
> HCI Event: Command Complete (0x0e) plen 6                                                                          #20 0.275333
      LE Read Maximum Advertising Data Length (0x08|0x003a) ncmd 1
        Status: Success (0x00)
        Max length: 1650
zephyr.exe[1604998]: < HCI Command: LE Read Supported States (0x08|0x001c) plen 0                                    #21 0.294602
> HCI Event: Command Complete (0x0e) plen 12                                                                         #22 0.295174
      LE Read Supported States (0x08|0x001c) ncmd 1
        Status: Success (0x00)
        States: 0x000003ff3e0306ff
          Non-connectable Advertising State
          Scannable Advertising State
          Connectable Advertising State
          High Duty Cycle Directed Advertising State
          Passive Scanning State
          Active Scanning State
          Initiating State
            and Connection State (Central Role)
          Connection State (Peripheral Role)
          Scannable Advertising State
            and Passive Scanning State
          Connectable Advertising State
            and Passive Scanning State
          Non-connectable Advertising State
            and Initiating State
          Scannable Advertising State
            and Initiating State
          Active Scanning State
            and Connection State (Central Role)
          Passive Scanning State
            and Connection State (Peripheral Role)
          Active Scanning State
            and Connection State (Peripheral Role)
          Initiating State
            and Connection State (Central Role)
            and Central Role & Central Role
          Low Duty Cycle Directed Advertising State
          Connectable Advertising State
            and Initiating State
            and Central Role & Peripheral Role
          High Duty Cycle Directed Advertising State
            and Initiating State
            and Central Role & Peripheral Role
          Low Duty Cycle Directed Advertising State
            and Initiating State
            and Central Role & Peripheral Role
          Connectable Advertising State
            and Connection State (Central Role)
            and Central Role & Peripheral Role
          High Duty Cycle Directed Advertising State
            and Connection State (Central Role)
            and Central Role & Peripheral Role
          Low Duty Cycle Directed Advertising State
            and Connection State (Central Role)
            and Central Role & Peripheral Role
          Connectable Advertising State
            and Connection State (Peripheral Role)
            and Central Role & Peripheral Role
          High Duty Cycle Directed Advertising State
            and Connection State (Peripheral Role)
            and Peripheral Role & Peripheral Role
          Low Duty Cycle Directed Advertising State
            and Connection State (Peripheral Role)
            and Peripheral Role & Peripheral Role
          Initiating State
            and Connection State (Peripheral Role)
            and Central Role & Peripheral Role
zephyr.exe[1604998]: < HCI Command: LE Read Maximum Data Length (0x08|0x002f) plen 0                                 #23 0.314586
> HCI Event: Command Complete (0x0e) plen 12                                                                         #24 0.315677
      LE Read Maximum Data Length (0x08|0x002f) ncmd 1
        Status: Success (0x00)
        Max TX octets: 251
        Max TX time: 2704
        Max RX octets: 251
        Max RX time: 2704
zephyr.exe[1604998]: < HCI Command: LE Write Suggested Default Data Length (0x08|0x0024) plen 4                      #25 0.334605
        TX octets: 251
        TX time: 2704
> HCI Event: Command Complete (0x0e) plen 4                                                                          #26 0.335422
      LE Write Suggested Default Data Length (0x08|0x0024) ncmd 1
        Status: Success (0x00)
zephyr.exe[1604998]: < HCI Command: LE Read Resolving List Size (0x08|0x002a) plen 0                                 #27 0.354589
> HCI Event: Command Complete (0x0e) plen 5                                                                          #28 0.355246
      LE Read Resolving List Size (0x08|0x002a) ncmd 1
        Status: Success (0x00)
        Size: 8
zephyr.exe[1604998]: < HCI Command: LE Set Event Mask (0x08|0x0001) plen 8                                           #29 0.374639
        Mask: 0x000002023f87fa5e
          LE Advertising Report
          LE Connection Update Complete
          LE Read Remote Used Features Complete
          LE Long Term Key Request
          LE Data Length Change
          LE Enhanced Connection Complete
          LE PHY Update Complete
          LE Extended Advertising Report
          LE Periodic Advertising Sync Established
          LE Periodic Advertising Report
          LE Periodic Advertising Sync Lost
          LE Extended Scan Timeout
          LE Extended Advertising Set Terminated
          LE Scan Request Received
          LE Periodic Advertising Sync Transfer Rvc
          LE CIS Established
          LE CIS Request
          LE Create BIG Complete
          LE Terminate BIG Complete
          LE BIG Sync Established Complete
          LE BIG Sync Lost
          LE BIG Info Advertising Report
          Unknown mask (0x0000020000000000)
> HCI Event: Command Complete (0x0e) plen 4                                                                          #30 0.375296
      LE Set Event Mask (0x08|0x0001) ncmd 1
        Status: Success (0x00)
zephyr.exe[1604998]: < HCI Command: Set Event Mask (0x03|0x0001) plen 8                                              #31 0.394593
        Mask: 0x2000800002008890
          Disconnection Complete
          Encryption Change
          Read Remote Version Information Complete
          Hardware Error
          Data Buffer Overflow
          Encryption Key Refresh Complete
          LE Meta
> HCI Event: Command Complete (0x0e) plen 4                                                                          #32 0.395356
      Set Event Mask (0x03|0x0001) ncmd 1
        Status: Success (0x00)
zephyr.exe[1604998]: < HCI Command: Read BD ADDR (0x04|0x0009) plen 0                                                #33 0.414590
> HCI Event: Command Complete (0x0e) plen 10                                                                         #34 0.415145
      Read BD ADDR (0x04|0x0009) ncmd 1
        Status: Success (0x00)
        Address: 00:00:00:00:00:00 (OUI 00-00-00)
zephyr.exe[1604998]: < HCI Command: LE Set Random Address (0x08|0x0005) plen 6                                       #35 0.434634
        Address: D5:B6:CC:31:DB:3B (Static)
> HCI Event: Command Complete (0x0e) plen 4                                                                          #36 0.435345
      LE Set Random Address (0x08|0x0005) ncmd 1
        Status: Success (0x00)
zephyr.exe[1604998]: < HCI Command: LE Set Extended Advertising Parameters (0x08|0x0036) plen 25                     #37 1.054703
        Handle: 0x00
        Properties: 0x0001
          Connectable
        Min advertising interval: 100.000 msec (0x00a0)
        Max advertising interval: 150.000 msec (0x00f0)
        Channel map: 37, 38, 39 (0x07)
        Own address type: Random (0x01)
        Peer address type: Public (0x00)
        Peer address: 00:00:00:00:00:00 (OUI 00-00-00)
        Filter policy: Allow Scan Request from Any, Allow Connect Request from Any (0x00)
        TX power: Host has no preference (0x7f)
        Primary PHY: LE 1M (0x01)
        Secondary max skip: 0x00
        Secondary PHY: LE 2M (0x02)
        SID: 0x00
        Scan request notifications: Disabled (0x00)
> HCI Event: Command Complete (0x0e) plen 5                                                                          #38 1.055602
      LE Set Extended Advertising Parameters (0x08|0x0036) ncmd 1
        Status: Success (0x00)
        TX power (selected): 0 dbm (0x00)
zephyr.exe[1604998]: < HCI Command: LE Set Advertising Set Random Address (0x08|0x0035) plen 7                       #39 1.074648
        Advertising handle: 0x00
        Advertising random address: D5:B6:CC:31:DB:3B (Static)
> HCI Event: Command Complete (0x0e) plen 4                                                                          #40 1.075505
      LE Set Advertising Set Random Address (0x08|0x0035) ncmd 1
        Status: Success (0x00)
zephyr.exe[1604998]: < HCI Command: LE Set Extended Advertising Data (0x08|0x0037) plen 39                           #41 1.094646
        Handle: 0x00
        Operation: Complete extended advertising data (0x03)
        Fragment preference: Minimize fragmentation (0x01)
        Data length: 0x23
        Flags: 0x06
          LE General Discoverable Mode
          BR/EDR Not Supported
        Name (complete): Tester_F6B11A
        Flags: 0x06
          LE General Discoverable Mode
          BR/EDR Not Supported
        16-bit Service UUIDs (complete): 1 entry
          Audio Stream Control (0x184e)
        Service Data: Audio Stream Control (0x184e)
          Data[6]: 01ff0fff0f00
> HCI Event: Command Complete (0x0e) plen 4                                                                          #42 1.096183
      LE Set Extended Advertising Data (0x08|0x0037) ncmd 1
        Status: Success (0x00)
zephyr.exe[1604998]: < HCI Command: LE Set Extended Advertising Enable (0x08|0x0039) plen 6                          #43 1.114647
        Extended advertising: Enabled (0x01)
        Number of sets: 1 (0x01)
        Entry 0
          Handle: 0x00
          Duration: 0 ms (0x00)
          Max ext adv events: 0
> HCI Event: Command Complete (0x0e) plen 4                                                                          #44 1.115425
      LE Set Extended Advertising Enable (0x08|0x0039) ncmd 1
        Status: Success (0x00)
> HCI Event: LE Meta Event (0x3e) plen 31                                                                            #45 2.797953
      LE Enhanced Connection Complete (0x0a)
        Status: Success (0x00)
        Handle: 75
        Role: Peripheral (0x01)
        Peer address type: Public (0x00)
        Peer address: DF:A9:FF:F6:B1:1A (OUI DF-A9-FF)
        Local resolvable private address: 00:00:00:00:00:00 (Non-Resolvable)
        Peer resolvable private address: 00:00:00:00:00:00 (Non-Resolvable)
        Connection interval: 60.00 msec (0x0030)
        Connection latency: 0 (0x0000)
        Supervision timeout: 25120 msec (0x09d0)
        Central clock accuracy: 0x01
> HCI Event: LE Meta Event (0x3e) plen 6                                                                             #46 2.797961
      LE Advertising Set Terminated (0x12)
        Status: Success (0x00)
        Handle: 0
        Connection handle: 75
        Number of completed extended advertising events: 0
zephyr.exe[1604998]: < HCI Command: LE Read Remote Used Features (0x08|0x0016) plen 2                                #47 2.814915
        Handle: 75 Address: DF:A9:FF:F6:B1:1A (OUI DF-A9-FF)
> HCI Event: Command Status (0x0f) plen 4                                                                            #48 2.815507
      LE Read Remote Used Features (0x08|0x0016) ncmd 1
        Status: Success (0x00)
zephyr.exe[1604998]: < ACL Data TX: Handle 75 [1/3] flags 0x00 dlen 7                                                #49 2.834753
      ATT: Exchange MTU Request (0x02) len 2
        Client RX MTU: 251
> HCI Event: Number of Completed Packets (0x13) plen 5                                                               #50 2.920090
        Num handles: 1
        Handle: 75 Address: DF:A9:FF:F6:B1:1A (OUI DF-A9-FF)
        Count: 1
        Buffers: 0/3
        #49: len 7 (0 Kb/s)
        Latency: 85 msec (85-85 msec ~85 msec)
> HCI Event: LE Meta Event (0x3e) plen 12                                                                            #51 2.980511
      LE Read Remote Used Features (0x04)
        Status: Success (0x00)
        Handle: 75 Address: DF:A9:FF:F6:B1:1A (OUI DF-A9-FF)
        Features: 0x2d 0x49 0x00 0xf7 0x67 0xd8 0x00 0x00
          LE Encryption
          Extended Reject Indication
          Peripheral-initiated Features Exchange
          LE Data Packet Length Extension
          LE 2M PHY
          LE Coded PHY
          Channel Selection Algorithm #2
          Periodic Advertising Sync Transfer - Sender
          Periodic Advertising Sync Transfer - Recipient
          Sleep Clock Accuracy Updates
          Connected Isochronous Stream - Central
          Connected Isochronous Stream - Peripheral
          Isochronous Broadcaster
          Synchronized Receiver
          Connected Isochronous Stream (Host Support)
          LE Power Control Request
          LE Power Control Request
          Connection Subrating
          Connection Subrating (Host Support)
          Unknown features (0x0000d80000000000)
zephyr.exe[1604998]: < HCI Command: LE Remove Advertising Set (0x08|0x003c) plen 1                                   #52 3.214794
        Handle: 0
> HCI Event: Command Complete (0x0e) plen 4                                                                          #53 3.215545
      LE Remove Advertising Set (0x08|0x003c) ncmd 1
        Status: Success (0x00)
zephyr.exe[1604998]: < HCI Command: LE Set Extended Advertising Parameters (0x08|0x0036) plen 25                     #54 3.234632
        Handle: 0x00
        Properties: 0x0001
          Connectable
        Min advertising interval: 100.000 msec (0x00a0)
        Max advertising interval: 150.000 msec (0x00f0)
        Channel map: 37, 38, 39 (0x07)
        Own address type: Random (0x01)
        Peer address type: Public (0x00)
        Peer address: 00:00:00:00:00:00 (OUI 00-00-00)
        Filter policy: Allow Scan Request from Any, Allow Connect Request from Any (0x00)
        TX power: Host has no preference (0x7f)
        Primary PHY: LE 1M (0x01)
        Secondary max skip: 0x00
        Secondary PHY: LE 2M (0x02)
        SID: 0x01
        Scan request notifications: Disabled (0x00)
> HCI Event: Command Complete (0x0e) plen 5                                                                          #55 3.235776
      LE Set Extended Advertising Parameters (0x08|0x0036) ncmd 1
        Status: Success (0x00)
        TX power (selected): 0 dbm (0x00)
zephyr.exe[1604998]: < HCI Command: LE Set Advertising Set Random Address (0x08|0x0035) plen 7                       #56 3.254656
        Advertising handle: 0x00
        Advertising random address: D5:B6:CC:31:DB:3B (Static)
> HCI Event: Command Complete (0x0e) plen 4                                                                          #57 3.255493
      LE Set Advertising Set Random Address (0x08|0x0035) ncmd 1
        Status: Success (0x00)
zephyr.exe[1604998]: < HCI Command: LE Set Extended Advertising Data (0x08|0x0037) plen 39                           #58 3.274627
        Handle: 0x00
        Operation: Complete extended advertising data (0x03)
        Fragment preference: Minimize fragmentation (0x01)
        Data length: 0x23
        Flags: 0x06
          LE General Discoverable Mode
          BR/EDR Not Supported
        Name (complete): Tester_F6B11A
        Flags: 0x06
          LE General Discoverable Mode
          BR/EDR Not Supported
        16-bit Service UUIDs (complete): 1 entry
          Audio Stream Control (0x184e)
        Service Data: Audio Stream Control (0x184e)
          Data[6]: 01ff0fff0f00
> HCI Event: Command Complete (0x0e) plen 4                                                                          #59 3.275644
      LE Set Extended Advertising Data (0x08|0x0037) ncmd 1
        Status: Success (0x00)
> ACL Data RX: Handle 75 flags 0x02 dlen 7                                                                           #60 3.280442
      ATT: Exchange MTU Request (0x02) len 2
        Client RX MTU: 64
> ACL Data RX: Handle 75 flags 0x02 dlen 7                                                                           #61 3.280566
      ATT: Exchange MTU Response (0x03) len 2
        Server RX MTU: 64
zephyr.exe[1604998]: < HCI Command: LE Set Extended Advertising Enable (0x08|0x0039) plen 6                          #62 3.294756
        Extended advertising: Enabled (0x01)
        Number of sets: 1 (0x01)
        Entry 0
          Handle: 0x00
          Duration: 0 ms (0x00)
          Max ext adv events: 0
zephyr.exe[1604998]: < HCI Command: Host Number of Completed Packets (0x03|0x0035) plen 5                            #63 3.294762
        Num handles: 1
        Handle: 75 Address: DF:A9:FF:F6:B1:1A (OUI DF-A9-FF)
        Count: 1
zephyr.exe[1604998]: < ACL Data TX: Handle 75 [1/3] flags 0x00 dlen 7                                                #64 3.294862
      ATT: Exchange MTU Response (0x03) len 2
        Server RX MTU: 251
zephyr.exe[1604998]: < HCI Command: Host Number of Completed Packets (0x03|0x0035) plen 5                            #65 3.294865
        Num handles: 1
        Handle: 75 Address: DF:A9:FF:F6:B1:1A (OUI DF-A9-FF)
        Count: 1
> HCI Event: Command Complete (0x0e) plen 4                                                                          #66 3.295956
      LE Set Extended Advertising Enable (0x08|0x0039) ncmd 1
        Status: Success (0x00)
> HCI Event: Number of Completed Packets (0x13) plen 5                                                               #67 3.399898
        Num handles: 1
        Handle: 75 Address: DF:A9:FF:F6:B1:1A (OUI DF-A9-FF)
        Count: 1
        Buffers: 0/3
        #64: len 7 (0 Kb/s)
        Latency: 105 msec (85-105 msec ~95 msec)
> ACL Data RX: Handle 75 flags 0x02 dlen 11                                                                          #68 5.380097
      SMP: Pairing Request (0x01) len 6
        IO capability: KeyboardDisplay (0x04)
        OOB data: Authentication data not present (0x00)
        Authentication requirement: Bonding, No MITM, SC, No Keypresses (0x09)
        Max encryption key size: 16
        Initiator key distribution: EncKey IdKey (0x03)
        Responder key distribution: EncKey IdKey Sign (0x07)
zephyr.exe[1604998]: < HCI Command: Host Number of Completed Packets (0x03|0x0035) plen 5                            #69 5.394759
        Num handles: 1
        Handle: 75 Address: DF:A9:FF:F6:B1:1A (OUI DF-A9-FF)
        Count: 1
zephyr.exe[1604998]: < ACL Data TX: Handle 75 [1/3] flags 0x00 dlen 11                                               #70 5.394774
      SMP: Pairing Response (0x02) len 6
        IO capability: NoInputNoOutput (0x03)
        OOB data: Authentication data not present (0x00)
        Authentication requirement: Bonding, No MITM, SC, No Keypresses (0x09)
        Max encryption key size: 16
        Initiator key distribution: IdKey (0x02)
        Responder key distribution: Sign (0x04)
> HCI Event: Number of Completed Packets (0x13) plen 5                                                               #71 5.500005
        Num handles: 1
        Handle: 75 Address: DF:A9:FF:F6:B1:1A (OUI DF-A9-FF)
        Count: 1
        Buffers: 0/3
        #70: len 11 (0 Kb/s)
        Latency: 105 msec (85-105 msec ~100 msec)
> ACL Data RX: Handle 75 flags 0x02 dlen 27                                                                          #72 5.500302
> ACL Data RX: Handle 75 flags 0x01 dlen 27                                                                          #73 5.500744
> ACL Data RX: Handle 75 flags 0x01 dlen 15                                                                          #74 5.501147
      SMP: Pairing Public Key (0x0c) len 64
        X[32]: f8e77de71a7791dd3ca05c2060dcd428bea02328bc58b9991a6a5db9c9ad603c
        Y[32]: 6aa4a9c4dd0071537ebc35e42b622d0f8496a0e5a6dfd979aca69b9483e07fc8
zephyr.exe[1604998]: < HCI Command: Host Number of Completed Packets (0x03|0x0035) plen 5                            #75 5.514837
        Num handles: 1
        Handle: 75 Address: DF:A9:FF:F6:B1:1A (OUI DF-A9-FF)
        Count: 1
zephyr.exe[1604998]: < HCI Command: Host Number of Completed Packets (0x03|0x0035) plen 5                            #76 5.514961
        Num handles: 1
        Handle: 75 Address: DF:A9:FF:F6:B1:1A (OUI DF-A9-FF)
        Count: 1
zephyr.exe[1604998]: < HCI Command: Host Number of Completed Packets (0x03|0x0035) plen 5                            #77 5.515000
        Num handles: 1
        Handle: 75 Address: DF:A9:FF:F6:B1:1A (OUI DF-A9-FF)
        Count: 1
zephyr.exe[1604998]: < ACL Data TX: Handle 75 [1/3] flags 0x00 dlen 27                                               #78 5.515041
zephyr.exe[1604998]: < ACL Data TX: Handle 75 flags 0x01 dlen 27                                                     #79 5.515083
zephyr.exe[1604998]: < ACL Data TX: Handle 75 flags 0x01 dlen 15                                                     #80 5.515087
      SMP: Pairing Public Key (0x0c) len 64
        X[32]: 98308440221e2d910f0e54b71e7ec652857aa9b5a0dc65028824cc19db1226e9
        Y[32]: 67a4816bcb62efb21701e31fdb27561a6217575fb007a8bbdabe7e28b6f68482
> HCI Event: Number of Completed Packets (0x13) plen 5                                                               #81 5.560291
        Num handles: 1
        Handle: 75 Address: DF:A9:FF:F6:B1:1A (OUI DF-A9-FF)
        Count: 1
        Buffers: 0/3
        #78: len 27 (4 Kb/s)
        Latency: 45 msec (45-105 msec ~72 msec)
> HCI Event: Number of Completed Packets (0x13) plen 5                                                               #82 5.560914
        Num handles: 1
        Handle: 75 Address: DF:A9:FF:F6:B1:1A (OUI DF-A9-FF)
        Count: 1
        Buffers: underflow/3
        #79: len 27 (4 Kb/s)
        Latency: 45 msec (45-105 msec ~59 msec)
zephyr.exe[1604998]: < ACL Data TX: Handle 75 [1/3] flags 0x00 dlen 21                                               #83 5.574725
      SMP: Pairing Confirm (0x03) len 16
        Confirm value[16]: 35a7d32237dbab2fb461398aab8c33fa
> HCI Event: Number of Completed Packets (0x13) plen 5                                                               #84 5.619784
        Num handles: 1
        Handle: 75 Address: DF:A9:FF:F6:B1:1A (OUI DF-A9-FF)
        Count: 1
        Buffers: 0/3
        #80: len 15 (1 Kb/s)
        Latency: 104 msec (45-105 msec ~81 msec)
> HCI Event: Number of Completed Packets (0x13) plen 5                                                               #85 5.680154
        Num handles: 1
        Handle: 75 Address: DF:A9:FF:F6:B1:1A (OUI DF-A9-FF)
        Count: 1
        Buffers: underflow/3
        #83: len 21 (1 Kb/s)
        Latency: 105 msec (45-105 msec ~93 msec)
> ACL Data RX: Handle 75 flags 0x02 dlen 21                                                                          #86 5.680239
      SMP: Pairing Random (0x04) len 16
        Random value[16]: 0737e81f067a3eac0000000000000000
zephyr.exe[1604998]: < HCI Command: Host Number of Completed Packets (0x03|0x0035) plen 5                            #87 5.694763
        Num handles: 1
        Handle: 75 Address: DF:A9:FF:F6:B1:1A (OUI DF-A9-FF)
        Count: 1
zephyr.exe[1604998]: < ACL Data TX: Handle 75 [1/3] flags 0x00 dlen 21                                               #88 5.694769
      SMP: Pairing Random (0x04) len 16
        Random value[16]: 8e6108f966a694cbe26df70bb96773e6
> HCI Event: Number of Completed Packets (0x13) plen 5                                                               #89 5.799923
        Num handles: 1
        Handle: 75 Address: DF:A9:FF:F6:B1:1A (OUI DF-A9-FF)
        Count: 1
        Buffers: 0/3
        #88: len 21 (1 Kb/s)
        Latency: 105 msec (45-105 msec ~99 msec)
> ACL Data RX: Handle 75 flags 0x02 dlen 21                                                                          #90 5.980116
      SMP: Pairing DHKey Check (0x0d) len 16
        E[16]: 5e4684acb0af335ed3587d17780d4fc6
zephyr.exe[1604998]: < HCI Command: Host Number of Completed Packets (0x03|0x0035) plen 5                            #91 5.994906
        Num handles: 1
        Handle: 75 Address: DF:A9:FF:F6:B1:1A (OUI DF-A9-FF)
        Count: 1
zephyr.exe[1604998]: < ACL Data TX: Handle 75 [1/3] flags 0x00 dlen 21                                               #92 5.994978
      SMP: Pairing DHKey Check (0x0d) len 16
        E[16]: d43193947a9b3cd8b3aaa00f4ca2b106
> HCI Event: Number of Completed Packets (0x13) plen 5                                                               #93 6.099877
        Num handles: 1
        Handle: 75 Address: DF:A9:FF:F6:B1:1A (OUI DF-A9-FF)
        Count: 1
        Buffers: 0/3
        #92: len 21 (1 Kb/s)
        Latency: 104 msec (45-105 msec ~102 msec)
> HCI Event: LE Meta Event (0x3e) plen 13                                                                            #94 6.160223
      LE Long Term Key Request (0x05)
        Handle: 75 Address: DF:A9:FF:F6:B1:1A (OUI DF-A9-FF)
        Random number: 0x0000000000000000
        Encrypted diversifier: 0x0000
zephyr.exe[1604998]: < HCI Command: LE Long Term Key Request Reply (0x08|0x001a) plen 18                             #95 6.174793
        Handle: 75 Address: DF:A9:FF:F6:B1:1A (OUI DF-A9-FF)
        Long term key[16]: e2741199890911a997b9ad65daa6168e
> HCI Event: Command Complete (0x0e) plen 6                                                                          #96 6.175766
      LE Long Term Key Request Reply (0x08|0x001a) ncmd 1
        Status: Success (0x00)
        Handle: 75 Address: DF:A9:FF:F6:B1:1A (OUI DF-A9-FF)
> HCI Event: Encryption Change (0x08) plen 4                                                                         #97 6.460261
        Status: Success (0x00)
        Handle: 75 Address: DF:A9:FF:F6:B1:1A (OUI DF-A9-FF)
        Encryption: Enabled with AES-CCM (0x01)
zephyr.exe[1604998]: < ACL Data TX: Handle 75 [1/3] flags 0x00 dlen 21                                               #98 6.584879
      SMP: Signing Information (0x0a) len 16
        Signature key[16]: 5da095555cc64d02679f89a05211af56
> HCI Event: Number of Completed Packets (0x13) plen 5                                                               #99 6.700045
        Num handles: 1
        Handle: 75 Address: DF:A9:FF:F6:B1:1A (OUI DF-A9-FF)
        Count: 1
        Buffers: 0/3
        #98: len 21 (1 Kb/s)
        Latency: 115 msec (45-115 msec ~108 msec)
> ACL Data RX: Handle 75 flags 0x02 dlen 21                                                                         #100 6.700080
      SMP: Identity Information (0x08) len 16
        Identity resolving key[16]: c8238e87e324d12de09e5024dd45c3d6
> ACL Data RX: Handle 75 flags 0x02 dlen 12                                                                         #101 6.700477
      SMP: Identity Address Information (0x09) len 7
        Address: DF:A9:FF:F6:B1:1A (OUI DF-A9-FF)
zephyr.exe[1604998]: < HCI Command: Host Number of Completed Packets (0x03|0x0035) plen 5                           #102 6.714887
        Num handles: 1
        Handle: 75 Address: DF:A9:FF:F6:B1:1A (OUI DF-A9-FF)
        Count: 1
zephyr.exe[1604998]: < HCI Command: LE Set Extended Advertising Enable (0x08|0x0039) plen 6                         #103 6.714986
        Extended advertising: Disabled (0x00)
        Number of sets: 1 (0x01)
        Entry 0
          Handle: 0x00
          Duration: 0 ms (0x00)
          Max ext adv events: 0
> HCI Event: Command Complete (0x0e) plen 4                                                                         #104 6.715693
      LE Set Extended Advertising Enable (0x08|0x0039) ncmd 1
        Status: Success (0x00)
zephyr.exe[1604998]: < HCI Command: LE Add Device To Resolving List (0x08|0x0027) plen 39                           #105 6.734817
        Address type: Public (0x00)
        Address: DF:A9:FF:F6:B1:1A (OUI DF-A9-FF)
        Peer identity resolving key[16]: c8238e87e324d12de09e5024dd45c3d6
        Local identity resolving key[16]: 00000000000000000000000000000000
> HCI Event: Command Complete (0x0e) plen 4                                                                         #106 6.735986
      LE Add Device To Resolving List (0x08|0x0027) ncmd 1
        Status: Success (0x00)
zephyr.exe[1604998]: < HCI Command: LE Set Privacy Mode (0x08|0x004e) plen 8                                        #107 6.754831
        Peer Identity address type: Public (0x00)
        Peer Identity address: DF:A9:FF:F6:B1:1A (OUI DF-A9-FF)
        Privacy Mode: Use Device Privacy (0x01)
> HCI Event: Command Complete (0x0e) plen 4                                                                         #108 6.756182
      LE Set Privacy Mode (0x08|0x004e) ncmd 1
        Status: Success (0x00)
zephyr.exe[1604998]: < HCI Command: LE Set Address Resolution Enable (0x08|0x002d) plen 1                           #109 6.774885
        Address resolution: Enabled (0x01)
> HCI Event: Command Complete (0x0e) plen 4                                                                         #110 6.776155
      LE Set Address Resolution Enable (0x08|0x002d) ncmd 1
        Status: Success (0x00)
zephyr.exe[1604998]: < HCI Command: LE Set Extended Advertising Enable (0x08|0x0039) plen 6                         #111 6.794834
        Extended advertising: Enabled (0x01)
        Number of sets: 1 (0x01)
        Entry 0
          Handle: 0x00
          Duration: 0 ms (0x00)
          Max ext adv events: 0
> HCI Event: Command Complete (0x0e) plen 4                                                                         #112 6.796489
      LE Set Extended Advertising Enable (0x08|0x0039) ncmd 1
        Status: Success (0x00)
zephyr.exe[1604998]: < HCI Command: Host Number of Completed Packets (0x03|0x0035) plen 5                           #113 6.814790
        Num handles: 1
        Handle: 75 Address: DF:A9:FF:F6:B1:1A (OUI DF-A9-FF)
        Count: 1
> ACL Data RX: Handle 75 flags 0x02 dlen 13                                                                         #114 6.879890
      ATT: Find By Type Value Request (0x06) len 8
        Handle range: 0x0001-0xffff
        Attribute type: Primary Service (0x2800)
          UUID: Broadcast Audio Scan (0x184f)
zephyr.exe[1604998]: < HCI Command: Host Number of Completed Packets (0x03|0x0035) plen 5                           #115 6.894769
        Num handles: 1
        Handle: 75 Address: DF:A9:FF:F6:B1:1A (OUI DF-A9-FF)
        Count: 1
zephyr.exe[1604998]: < ACL Data TX: Handle 75 [1/3] flags 0x00 dlen 9                                               #116 6.894849
      ATT: Find By Type Value Response (0x07) len 4
        Handle range: 0x0047-0x004c
> HCI Event: Number of Completed Packets (0x13) plen 5                                                              #117 6.999967
        Num handles: 1
        Handle: 75 Address: DF:A9:FF:F6:B1:1A (OUI DF-A9-FF)
        Count: 1
        Buffers: 0/3
        #116: len 9 (0 Kb/s)
        Latency: 105 msec (45-115 msec ~106 msec)
> ACL Data RX: Handle 75 flags 0x02 dlen 13                                                                         #118 7.000015
      ATT: Find By Type Value Request (0x06) len 8
        Handle range: 0x004d-0xffff
        Attribute type: Primary Service (0x2800)
          UUID: Broadcast Audio Scan (0x184f)
zephyr.exe[1604998]: < HCI Command: Host Number of Completed Packets (0x03|0x0035) plen 5                           #119 7.014877
        Num handles: 1
        Handle: 75 Address: DF:A9:FF:F6:B1:1A (OUI DF-A9-FF)
        Count: 1
zephyr.exe[1604998]: < ACL Data TX: Handle 75 [1/3] flags 0x00 dlen 9                                               #120 7.014923
      ATT: Error Response (0x01) len 4
        Find By Type Value Request (0x06)
        Handle: 0x004d
        Error: Attribute Not Found (0x0a)
> HCI Event: Number of Completed Packets (0x13) plen 5                                                              #121 7.120016
        Num handles: 1
        Handle: 75 Address: DF:A9:FF:F6:B1:1A (OUI DF-A9-FF)
        Count: 1
        Buffers: 0/3
        #120: len 9 (0 Kb/s)
        Latency: 105 msec (45-115 msec ~105 msec)
> ACL Data RX: Handle 75 flags 0x02 dlen 11                                                                         #122 7.120018
      ATT: Read By Type Request (0x08) len 6
        Handle range: 0x0047-0x004c
        Attribute type: Characteristic (0x2803)
zephyr.exe[1604998]: < HCI Command: Host Number of Completed Packets (0x03|0x0035) plen 5                           #123 7.134922
        Num handles: 1
        Handle: 75 Address: DF:A9:FF:F6:B1:1A (OUI DF-A9-FF)
        Count: 1
zephyr.exe[1604998]: < ACL Data TX: Handle 75 [1/3] flags 0x00 dlen 20                                              #124 7.134945
      ATT: Read By Type Response (0x09) len 15
        Attribute data length: 7
        Attribute data list: 2 entries
        Handle: 0x0048
        Value[5]: 0c4900c72b
            Properties: 0x0c
              Write Without Response (0x04)
              Write (0x08)
            Value Handle: 0x0049
            Value UUID: Broadcast Audio Scan Control Point (0x2bc7)
        Handle: 0x004a
        Value[5]: 124b00c82b
            Properties: 0x12
              Read (0x02)
              Notify (0x10)
            Value Handle: 0x004b
            Value UUID: Broadcast Receive State (0x2bc8)
> HCI Event: Number of Completed Packets (0x13) plen 5                                                              #125 7.239888
        Num handles: 1
        Handle: 75 Address: DF:A9:FF:F6:B1:1A (OUI DF-A9-FF)
        Count: 1
        Buffers: 0/3
        #124: len 20 (1 Kb/s)
        Latency: 104 msec (45-115 msec ~105 msec)
> ACL Data RX: Handle 75 flags 0x02 dlen 11                                                                         #126 7.239943
      ATT: Read By Type Request (0x08) len 6
        Handle range: 0x004b-0x004c
        Attribute type: Characteristic (0x2803)
zephyr.exe[1604998]: < HCI Command: Host Number of Completed Packets (0x03|0x0035) plen 5                           #127 7.254909
        Num handles: 1
        Handle: 75 Address: DF:A9:FF:F6:B1:1A (OUI DF-A9-FF)
        Count: 1
zephyr.exe[1604998]: < ACL Data TX: Handle 75 [1/3] flags 0x00 dlen 9                                               #128 7.254933
      ATT: Error Response (0x01) len 4
        Read By Type Request (0x08)
        Handle: 0x004b
        Error: Attribute Not Found (0x0a)
> HCI Event: Number of Completed Packets (0x13) plen 5                                                              #129 7.359837
        Num handles: 1
        Handle: 75 Address: DF:A9:FF:F6:B1:1A (OUI DF-A9-FF)
        Count: 1
        Buffers: 0/3
        #128: len 9 (0 Kb/s)
        Latency: 104 msec (45-115 msec ~105 msec)
> ACL Data RX: Handle 75 flags 0x02 dlen 9                                                                          #130 7.360089
      ATT: Find Information Request (0x04) len 4
        Handle range: 0x004c-0x004c
zephyr.exe[1604998]: < HCI Command: Host Number of Completed Packets (0x03|0x0035) plen 5                           #131 7.374903
        Num handles: 1
        Handle: 75 Address: DF:A9:FF:F6:B1:1A (OUI DF-A9-FF)
        Count: 1
zephyr.exe[1604998]: < ACL Data TX: Handle 75 [1/3] flags 0x00 dlen 10                                              #132 7.374926
      ATT: Find Information Response (0x05) len 5
        Format: UUID-16 (0x01)
        Handle: 0x004c
        UUID: Client Characteristic Configuration (0x2902)
> HCI Event: Number of Completed Packets (0x13) plen 5                                                              #133 7.479932
        Num handles: 1
        Handle: 75 Address: DF:A9:FF:F6:B1:1A (OUI DF-A9-FF)
        Count: 1
        Buffers: 0/3
        #132: len 10 (0 Kb/s)
        Latency: 105 msec (45-115 msec ~105 msec)
> ACL Data RX: Handle 75 flags 0x02 dlen 9                                                                          #134 7.479942
      ATT: Write Request (0x12) len 4
        Handle: 0x004c
          Data[2]: 0000
zephyr.exe[1604998]: < HCI Command: Host Number of Completed Packets (0x03|0x0035) plen 5                           #135 7.494771
        Num handles: 1
        Handle: 75 Address: DF:A9:FF:F6:B1:1A (OUI DF-A9-FF)
        Count: 1
zephyr.exe[1604998]: < ACL Data TX: Handle 75 [1/3] flags 0x00 dlen 5                                               #136 7.494847
      ATT: Write Response (0x13) len 0
> HCI Event: Number of Completed Packets (0x13) plen 5                                                              #137 7.599971
        Num handles: 1
        Handle: 75 Address: DF:A9:FF:F6:B1:1A (OUI DF-A9-FF)
        Count: 1
        Buffers: 0/3
        #136: len 5 (0 Kb/s)
        Latency: 105 msec (45-115 msec ~105 msec)
> ACL Data RX: Handle 75 flags 0x02 dlen 9                                                                          #138 7.600074
      ATT: Write Request (0x12) len 4
        Handle: 0x004c
          Data[2]: 0100
zephyr.exe[1604998]: < HCI Command: Host Number of Completed Packets (0x03|0x0035) plen 5                           #139 7.614880
        Num handles: 1
        Handle: 75 Address: DF:A9:FF:F6:B1:1A (OUI DF-A9-FF)
        Count: 1
zephyr.exe[1604998]: < ACL Data TX: Handle 75 [1/3] flags 0x00 dlen 5                                               #140 7.614932
      ATT: Write Response (0x13) len 0
> HCI Event: Number of Completed Packets (0x13) plen 5                                                              #141 7.720297
        Num handles: 1
        Handle: 75 Address: DF:A9:FF:F6:B1:1A (OUI DF-A9-FF)
        Count: 1
        Buffers: 0/3
        #140: len 5 (0 Kb/s)
        Latency: 105 msec (45-115 msec ~105 msec)
zephyr.exe[1604998]: < HCI Command: LE Set Random Address (0x08|0x0005) plen 6                                      #142 8.364723
        Address: 04:C8:1E:D2:64:DA (Non-Resolvable)
> HCI Event: Command Complete (0x0e) plen 4                                                                         #143 8.365405
      LE Set Random Address (0x08|0x0005) ncmd 1
        Status: Success (0x00)
zephyr.exe[1604998]: < HCI Command: LE Set Extended Scan Parameters (0x08|0x0041) plen 8                            #144 8.374763
        Own address type: Random (0x01)
        Filter policy: Accept all advertisement (0x00)
        PHYs: 0x01
        Entry 0: LE 1M
          Type: Active (0x01)
          Interval: 60.000 msec (0x0060)
          Window: 30.000 msec (0x0030)
> HCI Event: Command Complete (0x0e) plen 4                                                                         #145 8.376034
      LE Set Extended Scan Parameters (0x08|0x0041) ncmd 1
        Status: Success (0x00)
zephyr.exe[1604998]: < HCI Command: LE Set Extended Scan Enable (0x08|0x0042) plen 6                                #146 8.394719
        Extended scan: Enabled (0x01)
        Filter duplicates: Enabled (0x01)
        Duration: 0 msec (0x0000)
        Period: 0.00 sec (0x0000)
> HCI Event: Command Complete (0x0e) plen 4                                                                         #147 8.395513
      LE Set Extended Scan Enable (0x08|0x0042) ncmd 1
        Status: Success (0x00)
> HCI Event: LE Meta Event (0x3e) plen 48                                                                           #148 8.421147
      LE Extended Advertising Report (0x0d)
        Num reports: 1
        Entry 0
          Event type: 0x0000
            Props: 0x0000
            Data status: [0;32mComplete[0m
          Address type: Public (0x00)
          Address: DF:A9:FF:F6:B1:1A (OUI DF-A9-FF)
          Primary PHY: LE 1M
          Secondary PHY: LE 1M
          SID: 0x01
          TX power: 127 dBm
          RSSI: -20 dBm (0xec)
          Periodic advertising interval: 120.00 msec (0x0060)
          Direct address type: Reserved (0xff)
          Direct address: 00-00-00-00-00-00
          Data length: 0x16
        06 16 52 18 72 91 08 0e 09 50 54 53 2d 42 41 53  ..R.r....PTS-BAS
        53 2d 42 31 31 41                                S-B11A          
        Service Data: Broadcast Audio Announcement (0x1852)
        Broadcast ID: 561522 (0x089172)
        Name (complete): PTS-BASS-B11A
> HCI Event: LE Meta Event (0x3e) plen 51                                                                           #149 8.423059
      LE Extended Advertising Report (0x0d)
        Num reports: 1
        Entry 0
          Event type: 0x0013
            Props: 0x0013
              Connectable
              Scannable
              Use legacy advertising PDUs
            Data status: [0;32mComplete[0m
          Legacy PDU Type: ADV_IND (0x0013)
          Address type: Public (0x00)
          Address: F0:18:98:96:04:94 (Apple, Inc.)
          Primary PHY: LE 1M
          Secondary PHY: No packets
          SID: no ADI field (0xff)
          TX power: 127 dBm
          RSSI: -86 dBm (0xaa)
          Periodic advertising interval: 0.00 msec (0x0000)
          Direct address type: Reserved (0xff)
          Direct address: 00-00-00-00-00-00
          Data length: 0x19
        02 01 06 11 07 00 00 00 00 00 00 00 00 00 00 00  ................
        00 00 01 31 5a 03 09 7a 6d                       ...1Z..zm       
        Flags: 0x06
          LE General Discoverable Mode
          BR/EDR Not Supported
        128-bit Service UUIDs (complete): 1 entry
          Vendor specific
        Name (complete): zm
> HCI Event: LE Meta Event (0x3e) plen 26                                                                           #150 8.423475
      LE Extended Advertising Report (0x0d)
        Num reports: 1
        Entry 0
          Event type: 0x001b
            Props: 0x001b
              Connectable
              Scannable
              Scan response
              Use legacy advertising PDUs
            Data status: [0;32mComplete[0m
          Legacy PDU Type: SCAN_RSP to an ADV_SCAN_IND (0x001b)
          Address type: Public (0x00)
          Address: F0:18:98:96:04:94 (Apple, Inc.)
          Primary PHY: LE 1M
          Secondary PHY: No packets
          SID: no ADI field (0xff)
          TX power: 127 dBm
          RSSI: -86 dBm (0xaa)
          Periodic advertising interval: 0.00 msec (0x0000)
          Direct address type: Reserved (0xff)
          Direct address: 00-00-00-00-00-00
          Data length: 0x00
> HCI Event: LE Meta Event (0x3e) plen 50                                                                           #151 8.459272
      LE Extended Advertising Report (0x0d)
        Num reports: 1
        Entry 0
          Event type: 0x0013
            Props: 0x0013
              Connectable
              Scannable
              Use legacy advertising PDUs
            Data status: [0;32mComplete[0m
          Legacy PDU Type: ADV_IND (0x0013)
          Address type: Public (0x00)
          Address: 7C:49:EB:2C:13:D2 (XIAOMI Electronics,CO.,LTD)
          Primary PHY: LE 1M
          Secondary PHY: No packets
          SID: no ADI field (0xff)
          TX power: 127 dBm
          RSSI: -94 dBm (0xa2)
          Periodic advertising interval: 0.00 msec (0x0000)
          Direct address type: Reserved (0xff)
          Direct address: 00-00-00-00-00-00
          Data length: 0x18
        02 01 06 14 16 95 fe 71 20 13 01 78 d2 13 2c eb  .......q ..x..,.
        49 7c 09 05 10 02 00 15                          I|......        
        Flags: 0x06
          LE General Discoverable Mode
          BR/EDR Not Supported
        Service Data: Xiaomi Inc. (0xfe95)
          Data[17]: 7120130178d2132ceb497c090510020015
> HCI Event: LE Meta Event (0x3e) plen 54                                                                           #152 8.460335
      LE Extended Advertising Report (0x0d)
        Num reports: 1
        Entry 0
          Event type: 0x001b
            Props: 0x001b
              Connectable
              Scannable
              Scan response
              Use legacy advertising PDUs
            Data status: [0;32mComplete[0m
          Legacy PDU Type: SCAN_RSP to an ADV_SCAN_IND (0x001b)
          Address type: Public (0x00)
          Address: 7C:49:EB:2C:13:D2 (XIAOMI Electronics,CO.,LTD)
          Primary PHY: LE 1M
          Secondary PHY: No packets
          SID: no ADI field (0xff)
          TX power: 127 dBm
          RSSI: -94 dBm (0xa2)
          Periodic advertising interval: 0.00 msec (0x0000)
          Direct address type: Reserved (0xff)
          Direct address: 00-00-00-00-00-00
          Data length: 0x1c
        0b 03 01 aa 02 aa 03 aa 0a 18 e8 fe 05 12 06 00  ................
        80 0c 09 09 4d 69 4b 65 74 74 6c 65              ....MiKettle    
        16-bit Service UUIDs (complete): 5 entries
          Unknown (0xaa01)
          Unknown (0xaa02)
          Unknown (0xaa03)
          Device Information (0x180a)
          Quintic Corp. (0xfee8)
        Peripheral Conn. Interval: 0x0006 - 0x0c80
        Name (complete): MiKettle
> HCI Event: LE Meta Event (0x3e) plen 54                                                                           #153 8.534274
      LE Extended Advertising Report (0x0d)
        Num reports: 1
        Entry 0
          Event type: 0x0010
            Props: 0x0010
              Use legacy advertising PDUs
            Data status: [0;32mComplete[0m
          Legacy PDU Type: ADV_NONCONN_IND (0x0010)
          Address type: Public (0x00)
          Address: A4:30:7A:95:74:FB (Samsung Electronics Co.,Ltd)
          Primary PHY: LE 1M
          Secondary PHY: No packets
          SID: no ADI field (0xff)
          TX power: 127 dBm
          RSSI: -70 dBm (0xba)
          Periodic advertising interval: 0.00 msec (0x0000)
          Direct address type: Reserved (0xff)
          Direct address: 00-00-00-00-00-00
          Data length: 0x1c
        1b ff 75 00 42 04 01 80 6e a4 30 7a 95 74 fb a6  ..u.B...n.0z.t..
        30 7a 95 74 fa 01 d8 41 c5 d9 00 00              0z.t...A....    
        Company: Samsung Electronics Co. Ltd. (117)
          Data[24]: 420401806ea4307a9574fba6307a9574fa01d841c5d90000
> HCI Event: LE Meta Event (0x3e) plen 55                                                                           #154 8.537896
      LE Extended Advertising Report (0x0d)
        Num reports: 1
        Entry 0
          Event type: 0x0010
            Props: 0x0010
              Use legacy advertising PDUs
            Data status: [0;32mComplete[0m
          Legacy PDU Type: ADV_NONCONN_IND (0x0010)
          Address type: Random (0x01)
          Address: 2C:68:40:E4:59:65 (Non-Resolvable)
          Primary PHY: LE 1M
          Secondary PHY: No packets
          SID: no ADI field (0xff)
          TX power: 127 dBm
          RSSI: -83 dBm (0xad)
          Periodic advertising interval: 0.00 msec (0x0000)
          Direct address type: Reserved (0xff)
          Direct address: 00-00-00-00-00-00
          Data length: 0x1d
        1c ff 06 00 01 09 21 0a 4d e0 8a 52 d2 d4 4c 41  ......!.M..R..LA
        50 54 4f 50 2d 45 35 32 45 4f 44 32 49           PTOP-E52EOD2I   
        Company: Microsoft (6)
          Data[25]: 0109210a4de08a52d2d44c4150544f502d453532454f443249
> HCI Event: LE Meta Event (0x3e) plen 55                                                                           #155 8.647770
      LE Extended Advertising Report (0x0d)
        Num reports: 1
        Entry 0
          Event type: 0x0010
            Props: 0x0010
              Use legacy advertising PDUs
            Data status: [0;32mComplete[0m
          Legacy PDU Type: ADV_NONCONN_IND (0x0010)
          Address type: Random (0x01)
          Address: 2C:68:40:E4:59:65 (Non-Resolvable)
          Primary PHY: LE 1M
          Secondary PHY: No packets
          SID: no ADI field (0xff)
          TX power: 127 dBm
          RSSI: -68 dBm (0xbc)
          Periodic advertising interval: 0.00 msec (0x0000)
          Direct address type: Reserved (0xff)
          Direct address: 00-00-00-00-00-00
          Data length: 0x1d
        1c ff 06 00 01 09 21 0a 4d e0 8a 52 d2 d4 4c 41  ......!.M..R..LA
        50 54 4f 50 2d 45 35 32 45 4f 44 32 49           PTOP-E52EOD2I   
        Company: Microsoft (6)
          Data[25]: 0109210a4de08a52d2d44c4150544f502d453532454f443249
> HCI Event: LE Meta Event (0x3e) plen 50                                                                           #156 8.666577
      LE Extended Advertising Report (0x0d)
        Num reports: 1
        Entry 0
          Event type: 0x0013
            Props: 0x0013
              Connectable
              Scannable
              Use legacy advertising PDUs
            Data status: [0;32mComplete[0m
          Legacy PDU Type: ADV_IND (0x0013)
          Address type: Public (0x00)
          Address: 7C:49:EB:2C:13:D2 (XIAOMI Electronics,CO.,LTD)
          Primary PHY: LE 1M
          Secondary PHY: No packets
          SID: no ADI field (0xff)
          TX power: 127 dBm
          RSSI: -92 dBm (0xa4)
          Periodic advertising interval: 0.00 msec (0x0000)
          Direct address type: Reserved (0xff)
          Direct address: 00-00-00-00-00-00
          Data length: 0x18
        02 01 06 14 16 95 fe 71 20 13 01 78 d2 13 2c eb  .......q ..x..,.
        49 7c 09 05 10 02 00 15                          I|......        
        Flags: 0x06
          LE General Discoverable Mode
          BR/EDR Not Supported
        Service Data: Xiaomi Inc. (0xfe95)
          Data[17]: 7120130178d2132ceb497c090510020015
> HCI Event: LE Meta Event (0x3e) plen 57                                                                           #157 8.822153
      LE Extended Advertising Report (0x0d)
        Num reports: 1
        Entry 0
          Event type: 0x0010
            Props: 0x0010
              Use legacy advertising PDUs
            Data status: [0;32mComplete[0m
          Legacy PDU Type: ADV_NONCONN_IND (0x0010)
          Address type: Random (0x01)
          Address: 1E:C6:2C:13:A2:F2 (Non-Resolvable)
          Primary PHY: LE 1M
          Secondary PHY: No packets
          SID: no ADI field (0xff)
          TX power: 127 dBm
          RSSI: -81 dBm (0xaf)
          Periodic advertising interval: 0.00 msec (0x0000)
          Direct address type: Reserved (0xff)
          Direct address: 00-00-00-00-00-00
          Data length: 0x1f
        1e ff 06 00 01 09 20 22 27 8d 02 c9 92 56 33 94  ...... "'....V3.
        1c c8 83 ff 95 53 d8 02 97 83 f6 f3 ff 9e 28     .....S........( 
        Company: Microsoft (6)
          Data[27]: 01092022278d02c9925633941cc883ff9553d8029783f6f3ff9e28
> HCI Event: LE Meta Event (0x3e) plen 48                                                                           #158 8.833159
      LE Extended Advertising Report (0x0d)
        Num reports: 1
        Entry 0
          Event type: 0x0000
            Props: 0x0000
            Data status: [0;32mComplete[0m
          Address type: Public (0x00)
          Address: DF:A9:FF:F6:B1:1A (OUI DF-A9-FF)
          Primary PHY: LE 1M
          Secondary PHY: LE 1M
          SID: 0x01
          TX power: 127 dBm
          RSSI: -17 dBm (0xef)
          Periodic advertising interval: 120.00 msec (0x0060)
          Direct address type: Reserved (0xff)
          Direct address: 00-00-00-00-00-00
          Data length: 0x16
        06 16 52 18 72 91 08 0e 09 50 54 53 2d 42 41 53  ..R.r....PTS-BAS
        53 2d 42 31 31 41                                S-B11A          
        Service Data: Broadcast Audio Announcement (0x1852)
        Broadcast ID: 561522 (0x089172)
        Name (complete): PTS-BASS-B11A
> HCI Event: LE Meta Event (0x3e) plen 54                                                                           #159 8.845777
      LE Extended Advertising Report (0x0d)
        Num reports: 1
        Entry 0
          Event type: 0x0010
            Props: 0x0010
              Use legacy advertising PDUs
            Data status: [0;32mComplete[0m
          Legacy PDU Type: ADV_NONCONN_IND (0x0010)
          Address type: Public (0x00)
          Address: A4:30:7A:95:74:FB (Samsung Electronics Co.,Ltd)
          Primary PHY: LE 1M
          Secondary PHY: No packets
          SID: no ADI field (0xff)
          TX power: 127 dBm
          RSSI: -77 dBm (0xb3)
          Periodic advertising interval: 0.00 msec (0x0000)
          Direct address type: Reserved (0xff)
          Direct address: 00-00-00-00-00-00
          Data length: 0x1c
        1b ff 75 00 42 04 01 80 6e a4 30 7a 95 74 fb a6  ..u.B...n.0z.t..
        30 7a 95 74 fa 01 d8 41 c5 d9 00 00              0z.t...A....    
        Company: Samsung Electronics Co. Ltd. (117)
          Data[24]: 420401806ea4307a9574fba6307a9574fa01d841c5d90000
> HCI Event: LE Meta Event (0x3e) plen 56                                                                           #160 8.904087
      LE Extended Advertising Report (0x0d)
        Num reports: 1
        Entry 0
          Event type: 0x0012
            Props: 0x0012
              Scannable
              Use legacy advertising PDUs
            Data status: [0;32mComplete[0m
          Legacy PDU Type: ADV_SCAN_IND (0x0012)
          Address type: Random (0x01)
          Address: 63:B4:85:1B:C0:F7 (Resolvable)
          Primary PHY: LE 1M
          Secondary PHY: No packets
          SID: no ADI field (0xff)
          TX power: 127 dBm
          RSSI: -96 dBm (0xa0)
          Periodic advertising interval: 0.00 msec (0x0000)
          Direct address type: Reserved (0xff)
          Direct address: 00-00-00-00-00-00
          Data length: 0x1e
        1d ff 2d 01 02 00 01 10 9f 68 dc 85 cf 50 42 f6  ..-......h...PB.
        9c d6 96 85 4e 3f 00 d6 73 fc fd f2 ab 1e        ....N?..s.....  
        Company: Sony Corporation (301)
          Data[26]: 020001109f68dc85cf5042f69cd696854e3f00d673fcfdf2ab1e
> HCI Event: LE Meta Event (0x3e) plen 26                                                                           #161 8.904448
      LE Extended Advertising Report (0x0d)
        Num reports: 1
        Entry 0
          Event type: 0x001a
            Props: 0x001a
              Scannable
              Scan response
              Use legacy advertising PDUs
            Data status: [0;32mComplete[0m
          Legacy PDU Type: SCAN_RSP to an ADV_IND (0x001a)
          Address type: Random (0x01)
          Address: 63:B4:85:1B:C0:F7 (Resolvable)
          Primary PHY: LE 1M
          Secondary PHY: No packets
          SID: no ADI field (0xff)
          TX power: 127 dBm
          RSSI: -96 dBm (0xa0)
          Periodic advertising interval: 0.00 msec (0x0000)
          Direct address type: Reserved (0xff)
          Direct address: 00-00-00-00-00-00
          Data length: 0x00
zephyr.exe[1604998]: < HCI Command: LE Set Extended Scan Enable (0x08|0x0042) plen 6                                #162 8.934822
        Extended scan: Disabled (0x00)
        Filter duplicates: Disabled (0x00)
        Duration: 0 msec (0x0000)
        Period: 0.00 sec (0x0000)
> HCI Event: Command Complete (0x0e) plen 4                                                                         #163 8.935560
      LE Set Extended Scan Enable (0x08|0x0042) ncmd 1
        Status: Success (0x00)
zephyr.exe[1604998]: < HCI Command: LE Periodic Advertising Create Sync (0x08|0x0044) plen 14                       #164 8.974810
        Options: 0x0000
        Use advertising SID, Advertiser Address Type and address
        Reporting initially enabled
        SID: 0x01
        Adv address type: Public (0x00)
        Adv address: DF:A9:FF:F6:B1:1A (OUI DF-A9-FF)
        Skip: 0x0005
        Sync timeout: 10000 msec (0x03e8)
        Sync CTE type: 0x0000
> HCI Event: Command Status (0x0f) plen 4                                                                           #165 8.976104
      LE Periodic Advertising Create Sync (0x08|0x0044) ncmd 1
        Status: Success (0x00)
zephyr.exe[1604998]: < HCI Command: LE Set Random Address (0x08|0x0005) plen 6                                      #166 8.994766
        Address: 1A:23:BC:86:82:5E (Non-Resolvable)
> HCI Event: Command Complete (0x0e) plen 4                                                                         #167 8.995386
      LE Set Random Address (0x08|0x0005) ncmd 1
        Status: Success (0x00)
zephyr.exe[1604998]: < HCI Command: LE Set Extended Scan Parameters (0x08|0x0041) plen 13                           #168 9.014775
        Own address type: Random (0x01)
        Filter policy: Accept all advertisement (0x00)
        PHYs: 0x05
        Entry 0: LE 1M
          Type: Passive (0x00)
          Interval: 60.000 msec (0x0060)
          Window: 30.000 msec (0x0030)
        Entry 1: LE Coded
          Type: Passive (0x00)
          Interval: 60.000 msec (0x0060)
          Window: 30.000 msec (0x0030)
> HCI Event: Command Complete (0x0e) plen 4                                                                         #169 9.015881
      LE Set Extended Scan Parameters (0x08|0x0041) ncmd 1
        Status: Success (0x00)
zephyr.exe[1604998]: < HCI Command: LE Set Extended Scan Enable (0x08|0x0042) plen 6                                #170 9.034812
        Extended scan: Enabled (0x01)
        Filter duplicates: Enabled (0x01)
        Duration: 0 msec (0x0000)
        Period: 0.00 sec (0x0000)
> HCI Event: Command Complete (0x0e) plen 4                                                                         #171 9.035916
      LE Set Extended Scan Enable (0x08|0x0042) ncmd 1
        Status: Success (0x00)
> HCI Event: LE Meta Event (0x3e) plen 55                                                                           #172 9.062838
      LE Extended Advertising Report (0x0d)
        Num reports: 1
        Entry 0
          Event type: 0x0010
            Props: 0x0010
              Use legacy advertising PDUs
            Data status: [0;32mComplete[0m
          Legacy PDU Type: ADV_NONCONN_IND (0x0010)
          Address type: Random (0x01)
          Address: 2C:68:40:E4:59:65 (Non-Resolvable)
          Primary PHY: LE 1M
          Secondary PHY: No packets
          SID: no ADI field (0xff)
          TX power: 127 dBm
          RSSI: -75 dBm (0xb5)
          Periodic advertising interval: 0.00 msec (0x0000)
          Direct address type: Reserved (0xff)
          Direct address: 00-00-00-00-00-00
          Data length: 0x1d
        1c ff 06 00 01 09 21 0a 4d e0 8a 52 d2 d4 4c 41  ......!.M..R..LA
        50 54 4f 50 2d 45 35 32 45 4f 44 32 49           PTOP-E52EOD2I   
        Company: Microsoft (6)
          Data[25]: 0109210a4de08a52d2d44c4150544f502d453532454f443249
> HCI Event: LE Meta Event (0x3e) plen 56                                                                           #173 9.125653
      LE Extended Advertising Report (0x0d)
        Num reports: 1
        Entry 0
          Event type: 0x0013
            Props: 0x0013
              Connectable
              Scannable
              Use legacy advertising PDUs
            Data status: [0;32mComplete[0m
          Legacy PDU Type: ADV_IND (0x0013)
          Address type: Random (0x01)
          Address: 50:3A:5E:38:C8:21 (Resolvable)
          Primary PHY: LE 1M
          Secondary PHY: No packets
          SID: no ADI field (0xff)
          TX power: 127 dBm
          RSSI: -84 dBm (0xac)
          Periodic advertising interval: 0.00 msec (0x0000)
          Direct address type: Reserved (0xff)
          Direct address: 00-00-00-00-00-00
          Data length: 0x1e
        02 01 02 1a ff 4c 00 02 15 18 a5 47 93 5c 75 49  .....L.....G.\uI
        ae af 6d 3e dd a8 4d ff c3 41 40 c0 e4 c5        ..m>..M..A@...  
        Flags: 0x02
          LE General Discoverable Mode
        Company: Apple, Inc. (76)
          Type: iBeacon (2)
          UUID: c3ff4da8-dd3e-6daf-ae49-755c9347a518
          Version: 16449.58560
          TX power: -59 dB
> HCI Event: LE Meta Event (0x3e) plen 52                                                                           #174 9.133390
      LE Extended Advertising Report (0x0d)
        Num reports: 1
        Entry 0
          Event type: 0x0013
            Props: 0x0013
              Connectable
              Scannable
              Use legacy advertising PDUs
            Data status: [0;32mComplete[0m
          Legacy PDU Type: ADV_IND (0x0013)
          Address type: Public (0x00)
          Address: FC:EC:DA:D7:5C:52 (Ubiquiti Networks Inc.)
          Primary PHY: LE 1M
          Secondary PHY: No packets
          SID: no ADI field (0xff)
          TX power: 127 dBm
          RSSI: -96 dBm (0xa0)
          Periodic advertising interval: 0.00 msec (0x0000)
          Direct address type: Reserved (0xff)
          Direct address: 00-00-00-00-00-00
          Data length: 0x1a
        02 01 06 11 06 e5 68 f2 c4 5f e5 de a0 10 4c d8  ......h.._....L.
        1a c8 1a 4e 05 04 08 55 43 4b                    ...N...UCK      
        Flags: 0x06
          LE General Discoverable Mode
          BR/EDR Not Supported
        128-bit Service UUIDs (partial): 1 entry
          Vendor specific
        Name (short): UCK
> HCI Event: LE Meta Event (0x3e) plen 57                                                                           #175 9.142567
      LE Extended Advertising Report (0x0d)
        Num reports: 1
        Entry 0
          Event type: 0x0010
            Props: 0x0010
              Use legacy advertising PDUs
            Data status: [0;32mComplete[0m
          Legacy PDU Type: ADV_NONCONN_IND (0x0010)
          Address type: Random (0x01)
          Address: 1E:C6:2C:13:A2:F2 (Non-Resolvable)
          Primary PHY: LE 1M
          Secondary PHY: No packets
          SID: no ADI field (0xff)
          TX power: 127 dBm
          RSSI: -82 dBm (0xae)
          Periodic advertising interval: 0.00 msec (0x0000)
          Direct address type: Reserved (0xff)
          Direct address: 00-00-00-00-00-00
          Data length: 0x1f
        1e ff 06 00 01 09 20 22 27 8d 02 c9 92 56 33 94  ...... "'....V3.
        1c c8 83 ff 95 53 d8 02 97 83 f6 f3 ff 9e 28     .....S........( 
        Company: Microsoft (6)
          Data[27]: 01092022278d02c9925633941cc883ff9553d8029783f6f3ff9e28
> HCI Event: LE Meta Event (0x3e) plen 50                                                                           #176 9.145238
      LE Extended Advertising Report (0x0d)
        Num reports: 1
        Entry 0
          Event type: 0x0013
            Props: 0x0013
              Connectable
              Scannable
              Use legacy advertising PDUs
            Data status: [0;32mComplete[0m
          Legacy PDU Type: ADV_IND (0x0013)
          Address type: Public (0x00)
          Address: 7C:49:EB:2C:13:D2 (XIAOMI Electronics,CO.,LTD)
          Primary PHY: LE 1M
          Secondary PHY: No packets
          SID: no ADI field (0xff)
          TX power: 127 dBm
          RSSI: -94 dBm (0xa2)
          Periodic advertising interval: 0.00 msec (0x0000)
          Direct address type: Reserved (0xff)
          Direct address: 00-00-00-00-00-00
          Data length: 0x18
        02 01 06 14 16 95 fe 71 20 13 01 78 d2 13 2c eb  .......q ..x..,.
        49 7c 09 05 10 02 00 15                          I|......        
        Flags: 0x06
          LE General Discoverable Mode
          BR/EDR Not Supported
        Service Data: Xiaomi Inc. (0xfe95)
          Data[17]: 7120130178d2132ceb497c090510020015
> HCI Event: LE Meta Event (0x3e) plen 55                                                                           #177 9.163844
      LE Extended Advertising Report (0x0d)
        Num reports: 1
        Entry 0
          Event type: 0x0010
            Props: 0x0010
              Use legacy advertising PDUs
            Data status: [0;32mComplete[0m
          Legacy PDU Type: ADV_NONCONN_IND (0x0010)
          Address type: Random (0x01)
          Address: 2C:68:40:E4:59:65 (Non-Resolvable)
          Primary PHY: LE 1M
          Secondary PHY: No packets
          SID: no ADI field (0xff)
          TX power: 127 dBm
          RSSI: -83 dBm (0xad)
          Periodic advertising interval: 0.00 msec (0x0000)
          Direct address type: Reserved (0xff)
          Direct address: 00-00-00-00-00-00
          Data length: 0x1d
        1c ff 06 00 01 09 21 0a 4d e0 8a 52 d2 d4 4c 41  ......!.M..R..LA
        50 54 4f 50 2d 45 35 32 45 4f 44 32 49           PTOP-E52EOD2I   
        Company: Microsoft (6)
          Data[25]: 0109210a4de08a52d2d44c4150544f502d453532454f443249
> HCI Event: LE Meta Event (0x3e) plen 48                                                                           #178 9.232902
      LE Extended Advertising Report (0x0d)
        Num reports: 1
        Entry 0
          Event type: 0x0000
            Props: 0x0000
            Data status: [0;32mComplete[0m
          Address type: Public (0x00)
          Address: DF:A9:FF:F6:B1:1A (OUI DF-A9-FF)
          Primary PHY: LE 1M
          Secondary PHY: LE 1M
          SID: 0x01
          TX power: 127 dBm
          RSSI: -16 dBm (0xf0)
          Periodic advertising interval: 120.00 msec (0x0060)
          Direct address type: Reserved (0xff)
          Direct address: 00-00-00-00-00-00
          Data length: 0x16
        06 16 52 18 72 91 08 0e 09 50 54 53 2d 42 41 53  ..R.r....PTS-BAS
        53 2d 42 31 31 41                                S-B11A          
        Service Data: Broadcast Audio Announcement (0x1852)
        Broadcast ID: 561522 (0x089172)
        Name (complete): PTS-BASS-B11A
> HCI Event: LE Meta Event (0x3e) plen 47                                                                           #179 9.233710
      LE Extended Advertising Report (0x0d)
        Num reports: 1
        Entry 0
          Event type: 0x0013
            Props: 0x0013
              Connectable
              Scannable
              Use legacy advertising PDUs
            Data status: [0;32mComplete[0m
          Legacy PDU Type: ADV_IND (0x0013)
          Address type: Public (0x00)
          Address: A4:C1:38:07:35:CA (Telink Semiconductor (Taipei) Co. Ltd.)
          Primary PHY: LE 1M
          Secondary PHY: No packets
          SID: no ADI field (0xff)
          TX power: 127 dBm
          RSSI: -88 dBm (0xa8)
          Periodic advertising interval: 0.00 msec (0x0000)
          Direct address type: Reserved (0xff)
          Direct address: 00-00-00-00-00-00
          Data length: 0x15
        02 01 06 11 16 95 fe 30 58 5b 05 01 ca 35 07 38  .......0X[...5.8
        c1 a4 28 01 00                                   ..(..           
        Flags: 0x06
          LE General Discoverable Mode
          BR/EDR Not Supported
        Service Data: Xiaomi Inc. (0xfe95)
          Data[14]: 30585b0501ca350738c1a4280100
> HCI Event: LE Meta Event (0x3e) plen 57                                                                           #180 9.242542
      LE Extended Advertising Report (0x0d)
        Num reports: 1
        Entry 0
          Event type: 0x0010
            Props: 0x0010
              Use legacy advertising PDUs
            Data status: [0;32mComplete[0m
          Legacy PDU Type: ADV_NONCONN_IND (0x0010)
          Address type: Random (0x01)
          Address: 1E:C6:2C:13:A2:F2 (Non-Resolvable)
          Primary PHY: LE 1M
          Secondary PHY: No packets
          SID: no ADI field (0xff)
          TX power: 127 dBm
          RSSI: -78 dBm (0xb2)
          Periodic advertising interval: 0.00 msec (0x0000)
          Direct address type: Reserved (0xff)
          Direct address: 00-00-00-00-00-00
          Data length: 0x1f
        1e ff 06 00 01 09 20 22 27 8d 02 c9 92 56 33 94  ...... "'....V3.
        1c c8 83 ff 95 53 d8 02 97 83 f6 f3 ff 9e 28     .....S........( 
        Company: Microsoft (6)
          Data[27]: 01092022278d02c9925633941cc883ff9553d8029783f6f3ff9e28
> HCI Event: LE Meta Event (0x3e) plen 50                                                                           #181 9.253687
      LE Extended Advertising Report (0x0d)
        Num reports: 1
        Entry 0
          Event type: 0x0001
            Props: 0x0001
              Connectable
            Data status: [0;32mComplete[0m
          Address type: Random (0x01)
          Address: 76:E8:BC:C0:53:0A (Resolvable)
          Primary PHY: LE 1M
          Secondary PHY: LE 1M
          SID: 0x01
          TX power: 127 dBm
          RSSI: -90 dBm (0xa6)
          Periodic advertising interval: 0.00 msec (0x0000)
          Direct address type: Reserved (0xff)
          Direct address: 00-00-00-00-00-00
          Data length: 0x18
        05 03 4e 18 50 18 0e 09 41 6e 64 72 6f 73 69 6e  ..N.P...Androsin
        6b 2d 44 42 47 02 01 02                          k-DBG...        
        16-bit Service UUIDs (complete): 2 entries
          Audio Stream Control (0x184e)
          Published Audio Capabilities (0x1850)
        Name (complete): Androsink-DBG
        Flags: 0x02
          LE General Discoverable Mode
> HCI Event: LE Meta Event (0x3e) plen 16                                                                           #182 9.311277
      LE Periodic Advertising Sync Established (0x0e)
        Status: Success (0x00)
        Sync handle: 40
        Advertising SID: 0x01
        Advertiser address type: Resolved Public (0x02)
        Advertiser address: DF:A9:FF:F6:B1:1A (OUI DF-A9-FF)
        Advertiser PHY: LE 1M (0x01)
        Periodic advertising interval: 120.00 msec (0x0060)
        Advertiser clock accuracy: 0x01
> HCI Event: LE Meta Event (0x3e) plen 48                                                                           #183 9.311871
      LE Periodic Advertising Report (0x0f)
        Sync handle: 40
        TX power: 127 dbm (0x7f)
        RSSI: -18 dBm (0xee)
        CTE Type: No Constant Tone Extension (0xff)
        Data status: [0;32mComplete[0m
        Data length: 0x28
        Service Data: Basic Audio Announcement (0x1851)
          Presentation Delay: 40000
          Number of Subgroups: 1
            Subgroup #0:
            Number of BIS(s): 1
            Codec: LC3 (0x06)
            Codec Specific Configuration: #0: len 0x02 type 0x01
            Codec Specific Configuration: Sampling Frequency: 16 Khz (0x03)
            Codec Specific Configuration: #1: len 0x02 type 0x02
            Codec Specific Configuration: Frame Duration: 10 ms (0x01)
            Codec Specific Configuration: #2: len 0x03 type 0x04
            Codec Specific Configuration: Frame Length: 40 (0x0028)
            Metadata: #0: len 0x03 type 0x02
            Metadata: Context: 0x0004
            Metadata: Context	Media (0x0004)
            Metadata: #1: len 0x01 type 0x09
              BIS #0:
              Index: 1
              Codec Specific Configuration: #0: len 0x05 type 0x03
              Codec Specific Configuration: Location: 0x00000001
              Codec Specific Configuration: Location: Front Left (0x00000001)
> HCI Event: LE Meta Event (0x3e) plen 20                                                                           #184 9.311873
      LE Broadcast Isochronous Group Info Advertising Report (0x22)
        Sync Handle: 0x0028
        Number BIS: 1
        NSE: 3
        ISO Interval: 10.00 msec (0x0008)
        BN: 1
        PTO: 1
        IRC: 2
        Maximum PDU: 40
        SDU Interval: 10000 us (0x002710)
        Maximum SDU: 40
        PHY: LE 1M (0x01)
        Framing: Unframed (0x00)
        Encryption: 0x01
zephyr.exe[1604998]: < HCI Command: LE Set Extended Scan Enable (0x08|0x0042) plen 6                                #185 9.314918
        Extended scan: Disabled (0x00)
        Filter duplicates: Disabled (0x00)
        Duration: 0 msec (0x0000)
        Period: 0.00 sec (0x0000)
> HCI Event: Command Complete (0x0e) plen 4                                                                         #186 9.316483
      LE Set Extended Scan Enable (0x08|0x0042) ncmd 1
        Status: Success (0x00)
zephyr.exe[1604998]: < ACL Data TX: Handle 75 [1/3] flags 0x00 dlen 27                                              #187 9.335742
zephyr.exe[1604998]: < ACL Data TX: Handle 75 flags 0x01 dlen 6                                                     #188 9.335751
      ATT: Handle Value Notification (0x1b) len 28
        Handle: 0x004b
          Data[26]: 00001ab1f6ffa9df017291080201010000000006030204000109
> HCI Event: Number of Completed Packets (0x13) plen 5                                                              #189 9.340170
        Num handles: 1
        Handle: 75 Address: DF:A9:FF:F6:B1:1A (OUI DF-A9-FF)
        Count: 1
        Buffers: 0/3
        #187: len 27 (54 Kb/s)
        Latency: 4 msec (4-115 msec ~54 msec)
> HCI Event: Number of Completed Packets (0x13) plen 5                                                              #190 9.399954
        Num handles: 1
        Handle: 75 Address: DF:A9:FF:F6:B1:1A (OUI DF-A9-FF)
        Count: 1
        Buffers: underflow/3
        #188: len 6 (0 Kb/s)
        Latency: 64 msec (4-115 msec ~59 msec)
> ACL Data RX: Handle 75 flags 0x02 dlen 25                                                                         #191 9.400429
      ATT: Write Command (0x52) len 20
        Handle: 0x0049
          Data[18]: 040047fc153950449a5da5be0eacfa97fdfe
zephyr.exe[1604998]: < HCI Command: Host Number of Completed Packets (0x03|0x0035) plen 5                           #192 9.414871
        Num handles: 1
        Handle: 75 Address: DF:A9:FF:F6:B1:1A (OUI DF-A9-FF)
        Count: 1
zephyr.exe[1604998]: < HCI Command: LE Broadcast Isochronous Group Create Sync (0x08|0x006b) plen 25                #193 9.594839
        BIG Handle: 0x00
        BIG Sync Handle: 0x0028
        Encryption: Encrypted (0x01)
        Broadcast Code[16]: 47fc153950449a5da5be0eacfa97fdfe
        Maximum Number Subevents: 0x00
        Timeout: 200 ms (0x0014)
        Number of BIS: 1
        BIS ID: 0x01
> HCI Event: Command Status (0x0f) plen 4                                                                           #194 9.595752
      LE Broadcast Isochronous Group Create Sync (0x08|0x006b) ncmd 1
        Status: Success (0x00)
> HCI Event: LE Meta Event (0x3e) plen 48                                                                          #195 10.031387
      LE Periodic Advertising Report (0x0f)
        Sync handle: 40
        TX power: 127 dbm (0x7f)
        RSSI: -17 dBm (0xef)
        CTE Type: No Constant Tone Extension (0xff)
        Data status: [0;32mComplete[0m
        Data length: 0x28
        Service Data: Basic Audio Announcement (0x1851)
          Presentation Delay: 40000
          Number of Subgroups: 1
            Subgroup #0:
            Number of BIS(s): 1
            Codec: LC3 (0x06)
            Codec Specific Configuration: #0: len 0x02 type 0x01
            Codec Specific Configuration: Sampling Frequency: 16 Khz (0x03)
            Codec Specific Configuration: #1: len 0x02 type 0x02
            Codec Specific Configuration: Frame Duration: 10 ms (0x01)
            Codec Specific Configuration: #2: len 0x03 type 0x04
            Codec Specific Configuration: Frame Length: 40 (0x0028)
            Metadata: #0: len 0x03 type 0x02
            Metadata: Context: 0x0004
            Metadata: Context	Media (0x0004)
            Metadata: #1: len 0x01 type 0x09
              BIS #0:
              Index: 1
              Codec Specific Configuration: #0: len 0x05 type 0x03
              Codec Specific Configuration: Location: 0x00000001
              Codec Specific Configuration: Location: Front Left (0x00000001)
> HCI Event: LE Meta Event (0x3e) plen 20                                                                          #196 10.031997
      LE Broadcast Isochronous Group Info Advertising Report (0x22)
        Sync Handle: 0x0028
        Number BIS: 1
        NSE: 3
        ISO Interval: 10.00 msec (0x0008)
        BN: 1
        PTO: 1
        IRC: 2
        Maximum PDU: 40
        SDU Interval: 10000 us (0x002710)
        Maximum SDU: 40
        PHY: LE 1M (0x01)
        Framing: Unframed (0x00)
        Encryption: 0x01
> HCI Event: LE Meta Event (0x3e) plen 15                                                                          #197 10.037687
      LE Broadcast Isochronous Group Sync Established (0x1d)
        Status: Connection Terminated due to MIC Failure (0x3d)
        BIG Handle: 0x00
        Transport Latency: 525057 us (0x080301)
        NSE: 0
        BN: 1
        PTO: 1
        IRC: 2
        Maximum PDU: 40
        ISO Interval: 12500.00 msec (0x2710)
zephyr.exe[1604998]: < ACL Data TX: Handle 75 [1/3] flags 0x00 dlen 27                                             #198 10.054884
zephyr.exe[1604998]: < ACL Data TX: Handle 75 flags 0x01 dlen 22                                                   #199 10.054890
      ATT: Handle Value Notification (0x1b) len 44
        Handle: 0x004b
          Data[42]: 00001ab1f6ffa9df017291080203ffffffffffffffffffffffffffffffff01ffffffff06030204000109
> HCI Event: Number of Completed Packets (0x13) plen 5                                                             #200 10.060254
        Num handles: 1
        Handle: 75 Address: DF:A9:FF:F6:B1:1A (OUI DF-A9-FF)
        Count: 1
        Buffers: 0/3
        #198: len 27 (43 Kb/s)
        Latency: 5 msec (4-115 msec ~32 msec)
> HCI Event: Number of Completed Packets (0x13) plen 5                                                             #201 10.119733
        Num handles: 1
        Handle: 75 Address: DF:A9:FF:F6:B1:1A (OUI DF-A9-FF)
        Count: 1
        Buffers: underflow/3
        #199: len 22 (2 Kb/s)
        Latency: 64 msec (4-115 msec ~48 msec)
> HCI Event: LE Meta Event (0x3e) plen 48                                                                          #202 10.751038
      LE Periodic Advertising Report (0x0f)
        Sync handle: 40
        TX power: 127 dbm (0x7f)
        RSSI: -18 dBm (0xee)
        CTE Type: No Constant Tone Extension (0xff)
        Data status: [0;32mComplete[0m
        Data length: 0x28
        Service Data: Basic Audio Announcement (0x1851)
          Presentation Delay: 40000
          Number of Subgroups: 1
            Subgroup #0:
            Number of BIS(s): 1
            Codec: LC3 (0x06)
            Codec Specific Configuration: #0: len 0x02 type 0x01
            Codec Specific Configuration: Sampling Frequency: 16 Khz (0x03)
            Codec Specific Configuration: #1: len 0x02 type 0x02
            Codec Specific Configuration: Frame Duration: 10 ms (0x01)
            Codec Specific Configuration: #2: len 0x03 type 0x04
            Codec Specific Configuration: Frame Length: 40 (0x0028)
            Metadata: #0: len 0x03 type 0x02
            Metadata: Context: 0x0004
            Metadata: Context	Media (0x0004)
            Metadata: #1: len 0x01 type 0x09
              BIS #0:
              Index: 1
              Codec Specific Configuration: #0: len 0x05 type 0x03
              Codec Specific Configuration: Location: 0x00000001
              Codec Specific Configuration: Location: Front Left (0x00000001)
> HCI Event: LE Meta Event (0x3e) plen 20                                                                          #203 10.752018
      LE Broadcast Isochronous Group Info Advertising Report (0x22)
        Sync Handle: 0x0028
        Number BIS: 1
        NSE: 3
        ISO Interval: 10.00 msec (0x0008)
        BN: 1
        PTO: 1
        IRC: 2
        Maximum PDU: 40
        SDU Interval: 10000 us (0x002710)
        Maximum SDU: 40
        PHY: LE 1M (0x01)
        Framing: Unframed (0x00)
        Encryption: 0x01
zephyr.exe[1604998]: < HCI Command: LE Broadcast Isochronous Group Create Sync (0x08|0x006b) plen 25               #204 10.755137
        BIG Handle: 0x00
        BIG Sync Handle: 0x0028
        Encryption: Encrypted (0x01)
        Broadcast Code[16]: 47fc153950449a5da5be0eacfa97fdfe
        Maximum Number Subevents: 0x00
        Timeout: 200 ms (0x0014)
        Number of BIS: 1
        BIS ID: 0x01
> HCI Event: Command Status (0x0f) plen 4                                                                          #205 10.756886
      LE Broadcast Isochronous Group Create Sync (0x08|0x006b) ncmd 1
        Status: Success (0x00)
> HCI Event: LE Meta Event (0x3e) plen 48                                                                          #206 11.471155
      LE Periodic Advertising Report (0x0f)
        Sync handle: 40
        TX power: 127 dbm (0x7f)
        RSSI: -16 dBm (0xf0)
        CTE Type: No Constant Tone Extension (0xff)
        Data status: [0;32mComplete[0m
        Data length: 0x28
        Service Data: Basic Audio Announcement (0x1851)
          Presentation Delay: 40000
          Number of Subgroups: 1
            Subgroup #0:
            Number of BIS(s): 1
            Codec: LC3 (0x06)
            Codec Specific Configuration: #0: len 0x02 type 0x01
            Codec Specific Configuration: Sampling Frequency: 16 Khz (0x03)
            Codec Specific Configuration: #1: len 0x02 type 0x02
            Codec Specific Configuration: Frame Duration: 10 ms (0x01)
            Codec Specific Configuration: #2: len 0x03 type 0x04
            Codec Specific Configuration: Frame Length: 40 (0x0028)
            Metadata: #0: len 0x03 type 0x02
            Metadata: Context: 0x0004
            Metadata: Context	Media (0x0004)
            Metadata: #1: len 0x01 type 0x09
              BIS #0:
              Index: 1
              Codec Specific Configuration: #0: len 0x05 type 0x03
              Codec Specific Configuration: Location: 0x00000001
              Codec Specific Configuration: Location: Front Left (0x00000001)
> HCI Event: LE Meta Event (0x3e) plen 20                                                                          #207 11.471409
      LE Broadcast Isochrono