Bluetooth monitor ver 5.72
= Note: Linux version 6.14.0-36-generic (x86_64)                       0.225586
= Note: Bluetooth subsystem version 2.22                               0.225588
= New Index: 00:00:00:00:00:00 (Primary,UART,hci1)              [hci1] 0.225589
= New Index: 48:5F:99:8E:E0:64 (Primary,USB,hci0)               [hci0] 0.225590
= Open Index: 00:00:00:00:00:00                                 [hci1] 0.250181
= Index Info: 00:00:00:00:00:00 (Nordic Semiconductor ASA)      [hci1] 0.250185
@ USER Open: main (privileged) version 2.22            {0x0001} [hci1] 0.250189
< HCI Command: Reset (0x03|0x0003) plen 0                    #1 [hci1] 0.250559
> HCI Event: Command Complete (0x0e) plen 4                  #2 [hci1] 0.251065
      Reset (0x03|0x0003) ncmd 1
        Status: Success (0x00)
< HCI Command: Read Local Supported... (0x04|0x0003) plen 0  #3 [hci1] 0.270160
> HCI Event: Command Complete (0x0e) plen 12                 #4 [hci1] 0.270700
      Read Local Supported Features (0x04|0x0003) ncmd 1
        Status: Success (0x00)
        Features: 0x00 0x00 0x00 0x00 0x60 0x00 0x00 0x00
          BR/EDR Not Supported
          LE Supported (Controller)
< HCI Command: Read Local Version In.. (0x04|0x0001) plen 0  #5 [hci1] 0.290095
> HCI Event: Command Complete (0x0e) plen 12                 #6 [hci1] 0.290564
      Read Local Version Information (0x04|0x0001) ncmd 1
        Status: Success (0x00)
        HCI version: Reserved (0x0f) - Revision 12393 (0x3069)
        LMP version: Reserved (0x0f) - Subversion 12393 (0x3069)
        Manufacturer: Nordic Semiconductor ASA (89)
< HCI Command: Read Local Supported... (0x04|0x0002) plen 0  #7 [hci1] 0.310151
> HCI Event: Command Complete (0x0e) plen 68                 #8 [hci1] 0.311183
      Read Local Supported Commands (0x04|0x0002) ncmd 1
        Status: Success (0x00)
        Commands: 119 entries
          Disconnect (Octet 0 - Bit 5)
          Read Remote Version Information (Octet 2 - Bit 7)
          Set Event Mask (Octet 5 - Bit 6)
          Reset (Octet 5 - Bit 7)
          Read Connection Accept Timeout (Octet 7 - Bit 2)
          Write Connection Accept Timeout (Octet 7 - Bit 3)
          Read Transmit Power Level (Octet 10 - Bit 2)
          Set Controller To Host Flow Control (Octet 10 - Bit 5)
          Host Buffer Size (Octet 10 - Bit 6)
          Host Number of Completed Packets (Octet 10 - Bit 7)
          Read Local Version Information (Octet 14 - Bit 3)
          Read Local Supported Features (Octet 14 - Bit 5)
          Read BD ADDR (Octet 15 - Bit 1)
          Read RSSI (Octet 15 - Bit 5)
          Set Event Mask Page 2 (Octet 22 - Bit 2)
          LE Set Event Mask (Octet 25 - Bit 0)
          LE Read Buffer Size (Octet 25 - Bit 1)
          LE Read Local Supported Features (Octet 25 - Bit 2)
          LE Set Random Address (Octet 25 - Bit 4)
          LE Set Advertising Parameters (Octet 25 - Bit 5)
          LE Read Advertising Channel TX Power (Octet 25 - Bit 6)
          LE Set Advertising Data (Octet 25 - Bit 7)
          LE Set Scan Response Data (Octet 26 - Bit 0)
          LE Set Advertise Enable (Octet 26 - Bit 1)
          LE Set Scan Parameters (Octet 26 - Bit 2)
          LE Set Scan Enable (Octet 26 - Bit 3)
          LE Create Connection (Octet 26 - Bit 4)
          LE Create Connection Cancel (Octet 26 - Bit 5)
          LE Read Accept List Size (Octet 26 - Bit 6)
          LE Clear Accept List (Octet 26 - Bit 7)
          LE Add Device To Accept List (Octet 27 - Bit 0)
          LE Remove Device From Accept List (Octet 27 - Bit 1)
          LE Connection Update (Octet 27 - Bit 2)
          LE Set Host Channel Classification (Octet 27 - Bit 3)
          LE Read Channel Map (Octet 27 - Bit 4)
          LE Read Remote Used Features (Octet 27 - Bit 5)
          LE Encrypt (Octet 27 - Bit 6)
          LE Rand (Octet 27 - Bit 7)
          LE Start Encryption (Octet 28 - Bit 0)
          LE Long Term Key Request Reply (Octet 28 - Bit 1)
          LE Long Term Key Request Neg Reply (Octet 28 - Bit 2)
          LE Read Supported States (Octet 28 - Bit 3)
          LE Receiver Test (Octet 28 - Bit 4)
          LE Transmitter Test (Octet 28 - Bit 5)
          LE Test End (Octet 28 - Bit 6)
          Read Authenticated Payload Timeout (Octet 32 - Bit 4)
          Write Authenticated Payload Timeout (Octet 32 - Bit 5)
          LE Set Data Length (Octet 33 - Bit 6)
          LE Read Suggested Default Data Length (Octet 33 - Bit 7)
          LE Write Suggested Default Data Length (Octet 34 - Bit 0)
          LE Add Device To Resolving List (Octet 34 - Bit 3)
          LE Remove Device From Resolving List (Octet 34 - Bit 4)
          LE Clear Resolving List (Octet 34 - Bit 5)
          LE Read Resolving List Size (Octet 34 - Bit 6)
          LE Set Address Resolution Enable (Octet 35 - Bit 1)
          LE Set Resolvable Private Address Timeout (Octet 35 - Bit 2)
          LE Read Maximum Data Length (Octet 35 - Bit 3)
          LE Read PHY (Octet 35 - Bit 4)
          LE Set Default PHY (Octet 35 - Bit 5)
          LE Set PHY (Octet 35 - Bit 6)
          LE Enhanced Receiver Test (Octet 35 - Bit 7)
          LE Enhanced Transmitter Test (Octet 36 - Bit 0)
          LE Set Advertising Set Random Address (Octet 36 - Bit 1)
          LE Set Extended Advertising Parameters (Octet 36 - Bit 2)
          LE Set Extended Advertising Data (Octet 36 - Bit 3)
          LE Set Extended Scan Response Data (Octet 36 - Bit 4)
          LE Set Extended Advertising Enable (Octet 36 - Bit 5)
          LE Read Maximum Advertising Data Length (Octet 36 - Bit 6)
          LE Read Number of Supported Advertising Sets (Octet 36 - Bit 7)
          LE Remove Advertising Set (Octet 37 - Bit 0)
          LE Clear Advertising Sets (Octet 37 - Bit 1)
          LE Set Periodic Advertising Parameters (Octet 37 - Bit 2)
          LE Set Periodic Advertising Data (Octet 37 - Bit 3)
          LE Set Periodic Advertising Enable (Octet 37 - Bit 4)
          LE Set Extended Scan Parameters (Octet 37 - Bit 5)
          LE Set Extended Scan Enable (Octet 37 - Bit 6)
          LE Extended Create Connection (Octet 37 - Bit 7)
          LE Periodic Advertising Create Sync (Octet 38 - Bit 0)
          LE Periodic Advertising Create Sync Cancel (Octet 38 - Bit 1)
          LE Periodic Advertising Terminate Sync (Octet 38 - Bit 2)
          LE Add Device To Periodic Advertiser List (Octet 38 - Bit 3)
          LE Remove Device From Periodic Advertiser List (Octet 38 - Bit 4)
          LE Clear Periodic Advertiser List (Octet 38 - Bit 5)
          LE Read Periodic Advertiser List Size (Octet 38 - Bit 6)
          LE Read Transmit Power (Octet 38 - Bit 7)
          LE Read RF Path Compensation (Octet 39 - Bit 0)
          LE Write RF Path Compensation (Octet 39 - Bit 1)
          LE Set Privacy Mode (Octet 39 - Bit 2)
          LE Periodic Advertising Receive Enable (Octet 40 - Bit 5)
          LE Periodic Advertising Sync Transfer (Octet 40 - Bit 6)
          LE Periodic Advertising Set Info Transfer (Octet 40 - Bit 7)
          LE Periodic Advertising Sync Transfer Parameters (Octet 41 - Bit 0)
          LE Set Default Periodic Advertisng Sync Transfer Parameters (Octet 41 - Bit 1)
          LE Read Buffer v2 (Octet 41 - Bit 5)
          LE Read ISO TX Sync (Octet 41 - Bit 6)
          LE Set Connected Isochronous Group Parameters (Octet 41 - Bit 7)
          LE Set Connected Isochronous Group Parameters Test (Octet 42 - Bit 0)
          LE Create Connected Isochronous Stream (Octet 42 - Bit 1)
          LE Remove Connected Isochronous Group (Octet 42 - Bit 2)
          LE Accept Connected Isochronous Stream Request (Octet 42 - Bit 3)
          LE Reject Connected Isochronous Stream Request (Octet 42 - Bit 4)
          LE Create Broadcast Isochronous Group (Octet 42 - Bit 5)
          LE Create Broadcast Isochronous Group Test (Octet 42 - Bit 6)
          LE Terminate Broadcast Isochronous Group (Octet 42 - Bit 7)
          LE Broadcast Isochronous Group Create Sync (Octet 43 - Bit 0)
          LE Broadcast Isochronous Group Terminate Sync (Octet 43 - Bit 1)
          LE Request Peer SCA (Octet 43 - Bit 2)
          LE Setup Isochronous Data Path (Octet 43 - Bit 3)
          LE Remove Isochronous Data Path (Octet 43 - Bit 4)
          LE Isochronous Transmit Test (Octet 43 - Bit 5)
          LE Isochronous Receive Test (Octet 43 - Bit 6)
          LE Isochronous Read Test Counters (Octet 43 - Bit 7)
          LE Isochronous Read Test Counters (Octet 44 - Bit 0)
          LE Set Host Feature (Octet 44 - Bit 1)
          Octet 44 - Bit 2 
          Octet 45 - Bit 6 
          Octet 46 - Bit 0 
          Octet 46 - Bit 1 
          Octet 46 - Bit 2 
< HCI Command: Host Buffer Size (0x03|0x0033) plen 7         #9 [hci1] 0.330162
        ACL MTU: 255  ACL max packet: 16
        SCO MTU: 0    SCO max packet: 0
> HCI Event: Command Complete (0x0e) plen 4                 #10 [hci1] 0.330689
      Host Buffer Size (0x03|0x0033) ncmd 1
        Status: Success (0x00)
< HCI Command: Set Controller To Ho.. (0x03|0x0031) plen 1  #11 [hci1] 0.350152
        Flow control: ACL Data Packets (0x01)
> HCI Event: Command Complete (0x0e) plen 4                 #12 [hci1] 0.350561
      Set Controller To Host Flow Control (0x03|0x0031) ncmd 1
        Status: Success (0x00)
< HCI Command: LE Read Local Suppor.. (0x08|0x0003) plen 0  #13 [hci1] 0.370150
> HCI Event: Command Complete (0x0e) plen 12                #14 [hci1] 0.370620
      LE Read Local Supported Features (0x08|0x0003) ncmd 1
        Status: Success (0x00)
        Features: 0xfd 0x79 0x00 0xf7 0x30 0x01 0x00 0x00
          LE Encryption
          Extended Reject Indication
          Peripheral-initiated Features Exchange
          LE Ping
          LE Data Packet Length Extension
          LL Privacy
          Extended Scanner Filter Policies
          LE 2M PHY
          LE Coded PHY
          LE Extended Advertising
          LE Periodic Advertising
          Channel Selection Algorithm #2
          Periodic Advertising Sync Transfer - Sender
          Periodic Advertising Sync Transfer - Recipient
          Sleep Clock Accuracy Updates
          Connected Isochronous Stream - Central
          Connected Isochronous Stream - Peripheral
          Isochronous Broadcaster
          Synchronized Receiver
          Periodic Advertising ADI support
          Connection Subrating
          Unknown features (0x0000010000000000)
< HCI Command: LE Set Host Feature (0x08|0x0074) plen 2     #15 [hci1] 0.390166
        Bit Number: 32
          Connected Isochronous Stream (Host Support)
        Bit Value: 1
> HCI Event: Command Complete (0x0e) plen 4                 #16 [hci1] 0.390566
      LE Set Host Feature (0x08|0x0074) ncmd 1
        Status: Success (0x00)
< HCI Command: LE Read Buffer v2 (0x08|0x0060) plen 0       #17 [hci1] 0.410167
> HCI Event: Command Complete (0x0e) plen 10                #18 [hci1] 0.410668
      LE Read Buffer v2 (0x08|0x0060) ncmd 1
        Status: Success (0x00)
        ACL MTU: 27
        ACL max packet: 3
        ISO MTU: 318
        ISO max packet: 3
< HCI Command: LE Read Maximum Adve.. (0x08|0x003a) plen 0  #19 [hci1] 0.430178
> HCI Event: Command Complete (0x0e) plen 6                 #20 [hci1] 0.430664
      LE Read Maximum Advertising Data Length (0x08|0x003a) ncmd 1
        Status: Success (0x00)
        Max length: 1650
< HCI Command: LE Read Supported St.. (0x08|0x001c) plen 0  #21 [hci1] 0.450156
> HCI Event: Command Complete (0x0e) plen 12                #22 [hci1] 0.450746
      LE Read Supported States (0x08|0x001c) ncmd 1
        Status: Success (0x00)
        States: 0x000003ff3e0306ff
          Non-connectable Advertising State
          Scannable Advertising State
          Connectable Advertising State
          High Duty Cycle Directed Advertising State
          Passive Scanning State
          Active Scanning State
          Initiating State
            and Connection State (Central Role)
          Connection State (Peripheral Role)
          Scannable Advertising State
            and Passive Scanning State
          Connectable Advertising State
            and Passive Scanning State
          Non-connectable Advertising State
            and Initiating State
          Scannable Advertising State
            and Initiating State
          Active Scanning State
            and Connection State (Central Role)
          Passive Scanning State
            and Connection State (Peripheral Role)
          Active Scanning State
            and Connection State (Peripheral Role)
          Initiating State
            and Connection State (Central Role)
            and Central Role & Central Role
          Low Duty Cycle Directed Advertising State
          Connectable Advertising State
            and Initiating State
            and Central Role & Peripheral Role
          High Duty Cycle Directed Advertising State
            and Initiating State
            and Central Role & Peripheral Role
          Low Duty Cycle Directed Advertising State
            and Initiating State
            and Central Role & Peripheral Role
          Connectable Advertising State
            and Connection State (Central Role)
            and Central Role & Peripheral Role
          High Duty Cycle Directed Advertising State
            and Connection State (Central Role)
            and Central Role & Peripheral Role
          Low Duty Cycle Directed Advertising State
            and Connection State (Central Role)
            and Central Role & Peripheral Role
          Connectable Advertising State
            and Connection State (Peripheral Role)
            and Central Role & Peripheral Role
          High Duty Cycle Directed Advertising State
            and Connection State (Peripheral Role)
            and Peripheral Role & Peripheral Role
          Low Duty Cycle Directed Advertising State
            and Connection State (Peripheral Role)
            and Peripheral Role & Peripheral Role
          Initiating State
            and Connection State (Peripheral Role)
            and Central Role & Peripheral Role
< HCI Command: LE Read Maximum Data.. (0x08|0x002f) plen 0  #23 [hci1] 0.470148
> HCI Event: Command Complete (0x0e) plen 12                #24 [hci1] 0.470720
      LE Read Maximum Data Length (0x08|0x002f) ncmd 1
        Status: Success (0x00)
        Max TX octets: 251
        Max TX time: 2704
        Max RX octets: 251
        Max RX time: 2704
< HCI Command: LE Write Suggested D.. (0x08|0x0024) plen 4  #25 [hci1] 0.490149
        TX octets: 251
        TX time: 2704
> HCI Event: Command Complete (0x0e) plen 4                 #26 [hci1] 0.490714
      LE Write Suggested Default Data Length (0x08|0x0024) ncmd 1
        Status: Success (0x00)
< HCI Command: LE Read Resolving Li.. (0x08|0x002a) plen 0  #27 [hci1] 0.510166
> HCI Event: Command Complete (0x0e) plen 5                 #28 [hci1] 0.510605
      LE Read Resolving List Size (0x08|0x002a) ncmd 1
        Status: Success (0x00)
        Size: 8
< HCI Command: LE Set Event Mask (0x08|0x0001) plen 8       #29 [hci1] 0.530155
        Mask: 0x000002023f87fa5e
          LE Advertising Report
          LE Connection Update Complete
          LE Read Remote Used Features Complete
          LE Long Term Key Request
          LE Data Length Change
          LE Enhanced Connection Complete
          LE PHY Update Complete
          LE Extended Advertising Report
          LE Periodic Advertising Sync Established
          LE Periodic Advertising Report
          LE Periodic Advertising Sync Lost
          LE Extended Scan Timeout
          LE Extended Advertising Set Terminated
          LE Scan Request Received
          LE Periodic Advertising Sync Transfer Rvc
          LE CIS Established
          LE CIS Request
          LE Create BIG Complete
          LE Terminate BIG Complete
          LE BIG Sync Estabilished Complete
          LE BIG Sync Lost
          LE BIG Info Advertising Report
          Unknown mask (0x0000020000000000)
> HCI Event: Command Complete (0x0e) plen 4                 #30 [hci1] 0.530687
      LE Set Event Mask (0x08|0x0001) ncmd 1
        Status: Success (0x00)
< HCI Command: Set Event Mask (0x03|0x0001) plen 8          #31 [hci1] 0.550158
        Mask: 0x2000800002008890
          Disconnection Complete
          Encryption Change
          Read Remote Version Information Complete
          Hardware Error
          Data Buffer Overflow
          Encryption Key Refresh Complete
          LE Meta
> HCI Event: Command Complete (0x0e) plen 4                 #32 [hci1] 0.550801
      Set Event Mask (0x03|0x0001) ncmd 1
        Status: Success (0x00)
< HCI Command: Read BD ADDR (0x04|0x0009) plen 0            #33 [hci1] 0.570170
> HCI Event: Command Complete (0x0e) plen 10                #34 [hci1] 0.570669
      Read BD ADDR (0x04|0x0009) ncmd 1
        Status: Success (0x00)
        Address: 00:00:00:00:00:00 (OUI 00-00-00)
< HCI Command: LE Set Random Address (0x08|0x0005) plen 6   #35 [hci1] 0.590157
        Address: D5:B6:CC:31:DB:3B (Static)
> HCI Event: Command Complete (0x0e) plen 4                 #36 [hci1] 0.590631
      LE Set Random Address (0x08|0x0005) ncmd 1
        Status: Success (0x00)
< HCI Command: LE Set Extended Adv.. (0x08|0x0036) plen 25  #37 [hci1] 2.891468
        Handle: 0x00
        Properties: 0x0013
          Connectable
          Scannable
          Use legacy advertising PDUs: ADV_IND
        Min advertising interval: 100.000 msec (0x00a0)
        Max advertising interval: 150.000 msec (0x00f0)
        Channel map: 37, 38, 39 (0x07)
        Own address type: Random (0x01)
        Peer address type: Public (0x00)
        Peer address: 00:00:00:00:00:00 (OUI 00-00-00)
        Filter policy: Allow Scan Request from Any, Allow Connect Request from Any (0x00)
        TX power: Host has no preference (0x7f)
        Primary PHY: LE 1M (0x01)
        Secondary max skip: 0x00
        Secondary PHY: LE 1M (0x01)
        SID: 0x00
        Scan request notifications: Disabled (0x00)
> HCI Event: Command Complete (0x0e) plen 5                 #38 [hci1] 2.892216
      LE Set Extended Advertising Parameters (0x08|0x0036) ncmd 1
        Status: Success (0x00)
        TX power (selected): 0 dbm (0x00)
< HCI Command: LE Set Advertising S.. (0x08|0x0035) plen 7  #39 [hci1] 2.910048
        Advertising handle: 0x00
        Advertising random address: D5:B6:CC:31:DB:3B (Static)
> HCI Event: Command Complete (0x0e) plen 4                 #40 [hci1] 2.910533
      LE Set Advertising Set Random Address (0x08|0x0035) ncmd 1
        Status: Success (0x00)
< HCI Command: LE Set Extended Adv.. (0x08|0x0037) plen 22  #41 [hci1] 2.930062
        Handle: 0x00
        Operation: Complete extended advertising data (0x03)
        Fragment preference: Minimize fragmentation (0x01)
        Data length: 0x12
        Flags: 0x06
          LE General Discoverable Mode
          BR/EDR Not Supported
        Name (complete): Tester_F6B11A
> HCI Event: Command Complete (0x0e) plen 4                 #42 [hci1] 2.930779
      LE Set Extended Advertising Data (0x08|0x0037) ncmd 1
        Status: Success (0x00)
< HCI Command: LE Set Extended Scan.. (0x08|0x0038) plen 4  #43 [hci1] 2.950048
        Handle: 0x00
        Operation: Complete scan response data (0x03)
        Fragment preference: Minimize fragmentation (0x01)
        Data length: 0x00
> HCI Event: Command Complete (0x0e) plen 4                 #44 [hci1] 2.950509
      LE Set Extended Scan Response Data (0x08|0x0038) ncmd 1
        Status: Success (0x00)
< HCI Command: LE Set Extended Adve.. (0x08|0x0039) plen 6  #45 [hci1] 2.970061
        Extended advertising: Enabled (0x01)
        Number of sets: 1 (0x01)
        Entry 0
          Handle: 0x00
          Duration: 0 ms (0x00)
          Max ext adv events: 0
> HCI Event: Command Complete (0x0e) plen 4                 #46 [hci1] 2.970625
      LE Set Extended Advertising Enable (0x08|0x0039) ncmd 1
        Status: Success (0x00)
> HCI Event: LE Meta Event (0x3e) plen 31                   #47 [hci1] 3.293514
      LE Enhanced Connection Complete (0x0a)
        Status: Success (0x00)
        Handle: 1353
        Role: Peripheral (0x01)
        Peer address type: Public (0x00)
        Peer address: DF:A9:FF:F6:B1:1A (OUI DF-A9-FF)
        Local resolvable private address: 00:00:00:00:00:00 (Non-Resolvable)
        Peer resolvable private address: 00:00:00:00:00:00 (Non-Resolvable)
        Connection interval: 87.50 msec (0x0046)
        Connection latency: 0 (0x0000)
        Supervision timeout: 20000 msec (0x07d0)
        Central clock accuracy: 0x01
> HCI Event: LE Meta Event (0x3e) plen 6                    #48 [hci1] 3.293610
      LE Advertising Set Terminated (0x12)
        Status: Success (0x00)
        Handle: 0
        Connection handle: 1353
        Number of completed extended advertising events: 0
< HCI Command: LE Read Remote Used... (0x08|0x0016) plen 2  #49 [hci1] 3.310389
        Handle: 1353 Address: DF:A9:FF:F6:B1:1A (OUI DF-A9-FF)
> HCI Event: Command Status (0x0f) plen 4                   #50 [hci1] 3.310836
      LE Read Remote Used Features (0x08|0x0016) ncmd 1
        Status: Success (0x00)
> HCI Event: LE Meta Event (0x3e) plen 12                   #51 [hci1] 3.557376
      LE Read Remote Used Features (0x04)
        Status: Success (0x00)
        Handle: 1353 Address: DF:A9:FF:F6:B1:1A (OUI DF-A9-FF)
        Features: 0x2d 0x49 0x00 0xf7 0x67 0xd9 0x00 0x80
          LE Encryption
          Extended Reject Indication
          Peripheral-initiated Features Exchange
          LE Data Packet Length Extension
          LE 2M PHY
          LE Coded PHY
          Channel Selection Algorithm #2
          Periodic Advertising Sync Transfer - Sender
          Periodic Advertising Sync Transfer - Recipient
          Sleep Clock Accuracy Updates
          Connected Isochronous Stream - Central
          Connected Isochronous Stream - Peripheral
          Isochronous Broadcaster
          Synchronized Receiver
          Connected Isochronous Stream (Host Support)
          LE Power Control Request
          LE Power Control Request
          Connection Subrating
          Connection Subrating (Host Support)
          Unknown features (0x8000d90000000000)
< ACL Data TX: Handle 1353 flags 0x00 dlen 7                #52 [hci1] 4.410823
      ATT: Exchange MTU Request (0x02) len 2
        Client RX MTU: 251
> HCI Event: Number of Completed Packets (0x13) plen 5      #53 [hci1] 4.519629
        Num handles: 1
        Handle: 1353 Address: DF:A9:FF:F6:B1:1A (OUI DF-A9-FF)
        Count: 1
        #52: len 7 (0 Kb/s)
        Latency: 108 msec (108-108 msec ~108 msec)
> ACL Data RX: Handle 1353 flags 0x02 dlen 7                #54 [hci1] 4.519823
      ATT: Exchange MTU Response (0x03) len 2
        Server RX MTU: 23
< HCI Command: Host Number of Compl.. (0x03|0x0035) plen 5  #55 [hci1] 4.530982
        Num handles: 1
        Handle: 1353 Address: DF:A9:FF:F6:B1:1A (OUI DF-A9-FF)
        Count: 1
< ACL Data TX: Handle 1353 flags 0x00 dlen 27               #56 [hci1] 7.460763
      ATT: Prepare Write Request (0x16) len 22
        Handle: 0x0045
        Offset: 0x0000
          Data: 121212121212121212121212121212121212
> HCI Event: Number of Completed Packets (0x13) plen 5      #57 [hci1] 7.582157
        Num handles: 1
        Handle: 1353 Address: DF:A9:FF:F6:B1:1A (OUI DF-A9-FF)
        Count: 1
        #56: len 27 (1 Kb/s)
        Latency: 121 msec (108-121 msec ~115 msec)
> ACL Data RX: Handle 1353 flags 0x02 dlen 27               #58 [hci1] 7.582650
      ATT: Prepare Write Response (0x17) len 22
        Handle: 0x0045
        Offset: 0x0000
          Data: 121212121212121212121212121212121212
< HCI Command: Host Number of Compl.. (0x03|0x0035) plen 5  #59 [hci1] 7.590343
        Num handles: 1
        Handle: 1353 Address: DF:A9:FF:F6:B1:1A (OUI DF-A9-FF)
        Count: 1
< ACL Data TX: Handle 1353 flags 0x00 dlen 27               #60 [hci1] 7.590361
      ATT: Prepare Write Request (0x16) len 22
        Handle: 0x0045
        Offset: 0x0012
          Data: 121212121212121212121212121212121212
> HCI Event: Number of Completed Packets (0x13) plen 5      #61 [hci1] 7.757165
        Num handles: 1
        Handle: 1353 Address: DF:A9:FF:F6:B1:1A (OUI DF-A9-FF)
        Count: 1
        #60: len 27 (1 Kb/s)
        Latency: 166 msec (108-166 msec ~140 msec)
> ACL Data RX: Handle 1353 flags 0x02 dlen 27               #62 [hci1] 7.757522
      ATT: Prepare Write Response (0x17) len 22
        Handle: 0x0045
        Offset: 0x0012
          Data: 121212121212121212121212121212121212
< HCI Command: Host Number of Compl.. (0x03|0x0035) plen 5  #63 [hci1] 7.770377
        Num handles: 1
        Handle: 1353 Address: DF:A9:FF:F6:B1:1A (OUI DF-A9-FF)
        Count: 1
< ACL Data TX: Handle 1353 flags 0x00 dlen 27               #64 [hci1] 7.770383
      ATT: Prepare Write Request (0x16) len 22
        Handle: 0x0045
        Offset: 0x0024
          Data: 121212121212121212121212121212121212
> HCI Event: Number of Completed Packets (0x13) plen 5      #65 [hci1] 7.932175
        Num handles: 1
        Handle: 1353 Address: DF:A9:FF:F6:B1:1A (OUI DF-A9-FF)
        Count: 1
        #64: len 27 (1 Kb/s)
        Latency: 161 msec (108-166 msec ~151 msec)
> ACL Data RX: Handle 1353 flags 0x02 dlen 27               #66 [hci1] 7.932603
      ATT: Prepare Write Response (0x17) len 22
        Handle: 0x0045
        Offset: 0x0024
          Data: 121212121212121212121212121212121212
< HCI Command: Host Number of Compl.. (0x03|0x0035) plen 5  #67 [hci1] 7.950335
        Num handles: 1
        Handle: 1353 Address: DF:A9:FF:F6:B1:1A (OUI DF-A9-FF)
        Count: 1
< ACL Data TX: Handle 1353 flags 0x00 dlen 27               #68 [hci1] 7.950367
      ATT: Prepare Write Request (0x16) len 22
        Handle: 0x0045
        Offset: 0x0036
          Data: 121212121212121212121212121212121212
> HCI Event: Number of Completed Packets (0x13) plen 5      #69 [hci1] 8.107197
        Num handles: 1
        Handle: 1353 Address: DF:A9:FF:F6:B1:1A (OUI DF-A9-FF)
        Count: 1
        #68: len 27 (1 Kb/s)
        Latency: 156 msec (108-166 msec ~154 msec)
> ACL Data RX: Handle 1353 flags 0x02 dlen 27               #70 [hci1] 8.107511
      ATT: Prepare Write Response (0x17) len 22
        Handle: 0x0045
        Offset: 0x0036
          Data: 121212121212121212121212121212121212
< HCI Command: Host Number of Compl.. (0x03|0x0035) plen 5  #71 [hci1] 8.110330
        Num handles: 1
        Handle: 1353 Address: DF:A9:FF:F6:B1:1A (OUI DF-A9-FF)
        Count: 1
< ACL Data TX: Handle 1353 flags 0x00 dlen 27               #72 [hci1] 8.110361
      ATT: Prepare Write Request (0x16) len 22
        Handle: 0x0045
        Offset: 0x0048
          Data: 121212121212121212121212121212121212
> HCI Event: Number of Completed Packets (0x13) plen 5      #73 [hci1] 8.282234
        Num handles: 1
        Handle: 1353 Address: DF:A9:FF:F6:B1:1A (OUI DF-A9-FF)
        Count: 1
        #72: len 27 (1 Kb/s)
        Latency: 171 msec (108-171 msec ~162 msec)
> ACL Data RX: Handle 1353 flags 0x02 dlen 27               #74 [hci1] 8.282531
      ATT: Prepare Write Response (0x17) len 22
        Handle: 0x0045
        Offset: 0x0048
          Data: 121212121212121212121212121212121212
< HCI Command: Host Number of Compl.. (0x03|0x0035) plen 5  #75 [hci1] 8.290323
        Num handles: 1
        Handle: 1353 Address: DF:A9:FF:F6:B1:1A (OUI DF-A9-FF)
        Count: 1
< ACL Data TX: Handle 1353 flags 0x00 dlen 27               #76 [hci1] 8.290346
      ATT: Prepare Write Request (0x16) len 22
        Handle: 0x0045
        Offset: 0x005a
          Data: 121212121212121212121212121212121212
< ACL Data TX: Handle 1353 flags 0x00 dlen 16               #77 [hci1] 8.320213
      LE L2CAP: Connection Parameter Update Request (0x12) ident 1 len 8
        Min interval: 24
        Max interval: 40
        Peripheral latency: 0
        Timeout multiplier: 42
> HCI Event: Number of Completed Packets (0x13) plen 5      #78 [hci1] 8.370143
        Num handles: 1
        Handle: 1353 Address: DF:A9:FF:F6:B1:1A (OUI DF-A9-FF)
        Count: 1
        #76: len 27 (2 Kb/s)
        Latency: 79 msec (79-171 msec ~121 msec)
> HCI Event: Number of Completed Packets (0x13) plen 5      #79 [hci1] 8.457239
        Num handles: 1
        Handle: 1353 Address: DF:A9:FF:F6:B1:1A (OUI DF-A9-FF)
        Count: 1
        #77: len 16 (0 Kb/s)
        Latency: 137 msec (79-171 msec ~129 msec)
> ACL Data RX: Handle 1353 flags 0x02 dlen 27               #80 [hci1] 8.457538
      ATT: Prepare Write Response (0x17) len 22
        Handle: 0x0045
        Offset: 0x005a
          Data: 121212121212121212121212121212121212
> ACL Data RX: Handle 1353 flags 0x02 dlen 10               #81 [hci1] 8.457745
      LE L2CAP: Connection Parameter Update Response (0x13) ident 1 len 2
        Result: Connection Parameters accepted (0x0000)
< HCI Command: Host Number of Compl.. (0x03|0x0035) plen 5  #82 [hci1] 8.470333
        Num handles: 1
        Handle: 1353 Address: DF:A9:FF:F6:B1:1A (OUI DF-A9-FF)
        Count: 1
< ACL Data TX: Handle 1353 flags 0x00 dlen 27               #83 [hci1] 8.470364
      ATT: Prepare Write Request (0x16) len 22
        Handle: 0x0045
        Offset: 0x006c
          Data: 121212121212121212121212121212121212
< HCI Command: Host Number of Compl.. (0x03|0x0035) plen 5  #84 [hci1] 8.470565
        Num handles: 1
        Handle: 1353 Address: DF:A9:FF:F6:B1:1A (OUI DF-A9-FF)
        Count: 1
> HCI Event: Number of Completed Packets (0x13) plen 5      #85 [hci1] 8.632136
        Num handles: 1
        Handle: 1353 Address: DF:A9:FF:F6:B1:1A (OUI DF-A9-FF)
        Count: 1
        #83: len 27 (1 Kb/s)
        Latency: 161 msec (79-171 msec ~145 msec)
> ACL Data RX: Handle 1353 flags 0x02 dlen 27               #86 [hci1] 8.632656
      ATT: Prepare Write Response (0x17) len 22
        Handle: 0x0045
        Offset: 0x006c
          Data: 121212121212121212121212121212121212
< HCI Command: Host Number of Compl.. (0x03|0x0035) plen 5  #87 [hci1] 8.650342
        Num handles: 1
        Handle: 1353 Address: DF:A9:FF:F6:B1:1A (OUI DF-A9-FF)
        Count: 1
< ACL Data TX: Handle 1353 flags 0x00 dlen 27               #88 [hci1] 8.650443
      ATT: Prepare Write Request (0x16) len 22
        Handle: 0x0045
        Offset: 0x007e
          Data: 121212121212121212121212121212121212
> HCI Event: Number of Completed Packets (0x13) plen 5      #89 [hci1] 8.807219
        Num handles: 1
        Handle: 1353 Address: DF:A9:FF:F6:B1:1A (OUI DF-A9-FF)
        Count: 1
        #88: len 27 (1 Kb/s)
        Latency: 156 msec (79-171 msec ~151 msec)
> ACL Data RX: Handle 1353 flags 0x02 dlen 27               #90 [hci1] 8.807590
      ATT: Prepare Write Response (0x17) len 22
        Handle: 0x0045
        Offset: 0x007e
          Data: 121212121212121212121212121212121212
< HCI Command: Host Number of Compl.. (0x03|0x0035) plen 5  #91 [hci1] 8.810300
        Num handles: 1
        Handle: 1353 Address: DF:A9:FF:F6:B1:1A (OUI DF-A9-FF)
        Count: 1
< ACL Data TX: Handle 1353 flags 0x00 dlen 27               #92 [hci1] 8.810316
      ATT: Prepare Write Request (0x16) len 22
        Handle: 0x0045
        Offset: 0x0090
          Data: 121212121212121212121212121212121212
> HCI Event: Number of Completed Packets (0x13) plen 5      #93 [hci1] 8.982178
        Num handles: 1
        Handle: 1353 Address: DF:A9:FF:F6:B1:1A (OUI DF-A9-FF)
        Count: 1
        #92: len 27 (1 Kb/s)
        Latency: 171 msec (79-171 msec ~161 msec)
> ACL Data RX: Handle 1353 flags 0x02 dlen 27               #94 [hci1] 8.982587
      ATT: Prepare Write Response (0x17) len 22
        Handle: 0x0045
        Offset: 0x0090
          Data: 121212121212121212121212121212121212
< HCI Command: Host Number of Compl.. (0x03|0x0035) plen 5  #95 [hci1] 8.990345
        Num handles: 1
        Handle: 1353 Address: DF:A9:FF:F6:B1:1A (OUI DF-A9-FF)
        Count: 1
< ACL Data TX: Handle 1353 flags 0x00 dlen 27               #96 [hci1] 8.990379
      ATT: Prepare Write Request (0x16) len 22
        Handle: 0x0045
        Offset: 0x00a2
          Data: 121212121212121212121212121212121212
> HCI Event: Number of Completed Packets (0x13) plen 5      #97 [hci1] 9.157165
        Num handles: 1
        Handle: 1353 Address: DF:A9:FF:F6:B1:1A (OUI DF-A9-FF)
        Count: 1
        #96: len 27 (1 Kb/s)
        Latency: 166 msec (79-171 msec ~164 msec)
> ACL Data RX: Handle 1353 flags 0x02 dlen 27               #98 [hci1] 9.157668
      ATT: Prepare Write Response (0x17) len 22
        Handle: 0x0045
        Offset: 0x00a2
          Data: 121212121212121212121212121212121212
< HCI Command: Host Number of Compl.. (0x03|0x0035) plen 5  #99 [hci1] 9.170273
        Num handles: 1
        Handle: 1353 Address: DF:A9:FF:F6:B1:1A (OUI DF-A9-FF)
        Count: 1
< ACL Data TX: Handle 1353 flags 0x00 dlen 27              #100 [hci1] 9.170292
      ATT: Prepare Write Request (0x16) len 22
        Handle: 0x0045
        Offset: 0x00b4
          Data: 121212121212121212121212121212121212
> HCI Event: Number of Completed Packets (0x13) plen 5     #101 [hci1] 9.332189
        Num handles: 1
        Handle: 1353 Address: DF:A9:FF:F6:B1:1A (OUI DF-A9-FF)
        Count: 1
        #100: len 27 (1 Kb/s)
        Latency: 161 msec (79-171 msec ~163 msec)
> ACL Data RX: Handle 1353 flags 0x02 dlen 27              #102 [hci1] 9.332561
      ATT: Prepare Write Response (0x17) len 22
        Handle: 0x0045
        Offset: 0x00b4
          Data: 121212121212121212121212121212121212
< HCI Command: Host Number of Comp.. (0x03|0x0035) plen 5  #103 [hci1] 9.350348
        Num handles: 1
        Handle: 1353 Address: DF:A9:FF:F6:B1:1A (OUI DF-A9-FF)
        Count: 1
< ACL Data TX: Handle 1353 flags 0x00 dlen 27              #104 [hci1] 9.350374
      ATT: Prepare Write Request (0x16) len 22
        Handle: 0x0045
        Offset: 0x00c6
          Data: 121212121212121212121212121212121212
> HCI Event: Number of Completed Packets (0x13) plen 5     #105 [hci1] 9.507188
        Num handles: 1
        Handle: 1353 Address: DF:A9:FF:F6:B1:1A (OUI DF-A9-FF)
        Count: 1
        #104: len 27 (1 Kb/s)
        Latency: 156 msec (79-171 msec ~159 msec)
> ACL Data RX: Handle 1353 flags 0x02 dlen 27              #106 [hci1] 9.507576
      ATT: Prepare Write Response (0x17) len 22
        Handle: 0x0045
        Offset: 0x00c6
          Data: 121212121212121212121212121212121212
< HCI Command: Host Number of Comp.. (0x03|0x0035) plen 5  #107 [hci1] 9.510329
        Num handles: 1
        Handle: 1353 Address: DF:A9:FF:F6:B1:1A (OUI DF-A9-FF)
        Count: 1
< ACL Data TX: Handle 1353 flags 0x00 dlen 27              #108 [hci1] 9.510345
      ATT: Prepare Write Request (0x16) len 22
        Handle: 0x0045
        Offset: 0x00d8
          Data: 121212121212121212121212121212121212
> HCI Event: Number of Completed Packets (0x13) plen 5     #109 [hci1] 9.682130
        Num handles: 1
        Handle: 1353 Address: DF:A9:FF:F6:B1:1A (OUI DF-A9-FF)
        Count: 1
        #108: len 27 (1 Kb/s)
        Latency: 171 msec (79-171 msec ~165 msec)
> ACL Data RX: Handle 1353 flags 0x02 dlen 27              #110 [hci1] 9.682607
      ATT: Prepare Write Response (0x17) len 22
        Handle: 0x0045
        Offset: 0x00d8
          Data: 121212121212121212121212121212121212
< HCI Command: Host Number of Comp.. (0x03|0x0035) plen 5  #111 [hci1] 9.690437
        Num handles: 1
        Handle: 1353 Address: DF:A9:FF:F6:B1:1A (OUI DF-A9-FF)
        Count: 1
< ACL Data TX: Handle 1353 flags 0x00 dlen 27              #112 [hci1] 9.690555
      ATT: Prepare Write Request (0x16) len 22
        Handle: 0x0045
        Offset: 0x00ea
          Data: 121212121212121212121212121212121212
> HCI Event: Number of Completed Packets (0x13) plen 5     #113 [hci1] 9.857138
        Num handles: 1
        Handle: 1353 Address: DF:A9:FF:F6:B1:1A (OUI DF-A9-FF)
        Count: 1
        #112: len 27 (1 Kb/s)
        Latency: 166 msec (79-171 msec ~166 msec)
> ACL Data RX: Handle 1353 flags 0x02 dlen 27              #114 [hci1] 9.857604
      ATT: Prepare Write Response (0x17) len 22
        Handle: 0x0045
        Offset: 0x00ea
          Data: 121212121212121212121212121212121212
< HCI Command: Host Number of Comp.. (0x03|0x0035) plen 5  #115 [hci1] 9.870325
        Num handles: 1
        Handle: 1353 Address: DF:A9:FF:F6:B1:1A (OUI DF-A9-FF)
        Count: 1
< ACL Data TX: Handle 1353 flags 0x00 dlen 27              #116 [hci1] 9.870358
      ATT: Prepare Write Request (0x16) len 22
        Handle: 0x0045
        Offset: 0x00fc
          Data: 121212121212121212121212121212121212
> HCI Event: Number of Completed Packets (0x13) plen 5    #117 [hci1] 10.032187
        Num handles: 1
        Handle: 1353 Address: DF:A9:FF:F6:B1:1A (OUI DF-A9-FF)
        Count: 1
        #116: len 27 (1 Kb/s)
        Latency: 161 msec (79-171 msec ~164 msec)
> ACL Data RX: Handle 1353 flags 0x02 dlen 27             #118 [hci1] 10.032556
      ATT: Prepare Write Response (0x17) len 22
        Handle: 0x0045
        Offset: 0x00fc
          Data: 121212121212121212121212121212121212
< HCI Command: Host Number of Com.. (0x03|0x0035) plen 5  #119 [hci1] 10.050428
        Num handles: 1
        Handle: 1353 Address: DF:A9:FF:F6:B1:1A (OUI DF-A9-FF)
        Count: 1
< ACL Data TX: Handle 1353 flags 0x00 dlen 27             #120 [hci1] 10.050494
      ATT: Prepare Write Request (0x16) len 22
        Handle: 0x0045
        Offset: 0x010e
          Data: 121212121212121212121212121212121212
> HCI Event: Number of Completed Packets (0x13) plen 5    #121 [hci1] 10.207200
        Num handles: 1
        Handle: 1353 Address: DF:A9:FF:F6:B1:1A (OUI DF-A9-FF)
        Count: 1
        #120: len 27 (1 Kb/s)
        Latency: 156 msec (79-171 msec ~160 msec)
> ACL Data RX: Handle 1353 flags 0x02 dlen 27             #122 [hci1] 10.207545
      ATT: Prepare Write Response (0x17) len 22
        Handle: 0x0045
        Offset: 0x010e
          Data: 121212121212121212121212121212121212
< HCI Command: Host Number of Com.. (0x03|0x0035) plen 5  #123 [hci1] 10.210367
        Num handles: 1
        Handle: 1353 Address: DF:A9:FF:F6:B1:1A (OUI DF-A9-FF)
        Count: 1
< ACL Data TX: Handle 1353 flags 0x00 dlen 27             #124 [hci1] 10.210414
      ATT: Prepare Write Request (0x16) len 22
        Handle: 0x0045
        Offset: 0x0120
          Data: 121212121212121212121212121212121212
> HCI Event: Number of Completed Packets (0x13) plen 5    #125 [hci1] 10.382178
        Num handles: 1
        Handle: 1353 Address: DF:A9:FF:F6:B1:1A (OUI DF-A9-FF)
        Count: 1
        #124: len 27 (1 Kb/s)
        Latency: 171 msec (79-171 msec ~166 msec)
> ACL Data RX: Handle 1353 flags 0x02 dlen 27             #126 [hci1] 10.382546
      ATT: Prepare Write Response (0x17) len 22
        Handle: 0x0045
        Offset: 0x0120
          Data: 121212121212121212121212121212121212
< HCI Command: Host Number of Com.. (0x03|0x0035) plen 5  #127 [hci1] 10.390321
        Num handles: 1
        Handle: 1353 Address: DF:A9:FF:F6:B1:1A (OUI DF-A9-FF)
        Count: 1
< ACL Data TX: Handle 1353 flags 0x00 dlen 27             #128 [hci1] 10.390352
      ATT: Prepare Write Request (0x16) len 22
        Handle: 0x0045
        Offset: 0x0132
          Data: 121212121212121212121212121212121212
> HCI Event: Number of Completed Packets (0x13) plen 5    #129 [hci1] 10.557172
        Num handles: 1
        Handle: 1353 Address: DF:A9:FF:F6:B1:1A (OUI DF-A9-FF)
        Count: 1
        #128: len 27 (1 Kb/s)
        Latency: 166 msec (79-171 msec ~166 msec)
> ACL Data RX: Handle 1353 flags 0x02 dlen 27             #130 [hci1] 10.557536
      ATT: Prepare Write Response (0x17) len 22
        Handle: 0x0045
        Offset: 0x0132
          Data: 121212121212121212121212121212121212
< HCI Command: Host Number of Com.. (0x03|0x0035) plen 5  #131 [hci1] 10.570413
        Num handles: 1
        Handle: 1353 Address: DF:A9:FF:F6:B1:1A (OUI DF-A9-FF)
        Count: 1
< ACL Data TX: Handle 1353 flags 0x00 dlen 27             #132 [hci1] 10.570491
      ATT: Prepare Write Request (0x16) len 22
        Handle: 0x0045
        Offset: 0x0144
          Data: 121212121212121212121212121212121212
> HCI Event: Number of Completed Packets (0x13) plen 5    #133 [hci1] 10.732139
        Num handles: 1
        Handle: 1353 Address: DF:A9:FF:F6:B1:1A (OUI DF-A9-FF)
        Count: 1
        #132: len 27 (1 Kb/s)
        Latency: 161 msec (79-171 msec ~164 msec)
> ACL Data RX: Handle 1353 flags 0x02 dlen 27             #134 [hci1] 10.732543
      ATT: Prepare Write Response (0x17) len 22
        Handle: 0x0045
        Offset: 0x0144
          Data: 121212121212121212121212121212121212
< HCI Command: Host Number of Com.. (0x03|0x0035) plen 5  #135 [hci1] 10.750403
        Num handles: 1
        Handle: 1353 Address: DF:A9:FF:F6:B1:1A (OUI DF-A9-FF)
        Count: 1
< ACL Data TX: Handle 1353 flags 0x00 dlen 27             #136 [hci1] 10.750532
      ATT: Prepare Write Request (0x16) len 22
        Handle: 0x0045
        Offset: 0x0156
          Data: 121212121212121212121212121212121212
> HCI Event: Number of Completed Packets (0x13) plen 5    #137 [hci1] 10.907147
        Num handles: 1
        Handle: 1353 Address: DF:A9:FF:F6:B1:1A (OUI DF-A9-FF)
        Count: 1
        #136: len 27 (1 Kb/s)
        Latency: 156 msec (79-171 msec ~160 msec)
> ACL Data RX: Handle 1353 flags 0x02 dlen 27             #138 [hci1] 10.907535
      ATT: Prepare Write Response (0x17) len 22
        Handle: 0x0045
        Offset: 0x0156
          Data: 121212121212121212121212121212121212
< HCI Command: Host Number of Com.. (0x03|0x0035) plen 5  #139 [hci1] 10.910321
        Num handles: 1
        Handle: 1353 Address: DF:A9:FF:F6:B1:1A (OUI DF-A9-FF)
        Count: 1
< ACL Data TX: Handle 1353 flags 0x00 dlen 27             #140 [hci1] 10.910364
      ATT: Prepare Write Request (0x16) len 22
        Handle: 0x0045
        Offset: 0x0168
          Data: 121212121212121212121212121212121212
> HCI Event: Number of Completed Packets (0x13) plen 5    #141 [hci1] 11.082238
        Num handles: 1
        Handle: 1353 Address: DF:A9:FF:F6:B1:1A (OUI DF-A9-FF)
        Count: 1
        #140: len 27 (1 Kb/s)
        Latency: 171 msec (79-171 msec ~166 msec)
> ACL Data RX: Handle 1353 flags 0x02 dlen 27             #142 [hci1] 11.082528
      ATT: Prepare Write Response (0x17) len 22
        Handle: 0x0045
        Offset: 0x0168
          Data: 121212121212121212121212121212121212
< HCI Command: Host Number of Com.. (0x03|0x0035) plen 5  #143 [hci1] 11.090342
        Num handles: 1
        Handle: 1353 Address: DF:A9:FF:F6:B1:1A (OUI DF-A9-FF)
        Count: 1
< ACL Data TX: Handle 1353 flags 0x00 dlen 27             #144 [hci1] 11.090364
      ATT: Prepare Write Request (0x16) len 22
        Handle: 0x0045
        Offset: 0x017a
          Data: 121212121212121212121212121212121212
> HCI Event: Number of Completed Packets (0x13) plen 5    #145 [hci1] 11.257188
        Num handles: 1
        Handle: 1353 Address: DF:A9:FF:F6:B1:1A (OUI DF-A9-FF)
        Count: 1
        #144: len 27 (1 Kb/s)
        Latency: 166 msec (79-171 msec ~166 msec)
> ACL Data RX: Handle 1353 flags 0x02 dlen 27             #146 [hci1] 11.257489
      ATT: Prepare Write Response (0x17) len 22
        Handle: 0x0045
        Offset: 0x017a
          Data: 121212121212121212121212121212121212
< HCI Command: Host Number of Com.. (0x03|0x0035) plen 5  #147 [hci1] 11.270326
        Num handles: 1
        Handle: 1353 Address: DF:A9:FF:F6:B1:1A (OUI DF-A9-FF)
        Count: 1
< ACL Data TX: Handle 1353 flags 0x00 dlen 27             #148 [hci1] 11.270343
      ATT: Prepare Write Request (0x16) len 22
        Handle: 0x0045
        Offset: 0x018c
          Data: 121212121212121212121212121212121212
> HCI Event: Number of Completed Packets (0x13) plen 5    #149 [hci1] 11.432171
        Num handles: 1
        Handle: 1353 Address: DF:A9:FF:F6:B1:1A (OUI DF-A9-FF)
        Count: 1
        #148: len 27 (1 Kb/s)
        Latency: 161 msec (79-171 msec ~164 msec)
> ACL Data RX: Handle 1353 flags 0x02 dlen 27             #150 [hci1] 11.432536
      ATT: Prepare Write Response (0x17) len 22
        Handle: 0x0045
        Offset: 0x018c
          Data: 121212121212121212121212121212121212
< HCI Command: Host Number of Com.. (0x03|0x0035) plen 5  #151 [hci1] 11.450343
        Num handles: 1
        Handle: 1353 Address: DF:A9:FF:F6:B1:1A (OUI DF-A9-FF)
        Count: 1
< ACL Data TX: Handle 1353 flags 0x00 dlen 27             #152 [hci1] 11.450377
      ATT: Prepare Write Request (0x16) len 22
        Handle: 0x0045
        Offset: 0x019e
          Data: 121212121212121212121212121212121212
> HCI Event: Number of Completed Packets (0x13) plen 5    #153 [hci1] 11.607091
        Num handles: 1
        Handle: 1353 Address: DF:A9:FF:F6:B1:1A (OUI DF-A9-FF)
        Count: 1
        #152: len 27 (1 Kb/s)
        Latency: 156 msec (79-171 msec ~160 msec)
> ACL Data RX: Handle 1353 flags 0x02 dlen 27             #154 [hci1] 11.607535
      ATT: Prepare Write Response (0x17) len 22
        Handle: 0x0045
        Offset: 0x019e
          Data: 121212121212121212121212121212121212
< HCI Command: Host Number of Com.. (0x03|0x0035) plen 5  #155 [hci1] 11.610357
        Num handles: 1
        Handle: 1353 Address: DF:A9:FF:F6:B1:1A (OUI DF-A9-FF)
        Count: 1
< ACL Data TX: Handle 1353 flags 0x00 dlen 27             #156 [hci1] 11.610378
      ATT: Prepare Write Request (0x16) len 22
        Handle: 0x0045
        Offset: 0x01b0
          Data: 121212121212121212121212121212121212
> HCI Event: Number of Completed Packets (0x13) plen 5    #157 [hci1] 11.782162
        Num handles: 1
        Handle: 1353 Address: DF:A9:FF:F6:B1:1A (OUI DF-A9-FF)
        Count: 1
        #156: len 27 (1 Kb/s)
        Latency: 171 msec (79-171 msec ~166 msec)
> ACL Data RX: Handle 1353 flags 0x02 dlen 27             #158 [hci1] 11.782495
      ATT: Prepare Write Response (0x17) len 22
        Handle: 0x0045
        Offset: 0x01b0
          Data: 121212121212121212121212121212121212
< HCI Command: Host Number of Com.. (0x03|0x0035) plen 5  #159 [hci1] 11.790375
        Num handles: 1
        Handle: 1353 Address: DF:A9:FF:F6:B1:1A (OUI DF-A9-FF)
        Count: 1
< ACL Data TX: Handle 1353 flags 0x00 dlen 27             #160 [hci1] 11.790452
      ATT: Prepare Write Request (0x16) len 22
        Handle: 0x0045
        Offset: 0x01c2
          Data: 121212121212121212121212121212121212
> HCI Event: Number of Completed Packets (0x13) plen 5    #161 [hci1] 11.957130
        Num handles: 1
        Handle: 1353 Address: DF:A9:FF:F6:B1:1A (OUI DF-A9-FF)
        Count: 1
        #160: len 27 (1 Kb/s)
        Latency: 166 msec (79-171 msec ~166 msec)
> ACL Data RX: Handle 1353 flags 0x02 dlen 27             #162 [hci1] 11.957582
      ATT: Prepare Write Response (0x17) len 22
        Handle: 0x0045
        Offset: 0x01c2
          Data: 121212121212121212121212121212121212
< HCI Command: Host Number of Com.. (0x03|0x0035) plen 5  #163 [hci1] 11.970331
        Num handles: 1
        Handle: 1353 Address: DF:A9:FF:F6:B1:1A (OUI DF-A9-FF)
        Count: 1
< ACL Data TX: Handle 1353 flags 0x00 dlen 27             #164 [hci1] 11.970363
      ATT: Prepare Write Request (0x16) len 22
        Handle: 0x0045
        Offset: 0x01d4
          Data: 121212121212121212121212121212121212
> HCI Event: Number of Completed Packets (0x13) plen 5    #165 [hci1] 12.132184
        Num handles: 1
        Handle: 1353 Address: DF:A9:FF:F6:B1:1A (OUI DF-A9-FF)
        Count: 1
        #164: len 27 (1 Kb/s)
        Latency: 161 msec (79-171 msec ~164 msec)
> ACL Data RX: Handle 1353 flags 0x02 dlen 27             #166 [hci1] 12.132542
      ATT: Prepare Write Response (0x17) len 22
        Handle: 0x0045
        Offset: 0x01d4
          Data: 121212121212121212121212121212121212
< HCI Command: Host Number of Com.. (0x03|0x0035) plen 5  #167 [hci1] 12.150325
        Num handles: 1
        Handle: 1353 Address: DF:A9:FF:F6:B1:1A (OUI DF-A9-FF)
        Count: 1
< ACL Data TX: Handle 1353 flags 0x00 dlen 27             #168 [hci1] 12.150365
      ATT: Prepare Write Request (0x16) len 22
        Handle: 0x0045
        Offset: 0x01e6
          Data: 121212121212121212121212121212121212
> HCI Event: Number of Completed Packets (0x13) plen 5    #169 [hci1] 12.307132
        Num handles: 1
        Handle: 1353 Address: DF:A9:FF:F6:B1:1A (OUI DF-A9-FF)
        Count: 1
        #168: len 27 (1 Kb/s)
        Latency: 156 msec (79-171 msec ~160 msec)
> ACL Data RX: Handle 1353 flags 0x02 dlen 27             #170 [hci1] 12.307549
      ATT: Prepare Write Response (0x17) len 22
        Handle: 0x0045
        Offset: 0x01e6
          Data: 121212121212121212121212121212121212
< HCI Command: Host Number of Com.. (0x03|0x0035) plen 5  #171 [hci1] 12.310329
        Num handles: 1
        Handle: 1353 Address: DF:A9:FF:F6:B1:1A (OUI DF-A9-FF)
        Count: 1
< ACL Data TX: Handle 1353 flags 0x00 dlen 17             #172 [hci1] 12.310349
      ATT: Prepare Write Request (0x16) len 12
        Handle: 0x0045
        Offset: 0x01f8
          Data: 1212121212121212
> HCI Event: Number of Completed Packets (0x13) plen 5    #173 [hci1] 12.482089
        Num handles: 1
        Handle: 1353 Address: DF:A9:FF:F6:B1:1A (OUI DF-A9-FF)
        Count: 1
        #172: len 17 (0 Kb/s)
        Latency: 171 msec (79-171 msec ~166 msec)
> ACL Data RX: Handle 1353 flags 0x02 dlen 17             #174 [hci1] 12.482318
      ATT: Prepare Write Response (0x17) len 12
        Handle: 0x0045
        Offset: 0x01f8
          Data: 1212121212121212
< HCI Command: Host Number of Com.. (0x03|0x0035) plen 5  #175 [hci1] 12.490348
        Num handles: 1
        Handle: 1353 Address: DF:A9:FF:F6:B1:1A (OUI DF-A9-FF)
        Count: 1
< ACL Data TX: Handle 1353 flags 0x00 dlen 6              #176 [hci1] 12.490354
      ATT: Execute Write Request (0x18) len 1
        Flags: Immediately write all pending values (0x01)
> HCI Event: Number of Completed Packets (0x13) plen 5    #177 [hci1] 12.656952
        Num handles: 1
        Handle: 1353 Address: DF:A9:FF:F6:B1:1A (OUI DF-A9-FF)
        Count: 1
        #176: len 6 (0 Kb/s)
        Latency: 166 msec (79-171 msec ~166 msec)
> ACL Data RX: Handle 1353 flags 0x02 dlen 5              #178 [hci1] 12.657135
      ATT: Execute Write Response (0x19) len 0
< HCI Command: Host Number of Com.. (0x03|0x0035) plen 5  #179 [hci1] 12.670377
        Num handles: 1
        Handle: 1353 Address: DF:A9:FF:F6:B1:1A (OUI DF-A9-FF)
        Count: 1
> HCI Event: Disconnect Complete (0x05) plen 4            #180 [hci1] 15.194618
        Status: Success (0x00)
        Handle: 1353 Address: DF:A9:FF:F6:B1:1A (OUI DF-A9-FF)
        Reason: Remote User Terminated Connection (0x13)
< HCI Command: Reset (0x03|0x0003) plen 0                 #181 [hci1] 22.210484
> HCI Event: Command Complete (0x0e) plen 4               #182 [hci1] 22.211041
      Reset (0x03|0x0003) ncmd 1
        Status: Success (0x00)
@ USER Close: main                                    {0x0001} [hci1] 22.230357
= Close Index: 00:00:00:00:00:00                               [hci1] 22.230365
