Bluetooth monitor ver 5.72
btmon[2714358]: = Note: Linux version 6.14.0-36-generic (x86_64)                                                         0.940013
btmon[2714358]: = Note: Bluetooth subsystem version 2.22                                                                 0.940016
= New Index: 00:00:00:00:00:00 (Primary,UART,hci1)                                                                       0.940016
= New Index: 48:5F:99:8E:E0:64 (Primary,USB,hci0)                                                                        0.940017
= Open Index: 00:00:00:00:00:00                                                                                          0.953241
= Index Info: 00:00:00:00:00:00 (Nordic Semiconductor ASA)                                                               0.953247
zephyr.exe[2714360]: @ USER Open: main (privileged) version 2.22                                                {0x0001} 0.953252
zephyr.exe[2714360]: < HCI Command: Reset (0x03|0x0003) plen 0                                                        #1 0.953611
> HCI Event: Command Complete (0x0e) plen 4                                                                           #2 0.954053
      Reset (0x03|0x0003) ncmd 1
        Status: Success (0x00)
zephyr.exe[2714360]: < HCI Command: Read Local Supported Features (0x04|0x0003) plen 0                                #3 0.973164
> HCI Event: Command Complete (0x0e) plen 12                                                                          #4 0.973741
      Read Local Supported Features (0x04|0x0003) ncmd 1
        Status: Success (0x00)
        Features: 0x00 0x00 0x00 0x00 0x60 0x00 0x00 0x00
          BR/EDR Not Supported
          LE Supported (Controller)
zephyr.exe[2714360]: < HCI Command: Read Local Version Information (0x04|0x0001) plen 0                               #5 0.993129
> HCI Event: Command Complete (0x0e) plen 12                                                                          #6 0.993710
      Read Local Version Information (0x04|0x0001) ncmd 1
        Status: Success (0x00)
        HCI version: Reserved (0x0f) - Revision 12393 (0x3069)
        LMP version: Reserved (0x0f) - Subversion 12393 (0x3069)
        Manufacturer: Nordic Semiconductor ASA (89)
zephyr.exe[2714360]: < HCI Command: Read Local Supported Commands (0x04|0x0002) plen 0                                #7 1.013159
> HCI Event: Command Complete (0x0e) plen 68                                                                          #8 1.014266
      Read Local Supported Commands (0x04|0x0002) ncmd 1
        Status: Success (0x00)
        Commands: 119 entries
          Disconnect (Octet 0 - Bit 5)
          Read Remote Version Information (Octet 2 - Bit 7)
          Set Event Mask (Octet 5 - Bit 6)
          Reset (Octet 5 - Bit 7)
          Read Connection Accept Timeout (Octet 7 - Bit 2)
          Write Connection Accept Timeout (Octet 7 - Bit 3)
          Read Transmit Power Level (Octet 10 - Bit 2)
          Set Controller To Host Flow Control (Octet 10 - Bit 5)
          Host Buffer Size (Octet 10 - Bit 6)
          Host Number of Completed Packets (Octet 10 - Bit 7)
          Read Local Version Information (Octet 14 - Bit 3)
          Read Local Supported Features (Octet 14 - Bit 5)
          Read BD ADDR (Octet 15 - Bit 1)
          Read RSSI (Octet 15 - Bit 5)
          Set Event Mask Page 2 (Octet 22 - Bit 2)
          LE Set Event Mask (Octet 25 - Bit 0)
          LE Read Buffer Size (Octet 25 - Bit 1)
          LE Read Local Supported Features (Octet 25 - Bit 2)
          LE Set Random Address (Octet 25 - Bit 4)
          LE Set Advertising Parameters (Octet 25 - Bit 5)
          LE Read Advertising Channel TX Power (Octet 25 - Bit 6)
          LE Set Advertising Data (Octet 25 - Bit 7)
          LE Set Scan Response Data (Octet 26 - Bit 0)
          LE Set Advertise Enable (Octet 26 - Bit 1)
          LE Set Scan Parameters (Octet 26 - Bit 2)
          LE Set Scan Enable (Octet 26 - Bit 3)
          LE Create Connection (Octet 26 - Bit 4)
          LE Create Connection Cancel (Octet 26 - Bit 5)
          LE Read Accept List Size (Octet 26 - Bit 6)
          LE Clear Accept List (Octet 26 - Bit 7)
          LE Add Device To Accept List (Octet 27 - Bit 0)
          LE Remove Device From Accept List (Octet 27 - Bit 1)
          LE Connection Update (Octet 27 - Bit 2)
          LE Set Host Channel Classification (Octet 27 - Bit 3)
          LE Read Channel Map (Octet 27 - Bit 4)
          LE Read Remote Used Features (Octet 27 - Bit 5)
          LE Encrypt (Octet 27 - Bit 6)
          LE Rand (Octet 27 - Bit 7)
          LE Start Encryption (Octet 28 - Bit 0)
          LE Long Term Key Request Reply (Octet 28 - Bit 1)
          LE Long Term Key Request Neg Reply (Octet 28 - Bit 2)
          LE Read Supported States (Octet 28 - Bit 3)
          LE Receiver Test (Octet 28 - Bit 4)
          LE Transmitter Test (Octet 28 - Bit 5)
          LE Test End (Octet 28 - Bit 6)
          Read Authenticated Payload Timeout (Octet 32 - Bit 4)
          Write Authenticated Payload Timeout (Octet 32 - Bit 5)
          LE Set Data Length (Octet 33 - Bit 6)
          LE Read Suggested Default Data Length (Octet 33 - Bit 7)
          LE Write Suggested Default Data Length (Octet 34 - Bit 0)
          LE Add Device To Resolving List (Octet 34 - Bit 3)
          LE Remove Device From Resolving List (Octet 34 - Bit 4)
          LE Clear Resolving List (Octet 34 - Bit 5)
          LE Read Resolving List Size (Octet 34 - Bit 6)
          LE Set Address Resolution Enable (Octet 35 - Bit 1)
          LE Set Resolvable Private Address Timeout (Octet 35 - Bit 2)
          LE Read Maximum Data Length (Octet 35 - Bit 3)
          LE Read PHY (Octet 35 - Bit 4)
          LE Set Default PHY (Octet 35 - Bit 5)
          LE Set PHY (Octet 35 - Bit 6)
          LE Enhanced Receiver Test (Octet 35 - Bit 7)
          LE Enhanced Transmitter Test (Octet 36 - Bit 0)
          LE Set Advertising Set Random Address (Octet 36 - Bit 1)
          LE Set Extended Advertising Parameters (Octet 36 - Bit 2)
          LE Set Extended Advertising Data (Octet 36 - Bit 3)
          LE Set Extended Scan Response Data (Octet 36 - Bit 4)
          LE Set Extended Advertising Enable (Octet 36 - Bit 5)
          LE Read Maximum Advertising Data Length (Octet 36 - Bit 6)
          LE Read Number of Supported Advertising Sets (Octet 36 - Bit 7)
          LE Remove Advertising Set (Octet 37 - Bit 0)
          LE Clear Advertising Sets (Octet 37 - Bit 1)
          LE Set Periodic Advertising Parameters (Octet 37 - Bit 2)
          LE Set Periodic Advertising Data (Octet 37 - Bit 3)
          LE Set Periodic Advertising Enable (Octet 37 - Bit 4)
          LE Set Extended Scan Parameters (Octet 37 - Bit 5)
          LE Set Extended Scan Enable (Octet 37 - Bit 6)
          LE Extended Create Connection (Octet 37 - Bit 7)
          LE Periodic Advertising Create Sync (Octet 38 - Bit 0)
          LE Periodic Advertising Create Sync Cancel (Octet 38 - Bit 1)
          LE Periodic Advertising Terminate Sync (Octet 38 - Bit 2)
          LE Add Device To Periodic Advertiser List (Octet 38 - Bit 3)
          LE Remove Device From Periodic Advertiser List (Octet 38 - Bit 4)
          LE Clear Periodic Advertiser List (Octet 38 - Bit 5)
          LE Read Periodic Advertiser List Size (Octet 38 - Bit 6)
          LE Read Transmit Power (Octet 38 - Bit 7)
          LE Read RF Path Compensation (Octet 39 - Bit 0)
          LE Write RF Path Compensation (Octet 39 - Bit 1)
          LE Set Privacy Mode (Octet 39 - Bit 2)
          LE Periodic Advertising Receive Enable (Octet 40 - Bit 5)
          LE Periodic Advertising Sync Transfer (Octet 40 - Bit 6)
          LE Periodic Advertising Set Info Transfer (Octet 40 - Bit 7)
          LE Periodic Advertising Sync Transfer Parameters (Octet 41 - Bit 0)
          LE Set Default Periodic Advertisng Sync Transfer Parameters (Octet 41 - Bit 1)
          LE Read Buffer v2 (Octet 41 - Bit 5)
          LE Read ISO TX Sync (Octet 41 - Bit 6)
          LE Set Connected Isochronous Group Parameters (Octet 41 - Bit 7)
          LE Set Connected Isochronous Group Parameters Test (Octet 42 - Bit 0)
          LE Create Connected Isochronous Stream (Octet 42 - Bit 1)
          LE Remove Connected Isochronous Group (Octet 42 - Bit 2)
          LE Accept Connected Isochronous Stream Request (Octet 42 - Bit 3)
          LE Reject Connected Isochronous Stream Request (Octet 42 - Bit 4)
          LE Create Broadcast Isochronous Group (Octet 42 - Bit 5)
          LE Create Broadcast Isochronous Group Test (Octet 42 - Bit 6)
          LE Terminate Broadcast Isochronous Group (Octet 42 - Bit 7)
          LE Broadcast Isochronous Group Create Sync (Octet 43 - Bit 0)
          LE Broadcast Isochronous Group Terminate Sync (Octet 43 - Bit 1)
          LE Request Peer SCA (Octet 43 - Bit 2)
          LE Setup Isochronous Data Path (Octet 43 - Bit 3)
          LE Remove Isochronous Data Path (Octet 43 - Bit 4)
          LE Isochronous Transmit Test (Octet 43 - Bit 5)
          LE Isochronous Receive Test (Octet 43 - Bit 6)
          LE Isochronous Read Test Counters (Octet 43 - Bit 7)
          LE Isochronous Read Test Counters (Octet 44 - Bit 0)
          LE Set Host Feature (Octet 44 - Bit 1)
          Octet 44 - Bit 2 
          Octet 45 - Bit 6 
          Octet 46 - Bit 0 
          Octet 46 - Bit 1 
          Octet 46 - Bit 2 
zephyr.exe[2714360]: < HCI Command: Host Buffer Size (0x03|0x0033) plen 7                                             #9 1.033173
        ACL MTU: 255  ACL max packet: 16
        SCO MTU: 0    SCO max packet: 0
> HCI Event: Command Complete (0x0e) plen 4                                                                          #10 1.033609
      Host Buffer Size (0x03|0x0033) ncmd 1
        Status: Success (0x00)
zephyr.exe[2714360]: < HCI Command: Set Controller To Host Flow Control (0x03|0x0031) plen 1                         #11 1.053130
        Flow control: ACL Data Packets (0x01)
> HCI Event: Command Complete (0x0e) plen 4                                                                          #12 1.053524
      Set Controller To Host Flow Control (0x03|0x0031) ncmd 1
        Status: Success (0x00)
zephyr.exe[2714360]: < HCI Command: LE Read Local Supported Features (0x08|0x0003) plen 0                            #13 1.073159
> HCI Event: Command Complete (0x0e) plen 12                                                                         #14 1.073726
      LE Read Local Supported Features (0x08|0x0003) ncmd 1
        Status: Success (0x00)
        Features: 0xfd 0x79 0x00 0xf7 0x30 0x01 0x00 0x00
          LE Encryption
          Extended Reject Indication
          Peripheral-initiated Features Exchange
          LE Ping
          LE Data Packet Length Extension
          LL Privacy
          Extended Scanner Filter Policies
          LE 2M PHY
          LE Coded PHY
          LE Extended Advertising
          LE Periodic Advertising
          Channel Selection Algorithm #2
          Periodic Advertising Sync Transfer - Sender
          Periodic Advertising Sync Transfer - Recipient
          Sleep Clock Accuracy Updates
          Connected Isochronous Stream - Central
          Connected Isochronous Stream - Peripheral
          Isochronous Broadcaster
          Synchronized Receiver
          Periodic Advertising ADI support
          Connection Subrating
          Unknown features (0x0000010000000000)
zephyr.exe[2714360]: < HCI Command: LE Set Host Feature (0x08|0x0074) plen 2                                         #15 1.093143
        Bit Number: 32
          Connected Isochronous Stream (Host Support)
        Bit Value: 1
> HCI Event: Command Complete (0x0e) plen 4                                                                          #16 1.093541
      LE Set Host Feature (0x08|0x0074) ncmd 1
        Status: Success (0x00)
zephyr.exe[2714360]: < HCI Command: LE Read Buffer v2 (0x08|0x0060) plen 0                                           #17 1.113165
> HCI Event: Command Complete (0x0e) plen 10                                                                         #18 1.113659
      LE Read Buffer v2 (0x08|0x0060) ncmd 1
        Status: Success (0x00)
        ACL MTU: 27
        ACL max packet: 3
        ISO MTU: 318
        ISO max packet: 3
zephyr.exe[2714360]: < HCI Command: LE Read Maximum Advertising Data Length (0x08|0x003a) plen 0                     #19 1.133151
> HCI Event: Command Complete (0x0e) plen 6                                                                          #20 1.133664
      LE Read Maximum Advertising Data Length (0x08|0x003a) ncmd 1
        Status: Success (0x00)
        Max length: 1650
zephyr.exe[2714360]: < HCI Command: LE Read Supported States (0x08|0x001c) plen 0                                    #21 1.153143
> HCI Event: Command Complete (0x0e) plen 12                                                                         #22 1.153732
      LE Read Supported States (0x08|0x001c) ncmd 1
        Status: Success (0x00)
        States: 0x000003ff3e0306ff
          Non-connectable Advertising State
          Scannable Advertising State
          Connectable Advertising State
          High Duty Cycle Directed Advertising State
          Passive Scanning State
          Active Scanning State
          Initiating State
            and Connection State (Central Role)
          Connection State (Peripheral Role)
          Scannable Advertising State
            and Passive Scanning State
          Connectable Advertising State
            and Passive Scanning State
          Non-connectable Advertising State
            and Initiating State
          Scannable Advertising State
            and Initiating State
          Active Scanning State
            and Connection State (Central Role)
          Passive Scanning State
            and Connection State (Peripheral Role)
          Active Scanning State
            and Connection State (Peripheral Role)
          Initiating State
            and Connection State (Central Role)
            and Central Role & Central Role
          Low Duty Cycle Directed Advertising State
          Connectable Advertising State
            and Initiating State
            and Central Role & Peripheral Role
          High Duty Cycle Directed Advertising State
            and Initiating State
            and Central Role & Peripheral Role
          Low Duty Cycle Directed Advertising State
            and Initiating State
            and Central Role & Peripheral Role
          Connectable Advertising State
            and Connection State (Central Role)
            and Central Role & Peripheral Role
          High Duty Cycle Directed Advertising State
            and Connection State (Central Role)
            and Central Role & Peripheral Role
          Low Duty Cycle Directed Advertising State
            and Connection State (Central Role)
            and Central Role & Peripheral Role
          Connectable Advertising State
            and Connection State (Peripheral Role)
            and Central Role & Peripheral Role
          High Duty Cycle Directed Advertising State
            and Connection State (Peripheral Role)
            and Peripheral Role & Peripheral Role
          Low Duty Cycle Directed Advertising State
            and Connection State (Peripheral Role)
            and Peripheral Role & Peripheral Role
          Initiating State
            and Connection State (Peripheral Role)
            and Central Role & Peripheral Role
zephyr.exe[2714360]: < HCI Command: LE Read Maximum Data Length (0x08|0x002f) plen 0                                 #23 1.173161
> HCI Event: Command Complete (0x0e) plen 12                                                                         #24 1.173647
      LE Read Maximum Data Length (0x08|0x002f) ncmd 1
        Status: Success (0x00)
        Max TX octets: 251
        Max TX time: 2704
        Max RX octets: 251
        Max RX time: 2704
zephyr.exe[2714360]: < HCI Command: LE Write Suggested Default Data Length (0x08|0x0024) plen 4                      #25 1.193130
        TX octets: 251
        TX time: 2704
> HCI Event: Command Complete (0x0e) plen 4                                                                          #26 1.193585
      LE Write Suggested Default Data Length (0x08|0x0024) ncmd 1
        Status: Success (0x00)
zephyr.exe[2714360]: < HCI Command: LE Read Resolving List Size (0x08|0x002a) plen 0                                 #27 1.213164
> HCI Event: Command Complete (0x0e) plen 5                                                                          #28 1.213632
      LE Read Resolving List Size (0x08|0x002a) ncmd 1
        Status: Success (0x00)
        Size: 8
zephyr.exe[2714360]: < HCI Command: LE Set Event Mask (0x08|0x0001) plen 8                                           #29 1.233124
        Mask: 0x000002023f87fa5e
          LE Advertising Report
          LE Connection Update Complete
          LE Read Remote Used Features Complete
          LE Long Term Key Request
          LE Data Length Change
          LE Enhanced Connection Complete
          LE PHY Update Complete
          LE Extended Advertising Report
          LE Periodic Advertising Sync Established
          LE Periodic Advertising Report
          LE Periodic Advertising Sync Lost
          LE Extended Scan Timeout
          LE Extended Advertising Set Terminated
          LE Scan Request Received
          LE Periodic Advertising Sync Transfer Rvc
          LE CIS Established
          LE CIS Request
          LE Create BIG Complete
          LE Terminate BIG Complete
          LE BIG Sync Estabilished Complete
          LE BIG Sync Lost
          LE BIG Info Advertising Report
          Unknown mask (0x0000020000000000)
> HCI Event: Command Complete (0x0e) plen 4                                                                          #30 1.233729
      LE Set Event Mask (0x08|0x0001) ncmd 1
        Status: Success (0x00)
zephyr.exe[2714360]: < HCI Command: Set Event Mask (0x03|0x0001) plen 8                                              #31 1.253159
        Mask: 0x2000800002008890
          Disconnection Complete
          Encryption Change
          Read Remote Version Information Complete
          Hardware Error
          Data Buffer Overflow
          Encryption Key Refresh Complete
          LE Meta
> HCI Event: Command Complete (0x0e) plen 4                                                                          #32 1.253745
      Set Event Mask (0x03|0x0001) ncmd 1
        Status: Success (0x00)
zephyr.exe[2714360]: < HCI Command: Read BD ADDR (0x04|0x0009) plen 0                                                #33 1.273175
> HCI Event: Command Complete (0x0e) plen 10                                                                         #34 1.273669
      Read BD ADDR (0x04|0x0009) ncmd 1
        Status: Success (0x00)
        Address: 00:00:00:00:00:00 (OUI 00-00-00)
zephyr.exe[2714360]: < HCI Command: LE Set Random Address (0x08|0x0005) plen 6                                       #35 1.293172
        Address: D5:B6:CC:31:DB:3B (Static)
> HCI Event: Command Complete (0x0e) plen 4                                                                          #36 1.293738
      LE Set Random Address (0x08|0x0005) ncmd 1
        Status: Success (0x00)
zephyr.exe[2714360]: < HCI Command: LE Set Extended Advertising Parameters (0x08|0x0036) plen 25                     #37 5.243250
        Handle: 0x00
        Properties: 0x0013
          Connectable
          Scannable
          Use legacy advertising PDUs: ADV_IND
        Min advertising interval: 100.000 msec (0x00a0)
        Max advertising interval: 150.000 msec (0x00f0)
        Channel map: 37, 38, 39 (0x07)
        Own address type: Random (0x01)
        Peer address type: Public (0x00)
        Peer address: 00:00:00:00:00:00 (OUI 00-00-00)
        Filter policy: Allow Scan Request from Any, Allow Connect Request from Any (0x00)
        TX power: Host has no preference (0x7f)
        Primary PHY: LE 1M (0x01)
        Secondary max skip: 0x00
        Secondary PHY: LE 1M (0x01)
        SID: 0x00
        Scan request notifications: Disabled (0x00)
> HCI Event: Command Complete (0x0e) plen 5                                                                          #38 5.244080
      LE Set Extended Advertising Parameters (0x08|0x0036) ncmd 1
        Status: Success (0x00)
        TX power (selected): 0 dbm (0x00)
zephyr.exe[2714360]: < HCI Command: LE Set Advertising Set Random Address (0x08|0x0035) plen 7                       #39 5.253294
        Advertising handle: 0x00
        Advertising random address: D5:B6:CC:31:DB:3B (Static)
> HCI Event: Command Complete (0x0e) plen 4                                                                          #40 5.253830
      LE Set Advertising Set Random Address (0x08|0x0035) ncmd 1
        Status: Success (0x00)
zephyr.exe[2714360]: < HCI Command: LE Set Extended Advertising Data (0x08|0x0037) plen 22                           #41 5.273244
        Handle: 0x00
        Operation: Complete extended advertising data (0x03)
        Fragment preference: Minimize fragmentation (0x01)
        Data length: 0x12
        Flags: 0x04
          BR/EDR Not Supported
        Name (complete): Tester_F6B11A
> HCI Event: Command Complete (0x0e) plen 4                                                                          #42 5.273985
      LE Set Extended Advertising Data (0x08|0x0037) ncmd 1
        Status: Success (0x00)
zephyr.exe[2714360]: < HCI Command: LE Set Extended Scan Response Data (0x08|0x0038) plen 4                          #43 5.293183
        Handle: 0x00
        Operation: Complete scan response data (0x03)
        Fragment preference: Minimize fragmentation (0x01)
        Data length: 0x00
> HCI Event: Command Complete (0x0e) plen 4                                                                          #44 5.293607
      LE Set Extended Scan Response Data (0x08|0x0038) ncmd 1
        Status: Success (0x00)
zephyr.exe[2714360]: < HCI Command: LE Set Extended Advertising Enable (0x08|0x0039) plen 6                          #45 5.313230
        Extended advertising: Enabled (0x01)
        Number of sets: 1 (0x01)
        Entry 0
          Handle: 0x00
          Duration: 0 ms (0x00)
          Max ext adv events: 0
> HCI Event: Command Complete (0x0e) plen 4                                                                          #46 5.313889
      LE Set Extended Advertising Enable (0x08|0x0039) ncmd 1
        Status: Success (0x00)
> HCI Event: LE Meta Event (0x3e) plen 31                                                                            #47 5.528671
      LE Enhanced Connection Complete (0x0a)
        Status: Success (0x00)
        Handle: 237
        Role: Peripheral (0x01)
        Peer address type: Public (0x00)
        Peer address: DF:A9:FF:F6:B1:1A (OUI DF-A9-FF)
        Local resolvable private address: 00:00:00:00:00:00 (Non-Resolvable)
        Peer resolvable private address: 00:00:00:00:00:00 (Non-Resolvable)
        Connection interval: 87.50 msec (0x0046)
        Connection latency: 0 (0x0000)
        Supervision timeout: 20000 msec (0x07d0)
        Central clock accuracy: 0x01
> HCI Event: LE Meta Event (0x3e) plen 6                                                                             #48 5.528854
      LE Advertising Set Terminated (0x12)
        Status: Success (0x00)
        Handle: 0
        Connection handle: 237
        Number of completed extended advertising events: 0
zephyr.exe[2714360]: < HCI Command: LE Read Remote Used Features (0x08|0x0016) plen 2                                #49 5.534145
        Handle: 237 Address: DF:A9:FF:F6:B1:1A (OUI DF-A9-FF)
> HCI Event: Command Status (0x0f) plen 4                                                                            #50 5.534572
      LE Read Remote Used Features (0x08|0x0016) ncmd 1
        Status: Success (0x00)
> HCI Event: LE Meta Event (0x3e) plen 12                                                                            #51 5.792503
      LE Read Remote Used Features (0x04)
        Status: Success (0x00)
        Handle: 237 Address: DF:A9:FF:F6:B1:1A (OUI DF-A9-FF)
        Features: 0x2d 0x49 0x00 0xf7 0x67 0xd8 0x00 0x00
          LE Encryption
          Extended Reject Indication
          Peripheral-initiated Features Exchange
          LE Data Packet Length Extension
          LE 2M PHY
          LE Coded PHY
          Channel Selection Algorithm #2
          Periodic Advertising Sync Transfer - Sender
          Periodic Advertising Sync Transfer - Recipient
          Sleep Clock Accuracy Updates
          Connected Isochronous Stream - Central
          Connected Isochronous Stream - Peripheral
          Isochronous Broadcaster
          Synchronized Receiver
          Connected Isochronous Stream (Host Support)
          LE Power Control Request
          LE Power Control Request
          Connection Subrating
          Connection Subrating (Host Support)
          Unknown features (0x0000d80000000000)
zephyr.exe[2714360]: < ACL Data TX: Handle 237 flags 0x00 dlen 6                                                     #52 6.353946
      SMP: Security Request (0x0b) len 1
        Authentication requirement: Bonding, No MITM, SC, No Keypresses (0x09)
> HCI Event: Number of Completed Packets (0x13) plen 5                                                               #53 6.492207
        Num handles: 1
        Handle: 237 Address: DF:A9:FF:F6:B1:1A (OUI DF-A9-FF)
        Count: 1
        #52: len 6 (0 Kb/s)
        Latency: 138 msec (138-138 msec ~138 msec)
> ACL Data RX: Handle 237 flags 0x02 dlen 11                                                                         #54 6.492403
      SMP: Pairing Request (0x01) len 6
        IO capability: KeyboardDisplay (0x04)
        OOB data: Authentication data not present (0x00)
        Authentication requirement: Bonding, No MITM, Legacy, No Keypresses (0x01)
        Max encryption key size: 16
        Initiator key distribution: EncKey (0x01)
        Responder key distribution: EncKey (0x01)
zephyr.exe[2714360]: < HCI Command: Host Number of Completed Packets (0x03|0x0035) plen 5                            #55 6.493878
        Num handles: 1
        Handle: 237 Address: DF:A9:FF:F6:B1:1A (OUI DF-A9-FF)
        Count: 1
zephyr.exe[2714360]: < ACL Data TX: Handle 237 flags 0x00 dlen 11                                                    #56 6.493906
      SMP: Pairing Response (0x02) len 6
        IO capability: KeyboardDisplay (0x04)
        OOB data: Authentication data not present (0x00)
        Authentication requirement: Bonding, No MITM, Legacy, No Keypresses (0x01)
        Max encryption key size: 16
        Initiator key distribution: EncKey (0x01)
        Responder key distribution: EncKey (0x01)
> HCI Event: Number of Completed Packets (0x13) plen 5                                                               #57 6.667281
        Num handles: 1
        Handle: 237 Address: DF:A9:FF:F6:B1:1A (OUI DF-A9-FF)
        Count: 1
        #56: len 11 (0 Kb/s)
        Latency: 173 msec (138-173 msec ~155 msec)
> ACL Data RX: Handle 237 flags 0x02 dlen 21                                                                         #58 6.667554
      SMP: Pairing Confirm (0x03) len 16
        Confim value: 4ffe2dc525cd0b4dd2a9908054f3ea76
zephyr.exe[2714360]: < HCI Command: Host Number of Completed Packets (0x03|0x0035) plen 5                            #59 6.674090
        Num handles: 1
        Handle: 237 Address: DF:A9:FF:F6:B1:1A (OUI DF-A9-FF)
        Count: 1
zephyr.exe[2714360]: < ACL Data TX: Handle 237 flags 0x00 dlen 21                                                    #60 6.674177
      SMP: Pairing Confirm (0x03) len 16
        Confim value: 635dfee216fe2d3f979eb102416e1021
> HCI Event: Number of Completed Packets (0x13) plen 5                                                               #61 6.842296
        Num handles: 1
        Handle: 237 Address: DF:A9:FF:F6:B1:1A (OUI DF-A9-FF)
        Count: 1
        #60: len 21 (1 Kb/s)
        Latency: 168 msec (138-173 msec ~161 msec)
> ACL Data RX: Handle 237 flags 0x02 dlen 21                                                                         #62 6.842631
      SMP: Pairing Random (0x04) len 16
        Random value: 32b311a2aa65f75fb6cf36b0394b9579
zephyr.exe[2714360]: < HCI Command: Host Number of Completed Packets (0x03|0x0035) plen 5                            #63 6.854198
        Num handles: 1
        Handle: 237 Address: DF:A9:FF:F6:B1:1A (OUI DF-A9-FF)
        Count: 1
zephyr.exe[2714360]: < ACL Data TX: Handle 237 flags 0x00 dlen 21                                                    #64 6.854305
      SMP: Pairing Random (0x04) len 16
        Random value: 8e6108f966a694cbe26df70bb96773e6
> HCI Event: Number of Completed Packets (0x13) plen 5                                                               #65 7.017069
        Num handles: 1
        Handle: 237 Address: DF:A9:FF:F6:B1:1A (OUI DF-A9-FF)
        Count: 1
        #64: len 21 (1 Kb/s)
        Latency: 162 msec (138-173 msec ~162 msec)
> HCI Event: LE Meta Event (0x3e) plen 13                                                                            #66 7.105204
      LE Long Term Key Request (0x05)
        Handle: 237 Address: DF:A9:FF:F6:B1:1A (OUI DF-A9-FF)
        Random number: 0x0000000000000000
        Encrypted diversifier: 0x0000
zephyr.exe[2714360]: < HCI Command: LE Long Term Key Request Reply (0x08|0x001a) plen 18                             #67 7.113587
        Handle: 237 Address: DF:A9:FF:F6:B1:1A (OUI DF-A9-FF)
        Long term key: 465cf51e5ab462b086bd09affbc576a8
> HCI Event: Command Complete (0x0e) plen 6                                                                          #68 7.114369
      LE Long Term Key Request Reply (0x08|0x001a) ncmd 1
        Status: Success (0x00)
        Handle: 237 Address: DF:A9:FF:F6:B1:1A (OUI DF-A9-FF)
> HCI Event: Encryption Change (0x08) plen 4                                                                         #69 7.542376
        Status: Success (0x00)
        Handle: 237 Address: DF:A9:FF:F6:B1:1A (OUI DF-A9-FF)
        Encryption: Enabled with AES-CCM (0x01)
zephyr.exe[2714360]: < ACL Data TX: Handle 237 flags 0x00 dlen 21                                                    #70 7.663902
      SMP: Encryption Information (0x06) len 16
        Long term key: 5da095555cc64d02679f89a05211af56
zephyr.exe[2714360]: < ACL Data TX: Handle 237 flags 0x00 dlen 15                                                    #71 7.663928
      SMP: Central Identification (0x07) len 10
        EDIV: 0x825e
        Rand: 0x84c81ed264dab3d8
> HCI Event: Number of Completed Packets (0x13) plen 5                                                               #72 7.717657
        Num handles: 1
        Handle: 237 Address: DF:A9:FF:F6:B1:1A (OUI DF-A9-FF)
        Count: 1
        #70: len 21 (3 Kb/s)
        Latency: 53 msec (53-173 msec ~108 msec)
> HCI Event: Number of Completed Packets (0x13) plen 5                                                               #73 7.804847
        Num handles: 1
        Handle: 237 Address: DF:A9:FF:F6:B1:1A (OUI DF-A9-FF)
        Count: 1
        #71: len 15 (0 Kb/s)
        Latency: 140 msec (53-173 msec ~124 msec)
> ACL Data RX: Handle 237 flags 0x02 dlen 21                                                                         #74 7.805059
      SMP: Encryption Information (0x06) len 16
        Long term key: 0f71513df1057873b2a137405600a734
zephyr.exe[2714360]: < HCI Command: Host Number of Completed Packets (0x03|0x0035) plen 5                            #75 7.813536
        Num handles: 1
        Handle: 237 Address: DF:A9:FF:F6:B1:1A (OUI DF-A9-FF)
        Count: 1
> ACL Data RX: Handle 237 flags 0x02 dlen 15                                                                         #76 7.892399
      SMP: Central Identification (0x07) len 10
        EDIV: 0x94ee
        Rand: 0xa995cca549bf69b8
zephyr.exe[2714360]: < HCI Command: Host Number of Completed Packets (0x03|0x0035) plen 5                            #77 7.893798
        Num handles: 1
        Handle: 237 Address: DF:A9:FF:F6:B1:1A (OUI DF-A9-FF)
        Count: 1
> HCI Event: Disconnect Complete (0x05) plen 4                                                                       #78 8.679943
        Status: Success (0x00)
        Handle: 237 Address: DF:A9:FF:F6:B1:1A (OUI DF-A9-FF)
        Reason: Remote User Terminated Connection (0x13)
zephyr.exe[2714360]: < HCI Command: LE Set Extended Advertising Parameters (0x08|0x0036) plen 25                     #79 9.373372
        Handle: 0x00
        Properties: 0x0013
          Connectable
          Scannable
          Use legacy advertising PDUs: ADV_IND
        Min advertising interval: 100.000 msec (0x00a0)
        Max advertising interval: 150.000 msec (0x00f0)
        Channel map: 37, 38, 39 (0x07)
        Own address type: Random (0x01)
        Peer address type: Public (0x00)
        Peer address: 00:00:00:00:00:00 (OUI 00-00-00)
        Filter policy: Allow Scan Request from Any, Allow Connect Request from Any (0x00)
        TX power: Host has no preference (0x7f)
        Primary PHY: LE 1M (0x01)
        Secondary max skip: 0x00
        Secondary PHY: LE 1M (0x01)
        SID: 0x00
        Scan request notifications: Disabled (0x00)
> HCI Event: Command Complete (0x0e) plen 5                                                                          #80 9.374207
      LE Set Extended Advertising Parameters (0x08|0x0036) ncmd 1
        Status: Success (0x00)
        TX power (selected): 0 dbm (0x00)
zephyr.exe[2714360]: < HCI Command: LE Set Advertising Set Random Address (0x08|0x0035) plen 7                       #81 9.393177
        Advertising handle: 0x00
        Advertising random address: D5:B6:CC:31:DB:3B (Static)
> HCI Event: Command Complete (0x0e) plen 4                                                                          #82 9.393760
      LE Set Advertising Set Random Address (0x08|0x0035) ncmd 1
        Status: Success (0x00)
zephyr.exe[2714360]: < HCI Command: LE Set Extended Advertising Data (0x08|0x0037) plen 22                           #83 9.413311
        Handle: 0x00
        Operation: Complete extended advertising data (0x03)
        Fragment preference: Minimize fragmentation (0x01)
        Data length: 0x12
        Flags: 0x04
          BR/EDR Not Supported
        Name (complete): Tester_F6B11A
> HCI Event: Command Complete (0x0e) plen 4                                                                          #84 9.414089
      LE Set Extended Advertising Data (0x08|0x0037) ncmd 1
        Status: Success (0x00)
zephyr.exe[2714360]: < HCI Command: LE Set Extended Scan Response Data (0x08|0x0038) plen 4                          #85 9.433232
        Handle: 0x00
        Operation: Complete scan response data (0x03)
        Fragment preference: Minimize fragmentation (0x01)
        Data length: 0x00
> HCI Event: Command Complete (0x0e) plen 4                                                                          #86 9.433789
      LE Set Extended Scan Response Data (0x08|0x0038) ncmd 1
        Status: Success (0x00)
zephyr.exe[2714360]: < HCI Command: LE Set Extended Advertising Enable (0x08|0x0039) plen 6                          #87 9.453337
        Extended advertising: Enabled (0x01)
        Number of sets: 1 (0x01)
        Entry 0
          Handle: 0x00
          Duration: 0 ms (0x00)
          Max ext adv events: 0
> HCI Event: Command Complete (0x0e) plen 4                                                                          #88 9.453924
      LE Set Extended Advertising Enable (0x08|0x0039) ncmd 1
        Status: Success (0x00)
> HCI Event: LE Meta Event (0x3e) plen 31                                                                            #89 9.674545
      LE Enhanced Connection Complete (0x0a)
        Status: Success (0x00)
        Handle: 255
        Role: Peripheral (0x01)
        Peer address type: Public (0x00)
        Peer address: DF:A9:FF:F6:B1:1A (OUI DF-A9-FF)
        Local resolvable private address: 00:00:00:00:00:00 (Non-Resolvable)
        Peer resolvable private address: 00:00:00:00:00:00 (Non-Resolvable)
        Connection interval: 87.50 msec (0x0046)
        Connection latency: 0 (0x0000)
        Supervision timeout: 20000 msec (0x07d0)
        Central clock accuracy: 0x01
> HCI Event: LE Meta Event (0x3e) plen 6                                                                             #90 9.674582
      LE Advertising Set Terminated (0x12)
        Status: Success (0x00)
        Handle: 0
        Connection handle: 255
        Number of completed extended advertising events: 0
zephyr.exe[2714360]: < HCI Command: LE Read Remote Used Features (0x08|0x0016) plen 2                                #91 9.694244
        Handle: 255 Address: DF:A9:FF:F6:B1:1A (OUI DF-A9-FF)
> HCI Event: Command Status (0x0f) plen 4                                                                            #92 9.694767
      LE Read Remote Used Features (0x08|0x0016) ncmd 1
        Status: Success (0x00)
> HCI Event: LE Meta Event (0x3e) plen 12                                                                            #93 9.938484
      LE Read Remote Used Features (0x04)
        Status: Success (0x00)
        Handle: 255 Address: DF:A9:FF:F6:B1:1A (OUI DF-A9-FF)
        Features: 0x2d 0x49 0x00 0xf7 0x67 0xd8 0x00 0x00
          LE Encryption
          Extended Reject Indication
          Peripheral-initiated Features Exchange
          LE Data Packet Length Extension
          LE 2M PHY
          LE Coded PHY
          Channel Selection Algorithm #2
          Periodic Advertising Sync Transfer - Sender
          Periodic Advertising Sync Transfer - Recipient
          Sleep Clock Accuracy Updates
          Connected Isochronous Stream - Central
          Connected Isochronous Stream - Peripheral
          Isochronous Broadcaster
          Synchronized Receiver
          Connected Isochronous Stream (Host Support)
          LE Power Control Request
          LE Power Control Request
          Connection Subrating
          Connection Subrating (Host Support)
          Unknown features (0x0000d80000000000)
zephyr.exe[2714360]: < ACL Data TX: Handle 255 flags 0x00 dlen 7                                                    #94 10.493754
      ATT: Read Request (0x0a) len 2
        Handle: 0x0007
> HCI Event: Number of Completed Packets (0x13) plen 5                                                              #95 10.638067
        Num handles: 1
        Handle: 255 Address: DF:A9:FF:F6:B1:1A (OUI DF-A9-FF)
        Count: 1
        #94: len 7 (0 Kb/s)
        Latency: 144 msec (144-144 msec ~144 msec)
> ACL Data RX: Handle 255 flags 0x02 dlen 9                                                                         #96 10.638297
      ATT: Error Response (0x01) len 4
        Read Request (0x0a)
        Handle: 0x0007
        Error: Insufficient Authentication (0x05)
zephyr.exe[2714360]: < HCI Command: Host Number of Completed Packets (0x03|0x0035) plen 5                           #97 10.653535
        Num handles: 1
        Handle: 255 Address: DF:A9:FF:F6:B1:1A (OUI DF-A9-FF)
        Count: 1
zephyr.exe[2714360]: < ACL Data TX: Handle 255 flags 0x00 dlen 8                                                    #98 11.683842
      ATT: Write Request (0x12) len 3
        Handle: 0x0007
          Data: 02
> HCI Event: Number of Completed Packets (0x13) plen 5                                                              #99 11.775581
        Num handles: 1
        Handle: 255 Address: DF:A9:FF:F6:B1:1A (OUI DF-A9-FF)
        Count: 1
        #98: len 8 (0 Kb/s)
        Latency: 91 msec (91-144 msec ~118 msec)
> ACL Data RX: Handle 255 flags 0x02 dlen 5                                                                        #100 11.775708
      ATT: Write Response (0x13) len 0
zephyr.exe[2714360]: < HCI Command: Host Number of Completed Packets (0x03|0x0035) plen 5                          #101 11.793516
        Num handles: 1
        Handle: 255 Address: DF:A9:FF:F6:B1:1A (OUI DF-A9-FF)
        Count: 1
zephyr.exe[2714360]: < ACL Data TX: Handle 255 flags 0x00 dlen 16                                                  #102 14.703628
      LE L2CAP: Connection Parameter Update Request (0x12) ident 1 len 8
        Min interval: 24
        Max interval: 40
        Peripheral latency: 0
        Timeout multiplier: 42
> HCI Event: Number of Completed Packets (0x13) plen 5                                                             #103 14.838005
        Num handles: 1
        Handle: 255 Address: DF:A9:FF:F6:B1:1A (OUI DF-A9-FF)
        Count: 1
        #102: len 16 (0 Kb/s)
        Latency: 134 msec (91-144 msec ~126 msec)
> ACL Data RX: Handle 255 flags 0x02 dlen 10                                                                       #104 14.838218
      LE L2CAP: Connection Parameter Update Response (0x13) ident 1 len 2
        Result: Connection Parameters accepted (0x0000)
zephyr.exe[2714360]: < HCI Command: Host Number of Completed Packets (0x03|0x0035) plen 5                          #105 14.853960
        Num handles: 1
        Handle: 255 Address: DF:A9:FF:F6:B1:1A (OUI DF-A9-FF)
        Count: 1
> ACL Data RX: Handle 255 flags 0x02 dlen 11                                                                       #106 70.573757
      SMP: Pairing Request (0x01) len 6
        IO capability: KeyboardDisplay (0x04)
        OOB data: Authentication data not present (0x00)
        Authentication requirement: Bonding, No MITM, Legacy, No Keypresses (0x01)
        Max encryption key size: 16
        Initiator key distribution: EncKey (0x01)
        Responder key distribution: EncKey (0x01)
zephyr.exe[2714360]: < HCI Command: Host Number of Completed Packets (0x03|0x0035) plen 5                          #107 70.574719
        Num handles: 1
        Handle: 255 Address: DF:A9:FF:F6:B1:1A (OUI DF-A9-FF)
        Count: 1
zephyr.exe[2714360]: < ACL Data TX: Handle 255 flags 0x00 dlen 11                                                  #108 70.574980
      SMP: Pairing Response (0x02) len 6
        IO capability: KeyboardDisplay (0x04)
        OOB data: Authentication data not present (0x00)
        Authentication requirement: Bonding, No MITM, Legacy, No Keypresses (0x01)
        Max encryption key size: 16
        Initiator key distribution: EncKey (0x01)
        Responder key distribution: EncKey (0x01)
> HCI Event: Number of Completed Packets (0x13) plen 5                                                             #109 70.748777
        Num handles: 1
        Handle: 255 Address: DF:A9:FF:F6:B1:1A (OUI DF-A9-FF)
        Count: 1
        #108: len 11 (0 Kb/s)
        Latency: 173 msec (91-173 msec ~149 msec)
> ACL Data RX: Handle 255 flags 0x02 dlen 21                                                                       #110 70.749113
      SMP: Pairing Confirm (0x03) len 16
        Confim value: a1f026bb4966bf8e6d65af780ec353eb
zephyr.exe[2714360]: < HCI Command: Host Number of Completed Packets (0x03|0x0035) plen 5                          #111 70.754673
        Num handles: 1
        Handle: 255 Address: DF:A9:FF:F6:B1:1A (OUI DF-A9-FF)
        Count: 1
zephyr.exe[2714360]: < ACL Data TX: Handle 255 flags 0x00 dlen 21                                                  #112 70.754760
      SMP: Pairing Confirm (0x03) len 16
        Confim value: 3ce16175a14573a824e9041a12294d21
> HCI Event: Number of Completed Packets (0x13) plen 5                                                             #113 70.923756
        Num handles: 1
        Handle: 255 Address: DF:A9:FF:F6:B1:1A (OUI DF-A9-FF)
        Count: 1
        #112: len 21 (1 Kb/s)
        Latency: 168 msec (91-173 msec ~159 msec)
> ACL Data RX: Handle 255 flags 0x02 dlen 21                                                                       #114 70.924097
      SMP: Pairing Random (0x04) len 16
        Random value: 94d92a198825f2a19e3930fc70f1972a
zephyr.exe[2714360]: < HCI Command: Host Number of Completed Packets (0x03|0x0035) plen 5                          #115 70.934809
        Num handles: 1
        Handle: 255 Address: DF:A9:FF:F6:B1:1A (OUI DF-A9-FF)
        Count: 1
zephyr.exe[2714360]: < ACL Data TX: Handle 255 flags 0x00 dlen 21                                                  #116 70.934890
      SMP: Pairing Random (0x04) len 16
        Random value: bc235a02440d0c3424a2acf8fd71a45c
> HCI Event: Number of Completed Packets (0x13) plen 5                                                             #117 71.098712
        Num handles: 1
        Handle: 255 Address: DF:A9:FF:F6:B1:1A (OUI DF-A9-FF)
        Count: 1
        #116: len 21 (1 Kb/s)
        Latency: 163 msec (91-173 msec ~161 mse