Bluetooth monitor ver 5.72
= Note: Linux version 6.14.0-36-generic (x86_64)                       0.830879
= Note: Bluetooth subsystem version 2.22                               0.830881
= New Index: 00:00:00:00:00:00 (Primary,UART,hci1)              [hci1] 0.830882
= New Index: 48:5F:99:8E:E0:64 (Primary,USB,hci0)               [hci0] 0.830883
= Open Index: 00:00:00:00:00:00                                 [hci1] 0.944724
= Index Info: 00:00:00:00:00:00 (Nordic Semiconductor ASA)      [hci1] 0.944738
@ USER Open: main (privileged) version 2.22            {0x0001} [hci1] 0.944748
< HCI Command: Reset (0x03|0x0003) plen 0                    #1 [hci1] 0.946113
> HCI Event: Command Complete (0x0e) plen 4                  #2 [hci1] 0.946639
      Reset (0x03|0x0003) ncmd 1
        Status: Success (0x00)
< HCI Command: Read Local Supported... (0x04|0x0003) plen 0  #3 [hci1] 0.964447
> HCI Event: Command Complete (0x0e) plen 12                 #4 [hci1] 0.964945
      Read Local Supported Features (0x04|0x0003) ncmd 1
        Status: Success (0x00)
        Features: 0x00 0x00 0x00 0x00 0x60 0x00 0x00 0x00
          BR/EDR Not Supported
          LE Supported (Controller)
< HCI Command: Read Local Version In.. (0x04|0x0001) plen 0  #5 [hci1] 0.984104
> HCI Event: Command Complete (0x0e) plen 12                 #6 [hci1] 0.984635
      Read Local Version Information (0x04|0x0001) ncmd 1
        Status: Success (0x00)
        HCI version: Reserved (0x0f) - Revision 12393 (0x3069)
        LMP version: Reserved (0x0f) - Subversion 12393 (0x3069)
        Manufacturer: Nordic Semiconductor ASA (89)
< HCI Command: Read Local Supported... (0x04|0x0002) plen 0  #7 [hci1] 1.004018
> HCI Event: Command Complete (0x0e) plen 68                 #8 [hci1] 1.005030
      Read Local Supported Commands (0x04|0x0002) ncmd 1
        Status: Success (0x00)
        Commands: 119 entries
          Disconnect (Octet 0 - Bit 5)
          Read Remote Version Information (Octet 2 - Bit 7)
          Set Event Mask (Octet 5 - Bit 6)
          Reset (Octet 5 - Bit 7)
          Read Connection Accept Timeout (Octet 7 - Bit 2)
          Write Connection Accept Timeout (Octet 7 - Bit 3)
          Read Transmit Power Level (Octet 10 - Bit 2)
          Set Controller To Host Flow Control (Octet 10 - Bit 5)
          Host Buffer Size (Octet 10 - Bit 6)
          Host Number of Completed Packets (Octet 10 - Bit 7)
          Read Local Version Information (Octet 14 - Bit 3)
          Read Local Supported Features (Octet 14 - Bit 5)
          Read BD ADDR (Octet 15 - Bit 1)
          Read RSSI (Octet 15 - Bit 5)
          Set Event Mask Page 2 (Octet 22 - Bit 2)
          LE Set Event Mask (Octet 25 - Bit 0)
          LE Read Buffer Size (Octet 25 - Bit 1)
          LE Read Local Supported Features (Octet 25 - Bit 2)
          LE Set Random Address (Octet 25 - Bit 4)
          LE Set Advertising Parameters (Octet 25 - Bit 5)
          LE Read Advertising Channel TX Power (Octet 25 - Bit 6)
          LE Set Advertising Data (Octet 25 - Bit 7)
          LE Set Scan Response Data (Octet 26 - Bit 0)
          LE Set Advertise Enable (Octet 26 - Bit 1)
          LE Set Scan Parameters (Octet 26 - Bit 2)
          LE Set Scan Enable (Octet 26 - Bit 3)
          LE Create Connection (Octet 26 - Bit 4)
          LE Create Connection Cancel (Octet 26 - Bit 5)
          LE Read Accept List Size (Octet 26 - Bit 6)
          LE Clear Accept List (Octet 26 - Bit 7)
          LE Add Device To Accept List (Octet 27 - Bit 0)
          LE Remove Device From Accept List (Octet 27 - Bit 1)
          LE Connection Update (Octet 27 - Bit 2)
          LE Set Host Channel Classification (Octet 27 - Bit 3)
          LE Read Channel Map (Octet 27 - Bit 4)
          LE Read Remote Used Features (Octet 27 - Bit 5)
          LE Encrypt (Octet 27 - Bit 6)
          LE Rand (Octet 27 - Bit 7)
          LE Start Encryption (Octet 28 - Bit 0)
          LE Long Term Key Request Reply (Octet 28 - Bit 1)
          LE Long Term Key Request Neg Reply (Octet 28 - Bit 2)
          LE Read Supported States (Octet 28 - Bit 3)
          LE Receiver Test (Octet 28 - Bit 4)
          LE Transmitter Test (Octet 28 - Bit 5)
          LE Test End (Octet 28 - Bit 6)
          Read Authenticated Payload Timeout (Octet 32 - Bit 4)
          Write Authenticated Payload Timeout (Octet 32 - Bit 5)
          LE Set Data Length (Octet 33 - Bit 6)
          LE Read Suggested Default Data Length (Octet 33 - Bit 7)
          LE Write Suggested Default Data Length (Octet 34 - Bit 0)
          LE Add Device To Resolving List (Octet 34 - Bit 3)
          LE Remove Device From Resolving List (Octet 34 - Bit 4)
          LE Clear Resolving List (Octet 34 - Bit 5)
          LE Read Resolving List Size (Octet 34 - Bit 6)
          LE Set Address Resolution Enable (Octet 35 - Bit 1)
          LE Set Resolvable Private Address Timeout (Octet 35 - Bit 2)
          LE Read Maximum Data Length (Octet 35 - Bit 3)
          LE Read PHY (Octet 35 - Bit 4)
          LE Set Default PHY (Octet 35 - Bit 5)
          LE Set PHY (Octet 35 - Bit 6)
          LE Enhanced Receiver Test (Octet 35 - Bit 7)
          LE Enhanced Transmitter Test (Octet 36 - Bit 0)
          LE Set Advertising Set Random Address (Octet 36 - Bit 1)
          LE Set Extended Advertising Parameters (Octet 36 - Bit 2)
          LE Set Extended Advertising Data (Octet 36 - Bit 3)
          LE Set Extended Scan Response Data (Octet 36 - Bit 4)
          LE Set Extended Advertising Enable (Octet 36 - Bit 5)
          LE Read Maximum Advertising Data Length (Octet 36 - Bit 6)
          LE Read Number of Supported Advertising Sets (Octet 36 - Bit 7)
          LE Remove Advertising Set (Octet 37 - Bit 0)
          LE Clear Advertising Sets (Octet 37 - Bit 1)
          LE Set Periodic Advertising Parameters (Octet 37 - Bit 2)
          LE Set Periodic Advertising Data (Octet 37 - Bit 3)
          LE Set Periodic Advertising Enable (Octet 37 - Bit 4)
          LE Set Extended Scan Parameters (Octet 37 - Bit 5)
          LE Set Extended Scan Enable (Octet 37 - Bit 6)
          LE Extended Create Connection (Octet 37 - Bit 7)
          LE Periodic Advertising Create Sync (Octet 38 - Bit 0)
          LE Periodic Advertising Create Sync Cancel (Octet 38 - Bit 1)
          LE Periodic Advertising Terminate Sync (Octet 38 - Bit 2)
          LE Add Device To Periodic Advertiser List (Octet 38 - Bit 3)
          LE Remove Device From Periodic Advertiser List (Octet 38 - Bit 4)
          LE Clear Periodic Advertiser List (Octet 38 - Bit 5)
          LE Read Periodic Advertiser List Size (Octet 38 - Bit 6)
          LE Read Transmit Power (Octet 38 - Bit 7)
          LE Read RF Path Compensation (Octet 39 - Bit 0)
          LE Write RF Path Compensation (Octet 39 - Bit 1)
          LE Set Privacy Mode (Octet 39 - Bit 2)
          LE Periodic Advertising Receive Enable (Octet 40 - Bit 5)
          LE Periodic Advertising Sync Transfer (Octet 40 - Bit 6)
          LE Periodic Advertising Set Info Transfer (Octet 40 - Bit 7)
          LE Periodic Advertising Sync Transfer Parameters (Octet 41 - Bit 0)
          LE Set Default Periodic Advertisng Sync Transfer Parameters (Octet 41 - Bit 1)
          LE Read Buffer v2 (Octet 41 - Bit 5)
          LE Read ISO TX Sync (Octet 41 - Bit 6)
          LE Set Connected Isochronous Group Parameters (Octet 41 - Bit 7)
          LE Set Connected Isochronous Group Parameters Test (Octet 42 - Bit 0)
          LE Create Connected Isochronous Stream (Octet 42 - Bit 1)
          LE Remove Connected Isochronous Group (Octet 42 - Bit 2)
          LE Accept Connected Isochronous Stream Request (Octet 42 - Bit 3)
          LE Reject Connected Isochronous Stream Request (Octet 42 - Bit 4)
          LE Create Broadcast Isochronous Group (Octet 42 - Bit 5)
          LE Create Broadcast Isochronous Group Test (Octet 42 - Bit 6)
          LE Terminate Broadcast Isochronous Group (Octet 42 - Bit 7)
          LE Broadcast Isochronous Group Create Sync (Octet 43 - Bit 0)
          LE Broadcast Isochronous Group Terminate Sync (Octet 43 - Bit 1)
          LE Request Peer SCA (Octet 43 - Bit 2)
          LE Setup Isochronous Data Path (Octet 43 - Bit 3)
          LE Remove Isochronous Data Path (Octet 43 - Bit 4)
          LE Isochronous Transmit Test (Octet 43 - Bit 5)
          LE Isochronous Receive Test (Octet 43 - Bit 6)
          LE Isochronous Read Test Counters (Octet 43 - Bit 7)
          LE Isochronous Read Test Counters (Octet 44 - Bit 0)
          LE Set Host Feature (Octet 44 - Bit 1)
          Octet 44 - Bit 2 
          Octet 45 - Bit 6 
          Octet 46 - Bit 0 
          Octet 46 - Bit 1 
          Octet 46 - Bit 2 
< HCI Command: Host Buffer Size (0x03|0x0033) plen 7         #9 [hci1] 1.023995
        ACL MTU: 255  ACL max packet: 16
        SCO MTU: 0    SCO max packet: 0
> HCI Event: Command Complete (0x0e) plen 4                 #10 [hci1] 1.024540
      Host Buffer Size (0x03|0x0033) ncmd 1
        Status: Success (0x00)
< HCI Command: Set Controller To Ho.. (0x03|0x0031) plen 1  #11 [hci1] 1.044024
        Flow control: ACL Data Packets (0x01)
> HCI Event: Command Complete (0x0e) plen 4                 #12 [hci1] 1.044418
      Set Controller To Host Flow Control (0x03|0x0031) ncmd 1
        Status: Success (0x00)
< HCI Command: LE Read Local Suppor.. (0x08|0x0003) plen 0  #13 [hci1] 1.064014
> HCI Event: Command Complete (0x0e) plen 12                #14 [hci1] 1.064491
      LE Read Local Supported Features (0x08|0x0003) ncmd 1
        Status: Success (0x00)
        Features: 0xfd 0x79 0x00 0xf7 0x30 0x01 0x00 0x00
          LE Encryption
          Extended Reject Indication
          Peripheral-initiated Features Exchange
          LE Ping
          LE Data Packet Length Extension
          LL Privacy
          Extended Scanner Filter Policies
          LE 2M PHY
          LE Coded PHY
          LE Extended Advertising
          LE Periodic Advertising
          Channel Selection Algorithm #2
          Periodic Advertising Sync Transfer - Sender
          Periodic Advertising Sync Transfer - Recipient
          Sleep Clock Accuracy Updates
          Connected Isochronous Stream - Central
          Connected Isochronous Stream - Peripheral
          Isochronous Broadcaster
          Synchronized Receiver
          Periodic Advertising ADI support
          Connection Subrating
          Unknown features (0x0000010000000000)
< HCI Command: LE Set Host Feature (0x08|0x0074) plen 2     #15 [hci1] 1.084024
        Bit Number: 32
          Connected Isochronous Stream (Host Support)
        Bit Value: 1
> HCI Event: Command Complete (0x0e) plen 4                 #16 [hci1] 1.084559
      LE Set Host Feature (0x08|0x0074) ncmd 1
        Status: Success (0x00)
< HCI Command: LE Read Buffer v2 (0x08|0x0060) plen 0       #17 [hci1] 1.104027
> HCI Event: Command Complete (0x0e) plen 10                #18 [hci1] 1.104539
      LE Read Buffer v2 (0x08|0x0060) ncmd 1
        Status: Success (0x00)
        ACL MTU: 27
        ACL max packet: 3
        ISO MTU: 318
        ISO max packet: 3
< HCI Command: LE Read Maximum Adve.. (0x08|0x003a) plen 0  #19 [hci1] 1.124051
> HCI Event: Command Complete (0x0e) plen 6                 #20 [hci1] 1.124558
      LE Read Maximum Advertising Data Length (0x08|0x003a) ncmd 1
        Status: Success (0x00)
        Max length: 1650
< HCI Command: LE Read Supported St.. (0x08|0x001c) plen 0  #21 [hci1] 1.144039
> HCI Event: Command Complete (0x0e) plen 12                #22 [hci1] 1.144521
      LE Read Supported States (0x08|0x001c) ncmd 1
        Status: Success (0x00)
        States: 0x000003ff3e0306ff
          Non-connectable Advertising State
          Scannable Advertising State
          Connectable Advertising State
          High Duty Cycle Directed Advertising State
          Passive Scanning State
          Active Scanning State
          Initiating State
            and Connection State (Central Role)
          Connection State (Peripheral Role)
          Scannable Advertising State
            and Passive Scanning State
          Connectable Advertising State
            and Passive Scanning State
          Non-connectable Advertising State
            and Initiating State
          Scannable Advertising State
            and Initiating State
          Active Scanning State
            and Connection State (Central Role)
          Passive Scanning State
            and Connection State (Peripheral Role)
          Active Scanning State
            and Connection State (Peripheral Role)
          Initiating State
            and Connection State (Central Role)
            and Central Role & Central Role
          Low Duty Cycle Directed Advertising State
          Connectable Advertising State
            and Initiating State
            and Central Role & Peripheral Role
          High Duty Cycle Directed Advertising State
            and Initiating State
            and Central Role & Peripheral Role
          Low Duty Cycle Directed Advertising State
            and Initiating State
            and Central Role & Peripheral Role
          Connectable Advertising State
            and Connection State (Central Role)
            and Central Role & Peripheral Role
          High Duty Cycle Directed Advertising State
            and Connection State (Central Role)
            and Central Role & Peripheral Role
          Low Duty Cycle Directed Advertising State
            and Connection State (Central Role)
            and Central Role & Peripheral Role
          Connectable Advertising State
            and Connection State (Peripheral Role)
            and Central Role & Peripheral Role
          High Duty Cycle Directed Advertising State
            and Connection State (Peripheral Role)
            and Peripheral Role & Peripheral Role
          Low Duty Cycle Directed Advertising State
            and Connection State (Peripheral Role)
            and Peripheral Role & Peripheral Role
          Initiating State
            and Connection State (Peripheral Role)
            and Central Role & Peripheral Role
< HCI Command: LE Read Maximum Data.. (0x08|0x002f) plen 0  #23 [hci1] 1.164017
> HCI Event: Command Complete (0x0e) plen 12                #24 [hci1] 1.164533
      LE Read Maximum Data Length (0x08|0x002f) ncmd 1
        Status: Success (0x00)
        Max TX octets: 251
        Max TX time: 2704
        Max RX octets: 251
        Max RX time: 2704
< HCI Command: LE Write Suggested D.. (0x08|0x0024) plen 4  #25 [hci1] 1.184024
        TX octets: 251
        TX time: 2704
> HCI Event: Command Complete (0x0e) plen 4                 #26 [hci1] 1.184458
      LE Write Suggested Default Data Length (0x08|0x0024) ncmd 1
        Status: Success (0x00)
< HCI Command: LE Read Resolving Li.. (0x08|0x002a) plen 0  #27 [hci1] 1.204028
> HCI Event: Command Complete (0x0e) plen 5                 #28 [hci1] 1.204529
      LE Read Resolving List Size (0x08|0x002a) ncmd 1
        Status: Success (0x00)
        Size: 8
< HCI Command: LE Set Event Mask (0x08|0x0001) plen 8       #29 [hci1] 1.224017
        Mask: 0x000002023f87fa5e
          LE Advertising Report
          LE Connection Update Complete
          LE Read Remote Used Features Complete
          LE Long Term Key Request
          LE Data Length Change
          LE Enhanced Connection Complete
          LE PHY Update Complete
          LE Extended Advertising Report
          LE Periodic Advertising Sync Established
          LE Periodic Advertising Report
          LE Periodic Advertising Sync Lost
          LE Extended Scan Timeout
          LE Extended Advertising Set Terminated
          LE Scan Request Received
          LE Periodic Advertising Sync Transfer Rvc
          LE CIS Established
          LE CIS Request
          LE Create BIG Complete
          LE Terminate BIG Complete
          LE BIG Sync Estabilished Complete
          LE BIG Sync Lost
          LE BIG Info Advertising Report
          Unknown mask (0x0000020000000000)
> HCI Event: Command Complete (0x0e) plen 4                 #30 [hci1] 1.224522
      LE Set Event Mask (0x08|0x0001) ncmd 1
        Status: Success (0x00)
< HCI Command: Set Event Mask (0x03|0x0001) plen 8          #31 [hci1] 1.244041
        Mask: 0x2000800002008890
          Disconnection Complete
          Encryption Change
          Read Remote Version Information Complete
          Hardware Error
          Data Buffer Overflow
          Encryption Key Refresh Complete
          LE Meta
> HCI Event: Command Complete (0x0e) plen 4                 #32 [hci1] 1.244617
      Set Event Mask (0x03|0x0001) ncmd 1
        Status: Success (0x00)
< HCI Command: Read BD ADDR (0x04|0x0009) plen 0            #33 [hci1] 1.264036
> HCI Event: Command Complete (0x0e) plen 10                #34 [hci1] 1.264521
      Read BD ADDR (0x04|0x0009) ncmd 1
        Status: Success (0x00)
        Address: 00:00:00:00:00:00 (OUI 00-00-00)
< HCI Command: LE Set Random Address (0x08|0x0005) plen 6   #35 [hci1] 1.284039
        Address: D5:B6:CC:31:DB:3B (Static)
> HCI Event: Command Complete (0x0e) plen 4                 #36 [hci1] 1.284558
      LE Set Random Address (0x08|0x0005) ncmd 1
        Status: Success (0x00)
< HCI Command: LE Set Extended Adv.. (0x08|0x0036) plen 25  #37 [hci1] 3.834567
        Handle: 0x00
        Properties: 0x0013
          Connectable
          Scannable
          Use legacy advertising PDUs: ADV_IND
        Min advertising interval: 100.000 msec (0x00a0)
        Max advertising interval: 150.000 msec (0x00f0)
        Channel map: 37, 38, 39 (0x07)
        Own address type: Random (0x01)
        Peer address type: Public (0x00)
        Peer address: 00:00:00:00:00:00 (OUI 00-00-00)
        Filter policy: Allow Scan Request from Any, Allow Connect Request from Any (0x00)
        TX power: Host has no preference (0x7f)
        Primary PHY: LE 1M (0x01)
        Secondary max skip: 0x00
        Secondary PHY: LE 1M (0x01)
        SID: 0x00
        Scan request notifications: Disabled (0x00)
> HCI Event: Command Complete (0x0e) plen 5                 #38 [hci1] 3.835345
      LE Set Extended Advertising Parameters (0x08|0x0036) ncmd 1
        Status: Success (0x00)
        TX power (selected): 0 dbm (0x00)
< HCI Command: LE Set Advertising S.. (0x08|0x0035) plen 7  #39 [hci1] 3.844432
        Advertising handle: 0x00
        Advertising random address: D5:B6:CC:31:DB:3B (Static)
> HCI Event: Command Complete (0x0e) plen 4                 #40 [hci1] 3.844932
      LE Set Advertising Set Random Address (0x08|0x0035) ncmd 1
        Status: Success (0x00)
< HCI Command: LE Set Extended Adv.. (0x08|0x0037) plen 22  #41 [hci1] 3.864234
        Handle: 0x00
        Operation: Complete extended advertising data (0x03)
        Fragment preference: Minimize fragmentation (0x01)
        Data length: 0x12
        Flags: 0x06
          LE General Discoverable Mode
          BR/EDR Not Supported
        Name (complete): Tester_F6B11A
> HCI Event: Command Complete (0x0e) plen 4                 #42 [hci1] 3.864988
      LE Set Extended Advertising Data (0x08|0x0037) ncmd 1
        Status: Success (0x00)
< HCI Command: LE Set Extended Scan.. (0x08|0x0038) plen 4  #43 [hci1] 3.884090
        Handle: 0x00
        Operation: Complete scan response data (0x03)
        Fragment preference: Minimize fragmentation (0x01)
        Data length: 0x00
> HCI Event: Command Complete (0x0e) plen 4                 #44 [hci1] 3.884514
      LE Set Extended Scan Response Data (0x08|0x0038) ncmd 1
        Status: Success (0x00)
< HCI Command: LE Set Extended Adve.. (0x08|0x0039) plen 6  #45 [hci1] 3.904048
        Extended advertising: Enabled (0x01)
        Number of sets: 1 (0x01)
        Entry 0
          Handle: 0x00
          Duration: 0 ms (0x00)
          Max ext adv events: 0
> HCI Event: Command Complete (0x0e) plen 4                 #46 [hci1] 3.904663
      LE Set Extended Advertising Enable (0x08|0x0039) ncmd 1
        Status: Success (0x00)
> HCI Event: LE Meta Event (0x3e) plen 31                   #47 [hci1] 4.018471
      LE Enhanced Connection Complete (0x0a)
        Status: Success (0x00)
        Handle: 2199
        Role: Peripheral (0x01)
        Peer address type: Public (0x00)
        Peer address: DF:A9:FF:F6:B1:1A (OUI DF-A9-FF)
        Local resolvable private address: 00:00:00:00:00:00 (Non-Resolvable)
        Peer resolvable private address: 00:00:00:00:00:00 (Non-Resolvable)
        Connection interval: 87.50 msec (0x0046)
        Connection latency: 0 (0x0000)
        Supervision timeout: 25120 msec (0x09d0)
        Central clock accuracy: 0x01
> HCI Event: LE Meta Event (0x3e) plen 6                    #48 [hci1] 4.018610
      LE Advertising Set Terminated (0x12)
        Status: Success (0x00)
        Handle: 0
        Connection handle: 2199
        Number of completed extended advertising events: 0
< HCI Command: LE Read Remote Used... (0x08|0x0016) plen 2  #49 [hci1] 4.024478
        Handle: 2199 Address: DF:A9:FF:F6:B1:1A (OUI DF-A9-FF)
< ACL Data TX: Handle 2199 flags 0x00 dlen 7                #50 [hci1] 4.024491
      ATT: Exchange MTU Request (0x02) len 2
        Client RX MTU: 251
> HCI Event: Command Status (0x0f) plen 4                   #51 [hci1] 4.024940
      LE Read Remote Used Features (0x08|0x0016) ncmd 1
        Status: Success (0x00)
> HCI Event: Number of Completed Packets (0x13) plen 5      #52 [hci1] 4.194463
        Num handles: 1
        Handle: 2199 Address: DF:A9:FF:F6:B1:1A (OUI DF-A9-FF)
        Count: 1
        #50: len 7 (0 Kb/s)
        Latency: 169 msec (169-169 msec ~169 msec)
> HCI Event: LE Meta Event (0x3e) plen 12                   #53 [hci1] 4.282450
      LE Read Remote Used Features (0x04)
        Status: Success (0x00)
        Handle: 2199 Address: DF:A9:FF:F6:B1:1A (OUI DF-A9-FF)
        Features: 0x2d 0x49 0x00 0xf7 0x67 0xd8 0x00 0x00
          LE Encryption
          Extended Reject Indication
          Peripheral-initiated Features Exchange
          LE Data Packet Length Extension
          LE 2M PHY
          LE Coded PHY
          Channel Selection Algorithm #2
          Periodic Advertising Sync Transfer - Sender
          Periodic Advertising Sync Transfer - Recipient
          Sleep Clock Accuracy Updates
          Connected Isochronous Stream - Central
          Connected Isochronous Stream - Peripheral
          Isochronous Broadcaster
          Synchronized Receiver
          Connected Isochronous Stream (Host Support)
          LE Power Control Request
          LE Power Control Request
          Connection Subrating
          Connection Subrating (Host Support)
          Unknown features (0x0000d80000000000)
> ACL Data RX: Handle 2199 flags 0x02 dlen 11               #54 [hci1] 6.732039
      SMP: Pairing Request (0x01) len 6
        IO capability: KeyboardDisplay (0x04)
        OOB data: Authentication data not present (0x00)
        Authentication requirement: Bonding, MITM, SC, No Keypresses (0x0d)
        Max encryption key size: 16
        Initiator key distribution: EncKey IdKey (0x03)
        Responder key distribution: EncKey IdKey Sign (0x07)
> ACL Data RX: Handle 2199 flags 0x02 dlen 7                #55 [hci1] 6.732529
      ATT: Exchange MTU Response (0x03) len 2
        Server RX MTU: 23
< HCI Command: Host Number of Compl.. (0x03|0x0035) plen 5  #56 [hci1] 6.744720
        Num handles: 1
        Handle: 2199 Address: DF:A9:FF:F6:B1:1A (OUI DF-A9-FF)
        Count: 1
< ACL Data TX: Handle 2199 flags 0x00 dlen 11               #57 [hci1] 6.744886
      SMP: Pairing Response (0x02) len 6
        IO capability: DisplayOnly (0x00)
        OOB data: Authentication data not present (0x00)
        Authentication requirement: Bonding, No MITM, SC, No Keypresses (0x09)
        Max encryption key size: 16
        Initiator key distribution: IdKey (0x02)
        Responder key distribution: <none> (0x00)
< HCI Command: Host Number of Compl.. (0x03|0x0035) plen 5  #58 [hci1] 6.745271
        Num handles: 1
        Handle: 2199 Address: DF:A9:FF:F6:B1:1A (OUI DF-A9-FF)
        Count: 1
> HCI Event: Number of Completed Packets (0x13) plen 5      #59 [hci1] 6.907108
        Num handles: 1
        Handle: 2199 Address: DF:A9:FF:F6:B1:1A (OUI DF-A9-FF)
        Count: 1
        #57: len 11 (0 Kb/s)
        Latency: 162 msec (162-169 msec ~166 msec)
> ACL Data RX: Handle 2199 flags 0x02 dlen 27               #60 [hci1] 6.907490
> ACL Data RX: Handle 2199 flags 0x01 dlen 27               #61 [hci1] 6.907932
> ACL Data RX: Handle 2199 flags 0x01 dlen 15               #62 [hci1] 6.908395
      SMP: Pairing Public Key (0x0c) len 64
        X: 72d2895e483b64e47a02b2e85e24e141d89733d5929b451462b886bdffd2a850
        Y: a38c4b11b7f6bdff46027008bff8442452c0ec09e30b2d74738fc9b1736a141d
< HCI Command: Host Number of Compl.. (0x03|0x0035) plen 5  #63 [hci1] 6.925163
        Num handles: 1
        Handle: 2199 Address: DF:A9:FF:F6:B1:1A (OUI DF-A9-FF)
        Count: 1
< HCI Command: Host Number of Compl.. (0x03|0x0035) plen 5  #64 [hci1] 6.925275
        Num handles: 1
        Handle: 2199 Address: DF:A9:FF:F6:B1:1A (OUI DF-A9-FF)
        Count: 1
< HCI Command: Host Number of Compl.. (0x03|0x0035) plen 5  #65 [hci1] 6.925692
        Num handles: 1
        Handle: 2199 Address: DF:A9:FF:F6:B1:1A (OUI DF-A9-FF)
        Count: 1
< ACL Data TX: Handle 2199 flags 0x00 dlen 27               #66 [hci1] 6.925785
< ACL Data TX: Handle 2199 flags 0x01 dlen 27               #67 [hci1] 6.925812
< ACL Data TX: Handle 2199 flags 0x01 dlen 15               #68 [hci1] 6.925842
      SMP: Pairing Public Key (0x0c) len 64
        X: 98308440221e2d910f0e54b71e7ec652857aa9b5a0dc65028824cc19db1226e9
        Y: 67a4816bcb62efb21701e31fdb27561a6217575fb007a8bbdabe7e28b6f68482
> HCI Event: Number of Completed Packets (0x13) plen 5      #69 [hci1] 6.995020
        Num handles: 1
        Handle: 2199 Address: DF:A9:FF:F6:B1:1A (OUI DF-A9-FF)
        Count: 1
        #66: len 27 (3 Kb/s)
        Latency: 69 msec (69-169 msec ~117 msec)
> HCI Event: Number of Completed Packets (0x13) plen 5      #70 [hci1] 6.995737
        Num handles: 1
        Handle: 2199 Address: DF:A9:FF:F6:B1:1A (OUI DF-A9-FF)
        Count: 1
        #67: len 27 (3 Kb/s)
        Latency: 69 msec (69-169 msec ~93 msec)
> HCI Event: Number of Completed Packets (0x13) plen 5      #71 [hci1] 7.081825
        Num handles: 1
        Handle: 2199 Address: DF:A9:FF:F6:B1:1A (OUI DF-A9-FF)
        Count: 1
        #68: len 15 (0 Kb/s)
        Latency: 155 msec (69-169 msec ~124 msec)
> ACL Data RX: Handle 2199 flags 0x02 dlen 21               #72 [hci1] 8.044638
      SMP: Pairing Confirm (0x03) len 16
        Confim value: 16fd25377e375a5898a08e8b0a60441f
< HCI Command: Host Number of Compl.. (0x03|0x0035) plen 5  #73 [hci1] 8.064418
        Num handles: 1
        Handle: 2199 Address: DF:A9:FF:F6:B1:1A (OUI DF-A9-FF)
        Count: 1
< ACL Data TX: Handle 2199 flags 0x00 dlen 21               #74 [hci1] 8.064509
      SMP: Pairing Confirm (0x03) len 16
        Confim value: e657209e35f17a4518bb71734e48993c
> HCI Event: Number of Completed Packets (0x13) plen 5      #75 [hci1] 8.219570
        Num handles: 1
        Handle: 2199 Address: DF:A9:FF:F6:B1:1A (OUI DF-A9-FF)
        Count: 1
        #74: len 21 (1 Kb/s)
        Latency: 155 msec (69-169 msec ~139 msec)
> ACL Data RX: Handle 2199 flags 0x02 dlen 21               #76 [hci1] 8.219861
      SMP: Pairing Random (0x04) len 16
        Random value: fc8b2dafb40648fc0000000000000000
< HCI Command: Host Number of Compl.. (0x03|0x0035) plen 5  #77 [hci1] 8.224999
        Num handles: 1
        Handle: 2199 Address: DF:A9:FF:F6:B1:1A (OUI DF-A9-FF)
        Count: 1
< ACL Data TX: Handle 2199 flags 0x00 dlen 21               #78 [hci1] 8.225110
      SMP: Pairing Random (0x04) len 16
        Random value: 8e6108f966a694cbe26df70bb96773e6
> HCI Event: Number of Completed Packets (0x13) plen 5      #79 [hci1] 8.394300
        Num handles: 1
        Handle: 2199 Address: DF:A9:FF:F6:B1:1A (OUI DF-A9-FF)
        Count: 1
        #78: len 21 (0 Kb/s)
        Latency: 169 msec (69-169 msec ~154 msec)
> ACL Data RX: Handle 2199 flags 0x02 dlen 21               #80 [hci1] 8.482136
      SMP: Pairing Confirm (0x03) len 16
        Confim value: b1597dc43a252f51e773b5773ec51e6d
< HCI Command: Host Number of Compl.. (0x03|0x0035) plen 5  #81 [hci1] 8.484767
        Num handles: 1
        Handle: 2199 Address: DF:A9:FF:F6:B1:1A (OUI DF-A9-FF)
        Count: 1
< ACL Data TX: Handle 2199 flags 0x00 dlen 21               #82 [hci1] 8.484905
      SMP: Pairing Confirm (0x03) len 16
        Confim value: 69d0cb11b7a3ccada96220b90f6f9408
> HCI Event: Number of Completed Packets (0x13) plen 5      #83 [hci1] 8.657013
        Num handles: 1
        Handle: 2199 Address: DF:A9:FF:F6:B1:1A (OUI DF-A9-FF)
        Count: 1
        #82: len 21 (0 Kb/s)
        Latency: 172 msec (69-172 msec ~163 msec)
> ACL Data RX: Handle 2199 flags 0x02 dlen 21               #84 [hci1] 8.657269
      SMP: Pairing Random (0x04) len 16
        Random value: de6ab336c9f3666c0000000000000000
< HCI Command: Host Number of Compl.. (0x03|0x0035) plen 5  #85 [hci1] 8.665017
        Num handles: 1
        Handle: 2199 Address: DF:A9:FF:F6:B1:1A (OUI DF-A9-FF)
        Count: 1
< ACL Data TX: Handle 2199 flags 0x00 dlen 21               #86 [hci1] 8.665152
      SMP: Pairing Random (0x04) len 16
        Random value: 4d02679f89a05211af56d8b3da64d21e
> HCI Event: Number of Completed Packets (0x13) plen 5      #87 [hci1] 8.831834
        Num handles: 1
        Handle: 2199 Address: DF:A9:FF:F6:B1:1A (OUI DF-A9-FF)
        Count: 1
        #86: len 21 (1 Kb/s)
        Latency: 166 msec (69-172 msec ~165 msec)
> ACL Data RX: Handle 2199 flags 0x02 dlen 21               #88 [hci1] 8.919692
      SMP: Pairing Confirm (0x03) len 16
        Confim value: bf0773b1dfbc11e3b6b7e0b625b0e19d
< HCI Command: Host Number of Compl.. (0x03|0x0035) plen 5  #89 [hci1] 8.924586
        Num handles: 1
        Handle: 2199 Address: DF:A9:FF:F6:B1:1A (OUI DF-A9-FF)
        Count: 1
< ACL Data TX: Handle 2199 flags 0x00 dlen 21               #90 [hci1] 8.924646
      SMP: Pairing Confirm (0x03) len 16
        Confim value: 3103c9212ba95542fe51ffb6d633f4fd
> HCI Event: Number of Completed Packets (0x13) plen 5      #91 [hci1] 9.094489
        Num handles: 1
        Handle: 2199 Address: DF:A9:FF:F6:B1:1A (OUI DF-A9-FF)
        Count: 1
        #90: len 21 (0 Kb/s)
        Latency: 169 msec (69-172 msec ~167 msec)
> ACL Data RX: Handle 2199 flags 0x02 dlen 21               #92 [hci1] 9.094890
      SMP: Pairing Random (0x04) len 16
        Random value: 05b39912efdabef80000000000000000
< HCI Command: Host Number of Compl.. (0x03|0x0035) plen 5  #93 [hci1] 9.104502
        Num handles: 1
        Handle: 2199 Address: DF:A9:FF:F6:B1:1A (OUI DF-A9-FF)
        Count: 1
< ACL Data TX: Handle 2199 flags 0x00 dlen 21               #94 [hci1] 9.104614
      SMP: Pairing Random (0x04) len 16
        Random value: 5e8286bc235a02440d0c3424a2acf8fd
> HCI Event: Number of Completed Packets (0x13) plen 5      #95 [hci1] 9.269275
        Num handles: 1
        Handle: 2199 Address: DF:A9:FF:F6:B1:1A (OUI DF-A9-FF)
        Count: 1
        #94: len 21 (1 Kb/s)
        Latency: 164 msec (69-172 msec ~166 msec)
> ACL Data RX: Handle 2199 flags 0x02 dlen 21               #96 [hci1] 9.357195
      SMP: Pairing Confirm (0x03) len 16
        Confim value: cd548737232c0f490d6fa072d3207a65
< HCI Command: Host Number of Compl.. (0x03|0x0035) plen 5  #97 [hci1] 9.364787
        Num handles: 1
        Handle: 2199 Address: DF:A9:FF:F6:B1:1A (OUI DF-A9-FF)
        Count: 1
< ACL Data TX: Handle 2199 flags 0x00 dlen 21               #98 [hci1] 9.364900
      SMP: Pairing Confirm (0x03) len 16
        Confim value: 67fe5e1b9448068f402e7be6c27f6dd9
> HCI Event: Number of Completed Packets (0x13) plen 5      #99 [hci1] 9.531971
        Num handles: 1
        Handle: 2199 Address: DF:A9:FF:F6:B1:1A (OUI DF-A9-FF)
        Count: 1
        #98: len 21 (1 Kb/s)
        Latency: 167 msec (69-172 msec ~166 msec)
> ACL Data RX: Handle 2199 flags 0x02 dlen 21              #100 [hci1] 9.532299
      SMP: Pairing Random (0x04) len 16
        Random value: 7756f91c02672fe00000000000000000
< HCI Command: Host Number of Comp.. (0x03|0x0035) plen 5  #101 [hci1] 9.545063
        Num handles: 1
        Handle: 2199 Address: DF:A9:FF:F6:B1:1A (OUI DF-A9-FF)
        Count: 1
< ACL Data TX: Handle 2199 flags 0x00 dlen 21              #102 [hci1] 9.545211
      SMP: Pairing Random (0x04) len 16
        Random value: 5c4a1bcadd27bd58e945097b00bad7ac
> HCI Event: Number of Completed Packets (0x13) plen 5     #103 [hci1] 9.706706
        Num handles: 1
        Handle: 2199 Address: DF:A9:FF:F6:B1:1A (OUI DF-A9-FF)
        Count: 1
        #102: len 21 (1 Kb/s)
        Latency: 161 msec (69-172 msec ~164 msec)
> ACL Data RX: Handle 2199 flags 0x02 dlen 21              #104 [hci1] 9.794594
      SMP: Pairing Confirm (0x03) len 16
        Confim value: f73620708357299ef6e079547b3a047e
< HCI Command: Host Number of Comp.. (0x03|0x0035) plen 5  #105 [hci1] 9.804760
        Num handles: 1
        Handle: 2199 Address: DF:A9:FF:F6:B1:1A (OUI DF-A9-FF)
        Count: 1
< ACL Data TX: Handle 2199 flags 0x00 dlen 21              #106 [hci1] 9.804843
      SMP: Pairing Confirm (0x03) len 16
        Confim value: 2dc5eedb3d5d935359cb6f5a89bdef87
> HCI Event: Number of Completed Packets (0x13) plen 5     #107 [hci1] 9.969487
        Num handles: 1
        Handle: 2199 Address: DF:A9:FF:F6:B1:1A (OUI DF-A9-FF)
        Count: 1
        #106: len 21 (1 Kb/s)
        Latency: 164 msec (69-172 msec ~164 msec)
> ACL Data RX: Handle 2199 flags 0x02 dlen 21              #108 [hci1] 9.969815
      SMP: Pairing Random (0x04) len 16
        Random value: 905fb8d9daaa41960000000000000000
< HCI Command: Host Number of Comp.. (0x03|0x0035) plen 5  #109 [hci1] 9.985012
        Num handles: 1
        Handle: 2199 Address: DF:A9:FF:F6:B1:1A (OUI DF-A9-FF)
        Count: 1
< ACL Data TX: Handle 2199 flags 0x00 dlen 21              #110 [hci1] 9.985207
      SMP: Pairing Random (0x04) len 16
        Random value: 32527e6e64e79f33b2e374394db8ab2d
> HCI Event: Number of Completed Packets (0x13) plen 5    #111 [hci1] 10.144288
        Num handles: 1
        Handle: 2199 Address: DF:A9:FF:F6:B1:1A (OUI DF-A9-FF)
        Count: 1
        #110: len 21 (1 Kb/s)
        Latency: 159 msec (69-172 msec ~161 msec)
> ACL Data RX: Handle 2199 flags 0x02 dlen 21             #112 [hci1] 10.232050
      SMP: Pairing Confirm (0x03) len 16
        Confim value: d2438b453f08721c405b0ff59619745d
< HCI Command: Host Number of Com.. (0x03|0x0035) plen 5  #113 [hci1] 10.244733
        Num handles: 1
        Handle: 2199 Address: DF:A9:FF:F6:B1:1A (OUI DF-A9-FF)
        Count: 1
< ACL Data TX: Handle 2199 flags 0x00 dlen 21             #114 [hci1] 10.244894
      SMP: Pairing Confirm (0x03) len 16
        Confim value: bdc90348687a5207e0cec1714e010759
> HCI Event: Number of Completed Packets (0x13) plen 5    #115 [hci1] 10.407043
        Num handles: 1
        Handle: 2199 Address: DF:A9:FF:F6:B1:1A (OUI DF-A9-FF)
        Count: 1
        #114: len 21 (1 Kb/s)
        Latency: 162 msec (69-172 msec ~161 msec)
> ACL Data RX: Handle 2199 flags 0x02 dlen 21             #116 [hci1] 10.407287
      SMP: Pairing Random (0x04) len 16
        Random value: 53d9c2fb96531fe60000000000000000
< HCI Command: Host Number of Com.. (0x03|0x0035) plen 5  #117 [hci1] 10.424408
        Num handles: 1
        Handle: 2199 Address: DF:A9:FF:F6:B1:1A (OUI DF-A9-FF)
        Count: 1
< ACL Data TX: Handle 2199 flags 0x00 dlen 21             #118 [hci1] 10.424496
      SMP: Pairing Random (0x04) len 16
        Random value: dddbdfe2838e9a8cc6964353c850fef7
> HCI Event: Number of Completed Packets (0x13) plen 5    #119 [hci1] 10.581739
        Num handles: 1
        Handle: 2199 Address: DF:A9:FF:F6:B1:1A (OUI DF-A9-FF)
        Count: 1
        #118: len 21 (1 Kb/s)
        Latency: 157 msec (69-172 msec ~159 msec)
> ACL Data RX: Handle 2199 flags 0x02 dlen 21             #120 [hci1] 10.669696
      SMP: Pairing Confirm (0x03) len 16
        Confim value: c27557c5db47855b8c65f02e2b60f528
< HCI Command: Host Number of Com.. (0x03|0x0035) plen 5  #121 [hci1] 10.684380
        Num handles: 1
        Handle: 2199 Address: DF:A9:FF:F6:B1:1A (OUI DF-A9-FF)
        Count: 1
< ACL Data TX: Handle 2199 flags 0x00 dlen 21             #122 [hci1] 10.684470
      SMP: Pairing Confirm (0x03) len 16
        Confim value: 08a428410bca8e328189b27541fc3afa
> HCI Event: Number of Completed Packets (0x13) plen 5    #123 [hci1] 10.844463
        Num handles: 1
        Handle: 2199 Address: DF:A9:FF:F6:B1:1A (OUI DF-A9-FF)
        Count: 1
        #122: len 21 (1 Kb/s)
        Latency: 159 msec (69-172 msec ~159 msec)
> ACL Data RX: Handle 2199 flags 0x02 dlen 21             #124 [hci1] 10.844745
      SMP: Pairing Random (0x04) len 16
        Random value: 6cb8d91178ea0acc0000000000000000
< HCI Command: Host Number of Com.. (0x03|0x0035) plen 5  #125 [hci1] 10.865032
        Num handles: 1
        Handle: 2199 Address: DF:A9:FF:F6:B1:1A (OUI DF-A9-FF)
        Count: 1
< ACL Data TX: Handle 2199 flags 0x00 dlen 21             #126 [hci1] 10.865185
      SMP: Pairing Random (0x04) len 16
        Random value: eb9f1915536596b6fc3db1c86b2b1970
> HCI Event: Number of Completed Packets (0x13) plen 5    #127 [hci1] 11.019257
        Num handles: 1
        Handle: 2199 Address: DF:A9:FF:F6:B1:1A (OUI DF-A9-FF)
        Count: 1
        #126: len 21 (1 Kb/s)
        Latency: 154 msec (69-172 msec ~156 msec)
> ACL Data RX: Handle 2199 flags 0x02 dlen 21             #128 [hci1] 11.107036
      SMP: Pairing Confirm (0x03) len 16
        Confim value: 8f38b9c2625e66a802e500a4d824e85e
< HCI Command: Host Number of Com.. (0x03|0x0035) plen 5  #129 [hci1] 11.124254
        Num handles: 1
        Handle: 2199 Address: DF:A9:FF:F6:B1:1A (OUI DF-A9-FF)
        Count: 1
< ACL Data TX: Handle 2199 flags 0x00 dlen 21             #130 [hci1] 11.124299
      SMP: Pairing Confirm (0x03) len 16
        Confim value: 83485dbdc73b3386d22fb936d34e13df
> HCI Event: Number of Completed Packets (0x13) plen 5    #131 [hci1] 11.281925
        Num handles: 1
        Handle: 2199 Address: DF:A9:FF:F6:B1:1A (OUI DF-A9-FF)
        Count: 1
        #130: len 21 (1 Kb/s)
        Latency: 157 msec (69-172 msec ~157 msec)
> ACL Data RX: Handle 2199 flags 0x02 dlen 21             #132 [hci1] 11.282241
      SMP: Pairing Random (0x04) len 16
        Random value: 2122757d0de564870000000000000000
< HCI Command: Host Number of Com.. (0x03|0x0035) plen 5  #133 [hci1] 11.284987
        Num handles: 1
        Handle: 2199 Address: DF:A9:FF:F6:B1:1A (OUI DF-A9-FF)
        Count: 1
< ACL Data TX: Handle 2199 flags 0x00 dlen 21             #134 [hci1] 11.285097
      SMP: Pairing Random (0x04) len 16
        Random value: 5c794dc9ad9f2c3f295ebd5ad5e1c3cf
> HCI Event: Number of Completed Packets (0x13) plen 5    #135 [hci1] 11.456736
        Num handles: 1
        Handle: 2199 Address: DF:A9:FF:F6:B1:1A (OUI DF-A9-FF)
        Count: 1
        #134: len 21 (0 Kb/s)
        Latency: 171 msec (69-172 msec ~164 msec)
> ACL Data RX: Handle 2199 flags 0x02 dlen 21             #136 [hci1] 11.544546
      SMP: Pairing Confirm (0x03) len 16
        Confim value: a28f05118be10b11691efb3c955bbf74
< HCI Command: Host Number of Com.. (0x03|0x0035) plen 5  #137 [hci1] 11.564749
        Num handles: 1
        Handle: 2199 Address: DF:A9:FF:F6:B1:1A (OUI DF-A9-FF)
        Count: 1
< ACL Data TX: Handle 2199 flags 0x00 dlen 21             #138 [hci1] 11.564908
      SMP: Pairing Confirm (0x03) len 16
        Confim value: 73eb4261d431ca9a11544bba93091729
> HCI Event: Number of Completed Packets (0x13) plen 5    #139 [hci1] 11.719430
        Num handles: 1
        Handle: 2199 Address: DF:A9:FF:F6:B1:1A (OUI DF-A9-FF)
        Count: 1
        #138: len 21 (1 Kb/s)
        Latency: 154 msec (69-172 msec ~159 msec)
> ACL Data RX: Handle 2199 flags 0x02 dlen 21             #140 [hci1] 11.719776
      SMP: Pairing Random (0x04) len 16
        Random value: 6de2d79b9a0f94d10000000000000000
< HCI Command: Host Number of Com.. (0x03|0x0035) plen 5  #141 [hci1] 11.725086
        Num handles: 1
        Handle: 2199 Address: DF:A9:FF:F6:B1:1A (OUI DF-A9-FF)
        Count: 1
< ACL Data TX: Handle 2199 flags 0x00 dlen 21             #142 [hci1] 11.725330
      SMP: Pairing Random (0x04) len 16
        Random value: 5c2fff312cdf99c9491988e877355a9a
> HCI Event: Number of Completed Packets (0x13) plen 5    #143 [hci1] 11.894181
        Num handles: 1
        Handle: 2199 Address: DF:A9:FF:F6:B1:1A (OUI DF-A9-FF)
        Count: 1
        #142: len 21 (1 Kb/s)
        Latency: 168 msec (69-172 msec ~164 msec)
> ACL Data RX: Handle 2199 flags 0x02 dlen 21             #144 [hci1] 11.982056
      SMP: Pairing Confirm (0x03) len 16
        Confim value: 9209ae489677dea677e2c5acbe1c6aaf
< HCI Command: Host Number of Com.. (0x03|0x0035) plen 5  #145 [hci1] 11.984669
        Num handles: 1
        Handle: 2199 Address: DF:A9:FF:F6:B1:1A (OUI DF-A9-FF)
        Count: 1
< ACL Data TX: Handle 2199 flags 0x00 dlen 21             #146 [hci1] 11.984827
      SMP: Pairing Confirm (0x03) len 16
        Confim value: 91e98fd2263372df71354de84a0ad23b
> HCI Event: Number of Completed Packets (0x13) plen 5    #147 [hci1] 12.156907
        Num handles: 1
        Handle: 2199 Address: DF:A9:FF:F6:B1:1A (OUI DF-A9-FF)
        Count: 1
        #146: len 21 (0 Kb/s)
        Latency: 172 msec (69-172 msec ~168 msec)
> ACL Data RX: Handle 2199 flags 0x02 dlen 21             #148 [hci1] 12.157191
      SMP: Pairing Random (0x04) len 16
        Random value: 2dd763102b9d10f50000000000000000
< HCI Command: Host Number of Com.. (0x03|0x0035) plen 5  #149 [hci1] 12.164443
        Num handles: 1
        Handle: 2199 Address: DF:A9:FF:F6:B1:1A (OUI DF-A9-FF)
        Count: 1
< ACL Data TX: Handle 2199 flags 0x00 dlen 21             #150 [hci1] 12.164525
      SMP: Pairing Random (0x04) len 16
        Random value: c629a3a987d808e808655d558dfc1155
> HCI Event: Number of Completed Packets (0x13) plen 5    #151 [hci1] 12.331603
        Num handles: 1
        Handle: 2199 Address: DF:A9:FF:F6:B1:1A (OUI DF-A9-FF)
        Count: 1
        #150: len 21 (1 Kb/s)
        Latency: 167 msec (69-172 msec ~167 msec)
> ACL Data RX: Handle 2199 flags 0x02 dlen 21             #152 [hci1] 12.419514
      SMP: Pairing Confirm (0x03) len 16
        Confim value: 7cd5842f768508f08cc7a7dd64f074e8
< HCI Command: Host Number of Com.. (0x03|0x0035) plen 5  #153 [hci1] 12.424869
        Num handles: 1
        Handle: 2199 Address: DF:A9:FF:F6:B1:1A (OUI DF-A9-FF)
        Count: 1
< ACL Data TX: Handle 2199 flags 0x00 dlen 21             #154 [hci1] 12.425041
      SMP: Pairing Confirm (0x03) len 16
        Confim value: f0b968c0ae08107fef896c979be11ce0
> HCI Event: Number of Completed Packets (0x13) plen 5    #155 [hci1] 12.594366
        Num handles: 1
        Handle: 2199 Address: DF:A9:FF:F6:B1:1A (OUI DF-A9-FF)
        Count: 1
        #154: len 21 (0 Kb/s)
        Latency: 169 msec (69-172 msec ~168 msec)
> ACL Data RX: Handle 2199 flags 0x02 dlen 21             #156 [hci1] 12.594786
      SMP: Pairing Random (0x04) len 16
        Random value: 321570e78a8b4dfd0000000000000000
< HCI Command: Host Number of Com.. (0x03|0x0035) plen 5  #157 [hci1] 12.605017
        Num handles: 1
        Handle: 2199 Address: DF:A9:FF:F6:B1:1A (OUI DF-A9-FF)
        Count: 1
< ACL Data TX: Handle 2199 flags 0x00 dlen 21             #158 [hci1] 12.605107
      SMP: Pairing Random (0x04) len 16
        Random value: 92f20f6ad8f13724432c7fd6001c45ff
> HCI Event: Number of Completed Packets (0x13) plen 5    #159 [hci1] 12.769149
        Num handles: 1
        Handle: 2199 Address: DF:A9:FF:F6:B1:1A (OUI DF-A9-FF)
        Count: 1
        #158: len 21 (1 Kb/s)
        Latency: 164 msec (69-172 msec ~166 msec)
> ACL Data RX: Handle 2199 flags 0x02 dlen 21             #160 [hci1] 12.856971
      SMP: Pairing Confirm (0x03) len 16
        Confim value: 4a87a41ae63fad19b7db82c70eddce74
< HCI Command: Host Number of Com.. (0x03|0x0035) plen 5  #161 [hci1] 12.864666
        Num handles: 1
        Handle: 2199 Address: DF:A9:FF:F6:B1:1A (OUI DF-A9-FF)
        Count: 1
< ACL Data TX: Handle 2199 flags 0x00 dlen 21             #162 [hci1] 12.864844
      SMP: Pairing Confirm (0x03) len 16
        Confim value: d15ddea1d5e0df9b72179bb9aaaef050
> HCI Event: Number of Completed Packets (0x13) plen 5    #163 [hci1] 13.031830
        Num handles: 1
        Handle: 2199 Address: DF:A9:FF:F6:B1:1A (OUI DF-A9-FF)
        Count: 1
        #162: len 21 (1 Kb/s)
        Latency: 166 msec (69-172 msec ~166 msec)
> ACL Data RX: Handle 2199 flags 0x02 dlen 21             #164 [hci1] 13.032200
      SMP: Pairing Random (0x04) len 16
        Random value: 616d4bbcd650cd190000000000000000
< HCI Command: Host Number of Com.. (0x03|0x0035) plen 5  #165 [hci1] 13.044368
        Num handles: 1
        Handle: 2199 Address: DF:A9:FF:F6:B1:1A (OUI DF-A9-FF)
        Count: 1
< ACL Data TX: Handle 2199 flags 0x00 dlen 21             #166 [hci1] 13.044429
      SMP: Pairing Random (0x04) len 16
        Random value: 23ac32ebbb5e14c8a6b9622f296d277f
> HCI Event: Number of Completed Packets (0x13) plen 5    #167 [hci1] 13.206635
        Num handles: 1
        Handle: 2199 Address: DF:A9:FF:F6:B1:1A (OUI DF-A9-FF)
        Count: 1
        #166: len 21 (1 Kb/s)
        Latency: 162 msec (69-172 msec ~164 msec)
> ACL Data RX: Handle 2199 flags 0x02 dlen 21             #168 [hci1] 13.294471
      SMP: Pairing Confirm (0x03) len 16
        Confim value: 5fcabff56b583bfa23f4750abd27356b
< HCI Command: Host Number of Com.. (0x03|0x0035) plen 5  #169 [hci1] 13.304413
        Num handles: 1
        Handle: 2199 Address: DF:A9:FF:F6:B1:1A (OUI DF-A9-FF)
        Count: 1
< ACL Data TX: Handle 2199 flags 0x00 dlen 21             #170 [hci1] 13.304468
      SMP: Pairing Confirm (0x03) len 16
        Confim value: 873bd3325577f6f8884ccf0d87d24b54
> HCI Event: Number of Completed Packets (0x13) plen 5    #171 [hci1] 13.469352
        Num handles: 1
        Handle: 2199 Address: DF:A9:FF:F6:B1:1A (OUI DF-A9-FF)
        Count: 1
        #170: len 21 (1 Kb/s)
        Latency: 164 msec (69-172 msec ~164 msec)
> ACL Data RX: Handle 2199 flags 0x02 dlen 21             #172 [hci1] 13.469778
      SMP: Pairing Random (0x04) len 16
        Random value: 26e008b97ec2aa6d0000000000000000
< HCI Command: Host Number of Com.. (0x03|0x0035) plen 5  #173 [hci1] 13.485131
        Num handles: 1
        Handle: 2199 Address: DF:A9:FF:F6:B1:1A (OUI DF-A9-FF)
        Count: 1
< ACL Data TX: Handle 2199 flags 0x00 dlen 21             #174 [hci1] 13.485316
      SMP: Pairing Random (0x04) len 16
        Random value: 297efe85e67448a15f56bd27e3a3cf1d
> HCI Event: Number of Completed Packets (0x13) plen 5    #175 [hci1] 13.644149
        Num handles: 1
        Handle: 2199 Address: DF:A9:FF:F6:B1:1A (OUI DF-A9-FF)
        Count: 1
        #174: len 21 (1 Kb/s)
        Latency: 158 msec (69-172 msec ~161 msec)
> ACL Data RX: Handle 2199 flags 0x02 dlen 21             #176 [hci1] 13.732049
      SMP: Pairing Confirm (0x03) len 16
        Confim value: c11d8af30a7bdb57f32c08992be53d64
< HCI Command: Host Number of Com.. (0x03|0x0035) plen 5  #177 [hci1] 13.744747
        Num handles: 1
        Handle: 2199 Address: DF:A9:FF:F6:B1:1A (OUI DF-A9-FF)
        Count: 1
< ACL Data TX: Handle 2199 flags 0x00 dlen 21             #178 [hci1] 13.744921
      SMP: Pairing Confirm (0x03) len 16
        Confim value: 11a04ec592b9b81bc6c221f8e6b92e67
> HCI Event: Number of Completed Packets (0x13) plen 5    #179 [hci1] 13.906808
        Num handles: 1
        Handle: 2199 Address: DF:A9:FF:F6:B1:1A (OUI DF-A9-FF)
        Count: 1
        #178: len 21 (1 Kb/s)
        Latency: 161 msec (69-172 msec ~161 msec)
> ACL Data RX: Handle 2199 flags 0x02 dlen 21             #180 [hci1] 13.907153
      SMP: Pairing Random (0x04) len 16
        Random value: 93956b222901e6330000000000000000
< HCI Command: Host Number of Com.. (0x03|0x0035) plen 5  #181 [hci1] 13.924985
        Num handles: 1
        Handle: 2199 Address: DF:A9:FF:F6:B1:1A (OUI DF-A9-FF)
        Count: 1
< ACL Data TX: Handle 2199 flags 0x00 dlen 21             #182 [hci1] 13.925118
      SMP: Pairing Random (0x04) len 16
        Random value: 25a9493fd3ce4faf02be7293595bb7c6
> HCI Event: Number of Completed Packets (0x13) plen 5    #183 [hci1] 14.081594
        Num handles: 1
        Handle: 2199 Address: DF:A9:FF:F6:B1:1A (OUI DF-A9-FF)
        Count: 1
        #182: len 21 (1 Kb/s)
        Latency: 156 msec (69-172 msec ~159 msec)
> ACL Data RX: Handle 2199 flags 0x02 dlen 21             #184 [hci1] 14.169477
      SMP: Pairing Confirm (0x03) len 16
        Confim value: 8f6101dc313165fbdbf673b71ff55343
< HCI Command: Host Number of Com.. (0x03|0x0035) plen 5  #185 [hci1] 14.184784
        Num handles: 1
        Handle: 2199 Address: DF:A9:FF:F6:B1:1A (OUI DF-A9-FF)
        Count: 1
< ACL Data TX: Handle 2199 flags 0x00 dlen 21             #186 [hci1] 14.184898
      SMP: Pairing Confirm (0x03) len 16
        Confim value: dca2efb53f6fa9184242eff1096332f7
> HCI Event: Number of Completed Packets (0x13) plen 5    #187 [hci1] 14.344281
        Num handles: 1
        Handle: 2199 Address: DF:A9:FF:F6:B1:1A (OUI DF-A9-FF)
        Count: 1
        #186: len 21 (1 Kb/s)
        Latency: 159 msec (69-172 msec ~159 msec)
> ACL Data RX: Handle 2199 flags 0x02 dlen 21             #188 [hci1] 14.344647
      SMP: Pairing Random (0x04) len 16
        Random value: 29553d08d11192730000000000000000
< HCI Command: Host Number of Com.. (0x03|0x0035) plen 5  #189 [hci1] 14.365113
        Num handles: 1
        Handle: 2199 Address: DF:A9:FF:F6:B1:1A (OUI DF-A9-FF)
        Count: 1
< ACL Data TX: Handle 2199 flags 0x00 dlen 21             #190 [hci1] 14.365293
      SMP: Pairing Random (0x04) len 16
        Random value: 58f6b41f855a6f6c3560debd84e2affc
> HCI Event: Number of Completed Packets (0x13) plen 5    #191 [hci1] 14.519073
        Num handles: 1
        Handle: 2199 Address: DF:A9:FF:F6:B1:1A (OUI DF-A9-FF)
        Count: 1
        #190: len 21 (1 Kb/s)
        Latency: 153 msec (69-172 msec ~156 msec)
> ACL Data RX: Handle 2199 flags 0x02 dlen 21             #192 [hci1] 14.607034
      SMP: Pairing Confirm (0x03) len 16
        Confim value: efc8f3390ae2d44721ee523449a356a3
< HCI Command: Host Number of Com.. (0x03|0x0035) plen 5  #193 [hci1] 14.624868
        Num handles: 1
        Handle: 2199 Address: DF:A9:FF:F6:B1:1A (OUI DF-A9-FF)
        Count: 1
< ACL Data TX: Handle 2199 flags 0x00 dlen 21             #194 [hci1] 14.624970
      SMP: Pairing Confirm (0x03) len 16
        Confim value: 86ba179fd0118932d88bab853544c8b6
> HCI Event: Number of Completed Packets (0x13) plen 5    #195 [hci1] 14.781734
        Num handles: 1
        Handle: 2199 Address: DF:A9:FF:F6:B1:1A (OUI DF-A9-FF)
        Count: 1
        #194: len 21 (1 Kb/s)
        Latency: 156 msec (69-172 msec ~156 msec)
> ACL Data RX: Handle 2199 flags 0x02 dlen 21             #196 [hci1] 14.782091
      SMP: Pairing Random (0x04) len 16
        Random value: 98f76ee4decb3fb40000000000000000
< HCI Command: Host Number of Com.. (0x03|0x0035) plen 5  #197 [hci1] 14.785065
        Num handles: 1
        Handle: 2199 Address: DF:A9:FF:F6:B1:1A (OUI DF-A9-FF)
        Count: 1
< ACL Data TX: Handle 2199 flags 0x00 dlen 21             #198 [hci1] 14.785192
      SMP: Pairing Random (0x04) len 16
        Random value: b67e7216d5bf664139eda2b542549666
> HCI Event: Number of Completed Packets (0x13) plen 5    #199 [hci1] 14.956640
        Num handles: 1
        Handle: 2199 Address: DF:A9:FF:F6:B1:1A (OUI DF-A9-FF)
        Count: 1
        #198: len 21 (0 Kb/s)
        Latency: 171 msec (69-172 msec ~164 msec)
> ACL Data RX: Handle 2199 flags 0x02 dlen 21             #200 [hci1] 15.044469
      SMP: Pairing Confirm (0x03) len 16
        Confim value: 6ecf9a7c39eb20dd2fe0d041a5ceda30
< HCI Command: Host Number of Com.. (0x03|0x0035) plen 5  #201 [hci1] 15.064744
        Num handles: 1
        Handle: 2199 Address: DF:A9:FF:F6:B1:1A (OUI DF-A9-FF)
        Count: 1
< ACL Data TX: Handle 2199 flags 0x00 dlen 21             #202 [hci1] 15.064878
      SMP: Pairing Confirm (0x03) len 16
        Confim value: 61f18286df295134a6abed4dbec0da58
> HCI Event: Number of Completed Packets (0x13) plen 5    #203 [hci1] 15.219303
        Num handles: 1
        Handle: 2199 Address: DF:A9:FF:F6:B1:1A (OUI DF-A9-FF)
        Count: 1
        #202: len 21 (1 Kb/s)
        Latency: 154 msec (69-172 msec ~159 msec)
> ACL Data RX: Handle 2199 flags 0x02 dlen 21             #204 [hci1] 15.219632
      SMP: Pairing Random (0x04) len 16
        Random value: 677dad0ed3f382de0000000000000000
< HCI Command: Host Number of Com.. (0x03|0x0035) plen 5  #205 [hci1] 15.225096
        Num handles: 1
        Handle: 2199 Address: DF:A9:FF:F6:B1:1A (OUI DF-A9-FF)
        Count: 1
< ACL Data TX: Handle 2199 flags 0x00 dlen 21             #206 [hci1] 15.225278
      SMP: Pairing Random (0x04) len 16
        Random value: ed17f76500c95219dd01e09d1e63f87b
> HCI Event: Number of Completed Packets (0x13) plen 5    #207 [hci1] 15.394015
        Num handles: 1
        Handle: 2199 Address: DF:A9:FF:F6:B1:1A (OUI DF-A9-FF)
        Count: 1
        #206: len 21 (1 Kb/s)
        Latency: 168 msec (69-172 msec ~163 msec)
> ACL Data RX: Handle 2199 flags 0x02 dlen 21             #208 [hci1] 15.481955
      SMP: Pairing Confirm (0x03) len 16
        Confim value: 0e970b4a82bfb72de2b44ec7d7da53a8
< HCI Command: Host Number of Com.. (0x03|0x0035) plen 5  #209 [hci1] 15.484465
        Num handles: 1
        Handle: 2199 Address: DF:A9:FF:F6:B1:1A (OUI DF-A9-FF)
        Count: 1
< ACL Data TX: Handle 2199 flags 0x00 dlen 21             #210 [hci1] 15.484568
      SMP: Pairing Confirm (0x03) len 16
        Confim value: 92a30a8d5865ac17969dc82e36f94014
> HCI Event: Number of Completed Packets (0x13) plen 5    #211 [hci1] 15.656791
        Num handles: 1
        Handle: 2199 Address: DF:A9:FF:F6:B1:1A (OUI DF-A9-FF)
        Count: 1
        #210: len 21 (0 Kb/s)
        Latency: 172 msec (69-172 msec ~168 msec)
> ACL Data RX: Handle 2199 flags 0x02 dlen 21             #212 [hci1] 15.657149
      SMP: Pairing Random (0x04) len 16
        Random value: 19139cd307e8aa880000000000000000
< HCI Command: Host Number of Com.. (0x03|0x0035) plen 5  #213 [hci1] 15.664394
        Num handles: 1
        Handle: 2199 Address: DF:A9:FF:F6:B1:1A (OUI DF-A9-FF)
        Count: 1
< ACL Data TX: Handle 2199 flags 0x00 dlen 21             #214 [hci1] 15.664465
      SMP: Pairing Random (0x04) len 16
        Random value: 81d35d47e1f6006d79c974bd9d9e1ee3
> HCI Event: Number of Completed Packets (0x13) plen 5    #215 [hci1] 15.831642
        Num handles: 1
        Handle: 2199 Address: DF:A9:FF:F6:B1:1A (OUI DF-A9-FF)
        Count: 1
        #214: len 21 (1 Kb/s)
        Latency: 167 msec (69-172 msec ~167 msec)
> ACL Data RX: Handle 2199 flags 0x02 dlen 21             #216 [hci1] 15.919478
      SMP: Pairing Confirm (0x03) len 16
        Confim value: fecd285c44a8660a9661c5b6943aaf9f
< HCI Command: Host Number of Com.. (0x03|0x0035) plen 5  #217 [hci1] 15.924447
        Num handles: 1
        Handle: 2199 Address: DF:A9:FF:F6:B1:1A (OUI DF-A9-FF)
        Count: 1
< ACL Data TX: Handle 2199 flags 0x00 dlen 21             #218 [hci1] 15.924483
      SMP: Pairing Confirm (0x03) len 16
        Confim value: 56ff5eab1e7aa57ab3afa687540d877c
> HCI Event: Number of Completed Packets (0x13) plen 5    #219 [hci1] 16.094234
        Num handles: 1
        Handle: 2199 Address: DF:A9:FF:F6:B1:1A (OUI DF-A9-FF)
        Count: 1
        #218: len 21 (0 Kb/s)
        Latency: 169 msec (69-172 msec ~168 msec)
> ACL Data RX: Handle 2199 flags 0x02 dlen 21             #220 [hci1] 16.094618
      SMP: Pairing Random (0x04) len 16
        Random value: 6247d61715d284af0000000000000000
< HCI Command: Host Number of Com.. (0x03|0x0035) plen 5  #221 [hci1] 16.104986
        Num handles: 1
        Handle: 2199 Address: DF:A9:FF:F6:B1:1A (OUI DF-A9-FF)
        Count: 1
< ACL Data TX: Handle 2199 flags 0x00 dlen 21             #222 [hci1] 16.105120
      SMP: Pairing Random (0x04) len 16
        Random value: e7f7e0c2476823e41736a7e381bafb7c
> HCI Event: Number of Completed Packets (0x13) plen 5    #223 [hci1] 16.269068
        Num handles: 1
        Handle: 2199 Address: DF:A9:FF:F6:B1:1A (OUI DF-A9-FF)
        Count: 1
        #222: len 21 (1 Kb/s)
        Latency: 163 msec (69-172 msec ~166 msec)
> ACL Data RX: Handle 2199 flags 0x02 dlen 21             #224 [hci1] 16.356861
      SMP: Pairing Confirm (0x03) len 16
        Confim value: 09b3f53cda96d8485ff1e1472459f7ac
< HCI Command: Host Number of Com.. (0x03|0x0035) plen 5  #225 [hci1] 16.364818
        Num handles: 1
        Handle: 2199 Address: DF:A9:FF:F6:B1:1A (OUI DF-A9-FF)
        Count: 1
< ACL Data TX: Handle 2199 flags 0x00 dlen 21             #226 [hci1] 16.364979
      SMP: Pairing Confirm (0x03) len 16
        Confim value: b17ec75185981cb403b3584cccdb4f3d
> HCI Event: Number of Completed Packets (0x13) plen 5    #227 [hci1] 16.531719
        Num handles: 1
        Handle: 2199 Address: DF:A9:FF:F6:B1:1A (OUI DF-A9-FF)
        Count: 1
        #226: len 21 (1 Kb/s)
        Latency: 166 msec (69-172 msec ~166 msec)
> ACL Data RX: Handle 2199 flags 0x02 dlen 21             #228 [hci1] 16.532047
      SMP: Pairing Random (0x04) len 16
        Random value: 68ae5a8349ee02a80000000000000000
