Bluetooth monitor ver 5.72
= Note: Linux version 6.14.0-36-generic (x86_64)                       0.533313
= Note: Bluetooth subsystem version 2.22                               0.533315
= New Index: 00:00:00:00:00:00 (Primary,UART,hci1)              [hci1] 0.533316
= New Index: 48:5F:99:8E:E0:64 (Primary,USB,hci0)               [hci0] 0.533317
= Open Index: 00:00:00:00:00:00                                 [hci1] 1.047406
= Index Info: 00:00:00:00:00:00 (Nordic Semiconductor ASA)      [hci1] 1.047418
@ USER Open: main (privileged) version 2.22            {0x0001} [hci1] 1.047426
< HCI Command: Reset (0x03|0x0003) plen 0                    #1 [hci1] 1.048586
> HCI Event: Command Complete (0x0e) plen 4                  #2 [hci1] 1.049134
      Reset (0x03|0x0003) ncmd 1
        Status: Success (0x00)
< HCI Command: Read Local Supported... (0x04|0x0003) plen 0  #3 [hci1] 1.067212
> HCI Event: Command Complete (0x0e) plen 12                 #4 [hci1] 1.067738
      Read Local Supported Features (0x04|0x0003) ncmd 1
        Status: Success (0x00)
        Features: 0x00 0x00 0x00 0x00 0x60 0x00 0x00 0x00
          BR/EDR Not Supported
          LE Supported (Controller)
< HCI Command: Read Local Version In.. (0x04|0x0001) plen 0  #5 [hci1] 1.086944
> HCI Event: Command Complete (0x0e) plen 12                 #6 [hci1] 1.087402
      Read Local Version Information (0x04|0x0001) ncmd 1
        Status: Success (0x00)
        HCI version: Reserved (0x0f) - Revision 12393 (0x3069)
        LMP version: Reserved (0x0f) - Subversion 12393 (0x3069)
        Manufacturer: Nordic Semiconductor ASA (89)
< HCI Command: Read Local Supported... (0x04|0x0002) plen 0  #7 [hci1] 1.106888
> HCI Event: Command Complete (0x0e) plen 68                 #8 [hci1] 1.107931
      Read Local Supported Commands (0x04|0x0002) ncmd 1
        Status: Success (0x00)
        Commands: 119 entries
          Disconnect (Octet 0 - Bit 5)
          Read Remote Version Information (Octet 2 - Bit 7)
          Set Event Mask (Octet 5 - Bit 6)
          Reset (Octet 5 - Bit 7)
          Read Connection Accept Timeout (Octet 7 - Bit 2)
          Write Connection Accept Timeout (Octet 7 - Bit 3)
          Read Transmit Power Level (Octet 10 - Bit 2)
          Set Controller To Host Flow Control (Octet 10 - Bit 5)
          Host Buffer Size (Octet 10 - Bit 6)
          Host Number of Completed Packets (Octet 10 - Bit 7)
          Read Local Version Information (Octet 14 - Bit 3)
          Read Local Supported Features (Octet 14 - Bit 5)
          Read BD ADDR (Octet 15 - Bit 1)
          Read RSSI (Octet 15 - Bit 5)
          Set Event Mask Page 2 (Octet 22 - Bit 2)
          LE Set Event Mask (Octet 25 - Bit 0)
          LE Read Buffer Size (Octet 25 - Bit 1)
          LE Read Local Supported Features (Octet 25 - Bit 2)
          LE Set Random Address (Octet 25 - Bit 4)
          LE Set Advertising Parameters (Octet 25 - Bit 5)
          LE Read Advertising Channel TX Power (Octet 25 - Bit 6)
          LE Set Advertising Data (Octet 25 - Bit 7)
          LE Set Scan Response Data (Octet 26 - Bit 0)
          LE Set Advertise Enable (Octet 26 - Bit 1)
          LE Set Scan Parameters (Octet 26 - Bit 2)
          LE Set Scan Enable (Octet 26 - Bit 3)
          LE Create Connection (Octet 26 - Bit 4)
          LE Create Connection Cancel (Octet 26 - Bit 5)
          LE Read Accept List Size (Octet 26 - Bit 6)
          LE Clear Accept List (Octet 26 - Bit 7)
          LE Add Device To Accept List (Octet 27 - Bit 0)
          LE Remove Device From Accept List (Octet 27 - Bit 1)
          LE Connection Update (Octet 27 - Bit 2)
          LE Set Host Channel Classification (Octet 27 - Bit 3)
          LE Read Channel Map (Octet 27 - Bit 4)
          LE Read Remote Used Features (Octet 27 - Bit 5)
          LE Encrypt (Octet 27 - Bit 6)
          LE Rand (Octet 27 - Bit 7)
          LE Start Encryption (Octet 28 - Bit 0)
          LE Long Term Key Request Reply (Octet 28 - Bit 1)
          LE Long Term Key Request Neg Reply (Octet 28 - Bit 2)
          LE Read Supported States (Octet 28 - Bit 3)
          LE Receiver Test (Octet 28 - Bit 4)
          LE Transmitter Test (Octet 28 - Bit 5)
          LE Test End (Octet 28 - Bit 6)
          Read Authenticated Payload Timeout (Octet 32 - Bit 4)
          Write Authenticated Payload Timeout (Octet 32 - Bit 5)
          LE Set Data Length (Octet 33 - Bit 6)
          LE Read Suggested Default Data Length (Octet 33 - Bit 7)
          LE Write Suggested Default Data Length (Octet 34 - Bit 0)
          LE Add Device To Resolving List (Octet 34 - Bit 3)
          LE Remove Device From Resolving List (Octet 34 - Bit 4)
          LE Clear Resolving List (Octet 34 - Bit 5)
          LE Read Resolving List Size (Octet 34 - Bit 6)
          LE Set Address Resolution Enable (Octet 35 - Bit 1)
          LE Set Resolvable Private Address Timeout (Octet 35 - Bit 2)
          LE Read Maximum Data Length (Octet 35 - Bit 3)
          LE Read PHY (Octet 35 - Bit 4)
          LE Set Default PHY (Octet 35 - Bit 5)
          LE Set PHY (Octet 35 - Bit 6)
          LE Enhanced Receiver Test (Octet 35 - Bit 7)
          LE Enhanced Transmitter Test (Octet 36 - Bit 0)
          LE Set Advertising Set Random Address (Octet 36 - Bit 1)
          LE Set Extended Advertising Parameters (Octet 36 - Bit 2)
          LE Set Extended Advertising Data (Octet 36 - Bit 3)
          LE Set Extended Scan Response Data (Octet 36 - Bit 4)
          LE Set Extended Advertising Enable (Octet 36 - Bit 5)
          LE Read Maximum Advertising Data Length (Octet 36 - Bit 6)
          LE Read Number of Supported Advertising Sets (Octet 36 - Bit 7)
          LE Remove Advertising Set (Octet 37 - Bit 0)
          LE Clear Advertising Sets (Octet 37 - Bit 1)
          LE Set Periodic Advertising Parameters (Octet 37 - Bit 2)
          LE Set Periodic Advertising Data (Octet 37 - Bit 3)
          LE Set Periodic Advertising Enable (Octet 37 - Bit 4)
          LE Set Extended Scan Parameters (Octet 37 - Bit 5)
          LE Set Extended Scan Enable (Octet 37 - Bit 6)
          LE Extended Create Connection (Octet 37 - Bit 7)
          LE Periodic Advertising Create Sync (Octet 38 - Bit 0)
          LE Periodic Advertising Create Sync Cancel (Octet 38 - Bit 1)
          LE Periodic Advertising Terminate Sync (Octet 38 - Bit 2)
          LE Add Device To Periodic Advertiser List (Octet 38 - Bit 3)
          LE Remove Device From Periodic Advertiser List (Octet 38 - Bit 4)
          LE Clear Periodic Advertiser List (Octet 38 - Bit 5)
          LE Read Periodic Advertiser List Size (Octet 38 - Bit 6)
          LE Read Transmit Power (Octet 38 - Bit 7)
          LE Read RF Path Compensation (Octet 39 - Bit 0)
          LE Write RF Path Compensation (Octet 39 - Bit 1)
          LE Set Privacy Mode (Octet 39 - Bit 2)
          LE Periodic Advertising Receive Enable (Octet 40 - Bit 5)
          LE Periodic Advertising Sync Transfer (Octet 40 - Bit 6)
          LE Periodic Advertising Set Info Transfer (Octet 40 - Bit 7)
          LE Periodic Advertising Sync Transfer Parameters (Octet 41 - Bit 0)
          LE Set Default Periodic Advertisng Sync Transfer Parameters (Octet 41 - Bit 1)
          LE Read Buffer v2 (Octet 41 - Bit 5)
          LE Read ISO TX Sync (Octet 41 - Bit 6)
          LE Set Connected Isochronous Group Parameters (Octet 41 - Bit 7)
          LE Set Connected Isochronous Group Parameters Test (Octet 42 - Bit 0)
          LE Create Connected Isochronous Stream (Octet 42 - Bit 1)
          LE Remove Connected Isochronous Group (Octet 42 - Bit 2)
          LE Accept Connected Isochronous Stream Request (Octet 42 - Bit 3)
          LE Reject Connected Isochronous Stream Request (Octet 42 - Bit 4)
          LE Create Broadcast Isochronous Group (Octet 42 - Bit 5)
          LE Create Broadcast Isochronous Group Test (Octet 42 - Bit 6)
          LE Terminate Broadcast Isochronous Group (Octet 42 - Bit 7)
          LE Broadcast Isochronous Group Create Sync (Octet 43 - Bit 0)
          LE Broadcast Isochronous Group Terminate Sync (Octet 43 - Bit 1)
          LE Request Peer SCA (Octet 43 - Bit 2)
          LE Setup Isochronous Data Path (Octet 43 - Bit 3)
          LE Remove Isochronous Data Path (Octet 43 - Bit 4)
          LE Isochronous Transmit Test (Octet 43 - Bit 5)
          LE Isochronous Receive Test (Octet 43 - Bit 6)
          LE Isochronous Read Test Counters (Octet 43 - Bit 7)
          LE Isochronous Read Test Counters (Octet 44 - Bit 0)
          LE Set Host Feature (Octet 44 - Bit 1)
          Octet 44 - Bit 2 
          Octet 45 - Bit 6 
          Octet 46 - Bit 0 
          Octet 46 - Bit 1 
          Octet 46 - Bit 2 
< HCI Command: Host Buffer Size (0x03|0x0033) plen 7         #9 [hci1] 1.126896
        ACL MTU: 255  ACL max packet: 16
        SCO MTU: 0    SCO max packet: 0
> HCI Event: Command Complete (0x0e) plen 4                 #10 [hci1] 1.127394
      Host Buffer Size (0x03|0x0033) ncmd 1
        Status: Success (0x00)
< HCI Command: Set Controller To Ho.. (0x03|0x0031) plen 1  #11 [hci1] 1.146896
        Flow control: ACL Data Packets (0x01)
> HCI Event: Command Complete (0x0e) plen 4                 #12 [hci1] 1.147394
      Set Controller To Host Flow Control (0x03|0x0031) ncmd 1
        Status: Success (0x00)
< HCI Command: LE Read Local Suppor.. (0x08|0x0003) plen 0  #13 [hci1] 1.166887
> HCI Event: Command Complete (0x0e) plen 12                #14 [hci1] 1.167507
      LE Read Local Supported Features (0x08|0x0003) ncmd 1
        Status: Success (0x00)
        Features: 0xfd 0x79 0x00 0xf7 0x30 0x01 0x00 0x00
          LE Encryption
          Extended Reject Indication
          Peripheral-initiated Features Exchange
          LE Ping
          LE Data Packet Length Extension
          LL Privacy
          Extended Scanner Filter Policies
          LE 2M PHY
          LE Coded PHY
          LE Extended Advertising
          LE Periodic Advertising
          Channel Selection Algorithm #2
          Periodic Advertising Sync Transfer - Sender
          Periodic Advertising Sync Transfer - Recipient
          Sleep Clock Accuracy Updates
          Connected Isochronous Stream - Central
          Connected Isochronous Stream - Peripheral
          Isochronous Broadcaster
          Synchronized Receiver
          Periodic Advertising ADI support
          Connection Subrating
          Unknown features (0x0000010000000000)
< HCI Command: LE Set Host Feature (0x08|0x0074) plen 2     #15 [hci1] 1.186898
        Bit Number: 32
          Connected Isochronous Stream (Host Support)
        Bit Value: 1
> HCI Event: Command Complete (0x0e) plen 4                 #16 [hci1] 1.187363
      LE Set Host Feature (0x08|0x0074) ncmd 1
        Status: Success (0x00)
< HCI Command: LE Read Buffer v2 (0x08|0x0060) plen 0       #17 [hci1] 1.206886
> HCI Event: Command Complete (0x0e) plen 10                #18 [hci1] 1.207385
      LE Read Buffer v2 (0x08|0x0060) ncmd 1
        Status: Success (0x00)
        ACL MTU: 27
        ACL max packet: 3
        ISO MTU: 318
        ISO max packet: 3
< HCI Command: LE Read Maximum Adve.. (0x08|0x003a) plen 0  #19 [hci1] 1.226918
> HCI Event: Command Complete (0x0e) plen 6                 #20 [hci1] 1.227360
      LE Read Maximum Advertising Data Length (0x08|0x003a) ncmd 1
        Status: Success (0x00)
        Max length: 1650
< HCI Command: LE Read Supported St.. (0x08|0x001c) plen 0  #21 [hci1] 1.246891
> HCI Event: Command Complete (0x0e) plen 12                #22 [hci1] 1.247386
      LE Read Supported States (0x08|0x001c) ncmd 1
        Status: Success (0x00)
        States: 0x000003ff3e0306ff
          Non-connectable Advertising State
          Scannable Advertising State
          Connectable Advertising State
          High Duty Cycle Directed Advertising State
          Passive Scanning State
          Active Scanning State
          Initiating State
            and Connection State (Central Role)
          Connection State (Peripheral Role)
          Scannable Advertising State
            and Passive Scanning State
          Connectable Advertising State
            and Passive Scanning State
          Non-connectable Advertising State
            and Initiating State
          Scannable Advertising State
            and Initiating State
          Active Scanning State
            and Connection State (Central Role)
          Passive Scanning State
            and Connection State (Peripheral Role)
          Active Scanning State
            and Connection State (Peripheral Role)
          Initiating State
            and Connection State (Central Role)
            and Central Role & Central Role
          Low Duty Cycle Directed Advertising State
          Connectable Advertising State
            and Initiating State
            and Central Role & Peripheral Role
          High Duty Cycle Directed Advertising State
            and Initiating State
            and Central Role & Peripheral Role
          Low Duty Cycle Directed Advertising State
            and Initiating State
            and Central Role & Peripheral Role
          Connectable Advertising State
            and Connection State (Central Role)
            and Central Role & Peripheral Role
          High Duty Cycle Directed Advertising State
            and Connection State (Central Role)
            and Central Role & Peripheral Role
          Low Duty Cycle Directed Advertising State
            and Connection State (Central Role)
            and Central Role & Peripheral Role
          Connectable Advertising State
            and Connection State (Peripheral Role)
            and Central Role & Peripheral Role
          High Duty Cycle Directed Advertising State
            and Connection State (Peripheral Role)
            and Peripheral Role & Peripheral Role
          Low Duty Cycle Directed Advertising State
            and Connection State (Peripheral Role)
            and Peripheral Role & Peripheral Role
          Initiating State
            and Connection State (Peripheral Role)
            and Central Role & Peripheral Role
< HCI Command: LE Read Maximum Data.. (0x08|0x002f) plen 0  #23 [hci1] 1.266887
> HCI Event: Command Complete (0x0e) plen 12                #24 [hci1] 1.267391
      LE Read Maximum Data Length (0x08|0x002f) ncmd 1
        Status: Success (0x00)
        Max TX octets: 251
        Max TX time: 2704
        Max RX octets: 251
        Max RX time: 2704
< HCI Command: LE Write Suggested D.. (0x08|0x0024) plen 4  #25 [hci1] 1.286893
        TX octets: 251
        TX time: 2704
> HCI Event: Command Complete (0x0e) plen 4                 #26 [hci1] 1.287411
      LE Write Suggested Default Data Length (0x08|0x0024) ncmd 1
        Status: Success (0x00)
< HCI Command: LE Read Resolving Li.. (0x08|0x002a) plen 0  #27 [hci1] 1.306898
> HCI Event: Command Complete (0x0e) plen 5                 #28 [hci1] 1.307312
      LE Read Resolving List Size (0x08|0x002a) ncmd 1
        Status: Success (0x00)
        Size: 8
< HCI Command: LE Set Event Mask (0x08|0x0001) plen 8       #29 [hci1] 1.326886
        Mask: 0x000002023f87fa5e
          LE Advertising Report
          LE Connection Update Complete
          LE Read Remote Used Features Complete
          LE Long Term Key Request
          LE Data Length Change
          LE Enhanced Connection Complete
          LE PHY Update Complete
          LE Extended Advertising Report
          LE Periodic Advertising Sync Established
          LE Periodic Advertising Report
          LE Periodic Advertising Sync Lost
          LE Extended Scan Timeout
          LE Extended Advertising Set Terminated
          LE Scan Request Received
          LE Periodic Advertising Sync Transfer Rvc
          LE CIS Established
          LE CIS Request
          LE Create BIG Complete
          LE Terminate BIG Complete
          LE BIG Sync Estabilished Complete
          LE BIG Sync Lost
          LE BIG Info Advertising Report
          Unknown mask (0x0000020000000000)
> HCI Event: Command Complete (0x0e) plen 4                 #30 [hci1] 1.327339
      LE Set Event Mask (0x08|0x0001) ncmd 1
        Status: Success (0x00)
< HCI Command: Set Event Mask (0x03|0x0001) plen 8          #31 [hci1] 1.346877
        Mask: 0x2000800002008890
          Disconnection Complete
          Encryption Change
          Read Remote Version Information Complete
          Hardware Error
          Data Buffer Overflow
          Encryption Key Refresh Complete
          LE Meta
> HCI Event: Command Complete (0x0e) plen 4                 #32 [hci1] 1.347397
      Set Event Mask (0x03|0x0001) ncmd 1
        Status: Success (0x00)
< HCI Command: Read BD ADDR (0x04|0x0009) plen 0            #33 [hci1] 1.366845
> HCI Event: Command Complete (0x0e) plen 10                #34 [hci1] 1.367283
      Read BD ADDR (0x04|0x0009) ncmd 1
        Status: Success (0x00)
        Address: 00:00:00:00:00:00 (OUI 00-00-00)
< HCI Command: LE Set Random Address (0x08|0x0005) plen 6   #35 [hci1] 1.386891
        Address: D5:B6:CC:31:DB:3B (Static)
> HCI Event: Command Complete (0x0e) plen 4                 #36 [hci1] 1.387408
      LE Set Random Address (0x08|0x0005) ncmd 1
        Status: Success (0x00)
< HCI Command: LE Set Extended Adv.. (0x08|0x0036) plen 25  #37 [hci1] 3.887021
        Handle: 0x00
        Properties: 0x0013
          Connectable
          Scannable
          Use legacy advertising PDUs: ADV_IND
        Min advertising interval: 100.000 msec (0x00a0)
        Max advertising interval: 150.000 msec (0x00f0)
        Channel map: 37, 38, 39 (0x07)
        Own address type: Random (0x01)
        Peer address type: Public (0x00)
        Peer address: 00:00:00:00:00:00 (OUI 00-00-00)
        Filter policy: Allow Scan Request from Any, Allow Connect Request from Any (0x00)
        TX power: Host has no preference (0x7f)
        Primary PHY: LE 1M (0x01)
        Secondary max skip: 0x00
        Secondary PHY: LE 1M (0x01)
        SID: 0x00
        Scan request notifications: Disabled (0x00)
> HCI Event: Command Complete (0x0e) plen 5                 #38 [hci1] 3.887755
      LE Set Extended Advertising Parameters (0x08|0x0036) ncmd 1
        Status: Success (0x00)
        TX power (selected): 0 dbm (0x00)
< HCI Command: LE Set Advertising S.. (0x08|0x0035) plen 7  #39 [hci1] 3.906971
        Advertising handle: 0x00
        Advertising random address: D5:B6:CC:31:DB:3B (Static)
> HCI Event: Command Complete (0x0e) plen 4                 #40 [hci1] 3.907473
      LE Set Advertising Set Random Address (0x08|0x0035) ncmd 1
        Status: Success (0x00)
< HCI Command: LE Set Extended Adv.. (0x08|0x0037) plen 22  #41 [hci1] 3.926944
        Handle: 0x00
        Operation: Complete extended advertising data (0x03)
        Fragment preference: Minimize fragmentation (0x01)
        Data length: 0x12
        Flags: 0x06
          LE General Discoverable Mode
          BR/EDR Not Supported
        Name (complete): Tester_F6B11A
> HCI Event: Command Complete (0x0e) plen 4                 #42 [hci1] 3.927756
      LE Set Extended Advertising Data (0x08|0x0037) ncmd 1
        Status: Success (0x00)
< HCI Command: LE Set Extended Scan.. (0x08|0x0038) plen 4  #43 [hci1] 3.946946
        Handle: 0x00
        Operation: Complete scan response data (0x03)
        Fragment preference: Minimize fragmentation (0x01)
        Data length: 0x00
> HCI Event: Command Complete (0x0e) plen 4                 #44 [hci1] 3.947404
      LE Set Extended Scan Response Data (0x08|0x0038) ncmd 1
        Status: Success (0x00)
< HCI Command: LE Set Extended Adve.. (0x08|0x0039) plen 6  #45 [hci1] 3.966923
        Extended advertising: Enabled (0x01)
        Number of sets: 1 (0x01)
        Entry 0
          Handle: 0x00
          Duration: 0 ms (0x00)
          Max ext adv events: 0
> HCI Event: Command Complete (0x0e) plen 4                 #46 [hci1] 3.967498
      LE Set Extended Advertising Enable (0x08|0x0039) ncmd 1
        Status: Success (0x00)
> HCI Event: LE Meta Event (0x3e) plen 31                   #47 [hci1] 5.659034
      LE Enhanced Connection Complete (0x0a)
        Status: Success (0x00)
        Handle: 3117
        Role: Peripheral (0x01)
        Peer address type: Public (0x00)
        Peer address: DF:A9:FF:F6:B1:1A (OUI DF-A9-FF)
        Local resolvable private address: 00:00:00:00:00:00 (Non-Resolvable)
        Peer resolvable private address: 00:00:00:00:00:00 (Non-Resolvable)
        Connection interval: 87.50 msec (0x0046)
        Connection latency: 0 (0x0000)
        Supervision timeout: 25120 msec (0x09d0)
        Central clock accuracy: 0x01
> HCI Event: LE Meta Event (0x3e) plen 6                    #48 [hci1] 5.659042
      LE Advertising Set Terminated (0x12)
        Status: Success (0x00)
        Handle: 0
        Connection handle: 3117
        Number of completed extended advertising events: 0
< HCI Command: LE Read Remote Used... (0x08|0x0016) plen 2  #49 [hci1] 5.668017
        Handle: 3117 Address: DF:A9:FF:F6:B1:1A (OUI DF-A9-FF)
< ACL Data TX: Handle 3117 flags 0x00 dlen 7                #50 [hci1] 5.668055
      ATT: Exchange MTU Request (0x02) len 2
        Client RX MTU: 251
> HCI Event: Command Status (0x0f) plen 4                   #51 [hci1] 5.668508
      LE Read Remote Used Features (0x08|0x0016) ncmd 1
        Status: Success (0x00)
> HCI Event: Number of Completed Packets (0x13) plen 5      #52 [hci1] 5.834923
        Num handles: 1
        Handle: 3117 Address: DF:A9:FF:F6:B1:1A (OUI DF-A9-FF)
        Count: 1
        #50: len 7 (0 Kb/s)
        Latency: 166 msec (166-166 msec ~166 msec)
> HCI Event: LE Meta Event (0x3e) plen 12                   #53 [hci1] 5.922762
      LE Read Remote Used Features (0x04)
        Status: Success (0x00)
        Handle: 3117 Address: DF:A9:FF:F6:B1:1A (OUI DF-A9-FF)
        Features: 0x2d 0x49 0x00 0xf7 0x67 0xd8 0x00 0x00
          LE Encryption
          Extended Reject Indication
          Peripheral-initiated Features Exchange
          LE Data Packet Length Extension
          LE 2M PHY
          LE Coded PHY
          Channel Selection Algorithm #2
          Periodic Advertising Sync Transfer - Sender
          Periodic Advertising Sync Transfer - Recipient
          Sleep Clock Accuracy Updates
          Connected Isochronous Stream - Central
          Connected Isochronous Stream - Peripheral
          Isochronous Broadcaster
          Synchronized Receiver
          Connected Isochronous Stream (Host Support)
          LE Power Control Request
          LE Power Control Request
          Connection Subrating
          Connection Subrating (Host Support)
          Unknown features (0x0000d80000000000)
> ACL Data RX: Handle 3117 flags 0x02 dlen 11               #54 [hci1] 8.372574
      SMP: Pairing Request (0x01) len 6
        IO capability: KeyboardDisplay (0x04)
        OOB data: Authentication data not present (0x00)
        Authentication requirement: Bonding, MITM, SC, No Keypresses (0x0d)
        Max encryption key size: 16
        Initiator key distribution: EncKey IdKey (0x03)
        Responder key distribution: EncKey IdKey Sign (0x07)
> ACL Data RX: Handle 3117 flags 0x02 dlen 7                #55 [hci1] 8.373040
      ATT: Exchange MTU Response (0x03) len 2
        Server RX MTU: 23
< HCI Command: Host Number of Compl.. (0x03|0x0035) plen 5  #56 [hci1] 8.387440
        Num handles: 1
        Handle: 3117 Address: DF:A9:FF:F6:B1:1A (OUI DF-A9-FF)
        Count: 1
< ACL Data TX: Handle 3117 flags 0x00 dlen 11               #57 [hci1] 8.387723
      SMP: Pairing Response (0x02) len 6
        IO capability: DisplayOnly (0x00)
        OOB data: Authentication data not present (0x00)
        Authentication requirement: Bonding, No MITM, SC, No Keypresses (0x09)
        Max encryption key size: 16
        Initiator key distribution: IdKey (0x02)
        Responder key distribution: <none> (0x00)
< HCI Command: Host Number of Compl.. (0x03|0x0035) plen 5  #58 [hci1] 8.387925
        Num handles: 1
        Handle: 3117 Address: DF:A9:FF:F6:B1:1A (OUI DF-A9-FF)
        Count: 1
> HCI Event: Number of Completed Packets (0x13) plen 5      #59 [hci1] 8.547527
        Num handles: 1
        Handle: 3117 Address: DF:A9:FF:F6:B1:1A (OUI DF-A9-FF)
        Count: 1
        #57: len 11 (0 Kb/s)
        Latency: 159 msec (159-166 msec ~163 msec)
> ACL Data RX: Handle 3117 flags 0x02 dlen 27               #60 [hci1] 8.547830
> ACL Data RX: Handle 3117 flags 0x01 dlen 27               #61 [hci1] 8.548378
> ACL Data RX: Handle 3117 flags 0x01 dlen 15               #62 [hci1] 8.548804
      SMP: Pairing Public Key (0x0c) len 64
        X: d9634dfaf115801694c3a16c2b564dd729ea2448368e827ecbc1c0430602b5a2
        Y: e5bd2c6c83f7c8afecd0bd0fe1a69f5dbffd60218c970f712c0c4418ddddf326
< HCI Command: Host Number of Compl.. (0x03|0x0035) plen 5  #63 [hci1] 8.567044
        Num handles: 1
        Handle: 3117 Address: DF:A9:FF:F6:B1:1A (OUI DF-A9-FF)
        Count: 1
< HCI Command: Host Number of Compl.. (0x03|0x0035) plen 5  #64 [hci1] 8.567090
        Num handles: 1
        Handle: 3117 Address: DF:A9:FF:F6:B1:1A (OUI DF-A9-FF)
        Count: 1
< HCI Command: Host Number of Compl.. (0x03|0x0035) plen 5  #65 [hci1] 8.567201
        Num handles: 1
        Handle: 3117 Address: DF:A9:FF:F6:B1:1A (OUI DF-A9-FF)
        Count: 1
< ACL Data TX: Handle 3117 flags 0x00 dlen 27               #66 [hci1] 8.567275
< ACL Data TX: Handle 3117 flags 0x01 dlen 27               #67 [hci1] 8.567278
< ACL Data TX: Handle 3117 flags 0x01 dlen 15               #68 [hci1] 8.567284
      SMP: Pairing Public Key (0x0c) len 64
        X: 98308440221e2d910f0e54b71e7ec652857aa9b5a0dc65028824cc19db1226e9
        Y: 67a4816bcb62efb21701e31fdb27561a6217575fb007a8bbdabe7e28b6f68482
> HCI Event: Number of Completed Packets (0x13) plen 5      #69 [hci1] 8.635489
        Num handles: 1
        Handle: 3117 Address: DF:A9:FF:F6:B1:1A (OUI DF-A9-FF)
        Count: 1
        #66: len 27 (3 Kb/s)
        Latency: 68 msec (68-166 msec ~115 msec)
> HCI Event: Number of Completed Packets (0x13) plen 5      #70 [hci1] 8.636132
        Num handles: 1
        Handle: 3117 Address: DF:A9:FF:F6:B1:1A (OUI DF-A9-FF)
        Count: 1
        #67: len 27 (3 Kb/s)
        Latency: 68 msec (68-166 msec ~92 msec)
> HCI Event: Number of Completed Packets (0x13) plen 5      #71 [hci1] 8.722353
        Num handles: 1
        Handle: 3117 Address: DF:A9:FF:F6:B1:1A (OUI DF-A9-FF)
        Count: 1
        #68: len 15 (0 Kb/s)
        Latency: 155 msec (68-166 msec ~123 msec)
> ACL Data RX: Handle 3117 flags 0x02 dlen 21               #72 [hci1] 9.160194
      SMP: Pairing Confirm (0x03) len 16
        Confim value: ac2f9b3355e608a28b9545f0f94207d5
< HCI Command: Host Number of Compl.. (0x03|0x0035) plen 5  #73 [hci1] 9.166903
        Num handles: 1
        Handle: 3117 Address: DF:A9:FF:F6:B1:1A (OUI DF-A9-FF)
        Count: 1
< ACL Data TX: Handle 3117 flags 0x00 dlen 21               #74 [hci1] 9.166983
      SMP: Pairing Confirm (0x03) len 16
        Confim value: e708b596ad4780444719c534c85d9f19
> HCI Event: Number of Completed Packets (0x13) plen 5      #75 [hci1] 9.334985
        Num handles: 1
        Handle: 3117 Address: DF:A9:FF:F6:B1:1A (OUI DF-A9-FF)
        Count: 1
        #74: len 21 (1 Kb/s)
        Latency: 168 msec (68-168 msec ~145 msec)
> ACL Data RX: Handle 3117 flags 0x02 dlen 21               #76 [hci1] 9.335396
      SMP: Pairing Random (0x04) len 16
        Random value: 1f608b086c71380a0000000000000000
< HCI Command: Host Number of Compl.. (0x03|0x0035) plen 5  #77 [hci1] 9.347149
        Num handles: 1
        Handle: 3117 Address: DF:A9:FF:F6:B1:1A (OUI DF-A9-FF)
        Count: 1
< ACL Data TX: Handle 3117 flags 0x00 dlen 21               #78 [hci1] 9.347165
      SMP: Pairing Random (0x04) len 16
        Random value: 8e6108f966a694cbe26df70bb96773e6
> HCI Event: Number of Completed Packets (0x13) plen 5      #79 [hci1] 9.509822
        Num handles: 1
        Handle: 3117 Address: DF:A9:FF:F6:B1:1A (OUI DF-A9-FF)
        Count: 1
        #78: len 21 (1 Kb/s)
        Latency: 162 msec (68-168 msec ~154 msec)
> ACL Data RX: Handle 3117 flags 0x02 dlen 21               #80 [hci1] 9.597606
      SMP: Pairing Confirm (0x03) len 16
        Confim value: a5dbabf987dcbbf00758b91d6df62e3c
< HCI Command: Host Number of Compl.. (0x03|0x0035) plen 5  #81 [hci1] 9.607118
        Num handles: 1
        Handle: 3117 Address: DF:A9:FF:F6:B1:1A (OUI DF-A9-FF)
        Count: 1
< ACL Data TX: Handle 3117 flags 0x00 dlen 21               #82 [hci1] 9.607238
      SMP: Pairing Confirm (0x03) len 16
        Confim value: 58a195c67fd172decf0ce4f4c88f88a6
> HCI Event: Number of Completed Packets (0x13) plen 5      #83 [hci1] 9.772485
        Num handles: 1
        Handle: 3117 Address: DF:A9:FF:F6:B1:1A (OUI DF-A9-FF)
        Count: 1
        #82: len 21 (1 Kb/s)
        Latency: 165 msec (68-168 msec ~159 msec)
> ACL Data RX: Handle 3117 flags 0x02 dlen 21               #84 [hci1] 9.772765
      SMP: Pairing Random (0x04) len 16
        Random value: bbad00dcfb7655dc0000000000000000
< HCI Command: Host Number of Compl.. (0x03|0x0035) plen 5  #85 [hci1] 9.787235
        Num handles: 1
        Handle: 3117 Address: DF:A9:FF:F6:B1:1A (OUI DF-A9-FF)
        Count: 1
< ACL Data TX: Handle 3117 flags 0x00 dlen 21               #86 [hci1] 9.787243
      SMP: Pairing Random (0x04) len 16
        Random value: 4d02679f89a05211af56d8b3da64d21e
> HCI Event: Number of Completed Packets (0x13) plen 5      #87 [hci1] 9.947257
        Num handles: 1
        Handle: 3117 Address: DF:A9:FF:F6:B1:1A (OUI DF-A9-FF)
        Count: 1
        #86: len 21 (1 Kb/s)
        Latency: 160 msec (68-168 msec ~159 msec)
> ACL Data RX: Handle 3117 flags 0x02 dlen 21              #88 [hci1] 10.035104
      SMP: Pairing Confirm (0x03) len 16
        Confim value: a2e582cdeba4baee327ccb2f72a41046
< HCI Command: Host Number of Comp.. (0x03|0x0035) plen 5  #89 [hci1] 10.047395
        Num handles: 1
        Handle: 3117 Address: DF:A9:FF:F6:B1:1A (OUI DF-A9-FF)
        Count: 1
< ACL Data TX: Handle 3117 flags 0x00 dlen 21              #90 [hci1] 10.047553
      SMP: Pairing Confirm (0x03) len 16
        Confim value: c57391b7345806125a4f738470e9f196
> HCI Event: Number of Completed Packets (0x13) plen 5     #91 [hci1] 10.210022
        Num handles: 1
        Handle: 3117 Address: DF:A9:FF:F6:B1:1A (OUI DF-A9-FF)
        Count: 1
        #90: len 21 (1 Kb/s)
        Latency: 162 msec (68-168 msec ~161 msec)
> ACL Data RX: Handle 3117 flags 0x02 dlen 21              #92 [hci1] 10.210298
      SMP: Pairing Random (0x04) len 16
        Random value: e07332b8412cd8a00000000000000000
< HCI Command: Host Number of Comp.. (0x03|0x0035) plen 5  #93 [hci1] 10.227286
        Num handles: 1
        Handle: 3117 Address: DF:A9:FF:F6:B1:1A (OUI DF-A9-FF)
        Count: 1
< ACL Data TX: Handle 3117 flags 0x00 dlen 21              #94 [hci1] 10.227363
      SMP: Pairing Random (0x04) len 16
        Random value: 5e8286bc235a02440d0c3424a2acf8fd
> HCI Event: Number of Completed Packets (0x13) plen 5     #95 [hci1] 10.384733
        Num handles: 1
        Handle: 3117 Address: DF:A9:FF:F6:B1:1A (OUI DF-A9-FF)
        Count: 1
        #94: len 21 (1 Kb/s)
        Latency: 157 msec (68-168 msec ~159 msec)
> ACL Data RX: Handle 3117 flags 0x02 dlen 21              #96 [hci1] 10.472711
      SMP: Pairing Confirm (0x03) len 16
        Confim value: f3af87f2a13b834e12c8b98d5f5c8db1
< HCI Command: Host Number of Comp.. (0x03|0x0035) plen 5  #97 [hci1] 10.487516
        Num handles: 1
        Handle: 3117 Address: DF:A9:FF:F6:B1:1A (OUI DF-A9-FF)
        Count: 1
< ACL Data TX: Handle 3117 flags 0x00 dlen 21              #98 [hci1] 10.487704
      SMP: Pairing Confirm (0x03) len 16
        Confim value: c1774cf4337878d90c7321e347009e3f
> HCI Event: Number of Completed Packets (0x13) plen 5     #99 [hci1] 10.647438
        Num handles: 1
        Handle: 3117 Address: DF:A9:FF:F6:B1:1A (OUI DF-A9-FF)
        Count: 1
        #98: len 21 (1 Kb/s)
        Latency: 159 msec (68-168 msec ~159 msec)
> ACL Data RX: Handle 3117 flags 0x02 dlen 21             #100 [hci1] 10.647795
      SMP: Pairing Random (0x04) len 16
        Random value: 585b3b238e4a03920000000000000000
< HCI Command: Host Number of Com.. (0x03|0x0035) plen 5  #101 [hci1] 10.667293
        Num handles: 1
        Handle: 3117 Address: DF:A9:FF:F6:B1:1A (OUI DF-A9-FF)
        Count: 1
< ACL Data TX: Handle 3117 flags 0x00 dlen 21             #102 [hci1] 10.667389
      SMP: Pairing Random (0x04) len 16
        Random value: 5c4a1bcadd27bd58e945097b00bad7ac
> HCI Event: Number of Completed Packets (0x13) plen 5    #103 [hci1] 10.822210
        Num handles: 1
        Handle: 3117 Address: DF:A9:FF:F6:B1:1A (OUI DF-A9-FF)
        Count: 1
        #102: len 21 (1 Kb/s)
        Latency: 154 msec (68-168 msec ~157 msec)
> ACL Data RX: Handle 3117 flags 0x02 dlen 21             #104 [hci1] 10.910115
      SMP: Pairing Confirm (0x03) len 16
        Confim value: ed5207c52aee2deb5a25a614d35e6a9d
< HCI Command: Host Number of Com.. (0x03|0x0035) plen 5  #105 [hci1] 10.927583
        Num handles: 1
        Handle: 3117 Address: DF:A9:FF:F6:B1:1A (OUI DF-A9-FF)
        Count: 1
< ACL Data TX: Handle 3117 flags 0x00 dlen 21             #106 [hci1] 10.927785
      SMP: Pairing Confirm (0x03) len 16
        Confim value: 82b75a50f8d52941b3172d57c5340192
> HCI Event: Number of Completed Packets (0x13) plen 5    #107 [hci1] 11.084958
        Num handles: 1
        Handle: 3117 Address: DF:A9:FF:F6:B1:1A (OUI DF-A9-FF)
        Count: 1
        #106: len 21 (1 Kb/s)
        Latency: 157 msec (68-168 msec ~157 msec)
> ACL Data RX: Handle 3117 flags 0x02 dlen 21             #108 [hci1] 11.085186
      SMP: Pairing Random (0x04) len 16
        Random value: 3731379d334ac8e80000000000000000
< HCI Command: Host Number of Com.. (0x03|0x0035) plen 5  #109 [hci1] 11.087129
        Num handles: 1
        Handle: 3117 Address: DF:A9:FF:F6:B1:1A (OUI DF-A9-FF)
        Count: 1
< ACL Data TX: Handle 3117 flags 0x00 dlen 21             #110 [hci1] 11.087190
      SMP: Pairing Random (0x04) len 16
        Random value: 32527e6e64e79f33b2e374394db8ab2d
> HCI Event: Number of Completed Packets (0x13) plen 5    #111 [hci1] 11.259688
        Num handles: 1
        Handle: 3117 Address: DF:A9:FF:F6:B1:1A (OUI DF-A9-FF)
        Count: 1
        #110: len 21 (0 Kb/s)
        Latency: 172 msec (68-172 msec ~164 msec)
> ACL Data RX: Handle 3117 flags 0x02 dlen 21             #112 [hci1] 11.347653
      SMP: Pairing Confirm (0x03) len 16
        Confim value: f4b51ee7415e31bea093647293a756e3
< HCI Command: Host Number of Com.. (0x03|0x0035) plen 5  #113 [hci1] 11.367429
        Num handles: 1
        Handle: 3117 Address: DF:A9:FF:F6:B1:1A (OUI DF-A9-FF)
        Count: 1
< ACL Data TX: Handle 3117 flags 0x00 dlen 21             #114 [hci1] 11.367642
      SMP: Pairing Confirm (0x03) len 16
        Confim value: cfdad65f98c7a9fbf21c8768e2158e2e
> HCI Event: Number of Completed Packets (0x13) plen 5    #115 [hci1] 11.522518
        Num handles: 1
        Handle: 3117 Address: DF:A9:FF:F6:B1:1A (OUI DF-A9-FF)
        Count: 1
        #114: len 21 (1 Kb/s)
        Latency: 154 msec (68-172 msec ~159 msec)
> ACL Data RX: Handle 3117 flags 0x02 dlen 21             #116 [hci1] 11.522799
      SMP: Pairing Random (0x04) len 16
        Random value: b0a1bdf1a10d95410000000000000000
< HCI Command: Host Number of Com.. (0x03|0x0035) plen 5  #117 [hci1] 11.527645
        Num handles: 1
        Handle: 3117 Address: DF:A9:FF:F6:B1:1A (OUI DF-A9-FF)
        Count: 1
< ACL Data TX: Handle 3117 flags 0x00 dlen 21             #118 [hci1] 11.527720
      SMP: Pairing Random (0x04) len 16
        Random value: dddbdfe2838e9a8cc6964353c850fef7
> HCI Event: Number of Completed Packets (0x13) plen 5    #119 [hci1] 11.697204
        Num handles: 1
        Handle: 3117 Address: DF:A9:FF:F6:B1:1A (OUI DF-A9-FF)
        Count: 1
        #118: len 21 (0 Kb/s)
        Latency: 169 msec (68-172 msec ~164 msec)
> ACL Data RX: Handle 3117 flags 0x02 dlen 21             #120 [hci1] 11.785057
      SMP: Pairing Confirm (0x03) len 16
        Confim value: a43d0da25585eb55194af2e00b1bc9f7
< HCI Command: Host Number of Com.. (0x03|0x0035) plen 5  #121 [hci1] 11.787167
        Num handles: 1
        Handle: 3117 Address: DF:A9:FF:F6:B1:1A (OUI DF-A9-FF)
        Count: 1
< ACL Data TX: Handle 3117 flags 0x00 dlen 21             #122 [hci1] 11.787331
      SMP: Pairing Confirm (0x03) len 16
        Confim value: 5515e044ffd8000234277e82b9beb21f
> HCI Event: Number of Completed Packets (0x13) plen 5    #123 [hci1] 11.959870
        Num handles: 1
        Handle: 3117 Address: DF:A9:FF:F6:B1:1A (OUI DF-A9-FF)
        Count: 1
        #122: len 21 (0 Kb/s)
        Latency: 172 msec (68-172 msec ~168 msec)
> ACL Data RX: Handle 3117 flags 0x02 dlen 21             #124 [hci1] 11.960223
      SMP: Pairing Random (0x04) len 16
        Random value: 588ec530d909e3870000000000000000
< HCI Command: Host Number of Com.. (0x03|0x0035) plen 5  #125 [hci1] 11.967612
        Num handles: 1
        Handle: 3117 Address: DF:A9:FF:F6:B1:1A (OUI DF-A9-FF)
        Count: 1
< ACL Data TX: Handle 3117 flags 0x00 dlen 21             #126 [hci1] 11.967815
      SMP: Pairing Random (0x04) len 16
        Random value: eb9f1915536596b6fc3db1c86b2b1970
> HCI Event: Number of Completed Packets (0x13) plen 5    #127 [hci1] 12.134701
        Num handles: 1
        Handle: 3117 Address: DF:A9:FF:F6:B1:1A (OUI DF-A9-FF)
        Count: 1
        #126: len 21 (1 Kb/s)
        Latency: 166 msec (68-172 msec ~167 msec)
> ACL Data RX: Handle 3117 flags 0x02 dlen 21             #128 [hci1] 12.222492
      SMP: Pairing Confirm (0x03) len 16
        Confim value: 710b3211be21a591c9b31c0aad6ea726
< HCI Command: Host Number of Com.. (0x03|0x0035) plen 5  #129 [hci1] 12.227569
        Num handles: 1
        Handle: 3117 Address: DF:A9:FF:F6:B1:1A (OUI DF-A9-FF)
        Count: 1
< ACL Data TX: Handle 3117 flags 0x00 dlen 21             #130 [hci1] 12.227776
      SMP: Pairing Confirm (0x03) len 16
        Confim value: 8dfb0da9d492a72118c0221958eecafb
> HCI Event: Number of Completed Packets (0x13) plen 5    #131 [hci1] 12.397449
        Num handles: 1
        Handle: 3117 Address: DF:A9:FF:F6:B1:1A (OUI DF-A9-FF)
        Count: 1
        #130: len 21 (0 Kb/s)
        Latency: 169 msec (68-172 msec ~168 msec)
> ACL Data RX: Handle 3117 flags 0x02 dlen 21             #132 [hci1] 12.397693
      SMP: Pairing Random (0x04) len 16
        Random value: cd73ddfdf8418a310000000000000000
< HCI Command: Host Number of Com.. (0x03|0x0035) plen 5  #133 [hci1] 12.407718
        Num handles: 1
        Handle: 3117 Address: DF:A9:FF:F6:B1:1A (OUI DF-A9-FF)
        Count: 1
< ACL Data TX: Handle 3117 flags 0x00 dlen 21             #134 [hci1] 12.407833
      SMP: Pairing Random (0x04) len 16
        Random value: 5c794dc9ad9f2c3f295ebd5ad5e1c3cf
> HCI Event: Number of Completed Packets (0x13) plen 5    #135 [hci1] 12.572174
        Num handles: 1
        Handle: 3117 Address: DF:A9:FF:F6:B1:1A (OUI DF-A9-FF)
        Count: 1
        #134: len 21 (1 Kb/s)
        Latency: 164 msec (68-172 msec ~166 msec)
> ACL Data RX: Handle 3117 flags 0x02 dlen 21             #136 [hci1] 12.660035
      SMP: Pairing Confirm (0x03) len 16
        Confim value: f3fb72ef210618c5a407064c12617b61
< HCI Command: Host Number of Com.. (0x03|0x0035) plen 5  #137 [hci1] 12.667250
        Num handles: 1
        Handle: 3117 Address: DF:A9:FF:F6:B1:1A (OUI DF-A9-FF)
        Count: 1
< ACL Data TX: Handle 3117 flags 0x00 dlen 21             #138 [hci1] 12.667292
      SMP: Pairing Confirm (0x03) len 16
        Confim value: c1c2ec2a3e116fb22e2024717df1abf2
> HCI Event: Number of Completed Packets (0x13) plen 5    #139 [hci1] 12.834899
        Num handles: 1
        Handle: 3117 Address: DF:A9:FF:F6:B1:1A (OUI DF-A9-FF)
        Count: 1
        #138: len 21 (1 Kb/s)
        Latency: 167 msec (68-172 msec ~167 msec)
> ACL Data RX: Handle 3117 flags 0x02 dlen 21             #140 [hci1] 12.835232
      SMP: Pairing Random (0x04) len 16
        Random value: 6b389e00c0bcd00c0000000000000000
< HCI Command: Host Number of Com.. (0x03|0x0035) plen 5  #141 [hci1] 12.847250
        Num handles: 1
        Handle: 3117 Address: DF:A9:FF:F6:B1:1A (OUI DF-A9-FF)
        Count: 1
< ACL Data TX: Handle 3117 flags 0x00 dlen 21             #142 [hci1] 12.847307
      SMP: Pairing Random (0x04) len 16
        Random value: 5c2fff312cdf99c9491988e877355a9a
> HCI Event: Number of Completed Packets (0x13) plen 5    #143 [hci1] 13.009608
        Num handles: 1
        Handle: 3117 Address: DF:A9:FF:F6:B1:1A (OUI DF-A9-FF)
        Count: 1
        #142: len 21 (1 Kb/s)
        Latency: 162 msec (68-172 msec ~164 msec)
> ACL Data RX: Handle 3117 flags 0x02 dlen 21             #144 [hci1] 13.097517
      SMP: Pairing Confirm (0x03) len 16
        Confim value: bb8c67f61eeafce5fe23dd6de14c16c1
< HCI Command: Host Number of Com.. (0x03|0x0035) plen 5  #145 [hci1] 13.107524
        Num handles: 1
        Handle: 3117 Address: DF:A9:FF:F6:B1:1A (OUI DF-A9-FF)
        Count: 1
< ACL Data TX: Handle 3117 flags 0x00 dlen 21             #146 [hci1] 13.107730
      SMP: Pairing Confirm (0x03) len 16
        Confim value: c622858433d38e15cade9faa03019d87
> HCI Event: Number of Completed Packets (0x13) plen 5    #147 [hci1] 13.272299
        Num handles: 1
        Handle: 3117 Address: DF:A9:FF:F6:B1:1A (OUI DF-A9-FF)
        Count: 1
        #146: len 21 (1 Kb/s)
        Latency: 164 msec (68-172 msec ~164 msec)
> ACL Data RX: Handle 3117 flags 0x02 dlen 21             #148 [hci1] 13.272666
      SMP: Pairing Random (0x04) len 16
        Random value: 24b8007d1e7342710000000000000000
< HCI Command: Host Number of Com.. (0x03|0x0035) plen 5  #149 [hci1] 13.287228
        Num handles: 1
        Handle: 3117 Address: DF:A9:FF:F6:B1:1A (OUI DF-A9-FF)
        Count: 1
< ACL Data TX: Handle 3117 flags 0x00 dlen 21             #150 [hci1] 13.287288
      SMP: Pairing Random (0x04) len 16
        Random value: c629a3a987d808e808655d558dfc1155
> HCI Event: Number of Completed Packets (0x13) plen 5    #151 [hci1] 13.447134
        Num handles: 1
        Handle: 3117 Address: DF:A9:FF:F6:B1:1A (OUI DF-A9-FF)
        Count: 1
        #150: len 21 (1 Kb/s)
        Latency: 159 msec (68-172 msec ~162 msec)
> ACL Data RX: Handle 3117 flags 0x02 dlen 21             #152 [hci1] 13.534957
      SMP: Pairing Confirm (0x03) len 16
        Confim value: 72372dd8bf7215b8b5e08c870c81ae96
< HCI Command: Host Number of Com.. (0x03|0x0035) plen 5  #153 [hci1] 13.547627
        Num handles: 1
        Handle: 3117 Address: DF:A9:FF:F6:B1:1A (OUI DF-A9-FF)
        Count: 1
< ACL Data TX: Handle 3117 flags 0x00 dlen 21             #154 [hci1] 13.547890
      SMP: Pairing Confirm (0x03) len 16
        Confim value: 89fa6619dd729bfccc01e632e9ba4c29
> HCI Event: Number of Completed Packets (0x13) plen 5    #155 [hci1] 13.709753
        Num handles: 1
        Handle: 3117 Address: DF:A9:FF:F6:B1:1A (OUI DF-A9-FF)
        Count: 1
        #154: len 21 (1 Kb/s)
        Latency: 161 msec (68-172 msec ~162 msec)
> ACL Data RX: Handle 3117 flags 0x02 dlen 21             #156 [hci1] 13.710134
      SMP: Pairing Random (0x04) len 16
        Random value: b9157e1f094f4cc70000000000000000
< HCI Command: Host Number of Com.. (0x03|0x0035) plen 5  #157 [hci1] 13.727319
        Num handles: 1
        Handle: 3117 Address: DF:A9:FF:F6:B1:1A (OUI DF-A9-FF)
        Count: 1
< ACL Data TX: Handle 3117 flags 0x00 dlen 21             #158 [hci1] 13.727331
      SMP: Pairing Random (0x04) len 16
        Random value: 92f20f6ad8f13724432c7fd6001c45ff
> HCI Event: Number of Completed Packets (0x13) plen 5    #159 [hci1] 13.884643
        Num handles: 1
        Handle: 3117 Address: DF:A9:FF:F6:B1:1A (OUI DF-A9-FF)
        Count: 1
        #158: len 21 (1 Kb/s)
        Latency: 157 msec (68-172 msec ~159 msec)
> ACL Data RX: Handle 3117 flags 0x02 dlen 21             #160 [hci1] 13.972472
      SMP: Pairing Confirm (0x03) len 16
        Confim value: 0e7195a0f05f3863d6f95e9654473efb
< HCI Command: Host Number of Com.. (0x03|0x0035) plen 5  #161 [hci1] 13.987526
        Num handles: 1
        Handle: 3117 Address: DF:A9:FF:F6:B1:1A (OUI DF-A9-FF)
        Count: 1
< ACL Data TX: Handle 3117 flags 0x00 dlen 21             #162 [hci1] 13.987717
      SMP: Pairing Confirm (0x03) len 16
        Confim value: 22358603dd0e9772db71e54e0edaf8b5
> HCI Event: Number of Completed Packets (0x13) plen 5    #163 [hci1] 14.147336
        Num handles: 1
        Handle: 3117 Address: DF:A9:FF:F6:B1:1A (OUI DF-A9-FF)
        Count: 1
        #162: len 21 (1 Kb/s)
        Latency: 159 msec (68-172 msec ~159 msec)
> ACL Data RX: Handle 3117 flags 0x02 dlen 21             #164 [hci1] 14.147666
      SMP: Pairing Random (0x04) len 16
        Random value: 244a2a85dfa960ae0000000000000000
< HCI Command: Host Number of Com.. (0x03|0x0035) plen 5  #165 [hci1] 14.167155
        Num handles: 1
        Handle: 3117 Address: DF:A9:FF:F6:B1:1A (OUI DF-A9-FF)
        Count: 1
< ACL Data TX: Handle 3117 flags 0x00 dlen 21             #166 [hci1] 14.167220
      SMP: Pairing Random (0x04) len 16
        Random value: 23ac32ebbb5e14c8a6b9622f296d277f
> HCI Event: Number of Completed Packets (0x13) plen 5    #167 [hci1] 14.322138
        Num handles: 1
        Handle: 3117 Address: DF:A9:FF:F6:B1:1A (OUI DF-A9-FF)
        Count: 1
        #166: len 21 (1 Kb/s)
        Latency: 154 msec (68-172 msec ~157 msec)
> ACL Data RX: Handle 3117 flags 0x02 dlen 21             #168 [hci1] 14.410009
      SMP: Pairing Confirm (0x03) len 16
        Confim value: 8dccd4c10ea93b6139c9a97b308e5417
< HCI Command: Host Number of Com.. (0x03|0x0035) plen 5  #169 [hci1] 14.427488
        Num handles: 1
        Handle: 3117 Address: DF:A9:FF:F6:B1:1A (OUI DF-A9-FF)
        Count: 1
< ACL Data TX: Handle 3117 flags 0x00 dlen 21             #170 [hci1] 14.427696
      SMP: Pairing Confirm (0x03) len 16
        Confim value: 5115d8792fe60f07b351706829887746
> HCI Event: Number of Completed Packets (0x13) plen 5    #171 [hci1] 14.584787
        Num handles: 1
        Handle: 3117 Address: DF:A9:FF:F6:B1:1A (OUI DF-A9-FF)
        Count: 1
        #170: len 21 (1 Kb/s)
        Latency: 157 msec (68-172 msec ~157 msec)
> ACL Data RX: Handle 3117 flags 0x02 dlen 21             #172 [hci1] 14.585203
      SMP: Pairing Random (0x04) len 16
        Random value: 38aa8c0efc30a2ea0000000000000000
< HCI Command: Host Number of Com.. (0x03|0x0035) plen 5  #173 [hci1] 14.587613
        Num handles: 1
        Handle: 3117 Address: DF:A9:FF:F6:B1:1A (OUI DF-A9-FF)
        Count: 1
< ACL Data TX: Handle 3117 flags 0x00 dlen 21             #174 [hci1] 14.587746
      SMP: Pairing Random (0x04) len 16
        Random value: 297efe85e67448a15f56bd27e3a3cf1d
> HCI Event: Number of Completed Packets (0x13) plen 5    #175 [hci1] 14.759598
        Num handles: 1
        Handle: 3117 Address: DF:A9:FF:F6:B1:1A (OUI DF-A9-FF)
        Count: 1
        #174: len 21 (0 Kb/s)
        Latency: 171 msec (68-172 msec ~164 msec)
> ACL Data RX: Handle 3117 flags 0x02 dlen 21             #176 [hci1] 14.847433
      SMP: Pairing Confirm (0x03) len 16
        Confim value: 505cf02df4e5aed8bb5daa91ddd25a5f
< HCI Command: Host Number of Com.. (0x03|0x0035) plen 5  #177 [hci1] 14.867540
        Num handles: 1
        Handle: 3117 Address: DF:A9:FF:F6:B1:1A (OUI DF-A9-FF)
        Count: 1
< ACL Data TX: Handle 3117 flags 0x00 dlen 21             #178 [hci1] 14.867767
      SMP: Pairing Confirm (0x03) len 16
        Confim value: 9f9e5b244933a070e60686e75592347c
> HCI Event: Number of Completed Packets (0x13) plen 5    #179 [hci1] 15.022258
        Num handles: 1
        Handle: 3117 Address: DF:A9:FF:F6:B1:1A (OUI DF-A9-FF)
        Count: 1
        #178: len 21 (1 Kb/s)
        Latency: 154 msec (68-172 msec ~159 msec)
> ACL Data RX: Handle 3117 flags 0x02 dlen 21             #180 [hci1] 15.022716
      SMP: Pairing Random (0x04) len 16
        Random value: f3d538c10de9eb7f0000000000000000
< HCI Command: Host Number of Com.. (0x03|0x0035) plen 5  #181 [hci1] 15.027341
        Num handles: 1
        Handle: 3117 Address: DF:A9:FF:F6:B1:1A (OUI DF-A9-FF)
        Count: 1
< ACL Data TX: Handle 3117 flags 0x00 dlen 21             #182 [hci1] 15.027397
      SMP: Pairing Random (0x04) len 16
        Random value: 25a9493fd3ce4faf02be7293595bb7c6
> HCI Event: Number of Completed Packets (0x13) plen 5    #183 [hci1] 15.197069
        Num handles: 1
        Handle: 3117 Address: DF:A9:FF:F6:B1:1A (OUI DF-A9-FF)
        Count: 1
        #182: len 21 (0 Kb/s)
        Latency: 169 msec (68-172 msec ~164 msec)
> ACL Data RX: Handle 3117 flags 0x02 dlen 21             #184 [hci1] 15.284967
      SMP: Pairing Confirm (0x03) len 16
        Confim value: 48d8048a0c4ecbc58d4dc6e9cdc900e6
< HCI Command: Host Number of Com.. (0x03|0x0035) plen 5  #185 [hci1] 15.287188
        Num handles: 1
        Handle: 3117 Address: DF:A9:FF:F6:B1:1A (OUI DF-A9-FF)
        Count: 1
< ACL Data TX: Handle 3117 flags 0x00 dlen 21             #186 [hci1] 15.287306
      SMP: Pairing Confirm (0x03) len 16
        Confim value: f77bf26a2b17fc9ab7e822e5cb49746a
> HCI Event: Number of Completed Packets (0x13) plen 5    #187 [hci1] 15.459749
        Num handles: 1
        Handle: 3117 Address: DF:A9:FF:F6:B1:1A (OUI DF-A9-FF)
        Count: 1
        #186: len 21 (0 Kb/s)
        Latency: 172 msec (68-172 msec ~168 msec)
> ACL Data RX: Handle 3117 flags 0x02 dlen 21             #188 [hci1] 15.460068
      SMP: Pairing Random (0x04) len 16
        Random value: 710a4ade7222ab7a0000000000000000
< HCI Command: Host Number of Com.. (0x03|0x0035) plen 5  #189 [hci1] 15.467807
        Num handles: 1
        Handle: 3117 Address: DF:A9:FF:F6:B1:1A (OUI DF-A9-FF)
        Count: 1
< ACL Data TX: Handle 3117 flags 0x00 dlen 21             #190 [hci1] 15.467951
      SMP: Pairing Random (0x04) len 16
        Random value: 58f6b41f855a6f6c3560debd84e2affc
> HCI Event: Number of Completed Packets (0x13) plen 5    #191 [hci1] 15.634593
        Num handles: 1
        Handle: 3117 Address: DF:A9:FF:F6:B1:1A (OUI DF-A9-FF)
        Count: 1
        #190: len 21 (1 Kb/s)
        Latency: 166 msec (68-172 msec ~167 msec)
> ACL Data RX: Handle 3117 flags 0x02 dlen 21             #192 [hci1] 15.722463
      SMP: Pairing Confirm (0x03) len 16
        Confim value: 8ea5beaf98110f651561a2dc99556888
< HCI Command: Host Number of Com.. (0x03|0x0035) plen 5  #193 [hci1] 15.727200
        Num handles: 1
        Handle: 3117 Address: DF:A9:FF:F6:B1:1A (OUI DF-A9-FF)
        Count: 1
< ACL Data TX: Handle 3117 flags 0x00 dlen 21             #194 [hci1] 15.727211
      SMP: Pairing Confirm (0x03) len 16
        Confim value: 696bbc40e60a720c161c596206e650ab
> HCI Event: Number of Completed Packets (0x13) plen 5    #195 [hci1] 15.897215
        Num handles: 1
        Handle: 3117 Address: DF:A9:FF:F6:B1:1A (OUI DF-A9-FF)
        Count: 1
        #194: len 21 (0 Kb/s)
        Latency: 170 msec (68-172 msec ~168 msec)
> ACL Data RX: Handle 3117 flags 0x02 dlen 21             #196 [hci1] 15.897571
      SMP: Pairing Random (0x04) len 16
        Random value: da1a36c3662b03990000000000000000
< HCI Command: Host Number of Com.. (0x03|0x0035) plen 5  #197 [hci1] 15.907918
        Num handles: 1
        Handle: 3117 Address: DF:A9:FF:F6:B1:1A (OUI DF-A9-FF)
        Count: 1
< ACL Data TX: Handle 3117 flags 0x00 dlen 21             #198 [hci1] 15.907970
      SMP: Pairing Random (0x04) len 16
        Random value: b67e7216d5bf664139eda2b542549666
> HCI Event: Number of Completed Packets (0x13) plen 5    #199 [hci1] 16.072039
        Num handles: 1
        Handle: 3117 Address: DF:A9:FF:F6:B1:1A (OUI DF-A9-FF)
        Count: 1
        #198: len 21 (1 Kb/s)
        Latency: 164 msec (68-172 msec ~166 msec)
> ACL Data RX: Handle 3117 flags 0x02 dlen 21             #200 [hci1] 16.159945
      SMP: Pairing Confirm (0x03) len 16
        Confim value: d410bd87c6ddbba776f4b3824f975927
< HCI Command: Host Number of Com.. (0x03|0x0035) plen 5  #201 [hci1] 16.167228
        Num handles: 1
        Handle: 3117 Address: DF:A9:FF:F6:B1:1A (OUI DF-A9-FF)
        Count: 1
< ACL Data TX: Handle 3117 flags 0x00 dlen 21             #202 [hci1] 16.167362
      SMP: Pairing Confirm (0x03) len 16
        Confim value: 56e3e278a819668c7cbf0e0879146f9e
> HCI Event: Number of Completed Packets (0x13) plen 5    #203 [hci1] 16.334691
        Num handles: 1
        Handle: 3117 Address: DF:A9:FF:F6:B1:1A (OUI DF-A9-FF)
        Count: 1
        #202: len 21 (1 Kb/s)
        Latency: 167 msec (68-172 msec ~166 msec)
> ACL Data RX: Handle 3117 flags 0x02 dlen 21             #204 [hci1] 16.335116
      SMP: Pairing Random (0x04) len 16
        Random value: a1cdf10beb19355d0000000000000000
< HCI Command: Host Number of Com.. (0x03|0x0035) plen 5  #205 [hci1] 16.347327
        Num handles: 1
        Handle: 3117 Address: DF:A9:FF:F6:B1:1A (OUI DF-A9-FF)
        Count: 1
< ACL Data TX: Handle 3117 flags 0x00 dlen 21             #206 [hci1] 16.347379
      SMP: Pairing Random (0x04) len 16
        Random value: ed17f76500c95219dd01e09d1e63f87b
> HCI Event: Number of Completed Packets (0x13) plen 5    #207 [hci1] 16.509553
        Num handles: 1
        Handle: 3117 Address: DF:A9:FF:F6:B1:1A (OUI DF-A9-FF)
        Count: 1
        #206: len 21 (1 Kb/s)
        Latency: 162 msec (68-172 msec ~164 msec)
> ACL Data RX: Handle 3117 flags 0x02 dlen 21             #208 [hci1] 16.597428
      SMP: Pairing Confirm (0x03) len 16
        Confim value: 65a91a2e56d7b252d0b59e578cde9679
< HCI Command: Host Number of Com.. (0x03|0x0035) plen 5  #209 [hci1] 16.607630
        Num handles: 1
        Handle: 3117 Address: DF:A9:FF:F6:B1:1A (OUI DF-A9-FF)
        Count: 1
< ACL Data TX: Handle 3117 flags 0x00 dlen 21             #210 [hci1] 16.607851
      SMP: Pairing Confirm (0x03) len 16
        Confim value: eb62ef8d7cdb986575decf2fbd6acf88
> HCI Event: Number of Completed Packets (0x13) plen 5    #211 [hci1] 16.772275
        Num handles: 1
        Handle: 3117 Address: DF:A9:FF:F6:B1:1A (OUI DF-A9-FF)
        Count: 1
        #210: len 21 (1 Kb/s)
        Latency: 164 msec (68-172 msec ~164 msec)
> ACL Data RX: Handle 3117 flags 0x02 dlen 21             #212 [hci1] 16.772567
      SMP: Pairing Random (0x04) len 16
        Random value: d44c767e9f2f02560000000000000000
< HCI Command: Host Number of Com.. (0x03|0x0035) plen 5  #213 [hci1] 16.787300
        Num handles: 1
        Handle: 3117 Address: DF:A9:FF:F6:B1:1A (OUI DF-A9-FF)
        Count: 1
< ACL Data TX: Handle 3117 flags 0x00 dlen 21             #214 [hci1] 16.787347
      SMP: Pairing Random (0x04) len 16
        Random value: 81d35d47e1f6006d79c974bd9d9e1ee3
> HCI Event: Number of Completed Packets (0x13) plen 5    #215 [hci1] 16.947100
        Num handles: 1
        Handle: 3117 Address: DF:A9:FF:F6:B1:1A (OUI DF-A9-FF)
        Count: 1
        #214: len 21 (1 Kb/s)
        Latency: 159 msec (68-172 msec ~162 msec)
> ACL Data RX: Handle 3117 flags 0x02 dlen 21             #216 [hci1] 17.034912
      SMP: Pairing Confirm (0x03) len 16
        Confim value: 7e2d2793b84a20ecd931ca9e2c06cda1
< HCI Command: Host Number of Com.. (0x03|0x0035) plen 5  #217 [hci1] 17.047613
        Num handles: 1
        Handle: 3117 Address: DF:A9:FF:F6:B1:1A (OUI DF-A9-FF)
        Count: 1
< ACL Data TX: Handle 3117 flags 0x00 dlen 21             #218 [hci1] 17.047818
      SMP: Pairing Confirm (0x03) len 16
        Confim value: 4a941703525818ddcb26ebea244cdd9f
> HCI Event: Number of Completed Packets (0x13) plen 5    #219 [hci1] 17.209713
        Num handles: 1
        Handle: 3117 Address: DF:A9:FF:F6:B1:1A (OUI DF-A9-FF)
        Count: 1
        #218: len 21 (1 Kb/s)
        Latency: 161 msec (68-172 msec ~162 msec)
> ACL Data RX: Handle 3117 flags 0x02 dlen 21             #220 [hci1] 17.210072
      SMP: Pairing Random (0x04) len 16
        Random value: cb3b833ac72fd7db0000000000000000
< HCI Command: Host Number of Com.. (0x03|0x0035) plen 5  #221 [hci1] 17.227141
        Num handles: 1
        Handle: 3117 Address: DF:A9:FF:F6:B1:1A (OUI DF-A9-FF)
        Count: 1
< ACL Data TX: Handle 3117 flags 0x00 dlen 21             #222 [hci1] 17.227148
      SMP: Pairing Random (0x04) len 16
        Random value: e7f7e0c2476823e41736a7e381bafb7c
> HCI Event: Number of Completed Packets (0x13) plen 5    #223 [hci1] 17.384465
        Num handles: 1
        Handle: 3117 Address: DF:A9:FF:F6:B1:1A (OUI DF-A9-FF)
        Count: 1
        #222: len 21 (1 Kb/s)
        Latency: 157 msec (68-172 msec ~159 msec)
> ACL Data RX: Handle 3117 flags 0x02 dlen 21             #224 [hci1] 17.472420
      SMP: Pairing Confirm (0x03) len 16
        Confim value: 6c78c5881c80a24c3bf63efe17af0461
< HCI Command: Host Number of Com.. (0x03|0x0035) plen 5  #225 [hci1] 17.487484
        Num handles: 1
        Handle: 3117 Address: DF:A9:FF:F6:B1:1A (OUI DF-A9-FF)
        Count: 1
< ACL Data TX: Handle 3117 flags 0x00 dlen 21             #226 [hci1] 17.487626
      SMP: Pairing Confirm (0x03) len 16
        Confim value: 718f1705450ee3be9fa57286c2c085b5
> HCI Event: Number of Completed Packets (0x13) plen 5    #227 [hci1] 17.647157
        Num handles: 1
        Handle: 3117 Address: DF:A9:FF:F6:B1:1A (OUI DF-A9-FF)
        Count: 1
        #226: len 21 (1 Kb/s)
        Latency: 159 msec (68-172 msec ~159 msec)
> ACL Data RX: Handle 3117 flags 0x02 dlen 21             #228 [hci1] 17.647547
      SMP: Pairing Random (0x04) len 16
        Random value: bc88daf4d40e68fd0000000000000000
