Bluetooth monitor ver 5.72
= Note: Linux version 7.0.0-31-generic (x86_64)                        0.343853
= Note: Bluetooth subsystem version 2.22                               0.343855
= New Index: 00:00:00:00:00:00 (Primary,UART,hci2)              [hci2] 0.343856
= New Index: 00:00:00:00:00:00 (Primary,UART,hci1)              [hci1] 0.343856
= New Index: 48:5F:99:8E:E0:64 (Primary,USB,hci0)               [hci0] 0.343857
= Open Index: 00:00:00:00:00:00                                 [hci1] 0.477872
= Index Info: 00:00:00:00:00:00 (Nordic Semiconductor ASA)      [hci1] 0.477883
@ USER Open: main (privileged) version 2.22            {0x0001} [hci1] 0.477887
< HCI Command: Reset (0x03|0x0003) plen 0                    #1 [hci1] 0.478434
> HCI Event: Command Complete (0x0e) plen 4                  #2 [hci1] 0.478922
      Reset (0x03|0x0003) ncmd 1
        Status: Success (0x00)
< HCI Command: Read Local Supported... (0x04|0x0003) plen 0  #3 [hci1] 0.497030
> HCI Event: Command Complete (0x0e) plen 12                 #4 [hci1] 0.497618
      Read Local Supported Features (0x04|0x0003) ncmd 1
        Status: Success (0x00)
        Features: 0x00 0x00 0x00 0x00 0x60 0x00 0x00 0x00
          BR/EDR Not Supported
          LE Supported (Controller)
< HCI Command: Read Local Version In.. (0x04|0x0001) plen 0  #5 [hci1] 0.517038
> HCI Event: Command Complete (0x0e) plen 12                 #6 [hci1] 0.517600
      Read Local Version Information (0x04|0x0001) ncmd 1
        Status: Success (0x00)
        HCI version: Reserved (0x11) - Revision 12345 (0x3039)
        LMP version: Reserved (0x11) - Subversion 12345 (0x3039)
        Manufacturer: Nordic Semiconductor ASA (89)
< HCI Command: Read Local Supported... (0x04|0x0002) plen 0  #7 [hci1] 0.537062
> HCI Event: Command Complete (0x0e) plen 68                 #8 [hci1] 0.538205
      Read Local Supported Commands (0x04|0x0002) ncmd 1
        Status: Success (0x00)
        Commands: 115 entries
          Disconnect (Octet 0 - Bit 5)
          Read Remote Version Information (Octet 2 - Bit 7)
          Set Event Mask (Octet 5 - Bit 6)
          Reset (Octet 5 - Bit 7)
          Read Connection Accept Timeout (Octet 7 - Bit 2)
          Write Connection Accept Timeout (Octet 7 - Bit 3)
          Read Transmit Power Level (Octet 10 - Bit 2)
          Set Controller To Host Flow Control (Octet 10 - Bit 5)
          Host Buffer Size (Octet 10 - Bit 6)
          Host Number of Completed Packets (Octet 10 - Bit 7)
          Read Local Version Information (Octet 14 - Bit 3)
          Read Local Supported Features (Octet 14 - Bit 5)
          Read BD ADDR (Octet 15 - Bit 1)
          Read RSSI (Octet 15 - Bit 5)
          Set Event Mask Page 2 (Octet 22 - Bit 2)
          LE Set Event Mask (Octet 25 - Bit 0)
          LE Read Buffer Size (Octet 25 - Bit 1)
          LE Read Local Supported Features (Octet 25 - Bit 2)
          LE Set Random Address (Octet 25 - Bit 4)
          LE Set Advertising Parameters (Octet 25 - Bit 5)
          LE Read Advertising Channel TX Power (Octet 25 - Bit 6)
          LE Set Advertising Data (Octet 25 - Bit 7)
          LE Set Scan Response Data (Octet 26 - Bit 0)
          LE Set Advertise Enable (Octet 26 - Bit 1)
          LE Set Scan Parameters (Octet 26 - Bit 2)
          LE Set Scan Enable (Octet 26 - Bit 3)
          LE Create Connection (Octet 26 - Bit 4)
          LE Create Connection Cancel (Octet 26 - Bit 5)
          LE Read Accept List Size (Octet 26 - Bit 6)
          LE Clear Accept List (Octet 26 - Bit 7)
          LE Add Device To Accept List (Octet 27 - Bit 0)
          LE Remove Device From Accept List (Octet 27 - Bit 1)
          LE Connection Update (Octet 27 - Bit 2)
          LE Set Host Channel Classification (Octet 27 - Bit 3)
          LE Read Channel Map (Octet 27 - Bit 4)
          LE Read Remote Used Features (Octet 27 - Bit 5)
          LE Encrypt (Octet 27 - Bit 6)
          LE Rand (Octet 27 - Bit 7)
          LE Start Encryption (Octet 28 - Bit 0)
          LE Long Term Key Request Reply (Octet 28 - Bit 1)
          LE Long Term Key Request Neg Reply (Octet 28 - Bit 2)
          LE Read Supported States (Octet 28 - Bit 3)
          Read Authenticated Payload Timeout (Octet 32 - Bit 4)
          Write Authenticated Payload Timeout (Octet 32 - Bit 5)
          LE Set Data Length (Octet 33 - Bit 6)
          LE Read Suggested Default Data Length (Octet 33 - Bit 7)
          LE Write Suggested Default Data Length (Octet 34 - Bit 0)
          LE Add Device To Resolving List (Octet 34 - Bit 3)
          LE Remove Device From Resolving List (Octet 34 - Bit 4)
          LE Clear Resolving List (Octet 34 - Bit 5)
          LE Read Resolving List Size (Octet 34 - Bit 6)
          LE Set Address Resolution Enable (Octet 35 - Bit 1)
          LE Set Resolvable Private Address Timeout (Octet 35 - Bit 2)
          LE Read Maximum Data Length (Octet 35 - Bit 3)
          LE Read PHY (Octet 35 - Bit 4)
          LE Set Default PHY (Octet 35 - Bit 5)
          LE Set PHY (Octet 35 - Bit 6)
          LE Set Advertising Set Random Address (Octet 36 - Bit 1)
          LE Set Extended Advertising Parameters (Octet 36 - Bit 2)
          LE Set Extended Advertising Data (Octet 36 - Bit 3)
          LE Set Extended Scan Response Data (Octet 36 - Bit 4)
          LE Set Extended Advertising Enable (Octet 36 - Bit 5)
          LE Read Maximum Advertising Data Length (Octet 36 - Bit 6)
          LE Read Number of Supported Advertising Sets (Octet 36 - Bit 7)
          LE Remove Advertising Set (Octet 37 - Bit 0)
          LE Clear Advertising Sets (Octet 37 - Bit 1)
          LE Set Periodic Advertising Parameters (Octet 37 - Bit 2)
          LE Set Periodic Advertising Data (Octet 37 - Bit 3)
          LE Set Periodic Advertising Enable (Octet 37 - Bit 4)
          LE Set Extended Scan Parameters (Octet 37 - Bit 5)
          LE Set Extended Scan Enable (Octet 37 - Bit 6)
          LE Extended Create Connection (Octet 37 - Bit 7)
          LE Periodic Advertising Create Sync (Octet 38 - Bit 0)
          LE Periodic Advertising Create Sync Cancel (Octet 38 - Bit 1)
          LE Periodic Advertising Terminate Sync (Octet 38 - Bit 2)
          LE Add Device To Periodic Advertiser List (Octet 38 - Bit 3)
          LE Remove Device From Periodic Advertiser List (Octet 38 - Bit 4)
          LE Clear Periodic Advertiser List (Octet 38 - Bit 5)
          LE Read Periodic Advertiser List Size (Octet 38 - Bit 6)
          LE Read Transmit Power (Octet 38 - Bit 7)
          LE Read RF Path Compensation (Octet 39 - Bit 0)
          LE Write RF Path Compensation (Octet 39 - Bit 1)
          LE Set Privacy Mode (Octet 39 - Bit 2)
          LE Periodic Advertising Receive Enable (Octet 40 - Bit 5)
          LE Periodic Advertising Sync Transfer (Octet 40 - Bit 6)
          LE Periodic Advertising Set Info Transfer (Octet 40 - Bit 7)
          LE Periodic Advertising Sync Transfer Parameters (Octet 41 - Bit 0)
          LE Set Default Periodic Advertisng Sync Transfer Parameters (Octet 41 - Bit 1)
          LE Read Buffer v2 (Octet 41 - Bit 5)
          LE Read ISO TX Sync (Octet 41 - Bit 6)
          LE Set Connected Isochronous Group Parameters (Octet 41 - Bit 7)
          LE Set Connected Isochronous Group Parameters Test (Octet 42 - Bit 0)
          LE Create Connected Isochronous Stream (Octet 42 - Bit 1)
          LE Remove Connected Isochronous Group (Octet 42 - Bit 2)
          LE Accept Connected Isochronous Stream Request (Octet 42 - Bit 3)
          LE Reject Connected Isochronous Stream Request (Octet 42 - Bit 4)
          LE Create Broadcast Isochronous Group (Octet 42 - Bit 5)
          LE Create Broadcast Isochronous Group Test (Octet 42 - Bit 6)
          LE Terminate Broadcast Isochronous Group (Octet 42 - Bit 7)
          LE Broadcast Isochronous Group Create Sync (Octet 43 - Bit 0)
          LE Broadcast Isochronous Group Terminate Sync (Octet 43 - Bit 1)
          LE Request Peer SCA (Octet 43 - Bit 2)
          LE Setup Isochronous Data Path (Octet 43 - Bit 3)
          LE Remove Isochronous Data Path (Octet 43 - Bit 4)
          LE Isochronous Transmit Test (Octet 43 - Bit 5)
          LE Isochronous Receive Test (Octet 43 - Bit 6)
          LE Isochronous Read Test Counters (Octet 43 - Bit 7)
          LE Isochronous Read Test Counters (Octet 44 - Bit 0)
          LE Set Host Feature (Octet 44 - Bit 1)
          Octet 44 - Bit 2 
          Octet 45 - Bit 6 
          Octet 46 - Bit 0 
          Octet 46 - Bit 1 
          Octet 46 - Bit 2 
          Octet 47 - Bit 4 
< HCI Command: Host Buffer Size (0x03|0x0033) plen 7         #9 [hci1] 0.557057
        ACL MTU: 255  ACL max packet: 16
        SCO MTU: 0    SCO max packet: 0
> HCI Event: Command Complete (0x0e) plen 4                 #10 [hci1] 0.557563
      Host Buffer Size (0x03|0x0033) ncmd 1
        Status: Success (0x00)
< HCI Command: Set Controller To Ho.. (0x03|0x0031) plen 1  #11 [hci1] 0.577060
        Flow control: ACL Data Packets (0x01)
> HCI Event: Command Complete (0x0e) plen 4                 #12 [hci1] 0.577521
      Set Controller To Host Flow Control (0x03|0x0031) ncmd 1
        Status: Success (0x00)
< HCI Command: LE Read Local Suppor.. (0x08|0x0003) plen 0  #13 [hci1] 0.597046
> HCI Event: Command Complete (0x0e) plen 12                #14 [hci1] 0.597598
      LE Read Local Supported Features (0x08|0x0003) ncmd 1
        Status: Success (0x00)
        Features: 0xfd 0x79 0x00 0xf7 0x30 0x01 0x00 0x00
          LE Encryption
          Extended Reject Indication
          Peripheral-initiated Features Exchange
          LE Ping
          LE Data Packet Length Extension
          LL Privacy
          Extended Scanner Filter Policies
          LE 2M PHY
          LE Coded PHY
          LE Extended Advertising
          LE Periodic Advertising
          Channel Selection Algorithm #2
          Periodic Advertising Sync Transfer - Sender
          Periodic Advertising Sync Transfer - Recipient
          Sleep Clock Accuracy Updates
          Connected Isochronous Stream - Central
          Connected Isochronous Stream - Peripheral
          Isochronous Broadcaster
          Synchronized Receiver
          Periodic Advertising ADI support
          Connection Subrating
          Unknown features (0x0000010000000000)
< HCI Command: LE Set Host Feature (0x08|0x0074) plen 2     #15 [hci1] 0.616994
        Bit Number: 32
          Connected Isochronous Stream (Host Support)
        Bit Value: 1
> HCI Event: Command Complete (0x0e) plen 4                 #16 [hci1] 0.617610
      LE Set Host Feature (0x08|0x0074) ncmd 1
        Status: Success (0x00)
< HCI Command: LE Read Buffer v2 (0x08|0x0060) plen 0       #17 [hci1] 0.637064
> HCI Event: Command Complete (0x0e) plen 10                #18 [hci1] 0.637580
      LE Read Buffer v2 (0x08|0x0060) ncmd 1
        Status: Success (0x00)
        ACL MTU: 27
        ACL max packet: 3
        ISO MTU: 318
        ISO max packet: 3
< HCI Command: LE Read Maximum Adve.. (0x08|0x003a) plen 0  #19 [hci1] 0.657077
> HCI Event: Command Complete (0x0e) plen 6                 #20 [hci1] 0.657568
      LE Read Maximum Advertising Data Length (0x08|0x003a) ncmd 1
        Status: Success (0x00)
        Max length: 1650
< HCI Command: LE Read Supported St.. (0x08|0x001c) plen 0  #21 [hci1] 0.677052
> HCI Event: Command Complete (0x0e) plen 12                #22 [hci1] 0.677529
      LE Read Supported States (0x08|0x001c) ncmd 1
        Status: Success (0x00)
        States: 0x000003ff3e0306ff
          Non-connectable Advertising State
          Scannable Advertising State
          Connectable Advertising State
          High Duty Cycle Directed Advertising State
          Passive Scanning State
          Active Scanning State
          Initiating State
            and Connection State (Central Role)
          Connection State (Peripheral Role)
          Scannable Advertising State
            and Passive Scanning State
          Connectable Advertising State
            and Passive Scanning State
          Non-connectable Advertising State
            and Initiating State
          Scannable Advertising State
            and Initiating State
          Active Scanning State
            and Connection State (Central Role)
          Passive Scanning State
            and Connection State (Peripheral Role)
          Active Scanning State
            and Connection State (Peripheral Role)
          Initiating State
            and Connection State (Central Role)
            and Central Role & Central Role
          Low Duty Cycle Directed Advertising State
          Connectable Advertising State
            and Initiating State
            and Central Role & Peripheral Role
          High Duty Cycle Directed Advertising State
            and Initiating State
            and Central Role & Peripheral Role
          Low Duty Cycle Directed Advertising State
            and Initiating State
            and Central Role & Peripheral Role
          Connectable Advertising State
            and Connection State (Central Role)
            and Central Role & Peripheral Role
          High Duty Cycle Directed Advertising State
            and Connection State (Central Role)
            and Central Role & Peripheral Role
          Low Duty Cycle Directed Advertising State
            and Connection State (Central Role)
            and Central Role & Peripheral Role
          Connectable Advertising State
            and Connection State (Peripheral Role)
            and Central Role & Peripheral Role
          High Duty Cycle Directed Advertising State
            and Connection State (Peripheral Role)
            and Peripheral Role & Peripheral Role
          Low Duty Cycle Directed Advertising State
            and Connection State (Peripheral Role)
            and Peripheral Role & Peripheral Role
          Initiating State
            and Connection State (Peripheral Role)
            and Central Role & Peripheral Role
< HCI Command: LE Read Maximum Data.. (0x08|0x002f) plen 0  #23 [hci1] 0.697052
> HCI Event: Command Complete (0x0e) plen 12                #24 [hci1] 0.697778
      LE Read Maximum Data Length (0x08|0x002f) ncmd 1
        Status: Success (0x00)
        Max TX octets: 251
        Max TX time: 2704
        Max RX octets: 251
        Max RX time: 2704
< HCI Command: LE Write Suggested D.. (0x08|0x0024) plen 4  #25 [hci1] 0.717055
        TX octets: 251
        TX time: 2704
> HCI Event: Command Complete (0x0e) plen 4                 #26 [hci1] 0.717442
      LE Write Suggested Default Data Length (0x08|0x0024) ncmd 1
        Status: Success (0x00)
< HCI Command: LE Read Resolving Li.. (0x08|0x002a) plen 0  #27 [hci1] 0.737060
> HCI Event: Command Complete (0x0e) plen 5                 #28 [hci1] 0.737586
      LE Read Resolving List Size (0x08|0x002a) ncmd 1
        Status: Success (0x00)
        Size: 8
< HCI Command: LE Set Host Feature (0x08|0x0074) plen 2     #29 [hci1] 0.757047
        Bit Number: 38
          Connection Subrating (Host Support)
        Bit Value: 1
> HCI Event: Command Complete (0x0e) plen 4                 #30 [hci1] 0.757436
      LE Set Host Feature (0x08|0x0074) ncmd 1
        Status: Success (0x00)
< HCI Command: LE Set Event Mask (0x08|0x0001) plen 8       #31 [hci1] 0.777052
        Mask: 0x000002063f87fa5e
          LE Advertising Report
          LE Connection Update Complete
          LE Read Remote Used Features Complete
          LE Long Term Key Request
          LE Data Length Change
          LE Enhanced Connection Complete
          LE PHY Update Complete
          LE Extended Advertising Report
          LE Periodic Advertising Sync Established
          LE Periodic Advertising Report
          LE Periodic Advertising Sync Lost
          LE Extended Scan Timeout
          LE Extended Advertising Set Terminated
          LE Scan Request Received
          LE Periodic Advertising Sync Transfer Rvc
          LE CIS Established
          LE CIS Request
          LE Create BIG Complete
          LE Terminate BIG Complete
          LE BIG Sync Estabilished Complete
          LE BIG Sync Lost
          LE BIG Info Advertising Report
          LE Subrate Change
          Unknown mask (0x0000020000000000)
> HCI Event: Command Complete (0x0e) plen 4                 #32 [hci1] 0.777630
      LE Set Event Mask (0x08|0x0001) ncmd 1
        Status: Success (0x00)
< HCI Command: Set Event Mask (0x03|0x0001) plen 8          #33 [hci1] 0.797022
        Mask: 0x2000800002008890
          Disconnection Complete
          Encryption Change
          Read Remote Version Information Complete
          Hardware Error
          Data Buffer Overflow
          Encryption Key Refresh Complete
          LE Meta
> HCI Event: Command Complete (0x0e) plen 4                 #34 [hci1] 0.797645
      Set Event Mask (0x03|0x0001) ncmd 1
        Status: Success (0x00)
< HCI Command: Read BD ADDR (0x04|0x0009) plen 0            #35 [hci1] 0.817057
> HCI Event: Command Complete (0x0e) plen 10                #36 [hci1] 0.817549
      Read BD ADDR (0x04|0x0009) ncmd 1
        Status: Success (0x00)
        Address: 00:00:00:00:00:00 (OUI 00-00-00)
< HCI Command: LE Set Random Address (0x08|0x0005) plen 6   #37 [hci1] 0.837034
        Address: D5:B6:CC:31:DB:3B (Static)
> HCI Event: Command Complete (0x0e) plen 4                 #38 [hci1] 0.837603
      LE Set Random Address (0x08|0x0005) ncmd 1
        Status: Success (0x00)
< HCI Command: LE Set Extended Adv.. (0x08|0x0036) plen 25  #39 [hci1] 4.537637
        Handle: 0x00
        Properties: 0x0013
          Connectable
          Scannable
          Use legacy advertising PDUs: ADV_IND
        Min advertising interval: 100.000 msec (0x00a0)
        Max advertising interval: 150.000 msec (0x00f0)
        Channel map: 37, 38, 39 (0x07)
        Own address type: Random (0x01)
        Peer address type: Public (0x00)
        Peer address: 00:00:00:00:00:00 (OUI 00-00-00)
        Filter policy: Allow Scan Request from Any, Allow Connect Request from Any (0x00)
        TX power: Host has no preference (0x7f)
        Primary PHY: LE 1M (0x01)
        Secondary max skip: 0x00
        Secondary PHY: LE 1M (0x01)
        SID: 0x00
        Scan request notifications: Disabled (0x00)
> HCI Event: Command Complete (0x0e) plen 5                 #40 [hci1] 4.538588
      LE Set Extended Advertising Parameters (0x08|0x0036) ncmd 1
        Status: Success (0x00)
        TX power (selected): 0 dbm (0x00)
< HCI Command: LE Set Advertising S.. (0x08|0x0035) plen 7  #41 [hci1] 4.557189
        Advertising handle: 0x00
        Advertising random address: D5:B6:CC:31:DB:3B (Static)
> HCI Event: Command Complete (0x0e) plen 4                 #42 [hci1] 4.557809
      LE Set Advertising Set Random Address (0x08|0x0035) ncmd 1
        Status: Success (0x00)
< HCI Command: LE Set Extended Adv.. (0x08|0x0037) plen 22  #43 [hci1] 4.577097
        Handle: 0x00
        Operation: Complete extended advertising data (0x03)
        Fragment preference: Minimize fragmentation (0x01)
        Data length: 0x12
        Flags: 0x04
          BR/EDR Not Supported
        Name (complete): Tester_F6B11A
> HCI Event: Command Complete (0x0e) plen 4                 #44 [hci1] 4.577846
      LE Set Extended Advertising Data (0x08|0x0037) ncmd 1
        Status: Success (0x00)
< HCI Command: LE Set Extended Scan.. (0x08|0x0038) plen 4  #45 [hci1] 4.597104
        Handle: 0x00
        Operation: Complete scan response data (0x03)
        Fragment preference: Minimize fragmentation (0x01)
        Data length: 0x00
> HCI Event: Command Complete (0x0e) plen 4                 #46 [hci1] 4.597703
      LE Set Extended Scan Response Data (0x08|0x0038) ncmd 1
        Status: Success (0x00)
< HCI Command: LE Set Extended Adve.. (0x08|0x0039) plen 6  #47 [hci1] 4.617105
        Extended advertising: Enabled (0x01)
        Number of sets: 1 (0x01)
        Entry 0
          Handle: 0x00
          Duration: 0 ms (0x00)
          Max ext adv events: 0
> HCI Event: Command Complete (0x0e) plen 4                 #48 [hci1] 4.617678
      LE Set Extended Advertising Enable (0x08|0x0039) ncmd 1
        Status: Success (0x00)
> HCI Event: LE Meta Event (0x3e) plen 31                   #49 [hci1] 4.940062
      LE Enhanced Connection Complete (0x0a)
        Status: Success (0x00)
        Handle: 2973
        Role: Peripheral (0x01)
        Peer address type: Public (0x00)
        Peer address: DF:A9:FF:F6:B1:1A (OUI DF-A9-FF)
        Local resolvable private address: 00:00:00:00:00:00 (Non-Resolvable)
        Peer resolvable private address: 00:00:00:00:00:00 (Non-Resolvable)
        Connection interval: 87.50 msec (0x0046)
        Connection latency: 0 (0x0000)
        Supervision timeout: 20000 msec (0x07d0)
        Central clock accuracy: 0x01
> HCI Event: LE Meta Event (0x3e) plen 6                    #50 [hci1] 4.940162
      LE Advertising Set Terminated (0x12)
        Status: Success (0x00)
        Handle: 0
        Connection handle: 2973
        Number of completed extended advertising events: 0
< HCI Command: LE Read Remote Used... (0x08|0x0016) plen 2  #51 [hci1] 4.957892
        Handle: 2973 Address: DF:A9:FF:F6:B1:1A (OUI DF-A9-FF)
> HCI Event: Command Status (0x0f) plen 4                   #52 [hci1] 4.958431
      LE Read Remote Used Features (0x08|0x0016) ncmd 1
        Status: Success (0x00)
> HCI Event: LE Meta Event (0x3e) plen 12                   #53 [hci1] 5.203975
      LE Read Remote Used Features (0x04)
        Status: Success (0x00)
        Handle: 2973 Address: DF:A9:FF:F6:B1:1A (OUI DF-A9-FF)
        Features: 0x2d 0x49 0x00 0xf7 0x67 0xd9 0x00 0x80
          LE Encryption
          Extended Reject Indication
          Peripheral-initiated Features Exchange
          LE Data Packet Length Extension
          LE 2M PHY
          LE Coded PHY
          Channel Selection Algorithm #2
          Periodic Advertising Sync Transfer - Sender
          Periodic Advertising Sync Transfer - Recipient
          Sleep Clock Accuracy Updates
          Connected Isochronous Stream - Central
          Connected Isochronous Stream - Peripheral
          Isochronous Broadcaster
          Synchronized Receiver
          Connected Isochronous Stream (Host Support)
          LE Power Control Request
          LE Power Control Request
          Connection Subrating
          Connection Subrating (Host Support)
          Unknown features (0x8000d90000000000)
< ACL Data TX: Handle 2973 flags 0x00 dlen 16               #54 [hci1] 9.967217
      LE L2CAP: Connection Parameter Update Request (0x12) ident 1 len 8
        Min interval: 24
        Max interval: 40
        Peripheral latency: 0
        Timeout multiplier: 42
> HCI Event: Number of Completed Packets (0x13) plen 5     #55 [hci1] 10.103589
        Num handles: 1
        Handle: 2973 Address: DF:A9:FF:F6:B1:1A (OUI DF-A9-FF)
        Count: 1
        #54: len 16 (0 Kb/s)
        Latency: 136 msec (136-136 msec ~136 msec)
> ACL Data RX: Handle 2973 flags 0x02 dlen 10              #56 [hci1] 10.103855
      LE L2CAP: Connection Parameter Update Response (0x13) ident 1 len 2
        Result: Connection Parameters accepted (0x0000)
< HCI Command: Host Number of Comp.. (0x03|0x0035) plen 5  #57 [hci1] 10.117962
        Num handles: 1
        Handle: 2973 Address: DF:A9:FF:F6:B1:1A (OUI DF-A9-FF)
        Count: 1
> ACL Data RX: Handle 2973 flags 0x02 dlen 11              #58 [hci1] 65.665198
      SMP: Pairing Request (0x01) len 6
        IO capability: KeyboardDisplay (0x04)
        OOB data: Authentication data not present (0x00)
        Authentication requirement: Bonding, No MITM, SC, No Keypresses (0x09)
        Max encryption key size: 16
        Initiator key distribution: EncKey IdKey Sign LinkKey (0x0f)
        Responder key distribution: EncKey IdKey Sign LinkKey (0x0f)
< HCI Command: Host Number of Comp.. (0x03|0x0035) plen 5  #59 [hci1] 65.677818
        Num handles: 1
        Handle: 2973 Address: DF:A9:FF:F6:B1:1A (OUI DF-A9-FF)
        Count: 1
< ACL Data TX: Handle 2973 flags 0x00 dlen 11              #60 [hci1] 65.677848
      SMP: Pairing Response (0x02) len 6
        IO capability: KeyboardDisplay (0x04)
        OOB data: Authentication data not present (0x00)
        Authentication requirement: Bonding, No MITM, SC, No Keypresses (0x09)
        Max encryption key size: 16
        Initiator key distribution: IdKey (0x02)
        Responder key distribution: <none> (0x00)
> HCI Event: Number of Completed Packets (0x13) plen 5     #61 [hci1] 65.840273
        Num handles: 1
        Handle: 2973 Address: DF:A9:FF:F6:B1:1A (OUI DF-A9-FF)
        Count: 1
        #60: len 11 (0 Kb/s)
        Latency: 162 msec (136-162 msec ~149 msec)
> ACL Data RX: Handle 2973 flags 0x02 dlen 27              #62 [hci1] 65.840729
> ACL Data RX: Handle 2973 flags 0x01 dlen 27              #63 [hci1] 65.841249
> ACL Data RX: Handle 2973 flags 0x01 dlen 15              #64 [hci1] 65.841750
      SMP: Pairing Public Key (0x0c) len 64
        X: ddcd151e0c31afab131e5f332e613ac0d99cf8c51a46a4373f0fcacc7d96618f
        Y: 7c2ad2ca542ca1256d9cc286035b491ec1f0d115c23159356bcd50e61444bf05
< HCI Command: Host Number of Comp.. (0x03|0x0035) plen 5  #65 [hci1] 65.857841
        Num handles: 1
        Handle: 2973 Address: DF:A9:FF:F6:B1:1A (OUI DF-A9-FF)
        Count: 1
< HCI Command: Host Number of Comp.. (0x03|0x0035) plen 5  #66 [hci1] 65.857911
        Num handles: 1
        Handle: 2973 Address: DF:A9:FF:F6:B1:1A (OUI DF-A9-FF)
        Count: 1
< HCI Command: Host Number of Comp.. (0x03|0x0035) plen 5  #67 [hci1] 65.858028
        Num handles: 1
        Handle: 2973 Address: DF:A9:FF:F6:B1:1A (OUI DF-A9-FF)
        Count: 1
< ACL Data TX: Handle 2973 flags 0x00 dlen 27              #68 [hci1] 65.858102
< ACL Data TX: Handle 2973 flags 0x01 dlen 27              #69 [hci1] 65.858106
< ACL Data TX: Handle 2973 flags 0x01 dlen 15              #70 [hci1] 65.858107
      SMP: Pairing Public Key (0x0c) len 64
        X: 98308440221e2d910f0e54b71e7ec652857aa9b5a0dc65028824cc19db1226e9
        Y: 67a4816bcb62efb21701e31fdb27561a6217575fb007a8bbdabe7e28b6f68482
> HCI Event: Number of Completed Packets (0x13) plen 5     #71 [hci1] 65.928221
        Num handles: 1
        Handle: 2973 Address: DF:A9:FF:F6:B1:1A (OUI DF-A9-FF)
        Count: 1
        #68: len 27 (3 Kb/s)
        Latency: 70 msec (70-162 msec ~109 msec)
> HCI Event: Number of Completed Packets (0x13) plen 5     #72 [hci1] 65.928833
        Num handles: 1
        Handle: 2973 Address: DF:A9:FF:F6:B1:1A (OUI DF-A9-FF)
        Count: 1
        #69: len 27 (3 Kb/s)
        Latency: 70 msec (70-162 msec ~90 msec)
< ACL Data TX: Handle 2973 flags 0x00 dlen 21              #73 [hci1] 65.938012
      SMP: Pairing Confirm (0x03) len 16
        Confim value: 6d1366876273c132ae7eb52ca65dee80
> HCI Event: Number of Completed Packets (0x13) plen 5     #74 [hci1] 66.015132
        Num handles: 1
        Handle: 2973 Address: DF:A9:FF:F6:B1:1A (OUI DF-A9-FF)
        Count: 1
        #70: len 15 (0 Kb/s)
        Latency: 157 msec (70-162 msec ~123 msec)
> HCI Event: Number of Completed Packets (0x13) plen 5     #75 [hci1] 66.102714
        Num handles: 1
        Handle: 2973 Address: DF:A9:FF:F6:B1:1A (OUI DF-A9-FF)
        Count: 1
        #73: len 21 (1 Kb/s)
        Latency: 164 msec (70-164 msec ~144 msec)
> ACL Data RX: Handle 2973 flags 0x02 dlen 21              #76 [hci1] 66.103064
      SMP: Pairing Random (0x04) len 16
        Random value: 4773b0eb50d58cba0ad3c1b36de29d8c
< HCI Command: Host Number of Comp.. (0x03|0x0035) plen 5  #77 [hci1] 66.118371
        Num handles: 1
        Handle: 2973 Address: DF:A9:FF:F6:B1:1A (OUI DF-A9-FF)
        Count: 1
< ACL Data TX: Handle 2973 flags 0x00 dlen 21              #78 [hci1] 66.118421
      SMP: Pairing Random (0x04) len 16
        Random value: 8e6108f966a694cbe26df70bb96773e6
> HCI Event: Number of Completed Packets (0x13) plen 5     #79 [hci1] 66.277757
        Num handles: 1
        Handle: 2973 Address: DF:A9:FF:F6:B1:1A (OUI DF-A9-FF)
        Count: 1
        #78: len 21 (1 Kb/s)
        Latency: 159 msec (70-164 msec ~151 msec)
> ACL Data RX: Handle 2973 flags 0x02 dlen 21              #80 [hci1] 66.278032
      SMP: Pairing DHKey Check (0x0d) len 16
        E: b0366ccb22a5573f28355f50632a343d
< HCI Command: Host Number of Comp.. (0x03|0x0035) plen 5  #81 [hci1] 66.298364
        Num handles: 1
        Handle: 2973 Address: DF:A9:FF:F6:B1:1A (OUI DF-A9-FF)
        Count: 1
< ACL Data TX: Handle 2973 flags 0x00 dlen 21              #82 [hci1] 66.298441
      SMP: Pairing DHKey Check (0x0d) len 16
        E: 308a1092bb0ab9dfaa2244047b9530a5
> HCI Event: Number of Completed Packets (0x13) plen 5     #83 [hci1] 66.452591
        Num handles: 1
        Handle: 2973 Address: DF:A9:FF:F6:B1:1A (OUI DF-A9-FF)
        Count: 1
        #82: len 21 (1 Kb/s)
        Latency: 154 msec (70-164 msec ~152 msec)
> HCI Event: LE Meta Event (0x3e) plen 13                  #84 [hci1] 66.540722
      LE Long Term Key Request (0x05)
        Handle: 2973 Address: DF:A9:FF:F6:B1:1A (OUI DF-A9-FF)
        Random number: 0x0000000000000000
        Encrypted diversifier: 0x0000
< HCI Command: LE Long Term Key R.. (0x08|0x001a) plen 18  #85 [hci1] 66.557980
        Handle: 2973 Address: DF:A9:FF:F6:B1:1A (OUI DF-A9-FF)
        Long term key: 6109db299ae0db87ef15e11979d3c82d
> HCI Event: Command Complete (0x0e) plen 6                #86 [hci1] 66.558718
      LE Long Term Key Request Reply (0x08|0x001a) ncmd 1
        Status: Success (0x00)
        Handle: 2973 Address: DF:A9:FF:F6:B1:1A (OUI DF-A9-FF)
> HCI Event: Encryption Change (0x08) plen 4               #87 [hci1] 66.977842
        Status: Success (0x00)
        Handle: 2973 Address: DF:A9:FF:F6:B1:1A (OUI DF-A9-FF)
        Encryption: Enabled with AES-CCM (0x01)
> ACL Data RX: Handle 2973 flags 0x02 dlen 21              #88 [hci1] 67.065495
      SMP: Identity Information (0x08) len 16
        Identity resolving key: 6cf0d45ffcfbbc186cdd142739e03843
< ACL Data TX: Handle 2973 flags 0x00 dlen 11              #89 [hci1] 67.108326
      ATT: Read By Type Request (0x08) len 6
        Handle range: 0x0001-0xffff
        Attribute type: Central Address Resolution (0x2aa6)
< HCI Command: Host Number of Comp.. (0x03|0x0035) plen 5  #90 [hci1] 67.108707
        Num handles: 1
        Handle: 2973 Address: DF:A9:FF:F6:B1:1A (OUI DF-A9-FF)
        Count: 1
> ACL Data RX: Handle 2973 flags 0x02 dlen 12              #91 [hci1] 67.152677
      SMP: Identity Address Information (0x09) len 7
        Address: DF:A9:FF:F6:B1:1A (OUI DF-A9-FF)
< HCI Command: LE Add Device To R.. (0x08|0x0027) plen 39  #92 [hci1] 67.157830
        Address type: Public (0x00)
        Address: DF:A9:FF:F6:B1:1A (OUI DF-A9-FF)
        Peer identity resolving key: 6cf0d45ffcfbbc186cdd142739e03843
        Local identity resolving key: 00000000000000000000000000000000
> HCI Event: Command Complete (0x0e) plen 4                #93 [hci1] 67.158965
      LE Add Device To Resolving List (0x08|0x0027) ncmd 1
        Status: Success (0x00)
< HCI Command: LE Set Privacy Mode (0x08|0x004e) plen 8    #94 [hci1] 67.177627
        Peer Identity address type: Public (0x00)
        Peer Identity address: DF:A9:FF:F6:B1:1A (OUI DF-A9-FF)
        Privacy Mode: Use Device Privacy (0x01)
> HCI Event: Command Complete (0x0e) plen 4                #95 [hci1] 67.178203
      LE Set Privacy Mode (0x08|0x004e) ncmd 1
        Status: Success (0x00)
< HCI Command: LE Set Address Reso.. (0x08|0x002d) plen 1  #96 [hci1] 67.197654
        Address resolution: Enabled (0x01)
> HCI Event: Command Complete (0x0e) plen 4                #97 [hci1] 67.198195
      LE Set Address Resolution Enable (0x08|0x002d) ncmd 1
        Status: Success (0x00)
< HCI Command: Host Number of Comp.. (0x03|0x0035) plen 5  #98 [hci1] 67.217762
        Num handles: 1
        Handle: 2973 Address: DF:A9:FF:F6:B1:1A (OUI DF-A9-FF)
        Count: 1
> HCI Event: Number of Completed Packets (0x13) plen 5     #99 [hci1] 67.240144
        Num handles: 1
        Handle: 2973 Address: DF:A9:FF:F6:B1:1A (OUI DF-A9-FF)
        Count: 1
        #89: len 11 (0 Kb/s)
        Latency: 131 msec (70-164 msec ~142 msec)
> ACL Data RX: Handle 2973 flags 0x02 dlen 9              #100 [hci1] 67.240282
      ATT: Read By Type Response (0x09) len 4
        Attribute data length: 3
        Attribute data list: 1 entry
        Handle: 0x000f
        Value: 01
< HCI Command: Host Number of Com.. (0x03|0x0035) plen 5  #101 [hci1] 67.258132
        Num handles: 1
        Handle: 2973 Address: DF:A9:FF:F6:B1:1A (OUI DF-A9-FF)
        Count: 1
> HCI Event: Disconnect Complete (0x05) plen 4            #102 [hci1] 68.027761
        Status: Success (0x00)
        Handle: 2973 Address: DF:A9:FF:F6:B1:1A (OUI DF-A9-FF)
        Reason: Remote User Terminated Connection (0x13)
< HCI Command: LE Set Extended A.. (0x08|0x0036) plen 25  #103 [hci1] 68.677717
        Handle: 0x00
        Properties: 0x0013
          Connectable
          Scannable
          Use legacy advertising PDUs: ADV_IND
        Min advertising interval: 100.000 msec (0x00a0)
        Max advertising interval: 150.000 msec (0x00f0)
        Channel map: 37, 38, 39 (0x07)
        Own address type: Random (0x01)
        Peer address type: Public (0x00)
        Peer address: 00:00:00:00:00:00 (OUI 00-00-00)
        Filter policy: Allow Scan Request from Any, Allow Connect Request from Any (0x00)
        TX power: Host has no preference (0x7f)
        Primary PHY: LE 1M (0x01)
        Secondary max skip: 0x00
        Secondary PHY: LE 1M (0x01)
        SID: 0x00
        Scan request notifications: Disabled (0x00)
> HCI Event: Command Complete (0x0e) plen 5               #104 [hci1] 68.678584
      LE Set Extended Advertising Parameters (0x08|0x0036) ncmd 1
        Status: Success (0x00)
        TX power (selected): 0 dbm (0x00)
< HCI Command: LE Set Advertising.. (0x08|0x0035) plen 7  #105 [hci1] 68.697707
        Advertising handle: 0x00
        Advertising random address: D5:B6:CC:31:DB:3B (Static)
> HCI Event: Command Complete (0x0e) plen 4               #106 [hci1] 68.698359
      LE Set Advertising Set Random Address (0x08|0x0035) ncmd 1
        Status: Success (0x00)
< HCI Command: LE Set Extended A.. (0x08|0x0037) plen 22  #107 [hci1] 68.717781
        Handle: 0x00
        Operation: Complete extended advertising data (0x03)
        Fragment preference: Minimize fragmentation (0x01)
        Data length: 0x12
        Flags: 0x04
          BR/EDR Not Supported
        Name (complete): Tester_F6B11A
> HCI Event: Command Complete (0x0e) plen 4               #108 [hci1] 68.718531
      LE Set Extended Advertising Data (0x08|0x0037) ncmd 1
        Status: Success (0x00)
< HCI Command: LE Set Extended Sc.. (0x08|0x0038) plen 4  #109 [hci1] 68.737727
        Handle: 0x00
        Operation: Complete scan response data (0x03)
        Fragment preference: Minimize fragmentation (0x01)
        Data length: 0x00
> HCI Event: Command Complete (0x0e) plen 4               #110 [hci1] 68.738270
      LE Set Extended Scan Response Data (0x08|0x0038) ncmd 1
        Status: Success (0x00)
< HCI Command: LE Set Extended Ad.. (0x08|0x0039) plen 6  #111 [hci1] 68.757715
        Extended advertising: Enabled (0x01)
        Number of sets: 1 (0x01)
        Entry 0
          Handle: 0x00
          Duration: 0 ms (0x00)
          Max ext adv events: 0
> HCI Event: Command Complete (0x0e) plen 4               #112 [hci1] 68.758297
      LE Set Extended Advertising Enable (0x08|0x0039) ncmd 1
        Status: Success (0x00)
> HCI Event: LE Meta Event (0x3e) plen 31                 #113 [hci1] 69.080297
      LE Enhanced Connection Complete (0x0a)
        Status: Success (0x00)
        Handle: 2991
        Role: Peripheral (0x01)
        Peer address type: Public (0x00)
        Peer address: DF:A9:FF:F6:B1:1A (OUI DF-A9-FF)
        Local resolvable private address: 00:00:00:00:00:00 (Non-Resolvable)
        Peer resolvable private address: 00:00:00:00:00:00 (Non-Resolvable)
        Connection interval: 87.50 msec (0x0046)
        Connection latency: 0 (0x0000)
        Supervision timeout: 20000 msec (0x07d0)
        Central clock accuracy: 0x01
> HCI Event: LE Meta Event (0x3e) plen 6                  #114 [hci1] 69.080597
      LE Advertising Set Terminated (0x12)
        Status: Success (0x00)
        Handle: 0
        Connection handle: 2991
        Number of completed extended advertising events: 0
< HCI Command: LE Read Remote Use.. (0x08|0x0016) plen 2  #115 [hci1] 69.097980
        Handle: 2991 Address: DF:A9:FF:F6:B1:1A (OUI DF-A9-FF)
> HCI Event: Command Status (0x0f) plen 4                 #116 [hci1] 69.098517
      LE Read Remote Used Features (0x08|0x0016) ncmd 1
        Status: Success (0x00)
> HCI Event: LE Meta Event (0x3e) plen 12                 #117 [hci1] 69.344275
      LE Read Remote Used Features (0x04)
        Status: Success (0x00)
        Handle: 2991 Address: DF:A9:FF:F6:B1:1A (OUI DF-A9-FF)
        Features: 0x2d 0x49 0x00 0xf7 0x67 0xd9 0x00 0x80
          LE Encryption
          Extended Reject Indication
          Peripheral-initiated Features Exchange
          LE Data Packet Length Extension
          LE 2M PHY
          LE Coded PHY
          Channel Selection Algorithm #2
          Periodic Advertising Sync Transfer - Sender
          Periodic Advertising Sync Transfer - Recipient
          Sleep Clock Accuracy Updates
          Connected Isochronous Stream - Central
          Connected Isochronous Stream - Peripheral
          Isochronous Broadcaster
          Synchronized Receiver
          Connected Isochronous Stream (Host Support)
          LE Power Control Request
          LE Power Control Request
          Connection Subrating
          Connection Subrating (Host Support)
          Unknown features (0x8000d90000000000)
< ACL Data TX: Handle 2991 flags 0x00 dlen 7              #118 [hci1] 69.787675
      ATT: Read Request (0x0a) len 2
        Handle: 0x0007
> HCI Event: Number of Completed Packets (0x13) plen 5    #119 [hci1] 69.956403
        Num handles: 1
        Handle: 2991 Address: DF:A9:FF:F6:B1:1A (OUI DF-A9-FF)
        Count: 1
        #118: len 7 (0 Kb/s)
        Latency: 168 msec (168-168 msec ~168 msec)
> ACL Data RX: Handle 2991 flags 0x02 dlen 9              #120 [hci1] 69.956629
      ATT: Error Response (0x01) len 4
        Read Request (0x0a)
        Handle: 0x0007
        Error: Insufficient Authentication (0x05)
> ACL Data RX: Handle 2991 flags 0x02 dlen 11             #121 [hci1] 69.957072
      SMP: Pairing Request (0x01) len 6
        IO capability: KeyboardDisplay (0x04)
        OOB data: Authentication data not present (0x00)
        Authentication requirement: Bonding, No MITM, SC, No Keypresses (0x09)
        Max encryption key size: 16
        Initiator key distribution: EncKey IdKey Sign LinkKey (0x0f)
        Responder key distribution: EncKey IdKey Sign LinkKey (0x0f)
< HCI Command: Host Number of Com.. (0x03|0x0035) plen 5  #122 [hci1] 69.957846
        Num handles: 1
        Handle: 2991 Address: DF:A9:FF:F6:B1:1A (OUI DF-A9-FF)
        Count: 1
< HCI Command: Host Number of Com.. (0x03|0x0035) plen 5  #123 [hci1] 69.957943
        Num handles: 1
        Handle: 2991 Address: DF:A9:FF:F6:B1:1A (OUI DF-A9-FF)
        Count: 1
< ACL Data TX: Handle 2991 flags 0x00 dlen 11             #124 [hci1] 69.957960
      SMP: Pairing Response (0x02) len 6
        IO capability: KeyboardDisplay (0x04)
        OOB data: Authentication data not present (0x00)
        Authentication requirement: Bonding, No MITM, SC, No Keypresses (0x09)
        Max encryption key size: 16
        Initiator key distribution: IdKey (0x02)
        Responder key distribution: <none> (0x00)
> HCI Event: Number of Completed Packets (0x13) plen 5    #125 [hci1] 70.131579
        Num handles: 1
        Handle: 2991 Address: DF:A9:FF:F6:B1:1A (OUI DF-A9-FF)
        Count: 1
        #124: len 11 (0 Kb/s)
        Latency: 173 msec (168-173 msec ~171 msec)
> ACL Data RX: Handle 2991 flags 0x02 dlen 27             #126 [hci1] 70.131894
> ACL Data RX: Handle 2991 flags 0x01 dlen 27             #127 [hci1] 70.132387
> ACL Data RX: Handle 2991 flags 0x01 dlen 15             #128 [hci1] 70.132829
      SMP: Pairing Public Key (0x0c) len 64
        X: 850b6bea1de62e8a505f8fe00e55bba2b9b7d7262a758d41da849ab38a0c44e0
        Y: 87514809230a52d9c0e0f90073ce9e69e3230d3547127db475c07c67fe159dd4
< HCI Command: Host Number of Com.. (0x03|0x0035) plen 5  #129 [hci1] 70.138446
        Num handles: 1
        Handle: 2991 Address: DF:A9:FF:F6:B1:1A (OUI DF-A9-FF)
        Count: 1
< HCI Command: Host Number of Com.. (0x03|0x0035) plen 5  #130 [hci1] 70.138687
        Num handles: 1
        Handle: 2991 Address: DF:A9:FF:F6:B1:1A (OUI DF-A9-FF)
        Count: 1
< HCI Command: Host Number of Com.. (0x03|0x0035) plen 5  #131 [hci1] 70.138867
        Num handles: 1
        Handle: 2991 Address: DF:A9:FF:F6:B1:1A (OUI DF-A9-FF)
        Count: 1
< ACL Data TX: Handle 2991 flags 0x00 dlen 27             #132 [hci1] 70.138938
< ACL Data TX: Handle 2991 flags 0x01 dlen 27             #133 [hci1] 70.138965
< ACL Data TX: Handle 2991 flags 0x01 dlen 15             #134 [hci1] 70.139016
      SMP: Pairing Public Key (0x0c) len 64
        X: 98308440221e2d910f0e54b71e7ec652857aa9b5a0dc65028824cc19db1226e9
        Y: 67a4816bcb62efb21701e31fdb27561a6217575fb007a8bbdabe7e28b6f68482
> HCI Event: Number of Completed Packets (0x13) plen 5    #135 [hci1] 70.219564
        Num handles: 1
        Handle: 2991 Address: DF:A9:FF:F6:B1:1A (OUI DF-A9-FF)
        Count: 1
        #132: len 27 (2 Kb/s)
        Latency: 80 msec (80-173 msec ~125 msec)
> HCI Event: Number of Completed Packets (0x13) plen 5    #136 [hci1] 70.220084
        Num handles: 1
        Handle: 2991 Address: DF:A9:FF:F6:B1:1A (OUI DF-A9-FF)
        Count: 1
        #133: len 27 (2 Kb/s)
        Latency: 81 msec (80-173 msec ~103 msec)
< ACL Data TX: Handle 2991 flags 0x00 dlen 21             #137 [hci1] 70.238129
      SMP: Pairing Confirm (0x03) len 16
        Confim value: a7aa417dc2d8ab502f44374bf769ea1f
> HCI Event: Number of Completed Packets (0x13) plen 5    #138 [hci1] 70.306318
        Num handles: 1
        Handle: 2991 Address: DF:A9:FF:F6:B1:1A (OUI DF-A9-FF)
        Count: 1
        #134: len 15 (0 Kb/s)
        Latency: 167 msec (80-173 msec ~135 msec)
> HCI Event: Number of Completed Packets (0x13) plen 5    #139 [hci1] 70.394055
        Num handles: 1
        Handle: 2991 Address: DF:A9:FF:F6:B1:1A (OUI DF-A9-FF)
        Count: 1
        #137: len 21 (1 Kb/s)
        Latency: 155 msec (80-173 msec ~145 msec)
> ACL Data RX: Handle 2991 flags 0x02 dlen 21             #140 [hci1] 70.394291
      SMP: Pairing Random (0x04) len 16
        Random value: fe401b6d0accc44e53f0d335b1da1ff5
< HCI Command: Host Number of Com.. (0x03|0x0035) plen 5  #141 [hci1] 70.397914
        Num handles: 1
        Handle: 2991 Address: DF:A9:FF:F6:B1:1A (OUI DF-A9-FF)
        Count: 1
< ACL Data TX: Handle 2991 flags 0x00 dlen 21             #142 [hci1] 70.397941
      SMP: Pairing Random (0x04) len 16
        Random value: 5da095555cc64d02679f89a05211af56
> HCI Event: Number of Completed Packets (0x13) plen 5    #143 [hci1] 70.568992
        Num handles: 1
        Handle: 2991 Address: DF:A9:FF:F6:B1:1A (OUI DF-A9-FF)
        Count: 1
        #142: len 21 (0 Kb/s)
        Latency: 171 msec (80-173 msec ~158 msec)
> ACL Data RX: Handle 2991 flags 0x02 dlen 21             #144 [hci1] 70.569397
      SMP: Pairing DHKey Check (0x0d) len 16
        E: e4c4dcb1dc0f83726557ca127afc0b0c
< HCI Command: Host Number of Com.. (0x03|0x0035) plen 5  #145 [hci1] 70.578361
        Num handles: 1
        Handle: 2991 Address: DF:A9:FF:F6:B1:1A (OUI DF-A9-FF)
        Count: 1
< ACL Data TX: Handle 2991 flags 0x00 dlen 21             #146 [hci1] 70.578391
      SMP: Pairing DHKey Check (0x0d) len 16
        E: 4183d3ed9c59e4c192df46a8c978fd07
> HCI Event: Number of Completed Packets (0x13) plen 5    #147 [hci1] 70.743812
        Num handles: 1
        Handle: 2991 Address: DF:A9:FF:F6:B1:1A (OUI DF-A9-FF)
        Count: 1
        #146: len 21 (1 Kb/s)
        Latency: 165 msec (80-173 msec ~161 msec)
> HCI Event: LE Meta Event (0x3e) plen 13                 #148 [hci1] 70.831923
      LE Long Term Key Request (0x05)
        Handle: 2991 Address: DF:A9:FF:F6:B1:1A (OUI DF-A9-FF)
        Random number: 0x0000000000000000
        Encrypted diversifier: 0x0000
< HCI Command: LE Long Term Key... (0x08|0x001a) plen 18  #149 [hci1] 70.837799
        Handle: 2991 Address: DF:A9:FF:F6:B1:1A (OUI DF-A9-FF)
        Long term key: 19f66b361207a1ead1704a509f05d0a8
> HCI Event: Command Complete (0x0e) plen 6               #150 [hci1] 70.838591
      LE Long Term Key Request Reply (0x08|0x001a) ncmd 1
        Status: Success (0x00)
        Handle: 2991 Address: DF:A9:FF:F6:B1:1A (OUI DF-A9-FF)
> HCI Event: Encryption Change (0x08) plen 4              #151 [hci1] 71.269104
        Status: Success (0x00)
        Handle: 2991 Address: DF:A9:FF:F6:B1:1A (OUI DF-A9-FF)
        Encryption: Enabled with AES-CCM (0x01)
< HCI Command: LE Set Address Res.. (0x08|0x002d) plen 1  #152 [hci1] 71.277771
        Address resolution: Disabled (0x00)
> HCI Event: Command Complete (0x0e) plen 4               #153 [hci1] 71.278323
      LE Set Address Resolution Enable (0x08|0x002d) ncmd 1
        Status: Success (0x00)
< HCI Command: LE Remove Device F.. (0x08|0x0028) plen 7  #154 [hci1] 71.297796
        Address type: Public (0x00)
        Address: DF:A9:FF:F6:B1:1A (OUI DF-A9-FF)
> HCI Event: Command Complete (0x0e) plen 4               #155 [hci1] 71.298402
      LE Remove Device From Resolving List (0x08|0x0028) ncmd 1
        Status: Success (0x00)
> ACL Data RX: Handle 2991 flags 0x02 dlen 21             #156 [hci1] 71.356736
      SMP: Identity Information (0x08) len 16
        Identity resolving key: 6cf0d45ffcfbbc186cdd142739e03843
< ACL Data TX: Handle 2991 flags 0x00 dlen 11             #157 [hci1] 71.427827
      ATT: Read By Type Request (0x08) len 6
        Handle range: 0x0001-0xffff
        Attribute type: Central Address Resolution (0x2aa6)
< HCI Command: Host Number of Com.. (0x03|0x0035) plen 5  #158 [hci1] 71.427966
        Num handles: 1
        Handle: 2991 Address: DF:A9:FF:F6:B1:1A (OUI DF-A9-FF)
        Count: 1
> ACL Data RX: Handle 2991 flags 0x02 dlen 12             #159 [hci1] 71.444080
      SMP: Identity Address Information (0x09) len 7
        Address: DF:A9:FF:F6:B1:1A (OUI DF-A9-FF)
< HCI Command: LE Add Device To... (0x08|0x0027) plen 39  #160 [hci1] 71.457816
        Address type: Public (0x00)
        Address: DF:A9:FF:F6:B1:1A (OUI DF-A9-FF)
        Peer identity resolving key: 6cf0d45ffcfbbc186cdd142739e03843
        Local identity resolving key: 00000000000000000000000000000000
> HCI Event: Command Complete (0x0e) plen 4               #161 [hci1] 71.458807
      LE Add Device To Resolving List (0x08|0x0027) ncmd 1
        Status: Success (0x00)
< HCI Command: LE Set Privacy Mode (0x08|0x004e) plen 8   #162 [hci1] 71.477752
        Peer Identity address type: Public (0x00)
        Peer Identity address: DF:A9:FF:F6:B1:1A (OUI DF-A9-FF)
        Privacy Mode: Use Device Privacy (0x01)
> HCI Event: Command Complete (0x0e) plen 4               #163 [hci1] 71.478235
      LE Set Privacy Mode (0x08|0x004e) ncmd 1
        Status: Success (0x00)
< HCI Command: LE Set Address Res.. (0x08|0x002d) plen 1  #164 [hci1] 71.497771
        Address resolution: Enabled (0x01)
> HCI Event: Command Complete (0x0e) plen 4               #165 [hci1] 71.498320
      LE Set Address Resolution Enable (0x08|0x002d) ncmd 1
        Status: Success (0x00)
< HCI Command: Host Number of Com.. (0x03|0x0035) plen 5  #166 [hci1] 71.517767
        Num handles: 1
        Handle: 2991 Address: DF:A9:FF:F6:B1:1A (OUI DF-A9-FF)
        Count: 1
> HCI Event: Number of Completed Packets (0x13) plen 5    #167 [hci1] 71.531475
        Num handles: 1
        Handle: 2991 Address: DF:A9:FF:F6:B1:1A (OUI DF-A9-FF)
        Count: 1
        #157: len 11 (0 Kb/s)
        Latency: 103 msec (80-173 msec ~132 msec)
> ACL Data RX: Handle 2991 flags 0x02 dlen 9              #168 [hci1] 71.531686
      ATT: Read By Type Response (0x09) len 4
        Attribute data length: 3
        Attribute data list: 1 entry
        Handle: 0x000f
        Value: 01
< HCI Command: Host Number of Com.. (0x03|0x0035) plen 5  #169 [hci1] 71.537965
        Num handles: 1
        Handle: 2991 Address: DF:A9:FF:F6:B1:1A (OUI DF-A9-FF)
        Count: 1
< ACL Data TX: Handle 2991 flags 0x00 dlen 7              #170 [hci1] 71.977827
      ATT: Read Request (0x0a) len 2
        Handle: 0x0007
> HCI Event: Number of Completed Packets (0x13) plen 5    #171 [hci1] 72.144060
        Num handles: 1
        Handle: 2991 Address: DF:A9:FF:F6:B1:1A (OUI DF-A9-FF)
        Count: 1
        #170: len 7 (0 Kb/s)
        Latency: 166 msec (80-173 msec ~149 msec)
> ACL Data RX: Handle 2991 flags 0x02 dlen 27             #172 [hci1] 72.144539
      ATT: Read Response (0x0b) len 22
< HCI Command: Host Number of Com.. (0x03|0x0035) plen 5  #173 [hci1] 72.157911
        Num handles: 1
        Handle: 2991 Address: DF:A9:FF:F6:B1:1A (OUI DF-A9-FF)
        Count: 1
< ACL Data TX: Handle 2991 flags 0x00 dlen 9              #174 [hci1] 72.158011
      ATT: Read Blob Request (0x0c) len 4
        Handle: 0x0007
        Offset: 0x0016
> HCI Event: Number of Completed Packets (0x13) plen 5    #175 [hci1] 72.318865
        Num handles: 1
        Handle: 2991 Address: DF:A9:FF:F6:B1:1A (OUI DF-A9-FF)
        Count: 1
        #174: len 9 (0 Kb/s)
        Latency: 160 msec (80-173 msec ~155 msec)
> ACL Data RX: Handle 2991 flags 0x02 dlen 21             #176 [hci1] 72.406707
      ATT: Read Blob Response (0x0d) len 16
        77 69 6c 6c 20 62 65 20 70 75 74 20 68 65 72 65  will be put here
< HCI Command: Host Number of Com.. (0x03|0x0035) plen 5  #177 [hci1] 72.417996
        Num handles: 1
        Handle: 2991 Address: DF:A9:FF:F6:B1:1A (OUI DF-A9-FF)
        Count: 1
> HCI Event: Disconnect Complete (0x05) plen 4            #178 [hci1] 72.494113
        Status: Success (0x00)
        Handle: 2991 Address: DF:A9:FF:F6:B1:1A (OUI DF-A9-FF)
        Reason: Remote User Terminated Connection (0x13)
< HCI Command: Reset (0x03|0x0003) plen 0                 #179 [hci1] 77.117839
> HCI Event: Command Complete (0x0e) plen 4               #180 [hci1] 77.118306
      Reset (0x03|0x0003) ncmd 1
        Status: Success (0x00)
@ USER Close: main                                    {0x0001} [hci1] 77.137723
= Close Index: 00:00:00:00:00:00                               [hci1] 77.145423
