Bluetooth monitor ver 5.72
= Note: Linux version 7.0.0-31-generic (x86_64)                        0.994802
= Note: Bluetooth subsystem version 2.22                               0.994804
= New Index: 00:00:00:00:00:00 (Primary,UART,hci1)              [hci1] 0.994805
= New Index: 48:5F:99:8E:E0:64 (Primary,USB,hci0)               [hci0] 0.994806
= Open Index: 00:00:00:00:00:00                                 [hci1] 1.117944
= Index Info: 00:00:00:00:00:00 (Nordic Semiconductor ASA)      [hci1] 1.117949
@ USER Open: main (privileged) version 2.22            {0x0001} [hci1] 1.117951
< HCI Command: Reset (0x03|0x0003) plen 0                    #1 [hci1] 1.118253
> HCI Event: Command Complete (0x0e) plen 4                  #2 [hci1] 1.118717
      Reset (0x03|0x0003) ncmd 1
        Status: Success (0x00)
< HCI Command: Read Local Supported... (0x04|0x0003) plen 0  #3 [hci1] 1.137949
> HCI Event: Command Complete (0x0e) plen 12                 #4 [hci1] 1.138457
      Read Local Supported Features (0x04|0x0003) ncmd 1
        Status: Success (0x00)
        Features: 0x00 0x00 0x00 0x00 0x60 0x00 0x00 0x00
          BR/EDR Not Supported
          LE Supported (Controller)
< HCI Command: Read Local Version In.. (0x04|0x0001) plen 0  #5 [hci1] 1.157959
> HCI Event: Command Complete (0x0e) plen 12                 #6 [hci1] 1.158497
      Read Local Version Information (0x04|0x0001) ncmd 1
        Status: Success (0x00)
        HCI version: Reserved (0x11) - Revision 12345 (0x3039)
        LMP version: Reserved (0x11) - Subversion 12345 (0x3039)
        Manufacturer: Nordic Semiconductor ASA (89)
< HCI Command: Read Local Supported... (0x04|0x0002) plen 0  #7 [hci1] 1.177925
> HCI Event: Command Complete (0x0e) plen 68                 #8 [hci1] 1.178960
      Read Local Supported Commands (0x04|0x0002) ncmd 1
        Status: Success (0x00)
        Commands: 115 entries
          Disconnect (Octet 0 - Bit 5)
          Read Remote Version Information (Octet 2 - Bit 7)
          Set Event Mask (Octet 5 - Bit 6)
          Reset (Octet 5 - Bit 7)
          Read Connection Accept Timeout (Octet 7 - Bit 2)
          Write Connection Accept Timeout (Octet 7 - Bit 3)
          Read Transmit Power Level (Octet 10 - Bit 2)
          Set Controller To Host Flow Control (Octet 10 - Bit 5)
          Host Buffer Size (Octet 10 - Bit 6)
          Host Number of Completed Packets (Octet 10 - Bit 7)
          Read Local Version Information (Octet 14 - Bit 3)
          Read Local Supported Features (Octet 14 - Bit 5)
          Read BD ADDR (Octet 15 - Bit 1)
          Read RSSI (Octet 15 - Bit 5)
          Set Event Mask Page 2 (Octet 22 - Bit 2)
          LE Set Event Mask (Octet 25 - Bit 0)
          LE Read Buffer Size (Octet 25 - Bit 1)
          LE Read Local Supported Features (Octet 25 - Bit 2)
          LE Set Random Address (Octet 25 - Bit 4)
          LE Set Advertising Parameters (Octet 25 - Bit 5)
          LE Read Advertising Channel TX Power (Octet 25 - Bit 6)
          LE Set Advertising Data (Octet 25 - Bit 7)
          LE Set Scan Response Data (Octet 26 - Bit 0)
          LE Set Advertise Enable (Octet 26 - Bit 1)
          LE Set Scan Parameters (Octet 26 - Bit 2)
          LE Set Scan Enable (Octet 26 - Bit 3)
          LE Create Connection (Octet 26 - Bit 4)
          LE Create Connection Cancel (Octet 26 - Bit 5)
          LE Read Accept List Size (Octet 26 - Bit 6)
          LE Clear Accept List (Octet 26 - Bit 7)
          LE Add Device To Accept List (Octet 27 - Bit 0)
          LE Remove Device From Accept List (Octet 27 - Bit 1)
          LE Connection Update (Octet 27 - Bit 2)
          LE Set Host Channel Classification (Octet 27 - Bit 3)
          LE Read Channel Map (Octet 27 - Bit 4)
          LE Read Remote Used Features (Octet 27 - Bit 5)
          LE Encrypt (Octet 27 - Bit 6)
          LE Rand (Octet 27 - Bit 7)
          LE Start Encryption (Octet 28 - Bit 0)
          LE Long Term Key Request Reply (Octet 28 - Bit 1)
          LE Long Term Key Request Neg Reply (Octet 28 - Bit 2)
          LE Read Supported States (Octet 28 - Bit 3)
          Read Authenticated Payload Timeout (Octet 32 - Bit 4)
          Write Authenticated Payload Timeout (Octet 32 - Bit 5)
          LE Set Data Length (Octet 33 - Bit 6)
          LE Read Suggested Default Data Length (Octet 33 - Bit 7)
          LE Write Suggested Default Data Length (Octet 34 - Bit 0)
          LE Add Device To Resolving List (Octet 34 - Bit 3)
          LE Remove Device From Resolving List (Octet 34 - Bit 4)
          LE Clear Resolving List (Octet 34 - Bit 5)
          LE Read Resolving List Size (Octet 34 - Bit 6)
          LE Set Address Resolution Enable (Octet 35 - Bit 1)
          LE Set Resolvable Private Address Timeout (Octet 35 - Bit 2)
          LE Read Maximum Data Length (Octet 35 - Bit 3)
          LE Read PHY (Octet 35 - Bit 4)
          LE Set Default PHY (Octet 35 - Bit 5)
          LE Set PHY (Octet 35 - Bit 6)
          LE Set Advertising Set Random Address (Octet 36 - Bit 1)
          LE Set Extended Advertising Parameters (Octet 36 - Bit 2)
          LE Set Extended Advertising Data (Octet 36 - Bit 3)
          LE Set Extended Scan Response Data (Octet 36 - Bit 4)
          LE Set Extended Advertising Enable (Octet 36 - Bit 5)
          LE Read Maximum Advertising Data Length (Octet 36 - Bit 6)
          LE Read Number of Supported Advertising Sets (Octet 36 - Bit 7)
          LE Remove Advertising Set (Octet 37 - Bit 0)
          LE Clear Advertising Sets (Octet 37 - Bit 1)
          LE Set Periodic Advertising Parameters (Octet 37 - Bit 2)
          LE Set Periodic Advertising Data (Octet 37 - Bit 3)
          LE Set Periodic Advertising Enable (Octet 37 - Bit 4)
          LE Set Extended Scan Parameters (Octet 37 - Bit 5)
          LE Set Extended Scan Enable (Octet 37 - Bit 6)
          LE Extended Create Connection (Octet 37 - Bit 7)
          LE Periodic Advertising Create Sync (Octet 38 - Bit 0)
          LE Periodic Advertising Create Sync Cancel (Octet 38 - Bit 1)
          LE Periodic Advertising Terminate Sync (Octet 38 - Bit 2)
          LE Add Device To Periodic Advertiser List (Octet 38 - Bit 3)
          LE Remove Device From Periodic Advertiser List (Octet 38 - Bit 4)
          LE Clear Periodic Advertiser List (Octet 38 - Bit 5)
          LE Read Periodic Advertiser List Size (Octet 38 - Bit 6)
          LE Read Transmit Power (Octet 38 - Bit 7)
          LE Read RF Path Compensation (Octet 39 - Bit 0)
          LE Write RF Path Compensation (Octet 39 - Bit 1)
          LE Set Privacy Mode (Octet 39 - Bit 2)
          LE Periodic Advertising Receive Enable (Octet 40 - Bit 5)
          LE Periodic Advertising Sync Transfer (Octet 40 - Bit 6)
          LE Periodic Advertising Set Info Transfer (Octet 40 - Bit 7)
          LE Periodic Advertising Sync Transfer Parameters (Octet 41 - Bit 0)
          LE Set Default Periodic Advertisng Sync Transfer Parameters (Octet 41 - Bit 1)
          LE Read Buffer v2 (Octet 41 - Bit 5)
          LE Read ISO TX Sync (Octet 41 - Bit 6)
          LE Set Connected Isochronous Group Parameters (Octet 41 - Bit 7)
          LE Set Connected Isochronous Group Parameters Test (Octet 42 - Bit 0)
          LE Create Connected Isochronous Stream (Octet 42 - Bit 1)
          LE Remove Connected Isochronous Group (Octet 42 - Bit 2)
          LE Accept Connected Isochronous Stream Request (Octet 42 - Bit 3)
          LE Reject Connected Isochronous Stream Request (Octet 42 - Bit 4)
          LE Create Broadcast Isochronous Group (Octet 42 - Bit 5)
          LE Create Broadcast Isochronous Group Test (Octet 42 - Bit 6)
          LE Terminate Broadcast Isochronous Group (Octet 42 - Bit 7)
          LE Broadcast Isochronous Group Create Sync (Octet 43 - Bit 0)
          LE Broadcast Isochronous Group Terminate Sync (Octet 43 - Bit 1)
          LE Request Peer SCA (Octet 43 - Bit 2)
          LE Setup Isochronous Data Path (Octet 43 - Bit 3)
          LE Remove Isochronous Data Path (Octet 43 - Bit 4)
          LE Isochronous Transmit Test (Octet 43 - Bit 5)
          LE Isochronous Receive Test (Octet 43 - Bit 6)
          LE Isochronous Read Test Counters (Octet 43 - Bit 7)
          LE Isochronous Read Test Counters (Octet 44 - Bit 0)
          LE Set Host Feature (Octet 44 - Bit 1)
          Octet 44 - Bit 2 
          Octet 45 - Bit 6 
          Octet 46 - Bit 0 
          Octet 46 - Bit 1 
          Octet 46 - Bit 2 
          Octet 47 - Bit 4 
< HCI Command: Host Buffer Size (0x03|0x0033) plen 7         #9 [hci1] 1.197936
        ACL MTU: 255  ACL max packet: 16
        SCO MTU: 0    SCO max packet: 0
> HCI Event: Command Complete (0x0e) plen 4                 #10 [hci1] 1.198502
      Host Buffer Size (0x03|0x0033) ncmd 1
        Status: Success (0x00)
< HCI Command: Set Controller To Ho.. (0x03|0x0031) plen 1  #11 [hci1] 1.217933
        Flow control: ACL Data Packets (0x01)
> HCI Event: Command Complete (0x0e) plen 4                 #12 [hci1] 1.218278
      Set Controller To Host Flow Control (0x03|0x0031) ncmd 1
        Status: Success (0x00)
< HCI Command: LE Read Local Suppor.. (0x08|0x0003) plen 0  #13 [hci1] 1.237938
> HCI Event: Command Complete (0x0e) plen 12                #14 [hci1] 1.238445
      LE Read Local Supported Features (0x08|0x0003) ncmd 1
        Status: Success (0x00)
        Features: 0xfd 0x79 0x00 0xf7 0x30 0x01 0x00 0x00
          LE Encryption
          Extended Reject Indication
          Peripheral-initiated Features Exchange
          LE Ping
          LE Data Packet Length Extension
          LL Privacy
          Extended Scanner Filter Policies
          LE 2M PHY
          LE Coded PHY
          LE Extended Advertising
          LE Periodic Advertising
          Channel Selection Algorithm #2
          Periodic Advertising Sync Transfer - Sender
          Periodic Advertising Sync Transfer - Recipient
          Sleep Clock Accuracy Updates
          Connected Isochronous Stream - Central
          Connected Isochronous Stream - Peripheral
          Isochronous Broadcaster
          Synchronized Receiver
          Periodic Advertising ADI support
          Connection Subrating
          Unknown features (0x0000010000000000)
< HCI Command: LE Set Host Feature (0x08|0x0074) plen 2     #15 [hci1] 1.257928
        Bit Number: 32
          Connected Isochronous Stream (Host Support)
        Bit Value: 1
> HCI Event: Command Complete (0x0e) plen 4                 #16 [hci1] 1.258340
      LE Set Host Feature (0x08|0x0074) ncmd 1
        Status: Success (0x00)
< HCI Command: LE Read Buffer v2 (0x08|0x0060) plen 0       #17 [hci1] 1.277919
> HCI Event: Command Complete (0x0e) plen 10                #18 [hci1] 1.278369
      LE Read Buffer v2 (0x08|0x0060) ncmd 1
        Status: Success (0x00)
        ACL MTU: 27
        ACL max packet: 3
        ISO MTU: 318
        ISO max packet: 3
< HCI Command: LE Read Maximum Adve.. (0x08|0x003a) plen 0  #19 [hci1] 1.297964
> HCI Event: Command Complete (0x0e) plen 6                 #20 [hci1] 1.298481
      LE Read Maximum Advertising Data Length (0x08|0x003a) ncmd 1
        Status: Success (0x00)
        Max length: 1650
< HCI Command: LE Read Supported St.. (0x08|0x001c) plen 0  #21 [hci1] 1.317927
> HCI Event: Command Complete (0x0e) plen 12                #22 [hci1] 1.318360
      LE Read Supported States (0x08|0x001c) ncmd 1
        Status: Success (0x00)
        States: 0x000003ff3e0306ff
          Non-connectable Advertising State
          Scannable Advertising State
          Connectable Advertising State
          High Duty Cycle Directed Advertising State
          Passive Scanning State
          Active Scanning State
          Initiating State
            and Connection State (Central Role)
          Connection State (Peripheral Role)
          Scannable Advertising State
            and Passive Scanning State
          Connectable Advertising State
            and Passive Scanning State
          Non-connectable Advertising State
            and Initiating State
          Scannable Advertising State
            and Initiating State
          Active Scanning State
            and Connection State (Central Role)
          Passive Scanning State
            and Connection State (Peripheral Role)
          Active Scanning State
            and Connection State (Peripheral Role)
          Initiating State
            and Connection State (Central Role)
            and Central Role & Central Role
          Low Duty Cycle Directed Advertising State
          Connectable Advertising State
            and Initiating State
            and Central Role & Peripheral Role
          High Duty Cycle Directed Advertising State
            and Initiating State
            and Central Role & Peripheral Role
          Low Duty Cycle Directed Advertising State
            and Initiating State
            and Central Role & Peripheral Role
          Connectable Advertising State
            and Connection State (Central Role)
            and Central Role & Peripheral Role
          High Duty Cycle Directed Advertising State
            and Connection State (Central Role)
            and Central Role & Peripheral Role
          Low Duty Cycle Directed Advertising State
            and Connection State (Central Role)
            and Central Role & Peripheral Role
          Connectable Advertising State
            and Connection State (Peripheral Role)
            and Central Role & Peripheral Role
          High Duty Cycle Directed Advertising State
            and Connection State (Peripheral Role)
            and Peripheral Role & Peripheral Role
          Low Duty Cycle Directed Advertising State
            and Connection State (Peripheral Role)
            and Peripheral Role & Peripheral Role
          Initiating State
            and Connection State (Peripheral Role)
            and Central Role & Peripheral Role
< HCI Command: LE Read Maximum Data.. (0x08|0x002f) plen 0  #23 [hci1] 1.337931
> HCI Event: Command Complete (0x0e) plen 12                #24 [hci1] 1.338353
      LE Read Maximum Data Length (0x08|0x002f) ncmd 1
        Status: Success (0x00)
        Max TX octets: 251
        Max TX time: 2704
        Max RX octets: 251
        Max RX time: 2704
< HCI Command: LE Write Suggested D.. (0x08|0x0024) plen 4  #25 [hci1] 1.357926
        TX octets: 251
        TX time: 2704
> HCI Event: Command Complete (0x0e) plen 4                 #26 [hci1] 1.358332
      LE Write Suggested Default Data Length (0x08|0x0024) ncmd 1
        Status: Success (0x00)
< HCI Command: LE Read Resolving Li.. (0x08|0x002a) plen 0  #27 [hci1] 1.377929
> HCI Event: Command Complete (0x0e) plen 5                 #28 [hci1] 1.378323
      LE Read Resolving List Size (0x08|0x002a) ncmd 1
        Status: Success (0x00)
        Size: 8
< HCI Command: LE Set Host Feature (0x08|0x0074) plen 2     #29 [hci1] 1.397918
        Bit Number: 38
          Connection Subrating (Host Support)
        Bit Value: 1
> HCI Event: Command Complete (0x0e) plen 4                 #30 [hci1] 1.398342
      LE Set Host Feature (0x08|0x0074) ncmd 1
        Status: Success (0x00)
< HCI Command: LE Set Event Mask (0x08|0x0001) plen 8       #31 [hci1] 1.417874
        Mask: 0x000002063f87fa5e
          LE Advertising Report
          LE Connection Update Complete
          LE Read Remote Used Features Complete
          LE Long Term Key Request
          LE Data Length Change
          LE Enhanced Connection Complete
          LE PHY Update Complete
          LE Extended Advertising Report
          LE Periodic Advertising Sync Established
          LE Periodic Advertising Report
          LE Periodic Advertising Sync Lost
          LE Extended Scan Timeout
          LE Extended Advertising Set Terminated
          LE Scan Request Received
          LE Periodic Advertising Sync Transfer Rvc
          LE CIS Established
          LE CIS Request
          LE Create BIG Complete
          LE Terminate BIG Complete
          LE BIG Sync Estabilished Complete
          LE BIG Sync Lost
          LE BIG Info Advertising Report
          LE Subrate Change
          Unknown mask (0x0000020000000000)
> HCI Event: Command Complete (0x0e) plen 4                 #32 [hci1] 1.418380
      LE Set Event Mask (0x08|0x0001) ncmd 1
        Status: Success (0x00)
< HCI Command: Set Event Mask (0x03|0x0001) plen 8          #33 [hci1] 1.437921
        Mask: 0x2000800002008890
          Disconnection Complete
          Encryption Change
          Read Remote Version Information Complete
          Hardware Error
          Data Buffer Overflow
          Encryption Key Refresh Complete
          LE Meta
> HCI Event: Command Complete (0x0e) plen 4                 #34 [hci1] 1.438504
      Set Event Mask (0x03|0x0001) ncmd 1
        Status: Success (0x00)
< HCI Command: Read BD ADDR (0x04|0x0009) plen 0            #35 [hci1] 1.457934
> HCI Event: Command Complete (0x0e) plen 10                #36 [hci1] 1.458448
      Read BD ADDR (0x04|0x0009) ncmd 1
        Status: Success (0x00)
        Address: 00:00:00:00:00:00 (OUI 00-00-00)
< HCI Command: LE Set Random Address (0x08|0x0005) plen 6   #37 [hci1] 1.477934
        Address: D5:B6:CC:31:DB:3B (Static)
> HCI Event: Command Complete (0x0e) plen 4                 #38 [hci1] 1.478341
      LE Set Random Address (0x08|0x0005) ncmd 1
        Status: Success (0x00)
< HCI Command: LE Set Extended Adv.. (0x08|0x0036) plen 25  #39 [hci1] 3.918328
        Handle: 0x00
        Properties: 0x0013
          Connectable
          Scannable
          Use legacy advertising PDUs: ADV_IND
        Min advertising interval: 100.000 msec (0x00a0)
        Max advertising interval: 150.000 msec (0x00f0)
        Channel map: 37, 38, 39 (0x07)
        Own address type: Random (0x01)
        Peer address type: Public (0x00)
        Peer address: 00:00:00:00:00:00 (OUI 00-00-00)
        Filter policy: Allow Scan Request from Any, Allow Connect Request from Any (0x00)
        TX power: Host has no preference (0x7f)
        Primary PHY: LE 1M (0x01)
        Secondary max skip: 0x00
        Secondary PHY: LE 1M (0x01)
        SID: 0x00
        Scan request notifications: Disabled (0x00)
> HCI Event: Command Complete (0x0e) plen 5                 #40 [hci1] 3.919200
      LE Set Extended Advertising Parameters (0x08|0x0036) ncmd 1
        Status: Success (0x00)
        TX power (selected): 0 dbm (0x00)
< HCI Command: LE Set Advertising S.. (0x08|0x0035) plen 7  #41 [hci1] 3.938151
        Advertising handle: 0x00
        Advertising random address: D5:B6:CC:31:DB:3B (Static)
> HCI Event: Command Complete (0x0e) plen 4                 #42 [hci1] 3.938663
      LE Set Advertising Set Random Address (0x08|0x0035) ncmd 1
        Status: Success (0x00)
< HCI Command: LE Set Extended Adv.. (0x08|0x0037) plen 22  #43 [hci1] 3.957980
        Handle: 0x00
        Operation: Complete extended advertising data (0x03)
        Fragment preference: Minimize fragmentation (0x01)
        Data length: 0x12
        Flags: 0x06
          LE General Discoverable Mode
          BR/EDR Not Supported
        Name (complete): Tester_F6B11A
> HCI Event: Command Complete (0x0e) plen 4                 #44 [hci1] 3.958642
      LE Set Extended Advertising Data (0x08|0x0037) ncmd 1
        Status: Success (0x00)
< HCI Command: LE Set Extended Scan.. (0x08|0x0038) plen 4  #45 [hci1] 3.977999
        Handle: 0x00
        Operation: Complete scan response data (0x03)
        Fragment preference: Minimize fragmentation (0x01)
        Data length: 0x00
> HCI Event: Command Complete (0x0e) plen 4                 #46 [hci1] 3.978500
      LE Set Extended Scan Response Data (0x08|0x0038) ncmd 1
        Status: Success (0x00)
< HCI Command: LE Set Extended Adve.. (0x08|0x0039) plen 6  #47 [hci1] 3.997976
        Extended advertising: Enabled (0x01)
        Number of sets: 1 (0x01)
        Entry 0
          Handle: 0x00
          Duration: 0 ms (0x00)
          Max ext adv events: 0
> HCI Event: Command Complete (0x0e) plen 4                 #48 [hci1] 3.998542
      LE Set Extended Advertising Enable (0x08|0x0039) ncmd 1
        Status: Success (0x00)
> HCI Event: LE Meta Event (0x3e) plen 31                   #49 [hci1] 4.111474
      LE Enhanced Connection Complete (0x0a)
        Status: Success (0x00)
        Handle: 1263
        Role: Peripheral (0x01)
        Peer address type: Public (0x00)
        Peer address: DF:A9:FF:F6:B1:1A (OUI DF-A9-FF)
        Local resolvable private address: 00:00:00:00:00:00 (Non-Resolvable)
        Peer resolvable private address: 00:00:00:00:00:00 (Non-Resolvable)
        Connection interval: 150.00 msec (0x0078)
        Connection latency: 0 (0x0000)
        Supervision timeout: 25120 msec (0x09d0)
        Central clock accuracy: 0x01
> HCI Event: LE Meta Event (0x3e) plen 6                    #50 [hci1] 4.111680
      LE Advertising Set Terminated (0x12)
        Status: Success (0x00)
        Handle: 0
        Connection handle: 1263
        Number of completed extended advertising events: 0
< HCI Command: LE Read Remote Used... (0x08|0x0016) plen 2  #51 [hci1] 4.118405
        Handle: 1263 Address: DF:A9:FF:F6:B1:1A (OUI DF-A9-FF)
< ACL Data TX: Handle 1263 flags 0x00 dlen 7                #52 [hci1] 4.118417
      ATT: Exchange MTU Request (0x02) len 2
        Client RX MTU: 251
> HCI Event: Command Status (0x0f) plen 4                   #53 [hci1] 4.118941
      LE Read Remote Used Features (0x08|0x0016) ncmd 1
        Status: Success (0x00)
> HCI Event: Number of Completed Packets (0x13) plen 5      #54 [hci1] 4.412565
        Num handles: 1
        Handle: 1263 Address: DF:A9:FF:F6:B1:1A (OUI DF-A9-FF)
        Count: 1
        #52: len 7 (0 Kb/s)
        Latency: 294 msec (294-294 msec ~294 msec)
> HCI Event: LE Meta Event (0x3e) plen 12                   #55 [hci1] 4.562840
      LE Read Remote Used Features (0x04)
        Status: Success (0x00)
        Handle: 1263 Address: DF:A9:FF:F6:B1:1A (OUI DF-A9-FF)
        Features: 0x2d 0x49 0x00 0xf7 0x67 0xd9 0x00 0x80
          LE Encryption
          Extended Reject Indication
          Peripheral-initiated Features Exchange
          LE Data Packet Length Extension
          LE 2M PHY
          LE Coded PHY
          Channel Selection Algorithm #2
          Periodic Advertising Sync Transfer - Sender
          Periodic Advertising Sync Transfer - Recipient
          Sleep Clock Accuracy Updates
          Connected Isochronous Stream - Central
          Connected Isochronous Stream - Peripheral
          Isochronous Broadcaster
          Synchronized Receiver
          Connected Isochronous Stream (Host Support)
          LE Power Control Request
          LE Power Control Request
          Connection Subrating
          Connection Subrating (Host Support)
          Unknown features (0x8000d90000000000)
> ACL Data RX: Handle 1263 flags 0x02 dlen 7                #56 [hci1] 5.312602
      ATT: Exchange MTU Request (0x02) len 2
        Client RX MTU: 49
> ACL Data RX: Handle 1263 flags 0x02 dlen 7                #57 [hci1] 5.313131
      ATT: Exchange MTU Response (0x03) len 2
        Server RX MTU: 49
< HCI Command: Host Number of Compl.. (0x03|0x0035) plen 5  #58 [hci1] 5.318165
        Num handles: 1
        Handle: 1263 Address: DF:A9:FF:F6:B1:1A (OUI DF-A9-FF)
        Count: 1
< ACL Data TX: Handle 1263 flags 0x00 dlen 7                #59 [hci1] 5.318235
      ATT: Exchange MTU Response (0x03) len 2
        Server RX MTU: 251
< HCI Command: Host Number of Compl.. (0x03|0x0035) plen 5  #60 [hci1] 5.318366
        Num handles: 1
        Handle: 1263 Address: DF:A9:FF:F6:B1:1A (OUI DF-A9-FF)
        Count: 1
> HCI Event: Number of Completed Packets (0x13) plen 5      #61 [hci1] 5.612570
        Num handles: 1
        Handle: 1263 Address: DF:A9:FF:F6:B1:1A (OUI DF-A9-FF)
        Count: 1
        #59: len 7 (0 Kb/s)
        Latency: 294 msec (294-294 msec ~294 msec)
> ACL Data RX: Handle 1263 flags 0x02 dlen 11               #62 [hci1] 7.562717
      SMP: Pairing Request (0x01) len 6
        IO capability: KeyboardDisplay (0x04)
        OOB data: Authentication data not present (0x00)
        Authentication requirement: Bonding, No MITM, SC, No Keypresses (0x09)
        Max encryption key size: 16
        Initiator key distribution: EncKey IdKey Sign (0x07)
        Responder key distribution: EncKey IdKey Sign (0x07)
< HCI Command: Host Number of Compl.. (0x03|0x0035) plen 5  #63 [hci1] 7.578406
        Num handles: 1
        Handle: 1263 Address: DF:A9:FF:F6:B1:1A (OUI DF-A9-FF)
        Count: 1
< ACL Data TX: Handle 1263 flags 0x00 dlen 11               #64 [hci1] 7.578485
      SMP: Pairing Response (0x02) len 6
        IO capability: NoInputNoOutput (0x03)
        OOB data: Authentication data not present (0x00)
        Authentication requirement: Bonding, No MITM, SC, No Keypresses (0x09)
        Max encryption key size: 16
        Initiator key distribution: IdKey (0x02)
        Responder key distribution: <none> (0x00)
> HCI Event: Number of Completed Packets (0x13) plen 5      #65 [hci1] 7.862783
        Num handles: 1
        Handle: 1263 Address: DF:A9:FF:F6:B1:1A (OUI DF-A9-FF)
        Count: 1
        #64: len 11 (0 Kb/s)
        Latency: 284 msec (284-294 msec ~289 msec)
> ACL Data RX: Handle 1263 flags 0x02 dlen 27               #66 [hci1] 7.863050
> ACL Data RX: Handle 1263 flags 0x01 dlen 27               #67 [hci1] 7.863673
> ACL Data RX: Handle 1263 flags 0x01 dlen 15               #68 [hci1] 7.864005
      SMP: Pairing Public Key (0x0c) len 64
        X: a557b67564b6c5f81f1aa3d352ce06270ec53003a91791b0ad472cf147e2e186
        Y: b98840b827d6d0a486827eb157baaf96b3676838ba221080be490880f15390a3
< HCI Command: Host Number of Compl.. (0x03|0x0035) plen 5  #69 [hci1] 7.878711
        Num handles: 1
        Handle: 1263 Address: DF:A9:FF:F6:B1:1A (OUI DF-A9-FF)
        Count: 1
< HCI Command: Host Number of Compl.. (0x03|0x0035) plen 5  #70 [hci1] 7.878796
        Num handles: 1
        Handle: 1263 Address: DF:A9:FF:F6:B1:1A (OUI DF-A9-FF)
        Count: 1
< HCI Command: Host Number of Compl.. (0x03|0x0035) plen 5  #71 [hci1] 7.879144
        Num handles: 1
        Handle: 1263 Address: DF:A9:FF:F6:B1:1A (OUI DF-A9-FF)
        Count: 1
< ACL Data TX: Handle 1263 flags 0x00 dlen 27               #72 [hci1] 7.879613
< ACL Data TX: Handle 1263 flags 0x01 dlen 27               #73 [hci1] 7.879634
< ACL Data TX: Handle 1263 flags 0x01 dlen 15               #74 [hci1] 7.879637
      SMP: Pairing Public Key (0x0c) len 64
        X: 98308440221e2d910f0e54b71e7ec652857aa9b5a0dc65028824cc19db1226e9
        Y: 67a4816bcb62efb21701e31fdb27561a6217575fb007a8bbdabe7e28b6f68482
> HCI Event: Number of Completed Packets (0x13) plen 5      #75 [hci1] 8.013113
        Num handles: 1
        Handle: 1263 Address: DF:A9:FF:F6:B1:1A (OUI DF-A9-FF)
        Count: 1
        #72: len 27 (1 Kb/s)
        Latency: 133 msec (133-294 msec ~211 msec)
> HCI Event: Number of Completed Packets (0x13) plen 5      #76 [hci1] 8.013749
        Num handles: 1
        Handle: 1263 Address: DF:A9:FF:F6:B1:1A (OUI DF-A9-FF)
        Count: 1
        #73: len 27 (1 Kb/s)
        Latency: 134 msec (133-294 msec ~172 msec)
< ACL Data TX: Handle 1263 flags 0x00 dlen 21               #77 [hci1] 8.018351
      SMP: Pairing Confirm (0x03) len 16
        Confim value: ccd0b2708745348cfee4346e6bd11335
> HCI Event: Number of Completed Packets (0x13) plen 5      #78 [hci1] 8.162457
        Num handles: 1
        Handle: 1263 Address: DF:A9:FF:F6:B1:1A (OUI DF-A9-FF)
        Count: 1
        #74: len 15 (0 Kb/s)
        Latency: 282 msec (133-294 msec ~227 msec)
> HCI Event: Number of Completed Packets (0x13) plen 5      #79 [hci1] 8.312713
        Num handles: 1
        Handle: 1263 Address: DF:A9:FF:F6:B1:1A (OUI DF-A9-FF)
        Count: 1
        #77: len 21 (0 Kb/s)
        Latency: 294 msec (133-294 msec ~261 msec)
> ACL Data RX: Handle 1263 flags 0x02 dlen 21               #80 [hci1] 8.312949
      SMP: Pairing Random (0x04) len 16
        Random value: 9e9fc19d8e3e30d90000000000000000
< HCI Command: Host Number of Compl.. (0x03|0x0035) plen 5  #81 [hci1] 8.318109
        Num handles: 1
        Handle: 1263 Address: DF:A9:FF:F6:B1:1A (OUI DF-A9-FF)
        Count: 1
< ACL Data TX: Handle 1263 flags 0x00 dlen 21               #82 [hci1] 8.318137
      SMP: Pairing Random (0x04) len 16
        Random value: 8e6108f966a694cbe26df70bb96773e6
> HCI Event: Number of Completed Packets (0x13) plen 5      #83 [hci1] 8.612409
        Num handles: 1
        Handle: 1263 Address: DF:A9:FF:F6:B1:1A (OUI DF-A9-FF)
        Count: 1
        #82: len 21 (0 Kb/s)
        Latency: 294 msec (133-294 msec ~277 msec)
> ACL Data RX: Handle 1263 flags 0x02 dlen 21               #84 [hci1] 8.762881
      SMP: Pairing DHKey Check (0x0d) len 16
        E: 4ab740217d74ff3d9b49ad3cf3903c09
< HCI Command: Host Number of Compl.. (0x03|0x0035) plen 5  #85 [hci1] 8.778504
        Num handles: 1
        Handle: 1263 Address: DF:A9:FF:F6:B1:1A (OUI DF-A9-FF)
        Count: 1
< ACL Data TX: Handle 1263 flags 0x00 dlen 21               #86 [hci1] 8.778588
      SMP: Pairing DHKey Check (0x0d) len 16
        E: bc68c2389574d8765226320c8f390449
> HCI Event: Number of Completed Packets (0x13) plen 5      #87 [hci1] 9.062442
        Num handles: 1
        Handle: 1263 Address: DF:A9:FF:F6:B1:1A (OUI DF-A9-FF)
        Count: 1
        #86: len 21 (0 Kb/s)
        Latency: 283 msec (133-294 msec ~280 msec)
> HCI Event: LE Meta Event (0x3e) plen 13                   #88 [hci1] 9.213018
      LE Long Term Key Request (0x05)
        Handle: 1263 Address: DF:A9:FF:F6:B1:1A (OUI DF-A9-FF)
        Random number: 0x0000000000000000
        Encrypted diversifier: 0x0000
< HCI Command: LE Long Term Key Re.. (0x08|0x001a) plen 18  #89 [hci1] 9.218011
        Handle: 1263 Address: DF:A9:FF:F6:B1:1A (OUI DF-A9-FF)
        Long term key: 528fda73b59dba7dd06ab0b5d83e30eb
> HCI Event: Command Complete (0x0e) plen 6                 #90 [hci1] 9.218737
      LE Long Term Key Request Reply (0x08|0x001a) ncmd 1
        Status: Success (0x00)
        Handle: 1263 Address: DF:A9:FF:F6:B1:1A (OUI DF-A9-FF)
> HCI Event: Encryption Change (0x08) plen 4                #91 [hci1] 9.962719
        Status: Success (0x00)
        Handle: 1263 Address: DF:A9:FF:F6:B1:1A (OUI DF-A9-FF)
        Encryption: Enabled with AES-CCM (0x01)
< ACL Data TX: Handle 1263 flags 0x00 dlen 11              #92 [hci1] 10.088764
      ATT: Read By Type Request (0x08) len 6
        Handle range: 0x0001-0xffff
        Attribute type: Central Address Resolution (0x2aa6)
> ACL Data RX: Handle 1263 flags 0x02 dlen 21              #93 [hci1] 10.112816
      SMP: Identity Information (0x08) len 16
        Identity resolving key: d518df8a790d99caadce7bf6f1ee9965
< HCI Command: Host Number of Comp.. (0x03|0x0035) plen 5  #94 [hci1] 10.118086
        Num handles: 1
        Handle: 1263 Address: DF:A9:FF:F6:B1:1A (OUI DF-A9-FF)
        Count: 1
> HCI Event: Number of Completed Packets (0x13) plen 5     #95 [hci1] 10.262538
        Num handles: 1
        Handle: 1263 Address: DF:A9:FF:F6:B1:1A (OUI DF-A9-FF)
        Count: 1
        #92: len 11 (0 Kb/s)
        Latency: 173 msec (133-294 msec ~227 msec)
> ACL Data RX: Handle 1263 flags 0x02 dlen 12              #96 [hci1] 10.412679
      SMP: Identity Address Information (0x09) len 7
        Address: DF:A9:FF:F6:B1:1A (OUI DF-A9-FF)
< HCI Command: LE Add Device To R.. (0x08|0x0027) plen 39  #97 [hci1] 10.418492
        Address type: Public (0x00)
        Address: DF:A9:FF:F6:B1:1A (OUI DF-A9-FF)
        Peer identity resolving key: d518df8a790d99caadce7bf6f1ee9965
        Local identity resolving key: 00000000000000000000000000000000
> HCI Event: Command Complete (0x0e) plen 4                #98 [hci1] 10.419450
      LE Add Device To Resolving List (0x08|0x0027) ncmd 1
        Status: Success (0x00)
< HCI Command: LE Set Privacy Mode (0x08|0x004e) plen 8    #99 [hci1] 10.438374
        Peer Identity address type: Public (0x00)
        Peer Identity address: DF:A9:FF:F6:B1:1A (OUI DF-A9-FF)
        Privacy Mode: Use Device Privacy (0x01)
> HCI Event: Command Complete (0x0e) plen 4               #100 [hci1] 10.438993
      LE Set Privacy Mode (0x08|0x004e) ncmd 1
        Status: Success (0x00)
< HCI Command: LE Set Address Res.. (0x08|0x002d) plen 1  #101 [hci1] 10.458372
        Address resolution: Enabled (0x01)
> HCI Event: Command Complete (0x0e) plen 4               #102 [hci1] 10.458874
      LE Set Address Resolution Enable (0x08|0x002d) ncmd 1
        Status: Success (0x00)
< HCI Command: Host Number of Com.. (0x03|0x0035) plen 5  #103 [hci1] 10.478276
        Num handles: 1
        Handle: 1263 Address: DF:A9:FF:F6:B1:1A (OUI DF-A9-FF)
        Count: 1
> ACL Data RX: Handle 1263 flags 0x02 dlen 13             #104 [hci1] 10.562784
      ATT: Find By Type Value Request (0x06) len 8
        Handle range: 0x0001-0xffff
        Attribute type: Primary Service (0x2800)
          UUID: Hearing Aid (0x1854)
< HCI Command: Host Number of Com.. (0x03|0x0035) plen 5  #105 [hci1] 10.578550
        Num handles: 1
        Handle: 1263 Address: DF:A9:FF:F6:B1:1A (OUI DF-A9-FF)
        Count: 1
< ACL Data TX: Handle 1263 flags 0x00 dlen 9              #106 [hci1] 10.578660
      ATT: Find By Type Value Response (0x07) len 4
        Handle range: 0x002a-0x0032
> ACL Data RX: Handle 1263 flags 0x02 dlen 9              #107 [hci1] 10.712642
      ATT: Read By Type Response (0x09) len 4
        Attribute data length: 3
        Attribute data list: 1 entry
        Handle: 0x000f
        Value: 01
< HCI Command: Host Number of Com.. (0x03|0x0035) plen 5  #108 [hci1] 10.718323
        Num handles: 1
        Handle: 1263 Address: DF:A9:FF:F6:B1:1A (OUI DF-A9-FF)
        Count: 1
> HCI Event: Number of Completed Packets (0x13) plen 5    #109 [hci1] 10.862642
        Num handles: 1
        Handle: 1263 Address: DF:A9:FF:F6:B1:1A (OUI DF-A9-FF)
        Count: 1
        #106: len 9 (0 Kb/s)
        Latency: 283 msec (133-294 msec ~255 msec)
> ACL Data RX: Handle 1263 flags 0x02 dlen 13             #110 [hci1] 10.862901
      ATT: Find By Type Value Request (0x06) len 8
        Handle range: 0x0033-0xffff
        Attribute type: Primary Service (0x2800)
          UUID: Hearing Aid (0x1854)
< HCI Command: Host Number of Com.. (0x03|0x0035) plen 5  #111 [hci1] 10.878227
        Num handles: 1
        Handle: 1263 Address: DF:A9:FF:F6:B1:1A (OUI DF-A9-FF)
        Count: 1
< ACL Data TX: Handle 1263 flags 0x00 dlen 9              #112 [hci1] 10.878341
      ATT: Error Response (0x01) len 4
        Find By Type Value Request (0x06)
        Handle: 0x0033
        Error: Attribute Not Found (0x0a)
> HCI Event: Number of Completed Packets (0x13) plen 5    #113 [hci1] 11.162580
        Num handles: 1
        Handle: 1263 Address: DF:A9:FF:F6:B1:1A (OUI DF-A9-FF)
        Count: 1
        #112: len 9 (0 Kb/s)
        Latency: 284 msec (133-294 msec ~269 msec)
> ACL Data RX: Handle 1263 flags 0x02 dlen 11             #114 [hci1] 11.163240
      ATT: Read By Type Request (0x08) len 6
        Handle range: 0x002a-0x0032
        Attribute type: Characteristic (0x2803)
< HCI Command: Host Number of Com.. (0x03|0x0035) plen 5  #115 [hci1] 11.178449
        Num handles: 1
        Handle: 1263 Address: DF:A9:FF:F6:B1:1A (OUI DF-A9-FF)
        Count: 1
< ACL Data TX: Handle 1263 flags 0x00 dlen 27             #116 [hci1] 11.178460
      ATT: Read By Type Response (0x09) len 22
        Attribute data length: 7
        Attribute data list: 3 entries
        Handle: 0x002b
        Value: 022c00da2b
            Properties: 0x02
              Read (0x02)
            Value Handle: 0x002c
            Value UUID: Hearing Aid Features (0x2bda)
        Handle: 0x002d
        Value: 282e00db2b
            Properties: 0x28
              Write (0x08)
              Indicate (0x20)
            Value Handle: 0x002e
            Value UUID: Hearing Aid Preset Control Point (0x2bdb)
        Handle: 0x0030
        Value: 123100dc2b
            Properties: 0x12
              Read (0x02)
              Notify (0x10)
            Value Handle: 0x0031
            Value UUID: Active Preset Index (0x2bdc)
> HCI Event: Number of Completed Packets (0x13) plen 5    #117 [hci1] 11.462507
        Num handles: 1
        Handle: 1263 Address: DF:A9:FF:F6:B1:1A (OUI DF-A9-FF)
        Count: 1
        #116: len 27 (0 Kb/s)
        Latency: 284 msec (133-294 msec ~276 msec)
> ACL Data RX: Handle 1263 flags 0x02 dlen 11             #118 [hci1] 11.462827
      ATT: Read By Type Request (0x08) len 6
        Handle range: 0x0031-0x0032
        Attribute type: Characteristic (0x2803)
< HCI Command: Host Number of Com.. (0x03|0x0035) plen 5  #119 [hci1] 11.478473
        Num handles: 1
        Handle: 1263 Address: DF:A9:FF:F6:B1:1A (OUI DF-A9-FF)
        Count: 1
< ACL Data TX: Handle 1263 flags 0x00 dlen 9              #120 [hci1] 11.478738
      ATT: Error Response (0x01) len 4
        Read By Type Request (0x08)
        Handle: 0x0031
        Error: Attribute Not Found (0x0a)
> HCI Event: Number of Completed Packets (0x13) plen 5    #121 [hci1] 11.762533
        Num handles: 1
        Handle: 1263 Address: DF:A9:FF:F6:B1:1A (OUI DF-A9-FF)
        Count: 1
        #120: len 9 (0 Kb/s)
        Latency: 283 msec (133-294 msec ~280 msec)
> ACL Data RX: Handle 1263 flags 0x02 dlen 9              #122 [hci1] 11.762718
      ATT: Find Information Request (0x04) len 4
        Handle range: 0x002f-0x002f
< HCI Command: Host Number of Com.. (0x03|0x0035) plen 5  #123 [hci1] 11.778306
        Num handles: 1
        Handle: 1263 Address: DF:A9:FF:F6:B1:1A (OUI DF-A9-FF)
        Count: 1
< ACL Data TX: Handle 1263 flags 0x00 dlen 10             #124 [hci1] 11.778352
      ATT: Find Information Response (0x05) len 5
        Format: UUID-16 (0x01)
        Handle: 0x002f
        UUID: Client Characteristic Configuration (0x2902)
> HCI Event: Number of Completed Packets (0x13) plen 5    #125 [hci1] 12.062525
        Num handles: 1
        Handle: 1263 Address: DF:A9:FF:F6:B1:1A (OUI DF-A9-FF)
        Count: 1
        #124: len 10 (0 Kb/s)
        Latency: 284 msec (133-294 msec ~282 msec)
> ACL Data RX: Handle 1263 flags 0x02 dlen 9              #126 [hci1] 12.062806
      ATT: Find Information Request (0x04) len 4
        Handle range: 0x0032-0x0032
< HCI Command: Host Number of Com.. (0x03|0x0035) plen 5  #127 [hci1] 12.078314
        Num handles: 1
        Handle: 1263 Address: DF:A9:FF:F6:B1:1A (OUI DF-A9-FF)
        Count: 1
< ACL Data TX: Handle 1263 flags 0x00 dlen 10             #128 [hci1] 12.078373
      ATT: Find Information Response (0x05) len 5
        Format: UUID-16 (0x01)
        Handle: 0x0032
        UUID: Client Characteristic Configuration (0x2902)
> HCI Event: Number of Completed Packets (0x13) plen 5    #129 [hci1] 12.362672
        Num handles: 1
        Handle: 1263 Address: DF:A9:FF:F6:B1:1A (OUI DF-A9-FF)
        Count: 1
        #128: len 10 (0 Kb/s)
        Latency: 284 msec (133-294 msec ~283 msec)
> ACL Data RX: Handle 1263 flags 0x02 dlen 9              #130 [hci1] 12.362762
      ATT: Write Request (0x12) len 4
        Handle: 0x002f
          Data: 0000
< HCI Command: Host Number of Com.. (0x03|0x0035) plen 5  #131 [hci1] 12.378303
        Num handles: 1
        Handle: 1263 Address: DF:A9:FF:F6:B1:1A (OUI DF-A9-FF)
        Count: 1
< ACL Data TX: Handle 1263 flags 0x00 dlen 5              #132 [hci1] 12.378369
      ATT: Write Response (0x13) len 0
> HCI Event: Number of Completed Packets (0x13) plen 5    #133 [hci1] 12.662496
        Num handles: 1
        Handle: 1263 Address: DF:A9:FF:F6:B1:1A (OUI DF-A9-FF)
        Count: 1
        #132: len 5 (0 Kb/s)
        Latency: 284 msec (133-294 msec ~283 msec)
> ACL Data RX: Handle 1263 flags 0x02 dlen 9              #134 [hci1] 12.662679
      ATT: Write Request (0x12) len 4
        Handle: 0x002f
          Data: 0200
< HCI Command: Host Number of Com.. (0x03|0x0035) plen 5  #135 [hci1] 12.678703
        Num handles: 1
        Handle: 1263 Address: DF:A9:FF:F6:B1:1A (OUI DF-A9-FF)
        Count: 1
< ACL Data TX: Handle 1263 flags 0x00 dlen 5              #136 [hci1] 12.678769
      ATT: Write Response (0x13) len 0
> HCI Event: Number of Completed Packets (0x13) plen 5    #137 [hci1] 12.962600
        Num handles: 1
        Handle: 1263 Address: DF:A9:FF:F6:B1:1A (OUI DF-A9-FF)
        Count: 1
        #136: len 5 (0 Kb/s)
        Latency: 283 msec (133-294 msec ~283 msec)
> ACL Data RX: Handle 1263 flags 0x02 dlen 9              #138 [hci1] 12.962687
      ATT: Write Request (0x12) len 4
        Handle: 0x0032
          Data: 0000
< HCI Command: Host Number of Com.. (0x03|0x0035) plen 5  #139 [hci1] 12.978125
        Num handles: 1
        Handle: 1263 Address: DF:A9:FF:F6:B1:1A (OUI DF-A9-FF)
        Count: 1
< ACL Data TX: Handle 1263 flags 0x00 dlen 5              #140 [hci1] 12.978132
      ATT: Write Response (0x13) len 0
> HCI Event: Number of Completed Packets (0x13) plen 5    #141 [hci1] 13.262547
        Num handles: 1
        Handle: 1263 Address: DF:A9:FF:F6:B1:1A (OUI DF-A9-FF)
        Count: 1
        #140: len 5 (0 Kb/s)
        Latency: 284 msec (133-294 msec ~284 msec)
> ACL Data RX: Handle 1263 flags 0x02 dlen 9              #142 [hci1] 13.262722
      ATT: Write Request (0x12) len 4
        Handle: 0x0032
          Data: 0100
< HCI Command: Host Number of Com.. (0x03|0x0035) plen 5  #143 [hci1] 13.278810
        Num handles: 1
        Handle: 1263 Address: DF:A9:FF:F6:B1:1A (OUI DF-A9-FF)
        Count: 1
< ACL Data TX: Handle 1263 flags 0x00 dlen 5              #144 [hci1] 13.278907
      ATT: Write Response (0x13) len 0
> HCI Event: Number of Completed Packets (0x13) plen 5    #145 [hci1] 13.562486
        Num handles: 1
        Handle: 1263 Address: DF:A9:FF:F6:B1:1A (OUI DF-A9-FF)
        Count: 1
        #144: len 5 (0 Kb/s)
        Latency: 283 msec (133-294 msec ~283 msec)
> ACL Data RX: Handle 1263 flags 0x02 dlen 7              #146 [hci1] 13.562660
      ATT: Read Request (0x0a) len 2
        Handle: 0x002c
< HCI Command: Host Number of Com.. (0x03|0x0035) plen 5  #147 [hci1] 13.578282
        Num handles: 1
        Handle: 1263 Address: DF:A9:FF:F6:B1:1A (OUI DF-A9-FF)
        Count: 1
< ACL Data TX: Handle 1263 flags 0x00 dlen 6              #148 [hci1] 13.578311
      ATT: Read Response (0x0b) len 1
> HCI Event: Number of Completed Packets (0x13) plen 5    #149 [hci1] 13.862419
        Num handles: 1
        Handle: 1263 Address: DF:A9:FF:F6:B1:1A (OUI DF-A9-FF)
        Count: 1
        #148: len 6 (0 Kb/s)
        Latency: 284 msec (133-294 msec ~283 msec)
> ACL Data RX: Handle 1263 flags 0x02 dlen 10             #150 [hci1] 13.862676
      ATT: Write Request (0x12) len 5
        Handle: 0x002e
          Data: 0101ff
< HCI Command: Host Number of Com.. (0x03|0x0035) plen 5  #151 [hci1] 13.878232
        Num handles: 1
        Handle: 1263 Address: DF:A9:FF:F6:B1:1A (OUI DF-A9-FF)
        Count: 1
< ACL Data TX: Handle 1263 flags 0x00 dlen 5              #152 [hci1] 13.878309
      ATT: Write Response (0x13) len 0
< ACL Data TX: Handle 1263 flags 0x00 dlen 19             #153 [hci1] 13.878342
      ATT: Handle Value Indication (0x1d) len 14
        Handle: 0x002e
          Data: 020001035052455345545f31
> HCI Event: Number of Completed Packets (0x13) plen 5    #154 [hci1] 14.012898
        Num handles: 1
        Handle: 1263 Address: DF:A9:FF:F6:B1:1A (OUI DF-A9-FF)
        Count: 1
        #152: len 5 (0 Kb/s)
        Latency: 134 msec (133-294 msec ~209 msec)
> HCI Event: Number of Completed Packets (0x13) plen 5    #155 [hci1] 14.162567
        Num handles: 1
        Handle: 1263 Address: DF:A9:FF:F6:B1:1A (OUI DF-A9-FF)
        Count: 1
        #153: len 19 (0 Kb/s)
        Latency: 284 msec (133-294 msec ~246 msec)
> ACL Data RX: Handle 1263 flags 0x02 dlen 5              #156 [hci1] 14.162591
      ATT: Handle Value Confirmation (0x1e) len 0
< HCI Command: Host Number of Com.. (0x03|0x0035) plen 5  #157 [hci1] 14.178672
        Num handles: 1
        Handle: 1263 Address: DF:A9:FF:F6:B1:1A (OUI DF-A9-FF)
        Count: 1
< ACL Data TX: Handle 1263 flags 0x00 dlen 19             #158 [hci1] 14.178701
      ATT: Handle Value Indication (0x1d) len 14
        Handle: 0x002e
          Data: 020002035052455345545f32
> HCI Event: Number of Completed Packets (0x13) plen 5    #159 [hci1] 14.462412
        Num handles: 1
        Handle: 1263 Address: DF:A9:FF:F6:B1:1A (OUI DF-A9-FF)
        Count: 1
        #158: len 19 (0 Kb/s)
        Latency: 283 msec (133-294 msec ~265 msec)
> ACL Data RX: Handle 1263 flags 0x02 dlen 5              #160 [hci1] 14.462714
      ATT: Handle Value Confirmation (0x1e) len 0
< HCI Command: Host Number of Com.. (0x03|0x0035) plen 5  #161 [hci1] 14.478327
        Num handles: 1
        Handle: 1263 Address: DF:A9:FF:F6:B1:1A (OUI DF-A9-FF)
        Count: 1
< ACL Data TX: Handle 1263 flags 0x00 dlen 19             #162 [hci1] 14.478394
      ATT: Handle Value Indication (0x1d) len 14
        Handle: 0x002e
          Data: 020003005052455345545f33
> HCI Event: Number of Completed Packets (0x13) plen 5    #163 [hci1] 14.762480
        Num handles: 1
        Handle: 1263 Address: DF:A9:FF:F6:B1:1A (OUI DF-A9-FF)
        Count: 1
        #162: len 19 (0 Kb/s)
        Latency: 284 msec (133-294 msec ~274 msec)
> ACL Data RX: Handle 1263 flags 0x02 dlen 5              #164 [hci1] 14.762685
      ATT: Handle Value Confirmation (0x1e) len 0
< HCI Command: Host Number of Com.. (0x03|0x0035) plen 5  #165 [hci1] 14.778836
        Num handles: 1
        Handle: 1263 Address: DF:A9:FF:F6:B1:1A (OUI DF-A9-FF)
        Count: 1
< ACL Data TX: Handle 1263 flags 0x00 dlen 19             #166 [hci1] 14.778941
      ATT: Handle Value Indication (0x1d) len 14
        Handle: 0x002e
          Data: 020104025052455345545f34
> HCI Event: Number of Completed Packets (0x13) plen 5    #167 [hci1] 15.062529
        Num handles: 1
        Handle: 1263 Address: DF:A9:FF:F6:B1:1A (OUI DF-A9-FF)
        Count: 1
        #166: len 19 (0 Kb/s)
        Latency: 283 msec (133-294 msec ~279 msec)
> ACL Data RX: Handle 1263 flags 0x02 dlen 5              #168 [hci1] 15.062671
      ATT: Handle Value Confirmation (0x1e) len 0
> ACL Data RX: Handle 1263 flags 0x02 dlen 10             #169 [hci1] 15.063034
      ATT: Write Request (0x12) len 5
        Handle: 0x002e
          Data: 010501
< HCI Command: Host Number of Com.. (0x03|0x0035) plen 5  #170 [hci1] 15.078261
        Num handles: 1
        Handle: 1263 Address: DF:A9:FF:F6:B1:1A (OUI DF-A9-FF)
        Count: 1
< HCI Command: Host Number of Com.. (0x03|0x0035) plen 5  #171 [hci1] 15.078361
        Num handles: 1
        Handle: 1263 Address: DF:A9:FF:F6:B1:1A (OUI DF-A9-FF)
        Count: 1
< ACL Data TX: Handle 1263 flags 0x00 dlen 9              #172 [hci1] 15.078455
      ATT: Error Response (0x01) len 4
        Write Request (0x12)
        Handle: 0x002e
        Error: Out of Range (0xff)
> HCI Event: Number of Completed Packets (0x13) plen 5    #173 [hci1] 15.362457
        Num handles: 1
        Handle: 1263 Address: DF:A9:FF:F6:B1:1A (OUI DF-A9-FF)
        Count: 1
        #172: len 9 (0 Kb/s)
        Latency: 284 msec (133-294 msec ~281 msec)
> ACL Data RX: Handle 1263 flags 0x02 dlen 10             #174 [hci1] 15.362734
      ATT: Write Request (0x12) len 5
        Handle: 0x002e
          Data: 010501
< HCI Command: Host Number of Com.. (0x03|0x0035) plen 5  #175 [hci1] 15.378394
        Num handles: 1
        Handle: 1263 Address: DF:A9:FF:F6:B1:1A (OUI DF-A9-FF)
        Count: 1
< ACL Data TX: Handle 1263 flags 0x00 dlen 9              #176 [hci1] 15.378419
      ATT: Error Response (0x01) len 4
        Write Request (0x12)
        Handle: 0x002e
        Error: Out of Range (0xff)
> HCI Event: Number of Completed Packets (0x13) plen 5    #177 [hci1] 15.662501
        Num handles: 1
        Handle: 1263 Address: DF:A9:FF:F6:B1:1A (OUI DF-A9-FF)
        Count: 1
        #176: len 9 (0 Kb/s)
        Latency: 284 msec (133-294 msec ~282 msec)
> ACL Data RX: Handle 1263 flags 0x02 dlen 10             #178 [hci1] 15.662634
      ATT: Write Request (0x12) len 5
        Handle: 0x002e
          Data: 01ff01
< HCI Command: Host Number of Com.. (0x03|0x0035) plen 5  #179 [hci1] 15.678527
        Num handles: 1
        Handle: 1263 Address: DF:A9:FF:F6:B1:1A (OUI DF-A9-FF)
        Count: 1
< ACL Data TX: Handle 1263 flags 0x00 dlen 9              #180 [hci1] 15.678571
      ATT: Error Response (0x01) len 4
        Write Request (0x12)
        Handle: 0x002e
        Error: Out of Range (0xff)
> HCI Event: Number of Completed Packets (0x13) plen 5    #181 [hci1] 15.962476
        Num handles: 1
        Handle: 1263 Address: DF:A9:FF:F6:B1:1A (OUI DF-A9-FF)
        Count: 1
        #180: len 9 (0 Kb/s)
        Latency: 283 msec (133-294 msec ~283 msec)
> ACL Data RX: Handle 1263 flags 0x02 dlen 10             #182 [hci1] 15.962665
      ATT: Write Request (0x12) len 5
        Handle: 0x002e
          Data: 01ff01
< HCI Command: Host Number of Com.. (0x03|0x0035) plen 5  #183 [hci1] 15.978319
        Num handles: 1
        Handle: 1263 Address: DF:A9:FF:F6:B1:1A (OUI DF-A9-FF)
        Count: 1
< ACL Data TX: Handle 1263 flags 0x00 dlen 9              #184 [hci1] 15.978329
      ATT: Error Response (0x01) len 4
        Write Request (0x12)
        Handle: 0x002e
        Error: Out of Range (0xff)
> HCI Event: Number of Completed Packets (0x13) plen 5    #185 [hci1] 16.262326
        Num handles: 1
        Handle: 1263 Address: DF:A9:FF:F6:B1:1A (OUI DF-A9-FF)
        Count: 1
        #184: len 9 (0 Kb/s)
        Latency: 283 msec (133-294 msec ~283 msec)
> HCI Event: Disconnect Complete (0x05) plen 4            #186 [hci1] 17.612554
        Status: Success (0x00)
        Handle: 1263 Address: DF:A9:FF:F6:B1:1A (OUI DF-A9-FF)
        Reason: Remote User Terminated Connection (0x13)
< HCI Command: Reset (0x03|0x0003) plen 0                 #187 [hci1] 23.398248
> HCI Event: Command Complete (0x0e) plen 4               #188 [hci1] 23.398763
      Reset (0x03|0x0003) ncmd 1
        Status: Success (0x00)
@ USER Close: main                                    {0x0001} [hci1] 23.418168
= Close Index: 00:00:00:00:00:00                               [hci1] 23.421478
