Bluetooth monitor ver 5.84
btmon[1469752]: = Note: Linux version 6.8.0-83-generic (x86_64)                                                          0.739356
btmon[1469752]: = Note: Bluetooth subsystem version 2.22                                                                 0.739361
= New Index: 00:00:00:00:00:00 (Primary,UART,hci0)                                                                       0.739363
= Open Index: 00:00:00:00:00:00                                                                                          1.246676
= Index Info: 00:00:00:00:00:00 (Nordic Semiconductor ASA)                                                               1.246681
zephyr.exe[1469754]: @ USER Open: main (privileged) version 2.22                                                {0x0001} 1.246683
zephyr.exe[1469754]: < HCI Command: Reset (0x03|0x0003) plen 0                                                        #1 1.246904
> HCI Event: Command Complete (0x0e) plen 4                                                                           #2 1.247660
      Reset (0x03|0x0003) ncmd 1
        Status: Success (0x00)
zephyr.exe[1469754]: < HCI Command: Read Local Supported Features (0x04|0x0003) plen 0                                #3 1.266617
> HCI Event: Command Complete (0x0e) plen 12                                                                          #4 1.267317
      Read Local Supported Features (0x04|0x0003) ncmd 1
        Status: Success (0x00)
        Features: 0x00 0x00 0x00 0x00 0x60 0x00 0x00 0x00
          BR/EDR Not Supported
          LE Supported (Controller)
zephyr.exe[1469754]: < HCI Command: Read Local Version Information (0x04|0x0001) plen 0                               #5 1.286580
> HCI Event: Command Complete (0x0e) plen 12                                                                          #6 1.287281
      Read Local Version Information (0x04|0x0001) ncmd 1
        Status: Success (0x00)
        HCI version: Reserved (0x0e) - Revision 12520 (0x30e8)
        LMP version: Reserved (0x0e) - Subversion 12520 (0x30e8)
        Manufacturer: Nordic Semiconductor ASA (89)
zephyr.exe[1469754]: < HCI Command: Read Local Supported Commands (0x04|0x0002) plen 0                                #7 1.306617
> HCI Event: Command Complete (0x0e) plen 68                                                                          #8 1.308162
      Read Local Supported Commands (0x04|0x0002) ncmd 1
        Status: Success (0x00)
        Commands: 119 entries
          Disconnect (Octet 0 - Bit 5)
          Read Remote Version Information (Octet 2 - Bit 7)
          Set Event Mask (Octet 5 - Bit 6)
          Reset (Octet 5 - Bit 7)
          Read Connection Accept Timeout (Octet 7 - Bit 2)
          Write Connection Accept Timeout (Octet 7 - Bit 3)
          Read Transmit Power Level (Octet 10 - Bit 2)
          Set Controller To Host Flow Control (Octet 10 - Bit 5)
          Host Buffer Size (Octet 10 - Bit 6)
          Host Number of Completed Packets (Octet 10 - Bit 7)
          Read Local Version Information (Octet 14 - Bit 3)
          Read Local Supported Features (Octet 14 - Bit 5)
          Read BD ADDR (Octet 15 - Bit 1)
          Read RSSI (Octet 15 - Bit 5)
          Set Event Mask Page 2 (Octet 22 - Bit 2)
          LE Set Event Mask (Octet 25 - Bit 0)
          LE Read Buffer Size (Octet 25 - Bit 1)
          LE Read Local Supported Features (Octet 25 - Bit 2)
          LE Set Random Address (Octet 25 - Bit 4)
          LE Set Advertising Parameters (Octet 25 - Bit 5)
          LE Read Advertising Channel TX Power (Octet 25 - Bit 6)
          LE Set Advertising Data (Octet 25 - Bit 7)
          LE Set Scan Response Data (Octet 26 - Bit 0)
          LE Set Advertise Enable (Octet 26 - Bit 1)
          LE Set Scan Parameters (Octet 26 - Bit 2)
          LE Set Scan Enable (Octet 26 - Bit 3)
          LE Create Connection (Octet 26 - Bit 4)
          LE Create Connection Cancel (Octet 26 - Bit 5)
          LE Read Accept List Size (Octet 26 - Bit 6)
          LE Clear Accept List (Octet 26 - Bit 7)
          LE Add Device To Accept List (Octet 27 - Bit 0)
          LE Remove Device From Accept List (Octet 27 - Bit 1)
          LE Connection Update (Octet 27 - Bit 2)
          LE Set Host Channel Classification (Octet 27 - Bit 3)
          LE Read Channel Map (Octet 27 - Bit 4)
          LE Read Remote Used Features (Octet 27 - Bit 5)
          LE Encrypt (Octet 27 - Bit 6)
          LE Rand (Octet 27 - Bit 7)
          LE Start Encryption (Octet 28 - Bit 0)
          LE Long Term Key Request Reply (Octet 28 - Bit 1)
          LE Long Term Key Request Neg Reply (Octet 28 - Bit 2)
          LE Read Supported States (Octet 28 - Bit 3)
          LE Receiver Test (Octet 28 - Bit 4)
          LE Transmitter Test (Octet 28 - Bit 5)
          LE Test End (Octet 28 - Bit 6)
          Read Authenticated Payload Timeout (Octet 32 - Bit 4)
          Write Authenticated Payload Timeout (Octet 32 - Bit 5)
          LE Set Data Length (Octet 33 - Bit 6)
          LE Read Suggested Default Data Length (Octet 33 - Bit 7)
          LE Write Suggested Default Data Length (Octet 34 - Bit 0)
          LE Add Device To Resolving List (Octet 34 - Bit 3)
          LE Remove Device From Resolving List (Octet 34 - Bit 4)
          LE Clear Resolving List (Octet 34 - Bit 5)
          LE Read Resolving List Size (Octet 34 - Bit 6)
          LE Set Address Resolution Enable (Octet 35 - Bit 1)
          LE Set Resolvable Private Address Timeout (Octet 35 - Bit 2)
          LE Read Maximum Data Length (Octet 35 - Bit 3)
          LE Read PHY (Octet 35 - Bit 4)
          LE Set Default PHY (Octet 35 - Bit 5)
          LE Set PHY (Octet 35 - Bit 6)
          LE Enhanced Receiver Test (Octet 35 - Bit 7)
          LE Enhanced Transmitter Test (Octet 36 - Bit 0)
          LE Set Advertising Set Random Address (Octet 36 - Bit 1)
          LE Set Extended Advertising Parameters (Octet 36 - Bit 2)
          LE Set Extended Advertising Data (Octet 36 - Bit 3)
          LE Set Extended Scan Response Data (Octet 36 - Bit 4)
          LE Set Extended Advertising Enable (Octet 36 - Bit 5)
          LE Read Maximum Advertising Data Length (Octet 36 - Bit 6)
          LE Read Number of Supported Advertising Sets (Octet 36 - Bit 7)
          LE Remove Advertising Set (Octet 37 - Bit 0)
          LE Clear Advertising Sets (Octet 37 - Bit 1)
          LE Set Periodic Advertising Parameters (Octet 37 - Bit 2)
          LE Set Periodic Advertising Data (Octet 37 - Bit 3)
          LE Set Periodic Advertising Enable (Octet 37 - Bit 4)
          LE Set Extended Scan Parameters (Octet 37 - Bit 5)
          LE Set Extended Scan Enable (Octet 37 - Bit 6)
          LE Extended Create Connection (Octet 37 - Bit 7)
          LE Periodic Advertising Create Sync (Octet 38 - Bit 0)
          LE Periodic Advertising Create Sync Cancel (Octet 38 - Bit 1)
          LE Periodic Advertising Terminate Sync (Octet 38 - Bit 2)
          LE Add Device To Periodic Advertiser List (Octet 38 - Bit 3)
          LE Remove Device From Periodic Advertiser List (Octet 38 - Bit 4)
          LE Clear Periodic Advertiser List (Octet 38 - Bit 5)
          LE Read Periodic Advertiser List Size (Octet 38 - Bit 6)
          LE Read Transmit Power (Octet 38 - Bit 7)
          LE Read RF Path Compensation (Octet 39 - Bit 0)
          LE Write RF Path Compensation (Octet 39 - Bit 1)
          LE Set Privacy Mode (Octet 39 - Bit 2)
          LE Periodic Advertising Receive Enable (Octet 40 - Bit 5)
          LE Periodic Advertising Sync Transfer (Octet 40 - Bit 6)
          LE Periodic Advertising Set Info Transfer (Octet 40 - Bit 7)
          LE Periodic Advertising Sync Transfer Parameters (Octet 41 - Bit 0)
          LE Set Default Periodic Advertisng Sync Transfer Parameters (Octet 41 - Bit 1)
          LE Read Buffer v2 (Octet 41 - Bit 5)
          LE Read ISO TX Sync (Octet 41 - Bit 6)
          LE Set Connected Isochronous Group Parameters (Octet 41 - Bit 7)
          LE Set Connected Isochronous Group Parameters Test (Octet 42 - Bit 0)
          LE Create Connected Isochronous Stream (Octet 42 - Bit 1)
          LE Remove Connected Isochronous Group (Octet 42 - Bit 2)
          LE Accept Connected Isochronous Stream Request (Octet 42 - Bit 3)
          LE Reject Connected Isochronous Stream Request (Octet 42 - Bit 4)
          LE Create Broadcast Isochronous Group (Octet 42 - Bit 5)
          LE Create Broadcast Isochronous Group Test (Octet 42 - Bit 6)
          LE Terminate Broadcast Isochronous Group (Octet 42 - Bit 7)
          LE Broadcast Isochronous Group Create Sync (Octet 43 - Bit 0)
          LE Broadcast Isochronous Group Terminate Sync (Octet 43 - Bit 1)
          LE Request Peer SCA (Octet 43 - Bit 2)
          LE Setup Isochronous Data Path (Octet 43 - Bit 3)
          LE Remove Isochronous Data Path (Octet 43 - Bit 4)
          LE Isochronous Transmit Test (Octet 43 - Bit 5)
          LE Isochronous Receive Test (Octet 43 - Bit 6)
          LE Isochronous Read Test Counters (Octet 43 - Bit 7)
          LE Isochronous Read Test Counters (Octet 44 - Bit 0)
          LE Set Host Feature (Octet 44 - Bit 1)
          LE Read ISO link quality (Octet 44 - Bit 2)
          Octet 45 - Bit 6 
          Octet 46 - Bit 0 
          Octet 46 - Bit 1 
          Octet 46 - Bit 2 
zephyr.exe[1469754]: < HCI Command: Host Buffer Size (0x03|0x0033) plen 7                                             #9 1.326576
        ACL MTU: 255  ACL max packet: 16
        SCO MTU: 0    SCO max packet: 0
> HCI Event: Command Complete (0x0e) plen 4                                                                          #10 1.327465
      Host Buffer Size (0x03|0x0033) ncmd 1
        Status: Success (0x00)
zephyr.exe[1469754]: < HCI Command: Set Controller To Host Flow Control (0x03|0x0031) plen 1                         #11 1.346602
        Flow control: ACL Data Packets (0x01)
> HCI Event: Command Complete (0x0e) plen 4                                                                          #12 1.347191
      Set Controller To Host Flow Control (0x03|0x0031) ncmd 1
        Status: Success (0x00)
zephyr.exe[1469754]: < HCI Command: LE Read Local Supported Features (0x08|0x0003) plen 0                            #13 1.366614
> HCI Event: Command Complete (0x0e) plen 12                                                                         #14 1.367328
      LE Read Local Supported Features (0x08|0x0003) ncmd 1
        Status: Success (0x00)
        Features: 0xfd 0x79 0x00 0xf7 0x30 0x01 0x00 0x00
          LE Encryption
          Extended Reject Indication
          Peripheral-initiated Features Exchange
          LE Ping
          LE Data Packet Length Extension
          LL Privacy
          Extended Scanner Filter Policies
          LE 2M PHY
          LE Coded PHY
          LE Extended Advertising
          LE Periodic Advertising
          Channel Selection Algorithm #2
          Periodic Advertising Sync Transfer - Sender
          Periodic Advertising Sync Transfer - Recipient
          Sleep Clock Accuracy Updates
          Connected Isochronous Stream - Central
          Connected Isochronous Stream - Peripheral
          Isochronous Broadcaster
          Synchronized Receiver
          Periodic Advertising ADI support
          Connection Subrating
          Unknown features (0x0000010000000000)
zephyr.exe[1469754]: < HCI Command: LE Set Host Feature (0x08|0x0074) plen 2                                         #15 1.386608
        Bit Number: 32
          Connected Isochronous Stream (Host Support)
        Bit Value: 1
> HCI Event: Command Complete (0x0e) plen 4                                                                          #16 1.387352
      LE Set Host Feature (0x08|0x0074) ncmd 1
        Status: Success (0x00)
zephyr.exe[1469754]: < HCI Command: LE Read Buffer v2 (0x08|0x0060) plen 0                                           #17 1.406616
> HCI Event: Command Complete (0x0e) plen 10                                                                         #18 1.407693
      LE Read Buffer v2 (0x08|0x0060) ncmd 1
        Status: Success (0x00)
        ACL MTU: 27
        ACL max packet: 3
        ISO MTU: 318
        ISO max packet: 3
zephyr.exe[1469754]: < HCI Command: LE Read Maximum Advertising Data Length (0x08|0x003a) plen 0                     #19 1.426631
> HCI Event: Command Complete (0x0e) plen 6                                                                          #20 1.427059
      LE Read Maximum Advertising Data Length (0x08|0x003a) ncmd 1
        Status: Success (0x00)
        Max length: 1650
zephyr.exe[1469754]: < HCI Command: LE Read Supported States (0x08|0x001c) plen 0                                    #21 1.446609
> HCI Event: Command Complete (0x0e) plen 12                                                                         #22 1.447508
      LE Read Supported States (0x08|0x001c) ncmd 1
        Status: Success (0x00)
        States: 0x000003ff3e0306ff
          Non-connectable Advertising State
          Scannable Advertising State
          Connectable Advertising State
          High Duty Cycle Directed Advertising State
          Passive Scanning State
          Active Scanning State
          Initiating State
            and Connection State (Central Role)
          Connection State (Peripheral Role)
          Scannable Advertising State
            and Passive Scanning State
          Connectable Advertising State
            and Passive Scanning State
          Non-connectable Advertising State
            and Initiating State
          Scannable Advertising State
            and Initiating State
          Active Scanning State
            and Connection State (Central Role)
          Passive Scanning State
            and Connection State (Peripheral Role)
          Active Scanning State
            and Connection State (Peripheral Role)
          Initiating State
            and Connection State (Central Role)
            and Central Role & Central Role
          Low Duty Cycle Directed Advertising State
          Connectable Advertising State
            and Initiating State
            and Central Role & Peripheral Role
          High Duty Cycle Directed Advertising State
            and Initiating State
            and Central Role & Peripheral Role
          Low Duty Cycle Directed Advertising State
            and Initiating State
            and Central Role & Peripheral Role
          Connectable Advertising State
            and Connection State (Central Role)
            and Central Role & Peripheral Role
          High Duty Cycle Directed Advertising State
            and Connection State (Central Role)
            and Central Role & Peripheral Role
          Low Duty Cycle Directed Advertising State
            and Connection State (Central Role)
            and Central Role & Peripheral Role
          Connectable Advertising State
            and Connection State (Peripheral Role)
            and Central Role & Peripheral Role
          High Duty Cycle Directed Advertising State
            and Connection State (Peripheral Role)
            and Peripheral Role & Peripheral Role
          Low Duty Cycle Directed Advertising State
            and Connection State (Peripheral Role)
            and Peripheral Role & Peripheral Role
          Initiating State
            and Connection State (Peripheral Role)
            and Central Role & Peripheral Role
zephyr.exe[1469754]: < HCI Command: LE Read Maximum Data Length (0x08|0x002f) plen 0                                 #23 1.466556
> HCI Event: Command Complete (0x0e) plen 12                                                                         #24 1.467239
      LE Read Maximum Data Length (0x08|0x002f) ncmd 1
        Status: Success (0x00)
        Max TX octets: 251
        Max TX time: 2704
        Max RX octets: 251
        Max RX time: 2704
zephyr.exe[1469754]: < HCI Command: LE Write Suggested Default Data Length (0x08|0x0024) plen 4                      #25 1.486598
        TX octets: 251
        TX time: 2704
> HCI Event: Command Complete (0x0e) plen 4                                                                          #26 1.487584
      LE Write Suggested Default Data Length (0x08|0x0024) ncmd 1
        Status: Success (0x00)
zephyr.exe[1469754]: < HCI Command: LE Read Resolving List Size (0x08|0x002a) plen 0                                 #27 1.506493
> HCI Event: Command Complete (0x0e) plen 5                                                                          #28 1.507787
      LE Read Resolving List Size (0x08|0x002a) ncmd 1
        Status: Success (0x00)
        Size: 8
zephyr.exe[1469754]: < HCI Command: LE Set Event Mask (0x08|0x0001) plen 8                                           #29 1.526616
        Mask: 0x000002023f87fa5e
          LE Advertising Report
          LE Connection Update Complete
          LE Read Remote Used Features Complete
          LE Long Term Key Request
          LE Data Length Change
          LE Enhanced Connection Complete
          LE PHY Update Complete
          LE Extended Advertising Report
          LE Periodic Advertising Sync Established
          LE Periodic Advertising Report
          LE Periodic Advertising Sync Lost
          LE Extended Scan Timeout
          LE Extended Advertising Set Terminated
          LE Scan Request Received
          LE Periodic Advertising Sync Transfer Rvc
          LE CIS Established
          LE CIS Request
          LE Create BIG Complete
          LE Terminate BIG Complete
          LE BIG Sync Established Complete
          LE BIG Sync Lost
          LE BIG Info Advertising Report
          Unknown mask (0x0000020000000000)
> HCI Event: Command Complete (0x0e) plen 4                                                                          #30 1.527837
      LE Set Event Mask (0x08|0x0001) ncmd 1
        Status: Success (0x00)
zephyr.exe[1469754]: < HCI Command: Set Event Mask (0x03|0x0001) plen 8                                              #31 1.546599
        Mask: 0x2000800002008890
          Disconnection Complete
          Encryption Change
          Read Remote Version Information Complete
          Hardware Error
          Data Buffer Overflow
          Encryption Key Refresh Complete
          LE Meta
> HCI Event: Command Complete (0x0e) plen 4                                                                          #32 1.547880
      Set Event Mask (0x03|0x0001) ncmd 1
        Status: Success (0x00)
zephyr.exe[1469754]: < HCI Command: Read BD ADDR (0x04|0x0009) plen 0                                                #33 1.566610
> HCI Event: Command Complete (0x0e) plen 10                                                                         #34 1.567423
      Read BD ADDR (0x04|0x0009) ncmd 1
        Status: Success (0x00)
        Address: 00:00:00:00:00:00 (OUI 00-00-00)
zephyr.exe[1469754]: < HCI Command: LE Set Random Address (0x08|0x0005) plen 6                                       #35 1.586607
        Address: D5:B6:CC:31:DB:3B (Static)
> HCI Event: Command Complete (0x0e) plen 4                                                                          #36 1.587335
      LE Set Random Address (0x08|0x0005) ncmd 1
        Status: Success (0x00)
zephyr.exe[1469754]: < HCI Command: LE Extended Create Connection (0x08|0x0043) plen 26                              #37 3.736630
        Filter policy: Accept list is not used (0x00)
        Own address type: Random (0x01)
        Peer address type: Public (0x00)
        Peer address: DF:A9:FF:F6:B1:1A (OUI DF-A9-FF)
        Initiating PHYs: 0x01
        Entry 0: LE 1M
          Scan interval: 60.000 msec (0x0060)
          Scan window: 60.000 msec (0x0060)
          Min connection interval: 30.00 msec (0x0018)
          Max connection interval: 50.00 msec (0x0028)
          Connection latency: 0 (0x0000)
          Supervision timeout: 4000 msec (0x0190)
          Min connection length: 0.000 msec (0x0000)
          Max connection length: 0.000 msec (0x0000)
> HCI Event: Command Status (0x0f) plen 4                                                                            #38 3.737674
      LE Extended Create Connection (0x08|0x0043) ncmd 1
        Status: Success (0x00)
> HCI Event: LE Meta Event (0x3e) plen 31                                                                            #39 3.939483
      LE Enhanced Connection Complete (0x0a)
        Status: Success (0x00)
        Handle: 468
        Role: Central (0x00)
        Peer address type: Public (0x00)
        Peer address: DF:A9:FF:F6:B1:1A (OUI DF-A9-FF)
        Local resolvable private address: 00:00:00:00:00:00 (Non-Resolvable)
        Peer resolvable private address: 00:00:00:00:00:00 (Non-Resolvable)
        Connection interval: 50.00 msec (0x0028)
        Connection latency: 0 (0x0000)
        Supervision timeout: 4000 msec (0x0190)
        Central clock accuracy: 0x00
zephyr.exe[1469754]: < HCI Command: LE Read Remote Used Features (0x08|0x0016) plen 2                                #40 3.946666
        Handle: 468 Address: DF:A9:FF:F6:B1:1A (OUI DF-A9-FF)
> HCI Event: Command Status (0x0f) plen 4                                                                            #41 3.947674
      LE Read Remote Used Features (0x08|0x0016) ncmd 1
        Status: Success (0x00)
zephyr.exe[1469754]: < HCI Command: LE Set PHY (0x08|0x0032) plen 7                                                  #42 3.966593
        Handle: 468 Address: DF:A9:FF:F6:B1:1A (OUI DF-A9-FF)
        All PHYs preference: 0x00
        TX PHYs preference: 0x02
          LE 2M
        RX PHYs preference: 0x02
          LE 2M
        PHY options preference: Reserved (0x0000)
> HCI Event: Command Status (0x0f) plen 4                                                                            #43 3.967361
      LE Set PHY (0x08|0x0032) ncmd 1
        Status: Success (0x00)
> HCI Event: LE Meta Event (0x3e) plen 12                                                                            #44 4.091031
      LE Read Remote Used Features (0x04)
        Status: Success (0x00)
        Handle: 468 Address: DF:A9:FF:F6:B1:1A (OUI DF-A9-FF)
        Features: 0x2d 0x49 0x00 0xf7 0x67 0xd8 0x00 0x00
          LE Encryption
          Extended Reject Indication
          Peripheral-initiated Features Exchange
          LE Data Packet Length Extension
          LE 2M PHY
          LE Coded PHY
          Channel Selection Algorithm #2
          Periodic Advertising Sync Transfer - Sender
          Periodic Advertising Sync Transfer - Recipient
          Sleep Clock Accuracy Updates
          Connected Isochronous Stream - Central
          Connected Isochronous Stream - Peripheral
          Isochronous Broadcaster
          Synchronized Receiver
          Connected Isochronous Stream (Host Support)
          LE Power Control Request
          LE Power Control Request
          Connection Subrating
          Connection Subrating (Host Support)
          Unknown features (0x0000d80000000000)
> HCI Event: LE Meta Event (0x3e) plen 6                                                                             #45 4.590196
      LE PHY Update Complete (0x0c)
        Status: Success (0x00)
        Handle: 468 Address: DF:A9:FF:F6:B1:1A (OUI DF-A9-FF)
        TX PHY: LE 2M (0x02)
        RX PHY: LE 2M (0x02)
zephyr.exe[1469754]: < ACL Data TX: Handle 468 [1/3] flags 0x00 dlen 11                                              #46 4.976682
      SMP: Pairing Request (0x01) len 6
        IO capability: NoInputNoOutput (0x03)
        OOB data: Authentication data not present (0x00)
        Authentication requirement: No bonding, No MITM, SC, No Keypresses (0x08)
        Max encryption key size: 16
        Initiator key distribution: <none> (0x00)
        Responder key distribution: <none> (0x00)
> HCI Event: Number of Completed Packets (0x13) plen 5                                                               #47 4.990434
        Num handles: 1
        Handle: 468 Address: DF:A9:FF:F6:B1:1A (OUI DF-A9-FF)
        Count: 1
        Buffers: 0/3
        #46: len 11 (6 Kb/s)
        Latency: 13 msec (13-13 msec ~13 msec)
> ACL Data RX: Handle 468 flags 0x02 dlen 11                                                                         #48 5.040748
      SMP: Pairing Response (0x02) len 6
        IO capability: DisplayYesNo (0x01)
        OOB data: Authentication data not present (0x00)
        Authentication requirement: No bonding, No MITM, SC, No Keypresses (0x08)
        Max encryption key size: 16
        Initiator key distribution: <none> (0x00)
        Responder key distribution: <none> (0x00)
zephyr.exe[1469754]: < HCI Command: Host Number of Completed Packets (0x03|0x0035) plen 5                            #49 5.046710
        Num handles: 1
        Handle: 468 Address: DF:A9:FF:F6:B1:1A (OUI DF-A9-FF)
        Count: 1
zephyr.exe[1469754]: < ACL Data TX: Handle 468 [1/3] flags 0x00 dlen 27                                              #50 5.046791
zephyr.exe[1469754]: < ACL Data TX: Handle 468 flags 0x01 dlen 27                                                    #51 5.046794
zephyr.exe[1469754]: < ACL Data TX: Handle 468 flags 0x01 dlen 15                                                    #52 5.046795
      SMP: Pairing Public Key (0x0c) len 64
        X[32]: 98308440221e2d910f0e54b71e7ec652857aa9b5a0dc65028824cc19db1226e9
        Y[32]: 67a4816bcb62efb21701e31fdb27561a6217575fb007a8bbdabe7e28b6f68482
> HCI Event: Number of Completed Packets (0x13) plen 5                                                               #53 5.090379
        Num handles: 1
        Handle: 468 Address: DF:A9:FF:F6:B1:1A (OUI DF-A9-FF)
        Count: 1
        Buffers: 0/3
        #50: len 27 (5 Kb/s)
        Latency: 43 msec (13-43 msec ~28 msec)
> HCI Event: Number of Completed Packets (0x13) plen 5                                                               #54 5.090866
        Num handles: 1
        Handle: 468 Address: DF:A9:FF:F6:B1:1A (OUI DF-A9-FF)
        Count: 1
        Buffers: underflow/3
        #51: len 27 (4 Kb/s)
        Latency: 44 msec (13-44 msec ~36 msec)
> HCI Event: Number of Completed Packets (0x13) plen 5                                                               #55 5.091407
        Num handles: 1
        Handle: 468 Address: DF:A9:FF:F6:B1:1A (OUI DF-A9-FF)
        Count: 1
        Buffers: underflow/3
        #52: len 15 (2 Kb/s)
        Latency: 44 msec (13-44 msec ~40 msec)
> ACL Data RX: Handle 468 flags 0x02 dlen 27                                                                         #56 5.140990
> ACL Data RX: Handle 468 flags 0x01 dlen 27                                                                         #57 5.140992
> ACL Data RX: Handle 468 flags 0x01 dlen 15                                                                         #58 5.141612
      SMP: Pairing Public Key (0x0c) len 64
        X[32]: ab5fcfdd8c8a28b0581b067131a537f67066b5ed549704dbf009b29ae09b70b6
        Y[32]: 54422d4267327cfebbd0f7a11dca993a74584e677288c8c63467d6e6dde4a186
zephyr.exe[1469754]: < HCI Command: Host Number of Completed Packets (0x03|0x0035) plen 5                            #59 5.146787
        Num handles: 1
        Handle: 468 Address: DF:A9:FF:F6:B1:1A (OUI DF-A9-FF)
        Count: 1
zephyr.exe[1469754]: < HCI Command: Host Number of Completed Packets (0x03|0x0035) plen 5                            #60 5.146880
        Num handles: 1
        Handle: 468 Address: DF:A9:FF:F6:B1:1A (OUI DF-A9-FF)
        Count: 1
zephyr.exe[1469754]: < HCI Command: Host Number of Completed Packets (0x03|0x0035) plen 5                            #61 5.146884
        Num handles: 1
        Handle: 468 Address: DF:A9:FF:F6:B1:1A (OUI DF-A9-FF)
        Count: 1
> ACL Data RX: Handle 468 flags 0x02 dlen 21                                                                         #62 5.240734
      SMP: Pairing Confirm (0x03) len 16
        Confirm value[16]: 10a8655e5cd0fa7177295071471c02ce
zephyr.exe[1469754]: < HCI Command: Host Number of Completed Packets (0x03|0x0035) plen 5                            #63 5.246707
        Num handles: 1
        Handle: 468 Address: DF:A9:FF:F6:B1:1A (OUI DF-A9-FF)
        Count: 1
zephyr.exe[1469754]: < ACL Data TX: Handle 468 [1/3] flags 0x00 dlen 21                                              #64 5.246768
      SMP: Pairing Random (0x04) len 16
        Random value[16]: 8e6108f966a694cbe26df70bb96773e6
> HCI Event: Number of Completed Packets (0x13) plen 5                                                               #65 5.290367
        Num handles: 1
        Handle: 468 Address: DF:A9:FF:F6:B1:1A (OUI DF-A9-FF)
        Count: 1
        Buffers: 0/3
        #64: len 21 (3 Kb/s)
        Latency: 43 msec (13-44 msec ~42 msec)
> ACL Data RX: Handle 468 flags 0x02 dlen 21                                                                         #66 5.541224
      SMP: Pairing Random (0x04) len 16
        Random value[16]: 732dcdbab7a834b66e602c2e8aab2976
zephyr.exe[1469754]: < HCI Command: Host Number of Completed Packets (0x03|0x0035) plen 5                            #67 5.546820
        Num handles: 1
        Handle: 468 Address: DF:A9:FF:F6:B1:1A (OUI DF-A9-FF)
        Count: 1
zephyr.exe[1469754]: < ACL Data TX: Handle 468 [1/3] flags 0x00 dlen 21                                              #68 5.546843
      SMP: Pairing DHKey Check (0x0d) len 16
        E[16]: 149c80536f7e89d5a13d74df226dc005
> HCI Event: Number of Completed Packets (0x13) plen 5                                                               #69 5.590526
        Num handles: 1
        Handle: 468 Address: DF:A9:FF:F6:B1:1A (OUI DF-A9-FF)
        Count: 1
        Buffers: 0/3
        #68: len 21 (3 Kb/s)
        Latency: 43 msec (13-44 msec ~42 msec)
> ACL Data RX: Handle 468 flags 0x02 dlen 21                                                                         #70 5.640704
      SMP: Pairing DHKey Check (0x0d) len 16
        E[16]: 286b8ad8ec16c4cae7a8efe4e2748f42
zephyr.exe[1469754]: < HCI Command: LE Start Encryption (0x08|0x0019) plen 28                                        #71 5.646760
        Handle: 468 Address: DF:A9:FF:F6:B1:1A (OUI DF-A9-FF)
        Random number: 0x0000000000000000
        Encrypted diversifier: 0x0000
        Long term key[16]: 02825bacdfc3bec6db49777109f0ce6f
> HCI Event: Command Status (0x0f) plen 4                                                                            #72 5.648041
      LE Start Encryption (0x08|0x0019) ncmd 1
        Status: Success (0x00)
zephyr.exe[1469754]: < HCI Command: Host Number of Completed Packets (0x03|0x0035) plen 5                            #73 5.666629
        Num handles: 1
        Handle: 468 Address: DF:A9:FF:F6:B1:1A (OUI DF-A9-FF)
        Count: 1
> HCI Event: Encryption Change (0x08) plen 4                                                                         #74 5.990434
        Status: Success (0x00)
        Handle: 468 Address: DF:A9:FF:F6:B1:1A (OUI DF-A9-FF)
        Encryption: Enabled with AES-CCM (0x01)
zephyr.exe[1469754]: < HCI Command: Disconnect (0x01|0x0006) plen 3                                                  #75 7.006680
        Handle: 468 Address: DF:A9:FF:F6:B1:1A (OUI DF-A9-FF)
        Reason: Remote User Terminated Connection (0x13)
> HCI Event: Command Status (0x0f) plen 4                                                                            #76 7.007430
      Disconnect (0x01|0x0006) ncmd 1
        Status: Success (0x00)
> HCI Event: Disconnect Complete (0x05) plen 4                                                                       #77 7.090188
        Status: Success (0x00)
        Handle: 468 Address: DF:A9:FF:F6:B1:1A (OUI DF-A9-FF)
        Reason: Connection Terminated By Local Host (0x16)
zephyr.exe[1469754]: < HCI Command: LE Extended Create Connection (0x08|0x0043) plen 26                              #78 8.156678
        Filter policy: Accept list is not used (0x00)
        Own address type: Random (0x01)
        Peer address type: Public (0x00)
        Peer address: DF:A9:FF:F6:B1:1A (OUI DF-A9-FF)
        Initiating PHYs: 0x01
        Entry 0: LE 1M
          Scan interval: 60.000 msec (0x0060)
          Scan window: 60.000 msec (0x0060)
          Min connection interval: 30.00 msec (0x0018)
          Max connection interval: 50.00 msec (0x0028)
          Connection latency: 0 (0x0000)
          Supervision timeout: 4000 msec (0x0190)
          Min connection length: 0.000 msec (0x0000)
          Max connection length: 0.000 msec (0x0000)
> HCI Event: Command Status (0x0f) plen 4                                                                            #79 8.157664
      LE Extended Create Connection (0x08|0x0043) ncmd 1
        Status: Success (0x00)
> HCI Event: LE Meta Event (0x3e) plen 31                                                                            #80 8.214523
      LE Enhanced Connection Complete (0x0a)
        Status: Success (0x00)
        Handle: 486
        Role: Central (0x00)
        Peer address type: Public (0x00)
        Peer address: DF:A9:FF:F6:B1:1A (OUI DF-A9-FF)
        Local resolvable private address: 00:00:00:00:00:00 (Non-Resolvable)
        Peer resolvable private address: 00:00:00:00:00:00 (Non-Resolvable)
        Connection interval: 50.00 msec (0x0028)
        Connection latency: 0 (0x0000)
        Supervision timeout: 4000 msec (0x0190)
        Central clock accuracy: 0x00
zephyr.exe[1469754]: < HCI Command: LE Read Remote Used Features (0x08|0x0016) plen 2                                #81 8.226805
        Handle: 486 Address: DF:A9:FF:F6:B1:1A (OUI DF-A9-FF)
> HCI Event: Command Status (0x0f) plen 4                                                                            #82 8.228171
      LE Read Remote Used Features (0x08|0x0016) ncmd 1
        Status: Success (0x00)
zephyr.exe[1469754]: < HCI Command: LE Set PHY (0x08|0x0032) plen 7                                                  #83 8.246654
        Handle: 486 Address: DF:A9:FF:F6:B1:1A (OUI DF-A9-FF)
        All PHYs preference: 0x00
        TX PHYs preference: 0x02
          LE 2M
        RX PHYs preference: 0x02
          LE 2M
        PHY options preference: Reserved (0x0000)
> HCI Event: Command Status (0x0f) plen 4                                                                            #84 8.247340
      LE Set PHY (0x08|0x0032) ncmd 1
        Status: Success (0x00)
> HCI Event: LE Meta Event (0x3e) plen 12                                                                            #85 8.365889
      LE Read Remote Used Features (0x04)
        Status: Success (0x00)
        Handle: 486 Address: DF:A9:FF:F6:B1:1A (OUI DF-A9-FF)
        Features: 0x2d 0x49 0x00 0xf7 0x67 0xd8 0x00 0x00
          LE Encryption
          Extended Reject Indication
          Peripheral-initiated Features Exchange
          LE Data Packet Length Extension
          LE 2M PHY
          LE Coded PHY
          Channel Selection Algorithm #2
          Periodic Advertising Sync Transfer - Sender
          Periodic Advertising Sync Transfer - Recipient
          Sleep Clock Accuracy Updates
          Connected Isochronous Stream - Central
          Connected Isochronous Stream - Peripheral
          Isochronous Broadcaster
          Synchronized Receiver
          Connected Isochronous Stream (Host Support)
          LE Power Control Request
          LE Power Control Request
          Connection Subrating
          Connection Subrating (Host Support)
          Unknown features (0x0000d80000000000)
> HCI Event: LE Meta Event (0x3e) plen 6                                                                             #86 8.865039
      LE PHY Update Complete (0x0c)
        Status: Success (0x00)
        Handle: 486 Address: DF:A9:FF:F6:B1:1A (OUI DF-A9-FF)
        TX PHY: LE 2M (0x02)
        RX PHY: LE 2M (0x02)
zephyr.exe[1469754]: < ACL Data TX: Handle 486 [1/3] flags 0x00 dlen 11                                              #87 9.256700
      SMP: Pairing Request (0x01) len 6
        IO capability: NoInputNoOutput (0x03)
        OOB data: Authentication data not present (0x00)
        Authentication requirement: No bonding, No MITM, SC, No Keypresses (0x08)
        Max encryption key size: 16
        Initiator key distribution: <none> (0x00)
        Responder key distribution: <none> (0x00)
> HCI Event: Number of Completed Packets (0x13) plen 5                                                               #88 9.265714
        Num handles: 1
        Handle: 486 Address: DF:A9:FF:F6:B1:1A (OUI DF-A9-FF)
        Count: 1
        Buffers: 0/3
        #87: len 11 (9 Kb/s)
        Latency: 9 msec (9-9 msec ~9 msec)
> ACL Data RX: Handle 486 flags 0x02 dlen 11                                                                         #89 9.315940
      SMP: Pairing Response (0x02) len 6
        IO capability: DisplayYesNo (0x01)
        OOB data: Authentication data not present (0x00)
        Authentication requirement: No bonding, No MITM, SC, No Keypresses (0x08)
        Max encryption key size: 16
        Initiator key distribution: <none> (0x00)
        Responder key distribution: <none> (0x00)
zephyr.exe[1469754]: < HCI Command: Host Number of Completed Packets (0x03|0x0035) plen 5                            #90 9.326732
        Num handles: 1
        Handle: 486 Address: DF:A9:FF:F6:B1:1A (OUI DF-A9-FF)
        Count: 1
zephyr.exe[1469754]: < ACL Data TX: Handle 486 [1/3] flags 0x00 dlen 27                                              #91 9.326759
zephyr.exe[1469754]: < ACL Data TX: Handle 486 flags 0x01 dlen 27                                                    #92 9.326761
zephyr.exe[1469754]: < ACL Data TX: Handle 486 flags 0x01 dlen 15                                                    #93 9.326795
      SMP: Pairing Public Key (0x0c) len 64
        X[32]: 98308440221e2d910f0e54b71e7ec652857aa9b5a0dc65028824cc19db1226e9
        Y[32]: 67a4816bcb62efb21701e31fdb27561a6217575fb007a8bbdabe7e28b6f68482
> HCI Event: Number of Completed Packets (0x13) plen 5                                                               #94 9.365523
        Num handles: 1
        Handle: 486 Address: DF:A9:FF:F6:B1:1A (OUI DF-A9-FF)
        Count: 1
        Buffers: 0/3
        #91: len 27 (5 Kb/s)
        Latency: 38 msec (9-38 msec ~23 msec)
> HCI Event: Number of Completed Packets (0x13) plen 5                                                               #95 9.365939
        Num handles: 1
        Handle: 486 Address: DF:A9:FF:F6:B1:1A (OUI DF-A9-FF)
        Count: 1
        Buffers: underflow/3
        #92: len 27 (5 Kb/s)
        Latency: 39 msec (9-39 msec ~31 msec)
> HCI Event: Number of Completed Packets (0x13) plen 5                                                               #96 9.366448
        Num handles: 1
        Handle: 486 Address: DF:A9:FF:F6:B1:1A (OUI DF-A9-FF)
        Count: 1
        Buffers: underflow/3
        #93: len 15 (3 Kb/s)
        Latency: 39 msec (9-39 msec ~35 msec)
> ACL Data RX: Handle 486 flags 0x02 dlen 27                                                                         #97 9.416007
> ACL Data RX: Handle 486 flags 0x01 dlen 27                                                                         #98 9.416346
> ACL Data RX: Handle 486 flags 0x01 dlen 15                                                                         #99 9.417002
      SMP: Pairing Public Key (0x0c) len 64
        X[32]: 0c648e56392cb94d2ad94af75c763cff8269adf2d0b7ef9d733ebd51ca167932
        Y[32]: c4214b98a2405611c007dd3a52c1dd00c55f43472516b461329b3241949346b5
zephyr.exe[1469754]: < HCI Command: Host Number of Completed Packets (0x03|0x0035) plen 5                           #100 9.426814
        Num handles: 1
        Handle: 486 Address: DF:A9:FF:F6:B1:1A (OUI DF-A9-FF)
        Count: 1
zephyr.exe[1469754]: < HCI Command: Host Number of Completed Packets (0x03|0x0035) plen 5                           #101 9.426913
        Num handles: 1
        Handle: 486 Address: DF:A9:FF:F6:B1:1A (OUI DF-A9-FF)
        Count: 1
zephyr.exe[1469754]: < HCI Command: Host Number of Completed Packets (0x03|0x0035) plen 5                           #102 9.426916
        Num handles: 1
        Handle: 486 Address: DF:A9:FF:F6:B1:1A (OUI DF-A9-FF)
        Count: 1
> ACL Data RX: Handle 486 flags 0x02 dlen 21                                                                        #103 9.515708
      SMP: Pairing Confirm (0x03) len 16
        Confirm value[16]: b6b6c258600503ea5e120367378fbd17
zephyr.exe[1469754]: < HCI Command: Host Number of Completed Packets (0x03|0x0035) plen 5                           #104 9.526736
        Num handles: 1
        Handle: 486 Address: DF:A9:FF:F6:B1:1A (OUI DF-A9-FF)
        Count: 1
zephyr.exe[1469754]: < ACL Data TX: Handle 486 [1/3] flags 0x00 dlen 21                                             #105 9.526804
      SMP: Pairing Random (0x04) len 16
        Random value[16]: 5da095555cc64d02679f89a05211af56
> HCI Event: Number of Completed Packets (0x13) plen 5                                                              #106 9.565539
        Num handles: 1
        Handle: 486 Address: DF:A9:FF:F6:B1:1A (OUI DF-A9-FF)
        Count: 1
        Buffers: 0/3
        #105: len 21 (4 Kb/s)
        Latency: 38 msec (9-39 msec ~37 msec)
> ACL Data RX: Handle 486 flags 0x02 dlen 21                                                                        #107 9.815913
      SMP: Pairing Random (0x04) len 16
        Random value[16]: e524060e803c6c3200db7bbaf2799bfe
zephyr.exe[1469754]: < HCI Command: Host Number of Completed Packets (0x03|0x0035) plen 5                           #108 9.826910
        Num handles: 1
        Handle: 486 Address: DF:A9:FF:F6:B1:1A (OUI DF-A9-FF)
        Count: 1
zephyr.exe[1469754]: < ACL Data TX: Handle 486 [1/3] flags 0x00 dlen 21                                             #109 9.826916
      SMP: Pairing DHKey Check (0x0d) len 16
        E[16]: 8b3297fe2c5fcb0cc6e5fb15784af8aa
> HCI Event: Number of Completed Packets (0x13) plen 5                                                              #110 9.865563
        Num handles: 1
        Handle: 486 Address: DF:A9:FF:F6:B1:1A (OUI DF-A9-FF)
        Count: 1
        Buffers: 0/3
        #109: len 21 (4 Kb/s)
        Latency: 38 msec (9-39 msec ~37 msec)
> ACL Data RX: Handle 486 flags 0x02 dlen 21                                                                        #111 9.915692
      SMP: Pairing DHKey Check (0x0d) len 16
        E[16]: 998882d7904a31307210fea72c88c70f
zephyr.exe[1469754]: < HCI Command: LE Start Encryption (0x08|0x0019) plen 28                                       #112 9.926818
        Handle: 486 Address: DF:A9:FF:F6:B1:1A (OUI DF-A9-FF)
        Random number: 0x0000000000000000
        Encrypted diversifier: 0x0000
        Long term key[16]: 7d368cca09fe7284efc2280b5911ffd8
> HCI Event: Command Status (0x0f) plen 4                                                                           #113 9.927788
      LE Start Encryption (0x08|0x0019) ncmd 1
        Status: Success (0x00)
zephyr.exe[1469754]: < HCI Command: Host Number of Completed Packets (0x03|0x0035) plen 5                           #114 9.946656
        Num handles: 1
        Handle: 486 Address: DF:A9:FF:F6:B1:1A (OUI DF-A9-FF)
        Count: 1
> HCI Event: Encryption Change (0x08) plen 4                                                                       #115 10.265986
        Status: Success (0x00)
        Handle: 486 Address: DF:A9:FF:F6:B1:1A (OUI DF-A9-FF)
        Encryption: Enabled with AES-CCM (0x01)
zephyr.exe[1469754]: < HCI Command: Disconnect (0x01|0x0006) plen 3                                                #116 10.279110
        Handle: 486 Address: DF:A9:FF:F6:B1:1A (OUI DF-A9-FF)
        Reason: Remote User Terminated Connection (0x13)
> HCI Event: Command Status (0x0f) plen 4                                                                          #117 10.279996
      Disconnect (0x01|0x0006) ncmd 1
        Status: Success (0x00)
> HCI Event: Disconnect Complete (0x05) plen 4                                                                     #118 10.365423
        Status: Success (0x00)
        Handle: 486 Address: DF:A9:FF:F6:B1:1A (OUI DF-A9-FF)
        Reason: Connection Terminated By Local Host (0x16)
zephyr.exe[1469754]: < HCI Command: LE Extended Create Connection (0x08|0x0043) plen 26                            #119 11.556711
        Filter policy: Accept list is not used (0x00)
        Own address type: Random (0x01)
        Peer address type: Public (0x00)
        Peer address: DF:A9:FF:F6:B1:1A (OUI DF-A9-FF)
        Initiating PHYs: 0x01
        Entry 0: LE 1M
          Scan interval: 60.000 msec (0x0060)
          Scan window: 60.000 msec (0x0060)
          Min connection interval: 30.00 msec (0x0018)
          Max connection interval: 50.00 msec (0x0028)
          Connection latency: 0 (0x0000)
          Supervision timeout: 4000 msec (0x0190)
          Min connection length: 0.000 msec (0x0000)
          Max connection length: 0.000 msec (0x0000)
> HCI Event: Command Status (0x0f) plen 4                                                                          #120 11.557744
      LE Extended Create Connection (0x08|0x0043) ncmd 1
        Status: Success (0x00)
> HCI Event: LE Meta Event (0x3e) plen 31                                                                          #121 11.645824
      LE Enhanced Connection Complete (0x0a)
        Status: Success (0x00)
        Handle: 504
        Role: Central (0x00)
        Peer address type: Public (0x00)
        Peer address: DF:A9:FF:F6:B1:1A (OUI DF-A9-FF)
        Local resolvable private address: 00:00:00:00:00:00 (Non-Resolvable)
        Peer resolvable private address: 00:00:00:00:00:00 (Non-Resolvable)
        Connection interval: 50.00 msec (0x0028)
        Connection latency: 0 (0x0000)
        Supervision timeout: 4000 msec (0x0190)
        Central clock accuracy: 0x00
zephyr.exe[1469754]: < HCI Command: LE Read Remote Used Features (0x08|0x0016) plen 2                              #122 11.646843
        Handle: 504 Address: DF:A9:FF:F6:B1:1A (OUI DF-A9-FF)
> HCI Event: Command Status (0x0f) plen 4                                                                          #123 11.647526
      LE Read Remote Used Features (0x08|0x0016) ncmd 1
        Status: Success (0x00)
zephyr.exe[1469754]: < HCI Command: LE Set PHY (0x08|0x0032) plen 7                                                #124 11.666676
        Handle: 504 Address: DF:A9:FF:F6:B1:1A (OUI DF-A9-FF)
        All PHYs preference: 0x00
        TX PHYs preference: 0x02
          LE 2M
        RX PHYs preference: 0x02
          LE 2M
        PHY options preference: Reserved (0x0000)
> HCI Event: Command Status (0x0f) plen 4                                                                          #125 11.667629
      LE Set PHY (0x08|0x0032) ncmd 1
        Status: Success (0x00)
> HCI Event: LE Meta Event (0x3e) plen 12                                                                          #126 11.797416
      LE Read Remote Used Features (0x04)
        Status: Success (0x00)
        Handle: 504 Address: DF:A9:FF:F6:B1:1A (OUI DF-A9-FF)
        Features: 0x2d 0x49 0x00 0xf7 0x67 0xd8 0x00 0x00
          LE Encryption
          Extended Reject Indication
          Peripheral-initiated Features Exchange
          LE Data Packet Length Extension
          LE 2M PHY
          LE Coded PHY
          Channel Selection Algorithm #2
          Periodic Advertising Sync Transfer - Sender
          Periodic Advertising Sync Transfer - Recipient
          Sleep Clock Accuracy Updates
          Connected Isochronous Stream - Central
          Connected Isochronous Stream - Peripheral
          Isochronous Broadcaster
          Synchronized Receiver
          Connected Isochronous Stream (Host Support)
          LE Power Control Request
          LE Power Control Request
          Connection Subrating
          Connection Subrating (Host Support)
          Unknown features (0x0000d80000000000)
> HCI Event: LE Meta Event (0x3e) plen 6                                                                           #127 12.296815
      LE PHY Update Complete (0x0c)
        Status: Success (0x00)
        Handle: 504 Address: DF:A9:FF:F6:B1:1A (OUI DF-A9-FF)
        TX PHY: LE 2M (0x02)
        RX PHY: LE 2M (0x02)
zephyr.exe[1469754]: < ACL Data TX: Handle 504 [1/3] flags 0x00 dlen 11                                            #128 12.716771
      SMP: Pairing Request (0x01) len 6
        IO capability: NoInputNoOutput (0x03)
        OOB data: Authentication data not present (0x00)
        Authentication requirement: No bonding, No MITM, SC, No Keypresses (0x08)
        Max encryption key size: 16
        Initiator key distribution: <none> (0x00)
        Responder key distribution: <none> (0x00)
> HCI Event: Number of Completed Packets (0x13) plen 5                                                             #129 12.747275
        Num handles: 1
        Handle: 504 Address: DF:A9:FF:F6:B1:1A (OUI DF-A9-FF)
        Count: 1
        Buffers: 0/3
        #128: len 11 (2 Kb/s)
        Latency: 30 msec (30-30 msec ~30 msec)
> ACL Data RX: Handle 504 flags 0x02 dlen 11                                                                       #130 12.797338
      SMP: Pairing Response (0x02) len 6
        IO capability: DisplayYesNo (0x01)
        OOB data: Authentication data not present (0x00)
        Authentication requirement: No bonding, No MITM, SC, No Keypresses (0x08)
        Max encryption key size: 16
        Initiator key distribution: <none> (0x00)
        Responder key distribution: <none> (0x00)
zephyr.exe[1469754]: < HCI Command: Host Number of Completed Packets (0x03|0x0035) plen 5                          #131 12.806756
        Num handles: 1
        Handle: 504 Address: DF:A9:FF:F6:B1:1A (OUI DF-A9-FF)
        Count: 1
zephyr.exe[1469754]: < ACL Data TX: Handle 504 [1/3] flags 0x00 dlen 27                                            #132 12.806808
zephyr.exe[1469754]: < ACL Data TX: Handle 504 flags 0x01 dlen 27                                                  #133 12.806812
zephyr.exe[1469754]: < ACL Data TX: Handle 504 flags 0x01 dlen 15                                                  #134 12.806813
      SMP: Pairing Public Key (0x0c) len 64
        X[32]: 98308440221e2d910f0e54b71e7ec652857aa9b5a0dc65028824cc19db1226e9
        Y[32]: 67a4816bcb62efb21701e31fdb27561a6217575fb007a8bbdabe7e28b6f68482
> HCI Event: Number of Completed Packets (0x13) plen 5                                                             #135 12.847020
        Num handles: 1
        Handle: 504 Address: DF:A9:FF:F6:B1:1A (OUI DF-A9-FF)
        Count: 1
        Buffers: 0/3
        #132: len 27 (5 Kb/s)
        Latency: 40 msec (30-40 msec ~35 msec)
> HCI Event: Number of Completed Packets (0x13) plen 5                                                             #136 12.847476
        Num handles: 1
        Handle: 504 Address: DF:A9:FF:F6:B1:1A (OUI DF-A9-FF)
        Count: 1
        Buffers: underflow/3
        #133: len 27 (5 Kb/s)
        Latency: 40 msec (30-40 msec ~38 msec)
> HCI Event: Number of Completed Packets (0x13) plen 5                                                             #137 12.847965
        Num handles: 1
        Handle: 504 Address: DF:A9:FF:F6:B1:1A (OUI DF-A9-FF)
        Count: 1
        Buffers: underflow/3
        #134: len 15 (2 Kb/s)
        Latency: 41 msec (30-41 msec ~39 msec)
> ACL Data RX: Handle 504 flags 0x02 dlen 27                                                                       #138 12.897382
> ACL Data RX: Handle 504 flags 0x01 dlen 27                                                                       #139 12.897772
> ACL Data RX: Handle 504 flags 0x01 dlen 15                                                                       #140 12.898282
      SMP: Pairing Public Key (0x0c) len 64
        X[32]: d901270d8591abcbe0cbfd3efe68b32b635a027cdebcdcfb9e9c815f3610ef1a
        Y[32]: c1504630d86fccffc0b29644c2394e7dd555a142b0e971d5a519b1ef200e4976
zephyr.exe[1469754]: < HCI Command: Host Number of Completed Packets (0x03|0x0035) plen 5                          #141 12.906863
        Num handles: 1
        Handle: 504 Address: DF:A9:FF:F6:B1:1A (OUI DF-A9-FF)
        Count: 1
zephyr.exe[1469754]: < HCI Command: Host Number of Completed Packets (0x03|0x0035) plen 5                          #142 12.906952
        Num handles: 1
        Handle: 504 Address: DF:A9:FF:F6:B1:1A (OUI DF-A9-FF)
        Count: 1
zephyr.exe[1469754]: < HCI Command: Host Number of Completed Packets (0x03|0x0035) plen 5                          #143 12.906954
        Num handles: 1
        Handle: 504 Address: DF:A9:FF:F6:B1:1A (OUI DF-A9-FF)
        Count: 1
> ACL Data RX: Handle 504 flags 0x02 dlen 21                                                                       #144 12.997314
      SMP: Pairing Confirm (0x03) len 16
        Confirm value[16]: b25d19bae7f85c4980c1521851dbcd96
zephyr.exe[1469754]: < HCI Command: Ho