Bluetooth monitor ver 5.72
= Note: Linux version 6.14.0-36-generic (x86_64)                       0.892323
= Note: Bluetooth subsystem version 2.22                               0.892325
= New Index: 00:00:00:00:00:00 (Primary,UART,hci1)              [hci1] 0.892326
= New Index: 48:5F:99:8E:E0:64 (Primary,USB,hci0)               [hci0] 0.892326
= Open Index: 00:00:00:00:00:00                                 [hci1] 1.006359
= Index Info: 00:00:00:00:00:00 (Nordic Semiconductor ASA)      [hci1] 1.006371
@ USER Open: main (privileged) version 2.22            {0x0001} [hci1] 1.006380
< HCI Command: Reset (0x03|0x0003) plen 0                    #1 [hci1] 1.007598
> HCI Event: Command Complete (0x0e) plen 4                  #2 [hci1] 1.008114
      Reset (0x03|0x0003) ncmd 1
        Status: Success (0x00)
< HCI Command: Read Local Supported... (0x04|0x0003) plen 0  #3 [hci1] 1.025759
> HCI Event: Command Complete (0x0e) plen 12                 #4 [hci1] 1.026337
      Read Local Supported Features (0x04|0x0003) ncmd 1
        Status: Success (0x00)
        Features: 0x00 0x00 0x00 0x00 0x60 0x00 0x00 0x00
          BR/EDR Not Supported
          LE Supported (Controller)
< HCI Command: Read Local Version In.. (0x04|0x0001) plen 0  #5 [hci1] 1.045648
> HCI Event: Command Complete (0x0e) plen 12                 #6 [hci1] 1.046243
      Read Local Version Information (0x04|0x0001) ncmd 1
        Status: Success (0x00)
        HCI version: Reserved (0x0f) - Revision 12393 (0x3069)
        LMP version: Reserved (0x0f) - Subversion 12393 (0x3069)
        Manufacturer: Nordic Semiconductor ASA (89)
< HCI Command: Read Local Supported... (0x04|0x0002) plen 0  #7 [hci1] 1.065634
> HCI Event: Command Complete (0x0e) plen 68                 #8 [hci1] 1.066678
      Read Local Supported Commands (0x04|0x0002) ncmd 1
        Status: Success (0x00)
        Commands: 119 entries
          Disconnect (Octet 0 - Bit 5)
          Read Remote Version Information (Octet 2 - Bit 7)
          Set Event Mask (Octet 5 - Bit 6)
          Reset (Octet 5 - Bit 7)
          Read Connection Accept Timeout (Octet 7 - Bit 2)
          Write Connection Accept Timeout (Octet 7 - Bit 3)
          Read Transmit Power Level (Octet 10 - Bit 2)
          Set Controller To Host Flow Control (Octet 10 - Bit 5)
          Host Buffer Size (Octet 10 - Bit 6)
          Host Number of Completed Packets (Octet 10 - Bit 7)
          Read Local Version Information (Octet 14 - Bit 3)
          Read Local Supported Features (Octet 14 - Bit 5)
          Read BD ADDR (Octet 15 - Bit 1)
          Read RSSI (Octet 15 - Bit 5)
          Set Event Mask Page 2 (Octet 22 - Bit 2)
          LE Set Event Mask (Octet 25 - Bit 0)
          LE Read Buffer Size (Octet 25 - Bit 1)
          LE Read Local Supported Features (Octet 25 - Bit 2)
          LE Set Random Address (Octet 25 - Bit 4)
          LE Set Advertising Parameters (Octet 25 - Bit 5)
          LE Read Advertising Channel TX Power (Octet 25 - Bit 6)
          LE Set Advertising Data (Octet 25 - Bit 7)
          LE Set Scan Response Data (Octet 26 - Bit 0)
          LE Set Advertise Enable (Octet 26 - Bit 1)
          LE Set Scan Parameters (Octet 26 - Bit 2)
          LE Set Scan Enable (Octet 26 - Bit 3)
          LE Create Connection (Octet 26 - Bit 4)
          LE Create Connection Cancel (Octet 26 - Bit 5)
          LE Read Accept List Size (Octet 26 - Bit 6)
          LE Clear Accept List (Octet 26 - Bit 7)
          LE Add Device To Accept List (Octet 27 - Bit 0)
          LE Remove Device From Accept List (Octet 27 - Bit 1)
          LE Connection Update (Octet 27 - Bit 2)
          LE Set Host Channel Classification (Octet 27 - Bit 3)
          LE Read Channel Map (Octet 27 - Bit 4)
          LE Read Remote Used Features (Octet 27 - Bit 5)
          LE Encrypt (Octet 27 - Bit 6)
          LE Rand (Octet 27 - Bit 7)
          LE Start Encryption (Octet 28 - Bit 0)
          LE Long Term Key Request Reply (Octet 28 - Bit 1)
          LE Long Term Key Request Neg Reply (Octet 28 - Bit 2)
          LE Read Supported States (Octet 28 - Bit 3)
          LE Receiver Test (Octet 28 - Bit 4)
          LE Transmitter Test (Octet 28 - Bit 5)
          LE Test End (Octet 28 - Bit 6)
          Read Authenticated Payload Timeout (Octet 32 - Bit 4)
          Write Authenticated Payload Timeout (Octet 32 - Bit 5)
          LE Set Data Length (Octet 33 - Bit 6)
          LE Read Suggested Default Data Length (Octet 33 - Bit 7)
          LE Write Suggested Default Data Length (Octet 34 - Bit 0)
          LE Add Device To Resolving List (Octet 34 - Bit 3)
          LE Remove Device From Resolving List (Octet 34 - Bit 4)
          LE Clear Resolving List (Octet 34 - Bit 5)
          LE Read Resolving List Size (Octet 34 - Bit 6)
          LE Set Address Resolution Enable (Octet 35 - Bit 1)
          LE Set Resolvable Private Address Timeout (Octet 35 - Bit 2)
          LE Read Maximum Data Length (Octet 35 - Bit 3)
          LE Read PHY (Octet 35 - Bit 4)
          LE Set Default PHY (Octet 35 - Bit 5)
          LE Set PHY (Octet 35 - Bit 6)
          LE Enhanced Receiver Test (Octet 35 - Bit 7)
          LE Enhanced Transmitter Test (Octet 36 - Bit 0)
          LE Set Advertising Set Random Address (Octet 36 - Bit 1)
          LE Set Extended Advertising Parameters (Octet 36 - Bit 2)
          LE Set Extended Advertising Data (Octet 36 - Bit 3)
          LE Set Extended Scan Response Data (Octet 36 - Bit 4)
          LE Set Extended Advertising Enable (Octet 36 - Bit 5)
          LE Read Maximum Advertising Data Length (Octet 36 - Bit 6)
          LE Read Number of Supported Advertising Sets (Octet 36 - Bit 7)
          LE Remove Advertising Set (Octet 37 - Bit 0)
          LE Clear Advertising Sets (Octet 37 - Bit 1)
          LE Set Periodic Advertising Parameters (Octet 37 - Bit 2)
          LE Set Periodic Advertising Data (Octet 37 - Bit 3)
          LE Set Periodic Advertising Enable (Octet 37 - Bit 4)
          LE Set Extended Scan Parameters (Octet 37 - Bit 5)
          LE Set Extended Scan Enable (Octet 37 - Bit 6)
          LE Extended Create Connection (Octet 37 - Bit 7)
          LE Periodic Advertising Create Sync (Octet 38 - Bit 0)
          LE Periodic Advertising Create Sync Cancel (Octet 38 - Bit 1)
          LE Periodic Advertising Terminate Sync (Octet 38 - Bit 2)
          LE Add Device To Periodic Advertiser List (Octet 38 - Bit 3)
          LE Remove Device From Periodic Advertiser List (Octet 38 - Bit 4)
          LE Clear Periodic Advertiser List (Octet 38 - Bit 5)
          LE Read Periodic Advertiser List Size (Octet 38 - Bit 6)
          LE Read Transmit Power (Octet 38 - Bit 7)
          LE Read RF Path Compensation (Octet 39 - Bit 0)
          LE Write RF Path Compensation (Octet 39 - Bit 1)
          LE Set Privacy Mode (Octet 39 - Bit 2)
          LE Periodic Advertising Receive Enable (Octet 40 - Bit 5)
          LE Periodic Advertising Sync Transfer (Octet 40 - Bit 6)
          LE Periodic Advertising Set Info Transfer (Octet 40 - Bit 7)
          LE Periodic Advertising Sync Transfer Parameters (Octet 41 - Bit 0)
          LE Set Default Periodic Advertisng Sync Transfer Parameters (Octet 41 - Bit 1)
          LE Read Buffer v2 (Octet 41 - Bit 5)
          LE Read ISO TX Sync (Octet 41 - Bit 6)
          LE Set Connected Isochronous Group Parameters (Octet 41 - Bit 7)
          LE Set Connected Isochronous Group Parameters Test (Octet 42 - Bit 0)
          LE Create Connected Isochronous Stream (Octet 42 - Bit 1)
          LE Remove Connected Isochronous Group (Octet 42 - Bit 2)
          LE Accept Connected Isochronous Stream Request (Octet 42 - Bit 3)
          LE Reject Connected Isochronous Stream Request (Octet 42 - Bit 4)
          LE Create Broadcast Isochronous Group (Octet 42 - Bit 5)
          LE Create Broadcast Isochronous Group Test (Octet 42 - Bit 6)
          LE Terminate Broadcast Isochronous Group (Octet 42 - Bit 7)
          LE Broadcast Isochronous Group Create Sync (Octet 43 - Bit 0)
          LE Broadcast Isochronous Group Terminate Sync (Octet 43 - Bit 1)
          LE Request Peer SCA (Octet 43 - Bit 2)
          LE Setup Isochronous Data Path (Octet 43 - Bit 3)
          LE Remove Isochronous Data Path (Octet 43 - Bit 4)
          LE Isochronous Transmit Test (Octet 43 - Bit 5)
          LE Isochronous Receive Test (Octet 43 - Bit 6)
          LE Isochronous Read Test Counters (Octet 43 - Bit 7)
          LE Isochronous Read Test Counters (Octet 44 - Bit 0)
          LE Set Host Feature (Octet 44 - Bit 1)
          Octet 44 - Bit 2 
          Octet 45 - Bit 6 
          Octet 46 - Bit 0 
          Octet 46 - Bit 1 
          Octet 46 - Bit 2 
< HCI Command: Host Buffer Size (0x03|0x0033) plen 7         #9 [hci1] 1.085619
        ACL MTU: 255  ACL max packet: 16
        SCO MTU: 0    SCO max packet: 0
> HCI Event: Command Complete (0x0e) plen 4                 #10 [hci1] 1.086275
      Host Buffer Size (0x03|0x0033) ncmd 1
        Status: Success (0x00)
< HCI Command: Set Controller To Ho.. (0x03|0x0031) plen 1  #11 [hci1] 1.105622
        Flow control: ACL Data Packets (0x01)
> HCI Event: Command Complete (0x0e) plen 4                 #12 [hci1] 1.106069
      Set Controller To Host Flow Control (0x03|0x0031) ncmd 1
        Status: Success (0x00)
< HCI Command: LE Read Local Suppor.. (0x08|0x0003) plen 0  #13 [hci1] 1.125616
> HCI Event: Command Complete (0x0e) plen 12                #14 [hci1] 1.126079
      LE Read Local Supported Features (0x08|0x0003) ncmd 1
        Status: Success (0x00)
        Features: 0xfd 0x79 0x00 0xf7 0x30 0x01 0x00 0x00
          LE Encryption
          Extended Reject Indication
          Peripheral-initiated Features Exchange
          LE Ping
          LE Data Packet Length Extension
          LL Privacy
          Extended Scanner Filter Policies
          LE 2M PHY
          LE Coded PHY
          LE Extended Advertising
          LE Periodic Advertising
          Channel Selection Algorithm #2
          Periodic Advertising Sync Transfer - Sender
          Periodic Advertising Sync Transfer - Recipient
          Sleep Clock Accuracy Updates
          Connected Isochronous Stream - Central
          Connected Isochronous Stream - Peripheral
          Isochronous Broadcaster
          Synchronized Receiver
          Periodic Advertising ADI support
          Connection Subrating
          Unknown features (0x0000010000000000)
< HCI Command: LE Set Host Feature (0x08|0x0074) plen 2     #15 [hci1] 1.145637
        Bit Number: 32
          Connected Isochronous Stream (Host Support)
        Bit Value: 1
> HCI Event: Command Complete (0x0e) plen 4                 #16 [hci1] 1.146071
      LE Set Host Feature (0x08|0x0074) ncmd 1
        Status: Success (0x00)
< HCI Command: LE Read Buffer v2 (0x08|0x0060) plen 0       #17 [hci1] 1.165620
> HCI Event: Command Complete (0x0e) plen 10                #18 [hci1] 1.166053
      LE Read Buffer v2 (0x08|0x0060) ncmd 1
        Status: Success (0x00)
        ACL MTU: 27
        ACL max packet: 3
        ISO MTU: 318
        ISO max packet: 3
< HCI Command: LE Read Maximum Adve.. (0x08|0x003a) plen 0  #19 [hci1] 1.185651
> HCI Event: Command Complete (0x0e) plen 6                 #20 [hci1] 1.186100
      LE Read Maximum Advertising Data Length (0x08|0x003a) ncmd 1
        Status: Success (0x00)
        Max length: 1650
< HCI Command: LE Read Supported St.. (0x08|0x001c) plen 0  #21 [hci1] 1.205609
> HCI Event: Command Complete (0x0e) plen 12                #22 [hci1] 1.206078
      LE Read Supported States (0x08|0x001c) ncmd 1
        Status: Success (0x00)
        States: 0x000003ff3e0306ff
          Non-connectable Advertising State
          Scannable Advertising State
          Connectable Advertising State
          High Duty Cycle Directed Advertising State
          Passive Scanning State
          Active Scanning State
          Initiating State
            and Connection State (Central Role)
          Connection State (Peripheral Role)
          Scannable Advertising State
            and Passive Scanning State
          Connectable Advertising State
            and Passive Scanning State
          Non-connectable Advertising State
            and Initiating State
          Scannable Advertising State
            and Initiating State
          Active Scanning State
            and Connection State (Central Role)
          Passive Scanning State
            and Connection State (Peripheral Role)
          Active Scanning State
            and Connection State (Peripheral Role)
          Initiating State
            and Connection State (Central Role)
            and Central Role & Central Role
          Low Duty Cycle Directed Advertising State
          Connectable Advertising State
            and Initiating State
            and Central Role & Peripheral Role
          High Duty Cycle Directed Advertising State
            and Initiating State
            and Central Role & Peripheral Role
          Low Duty Cycle Directed Advertising State
            and Initiating State
            and Central Role & Peripheral Role
          Connectable Advertising State
            and Connection State (Central Role)
            and Central Role & Peripheral Role
          High Duty Cycle Directed Advertising State
            and Connection State (Central Role)
            and Central Role & Peripheral Role
          Low Duty Cycle Directed Advertising State
            and Connection State (Central Role)
            and Central Role & Peripheral Role
          Connectable Advertising State
            and Connection State (Peripheral Role)
            and Central Role & Peripheral Role
          High Duty Cycle Directed Advertising State
            and Connection State (Peripheral Role)
            and Peripheral Role & Peripheral Role
          Low Duty Cycle Directed Advertising State
            and Connection State (Peripheral Role)
            and Peripheral Role & Peripheral Role
          Initiating State
            and Connection State (Peripheral Role)
            and Central Role & Peripheral Role
< HCI Command: LE Read Maximum Data.. (0x08|0x002f) plen 0  #23 [hci1] 1.225658
> HCI Event: Command Complete (0x0e) plen 12                #24 [hci1] 1.226143
      LE Read Maximum Data Length (0x08|0x002f) ncmd 1
        Status: Success (0x00)
        Max TX octets: 251
        Max TX time: 2704
        Max RX octets: 251
        Max RX time: 2704
< HCI Command: LE Write Suggested D.. (0x08|0x0024) plen 4  #25 [hci1] 1.245614
        TX octets: 251
        TX time: 2704
> HCI Event: Command Complete (0x0e) plen 4                 #26 [hci1] 1.246056
      LE Write Suggested Default Data Length (0x08|0x0024) ncmd 1
        Status: Success (0x00)
< HCI Command: LE Read Resolving Li.. (0x08|0x002a) plen 0  #27 [hci1] 1.265620
> HCI Event: Command Complete (0x0e) plen 5                 #28 [hci1] 1.266019
      LE Read Resolving List Size (0x08|0x002a) ncmd 1
        Status: Success (0x00)
        Size: 8
< HCI Command: LE Set Event Mask (0x08|0x0001) plen 8       #29 [hci1] 1.285611
        Mask: 0x000002023f87fa5e
          LE Advertising Report
          LE Connection Update Complete
          LE Read Remote Used Features Complete
          LE Long Term Key Request
          LE Data Length Change
          LE Enhanced Connection Complete
          LE PHY Update Complete
          LE Extended Advertising Report
          LE Periodic Advertising Sync Established
          LE Periodic Advertising Report
          LE Periodic Advertising Sync Lost
          LE Extended Scan Timeout
          LE Extended Advertising Set Terminated
          LE Scan Request Received
          LE Periodic Advertising Sync Transfer Rvc
          LE CIS Established
          LE CIS Request
          LE Create BIG Complete
          LE Terminate BIG Complete
          LE BIG Sync Estabilished Complete
          LE BIG Sync Lost
          LE BIG Info Advertising Report
          Unknown mask (0x0000020000000000)
> HCI Event: Command Complete (0x0e) plen 4                 #30 [hci1] 1.286173
      LE Set Event Mask (0x08|0x0001) ncmd 1
        Status: Success (0x00)
< HCI Command: Set Event Mask (0x03|0x0001) plen 8          #31 [hci1] 1.305632
        Mask: 0x2000800002008890
          Disconnection Complete
          Encryption Change
          Read Remote Version Information Complete
          Hardware Error
          Data Buffer Overflow
          Encryption Key Refresh Complete
          LE Meta
> HCI Event: Command Complete (0x0e) plen 4                 #32 [hci1] 1.306165
      Set Event Mask (0x03|0x0001) ncmd 1
        Status: Success (0x00)
< HCI Command: Read BD ADDR (0x04|0x0009) plen 0            #33 [hci1] 1.325628
> HCI Event: Command Complete (0x0e) plen 10                #34 [hci1] 1.326065
      Read BD ADDR (0x04|0x0009) ncmd 1
        Status: Success (0x00)
        Address: 00:00:00:00:00:00 (OUI 00-00-00)
< HCI Command: LE Set Random Address (0x08|0x0005) plen 6   #35 [hci1] 1.345627
        Address: D5:B6:CC:31:DB:3B (Static)
> HCI Event: Command Complete (0x0e) plen 4                 #36 [hci1] 1.346127
      LE Set Random Address (0x08|0x0005) ncmd 1
        Status: Success (0x00)
< HCI Command: LE Set Extended Adv.. (0x08|0x0036) plen 25  #37 [hci1] 3.835900
        Handle: 0x00
        Properties: 0x0013
          Connectable
          Scannable
          Use legacy advertising PDUs: ADV_IND
        Min advertising interval: 100.000 msec (0x00a0)
        Max advertising interval: 150.000 msec (0x00f0)
        Channel map: 37, 38, 39 (0x07)
        Own address type: Random (0x01)
        Peer address type: Public (0x00)
        Peer address: 00:00:00:00:00:00 (OUI 00-00-00)
        Filter policy: Allow Scan Request from Any, Allow Connect Request from Any (0x00)
        TX power: Host has no preference (0x7f)
        Primary PHY: LE 1M (0x01)
        Secondary max skip: 0x00
        Secondary PHY: LE 1M (0x01)
        SID: 0x00
        Scan request notifications: Disabled (0x00)
> HCI Event: Command Complete (0x0e) plen 5                 #38 [hci1] 3.836695
      LE Set Extended Advertising Parameters (0x08|0x0036) ncmd 1
        Status: Success (0x00)
        TX power (selected): 0 dbm (0x00)
< HCI Command: LE Set Advertising S.. (0x08|0x0035) plen 7  #39 [hci1] 3.845873
        Advertising handle: 0x00
        Advertising random address: D5:B6:CC:31:DB:3B (Static)
> HCI Event: Command Complete (0x0e) plen 4                 #40 [hci1] 3.846406
      LE Set Advertising Set Random Address (0x08|0x0035) ncmd 1
        Status: Success (0x00)
< HCI Command: LE Set Extended Adv.. (0x08|0x0037) plen 22  #41 [hci1] 3.865709
        Handle: 0x00
        Operation: Complete extended advertising data (0x03)
        Fragment preference: Minimize fragmentation (0x01)
        Data length: 0x12
        Flags: 0x06
          LE General Discoverable Mode
          BR/EDR Not Supported
        Name (complete): Tester_F6B11A
> HCI Event: Command Complete (0x0e) plen 4                 #42 [hci1] 3.866422
      LE Set Extended Advertising Data (0x08|0x0037) ncmd 1
        Status: Success (0x00)
< HCI Command: LE Set Extended Scan.. (0x08|0x0038) plen 4  #43 [hci1] 3.885709
        Handle: 0x00
        Operation: Complete scan response data (0x03)
        Fragment preference: Minimize fragmentation (0x01)
        Data length: 0x00
> HCI Event: Command Complete (0x0e) plen 4                 #44 [hci1] 3.886139
      LE Set Extended Scan Response Data (0x08|0x0038) ncmd 1
        Status: Success (0x00)
< HCI Command: LE Set Extended Adve.. (0x08|0x0039) plen 6  #45 [hci1] 3.905704
        Extended advertising: Enabled (0x01)
        Number of sets: 1 (0x01)
        Entry 0
          Handle: 0x00
          Duration: 0 ms (0x00)
          Max ext adv events: 0
> HCI Event: Command Complete (0x0e) plen 4                 #46 [hci1] 3.906262
      LE Set Extended Advertising Enable (0x08|0x0039) ncmd 1
        Status: Success (0x00)
> HCI Event: LE Meta Event (0x3e) plen 31                   #47 [hci1] 4.018949
      LE Enhanced Connection Complete (0x0a)
        Status: Success (0x00)
        Handle: 471
        Role: Peripheral (0x01)
        Peer address type: Public (0x00)
        Peer address: DF:A9:FF:F6:B1:1A (OUI DF-A9-FF)
        Local resolvable private address: 00:00:00:00:00:00 (Non-Resolvable)
        Peer resolvable private address: 00:00:00:00:00:00 (Non-Resolvable)
        Connection interval: 87.50 msec (0x0046)
        Connection latency: 0 (0x0000)
        Supervision timeout: 25120 msec (0x09d0)
        Central clock accuracy: 0x01
> HCI Event: LE Meta Event (0x3e) plen 6                    #48 [hci1] 4.019041
      LE Advertising Set Terminated (0x12)
        Status: Success (0x00)
        Handle: 0
        Connection handle: 471
        Number of completed extended advertising events: 0
< HCI Command: LE Read Remote Used... (0x08|0x0016) plen 2  #49 [hci1] 4.025916
        Handle: 471 Address: DF:A9:FF:F6:B1:1A (OUI DF-A9-FF)
< ACL Data TX: Handle 471 flags 0x00 dlen 7                 #50 [hci1] 4.025922
      ATT: Exchange MTU Request (0x02) len 2
        Client RX MTU: 251
> HCI Event: Command Status (0x0f) plen 4                   #51 [hci1] 4.026416
      LE Read Remote Used Features (0x08|0x0016) ncmd 1
        Status: Success (0x00)
> HCI Event: Number of Completed Packets (0x13) plen 5      #52 [hci1] 4.194988
        Num handles: 1
        Handle: 471 Address: DF:A9:FF:F6:B1:1A (OUI DF-A9-FF)
        Count: 1
        #50: len 7 (0 Kb/s)
        Latency: 169 msec (169-169 msec ~169 msec)
> HCI Event: LE Meta Event (0x3e) plen 12                   #53 [hci1] 4.282856
      LE Read Remote Used Features (0x04)
        Status: Success (0x00)
        Handle: 471 Address: DF:A9:FF:F6:B1:1A (OUI DF-A9-FF)
        Features: 0x2d 0x49 0x00 0xf7 0x67 0xd9 0x00 0x80
          LE Encryption
          Extended Reject Indication
          Peripheral-initiated Features Exchange
          LE Data Packet Length Extension
          LE 2M PHY
          LE Coded PHY
          Channel Selection Algorithm #2
          Periodic Advertising Sync Transfer - Sender
          Periodic Advertising Sync Transfer - Recipient
          Sleep Clock Accuracy Updates
          Connected Isochronous Stream - Central
          Connected Isochronous Stream - Peripheral
          Isochronous Broadcaster
          Synchronized Receiver
          Connected Isochronous Stream (Host Support)
          LE Power Control Request
          LE Power Control Request
          Connection Subrating
          Connection Subrating (Host Support)
          Unknown features (0x8000d90000000000)
> ACL Data RX: Handle 471 flags 0x02 dlen 11                #54 [hci1] 6.732646
      SMP: Pairing Request (0x01) len 6
        IO capability: KeyboardDisplay (0x04)
        OOB data: Authentication data not present (0x00)
        Authentication requirement: Bonding, MITM, SC, No Keypresses (0x0d)
        Max encryption key size: 16
        Initiator key distribution: EncKey IdKey (0x03)
        Responder key distribution: EncKey IdKey Sign (0x07)
> ACL Data RX: Handle 471 flags 0x02 dlen 7                 #55 [hci1] 6.732985
      ATT: Exchange MTU Response (0x03) len 2
        Server RX MTU: 23
< HCI Command: Host Number of Compl.. (0x03|0x0035) plen 5  #56 [hci1] 6.746022
        Num handles: 1
        Handle: 471 Address: DF:A9:FF:F6:B1:1A (OUI DF-A9-FF)
        Count: 1
< ACL Data TX: Handle 471 flags 0x00 dlen 11                #57 [hci1] 6.746093
      SMP: Pairing Response (0x02) len 6
        IO capability: DisplayOnly (0x00)
        OOB data: Authentication data not present (0x00)
        Authentication requirement: Bonding, No MITM, SC, No Keypresses (0x09)
        Max encryption key size: 16
        Initiator key distribution: IdKey (0x02)
        Responder key distribution: <none> (0x00)
< HCI Command: Host Number of Compl.. (0x03|0x0035) plen 5  #58 [hci1] 6.746370
        Num handles: 1
        Handle: 471 Address: DF:A9:FF:F6:B1:1A (OUI DF-A9-FF)
        Count: 1
> HCI Event: Number of Completed Packets (0x13) plen 5      #59 [hci1] 6.907716
        Num handles: 1
        Handle: 471 Address: DF:A9:FF:F6:B1:1A (OUI DF-A9-FF)
        Count: 1
        #57: len 11 (0 Kb/s)
        Latency: 161 msec (161-169 msec ~165 msec)
> ACL Data RX: Handle 471 flags 0x02 dlen 27                #60 [hci1] 6.907953
> ACL Data RX: Handle 471 flags 0x01 dlen 27                #61 [hci1] 6.908506
> ACL Data RX: Handle 471 flags 0x01 dlen 15                #62 [hci1] 6.908891
      SMP: Pairing Public Key (0x0c) len 64
        X: d0780cf25c398d4ca00b3ce6ae12a035ecdba2f401546022f0649a219d9e6fb8
        Y: ead13feb20932aff2d54fb49752ca85403626e035a60a278df04241b636408b8
< HCI Command: Host Number of Compl.. (0x03|0x0035) plen 5  #63 [hci1] 6.926561
        Num handles: 1
        Handle: 471 Address: DF:A9:FF:F6:B1:1A (OUI DF-A9-FF)
        Count: 1
< HCI Command: Host Number of Compl.. (0x03|0x0035) plen 5  #64 [hci1] 6.926765
        Num handles: 1
        Handle: 471 Address: DF:A9:FF:F6:B1:1A (OUI DF-A9-FF)
        Count: 1
< HCI Command: Host Number of Compl.. (0x03|0x0035) plen 5  #65 [hci1] 6.927082
        Num handles: 1
        Handle: 471 Address: DF:A9:FF:F6:B1:1A (OUI DF-A9-FF)
        Count: 1
< ACL Data TX: Handle 471 flags 0x00 dlen 27                #66 [hci1] 6.927214
< ACL Data TX: Handle 471 flags 0x01 dlen 27                #67 [hci1] 6.927245
< ACL Data TX: Handle 471 flags 0x01 dlen 15                #68 [hci1] 6.927287
      SMP: Pairing Public Key (0x0c) len 64
        X: 98308440221e2d910f0e54b71e7ec652857aa9b5a0dc65028824cc19db1226e9
        Y: 67a4816bcb62efb21701e31fdb27561a6217575fb007a8bbdabe7e28b6f68482
> HCI Event: Number of Completed Packets (0x13) plen 5      #69 [hci1] 6.995490
        Num handles: 1
        Handle: 471 Address: DF:A9:FF:F6:B1:1A (OUI DF-A9-FF)
        Count: 1
        #66: len 27 (3 Kb/s)
        Latency: 68 msec (68-169 msec ~116 msec)
> HCI Event: Number of Completed Packets (0x13) plen 5      #70 [hci1] 6.996149
        Num handles: 1
        Handle: 471 Address: DF:A9:FF:F6:B1:1A (OUI DF-A9-FF)
        Count: 1
        #67: len 27 (3 Kb/s)
        Latency: 68 msec (68-169 msec ~92 msec)
> HCI Event: Number of Completed Packets (0x13) plen 5      #71 [hci1] 7.082307
        Num handles: 1
        Handle: 471 Address: DF:A9:FF:F6:B1:1A (OUI DF-A9-FF)
        Count: 1
        #68: len 15 (0 Kb/s)
        Latency: 155 msec (68-169 msec ~123 msec)
> ACL Data RX: Handle 471 flags 0x02 dlen 21                #72 [hci1] 8.132670
      SMP: Pairing Confirm (0x03) len 16
        Confim value: 9dad2d4edcf8f6b479f32b485036ce15
< HCI Command: Host Number of Compl.. (0x03|0x0035) plen 5  #73 [hci1] 8.145966
        Num handles: 1
        Handle: 471 Address: DF:A9:FF:F6:B1:1A (OUI DF-A9-FF)
        Count: 1
< ACL Data TX: Handle 471 flags 0x00 dlen 21                #74 [hci1] 8.146061
      SMP: Pairing Confirm (0x03) len 16
        Confim value: c09150a9e7736673dc4a6736ad5a4aff
> HCI Event: Number of Completed Packets (0x13) plen 5      #75 [hci1] 8.307560
        Num handles: 1
        Handle: 471 Address: DF:A9:FF:F6:B1:1A (OUI DF-A9-FF)
        Count: 1
        #74: len 21 (1 Kb/s)
        Latency: 161 msec (68-169 msec ~142 msec)
> ACL Data RX: Handle 471 flags 0x02 dlen 21                #76 [hci1] 8.307910
      SMP: Pairing Random (0x04) len 16
        Random value: 2583c677d669316e0000000000000000
< HCI Command: Host Number of Compl.. (0x03|0x0035) plen 5  #77 [hci1] 8.326393
        Num handles: 1
        Handle: 471 Address: DF:A9:FF:F6:B1:1A (OUI DF-A9-FF)
        Count: 1
< ACL Data TX: Handle 471 flags 0x00 dlen 21                #78 [hci1] 8.326473
      SMP: Pairing Random (0x04) len 16
        Random value: 8e6108f966a694cbe26df70bb96773e6
> HCI Event: Number of Completed Packets (0x13) plen 5      #79 [hci1] 8.482358
        Num handles: 1
        Handle: 471 Address: DF:A9:FF:F6:B1:1A (OUI DF-A9-FF)
        Count: 1
        #78: len 21 (1 Kb/s)
        Latency: 155 msec (68-169 msec ~149 msec)
> ACL Data RX: Handle 471 flags 0x02 dlen 21                #80 [hci1] 8.570187
      SMP: Pairing Confirm (0x03) len 16
        Confim value: db496919db2b60fdc46e16828064f646
< HCI Command: Host Number of Compl.. (0x03|0x0035) plen 5  #81 [hci1] 8.586371
        Num handles: 1
        Handle: 471 Address: DF:A9:FF:F6:B1:1A (OUI DF-A9-FF)
        Count: 1
< ACL Data TX: Handle 471 flags 0x00 dlen 21                #82 [hci1] 8.586521
      SMP: Pairing Confirm (0x03) len 16
        Confim value: c21160ce7d327a40ff3e659695b29a36
> HCI Event: Number of Completed Packets (0x13) plen 5      #83 [hci1] 8.745077
        Num handles: 1
        Handle: 471 Address: DF:A9:FF:F6:B1:1A (OUI DF-A9-FF)
        Count: 1
        #82: len 21 (1 Kb/s)
        Latency: 158 msec (68-169 msec ~153 msec)
> ACL Data RX: Handle 471 flags 0x02 dlen 21                #84 [hci1] 8.745419
      SMP: Pairing Random (0x04) len 16
        Random value: ba8bfda3b3481aa50000000000000000
< HCI Command: Host Number of Compl.. (0x03|0x0035) plen 5  #85 [hci1] 8.746431
        Num handles: 1
        Handle: 471 Address: DF:A9:FF:F6:B1:1A (OUI DF-A9-FF)
        Count: 1
< ACL Data TX: Handle 471 flags 0x00 dlen 21                #86 [hci1] 8.746553
      SMP: Pairing Random (0x04) len 16
        Random value: 4d02679f89a05211af56d8b3da64d21e
> HCI Event: Number of Completed Packets (0x13) plen 5      #87 [hci1] 8.919859
        Num handles: 1
        Handle: 471 Address: DF:A9:FF:F6:B1:1A (OUI DF-A9-FF)
        Count: 1
        #86: len 21 (0 Kb/s)
        Latency: 173 msec (68-173 msec ~163 msec)
> ACL Data RX: Handle 471 flags 0x02 dlen 21                #88 [hci1] 9.007694
      SMP: Pairing Confirm (0x03) len 16
        Confim value: 926d008cc9ebde4c39c3a4ae3824a09f
< HCI Command: Host Number of Compl.. (0x03|0x0035) plen 5  #89 [hci1] 9.026345
        Num handles: 1
        Handle: 471 Address: DF:A9:FF:F6:B1:1A (OUI DF-A9-FF)
        Count: 1
< ACL Data TX: Handle 471 flags 0x00 dlen 21                #90 [hci1] 9.026475
      SMP: Pairing Confirm (0x03) len 16
        Confim value: baf4ff631e31b548f22d69af1509e4e8
> HCI Event: Number of Completed Packets (0x13) plen 5      #91 [hci1] 9.182552
        Num handles: 1
        Handle: 471 Address: DF:A9:FF:F6:B1:1A (OUI DF-A9-FF)
        Count: 1
        #90: len 21 (1 Kb/s)
        Latency: 156 msec (68-173 msec ~159 msec)
> ACL Data RX: Handle 471 flags 0x02 dlen 21                #92 [hci1] 9.182847
      SMP: Pairing Random (0x04) len 16
        Random value: b2513a3467c454300000000000000000
< HCI Command: Host Number of Compl.. (0x03|0x0035) plen 5  #93 [hci1] 9.186032
        Num handles: 1
        Handle: 471 Address: DF:A9:FF:F6:B1:1A (OUI DF-A9-FF)
        Count: 1
< ACL Data TX: Handle 471 flags 0x00 dlen 21                #94 [hci1] 9.186077
      SMP: Pairing Random (0x04) len 16
        Random value: 5e8286bc235a02440d0c3424a2acf8fd
> HCI Event: Number of Completed Packets (0x13) plen 5      #95 [hci1] 9.357331
        Num handles: 1
        Handle: 471 Address: DF:A9:FF:F6:B1:1A (OUI DF-A9-FF)
        Count: 1
        #94: len 21 (0 Kb/s)
        Latency: 171 msec (68-173 msec ~165 msec)
> ACL Data RX: Handle 471 flags 0x02 dlen 21                #96 [hci1] 9.445145
      SMP: Pairing Confirm (0x03) len 16
        Confim value: c92ac12719520cc3969994e879179398
< HCI Command: Host Number of Compl.. (0x03|0x0035) plen 5  #97 [hci1] 9.446128
        Num handles: 1
        Handle: 471 Address: DF:A9:FF:F6:B1:1A (OUI DF-A9-FF)
        Count: 1
< ACL Data TX: Handle 471 flags 0x00 dlen 21                #98 [hci1] 9.446372
      SMP: Pairing Confirm (0x03) len 16
        Confim value: b93c0d81ab71a21ecf48514cc139d255
> HCI Event: Number of Completed Packets (0x13) plen 5      #99 [hci1] 9.619984
        Num handles: 1
        Handle: 471 Address: DF:A9:FF:F6:B1:1A (OUI DF-A9-FF)
        Count: 1
        #98: len 21 (0 Kb/s)
        Latency: 173 msec (68-173 msec ~169 msec)
> ACL Data RX: Handle 471 flags 0x02 dlen 21               #100 [hci1] 9.620362
      SMP: Pairing Random (0x04) len 16
        Random value: 85d156f65d2ebe110000000000000000
< HCI Command: Host Number of Comp.. (0x03|0x0035) plen 5  #101 [hci1] 9.626057
        Num handles: 1
        Handle: 471 Address: DF:A9:FF:F6:B1:1A (OUI DF-A9-FF)
        Count: 1
< ACL Data TX: Handle 471 flags 0x00 dlen 21               #102 [hci1] 9.626107
      SMP: Pairing Random (0x04) len 16
        Random value: 5c4a1bcadd27bd58e945097b00bad7ac
> HCI Event: Number of Completed Packets (0x13) plen 5     #103 [hci1] 9.794794
        Num handles: 1
        Handle: 471 Address: DF:A9:FF:F6:B1:1A (OUI DF-A9-FF)
        Count: 1
        #102: len 21 (1 Kb/s)
        Latency: 168 msec (68-173 msec ~169 msec)
> ACL Data RX: Handle 471 flags 0x02 dlen 21               #104 [hci1] 9.882759
      SMP: Pairing Confirm (0x03) len 16
        Confim value: 19cdc726e2d705042afe9f9f8db44aa7
< HCI Command: Host Number of Comp.. (0x03|0x0035) plen 5  #105 [hci1] 9.886401
        Num handles: 1
        Handle: 471 Address: DF:A9:FF:F6:B1:1A (OUI DF-A9-FF)
        Count: 1
< ACL Data TX: Handle 471 flags 0x00 dlen 21               #106 [hci1] 9.886562
      SMP: Pairing Confirm (0x03) len 16
        Confim value: a0e5d9cc23d7a117d58558d4792922ea
> HCI Event: Number of Completed Packets (0x13) plen 5    #107 [hci1] 10.057525
        Num handles: 1
        Handle: 471 Address: DF:A9:FF:F6:B1:1A (OUI DF-A9-FF)
        Count: 1
        #106: len 21 (0 Kb/s)
        Latency: 170 msec (68-173 msec ~170 msec)
> ACL Data RX: Handle 471 flags 0x02 dlen 21              #108 [hci1] 10.057959
      SMP: Pairing Random (0x04) len 16
        Random value: 3ea2393e3e839d660000000000000000
< HCI Command: Host Number of Com.. (0x03|0x0035) plen 5  #109 [hci1] 10.066493
        Num handles: 1
        Handle: 471 Address: DF:A9:FF:F6:B1:1A (OUI DF-A9-FF)
        Count: 1
< ACL Data TX: Handle 471 flags 0x00 dlen 21              #110 [hci1] 10.066641
      SMP: Pairing Random (0x04) len 16
        Random value: 32527e6e64e79f33b2e374394db8ab2d
> HCI Event: Number of Completed Packets (0x13) plen 5    #111 [hci1] 10.232540
        Num handles: 1
        Handle: 471 Address: DF:A9:FF:F6:B1:1A (OUI DF-A9-FF)
        Count: 1
        #110: len 21 (1 Kb/s)
        Latency: 165 msec (68-173 msec ~167 msec)
> ACL Data RX: Handle 471 flags 0x02 dlen 21              #112 [hci1] 10.232931
      SMP: Pairing Confirm (0x03) len 16
        Confim value: b0f2bfd65a5b5afc80facddec3d6ede4
< HCI Command: Host Number of Com.. (0x03|0x0035) plen 5  #113 [hci1] 10.245919
        Num handles: 1
        Handle: 471 Address: DF:A9:FF:F6:B1:1A (OUI DF-A9-FF)
        Count: 1
< ACL Data TX: Handle 471 flags 0x00 dlen 21              #114 [hci1] 10.245949
      SMP: Pairing Confirm (0x03) len 16
        Confim value: 49220c04fe968d80cd3f6eabe85ba77e
> HCI Event: Number of Completed Packets (0x13) plen 5    #115 [hci1] 10.407485
        Num handles: 1
        Handle: 471 Address: DF:A9:FF:F6:B1:1A (OUI DF-A9-FF)
        Count: 1
        #114: len 21 (1 Kb/s)
        Latency: 161 msec (68-173 msec ~164 msec)
> ACL Data RX: Handle 471 flags 0x02 dlen 21              #116 [hci1] 10.407942
      SMP: Pairing Random (0x04) len 16
        Random value: eb9ff88146753de80000000000000000
< HCI Command: Host Number of Com.. (0x03|0x0035) plen 5  #117 [hci1] 10.426360
        Num handles: 1
        Handle: 471 Address: DF:A9:FF:F6:B1:1A (OUI DF-A9-FF)
        Count: 1
< ACL Data TX: Handle 471 flags 0x00 dlen 21              #118 [hci1] 10.426462
      SMP: Pairing Random (0x04) len 16
        Random value: dddbdfe2838e9a8cc6964353c850fef7
> HCI Event: Number of Completed Packets (0x13) plen 5    #119 [hci1] 10.582332
        Num handles: 1
        Handle: 471 Address: DF:A9:FF:F6:B1:1A (OUI DF-A9-FF)
        Count: 1
        #118: len 21 (1 Kb/s)
        Latency: 155 msec (68-173 msec ~160 msec)
> ACL Data RX: Handle 471 flags 0x02 dlen 21              #120 [hci1] 10.670155
      SMP: Pairing Confirm (0x03) len 16
        Confim value: e2f9ee213ee2bbfaa23365e6cb8c4395
< HCI Command: Host Number of Com.. (0x03|0x0035) plen 5  #121 [hci1] 10.685929
        Num handles: 1
        Handle: 471 Address: DF:A9:FF:F6:B1:1A (OUI DF-A9-FF)
        Count: 1
< ACL Data TX: Handle 471 flags 0x00 dlen 21              #122 [hci1] 10.686015
      SMP: Pairing Confirm (0x03) len 16
        Confim value: 8ced2ec3764f0e24ca9a74aa8d20665a
> HCI Event: Number of Completed Packets (0x13) plen 5    #123 [hci1] 10.844953
        Num handles: 1
        Handle: 471 Address: DF:A9:FF:F6:B1:1A (OUI DF-A9-FF)
        Count: 1
        #122: len 21 (1 Kb/s)
        Latency: 158 msec (68-173 msec ~159 msec)
> ACL Data RX: Handle 471 flags 0x02 dlen 21              #124 [hci1] 10.845394
      SMP: Pairing Random (0x04) len 16
        Random value: 211a00b2268265250000000000000000
< HCI Command: Host Number of Com.. (0x03|0x0035) plen 5  #125 [hci1] 10.846401
        Num handles: 1
        Handle: 471 Address: DF:A9:FF:F6:B1:1A (OUI DF-A9-FF)
        Count: 1
< ACL Data TX: Handle 471 flags 0x00 dlen 21              #126 [hci1] 10.846472
      SMP: Pairing Random (0x04) len 16
        Random value: eb9f1915536596b6fc3db1c86b2b1970
> HCI Event: Number of Completed Packets (0x13) plen 5    #127 [hci1] 11.019725
        Num handles: 1
        Handle: 471 Address: DF:A9:FF:F6:B1:1A (OUI DF-A9-FF)
        Count: 1
        #126: len 21 (0 Kb/s)
        Latency: 173 msec (68-173 msec ~166 msec)
> ACL Data RX: Handle 471 flags 0x02 dlen 21              #128 [hci1] 11.107661
      SMP: Pairing Confirm (0x03) len 16
        Confim value: 5a6256bffee1d6f3604d255f92779805
< HCI Command: Host Number of Com.. (0x03|0x0035) plen 5  #129 [hci1] 11.126070
        Num handles: 1
        Handle: 471 Address: DF:A9:FF:F6:B1:1A (OUI DF-A9-FF)
        Count: 1
< ACL Data TX: Handle 471 flags 0x00 dlen 21              #130 [hci1] 11.126127
      SMP: Pairing Confirm (0x03) len 16
        Confim value: c8139177ee5b41d78006b0434cd18c69
> HCI Event: Number of Completed Packets (0x13) plen 5    #131 [hci1] 11.282528
        Num handles: 1
        Handle: 471 Address: DF:A9:FF:F6:B1:1A (OUI DF-A9-FF)
        Count: 1
        #130: len 21 (1 Kb/s)
        Latency: 156 msec (68-173 msec ~161 msec)
> ACL Data RX: Handle 471 flags 0x02 dlen 21              #132 [hci1] 11.282936
      SMP: Pairing Random (0x04) len 16
        Random value: c4bc43b74ad9fba90000000000000000
< HCI Command: Host Number of Com.. (0x03|0x0035) plen 5  #133 [hci1] 11.286601
        Num handles: 1
        Handle: 471 Address: DF:A9:FF:F6:B1:1A (OUI DF-A9-FF)
        Count: 1
< ACL Data TX: Handle 471 flags 0x00 dlen 21              #134 [hci1] 11.286757
      SMP: Pairing Random (0x04) len 16
        Random value: 5c794dc9ad9f2c3f295ebd5ad5e1c3cf
> HCI Event: Number of Completed Packets (0x13) plen 5    #135 [hci1] 11.457262
        Num handles: 1
        Handle: 471 Address: DF:A9:FF:F6:B1:1A (OUI DF-A9-FF)
        Count: 1
        #134: len 21 (0 Kb/s)
        Latency: 170 msec (68-173 msec ~165 msec)
> ACL Data RX: Handle 471 flags 0x02 dlen 21              #136 [hci1] 11.545122
      SMP: Pairing Confirm (0x03) len 16
        Confim value: 2c7b9b546b554689f30e931d3991381c
< HCI Command: Host Number of Com.. (0x03|0x0035) plen 5  #137 [hci1] 11.546340
        Num handles: 1
        Handle: 471 Address: DF:A9:FF:F6:B1:1A (OUI DF-A9-FF)
        Count: 1
< ACL Data TX: Handle 471 flags 0x00 dlen 21              #138 [hci1] 11.546390
      SMP: Pairing Confirm (0x03) len 16
        Confim value: a5b47b05e9d09344ecf623119340724f
> HCI Event: Number of Completed Packets (0x13) plen 5    #139 [hci1] 11.719990
        Num handles: 1
        Handle: 471 Address: DF:A9:FF:F6:B1:1A (OUI DF-A9-FF)
        Count: 1
        #138: len 21 (0 Kb/s)
        Latency: 173 msec (68-173 msec ~169 msec)
> ACL Data RX: Handle 471 flags 0x02 dlen 21              #140 [hci1] 11.720258
      SMP: Pairing Random (0x04) len 16
        Random value: 7002427052a40dd40000000000000000
< HCI Command: Host Number of Com.. (0x03|0x0035) plen 5  #141 [hci1] 11.725962
        Num handles: 1
        Handle: 471 Address: DF:A9:FF:F6:B1:1A (OUI DF-A9-FF)
        Count: 1
< ACL Data TX: Handle 471 flags 0x00 dlen 21              #142 [hci1] 11.726000
      SMP: Pairing Random (0x04) len 16
        Random value: 5c2fff312cdf99c9491988e877355a9a
> HCI Event: Number of Completed Packets (0x13) plen 5    #143 [hci1] 11.894799
        Num handles: 1
        Handle: 471 Address: DF:A9:FF:F6:B1:1A (OUI DF-A9-FF)
        Count: 1
        #142: len 21 (1 Kb/s)
        Latency: 168 msec (68-173 msec ~169 msec)
> ACL Data RX: Handle 471 flags 0x02 dlen 21              #144 [hci1] 11.982663
      SMP: Pairing Confirm (0x03) len 16
        Confim value: ae0769ea67a0ca45ae373ec97ab187f6
< HCI Command: Host Number of Com.. (0x03|0x0035) plen 5  #145 [hci1] 11.986457
        Num handles: 1
        Handle: 471 Address: DF:A9:FF:F6:B1:1A (OUI DF-A9-FF)
        Count: 1
< ACL Data TX: Handle 471 flags 0x00 dlen 21              #146 [hci1] 11.986714
      SMP: Pairing Confirm (0x03) len 16
        Confim value: bcc54b2acda03662902d2f7f0a74815e
> HCI Event: Number of Completed Packets (0x13) plen 5    #147 [hci1] 12.157502
        Num handles: 1
        Handle: 471 Address: DF:A9:FF:F6:B1:1A (OUI DF-A9-FF)
        Count: 1
        #146: len 21 (0 Kb/s)
        Latency: 170 msec (68-173 msec ~170 msec)
> ACL Data RX: Handle 471 flags 0x02 dlen 21              #148 [hci1] 12.157869
      SMP: Pairing Random (0x04) len 16
        Random value: 1f7cba57f041c6410000000000000000
< HCI Command: Host Number of Com.. (0x03|0x0035) plen 5  #149 [hci1] 12.166092
        Num handles: 1
        Handle: 471 Address: DF:A9:FF:F6:B1:1A (OUI DF-A9-FF)
        Count: 1
< ACL Data TX: Handle 471 flags 0x00 dlen 21              #150 [hci1] 12.166141
      SMP: Pairing Random (0x04) len 16
        Random value: c629a3a987d808e808655d558dfc1155
> HCI Event: Number of Completed Packets (0x13) plen 5    #151 [hci1] 12.332256
        Num handles: 1
        Handle: 471 Address: DF:A9:FF:F6:B1:1A (OUI DF-A9-FF)
        Count: 1
        #150: len 21 (1 Kb/s)
        Latency: 166 msec (68-173 msec ~168 msec)
> ACL Data RX: Handle 471 flags 0x02 dlen 21              #152 [hci1] 12.420103
      SMP: Pairing Confirm (0x03) len 16
        Confim value: 732781d86a3b760b9b4fae06b3a318ab
< HCI Command: Host Number of Com.. (0x03|0x0035) plen 5  #153 [hci1] 12.426003
        Num handles: 1
        Handle: 471 Address: DF:A9:FF:F6:B1:1A (OUI DF-A9-FF)
        Count: 1
< ACL Data TX: Handle 471 flags 0x00 dlen 21              #154 [hci1] 12.426015
      SMP: Pairing Confirm (0x03) len 16
        Confim value: 52d4773be8e753e4e43f8f6f16f54570
> HCI Event: Number of Completed Packets (0x13) plen 5    #155 [hci1] 12.594967
        Num handles: 1
        Handle: 471 Address: DF:A9:FF:F6:B1:1A (OUI DF-A9-FF)
        Count: 1
        #154: len 21 (1 Kb/s)
        Latency: 168 msec (68-173 msec ~168 msec)
> ACL Data RX: Handle 471 flags 0x02 dlen 21              #156 [hci1] 12.595281
      SMP: Pairing Random (0x04) len 16
        Random value: 2398452d6131322e0000000000000000
< HCI Command: Host Number of Com.. (0x03|0x0035) plen 5  #157 [hci1] 12.606652
        Num handles: 1
        Handle: 471 Address: DF:A9:FF:F6:B1:1A (OUI DF-A9-FF)
        Count: 1
< ACL Data TX: Handle 471 flags 0x00 dlen 21              #158 [hci1] 12.606750
      SMP: Pairing Random (0x04) len 16
        Random value: 92f20f6ad8f13724432c7fd6001c45ff
> HCI Event: Number of Completed Packets (0x13) plen 5    #159 [hci1] 12.769889
        Num handles: 1
        Handle: 471 Address: DF:A9:FF:F6:B1:1A (OUI DF-A9-FF)
        Count: 1
        #158: len 21 (1 Kb/s)
        Latency: 163 msec (68-173 msec ~165 msec)
> ACL Data RX: Handle 471 flags 0x02 dlen 21              #160 [hci1] 12.857675
      SMP: Pairing Confirm (0x03) len 16
        Confim value: 2f4fdbc76590ffc66992e2dca0660f0f
< HCI Command: Host Number of Com.. (0x03|0x0035) plen 5  #161 [hci1] 12.866364
        Num handles: 1
        Handle: 471 Address: DF:A9:FF:F6:B1:1A (OUI DF-A9-FF)
        Count: 1
< ACL Data TX: Handle 471 flags 0x00 dlen 21              #162 [hci1] 12.866452
      SMP: Pairing Confirm (0x03) len 16
        Confim value: b0f19ba4f4b49fc49b67adce9c159fda
> HCI Event: Number of Completed Packets (0x13) plen 5    #163 [hci1] 13.032504
        Num handles: 1
        Handle: 471 Address: DF:A9:FF:F6:B1:1A (OUI DF-A9-FF)
        Count: 1
        #162: len 21 (1 Kb/s)
        Latency: 166 msec (68-173 msec ~165 msec)
> ACL Data RX: Handle 471 flags 0x02 dlen 21              #164 [hci1] 13.032787
      SMP: Pairing Random (0x04) len 16
        Random value: d4b2af857d6aba160000000000000000
< HCI Command: Host Number of Com.. (0x03|0x0035) plen 5  #165 [hci1] 13.046637
        Num handles: 1
        Handle: 471 Address: DF:A9:FF:F6:B1:1A (OUI DF-A9-FF)
        Count: 1
< ACL Data TX: Handle 471 flags 0x00 dlen 21              #166 [hci1] 13.046837
      SMP: Pairing Random (0x04) len 16
        Random value: 23ac32ebbb5e14c8a6b9622f296d277f
> HCI Event: Number of Completed Packets (0x13) plen 5    #167 [hci1] 13.207252
        Num handles: 1
        Handle: 471 Address: DF:A9:FF:F6:B1:1A (OUI DF-A9-FF)
        Count: 1
        #166: len 21 (1 Kb/s)
        Latency: 160 msec (68-173 msec ~163 msec)
> ACL Data RX: Handle 471 flags 0x02 dlen 21              #168 [hci1] 13.295147
      SMP: Pairing Confirm (0x03) len 16
        Confim value: f3c96d2f28586e473353489e4e76f385
< HCI Command: Host Number of Com.. (0x03|0x0035) plen 5  #169 [hci1] 13.306544
        Num handles: 1
        Handle: 471 Address: DF:A9:FF:F6:B1:1A (OUI DF-A9-FF)
        Count: 1
< ACL Data TX: Handle 471 flags 0x00 dlen 21              #170 [hci1] 13.306709
      SMP: Pairing Confirm (0x03) len 16
        Confim value: 94e65038d0a18ffea1a241f27a2bfa93
> HCI Event: Number of Completed Packets (0x13) plen 5    #171 [hci1] 13.469940
        Num handles: 1
        Handle: 471 Address: DF:A9:FF:F6:B1:1A (OUI DF-A9-FF)
        Count: 1
        #170: len 21 (1 Kb/s)
        Latency: 163 msec (68-173 msec ~163 msec)
> ACL Data RX: Handle 471 flags 0x02 dlen 21              #172 [hci1] 13.470258
      SMP: Pairing Random (0x04) len 16
        Random value: 2fe29a9ef19189b20000000000000000
< HCI Command: Host Number of Com.. (0x03|0x0035) plen 5  #173 [hci1] 13.486587
        Num handles: 1
        Handle: 471 Address: DF:A9:FF:F6:B1:1A (OUI DF-A9-FF)
        Count: 1
< ACL Data TX: Handle 471 flags 0x00 dlen 21              #174 [hci1] 13.486738
      SMP: Pairing Random (0x04) len 16
        Random value: 297efe85e67448a15f56bd27e3a3cf1d
> HCI Event: Number of Completed Packets (0x13) plen 5    #175 [hci1] 13.644858
        Num handles: 1
        Handle: 471 Address: DF:A9:FF:F6:B1:1A (OUI DF-A9-FF)
        Count: 1
        #174: len 21 (1 Kb/s)
        Latency: 158 msec (68-173 msec ~160 msec)
> ACL Data RX: Handle 471 flags 0x02 dlen 21              #176 [hci1] 13.732608
      SMP: Pairing Confirm (0x03) len 16
        Confim value: abf42ff8091a4a8002b7487c25016c57
< HCI Command: Host Number of Com.. (0x03|0x0035) plen 5  #177 [hci1] 13.746014
        Num handles: 1
        Handle: 471 Address: DF:A9:FF:F6:B1:1A (OUI DF-A9-FF)
        Count: 1
< ACL Data TX: Handle 471 flags 0x00 dlen 21              #178 [hci1] 13.746024
      SMP: Pairing Confirm (0x03) len 16
        Confim value: e8a8003729ba9f50cc0a335532e39c64
> HCI Event: Number of Completed Packets (0x13) plen 5    #179 [hci1] 13.907394
        Num handles: 1
        Handle: 471 Address: DF:A9:FF:F6:B1:1A (OUI DF-A9-FF)
        Count: 1
        #178: len 21 (1 Kb/s)
        Latency: 161 msec (68-173 msec ~161 msec)
> ACL Data RX: Handle 471 flags 0x02 dlen 21              #180 [hci1] 13.907893
      SMP: Pairing Random (0x04) len 16
        Random value: 55d3d897dbcef8100000000000000000
< HCI Command: Host Number of Com.. (0x03|0x0035) plen 5  #181 [hci1] 13.926697
        Num handles: 1
        Handle: 471 Address: DF:A9:FF:F6:B1:1A (OUI DF-A9-FF)
        Count: 1
< ACL Data TX: Handle 471 flags 0x00 dlen 21              #182 [hci1] 13.926884
      SMP: Pairing Random (0x04) len 16
        Random value: 25a9493fd3ce4faf02be7293595bb7c6
> HCI Event: Number of Completed Packets (0x13) plen 5    #183 [hci1] 14.082230
        Num handles: 1
        Handle: 471 Address: DF:A9:FF:F6:B1:1A (OUI DF-A9-FF)
        Count: 1
        #182: len 21 (1 Kb/s)
        Latency: 155 msec (68-173 msec ~158 msec)
> ACL Data RX: Handle 471 flags 0x02 dlen 21              #184 [hci1] 14.170053
      SMP: Pairing Confirm (0x03) len 16
        Confim value: f8f35db9081e0c2a57f54f15a0357a83
< HCI Command: Host Number of Com.. (0x03|0x0035) plen 5  #185 [hci1] 14.186302
        Num handles: 1
        Handle: 471 Address: DF:A9:FF:F6:B1:1A (OUI DF-A9-FF)
        Count: 1
< ACL Data TX: Handle 471 flags 0x00 dlen 21              #186 [hci1] 14.186431
      SMP: Pairing Confirm (0x03) len 16
        Confim value: 950e5532610cddfb04aca682341f3b11
> HCI Event: Number of Completed Packets (0x13) plen 5    #187 [hci1] 14.344995
        Num handles: 1
        Handle: 471 Address: DF:A9:FF:F6:B1:1A (OUI DF-A9-FF)
        Count: 1
        #186: len 21 (1 Kb/s)
        Latency: 158 msec (68-173 msec ~158 msec)
> ACL Data RX: Handle 471 flags 0x02 dlen 21              #188 [hci1] 14.345304
      SMP: Pairing Random (0x04) len 16
        Random value: 0ce2d8829b13f4d00000000000000000
< HCI Command: Host Number of Com.. (0x03|0x0035) plen 5  #189 [hci1] 14.346237
        Num handles: 1
        Handle: 471 Address: DF:A9:FF:F6:B1:1A (OUI DF-A9-FF)
        Count: 1
< ACL Data TX: Handle 471 flags 0x00 dlen 21              #190 [hci1] 14.346293
      SMP: Pairing Random (0x04) len 16
        Random value: 58f6b41f855a6f6c3560debd84e2affc
> HCI Event: Number of Completed Packets (0x13) plen 5    #191 [hci1] 14.519740
        Num handles: 1
        Handle: 471 Address: DF:A9:FF:F6:B1:1A (OUI DF-A9-FF)
        Count: 1
        #190: len 21 (0 Kb/s)
        Latency: 173 msec (68-173 msec ~165 msec)
> ACL Data RX: Handle 471 flags 0x02 dlen 21              #192 [hci1] 14.607594
      SMP: Pairing Confirm (0x03) len 16
        Confim value: d59e4b76fbac9e5729b363d1c26ed968
< HCI Command: Host Number of Com.. (0x03|0x0035) plen 5  #193 [hci1] 14.626153
        Num handles: 1
        Handle: 471 Address: DF:A9:FF:F6:B1:1A (OUI DF-A9-FF)
        Count: 1
< ACL Data TX: Handle 471 flags 0x00 dlen 21              #194 [hci1] 14.626266
      SMP: Pairing Confirm (0x03) len 16
        Confim value: c3b7eee09d5ede222f625e8fc2df61a4
> HCI Event: Number of Completed Packets (0x13) plen 5    #195 [hci1] 14.782471
        Num handles: 1
        Handle: 471 Address: DF:A9:FF:F6:B1:1A (OUI DF-A9-FF)
        Count: 1
        #194: len 21 (1 Kb/s)
        Latency: 156 msec (68-173 msec ~161 msec)
> ACL Data RX: Handle 471 flags 0x02 dlen 21              #196 [hci1] 14.782795
      SMP: Pairing Random (0x04) len 16
        Random value: 0fcfff1f57f61c1d0000000000000000
< HCI Command: Host Number of Com.. (0x03|0x0035) plen 5  #197 [hci1] 14.786071
        Num handles: 1
        Handle: 471 Address: DF:A9:FF:F6:B1:1A (OUI DF-A9-FF)
        Count: 1
< ACL Data TX: Handle 471 flags 0x00 dlen 21              #198 [hci1] 14.786103
      SMP: Pairing Random (0x04) len 16
        Random value: b67e7216d5bf664139eda2b542549666
> HCI Event: Number of Completed Packets (0x13) plen 5    #199 [hci1] 14.957203
        Num handles: 1
        Handle: 471 Address: DF:A9:FF:F6:B1:1A (OUI DF-A9-FF)
        Count: 1
        #198: len 21 (0 Kb/s)
        Latency: 171 msec (68-173 msec ~166 msec)
> ACL Data RX: Handle 471 flags 0x02 dlen 21              #200 [hci1] 15.045039
      SMP: Pairing Confirm (0x03) len 16
        Confim value: c5eb71ef034f6f5e069d5b992d6b6cd2
< HCI Command: Host Number of Com.. (0x03|0x0035) plen 5  #201 [hci1] 15.045853
        Num handles: 1
        Handle: 471 Address: DF:A9:FF:F6:B1:1A (OUI DF-A9-FF)
        Count: 1
< ACL Data TX: Handle 471 flags 0x00 dlen 21              #202 [hci1] 15.045934
      SMP: Pairing Confirm (0x03) len 16
        Confim value: 82081ebef320ebd4c4184addd2df06a4
> HCI Event: Number of Completed Packets (0x13) plen 5    #203 [hci1] 15.219985
        Num handles: 1
        Handle: 471 Address: DF:A9:FF:F6:B1:1A (OUI DF-A9-FF)
        Count: 1
        #202: len 21 (0 Kb/s)
        Latency: 174 msec (68-174 msec ~170 msec)
> ACL Data RX: Handle 471 flags 0x02 dlen 21              #204 [hci1] 15.220241
      SMP: Pairing Random (0x04) len 16
        Random value: 5140b06c43c734c20000000000000000
< HCI Command: Host Number of Com.. (0x03|0x0035) plen 5  #205 [hci1] 15.226227
        Num handles: 1
        Handle: 471 Address: DF:A9:FF:F6:B1:1A (OUI DF-A9-FF)
        Count: 1
< ACL Data TX: Handle 471 flags 0x00 dlen 21              #206 [hci1] 15.226342
      SMP: Pairing Random (0x04) len 16
        Random value: ed17f76500c95219dd01e09d1e63f87b
> HCI Event: Number of Completed Packets (0x13) plen 5    #207 [hci1] 15.394734
        Num handles: 1
        Handle: 471 Address: DF:A9:FF:F6:B1:1A (OUI DF-A9-FF)
        Count: 1
        #206: len 21 (1 Kb/s)
        Latency: 168 msec (68-174 msec ~169 msec)
> ACL Data RX: Handle 471 flags 0x02 dlen 21              #208 [hci1] 15.482586
      SMP: Pairing Confirm (0x03) len 16
        Confim value: fe5a61f26aaf39de093c73fb750d91bd
< HCI Command: Host Number of Com.. (0x03|0x0035) plen 5  #209 [hci1] 15.486416
        Num handles: 1
        Handle: 471 Address: DF:A9:FF:F6:B1:1A (OUI DF-A9-FF)
        Count: 1
< ACL Data TX: Handle 471 flags 0x00 dlen 21              #210 [hci1] 15.486560
      SMP: Pairing Confirm (0x03) len 16
        Confim value: 2e44c077f6d2957fd5fce44273f2c0a5
> HCI Event: Number of Completed Packets (0x13) plen 5    #211 [hci1] 15.657407
        Num handles: 1
        Handle: 471 Address: DF:A9:FF:F6:B1:1A (OUI DF-A9-FF)
        Count: 1
        #210: len 21 (0 Kb/s)
        Latency: 170 msec (68-174 msec ~170 msec)
> ACL Data RX: Handle 471 flags 0x02 dlen 21              #212 [hci1] 15.657760
      SMP: Pairing Random (0x04) len 16
        Random value: 62b28b2269ece5090000000000000000
< HCI Command: Host Number of Com.. (0x03|0x0035) plen 5  #213 [hci1] 15.666316
        Num handles: 1
        Handle: 471 Address: DF:A9:FF:F6:B1:1A (OUI DF-A9-FF)
        Count: 1
< ACL Data TX: Handle 471 flags 0x00 dlen 21              #214 [hci1] 15.666422
      SMP: Pairing Random (0x04) len 16
        Random value: 81d35d47e1f6006d79c974bd9d9e1ee3
> HCI Event: Number of Completed Packets (0x13) plen 5    #215 [hci1] 15.832248
        Num handles: 1
        Handle: 471 Address: DF:A9:FF:F6:B1:1A (OUI DF-A9-FF)
        Count: 1
        #214: len 21 (1 Kb/s)
        Latency: 165 msec (68-174 msec ~167 msec)
> ACL Data RX: Handle 471 flags 0x02 dlen 21              #216 [hci1] 15.920110
      SMP: Pairing Confirm (0x03) len 16
        Confim value: 2cef2cb3881fe03c9a126692745a69fc
< HCI Command: Host Number of Com.. (0x03|0x0035) plen 5  #217 [hci1] 15.926458
        Num handles: 1
        Handle: 471 Address: DF:A9:FF:F6:B1:1A (OUI DF-A9-FF)
        Count: 1
< ACL Data TX: Handle 471 flags 0x00 dlen 21              #218 [hci1] 15.926595
      SMP: Pairing Confirm (0x03) len 16
        Confim value: f14b646218b73df259aed99dc6661970
> HCI Event: Number of Completed Packets (0x13) plen 5    #219 [hci1] 16.094964
        Num handles: 1
        Handle: 471 Address: DF:A9:FF:F6:B1:1A (OUI DF-A9-FF)
        Count: 1
        #218: len 21 (1 Kb/s)
        Latency: 168 msec (68-174 msec ~168 msec)
> ACL Data RX: Handle 471 flags 0x02 dlen 21              #220 [hci1] 16.095305
      SMP: Pairing Random (0x04) len 16
        Random value: 6e844cca4a1c77990000000000000000
< HCI Command: Host Number of Com.. (0x03|0x0035) plen 5  #221 [hci1] 16.106830
        Num handles: 1
        Handle: 471 Address: DF:A9:FF:F6:B1:1A (OUI DF-A9-FF)
        Count: 1
< ACL Data TX: Handle 471 flags 0x00 dlen 21              #222 [hci1] 16.106997
      SMP: Pairing Random (0x04) len 16
        Random value: e7f7e0c2476823e41736a7e381bafb7c
> HCI Event: Number of Completed Packets (0x13) plen 5    #223 [hci1] 16.269681
        Num handles: 1
        Handle: 471 Address: DF:A9:FF:F6:B1:1A (OUI DF-A9-FF)
        Count: 1
        #222: len 21 (1 Kb/s)
        Latency: 162 msec (68-174 msec ~165 msec)
> ACL Data RX: Handle 471 flags 0x02 dlen 21              #224 [hci1] 16.357576
      SMP: Pairing Confirm (0x03) len 16
        Confim value: 4bedc79ec45a6e79804781f7d37878aa
< HCI Command: Host Number of Com.. (0x03|0x0035) plen 5  #225 [hci1] 16.366256
        Num handles: 1
        Handle: 471 Address: DF:A9:FF:F6:B1:1A (OUI DF-A9-FF)
        Count: 1
< ACL Data TX: Handle 471 flags 0x00 dlen 21              #226 [hci1] 16.366395
      SMP: Pairing Confirm (0x03) len 16
        Confim value: 661a0ab7be78a7d669a52a22b6ececfc
> HCI Event: Number of Completed Packets (0x13) plen 5    #227 [hci1] 16.532507
        Num handles: 1
        Handle: 471 Address: DF:A9:FF:F6:B1:1A (OUI DF-A9-FF)
        Count: 1
        #226: len 21 (1 Kb/s)
        Latency: 166 msec (68-174 msec ~165 msec)
> ACL Data RX: Handle 471 flags 0x02 dlen 21              #228 [hci1] 16.532755
      SMP: Pairing Random (0x04) len 16
        Random value: 1c10608791e0f99c0000000000000000
< HCI Command: Host Number of Com.. (0x03|0x0035) plen 5  #229 [hci1] 16.546123
        Num handles: 1
        Handle: 471 Address: DF:A9:FF:F6:B1:1A (OUI DF-A9-FF)
        Count: 1
