Bluetooth monitor ver 5.72
= Note: Linux version 6.14.0-36-generic (x86_64)                       0.797166
= Note: Bluetooth subsystem version 2.22                               0.797167
= New Index: 00:00:00:00:00:00 (Primary,UART,hci1)              [hci1] 0.797168
= New Index: 48:5F:99:8E:E0:64 (Primary,USB,hci0)               [hci0] 0.797169
= Open Index: 00:00:00:00:00:00                                 [hci1] 1.311135
= Index Info: 00:00:00:00:00:00 (Nordic Semiconductor ASA)      [hci1] 1.311151
@ USER Open: main (privileged) version 2.22            {0x0001} [hci1] 1.311162
< HCI Command: Reset (0x03|0x0003) plen 0                    #1 [hci1] 1.312506
> HCI Event: Command Complete (0x0e) plen 4                  #2 [hci1] 1.313081
      Reset (0x03|0x0003) ncmd 1
        Status: Success (0x00)
< HCI Command: Read Local Supported... (0x04|0x0003) plen 0  #3 [hci1] 1.330859
> HCI Event: Command Complete (0x0e) plen 12                 #4 [hci1] 1.331546
      Read Local Supported Features (0x04|0x0003) ncmd 1
        Status: Success (0x00)
        Features: 0x00 0x00 0x00 0x00 0x60 0x00 0x00 0x00
          BR/EDR Not Supported
          LE Supported (Controller)
< HCI Command: Read Local Version In.. (0x04|0x0001) plen 0  #5 [hci1] 1.350607
> HCI Event: Command Complete (0x0e) plen 12                 #6 [hci1] 1.351063
      Read Local Version Information (0x04|0x0001) ncmd 1
        Status: Success (0x00)
        HCI version: Reserved (0x0f) - Revision 12393 (0x3069)
        LMP version: Reserved (0x0f) - Subversion 12393 (0x3069)
        Manufacturer: Nordic Semiconductor ASA (89)
< HCI Command: Read Local Supported... (0x04|0x0002) plen 0  #7 [hci1] 1.370570
> HCI Event: Command Complete (0x0e) plen 68                 #8 [hci1] 1.371646
      Read Local Supported Commands (0x04|0x0002) ncmd 1
        Status: Success (0x00)
        Commands: 119 entries
          Disconnect (Octet 0 - Bit 5)
          Read Remote Version Information (Octet 2 - Bit 7)
          Set Event Mask (Octet 5 - Bit 6)
          Reset (Octet 5 - Bit 7)
          Read Connection Accept Timeout (Octet 7 - Bit 2)
          Write Connection Accept Timeout (Octet 7 - Bit 3)
          Read Transmit Power Level (Octet 10 - Bit 2)
          Set Controller To Host Flow Control (Octet 10 - Bit 5)
          Host Buffer Size (Octet 10 - Bit 6)
          Host Number of Completed Packets (Octet 10 - Bit 7)
          Read Local Version Information (Octet 14 - Bit 3)
          Read Local Supported Features (Octet 14 - Bit 5)
          Read BD ADDR (Octet 15 - Bit 1)
          Read RSSI (Octet 15 - Bit 5)
          Set Event Mask Page 2 (Octet 22 - Bit 2)
          LE Set Event Mask (Octet 25 - Bit 0)
          LE Read Buffer Size (Octet 25 - Bit 1)
          LE Read Local Supported Features (Octet 25 - Bit 2)
          LE Set Random Address (Octet 25 - Bit 4)
          LE Set Advertising Parameters (Octet 25 - Bit 5)
          LE Read Advertising Channel TX Power (Octet 25 - Bit 6)
          LE Set Advertising Data (Octet 25 - Bit 7)
          LE Set Scan Response Data (Octet 26 - Bit 0)
          LE Set Advertise Enable (Octet 26 - Bit 1)
          LE Set Scan Parameters (Octet 26 - Bit 2)
          LE Set Scan Enable (Octet 26 - Bit 3)
          LE Create Connection (Octet 26 - Bit 4)
          LE Create Connection Cancel (Octet 26 - Bit 5)
          LE Read Accept List Size (Octet 26 - Bit 6)
          LE Clear Accept List (Octet 26 - Bit 7)
          LE Add Device To Accept List (Octet 27 - Bit 0)
          LE Remove Device From Accept List (Octet 27 - Bit 1)
          LE Connection Update (Octet 27 - Bit 2)
          LE Set Host Channel Classification (Octet 27 - Bit 3)
          LE Read Channel Map (Octet 27 - Bit 4)
          LE Read Remote Used Features (Octet 27 - Bit 5)
          LE Encrypt (Octet 27 - Bit 6)
          LE Rand (Octet 27 - Bit 7)
          LE Start Encryption (Octet 28 - Bit 0)
          LE Long Term Key Request Reply (Octet 28 - Bit 1)
          LE Long Term Key Request Neg Reply (Octet 28 - Bit 2)
          LE Read Supported States (Octet 28 - Bit 3)
          LE Receiver Test (Octet 28 - Bit 4)
          LE Transmitter Test (Octet 28 - Bit 5)
          LE Test End (Octet 28 - Bit 6)
          Read Authenticated Payload Timeout (Octet 32 - Bit 4)
          Write Authenticated Payload Timeout (Octet 32 - Bit 5)
          LE Set Data Length (Octet 33 - Bit 6)
          LE Read Suggested Default Data Length (Octet 33 - Bit 7)
          LE Write Suggested Default Data Length (Octet 34 - Bit 0)
          LE Add Device To Resolving List (Octet 34 - Bit 3)
          LE Remove Device From Resolving List (Octet 34 - Bit 4)
          LE Clear Resolving List (Octet 34 - Bit 5)
          LE Read Resolving List Size (Octet 34 - Bit 6)
          LE Set Address Resolution Enable (Octet 35 - Bit 1)
          LE Set Resolvable Private Address Timeout (Octet 35 - Bit 2)
          LE Read Maximum Data Length (Octet 35 - Bit 3)
          LE Read PHY (Octet 35 - Bit 4)
          LE Set Default PHY (Octet 35 - Bit 5)
          LE Set PHY (Octet 35 - Bit 6)
          LE Enhanced Receiver Test (Octet 35 - Bit 7)
          LE Enhanced Transmitter Test (Octet 36 - Bit 0)
          LE Set Advertising Set Random Address (Octet 36 - Bit 1)
          LE Set Extended Advertising Parameters (Octet 36 - Bit 2)
          LE Set Extended Advertising Data (Octet 36 - Bit 3)
          LE Set Extended Scan Response Data (Octet 36 - Bit 4)
          LE Set Extended Advertising Enable (Octet 36 - Bit 5)
          LE Read Maximum Advertising Data Length (Octet 36 - Bit 6)
          LE Read Number of Supported Advertising Sets (Octet 36 - Bit 7)
          LE Remove Advertising Set (Octet 37 - Bit 0)
          LE Clear Advertising Sets (Octet 37 - Bit 1)
          LE Set Periodic Advertising Parameters (Octet 37 - Bit 2)
          LE Set Periodic Advertising Data (Octet 37 - Bit 3)
          LE Set Periodic Advertising Enable (Octet 37 - Bit 4)
          LE Set Extended Scan Parameters (Octet 37 - Bit 5)
          LE Set Extended Scan Enable (Octet 37 - Bit 6)
          LE Extended Create Connection (Octet 37 - Bit 7)
          LE Periodic Advertising Create Sync (Octet 38 - Bit 0)
          LE Periodic Advertising Create Sync Cancel (Octet 38 - Bit 1)
          LE Periodic Advertising Terminate Sync (Octet 38 - Bit 2)
          LE Add Device To Periodic Advertiser List (Octet 38 - Bit 3)
          LE Remove Device From Periodic Advertiser List (Octet 38 - Bit 4)
          LE Clear Periodic Advertiser List (Octet 38 - Bit 5)
          LE Read Periodic Advertiser List Size (Octet 38 - Bit 6)
          LE Read Transmit Power (Octet 38 - Bit 7)
          LE Read RF Path Compensation (Octet 39 - Bit 0)
          LE Write RF Path Compensation (Octet 39 - Bit 1)
          LE Set Privacy Mode (Octet 39 - Bit 2)
          LE Periodic Advertising Receive Enable (Octet 40 - Bit 5)
          LE Periodic Advertising Sync Transfer (Octet 40 - Bit 6)
          LE Periodic Advertising Set Info Transfer (Octet 40 - Bit 7)
          LE Periodic Advertising Sync Transfer Parameters (Octet 41 - Bit 0)
          LE Set Default Periodic Advertisng Sync Transfer Parameters (Octet 41 - Bit 1)
          LE Read Buffer v2 (Octet 41 - Bit 5)
          LE Read ISO TX Sync (Octet 41 - Bit 6)
          LE Set Connected Isochronous Group Parameters (Octet 41 - Bit 7)
          LE Set Connected Isochronous Group Parameters Test (Octet 42 - Bit 0)
          LE Create Connected Isochronous Stream (Octet 42 - Bit 1)
          LE Remove Connected Isochronous Group (Octet 42 - Bit 2)
          LE Accept Connected Isochronous Stream Request (Octet 42 - Bit 3)
          LE Reject Connected Isochronous Stream Request (Octet 42 - Bit 4)
          LE Create Broadcast Isochronous Group (Octet 42 - Bit 5)
          LE Create Broadcast Isochronous Group Test (Octet 42 - Bit 6)
          LE Terminate Broadcast Isochronous Group (Octet 42 - Bit 7)
          LE Broadcast Isochronous Group Create Sync (Octet 43 - Bit 0)
          LE Broadcast Isochronous Group Terminate Sync (Octet 43 - Bit 1)
          LE Request Peer SCA (Octet 43 - Bit 2)
          LE Setup Isochronous Data Path (Octet 43 - Bit 3)
          LE Remove Isochronous Data Path (Octet 43 - Bit 4)
          LE Isochronous Transmit Test (Octet 43 - Bit 5)
          LE Isochronous Receive Test (Octet 43 - Bit 6)
          LE Isochronous Read Test Counters (Octet 43 - Bit 7)
          LE Isochronous Read Test Counters (Octet 44 - Bit 0)
          LE Set Host Feature (Octet 44 - Bit 1)
          Octet 44 - Bit 2 
          Octet 45 - Bit 6 
          Octet 46 - Bit 0 
          Octet 46 - Bit 1 
          Octet 46 - Bit 2 
< HCI Command: Host Buffer Size (0x03|0x0033) plen 7         #9 [hci1] 1.390527
        ACL MTU: 255  ACL max packet: 16
        SCO MTU: 0    SCO max packet: 0
> HCI Event: Command Complete (0x0e) plen 4                 #10 [hci1] 1.391053
      Host Buffer Size (0x03|0x0033) ncmd 1
        Status: Success (0x00)
< HCI Command: Set Controller To Ho.. (0x03|0x0031) plen 1  #11 [hci1] 1.410512
        Flow control: ACL Data Packets (0x01)
> HCI Event: Command Complete (0x0e) plen 4                 #12 [hci1] 1.410993
      Set Controller To Host Flow Control (0x03|0x0031) ncmd 1
        Status: Success (0x00)
< HCI Command: LE Read Local Suppor.. (0x08|0x0003) plen 0  #13 [hci1] 1.430513
> HCI Event: Command Complete (0x0e) plen 12                #14 [hci1] 1.430986
      LE Read Local Supported Features (0x08|0x0003) ncmd 1
        Status: Success (0x00)
        Features: 0xfd 0x79 0x00 0xf7 0x30 0x01 0x00 0x00
          LE Encryption
          Extended Reject Indication
          Peripheral-initiated Features Exchange
          LE Ping
          LE Data Packet Length Extension
          LL Privacy
          Extended Scanner Filter Policies
          LE 2M PHY
          LE Coded PHY
          LE Extended Advertising
          LE Periodic Advertising
          Channel Selection Algorithm #2
          Periodic Advertising Sync Transfer - Sender
          Periodic Advertising Sync Transfer - Recipient
          Sleep Clock Accuracy Updates
          Connected Isochronous Stream - Central
          Connected Isochronous Stream - Peripheral
          Isochronous Broadcaster
          Synchronized Receiver
          Periodic Advertising ADI support
          Connection Subrating
          Unknown features (0x0000010000000000)
< HCI Command: LE Set Host Feature (0x08|0x0074) plen 2     #15 [hci1] 1.450520
        Bit Number: 32
          Connected Isochronous Stream (Host Support)
        Bit Value: 1
> HCI Event: Command Complete (0x0e) plen 4                 #16 [hci1] 1.450966
      LE Set Host Feature (0x08|0x0074) ncmd 1
        Status: Success (0x00)
< HCI Command: LE Read Buffer v2 (0x08|0x0060) plen 0       #17 [hci1] 1.470501
> HCI Event: Command Complete (0x0e) plen 10                #18 [hci1] 1.471099
      LE Read Buffer v2 (0x08|0x0060) ncmd 1
        Status: Success (0x00)
        ACL MTU: 27
        ACL max packet: 3
        ISO MTU: 318
        ISO max packet: 3
< HCI Command: LE Read Maximum Adve.. (0x08|0x003a) plen 0  #19 [hci1] 1.490575
> HCI Event: Command Complete (0x0e) plen 6                 #20 [hci1] 1.491076
      LE Read Maximum Advertising Data Length (0x08|0x003a) ncmd 1
        Status: Success (0x00)
        Max length: 1650
< HCI Command: LE Read Supported St.. (0x08|0x001c) plen 0  #21 [hci1] 1.510510
> HCI Event: Command Complete (0x0e) plen 12                #22 [hci1] 1.510955
      LE Read Supported States (0x08|0x001c) ncmd 1
        Status: Success (0x00)
        States: 0x000003ff3e0306ff
          Non-connectable Advertising State
          Scannable Advertising State
          Connectable Advertising State
          High Duty Cycle Directed Advertising State
          Passive Scanning State
          Active Scanning State
          Initiating State
            and Connection State (Central Role)
          Connection State (Peripheral Role)
          Scannable Advertising State
            and Passive Scanning State
          Connectable Advertising State
            and Passive Scanning State
          Non-connectable Advertising State
            and Initiating State
          Scannable Advertising State
            and Initiating State
          Active Scanning State
            and Connection State (Central Role)
          Passive Scanning State
            and Connection State (Peripheral Role)
          Active Scanning State
            and Connection State (Peripheral Role)
          Initiating State
            and Connection State (Central Role)
            and Central Role & Central Role
          Low Duty Cycle Directed Advertising State
          Connectable Advertising State
            and Initiating State
            and Central Role & Peripheral Role
          High Duty Cycle Directed Advertising State
            and Initiating State
            and Central Role & Peripheral Role
          Low Duty Cycle Directed Advertising State
            and Initiating State
            and Central Role & Peripheral Role
          Connectable Advertising State
            and Connection State (Central Role)
            and Central Role & Peripheral Role
          High Duty Cycle Directed Advertising State
            and Connection State (Central Role)
            and Central Role & Peripheral Role
          Low Duty Cycle Directed Advertising State
            and Connection State (Central Role)
            and Central Role & Peripheral Role
          Connectable Advertising State
            and Connection State (Peripheral Role)
            and Central Role & Peripheral Role
          High Duty Cycle Directed Advertising State
            and Connection State (Peripheral Role)
            and Peripheral Role & Peripheral Role
          Low Duty Cycle Directed Advertising State
            and Connection State (Peripheral Role)
            and Peripheral Role & Peripheral Role
          Initiating State
            and Connection State (Peripheral Role)
            and Central Role & Peripheral Role
< HCI Command: LE Read Maximum Data.. (0x08|0x002f) plen 0  #23 [hci1] 1.530497
> HCI Event: Command Complete (0x0e) plen 12                #24 [hci1] 1.530968
      LE Read Maximum Data Length (0x08|0x002f) ncmd 1
        Status: Success (0x00)
        Max TX octets: 251
        Max TX time: 2704
        Max RX octets: 251
        Max RX time: 2704
< HCI Command: LE Write Suggested D.. (0x08|0x0024) plen 4  #25 [hci1] 1.550539
        TX octets: 251
        TX time: 2704
> HCI Event: Command Complete (0x0e) plen 4                 #26 [hci1] 1.550975
      LE Write Suggested Default Data Length (0x08|0x0024) ncmd 1
        Status: Success (0x00)
< HCI Command: LE Read Resolving Li.. (0x08|0x002a) plen 0  #27 [hci1] 1.570494
> HCI Event: Command Complete (0x0e) plen 5                 #28 [hci1] 1.570908
      LE Read Resolving List Size (0x08|0x002a) ncmd 1
        Status: Success (0x00)
        Size: 8
< HCI Command: LE Set Event Mask (0x08|0x0001) plen 8       #29 [hci1] 1.590511
        Mask: 0x000002023f87fa5e
          LE Advertising Report
          LE Connection Update Complete
          LE Read Remote Used Features Complete
          LE Long Term Key Request
          LE Data Length Change
          LE Enhanced Connection Complete
          LE PHY Update Complete
          LE Extended Advertising Report
          LE Periodic Advertising Sync Established
          LE Periodic Advertising Report
          LE Periodic Advertising Sync Lost
          LE Extended Scan Timeout
          LE Extended Advertising Set Terminated
          LE Scan Request Received
          LE Periodic Advertising Sync Transfer Rvc
          LE CIS Established
          LE CIS Request
          LE Create BIG Complete
          LE Terminate BIG Complete
          LE BIG Sync Estabilished Complete
          LE BIG Sync Lost
          LE BIG Info Advertising Report
          Unknown mask (0x0000020000000000)
> HCI Event: Command Complete (0x0e) plen 4                 #30 [hci1] 1.591005
      LE Set Event Mask (0x08|0x0001) ncmd 1
        Status: Success (0x00)
< HCI Command: Set Event Mask (0x03|0x0001) plen 8          #31 [hci1] 1.610517
        Mask: 0x2000800002008890
          Disconnection Complete
          Encryption Change
          Read Remote Version Information Complete
          Hardware Error
          Data Buffer Overflow
          Encryption Key Refresh Complete
          LE Meta
> HCI Event: Command Complete (0x0e) plen 4                 #32 [hci1] 1.611046
      Set Event Mask (0x03|0x0001) ncmd 1
        Status: Success (0x00)
< HCI Command: Read BD ADDR (0x04|0x0009) plen 0            #33 [hci1] 1.630514
> HCI Event: Command Complete (0x0e) plen 10                #34 [hci1] 1.631032
      Read BD ADDR (0x04|0x0009) ncmd 1
        Status: Success (0x00)
        Address: 00:00:00:00:00:00 (OUI 00-00-00)
< HCI Command: LE Set Random Address (0x08|0x0005) plen 6   #35 [hci1] 1.650515
        Address: D5:B6:CC:31:DB:3B (Static)
> HCI Event: Command Complete (0x0e) plen 4                 #36 [hci1] 1.651032
      LE Set Random Address (0x08|0x0005) ncmd 1
        Status: Success (0x00)
< HCI Command: LE Set Extended Adv.. (0x08|0x0036) plen 25  #37 [hci1] 4.120982
        Handle: 0x00
        Properties: 0x0013
          Connectable
          Scannable
          Use legacy advertising PDUs: ADV_IND
        Min advertising interval: 100.000 msec (0x00a0)
        Max advertising interval: 150.000 msec (0x00f0)
        Channel map: 37, 38, 39 (0x07)
        Own address type: Random (0x01)
        Peer address type: Public (0x00)
        Peer address: 00:00:00:00:00:00 (OUI 00-00-00)
        Filter policy: Allow Scan Request from Any, Allow Connect Request from Any (0x00)
        TX power: Host has no preference (0x7f)
        Primary PHY: LE 1M (0x01)
        Secondary max skip: 0x00
        Secondary PHY: LE 1M (0x01)
        SID: 0x00
        Scan request notifications: Disabled (0x00)
> HCI Event: Command Complete (0x0e) plen 5                 #38 [hci1] 4.121771
      LE Set Extended Advertising Parameters (0x08|0x0036) ncmd 1
        Status: Success (0x00)
        TX power (selected): 0 dbm (0x00)
< HCI Command: LE Set Advertising S.. (0x08|0x0035) plen 7  #39 [hci1] 4.130548
        Advertising handle: 0x00
        Advertising random address: D5:B6:CC:31:DB:3B (Static)
> HCI Event: Command Complete (0x0e) plen 4                 #40 [hci1] 4.130998
      LE Set Advertising Set Random Address (0x08|0x0035) ncmd 1
        Status: Success (0x00)
< HCI Command: LE Set Extended Adv.. (0x08|0x0037) plen 22  #41 [hci1] 4.150559
        Handle: 0x00
        Operation: Complete extended advertising data (0x03)
        Fragment preference: Minimize fragmentation (0x01)
        Data length: 0x12
        Flags: 0x06
          LE General Discoverable Mode
          BR/EDR Not Supported
        Name (complete): Tester_F6B11A
> HCI Event: Command Complete (0x0e) plen 4                 #42 [hci1] 4.151400
      LE Set Extended Advertising Data (0x08|0x0037) ncmd 1
        Status: Success (0x00)
< HCI Command: LE Set Extended Scan.. (0x08|0x0038) plen 4  #43 [hci1] 4.170511
        Handle: 0x00
        Operation: Complete scan response data (0x03)
        Fragment preference: Minimize fragmentation (0x01)
        Data length: 0x00
> HCI Event: Command Complete (0x0e) plen 4                 #44 [hci1] 4.171015
      LE Set Extended Scan Response Data (0x08|0x0038) ncmd 1
        Status: Success (0x00)
< HCI Command: LE Set Extended Adve.. (0x08|0x0039) plen 6  #45 [hci1] 4.190553
        Extended advertising: Enabled (0x01)
        Number of sets: 1 (0x01)
        Entry 0
          Handle: 0x00
          Duration: 0 ms (0x00)
          Max ext adv events: 0
> HCI Event: Command Complete (0x0e) plen 4                 #46 [hci1] 4.191096
      LE Set Extended Advertising Enable (0x08|0x0039) ncmd 1
        Status: Success (0x00)
> HCI Event: LE Meta Event (0x3e) plen 31                   #47 [hci1] 4.309330
      LE Enhanced Connection Complete (0x0a)
        Status: Success (0x00)
        Handle: 93
        Role: Peripheral (0x01)
        Peer address type: Public (0x00)
        Peer address: DF:A9:FF:F6:B1:1A (OUI DF-A9-FF)
        Local resolvable private address: 00:00:00:00:00:00 (Non-Resolvable)
        Peer resolvable private address: 00:00:00:00:00:00 (Non-Resolvable)
        Connection interval: 87.50 msec (0x0046)
        Connection latency: 0 (0x0000)
        Supervision timeout: 25120 msec (0x09d0)
        Central clock accuracy: 0x01
> HCI Event: LE Meta Event (0x3e) plen 6                    #48 [hci1] 4.309472
      LE Advertising Set Terminated (0x12)
        Status: Success (0x00)
        Handle: 0
        Connection handle: 93
        Number of completed extended advertising events: 0
< HCI Command: LE Read Remote Used... (0x08|0x0016) plen 2  #49 [hci1] 4.311633
        Handle: 93 Address: DF:A9:FF:F6:B1:1A (OUI DF-A9-FF)
< ACL Data TX: Handle 93 flags 0x00 dlen 7                  #50 [hci1] 4.311675
      ATT: Exchange MTU Request (0x02) len 2
        Client RX MTU: 251
> HCI Event: Command Status (0x0f) plen 4                   #51 [hci1] 4.312219
      LE Read Remote Used Features (0x08|0x0016) ncmd 1
        Status: Success (0x00)
> HCI Event: Number of Completed Packets (0x13) plen 5      #52 [hci1] 4.485163
        Num handles: 1
        Handle: 93 Address: DF:A9:FF:F6:B1:1A (OUI DF-A9-FF)
        Count: 1
        #50: len 7 (0 Kb/s)
        Latency: 173 msec (173-173 msec ~173 msec)
> HCI Event: LE Meta Event (0x3e) plen 12                   #53 [hci1] 4.573051
      LE Read Remote Used Features (0x04)
        Status: Success (0x00)
        Handle: 93 Address: DF:A9:FF:F6:B1:1A (OUI DF-A9-FF)
        Features: 0x2d 0x49 0x00 0xf7 0x67 0xd8 0x00 0x00
          LE Encryption
          Extended Reject Indication
          Peripheral-initiated Features Exchange
          LE Data Packet Length Extension
          LE 2M PHY
          LE Coded PHY
          Channel Selection Algorithm #2
          Periodic Advertising Sync Transfer - Sender
          Periodic Advertising Sync Transfer - Recipient
          Sleep Clock Accuracy Updates
          Connected Isochronous Stream - Central
          Connected Isochronous Stream - Peripheral
          Isochronous Broadcaster
          Synchronized Receiver
          Connected Isochronous Stream (Host Support)
          LE Power Control Request
          LE Power Control Request
          Connection Subrating
          Connection Subrating (Host Support)
          Unknown features (0x0000d80000000000)
> ACL Data RX: Handle 93 flags 0x02 dlen 11                 #54 [hci1] 7.022875
      SMP: Pairing Request (0x01) len 6
        IO capability: KeyboardDisplay (0x04)
        OOB data: Authentication data not present (0x00)
        Authentication requirement: Bonding, MITM, SC, No Keypresses (0x0d)
        Max encryption key size: 16
        Initiator key distribution: EncKey IdKey (0x03)
        Responder key distribution: EncKey IdKey Sign (0x07)
> ACL Data RX: Handle 93 flags 0x02 dlen 7                  #55 [hci1] 7.023159
      ATT: Exchange MTU Response (0x03) len 2
        Server RX MTU: 23
< HCI Command: Host Number of Compl.. (0x03|0x0035) plen 5  #56 [hci1] 7.031028
        Num handles: 1
        Handle: 93 Address: DF:A9:FF:F6:B1:1A (OUI DF-A9-FF)
        Count: 1
< ACL Data TX: Handle 93 flags 0x00 dlen 11                 #57 [hci1] 7.031298
      SMP: Pairing Response (0x02) len 6
        IO capability: DisplayOnly (0x00)
        OOB data: Authentication data not present (0x00)
        Authentication requirement: Bonding, No MITM, SC, No Keypresses (0x09)
        Max encryption key size: 16
        Initiator key distribution: IdKey (0x02)
        Responder key distribution: <none> (0x00)
< HCI Command: Host Number of Compl.. (0x03|0x0035) plen 5  #58 [hci1] 7.031528
        Num handles: 1
        Handle: 93 Address: DF:A9:FF:F6:B1:1A (OUI DF-A9-FF)
        Count: 1
> HCI Event: Number of Completed Packets (0x13) plen 5      #59 [hci1] 7.197885
        Num handles: 1
        Handle: 93 Address: DF:A9:FF:F6:B1:1A (OUI DF-A9-FF)
        Count: 1
        #57: len 11 (0 Kb/s)
        Latency: 166 msec (166-173 msec ~170 msec)
> ACL Data RX: Handle 93 flags 0x02 dlen 27                 #60 [hci1] 7.198118
> ACL Data RX: Handle 93 flags 0x01 dlen 27                 #61 [hci1] 7.198690
> ACL Data RX: Handle 93 flags 0x01 dlen 15                 #62 [hci1] 7.199181
      SMP: Pairing Public Key (0x0c) len 64
        X: a9f632cbb2f8ccf9ac66da317782d41c886a56f2910e84ce368503f26b1f0563
        Y: 65230ddbc696c1b2d6efaf1e1df02fdfe70218b78bb43f550662154397a71743
< HCI Command: Host Number of Compl.. (0x03|0x0035) plen 5  #63 [hci1] 7.211436
        Num handles: 1
        Handle: 93 Address: DF:A9:FF:F6:B1:1A (OUI DF-A9-FF)
        Count: 1
< HCI Command: Host Number of Compl.. (0x03|0x0035) plen 5  #64 [hci1] 7.211643
        Num handles: 1
        Handle: 93 Address: DF:A9:FF:F6:B1:1A (OUI DF-A9-FF)
        Count: 1
< HCI Command: Host Number of Compl.. (0x03|0x0035) plen 5  #65 [hci1] 7.211984
        Num handles: 1
        Handle: 93 Address: DF:A9:FF:F6:B1:1A (OUI DF-A9-FF)
        Count: 1
< ACL Data TX: Handle 93 flags 0x00 dlen 27                 #66 [hci1] 7.212202
< ACL Data TX: Handle 93 flags 0x01 dlen 27                 #67 [hci1] 7.212247
< ACL Data TX: Handle 93 flags 0x01 dlen 15                 #68 [hci1] 7.212252
      SMP: Pairing Public Key (0x0c) len 64
        X: 98308440221e2d910f0e54b71e7ec652857aa9b5a0dc65028824cc19db1226e9
        Y: 67a4816bcb62efb21701e31fdb27561a6217575fb007a8bbdabe7e28b6f68482
> HCI Event: Number of Completed Packets (0x13) plen 5      #69 [hci1] 7.285764
        Num handles: 1
        Handle: 93 Address: DF:A9:FF:F6:B1:1A (OUI DF-A9-FF)
        Count: 1
        #66: len 27 (2 Kb/s)
        Latency: 73 msec (73-173 msec ~121 msec)
> HCI Event: Number of Completed Packets (0x13) plen 5      #70 [hci1] 7.286498
        Num handles: 1
        Handle: 93 Address: DF:A9:FF:F6:B1:1A (OUI DF-A9-FF)
        Count: 1
        #67: len 27 (2 Kb/s)
        Latency: 74 msec (73-173 msec ~98 msec)
> HCI Event: Number of Completed Packets (0x13) plen 5      #71 [hci1] 7.372563
        Num handles: 1
        Handle: 93 Address: DF:A9:FF:F6:B1:1A (OUI DF-A9-FF)
        Count: 1
        #68: len 15 (0 Kb/s)
        Latency: 160 msec (73-173 msec ~129 msec)
> ACL Data RX: Handle 93 flags 0x02 dlen 21                 #72 [hci1] 8.335437
      SMP: Pairing Confirm (0x03) len 16
        Confim value: a7c3919fb04307eea81de7e9ffe9ae1d
< HCI Command: Host Number of Compl.. (0x03|0x0035) plen 5  #73 [hci1] 8.351299
        Num handles: 1
        Handle: 93 Address: DF:A9:FF:F6:B1:1A (OUI DF-A9-FF)
        Count: 1
< ACL Data TX: Handle 93 flags 0x00 dlen 21                 #74 [hci1] 8.351491
      SMP: Pairing Confirm (0x03) len 16
        Confim value: 6cbab4265204642237a14eec971f5bec
> HCI Event: Number of Completed Packets (0x13) plen 5      #75 [hci1] 8.510270
        Num handles: 1
        Handle: 93 Address: DF:A9:FF:F6:B1:1A (OUI DF-A9-FF)
        Count: 1
        #74: len 21 (1 Kb/s)
        Latency: 158 msec (73-173 msec ~143 msec)
> ACL Data RX: Handle 93 flags 0x02 dlen 21                 #76 [hci1] 8.510531
      SMP: Pairing Random (0x04) len 16
        Random value: 08dd5b30f3051bc90000000000000000
< HCI Command: Host Number of Compl.. (0x03|0x0035) plen 5  #77 [hci1] 8.530614
        Num handles: 1
        Handle: 93 Address: DF:A9:FF:F6:B1:1A (OUI DF-A9-FF)
        Count: 1
< ACL Data TX: Handle 93 flags 0x00 dlen 21                 #78 [hci1] 8.530624
      SMP: Pairing Random (0x04) len 16
        Random value: 8e6108f966a694cbe26df70bb96773e6
> HCI Event: Number of Completed Packets (0x13) plen 5      #79 [hci1] 8.685069
        Num handles: 1
        Handle: 93 Address: DF:A9:FF:F6:B1:1A (OUI DF-A9-FF)
        Count: 1
        #78: len 21 (1 Kb/s)
        Latency: 154 msec (73-173 msec ~149 msec)
> ACL Data RX: Handle 93 flags 0x02 dlen 21                 #80 [hci1] 8.772810
      SMP: Pairing Confirm (0x03) len 16
        Confim value: 4e137b8a042f7fd87be69b060197108d
< HCI Command: Host Number of Compl.. (0x03|0x0035) plen 5  #81 [hci1] 8.790593
        Num handles: 1
        Handle: 93 Address: DF:A9:FF:F6:B1:1A (OUI DF-A9-FF)
        Count: 1
< ACL Data TX: Handle 93 flags 0x00 dlen 21                 #82 [hci1] 8.791070
      SMP: Pairing Confirm (0x03) len 16
        Confim value: 6a90d084e7df4c0a46de99d6c6bd17ff
> HCI Event: Number of Completed Packets (0x13) plen 5      #83 [hci1] 8.947784
        Num handles: 1
        Handle: 93 Address: DF:A9:FF:F6:B1:1A (OUI DF-A9-FF)
        Count: 1
        #82: len 21 (1 Kb/s)
        Latency: 156 msec (73-173 msec ~152 msec)
> ACL Data RX: Handle 93 flags 0x02 dlen 21                 #84 [hci1] 8.948187
      SMP: Pairing Random (0x04) len 16
        Random value: a4a15c369fa920670000000000000000
< HCI Command: Host Number of Compl.. (0x03|0x0035) plen 5  #85 [hci1] 8.950574
        Num handles: 1
        Handle: 93 Address: DF:A9:FF:F6:B1:1A (OUI DF-A9-FF)
        Count: 1
< ACL Data TX: Handle 93 flags 0x00 dlen 21                 #86 [hci1] 8.950586
      SMP: Pairing Random (0x04) len 16
        Random value: 4d02679f89a05211af56d8b3da64d21e
> HCI Event: Number of Completed Packets (0x13) plen 5      #87 [hci1] 9.123176
        Num handles: 1
        Handle: 93 Address: DF:A9:FF:F6:B1:1A (OUI DF-A9-FF)
        Count: 1
        #86: len 21 (0 Kb/s)
        Latency: 172 msec (73-173 msec ~162 msec)
> ACL Data RX: Handle 93 flags 0x02 dlen 21                 #88 [hci1] 9.210393
      SMP: Pairing Confirm (0x03) len 16
        Confim value: ee6c7554c0e998b4c2b4f576b536b8e9
< HCI Command: Host Number of Compl.. (0x03|0x0035) plen 5  #89 [hci1] 9.210541
        Num handles: 1
        Handle: 93 Address: DF:A9:FF:F6:B1:1A (OUI DF-A9-FF)
        Count: 1
< ACL Data TX: Handle 93 flags 0x00 dlen 21                 #90 [hci1] 9.210588
      SMP: Pairing Confirm (0x03) len 16
        Confim value: 7bb64f7af2ed69a57ff24205e0b1a0dd
> HCI Event: Number of Completed Packets (0x13) plen 5      #91 [hci1] 9.385239
        Num handles: 1
        Handle: 93 Address: DF:A9:FF:F6:B1:1A (OUI DF-A9-FF)
        Count: 1
        #90: len 21 (0 Kb/s)
        Latency: 174 msec (73-174 msec ~168 msec)
> ACL Data RX: Handle 93 flags 0x02 dlen 21                 #92 [hci1] 9.385564
      SMP: Pairing Random (0x04) len 16
        Random value: db531942a179e6520000000000000000
< HCI Command: Host Number of Compl.. (0x03|0x0035) plen 5  #93 [hci1] 9.390590
        Num handles: 1
        Handle: 93 Address: DF:A9:FF:F6:B1:1A (OUI DF-A9-FF)
        Count: 1
< ACL Data TX: Handle 93 flags 0x00 dlen 21                 #94 [hci1] 9.390707
      SMP: Pairing Random (0x04) len 16
        Random value: 5e8286bc235a02440d0c3424a2acf8fd
> HCI Event: Number of Completed Packets (0x13) plen 5      #95 [hci1] 9.560010
        Num handles: 1
        Handle: 93 Address: DF:A9:FF:F6:B1:1A (OUI DF-A9-FF)
        Count: 1
        #94: len 21 (0 Kb/s)
        Latency: 169 msec (73-174 msec ~169 msec)
> ACL Data RX: Handle 93 flags 0x02 dlen 21                 #96 [hci1] 9.647821
      SMP: Pairing Confirm (0x03) len 16
        Confim value: e4700bde343a075132fbf4460c248450
< HCI Command: Host Number of Compl.. (0x03|0x0035) plen 5  #97 [hci1] 9.650606
        Num handles: 1
        Handle: 93 Address: DF:A9:FF:F6:B1:1A (OUI DF-A9-FF)
        Count: 1
< ACL Data TX: Handle 93 flags 0x00 dlen 21                 #98 [hci1] 9.650641
      SMP: Pairing Confirm (0x03) len 16
        Confim value: 5b583d1a7200645f85df7463a3cf2dd6
> HCI Event: Number of Completed Packets (0x13) plen 5      #99 [hci1] 9.822632
        Num handles: 1
        Handle: 93 Address: DF:A9:FF:F6:B1:1A (OUI DF-A9-FF)
        Count: 1
        #98: len 21 (0 Kb/s)
        Latency: 171 msec (73-174 msec ~170 msec)
> ACL Data RX: Handle 93 flags 0x02 dlen 21                #100 [hci1] 9.823036
      SMP: Pairing Random (0x04) len 16
        Random value: 8ef5b01126bce2230000000000000000
< HCI Command: Host Number of Comp.. (0x03|0x0035) plen 5  #101 [hci1] 9.830776
        Num handles: 1
        Handle: 93 Address: DF:A9:FF:F6:B1:1A (OUI DF-A9-FF)
        Count: 1
< ACL Data TX: Handle 93 flags 0x00 dlen 21                #102 [hci1] 9.830781
      SMP: Pairing Random (0x04) len 16
        Random value: 5c4a1bcadd27bd58e945097b00bad7ac
> HCI Event: Number of Completed Packets (0x13) plen 5     #103 [hci1] 9.997469
        Num handles: 1
        Handle: 93 Address: DF:A9:FF:F6:B1:1A (OUI DF-A9-FF)
        Count: 1
        #102: len 21 (1 Kb/s)
        Latency: 166 msec (73-174 msec ~168 msec)
> ACL Data RX: Handle 93 flags 0x02 dlen 21               #104 [hci1] 10.085366
      SMP: Pairing Confirm (0x03) len 16
        Confim value: 8dacc8bae3476bd44453ca91aeae9068
< HCI Command: Host Number of Com.. (0x03|0x0035) plen 5  #105 [hci1] 10.090883
        Num handles: 1
        Handle: 93 Address: DF:A9:FF:F6:B1:1A (OUI DF-A9-FF)
        Count: 1
< ACL Data TX: Handle 93 flags 0x00 dlen 21               #106 [hci1] 10.091035
      SMP: Pairing Confirm (0x03) len 16
        Confim value: 6f6a0d8bf69a50cf59bbe7892f0effc7
> HCI Event: Number of Completed Packets (0x13) plen 5    #107 [hci1] 10.260237
        Num handles: 1
        Handle: 93 Address: DF:A9:FF:F6:B1:1A (OUI DF-A9-FF)
        Count: 1
        #106: len 21 (0 Kb/s)
        Latency: 169 msec (73-174 msec ~168 msec)
> ACL Data RX: Handle 93 flags 0x02 dlen 21               #108 [hci1] 10.260587
      SMP: Pairing Random (0x04) len 16
        Random value: 0588f535433567580000000000000000
< HCI Command: Host Number of Com.. (0x03|0x0035) plen 5  #109 [hci1] 10.271405
        Num handles: 1
        Handle: 93 Address: DF:A9:FF:F6:B1:1A (OUI DF-A9-FF)
        Count: 1
< ACL Data TX: Handle 93 flags 0x00 dlen 21               #110 [hci1] 10.271454
      SMP: Pairing Random (0x04) len 16
        Random value: 32527e6e64e79f33b2e374394db8ab2d
> HCI Event: Number of Completed Packets (0x13) plen 5    #111 [hci1] 10.435050
        Num handles: 1
        Handle: 93 Address: DF:A9:FF:F6:B1:1A (OUI DF-A9-FF)
        Count: 1
        #110: len 21 (1 Kb/s)
        Latency: 163 msec (73-174 msec ~166 msec)
> ACL Data RX: Handle 93 flags 0x02 dlen 21               #112 [hci1] 10.522854
      SMP: Pairing Confirm (0x03) len 16
        Confim value: 9e1df25c912692cae07071fb2677ba1e
< HCI Command: Host Number of Com.. (0x03|0x0035) plen 5  #113 [hci1] 10.531031
        Num handles: 1
        Handle: 93 Address: DF:A9:FF:F6:B1:1A (OUI DF-A9-FF)
        Count: 1
< ACL Data TX: Handle 93 flags 0x00 dlen 21               #114 [hci1] 10.531196
      SMP: Pairing Confirm (0x03) len 16
        Confim value: 3ff52519e8f74f3f9a73f1c9d1e0fbfb
> HCI Event: Number of Completed Packets (0x13) plen 5    #115 [hci1] 10.697759
        Num handles: 1
        Handle: 93 Address: DF:A9:FF:F6:B1:1A (OUI DF-A9-FF)
        Count: 1
        #114: len 21 (1 Kb/s)
        Latency: 166 msec (73-174 msec ~166 msec)
> ACL Data RX: Handle 93 flags 0x02 dlen 21               #116 [hci1] 10.698090
      SMP: Pairing Random (0x04) len 16
        Random value: a5535c88316315a50000000000000000
< HCI Command: Host Number of Com.. (0x03|0x0035) plen 5  #117 [hci1] 10.711354
        Num handles: 1
        Handle: 93 Address: DF:A9:FF:F6:B1:1A (OUI DF-A9-FF)
        Count: 1
< ACL Data TX: Handle 93 flags 0x00 dlen 21               #118 [hci1] 10.711427
      SMP: Pairing Random (0x04) len 16
        Random value: dddbdfe2838e9a8cc6964353c850fef7
> HCI Event: Number of Completed Packets (0x13) plen 5    #119 [hci1] 10.872660
        Num handles: 1
        Handle: 93 Address: DF:A9:FF:F6:B1:1A (OUI DF-A9-FF)
        Count: 1
        #118: len 21 (1 Kb/s)
        Latency: 161 msec (73-174 msec ~163 msec)
> ACL Data RX: Handle 93 flags 0x02 dlen 21               #120 [hci1] 10.960428
      SMP: Pairing Confirm (0x03) len 16
        Confim value: 6456caa1c109349ed6394fb2a9915da3
< HCI Command: Host Number of Com.. (0x03|0x0035) plen 5  #121 [hci1] 10.971107
        Num handles: 1
        Handle: 93 Address: DF:A9:FF:F6:B1:1A (OUI DF-A9-FF)
        Count: 1
< ACL Data TX: Handle 93 flags 0x00 dlen 21               #122 [hci1] 10.971280
      SMP: Pairing Confirm (0x03) len 16
        Confim value: 069a9a7d8b87121366e8e8862e1feaea
> HCI Event: Number of Completed Packets (0x13) plen 5    #123 [hci1] 11.135225
        Num handles: 1
        Handle: 93 Address: DF:A9:FF:F6:B1:1A (OUI DF-A9-FF)
        Count: 1
        #122: len 21 (1 Kb/s)
        Latency: 163 msec (73-174 msec ~163 msec)
> ACL Data RX: Handle 93 flags 0x02 dlen 21               #124 [hci1] 11.135523
      SMP: Pairing Random (0x04) len 16
        Random value: 8cb536c4ee3fa2e20000000000000000
< HCI Command: Host Number of Com.. (0x03|0x0035) plen 5  #125 [hci1] 11.151352
        Num handles: 1
        Handle: 93 Address: DF:A9:FF:F6:B1:1A (OUI DF-A9-FF)
        Count: 1
< ACL Data TX: Handle 93 flags 0x00 dlen 21               #126 [hci1] 11.151485
      SMP: Pairing Random (0x04) len 16
        Random value: eb9f1915536596b6fc3db1c86b2b1970
> HCI Event: Number of Completed Packets (0x13) plen 5    #127 [hci1] 11.310033
        Num handles: 1
        Handle: 93 Address: DF:A9:FF:F6:B1:1A (OUI DF-A9-FF)
        Count: 1
        #126: len 21 (1 Kb/s)
        Latency: 158 msec (73-174 msec ~161 msec)
> ACL Data RX: Handle 93 flags 0x02 dlen 21               #128 [hci1] 11.397733
      SMP: Pairing Confirm (0x03) len 16
        Confim value: 801d9954f785a704b44b3481852cab86
< HCI Command: Host Number of Com.. (0x03|0x0035) plen 5  #129 [hci1] 11.410870
        Num handles: 1
        Handle: 93 Address: DF:A9:FF:F6:B1:1A (OUI DF-A9-FF)
        Count: 1
< ACL Data TX: Handle 93 flags 0x00 dlen 21               #130 [hci1] 11.411012
      SMP: Pairing Confirm (0x03) len 16
        Confim value: 4bdb3c38661d3b9e988434e187298589
> HCI Event: Number of Completed Packets (0x13) plen 5    #131 [hci1] 11.572625
        Num handles: 1
        Handle: 93 Address: DF:A9:FF:F6:B1:1A (OUI DF-A9-FF)
        Count: 1
        #130: len 21 (1 Kb/s)
        Latency: 161 msec (73-174 msec ~161 msec)
> ACL Data RX: Handle 93 flags 0x02 dlen 21               #132 [hci1] 11.573049
      SMP: Pairing Random (0x04) len 16
        Random value: e5ff3b3ae680fa2a0000000000000000
< HCI Command: Host Number of Com.. (0x03|0x0035) plen 5  #133 [hci1] 11.591288
        Num handles: 1
        Handle: 93 Address: DF:A9:FF:F6:B1:1A (OUI DF-A9-FF)
        Count: 1
< ACL Data TX: Handle 93 flags 0x00 dlen 21               #134 [hci1] 11.591450
      SMP: Pairing Random (0x04) len 16
        Random value: 5c794dc9ad9f2c3f295ebd5ad5e1c3cf
> HCI Event: Number of Completed Packets (0x13) plen 5    #135 [hci1] 11.747493
        Num handles: 1
        Handle: 93 Address: DF:A9:FF:F6:B1:1A (OUI DF-A9-FF)
        Count: 1
        #134: len 21 (1 Kb/s)
        Latency: 156 msec (73-174 msec ~158 msec)
> ACL Data RX: Handle 93 flags 0x02 dlen 21               #136 [hci1] 11.835283
      SMP: Pairing Confirm (0x03) len 16
        Confim value: 99e4f04361ebfae3467340b452afcacd
< HCI Command: Host Number of Com.. (0x03|0x0035) plen 5  #137 [hci1] 11.851105
        Num handles: 1
        Handle: 93 Address: DF:A9:FF:F6:B1:1A (OUI DF-A9-FF)
        Count: 1
< ACL Data TX: Handle 93 flags 0x00 dlen 21               #138 [hci1] 11.851298
      SMP: Pairing Confirm (0x03) len 16
        Confim value: a2d371cc7ad251d617e8aec036d6c32c
> HCI Event: Number of Completed Packets (0x13) plen 5    #139 [hci1] 12.010136
        Num handles: 1
        Handle: 93 Address: DF:A9:FF:F6:B1:1A (OUI DF-A9-FF)
        Count: 1
        #138: len 21 (1 Kb/s)
        Latency: 158 msec (73-174 msec ~158 msec)
> ACL Data RX: Handle 93 flags 0x02 dlen 21               #140 [hci1] 12.010600
      SMP: Pairing Random (0x04) len 16
        Random value: 27521916e65715880000000000000000
< HCI Command: Host Number of Com.. (0x03|0x0035) plen 5  #141 [hci1] 12.031077
        Num handles: 1
        Handle: 93 Address: DF:A9:FF:F6:B1:1A (OUI DF-A9-FF)
        Count: 1
< ACL Data TX: Handle 93 flags 0x00 dlen 21               #142 [hci1] 12.031277
      SMP: Pairing Random (0x04) len 16
        Random value: 5c2fff312cdf99c9491988e877355a9a
> HCI Event: Number of Completed Packets (0x13) plen 5    #143 [hci1] 12.184863
        Num handles: 1
        Handle: 93 Address: DF:A9:FF:F6:B1:1A (OUI DF-A9-FF)
        Count: 1
        #142: len 21 (1 Kb/s)
        Latency: 153 msec (73-174 msec ~156 msec)
> ACL Data RX: Handle 93 flags 0x02 dlen 21               #144 [hci1] 12.272810
      SMP: Pairing Confirm (0x03) len 16
        Confim value: 3081b06fd82de89df725c8b1a40e350e
< HCI Command: Host Number of Com.. (0x03|0x0035) plen 5  #145 [hci1] 12.290937
        Num handles: 1
        Handle: 93 Address: DF:A9:FF:F6:B1:1A (OUI DF-A9-FF)
        Count: 1
< ACL Data TX: Handle 93 flags 0x00 dlen 21               #146 [hci1] 12.291079
      SMP: Pairing Confirm (0x03) len 16
        Confim value: 3e09c61a17eb093e491dcb93aac48fbc
> HCI Event: Number of Completed Packets (0x13) plen 5    #147 [hci1] 12.447667
        Num handles: 1
        Handle: 93 Address: DF:A9:FF:F6:B1:1A (OUI DF-A9-FF)
        Count: 1
        #146: len 21 (1 Kb/s)
        Latency: 156 msec (73-174 msec ~156 msec)
> ACL Data RX: Handle 93 flags 0x02 dlen 21               #148 [hci1] 12.447937
      SMP: Pairing Random (0x04) len 16
        Random value: b5d64cf9f76cc15b0000000000000000
< HCI Command: Host Number of Com.. (0x03|0x0035) plen 5  #149 [hci1] 12.451360
        Num handles: 1
        Handle: 93 Address: DF:A9:FF:F6:B1:1A (OUI DF-A9-FF)
        Count: 1
< ACL Data TX: Handle 93 flags 0x00 dlen 21               #150 [hci1] 12.451499
      SMP: Pairing Random (0x04) len 16
        Random value: c629a3a987d808e808655d558dfc1155
> HCI Event: Number of Completed Packets (0x13) plen 5    #151 [hci1] 12.622397
        Num handles: 1
        Handle: 93 Address: DF:A9:FF:F6:B1:1A (OUI DF-A9-FF)
        Count: 1
        #150: len 21 (0 Kb/s)
        Latency: 170 msec (73-174 msec ~163 msec)
> ACL Data RX: Handle 93 flags 0x02 dlen 21               #152 [hci1] 12.710242
      SMP: Pairing Confirm (0x03) len 16
        Confim value: fa0955bafc4144153f4e01e209e68a0f
< HCI Command: Host Number of Com.. (0x03|0x0035) plen 5  #153 [hci1] 12.710877
        Num handles: 1
        Handle: 93 Address: DF:A9:FF:F6:B1:1A (OUI DF-A9-FF)
        Count: 1
< ACL Data TX: Handle 93 flags 0x00 dlen 21               #154 [hci1] 12.711013
      SMP: Pairing Confirm (0x03) len 16
        Confim value: 6e0eb17a2eebf53058bbcff0a1be822a
> HCI Event: Number of Completed Packets (0x13) plen 5    #155 [hci1] 12.885136
        Num handles: 1
        Handle: 93 Address: DF:A9:FF:F6:B1:1A (OUI DF-A9-FF)
        Count: 1
        #154: len 21 (0 Kb/s)
        Latency: 174 msec (73-174 msec ~168 msec)
> ACL Data RX: Handle 93 flags 0x02 dlen 21               #156 [hci1] 12.885553
      SMP: Pairing Random (0x04) len 16
        Random value: f2b415fa44dd947f0000000000000000
< HCI Command: Host Number of Com.. (0x03|0x0035) plen 5  #157 [hci1] 12.891324
        Num handles: 1
        Handle: 93 Address: DF:A9:FF:F6:B1:1A (OUI DF-A9-FF)
        Count: 1
< ACL Data TX: Handle 93 flags 0x00 dlen 21               #158 [hci1] 12.891446
      SMP: Pairing Random (0x04) len 16
        Random value: 92f20f6ad8f13724432c7fd6001c45ff
> HCI Event: Number of Completed Packets (0x13) plen 5    #159 [hci1] 13.059870
        Num handles: 1
        Handle: 93 Address: DF:A9:FF:F6:B1:1A (OUI DF-A9-FF)
        Count: 1
        #158: len 21 (1 Kb/s)
        Latency: 168 msec (73-174 msec ~168 msec)
> ACL Data RX: Handle 93 flags 0x02 dlen 21               #160 [hci1] 13.147697
      SMP: Pairing Confirm (0x03) len 16
        Confim value: 38720b6da7e230271a6be55fc3d988e1
< HCI Command: Host Number of Com.. (0x03|0x0035) plen 5  #161 [hci1] 13.151098
        Num handles: 1
        Handle: 93 Address: DF:A9:FF:F6:B1:1A (OUI DF-A9-FF)
        Count: 1
< ACL Data TX: Handle 93 flags 0x00 dlen 21               #162 [hci1] 13.151175
      SMP: Pairing Confirm (0x03) len 16
        Confim value: ed5278771926417146ff3896f60130a6
> HCI Event: Number of Completed Packets (0x13) plen 5    #163 [hci1] 13.322573
        Num handles: 1
        Handle: 93 Address: DF:A9:FF:F6:B1:1A (OUI DF-A9-FF)
        Count: 1
        #162: len 21 (0 Kb/s)
        Latency: 171 msec (73-174 msec ~170 msec)
> ACL Data RX: Handle 93 flags 0x02 dlen 21               #164 [hci1] 13.322881
      SMP: Pairing Random (0x04) len 16
        Random value: df1abde391d2853c0000000000000000
< HCI Command: Host Number of Com.. (0x03|0x0035) plen 5  #165 [hci1] 13.331043
        Num handles: 1
        Handle: 93 Address: DF:A9:FF:F6:B1:1A (OUI DF-A9-FF)
        Count: 1
< ACL Data TX: Handle 93 flags 0x00 dlen 21               #166 [hci1] 13.331094
      SMP: Pairing Random (0x04) len 16
        Random value: 23ac32ebbb5e14c8a6b9622f296d277f
> HCI Event: Number of Completed Packets (0x13) plen 5    #167 [hci1] 13.497381
        Num handles: 1
        Handle: 93 Address: DF:A9:FF:F6:B1:1A (OUI DF-A9-FF)
        Count: 1
        #166: len 21 (1 Kb/s)
        Latency: 166 msec (73-174 msec ~168 msec)
> ACL Data RX: Handle 93 flags 0x02 dlen 21               #168 [hci1] 13.585282
      SMP: Pairing Confirm (0x03) len 16
        Confim value: facb484c990a05068d98ddec0e8852e6
< HCI Command: Host Number of Com.. (0x03|0x0035) plen 5  #169 [hci1] 13.591159
        Num handles: 1
        Handle: 93 Address: DF:A9:FF:F6:B1:1A (OUI DF-A9-FF)
        Count: 1
< ACL Data TX: Handle 93 flags 0x00 dlen 21               #170 [hci1] 13.591373
      SMP: Pairing Confirm (0x03) len 16
        Confim value: d11923d909001e49a71db170e2372fe1
> HCI Event: Number of Completed Packets (0x13) plen 5    #171 [hci1] 13.760133
        Num handles: 1
        Handle: 93 Address: DF:A9:FF:F6:B1:1A (OUI DF-A9-FF)
        Count: 1
        #170: len 21 (1 Kb/s)
        Latency: 168 msec (73-174 msec ~168 msec)
> ACL Data RX: Handle 93 flags 0x02 dlen 21               #172 [hci1] 13.760550
      SMP: Pairing Random (0x04) len 16
        Random value: 6f7ca01df107ab9b0000000000000000
< HCI Command: Host Number of Com.. (0x03|0x0035) plen 5  #173 [hci1] 13.771073
        Num handles: 1
        Handle: 93 Address: DF:A9:FF:F6:B1:1A (OUI DF-A9-FF)
        Count: 1
< ACL Data TX: Handle 93 flags 0x00 dlen 21               #174 [hci1] 13.771112
      SMP: Pairing Random (0x04) len 16
        Random value: 297efe85e67448a15f56bd27e3a3cf1d
> HCI Event: Number of Completed Packets (0x13) plen 5    #175 [hci1] 13.934882
        Num handles: 1
        Handle: 93 Address: DF:A9:FF:F6:B1:1A (OUI DF-A9-FF)
        Count: 1
        #174: len 21 (1 Kb/s)
        Latency: 163 msec (73-174 msec ~166 msec)
> ACL Data RX: Handle 93 flags 0x02 dlen 21               #176 [hci1] 14.022719
      SMP: Pairing Confirm (0x03) len 16
        Confim value: 67de5b708d005e8afe9e8efeea3b5f89
< HCI Command: Host Number of Com.. (0x03|0x0035) plen 5  #177 [hci1] 14.031173
        Num handles: 1
        Handle: 93 Address: DF:A9:FF:F6:B1:1A (OUI DF-A9-FF)
        Count: 1
< ACL Data TX: Handle 93 flags 0x00 dlen 21               #178 [hci1] 14.031364
      SMP: Pairing Confirm (0x03) len 16
        Confim value: 3f4caf9547367a8adc273312cd173708
> HCI Event: Number of Completed Packets (0x13) plen 5    #179 [hci1] 14.197639
        Num handles: 1
        Handle: 93 Address: DF:A9:FF:F6:B1:1A (OUI DF-A9-FF)
        Count: 1
        #178: len 21 (1 Kb/s)
        Latency: 166 msec (73-174 msec ~166 msec)
> ACL Data RX: Handle 93 flags 0x02 dlen 21               #180 [hci1] 14.197911
      SMP: Pairing Random (0x04) len 16
        Random value: 279338fbdf87b53e0000000000000000
< HCI Command: Host Number of Com.. (0x03|0x0035) plen 5  #181 [hci1] 14.210924
        Num handles: 1
        Handle: 93 Address: DF:A9:FF:F6:B1:1A (OUI DF-A9-FF)
        Count: 1
< ACL Data TX: Handle 93 flags 0x00 dlen 21               #182 [hci1] 14.211007
      SMP: Pairing Random (0x04) len 16
        Random value: 25a9493fd3ce4faf02be7293595bb7c6
> HCI Event: Number of Completed Packets (0x13) plen 5    #183 [hci1] 14.372361
        Num handles: 1
        Handle: 93 Address: DF:A9:FF:F6:B1:1A (OUI DF-A9-FF)
        Count: 1
        #182: len 21 (1 Kb/s)
        Latency: 161 msec (73-174 msec ~163 msec)
> ACL Data RX: Handle 93 flags 0x02 dlen 21               #184 [hci1] 14.460242
      SMP: Pairing Confirm (0x03) len 16
        Confim value: 761d602aa7cf321d414137f9de25aa4e
< HCI Command: Host Number of Com.. (0x03|0x0035) plen 5  #185 [hci1] 14.470928
        Num handles: 1
        Handle: 93 Address: DF:A9:FF:F6:B1:1A (OUI DF-A9-FF)
        Count: 1
< ACL Data TX: Handle 93 flags 0x00 dlen 21               #186 [hci1] 14.471062
      SMP: Pairing Confirm (0x03) len 16
        Confim value: 62c7adef94ab921ba9a1f17aaca1ae6b
> HCI Event: Number of Completed Packets (0x13) plen 5    #187 [hci1] 14.635105
        Num handles: 1
        Handle: 93 Address: DF:A9:FF:F6:B1:1A (OUI DF-A9-FF)
        Count: 1
        #186: len 21 (1 Kb/s)
        Latency: 164 msec (73-174 msec ~163 msec)
> ACL Data RX: Handle 93 flags 0x02 dlen 21               #188 [hci1] 14.635418
      SMP: Pairing Random (0x04) len 16
        Random value: fa8db4d2c1d53ff40000000000000000
< HCI Command: Host Number of Com.. (0x03|0x0035) plen 5  #189 [hci1] 14.651328
        Num handles: 1
        Handle: 93 Address: DF:A9:FF:F6:B1:1A (OUI DF-A9-FF)
        Count: 1
< ACL Data TX: Handle 93 flags 0x00 dlen 21               #190 [hci1] 14.651433
      SMP: Pairing Random (0x04) len 16
        Random value: 58f6b41f855a6f6c3560debd84e2affc
> HCI Event: Number of Completed Packets (0x13) plen 5    #191 [hci1] 14.809820
        Num handles: 1
        Handle: 93 Address: DF:A9:FF:F6:B1:1A (OUI DF-A9-FF)
        Count: 1
        #190: len 21 (1 Kb/s)
        Latency: 158 msec (73-174 msec ~161 msec)
> ACL Data RX: Handle 93 flags 0x02 dlen 21               #192 [hci1] 14.897769
      SMP: Pairing Confirm (0x03) len 16
        Confim value: 2520ac1d507eef121146834135e75e85
< HCI Command: Host Number of Com.. (0x03|0x0035) plen 5  #193 [hci1] 14.911162
        Num handles: 1
        Handle: 93 Address: DF:A9:FF:F6:B1:1A (OUI DF-A9-FF)
        Count: 1
< ACL Data TX: Handle 93 flags 0x00 dlen 21               #194 [hci1] 14.911381
      SMP: Pairing Confirm (0x03) len 16
        Confim value: 7ad475f9d45506687bfcc3e6f4a13218
> HCI Event: Number of Completed Packets (0x13) plen 5    #195 [hci1] 15.072563
        Num handles: 1
        Handle: 93 Address: DF:A9:FF:F6:B1:1A (OUI DF-A9-FF)
        Count: 1
        #194: len 21 (1 Kb/s)
        Latency: 161 msec (73-174 msec ~161 msec)
> ACL Data RX: Handle 93 flags 0x02 dlen 21               #196 [hci1] 15.072877
      SMP: Pairing Random (0x04) len 16
        Random value: b9f606fa8dbf2f8e0000000000000000
< HCI Command: Host Number of Com.. (0x03|0x0035) plen 5  #197 [hci1] 15.091372
        Num handles: 1
        Handle: 93 Address: DF:A9:FF:F6:B1:1A (OUI DF-A9-FF)
        Count: 1
< ACL Data TX: Handle 93 flags 0x00 dlen 21               #198 [hci1] 15.091509
      SMP: Pairing Random (0x04) len 16
        Random value: b67e7216d5bf664139eda2b542549666
> HCI Event: Number of Completed Packets (0x13) plen 5    #199 [hci1] 15.247333
        Num handles: 1
        Handle: 93 Address: DF:A9:FF:F6:B1:1A (OUI DF-A9-FF)
        Count: 1
        #198: len 21 (1 Kb/s)
        Latency: 155 msec (73-174 msec ~158 msec)
> ACL Data RX: Handle 93 flags 0x02 dlen 21               #200 [hci1] 15.335258
      SMP: Pairing Confirm (0x03) len 16
        Confim value: daeb022e317909815d69ace507eab772
< HCI Command: Host Number of Com.. (0x03|0x0035) plen 5  #201 [hci1] 15.351247
        Num handles: 1
        Handle: 93 Address: DF:A9:FF:F6:B1:1A (OUI DF-A9-FF)
        Count: 1
< ACL Data TX: Handle 93 flags 0x00 dlen 21               #202 [hci1] 15.351476
      SMP: Pairing Confirm (0x03) len 16
        Confim value: 0545bfa42d9a01fb3a2f39c01593b307
> HCI Event: Number of Completed Packets (0x13) plen 5    #203 [hci1] 15.510103
        Num handles: 1
        Handle: 93 Address: DF:A9:FF:F6:B1:1A (OUI DF-A9-FF)
        Count: 1
        #202: len 21 (1 Kb/s)
        Latency: 158 msec (73-174 msec ~158 msec)
> ACL Data RX: Handle 93 flags 0x02 dlen 21               #204 [hci1] 15.510369
      SMP: Pairing Random (0x04) len 16
        Random value: 0849434318a3eeb80000000000000000
< HCI Command: Host Number of Com.. (0x03|0x0035) plen 5  #205 [hci1] 15.511296
        Num handles: 1
        Handle: 93 Address: DF:A9:FF:F6:B1:1A (OUI DF-A9-FF)
        Count: 1
< ACL Data TX: Handle 93 flags 0x00 dlen 21               #206 [hci1] 15.511372
      SMP: Pairing Random (0x04) len 16
        Random value: ed17f76500c95219dd01e09d1e63f87b
> HCI Event: Number of Completed Packets (0x13) plen 5    #207 [hci1] 15.684910
        Num handles: 1
        Handle: 93 Address: DF:A9:FF:F6:B1:1A (OUI DF-A9-FF)
        Count: 1
        #206: len 21 (0 Kb/s)
        Latency: 173 msec (73-174 msec ~166 msec)
> ACL Data RX: Handle 93 flags 0x02 dlen 21               #208 [hci1] 15.772613
      SMP: Pairing Confirm (0x03) len 16
        Confim value: b3f0de0874c1237d729ae8c9d5a55644
< HCI Command: Host Number of Com.. (0x03|0x0035) plen 5  #209 [hci1] 15.790972
        Num handles: 1
        Handle: 93 Address: DF:A9:FF:F6:B1:1A (OUI DF-A9-FF)
        Count: 1
< ACL Data TX: Handle 93 flags 0x00 dlen 21               #210 [hci1] 15.791088
      SMP: Pairing Confirm (0x03) len 16
        Confim value: e3480ba1f3cd6ec4cd9bc66d859d668e
> HCI Event: Number of Completed Packets (0x13) plen 5    #211 [hci1] 15.947624
        Num handles: 1
        Handle: 93 Address: DF:A9:FF:F6:B1:1A (OUI DF-A9-FF)
        Count: 1
        #210: len 21 (1 Kb/s)
        Latency: 156 msec (73-174 msec ~161 msec)
> ACL Data RX: Handle 93 flags 0x02 dlen 21               #212 [hci1] 15.947877
      SMP: Pairing Random (0x04) len 16
        Random value: 5b4bead48ad5fb1c0000000000000000
< HCI Command: Host Number of Com.. (0x03|0x0035) plen 5  #213 [hci1] 15.951388
        Num handles: 1
        Handle: 93 Address: DF:A9:FF:F6:B1:1A (OUI DF-A9-FF)
        Count: 1
< ACL Data TX: Handle 93 flags 0x00 dlen 21               #214 [hci1] 15.951437
      SMP: Pairing Random (0x04) len 16
        Random value: 81d35d47e1f6006d79c974bd9d9e1ee3
> HCI Event: Number of Completed Packets (0x13) plen 5    #215 [hci1] 16.122337
        Num handles: 1
        Handle: 93 Address: DF:A9:FF:F6:B1:1A (OUI DF-A9-FF)
        Count: 1
        #214: len 21 (0 Kb/s)
        Latency: 170 msec (73-174 msec ~166 msec)
> ACL Data RX: Handle 93 flags 0x02 dlen 21               #216 [hci1] 16.210103
      SMP: Pairing Confirm (0x03) len 16
        Confim value: 7ec85e3ab32de8d3bddeb2d08f360a94
< HCI Command: Host Number of Com.. (0x03|0x0035) plen 5  #217 [hci1] 16.211214
        Num handles: 1
        Handle: 93 Address: DF:A9:FF:F6:B1:1A (OUI DF-A9-FF)
        Count: 1
< ACL Data TX: Handle 93 flags 0x00 dlen 21               #218 [hci1] 16.211398
      SMP: Pairing Confirm (0x03) len 16
        Confim value: 747336d244c03f5ffaa5090f8f9cd636
> HCI Event: Number of Completed Packets (0x13) plen 5    #219 [hci1] 16.385116
        Num handles: 1
        Handle: 93 Address: DF:A9:FF:F6:B1:1A (OUI DF-A9-FF)
        Count: 1
        #218: len 21 (0 Kb/s)
        Latency: 173 msec (73-174 msec ~169 msec)
> ACL Data RX: Handle 93 flags 0x02 dlen 21               #220 [hci1] 16.385333
      SMP: Pairing Random (0x04) len 16
        Random value: e1c43f3a62e933e90000000000000000
< HCI Command: Host Number of Com.. (0x03|0x0035) plen 5  #221 [hci1] 16.391103
        Num handles: 1
        Handle: 93 Address: DF:A9:FF:F6:B1:1A (OUI DF-A9-FF)
        Count: 1
< ACL Data TX: Handle 93 flags 0x00 dlen 21               #222 [hci1] 16.391157
      SMP: Pairing Random (0x04) len 16
        Random value: e7f7e0c2476823e41736a7e381bafb7c
> HCI Event: Number of Completed Packets (0x13) plen 5    #223 [hci1] 16.559915
        Num handles: 1
        Handle: 93 Address: DF:A9:FF:F6:B1:1A (OUI DF-A9-FF)
        Count: 1
        #222: len 21 (1 Kb/s)
        Latency: 168 msec (73-174 msec ~169 msec)
> ACL Data RX: Handle 93 flags 0x02 dlen 21               #224 [hci1] 16.647642
      SMP: Pairing Confirm (0x03) len 16
        Confim value: 157b7c8d652d8244774d4beecec6eae7
< HCI Command: Host Number of Com.. (0x03|0x0035) plen 5  #225 [hci1] 16.650951
        Num handles: 1
        Handle: 93 Address: DF:A9:FF:F6:B1:1A (OUI DF-A9-FF)
        Count: 1
< ACL Data TX: Handle 93 flags 0x00 dlen 21               #226 [hci1] 16.651079
      SMP: Pairing Confirm (0x03) len 16
        Confim value: 9dc166e78f5d1b769953757f2d2e1a9e
> HCI Event: Number of Completed Packets (0x13) plen 5    #227 [hci1] 16.822635
        Num handles: 1
        Handle: 93 Address: DF:A9:FF:F6:B1:1A (OUI DF-A9-FF)
        Count: 1
        #226: len 21 (0 Kb/s)
        Latency: 171 msec (73-174 msec ~170 msec)
> ACL Data RX: Handle 93 flags 0x02 dlen 21               #228 [hci1] 16.822984
      SMP: Pairing Random (0x04) len 16
        Random value: e7ed3ebe011c1b790000000000000000
< HCI Command: Host Number of Com.. (0x03|0x0035) plen 5  #229 [hci1] 16.831244
        Num handles: 1
        Handle: 93 Address: DF:A9:FF:F6:B1:1A (OUI DF-A9-FF)
        Count: 1
