Bluetooth monitor ver 5.72
btmon[2673532]: = Note: Linux version 6.14.0-35-generic (x86_64)                                                         0.924500
btmon[2673532]: = Note: Bluetooth subsystem version 2.22                                                                 0.924502
= New Index: 00:00:00:00:00:00 (Primary,UART,hci1)                                                                       0.924503
= New Index: 48:5F:99:8E:E0:64 (Primary,USB,hci0)                                                                        0.924504
= Open Index: 00:00:00:00:00:00                                                                                          1.438150
= Index Info: 00:00:00:00:00:00 (Nordic Semiconductor ASA)                                                               1.438168
zephyr.exe[2673534]: @ USER Open: main (privileged) version 2.22                                                {0x0001} 1.438177
zephyr.exe[2673534]: < HCI Command: Reset (0x03|0x0003) plen 0                                                        #1 1.439410
> HCI Event: Command Complete (0x0e) plen 4                                                                           #2 1.439943
      Reset (0x03|0x0003) ncmd 1
        Status: Success (0x00)
zephyr.exe[2673534]: < HCI Command: Read Local Supported Features (0x04|0x0003) plen 0                                #3 1.457918
> HCI Event: Command Complete (0x0e) plen 12                                                                          #4 1.458506
      Read Local Supported Features (0x04|0x0003) ncmd 1
        Status: Success (0x00)
        Features: 0x00 0x00 0x00 0x00 0x60 0x00 0x00 0x00
          BR/EDR Not Supported
          LE Supported (Controller)
zephyr.exe[2673534]: < HCI Command: Read Local Version Information (0x04|0x0001) plen 0                               #5 1.477660
> HCI Event: Command Complete (0x0e) plen 12                                                                          #6 1.478106
      Read Local Version Information (0x04|0x0001) ncmd 1
        Status: Success (0x00)
        HCI version: Reserved (0x0e) - Revision 12520 (0x30e8)
        LMP version: Reserved (0x0e) - Subversion 12520 (0x30e8)
        Manufacturer: Nordic Semiconductor ASA (89)
zephyr.exe[2673534]: < HCI Command: Read Local Supported Commands (0x04|0x0002) plen 0                                #7 1.497565
> HCI Event: Command Complete (0x0e) plen 68                                                                          #8 1.498606
      Read Local Supported Commands (0x04|0x0002) ncmd 1
        Status: Success (0x00)
        Commands: 119 entries
          Disconnect (Octet 0 - Bit 5)
          Read Remote Version Information (Octet 2 - Bit 7)
          Set Event Mask (Octet 5 - Bit 6)
          Reset (Octet 5 - Bit 7)
          Read Connection Accept Timeout (Octet 7 - Bit 2)
          Write Connection Accept Timeout (Octet 7 - Bit 3)
          Read Transmit Power Level (Octet 10 - Bit 2)
          Set Controller To Host Flow Control (Octet 10 - Bit 5)
          Host Buffer Size (Octet 10 - Bit 6)
          Host Number of Completed Packets (Octet 10 - Bit 7)
          Read Local Version Information (Octet 14 - Bit 3)
          Read Local Supported Features (Octet 14 - Bit 5)
          Read BD ADDR (Octet 15 - Bit 1)
          Read RSSI (Octet 15 - Bit 5)
          Set Event Mask Page 2 (Octet 22 - Bit 2)
          LE Set Event Mask (Octet 25 - Bit 0)
          LE Read Buffer Size (Octet 25 - Bit 1)
          LE Read Local Supported Features (Octet 25 - Bit 2)
          LE Set Random Address (Octet 25 - Bit 4)
          LE Set Advertising Parameters (Octet 25 - Bit 5)
          LE Read Advertising Channel TX Power (Octet 25 - Bit 6)
          LE Set Advertising Data (Octet 25 - Bit 7)
          LE Set Scan Response Data (Octet 26 - Bit 0)
          LE Set Advertise Enable (Octet 26 - Bit 1)
          LE Set Scan Parameters (Octet 26 - Bit 2)
          LE Set Scan Enable (Octet 26 - Bit 3)
          LE Create Connection (Octet 26 - Bit 4)
          LE Create Connection Cancel (Octet 26 - Bit 5)
          LE Read Accept List Size (Octet 26 - Bit 6)
          LE Clear Accept List (Octet 26 - Bit 7)
          LE Add Device To Accept List (Octet 27 - Bit 0)
          LE Remove Device From Accept List (Octet 27 - Bit 1)
          LE Connection Update (Octet 27 - Bit 2)
          LE Set Host Channel Classification (Octet 27 - Bit 3)
          LE Read Channel Map (Octet 27 - Bit 4)
          LE Read Remote Used Features (Octet 27 - Bit 5)
          LE Encrypt (Octet 27 - Bit 6)
          LE Rand (Octet 27 - Bit 7)
          LE Start Encryption (Octet 28 - Bit 0)
          LE Long Term Key Request Reply (Octet 28 - Bit 1)
          LE Long Term Key Request Neg Reply (Octet 28 - Bit 2)
          LE Read Supported States (Octet 28 - Bit 3)
          LE Receiver Test (Octet 28 - Bit 4)
          LE Transmitter Test (Octet 28 - Bit 5)
          LE Test End (Octet 28 - Bit 6)
          Read Authenticated Payload Timeout (Octet 32 - Bit 4)
          Write Authenticated Payload Timeout (Octet 32 - Bit 5)
          LE Set Data Length (Octet 33 - Bit 6)
          LE Read Suggested Default Data Length (Octet 33 - Bit 7)
          LE Write Suggested Default Data Length (Octet 34 - Bit 0)
          LE Add Device To Resolving List (Octet 34 - Bit 3)
          LE Remove Device From Resolving List (Octet 34 - Bit 4)
          LE Clear Resolving List (Octet 34 - Bit 5)
          LE Read Resolving List Size (Octet 34 - Bit 6)
          LE Set Address Resolution Enable (Octet 35 - Bit 1)
          LE Set Resolvable Private Address Timeout (Octet 35 - Bit 2)
          LE Read Maximum Data Length (Octet 35 - Bit 3)
          LE Read PHY (Octet 35 - Bit 4)
          LE Set Default PHY (Octet 35 - Bit 5)
          LE Set PHY (Octet 35 - Bit 6)
          LE Enhanced Receiver Test (Octet 35 - Bit 7)
          LE Enhanced Transmitter Test (Octet 36 - Bit 0)
          LE Set Advertising Set Random Address (Octet 36 - Bit 1)
          LE Set Extended Advertising Parameters (Octet 36 - Bit 2)
          LE Set Extended Advertising Data (Octet 36 - Bit 3)
          LE Set Extended Scan Response Data (Octet 36 - Bit 4)
          LE Set Extended Advertising Enable (Octet 36 - Bit 5)
          LE Read Maximum Advertising Data Length (Octet 36 - Bit 6)
          LE Read Number of Supported Advertising Sets (Octet 36 - Bit 7)
          LE Remove Advertising Set (Octet 37 - Bit 0)
          LE Clear Advertising Sets (Octet 37 - Bit 1)
          LE Set Periodic Advertising Parameters (Octet 37 - Bit 2)
          LE Set Periodic Advertising Data (Octet 37 - Bit 3)
          LE Set Periodic Advertising Enable (Octet 37 - Bit 4)
          LE Set Extended Scan Parameters (Octet 37 - Bit 5)
          LE Set Extended Scan Enable (Octet 37 - Bit 6)
          LE Extended Create Connection (Octet 37 - Bit 7)
          LE Periodic Advertising Create Sync (Octet 38 - Bit 0)
          LE Periodic Advertising Create Sync Cancel (Octet 38 - Bit 1)
          LE Periodic Advertising Terminate Sync (Octet 38 - Bit 2)
          LE Add Device To Periodic Advertiser List (Octet 38 - Bit 3)
          LE Remove Device From Periodic Advertiser List (Octet 38 - Bit 4)
          LE Clear Periodic Advertiser List (Octet 38 - Bit 5)
          LE Read Periodic Advertiser List Size (Octet 38 - Bit 6)
          LE Read Transmit Power (Octet 38 - Bit 7)
          LE Read RF Path Compensation (Octet 39 - Bit 0)
          LE Write RF Path Compensation (Octet 39 - Bit 1)
          LE Set Privacy Mode (Octet 39 - Bit 2)
          LE Periodic Advertising Receive Enable (Octet 40 - Bit 5)
          LE Periodic Advertising Sync Transfer (Octet 40 - Bit 6)
          LE Periodic Advertising Set Info Transfer (Octet 40 - Bit 7)
          LE Periodic Advertising Sync Transfer Parameters (Octet 41 - Bit 0)
          LE Set Default Periodic Advertisng Sync Transfer Parameters (Octet 41 - Bit 1)
          LE Read Buffer v2 (Octet 41 - Bit 5)
          LE Read ISO TX Sync (Octet 41 - Bit 6)
          LE Set Connected Isochronous Group Parameters (Octet 41 - Bit 7)
          LE Set Connected Isochronous Group Parameters Test (Octet 42 - Bit 0)
          LE Create Connected Isochronous Stream (Octet 42 - Bit 1)
          LE Remove Connected Isochronous Group (Octet 42 - Bit 2)
          LE Accept Connected Isochronous Stream Request (Octet 42 - Bit 3)
          LE Reject Connected Isochronous Stream Request (Octet 42 - Bit 4)
          LE Create Broadcast Isochronous Group (Octet 42 - Bit 5)
          LE Create Broadcast Isochronous Group Test (Octet 42 - Bit 6)
          LE Terminate Broadcast Isochronous Group (Octet 42 - Bit 7)
          LE Broadcast Isochronous Group Create Sync (Octet 43 - Bit 0)
          LE Broadcast Isochronous Group Terminate Sync (Octet 43 - Bit 1)
          LE Request Peer SCA (Octet 43 - Bit 2)
          LE Setup Isochronous Data Path (Octet 43 - Bit 3)
          LE Remove Isochronous Data Path (Octet 43 - Bit 4)
          LE Isochronous Transmit Test (Octet 43 - Bit 5)
          LE Isochronous Receive Test (Octet 43 - Bit 6)
          LE Isochronous Read Test Counters (Octet 43 - Bit 7)
          LE Isochronous Read Test Counters (Octet 44 - Bit 0)
          LE Set Host Feature (Octet 44 - Bit 1)
          Octet 44 - Bit 2 
          Octet 45 - Bit 6 
          Octet 46 - Bit 0 
          Octet 46 - Bit 1 
          Octet 46 - Bit 2 
zephyr.exe[2673534]: < HCI Command: Host Buffer Size (0x03|0x0033) plen 7                                             #9 1.517544
        ACL MTU: 255  ACL max packet: 16
        SCO MTU: 0    SCO max packet: 0
> HCI Event: Command Complete (0x0e) plen 4                                                                          #10 1.518139
      Host Buffer Size (0x03|0x0033) ncmd 1
        Status: Success (0x00)
zephyr.exe[2673534]: < HCI Command: Set Controller To Host Flow Control (0x03|0x0031) plen 1                         #11 1.537542
        Flow control: ACL Data Packets (0x01)
> HCI Event: Command Complete (0x0e) plen 4                                                                          #12 1.538003
      Set Controller To Host Flow Control (0x03|0x0031) ncmd 1
        Status: Success (0x00)
zephyr.exe[2673534]: < HCI Command: LE Read Local Supported Features (0x08|0x0003) plen 0                            #13 1.557561
> HCI Event: Command Complete (0x0e) plen 12                                                                         #14 1.558053
      LE Read Local Supported Features (0x08|0x0003) ncmd 1
        Status: Success (0x00)
        Features: 0xfd 0x79 0x00 0xf7 0x30 0x01 0x00 0x00
          LE Encryption
          Extended Reject Indication
          Peripheral-initiated Features Exchange
          LE Ping
          LE Data Packet Length Extension
          LL Privacy
          Extended Scanner Filter Policies
          LE 2M PHY
          LE Coded PHY
          LE Extended Advertising
          LE Periodic Advertising
          Channel Selection Algorithm #2
          Periodic Advertising Sync Transfer - Sender
          Periodic Advertising Sync Transfer - Recipient
          Sleep Clock Accuracy Updates
          Connected Isochronous Stream - Central
          Connected Isochronous Stream - Peripheral
          Isochronous Broadcaster
          Synchronized Receiver
          Periodic Advertising ADI support
          Connection Subrating
          Unknown features (0x0000010000000000)
zephyr.exe[2673534]: < HCI Command: LE Set Host Feature (0x08|0x0074) plen 2                                         #15 1.577545
        Bit Number: 32
          Connected Isochronous Stream (Host Support)
        Bit Value: 1
> HCI Event: Command Complete (0x0e) plen 4                                                                          #16 1.578038
      LE Set Host Feature (0x08|0x0074) ncmd 1
        Status: Success (0x00)
zephyr.exe[2673534]: < HCI Command: LE Read Buffer v2 (0x08|0x0060) plen 0                                           #17 1.597521
> HCI Event: Command Complete (0x0e) plen 10                                                                         #18 1.598001
      LE Read Buffer v2 (0x08|0x0060) ncmd 1
        Status: Success (0x00)
        ACL MTU: 27
        ACL max packet: 3
        ISO MTU: 318
        ISO max packet: 3
zephyr.exe[2673534]: < HCI Command: LE Read Maximum Advertising Data Length (0x08|0x003a) plen 0                     #19 1.617534
> HCI Event: Command Complete (0x0e) plen 6                                                                          #20 1.618014
      LE Read Maximum Advertising Data Length (0x08|0x003a) ncmd 1
        Status: Success (0x00)
        Max length: 1650
zephyr.exe[2673534]: < HCI Command: LE Read Supported States (0x08|0x001c) plen 0                                    #21 1.637548
> HCI Event: Command Complete (0x0e) plen 12                                                                         #22 1.638098
      LE Read Supported States (0x08|0x001c) ncmd 1
        Status: Success (0x00)
        States: 0x000003ff3e0306ff
          Non-connectable Advertising State
          Scannable Advertising State
          Connectable Advertising State
          High Duty Cycle Directed Advertising State
          Passive Scanning State
          Active Scanning State
          Initiating State
            and Connection State (Central Role)
          Connection State (Peripheral Role)
          Scannable Advertising State
            and Passive Scanning State
          Connectable Advertising State
            and Passive Scanning State
          Non-connectable Advertising State
            and Initiating State
          Scannable Advertising State
            and Initiating State
          Active Scanning State
            and Connection State (Central Role)
          Passive Scanning State
            and Connection State (Peripheral Role)
          Active Scanning State
            and Connection State (Peripheral Role)
          Initiating State
            and Connection State (Central Role)
            and Central Role & Central Role
          Low Duty Cycle Directed Advertising State
          Connectable Advertising State
            and Initiating State
            and Central Role & Peripheral Role
          High Duty Cycle Directed Advertising State
            and Initiating State
            and Central Role & Peripheral Role
          Low Duty Cycle Directed Advertising State
            and Initiating State
            and Central Role & Peripheral Role
          Connectable Advertising State
            and Connection State (Central Role)
            and Central Role & Peripheral Role
          High Duty Cycle Directed Advertising State
            and Connection State (Central Role)
            and Central Role & Peripheral Role
          Low Duty Cycle Directed Advertising State
            and Connection State (Central Role)
            and Central Role & Peripheral Role
          Connectable Advertising State
            and Connection State (Peripheral Role)
            and Central Role & Peripheral Role
          High Duty Cycle Directed Advertising State
            and Connection State (Peripheral Role)
            and Peripheral Role & Peripheral Role
          Low Duty Cycle Directed Advertising State
            and Connection State (Peripheral Role)
            and Peripheral Role & Peripheral Role
          Initiating State
            and Connection State (Peripheral Role)
            and Central Role & Peripheral Role
zephyr.exe[2673534]: < HCI Command: LE Read Maximum Data Length (0x08|0x002f) plen 0                                 #23 1.657545
> HCI Event: Command Complete (0x0e) plen 12                                                                         #24 1.658047
      LE Read Maximum Data Length (0x08|0x002f) ncmd 1
        Status: Success (0x00)
        Max TX octets: 251
        Max TX time: 2704
        Max RX octets: 251
        Max RX time: 2704
zephyr.exe[2673534]: < HCI Command: LE Write Suggested Default Data Length (0x08|0x0024) plen 4                      #25 1.677524
        TX octets: 251
        TX time: 2704
> HCI Event: Command Complete (0x0e) plen 4                                                                          #26 1.678096
      LE Write Suggested Default Data Length (0x08|0x0024) ncmd 1
        Status: Success (0x00)
zephyr.exe[2673534]: < HCI Command: LE Read Resolving List Size (0x08|0x002a) plen 0                                 #27 1.697536
> HCI Event: Command Complete (0x0e) plen 5                                                                          #28 1.698068
      LE Read Resolving List Size (0x08|0x002a) ncmd 1
        Status: Success (0x00)
        Size: 8
zephyr.exe[2673534]: < HCI Command: LE Set Event Mask (0x08|0x0001) plen 8                                           #29 1.717536
        Mask: 0x000002023f87fa5e
          LE Advertising Report
          LE Connection Update Complete
          LE Read Remote Used Features Complete
          LE Long Term Key Request
          LE Data Length Change
          LE Enhanced Connection Complete
          LE PHY Update Complete
          LE Extended Advertising Report
          LE Periodic Advertising Sync Established
          LE Periodic Advertising Report
          LE Periodic Advertising Sync Lost
          LE Extended Scan Timeout
          LE Extended Advertising Set Terminated
          LE Scan Request Received
          LE Periodic Advertising Sync Transfer Rvc
          LE CIS Established
          LE CIS Request
          LE Create BIG Complete
          LE Terminate BIG Complete
          LE BIG Sync Estabilished Complete
          LE BIG Sync Lost
          LE BIG Info Advertising Report
          Unknown mask (0x0000020000000000)
> HCI Event: Command Complete (0x0e) plen 4                                                                          #30 1.718101
      LE Set Event Mask (0x08|0x0001) ncmd 1
        Status: Success (0x00)
zephyr.exe[2673534]: < HCI Command: Set Event Mask (0x03|0x0001) plen 8                                              #31 1.737538
        Mask: 0x2000800002008890
          Disconnection Complete
          Encryption Change
          Read Remote Version Information Complete
          Hardware Error
          Data Buffer Overflow
          Encryption Key Refresh Complete
          LE Meta
> HCI Event: Command Complete (0x0e) plen 4                                                                          #32 1.738057
      Set Event Mask (0x03|0x0001) ncmd 1
        Status: Success (0x00)
zephyr.exe[2673534]: < HCI Command: Read BD ADDR (0x04|0x0009) plen 0                                                #33 1.757535
> HCI Event: Command Complete (0x0e) plen 10                                                                         #34 1.758014
      Read BD ADDR (0x04|0x0009) ncmd 1
        Status: Success (0x00)
        Address: 00:00:00:00:00:00 (OUI 00-00-00)
zephyr.exe[2673534]: < HCI Command: LE Set Random Address (0x08|0x0005) plen 6                                       #35 1.777545
        Address: D5:B6:CC:31:DB:3B (Static)
> HCI Event: Command Complete (0x0e) plen 4                                                                          #36 1.778006
      LE Set Random Address (0x08|0x0005) ncmd 1
        Status: Success (0x00)
zephyr.exe[2673534]: < HCI Command: LE Set Extended Advertising Parameters (0x08|0x0036) plen 25                     #37 2.457631
        Handle: 0x00
        Properties: 0x0001
          Connectable
        Min advertising interval: 100.000 msec (0x00a0)
        Max advertising interval: 150.000 msec (0x00f0)
        Channel map: 37, 38, 39 (0x07)
        Own address type: Random (0x01)
        Peer address type: Public (0x00)
        Peer address: 00:00:00:00:00:00 (OUI 00-00-00)
        Filter policy: Allow Scan Request from Any, Allow Connect Request from Any (0x00)
        TX power: Host has no preference (0x7f)
        Primary PHY: LE 1M (0x01)
        Secondary max skip: 0x00
        Secondary PHY: LE 2M (0x02)
        SID: 0x00
        Scan request notifications: Disabled (0x00)
> HCI Event: Command Complete (0x0e) plen 5                                                                          #38 2.458428
      LE Set Extended Advertising Parameters (0x08|0x0036) ncmd 1
        Status: Success (0x00)
        TX power (selected): 0 dbm (0x00)
zephyr.exe[2673534]: < HCI Command: LE Set Advertising Set Random Address (0x08|0x0035) plen 7                       #39 2.477495
        Advertising handle: 0x00
        Advertising random address: D5:B6:CC:31:DB:3B (Static)
> HCI Event: Command Complete (0x0e) plen 4                                                                          #40 2.477916
      LE Set Advertising Set Random Address (0x08|0x0035) ncmd 1
        Status: Success (0x00)
zephyr.exe[2673534]: < HCI Command: LE Set Extended Advertising Data (0x08|0x0037) plen 39                           #41 2.497537
        Handle: 0x00
        Operation: Complete extended advertising data (0x03)
        Fragment preference: Minimize fragmentation (0x01)
        Data length: 0x23
        Flags: 0x06
          LE General Discoverable Mode
          BR/EDR Not Supported
        Name (complete): Tester_F6B11A
        Flags: 0x06
          LE General Discoverable Mode
          BR/EDR Not Supported
        16-bit Service UUIDs (complete): 1 entry
          Audio Stream Control (0x184e)
        Service Data: Audio Stream Control (0x184e)
          Data: 01ff0fff0f00
> HCI Event: Command Complete (0x0e) plen 4                                                                          #42 2.498508
      LE Set Extended Advertising Data (0x08|0x0037) ncmd 1
        Status: Success (0x00)
zephyr.exe[2673534]: < HCI Command: LE Set Extended Advertising Enable (0x08|0x0039) plen 6                          #43 2.517552
        Extended advertising: Enabled (0x01)
        Number of sets: 1 (0x01)
        Entry 0
          Handle: 0x00
          Duration: 0 ms (0x00)
          Max ext adv events: 0
> HCI Event: Command Complete (0x0e) plen 4                                                                          #44 2.518131
      LE Set Extended Advertising Enable (0x08|0x0039) ncmd 1
        Status: Success (0x00)
> HCI Event: LE Meta Event (0x3e) plen 31                                                                            #45 4.833185
      LE Enhanced Connection Complete (0x0a)
        Status: Success (0x00)
        Handle: 2613
        Role: Peripheral (0x01)
        Peer address type: Public (0x00)
        Peer address: DF:A9:FF:F6:B1:1A (OUI DF-A9-FF)
        Local resolvable private address: 00:00:00:00:00:00 (Non-Resolvable)
        Peer resolvable private address: 00:00:00:00:00:00 (Non-Resolvable)
        Connection interval: 80.00 msec (0x0040)
        Connection latency: 0 (0x0000)
        Supervision timeout: 25120 msec (0x09d0)
        Central clock accuracy: 0x01
> HCI Event: LE Meta Event (0x3e) plen 6                                                                             #46 4.833265
      LE Advertising Set Terminated (0x12)
        Status: Success (0x00)
        Handle: 0
        Connection handle: 2613
        Number of completed extended advertising events: 0
zephyr.exe[2673534]: < HCI Command: LE Read Remote Used Features (0x08|0x0016) plen 2                                #47 4.837912
        Handle: 2613 Address: DF:A9:FF:F6:B1:1A (OUI DF-A9-FF)
> HCI Event: Command Status (0x0f) plen 4                                                                            #48 4.838344
      LE Read Remote Used Features (0x08|0x0016) ncmd 1
        Status: Success (0x00)
zephyr.exe[2673534]: < ACL Data TX: Handle 2613 flags 0x00 dlen 7                                                    #49 4.857635
      ATT: Exchange MTU Request (0x02) len 2
        Client RX MTU: 251
> HCI Event: Number of Completed Packets (0x13) plen 5                                                               #50 4.995129
        Num handles: 1
        Handle: 2613 Address: DF:A9:FF:F6:B1:1A (OUI DF-A9-FF)
        Count: 1
        #49: len 7 (0 Kb/s)
        Latency: 137 msec (137-137 msec ~137 msec)
> HCI Event: LE Meta Event (0x3e) plen 12                                                                            #51 5.075466
      LE Read Remote Used Features (0x04)
        Status: Success (0x00)
        Handle: 2613 Address: DF:A9:FF:F6:B1:1A (OUI DF-A9-FF)
        Features: 0x2d 0x49 0x00 0xf7 0x67 0xd8 0x00 0x00
          LE Encryption
          Extended Reject Indication
          Peripheral-initiated Features Exchange
          LE Data Packet Length Extension
          LE 2M PHY
          LE Coded PHY
          Channel Selection Algorithm #2
          Periodic Advertising Sync Transfer - Sender
          Periodic Advertising Sync Transfer - Recipient
          Sleep Clock Accuracy Updates
          Connected Isochronous Stream - Central
          Connected Isochronous Stream - Peripheral
          Isochronous Broadcaster
          Synchronized Receiver
          Connected Isochronous Stream (Host Support)
          LE Power Control Request
          LE Power Control Request
          Connection Subrating
          Connection Subrating (Host Support)
          Unknown features (0x0000d80000000000)
> ACL Data RX: Handle 2613 flags 0x02 dlen 7                                                                         #52 5.475302
      ATT: Exchange MTU Request (0x02) len 2
        Client RX MTU: 64
> ACL Data RX: Handle 2613 flags 0x02 dlen 7                                                                         #53 5.475620
      ATT: Exchange MTU Response (0x03) len 2
        Server RX MTU: 64
zephyr.exe[2673534]: < HCI Command: Host Number of Completed Packets (0x03|0x0035) plen 5                            #54 5.477846
        Num handles: 1
        Handle: 2613 Address: DF:A9:FF:F6:B1:1A (OUI DF-A9-FF)
        Count: 1
zephyr.exe[2673534]: < ACL Data TX: Handle 2613 flags 0x00 dlen 7                                                    #55 5.477865
      ATT: Exchange MTU Response (0x03) len 2
        Server RX MTU: 251
zephyr.exe[2673534]: < HCI Command: Host Number of Completed Packets (0x03|0x0035) plen 5                            #56 5.478005
        Num handles: 1
        Handle: 2613 Address: DF:A9:FF:F6:B1:1A (OUI DF-A9-FF)
        Count: 1
zephyr.exe[2673534]: < HCI Command: LE Remove Advertising Set (0x08|0x003c) plen 1                                   #57 5.608107
        Handle: 0
> HCI Event: Command Complete (0x0e) plen 4                                                                          #58 5.608603
      LE Remove Advertising Set (0x08|0x003c) ncmd 1
        Status: Success (0x00)
zephyr.exe[2673534]: < HCI Command: LE Set Extended Advertising Parameters (0x08|0x0036) plen 25                     #59 5.617914
        Handle: 0x00
        Properties: 0x0001
          Connectable
        Min advertising interval: 100.000 msec (0x00a0)
        Max advertising interval: 150.000 msec (0x00f0)
        Channel map: 37, 38, 39 (0x07)
        Own address type: Random (0x01)
        Peer address type: Public (0x00)
        Peer address: 00:00:00:00:00:00 (OUI 00-00-00)
        Filter policy: Allow Scan Request from Any, Allow Connect Request from Any (0x00)
        TX power: Host has no preference (0x7f)
        Primary PHY: LE 1M (0x01)
        Secondary max skip: 0x00
        Secondary PHY: LE 2M (0x02)
        SID: 0x01
        Scan request notifications: Disabled (0x00)
> HCI Event: Command Complete (0x0e) plen 5                                                                          #60 5.618723
      LE Set Extended Advertising Parameters (0x08|0x0036) ncmd 1
        Status: Success (0x00)
        TX power (selected): 0 dbm (0x00)
> HCI Event: Number of Completed Packets (0x13) plen 5                                                               #61 5.635224
        Num handles: 1
        Handle: 2613 Address: DF:A9:FF:F6:B1:1A (OUI DF-A9-FF)
        Count: 1
        #55: len 7 (0 Kb/s)
        Latency: 157 msec (137-157 msec ~147 msec)
zephyr.exe[2673534]: < HCI Command: LE Set Advertising Set Random Address (0x08|0x0035) plen 7                       #62 5.637675
        Advertising handle: 0x00
        Advertising random address: D5:B6:CC:31:DB:3B (Static)
> HCI Event: Command Complete (0x0e) plen 4                                                                          #63 5.638178
      LE Set Advertising Set Random Address (0x08|0x0035) ncmd 1
        Status: Success (0x00)
zephyr.exe[2673534]: < HCI Command: LE Set Extended Advertising Data (0x08|0x0037) plen 39                           #64 5.657554
        Handle: 0x00
        Operation: Complete extended advertising data (0x03)
        Fragment preference: Minimize fragmentation (0x01)
        Data length: 0x23
        Flags: 0x06
          LE General Discoverable Mode
          BR/EDR Not Supported
        Name (complete): Tester_F6B11A
        Flags: 0x06
          LE General Discoverable Mode
          BR/EDR Not Supported
        16-bit Service UUIDs (complete): 1 entry
          Audio Stream Control (0x184e)
        Service Data: Audio Stream Control (0x184e)
          Data: 01ff0fff0f00
> HCI Event: Command Complete (0x0e) plen 4                                                                          #65 5.658541
      LE Set Extended Advertising Data (0x08|0x0037) ncmd 1
        Status: Success (0x00)
zephyr.exe[2673534]: < HCI Command: LE Set Extended Advertising Enable (0x08|0x0039) plen 6                          #66 5.677594
        Extended advertising: Enabled (0x01)
        Number of sets: 1 (0x01)
        Entry 0
          Handle: 0x00
          Duration: 0 ms (0x00)
          Max ext adv events: 0
> HCI Event: Command Complete (0x0e) plen 4                                                                          #67 5.678178
      LE Set Extended Advertising Enable (0x08|0x0039) ncmd 1
        Status: Success (0x00)
> ACL Data RX: Handle 2613 flags 0x02 dlen 11                                                                        #68 7.635207
      SMP: Pairing Request (0x01) len 6
        IO capability: KeyboardDisplay (0x04)
        OOB data: Authentication data not present (0x00)
        Authentication requirement: Bonding, No MITM, SC, No Keypresses (0x09)
        Max encryption key size: 16
        Initiator key distribution: EncKey IdKey Sign (0x07)
        Responder key distribution: EncKey IdKey Sign (0x07)
zephyr.exe[2673534]: < HCI Command: Host Number of Completed Packets (0x03|0x0035) plen 5                            #69 7.638024
        Num handles: 1
        Handle: 2613 Address: DF:A9:FF:F6:B1:1A (OUI DF-A9-FF)
        Count: 1
zephyr.exe[2673534]: < ACL Data TX: Handle 2613 flags 0x00 dlen 11                                                   #70 7.638102
      SMP: Pairing Response (0x02) len 6
        IO capability: NoInputNoOutput (0x03)
        OOB data: Authentication data not present (0x00)
        Authentication requirement: Bonding, No MITM, SC, No Keypresses (0x09)
        Max encryption key size: 16
        Initiator key distribution: IdKey (0x02)
        Responder key distribution: <none> (0x00)
> HCI Event: Number of Completed Packets (0x13) plen 5                                                               #71 7.795232
        Num handles: 1
        Handle: 2613 Address: DF:A9:FF:F6:B1:1A (OUI DF-A9-FF)
        Count: 1
        #70: len 11 (0 Kb/s)
        Latency: 157 msec (137-157 msec ~152 msec)
> ACL Data RX: Handle 2613 flags 0x02 dlen 27                                                                        #72 7.795540
> ACL Data RX: Handle 2613 flags 0x01 dlen 27                                                                        #73 7.795850
> ACL Data RX: Handle 2613 flags 0x01 dlen 15                                                                        #74 7.796176
      SMP: Pairing Public Key (0x0c) len 64
        X: d82e1bc8283cb948928a8a5842a88bc09c31509d83273312563cedfba4716ba6
        Y: 40a310534d6188bd674f34f26a4ac092a85fa92f99416183557a73d87c968a5c
zephyr.exe[2673534]: < HCI Command: Host Number of Completed Packets (0x03|0x0035) plen 5                            #75 7.798012
        Num handles: 1
        Handle: 2613 Address: DF:A9:FF:F6:B1:1A (OUI DF-A9-FF)
        Count: 1
zephyr.exe[2673534]: < HCI Command: Host Number of Completed Packets (0x03|0x0035) plen 5                            #76 7.798237
        Num handles: 1
        Handle: 2613 Address: DF:A9:FF:F6:B1:1A (OUI DF-A9-FF)
        Count: 1
zephyr.exe[2673534]: < HCI Command: Host Number of Completed Packets (0x03|0x0035) plen 5                            #77 7.798594
        Num handles: 1
        Handle: 2613 Address: DF:A9:FF:F6:B1:1A (OUI DF-A9-FF)
        Count: 1
zephyr.exe[2673534]: < ACL Data TX: Handle 2613 flags 0x00 dlen 27                                                   #78 7.798636
zephyr.exe[2673534]: < ACL Data TX: Handle 2613 flags 0x01 dlen 27                                                   #79 7.798676
zephyr.exe[2673534]: < ACL Data TX: Handle 2613 flags 0x01 dlen 15                                                   #80 7.798692
      SMP: Pairing Public Key (0x0c) len 64
        X: 98308440221e2d910f0e54b71e7ec652857aa9b5a0dc65028824cc19db1226e9
        Y: 67a4816bcb62efb21701e31fdb27561a6217575fb007a8bbdabe7e28b6f68482
> HCI Event: Number of Completed Packets (0x13) plen 5                                                               #81 7.875514
        Num handles: 1
        Handle: 2613 Address: DF:A9:FF:F6:B1:1A (OUI DF-A9-FF)
        Count: 1
        #78: len 27 (2 Kb/s)
        Latency: 76 msec (76-157 msec ~114 msec)
> HCI Event: Number of Completed Packets (0x13) plen 5                                                               #82 7.876014
        Num handles: 1
        Handle: 2613 Address: DF:A9:FF:F6:B1:1A (OUI DF-A9-FF)
        Count: 1
        #79: len 27 (2 Kb/s)
        Latency: 77 msec (76-157 msec ~95 msec)
zephyr.exe[2673534]: < ACL Data TX: Handle 2613 flags 0x00 dlen 21                                                   #83 7.877871
      SMP: Pairing Confirm (0x03) len 16
        Confim value: aa9acad35437de2833fbf55c1be8e62a
> HCI Event: Number of Completed Packets (0x13) plen 5                                                               #84 7.955068
        Num handles: 1
        Handle: 2613 Address: DF:A9:FF:F6:B1:1A (OUI DF-A9-FF)
        Count: 1
        #80: len 15 (0 Kb/s)
        Latency: 156 msec (76-157 msec ~126 msec)
> HCI Event: Number of Completed Packets (0x13) plen 5                                                               #85 8.035155
        Num handles: 1
        Handle: 2613 Address: DF:A9:FF:F6:B1:1A (OUI DF-A9-FF)
        Count: 1
        #83: len 21 (1 Kb/s)
        Latency: 157 msec (76-157 msec ~141 msec)
> ACL Data RX: Handle 2613 flags 0x02 dlen 21                                                                        #86 8.035639
      SMP: Pairing Random (0x04) len 16
        Random value: 3e843c795cdd81640000000000000000
zephyr.exe[2673534]: < HCI Command: Host Number of Completed Packets (0x03|0x0035) plen 5                            #87 8.037785
        Num handles: 1
        Handle: 2613 Address: DF:A9:FF:F6:B1:1A (OUI DF-A9-FF)
        Count: 1
zephyr.exe[2673534]: < ACL Data TX: Handle 2613 flags 0x00 dlen 21                                                   #88 8.037829
      SMP: Pairing Random (0x04) len 16
        Random value: 8e6108f966a694cbe26df70bb96773e6
> HCI Event: Number of Completed Packets (0x13) plen 5                                                               #89 8.195157
        Num handles: 1
        Handle: 2613 Address: DF:A9:FF:F6:B1:1A (OUI DF-A9-FF)
        Count: 1
        #88: len 21 (1 Kb/s)
        Latency: 157 msec (76-157 msec ~149 msec)
> ACL Data RX: Handle 2613 flags 0x02 dlen 21                                                                        #90 8.435381
      SMP: Pairing DHKey Check (0x0d) len 16
        E: 391fdaeebb8c0a7e0e39231f70c0c23d
zephyr.exe[2673534]: < HCI Command: Host Number of Completed Packets (0x03|0x0035) plen 5                            #91 8.438312
        Num handles: 1
        Handle: 2613 Address: DF:A9:FF:F6:B1:1A (OUI DF-A9-FF)
        Count: 1
zephyr.exe[2673534]: < ACL Data TX: Handle 2613 flags 0x00 dlen 21                                                   #92 8.438838
      SMP: Pairing DHKey Check (0x0d) len 16
        E: c8551392ff93d559c90203882b89fe69
> HCI Event: Number of Completed Packets (0x13) plen 5                                                               #93 8.595028
        Num handles: 1
        Handle: 2613 Address: DF:A9:FF:F6:B1:1A (OUI DF-A9-FF)
        Count: 1
        #92: len 21 (1 Kb/s)
        Latency: 156 msec (76-157 msec ~152 msec)
> HCI Event: LE Meta Event (0x3e) plen 13                                                                            #94 8.675608
      LE Long Term Key Request (0x05)
        Handle: 2613 Address: DF:A9:FF:F6:B1:1A (OUI DF-A9-FF)
        Random number: 0x0000000000000000
        Encrypted diversifier: 0x0000
zephyr.exe[2673534]: < HCI Command: LE Long Term Key Request Reply (0x08|0x001a) plen 18                             #95 8.677848
        Handle: 2613 Address: DF:A9:FF:F6:B1:1A (OUI DF-A9-FF)
        Long term key: 56fe1c517a79695d6a151e60ce6b2fe2
> HCI Event: Command Complete (0x0e) plen 6                                                                          #96 8.678535
      LE Long Term Key Request Reply (0x08|0x001a) ncmd 1
        Status: Success (0x00)
        Handle: 2613 Address: DF:A9:FF:F6:B1:1A (OUI DF-A9-FF)
> HCI Event: Encryption Change (0x08) plen 4                                                                         #97 9.075349
        Status: Success (0x00)
        Handle: 2613 Address: DF:A9:FF:F6:B1:1A (OUI DF-A9-FF)
        Encryption: Enabled with AES-CCM (0x01)
> ACL Data RX: Handle 2613 flags 0x02 dlen 21                                                                        #98 9.155339
      SMP: Identity Information (0x08) len 16
        Identity resolving key: 992bc3c06ea79f7a937f82d7b0cee7f0
zephyr.exe[2673534]: < HCI Command: Host Number of Completed Packets (0x03|0x0035) plen 5                            #99 9.188437
        Num handles: 1
        Handle: 2613 Address: DF:A9:FF:F6:B1:1A (OUI DF-A9-FF)
        Count: 1
> ACL Data RX: Handle 2613 flags 0x02 dlen 12                                                                       #100 9.315198
      SMP: Identity Address Information (0x09) len 7
        Address: DF:A9:FF:F6:B1:1A (OUI DF-A9-FF)
zephyr.exe[2673534]: < HCI Command: LE Set Extended Advertising Enable (0x08|0x0039) plen 6                         #101 9.318100
        Extended advertising: Disabled (0x00)
        Number of sets: 1 (0x01)
        Entry 0
          Handle: 0x00
          Duration: 0 ms (0x00)
          Max ext adv events: 0
> HCI Event: Command Complete (0x0e) plen 4                                                                         #102 9.318667
      LE Set Extended Advertising Enable (0x08|0x0039) ncmd 1
        Status: Success (0x00)
zephyr.exe[2673534]: < HCI Command: LE Add Device To Resolving List (0x08|0x0027) plen 39                           #103 9.337948
        Address type: Public (0x00)
        Address: DF:A9:FF:F6:B1:1A (OUI DF-A9-FF)
        Peer identity resolving key: 992bc3c06ea79f7a937f82d7b0cee7f0
        Local identity resolving key: 00000000000000000000000000000000
> HCI Event: Command Complete (0x0e) plen 4                                                                         #104 9.338864
      LE Add Device To Resolving List (0x08|0x0027) ncmd 1
        Status: Success (0x00)
zephyr.exe[2673534]: < HCI Command: LE Set Privacy Mode (0x08|0x004e) plen 8                                        #105 9.357971
        Peer Identity address type: Public (0x00)
        Peer Identity address: DF:A9:FF:F6:B1:1A (OUI DF-A9-FF)
        Privacy Mode: Use Device Privacy (0x01)
> HCI Event: Command Complete (0x0e) plen 4                                                                         #106 9.358499
      LE Set Privacy Mode (0x08|0x004e) ncmd 1
        Status: Success (0x00)
zephyr.exe[2673534]: < HCI Command: LE Set Address Resolution Enable (0x08|0x002d) plen 1                           #107 9.377951
        Address resolution: Enabled (0x01)
> HCI Event: Command Complete (0x0e) plen 4                                                                         #108 9.378368
      LE Set Address Resolution Enable (0x08|0x002d) ncmd 1
        Status: Success (0x00)
> ACL Data RX: Handle 2613 flags 0x02 dlen 13                                                                       #109 9.395218
      ATT: Find By Type Value Request (0x06) len 8
        Handle range: 0x0001-0xffff
        Attribute type: Primary Service (0x2800)
          UUID: Published Audio Capabilities (0x1850)
zephyr.exe[2673534]: < HCI Command: LE Set Extended Advertising Enable (0x08|0x0039) plen 6                         #110 9.397876
        Extended advertising: Enabled (0x01)
        Number of sets: 1 (0x01)
        Entry 0
          Handle: 0x00
          Duration: 0 ms (0x00)
          Max ext adv events: 0
> HCI Event: Command Complete (0x0e) plen 4                                                                         #111 9.398522
      LE Set Extended Advertising Enable (0x08|0x0039) ncmd 1
        Status: Success (0x00)
zephyr.exe[2673534]: < HCI Command: Host Number of Completed Packets (0x03|0x0035) plen 5                           #112 9.417891
        Num handles: 1
        Handle: 2613 Address: DF:A9:FF:F6:B1:1A (OUI DF-A9-FF)
        Count: 1
zephyr.exe[2673534]: < HCI Command: Host Number of Completed Packets (0x03|0x0035) plen 5                           #113 9.418298
        Num handles: 1
        Handle: 2613 Address: DF:A9:FF:F6:B1:1A (OUI DF-A9-FF)
        Count: 1
zephyr.exe[2673534]: < ACL Data TX: Handle 2613 flags 0x00 dlen 9                                                   #114 9.418345
      ATT: Find By Type Value Response (0x07) len 4
        Handle range: 0x0024-0x0036
> HCI Event: Number of Completed Packets (0x13) plen 5                                                              #115 9.555036
        Num handles: 1
        Handle: 2613 Address: DF:A9:FF:F6:B1:1A (OUI DF-A9-FF)
        Count: 1
        #114: len 9 (0 Kb/s)
        Latency: 136 msec (76-157 msec ~144 msec)
> ACL Data RX: Handle 2613 flags 0x02 dlen 13                                                                       #116 9.555332
      ATT: Find By Type Value Request (0x06) len 8
        Handle range: 0x0037-0xffff
        Attribute type: Primary Service (0x2800)
          UUID: Published Audio Capabilities (0x1850)
zephyr.exe[2673534]: < HCI Command: Host Number of Completed Packets (0x03|0x0035) plen 5                           #117 9.557857
        Num handles: 1
        Handle: 2613 Address: DF:A9:FF:F6:B1:1A (OUI DF-A9-FF)
        Count: 1
zephyr.exe[2673534]: < ACL Data TX: Handle 2613 flags 0x00 dlen 9                                                   #118 9.557963
      ATT: Error Response (0x01) len 4
        Find By Type Value Request (0x06)
        Handle: 0x0037
        Error: Attribute Not Found (0x0a)
> HCI Event: Number of Completed Packets (0x13) plen 5                                                              #119 9.715198
        Num handles: 1
        Handle: 2613 Address: DF:A9:FF:F6:B1:1A (OUI DF-A9-FF)
        Count: 1
        #118: len 9 (0 Kb/s)
        Latency: 157 msec (76-157 msec ~151 msec)
> ACL Data RX: Handle 2613 flags 0x02 dlen 11                                                                       #120 9.715358
      ATT: Read By Type Request (0x08) len 6
        Handle range: 0x0024-0x0036
        Attribute type: Characteristic (0x2803)
zephyr.exe[2673534]: < HCI Command: Host Number of Completed Packets (0x03|0x0035) plen 5                           #121 9.718089
        Num handles: 1
        Handle: 2613 Address: DF:A9:FF:F6:B1:1A (OUI DF-A9-FF)
        Count: 1
zephyr.exe[2673534]: < ACL Data TX: Handle 2613 flags 0x00 dlen 27                                                  #122 9.718137
zephyr.exe[2673534]: < ACL Data TX: Handle 2613 flags 0x01 dlen 21                                                  #123 9.718192
      ATT: Read By Type Response (0x09) len 43
        Attribute data length: 7
        Attribute data list: 6 entries
        Handle: 0x0025
        Value: 122600c92b
            Properties: 0x12
              Read (0x02)
              Notify (0x10)
            Value Handle: 0x0026
            Value UUID: Sink PAC (0x2bc9)
        Handle: 0x0028
        Value: 1a2900ca2b
            Properties: 0x1a
              Read (0x02)
              Write (0x08)
              Notify (0x10)
            Value Handle: 0x0029
            Value UUID: Sink Audio Locations (0x2bca)
        Handle: 0x002b
        Value: 122c00cb2b
            Properties: 0x12
              Read (0x02)
              Notify (0x10)
            Value Handle: 0x002c
            Value UUID: Source PAC (0x2bcb)
        Handle: 0x002e
        Value: 1a2f00cc2b
            Properties: 0x1a
              Read (0x02)
              Write (0x08)
              Notify (0x10)
            Value Handle: 0x002f
            Value UUID: Source Audio Locations (0x2bcc)
        Handle: 0x0031
        Value: 123200cd2b
            Properties: 0x12
              Read (0x02)
              Notify (0x10)
            Value Handle: 0x0032
            Value UUID: Available Audio Contexts (0x2bcd)
        Handle: 0x0034
        Value: 123500ce2b
            Properties: 0x12
              Read (0x02)
              Notify (0x10)
            Value Handle: 0x0035
            Value UUID: Supported Audio Contexts (0x2bce)
> HCI Event: Number of Completed Packets (0x13) plen 5                                                              #124 9.795415
        Num handles: 1
        Handle: 2613 Address: DF:A9:FF:F6:B1:1A (OUI DF-A9-FF)
        Count: 1
        #122: len 27 (2 Kb/s)
        Latency: 77 msec (76-157 msec ~114 msec)
> HCI Event: Number of Completed Packets (0x13) plen 5                                                              #125 9.875067
        Num handles: 1
        Handle: 2613 Address: DF:A9:FF:F6:B1:1A (OUI DF-A9-FF)
        Count: 1
        #123: len 21 (1 Kb/s)
        Latency: 156 msec (76-157 msec ~135 msec)
> ACL Data RX: Handle 2613 flags 0x02 dlen 11                                                                       #126 9.875409
      ATT: Read By Type Request (0x08) len 6
        Handle range: 0x0035-0x0036
        Attribute type: Characteristic (0x2803)
zephyr.exe[2673534]: < HCI Command: Host Number of Completed Packets (0x03|0x0035) plen 5                           #127 9.878041
        Num handles: 1
        Handle: 2613 Address: DF:A9:FF:F6:B1:1A (OUI DF-A9-FF)
        Count: 1
zephyr.exe[2673534]: < ACL Data TX: Handle 2613 flags 0x00 dlen 9                                                   #128 9.878149
      ATT: Error Response (0x01) len 4
        Read By Type Request (0x08)
        Handle: 0x0035
        Error: Attribute Not Found (0x0a)
> HCI Event: Number of Completed Packets (0x13) plen 5                                                             #129 10.035095
        Num handles: 1
        Handle: 2613 Address: DF:A9:FF:F6:B1:1A (OUI DF-A9-FF)
        Count: 1
        #128: len 9 (0 Kb/s)
        Latency: 156 msec (76-157 msec ~146 msec)
> ACL Data RX: Handle 2613 flags 0x02 dlen 9                                                                       #130 10.035388
      ATT: Find Information Request (0x04) len 4
        Handle range: 0x0027-0x0027
zephyr.exe[2673534]: < HCI Command: Host Number of Completed Packets (0x03|0x0035) plen 5                          #131 10.037999
        Num handles: 1
        Handle: 2613 Address: DF:A9:FF:F6:B1:1A (OUI DF-A9-FF)
        Count: 1
zephyr.exe[2673534]: < ACL Data TX: Handle 2613 flags 0x00 dlen 10                                                 #132 10.038081
      ATT: Find Information Response (0x05) len 5
        Format: UUID-16 (0x01)
        Handle: 0x0027
        UUID: Client Characteristic Configuration (0x2902)
> HCI Event: Number of Completed Packets (0x13) plen 5                                                             #133 10.195085
        Num handles: 1
        Handle: 2613 Address: DF:A9:FF:F6:B1:1A (OUI DF-A9-FF)
        Count: 1
        #132: len 10 (0 Kb/s)
        Latency: 157 msec (76-157 msec ~151 msec)
> ACL Data RX: Handle 2613 flags 0x02 dlen 9                                                                       #134 10.195299
      ATT: Find Information Request (0x04) len 4
        Handle range: 0x002a-0x002a
zephyr.exe[2673534]: < HCI Command: Host Number of Completed Packets (0x03|0x0035) plen 5                          #135 10.197894
        Num handles: 1
        Handle: 2613 Address: DF:A9:FF:F6:B1:1A (OUI DF-A9-FF)
        Count: 1
zephyr.exe[2673534]: < ACL Data TX: Handle 2613 flags 0x00 dlen 10                                                 #136 10.197992
      ATT: Find Information Response (0x05) len 5
        Format: UUID-16 (0x01)
        Handle: 0x002a
        UUID: Client Characteristic Configuration (0x2902)
> HCI Event: Number of Completed Packets (0x13) plen 5                                                             #137 10.355050
        Num handles: 1
        Handle: 2613 Address: DF:A9:FF:F6:B1:1A (OUI DF-A9-FF)
        Count: 1
        #136: len 10 (0 Kb/s)
        Latency: 157 msec (76-157 msec ~154 msec)
> ACL Data RX: Handle 2613 flags 0x02 dlen 9                                                                       #138 10.355298
      ATT: Find Information Request (0x04) len 4
        Handle range: 0x002d-0x002d
zephyr.exe[2673534]: < HCI Command: Host Number of Completed Packets (0x03|0x0035) plen 5                          #139 10.357942
        Num handles: 1
        Handle: 2613 Address: DF:A9:FF:F6:B1:1A (OUI DF-A9-FF)
        Count: 1
zephyr.exe[2673534]: < ACL Data TX: Handle 2613 flags 0x00 dlen 10                                                 #140 10.358055
      ATT: Find Information Response (0x05) len 5
        Format: UUID-16 (0x01)
        Handle: 0x002d
        UUID: Client Characteristic Configuration (0x2902)
> HCI Event: Number of Completed Packets (0x13) plen 5                                                             #141 10.515110
        Num handles: 1
        Handle: 2613 Address: DF:A9:FF:F6:B1:1A (OUI DF-A9-FF)
        Count: 1
        #140: len 10 (0 Kb/s)
        Latency: 157 msec (76-157 msec ~155 msec)
> ACL Data RX: Handle 2613 flags 0x02 dlen 9                                                                       #142 10.515219
      ATT: Find Information Request (0x04) len 4
        Handle range: 0x0030-0x0030
zephyr.exe[2673534]: < HCI Command: Host Number of Completed Packets (0x03|0x0035) plen 5                          #143 10.517954
        Num handles: 1
        Handle: 2613 Address: DF:A9:FF:F6:B1:1A (OUI DF-A9-FF)
        Count: 1
zephyr.exe[2673534]: < ACL Data TX: Handle 2613 flags 0x00 dlen 10                                                 #144 10.518102
      ATT: Find Information Response (0x05) len 5
        Format: UUID-16 (0x01)
        Handle: 0x0030
        UUID: Client Characteristic Configuration (0x2902)
> HCI Event: Number of Completed Packets (0x13) plen 5                                                             #145 10.755221
        Num handles: 1
        Handle: 2613 Address: DF:A9:FF:F6:B1:1A (OUI DF-A9-FF)
        Count: 1
        #144: len 10 (0 Kb/s)
        Latency: 237 msec (76-237 msec ~196 msec)
> ACL Data RX: Handle 2613 flags 0x02 dlen 9                                                                       #146 10.755228
      ATT: Find Information Request (0x04) len 4
        Handle range: 0x0033-0x0033
zephyr.exe[2673534]: < HCI Command: Host Number of Completed Packets (0x03|0x0035) plen 5                          #147 10.757977
        Num handles: 1
        Handle: 2613 Address: DF:A9:FF:F6:B1:1A (OUI DF-A9-FF)
        Count: 1
zephyr.exe[2673534]: < ACL Data TX: Handle 2613 flags 0x00 dlen 10                                                 #148 10.758136
      ATT: Find Information Response (0x05) len 5
        Format: UUID-16 (0x01)
        Handle: 0x0033
        UUID: Client Characteristic Configuration (0x2902)
> HCI Event: Number of Completed Packets (0x13) plen 5                                                             #149 10.915085
        Num handles: 1
        Handle: 2613 Address: DF:A9:FF:F6:B1:1A (OUI DF-A9-FF)
        Count: 1
        #148: len 10 (0 Kb/s)
        Latency: 156 msec (76-237 msec ~176 msec)
> ACL Data RX: Handle 2613 flags 0x02 dlen 9                                                                       #150 10.915255
      ATT: Find Information Request (0x04) len 4
        Handle range: 0x0036-0x0036
zephyr.exe[2673534]: < HCI Command: Host Number of Completed Packets (0x03|0x0035) plen 5                          #151 10.917895
        Num handles: 1
        Handle: 2613 Address: DF:A9:FF:F6:B1:1A (OUI DF-A9-FF)
        Count: 1
zephyr.exe[2673534]: < ACL Data TX: Handle 2613 flags 0x00 dlen 10                                                 #152 10.917915
      ATT: Find Information Response (0x05) len 5
        Format: UUID-16 (0x01)
        Handle: 0x0036
        UUID: Client Characteristic Configuration (0x2902)
> HCI Event: Number of Completed Packets (0x13) plen 5                                                             #153 11.075111
        Num handles: 1
        Handle: 2613 Address: DF:A9:FF:F6:B1:1A (OUI DF-A9-FF)
        Count: 1
        #152: len 10 (0 Kb/s)
        Latency: 157 msec (76-237 msec ~166 msec)
> ACL Data RX: Handle 2613 flags 0x02 dlen 13                                                                      #154 11.075331
      ATT: Find By Type Value Request (0x06) len 8
        Handle range: 0x0001-0xffff
        Attribute type: Primary Service (0x2800)
          UUID: Audio Stream Control (0x184e)
zephyr.exe[2673534]: < HCI Command: Host Number of Completed Packets (0x03|0x0035) plen 5                          #155 11.078176
        Num handles: 1
        Handle: 2613 Address: DF:A9:FF:F6:B1:1A (OUI DF-A9-FF)
        Count: 1
zephyr.exe[2673534]: < ACL Data TX: Handle 2613 flags 0x00 dlen 9                                                  #156 11.078227
      ATT: Find By Type Value Response (0x07) len 4
        Handle range: 0x0037-0x0046
> HCI Event: Number of Completed Packets (0x13) plen 5                                                             #157 11.235166
        Num handles: 1
        Handle: 2613 Address: DF:A9:FF:F6:B1:1A (OUI DF-A9-FF)
        Count: 1
        #156: len 9 (0 Kb/s)
        Latency: 156 msec (76-237 msec ~161 msec)
> ACL Data RX: Handle 2613 flags 0x02 dlen 13                                                                      #158 11.235292
      ATT: Find By Type Value Request (0x06) len 8
        Handle range: 0x0047-0xffff
        Attribute type: Primary Service (0x2800)
          UUID: Audio Stream Control (0x184e)
zephyr.exe[2673534]: < HCI Command: Host Number of Completed Packets (0x03|0x0035) plen 5                          #159 11.238040
        Num handles: 1
        Handle: 2613 Address: DF:A9:FF:F6:B1:1A (OUI DF-A9-FF)
        Count: 1
zephyr.exe[2673534]: < ACL Data TX: Handle 2613 flags 0x00 dlen 9                                                  #160 11.238104
      ATT: Error Response (0x01) len 4
        Find By Type Value Request (0x06)
        Handle: 0x0047
        Error: Attribute Not Found (0x0a)
> HCI Event: Number of Completed Packets (0x13) plen 5                                                             #161 11.395021
        Num handles: 1
        Handle: 2613 Address: DF:A9:FF:F6:B1:1A (OUI DF-A9-FF)
        Count: 1
        #160: len 9 (0 Kb/s)
        Latency: 156 msec (76-237 msec ~159 msec)
> ACL Data RX: Handle 2613 flags 0x02 dlen 11                                                                      #162 11.395241
      ATT: Read By Type Request (0x08) len 6
        Handle range: 0x0037-0x0046
        Attribute type: Characteristic (0x2803)
zephyr.exe[2673534]: < HCI Command: Host Number of Completed Packets (0x03|0x0035) plen 5                          #163 11.398148
        Num handles: 1
        Handle: 2613 Address: DF:A9:FF:F6:B1:1A (OUI DF-A9-FF)
        Count: 1
zephyr.exe[2673534]: < ACL Data TX: Handle 2613 flags 0x00 dlen 27                                                 #164 11.398231
zephyr.exe[2673534]: < ACL Data TX: Handle 2613 flags 0x01 dlen 14                                                 #165 11.398240
      ATT: Read By Type Response (0x09) len 36
        Attribute data length: 7
        Attribute data list: 5 entries
        Handle: 0x0038
        Value: 1c3900c62b
            Properties: 0x1c
              Write Without Response (0x04)
              Write (0x08)
              Notify (0x10)
            Value Handle: 0x0039
            Value UUID: ASE Control Point (0x2bc6)
        Handle: 0x003b
        Value: 123c00c42b
            Properties: 0x12
              Read (0x02)
              Notify (0x10)
            Value Handle: 0x003c
            Value UUID: Sink ASE (0x2bc4)
        Handle: 0x003e
        Value: 123f00c42b
            Properties: 0x12
              Read (0x02)
              Notify (0x10)
            Value Handle: 0x003f
            Value UUID: Sink ASE (0x2bc4)
        Handle: 0x0041
        Value: 124200c52b
            Properties: 0x12
              Read (0x02)
              Notify (0x10)
            Value Handle: 0x0042
            Value UUID: Source ASE (0x2bc5)
        Handle: 0x0044
        Value: 124500c52b
            Properties: 0x12
              Read (0x02)
              Notify (0x10)
            Value Handle: 0x0045
            Value UUID: Source ASE (0x2bc5)
> HCI Event: Number of Completed Packets (0x13) plen 5                                                             #166 11.475514
        Num handles: 1
        Handle: 2613 Address: DF:A9:FF:F6:B1:1A (OUI DF-A9-FF)
        Count: 1
        #164: len 27 (2 Kb/s)
        Latency: 77 msec (76-237 msec ~118 msec)
> HCI Event: Number of Completed Packets (0x13) plen 5                                                             #167 11.555021
        Num handles: 1
        Handle: 2613 Address: DF:A9:FF:F6:B1:1A (OUI DF-A9-FF)
        Count: 1
        #165: len 14 (0 Kb/s)
        Latency: 156 msec (76-237 msec ~137 msec)
> ACL Data RX: Handle 2613 flags 0x02 dlen 11                                                                      #168 11.555245
      ATT: Read By Type Request (0x08) len 6
        Handle range: 0x0045-0x0046
        Attribute type: Characteristic (0x2803)
zephyr.exe[2673534]: < HCI Command: Host Number of Completed Packets (0x03|0x0035) plen 5                          #169 11.558064
        Num handles: 1
        Handle: 2613 Address: DF:A9:FF:F6:B1:1A (OUI DF-A9-FF)
        Count: 1
zephyr.exe[2673534]: < ACL Data TX: Handle 2613 flags 0x00 dlen 9                                                  #170 11.558140
      ATT: Error Response (0x01) len 4
        Read By Type Request (0x08)
        Handle: 0x0045
        Error: Attribute Not Found (0x0a)
> HCI Event: Number of Completed Packets (0x13) plen 5                                                             #171 11.715033
        Num handles: 1
        Handle: 2613 Address: DF:A9:FF:F6:B1:1A (OUI DF-A9-FF)
        Count: 1
        #170: len 9 (0 Kb/s)
        Latency: 156 msec (76-237 msec ~147 msec)
> ACL Data RX: Handle 2613 flags 0x02 dlen 9                                                                       #172 11.715227
      ATT: Find Information Request (0x04) len 4
        Handle range: 0x003a-0x003a
zephyr.exe[2673534]: < HCI Command: Host Number of Completed Packets (0x03|0x0035) plen 5                          #173 11.718108
        Num handles: 1
        Handle: 2613 Address: DF:A9:FF:F6:B1:1A (OUI DF-A9-FF)
        Count: 1
zephyr.exe[2673534]: < ACL Data TX: Handle 2613 flags 0x00 dlen 10                                                 #174 11.718196
      ATT: Find Information Response (0x05) len 5
        Format: UUID-16 (0x01)
        Handle: 0x003a
        UUID: Client Characteristic Configuration (0x2902)
> HCI Event: Number of Completed Packets (0x13) plen 5                                                             #175 11.875056
        Num handles: 1
        Handle: 2613 Address: DF:A9:FF:F6:B1:1A (OUI DF-A9-FF)
        Count: 1
        #174: len 10 (0 Kb/s)
        Latency: 156 msec (76-237 msec ~152 msec)
> ACL Data RX: Handle 2613 flags 0x02 dlen 9                                                                       #176 11.875266
      ATT: Find Information Request (0x04) len 4
        Handle range: 0x003d-0x003d
zephyr.exe[2673534]: < HCI Command: Host Number of Completed Packets (0x03|0x0035) plen 5                          #177 11.878046
        Num handles: 1
        Handle: 2613 Address: DF:A9:FF:F6:B1:1A (OUI DF-A9-FF)
        Count: 1
zephyr.exe[2673534]: < ACL Data TX: Handle 2613 flags 0x00 dlen 10                                                 #178 11.878117
      ATT: Find Information Response (0x05) len 5
        Format: UUID-16 (0x01)
        Handle: 0x003d
        UUID: Client Characteristic Configuration (0x2902)
> HCI Event: Number of Completed Packets (0x13) plen 5                                                             #179 12.035146
        Num handles: 1
        Handle: 2613 Address: DF:A9:FF:F6:B1:1A (OUI DF-A9-FF)
        Count: 1
        #178: len 10 (0 Kb/s)
        Latency: 157 msec (76-237 msec ~154 msec)
> ACL Data RX: Handle 2613 flags 0x02 dlen 9                                                                       #180 12.035231
      ATT: Find Information Request (0x04) len 4
        Handle range: 0x0040-0x0040
zephyr.exe[2673534]: < HCI Command: Host Number of Completed Packets (0x03|0x0035) plen 5                          #181 12.038068
        Num handles: 1
        Handle: 2613 Address: DF:A9:FF:F6:B1:1A (OUI DF-A9-FF)
        Count: 1
zephyr.exe[2673534]: < ACL Data TX: Handle 2613 flags 0x00 dlen 10                                                 #182 12.038140
      ATT: Find Information Response (0x05) len 5
        Format: UUID-16 (0x01)
        Handle: 0x0040
        UUID: Client Characteristic Configuration (0x2902)
> HCI Event: Number of Completed Packets (0x13) plen 5                                                             #183 12.194965
        Num handles: 1
        Handle: 2613 Address: DF:A9:FF:F6:B1:1A (OUI DF-A9-FF)
        Count: 1
        #182: len 10 (0 Kb/s)
        Latency: 156 msec (76-237 msec ~155 msec)
> ACL Data RX: Handle 2613 flags 0x02 dlen 9                                                                       #184 12.195259
      ATT: Find Information Request (0x04) len 4
        Handle range: 0x0043-0x0043
zephyr.exe[2673534]: < HCI Command: Host Number of Completed Packets (0x03|0x0035) plen 5                          #185 12.198063
        Num handles: 1
        Handle: 2613 Address: DF:A9:FF:F6:B1:1A (OUI DF-A9-FF)
        Count: 1
zephyr.exe[2673534]: < ACL Data TX: Handle 2613 flags 0x00 dlen 10                                                 #186 12.198168
      ATT: Find Information Response (0x05) len 5
        Format: UUID-16 (0x01)
        Handle: 0x0043
        UUID: Client Characteristic Configuration (0x2902)
> HCI Event: Number of Completed Packets (0x13) plen 5                                                             #187 12.354979
        Num handles: 1
        Handle: 2613 Address: DF:A9:FF:F6:B1:1A (OUI DF-A9-FF)
        Count: 1
        #186: len 10 (0 Kb/s)
        Latency: 156 msec (76-237 msec ~156 msec)
> ACL Data RX: Handle 2613 flags 0x02 dlen 9                                                                       #188 12.355264
      ATT: Find Information Request (0x04) len 4
        Handle range: 0x0046-0x0046
zephyr.exe[2673534]: < HCI Command: Host Number of Completed Packets (0x03|0x0035) plen 5                          #189 12.358166
        Num handles: 1
        Handle: 2613 Address: DF:A9:FF:F6:B1:1A (OUI DF-A9-FF)
        Count: 1
zephyr.exe[2673534]: < ACL Data TX: Handle 2613 flags 0x00 dlen 10                                                 #190 12.358262
      ATT: Find Information Response (0x05) len 5
        Format: UUID-16 (0x01)
        Handle: 0x0046
        UUID: Client Characteristic Configuration (0x2902)
> HCI Event: Number of Completed Packets (0x13) plen 5                                                             #191 12.515088
        Num handles: 1
        Handle: 2613 Address: DF:A9:FF:F6:B1:1A (OUI DF-A9-FF)
        Count: 1
        #190: len 10 (0 Kb/s)
        Latency: 156 msec (76-237 msec ~156 msec)
> ACL Data RX: Handle 2613 flags 0x02 dlen 9                                                                       #192 12.515160
      ATT: Write Request (0x12) len 4
        Handle: 0x0033
          Data: 0000
zephyr.exe[2673534]: < HCI Command: Host Number of Completed Packets (0x03|0x0035) plen 5                          #193 12.518061
        Num handles: 1
        Handle: 2613 Address: DF:A9:FF:F6:B1:1A (OUI DF-A9-FF)
        Count: 1
zephyr.exe[2673534]: < ACL Data TX: Handle 2613 flags 0x00 dlen 5                                                  #194 12.518171
      ATT: Write Response (0x13) len 0
> HCI Event: Number of Completed Packets (0x13) plen 5                                                             #195 12.674962
        Num handles: 1
        Handle: 2613 Address: DF:A9:FF:F6:B1:1A (OUI DF-A9-FF)
        Count: 1
        #194: len 5 (0 Kb/s)
        Latency: 156 msec (76-237 msec ~156 msec)
> ACL Data RX: Handle 2613 flags 0x02 dlen 9                                                                       #196 12.675226
      ATT: Write Request (0x12) len 4
        Handle: 0x0033
          Data: 0100
zephyr.exe[2673534]: < HCI Command: Host Number of Completed Packets (0x03|0x0035) plen 5                          #197 12.678192
        Num handles: 1
        Handle: 2613 Address: DF:A9:FF:F6:B1:1A (OUI DF-A9-FF)
        Count: 1
zephyr.exe[2673534]: < ACL Data TX: Handle 2613 flags 0x00 dlen 5                                                  #198 12.678266
      ATT: Write Response (0x13) len 0
> HCI Event: Number of Completed Packets (0x13) plen 5                                                             #199 12.834978
        Num handles: 1
        Handle: 2613 Address: DF:A9:FF:F6:B1:1A (OUI DF-A9-FF)
        Count: 1
        #198: len 5 (0 Kb/s)
        Latency: 156 msec (76-237 msec ~156 msec)
> ACL Data RX: Handle 2613 flags 0x02 dlen 9                                                                       #200 12.835295
      ATT: Write Request (0x12) len 4
        Handle: 0x003a
          Data: 0000
zephyr.exe[2673534]: < HCI Command: Host Number of Completed Packets (0x03|0x0035) plen 5                          #201 12.838106
        Num handles: 1
        Handle: 2613 Address: DF:A9:FF:F6:B1:1A (OUI DF-A9-FF)
        Count: 1
zephyr.exe[2673534]: < ACL Data TX: Handle 2613 flags 0x00 dlen 5                                                  #202 12.838181
      ATT: Write Response (0x13) len 0
> HCI Event: Number of Completed Packets (0x13) plen 5                                                             #203 12.995074
        Num handles: 1
        Handle: 2613 Address: DF:A9:FF:F6:B1:1A (OUI DF-A9-FF)
        Count: 1
        #202: len 5 (0 Kb/s)
        Latency: 156 msec (76-237 msec ~156 msec)
> ACL Data RX: Handle 2613 flags 0x02 dlen 9                                                                       #204 12.995155
      ATT: Write Request (0x12) len 4
        Handle: 0x003a
          Data: 0100
zephyr.exe[2673534]: < HCI Command: Host Number of Completed Packets (0x03|0x0035) plen 5                          #205 12.997854
        Num handles: 1
        Handle: 2613 Address: DF:A9:FF:F6:B1:1A (OUI DF-A9-FF)
        Count: 1
zephyr.exe[2673534]: < ACL Data TX: Handle 2613 flags 0x00 dlen 5                                                  #206 12.997936
      ATT: Write Response (0x13) len 0
> HCI Event: Number of Completed Packets (0x13) plen 5                                                             #207 13.154988
        Num handles: 1
        Handle: 2613 Address: DF:A9:FF:F6:B1:1A (OUI DF-A9-FF)
        Count: 1
        #206: len 5 (0 Kb/s)
        Latency: 157 msec (76-237 msec ~156 msec)
> ACL Data RX: Handle 2613 flags 0x02 dlen 9                                                                       #208 13.155154
      ATT: Write Request (0x12) len 4
        Handle: 0x003d
          Data: 0000
zephyr.exe[2673534]: < HCI Command: Host Number of Completed Packets (0x03|0x0035) plen 5                          #209 13.157788
        Num handles: 1
        Handle: 2613 Address: DF:A9:FF:F6:B1:1A (OUI DF-A9-FF)
        Count: 1
zephyr.exe[2673534]: < ACL Data TX: Handle 2613 flags 0x00 dlen 5                                                  #210 13.157871
      ATT: Write Response (0x13) len 0
> HCI Event: Number of Completed Packets (0x13) plen 5                                                             #211 13.314972
        Num handles: 1
        Handle: 2613 Address: DF:A9:FF:F6:B1:1A (OUI DF-A9-FF)
        Count: 1
        #210: len 5 (0 Kb/s)
        Latency: 157 msec (76-237 msec ~157 msec)
> ACL Data RX: Handle 2613 flags 0x02 dlen 9                                                                       #212 13.315110
      ATT: Write Request (0x12) len 4
        Handle: 0x003d
          Data: 0100
zephyr.exe[2673534]: < HCI Command: Host Number of Completed Packets (0x03|0x0035) plen 5                          #213 13.318128
        Num handles: 1
        Handle: 2613 Address: DF:A9:FF:F6:B1:1A (OUI DF-A9-FF)
        Count: 1
zephyr.exe[2673534]: < ACL Data TX: Handle 2613 flags 0x00 dlen 5                                                  #214 13.318243
      ATT: Write Response (0x13) len 0
> HCI Event: Number of Completed Packets (0x13) plen 5                                                             #215 13.555011
        Num handles: 1
        Handle: 2613 Address: DF:A9:FF:F6:B1:1A (OUI DF-A9-FF)
        Count: 1
        #214: len 5 (0 Kb/s)
        Latency: 236 msec (76-237 msec ~196 msec)
> ACL Data RX: Handle 2613 flags 0x02 dlen 9                                                                       #216 13.555143
      ATT: Write Request (0x12) len 4
        Handle: 0x0040
          Data: 0000
zephyr.exe[2673534]: < HCI Command: Host Number of Completed Packets (0x03|0x0035) plen 5                          #217 13.557967
        Num handles: 1
        Handle: 2613 Address: DF:A9:FF:F6:B1:1A (OUI DF-A9-FF)
        Count: 1
zephyr.exe[2673534]: < ACL Data TX: Handle 2613 flags 0x00 dlen 5                                                  #218 13.557986
      ATT: Write Response (0x13) len 0
> HCI Event: Number of Completed Packets (0x13) plen 5                                                             #219 13.715111
        Num handles: 1
        Handle: 2613 Address: DF:A9:FF:F6:B1:1A (OUI DF-A9-FF)
        Count: 1
        #218: len 5 (0 Kb/s)
        Latency: 157 msec (76-237 msec ~177 msec)
> ACL Data RX: Handle 2613 flags 0x02 dlen 9                                                                       #220 13.715151
      ATT: Write Request (0x12) len 4
        Handle: 0x0040
          Data: 0100
zephyr.exe[2673534]: < HCI Command: Host Number of Completed Packets (0x03|0x0035) plen 5                          #221 13.718137
        Num handles: 1
        Handle: 2613 Address: DF:A9:FF:F6:B1:1A (OUI DF-A9-FF)
        Count: 1
zephyr.exe[2673534]: < ACL Data TX: Handle 2613 flags 0x00 dlen 5                                                  #222 13.718187
      ATT: Write Response (0x13) len 0
> HCI Event: Number of Completed Packets (0x13) plen 5                                                             #223 13.875005
        Num handles: 1
        Handle: 2613 Address: DF:A9:FF:F6:B1:1A (OUI DF-A9-FF)
        Count: 1
        #222: len 5 (0 Kb/s)
        Latency: 156 msec (76-237 msec ~166 msec)
> ACL Data RX: Handle 2613 flags 0x02 dlen 9                                                                       #224 13.875187
      ATT: Write Request (0x12) len 4
        Handle: 0x0043
          Data: 0000
zephyr.exe[2673534]: < HCI Command: Host Number of Completed Packets (0x03|0x0035) plen 5                          #225 13.877949
        Num handles: 1
        Handle: 2613 Address: DF:A9:FF:F6:B1:1A (OUI DF-A9-FF)
        Count: 1
zephyr.exe[2673534]: < ACL Data TX: Handle 2613 flags 0x00 dlen 5                                                  #226 13.877968
      ATT: Write Response (0x13) len 0
> HCI Event: Number of Completed Packets (0x13) plen 5                                                             #227 14.035004
        Num handles: 1
        Handle: 2613 Address: DF:A9:FF:F6:B1:1A (OUI DF-A9-FF)
        Count: 1
        #226: len 5 (0 Kb/s)
        Latency: 157 msec (76-237 msec ~161 msec)
> ACL Data RX: Handle 2613 flags 0x02 dlen 9                                                                       #228 14.035124
      ATT: Write Request (0x12) len 4
        Handle: 0x0043
          Data: 0100
zephyr.exe[2673534]: < HCI Command: Host Number of Completed Packets (0x03|0x0035) plen 5                          #229 14.038118
        Num handles: 1
        Handle: 2613 Address: DF:A9:FF:F6:B1:1A (OUI DF-A9-FF)
        Count: 1
zephyr.exe[2673534]: < ACL Data TX: Handle 2613 flags 0x00 dlen 5                                                  #230 14.038228
      ATT: Write Response (0x13) len 0
> HCI Event: Number of Completed Packets (0x13) plen 5                                                             #231 14.194980
        Num handles: 1
        Handle: 2613 Address: DF:A9:FF:F6:B1:1A (OUI DF-A9-FF)
        Count: 1
        #230: len 5 (0 Kb/s)
        Latency: 156 msec (76-237 msec ~159 msec)
> ACL Data RX: Handle 2613 flags 0x02 dlen 9                                                                       #232 14.195170
      ATT: Write Request (0x12) len 4
        Handle: 0x0046
          Data: 0000
zephyr.exe[2673534]: < HCI Command: Host Number of Completed Packets (0x03|0x0035) plen 5                          #233 14.198102
        Num handles: 1
        Handle: 2613 Address: DF:A9:FF:F6:B1:1A (OUI DF-A9-FF)
        Count: 1
zephyr.exe[2673534]: < ACL Data TX: Handle 2613 flags 0x00 dlen 5                                                  #234 14.198188
      ATT: Write Response (0x13) len 0
> HCI Event: Number of Completed Packets (0x13) plen 5                                                             #235 14.355031
        Num handles: 1
        Handle: 2613 Address: DF:A9:FF:F6:B1:1A (OUI DF-A9-FF)
        Count: 1
        #234: len 5 (0 Kb/s)
        Latency: 156 msec (76-237 msec ~158 msec)
> ACL Data RX: Handle 2613 flags 0x02 dlen 9                                                                       #236 14.355190
      ATT: Write Request (0x12) len 4
        Handle: 0x0046
          Data: 0100
zephyr.exe[2673534]: < HCI Command: Host Number of Completed Packets (0x03|0x0035) plen 5                          #237 14.358109
        Num handles: 1
        Handle: 2613 Address: DF:A9:FF:F6:B1:1A (OUI DF-A9-FF)
        Count: 1
zephyr.exe[2673534]: < ACL Data TX: Handle 2613 flags 0x00 dlen 5                                                  #238 14.358188
      ATT: Write Response (0x13) len 0
> HCI Event: Number of Completed Packets (0x13) plen 5                                                             #239 14.514994
        Num handles: 1
        Handle: 2613 Address: DF:A9:FF:F6:B1:1A (OUI DF-A9-FF)
        Count: 1
        #238: len 5 (0 Kb/s)
        Latency: 156 msec (76-237 msec ~157 msec)
> ACL Data RX: Handle 2613 flags 0x02 dlen 7                                                                       #240 14.515166
      ATT: Read Request (0x0a) len 2
        Handle: 0x003c
zephyr.exe[2673534]: < HCI Command: Host Number of Completed Packets (0x03|0x0035) plen 5                          #241 14.518074
        Num handles: 1
        Handle: 2613 Address: DF:A9:FF:F6:B1:1A (OUI DF-A9-FF)
        Count: 1
zephyr.exe[2673534]: < ACL Data TX: Handle 2613 flags 0x00 dlen 7                                                  #242 14.518187
      ATT: Read Response (0x0b) len 2
> HCI Event: Number of Completed Packets (0x13) plen 5                                                             #243 14.674929
        Num handles: 1
        Handle: 2613 Address: DF:A9:FF:F6:B1:1A (OUI DF-A9-FF)
        Count: 1
        #242: len 7 (0 Kb/s)
        Latency: 156 msec (76-237 msec ~157 msec)
> ACL Data RX: Handle 2613 flags 0x02 dlen 7                                                                       #244 14.675106
      ATT: Read Request (0x0a) len 2
        Handle: 0x003f
zephyr.exe[2673534]: < HCI Command: Host Number of Completed Packets (0x03|0x0035) plen 5                          #245 14.678064
        Num handles: 1
        Handle: 2613 Address: DF:A9:FF:F6:B1:1A (OUI DF-A9-FF)
        Count: 1
zephyr.exe[2673534]: < ACL Data TX: Handle 2613 flags 0x00 dlen 7                                                  #246 14.678132
      ATT: Read Response (0x0b) len 2
> HCI Event: Number of Completed Packets (0x13) plen 5                                                             #247 14.834931
        Num handles: 1
        Handle: 2613 Address: DF:A9:FF:F6:B1:1A (OUI DF-A9-FF)
        Count: 1
        #246: len 7 (0 Kb/s)
        Latency: 156 msec (76-237 msec ~156 msec)
> ACL Data RX: Handle 2613 flags 0x02 dlen 7                                                                       #248 14.835115
      ATT: Read Request (0x0a) len 2
        Handle: 0x0042
zephyr.exe[2673534]: < HCI Command: Host Number of Completed Packets (0x03|0x0035) plen 5                          #249 14.837848
        Num handles: 1
        Handle: 2613 Address: DF:A9:FF:F6:B1:1A (OUI DF-A9-FF)
        Count: 1
zephyr.exe[2673534]: < ACL Data TX: Handle 2613 flags 0x00 dlen 7                                                  #250 14.837911
      ATT: Read Response (0x0b) len 2
> HCI Event: Number of Completed Packets (0x13) plen 5                                                             #251 14.994920
        Num handles: 1
        Handle: 2613 Address: DF:A9:FF:F6:B1:1A (OUI DF-A9-FF)
        Count: 1
        #250: len 7 (0 Kb/s)
        Latency: 157 msec (76-237 msec ~156 msec)
> ACL Data RX: Handle 2613 flags 0x02 dlen 7                                                                       #252 14.995098
      ATT: Read Request (0x0a) len 2
        Handle: 0x0045
zephyr.exe[2673534]: < HCI Command: Host Number of Completed Packets (0x03|0x0035) plen 5                          #253 14.997992
        Num handles: 1
        Handle: 2613 Address: DF:A9:FF:F6:B1:1A (OUI DF-A9-FF)
        Count: 1
zephyr.exe[2673534]: < ACL Data TX: Handle 2613 flags 0x00 dlen 7                                                  #254 14.998101
      ATT: Read Response (0x0b) len 2
> HCI Event: Number of Completed Packets (0x13) plen 5                                                             #255 15.154960
        Num handles: 1
        Handle: 2613 Address: DF:A9:FF:F6:B1:1A (OUI DF-A9-FF)
        Count: 1
        #254: len 7 (0 Kb/s)
        Latency: 156 msec (76-237 msec ~156 msec)
> ACL Data RX: Handle 2613 flags 0x02 dlen 7                                                                       #256 15.155092
      ATT: Read Request (0x0a) len 2
        Handle: 0x002f
zephyr.exe[2673534]: < HCI Command: Host Number of Completed Packets (0x03|0x0035) plen 5                          #257 15.157992
        Num handles: 1
        Handle: 2613 Address: DF:A9:FF:F6:B1:1A (OUI DF-A9-FF)
        Count: 1
zephyr.exe[2673534]: < ACL Data TX: Handle 2613 flags 0x00 dlen 9                                                  #258 15.158036
      ATT: Read Response (0x0b) len 4
> HCI Event: Number of Completed Packets (0x13) plen 5                                                             #259 15.314975
        Num handles: 1
        Handle: 2613 Address: DF:A9:FF:F6:B1:1A (OUI DF-A9-FF)
        Count: 1
        #258: len 9 (0 Kb/s)
        Latency: 156 msec (76-237 msec ~156 msec)
> ACL Data RX: Handle 2613 flags 0x02 dlen 7                                                                       #260 15.315116
      ATT: Read Request (0x0a) len 2
        Handle: 0x002c
zephyr.exe[2673534]: < HCI Command: Host Number of Completed Packets (0x03|0x0035) plen 5                          #261 15.318156
        Num handles: 1
        Handle: 2613 Address: DF:A9:FF:F6:B1:1A (OUI DF-A9-FF)
        Count: 1
zephyr.exe[2673534]: < ACL Data TX: Handle 2613 flags 0x00 dlen 27                                                 #262 15.318207
zephyr.exe[2673534]: < ACL Data TX: Handle 2613 flags 0x01 dlen 27                                                 #263 15.318289
zephyr.exe[2673534]: < ACL Data TX: Handle 2613 flags 0x01 dlen 12                                                 #264 15.318306
      ATT: Read Response (0x0b) len 61
> HCI Event: Number of Completed Packets (0x13) plen 5                                                             #265 15.395320
        Num handles: 1
        Handle: 2613 Address: DF:A9:FF:F6:B1:1A (OUI DF-A9-FF)
        Count: 1
        #262: len 27 (2 Kb/s)
        Latency: 77 msec (76-237 msec ~117 msec)
> HCI Event: Number of Completed Packets (0x13) plen 5                                                             #266 15.395808
        Num handles: 1
        Handle: 2613 Address: DF:A9:FF:F6:B1:1A (OUI DF-A9-FF)
        Count: 1
        #263: len 27 (2 Kb/s)
        Latency: 77 msec (76-237 msec ~97 msec)
> HCI Event: Number of Completed Packets (0x13) plen 5                                                             #267 15.474917
        Num handles: 1
        Handle: 2613 Address: DF:A9:FF:F6:B1:1A (OUI DF-A9-FF)
        Count: 1
        #264: len 12 (0 Kb/s)
        Latency: 156 msec (76-237 msec ~126 msec)
> ACL Data RX: Handle 2613 flags 0x02 dlen 7                                                                       #268 15.554995
      ATT: Read Request (0x0a) len 2
        Handle: 0x0032
zephyr.exe[2673534]: < HCI Command: Host Number of Completed Packets (0x03|0x0035) plen 5                          #269 15.557955
        Num handles: 1
        Handle: 2613 Address: DF:A9:FF:F6:B1:1A (OUI DF-A9-FF)
        Count: 1
zephyr.exe[2673534]: < ACL Data TX: Handle 2613 flags 0x00 dlen 9                                                  #270 15.558017
      ATT: Read Response (0x0b) len 4
> HCI Event: Number of Completed Packets (0x13) plen 5                                                             #271 15.794904
        Num handles: 1
        Handle: 2613 Address: DF:A9:FF:F6:B1:1A (OUI DF-A9-FF)
        Count: 1
        #270: len 9 (0 Kb/s)
        Latency: 236 msec (76-237 msec ~181 msec)
> ACL Data RX: Handle 2613 flags 0x02 dlen 7                                                                       #272 15.795124
      ATT: Read Request (0x0a) len 2
        Handle: 0x0035
zephyr.exe[2673534]: < HCI Command: Host Number of Completed Packets (0x03|0x0035) plen 5                          #273 15.797847
        Num handles: 1
        Handle: 2613 Address: DF:A9:FF:F6:B1:1A (OUI DF-A9-FF)
        Count: 1
zephyr.exe[2673534]: < ACL Data TX: Handle 2613 flags 0x00 dlen 9                                                  #274 15.797906
      ATT: Read Response (0x0b) len 4
> HCI Event: Number of Completed Packets (0x13) plen 5                                                             #275 15.954834
        Num handles: 1
        Handle: 2613 Address: DF:A9:FF:F6:B1:1A (OUI DF-A9-FF)
        Count: 1
        #274: len 9 (0 Kb/s)
        Latency: 156 msec (76-237 msec ~169 msec)
> ACL Data RX: Handle 2613 flags 0x02 dlen 27                                                                      #276 16.035188
> ACL Data RX: Handle 2613 flags 0x01 dlen 7                                                                       #277 16.035459
      ATT: Write Command (0x52) len 29
        Handle: 0x0039
          Data: 010103010206000000001002010302020103042800050301000000
zephyr.exe[2673534]: < HCI Command: Host Number of Completed Packets (0x03|0x0035) plen 5                          #278 16.038156
        Num handles: 1
        Handle: 2613 Address: DF:A9:FF:F6:B1:1A (OUI DF-A9-FF)
        Count: 1
zephyr.exe[2673534]: < HCI Command: Host Number of Completed Packets (0x03|0x0035) plen 5                          #279 16.039817
        Num handles: 1
        Handle: 2613 Address: DF:A9:FF:F6:B1:1A (OUI DF-A9-FF)
        Count: 1
zephyr.exe[2673534]: < ACL Data TX: Handle 2613 flags 0x00 dlen 12                                                 #280 16.040469
      ATT: Handle Value Notification (0x1b) len 7
        Handle: 0x0039
          Data: 0101030000
zephyr.exe[2673534]: < ACL Data TX: Handle 2613 flags 0x00 dlen 27                                                 #281 16.040494
zephyr.exe[2673534]: < ACL Data TX: Handle 2613 flags 0x01 dlen 21                                                 #282 16.040527
      ATT: Handle Value Notification (0x1b) len 43
        Handle: 0x0042
          Data: 03010002020a00102700409c00102700409c0006000000001002010302020103042800050301000000
> HCI Event: Number of Completed Packets (0x13) plen 5                                                             #283 16.115239
        Num handles: 1
        Handle: 2613 Address: DF:A9:FF:F6:B1:1A (OUI DF-A9-FF)
        Count: 1
        #280: len 12 (1 Kb/s)
        Latency: 74 msec (74-237 msec ~122 msec)
> HCI Event: Number of Completed Packets (0x13) plen 5                                                             #284 16.115730
        Num handles: 1
        Handle: 2613 Address: DF:A9:FF:F6:B1:1A (OUI DF-A9-FF)
        Count: 1
        #281: len 27 (2 Kb/s)
        Latency: 75 msec (74-237 msec ~98 msec)
> HCI Event: Number of Completed Packets (0x13) plen 5                                                             #285 16.194890
        Num handles: 1
        Handle: 2613 Address: DF:A9:FF:F6:B1:1A (OUI DF-A9-FF)
        Count: 1
        #282: len 21 (1 Kb/s)
        Latency: 154 msec (74-237 msec ~126 msec)
> ACL Data RX: Handle 2613 flags 0x02 dlen 25                                                                      #286 16.275175
      ATT: Write Command (0x52) len 20
        Handle: 0x0039
          Data: 020103010110270000022800020a00a86100
zephyr.exe[2673534]: < HCI Command: Host Number of Completed Packets (0x03|0x0035) plen 5                          #287 16.282257
        Num handles: 1
        Handle: 2613 Address: DF:A9:FF:F6:B1:1A (OUI DF-A9-FF)
        Count: 1
zephyr.exe[2673534]: < ACL Data TX: Handle 2613 flags 0x00 dlen 12                                                 #288 16.282743
      ATT: Handle Value Notification (0x1b) len 7
        Handle: 0x0039
          Data: 0201030000
zephyr.exe[2673534]: < ACL Data TX: Handle 2613 flags 0x00 dlen 24                                                 #289 16.282782
      ATT: Handle Value Notification (0x1b) len 19
        Handle: 0x0042
          Data: 0302010110270000022800020a00a86100
> HCI Event: Number of Completed Packets (0x13) plen 5                                                             #290 16.355252
        Num handles: 1
        Handle: 2613 Address: DF:A9:FF:F6:B1:1A (OUI DF-A9-FF)
        Count: 1
        #288: len 12 (1 Kb/s)
        Latency: 72 msec (72-237 msec ~99 msec)
> HCI Event: Number of Completed Packets (0x13) plen 5                                                             #291 16.434802
        Num handles: 1
        Handle: 2613 Address: DF:A9:FF:F6:B1:1A (OUI DF-A9-FF)
        Count: 1
        #289: len 24 (1 Kb/s)
        Latency: 152 msec (72-237 msec ~125 msec)
> ACL Data RX: Handle 2613 flags 0x02 dlen 15                                                                      #292 16.515071
      ATT: Write Command (0x52) len 10
        Handle: 0x0039
          Data: 030103040302ff0f
zephyr.exe[2673534]: < HCI Command: Host Number of Completed Packets (0x03|0x0035) plen 5                          #293 16.518211
        Num handles: 1
        Handle: 2613 Address: DF:A9:FF:F6:B1:1A (OUI DF-A9-FF)
        Count: 1
zephyr.exe[2673534]: < ACL Data TX: Handle 2613 flags 0x00 dlen 12                                                 #294 16.518607
      ATT: Handle Value Notification (0x1b) len 7
        Handle: 0x0039
          Data: 0301030000
zephyr.exe[2673534]: < ACL Data TX: Handle 2613 flags 0x00 dlen 16                                                 #295 16.518622
      ATT: Handle Value Notification (0x1b) len 11
        Handle: 0x0042
          Data: 03030101040302ff0f
> HCI Event: Number of Completed Packets (0x13) plen 5                                                             #296 16.595223
        Num handles: 1
        Handle: 2613 Address: DF:A9:FF:F6:B1:1A (OUI DF-A9-FF)
        Count: 1
        #294: len 12 (1 Kb/s)
        Latency: 76 msec (72-237 msec ~101 msec)
> HCI Event: Number of Completed Packets (0x13) plen 5                                                             #297 16.674823
        Num handles: 1
        Handle: 2613 Address: DF:A9:FF:F6:B1:1A (OUI DF-A9-FF)
        Count: 1
        #295: len 16 (0 Kb/s)
        Latency: 156 msec (72-237 msec ~128 msec)
> HCI Event: LE Meta Event (0x3e) plen 7                                                                           #298 16.755353
      LE Connected Isochronous Stream Request (0x1a)
        ACL Handle: 2613
        CIS Handle: 222
        CIG ID: 0x01
        CIS ID: 0x01
zephyr.exe[2673534]: < HCI Command: LE Accept Connected Isochronous Stream Request (0x08|0x0066) plen 2            #299 16.758101
        CIS Handle: 222
> HCI Event: Command Status (0x0f) plen 4                                                                          #300 16.758558
      LE Accept Connected Isochronous Stream Request (0x08|0x0066) ncmd 1
        Status: Success (0x00)
> HCI Event: LE Meta Event (0x3e) plen 43                                                                          #301 17.002855
      Unknown (0x2a)
        00 de 00 d2 06 00 d2 06 00 d2 06 00 d2 06 00 02  ................
        02 03 00 01 01 01 00 00 28 00 08 00 46 02 00 00  ........(...F...
        00 28 00 10 27 00 10 27 00 00                    .(..'..'..      
> ACL Data RX: Handle 2613 flags 0x02 dlen 10                                                                      #302 17.074990
      ATT: Write Command (0x52) len 5
        Handle: 0x0039
          Data: 040103
zephyr.exe[2673534]: < HCI Command: Host Number of Completed Packets (0x03|0x0035) plen 5                          #303 17.077801
        Num handles: 1
        Handle: 2613 Address: DF:A9:FF:F6:B1:1A (OUI DF-A9-FF)
        Count: 1
zephyr.exe[2673534]: < HCI Command: LE Setup Isochronous Data Path (0x08|0x006e) plen 13                           #304 17.077878
        Handle: 222
        Data Path Direction: Input (Host to Controller) (0x00)
        Data Path: HCI (0x00)
        Coding Format: Transparent (0x03)
        Company Codec ID: Ericsson Technology Licensing (0)
        Vendor Codec ID: 0
        Controller Delay: 0 us (0x000000)
        Codec Configuration Length: 0
        Codec Configuration: 
> HCI Event: Command Complete (0x0e) plen 6                                                                        #305 17.078550
      LE Setup Isochronous Data Path (0x08|0x006e) ncmd 1
        Status: Success (0x00)
        Handle: 222
zephyr.exe[2673534]: < ACL Data TX: Handle 2613 flags 0x00 dlen 12                                                 #306 17.097759
      ATT: Handle Value Notification (0x1b) len 7
        Handle: 0x0039
          Data: 0401030000
zephyr.exe[2673534]: < ACL Data TX: Handle 2613 flags 0x00 dlen 16                                                 #307 17.097767
      ATT: Handle Value Notification (0x1b) len 11
        Handle: 0x0042
          Data: 03040101040302ff0f
zephyr.exe[2673534]: < ISO Data TX: Handle 222 flags 0x02 dlen 44                                                  #308 17.107645
zephyr.exe[2673534]: < ISO Data TX: Handle 222 flags 0x02 dlen 44                                                  #309 17.107771
> HCI Event: Number of Completed Packets (0x13) plen 5                                                             #310 17.108749
        Num handles: 1
        Handle: 222
        Count: 1
> HCI Event: Number of Completed Packets (0x13) plen 5                                                             #311 17.109396
        Num handles: 1
        Handle: 222
        Count: 1
zephyr.exe[2673534]: < ISO Data TX: Handle 222 flags 0x02 dlen 44                                                  #312 17.127773
zephyr.exe[2673534]: < ISO Data TX: Handle 222 flags 0x02 dlen 44                                                  #313 17.127917
> HCI Event: Number of Completed Packets (0x13) plen 5                                                             #314 17.128951
        Num handles: 1
        Handle: 222
        Count: 1
> HCI Event: Number of Completed Packets (0x13) plen 5                                                             #315 17.129422
        Num handles: 1
        Handle: 222
        Count: 1
zephyr.exe[2673534]: < ISO Data TX: Handle 222 flags 0x02 dlen 44                                                  #316 17.147889
zephyr.exe[2673534]: < ISO Data TX: Handle 222 flags 0x02 dlen 44                                                  #317 17.148145
> HCI Event: Number of Completed Packets (0x13) plen 5                                                             #318 17.149086
        Num handles: 1
        Handle: 222
        Count: 1
> HCI Event: Number of Completed Packets (0x13) plen 5                                                             #319 17.149611
        Num handles: 1
        Handle: 222
        Count: 1
> HCI Event: Number of Completed Packets (0x13) plen 5                                                             #320 17.155187
        Num handles: 1
        Handle: 2613 Address: DF:A9:FF:F6:B1:1A (OUI DF-A9-FF)
        Count: 1
        #306: len 12 (1 Kb/s)
        Latency: 57 msec (57-237 msec ~93 msec)
zephyr.exe[2673534]: < ISO Data TX: Handle 222 flags 0x02 dlen 44                                                  #321 17.167853
zephyr.exe[2673534]: < ISO Data TX: Handle 222 flags 0x02 dlen 44                                                  #322 17.168006
> HCI Event: Number of Completed Packets (0x13) plen 5                                                             #323 17.168999
        Num handles: 1
        Handle: 222
        Count: 1
> HCI Event: Number of Completed Packets (0x13) plen 5                                                             #324 17.169628
        Num handles: 1
        Handle: 222
        Count: 1
zephyr.exe[2673534]: < ISO Data TX: Handle 222 flags 0x02 dlen 44                                                  #325 17.187774
zephyr.exe[2673534]: < ISO Data TX: Handle 222 flags 0x02 dlen 44                                                  #326 17.187939
> HCI Event: Number of Completed Packets (0x13) plen 5                                                             #327 17.189018
        Num handles: 1
        Handle: 222
        Count: 1
> HCI Event: Number of Completed Packets (0x13) plen 5                                                             #328 17.189479
        Num handles: 1
        Handle: 222
        Count: 1
zephyr.exe[2673534]: < ISO Data TX: Handle 222 flags 0x02 dlen 44                                                  #329 17.207661
zephyr.exe[2673534]: < ISO Data TX: Handle 222 flags 0x02 dlen 44                                                  #330 17.207745
> HCI Event: Number of Completed Packets (0x13) plen 5                                                             #331 17.208773
        Num handles: 1
        Handle: 222
        Count: 1
> HCI Event: Number of Completed Packets (0x13) plen 5                                                             #332 17.209269
        Num handles: 1
        Handle: 222
        Count: 1
zephyr.exe[2673534]: < ISO Data TX: Handle 222 flags 0x02 dlen 44                                                  #333 17.227663
zephyr.exe[2673534]: < ISO Data TX: Handle 222 flags 0x02 dlen 44                                                  #334 17.227796
> HCI Event: Number of Completed Packets (0x13) plen 5                                                             #335 17.228902
        Num handles: 1
        Handle: 222
        Count: 1
> HCI Event: Number of Completed Packets (0x13) plen 5                                                             #336 17.229449
        Num handles: 1
        Handle: 222
        Count: 1
> HCI Event: Number of Completed Packets (0x13) plen 5                                                             #337 17.234905
        Num handles: 1
        Handle: 2613 Address: DF:A9:FF:F6:B1:1A (OUI DF-A9-FF)
        Count: 1
        #307: len 16 (0 Kb/s)
        Latency: 137 msec (57-237 msec ~115 msec)
> ACL Data RX: Handle 2613 flags 0x02 dlen 10                                                                      #338 17.235080
      ATT: Write Command (0x52) len 5
        Handle: 0x0039
          Data: 050103
zephyr.exe[2673534]: < HCI Command: Host Number of Completed Packets (0x03|0x0035) plen 5                          #339 17.237766
        Num handles: 1
        Handle: 2613 Address: DF:A9:FF:F6:B1:1A (OUI DF-A9-FF)
        Count: 1
ze