Bluetooth monitor ver 5.72
= Note: Linux version 7.0.0-31-generic (x86_64)                        0.797112
= Note: Bluetooth subsystem version 2.22                               0.797114
= New Index: 00:00:00:00:00:00 (Primary,UART,hci1)              [hci1] 0.797115
= New Index: 48:5F:99:8E:E0:64 (Primary,USB,hci0)               [hci0] 0.797115
= Open Index: 00:00:00:00:00:00                                 [hci1] 0.961602
= Index Info: 00:00:00:00:00:00 (Nordic Semiconductor ASA)      [hci1] 0.961609
@ USER Open: main (privileged) version 2.22            {0x0001} [hci1] 0.961612
< HCI Command: Reset (0x03|0x0003) plen 0                    #1 [hci1] 0.963385
> HCI Event: Command Complete (0x0e) plen 4                  #2 [hci1] 0.964679
      Reset (0x03|0x0003) ncmd 1
        Status: Success (0x00)
< HCI Command: Read Local Supported... (0x04|0x0003) plen 0  #3 [hci1] 0.980384
> HCI Event: Command Complete (0x0e) plen 12                 #4 [hci1] 0.980864
      Read Local Supported Features (0x04|0x0003) ncmd 1
        Status: Success (0x00)
        Features: 0x00 0x00 0x00 0x00 0x60 0x00 0x00 0x00
          BR/EDR Not Supported
          LE Supported (Controller)
< HCI Command: Read Local Version In.. (0x04|0x0001) plen 0  #5 [hci1] 1.000239
> HCI Event: Command Complete (0x0e) plen 12                 #6 [hci1] 1.000653
      Read Local Version Information (0x04|0x0001) ncmd 1
        Status: Success (0x00)
        HCI version: Reserved (0x11) - Revision 12345 (0x3039)
        LMP version: Reserved (0x11) - Subversion 12345 (0x3039)
        Manufacturer: Nordic Semiconductor ASA (89)
< HCI Command: Read Local Supported... (0x04|0x0002) plen 0  #7 [hci1] 1.020309
> HCI Event: Command Complete (0x0e) plen 68                 #8 [hci1] 1.021393
      Read Local Supported Commands (0x04|0x0002) ncmd 1
        Status: Success (0x00)
        Commands: 115 entries
          Disconnect (Octet 0 - Bit 5)
          Read Remote Version Information (Octet 2 - Bit 7)
          Set Event Mask (Octet 5 - Bit 6)
          Reset (Octet 5 - Bit 7)
          Read Connection Accept Timeout (Octet 7 - Bit 2)
          Write Connection Accept Timeout (Octet 7 - Bit 3)
          Read Transmit Power Level (Octet 10 - Bit 2)
          Set Controller To Host Flow Control (Octet 10 - Bit 5)
          Host Buffer Size (Octet 10 - Bit 6)
          Host Number of Completed Packets (Octet 10 - Bit 7)
          Read Local Version Information (Octet 14 - Bit 3)
          Read Local Supported Features (Octet 14 - Bit 5)
          Read BD ADDR (Octet 15 - Bit 1)
          Read RSSI (Octet 15 - Bit 5)
          Set Event Mask Page 2 (Octet 22 - Bit 2)
          LE Set Event Mask (Octet 25 - Bit 0)
          LE Read Buffer Size (Octet 25 - Bit 1)
          LE Read Local Supported Features (Octet 25 - Bit 2)
          LE Set Random Address (Octet 25 - Bit 4)
          LE Set Advertising Parameters (Octet 25 - Bit 5)
          LE Read Advertising Channel TX Power (Octet 25 - Bit 6)
          LE Set Advertising Data (Octet 25 - Bit 7)
          LE Set Scan Response Data (Octet 26 - Bit 0)
          LE Set Advertise Enable (Octet 26 - Bit 1)
          LE Set Scan Parameters (Octet 26 - Bit 2)
          LE Set Scan Enable (Octet 26 - Bit 3)
          LE Create Connection (Octet 26 - Bit 4)
          LE Create Connection Cancel (Octet 26 - Bit 5)
          LE Read Accept List Size (Octet 26 - Bit 6)
          LE Clear Accept List (Octet 26 - Bit 7)
          LE Add Device To Accept List (Octet 27 - Bit 0)
          LE Remove Device From Accept List (Octet 27 - Bit 1)
          LE Connection Update (Octet 27 - Bit 2)
          LE Set Host Channel Classification (Octet 27 - Bit 3)
          LE Read Channel Map (Octet 27 - Bit 4)
          LE Read Remote Used Features (Octet 27 - Bit 5)
          LE Encrypt (Octet 27 - Bit 6)
          LE Rand (Octet 27 - Bit 7)
          LE Start Encryption (Octet 28 - Bit 0)
          LE Long Term Key Request Reply (Octet 28 - Bit 1)
          LE Long Term Key Request Neg Reply (Octet 28 - Bit 2)
          LE Read Supported States (Octet 28 - Bit 3)
          Read Authenticated Payload Timeout (Octet 32 - Bit 4)
          Write Authenticated Payload Timeout (Octet 32 - Bit 5)
          LE Set Data Length (Octet 33 - Bit 6)
          LE Read Suggested Default Data Length (Octet 33 - Bit 7)
          LE Write Suggested Default Data Length (Octet 34 - Bit 0)
          LE Add Device To Resolving List (Octet 34 - Bit 3)
          LE Remove Device From Resolving List (Octet 34 - Bit 4)
          LE Clear Resolving List (Octet 34 - Bit 5)
          LE Read Resolving List Size (Octet 34 - Bit 6)
          LE Set Address Resolution Enable (Octet 35 - Bit 1)
          LE Set Resolvable Private Address Timeout (Octet 35 - Bit 2)
          LE Read Maximum Data Length (Octet 35 - Bit 3)
          LE Read PHY (Octet 35 - Bit 4)
          LE Set Default PHY (Octet 35 - Bit 5)
          LE Set PHY (Octet 35 - Bit 6)
          LE Set Advertising Set Random Address (Octet 36 - Bit 1)
          LE Set Extended Advertising Parameters (Octet 36 - Bit 2)
          LE Set Extended Advertising Data (Octet 36 - Bit 3)
          LE Set Extended Scan Response Data (Octet 36 - Bit 4)
          LE Set Extended Advertising Enable (Octet 36 - Bit 5)
          LE Read Maximum Advertising Data Length (Octet 36 - Bit 6)
          LE Read Number of Supported Advertising Sets (Octet 36 - Bit 7)
          LE Remove Advertising Set (Octet 37 - Bit 0)
          LE Clear Advertising Sets (Octet 37 - Bit 1)
          LE Set Periodic Advertising Parameters (Octet 37 - Bit 2)
          LE Set Periodic Advertising Data (Octet 37 - Bit 3)
          LE Set Periodic Advertising Enable (Octet 37 - Bit 4)
          LE Set Extended Scan Parameters (Octet 37 - Bit 5)
          LE Set Extended Scan Enable (Octet 37 - Bit 6)
          LE Extended Create Connection (Octet 37 - Bit 7)
          LE Periodic Advertising Create Sync (Octet 38 - Bit 0)
          LE Periodic Advertising Create Sync Cancel (Octet 38 - Bit 1)
          LE Periodic Advertising Terminate Sync (Octet 38 - Bit 2)
          LE Add Device To Periodic Advertiser List (Octet 38 - Bit 3)
          LE Remove Device From Periodic Advertiser List (Octet 38 - Bit 4)
          LE Clear Periodic Advertiser List (Octet 38 - Bit 5)
          LE Read Periodic Advertiser List Size (Octet 38 - Bit 6)
          LE Read Transmit Power (Octet 38 - Bit 7)
          LE Read RF Path Compensation (Octet 39 - Bit 0)
          LE Write RF Path Compensation (Octet 39 - Bit 1)
          LE Set Privacy Mode (Octet 39 - Bit 2)
          LE Periodic Advertising Receive Enable (Octet 40 - Bit 5)
          LE Periodic Advertising Sync Transfer (Octet 40 - Bit 6)
          LE Periodic Advertising Set Info Transfer (Octet 40 - Bit 7)
          LE Periodic Advertising Sync Transfer Parameters (Octet 41 - Bit 0)
          LE Set Default Periodic Advertisng Sync Transfer Parameters (Octet 41 - Bit 1)
          LE Read Buffer v2 (Octet 41 - Bit 5)
          LE Read ISO TX Sync (Octet 41 - Bit 6)
          LE Set Connected Isochronous Group Parameters (Octet 41 - Bit 7)
          LE Set Connected Isochronous Group Parameters Test (Octet 42 - Bit 0)
          LE Create Connected Isochronous Stream (Octet 42 - Bit 1)
          LE Remove Connected Isochronous Group (Octet 42 - Bit 2)
          LE Accept Connected Isochronous Stream Request (Octet 42 - Bit 3)
          LE Reject Connected Isochronous Stream Request (Octet 42 - Bit 4)
          LE Create Broadcast Isochronous Group (Octet 42 - Bit 5)
          LE Create Broadcast Isochronous Group Test (Octet 42 - Bit 6)
          LE Terminate Broadcast Isochronous Group (Octet 42 - Bit 7)
          LE Broadcast Isochronous Group Create Sync (Octet 43 - Bit 0)
          LE Broadcast Isochronous Group Terminate Sync (Octet 43 - Bit 1)
          LE Request Peer SCA (Octet 43 - Bit 2)
          LE Setup Isochronous Data Path (Octet 43 - Bit 3)
          LE Remove Isochronous Data Path (Octet 43 - Bit 4)
          LE Isochronous Transmit Test (Octet 43 - Bit 5)
          LE Isochronous Receive Test (Octet 43 - Bit 6)
          LE Isochronous Read Test Counters (Octet 43 - Bit 7)
          LE Isochronous Read Test Counters (Octet 44 - Bit 0)
          LE Set Host Feature (Octet 44 - Bit 1)
          Octet 44 - Bit 2 
          Octet 45 - Bit 6 
          Octet 46 - Bit 0 
          Octet 46 - Bit 1 
          Octet 46 - Bit 2 
          Octet 47 - Bit 4 
< HCI Command: Host Buffer Size (0x03|0x0033) plen 7         #9 [hci1] 1.040308
        ACL MTU: 255  ACL max packet: 16
        SCO MTU: 0    SCO max packet: 0
> HCI Event: Command Complete (0x0e) plen 4                 #10 [hci1] 1.040815
      Host Buffer Size (0x03|0x0033) ncmd 1
        Status: Success (0x00)
< HCI Command: Set Controller To Ho.. (0x03|0x0031) plen 1  #11 [hci1] 1.060314
        Flow control: ACL Data Packets (0x01)
> HCI Event: Command Complete (0x0e) plen 4                 #12 [hci1] 1.060726
      Set Controller To Host Flow Control (0x03|0x0031) ncmd 1
        Status: Success (0x00)
< HCI Command: LE Read Local Suppor.. (0x08|0x0003) plen 0  #13 [hci1] 1.080300
> HCI Event: Command Complete (0x0e) plen 12                #14 [hci1] 1.080751
      LE Read Local Supported Features (0x08|0x0003) ncmd 1
        Status: Success (0x00)
        Features: 0xfd 0x79 0x00 0xf7 0x30 0x01 0x00 0x00
          LE Encryption
          Extended Reject Indication
          Peripheral-initiated Features Exchange
          LE Ping
          LE Data Packet Length Extension
          LL Privacy
          Extended Scanner Filter Policies
          LE 2M PHY
          LE Coded PHY
          LE Extended Advertising
          LE Periodic Advertising
          Channel Selection Algorithm #2
          Periodic Advertising Sync Transfer - Sender
          Periodic Advertising Sync Transfer - Recipient
          Sleep Clock Accuracy Updates
          Connected Isochronous Stream - Central
          Connected Isochronous Stream - Peripheral
          Isochronous Broadcaster
          Synchronized Receiver
          Periodic Advertising ADI support
          Connection Subrating
          Unknown features (0x0000010000000000)
< HCI Command: LE Set Host Feature (0x08|0x0074) plen 2     #15 [hci1] 1.100309
        Bit Number: 32
          Connected Isochronous Stream (Host Support)
        Bit Value: 1
> HCI Event: Command Complete (0x0e) plen 4                 #16 [hci1] 1.100718
      LE Set Host Feature (0x08|0x0074) ncmd 1
        Status: Success (0x00)
< HCI Command: LE Read Buffer v2 (0x08|0x0060) plen 0       #17 [hci1] 1.120305
> HCI Event: Command Complete (0x0e) plen 10                #18 [hci1] 1.120823
      LE Read Buffer v2 (0x08|0x0060) ncmd 1
        Status: Success (0x00)
        ACL MTU: 27
        ACL max packet: 3
        ISO MTU: 318
        ISO max packet: 3
< HCI Command: LE Read Maximum Adve.. (0x08|0x003a) plen 0  #19 [hci1] 1.140334
> HCI Event: Command Complete (0x0e) plen 6                 #20 [hci1] 1.140803
      LE Read Maximum Advertising Data Length (0x08|0x003a) ncmd 1
        Status: Success (0x00)
        Max length: 1650
< HCI Command: LE Read Supported St.. (0x08|0x001c) plen 0  #21 [hci1] 1.160320
> HCI Event: Command Complete (0x0e) plen 12                #22 [hci1] 1.160770
      LE Read Supported States (0x08|0x001c) ncmd 1
        Status: Success (0x00)
        States: 0x000003ff3e0306ff
          Non-connectable Advertising State
          Scannable Advertising State
          Connectable Advertising State
          High Duty Cycle Directed Advertising State
          Passive Scanning State
          Active Scanning State
          Initiating State
            and Connection State (Central Role)
          Connection State (Peripheral Role)
          Scannable Advertising State
            and Passive Scanning State
          Connectable Advertising State
            and Passive Scanning State
          Non-connectable Advertising State
            and Initiating State
          Scannable Advertising State
            and Initiating State
          Active Scanning State
            and Connection State (Central Role)
          Passive Scanning State
            and Connection State (Peripheral Role)
          Active Scanning State
            and Connection State (Peripheral Role)
          Initiating State
            and Connection State (Central Role)
            and Central Role & Central Role
          Low Duty Cycle Directed Advertising State
          Connectable Advertising State
            and Initiating State
            and Central Role & Peripheral Role
          High Duty Cycle Directed Advertising State
            and Initiating State
            and Central Role & Peripheral Role
          Low Duty Cycle Directed Advertising State
            and Initiating State
            and Central Role & Peripheral Role
          Connectable Advertising State
            and Connection State (Central Role)
            and Central Role & Peripheral Role
          High Duty Cycle Directed Advertising State
            and Connection State (Central Role)
            and Central Role & Peripheral Role
          Low Duty Cycle Directed Advertising State
            and Connection State (Central Role)
            and Central Role & Peripheral Role
          Connectable Advertising State
            and Connection State (Peripheral Role)
            and Central Role & Peripheral Role
          High Duty Cycle Directed Advertising State
            and Connection State (Peripheral Role)
            and Peripheral Role & Peripheral Role
          Low Duty Cycle Directed Advertising State
            and Connection State (Peripheral Role)
            and Peripheral Role & Peripheral Role
          Initiating State
            and Connection State (Peripheral Role)
            and Central Role & Peripheral Role
< HCI Command: LE Read Maximum Data.. (0x08|0x002f) plen 0  #23 [hci1] 1.180311
> HCI Event: Command Complete (0x0e) plen 12                #24 [hci1] 1.180799
      LE Read Maximum Data Length (0x08|0x002f) ncmd 1
        Status: Success (0x00)
        Max TX octets: 251
        Max TX time: 2704
        Max RX octets: 251
        Max RX time: 2704
< HCI Command: LE Write Suggested D.. (0x08|0x0024) plen 4  #25 [hci1] 1.200305
        TX octets: 251
        TX time: 2704
> HCI Event: Command Complete (0x0e) plen 4                 #26 [hci1] 1.200804
      LE Write Suggested Default Data Length (0x08|0x0024) ncmd 1
        Status: Success (0x00)
< HCI Command: LE Read Resolving Li.. (0x08|0x002a) plen 0  #27 [hci1] 1.220326
> HCI Event: Command Complete (0x0e) plen 5                 #28 [hci1] 1.220785
      LE Read Resolving List Size (0x08|0x002a) ncmd 1
        Status: Success (0x00)
        Size: 8
< HCI Command: LE Set Host Feature (0x08|0x0074) plen 2     #29 [hci1] 1.240309
        Bit Number: 38
          Connection Subrating (Host Support)
        Bit Value: 1
> HCI Event: Command Complete (0x0e) plen 4                 #30 [hci1] 1.240726
      LE Set Host Feature (0x08|0x0074) ncmd 1
        Status: Success (0x00)
< HCI Command: LE Set Event Mask (0x08|0x0001) plen 8       #31 [hci1] 1.260283
        Mask: 0x000002063f87fa5e
          LE Advertising Report
          LE Connection Update Complete
          LE Read Remote Used Features Complete
          LE Long Term Key Request
          LE Data Length Change
          LE Enhanced Connection Complete
          LE PHY Update Complete
          LE Extended Advertising Report
          LE Periodic Advertising Sync Established
          LE Periodic Advertising Report
          LE Periodic Advertising Sync Lost
          LE Extended Scan Timeout
          LE Extended Advertising Set Terminated
          LE Scan Request Received
          LE Periodic Advertising Sync Transfer Rvc
          LE CIS Established
          LE CIS Request
          LE Create BIG Complete
          LE Terminate BIG Complete
          LE BIG Sync Estabilished Complete
          LE BIG Sync Lost
          LE BIG Info Advertising Report
          LE Subrate Change
          Unknown mask (0x0000020000000000)
> HCI Event: Command Complete (0x0e) plen 4                 #32 [hci1] 1.260899
      LE Set Event Mask (0x08|0x0001) ncmd 1
        Status: Success (0x00)
< HCI Command: Set Event Mask (0x03|0x0001) plen 8          #33 [hci1] 1.280312
        Mask: 0x2000800002008890
          Disconnection Complete
          Encryption Change
          Read Remote Version Information Complete
          Hardware Error
          Data Buffer Overflow
          Encryption Key Refresh Complete
          LE Meta
> HCI Event: Command Complete (0x0e) plen 4                 #34 [hci1] 1.280814
      Set Event Mask (0x03|0x0001) ncmd 1
        Status: Success (0x00)
< HCI Command: Read BD ADDR (0x04|0x0009) plen 0            #35 [hci1] 1.300314
> HCI Event: Command Complete (0x0e) plen 10                #36 [hci1] 1.300979
      Read BD ADDR (0x04|0x0009) ncmd 1
        Status: Success (0x00)
        Address: 00:00:00:00:00:00 (OUI 00-00-00)
< HCI Command: LE Set Random Address (0x08|0x0005) plen 6   #37 [hci1] 1.320333
        Address: D5:B6:CC:31:DB:3B (Static)
> HCI Event: Command Complete (0x0e) plen 4                 #38 [hci1] 1.320915
      LE Set Random Address (0x08|0x0005) ncmd 1
        Status: Success (0x00)
< HCI Command: LE Set Extended Adv.. (0x08|0x0036) plen 25  #39 [hci1] 2.880347
        Handle: 0x00
        Properties: 0x0001
          Connectable
        Min advertising interval: 100.000 msec (0x00a0)
        Max advertising interval: 150.000 msec (0x00f0)
        Channel map: 37, 38, 39 (0x07)
        Own address type: Random (0x01)
        Peer address type: Public (0x00)
        Peer address: 00:00:00:00:00:00 (OUI 00-00-00)
        Filter policy: Allow Scan Request from Any, Allow Connect Request from Any (0x00)
        TX power: Host has no preference (0x7f)
        Primary PHY: LE 1M (0x01)
        Secondary max skip: 0x00
        Secondary PHY: LE 2M (0x02)
        SID: 0x00
        Scan request notifications: Disabled (0x00)
> HCI Event: Command Complete (0x0e) plen 5                 #40 [hci1] 2.881268
      LE Set Extended Advertising Parameters (0x08|0x0036) ncmd 1
        Status: Success (0x00)
        TX power (selected): 0 dbm (0x00)
< HCI Command: LE Set Advertising S.. (0x08|0x0035) plen 7  #41 [hci1] 2.900326
        Advertising handle: 0x00
        Advertising random address: D5:B6:CC:31:DB:3B (Static)
> HCI Event: Command Complete (0x0e) plen 4                 #42 [hci1] 2.900870
      LE Set Advertising Set Random Address (0x08|0x0035) ncmd 1
        Status: Success (0x00)
< HCI Command: LE Set Extended Adv.. (0x08|0x0037) plen 30  #43 [hci1] 2.920328
        Handle: 0x00
        Operation: Complete extended advertising data (0x03)
        Fragment preference: Minimize fragmentation (0x01)
        Data length: 0x1a
        Flags: 0x06
          LE General Discoverable Mode
          BR/EDR Not Supported
        Service Data: Common Audio (0x1853)
          Data: 01
        Service Data: Audio Stream Control (0x184e)
          Data: 014602420000
        Resolvable Set Identifier: 48-61-8E-0C-80-97
          Hash: 0x c8097
          Random: 0x48618e
> HCI Event: Command Complete (0x0e) plen 4                 #44 [hci1] 2.921212
      LE Set Extended Advertising Data (0x08|0x0037) ncmd 1
        Status: Success (0x00)
< HCI Command: LE Set Extended Adve.. (0x08|0x0039) plen 6  #45 [hci1] 2.940298
        Extended advertising: Enabled (0x01)
        Number of sets: 1 (0x01)
        Entry 0
          Handle: 0x00
          Duration: 0 ms (0x00)
          Max ext adv events: 0
> HCI Event: Command Complete (0x0e) plen 4                 #46 [hci1] 2.940894
      LE Set Extended Advertising Enable (0x08|0x0039) ncmd 1
        Status: Success (0x00)
> HCI Event: LE Meta Event (0x3e) plen 31                   #47 [hci1] 4.750752
      LE Enhanced Connection Complete (0x0a)
        Status: Success (0x00)
        Handle: 3603
        Role: Peripheral (0x01)
        Peer address type: Public (0x00)
        Peer address: DF:A9:FF:F6:B1:1A (OUI DF-A9-FF)
        Local resolvable private address: 00:00:00:00:00:00 (Non-Resolvable)
        Peer resolvable private address: 00:00:00:00:00:00 (Non-Resolvable)
        Connection interval: 100.00 msec (0x0050)
        Connection latency: 0 (0x0000)
        Supervision timeout: 25120 msec (0x09d0)
        Central clock accuracy: 0x01
> HCI Event: LE Meta Event (0x3e) plen 6                    #48 [hci1] 4.750758
      LE Advertising Set Terminated (0x12)
        Status: Success (0x00)
        Handle: 0
        Connection handle: 3603
        Number of completed extended advertising events: 0
< HCI Command: LE Read Remote Used... (0x08|0x0016) plen 2  #49 [hci1] 4.760996
        Handle: 3603 Address: DF:A9:FF:F6:B1:1A (OUI DF-A9-FF)
< ACL Data TX: Handle 3603 flags 0x00 dlen 7                #50 [hci1] 4.761018
      ATT: Exchange MTU Request (0x02) len 2
        Client RX MTU: 251
> HCI Event: Command Status (0x0f) plen 4                   #51 [hci1] 4.761528
      LE Read Remote Used Features (0x08|0x0016) ncmd 1
        Status: Success (0x00)
> HCI Event: Number of Completed Packets (0x13) plen 5      #52 [hci1] 4.952738
        Num handles: 1
        Handle: 3603 Address: DF:A9:FF:F6:B1:1A (OUI DF-A9-FF)
        Count: 1
        #50: len 7 (0 Kb/s)
        Latency: 191 msec (191-191 msec ~191 msec)
> HCI Event: LE Meta Event (0x3e) plen 12                   #53 [hci1] 5.053046
      LE Read Remote Used Features (0x04)
        Status: Success (0x00)
        Handle: 3603 Address: DF:A9:FF:F6:B1:1A (OUI DF-A9-FF)
        Features: 0x2d 0x49 0x00 0xf7 0x67 0xd9 0x00 0x80
          LE Encryption
          Extended Reject Indication
          Peripheral-initiated Features Exchange
          LE Data Packet Length Extension
          LE 2M PHY
          LE Coded PHY
          Channel Selection Algorithm #2
          Periodic Advertising Sync Transfer - Sender
          Periodic Advertising Sync Transfer - Recipient
          Sleep Clock Accuracy Updates
          Connected Isochronous Stream - Central
          Connected Isochronous Stream - Peripheral
          Isochronous Broadcaster
          Synchronized Receiver
          Connected Isochronous Stream (Host Support)
          LE Power Control Request
          LE Power Control Request
          Connection Subrating
          Connection Subrating (Host Support)
          Unknown features (0x8000d90000000000)
> ACL Data RX: Handle 3603 flags 0x02 dlen 7                #54 [hci1] 5.552746
      ATT: Exchange MTU Request (0x02) len 2
        Client RX MTU: 64
> ACL Data RX: Handle 3603 flags 0x02 dlen 7                #55 [hci1] 5.553177
      ATT: Exchange MTU Response (0x03) len 2
        Server RX MTU: 64
< HCI Command: Host Number of Compl.. (0x03|0x0035) plen 5  #56 [hci1] 5.560747
        Num handles: 1
        Handle: 3603 Address: DF:A9:FF:F6:B1:1A (OUI DF-A9-FF)
        Count: 1
< ACL Data TX: Handle 3603 flags 0x00 dlen 7                #57 [hci1] 5.560893
      ATT: Exchange MTU Response (0x03) len 2
        Server RX MTU: 251
< HCI Command: Host Number of Compl.. (0x03|0x0035) plen 5  #58 [hci1] 5.561256
        Num handles: 1
        Handle: 3603 Address: DF:A9:FF:F6:B1:1A (OUI DF-A9-FF)
        Count: 1
> HCI Event: Number of Completed Packets (0x13) plen 5      #59 [hci1] 5.752663
        Num handles: 1
        Handle: 3603 Address: DF:A9:FF:F6:B1:1A (OUI DF-A9-FF)
        Count: 1
        #57: len 7 (0 Kb/s)
        Latency: 191 msec (191-191 msec ~191 msec)
> ACL Data RX: Handle 3603 flags 0x02 dlen 11               #60 [hci1] 7.752759
      SMP: Pairing Request (0x01) len 6
        IO capability: KeyboardDisplay (0x04)
        OOB data: Authentication data not present (0x00)
        Authentication requirement: Bonding, No MITM, SC, No Keypresses (0x09)
        Max encryption key size: 16
        Initiator key distribution: EncKey IdKey Sign (0x07)
        Responder key distribution: EncKey IdKey Sign (0x07)
< HCI Command: Host Number of Compl.. (0x03|0x0035) plen 5  #61 [hci1] 7.760896
        Num handles: 1
        Handle: 3603 Address: DF:A9:FF:F6:B1:1A (OUI DF-A9-FF)
        Count: 1
< ACL Data TX: Handle 3603 flags 0x00 dlen 11               #62 [hci1] 7.760962
      SMP: Pairing Response (0x02) len 6
        IO capability: NoInputNoOutput (0x03)
        OOB data: Authentication data not present (0x00)
        Authentication requirement: Bonding, No MITM, SC, No Keypresses (0x09)
        Max encryption key size: 16
        Initiator key distribution: IdKey (0x02)
        Responder key distribution: <none> (0x00)
> HCI Event: Number of Completed Packets (0x13) plen 5      #63 [hci1] 7.952786
        Num handles: 1
        Handle: 3603 Address: DF:A9:FF:F6:B1:1A (OUI DF-A9-FF)
        Count: 1
        #62: len 11 (0 Kb/s)
        Latency: 191 msec (191-191 msec ~191 msec)
> ACL Data RX: Handle 3603 flags 0x02 dlen 27               #64 [hci1] 7.953150
> ACL Data RX: Handle 3603 flags 0x01 dlen 27               #65 [hci1] 7.953446
> ACL Data RX: Handle 3603 flags 0x01 dlen 15               #66 [hci1] 7.953785
      SMP: Pairing Public Key (0x0c) len 64
        X: 199c32d9dcc8e8d54450b7c5769e7c9be999b9e24c01c35435f95c368071d5cc
        Y: 36f2da4d3ee59cf77a14a7955f605d6e9f588880b7909a6a83955d04c7db47ef
< HCI Command: Host Number of Compl.. (0x03|0x0035) plen 5  #67 [hci1] 7.961165
        Num handles: 1
        Handle: 3603 Address: DF:A9:FF:F6:B1:1A (OUI DF-A9-FF)
        Count: 1
< HCI Command: Host Number of Compl.. (0x03|0x0035) plen 5  #68 [hci1] 7.961303
        Num handles: 1
        Handle: 3603 Address: DF:A9:FF:F6:B1:1A (OUI DF-A9-FF)
        Count: 1
< HCI Command: Host Number of Compl.. (0x03|0x0035) plen 5  #69 [hci1] 7.961646
        Num handles: 1
        Handle: 3603 Address: DF:A9:FF:F6:B1:1A (OUI DF-A9-FF)
        Count: 1
< ACL Data TX: Handle 3603 flags 0x00 dlen 27               #70 [hci1] 7.961725
< ACL Data TX: Handle 3603 flags 0x01 dlen 27               #71 [hci1] 7.961753
< ACL Data TX: Handle 3603 flags 0x01 dlen 15               #72 [hci1] 7.961842
      SMP: Pairing Public Key (0x0c) len 64
        X: 98308440221e2d910f0e54b71e7ec652857aa9b5a0dc65028824cc19db1226e9
        Y: 67a4816bcb62efb21701e31fdb27561a6217575fb007a8bbdabe7e28b6f68482
> HCI Event: Number of Completed Packets (0x13) plen 5      #73 [hci1] 8.053128
        Num handles: 1
        Handle: 3603 Address: DF:A9:FF:F6:B1:1A (OUI DF-A9-FF)
        Count: 1
        #70: len 27 (2 Kb/s)
        Latency: 91 msec (91-191 msec ~141 msec)
> HCI Event: Number of Completed Packets (0x13) plen 5      #74 [hci1] 8.053624
        Num handles: 1
        Handle: 3603 Address: DF:A9:FF:F6:B1:1A (OUI DF-A9-FF)
        Count: 1
        #71: len 27 (2 Kb/s)
        Latency: 91 msec (91-191 msec ~116 msec)
< ACL Data TX: Handle 3603 flags 0x00 dlen 21               #75 [hci1] 8.060438
      SMP: Pairing Confirm (0x03) len 16
        Confim value: 957891ba3dadda68a414538c9fb9a2f1
> HCI Event: Number of Completed Packets (0x13) plen 5      #76 [hci1] 8.152599
        Num handles: 1
        Handle: 3603 Address: DF:A9:FF:F6:B1:1A (OUI DF-A9-FF)
        Count: 1
        #72: len 15 (0 Kb/s)
        Latency: 190 msec (91-191 msec ~153 msec)
> HCI Event: Number of Completed Packets (0x13) plen 5      #77 [hci1] 8.252755
        Num handles: 1
        Handle: 3603 Address: DF:A9:FF:F6:B1:1A (OUI DF-A9-FF)
        Count: 1
        #75: len 21 (0 Kb/s)
        Latency: 192 msec (91-192 msec ~173 msec)
> ACL Data RX: Handle 3603 flags 0x02 dlen 21               #78 [hci1] 8.253082
      SMP: Pairing Random (0x04) len 16
        Random value: 9211b46df43b41110000000000000000
< HCI Command: Host Number of Compl.. (0x03|0x0035) plen 5  #79 [hci1] 8.260963
        Num handles: 1
        Handle: 3603 Address: DF:A9:FF:F6:B1:1A (OUI DF-A9-FF)
        Count: 1
< ACL Data TX: Handle 3603 flags 0x00 dlen 21               #80 [hci1] 8.261055
      SMP: Pairing Random (0x04) len 16
        Random value: f966a694cbe26df70bb96773e6cc6f5d
> HCI Event: Number of Completed Packets (0x13) plen 5      #81 [hci1] 8.452683
        Num handles: 1
        Handle: 3603 Address: DF:A9:FF:F6:B1:1A (OUI DF-A9-FF)
        Count: 1
        #80: len 21 (0 Kb/s)
        Latency: 191 msec (91-192 msec ~182 msec)
> ACL Data RX: Handle 3603 flags 0x02 dlen 21               #82 [hci1] 8.652980
      SMP: Pairing DHKey Check (0x0d) len 16
        E: e5c90ea4b40e877db76f14fe52c44350
< HCI Command: Host Number of Compl.. (0x03|0x0035) plen 5  #83 [hci1] 8.660619
        Num handles: 1
        Handle: 3603 Address: DF:A9:FF:F6:B1:1A (OUI DF-A9-FF)
        Count: 1
< ACL Data TX: Handle 3603 flags 0x00 dlen 21               #84 [hci1] 8.660649
      SMP: Pairing DHKey Check (0x0d) len 16
        E: da248a5fc4242fbdf1332d299ad3348e
> HCI Event: Number of Completed Packets (0x13) plen 5      #85 [hci1] 8.852672
        Num handles: 1
        Handle: 3603 Address: DF:A9:FF:F6:B1:1A (OUI DF-A9-FF)
        Count: 1
        #84: len 21 (0 Kb/s)
        Latency: 192 msec (91-192 msec ~187 msec)
> HCI Event: LE Meta Event (0x3e) plen 13                   #86 [hci1] 8.953096
      LE Long Term Key Request (0x05)
        Handle: 3603 Address: DF:A9:FF:F6:B1:1A (OUI DF-A9-FF)
        Random number: 0x0000000000000000
        Encrypted diversifier: 0x0000
< HCI Command: LE Long Term Key Re.. (0x08|0x001a) plen 18  #87 [hci1] 8.960467
        Handle: 3603 Address: DF:A9:FF:F6:B1:1A (OUI DF-A9-FF)
        Long term key: 769f54d1bf00fe9aa889d83a69ad2625
> HCI Event: Command Complete (0x0e) plen 6                 #88 [hci1] 8.961113
      LE Long Term Key Request Reply (0x08|0x001a) ncmd 1
        Status: Success (0x00)
        Handle: 3603 Address: DF:A9:FF:F6:B1:1A (OUI DF-A9-FF)
> HCI Event: Encryption Change (0x08) plen 4                #89 [hci1] 9.452827
        Status: Success (0x00)
        Handle: 3603 Address: DF:A9:FF:F6:B1:1A (OUI DF-A9-FF)
        Encryption: Enabled with AES-CCM (0x01)
> ACL Data RX: Handle 3603 flags 0x02 dlen 21               #90 [hci1] 9.553073
      SMP: Identity Information (0x08) len 16
        Identity resolving key: ead0cc7d67e23a8b7c291044e28d6ce1
< ACL Data TX: Handle 3603 flags 0x00 dlen 11               #91 [hci1] 9.571028
      ATT: Read By Type Request (0x08) len 6
        Handle range: 0x0001-0xffff
        Attribute type: Central Address Resolution (0x2aa6)
< HCI Command: Host Number of Compl.. (0x03|0x0035) plen 5  #92 [hci1] 9.571617
        Num handles: 1
        Handle: 3603 Address: DF:A9:FF:F6:B1:1A (OUI DF-A9-FF)
        Count: 1
> HCI Event: Number of Completed Packets (0x13) plen 5      #93 [hci1] 9.752752
        Num handles: 1
        Handle: 3603 Address: DF:A9:FF:F6:B1:1A (OUI DF-A9-FF)
        Count: 1
        #91: len 11 (0 Kb/s)
        Latency: 181 msec (91-192 msec ~184 msec)
> ACL Data RX: Handle 3603 flags 0x02 dlen 12               #94 [hci1] 9.752959
      SMP: Identity Address Information (0x09) len 7
        Address: DF:A9:FF:F6:B1:1A (OUI DF-A9-FF)
< HCI Command: LE Add Device To Re.. (0x08|0x0027) plen 39  #95 [hci1] 9.761078
        Address type: Public (0x00)
        Address: DF:A9:FF:F6:B1:1A (OUI DF-A9-FF)
        Peer identity resolving key: ead0cc7d67e23a8b7c291044e28d6ce1
        Local identity resolving key: 00000000000000000000000000000000
> HCI Event: Command Complete (0x0e) plen 4                 #96 [hci1] 9.762081
      LE Add Device To Resolving List (0x08|0x0027) ncmd 1
        Status: Success (0x00)
< HCI Command: LE Set Privacy Mode (0x08|0x004e) plen 8     #97 [hci1] 9.780684
        Peer Identity address type: Public (0x00)
        Peer Identity address: DF:A9:FF:F6:B1:1A (OUI DF-A9-FF)
        Privacy Mode: Use Device Privacy (0x01)
> HCI Event: Command Complete (0x0e) plen 4                 #98 [hci1] 9.781232
      LE Set Privacy Mode (0x08|0x004e) ncmd 1
        Status: Success (0x00)
< HCI Command: LE Set Address Resol.. (0x08|0x002d) plen 1  #99 [hci1] 9.800703
        Address resolution: Enabled (0x01)
> HCI Event: Command Complete (0x0e) plen 4                #100 [hci1] 9.801137
      LE Set Address Resolution Enable (0x08|0x002d) ncmd 1
        Status: Success (0x00)
< HCI Command: Host Number of Comp.. (0x03|0x0035) plen 5  #101 [hci1] 9.820638
        Num handles: 1
        Handle: 3603 Address: DF:A9:FF:F6:B1:1A (OUI DF-A9-FF)
        Count: 1
> ACL Data RX: Handle 3603 flags 0x02 dlen 13              #102 [hci1] 9.852855
      ATT: Find By Type Value Request (0x06) len 8
        Handle range: 0x0001-0xffff
        Attribute type: Primary Service (0x2800)
          UUID: Published Audio Capabilities (0x1850)
< HCI Command: Host Number of Comp.. (0x03|0x0035) plen 5  #103 [hci1] 9.860639
        Num handles: 1
        Handle: 3603 Address: DF:A9:FF:F6:B1:1A (OUI DF-A9-FF)
        Count: 1
< ACL Data TX: Handle 3603 flags 0x00 dlen 9               #104 [hci1] 9.860719
      ATT: Find By Type Value Response (0x07) len 4
        Handle range: 0x00d6-0x00e8
> ACL Data RX: Handle 3603 flags 0x02 dlen 9               #105 [hci1] 9.952710
      ATT: Read By Type Response (0x09) len 4
        Attribute data length: 3
        Attribute data list: 1 entry
        Handle: 0x000f
        Value: 01
< HCI Command: Host Number of Comp.. (0x03|0x0035) plen 5  #106 [hci1] 9.960602
        Num handles: 1
        Handle: 3603 Address: DF:A9:FF:F6:B1:1A (OUI DF-A9-FF)
        Count: 1
> HCI Event: Number of Completed Packets (0x13) plen 5    #107 [hci1] 10.052748
        Num handles: 1
        Handle: 3603 Address: DF:A9:FF:F6:B1:1A (OUI DF-A9-FF)
        Count: 1
        #104: len 9 (0 Kb/s)
        Latency: 192 msec (91-192 msec ~188 msec)
> ACL Data RX: Handle 3603 flags 0x02 dlen 13             #108 [hci1] 10.052977
      ATT: Find By Type Value Request (0x06) len 8
        Handle range: 0x00e9-0xffff
        Attribute type: Primary Service (0x2800)
          UUID: Published Audio Capabilities (0x1850)
< HCI Command: Host Number of Com.. (0x03|0x0035) plen 5  #109 [hci1] 10.061126
        Num handles: 1
        Handle: 3603 Address: DF:A9:FF:F6:B1:1A (OUI DF-A9-FF)
        Count: 1
< ACL Data TX: Handle 3603 flags 0x00 dlen 9              #110 [hci1] 10.061389
      ATT: Error Response (0x01) len 4
        Find By Type Value Request (0x06)
        Handle: 0x00e9
        Error: Attribute Not Found (0x0a)
> HCI Event: Number of Completed Packets (0x13) plen 5    #111 [hci1] 10.252747
        Num handles: 1
        Handle: 3603 Address: DF:A9:FF:F6:B1:1A (OUI DF-A9-FF)
        Count: 1
        #110: len 9 (0 Kb/s)
        Latency: 191 msec (91-192 msec ~189 msec)
> ACL Data RX: Handle 3603 flags 0x02 dlen 11             #112 [hci1] 10.252850
      ATT: Read By Type Request (0x08) len 6
        Handle range: 0x00d6-0x00e8
        Attribute type: Characteristic (0x2803)
< HCI Command: Host Number of Com.. (0x03|0x0035) plen 5  #113 [hci1] 10.260695
        Num handles: 1
        Handle: 3603 Address: DF:A9:FF:F6:B1:1A (OUI DF-A9-FF)
        Count: 1
< ACL Data TX: Handle 3603 flags 0x00 dlen 27             #114 [hci1] 10.260725
< ACL Data TX: Handle 3603 flags 0x01 dlen 21             #115 [hci1] 10.260736
      ATT: Read By Type Response (0x09) len 43
        Attribute data length: 7
        Attribute data list: 6 entries
        Handle: 0x00d7
        Value: 12d800c92b
            Properties: 0x12
              Read (0x02)
              Notify (0x10)
            Value Handle: 0x00d8
            Value UUID: Sink PAC (0x2bc9)
        Handle: 0x00da
        Value: 1adb00ca2b
            Properties: 0x1a
              Read (0x02)
              Write (0x08)
              Notify (0x10)
            Value Handle: 0x00db
            Value UUID: Sink Audio Locations (0x2bca)
        Handle: 0x00dd
        Value: 12de00cb2b
            Properties: 0x12
              Read (0x02)
              Notify (0x10)
            Value Handle: 0x00de
            Value UUID: Source PAC (0x2bcb)
        Handle: 0x00e0
        Value: 1ae100cc2b
            Properties: 0x1a
              Read (0x02)
              Write (0x08)
              Notify (0x10)
            Value Handle: 0x00e1
            Value UUID: Source Audio Locations (0x2bcc)
        Handle: 0x00e3
        Value: 12e400cd2b
            Properties: 0x12
              Read (0x02)
              Notify (0x10)
            Value Handle: 0x00e4
            Value UUID: Available Audio Contexts (0x2bcd)
        Handle: 0x00e6
        Value: 12e700ce2b
            Properties: 0x12
              Read (0x02)
              Notify (0x10)
            Value Handle: 0x00e7
            Value UUID: Supported Audio Contexts (0x2bce)
> HCI Event: Number of Completed Packets (0x13) plen 5    #116 [hci1] 10.353125
        Num handles: 1
        Handle: 3603 Address: DF:A9:FF:F6:B1:1A (OUI DF-A9-FF)
        Count: 1
        #114: len 27 (2 Kb/s)
        Latency: 92 msec (91-192 msec ~141 msec)
> HCI Event: Number of Completed Packets (0x13) plen 5    #117 [hci1] 10.452737
        Num handles: 1
        Handle: 3603 Address: DF:A9:FF:F6:B1:1A (OUI DF-A9-FF)
        Count: 1
        #115: len 21 (0 Kb/s)
        Latency: 192 msec (91-192 msec ~166 msec)
> ACL Data RX: Handle 3603 flags 0x02 dlen 11             #118 [hci1] 10.452877
      ATT: Read By Type Request (0x08) len 6
        Handle range: 0x00e7-0x00e8
        Attribute type: Characteristic (0x2803)
< HCI Command: Host Number of Com.. (0x03|0x0035) plen 5  #119 [hci1] 10.460629
        Num handles: 1
        Handle: 3603 Address: DF:A9:FF:F6:B1:1A (OUI DF-A9-FF)
        Count: 1
< ACL Data TX: Handle 3603 flags 0x00 dlen 9              #120 [hci1] 10.460751
      ATT: Error Response (0x01) len 4
        Read By Type Request (0x08)
        Handle: 0x00e7
        Error: Attribute Not Found (0x0a)
> HCI Event: Number of Completed Packets (0x13) plen 5    #121 [hci1] 10.652635
        Num handles: 1
        Handle: 3603 Address: DF:A9:FF:F6:B1:1A (OUI DF-A9-FF)
        Count: 1
        #120: len 9 (0 Kb/s)
        Latency: 191 msec (91-192 msec ~179 msec)
> ACL Data RX: Handle 3603 flags 0x02 dlen 9              #122 [hci1] 10.652808
      ATT: Find Information Request (0x04) len 4
        Handle range: 0x00d9-0x00d9
< HCI Command: Host Number of Com.. (0x03|0x0035) plen 5  #123 [hci1] 10.660418
        Num handles: 1
        Handle: 3603 Address: DF:A9:FF:F6:B1:1A (OUI DF-A9-FF)
        Count: 1
< ACL Data TX: Handle 3603 flags 0x00 dlen 10             #124 [hci1] 10.660483
      ATT: Find Information Response (0x05) len 5
        Format: UUID-16 (0x01)
        Handle: 0x00d9
        UUID: Client Characteristic Configuration (0x2902)
> HCI Event: Number of Completed Packets (0x13) plen 5    #125 [hci1] 10.852676
        Num handles: 1
        Handle: 3603 Address: DF:A9:FF:F6:B1:1A (OUI DF-A9-FF)
        Count: 1
        #124: len 10 (0 Kb/s)
        Latency: 192 msec (91-192 msec ~185 msec)
> ACL Data RX: Handle 3603 flags 0x02 dlen 9              #126 [hci1] 10.852871
      ATT: Find Information Request (0x04) len 4
        Handle range: 0x00dc-0x00dc
< HCI Command: Host Number of Com.. (0x03|0x0035) plen 5  #127 [hci1] 10.860825
        Num handles: 1
        Handle: 3603 Address: DF:A9:FF:F6:B1:1A (OUI DF-A9-FF)
        Count: 1
< ACL Data TX: Handle 3603 flags 0x00 dlen 10             #128 [hci1] 10.860877
      ATT: Find Information Response (0x05) len 5
        Format: UUID-16 (0x01)
        Handle: 0x00dc
        UUID: Client Characteristic Configuration (0x2902)
> HCI Event: Number of Completed Packets (0x13) plen 5    #129 [hci1] 11.052668
        Num handles: 1
        Handle: 3603 Address: DF:A9:FF:F6:B1:1A (OUI DF-A9-FF)
        Count: 1
        #128: len 10 (0 Kb/s)
        Latency: 191 msec (91-192 msec ~188 msec)
> ACL Data RX: Handle 3603 flags 0x02 dlen 9              #130 [hci1] 11.052855
      ATT: Find Information Request (0x04) len 4
        Handle range: 0x00df-0x00df
< HCI Command: Host Number of Com.. (0x03|0x0035) plen 5  #131 [hci1] 11.060706
        Num handles: 1
        Handle: 3603 Address: DF:A9:FF:F6:B1:1A (OUI DF-A9-FF)
        Count: 1
< ACL Data TX: Handle 3603 flags 0x00 dlen 10             #132 [hci1] 11.060774
      ATT: Find Information Response (0x05) len 5
        Format: UUID-16 (0x01)
        Handle: 0x00df
        UUID: Client Characteristic Configuration (0x2902)
> HCI Event: Number of Completed Packets (0x13) plen 5    #133 [hci1] 11.252627
        Num handles: 1
        Handle: 3603 Address: DF:A9:FF:F6:B1:1A (OUI DF-A9-FF)
        Count: 1
        #132: len 10 (0 Kb/s)
        Latency: 191 msec (91-192 msec ~190 msec)
> ACL Data RX: Handle 3603 flags 0x02 dlen 9              #134 [hci1] 11.252854
      ATT: Find Information Request (0x04) len 4
        Handle range: 0x00e2-0x00e2
< HCI Command: Host Number of Com.. (0x03|0x0035) plen 5  #135 [hci1] 11.260569
        Num handles: 1
        Handle: 3603 Address: DF:A9:FF:F6:B1:1A (OUI DF-A9-FF)
        Count: 1
< ACL Data TX: Handle 3603 flags 0x00 dlen 10             #136 [hci1] 11.260624
      ATT: Find Information Response (0x05) len 5
        Format: UUID-16 (0x01)
        Handle: 0x00e2
        UUID: Client Characteristic Configuration (0x2902)
> HCI Event: Number of Completed Packets (0x13) plen 5    #137 [hci1] 11.452623
        Num handles: 1
        Handle: 3603 Address: DF:A9:FF:F6:B1:1A (OUI DF-A9-FF)
        Count: 1
        #136: len 10 (0 Kb/s)
        Latency: 191 msec (91-192 msec ~191 msec)
> ACL Data RX: Handle 3603 flags 0x02 dlen 9              #138 [hci1] 11.452855
      ATT: Find Information Request (0x04) len 4
        Handle range: 0x00e5-0x00e5
< HCI Command: Host Number of Com.. (0x03|0x0035) plen 5  #139 [hci1] 11.460645
        Num handles: 1
        Handle: 3603 Address: DF:A9:FF:F6:B1:1A (OUI DF-A9-FF)
        Count: 1
< ACL Data TX: Handle 3603 flags 0x00 dlen 10             #140 [hci1] 11.460692
      ATT: Find Information Response (0x05) len 5
        Format: UUID-16 (0x01)
        Handle: 0x00e5
        UUID: Client Characteristic Configuration (0x2902)
> HCI Event: Number of Completed Packets (0x13) plen 5    #141 [hci1] 11.652664
        Num handles: 1
        Handle: 3603 Address: DF:A9:FF:F6:B1:1A (OUI DF-A9-FF)
        Count: 1
        #140: len 10 (0 Kb/s)
        Latency: 191 msec (91-192 msec ~191 msec)
> ACL Data RX: Handle 3603 flags 0x02 dlen 9              #142 [hci1] 11.652881
      ATT: Find Information Request (0x04) len 4
        Handle range: 0x00e8-0x00e8
< HCI Command: Host Number of Com.. (0x03|0x0035) plen 5  #143 [hci1] 11.660674
        Num handles: 1
        Handle: 3603 Address: DF:A9:FF:F6:B1:1A (OUI DF-A9-FF)
        Count: 1
< ACL Data TX: Handle 3603 flags 0x00 dlen 10             #144 [hci1] 11.660710
      ATT: Find Information Response (0x05) len 5
        Format: UUID-16 (0x01)
        Handle: 0x00e8
        UUID: Client Characteristic Configuration (0x2902)
> HCI Event: Number of Completed Packets (0x13) plen 5    #145 [hci1] 11.852725
        Num handles: 1
        Handle: 3603 Address: DF:A9:FF:F6:B1:1A (OUI DF-A9-FF)
        Count: 1
        #144: len 10 (0 Kb/s)
        Latency: 192 msec (91-192 msec ~191 msec)
> ACL Data RX: Handle 3603 flags 0x02 dlen 13             #146 [hci1] 11.852932
      ATT: Find By Type Value Request (0x06) len 8
        Handle range: 0x0001-0xffff
        Attribute type: Primary Service (0x2800)
          UUID: Audio Stream Control (0x184e)
< HCI Command: Host Number of Com.. (0x03|0x0035) plen 5  #147 [hci1] 11.860894
        Num handles: 1
        Handle: 3603 Address: DF:A9:FF:F6:B1:1A (OUI DF-A9-FF)
        Count: 1
< ACL Data TX: Handle 3603 flags 0x00 dlen 9              #148 [hci1] 11.860974
      ATT: Find By Type Value Response (0x07) len 4
        Handle range: 0x00e9-0x00f8
> HCI Event: Number of Completed Packets (0x13) plen 5    #149 [hci1] 12.052654
        Num handles: 1
        Handle: 3603 Address: DF:A9:FF:F6:B1:1A (OUI DF-A9-FF)
        Count: 1
        #148: len 9 (0 Kb/s)
        Latency: 191 msec (91-192 msec ~191 msec)
> ACL Data RX: Handle 3603 flags 0x02 dlen 13             #150 [hci1] 12.052863
      ATT: Find By Type Value Request (0x06) len 8
        Handle range: 0x00f9-0xffff
        Attribute type: Primary Service (0x2800)
          UUID: Audio Stream Control (0x184e)
< HCI Command: Host Number of Com.. (0x03|0x0035) plen 5  #151 [hci1] 12.060668
        Num handles: 1
        Handle: 3603 Address: DF:A9:FF:F6:B1:1A (OUI DF-A9-FF)
        Count: 1
< ACL Data TX: Handle 3603 flags 0x00 dlen 9              #152 [hci1] 12.060764
      ATT: Error Response (0x01) len 4
        Find By Type Value Request (0x06)
        Handle: 0x00f9
        Error: Attribute Not Found (0x0a)
> HCI Event: Number of Completed Packets (0x13) plen 5    #153 [hci1] 12.252641
        Num handles: 1
        Handle: 3603 Address: DF:A9:FF:F6:B1:1A (OUI DF-A9-FF)
        Count: 1
        #152: len 9 (0 Kb/s)
        Latency: 191 msec (91-192 msec ~191 msec)
> ACL Data RX: Handle 3603 flags 0x02 dlen 11             #154 [hci1] 12.252875
      ATT: Read By Type Request (0x08) len 6
        Handle range: 0x00e9-0x00f8
        Attribute type: Characteristic (0x2803)
< HCI Command: Host Number of Com.. (0x03|0x0035) plen 5  #155 [hci1] 12.260649
        Num handles: 1
        Handle: 3603 Address: DF:A9:FF:F6:B1:1A (OUI DF-A9-FF)
        Count: 1
< ACL Data TX: Handle 3603 flags 0x00 dlen 27             #156 [hci1] 12.260688
< ACL Data TX: Handle 3603 flags 0x01 dlen 14             #157 [hci1] 12.260726
      ATT: Read By Type Response (0x09) len 36
        Attribute data length: 7
        Attribute data list: 5 entries
        Handle: 0x00ea
        Value: 1ceb00c62b
            Properties: 0x1c
              Write Without Response (0x04)
              Write (0x08)
              Notify (0x10)
            Value Handle: 0x00eb
            Value UUID: ASE Control Point (0x2bc6)
        Handle: 0x00ed
        Value: 12ee00c42b
            Properties: 0x12
              Read (0x02)
              Notify (0x10)
            Value Handle: 0x00ee
            Value UUID: Sink ASE (0x2bc4)
        Handle: 0x00f0
        Value: 12f100c42b
            Properties: 0x12
              Read (0x02)
              Notify (0x10)
            Value Handle: 0x00f1
            Value UUID: Sink ASE (0x2bc4)
        Handle: 0x00f3
        Value: 12f400c52b
            Properties: 0x12
              Read (0x02)
              Notify (0x10)
            Value Handle: 0x00f4
            Value UUID: Source ASE (0x2bc5)
        Handle: 0x00f6
        Value: 12f700c52b
            Properties: 0x12
              Read (0x02)
              Notify (0x10)
            Value Handle: 0x00f7
            Value UUID: Source ASE (0x2bc5)
> HCI Event: Number of Completed Packets (0x13) plen 5    #158 [hci1] 12.353068
        Num handles: 1
        Handle: 3603 Address: DF:A9:FF:F6:B1:1A (OUI DF-A9-FF)
        Count: 1
        #156: len 27 (2 Kb/s)
        Latency: 92 msec (91-192 msec ~142 msec)
> HCI Event: Number of Completed Packets (0x13) plen 5    #159 [hci1] 12.452727
        Num handles: 1
        Handle: 3603 Address: DF:A9:FF:F6:B1:1A (OUI DF-A9-FF)
        Count: 1
        #157: len 14 (0 Kb/s)
        Latency: 192 msec (91-192 msec ~167 msec)
> ACL Data RX: Handle 3603 flags 0x02 dlen 11             #160 [hci1] 12.452815
      ATT: Read By Type Request (0x08) len 6
        Handle range: 0x00f7-0x00f8
        Attribute type: Characteristic (0x2803)
< HCI Command: Host Number of Com.. (0x03|0x0035) plen 5  #161 [hci1] 12.460797
        Num handles: 1
        Handle: 3603 Address: DF:A9:FF:F6:B1:1A (OUI DF-A9-FF)
        Count: 1
< ACL Data TX: Handle 3603 flags 0x00 dlen 9              #162 [hci1] 12.460900
      ATT: Error Response (0x01) len 4
        Read By Type Request (0x08)
        Handle: 0x00f7
        Error: Attribute Not Found (0x0a)
> HCI Event: Number of Completed Packets (0x13) plen 5    #163 [hci1] 12.652794
        Num handles: 1
        Handle: 3603 Address: DF:A9:FF:F6:B1:1A (OUI DF-A9-FF)
        Count: 1
        #162: len 9 (0 Kb/s)
        Latency: 191 msec (91-192 msec ~179 msec)
> ACL Data RX: Handle 3603 flags 0x02 dlen 9              #164 [hci1] 12.652868
      ATT: Find Information Request (0x04) len 4
        Handle range: 0x00ec-0x00ec
< HCI Command: Host Number of Com.. (0x03|0x0035) plen 5  #165 [hci1] 12.660492
        Num handles: 1
        Handle: 3603 Address: DF:A9:FF:F6:B1:1A (OUI DF-A9-FF)
        Count: 1
< ACL Data TX: Handle 3603 flags 0x00 dlen 10             #166 [hci1] 12.660542
      ATT: Find Information Response (0x05) len 5
        Format: UUID-16 (0x01)
        Handle: 0x00ec
        UUID: Client Characteristic Configuration (0x2902)
> HCI Event: Number of Completed Packets (0x13) plen 5    #167 [hci1] 12.852691
        Num handles: 1
        Handle: 3603 Address: DF:A9:FF:F6:B1:1A (OUI DF-A9-FF)
        Count: 1
        #166: len 10 (0 Kb/s)
        Latency: 192 msec (91-192 msec ~185 msec)
> ACL Data RX: Handle 3603 flags 0x02 dlen 9              #168 [hci1] 12.852832
      ATT: Find Information Request (0x04) len 4
        Handle range: 0x00ef-0x00ef
< HCI Command: Host Number of Com.. (0x03|0x0035) plen 5  #169 [hci1] 12.860899
        Num handles: 1
        Handle: 3603 Address: DF:A9:FF:F6:B1:1A (OUI DF-A9-FF)
        Count: 1
< ACL Data TX: Handle 3603 flags 0x00 dlen 10             #170 [hci1] 12.860955
      ATT: Find Information Response (0x05) len 5
        Format: UUID-16 (0x01)
        Handle: 0x00ef
        UUID: Client Characteristic Configuration (0x2902)
> HCI Event: Number of Completed Packets (0x13) plen 5    #171 [hci1] 13.052674
        Num handles: 1
        Handle: 3603 Address: DF:A9:FF:F6:B1:1A (OUI DF-A9-FF)
        Count: 1
        #170: len 10 (0 Kb/s)
        Latency: 191 msec (91-192 msec ~188 msec)
> ACL Data RX: Handle 3603 flags 0x02 dlen 9              #172 [hci1] 13.052857
      ATT: Find Information Request (0x04) len 4
        Handle range: 0x00f2-0x00f2
< HCI Command: Host Number of Com.. (0x03|0x0035) plen 5  #173 [hci1] 13.060755
        Num handles: 1
        Handle: 3603 Address: DF:A9:FF:F6:B1:1A (OUI DF-A9-FF)
        Count: 1
< ACL Data TX: Handle 3603 flags 0x00 dlen 10             #174 [hci1] 13.060779
      ATT: Find Information Response (0x05) len 5
        Format: UUID-16 (0x01)
        Handle: 0x00f2
        UUID: Client Characteristic Configuration (0x2902)
> HCI Event: Number of Completed Packets (0x13) plen 5    #175 [hci1] 13.252671
        Num handles: 1
        Handle: 3603 Address: DF:A9:FF:F6:B1:1A (OUI DF-A9-FF)
        Count: 1
        #174: len 10 (0 Kb/s)
        Latency: 191 msec (91-192 msec ~190 msec)
> ACL Data RX: Handle 3603 flags 0x02 dlen 9              #176 [hci1] 13.252830
      ATT: Find Information Request (0x04) len 4
        Handle range: 0x00f5-0x00f5
< HCI Command: Host Number of Com.. (0x03|0x0035) plen 5  #177 [hci1] 13.260721
        Num handles: 1
        Handle: 3603 Address: DF:A9:FF:F6:B1:1A (OUI DF-A9-FF)
        Count: 1
< ACL Data TX: Handle 3603 flags 0x00 dlen 10             #178 [hci1] 13.260746
      ATT: Find Information Response (0x05) len 5
        Format: UUID-16 (0x01)
        Handle: 0x00f5
        UUID: Client Characteristic Configuration (0x2902)
> HCI Event: Number of Completed Packets (0x13) plen 5    #179 [hci1] 13.452677
        Num handles: 1
        Handle: 3603 Address: DF:A9:FF:F6:B1:1A (OUI DF-A9-FF)
        Count: 1
        #178: len 10 (0 Kb/s)
        Latency: 191 msec (91-192 msec ~191 msec)
> ACL Data RX: Handle 3603 flags 0x02 dlen 9              #180 [hci1] 13.452888
      ATT: Find Information Request (0x04) len 4
        Handle range: 0x00f8-0x00f8
< HCI Command: Host Number of Com.. (0x03|0x0035) plen 5  #181 [hci1] 13.460767
        Num handles: 1
        Handle: 3603 Address: DF:A9:FF:F6:B1:1A (OUI DF-A9-FF)
        Count: 1
< ACL Data TX: Handle 3603 flags 0x00 dlen 10             #182 [hci1] 13.460800
      ATT: Find Information Response (0x05) len 5
        Format: UUID-16 (0x01)
        Handle: 0x00f8
        UUID: Client Characteristic Configuration (0x2902)
> HCI Event: Number of Completed Packets (0x13) plen 5    #183 [hci1] 13.652716
        Num handles: 1
        Handle: 3603 Address: DF:A9:FF:F6:B1:1A (OUI DF-A9-FF)
        Count: 1
        #182: len 10 (0 Kb/s)
        Latency: 191 msec (91-192 msec ~191 msec)
> ACL Data RX: Handle 3603 flags 0x02 dlen 13             #184 [hci1] 13.652863
      ATT: Find By Type Value Request (0x06) len 8
        Handle range: 0x0001-0xffff
        Attribute type: Primary Service (0x2800)
          UUID: Common Audio (0x1853)
< HCI Command: Host Number of Com.. (0x03|0x0035) plen 5  #185 [hci1] 13.660757
        Num handles: 1
        Handle: 3603 Address: DF:A9:FF:F6:B1:1A (OUI DF-A9-FF)
        Count: 1
< ACL Data TX: Handle 3603 flags 0x00 dlen 9              #186 [hci1] 13.660803
      ATT: Find By Type Value Response (0x07) len 4
        Handle range: 0x0105-0x0106
> HCI Event: Number of Completed Packets (0x13) plen 5    #187 [hci1] 13.852721
        Num handles: 1
        Handle: 3603 Address: DF:A9:FF:F6:B1:1A (OUI DF-A9-FF)
        Count: 1
        #186: len 9 (0 Kb/s)
        Latency: 191 msec (91-192 msec ~191 msec)
> ACL Data RX: Handle 3603 flags 0x02 dlen 13             #188 [hci1] 13.852905
      ATT: Find By Type Value Request (0x06) len 8
        Handle range: 0x0107-0xffff
        Attribute type: Primary Service (0x2800)
          UUID: Common Audio (0x1853)
< HCI Command: Host Number of Com.. (0x03|0x0035) plen 5  #189 [hci1] 13.861275
        Num handles: 1
        Handle: 3603 Address: DF:A9:FF:F6:B1:1A (OUI DF-A9-FF)
        Count: 1
< ACL Data TX: Handle 3603 flags 0x00 dlen 9              #190 [hci1] 13.861470
      ATT: Error Response (0x01) len 4
        Find By Type Value Request (0x06)
        Handle: 0x0107
        Error: Attribute Not Found (0x0a)
> HCI Event: Number of Completed Packets (0x13) plen 5    #191 [hci1] 14.052813
        Num handles: 1
        Handle: 3603 Address: DF:A9:FF:F6:B1:1A (OUI DF-A9-FF)
        Count: 1
        #190: len 9 (0 Kb/s)
        Latency: 191 msec (91-192 msec ~191 msec)
> ACL Data RX: Handle 3603 flags 0x02 dlen 11             #192 [hci1] 14.052820
      ATT: Read By Type Request (0x08) len 6
        Handle range: 0x0105-0x0106
        Attribute type: Include (0x2802)
< HCI Command: Host Number of Com.. (0x03|0x0035) plen 5  #193 [hci1] 14.060998
        Num handles: 1
        Handle: 3603 Address: DF:A9:FF:F6:B1:1A (OUI DF-A9-FF)
        Count: 1
< ACL Data TX: Handle 3603 flags 0x00 dlen 14             #194 [hci1] 14.061067
      ATT: Read By Type Response (0x09) len 9
        Attribute data length: 8
        Attribute data list: 1 entry
        Handle: 0x0106
        Value: f90004014618
> HCI Event: Number of Completed Packets (0x13) plen 5    #195 [hci1] 14.252679
        Num handles: 1
        Handle: 3603 Address: DF:A9:FF:F6:B1:1A (OUI DF-A9-FF)
        Count: 1
        #194: len 14 (0 Kb/s)
        Latency: 191 msec (91-192 msec ~191 msec)
> ACL Data RX: Handle 3603 flags 0x02 dlen 11             #196 [hci1] 14.252781
      ATT: Read By Type Request (0x08) len 6
        Handle range: 0x00f9-0x0104
        Attribute type: Characteristic (0x2803)
< HCI Command: Host Number of Com.. (0x03|0x0035) plen 5  #197 [hci1] 14.260746
        Num handles: 1
        Handle: 3603 Address: DF:A9:FF:F6:B1:1A (OUI DF-A9-FF)
        Count: 1
< ACL Data TX: Handle 3603 flags 0x00 dlen 27             #198 [hci1] 14.260814
< ACL Data TX: Handle 3603 flags 0x01 dlen 7              #199 [hci1] 14.260818
      ATT: Read By Type Response (0x09) len 29
        Attribute data length: 7
        Attribute data list: 4 entries
        Handle: 0x00fa
        Value: 12fb00842b
            Properties: 0x12
              Read (0x02)
              Notify (0x10)
            Value Handle: 0x00fb
            Value UUID: Set Identity Resolving Key (0x2b84)
        Handle: 0x00fd
        Value: 12fe00852b
            Properties: 0x12
              Read (0x02)
              Notify (0x10)
            Value Handle: 0x00fe
            Value UUID: Coordinated Set Size (0x2b85)
        Handle: 0x0100
        Value: 1a0101862b
            Properties: 0x1a
              Read (0x02)
              Write (0x08)
              Notify (0x10)
            Value Handle: 0x0101
            Value UUID: Set Member Lock (0x2b86)
        Handle: 0x0103
        Value: 020401872b
            Properties: 0x02
              Read (0x02)
            Value Handle: 0x0104
            Value UUID: Set Member Rank (0x2b87)
> HCI Event: Number of Completed Packets (0x13) plen 5    #200 [hci1] 14.353038
        Num handles: 1
        Handle: 3603 Address: DF:A9:FF:F6:B1:1A (OUI DF-A9-FF)
        Count: 1
        #198: len 27 (2 Kb/s)
        Latency: 92 msec (91-192 msec ~141 msec)
> HCI Event: Number of Completed Packets (0x13) plen 5    #201 [hci1] 14.452683
        Num handles: 1
        Handle: 3603 Address: DF:A9:FF:F6:B1:1A (OUI DF-A9-FF)
        Count: 1
        #199: len 7 (0 Kb/s)
        Latency: 191 msec (91-192 msec ~166 msec)
> ACL Data RX: Handle 3603 flags 0x02 dlen 11             #202 [hci1] 14.452813
      ATT: Read By Type Request (0x08) len 6
        Handle range: 0x0104-0x0104
        Attribute type: Characteristic (0x2803)
< HCI Command: Host Number of Com.. (0x03|0x0035) plen 5  #203 [hci1] 14.460801
        Num handles: 1
        Handle: 3603 Address: DF:A9:FF:F6:B1:1A (OUI DF-A9-FF)
        Count: 1
< ACL Data TX: Handle 3603 flags 0x00 dlen 9              #204 [hci1] 14.460916
      ATT: Error Response (0x01) len 4
        Read By Type Request (0x08)
        Handle: 0x0104
        Error: Attribute Not Found (0x0a)
> HCI Event: Number of Completed Packets (0x13) plen 5    #205 [hci1] 14.652632
        Num handles: 1
        Handle: 3603 Address: DF:A9:FF:F6:B1:1A (OUI DF-A9-FF)
        Count: 1
        #204: len 9 (0 Kb/s)
        Latency: 191 msec (91-192 msec ~179 msec)
> ACL Data RX: Handle 3603 flags 0x02 dlen 9              #206 [hci1] 14.652831
      ATT: Find Information Request (0x04) len 4
        Handle range: 0x00fc-0x00fc
< HCI Command: Host Number of Com.. (0x03|0x0035) plen 5  #207 [hci1] 14.660732
        Num handles: 1
        Handle: 3603 Address: DF:A9:FF:F6:B1:1A (OUI DF-A9-FF)
        Count: 1
< ACL Data TX: Handle 3603 flags 0x00 dlen 10             #208 [hci1] 14.660756
      ATT: Find Information Response (0x05) len 5
        Format: UUID-16 (0x01)
        Handle: 0x00fc
        UUID: Client Characteristic Configuration (0x2902)
> HCI Event: Number of Completed Packets (0x13) plen 5    #209 [hci1] 14.852693
        Num handles: 1
        Handle: 3603 Address: DF:A9:FF:F6:B1:1A (OUI DF-A9-FF)
        Count: 1
        #208: len 10 (0 Kb/s)
        Latency: 191 msec (91-192 msec ~185 msec)
> ACL Data RX: Handle 3603 flags 0x02 dlen 9              #210 [hci1] 14.852812
      ATT: Find Information Request (0x04) len 4
        Handle range: 0x00ff-0x00ff
< HCI Command: Host Number of Com.. (0x03|0x0035) plen 5  #211 [hci1] 14.860775
        Num handles: 1
        Handle: 3603 Address: DF:A9:FF:F6:B1:1A (OUI DF-A9-FF)
        Count: 1
< ACL Data TX: Handle 3603 flags 0x00 dlen 10             #212 [hci1] 14.860822
      ATT: Find Information Response (0x05) len 5
        Format: UUID-16 (0x01)
        Handle: 0x00ff
        UUID: Client Characteristic Configuration (0x2902)
> HCI Event: Number of Completed Packets (0x13) plen 5    #213 [hci1] 15.052667
        Num handles: 1
        Handle: 3603 Address: DF:A9:FF:F6:B1:1A (OUI DF-A9-FF)
        Count: 1
        #212: len 10 (0 Kb/s)
        Latency: 191 msec (91-192 msec ~188 msec)
> ACL Data RX: Handle 3603 flags 0x02 dlen 9              #214 [hci1] 15.052786
      ATT: Find Information Request (0x04) len 4
        Handle range: 0x0102-0x0102
< HCI Command: Host Number of Com.. (0x03|0x0035) plen 5  #215 [hci1] 15.060776
        Num handles: 1
        Handle: 3603 Address: DF:A9:FF:F6:B1:1A (OUI DF-A9-FF)
        Count: 1
< ACL Data TX: Handle 3603 flags 0x00 dlen 10             #216 [hci1] 15.060815
      ATT: Find Information Response (0x05) len 5
        Format: UUID-16 (0x01)
        Handle: 0x0102
        UUID: Client Characteristic Configuration (0x2902)
> HCI Event: Number of Completed Packets (0x13) plen 5    #217 [hci1] 15.252788
        Num handles: 1
        Handle: 3603 Address: DF:A9:FF:F6:B1:1A (OUI DF-A9-FF)
        Count: 1
        #216: len 10 (0 Kb/s)
        Latency: 191 msec (91-192 msec ~190 msec)
> ACL Data RX: Handle 3603 flags 0x02 dlen 9              #218 [hci1] 15.252791
      ATT: Write Request (0x12) len 4
        Handle: 0x00e5
          Data: 0000
< HCI Command: Host Number of Com.. (0x03|0x0035) plen 5  #219 [hci1] 15.260749
        Num handles: 1
        Handle: 3603 Address: DF:A9:FF:F6:B1:1A (OUI DF-A9-FF)
        Count: 1
< ACL Data TX: Handle 3603 flags 0x00 dlen 5              #220 [hci1] 15.260775
      ATT: Write Response (0x13) len 0
> HCI Event: Number of Completed Packets (0x13) plen 5    #221 [hci1] 15.452822
        Num handles: 1
        Handle: 3603 Address: DF:A9:FF:F6:B1:1A (OUI DF-A9-FF)
        Count: 1
        #220: len 5 (0 Kb/s)
        Latency: 192 msec (91-192 msec ~191 msec)
> ACL Data RX: Handle 3603 flags 0x02 dlen 9              #222 [hci1] 15.452825
      ATT: Write Request (0x12) len 4
        Handle: 0x00e5
          Data: 0100
< HCI Command: Host Number of Com.. (0x03|0x0035) plen 5  #223 [hci1] 15.460720
        Num handles: 1
        Handle: 3603 Address: DF:A9:FF:F6:B1:1A (OUI DF-A9-FF)
        Count: 1
< ACL Data TX: Handle 3603 flags 0x00 dlen 5              #224 [hci1] 15.460750
      ATT: Write Response (0x13) len 0
> HCI Event: Number of Completed Packets (0x13) plen 5    #225 [hci1] 15.652625
        Num handles: 1
        Handle: 3603 Address: DF:A9:FF:F6:B1:1A (OUI DF-A9-FF)
        Count: 1
        #224: len 5 (0 Kb/s)
        Latency: 191 msec (91-192 msec ~191 msec)
> ACL Data RX: Handle 3603 flags 0x02 dlen 9              #226 [hci1] 15.652725
      ATT: Write Request (0x12) len 4
        Handle: 0x00ec
          Data: 0000
< HCI Command: Host Number of Com.. (0x03|0x0035) plen 5  #227 [hci1] 15.661070
        Num handles: 1
        Handle: 3603 Address: DF:A9:FF:F6:B1:1A (OUI DF-A9-FF)
        Count: 1
< ACL Data TX: Handle 3603 flags 0x00 dlen 5              #228 [hci1] 15.661170
      ATT: Write Response (0x13) len 0
> HCI Event: Number of Completed Packets (0x13) plen 5    #229 [hci1] 15.852679
        Num handles: 1
        Handle: 3603 Address: DF:A9:FF:F6:B1:1A (OUI DF-A9-FF)
        Count: 1
        #228: len 5 (0 Kb/s)
        Latency: 191 msec (91-192 msec ~191 msec)
> ACL Data RX: Handle 3603 flags 0x02 dlen 9              #230 [hci1] 15.852766
      ATT: Write Request (0x12) len 4
        Handle: 0x00ec
          Data: 0100
< HCI Command: Host Number of Com.. (0x03|0x0035) plen 5  #231 [hci1] 15.860804
        Num handles: 1
        Handle: 3603 Address: DF:A9:FF:F6:B1:1A (OUI DF-A9-FF)
        Count: 1
< ACL Data TX: Handle 3603 flags 0x00 dlen 5              #232 [hci1] 15.860888
      ATT: Write Response (0x13) len 0
> HCI Event: Number of Completed Packets (0x13) plen 5    #233 [hci1] 16.052605
        Num handles: 1
        Handle: 3603 Address: DF:A9:FF:F6:B1:1A (OUI DF-A9-FF)
        Count: 1
        #232: len 5 (0 Kb/s)
        Latency: 191 msec (91-192 msec ~191 msec)
> ACL Data RX: Handle 3603 flags 0x02 dlen 9              #234 [hci1] 16.052749
      ATT: Write Request (0x12) len 4
        Handle: 0x00ef
          Data: 0000
< HCI Command: Host Number of Com.. (0x03|0x0035) plen 5  #235 [hci1] 16.060770
        Num handles: 1
        Handle: 3603 Address: DF:A9:FF:F6:B1:1A (OUI DF-A9-FF)
        Count: 1
< ACL Data TX: Handle 3603 flags 0x00 dlen 5              #236 [hci1] 16.060814
      ATT: Write Response (0x13) len 0
> HCI Event: Number of Completed Packets (0x13) plen 5    #237 [hci1] 16.252581
        Num handles: 1
        Handle: 3603 Address: DF:A9:FF:F6:B1:1A (OUI DF-A9-FF)
        Count: 1
        #236: len 5 (0 Kb/s)
        Latency: 191 msec (91-192 msec ~191 msec)
> ACL Data RX: Handle 3603 flags 0x02 dlen 9              #238 [hci1] 16.252729
      ATT: Write Request (0x12) len 4
        Handle: 0x00ef
          Data: 0100
< HCI Command: Host Number of Com.. (0x03|0x0035) plen 5  #239 [hci1] 16.260699
        Num handles: 1
        Handle: 3603 Address: DF:A9:FF:F6:B1:1A (OUI DF-A9-FF)
        Count: 1
< ACL Data TX: Handle 3603 flags 0x00 dlen 5              #240 [hci1] 16.260722
      ATT: Write Response (0x13) len 0
> HCI Event: Number of Completed Packets (0x13) plen 5    #241 [hci1] 16.452610
        Num handles: 1
        Handle: 3603 Address: DF:A9:FF:F6:B1:1A (OUI DF-A9-FF)
        Count: 1
        #240: len 5 (0 Kb/s)
        Latency: 191 msec (91-192 msec ~191 msec)
> ACL Data RX: Handle 3603 flags 0x02 dlen 9              #242 [hci1] 16.452742
      ATT: Write Request (0x12) len 4
        Handle: 0x00f2
          Data: 0000
< HCI Command: Host Number of Com.. (0x03|0x0035) plen 5  #243 [hci1] 16.461121
        Num handles: 1
        Handle: 3603 Address: DF:A9:FF:F6:B1:1A (OUI DF-A9-FF)
        Count: 1
< ACL Data TX: Handle 3603 flags 0x00 dlen 5              #244 [hci1] 16.461217
      ATT: Write Response (0x13) len 0
> HCI Event: Number of Completed Packets (0x13) plen 5    #245 [hci1] 16.652757
        Num handles: 1
        Handle: 3603 Address: DF:A9:FF:F6:B1:1A (OUI DF-A9-FF)
        Count: 1
        #244: len 5 (0 Kb/s)
        Latency: 191 msec (91-192 msec ~191 msec)
> ACL Data RX: Handle 3603 flags 0x02 dlen 9              #246 [hci1] 16.652766
      ATT: Write Request (0x12) len 4
        Handle: 0x00f2
          Data: 0100
< HCI Command: Host Number of Com.. (0x03|0x0035) plen 5  #247 [hci1] 16.661146
        Num handles: 1
        Handle: 3603 Address: DF:A9:FF:F6:B1:1A (OUI DF-A9-FF)
        Count: 1
< ACL Data TX: Handle 3603 flags 0x00 dlen 5              #248 [hci1] 16.661224
      ATT: Write Response (0x13) len 0
> HCI Event: Number of Completed Packets (0x13) plen 5    #249 [hci1] 16.852591
        Num handles: 1
        Handle: 3603 Address: DF:A9:FF:F6:B1:1A (OUI DF-A9-FF)
        Count: 1
        #248: len 5 (0 Kb/s)
        Latency: 191 msec (91-192 msec ~191 msec)
> ACL Data RX: Handle 3603 flags 0x02 dlen 9              #250 [hci1] 16.852792
      ATT: Write Request (0x12) len 4
        Handle: 0x00f5
          Data: 0000
< HCI Command: Host Number of Com.. (0x03|0x0035) plen 5  #251 [hci1] 16.860789
        Num handles: 1
        Handle: 3603 Address: DF:A9:FF:F6:B1:1A (OUI DF-A9-FF)
        Count: 1
< ACL Data TX: Handle 3603 flags 0x00 dlen 5              #252 [hci1] 16.860862
      ATT: Write Response (0x13) len 0
> HCI Event: Number of Completed Packets (0x13) plen 5    #253 [hci1] 17.052556
        Num handles: 1
        Handle: 3603 Address: DF:A9:FF:F6:B1:1A (OUI DF-A9-FF)
        Count: 1
        #252: len 5 (0 Kb/s)
        Latency: 191 msec (91-192 msec ~191 msec)
> ACL Data RX: Handle 3603 flags 0x02 dlen 9              #254 [hci1] 17.052714
      ATT: Write Request (0x12) len 4
        Handle: 0x00f5
          Data: 0100
< HCI Command: Host Number of Com.. (0x03|0x0035) plen 5  #255 [hci1] 17.060672
        Num handles: 1
        Handle: 3603 Address: DF:A9:FF:F6:B1:1A (OUI DF-A9-FF)
        Count: 1
< ACL Data TX: Handle 3603 flags 0x00 dlen 5              #256 [hci1] 17.060697
      ATT: Write Response (0x13) len 0
> HCI Event: Number of Completed Packets (0x13) plen 5    #257 [hci1] 17.252693
        Num handles: 1
        Handle: 3603 Address: DF:A9:FF:F6:B1:1A (OUI DF-A9-FF)
        Count: 1
        #256: len 5 (0 Kb/s)
        Latency: 191 msec (91-192 msec ~191 msec)
> ACL Data RX: Handle 3603 flags 0x02 dlen 9              #258 [hci1] 17.252695
      ATT: Write Request (0x12) len 4
        Handle: 0x00f8
          Data: 0000
< HCI Command: Host Number of Com.. (0x03|0x0035) plen 5  #259 [hci1] 17.260633
        Num handles: 1
        Handle: 3603 Address: DF:A9:FF:F6:B1:1A (OUI DF-A9-FF)
        Count: 1
< ACL Data TX: Handle 3603 flags 0x00 dlen 5              #260 [hci1] 17.260663
      ATT: Write Response (0x13) len 0
> HCI Event: Number of Completed Packets (0x13) plen 5    #261 [hci1] 17.452687
        Num handles: 1
        Handle: 3603 Address: DF:A9:FF:F6:B1:1A (OUI DF-A9-FF)
        Count: 1
        #260: len 5 (0 Kb/s)
        Latency: 192 msec (91-192 msec ~191 msec)
> ACL Data RX: Handle 3603 flags 0x02 dlen 9              #262 [hci1] 17.452690
      ATT: Write Request (0x12) len 4
        Handle: 0x00f8
          Data: 0100
< HCI Command: Host Number of Com.. (0x03|0x0035) plen 5  #263 [hci1] 17.460712
        Num handles: 1
        Handle: 3603 Address: DF:A9:FF:F6:B1:1A (OUI DF-A9-FF)
        Count: 1
< ACL Data TX: Handle 3603 flags 0x00 dlen 5              #264 [hci1] 17.460759
      ATT: Write Response (0x13) len 0
> HCI Event: Number of Completed Packets (0x13) plen 5    #265 [hci1] 17.652515
        Num handles: 1
        Handle: 3603 Address: DF:A9:FF:F6:B1:1A (OUI DF-A9-FF)
        Count: 1
        #264: len 5 (0 Kb/s)
        Latency: 191 msec (91-192 msec ~191 msec)
> ACL Data RX: Handle 3603 flags 0x02 dlen 7              #266 [hci1] 17.652704
      ATT: Read Request (0x0a) len 2
        Handle: 0x00ee
< HCI Command: Host Number of Com.. (0x03|0x0035) plen 5  #267 [hci1] 17.661280
        Num handles: 1
        Handle: 3603 Address: DF:A9:FF:F6:B1:1A (OUI DF-A9-FF)
        Count: 1
< ACL Data TX: Handle 3603 flags 0x00 dlen 7              #268 [hci1] 17.661361
      ATT: Read Response (0x0b) len 2
> HCI Event: Number of Completed Packets (0x13) plen 5    #269 [hci1] 17.852568
        Num handles: 1
        Handle: 3603 Address: DF:A9:FF:F6:B1:1A (OUI DF-A9-FF)
        Count: 1
        #268: len 7 (0 Kb/s)
        Latency: 191 msec (91-192 msec ~191 msec)
> ACL Data RX: Handle 3603 flags 0x02 dlen 7              #270 [hci1] 17.852814
      ATT: Read Request (0x0a) len 2
        Handle: 0x00f1
< HCI Command: Host Number of Com.. (0x03|0x0035) plen 5  #271 [hci1] 17.860862
        Num handles: 1
        Handle: 3603 Address: DF:A9:FF:F6:B1:1A (OUI DF-A9-FF)
        Count: 1
< ACL Data TX: Handle 3603 flags 0x00 dlen 7              #272 [hci1] 17.860918
      ATT: Read Response (0x0b) len 2
> HCI Event: Number of Completed Packets (0x13) plen 5    #273 [hci1] 18.052608
        Num handles: 1
        Handle: 3603 Address: DF:A9:FF:F6:B1:1A (OUI DF-A9-FF)
        Count: 1
        #272: len 7 (0 Kb/s)
        Latency: 191 msec (91-192 msec ~191 msec)
> ACL Data RX: Handle 3603 flags 0x02 dlen 7              #274 [hci1] 18.052760
      ATT: Read Request (0x0a) len 2
        Handle: 0x00f4
< HCI Command: Host Number of Com.. (0x03|0x0035) plen 5  #275 [hci1] 18.060659
        Num handles: 1
        Handle: 3603 Address: DF:A9:FF:F6:B1:1A (OUI DF-A9-FF)
        Count: 1
< ACL Data TX: Handle 3603 flags 0x00 dlen 7              #276 [hci1] 18.060747
      ATT: Read Response (0x0b) len 2
> HCI Event: Number of Completed Packets (0x13) plen 5    #277 [hci1] 18.252550
        Num handles: 1
        Handle: 3603 Address: DF:A9:FF:F6:B1:1A (OUI DF-A9-FF)
        Count: 1
        #276: len 7 (0 Kb/s)
        Latency: 191 msec (91-192 msec ~191 msec)
> ACL Data RX: Handle 3603 flags 0x02 dlen 7              #278 [hci1] 18.252758
      ATT: Read Request (0x0a) len 2
        Handle: 0x00f7
< HCI Command: Host Number of Com.. (0x03|0x0035) plen 5  #279 [hci1] 18.261019
        Num handles: 1
        Handle: 3603 Address: DF:A9:FF:F6:B1:1A (OUI DF-A9-FF)
        Count: 1
< ACL Data TX: Handle 3603 flags 0x00 dlen 7              #280 [hci1] 18.261089
      ATT: Read Response (0x0b) len 2
> HCI Event: Number of Completed Packets (0x13) plen 5    #281 [hci1] 18.452592
        Num handles: 1
        Handle: 3603 Address: DF:A9:FF:F6:B1:1A (OUI DF-A9-FF)
        Count: 1
        #280: len 7 (0 Kb/s)
        Latency: 191 msec (91-192 msec ~191 msec)
> ACL Data RX: Handle 3603 flags 0x02 dlen 9              #282 [hci1] 18.452763
      ATT: Write Request (0x12) len 4
        Handle: 0x0102
          Data: 0000
< HCI Command: Host Number of Com.. (0x03|0x0035) plen 5  #283 [hci1] 18.461046
        Num handles: 1
        Handle: 3603 Address: DF:A9:FF:F6:B1:1A (OUI DF-A9-FF)
        Count: 1
< ACL Data TX: Handle 3603 flags 0x00 dlen 5              #284 [hci1] 18.461132
      ATT: Write Response (0x13) len 0
> HCI Event: Number of Completed Packets (0x13) plen 5    #285 [hci1] 18.652567
        Num handles: 1
        Handle: 3603 Address: DF:A9:FF:F6:B1:1A (OUI DF-A9-FF)
        Count: 1
        #284: len 5 (0 Kb/s)
        Latency: 191 msec (91-192 msec ~191 msec)
> ACL Data RX: Handle 3603 flags 0x02 dlen 9              #286 [hci1] 18.652746
      ATT: Write Request (0x12) len 4
        Handle: 0x0102
          Data: 0100
< HCI Command: Host Number of Com.. (0x03|0x0035) plen 5  #287 [hci1] 18.661146
        Num handles: 1
        Handle: 3603 Address: DF:A9:FF:F6:B1:1A (OUI DF-A9-FF)
        Count: 1
< ACL Data TX: Handle 3603 flags 0x00 dlen 5              #288 [hci1] 18.661230
      ATT: Write Response (0x13) len 0
> HCI Event: Number of Completed Packets (0x13) plen 5    #289 [hci1] 18.852578
        Num handles: 1
        Handle: 3603 Address: DF:A9:FF:F6:B1:1A (OUI DF-A9-FF)
        Count: 1
        #288: len 5 (0 Kb/s)
        Latency: 191 msec (91-192 msec ~191 msec)
> ACL Data RX: Handle 3603 flags 0x02 dlen 7              #290 [hci1] 18.852826
      ATT: Read Request (0x0a) len 2
        Handle: 0x00db
< HCI Command: Host Number of Com.. (0x03|0x0035) plen 5  #291 [hci1] 18.860683
        Num handles: 1
        Handle: 3603 Address: DF:A9:FF:F6:B1:1A (OUI DF-A9-FF)
        Count: 1
< ACL Data TX: Handle 3603 flags 0x00 dlen 9              #292 [hci1] 18.860706
      ATT: Read Response (0x0b) len 4
> HCI Event: Number of Completed Packets (0x13) plen 5    #293 [hci1] 19.052547
        Num handles: 1
        Handle: 3603 Address: DF:A9:FF:F6:B1:1A (OUI DF-A9-FF)
        Count: 1
        #292: len 9 (0 Kb/s)
        Latency: 191 msec (91-192 msec ~191 msec)
> ACL Data RX: Handle 3603 flags 0x02 dlen 7              #294 [hci1] 19.052814
      ATT: Read Request (0x0a) len 2
        Handle: 0x00d8
< HCI Command: Host Number of Com.. (0x03|0x0035) plen 5  #295 [hci1] 19.061124
        Num handles: 1
        Handle: 3603 Address: DF:A9:FF:F6:B1:1A (OUI DF-A9-FF)
        Count: 1
< ACL Data TX: Handle 3603 flags 0x00 dlen 27             #296 [hci1] 19.061231
< ACL Data TX: Handle 3603 flags 0x01 dlen 27             #297 [hci1] 19.061242
< ACL Data TX: Handle 3603 flags 0x01 dlen 12             #298 [hci1] 19.061246
      ATT: Read Response (0x0b) len 61
> HCI Event: Number of Completed Packets (0x13) plen 5    #299 [hci1] 19.152986
        Num handles: 1
        Handle: 3603 Address: DF:A9:FF:F6:B1:1A (OUI DF-A9-FF)
        Count: 1
        #296: len 27 (2 Kb/s)
        Latency: 91 msec (91-192 msec ~141 msec)
> HCI Event: Number of Completed Packets (0x13) plen 5    #300 [hci1] 19.153485
        Num handles: 1
        Handle: 3603 Address: DF:A9:FF:F6:B1:1A (OUI DF-A9-FF)
        Count: 1
        #297: len 27 (2 Kb/s)
        Latency: 92 msec (91-192 msec ~116 msec)
> HCI Event: Number of Completed Packets (0x13) plen 5    #301 [hci1] 19.252601
        Num handles: 1
        Handle: 3603 Address: DF:A9:FF:F6:B1:1A (OUI DF-A9-FF)
        Count: 1
        #298: len 12 (0 Kb/s)
        Latency: 191 msec (91-192 msec ~154 msec)
> ACL Data RX: Handle 3603 flags 0x02 dlen 7              #302 [hci1] 19.252751
      ATT: Read Request (0x0a) len 2
        Handle: 0x00e4
< HCI Command: Host Number of Com.. (0x03|0x0035) plen 5  #303 [hci1] 19.260706
        Num handles: 1
        Handle: 3603 Address: DF:A9:FF:F6:B1:1A (OUI DF-A9-FF)
        Count: 1
< ACL Data TX: Handle 3603 flags 0x00 dlen 9              #304 [hci1] 19.260735
      ATT: Read Response (0x0b) len 4
> HCI Event: Number of Completed Packets (0x13) plen 5    #305 [hci1] 19.452548
        Num handles: 1
        Handle: 3603 Address: DF:A9:FF:F6:B1:1A (OUI DF-A9-FF)
        Count: 1
        #304: len 9 (0 Kb/s)
        Latency: 191 msec (91-192 msec ~172 msec)
> ACL Data RX: Handle 3603 flags 0x02 dlen 7              #306 [hci1] 19.452765
      ATT: Read Request (0x0a) len 2
        Handle: 0x00e7
< HCI Command: Host Number of Com.. (0x03|0x0035) plen 5  #307 [hci1] 19.460870
        Num handles: 1
        Handle: 3603 Address: DF:A9:FF:F6:B1:1A (OUI DF-A9-FF)
        Count: 1
< ACL Data TX: Handle 3603 flags 0x00 dlen 9              #308 [hci1] 19.460921
      ATT: Read Response (0x0b) len 4
> HCI Event: Number of Completed Packets (0x13) plen 5    #309 [hci1] 19.652508
        Num handles: 1
        Handle: 3603 Address: DF:A9:FF:F6:B1:1A (OUI DF-A9-FF)
        Count: 1
        #308: len 9 (0 Kb/s)
        Latency: 191 msec (91-192 msec ~182 msec)
> ACL Data RX: Handle 3603 flags 0x02 dlen 7              #310 [hci1] 19.652771
      ATT: Read Request (0x0a) len 2
        Handle: 0x0101
< HCI Command: Host Number of Com.. (0x03|0x0035) plen 5  #311 [hci1] 19.661259
        Num handles: 1
        Handle: 3603 Address: DF:A9:FF:F6:B1:1A (OUI DF-A9-FF)
        Count: 1
< ACL Data TX: Handle 3603 flags 0x00 dlen 6              #312 [hci1] 19.661368
      ATT: Read Response (0x0b) len 1
> HCI Event: Number of Completed Packets (0x13) plen 5    #313 [hci1] 19.852612
        Num handles: 1
        Handle: 3603 Address: DF:A9:FF:F6:B1:1A (OUI DF-A9-FF)
        Count: 1
        #312: len 6 (0 Kb/s)
        Latency: 191 msec (91-192 msec ~186 msec)
> ACL Data RX: Handle 3603 flags 0x02 dlen 27             #314 [hci1] 19.852929
> ACL Data RX: Handle 3603 flags 0x01 dlen 7              #315 [hci1] 19.853079
      ATT: Write Command (0x52) len 29
        Handle: 0x00eb
          Data: 010101020206000000001002010302020103042800050302000000
< HCI Command: Host Number of Com.. (0x03|0x0035) plen 5  #316 [hci1] 19.860839
        Num handles: 1
        Handle: 3603 Address: DF:A9:FF:F6:B1:1A (OUI DF-A9-FF)
        Count: 1
< HCI Command: Host Number of Com.. (0x03|0x0035) plen 5  #317 [hci1] 19.861253
        Num handles: 1
        Handle: 3603 Address: DF:A9:FF:F6:B1:1A (OUI DF-A9-FF)
        Count: 1
< ACL Data TX: Handle 3603 flags 0x00 dlen 12             #318 [hci1] 19.861465
      ATT: Handle Value Notification (0x1b) len 7
        Handle: 0x00eb
          Data: 0101010000
< ACL Data TX: Handle 3603 flags 0x00 dlen 27             #319 [hci1] 19.861560
< ACL Data TX: Handle 3603 flags 0x01 dlen 21             #320 [hci1] 19.861562
      ATT: Handle Value Notification (0x1b) len 43
        Handle: 0x00ee
          Data: 01010002020a00102700409c00102700409c0006000000001002010302020103042800050302000000
> HCI Event: Number of Completed Packets (0x13) plen 5    #321 [hci1] 19.952970
        Num handles: 1
        Handle: 3603 Address: DF:A9:FF:F6:B1:1A (OUI DF-A9-FF)
        Count: 1
        #318: len 12 (1 Kb/s)
        Latency: 91 msec (91-192 msec ~139 msec)
> HCI Event: Number of Completed Packets (0x13) plen 5    #322 [hci1] 19.953351
        Num handles: 1
        Handle: 3603 Address: DF:A9:FF:F6:B1:1A (OUI DF-A9-FF)
        Count: 1
        #319: len 27 (2 Kb/s)
        Latency: 91 msec (91-192 msec ~115 msec)
> HCI Event: Number of Completed Packets (0x13) plen 5    #323 [hci1] 20.052605
        Num handles: 1
        Handle: 3603 Address: DF:A9:FF:F6:B1:1A (OUI DF-A9-FF)
        Count: 1
        #320: len 21 (0 Kb/s)
        Latency: 191 msec (91-192 msec ~153 msec)
> ACL Data RX: Handle 3603 flags 0x02 dlen 25             #324 [hci1] 20.052911
      ATT: Write Command (0x52) len 20
        Handle: 0x00eb
          Data: 020101010110270000022800020a00a86100
< HCI Command: Host Number of Com.. (0x03|0x0035) plen 5  #325 [hci1] 20.060807
        Num handles: 1
        Handle: 3603 Address: DF:A9:FF:F6:B1:1A (OUI DF-A9-FF)
        Count: 1
< ACL Data TX: Handle 3603 flags 0x00 dlen 12             #326 [hci1] 20.061017
      ATT: Handle Value Notification (0x1b) len 7
        Handle: 0x00eb
          Data: 0201010000
< ACL Data TX: Handle 3603 flags 0x00 dlen 24             #327 [hci1] 20.061089
      ATT: Handle Value Notification (0x1b) len 19
        Handle: 0x00ee
          Data: 0102010110270000022800020a00a86100
> HCI Event: Number of Completed Packets (0x13) plen 5    #328 [hci1] 20.152930
        Num handles: 1
        Handle: 3603 Address: DF:A9:FF:F6:B1:1A (OUI DF-A9-FF)
        Count: 1
        #326: len 12 (1 Kb/s)
        Latency: 91 msec (91-192 msec ~122 msec)
> HCI Event: Number of Completed Packets (0x13) plen 5    #329 [hci1] 20.252539
        Num handles: 1
        Handle: 3603 Address: DF:A9:FF:F6:B1:1A (OUI DF-A9-FF)
        Count: 1
        #327: len 24 (1 Kb/s)
        Latency: 191 msec (91-192 msec ~157 msec)
> ACL Data RX: Handle 3603 flags 0x02 dlen 15             #330 [hci1] 20.252819
      ATT: Write Request (0x12) len 10
        Handle: 0x00eb
          Data: 030101040302fd0f
< HCI Command: Host Number of Com.. (0x03|0x0035) plen 5  #331 [hci1] 20.260794
        Num handles: 1
        Handle: 3603 Address: DF:A9:FF:F6:B1:1A (OUI DF-A9-FF)
        Count: 1
< ACL Data TX: Handle 3603 flags 0x00 dlen 5              #332 [hci1] 20.260951
      ATT: Write Response (0x13) len 0
< ACL Data TX: Handle 3603 flags 0x00 dlen 12             #333 [hci1] 20.261083
      ATT: Handle Value Notification (0x1b) len 7
        Handle: 0x00eb
          Data: 0301010b02
> HCI Event: Number of Completed Packets (0x13) plen 5    #334 [hci1] 20.352873
        Num handles: 1
        Handle: 3603 Address: DF:A9:FF:F6:B1:1A (OUI DF-A9-FF)
        Count: 1
        #332: len 5 (0 Kb/s)
        Latency: 91 msec (91-192 msec ~124 msec)
> HCI Event: Number of Completed Packets (0x13) plen 5    #335 [hci1] 20.452579
        Num handles: 1
        Handle: 3603 Address: DF:A9:FF:F6:B1:1A (OUI DF-A9-FF)
        Count: 1
        #333: len 12 (0 Kb/s)
        Latency: 191 msec (91-192 msec ~157 msec)
> ACL Data RX: Handle 3603 flags 0x02 dlen 10             #336 [hci1] 40.452351
      ATT: Write Command (0x52) len 5
        Handle: 0x00eb
          Data: 080101
< HCI Command: Host Number of Com.. (0x03|0x0035) plen 5  #337 [hci1] 40.460947
        Num handles: 1
        Handle: 3603 Address: DF:A9:FF:F6:B1:1A (OUI DF-A9-FF)
        Count: 1
< ACL Data TX: Handle 3603 flags 0x00 dlen 12             #338 [hci1] 40.461119
      ATT: Handle Value Notification (0x1b) len 7
        Handle: 0x00eb
          Data: 0801010000
< ACL Data TX: Handle 3603 flags 0x00 dlen 9              #339 [hci1] 40.461330
      ATT: Handle Value Notification (0x1b) len 4
        Handle: 0x00ee
          Data: 0106
< ACL Data TX: Handle 3603 flags 0x00 dlen 9              #340 [hci1] 40.461337
      ATT: Handle Value Notification (0x1b) len 4
        Handle: 0x00ee
          Data: 0100
> HCI Event: Number of Completed Packets (0x13) plen 5    #341 [hci1] 40.552569
        Num handles: 1
        Handle: 3603 Address: DF:A9:FF:F6:B1:1A (OUI DF-A9-FF)
        Count: 1
        #338: len 12 (1 Kb/s)
        Latency: 91 msec (91-192 msec ~124 msec)
> HCI Event: Number of Completed Packets (0x13) plen 5    #342 [hci1] 40.553160
        Num handles: 1
        Handle: 3603 Address: DF:A9:FF:F6:B1:1A (OUI DF-A9-FF)
        Count: 1
        #339: len 9 (0 Kb/s)
        Latency: 91 msec (91-192 msec ~108 msec)
> HCI Event: Number of Completed Packets (0x13) plen 5    #343 [hci1] 40.652257
        Num handles: 1
        Handle: 3603 Address: DF:A9:FF:F6:B1:1A (OUI DF-A9-FF)
        Count: 1
        #340: len 9 (0 Kb/s)
        Latency: 190 msec (91-192 msec ~149 msec)
> HCI Event: Disconnect Complete (0x05) plen 4            #344 [hci1] 40.752457
        Status: Success (0x00)
        Handle: 3603 Address: DF:A9:FF:F6:B1:1A (OUI DF-A9-FF)
        Reason: Remote User Terminated Connection (0x13)
< HCI Command: Reset (0x03|0x0003) plen 0                 #345 [hci1] 47.540910
> HCI Event: Command Complete (0x0e) plen 4               #346 [hci1] 47.541328
      Reset (0x03|0x0003) ncmd 1
        Status: Success (0x00)
@ USER Close: main                                    {0x0001} [hci1] 47.560805
= Close Index: 00:00:00:00:00:00                               [hci1] 47.564487
