Bluetooth monitor ver 5.72
btmon[1456213]: = Note: Linux version 6.14.0-36-generic (x86_64)                                                         0.156268
btmon[1456213]: = Note: Bluetooth subsystem version 2.22                                                                 0.156270
= New Index: 00:00:00:00:00:00 (Primary,UART,hci1)                                                                       0.156271
= New Index: 48:5F:99:8E:E0:64 (Primary,USB,hci0)                                                                        0.156272
= Open Index: 00:00:00:00:00:00                                                                                          0.669866
= Index Info: 00:00:00:00:00:00 (Nordic Semiconductor ASA)                                                               0.669884
zephyr.exe[1456215]: @ USER Open: main (privileged) version 2.22                                                {0x0001} 0.669894
zephyr.exe[1456215]: < HCI Command: Reset (0x03|0x0003) plen 0                                                        #1 0.671033
> HCI Event: Command Complete (0x0e) plen 4                                                                           #2 0.671686
      Reset (0x03|0x0003) ncmd 1
        Status: Success (0x00)
zephyr.exe[1456215]: < HCI Command: Read Local Supported Features (0x04|0x0003) plen 0                                #3 0.689712
> HCI Event: Command Complete (0x0e) plen 12                                                                          #4 0.690351
      Read Local Supported Features (0x04|0x0003) ncmd 1
        Status: Success (0x00)
        Features: 0x00 0x00 0x00 0x00 0x60 0x00 0x00 0x00
          BR/EDR Not Supported
          LE Supported (Controller)
zephyr.exe[1456215]: < HCI Command: Read Local Version Information (0x04|0x0001) plen 0                               #5 0.709418
> HCI Event: Command Complete (0x0e) plen 12                                                                          #6 0.709977
      Read Local Version Information (0x04|0x0001) ncmd 1
        Status: Success (0x00)
        HCI version: Reserved (0x0f) - Revision 12393 (0x3069)
        LMP version: Reserved (0x0f) - Subversion 12393 (0x3069)
        Manufacturer: Nordic Semiconductor ASA (89)
zephyr.exe[1456215]: < HCI Command: Read Local Supported Commands (0x04|0x0002) plen 0                                #7 0.729363
> HCI Event: Command Complete (0x0e) plen 68                                                                          #8 0.730527
      Read Local Supported Commands (0x04|0x0002) ncmd 1
        Status: Success (0x00)
        Commands: 119 entries
          Disconnect (Octet 0 - Bit 5)
          Read Remote Version Information (Octet 2 - Bit 7)
          Set Event Mask (Octet 5 - Bit 6)
          Reset (Octet 5 - Bit 7)
          Read Connection Accept Timeout (Octet 7 - Bit 2)
          Write Connection Accept Timeout (Octet 7 - Bit 3)
          Read Transmit Power Level (Octet 10 - Bit 2)
          Set Controller To Host Flow Control (Octet 10 - Bit 5)
          Host Buffer Size (Octet 10 - Bit 6)
          Host Number of Completed Packets (Octet 10 - Bit 7)
          Read Local Version Information (Octet 14 - Bit 3)
          Read Local Supported Features (Octet 14 - Bit 5)
          Read BD ADDR (Octet 15 - Bit 1)
          Read RSSI (Octet 15 - Bit 5)
          Set Event Mask Page 2 (Octet 22 - Bit 2)
          LE Set Event Mask (Octet 25 - Bit 0)
          LE Read Buffer Size (Octet 25 - Bit 1)
          LE Read Local Supported Features (Octet 25 - Bit 2)
          LE Set Random Address (Octet 25 - Bit 4)
          LE Set Advertising Parameters (Octet 25 - Bit 5)
          LE Read Advertising Channel TX Power (Octet 25 - Bit 6)
          LE Set Advertising Data (Octet 25 - Bit 7)
          LE Set Scan Response Data (Octet 26 - Bit 0)
          LE Set Advertise Enable (Octet 26 - Bit 1)
          LE Set Scan Parameters (Octet 26 - Bit 2)
          LE Set Scan Enable (Octet 26 - Bit 3)
          LE Create Connection (Octet 26 - Bit 4)
          LE Create Connection Cancel (Octet 26 - Bit 5)
          LE Read Accept List Size (Octet 26 - Bit 6)
          LE Clear Accept List (Octet 26 - Bit 7)
          LE Add Device To Accept List (Octet 27 - Bit 0)
          LE Remove Device From Accept List (Octet 27 - Bit 1)
          LE Connection Update (Octet 27 - Bit 2)
          LE Set Host Channel Classification (Octet 27 - Bit 3)
          LE Read Channel Map (Octet 27 - Bit 4)
          LE Read Remote Used Features (Octet 27 - Bit 5)
          LE Encrypt (Octet 27 - Bit 6)
          LE Rand (Octet 27 - Bit 7)
          LE Start Encryption (Octet 28 - Bit 0)
          LE Long Term Key Request Reply (Octet 28 - Bit 1)
          LE Long Term Key Request Neg Reply (Octet 28 - Bit 2)
          LE Read Supported States (Octet 28 - Bit 3)
          LE Receiver Test (Octet 28 - Bit 4)
          LE Transmitter Test (Octet 28 - Bit 5)
          LE Test End (Octet 28 - Bit 6)
          Read Authenticated Payload Timeout (Octet 32 - Bit 4)
          Write Authenticated Payload Timeout (Octet 32 - Bit 5)
          LE Set Data Length (Octet 33 - Bit 6)
          LE Read Suggested Default Data Length (Octet 33 - Bit 7)
          LE Write Suggested Default Data Length (Octet 34 - Bit 0)
          LE Add Device To Resolving List (Octet 34 - Bit 3)
          LE Remove Device From Resolving List (Octet 34 - Bit 4)
          LE Clear Resolving List (Octet 34 - Bit 5)
          LE Read Resolving List Size (Octet 34 - Bit 6)
          LE Set Address Resolution Enable (Octet 35 - Bit 1)
          LE Set Resolvable Private Address Timeout (Octet 35 - Bit 2)
          LE Read Maximum Data Length (Octet 35 - Bit 3)
          LE Read PHY (Octet 35 - Bit 4)
          LE Set Default PHY (Octet 35 - Bit 5)
          LE Set PHY (Octet 35 - Bit 6)
          LE Enhanced Receiver Test (Octet 35 - Bit 7)
          LE Enhanced Transmitter Test (Octet 36 - Bit 0)
          LE Set Advertising Set Random Address (Octet 36 - Bit 1)
          LE Set Extended Advertising Parameters (Octet 36 - Bit 2)
          LE Set Extended Advertising Data (Octet 36 - Bit 3)
          LE Set Extended Scan Response Data (Octet 36 - Bit 4)
          LE Set Extended Advertising Enable (Octet 36 - Bit 5)
          LE Read Maximum Advertising Data Length (Octet 36 - Bit 6)
          LE Read Number of Supported Advertising Sets (Octet 36 - Bit 7)
          LE Remove Advertising Set (Octet 37 - Bit 0)
          LE Clear Advertising Sets (Octet 37 - Bit 1)
          LE Set Periodic Advertising Parameters (Octet 37 - Bit 2)
          LE Set Periodic Advertising Data (Octet 37 - Bit 3)
          LE Set Periodic Advertising Enable (Octet 37 - Bit 4)
          LE Set Extended Scan Parameters (Octet 37 - Bit 5)
          LE Set Extended Scan Enable (Octet 37 - Bit 6)
          LE Extended Create Connection (Octet 37 - Bit 7)
          LE Periodic Advertising Create Sync (Octet 38 - Bit 0)
          LE Periodic Advertising Create Sync Cancel (Octet 38 - Bit 1)
          LE Periodic Advertising Terminate Sync (Octet 38 - Bit 2)
          LE Add Device To Periodic Advertiser List (Octet 38 - Bit 3)
          LE Remove Device From Periodic Advertiser List (Octet 38 - Bit 4)
          LE Clear Periodic Advertiser List (Octet 38 - Bit 5)
          LE Read Periodic Advertiser List Size (Octet 38 - Bit 6)
          LE Read Transmit Power (Octet 38 - Bit 7)
          LE Read RF Path Compensation (Octet 39 - Bit 0)
          LE Write RF Path Compensation (Octet 39 - Bit 1)
          LE Set Privacy Mode (Octet 39 - Bit 2)
          LE Periodic Advertising Receive Enable (Octet 40 - Bit 5)
          LE Periodic Advertising Sync Transfer (Octet 40 - Bit 6)
          LE Periodic Advertising Set Info Transfer (Octet 40 - Bit 7)
          LE Periodic Advertising Sync Transfer Parameters (Octet 41 - Bit 0)
          LE Set Default Periodic Advertisng Sync Transfer Parameters (Octet 41 - Bit 1)
          LE Read Buffer v2 (Octet 41 - Bit 5)
          LE Read ISO TX Sync (Octet 41 - Bit 6)
          LE Set Connected Isochronous Group Parameters (Octet 41 - Bit 7)
          LE Set Connected Isochronous Group Parameters Test (Octet 42 - Bit 0)
          LE Create Connected Isochronous Stream (Octet 42 - Bit 1)
          LE Remove Connected Isochronous Group (Octet 42 - Bit 2)
          LE Accept Connected Isochronous Stream Request (Octet 42 - Bit 3)
          LE Reject Connected Isochronous Stream Request (Octet 42 - Bit 4)
          LE Create Broadcast Isochronous Group (Octet 42 - Bit 5)
          LE Create Broadcast Isochronous Group Test (Octet 42 - Bit 6)
          LE Terminate Broadcast Isochronous Group (Octet 42 - Bit 7)
          LE Broadcast Isochronous Group Create Sync (Octet 43 - Bit 0)
          LE Broadcast Isochronous Group Terminate Sync (Octet 43 - Bit 1)
          LE Request Peer SCA (Octet 43 - Bit 2)
          LE Setup Isochronous Data Path (Octet 43 - Bit 3)
          LE Remove Isochronous Data Path (Octet 43 - Bit 4)
          LE Isochronous Transmit Test (Octet 43 - Bit 5)
          LE Isochronous Receive Test (Octet 43 - Bit 6)
          LE Isochronous Read Test Counters (Octet 43 - Bit 7)
          LE Isochronous Read Test Counters (Octet 44 - Bit 0)
          LE Set Host Feature (Octet 44 - Bit 1)
          Octet 44 - Bit 2 
          Octet 45 - Bit 6 
          Octet 46 - Bit 0 
          Octet 46 - Bit 1 
          Octet 46 - Bit 2 
zephyr.exe[1456215]: < HCI Command: Host Buffer Size (0x03|0x0033) plen 7                                             #9 0.749372
        ACL MTU: 255  ACL max packet: 16
        SCO MTU: 0    SCO max packet: 0
> HCI Event: Command Complete (0x0e) plen 4                                                                          #10 0.749935
      Host Buffer Size (0x03|0x0033) ncmd 1
        Status: Success (0x00)
zephyr.exe[1456215]: < HCI Command: Set Controller To Host Flow Control (0x03|0x0031) plen 1                         #11 0.769358
        Flow control: ACL Data Packets (0x01)
> HCI Event: Command Complete (0x0e) plen 4                                                                          #12 0.769826
      Set Controller To Host Flow Control (0x03|0x0031) ncmd 1
        Status: Success (0x00)
zephyr.exe[1456215]: < HCI Command: LE Read Local Supported Features (0x08|0x0003) plen 0                            #13 0.789366
> HCI Event: Command Complete (0x0e) plen 12                                                                         #14 0.789925
      LE Read Local Supported Features (0x08|0x0003) ncmd 1
        Status: Success (0x00)
        Features: 0xfd 0x79 0x00 0xf7 0x30 0x01 0x00 0x00
          LE Encryption
          Extended Reject Indication
          Peripheral-initiated Features Exchange
          LE Ping
          LE Data Packet Length Extension
          LL Privacy
          Extended Scanner Filter Policies
          LE 2M PHY
          LE Coded PHY
          LE Extended Advertising
          LE Periodic Advertising
          Channel Selection Algorithm #2
          Periodic Advertising Sync Transfer - Sender
          Periodic Advertising Sync Transfer - Recipient
          Sleep Clock Accuracy Updates
          Connected Isochronous Stream - Central
          Connected Isochronous Stream - Peripheral
          Isochronous Broadcaster
          Synchronized Receiver
          Periodic Advertising ADI support
          Connection Subrating
          Unknown features (0x0000010000000000)
zephyr.exe[1456215]: < HCI Command: LE Set Host Feature (0x08|0x0074) plen 2                                         #15 0.809382
        Bit Number: 32
          Connected Isochronous Stream (Host Support)
        Bit Value: 1
> HCI Event: Command Complete (0x0e) plen 4                                                                          #16 0.809793
      LE Set Host Feature (0x08|0x0074) ncmd 1
        Status: Success (0x00)
zephyr.exe[1456215]: < HCI Command: LE Read Buffer v2 (0x08|0x0060) plen 0                                           #17 0.829399
> HCI Event: Command Complete (0x0e) plen 10                                                                         #18 0.829968
      LE Read Buffer v2 (0x08|0x0060) ncmd 1
        Status: Success (0x00)
        ACL MTU: 27
        ACL max packet: 3
        ISO MTU: 318
        ISO max packet: 3
zephyr.exe[1456215]: < HCI Command: LE Read Maximum Advertising Data Length (0x08|0x003a) plen 0                     #19 0.849382
> HCI Event: Command Complete (0x0e) plen 6                                                                          #20 0.849858
      LE Read Maximum Advertising Data Length (0x08|0x003a) ncmd 1
        Status: Success (0x00)
        Max length: 1650
zephyr.exe[1456215]: < HCI Command: LE Read Supported States (0x08|0x001c) plen 0                                    #21 0.869363
> HCI Event: Command Complete (0x0e) plen 12                                                                         #22 0.869911
      LE Read Supported States (0x08|0x001c) ncmd 1
        Status: Success (0x00)
        States: 0x000003ff3e0306ff
          Non-connectable Advertising State
          Scannable Advertising State
          Connectable Advertising State
          High Duty Cycle Directed Advertising State
          Passive Scanning State
          Active Scanning State
          Initiating State
            and Connection State (Central Role)
          Connection State (Peripheral Role)
          Scannable Advertising State
            and Passive Scanning State
          Connectable Advertising State
            and Passive Scanning State
          Non-connectable Advertising State
            and Initiating State
          Scannable Advertising State
            and Initiating State
          Active Scanning State
            and Connection State (Central Role)
          Passive Scanning State
            and Connection State (Peripheral Role)
          Active Scanning State
            and Connection State (Peripheral Role)
          Initiating State
            and Connection State (Central Role)
            and Central Role & Central Role
          Low Duty Cycle Directed Advertising State
          Connectable Advertising State
            and Initiating State
            and Central Role & Peripheral Role
          High Duty Cycle Directed Advertising State
            and Initiating State
            and Central Role & Peripheral Role
          Low Duty Cycle Directed Advertising State
            and Initiating State
            and Central Role & Peripheral Role
          Connectable Advertising State
            and Connection State (Central Role)
            and Central Role & Peripheral Role
          High Duty Cycle Directed Advertising State
            and Connection State (Central Role)
            and Central Role & Peripheral Role
          Low Duty Cycle Directed Advertising State
            and Connection State (Central Role)
            and Central Role & Peripheral Role
          Connectable Advertising State
            and Connection State (Peripheral Role)
            and Central Role & Peripheral Role
          High Duty Cycle Directed Advertising State
            and Connection State (Peripheral Role)
            and Peripheral Role & Peripheral Role
          Low Duty Cycle Directed Advertising State
            and Connection State (Peripheral Role)
            and Peripheral Role & Peripheral Role
          Initiating State
            and Connection State (Peripheral Role)
            and Central Role & Peripheral Role
zephyr.exe[1456215]: < HCI Command: LE Read Maximum Data Length (0x08|0x002f) plen 0                                 #23 0.889346
> HCI Event: Command Complete (0x0e) plen 12                                                                         #24 0.889910
      LE Read Maximum Data Length (0x08|0x002f) ncmd 1
        Status: Success (0x00)
        Max TX octets: 251
        Max TX time: 2704
        Max RX octets: 251
        Max RX time: 2704
zephyr.exe[1456215]: < HCI Command: LE Write Suggested Default Data Length (0x08|0x0024) plen 4                      #25 0.909336
        TX octets: 251
        TX time: 2704
> HCI Event: Command Complete (0x0e) plen 4                                                                          #26 0.909750
      LE Write Suggested Default Data Length (0x08|0x0024) ncmd 1
        Status: Success (0x00)
zephyr.exe[1456215]: < HCI Command: LE Set Resolvable Private Address Timeout (0x08|0x002e) plen 2                   #27 0.929433
        Timeout: 30 seconds
> HCI Event: Command Complete (0x0e) plen 4                                                                          #28 0.929914
      LE Set Resolvable Private Address Timeout (0x08|0x002e) ncmd 1
        Status: Success (0x00)
zephyr.exe[1456215]: < HCI Command: LE Read Resolving List Size (0x08|0x002a) plen 0                                 #29 0.949399
> HCI Event: Command Complete (0x0e) plen 5                                                                          #30 0.949862
      LE Read Resolving List Size (0x08|0x002a) ncmd 1
        Status: Success (0x00)
        Size: 8
zephyr.exe[1456215]: < HCI Command: LE Set Event Mask (0x08|0x0001) plen 8                                           #31 0.969391
        Mask: 0x000002023f87fa5e
          LE Advertising Report
          LE Connection Update Complete
          LE Read Remote Used Features Complete
          LE Long Term Key Request
          LE Data Length Change
          LE Enhanced Connection Complete
          LE PHY Update Complete
          LE Extended Advertising Report
          LE Periodic Advertising Sync Established
          LE Periodic Advertising Report
          LE Periodic Advertising Sync Lost
          LE Extended Scan Timeout
          LE Extended Advertising Set Terminated
          LE Scan Request Received
          LE Periodic Advertising Sync Transfer Rvc
          LE CIS Established
          LE CIS Request
          LE Create BIG Complete
          LE Terminate BIG Complete
          LE BIG Sync Estabilished Complete
          LE BIG Sync Lost
          LE BIG Info Advertising Report
          Unknown mask (0x0000020000000000)
> HCI Event: Command Complete (0x0e) plen 4                                                                          #32 0.969890
      LE Set Event Mask (0x08|0x0001) ncmd 1
        Status: Success (0x00)
zephyr.exe[1456215]: < HCI Command: Set Event Mask (0x03|0x0001) plen 8                                              #33 0.989358
        Mask: 0x2000800002008890
          Disconnection Complete
          Encryption Change
          Read Remote Version Information Complete
          Hardware Error
          Data Buffer Overflow
          Encryption Key Refresh Complete
          LE Meta
> HCI Event: Command Complete (0x0e) plen 4                                                                          #34 0.989941
      Set Event Mask (0x03|0x0001) ncmd 1
        Status: Success (0x00)
zephyr.exe[1456215]: < HCI Command: Read BD ADDR (0x04|0x0009) plen 0                                                #35 1.009336
> HCI Event: Command Complete (0x0e) plen 10                                                                         #36 1.009814
      Read BD ADDR (0x04|0x0009) ncmd 1
        Status: Success (0x00)
        Address: 00:00:00:00:00:00 (OUI 00-00-00)
zephyr.exe[1456215]: < HCI Command: LE Set Random Address (0x08|0x0005) plen 6                                       #37 1.029386
        Address: D5:B6:CC:31:DB:3B (Static)
> HCI Event: Command Complete (0x0e) plen 4                                                                          #38 1.029978
      LE Set Random Address (0x08|0x0005) ncmd 1
        Status: Success (0x00)
zephyr.exe[1456215]: < HCI Command: LE Set Random Address (0x08|0x0005) plen 6                                       #39 1.119394
        Address: 48:61:8E:DB:C6:F9 (Resolvable)
> HCI Event: Command Complete (0x0e) plen 4                                                                          #40 1.119885
      LE Set Random Address (0x08|0x0005) ncmd 1
        Status: Success (0x00)
zephyr.exe[1456215]: < HCI Command: LE Extended Create Connection (0x08|0x0043) plen 26                              #41 4.949918
        Filter policy: Accept list is not used (0x00)
        Own address type: Random (0x03)
        Peer address type: Public (0x00)
        Peer address: DF:A9:FF:F6:B1:1A (OUI DF-A9-FF)
        Initiating PHYs: 0x01
        Entry 0: LE 1M
          Scan interval: 60.000 msec (0x0060)
          Scan window: 60.000 msec (0x0060)
          Min connection interval: 30.00 msec (0x0018)
          Max connection interval: 50.00 msec (0x0028)
          Connection latency: 0 (0x0000)
          Supervision timeout: 4000 msec (0x0190)
          Min connection length: 0.000 msec (0x0000)
          Max connection length: 0.000 msec (0x0000)
> HCI Event: Command Status (0x0f) plen 4                                                                            #42 4.950957
      LE Extended Create Connection (0x08|0x0043) ncmd 1
        Status: Success (0x00)
> HCI Event: LE Meta Event (0x3e) plen 31                                                                            #43 5.012174
      LE Enhanced Connection Complete (0x0a)
        Status: Success (0x00)
        Handle: 738
        Role: Central (0x00)
        Peer address type: Public (0x00)
        Peer address: DF:A9:FF:F6:B1:1A (OUI DF-A9-FF)
        Local resolvable private address: 48:61:8E:DB:C6:F9 (Resolvable)
        Peer resolvable private address: 00:00:00:00:00:00 (Non-Resolvable)
        Connection interval: 50.00 msec (0x0028)
        Connection latency: 0 (0x0000)
        Supervision timeout: 4000 msec (0x0190)
        Central clock accuracy: 0x00
zephyr.exe[1456215]: < HCI Command: LE Read Remote Used Features (0x08|0x0016) plen 2                                #44 5.029775
        Handle: 738 Address: DF:A9:FF:F6:B1:1A (OUI DF-A9-FF)
> HCI Event: Command Status (0x0f) plen 4                                                                            #45 5.030180
      LE Read Remote Used Features (0x08|0x0016) ncmd 1
        Status: Success (0x00)
zephyr.exe[1456215]: < HCI Command: LE Set PHY (0x08|0x0032) plen 7                                                  #46 5.049504
        Handle: 738 Address: DF:A9:FF:F6:B1:1A (OUI DF-A9-FF)
        All PHYs preference: 0x00
        TX PHYs preference: 0x02
          LE 2M
        RX PHYs preference: 0x02
          LE 2M
        PHY options preference: Reserved (0x0000)
> HCI Event: Command Status (0x0f) plen 4                                                                            #47 5.050045
      LE Set PHY (0x08|0x0032) ncmd 1
        Status: Success (0x00)
> HCI Event: LE Meta Event (0x3e) plen 12                                                                            #48 5.163662
      LE Read Remote Used Features (0x04)
        Status: Success (0x00)
        Handle: 738 Address: DF:A9:FF:F6:B1:1A (OUI DF-A9-FF)
        Features: 0x2d 0x49 0x00 0xf7 0x67 0xd8 0x00 0x00
          LE Encryption
          Extended Reject Indication
          Peripheral-initiated Features Exchange
          LE Data Packet Length Extension
          LE 2M PHY
          LE Coded PHY
          Channel Selection Algorithm #2
          Periodic Advertising Sync Transfer - Sender
          Periodic Advertising Sync Transfer - Recipient
          Sleep Clock Accuracy Updates
          Connected Isochronous Stream - Central
          Connected Isochronous Stream - Peripheral
          Isochronous Broadcaster
          Synchronized Receiver
          Connected Isochronous Stream (Host Support)
          LE Power Control Request
          LE Power Control Request
          Connection Subrating
          Connection Subrating (Host Support)
          Unknown features (0x0000d80000000000)
> HCI Event: LE Meta Event (0x3e) plen 6                                                                             #49 5.663089
      LE PHY Update Complete (0x0c)
        Status: Success (0x00)
        Handle: 738 Address: DF:A9:FF:F6:B1:1A (OUI DF-A9-FF)
        TX PHY: LE 2M (0x02)
        RX PHY: LE 2M (0x02)
> ACL Data RX: Handle 738 flags 0x02 dlen 6                                                                          #50 6.063621
      SMP: Security Request (0x0b) len 1
        Authentication requirement: Bonding, No MITM, SC, No Keypresses (0x09)
zephyr.exe[1456215]: < HCI Command: Host Number of Completed Packets (0x03|0x0035) plen 5                            #51 6.069703
        Num handles: 1
        Handle: 738 Address: DF:A9:FF:F6:B1:1A (OUI DF-A9-FF)
        Count: 1
zephyr.exe[1456215]: < ACL Data TX: Handle 738 flags 0x00 dlen 11                                                    #52 6.069844
      SMP: Pairing Request (0x01) len 6
        IO capability: KeyboardDisplay (0x04)
        OOB data: Authentication data not present (0x00)
        Authentication requirement: Bonding, No MITM, SC, No Keypresses (0x09)
        Max encryption key size: 16
        Initiator key distribution: EncKey IdKey (0x03)
        Responder key distribution: EncKey IdKey (0x03)
> HCI Event: Number of Completed Packets (0x13) plen 5                                                               #53 6.113523
        Num handles: 1
        Handle: 738 Address: DF:A9:FF:F6:B1:1A (OUI DF-A9-FF)
        Count: 1
        #52: len 11 (2 Kb/s)
        Latency: 43 msec (43-43 msec ~43 msec)
> ACL Data RX: Handle 738 flags 0x02 dlen 11                                                                         #54 6.163626
      SMP: Pairing Response (0x02) len 6
        IO capability: KeyboardDisplay (0x04)
        OOB data: Authentication data not present (0x00)
        Authentication requirement: Bonding, No MITM, SC, No Keypresses (0x09)
        Max encryption key size: 16
        Initiator key distribution: EncKey IdKey (0x03)
        Responder key distribution: EncKey IdKey (0x03)
zephyr.exe[1456215]: < HCI Command: Host Number of Completed Packets (0x03|0x0035) plen 5                            #55 6.169474
        Num handles: 1
        Handle: 738 Address: DF:A9:FF:F6:B1:1A (OUI DF-A9-FF)
        Count: 1
zephyr.exe[1456215]: < ACL Data TX: Handle 738 flags 0x00 dlen 27                                                    #56 6.169568
zephyr.exe[1456215]: < ACL Data TX: Handle 738 flags 0x01 dlen 27                                                    #57 6.169587
zephyr.exe[1456215]: < ACL Data TX: Handle 738 flags 0x01 dlen 15                                                    #58 6.169588
      SMP: Pairing Public Key (0x0c) len 64
        X: 68f6ada634ce84d11617383d57f070fe3445c38b33b569efa5eb771a0dc8aea5
        Y: 83c407aaa8337331fdc418e55085d75e6c1c6e5d42f8bf9c18fb5a2a7d4f31aa
> HCI Event: Number of Completed Packets (0x13) plen 5                                                               #59 6.213442
        Num handles: 1
        Handle: 738 Address: DF:A9:FF:F6:B1:1A (OUI DF-A9-FF)
        Count: 1
        #56: len 27 (5 Kb/s)
        Latency: 43 msec (43-43 msec ~43 msec)
> HCI Event: Number of Completed Packets (0x13) plen 5                                                               #60 6.214012
        Num handles: 1
        Handle: 738 Address: DF:A9:FF:F6:B1:1A (OUI DF-A9-FF)
        Count: 1
        #57: len 27 (4 Kb/s)
        Latency: 44 msec (43-44 msec ~44 msec)
> HCI Event: Number of Completed Packets (0x13) plen 5                                                               #61 6.214517
        Num handles: 1
        Handle: 738 Address: DF:A9:FF:F6:B1:1A (OUI DF-A9-FF)
        Count: 1
        #58: len 15 (2 Kb/s)
        Latency: 44 msec (43-44 msec ~44 msec)
> ACL Data RX: Handle 738 flags 0x02 dlen 27                                                                         #62 6.263613
> ACL Data RX: Handle 738 flags 0x01 dlen 27                                                                         #63 6.264246
> ACL Data RX: Handle 738 flags 0x01 dlen 15                                                                         #64 6.264548
      SMP: Pairing Public Key (0x0c) len 64
        X: ed626ba27ec4c39f591479541f2091f26e89ea4b9c8b097d4b679b3b515b9cab
        Y: d70ad26fab964ddb5068628947a4d50f3029ddbf079cbb79375ed5cfcfbf2a25
zephyr.exe[1456215]: < HCI Command: Host Number of Completed Packets (0x03|0x0035) plen 5                            #65 6.269523
        Num handles: 1
        Handle: 738 Address: DF:A9:FF:F6:B1:1A (OUI DF-A9-FF)
        Count: 1
zephyr.exe[1456215]: < HCI Command: Host Number of Completed Packets (0x03|0x0035) plen 5                            #66 6.269608
        Num handles: 1
        Handle: 738 Address: DF:A9:FF:F6:B1:1A (OUI DF-A9-FF)
        Count: 1
zephyr.exe[1456215]: < HCI Command: Host Number of Completed Packets (0x03|0x0035) plen 5                            #67 6.269716
        Num handles: 1
        Handle: 738 Address: DF:A9:FF:F6:B1:1A (OUI DF-A9-FF)
        Count: 1
> ACL Data RX: Handle 738 flags 0x02 dlen 21                                                                         #68 6.313696
      SMP: Pairing Confirm (0x03) len 16
        Confim value: 80dfcbc33daaf291979f958b6c506cb0
zephyr.exe[1456215]: < HCI Command: Host Number of Completed Packets (0x03|0x0035) plen 5                            #69 6.329790
        Num handles: 1
        Handle: 738 Address: DF:A9:FF:F6:B1:1A (OUI DF-A9-FF)
        Count: 1
zephyr.exe[1456215]: < ACL Data TX: Handle 738 flags 0x00 dlen 21                                                    #70 6.330027
      SMP: Pairing Random (0x04) len 16
        Random value: 555cc64d02679f89a05211af56d8b3da
> HCI Event: Number of Completed Packets (0x13) plen 5                                                               #71 6.363516
        Num handles: 1
        Handle: 738 Address: DF:A9:FF:F6:B1:1A (OUI DF-A9-FF)
        Count: 1
        #70: len 21 (5 Kb/s)
        Latency: 33 msec (33-44 msec ~39 msec)
> ACL Data RX: Handle 738 flags 0x02 dlen 21                                                                         #72 6.413707
      SMP: Pairing Random (0x04) len 16
        Random value: 9dfe37a3cbf00a1c0000000000000000
zephyr.exe[1456215]: < HCI Command: Host Number of Completed Packets (0x03|0x0035) plen 5                            #73 6.429684
        Num handles: 1
        Handle: 738 Address: DF:A9:FF:F6:B1:1A (OUI DF-A9-FF)
        Count: 1
zephyr.exe[1456215]: < ACL Data TX: Handle 738 flags 0x00 dlen 21                                                    #74 6.429820
      SMP: Pairing DHKey Check (0x0d) len 16
        E: 22daa6484a45e964117af9dbd4885bbf
> HCI Event: Number of Completed Packets (0x13) plen 5                                                               #75 6.463562
        Num handles: 1
        Handle: 738 Address: DF:A9:FF:F6:B1:1A (OUI DF-A9-FF)
        Count: 1
        #74: len 21 (5 Kb/s)
        Latency: 33 msec (33-44 msec ~36 msec)
> ACL Data RX: Handle 738 flags 0x02 dlen 21                                                                         #76 6.663752
      SMP: Pairing DHKey Check (0x0d) len 16
        E: 7ff4239b4f08904de8ef7995f0b8f362
zephyr.exe[1456215]: < HCI Command: LE Start Encryption (0x08|0x0019) plen 28                                        #77 6.669622
        Handle: 738 Address: DF:A9:FF:F6:B1:1A (OUI DF-A9-FF)
        Random number: 0x0000000000000000
        Encrypted diversifier: 0x0000
        Long term key: a5e8d0962e2c213ce419a7d5ef51d1e6
> HCI Event: Command Status (0x0f) plen 4                                                                            #78 6.670608
      LE Start Encryption (0x08|0x0019) ncmd 1
        Status: Success (0x00)
zephyr.exe[1456215]: < HCI Command: Host Number of Completed Packets (0x03|0x0035) plen 5                            #79 6.689517
        Num handles: 1
        Handle: 738 Address: DF:A9:FF:F6:B1:1A (OUI DF-A9-FF)
        Count: 1
> HCI Event: Encryption Change (0x08) plen 4                                                                         #80 7.013454
        Status: Success (0x00)
        Handle: 738 Address: DF:A9:FF:F6:B1:1A (OUI DF-A9-FF)
        Encryption: Enabled with AES-CCM (0x01)
> ACL Data RX: Handle 738 flags 0x02 dlen 21                                                                         #81 7.063642
      SMP: Identity Information (0x08) len 16
        Identity resolving key: 1584be7166ca86880b5d8d7776b201ff
zephyr.exe[1456215]: < HCI Command: Host Number of Completed Packets (0x03|0x0035) plen 5                            #82 7.069612
        Num handles: 1
        Handle: 738 Address: DF:A9:FF:F6:B1:1A (OUI DF-A9-FF)
        Count: 1
> ACL Data RX: Handle 738 flags 0x02 dlen 12                                                                         #83 7.113565
      SMP: Identity Address Information (0x09) len 7
        Address: DF:A9:FF:F6:B1:1A (OUI DF-A9-FF)
zephyr.exe[1456215]: < HCI Command: LE Add Device To Resolving List (0x08|0x0027) plen 39                            #84 7.129639
        Address type: Public (0x00)
        Address: DF:A9:FF:F6:B1:1A (OUI DF-A9-FF)
        Peer identity resolving key: 1584be7166ca86880b5d8d7776b201ff
        Local identity resolving key: 08aad2e1be87e47b88aeb19de6889efb
> HCI Event: Command Complete (0x0e) plen 4                                                                          #85 7.130675
      LE Add Device To Resolving List (0x08|0x0027) ncmd 1
        Status: Success (0x00)
zephyr.exe[1456215]: < HCI Command: LE Set Privacy Mode (0x08|0x004e) plen 8                                         #86 7.149570
        Peer Identity address type: Public (0x00)
        Peer Identity address: DF:A9:FF:F6:B1:1A (OUI DF-A9-FF)
        Privacy Mode: Use Device Privacy (0x01)
> HCI Event: Command Complete (0x0e) plen 4                                                                          #87 7.150176
      LE Set Privacy Mode (0x08|0x004e) ncmd 1
        Status: Success (0x00)
zephyr.exe[1456215]: < HCI Command: LE Set Address Resolution Enable (0x08|0x002d) plen 1                            #88 7.169536
        Address resolution: Enabled (0x01)
> HCI Event: Command Complete (0x0e) plen 4                                                                          #89 7.170087
      LE Set Address Resolution Enable (0x08|0x002d) ncmd 1
        Status: Success (0x00)
zephyr.exe[1456215]: < HCI Command: Host Number of Completed Packets (0x03|0x0035) plen 5                            #90 7.189439
        Num handles: 1
        Handle: 738 Address: DF:A9:FF:F6:B1:1A (OUI DF-A9-FF)
        Count: 1
zephyr.exe[1456215]: < ACL Data TX: Handle 738 flags 0x00 dlen 21                                                    #91 7.189520
      SMP: Identity Information (0x08) len 16
        Identity resolving key: 08aad2e1be87e47b88aeb19de6889efb
zephyr.exe[1456215]: < ACL Data TX: Handle 738 flags 0x00 dlen 12                                                    #92 7.189526
      SMP: Identity Address Information (0x09) len 7
        Address: D5:B6:CC:31:DB:3B (Static)
> HCI Event: Number of Completed Packets (0x13) plen 5                                                               #93 7.213450
        Num handles: 1
        Handle: 738 Address: DF:A9:FF:F6:B1:1A (OUI DF-A9-FF)
        Count: 1
        #91: len 21 (7 Kb/s)
        Latency: 23 msec (23-44 msec ~30 msec)
> HCI Event: Number of Completed Packets (0x13) plen 5                                                               #94 7.213998
        Num handles: 1
        Handle: 738 Address: DF:A9:FF:F6:B1:1A (OUI DF-A9-FF)
        Count: 1
        #92: len 12 (4 Kb/s)
        Latency: 24 msec (23-44 msec ~27 msec)
zephyr.exe[1456215]: < ACL Data TX: Handle 738 flags 0x00 dlen 11                                                    #95 7.229588
      ATT: Read By Type Request (0x08) len 6
        Handle range: 0x0001-0xffff
        Attribute type: Central Address Resolution (0x2aa6)
> HCI Event: Number of Completed Packets (0x13) plen 5                                                               #96 7.263559
        Num handles: 1
        Handle: 738 Address: DF:A9:FF:F6:B1:1A (OUI DF-A9-FF)
        Count: 1
        #95: len 11 (2 Kb/s)
        Latency: 33 msec (23-44 msec ~30 msec)
> ACL Data RX: Handle 738 flags 0x02 dlen 13                                                                         #97 7.413576
      ATT: Find By Type Value Request (0x06) len 8
        Handle range: 0x0001-0xffff
        Attribute type: Primary Service (0x2800)
          UUID: Generic Access Profile (0x1800)
zephyr.exe[1456215]: < HCI Command: Host Number of Completed Packets (0x03|0x0035) plen 5                            #98 7.429576
        Num handles: 1
        Handle: 738 Address: DF:A9:FF:F6:B1:1A (OUI DF-A9-FF)
        Count: 1
zephyr.exe[1456215]: < ACL Data TX: Handle 738 flags 0x00 dlen 9                                                     #99 7.429652
      ATT: Find By Type Value Response (0x07) len 4
        Handle range: 0x000b-0x0013
> ACL Data RX: Handle 738 flags 0x02 dlen 9                                                                         #100 7.463554
      ATT: Read By Type Response (0x09) len 4
        Attribute data length: 3
        Attribute data list: 1 entry
        Handle: 0x000f
        Value: 01
> HCI Event: Number of Completed Packets (0x13) plen 5                                                              #101 7.463898
        Num handles: 1
        Handle: 738 Address: DF:A9:FF:F6:B1:1A (OUI DF-A9-FF)
        Count: 1
        #99: len 9 (2 Kb/s)
        Latency: 34 msec (23-44 msec ~32 msec)
zephyr.exe[1456215]: < HCI Command: Host Number of Completed Packets (0x03|0x0035) plen 5                           #102 7.469862
        Num handles: 1
        Handle: 738 Address: DF:A9:FF:F6:B1:1A (OUI DF-A9-FF)
        Count: 1
> ACL Data RX: Handle 738 flags 0x02 dlen 13                                                                        #103 7.513630
      ATT: Find By Type Value Request (0x06) len 8
        Handle range: 0x0014-0xffff
        Attribute type: Primary Service (0x2800)
          UUID: Generic Access Profile (0x1800)
zephyr.exe[1456215]: < HCI Command: Host Number of Completed Packets (0x03|0x0035) plen 5                           #104 7.529840
        Num handles: 1
        Handle: 738 Address: DF:A9:FF:F6:B1:1A (OUI DF-A9-FF)
        Count: 1
zephyr.exe[1456215]: < ACL Data TX: Handle 738 flags 0x00 dlen 9                                                    #105 7.530044
      ATT: Error Response (0x01) len 4
        Find By Type Value Request (0x06)
        Handle: 0x0014
        Error: Attribute Not Found (0x0a)
> HCI Event: Number of Completed Packets (0x13) plen 5                                                              #106 7.563563
        Num handles: 1
        Handle: 738 Address: DF:A9:FF:F6:B1:1A (OUI DF-A9-FF)
        Count: 1
        #105: len 9 (2 Kb/s)
        Latency: 33 msec (23-44 msec ~32 msec)
> ACL Data RX: Handle 738 flags 0x02 dlen 11                                                                        #107 7.613618
      ATT: Read By Type Request (0x08) len 6
        Handle range: 0x000b-0x0013
        Attribute type: Characteristic (0x2803)
zephyr.exe[1456215]: < HCI Command: Host Number of Completed Packets (0x03|0x0035) plen 5                           #108 7.629675
        Num handles: 1
        Handle: 738 Address: DF:A9:FF:F6:B1:1A (OUI DF-A9-FF)
        Count: 1
zephyr.exe[1456215]: < ACL Data TX: Handle 738 flags 0x00 dlen 20                                                   #109 7.629815
      ATT: Read By Type Response (0x09) len 15
        Attribute data length: 7
        Attribute data list: 2 entries
        Handle: 0x000c
        Value: 0a0d00002a
            Properties: 0x0a
              Read (0x02)
              Write (0x08)
            Value Handle: 0x000d
            Value UUID: Device Name (0x2a00)
        Handle: 0x000e
        Value: 0a0f00012a
            Properties: 0x0a
              Read (0x02)
              Write (0x08)
            Value Handle: 0x000f
            Value UUID: Appearance (0x2a01)
> HCI Event: Number of Completed Packets (0x13) plen 5                                                              #110 7.663566
        Num handles: 1
        Handle: 738 Address: DF:A9:FF:F6:B1:1A (OUI DF-A9-FF)
        Count: 1
        #109: len 20 (4 Kb/s)
        Latency: 33 msec (23-44 msec ~33 msec)
> ACL Data RX: Handle 738 flags 0x02 dlen 11                                                                        #111 7.713653
      ATT: Read By Type Request (0x08) len 6
        Handle range: 0x000f-0x0013
        Attribute type: Characteristic (0x2803)
zephyr.exe[1456215]: < HCI Command: Host Number of Completed Packets (0x03|0x0035) plen 5                           #112 7.729498
        Num handles: 1
        Handle: 738 Address: DF:A9:FF:F6:B1:1A (OUI DF-A9-FF)
        Count: 1
zephyr.exe[1456215]: < ACL Data TX: Handle 738 flags 0x00 dlen 20                                                   #113 7.729605
      ATT: Read By Type Response (0x09) len 15
        Attribute data length: 7
        Attribute data list: 2 entries
        Handle: 0x0010
        Value: 021100a62a
            Properties: 0x02
              Read (0x02)
            Value Handle: 0x0011
            Value UUID: Central Address Resolution (0x2aa6)
        Handle: 0x0012
        Value: 021300042a
            Properties: 0x02
              Read (0x02)
            Value Handle: 0x0013
            Value UUID: Peripheral Preferred Connection Parameters (0x2a04)
> HCI Event: Number of Completed Packets (0x13) plen 5                                                              #114 7.763645
        Num handles: 1
        Handle: 738 Address: DF:A9:FF:F6:B1:1A (OUI DF-A9-FF)
        Count: 1
        #113: len 20 (4 Kb/s)
        Latency: 34 msec (23-44 msec ~33 msec)
> ACL Data RX: Handle 738 flags 0x02 dlen 11                                                                        #115 7.813609
      ATT: Read By Type Request (0x08) len 6
        Handle range: 0x0013-0x0013
        Attribute type: Characteristic (0x2803)
zephyr.exe[1456215]: < HCI Command: Host Number of Completed Packets (0x03|0x0035) plen 5                           #116 7.829960
        Num handles: 1
        Handle: 738 Address: DF:A9:FF:F6:B1:1A (OUI DF-A9-FF)
        Count: 1
zephyr.exe[1456215]: < ACL Data TX: Handle 738 flags 0x00 dlen 9                                                    #117 7.830131
      ATT: Error Response (0x01) len 4
        Read By Type Request (0x08)
        Handle: 0x0013
        Error: Attribute Not Found (0x0a)
> HCI Event: Number of Completed Packets (0x13) plen 5                                                              #118 7.863428
        Num handles: 1
        Handle: 738 Address: DF:A9:FF:F6:B1:1A (OUI DF-A9-FF)
        Count: 1
        #117: len 9 (2 Kb/s)
        Latency: 33 msec (23-44 msec ~33 msec)
> ACL Data RX: Handle 738 flags 0x02 dlen 7                                                                         #119 7.913434
      ATT: Read Request (0x0a) len 2
        Handle: 0x0011
zephyr.exe[1456215]: < HCI Command: Host Number of Completed Packets (0x03|0x0035) plen 5                           #120 7.929980
        Num handles: 1
        Handle: 738 Address: DF:A9:FF:F6:B1:1A (OUI DF-A9-FF)
        Count: 1
zephyr.exe[1456215]: < ACL Data TX: Handle 738 flags 0x00 dlen 6                                                    #121 7.930141
      ATT: Read Response (0x0b) len 1
> HCI Event: Number of Completed Packets (0x13) plen 5                                                              #122 7.963468
        Num handles: 1
        Handle: 738 Address: DF:A9:FF:F6:B1:1A (OUI DF-A9-FF)
        Count: 1
        #121: len 6 (1 Kb/s)
        Latency: 33 msec (23-44 msec ~33 msec)
zephyr.exe[1456215]: < HCI Command: Disconnect (0x01|0x0006) plen 3                                                 #123 8.009703
        Handle: 738 Address: DF:A9:FF:F6:B1:1A (OUI DF-A9-FF)
        Reason: Remote User Terminated Connection (0x13)
> HCI Event: Command Status (0x0f) plen 4                                                                           #124 8.010167
      Disconnect (0x01|0x0006) ncmd 1
        Status: Success (0x00)
> HCI Event: Disconnect Complete (0x05) plen 4                                                                      #125 8.063353
        Status: Success (0x00)
        Handle: 738 Address: DF:A9:FF:F6:B1:1A (OUI DF-A9-FF)
        Reason: Connection Terminated By Local Host (0x16)
zephyr.exe[1456215]: < HCI Command: LE Extended Create Connection (0x08|0x0043) plen 26                             #126 9.049941
        Filter policy: Accept list is not used (0x00)
        Own address type: Random (0x03)
        Peer address type: Public