Bluetooth monitor ver 5.84
btmon[838225]: = Note: Linux version 6.8.0-83-generic (x86_64)                                                           0.758526
btmon[838225]: = Note: Bluetooth subsystem version 2.22                                                                  0.758528
= New Index: 00:00:00:00:00:00 (Primary,UART,hci0)                                                                       0.758529
= Open Index: 00:00:00:00:00:00                                                                                          0.765841
= Index Info: 00:00:00:00:00:00 (Nordic Semiconductor ASA)                                                               0.765846
zephyr.exe[838227]: @ USER Open: main (privileged) version 2.22                                                 {0x0001} 0.765848
zephyr.exe[838227]: < HCI Command: Reset (0x03|0x0003) plen 0                                                         #1 0.766024
> HCI Event: Command Complete (0x0e) plen 4                                                                           #2 0.766662
      Reset (0x03|0x0003) ncmd 1
        Status: Success (0x00)
zephyr.exe[838227]: < HCI Command: Read Local Supported Features (0x04|0x0003) plen 0                                 #3 0.785798
> HCI Event: Command Complete (0x0e) plen 12                                                                          #4 0.786606
      Read Local Supported Features (0x04|0x0003) ncmd 1
        Status: Success (0x00)
        Features: 0x00 0x00 0x00 0x00 0x60 0x00 0x00 0x00
          BR/EDR Not Supported
          LE Supported (Controller)
zephyr.exe[838227]: < HCI Command: Read Local Version Information (0x04|0x0001) plen 0                                #5 0.805789
> HCI Event: Command Complete (0x0e) plen 12                                                                          #6 0.806776
      Read Local Version Information (0x04|0x0001) ncmd 1
        Status: Success (0x00)
        HCI version: Reserved (0x0e) - Revision 12520 (0x30e8)
        LMP version: Reserved (0x0e) - Subversion 12520 (0x30e8)
        Manufacturer: Nordic Semiconductor ASA (89)
zephyr.exe[838227]: < HCI Command: Read Local Supported Commands (0x04|0x0002) plen 0                                 #7 0.825763
> HCI Event: Command Complete (0x0e) plen 68                                                                          #8 0.827036
      Read Local Supported Commands (0x04|0x0002) ncmd 1
        Status: Success (0x00)
        Commands: 119 entries
          Disconnect (Octet 0 - Bit 5)
          Read Remote Version Information (Octet 2 - Bit 7)
          Set Event Mask (Octet 5 - Bit 6)
          Reset (Octet 5 - Bit 7)
          Read Connection Accept Timeout (Octet 7 - Bit 2)
          Write Connection Accept Timeout (Octet 7 - Bit 3)
          Read Transmit Power Level (Octet 10 - Bit 2)
          Set Controller To Host Flow Control (Octet 10 - Bit 5)
          Host Buffer Size (Octet 10 - Bit 6)
          Host Number of Completed Packets (Octet 10 - Bit 7)
          Read Local Version Information (Octet 14 - Bit 3)
          Read Local Supported Features (Octet 14 - Bit 5)
          Read BD ADDR (Octet 15 - Bit 1)
          Read RSSI (Octet 15 - Bit 5)
          Set Event Mask Page 2 (Octet 22 - Bit 2)
          LE Set Event Mask (Octet 25 - Bit 0)
          LE Read Buffer Size (Octet 25 - Bit 1)
          LE Read Local Supported Features (Octet 25 - Bit 2)
          LE Set Random Address (Octet 25 - Bit 4)
          LE Set Advertising Parameters (Octet 25 - Bit 5)
          LE Read Advertising Channel TX Power (Octet 25 - Bit 6)
          LE Set Advertising Data (Octet 25 - Bit 7)
          LE Set Scan Response Data (Octet 26 - Bit 0)
          LE Set Advertise Enable (Octet 26 - Bit 1)
          LE Set Scan Parameters (Octet 26 - Bit 2)
          LE Set Scan Enable (Octet 26 - Bit 3)
          LE Create Connection (Octet 26 - Bit 4)
          LE Create Connection Cancel (Octet 26 - Bit 5)
          LE Read Accept List Size (Octet 26 - Bit 6)
          LE Clear Accept List (Octet 26 - Bit 7)
          LE Add Device To Accept List (Octet 27 - Bit 0)
          LE Remove Device From Accept List (Octet 27 - Bit 1)
          LE Connection Update (Octet 27 - Bit 2)
          LE Set Host Channel Classification (Octet 27 - Bit 3)
          LE Read Channel Map (Octet 27 - Bit 4)
          LE Read Remote Used Features (Octet 27 - Bit 5)
          LE Encrypt (Octet 27 - Bit 6)
          LE Rand (Octet 27 - Bit 7)
          LE Start Encryption (Octet 28 - Bit 0)
          LE Long Term Key Request Reply (Octet 28 - Bit 1)
          LE Long Term Key Request Neg Reply (Octet 28 - Bit 2)
          LE Read Supported States (Octet 28 - Bit 3)
          LE Receiver Test (Octet 28 - Bit 4)
          LE Transmitter Test (Octet 28 - Bit 5)
          LE Test End (Octet 28 - Bit 6)
          Read Authenticated Payload Timeout (Octet 32 - Bit 4)
          Write Authenticated Payload Timeout (Octet 32 - Bit 5)
          LE Set Data Length (Octet 33 - Bit 6)
          LE Read Suggested Default Data Length (Octet 33 - Bit 7)
          LE Write Suggested Default Data Length (Octet 34 - Bit 0)
          LE Add Device To Resolving List (Octet 34 - Bit 3)
          LE Remove Device From Resolving List (Octet 34 - Bit 4)
          LE Clear Resolving List (Octet 34 - Bit 5)
          LE Read Resolving List Size (Octet 34 - Bit 6)
          LE Set Address Resolution Enable (Octet 35 - Bit 1)
          LE Set Resolvable Private Address Timeout (Octet 35 - Bit 2)
          LE Read Maximum Data Length (Octet 35 - Bit 3)
          LE Read PHY (Octet 35 - Bit 4)
          LE Set Default PHY (Octet 35 - Bit 5)
          LE Set PHY (Octet 35 - Bit 6)
          LE Enhanced Receiver Test (Octet 35 - Bit 7)
          LE Enhanced Transmitter Test (Octet 36 - Bit 0)
          LE Set Advertising Set Random Address (Octet 36 - Bit 1)
          LE Set Extended Advertising Parameters (Octet 36 - Bit 2)
          LE Set Extended Advertising Data (Octet 36 - Bit 3)
          LE Set Extended Scan Response Data (Octet 36 - Bit 4)
          LE Set Extended Advertising Enable (Octet 36 - Bit 5)
          LE Read Maximum Advertising Data Length (Octet 36 - Bit 6)
          LE Read Number of Supported Advertising Sets (Octet 36 - Bit 7)
          LE Remove Advertising Set (Octet 37 - Bit 0)
          LE Clear Advertising Sets (Octet 37 - Bit 1)
          LE Set Periodic Advertising Parameters (Octet 37 - Bit 2)
          LE Set Periodic Advertising Data (Octet 37 - Bit 3)
          LE Set Periodic Advertising Enable (Octet 37 - Bit 4)
          LE Set Extended Scan Parameters (Octet 37 - Bit 5)
          LE Set Extended Scan Enable (Octet 37 - Bit 6)
          LE Extended Create Connection (Octet 37 - Bit 7)
          LE Periodic Advertising Create Sync (Octet 38 - Bit 0)
          LE Periodic Advertising Create Sync Cancel (Octet 38 - Bit 1)
          LE Periodic Advertising Terminate Sync (Octet 38 - Bit 2)
          LE Add Device To Periodic Advertiser List (Octet 38 - Bit 3)
          LE Remove Device From Periodic Advertiser List (Octet 38 - Bit 4)
          LE Clear Periodic Advertiser List (Octet 38 - Bit 5)
          LE Read Periodic Advertiser List Size (Octet 38 - Bit 6)
          LE Read Transmit Power (Octet 38 - Bit 7)
          LE Read RF Path Compensation (Octet 39 - Bit 0)
          LE Write RF Path Compensation (Octet 39 - Bit 1)
          LE Set Privacy Mode (Octet 39 - Bit 2)
          LE Periodic Advertising Receive Enable (Octet 40 - Bit 5)
          LE Periodic Advertising Sync Transfer (Octet 40 - Bit 6)
          LE Periodic Advertising Set Info Transfer (Octet 40 - Bit 7)
          LE Periodic Advertising Sync Transfer Parameters (Octet 41 - Bit 0)
          LE Set Default Periodic Advertisng Sync Transfer Parameters (Octet 41 - Bit 1)
          LE Read Buffer v2 (Octet 41 - Bit 5)
          LE Read ISO TX Sync (Octet 41 - Bit 6)
          LE Set Connected Isochronous Group Parameters (Octet 41 - Bit 7)
          LE Set Connected Isochronous Group Parameters Test (Octet 42 - Bit 0)
          LE Create Connected Isochronous Stream (Octet 42 - Bit 1)
          LE Remove Connected Isochronous Group (Octet 42 - Bit 2)
          LE Accept Connected Isochronous Stream Request (Octet 42 - Bit 3)
          LE Reject Connected Isochronous Stream Request (Octet 42 - Bit 4)
          LE Create Broadcast Isochronous Group (Octet 42 - Bit 5)
          LE Create Broadcast Isochronous Group Test (Octet 42 - Bit 6)
          LE Terminate Broadcast Isochronous Group (Octet 42 - Bit 7)
          LE Broadcast Isochronous Group Create Sync (Octet 43 - Bit 0)
          LE Broadcast Isochronous Group Terminate Sync (Octet 43 - Bit 1)
          LE Request Peer SCA (Octet 43 - Bit 2)
          LE Setup Isochronous Data Path (Octet 43 - Bit 3)
          LE Remove Isochronous Data Path (Octet 43 - Bit 4)
          LE Isochronous Transmit Test (Octet 43 - Bit 5)
          LE Isochronous Receive Test (Octet 43 - Bit 6)
          LE Isochronous Read Test Counters (Octet 43 - Bit 7)
          LE Isochronous Read Test Counters (Octet 44 - Bit 0)
          LE Set Host Feature (Octet 44 - Bit 1)
          LE Read ISO link quality (Octet 44 - Bit 2)
          Octet 45 - Bit 6 
          Octet 46 - Bit 0 
          Octet 46 - Bit 1 
          Octet 46 - Bit 2 
zephyr.exe[838227]: < HCI Command: Host Buffer Size (0x03|0x0033) plen 7                                              #9 0.845791
        ACL MTU: 255  ACL max packet: 16
        SCO MTU: 0    SCO max packet: 0
> HCI Event: Command Complete (0x0e) plen 4                                                                          #10 0.846644
      Host Buffer Size (0x03|0x0033) ncmd 1
        Status: Success (0x00)
zephyr.exe[838227]: < HCI Command: Set Controller To Host Flow Control (0x03|0x0031) plen 1                          #11 0.865792
        Flow control: ACL Data Packets (0x01)
> HCI Event: Command Complete (0x0e) plen 4                                                                          #12 0.866508
      Set Controller To Host Flow Control (0x03|0x0031) ncmd 1
        Status: Success (0x00)
zephyr.exe[838227]: < HCI Command: LE Read Local Supported Features (0x08|0x0003) plen 0                             #13 0.885794
> HCI Event: Command Complete (0x0e) plen 12                                                                         #14 0.886511
      LE Read Local Supported Features (0x08|0x0003) ncmd 1
        Status: Success (0x00)
        Features: 0xfd 0x79 0x00 0xf7 0x30 0x01 0x00 0x00
          LE Encryption
          Extended Reject Indication
          Peripheral-initiated Features Exchange
          LE Ping
          LE Data Packet Length Extension
          LL Privacy
          Extended Scanner Filter Policies
          LE 2M PHY
          LE Coded PHY
          LE Extended Advertising
          LE Periodic Advertising
          Channel Selection Algorithm #2
          Periodic Advertising Sync Transfer - Sender
          Periodic Advertising Sync Transfer - Recipient
          Sleep Clock Accuracy Updates
          Connected Isochronous Stream - Central
          Connected Isochronous Stream - Peripheral
          Isochronous Broadcaster
          Synchronized Receiver
          Periodic Advertising ADI support
          Connection Subrating
          Unknown features (0x0000010000000000)
zephyr.exe[838227]: < HCI Command: LE Set Host Feature (0x08|0x0074) plen 2                                          #15 0.905793
        Bit Number: 32
          Connected Isochronous Stream (Host Support)
        Bit Value: 1
> HCI Event: Command Complete (0x0e) plen 4                                                                          #16 0.906324
      LE Set Host Feature (0x08|0x0074) ncmd 1
        Status: Success (0x00)
zephyr.exe[838227]: < HCI Command: LE Read Buffer v2 (0x08|0x0060) plen 0                                            #17 0.925789
> HCI Event: Command Complete (0x0e) plen 10                                                                         #18 0.926391
      LE Read Buffer v2 (0x08|0x0060) ncmd 1
        Status: Success (0x00)
        ACL MTU: 27
        ACL max packet: 3
        ISO MTU: 318
        ISO max packet: 3
zephyr.exe[838227]: < HCI Command: LE Read Maximum Advertising Data Length (0x08|0x003a) plen 0                      #19 0.945787
> HCI Event: Command Complete (0x0e) plen 6                                                                          #20 0.946657
      LE Read Maximum Advertising Data Length (0x08|0x003a) ncmd 1
        Status: Success (0x00)
        Max length: 1650
zephyr.exe[838227]: < HCI Command: LE Read Supported States (0x08|0x001c) plen 0                                     #21 0.965805
> HCI Event: Command Complete (0x0e) plen 12                                                                         #22 0.966665
      LE Read Supported States (0x08|0x001c) ncmd 1
        Status: Success (0x00)
        States: 0x000003ff3e0306ff
          Non-connectable Advertising State
          Scannable Advertising State
          Connectable Advertising State
          High Duty Cycle Directed Advertising State
          Passive Scanning State
          Active Scanning State
          Initiating State
            and Connection State (Central Role)
          Connection State (Peripheral Role)
          Scannable Advertising State
            and Passive Scanning State
          Connectable Advertising State
            and Passive Scanning State
          Non-connectable Advertising State
            and Initiating State
          Scannable Advertising State
            and Initiating State
          Active Scanning State
            and Connection State (Central Role)
          Passive Scanning State
            and Connection State (Peripheral Role)
          Active Scanning State
            and Connection State (Peripheral Role)
          Initiating State
            and Connection State (Central Role)
            and Central Role & Central Role
          Low Duty Cycle Directed Advertising State
          Connectable Advertising State
            and Initiating State
            and Central Role & Peripheral Role
          High Duty Cycle Directed Advertising State
            and Initiating State
            and Central Role & Peripheral Role
          Low Duty Cycle Directed Advertising State
            and Initiating State
            and Central Role & Peripheral Role
          Connectable Advertising State
            and Connection State (Central Role)
            and Central Role & Peripheral Role
          High Duty Cycle Directed Advertising State
            and Connection State (Central Role)
            and Central Role & Peripheral Role
          Low Duty Cycle Directed Advertising State
            and Connection State (Central Role)
            and Central Role & Peripheral Role
          Connectable Advertising State
            and Connection State (Peripheral Role)
            and Central Role & Peripheral Role
          High Duty Cycle Directed Advertising State
            and Connection State (Peripheral Role)
            and Peripheral Role & Peripheral Role
          Low Duty Cycle Directed Advertising State
            and Connection State (Peripheral Role)
            and Peripheral Role & Peripheral Role
          Initiating State
            and Connection State (Peripheral Role)
            and Central Role & Peripheral Role
zephyr.exe[838227]: < HCI Command: LE Read Maximum Data Length (0x08|0x002f) plen 0                                  #23 0.985796
> HCI Event: Command Complete (0x0e) plen 12                                                                         #24 0.986633
      LE Read Maximum Data Length (0x08|0x002f) ncmd 1
        Status: Success (0x00)
        Max TX octets: 251
        Max TX time: 2704
        Max RX octets: 251
        Max RX time: 2704
zephyr.exe[838227]: < HCI Command: LE Write Suggested Default Data Length (0x08|0x0024) plen 4                       #25 1.005792
        TX octets: 251
        TX time: 2704
> HCI Event: Command Complete (0x0e) plen 4                                                                          #26 1.007686
      LE Write Suggested Default Data Length (0x08|0x0024) ncmd 1
        Status: Success (0x00)
zephyr.exe[838227]: < HCI Command: LE Read Resolving List Size (0x08|0x002a) plen 0                                  #27 1.025785
> HCI Event: Command Complete (0x0e) plen 5                                                                          #28 1.026195
      LE Read Resolving List Size (0x08|0x002a) ncmd 1
        Status: Success (0x00)
        Size: 8
zephyr.exe[838227]: < HCI Command: LE Set Event Mask (0x08|0x0001) plen 8                                            #29 1.045791
        Mask: 0x000002023f87fa5e
          LE Advertising Report
          LE Connection Update Complete
          LE Read Remote Used Features Complete
          LE Long Term Key Request
          LE Data Length Change
          LE Enhanced Connection Complete
          LE PHY Update Complete
          LE Extended Advertising Report
          LE Periodic Advertising Sync Established
          LE Periodic Advertising Report
          LE Periodic Advertising Sync Lost
          LE Extended Scan Timeout
          LE Extended Advertising Set Terminated
          LE Scan Request Received
          LE Periodic Advertising Sync Transfer Rvc
          LE CIS Established
          LE CIS Request
          LE Create BIG Complete
          LE Terminate BIG Complete
          LE BIG Sync Established Complete
          LE BIG Sync Lost
          LE BIG Info Advertising Report
          Unknown mask (0x0000020000000000)
> HCI Event: Command Complete (0x0e) plen 4                                                                          #30 1.046826
      LE Set Event Mask (0x08|0x0001) ncmd 1
        Status: Success (0x00)
zephyr.exe[838227]: < HCI Command: Set Event Mask (0x03|0x0001) plen 8                                               #31 1.065796
        Mask: 0x2000800002008890
          Disconnection Complete
          Encryption Change
          Read Remote Version Information Complete
          Hardware Error
          Data Buffer Overflow
          Encryption Key Refresh Complete
          LE Meta
> HCI Event: Command Complete (0x0e) plen 4                                                                          #32 1.067070
      Set Event Mask (0x03|0x0001) ncmd 1
        Status: Success (0x00)
zephyr.exe[838227]: < HCI Command: Read BD ADDR (0x04|0x0009) plen 0                                                 #33 1.085795
> HCI Event: Command Complete (0x0e) plen 10                                                                         #34 1.086944
      Read BD ADDR (0x04|0x0009) ncmd 1
        Status: Success (0x00)
        Address: 00:00:00:00:00:00 (OUI 00-00-00)
zephyr.exe[838227]: < HCI Command: LE Set Random Address (0x08|0x0005) plen 6                                        #35 1.105804
        Address: D5:B6:CC:31:DB:3B (Static)
> HCI Event: Command Complete (0x0e) plen 4                                                                          #36 1.106466
      LE Set Random Address (0x08|0x0005) ncmd 1
        Status: Success (0x00)
zephyr.exe[838227]: < HCI Command: LE Set Extended Advertising Parameters (0x08|0x0036) plen 25                      #37 1.785861
        Handle: 0x00
        Properties: 0x0001
          Connectable
        Min advertising interval: 100.000 msec (0x00a0)
        Max advertising interval: 150.000 msec (0x00f0)
        Channel map: 37, 38, 39 (0x07)
        Own address type: Random (0x01)
        Peer address type: Public (0x00)
        Peer address: 00:00:00:00:00:00 (OUI 00-00-00)
        Filter policy: Allow Scan Request from Any, Allow Connect Request from Any (0x00)
        TX power: Host has no preference (0x7f)
        Primary PHY: LE 1M (0x01)
        Secondary max skip: 0x00
        Secondary PHY: LE 2M (0x02)
        SID: 0x00
        Scan request notifications: Disabled (0x00)
> HCI Event: Command Complete (0x0e) plen 5                                                                          #38 1.787040
      LE Set Extended Advertising Parameters (0x08|0x0036) ncmd 1
        Status: Success (0x00)
        TX power (selected): 0 dbm (0x00)
zephyr.exe[838227]: < HCI Command: LE Set Advertising Set Random Address (0x08|0x0035) plen 7                        #39 1.805806
        Advertising handle: 0x00
        Advertising random address: D5:B6:CC:31:DB:3B (Static)
> HCI Event: Command Complete (0x0e) plen 4                                                                          #40 1.806633
      LE Set Advertising Set Random Address (0x08|0x0035) ncmd 1
        Status: Success (0x00)
zephyr.exe[838227]: < HCI Command: LE Set Extended Advertising Data (0x08|0x0037) plen 39                            #41 1.825809
        Handle: 0x00
        Operation: Complete extended advertising data (0x03)
        Fragment preference: Minimize fragmentation (0x01)
        Data length: 0x23
        Flags: 0x06
          LE General Discoverable Mode
          BR/EDR Not Supported
        Name (complete): Tester_F6B11A
        Flags: 0x06
          LE General Discoverable Mode
          BR/EDR Not Supported
        16-bit Service UUIDs (complete): 1 entry
          Audio Stream Control (0x184e)
        Service Data: Audio Stream Control (0x184e)
          Data[6]: 01ff0fff0f00
> HCI Event: Command Complete (0x0e) plen 4                                                                          #42 1.826897
      LE Set Extended Advertising Data (0x08|0x0037) ncmd 1
        Status: Success (0x00)
zephyr.exe[838227]: < HCI Command: LE Set Extended Advertising Enable (0x08|0x0039) plen 6                           #43 1.845808
        Extended advertising: Enabled (0x01)
        Number of sets: 1 (0x01)
        Entry 0
          Handle: 0x00
          Duration: 0 ms (0x00)
          Max ext adv events: 0
> HCI Event: Command Complete (0x0e) plen 4                                                                          #44 1.846688
      LE Set Extended Advertising Enable (0x08|0x0039) ncmd 1
        Status: Success (0x00)
> HCI Event: LE Meta Event (0x3e) plen 31                                                                            #45 3.424382
      LE Enhanced Connection Complete (0x0a)
        Status: Success (0x00)
        Handle: 201
        Role: Peripheral (0x01)
        Peer address type: Public (0x00)
        Peer address: DF:A9:FF:F6:B1:1A (OUI DF-A9-FF)
        Local resolvable private address: 00:00:00:00:00:00 (Non-Resolvable)
        Peer resolvable private address: 00:00:00:00:00:00 (Non-Resolvable)
        Connection interval: 60.00 msec (0x0030)
        Connection latency: 0 (0x0000)
        Supervision timeout: 25120 msec (0x09d0)
        Central clock accuracy: 0x01
> HCI Event: LE Meta Event (0x3e) plen 6                                                                             #46 3.424535
      LE Advertising Set Terminated (0x12)
        Status: Success (0x00)
        Handle: 0
        Connection handle: 201
        Number of completed extended advertising events: 0
zephyr.exe[838227]: < HCI Command: LE Read Remote Used Features (0x08|0x0016) plen 2                                 #47 3.425951
        Handle: 201 Address: DF:A9:FF:F6:B1:1A (OUI DF-A9-FF)
> HCI Event: Command Status (0x0f) plen 4                                                                            #48 3.426584
      LE Read Remote Used Features (0x08|0x0016) ncmd 1
        Status: Success (0x00)
zephyr.exe[838227]: < ACL Data TX: Handle 201 [1/3] flags 0x00 dlen 7                                                #49 3.445868
      ATT: Exchange MTU Request (0x02) len 2
        Client RX MTU: 251
> HCI Event: Number of Completed Packets (0x13) plen 5                                                               #50 3.546731
        Num handles: 1
        Handle: 201 Address: DF:A9:FF:F6:B1:1A (OUI DF-A9-FF)
        Count: 1
        Buffers: 0/3
        #49: len 7 (0 Kb/s)
        Latency: 100 msec (100-100 msec ~100 msec)
> HCI Event: LE Meta Event (0x3e) plen 12                                                                            #51 3.606686
      LE Read Remote Used Features (0x04)
        Status: Success (0x00)
        Handle: 201 Address: DF:A9:FF:F6:B1:1A (OUI DF-A9-FF)
        Features: 0x2d 0x49 0x00 0xf7 0x67 0xd8 0x00 0x00
          LE Encryption
          Extended Reject Indication
          Peripheral-initiated Features Exchange
          LE Data Packet Length Extension
          LE 2M PHY
          LE Coded PHY
          Channel Selection Algorithm #2
          Periodic Advertising Sync Transfer - Sender
          Periodic Advertising Sync Transfer - Recipient
          Sleep Clock Accuracy Updates
          Connected Isochronous Stream - Central
          Connected Isochronous Stream - Peripheral
          Isochronous Broadcaster
          Synchronized Receiver
          Connected Isochronous Stream (Host Support)
          LE Power Control Request
          LE Power Control Request
          Connection Subrating
          Connection Subrating (Host Support)
          Unknown features (0x0000d80000000000)
> ACL Data RX: Handle 201 flags 0x02 dlen 7                                                                          #52 3.906494
      ATT: Exchange MTU Request (0x02) len 2
        Client RX MTU: 64
> ACL Data RX: Handle 201 flags 0x02 dlen 7                                                                          #53 3.906602
      ATT: Exchange MTU Response (0x03) len 2
        Server RX MTU: 64
zephyr.exe[838227]: < HCI Command: Host Number of Completed Packets (0x03|0x0035) plen 5                             #54 3.925939
        Num handles: 1
        Handle: 201 Address: DF:A9:FF:F6:B1:1A (OUI DF-A9-FF)
        Count: 1
zephyr.exe[838227]: < ACL Data TX: Handle 201 [1/3] flags 0x00 dlen 7                                                #55 3.925970
      ATT: Exchange MTU Response (0x03) len 2
        Server RX MTU: 251
zephyr.exe[838227]: < HCI Command: Host Number of Completed Packets (0x03|0x0035) plen 5                             #56 3.925987
        Num handles: 1
        Handle: 201 Address: DF:A9:FF:F6:B1:1A (OUI DF-A9-FF)
        Count: 1
zephyr.exe[838227]: < HCI Command: LE Remove Advertising Set (0x08|0x003c) plen 1                                    #57 3.955848
        Handle: 0
> HCI Event: Command Complete (0x0e) plen 4                                                                          #58 3.956263
      LE Remove Advertising Set (0x08|0x003c) ncmd 1
        Status: Success (0x00)
zephyr.exe[838227]: < HCI Command: LE Set Extended Advertising Parameters (0x08|0x0036) plen 25                      #59 3.965831
        Handle: 0x00
        Properties: 0x0001
          Connectable
        Min advertising interval: 100.000 msec (0x00a0)
        Max advertising interval: 150.000 msec (0x00f0)
        Channel map: 37, 38, 39 (0x07)
        Own address type: Random (0x01)
        Peer address type: Public (0x00)
        Peer address: 00:00:00:00:00:00 (OUI 00-00-00)
        Filter policy: Allow Scan Request from Any, Allow Connect Request from Any (0x00)
        TX power: Host has no preference (0x7f)
        Primary PHY: LE 1M (0x01)
        Secondary max skip: 0x00
        Secondary PHY: LE 2M (0x02)
        SID: 0x01
        Scan request notifications: Disabled (0x00)
> HCI Event: Command Complete (0x0e) plen 5                                                                          #60 3.966829
      LE Set Extended Advertising Parameters (0x08|0x0036) ncmd 1
        Status: Success (0x00)
        TX power (selected): 0 dbm (0x00)
zephyr.exe[838227]: < HCI Command: LE Set Advertising Set Random Address (0x08|0x0035) plen 7                        #61 3.985833
        Advertising handle: 0x00
        Advertising random address: D5:B6:CC:31:DB:3B (Static)
> HCI Event: Command Complete (0x0e) plen 4                                                                          #62 3.986471
      LE Set Advertising Set Random Address (0x08|0x0035) ncmd 1
        Status: Success (0x00)
zephyr.exe[838227]: < HCI Command: LE Set Extended Advertising Data (0x08|0x0037) plen 39                            #63 4.005826
        Handle: 0x00
        Operation: Complete extended advertising data (0x03)
        Fragment preference: Minimize fragmentation (0x01)
        Data length: 0x23
        Flags: 0x06
          LE General Discoverable Mode
          BR/EDR Not Supported
        Name (complete): Tester_F6B11A
        Flags: 0x06
          LE General Discoverable Mode
          BR/EDR Not Supported
        16-bit Service UUIDs (complete): 1 entry
          Audio Stream Control (0x184e)
        Service Data: Audio Stream Control (0x184e)
          Data[6]: 01ff0fff0f00
> HCI Event: Command Complete (0x0e) plen 4                                                                          #64 4.006954
      LE Set Extended Advertising Data (0x08|0x0037) ncmd 1
        Status: Success (0x00)
zephyr.exe[838227]: < HCI Command: LE Set Extended Advertising Enable (0x08|0x0039) plen 6                           #65 4.025826
        Extended advertising: Enabled (0x01)
        Number of sets: 1 (0x01)
        Entry 0
          Handle: 0x00
          Duration: 0 ms (0x00)
          Max ext adv events: 0
> HCI Event: Number of Completed Packets (0x13) plen 5                                                               #66 4.026662
        Num handles: 1
        Handle: 201 Address: DF:A9:FF:F6:B1:1A (OUI DF-A9-FF)
        Count: 1
        Buffers: 0/3
        #55: len 7 (0 Kb/s)
        Latency: 100 msec (100-100 msec ~100 msec)
> HCI Event: Command Complete (0x0e) plen 4                                                                          #67 4.026663
      LE Set Extended Advertising Enable (0x08|0x0039) ncmd 1
        Status: Success (0x00)
> ACL Data RX: Handle 201 flags 0x02 dlen 11                                                                         #68 6.006428
      SMP: Pairing Request (0x01) len 6
        IO capability: KeyboardDisplay (0x04)
        OOB data: Authentication data not present (0x00)
        Authentication requirement: Bonding, No MITM, SC, No Keypresses (0x09)
        Max encryption key size: 16
        Initiator key distribution: EncKey IdKey (0x03)
        Responder key distribution: EncKey IdKey Sign (0x07)
zephyr.exe[838227]: < HCI Command: Host Number of Completed Packets (0x03|0x0035) plen 5                             #69 6.025942
        Num handles: 1
        Handle: 201 Address: DF:A9:FF:F6:B1:1A (OUI DF-A9-FF)
        Count: 1
zephyr.exe[838227]: < ACL Data TX: Handle 201 [1/3] flags 0x00 dlen 11                                               #70 6.025965
      SMP: Pairing Response (0x02) len 6
        IO capability: NoInputNoOutput (0x03)
        OOB data: Authentication data not present (0x00)
        Authentication requirement: Bonding, No MITM, SC, No Keypresses (0x09)
        Max encryption key size: 16
        Initiator key distribution: IdKey (0x02)
        Responder key distribution: Sign (0x04)
> HCI Event: Number of Completed Packets (0x13) plen 5                                                               #71 6.126537
        Num handles: 1
        Handle: 201 Address: DF:A9:FF:F6:B1:1A (OUI DF-A9-FF)
        Count: 1
        Buffers: 0/3
        #70: len 11 (0 Kb/s)
        Latency: 100 msec (100-100 msec ~100 msec)
> ACL Data RX: Handle 201 flags 0x02 dlen 27                                                                         #72 6.126863
> ACL Data RX: Handle 201 flags 0x01 dlen 27                                                                         #73 6.127364
> ACL Data RX: Handle 201 flags 0x01 dlen 15                                                                         #74 6.127538
      SMP: Pairing Public Key (0x0c) len 64
        X[32]: 909af899b709a64ec5f6375b8896699ffbe9fecb73c65e23b5e8cfe0243c95ff
        Y[32]: 29e0ded4ba1e7cd7f979d3c9e02a43dfea2dcd0a71b02555f42aea84cf8a1fe3
zephyr.exe[838227]: < HCI Command: Host Number of Completed Packets (0x03|0x0035) plen 5                             #75 6.145974
        Num handles: 1
        Handle: 201 Address: DF:A9:FF:F6:B1:1A (OUI DF-A9-FF)
        Count: 1
zephyr.exe[838227]: < HCI Command: Host Number of Completed Packets (0x03|0x0035) plen 5                             #76 6.146023
        Num handles: 1
        Handle: 201 Address: DF:A9:FF:F6:B1:1A (OUI DF-A9-FF)
        Count: 1
zephyr.exe[838227]: < HCI Command: Host Number of Completed Packets (0x03|0x0035) plen 5                             #77 6.146094
        Num handles: 1
        Handle: 201 Address: DF:A9:FF:F6:B1:1A (OUI DF-A9-FF)
        Count: 1
zephyr.exe[838227]: < ACL Data TX: Handle 201 [1/3] flags 0x00 dlen 27                                               #78 6.146152
zephyr.exe[838227]: < ACL Data TX: Handle 201 flags 0x01 dlen 27                                                     #79 6.146157
zephyr.exe[838227]: < ACL Data TX: Handle 201 flags 0x01 dlen 15                                                     #80 6.146161
      SMP: Pairing Public Key (0x0c) len 64
        X[32]: 98308440221e2d910f0e54b71e7ec652857aa9b5a0dc65028824cc19db1226e9
        Y[32]: 67a4816bcb62efb21701e31fdb27561a6217575fb007a8bbdabe7e28b6f68482
> HCI Event: Number of Completed Packets (0x13) plen 5                                                               #81 6.186612
        Num handles: 1
        Handle: 201 Address: DF:A9:FF:F6:B1:1A (OUI DF-A9-FF)
        Count: 1
        Buffers: 0/3
        #78: len 27 (5 Kb/s)
        Latency: 40 msec (40-100 msec ~70 msec)
> HCI Event: Number of Completed Packets (0x13) plen 5                                                               #82 6.187124
        Num handles: 1
        Handle: 201 Address: DF:A9:FF:F6:B1:1A (OUI DF-A9-FF)
        Count: 1
        Buffers: underflow/3
        #79: len 27 (5 Kb/s)
        Latency: 40 msec (40-100 msec ~55 msec)
zephyr.exe[838227]: < ACL Data TX: Handle 201 [1/3] flags 0x00 dlen 21                                               #83 6.205905
      SMP: Pairing Confirm (0x03) len 16
        Confirm value[16]: 5eea3550efd699328379134f9bbfae59
> HCI Event: Number of Completed Packets (0x13) plen 5                                                               #84 6.246536
        Num handles: 1
        Handle: 201 Address: DF:A9:FF:F6:B1:1A (OUI DF-A9-FF)
        Count: 1
        Buffers: 0/3
        #80: len 15 (1 Kb/s)
        Latency: 100 msec (40-100 msec ~78 msec)
> HCI Event: Number of Completed Packets (0x13) plen 5                                                               #85 6.306422
        Num handles: 1
        Handle: 201 Address: DF:A9:FF:F6:B1:1A (OUI DF-A9-FF)
        Count: 1
        Buffers: underflow/3
        #83: len 21 (1 Kb/s)
        Latency: 100 msec (40-100 msec ~89 msec)
> ACL Data RX: Handle 201 flags 0x02 dlen 21                                                                         #86 6.306574
      SMP: Pairing Random (0x04) len 16
        Random value[16]: 17fbcc8a56b947150000000000000000
zephyr.exe[838227]: < HCI Command: Host Number of Completed Packets (0x03|0x0035) plen 5                             #87 6.325897
        Num handles: 1
        Handle: 201 Address: DF:A9:FF:F6:B1:1A (OUI DF-A9-FF)
        Count: 1
zephyr.exe[838227]: < ACL Data TX: Handle 201 [1/3] flags 0x00 dlen 21                                               #88 6.325921
      SMP: Pairing Random (0x04) len 16
        Random value[16]: 8e6108f966a694cbe26df70bb96773e6
> HCI Event: Number of Completed Packets (0x13) plen 5                                                               #89 6.426277
        Num handles: 1
        Handle: 201 Address: DF:A9:FF:F6:B1:1A (OUI DF-A9-FF)
        Count: 1
        Buffers: 0/3
        #88: len 21 (1 Kb/s)
        Latency: 100 msec (40-100 msec ~94 msec)
> ACL Data RX: Handle 201 flags 0x02 dlen 21                                                                         #90 6.606388
      SMP: Pairing DHKey Check (0x0d) len 16
        E[16]: 6a361c880f5095b77a9e131c3792568d
zephyr.exe[838227]: < HCI Command: Host Number of Completed Packets (0x03|0x0035) plen 5                             #91 6.626086
        Num handles: 1
        Handle: 201 Address: DF:A9:FF:F6:B1:1A (OUI DF-A9-FF)
        Count: 1
zephyr.exe[838227]: < ACL Data TX: Handle 201 [1/3] flags 0x00 dlen 21                                               #92 6.626092
      SMP: Pairing DHKey Check (0x0d) len 16
        E[16]: f466bcb83b352e26202fbab25cce12d1
> HCI Event: Number of Completed Packets (0x13) plen 5                                                               #93 6.726472
        Num handles: 1
        Handle: 201 Address: DF:A9:FF:F6:B1:1A (OUI DF-A9-FF)
        Count: 1
        Buffers: 0/3
        #92: len 21 (1 Kb/s)
        Latency: 100 msec (40-100 msec ~97 msec)
> HCI Event: LE Meta Event (0x3e) plen 13                                                                            #94 6.786650
      LE Long Term Key Request (0x05)
        Handle: 201 Address: DF:A9:FF:F6:B1:1A (OUI DF-A9-FF)
        Random number: 0x0000000000000000
        Encrypted diversifier: 0x0000
zephyr.exe[838227]: < HCI Command: LE Long Term Key Request Reply (0x08|0x001a) plen 18                              #95 6.805941
        Handle: 201 Address: DF:A9:FF:F6:B1:1A (OUI DF-A9-FF)
        Long term key[16]: 3da297dc4945dc3a414b74fd6231ae22
> HCI Event: Command Complete (0x0e) plen 6                                                                          #96 6.806650
      LE Long Term Key Request Reply (0x08|0x001a) ncmd 1
        Status: Success (0x00)
        Handle: 201 Address: DF:A9:FF:F6:B1:1A (OUI DF-A9-FF)
> HCI Event: Encryption Change (0x08) plen 4                                                                         #97 7.146598
        Status: Success (0x00)
        Handle: 201 Address: DF:A9:FF:F6:B1:1A (OUI DF-A9-FF)
        Encryption: Enabled with AES-CCM (0x01)
zephyr.exe[838227]: < ACL Data TX: Handle 201 [1/3] flags 0x00 dlen 21                                               #98 7.275946
      SMP: Signing Information (0x0a) len 16
        Signature key[16]: 5da095555cc64d02679f89a05211af56
> HCI Event: Number of Completed Packets (0x13) plen 5                                                               #99 7.386375
        Num handles: 1
        Handle: 201 Address: DF:A9:FF:F6:B1:1A (OUI DF-A9-FF)
        Count: 1
        Buffers: 0/3
        #98: len 21 (1 Kb/s)
        Latency: 110 msec (40-110 msec ~104 msec)
> ACL Data RX: Handle 201 flags 0x02 dlen 21                                                                        #100 7.386507
      SMP: Identity Information (0x08) len 16
        Identity resolving key[16]: e76cad6ae6c6de60acc435a4411c252f
> ACL Data RX: Handle 201 flags 0x02 dlen 12                                                                        #101 7.386797
      SMP: Identity Address Information (0x09) len 7
        Address: DF:A9:FF:F6:B1:1A (OUI DF-A9-FF)
zephyr.exe[838227]: < HCI Command: Host Number of Completed Packets (0x03|0x0035) plen 5                            #102 7.406067
        Num handles: 1
        Handle: 201 Address: DF:A9:FF:F6:B1:1A (OUI DF-A9-FF)
        Count: 1
zephyr.exe[838227]: < HCI Command: LE Set Extended Advertising Enable (0x08|0x0039) plen 6                          #103 7.406073
        Extended advertising: Disabled (0x00)
        Number of sets: 1 (0x01)
        Entry 0
          Handle: 0x00
          Duration: 0 ms (0x00)
          Max ext adv events: 0
> HCI Event: Command Complete (0x0e) plen 4                                                                         #104 7.407132
      LE Set Extended Advertising Enable (0x08|0x0039) ncmd 1
        Status: Success (0x00)
zephyr.exe[838227]: < HCI Command: LE Add Device To Resolving List (0x08|0x0027) plen 39                            #105 7.425948
        Address type: Public (0x00)
        Address: DF:A9:FF:F6:B1:1A (OUI DF-A9-FF)
        Peer identity resolving key[16]: e76cad6ae6c6de60acc435a4411c252f
        Local identity resolving key[16]: 00000000000000000000000000000000
> HCI Event: Command Complete (0x0e) plen 4                                                                         #106 7.426949
      LE Add Device To Resolving List (0x08|0x0027) ncmd 1
        Status: Success (0x00)
zephyr.exe[838227]: < HCI Command: LE Set Privacy Mode (0x08|0x004e) plen 8                                         #107 7.445965
        Peer Identity address type: Public (0x00)
        Peer Identity address: DF:A9:FF:F6:B1:1A (OUI DF-A9-FF)
        Privacy Mode: Use Device Privacy (0x01)
> HCI Event: Command Complete (0x0e) plen 4                                                                         #108 7.446723
      LE Set Privacy Mode (0x08|0x004e) ncmd 1
        Status: Success (0x00)
zephyr.exe[838227]: < HCI Command: LE Set Address Resolution Enable (0x08|0x002d) plen 1                            #109 7.465964
        Address resolution: Enabled (0x01)
> HCI Event: Command Complete (0x0e) plen 4                                                                         #110 7.466562
      LE Set Address Resolution Enable (0x08|0x002d) ncmd 1
        Status: Success (0x00)
zephyr.exe[838227]: < HCI Command: LE Set Extended Advertising Enable (0x08|0x0039) plen 6                          #111 7.485955
        Extended advertising: Enabled (0x01)
        Number of sets: 1 (0x01)
        Entry 0
          Handle: 0x00
          Duration: 0 ms (0x00)
          Max ext adv events: 0
> HCI Event: Command Complete (0x0e) plen 4                                                                         #112 7.486603
      LE Set Extended Advertising Enable (0x08|0x0039) ncmd 1
        Status: Success (0x00)
zephyr.exe[838227]: < HCI Command: Host Number of Completed Packets (0x03|0x0035) plen 5                            #113 7.505924
        Num handles: 1
        Handle: 201 Address: DF:A9:FF:F6:B1:1A (OUI DF-A9-FF)
        Count: 1
> ACL Data RX: Handle 201 flags 0x02 dlen 13                                                                        #114 7.566471
      ATT: Find By Type Value Request (0x06) len 8
        Handle range: 0x0001-0xffff
        Attribute type: Primary Service (0x2800)
          UUID: Broadcast Audio Scan (0x184f)
zephyr.exe[838227]: < HCI Command: Host Number of Completed Packets (0x03|0x0035) plen 5                            #115 7.586002
        Num handles: 1
        Handle: 201 Address: DF:A9:FF:F6:B1:1A (OUI DF-A9-FF)
        Count: 1
zephyr.exe[838227]: < ACL Data TX: Handle 201 [1/3] flags 0x00 dlen 9                                               #116 7.586008
      ATT: Find By Type Value Response (0x07) len 4
        Handle range: 0x0047-0x004c
> HCI Event: Number of Completed Packets (0x13) plen 5                                                              #117 7.686268
        Num handles: 1
        Handle: 201 Address: DF:A9:FF:F6:B1:1A (OUI DF-A9-FF)
        Count: 1
        Buffers: 0/3
        #116: len 9 (0 Kb/s)
        Latency: 100 msec (40-110 msec ~102 msec)
> ACL Data RX: Handle 201 flags 0x02 dlen 13                                                                        #118 7.686510
      ATT: Find By Type Value Request (0x06) len 8
        Handle range: 0x004d-0xffff
        Attribute type: Primary Service (0x2800)
          UUID: Broadcast Audio Scan (0x184f)
zephyr.exe[838227]: < HCI Command: Host Number of Completed Packets (0x03|0x0035) plen 5                            #119 7.705971
        Num handles: 1
        Handle: 201 Address: DF:A9:FF:F6:B1:1A (OUI DF-A9-FF)
        Count: 1
zephyr.exe[838227]: < ACL Data TX: Handle 201 [1/3] flags 0x00 dlen 9                                               #120 7.706024
      ATT: Error Response (0x01) len 4
        Find By Type Value Request (0x06)
        Handle: 0x004d
        Error: Attribute Not Found (0x0a)
> HCI Event: Number of Completed Packets (0x13) plen 5                                                              #121 7.806297
        Num handles: 1
        Handle: 201 Address: DF:A9:FF:F6:B1:1A (OUI DF-A9-FF)
        Count: 1
        Buffers: 0/3
        #120: len 9 (0 Kb/s)
        Latency: 100 msec (40-110 msec ~101 msec)
> ACL Data RX: Handle 201 flags 0x02 dlen 11                                                                        #122 7.806742
      ATT: Read By Type Request (0x08) len 6
        Handle range: 0x0047-0x004c
        Attribute type: Characteristic (0x2803)
zephyr.exe[838227]: < HCI Command: Host Number of Completed Packets (0x03|0x0035) plen 5                            #123 7.825950
        Num handles: 1
        Handle: 201 Address: DF:A9:FF:F6:B1:1A (OUI DF-A9-FF)
        Count: 1
zephyr.exe[838227]: < ACL Data TX: Handle 201 [1/3] flags 0x00 dlen 20                                              #124 7.825976
      ATT: Read By Type Response (0x09) len 15
        Attribute data length: 7
        Attribute data list: 2 entries
        Handle: 0x0048
        Value[5]: 0c4900c72b
            Properties: 0x0c
              Write Without Response (0x04)
              Write (0x08)
            Value Handle: 0x0049
            Value UUID: Broadcast Audio Scan Control Point (0x2bc7)
        Handle: 0x004a
        Value[5]: 124b00c82b
            Properties: 0x12
              Read (0x02)
              Notify (0x10)
            Value Handle: 0x004b
            Value UUID: Broadcast Receive State (0x2bc8)
> HCI Event: Number of Completed Packets (0x13) plen 5                                                              #125 7.926247
        Num handles: 1
        Handle: 201 Address: DF:A9:FF:F6:B1:1A (OUI DF-A9-FF)
        Count: 1
        Buffers: 0/3
        #124: len 20 (1 Kb/s)
        Latency: 100 msec (40-110 msec ~100 msec)
> ACL Data RX: Handle 201 flags 0x02 dlen 11                                                                        #126 7.926426
      ATT: Read By Type Request (0x08) len 6
        Handle range: 0x004b-0x004c
        Attribute type: Characteristic (0x2803)
zephyr.exe[838227]: < HCI Command: Host Number of Completed Packets (0x03|0x0035) plen 5                            #127 7.946010
        Num handles: 1
        Handle: 201 Address: DF:A9:FF:F6:B1:1A (OUI DF-A9-FF)
        Count: 1
zephyr.exe[838227]: < ACL Data TX: Handle 201 [1/3] flags 0x00 dlen 9                                               #128 7.946015
      ATT: Error Response (0x01) len 4
        Read By Type Request (0x08)
        Handle: 0x004b
        Error: Attribute Not Found (0x0a)
> HCI Event: Number of Completed Packets (0x13) plen 5                                                              #129 8.046763
        Num handles: 1
        Handle: 201 Address: DF:A9:FF:F6:B1:1A (OUI DF-A9-FF)
        Count: 1
        Buffers: 0/3
        #128: len 9 (0 Kb/s)
        Latency: 100 msec (40-110 msec ~100 msec)
> ACL Data RX: Handle 201 flags 0x02 dlen 9                                                                         #130 8.046766
      ATT: Find Information Request (0x04) len 4
        Handle range: 0x004c-0x004c
zephyr.exe[838227]: < HCI Command: Host Number of Completed Packets (0x03|0x0035) plen 5                            #131 8.065995
        Num handles: 1
        Handle: 201 Address: DF:A9:FF:F6:B1:1A (OUI DF-A9-FF)
        Count: 1
zephyr.exe[838227]: < ACL Data TX: Handle 201 [1/3] flags 0x00 dlen 10                                              #132 8.066002
      ATT: Find Information Response (0x05) len 5
        Format: UUID-16 (0x01)
        Handle: 0x004c
        UUID: Client Characteristic Configuration (0x2902)
> HCI Event: Number of Completed Packets (0x13) plen 5                                                              #133 8.226444
        Num handles: 1
        Handle: 201 Address: DF:A9:FF:F6:B1:1A (OUI DF-A9-FF)
        Count: 1
        Buffers: 0/3
        #132: len 10 (0 Kb/s)
        Latency: 160 msec (40-160 msec ~130 msec)
> ACL Data RX: Handle 201 flags 0x02 dlen 9                                                                         #134 8.226580
      ATT: Write Request (0x12) len 4
        Handle: 0x004c
          Data[2]: 0000
zephyr.exe[838227]: < HCI Command: Host Number of Completed Packets (0x03|0x0035) plen 5                            #135 8.245970
        Num handles: 1
        Handle: 201 Address: DF:A9:FF:F6:B1:1A (OUI DF-A9-FF)
        Count: 1
zephyr.exe[838227]: < ACL Data TX: Handle 201 [1/3] flags 0x00 dlen 5                                               #136 8.245991
      ATT: Write Response (0x13) len 0
> HCI Event: Number of Completed Packets (0x13) plen 5                                                              #137 8.346550
        Num handles: 1
        Handle: 201 Address: DF:A9:FF:F6:B1:1A (OUI DF-A9-FF)
        Count: 1
        Buffers: 0/3
        #136: len 5 (0 Kb/s)
        Latency: 100 msec (40-160 msec ~115 msec)
> ACL Data RX: Handle 201 flags 0x02 dlen 9                                                                         #138 8.346552
      ATT: Write Request (0x12) len 4
        Handle: 0x004c
          Data[2]: 0100
zephyr.exe[838227]: < HCI Command: Host Number of Completed Packets (0x03|0x0035) plen 5                            #139 8.365990
        Num handles: 1
        Handle: 201 Address: DF:A9:FF:F6:B1:1A (OUI DF-A9-FF)
        Count: 1
zephyr.exe[838227]: < ACL Data TX: Handle 201 [1/3] flags 0x00 dlen 5                                               #140 8.366011
      ATT: Write Response (0x13) len 0
> HCI Event: Number of Completed Packets (0x13) plen 5                                                              #141 8.466346
        Num handles: 1
        Handle: 201 Address: DF:A9:FF:F6:B1:1A (OUI DF-A9-FF)
        Count: 1
        Buffers: 0/3
        #140: len 5 (0 Kb/s)
        Latency: 100 msec (40-160 msec ~107 msec)
> ACL Data RX: Handle 201 flags 0x02 dlen 7                                                                         #142 8.466348
      ATT: Read Request (0x0a) len 2
        Handle: 0x004b
zephyr.exe[838227]: < HCI Command: Host Number of Completed Packets (0x03|0x0035) plen 5                            #143 8.485993
        Num handles: 1
        Handle: 201 Address: DF:A9:FF:F6:B1:1A (OUI DF-A9-FF)
        Count: 1
zephyr.exe[838227]: < ACL Data TX: Handle 201 [1/3] flags 0x00 dlen 5                                               #144 8.485999
      ATT: Read Response (0x0b) len 0
        Value[0]: 
> HCI Event: Number of Completed Packets (0x13) plen 5                                                              #145 8.586503
        Num handles: 1
        Handle: 201 Address: DF:A9:FF:F6:B1:1A (OUI DF-A9-FF)
        Count: 1
        Buffers: 0/3
        #144: len 5 (0 Kb/s)
        Latency: 100 msec (40-160 msec ~104 msec)
> ACL Data RX: Handle 201 flags 0x02 dlen 27                                                                        #146 8.766774
> ACL Data RX: Handle 201 flags 0x01 dlen 1                                                                         #147 8.766776
      ATT: Write Request (0x12) len 23
        Handle: 0x0049
          Data[21]: 02001ab1f6ffa9df00f1143602401f010000000000
zephyr.exe[838227]: < HCI Command: Host Number of Completed Packets (0x03|0x0035) plen 5                            #148 8.785965
        Num handles: 1
        Handle: 201 Address: DF:A9:FF:F6:B1:1A (OUI DF-A9-FF)
        Count: 1
zephyr.exe[838227]: < HCI Command: Host Number of Completed Packets (0x03|0x0035) plen 5                            #149 8.786191
        Num handles: 1
        Handle: 201 Address: DF:A9:FF:F6:B1:1A (OUI DF-A9-FF)
        Count: 1
zephyr.exe[838227]: < ACL Data TX: Handle 201 [1/3] flags 0x00 dlen 5                                               #150 8.786196
      ATT: Write Response (0x13) len 0
zephyr.exe[838227]: < ACL Data TX: Handle 201 [2/3] flags 0x00 dlen 27                                              #151 8.786197
      ATT: Handle Value Notification (0x1b) len 22
        Handle: 0x004b
          Data[20]: 00001ab1f6ffa9df00f114360000010000000000
> HCI Event: Number of Completed Packets (0x13) plen 5                                                              #152 8.826776
        Num handles: 1
        Handle: 201 Address: DF:A9:FF:F6:B1:1A (OUI DF-A9-FF)
        Count: 1
        Buffers: 1/3
        #150: len 5 (1 Kb/s)
        Latency: 40 msec (40-160 msec ~72 msec)
> HCI Event: Number of Completed Packets (0x13) plen 5                                                              #153 8.887006
        Num handles: 1
        Handle: 201 Address: DF:A9:FF:F6:B1:1A (OUI DF-A9-FF)
        Count: 1
        Buffers: 0/3
        #151: len 27 (2 Kb/s)
        Latency: 100 msec (40-160 msec ~86 msec)
zephyr.exe[838227]: < HCI Command: LE Periodic Advertising Create Sync (0x08|0x0044) plen 14                        #154 9.065935
        Options: 0x0000
        Use advertising SID, Advertiser Address Type and address
        Reporting initially enabled
        SID: 0x00
        Adv address type: Public (0x00)
        Adv address: DF:A9:FF:F6:B1:1A (OUI DF-A9-FF)
        Skip: 0x0005
        Sync timeout: 10000 msec (0x03e8)
        Sync CTE type: 0x0000
> HCI Event: Command Status (0x0f) plen 4                                                                           #155 9.066604
      LE Periodic Advertising Create Sync (0x08|0x0044) ncmd 1
        Status: Success (0x00)
zephyr.exe[838227]: < HCI Command: LE Set Random Address (0x08|0x0005) plen 6                                       #156 9.085881
        Address: 04:C8:1E:D2:64:DA (Non-Resolvable)
> HCI Event: Command Complete (0x0e) plen 4                                                                         #157 9.086547
      LE Set Random Address (0x08|0x0005) ncmd 1
        Status: Success (0x00)
zephyr.exe[838227]: < HCI Command: LE Set Extended Scan Parameters (0x08|0x0041) plen 13                            #158 9.105875
        Own address type: Random (0x01)
        Filter policy: Accept all advertisement (0x00)
        PHYs: 0x05
        Entry 0: LE 1M
          Type: Passive (0x00)
          Interval: 60.000 msec (0x0060)
          Window: 30.000 msec (0x0030)
        Entry 1: LE Coded
          Type: Passive (0x00)
          Interval: 60.000 msec (0x0060)
          Window: 30.000 msec (0x0030)
> HCI Event: Command Complete (0x0e) plen 4                                                                         #159 9.106868
      LE Set Extended Scan Parameters (0x08|0x0041) ncmd 1
        Status: Success (0x00)
zephyr.exe[838227]: < HCI Command: LE Set Extended Scan Enable (0x08|0x0042) plen 6                                 #160 9.125877
        Extended scan: Enabled (0x01)
        Filter duplicates: Enabled (0x01)
        Duration: 0 msec (0x0000)
        Period: 0.00 sec (0x0000)
> HCI Event: Command Complete (0x0e) plen 4                                                                         #161 9.126733
      LE Set Extended Scan Enable (0x08|0x0042) ncmd 1
        Status: Success (0x00)
> HCI Event: LE Meta Event (0x3e) plen 57                                                                           #162 9.141958
      LE Extended Advertising Report (0x0d)
        Num reports: 1
        Entry 0
          Event type: 0x0013
            Props: 0x0013
              Connectable
              Scannable
              Use legacy advertising PDUs
            Data status: [0;32mComplete[0m
          Legacy PDU Type: ADV_IND (0x0013)
          Address type: Random (0x01)
          Address: C7:7D:9B:A0:06:8A (Static)
          Primary PHY: LE 1M
          Secondary PHY: No packets
          SID: no ADI field (0xff)
          TX power: 127 dBm
          RSSI: -88 dBm (0xa8)
          Periodic advertising interval: 0.00 msec (0x0000)
          Direct address type: Reserved (0xff)
          Direct address: 00-00-00-00-00-00
          Data length: 0x1f
        1e ff 4c 00 12 19 50 e7 24 47 24 e6 e0 a9 08 21  ..L...P.$G$....!
        d8 ab 9f b3 c8 7a 0a ac b5 c8 2f f9 4e 01 94     .....z..../.N.. 
        Company: Apple, Inc. (76)
          Type: Unknown (18)
          Data[25]: 50e7244724e6e0a90821d8ab9fb3c87a0aacb5c82ff94e0194
> HCI Event: LE Meta Event (0x3e) plen 55                                                                           #163 9.149374
      LE Extended Advertising Report (0x0d)
        Num reports: 1
        Entry 0
          Event type: 0x0010
            Props: 0x0010
              Use legacy advertising PDUs
            Data status: [0;32mComplete[0m
          Legacy PDU Type: ADV_NONCONN_IND (0x0010)
          Address type: Random (0x01)
          Address: 21:A5:68:33:49:51 (Non-Resolvable)
          Primary PHY: LE 1M
          Secondary PHY: No packets
          SID: no ADI field (0xff)
          TX power: 127 dBm
          RSSI: -81 dBm (0xaf)
          Periodic advertising interval: 0.00 msec (0x0000)
          Direct address type: Reserved (0xff)
          Direct address: 00-00-00-00-00-00
          Data length: 0x1d
        1c ff 06 00 01 09 21 0a 4d e0 8a 52 d2 d4 4c 41  ......!.M..R..LA
        50 54 4f 50 2d 45 35 32 45 4f 44 32 49           PTOP-E52EOD2I   
        Company: Microsoft (6)
          Data[25]: 0109210a4de08a52d2d44c4150544f502d453532454f443249
> HCI Event: LE Meta Event (0x3e) plen 33                                                                           #164 9.263148
      LE Extended Advertising Report (0x0d)
        Num reports: 1
        Entry 0
          Event type: 0x0001
            Props: 0x0001
              Connectable
            Data status: [0;32mComplete[0m
          Address type: Random (0x01)
          Address: F7:78:15:2E:E6:88 (Static)
          Primary PHY: LE 1M
          Secondary PHY: LE 1M
          SID: 0x00
          TX power: 127 dBm
          RSSI: -94 dBm (0xa2)
          Periodic advertising interval: 0.00 msec (0x0000)
          Direct address type: Reserved (0xff)
          Direct address: 00-00-00-00-00-00
          Data length: 0x07
        06 08 48 41 4c 53 43                             ..HALSC         
        Name (short): HALSC
> HCI Event: LE Meta Event (0x3e) plen 48                                                                           #165 9.277584
      LE Extended Advertising Report (0x0d)
        Num reports: 1
        Entry 0
          Event type: 0x0000
            Props: 0x0000
            Data status: [0;32mComplete[0m
          Address type: Public (0x00)
          Address: DF:A9:FF:F6:B1:1A (OUI DF-A9-FF)
          Primary PHY: LE 1M
          Secondary PHY: LE 1M
          SID: 0x00
          TX power: 127 dBm
          RSSI: -18 dBm (0xee)
          Periodic advertising interval: 120.00 msec (0x0060)
          Direct address type: Reserved (0xff)
          Direct address: 00-00-00-00-00-00
          Data length: 0x16
        06 16 52 18 f1 14 36 0e 09 50 54 53 2d 42 41 53  ..R...6..PTS-BAS
        53 2d 42 31 31 41                                S-B11A          
        Service Data: Broadcast Audio Announcement (0x1852)
        Broadcast ID: 3544305 (0x3614f1)
        Name (complete): PTS-BASS-B11A
> HCI Event: LE Meta Event (0x3e) plen 16                                                                           #166 9.337466
      LE Periodic Advertising Sync Established (0x0e)
        Status: Success (0x00)
        Sync handle: 110
        Advertising SID: 0x00
        Advertiser address type: Resolved Public (0x02)
        Advertiser address: DF:A9:FF:F6:B1:1A (OUI DF-A9-FF)
        Advertiser PHY: LE 1M (0x01)
        Periodic advertising interval: 120.00 msec (0x0060)
        Advertiser clock accuracy: 0x01
> HCI Event: LE Meta Event (0x3e) plen 48                                                                           #167 9.337554
      LE Periodic Advertising Report (0x0f)
        Sync handle: 110
        TX power: 127 dbm (0x7f)
        RSSI: -17 dBm (0xef)
        CTE Type: No Constant Tone Extension (0xff)
        Data status: [0;32mComplete[0m
        Data length: 0x28
        Service Data: Basic Audio Announcement (0x1851)
          Presentation Delay: 40000
          Number of Subgroups: 1
            Subgroup #0:
            Number of BIS(s): 1
            Codec: LC3 (0x06)
            Codec Specific Configuration: #0: len 0x02 type 0x01
            Codec Specific Configuration: Sampling Frequency: 16 Khz (0x03)
            Codec Specific Configuration: #1: len 0x02 type 0x02
            Codec Specific Configuration: Frame Duration: 10 ms (0x01)
            Codec Specific Configuration: #2: len 0x03 type 0x04
            Codec Specific Configuration: Frame Length: 40 (0x0028)
            Metadata: #0: len 0x03 type 0x02
            Metadata: Context: 0x0004
            Metadata: Context	Media (0x0004)
            Metadata: #1: len 0x01 type 0x09
              BIS #0:
              Index: 1
              Codec Specific Configuration: #0: len 0x05 type 0x03
              Codec Specific Configuration: Location: 0x00000001
              Codec Specific Configuration: Location: Front Left (0x00000001)
> HCI Event: LE Meta Event (0x3e) plen 20                                                                           #168 9.337794
      LE Broadcast Isochronous Group Info Advertising Report (0x22)
        Sync Handle: 0x006e
        Number BIS: 1
        NSE: 3
        ISO Interval: 10.00 msec (0x0008)
        BN: 1
        PTO: 1
        IRC: 2
        Maximum PDU: 40
        SDU Interval: 10000 us (0x002710)
        Maximum SDU: 40
        PHY: LE 1M (0x01)
        Framing: Unframed (0x00)
        Encryption: 0x00
> HCI Event: LE Meta Event (0x3e) plen 38                                                                           #169 9.341597
      LE Extended Advertising Report (0x0d)
        Num reports: 1
        Entry 0
          Event type: 0x0012
            Props: 0x0012
              Scannable
              Use legacy advertising PDUs
            Data status: [0;32mComplete[0m
          Legacy PDU Type: ADV_SCAN_IND (0x0012)
          Address type: Random (0x01)
          Address: 6C:75:24:62:C8:22 (Resolvable)
          Primary PHY: LE 1M
          Secondary PHY: No packets
          SID: no ADI field (0xff)
          TX power: 127 dBm
          RSSI: -82 dBm (0xae)
          Periodic advertising interval: 0.00 msec (0x0000)
          Direct address type: Reserved (0xff)
          Direct address: 00-00-00-00-00-00
          Data length: 0x0c
        0b ff 4c 00 09 06 03 00 0a 03 0a 1e              ..L.........    
        Company: Apple, Inc. (76)
          Type: Apple TV (9)
          Data[6]: 03000a030a1e
zephyr.exe[838227]: < HCI Command: LE Set Extended Scan Enable (0x08|0x0042) plen 6                                 #170 9.345971
        Extended scan: Disabled (0x00)
        Filter duplicates: Disabled (0x00)
        Duration: 0 msec (0x0000)
        Period: 0.00 sec (0x0000)
> HCI Event: Command Complete (0x0e) plen 4                                                                         #171 9.347362
      LE Set Extended Scan Enable (0x08|0x0042) ncmd 1
        Status: Success (0x00)
zephyr.exe[838227]: < ACL Data TX: Handle 201 [1/3] flags 0x00 dlen 27                                              #172 9.366452
zephyr.exe[838227]: < ACL Data TX: Handle 201 flags 0x01 dlen 6                                                     #173 9.366457
      ATT: Handle Value Notification (0x1b) len 28
        Handle: 0x004b
          Data[26]: 00001ab1f6ffa9df00f114360200010000000006030204000109
> HCI Event: Number of Completed Packets (0x13) plen 5                                                              #174 9.426745
        Num handles: 1
        Handle: 201 Address: DF:A9:FF:F6:B1:1A (OUI DF-A9-FF)
        Count: 1
        Buffers: 0/3
        #172: len 27 (3 Kb/s)
        Latency: 60 msec (40-160 msec ~73 msec)
> HCI Event: Number of Completed Packets (0x13) plen 5                                                              #175 9.486352
        Num handles: 1
        Handle: 201 Address: DF:A9:FF:F6:B1:1A (OUI DF-A9-FF)
        Count: 1
        Buffers: underflow/3
        #173: len 6 (0 Kb/s)
        Latency: 119 msec (40-160 msec ~96 msec)
> ACL Data RX: Handle 201 flags 0x02 dlen 10                                                                        #176 9.486471
      ATT: Write Request (0x12) len 5
        Handle: 0x0049
          Data[3]: 000001
zephyr.exe[838227]: < HCI Command: Host Number of Completed Packets (0x03|0x0035) plen 5                            #177 9.506008
        Num handles: 1
        Handle: 201 Address: DF:A9:FF:F6:B1:1A (OUI DF-A9-FF)
        Count: 1
zephyr.exe[838227]: < ACL Data TX: Handle 201 [1/3] flags 0x00 dlen 9                                               #178 9.506026
      ATT: Error Response (0x01) len 4
        Write Request (0x12)
        Handle: 0x0049
        Error: Reserved (0xfc)
> HCI Event: Number of Completed Packets (0x13) plen 5                                                              #179 9.606944
        Num handles: 1
        Handle: 201 Address: DF:A9:FF:F6:B1:1A (OUI DF-A9-FF)
        Count: 1
        Buffers: 0/3
        #178: len 9 (0 Kb/s)
        Latency: 100 msec (40-160 msec ~98 msec)
> HCI Event: LE Meta Event (0x3e) plen 48                                                                          #180 10.057580
      LE Periodic Advertising Report (0x0f)
        Sync handle: 110
        TX power: 127 dbm (0x7f)
        RSSI: -18 dBm (0xee)
        CTE Type: No Constant Tone Extension (0xff)
        Data status: [0;32mComplete[0m
        Data length: 0x28
        Service Data: Basic Audio Announcement (0x1851)
          Presentation Delay: 40000
          Number of Subgroups: 1
            Subgroup #0:
            Number of BIS(s): 1
            Codec: LC3 (0x06)
            Codec Specific Configuration: #0: len 0x02 type 0x01
            Codec Specific Configuration: Sampling Frequency: 16 Khz (0x03)
            Codec Specific Configuration: #1: len 0x02 type 0x02
            Codec Specific Configuration: Frame Duration: 10 ms (0x01)
            Codec Specific Configuration: #2: len 0x03 type 0x04
            Codec Specific Configuration: Frame Length: 40 (0x0028)
            Metadata: #0: len 0x03 type 0x02
            Metadata: Context: 0x0004
            Metadata: Context	Media (0x0004)
            Metadata: #1: len 0x01 type 0x09
              BIS #0:
              Index: 1
              Codec Specific Configuration: #0: len 0x05 type 0x03
              Codec Specific Configuration: Location: 0x00000001
              Codec Specific Configuration: Location: Front Left (0x00000001)
> HCI Event: LE Meta Event (0x3e) plen 20                                                                          #181 10.057625
      LE Broadcast Isochronous Group Info Advertising Report (0x22)
        Sync Handle: 0x006e
        Number BIS: 1
        NSE: 3
        ISO Interval: 10.00 msec (0x0008)
        BN: 1
        PTO: 1
        IRC: 2
        Maximum PDU: 40
        SDU Interval: 10000 us (0x002710)
        Maximum SDU: 40
        PHY: LE 1M (0x01)
        Framing: Unframed (0x00)
        Encryption: 0x00
> HCI Event: LE Meta Event (0x3e) plen 48                                                                          #182 10.777246
      LE Periodic Advertising Report (0x0f)
        Sync handle: 110
        TX power: 127 dbm (0x7f)
        RSSI: -17 dBm (0xef)
        CTE Type: No Constant Tone Extension (0xff)
        Data status: [0;32mComplete[0m
        Data length: 0x28
        Service Data: Basic Audio Announcement (0x1851)
          Presentation Delay: 40000
          Number of Subgroups: 1
            Subgroup #0:
            Number of BIS(s): 1
            Codec: LC3 (0x06)
            Codec Specific Configuration: #0: len 0x02 type 0x01
            Codec Specific Configuration: Sampling Frequency: 16 Khz (0x03)
            Codec Specific Configuration: #1: len 0x02 type 0x02
            Codec Specific Configuration: Frame Duration: 10 ms (0x01)
            Codec Specific Configuration: #2: len 0x03 type 0x04
            Codec Specific Configuration: Frame Length: 40 (0x0028)
            Metadata: #0: len 0x03 type 0x02
            Metadata: Context: 0x0004
            Metadata: Context	Media (0x0004)
            Metadata: #1: len 0x01 type 0x09
              BIS #0:
              Index: 1
              Codec Specific Configuration: #0: len 0x05 type 0x03
              Codec Specific Configuration: Location: 0x00000001
              Codec Specific Configuration: Location: Front Left (0x00000001)
> HCI Event: LE Meta Event (0x3e) plen 20                                                                          #183 10.777696
      LE Broadcast Isochronous Group Info Advertising Report (0x22)
        Sync Handle: 0x006e
        Number BIS: 1
        NSE: 3
        ISO Interval: 10.00 msec (0x0008)
        BN: 1
        PTO: 1
        IRC: 2
        Maximum PDU: 40
        SDU Interval: 10000 us (0x002710)
        Maximum SDU: 40
        PHY: LE 1M (0x01)
        Framing: Unframed (0x00)
        Encryption: 0x00
> HCI Event: LE Meta Event (0x3e) plen 48                                                                          #184 11.497891
      LE Periodic Advertising Report (0x0f)
        Sync handle: 110
        TX power: 127 dbm (0x7f)
        RSSI: -18 dBm (0xee)
        CTE Type: No Constant Tone Extension (0xff)
        Data status: [0;32mComplete[0m
        Data length: 0x28
        Service Data: Basic Audio Announcement (0x1851)
          Presentation Delay: 40000
          Number of Subgroups: 1
            Subgroup #0:
            Number of BIS(s): 1
            Codec: LC3 (0x06)
            Codec Specific Configuration: #0: len 0x02 type 0x01
            Codec Specific Configuration: Sampling Frequency: 16 Khz (0x03)
            Codec Specific Configuration: #1: len 0x02 type 0x02
            Codec Specific Configuration: Frame Duration: 10 ms (0x01)
            Codec Specific Configuration: #2: len 0x03 type 0x04
            Codec Specific Configuration: Frame Length: 40 (0x0028)
            Metadata: #0: len 0x03 type 0x02
            Metadata: Context: 0x0004
            Metadata: Context	Media (0x0004)
            Metadata: #1: len 0x01 type 0x09
              BIS #0:
              Index: 1
              Codec Specific Configuration: #0: len 0x05 type 0x03
              Codec Specific Configuration: Location: 0x00000001
              Codec Specific Configuration: Location: Front Left (0x00000001)
> HCI Event: LE Meta Event (0x3e) plen 20                                                                          #185 11.497956
      LE Broadcast Isochronous Group Info Advertising Report (0x22)
        Sync Handle: 0x006e
        Number BIS: 1
        NSE: 3
        ISO Interval: 10.00 msec (0x0008)
        BN: 1
        PTO: 1
        IRC: 2
        Maximum PDU: 40
        SDU Interval: 10000 us (0x002710)
        Maximum SDU: 40
        PHY: LE 1M (0x01)
        Framing: Unframed (0x00)
        Encryption: 0x00
> HCI Event: LE Meta Event (0x3e) plen 48                                                                          #186 12.217625
      LE Periodic Advertising Report (0x0f)
        Sync handle: 110
        TX power: 127 dbm (0x7f)
        RSSI: -16 dBm (0xf0)
        CTE Type: No Constant Tone Extension (0xff)
        Data status: [0;32mComplete[0m
        Data length: 0x28
        Service Data: Basic Audio Announcement (0x1851)
          Presentation Delay: 40000
          Number of Subgroups: 1
            Subgroup #0:
            Number of BIS(s): 1
            Codec: LC3 (0x06)
            Codec Specific Configuration: #0: len 0x02 type 0x01
            Codec Specific Configuration: Sampling Frequency: 16 Khz (0x03)
            Codec Specific Configuration: #1: len 0x02 type 0x02
            Codec Specific Configuration: Frame Duration: 10 ms (0x01)
            Codec Specific Configuration: #2: len 0x03 type 0x04
            Codec Specific Configuration: Frame Length: 40 (0x0028)
            Metadata: #0: len 0x03 type 0x02
            Metadata: Context: 0x0004
            Metadata: Context	Media (0x0004)
            Metadata: #1: len 0x01 type 0x09
              BIS #0:
              Index: 1
              Codec Specific Configuration: #0: len 0x05 type 0x03
              Codec Specific Configuration: Location: 0x00000001
              Codec Specific Configuration: Location: Front Left (0x00000001)
> HCI Event: LE Meta Event (0x3e) plen 20                                                                          #187 12.217627
      LE Broadcast Isochronous Group Info Advertising Report (0x22)
        Sync Handle: 0x006e
        Number BIS: 1
        NSE: 3
        ISO Interval: 10.00 msec (0x0008)
        BN: 1
        PTO: 1
        IRC: 2
        Maximum PDU: 40
        SDU Interval: 10000 us (0x002710)
        Maximum SDU: 40
        PHY: LE 1M (0x01)
        Framing: Unframed (0x00)
        Encryption: 0x00
> HCI Event: LE Meta Event (0x3e) plen 48                                                                          #188 13.657065
      LE Periodic Advertising Report (0x0f)
        Sync handle: 110
        TX power: 127 dbm (0x7f)
        RSSI: -18 dBm (0xee)
        CTE Type: No Constant Tone Extension (0xff)
        Data status: [0;32mComplete[0m
        Data length: 0x28
        Service Data: Basic Audio Announcement (0x1851)
          Presentation Delay: 40000
          Number of Subgroups: 1
            Subgroup #0:
            Number of BIS(s): 1
            Codec: LC3 (0x06)
            Codec Specific Configuration: #0: len 0x02 type 0x01
            Codec Specific Configuration: Sampling Frequency: 16 Khz (0x03)
            Codec Specific Configuration: #1: len 0x02 type 0x02
            Codec Specific Configuration: Frame Duration: 10 ms (0x01)
            Codec Specific Configuration: #2: len 0x03 type 0x04
            Codec Specific Configuration: Frame Length: 40 (0x0028)
            Metadata: #0: len 0x03 type 0x02
            Metadata: Context: 0x0004
            Metadata: Context	Media (0x0004)
            Metadata: #1: len 0x01 type 0x09
              BIS #0:
              Index: 1
              Codec Specific Configuration: #0: len 0x05 type 0x03
              Codec Specific Configuration: Location: 0x00000001
              Codec Specific Configuration: Location: Front Left (0x00000001)
> HCI Event: LE Meta Event (0x3e) plen 20                                                                          #189 13.658087
      LE Broadcast Isochronous Group Info Advertising Report (0x22)
        Sync Handle: 0x006e
        Number BIS: 1
        NSE: 3
        ISO Interval: 10.00 msec (0x0008)
        BN: 1
        PTO: 1
        IRC: 2
        Maximum PDU: 40
        SDU Interval: 10000 us (0x002710)
        Maximum SDU: 40
        PHY: LE 1M (0x01)
        Framing: Unframed (0x00)
        Encryption: 0x00
> HCI Event: LE Meta Event (0x3e) plen 48                                                                          #190 14.377380
      LE Periodic Advertising Report (0x0f)
        Sync handle: 110
        TX power: 127 dbm (0x7f)
        RSSI: -17 dBm (0xef)
        CTE Type: No Constant Tone Extension (0xff)
        Data status: [0;32mComplete[0m
        Data length: 0x28
        Service Data: Basic Audio Announcement (0x1851)
          Presentation Delay: 40000
          Number of Subgroups: 1
            Subgroup #0:
            Number of BIS(s): 1
            Codec: LC3 (0x06)
            Codec Specific Configuration: #0: len 0x02 type 0x01
            Codec Specific Configuration: Sampling Frequency: 16 Khz (0x03)
            Codec Specific Configuration: #1: len 0x02 type 0x02
            Codec Specific Configuration: Frame Duration: 10 ms (0x01)
            Codec Specific Configuration: #2: len 0x03 type 0x04
            Codec Specific Configuration: Frame Length: 40 (0x0028)
            Metadata: #0: len 0x03 type 0x02
            Metadata: Context: 0x0004
            Metadata: Context	Media (0x0004)
            Metadata: #1: len 0x01 type 0x09
              BIS #0:
              Index: 1
              Codec Specific Configuration: #0: len 0x05 type 0x03
              Codec Specific Configuration: Location: 0x00000001
              Codec Specific Configuration: Location: Front Left (0x00000001)
> HCI Event: LE Meta Event (0x3e) plen 20                                                                          #191 14.377382
      LE Broadcast Isochronous Group Info Advertising Report (0x22)
        Sync Handle: 0x006e
        Number BIS: 1
        NSE: 3
        ISO Interval: 10.00 msec (0x0008)
        BN: 1
        PTO: 1
        IRC: 2
        Maximum PDU: 40
        SDU Interval: 10000 us (0x002710)
        Maximum SDU: 40
        PHY: LE 1M (0x01)
        Framing: Unframed (0x00)
        Encryption: 0x00
> ACL Data RX: Handle 201 flags 0x02 dlen 10                                                                       #192 14.586071
      ATT: Write Request (0x12) len 5
        Handle: 0x0049
          Data[3]: 010000
zephyr.exe[838227]: < HCI Command: Host Number of Completed Packets (0x03|0x0035) plen 5                           #193 14.606004
        Num handles: 1
        Handle: 201 Address: DF:A9:FF:F6:B1:1A (OUI DF-A9-FF)
        Count: 1
zephyr.exe[838227]: < ACL Data TX: Handle 201 [1/3] flags 0x00 dlen 9                                              #194 14.606010
      ATT: Error Response (0x01) len 4
        Write Request (0x12)
        Handle: 0x0049
        Error: Reserved (0xfc)
> HCI Event: Number of Completed Packets (0x13) plen 5                                                             #195 14.706190
        Num handles: 1
        Handle: 201 Address: DF:A9:FF:F6:B1:1A (OUI DF-A9-FF)
        Count: 1
        Buffers: 0/3
        #194: len 9 (0 Kb/s)
        Latency: 100 msec (40-160 msec ~99 msec)
> HCI Event: LE Meta Event (0x3e) plen 48                                                                          #196 15.097287
      LE Periodic Advertising Report (0x0f)
        Sync handle: 110
        TX power: 127 dbm (0x7f)
        RSSI: -16 dBm (0xf0)
        CTE Type: No Constant Tone Extension (0xff)
        Data status: [0;32mComplete[0m
        Data length: 0x28
        Service Data: Basic Audio Announcement (0x1851)
          Presentation Delay: 40000
          Number of Subgroups: 1
            Subgroup #0:
            Number of BIS(s): 1
            Codec: LC3 (0x06)
            Codec Specific Configuration: #0: len 0x02 type 0x01
            Codec Specific Configuration: Sampling Frequency: 16 Khz (0x03)
            Codec Specific Configuration: #1: len 0x02 type 0x02
            Codec Specific Configuration: Frame Duration: 10 ms (0x01)
            Codec Specific Configuration: #2: len 0x03 type 0x04
            Codec Specific Configuration: Frame Length: 40 (0x0028)
            Metadata: #0: len 0x03 type 0x02
            Metadata: Context: 0x0004
            Metadata: Context	Media (0x0004)
            Metadata: #1: len 0x01 type 0x09
              BIS #0:
              Index: 1
              Codec Specific Configuration: #0: len 0x05 type 0x03
              Codec Specific Configuration: Location: 0x00000001
              Codec Specific Configuration: Location: Front Left (0x00000001)
> HCI Event: LE Meta Event (0x3e) plen 20                                                                          #197 15.097493
      LE Broadcast Isochronous Group Info Advertising Report (0x22)
        Sync Handle: 0x006e
        Number BIS: 1
        NSE: 3
        ISO Interval: 10.00 msec (0x0008)
        BN: 1
        PTO: 1
        IRC: 2
        Maximum PDU: 40
        SDU Interval: 10000 us (0x002710)
        Maximum SDU: 40
        PHY: LE 1M (0x01)
        Framing: Unframed (0x00)
        Encryption: 0x00
> HCI Event: LE Meta Event (0x3e) plen 48                                                                          #198 15.817037
      LE Periodic Advertising Report (0x0f)
        Sync handle: 110
        TX power: 127 dbm (0x7f)
        RSSI: -17 dBm (0xef)
        CTE Type: No Constant Tone Extension (0xff)
        Data status: [0;32mComplete[0m
        Data length: 0x28
        Service Data: Basic Audio Announcement (0x1851)
          Presentation Delay: 40000
          Number of Subgroups: 1
            Subgroup #0:
            Number of BIS(s): 1
            Codec: LC3 (0x06)
            Codec Specific Configuration: #0: len 0x02 type 0x01
            Codec Specific Configuration: Sampling Frequency: 16 Khz (0x03)
            Codec Specific Configuration: #1: len 0x02 type 0x02
            Codec Specific Configuration: Frame Duration: 10 ms (0x01)
            Codec Specific Configuration: #2: len 0x03 type 0x04
            Codec Specific Configuration: Frame Length: 40 (0x0028)
            Metadata: #0: len 0x03 type 0x02
            Metadata: Context: 0x0004
            Metadata: Context	Media (0x0004)
            Metadata: #1: len 0x01 type 0x09
              BIS #0:
              Index: 1
              Codec Specific Configuration: #0: len 0x05 type 0x03
              Codec Specific Configuration: Location: 0x00000001
              Codec Specific Configuration: Location: Front Left (0x00000001)
> HCI Event: LE Meta Event (0x3e) plen 20                                                                          #199 15.817450
      LE Broadcast Isochronous Group Info Advertising Report (0x22)
        Sync Handle: 0x006e
        Number BIS: 1
        NSE: 3
        ISO Interval: 10.00 msec (0x0008)
        BN: 1
        PTO: 1
        IRC: 2
        Maximum PDU: 40
        SDU Interval: 10000 us (0x002710)
        Maximum SDU: 40
        PHY: LE 1M (0x01)
        Framing: Unframed (0x00)
        Encryption: 0x00
> HCI Event: LE Meta Event (0x3e) plen 48                                                                          #200 16.537164
      LE Periodic Advertising Report (0x0f)
        Sync handle: 110
        TX power: 127 dbm (0x7f)
        RSSI: -17 dBm (0xef)
        CTE Type: No Constant Tone Extension (0xff)
        Data status: [0;32mComplete[0m
        Data length: 0x28
        Service Data: Basic Audio Announcement (0x1851)
          Presentation Delay: 40000
          Number of Subgroups: 1
            Subgroup #0:
            Number of BIS(s): 1
            Codec: LC3 (0x06)
            Codec Specific Configuration: #0: len 0x02 type 0x01
            Codec Specific Configuration: Sampling Frequency: 16 Khz (0x03)
            Codec Specific Configuration: #1: len 0x02 type 0x02
            Codec Specific Configuration: Frame Duration: 10 ms (0x01)
            Codec Specific Configuration: #2: len 0x03 type 0x04
            Codec Specific Configuration: Frame Length: 40 (0x0028)
            Metadata: #0: len 0x03 type 0x02
            Metadata: Context: 0x0004
            Metadata: Context	Media (0x0004)
            Metadata: #1: len 0x01 type 0x09
              BIS #0:
              Index: 1
              Codec Specific Configuration: #0: len 0x05 type 0x03
              Codec Specific Configuration: Location: 0x00000001
              Codec Specific Configuration: Location: Front Left (0x00000001)
> HCI Event: LE Meta Event (0x3e) plen 20                                                                          #201 16.537273
      LE Broadcast Isochronous Group Info Advertising Report (0x22)
        Sync Handle: 0x006e
        Number BIS: 1
        NSE: 3
        ISO Interval: 10.00 msec (0x0008)
        BN: 1
        PTO: 1
        IRC: 2
        Maximum PDU: 40
        SDU Interval: 10000 us (0x002710)
        Maximum SDU: 40
        PHY: LE 1M (0x01)
        Framing: Unframed (0x00)
        Encryption: 0x00
> HCI Event: LE Meta Event (0x3e) plen 48                                                                          #202 17.257472
      LE Periodic Advertising Report (0x0f)
        Sync handle: 110
        TX power: 127 dbm (0x7f)
        RSSI: -17 dBm (0xef)
        CTE Type: No Constant Tone Extension (0xff)
        Data status: [0;32mComplete[0m
        Data length: 0x28
        Service Data: Basic Audio Announcement (0x1851)
          Presentation Delay: 40000
          Number of Subgroups: 1
            Subgroup #0:
            Number of BIS(s): 1
            Codec: LC3 (0x06)
            Codec Specific Configuration: #0: len 0x02 type 0x01
            Codec Specific Configuration: Sampling Frequency: 16 Khz (0x03)
            Codec Specific Configuration: #1: len 0x02 type 0x02
            Codec Specific Configuration: Frame Duration: 10 ms (0x01)
            Codec Specific Configuration: #2: len 0x03 type 0x04
            Codec Specific Configuration: Frame Length: 40 (0x0028)
            Metadata: #0: len 0x03 type 0x02
            Metadata: Context: 0x0004
            Metadata: Context	Media (0x0004)
            Metadata: #1: len 0x01 type 0x09
              BIS #0:
              Index: 1
              Codec Specific Configuration: #0: len 0x05 type 0x03
              Codec Specific Configuration: Location: 0x00000001
              Codec Specific Configuration: Location: Front Left (0x00000001)
> HCI Event: LE Meta Event (0x3e) plen 20                                                                          #203 17.257806
      LE Broadcast Isochronous Group Info Advertising Report (0x22)
        Sync Handle: 0x006e
        Number BIS: 1
        NSE: 3
        ISO Interval: 10.00 msec (0x0008)
        BN: 1
        PTO: 1
        IRC: 2
        Maximum PDU: 40
        SDU Interval: 10000 us (0x002710)
        Maximum SDU: 40
        PHY: LE 1M (0x01)
        Framing: Unframed (0x00)
        Encryption: 0x00
> HCI Event: LE Meta Event (0x3e) plen 48                                                                          #204 17.976947
      LE Periodic Advertising Report (0x0f)
        Sync handle: 110
        TX power: 127 dbm (0x7f)
        RSSI: -16 dBm (0xf0)
        CTE Type: No Constant Tone Extension (0xff)
        Data status: [0;32mComplete[0m
        Data length: 0x28
        Service Data: Basic Audio Announcement (0x1851)
          Presentation Delay: 40000
          Number of Subgroups: 1
            Subgroup #0:
            Number of BIS(s): 1
            Codec: LC3 (0x06)
            Codec Specific Configuration: #0: len 0x02 type 0x01
            Codec Specific Configuration: Sampling Frequency: 16 Khz (0x03)
            Codec Specific Configuration: #1: len 0x02 type 0x02
            Codec Specific Configuration: Frame Duration: 10 ms (0x01)
            Codec Specific Configuration: #2: len 0x03 type 0x04
            Codec Specific Configuration: Frame Length: 40 (0x0028)
            Metadata: #0: len 0x03 type 0x02
            Metadata: Context: 0x0004
            Metadata: Context	Media (0x0004)
            Metadata: #1: len 0x01 type 0x09
              BIS #0:
              Index: 1
              Codec Specific Configuration: #0: len 0x05 type 0x03
              Codec Specific Configuration: Location: 0x00000001
              Codec Specific Configuration: Location: Front Left (0x00000001)
> HCI Event: LE Meta Event (0x3e) plen 20                                                                          #205 17.978541
      LE Broadcast Isochronous Group Info Advertising Report (0x22)
        Sync Handle: 0x006e
        Number BIS: 1
        NSE: 3
        ISO Interval: 10.00 msec (0x0008)
        BN: 1
        PTO: 1
        IRC: 2
        Maximum PDU: 40
        SDU Interval: 10000 us (0x002710)
        Maximum SDU: 40
        PHY: LE 1M (0x01)
        Framing: Unframed (0x00)
        Encryption: 0x00
> HCI Event: LE Meta Event (0x3e) plen 48                                                                          #206 18.697059
      LE Periodic Advertising Report (0x0f)
        Sync handle: 110
        TX power: 127 dbm (0x7f)
        RSSI: -16 dBm (0xf0)
        CTE Type: No Constant Tone Extension (0xff)
        Data status: [0;32mComplete[0m
        Data length: 0x28
        Service Data: Basic Audio Announcement (0x1851)
          Presentation Delay: 40000
          Number of Subgroups: 1
            Subgroup #0:
            Number of BIS(s): 1
            Codec: LC3 (0x06)
            Codec Specific Configuration: #0: len 0x02 type 0x01
            Codec Specific Configuration: Sampling Frequency: 16 Khz (0x03)
            Codec Specific Configuration: #1: len 0x02 type 0x02
            Codec Specific Configuration: Frame Duration: 10 ms (0x01)
            Codec Specific Configuration: #2: len 0x03 type 0x04
            Codec Specific Configuration: Frame Length: 40 (0x0028)
            Metadata: #0: len 0x03 type 0x02
            Metadata: Context: 0x0004
            Metadata: Context	Media (0x0004)
            Metadata: #1: len 0x01 type 0x09
              BIS #0:
              Index: 1
              Codec Specific Configuration: #0: len 0x05 type 0x03
              Codec Specific Configuration: Location: 0x00000001
              Codec Specific Configuration: Location: Front Left (0x00000001)
> HCI Event: LE Meta Event (0x3e) plen 20                                                                          #207 18.697505
      LE Broadcast Isochronous Group Info Advertising Report (0x22)
        Sync Handle: 0x006e
        Number BIS: 1
        NSE: 3
        ISO Interval: 10.00 msec (0x0008)
        BN: 1
        PTO: 1
        IRC: 2
        Maximum PDU: 40
        SDU Interval: 10000 us (0x002710)
        Maximum SDU: 40
        PHY: LE 1M (0x01)
        Framing: Unframed (0x00)
        Encryption: 0x00
> HCI Event: LE Meta Event (0x3e) plen 48                                                                          #208 19.417079
      LE Periodic Advertising Report (0x0f)
        Sync handle: 110
        TX power: 127 dbm (0x7f)
        RSSI: -16 dBm (0xf0)
        CTE Type: No Constant Tone Extension (0xff)
        Data status: [0;32mComplete[0m
        Data length: 0x28
        Service Data: Basic Audio Announcement (0x1851)
          Presentation Delay: 40000
          Number of Subgroups: 1
            Subgroup #0:
            Number of BIS(s): 1
            Codec: LC3 (0x06)
            Codec Specific Configuration: #0: len 0x02 type 0x01
            Codec Specific Configuration: Sampling Frequency: 16 Khz (0x03)
            Codec Specific Configuration: #1: len 0x02 type 0x02
            Codec Specific Configuration: Frame Duration: 10 ms (0x01)
            Codec Specific Configuration: #2: len 0x03 type 0x04
            Codec Specific Configuration: Frame Length: 40 (0x0028)
            Metadata: #0: len 0x03 type 0x02
            Metadata: Context: 0x0004
            Metadata: Context	Media (0x0004)
            Metadata: #1: len 0x01 type 0x09
              BIS #0:
              Index: 1
              Codec Specific Configuration: #0: len 0x05 type 0x03
              Codec Specific Configuration: Location: 0x00000001
              Codec Specific Configuration: Location: Front Left (0x00000001)
> HCI Event: LE Meta Event (0x3e) plen 20                                                                          #209 19.417564
      LE Broadcast Isochronous Group Info Advertising Report (0x22)
        Sync Handle: 0x006e
        Number BIS: 1
        NSE: 3
        ISO Interval: 10.00 msec (0x0008)
        BN: 1
        PTO: 1
        IRC: 2
        Maximum PDU: 40
        SDU Interval: 10000 us (0x002710)
        Maximum SDU: 40
        PHY: LE 1M (0x01)
        Framing: Unframed (0x00)
        Encryption: 0x00
> ACL Data RX: Handle 201 flags 0x02 dlen 27                                                                       #210 19.686070
> ACL Data RX: Handle 201 flags 0x01 dlen 3                                                                        #211 19.686346
      ATT: Write Request (0x12) len 25
        Handle: 0x0049
          Data[23]: 02001ab1f6ffa9df0134120002401f0100000000000000
zephyr.exe[838227]: < HCI Command: Host Number of Completed Packets (0x03|0x0035) plen 5                           #212 19.706045
        Num handles: 1
        Handle: 201 Address: DF:A9:FF:F6:B1:1A (OUI DF-A9-FF)
        Count: 1
zephyr.exe[838227]: < HCI Command: Host Number of Completed Packets (0x03|0x0035) plen 5                           #213 19.706126
        Num handles: 1
        Handle: 201 Address: DF:A9:FF:F6:B1:1A (OUI DF-A9-FF)
        Count: 1
zephyr.exe[838227]: < ACL Data TX: Handle 201 [1/3] flags 0x00 dlen 9                                              #214 19.706158
      ATT: Error Response (0x01) len 4
        Write Request (0x12)
        Handle: 0x0049
        Error: Reserved (0xfc)
> HCI Event: Number of Completed Packets (0x13) plen 5                                                             #215 19.806007
        Num handles: 1
        Handle: 201 Address: DF:A9:FF:F6:B1:1A (OUI DF-A9-FF)
        Count: 1
        Buffers: 0/3
        #214: len 9 (0 Kb/s)
        Latency: 99 msec (40-160 msec ~99 msec)
> HCI Event: LE Meta Event (0x3e) plen 48                                                                          #216 20.137118
      LE Periodic Advertising Report (0x0f)
        Sync handle: 110
        TX power: 127 dbm (0x7f)
        RSSI: -18 dBm (0xee)
        CTE Type: No Constant Tone Extension (0xff)
        Data status: [0;32mComplete[0m
        Data length: 0x28
        Service Data: Basic Audio Announcement (0x1851)
          Presentation Delay: 40000
          Number of Subgroups: 1
            Subgroup #0:
            Number of BIS(s): 1
            Codec: LC3 (0x06)
            Codec Specific Configuration: #0: len 0x02 type 0x01
            Codec Specific Configuration: Sampling Frequency: 16 Khz (0x03)
            Codec Specific Configurati