Bluetooth monitor ver 5.72
btmon[325279]: = Note: Linux version 6.14.0-36-generic (x86_64)                                                          0.036572
btmon[325279]: = Note: Bluetooth subsystem version 2.22                                                                  0.036573
= New Index: 00:00:00:00:00:00 (Primary,UART,hci1)                                                                       0.036575
= New Index: 48:5F:99:8E:E0:64 (Primary,USB,hci0)                                                                        0.036575
= Open Index: 00:00:00:00:00:00                                                                                          0.049762
= Index Info: 00:00:00:00:00:00 (Nordic Semiconductor ASA)                                                               0.049767
zephyr.exe[325281]: @ USER Open: main (privileged) version 2.22                                                 {0x0001} 0.049770
zephyr.exe[325281]: < HCI Command: Reset (0x03|0x0003) plen 0                                                         #1 0.050082
> HCI Event: Command Complete (0x0e) plen 4                                                                           #2 0.050629
      Reset (0x03|0x0003) ncmd 1
        Status: Success (0x00)
zephyr.exe[325281]: < HCI Command: Read Local Supported Features (0x04|0x0003) plen 0                                 #3 0.069733
> HCI Event: Command Complete (0x0e) plen 12                                                                          #4 0.070294
      Read Local Supported Features (0x04|0x0003) ncmd 1
        Status: Success (0x00)
        Features: 0x00 0x00 0x00 0x00 0x60 0x00 0x00 0x00
          BR/EDR Not Supported
          LE Supported (Controller)
zephyr.exe[325281]: < HCI Command: Read Local Version Information (0x04|0x0001) plen 0                                #5 0.089742
> HCI Event: Command Complete (0x0e) plen 12                                                                          #6 0.090175
      Read Local Version Information (0x04|0x0001) ncmd 1
        Status: Success (0x00)
        HCI version: Reserved (0x0e) - Revision 12520 (0x30e8)
        LMP version: Reserved (0x0e) - Subversion 12520 (0x30e8)
        Manufacturer: Nordic Semiconductor ASA (89)
zephyr.exe[325281]: < HCI Command: Read Local Supported Commands (0x04|0x0002) plen 0                                 #7 0.109733
> HCI Event: Command Complete (0x0e) plen 68                                                                          #8 0.110794
      Read Local Supported Commands (0x04|0x0002) ncmd 1
        Status: Success (0x00)
        Commands: 119 entries
          Disconnect (Octet 0 - Bit 5)
          Read Remote Version Information (Octet 2 - Bit 7)
          Set Event Mask (Octet 5 - Bit 6)
          Reset (Octet 5 - Bit 7)
          Read Connection Accept Timeout (Octet 7 - Bit 2)
          Write Connection Accept Timeout (Octet 7 - Bit 3)
          Read Transmit Power Level (Octet 10 - Bit 2)
          Set Controller To Host Flow Control (Octet 10 - Bit 5)
          Host Buffer Size (Octet 10 - Bit 6)
          Host Number of Completed Packets (Octet 10 - Bit 7)
          Read Local Version Information (Octet 14 - Bit 3)
          Read Local Supported Features (Octet 14 - Bit 5)
          Read BD ADDR (Octet 15 - Bit 1)
          Read RSSI (Octet 15 - Bit 5)
          Set Event Mask Page 2 (Octet 22 - Bit 2)
          LE Set Event Mask (Octet 25 - Bit 0)
          LE Read Buffer Size (Octet 25 - Bit 1)
          LE Read Local Supported Features (Octet 25 - Bit 2)
          LE Set Random Address (Octet 25 - Bit 4)
          LE Set Advertising Parameters (Octet 25 - Bit 5)
          LE Read Advertising Channel TX Power (Octet 25 - Bit 6)
          LE Set Advertising Data (Octet 25 - Bit 7)
          LE Set Scan Response Data (Octet 26 - Bit 0)
          LE Set Advertise Enable (Octet 26 - Bit 1)
          LE Set Scan Parameters (Octet 26 - Bit 2)
          LE Set Scan Enable (Octet 26 - Bit 3)
          LE Create Connection (Octet 26 - Bit 4)
          LE Create Connection Cancel (Octet 26 - Bit 5)
          LE Read Accept List Size (Octet 26 - Bit 6)
          LE Clear Accept List (Octet 26 - Bit 7)
          LE Add Device To Accept List (Octet 27 - Bit 0)
          LE Remove Device From Accept List (Octet 27 - Bit 1)
          LE Connection Update (Octet 27 - Bit 2)
          LE Set Host Channel Classification (Octet 27 - Bit 3)
          LE Read Channel Map (Octet 27 - Bit 4)
          LE Read Remote Used Features (Octet 27 - Bit 5)
          LE Encrypt (Octet 27 - Bit 6)
          LE Rand (Octet 27 - Bit 7)
          LE Start Encryption (Octet 28 - Bit 0)
          LE Long Term Key Request Reply (Octet 28 - Bit 1)
          LE Long Term Key Request Neg Reply (Octet 28 - Bit 2)
          LE Read Supported States (Octet 28 - Bit 3)
          LE Receiver Test (Octet 28 - Bit 4)
          LE Transmitter Test (Octet 28 - Bit 5)
          LE Test End (Octet 28 - Bit 6)
          Read Authenticated Payload Timeout (Octet 32 - Bit 4)
          Write Authenticated Payload Timeout (Octet 32 - Bit 5)
          LE Set Data Length (Octet 33 - Bit 6)
          LE Read Suggested Default Data Length (Octet 33 - Bit 7)
          LE Write Suggested Default Data Length (Octet 34 - Bit 0)
          LE Add Device To Resolving List (Octet 34 - Bit 3)
          LE Remove Device From Resolving List (Octet 34 - Bit 4)
          LE Clear Resolving List (Octet 34 - Bit 5)
          LE Read Resolving List Size (Octet 34 - Bit 6)
          LE Set Address Resolution Enable (Octet 35 - Bit 1)
          LE Set Resolvable Private Address Timeout (Octet 35 - Bit 2)
          LE Read Maximum Data Length (Octet 35 - Bit 3)
          LE Read PHY (Octet 35 - Bit 4)
          LE Set Default PHY (Octet 35 - Bit 5)
          LE Set PHY (Octet 35 - Bit 6)
          LE Enhanced Receiver Test (Octet 35 - Bit 7)
          LE Enhanced Transmitter Test (Octet 36 - Bit 0)
          LE Set Advertising Set Random Address (Octet 36 - Bit 1)
          LE Set Extended Advertising Parameters (Octet 36 - Bit 2)
          LE Set Extended Advertising Data (Octet 36 - Bit 3)
          LE Set Extended Scan Response Data (Octet 36 - Bit 4)
          LE Set Extended Advertising Enable (Octet 36 - Bit 5)
          LE Read Maximum Advertising Data Length (Octet 36 - Bit 6)
          LE Read Number of Supported Advertising Sets (Octet 36 - Bit 7)
          LE Remove Advertising Set (Octet 37 - Bit 0)
          LE Clear Advertising Sets (Octet 37 - Bit 1)
          LE Set Periodic Advertising Parameters (Octet 37 - Bit 2)
          LE Set Periodic Advertising Data (Octet 37 - Bit 3)
          LE Set Periodic Advertising Enable (Octet 37 - Bit 4)
          LE Set Extended Scan Parameters (Octet 37 - Bit 5)
          LE Set Extended Scan Enable (Octet 37 - Bit 6)
          LE Extended Create Connection (Octet 37 - Bit 7)
          LE Periodic Advertising Create Sync (Octet 38 - Bit 0)
          LE Periodic Advertising Create Sync Cancel (Octet 38 - Bit 1)
          LE Periodic Advertising Terminate Sync (Octet 38 - Bit 2)
          LE Add Device To Periodic Advertiser List (Octet 38 - Bit 3)
          LE Remove Device From Periodic Advertiser List (Octet 38 - Bit 4)
          LE Clear Periodic Advertiser List (Octet 38 - Bit 5)
          LE Read Periodic Advertiser List Size (Octet 38 - Bit 6)
          LE Read Transmit Power (Octet 38 - Bit 7)
          LE Read RF Path Compensation (Octet 39 - Bit 0)
          LE Write RF Path Compensation (Octet 39 - Bit 1)
          LE Set Privacy Mode (Octet 39 - Bit 2)
          LE Periodic Advertising Receive Enable (Octet 40 - Bit 5)
          LE Periodic Advertising Sync Transfer (Octet 40 - Bit 6)
          LE Periodic Advertising Set Info Transfer (Octet 40 - Bit 7)
          LE Periodic Advertising Sync Transfer Parameters (Octet 41 - Bit 0)
          LE Set Default Periodic Advertisng Sync Transfer Parameters (Octet 41 - Bit 1)
          LE Read Buffer v2 (Octet 41 - Bit 5)
          LE Read ISO TX Sync (Octet 41 - Bit 6)
          LE Set Connected Isochronous Group Parameters (Octet 41 - Bit 7)
          LE Set Connected Isochronous Group Parameters Test (Octet 42 - Bit 0)
          LE Create Connected Isochronous Stream (Octet 42 - Bit 1)
          LE Remove Connected Isochronous Group (Octet 42 - Bit 2)
          LE Accept Connected Isochronous Stream Request (Octet 42 - Bit 3)
          LE Reject Connected Isochronous Stream Request (Octet 42 - Bit 4)
          LE Create Broadcast Isochronous Group (Octet 42 - Bit 5)
          LE Create Broadcast Isochronous Group Test (Octet 42 - Bit 6)
          LE Terminate Broadcast Isochronous Group (Octet 42 - Bit 7)
          LE Broadcast Isochronous Group Create Sync (Octet 43 - Bit 0)
          LE Broadcast Isochronous Group Terminate Sync (Octet 43 - Bit 1)
          LE Request Peer SCA (Octet 43 - Bit 2)
          LE Setup Isochronous Data Path (Octet 43 - Bit 3)
          LE Remove Isochronous Data Path (Octet 43 - Bit 4)
          LE Isochronous Transmit Test (Octet 43 - Bit 5)
          LE Isochronous Receive Test (Octet 43 - Bit 6)
          LE Isochronous Read Test Counters (Octet 43 - Bit 7)
          LE Isochronous Read Test Counters (Octet 44 - Bit 0)
          LE Set Host Feature (Octet 44 - Bit 1)
          Octet 44 - Bit 2 
          Octet 45 - Bit 6 
          Octet 46 - Bit 0 
          Octet 46 - Bit 1 
          Octet 46 - Bit 2 
zephyr.exe[325281]: < HCI Command: Host Buffer Size (0x03|0x0033) plen 7                                              #9 0.129738
        ACL MTU: 255  ACL max packet: 16
        SCO MTU: 0    SCO max packet: 0
> HCI Event: Command Complete (0x0e) plen 4                                                                          #10 0.130267
      Host Buffer Size (0x03|0x0033) ncmd 1
        Status: Success (0x00)
zephyr.exe[325281]: < HCI Command: Set Controller To Host Flow Control (0x03|0x0031) plen 1                          #11 0.149733
        Flow control: ACL Data Packets (0x01)
> HCI Event: Command Complete (0x0e) plen 4                                                                          #12 0.150193
      Set Controller To Host Flow Control (0x03|0x0031) ncmd 1
        Status: Success (0x00)
zephyr.exe[325281]: < HCI Command: LE Read Local Supported Features (0x08|0x0003) plen 0                             #13 0.169745
> HCI Event: Command Complete (0x0e) plen 12                                                                         #14 0.170264
      LE Read Local Supported Features (0x08|0x0003) ncmd 1
        Status: Success (0x00)
        Features: 0xfd 0x79 0x00 0xf7 0x30 0x01 0x00 0x00
          LE Encryption
          Extended Reject Indication
          Peripheral-initiated Features Exchange
          LE Ping
          LE Data Packet Length Extension
          LL Privacy
          Extended Scanner Filter Policies
          LE 2M PHY
          LE Coded PHY
          LE Extended Advertising
          LE Periodic Advertising
          Channel Selection Algorithm #2
          Periodic Advertising Sync Transfer - Sender
          Periodic Advertising Sync Transfer - Recipient
          Sleep Clock Accuracy Updates
          Connected Isochronous Stream - Central
          Connected Isochronous Stream - Peripheral
          Isochronous Broadcaster
          Synchronized Receiver
          Periodic Advertising ADI support
          Connection Subrating
          Unknown features (0x0000010000000000)
zephyr.exe[325281]: < HCI Command: LE Set Host Feature (0x08|0x0074) plen 2                                          #15 0.189741
        Bit Number: 32
          Connected Isochronous Stream (Host Support)
        Bit Value: 1
> HCI Event: Command Complete (0x0e) plen 4                                                                          #16 0.190133
      LE Set Host Feature (0x08|0x0074) ncmd 1
        Status: Success (0x00)
zephyr.exe[325281]: < HCI Command: LE Read Buffer v2 (0x08|0x0060) plen 0                                            #17 0.209733
> HCI Event: Command Complete (0x0e) plen 10                                                                         #18 0.210250
      LE Read Buffer v2 (0x08|0x0060) ncmd 1
        Status: Success (0x00)
        ACL MTU: 27
        ACL max packet: 3
        ISO MTU: 318
        ISO max packet: 3
zephyr.exe[325281]: < HCI Command: LE Read Maximum Advertising Data Length (0x08|0x003a) plen 0                      #19 0.229759
> HCI Event: Command Complete (0x0e) plen 6                                                                          #20 0.230157
      LE Read Maximum Advertising Data Length (0x08|0x003a) ncmd 1
        Status: Success (0x00)
        Max length: 1650
zephyr.exe[325281]: < HCI Command: LE Read Supported States (0x08|0x001c) plen 0                                     #21 0.249698
> HCI Event: Command Complete (0x0e) plen 12                                                                         #22 0.250208
      LE Read Supported States (0x08|0x001c) ncmd 1
        Status: Success (0x00)
        States: 0x000003ff3e0306ff
          Non-connectable Advertising State
          Scannable Advertising State
          Connectable Advertising State
          High Duty Cycle Directed Advertising State
          Passive Scanning State
          Active Scanning State
          Initiating State
            and Connection State (Central Role)
          Connection State (Peripheral Role)
          Scannable Advertising State
            and Passive Scanning State
          Connectable Advertising State
            and Passive Scanning State
          Non-connectable Advertising State
            and Initiating State
          Scannable Advertising State
            and Initiating State
          Active Scanning State
            and Connection State (Central Role)
          Passive Scanning State
            and Connection State (Peripheral Role)
          Active Scanning State
            and Connection State (Peripheral Role)
          Initiating State
            and Connection State (Central Role)
            and Central Role & Central Role
          Low Duty Cycle Directed Advertising State
          Connectable Advertising State
            and Initiating State
            and Central Role & Peripheral Role
          High Duty Cycle Directed Advertising State
            and Initiating State
            and Central Role & Peripheral Role
          Low Duty Cycle Directed Advertising State
            and Initiating State
            and Central Role & Peripheral Role
          Connectable Advertising State
            and Connection State (Central Role)
            and Central Role & Peripheral Role
          High Duty Cycle Directed Advertising State
            and Connection State (Central Role)
            and Central Role & Peripheral Role
          Low Duty Cycle Directed Advertising State
            and Connection State (Central Role)
            and Central Role & Peripheral Role
          Connectable Advertising State
            and Connection State (Peripheral Role)
            and Central Role & Peripheral Role
          High Duty Cycle Directed Advertising State
            and Connection State (Peripheral Role)
            and Peripheral Role & Peripheral Role
          Low Duty Cycle Directed Advertising State
            and Connection State (Peripheral Role)
            and Peripheral Role & Peripheral Role
          Initiating State
            and Connection State (Peripheral Role)
            and Central Role & Peripheral Role
zephyr.exe[325281]: < HCI Command: LE Read Maximum Data Length (0x08|0x002f) plen 0                                  #23 0.269737
> HCI Event: Command Complete (0x0e) plen 12                                                                         #24 0.270294
      LE Read Maximum Data Length (0x08|0x002f) ncmd 1
        Status: Success (0x00)
        Max TX octets: 251
        Max TX time: 2704
        Max RX octets: 251
        Max RX time: 2704
zephyr.exe[325281]: < HCI Command: LE Write Suggested Default Data Length (0x08|0x0024) plen 4                       #25 0.289740
        TX octets: 251
        TX time: 2704
> HCI Event: Command Complete (0x0e) plen 4                                                                          #26 0.290260
      LE Write Suggested Default Data Length (0x08|0x0024) ncmd 1
        Status: Success (0x00)
zephyr.exe[325281]: < HCI Command: LE Read Resolving List Size (0x08|0x002a) plen 0                                  #27 0.309735
> HCI Event: Command Complete (0x0e) plen 5                                                                          #28 0.310129
      LE Read Resolving List Size (0x08|0x002a) ncmd 1
        Status: Success (0x00)
        Size: 8
zephyr.exe[325281]: < HCI Command: LE Set Event Mask (0x08|0x0001) plen 8                                            #29 0.329730
        Mask: 0x000002023f87fa5e
          LE Advertising Report
          LE Connection Update Complete
          LE Read Remote Used Features Complete
          LE Long Term Key Request
          LE Data Length Change
          LE Enhanced Connection Complete
          LE PHY Update Complete
          LE Extended Advertising Report
          LE Periodic Advertising Sync Established
          LE Periodic Advertising Report
          LE Periodic Advertising Sync Lost
          LE Extended Scan Timeout
          LE Extended Advertising Set Terminated
          LE Scan Request Received
          LE Periodic Advertising Sync Transfer Rvc
          LE CIS Established
          LE CIS Request
          LE Create BIG Complete
          LE Terminate BIG Complete
          LE BIG Sync Estabilished Complete
          LE BIG Sync Lost
          LE BIG Info Advertising Report
          Unknown mask (0x0000020000000000)
> HCI Event: Command Complete (0x0e) plen 4                                                                          #30 0.330343
      LE Set Event Mask (0x08|0x0001) ncmd 1
        Status: Success (0x00)
zephyr.exe[325281]: < HCI Command: Set Event Mask (0x03|0x0001) plen 8                                               #31 0.349763
        Mask: 0x2000800002008890
          Disconnection Complete
          Encryption Change
          Read Remote Version Information Complete
          Hardware Error
          Data Buffer Overflow
          Encryption Key Refresh Complete
          LE Meta
> HCI Event: Command Complete (0x0e) plen 4                                                                          #32 0.350316
      Set Event Mask (0x03|0x0001) ncmd 1
        Status: Success (0x00)
zephyr.exe[325281]: < HCI Command: Read BD ADDR (0x04|0x0009) plen 0                                                 #33 0.369737
> HCI Event: Command Complete (0x0e) plen 10                                                                         #34 0.370268
      Read BD ADDR (0x04|0x0009) ncmd 1
        Status: Success (0x00)
        Address: 00:00:00:00:00:00 (OUI 00-00-00)
zephyr.exe[325281]: < HCI Command: LE Set Random Address (0x08|0x0005) plen 6                                        #35 0.389743
        Address: D5:B6:CC:31:DB:3B (Static)
> HCI Event: Command Complete (0x0e) plen 4                                                                          #36 0.390296
      LE Set Random Address (0x08|0x0005) ncmd 1
        Status: Success (0x00)
zephyr.exe[325281]: < HCI Command: LE Extended Create Connection (0x08|0x0043) plen 26                               #37 2.599920
        Filter policy: Accept list is not used (0x00)
        Own address type: Random (0x01)
        Peer address type: Public (0x00)
        Peer address: DF:A9:FF:F6:B1:1A (OUI DF-A9-FF)
        Initiating PHYs: 0x01
        Entry 0: LE 1M
          Scan interval: 60.000 msec (0x0060)
          Scan window: 60.000 msec (0x0060)
          Min connection interval: 30.00 msec (0x0018)
          Max connection interval: 50.00 msec (0x0028)
          Connection latency: 0 (0x0000)
          Supervision timeout: 4000 msec (0x0190)
          Min connection length: 0.000 msec (0x0000)
          Max connection length: 0.000 msec (0x0000)
> HCI Event: Command Status (0x0f) plen 4                                                                            #38 2.600849
      LE Extended Create Connection (0x08|0x0043) ncmd 1
        Status: Success (0x00)
> HCI Event: LE Meta Event (0x3e) plen 31                                                                            #39 2.627731
      LE Enhanced Connection Complete (0x0a)
        Status: Success (0x00)
        Handle: 90
        Role: Central (0x00)
        Peer address type: Public (0x00)
        Peer address: DF:A9:FF:F6:B1:1A (OUI DF-A9-FF)
        Local resolvable private address: 00:00:00:00:00:00 (Non-Resolvable)
        Peer resolvable private address: 00:00:00:00:00:00 (Non-Resolvable)
        Connection interval: 50.00 msec (0x0028)
        Connection latency: 0 (0x0000)
        Supervision timeout: 4000 msec (0x0190)
        Central clock accuracy: 0x00
zephyr.exe[325281]: < HCI Command: LE Read Remote Used Features (0x08|0x0016) plen 2                                 #40 2.629947
        Handle: 90 Address: DF:A9:FF:F6:B1:1A (OUI DF-A9-FF)
> HCI Event: Command Status (0x0f) plen 4                                                                            #41 2.630488
      LE Read Remote Used Features (0x08|0x0016) ncmd 1
        Status: Success (0x00)
zephyr.exe[325281]: < HCI Command: LE Set PHY (0x08|0x0032) plen 7                                                   #42 2.649760
        Handle: 90 Address: DF:A9:FF:F6:B1:1A (OUI DF-A9-FF)
        All PHYs preference: 0x00
        TX PHYs preference: 0x02
          LE 2M
        RX PHYs preference: 0x02
          LE 2M
        PHY options preference: Reserved (0x0000)
> HCI Event: Command Status (0x0f) plen 4                                                                            #43 2.650290
      LE Set PHY (0x08|0x0032) ncmd 1
        Status: Success (0x00)
> ACL Data RX: Handle 90 flags 0x02 dlen 6                                                                           #44 2.679071
      SMP: Security Request (0x0b) len 1
        Authentication requirement: No bonding, MITM, SC, No Keypresses (0x0c)
zephyr.exe[325281]: < HCI Command: Host Number of Completed Packets (0x03|0x0035) plen 5                             #45 2.689811
        Num handles: 1
        Handle: 90 Address: DF:A9:FF:F6:B1:1A (OUI DF-A9-FF)
        Count: 1
zephyr.exe[325281]: < ACL Data TX: Handle 90 flags 0x00 dlen 11                                                      #46 2.689944
      SMP: Pairing Request (0x01) len 6
        IO capability: DisplayOnly (0x00)
        OOB data: Authentication data not present (0x00)
        Authentication requirement: Bonding, No MITM, SC, No Keypresses (0x09)
        Max encryption key size: 16
        Initiator key distribution: EncKey (0x01)
        Responder key distribution: EncKey IdKey (0x03)
> HCI Event: Number of Completed Packets (0x13) plen 5                                                               #47 2.779098
        Num handles: 1
        Handle: 90 Address: DF:A9:FF:F6:B1:1A (OUI DF-A9-FF)
        Count: 1
        #46: len 11 (0 Kb/s)
        Latency: 89 msec (89-89 msec ~89 msec)
> HCI Event: LE Meta Event (0x3e) plen 12                                                                            #48 2.779258
      LE Read Remote Used Features (0x04)
        Status: Success (0x00)
        Handle: 90 Address: DF:A9:FF:F6:B1:1A (OUI DF-A9-FF)
        Features: 0x2d 0x49 0x00 0xf7 0x67 0xd8 0x00 0x00
          LE Encryption
          Extended Reject Indication
          Peripheral-initiated Features Exchange
          LE Data Packet Length Extension
          LE 2M PHY
          LE Coded PHY
          Channel Selection Algorithm #2
          Periodic Advertising Sync Transfer - Sender
          Periodic Advertising Sync Transfer - Recipient
          Sleep Clock Accuracy Updates
          Connected Isochronous Stream - Central
          Connected Isochronous Stream - Peripheral
          Isochronous Broadcaster
          Synchronized Receiver
          Connected Isochronous Stream (Host Support)
          LE Power Control Request
          LE Power Control Request
          Connection Subrating
          Connection Subrating (Host Support)
          Unknown features (0x0000d80000000000)
> ACL Data RX: Handle 90 flags 0x02 dlen 11                                                                          #49 2.829080
      SMP: Pairing Response (0x02) len 6
        IO capability: KeyboardDisplay (0x04)
        OOB data: Authentication data not present (0x00)
        Authentication requirement: No bonding, MITM, SC, No Keypresses (0x0c)
        Max encryption key size: 16
        Initiator key distribution: <none> (0x00)
        Responder key distribution: <none> (0x00)
zephyr.exe[325281]: < HCI Command: Host Number of Completed Packets (0x03|0x0035) plen 5                             #50 2.829785
        Num handles: 1
        Handle: 90 Address: DF:A9:FF:F6:B1:1A (OUI DF-A9-FF)
        Count: 1
zephyr.exe[325281]: < ACL Data TX: Handle 90 flags 0x00 dlen 27                                                      #51 2.829840
zephyr.exe[325281]: < ACL Data TX: Handle 90 flags 0x01 dlen 27                                                      #52 2.829842
zephyr.exe[325281]: < ACL Data TX: Handle 90 flags 0x01 dlen 15                                                      #53 2.829843
      SMP: Pairing Public Key (0x0c) len 64
        X: 98308440221e2d910f0e54b71e7ec652857aa9b5a0dc65028824cc19db1226e9
        Y: 67a4816bcb62efb21701e31fdb27561a6217575fb007a8bbdabe7e28b6f68482
> HCI Event: Number of Completed Packets (0x13) plen 5                                                               #54 2.879067
        Num handles: 1
        Handle: 90 Address: DF:A9:FF:F6:B1:1A (OUI DF-A9-FF)
        Count: 1
        #51: len 27 (4 Kb/s)
        Latency: 49 msec (49-89 msec ~69 msec)
> HCI Event: Number of Completed Packets (0x13) plen 5                                                               #55 2.929230
        Num handles: 1
        Handle: 90 Address: DF:A9:FF:F6:B1:1A (OUI DF-A9-FF)
        Count: 1
        #52: len 27 (2 Kb/s)
        Latency: 99 msec (49-99 msec ~84 msec)
> HCI Event: Number of Completed Packets (0x13) plen 5                                                               #56 3.029105
        Num handles: 1
        Handle: 90 Address: DF:A9:FF:F6:B1:1A (OUI DF-A9-FF)
        Count: 1
        #53: len 15 (0 Kb/s)
        Latency: 199 msec (49-199 msec ~141 msec)
> ACL Data RX: Handle 90 flags 0x02 dlen 27                                                                          #57 3.079299
> ACL Data RX: Handle 90 flags 0x01 dlen 27                                                                          #58 3.079906
> ACL Data RX: Handle 90 flags 0x01 dlen 15                                                                          #59 3.080463
      SMP: Pairing Public Key (0x0c) len 64
        X: d73ea7dc3ff697e5d4ae7e79045b8b322d22081189047acdd5ea2744875970b2
        Y: 1c803ebd1f44a4d72bd6933f9d9208b06076391a94e6521d982b9d0a63b3cb05
zephyr.exe[325281]: < HCI Command: Host Number of Completed Packets (0x03|0x0035) plen 5                             #60 3.089992
        Num handles: 1
        Handle: 90 Address: DF:A9:FF:F6:B1:1A (OUI DF-A9-FF)
        Count: 1
zephyr.exe[325281]: < HCI Command: Host Number of Completed Packets (0x03|0x0035) plen 5                             #61 3.090080
        Num handles: 1
        Handle: 90 Address: DF:A9:FF:F6:B1:1A (OUI DF-A9-FF)
        Count: 1
zephyr.exe[325281]: < HCI Command: Host Number of Completed Packets (0x03|0x0035) plen 5                             #62 3.090305
        Num handles: 1
        Handle: 90 Address: DF:A9:FF:F6:B1:1A (OUI DF-A9-FF)
        Count: 1
zephyr.exe[325281]: < ACL Data TX: Handle 90 flags 0x00 dlen 21                                                      #63 3.090424
      SMP: Pairing Confirm (0x03) len 16
        Confim value: f00ac9ec857454061dff02c7190c4ef1
> HCI Event: Number of Completed Packets (0x13) plen 5                                                               #64 3.129085
        Num handles: 1
        Handle: 90 Address: DF:A9:FF:F6:B1:1A (OUI DF-A9-FF)
        Count: 1
        #63: len 21 (4 Kb/s)
        Latency: 38 msec (38-199 msec ~90 msec)
> HCI Event: LE Meta Event (0x3e) plen 6                                                                             #65 3.278428
      LE PHY Update Complete (0x0c)
        Status: Success (0x00)
        Handle: 90 Address: DF:A9:FF:F6:B1:1A (OUI DF-A9-FF)
        TX PHY: LE 2M (0x02)
        RX PHY: LE 2M (0x02)
> ACL Data RX: Handle 90 flags 0x02 dlen 21                                                                          #66 3.779051
      SMP: Pairing Confirm (0x03) len 16
        Confim value: 5f10a3b69ca8201a7924e932e7e1e173
zephyr.exe[325281]: < HCI Command: Host Number of Completed Packets (0x03|0x0035) plen 5                             #67 3.789950
        Num handles: 1
        Handle: 90 Address: DF:A9:FF:F6:B1:1A (OUI DF-A9-FF)
        Count: 1
zephyr.exe[325281]: < ACL Data TX: Handle 90 flags 0x00 dlen 21                                                      #68 3.790087
      SMP: Pairing Random (0x04) len 16
        Random value: 8e6108f966a694cbe26df70bb96773e6
> HCI Event: Number of Completed Packets (0x13) plen 5                                                               #69 3.828842
        Num handles: 1
        Handle: 90 Address: DF:A9:FF:F6:B1:1A (OUI DF-A9-FF)
        Count: 1
        #68: len 21 (4 Kb/s)
        Latency: 38 msec (38-199 msec ~64 msec)
> ACL Data RX: Handle 90 flags 0x02 dlen 21                                                                          #70 4.078988
      SMP: Pairing Random (0x04) len 16
        Random value: 1cc3247637284968e05dd3ff65415e2d
zephyr.exe[325281]: < HCI Command: Host Number of Completed Packets (0x03|0x0035) plen 5                             #71 4.090493
        Num handles: 1
        Handle: 90 Address: DF:A9:FF:F6:B1:1A (OUI DF-A9-FF)
        Count: 1
zephyr.exe[325281]: < ACL Data TX: Handle 90 flags 0x00 dlen 21                                                      #72 4.090751
      SMP: Pairing Confirm (0x03) len 16
        Confim value: 4460a31d341f5b79abe48c15fda1af5b
> HCI Event: Number of Completed Packets (0x13) plen 5                                                               #73 4.128828
        Num handles: 1
        Handle: 90 Address: DF:A9:FF:F6:B1:1A (OUI DF-A9-FF)
        Count: 1
        #72: len 21 (4 Kb/s)
        Latency: 38 msec (38-199 msec ~51 msec)
> ACL Data RX: Handle 90 flags 0x02 dlen 21                                                                          #74 4.179128
      SMP: Pairing Confirm (0x03) len 16
        Confim value: 0f86de3ad6a8ff7602ad5cf9d16a4be1
zephyr.exe[325281]: < HCI Command: Host Number of Completed Packets (0x03|0x0035) plen 5                             #75 4.190158
        Num handles: 1
        Handle: 90 Address: DF:A9:FF:F6:B1:1A (OUI DF-A9-FF)
        Count: 1
zephyr.exe[325281]: < ACL Data TX: Handle 90 flags 0x00 dlen 21                                                      #76 4.190344
      SMP: Pairing Random (0x04) len 16
        Random value: 4d02679f89a05211af56d8b3da64d21e
> HCI Event: Number of Completed Packets (0x13) plen 5                                                               #77 4.228812
        Num handles: 1
        Handle: 90 Address: DF:A9:FF:F6:B1:1A (OUI DF-A9-FF)
        Count: 1
        #76: len 21 (4 Kb/s)
        Latency: 38 msec (38-199 msec ~44 msec)
> ACL Data RX: Handle 90 flags 0x02 dlen 21                                                                          #78 4.479123
      SMP: Pairing Random (0x04) len 16
        Random value: 68a9833ae312ef6d1fa40f973252cae3
zephyr.exe[325281]: < HCI Command: Host Number of Completed Packets (0x03|0x0035) plen 5                             #79 4.490260
        Num handles: 1
        Handle: 90 Address: DF:A9:FF:F6:B1:1A (OUI DF-A9-FF)
        Count: 1
zephyr.exe[325281]: < ACL Data TX: Handle 90 flags 0x00 dlen 21                                                      #80 4.490586
      SMP: Pairing Confirm (0x03) len 16
        Confim value: 54b0b7e336470ea21c78844af923640f
> HCI Event: Number of Completed Packets (0x13) plen 5                                                               #81 4.528832
        Num handles: 1
        Handle: 90 Address: DF:A9:FF:F6:B1:1A (OUI DF-A9-FF)
        Count: 1
        #80: len 21 (4 Kb/s)
        Latency: 38 msec (38-199 msec ~41 msec)
> ACL Data RX: Handle 90 flags 0x02 dlen 21                                                                          #82 4.579103
      SMP: Pairing Confirm (0x03) len 16
        Confim value: 2fa3989616d442bc51cc66f309f427f5
zephyr.exe[325281]: < HCI Command: Host Number of Completed Packets (0x03|0x0035) plen 5                             #83 4.590271
        Num handles: 1
        Handle: 90 Address: DF:A9:FF:F6:B1:1A (OUI DF-A9-FF)
        Count: 1
zephyr.exe[325281]: < ACL Data TX: Handle 90 flags 0x00 dlen 21                                                      #84 4.590445
      SMP: Pairing Random (0x04) len 16
        Random value: 5e8286bc235a02440d0c3424a2acf8fd
> HCI Event: Number of Completed Packets (0x13) plen 5                                                               #85 4.628780
        Num handles: 1
        Handle: 90 Address: DF:A9:FF:F6:B1:1A (OUI DF-A9-FF)
        Count: 1
        #84: len 21 (4 Kb/s)
        Latency: 38 msec (38-199 msec ~39 msec)
> ACL Data RX: Handle 90 flags 0x02 dlen 21                                                                          #86 4.879103
      SMP: Pairing Random (0x04) len 16
        Random value: 17b28637ab37dd76389218af598b2e0c
zephyr.exe[325281]: < HCI Command: Host Number of Completed Packets (0x03|0x0035) plen 5                             #87 4.890043
        Num handles: 1
        Handle: 90 Address: DF:A9:FF:F6:B1:1A (OUI DF-A9-FF)
        Count: 1
zephyr.exe[325281]: < ACL Data TX: Handle 90 flags 0x00 dlen 21                                                      #88 4.890148
      SMP: Pairing Confirm (0x03) len 16
        Confim value: da0a03751fba4c7b8c6ae7ef0f7be5ad
> HCI Event: Number of Completed Packets (0x13) plen 5                                                               #89 4.928772
        Num handles: 1
        Handle: 90 Address: DF:A9:FF:F6:B1:1A (OUI DF-A9-FF)
        Count: 1
        #88: len 21 (4 Kb/s)
        Latency: 38 msec (38-199 msec ~39 msec)
> ACL Data RX: Handle 90 flags 0x02 dlen 21                                                                          #90 4.978970
      SMP: Pairing Confirm (0x03) len 16
        Confim value: d965c919e8943fbe91bdfa24528d69d8
zephyr.exe[325281]: < HCI Command: Host Number of Completed Packets (0x03|0x0035) plen 5                             #91 4.990300
        Num handles: 1
        Handle: 90 Address: DF:A9:FF:F6:B1:1A (OUI DF-A9-FF)
        Count: 1
zephyr.exe[325281]: < ACL Data TX: Handle 90 flags 0x00 dlen 21                                                      #92 4.990585
      SMP: Pairing Random (0x04) len 16
        Random value: 5c4a1bcadd27bd58e945097b00bad7ac
> HCI Event: Number of Completed Packets (0x13) plen 5                                                               #93 5.028808
        Num handles: 1
        Handle: 90 Address: DF:A9:FF:F6:B1:1A (OUI DF-A9-FF)
        Count: 1
        #92: len 21 (4 Kb/s)
        Latency: 38 msec (38-199 msec ~38 msec)
> ACL Data RX: Handle 90 flags 0x02 dlen 21                                                                          #94 5.278965
      SMP: Pairing Random (0x04) len 16
        Random value: 70c9894f46b15e1250712b897063b898
zephyr.exe[325281]: < HCI Command: Host Number of Completed Packets (0x03|0x0035) plen 5                             #95 5.290370
        Num handles: 1
        Handle: 90 Address: DF:A9:FF:F6:B1:1A (OUI DF-A9-FF)
        Count: 1
zephyr.exe[325281]: < ACL Data TX: Handle 90 flags 0x00 dlen 21                                                      #96 5.290583
      SMP: Pairing Confirm (0x03) len 16
        Confim value: c8e3345834fd7e1c9fd8a33967b45f2e
> HCI Event: Number of Completed Packets (0x13) plen 5                                                               #97 5.328730
        Num handles: 1
        Handle: 90 Address: DF:A9:FF:F6:B1:1A (OUI DF-A9-FF)
        Count: 1
        #96: len 21 (4 Kb/s)
        Latency: 38 msec (38-199 msec ~38 msec)
> ACL Data RX: Handle 90 flags 0x02 dlen 21                                                                          #98 5.378966
      SMP: Pairing Confirm (0x03) len 16
        Confim value: 875e73474ccfe52f9170f08e3bd1781d
zephyr.exe[325281]: < HCI Command: Host Number of Completed Packets (0x03|0x0035) plen 5                             #99 5.390206
        Num handles: 1
        Handle: 90 Address: DF:A9:FF:F6:B1:1A (OUI DF-A9-FF)
        Count: 1
zephyr.exe[325281]: < ACL Data TX: Handle 90 flags 0x00 dlen 21                                                     #100 5.390337
      SMP: Pairing Random (0x04) len 16
        Random value: 32527e6e64e79f33b2e374394db8ab2d
> HCI Event: Number of Completed Packets (0x13) plen 5                                                              #101 5.428747
        Num handles: 1
        Handle: 90 Address: DF:A9:FF:F6:B1:1A (OUI DF-A9-FF)
        Count: 1
        #100: len 21 (4 Kb/s)
        Latency: 38 msec (38-199 msec ~38 msec)
> ACL Data RX: Handle 90 flags 0x02 dlen 21                                                                         #102 5.678985
      SMP: Pairing Random (0x04) len 16
        Random value: f7152ba2a7d80014cbc9c6a64c95d4b9
zephyr.exe[325281]: < HCI Command: Host Number of Completed Packets (0x03|0x0035) plen 5                            #103 5.690427
        Num handles: 1
        Handle: 90 Address: DF:A9:FF:F6:B1:1A (OUI DF-A9-FF)
        Count: 1
zephyr.exe[325281]: < ACL Data TX: Handle 90 flags 0x00 dlen 21                                                     #104 5.690661
      SMP: Pairing Confirm (0x03) len 16
        Confim value: 84851a141d42b99eb18c9970c30b7714
> HCI Event: Number of Completed Packets (0x13) plen 5                                                              #105 5.728753
        Num handles: 1
        Handle: 90 Address: DF:A9:FF:F6:B1:1A (OUI DF-A9-FF)
        Count: 1
        #104: len 21 (4 Kb/s)
        Latency: 38 msec (38-199 msec ~38 msec)
> ACL Data RX: Handle 90 flags 0x02 dlen 21                                                                         #106 5.778974
      SMP: Pairing Confirm (0x03) len 16
        Confim value: 4c9f95a6e2b2bd6add0789c980d7d180
zephyr.exe[325281]: < HCI Command: Host Number of Completed Packets (0x03|0x0035) plen 5                            #107 5.790259
        Num handles: 1
        Handle: 90 Address: DF:A9:FF:F6:B1:1A (OUI DF-A9-FF)
        Count: 1
zephyr.exe[325281]: < ACL Data TX: Handle 90 flags 0x00 dlen 21                                                     #108 5.790527
      SMP: Pairing Random (0x04) len 16
        Random value: dddbdfe2838e9a8cc6964353c850fef7
> HCI Event: Number of Completed Packets (0x13) plen 5                                                              #109 5.828777
        Num handles: 1
        Handle: 90 Address: DF:A9:FF:F6:B1:1A (OUI DF-A9-FF)
        Count: 1
        #108: len 21 (4 Kb/s)
        Latency: 38 msec (38-199 msec ~38 msec)
> ACL Data RX: Handle 90 flags 0x02 dlen 21                                                                         #110 6.078959
      SMP: Pairing Random (0x04) len 16
        Random value: 710147910547908b4f64a5c701182fdf
zephyr.exe[325281]: < HCI Command: Host Number of Completed Packets (0x03|0x0035) plen 5                            #111 6.090473
        Num handles: 1
        Handle: 90 Address: DF:A9:FF:F6:B1:1A (OUI DF-A9-FF)
        Count: 1
zephyr.exe[325281]: < ACL Data TX: Handle 90 flags 0x00 dlen 21                                                     #112 6.090689
      SMP: Pairing Confirm (0x03) len 16
        Confim value: 048aee8e892d448905073b141283faea
> HCI Event: Number of Completed Packets (0x13) plen 5                                                              #113 6.128718
        Num handles: 1
        Handle: 90 Address: DF:A9:FF:F6:B1:1A (OUI DF-A9-FF)
        Count: 1
        #112: len 21 (4 Kb/s)
        Latency: 38 msec (38-199 msec ~38 msec)
> ACL Data RX: Handle 90 flags 0x02 dlen 21                                                                         #114 6.178985
      SMP: Pairing Confirm (0x03) len 16
        Confim value: 4ad8b4f3c6e288403b9b664402018b5c
zephyr.exe[325281]: < HCI Command: Host Number of Completed Packets (0x03|0x0035) plen 5                            #115 6.189989
        Num handles: 1
        Handle: 90 Address: DF:A9:FF:F6:B1:1A (OUI DF-A9-FF)
        Count: 1
zephyr.exe[325281]: < ACL Data TX: Handle 90 flags 0x00 dlen 21                                                     #116 6.190085
      SMP: Pairing Random (0x04) len 16
        Random value: eb9f1915536596b6fc3db1c86b2b1970
> HCI Event: Number of Completed Packets (0x13) plen 5                                                              #117 6.228716
        Num handles: 1
        Handle: 90 Address: DF:A9:FF:F6:B1:1A (OUI DF-A9-FF)
        Count: 1
        #116: len 21 (4 Kb/s)
        Latency: 38 msec (38-199 msec ~38 msec)
> ACL Data RX: Handle 90 flags 0x02 dlen 21                                                                         #118 6.478977
      SMP: Pairing Random (0x04) len 16
        Random value: e334fcbed3d51acac04ac6ede428b6bc
zephyr.exe[325281]: < HCI Command: Host Number of Completed Packets (0x03|0x0035) plen 5                            #119 6.490119
        Num handles: 1
        Handle: 90 Address: DF:A9:FF:F6:B1:1A (OUI DF-A9-FF)
        Count: 1
zephyr.exe[325281]: < ACL Data TX: Handle 90 flags 0x00 dlen 21                                                     #120 6.490208
      SMP: Pairing Confirm (0x03) len 16
        Confim value: 30b4395d5f17227b733d40cca97d3cd4
> HCI Event: Number of Completed Packets (0x13) plen 5                                                              #121 6.528680
        Num handles: 1
        Handle: 90 Address: DF:A9:FF:F6:B1:1A (OUI DF-A9-FF)
        Count: 1
        #120: len 21 (4 Kb/s)
        Latency: 38 msec (38-199 msec ~38 msec)
> ACL Data RX: Handle 90 flags 0x02 dlen 21                                                                         #122 6.578856
      SMP: Pairing Confirm (0x03) len 16
        Confim value: 01ec8e746a12c082579d06182b890d3e
zephyr.exe[325281]: < HCI Command: Host Number of Completed Packets (0x03|0x0035) plen 5                            #123 6.590257
        Num handles: 1
        Handle: 90 Address: DF:A9:FF:F6:B1:1A (OUI DF-A9-FF)
        Count: 1
zephyr.exe[325281]: < ACL Data TX: Handle 90 flags 0x00 dlen 21                                                     #124 6.590351
      SMP: Pairing Random (0x04) len 16
        Random value: 5c794dc9ad9f2c3f295ebd5ad5e1c3cf
> HCI Event: Number of Completed Packets (0x13) plen 5                                                              #125 6.628852
        Num handles: 1
        Handle: 90 Address: DF:A9:FF:F6:B1:1A (OUI DF-A9-FF)
        Count: 1
        #124: len 21 (4 Kb/s)
        Latency: 38 msec (38-199 msec ~38 msec)
> ACL Data RX: Handle 90 flags 0x02 dlen 21                                                                         #126 6.878893
      SMP: Pairing Random (0x04) len 16
        Random value: 9398a609c79bec6045c566598a3b9740
zephyr.exe[325281]: < HCI Command: Host Number of Completed Packets (0x03|0x0035) plen 5                            #127 6.890062
        Num handles: 1
        Handle: 90 Address: DF:A9:FF:F6:B1:1A (OUI DF-A9-FF)
        Count: 1
zephyr.exe[325281]: < ACL Data TX: Handle 90 flags 0x00 dlen 21                                                     #128 6.890133
      SMP: Pairing Confirm (0x03) len 16
        Confim value: 09c2c1548933384c3812ffae99c65516
> HCI Event: Number of Completed Packets (0x13) plen 5                                                              #129 6.928657
        Num handles: 1
        Handle: 90 Address: DF:A9:FF:F6:B1:1A (OUI DF-A9-FF)
        Count: 1
        #128: len 21 (4 Kb/s)
        Latency: 38 msec (38-199 msec ~38 msec)
> ACL Data RX: Handle 90 flags 0x02 dlen 21                                                                         #130 6.978856
      SMP: Pairing Confirm (0x03) len 16
        Confim value: 5588e113fd0aa9790952bab2a2f44376
zephyr.exe[325281]: < HCI Command: Host Number of Completed Packets (0x03|0x0035) plen 5                            #131 6.989915
        Num handles: 1
        Handle: 90 Address: DF:A9:FF:F6:B1:1A (OUI DF-A9-FF)
        Count: 1
zephyr.exe[325281]: < ACL Data TX: Handle 90 flags 0x00 dlen 21                                                     #132 6.990022
      SMP: Pairing Random (0x04) len 16
        Random value: 5c2fff312cdf99c9491988e877355a9a
> HCI Event: Number of Completed Packets (0x13) plen 5                                                              #133 7.028760
        Num handles: 1
        Handle: 90 Address: DF:A9:FF:F6:B1:1A (OUI DF-A9-FF)
        Count: 1
        #132: len 21 (4 Kb/s)
        Latency: 38 msec (38-199 msec ~38 msec)
> ACL Data RX: Handle 90 flags 0x02 dlen 21                                                                         #134 7.278905
      SMP: Pairing Random (0x04) len 16
        Random value: 0456e193d6f49320405d018bc90b3e9e
zephyr.exe[325281]: < HCI Command: Host Number of Completed Packets (0x03|0x0035) plen 5                            #135 7.290416
        Num handles: 1
        Handle: 90 Address: DF:A9:FF:F6:B1:1A (OUI DF-A9-FF)
        Count: 1
zephyr.exe[325281]: < ACL Data TX: Handle 90 flags 0x00 dlen 21                                                     #136 7.290650
      SMP: Pairing Confirm (0x03) len 16
        Confim value: f940dfd38e4d027a97d3b6e2e5b61046
> HCI Event: Number of Completed Packets (0x13) plen 5                                                              #137 7.328694
        Num handles: 1
        Handle: 90 Address: DF:A9:FF:F6:B1:1A (OUI DF-A9-FF)
        Count: 1
        #136: len 21 (4 Kb/s)
        Latency: 38 msec (38-199 msec ~38 msec)
> ACL Data RX: Handle 90 flags 0x02 dlen 21                                                                         #138 7.378856
      SMP: Pairing Confirm (0x03) len 16
        Confim value: 0c2d5daaa4c2d0dcf40592aba8e0d3bf
zephyr.exe[325281]: < HCI Command: Host Number of Completed Packets (0x03|0x0035) plen 5                            #139 7.389953
        Num handles: 1
        Handle: 90 Address: DF:A9:FF:F6:B1:1A (OUI DF-A9-FF)
        Count: 1
zephyr.exe[325281]: < ACL Data TX: Handle 90 flags 0x00 dlen 21                                                     #140 7.390059
      SMP: Pairing Random (0x04) len 16
        Random value: c629a3a987d808e808655d558dfc1155
> HCI Event: Number of Completed Packets (0x13) plen 5                                                              #141 7.428732
        Num handles: 1
        Handle: 90 Address: DF:A9:FF:F6:B1:1A (OUI DF-A9-FF)
        Count: 1
        #140: len 21 (4 Kb/s)
        Latency: 38 msec (38-199 msec ~38 msec)
> ACL Data RX: Handle 90 flags 0x02 dlen 21                                                                         #142 7.678892
      SMP: Pairing Random (0x04) len 16
        Random value: fdd88cbd3577dc1a59dc5545b6925844
zephyr.exe[325281]: < HCI Command: Host Number of Completed Packets (0x03|0x0035) plen 5                            #143 7.690412
        Num handles: 1
        Handle: 90 Address: DF:A9:FF:F6:B1:1A (OUI DF-A9-FF)
        Count: 1
zephyr.exe[325281]: < ACL Data TX: Handle 90 flags 0x00 dlen 21                                                     #144 7.690657
      SMP: Pairing Confirm (0x03) len 16
        Confim value: 4d11b2d3f4e73c8cfa20156a9f0ed477
> HCI Event: Number of Completed Packets (0x13) plen 5                                                              #145 7.728664
        Num handles: 1
        Handle: 90 Address: DF:A9:FF:F6:B1:1A (OUI DF-A9-FF)
        Count: 1
        #144: len 21 (4 Kb/s)
        Latency: 38 msec (38-199 msec ~38 msec)
> ACL Data RX: Handle 90 flags 0x02 dlen 21                                                                         #146 7.778949
      SMP: Pairing Confirm (0x03) len 16
        Confim value: acf6b73fc7d5d80b5838474e3666488b
zephyr.exe[325281]: < HCI Command: Host Number of Completed Packets (0x03|0x0035) plen 5                            #147 7.790204
        Num handles: 1
        Handle: 90 Address: DF:A9:FF:F6:B1:1A (OUI DF-A9-FF)
        Count: 1
zephyr.exe[325281]: < ACL Data TX: Handle 90 flags 0x00 dlen 21                                                     #148 7.790464
      SMP: Pairing Random (0x04) len 16
        Random value: 92f20f6ad8f13724432c7fd6001c45ff
> HCI Event: Number of Completed Packets (0x13) plen 5                                                              #149 7.828628
        Num handles: 1
        Handle: 90 Address: DF:A9:FF:F6:B1:1A (OUI DF-A9-FF)
        Count: 1
        #148: len 21 (4 Kb/s)
        Latency: 38 msec (38-199 msec ~38 msec)
> ACL Data RX: Handle 90 flags 0x02 dlen 21                                                                         #150 8.078883
      SMP: Pairing Random (0x04) len 16
        Random value: 82c5c32959fed39f734a5e88a408d2e6
zephyr.exe[325281]: < HCI Command: Host Number of Completed Packets (0x03|0x0035) plen 5                            #151 8.090348
        Num handles: 1
        Handle: 90 Address: DF:A9:FF:F6:B1:1A (OUI DF-A9-FF)
        Count: 1
zephyr.exe[325281]: < ACL Data TX: Handle 90 flags 0x00 dlen 21                                                     #152 8.090580
      SMP: Pairing Confirm (0x03) len 16
        Confim value: c4589462a1536f9019debb4d47daad4f
> HCI Event: Number of Completed Packets (0x13) plen 5                                                              #153 8.128796
        Num handles: 1
        Handle: 90 Address: DF:A9:FF:F6:B1:1A (OUI DF-A9-FF)
        Count: 1
        #152: len 21 (4 Kb/s)
        Latency: 38 msec (38-199 msec ~38 msec)
> ACL Data RX: Handle 90 flags 0x02 dlen 21                                                                         #154 8.178857
      SMP: Pairing Confirm (0x03) len 16
        Confim value: 0c0b330a947ec60110f6b5c217e25198
zephyr.exe[325281]: < HCI Command: Host Number of Completed Packets (0x03|0x0035) plen 5                            #155 8.190112
        Num handles: 1
        Handle: 90 Address: DF:A9:FF:F6:B1:1A (OUI DF-A9-FF)
        Count: 1
zephyr.exe[325281]: < ACL Data TX: Handle 90 flags 0x00 dlen 21                                                     #156 8.190319
      SMP: Pairing Random (0x04) len 16
        Random value: 23ac32ebbb5e14c8a6b9622f296d277f
> HCI Event: Number of Completed Packets (0x13) plen 5                                                              #157 8.228720
        Num handles: 1
        Handle: 90 Address: DF:A9:FF:F6:B1:1A (OUI DF-A9-FF)
        Count: 1
        #156: len 21 (4 Kb/s)
        Latency: 38 msec (38-199 msec ~38 msec)
> ACL Data RX: Handle 90 flags 0x02 dlen 21                                                                         #158 8.478766
      SMP: Pairing Random (0x04) len 16
        Random value: d807e2b7f6a1c640b4f059952ae6da72
zephyr.exe[325281]: < HCI Command: Host Number of Completed Packets (0x03|0x0035) plen 5                            #159 8.490053
        Num handles: 1
        Handle: 90 Address: DF:A9:FF:F6:B1:1A (OUI DF-A9-FF)
        Count: 1
zephyr.exe[325281]: < ACL Data TX: Handle 90 flags 0x00 dlen 21                                                     #160 8.490154
      SMP: Pairing Confirm (0x03) len 16
        Confim value: e9a432ad4ee643c01ee65504d3286658
> HCI Event: Number of Completed Packets (0x13) plen 5                                                              #161 8.528705
        Num handles: 1
        Handle: 90 Address: DF:A9:FF:F6:B1:1A (OUI DF-A9-FF)
        Count: 1
        #160: len 21 (4 Kb/s)
        Latency: 38 msec (38-199 msec ~38 msec)
> ACL Data RX: Handle 90 flags 0x02 dlen 21                                                                         #162 8.578845
      SMP: Pairing Confirm (0x03) len 16
        Confim value: c4d650b59721e4d808ef2efe873b03cf
zephyr.exe[325281]: < HCI Command: Host Number of Completed Packets (0x03|0x0035) plen 5                            #163 8.590273
        Num handles: 1
        Handle: 90 Address: DF:A9:FF:F6:B1:1A (OUI DF-A9-FF)
        Count: 1
zephyr.exe[325281]: < ACL Data TX: Handle 90 flags 0x00 dlen 21                                                     #164 8.590472
      SMP: Pairing Random (0x04) len 16
        Random value: 297efe85e67448a15f56bd27e3a3cf1d
> HCI Event: Number of Completed Packets (0x13) plen 5                                                              #165 8.628620
        Num handles: 1
        Handle: 90 Address: DF:A9:FF:F6:B1:1A (OUI DF-A9-FF)
        Count: 1
        #164: len 21 (4 Kb/s)
        Latency: 38 msec (38-199 msec ~38 msec)
> ACL Data RX: Handle 90 flags 0x02 dlen 21                                                                         #166 8.878801
      SMP: Pairing Random (0x04) len 16
        Random value: 84c7888903ba42ce8058c4ed1de5dc1c
zephyr.exe[325281]: < HCI Command: Host Number of Completed Packets (0x03|0x0035) plen 5                            #167 8.890412
        Num handles: 1
        Handle: 90 Address: DF:A9:FF:F6:B1:1A (OUI DF-A9-FF)
        Count: 1
zephyr.exe[325281]: < ACL Data TX: Handle 90 flags 0x00 dlen 21                                                     #168 8.890608
      SMP: Pairing Confirm (0x03) len 16
        Confim value: f8aae893b2a43d7792e591850a8014ac
> HCI Event: Number of Completed Packets (0x13) plen 5                                                              #169 8.928621
        Num handles: 1
        Handle: 90 Address: DF:A9:FF:F6:B1:1A (OUI DF-A9-FF)
        Count: 1
        #168: len 21 (4 Kb/s)
        Latency: 38 msec (38-199 msec ~38 msec)
> ACL Data RX: Handle 90 flags 0x02 dlen 21                                                                         #170 8.978781
      SMP: Pairing Confirm (0x03) len 16
        Confim value: 0300f17de447925a7480d5f71fbddae2
zephyr.exe[325281]: < HCI Command: Host Number of Completed Packets (0x03|0x0035) plen 5                            #171 8.990078
        Num handles: 1
        Handle: 90 Address: DF:A9:FF:F6:B1:1A (OUI DF-A9-FF)
        Count: 1
zephyr.exe[325281]: < ACL Data TX: Handle 90 flags 0x00 dlen 21                                                     #172 8.990157
      SMP: Pairing Random (0x04) len 16
        Random value: 25a9493fd3ce4faf02be7293595bb7c6
> HCI Event: Number of Completed Packets (0x13) plen 5                                                              #173 9.028684
        Num handles: 1
        Handle: 90 Address: DF:A9:FF:F6:B1:1A (OUI DF-A9-FF)
        Count: 1
        #172: len 21 (4 Kb/s)
        Latency: 38 msec (38-199 msec ~38 msec)
> ACL Data RX: Handle 90 flags 0x02 dlen 21                                                                         #174 9.278696
      SMP: Pairing Random (0x04) len 16
        Random value: 4b6e91ffb3e2145a7d4a5c5191fe8553
zephyr.exe[325281]: < HCI Command: Host Number of Completed Packets (0x03|0x0035) plen 5                            #175 9.290385
        Num handles: 1
        Handle: 90 Address: DF:A9:FF:F6:B1:1A (OUI DF-A9-FF)
        Count: 1
zephyr.exe[325281]: < ACL Data TX: Handle 90 flags 0x00 dlen 21                                                     #176 9.290582
      SMP: Pairing Confirm (0x03) len 16
        Confim value: 0296af11b97c9980875f21744381c816
> HCI Event: Number of Completed Packets (0x13) plen 5                                                              #177 9.328561
        Num handles: 1
        Handle: 90 Address: DF:A9:FF:F6:B1:1A (OUI DF-A9-FF)
        Count: 1
        #176: len 21 (4 Kb/s)
        Latency: 37 msec (37-199 msec ~38 msec)
> ACL Data RX: Handle 90 flags 0x02 dlen 21                                                                         #178 9.378799
      SMP: Pairing Confirm (0x03) len 16
        Confim value: c9471c2ccf637414dfee63b2e20489f3
zephyr.exe[325281]: < HCI Command: Host Number of Completed Packets (0x03|0x0035) plen 5                            #179 9.390304
        Num handles: 1
        Handle: 90 Address: DF:A9:FF:F6:B1:1A (OUI DF-A9-FF)
        Count: 1
zephyr.exe[325281]: < ACL Data TX: Handle 90 flags 0x00 dlen 21                                                     #180 9.390513
      SMP: Pairing Random (0x04) len 16
        Random value: 58f6b41f855a6f6c3560debd84e2affc
> HCI Event: Number of Completed Packets (0x13) plen 5                                                              #181 9.428561
        Num handles: 1
        Handle: 90 Address: DF:A9:FF:F6:B1:1A (OUI DF-A9-FF)
        Count: 1
        #180: len 21 (4 Kb/s)
        Latency: 38 msec (37-199 msec ~38 msec)
> ACL Data RX: Handle 90 flags 0x02 dlen 21                                                                         #182 9.678697
      SMP: Pairing Random (0x04) len 16
        Random value: 32a51aba7df2493590d01dc1db6bc3c8
zephyr.exe[325281]: < HCI Command: Host Number of Completed Packets (0x03|0x0035) plen 5                            #183 9.690427
        Num handles: 1
        Handle: 90 Address: DF:A9:FF:F6:B1:1A (OUI DF-A9-FF)
        Count: 1
zephyr.exe[325281]: < ACL Data TX: Handle 90 flags 0x00 dlen 21                                                     #184 9.690711
      SMP: Pairing Confirm (0x03) len 16
        Confim value: bd84fc221acdf4bb4d99967845bb23fd
> HCI Event: Number of Completed Packets (0x13) plen 5                                                              #185 9.728490
        Num handles: 1
        Handle: 90 Address: DF:A9:FF:F6:B1:1A (OUI DF-A9-FF)
        Count: 1
        #184: len 21 (4 Kb/s)
        Latency: 37 msec (37-199 msec ~37 msec)
> ACL Data RX: Handle 90 flags 0x02 dlen 21                                                                         #186 9.778800
      SMP: Pairing Confirm (0x03) len 16
        Confim value: 689827bf58889a116a925ca12e604afa
zephyr.exe[325281]: < HCI Command: Host Number of Completed Packets (0x03|0x0035) plen 5                            #187 9.790270
        Num handles: 1
        Handle: 90 Address: DF:A9:FF:F6:B1:1A (OUI DF-A9-FF)
        Count: 1
zephyr.exe[325281]: < ACL Data TX: Handle 90 flags 0x00 dlen 21                                                     #188 9.790569
      SMP: Pairing Random (0x04) len 16
        Random value: b67e7216d5bf664139eda2b542549666
> HCI Event: Number of Completed Packets (0x13) plen 5                                                              #189 9.828543
        Num handles: 1
        Handle: 90 Address: DF:A9:FF:F6:B1:1A (OUI DF-A9-FF)
        Count: 1
        #188: len 21 (4 Kb/s)
        Latency: 37 msec (37-199 msec ~37 msec)
> ACL Data RX: Handle 90 flags 0x02 dlen 21                                                                        #190 10.078705
      SMP: Pairing Random (0x04) len 16
        Random value: 7f55809b14022df1dd33457f91a4c26d
zephyr.exe[325281]: < HCI Command: Host Number of Completed Packets (0x03|0x0035) plen 5                           #191 10.090325
        Num handles: 1
        Handle: 90 Address: DF:A9:FF:F6:B1:1A (OUI DF-A9-FF)
        Count: 1
zephyr.exe[325281]: < ACL Data TX: Handle 90 flags 0x00 dlen 21                                                    #192 10.090489
      SMP: Pairing Confirm (0x03) len 16
        Confim value: c66e103d8d3205a5f41ebd33a1069c21
> HCI Event: Number of Completed Packets (0x13) plen 5                                                             #193 10.128526
        Num handles: 1
        Handle: 90 Address: DF:A9:FF:F6:B1:1A (OUI DF-A9-FF)
        Count: 1
        #192: len 21 (4 Kb/s)
        Latency: 38 msec (37-199 msec ~37 msec)
> ACL Data RX: Handle 90 flags 0x02 dlen 21                                                                        #194 10.178719
      SMP: Pairing Confirm (0x03) len 16
        Confim value: 080ac37a96a9591ec1c986d710a3840f
zephyr.exe[325281]: < HCI Command: Host Number of Completed Packets (0x03|0x0035) plen 5                           #195 10.190288
        Num handles: 1
        Handle: 90 Address: DF:A9:FF:F6:B1:1A (OUI DF-A9-FF)
        Count: 1
zephyr.exe[325281]: < ACL Data TX: Handle 90 flags 0x00 dlen 21                                                    #196 10.190583
      SMP: Pairing Random (0x04) len 16
        Random value: ed17f76500c95219dd01e09d1e63f87b
> HCI Event: Number of Completed Packets (0x13) plen 5                                                             #197 10.228425
        Num handles: 1
        Handle: 90 Address: DF:A9:FF:F6:B1:1A (OUI DF-A9-FF)
        Count: 1
        #196: len 21 (4 Kb/s)
        Latency: 37 msec (37-199 msec ~37 msec)
> ACL Data RX: Handle 90 flags 0x02 dlen 21                                                                        #198 10.478723
      SMP: Pairing Random (0x04) len 16
        Random value: b5a75fc46e6c4e5dcafa500c8762ef73
zephyr.exe[325281]: < HCI Command: Host Number of Completed Packets (0x03|0x0035) plen 5                           #199 10.490315
        Num handles: 1
        Handle: 90 Address: DF:A9:FF:F6:B1:1A (OUI DF-A9-FF)
        Count: 1
zephyr.exe[325281]: < ACL Data TX: Handle 90 flags 0x00 dlen 21                                                    #200 10.490460
      SMP: Pairing Confirm (0x03) len 16
        Confim value: 8621b94e07f6e3a12c278618bc388d84
> HCI Event: Number of Completed Packets (0x13) plen 5                                                             #201 10.528528
        Num handles: 1
        Handle: 90 Address: DF:A9:FF:F6:B1:1A (OUI DF-A9-FF)
        Count: 1
        #200: len 21 (4 Kb/s)
        Latency: 38 msec (37-199 msec ~37 msec)
> ACL Data RX: Handle 90 flags 0x02 dlen 21                                                                        #202 10.578739
      SMP: Pairing Confirm (0x03) len 16
        Confim value: 3d7231d166c19f1b9e6cd4c26e63d113
zephyr.exe[325281]: < HCI Command: Host Number of Completed Packets (0x03|0x0035) plen 5                           #203 10.590121
        Num handles: 1
        Handle: 90 Address: DF:A9:FF:F6:B1:1A (OUI DF-A9-FF)
        Count: 1
zephyr.exe[325281]: < ACL Data TX: Handle 90 flags 0x00 dlen 21                                                    #204 10.590290
      SMP: Pairing Random (0x04) len 16
        Random value: 81d35d47e1f6006d79c974bd9d9e1ee3
> HCI Event: Number of Completed Packets (0x13) plen 5                                                             #205 10.628450
        Num handles: 1
        Handle: 90 Address: DF:A9:FF:F6:B1:1A (OUI DF-A9-FF)
        Count: 1
        #204: len 21 (4 Kb/s)
        Latency: 38 msec (37-199 msec ~38 msec)
> ACL Data RX: Handle 90 flags 0x02 dlen 21                                                                        #206 10.878728
      SMP: Pairing Random (0x04) len 16
        Random value: 9b039695c0c9798cfcf1fc29d29ef74b
zephyr.exe[325281]: < HCI Command: Host Number of Completed Packets (0x03|0x0035) plen 5                           #207 10.890528
        Num handles: 1
        Handle: 90 Address: DF:A9:FF:F6:B1:1A (OUI DF-A9-FF)
        Count: 1
zephyr.exe[325281]: < ACL Data TX: Handle 90 flags 0x00 dlen 21                                                    #208 10.890745
      SMP: Pairing Confirm (0x03) len 16
        Confim value: 24e13851fb6eb73a6f01c9d0c82f70b5
> HCI Event: Number of Completed Packets (0x13) plen 5                                                             #209 10.928467
        Num handles: 1
        Handle: 90 Address: DF:A9:FF:F6:B1:1A (OUI DF-A9-FF)
        Count: 1
        #208: len 21 (4 Kb/s)
        Latency: 37 msec (37-199 msec ~37 msec)
> ACL Data RX: Handle 90 flags 0x02 dlen 21                                                                        #210 10.978663
      SMP: Pairing Confirm (0x03) len 16
        Confim value: bb60e3cbfaea890b39f1583134343ec8
zephyr.exe[325281]: < HCI Command: Host Number of Completed Packets (0x03|0x0035) plen 5                           #211 10.990052
        Num handles: 1
        Handle: 90 Address: DF:A9:FF:F6:B1:1A (OUI DF-A9-FF)
        Count: 1
zephyr.exe[325281]: < ACL Data TX: Handle 90 flags 0x00 dlen 21                                                    #212 10.990163
      SMP: Pairing Random (0x04) len 16
        Random value: e7f7e0c2476823e41736a7e381bafb7c
> HCI Event: Number of Completed Packets (0x13) plen 5                                                             #213 11.028530
        Num handles: 1
        Handle: 90 Address: DF:A9:FF:F6:B1:1A (OUI DF-A9-FF)
        Count: 1
        #212: len 21 (4 Kb/s)
        Latency: 38 msec (37-199 msec ~38 ms