Bluetooth monitor ver 5.72
= Note: Linux version 7.0.0-31-generic (x86_64)                        0.372157
= Note: Bluetooth subsystem version 2.22                               0.372159
= New Index: 00:00:00:00:00:00 (Primary,UART,hci1)              [hci1] 0.372160
= New Index: 48:5F:99:8E:E0:64 (Primary,USB,hci0)               [hci0] 0.372160
= Open Index: 00:00:00:00:00:00                                 [hci1] 0.501933
= Index Info: 00:00:00:00:00:00 (Nordic Semiconductor ASA)      [hci1] 0.501938
@ USER Open: main (privileged) version 2.22            {0x0001} [hci1] 0.501941
< HCI Command: Reset (0x03|0x0003) plen 0                    #1 [hci1] 0.502278
> HCI Event: Command Complete (0x0e) plen 4                  #2 [hci1] 0.502765
      Reset (0x03|0x0003) ncmd 1
        Status: Success (0x00)
< HCI Command: Read Local Supported... (0x04|0x0003) plen 0  #3 [hci1] 0.521915
> HCI Event: Command Complete (0x0e) plen 12                 #4 [hci1] 0.522348
      Read Local Supported Features (0x04|0x0003) ncmd 1
        Status: Success (0x00)
        Features: 0x00 0x00 0x00 0x00 0x60 0x00 0x00 0x00
          BR/EDR Not Supported
          LE Supported (Controller)
< HCI Command: Read Local Version In.. (0x04|0x0001) plen 0  #5 [hci1] 0.541889
> HCI Event: Command Complete (0x0e) plen 12                 #6 [hci1] 0.542380
      Read Local Version Information (0x04|0x0001) ncmd 1
        Status: Success (0x00)
        HCI version: Reserved (0x11) - Revision 12345 (0x3039)
        LMP version: Reserved (0x11) - Subversion 12345 (0x3039)
        Manufacturer: Nordic Semiconductor ASA (89)
< HCI Command: Read Local Supported... (0x04|0x0002) plen 0  #7 [hci1] 0.561905
> HCI Event: Command Complete (0x0e) plen 68                 #8 [hci1] 0.562965
      Read Local Supported Commands (0x04|0x0002) ncmd 1
        Status: Success (0x00)
        Commands: 115 entries
          Disconnect (Octet 0 - Bit 5)
          Read Remote Version Information (Octet 2 - Bit 7)
          Set Event Mask (Octet 5 - Bit 6)
          Reset (Octet 5 - Bit 7)
          Read Connection Accept Timeout (Octet 7 - Bit 2)
          Write Connection Accept Timeout (Octet 7 - Bit 3)
          Read Transmit Power Level (Octet 10 - Bit 2)
          Set Controller To Host Flow Control (Octet 10 - Bit 5)
          Host Buffer Size (Octet 10 - Bit 6)
          Host Number of Completed Packets (Octet 10 - Bit 7)
          Read Local Version Information (Octet 14 - Bit 3)
          Read Local Supported Features (Octet 14 - Bit 5)
          Read BD ADDR (Octet 15 - Bit 1)
          Read RSSI (Octet 15 - Bit 5)
          Set Event Mask Page 2 (Octet 22 - Bit 2)
          LE Set Event Mask (Octet 25 - Bit 0)
          LE Read Buffer Size (Octet 25 - Bit 1)
          LE Read Local Supported Features (Octet 25 - Bit 2)
          LE Set Random Address (Octet 25 - Bit 4)
          LE Set Advertising Parameters (Octet 25 - Bit 5)
          LE Read Advertising Channel TX Power (Octet 25 - Bit 6)
          LE Set Advertising Data (Octet 25 - Bit 7)
          LE Set Scan Response Data (Octet 26 - Bit 0)
          LE Set Advertise Enable (Octet 26 - Bit 1)
          LE Set Scan Parameters (Octet 26 - Bit 2)
          LE Set Scan Enable (Octet 26 - Bit 3)
          LE Create Connection (Octet 26 - Bit 4)
          LE Create Connection Cancel (Octet 26 - Bit 5)
          LE Read Accept List Size (Octet 26 - Bit 6)
          LE Clear Accept List (Octet 26 - Bit 7)
          LE Add Device To Accept List (Octet 27 - Bit 0)
          LE Remove Device From Accept List (Octet 27 - Bit 1)
          LE Connection Update (Octet 27 - Bit 2)
          LE Set Host Channel Classification (Octet 27 - Bit 3)
          LE Read Channel Map (Octet 27 - Bit 4)
          LE Read Remote Used Features (Octet 27 - Bit 5)
          LE Encrypt (Octet 27 - Bit 6)
          LE Rand (Octet 27 - Bit 7)
          LE Start Encryption (Octet 28 - Bit 0)
          LE Long Term Key Request Reply (Octet 28 - Bit 1)
          LE Long Term Key Request Neg Reply (Octet 28 - Bit 2)
          LE Read Supported States (Octet 28 - Bit 3)
          Read Authenticated Payload Timeout (Octet 32 - Bit 4)
          Write Authenticated Payload Timeout (Octet 32 - Bit 5)
          LE Set Data Length (Octet 33 - Bit 6)
          LE Read Suggested Default Data Length (Octet 33 - Bit 7)
          LE Write Suggested Default Data Length (Octet 34 - Bit 0)
          LE Add Device To Resolving List (Octet 34 - Bit 3)
          LE Remove Device From Resolving List (Octet 34 - Bit 4)
          LE Clear Resolving List (Octet 34 - Bit 5)
          LE Read Resolving List Size (Octet 34 - Bit 6)
          LE Set Address Resolution Enable (Octet 35 - Bit 1)
          LE Set Resolvable Private Address Timeout (Octet 35 - Bit 2)
          LE Read Maximum Data Length (Octet 35 - Bit 3)
          LE Read PHY (Octet 35 - Bit 4)
          LE Set Default PHY (Octet 35 - Bit 5)
          LE Set PHY (Octet 35 - Bit 6)
          LE Set Advertising Set Random Address (Octet 36 - Bit 1)
          LE Set Extended Advertising Parameters (Octet 36 - Bit 2)
          LE Set Extended Advertising Data (Octet 36 - Bit 3)
          LE Set Extended Scan Response Data (Octet 36 - Bit 4)
          LE Set Extended Advertising Enable (Octet 36 - Bit 5)
          LE Read Maximum Advertising Data Length (Octet 36 - Bit 6)
          LE Read Number of Supported Advertising Sets (Octet 36 - Bit 7)
          LE Remove Advertising Set (Octet 37 - Bit 0)
          LE Clear Advertising Sets (Octet 37 - Bit 1)
          LE Set Periodic Advertising Parameters (Octet 37 - Bit 2)
          LE Set Periodic Advertising Data (Octet 37 - Bit 3)
          LE Set Periodic Advertising Enable (Octet 37 - Bit 4)
          LE Set Extended Scan Parameters (Octet 37 - Bit 5)
          LE Set Extended Scan Enable (Octet 37 - Bit 6)
          LE Extended Create Connection (Octet 37 - Bit 7)
          LE Periodic Advertising Create Sync (Octet 38 - Bit 0)
          LE Periodic Advertising Create Sync Cancel (Octet 38 - Bit 1)
          LE Periodic Advertising Terminate Sync (Octet 38 - Bit 2)
          LE Add Device To Periodic Advertiser List (Octet 38 - Bit 3)
          LE Remove Device From Periodic Advertiser List (Octet 38 - Bit 4)
          LE Clear Periodic Advertiser List (Octet 38 - Bit 5)
          LE Read Periodic Advertiser List Size (Octet 38 - Bit 6)
          LE Read Transmit Power (Octet 38 - Bit 7)
          LE Read RF Path Compensation (Octet 39 - Bit 0)
          LE Write RF Path Compensation (Octet 39 - Bit 1)
          LE Set Privacy Mode (Octet 39 - Bit 2)
          LE Periodic Advertising Receive Enable (Octet 40 - Bit 5)
          LE Periodic Advertising Sync Transfer (Octet 40 - Bit 6)
          LE Periodic Advertising Set Info Transfer (Octet 40 - Bit 7)
          LE Periodic Advertising Sync Transfer Parameters (Octet 41 - Bit 0)
          LE Set Default Periodic Advertisng Sync Transfer Parameters (Octet 41 - Bit 1)
          LE Read Buffer v2 (Octet 41 - Bit 5)
          LE Read ISO TX Sync (Octet 41 - Bit 6)
          LE Set Connected Isochronous Group Parameters (Octet 41 - Bit 7)
          LE Set Connected Isochronous Group Parameters Test (Octet 42 - Bit 0)
          LE Create Connected Isochronous Stream (Octet 42 - Bit 1)
          LE Remove Connected Isochronous Group (Octet 42 - Bit 2)
          LE Accept Connected Isochronous Stream Request (Octet 42 - Bit 3)
          LE Reject Connected Isochronous Stream Request (Octet 42 - Bit 4)
          LE Create Broadcast Isochronous Group (Octet 42 - Bit 5)
          LE Create Broadcast Isochronous Group Test (Octet 42 - Bit 6)
          LE Terminate Broadcast Isochronous Group (Octet 42 - Bit 7)
          LE Broadcast Isochronous Group Create Sync (Octet 43 - Bit 0)
          LE Broadcast Isochronous Group Terminate Sync (Octet 43 - Bit 1)
          LE Request Peer SCA (Octet 43 - Bit 2)
          LE Setup Isochronous Data Path (Octet 43 - Bit 3)
          LE Remove Isochronous Data Path (Octet 43 - Bit 4)
          LE Isochronous Transmit Test (Octet 43 - Bit 5)
          LE Isochronous Receive Test (Octet 43 - Bit 6)
          LE Isochronous Read Test Counters (Octet 43 - Bit 7)
          LE Isochronous Read Test Counters (Octet 44 - Bit 0)
          LE Set Host Feature (Octet 44 - Bit 1)
          Octet 44 - Bit 2 
          Octet 45 - Bit 6 
          Octet 46 - Bit 0 
          Octet 46 - Bit 1 
          Octet 46 - Bit 2 
          Octet 47 - Bit 4 
< HCI Command: Host Buffer Size (0x03|0x0033) plen 7         #9 [hci1] 0.581917
        ACL MTU: 255  ACL max packet: 16
        SCO MTU: 0    SCO max packet: 0
> HCI Event: Command Complete (0x0e) plen 4                 #10 [hci1] 0.582367
      Host Buffer Size (0x03|0x0033) ncmd 1
        Status: Success (0x00)
< HCI Command: Set Controller To Ho.. (0x03|0x0031) plen 1  #11 [hci1] 0.601905
        Flow control: ACL Data Packets (0x01)
> HCI Event: Command Complete (0x0e) plen 4                 #12 [hci1] 0.602305
      Set Controller To Host Flow Control (0x03|0x0031) ncmd 1
        Status: Success (0x00)
< HCI Command: LE Read Local Suppor.. (0x08|0x0003) plen 0  #13 [hci1] 0.621896
> HCI Event: Command Complete (0x0e) plen 12                #14 [hci1] 0.622305
      LE Read Local Supported Features (0x08|0x0003) ncmd 1
        Status: Success (0x00)
        Features: 0xfd 0x79 0x00 0xf7 0x30 0x01 0x00 0x00
          LE Encryption
          Extended Reject Indication
          Peripheral-initiated Features Exchange
          LE Ping
          LE Data Packet Length Extension
          LL Privacy
          Extended Scanner Filter Policies
          LE 2M PHY
          LE Coded PHY
          LE Extended Advertising
          LE Periodic Advertising
          Channel Selection Algorithm #2
          Periodic Advertising Sync Transfer - Sender
          Periodic Advertising Sync Transfer - Recipient
          Sleep Clock Accuracy Updates
          Connected Isochronous Stream - Central
          Connected Isochronous Stream - Peripheral
          Isochronous Broadcaster
          Synchronized Receiver
          Periodic Advertising ADI support
          Connection Subrating
          Unknown features (0x0000010000000000)
< HCI Command: LE Set Host Feature (0x08|0x0074) plen 2     #15 [hci1] 0.641908
        Bit Number: 32
          Connected Isochronous Stream (Host Support)
        Bit Value: 1
> HCI Event: Command Complete (0x0e) plen 4                 #16 [hci1] 0.642319
      LE Set Host Feature (0x08|0x0074) ncmd 1
        Status: Success (0x00)
< HCI Command: LE Read Buffer v2 (0x08|0x0060) plen 0       #17 [hci1] 0.661903
> HCI Event: Command Complete (0x0e) plen 10                #18 [hci1] 0.662375
      LE Read Buffer v2 (0x08|0x0060) ncmd 1
        Status: Success (0x00)
        ACL MTU: 27
        ACL max packet: 3
        ISO MTU: 318
        ISO max packet: 3
< HCI Command: LE Read Maximum Adve.. (0x08|0x003a) plen 0  #19 [hci1] 0.681947
> HCI Event: Command Complete (0x0e) plen 6                 #20 [hci1] 0.682403
      LE Read Maximum Advertising Data Length (0x08|0x003a) ncmd 1
        Status: Success (0x00)
        Max length: 1650
< HCI Command: LE Read Supported St.. (0x08|0x001c) plen 0  #21 [hci1] 0.701935
> HCI Event: Command Complete (0x0e) plen 12                #22 [hci1] 0.702361
      LE Read Supported States (0x08|0x001c) ncmd 1
        Status: Success (0x00)
        States: 0x000003ff3e0306ff
          Non-connectable Advertising State
          Scannable Advertising State
          Connectable Advertising State
          High Duty Cycle Directed Advertising State
          Passive Scanning State
          Active Scanning State
          Initiating State
            and Connection State (Central Role)
          Connection State (Peripheral Role)
          Scannable Advertising State
            and Passive Scanning State
          Connectable Advertising State
            and Passive Scanning State
          Non-connectable Advertising State
            and Initiating State
          Scannable Advertising State
            and Initiating State
          Active Scanning State
            and Connection State (Central Role)
          Passive Scanning State
            and Connection State (Peripheral Role)
          Active Scanning State
            and Connection State (Peripheral Role)
          Initiating State
            and Connection State (Central Role)
            and Central Role & Central Role
          Low Duty Cycle Directed Advertising State
          Connectable Advertising State
            and Initiating State
            and Central Role & Peripheral Role
          High Duty Cycle Directed Advertising State
            and Initiating State
            and Central Role & Peripheral Role
          Low Duty Cycle Directed Advertising State
            and Initiating State
            and Central Role & Peripheral Role
          Connectable Advertising State
            and Connection State (Central Role)
            and Central Role & Peripheral Role
          High Duty Cycle Directed Advertising State
            and Connection State (Central Role)
            and Central Role & Peripheral Role
          Low Duty Cycle Directed Advertising State
            and Connection State (Central Role)
            and Central Role & Peripheral Role
          Connectable Advertising State
            and Connection State (Peripheral Role)
            and Central Role & Peripheral Role
          High Duty Cycle Directed Advertising State
            and Connection State (Peripheral Role)
            and Peripheral Role & Peripheral Role
          Low Duty Cycle Directed Advertising State
            and Connection State (Peripheral Role)
            and Peripheral Role & Peripheral Role
          Initiating State
            and Connection State (Peripheral Role)
            and Central Role & Peripheral Role
< HCI Command: LE Read Maximum Data.. (0x08|0x002f) plen 0  #23 [hci1] 0.721909
> HCI Event: Command Complete (0x0e) plen 12                #24 [hci1] 0.722346
      LE Read Maximum Data Length (0x08|0x002f) ncmd 1
        Status: Success (0x00)
        Max TX octets: 251
        Max TX time: 2704
        Max RX octets: 251
        Max RX time: 2704
< HCI Command: LE Write Suggested D.. (0x08|0x0024) plen 4  #25 [hci1] 0.741910
        TX octets: 251
        TX time: 2704
> HCI Event: Command Complete (0x0e) plen 4                 #26 [hci1] 0.742292
      LE Write Suggested Default Data Length (0x08|0x0024) ncmd 1
        Status: Success (0x00)
< HCI Command: LE Read Resolving Li.. (0x08|0x002a) plen 0  #27 [hci1] 0.761909
> HCI Event: Command Complete (0x0e) plen 5                 #28 [hci1] 0.762322
      LE Read Resolving List Size (0x08|0x002a) ncmd 1
        Status: Success (0x00)
        Size: 8
< HCI Command: LE Set Host Feature (0x08|0x0074) plen 2     #29 [hci1] 0.781905
        Bit Number: 38
          Connection Subrating (Host Support)
        Bit Value: 1
> HCI Event: Command Complete (0x0e) plen 4                 #30 [hci1] 0.782296
      LE Set Host Feature (0x08|0x0074) ncmd 1
        Status: Success (0x00)
< HCI Command: LE Set Event Mask (0x08|0x0001) plen 8       #31 [hci1] 0.801911
        Mask: 0x000002063f87fa5e
          LE Advertising Report
          LE Connection Update Complete
          LE Read Remote Used Features Complete
          LE Long Term Key Request
          LE Data Length Change
          LE Enhanced Connection Complete
          LE PHY Update Complete
          LE Extended Advertising Report
          LE Periodic Advertising Sync Established
          LE Periodic Advertising Report
          LE Periodic Advertising Sync Lost
          LE Extended Scan Timeout
          LE Extended Advertising Set Terminated
          LE Scan Request Received
          LE Periodic Advertising Sync Transfer Rvc
          LE CIS Established
          LE CIS Request
          LE Create BIG Complete
          LE Terminate BIG Complete
          LE BIG Sync Estabilished Complete
          LE BIG Sync Lost
          LE BIG Info Advertising Report
          LE Subrate Change
          Unknown mask (0x0000020000000000)
> HCI Event: Command Complete (0x0e) plen 4                 #32 [hci1] 0.802340
      LE Set Event Mask (0x08|0x0001) ncmd 1
        Status: Success (0x00)
< HCI Command: Set Event Mask (0x03|0x0001) plen 8          #33 [hci1] 0.821919
        Mask: 0x2000800002008890
          Disconnection Complete
          Encryption Change
          Read Remote Version Information Complete
          Hardware Error
          Data Buffer Overflow
          Encryption Key Refresh Complete
          LE Meta
> HCI Event: Command Complete (0x0e) plen 4                 #34 [hci1] 0.822360
      Set Event Mask (0x03|0x0001) ncmd 1
        Status: Success (0x00)
< HCI Command: Read BD ADDR (0x04|0x0009) plen 0            #35 [hci1] 0.841913
> HCI Event: Command Complete (0x0e) plen 10                #36 [hci1] 0.842321
      Read BD ADDR (0x04|0x0009) ncmd 1
        Status: Success (0x00)
        Address: 00:00:00:00:00:00 (OUI 00-00-00)
< HCI Command: LE Set Random Address (0x08|0x0005) plen 6   #37 [hci1] 0.861911
        Address: D5:B6:CC:31:DB:3B (Static)
> HCI Event: Command Complete (0x0e) plen 4                 #38 [hci1] 0.862341
      LE Set Random Address (0x08|0x0005) ncmd 1
        Status: Success (0x00)
< HCI Command: LE Set Extended Adv.. (0x08|0x0036) plen 25  #39 [hci1] 5.242560
        Handle: 0x00
        Properties: 0x0013
          Connectable
          Scannable
          Use legacy advertising PDUs: ADV_IND
        Min advertising interval: 100.000 msec (0x00a0)
        Max advertising interval: 150.000 msec (0x00f0)
        Channel map: 37, 38, 39 (0x07)
        Own address type: Random (0x01)
        Peer address type: Public (0x00)
        Peer address: 00:00:00:00:00:00 (OUI 00-00-00)
        Filter policy: Allow Scan Request from Any, Allow Connect Request from Any (0x00)
        TX power: Host has no preference (0x7f)
        Primary PHY: LE 1M (0x01)
        Secondary max skip: 0x00
        Secondary PHY: LE 1M (0x01)
        SID: 0x00
        Scan request notifications: Disabled (0x00)
> HCI Event: Command Complete (0x0e) plen 5                 #40 [hci1] 5.243396
      LE Set Extended Advertising Parameters (0x08|0x0036) ncmd 1
        Status: Success (0x00)
        TX power (selected): 0 dbm (0x00)
< HCI Command: LE Set Advertising S.. (0x08|0x0035) plen 7  #41 [hci1] 5.262296
        Advertising handle: 0x00
        Advertising random address: D5:B6:CC:31:DB:3B (Static)
> HCI Event: Command Complete (0x0e) plen 4                 #42 [hci1] 5.262821
      LE Set Advertising Set Random Address (0x08|0x0035) ncmd 1
        Status: Success (0x00)
< HCI Command: LE Set Extended Adv.. (0x08|0x0037) plen 22  #43 [hci1] 5.282033
        Handle: 0x00
        Operation: Complete extended advertising data (0x03)
        Fragment preference: Minimize fragmentation (0x01)
        Data length: 0x12
        Flags: 0x06
          LE General Discoverable Mode
          BR/EDR Not Supported
        Name (complete): Tester_F6B11A
> HCI Event: Command Complete (0x0e) plen 4                 #44 [hci1] 5.282711
      LE Set Extended Advertising Data (0x08|0x0037) ncmd 1
        Status: Success (0x00)
< HCI Command: LE Set Extended Scan.. (0x08|0x0038) plen 4  #45 [hci1] 5.301970
        Handle: 0x00
        Operation: Complete scan response data (0x03)
        Fragment preference: Minimize fragmentation (0x01)
        Data length: 0x00
> HCI Event: Command Complete (0x0e) plen 4                 #46 [hci1] 5.302394
      LE Set Extended Scan Response Data (0x08|0x0038) ncmd 1
        Status: Success (0x00)
< HCI Command: LE Set Extended Adve.. (0x08|0x0039) plen 6  #47 [hci1] 5.321981
        Extended advertising: Enabled (0x01)
        Number of sets: 1 (0x01)
        Entry 0
          Handle: 0x00
          Duration: 0 ms (0x00)
          Max ext adv events: 0
> HCI Event: Command Complete (0x0e) plen 4                 #48 [hci1] 5.322544
      LE Set Extended Advertising Enable (0x08|0x0039) ncmd 1
        Status: Success (0x00)
> HCI Event: LE Meta Event (0x3e) plen 31                   #49 [hci1] 5.428678
      LE Enhanced Connection Complete (0x0a)
        Status: Success (0x00)
        Handle: 2163
        Role: Peripheral (0x01)
        Peer address type: Public (0x00)
        Peer address: DF:A9:FF:F6:B1:1A (OUI DF-A9-FF)
        Local resolvable private address: 00:00:00:00:00:00 (Non-Resolvable)
        Peer resolvable private address: 00:00:00:00:00:00 (Non-Resolvable)
        Connection interval: 87.50 msec (0x0046)
        Connection latency: 0 (0x0000)
        Supervision timeout: 25120 msec (0x09d0)
        Central clock accuracy: 0x01
> HCI Event: LE Meta Event (0x3e) plen 6                    #50 [hci1] 5.428681
      LE Advertising Set Terminated (0x12)
        Status: Success (0x00)
        Handle: 0
        Connection handle: 2163
        Number of completed extended advertising events: 0
< HCI Command: LE Read Remote Used... (0x08|0x0016) plen 2  #51 [hci1] 5.442596
        Handle: 2163 Address: DF:A9:FF:F6:B1:1A (OUI DF-A9-FF)
< ACL Data TX: Handle 2163 flags 0x00 dlen 7                #52 [hci1] 5.442624
      ATT: Exchange MTU Request (0x02) len 2
        Client RX MTU: 251
> HCI Event: Command Status (0x0f) plen 4                   #53 [hci1] 5.443172
      LE Read Remote Used Features (0x08|0x0016) ncmd 1
        Status: Success (0x00)
> HCI Event: Number of Completed Packets (0x13) plen 5      #54 [hci1] 5.604608
        Num handles: 1
        Handle: 2163 Address: DF:A9:FF:F6:B1:1A (OUI DF-A9-FF)
        Count: 1
        #52: len 7 (0 Kb/s)
        Latency: 161 msec (161-161 msec ~161 msec)
> HCI Event: LE Meta Event (0x3e) plen 12                   #55 [hci1] 5.692442
      LE Read Remote Used Features (0x04)
        Status: Success (0x00)
        Handle: 2163 Address: DF:A9:FF:F6:B1:1A (OUI DF-A9-FF)
        Features: 0x2d 0x49 0x00 0xf7 0x67 0xd9 0x00 0x80
          LE Encryption
          Extended Reject Indication
          Peripheral-initiated Features Exchange
          LE Data Packet Length Extension
          LE 2M PHY
          LE Coded PHY
          Channel Selection Algorithm #2
          Periodic Advertising Sync Transfer - Sender
          Periodic Advertising Sync Transfer - Recipient
          Sleep Clock Accuracy Updates
          Connected Isochronous Stream - Central
          Connected Isochronous Stream - Peripheral
          Isochronous Broadcaster
          Synchronized Receiver
          Connected Isochronous Stream (Host Support)
          LE Power Control Request
          LE Power Control Request
          Connection Subrating
          Connection Subrating (Host Support)
          Unknown features (0x8000d90000000000)
> ACL Data RX: Handle 2163 flags 0x02 dlen 11               #56 [hci1] 8.142221
      SMP: Pairing Request (0x01) len 6
        IO capability: KeyboardDisplay (0x04)
        OOB data: Authentication data not present (0x00)
        Authentication requirement: Bonding, No MITM, SC, No Keypresses (0x09)
        Max encryption key size: 16
        Initiator key distribution: EncKey IdKey (0x03)
        Responder key distribution: EncKey IdKey Sign (0x07)
> ACL Data RX: Handle 2163 flags 0x02 dlen 7                #57 [hci1] 8.142689
      ATT: Exchange MTU Response (0x03) len 2
        Server RX MTU: 23
< HCI Command: Host Number of Compl.. (0x03|0x0035) plen 5  #58 [hci1] 8.162110
        Num handles: 1
        Handle: 2163 Address: DF:A9:FF:F6:B1:1A (OUI DF-A9-FF)
        Count: 1
< ACL Data TX: Handle 2163 flags 0x00 dlen 11               #59 [hci1] 8.162190
      SMP: Pairing Response (0x02) len 6
        IO capability: DisplayOnly (0x00)
        OOB data: Authentication data not present (0x00)
        Authentication requirement: Bonding, No MITM, SC, No Keypresses (0x09)
        Max encryption key size: 16
        Initiator key distribution: IdKey (0x02)
        Responder key distribution: <none> (0x00)
< HCI Command: Host Number of Compl.. (0x03|0x0035) plen 5  #60 [hci1] 8.162334
        Num handles: 1
        Handle: 2163 Address: DF:A9:FF:F6:B1:1A (OUI DF-A9-FF)
        Count: 1
> HCI Event: Number of Completed Packets (0x13) plen 5      #61 [hci1] 8.317247
        Num handles: 1
        Handle: 2163 Address: DF:A9:FF:F6:B1:1A (OUI DF-A9-FF)
        Count: 1
        #59: len 11 (0 Kb/s)
        Latency: 155 msec (155-161 msec ~158 msec)
> ACL Data RX: Handle 2163 flags 0x02 dlen 27               #62 [hci1] 8.317647
> ACL Data RX: Handle 2163 flags 0x01 dlen 27               #63 [hci1] 8.318059
> ACL Data RX: Handle 2163 flags 0x01 dlen 15               #64 [hci1] 8.318576
      SMP: Pairing Public Key (0x0c) len 64
        X: 295689ea573209cf1f3c4fb8a82e5f2cd956bf1b7af712a699751ada6ed39c3d
        Y: 9c2dea724efafdbc835b21c4a801d0ce14ff6cef6853b83af3efaa72fcfc4c71
< HCI Command: Host Number of Compl.. (0x03|0x0035) plen 5  #65 [hci1] 8.322654
        Num handles: 1
        Handle: 2163 Address: DF:A9:FF:F6:B1:1A (OUI DF-A9-FF)
        Count: 1
< HCI Command: Host Number of Compl.. (0x03|0x0035) plen 5  #66 [hci1] 8.322852
        Num handles: 1
        Handle: 2163 Address: DF:A9:FF:F6:B1:1A (OUI DF-A9-FF)
        Count: 1
< HCI Command: Host Number of Compl.. (0x03|0x0035) plen 5  #67 [hci1] 8.323116
        Num handles: 1
        Handle: 2163 Address: DF:A9:FF:F6:B1:1A (OUI DF-A9-FF)
        Count: 1
< ACL Data TX: Handle 2163 flags 0x00 dlen 27               #68 [hci1] 8.323190
< ACL Data TX: Handle 2163 flags 0x01 dlen 27               #69 [hci1] 8.323199
< ACL Data TX: Handle 2163 flags 0x01 dlen 15               #70 [hci1] 8.323240
      SMP: Pairing Public Key (0x0c) len 64
        X: 98308440221e2d910f0e54b71e7ec652857aa9b5a0dc65028824cc19db1226e9
        Y: 67a4816bcb62efb21701e31fdb27561a6217575fb007a8bbdabe7e28b6f68482
> HCI Event: Number of Completed Packets (0x13) plen 5      #71 [hci1] 8.405185
        Num handles: 1
        Handle: 2163 Address: DF:A9:FF:F6:B1:1A (OUI DF-A9-FF)
        Count: 1
        #68: len 27 (2 Kb/s)
        Latency: 81 msec (81-161 msec ~120 msec)
> HCI Event: Number of Completed Packets (0x13) plen 5      #72 [hci1] 8.405859
        Num handles: 1
        Handle: 2163 Address: DF:A9:FF:F6:B1:1A (OUI DF-A9-FF)
        Count: 1
        #69: len 27 (2 Kb/s)
        Latency: 82 msec (81-161 msec ~101 msec)
< ACL Data TX: Handle 2163 flags 0x00 dlen 21               #73 [hci1] 8.421975
      SMP: Pairing Confirm (0x03) len 16
        Confim value: 3d6f1cb60299976dc8e1c6233d6f1ac6
> HCI Event: Number of Completed Packets (0x13) plen 5      #74 [hci1] 8.492037
        Num handles: 1
        Handle: 2163 Address: DF:A9:FF:F6:B1:1A (OUI DF-A9-FF)
        Count: 1
        #70: len 15 (0 Kb/s)
        Latency: 168 msec (81-168 msec ~135 msec)
> HCI Event: Number of Completed Packets (0x13) plen 5      #75 [hci1] 8.579868
        Num handles: 1
        Handle: 2163 Address: DF:A9:FF:F6:B1:1A (OUI DF-A9-FF)
        Count: 1
        #73: len 21 (1 Kb/s)
        Latency: 157 msec (81-168 msec ~146 msec)
> ACL Data RX: Handle 2163 flags 0x02 dlen 21               #76 [hci1] 8.580099
      SMP: Pairing Random (0x04) len 16
        Random value: 70ea2dbc6b2312600000000000000000
< HCI Command: Host Number of Compl.. (0x03|0x0035) plen 5  #77 [hci1] 8.582192
        Num handles: 1
        Handle: 2163 Address: DF:A9:FF:F6:B1:1A (OUI DF-A9-FF)
        Count: 1
< ACL Data TX: Handle 2163 flags 0x00 dlen 21               #78 [hci1] 8.582225
      SMP: Pairing Random (0x04) len 16
        Random value: 8e6108f966a694cbe26df70bb96773e6
> HCI Event: Number of Completed Packets (0x13) plen 5      #79 [hci1] 8.754549
        Num handles: 1
        Handle: 2163 Address: DF:A9:FF:F6:B1:1A (OUI DF-A9-FF)
        Count: 1
        #78: len 21 (0 Kb/s)
        Latency: 172 msec (81-172 msec ~159 msec)
> ACL Data RX: Handle 2163 flags 0x02 dlen 21               #80 [hci1] 8.929871
      SMP: Pairing DHKey Check (0x0d) len 16
        E: 298e4f47cb1f9a74fe346210d9e0321a
< HCI Command: Host Number of Compl.. (0x03|0x0035) plen 5  #81 [hci1] 8.942438
        Num handles: 1
        Handle: 2163 Address: DF:A9:FF:F6:B1:1A (OUI DF-A9-FF)
        Count: 1
< ACL Data TX: Handle 2163 flags 0x00 dlen 21               #82 [hci1] 8.942463
      SMP: Pairing DHKey Check (0x0d) len 16
        E: b6f7324ef49297e0bd739473ccae2ffa
> HCI Event: Number of Completed Packets (0x13) plen 5      #83 [hci1] 9.104560
        Num handles: 1
        Handle: 2163 Address: DF:A9:FF:F6:B1:1A (OUI DF-A9-FF)
        Count: 1
        #82: len 21 (1 Kb/s)
        Latency: 162 msec (81-172 msec ~160 msec)
> HCI Event: LE Meta Event (0x3e) plen 13                   #84 [hci1] 9.192610
      LE Long Term Key Request (0x05)
        Handle: 2163 Address: DF:A9:FF:F6:B1:1A (OUI DF-A9-FF)
        Random number: 0x0000000000000000
        Encrypted diversifier: 0x0000
< HCI Command: LE Long Term Key Re.. (0x08|0x001a) plen 18  #85 [hci1] 9.202313
        Handle: 2163 Address: DF:A9:FF:F6:B1:1A (OUI DF-A9-FF)
        Long term key: 06fdd87db55bbec65f979db4fdb93c90
> HCI Event: Command Complete (0x0e) plen 6                 #86 [hci1] 9.203054
      LE Long Term Key Request Reply (0x08|0x001a) ncmd 1
        Status: Success (0x00)
        Handle: 2163 Address: DF:A9:FF:F6:B1:1A (OUI DF-A9-FF)
> HCI Event: Encryption Change (0x08) plen 4                #87 [hci1] 9.629836
        Status: Success (0x00)
        Handle: 2163 Address: DF:A9:FF:F6:B1:1A (OUI DF-A9-FF)
        Encryption: Enabled with AES-CCM (0x01)
> ACL Data RX: Handle 2163 flags 0x02 dlen 21               #88 [hci1] 9.717391
      SMP: Identity Information (0x08) len 16
        Identity resolving key: f9177c3ba814a79f12589ac7d889b899
< ACL Data TX: Handle 2163 flags 0x00 dlen 11               #89 [hci1] 9.752726
      ATT: Read By Type Request (0x08) len 6
        Handle range: 0x0001-0xffff
        Attribute type: Central Address Resolution (0x2aa6)
< HCI Command: Host Number of Compl.. (0x03|0x0035) plen 5  #90 [hci1] 9.753068
        Num handles: 1
        Handle: 2163 Address: DF:A9:FF:F6:B1:1A (OUI DF-A9-FF)
        Count: 1
> HCI Event: Number of Completed Packets (0x13) plen 5      #91 [hci1] 9.892284
        Num handles: 1
        Handle: 2163 Address: DF:A9:FF:F6:B1:1A (OUI DF-A9-FF)
        Count: 1
        #89: len 11 (0 Kb/s)
        Latency: 139 msec (81-172 msec ~150 msec)
> ACL Data RX: Handle 2163 flags 0x02 dlen 12               #92 [hci1] 9.892310
      SMP: Identity Address Information (0x09) len 7
        Address: DF:A9:FF:F6:B1:1A (OUI DF-A9-FF)
< HCI Command: LE Add Device To Re.. (0x08|0x0027) plen 39  #93 [hci1] 9.902772
        Address type: Public (0x00)
        Address: DF:A9:FF:F6:B1:1A (OUI DF-A9-FF)
        Peer identity resolving key: f9177c3ba814a79f12589ac7d889b899
        Local identity resolving key: 00000000000000000000000000000000
> HCI Event: Command Complete (0x0e) plen 4                 #94 [hci1] 9.903721
      LE Add Device To Resolving List (0x08|0x0027) ncmd 1
        Status: Success (0x00)
< HCI Command: LE Set Privacy Mode (0x08|0x004e) plen 8     #95 [hci1] 9.922311
        Peer Identity address type: Public (0x00)
        Peer Identity address: DF:A9:FF:F6:B1:1A (OUI DF-A9-FF)
        Privacy Mode: Use Device Privacy (0x01)
> HCI Event: Command Complete (0x0e) plen 4                 #96 [hci1] 9.922902
      LE Set Privacy Mode (0x08|0x004e) ncmd 1
        Status: Success (0x00)
< HCI Command: LE Set Address Resol.. (0x08|0x002d) plen 1  #97 [hci1] 9.942413
        Address resolution: Enabled (0x01)
> HCI Event: Command Complete (0x0e) plen 4                 #98 [hci1] 9.942892
      LE Set Address Resolution Enable (0x08|0x002d) ncmd 1
        Status: Success (0x00)
< HCI Command: Host Number of Compl.. (0x03|0x0035) plen 5  #99 [hci1] 9.962290
        Num handles: 1
        Handle: 2163 Address: DF:A9:FF:F6:B1:1A (OUI DF-A9-FF)
        Count: 1
> ACL Data RX: Handle 2163 flags 0x02 dlen 13              #100 [hci1] 9.979702
      ATT: Find By Type Value Request (0x06) len 8
        Handle range: 0x0001-0xffff
        Attribute type: Primary Service (0x2800)
          UUID: Telephony Bearer (0x184b)
< HCI Command: Host Number of Comp.. (0x03|0x0035) plen 5  #101 [hci1] 9.982620
        Num handles: 1
        Handle: 2163 Address: DF:A9:FF:F6:B1:1A (OUI DF-A9-FF)
        Count: 1
< ACL Data TX: Handle 2163 flags 0x00 dlen 9               #102 [hci1] 9.982775
      ATT: Find By Type Value Response (0x07) len 4
        Handle range: 0x0057-0x0083
> ACL Data RX: Handle 2163 flags 0x02 dlen 9              #103 [hci1] 10.067266
      ATT: Read By Type Response (0x09) len 4
        Attribute data length: 3
        Attribute data list: 1 entry
        Handle: 0x000f
        Value: 01
< HCI Command: Host Number of Com.. (0x03|0x0035) plen 5  #104 [hci1] 10.082139
        Num handles: 1
        Handle: 2163 Address: DF:A9:FF:F6:B1:1A (OUI DF-A9-FF)
        Count: 1
> HCI Event: Number of Completed Packets (0x13) plen 5    #105 [hci1] 10.154751
        Num handles: 1
        Handle: 2163 Address: DF:A9:FF:F6:B1:1A (OUI DF-A9-FF)
        Count: 1
        #102: len 9 (0 Kb/s)
        Latency: 171 msec (81-172 msec ~161 msec)
> ACL Data RX: Handle 2163 flags 0x02 dlen 13             #106 [hci1] 10.154899
      ATT: Find By Type Value Request (0x06) len 8
        Handle range: 0x0084-0xffff
        Attribute type: Primary Service (0x2800)
          UUID: Telephony Bearer (0x184b)
< HCI Command: Host Number of Com.. (0x03|0x0035) plen 5  #107 [hci1] 10.162192
        Num handles: 1
        Handle: 2163 Address: DF:A9:FF:F6:B1:1A (OUI DF-A9-FF)
        Count: 1
< ACL Data TX: Handle 2163 flags 0x00 dlen 9              #108 [hci1] 10.162339
      ATT: Error Response (0x01) len 4
        Find By Type Value Request (0x06)
        Handle: 0x0084
        Error: Attribute Not Found (0x0a)
> HCI Event: Number of Completed Packets (0x13) plen 5    #109 [hci1] 10.329693
        Num handles: 1
        Handle: 2163 Address: DF:A9:FF:F6:B1:1A (OUI DF-A9-FF)
        Count: 1
        #108: len 9 (0 Kb/s)
        Latency: 167 msec (81-172 msec ~164 msec)
> ACL Data RX: Handle 2163 flags 0x02 dlen 11             #110 [hci1] 10.329922
      ATT: Read By Type Request (0x08) len 6
        Handle range: 0x0057-0x0083
        Attribute type: Characteristic (0x2803)
< HCI Command: Host Number of Com.. (0x03|0x0035) plen 5  #111 [hci1] 10.342301
        Num handles: 1
        Handle: 2163 Address: DF:A9:FF:F6:B1:1A (OUI DF-A9-FF)
        Count: 1
< ACL Data TX: Handle 2163 flags 0x00 dlen 20             #112 [hci1] 10.342309
      ATT: Read By Type Response (0x09) len 15
        Attribute data length: 7
        Attribute data list: 2 entries
        Handle: 0x0058
        Value: 125900b32b
            Properties: 0x12
              Read (0x02)
              Notify (0x10)
            Value Handle: 0x0059
            Value UUID: Bearer Provider Name (0x2bb3)
        Handle: 0x005b
        Value: 025c00b42b
            Properties: 0x02
              Read (0x02)
            Value Handle: 0x005c
            Value UUID: Bearer UCI (0x2bb4)
> HCI Event: Number of Completed Packets (0x13) plen 5    #113 [hci1] 10.504695
        Num handles: 1
        Handle: 2163 Address: DF:A9:FF:F6:B1:1A (OUI DF-A9-FF)
        Count: 1
        #112: len 20 (0 Kb/s)
        Latency: 162 msec (81-172 msec ~163 msec)
> ACL Data RX: Handle 2163 flags 0x02 dlen 11             #114 [hci1] 10.504872
      ATT: Read By Type Request (0x08) len 6
        Handle range: 0x005c-0x0083
        Attribute type: Characteristic (0x2803)
< HCI Command: Host Number of Com.. (0x03|0x0035) plen 5  #115 [hci1] 10.522393
        Num handles: 1
        Handle: 2163 Address: DF:A9:FF:F6:B1:1A (OUI DF-A9-FF)
        Count: 1
< ACL Data TX: Handle 2163 flags 0x00 dlen 20             #116 [hci1] 10.522439
      ATT: Read By Type Response (0x09) len 15
        Attribute data length: 7
        Attribute data list: 2 entries
        Handle: 0x005d
        Value: 125e00b52b
            Properties: 0x12
              Read (0x02)
              Notify (0x10)
            Value Handle: 0x005e
            Value UUID: Bearer Technology (0x2bb5)
        Handle: 0x0060
        Value: 126100b62b
            Properties: 0x12
              Read (0x02)
              Notify (0x10)
            Value Handle: 0x0061
            Value UUID: Bearer URI Schemes Supported List (0x2bb6)
> HCI Event: Number of Completed Packets (0x13) plen 5    #117 [hci1] 10.679629
        Num handles: 1
        Handle: 2163 Address: DF:A9:FF:F6:B1:1A (OUI DF-A9-FF)
        Count: 1
        #116: len 20 (1 Kb/s)
        Latency: 157 msec (81-172 msec ~160 msec)
> ACL Data RX: Handle 2163 flags 0x02 dlen 11             #118 [hci1] 10.679867
      ATT: Read By Type Request (0x08) len 6
        Handle range: 0x0061-0x0083
        Attribute type: Characteristic (0x2803)
< HCI Command: Host Number of Com.. (0x03|0x0035) plen 5  #119 [hci1] 10.682595
        Num handles: 1
        Handle: 2163 Address: DF:A9:FF:F6:B1:1A (OUI DF-A9-FF)
        Count: 1
< ACL Data TX: Handle 2163 flags 0x00 dlen 20             #120 [hci1] 10.682659
      ATT: Read By Type Response (0x09) len 15
        Attribute data length: 7
        Attribute data list: 2 entries
        Handle: 0x0063
        Value: 126400b72b
            Properties: 0x12
              Read (0x02)
              Notify (0x10)
            Value Handle: 0x0064
            Value UUID: Bearer Signal Strength (0x2bb7)
        Handle: 0x0066
        Value: 0e6700b82b
            Properties: 0x0e
              Read (0x02)
              Write Without Response (0x04)
              Write (0x08)
            Value Handle: 0x0067
            Value UUID: Bearer Signal Strength Reporting Interval (0x2bb8)
> HCI Event: Number of Completed Packets (0x13) plen 5    #121 [hci1] 10.854665
        Num handles: 1
        Handle: 2163 Address: DF:A9:FF:F6:B1:1A (OUI DF-A9-FF)
        Count: 1
        #120: len 20 (0 Kb/s)
        Latency: 172 msec (81-172 msec ~166 msec)
> ACL Data RX: Handle 2163 flags 0x02 dlen 11             #122 [hci1] 10.854867
      ATT: Read By Type Request (0x08) len 6
        Handle range: 0x0067-0x0083
        Attribute type: Characteristic (0x2803)
< HCI Command: Host Number of Com.. (0x03|0x0035) plen 5  #123 [hci1] 10.862266
        Num handles: 1
        Handle: 2163 Address: DF:A9:FF:F6:B1:1A (OUI DF-A9-FF)
        Count: 1
< ACL Data TX: Handle 2163 flags 0x00 dlen 20             #124 [hci1] 10.862301
      ATT: Read By Type Response (0x09) len 15
        Attribute data length: 7
        Attribute data list: 2 entries
        Handle: 0x0068
        Value: 126900b92b
            Properties: 0x12
              Read (0x02)
              Notify (0x10)
            Value Handle: 0x0069
            Value UUID: Bearer List Current Calls (0x2bb9)
        Handle: 0x006b
        Value: 026c00ba2b
            Properties: 0x02
              Read (0x02)
            Value Handle: 0x006c
            Value UUID: Content Control ID (0x2bba)
> HCI Event: Number of Completed Packets (0x13) plen 5    #125 [hci1] 11.029655
        Num handles: 1
        Handle: 2163 Address: DF:A9:FF:F6:B1:1A (OUI DF-A9-FF)
        Count: 1
        #124: len 20 (0 Kb/s)
        Latency: 167 msec (81-172 msec ~166 msec)
> ACL Data RX: Handle 2163 flags 0x02 dlen 11             #126 [hci1] 11.029820
      ATT: Read By Type Request (0x08) len 6
        Handle range: 0x006c-0x0083
        Attribute type: Characteristic (0x2803)
< HCI Command: Host Number of Com.. (0x03|0x0035) plen 5  #127 [hci1] 11.042283
        Num handles: 1
        Handle: 2163 Address: DF:A9:FF:F6:B1:1A (OUI DF-A9-FF)
        Count: 1
< ACL Data TX: Handle 2163 flags 0x00 dlen 20             #128 [hci1] 11.042327
      ATT: Read By Type Response (0x09) len 15
        Attribute data length: 7
        Attribute data list: 2 entries
        Handle: 0x006d
        Value: 126e00bb2b
            Properties: 0x12
              Read (0x02)
              Notify (0x10)
            Value Handle: 0x006e
            Value UUID: Status Flags (0x2bbb)
        Handle: 0x0070
        Value: 127100bc2b
            Properties: 0x12
              Read (0x02)
              Notify (0x10)
            Value Handle: 0x0071
            Value UUID: Incoming Call Target Bearer URI (0x2bbc)
> HCI Event: Number of Completed Packets (0x13) plen 5    #129 [hci1] 11.204675
        Num handles: 1
        Handle: 2163 Address: DF:A9:FF:F6:B1:1A (OUI DF-A9-FF)
        Count: 1
        #128: len 20 (0 Kb/s)
        Latency: 162 msec (81-172 msec ~164 msec)
> ACL Data RX: Handle 2163 flags 0x02 dlen 11             #130 [hci1] 11.204886
      ATT: Read By Type Request (0x08) len 6
        Handle range: 0x0071-0x0083
        Attribute type: Characteristic (0x2803)
< HCI Command: Host Number of Com.. (0x03|0x0035) plen 5  #131 [hci1] 11.222723
        Num handles: 1
        Handle: 2163 Address: DF:A9:FF:F6:B1:1A (OUI DF-A9-FF)
        Count: 1
< ACL Data TX: Handle 2163 flags 0x00 dlen 20             #132 [hci1] 11.222831
      ATT: Read By Type Response (0x09) len 15
        Attribute data length: 7
        Attribute data list: 2 entries
        Handle: 0x0073
        Value: 127400bd2b
            Properties: 0x12
              Read (0x02)
              Notify (0x10)
            Value Handle: 0x0074
            Value UUID: Call State (0x2bbd)
        Handle: 0x0076
        Value: 1c7700be2b
            Properties: 0x1c
              Write Without Response (0x04)
              Write (0x08)
              Notify (0x10)
            Value Handle: 0x0077
            Value UUID: Call Control Point (0x2bbe)
> HCI Event: Number of Completed Packets (0x13) plen 5    #133 [hci1] 11.379646
        Num handles: 1
        Handle: 2163 Address: DF:A9:FF:F6:B1:1A (OUI DF-A9-FF)
        Count: 1
        #132: len 20 (1 Kb/s)
        Latency: 156 msec (81-172 msec ~160 msec)
> ACL Data RX: Handle 2163 flags 0x02 dlen 11             #134 [hci1] 11.379844
      ATT: Read By Type Request (0x08) len 6
        Handle range: 0x0077-0x0083
        Attribute type: Characteristic (0x2803)
< HCI Command: Host Number of Com.. (0x03|0x0035) plen 5  #135 [hci1] 11.382305
        Num handles: 1
        Handle: 2163 Address: DF:A9:FF:F6:B1:1A (OUI DF-A9-FF)
        Count: 1
< ACL Data TX: Handle 2163 flags 0x00 dlen 20             #136 [hci1] 11.382339
      ATT: Read By Type Response (0x09) len 15
        Attribute data length: 7
        Attribute data list: 2 entries
        Handle: 0x0079
        Value: 027a00bf2b
            Properties: 0x02
              Read (0x02)
            Value Handle: 0x007a
            Value UUID: Call Control Point Optional Opcodes (0x2bbf)
        Handle: 0x007b
        Value: 107c00c02b
            Properties: 0x10
              Notify (0x10)
            Value Handle: 0x007c
            Value UUID: Termination Reason (0x2bc0)
> HCI Event: Number of Completed Packets (0x13) plen 5    #137 [hci1] 11.554629
        Num handles: 1
        Handle: 2163 Address: DF:A9:FF:F6:B1:1A (OUI DF-A9-FF)
        Count: 1
        #136: len 20 (0 Kb/s)
        Latency: 172 msec (81-172 msec ~166 msec)
> ACL Data RX: Handle 2163 flags 0x02 dlen 11             #138 [hci1] 11.554843
      ATT: Read By Type Request (0x08) len 6
        Handle range: 0x007c-0x0083
        Attribute type: Characteristic (0x2803)
< HCI Command: Host Number of Com.. (0x03|0x0035) plen 5  #139 [hci1] 11.562207
        Num handles: 1
        Handle: 2163 Address: DF:A9:FF:F6:B1:1A (OUI DF-A9-FF)
        Count: 1
< ACL Data TX: Handle 2163 flags 0x00 dlen 20             #140 [hci1] 11.562231
      ATT: Read By Type Response (0x09) len 15
        Attribute data length: 7
        Attribute data list: 2 entries
        Handle: 0x007e
        Value: 127f00c12b
            Properties: 0x12
              Read (0x02)
              Notify (0x10)
            Value Handle: 0x007f
            Value UUID: Incoming Call (0x2bc1)
        Handle: 0x0081
        Value: 128200c22b
            Properties: 0x12
              Read (0x02)
              Notify (0x10)
            Value Handle: 0x0082
            Value UUID: Call Friendly Name (0x2bc2)
> HCI Event: Number of Completed Packets (0x13) plen 5    #141 [hci1] 11.729728
        Num handles: 1
        Handle: 2163 Address: DF:A9:FF:F6:B1:1A (OUI DF-A9-FF)
        Count: 1
        #140: len 20 (0 Kb/s)
        Latency: 167 msec (81-172 msec ~166 msec)
> ACL Data RX: Handle 2163 flags 0x02 dlen 11             #142 [hci1] 11.729892
      ATT: Read By Type Request (0x08) len 6
        Handle range: 0x0082-0x0083
        Attribute type: Characteristic (0x2803)
< HCI Command: Host Number of Com.. (0x03|0x0035) plen 5  #143 [hci1] 11.742736
        Num handles: 1
        Handle: 2163 Address: DF:A9:FF:F6:B1:1A (OUI DF-A9-FF)
        Count: 1
< ACL Data TX: Handle 2163 flags 0x00 dlen 9              #144 [hci1] 11.742945
      ATT: Error Response (0x01) len 4
        Read By Type Request (0x08)
        Handle: 0x0082
        Error: Attribute Not Found (0x0a)
> HCI Event: Number of Completed Packets (0x13) plen 5    #145 [hci1] 11.904658
        Num handles: 1
        Handle: 2163 Address: DF:A9:FF:F6:B1:1A (OUI DF-A9-FF)
        Count: 1
        #144: len 9 (0 Kb/s)
        Latency: 161 msec (81-172 msec ~164 msec)
> ACL Data RX: Handle 2163 flags 0x02 dlen 9              #146 [hci1] 11.904770
      ATT: Find Information Request (0x04) len 4
        Handle range: 0x005a-0x005a
< HCI Command: Host Number of Com.. (0x03|0x0035) plen 5  #147 [hci1] 11.922335
        Num handles: 1
        Handle: 2163 Address: DF:A9:FF:F6:B1:1A (OUI DF-A9-FF)
        Count: 1
< ACL Data TX: Handle 2163 flags 0x00 dlen 10             #148 [hci1] 11.922387
      ATT: Find Information Response (0x05) len 5
        Format: UUID-16 (0x01)
        Handle: 0x005a
        UUID: Client Characteristic Configuration (0x2902)
> HCI Event: Number of Completed Packets (0x13) plen 5    #149 [hci1] 12.079679
        Num handles: 1
        Handle: 2163 Address: DF:A9:FF:F6:B1:1A (OUI DF-A9-FF)
        Count: 1
        #148: len 10 (0 Kb/s)
        Latency: 157 msec (81-172 msec ~160 msec)
> ACL Data RX: Handle 2163 flags 0x02 dlen 9              #150 [hci1] 12.079793
      ATT: Find Information Request (0x04) len 4
        Handle range: 0x005f-0x005f
< HCI Command: Host Number of Com.. (0x03|0x0035) plen 5  #151 [hci1] 12.082332
        Num handles: 1
        Handle: 2163 Address: DF:A9:FF:F6:B1:1A (OUI DF-A9-FF)
        Count: 1
< ACL Data TX: Handle 2163 flags 0x00 dlen 10             #152 [hci1] 12.082343
      ATT: Find Information Response (0x05) len 5
        Format: UUID-16 (0x01)
        Handle: 0x005f
        UUID: Client Characteristic Configuration (0x2902)
> HCI Event: Number of Completed Packets (0x13) plen 5    #153 [hci1] 12.254668
        Num handles: 1
        Handle: 2163 Address: DF:A9:FF:F6:B1:1A (OUI DF-A9-FF)
        Count: 1
        #152: len 10 (0 Kb/s)
        Latency: 172 msec (81-172 msec ~166 msec)
> ACL Data RX: Handle 2163 flags 0x02 dlen 9              #154 [hci1] 12.254853
      ATT: Find Information Request (0x04) len 4
        Handle range: 0x0062-0x0062
< HCI Command: Host Number of Com.. (0x03|0x0035) plen 5  #155 [hci1] 12.262722
        Num handles: 1
        Handle: 2163 Address: DF:A9:FF:F6:B1:1A (OUI DF-A9-FF)
        Count: 1
< ACL Data TX: Handle 2163 flags 0x00 dlen 10             #156 [hci1] 12.262791
      ATT: Find Information Response (0x05) len 5
        Format: UUID-16 (0x01)
        Handle: 0x0062
        UUID: Client Characteristic Configuration (0x2902)
> HCI Event: Number of Completed Packets (0x13) plen 5    #157 [hci1] 12.429706
        Num handles: 1
        Handle: 2163 Address: DF:A9:FF:F6:B1:1A (OUI DF-A9-FF)
        Count: 1
        #156: len 10 (0 Kb/s)
        Latency: 166 msec (81-172 msec ~166 msec)
> ACL Data RX: Handle 2163 flags 0x02 dlen 9              #158 [hci1] 12.429781
      ATT: Find Information Request (0x04) len 4
        Handle range: 0x0065-0x0065
< HCI Command: Host Number of Com.. (0x03|0x0035) plen 5  #159 [hci1] 12.442302
        Num handles: 1
        Handle: 2163 Address: DF:A9:FF:F6:B1:1A (OUI DF-A9-FF)
        Count: 1
< ACL Data TX: Handle 2163 flags 0x00 dlen 10             #160 [hci1] 12.442315
      ATT: Find Information Response (0x05) len 5
        Format: UUID-16 (0x01)
        Handle: 0x0065
        UUID: Client Characteristic Configuration (0x2902)
> HCI Event: Number of Completed Packets (0x13) plen 5    #161 [hci1] 12.604550
        Num handles: 1
        Handle: 2163 Address: DF:A9:FF:F6:B1:1A (OUI DF-A9-FF)
        Count: 1
        #160: len 10 (0 Kb/s)
        Latency: 162 msec (81-172 msec ~164 msec)
> ACL Data RX: Handle 2163 flags 0x02 dlen 9              #162 [hci1] 12.604814
      ATT: Find Information Request (0x04) len 4
        Handle range: 0x006a-0x006a
< HCI Command: Host Number of Com.. (0x03|0x0035) plen 5  #163 [hci1] 12.622240
        Num handles: 1
        Handle: 2163 Address: DF:A9:FF:F6:B1:1A (OUI DF-A9-FF)
        Count: 1
< ACL Data TX: Handle 2163 flags 0x00 dlen 10             #164 [hci1] 12.622284
      ATT: Find Information Response (0x05) len 5
        Format: UUID-16 (0x01)
        Handle: 0x006a
        UUID: Client Characteristic Configuration (0x2902)
> HCI Event: Number of Completed Packets (0x13) plen 5    #165 [hci1] 12.779609
        Num handles: 1
        Handle: 2163 Address: DF:A9:FF:F6:B1:1A (OUI DF-A9-FF)
        Count: 1
        #164: len 10 (0 Kb/s)
        Latency: 157 msec (81-172 msec ~160 msec)
> ACL Data RX: Handle 2163 flags 0x02 dlen 9              #166 [hci1] 12.779754
      ATT: Find Information Request (0x04) len 4
        Handle range: 0x006f-0x006f
< HCI Command: Host Number of Com.. (0x03|0x0035) plen 5  #167 [hci1] 12.782711
        Num handles: 1
        Handle: 2163 Address: DF:A9:FF:F6:B1:1A (OUI DF-A9-FF)
        Count: 1
< ACL Data TX: Handle 2163 flags 0x00 dlen 10             #168 [hci1] 12.782785
      ATT: Find Information Response (0x05) len 5
        Format: UUID-16 (0x01)
        Handle: 0x006f
        UUID: Client Characteristic Configuration (0x2902)
> HCI Event: Number of Completed Packets (0x13) plen 5    #169 [hci1] 12.954631
        Num handles: 1
        Handle: 2163 Address: DF:A9:FF:F6:B1:1A (OUI DF-A9-FF)
        Count: 1
        #168: len 10 (0 Kb/s)
        Latency: 171 msec (81-172 msec ~166 msec)
> ACL Data RX: Handle 2163 flags 0x02 dlen 9              #170 [hci1] 12.954779
      ATT: Find Information Request (0x04) len 4
        Handle range: 0x0072-0x0072
< HCI Command: Host Number of Com.. (0x03|0x0035) plen 5  #171 [hci1] 12.962297
        Num handles: 1
        Handle: 2163 Address: DF:A9:FF:F6:B1:1A (OUI DF-A9-FF)
        Count: 1
< ACL Data TX: Handle 2163 flags 0x00 dlen 10             #172 [hci1] 12.962339
      ATT: Find Information Response (0x05) len 5
        Format: UUID-16 (0x01)
        Handle: 0x0072
        UUID: Client Characteristic Configuration (0x2902)
> HCI Event: Number of Completed Packets (0x13) plen 5    #173 [hci1] 13.129595
        Num handles: 1
        Handle: 2163 Address: DF:A9:FF:F6:B1:1A (OUI DF-A9-FF)
        Count: 1
        #172: len 10 (0 Kb/s)
        Latency: 167 msec (81-172 msec ~166 msec)
> ACL Data RX: Handle 2163 flags 0x02 dlen 9              #174 [hci1] 13.129769
      ATT: Find Information Request (0x04) len 4
        Handle range: 0x0075-0x0075
< HCI Command: Host Number of Com.. (0x03|0x0035) plen 5  #175 [hci1] 13.142299
        Num handles: 1
        Handle: 2163 Address: DF:A9:FF:F6:B1:1A (OUI DF-A9-FF)
        Count: 1
< ACL Data TX: Handle 2163 flags 0x00 dlen 10             #176 [hci1] 13.142323
      ATT: Find Information Response (0x05) len 5
        Format: UUID-16 (0x01)
        Handle: 0x0075
        UUID: Client Characteristic Configuration (0x2902)
> HCI Event: Number of Completed Packets (0x13) plen 5    #177 [hci1] 13.304710
        Num handles: 1
        Handle: 2163 Address: DF:A9:FF:F6:B1:1A (OUI DF-A9-FF)
        Count: 1
        #176: len 10 (0 Kb/s)
        Latency: 162 msec (81-172 msec ~164 msec)
> ACL Data RX: Handle 2163 flags 0x02 dlen 9              #178 [hci1] 13.304852
      ATT: Find Information Request (0x04) len 4
        Handle range: 0x0078-0x0078
< HCI Command: Host Number of Com.. (0x03|0x0035) plen 5  #179 [hci1] 13.322705
        Num handles: 1
        Handle: 2163 Address: DF:A9:FF:F6:B1:1A (OUI DF-A9-FF)
        Count: 1
< ACL Data TX: Handle 2163 flags 0x00 dlen 10             #180 [hci1] 13.322842
      ATT: Find Information Response (0x05) len 5
        Format: UUID-16 (0x01)
        Handle: 0x0078
        UUID: Client Characteristic Configuration (0x2902)
> HCI Event: Number of Completed Packets (0x13) plen 5    #181 [hci1] 13.479560
        Num handles: 1
        Handle: 2163 Address: DF:A9:FF:F6:B1:1A (OUI DF-A9-FF)
        Count: 1
        #180: len 10 (0 Kb/s)
        Latency: 156 msec (81-172 msec ~160 msec)
> ACL Data RX: Handle 2163 flags 0x02 dlen 9              #182 [hci1] 13.479747
      ATT: Find Information Request (0x04) len 4
        Handle range: 0x007d-0x007d
< HCI Command: Host Number of Com.. (0x03|0x0035) plen 5  #183 [hci1] 13.482207
        Num handles: 1
        Handle: 2163 Address: DF:A9:FF:F6:B1:1A (OUI DF-A9-FF)
        Count: 1
< ACL Data TX: Handle 2163 flags 0x00 dlen 10             #184 [hci1] 13.482213
      ATT: Find Information Response (0x05) len 5
        Format: UUID-16 (0x01)
        Handle: 0x007d
        UUID: Client Characteristic Configuration (0x2902)
> HCI Event: Number of Completed Packets (0x13) plen 5    #185 [hci1] 13.654593
        Num handles: 1
        Handle: 2163 Address: DF:A9:FF:F6:B1:1A (OUI DF-A9-FF)
        Count: 1
        #184: len 10 (0 Kb/s)
        Latency: 172 msec (81-172 msec ~166 msec)
> ACL Data RX: Handle 2163 flags 0x02 dlen 9              #186 [hci1] 13.654847
      ATT: Find Information Request (0x04) len 4
        Handle range: 0x0080-0x0080
< HCI Command: Host Number of Com.. (0x03|0x0035) plen 5  #187 [hci1] 13.662149
        Num handles: 1
        Handle: 2163 Address: DF:A9:FF:F6:B1:1A (OUI DF-A9-FF)
        Count: 1
< ACL Data TX: Handle 2163 flags 0x00 dlen 10             #188 [hci1] 13.662177
      ATT: Find Information Response (0x05) len 5
        Format: UUID-16 (0x01)
        Handle: 0x0080
        UUID: Client Characteristic Configuration (0x2902)
> HCI Event: Number of Completed Packets (0x13) plen 5    #189 [hci1] 13.829563
        Num handles: 1
        Handle: 2163 Address: DF:A9:FF:F6:B1:1A (OUI DF-A9-FF)
        Count: 1
        #188: len 10 (0 Kb/s)
        Latency: 167 msec (81-172 msec ~166 msec)
> ACL Data RX: Handle 2163 flags 0x02 dlen 9              #190 [hci1] 13.829792
      ATT: Find Information Request (0x04) len 4
        Handle range: 0x0083-0x0083
< HCI Command: Host Number of Com.. (0x03|0x0035) plen 5  #191 [hci1] 13.842675
        Num handles: 1
        Handle: 2163 Address: DF:A9:FF:F6:B1:1A (OUI DF-A9-FF)
        Count: 1
< ACL Data TX: Handle 2163 flags 0x00 dlen 10             #192 [hci1] 13.842783
      ATT: Find Information Response (0x05) len 5
        Format: UUID-16 (0x01)
        Handle: 0x0083
        UUID: Client Characteristic Configuration (0x2902)
> HCI Event: Number of Completed Packets (0x13) plen 5    #193 [hci1] 14.004643
        Num handles: 1
        Handle: 2163 Address: DF:A9:FF:F6:B1:1A (OUI DF-A9-FF)
        Count: 1
        #192: len 10 (0 Kb/s)
        Latency: 161 msec (81-172 msec ~164 msec)
> ACL Data RX: Handle 2163 flags 0x02 dlen 7              #194 [hci1] 14.004750
      ATT: Read Request (0x0a) len 2
        Handle: 0x0065
< HCI Command: Host Number of Com.. (0x03|0x0035) plen 5  #195 [hci1] 14.022278
        Num handles: 1
        Handle: 2163 Address: DF:A9:FF:F6:B1:1A (OUI DF-A9-FF)
        Count: 1
< ACL Data TX: Handle 2163 flags 0x00 dlen 7              #196 [hci1] 14.022301
      ATT: Read Response (0x0b) len 2
> HCI Event: Number of Completed Packets (0x13) plen 5    #197 [hci1] 14.179521
        Num handles: 1
        Handle: 2163 Address: DF:A9:FF:F6:B1:1A (OUI DF-A9-FF)
        Count: 1
        #196: len 7 (0 Kb/s)
        Latency: 157 msec (81-172 msec ~160 msec)
> ACL Data RX: Handle 2163 flags 0x02 dlen 7              #198 [hci1] 14.179806
      ATT: Read Request (0x0a) len 2
        Handle: 0x0064
< HCI Command: Host Number of Com.. (0x03|0x0035) plen 5  #199 [hci1] 14.182262
        Num handles: 1
        Handle: 2163 Address: DF:A9:FF:F6:B1:1A (OUI DF-A9-FF)
        Count: 1
< ACL Data TX: Handle 2163 flags 0x00 dlen 6              #200 [hci1] 14.182296
      ATT: Read Response (0x0b) len 1
> HCI Event: Number of Completed Packets (0x13) plen 5    #201 [hci1] 14.354505
        Num handles: 1
        Handle: 2163 Address: DF:A9:FF:F6:B1:1A (OUI DF-A9-FF)
        Count: 1
        #200: len 6 (0 Kb/s)
        Latency: 172 msec (81-172 msec ~166 msec)
> HCI Event: Disconnect Complete (0x05) plen 4            #202 [hci1] 15.754675
        Status: Success (0x00)
        Handle: 2163 Address: DF:A9:FF:F6:B1:1A (OUI DF-A9-FF)
        Reason: Remote User Terminated Connection (0x13)
< HCI Command: Reset (0x03|0x0003) plen 0                 #203 [hci1] 20.742216
> HCI Event: Command Complete (0x0e) plen 4               #204 [hci1] 20.742680
      Reset (0x03|0x0003) ncmd 1
        Status: Success (0x00)
@ USER Close: main                                    {0x0001} [hci1] 20.762103
= Close Index: 00:00:00:00:00:00                               [hci1] 20.765484
