Bluetooth monitor ver 5.72
= Note: Linux version 6.14.0-36-generic (x86_64)                       0.087051
= Note: Bluetooth subsystem version 2.22                               0.087053
= New Index: 00:00:00:00:00:00 (Primary,UART,hci1)              [hci1] 0.087054
= New Index: 48:5F:99:8E:E0:64 (Primary,USB,hci0)               [hci0] 0.087054
= Open Index: 00:00:00:00:00:00                                 [hci1] 0.230756
= Index Info: 00:00:00:00:00:00 (Nordic Semiconductor ASA)      [hci1] 0.230784
@ USER Open: main (privileged) version 2.22            {0x0001} [hci1] 0.230789
< HCI Command: Reset (0x03|0x0003) plen 0                    #1 [hci1] 0.231548
> HCI Event: Command Complete (0x0e) plen 4                  #2 [hci1] 0.232036
      Reset (0x03|0x0003) ncmd 1
        Status: Success (0x00)
< HCI Command: Read Local Supported... (0x04|0x0003) plen 0  #3 [hci1] 0.250412
> HCI Event: Command Complete (0x0e) plen 12                 #4 [hci1] 0.250866
      Read Local Supported Features (0x04|0x0003) ncmd 1
        Status: Success (0x00)
        Features: 0x00 0x00 0x00 0x00 0x60 0x00 0x00 0x00
          BR/EDR Not Supported
          LE Supported (Controller)
< HCI Command: Read Local Version In.. (0x04|0x0001) plen 0  #5 [hci1] 0.270378
> HCI Event: Command Complete (0x0e) plen 12                 #6 [hci1] 0.270852
      Read Local Version Information (0x04|0x0001) ncmd 1
        Status: Success (0x00)
        HCI version: Reserved (0x0f) - Revision 12393 (0x3069)
        LMP version: Reserved (0x0f) - Subversion 12393 (0x3069)
        Manufacturer: Nordic Semiconductor ASA (89)
< HCI Command: Read Local Supported... (0x04|0x0002) plen 0  #7 [hci1] 0.290287
> HCI Event: Command Complete (0x0e) plen 68                 #8 [hci1] 0.291350
      Read Local Supported Commands (0x04|0x0002) ncmd 1
        Status: Success (0x00)
        Commands: 119 entries
          Disconnect (Octet 0 - Bit 5)
          Read Remote Version Information (Octet 2 - Bit 7)
          Set Event Mask (Octet 5 - Bit 6)
          Reset (Octet 5 - Bit 7)
          Read Connection Accept Timeout (Octet 7 - Bit 2)
          Write Connection Accept Timeout (Octet 7 - Bit 3)
          Read Transmit Power Level (Octet 10 - Bit 2)
          Set Controller To Host Flow Control (Octet 10 - Bit 5)
          Host Buffer Size (Octet 10 - Bit 6)
          Host Number of Completed Packets (Octet 10 - Bit 7)
          Read Local Version Information (Octet 14 - Bit 3)
          Read Local Supported Features (Octet 14 - Bit 5)
          Read BD ADDR (Octet 15 - Bit 1)
          Read RSSI (Octet 15 - Bit 5)
          Set Event Mask Page 2 (Octet 22 - Bit 2)
          LE Set Event Mask (Octet 25 - Bit 0)
          LE Read Buffer Size (Octet 25 - Bit 1)
          LE Read Local Supported Features (Octet 25 - Bit 2)
          LE Set Random Address (Octet 25 - Bit 4)
          LE Set Advertising Parameters (Octet 25 - Bit 5)
          LE Read Advertising Channel TX Power (Octet 25 - Bit 6)
          LE Set Advertising Data (Octet 25 - Bit 7)
          LE Set Scan Response Data (Octet 26 - Bit 0)
          LE Set Advertise Enable (Octet 26 - Bit 1)
          LE Set Scan Parameters (Octet 26 - Bit 2)
          LE Set Scan Enable (Octet 26 - Bit 3)
          LE Create Connection (Octet 26 - Bit 4)
          LE Create Connection Cancel (Octet 26 - Bit 5)
          LE Read Accept List Size (Octet 26 - Bit 6)
          LE Clear Accept List (Octet 26 - Bit 7)
          LE Add Device To Accept List (Octet 27 - Bit 0)
          LE Remove Device From Accept List (Octet 27 - Bit 1)
          LE Connection Update (Octet 27 - Bit 2)
          LE Set Host Channel Classification (Octet 27 - Bit 3)
          LE Read Channel Map (Octet 27 - Bit 4)
          LE Read Remote Used Features (Octet 27 - Bit 5)
          LE Encrypt (Octet 27 - Bit 6)
          LE Rand (Octet 27 - Bit 7)
          LE Start Encryption (Octet 28 - Bit 0)
          LE Long Term Key Request Reply (Octet 28 - Bit 1)
          LE Long Term Key Request Neg Reply (Octet 28 - Bit 2)
          LE Read Supported States (Octet 28 - Bit 3)
          LE Receiver Test (Octet 28 - Bit 4)
          LE Transmitter Test (Octet 28 - Bit 5)
          LE Test End (Octet 28 - Bit 6)
          Read Authenticated Payload Timeout (Octet 32 - Bit 4)
          Write Authenticated Payload Timeout (Octet 32 - Bit 5)
          LE Set Data Length (Octet 33 - Bit 6)
          LE Read Suggested Default Data Length (Octet 33 - Bit 7)
          LE Write Suggested Default Data Length (Octet 34 - Bit 0)
          LE Add Device To Resolving List (Octet 34 - Bit 3)
          LE Remove Device From Resolving List (Octet 34 - Bit 4)
          LE Clear Resolving List (Octet 34 - Bit 5)
          LE Read Resolving List Size (Octet 34 - Bit 6)
          LE Set Address Resolution Enable (Octet 35 - Bit 1)
          LE Set Resolvable Private Address Timeout (Octet 35 - Bit 2)
          LE Read Maximum Data Length (Octet 35 - Bit 3)
          LE Read PHY (Octet 35 - Bit 4)
          LE Set Default PHY (Octet 35 - Bit 5)
          LE Set PHY (Octet 35 - Bit 6)
          LE Enhanced Receiver Test (Octet 35 - Bit 7)
          LE Enhanced Transmitter Test (Octet 36 - Bit 0)
          LE Set Advertising Set Random Address (Octet 36 - Bit 1)
          LE Set Extended Advertising Parameters (Octet 36 - Bit 2)
          LE Set Extended Advertising Data (Octet 36 - Bit 3)
          LE Set Extended Scan Response Data (Octet 36 - Bit 4)
          LE Set Extended Advertising Enable (Octet 36 - Bit 5)
          LE Read Maximum Advertising Data Length (Octet 36 - Bit 6)
          LE Read Number of Supported Advertising Sets (Octet 36 - Bit 7)
          LE Remove Advertising Set (Octet 37 - Bit 0)
          LE Clear Advertising Sets (Octet 37 - Bit 1)
          LE Set Periodic Advertising Parameters (Octet 37 - Bit 2)
          LE Set Periodic Advertising Data (Octet 37 - Bit 3)
          LE Set Periodic Advertising Enable (Octet 37 - Bit 4)
          LE Set Extended Scan Parameters (Octet 37 - Bit 5)
          LE Set Extended Scan Enable (Octet 37 - Bit 6)
          LE Extended Create Connection (Octet 37 - Bit 7)
          LE Periodic Advertising Create Sync (Octet 38 - Bit 0)
          LE Periodic Advertising Create Sync Cancel (Octet 38 - Bit 1)
          LE Periodic Advertising Terminate Sync (Octet 38 - Bit 2)
          LE Add Device To Periodic Advertiser List (Octet 38 - Bit 3)
          LE Remove Device From Periodic Advertiser List (Octet 38 - Bit 4)
          LE Clear Periodic Advertiser List (Octet 38 - Bit 5)
          LE Read Periodic Advertiser List Size (Octet 38 - Bit 6)
          LE Read Transmit Power (Octet 38 - Bit 7)
          LE Read RF Path Compensation (Octet 39 - Bit 0)
          LE Write RF Path Compensation (Octet 39 - Bit 1)
          LE Set Privacy Mode (Octet 39 - Bit 2)
          LE Periodic Advertising Receive Enable (Octet 40 - Bit 5)
          LE Periodic Advertising Sync Transfer (Octet 40 - Bit 6)
          LE Periodic Advertising Set Info Transfer (Octet 40 - Bit 7)
          LE Periodic Advertising Sync Transfer Parameters (Octet 41 - Bit 0)
          LE Set Default Periodic Advertisng Sync Transfer Parameters (Octet 41 - Bit 1)
          LE Read Buffer v2 (Octet 41 - Bit 5)
          LE Read ISO TX Sync (Octet 41 - Bit 6)
          LE Set Connected Isochronous Group Parameters (Octet 41 - Bit 7)
          LE Set Connected Isochronous Group Parameters Test (Octet 42 - Bit 0)
          LE Create Connected Isochronous Stream (Octet 42 - Bit 1)
          LE Remove Connected Isochronous Group (Octet 42 - Bit 2)
          LE Accept Connected Isochronous Stream Request (Octet 42 - Bit 3)
          LE Reject Connected Isochronous Stream Request (Octet 42 - Bit 4)
          LE Create Broadcast Isochronous Group (Octet 42 - Bit 5)
          LE Create Broadcast Isochronous Group Test (Octet 42 - Bit 6)
          LE Terminate Broadcast Isochronous Group (Octet 42 - Bit 7)
          LE Broadcast Isochronous Group Create Sync (Octet 43 - Bit 0)
          LE Broadcast Isochronous Group Terminate Sync (Octet 43 - Bit 1)
          LE Request Peer SCA (Octet 43 - Bit 2)
          LE Setup Isochronous Data Path (Octet 43 - Bit 3)
          LE Remove Isochronous Data Path (Octet 43 - Bit 4)
          LE Isochronous Transmit Test (Octet 43 - Bit 5)
          LE Isochronous Receive Test (Octet 43 - Bit 6)
          LE Isochronous Read Test Counters (Octet 43 - Bit 7)
          LE Isochronous Read Test Counters (Octet 44 - Bit 0)
          LE Set Host Feature (Octet 44 - Bit 1)
          Octet 44 - Bit 2 
          Octet 45 - Bit 6 
          Octet 46 - Bit 0 
          Octet 46 - Bit 1 
          Octet 46 - Bit 2 
< HCI Command: Host Buffer Size (0x03|0x0033) plen 7         #9 [hci1] 0.310403
        ACL MTU: 255  ACL max packet: 16
        SCO MTU: 0    SCO max packet: 0
> HCI Event: Command Complete (0x0e) plen 4                 #10 [hci1] 0.310949
      Host Buffer Size (0x03|0x0033) ncmd 1
        Status: Success (0x00)
< HCI Command: Set Controller To Ho.. (0x03|0x0031) plen 1  #11 [hci1] 0.330371
        Flow control: ACL Data Packets (0x01)
> HCI Event: Command Complete (0x0e) plen 4                 #12 [hci1] 0.330805
      Set Controller To Host Flow Control (0x03|0x0031) ncmd 1
        Status: Success (0x00)
< HCI Command: LE Read Local Suppor.. (0x08|0x0003) plen 0  #13 [hci1] 0.350372
> HCI Event: Command Complete (0x0e) plen 12                #14 [hci1] 0.350886
      LE Read Local Supported Features (0x08|0x0003) ncmd 1
        Status: Success (0x00)
        Features: 0xfd 0x79 0x00 0xf7 0x30 0x01 0x00 0x00
          LE Encryption
          Extended Reject Indication
          Peripheral-initiated Features Exchange
          LE Ping
          LE Data Packet Length Extension
          LL Privacy
          Extended Scanner Filter Policies
          LE 2M PHY
          LE Coded PHY
          LE Extended Advertising
          LE Periodic Advertising
          Channel Selection Algorithm #2
          Periodic Advertising Sync Transfer - Sender
          Periodic Advertising Sync Transfer - Recipient
          Sleep Clock Accuracy Updates
          Connected Isochronous Stream - Central
          Connected Isochronous Stream - Peripheral
          Isochronous Broadcaster
          Synchronized Receiver
          Periodic Advertising ADI support
          Connection Subrating
          Unknown features (0x0000010000000000)
< HCI Command: LE Set Host Feature (0x08|0x0074) plen 2     #15 [hci1] 0.370367
        Bit Number: 32
          Connected Isochronous Stream (Host Support)
        Bit Value: 1
> HCI Event: Command Complete (0x0e) plen 4                 #16 [hci1] 0.370773
      LE Set Host Feature (0x08|0x0074) ncmd 1
        Status: Success (0x00)
< HCI Command: LE Read Buffer v2 (0x08|0x0060) plen 0       #17 [hci1] 0.390581
> HCI Event: Command Complete (0x0e) plen 10                #18 [hci1] 0.391028
      LE Read Buffer v2 (0x08|0x0060) ncmd 1
        Status: Success (0x00)
        ACL MTU: 27
        ACL max packet: 3
        ISO MTU: 318
        ISO max packet: 3
< HCI Command: LE Read Maximum Adve.. (0x08|0x003a) plen 0  #19 [hci1] 0.410384
> HCI Event: Command Complete (0x0e) plen 6                 #20 [hci1] 0.410835
      LE Read Maximum Advertising Data Length (0x08|0x003a) ncmd 1
        Status: Success (0x00)
        Max length: 1650
< HCI Command: LE Read Supported St.. (0x08|0x001c) plen 0  #21 [hci1] 0.430395
> HCI Event: Command Complete (0x0e) plen 12                #22 [hci1] 0.430860
      LE Read Supported States (0x08|0x001c) ncmd 1
        Status: Success (0x00)
        States: 0x000003ff3e0306ff
          Non-connectable Advertising State
          Scannable Advertising State
          Connectable Advertising State
          High Duty Cycle Directed Advertising State
          Passive Scanning State
          Active Scanning State
          Initiating State
            and Connection State (Central Role)
          Connection State (Peripheral Role)
          Scannable Advertising State
            and Passive Scanning State
          Connectable Advertising State
            and Passive Scanning State
          Non-connectable Advertising State
            and Initiating State
          Scannable Advertising State
            and Initiating State
          Active Scanning State
            and Connection State (Central Role)
          Passive Scanning State
            and Connection State (Peripheral Role)
          Active Scanning State
            and Connection State (Peripheral Role)
          Initiating State
            and Connection State (Central Role)
            and Central Role & Central Role
          Low Duty Cycle Directed Advertising State
          Connectable Advertising State
            and Initiating State
            and Central Role & Peripheral Role
          High Duty Cycle Directed Advertising State
            and Initiating State
            and Central Role & Peripheral Role
          Low Duty Cycle Directed Advertising State
            and Initiating State
            and Central Role & Peripheral Role
          Connectable Advertising State
            and Connection State (Central Role)
            and Central Role & Peripheral Role
          High Duty Cycle Directed Advertising State
            and Connection State (Central Role)
            and Central Role & Peripheral Role
          Low Duty Cycle Directed Advertising State
            and Connection State (Central Role)
            and Central Role & Peripheral Role
          Connectable Advertising State
            and Connection State (Peripheral Role)
            and Central Role & Peripheral Role
          High Duty Cycle Directed Advertising State
            and Connection State (Peripheral Role)
            and Peripheral Role & Peripheral Role
          Low Duty Cycle Directed Advertising State
            and Connection State (Peripheral Role)
            and Peripheral Role & Peripheral Role
          Initiating State
            and Connection State (Peripheral Role)
            and Central Role & Peripheral Role
< HCI Command: LE Read Maximum Data.. (0x08|0x002f) plen 0  #23 [hci1] 0.450376
> HCI Event: Command Complete (0x0e) plen 12                #24 [hci1] 0.450840
      LE Read Maximum Data Length (0x08|0x002f) ncmd 1
        Status: Success (0x00)
        Max TX octets: 251
        Max TX time: 2704
        Max RX octets: 251
        Max RX time: 2704
< HCI Command: LE Write Suggested D.. (0x08|0x0024) plen 4  #25 [hci1] 0.470370
        TX octets: 251
        TX time: 2704
> HCI Event: Command Complete (0x0e) plen 4                 #26 [hci1] 0.470818
      LE Write Suggested Default Data Length (0x08|0x0024) ncmd 1
        Status: Success (0x00)
< HCI Command: LE Read Resolving Li.. (0x08|0x002a) plen 0  #27 [hci1] 0.490317
> HCI Event: Command Complete (0x0e) plen 5                 #28 [hci1] 0.490680
      LE Read Resolving List Size (0x08|0x002a) ncmd 1
        Status: Success (0x00)
        Size: 8
< HCI Command: LE Set Event Mask (0x08|0x0001) plen 8       #29 [hci1] 0.510364
        Mask: 0x000002023f87fa5e
          LE Advertising Report
          LE Connection Update Complete
          LE Read Remote Used Features Complete
          LE Long Term Key Request
          LE Data Length Change
          LE Enhanced Connection Complete
          LE PHY Update Complete
          LE Extended Advertising Report
          LE Periodic Advertising Sync Established
          LE Periodic Advertising Report
          LE Periodic Advertising Sync Lost
          LE Extended Scan Timeout
          LE Extended Advertising Set Terminated
          LE Scan Request Received
          LE Periodic Advertising Sync Transfer Rvc
          LE CIS Established
          LE CIS Request
          LE Create BIG Complete
          LE Terminate BIG Complete
          LE BIG Sync Estabilished Complete
          LE BIG Sync Lost
          LE BIG Info Advertising Report
          Unknown mask (0x0000020000000000)
> HCI Event: Command Complete (0x0e) plen 4                 #30 [hci1] 0.510901
      LE Set Event Mask (0x08|0x0001) ncmd 1
        Status: Success (0x00)
< HCI Command: Set Event Mask (0x03|0x0001) plen 8          #31 [hci1] 0.530328
        Mask: 0x2000800002008890
          Disconnection Complete
          Encryption Change
          Read Remote Version Information Complete
          Hardware Error
          Data Buffer Overflow
          Encryption Key Refresh Complete
          LE Meta
> HCI Event: Command Complete (0x0e) plen 4                 #32 [hci1] 0.530854
      Set Event Mask (0x03|0x0001) ncmd 1
        Status: Success (0x00)
< HCI Command: Read BD ADDR (0x04|0x0009) plen 0            #33 [hci1] 0.550338
> HCI Event: Command Complete (0x0e) plen 10                #34 [hci1] 0.550788
      Read BD ADDR (0x04|0x0009) ncmd 1
        Status: Success (0x00)
        Address: 00:00:00:00:00:00 (OUI 00-00-00)
< HCI Command: LE Set Random Address (0x08|0x0005) plen 6   #35 [hci1] 0.570375
        Address: D5:B6:CC:31:DB:3B (Static)
> HCI Event: Command Complete (0x0e) plen 4                 #36 [hci1] 0.570799
      LE Set Random Address (0x08|0x0005) ncmd 1
        Status: Success (0x00)
< HCI Command: LE Set Extended Adv.. (0x08|0x0036) plen 25  #37 [hci1] 1.880427
        Handle: 0x00
        Properties: 0x0001
          Connectable
        Min advertising interval: 100.000 msec (0x00a0)
        Max advertising interval: 150.000 msec (0x00f0)
        Channel map: 37, 38, 39 (0x07)
        Own address type: Random (0x01)
        Peer address type: Public (0x00)
        Peer address: 00:00:00:00:00:00 (OUI 00-00-00)
        Filter policy: Allow Scan Request from Any, Allow Connect Request from Any (0x00)
        TX power: Host has no preference (0x7f)
        Primary PHY: LE 1M (0x01)
        Secondary max skip: 0x00
        Secondary PHY: LE 2M (0x02)
        SID: 0x00
        Scan request notifications: Disabled (0x00)
> HCI Event: Command Complete (0x0e) plen 5                 #38 [hci1] 1.881204
      LE Set Extended Advertising Parameters (0x08|0x0036) ncmd 1
        Status: Success (0x00)
        TX power (selected): 0 dbm (0x00)
< HCI Command: LE Set Advertising S.. (0x08|0x0035) plen 7  #39 [hci1] 1.890394
        Advertising handle: 0x00
        Advertising random address: D5:B6:CC:31:DB:3B (Static)
> HCI Event: Command Complete (0x0e) plen 4                 #40 [hci1] 1.890878
      LE Set Advertising Set Random Address (0x08|0x0035) ncmd 1
        Status: Success (0x00)
< HCI Command: LE Set Extended Adv.. (0x08|0x0037) plen 30  #41 [hci1] 1.910379
        Handle: 0x00
        Operation: Complete extended advertising data (0x03)
        Fragment preference: Minimize fragmentation (0x01)
        Data length: 0x1a
        Flags: 0x06
          LE General Discoverable Mode
          BR/EDR Not Supported
        Service Data: Common Audio (0x1853)
          Data: 01
        Service Data: Audio Stream Control (0x184e)
          Data: 014400400000
        Resolvable Set Identifier: 48-61-8E-0C-80-97
          Hash: 0x c8097
          Random: 0x48618e
> HCI Event: Command Complete (0x0e) plen 4                 #42 [hci1] 1.911136
      LE Set Extended Advertising Data (0x08|0x0037) ncmd 1
        Status: Success (0x00)
< HCI Command: LE Set Extended Adve.. (0x08|0x0039) plen 6  #43 [hci1] 1.930407
        Extended advertising: Enabled (0x01)
        Number of sets: 1 (0x01)
        Entry 0
          Handle: 0x00
          Duration: 0 ms (0x00)
          Max ext adv events: 0
> HCI Event: Command Complete (0x0e) plen 4                 #44 [hci1] 1.930941
      LE Set Extended Advertising Enable (0x08|0x0039) ncmd 1
        Status: Success (0x00)
> HCI Event: LE Meta Event (0x3e) plen 31                   #45 [hci1] 3.703115
      LE Enhanced Connection Complete (0x0a)
        Status: Success (0x00)
        Handle: 2667
        Role: Peripheral (0x01)
        Peer address type: Public (0x00)
        Peer address: DF:A9:FF:F6:B1:1A (OUI DF-A9-FF)
        Local resolvable private address: 00:00:00:00:00:00 (Non-Resolvable)
        Peer resolvable private address: 00:00:00:00:00:00 (Non-Resolvable)
        Connection interval: 150.00 msec (0x0078)
        Connection latency: 0 (0x0000)
        Supervision timeout: 25120 msec (0x09d0)
        Central clock accuracy: 0x01
> HCI Event: LE Meta Event (0x3e) plen 6                    #46 [hci1] 3.703294
      LE Advertising Set Terminated (0x12)
        Status: Success (0x00)
        Handle: 0
        Connection handle: 2667
        Number of completed extended advertising events: 0
< HCI Command: LE Read Remote Used... (0x08|0x0016) plen 2  #47 [hci1] 3.711540
        Handle: 2667 Address: DF:A9:FF:F6:B1:1A (OUI DF-A9-FF)
< ACL Data TX: Handle 2667 flags 0x00 dlen 7                #48 [hci1] 3.711573
      ATT: Exchange MTU Request (0x02) len 2
        Client RX MTU: 251
> HCI Event: Command Status (0x0f) plen 4                   #49 [hci1] 3.712044
      LE Read Remote Used Features (0x08|0x0016) ncmd 1
        Status: Success (0x00)
> HCI Event: Number of Completed Packets (0x13) plen 5      #50 [hci1] 4.005121
        Num handles: 1
        Handle: 2667 Address: DF:A9:FF:F6:B1:1A (OUI DF-A9-FF)
        Count: 1
        #48: len 7 (0 Kb/s)
        Latency: 293 msec (293-293 msec ~293 msec)
< HCI Command: LE Remove Advertisin.. (0x08|0x003c) plen 1  #51 [hci1] 4.060832
        Handle: 0
> HCI Event: Command Complete (0x0e) plen 4                 #52 [hci1] 4.061291
      LE Remove Advertising Set (0x08|0x003c) ncmd 1
        Status: Success (0x00)
< HCI Command: LE Set Extended Adv.. (0x08|0x0036) plen 25  #53 [hci1] 4.070411
        Handle: 0x00
        Properties: 0x0001
          Connectable
        Min advertising interval: 100.000 msec (0x00a0)
        Max advertising interval: 150.000 msec (0x00f0)
        Channel map: 37, 38, 39 (0x07)
        Own address type: Random (0x01)
        Peer address type: Public (0x00)
        Peer address: 00:00:00:00:00:00 (OUI 00-00-00)
        Filter policy: Allow Scan Request from Any, Allow Connect Request from Any (0x00)
        TX power: Host has no preference (0x7f)
        Primary PHY: LE 1M (0x01)
        Secondary max skip: 0x00
        Secondary PHY: LE 2M (0x02)
        SID: 0x01
        Scan request notifications: Disabled (0x00)
> HCI Event: Command Complete (0x0e) plen 5                 #54 [hci1] 4.071144
      LE Set Extended Advertising Parameters (0x08|0x0036) ncmd 1
        Status: Success (0x00)
        TX power (selected): 0 dbm (0x00)
< HCI Command: LE Set Advertising S.. (0x08|0x0035) plen 7  #55 [hci1] 4.090456
        Advertising handle: 0x00
        Advertising random address: D5:B6:CC:31:DB:3B (Static)
> HCI Event: Command Complete (0x0e) plen 4                 #56 [hci1] 4.091008
      LE Set Advertising Set Random Address (0x08|0x0035) ncmd 1
        Status: Success (0x00)
< HCI Command: LE Set Extended Adv.. (0x08|0x0037) plen 22  #57 [hci1] 4.110424
        Handle: 0x00
        Operation: Complete extended advertising data (0x03)
        Fragment preference: Minimize fragmentation (0x01)
        Data length: 0x12
        Flags: 0x06
          LE General Discoverable Mode
          BR/EDR Not Supported
        Name (complete): Tester_F6B11A
> HCI Event: Command Complete (0x0e) plen 4                 #58 [hci1] 4.111102
      LE Set Extended Advertising Data (0x08|0x0037) ncmd 1
        Status: Success (0x00)
< HCI Command: LE Set Extended Adve.. (0x08|0x0039) plen 6  #59 [hci1] 4.130449
        Extended advertising: Enabled (0x01)
        Number of sets: 1 (0x01)
        Entry 0
          Handle: 0x00
          Duration: 0 ms (0x00)
          Max ext adv events: 0
> HCI Event: Command Complete (0x0e) plen 4                 #60 [hci1] 4.131123
      LE Set Extended Advertising Enable (0x08|0x0039) ncmd 1
        Status: Success (0x00)
> HCI Event: LE Meta Event (0x3e) plen 12                   #61 [hci1] 4.155541
      LE Read Remote Used Features (0x04)
        Status: Success (0x00)
        Handle: 2667 Address: DF:A9:FF:F6:B1:1A (OUI DF-A9-FF)
        Features: 0x2d 0x49 0x00 0xf7 0x67 0xd9 0x00 0x80
          LE Encryption
          Extended Reject Indication
          Peripheral-initiated Features Exchange
          LE Data Packet Length Extension
          LE 2M PHY
          LE Coded PHY
          Channel Selection Algorithm #2
          Periodic Advertising Sync Transfer - Sender
          Periodic Advertising Sync Transfer - Recipient
          Sleep Clock Accuracy Updates
          Connected Isochronous Stream - Central
          Connected Isochronous Stream - Peripheral
          Isochronous Broadcaster
          Synchronized Receiver
          Connected Isochronous Stream (Host Support)
          LE Power Control Request
          LE Power Control Request
          Connection Subrating
          Connection Subrating (Host Support)
          Unknown features (0x8000d90000000000)
> ACL Data RX: Handle 2667 flags 0x02 dlen 7                #62 [hci1] 4.905142
      ATT: Exchange MTU Request (0x02) len 2
        Client RX MTU: 64
> ACL Data RX: Handle 2667 flags 0x02 dlen 7                #63 [hci1] 4.905563
      ATT: Exchange MTU Response (0x03) len 2
        Server RX MTU: 64
< HCI Command: Host Number of Compl.. (0x03|0x0035) plen 5  #64 [hci1] 4.910939
        Num handles: 1
        Handle: 2667 Address: DF:A9:FF:F6:B1:1A (OUI DF-A9-FF)
        Count: 1
< ACL Data TX: Handle 2667 flags 0x00 dlen 7                #65 [hci1] 4.910957
      ATT: Exchange MTU Response (0x03) len 2
        Server RX MTU: 251
< HCI Command: Host Number of Compl.. (0x03|0x0035) plen 5  #66 [hci1] 4.911052
        Num handles: 1
        Handle: 2667 Address: DF:A9:FF:F6:B1:1A (OUI DF-A9-FF)
        Count: 1
> HCI Event: Number of Completed Packets (0x13) plen 5      #67 [hci1] 5.205154
        Num handles: 1
        Handle: 2667 Address: DF:A9:FF:F6:B1:1A (OUI DF-A9-FF)
        Count: 1
        #65: len 7 (0 Kb/s)
        Latency: 294 msec (293-294 msec ~293 msec)
> ACL Data RX: Handle 2667 flags 0x02 dlen 11               #68 [hci1] 7.155107
      SMP: Pairing Request (0x01) len 6
        IO capability: KeyboardDisplay (0x04)
        OOB data: Authentication data not present (0x00)
        Authentication requirement: Bonding, No MITM, SC, No Keypresses (0x09)
        Max encryption key size: 16
        Initiator key distribution: EncKey IdKey Sign (0x07)
        Responder key distribution: EncKey IdKey Sign (0x07)
< HCI Command: Host Number of Compl.. (0x03|0x0035) plen 5  #69 [hci1] 7.170953
        Num handles: 1
        Handle: 2667 Address: DF:A9:FF:F6:B1:1A (OUI DF-A9-FF)
        Count: 1
< ACL Data TX: Handle 2667 flags 0x00 dlen 11               #70 [hci1] 7.171040
      SMP: Pairing Response (0x02) len 6
        IO capability: NoInputNoOutput (0x03)
        OOB data: Authentication data not present (0x00)
        Authentication requirement: Bonding, No MITM, SC, No Keypresses (0x09)
        Max encryption key size: 16
        Initiator key distribution: IdKey (0x02)
        Responder key distribution: <none> (0x00)
> HCI Event: Number of Completed Packets (0x13) plen 5      #71 [hci1] 7.455225
        Num handles: 1
        Handle: 2667 Address: DF:A9:FF:F6:B1:1A (OUI DF-A9-FF)
        Count: 1
        #70: len 11 (0 Kb/s)
        Latency: 284 msec (284-294 msec ~289 msec)
> ACL Data RX: Handle 2667 flags 0x02 dlen 27               #72 [hci1] 7.455546
> ACL Data RX: Handle 2667 flags 0x01 dlen 27               #73 [hci1] 7.455986
> ACL Data RX: Handle 2667 flags 0x01 dlen 15               #74 [hci1] 7.456232
      SMP: Pairing Public Key (0x0c) len 64
        X: bfa26ea908c7c22f32d73246d81ac80d40409090ec7b0d3482f021191275b707
        Y: 4ce5f88ebed62debabca4ee72fbc251f6037dca594a570796fe5c190ce9add79
< HCI Command: Host Number of Compl.. (0x03|0x0035) plen 5  #75 [hci1] 7.471224
        Num handles: 1
        Handle: 2667 Address: DF:A9:FF:F6:B1:1A (OUI DF-A9-FF)
        Count: 1
< HCI Command: Host Number of Compl.. (0x03|0x0035) plen 5  #76 [hci1] 7.471274
        Num handles: 1
        Handle: 2667 Address: DF:A9:FF:F6:B1:1A (OUI DF-A9-FF)
        Count: 1
< HCI Command: Host Number of Compl.. (0x03|0x0035) plen 5  #77 [hci1] 7.471595
        Num handles: 1
        Handle: 2667 Address: DF:A9:FF:F6:B1:1A (OUI DF-A9-FF)
        Count: 1
< ACL Data TX: Handle 2667 flags 0x00 dlen 27               #78 [hci1] 7.471672
< ACL Data TX: Handle 2667 flags 0x01 dlen 27               #79 [hci1] 7.471699
< ACL Data TX: Handle 2667 flags 0x01 dlen 15               #80 [hci1] 7.471738
      SMP: Pairing Public Key (0x0c) len 64
        X: 98308440221e2d910f0e54b71e7ec652857aa9b5a0dc65028824cc19db1226e9
        Y: 67a4816bcb62efb21701e31fdb27561a6217575fb007a8bbdabe7e28b6f68482
> HCI Event: Number of Completed Packets (0x13) plen 5      #81 [hci1] 7.605486
        Num handles: 1
        Handle: 2667 Address: DF:A9:FF:F6:B1:1A (OUI DF-A9-FF)
        Count: 1
        #78: len 27 (1 Kb/s)
        Latency: 133 msec (133-294 msec ~211 msec)
> HCI Event: Number of Completed Packets (0x13) plen 5      #82 [hci1] 7.605991
        Num handles: 1
        Handle: 2667 Address: DF:A9:FF:F6:B1:1A (OUI DF-A9-FF)
        Count: 1
        #79: len 27 (1 Kb/s)
        Latency: 134 msec (133-294 msec ~172 msec)
< ACL Data TX: Handle 2667 flags 0x00 dlen 21               #83 [hci1] 7.610810
      SMP: Pairing Confirm (0x03) len 16
        Confim value: 248723811477d0ff652068c01bbe9b8c
> HCI Event: Number of Completed Packets (0x13) plen 5      #84 [hci1] 7.755015
        Num handles: 1
        Handle: 2667 Address: DF:A9:FF:F6:B1:1A (OUI DF-A9-FF)
        Count: 1
        #80: len 15 (0 Kb/s)
        Latency: 283 msec (133-294 msec ~228 msec)
> HCI Event: Number of Completed Packets (0x13) plen 5      #85 [hci1] 7.905135
        Num handles: 1
        Handle: 2667 Address: DF:A9:FF:F6:B1:1A (OUI DF-A9-FF)
        Count: 1
        #83: len 21 (0 Kb/s)
        Latency: 294 msec (133-294 msec ~261 msec)
> ACL Data RX: Handle 2667 flags 0x02 dlen 21               #86 [hci1] 7.905551
      SMP: Pairing Random (0x04) len 16
        Random value: 944827b90fdabb380000000000000000
< HCI Command: Host Number of Compl.. (0x03|0x0035) plen 5  #87 [hci1] 7.911120
        Num handles: 1
        Handle: 2667 Address: DF:A9:FF:F6:B1:1A (OUI DF-A9-FF)
        Count: 1
< ACL Data TX: Handle 2667 flags 0x00 dlen 21               #88 [hci1] 7.911223
      SMP: Pairing Random (0x04) len 16
        Random value: f966a694cbe26df70bb96773e6cc6f5d
> HCI Event: Number of Completed Packets (0x13) plen 5      #89 [hci1] 8.205068
        Num handles: 1
        Handle: 2667 Address: DF:A9:FF:F6:B1:1A (OUI DF-A9-FF)
        Count: 1
        #88: len 21 (0 Kb/s)
        Latency: 293 msec (133-294 msec ~277 msec)
> ACL Data RX: Handle 2667 flags 0x02 dlen 21               #90 [hci1] 8.355327
      SMP: Pairing DHKey Check (0x0d) len 16
        E: ecf4b0b5687c096dbd5c58815114b04b
< HCI Command: Host Number of Compl.. (0x03|0x0035) plen 5  #91 [hci1] 8.371378
        Num handles: 1
        Handle: 2667 Address: DF:A9:FF:F6:B1:1A (OUI DF-A9-FF)
        Count: 1
< ACL Data TX: Handle 2667 flags 0x00 dlen 21               #92 [hci1] 8.371468
      SMP: Pairing DHKey Check (0x0d) len 16
        E: 2f1cfab4fee77eedd8dbc630a7cd9922
> HCI Event: Number of Completed Packets (0x13) plen 5      #93 [hci1] 8.655055
        Num handles: 1
        Handle: 2667 Address: DF:A9:FF:F6:B1:1A (OUI DF-A9-FF)
        Count: 1
        #92: len 21 (0 Kb/s)
        Latency: 283 msec (133-294 msec ~280 msec)
> HCI Event: LE Meta Event (0x3e) plen 13                   #94 [hci1] 8.805582
      LE Long Term Key Request (0x05)
        Handle: 2667 Address: DF:A9:FF:F6:B1:1A (OUI DF-A9-FF)
        Random number: 0x0000000000000000
        Encrypted diversifier: 0x0000
< HCI Command: LE Long Term Key Re.. (0x08|0x001a) plen 18  #95 [hci1] 8.810679
        Handle: 2667 Address: DF:A9:FF:F6:B1:1A (OUI DF-A9-FF)
        Long term key: 648c6e41ceb3714e6e44987a5ab71c64
> HCI Event: Command Complete (0x0e) plen 6                 #96 [hci1] 8.811493
      LE Long Term Key Request Reply (0x08|0x001a) ncmd 1
        Status: Success (0x00)
        Handle: 2667 Address: DF:A9:FF:F6:B1:1A (OUI DF-A9-FF)
> HCI Event: Encryption Change (0x08) plen 4                #97 [hci1] 9.555233
        Status: Success (0x00)
        Handle: 2667 Address: DF:A9:FF:F6:B1:1A (OUI DF-A9-FF)
        Encryption: Enabled with AES-CCM (0x01)
> ACL Data RX: Handle 2667 flags 0x02 dlen 21               #98 [hci1] 9.705297
      SMP: Identity Information (0x08) len 16
        Identity resolving key: 4b5eef0cb85a725e7167e383d8ef5358
< HCI Command: Host Number of Compl.. (0x03|0x0035) plen 5  #99 [hci1] 9.711001
        Num handles: 1
        Handle: 2667 Address: DF:A9:FF:F6:B1:1A (OUI DF-A9-FF)
        Count: 1
> ACL Data RX: Handle 2667 flags 0x02 dlen 12             #100 [hci1] 10.005202
      SMP: Identity Address Information (0x09) len 7
        Address: DF:A9:FF:F6:B1:1A (OUI DF-A9-FF)
< HCI Command: LE Set Extended Ad.. (0x08|0x0039) plen 6  #101 [hci1] 10.010996
        Extended advertising: Disabled (0x00)
        Number of sets: 1 (0x01)
        Entry 0
          Handle: 0x00
          Duration: 0 ms (0x00)
          Max ext adv events: 0
> HCI Event: Command Complete (0x0e) plen 4               #102 [hci1] 10.011529
      LE Set Extended Advertising Enable (0x08|0x0039) ncmd 1
        Status: Success (0x00)
< HCI Command: LE Add Device To... (0x08|0x0027) plen 39  #103 [hci1] 10.030844
        Address type: Public (0x00)
        Address: DF:A9:FF:F6:B1:1A (OUI DF-A9-FF)
        Peer identity resolving key: 4b5eef0cb85a725e7167e383d8ef5358
        Local identity resolving key: 00000000000000000000000000000000
> HCI Event: Command Complete (0x0e) plen 4               #104 [hci1] 10.031803
      LE Add Device To Resolving List (0x08|0x0027) ncmd 1
        Status: Success (0x00)
< HCI Command: LE Set Privacy Mode (0x08|0x004e) plen 8   #105 [hci1] 10.050831
        Peer Identity address type: Public (0x00)
        Peer Identity address: DF:A9:FF:F6:B1:1A (OUI DF-A9-FF)
        Privacy Mode: Use Device Privacy (0x01)
> HCI Event: Command Complete (0x0e) plen 4               #106 [hci1] 10.051371
      LE Set Privacy Mode (0x08|0x004e) ncmd 1
        Status: Success (0x00)
< HCI Command: LE Set Address Res.. (0x08|0x002d) plen 1  #107 [hci1] 10.070790
        Address resolution: Enabled (0x01)
> HCI Event: Command Complete (0x0e) plen 4               #108 [hci1] 10.071335
      LE Set Address Resolution Enable (0x08|0x002d) ncmd 1
        Status: Success (0x00)
< HCI Command: LE Set Extended Ad.. (0x08|0x0039) plen 6  #109 [hci1] 10.090757
        Extended advertising: Enabled (0x01)
        Number of sets: 1 (0x01)
        Entry 0
          Handle: 0x00
          Duration: 0 ms (0x00)
          Max ext adv events: 0
> HCI Event: Command Complete (0x0e) plen 4               #110 [hci1] 10.091321
      LE Set Extended Advertising Enable (0x08|0x0039) ncmd 1
        Status: Success (0x00)
< HCI Command: Host Number of Com.. (0x03|0x0035) plen 5  #111 [hci1] 10.110691
        Num handles: 1
        Handle: 2667 Address: DF:A9:FF:F6:B1:1A (OUI DF-A9-FF)
        Count: 1
> ACL Data RX: Handle 2667 flags 0x02 dlen 13             #112 [hci1] 10.155295
      ATT: Find By Type Value Request (0x06) len 8
        Handle range: 0x0001-0xffff
        Attribute type: Primary Service (0x2800)
          UUID: Published Audio Capabilities (0x1850)
< HCI Command: Host Number of Com.. (0x03|0x0035) plen 5  #113 [hci1] 10.171207
        Num handles: 1
        Handle: 2667 Address: DF:A9:FF:F6:B1:1A (OUI DF-A9-FF)
        Count: 1
< ACL Data TX: Handle 2667 flags 0x00 dlen 9              #114 [hci1] 10.171325
      ATT: Find By Type Value Response (0x07) len 4
        Handle range: 0x003f-0x0051
> HCI Event: Number of Completed Packets (0x13) plen 5    #115 [hci1] 10.455112
        Num handles: 1
        Handle: 2667 Address: DF:A9:FF:F6:B1:1A (OUI DF-A9-FF)
        Count: 1
        #114: len 9 (0 Kb/s)
        Latency: 283 msec (133-294 msec ~282 msec)
> ACL Data RX: Handle 2667 flags 0x02 dlen 13             #116 [hci1] 10.455333
      ATT: Find By Type Value Request (0x06) len 8
        Handle range: 0x0052-0xffff
        Attribute type: Primary Service (0x2800)
          UUID: Published Audio Capabilities (0x1850)
< HCI Command: Host Number of Com.. (0x03|0x0035) plen 5  #117 [hci1] 10.471349
        Num handles: 1
        Handle: 2667 Address: DF:A9:FF:F6:B1:1A (OUI DF-A9-FF)
        Count: 1
< ACL Data TX: Handle 2667 flags 0x00 dlen 9              #118 [hci1] 10.471555
      ATT: Error Response (0x01) len 4
        Find By Type Value Request (0x06)
        Handle: 0x0052
        Error: Attribute Not Found (0x0a)
> HCI Event: Number of Completed Packets (0x13) plen 5    #119 [hci1] 10.755193
        Num handles: 1
        Handle: 2667 Address: DF:A9:FF:F6:B1:1A (OUI DF-A9-FF)
        Count: 1
        #118: len 9 (0 Kb/s)
        Latency: 283 msec (133-294 msec ~282 msec)
> ACL Data RX: Handle 2667 flags 0x02 dlen 11             #120 [hci1] 10.755314
      ATT: Read By Type Request (0x08) len 6
        Handle range: 0x003f-0x0051
        Attribute type: Characteristic (0x2803)
< HCI Command: Host Number of Com.. (0x03|0x0035) plen 5  #121 [hci1] 10.770871
        Num handles: 1
        Handle: 2667 Address: DF:A9:FF:F6:B1:1A (OUI DF-A9-FF)
        Count: 1
< ACL Data TX: Handle 2667 flags 0x00 dlen 27             #122 [hci1] 10.770919
< ACL Data TX: Handle 2667 flags 0x01 dlen 21             #123 [hci1] 10.770976
      ATT: Read By Type Response (0x09) len 43
        Attribute data length: 7
        Attribute data list: 6 entries
        Handle: 0x0040
        Value: 124100c92b
            Properties: 0x12
              Read (0x02)
              Notify (0x10)
            Value Handle: 0x0041
            Value UUID: Sink PAC (0x2bc9)
        Handle: 0x0043
        Value: 1a4400ca2b
            Properties: 0x1a
              Read (0x02)
              Write (0x08)
              Notify (0x10)
            Value Handle: 0x0044
            Value UUID: Sink Audio Locations (0x2bca)
        Handle: 0x0046
        Value: 124700cb2b
            Properties: 0x12
              Read (0x02)
              Notify (0x10)
            Value Handle: 0x0047
            Value UUID: Source PAC (0x2bcb)
        Handle: 0x0049
        Value: 1a4a00cc2b
            Properties: 0x1a
              Read (0x02)
              Write (0x08)
              Notify (0x10)
            Value Handle: 0x004a
            Value UUID: Source Audio Locations (0x2bcc)
        Handle: 0x004c
        Value: 124d00cd2b
            Properties: 0x12
              Read (0x02)
              Notify (0x10)
            Value Handle: 0x004d
            Value UUID: Available Audio Contexts (0x2bcd)
        Handle: 0x004f
        Value: 125000ce2b
            Properties: 0x12
              Read (0x02)
              Notify (0x10)
            Value Handle: 0x0050
            Value UUID: Supported Audio Contexts (0x2bce)
> HCI Event: Number of Completed Packets (0x13) plen 5    #124 [hci1] 10.905562
        Num handles: 1
        Handle: 2667 Address: DF:A9:FF:F6:B1:1A (OUI DF-A9-FF)
        Count: 1
        #122: len 27 (1 Kb/s)
        Latency: 134 msec (133-294 msec ~208 msec)
> HCI Event: Number of Completed Packets (0x13) plen 5    #125 [hci1] 11.055086
        Num handles: 1
        Handle: 2667 Address: DF:A9:FF:F6:B1:1A (OUI DF-A9-FF)
        Count: 1
        #123: len 21 (0 Kb/s)
        Latency: 284 msec (133-294 msec ~246 msec)
> ACL Data RX: Handle 2667 flags 0x02 dlen 11             #126 [hci1] 11.055341
      ATT: Read By Type Request (0x08) len 6
        Handle range: 0x0050-0x0051
        Attribute type: Characteristic (0x2803)
< HCI Command: Host Number of Com.. (0x03|0x0035) plen 5  #127 [hci1] 11.071160
        Num handles: 1
        Handle: 2667 Address: DF:A9:FF:F6:B1:1A (OUI DF-A9-FF)
        Count: 1
< ACL Data TX: Handle 2667 flags 0x00 dlen 9              #128 [hci1] 11.071387
      ATT: Error Response (0x01) len 4
        Read By Type Request (0x08)
        Handle: 0x0050
        Error: Attribute Not Found (0x0a)
> HCI Event: Number of Completed Packets (0x13) plen 5    #129 [hci1] 11.355097
        Num handles: 1
        Handle: 2667 Address: DF:A9:FF:F6:B1:1A (OUI DF-A9-FF)
        Count: 1
        #128: len 9 (0 Kb/s)
        Latency: 283 msec (133-294 msec ~265 msec)
> ACL Data RX: Handle 2667 flags 0x02 dlen 9              #130 [hci1] 11.355245
      ATT: Find Information Request (0x04) len 4
        Handle range: 0x0042-0x0042
< HCI Command: Host Number of Com.. (0x03|0x0035) plen 5  #131 [hci1] 11.371139
        Num handles: 1
        Handle: 2667 Address: DF:A9:FF:F6:B1:1A (OUI DF-A9-FF)
        Count: 1
< ACL Data TX: Handle 2667 flags 0x00 dlen 10             #132 [hci1] 11.371292
      ATT: Find Information Response (0x05) len 5
        Format: UUID-16 (0x01)
        Handle: 0x0042
        UUID: Client Characteristic Configuration (0x2902)
> HCI Event: Number of Completed Packets (0x13) plen 5    #133 [hci1] 11.655054
        Num handles: 1
        Handle: 2667 Address: DF:A9:FF:F6:B1:1A (OUI DF-A9-FF)
        Count: 1
        #132: len 10 (0 Kb/s)
        Latency: 283 msec (133-294 msec ~274 msec)
> ACL Data RX: Handle 2667 flags 0x02 dlen 9              #134 [hci1] 11.655219
      ATT: Find Information Request (0x04) len 4
        Handle range: 0x0045-0x0045
< HCI Command: Host Number of Com.. (0x03|0x0035) plen 5  #135 [hci1] 11.671089
        Num handles: 1
        Handle: 2667 Address: DF:A9:FF:F6:B1:1A (OUI DF-A9-FF)
        Count: 1
< ACL Data TX: Handle 2667 flags 0x00 dlen 10             #136 [hci1] 11.671181
      ATT: Find Information Response (0x05) len 5
        Format: UUID-16 (0x01)
        Handle: 0x0045
        UUID: Client Characteristic Configuration (0x2902)
> HCI Event: Number of Completed Packets (0x13) plen 5    #137 [hci1] 11.955096
        Num handles: 1
        Handle: 2667 Address: DF:A9:FF:F6:B1:1A (OUI DF-A9-FF)
        Count: 1
        #136: len 10 (0 Kb/s)
        Latency: 283 msec (133-294 msec ~279 msec)
> ACL Data RX: Handle 2667 flags 0x02 dlen 9              #138 [hci1] 11.955268
      ATT: Find Information Request (0x04) len 4
        Handle range: 0x0048-0x0048
< HCI Command: Host Number of Com.. (0x03|0x0035) plen 5  #139 [hci1] 11.971112
        Num handles: 1
        Handle: 2667 Address: DF:A9:FF:F6:B1:1A (OUI DF-A9-FF)
        Count: 1
< ACL Data TX: Handle 2667 flags 0x00 dlen 10             #140 [hci1] 11.971135
      ATT: Find Information Response (0x05) len 5
        Format: UUID-16 (0x01)
        Handle: 0x0048
        UUID: Client Characteristic Configuration (0x2902)
> HCI Event: Number of Completed Packets (0x13) plen 5    #141 [hci1] 12.255145
        Num handles: 1
        Handle: 2667 Address: DF:A9:FF:F6:B1:1A (OUI DF-A9-FF)
        Count: 1
        #140: len 10 (0 Kb/s)
        Latency: 284 msec (133-294 msec ~281 msec)
> ACL Data RX: Handle 2667 flags 0x02 dlen 9              #142 [hci1] 12.255257
      ATT: Find Information Request (0x04) len 4
        Handle range: 0x004b-0x004b
< HCI Command: Host Number of Com.. (0x03|0x0035) plen 5  #143 [hci1] 12.270778
        Num handles: 1
        Handle: 2667 Address: DF:A9:FF:F6:B1:1A (OUI DF-A9-FF)
        Count: 1
< ACL Data TX: Handle 2667 flags 0x00 dlen 10             #144 [hci1] 12.270827
      ATT: Find Information Response (0x05) len 5
        Format: UUID-16 (0x01)
        Handle: 0x004b
        UUID: Client Characteristic Configuration (0x2902)
> HCI Event: Number of Completed Packets (0x13) plen 5    #145 [hci1] 12.555005
        Num handles: 1
        Handle: 2667 Address: DF:A9:FF:F6:B1:1A (OUI DF-A9-FF)
        Count: 1
        #144: len 10 (0 Kb/s)
        Latency: 284 msec (133-294 msec ~282 msec)
> ACL Data RX: Handle 2667 flags 0x02 dlen 9              #146 [hci1] 12.555316
      ATT: Find Information Request (0x04) len 4
        Handle range: 0x004e-0x004e
< HCI Command: Host Number of Com.. (0x03|0x0035) plen 5  #147 [hci1] 12.570596
        Num handles: 1
        Handle: 2667 Address: DF:A9:FF:F6:B1:1A (OUI DF-A9-FF)
        Count: 1
< ACL Data TX: Handle 2667 flags 0x00 dlen 10             #148 [hci1] 12.570673
      ATT: Find Information Response (0x05) len 5
        Format: UUID-16 (0x01)
        Handle: 0x004e
        UUID: Client Characteristic Configuration (0x2902)
> HCI Event: Number of Completed Packets (0x13) plen 5    #149 [hci1] 12.855053
        Num handles: 1
        Handle: 2667 Address: DF:A9:FF:F6:B1:1A (OUI DF-A9-FF)
        Count: 1
        #148: len 10 (0 Kb/s)
        Latency: 284 msec (133-294 msec ~283 msec)
> ACL Data RX: Handle 2667 flags 0x02 dlen 9              #150 [hci1] 12.855264
      ATT: Find Information Request (0x04) len 4
        Handle range: 0x0051-0x0051
< HCI Command: Host Number of Com.. (0x03|0x0035) plen 5  #151 [hci1] 12.870723
        Num handles: 1
        Handle: 2667 Address: DF:A9:FF:F6:B1:1A (OUI DF-A9-FF)
        Count: 1
< ACL Data TX: Handle 2667 flags 0x00 dlen 10             #152 [hci1] 12.870800
      ATT: Find Information Response (0x05) len 5
        Format: UUID-16 (0x01)
        Handle: 0x0051
        UUID: Client Characteristic Configuration (0x2902)
> HCI Event: Number of Completed Packets (0x13) plen 5    #153 [hci1] 13.155077
        Num handles: 1
        Handle: 2667 Address: DF:A9:FF:F6:B1:1A (OUI DF-A9-FF)
        Count: 1
        #152: len 10 (0 Kb/s)
        Latency: 284 msec (133-294 msec ~283 msec)
> ACL Data RX: Handle 2667 flags 0x02 dlen 13             #154 [hci1] 13.155285
      ATT: Find By Type Value Request (0x06) len 8
        Handle range: 0x0001-0xffff
        Attribute type: Primary Service (0x2800)
          UUID: Audio Stream Control (0x184e)
< HCI Command: Host Number of Com.. (0x03|0x0035) plen 5  #155 [hci1] 13.171497
        Num handles: 1
        Handle: 2667 Address: DF:A9:FF:F6:B1:1A (OUI DF-A9-FF)
        Count: 1
< ACL Data TX: Handle 2667 flags 0x00 dlen 9              #156 [hci1] 13.171573
      ATT: Find By Type Value Response (0x07) len 4
        Handle range: 0x0052-0x0061
> HCI Event: Number of Completed Packets (0x13) plen 5    #157 [hci1] 13.455127
        Num handles: 1
        Handle: 2667 Address: DF:A9:FF:F6:B1:1A (OUI DF-A9-FF)
        Count: 1
        #156: len 9 (0 Kb/s)
        Latency: 283 msec (133-294 msec ~283 msec)
> ACL Data RX: Handle 2667 flags 0x02 dlen 13             #158 [hci1] 13.455338
      ATT: Find By Type Value Request (0x06) len 8
        Handle range: 0x0062-0xffff
        Attribute type: Primary Service (0x2800)
          UUID: Audio Stream Control (0x184e)
< HCI Command: Host Number of Com.. (0x03|0x0035) plen 5  #159 [hci1] 13.471374
        Num handles: 1
        Handle: 2667 Address: DF:A9:FF:F6:B1:1A (OUI DF-A9-FF)
        Count: 1
< ACL Data TX: Handle 2667 flags 0x00 dlen 9              #160 [hci1] 13.471570
      ATT: Error Response (0x01) len 4
        Find By Type Value Request (0x06)
        Handle: 0x0062
        Error: Attribute Not Found (0x0a)
> HCI Event: Number of Completed Packets (0x13) plen 5    #161 [hci1] 13.755073
        Num handles: 1
        Handle: 2667 Address: DF:A9:FF:F6:B1:1A (OUI DF-A9-FF)
        Count: 1
        #160: len 9 (0 Kb/s)
        Latency: 283 msec (133-294 msec ~283 msec)
> ACL Data RX: Handle 2667 flags 0x02 dlen 11             #162 [hci1] 13.755227
      ATT: Read By Type Request (0x08) len 6
        Handle range: 0x0052-0x0061
        Attribute type: Characteristic (0x2803)
< HCI Command: Host Number of Com.. (0x03|0x0035) plen 5  #163 [hci1] 13.771205
        Num handles: 1
        Handle: 2667 Address: DF:A9:FF:F6:B1:1A (OUI DF-A9-FF)
        Count: 1
< ACL Data TX: Handle 2667 flags 0x00 dlen 27             #164 [hci1] 13.771255
< ACL Data TX: Handle 2667 flags 0x01 dlen 14             #165 [hci1] 13.771320
      ATT: Read By Type Response (0x09) len 36
        Attribute data length: 7
        Attribute data list: 5 entries
        Handle: 0x0053
        Value: 1c5400c62b
            Properties: 0x1c
              Write Without Response (0x04)
              Write (0x08)
              Notify (0x10)
            Value Handle: 0x0054
            Value UUID: ASE Control Point (0x2bc6)
        Handle: 0x0056
        Value: 125700c42b
            Properties: 0x12
              Read (0x02)
              Notify (0x10)
            Value Handle: 0x0057
            Value UUID: Sink ASE (0x2bc4)
        Handle: 0x0059
        Value: 125a00c42b
            Properties: 0x12
              Read (0x02)
              Notify (0x10)
            Value Handle: 0x005a
            Value UUID: Sink ASE (0x2bc4)
        Handle: 0x005c
        Value: 125d00c52b
            Properties: 0x12
              Read (0x02)
              Notify (0x10)
            Value Handle: 0x005d
            Value UUID: Source ASE (0x2bc5)
        Handle: 0x005f
        Value: 126000c52b
            Properties: 0x12
              Read (0x02)
              Notify (0x10)
            Value Handle: 0x0060
            Value UUID: Source ASE (0x2bc5)
> HCI Event: Number of Completed Packets (0x13) plen 5    #166 [hci1] 13.905430
        Num handles: 1
        Handle: 2667 Address: DF:A9:FF:F6:B1:1A (OUI DF-A9-FF)
        Count: 1
        #164: len 27 (1 Kb/s)
        Latency: 134 msec (133-294 msec ~208 msec)
> HCI Event: Number of Completed Packets (0x13) plen 5    #167 [hci1] 14.055035
        Num handles: 1
        Handle: 2667 Address: DF:A9:FF:F6:B1:1A (OUI DF-A9-FF)
        Count: 1
        #165: len 14 (0 Kb/s)
        Latency: 283 msec (133-294 msec ~246 msec)
> ACL Data RX: Handle 2667 flags 0x02 dlen 11             #168 [hci1] 14.055337
      ATT: Read By Type Request (0x08) len 6
        Handle range: 0x0060-0x0061
        Attribute type: Characteristic (0x2803)
< HCI Command: Host Number of Com.. (0x03|0x0035) plen 5  #169 [hci1] 14.071104
        Num handles: 1
        Handle: 2667 Address: DF:A9:FF:F6:B1:1A (OUI DF-A9-FF)
        Count: 1
< ACL Data TX: Handle 2667 flags 0x00 dlen 9              #170 [hci1] 14.071262
      ATT: Error Response (0x01) len 4
        Read By Type Request (0x08)
        Handle: 0x0060
        Error: Attribute Not Found (0x0a)
> HCI Event: Number of Completed Packets (0x13) plen 5    #171 [hci1] 14.355017
        Num handles: 1
        Handle: 2667 Address: DF:A9:FF:F6:B1:1A (OUI DF-A9-FF)
        Count: 1
        #170: len 9 (0 Kb/s)
        Latency: 283 msec (133-294 msec ~265 msec)
> ACL Data RX: Handle 2667 flags 0x02 dlen 9              #172 [hci1] 14.355226
      ATT: Find Information Request (0x04) len 4
        Handle range: 0x0055-0x0055
< HCI Command: Host Number of Com.. (0x03|0x0035) plen 5  #173 [hci1] 14.371107
        Num handles: 1
        Handle: 2667 Address: DF:A9:FF:F6:B1:1A (OUI DF-A9-FF)
        Count: 1
< ACL Data TX: Handle 2667 flags 0x00 dlen 10             #174 [hci1] 14.371271
      ATT: Find Information Response (0x05) len 5
        Format: UUID-16 (0x01)
        Handle: 0x0055
        UUID: Client Characteristic Configuration (0x2902)
> HCI Event: Number of Completed Packets (0x13) plen 5    #175 [hci1] 14.654993
        Num handles: 1
        Handle: 2667 Address: DF:A9:FF:F6:B1:1A (OUI DF-A9-FF)
        Count: 1
        #174: len 10 (0 Kb/s)
        Latency: 283 msec (133-294 msec ~274 msec)
> ACL Data RX: Handle 2667 flags 0x02 dlen 9              #176 [hci1] 14.655234
      ATT: Find Information Request (0x04) len 4
        Handle range: 0x0058-0x0058
< HCI Command: Host Number of Com.. (0x03|0x0035) plen 5  #177 [hci1] 14.671142
        Num handles: 1
        Handle: 2667 Address: DF:A9:FF:F6:B1:1A (OUI DF-A9-FF)
        Count: 1
< ACL Data TX: Handle 2667 flags 0x00 dlen 10             #178 [hci1] 14.671300
      ATT: Find Information Response (0x05) len 5
        Format: UUID-16 (0x01)
        Handle: 0x0058
        UUID: Client Characteristic Configuration (0x2902)
> HCI Event: Number of Completed Packets (0x13) plen 5    #179 [hci1] 14.955040
        Num handles: 1
        Handle: 2667 Address: DF:A9:FF:F6:B1:1A (OUI DF-A9-FF)
        Count: 1
        #178: len 10 (0 Kb/s)
        Latency: 283 msec (133-294 msec ~279 msec)
> ACL Data RX: Handle 2667 flags 0x02 dlen 9              #180 [hci1] 14.955300
      ATT: Find Information Request (0x04) len 4
        Handle range: 0x005b-0x005b
< HCI Command: Host Number of Com.. (0x03|0x0035) plen 5  #181 [hci1] 14.971100
        Num handles: 1
        Handle: 2667 Address: DF:A9:FF:F6:B1:1A (OUI DF-A9-FF)
        Count: 1
< ACL Data TX: Handle 2667 flags 0x00 dlen 10             #182 [hci1] 14.971277
      ATT: Find Information Response (0x05) len 5
        Format: UUID-16 (0x01)
        Handle: 0x005b
        UUID: Client Characteristic Configuration (0x2902)
> HCI Event: Number of Completed Packets (0x13) plen 5    #183 [hci1] 15.255120
        Num handles: 1
        Handle: 2667 Address: DF:A9:FF:F6:B1:1A (OUI DF-A9-FF)
        Count: 1
        #182: len 10 (0 Kb/s)
        Latency: 283 msec (133-294 msec ~281 msec)
> ACL Data RX: Handle 2667 flags 0x02 dlen 9              #184 [hci1] 15.255247
      ATT: Find Information Request (0x04) len 4
        Handle range: 0x005e-0x005e
< HCI Command: Host Number of Com.. (0x03|0x0035) plen 5  #185 [hci1] 15.271106
        Num handles: 1
        Handle: 2667 Address: DF:A9:FF:F6:B1:1A (OUI DF-A9-FF)
        Count: 1
< ACL Data TX: Handle 2667 flags 0x00 dlen 10             #186 [hci1] 15.271205
      ATT: Find Information Response (0x05) len 5
        Format: UUID-16 (0x01)
        Handle: 0x005e
        UUID: Client Characteristic Configuration (0x2902)
> HCI Event: Number of Completed Packets (0x13) plen 5    #187 [hci1] 15.555036
        Num handles: 1
        Handle: 2667 Address: DF:A9:FF:F6:B1:1A (OUI DF-A9-FF)
        Count: 1
        #186: len 10 (0 Kb/s)
        Latency: 283 msec (133-294 msec ~282 msec)
> ACL Data RX: Handle 2667 flags 0x02 dlen 9              #188 [hci1] 15.555283
      ATT: Find Information Request (0x04) len 4
        Handle range: 0x0061-0x0061
< HCI Command: Host Number of Com.. (0x03|0x0035) plen 5  #189 [hci1] 15.571133
        Num handles: 1
        Handle: 2667 Address: DF:A9:FF:F6:B1:1A (OUI DF-A9-FF)
        Count: 1
< ACL Data TX: Handle 2667 flags 0x00 dlen 10             #190 [hci1] 15.571184
      ATT: Find Information Response (0x05) len 5
        Format: UUID-16 (0x01)
        Handle: 0x0061
        UUID: Client Characteristic Configuration (0x2902)
> HCI Event: Number of Completed Packets (0x13) plen 5    #191 [hci1] 15.855109
        Num handles: 1
        Handle: 2667 Address: DF:A9:FF:F6:B1:1A (OUI DF-A9-FF)
        Count: 1
        #190: len 10 (0 Kb/s)
        Latency: 283 msec (133-294 msec ~283 msec)
> ACL Data RX: Handle 2667 flags 0x02 dlen 13             #192 [hci1] 15.855239
      ATT: Find By Type Value Request (0x06) len 8
        Handle range: 0x0001-0xffff
        Attribute type: Primary Service (0x2800)
          UUID: Hearing Aid (0x1854)
< HCI Command: Host Number of Com.. (0x03|0x0035) plen 5  #193 [hci1] 15.871578
        Num handles: 1
        Handle: 2667 Address: DF:A9:FF:F6:B1:1A (OUI DF-A9-FF)
        Count: 1
< ACL Data TX: Handle 2667 flags 0x00 dlen 9              #194 [hci1] 15.871660
      ATT: Find By Type Value Response (0x07) len 4
        Handle range: 0x00b5-0x00bd
> HCI Event: Number of Completed Packets (0x13) plen 5    #195 [hci1] 16.155005
        Num handles: 1
        Handle: 2667 Address: DF:A9:FF:F6:B1:1A (OUI DF-A9-FF)
        Count: 1
        #194: len 9 (0 Kb/s)
        Latency: 283 msec (133-294 msec ~283 msec)
> ACL Data RX: Handle 2667 flags 0x02 dlen 13             #196 [hci1] 16.155287
      ATT: Find By Type Value Request (0x06) len 8
        Handle range: 0x00be-0xffff
        Attribute type: Primary Service (0x2800)
          UUID: Hearing Aid (0x1854)
< HCI Command: Host Number of Com.. (0x03|0x0035) plen 5  #197 [hci1] 16.171251
        Num handles: 1
        Handle: 2667 Address: DF:A9:FF:F6:B1:1A (OUI DF-A9-FF)
        Count: 1
< ACL Data TX: Handle 2667 flags 0x00 dlen 9              #198 [hci1] 16.171428
      ATT: Error Response (0x01) len 4
        Find By Type Value Request (0x06)
        Handle: 0x00be
        Error: Attribute Not Found (0x0a)
> HCI Event: Number of Completed Packets (0x13) plen 5    #199 [hci1] 16.455064
        Num handles: 1
        Handle: 2667 Address: DF:A9:FF:F6:B1:1A (OUI DF-A9-FF)
        Count: 1
        #198: len 9 (0 Kb/s)
        Latency: 283 msec (133-294 msec ~283 msec)
> ACL Data RX: Handle 2667 flags 0x02 dlen 11             #200 [hci1] 16.455324
      ATT: Read By Type Request (0x08) len 6
        Handle range: 0x00b5-0x00bd
        Attribute type: Characteristic (0x2803)
< HCI Command: Host Number of Com.. (0x03|0x0035) plen 5  #201 [hci1] 16.471202
        Num handles: 1
        Handle: 2667 Address: DF:A9:FF:F6:B1:1A (OUI DF-A9-FF)
        Count: 1
< ACL Data TX: Handle 2667 flags 0x00 dlen 27             #202 [hci1] 16.471305
      ATT: Read By Type Response (0x09) len 22
        Attribute data length: 7
        Attribute data list: 3 entries
        Handle: 0x00b6
        Value: 02b700da2b
            Properties: 0x02
              Read (0x02)
            Value Handle: 0x00b7
            Value UUID: Hearing Aid Features (0x2bda)
        Handle: 0x00b8
        Value: 28b900db2b
            Properties: 0x28
              Write (0x08)
              Indicate (0x20)
            Value Handle: 0x00b9
            Value UUID: Hearing Aid Preset Control Point (0x2bdb)
        Handle: 0x00bb
        Value: 12bc00dc2b
            Properties: 0x12
              Read (0x02)
              Notify (0x10)
            Value Handle: 0x00bc
            Value UUID: Active Preset Index (0x2bdc)
> HCI Event: Number of Completed Packets (0x13) plen 5    #203 [hci1] 16.755074
        Num handles: 1
        Handle: 2667 Address: DF:A9:FF:F6:B1:1A (OUI DF-A9-FF)
        Count: 1
        #202: len 27 (0 Kb/s)
        Latency: 283 msec (133-294 msec ~283 msec)
> ACL Data RX: Handle 2667 flags 0x02 dlen 11             #204 [hci1] 16.755259
      ATT: Read By Type Request (0x08) len 6
        Handle range: 0x00bc-0x00bd
        Attribute type: Characteristic (0x2803)
< HCI Command: Host Number of Com.. (0x03|0x0035) plen 5  #205 [hci1] 16.771228
        Num handles: 1
        Handle: 2667 Address: DF:A9:FF:F6:B1:1A (OUI DF-A9-FF)
        Count: 1
< ACL Data TX: Handle 2667 flags 0x00 dlen 9              #206 [hci1] 16.771742
      ATT: Error Response (0x01) len 4
        Read By Type Request (0x08)
        Handle: 0x00bc
        Error: Attribute Not Found (0x0a)
> HCI Event: Number of Completed Packets (0x13) plen 5    #207 [hci1] 17.055033
        Num handles: 1
        Handle: 2667 Address: DF:A9:FF:F6:B1:1A (OUI DF-A9-FF)
        Count: 1
        #206: len 9 (0 Kb/s)
        Latency: 283 msec (133-294 msec ~283 msec)
> ACL Data RX: Handle 2667 flags 0x02 dlen 9              #208 [hci1] 17.055259
      ATT: Find Information Request (0x04) len 4
        Handle range: 0x00ba-0x00ba
< HCI Command: Host Number of Com.. (0x03|0x0035) plen 5  #209 [hci1] 17.071211
        Num handles: 1
        Handle: 2667 Address: DF:A9:FF:F6:B1:1A (OUI DF-A9-FF)
        Count: 1
< ACL Data TX: Handle 2667 flags 0x00 dlen 10             #210 [hci1] 17.071259
      ATT: Find Information Response (0x05) len 5
        Format: UUID-16 (0x01)
        Handle: 0x00ba
        UUID: Client Characteristic Configuration (0x2902)
> HCI Event: Number of Completed Packets (0x13) plen 5    #211 [hci1] 17.355016
        Num handles: 1
        Handle: 2667 Address: DF:A9:FF:F6:B1:1A (OUI DF-A9-FF)
        Count: 1
        #210: len 10 (0 Kb/s)
        Latency: 283 msec (133-294 msec ~283 msec)
> ACL Data RX: Handle 2667 flags 0x02 dlen 9              #212 [hci1] 17.355222
      ATT: Find Information Request (0x04) len 4
        Handle range: 0x00bd-0x00bd
< HCI Command: Host Number of Com.. (0x03|0x0035) plen 5  #213 [hci1] 17.371285
        Num handles: 1
        Handle: 2667 Address: DF:A9:FF:F6:B1:1A (OUI DF-A9-FF)
        Count: 1
< ACL Data TX: Handle 2667 flags 0x00 dlen 10             #214 [hci1] 17.371373
      ATT: Find Information Response (0x05) len 5
        Format: UUID-16 (0x01)
        Handle: 0x00bd
        UUID: Client Characteristic Configuration (0x2902)
> HCI Event: Number of Completed Packets (0x13) plen 5    #215 [hci1] 17.655029
        Num handles: 1
        Handle: 2667 Address: DF:A9:FF:F6:B1:1A (OUI DF-A9-FF)
        Count: 1
        #214: len 10 (0 Kb/s)
        Latency: 283 msec (133-294 msec ~283 msec)
> ACL Data RX: Handle 2667 flags 0x02 dlen 13             #216 [hci1] 17.655215
      ATT: Find By Type Value Request (0x06) len 8
        Handle range: 0x0001-0xffff
        Attribute type: Primary Service (0x2800)
          UUID: Hearing Aid (0x1854)
< HCI Command: Host Number of Com.. (0x03|0x0035) plen 5  #217 [hci1] 17.671515
        Num handles: 1
        Handle: 2667 Address: DF:A9:FF:F6:B1:1A (OUI DF-A9-FF)
        Count: 1
< ACL Data TX: Handle 2667 flags 0x00 dlen 9              #218 [hci1] 17.671628
      ATT: Find By Type Value Response (0x07) len 4
        Handle range: 0x00b5-0x00bd
> HCI Event: Number of Completed Packets (0x13) plen 5    #219 [hci1] 17.954988
        Num handles: 1
        Handle: 2667 Address: DF:A9:FF:F6:B1:1A (OUI DF-A9-FF)
        Count: 1
        #218: len 9 (0 Kb/s)
        Latency: 283 msec (133-294 msec ~283 msec)
> ACL Data RX: Handle 2667 flags 0x02 dlen 13             #220 [hci1] 17.955233
      ATT: Find By Type Value Request (0x06) len 8
        Handle range: 0x00be-0xffff
        Attribute type: Primary Service (0x2800)
          UUID: Hearing Aid (0x1854)
< HCI Command: Host Number of Com.. (0x03|0x0035) plen 5  #221 [hci1] 17.970673
        Num handles: 1
        Handle: 2667 Address: DF:A9:FF:F6:B1:1A (OUI DF-A9-FF)
        Count: 1
< ACL Data TX: Handle 2667 flags 0x00 dlen 9              #222 [hci1] 17.970774
      ATT: Error Response (0x01) len 4
        Find By Type Value Request (0x06)
        Handle: 0x00be
        Error: Attribute Not Found (0x0a)
> HCI Event: Number of Completed Packets (0x13) plen 5    #223 [hci1] 18.255021
        Num handles: 1
        Handle: 2667 Address: DF:A9:FF:F6:B1:1A (OUI DF-A9-FF)
        Count: 1
        #222: len 9 (0 Kb/s)
        Latency: 284 msec (133-294 msec ~283 msec)
> ACL Data RX: Handle 2667 flags 0x02 dlen 11             #224 [hci1] 18.255156
      ATT: Read By Type Request (0x08) len 6
        Handle range: 0x00b5-0x00bd
        Attribute type: Characteristic (0x2803)
< HCI Command: Host Number of Com.. (0x03|0x0035) plen 5  #225 [hci1] 18.271162
        Num handles: 1
        Handle: 2667 Address: DF:A9:FF:F6:B1:1A (OUI DF-A9-FF)
        Count: 1
< ACL Data TX: Handle 2667 flags 0x00 dlen 27             #226 [hci1] 18.271352
      ATT: Read By Type Response (0x09) len 22
        Attribute data length: 7
        Attribute data list: 3 entries
        Handle: 0x00b6
        Value: 02b700da2b
            Properties: 0x02
              Read (0x02)
            Value Handle: 0x00b7
            Value UUID: Hearing Aid Features (0x2bda)
        Handle: 0x00b8
        Value: 28b900db2b
            Properties: 0x28
              Write (0x08)
              Indicate (0x20)
            Value Handle: 0x00b9
            Value UUID: Hearing Aid Preset Control Point (0x2bdb)
        Handle: 0x00bb
        Value: 12bc00dc2b
            Properties: 0x12
              Read (0x02)
              Notify (0x10)
            Value Handle: 0x00bc
            Value UUID: Active Preset Index (0x2bdc)
> HCI Event: Number of Completed Packets (0x13) plen 5    #227 [hci1] 18.554997
        Num handles: 1
        Handle: 2667 Address: DF:A9:FF:F6:B1:1A (OUI DF-A9-FF)
        Count: 1
        #226: len 27 (0 Kb/s)
        Latency: 283 msec (133-294 msec ~283 msec)
> ACL Data RX: Handle 2667 flags 0x02 dlen 11             #228 [hci1] 18.555202
      ATT: Read By Type Request (0x08) len 6
        Handle range: 0x00bc-0x00bd
        Attribute type: Characteristic (0x2803)
< HCI Command: Host Number of Com.. (0x03|0x0035) plen 5  #229 [hci1] 18.571171
        Num handles: 1
        Handle: 2667 Address: DF:A9:FF:F6:B1:1A (OUI DF-A9-FF)
        Count: 1
< ACL Data TX: Handle 2667 flags 0x00 dlen 9              #230 [hci1] 18.571238
      ATT: Error Response (0x01) len 4
        Read By Type Request (0x08)
        Handle: 0x00bc
        Error: Attribute Not Found (0x0a)
> HCI Event: Number of Completed Packets (0x13) plen 5    #231 [hci1] 18.855018
        Num handles: 1
        Handle: 2667 Address: DF:A9:FF:F6:B1:1A (OUI DF-A9-FF)
        Count: 1
        #230: len 9 (0 Kb/s)
        Latency: 283 msec (133-294 msec ~283 msec)
> ACL Data RX: Handle 2667 flags 0x02 dlen 9              #232 [hci1] 18.855247
      ATT: Find Information Request (0x04) len 4
        Handle range: 0x00ba-0x00ba
< HCI Command: Host Number of Com.. (0x03|0x0035) plen 5  #233 [hci1] 18.871169
        Num handles: 1
        Handle: 2667 Address: DF:A9:FF:F6:B1:1A (OUI DF-A9-FF)
        Count: 1
< ACL Data TX: Handle 2667 flags 0x00 dlen 10             #234 [hci1] 18.871204
      ATT: Find Information Response (0x05) len 5
        Format: UUID-16 (0x01)
        Handle: 0x00ba
        UUID: Client Characteristic Configuration (0x2902)
> HCI Event: Number of Completed Packets (0x13) plen 5    #235 [hci1] 19.155009
        Num handles: 1
        Handle: 2667 Address: DF:A9:FF:F6:B1:1A (OUI DF-A9-FF)
        Count: 1
        #234: len 10 (0 Kb/s)
        Latency: 283 msec (133-294 msec ~283 msec)
> ACL Data RX: Handle 2667 flags 0x02 dlen 9              #236 [hci1] 19.155178
      ATT: Find Information Request (0x04) len 4
        Handle range: 0x00bd-0x00bd
< HCI Command: Host Number of Com.. (0x03|0x0035) plen 5  #237 [hci1] 19.171208
        Num handles: 1
        Handle: 2667 Address: DF:A9:FF:F6:B1:1A (OUI DF-A9-FF)
        Count: 1
< ACL Data TX: Handle 2667 flags 0x00 dlen 10             #238 [hci1] 19.171282
      ATT: Find Information Response (0x05) len 5
        Format: UUID-16 (0x01)
        Handle: 0x00bd
        UUID: Client Characteristic Configuration (0x2902)
> HCI Event: Number of Completed Packets (0x13) plen 5    #239 [hci1] 19.454982
        Num handles: 1
        Handle: 2667 Address: DF:A9:FF:F6:B1:1A (OUI DF-A9-FF)
        Count: 1
        #238: len 10 (0 Kb/s)
        Latency: 283 msec (133-294 msec ~283 msec)
> ACL Data RX: Handle 2667 flags 0x02 dlen 9              #240 [hci1] 19.455195
      ATT: Write Request (0x12) len 4
        Handle: 0x004e
          Data: 0000
< HCI Command: Host Number of Com.. (0x03|0x0035) plen 5  #241 [hci1] 19.471206
        Num handles: 1
        Handle: 2667 Address: DF:A9:FF:F6:B1:1A (OUI DF-A9-FF)
        Count: 1
< ACL Data TX: Handle 2667 flags 0x00 dlen 5              #242 [hci1] 19.471323
      ATT: Write Response (0x13) len 0
> HCI Event: Number of Completed Packets (0x13) plen 5    #243 [hci1] 19.754950
        Num handles: 1
        Handle: 2667 Address: DF:A9:FF:F6:B1:1A (OUI DF-A9-FF)
        Count: 1
        #242: len 5 (0 Kb/s)
        Latency: 283 msec (133-294 msec ~283 msec)
> ACL Data RX: Handle 2667 flags 0x02 dlen 9              #244 [hci1] 19.755150
      ATT: Write Request (0x12) len 4
        Handle: 0x004e
          Data: 0100
< HCI Command: Host Number of Com.. (0x03|0x0035) plen 5  #245 [hci1] 19.771280
        Num handles: 1
        Handle: 2667 Address: DF:A9:FF:F6:B1:1A (OUI DF-A9-FF)
        Count: 1
< ACL Data TX: Handle 2667 flags 0x00 dlen 5              #246 [hci1] 19.771391
      ATT: Write Response (0x13) len 0
> HCI Event: Number of Completed Packets (0x13) plen 5    #247 [hci1] 20.054982
        Num handles: 1
        Handle: 2667 Address: DF:A9:FF:F6:B1:1A (OUI DF-A9-FF)
        Count: 1
        #246: len 5 (0 Kb/s)
        Latency: 283 msec (133-294 msec ~283 msec)
> ACL Data RX: Handle 2667 flags 0x02 dlen 9              #248 [hci1] 20.055271
      ATT: Write Request (0x12) len 4
        Handle: 0x0055
          Data: 0000
< HCI Command: Host Number of Com.. (0x03|0x0035) plen 5  #249 [hci1] 20.071335
        Num handles: 1
        Handle: 2667 Address: DF:A9:FF:F6:B1:1A (OUI DF-A9-FF)
        Count: 1
< ACL Data TX: Handle 2667 flags 0x00 dlen 5              #250 [hci1] 20.071487
      ATT: Write Response (0x13) len 0
> HCI Event: Number of Completed Packets (0x13) plen 5    #251 [hci1] 20.354958
        Num handles: 1
        Handle: 2667 Address: DF:A9:FF:F6:B1:1A (OUI DF-A9-FF)
        Count: 1
        #250: len 5 (0 Kb/s)
        Latency: 283 msec (133-294 msec ~283 msec)
> ACL Data RX: Handle 2667 flags 0x02 dlen 9              #252 [hci1] 20.355179
      ATT: Write Request (0x12) len 4
        Handle: 0x0055
          Data: 0100
< HCI Command: Host Number of Com.. (0x03|0x0035) plen 5  #253 [hci1] 20.371280
        Num handles: 1
        Handle: 2667 Address: DF:A9:FF:F6:B1:1A (OUI DF-A9-FF)
        Count: 1
< ACL Data TX: Handle 2667 flags 0x00 dlen 5              #254 [hci1] 20.371356
      ATT: Write Response (0x13) len 0
> HCI Event: Number of Completed Packets (0x13) plen 5    #255 [hci1] 20.654963
        Num handles: 1
        Handle: 2667 Address: DF:A9:FF:F6:B1:1A (OUI DF-A9-FF)
        Count: 1
        #254: len 5 (0 Kb/s)
        Latency: 283 msec (133-294 msec ~283 msec)
> ACL Data RX: Handle 2667 flags 0x02 dlen 9              #256 [hci1] 20.655153
      ATT: Write Request (0x12) len 4
        Handle: 0x0058
          Data: 0000
< HCI Command: Host Number of Com.. (0x03|0x0035) plen 5  #257 [hci1] 20.671295
        Num handles: 1
        Handle: 2667 Address: DF:A9:FF:F6:B1:1A (OUI DF-A9-FF)
        Count: 1
< ACL Data TX: Handle 2667 flags 0x00 dlen 5              #258 [hci1] 20.671376
      ATT: Write Response (0x13) len 0
> HCI Event: Number of Completed Packets (0x13) plen 5    #259 [hci1] 20.954999
        Num handles: 1
        Handle: 2667 Address: DF:A9:FF:F6:B1:1A (OUI DF-A9-FF)
        Count: 1
        #258: len 5 (0 Kb/s)
        Latency: 283 msec (133-294 msec ~283 msec)
> ACL Data RX: Handle 2667 flags 0x02 dlen 9              #260 [hci1] 20.955144
      ATT: Write Request (0x12) len 4
        Handle: 0x0058
          Data: 0100
< HCI Command: Host Number of Com.. (0x03|0x0035) plen 5  #261 [hci1] 20.971248
        Num handles: 1
        Handle: 2667 Address: DF:A9:FF:F6:B1:1A (OUI DF-A9-FF)
        Count: 1
< ACL Data TX: Handle 2667 flags 0x00 dlen 5              #262 [hci1] 20.971305
      ATT: Write Response (0x13) len 0
> HCI Event: Number of Completed Packets (0x13) plen 5    #263 [hci1] 21.254947
        Num handles: 1
        Handle: 2667 Address: DF:A9:FF:F6:B1:1A (OUI DF-A9-FF)
        Count: 1
        #262: len 5 (0 Kb/s)
        Latency: 283 msec (133-294 msec ~283 msec)
> ACL Data RX: Handle 2667 flags 0x02 dlen 9              #264 [hci1] 21.255144
      ATT: Write Request (0x12) len 4
        Handle: 0x005b
          Data: 0000
< HCI Command: Host Number of Com.. (0x03|0x0035) plen 5  #265 [hci1] 21.271307
        Num handles: 1
        Handle: 2667 Address: DF:A9:FF:F6:B1:1A (OUI DF-A9-FF)
        Count: 1
< ACL Data TX: Handle 2667 flags 0x00 dlen 5              #266 [hci1] 21.271383
      ATT: Write Response (0x13) len 0
> HCI Event: Number of Completed Packets (0x13) plen 5    #267 [hci1] 21.554963
        Num handles: 1
        Handle: 2667 Address: DF:A9:FF:F6:B1:1A (OUI DF-A9-FF)
        Count: 1
        #266: len 5 (0 Kb/s)
        Latency: 283 msec (133-294 msec ~283 msec)
> ACL Data RX: Handle 2667 flags 0x02 dlen 9              #268 [hci1] 21.555119
      ATT: Write Request (0x12) len 4
        Handle: 0x005b
          Data: 0100
< HCI Command: Host Number of Com.. (0x03|0x0035) plen 5  #269 [hci1] 21.571352
        Num handles: 1
        Handle: 2667 Address: DF:A9:FF:F6:B1:1A (OUI DF-A9-FF)
        Count: 1
< ACL Data TX: Handle 2667 flags 0x00 dlen 5              #270 [hci1] 21.571448
      ATT: Write Response (0x13) len 0
> HCI Event: Number of Completed Packets (0x13) plen 5    #271 [hci1] 21.854924
        Num handles: 1
        Handle: 2667 Address: DF:A9:FF:F6:B1:1A (OUI DF-A9-FF)
        Count: 1
        #270: len 5 (0 Kb/s)
        Latency: 283 msec (133-294 msec ~283 msec)
> ACL Data RX: Handle 2667 flags 0x02 dlen 9              #272 [hci1] 21.855161
      ATT: Write Request (0x12) len 4
        Handle: 0x005e
          Data: 0000
< HCI Command: Host Number of Com.. (0x03|0x0035) plen 5  #273 [hci1] 21.871315
        Num handles: 1
        Handle: 2667 Address: DF:A9:FF:F6:B1:1A (OUI DF-A9-FF)
        Count: 1
< ACL Data TX: Handle 2667 flags 0x00 dlen 5              #274 [hci1] 21.871425
      ATT: Write Response (0x13) len 0
> HCI Event: Number of Completed Packets (0x13) plen 5    #275 [hci1] 22.155025
        Num handles: 1
        Handle: 2667 Address: DF:A9:FF:F6:B1:1A (OUI DF-A9-FF)
        Count: 1
        #274: len 5 (0 Kb/s)
        Latency: 283 msec (133-294 msec ~283 msec)
> ACL Data RX: Handle 2667 flags 0x02 dlen 9              #276 [hci1] 22.155143
      ATT: Write Request (0x12) len 4
        Handle: 0x005e
          Data: 0100
< HCI Command: Host Number of Com.. (0x03|0x0035) plen 5  #277 [hci1] 22.171270
        Num handles: 1
        Handle: 2667 Address: DF:A9:FF:F6:B1:1A (OUI DF-A9-FF)
        Count: 1
< ACL Data TX: Handle 2667 flags 0x00 dlen 5              #278 [hci1] 22.171360
      ATT: Write Response (0x13) len 0
> HCI Event: Number of Completed Packets (0x13) plen 5    #279 [hci1] 22.454936
        Num handles: 1
        Handle: 2667 Address: DF:A9:FF:F6:B1:1A (OUI DF-A9-FF)
        Count: 1
        #278: len 5 (0 Kb/s)
        Latency: 283 msec (133-294 msec ~283 msec)
> ACL Data RX: Handle 2667 flags 0x02 dlen 9              #280 [hci1] 22.455207
      ATT: Write Request (0x12) len 4
        Handle: 0x0061
          Data: 0000
< HCI Command: Host Number of Com.. (0x03|0x0035) plen 5  #281 [hci1] 22.471293
        Num handles: 1
        Handle: 2667 Address: DF:A9:FF:F6:B1:1A (OUI DF-A9-FF)
        Count: 1
< ACL Data TX: Handle 2667 flags 0x00 dlen 5              #282 [hci1] 22.471374
      ATT: Write Response (0x13) len 0
> HCI Event: Number of Completed Packets (0x13) plen 5    #283 [hci1] 22.754897
        Num handles: 1
        Handle: 2667 Address: DF:A9:FF:F6:B1:1A (OUI DF-A9-FF)
        Count: 1
        #282: len 5 (0 Kb/s)
        Latency: 283 msec (133-294 msec ~283 msec)
> ACL Data RX: Handle 2667 flags 0x02 dlen 9              #284 [hci1] 22.755117
      ATT: Write Request (0x12) len 4
        Handle: 0x0061
          Data: 0100
< HCI Command: Host Number of Com.. (0x03|0x0035) plen 5  #285 [hci1] 22.771271
        Num handles: 1
        Handle: 2667 Address: DF:A9:FF:F6:B1:1A (OUI DF-A9-FF)
        Count: 1
< ACL Data TX: Handle 2667 flags 0x00 dlen 5              #286 [hci1] 22.771321
      ATT: Write Response (0x13) len 0
> HCI Event: Number of Completed Packets (0x13) plen 5    #287 [hci1] 23.055004
        Num handles: 1
        Handle: 2667 Address: DF:A9:FF:F6:B1:1A (OUI DF-A9-FF)
        Count: 1
        #286: len 5 (0 Kb/s)
        Latency: 283 msec (133-294 msec ~283 msec)
> ACL Data RX: Handle 2667 flags 0x02 dlen 7              #288 [hci1] 23.055088
      ATT: Read Request (0x0a) len 2
        Handle: 0x0057
< HCI Command: Host Number of Com.. (0x03|0x0035) plen 5  #289 [hci1] 23.071317
        Num handles: 1
        Handle: 2667 Address: DF:A9:FF:F6:B1:1A (OUI DF-A9-FF)
        Count: 1
< ACL Data TX: Handle 2667 flags 0x00 dlen 7              #290 [hci1] 23.071424
      ATT: Read Response (0x0b) len 2
> HCI Event: Number of Completed Packets (0x13) plen 5    #291 [hci1] 23.355005
        Num handles: 1
        Handle: 2667 Address: DF:A9:FF:F6:B1:1A (OUI DF-A9-FF)
        Count: 1
        #290: len 7 (0 Kb/s)
        Latency: 283 msec (133-294 msec ~283 msec)
> ACL Data RX: Handle 2667 flags 0x02 dlen 7              #292 [hci1] 23.355064
      ATT: Read Request (0x0a) len 2
        Handle: 0x005a
< HCI Command: Host Number of Com.. (0x03|0x0035) plen 5  #293 [hci1] 23.371280
        Num handles: 1
        Handle: 2667 Address: DF:A9:FF:F6:B1:1A (OUI DF-A9-FF)
        Count: 1
< ACL Data TX: Handle 2667 flags 0x00 dlen 7              #294 [hci1] 23.371391
      ATT: Read Response (0x0b) len 2
> HCI Event: Number of Completed Packets (0x13) plen 5    #295 [hci1] 23.654940
        Num handles: 1
        Handle: 2667 Address: DF:A9:FF:F6:B1:1A (OUI DF-A9-FF)
        Count: 1
        #294: len 7 (0 Kb/s)
        Latency: 283 msec (133-294 msec ~283 msec)
> ACL Data RX: Handle 2667 flags 0x02 dlen 7              #296 [hci1] 23.655076
      ATT: Read Request (0x0a) len 2
        Handle: 0x005d
< HCI Command: Host Number of Com.. (0x03|0x0035) plen 5  #297 [hci1] 23.671311
        Num handles: 1
        Handle: 2667 Address: DF:A9:FF:F6:B1:1A (OUI DF-A9-FF)
        Count: 1
< ACL Data TX: Handle 2667 flags 0x00 dlen 7              #298 [hci1] 23.671400
      ATT: Read Response (0x0b) len 2
> HCI Event: Number of Completed Packets (0x13) plen 5    #299 [hci1] 23.954857
        Num handles: 1
        Handle: 2667 Address: DF:A9:FF:F6:B1:1A (OUI DF-A9-FF)
        Count: 1
        #298: len 7 (0 Kb/s)
        Latency: 283 msec (133-294 msec ~283 msec)
> ACL Data RX: Handle 2667 flags 0x02 dlen 7              #300 [hci1] 23.955064
      ATT: Read Request (0x0a) len 2
        Handle: 0x0060
< HCI Command: Host Number of Com.. (0x03|0x0035) plen 5  #301 [hci1] 23.971325
        Num handles: 1
        Handle: 2667 Address: DF:A9:FF:F6:B1:1A (OUI DF-A9-FF)
        Count: 1
< ACL Data TX: Handle 2667 flags 0x00 dlen 7              #302 [hci1] 23.971435
      ATT: Read Response (0x0b) len 2
> HCI Event: Number of Completed Packets (0x13) plen 5    #303 [hci1] 24.254866
        Num handles: 1
        Handle: 2667 Address: DF:A9:FF:F6:B1:1A (OUI DF-A9-FF)
        Count: 1
        #302: len 7 (0 Kb/s)
        Latency: 283 msec (133-294 msec ~283 msec)
> ACL Data RX: Handle 2667 flags 0x02 dlen 7              #304 [hci1] 24.255087
      ATT: Read Request (0x0a) len 2
        Handle: 0x0044
< HCI Command: Host Number of Com.. (0x03|0x0035) plen 5  #305 [hci1] 24.271290
        Num handles: 1
        Handle: 2667 Address: DF:A9:FF:F6:B1:1A (OUI DF-A9-FF)
        Count: 1
< ACL Data TX: Handle 2667 flags 0x00 dlen 9              #306 [hci1] 24.271316
      ATT: Read Response (0x0b) len 4
> HCI Event: Number of Completed Packets (0x13) plen 5    #307 [hci1] 24.554903
        Num handles: 1
        Handle: 2667 Address: DF:A9:FF:F6:B1:1A (OUI DF-A9-FF)
        Count: 1
        #306: len 9 (0 Kb/s)
        Latency: 283 msec (133-294 msec ~283 msec)
> ACL Data RX: Handle 2667 flags 0x02 dlen 7              #308 [hci1] 24.555048
      ATT: Read Request (0x0a) len 2
        Handle: 0x0041
< HCI Command: Host Number of Com.. (0x03|0x0035) plen 5  #309 [hci1] 24.571301
        Num handles: 1
        Handle: 2667 Address: DF:A9:FF:F6:B1:1A (OUI DF-A9-FF)
        Count: 1
< ACL Data TX: Handle 2667 flags 0x00 dlen 27             #310 [hci1] 24.571346
< ACL Data TX: Handle 2667 flags 0x01 dlen 27             #311 [hci1] 24.571425
< ACL Data TX: Handle 2667 flags 0x01 dlen 12             #312 [hci1] 24.571443
      ATT: Read Response (0x0b) len 61
> HCI Event: Number of Completed Packets (0x13) plen 5    #313 [hci1] 24.705289
        Num handles: 1
        Handle: 2667 Address: DF:A9:FF:F6:B1:1A (OUI DF-A9-FF)
        Count: 1
        #310: len 27 (1 Kb/s)
        Latency: 133 msec (133-294 msec ~208 msec)
> HCI Event: Number of Completed Packets (0x13) plen 5    #314 [hci1] 24.705885
        Num handles: 1
        Handle: 2667 Address: DF:A9:FF:F6:B1:1A (OUI DF-A9-FF)
        Count: 1
        #311: len 27 (1 Kb/s)
        Latency: 134 msec (133-294 msec ~171 msec)
> HCI Event: Number of Completed Packets (0x13) plen 5    #315 [hci1] 24.854951
        Num handles: 1
        Handle: 2667 Address: DF:A9:FF:F6:B1:1A (OUI DF-A9-FF)
        Count: 1
        #312: len 12 (0 Kb/s)
        Latency: 283 msec (133-294 msec ~227 msec)
> ACL Data RX: Handle 2667 flags 0x02 dlen 7              #316 [hci1] 24.855032
      ATT: Read Request (0x0a) len 2
        Handle: 0x004d
< HCI Command: Host Number of Com.. (0x03|0x0035) plen 5  #317 [hci1] 24.870979
        Num handles: 1
        Handle: 2667 Address: DF:A9:FF:F6:B1:1A (OUI DF-A9-FF)
        Count: 1
< ACL Data TX: Handle 2667 flags 0x00 dlen 9              #318 [hci1] 24.870989
      ATT: Read Response (0x0b) len 4
> HCI Event: Number of Completed Packets (0x13) plen 5    #319 [hci1] 25.154862
        Num handles: 1
        Handle: 2667 Address: DF:A9:FF:F6:B1:1A (OUI DF-A9-FF)
        Count: 1
        #318: len 9 (0 Kb/s)
        Latency: 283 msec (133-294 msec ~255 msec)
> ACL Data RX: Handle 2667 flags 0x02 dlen 7              #320 [hci1] 25.155085
      ATT: Read Request (0x0a) len 2
        Handle: 0x0050
< HCI Command: Host Number of Com.. (0x03|0x0035) plen 5  #321 [hci1] 25.171345
        Num handles: 1
        Handle: 2667 Address: DF:A9:FF:F6:B1:1A (OUI DF-A9-FF)
        Count: 1
< ACL Data TX: Handle 2667 flags 0x00 dlen 9              #322 [hci1] 25.171444
      ATT: Read Response (0x0b) len 4
> HCI Event: Number of Completed Packets (0x13) plen 5    #323 [hci1] 25.454960
        Num handles: 1
        Handle: 2667 Address: DF:A9:FF:F6:B1:1A (OUI DF-A9-FF)
        Count: 1
        #322: len 9 (0 Kb/s)
        Latency: 283 msec (133-294 msec ~269 msec)
> ACL Data RX: Handle 2667 flags 0x02 dlen 9              #324 [hci1] 25.455089
      ATT: Write Request (0x12) len 4
        Handle: 0x00ba
          Data: 0000
< HCI Command: Host Number of Com.. (0x03|0x0035) plen 5  #325 [hci1] 25.471229
        Num handles: 1
        Handle: 2667 Address: DF:A9:FF:F6:B1:1A (OUI DF-A9-FF)
        Count: 1
< ACL Data TX: Handle 2667 flags 0x00 dlen 5              #326 [hci1] 25.471350
      ATT: Write Response (0x13) len 0
> HCI Event: Number of Completed Packets (0x13) plen 5    #327 [hci1] 25.754934
        Num handles: 1
        Handle: 2667 Address: DF:A9:FF:F6:B1:1A (OUI DF-A9-FF)
        Count: 1
        #326: len 5 (0 Kb/s)
        Latency: 283 msec (133-294 msec ~276 msec)
> ACL Data RX: Handle 2667 flags 0x02 dlen 9              #328 [hci1] 25.755105
      ATT: Write Request (0x12) len 4
        Handle: 0x00ba
          Data: 0200
< HCI Command: Host Number of Com.. (0x03|0x0035) plen 5  #329 [hci1] 25.770970
        Num handles: 1
        Handle: 2667 Address: DF:A9:FF:F6:B1:1A (OUI DF-A9-FF)
        Count: 1
< ACL Data TX: Handle 2667 flags 0x00 dlen 5              #330 [hci1] 25.770979
      ATT: Write Response (0x13) len 0
> HCI Event: Number of Completed Packets (0x13) plen 5    #331 [hci1] 26.054869
        Num handles: 1
        Handle: 2667 Address: DF:A9:FF:F6:B1:1A (OUI DF-A9-FF)
        Count: 1
        #330: len 5 (0 Kb/s)
        Latency: 283 msec (133-294 msec ~280 msec)
> ACL Data RX: Handle 2667 flags 0x02 dlen 9              #332 [hci1] 26.055064
      ATT: Write Request (0x12) len 4
        Handle: 0x00bd
          Data: 0000
< HCI Command: Host Number of Com.. (0x03|0x0035) plen 5  #333 [hci1] 26.071354
        Num handles: 1
        Handle: 2667 Address: DF:A9:FF:F6:B1:1A (OUI DF-A9-FF)
        Count: 1
< ACL Data TX: Handle 2667 flags 0x00 dlen 5              #334 [hci1] 26.071467
      ATT: Write Response (0x13) len 0
> HCI Event: Number of Completed Packets (0x13) plen 5    #335 [hci1] 26.354964
        Num handles: 1
        Handle: 2667 Address: DF:A9:FF:F6:B1:1A (OUI DF-A9-FF)
        Count: 1
        #334: len 5 (0 Kb/s)
        Latency: 283 msec (133-294 msec ~281 msec)
> ACL Data RX: Handle 2667 flags 0x02 dlen 9              #336 [hci1] 26.355101
      ATT: Write Request (0x12) len 4
        Handle: 0x00bd
          Data: 0100
< HCI Command: Host Number of Com.. (0x03|0x0035) plen 5  #337 [hci1] 26.371357
        Num handles: 1
        Handle: 2667 Address: DF:A9:FF:F6:B1:1A (OUI DF-A9-FF)
        Count: 1
< ACL Data TX: Handle 2667 flags 0x00 dlen 5              #338 [hci1] 26.371463
      ATT: Write Response (0x13) len 0
> HCI Event: Number of Completed Packets (0x13) plen 5    #339 [hci1] 26.654893
        Num handles: 1
        Handle: 2667 Address: DF:A9:FF:F6:B1:1A (OUI DF-A9-FF)
        Count: 1
        #338: len 5 (0 Kb/s)
        Latency: 283 msec (133-294 msec ~282 msec)
> ACL Data RX: Handle 2667 flags 0x02 dlen 7              #340 [hci1] 26.655043
      ATT: Read Request (0x0a) len 2
        Handle: 0x00b7
< HCI Command: Host Number of Com.. (0x03|0x0035) plen 5  #341 [hci1] 26.671405
        Num handles: 1
        Handle: 2667 Address: DF:A9:FF:F6:B1:1A (OUI DF-A9-FF)
        Count: 1
< ACL Data TX: Handle 2667 flags 0x00 dlen 6              #342 [hci1] 26.671478
      ATT: Read Response (0x0b) len 1
> HCI Event: Number of Completed Packets (0x13) plen 5    #343 [hci1] 26.954924
        Num handles: 1
        Handle: 2667 Address: DF:A9:FF:F6:B1:1A (OUI DF-A9-FF)
        Count: 1
        #342: len 6 (0 Kb/s)
        Latency: 283 msec (133-294 msec ~283 msec)
> ACL Data RX: Handle 2667 flags 0x02 dlen 27             #344 [hci1] 26.955270
> ACL Data RX: Handle 2667 flags 0x01 dlen 7              #345 [hci1] 26.955365
      ATT: Write Command (0x52) len 29
        Handle: 0x0054
          Data: 010101020206000000001002010302020103042800050301000000
< HCI Command: Host Number of Com.. (0x03|0x0035) plen 5  #346 [hci1] 26.971037
        Num handles: 1
        Handle: 2667 Address: DF:A9:FF:F6:B1:1A (OUI DF-A9-FF)
        Count: 1
< HCI Command: Host Number of Com.. (0x03|0x0035) plen 5  #347 [hci1] 26.971730
        Num handles: 1
        Handle: 2667 Address: DF:A9:FF:F6:B1:1A (OUI DF-A9-FF)
        Count: 1
< ACL Data TX: Handle 2667 flags 0x00 dlen 12             #348 [hci1] 26.971979
      ATT: Handle Value Notification (0x1b) len 7
        Handle: 0x0054
          Data: 0101010000
< ACL Data TX: Handle 2667 flags 0x00 dlen 27             #349 [hci1] 26.972062
< ACL Data TX: Handle 2667 flags 0x01 dlen 21             #350 [hci1] 26.972071
      ATT: Handle Value Notification (0x1b) len 43
        Handle: 0x0057
          Data: 01010002020a00102700409c00102700409c0006000000001002010302020103042800050301000000
> HCI Event: Number of Completed Packets (0x13) plen 5    #351 [hci1] 27.105139
        Num handles: 1
        Handle: 2667 Address: DF:A9:FF:F6:B1:1A (OUI DF-A9-FF)
        Count: 1
        #348: len 12 (0 Kb/s)
        Latency: 133 msec (133-294 msec ~208 msec)
> HCI Event: Number of Completed Packets (0x13) plen 5    #352 [hci1] 27.105725
        Num handles: 1
        Handle: 2667 Address: DF:A9:FF:F6:B1:1A (OUI DF-A9-FF)
        Count: 1
        #349: len 27 (1 Kb/s)
        Latency: 133 msec (133-294 msec ~170 msec)
> HCI Event: Number of Completed Packets (0x13) plen 5    #353 [hci1] 27.254940
        Num handles: 1
        Handle: 2667 Address: DF:A9:FF:F6:B1:1A (OUI DF-A9-FF)
        Count: 1
        #350: len 21 (0 Kb/s)
        Latency: 282 msec (133-294 msec ~226 msec)
> ACL Data RX: Handle 2667 flags 0x02 dlen 25             #354 [hci1] 27.255258
      ATT: Write Command (0x52) len 20
        Handle: 0x0054
          Data: 020101010110270000022800020a00a86100
< HCI Command: Host Number of Com.. (0x03|0x0035) plen 5  #355 [hci1] 27.271438
        Num handles: 1
        Handle: 2667 Address: DF:A9:FF:F6:B1:1A (OUI DF-A9-FF)
        Count: 1
< ACL Data TX: Handle 2667 flags 0x00 dlen 12             #356 [hci1] 27.271922
      ATT: Handle Value Notification (0x1b) len 7
        Handle: 0x0054
          Data: 0201010000
< ACL Data TX: Handle 2667 flags 0x00 dlen 24             #357 [hci1] 27.272105
      ATT: Handle Value Notification (0x1b) len 19
        Handle: 0x0057
          Data: 0102010110270000022800020a00a86100
> HCI Event: Number of Completed Packets (0x13) plen 5    #358 [hci1] 27.405243
        Num handles: 1
        Handle: 2667 Address: DF:A9:FF:F6:B1:1A (OUI DF-A9-FF)
        Count: 1
        #356: len 12 (0 Kb/s)
        Latency: 133 msec (133-294 msec ~180 msec)
> HCI Event: Number of Completed Packets (0x13) plen 5    #359 [hci1] 27.554858
        Num handles: 1
        Handle: 2667 Address: DF:A9:FF:F6:B1:1A (OUI DF-A9-FF)
        Count: 1
        #357: len 24 (0 Kb/s)
        Latency: 282 msec (133-294 msec ~231 msec)
> ACL Data RX: Handle 2667 flags 0x02 dlen 15             #360 [hci1] 27.555162
      ATT: Write Command (0x52) len 10
        Handle: 0x0054
          Data: 030101040302ff0f
< HCI Command: Host Number of Com.. (0x03|0x0035) plen 5  #361 [hci1] 27.571518
        Num handles: 1
        Handle: 2667 Address: DF:A9:FF:F6:B1:1A (OUI DF-A9-FF)
        Count: 1
< ACL Data TX: Handle 2667 flags 0x00 dlen 12             #362 [hci1] 27.572116
      ATT: Handle Value Notification (0x1b) len 7
        Handle: 0x0054
          Data: 0301010000
< ACL Data TX: Handle 2667 flags 0x00 dlen 16             #363 [hci1] 27.572251
      ATT: Handle Value Notification (0x1b) len 11
        Handle: 0x0057
          Data: 01030101040302ff0f
> HCI Event: Number of Completed Packets (0x13) plen 5    #364 [hci1] 27.705287
        Num handles: 1
        Handle: 2667 Address: DF:A9:FF:F6:B1:1A (OUI DF-A9-FF)
        Count: 1
        #362: len 12 (0 Kb/s)
        Latency: 133 msec (133-294 msec ~182 msec)
> HCI Event: Number of Completed Packets (0x13) plen 5    #365 [hci1] 27.854822
        Num handles: 1
        Handle: 2667 Address: DF:A9:FF:F6:B1:1A (OUI DF-A9-FF)
        Count: 1
        #363: len 16 (0 Kb/s)
        Latency: 282 msec (133-294 msec ~232 msec)
> HCI Event: LE Meta Event (0x3e) plen 7                  #366 [hci1] 28.005250
      LE Connected Isochronous Stream Request (0x1a)
        ACL Handle: 2667
        CIS Handle: 386
        CIG ID: 0x01
        CIS ID: 0x01
< HCI Command: LE Accept Connecte.. (0x08|0x0066) plen 2  #367 [hci1] 28.011092
        CIS Handle: 386
> HCI Event: Command Status (0x0f) plen 4                 #368 [hci1] 28.011558
      LE Accept Connected Isochronous Stream Request (0x08|0x0066) ncmd 1
        Status: Success (0x00)
> HCI Event: LE Meta Event (0x3e) plen 43                 #369 [hci1] 28.460234
      Unknown (0x2a)
        00 82 01 0e 07 00 0e 07 00 6a 4b 00 6a 4b 00 02  .........jK.jK..
        02 03 02 00 01 01 2d 00 00 00 06 00 5a 02 00 28  ......-.....Z..(
        00 00 00 10 27 00 10 27 00 01                    ....'..'..      
< HCI Command: LE Setup Isochron.. (0x08|0x006e) plen 13  #370 [hci1] 28.471090
        Handle: 386
        Data Path Direction: Output (Controller to Host) (0x01)
        Data Path: HCI (0x00)
        Coding Format: Transparent (0x03)
        Company Codec ID: Ericsson Technology Licensing (0)
        Vendor Codec ID: 0
        Controller Delay: 0 us (0x000000)
        Codec Configuration Length: 0
        Codec Configuration: 
< ACL Data TX: Handle 2667 flags 0x00 dlen 16             #371 [hci1] 28.471100
      ATT: Handle Value Notification (0x1b) len 11
        Handle: 0x0057
          Data: 01040101040302ff0f
> HCI Event: Command Complete (0x0e) plen 6               #372 [hci1] 28.471802
      LE Setup Isochronous Data Path (0x08|0x006e) ncmd 1
        Status: Success (0x00)
        Handle: 386
> HCI Event: Number of Completed Packets (0x13) plen 5    #373 [hci1] 28.754816
        Num handles: 1
        Handle: 2667 Address: DF:A9:FF:F6:B1:1A (OUI DF-A9-FF)
        Count: 1
        #371: len 16 (0 Kb/s)
        Latency: 283 msec (133-294 msec ~258 msec)
> ACL Data RX: Handle 2667 flags 0x02 dlen 10             #374 [hci1] 28.755048
      ATT: Write Command (0x52) len 5
        Handle: 0x0054
          Data: 080101
< HCI Command: Host Number of Com.. (0x03|0x0035) plen 5  #375 [hci1] 28.771593
        Num handles: 1
        Handle: 2667 Address: DF:A9:FF:F6:B1:1A (OUI DF-A9-FF)
        Count: 1
< HCI Command: LE Remove Isochron.. (0x08|0x006f) plen 3  #376 [hci1] 28.771901
        Connection Handle: 386
        Data Path Direction: Reserved (0x02)
< ACL Data TX: Handle 2667 flags 0x00 dlen 12             #377 [hci1] 28.771923
      ATT: Handle Value Notification (0x1b) len 7
        Handle: 0x0054
          Data: 0801010000
< ACL Data TX: Handle 2667 flags 0x00 dlen 9              #378 [hci1] 28.771956
      ATT: Handle Value Notification (0x1b) len 4
        Handle: 0x0057
          Data: 0106
> HCI Event: Command Complete (0x0e) plen 6               #379 [hci1] 28.772559
      LE Remove Isochronous Data Path (0x08|0x006f) ncmd 1
        Status: Success (0x00)
        Connection handle: 130
> HCI Event: Number of Completed Packets (0x13) plen 5    #380 [hci1] 28.905217
        Num handles: 1
        Handle: 2667 Address: DF:A9:FF:F6:B1:1A (OUI DF-A9-FF)
        Count: 1
        #377: len 12 (0 Kb/s)
        Latency: 133 msec (133-294 msec ~195 msec)
> HCI Event: Number of Completed Packets (0x13) plen 5    #381 [hci1] 29.054842
        Num handles: 1
        Handle: 2667 Address: DF:A9:FF:F6:B1:1A (OUI DF-A9-FF)
        Count: 1
        #378: len 9 (0 Kb/s)
        Latency: 282 msec (133-294 msec ~239 msec)
> HCI Event: Disconnect Complete (0x05) plen 4            #382 [hci1] 29.209723
        Status: Success (0x00)
        Handle: 386
        Reason: Remote User Terminated Connection (0x13)
< ACL Data TX: Handle 2667 flags 0x00 dlen 9              #383 [hci1] 29.211808
      ATT: Handle Value Notification (0x1b) len 4
        Handle: 0x0057
          Data: 0100
> HCI Event: Number of Completed Packets (0x13) plen 5    #384 [hci1] 29.504754
        Num handles: 1
        Handle: 2667 Address: DF:A9:FF:F6:B1:1A (OUI DF-A9-FF)
        Count: 1
        #383: len 9 (0 Kb/s)
        Latency: 292 msec (133-294 msec ~266 msec)
> HCI Event: Disconnect Complete (0x05) plen 4            #385 [hci1] 30.705048
        Status: Success (0x00)
        Handle: 2667 Address: DF:A9:FF:F6:B1:1A (OUI DF-A9-FF)
        Reason: Remote User Terminated Connection (0x13)
< HCI Command: Reset (0x03|0x0003) plen 0                 #386 [hci1] 35.270875
> HCI Event: Command Complete (0x0e) plen 4               #387 [hci1] 35.271426
      Reset (0x03|0x0003) ncmd 1
        Status: Success (0x00)
@ USER Close: main                                    {0x0001} [hci1] 35.290711
= Close Index: 00:00:00:00:00:00                               [hci1] 35.290718
