Bluetooth monitor ver 5.72
btmon[1453763]: = Note: Linux version 6.14.0-36-generic (x86_64)                                                         0.127351
btmon[1453763]: = Note: Bluetooth subsystem version 2.22                                                                 0.127353
= New Index: 00:00:00:00:00:00 (Primary,UART,hci1)                                                                       0.127354
= New Index: 48:5F:99:8E:E0:64 (Primary,USB,hci0)                                                                        0.127354
= Open Index: 00:00:00:00:00:00                                                                                          0.641033
= Index Info: 00:00:00:00:00:00 (Nordic Semiconductor ASA)                                                               0.641052
zephyr.exe[1453765]: @ USER Open: main (privileged) version 2.22                                                {0x0001} 0.641062
zephyr.exe[1453765]: < HCI Command: Reset (0x03|0x0003) plen 0                                                        #1 0.642431
> HCI Event: Command Complete (0x0e) plen 4                                                                           #2 0.642904
      Reset (0x03|0x0003) ncmd 1
        Status: Success (0x00)
zephyr.exe[1453765]: < HCI Command: Read Local Supported Features (0x04|0x0003) plen 0                                #3 0.660412
> HCI Event: Command Complete (0x0e) plen 12                                                                          #4 0.660884
      Read Local Supported Features (0x04|0x0003) ncmd 1
        Status: Success (0x00)
        Features: 0x00 0x00 0x00 0x00 0x60 0x00 0x00 0x00
          BR/EDR Not Supported
          LE Supported (Controller)
zephyr.exe[1453765]: < HCI Command: Read Local Version Information (0x04|0x0001) plen 0                               #5 0.680395
> HCI Event: Command Complete (0x0e) plen 12                                                                          #6 0.680966
      Read Local Version Information (0x04|0x0001) ncmd 1
        Status: Success (0x00)
        HCI version: Reserved (0x0f) - Revision 12393 (0x3069)
        LMP version: Reserved (0x0f) - Subversion 12393 (0x3069)
        Manufacturer: Nordic Semiconductor ASA (89)
zephyr.exe[1453765]: < HCI Command: Read Local Supported Commands (0x04|0x0002) plen 0                                #7 0.700469
> HCI Event: Command Complete (0x0e) plen 68                                                                          #8 0.701582
      Read Local Supported Commands (0x04|0x0002) ncmd 1
        Status: Success (0x00)
        Commands: 119 entries
          Disconnect (Octet 0 - Bit 5)
          Read Remote Version Information (Octet 2 - Bit 7)
          Set Event Mask (Octet 5 - Bit 6)
          Reset (Octet 5 - Bit 7)
          Read Connection Accept Timeout (Octet 7 - Bit 2)
          Write Connection Accept Timeout (Octet 7 - Bit 3)
          Read Transmit Power Level (Octet 10 - Bit 2)
          Set Controller To Host Flow Control (Octet 10 - Bit 5)
          Host Buffer Size (Octet 10 - Bit 6)
          Host Number of Completed Packets (Octet 10 - Bit 7)
          Read Local Version Information (Octet 14 - Bit 3)
          Read Local Supported Features (Octet 14 - Bit 5)
          Read BD ADDR (Octet 15 - Bit 1)
          Read RSSI (Octet 15 - Bit 5)
          Set Event Mask Page 2 (Octet 22 - Bit 2)
          LE Set Event Mask (Octet 25 - Bit 0)
          LE Read Buffer Size (Octet 25 - Bit 1)
          LE Read Local Supported Features (Octet 25 - Bit 2)
          LE Set Random Address (Octet 25 - Bit 4)
          LE Set Advertising Parameters (Octet 25 - Bit 5)
          LE Read Advertising Channel TX Power (Octet 25 - Bit 6)
          LE Set Advertising Data (Octet 25 - Bit 7)
          LE Set Scan Response Data (Octet 26 - Bit 0)
          LE Set Advertise Enable (Octet 26 - Bit 1)
          LE Set Scan Parameters (Octet 26 - Bit 2)
          LE Set Scan Enable (Octet 26 - Bit 3)
          LE Create Connection (Octet 26 - Bit 4)
          LE Create Connection Cancel (Octet 26 - Bit 5)
          LE Read Accept List Size (Octet 26 - Bit 6)
          LE Clear Accept List (Octet 26 - Bit 7)
          LE Add Device To Accept List (Octet 27 - Bit 0)
          LE Remove Device From Accept List (Octet 27 - Bit 1)
          LE Connection Update (Octet 27 - Bit 2)
          LE Set Host Channel Classification (Octet 27 - Bit 3)
          LE Read Channel Map (Octet 27 - Bit 4)
          LE Read Remote Used Features (Octet 27 - Bit 5)
          LE Encrypt (Octet 27 - Bit 6)
          LE Rand (Octet 27 - Bit 7)
          LE Start Encryption (Octet 28 - Bit 0)
          LE Long Term Key Request Reply (Octet 28 - Bit 1)
          LE Long Term Key Request Neg Reply (Octet 28 - Bit 2)
          LE Read Supported States (Octet 28 - Bit 3)
          LE Receiver Test (Octet 28 - Bit 4)
          LE Transmitter Test (Octet 28 - Bit 5)
          LE Test End (Octet 28 - Bit 6)
          Read Authenticated Payload Timeout (Octet 32 - Bit 4)
          Write Authenticated Payload Timeout (Octet 32 - Bit 5)
          LE Set Data Length (Octet 33 - Bit 6)
          LE Read Suggested Default Data Length (Octet 33 - Bit 7)
          LE Write Suggested Default Data Length (Octet 34 - Bit 0)
          LE Add Device To Resolving List (Octet 34 - Bit 3)
          LE Remove Device From Resolving List (Octet 34 - Bit 4)
          LE Clear Resolving List (Octet 34 - Bit 5)
          LE Read Resolving List Size (Octet 34 - Bit 6)
          LE Set Address Resolution Enable (Octet 35 - Bit 1)
          LE Set Resolvable Private Address Timeout (Octet 35 - Bit 2)
          LE Read Maximum Data Length (Octet 35 - Bit 3)
          LE Read PHY (Octet 35 - Bit 4)
          LE Set Default PHY (Octet 35 - Bit 5)
          LE Set PHY (Octet 35 - Bit 6)
          LE Enhanced Receiver Test (Octet 35 - Bit 7)
          LE Enhanced Transmitter Test (Octet 36 - Bit 0)
          LE Set Advertising Set Random Address (Octet 36 - Bit 1)
          LE Set Extended Advertising Parameters (Octet 36 - Bit 2)
          LE Set Extended Advertising Data (Octet 36 - Bit 3)
          LE Set Extended Scan Response Data (Octet 36 - Bit 4)
          LE Set Extended Advertising Enable (Octet 36 - Bit 5)
          LE Read Maximum Advertising Data Length (Octet 36 - Bit 6)
          LE Read Number of Supported Advertising Sets (Octet 36 - Bit 7)
          LE Remove Advertising Set (Octet 37 - Bit 0)
          LE Clear Advertising Sets (Octet 37 - Bit 1)
          LE Set Periodic Advertising Parameters (Octet 37 - Bit 2)
          LE Set Periodic Advertising Data (Octet 37 - Bit 3)
          LE Set Periodic Advertising Enable (Octet 37 - Bit 4)
          LE Set Extended Scan Parameters (Octet 37 - Bit 5)
          LE Set Extended Scan Enable (Octet 37 - Bit 6)
          LE Extended Create Connection (Octet 37 - Bit 7)
          LE Periodic Advertising Create Sync (Octet 38 - Bit 0)
          LE Periodic Advertising Create Sync Cancel (Octet 38 - Bit 1)
          LE Periodic Advertising Terminate Sync (Octet 38 - Bit 2)
          LE Add Device To Periodic Advertiser List (Octet 38 - Bit 3)
          LE Remove Device From Periodic Advertiser List (Octet 38 - Bit 4)
          LE Clear Periodic Advertiser List (Octet 38 - Bit 5)
          LE Read Periodic Advertiser List Size (Octet 38 - Bit 6)
          LE Read Transmit Power (Octet 38 - Bit 7)
          LE Read RF Path Compensation (Octet 39 - Bit 0)
          LE Write RF Path Compensation (Octet 39 - Bit 1)
          LE Set Privacy Mode (Octet 39 - Bit 2)
          LE Periodic Advertising Receive Enable (Octet 40 - Bit 5)
          LE Periodic Advertising Sync Transfer (Octet 40 - Bit 6)
          LE Periodic Advertising Set Info Transfer (Octet 40 - Bit 7)
          LE Periodic Advertising Sync Transfer Parameters (Octet 41 - Bit 0)
          LE Set Default Periodic Advertisng Sync Transfer Parameters (Octet 41 - Bit 1)
          LE Read Buffer v2 (Octet 41 - Bit 5)
          LE Read ISO TX Sync (Octet 41 - Bit 6)
          LE Set Connected Isochronous Group Parameters (Octet 41 - Bit 7)
          LE Set Connected Isochronous Group Parameters Test (Octet 42 - Bit 0)
          LE Create Connected Isochronous Stream (Octet 42 - Bit 1)
          LE Remove Connected Isochronous Group (Octet 42 - Bit 2)
          LE Accept Connected Isochronous Stream Request (Octet 42 - Bit 3)
          LE Reject Connected Isochronous Stream Request (Octet 42 - Bit 4)
          LE Create Broadcast Isochronous Group (Octet 42 - Bit 5)
          LE Create Broadcast Isochronous Group Test (Octet 42 - Bit 6)
          LE Terminate Broadcast Isochronous Group (Octet 42 - Bit 7)
          LE Broadcast Isochronous Group Create Sync (Octet 43 - Bit 0)
          LE Broadcast Isochronous Group Terminate Sync (Octet 43 - Bit 1)
          LE Request Peer SCA (Octet 43 - Bit 2)
          LE Setup Isochronous Data Path (Octet 43 - Bit 3)
          LE Remove Isochronous Data Path (Octet 43 - Bit 4)
          LE Isochronous Transmit Test (Octet 43 - Bit 5)
          LE Isochronous Receive Test (Octet 43 - Bit 6)
          LE Isochronous Read Test Counters (Octet 43 - Bit 7)
          LE Isochronous Read Test Counters (Octet 44 - Bit 0)
          LE Set Host Feature (Octet 44 - Bit 1)
          Octet 44 - Bit 2 
          Octet 45 - Bit 6 
          Octet 46 - Bit 0 
          Octet 46 - Bit 1 
          Octet 46 - Bit 2 
zephyr.exe[1453765]: < HCI Command: Host Buffer Size (0x03|0x0033) plen 7                                             #9 0.720458
        ACL MTU: 255  ACL max packet: 16
        SCO MTU: 0    SCO max packet: 0
> HCI Event: Command Complete (0x0e) plen 4                                                                          #10 0.720910
      Host Buffer Size (0x03|0x0033) ncmd 1
        Status: Success (0x00)
zephyr.exe[1453765]: < HCI Command: Set Controller To Host Flow Control (0x03|0x0031) plen 1                         #11 0.740453
        Flow control: ACL Data Packets (0x01)
> HCI Event: Command Complete (0x0e) plen 4                                                                          #12 0.740924
      Set Controller To Host Flow Control (0x03|0x0031) ncmd 1
        Status: Success (0x00)
zephyr.exe[1453765]: < HCI Command: LE Read Local Supported Features (0x08|0x0003) plen 0                            #13 0.760460
> HCI Event: Command Complete (0x0e) plen 12                                                                         #14 0.760919
      LE Read Local Supported Features (0x08|0x0003) ncmd 1
        Status: Success (0x00)
        Features: 0xfd 0x79 0x00 0xf7 0x30 0x01 0x00 0x00
          LE Encryption
          Extended Reject Indication
          Peripheral-initiated Features Exchange
          LE Ping
          LE Data Packet Length Extension
          LL Privacy
          Extended Scanner Filter Policies
          LE 2M PHY
          LE Coded PHY
          LE Extended Advertising
          LE Periodic Advertising
          Channel Selection Algorithm #2
          Periodic Advertising Sync Transfer - Sender
          Periodic Advertising Sync Transfer - Recipient
          Sleep Clock Accuracy Updates
          Connected Isochronous Stream - Central
          Connected Isochronous Stream - Peripheral
          Isochronous Broadcaster
          Synchronized Receiver
          Periodic Advertising ADI support
          Connection Subrating
          Unknown features (0x0000010000000000)
zephyr.exe[1453765]: < HCI Command: LE Set Host Feature (0x08|0x0074) plen 2                                         #15 0.780498
        Bit Number: 32
          Connected Isochronous Stream (Host Support)
        Bit Value: 1
> HCI Event: Command Complete (0x0e) plen 4                                                                          #16 0.780939
      LE Set Host Feature (0x08|0x0074) ncmd 1
        Status: Success (0x00)
zephyr.exe[1453765]: < HCI Command: LE Read Buffer v2 (0x08|0x0060) plen 0                                           #17 0.800446
> HCI Event: Command Complete (0x0e) plen 10                                                                         #18 0.800917
      LE Read Buffer v2 (0x08|0x0060) ncmd 1
        Status: Success (0x00)
        ACL MTU: 27
        ACL max packet: 3
        ISO MTU: 318
        ISO max packet: 3
zephyr.exe[1453765]: < HCI Command: LE Read Maximum Advertising Data Length (0x08|0x003a) plen 0                     #19 0.820511
> HCI Event: Command Complete (0x0e) plen 6                                                                          #20 0.821007
      LE Read Maximum Advertising Data Length (0x08|0x003a) ncmd 1
        Status: Success (0x00)
        Max length: 1650
zephyr.exe[1453765]: < HCI Command: LE Read Supported States (0x08|0x001c) plen 0                                    #21 0.840468
> HCI Event: Command Complete (0x0e) plen 12                                                                         #22 0.841008
      LE Read Supported States (0x08|0x001c) ncmd 1
        Status: Success (0x00)
        States: 0x000003ff3e0306ff
          Non-connectable Advertising State
          Scannable Advertising State
          Connectable Advertising State
          High Duty Cycle Directed Advertising State
          Passive Scanning State
          Active Scanning State
          Initiating State
            and Connection State (Central Role)
          Connection State (Peripheral Role)
          Scannable Advertising State
            and Passive Scanning State
          Connectable Advertising State
            and Passive Scanning State
          Non-connectable Advertising State
            and Initiating State
          Scannable Advertising State
            and Initiating State
          Active Scanning State
            and Connection State (Central Role)
          Passive Scanning State
            and Connection State (Peripheral Role)
          Active Scanning State
            and Connection State (Peripheral Role)
          Initiating State
            and Connection State (Central Role)
            and Central Role & Central Role
          Low Duty Cycle Directed Advertising State
          Connectable Advertising State
            and Initiating State
            and Central Role & Peripheral Role
          High Duty Cycle Directed Advertising State
            and Initiating State
            and Central Role & Peripheral Role
          Low Duty Cycle Directed Advertising State
            and Initiating State
            and Central Role & Peripheral Role
          Connectable Advertising State
            and Connection State (Central Role)
            and Central Role & Peripheral Role
          High Duty Cycle Directed Advertising State
            and Connection State (Central Role)
            and Central Role & Peripheral Role
          Low Duty Cycle Directed Advertising State
            and Connection State (Central Role)
            and Central Role & Peripheral Role
          Connectable Advertising State
            and Connection State (Peripheral Role)
            and Central Role & Peripheral Role
          High Duty Cycle Directed Advertising State
            and Connection State (Peripheral Role)
            and Peripheral Role & Peripheral Role
          Low Duty Cycle Directed Advertising State
            and Connection State (Peripheral Role)
            and Peripheral Role & Peripheral Role
          Initiating State
            and Connection State (Peripheral Role)
            and Central Role & Peripheral Role
zephyr.exe[1453765]: < HCI Command: LE Read Maximum Data Length (0x08|0x002f) plen 0                                 #23 0.860467
> HCI Event: Command Complete (0x0e) plen 12                                                                         #24 0.860973
      LE Read Maximum Data Length (0x08|0x002f) ncmd 1
        Status: Success (0x00)
        Max TX octets: 251
        Max TX time: 2704
        Max RX octets: 251
        Max RX time: 2704
zephyr.exe[1453765]: < HCI Command: LE Write Suggested Default Data Length (0x08|0x0024) plen 4                      #25 0.880434
        TX octets: 251
        TX time: 2704
> HCI Event: Command Complete (0x0e) plen 4                                                                          #26 0.880901
      LE Write Suggested Default Data Length (0x08|0x0024) ncmd 1
        Status: Success (0x00)
zephyr.exe[1453765]: < HCI Command: LE Set Resolvable Private Address Timeout (0x08|0x002e) plen 2                   #27 0.900457
        Timeout: 900 seconds
> HCI Event: Command Complete (0x0e) plen 4                                                                          #28 0.900937
      LE Set Resolvable Private Address Timeout (0x08|0x002e) ncmd 1
        Status: Success (0x00)
zephyr.exe[1453765]: < HCI Command: LE Read Resolving List Size (0x08|0x002a) plen 0                                 #29 0.920435
> HCI Event: Command Complete (0x0e) plen 5                                                                          #30 0.920839
      LE Read Resolving List Size (0x08|0x002a) ncmd 1
        Status: Success (0x00)
        Size: 8
zephyr.exe[1453765]: < HCI Command: LE Set Event Mask (0x08|0x0001) plen 8                                           #31 0.940444
        Mask: 0x000002023f87fa5e
          LE Advertising Report
          LE Connection Update Complete
          LE Read Remote Used Features Complete
          LE Long Term Key Request
          LE Data Length Change
          LE Enhanced Connection Complete
          LE PHY Update Complete
          LE Extended Advertising Report
          LE Periodic Advertising Sync Established
          LE Periodic Advertising Report
          LE Periodic Advertising Sync Lost
          LE Extended Scan Timeout
          LE Extended Advertising Set Terminated
          LE Scan Request Received
          LE Periodic Advertising Sync Transfer Rvc
          LE CIS Established
          LE CIS Request
          LE Create BIG Complete
          LE Terminate BIG Complete
          LE BIG Sync Estabilished Complete
          LE BIG Sync Lost
          LE BIG Info Advertising Report
          Unknown mask (0x0000020000000000)
> HCI Event: Command Complete (0x0e) plen 4                                                                          #32 0.940958
      LE Set Event Mask (0x08|0x0001) ncmd 1
        Status: Success (0x00)
zephyr.exe[1453765]: < HCI Command: Set Event Mask (0x03|0x0001) plen 8                                              #33 0.960440
        Mask: 0x2000800002008890
          Disconnection Complete
          Encryption Change
          Read Remote Version Information Complete
          Hardware Error
          Data Buffer Overflow
          Encryption Key Refresh Complete
          LE Meta
> HCI Event: Command Complete (0x0e) plen 4                                                                          #34 0.961011
      Set Event Mask (0x03|0x0001) ncmd 1
        Status: Success (0x00)
zephyr.exe[1453765]: < HCI Command: Read BD ADDR (0x04|0x0009) plen 0                                                #35 0.980433
> HCI Event: Command Complete (0x0e) plen 10                                                                         #36 0.980937
      Read BD ADDR (0x04|0x0009) ncmd 1
        Status: Success (0x00)
        Address: 00:00:00:00:00:00 (OUI 00-00-00)
zephyr.exe[1453765]: < HCI Command: LE Set Random Address (0x08|0x0005) plen 6                                       #37 1.000442
        Address: D5:B6:CC:31:DB:3B (Static)
> HCI Event: Command Complete (0x0e) plen 4                                                                          #38 1.000944
      LE Set Random Address (0x08|0x0005) ncmd 1
        Status: Success (0x00)
zephyr.exe[1453765]: < HCI Command: LE Set Random Address (0x08|0x0005) plen 6                                       #39 1.100471
        Address: 48:61:8E:DB:C6:F9 (Resolvable)
> HCI Event: Command Complete (0x0e) plen 4                                                                          #40 1.101018
      LE Set Random Address (0x08|0x0005) ncmd 1
        Status: Success (0x00)
zephyr.exe[1453765]: < HCI Command: LE Set Extended Advertising Parameters (0x08|0x0036) plen 25                     #41 5.990504
        Handle: 0x00
        Properties: 0x0013
          Connectable
          Scannable
          Use legacy advertising PDUs: ADV_IND
        Min advertising interval: 100.000 msec (0x00a0)
        Max advertising interval: 150.000 msec (0x00f0)
        Channel map: 37, 38, 39 (0x07)
        Own address type: Random (0x01)
        Peer address type: Public (0x00)
        Peer address: 00:00:00:00:00:00 (OUI 00-00-00)
        Filter policy: Allow Scan Request from Any, Allow Connect Request from Any (0x00)
        TX power: Host has no preference (0x7f)
        Primary PHY: LE 1M (0x01)
        Secondary max skip: 0x00
        Secondary PHY: LE 1M (0x01)
        SID: 0x00
        Scan request notifications: Disabled (0x00)
> HCI Event: Command Complete (0x0e) plen 5                                                                          #42 5.991256
      LE Set Extended Advertising Parameters (0x08|0x0036) ncmd 1
        Status: Success (0x00)
        TX power (selected): 0 dbm (0x00)
zephyr.exe[1453765]: < HCI Command: LE Set Advertising Set Random Address (0x08|0x0035) plen 7                       #43 6.000494
        Advertising handle: 0x00
        Advertising random address: D5:B6:CC:31:DB:3B (Static)
> HCI Event: Command Complete (0x0e) plen 4                                                                          #44 6.000941
      LE Set Advertising Set Random Address (0x08|0x0035) ncmd 1
        Status: Success (0x00)
zephyr.exe[1453765]: < HCI Command: LE Set Extended Advertising Data (0x08|0x0037) plen 22                           #45 6.020474
        Handle: 0x00
        Operation: Complete extended advertising data (0x03)
        Fragment preference: Minimize fragmentation (0x01)
        Data length: 0x12
        Flags: 0x04
          BR/EDR Not Supported
        Name (complete): Tester_F6B11A
> HCI Event: Command Complete (0x0e) plen 4                                                                          #46 6.021216
      LE Set Extended Advertising Data (0x08|0x0037) ncmd 1
        Status: Success (0x00)
zephyr.exe[1453765]: < HCI Command: LE Set Extended Scan Response Data (0x08|0x0038) plen 4                          #47 6.040488
        Handle: 0x00
        Operation: Complete scan response data (0x03)
        Fragment preference: Minimize fragmentation (0x01)
        Data length: 0x00
> HCI Event: Command Complete (0x0e) plen 4                                                                          #48 6.041078
      LE Set Extended Scan Response Data (0x08|0x0038) ncmd 1
        Status: Success (0x00)
zephyr.exe[1453765]: < HCI Command: LE Set Extended Advertising Enable (0x08|0x0039) plen 6                          #49 6.060498
        Extended advertising: Enabled (0x01)
        Number of sets: 1 (0x01)
        Entry 0
          Handle: 0x00
          Duration: 0 ms (0x00)
          Max ext adv events: 0
> HCI Event: Command Complete (0x0e) plen 4                                                                          #50 6.061076
      LE Set Extended Advertising Enable (0x08|0x0039) ncmd 1
        Status: Success (0x00)
> HCI Event: LE Meta Event (0x3e) plen 31                                                                            #51 6.283544
      LE Enhanced Connection Complete (0x0a)
        Status: Success (0x00)
        Handle: 39
        Role: Peripheral (0x01)
        Peer address type: Public (0x00)
        Peer address: DF:A9:FF:F6:B1:1A (OUI DF-A9-FF)
        Local resolvable private address: 00:00:00:00:00:00 (Non-Resolvable)
        Peer resolvable private address: 00:00:00:00:00:00 (Non-Resolvable)
        Connection interval: 87.50 msec (0x0046)
        Connection latency: 0 (0x0000)
        Supervision timeout: 20000 msec (0x07d0)
        Central clock accuracy: 0x01
> HCI Event: LE Meta Event (0x3e) plen 6                                                                             #52 6.283546
      LE Advertising Set Terminated (0x12)
        Status: Success (0x00)
        Handle: 0
        Connection handle: 39
        Number of completed extended advertising events: 0
zephyr.exe[1453765]: < HCI Command: LE Read Remote Used Features (0x08|0x0016) plen 2                                #53 6.300771
        Handle: 39 Address: DF:A9:FF:F6:B1:1A (OUI DF-A9-FF)
> HCI Event: Command Status (0x0f) plen 4                                                                            #54 6.301327
      LE Read Remote Used Features (0x08|0x0016) ncmd 1
        Status: Success (0x00)
> HCI Event: LE Meta Event (0x3e) plen 12                                                                            #55 6.547303
      LE Read Remote Used Features (0x04)
        Status: Success (0x00)
        Handle: 39 Address: DF:A9:FF:F6:B1:1A (OUI DF-A9-FF)
        Features: 0x2d 0x49 0x00 0xf7 0x67 0xd8 0x00 0x00
          LE Encryption
          Extended Reject Indication
          Peripheral-initiated Features Exchange
          LE Data Packet Length Extension
          LE 2M PHY
          LE Coded PHY
          Channel Selection Algorithm #2
          Periodic Advertising Sync Transfer - Sender
          Periodic Advertising Sync Transfer - Recipient
          Sleep Clock Accuracy Updates
          Connected Isochronous Stream - Central
          Connected Isochronous Stream - Peripheral
          Isochronous Broadcaster
          Synchronized Receiver
          Connected Isochronous Stream (Host Support)
          LE Power Control Request
          LE Power Control Request
          Connection Subrating
          Connection Subrating (Host Support)
          Unknown features (0x0000d80000000000)
> ACL Data RX: Handle 39 flags 0x02 dlen 11                                                                          #56 7.159626
      SMP: Pairing Request (0x01) len 6
        IO capability: KeyboardDisplay (0x04)
        OOB data: Authentication data not present (0x00)
        Authentication requirement: Bonding, MITM, SC, No Keypresses (0x0d)
        Max encryption key size: 16
        Initiator key distribution: IdKey (0x02)
        Responder key distribution: IdKey (0x02)
zephyr.exe[1453765]: < HCI Command: Host Number of Completed Packets (0x03|0x0035) plen 5                            #57 7.160562
        Num handles: 1
        Handle: 39 Address: DF:A9:FF:F6:B1:1A (OUI DF-A9-FF)
        Count: 1
zephyr.exe[1453765]: < ACL Data TX: Handle 39 flags 0x00 dlen 11                                                     #58 7.160654
      SMP: Pairing Response (0x02) len 6
        IO capability: KeyboardDisplay (0x04)
        OOB data: Authentication data not present (0x00)
        Authentication requirement: Bonding, MITM, SC, No Keypresses (0x0d)
        Max encryption key size: 16
        Initiator key distribution: IdKey (0x02)
        Responder key distribution: IdKey (0x02)
> HCI Event: Number of Completed Packets (0x13) plen 5                                                               #59 7.334756
        Num handles: 1
        Handle: 39 Address: DF:A9:FF:F6:B1:1A (OUI DF-A9-FF)
        Count: 1
        #58: len 11 (0 Kb/s)
        Latency: 174 msec (174-174 msec ~174 msec)
> ACL Data RX: Handle 39 flags 0x02 dlen 27                                                                          #60 7.334940
> ACL Data RX: Handle 39 flags 0x01 dlen 27                                                                          #61 7.335498
> ACL Data RX: Handle 39 flags 0x01 dlen 15                                                                          #62 7.335996
      SMP: Pairing Public Key (0x0c) len 64
        X: af411b4b379055c9673fe0ef99a5c229c63ddcd6f9820f4b34a9a8540ba72e13
        Y: 17ce0b65b78e52e952b1387a0707317e935ed111371140706de80de33d08dee1
zephyr.exe[1453765]: < HCI Command: Host Number of Completed Packets (0x03|0x0035) plen 5                            #63 7.341424
        Num handles: 1
        Handle: 39 Address: DF:A9:FF:F6:B1:1A (OUI DF-A9-FF)
        Count: 1
zephyr.exe[1453765]: < HCI Command: Host Number of Completed Packets (0x03|0x0035) plen 5                            #64 7.341437
        Num handles: 1
        Handle: 39 Address: DF:A9:FF:F6:B1:1A (OUI DF-A9-FF)
        Count: 1
zephyr.exe[1453765]: < HCI Command: Host Number of Completed Packets (0x03|0x0035) plen 5                            #65 7.341520
        Num handles: 1
        Handle: 39 Address: DF:A9:FF:F6:B1:1A (OUI DF-A9-FF)
        Count: 1
zephyr.exe[1453765]: < ACL Data TX: Handle 39 flags 0x00 dlen 27                                                     #66 7.341585
zephyr.exe[1453765]: < ACL Data TX: Handle 39 flags 0x01 dlen 27                                                     #67 7.341588
zephyr.exe[1453765]: < ACL Data TX: Handle 39 flags 0x01 dlen 15                                                     #68 7.341597
      SMP: Pairing Public Key (0x0c) len 64
        X: 68f6ada634ce84d11617383d57f070fe3445c38b33b569efa5eb771a0dc8aea5
        Y: 83c407aaa8337331fdc418e55085d75e6c1c6e5d42f8bf9c18fb5a2a7d4f31aa
> HCI Event: Number of Completed Packets (0x13) plen 5                                                               #69 7.422572
        Num handles: 1
        Handle: 39 Address: DF:A9:FF:F6:B1:1A (OUI DF-A9-FF)
        Count: 1
        #66: len 27 (2 Kb/s)
        Latency: 80 msec (80-174 msec ~127 msec)
> HCI Event: Number of Completed Packets (0x13) plen 5                                                               #70 7.423165
        Num handles: 1
        Handle: 39 Address: DF:A9:FF:F6:B1:1A (OUI DF-A9-FF)
        Count: 1
        #67: len 27 (2 Kb/s)
        Latency: 81 msec (80-174 msec ~104 msec)
zephyr.exe[1453765]: < ACL Data TX: Handle 39 flags 0x00 dlen 21                                                     #71 7.441328
      SMP: Pairing Confirm (0x03) len 16
        Confim value: ead726abab0931669f1be7baf0b00c09
> HCI Event: Number of Completed Packets (0x13) plen 5                                                               #72 7.509468
        Num handles: 1
        Handle: 39 Address: DF:A9:FF:F6:B1:1A (OUI DF-A9-FF)
        Count: 1
        #68: len 15 (0 Kb/s)
        Latency: 167 msec (80-174 msec ~136 msec)
> HCI Event: Number of Completed Packets (0x13) plen 5                                                               #73 7.597024
        Num handles: 1
        Handle: 39 Address: DF:A9:FF:F6:B1:1A (OUI DF-A9-FF)
        Count: 1
        #71: len 21 (1 Kb/s)
        Latency: 155 msec (80-174 msec ~145 msec)
> ACL Data RX: Handle 39 flags 0x02 dlen 21                                                                          #74 7.597505
      SMP: Pairing Random (0x04) len 16
        Random value: b3d08066e63911d62e1100a6d86659cc
zephyr.exe[1453765]: < HCI Command: Host Number of Completed Packets (0x03|0x0035) plen 5                            #75 7.600636
        Num handles: 1
        Handle: 39 Address: DF:A9:FF:F6:B1:1A (OUI DF-A9-FF)
        Count: 1
zephyr.exe[1453765]: < ACL Data TX: Handle 39 flags 0x00 dlen 21                                                     #76 7.600644
      SMP: Pairing Random (0x04) len 16
        Random value: 555cc64d02679f89a05211af56d8b3da
> HCI Event: Number of Completed Packets (0x13) plen 5                                                               #77 7.771894
        Num handles: 1
        Handle: 39 Address: DF:A9:FF:F6:B1:1A (OUI DF-A9-FF)
        Count: 1
        #76: len 21 (0 Kb/s)
        Latency: 171 msec (80-174 msec ~158 msec)
> ACL Data RX: Handle 39 flags 0x02 dlen 21                                                                          #78 8.122185
      SMP: Pairing DHKey Check (0x0d) len 16
        E: fd39e3e584745375d51d6611409c33d8
zephyr.exe[1453765]: < HCI Command: Host Number of Completed Packets (0x03|0x0035) plen 5                            #79 8.140720
        Num handles: 1
        Handle: 39 Address: DF:A9:FF:F6:B1:1A (OUI DF-A9-FF)
        Count: 1
zephyr.exe[1453765]: < ACL Data TX: Handle 39 flags 0x00 dlen 21                                                     #80 8.140822
      SMP: Pairing DHKey Check (0x0d) len 16
        E: 74c0a820860aa71d149d0821650559c2
> HCI Event: Number of Completed Packets (0x13) plen 5                                                               #81 8.296876
        Num handles: 1
        Handle: 39 Address: DF:A9:FF:F6:B1:1A (OUI DF-A9-FF)
        Count: 1
        #80: len 21 (1 Kb/s)
        Latency: 156 msec (80-174 msec ~157 msec)
> HCI Event: LE Meta Event (0x3e) plen 13                                                                            #82 8.385048
      LE Long Term Key Request (0x05)
        Handle: 39 Address: DF:A9:FF:F6:B1:1A (OUI DF-A9-FF)
        Random number: 0x0000000000000000
        Encrypted diversifier: 0x0000
zephyr.exe[1453765]: < HCI Command: LE Long Term Key Request Reply (0x08|0x001a) plen 18                             #83 8.400807
        Handle: 39 Address: DF:A9:FF:F6:B1:1A (OUI DF-A9-FF)
        Long term key: aff0db29241b5a7d68714e291d56502d
> HCI Event: Command Complete (0x0e) plen 6                                                                          #84 8.401576
      LE Long Term Key Request Reply (0x08|0x001a) ncmd 1
        Status: Success (0x00)
        Handle: 39 Address: DF:A9:FF:F6:B1:1A (OUI DF-A9-FF)
> HCI Event: Encryption Change (0x08) plen 4                                                                         #85 8.822179
        Status: Success (0x00)
        Handle: 39 Address: DF:A9:FF:F6:B1:1A (OUI DF-A9-FF)
        Encryption: Enabled with AES-CCM (0x01)
zephyr.exe[1453765]: < ACL Data TX: Handle 39 flags 0x00 dlen 21                                                     #86 8.951030
      SMP: Identity Information (0x08) len 16
        Identity resolving key: 08aad2e1be87e47b88aeb19de6889efb
zephyr.exe[1453765]: < ACL Data TX: Handle 39 flags 0x00 dlen 12                                                     #87 8.951058
      SMP: Identity Address Information (0x09) len 7
        Address: D5:B6:CC:31:DB:3B (Static)
> HCI Event: Number of Completed Packets (0x13) plen 5                                                               #88 8.997547
        Num handles: 1
        Handle: 39 Address: DF:A9:FF:F6:B1:1A (OUI DF-A9-FF)
        Count: 1
        #86: len 21 (3 Kb/s)
        Latency: 46 msec (46-174 msec ~101 msec)
> HCI Event: Number of Completed Packets (0x13) plen 5                                                               #89 9.084692
        Num handles: 1
        Handle: 39 Address: DF:A9:FF:F6:B1:1A (OUI DF-A9-FF)
        Count: 1
        #87: len 12 (0 Kb/s)
        Latency: 133 msec (46-174 msec ~117 msec)
> ACL Data RX: Handle 39 flags 0x02 dlen 21                                                                          #90 9.084924
      SMP: Identity Information (0x08) len 16
        Identity resolving key: 6cf0d45ffcfbbc186cdd142739e03843
zephyr.exe[1453765]: < HCI Command: Host Number of Completed Packets (0x03|0x0035) plen 5                            #91 9.101212
        Num handles: 1
        Handle: 39 Address: DF:A9:FF:F6:B1:1A (OUI DF-A9-FF)
        Count: 1
> ACL Data RX: Handle 39 flags 0x02 dlen 12                                                                          #92 9.172123
      SMP: Identity Address Information (0x09) len 7
        Address: DF:A9:FF:F6:B1:1A (OUI DF-A9-FF)
zephyr.exe[1453765]: < HCI Command: LE Add Device To Resolving List (0x08|0x0027) plen 39                            #93 9.180903
        Address type: Public (0x00)
        Address: DF:A9:FF:F6:B1:1A (OUI DF-A9-FF)
        Peer identity resolving key: 6cf0d45ffcfbbc186cdd142739e03843
        Local identity resolving key: 08aad2e1be87e47b88aeb19de6889efb
> HCI Event: Command Complete (0x0e) plen 4                                                                          #94 9.181980
      LE Add Device To Resolving List (0x08|0x0027) ncmd 1
        Status: Success (0x00)
zephyr.exe[1453765]: < HCI Command: LE Set Privacy Mode (0x08|0x004e) plen 8                                         #95 9.200567
        Peer Identity address type: Public (0x00)
        Peer Identity address: DF:A9:FF:F6:B1:1A (OUI DF-A9-FF)
        Privacy Mode: Use Device Privacy (0x01)
> HCI Event: Command Complete (0x0e) plen 4                                                                          #96 9.201096
      LE Set Privacy Mode (0x08|0x004e) ncmd 1
        Status: Success (0x00)
zephyr.exe[1453765]: < HCI Command: LE Set Address Resolution Enable (0x08|0x002d) plen 1                            #97 9.220535
        Address resolution: Enabled (0x01)
> HCI Event: Command Complete (0x0e) plen 4                                                                          #98 9.220974
      LE Set Address Resolution Enable (0x08|0x002d) ncmd 1
        Status: Success (0x00)
zephyr.exe[1453765]: < HCI Command: Host Number of Completed Packets (0x03|0x0035) plen 5                            #99 9.240491
        Num handles: 1
        Handle: 39 Address: DF:A9:FF:F6:B1:1A (OUI DF-A9-FF)
        Count: 1
zephyr.exe[1453765]: < ACL Data TX: Handle 39 flags 0x00 dlen 11                                                    #100 9.240560
      ATT: Read By Type Request (0x08) len 6
        Handle range: 0x0001-0xffff
        Attribute type: Central Address Resolution (0x2aa6)
> HCI Event: Number of Completed Packets (0x13) plen 5                                                              #101 9.346977
        Num handles: 1
        Handle: 39 Address: DF:A9:FF:F6:B1:1A (OUI DF-A9-FF)
        Count: 1
        #100: len 11 (0 Kb/s)
        Latency: 106 msec (46-174 msec ~112 msec)
> ACL Data RX: Handle 39 flags 0x02 dlen 9                                                                          #102 9.347203
      ATT: Read By Type Response (0x09) len 4
        Attribute data length: 3
        Attribute data list: 1 entry
        Handle: 0x000f
        Value: 01
zephyr.exe[1453765]: < HCI Command: Host Number of Completed Packets (0x03|0x0035) plen 5                           #103 9.361109
        Num handles: 1
        Handle: 39 Address: DF:A9:FF:F6:B1:1A (OUI DF-A9-FF)
        Count: 1
zephyr.exe[1453765]: < ACL Data TX: Handle 39 flags 0x00 dlen 11                                                   #104 10.121032
      ATT: Read By Type Request (0x08) len 6
        Handle range: 0x0001-0x000d
        Attribute type: Characteristic (0x2803)
> HCI Event: Number of Completed Packets (0x13) plen 5                                                             #105 10.222097
        Num handles: 1
        Handle: 39 Address: DF:A9:FF:F6:B1:1A (OUI DF-A9-FF)
        Count: 1
        #104: len 11 (0 Kb/s)
        Latency: 101 msec (46-174 msec ~106 msec)
> ACL Data RX: Handle 39 flags 0x02 dlen 27                                                                        #106 10.222600
      ATT: Read By Type Response (0x09) len 22
        Attribute data length: 7
        Attribute data list: 3 entries
        Handle: 0x0002
        Value: 0a0300002a
            Properties: 0x0a
              Read (0x02)
              Write (0x08)
            Value Handle: 0x0003
            Value UUID: Device Name (0x2a00)
        Handle: 0x0004
        Value: 0a0500012a
            Properties: 0x0a
              Read (0x02)
              Write (0x08)
            Value Handle: 0x0005
            Value UUID: Appearance (0x2a01)
        Handle: 0x0006
        Value: 4e07000945
            Properties: 0x4e
              Read (0x02)
              Write Without Response (0x04)
              Write (0x08)
              Authorize (0x40)
              Extended Properties (0x80)
            Value Handle: 0x0007
            Value UUID: Unknown (0x4509)
zephyr.exe[1453765]: < HCI Command: Host Number of Completed Packets (0x03|0x0035) plen 5                          #107 10.240692
        Num handles: 1
        Handle: 39 Address: DF:A9:FF:F6:B1:1A (OUI DF-A9-FF)
        Count: 1
zephyr.exe[1453765]: < ACL Data TX: Handle 39 flags 0x00 dlen 11                                                   #108 10.240720
      ATT: Read By Type Request (0x08) len 6
        Handle range: 0x0007-0x000d
        Attribute type: Characteristic (0x2803)
> HCI Event: Number of Completed Packets (0x13) plen 5                                                             #109 10.397072
        Num handles: 1
        Handle: 39 Address: DF:A9:FF:F6:B1:1A (OUI DF-A9-FF)
        Count: 1
        #108: len 11 (0 Kb/s)
        Latency: 156 msec (46-174 msec ~131 msec)
> ACL Data RX: Handle 39 flags 0x02 dlen 20                                                                        #110 10.397407
      ATT: Read By Type Response (0x09) len 15
        Attribute data length: 7
        Attribute data list: 2 entries
        Handle: 0x0008
        Value: 020900042a
            Properties: 0x02
              Read (0x02)
            Value Handle: 0x0009
            Value UUID: Peripheral Preferred Connection Parameters (0x2a04)
        Handle: 0x000a
        Value: 320b00192a
            Properties: 0x32
              Read (0x02)
              Notify (0x10)
              Indicate (0x20)
            Value Handle: 0x000b
            Value UUID: Battery Level (0x2a19)
zephyr.exe[1453765]: < HCI Command: Host Number of Completed Packets (0x03|0x0035) plen 5                          #111 10.400637
        Num handles: 1
        Handle: 39 Address: DF:A9:FF:F6:B1:1A (OUI DF-A9-FF)
        Count: 1
zephyr.exe[1453765]: < ACL Data TX: Handle 39 flags 0x00 dlen 11                                                   #112 10.400662
      ATT: Read By Type Request (0x08) len 6
        Handle range: 0x000b-0x000d
        Attribute type: Characteristic (0x2803)
> HCI Event: Number of Completed Packets (0x13) plen 5                                                             #113 10.571998
        Num handles: 1
        Handle: 39 Address: DF:A9:FF:F6:B1:1A (OUI DF-A9-FF)
        Count: 1
        #112: len 11 (0 Kb/s)
        Latency: 171 msec (46-174 msec ~151 msec)
> ACL Data RX: Handle 39 flags 0x02 dlen 9                                                                         #114 10.572132
      ATT: Error Response (0x01) len 4
        Read By Type Request (0x08)
        Handle: 0x000b
        Error: Attribute Not Found (0x0a)
zephyr.exe[1453765]: < HCI Command: Host Number of Completed Packets (0x03|0x0035) plen 5                          #115 10.580744
        Num handles: 1
        Handle: 39 Address: DF:A9:FF:F6:B1:1A (OUI DF-A9-FF)
        Count: 1
zephyr.exe[1453765]: < ACL Data TX: Handle 39 flags 0x00 dlen 9                                                    #116 10.580761
      ATT: Write Request (0x12) len 4
        Handle: 0x000d
          Data: 0100
> HCI Event: Number of Completed Packets (0x13) plen 5                                                             #117 10.747026
        Num handles: 1
        Handle: 39 Address: DF:A9:FF:F6:B1:1A (OUI DF-A9-FF)
        Count: 1
        #116: len 9 (0 Kb/s)
        Latency: 166 msec (46-174 msec ~158 msec)
> ACL Data RX: Handle 39 flags 0x02 dlen 5                                                                         #118 10.747029
      ATT: Write Response (0x13) len 0
zephyr.exe[1453765]: < HCI Command: Host Number of Completed Packets (0x03|0x0035) plen 5                          #119 10.760829
        Num handles: 1
        Handle: 39 Address: DF:A9:FF:F6:B1:1A (OUI DF-A9-FF)
        Count: 1
zephyr.exe[1453765]: < ACL Data TX: Handle 39 flags 0x00 dlen 16                                                   #120 11.310778
      LE L2CAP: Connection Parameter Update Request (0x12) ident 1 len 8
        Min interval: 24
        Max interval: 40
        Peripheral latency: 0
        Timeout multiplier: 42
> HCI Event: Number of Completed Packets (0x13) plen 5                                                             #121 11.447025
        Num handles: 1
        Handle: 39 Address: DF:A9:FF:F6:B1:1A (OUI DF-A9-FF)
        Count: 1
        #120: len 16 (0 Kb/s)
        Latency: 136 msec (46-174 msec ~147 msec)
> ACL Data RX: Handle 39 flags 0x02 dlen 10                                                                        #122 11.447281
      LE L2CAP: Connection Parameter Update Response (0x13) ident 1 len 2
        Result: Connection Parameters accepted (0x0000)
zephyr.exe[1453765]: < HCI Command: Host Number of Completed Packets (0x03|0x0035) plen 5                          #123 11.461140
        Num handles: 1
        Handle: 39 Address: DF:A9:FF:F6:B1:1A (OUI DF-A9-FF)
        Count: 1
> HCI Event: Disconnect Complete (0x05) plen 4                                                                     #124 11.972095
        Status: Success (0x00)
        Handle: 39 Address: DF:A9:FF:F6:B1:1A (OUI DF-A9-FF)
        Reason: Remote User Terminated Connection (0x13)
zephyr.exe[1453765]: < HCI Command: LE Set Extended Advertising Parameters (0x08|0x0036) plen 25                   #125 12.630653
        Handle: 0x00
        Properties: 0x0013
          Connectable
          Scannable
          Use legacy advertising PDUs: ADV_IND
        Min advertising interval: 100.000 msec (0x00a0)
        Max advertising interval: 150.000 msec (0x00f0)
        Channel map: 37, 38, 39 (0x07)
        Own address type: Random (0x01)
        Peer address type: Public (0x00)
        Peer address: 00:00:00:00:00:00 (OUI 00-00-00)
        Filter policy: Allow Scan Request from Any, Allow Connect Request from Any (0x00)
        TX power: Host has no preference (0x7f)
        Primary PHY: LE 1M (0x01)
        Secondary max skip: 0x00
        Secondary PHY: LE 1M (0x01)
        SID: 0x00
        Scan request notifications: Disabled (0x00)
> HCI Event: Command Complete (0x0e) plen 5                                                                        #126 12.631573
      LE Set Extended Advertising Parameters (0x08|0x0036) ncmd 1
        Status: Success (0x00)
        TX power (selected): 0 dbm (0x00)
zephyr.exe[1453765]: < HCI Command: LE Set Advertising Set Random Address (0x08|0x0035) plen 7                     #127 12.640539
        Advertising handle: 0x00
        Advertising random address: D5:B6:CC:31:DB:3B (Static)
> HCI Event: Command Complete (0x0e) plen 4                                                                        #128 12.641102
      LE Set Advertising Set Random Address (0x08|0x0035) ncmd 1
        Status: Success (0x00)
zephyr.exe[1453765]: < HCI Command: LE Set Extended Advertising Data (0x08|0x0037) plen 22                         #129 12.660546
        Handle: 0x00
        Operation: Complete extended advertising data (0x03)
        Fragment preference: Minimize fragmentation (0x01)
        Data length: 0x12
        Flags: 0x04
          BR/EDR Not Supported
        Name (complete): Tester_F6B11A
> HCI Event: Command Complete (0x0e) plen 4                                                                        #130 12.661314
      LE Set Extended Advertising Data (0x08|0x0037) ncmd 1
        Status: Success (0x00)
zephyr.exe[1453765]: < HCI Command: LE Set Extended Scan Response Data (0x08|0x0038) plen 4                        #131 12.680561
        Handle: 0x00
        Operation: Complete scan response data (0x03)
        Fragment preference: Minimize fragmentation (0x01)
        Data length: 0x00
> HCI Event: Command Complete (0x0e) plen 4                                                                        #132 12.681062
      LE Set Extended Scan Response Data (0x08|0x0038) ncmd 1
        Status: Success (0x00)
zephyr.exe[1453765]: < HCI Command: LE Set Extended Advertising Enable (0x08|0x0039) plen 6                        #133 12.700641
        Extended advertising: Enabled (0x01)
        Number of sets: 1 (0x01)
        Entry 0
          Handle: 0x00
          Duration: 0 ms (0x00)
          Max ext adv events: 0
> HCI Event: Command Complete (0x0e) plen 4                                                                        #134 12.701230
      LE Set Extended Advertising Enable (0x08|0x0039) ncmd 1
        Status: Success (0x00)
> HCI Event: LE Meta Event (0x3e) plen 31                                                                          #135 12.805578
      LE Enhanced Connection Complete (0x0a)
        Status: Success (0x00)
        Handle: 57
        Role: Peripheral (0x01)
        Peer address type: Public (0x00)
        Peer address: DF:A9:FF:F6:B1:1A (OUI DF-A9-FF)
        Local resolvable private address: 00:00:00:00:00:00 (Non-Resolvable)
        Peer resolvable private address: 00:00:00:00:00:00 (Non-Resolvable)
        Connection interval: 87.50 msec (0x0046)
        Connection latency: 0 (0x0000)
        Supervision timeout: 20000 msec (0x07d0)
        Central clock accuracy: 0x01
> HCI Event: LE Meta Even