Bluetooth monitor ver 5.72
btmon[153476]: = Note: Linux version 6.14.0-35-generic (x86_64)                                                          0.546855
btmon[153476]: = Note: Bluetooth subsystem version 2.22                                                                  0.546857
= New Index: 00:00:00:00:00:00 (Primary,UART,hci1)                                                                       0.546858
= New Index: 48:5F:99:8E:E0:64 (Primary,USB,hci0)                                                                        0.546858
= Open Index: 00:00:00:00:00:00                                                                                          1.060715
= Index Info: 00:00:00:00:00:00 (Nordic Semiconductor ASA)                                                               1.060747
zephyr.exe[153478]: @ USER Open: main (privileged) version 2.22                                                 {0x0001} 1.060754
zephyr.exe[153478]: < HCI Command: Reset (0x03|0x0003) plen 0                                                         #1 1.061877
> HCI Event: Command Complete (0x0e) plen 4                                                                           #2 1.062440
      Reset (0x03|0x0003) ncmd 1
        Status: Success (0x00)
zephyr.exe[153478]: < HCI Command: Read Local Supported Features (0x04|0x0003) plen 0                                 #3 1.080622
> HCI Event: Command Complete (0x0e) plen 12                                                                          #4 1.081105
      Read Local Supported Features (0x04|0x0003) ncmd 1
        Status: Success (0x00)
        Features: 0x00 0x00 0x00 0x00 0x60 0x00 0x00 0x00
          BR/EDR Not Supported
          LE Supported (Controller)
zephyr.exe[153478]: < HCI Command: Read Local Version Information (0x04|0x0001) plen 0                                #5 1.100225
> HCI Event: Command Complete (0x0e) plen 12                                                                          #6 1.100839
      Read Local Version Information (0x04|0x0001) ncmd 1
        Status: Success (0x00)
        HCI version: Reserved (0x0e) - Revision 12520 (0x30e8)
        LMP version: Reserved (0x0e) - Subversion 12520 (0x30e8)
        Manufacturer: Nordic Semiconductor ASA (89)
zephyr.exe[153478]: < HCI Command: Read Local Supported Commands (0x04|0x0002) plen 0                                 #7 1.120200
> HCI Event: Command Complete (0x0e) plen 68                                                                          #8 1.121254
      Read Local Supported Commands (0x04|0x0002) ncmd 1
        Status: Success (0x00)
        Commands: 119 entries
          Disconnect (Octet 0 - Bit 5)
          Read Remote Version Information (Octet 2 - Bit 7)
          Set Event Mask (Octet 5 - Bit 6)
          Reset (Octet 5 - Bit 7)
          Read Connection Accept Timeout (Octet 7 - Bit 2)
          Write Connection Accept Timeout (Octet 7 - Bit 3)
          Read Transmit Power Level (Octet 10 - Bit 2)
          Set Controller To Host Flow Control (Octet 10 - Bit 5)
          Host Buffer Size (Octet 10 - Bit 6)
          Host Number of Completed Packets (Octet 10 - Bit 7)
          Read Local Version Information (Octet 14 - Bit 3)
          Read Local Supported Features (Octet 14 - Bit 5)
          Read BD ADDR (Octet 15 - Bit 1)
          Read RSSI (Octet 15 - Bit 5)
          Set Event Mask Page 2 (Octet 22 - Bit 2)
          LE Set Event Mask (Octet 25 - Bit 0)
          LE Read Buffer Size (Octet 25 - Bit 1)
          LE Read Local Supported Features (Octet 25 - Bit 2)
          LE Set Random Address (Octet 25 - Bit 4)
          LE Set Advertising Parameters (Octet 25 - Bit 5)
          LE Read Advertising Channel TX Power (Octet 25 - Bit 6)
          LE Set Advertising Data (Octet 25 - Bit 7)
          LE Set Scan Response Data (Octet 26 - Bit 0)
          LE Set Advertise Enable (Octet 26 - Bit 1)
          LE Set Scan Parameters (Octet 26 - Bit 2)
          LE Set Scan Enable (Octet 26 - Bit 3)
          LE Create Connection (Octet 26 - Bit 4)
          LE Create Connection Cancel (Octet 26 - Bit 5)
          LE Read Accept List Size (Octet 26 - Bit 6)
          LE Clear Accept List (Octet 26 - Bit 7)
          LE Add Device To Accept List (Octet 27 - Bit 0)
          LE Remove Device From Accept List (Octet 27 - Bit 1)
          LE Connection Update (Octet 27 - Bit 2)
          LE Set Host Channel Classification (Octet 27 - Bit 3)
          LE Read Channel Map (Octet 27 - Bit 4)
          LE Read Remote Used Features (Octet 27 - Bit 5)
          LE Encrypt (Octet 27 - Bit 6)
          LE Rand (Octet 27 - Bit 7)
          LE Start Encryption (Octet 28 - Bit 0)
          LE Long Term Key Request Reply (Octet 28 - Bit 1)
          LE Long Term Key Request Neg Reply (Octet 28 - Bit 2)
          LE Read Supported States (Octet 28 - Bit 3)
          LE Receiver Test (Octet 28 - Bit 4)
          LE Transmitter Test (Octet 28 - Bit 5)
          LE Test End (Octet 28 - Bit 6)
          Read Authenticated Payload Timeout (Octet 32 - Bit 4)
          Write Authenticated Payload Timeout (Octet 32 - Bit 5)
          LE Set Data Length (Octet 33 - Bit 6)
          LE Read Suggested Default Data Length (Octet 33 - Bit 7)
          LE Write Suggested Default Data Length (Octet 34 - Bit 0)
          LE Add Device To Resolving List (Octet 34 - Bit 3)
          LE Remove Device From Resolving List (Octet 34 - Bit 4)
          LE Clear Resolving List (Octet 34 - Bit 5)
          LE Read Resolving List Size (Octet 34 - Bit 6)
          LE Set Address Resolution Enable (Octet 35 - Bit 1)
          LE Set Resolvable Private Address Timeout (Octet 35 - Bit 2)
          LE Read Maximum Data Length (Octet 35 - Bit 3)
          LE Read PHY (Octet 35 - Bit 4)
          LE Set Default PHY (Octet 35 - Bit 5)
          LE Set PHY (Octet 35 - Bit 6)
          LE Enhanced Receiver Test (Octet 35 - Bit 7)
          LE Enhanced Transmitter Test (Octet 36 - Bit 0)
          LE Set Advertising Set Random Address (Octet 36 - Bit 1)
          LE Set Extended Advertising Parameters (Octet 36 - Bit 2)
          LE Set Extended Advertising Data (Octet 36 - Bit 3)
          LE Set Extended Scan Response Data (Octet 36 - Bit 4)
          LE Set Extended Advertising Enable (Octet 36 - Bit 5)
          LE Read Maximum Advertising Data Length (Octet 36 - Bit 6)
          LE Read Number of Supported Advertising Sets (Octet 36 - Bit 7)
          LE Remove Advertising Set (Octet 37 - Bit 0)
          LE Clear Advertising Sets (Octet 37 - Bit 1)
          LE Set Periodic Advertising Parameters (Octet 37 - Bit 2)
          LE Set Periodic Advertising Data (Octet 37 - Bit 3)
          LE Set Periodic Advertising Enable (Octet 37 - Bit 4)
          LE Set Extended Scan Parameters (Octet 37 - Bit 5)
          LE Set Extended Scan Enable (Octet 37 - Bit 6)
          LE Extended Create Connection (Octet 37 - Bit 7)
          LE Periodic Advertising Create Sync (Octet 38 - Bit 0)
          LE Periodic Advertising Create Sync Cancel (Octet 38 - Bit 1)
          LE Periodic Advertising Terminate Sync (Octet 38 - Bit 2)
          LE Add Device To Periodic Advertiser List (Octet 38 - Bit 3)
          LE Remove Device From Periodic Advertiser List (Octet 38 - Bit 4)
          LE Clear Periodic Advertiser List (Octet 38 - Bit 5)
          LE Read Periodic Advertiser List Size (Octet 38 - Bit 6)
          LE Read Transmit Power (Octet 38 - Bit 7)
          LE Read RF Path Compensation (Octet 39 - Bit 0)
          LE Write RF Path Compensation (Octet 39 - Bit 1)
          LE Set Privacy Mode (Octet 39 - Bit 2)
          LE Periodic Advertising Receive Enable (Octet 40 - Bit 5)
          LE Periodic Advertising Sync Transfer (Octet 40 - Bit 6)
          LE Periodic Advertising Set Info Transfer (Octet 40 - Bit 7)
          LE Periodic Advertising Sync Transfer Parameters (Octet 41 - Bit 0)
          LE Set Default Periodic Advertisng Sync Transfer Parameters (Octet 41 - Bit 1)
          LE Read Buffer v2 (Octet 41 - Bit 5)
          LE Read ISO TX Sync (Octet 41 - Bit 6)
          LE Set Connected Isochronous Group Parameters (Octet 41 - Bit 7)
          LE Set Connected Isochronous Group Parameters Test (Octet 42 - Bit 0)
          LE Create Connected Isochronous Stream (Octet 42 - Bit 1)
          LE Remove Connected Isochronous Group (Octet 42 - Bit 2)
          LE Accept Connected Isochronous Stream Request (Octet 42 - Bit 3)
          LE Reject Connected Isochronous Stream Request (Octet 42 - Bit 4)
          LE Create Broadcast Isochronous Group (Octet 42 - Bit 5)
          LE Create Broadcast Isochronous Group Test (Octet 42 - Bit 6)
          LE Terminate Broadcast Isochronous Group (Octet 42 - Bit 7)
          LE Broadcast Isochronous Group Create Sync (Octet 43 - Bit 0)
          LE Broadcast Isochronous Group Terminate Sync (Octet 43 - Bit 1)
          LE Request Peer SCA (Octet 43 - Bit 2)
          LE Setup Isochronous Data Path (Octet 43 - Bit 3)
          LE Remove Isochronous Data Path (Octet 43 - Bit 4)
          LE Isochronous Transmit Test (Octet 43 - Bit 5)
          LE Isochronous Receive Test (Octet 43 - Bit 6)
          LE Isochronous Read Test Counters (Octet 43 - Bit 7)
          LE Isochronous Read Test Counters (Octet 44 - Bit 0)
          LE Set Host Feature (Octet 44 - Bit 1)
          Octet 44 - Bit 2 
          Octet 45 - Bit 6 
          Octet 46 - Bit 0 
          Octet 46 - Bit 1 
          Octet 46 - Bit 2 
zephyr.exe[153478]: < HCI Command: Host Buffer Size (0x03|0x0033) plen 7                                              #9 1.140166
        ACL MTU: 255  ACL max packet: 16
        SCO MTU: 0    SCO max packet: 0
> HCI Event: Command Complete (0x0e) plen 4                                                                          #10 1.140793
      Host Buffer Size (0x03|0x0033) ncmd 1
        Status: Success (0x00)
zephyr.exe[153478]: < HCI Command: Set Controller To Host Flow Control (0x03|0x0031) plen 1                          #11 1.160155
        Flow control: ACL Data Packets (0x01)
> HCI Event: Command Complete (0x0e) plen 4                                                                          #12 1.160632
      Set Controller To Host Flow Control (0x03|0x0031) ncmd 1
        Status: Success (0x00)
zephyr.exe[153478]: < HCI Command: LE Read Local Supported Features (0x08|0x0003) plen 0                             #13 1.180199
> HCI Event: Command Complete (0x0e) plen 12                                                                         #14 1.180800
      LE Read Local Supported Features (0x08|0x0003) ncmd 1
        Status: Success (0x00)
        Features: 0xfd 0x79 0x00 0xf7 0x30 0x01 0x00 0x00
          LE Encryption
          Extended Reject Indication
          Peripheral-initiated Features Exchange
          LE Ping
          LE Data Packet Length Extension
          LL Privacy
          Extended Scanner Filter Policies
          LE 2M PHY
          LE Coded PHY
          LE Extended Advertising
          LE Periodic Advertising
          Channel Selection Algorithm #2
          Periodic Advertising Sync Transfer - Sender
          Periodic Advertising Sync Transfer - Recipient
          Sleep Clock Accuracy Updates
          Connected Isochronous Stream - Central
          Connected Isochronous Stream - Peripheral
          Isochronous Broadcaster
          Synchronized Receiver
          Periodic Advertising ADI support
          Connection Subrating
          Unknown features (0x0000010000000000)
zephyr.exe[153478]: < HCI Command: LE Set Host Feature (0x08|0x0074) plen 2                                          #15 1.200208
        Bit Number: 32
          Connected Isochronous Stream (Host Support)
        Bit Value: 1
> HCI Event: Command Complete (0x0e) plen 4                                                                          #16 1.200705
      LE Set Host Feature (0x08|0x0074) ncmd 1
        Status: Success (0x00)
zephyr.exe[153478]: < HCI Command: LE Read Buffer v2 (0x08|0x0060) plen 0                                            #17 1.220165
> HCI Event: Command Complete (0x0e) plen 10                                                                         #18 1.220581
      LE Read Buffer v2 (0x08|0x0060) ncmd 1
        Status: Success (0x00)
        ACL MTU: 27
        ACL max packet: 3
        ISO MTU: 318
        ISO max packet: 3
zephyr.exe[153478]: < HCI Command: LE Read Maximum Advertising Data Length (0x08|0x003a) plen 0                      #19 1.240200
> HCI Event: Command Complete (0x0e) plen 6                                                                          #20 1.240678
      LE Read Maximum Advertising Data Length (0x08|0x003a) ncmd 1
        Status: Success (0x00)
        Max length: 1650
zephyr.exe[153478]: < HCI Command: LE Read Supported States (0x08|0x001c) plen 0                                     #21 1.260156
> HCI Event: Command Complete (0x0e) plen 12                                                                         #22 1.260675
      LE Read Supported States (0x08|0x001c) ncmd 1
        Status: Success (0x00)
        States: 0x000003ff3e0306ff
          Non-connectable Advertising State
          Scannable Advertising State
          Connectable Advertising State
          High Duty Cycle Directed Advertising State
          Passive Scanning State
          Active Scanning State
          Initiating State
            and Connection State (Central Role)
          Connection State (Peripheral Role)
          Scannable Advertising State
            and Passive Scanning State
          Connectable Advertising State
            and Passive Scanning State
          Non-connectable Advertising State
            and Initiating State
          Scannable Advertising State
            and Initiating State
          Active Scanning State
            and Connection State (Central Role)
          Passive Scanning State
            and Connection State (Peripheral Role)
          Active Scanning State
            and Connection State (Peripheral Role)
          Initiating State
            and Connection State (Central Role)
            and Central Role & Central Role
          Low Duty Cycle Directed Advertising State
          Connectable Advertising State
            and Initiating State
            and Central Role & Peripheral Role
          High Duty Cycle Directed Advertising State
            and Initiating State
            and Central Role & Peripheral Role
          Low Duty Cycle Directed Advertising State
            and Initiating State
            and Central Role & Peripheral Role
          Connectable Advertising State
            and Connection State (Central Role)
            and Central Role & Peripheral Role
          High Duty Cycle Directed Advertising State
            and Connection State (Central Role)
            and Central Role & Peripheral Role
          Low Duty Cycle Directed Advertising State
            and Connection State (Central Role)
            and Central Role & Peripheral Role
          Connectable Advertising State
            and Connection State (Peripheral Role)
            and Central Role & Peripheral Role
          High Duty Cycle Directed Advertising State
            and Connection State (Peripheral Role)
            and Peripheral Role & Peripheral Role
          Low Duty Cycle Directed Advertising State
            and Connection State (Peripheral Role)
            and Peripheral Role & Peripheral Role
          Initiating State
            and Connection State (Peripheral Role)
            and Central Role & Peripheral Role
zephyr.exe[153478]: < HCI Command: LE Read Maximum Data Length (0x08|0x002f) plen 0                                  #23 1.280194
> HCI Event: Command Complete (0x0e) plen 12                                                                         #24 1.280662
      LE Read Maximum Data Length (0x08|0x002f) ncmd 1
        Status: Success (0x00)
        Max TX octets: 251
        Max TX time: 2704
        Max RX octets: 251
        Max RX time: 2704
zephyr.exe[153478]: < HCI Command: LE Write Suggested Default Data Length (0x08|0x0024) plen 4                       #25 1.300193
        TX octets: 251
        TX time: 2704
> HCI Event: Command Complete (0x0e) plen 4                                                                          #26 1.300700
      LE Write Suggested Default Data Length (0x08|0x0024) ncmd 1
        Status: Success (0x00)
zephyr.exe[153478]: < HCI Command: LE Set Resolvable Private Address Timeout (0x08|0x002e) plen 2                    #27 1.320204
        Timeout: 900 seconds
> HCI Event: Command Complete (0x0e) plen 4                                                                          #28 1.320730
      LE Set Resolvable Private Address Timeout (0x08|0x002e) ncmd 1
        Status: Success (0x00)
zephyr.exe[153478]: < HCI Command: LE Read Resolving List Size (0x08|0x002a) plen 0                                  #29 1.340206
> HCI Event: Command Complete (0x0e) plen 5                                                                          #30 1.340746
      LE Read Resolving List Size (0x08|0x002a) ncmd 1
        Status: Success (0x00)
        Size: 8
zephyr.exe[153478]: < HCI Command: LE Set Event Mask (0x08|0x0001) plen 8                                            #31 1.360175
        Mask: 0x000002023f87fa5e
          LE Advertising Report
          LE Connection Update Complete
          LE Read Remote Used Features Complete
          LE Long Term Key Request
          LE Data Length Change
          LE Enhanced Connection Complete
          LE PHY Update Complete
          LE Extended Advertising Report
          LE Periodic Advertising Sync Established
          LE Periodic Advertising Report
          LE Periodic Advertising Sync Lost
          LE Extended Scan Timeout
          LE Extended Advertising Set Terminated
          LE Scan Request Received
          LE Periodic Advertising Sync Transfer Rvc
          LE CIS Established
          LE CIS Request
          LE Create BIG Complete
          LE Terminate BIG Complete
          LE BIG Sync Estabilished Complete
          LE BIG Sync Lost
          LE BIG Info Advertising Report
          Unknown mask (0x0000020000000000)
> HCI Event: Command Complete (0x0e) plen 4                                                                          #32 1.360796
      LE Set Event Mask (0x08|0x0001) ncmd 1
        Status: Success (0x00)
zephyr.exe[153478]: < HCI Command: Set Event Mask (0x03|0x0001) plen 8                                               #33 1.380200
        Mask: 0x2000800002008890
          Disconnection Complete
          Encryption Change
          Read Remote Version Information Complete
          Hardware Error
          Data Buffer Overflow
          Encryption Key Refresh Complete
          LE Meta
> HCI Event: Command Complete (0x0e) plen 4                                                                          #34 1.380714
      Set Event Mask (0x03|0x0001) ncmd 1
        Status: Success (0x00)
zephyr.exe[153478]: < HCI Command: Read BD ADDR (0x04|0x0009) plen 0                                                 #35 1.400199
> HCI Event: Command Complete (0x0e) plen 10                                                                         #36 1.400686
      Read BD ADDR (0x04|0x0009) ncmd 1
        Status: Success (0x00)
        Address: 00:00:00:00:00:00 (OUI 00-00-00)
zephyr.exe[153478]: < HCI Command: LE Set Random Address (0x08|0x0005) plen 6                                        #37 1.420211
        Address: D5:B6:CC:31:DB:3B (Static)
> HCI Event: Command Complete (0x0e) plen 4                                                                          #38 1.420768
      LE Set Random Address (0x08|0x0005) ncmd 1
        Status: Success (0x00)
zephyr.exe[153478]: < HCI Command: LE Set Random Address (0x08|0x0005) plen 6                                        #39 1.520209
        Address: 48:61:8E:DB:C6:F9 (Resolvable)
> HCI Event: Command Complete (0x0e) plen 4                                                                          #40 1.520785
      LE Set Random Address (0x08|0x0005) ncmd 1
        Status: Success (0x00)
zephyr.exe[153478]: < HCI Command: LE Set Extended Advertising Parameters (0x08|0x0036) plen 25                      #41 7.480819
        Handle: 0x00
        Properties: 0x0013
          Connectable
          Scannable
          Use legacy advertising PDUs: ADV_IND
        Min advertising interval: 100.000 msec (0x00a0)
        Max advertising interval: 150.000 msec (0x00f0)
        Channel map: 37, 38, 39 (0x07)
        Own address type: Random (0x01)
        Peer address type: Public (0x00)
        Peer address: 00:00:00:00:00:00 (OUI 00-00-00)
        Filter policy: Allow Scan Request from Any, Allow Connect Request from Any (0x00)
        TX power: Host has no preference (0x7f)
        Primary PHY: LE 1M (0x01)
        Secondary max skip: 0x00
        Secondary PHY: LE 1M (0x01)
        SID: 0x00
        Scan request notifications: Disabled (0x00)
> HCI Event: Command Complete (0x0e) plen 5                                                                          #42 7.481612
      LE Set Extended Advertising Parameters (0x08|0x0036) ncmd 1
        Status: Success (0x00)
        TX power (selected): 0 dbm (0x00)
zephyr.exe[153478]: < HCI Command: LE Set Advertising Set Random Address (0x08|0x0035) plen 7                        #43 7.500191
        Advertising handle: 0x00
        Advertising random address: D5:B6:CC:31:DB:3B (Static)
> HCI Event: Command Complete (0x0e) plen 4                                                                          #44 7.500755
      LE Set Advertising Set Random Address (0x08|0x0035) ncmd 1
        Status: Success (0x00)
zephyr.exe[153478]: < HCI Command: LE Set Extended Advertising Data (0x08|0x0037) plen 22                            #45 7.520251
        Handle: 0x00
        Operation: Complete extended advertising data (0x03)
        Fragment preference: Minimize fragmentation (0x01)
        Data length: 0x12
        Flags: 0x04
          BR/EDR Not Supported
        Name (complete): Tester_F6B11A
> HCI Event: Command Complete (0x0e) plen 4                                                                          #46 7.520972
      LE Set Extended Advertising Data (0x08|0x0037) ncmd 1
        Status: Success (0x00)
zephyr.exe[153478]: < HCI Command: LE Set Extended Scan Response Data (0x08|0x0038) plen 4                           #47 7.540254
        Handle: 0x00
        Operation: Complete scan response data (0x03)
        Fragment preference: Minimize fragmentation (0x01)
        Data length: 0x00
> HCI Event: Command Complete (0x0e) plen 4                                                                          #48 7.540805
      LE Set Extended Scan Response Data (0x08|0x0038) ncmd 1
        Status: Success (0x00)
zephyr.exe[153478]: < HCI Command: LE Set Extended Advertising Enable (0x08|0x0039) plen 6                           #49 7.560235
        Extended advertising: Enabled (0x01)
        Number of sets: 1 (0x01)
        Entry 0
          Handle: 0x00
          Duration: 0 ms (0x00)
          Max ext adv events: 0
> HCI Event: Command Complete (0x0e) plen 4                                                                          #50 7.560741
      LE Set Extended Advertising Enable (0x08|0x0039) ncmd 1
        Status: Success (0x00)
> HCI Event: LE Meta Event (0x3e) plen 31                                                                            #51 7.670483
      LE Enhanced Connection Complete (0x0a)
        Status: Success (0x00)
        Handle: 993
        Role: Peripheral (0x01)
        Peer address type: Public (0x00)
        Peer address: DF:A9:FF:F6:B1:1A (OUI DF-A9-FF)
        Local resolvable private address: 00:00:00:00:00:00 (Non-Resolvable)
        Peer resolvable private address: 00:00:00:00:00:00 (Non-Resolvable)
        Connection interval: 87.50 msec (0x0046)
        Connection latency: 0 (0x0000)
        Supervision timeout: 20000 msec (0x07d0)
        Central clock accuracy: 0x01
> HCI Event: LE Meta Event (0x3e) plen 6                                                                             #52 7.670578
      LE Advertising Set Terminated (0x12)
        Status: Success (0x00)
        Handle: 0
        Connection handle: 993
        Number of completed extended advertising events: 0
zephyr.exe[153478]: < HCI Command: LE Read Remote Used Features (0x08|0x0016) plen 2                                 #53 7.681411
        Handle: 993 Address: DF:A9:FF:F6:B1:1A (OUI DF-A9-FF)
> HCI Event: Command Status (0x0f) plen 4                                                                            #54 7.681866
      LE Read Remote Used Features (0x08|0x0016) ncmd 1
        Status: Success (0x00)
> HCI Event: LE Meta Event (0x3e) plen 12                                                                            #55 7.934324
      LE Read Remote Used Features (0x04)
        Status: Success (0x00)
        Handle: 993 Address: DF:A9:FF:F6:B1:1A (OUI DF-A9-FF)
        Features: 0x2d 0x49 0x00 0xf7 0x67 0xd8 0x00 0x00
          LE Encryption
          Extended Reject Indication
          Peripheral-initiated Features Exchange
          LE Data Packet Length Extension
          LE 2M PHY
          LE Coded PHY
          Channel Selection Algorithm #2
          Periodic Advertising Sync Transfer - Sender
          Periodic Advertising Sync Transfer - Recipient
          Sleep Clock Accuracy Updates
          Connected Isochronous Stream - Central
          Connected Isochronous Stream - Peripheral
          Isochronous Broadcaster
          Synchronized Receiver
          Connected Isochronous Stream (Host Support)
          LE Power Control Request
          LE Power Control Request
          Connection Subrating
          Connection Subrating (Host Support)
          Unknown features (0x0000d80000000000)
> ACL Data RX: Handle 993 flags 0x02 dlen 13                                                                         #56 8.371766
      ATT: Find By Type Value Request (0x06) len 8
        Handle range: 0x0001-0xffff
        Attribute type: Primary Service (0x2800)
          UUID: Generic Access Profile (0x1800)
zephyr.exe[153478]: < HCI Command: Host Number of Completed Packets (0x03|0x0035) plen 5                             #57 8.380480
        Num handles: 1
        Handle: 993 Address: DF:A9:FF:F6:B1:1A (OUI DF-A9-FF)
        Count: 1
zephyr.exe[153478]: < ACL Data TX: Handle 993 flags 0x00 dlen 9                                                      #58 8.380633
      ATT: Find By Type Value Response (0x07) len 4
        Handle range: 0x000b-0x0013
> HCI Event: Number of Completed Packets (0x13) plen 5                                                               #59 8.546564
        Num handles: 1
        Handle: 993 Address: DF:A9:FF:F6:B1:1A (OUI DF-A9-FF)
        Count: 1
        #58: len 9 (0 Kb/s)
        Latency: 165 msec (165-165 msec ~165 msec)
> ACL Data RX: Handle 993 flags 0x02 dlen 13                                                                         #60 8.546787
      ATT: Find By Type Value Request (0x06) len 8
        Handle range: 0x0014-0xffff
        Attribute type: Primary Service (0x2800)
          UUID: Generic Access Profile (0x1800)
zephyr.exe[153478]: < HCI Command: Host Number of Completed Packets (0x03|0x0035) plen 5                             #61 8.560526
        Num handles: 1
        Handle: 993 Address: DF:A9:FF:F6:B1:1A (OUI DF-A9-FF)
        Count: 1
zephyr.exe[153478]: < ACL Data TX: Handle 993 flags 0x00 dlen 9                                                      #62 8.560545
      ATT: Error Response (0x01) len 4
        Find By Type Value Request (0x06)
        Handle: 0x0014
        Error: Attribute Not Found (0x0a)
> HCI Event: Number of Completed Packets (0x13) plen 5                                                               #63 8.721525
        Num handles: 1
        Handle: 993 Address: DF:A9:FF:F6:B1:1A (OUI DF-A9-FF)
        Count: 1
        #62: len 9 (0 Kb/s)
        Latency: 160 msec (160-165 msec ~163 msec)
> ACL Data RX: Handle 993 flags 0x02 dlen 11                                                                         #64 8.721838
      ATT: Read By Type Request (0x08) len 6
        Handle range: 0x000b-0x0013
        Attribute type: Characteristic (0x2803)
zephyr.exe[153478]: < HCI Command: Host Number of Completed Packets (0x03|0x0035) plen 5                             #65 8.740539
        Num handles: 1
        Handle: 993 Address: DF:A9:FF:F6:B1:1A (OUI DF-A9-FF)
        Count: 1
zephyr.exe[153478]: < ACL Data TX: Handle 993 flags 0x00 dlen 20                                                     #66 8.740611
      ATT: Read By Type Response (0x09) len 15
        Attribute data length: 7
        Attribute data list: 2 entries
        Handle: 0x000c
        Value: 0a0d00002a
            Properties: 0x0a
              Read (0x02)
              Write (0x08)
            Value Handle: 0x000d
            Value UUID: Device Name (0x2a00)
        Handle: 0x000e
        Value: 0a0f00012a
            Properties: 0x0a
              Read (0x02)
              Write (0x08)
            Value Handle: 0x000f
            Value UUID: Appearance (0x2a01)
> HCI Event: Number of Completed Packets (0x13) plen 5                                                               #67 8.896676
        Num handles: 1
        Handle: 993 Address: DF:A9:FF:F6:B1:1A (OUI DF-A9-FF)
        Count: 1
        #66: len 20 (1 Kb/s)
        Latency: 156 msec (156-165 msec ~159 msec)
> ACL Data RX: Handle 993 flags 0x02 dlen 11                                                                         #68 8.896869
      ATT: Read By Type Request (0x08) len 6
        Handle range: 0x000f-0x0013
        Attribute type: Characteristic (0x2803)
zephyr.exe[153478]: < HCI Command: Host Number of Completed Packets (0x03|0x0035) plen 5                             #69 8.900942
        Num handles: 1
        Handle: 993 Address: DF:A9:FF:F6:B1:1A (OUI DF-A9-FF)
        Count: 1
zephyr.exe[153478]: < ACL Data TX: Handle 993 flags 0x00 dlen 20                                                     #70 8.901017
      ATT: Read By Type Response (0x09) len 15
        Attribute data length: 7
        Attribute data list: 2 entries
        Handle: 0x0010
        Value: 021100a62a
            Properties: 0x02
              Read (0x02)
            Value Handle: 0x0011
            Value UUID: Central Address Resolution (0x2aa6)
        Handle: 0x0012
        Value: 021300042a
            Properties: 0x02
              Read (0x02)
            Value Handle: 0x0013
            Value UUID: Peripheral Preferred Connection Parameters (0x2a04)
> HCI Event: Number of Completed Packets (0x13) plen 5                                                               #71 9.071506
        Num handles: 1
        Handle: 993 Address: DF:A9:FF:F6:B1:1A (OUI DF-A9-FF)
        Count: 1
        #70: len 20 (0 Kb/s)
        Latency: 170 msec (156-170 msec ~165 msec)
> ACL Data RX: Handle 993 flags 0x02 dlen 11                                                                         #72 9.071796
      ATT: Read By Type Request (0x08) len 6
        Handle range: 0x0013-0x0013
        Attribute type: Characteristic (0x2803)
zephyr.exe[153478]: < HCI Command: Host Number of Completed Packets (0x03|0x0035) plen 5                             #73 9.080441
        Num handles: 1
        Handle: 993 Address: DF:A9:FF:F6:B1:1A (OUI DF-A9-FF)
        Count: 1
zephyr.exe[153478]: < ACL Data TX: Handle 993 flags 0x00 dlen 9                                                      #74 9.080469
      ATT: Error Response (0x01) len 4
        Read By Type Request (0x08)
        Handle: 0x0013
        Error: Attribute Not Found (0x0a)
> HCI Event: Number of Completed Packets (0x13) plen 5                                                               #75 9.246578
        Num handles: 1
        Handle: 993 Address: DF:A9:FF:F6:B1:1A (OUI DF-A9-FF)
        Count: 1
        #74: len 9 (0 Kb/s)
        Latency: 166 msec (156-170 msec ~165 msec)
> ACL Data RX: Handle 993 flags 0x02 dlen 11                                                                         #76 9.246780
      SMP: Pairing Request (0x01) len 6
        IO capability: KeyboardDisplay (0x04)
        OOB data: Authentication data not present (0x00)
        Authentication requirement: Bonding, MITM, SC, No Keypresses (0x0d)
        Max encryption key size: 16
        Initiator key distribution: IdKey (0x02)
        Responder key distribution: IdKey (0x02)
zephyr.exe[153478]: < HCI Command: Host Number of Completed Packets (0x03|0x0035) plen 5                             #77 9.261037
        Num handles: 1
        Handle: 993 Address: DF:A9:FF:F6:B1:1A (OUI DF-A9-FF)
        Count: 1
zephyr.exe[153478]: < ACL Data TX: Handle 993 flags 0x00 dlen 11                                                     #78 9.261145
      SMP: Pairing Response (0x02) len 6
        IO capability: KeyboardDisplay (0x04)
        OOB data: Authentication data not present (0x00)
        Authentication requirement: Bonding, MITM, SC, No Keypresses (0x0d)
        Max encryption key size: 16
        Initiator key distribution: IdKey (0x02)
        Responder key distribution: IdKey (0x02)
> HCI Event: Number of Completed Packets (0x13) plen 5                                                               #79 9.421655
        Num handles: 1
        Handle: 993 Address: DF:A9:FF:F6:B1:1A (OUI DF-A9-FF)
        Count: 1
        #78: len 11 (0 Kb/s)
        Latency: 160 msec (156-170 msec ~163 msec)
> ACL Data RX: Handle 993 flags 0x02 dlen 27                                                                         #80 9.422031
> ACL Data RX: Handle 993 flags 0x01 dlen 27                                                                         #81 9.422570
> ACL Data RX: Handle 993 flags 0x01 dlen 15                                                                         #82 9.422950
      SMP: Pairing Public Key (0x0c) len 64
        X: fe72411b126d4b383fa5f0494c8f66a71af1477d9546bbd64c6157d2b050d61c
        Y: 2939d48d68e90d6e01fb1e45dd96042f12f203c3c097f9e7c1216bd14e82e875
zephyr.exe[153478]: < HCI Command: Host Number of Completed Packets (0x03|0x0035) plen 5                             #83 9.441251
        Num handles: 1
        Handle: 993 Address: DF:A9:FF:F6:B1:1A (OUI DF-A9-FF)
        Count: 1
zephyr.exe[153478]: < HCI Command: Host Number of Completed Packets (0x03|0x0035) plen 5                             #84 9.441317
        Num handles: 1
        Handle: 993 Address: DF:A9:FF:F6:B1:1A (OUI DF-A9-FF)
        Count: 1
zephyr.exe[153478]: < HCI Command: Host Number of Completed Packets (0x03|0x0035) plen 5                             #85 9.441666
        Num handles: 1
        Handle: 993 Address: DF:A9:FF:F6:B1:1A (OUI DF-A9-FF)
        Count: 1
zephyr.exe[153478]: < ACL Data TX: Handle 993 flags 0x00 dlen 27                                                     #86 9.441884
zephyr.exe[153478]: < ACL Data TX: Handle 993 flags 0x01 dlen 27                                                     #87 9.441901
zephyr.exe[153478]: < ACL Data TX: Handle 993 flags 0x01 dlen 15                                                     #88 9.441905
      SMP: Pairing Public Key (0x0c) len 64
        X: 68f6ada634ce84d11617383d57f070fe3445c38b33b569efa5eb771a0dc8aea5
        Y: 83c407aaa8337331fdc418e55085d75e6c1c6e5d42f8bf9c18fb5a2a7d4f31aa
> HCI Event: Number of Completed Packets (0x13) plen 5                                                               #89 9.509489
        Num handles: 1
        Handle: 993 Address: DF:A9:FF:F6:B1:1A (OUI DF-A9-FF)
        Count: 1
        #86: len 27 (3 Kb/s)
        Latency: 67 msec (67-170 msec ~115 msec)
> HCI Event: Number of Completed Packets (0x13) plen 5                                                               #90 9.510209
        Num handles: 1
        Handle: 993 Address: DF:A9:FF:F6:B1:1A (OUI DF-A9-FF)
        Count: 1
        #87: len 27 (3 Kb/s)
        Latency: 68 msec (67-170 msec ~91 msec)
zephyr.exe[153478]: < ACL Data TX: Handle 993 flags 0x00 dlen 21                                                     #91 9.520538
      SMP: Pairing Confirm (0x03) len 16
        Confim value: ba8188fbe51ef46f29b108bf9ebfb97c
> HCI Event: Number of Completed Packets (0x13) plen 5                                                               #92 9.596445
        Num handles: 1
        Handle: 993 Address: DF:A9:FF:F6:B1:1A (OUI DF-A9-FF)
        Count: 1
        #88: len 15 (0 Kb/s)
        Latency: 154 msec (67-170 msec ~123 msec)
> HCI Event: Number of Completed Packets (0x13) plen 5                                                               #93 9.684104
        Num handles: 1
        Handle: 993 Address: DF:A9:FF:F6:B1:1A (OUI DF-A9-FF)
        Count: 1
        #91: len 21 (1 Kb/s)
        Latency: 163 msec (67-170 msec ~143 msec)
> ACL Data RX: Handle 993 flags 0x02 dlen 21                                                                         #94 9.684455
      SMP: Pairing Random (0x04) len 16
        Random value: 6576a9aaed9e5b611f45a74e00e3c8ad
zephyr.exe[153478]: < HCI Command: Host Number of Completed Packets (0x03|0x0035) plen 5                             #95 9.701442
        Num handles: 1
        Handle: 993 Address: DF:A9:FF:F6:B1:1A (OUI DF-A9-FF)
        Count: 1
zephyr.exe[153478]: < ACL Data TX: Handle 993 flags 0x00 dlen 21                                                     #96 9.701524
      SMP: Pairing Random (0x04) len 16
        Random value: 555cc64d02679f89a05211af56d8b3da
> HCI Event: Number of Completed Packets (0x13) plen 5                                                               #97 9.858895
        Num handles: 1
        Handle: 993 Address: DF:A9:FF:F6:B1:1A (OUI DF-A9-FF)
        Count: 1
        #96: len 21 (1 Kb/s)
        Latency: 157 msec (67-170 msec ~150 msec)
> ACL Data RX: Handle 993 flags 0x02 dlen 21                                                                        #98 10.646689
      SMP: Pairing DHKey Check (0x0d) len 16
        E: 168fa49d6fef19657a6d2e78112e5b88
zephyr.exe[153478]: < HCI Command: Host Number of Completed Packets (0x03|0x0035) plen 5                            #99 10.660839
        Num handles: 1
        Handle: 993 Address: DF:A9:FF:F6:B1:1A (OUI DF-A9-FF)
        Count: 1
zephyr.exe[153478]: < ACL Data TX: Handle 993 flags 0x00 dlen 21                                                   #100 10.660980
      SMP: Pairing DHKey Check (0x0d) len 16
        E: 41d3cf218a4c555018e47a710e0a4076
> HCI Event: Number of Completed Packets (0x13) plen 5                                                             #101 10.821351
        Num handles: 1
        Handle: 993 Address: DF:A9:FF:F6:B1:1A (OUI DF-A9-FF)
        Count: 1
        #100: len 21 (1 Kb/s)
        Latency: 160 msec (67-170 msec ~155 msec)
> HCI Event: LE Meta Event (0x3e) plen 13                                                                          #102 10.909477
      LE Long Term Key Request (0x05)
        Handle: 993 Address: DF:A9:FF:F6:B1:1A (OUI DF-A9-FF)
        Random number: 0x0000000000000000
        Encrypted diversifier: 0x0000
zephyr.exe[153478]: < HCI Command: LE Long Term Key Request Reply (0x08|0x001a) plen 18                            #103 10.920368
        Handle: 993 Address: DF:A9:FF:F6:B1:1A (OUI DF-A9-FF)
        Long term key: d8edbe57a04bb014cf5cc2d1e7f11695
> HCI Event: Command Complete (0x0e) plen 6                                                                        #104 10.921047
      LE Long Term Key Request Reply (0x08|0x001a) ncmd 1
        Status: Success (0x00)
        Handle: 993 Address: DF:A9:FF:F6:B1:1A (OUI DF-A9-FF)
> HCI Event: Encryption Change (0x08) plen 4                                                                       #105 11.346695
        Status: Success (0x00)
        Handle: 993 Address: DF:A9:FF:F6:B1:1A (OUI DF-A9-FF)
        Encryption: Enabled with AES-CCM (0x01)
zephyr.exe[153478]: < ACL Data TX: Handle 993 flags 0x00 dlen 21                                                   #106 11.470457
      SMP: Identity Information (0x08) len 16
        Identity resolving key: 08aad2e1be87e47b88aeb19de6889efb
zephyr.exe[153478]: < ACL Data TX: Handle 993 flags 0x00 dlen 12                                                   #107 11.470483
      SMP: Identity Address Information (0x09) len 7
        Address: D5:B6:CC:31:DB:3B (Static)
> HCI Event: Number of Completed Packets (0x13) plen 5                                                             #108 11.521959
        Num handles: 1
        Handle: 993 Address: DF:A9:FF:F6:B1:1A (OUI DF-A9-FF)
        Count: 1
        #106: len 21 (3 Kb/s)
        Latency: 51 msec (51-170 msec ~103 msec)
> HCI Event: Numbe