Bluetooth monitor ver 5.72
= Note: Linux version 7.0.0-31-generic (x86_64)                        0.481702
= Note: Bluetooth subsystem version 2.22                               0.481705
= New Index: 00:00:00:00:00:00 (Primary,UART,hci1)              [hci1] 0.481706
= New Index: 48:5F:99:8E:E0:64 (Primary,USB,hci0)               [hci0] 0.481706
= Open Index: 00:00:00:00:00:00                                 [hci1] 0.634927
= Index Info: 00:00:00:00:00:00 (Nordic Semiconductor ASA)      [hci1] 0.634932
@ USER Open: main (privileged) version 2.22            {0x0001} [hci1] 0.634937
< HCI Command: Reset (0x03|0x0003) plen 0                    #1 [hci1] 0.635308
> HCI Event: Command Complete (0x0e) plen 4                  #2 [hci1] 0.635873
      Reset (0x03|0x0003) ncmd 1
        Status: Success (0x00)
< HCI Command: Read Local Supported... (0x04|0x0003) plen 0  #3 [hci1] 0.654855
> HCI Event: Command Complete (0x0e) plen 12                 #4 [hci1] 0.655460
      Read Local Supported Features (0x04|0x0003) ncmd 1
        Status: Success (0x00)
        Features: 0x00 0x00 0x00 0x00 0x60 0x00 0x00 0x00
          BR/EDR Not Supported
          LE Supported (Controller)
< HCI Command: Read Local Version In.. (0x04|0x0001) plen 0  #5 [hci1] 0.674853
> HCI Event: Command Complete (0x0e) plen 12                 #6 [hci1] 0.675271
      Read Local Version Information (0x04|0x0001) ncmd 1
        Status: Success (0x00)
        HCI version: Reserved (0x11) - Revision 12345 (0x3039)
        LMP version: Reserved (0x11) - Subversion 12345 (0x3039)
        Manufacturer: Nordic Semiconductor ASA (89)
< HCI Command: Read Local Supported... (0x04|0x0002) plen 0  #7 [hci1] 0.694891
> HCI Event: Command Complete (0x0e) plen 68                 #8 [hci1] 0.695944
      Read Local Supported Commands (0x04|0x0002) ncmd 1
        Status: Success (0x00)
        Commands: 115 entries
          Disconnect (Octet 0 - Bit 5)
          Read Remote Version Information (Octet 2 - Bit 7)
          Set Event Mask (Octet 5 - Bit 6)
          Reset (Octet 5 - Bit 7)
          Read Connection Accept Timeout (Octet 7 - Bit 2)
          Write Connection Accept Timeout (Octet 7 - Bit 3)
          Read Transmit Power Level (Octet 10 - Bit 2)
          Set Controller To Host Flow Control (Octet 10 - Bit 5)
          Host Buffer Size (Octet 10 - Bit 6)
          Host Number of Completed Packets (Octet 10 - Bit 7)
          Read Local Version Information (Octet 14 - Bit 3)
          Read Local Supported Features (Octet 14 - Bit 5)
          Read BD ADDR (Octet 15 - Bit 1)
          Read RSSI (Octet 15 - Bit 5)
          Set Event Mask Page 2 (Octet 22 - Bit 2)
          LE Set Event Mask (Octet 25 - Bit 0)
          LE Read Buffer Size (Octet 25 - Bit 1)
          LE Read Local Supported Features (Octet 25 - Bit 2)
          LE Set Random Address (Octet 25 - Bit 4)
          LE Set Advertising Parameters (Octet 25 - Bit 5)
          LE Read Advertising Channel TX Power (Octet 25 - Bit 6)
          LE Set Advertising Data (Octet 25 - Bit 7)
          LE Set Scan Response Data (Octet 26 - Bit 0)
          LE Set Advertise Enable (Octet 26 - Bit 1)
          LE Set Scan Parameters (Octet 26 - Bit 2)
          LE Set Scan Enable (Octet 26 - Bit 3)
          LE Create Connection (Octet 26 - Bit 4)
          LE Create Connection Cancel (Octet 26 - Bit 5)
          LE Read Accept List Size (Octet 26 - Bit 6)
          LE Clear Accept List (Octet 26 - Bit 7)
          LE Add Device To Accept List (Octet 27 - Bit 0)
          LE Remove Device From Accept List (Octet 27 - Bit 1)
          LE Connection Update (Octet 27 - Bit 2)
          LE Set Host Channel Classification (Octet 27 - Bit 3)
          LE Read Channel Map (Octet 27 - Bit 4)
          LE Read Remote Used Features (Octet 27 - Bit 5)
          LE Encrypt (Octet 27 - Bit 6)
          LE Rand (Octet 27 - Bit 7)
          LE Start Encryption (Octet 28 - Bit 0)
          LE Long Term Key Request Reply (Octet 28 - Bit 1)
          LE Long Term Key Request Neg Reply (Octet 28 - Bit 2)
          LE Read Supported States (Octet 28 - Bit 3)
          Read Authenticated Payload Timeout (Octet 32 - Bit 4)
          Write Authenticated Payload Timeout (Octet 32 - Bit 5)
          LE Set Data Length (Octet 33 - Bit 6)
          LE Read Suggested Default Data Length (Octet 33 - Bit 7)
          LE Write Suggested Default Data Length (Octet 34 - Bit 0)
          LE Add Device To Resolving List (Octet 34 - Bit 3)
          LE Remove Device From Resolving List (Octet 34 - Bit 4)
          LE Clear Resolving List (Octet 34 - Bit 5)
          LE Read Resolving List Size (Octet 34 - Bit 6)
          LE Set Address Resolution Enable (Octet 35 - Bit 1)
          LE Set Resolvable Private Address Timeout (Octet 35 - Bit 2)
          LE Read Maximum Data Length (Octet 35 - Bit 3)
          LE Read PHY (Octet 35 - Bit 4)
          LE Set Default PHY (Octet 35 - Bit 5)
          LE Set PHY (Octet 35 - Bit 6)
          LE Set Advertising Set Random Address (Octet 36 - Bit 1)
          LE Set Extended Advertising Parameters (Octet 36 - Bit 2)
          LE Set Extended Advertising Data (Octet 36 - Bit 3)
          LE Set Extended Scan Response Data (Octet 36 - Bit 4)
          LE Set Extended Advertising Enable (Octet 36 - Bit 5)
          LE Read Maximum Advertising Data Length (Octet 36 - Bit 6)
          LE Read Number of Supported Advertising Sets (Octet 36 - Bit 7)
          LE Remove Advertising Set (Octet 37 - Bit 0)
          LE Clear Advertising Sets (Octet 37 - Bit 1)
          LE Set Periodic Advertising Parameters (Octet 37 - Bit 2)
          LE Set Periodic Advertising Data (Octet 37 - Bit 3)
          LE Set Periodic Advertising Enable (Octet 37 - Bit 4)
          LE Set Extended Scan Parameters (Octet 37 - Bit 5)
          LE Set Extended Scan Enable (Octet 37 - Bit 6)
          LE Extended Create Connection (Octet 37 - Bit 7)
          LE Periodic Advertising Create Sync (Octet 38 - Bit 0)
          LE Periodic Advertising Create Sync Cancel (Octet 38 - Bit 1)
          LE Periodic Advertising Terminate Sync (Octet 38 - Bit 2)
          LE Add Device To Periodic Advertiser List (Octet 38 - Bit 3)
          LE Remove Device From Periodic Advertiser List (Octet 38 - Bit 4)
          LE Clear Periodic Advertiser List (Octet 38 - Bit 5)
          LE Read Periodic Advertiser List Size (Octet 38 - Bit 6)
          LE Read Transmit Power (Octet 38 - Bit 7)
          LE Read RF Path Compensation (Octet 39 - Bit 0)
          LE Write RF Path Compensation (Octet 39 - Bit 1)
          LE Set Privacy Mode (Octet 39 - Bit 2)
          LE Periodic Advertising Receive Enable (Octet 40 - Bit 5)
          LE Periodic Advertising Sync Transfer (Octet 40 - Bit 6)
          LE Periodic Advertising Set Info Transfer (Octet 40 - Bit 7)
          LE Periodic Advertising Sync Transfer Parameters (Octet 41 - Bit 0)
          LE Set Default Periodic Advertisng Sync Transfer Parameters (Octet 41 - Bit 1)
          LE Read Buffer v2 (Octet 41 - Bit 5)
          LE Read ISO TX Sync (Octet 41 - Bit 6)
          LE Set Connected Isochronous Group Parameters (Octet 41 - Bit 7)
          LE Set Connected Isochronous Group Parameters Test (Octet 42 - Bit 0)
          LE Create Connected Isochronous Stream (Octet 42 - Bit 1)
          LE Remove Connected Isochronous Group (Octet 42 - Bit 2)
          LE Accept Connected Isochronous Stream Request (Octet 42 - Bit 3)
          LE Reject Connected Isochronous Stream Request (Octet 42 - Bit 4)
          LE Create Broadcast Isochronous Group (Octet 42 - Bit 5)
          LE Create Broadcast Isochronous Group Test (Octet 42 - Bit 6)
          LE Terminate Broadcast Isochronous Group (Octet 42 - Bit 7)
          LE Broadcast Isochronous Group Create Sync (Octet 43 - Bit 0)
          LE Broadcast Isochronous Group Terminate Sync (Octet 43 - Bit 1)
          LE Request Peer SCA (Octet 43 - Bit 2)
          LE Setup Isochronous Data Path (Octet 43 - Bit 3)
          LE Remove Isochronous Data Path (Octet 43 - Bit 4)
          LE Isochronous Transmit Test (Octet 43 - Bit 5)
          LE Isochronous Receive Test (Octet 43 - Bit 6)
          LE Isochronous Read Test Counters (Octet 43 - Bit 7)
          LE Isochronous Read Test Counters (Octet 44 - Bit 0)
          LE Set Host Feature (Octet 44 - Bit 1)
          Octet 44 - Bit 2 
          Octet 45 - Bit 6 
          Octet 46 - Bit 0 
          Octet 46 - Bit 1 
          Octet 46 - Bit 2 
          Octet 47 - Bit 4 
< HCI Command: Host Buffer Size (0x03|0x0033) plen 7         #9 [hci1] 0.714874
        ACL MTU: 255  ACL max packet: 16
        SCO MTU: 0    SCO max packet: 0
> HCI Event: Command Complete (0x0e) plen 4                 #10 [hci1] 0.715455
      Host Buffer Size (0x03|0x0033) ncmd 1
        Status: Success (0x00)
< HCI Command: Set Controller To Ho.. (0x03|0x0031) plen 1  #11 [hci1] 0.734877
        Flow control: ACL Data Packets (0x01)
> HCI Event: Command Complete (0x0e) plen 4                 #12 [hci1] 0.735239
      Set Controller To Host Flow Control (0x03|0x0031) ncmd 1
        Status: Success (0x00)
< HCI Command: LE Read Local Suppor.. (0x08|0x0003) plen 0  #13 [hci1] 0.754891
> HCI Event: Command Complete (0x0e) plen 12                #14 [hci1] 0.755370
      LE Read Local Supported Features (0x08|0x0003) ncmd 1
        Status: Success (0x00)
        Features: 0xfd 0x79 0x00 0xf7 0x30 0x01 0x00 0x00
          LE Encryption
          Extended Reject Indication
          Peripheral-initiated Features Exchange
          LE Ping
          LE Data Packet Length Extension
          LL Privacy
          Extended Scanner Filter Policies
          LE 2M PHY
          LE Coded PHY
          LE Extended Advertising
          LE Periodic Advertising
          Channel Selection Algorithm #2
          Periodic Advertising Sync Transfer - Sender
          Periodic Advertising Sync Transfer - Recipient
          Sleep Clock Accuracy Updates
          Connected Isochronous Stream - Central
          Connected Isochronous Stream - Peripheral
          Isochronous Broadcaster
          Synchronized Receiver
          Periodic Advertising ADI support
          Connection Subrating
          Unknown features (0x0000010000000000)
< HCI Command: LE Set Host Feature (0x08|0x0074) plen 2     #15 [hci1] 0.774897
        Bit Number: 32
          Connected Isochronous Stream (Host Support)
        Bit Value: 1
> HCI Event: Command Complete (0x0e) plen 4                 #16 [hci1] 0.775282
      LE Set Host Feature (0x08|0x0074) ncmd 1
        Status: Success (0x00)
< HCI Command: LE Read Buffer v2 (0x08|0x0060) plen 0       #17 [hci1] 0.794880
> HCI Event: Command Complete (0x0e) plen 10                #18 [hci1] 0.795387
      LE Read Buffer v2 (0x08|0x0060) ncmd 1
        Status: Success (0x00)
        ACL MTU: 27
        ACL max packet: 3
        ISO MTU: 318
        ISO max packet: 3
< HCI Command: LE Read Maximum Adve.. (0x08|0x003a) plen 0  #19 [hci1] 0.814921
> HCI Event: Command Complete (0x0e) plen 6                 #20 [hci1] 0.815375
      LE Read Maximum Advertising Data Length (0x08|0x003a) ncmd 1
        Status: Success (0x00)
        Max length: 1650
< HCI Command: LE Read Supported St.. (0x08|0x001c) plen 0  #21 [hci1] 0.834881
> HCI Event: Command Complete (0x0e) plen 12                #22 [hci1] 0.835458
      LE Read Supported States (0x08|0x001c) ncmd 1
        Status: Success (0x00)
        States: 0x000003ff3e0306ff
          Non-connectable Advertising State
          Scannable Advertising State
          Connectable Advertising State
          High Duty Cycle Directed Advertising State
          Passive Scanning State
          Active Scanning State
          Initiating State
            and Connection State (Central Role)
          Connection State (Peripheral Role)
          Scannable Advertising State
            and Passive Scanning State
          Connectable Advertising State
            and Passive Scanning State
          Non-connectable Advertising State
            and Initiating State
          Scannable Advertising State
            and Initiating State
          Active Scanning State
            and Connection State (Central Role)
          Passive Scanning State
            and Connection State (Peripheral Role)
          Active Scanning State
            and Connection State (Peripheral Role)
          Initiating State
            and Connection State (Central Role)
            and Central Role & Central Role
          Low Duty Cycle Directed Advertising State
          Connectable Advertising State
            and Initiating State
            and Central Role & Peripheral Role
          High Duty Cycle Directed Advertising State
            and Initiating State
            and Central Role & Peripheral Role
          Low Duty Cycle Directed Advertising State
            and Initiating State
            and Central Role & Peripheral Role
          Connectable Advertising State
            and Connection State (Central Role)
            and Central Role & Peripheral Role
          High Duty Cycle Directed Advertising State
            and Connection State (Central Role)
            and Central Role & Peripheral Role
          Low Duty Cycle Directed Advertising State
            and Connection State (Central Role)
            and Central Role & Peripheral Role
          Connectable Advertising State
            and Connection State (Peripheral Role)
            and Central Role & Peripheral Role
          High Duty Cycle Directed Advertising State
            and Connection State (Peripheral Role)
            and Peripheral Role & Peripheral Role
          Low Duty Cycle Directed Advertising State
            and Connection State (Peripheral Role)
            and Peripheral Role & Peripheral Role
          Initiating State
            and Connection State (Peripheral Role)
            and Central Role & Peripheral Role
< HCI Command: LE Read Maximum Data.. (0x08|0x002f) plen 0  #23 [hci1] 0.854892
> HCI Event: Command Complete (0x0e) plen 12                #24 [hci1] 0.855380
      LE Read Maximum Data Length (0x08|0x002f) ncmd 1
        Status: Success (0x00)
        Max TX octets: 251
        Max TX time: 2704
        Max RX octets: 251
        Max RX time: 2704
< HCI Command: LE Write Suggested D.. (0x08|0x0024) plen 4  #25 [hci1] 0.874880
        TX octets: 251
        TX time: 2704
> HCI Event: Command Complete (0x0e) plen 4                 #26 [hci1] 0.875276
      LE Write Suggested Default Data Length (0x08|0x0024) ncmd 1
        Status: Success (0x00)
< HCI Command: LE Read Resolving Li.. (0x08|0x002a) plen 0  #27 [hci1] 0.894876
> HCI Event: Command Complete (0x0e) plen 5                 #28 [hci1] 0.895263
      LE Read Resolving List Size (0x08|0x002a) ncmd 1
        Status: Success (0x00)
        Size: 8
< HCI Command: LE Set Host Feature (0x08|0x0074) plen 2     #29 [hci1] 0.914900
        Bit Number: 38
          Connection Subrating (Host Support)
        Bit Value: 1
> HCI Event: Command Complete (0x0e) plen 4                 #30 [hci1] 0.915461
      LE Set Host Feature (0x08|0x0074) ncmd 1
        Status: Success (0x00)
< HCI Command: LE Set Event Mask (0x08|0x0001) plen 8       #31 [hci1] 0.934893
        Mask: 0x000002063f87fa5e
          LE Advertising Report
          LE Connection Update Complete
          LE Read Remote Used Features Complete
          LE Long Term Key Request
          LE Data Length Change
          LE Enhanced Connection Complete
          LE PHY Update Complete
          LE Extended Advertising Report
          LE Periodic Advertising Sync Established
          LE Periodic Advertising Report
          LE Periodic Advertising Sync Lost
          LE Extended Scan Timeout
          LE Extended Advertising Set Terminated
          LE Scan Request Received
          LE Periodic Advertising Sync Transfer Rvc
          LE CIS Established
          LE CIS Request
          LE Create BIG Complete
          LE Terminate BIG Complete
          LE BIG Sync Estabilished Complete
          LE BIG Sync Lost
          LE BIG Info Advertising Report
          LE Subrate Change
          Unknown mask (0x0000020000000000)
> HCI Event: Command Complete (0x0e) plen 4                 #32 [hci1] 0.935459
      LE Set Event Mask (0x08|0x0001) ncmd 1
        Status: Success (0x00)
< HCI Command: Set Event Mask (0x03|0x0001) plen 8          #33 [hci1] 0.954880
        Mask: 0x2000800002008890
          Disconnection Complete
          Encryption Change
          Read Remote Version Information Complete
          Hardware Error
          Data Buffer Overflow
          Encryption Key Refresh Complete
          LE Meta
> HCI Event: Command Complete (0x0e) plen 4                 #34 [hci1] 0.955434
      Set Event Mask (0x03|0x0001) ncmd 1
        Status: Success (0x00)
< HCI Command: Read BD ADDR (0x04|0x0009) plen 0            #35 [hci1] 0.974877
> HCI Event: Command Complete (0x0e) plen 10                #36 [hci1] 0.975319
      Read BD ADDR (0x04|0x0009) ncmd 1
        Status: Success (0x00)
        Address: 00:00:00:00:00:00 (OUI 00-00-00)
< HCI Command: LE Set Random Address (0x08|0x0005) plen 6   #37 [hci1] 0.994872
        Address: D5:B6:CC:31:DB:3B (Static)
> HCI Event: Command Complete (0x0e) plen 4                 #38 [hci1] 0.995454
      LE Set Random Address (0x08|0x0005) ncmd 1
        Status: Success (0x00)
< HCI Command: LE Set Extended Adv.. (0x08|0x0036) plen 25  #39 [hci1] 3.374991
        Handle: 0x00
        Properties: 0x0013
          Connectable
          Scannable
          Use legacy advertising PDUs: ADV_IND
        Min advertising interval: 100.000 msec (0x00a0)
        Max advertising interval: 150.000 msec (0x00f0)
        Channel map: 37, 38, 39 (0x07)
        Own address type: Random (0x01)
        Peer address type: Public (0x00)
        Peer address: 00:00:00:00:00:00 (OUI 00-00-00)
        Filter policy: Allow Scan Request from Any, Allow Connect Request from Any (0x00)
        TX power: Host has no preference (0x7f)
        Primary PHY: LE 1M (0x01)
        Secondary max skip: 0x00
        Secondary PHY: LE 1M (0x01)
        SID: 0x00
        Scan request notifications: Disabled (0x00)
> HCI Event: Command Complete (0x0e) plen 5                 #40 [hci1] 3.375748
      LE Set Extended Advertising Parameters (0x08|0x0036) ncmd 1
        Status: Success (0x00)
        TX power (selected): 0 dbm (0x00)
< HCI Command: LE Set Advertising S.. (0x08|0x0035) plen 7  #41 [hci1] 3.394938
        Advertising handle: 0x00
        Advertising random address: D5:B6:CC:31:DB:3B (Static)
> HCI Event: Command Complete (0x0e) plen 4                 #42 [hci1] 3.395463
      LE Set Advertising Set Random Address (0x08|0x0035) ncmd 1
        Status: Success (0x00)
< HCI Command: LE Set Extended Adv.. (0x08|0x0037) plen 22  #43 [hci1] 3.414943
        Handle: 0x00
        Operation: Complete extended advertising data (0x03)
        Fragment preference: Minimize fragmentation (0x01)
        Data length: 0x12
        Flags: 0x06
          LE General Discoverable Mode
          BR/EDR Not Supported
        Name (complete): Tester_F6B11A
> HCI Event: Command Complete (0x0e) plen 4                 #44 [hci1] 3.415637
      LE Set Extended Advertising Data (0x08|0x0037) ncmd 1
        Status: Success (0x00)
< HCI Command: LE Set Extended Scan.. (0x08|0x0038) plen 4  #45 [hci1] 3.434945
        Handle: 0x00
        Operation: Complete scan response data (0x03)
        Fragment preference: Minimize fragmentation (0x01)
        Data length: 0x00
> HCI Event: Command Complete (0x0e) plen 4                 #46 [hci1] 3.435451
      LE Set Extended Scan Response Data (0x08|0x0038) ncmd 1
        Status: Success (0x00)
< HCI Command: LE Set Extended Adve.. (0x08|0x0039) plen 6  #47 [hci1] 3.454941
        Extended advertising: Enabled (0x01)
        Number of sets: 1 (0x01)
        Entry 0
          Handle: 0x00
          Duration: 0 ms (0x00)
          Max ext adv events: 0
> HCI Event: Command Complete (0x0e) plen 4                 #48 [hci1] 3.455500
      LE Set Extended Advertising Enable (0x08|0x0039) ncmd 1
        Status: Success (0x00)
> HCI Event: LE Meta Event (0x3e) plen 31                   #49 [hci1] 3.562745
      LE Enhanced Connection Complete (0x0a)
        Status: Success (0x00)
        Handle: 1875
        Role: Peripheral (0x01)
        Peer address type: Public (0x00)
        Peer address: DF:A9:FF:F6:B1:1A (OUI DF-A9-FF)
        Local resolvable private address: 00:00:00:00:00:00 (Non-Resolvable)
        Peer resolvable private address: 00:00:00:00:00:00 (Non-Resolvable)
        Connection interval: 87.50 msec (0x0046)
        Connection latency: 0 (0x0000)
        Supervision timeout: 25120 msec (0x09d0)
        Central clock accuracy: 0x01
> HCI Event: LE Meta Event (0x3e) plen 6                    #50 [hci1] 3.562809
      LE Advertising Set Terminated (0x12)
        Status: Success (0x00)
        Handle: 0
        Connection handle: 1875
        Number of completed extended advertising events: 0
< HCI Command: LE Read Remote Used... (0x08|0x0016) plen 2  #51 [hci1] 3.575202
        Handle: 1875 Address: DF:A9:FF:F6:B1:1A (OUI DF-A9-FF)
< ACL Data TX: Handle 1875 flags 0x00 dlen 7                #52 [hci1] 3.575210
      ATT: Exchange MTU Request (0x02) len 2
        Client RX MTU: 251
> HCI Event: Command Status (0x0f) plen 4                   #53 [hci1] 3.575641
      LE Read Remote Used Features (0x08|0x0016) ncmd 1
        Status: Success (0x00)
> HCI Event: Number of Completed Packets (0x13) plen 5      #54 [hci1] 3.738731
        Num handles: 1
        Handle: 1875 Address: DF:A9:FF:F6:B1:1A (OUI DF-A9-FF)
        Count: 1
        #52: len 7 (0 Kb/s)
        Latency: 163 msec (163-163 msec ~163 msec)
> HCI Event: LE Meta Event (0x3e) plen 12                   #55 [hci1] 3.826627
      LE Read Remote Used Features (0x04)
        Status: Success (0x00)
        Handle: 1875 Address: DF:A9:FF:F6:B1:1A (OUI DF-A9-FF)
        Features: 0x2d 0x49 0x00 0xf7 0x67 0xd9 0x00 0x80
          LE Encryption
          Extended Reject Indication
          Peripheral-initiated Features Exchange
          LE Data Packet Length Extension
          LE 2M PHY
          LE Coded PHY
          Channel Selection Algorithm #2
          Periodic Advertising Sync Transfer - Sender
          Periodic Advertising Sync Transfer - Recipient
          Sleep Clock Accuracy Updates
          Connected Isochronous Stream - Central
          Connected Isochronous Stream - Peripheral
          Isochronous Broadcaster
          Synchronized Receiver
          Connected Isochronous Stream (Host Support)
          LE Power Control Request
          LE Power Control Request
          Connection Subrating
          Connection Subrating (Host Support)
          Unknown features (0x8000d90000000000)
> ACL Data RX: Handle 1875 flags 0x02 dlen 11               #56 [hci1] 6.276390
      SMP: Pairing Request (0x01) len 6
        IO capability: KeyboardDisplay (0x04)
        OOB data: Authentication data not present (0x00)
        Authentication requirement: Bonding, MITM, SC, No Keypresses (0x0d)
        Max encryption key size: 16
        Initiator key distribution: EncKey IdKey (0x03)
        Responder key distribution: EncKey IdKey Sign (0x07)
> ACL Data RX: Handle 1875 flags 0x02 dlen 7                #57 [hci1] 6.276780
      ATT: Exchange MTU Response (0x03) len 2
        Server RX MTU: 23
< HCI Command: Host Number of Compl.. (0x03|0x0035) plen 5  #58 [hci1] 6.295141
        Num handles: 1
        Handle: 1875 Address: DF:A9:FF:F6:B1:1A (OUI DF-A9-FF)
        Count: 1
< ACL Data TX: Handle 1875 flags 0x00 dlen 11               #59 [hci1] 6.295219
      SMP: Pairing Response (0x02) len 6
        IO capability: DisplayOnly (0x00)
        OOB data: Authentication data not present (0x00)
        Authentication requirement: Bonding, No MITM, SC, No Keypresses (0x09)
        Max encryption key size: 16
        Initiator key distribution: IdKey (0x02)
        Responder key distribution: <none> (0x00)
< HCI Command: Host Number of Compl.. (0x03|0x0035) plen 5  #60 [hci1] 6.295426
        Num handles: 1
        Handle: 1875 Address: DF:A9:FF:F6:B1:1A (OUI DF-A9-FF)
        Count: 1
> HCI Event: Number of Completed Packets (0x13) plen 5      #61 [hci1] 6.451563
        Num handles: 1
        Handle: 1875 Address: DF:A9:FF:F6:B1:1A (OUI DF-A9-FF)
        Count: 1
        #59: len 11 (0 Kb/s)
        Latency: 156 msec (156-163 msec ~159 msec)
> ACL Data RX: Handle 1875 flags 0x02 dlen 27               #62 [hci1] 6.451800
> ACL Data RX: Handle 1875 flags 0x01 dlen 27               #63 [hci1] 6.452332
> ACL Data RX: Handle 1875 flags 0x01 dlen 15               #64 [hci1] 6.452726
      SMP: Pairing Public Key (0x0c) len 64
        X: 092bdbda7eaa13daa9d1038ad63c2ac39c6931d7942d466b37d1f301c11254c8
        Y: d2c687d1f39243b63646d86053249ca8de94740fb4858a4e8ca73d5685ae4d75
< HCI Command: Host Number of Compl.. (0x03|0x0035) plen 5  #65 [hci1] 6.455685
        Num handles: 1
        Handle: 1875 Address: DF:A9:FF:F6:B1:1A (OUI DF-A9-FF)
        Count: 1
< HCI Command: Host Number of Compl.. (0x03|0x0035) plen 5  #66 [hci1] 6.455781
        Num handles: 1
        Handle: 1875 Address: DF:A9:FF:F6:B1:1A (OUI DF-A9-FF)
        Count: 1
< HCI Command: Host Number of Compl.. (0x03|0x0035) plen 5  #67 [hci1] 6.456128
        Num handles: 1
        Handle: 1875 Address: DF:A9:FF:F6:B1:1A (OUI DF-A9-FF)
        Count: 1
< ACL Data TX: Handle 1875 flags 0x00 dlen 27               #68 [hci1] 6.456188
< ACL Data TX: Handle 1875 flags 0x01 dlen 27               #69 [hci1] 6.456213
< ACL Data TX: Handle 1875 flags 0x01 dlen 15               #70 [hci1] 6.456255
      SMP: Pairing Public Key (0x0c) len 64
        X: 98308440221e2d910f0e54b71e7ec652857aa9b5a0dc65028824cc19db1226e9
        Y: 67a4816bcb62efb21701e31fdb27561a6217575fb007a8bbdabe7e28b6f68482
> HCI Event: Number of Completed Packets (0x13) plen 5      #71 [hci1] 6.539296
        Num handles: 1
        Handle: 1875 Address: DF:A9:FF:F6:B1:1A (OUI DF-A9-FF)
        Count: 1
        #68: len 27 (2 Kb/s)
        Latency: 83 msec (83-163 msec ~121 msec)
> HCI Event: Number of Completed Packets (0x13) plen 5      #72 [hci1] 6.539943
        Num handles: 1
        Handle: 1875 Address: DF:A9:FF:F6:B1:1A (OUI DF-A9-FF)
        Count: 1
        #69: len 27 (2 Kb/s)
        Latency: 83 msec (83-163 msec ~102 msec)
> HCI Event: Number of Completed Packets (0x13) plen 5      #73 [hci1] 6.626249
        Num handles: 1
        Handle: 1875 Address: DF:A9:FF:F6:B1:1A (OUI DF-A9-FF)
        Count: 1
        #70: len 15 (0 Kb/s)
        Latency: 169 msec (83-169 msec ~136 msec)
> ACL Data RX: Handle 1875 flags 0x02 dlen 21               #74 [hci1] 7.588988
      SMP: Pairing Confirm (0x03) len 16
        Confim value: 353edffa16597a89a5da646b29e61dbb
< HCI Command: Host Number of Compl.. (0x03|0x0035) plen 5  #75 [hci1] 7.595116
        Num handles: 1
        Handle: 1875 Address: DF:A9:FF:F6:B1:1A (OUI DF-A9-FF)
        Count: 1
< ACL Data TX: Handle 1875 flags 0x00 dlen 21               #76 [hci1] 7.595179
      SMP: Pairing Confirm (0x03) len 16
        Confim value: b8d80327dca9fcbcbded557306f95b29
> HCI Event: Number of Completed Packets (0x13) plen 5      #77 [hci1] 7.763800
        Num handles: 1
        Handle: 1875 Address: DF:A9:FF:F6:B1:1A (OUI DF-A9-FF)
        Count: 1
        #76: len 21 (1 Kb/s)
        Latency: 168 msec (83-169 msec ~152 msec)
> ACL Data RX: Handle 1875 flags 0x02 dlen 21               #78 [hci1] 7.764083
      SMP: Pairing Random (0x04) len 16
        Random value: ed1bf09142e0f26e0000000000000000
< HCI Command: Host Number of Compl.. (0x03|0x0035) plen 5  #79 [hci1] 7.775102
        Num handles: 1
        Handle: 1875 Address: DF:A9:FF:F6:B1:1A (OUI DF-A9-FF)
        Count: 1
< ACL Data TX: Handle 1875 flags 0x00 dlen 21               #80 [hci1] 7.775151
      SMP: Pairing Random (0x04) len 16
        Random value: 8e6108f966a694cbe26df70bb96773e6
> HCI Event: Number of Completed Packets (0x13) plen 5      #81 [hci1] 7.938594
        Num handles: 1
        Handle: 1875 Address: DF:A9:FF:F6:B1:1A (OUI DF-A9-FF)
        Count: 1
        #80: len 21 (1 Kb/s)
        Latency: 163 msec (83-169 msec ~157 msec)
> ACL Data RX: Handle 1875 flags 0x02 dlen 21               #82 [hci1] 8.026618
      SMP: Pairing Confirm (0x03) len 16
        Confim value: e83c01878f770f6ca9c210de719081d8
< HCI Command: Host Number of Compl.. (0x03|0x0035) plen 5  #83 [hci1] 8.035112
        Num handles: 1
        Handle: 1875 Address: DF:A9:FF:F6:B1:1A (OUI DF-A9-FF)
        Count: 1
< ACL Data TX: Handle 1875 flags 0x00 dlen 21               #84 [hci1] 8.035144
      SMP: Pairing Confirm (0x03) len 16
        Confim value: 3ebf0fdbff9b588a340db733dd8b8866
> HCI Event: Number of Completed Packets (0x13) plen 5      #85 [hci1] 8.201276
        Num handles: 1
        Handle: 1875 Address: DF:A9:FF:F6:B1:1A (OUI DF-A9-FF)
        Count: 1
        #84: len 21 (1 Kb/s)
        Latency: 166 msec (83-169 msec ~162 msec)
> ACL Data RX: Handle 1875 flags 0x02 dlen 21               #86 [hci1] 8.201674
      SMP: Pairing Random (0x04) len 16
        Random value: 0ea9c50c392fcce50000000000000000
< HCI Command: Host Number of Compl.. (0x03|0x0035) plen 5  #87 [hci1] 8.215281
        Num handles: 1
        Handle: 1875 Address: DF:A9:FF:F6:B1:1A (OUI DF-A9-FF)
        Count: 1
< ACL Data TX: Handle 1875 flags 0x00 dlen 21               #88 [hci1] 8.215327
      SMP: Pairing Random (0x04) len 16
        Random value: 4d02679f89a05211af56d8b3da64d21e
> HCI Event: Number of Completed Packets (0x13) plen 5      #89 [hci1] 8.376344
        Num handles: 1
        Handle: 1875 Address: DF:A9:FF:F6:B1:1A (OUI DF-A9-FF)
        Count: 1
        #88: len 21 (1 Kb/s)
        Latency: 161 msec (83-169 msec ~161 msec)
> ACL Data RX: Handle 1875 flags 0x02 dlen 21               #90 [hci1] 8.376733
      SMP: Pairing Confirm (0x03) len 16
        Confim value: 8b9bbe5774f47e563600c745d3c5b9dc
< HCI Command: Host Number of Compl.. (0x03|0x0035) plen 5  #91 [hci1] 8.395224
        Num handles: 1
        Handle: 1875 Address: DF:A9:FF:F6:B1:1A (OUI DF-A9-FF)
        Count: 1
< ACL Data TX: Handle 1875 flags 0x00 dlen 21               #92 [hci1] 8.395250
      SMP: Pairing Confirm (0x03) len 16
        Confim value: 371bbfd3a01f03fededdeb0a32eaf191
> HCI Event: Number of Completed Packets (0x13) plen 5      #93 [hci1] 8.551280
        Num handles: 1
        Handle: 1875 Address: DF:A9:FF:F6:B1:1A (OUI DF-A9-FF)
        Count: 1
        #92: len 21 (1 Kb/s)
        Latency: 156 msec (83-169 msec ~158 msec)
> ACL Data RX: Handle 1875 flags 0x02 dlen 21               #94 [hci1] 8.551660
      SMP: Pairing Random (0x04) len 16
        Random value: c38b672f8460308a0000000000000000
< HCI Command: Host Number of Compl.. (0x03|0x0035) plen 5  #95 [hci1] 8.555596
        Num handles: 1
        Handle: 1875 Address: DF:A9:FF:F6:B1:1A (OUI DF-A9-FF)
        Count: 1
< ACL Data TX: Handle 1875 flags 0x00 dlen 21               #96 [hci1] 8.555696
      SMP: Pairing Random (0x04) len 16
        Random value: 5e8286bc235a02440d0c3424a2acf8fd
> HCI Event: Number of Completed Packets (0x13) plen 5      #97 [hci1] 8.726185
        Num handles: 1
        Handle: 1875 Address: DF:A9:FF:F6:B1:1A (OUI DF-A9-FF)
        Count: 1
        #96: len 21 (0 Kb/s)
        Latency: 170 msec (83-170 msec ~164 msec)
> ACL Data RX: Handle 1875 flags 0x02 dlen 21               #98 [hci1] 8.813975
      SMP: Pairing Confirm (0x03) len 16
        Confim value: bc7c126d345f21ca6544363496d732d5
< HCI Command: Host Number of Compl.. (0x03|0x0035) plen 5  #99 [hci1] 8.815119
        Num handles: 1
        Handle: 1875 Address: DF:A9:FF:F6:B1:1A (OUI DF-A9-FF)
        Count: 1
< ACL Data TX: Handle 1875 flags 0x00 dlen 21              #100 [hci1] 8.815216
      SMP: Pairing Confirm (0x03) len 16
        Confim value: ff0d15dc7062fe3adda21d24b98fac7e
> HCI Event: Number of Completed Packets (0x13) plen 5     #101 [hci1] 8.988852
        Num handles: 1
        Handle: 1875 Address: DF:A9:FF:F6:B1:1A (OUI DF-A9-FF)
        Count: 1
        #100: len 21 (0 Kb/s)
        Latency: 173 msec (83-173 msec ~169 msec)
> ACL Data RX: Handle 1875 flags 0x02 dlen 21              #102 [hci1] 8.989201
      SMP: Pairing Random (0x04) len 16
        Random value: f44ce005dddb38f00000000000000000
< HCI Command: Host Number of Comp.. (0x03|0x0035) plen 5  #103 [hci1] 8.995754
        Num handles: 1
        Handle: 1875 Address: DF:A9:FF:F6:B1:1A (OUI DF-A9-FF)
        Count: 1
< ACL Data TX: Handle 1875 flags 0x00 dlen 21              #104 [hci1] 8.995890
      SMP: Pairing Random (0x04) len 16
        Random value: 5c4a1bcadd27bd58e945097b00bad7ac
> HCI Event: Number of Completed Packets (0x13) plen 5     #105 [hci1] 9.163838
        Num handles: 1
        Handle: 1875 Address: DF:A9:FF:F6:B1:1A (OUI DF-A9-FF)
        Count: 1
        #104: len 21 (1 Kb/s)
        Latency: 167 msec (83-173 msec ~168 msec)
> ACL Data RX: Handle 1875 flags 0x02 dlen 21              #106 [hci1] 9.251525
      SMP: Pairing Confirm (0x03) len 16
        Confim value: 5a3f6fe55da238571db6220465d2754e
< HCI Command: Host Number of Comp.. (0x03|0x0035) plen 5  #107 [hci1] 9.255165
        Num handles: 1
        Handle: 1875 Address: DF:A9:FF:F6:B1:1A (OUI DF-A9-FF)
        Count: 1
< ACL Data TX: Handle 1875 flags 0x00 dlen 21              #108 [hci1] 9.255232
      SMP: Pairing Confirm (0x03) len 16
        Confim value: e1345511e83b7a2cb4568fe9d47089f7
> HCI Event: Number of Completed Packets (0x13) plen 5     #109 [hci1] 9.426355
        Num handles: 1
        Handle: 1875 Address: DF:A9:FF:F6:B1:1A (OUI DF-A9-FF)
        Count: 1
        #108: len 21 (0 Kb/s)
        Latency: 171 msec (83-173 msec ~169 msec)
> ACL Data RX: Handle 1875 flags 0x02 dlen 21              #110 [hci1] 9.426640
      SMP: Pairing Random (0x04) len 16
        Random value: 19a876ec7a4afe4f0000000000000000
< HCI Command: Host Number of Comp.. (0x03|0x0035) plen 5  #111 [hci1] 9.435462
        Num handles: 1
        Handle: 1875 Address: DF:A9:FF:F6:B1:1A (OUI DF-A9-FF)
        Count: 1
< ACL Data TX: Handle 1875 flags 0x00 dlen 21              #112 [hci1] 9.435476
      SMP: Pairing Random (0x04) len 16
        Random value: 32527e6e64e79f33b2e374394db8ab2d
> HCI Event: Number of Completed Packets (0x13) plen 5     #113 [hci1] 9.601088
        Num handles: 1
        Handle: 1875 Address: DF:A9:FF:F6:B1:1A (OUI DF-A9-FF)
        Count: 1
        #112: len 21 (1 Kb/s)
        Latency: 165 msec (83-173 msec ~167 msec)
> ACL Data RX: Handle 1875 flags 0x02 dlen 21              #114 [hci1] 9.688999
      SMP: Pairing Confirm (0x03) len 16
        Confim value: e66f9407b207c748b04b70331bd9aaba
< HCI Command: Host Number of Comp.. (0x03|0x0035) plen 5  #115 [hci1] 9.695259
        Num handles: 1
        Handle: 1875 Address: DF:A9:FF:F6:B1:1A (OUI DF-A9-FF)
        Count: 1
< ACL Data TX: Handle 1875 flags 0x00 dlen 21              #116 [hci1] 9.695270
      SMP: Pairing Confirm (0x03) len 16
        Confim value: a97a44d82c6b47dada39dac1719a4250
> HCI Event: Number of Completed Packets (0x13) plen 5     #117 [hci1] 9.863825
        Num handles: 1
        Handle: 1875 Address: DF:A9:FF:F6:B1:1A (OUI DF-A9-FF)
        Count: 1
        #116: len 21 (1 Kb/s)
        Latency: 168 msec (83-173 msec ~168 msec)
> ACL Data RX: Handle 1875 flags 0x02 dlen 21              #118 [hci1] 9.864123
      SMP: Pairing Random (0x04) len 16
        Random value: 33a5c5156c4d4a830000000000000000
< HCI Command: Host Number of Comp.. (0x03|0x0035) plen 5  #119 [hci1] 9.875275
        Num handles: 1
        Handle: 1875 Address: DF:A9:FF:F6:B1:1A (OUI DF-A9-FF)
        Count: 1
< ACL Data TX: Handle 1875 flags 0x00 dlen 21              #120 [hci1] 9.875317
      SMP: Pairing Random (0x04) len 16
        Random value: dddbdfe2838e9a8cc6964353c850fef7
> HCI Event: Number of Completed Packets (0x13) plen 5    #121 [hci1] 10.038586
        Num handles: 1
        Handle: 1875 Address: DF:A9:FF:F6:B1:1A (OUI DF-A9-FF)
        Count: 1
        #120: len 21 (1 Kb/s)
        Latency: 163 msec (83-173 msec ~165 msec)
> ACL Data RX: Handle 1875 flags 0x02 dlen 21             #122 [hci1] 10.126439
      SMP: Pairing Confirm (0x03) len 16
        Confim value: f7bb7bf068d337ff89964259367ff30c
< HCI Command: Host Number of Com.. (0x03|0x0035) plen 5  #123 [hci1] 10.135465
        Num handles: 1
        Handle: 1875 Address: DF:A9:FF:F6:B1:1A (OUI DF-A9-FF)
        Count: 1
< ACL Data TX: Handle 1875 flags 0x00 dlen 21             #124 [hci1] 10.135561
      SMP: Pairing Confirm (0x03) len 16
        Confim value: b798edc614c7a4e7cf004e3328ee7dbc
> HCI Event: Number of Completed Packets (0x13) plen 5    #125 [hci1] 10.301330
        Num handles: 1
        Handle: 1875 Address: DF:A9:FF:F6:B1:1A (OUI DF-A9-FF)
        Count: 1
        #124: len 21 (1 Kb/s)
        Latency: 165 msec (83-173 msec ~165 msec)
> ACL Data RX: Handle 1875 flags 0x02 dlen 21             #126 [hci1] 10.301645
      SMP: Pairing Random (0x04) len 16
        Random value: da47d2fdc523de3d0000000000000000
< HCI Command: Host Number of Com.. (0x03|0x0035) plen 5  #127 [hci1] 10.315300
        Num handles: 1
        Handle: 1875 Address: DF:A9:FF:F6:B1:1A (OUI DF-A9-FF)
        Count: 1
< ACL Data TX: Handle 1875 flags 0x00 dlen 21             #128 [hci1] 10.315338
      SMP: Pairing Random (0x04) len 16
        Random value: eb9f1915536596b6fc3db1c86b2b1970
> HCI Event: Number of Completed Packets (0x13) plen 5    #129 [hci1] 10.476088
        Num handles: 1
        Handle: 1875 Address: DF:A9:FF:F6:B1:1A (OUI DF-A9-FF)
        Count: 1
        #128: len 21 (1 Kb/s)
        Latency: 160 msec (83-173 msec ~163 msec)
> ACL Data RX: Handle 1875 flags 0x02 dlen 21             #130 [hci1] 10.564045
      SMP: Pairing Confirm (0x03) len 16
        Confim value: dc9f47c437b92a22e5abd03f22d55581
< HCI Command: Host Number of Com.. (0x03|0x0035) plen 5  #131 [hci1] 10.575519
        Num handles: 1
        Handle: 1875 Address: DF:A9:FF:F6:B1:1A (OUI DF-A9-FF)
        Count: 1
< ACL Data TX: Handle 1875 flags 0x00 dlen 21             #132 [hci1] 10.575607
      SMP: Pairing Confirm (0x03) len 16
        Confim value: 09d0d582ceb98bf9909f94584b20a440
> HCI Event: Number of Completed Packets (0x13) plen 5    #133 [hci1] 10.739154
        Num handles: 1
        Handle: 1875 Address: DF:A9:FF:F6:B1:1A (OUI DF-A9-FF)
        Count: 1
        #132: len 21 (1 Kb/s)
        Latency: 163 msec (83-173 msec ~163 msec)
> ACL Data RX: Handle 1875 flags 0x02 dlen 21             #134 [hci1] 10.739158
      SMP: Pairing Random (0x04) len 16
        Random value: 461cd1622a42f14d0000000000000000
< HCI Command: Host Number of Com.. (0x03|0x0035) plen 5  #135 [hci1] 10.755534
        Num handles: 1
        Handle: 1875 Address: DF:A9:FF:F6:B1:1A (OUI DF-A9-FF)
        Count: 1
< ACL Data TX: Handle 1875 flags 0x00 dlen 21             #136 [hci1] 10.756429
      SMP: Pairing Random (0x04) len 16
        Random value: 5c794dc9ad9f2c3f295ebd5ad5e1c3cf
> HCI Event: Number of Completed Packets (0x13) plen 5    #137 [hci1] 10.913513
        Num handles: 1
        Handle: 1875 Address: DF:A9:FF:F6:B1:1A (OUI DF-A9-FF)
        Count: 1
        #136: len 21 (1 Kb/s)
        Latency: 157 msec (83-173 msec ~160 msec)
> ACL Data RX: Handle 1875 flags 0x02 dlen 21             #138 [hci1] 11.001420
      SMP: Pairing Confirm (0x03) len 16
        Confim value: e2bf91221f1053738f5de628e8ab136d
< HCI Command: Host Number of Com.. (0x03|0x0035) plen 5  #139 [hci1] 11.015107
        Num handles: 1
        Handle: 1875 Address: DF:A9:FF:F6:B1:1A (OUI DF-A9-FF)
        Count: 1
< ACL Data TX: Handle 1875 flags 0x00 dlen 21             #140 [hci1] 11.015135
      SMP: Pairing Confirm (0x03) len 16
        Confim value: a85e29925764f68bb63e0e2667d3bd4d
> HCI Event: Number of Completed Packets (0x13) plen 5    #141 [hci1] 11.176268
        Num handles: 1
        Handle: 1875 Address: DF:A9:FF:F6:B1:1A (OUI DF-A9-FF)
        Count: 1
        #140: len 21 (1 Kb/s)
        Latency: 161 msec (83-173 msec ~160 msec)
> ACL Data RX: Handle 1875 flags 0x02 dlen 21             #142 [hci1] 11.176560
      SMP: Pairing Random (0x04) len 16
        Random value: 6e656abd169ed2270000000000000000
< HCI Command: Host Number of Com.. (0x03|0x0035) plen 5  #143 [hci1] 11.195172
        Num handles: 1
        Handle: 1875 Address: DF:A9:FF:F6:B1:1A (OUI DF-A9-FF)
        Count: 1
< ACL Data TX: Handle 1875 flags 0x00 dlen 21             #144 [hci1] 11.195194
      SMP: Pairing Random (0x04) len 16
        Random value: 5c2fff312cdf99c9491988e877355a9a
> HCI Event: Number of Completed Packets (0x13) plen 5    #145 [hci1] 11.351068
        Num handles: 1
        Handle: 1875 Address: DF:A9:FF:F6:B1:1A (OUI DF-A9-FF)
        Count: 1
        #144: len 21 (1 Kb/s)
        Latency: 155 msec (83-173 msec ~158 msec)
> ACL Data RX: Handle 1875 flags 0x02 dlen 21             #146 [hci1] 11.438950
      SMP: Pairing Confirm (0x03) len 16
        Confim value: ff3a066aed015b77ae1da51feb53105e
< HCI Command: Host Number of Com.. (0x03|0x0035) plen 5  #147 [hci1] 11.455185
        Num handles: 1
        Handle: 1875 Address: DF:A9:FF:F6:B1:1A (OUI DF-A9-FF)
        Count: 1
< ACL Data TX: Handle 1875 flags 0x00 dlen 21             #148 [hci1] 11.455212
      SMP: Pairing Confirm (0x03) len 16
        Confim value: df10530e696bbea39fbbc5f8ff97abd9
> HCI Event: Number of Completed Packets (0x13) plen 5    #149 [hci1] 11.613837
        Num handles: 1
        Handle: 1875 Address: DF:A9:FF:F6:B1:1A (OUI DF-A9-FF)
        Count: 1
        #148: len 21 (1 Kb/s)
        Latency: 158 msec (83-173 msec ~158 msec)
> ACL Data RX: Handle 1875 flags 0x02 dlen 21             #150 [hci1] 11.614098
      SMP: Pairing Random (0x04) len 16
        Random value: 39bc200e911f77510000000000000000
< HCI Command: Host Number of Com.. (0x03|0x0035) plen 5  #151 [hci1] 11.615569
        Num handles: 1
        Handle: 1875 Address: DF:A9:FF:F6:B1:1A (OUI DF-A9-FF)
        Count: 1
< ACL Data TX: Handle 1875 flags 0x00 dlen 21             #152 [hci1] 11.615622
      SMP: Pairing Random (0x04) len 16
        Random value: c629a3a987d808e808655d558dfc1155
> HCI Event: Number of Completed Packets (0x13) plen 5    #153 [hci1] 11.788669
        Num handles: 1
        Handle: 1875 Address: DF:A9:FF:F6:B1:1A (OUI DF-A9-FF)
        Count: 1
        #152: len 21 (0 Kb/s)
        Latency: 173 msec (83-173 msec ~165 msec)
> ACL Data RX: Handle 1875 flags 0x02 dlen 21             #154 [hci1] 11.876519
      SMP: Pairing Confirm (0x03) len 16
        Confim value: dd3c03010c57152a81fc925e4f5ccaa0
< HCI Command: Host Number of Com.. (0x03|0x0035) plen 5  #155 [hci1] 11.895162
        Num handles: 1
        Handle: 1875 Address: DF:A9:FF:F6:B1:1A (OUI DF-A9-FF)
        Count: 1
< ACL Data TX: Handle 1875 flags 0x00 dlen 21             #156 [hci1] 11.895171
      SMP: Pairing Confirm (0x03) len 16
        Confim value: f8e13a359e9e57a2ae92d241d600b9a2
> HCI Event: Number of Completed Packets (0x13) plen 5    #157 [hci1] 12.051335
        Num handles: 1
        Handle: 1875 Address: DF:A9:FF:F6:B1:1A (OUI DF-A9-FF)
        Count: 1
        #156: len 21 (1 Kb/s)
        Latency: 156 msec (83-173 msec ~160 msec)
> ACL Data RX: Handle 1875 flags 0x02 dlen 21             #158 [hci1] 12.051575
      SMP: Pairing Random (0x04) len 16
        Random value: f7a3efd2827bf3140000000000000000
< HCI Command: Host Number of Com.. (0x03|0x0035) plen 5  #159 [hci1] 12.055344
        Num handles: 1
        Handle: 1875 Address: DF:A9:FF:F6:B1:1A (OUI DF-A9-FF)
        Count: 1
< ACL Data TX: Handle 1875 flags 0x00 dlen 21             #160 [hci1] 12.055391
      SMP: Pairing Random (0x04) len 16
        Random value: 92f20f6ad8f13724432c7fd6001c45ff
> HCI Event: Number of Completed Packets (0x13) plen 5    #161 [hci1] 12.226053
        Num handles: 1
        Handle: 1875 Address: DF:A9:FF:F6:B1:1A (OUI DF-A9-FF)
        Count: 1
        #160: len 21 (0 Kb/s)
        Latency: 170 msec (83-173 msec ~165 msec)
> ACL Data RX: Handle 1875 flags 0x02 dlen 21             #162 [hci1] 12.313888
      SMP: Pairing Confirm (0x03) len 16
        Confim value: f68c9027554a4a65742ff454741e5b4c
< HCI Command: Host Number of Com.. (0x03|0x0035) plen 5  #163 [hci1] 12.315164
        Num handles: 1
        Handle: 1875 Address: DF:A9:FF:F6:B1:1A (OUI DF-A9-FF)
        Count: 1
< ACL Data TX: Handle 1875 flags 0x00 dlen 21             #164 [hci1] 12.315226
      SMP: Pairing Confirm (0x03) len 16
        Confim value: 35192601ba27800746d769021578e53d
> HCI Event: Number of Completed Packets (0x13) plen 5    #165 [hci1] 12.488932
        Num handles: 1
        Handle: 1875 Address: DF:A9:FF:F6:B1:1A (OUI DF-A9-FF)
        Count: 1
        #164: len 21 (0 Kb/s)
        Latency: 173 msec (83-173 msec ~169 msec)
> ACL Data RX: Handle 1875 flags 0x02 dlen 21             #166 [hci1] 12.489074
      SMP: Pairing Random (0x04) len 16
        Random value: ccf903c9ef2742c60000000000000000
< HCI Command: Host Number of Com.. (0x03|0x0035) plen 5  #167 [hci1] 12.495312
        Num handles: 1
        Handle: 1875 Address: DF:A9:FF:F6:B1:1A (OUI DF-A9-FF)
        Count: 1
< ACL Data TX: Handle 1875 flags 0x00 dlen 21             #168 [hci1] 12.495351
      SMP: Pairing Random (0x04) len 16
        Random value: 23ac32ebbb5e14c8a6b9622f296d277f
> HCI Event: Number of Completed Packets (0x13) plen 5    #169 [hci1] 12.663719
        Num handles: 1
        Handle: 1875 Address: DF:A9:FF:F6:B1:1A (OUI DF-A9-FF)
        Count: 1
        #168: len 21 (1 Kb/s)
        Latency: 168 msec (83-173 msec ~169 msec)
> ACL Data RX: Handle 1875 flags 0x02 dlen 21             #170 [hci1] 12.664113
      SMP: Pairing Confirm (0x03) len 16
        Confim value: 44d4281980ebf71945986c4ccbbb046d
< HCI Command: Host Number of Com.. (0x03|0x0035) plen 5  #171 [hci1] 12.675665
        Num handles: 1
        Handle: 1875 Address: DF:A9:FF:F6:B1:1A (OUI DF-A9-FF)
        Count: 1
< ACL Data TX: Handle 1875 flags 0x00 dlen 21             #172 [hci1] 12.675827
      SMP: Pairing Confirm (0x03) len 16
        Confim value: 0105e1f43a048cebbf458e82dc94668b
> HCI Event: Number of Completed Packets (0x13) plen 5    #173 [hci1] 12.838733
        Num handles: 1
        Handle: 1875 Address: DF:A9:FF:F6:B1:1A (OUI DF-A9-FF)
        Count: 1
        #172: len 21 (1 Kb/s)
        Latency: 162 msec (83-173 msec ~165 msec)
> ACL Data RX: Handle 1875 flags 0x02 dlen 21             #174 [hci1] 12.839087
      SMP: Pairing Random (0x04) len 16
        Random value: 34dd706c992b1e0b0000000000000000
< HCI Command: Host Number of Com.. (0x03|0x0035) plen 5  #175 [hci1] 12.855249
        Num handles: 1
        Handle: 1875 Address: DF:A9:FF:F6:B1:1A (OUI DF-A9-FF)
        Count: 1
< ACL Data TX: Handle 1875 flags 0x00 dlen 21             #176 [hci1] 12.855275
      SMP: Pairing Random (0x04) len 16
        Random value: 297efe85e67448a15f56bd27e3a3cf1d
> HCI Event: Number of Completed Packets (0x13) plen 5    #177 [hci1] 13.013616
        Num handles: 1
        Handle: 1875 Address: DF:A9:FF:F6:B1:1A (OUI DF-A9-FF)
        Count: 1
        #176: len 21 (1 Kb/s)
        Latency: 158 msec (83-173 msec ~162 msec)
> ACL Data RX: Handle 1875 flags 0x02 dlen 21             #178 [hci1] 13.101419
      SMP: Pairing Confirm (0x03) len 16
        Confim value: 8d0d0f7ec6e23ac32c9da38794936e30
< HCI Command: Host Number of Com.. (0x03|0x0035) plen 5  #179 [hci1] 13.115552
        Num handles: 1
        Handle: 1875 Address: DF:A9:FF:F6:B1:1A (OUI DF-A9-FF)
        Count: 1
< ACL Data TX: Handle 1875 flags 0x00 dlen 21             #180 [hci1] 13.115644
      SMP: Pairing Confirm (0x03) len 16
        Confim value: 4bb8ab6a0e06a7a6bbab85377d88f787
> HCI Event: Number of Completed Packets (0x13) plen 5    #181 [hci1] 13.276366
        Num handles: 1
        Handle: 1875 Address: DF:A9:FF:F6:B1:1A (OUI DF-A9-FF)
        Count: 1
        #180: len 21 (1 Kb/s)
        Latency: 160 msec (83-173 msec ~161 msec)
> ACL Data RX: Handle 1875 flags 0x02 dlen 21             #182 [hci1] 13.276608
      SMP: Pairing Random (0x04) len 16
        Random value: bc8095595ed621310000000000000000
< HCI Command: Host Number of Com.. (0x03|0x0035) plen 5  #183 [hci1] 13.295148
        Num handles: 1
        Handle: 1875 Address: DF:A9:FF:F6:B1:1A (OUI DF-A9-FF)
        Count: 1
< ACL Data TX: Handle 1875 flags 0x00 dlen 21             #184 [hci1] 13.295157
      SMP: Pairing Random (0x04) len 16
        Random value: 25a9493fd3ce4faf02be7293595bb7c6
> HCI Event: Number of Completed Packets (0x13) plen 5    #185 [hci1] 13.451049
        Num handles: 1
        Handle: 1875 Address: DF:A9:FF:F6:B1:1A (OUI DF-A9-FF)
        Count: 1
        #184: len 21 (1 Kb/s)
        Latency: 155 msec (83-173 msec ~158 msec)
> ACL Data RX: Handle 1875 flags 0x02 dlen 21             #186 [hci1] 13.538854
      SMP: Pairing Confirm (0x03) len 16
        Confim value: 8e45751b4d80f5b4316c243303809c4b
< HCI Command: Host Number of Com.. (0x03|0x0035) plen 5  #187 [hci1] 13.555539
        Num handles: 1
        Handle: 1875 Address: DF:A9:FF:F6:B1:1A (OUI DF-A9-FF)
        Count: 1
< ACL Data TX: Handle 1875 flags 0x00 dlen 21             #188 [hci1] 13.555624
      SMP: Pairing Confirm (0x03) len 16
        Confim value: 2bc2ef3b80c77fd8f52dd903288fded7
> HCI Event: Number of Completed Packets (0x13) plen 5    #189 [hci1] 13.713786
        Num handles: 1
        Handle: 1875 Address: DF:A9:FF:F6:B1:1A (OUI DF-A9-FF)
        Count: 1
        #188: len 21 (1 Kb/s)
        Latency: 158 msec (83-173 msec ~158 msec)
> ACL Data RX: Handle 1875 flags 0x02 dlen 21             #190 [hci1] 13.714019
      SMP: Pairing Random (0x04) len 16
        Random value: 0757d741fd4e5f9f0000000000000000
< HCI Command: Host Number of Com.. (0x03|0x0035) plen 5  #191 [hci1] 13.715524
        Num handles: 1
        Handle: 1875 Address: DF:A9:FF:F6:B1:1A (OUI DF-A9-FF)
        Count: 1
< ACL Data TX: Handle 1875 flags 0x00 dlen 21             #192 [hci1] 13.715601
      SMP: Pairing Random (0x04) len 16
        Random value: 58f6b41f855a6f6c3560debd84e2affc
> HCI Event: Number of Completed Packets (0x13) plen 5    #193 [hci1] 13.888590
        Num handles: 1
        Handle: 1875 Address: DF:A9:FF:F6:B1:1A (OUI DF-A9-FF)
        Count: 1
        #192: len 21 (0 Kb/s)
        Latency: 172 msec (83-173 msec ~165 msec)
> ACL Data RX: Handle 1875 flags 0x02 dlen 21             #194 [hci1] 13.976347
      SMP: Pairing Confirm (0x03) len 16
        Confim value: 007b8e86048e25eda5fbd569b6bb7fe9
< HCI Command: Host Number of Com.. (0x03|0x0035) plen 5  #195 [hci1] 13.995613
        Num handles: 1
        Handle: 1875 Address: DF:A9:FF:F6:B1:1A (OUI DF-A9-FF)
        Count: 1
< ACL Data TX: Handle 1875 flags 0x00 dlen 21             #196 [hci1] 13.995714
      SMP: Pairing Confirm (0x03) len 16
        Confim value: ca0bc8e9f15c5b2c862e0e8ce212a655
> HCI Event: Number of Completed Packets (0x13) plen 5    #197 [hci1] 14.151287
        Num handles: 1
        Handle: 1875 Address: DF:A9:FF:F6:B1:1A (OUI DF-A9-FF)
        Count: 1
        #196: len 21 (1 Kb/s)
        Latency: 155 msec (83-173 msec ~160 msec)
> ACL Data RX: Handle 1875 flags 0x02 dlen 21             #198 [hci1] 14.151611
      SMP: Pairing Random (0x04) len 16
        Random value: 224249e8b132c2240000000000000000
< HCI Command: Host Number of Com.. (0x03|0x0035) plen 5  #199 [hci1] 14.155223
        Num handles: 1
        Handle: 1875 Address: DF:A9:FF:F6:B1:1A (OUI DF-A9-FF)
        Count: 1
< ACL Data TX: Handle 1875 flags 0x00 dlen 21             #200 [hci1] 14.155248
      SMP: Pairing Random (0x04) len 16
        Random value: b67e7216d5bf664139eda2b542549666
> HCI Event: Number of Completed Packets (0x13) plen 5    #201 [hci1] 14.326037
        Num handles: 1
        Handle: 1875 Address: DF:A9:FF:F6:B1:1A (OUI DF-A9-FF)
        Count: 1
        #200: len 21 (0 Kb/s)
        Latency: 170 msec (83-173 msec ~165 msec)
> ACL Data RX: Handle 1875 flags 0x02 dlen 21             #202 [hci1] 14.413894
      SMP: Pairing Confirm (0x03) len 16
        Confim value: 3dec5f10d3396a524a0d75f23ada4441
< HCI Command: Host Number of Com.. (0x03|0x0035) plen 5  #203 [hci1] 14.415116
        Num handles: 1
        Handle: 1875 Address: DF:A9:FF:F6:B1:1A (OUI DF-A9-FF)
        Count: 1
< ACL Data TX: Handle 1875 flags 0x00 dlen 21             #204 [hci1] 14.415123
      SMP: Pairing Confirm (0x03) len 16
        Confim value: db09c0ae4d9477a58275d98fc9edbde1
> HCI Event: Number of Completed Packets (0x13) plen 5    #205 [hci1] 14.588720
        Num handles: 1
        Handle: 1875 Address: DF:A9:FF:F6:B1:1A (OUI DF-A9-FF)
        Count: 1
        #204: len 21 (0 Kb/s)
        Latency: 173 msec (83-173 msec ~169 msec)
> ACL Data RX: Handle 1875 flags 0x02 dlen 21             #206 [hci1] 14.589188
      SMP: Pairing Random (0x04) len 16
        Random value: d8fc322904551cf00000000000000000
< HCI Command: Host Number of Com.. (0x03|0x0035) plen 5  #207 [hci1] 14.595750
        Num handles: 1
        Handle: 1875 Address: DF:A9:FF:F6:B1:1A (OUI DF-A9-FF)
        Count: 1
< ACL Data TX: Handle 1875 flags 0x00 dlen 21             #208 [hci1] 14.595860
      SMP: Pairing Random (0x04) len 16
        Random value: ed17f76500c95219dd01e09d1e63f87b
> HCI Event: Number of Completed Packets (0x13) plen 5    #209 [hci1] 14.763590
        Num handles: 1
        Handle: 1875 Address: DF:A9:FF:F6:B1:1A (OUI DF-A9-FF)
        Count: 1
        #208: len 21 (1 Kb/s)
        Latency: 167 msec (83-173 msec ~168 msec)
> ACL Data RX: Handle 1875 flags 0x02 dlen 21             #210 [hci1] 14.851304
      SMP: Pairing Confirm (0x03) len 16
        Confim value: 8b78b19c7ff97177750a454820324cec
< HCI Command: Host Number of Com.. (0x03|0x0035) plen 5  #211 [hci1] 14.855156
        Num handles: 1
        Handle: 1875 Address: DF:A9:FF:F6:B1:1A (OUI DF-A9-FF)
        Count: 1
< ACL Data TX: Handle 1875 flags 0x00 dlen 21             #212 [hci1] 14.855162
      SMP: Pairing Confirm (0x03) len 16
        Confim value: feb8ed5c586ea841ffee20f9899885ad
> HCI Event: Number of Completed Packets (0x13) plen 5    #213 [hci1] 15.026244
        Num handles: 1
        Handle: 1875 Address: DF:A9:FF:F6:B1:1A (OUI DF-A9-FF)
        Count: 1
        #212: len 21 (0 Kb/s)
        Latency: 171 msec (83-173 msec ~169 msec)
> ACL Data RX: Handle 1875 flags 0x02 dlen 21             #214 [hci1] 15.026612
      SMP: Pairing Random (0x04) len 16
        Random value: b3a9c480d2d32c110000000000000000
< HCI Command: Host Number of Com.. (0x03|0x0035) plen 5  #215 [hci1] 15.035388
        Num handles: 1
        Handle: 1875 Address: DF:A9:FF:F6:B1:1A (OUI DF-A9-FF)
        Count: 1
< ACL Data TX: Handle 1875 flags 0x00 dlen 21             #216 [hci1] 15.035400
      SMP: Pairing Random (0x04) len 16
        Random value: 81d35d47e1f6006d79c974bd9d9e1ee3
> HCI Event: Number of Completed Packets (0x13) plen 5    #217 [hci1] 15.201065
        Num handles: 1
        Handle: 1875 Address: DF:A9:FF:F6:B1:1A (OUI DF-A9-FF)
        Count: 1
        #216: len 21 (1 Kb/s)
        Latency: 165 msec (83-173 msec ~167 msec)
> ACL Data RX: Handle 1875 flags 0x02 dlen 21             #218 [hci1] 15.288839
      SMP: Pairing Confirm (0x03) len 16
        Confim value: 3fc0e881972308ab990d183cd4ae37b8
< HCI Command: Host Number of Com.. (0x03|0x0035) plen 5  #219 [hci1] 15.295195
        Num handles: 1
        Handle: 1875 Address: DF:A9:FF:F6:B1:1A (OUI DF-A9-FF)
        Count: 1
< ACL Data TX: Handle 1875 flags 0x00 dlen 21             #220 [hci1] 15.295206
      SMP: Pairing Confirm (0x03) len 16
        Confim value: 72693fcd7d84ab0bf56a2fce6f45b801
> HCI Event: Number of Completed Packets (0x13) plen 5    #221 [hci1] 15.463726
        Num handles: 1
        Handle: 1875 Address: DF:A9:FF:F6:B1:1A (OUI DF-A9-FF)
        Count: 1
        #220: len 21 (1 Kb/s)
        Latency: 168 msec (83-173 msec ~168 msec)
> ACL Data RX: Handle 1875 flags 0x02 dlen 21             #222 [hci1] 15.464071
      SMP: Pairing Random (0x04) len 16
        Random value: 8e52732c2c0734450000000000000000
< HCI Command: Host Number of Com.. (0x03|0x0035) plen 5  #223 [hci1] 15.475283
        Num handles: 1
        Handle: 1875 Address: DF:A9:FF:F6:B1:1A (OUI DF-A9-FF)
        Count: 1
< ACL Data TX: Handle 1875 flags 0x00 dlen 21             #224 [hci1] 15.475291
      SMP: Pairing Random (0x04) len 16
        Random value: e7f7e0c2476823e41736a7e381bafb7c
> HCI Event: Number of Completed Packets (0x13) plen 5    #225 [hci1] 15.638622
        Num handles: 1
        Handle: 1875 Address: DF:A9:FF:F6:B1:1A (OUI DF-A9-FF)
        Count: 1
        #224: len 21 (1 Kb/s)
        Latency: 163 msec (83-173 msec ~165 msec)
> ACL Data RX: Handle 1875 flags 0x02 dlen 21             #226 [hci1] 15.726312
      SMP: Pairing Confirm (0x03) len 16
        Confim value: eb45c4672b11a67d2baa66bcd8d04173
< HCI Command: Host Number of Com.. (0x03|0x0035) plen 5  #227 [hci1] 15.735395
        Num handles: 1
        Handle: 1875 Address: DF:A9:FF:F6:B1:1A (OUI DF-A9-FF)
        Count: 1
< ACL Data TX: Handle 1875 flags 0x00 dlen 21             #228 [hci1] 15.735413
      SMP: Pairing Confirm (0x03) len 16
        Confim value: e5dbe6d16502705a93257a5fb031af9a
> HCI Event: Number of Completed Packets (0x13) plen 5    #229 [hci1] 15.901267
        Num handles: 1
        Handle: 1875 Address: DF:A9:FF:F6:B1:1A (OUI DF-A9-FF)
        Count: 1
        #228: len 21 (1 Kb/s)
        Latency: 165 msec (83-173 msec ~165 msec)
> ACL Data RX: Handle 1875 flags 0x02 dlen 21             #230 [hci1] 15.901572
      SMP: Pairing Random (0x04) len 16
        Random value: e468fcbe2f45de5b0000000000000000
< HCI Command: Host Number of Com.. (0x03|0x0035) plen 5  #231 [hci1] 15.915242
        Num handles: 1
        Handle: 1875 Address: DF:A9:FF:F6:B1:1A (OUI DF-A9-FF)
        Count: 1
< ACL Data TX: Handle 1875 flags 0x00 dlen 21             #232 [hci1] 15.915271
      SMP: Pairing Random (0x04) len 16
        Random value: fc8b40d9b0b09bc4296bf8753a8f6e1f
> HCI Event: Number of Completed Packets (0x13) plen 5    #233 [hci1] 16.075981
        Num handles: 1
        Handle: 1875 Address: DF:A9:FF:F6:B1:1A (OUI DF-A9-FF)
        Count: 1
        #232: len 21 (1 Kb/s)
        Latency: 160 msec (83-173 msec ~163 msec)
> ACL Data RX: Handle 1875 flags 0x02 dlen 21             #234 [hci1] 16.251353
      SMP: Pairing DHKey Check (0x0d) len 16
        E: 368d824c1a346e6268189178a850176d
< HCI Command: Host Number of Com.. (0x03|0x0035) plen 5  #235 [hci1] 16.255871
        Num handles: 1
        Handle: 1875 Address: DF:A9:FF:F6:B1:1A (OUI DF-A9-FF)
        Count: 1
< ACL Data TX: Handle 1875 flags 0x00 dlen 21             #236 [hci1] 16.255974
      SMP: Pairing DHKey Check (0x0d) len 16
        E: ea4611fb4966979f8d7e57c2aee81002
> HCI Event: Number of Completed Packets (0x13) plen 5    #237 [hci1] 16.426042
        Num handles: 1
        Handle: 1875 Address: DF:A9:FF:F6:B1:1A (OUI DF-A9-FF)
        Count: 1
        #236: len 21 (0 Kb/s)
        Latency: 170 msec (83-173 msec ~166 msec)
> HCI Event: LE Meta Event (0x3e) plen 13                 #238 [hci1] 16.514072
      LE Long Term Key Request (0x05)
        Handle: 1875 Address: DF:A9:FF:F6:B1:1A (OUI DF-A9-FF)
        Random number: 0x0000000000000000
        Encrypted diversifier: 0x0000
< HCI Command: LE Long Term Key... (0x08|0x001a) plen 18  #239 [hci1] 16.515003
        Handle: 1875 Address: DF:A9:FF:F6:B1:1A (OUI DF-A9-FF)
        Long term key: dd5812ecb37ce1835544576b04cdfe13
> HCI Event: Command Complete (0x0e) plen 6               #240 [hci1] 16.515634
      LE Long Term Key Request Reply (0x08|0x001a) ncmd 1
        Status: Success (0x00)
        Handle: 1875 Address: DF:A9:FF:F6:B1:1A (OUI DF-A9-FF)
> HCI Event: Encryption Change (0x08) plen 4              #241 [hci1] 16.951322
        Status: Success (0x00)
        Handle: 1875 Address: DF:A9:FF:F6:B1:1A (OUI DF-A9-FF)
        Encryption: Enabled with AES-CCM (0x01)
> ACL Data RX: Handle 1875 flags 0x02 dlen 21             #242 [hci1] 17.038909
      SMP: Identity Information (0x08) len 16
        Identity resolving key: 1b4207399075f90780dd5a538d218c0b
< HCI Command: Host Number of Com.. (0x03|0x0035) plen 5  #243 [hci1] 17.065878
        Num handles: 1
        Handle: 1875 Address: DF:A9:FF:F6:B1:1A (OUI DF-A9-FF)
        Count: 1
> ACL Data RX: Handle 1875 flags 0x02 dlen 12             #244 [hci1] 17.213892
      SMP: Identity Address Information (0x09) len 7
        Address: DF:A9:FF:F6:B1:1A (OUI DF-A9-FF)
< HCI Command: LE Add Device To... (0x08|0x0027) plen 39  #245 [hci1] 17.215290
        Address type: Public (0x00)
        Address: DF:A9:FF:F6:B1:1A (OUI DF-A9-FF)
        Peer identity resolving key: 1b4207399075f90780dd5a538d218c0b
        Local identity resolving key: 00000000000000000000000000000000
> HCI Event: Command Complete (0x0e) plen 4               #246 [hci1] 17.216235
      LE Add Device To Resolving List (0x08|0x0027) ncmd 1
        Status: Success (0x00)
< HCI Command: LE Set Privacy Mode (0x08|0x004e) plen 8   #247 [hci1] 17.235199
        Peer Identity address type: Public (0x00)
        Peer Identity address: DF:A9:FF:F6:B1:1A (OUI DF-A9-FF)
        Privacy Mode: Use Device Privacy (0x01)
> HCI Event: Command Complete (0x0e) plen 4               #248 [hci1] 17.235792
      LE Set Privacy Mode (0x08|0x004e) ncmd 1
        Status: Success (0x00)
< HCI Command: LE Set Address Res.. (0x08|0x002d) plen 1  #249 [hci1] 17.255111
        Address resolution: Enabled (0x01)
> HCI Event: Command Complete (0x0e) plen 4               #250 [hci1] 17.255505
      LE Set Address Resolution Enable (0x08|0x002d) ncmd 1
        Status: Success (0x00)
< HCI Command: Host Number of Com.. (0x03|0x0035) plen 5  #251 [hci1] 17.275045
        Num handles: 1
        Handle: 1875 Address: DF:A9:FF:F6:B1:1A (OUI DF-A9-FF)
        Count: 1
> ACL Data RX: Handle 1875 flags 0x02 dlen 13             #252 [hci1] 17.301205
      ATT: Find By Type Value Request (0x06) len 8
        Handle range: 0x0001-0xffff
        Attribute type: Primary Service (0x2800)
          UUID: Telephony Bearer (0x184b)
< HCI Command: Host Number of Com.. (0x03|0x0035) plen 5  #253 [hci1] 17.315225
        Num handles: 1
        Handle: 1875 Address: DF:A9:FF:F6:B1:1A (OUI DF-A9-FF)
        Count: 1
< ACL Data TX: Handle 1875 flags 0x00 dlen 9              #254 [hci1] 17.315252
      ATT: Find By Type Value Response (0x07) len 4
        Handle range: 0x0057-0x0083
> HCI Event: Number of Completed Packets (0x13) plen 5    #255 [hci1] 17.476243
        Num handles: 1
        Handle: 1875 Address: DF:A9:FF:F6:B1:1A (OUI DF-A9-FF)
        Count: 1
        #254: len 9 (0 Kb/s)
        Latency: 160 msec (83-173 msec ~163 msec)
> ACL Data RX: Handle 1875 flags 0x02 dlen 13             #256 [hci1] 17.476339
      ATT: Find By Type Value Request (0x06) len 8
        Handle range: 0x0084-0xffff
        Attribute type: Primary Service (0x2800)
          UUID: Telephony Bearer (0x184b)
< HCI Command: Host Number of Com.. (0x03|0x0035) plen 5  #257 [hci1] 17.495745
        Num handles: 1
        Handle: 1875 Address: DF:A9:FF:F6:B1:1A (OUI DF-A9-FF)
        Count: 1
< ACL Data TX: Handle 1875 flags 0x00 dlen 9              #258 [hci1] 17.495951
      ATT: Error Response (0x01) len 4
        Find By Type Value Request (0x06)
        Handle: 0x0084
        Error: Attribute Not Found (0x0a)
> HCI Event: Number of Completed Packets (0x13) plen 5    #259 [hci1] 17.651245
        Num handles: 1
        Handle: 1875 Address: DF:A9:FF:F6:B1:1A (OUI DF-A9-FF)
        Count: 1
        #258: len 9 (0 Kb/s)
        Latency: 155 msec (83-173 msec ~159 msec)
> ACL Data RX: Handle 1875 flags 0x02 dlen 11             #260 [hci1] 17.651364
      ATT: Read By Type Request (0x08) len 6
        Handle range: 0x0057-0x0083
        Attribute type: Characteristic (0x2803)
< HCI Command: Host Number of Com.. (0x03|0x0035) plen 5  #261 [hci1] 17.655743
        Num handles: 1
        Handle: 1875 Address: DF:A9:FF:F6:B1:1A (OUI DF-A9-FF)
        Count: 1
< ACL Data TX: Handle 1875 flags 0x00 dlen 20             #262 [hci1] 17.655824
      ATT: Read By Type Response (0x09) len 15
        Attribute data length: 7
        Attribute data list: 2 entries
        Handle: 0x0058
        Value: 125900b32b
            Properties: 0x12
              Read (0x02)
              Notify (0x10)
            Value Handle: 0x0059
            Value UUID: Bearer Provider Name (0x2bb3)
        Handle: 0x005b
        Value: 025c00b42b
            Properties: 0x02
              Read (0x02)
            Value Handle: 0x005c
            Value UUID: Bearer UCI (0x2bb4)
> HCI Event: Number of Completed Packets (0x13) plen 5    #263 [hci1] 17.826131
        Num handles: 1
        Handle: 1875 Address: DF:A9:FF:F6:B1:1A (OUI DF-A9-FF)
        Count: 1
        #262: len 20 (0 Kb/s)
        Latency: 170 msec (83-173 msec ~164 msec)
> ACL Data RX: Handle 1875 flags 0x02 dlen 11             #264 [hci1] 17.826328
      ATT: Read By Type Request (0x08) len 6
        Handle range: 0x005c-0x0083
        Attribute type: Characteristic (0x2803)
< HCI Command: Host Number of Com.. (0x03|0x0035) plen 5  #265 [hci1] 17.835420
        Num handles: 1
        Handle: 1875 Address: DF:A9:FF:F6:B1:1A (OUI DF-A9-FF)
        Count: 1
< ACL Data TX: Handle 1875 flags 0x00 dlen 20             #266 [hci1] 17.835438
      ATT: Read By Type Response (0x09) len 15
        Attribute data length: 7
        Attribute data list: 2 entries
        Handle: 0x005d
        Value: 125e00b52b
            Properties: 0x12
              Read (0x02)
              Notify (0x10)
            Value Handle: 0x005e
            Value UUID: Bearer Technology (0x2bb5)
        Handle: 0x0060
        Value: 126100b62b
            Properties: 0x12
              Read (0x02)
              Notify (0x10)
            Value Handle: 0x0061
            Value UUID: Bearer URI Schemes Supported List (0x2bb6)
> HCI Event: Number of Completed Packets (0x13) plen 5    #267 [hci1] 18.001094
        Num handles: 1
        Handle: 1875 Address: DF:A9:FF:F6:B1:1A (OUI DF-A9-FF)
        Count: 1
        #266: len 20 (0 Kb/s)
        Latency: 165 msec (83-173 msec ~165 msec)
> ACL Data RX: Handle 1875 flags 0x02 dlen 11             #268 [hci1] 18.001311
      ATT: Read By Type Request (0x08) len 6
        Handle range: 0x0061-0x0083
        Attribute type: Characteristic (0x2803)
< HCI Command: Host Number of Com.. (0x03|0x0035) plen 5  #269 [hci1] 18.015234
        Num handles: 1
        Handle: 1875 Address: DF:A9:FF:F6:B1:1A (OUI DF-A9-FF)
        Count: 1
< ACL Data TX: Handle 1875 flags 0x00 dlen 20             #270 [hci1] 18.015265
      ATT: Read By Type Response (0x09) len 15
        Attribute data length: 7
        Attribute data list: 2 entries
        Handle: 0x0063
        Value: 126400b72b
            Properties: 0x12
              Read (0x02)
              Notify (0x10)
            Value Handle: 0x0064
            Value UUID: Bearer Signal Strength (0x2bb7)
        Handle: 0x0066
        Value: 0e6700b82b
            Properties: 0x0e
              Read (0x02)
              Write Without Response (0x04)
              Write (0x08)
            Value Handle: 0x0067
            Value UUID: Bearer Signal Strength Reporting Interval (0x2bb8)
> HCI Event: Number of Completed Packets (0x13) plen 5    #271 [hci1] 18.176108
        Num handles: 1
        Handle: 1875 Address: DF:A9:FF:F6:B1:1A (OUI DF-A9-FF)
        Count: 1
        #270: len 20 (1 Kb/s)
        Latency: 160 msec (83-173 msec ~163 msec)
> ACL Data RX: Handle 1875 flags 0x02 dlen 11             #272 [hci1] 18.176352
      ATT: Read By Type Request (0x08) len 6
        Handle range: 0x0067-0x0083
        Attribute type: Characteristic (0x2803)
< HCI Command: Host Number of Com.. (0x03|0x0035) plen 5  #273 [hci1] 18.195837
        Num handles: 1
        Handle: 1875 Address: DF:A9:FF:F6:B1:1A (OUI DF-A9-FF)
        Count: 1
< ACL Data TX: Handle 1875 flags 0x00 dlen 20             #274 [hci1] 18.195948
      ATT: Read By Type Response (0x09) len 15
        Attribute data length: 7
        Attribute data list: 2 entries
        Handle: 0x0068
        Value: 126900b92b
            Properties: 0x12
              Read (0x02)
              Notify (0x10)
            Value Handle: 0x0069
            Value UUID: Bearer List Current Calls (0x2bb9)
        Handle: 0x006b
        Value: 026c00ba2b
            Properties: 0x02
              Read (0x02)
            Value Handle: 0x006c
            Value UUID: Content Control ID (0x2bba)
> HCI Event: Number of Completed Packets (0x13) plen 5    #275 [hci1] 18.351156
        Num handles: 1
        Handle: 1875 Address: DF:A9:FF:F6:B1:1A (OUI DF-A9-FF)
        Count: 1
        #274: len 20 (1 Kb/s)
        Latency: 155 msec (83-173 msec ~159 msec)
> ACL Data RX: Handle 1875 flags 0x02 dlen 11             #276 [hci1] 18.351343
      ATT: Read By Type Request (0x08) len 6
        Handle range: 0x006c-0x0083
        Attribute type: Characteristic (0x2803)
< HCI Command: Host Number of Com.. (0x03|0x0035) plen 5  #277 [hci1] 18.355362
        Num handles: 1
        Handle: 1875 Address: DF:A9:FF:F6:B1:1A (OUI DF-A9-FF)
        Count: 1
< ACL Data TX: Handle 1875 flags 0x00 dlen 20             #278 [hci1] 18.355371
      ATT: Read By Type Response (0x09) len 15
        Attribute data length: 7
        Attribute data list: 2 entries
        Handle: 0x006d
        Value: 126e00bb2b
            Properties: 0x12
              Read (0x02)
              Notify (0x10)
            Value Handle: 0x006e
            Value UUID: Status Flags (0x2bbb)
        Handle: 0x0070
        Value: 127100bc2b
            Properties: 0x12
              Read (0x02)
              Notify (0x10)
            Value Handle: 0x0071
            Value UUID: Incoming Call Target Bearer URI (0x2bbc)
> HCI Event: Number of Completed Packets (0x13) plen 5    #279 [hci1] 18.526170
        Num handles: 1
        Handle: 1875 Address: DF:A9:FF:F6:B1:1A (OUI DF-A9-FF)
        Count: 1
        #278: len 20 (0 Kb/s)
        Latency: 170 msec (83-173 msec ~164 msec)
> ACL Data RX: Handle 1875 flags 0x02 dlen 11             #280 [hci1] 18.526355
      ATT: Read By Type Request (0x08) len 6
        Handle range: 0x0071-0x0083
        Attribute type: Characteristic (0x2803)
< HCI Command: Host Number of Com.. (0x03|0x0035) plen 5  #281 [hci1] 18.535487
        Num handles: 1
        Handle: 1875 Address: DF:A9:FF:F6:B1:1A (OUI DF-A9-FF)
        Count: 1
< ACL Data TX: Handle 1875 flags 0x00 dlen 20             #282 [hci1] 18.535549
      ATT: Read By Type Response (0x09) len 15
        Attribute data length: 7
        Attribute data list: 2 entries
        Handle: 0x0073
        Value: 127400bd2b
            Properties: 0x12
              Read (0x02)
              Notify (0x10)
            Value Handle: 0x0074
            Value UUID: Call State (0x2bbd)
        Handle: 0x0076
        Value: 1c7700be2b
            Properties: 0x1c
              Write Without Response (0x04)
              Write (0x08)
              Notify (0x10)
            Value Handle: 0x0077
            Value UUID: Call Control Point (0x2bbe)
> HCI Event: Number of Completed Packets (0x13) plen 5    #283 [hci1] 18.701269
        Num handles: 1
        Handle: 1875 Address: DF:A9:FF:F6:B1:1A (OUI DF-A9-FF)
        Count: 1
        #282: len 20 (0 Kb/s)
        Latency: 165 msec (83-173 msec ~165 msec)
> ACL Data RX: Handle 1875 flags 0x02 dlen 11             #284 [hci1] 18.701346
      ATT: Read By Type Request (0x08) len 6
        Handle range: 0x0077-0x0083
        Attribute type: Characteristic (0x2803)
< HCI Command: Host Number of Com.. (0x03|0x0035) plen 5  #285 [hci1] 18.715711
        Num handles: 1
        Handle: 1875 Address: DF:A9:FF:F6:B1:1A (OUI DF-A9-FF)
        Count: 1
< ACL Data TX: Handle 1875 flags 0x00 dlen 20             #286 [hci1] 18.715797
      ATT: Read By Type Response (0x09) len 15
        Attribute data length: 7
        Attribute data list: 2 entries
        Handle: 0x0079
        Value: 027a00bf2b
            Properties: 0x02
              Read (0x02)
            Value Handle: 0x007a
            Value UUID: Call Control Point Optional Opcodes (0x2bbf)
        Handle: 0x007b
        Value: 107c00c02b
            Properties: 0x10
              Notify (0x10)
            Value Handle: 0x007c
            Value UUID: Termination Reason (0x2bc0)
> HCI Event: Number of Completed Packets (0x13) plen 5    #287 [hci1] 18.876143
        Num handles: 1
        Handle: 1875 Address: DF:A9:FF:F6:B1:1A (OUI DF-A9-FF)
        Count: 1
        #286: len 20 (1 Kb/s)
        Latency: 160 msec (83-173 msec ~162 msec)
> ACL Data RX: Handle 1875 flags 0x02 dlen 11             #288 [hci1] 18.876282
      ATT: Read By Type Request (0x08) len 6
        Handle range: 0x007c-0x0083
        Attribute type: Characteristic (0x2803)
< HCI Command: Host Number of Com.. (0x03|0x0035) plen 5  #289 [hci1] 18.895231
        Num handles: 1
        Handle: 1875 Address: DF:A9:FF:F6:B1:1A (OUI DF-A9-FF)
        Count: 1
< ACL Data TX: Handle 1875 flags 0x00 dlen 20             #290 [hci1] 18.895264
      ATT: Read By Type Response (0x09) len 15
        Attribute data length: 7
        Attribute data list: 2 entries
        Handle: 0x007e
        Value: 127f00c12b
            Properties: 0x12
              Read (0x02)
              Notify (0x10)
            Value Handle: 0x007f
            Value UUID: Incoming Call (0x2bc1)
        Handle: 0x0081
        Value: 128200c22b
            Properties: 0x12
              Read (0x02)
              Notify (0x10)
            Value Handle: 0x0082
            Value UUID: Call Friendly Name (0x2bc2)
> HCI Event: Number of Completed Packets (0x13) plen 5    #291 [hci1] 19.051145
        Num handles: 1
        Handle: 1875 Address: DF:A9:FF:F6:B1:1A (OUI DF-A9-FF)
        Count: 1
        #290: len 20 (1 Kb/s)
        Latency: 155 msec (83-173 msec ~159 msec)
> ACL Data RX: Handle 1875 flags 0x02 dlen 11             #292 [hci1] 19.051311
      ATT: Read By Type Request (0x08) len 6
        Handle range: 0x0082-0x0083
        Attribute type: Characteristic (0x2803)
< HCI Command: Host Number of Com.. (0x03|0x0035) plen 5  #293 [hci1] 19.055345
        Num handles: 1
        Handle: 1875 Address: DF:A9:FF:F6:B1:1A (OUI DF-A9-FF)
        Count: 1
< ACL Data TX: Handle 1875 flags 0x00 dlen 9              #294 [hci1] 19.055381
      ATT: Error Response (0x01) len 4
        Read By Type Request (0x08)
        Handle: 0x0082
        Error: Attribute Not Found (0x0a)
> HCI Event: Number of Completed Packets (0x13) plen 5    #295 [hci1] 19.226102
        Num handles: 1
        Handle: 1875 Address: DF:A9:FF:F6:B1:1A (OUI DF-A9-FF)
        Count: 1
        #294: len 9 (0 Kb/s)
        Latency: 170 msec (83-173 msec ~165 msec)
> ACL Data RX: Handle 1875 flags 0x02 dlen 9              #296 [hci1] 19.226283
      ATT: Find Information Request (0x04) len 4
        Handle range: 0x005a-0x005a
< HCI Command: Host Number of Com.. (0x03|0x0035) plen 5  #297 [hci1] 19.235344
        Num handles: 1
        Handle: 1875 Address: DF:A9:FF:F6:B1:1A (OUI DF-A9-FF)
        Count: 1
< ACL Data TX: Handle 1875 flags 0x00 dlen 10             #298 [hci1] 19.235351
      ATT: Find Information Response (0x05) len 5
        Format: UUID-16 (0x01)
        Handle: 0x005a
        UUID: Client Characteristic Configuration (0x2902)
> HCI Event: Number of Completed Packets (0x13) plen 5    #299 [hci1] 19.401007
        Num handles: 1
        Handle: 1875 Address: DF:A9:FF:F6:B1:1A (OUI DF-A9-FF)
        Count: 1
        #298: len 10 (0 Kb/s)
        Latency: 165 msec (83-173 msec ~165 msec)
> ACL Data RX: Handle 1875 flags 0x02 dlen 9              #300 [hci1] 19.401307
      ATT: Find Information Request (0x04) len 4
        Handle range: 0x005f-0x005f
< HCI Command: Host Number of Com.. (0x03|0x0035) plen 5  #301 [hci1] 19.415246
        Num handles: 1
        Handle: 1875 Address: DF:A9:FF:F6:B1:1A (OUI DF-A9-FF)
        Count: 1
< ACL Data TX: Handle 1875 flags 0x00 dlen 10             #302 [hci1] 19.415273
      ATT: Find Information Response (0x05) len 5
        Format: UUID-16 (0x01)
        Handle: 0x005f
        UUID: Client Characteristic Configuration (0x2902)
> HCI Event: Number of Completed Packets (0x13) plen 5    #303 [hci1] 19.576023
        Num handles: 1
        Handle: 1875 Address: DF:A9:FF:F6:B1:1A (OUI DF-A9-FF)
        Count: 1
        #302: len 10 (0 Kb/s)
        Latency: 160 msec (83-173 msec ~163 msec)
> ACL Data RX: Handle 1875 flags 0x02 dlen 9              #304 [hci1] 19.576263
      ATT: Find Information Request (0x04) len 4
        Handle range: 0x0062-0x0062
< HCI Command: Host Number of Com.. (0x03|0x0035) plen 5  #305 [hci1] 19.595325
        Num handles: 1
        Handle: 1875 Address: DF:A9:FF:F6:B1:1A (OUI DF-A9-FF)
        Count: 1
< ACL Data TX: Handle 1875 flags 0x00 dlen 10             #306 [hci1] 19.595374
      ATT: Find Information Response (0x05) len 5
        Format: UUID-16 (0x01)
        Handle: 0x0062
        UUID: Client Characteristic Configuration (0x2902)
> HCI Event: Number of Completed Packets (0x13) plen 5    #307 [hci1] 19.751122
        Num handles: 1
        Handle: 1875 Address: DF:A9:FF:F6:B1:1A (OUI DF-A9-FF)
        Count: 1
        #306: len 10 (0 Kb/s)
        Latency: 155 msec (83-173 msec ~159 msec)
> ACL Data RX: Handle 1875 flags 0x02 dlen 9              #308 [hci1] 19.751219
      ATT: Find Information Request (0x04) len 4
        Handle range: 0x0065-0x0065
< HCI Command: Host Number of Com.. (0x03|0x0035) plen 5  #309 [hci1] 19.755484
        Num handles: 1
        Handle: 1875 Address: DF:A9:FF:F6:B1:1A (OUI DF-A9-FF)
        Count: 1
< ACL Data TX: Handle 1875 flags 0x00 dlen 10             #310 [hci1] 19.755541
      ATT: Find Information Response (0x05) len 5
        Format: UUID-16 (0x01)
        Handle: 0x0065
        UUID: Client Characteristic Configuration (0x2902)
> HCI Event: Number of Completed Packets (0x13) plen 5    #311 [hci1] 19.926079
        Num handles: 1
        Handle: 1875 Address: DF:A9:FF:F6:B1:1A (OUI DF-A9-FF)
        Count: 1
        #310: len 10 (0 Kb/s)
        Latency: 170 msec (83-173 msec ~164 msec)
> ACL Data RX: Handle 1875 flags 0x02 dlen 9              #312 [hci1] 19.926236
      ATT: Find Information Request (0x04) len 4
        Handle range: 0x006a-0x006a
< HCI Command: Host Number of Com.. (0x03|0x0035) plen 5  #313 [hci1] 19.935236
        Num handles: 1
        Handle: 1875 Address: DF:A9:FF:F6:B1:1A (OUI DF-A9-FF)
        Count: 1
< ACL Data TX: Handle 1875 flags 0x00 dlen 10             #314 [hci1] 19.935273
      ATT: Find Information Response (0x05) len 5
        Format: UUID-16 (0x01)
        Handle: 0x006a
        UUID: Client Characteristic Configuration (0x2902)
> HCI Event: Number of Completed Packets (0x13) plen 5    #315 [hci1] 20.101119
        Num handles: 1
        Handle: 1875 Address: DF:A9:FF:F6:B1:1A (OUI DF-A9-FF)
        Count: 1
        #314: len 10 (0 Kb/s)
        Latency: 165 msec (83-173 msec ~165 msec)
> ACL Data RX: Handle 1875 flags 0x02 dlen 9              #316 [hci1] 20.101272
      ATT: Find Information Request (0x04) len 4
        Handle range: 0x006f-0x006f
< HCI Command: Host Number of Com.. (0x03|0x0035) plen 5  #317 [hci1] 20.115349
        Num handles: 1
        Handle: 1875 Address: DF:A9:FF:F6:B1:1A (OUI DF-A9-FF)
        Count: 1
< ACL Data TX: Handle 1875 flags 0x00 dlen 10             #318 [hci1] 20.115401
      ATT: Find Information Response (0x05) len 5
        Format: UUID-16 (0x01)
        Handle: 0x006f
        UUID: Client Characteristic Configuration (0x2902)
> HCI Event: Number of Completed Packets (0x13) plen 5    #319 [hci1] 20.276102
        Num handles: 1
        Handle: 1875 Address: DF:A9:FF:F6:B1:1A (OUI DF-A9-FF)
        Count: 1
        #318: len 10 (0 Kb/s)
        Latency: 160 msec (83-173 msec ~163 msec)
> ACL Data RX: Handle 1875 flags 0x02 dlen 9              #320 [hci1] 20.276261
      ATT: Find Information Request (0x04) len 4
        Handle range: 0x0072-0x0072
< HCI Command: Host Number of Com.. (0x03|0x0035) plen 5  #321 [hci1] 20.295804
        Num handles: 1
        Handle: 1875 Address: DF:A9:FF:F6:B1:1A (OUI DF-A9-FF)
        Count: 1
< ACL Data TX: Handle 1875 flags 0x00 dlen 10             #322 [hci1] 20.295975
      ATT: Find Information Response (0x05) len 5
        Format: UUID-16 (0x01)
        Handle: 0x0072
        UUID: Client Characteristic Configuration (0x2902)
> HCI Event: Number of Completed Packets (0x13) plen 5    #323 [hci1] 20.451042
        Num handles: 1
        Handle: 1875 Address: DF:A9:FF:F6:B1:1A (OUI DF-A9-FF)
        Count: 1
        #322: len 10 (0 Kb/s)
        Latency: 155 msec (83-173 msec ~159 msec)
> ACL Data RX: Handle 1875 flags 0x02 dlen 9              #324 [hci1] 20.451278
      ATT: Find Information Request (0x04) len 4
        Handle range: 0x0075-0x0075
< HCI Command: Host Number of Com.. (0x03|0x0035) plen 5  #325 [hci1] 20.455326
        Num handles: 1
        Handle: 1875 Address: DF:A9:FF:F6:B1:1A (OUI DF-A9-FF)
        Count: 1
< ACL Data TX: Handle 1875 flags 0x00 dlen 10             #326 [hci1] 20.455333
      ATT: Find Information Response (0x05) len 5
        Format: UUID-16 (0x01)
        Handle: 0x0075
        UUID: Client Characteristic Configuration (0x2902)
> HCI Event: Number of Completed Packets (0x13) plen 5    #327 [hci1] 20.626053
        Num handles: 1
        Handle: 1875 Address: DF:A9:FF:F6:B1:1A (OUI DF-A9-FF)
        Count: 1
        #326: len 10 (0 Kb/s)
        Latency: 170 msec (83-173 msec ~164 msec)
> ACL Data RX: Handle 1875 flags 0x02 dlen 9              #328 [hci1] 20.626256
      ATT: Find Information Request (0x04) len 4
        Handle range: 0x0078-0x0078
< HCI Command: Host Number of Com.. (0x03|0x0035) plen 5  #329 [hci1] 20.635473
        Num handles: 1
        Handle: 1875 Address: DF:A9:FF:F6:B1:1A (OUI DF-A9-FF)
        Count: 1
< ACL Data TX: Handle 1875 flags 0x00 dlen 10             #330 [hci1] 20.635531
      ATT: Find Information Response (0x05) len 5
        Format: UUID-16 (0x01)
        Handle: 0x0078
        UUID: Client Characteristic Configuration (0x2902)
> HCI Event: Number of Completed Packets (0x13) plen 5    #331 [hci1] 20.801053
        Num handles: 1
        Handle: 1875 Address: DF:A9:FF:F6:B1:1A (OUI DF-A9-FF)
        Count: 1
        #330: len 10 (0 Kb/s)
        Latency: 165 msec (83-173 msec ~165 msec)
> ACL Data RX: Handle 1875 flags 0x02 dlen 9              #332 [hci1] 20.801268
      ATT: Find Information Request (0x04) len 4
        Handle range: 0x007d-0x007d
< HCI Command: Host Number of Com.. (0x03|0x0035) plen 5  #333 [hci1] 20.815347
        Num handles: 1
        Handle: 1875 Address: DF:A9:FF:F6:B1:1A (OUI DF-A9-FF)
        Count: 1
< ACL Data TX: Handle 1875 flags 0x00 dlen 10             #334 [hci1] 20.815354
      ATT: Find Information Response (0x05) len 5
        Format: UUID-16 (0x01)
        Handle: 0x007d
        UUID: Client Characteristic Configuration (0x2902)
> HCI Event: Number of Completed Packets (0x13) plen 5    #335 [hci1] 20.976070
        Num handles: 1
        Handle: 1875 Address: DF:A9:FF:F6:B1:1A (OUI DF-A9-FF)
        Count: 1
        #334: len 10 (0 Kb/s)
        Latency: 160 msec (83-173 msec ~162 msec)
> ACL Data RX: Handle 1875 flags 0x02 dlen 9              #336 [hci1] 20.976266
      ATT: Find Information Request (0x04) len 4
        Handle range: 0x0080-0x0080
< HCI Command: Host Number of Com.. (0x03|0x0035) plen 5  #337 [hci1] 20.995367
        Num handles: 1
        Handle: 1875 Address: DF:A9:FF:F6:B1:1A (OUI DF-A9-FF)
        Count: 1
< ACL Data TX: Handle 1875 flags 0x00 dlen 10             #338 [hci1] 20.995445
      ATT: Find Information Response (0x05) len 5
        Format: UUID-16 (0x01)
        Handle: 0x0080
        UUID: Client Characteristic Configuration (0x2902)
> HCI Event: Number of Completed Packets (0x13) plen 5    #339 [hci1] 21.151079
        Num handles: 1
        Handle: 1875 Address: DF:A9:FF:F6:B1:1A (OUI DF-A9-FF)
        Count: 1
        #338: len 10 (0 Kb/s)
        Latency: 155 msec (83-173 msec ~159 msec)
> ACL Data RX: Handle 1875 flags 0x02 dlen 9              #340 [hci1] 21.151276
      ATT: Find Information Request (0x04) len 4
        Handle range: 0x0083-0x0083
< HCI Command: Host Number of Com.. (0x03|0x0035) plen 5  #341 [hci1] 21.155332
        Num handles: 1
        Handle: 1875 Address: DF:A9:FF:F6:B1:1A (OUI DF-A9-FF)
        Count: 1
< ACL Data TX: Handle 1875 flags 0x00 dlen 10             #342 [hci1] 21.155358
      ATT: Find Information Response (0x05) len 5
        Format: UUID-16 (0x01)
        Handle: 0x0083
        UUID: Client Characteristic Configuration (0x2902)
> HCI Event: Number of Completed Packets (0x13) plen 5    #343 [hci1] 21.326144
        Num handles: 1
        Handle: 1875 Address: DF:A9:FF:F6:B1:1A (OUI DF-A9-FF)
        Count: 1
        #342: len 10 (0 Kb/s)
        Latency: 170 msec (83-173 msec ~165 msec)
> ACL Data RX: Handle 1875 flags 0x02 dlen 9              #344 [hci1] 21.326245
      ATT: Write Request (0x12) len 4
        Handle: 0x0075
          Data: 0000
< HCI Command: Host Number of Com.. (0x03|0x0035) plen 5  #345 [hci1] 21.335672
        Num handles: 1
        Handle: 1875 Address: DF:A9:FF:F6:B1:1A (OUI DF-A9-FF)
        Count: 1
< ACL Data TX: Handle 1875 flags 0x00 dlen 5              #346 [hci1] 21.335841
      ATT: Write Response (0x13) len 0
> HCI Event: Number of Completed Packets (0x13) plen 5    #347 [hci1] 21.501065
        Num handles: 1
        Handle: 1875 Address: DF:A9:FF:F6:B1:1A (OUI DF-A9-FF)
        Count: 1
        #346: len 5 (0 Kb/s)
        Latency: 165 msec (83-173 msec ~165 msec)
> ACL Data RX: Handle 1875 flags 0x02 dlen 9              #348 [hci1] 21.501269
      ATT: Write Request (0x12) len 4
        Handle: 0x0075
          Data: 0100
< HCI Command: Host Number of Com.. (0x03|0x0035) plen 5  #349 [hci1] 21.515251
        Num handles: 1
        Handle: 1875 Address: DF:A9:FF:F6:B1:1A (OUI DF-A9-FF)
        Count: 1
< ACL Data TX: Handle 1875 flags 0x00 dlen 5              #350 [hci1] 21.515280
      ATT: Write Response (0x13) len 0
> HCI Event: Number of Completed Packets (0x13) plen 5    #351 [hci1] 21.676113
        Num handles: 1
        Handle: 1875 Address: DF:A9:FF:F6:B1:1A (OUI DF-A9-FF)
        Count: 1
        #350: len 5 (0 Kb/s)
        Latency: 160 msec (83-173 msec ~162 msec)
> ACL Data RX: Handle 1875 flags 0x02 dlen 9              #352 [hci1] 21.676334
      ATT: Write Request (0x12) len 4
        Handle: 0x0080
          Data: 0000
< HCI Command: Host Number of Com.. (0x03|0x0035) plen 5  #353 [hci1] 21.695559
        Num handles: 1
        Handle: 1875 Address: DF:A9:FF:F6:B1:1A (OUI DF-A9-FF)
        Count: 1
< ACL Data TX: Handle 1875 flags 0x00 dlen 5              #354 [hci1] 21.695625
      ATT: Write Response (0x13) len 0
> HCI Event: Number of Completed Packets (0x13) plen 5    #355 [hci1] 21.851185
        Num handles: 1
        Handle: 1875 Address: DF:A9:FF:F6:B1:1A (OUI DF-A9-FF)
        Count: 1
        #354: len 5 (0 Kb/s)
        Latency: 155 msec (83-173 msec ~159 msec)
> ACL Data RX: Handle 1875 flags 0x02 dlen 9              #356 [hci1] 21.851241
      ATT: Write Request (0x12) len 4
        Handle: 0x0080
          Data: 0100
< HCI Command: Host Number of Com.. (0x03|0x0035) plen 5  #357 [hci1] 21.855809
        Num handles: 1
        Handle: 1875 Address: DF:A9:FF:F6:B1:1A (OUI DF-A9-FF)
        Count: 1
< ACL Data TX: Handle 1875 flags 0x00 dlen 5              #358 [hci1] 21.855887
      ATT: Write Response (0x13) len 0
> HCI Event: Number of Completed Packets (0x13) plen 5    #359 [hci1] 22.026030
        Num handles: 1
        Handle: 1875 Address: DF:A9:FF:F6:B1:1A (OUI DF-A9-FF)
        Count: 1
        #358: len 5 (0 Kb/s)
        Latency: 170 msec (83-173 msec ~164 msec)
> ACL Data RX: Handle 1875 flags 0x02 dlen 9              #360 [hci1] 22.026246
      ATT: Write Request (0x12) len 4
        Handle: 0x007d
          Data: 0000
< HCI Command: Host Number of Com.. (0x03|0x0035) plen 5  #361 [hci1] 22.035281
        Num handles: 1
        Handle: 1875 Address: DF:A9:FF:F6:B1:1A (OUI DF-A9-FF)
        Count: 1
< ACL Data TX: Handle 1875 flags 0x00 dlen 5              #362 [hci1] 22.035310
      ATT: Write Response (0x13) len 0
> HCI Event: Number of Completed Packets (0x13) plen 5    #363 [hci1] 22.201028
        Num handles: 1
        Handle: 1875 Address: DF:A9:FF:F6:B1:1A (OUI DF-A9-FF)
        Count: 1
        #362: len 5 (0 Kb/s)
        Latency: 165 msec (83-173 msec ~165 msec)
> ACL Data RX: Handle 1875 flags 0x02 dlen 9              #364 [hci1] 22.201217
      ATT: Write Request (0x12) len 4
        Handle: 0x007d
          Data: 0100
< HCI Command: Host Number of Com.. (0x03|0x0035) plen 5  #365 [hci1] 22.215412
        Num handles: 1
        Handle: 1875 Address: DF:A9:FF:F6:B1:1A (OUI DF-A9-FF)
        Count: 1
< ACL Data TX: Handle 1875 flags 0x00 dlen 5              #366 [hci1] 22.215439
      ATT: Write Response (0x13) len 0
> HCI Event: Number of Completed Packets (0x13) plen 5    #367 [hci1] 22.376011
        Num handles: 1
        Handle: 1875 Address: DF:A9:FF:F6:B1:1A (OUI DF-A9-FF)
        Count: 1
        #366: len 5 (0 Kb/s)
        Latency: 160 msec (83-173 msec ~162 msec)
> ACL Data RX: Handle 1875 flags 0x02 dlen 9              #368 [hci1] 22.376327
      ATT: Write Request (0x12) len 4
        Handle: 0x0078
          Data: 0000
< HCI Command: Host Number of Com.. (0x03|0x0035) plen 5  #369 [hci1] 22.395955
        Num handles: 1
        Handle: 1875 Address: DF:A9:FF:F6:B1:1A (OUI DF-A9-FF)
        Count: 1
< ACL Data TX: Handle 1875 flags 0x00 dlen 5              #370 [hci1] 22.396107
      ATT: Write Response (0x13) len 0
> HCI Event: Number of Completed Packets (0x13) plen 5    #371 [hci1] 22.551029
        Num handles: 1
        Handle: 1875 Address: DF:A9:FF:F6:B1:1A (OUI DF-A9-FF)
        Count: 1
        #370: len 5 (0 Kb/s)
        Latency: 154 msec (83-173 msec ~158 msec)
> ACL Data RX: Handle 1875 flags 0x02 dlen 9              #372 [hci1] 22.551229
      ATT: Write Request (0x12) len 4
        Handle: 0x0078
          Data: 0100
< HCI Command: Host Number of Com.. (0x03|0x0035) plen 5  #373 [hci1] 22.555345
        Num handles: 1
        Handle: 1875 Address: DF:A9:FF:F6:B1:1A (OUI DF-A9-FF)
        Count: 1
< ACL Data TX: Handle 1875 flags 0x00 dlen 5              #374 [hci1] 22.555380
      ATT: Write Response (0x13) len 0
> HCI Event: Number of Completed Packets (0x13) plen 5    #375 [hci1] 22.726117
        Num handles: 1
        Handle: 1875 Address: DF:A9:FF:F6:B1:1A (OUI DF-A9-FF)
        Count: 1
        #374: len 5 (0 Kb/s)
        Latency: 170 msec (83-173 msec ~164 msec)
> ACL Data RX: Handle 1875 flags 0x02 dlen 9              #376 [hci1] 22.726238
      ATT: Write Request (0x12) len 4
        Handle: 0x0072
          Data: 0000
< HCI Command: Host Number of Com.. (0x03|0x0035) plen 5  #377 [hci1] 22.735348
        Num handles: 1
        Handle: 1875 Address: DF:A9:FF:F6:B1:1A (OUI DF-A9-FF)
        Count: 1
< ACL Data TX: Handle 1875 flags 0x00 dlen 5              #378 [hci1] 22.735358
      ATT: Write Response (0x13) len 0
> HCI Event: Number of Completed Packets (0x13) plen 5    #379 [hci1] 22.901054
        Num handles: 1
        Handle: 1875 Address: DF:A9:FF:F6:B1:1A (OUI DF-A9-FF)
        Count: 1
        #378: len 5 (0 Kb/s)
        Latency: 165 msec (83-173 msec ~165 msec)
> ACL Data RX: Handle 1875 flags 0x02 dlen 9              #380 [hci1] 22.901201
      ATT: Write Request (0x12) len 4
        Handle: 0x0072
          Data: 0100
< HCI Command: Host Number of Com.. (0x03|0x0035) plen 5  #381 [hci1] 22.915893
        Num handles: 1
        Handle: 1875 Address: DF:A9:FF:F6:B1:1A (OUI DF-A9-FF)
        Count: 1
< ACL Data TX: Handle 1875 flags 0x00 dlen 5              #382 [hci1] 22.915947
      ATT: Write Response (0x13) len 0
> HCI Event: Number of Completed Packets (0x13) plen 5    #383 [hci1] 23.076017
        Num handles: 1
        Handle: 1875 Address: DF:A9:FF:F6:B1:1A (OUI DF-A9-FF)
        Count: 1
        #382: len 5 (0 Kb/s)
        Latency: 160 msec (83-173 msec ~162 msec)
> ACL Data RX: Handle 1875 flags 0x02 dlen 9              #384 [hci1] 23.076187
      ATT: Write Request (0x12) len 4
        Handle: 0x0083
          Data: 0000
< HCI Command: Host Number of Com.. (0x03|0x0035) plen 5  #385 [hci1] 23.095343
        Num handles: 1
        Handle: 1875 Address: DF:A9:FF:F6:B1:1A (OUI DF-A9-FF)
        Count: 1
< ACL Data TX: Handle 1875 flags 0x00 dlen 5              #386 [hci1] 23.095365
      ATT: Write Response (0x13) len 0
> HCI Event: Number of Completed Packets (0x13) plen 5    #387 [hci1] 23.251154
        Num handles: 1
        Handle: 1875 Address: DF:A9:FF:F6:B1:1A (OUI DF-A9-FF)
        Count: 1
        #386: len 5 (0 Kb/s)
        Latency: 155 msec (83-173 msec ~159 msec)
> ACL Data RX: Handle 1875 flags 0x02 dlen 9              #388 [hci1] 23.251300
      ATT: Write Request (0x12) len 4
        Handle: 0x0083
          Data: 0100
< HCI Command: Host Number of Com.. (0x03|0x0035) plen 5  #389 [hci1] 23.255344
        Num handles: 1
        Handle: 1875 Address: DF:A9:FF:F6:B1:1A (OUI DF-A9-FF)
        Count: 1
< ACL Data TX: Handle 1875 flags 0x00 dlen 5              #390 [hci1] 23.255361
      ATT: Write Response (0x13) len 0
> HCI Event: Number of Completed Packets (0x13) plen 5    #391 [hci1] 23.426032
        Num handles: 1
        Handle: 1875 Address: DF:A9:FF:F6:B1:1A (OUI DF-A9-FF)
        Count: 1
        #390: len 5 (0 Kb/s)
        Latency: 170 msec (83-173 msec ~164 msec)
> ACL Data RX: Handle 1875 flags 0x02 dlen 9              #392 [hci1] 23.426218
      ATT: Write Request (0x12) len 4
        Handle: 0x0065
          Data: 0000
< HCI Command: Host Number of Com.. (0x03|0x0035) plen 5  #393 [hci1] 23.435903
        Num handles: 1
        Handle: 1875 Address: DF:A9:FF:F6:B1:1A (OUI DF-A9-FF)
        Count: 1
< ACL Data TX: Handle 1875 flags 0x00 dlen 5              #394 [hci1] 23.436064
      ATT: Write Response (0x13) len 0
> HCI Event: Number of Completed Packets (0x13) plen 5    #395 [hci1] 23.601092
        Num handles: 1
        Handle: 1875 Address: DF:A9:FF:F6:B1:1A (OUI DF-A9-FF)
        Count: 1
        #394: len 5 (0 Kb/s)
        Latency: 165 msec (83-173 msec ~164 msec)
> ACL Data RX: Handle 1875 flags 0x02 dlen 9              #396 [hci1] 23.601161
      ATT: Write Request (0x12) len 4
        Handle: 0x0065
          Data: 0100
< HCI Command: Host Number of Com.. (0x03|0x0035) plen 5  #397 [hci1] 23.615361
        Num handles: 1
        Handle: 1875 Address: DF:A9:FF:F6:B1:1A (OUI DF-A9-FF)
        Count: 1
< ACL Data TX: Handle 1875 flags 0x00 dlen 5              #398 [hci1] 23.615395
      ATT: Write Response (0x13) len 0
> HCI Event: Number of Completed Packets (0x13) plen 5    #399 [hci1] 23.776048
        Num handles: 1
        Handle: 1875 Address: DF:A9:FF:F6:B1:1A (OUI DF-A9-FF)
        Count: 1
        #398: len 5 (0 Kb/s)
        Latency: 160 msec (83-173 msec ~162 msec)
> ACL Data RX: Handle 1875 flags 0x02 dlen 7              #400 [hci1] 23.776158
      ATT: Read Request (0x0a) len 2
        Handle: 0x006e
< HCI Command: Host Number of Com.. (0x03|0x0035) plen 5  #401 [hci1] 23.795538
        Num handles: 1
        Handle: 1875 Address: DF:A9:FF:F6:B1:1A (OUI DF-A9-FF)
        Count: 1
< ACL Data TX: Handle 1875 flags 0x00 dlen 7              #402 [hci1] 23.795620
      ATT: Read Response (0x0b) len 2
> HCI Event: Number of Completed Packets (0x13) plen 5    #403 [hci1] 23.951066
        Num handles: 1
        Handle: 1875 Address: DF:A9:FF:F6:B1:1A (OUI DF-A9-FF)
        Count: 1
        #402: len 7 (0 Kb/s)
        Latency: 155 msec (83-173 msec ~159 msec)
> ACL Data RX: Handle 1875 flags 0x02 dlen 7              #404 [hci1] 23.951166
      ATT: Read Request (0x0a) len 2
        Handle: 0x007a
< HCI Command: Host Number of Com.. (0x03|0x0035) plen 5  #405 [hci1] 23.955421
        Num handles: 1
        Handle: 1875 Address: DF:A9:FF:F6:B1:1A (OUI DF-A9-FF)
        Count: 1
< ACL Data TX: Handle 1875 flags 0x00 dlen 7              #406 [hci1] 23.955488
      ATT: Read Response (0x0b) len 2
> HCI Event: Number of Completed Packets (0x13) plen 5    #407 [hci1] 24.125979
        Num handles: 1
        Handle: 1875 Address: DF:A9:FF:F6:B1:1A (OUI DF-A9-FF)
        Count: 1
        #406: len 7 (0 Kb/s)
        Latency: 170 msec (83-173 msec ~164 msec)
> ACL Data RX: Handle 1875 flags 0x02 dlen 8              #408 [hci1] 24.126175
      ATT: Write Request (0x12) len 3
        Handle: 0x0067
          Data: 0a
< HCI Command: Host Number of Com.. (0x03|0x0035) plen 5  #409 [hci1] 24.135349
        Num handles: 1
        Handle: 1875 Address: DF:A9:FF:F6:B1:1A (OUI DF-A9-FF)
        Count: 1
< ACL Data TX: Handle 1875 flags 0x00 dlen 5              #410 [hci1] 24.135424
      ATT: Write Response (0x13) len 0
> HCI Event: Number of Completed Packets (0x13) plen 5    #411 [hci1] 24.300860
        Num handles: 1
        Handle: 1875 Address: DF:A9:FF:F6:B1:1A (OUI DF-A9-FF)
        Count: 1
        #410: len 5 (0 Kb/s)
        Latency: 165 msec (83-173 msec ~165 msec)
< ACL Data TX: Handle 1875 flags 0x00 dlen 8              #412 [hci1] 24.525468
      ATT: Handle Value Notification (0x1b) len 3
        Handle: 0x0064
          Data: 0a
> HCI Event: Number of Completed Packets (0x13) plen 5    #413 [hci1] 24.650920
        Num handles: 1
        Handle: 1875 Address: DF:A9:FF:F6:B1:1A (OUI DF-A9-FF)
        Count: 1
        #412: len 8 (0 Kb/s)
        Latency: 125 msec (83-173 msec ~145 msec)
< ACL Data TX: Handle 1875 flags 0x00 dlen 8              #414 [hci1] 34.535371
      ATT: Handle Value Notification (0x1b) len 3
        Handle: 0x0064
          Data: 07
> HCI Event: Number of Completed Packets (0x13) plen 5    #415 [hci1] 34.625783
        Num handles: 1
        Handle: 1875 Address: DF:A9:FF:F6:B1:1A (OUI DF-A9-FF)
        Count: 1
        #414: len 8 (0 Kb/s)
        Latency: 90 msec (83-173 msec ~117 msec)
< ACL Data TX: Handle 1875 flags 0x00 dlen 8              #416 [hci1] 44.545790
      ATT: Handle Value Notification (0x1b) len 3
        Handle: 0x0064
          Data: 0a
> HCI Event: Number of Completed Packets (0x13) plen 5    #417 [hci1] 44.688075
        Num handles: 1
        Handle: 1875 Address: DF:A9:FF:F6:B1:1A (OUI DF-A9-FF)
        Count: 1
        #416: len 8 (0 Kb/s)
        Latency: 142 msec (83-173 msec ~130 msec)
> HCI Event: Disconnect Complete (0x05) plen 4            #418 [hci1] 46.088338
        Status: Success (0x00)
        Handle: 1875 Address: DF:A9:FF:F6:B1:1A (OUI DF-A9-FF)
        Reason: Remote User Terminated Connection (0x13)
< HCI Command: Reset (0x03|0x0003) plen 0                 #419 [hci1] 51.855519
> HCI Event: Command Complete (0x0e) plen 4               #420 [hci1] 51.856066
      Reset (0x03|0x0003) ncmd 1
        Status: Success (0x00)
@ USER Close: main                                    {0x0001} [hci1] 51.875361
= Close Index: 00:00:00:00:00:00                               [hci1] 51.879445
