Bluetooth monitor ver 5.72
= Note: Linux version 6.14.0-36-generic (x86_64)                       0.108887
= Note: Bluetooth subsystem version 2.22                               0.108889
= New Index: 00:00:00:00:00:00 (Primary,UART,hci1)              [hci1] 0.108890
= New Index: 48:5F:99:8E:E0:64 (Primary,USB,hci0)               [hci0] 0.108890
= Open Index: 00:00:00:00:00:00                                 [hci1] 0.622743
= Index Info: 00:00:00:00:00:00 (Nordic Semiconductor ASA)      [hci1] 0.622761
@ USER Open: main (privileged) version 2.22            {0x0001} [hci1] 0.622772
< HCI Command: Reset (0x03|0x0003) plen 0                    #1 [hci1] 0.623988
> HCI Event: Command Complete (0x0e) plen 4                  #2 [hci1] 0.624540
      Reset (0x03|0x0003) ncmd 1
        Status: Success (0x00)
< HCI Command: Read Local Supported... (0x04|0x0003) plen 0  #3 [hci1] 0.642525
> HCI Event: Command Complete (0x0e) plen 12                 #4 [hci1] 0.643046
      Read Local Supported Features (0x04|0x0003) ncmd 1
        Status: Success (0x00)
        Features: 0x00 0x00 0x00 0x00 0x60 0x00 0x00 0x00
          BR/EDR Not Supported
          LE Supported (Controller)
< HCI Command: Read Local Version In.. (0x04|0x0001) plen 0  #5 [hci1] 0.662145
> HCI Event: Command Complete (0x0e) plen 12                 #6 [hci1] 0.662754
      Read Local Version Information (0x04|0x0001) ncmd 1
        Status: Success (0x00)
        HCI version: Reserved (0x0f) - Revision 12393 (0x3069)
        LMP version: Reserved (0x0f) - Subversion 12393 (0x3069)
        Manufacturer: Nordic Semiconductor ASA (89)
< HCI Command: Read Local Supported... (0x04|0x0002) plen 0  #7 [hci1] 0.682115
> HCI Event: Command Complete (0x0e) plen 68                 #8 [hci1] 0.683144
      Read Local Supported Commands (0x04|0x0002) ncmd 1
        Status: Success (0x00)
        Commands: 119 entries
          Disconnect (Octet 0 - Bit 5)
          Read Remote Version Information (Octet 2 - Bit 7)
          Set Event Mask (Octet 5 - Bit 6)
          Reset (Octet 5 - Bit 7)
          Read Connection Accept Timeout (Octet 7 - Bit 2)
          Write Connection Accept Timeout (Octet 7 - Bit 3)
          Read Transmit Power Level (Octet 10 - Bit 2)
          Set Controller To Host Flow Control (Octet 10 - Bit 5)
          Host Buffer Size (Octet 10 - Bit 6)
          Host Number of Completed Packets (Octet 10 - Bit 7)
          Read Local Version Information (Octet 14 - Bit 3)
          Read Local Supported Features (Octet 14 - Bit 5)
          Read BD ADDR (Octet 15 - Bit 1)
          Read RSSI (Octet 15 - Bit 5)
          Set Event Mask Page 2 (Octet 22 - Bit 2)
          LE Set Event Mask (Octet 25 - Bit 0)
          LE Read Buffer Size (Octet 25 - Bit 1)
          LE Read Local Supported Features (Octet 25 - Bit 2)
          LE Set Random Address (Octet 25 - Bit 4)
          LE Set Advertising Parameters (Octet 25 - Bit 5)
          LE Read Advertising Channel TX Power (Octet 25 - Bit 6)
          LE Set Advertising Data (Octet 25 - Bit 7)
          LE Set Scan Response Data (Octet 26 - Bit 0)
          LE Set Advertise Enable (Octet 26 - Bit 1)
          LE Set Scan Parameters (Octet 26 - Bit 2)
          LE Set Scan Enable (Octet 26 - Bit 3)
          LE Create Connection (Octet 26 - Bit 4)
          LE Create Connection Cancel (Octet 26 - Bit 5)
          LE Read Accept List Size (Octet 26 - Bit 6)
          LE Clear Accept List (Octet 26 - Bit 7)
          LE Add Device To Accept List (Octet 27 - Bit 0)
          LE Remove Device From Accept List (Octet 27 - Bit 1)
          LE Connection Update (Octet 27 - Bit 2)
          LE Set Host Channel Classification (Octet 27 - Bit 3)
          LE Read Channel Map (Octet 27 - Bit 4)
          LE Read Remote Used Features (Octet 27 - Bit 5)
          LE Encrypt (Octet 27 - Bit 6)
          LE Rand (Octet 27 - Bit 7)
          LE Start Encryption (Octet 28 - Bit 0)
          LE Long Term Key Request Reply (Octet 28 - Bit 1)
          LE Long Term Key Request Neg Reply (Octet 28 - Bit 2)
          LE Read Supported States (Octet 28 - Bit 3)
          LE Receiver Test (Octet 28 - Bit 4)
          LE Transmitter Test (Octet 28 - Bit 5)
          LE Test End (Octet 28 - Bit 6)
          Read Authenticated Payload Timeout (Octet 32 - Bit 4)
          Write Authenticated Payload Timeout (Octet 32 - Bit 5)
          LE Set Data Length (Octet 33 - Bit 6)
          LE Read Suggested Default Data Length (Octet 33 - Bit 7)
          LE Write Suggested Default Data Length (Octet 34 - Bit 0)
          LE Add Device To Resolving List (Octet 34 - Bit 3)
          LE Remove Device From Resolving List (Octet 34 - Bit 4)
          LE Clear Resolving List (Octet 34 - Bit 5)
          LE Read Resolving List Size (Octet 34 - Bit 6)
          LE Set Address Resolution Enable (Octet 35 - Bit 1)
          LE Set Resolvable Private Address Timeout (Octet 35 - Bit 2)
          LE Read Maximum Data Length (Octet 35 - Bit 3)
          LE Read PHY (Octet 35 - Bit 4)
          LE Set Default PHY (Octet 35 - Bit 5)
          LE Set PHY (Octet 35 - Bit 6)
          LE Enhanced Receiver Test (Octet 35 - Bit 7)
          LE Enhanced Transmitter Test (Octet 36 - Bit 0)
          LE Set Advertising Set Random Address (Octet 36 - Bit 1)
          LE Set Extended Advertising Parameters (Octet 36 - Bit 2)
          LE Set Extended Advertising Data (Octet 36 - Bit 3)
          LE Set Extended Scan Response Data (Octet 36 - Bit 4)
          LE Set Extended Advertising Enable (Octet 36 - Bit 5)
          LE Read Maximum Advertising Data Length (Octet 36 - Bit 6)
          LE Read Number of Supported Advertising Sets (Octet 36 - Bit 7)
          LE Remove Advertising Set (Octet 37 - Bit 0)
          LE Clear Advertising Sets (Octet 37 - Bit 1)
          LE Set Periodic Advertising Parameters (Octet 37 - Bit 2)
          LE Set Periodic Advertising Data (Octet 37 - Bit 3)
          LE Set Periodic Advertising Enable (Octet 37 - Bit 4)
          LE Set Extended Scan Parameters (Octet 37 - Bit 5)
          LE Set Extended Scan Enable (Octet 37 - Bit 6)
          LE Extended Create Connection (Octet 37 - Bit 7)
          LE Periodic Advertising Create Sync (Octet 38 - Bit 0)
          LE Periodic Advertising Create Sync Cancel (Octet 38 - Bit 1)
          LE Periodic Advertising Terminate Sync (Octet 38 - Bit 2)
          LE Add Device To Periodic Advertiser List (Octet 38 - Bit 3)
          LE Remove Device From Periodic Advertiser List (Octet 38 - Bit 4)
          LE Clear Periodic Advertiser List (Octet 38 - Bit 5)
          LE Read Periodic Advertiser List Size (Octet 38 - Bit 6)
          LE Read Transmit Power (Octet 38 - Bit 7)
          LE Read RF Path Compensation (Octet 39 - Bit 0)
          LE Write RF Path Compensation (Octet 39 - Bit 1)
          LE Set Privacy Mode (Octet 39 - Bit 2)
          LE Periodic Advertising Receive Enable (Octet 40 - Bit 5)
          LE Periodic Advertising Sync Transfer (Octet 40 - Bit 6)
          LE Periodic Advertising Set Info Transfer (Octet 40 - Bit 7)
          LE Periodic Advertising Sync Transfer Parameters (Octet 41 - Bit 0)
          LE Set Default Periodic Advertisng Sync Transfer Parameters (Octet 41 - Bit 1)
          LE Read Buffer v2 (Octet 41 - Bit 5)
          LE Read ISO TX Sync (Octet 41 - Bit 6)
          LE Set Connected Isochronous Group Parameters (Octet 41 - Bit 7)
          LE Set Connected Isochronous Group Parameters Test (Octet 42 - Bit 0)
          LE Create Connected Isochronous Stream (Octet 42 - Bit 1)
          LE Remove Connected Isochronous Group (Octet 42 - Bit 2)
          LE Accept Connected Isochronous Stream Request (Octet 42 - Bit 3)
          LE Reject Connected Isochronous Stream Request (Octet 42 - Bit 4)
          LE Create Broadcast Isochronous Group (Octet 42 - Bit 5)
          LE Create Broadcast Isochronous Group Test (Octet 42 - Bit 6)
          LE Terminate Broadcast Isochronous Group (Octet 42 - Bit 7)
          LE Broadcast Isochronous Group Create Sync (Octet 43 - Bit 0)
          LE Broadcast Isochronous Group Terminate Sync (Octet 43 - Bit 1)
          LE Request Peer SCA (Octet 43 - Bit 2)
          LE Setup Isochronous Data Path (Octet 43 - Bit 3)
          LE Remove Isochronous Data Path (Octet 43 - Bit 4)
          LE Isochronous Transmit Test (Octet 43 - Bit 5)
          LE Isochronous Receive Test (Octet 43 - Bit 6)
          LE Isochronous Read Test Counters (Octet 43 - Bit 7)
          LE Isochronous Read Test Counters (Octet 44 - Bit 0)
          LE Set Host Feature (Octet 44 - Bit 1)
          Octet 44 - Bit 2 
          Octet 45 - Bit 6 
          Octet 46 - Bit 0 
          Octet 46 - Bit 1 
          Octet 46 - Bit 2 
< HCI Command: Host Buffer Size (0x03|0x0033) plen 7         #9 [hci1] 0.702105
        ACL MTU: 255  ACL max packet: 16
        SCO MTU: 0    SCO max packet: 0
> HCI Event: Command Complete (0x0e) plen 4                 #10 [hci1] 0.702561
      Host Buffer Size (0x03|0x0033) ncmd 1
        Status: Success (0x00)
< HCI Command: Set Controller To Ho.. (0x03|0x0031) plen 1  #11 [hci1] 0.722101
        Flow control: ACL Data Packets (0x01)
> HCI Event: Command Complete (0x0e) plen 4                 #12 [hci1] 0.722537
      Set Controller To Host Flow Control (0x03|0x0031) ncmd 1
        Status: Success (0x00)
< HCI Command: LE Read Local Suppor.. (0x08|0x0003) plen 0  #13 [hci1] 0.742099
> HCI Event: Command Complete (0x0e) plen 12                #14 [hci1] 0.742656
      LE Read Local Supported Features (0x08|0x0003) ncmd 1
        Status: Success (0x00)
        Features: 0xfd 0x79 0x00 0xf7 0x30 0x01 0x00 0x00
          LE Encryption
          Extended Reject Indication
          Peripheral-initiated Features Exchange
          LE Ping
          LE Data Packet Length Extension
          LL Privacy
          Extended Scanner Filter Policies
          LE 2M PHY
          LE Coded PHY
          LE Extended Advertising
          LE Periodic Advertising
          Channel Selection Algorithm #2
          Periodic Advertising Sync Transfer - Sender
          Periodic Advertising Sync Transfer - Recipient
          Sleep Clock Accuracy Updates
          Connected Isochronous Stream - Central
          Connected Isochronous Stream - Peripheral
          Isochronous Broadcaster
          Synchronized Receiver
          Periodic Advertising ADI support
          Connection Subrating
          Unknown features (0x0000010000000000)
< HCI Command: LE Set Host Feature (0x08|0x0074) plen 2     #15 [hci1] 0.762111
        Bit Number: 32
          Connected Isochronous Stream (Host Support)
        Bit Value: 1
> HCI Event: Command Complete (0x0e) plen 4                 #16 [hci1] 0.762534
      LE Set Host Feature (0x08|0x0074) ncmd 1
        Status: Success (0x00)
< HCI Command: LE Read Buffer v2 (0x08|0x0060) plen 0       #17 [hci1] 0.782092
> HCI Event: Command Complete (0x0e) plen 10                #18 [hci1] 0.782665
      LE Read Buffer v2 (0x08|0x0060) ncmd 1
        Status: Success (0x00)
        ACL MTU: 27
        ACL max packet: 3
        ISO MTU: 318
        ISO max packet: 3
< HCI Command: LE Read Maximum Adve.. (0x08|0x003a) plen 0  #19 [hci1] 0.802142
> HCI Event: Command Complete (0x0e) plen 6                 #20 [hci1] 0.802623
      LE Read Maximum Advertising Data Length (0x08|0x003a) ncmd 1
        Status: Success (0x00)
        Max length: 1650
< HCI Command: LE Read Supported St.. (0x08|0x001c) plen 0  #21 [hci1] 0.822113
> HCI Event: Command Complete (0x0e) plen 12                #22 [hci1] 0.822683
      LE Read Supported States (0x08|0x001c) ncmd 1
        Status: Success (0x00)
        States: 0x000003ff3e0306ff
          Non-connectable Advertising State
          Scannable Advertising State
          Connectable Advertising State
          High Duty Cycle Directed Advertising State
          Passive Scanning State
          Active Scanning State
          Initiating State
            and Connection State (Central Role)
          Connection State (Peripheral Role)
          Scannable Advertising State
            and Passive Scanning State
          Connectable Advertising State
            and Passive Scanning State
          Non-connectable Advertising State
            and Initiating State
          Scannable Advertising State
            and Initiating State
          Active Scanning State
            and Connection State (Central Role)
          Passive Scanning State
            and Connection State (Peripheral Role)
          Active Scanning State
            and Connection State (Peripheral Role)
          Initiating State
            and Connection State (Central Role)
            and Central Role & Central Role
          Low Duty Cycle Directed Advertising State
          Connectable Advertising State
            and Initiating State
            and Central Role & Peripheral Role
          High Duty Cycle Directed Advertising State
            and Initiating State
            and Central Role & Peripheral Role
          Low Duty Cycle Directed Advertising State
            and Initiating State
            and Central Role & Peripheral Role
          Connectable Advertising State
            and Connection State (Central Role)
            and Central Role & Peripheral Role
          High Duty Cycle Directed Advertising State
            and Connection State (Central Role)
            and Central Role & Peripheral Role
          Low Duty Cycle Directed Advertising State
            and Connection State (Central Role)
            and Central Role & Peripheral Role
          Connectable Advertising State
            and Connection State (Peripheral Role)
            and Central Role & Peripheral Role
          High Duty Cycle Directed Advertising State
            and Connection State (Peripheral Role)
            and Peripheral Role & Peripheral Role
          Low Duty Cycle Directed Advertising State
            and Connection State (Peripheral Role)
            and Peripheral Role & Peripheral Role
          Initiating State
            and Connection State (Peripheral Role)
            and Central Role & Peripheral Role
< HCI Command: LE Read Maximum Data.. (0x08|0x002f) plen 0  #23 [hci1] 0.842115
> HCI Event: Command Complete (0x0e) plen 12                #24 [hci1] 0.842656
      LE Read Maximum Data Length (0x08|0x002f) ncmd 1
        Status: Success (0x00)
        Max TX octets: 251
        Max TX time: 2704
        Max RX octets: 251
        Max RX time: 2704
< HCI Command: LE Write Suggested D.. (0x08|0x0024) plen 4  #25 [hci1] 0.862079
        TX octets: 251
        TX time: 2704
> HCI Event: Command Complete (0x0e) plen 4                 #26 [hci1] 0.862525
      LE Write Suggested Default Data Length (0x08|0x0024) ncmd 1
        Status: Success (0x00)
< HCI Command: LE Read Resolving Li.. (0x08|0x002a) plen 0  #27 [hci1] 0.882117
> HCI Event: Command Complete (0x0e) plen 5                 #28 [hci1] 0.882491
      LE Read Resolving List Size (0x08|0x002a) ncmd 1
        Status: Success (0x00)
        Size: 8
< HCI Command: LE Set Event Mask (0x08|0x0001) plen 8       #29 [hci1] 0.902115
        Mask: 0x000002023f87fa5e
          LE Advertising Report
          LE Connection Update Complete
          LE Read Remote Used Features Complete
          LE Long Term Key Request
          LE Data Length Change
          LE Enhanced Connection Complete
          LE PHY Update Complete
          LE Extended Advertising Report
          LE Periodic Advertising Sync Established
          LE Periodic Advertising Report
          LE Periodic Advertising Sync Lost
          LE Extended Scan Timeout
          LE Extended Advertising Set Terminated
          LE Scan Request Received
          LE Periodic Advertising Sync Transfer Rvc
          LE CIS Established
          LE CIS Request
          LE Create BIG Complete
          LE Terminate BIG Complete
          LE BIG Sync Estabilished Complete
          LE BIG Sync Lost
          LE BIG Info Advertising Report
          Unknown mask (0x0000020000000000)
> HCI Event: Command Complete (0x0e) plen 4                 #30 [hci1] 0.902689
      LE Set Event Mask (0x08|0x0001) ncmd 1
        Status: Success (0x00)
< HCI Command: Set Event Mask (0x03|0x0001) plen 8          #31 [hci1] 0.922124
        Mask: 0x2000800002008890
          Disconnection Complete
          Encryption Change
          Read Remote Version Information Complete
          Hardware Error
          Data Buffer Overflow
          Encryption Key Refresh Complete
          LE Meta
> HCI Event: Command Complete (0x0e) plen 4                 #32 [hci1] 0.922699
      Set Event Mask (0x03|0x0001) ncmd 1
        Status: Success (0x00)
< HCI Command: Read BD ADDR (0x04|0x0009) plen 0            #33 [hci1] 0.942108
> HCI Event: Command Complete (0x0e) plen 10                #34 [hci1] 0.942663
      Read BD ADDR (0x04|0x0009) ncmd 1
        Status: Success (0x00)
        Address: 00:00:00:00:00:00 (OUI 00-00-00)
< HCI Command: LE Set Random Address (0x08|0x0005) plen 6   #35 [hci1] 0.962108
        Address: D5:B6:CC:31:DB:3B (Static)
> HCI Event: Command Complete (0x0e) plen 4                 #36 [hci1] 0.962615
      LE Set Random Address (0x08|0x0005) ncmd 1
        Status: Success (0x00)
< HCI Command: LE Set Extended Adv.. (0x08|0x0036) plen 25  #37 [hci1] 3.402609
        Handle: 0x00
        Properties: 0x0013
          Connectable
          Scannable
          Use legacy advertising PDUs: ADV_IND
        Min advertising interval: 100.000 msec (0x00a0)
        Max advertising interval: 150.000 msec (0x00f0)
        Channel map: 37, 38, 39 (0x07)
        Own address type: Random (0x01)
        Peer address type: Public (0x00)
        Peer address: 00:00:00:00:00:00 (OUI 00-00-00)
        Filter policy: Allow Scan Request from Any, Allow Connect Request from Any (0x00)
        TX power: Host has no preference (0x7f)
        Primary PHY: LE 1M (0x01)
        Secondary max skip: 0x00
        Secondary PHY: LE 1M (0x01)
        SID: 0x00
        Scan request notifications: Disabled (0x00)
> HCI Event: Command Complete (0x0e) plen 5                 #38 [hci1] 3.403431
      LE Set Extended Advertising Parameters (0x08|0x0036) ncmd 1
        Status: Success (0x00)
        TX power (selected): 0 dbm (0x00)
< HCI Command: LE Set Advertising S.. (0x08|0x0035) plen 7  #39 [hci1] 3.422161
        Advertising handle: 0x00
        Advertising random address: D5:B6:CC:31:DB:3B (Static)
> HCI Event: Command Complete (0x0e) plen 4                 #40 [hci1] 3.422641
      LE Set Advertising Set Random Address (0x08|0x0035) ncmd 1
        Status: Success (0x00)
< HCI Command: LE Set Extended Adv.. (0x08|0x0037) plen 22  #41 [hci1] 3.442109
        Handle: 0x00
        Operation: Complete extended advertising data (0x03)
        Fragment preference: Minimize fragmentation (0x01)
        Data length: 0x12
        Flags: 0x06
          LE General Discoverable Mode
          BR/EDR Not Supported
        Name (complete): Tester_F6B11A
> HCI Event: Command Complete (0x0e) plen 4                 #42 [hci1] 3.442887
      LE Set Extended Advertising Data (0x08|0x0037) ncmd 1
        Status: Success (0x00)
< HCI Command: LE Set Extended Scan.. (0x08|0x0038) plen 4  #43 [hci1] 3.462114
        Handle: 0x00
        Operation: Complete scan response data (0x03)
        Fragment preference: Minimize fragmentation (0x01)
        Data length: 0x00
> HCI Event: Command Complete (0x0e) plen 4                 #44 [hci1] 3.462640
      LE Set Extended Scan Response Data (0x08|0x0038) ncmd 1
        Status: Success (0x00)
< HCI Command: LE Set Extended Adve.. (0x08|0x0039) plen 6  #45 [hci1] 3.482116
        Extended advertising: Enabled (0x01)
        Number of sets: 1 (0x01)
        Entry 0
          Handle: 0x00
          Duration: 0 ms (0x00)
          Max ext adv events: 0
> HCI Event: Command Complete (0x0e) plen 4                 #46 [hci1] 3.482733
      LE Set Extended Advertising Enable (0x08|0x0039) ncmd 1
        Status: Success (0x00)
> HCI Event: LE Meta Event (0x3e) plen 31                   #47 [hci1] 3.596262
      LE Enhanced Connection Complete (0x0a)
        Status: Success (0x00)
        Handle: 21
        Role: Peripheral (0x01)
        Peer address type: Public (0x00)
        Peer address: DF:A9:FF:F6:B1:1A (OUI DF-A9-FF)
        Local resolvable private address: 00:00:00:00:00:00 (Non-Resolvable)
        Peer resolvable private address: 00:00:00:00:00:00 (Non-Resolvable)
        Connection interval: 87.50 msec (0x0046)
        Connection latency: 0 (0x0000)
        Supervision timeout: 25120 msec (0x09d0)
        Central clock accuracy: 0x01
> HCI Event: LE Meta Event (0x3e) plen 6                    #48 [hci1] 3.596415
      LE Advertising Set Terminated (0x12)
        Status: Success (0x00)
        Handle: 0
        Connection handle: 21
        Number of completed extended advertising events: 0
< HCI Command: LE Read Remote Used... (0x08|0x0016) plen 2  #49 [hci1] 3.603314
        Handle: 21 Address: DF:A9:FF:F6:B1:1A (OUI DF-A9-FF)
< ACL Data TX: Handle 21 flags 0x00 dlen 7                  #50 [hci1] 3.603339
      ATT: Exchange MTU Request (0x02) len 2
        Client RX MTU: 251
> HCI Event: Command Status (0x0f) plen 4                   #51 [hci1] 3.603832
      LE Read Remote Used Features (0x08|0x0016) ncmd 1
        Status: Success (0x00)
> HCI Event: Number of Completed Packets (0x13) plen 5      #52 [hci1] 3.772353
        Num handles: 1
        Handle: 21 Address: DF:A9:FF:F6:B1:1A (OUI DF-A9-FF)
        Count: 1
        #50: len 7 (0 Kb/s)
        Latency: 169 msec (169-169 msec ~169 msec)
> HCI Event: LE Meta Event (0x3e) plen 12                   #53 [hci1] 3.860275
      LE Read Remote Used Features (0x04)
        Status: Success (0x00)
        Handle: 21 Address: DF:A9:FF:F6:B1:1A (OUI DF-A9-FF)
        Features: 0x2d 0x49 0x00 0xf7 0x67 0xd8 0x00 0x00
          LE Encryption
          Extended Reject Indication
          Peripheral-initiated Features Exchange
          LE Data Packet Length Extension
          LE 2M PHY
          LE Coded PHY
          Channel Selection Algorithm #2
          Periodic Advertising Sync Transfer - Sender
          Periodic Advertising Sync Transfer - Recipient
          Sleep Clock Accuracy Updates
          Connected Isochronous Stream - Central
          Connected Isochronous Stream - Peripheral
          Isochronous Broadcaster
          Synchronized Receiver
          Connected Isochronous Stream (Host Support)
          LE Power Control Request
          LE Power Control Request
          Connection Subrating
          Connection Subrating (Host Support)
          Unknown features (0x0000d80000000000)
> ACL Data RX: Handle 21 flags 0x02 dlen 11                 #54 [hci1] 6.309806
      SMP: Pairing Request (0x01) len 6
        IO capability: KeyboardDisplay (0x04)
        OOB data: Authentication data not present (0x00)
        Authentication requirement: Bonding, MITM, SC, No Keypresses (0x0d)
        Max encryption key size: 16
        Initiator key distribution: EncKey IdKey (0x03)
        Responder key distribution: EncKey IdKey Sign (0x07)
> ACL Data RX: Handle 21 flags 0x02 dlen 7                  #55 [hci1] 6.310373
      ATT: Exchange MTU Response (0x03) len 2
        Server RX MTU: 23
< HCI Command: Host Number of Compl.. (0x03|0x0035) plen 5  #56 [hci1] 6.322713
        Num handles: 1
        Handle: 21 Address: DF:A9:FF:F6:B1:1A (OUI DF-A9-FF)
        Count: 1
< ACL Data TX: Handle 21 flags 0x00 dlen 11                 #57 [hci1] 6.322961
      SMP: Pairing Response (0x02) len 6
        IO capability: DisplayOnly (0x00)
        OOB data: Authentication data not present (0x00)
        Authentication requirement: Bonding, No MITM, SC, No Keypresses (0x09)
        Max encryption key size: 16
        Initiator key distribution: IdKey (0x02)
        Responder key distribution: <none> (0x00)
< HCI Command: Host Number of Compl.. (0x03|0x0035) plen 5  #58 [hci1] 6.323100
        Num handles: 1
        Handle: 21 Address: DF:A9:FF:F6:B1:1A (OUI DF-A9-FF)
        Count: 1
> HCI Event: Number of Completed Packets (0x13) plen 5      #59 [hci1] 6.484935
        Num handles: 1
        Handle: 21 Address: DF:A9:FF:F6:B1:1A (OUI DF-A9-FF)
        Count: 1
        #57: len 11 (0 Kb/s)
        Latency: 161 msec (161-169 msec ~165 msec)
> ACL Data RX: Handle 21 flags 0x02 dlen 27                 #60 [hci1] 6.485306
> ACL Data RX: Handle 21 flags 0x01 dlen 27                 #61 [hci1] 6.485803
> ACL Data RX: Handle 21 flags 0x01 dlen 15                 #62 [hci1] 6.486367
      SMP: Pairing Public Key (0x0c) len 64
        X: 271dd9b424795dd32812b13ff3829b13bc0712fc3696f8c45ba7fd2196831182
        Y: ea0ebae23a418477eec7dd727fcb9a8a5e3dee0138d0ea75297b253e9a36f0ec
< HCI Command: Host Number of Compl.. (0x03|0x0035) plen 5  #63 [hci1] 6.503161
        Num handles: 1
        Handle: 21 Address: DF:A9:FF:F6:B1:1A (OUI DF-A9-FF)
        Count: 1
< HCI Command: Host Number of Compl.. (0x03|0x0035) plen 5  #64 [hci1] 6.503196
        Num handles: 1
        Handle: 21 Address: DF:A9:FF:F6:B1:1A (OUI DF-A9-FF)
        Count: 1
< HCI Command: Host Number of Compl.. (0x03|0x0035) plen 5  #65 [hci1] 6.503562
        Num handles: 1
        Handle: 21 Address: DF:A9:FF:F6:B1:1A (OUI DF-A9-FF)
        Count: 1
< ACL Data TX: Handle 21 flags 0x00 dlen 27                 #66 [hci1] 6.503708
< ACL Data TX: Handle 21 flags 0x01 dlen 27                 #67 [hci1] 6.503726
< ACL Data TX: Handle 21 flags 0x01 dlen 15                 #68 [hci1] 6.503729
      SMP: Pairing Public Key (0x0c) len 64
        X: 98308440221e2d910f0e54b71e7ec652857aa9b5a0dc65028824cc19db1226e9
        Y: 67a4816bcb62efb21701e31fdb27561a6217575fb007a8bbdabe7e28b6f68482
> HCI Event: Number of Completed Packets (0x13) plen 5      #69 [hci1] 6.572817
        Num handles: 1
        Handle: 21 Address: DF:A9:FF:F6:B1:1A (OUI DF-A9-FF)
        Count: 1
        #66: len 27 (3 Kb/s)
        Latency: 69 msec (69-169 msec ~117 msec)
> HCI Event: Number of Completed Packets (0x13) plen 5      #70 [hci1] 6.573532
        Num handles: 1
        Handle: 21 Address: DF:A9:FF:F6:B1:1A (OUI DF-A9-FF)
        Count: 1
        #67: len 27 (3 Kb/s)
        Latency: 69 msec (69-169 msec ~93 msec)
> HCI Event: Number of Completed Packets (0x13) plen 5      #71 [hci1] 6.659703
        Num handles: 1
        Handle: 21 Address: DF:A9:FF:F6:B1:1A (OUI DF-A9-FF)
        Count: 1
        #68: len 15 (0 Kb/s)
        Latency: 155 msec (69-169 msec ~124 msec)
> ACL Data RX: Handle 21 flags 0x02 dlen 21                 #72 [hci1] 7.622628
      SMP: Pairing Confirm (0x03) len 16
        Confim value: 6d61bb82b8537a506fe79520641aa42d
< HCI Command: Host Number of Compl.. (0x03|0x0035) plen 5  #73 [hci1] 7.642834
        Num handles: 1
        Handle: 21 Address: DF:A9:FF:F6:B1:1A (OUI DF-A9-FF)
        Count: 1
< ACL Data TX: Handle 21 flags 0x00 dlen 21                 #74 [hci1] 7.643080
      SMP: Pairing Confirm (0x03) len 16
        Confim value: 07b4f097377c0a50ba6d39d931351bba
> HCI Event: Number of Completed Packets (0x13) plen 5      #75 [hci1] 7.797502
        Num handles: 1
        Handle: 21 Address: DF:A9:FF:F6:B1:1A (OUI DF-A9-FF)
        Count: 1
        #74: len 21 (1 Kb/s)
        Latency: 154 msec (69-169 msec ~139 msec)
> ACL Data RX: Handle 21 flags 0x02 dlen 21                 #76 [hci1] 7.797783
      SMP: Pairing Random (0x04) len 16
        Random value: d11276c85423531b0000000000000000
< HCI Command: Host Number of Compl.. (0x03|0x0035) plen 5  #77 [hci1] 7.802976
        Num handles: 1
        Handle: 21 Address: DF:A9:FF:F6:B1:1A (OUI DF-A9-FF)
        Count: 1
< ACL Data TX: Handle 21 flags 0x00 dlen 21                 #78 [hci1] 7.803081
      SMP: Pairing Random (0x04) len 16
        Random value: 8e6108f966a694cbe26df70bb96773e6
> HCI Event: Number of Completed Packets (0x13) plen 5      #79 [hci1] 7.972102
        Num handles: 1
        Handle: 21 Address: DF:A9:FF:F6:B1:1A (OUI DF-A9-FF)
        Count: 1
        #78: len 21 (0 Kb/s)
        Latency: 169 msec (69-169 msec ~154 msec)
> ACL Data RX: Handle 21 flags 0x02 dlen 21                 #80 [hci1] 8.060120
      SMP: Pairing Confirm (0x03) len 16
        Confim value: 5d2f7ec5ef947ce3d732f81414e9deaf
< HCI Command: Host Number of Compl.. (0x03|0x0035) plen 5  #81 [hci1] 8.062485
        Num handles: 1
        Handle: 21 Address: DF:A9:FF:F6:B1:1A (OUI DF-A9-FF)
        Count: 1
< ACL Data TX: Handle 21 flags 0x00 dlen 21                 #82 [hci1] 8.062686
      SMP: Pairing Confirm (0x03) len 16
        Confim value: 5bb83e09334341b7b21d15be8f142bbc
> HCI Event: Number of Completed Packets (0x13) plen 5      #83 [hci1] 8.234917
        Num handles: 1
        Handle: 21 Address: DF:A9:FF:F6:B1:1A (OUI DF-A9-FF)
        Count: 1
        #82: len 21 (0 Kb/s)
        Latency: 172 msec (69-172 msec ~163 msec)
> ACL Data RX: Handle 21 flags 0x02 dlen 21                 #84 [hci1] 8.235153
      SMP: Pairing Random (0x04) len 16
        Random value: 7db764ca9bc3f4f10000000000000000
< HCI Command: Host Number of Compl.. (0x03|0x0035) plen 5  #85 [hci1] 8.242803
        Num handles: 1
        Handle: 21 Address: DF:A9:FF:F6:B1:1A (OUI DF-A9-FF)
        Count: 1
< ACL Data TX: Handle 21 flags 0x00 dlen 21                 #86 [hci1] 8.242894
      SMP: Pairing Random (0x04) len 16
        Random value: 4d02679f89a05211af56d8b3da64d21e
> HCI Event: Number of Completed Packets (0x13) plen 5      #87 [hci1] 8.409676
        Num handles: 1
        Handle: 21 Address: DF:A9:FF:F6:B1:1A (OUI DF-A9-FF)
        Count: 1
        #86: len 21 (1 Kb/s)
        Latency: 166 msec (69-172 msec ~165 msec)
> ACL Data RX: Handle 21 flags 0x02 dlen 21                 #88 [hci1] 8.497544
      SMP: Pairing Confirm (0x03) len 16
        Confim value: 316920a91cc942100f55378ec3aa1df5
< HCI Command: Host Number of Compl.. (0x03|0x0035) plen 5  #89 [hci1] 8.502388
        Num handles: 1
        Handle: 21 Address: DF:A9:FF:F6:B1:1A (OUI DF-A9-FF)
        Count: 1
< ACL Data TX: Handle 21 flags 0x00 dlen 21                 #90 [hci1] 8.502519
      SMP: Pairing Confirm (0x03) len 16
        Confim value: 8095110077bfd6f0d7978b161c9446b5
> HCI Event: Number of Completed Packets (0x13) plen 5      #91 [hci1] 8.672323
        Num handles: 1
        Handle: 21 Address: DF:A9:FF:F6:B1:1A (OUI DF-A9-FF)
        Count: 1
        #90: len 21 (0 Kb/s)
        Latency: 169 msec (69-172 msec ~167 msec)
> ACL Data RX: Handle 21 flags 0x02 dlen 21                 #92 [hci1] 8.672698
      SMP: Pairing Random (0x04) len 16
        Random value: 612da4d81e18a4af0000000000000000
< HCI Command: Host Number of Compl.. (0x03|0x0035) plen 5  #93 [hci1] 8.682869
        Num handles: 1
        Handle: 21 Address: DF:A9:FF:F6:B1:1A (OUI DF-A9-FF)
        Count: 1
< ACL Data TX: Handle 21 flags 0x00 dlen 21                 #94 [hci1] 8.683023
      SMP: Pairing Random (0x04) len 16
        Random value: 5e8286bc235a02440d0c3424a2acf8fd
> HCI Event: Number of Completed Packets (0x13) plen 5      #95 [hci1] 8.847211
        Num handles: 1
        Handle: 21 Address: DF:A9:FF:F6:B1:1A (OUI DF-A9-FF)
        Count: 1
        #94: len 21 (1 Kb/s)
        Latency: 164 msec (69-172 msec ~165 msec)
> ACL Data RX: Handle 21 flags 0x02 dlen 21                 #96 [hci1] 8.935035
      SMP: Pairing Confirm (0x03) len 16
        Confim value: f9953159e27ffbb2330ac82310d15627
< HCI Command: Host Number of Compl.. (0x03|0x0035) plen 5  #97 [hci1] 8.942569
        Num handles: 1
        Handle: 21 Address: DF:A9:FF:F6:B1:1A (OUI DF-A9-FF)
        Count: 1
< ACL Data TX: Handle 21 flags 0x00 dlen 21                 #98 [hci1] 8.942774
      SMP: Pairing Confirm (0x03) len 16
        Confim value: 82631a59d290dd145f73197490b937cc
> HCI Event: Number of Completed Packets (0x13) plen 5      #99 [hci1] 9.109915
        Num handles: 1
        Handle: 21 Address: DF:A9:FF:F6:B1:1A (OUI DF-A9-FF)
        Count: 1
        #98: len 21 (1 Kb/s)
        Latency: 167 msec (69-172 msec ~166 msec)
> ACL Data RX: Handle 21 flags 0x02 dlen 21                #100 [hci1] 9.110106
      SMP: Pairing Random (0x04) len 16
        Random value: 9e95613a27181ae60000000000000000
< HCI Command: Host Number of Comp.. (0x03|0x0035) plen 5  #101 [hci1] 9.122837
        Num handles: 1
        Handle: 21 Address: DF:A9:FF:F6:B1:1A (OUI DF-A9-FF)
        Count: 1
< ACL Data TX: Handle 21 flags 0x00 dlen 21                #102 [hci1] 9.123010
      SMP: Pairing Random (0x04) len 16
        Random value: 5c4a1bcadd27bd58e945097b00bad7ac
> HCI Event: Number of Completed Packets (0x13) plen 5     #103 [hci1] 9.284638
        Num handles: 1
        Handle: 21 Address: DF:A9:FF:F6:B1:1A (OUI DF-A9-FF)
        Count: 1
        #102: len 21 (1 Kb/s)
        Latency: 161 msec (69-172 msec ~164 msec)
> ACL Data RX: Handle 21 flags 0x02 dlen 21                #104 [hci1] 9.372402
      SMP: Pairing Confirm (0x03) len 16
        Confim value: 50bf7ceb07098fde64dcd84e6f35c56b
< HCI Command: Host Number of Comp.. (0x03|0x0035) plen 5  #105 [hci1] 9.382336
        Num handles: 1
        Handle: 21 Address: DF:A9:FF:F6:B1:1A (OUI DF-A9-FF)
        Count: 1
< ACL Data TX: Handle 21 flags 0x00 dlen 21                #106 [hci1] 9.382346
      SMP: Pairing Confirm (0x03) len 16
        Confim value: 03466ab582c00144385fa08f23c0e8fb
> HCI Event: Number of Completed Packets (0x13) plen 5     #107 [hci1] 9.547329
        Num handles: 1
        Handle: 21 Address: DF:A9:FF:F6:B1:1A (OUI DF-A9-FF)
        Count: 1
        #106: len 21 (1 Kb/s)
        Latency: 164 msec (69-172 msec ~164 msec)
> ACL Data RX: Handle 21 flags 0x02 dlen 21                #108 [hci1] 9.547651
      SMP: Pairing Random (0x04) len 16
        Random value: 1919c60851e17c020000000000000000
< HCI Command: Host Number of Comp.. (0x03|0x0035) plen 5  #109 [hci1] 9.562966
        Num handles: 1
        Handle: 21 Address: DF:A9:FF:F6:B1:1A (OUI DF-A9-FF)
        Count: 1
< ACL Data TX: Handle 21 flags 0x00 dlen 21                #110 [hci1] 9.563019
      SMP: Pairing Random (0x04) len 16
        Random value: 32527e6e64e79f33b2e374394db8ab2d
> HCI Event: Number of Completed Packets (0x13) plen 5     #111 [hci1] 9.722052
        Num handles: 1
        Handle: 21 Address: DF:A9:FF:F6:B1:1A (OUI DF-A9-FF)
        Count: 1
        #110: len 21 (1 Kb/s)
        Latency: 159 msec (69-172 msec ~161 msec)
> ACL Data RX: Handle 21 flags 0x02 dlen 21                #112 [hci1] 9.809986
      SMP: Pairing Confirm (0x03) len 16
        Confim value: fa035ca8a1c4a977d1ebddc28b2f59cc
< HCI Command: Host Number of Comp.. (0x03|0x0035) plen 5  #113 [hci1] 9.822473
        Num handles: 1
        Handle: 21 Address: DF:A9:FF:F6:B1:1A (OUI DF-A9-FF)
        Count: 1
< ACL Data TX: Handle 21 flags 0x00 dlen 21                #114 [hci1] 9.822554
      SMP: Pairing Confirm (0x03) len 16
        Confim value: 3a351a3428b37f30f3e938a5db1e930c
> HCI Event: Number of Completed Packets (0x13) plen 5     #115 [hci1] 9.984888
        Num handles: 1
        Handle: 21 Address: DF:A9:FF:F6:B1:1A (OUI DF-A9-FF)
        Count: 1
        #114: len 21 (1 Kb/s)
        Latency: 162 msec (69-172 msec ~162 msec)
> ACL Data RX: Handle 21 flags 0x02 dlen 21                #116 [hci1] 9.985093
      SMP: Pairing Random (0x04) len 16
        Random value: 4a908c9e4eebd8e30000000000000000
< HCI Command: Host Number of Com.. (0x03|0x0035) plen 5  #117 [hci1] 10.002918
        Num handles: 1
        Handle: 21 Address: DF:A9:FF:F6:B1:1A (OUI DF-A9-FF)
        Count: 1
< ACL Data TX: Handle 21 flags 0x00 dlen 21               #118 [hci1] 10.003021
      SMP: Pairing Random (0x04) len 16
        Random value: dddbdfe2838e9a8cc6964353c850fef7
> HCI Event: Number of Completed Packets (0x13) plen 5    #119 [hci1] 10.159620
        Num handles: 1
        Handle: 21 Address: DF:A9:FF:F6:B1:1A (OUI DF-A9-FF)
        Count: 1
        #118: len 21 (1 Kb/s)
        Latency: 156 msec (69-172 msec ~159 msec)
> ACL Data RX: Handle 21 flags 0x02 dlen 21               #120 [hci1] 10.247474
      SMP: Pairing Confirm (0x03) len 16
        Confim value: 2639dd7ec8828fc65bb7231b253b4795
< HCI Command: Host Number of Com.. (0x03|0x0035) plen 5  #121 [hci1] 10.262723
        Num handles: 1
        Handle: 21 Address: DF:A9:FF:F6:B1:1A (OUI DF-A9-FF)
        Count: 1
< ACL Data TX: Handle 21 flags 0x00 dlen 21               #122 [hci1] 10.262969
      SMP: Pairing Confirm (0x03) len 16
        Confim value: 3005b555359609c113f33cbac6225c14
> HCI Event: Number of Completed Packets (0x13) plen 5    #123 [hci1] 10.422322
        Num handles: 1
        Handle: 21 Address: DF:A9:FF:F6:B1:1A (OUI DF-A9-FF)
        Count: 1
        #122: len 21 (1 Kb/s)
        Latency: 159 msec (69-172 msec ~159 msec)
> ACL Data RX: Handle 21 flags 0x02 dlen 21               #124 [hci1] 10.422638
      SMP: Pairing Random (0x04) len 16
        Random value: 254ba691d2f240090000000000000000
< HCI Command: Host Number of Com.. (0x03|0x0035) plen 5  #125 [hci1] 10.443001
        Num handles: 1
        Handle: 21 Address: DF:A9:FF:F6:B1:1A (OUI DF-A9-FF)
        Count: 1
< ACL Data TX: Handle 21 flags 0x00 dlen 21               #126 [hci1] 10.443119
      SMP: Pairing Random (0x04) len 16
        Random value: eb9f1915536596b6fc3db1c86b2b1970
> HCI Event: Number of Completed Packets (0x13) plen 5    #127 [hci1] 10.596991
        Num handles: 1
        Handle: 21 Address: DF:A9:FF:F6:B1:1A (OUI DF-A9-FF)
        Count: 1
        #126: len 21 (1 Kb/s)
        Latency: 153 msec (69-172 msec ~156 msec)
> ACL Data RX: Handle 21 flags 0x02 dlen 21               #128 [hci1] 10.685030
      SMP: Pairing Confirm (0x03) len 16
        Confim value: 3d973761c65df99737455ca54d9630c6
< HCI Command: Host Number of Com.. (0x03|0x0035) plen 5  #129 [hci1] 10.702719
        Num handles: 1
        Handle: 21 Address: DF:A9:FF:F6:B1:1A (OUI DF-A9-FF)
        Count: 1
< ACL Data TX: Handle 21 flags 0x00 dlen 21               #130 [hci1] 10.702926
      SMP: Pairing Confirm (0x03) len 16
        Confim value: 115619cc37531325625b838be97b81fa
> HCI Event: Number of Completed Packets (0x13) plen 5    #131 [hci1] 10.859748
        Num handles: 1
        Handle: 21 Address: DF:A9:FF:F6:B1:1A (OUI DF-A9-FF)
        Count: 1
        #130: len 21 (1 Kb/s)
        Latency: 156 msec (69-172 msec ~156 msec)
> ACL Data RX: Handle 21 flags 0x02 dlen 21               #132 [hci1] 10.860106
      SMP: Pairing Random (0x04) len 16
        Random value: a0629a06b3cffbc40000000000000000
< HCI Command: Host Number of Com.. (0x03|0x0035) plen 5  #133 [hci1] 10.862942
        Num handles: 1
        Handle: 21 Address: DF:A9:FF:F6:B1:1A (OUI DF-A9-FF)
        Count: 1
< ACL Data TX: Handle 21 flags 0x00 dlen 21               #134 [hci1] 10.863020
      SMP: Pairing Random (0x04) len 16
        Random value: 5c794dc9ad9f2c3f295ebd5ad5e1c3cf
> HCI Event: Number of Completed Packets (0x13) plen 5    #135 [hci1] 11.034572
        Num handles: 1
        Handle: 21 Address: DF:A9:FF:F6:B1:1A (OUI DF-A9-FF)
        Count: 1
        #134: len 21 (0 Kb/s)
        Latency: 171 msec (69-172 msec ~164 msec)
> ACL Data RX: Handle 21 flags 0x02 dlen 21               #136 [hci1] 11.122396
      SMP: Pairing Confirm (0x03) len 16
        Confim value: cb4b25cfd11dd8e15455c068e39bcf31
< HCI Command: Host Number of Com.. (0x03|0x0035) plen 5  #137 [hci1] 11.142374
        Num handles: 1
        Handle: 21 Address: DF:A9:FF:F6:B1:1A (OUI DF-A9-FF)
        Count: 1
< ACL Data TX: Handle 21 flags 0x00 dlen 21               #138 [hci1] 11.142502
      SMP: Pairing Confirm (0x03) len 16
        Confim value: a2ac46477bf9fcc962a5bed263ae91e8
> HCI Event: Number of Completed Packets (0x13) plen 5    #139 [hci1] 11.297380
        Num handles: 1
        Handle: 21 Address: DF:A9:FF:F6:B1:1A (OUI DF-A9-FF)
        Count: 1
        #138: len 21 (1 Kb/s)
        Latency: 154 msec (69-172 msec ~159 msec)
> ACL Data RX: Handle 21 flags 0x02 dlen 21               #140 [hci1] 11.297645
      SMP: Pairing Random (0x04) len 16
        Random value: 2717de2ccea48fba0000000000000000
< HCI Command: Host Number of Com.. (0x03|0x0035) plen 5  #141 [hci1] 11.302859
        Num handles: 1
        Handle: 21 Address: DF:A9:FF:F6:B1:1A (OUI DF-A9-FF)
        Count: 1
< ACL Data TX: Handle 21 flags 0x00 dlen 21               #142 [hci1] 11.302971
      SMP: Pairing Random (0x04) len 16
        Random value: 5c2fff312cdf99c9491988e877355a9a
> HCI Event: Number of Completed Packets (0x13) plen 5    #143 [hci1] 11.472047
        Num handles: 1
        Handle: 21 Address: DF:A9:FF:F6:B1:1A (OUI DF-A9-FF)
        Count: 1
        #142: len 21 (0 Kb/s)
        Latency: 169 msec (69-172 msec ~164 msec)
> ACL Data RX: Handle 21 flags 0x02 dlen 21               #144 [hci1] 11.559951
      SMP: Pairing Confirm (0x03) len 16
        Confim value: 2ce7f8e5ed01019c24bd144703babc16
< HCI Command: Host Number of Com.. (0x03|0x0035) plen 5  #145 [hci1] 11.562751
        Num handles: 1
        Handle: 21 Address: DF:A9:FF:F6:B1:1A (OUI DF-A9-FF)
        Count: 1
< ACL Data TX: Handle 21 flags 0x00 dlen 21               #146 [hci1] 11.562954
      SMP: Pairing Confirm (0x03) len 16
        Confim value: 112b2b6c61e9970d534dbab391231bff
> HCI Event: Number of Completed Packets (0x13) plen 5    #147 [hci1] 11.734781
        Num handles: 1
        Handle: 21 Address: DF:A9:FF:F6:B1:1A (OUI DF-A9-FF)
        Count: 1
        #146: len 21 (0 Kb/s)
        Latency: 171 msec (69-172 msec ~168 msec)
> ACL Data RX: Handle 21 flags 0x02 dlen 21               #148 [hci1] 11.735122
      SMP: Pairing Random (0x04) len 16
        Random value: 43c049e146c7ed7f0000000000000000
< HCI Command: Host Number of Com.. (0x03|0x0035) plen 5  #149 [hci1] 11.742846
        Num handles: 1
        Handle: 21 Address: DF:A9:FF:F6:B1:1A (OUI DF-A9-FF)
        Count: 1
< ACL Data TX: Handle 21 flags 0x00 dlen 21               #150 [hci1] 11.742982
      SMP: Pairing Random (0x04) len 16
        Random value: c629a3a987d808e808655d558dfc1155
> HCI Event: Number of Completed Packets (0x13) plen 5    #151 [hci1] 11.909525
        Num handles: 1
        Handle: 21 Address: DF:A9:FF:F6:B1:1A (OUI DF-A9-FF)
        Count: 1
        #150: len 21 (1 Kb/s)
        Latency: 166 msec (69-172 msec ~167 msec)
> ACL Data RX: Handle 21 flags 0x02 dlen 21               #152 [hci1] 11.997534
      SMP: Pairing Confirm (0x03) len 16
        Confim value: fd1bcbf344dc5a6ae3710cc982e0f56c
< HCI Command: Host Number of Com.. (0x03|0x0035) plen 5  #153 [hci1] 12.002221
        Num handles: 1
        Handle: 21 Address: DF:A9:FF:F6:B1:1A (OUI DF-A9-FF)
        Count: 1
< ACL Data TX: Handle 21 flags 0x00 dlen 21               #154 [hci1] 12.002363
      SMP: Pairing Confirm (0x03) len 16
        Confim value: 591ae8f31aaebacdef9b6766b98dbce9
> HCI Event: Number of Completed Packets (0x13) plen 5    #155 [hci1] 12.172176
        Num handles: 1
        Handle: 21 Address: DF:A9:FF:F6:B1:1A (OUI DF-A9-FF)
        Count: 1
        #154: len 21 (0 Kb/s)
        Latency: 169 msec (69-172 msec ~168 msec)
> ACL Data RX: Handle 21 flags 0x02 dlen 21               #156 [hci1] 12.172645
      SMP: Pairing Random (0x04) len 16
        Random value: 8267b526b094cc670000000000000000
< HCI Command: Host Number of Com.. (0x03|0x0035) plen 5  #157 [hci1] 12.182933
        Num handles: 1
        Handle: 21 Address: DF:A9:FF:F6:B1:1A (OUI DF-A9-FF)
        Count: 1
< ACL Data TX: Handle 21 flags 0x00 dlen 21               #158 [hci1] 12.183057
      SMP: Pairing Random (0x04) len 16
        Random value: 92f20f6ad8f13724432c7fd6001c45ff
> HCI Event: Number of Completed Packets (0x13) plen 5    #159 [hci1] 12.346999
        Num handles: 1
        Handle: 21 Address: DF:A9:FF:F6:B1:1A (OUI DF-A9-FF)
        Count: 1
        #158: len 21 (1 Kb/s)
        Latency: 163 msec (69-172 msec ~166 msec)
> ACL Data RX: Handle 21 flags 0x02 dlen 21               #160 [hci1] 12.434884
      SMP: Pairing Confirm (0x03) len 16
        Confim value: af25d9ad8a3d98411d62fcb446ff67bb
< HCI Command: Host Number of Com.. (0x03|0x0035) plen 5  #161 [hci1] 12.442810
        Num handles: 1
        Handle: 21 Address: DF:A9:FF:F6:B1:1A (OUI DF-A9-FF)
        Count: 1
< ACL Data TX: Handle 21 flags 0x00 dlen 21               #162 [hci1] 12.443031
      SMP: Pairing Confirm (0x03) len 16
        Confim value: 093d97b1d7819a4e1b57a0f06704b5e3
> HCI Event: Number of Completed Packets (0x13) plen 5    #163 [hci1] 12.609700
        Num handles: 1
        Handle: 21 Address: DF:A9:FF:F6:B1:1A (OUI DF-A9-FF)
        Count: 1
        #162: len 21 (1 Kb/s)
        Latency: 166 msec (69-172 msec ~166 msec)
> ACL Data RX: Handle 21 flags 0x02 dlen 21               #164 [hci1] 12.610073
      SMP: Pairing Random (0x04) len 16
        Random value: 99cddee2719db8ad0000000000000000
< HCI Command: Host Number of Com.. (0x03|0x0035) plen 5  #165 [hci1] 12.622887
        Num handles: 1
        Handle: 21 Address: DF:A9:FF:F6:B1:1A (OUI DF-A9-FF)
        Count: 1
< ACL Data TX: Handle 21 flags 0x00 dlen 21               #166 [hci1] 12.622997
      SMP: Pairing Random (0x04) len 16
        Random value: 23ac32ebbb5e14c8a6b9622f296d277f
> HCI Event: Number of Completed Packets (0x13) plen 5    #167 [hci1] 12.784489
        Num handles: 1
        Handle: 21 Address: DF:A9:FF:F6:B1:1A (OUI DF-A9-FF)
        Count: 1
        #166: len 21 (1 Kb/s)
        Latency: 161 msec (69-172 msec ~163 msec)
> ACL Data RX: Handle 21 flags 0x02 dlen 21               #168 [hci1] 12.872305
      SMP: Pairing Confirm (0x03) len 16
        Confim value: f9995c3da48ff5929477c55e418b73fd
< HCI Command: Host Number of Com.. (0x03|0x0035) plen 5  #169 [hci1] 12.882442
        Num handles: 1
        Handle: 21 Address: DF:A9:FF:F6:B1:1A (OUI DF-A9-FF)
        Count: 1
< ACL Data TX: Handle 21 flags 0x00 dlen 21               #170 [hci1] 12.882584
      SMP: Pairing Confirm (0x03) len 16
        Confim value: 6b0e07126992e42a4ce570ca1c83f996
> HCI Event: Number of Completed Packets (0x13) plen 5    #171 [hci1] 13.047232
        Num handles: 1
        Handle: 21 Address: DF:A9:FF:F6:B1:1A (OUI DF-A9-FF)
        Count: 1
        #170: len 21 (1 Kb/s)
        Latency: 164 msec (69-172 msec ~164 msec)
> ACL Data RX: Handle 21 flags 0x02 dlen 21               #172 [hci1] 13.047515
      SMP: Pairing Random (0x04) len 16
        Random value: 1bdbc40b09519fa50000000000000000
< HCI Command: Host Number of Com.. (0x03|0x0035) plen 5  #173 [hci1] 13.062860
        Num handles: 1
        Handle: 21 Address: DF:A9:FF:F6:B1:1A (OUI DF-A9-FF)
        Count: 1
< ACL Data TX: Handle 21 flags 0x00 dlen 21               #174 [hci1] 13.062938
      SMP: Pairing Random (0x04) len 16
        Random value: 297efe85e67448a15f56bd27e3a3cf1d
> HCI Event: Number of Completed Packets (0x13) plen 5    #175 [hci1] 13.222006
        Num handles: 1
        Handle: 21 Address: DF:A9:FF:F6:B1:1A (OUI DF-A9-FF)
        Count: 1
        #174: len 21 (1 Kb/s)
        Latency: 159 msec (69-172 msec ~161 msec)
> ACL Data RX: Handle 21 flags 0x02 dlen 21               #176 [hci1] 13.309815
      SMP: Pairing Confirm (0x03) len 16
        Confim value: 06af15dba7445ff8fdb783648ccb61b9
< HCI Command: Host Number of Com.. (0x03|0x0035) plen 5  #177 [hci1] 13.322219
        Num handles: 1
        Handle: 21 Address: DF:A9:FF:F6:B1:1A (OUI DF-A9-FF)
        Count: 1
< ACL Data TX: Handle 21 flags 0x00 dlen 21               #178 [hci1] 13.322310
      SMP: Pairing Confirm (0x03) len 16
        Confim value: 0aaa0ab1c963dfa8b24f4f265daa564a
> HCI Event: Number of Completed Packets (0x13) plen 5    #179 [hci1] 13.484753
        Num handles: 1
        Handle: 21 Address: DF:A9:FF:F6:B1:1A (OUI DF-A9-FF)
        Count: 1
        #178: len 21 (1 Kb/s)
        Latency: 162 msec (69-172 msec ~162 msec)
> ACL Data RX: Handle 21 flags 0x02 dlen 21               #180 [hci1] 13.484951
      SMP: Pairing Random (0x04) len 16
        Random value: 39c23ee7d4db4d610000000000000000
< HCI Command: Host Number of Com.. (0x03|0x0035) plen 5  #181 [hci1] 13.502316
        Num handles: 1
        Handle: 21 Address: DF:A9:FF:F6:B1:1A (OUI DF-A9-FF)
        Count: 1
< ACL Data TX: Handle 21 flags 0x00 dlen 21               #182 [hci1] 13.502365
      SMP: Pairing Random (0x04) len 16
        Random value: 25a9493fd3ce4faf02be7293595bb7c6
> HCI Event: Number of Completed Packets (0x13) plen 5    #183 [hci1] 13.659451
        Num handles: 1
        Handle: 21 Address: DF:A9:FF:F6:B1:1A (OUI DF-A9-FF)
        Count: 1
        #182: len 21 (1 Kb/s)
        Latency: 157 msec (69-172 msec ~159 msec)
> ACL Data RX: Handle 21 flags 0x02 dlen 21               #184 [hci1] 13.747283
      SMP: Pairing Confirm (0x03) len 16
        Confim value: 293a81cbc3d0be383673554ccc0577ec
< HCI Command: Host Number of Com.. (0x03|0x0035) plen 5  #185 [hci1] 13.762147
        Num handles: 1
        Handle: 21 Address: DF:A9:FF:F6:B1:1A (OUI DF-A9-FF)
        Count: 1
< ACL Data TX: Handle 21 flags 0x00 dlen 21               #186 [hci1] 13.762175
      SMP: Pairing Confirm (0x03) len 16
        Confim value: c7361554461bdca0658aa078d80d2f84
> HCI Event: Number of Completed Packets (0x13) plen 5    #187 [hci1] 13.922161
        Num handles: 1
        Handle: 21 Address: DF:A9:FF:F6:B1:1A (OUI DF-A9-FF)
        Count: 1
        #186: len 21 (1 Kb/s)
        Latency: 159 msec (69-172 msec ~159 msec)
> ACL Data RX: Handle 21 flags 0x02 dlen 21               #188 [hci1] 13.922491
      SMP: Pairing Random (0x04) len 16
        Random value: f35ba886de08b2620000000000000000
< HCI Command: Host Number of Com.. (0x03|0x0035) plen 5  #189 [hci1] 13.942154
        Num handles: 1
        Handle: 21 Address: DF:A9:FF:F6:B1:1A (OUI DF-A9-FF)
        Count: 1
< ACL Data TX: Handle 21 flags 0x00 dlen 21               #190 [hci1] 13.942168
      SMP: Pairing Random (0x04) len 16
        Random value: 58f6b41f855a6f6c3560debd84e2affc
> HCI Event: Number of Completed Packets (0x13) plen 5    #191 [hci1] 14.096940
        Num handles: 1
        Handle: 21 Address: DF:A9:FF:F6:B1:1A (OUI DF-A9-FF)
        Count: 1
        #190: len 21 (1 Kb/s)
        Latency: 154 msec (69-172 msec ~157 msec)
> ACL Data RX: Handle 21 flags 0x02 dlen 21               #192 [hci1] 14.184814
      SMP: Pairing Confirm (0x03) len 16
        Confim value: 8dfb64b3e7504316b1324b5d8a6e473a
< HCI Command: Host Number of Com.. (0x03|0x0035) plen 5  #193 [hci1] 14.202320
        Num handles: 1
        Handle: 21 Address: DF:A9:FF:F6:B1:1A (OUI DF-A9-FF)
        Count: 1
< ACL Data TX: Handle 21 flags 0x00 dlen 21               #194 [hci1] 14.202342
      SMP: Pairing Confirm (0x03) len 16
        Confim value: 165eb823a76630d11cc3ec32889a51d2
> HCI Event: Number of Completed Packets (0x13) plen 5    #195 [hci1] 14.359603
        Num handles: 1
        Handle: 21 Address: DF:A9:FF:F6:B1:1A (OUI DF-A9-FF)
        Count: 1
        #194: len 21 (1 Kb/s)
        Latency: 157 msec (69-172 msec ~157 msec)
> ACL Data RX: Handle 21 flags 0x02 dlen 21               #196 [hci1] 14.359946
      SMP: Pairing Random (0x04) len 16
        Random value: 81b50e5f9b17f1c80000000000000000
< HCI Command: Host Number of Com.. (0x03|0x0035) plen 5  #197 [hci1] 14.362139
        Num handles: 1
        Handle: 21 Address: DF:A9:FF:F6:B1:1A (OUI DF-A9-FF)
        Count: 1
< ACL Data TX: Handle 21 flags 0x00 dlen 21               #198 [hci1] 14.362308
      SMP: Pairing Random (0x04) len 16
        Random value: b67e7216d5bf664139eda2b542549666
> HCI Event: Number of Completed Packets (0x13) plen 5    #199 [hci1] 14.534620
        Num handles: 1
        Handle: 21 Address: DF:A9:FF:F6:B1:1A (OUI DF-A9-FF)
        Count: 1
        #198: len 21 (0 Kb/s)
        Latency: 172 msec (69-172 msec ~164 msec)
> ACL Data RX: Handle 21 flags 0x02 dlen 21               #200 [hci1] 14.622326
      SMP: Pairing Confirm (0x03) len 16
        Confim value: fa9e3b6fcacef95534d0538a5758b3ec
< HCI Command: Host Number of Com.. (0x03|0x0035) plen 5  #201 [hci1] 14.642535
        Num handles: 1
        Handle: 21 Address: DF:A9:FF:F6:B1:1A (OUI DF-A9-FF)
        Count: 1
< ACL Data TX: Handle 21 flags 0x00 dlen 21               #202 [hci1] 14.642720
      SMP: Pairing Confirm (0x03) len 16
        Confim value: feb859020b264b2dfc03a36c8f42913e
> HCI Event: Number of Completed Packets (0x13) plen 5    #203 [hci1] 14.797132
        Num handles: 1
        Handle: 21 Address: DF:A9:FF:F6:B1:1A (OUI DF-A9-FF)
        Count: 1
        #202: len 21 (1 Kb/s)
        Latency: 154 msec (69-172 msec ~159 msec)
> ACL Data RX: Handle 21 flags 0x02 dlen 21               #204 [hci1] 14.797537
      SMP: Pairing Random (0x04) len 16
        Random value: 378737787cd594800000000000000000
< HCI Command: Host Number of Com.. (0x03|0x0035) plen 5  #205 [hci1] 14.802867
        Num handles: 1
        Handle: 21 Address: DF:A9:FF:F6:B1:1A (OUI DF-A9-FF)
        Count: 1
< ACL Data TX: Handle 21 flags 0x00 dlen 21               #206 [hci1] 14.802963
      SMP: Pairing Random (0x04) len 16
        Random value: ed17f76500c95219dd01e09d1e63f87b
> HCI Event: Number of Completed Packets (0x13) plen 5    #207 [hci1] 14.971881
        Num handles: 1
        Handle: 21 Address: DF:A9:FF:F6:B1:1A (OUI DF-A9-FF)
        Count: 1
        #206: len 21 (1 Kb/s)
        Latency: 168 msec (69-172 msec ~164 msec)
> ACL Data RX: Handle 21 flags 0x02 dlen 21               #208 [hci1] 15.059794
      SMP: Pairing Confirm (0x03) len 16
        Confim value: 33ec7c29582dc565b33eda32ef6e1a45
< HCI Command: Host Number of Com.. (0x03|0x0035) plen 5  #209 [hci1] 15.062503
        Num handles: 1
        Handle: 21 Address: DF:A9:FF:F6:B1:1A (OUI DF-A9-FF)
        Count: 1
< ACL Data TX: Handle 21 flags 0x00 dlen 21               #210 [hci1] 15.062632
      SMP: Pairing Confirm (0x03) len 16
        Confim value: a9059e3aa51998cb10e5af1a1e54d9cb
> HCI Event: Number of Completed Packets (0x13) plen 5    #211 [hci1] 15.234670
        Num handles: 1
        Handle: 21 Address: DF:A9:FF:F6:B1:1A (OUI DF-A9-FF)
        Count: 1
        #210: len 21 (0 Kb/s)
        Latency: 172 msec (69-172 msec ~168 msec)
> ACL Data RX: Handle 21 flags 0x02 dlen 21               #212 [hci1] 15.234921
      SMP: Pairing Random (0x04) len 16
        Random value: ae541ea9864ef5e00000000000000000
< HCI Command: Host Number of Com.. (0x03|0x0035) plen 5  #213 [hci1] 15.242933
        Num handles: 1
        Handle: 21 Address: DF:A9:FF:F6:B1:1A (OUI DF-A9-FF)
        Count: 1
< ACL Data TX: Handle 21 flags 0x00 dlen 21               #214 [hci1] 15.242987
      SMP: Pairing Random (0x04) len 16
        Random value: 81d35d47e1f6006d79c974bd9d9e1ee3
> HCI Event: Number of Completed Packets (0x13) plen 5    #215 [hci1] 15.409369
        Num handles: 1
        Handle: 21 Address: DF:A9:FF:F6:B1:1A (OUI DF-A9-FF)
        Count: 1
        #214: len 21 (1 Kb/s)
        Latency: 166 msec (69-172 msec ~167 msec)
> ACL Data RX: Handle 21 flags 0x02 dlen 21               #216 [hci1] 15.497293
      SMP: Pairing Confirm (0x03) len 16
        Confim value: 78bb463b039206b67ac87734b2de1465
< HCI Command: Host Number of Com.. (0x03|0x0035) plen 5  #217 [hci1] 15.502789
        Num handles: 1
        Handle: 21 Address: DF:A9:FF:F6:B1:1A (OUI DF-A9-FF)
        Count: 1
< ACL Data TX: Handle 21 flags 0x00 dlen 21               #218 [hci1] 15.502999
      SMP: Pairing Confirm (0x03) len 16
        Confim value: d6eaad111a5d3cec6438ede098e61f14
> HCI Event: Number of Completed Packets (0x13) plen 5    #219 [hci1] 15.672143
        Num handles: 1
        Handle: 21 Address: DF:A9:FF:F6:B1:1A (OUI DF-A9-FF)
        Count: 1
        #218: len 21 (0 Kb/s)
        Latency: 169 msec (69-172 msec ~168 msec)
> ACL Data RX: Handle 21 flags 0x02 dlen 21               #220 [hci1] 15.672480
      SMP: Pairing Random (0x04) len 16
        Random value: 843ed4a9a9ed3d140000000000000000
< HCI Command: Host Number of Com.. (0x03|0x0035) plen 5  #221 [hci1] 15.683014
        Num handles: 1
        Handle: 21 Address: DF:A9:FF:F6:B1:1A (OUI DF-A9-FF)
        Count: 1
< ACL Data TX: Handle 21 flags 0x00 dlen 21               #222 [hci1] 15.683116
      SMP: Pairing Random (0x04) len 16
        Random value: e7f7e0c2476823e41736a7e381bafb7c
> HCI Event: Number of Completed Packets (0x13) plen 5    #223 [hci1] 15.846876
        Num handles: 1
        Handle: 21 Address: DF:A9:FF:F6:B1:1A (OUI DF-A9-FF)
        Count: 1
        #222: len 21 (1 Kb/s)
        Latency: 163 msec (69-172 msec ~165 msec)
> ACL Data RX: Handle 21 flags 0x02 dlen 21               #224 [hci1] 15.934704
      SMP: Pairing Confirm (0x03) len 16
        Confim value: 765aee1643498fe4574a6f3e5a34e602
< HCI Command: Host Number of Com.. (0x03|0x0035) plen 5  #225 [hci1] 15.942614
        Num handles: 1
        Handle: 21 Address: DF:A9:FF:F6:B1:1A (OUI DF-A9-FF)
        Count: 1
< ACL Data TX: Handle 21 flags 0x00 dlen 21               #226 [hci1] 15.942818
      SMP: Pairing Confirm (0x03) len 16
        Confim value: dcade88f02d89dff3138ea2053cc5e04
> HCI Event: Number of Completed Packets (0x13) plen 5    #227 [hci1] 16.109629
        Num handles: 1
        Handle: 21 Address: DF:A9:FF:F6:B1:1A (OUI DF-A9-FF)
        Count: 1
        #226: len 21 (1 Kb/s)
        Latency: 166 msec (69-172 msec ~166 msec)
> ACL Data RX: Handle 21 flags 0x02 dlen 21               #228 [hci1] 16.109989
      SMP: Pairing Random (0x04) len 16
        Random value: cda0de6cb2d9c7a50000000000000000
< HCI Command: Host Number of Com.. (0x03|0x0035) plen 5  #229 [hci1] 16.122955
        Num handles: 1
        Handle: 21 Address: DF:A9:FF:F6:B1:1A (OUI DF-A9-FF)
        Count: 1
