Bluetooth monitor ver 5.84
btmon[1622727]: = Note: Linux version 6.8.0-83-generic (x86_64)                                                          0.630559
btmon[1622727]: = Note: Bluetooth subsystem version 2.22                                                                 0.630561
= New Index: 00:00:00:00:00:00 (Primary,UART,hci0)                                                                       0.630562
= Open Index: 00:00:00:00:00:00                                                                                          0.638261
= Index Info: 00:00:00:00:00:00 (Nordic Semiconductor ASA)                                                               0.638266
zephyr.exe[1622729]: @ USER Open: main (privileged) version 2.22                                                {0x0001} 0.638268
zephyr.exe[1622729]: < HCI Command: Reset (0x03|0x0003) plen 0                                                        #1 0.638524
> HCI Event: Command Complete (0x0e) plen 4                                                                           #2 0.639292
      Reset (0x03|0x0003) ncmd 1
        Status: Success (0x00)
zephyr.exe[1622729]: < HCI Command: Read Local Supported Features (0x04|0x0003) plen 0                                #3 0.658178
> HCI Event: Command Complete (0x0e) plen 12                                                                          #4 0.658966
      Read Local Supported Features (0x04|0x0003) ncmd 1
        Status: Success (0x00)
        Features: 0x00 0x00 0x00 0x00 0x60 0x00 0x00 0x00
          BR/EDR Not Supported
          LE Supported (Controller)
zephyr.exe[1622729]: < HCI Command: Read Local Version Information (0x04|0x0001) plen 0                               #5 0.678167
> HCI Event: Command Complete (0x0e) plen 12                                                                          #6 0.678728
      Read Local Version Information (0x04|0x0001) ncmd 1
        Status: Success (0x00)
        HCI version: Reserved (0x0e) - Revision 12520 (0x30e8)
        LMP version: Reserved (0x0e) - Subversion 12520 (0x30e8)
        Manufacturer: Nordic Semiconductor ASA (89)
zephyr.exe[1622729]: < HCI Command: Read Local Supported Commands (0x04|0x0002) plen 0                                #7 0.698166
> HCI Event: Command Complete (0x0e) plen 68                                                                          #8 0.700222
      Read Local Supported Commands (0x04|0x0002) ncmd 1
        Status: Success (0x00)
        Commands: 119 entries
          Disconnect (Octet 0 - Bit 5)
          Read Remote Version Information (Octet 2 - Bit 7)
          Set Event Mask (Octet 5 - Bit 6)
          Reset (Octet 5 - Bit 7)
          Read Connection Accept Timeout (Octet 7 - Bit 2)
          Write Connection Accept Timeout (Octet 7 - Bit 3)
          Read Transmit Power Level (Octet 10 - Bit 2)
          Set Controller To Host Flow Control (Octet 10 - Bit 5)
          Host Buffer Size (Octet 10 - Bit 6)
          Host Number of Completed Packets (Octet 10 - Bit 7)
          Read Local Version Information (Octet 14 - Bit 3)
          Read Local Supported Features (Octet 14 - Bit 5)
          Read BD ADDR (Octet 15 - Bit 1)
          Read RSSI (Octet 15 - Bit 5)
          Set Event Mask Page 2 (Octet 22 - Bit 2)
          LE Set Event Mask (Octet 25 - Bit 0)
          LE Read Buffer Size (Octet 25 - Bit 1)
          LE Read Local Supported Features (Octet 25 - Bit 2)
          LE Set Random Address (Octet 25 - Bit 4)
          LE Set Advertising Parameters (Octet 25 - Bit 5)
          LE Read Advertising Channel TX Power (Octet 25 - Bit 6)
          LE Set Advertising Data (Octet 25 - Bit 7)
          LE Set Scan Response Data (Octet 26 - Bit 0)
          LE Set Advertise Enable (Octet 26 - Bit 1)
          LE Set Scan Parameters (Octet 26 - Bit 2)
          LE Set Scan Enable (Octet 26 - Bit 3)
          LE Create Connection (Octet 26 - Bit 4)
          LE Create Connection Cancel (Octet 26 - Bit 5)
          LE Read Accept List Size (Octet 26 - Bit 6)
          LE Clear Accept List (Octet 26 - Bit 7)
          LE Add Device To Accept List (Octet 27 - Bit 0)
          LE Remove Device From Accept List (Octet 27 - Bit 1)
          LE Connection Update (Octet 27 - Bit 2)
          LE Set Host Channel Classification (Octet 27 - Bit 3)
          LE Read Channel Map (Octet 27 - Bit 4)
          LE Read Remote Used Features (Octet 27 - Bit 5)
          LE Encrypt (Octet 27 - Bit 6)
          LE Rand (Octet 27 - Bit 7)
          LE Start Encryption (Octet 28 - Bit 0)
          LE Long Term Key Request Reply (Octet 28 - Bit 1)
          LE Long Term Key Request Neg Reply (Octet 28 - Bit 2)
          LE Read Supported States (Octet 28 - Bit 3)
          LE Receiver Test (Octet 28 - Bit 4)
          LE Transmitter Test (Octet 28 - Bit 5)
          LE Test End (Octet 28 - Bit 6)
          Read Authenticated Payload Timeout (Octet 32 - Bit 4)
          Write Authenticated Payload Timeout (Octet 32 - Bit 5)
          LE Set Data Length (Octet 33 - Bit 6)
          LE Read Suggested Default Data Length (Octet 33 - Bit 7)
          LE Write Suggested Default Data Length (Octet 34 - Bit 0)
          LE Add Device To Resolving List (Octet 34 - Bit 3)
          LE Remove Device From Resolving List (Octet 34 - Bit 4)
          LE Clear Resolving List (Octet 34 - Bit 5)
          LE Read Resolving List Size (Octet 34 - Bit 6)
          LE Set Address Resolution Enable (Octet 35 - Bit 1)
          LE Set Resolvable Private Address Timeout (Octet 35 - Bit 2)
          LE Read Maximum Data Length (Octet 35 - Bit 3)
          LE Read PHY (Octet 35 - Bit 4)
          LE Set Default PHY (Octet 35 - Bit 5)
          LE Set PHY (Octet 35 - Bit 6)
          LE Enhanced Receiver Test (Octet 35 - Bit 7)
          LE Enhanced Transmitter Test (Octet 36 - Bit 0)
          LE Set Advertising Set Random Address (Octet 36 - Bit 1)
          LE Set Extended Advertising Parameters (Octet 36 - Bit 2)
          LE Set Extended Advertising Data (Octet 36 - Bit 3)
          LE Set Extended Scan Response Data (Octet 36 - Bit 4)
          LE Set Extended Advertising Enable (Octet 36 - Bit 5)
          LE Read Maximum Advertising Data Length (Octet 36 - Bit 6)
          LE Read Number of Supported Advertising Sets (Octet 36 - Bit 7)
          LE Remove Advertising Set (Octet 37 - Bit 0)
          LE Clear Advertising Sets (Octet 37 - Bit 1)
          LE Set Periodic Advertising Parameters (Octet 37 - Bit 2)
          LE Set Periodic Advertising Data (Octet 37 - Bit 3)
          LE Set Periodic Advertising Enable (Octet 37 - Bit 4)
          LE Set Extended Scan Parameters (Octet 37 - Bit 5)
          LE Set Extended Scan Enable (Octet 37 - Bit 6)
          LE Extended Create Connection (Octet 37 - Bit 7)
          LE Periodic Advertising Create Sync (Octet 38 - Bit 0)
          LE Periodic Advertising Create Sync Cancel (Octet 38 - Bit 1)
          LE Periodic Advertising Terminate Sync (Octet 38 - Bit 2)
          LE Add Device To Periodic Advertiser List (Octet 38 - Bit 3)
          LE Remove Device From Periodic Advertiser List (Octet 38 - Bit 4)
          LE Clear Periodic Advertiser List (Octet 38 - Bit 5)
          LE Read Periodic Advertiser List Size (Octet 38 - Bit 6)
          LE Read Transmit Power (Octet 38 - Bit 7)
          LE Read RF Path Compensation (Octet 39 - Bit 0)
          LE Write RF Path Compensation (Octet 39 - Bit 1)
          LE Set Privacy Mode (Octet 39 - Bit 2)
          LE Periodic Advertising Receive Enable (Octet 40 - Bit 5)
          LE Periodic Advertising Sync Transfer (Octet 40 - Bit 6)
          LE Periodic Advertising Set Info Transfer (Octet 40 - Bit 7)
          LE Periodic Advertising Sync Transfer Parameters (Octet 41 - Bit 0)
          LE Set Default Periodic Advertisng Sync Transfer Parameters (Octet 41 - Bit 1)
          LE Read Buffer v2 (Octet 41 - Bit 5)
          LE Read ISO TX Sync (Octet 41 - Bit 6)
          LE Set Connected Isochronous Group Parameters (Octet 41 - Bit 7)
          LE Set Connected Isochronous Group Parameters Test (Octet 42 - Bit 0)
          LE Create Connected Isochronous Stream (Octet 42 - Bit 1)
          LE Remove Connected Isochronous Group (Octet 42 - Bit 2)
          LE Accept Connected Isochronous Stream Request (Octet 42 - Bit 3)
          LE Reject Connected Isochronous Stream Request (Octet 42 - Bit 4)
          LE Create Broadcast Isochronous Group (Octet 42 - Bit 5)
          LE Create Broadcast Isochronous Group Test (Octet 42 - Bit 6)
          LE Terminate Broadcast Isochronous Group (Octet 42 - Bit 7)
          LE Broadcast Isochronous Group Create Sync (Octet 43 - Bit 0)
          LE Broadcast Isochronous Group Terminate Sync (Octet 43 - Bit 1)
          LE Request Peer SCA (Octet 43 - Bit 2)
          LE Setup Isochronous Data Path (Octet 43 - Bit 3)
          LE Remove Isochronous Data Path (Octet 43 - Bit 4)
          LE Isochronous Transmit Test (Octet 43 - Bit 5)
          LE Isochronous Receive Test (Octet 43 - Bit 6)
          LE Isochronous Read Test Counters (Octet 43 - Bit 7)
          LE Isochronous Read Test Counters (Octet 44 - Bit 0)
          LE Set Host Feature (Octet 44 - Bit 1)
          LE Read ISO link quality (Octet 44 - Bit 2)
          Octet 45 - Bit 6 
          Octet 46 - Bit 0 
          Octet 46 - Bit 1 
          Octet 46 - Bit 2 
zephyr.exe[1622729]: < HCI Command: Host Buffer Size (0x03|0x0033) plen 7                                             #9 0.718174
        ACL MTU: 255  ACL max packet: 16
        SCO MTU: 0    SCO max packet: 0
> HCI Event: Command Complete (0x0e) plen 4                                                                          #10 0.718715
      Host Buffer Size (0x03|0x0033) ncmd 1
        Status: Success (0x00)
zephyr.exe[1622729]: < HCI Command: Set Controller To Host Flow Control (0x03|0x0031) plen 1                         #11 0.738133
        Flow control: ACL Data Packets (0x01)
> HCI Event: Command Complete (0x0e) plen 4                                                                          #12 0.738720
      Set Controller To Host Flow Control (0x03|0x0031) ncmd 1
        Status: Success (0x00)
zephyr.exe[1622729]: < HCI Command: LE Read Local Supported Features (0x08|0x0003) plen 0                            #13 0.758180
> HCI Event: Command Complete (0x0e) plen 12                                                                         #14 0.759559
      LE Read Local Supported Features (0x08|0x0003) ncmd 1
        Status: Success (0x00)
        Features: 0xfd 0x79 0x00 0xf7 0x30 0x01 0x00 0x00
          LE Encryption
          Extended Reject Indication
          Peripheral-initiated Features Exchange
          LE Ping
          LE Data Packet Length Extension
          LL Privacy
          Extended Scanner Filter Policies
          LE 2M PHY
          LE Coded PHY
          LE Extended Advertising
          LE Periodic Advertising
          Channel Selection Algorithm #2
          Periodic Advertising Sync Transfer - Sender
          Periodic Advertising Sync Transfer - Recipient
          Sleep Clock Accuracy Updates
          Connected Isochronous Stream - Central
          Connected Isochronous Stream - Peripheral
          Isochronous Broadcaster
          Synchronized Receiver
          Periodic Advertising ADI support
          Connection Subrating
          Unknown features (0x0000010000000000)
zephyr.exe[1622729]: < HCI Command: LE Set Host Feature (0x08|0x0074) plen 2                                         #15 0.778166
        Bit Number: 32
          Connected Isochronous Stream (Host Support)
        Bit Value: 1
> HCI Event: Command Complete (0x0e) plen 4                                                                          #16 0.778625
      LE Set Host Feature (0x08|0x0074) ncmd 1
        Status: Success (0x00)
zephyr.exe[1622729]: < HCI Command: LE Read Buffer v2 (0x08|0x0060) plen 0                                           #17 0.798175
> HCI Event: Command Complete (0x0e) plen 10                                                                         #18 0.799266
      LE Read Buffer v2 (0x08|0x0060) ncmd 1
        Status: Success (0x00)
        ACL MTU: 27
        ACL max packet: 3
        ISO MTU: 318
        ISO max packet: 3
zephyr.exe[1622729]: < HCI Command: LE Read Maximum Advertising Data Length (0x08|0x003a) plen 0                     #19 0.818154
> HCI Event: Command Complete (0x0e) plen 6                                                                          #20 0.819198
      LE Read Maximum Advertising Data Length (0x08|0x003a) ncmd 1
        Status: Success (0x00)
        Max length: 1650
zephyr.exe[1622729]: < HCI Command: LE Read Supported States (0x08|0x001c) plen 0                                    #21 0.838063
> HCI Event: Command Complete (0x0e) plen 12                                                                         #22 0.838521
      LE Read Supported States (0x08|0x001c) ncmd 1
        Status: Success (0x00)
        States: 0x000003ff3e0306ff
          Non-connectable Advertising State
          Scannable Advertising State
          Connectable Advertising State
          High Duty Cycle Directed Advertising State
          Passive Scanning State
          Active Scanning State
          Initiating State
            and Connection State (Central Role)
          Connection State (Peripheral Role)
          Scannable Advertising State
            and Passive Scanning State
          Connectable Advertising State
            and Passive Scanning State
          Non-connectable Advertising State
            and Initiating State
          Scannable Advertising State
            and Initiating State
          Active Scanning State
            and Connection State (Central Role)
          Passive Scanning State
            and Connection State (Peripheral Role)
          Active Scanning State
            and Connection State (Peripheral Role)
          Initiating State
            and Connection State (Central Role)
            and Central Role & Central Role
          Low Duty Cycle Directed Advertising State
          Connectable Advertising State
            and Initiating State
            and Central Role & Peripheral Role
          High Duty Cycle Directed Advertising State
            and Initiating State
            and Central Role & Peripheral Role
          Low Duty Cycle Directed Advertising State
            and Initiating State
            and Central Role & Peripheral Role
          Connectable Advertising State
            and Connection State (Central Role)
            and Central Role & Peripheral Role
          High Duty Cycle Directed Advertising State
            and Connection State (Central Role)
            and Central Role & Peripheral Role
          Low Duty Cycle Directed Advertising State
            and Connection State (Central Role)
            and Central Role & Peripheral Role
          Connectable Advertising State
            and Connection State (Peripheral Role)
            and Central Role & Peripheral Role
          High Duty Cycle Directed Advertising State
            and Connection State (Peripheral Role)
            and Peripheral Role & Peripheral Role
          Low Duty Cycle Directed Advertising State
            and Connection State (Peripheral Role)
            and Peripheral Role & Peripheral Role
          Initiating State
            and Connection State (Peripheral Role)
            and Central Role & Peripheral Role
zephyr.exe[1622729]: < HCI Command: LE Read Maximum Data Length (0x08|0x002f) plen 0                                 #23 0.858167
> HCI Event: Command Complete (0x0e) plen 12                                                                         #24 0.858900
      LE Read Maximum Data Length (0x08|0x002f) ncmd 1
        Status: Success (0x00)
        Max TX octets: 251
        Max TX time: 2704
        Max RX octets: 251
        Max RX time: 2704
zephyr.exe[1622729]: < HCI Command: LE Write Suggested Default Data Length (0x08|0x0024) plen 4                      #25 0.878170
        TX octets: 251
        TX time: 2704
> HCI Event: Command Complete (0x0e) plen 4                                                                          #26 0.878886
      LE Write Suggested Default Data Length (0x08|0x0024) ncmd 1
        Status: Success (0x00)
zephyr.exe[1622729]: < HCI Command: LE Read Resolving List Size (0x08|0x002a) plen 0                                 #27 0.898180
> HCI Event: Command Complete (0x0e) plen 5                                                                          #28 0.898885
      LE Read Resolving List Size (0x08|0x002a) ncmd 1
        Status: Success (0x00)
        Size: 8
zephyr.exe[1622729]: < HCI Command: LE Set Event Mask (0x08|0x0001) plen 8                                           #29 0.918181
        Mask: 0x000002023f87fa5e
          LE Advertising Report
          LE Connection Update Complete
          LE Read Remote Used Features Complete
          LE Long Term Key Request
          LE Data Length Change
          LE Enhanced Connection Complete
          LE PHY Update Complete
          LE Extended Advertising Report
          LE Periodic Advertising Sync Established
          LE Periodic Advertising Report
          LE Periodic Advertising Sync Lost
          LE Extended Scan Timeout
          LE Extended Advertising Set Terminated
          LE Scan Request Received
          LE Periodic Advertising Sync Transfer Rvc
          LE CIS Established
          LE CIS Request
          LE Create BIG Complete
          LE Terminate BIG Complete
          LE BIG Sync Established Complete
          LE BIG Sync Lost
          LE BIG Info Advertising Report
          Unknown mask (0x0000020000000000)
> HCI Event: Command Complete (0x0e) plen 4                                                                          #30 0.918688
      LE Set Event Mask (0x08|0x0001) ncmd 1
        Status: Success (0x00)
zephyr.exe[1622729]: < HCI Command: Set Event Mask (0x03|0x0001) plen 8                                              #31 0.938163
        Mask: 0x2000800002008890
          Disconnection Complete
          Encryption Change
          Read Remote Version Information Complete
          Hardware Error
          Data Buffer Overflow
          Encryption Key Refresh Complete
          LE Meta
> HCI Event: Command Complete (0x0e) plen 4                                                                          #32 0.938954
      Set Event Mask (0x03|0x0001) ncmd 1
        Status: Success (0x00)
zephyr.exe[1622729]: < HCI Command: Read BD ADDR (0x04|0x0009) plen 0                                                #33 0.958070
> HCI Event: Command Complete (0x0e) plen 10                                                                         #34 0.958857
      Read BD ADDR (0x04|0x0009) ncmd 1
        Status: Success (0x00)
        Address: 00:00:00:00:00:00 (OUI 00-00-00)
zephyr.exe[1622729]: < HCI Command: LE Set Random Address (0x08|0x0005) plen 6                                       #35 0.978179
        Address: D5:B6:CC:31:DB:3B (Static)
> HCI Event: Command Complete (0x0e) plen 4                                                                          #36 0.979107
      LE Set Random Address (0x08|0x0005) ncmd 1
        Status: Success (0x00)
zephyr.exe[1622729]: < HCI Command: LE Set Extended Advertising Parameters (0x08|0x0036) plen 25                     #37 3.388178
        Handle: 0x00
        Properties: 0x0013
          Connectable
          Scannable
          Use legacy advertising PDUs: ADV_IND
        Min advertising interval: 100.000 msec (0x00a0)
        Max advertising interval: 150.000 msec (0x00f0)
        Channel map: 37, 38, 39 (0x07)
        Own address type: Random (0x01)
        Peer address type: Public (0x00)
        Peer address: 00:00:00:00:00:00 (OUI 00-00-00)
        Filter policy: Allow Scan Request from Any, Allow Connect Request from Any (0x00)
        TX power: Host has no preference (0x7f)
        Primary PHY: LE 1M (0x01)
        Secondary max skip: 0x00
        Secondary PHY: LE 1M (0x01)
        SID: 0x00
        Scan request notifications: Disabled (0x00)
> HCI Event: Command Complete (0x0e) plen 5                                                                          #38 3.388999
      LE Set Extended Advertising Parameters (0x08|0x0036) ncmd 1
        Status: Success (0x00)
        TX power (selected): 0 dbm (0x00)
zephyr.exe[1622729]: < HCI Command: LE Set Advertising Set Random Address (0x08|0x0035) plen 7                       #39 3.398157
        Advertising handle: 0x00
        Advertising random address: D5:B6:CC:31:DB:3B (Static)
> HCI Event: Command Complete (0x0e) plen 4                                                                          #40 3.398758
      LE Set Advertising Set Random Address (0x08|0x0035) ncmd 1
        Status: Success (0x00)
zephyr.exe[1622729]: < HCI Command: LE Set Extended Advertising Data (0x08|0x0037) plen 22                           #41 3.418173
        Handle: 0x00
        Operation: Complete extended advertising data (0x03)
        Fragment preference: Minimize fragmentation (0x01)
        Data length: 0x12
        Flags: 0x06
          LE General Discoverable Mode
          BR/EDR Not Supported
        Name (complete): Tester_F6B11A
> HCI Event: Command Complete (0x0e) plen 4                                                                          #42 3.418995
      LE Set Extended Advertising Data (0x08|0x0037) ncmd 1
        Status: Success (0x00)
zephyr.exe[1622729]: < HCI Command: LE Set Extended Scan Response Data (0x08|0x0038) plen 4                          #43 3.438153
        Handle: 0x00
        Operation: Complete scan response data (0x03)
        Fragment preference: Minimize fragmentation (0x01)
        Data length: 0x00
> HCI Event: Command Complete (0x0e) plen 4                                                                          #44 3.438766
      LE Set Extended Scan Response Data (0x08|0x0038) ncmd 1
        Status: Success (0x00)
zephyr.exe[1622729]: < HCI Command: LE Set Extended Advertising Enable (0x08|0x0039) plen 6                          #45 3.458203
        Extended advertising: Enabled (0x01)
        Number of sets: 1 (0x01)
        Entry 0
          Handle: 0x00
          Duration: 0 ms (0x00)
          Max ext adv events: 0
> HCI Event: Command Complete (0x0e) plen 4                                                                          #46 3.458898
      LE Set Extended Advertising Enable (0x08|0x0039) ncmd 1
        Status: Success (0x00)
> HCI Event: LE Meta Event (0x3e) plen 31                                                                            #47 3.572981
      LE Enhanced Connection Complete (0x0a)
        Status: Success (0x00)
        Handle: 327
        Role: Peripheral (0x01)
        Peer address type: Public (0x00)
        Peer address: DF:A9:FF:F6:B1:1A (OUI DF-A9-FF)
        Local resolvable private address: 00:00:00:00:00:00 (Non-Resolvable)
        Peer resolvable private address: 00:00:00:00:00:00 (Non-Resolvable)
        Connection interval: 87.50 msec (0x0046)
        Connection latency: 0 (0x0000)
        Supervision timeout: 25120 msec (0x09d0)
        Central clock accuracy: 0x01
> HCI Event: LE Meta Event (0x3e) plen 6                                                                             #48 3.572983
      LE Advertising Set Terminated (0x12)
        Status: Success (0x00)
        Handle: 0
        Connection handle: 327
        Number of completed extended advertising events: 0
zephyr.exe[1622729]: < HCI Command: LE Read Remote Used Features (0x08|0x0016) plen 2                                #49 3.578334
        Handle: 327 Address: DF:A9:FF:F6:B1:1A (OUI DF-A9-FF)
> HCI Event: Command Status (0x0f) plen 4                                                                            #50 3.578898
      LE Read Remote Used Features (0x08|0x0016) ncmd 1
        Status: Success (0x00)
zephyr.exe[1622729]: < ACL Data TX: Handle 327 [1/3] flags 0x00 dlen 7                                               #51 3.598278
      ATT: Exchange MTU Request (0x02) len 2
        Client RX MTU: 251
> HCI Event: Number of Completed Packets (0x13) plen 5                                                               #52 3.748776
        Num handles: 1
        Handle: 327 Address: DF:A9:FF:F6:B1:1A (OUI DF-A9-FF)
        Count: 1
        Buffers: 0/3
        #51: len 7 (0 Kb/s)
        Latency: 150 msec (150-150 msec ~150 msec)
> HCI Event: LE Meta Event (0x3e) plen 12                                                                            #53 3.836623
      LE Read Remote Used Features (0x04)
        Status: Success (0x00)
        Handle: 327 Address: DF:A9:FF:F6:B1:1A (OUI DF-A9-FF)
        Features: 0x2d 0x49 0x00 0xf7 0x67 0xd8 0x00 0x00
          LE Encryption
          Extended Reject Indication
          Peripheral-initiated Features Exchange
          LE Data Packet Length Extension
          LE 2M PHY
          LE Coded PHY
          Channel Selection Algorithm #2
          Periodic Advertising Sync Transfer - Sender
          Periodic Advertising Sync Transfer - Recipient
          Sleep Clock Accuracy Updates
          Connected Isochronous Stream - Central
          Connected Isochronous Stream - Peripheral
          Isochronous Broadcaster
          Synchronized Receiver
          Connected Isochronous Stream (Host Support)
          LE Power Control Request
          LE Power Control Request
          Connection Subrating
          Connection Subrating (Host Support)
          Unknown features (0x0000d80000000000)
> ACL Data RX: Handle 327 flags 0x02 dlen 11                                                                         #54 6.286447
      SMP: Pairing Request (0x01) len 6
        IO capability: KeyboardDisplay (0x04)
        OOB data: Authentication data not present (0x00)
        Authentication requirement: Bonding, No MITM, SC, No Keypresses (0x09)
        Max encryption key size: 16
        Initiator key distribution: EncKey IdKey (0x03)
        Responder key distribution: EncKey IdKey Sign (0x07)
> ACL Data RX: Handle 327 flags 0x02 dlen 7                                                                          #55 6.287070
      ATT: Exchange MTU Response (0x03) len 2
        Server RX MTU: 23
zephyr.exe[1622729]: < HCI Command: Host Number of Completed Packets (0x03|0x0035) plen 5                            #56 6.298214
        Num handles: 1
        Handle: 327 Address: DF:A9:FF:F6:B1:1A (OUI DF-A9-FF)
        Count: 1
zephyr.exe[1622729]: < ACL Data TX: Handle 327 [1/3] flags 0x00 dlen 11                                              #57 6.298240
      SMP: Pairing Response (0x02) len 6
        IO capability: DisplayOnly (0x00)
        OOB data: Authentication data not present (0x00)
        Authentication requirement: Bonding, No MITM, SC, No Keypresses (0x09)
        Max encryption key size: 16
        Initiator key distribution: IdKey (0x02)
        Responder key distribution: Sign (0x04)
zephyr.exe[1622729]: < HCI Command: Host Number of Completed Packets (0x03|0x0035) plen 5                            #58 6.298324
        Num handles: 1
        Handle: 327 Address: DF:A9:FF:F6:B1:1A (OUI DF-A9-FF)
        Count: 1
> HCI Event: Number of Completed Packets (0x13) plen 5                                                               #59 6.461959
        Num handles: 1
        Handle: 327 Address: DF:A9:FF:F6:B1:1A (OUI DF-A9-FF)
        Count: 1
        Buffers: 0/3
        #57: len 11 (0 Kb/s)
        Latency: 163 msec (150-163 msec ~157 msec)
> ACL Data RX: Handle 327 flags 0x02 dlen 27                                                                         #60 6.462289
> ACL Data RX: Handle 327 flags 0x01 dlen 27                                                                         #61 6.462365
> ACL Data RX: Handle 327 flags 0x01 dlen 15                                                                         #62 6.462952
      SMP: Pairing Public Key (0x0c) len 64
        X[32]: a60e6361f40bc9e1510535600f47ac14ddb3d4f07993f36cb44066966c432b63
        Y[32]: 9ce70f8ad830cf72c26535260189752061afc6309e5d15be0a3ed184eca1a258
zephyr.exe[1622729]: < HCI Command: Host Number of Completed Packets (0x03|0x0035) plen 5                            #63 6.478435
        Num handles: 1
        Handle: 327 Address: DF:A9:FF:F6:B1:1A (OUI DF-A9-FF)
        Count: 1
zephyr.exe[1622729]: < HCI Command: Host Number of Completed Packets (0x03|0x0035) plen 5                            #64 6.478524
        Num handles: 1
        Handle: 327 Address: DF:A9:FF:F6:B1:1A (OUI DF-A9-FF)
        Count: 1
zephyr.exe[1622729]: < HCI Command: Host Number of Completed Packets (0x03|0x0035) plen 5                            #65 6.478587
        Num handles: 1
        Handle: 327 Address: DF:A9:FF:F6:B1:1A (OUI DF-A9-FF)
        Count: 1
zephyr.exe[1622729]: < ACL Data TX: Handle 327 [1/3] flags 0x00 dlen 27                                              #66 6.478591
zephyr.exe[1622729]: < ACL Data TX: Handle 327 flags 0x01 dlen 27                                                    #67 6.478591
zephyr.exe[1622729]: < ACL Data TX: Handle 327 flags 0x01 dlen 15                                                    #68 6.478627
      SMP: Pairing Public Key (0x0c) len 64
        X[32]: 98308440221e2d910f0e54b71e7ec652857aa9b5a0dc65028824cc19db1226e9
        Y[32]: 67a4816bcb62efb21701e31fdb27561a6217575fb007a8bbdabe7e28b6f68482
> HCI Event: Number of Completed Packets (0x13) plen 5                                                               #69 6.549351
        Num handles: 1
        Handle: 327 Address: DF:A9:FF:F6:B1:1A (OUI DF-A9-FF)
        Count: 1
        Buffers: 0/3
        #66: len 27 (3 Kb/s)
        Latency: 70 msec (70-163 msec ~113 msec)
> HCI Event: Number of Completed Packets (0x13) plen 5                                                               #70 6.550140
        Num handles: 1
        Handle: 327 Address: DF:A9:FF:F6:B1:1A (OUI DF-A9-FF)
        Count: 1
        Buffers: underflow/3
        #67: len 27 (3 Kb/s)
        Latency: 71 msec (70-163 msec ~92 msec)
zephyr.exe[1622729]: < ACL Data TX: Handle 327 [1/3] flags 0x00 dlen 21                                              #71 6.558159
      SMP: Pairing Confirm (0x03) len 16
        Confirm value[16]: b776c0b2fbcf8d53464f8ec8396a1999
> HCI Event: Number of Completed Packets (0x13) plen 5                                                               #72 6.636318
        Num handles: 1
        Handle: 327 Address: DF:A9:FF:F6:B1:1A (OUI DF-A9-FF)
        Count: 1
        Buffers: 0/3
        #68: len 15 (0 Kb/s)
        Latency: 157 msec (70-163 msec ~125 msec)
> HCI Event: Number of Completed Packets (0x13) plen 5                                                               #73 6.724013
        Num handles: 1
        Handle: 327 Address: DF:A9:FF:F6:B1:1A (OUI DF-A9-FF)
        Count: 1
        Buffers: underflow/3
        #71: len 21 (1 Kb/s)
        Latency: 165 msec (70-165 msec ~145 msec)
> ACL Data RX: Handle 327 flags 0x02 dlen 21                                                                         #74 6.724744
      SMP: Pairing Random (0x04) len 16
        Random value[16]: 76d4fec6186c09a40000000000000000
zephyr.exe[1622729]: < HCI Command: Host Number of Completed Packets (0x03|0x0035) plen 5                            #75 6.738202
        Num handles: 1
        Handle: 327 Address: DF:A9:FF:F6:B1:1A (OUI DF-A9-FF)
        Count: 1
zephyr.exe[1622729]: < ACL Data TX: Handle 327 [1/3] flags 0x00 dlen 21                                              #76 6.738229
      SMP: Pairing Random (0x04) len 16
        Random value[16]: 8e6108f966a694cbe26df70bb96773e6
> HCI Event: Number of Completed Packets (0x13) plen 5                                                               #77 6.898712
        Num handles: 1
        Handle: 327 Address: DF:A9:FF:F6:B1:1A (OUI DF-A9-FF)
        Count: 1
        Buffers: 0/3
        #76: len 21 (1 Kb/s)
        Latency: 160 msec (70-165 msec ~153 msec)
> ACL Data RX: Handle 327 flags 0x02 dlen 21                                                                         #78 7.074163
      SMP: Pairing DHKey Check (0x0d) len 16
        E[16]: 7a603776f9d810cb5bed4c7d62dc7ca2
zephyr.exe[1622729]: < HCI Command: Host Number of Completed Packets (0x03|0x0035) plen 5                            #79 7.078429
        Num handles: 1
        Handle: 327 Address: DF:A9:FF:F6:B1:1A (OUI DF-A9-FF)
        Count: 1
zephyr.exe[1622729]: < ACL Data TX: Handle 327 [1/3] flags 0x00 dlen 21                                              #80 7.078457
      SMP: Pairing DHKey Check (0x0d) len 16
        E[16]: 685f9c0e39ed80fc212f4e72b6103b20
> HCI Event: Number of Completed Packets (0x13) plen 5                                                               #81 7.249052
        Num handles: 1
        Handle: 327 Address: DF:A9:FF:F6:B1:1A (OUI DF-A9-FF)
        Count: 1
        Buffers: 0/3
        #80: len 21 (0 Kb/s)
        Latency: 170 msec (70-170 msec ~161 msec)
> HCI Event: LE Meta Event (0x3e) plen 13                                                                            #82 7.336728
      LE Long Term Key Request (0x05)
        Handle: 327 Address: DF:A9:FF:F6:B1:1A (OUI DF-A9-FF)
        Random number: 0x0000000000000000
        Encrypted diversifier: 0x0000
zephyr.exe[1622729]: < HCI Command: LE Long Term Key Request Reply (0x08|0x001a) plen 18                             #83 7.338230
        Handle: 327 Address: DF:A9:FF:F6:B1:1A (OUI DF-A9-FF)
        Long term key[16]: 84117abc27e2d4460f166f728cb53608
> HCI Event: Command Complete (0x0e) plen 6                                                                          #84 7.339307
      LE Long Term Key Request Reply (0x08|0x001a) ncmd 1
        Status: Success (0x00)
        Handle: 327 Address: DF:A9:FF:F6:B1:1A (OUI DF-A9-FF)
> HCI Event: Encryption Change (0x08) plen 4                                                                         #85 7.773912
        Status: Success (0x00)
        Handle: 327 Address: DF:A9:FF:F6:B1:1A (OUI DF-A9-FF)
        Encryption: Enabled with AES-CCM (0x01)
zephyr.exe[1622729]: < ACL Data TX: Handle 327 [1/3] flags 0x00 dlen 21                                              #86 7.888328
      SMP: Signing Information (0x0a) len 16
        Signature key[16]: 5da095555cc64d02679f89a05211af56
> HCI Event: Number of Completed Packets (0x13) plen 5                                                               #87 8.036507
        Num handles: 1
        Handle: 327 Address: DF:A9:FF:F6:B1:1A (OUI DF-A9-FF)
        Count: 1
        Buffers: 0/3
        #86: len 21 (1 Kb/s)
        Latency: 148 msec (70-170 msec ~154 msec)
> ACL Data RX: Handle 327 flags 0x02 dlen 21                                                                         #88 8.036639
      SMP: Identity Information (0x08) len 16
        Identity resolving key[16]: 42f6df8bff255b33f0dbe4de5b921392
> ACL Data RX: Handle 327 flags 0x02 dlen 12                                                                         #89 8.037188
      SMP: Identity Address Information (0x09) len 7
        Address: DF:A9:FF:F6:B1:1A (OUI DF-A9-FF)
zephyr.exe[1622729]: < HCI Command: Host Number of Completed Packets (0x03|0x0035) plen 5                            #90 8.038338
        Num handles: 1
        Handle: 327 Address: DF:A9:FF:F6:B1:1A (OUI DF-A9-FF)
        Count: 1
zephyr.exe[1622729]: < HCI Command: LE Add Device To Resolving List (0x08|0x0027) plen 39                            #91 8.038479
        Address type: Public (0x00)
        Address: DF:A9:FF:F6:B1:1A (OUI DF-A9-FF)
        Peer identity resolving key[16]: 42f6df8bff255b33f0dbe4de5b921392
        Local identity resolving key[16]: 00000000000000000000000000000000
> HCI Event: Command Complete (0x0e) plen 4                                                                          #92 8.039457
      LE Add Device To Resolving List (0x08|0x0027) ncmd 1
        Status: Success (0x00)
zephyr.exe[1622729]: < HCI Command: LE Set Privacy Mode (0x08|0x004e) plen 8                                         #93 8.058315
        Peer Identity address type: Public (0x00)
        Peer Identity address: DF:A9:FF:F6:B1:1A (OUI DF-A9-FF)
        Privacy Mode: Use Device Privacy (0x01)
> HCI Event: Command Complete (0x0e) plen 4                                                                          #94 8.059341
      LE Set Privacy Mode (0x08|0x004e) ncmd 1
        Status: Success (0x00)
zephyr.exe[1622729]: < HCI Command: LE Set Address Resolution Enable (0x08|0x002d) plen 1                            #95 8.078338
        Address resolution: Enabled (0x01)
> HCI Event: Command Complete (0x0e) plen 4                                                                          #96 8.078896
      LE Set Address Resolution Enable (0x08|0x002d) ncmd 1
        Status: Success (0x00)
zephyr.exe[1622729]: < HCI Command: Host Number of Completed Packets (0x03|0x0035) plen 5                            #97 8.098250
        Num handles: 1
        Handle: 327 Address: DF:A9:FF:F6:B1:1A (OUI DF-A9-FF)
        Count: 1
> ACL Data RX: Handle 327 flags 0x02 dlen 13                                                                         #98 8.299199
      ATT: Find By Type Value Request (0x06) len 8
        Handle range: 0x0001-0xffff
        Attribute type: Primary Service (0x2800)
          UUID: Generic Media Control (0x1849)
zephyr.exe[1622729]: < HCI Command: Host Number of Completed Packets (0x03|0x0035) plen 5                            #99 8.318339
        Num handles: 1
        Handle: 327 Address: DF:A9:FF:F6:B1:1A (OUI DF-A9-FF)
        Count: 1
zephyr.exe[1622729]: < ACL Data TX: Handle 327 [1/3] flags 0x00 dlen 9                                              #100 8.318405
      ATT: Find By Type Value Response (0x07) len 4
        Handle range: 0x0037-0x0075
> HCI Event: Number of Completed Packets (0x13) plen 5                                                              #101 8.474661
        Num handles: 1
        Handle: 327 Address: DF:A9:FF:F6:B1:1A (OUI DF-A9-FF)
        Count: 1
        Buffers: 0/3
        #100: len 9 (0 Kb/s)
        Latency: 156 msec (70-170 msec ~155 msec)
> ACL Data RX: Handle 327 flags 0x02 dlen 13                                                                        #102 8.474664
      ATT: Find By Type Value Request (0x06) len 8
        Handle range: 0x0076-0xffff
        Attribute type: Primary Service (0x2800)
          UUID: Generic Media Control (0x1849)
zephyr.exe[1622729]: < HCI Command: Host Number of Completed Packets (0x03|0x0035) plen 5                           #103 8.478341
        Num handles: 1
        Handle: 327 Address: DF:A9:FF:F6:B1:1A (OUI DF-A9-FF)
        Count: 1
zephyr.exe[1622729]: < ACL Data TX: Handle 327 [1/3] flags 0x00 dlen 9                                              #104 8.478368
      ATT: Error Response (0x01) len 4
        Find By Type Value Request (0x06)
        Handle: 0x0076
        Error: Attribute Not Found (0x0a)
> HCI Event: Number of Completed Packets (0x13) plen 5                                                              #105 8.648942
        Num handles: 1
        Handle: 327 Address: DF:A9:FF:F6:B1:1A (OUI DF-A9-FF)
        Count: 1
        Buffers: 0/3
        #104: len 9 (0 Kb/s)
        Latency: 170 msec (70-170 msec ~163 msec)
> ACL Data RX: Handle 327 flags 0x02 dlen 11                                                                        #106 8.649007
      ATT: Read By Type Request (0x08) len 6
        Handle range: 0x0037-0x0075
        Attribute type: Characteristic (0x2803)
zephyr.exe[1622729]: < HCI Command: Host Number of Completed Packets (0x03|0x0035) plen 5                           #107 8.658326
        Num handles: 1
        Handle: 327 Address: DF:A9:FF:F6:B1:1A (OUI DF-A9-FF)
        Count: 1
zephyr.exe[1622729]: < ACL Data TX: Handle 327 [1/3] flags 0x00 dlen 20                                             #108 8.658349
      ATT: Read By Type Response (0x09) len 15
        Attribute data length: 7
        Attribute data list: 2 entries
        Handle: 0x0039
        Value[5]: 123a00932b
            Properties: 0x12
              Read (0x02)
              Notify (0x10)
            Value Handle: 0x003a
            Value UUID: Media Player Name (0x2b93)
        Handle: 0x003c
        Value[5]: 023d00942b
            Properties: 0x02
              Read (0x02)
            Value Handle: 0x003d
            Value UUID: Media Player Icon Object ID (0x2b94)
> HCI Event: Number of Completed Packets (0x13) plen 5                                                              #109 8.823955
        Num handles: 1
        Handle: 327 Address: DF:A9:FF:F6:B1:1A (OUI DF-A9-FF)
        Count: 1
        Buffers: 0/3
        #108: len 20 (0 Kb/s)
        Latency: 165 msec (70-170 msec ~164 msec)
> ACL Data RX: Handle 327 flags 0x02 dlen 11                                                                        #110 8.824182
      ATT: Read By Type Request (0x08) len 6
        Handle range: 0x003d-0x0075
        Attribute type: Characteristic (0x2803)
zephyr.exe[1622729]: < HCI Command: Host Number of Completed Packets (0x03|0x0035) plen 5                           #111 8.838333
        Num handles: 1
        Handle: 327 Address: DF:A9:FF:F6:B1:1A (OUI DF-A9-FF)
        Count: 1
zephyr.exe[1622729]: < ACL Data TX: Handle 327 [1/3] flags 0x00 dlen 20                                             #112 8.838339
      ATT: Read By Type Response (0x09) len 15
        Attribute data length: 7
        Attribute data list: 2 entries
        Handle: 0x003e
        Value[5]: 023f00952b
            Properties: 0x02
              Read (0x02)
            Value Handle: 0x003f
            Value UUID: Media Player Icon URL (0x2b95)
        Handle: 0x0040
        Value[5]: 104100962b
            Properties: 0x10
              Notify (0x10)
            Value Handle: 0x0041
            Value UUID: Track Changed (0x2b96)
> HCI Event: Number of Completed Packets (0x13) plen 5                                                              #113 8.998764
        Num handles: 1
        Handle: 327 Address: DF:A9:FF:F6:B1:1A (OUI DF-A9-FF)
        Count: 1
        Buffers: 0/3
        #112: len 20 (1 Kb/s)
        Latency: 160 msec (70-170 msec ~162 msec)
> ACL Data RX: Handle 327 flags 0x02 dlen 11                                                                        #114 8.998963
      ATT: Read By Type Request (0x08) len 6
        Handle range: 0x0041-0x0075
        Attribute type: Characteristic (0x2803)
zephyr.exe[1622729]: < HCI Command: Host Number of Completed Packets (0x03|0x0035) plen 5                           #115 9.018313
        Num handles: 1
        Handle: 327 Address: DF:A9:FF:F6:B1:1A (OUI DF-A9-FF)
        Count: 1
zephyr.exe[1622729]: < ACL Data TX: Handle 327 [1/3] flags 0x00 dlen 20                                             #116 9.018341
      ATT: Read By Type Response (0x09) len 15
        Attribute data length: 7
        Attribute data list: 2 entries
        Handle: 0x0043
        Value[5]: 124400972b
            Properties: 0x12
              Read (0x02)
              Notify (0x10)
            Value Handle: 0x0044
            Value UUID: Track Title (0x2b97)
        Handle: 0x0046
        Value[5]: 124700982b
            Properties: 0x12
              Read (0x02)
              Notify (0x10)
            Value Handle: 0x0047
            Value UUID: Track Duration (0x2b98)
> HCI Event: Number of Completed Packets (0x13) plen 5                                                              #117 9.174015
        Num handles: 1
        Handle: 327 Address: DF:A9:FF:F6:B1:1A (OUI DF-A9-FF)
        Count: 1
        Buffers: 0/3
        #116: len 20 (1 Kb/s)
        Latency: 155 msec (70-170 msec ~159 msec)
> ACL Data RX: Handle 327 flags 0x02 dlen 11                                                                        #118 9.174152
      ATT: Read By Type Request (0x08) len 6
        Handle range: 0x0047-0x0075
        Attribute type: Characteristic (0x2803)
zephyr.exe[1622729]: < HCI Command: Host Number of Completed Packets (0x03|0x0035) plen 5                           #119 9.178323
        Num handles: 1
        Handle: 327 Address: DF:A9:FF:F6:B1:1A (OUI DF-A9-FF)
        Count: 1
zephyr.exe[1622729]: < ACL Data TX: Handle 327 [1/3] flags 0x00 dlen 20                                             #120 9.178389
      ATT: Read By Type Response (0x09) len 15
        Attribute data length: 7
        Attribute data list: 2 entries
        Handle: 0x0049
        Value[5]: 1e4a00992b
            Properties: 0x1e
              Read (0x02)
              Write Without Response (0x04)
              Write (0x08)
              Notify (0x10)
            Value Handle: 0x004a
            Value UUID: Track Position (0x2b99)
        Handle: 0x004c
        Value[5]: 1e4d009a2b
            Properties: 0x1e
              Read (0x02)
              Write Without Response (0x04)
              Write (0x08)
              Notify (0x10)
            Value Handle: 0x004d
            Value UUID: Playback Speed (0x2b9a)
> HCI Event: Number of Completed Packets (0x13) plen 5                                                              #121 9.348992
        Num handles: 1
        Handle: 327 Address: DF:A9:FF:F6:B1:1A (OUI DF-A9-FF)
        Count: 1
        Buffers: 0/3
        #120: len 20 (0 Kb/s)
        Latency: 170 msec (70-170 msec ~164 msec)
> ACL Data RX: Handle 327 flags 0x02 dlen 11                                                                        #122 9.349162
      ATT: Read By Type Request (0x08) len 6
        Handle range: 0x004d-0x0075
        Attribute type: Characteristic (0x2803)
zephyr.exe[1622729]: < HCI Command: Host Number of Completed Packets (0x03|0x0035) plen 5                           #123 9.358322
        Num handles: 1
        Handle: 327 Address: DF:A9:FF:F6:B1:1A (OUI DF-A9-FF)
        Count: 1
zephyr.exe[1622729]: < ACL Data TX: Handle 327 [1/3] flags 0x00 dlen 20                                             #124 9.358349
      ATT: Read By Type Response (0x09) len 15
        Attribute data length: 7
        Attribute data list: 2 entries
        Handle: 0x004f
        Value[5]: 1250009b2b
            Properties: 0x12
              Read (0x02)
              Notify (0x10)
            Value Handle: 0x0050
            Value UUID: Seeking Speed (0x2b9b)
        Handle: 0x0052
        Value[5]: 0253009c2b
            Properties: 0x02
              Read (0x02)
            Value Handle: 0x0053
            Value UUID: Current Track Segments Object ID (0x2b9c)
> HCI Event: Number of Completed Packets (0x13) plen 5                                                              #125 9.523992
        Num handles: 1
        Handle: 327 Address: DF:A9:FF:F6:B1:1A (OUI DF-A9-FF)
        Count: 1
        Buffers: 0/3
        #124: len 20 (0 Kb/s)
        Latency: 165 msec (70-170 msec ~165 msec)
> ACL Data RX: Handle 327 flags 0x02 dlen 11                                                                        #126 9.524613
      ATT: Read By Type Request (0x08) len 6
        Handle range: 0x0053-0x0075
        Attribute type: Characteristic (0x2803)
zephyr.exe[1622729]: < HCI Command: Host Number of Completed Packets (0x03|0x0035) plen 5                           #127 9.538404
        Num handles: 1
        Handle: 327 Address: DF:A9:FF:F6:B1:1A (OUI DF-A9-FF)
        Count: 1
zephyr.exe[1622729]: < ACL Data TX: Handle 327 [1/3] flags 0x00 dlen 20                                             #128 9.538432
      ATT: Read By Type Response (0x09) len 15
        Attribute data length: 7
        Attribute data list: 2 entries
        Handle: 0x0054
        Value[5]: 1e55009d2b
            Properties: 0x1e
              Read (0x02)
              Write Without Response (0x04)
              Write (0x08)
              Notify (0x10)
            Value Handle: 0x0055
            Value UUID: Current Track Object ID (0x2b9d)
        Handle: 0x0057
        Value[5]: 1e58009e2b
            Properties: 0x1e
              Read (0x02)
              Write Without Response (0x04)
              Write (0x08)
              Notify (0x10)
            Value Handle: 0x0058
            Value UUID: Next Track Object ID (0x2b9e)
> HCI Event: Number of Completed Packets (0x13) plen 5                                                              #129 9.698668
        Num handles: 1
        Handle: 327 Address: DF:A9:FF:F6:B1:1A (OUI DF-A9-FF)
        Count: 1
        Buffers: 0/3
        #128: len 20 (1 Kb/s)
        Latency: 160 msec (70-170 msec ~162 msec)
> ACL Data RX: Handle 327 flags 0x02 dlen 11                                                                        #130 9.698985
      ATT: Read By Type Request (0x08) len 6
        Handle range: 0x0058-0x0075
        Attribute type: Characteristic (0x2803)
zephyr.exe[1622729]: < HCI Command: Host Number of Completed Packets (0x03|0x0035) plen 5                           #131 9.718315
        Num handles: 1
        Handle: 327 Address: DF:A9:FF:F6:B1:1A (OUI DF-A9-FF)
        Count: 1
zephyr.exe[1622729]: < ACL Data TX: Handle 327 [1/3] flags 0x00 dlen 20                                             #132 9.718339
      ATT: Read By Type Response (0x09) len 15
        Attribute data length: 7
        Attribute data list: 2 entries
        Handle: 0x005a
        Value[5]: 125b009f2b
            Properties: 0x12
              Read (0x02)
              Notify (0x10)
            Value Handle: 0x005b
            Value UUID: Parent Group Object ID (0x2b9f)
        Handle: 0x005d
        Value[5]: 1e5e00a02b
            Properties: 0x1e
              Read (0x02)
              Write Without Response (0x04)
              Write (0x08)
              Notify (0x10)
            Value Handle: 0x005e
            Value UUID: Current Group Object ID (0x2ba0)
> HCI Event: Number of Completed Packets (0x13) plen 5                                                              #133 9.873903
        Num handles: 1
        Handle: 327 Address: DF:A9:FF:F6:B1:1A (OUI DF-A9-FF)
        Count: 1
        Buffers: 0/3
        #132: len 20 (1 Kb/s)
        Latency: 155 msec (70-170 msec ~159 msec)
> ACL Data RX: Handle 327 flags 0x02 dlen 11                                                                        #134 9.873906
      ATT: Read By Type Request (0x08) len 6
        Handle range: 0x005e-0x0075
        Attribute type: Characteristic (0x2803)
zephyr.exe[1622729]: < HCI Command: Host Number of Completed Packets (0x03|0x0035) plen 5                           #135 9.878392
        Num handles: 1
        Handle: 327 Address: DF:A9:FF:F6:B1:1A (OUI DF-A9-FF)
        Count: 1
zephyr.exe[1622729]: < ACL Data TX: Handle 327 [1/3] flags 0x00 dlen 20                                             #136 9.878458
      ATT: Read By Type Response (0x09) len 15
        Attribute data length: 7
        Attribute data list: 2 entries
        Handle: 0x0060
        Value[5]: 1e6100a12b
            Properties: 0x1e
              Read (0x02)
              Write Without Response (0x04)
              Write (0x08)
              Notify (0x10)
            Value Handle: 0x0061
            Value UUID: Playing Order (0x2ba1)
        Handle: 0x0063
        Value[5]: 026400a22b
            Properties: 0x02
              Read (0x02)
            Value Handle: 0x0064
            Value UUID: Playing Orders Supported (0x2ba2)
> HCI Event: Number of Completed Packets (0x13) plen 5                                                             #137 10.048925
        Num handles: 1
        Handle: 327 Address: DF:A9:FF:F6:B1:1A (OUI DF-A9-FF)
        Count: 1
        Buffers: 0/3
        #136: len 20 (0 Kb/s)
        Latency: 170 msec (70-170 msec ~164 msec)
> ACL Data RX: Handle 327 flags 0x02 dlen 11                                                                       #138 10.048995
      ATT: Read By Type Request (0x08) len 6
        Handle range: 0x0064-0x0075
        Attribute type: Characteristic (0x2803)
zephyr.exe[1622729]: < HCI Command: Host Number of Completed Packets (0x03|0x0035) plen 5                          #139 10.058324
        Num handles: 1
        Handle: 327 Address: DF:A9:FF:F6:B1:1A (OUI DF-A9-FF)
        Count: 1
zephyr.exe[1622729]: < ACL Data TX: Handle 327 [1/3] flags 0x00 dlen 20                                            #140 10.058351
      ATT: Read By Type Response (0x09) len 15
        Attribute data length: 7
        Attribute data list: 2 entries
        Handle: 0x0065
        Value[5]: 126600a32b
            Properties: 0x12
              Read (0x02)
              Notify (0x10)
            Value Handle: 0x0066
            Value UUID: Media State (0x2ba3)
        Handle: 0x0068
        Value[5]: 1c6900a42b
            Properties: 0x1c
              Write Without Response (0x04)
              Write (0x08)
              Notify (0x10)
            Value Handle: 0x0069
            Value UUID: Media Control Point (0x2ba4)
> HCI Event: Number of Completed Packets (0x13) plen 5                                                             #141 10.223947
        Num handles: 1
        Handle: 327 Address: DF:A9:FF:F6:B1:1A (OUI DF-A9-FF)
        Count: 1
        Buffers: 0/3
        #140: len 20 (0 Kb/s)
        Latency: 165 msec (70-170 msec ~165 msec)
> ACL Data RX: Handle 327 flags 0x02 dlen 11                                                                       #142 10.224008
      ATT: Read By Type Request (0x08) len 6
        Handle range: 0x0069-0x0075
        Attribute type: Characteristic (0x2803)
zephyr.exe[1622729]: < HCI Command: Host Number of Completed Packets (0x03|0x0035) plen 5                          #143 10.238408
        Num handles: 1
        Handle: 327 Address: DF:A9:FF:F6:B1:1A (OUI DF-A9-FF)
        Count: 1
zephyr.exe[1622729]: < ACL Data TX: Handle 327 [1/3] flags 0x00 dlen 20                                            #144 10.238430
      ATT: Read By Type Response (0x09) len 15
        Attribute data length: 7
        Attribute data list: 2 entries
        Handle: 0x006b
        Value[5]: 126c00a52b
            Properties: 0x12
              Read (0x02)
              Notify (0x10)
            Value Handle: 0x006c
            Value UUID: Media Control Point Opcodes Supported (0x2ba5)
        Handle: 0x006e
        Value[5]: 1c6f00a72b
            Properties: 0x1c
              Write Without Response (0x04)
              Write (0x08)
              Notify (0x10)
            Value Handle: 0x006f
            Value UUID: Search Control Point (0x2ba7)
> HCI Event: Number of Completed Packets (0x13) plen 5                                                             #145 10.398683
        Num handles: 1
        Handle: 327 Address: DF:A9:FF:F6:B1:1A (OUI DF-A9-FF)
        Count: 1
        Buffers: 0/3
        #144: len 20 (1 Kb/s)
        Latency: 160 msec (70-170 msec ~162 msec)
> ACL Data RX: Handle 327 flags 0x02 dlen 11                                                                       #146 10.399158
      ATT: Read By Type Request (0x08) len 6
        Handle range: 0x006f-0x0075
        Attribute type: Characteristic (0x2803)
zephyr.exe[1622729]: < HCI Command: Host Number of Completed Packets (0x03|0x0035) plen 5                          #147 10.418410
        Num handles: 1
        Handle: 327 Address: DF:A9:FF:F6:B1:1A (OUI DF-A9-FF)
        Count: 1
zephyr.exe[1622729]: < ACL Data TX: Handle 327 [1/3] flags 0x00 dlen 20                                            #148 10.418474
      ATT: Read By Type Response (0x09) len 15
        Attribute data length: 7
        Attribute data list: 2 entries
        Handle: 0x0071
        Value[5]: 127200a62b
            Properties: 0x12
              Read (0x02)
              Notify (0x10)
            Value Handle: 0x0072
            Value UUID: Search Results Object ID (0x2ba6)
        Handle: 0x0074
        Value[5]: 027500ba2b
            Properties: 0x02
              Read (0x02)
            Value Handle: 0x0075
            Value UUID: Content Control ID (0x2bba)
> HCI Event: Number of Completed Packets (0x13) plen 5                                                             #149 10.574009
        Num handles: 1
        Handle: 327 Address: DF:A9:FF:F6:B1:1A (OUI DF-A9-FF)
        Count: 1
        Buffers: 0/3
        #148: len 20 (1 Kb/s)
        Latency: 155 msec (70-170 msec ~159 msec)
> ACL Data RX: Handle 327 flags 0x02 dlen 11                                                                       #150 10.574011
      ATT: Read By Type Request (0x08) len 6
        Handle range: 0x0075-0x0075
        Attribute type: Characteristic (0x2803)
zephyr.exe[1622729]: < HCI Command: Host Number of Completed Packets (0x03|0x0035) plen 5                          #151 10.578323
        Num handles: 1
        Handle: 327 Address: DF:A9:FF:F6:B1:1A (OUI DF-A9-FF)
        Count: 1
zephyr.exe[1622729]: < ACL Data TX: Handle 327 [1/3] flags 0x00 dlen 9                                             #152 10.578349
      ATT: Error Response (0x01) len 4
        Read By Type Request (0x08)
        Handle: 0x0075
        Error: Attribute Not Found (0x0a)
> HCI Event: Number of Completed Packets (0x13) plen 5                                                             #153 10.748839
        Num handles: 1
        Handle: 327 Address: DF:A9:FF:F6:B1:1A (OUI DF-A9-FF)
        Count: 1
        Buffers: 0/3
        #152: len 9 (0 Kb/s)
        Latency: 170 msec (70-170 msec ~164 msec)
> ACL Data RX: Handle 327 flags 0x02 dlen 9                                                                        #154 10.748841
      ATT: Find Information Request (0x04) len 4
        Handle range: 0x003b-0x003b
zephyr.exe[1622729]: < HCI Command: Host Number of Completed Packets (0x03|0x0035) plen 5                          #155 10.758370
        Num handles: 1
        Handle: 327 Address: DF:A9:FF:F6:B1:1A (OUI DF-A9-FF)
        Count: 1
zephyr.exe[1622729]: < ACL Data TX: Handle 327 [1/3] flags 0x00 dlen 10                                            #156 10.758398
      ATT: Find Information Response (0x05) len 5
        Format: UUID-16 (0x01)
        Handle: 0x003b
        UUID: Client Characteristic Configuration (0x2902)
> HCI Event: Number of Completed Packets (0x13) plen 5                                                             #157 10.923924
        Num handles: 1
        Handle: 327 Address: DF:A9:FF:F6:B1:1A (OUI DF-A9-FF)
        Count: 1
        Buffers: 0/3
        #156: len 10 (0 Kb/s)
        Latency: 165 msec (70-170 msec ~165 msec)
> ACL Data RX: Handle 327 flags 0x02 dlen 9                                                                        #158 10.924072
      ATT: Find Information Request (0x04) len 4
        Handle range: 0x0042-0x0042
zephyr.exe[1622729]: < HCI Command: Host Number of Completed Packets (0x03|0x0035) plen 5                          #159 10.938359
        Num handles: 1
        Handle: 327 Address: DF:A9:FF:F6:B1:1A (OUI DF-A9-FF)
        Count: 1
zephyr.exe[1622729]: < ACL Data TX: Handle 327 [1/3] flags 0x00 dlen 10                                            #160 10.938385
      ATT: Find Information Response (0x05) len 5
        Format: UUID-16 (0x01)
        Handle: 0x0042
        UUID: Client Characteristic Configuration (0x2902)
> HCI Event: Number of Completed Packets (0x13) plen 5                                                             #161 11.098844
        Num handles: 1
        Handle: 327 Address: DF:A9:FF:F6:B1:1A (OUI DF-A9-FF)
        Count: 1
        Buffers: 0/3
        #160: len 10 (0 Kb/s)
        Latency: 160 msec (70-170 msec ~162 msec)
> ACL Data RX: Handle 327 flags 0x02 dlen 9                                                                        #162 11.098967
      ATT: Find Information Request (0x04) len 4
        Handle range: 0x0045-0x0045
zephyr.exe[1622729]: < HCI Command: Host Number of Completed Packets (0x03|0x0035) plen 5                          #163 11.118309
        Num handles: 1
        Handle: 327 Address: DF:A9:FF:F6:B1:1A (OUI DF-A9-FF)
        Count: 1
zephyr.exe[1622729]: < ACL Data TX: Handle 327 [1/3] flags 0x00 dlen 10                                            #164 11.118332
      ATT: Find Information Response (0x05) len 5
        Format: UUID-16 (0x01)
        Handle: 0x0045
        UUID: Client Characteristic Configuration (0x2902)
> HCI Event: Number of Completed Packets (0x13) plen 5                                                             #165 11.273892
        Num handles: 1
        Handle: 327 Address: DF:A9:FF:F6:B1:1A (OUI DF-A9-FF)
        Count: 1
        Buffers: 0/3
        #164: len 10 (0 Kb/s)
        Latency: 155 msec (70-170 msec ~159 msec)
> ACL Data RX: Handle 327 flags 0x02 dlen 9                                                                        #166 11.273976
      ATT: Find Information Request (0x04) len 4
        Handle range: 0x0048-0x0048
zephyr.exe[1622729]: < HCI Command: Host Number of Completed Packets (0x03|0x0035) plen 5                          #167 11.278395
        Num handles: 1
        Handle: 327 Address: DF:A9:FF:F6:B1:1A (OUI DF-A9-FF)
        Count: 1
zephyr.exe[1622729]: < ACL Data TX: Handle 327 [1/3] flags 0x00 dlen 10                                            #168 11.278423
      ATT: Find Information Response (0x05) len 5
        Format: UUID-16 (0x01)
        Handle: 0x0048
        UUID: Client Characteristic Configuration (0x2902)
> HCI Event: Number of Completed Packets (0x13) plen 5                                                             #169 11.449198
        Num handles: 1
        Handle: 327 Address: DF:A9:FF:F6:B1:1A (OUI DF-A9-FF)
        Count: 1
        Buffers: 0/3
        #168: len 10 (0 Kb/s)
        Latency: 170 msec (70-170 msec ~164 msec)
> ACL Data RX: Handle 327 flags 0x02 dlen 9                                                                        #170 11.449201
      ATT: Find Information Request (0x04) len 4
        Handle range: 0x004b-0x004b
zephyr.exe[1622729]: < HCI Command: Host Number of Completed Packets (0x03|0x0035) plen 5                          #171 11.458398
        Num handles: 1
        Handle: 327 Address: DF:A9:FF:F6:B1:1A (OUI DF-A9-FF)
        Count: 1
zephyr.exe[1622729]: < ACL Data TX: Handle 327 [1/3] flags 0x00 dlen 10                                            #172 11.458424
      ATT: Find Information Response (0x05) len 5
        Format: UUID-16 (0x01)
        Handle: 0x004b
        UUID: Client Characteristic Configuration (0x2902)
> HCI Event: Number of Completed Packets (0x13) plen 5                                                             #173 11.624051
        Num handles: 1
        Handle: 327 Address: DF:A9:FF:F6:B1:1A (OUI DF-A9-FF)
        Count: 1
        Buffers: 0/3
        #172: len 10 (0 Kb/s)
        Latency: 165 msec (70-170 msec ~165 msec)
> ACL Data RX: Handle 327 flags 0x02 dlen 9                                                                        #174 11.624054
      ATT: Find Information Request (0x04) len 4
        Handle range: 0x004e-0x004e
zephyr.exe[1622729]: < HCI Command: Host Number of Completed Packets (0x03|0x0035) plen 5                          #175 11.638315
        Num handles: 1
        Handle: 327 Address: DF:A9:FF:F6:B1:1A (OUI DF-A9-FF)
        Count: 1
zephyr.exe[1622729]: < ACL Data TX: Handle 327 [1/3] flags 0x00 dlen 10                                            #176 11.638338
      ATT: Find Information Response (0x05) len 5
        Format: UUID-16 (0x01)
        Handle: 0x004e
        UUID: Client Characteristic Configuration (0x2902)
> HCI Event: Number of Completed Packets (0x13) plen 5                                                             #177 11.798709
        Num handles: 1
        Handle: 327 Address: DF:A9:FF:F6:B1:1A (OUI DF-A9-FF)
        Count: 1
        Buffers: 0/3
        #176: len 10 (0 Kb/s)
        Latency: 160 msec (70-170 msec ~162 msec)
> ACL Data RX: Handle 327 flags 0x02 dlen 9                                                                        #178 11.798837
      ATT: Find Information Request (0x04) len 4
        Handle range: 0x0051-0x0051
zephyr.exe[1622729]: < HCI Command: Host Number of Completed Packets (0x03|0x0035) plen 5                          #179 11.818309
        Num handles: 1
        Handle: 327 Address: DF:A9:FF:F6:B1:1A (OUI DF-A9-FF)
        Count: 1
zephyr.exe[1622729]: < ACL Data TX: Handle 327 [1/3] flags 0x00 dlen 10                                            #180 11.818377
      ATT: Find Information Response (0x05) len 5
        Format: UUID-16 (0x01)
        Handle: 0x0051
        UUID: Client Characteristic Configuration (0x2902)
> HCI Event: Number of Completed Packets (0x13) plen 5                                                             #181 11.973858
        Num handles: 1
        Handle: 327 Address: DF:A9:FF:F6:B1:1A (OUI DF-A9-FF)
        Count: 1
        Buffers: 0/3
        #180: len 10 (0 Kb/s)
        Latency: 155 msec (70-170 msec ~159 msec)
> ACL Data RX: Handle 327 flags 0x02 dlen 9                                                                        #182 11.973993
      ATT: Find Information Request (0x04) len 4
        Handle range: 0x0056-0x0056
zephyr.exe[1622729]: < HCI Command: Host Number of Completed Packets (0x03|0x0035) plen 5                          #183 11.978342
        Num handles: 1
        Handle: 327 Address: DF:A9:FF:F6:B1:1A (OUI DF-A9-FF)
        Count: 1
zephyr.exe[1622729]: < ACL Data TX: Handle 327 [1/3] flags 0x00 dlen 10                                            #184 11.978418
      ATT: Find Information Response (0x05) len 5
        Format: UUID-16 (0x01)
        Handle: 0x0056
        UUID: Client Characteristic Configuration (0x2902)
> HCI Event: Number of Completed Packets (0x13) plen 5                                                             #185 12.148885
        Num handles: 1
        Handle: 327 Address: DF:A9:FF:F6:B1:1A (OUI DF-A9-FF)
        Count: 1
        Buffers: 0/3
        #184: len 10 (0 Kb/s)
        Latency: 170 msec (70-170 msec ~164 msec)
> ACL Data RX: Handle 327 flags 0x02 dlen 9                                                                        #186 12.148888
      ATT: Find Information Request (0x04) len 4
        Handle range: 0x0059-0x0059
zephyr.exe[1622729]: < HCI Command: Host Number of Completed Packets (0x03|0x0035) plen 5                          #187 12.158359
        Num handles: 1
        Handle: 327 Address: DF:A9:FF:F6:B1:1A (OUI DF-A9-FF)
        Count: 1
zephyr.exe[1622729]: < ACL Data TX: Handle 327 [1/3] flags 0x00 dlen 10                                            #188 12.158384
      ATT: Find Information Response (0x05) len 5
        Format: UUID-16 (0x01)
        Handle: 0x0059
        UUID: Client Characteristic Configuration (0x2902)
> HCI Event: Number of Completed Packets (0x13) plen 5                                                             #189 12.323813
        Num handles: 1
        Handle: 327 Address: DF:A9:FF:F6:B1:1A (OUI DF-A9-FF)
        Count: 1
        Buffers: 0/3
        #188: len 10 (0 Kb/s)
        Latency: 165 msec (70-170 msec ~165 msec)
> ACL Data RX: Handle 327 flags 0x02 dlen 9                                                                        #190 12.323816
      ATT: Find Information Request (0x04) len 4
        Handle range: 0x005c-0x005c
zephyr.exe[1622729]: < HCI Command: Host Number of Completed Packets (0x03|0x0035) plen 5                          #191 12.338356
        Num handles: 1
        Handle: 327 Address: DF:A9:FF:F6:B1:1A (OUI DF-A9-FF)
        Count: 1
zephyr.exe[1622729]: < ACL Data TX: Handle 327 [1/3] flags 0x00 dlen 10                                            #192 12.338422
      ATT: Find Information Response (0x05) len 5
        Format: UUID-16 (0x01)
        Handle: 0x005c
        UUID: Client Characteristic Configuration (0x2902)
> HCI Event: Number of Completed Packets (0x13) plen 5                                                             #193 12.498865
        Num handles: 1
        Handle: 327 Address: DF:A9:FF:F6:B1:1A (OUI DF-A9-FF)
        Count: 1
        Buffers: 0/3
        #192: len 10 (0 Kb/s)
        Latency: 160 msec (70-170 msec ~162 msec)
> ACL Data RX: Handle 327 flags 0x02 dlen 9                                                                        #194 12.498869
      ATT: Find Information Request (0x04) len 4
        Handle range: 0x005f-0x005f
zephyr.exe[1622729]: < HCI Command: Host Number of Completed Packets (0x03|0x0035) plen 5                          #195 12.518263
        Num handles: 1
        Handle: 327 Address: DF:A9:FF:F6:B1:1A (OUI DF-A9-FF)
        Count: 1
zephyr.exe[1622729]: < ACL Data TX: Handle 327 [1/3] flags 0x00 dlen 10                                            #196 12.518268
      ATT: Find Information Response (0x05) len 5
        Format: UUID-16 (0x01)
        Handle: 0x005f
        UUID: Client Characteristic Configuration (0x2902)
> HCI Event: Number of Completed Packets (0x13) plen 5                                                             #197 12.673692
        Num handles: 1
        Handle: 327 Address: DF:A9:FF:F6:B1:1A (OUI DF-A9-FF)
        Count: 1
        Buffers: 0/3
        #196: len 10 (0 Kb/s)
        Latency: 155 msec (70-170 msec ~159 msec)
> ACL Data RX: Handle 327 flags 0x02 dlen 9                                                                        #198 12.673843
      ATT: Find Information Request (0x04) len 4
        Handle range: 0x0062-0x0062
zephyr.exe[1622729]: < HCI Command: Host Number of Completed Packets (0x03|0x0035) plen 5                          #199 12.678364
        Num handles: 1
        Handle: 327 Address: DF:A9:FF:F6:B1:1A (OUI DF-A9-FF)
        Count: 1
zephyr.exe[1622729]: < ACL Data TX: Handle 327 [1/3] flags 0x00 dlen 10                                            #200 12.678425
      ATT: Find Information Response (0x05) len 5
        Format: UUID-16 (0x01)
        Handle: 0x0062
        UUID: Client Characteristic Configuration (0x2902)
> HCI Event: Number of Completed Packets (0x13) plen 5                                                             #201 12.849041
        Num handles: 1
        Handle: 327 Address: DF:A9:FF:F6:B1:1A (OUI DF-A9-FF)
        Count: 1
        Buffers: 0/3
        #200: len 10 (0 Kb/s)
        Latency: 170 msec (70-170 msec ~164 msec)
> ACL Data RX: Handle 327 flags 0x02 dlen 9                                                                        #202 12.849044
      ATT: Find Information Request (0x04) len 4
        Handle range: 0x0067-0x0067
zephyr.exe[1622729]: < HCI Command: Host Number of Completed Packets (0x03|0x0035) plen 5                          #203 12.858359
        Num handles: 1
        Handle: 327 Address: DF:A9:FF:F6:B1:1A (OUI DF-A9-FF)
        Count: 1
zephyr.exe[1622729]: < ACL Data TX: Handle 327 [1/3] flags 0x00 dlen 10                                            #204 12.858386
      ATT: Find Information Response (0x05) len 5
        Format: UUID-16 (0x01)
        Handle: 0x0067
        UUID: Client Characteristic Configuration (0x2902)
> HCI Event: Number of Completed Packets (0x13) plen 5                                                             #205 13.023900
        Num handles: 1
        Handle: 327 Address: DF:A9:FF:F6:B1:1A (OUI DF-A9-FF)
        Count: 1
        Buffers: 0/3
        #204: len 10 (0 Kb/s)
        Latency: 165 msec (70-170 msec ~165 msec)
> ACL Data RX: Handle 327 flags 0x02 dlen 9                                                                        #206 13.024018
      ATT: Find Information Request (0x04) len 4
        Handle range: 0x006a-0x006a
zephyr.exe[1622729]: < HCI Command: Host Number of Completed Packets (0x03|0x0035) plen 5                          #207 13.038277
        Num handles: 1
        Handle: 327 Address: DF:A9:FF:F6:B1:1A (OUI DF-A9-FF)
        Count: 1
zephyr.exe[1622729]: < ACL Data TX: Handle 327 [1/3] flags 0x00 dlen 10                                            #208 13.038282
      ATT: Find Information Response (0x05) len 5
        Format: UUID-16 (0x01)
        Handle: 0x006a
        UUID: Client Characteristic Configuration (0x2902)
> HCI Event: Number of Completed Packets (0x13) plen 5                                                             #209 13.198910
        Num handles: 1
        Handle: 327 Address: DF:A9:FF:F6:B1:1A (OUI DF-A9-FF)
        Count: 1
        Buffers: 0/3
        #208: len 10 (0 Kb/s)
        Latency: 160 msec (70-170 msec ~162 msec)
> ACL Data RX: Handle 327 flags 0x02 dlen 9                                                                        #210 13.198912
      ATT: Find Information Request (0x04) len 4
        Handle range: 0x006d-0x006d
zephyr.exe[1622729]: < HCI Command: Host Number of Completed Packets (0x03|0x0035) plen 5                          #211 13.218494
        Num handles: 1
        Handle: 327 Address: DF:A9:FF:F6:B1:1A (OUI DF-A9-FF)
        Count: 1
zephyr.exe[1622729]: < ACL Data TX: Handle 327 [1/3] flags 0x00 dlen 10                                            #212 13.218518
      ATT: Find Information Response (0x05) len 5
        Format: UUID-16 (0x01)
        Handle: 0x006d
        UUID: Client Characteristic Configuration (0x2902)
> HCI Event: Number of Completed Packets (0x13) plen 5                                                             #213 13.373752
        Num handles: 1
        Handle: 327 Address: DF:A9:FF:F6:B1:1A (OUI DF-A9-FF)
        Count: 1
        Buffers: 0/3
        #212: len 10 (0 Kb/s)
        Latency: 155 msec (70-170 msec ~159 msec)
> ACL Data RX: Handle 327 flags 0x02 dlen 9                                                                        #214 13.373755
      ATT: Find Information Request (0x04) len 4
        Handle range: 0x0070-0x0070
zephyr.exe[1622729]: < HCI Command: Host Number of Completed Packets (0x03|0x0035) plen 5                          #215 13.378465
        Num handles: 1
        Handle: 327 Address: DF:A9:FF:F6:B1:1A (OUI DF-A9-FF)
        Count: 1
zephyr.exe[1622729]: < ACL Data TX: Handle 327 [1/3] flags 0x00 dlen 10                                            #216 13.378550
      ATT: Find Information Response (0x05) len 5
        Format: UUID-16 (0x01)
        Handle: 0x0070
        UUID: Client Characteristic Configuration (0x2902)
> HCI Event: Number of Completed Packets (0x13) plen 5                                                             #217 13.548768
        Num handles: 1
        Handle: 327 Address: DF:A9:FF:F6:B1:1A (OUI DF-A9-FF)
        Count: 1
        Buffers: 0/3
        #216: len 10 (0 Kb/s)
        Latency: 170 msec (70-170 msec ~164 msec)
> ACL Data RX: Handle 327 flags 0x02 dlen 9                                                                        #218 13.548999
      ATT: Find Information Request (0x04) len 4
        Handle range: 0x0073-0x0073
zephyr.exe[1622729]: < HCI Command: Host Number of Completed Packets (0x03|0x0035) plen 5                          #219 13.558316
        Num handles: 1
        Handle: 327 Address: DF:A9:FF:F6:B1:1A (OUI DF-A9-FF)
        Count: 1
zephyr.exe[1622729]: < ACL Data TX: Handle 327 [1/3] flags 0x00 dlen 10                                            #220 13.558380
      ATT: Find Information Response (0x05) len 5
        Format: UUID-16 (0x01)
        Handle: 0x0073
        UUID: Client Characteristic Configuration (0x2902)
> HCI Event: Number of Completed Packets (0x13) plen 5                                                             #221 13.723754
        Num handles: 1
        Handle: 327 Address: DF:A9:FF:F6:B1:1A (OUI DF-A9-FF)
        Count: 1
        Buffers: 0/3
        #220: len 10 (0 Kb/s)
        Latency: 165 msec (70-170 msec ~165 msec)
> ACL Data RX: Handle 327 flags 0x02 dlen 9                                                                        #222 13.723756
      ATT: Write Request (0x12) len 4
        Handle: 0x0067
          Data[2]: 0000
zephyr.exe[1622729]: < HCI Command: Host Number of Completed Packets (0x03|0x0035) plen 5                          #223 13.738347
        Num handles: 1
        Handle: 327 Address: DF:A9:FF:F6:B1:1A (OUI DF-A9-FF)
        Count: 1
zephyr.exe[1622729]: < ACL Data TX: Handle 327 [1/3] flags 0x00 dlen 5                                             #224 13.738374
      ATT: Write Response (0x13) len 0
> HCI Event: Number of Completed Packets (0x13) plen 5                                                             #225 13.898959
        Num handles: 1
        Handle: 327 Address: DF:A9:FF:F6:B1:1A (OUI DF-A9-FF)
        Count: 1
        Buffers: 0/3
        #224: len 5 (0 Kb/s)
        Latency: 160 msec (70-170 msec ~162 msec)
> ACL Data RX: Handle 327 flags 0x02 dlen 9                                                                        #226 13.899020
      ATT: Write Request (0x12) len 4
        Handle: 0x0067
          Data[2]: 0100
zephyr.exe[1622729]: < HCI Command: Host Number of Completed Packets (0x03|0x0035) plen 5                          #227 13.918377
        Num handles: 1
        Handle: 327 Address: DF:A9:FF:F6:B1:1A (OUI DF-A9-FF)
        Count: 1
zephyr.exe[1622729]: < ACL Data TX: Handle 327 [1/3] flags 0x00 dlen 5                                             #228 13.918442
      ATT: Write Response (0x13) len 0
> HCI Event: Number of Completed Packets (0x13) plen 5                                                             #229 14.073998
        Num handles: 1
        Handle: 327 Address: DF:A9:FF:F6:B1:1A (OUI DF-A9-FF)
        Count: 1
        Buffers: 0/3
        #228: len 5 (0 Kb/s)
        Latency: 155 msec (70-170 msec ~159 msec)
> ACL Data RX: Handle 327 flags 0x02 dlen 9                                                                        #230 14.074001
      ATT: Write Request (0x12) len 4
        Handle: 0x006a
          Data[2]: 0000
zephyr.exe[1622729]: < HCI Command: Host Number of Completed Packets (0x03|0x0035) plen 5                          #231 14.078346
        Num handles: 1
        Handle: 327 Address: DF:A9:FF:F6:B1:1A (OUI DF-A9-FF)
        Count: 1
zephyr.exe[1622729]: < ACL Data TX: Handle 327 [1/3] flags 0x00 dlen 5                                             #232 14.078373
      ATT: Write Response (0x13) len 0
> HCI Event: Number of Completed Packets (0x13) plen 5                                                             #233 14.248895
        Num handles: 1
        Handle: 327 Address: DF:A9:FF:F6:B1:1A (OUI DF-A9-FF)
        Count: 1
        Buffers: 0/3
        #232: len 5 (0 Kb/s)
        Latency: 170 msec (70-170 msec ~164 msec)
> ACL Data RX: Handle 327 flags 0x02 dlen 9                                                                        #234 14.249333
      ATT: Write Request (0x12) len 4
        Handle: 0x006a
          Data[2]: 0100
zephyr.exe[1622729]: < HCI Command: Host Number of Completed Packets (0x03|0x0035) plen 5                          #235 14.258461
        Num handles: 1
        Handle: 327 Address: DF:A9:FF:F6:B1:1A (OUI DF-A9-FF)
        Count: 1
zephyr.exe[1622729]: < ACL Data TX: Handle 327 [1/3] flags 0x00 dlen 5                                             #236 14.258488
      ATT: Write Response (0x13) len 0
> HCI Event: Number of Completed Packets (0x13) plen 5                                                             #237 14.423616
        Num handles: 1
        Handle: 327 Address: DF:A9:FF:F6:B1:1A (OUI DF-A9-FF)
        Count: 1
        Buffers: 0/3
        #236: len 5 (0 Kb/s)
        Latency: 165 msec (70-170 msec ~164 msec)
> ACL Data RX: Handle 327 flags 0x02 dlen 9                                                                        #238 14.423804
      ATT: Write Request (0x12) len 4
        Handle: 0x004b
          Data[2]: 0000
zephyr.exe[1622729]: < HCI Command: Host Number of Completed Packets (0x03|0x0035) plen 5                          #239 14.438340
        Num handles: 1
        Handle: 327 Address: DF:A9:FF:F6:B1:1A (OUI DF-A9-FF)
        Count: 1
zephyr.exe[1622729]: < ACL Data TX: Handle 327 [1/3] flags 0x00 dlen 5                                             #240 14.438368
      ATT: Write Response (0x13) len 0
> HCI Event: Number of Completed Packets (0x13) plen 5                                                             #241 14.599019
        Num handles: 1
        Handle: 327 Address: DF:A9:FF:F6:B1:1A (OUI DF-A9-FF)
        Count: 1
        Buffers: 0/3
        #240: len 5 (0 Kb/s)
        Latency: 160 msec (70-170 msec ~162 msec)
> ACL Data RX: Handle 327 flags 0x02 dlen 9                                                                        #242 14.599021
      ATT: Write Request (0x12) len 4
        Handle: 0x004b
          Data[2]: 0100
zephyr.exe[1622729]: < HCI Command: Host Number of Completed Packets (0x03|0x0035) plen 5                          #243 14.618375
        Num handles: 1
        Handle: 327 Address: DF:A9:FF:F6:B1:1A (OUI DF-A9-FF)
        Count: 1
zephyr.exe[1622729]: < ACL Data TX: Handle 327 [1/3] flags 0x00 dlen 5                                             #244 14.618422
      ATT: Write Response (0x13) len 0
> HCI Event: Number of Completed Packets (0x13) plen 5                                                             #245 14.773734
        Num handles: 1
        Handle: 327 Address: DF:A9:FF:F6:B1:1A (OUI DF-A9-FF)
        Count: 1
        Buffers: 0/3
        #244: len 5 (0 Kb/s)
        Latency: 155 msec (70-170 msec ~159 msec)
> ACL Data RX: Handle 327 flags 0x02 dlen 11                                                                       #246 14.773835
      ATT: Read By Type Request (0x08) len 6
        Handle range: 0x0001-0xffff
        Attribute type: Include (0x2802)
zephyr.exe[1622729]: < HCI Command: Host Number of Completed Packets (0x03|0x0035) plen 5                          #247 14.778361
        Num handles: 1
        Handle: 327 Address: DF:A9:FF:F6:B1:1A (OUI DF-A9-FF)
        Count: 1
zephyr.exe[1622729]: < ACL Data TX: Handle 327 [1/3] flags 0x00 dlen 14                                            #248 14.778410
      ATT: Read By Type Response (0x09) len 9
        Attribute data length: 8
        Attribute data list: 1 entry
        Handle: 0x0038
        Value[6]: 240036002518
> HCI Event: Number of Completed Packets (0x13) plen 5                                                             #249 14.948741
        Num handles: 1
        Handle: 327 Address: DF:A9:FF:F6:B1:1A (OUI DF-A9-FF)
        Count: 1
        Buffers: 0/3
        #248: len 14 (0 Kb/s)
        Latency: 170 msec (70-170 msec ~164 msec)
> ACL Data RX: Handle 327 flags 0x02 dlen 11                                                                       #250 14.948842
      ATT: Read By Type Request (0x08) len 6
        Handle range: 0x0039-0xffff
        Attribute type: Include (0x2802)
zephyr.exe[1622729]: < HCI Command: Host Number of Completed Packets (0x03|0x0035) plen 5                          #251 14.958363
        Num handles: 1
        Handle: 327 Address: DF:A9:FF:F6:B1:1A (OUI DF-A9-FF)
        Count: 1
zephyr.exe[1622729]: < ACL Data TX: Handle 327 [1/3] flags 0x00 dlen 9                                             #252 14.958390
      ATT: Error Response (0x01) len 4
        Read By Type Request (0x08)
        Handle: 0x0039
        Error: Attribute Not Found (0x0a)
> HCI Event: Number of Completed Packets (0x13) plen 5                                                             #253 15.123655
        Num handles: 1
        Handle: 327 Address: DF:A9:FF:F6:B1:1A (OUI DF-A9-FF)
        Count: 1
        Buffers: 0/3
        #252: len 9 (0 Kb/s)
        Latency: 165 msec (70-170 msec ~164 msec)
> ACL Data RX: Handle 327 flags 0x02 dlen 11                                                                       #254 15.123929
      ATT: Read By Type Request (0x08) len 6
        Handle range: 0x0024-0x0036
        Attribute type: Characteristic (0x2803)
zephyr.exe[1622729]: < HCI Command: Host Number of Completed Packets (0x03|0x0035) plen 5                          #255 15.138306
        Num handles: 1
        Handle: 327 Address: DF:A9:FF:F6:B1:1A (OUI DF-A9-FF)
        Count: 1
zephyr.exe[1622729]: < ACL Data TX: Handle 327 [1/3] flags 0x00 dlen 20                                            #256 15.138369
      ATT: Read By Type Response (0x09) len 15
        Attribute data length: 7
        Attribute data list: 2 entries
        Handle: 0x0025
        Value[5]: 022600bd2a
            Properties: 0x02
              Read (0x02)
            Value Handle: 0x0026
            Value UUID: OTS Feature (0x2abd)
        Handle: 0x0027
        Value[5]: 0a2800be2a
            Properties: 0x0a
              Read (0x02)
              Write (0x08)
            Value Handle: 0x0028
            Value UUID: Object Name (0x2abe)
> HCI Event: Number of Completed Packets (0x13) plen 5                                                             #257 15.298664
        Num handles: 1
        Handle: 327 Address: DF:A9:FF:F6:B1:1A (OUI DF-A9-FF)
        Count: 1
        Buffers: 0/3
        #256: len 20 (1 Kb/s)
        Latency: 160 msec (70-170 msec ~162 msec)
> ACL Data RX: Handle 327 flags 0x02 dlen 11                                                                       #258 15.298856
      ATT: Read By Type Request (0x08) len 6
        Handle range: 0x0028-0x0036
        Attribute type: Characteristic (0x2803)
zephyr.exe[1622729]: < HCI Command: Host Number of Completed Packets (0x03|0x0035) plen 5                          #259 15.318364
        Num handles: 1
        Handle: 327 Address: DF:A9:FF:F6:B1:1A (OUI DF-A9-FF)
        Count: 1
zephyr.exe[1622729]: < ACL Data TX: Handle 327 [1/3] flags 0x00 dlen 20                                            #260 15.318391
      ATT: Read By Type Response (0x09) len 15
        Attribute data length: 7
        Attribute data list: 2 entries
        Handle: 0x0029
        Value[5]: 022a00bf2a
            Properties: 0x02
              Read (0x02)
            Value Handle: 0x002a
            Value UUID: Object Type (0x2abf)
        Handle: 0x002b
        Value[5]: 022c00c02a
            Properties: 0x02
              Read (0x02)
            Value Handle: 0x002c
            Value UUID: Object Size (0x2ac0)
> HCI Event: Number of Completed Packets (0x13) plen 5                                                             #261 15.473747
        Num handles: 1
        Handle: 327 Address: DF:A9:FF:F6:B1:1A (OUI DF-A9-FF)
        Count: 1
        Buffers: 0/3
        #260: len 20 (1 Kb/s)
        Latency: 155 msec (70-170 msec ~158 msec)
> ACL Data RX: Handle 327 flags 0x02 dlen 11                                                                       #262 15.474061
      ATT: Read By Type Request (0x08) len 6
        Handle range: 0x002c-0x0036
        Attribute type: Characteristic (0x2803)
zephyr.exe[1622729]: < HCI Command: Host Number of Completed Packets (0x03|0x0035) plen 5                          #263 15.478301
        Num handles: 1
        Handle: 327 Address: DF:A9:FF:F6:B1:1A (OUI DF-A9-FF)
        Count: 1
zephyr.exe[1622729]: < ACL Data TX: Handle 327 [1/3] flags 0x00 dlen 20                                            #264 15.478306
      ATT: Read By Type Response (0x09) len 15
        Attribute data length: 7
        Attribute data list: 2 entries
        Handle: 0x002d
        Value[5]: 022e00c32a
            Properties: 0x02
              Read (0x02)
            Value Handle: 0x002e
            Value UUID: Object ID (0x2ac3)
        Handle: 0x002f
        Value[5]: 023000c42a
            Properties: 0x02
              Read (0x02)
            Value Handle: 0x0030
            Value UUID: Object Properties (0x2ac4)
> HCI Event: Number of Completed Packets (0x13) plen 5                                                             #265 15.648563
        Num handles: 1
        Handle: 327 Address: DF:A9:FF:F6:B1:1A (OUI DF-A9-FF)
        Count: 1
        Buffers: 0/3
        #264: len 20 (0 Kb/s)
        Latency: 170 msec (70-170 msec ~164 msec)
> ACL Data RX: Handle 327 flags 0x02 dlen 11                                                                       #266 15.648874
      ATT: Read By Type Request (0x08) len 6
        Handle range: 0x0030-0x0036
        Attribute type: Characteristic (0x2803)
zephyr.exe[1622729]: < HCI Command: Host Number of Completed Packets (0x03|0x0035) plen 5                          #267 15.658267
        Num handles: 1
        Handle: 327 Address: DF:A9:FF:F6:B1:1A (OUI DF-A9-FF)
        Count: 1
zephyr.exe[1622729]: < ACL Data TX: Handle 327 [1/3] flags 0x00 dlen 20                                            #268 15.658272
      ATT: Read By Type Response (0x09) len 15
        Attribute data length: 7
        Attribute data list: 2 entries
        Handle: 0x0031
        Value[5]: 283200c52a
            Properties: 0x28
              Write (0x08)
              Indicate (0x20)
            Value Handle: 0x0032
            Value UUID: Object Action Control Point (0x2ac5)
        Handle: 0x0034
        Value[5]: 283500c62a
            Properties: 0x28
              Write (0x08)
              Indicate (0x20)
            Value Handle: 0x0035
            Value UUID: Object List Control Point (0x2ac6)
> HCI Event: Number of Completed Packets (0x13) plen 5                                                             #269 15.823779
        Num handles: 1
        Handle: 327 Address: DF:A9:FF:F6:B1:1A (OUI DF-A9-FF)
        Count: 1
        Buffers: 0/3
        #268: len 20 (0 Kb/s)
        Latency: 165 msec (70-170 msec ~165 msec)
> ACL Data RX: Handle 327 flags 0x02 dlen 11                                                                       #270 15.823782
      ATT: Read By Type Request (0x08) len 6
        Handle range: 0x0035-0x0036
        Attribute type: Characteristic (0x2803)
zephyr.exe[1622729]: < HCI Command: Host Number of Completed Packets (0x03|0x0035) plen 5                          #271 15.838380
        Num handles: 1
        Handle: 327 Address: DF:A9:FF:F6:B1:1A (OUI DF-A9-FF)
        Count: 1
zephyr.exe[1622729]: < ACL Data TX: Handle 327 [1/3] flags 0x00 dlen 9                                             #272 15.838401
      ATT: Error Response (0x01) len 4
        Read By Type Request (0x08)
        Handle: 0x0035
        Error: Attribute Not Found (0x0a)
> HCI Event: Number of Completed Packets (0x13) plen 5                                                             #273 15.998627
        Num handles: 1
        Handle: 327 Address: DF:A9:FF:F6:B1:1A (OUI DF-A9-FF)
        Count: 1
        Buffers: 0/3
        #272: len 9 (0 Kb/s)
        Latency: 160 msec (70-170 msec ~162 msec)
> ACL Data RX: Handle 327 flags 0x02 dlen 9                                                                        #274 15.998830
      ATT: Find Information Request (0x04) len 4
        Handle range: 0x0033-0x0033
zephyr.exe[1622729]: < HCI Command: Host Number of Completed Packets (0x03|0x0035) plen 5                          #275 16.018437
        Num handles: 1
        Handle: 327 Address: DF:A9:FF:F6:B1:1A (OUI DF-A9-FF)
        Count: 1
zephyr.exe[1622729]: < ACL Data TX: Handle 327 [1/3] flags 0x00 dlen 10                                            #276 16.018442
      ATT: Find Information Response (0x05) len 5
        Format: UUID-16 (0x01)
        Handle: 0x0033
        UUID: Client Characteristic Configuration (0x2902)
> HCI Event: Number of Completed Packets (0x13) plen 5                                                             #277 16.173816
        Num handles: 1
        Handle: 327 Address: DF:A9:FF:F6:B1:1A (OUI DF-A9-FF)
        Count: 1
        Buffers: 0/3
        #276: len 10 (0 Kb/s)
        Latency: 155 msec (70-170 msec ~159 msec)
> ACL Data RX: Handle 327 flags 0x02 dlen 9                                                                        #278 16.173819
      ATT: Find Information Request (0x04) len 4
        Handle range: 0x0036-0x0036
zephyr.exe[1622729]: < HCI Command: Host Number of Completed Packets (0x03|0x0035) plen 5                          #279 16.178285
        Num handles: 1
        Handle: 327 Address: DF:A9:FF:F6:B1:1A (OUI DF-A9-FF)
        Count: 1
zephyr.exe[1622729]: < ACL Data TX: Handle 327 [1/3] flags 0x00 dlen 10                                            #280 16.178290
      ATT: Find Information Response (0x05) len 5
        Format: UUID-16 (0x01)
        Handle: 0x0036
        UUID: Client Characteristic Configuration (0x2902)
> HCI Event: Number of Completed Packets (0x13) plen 5                                                             #281 16.348730
        Num handles: 1
        Handle: 327 Address: DF:A9:FF:F6:B1:1A (OUI DF-A9-FF)
        Count: 1
        Buffers: 0/3
        #280: len 10 (0 Kb/s)
        Latency: 170 msec (70-170 msec ~164 msec)
> ACL Data RX: Handle 327 flags 0x02 dlen 7                                                                        #282 16.348732
      ATT: Read Request (0x0a) len 2
        Handle: 0x0026
zephyr.exe[1622729]: < HCI Command: Host Number of Completed Packets (0x03|0x0035) plen 5                          #283 16.358353
        Num handles: 1
        Handle: 327 Address: DF:A9:FF:F6:B1:1A (OUI DF-A9-FF)
        Count: 1
zephyr.exe[1622729]: < ACL Data TX: Handle 327 [1/3] flags 0x00 dlen 13                                            #284 16.358381
      ATT: Read Response (0x0b) len 8
        Value[8]: 1000000001000000
> HCI Event: Number of Completed Packets (0x13) plen 5                                                             #285 16.523701
        Num handles: 1
        Handle: 327 Address: DF:A9:FF:F6:B1:1A (OUI DF-A9-FF)
        Count: 1
        Buffers: 0/3
        #284: len 13 (0 Kb/s)
        Latency: 165 msec (70-170 msec ~165 msec)
> ACL Data RX: Handle 327 flags 0x02 dlen 9                                                                        #286 16.524243
      ATT: Write Request (0x12) len 4
        Handle: 0x0033
          Data[2]: 0000
zephyr.exe[1622729]: < HCI Command: Host Number of Completed Packets (0x03|0x0035) plen 5                          #287 16.538441
        Num handles: 1
        Handle: 327 Address: DF:A9:FF:F6:B1:1A (OUI DF-A9-FF)
        Count: 1
zephyr.exe[1622729]: < ACL Data TX: Handle 327 [1/3] flags 0x00 dlen 5                                             #288 16.538507
      ATT: Write Response (0x13) len 0
> HCI Event: Number of Completed Packets (0x13) plen 5                                                             #289 16.698540
        Num handles: 1
        Handle: 327 Address: DF:A9:FF:F6:B1:1A (OUI DF-A9-FF)
        Count: 1
        Buffers: 0/3
        #288: len 5 (0 Kb/s)
        Latency: 160 msec (70-170 msec ~162 msec)
> ACL Data RX: Handle 327 flags 0x02 dlen 9                                                                        #290 16.698711
      ATT: Write Request (0x12) len 4
        Handle: 0x0033
          Data[2]: 0200
zephyr.exe[1622729]: < HCI Command: Host Number of Completed Packets (0x03|0x0035) plen 5                          #291 16.718347
        Num handles: 1
        Handle: 327 Address: DF:A9:FF:F6:B1:1A (OUI DF-A9-FF)
        Count: 1
zephyr.exe[1622729]: < ACL Data TX: Handle 327 [1/3] flags 0x00 dlen 5                                             #292 16.718419
      ATT: Write Response (0x13) len 0
> HCI Event: Number of Completed Packets (0x13) plen 5                                                             #293 16.873597
        Num handles: 1
        Handle: 327 Address: DF:A9:FF:F6:B1:1A (OUI DF-A9-FF)
        Count: 1
        Buffers: 0/3
        #292: len 5 (0 Kb/s)
        Latency: 155 msec (70-170 msec ~158 msec)
> ACL Data RX: Handle 327 flags 0x02 dlen 9                                                                        #294 16.873678
      ATT: Write Request (0x12) len 4
        Handle: 0x0036
          Data[2]: 0000
zephyr.exe[1622729]: < HCI Command: Host Number of Completed Packets (0x03|0x0035) plen 5                          #295 16.878346
        Num handles: 1
        Handle: 327 Address: DF:A9:FF:F6:B1:1A (OUI DF-A9-FF)
        Count: 1
zephyr.exe[1622729]: < ACL Data TX: Handle 327 [1/3] flags 0x00 dlen 5                                             #296 16.878407
      ATT: Write Response (0x13) len 0
> HCI Event: Number of Completed Packets (0x13) plen 5                                                             #297 17.048719
        Num handles: 1
        Handle: 327 Address: DF:A9:FF:F6:B1:1A (OUI DF-A9-FF)
        Count: 1
        Buffers: 0/3
        #296: len 5 (0 Kb/s)
        Latency: 170 msec (70-170 msec ~164 msec)
> ACL Data RX: Handle 327 flags 0x02 dlen 9                                                                        #298 17.048836
      ATT: Write Request (0x12) len 4
        Handle: 0x0036
          Data[2]: 0200
zephyr.exe[1622729]: < HCI Command: Host Number of Completed Packets (0x03|0x0035) plen 5                          #299 17.058465
        Num handles: 1
        Handle: 327 Address: DF:A9:FF:F6:B1:1A (OUI DF-A9-FF)
        Count: 1
zephyr.exe[1622729]: < ACL Data TX: Handle 327 [1/3] flags 0x00 dlen 5                                             #300 17.058492
      ATT: Write Response (0x13) len 0
> HCI Event: Number of Completed Packets (0x13) plen 5                                                             #301 17.223711
        Num handles: 1
        Handle: 327 Address: DF:A9:FF:F6:B1:1A (OUI DF-A9-FF)
        Count: 1
        Buffers: 0/3
        #300: len 5 (0 Kb/s)
        Latency: 165 msec (70-170 msec ~164 msec)
> ACL Data RX: Handle 327 flags 0x02 dlen 7                                                                        #302 17.223713
      ATT: Read Request (0x0a) len 2
        Handle: 0x006c
zephyr.exe[1622729]: < HCI Command: Host Number of Completed Packets (0x03|0x0035) plen 5                          #303 17.238240
        Num handles: 1
        Handle: 327 Address: DF:A9:FF:F6:B1:1A (OUI DF-A9-FF)
        Count: 1
zephyr.exe[1622729]: < ACL Data TX: Handle 327 [1/3] flags 0x00 dlen 9                                             #304 17.238299
      ATT: Read Response (0x0b) len 4
        Value[4]: ffff1f00
> HCI Event: Nu