Bluetooth monitor ver 5.72
btmon[1453946]: = Note: Linux version 6.14.0-36-generic (x86_64)                                                         0.543485
btmon[1453946]: = Note: Bluetooth subsystem version 2.22                                                                 0.543487
= New Index: 00:00:00:00:00:00 (Primary,UART,hci1)                                                                       0.543488
= New Index: 48:5F:99:8E:E0:64 (Primary,USB,hci0)                                                                        0.543488
= Open Index: 00:00:00:00:00:00                                                                                          1.057503
= Index Info: 00:00:00:00:00:00 (Nordic Semiconductor ASA)                                                               1.057522
zephyr.exe[1453948]: @ USER Open: main (privileged) version 2.22                                                {0x0001} 1.057533
zephyr.exe[1453948]: < HCI Command: Reset (0x03|0x0003) plen 0                                                        #1 1.058754
> HCI Event: Command Complete (0x0e) plen 4                                                                           #2 1.059343
      Reset (0x03|0x0003) ncmd 1
        Status: Success (0x00)
zephyr.exe[1453948]: < HCI Command: Read Local Supported Features (0x04|0x0003) plen 0                                #3 1.077174
> HCI Event: Command Complete (0x0e) plen 12                                                                          #4 1.077667
      Read Local Supported Features (0x04|0x0003) ncmd 1
        Status: Success (0x00)
        Features: 0x00 0x00 0x00 0x00 0x60 0x00 0x00 0x00
          BR/EDR Not Supported
          LE Supported (Controller)
zephyr.exe[1453948]: < HCI Command: Read Local Version Information (0x04|0x0001) plen 0                               #5 1.096995
> HCI Event: Command Complete (0x0e) plen 12                                                                          #6 1.097496
      Read Local Version Information (0x04|0x0001) ncmd 1
        Status: Success (0x00)
        HCI version: Reserved (0x0f) - Revision 12393 (0x3069)
        LMP version: Reserved (0x0f) - Subversion 12393 (0x3069)
        Manufacturer: Nordic Semiconductor ASA (89)
zephyr.exe[1453948]: < HCI Command: Read Local Supported Commands (0x04|0x0002) plen 0                                #7 1.116932
> HCI Event: Command Complete (0x0e) plen 68                                                                          #8 1.117979
      Read Local Supported Commands (0x04|0x0002) ncmd 1
        Status: Success (0x00)
        Commands: 119 entries
          Disconnect (Octet 0 - Bit 5)
          Read Remote Version Information (Octet 2 - Bit 7)
          Set Event Mask (Octet 5 - Bit 6)
          Reset (Octet 5 - Bit 7)
          Read Connection Accept Timeout (Octet 7 - Bit 2)
          Write Connection Accept Timeout (Octet 7 - Bit 3)
          Read Transmit Power Level (Octet 10 - Bit 2)
          Set Controller To Host Flow Control (Octet 10 - Bit 5)
          Host Buffer Size (Octet 10 - Bit 6)
          Host Number of Completed Packets (Octet 10 - Bit 7)
          Read Local Version Information (Octet 14 - Bit 3)
          Read Local Supported Features (Octet 14 - Bit 5)
          Read BD ADDR (Octet 15 - Bit 1)
          Read RSSI (Octet 15 - Bit 5)
          Set Event Mask Page 2 (Octet 22 - Bit 2)
          LE Set Event Mask (Octet 25 - Bit 0)
          LE Read Buffer Size (Octet 25 - Bit 1)
          LE Read Local Supported Features (Octet 25 - Bit 2)
          LE Set Random Address (Octet 25 - Bit 4)
          LE Set Advertising Parameters (Octet 25 - Bit 5)
          LE Read Advertising Channel TX Power (Octet 25 - Bit 6)
          LE Set Advertising Data (Octet 25 - Bit 7)
          LE Set Scan Response Data (Octet 26 - Bit 0)
          LE Set Advertise Enable (Octet 26 - Bit 1)
          LE Set Scan Parameters (Octet 26 - Bit 2)
          LE Set Scan Enable (Octet 26 - Bit 3)
          LE Create Connection (Octet 26 - Bit 4)
          LE Create Connection Cancel (Octet 26 - Bit 5)
          LE Read Accept List Size (Octet 26 - Bit 6)
          LE Clear Accept List (Octet 26 - Bit 7)
          LE Add Device To Accept List (Octet 27 - Bit 0)
          LE Remove Device From Accept List (Octet 27 - Bit 1)
          LE Connection Update (Octet 27 - Bit 2)
          LE Set Host Channel Classification (Octet 27 - Bit 3)
          LE Read Channel Map (Octet 27 - Bit 4)
          LE Read Remote Used Features (Octet 27 - Bit 5)
          LE Encrypt (Octet 27 - Bit 6)
          LE Rand (Octet 27 - Bit 7)
          LE Start Encryption (Octet 28 - Bit 0)
          LE Long Term Key Request Reply (Octet 28 - Bit 1)
          LE Long Term Key Request Neg Reply (Octet 28 - Bit 2)
          LE Read Supported States (Octet 28 - Bit 3)
          LE Receiver Test (Octet 28 - Bit 4)
          LE Transmitter Test (Octet 28 - Bit 5)
          LE Test End (Octet 28 - Bit 6)
          Read Authenticated Payload Timeout (Octet 32 - Bit 4)
          Write Authenticated Payload Timeout (Octet 32 - Bit 5)
          LE Set Data Length (Octet 33 - Bit 6)
          LE Read Suggested Default Data Length (Octet 33 - Bit 7)
          LE Write Suggested Default Data Length (Octet 34 - Bit 0)
          LE Add Device To Resolving List (Octet 34 - Bit 3)
          LE Remove Device From Resolving List (Octet 34 - Bit 4)
          LE Clear Resolving List (Octet 34 - Bit 5)
          LE Read Resolving List Size (Octet 34 - Bit 6)
          LE Set Address Resolution Enable (Octet 35 - Bit 1)
          LE Set Resolvable Private Address Timeout (Octet 35 - Bit 2)
          LE Read Maximum Data Length (Octet 35 - Bit 3)
          LE Read PHY (Octet 35 - Bit 4)
          LE Set Default PHY (Octet 35 - Bit 5)
          LE Set PHY (Octet 35 - Bit 6)
          LE Enhanced Receiver Test (Octet 35 - Bit 7)
          LE Enhanced Transmitter Test (Octet 36 - Bit 0)
          LE Set Advertising Set Random Address (Octet 36 - Bit 1)
          LE Set Extended Advertising Parameters (Octet 36 - Bit 2)
          LE Set Extended Advertising Data (Octet 36 - Bit 3)
          LE Set Extended Scan Response Data (Octet 36 - Bit 4)
          LE Set Extended Advertising Enable (Octet 36 - Bit 5)
          LE Read Maximum Advertising Data Length (Octet 36 - Bit 6)
          LE Read Number of Supported Advertising Sets (Octet 36 - Bit 7)
          LE Remove Advertising Set (Octet 37 - Bit 0)
          LE Clear Advertising Sets (Octet 37 - Bit 1)
          LE Set Periodic Advertising Parameters (Octet 37 - Bit 2)
          LE Set Periodic Advertising Data (Octet 37 - Bit 3)
          LE Set Periodic Advertising Enable (Octet 37 - Bit 4)
          LE Set Extended Scan Parameters (Octet 37 - Bit 5)
          LE Set Extended Scan Enable (Octet 37 - Bit 6)
          LE Extended Create Connection (Octet 37 - Bit 7)
          LE Periodic Advertising Create Sync (Octet 38 - Bit 0)
          LE Periodic Advertising Create Sync Cancel (Octet 38 - Bit 1)
          LE Periodic Advertising Terminate Sync (Octet 38 - Bit 2)
          LE Add Device To Periodic Advertiser List (Octet 38 - Bit 3)
          LE Remove Device From Periodic Advertiser List (Octet 38 - Bit 4)
          LE Clear Periodic Advertiser List (Octet 38 - Bit 5)
          LE Read Periodic Advertiser List Size (Octet 38 - Bit 6)
          LE Read Transmit Power (Octet 38 - Bit 7)
          LE Read RF Path Compensation (Octet 39 - Bit 0)
          LE Write RF Path Compensation (Octet 39 - Bit 1)
          LE Set Privacy Mode (Octet 39 - Bit 2)
          LE Periodic Advertising Receive Enable (Octet 40 - Bit 5)
          LE Periodic Advertising Sync Transfer (Octet 40 - Bit 6)
          LE Periodic Advertising Set Info Transfer (Octet 40 - Bit 7)
          LE Periodic Advertising Sync Transfer Parameters (Octet 41 - Bit 0)
          LE Set Default Periodic Advertisng Sync Transfer Parameters (Octet 41 - Bit 1)
          LE Read Buffer v2 (Octet 41 - Bit 5)
          LE Read ISO TX Sync (Octet 41 - Bit 6)
          LE Set Connected Isochronous Group Parameters (Octet 41 - Bit 7)
          LE Set Connected Isochronous Group Parameters Test (Octet 42 - Bit 0)
          LE Create Connected Isochronous Stream (Octet 42 - Bit 1)
          LE Remove Connected Isochronous Group (Octet 42 - Bit 2)
          LE Accept Connected Isochronous Stream Request (Octet 42 - Bit 3)
          LE Reject Connected Isochronous Stream Request (Octet 42 - Bit 4)
          LE Create Broadcast Isochronous Group (Octet 42 - Bit 5)
          LE Create Broadcast Isochronous Group Test (Octet 42 - Bit 6)
          LE Terminate Broadcast Isochronous Group (Octet 42 - Bit 7)
          LE Broadcast Isochronous Group Create Sync (Octet 43 - Bit 0)
          LE Broadcast Isochronous Group Terminate Sync (Octet 43 - Bit 1)
          LE Request Peer SCA (Octet 43 - Bit 2)
          LE Setup Isochronous Data Path (Octet 43 - Bit 3)
          LE Remove Isochronous Data Path (Octet 43 - Bit 4)
          LE Isochronous Transmit Test (Octet 43 - Bit 5)
          LE Isochronous Receive Test (Octet 43 - Bit 6)
          LE Isochronous Read Test Counters (Octet 43 - Bit 7)
          LE Isochronous Read Test Counters (Octet 44 - Bit 0)
          LE Set Host Feature (Octet 44 - Bit 1)
          Octet 44 - Bit 2 
          Octet 45 - Bit 6 
          Octet 46 - Bit 0 
          Octet 46 - Bit 1 
          Octet 46 - Bit 2 
zephyr.exe[1453948]: < HCI Command: Host Buffer Size (0x03|0x0033) plen 7                                             #9 1.136935
        ACL MTU: 255  ACL max packet: 16
        SCO MTU: 0    SCO max packet: 0
> HCI Event: Command Complete (0x0e) plen 4                                                                          #10 1.137442
      Host Buffer Size (0x03|0x0033) ncmd 1
        Status: Success (0x00)
zephyr.exe[1453948]: < HCI Command: Set Controller To Host Flow Control (0x03|0x0031) plen 1                         #11 1.158278
        Flow control: ACL Data Packets (0x01)
> HCI Event: Command Complete (0x0e) plen 4                                                                          #12 1.160579
      Set Controller To Host Flow Control (0x03|0x0031) ncmd 1
        Status: Success (0x00)
zephyr.exe[1453948]: < HCI Command: LE Read Local Supported Features (0x08|0x0003) plen 0                            #13 1.176769
> HCI Event: Command Complete (0x0e) plen 12                                                                         #14 1.177307
      LE Read Local Supported Features (0x08|0x0003) ncmd 1
        Status: Success (0x00)
        Features: 0xfd 0x79 0x00 0xf7 0x30 0x01 0x00 0x00
          LE Encryption
          Extended Reject Indication
          Peripheral-initiated Features Exchange
          LE Ping
          LE Data Packet Length Extension
          LL Privacy
          Extended Scanner Filter Policies
          LE 2M PHY
          LE Coded PHY
          LE Extended Advertising
          LE Periodic Advertising
          Channel Selection Algorithm #2
          Periodic Advertising Sync Transfer - Sender
          Periodic Advertising Sync Transfer - Recipient
          Sleep Clock Accuracy Updates
          Connected Isochronous Stream - Central
          Connected Isochronous Stream - Peripheral
          Isochronous Broadcaster
          Synchronized Receiver
          Periodic Advertising ADI support
          Connection Subrating
          Unknown features (0x0000010000000000)
zephyr.exe[1453948]: < HCI Command: LE Set Host Feature (0x08|0x0074) plen 2                                         #15 1.197121
        Bit Number: 32
          Connected Isochronous Stream (Host Support)
        Bit Value: 1
> HCI Event: Command Complete (0x0e) plen 4                                                                          #16 1.197694
      LE Set Host Feature (0x08|0x0074) ncmd 1
        Status: Success (0x00)
zephyr.exe[1453948]: < HCI Command: LE Read Buffer v2 (0x08|0x0060) plen 0                                           #17 1.216781
> HCI Event: Command Complete (0x0e) plen 10                                                                         #18 1.217243
      LE Read Buffer v2 (0x08|0x0060) ncmd 1
        Status: Success (0x00)
        ACL MTU: 27
        ACL max packet: 3
        ISO MTU: 318
        ISO max packet: 3
zephyr.exe[1453948]: < HCI Command: LE Read Maximum Advertising Data Length (0x08|0x003a) plen 0                     #19 1.236816
> HCI Event: Command Complete (0x0e) plen 6                                                                          #20 1.237235
      LE Read Maximum Advertising Data Length (0x08|0x003a) ncmd 1
        Status: Success (0x00)
        Max length: 1650
zephyr.exe[1453948]: < HCI Command: LE Read Supported States (0x08|0x001c) plen 0                                    #21 1.256789
> HCI Event: Command Complete (0x0e) plen 12                                                                         #22 1.257297
      LE Read Supported States (0x08|0x001c) ncmd 1
        Status: Success (0x00)
        States: 0x000003ff3e0306ff
          Non-connectable Advertising State
          Scannable Advertising State
          Connectable Advertising State
          High Duty Cycle Directed Advertising State
          Passive Scanning State
          Active Scanning State
          Initiating State
            and Connection State (Central Role)
          Connection State (Peripheral Role)
          Scannable Advertising State
            and Passive Scanning State
          Connectable Advertising State
            and Passive Scanning State
          Non-connectable Advertising State
            and Initiating State
          Scannable Advertising State
            and Initiating State
          Active Scanning State
            and Connection State (Central Role)
          Passive Scanning State
            and Connection State (Peripheral Role)
          Active Scanning State
            and Connection State (Peripheral Role)
          Initiating State
            and Connection State (Central Role)
            and Central Role & Central Role
          Low Duty Cycle Directed Advertising State
          Connectable Advertising State
            and Initiating State
            and Central Role & Peripheral Role
          High Duty Cycle Directed Advertising State
            and Initiating State
            and Central Role & Peripheral Role
          Low Duty Cycle Directed Advertising State
            and Initiating State
            and Central Role & Peripheral Role
          Connectable Advertising State
            and Connection State (Central Role)
            and Central Role & Peripheral Role
          High Duty Cycle Directed Advertising State
            and Connection State (Central Role)
            and Central Role & Peripheral Role
          Low Duty Cycle Directed Advertising State
            and Connection State (Central Role)
            and Central Role & Peripheral Role
          Connectable Advertising State
            and Connection State (Peripheral Role)
            and Central Role & Peripheral Role
          High Duty Cycle Directed Advertising State
            and Connection State (Peripheral Role)
            and Peripheral Role & Peripheral Role
          Low Duty Cycle Directed Advertising State
            and Connection State (Peripheral Role)
            and Peripheral Role & Peripheral Role
          Initiating State
            and Connection State (Peripheral Role)
            and Central Role & Peripheral Role
zephyr.exe[1453948]: < HCI Command: LE Read Maximum Data Length (0x08|0x002f) plen 0                                 #23 1.276861
> HCI Event: Command Complete (0x0e) plen 12                                                                         #24 1.277442
      LE Read Maximum Data Length (0x08|0x002f) ncmd 1
        Status: Success (0x00)
        Max TX octets: 251
        Max TX time: 2704
        Max RX octets: 251
        Max RX time: 2704
zephyr.exe[1453948]: < HCI Command: LE Write Suggested Default Data Length (0x08|0x0024) plen 4                      #25 1.296777
        TX octets: 251
        TX time: 2704
> HCI Event: Command Complete (0x0e) plen 4                                                                          #26 1.297243
      LE Write Suggested Default Data Length (0x08|0x0024) ncmd 1
        Status: Success (0x00)
zephyr.exe[1453948]: < HCI Command: LE Set Resolvable Private Address Timeout (0x08|0x002e) plen 2                   #27 1.316883
        Timeout: 900 seconds
> HCI Event: Command Complete (0x0e) plen 4                                                                          #28 1.317370
      LE Set Resolvable Private Address Timeout (0x08|0x002e) ncmd 1
        Status: Success (0x00)
zephyr.exe[1453948]: < HCI Command: LE Read Resolving List Size (0x08|0x002a) plen 0                                 #29 1.336882
> HCI Event: Command Complete (0x0e) plen 5                                                                          #30 1.337323
      LE Read Resolving List Size (0x08|0x002a) ncmd 1
        Status: Success (0x00)
        Size: 8
zephyr.exe[1453948]: < HCI Command: LE Set Event Mask (0x08|0x0001) plen 8                                           #31 1.356899
        Mask: 0x000002023f87fa5e
          LE Advertising Report
          LE Connection Update Complete
          LE Read Remote Used Features Complete
          LE Long Term Key Request
          LE Data Length Change
          LE Enhanced Connection Complete
          LE PHY Update Complete
          LE Extended Advertising Report
          LE Periodic Advertising Sync Established
          LE Periodic Advertising Report
          LE Periodic Advertising Sync Lost
          LE Extended Scan Timeout
          LE Extended Advertising Set Terminated
          LE Scan Request Received
          LE Periodic Advertising Sync Transfer Rvc
          LE CIS Established
          LE CIS Request
          LE Create BIG Complete
          LE Terminate BIG Complete
          LE BIG Sync Estabilished Complete
          LE BIG Sync Lost
          LE BIG Info Advertising Report
          Unknown mask (0x0000020000000000)
> HCI Event: Command Complete (0x0e) plen 4                                                                          #32 1.357557
      LE Set Event Mask (0x08|0x0001) ncmd 1
        Status: Success (0x00)
zephyr.exe[1453948]: < HCI Command: Set Event Mask (0x03|0x0001) plen 8                                              #33 1.376943
        Mask: 0x2000800002008890
          Disconnection Complete
          Encryption Change
          Read Remote Version Information Complete
          Hardware Error
          Data Buffer Overflow
          Encryption Key Refresh Complete
          LE Meta
> HCI Event: Command Complete (0x0e) plen 4                                                                          #34 1.377539
      Set Event Mask (0x03|0x0001) ncmd 1
        Status: Success (0x00)
zephyr.exe[1453948]: < HCI Command: Read BD ADDR (0x04|0x0009) plen 0                                                #35 1.396931
> HCI Event: Command Complete (0x0e) plen 10                                                                         #36 1.399192
      Read BD ADDR (0x04|0x0009) ncmd 1
        Status: Success (0x00)
        Address: 00:00:00:00:00:00 (OUI 00-00-00)
zephyr.exe[1453948]: < HCI Command: LE Set Random Address (0x08|0x0005) plen 6                                       #37 1.416928
        Address: D5:B6:CC:31:DB:3B (Static)
> HCI Event: Command Complete (0x0e) plen 4                                                                          #38 1.417364
      LE Set Random Address (0x08|0x0005) ncmd 1
        Status: Success (0x00)
zephyr.exe[1453948]: < HCI Command: LE Set Random Address (0x08|0x0005) plen 6                                       #39 1.517474
        Address: 48:61:8E:DB:C6:F9 (Resolvable)
> HCI Event: Command Complete (0x0e) plen 4                                                                          #40 1.517901
      LE Set Random Address (0x08|0x0005) ncmd 1
        Status: Success (0x00)
zephyr.exe[1453948]: < HCI Command: LE Set Extended Advertising Parameters (0x08|0x0036) plen 25                     #41 5.457043
        Handle: 0x00
        Properties: 0x0013
          Connectable
          Scannable
          Use legacy advertising PDUs: ADV_IND
        Min advertising interval: 100.000 msec (0x00a0)
        Max advertising interval: 150.000 msec (0x00f0)
        Channel map: 37, 38, 39 (0x07)
        Own address type: Random (0x01)
        Peer address type: Public (0x00)
        Peer address: 00:00:00:00:00:00 (OUI 00-00-00)
        Filter policy: Allow Scan Request from Any, Allow Connect Request from Any (0x00)
        TX power: Host has no preference (0x7f)
        Primary PHY: LE 1M (0x01)
        Secondary max skip: 0x00
        Secondary PHY: LE 1M (0x01)
        SID: 0x00
        Scan request notifications: Disabled (0x00)
> HCI Event: Command Complete (0x0e) plen 5                                                                          #42 5.457876
      LE Set Extended Advertising Parameters (0x08|0x0036) ncmd 1
        Status: Success (0x00)
        TX power (selected): 0 dbm (0x00)
zephyr.exe[1453948]: < HCI Command: LE Set Advertising Set Random Address (0x08|0x0035) plen 7                       #43 5.476995
        Advertising handle: 0x00
        Advertising random address: D5:B6:CC:31:DB:3B (Static)
> HCI Event: Command Complete (0x0e) plen 4                                                                          #44 5.477634
      LE Set Advertising Set Random Address (0x08|0x0035) ncmd 1
        Status: Success (0x00)
zephyr.exe[1453948]: < HCI Command: LE Set Extended Advertising Data (0x08|0x0037) plen 22                           #45 5.497030
        Handle: 0x00
        Operation: Complete extended advertising data (0x03)
        Fragment preference: Minimize fragmentation (0x01)
        Data length: 0x12
        Flags: 0x04
          BR/EDR Not Supported
        Name (complete): Tester_F6B11A
> HCI Event: Command Complete (0x0e) plen 4                                                                          #46 5.497774
      LE Set Extended Advertising Data (0x08|0x0037) ncmd 1
        Status: Success (0x00)
zephyr.exe[1453948]: < HCI Command: LE Set Extended Scan Response Data (0x08|0x0038) plen 4                          #47 5.516995
        Handle: 0x00
        Operation: Complete scan response data (0x03)
        Fragment preference: Minimize fragmentation (0x01)
        Data length: 0x00
> HCI Event: Command Complete (0x0e) plen 4                                                                          #48 5.517481
      LE Set Extended Scan Response Data (0x08|0x0038) ncmd 1
        Status: Success (0x00)
zephyr.exe[1453948]: < HCI Command: LE Set Extended Advertising Enable (0x08|0x0039) plen 6                          #49 5.537001
        Extended advertising: Enabled (0x01)
        Number of sets: 1 (0x01)
        Entry 0
          Handle: 0x00
          Duration: 0 ms (0x00)
          Max ext adv events: 0
> HCI Event: Command Complete (0x0e) plen 4                                                                          #50 5.537679
      LE Set Extended Advertising Enable (0x08|0x0039) ncmd 1
        Status: Success (0x00)
> HCI Event: LE Meta Event (0x3e) plen 31                                                                            #51 5.652861
      LE Enhanced Connection Complete (0x0a)
        Status: Success (0x00)
        Handle: 75
        Role: Peripheral (0x01)
        Peer address type: Public (0x00)
        Peer address: DF:A9:FF:F6:B1:1A (OUI DF-A9-FF)
        Local resolvable private address: 00:00:00:00:00:00 (Non-Resolvable)
        Peer resolvable private address: 00:00:00:00:00:00 (Non-Resolvable)
        Connection interval: 87.50 msec (0x0046)
        Connection latency: 0 (0x0000)
        Supervision timeout: 20000 msec (0x07d0)
        Central clock accuracy: 0x01
> HCI Event: LE Meta Event (0x3e) plen 6                                                                             #52 5.652863
      LE Advertising Set Terminated (0x12)
        Status: Success (0x00)
        Handle: 0
        Connection handle: 75
        Number of completed extended advertising events: 0
zephyr.exe[1453948]: < HCI Command: LE Read Remote Used Features (0x08|0x0016) plen 2                                #53 5.657128
        Handle: 75 Address: DF:A9:FF:F6:B1:1A (OUI DF-A9-FF)
> HCI Event: Command Status (0x0f) plen 4                                                                            #54 5.657580
      LE Read Remote Used Features (0x08|0x0016) ncmd 1
        Status: Success (0x00)
> HCI Event: LE Meta Event (0x3e) plen 12                                                                            #55 5.916653
      LE Read Remote Used Features (0x04)
        Status: Success (0x00)
        Handle: 75 Address: DF:A9:FF:F6:B1:1A (OUI DF-A9-FF)
        Features: 0x2d 0x49 0x00 0xf7 0x67 0xd8 0x00 0x00
          LE Encryption
          Extended Reject Indication
          Peripheral-initiated Features Exchange
          LE Data Packet Length Extension
          LE 2M PHY
          LE Coded PHY
          Channel Selection Algorithm #2
          Periodic Advertising Sync Transfer - Sender
          Periodic Advertising Sync Transfer - Recipient
          Sleep Clock Accuracy Updates
          Connected Isochronous Stream - Central
          Connected Isochronous Stream - Peripheral
          Isochronous Broadcaster
          Synchronized Receiver
          Connected Isochronous Stream (Host Support)
          LE Power Control Request
          LE Power Control Request
          Connection Subrating
          Connection Subrating (Host Support)
          Unknown features (0x0000d80000000000)
> ACL Data RX: Handle 75 flags 0x02 dlen 13                                                                          #56 6.353893
      ATT: Find By Type Value Request (0x06) len 8
        Handle range: 0x0001-0xffff
        Attribute type: Primary Service (0x2800)
          UUID: Generic Access Profile (0x1800)
zephyr.exe[1453948]: < HCI Command: Host Number of Completed Packets (0x03|0x0035) plen 5                            #57 6.357444
        Num handles: 1
        Handle: 75 Address: DF:A9:FF:F6:B1:1A (OUI DF-A9-FF)
        Count: 1
zephyr.exe[1453948]: < ACL Data TX: Handle 75 flags 0x00 dlen 9                                                      #58 6.357710
      ATT: Find By Type Value Response (0x07) len 4
        Handle range: 0x000b-0x0013
> HCI Event: Number of Completed Packets (0x13) plen 5                                                               #59 6.528905
        Num handles: 1
        Handle: 75 Address: DF:A9:FF:F6:B1:1A (OUI DF-A9-FF)
        Count: 1
        #58: len 9 (0 Kb/s)
        Latency: 171 msec (171-171 msec ~171 msec)
> ACL Data RX: Handle 75 flags 0x02 dlen 13                                                                          #60 6.529158
      ATT: Find By Type Value Request (0x06) len 8
        Handle range: 0x0014-0xffff
        Attribute type: Primary Service (0x2800)
          UUID: Generic Access Profile (0x1800)
zephyr.exe[1453948]: < HCI Command: Host Number of Completed Packets (0x03|0x0035) plen 5                            #61 6.537629
        Num handles: 1
        Handle: 75 Address: DF:A9:FF:F6:B1:1A (OUI DF-A9-FF)
        Count: 1
zephyr.exe[1453948]: < ACL Data TX: Handle 75 flags 0x00 dlen 9                                                      #62 6.537651
      ATT: Error Response (0x01) len 4
        Find By Type Value Request (0x06)
        Handle: 0x0014
        Error: Attribute Not Found (0x0a)
> HCI Event: Number of Completed Packets (0x13) plen 5                                                               #63 6.703824
        Num handles: 1
        Handle: 75 Address: DF:A9:FF:F6:B1:1A (OUI DF-A9-FF)
        Count: 1
        #62: len 9 (0 Kb/s)
        Latency: 166 msec (166-171 msec ~168 msec)
> ACL Data RX: Handle 75 flags 0x02 dlen 11                                                                          #64 6.704093
      ATT: Read By Type Request (0x08) len 6
        Handle range: 0x000b-0x0013
        Attribute type: Characteristic (0x2803)
zephyr.exe[1453948]: < HCI Command: Host Number of Completed Packets (0x03|0x0035) plen 5                            #65 6.717783
        Num handles: 1
        Handle: 75 Address: DF:A9:FF:F6:B1:1A (OUI DF-A9-FF)
        Count: 1
zephyr.exe[1453948]: < ACL Data TX: Handle 75 flags 0x00 dlen 20                                                     #66 6.717866
      ATT: Read By Type Response (0x09) len 15
        Attribute data length: 7
        Attribute data list: 2 entries
        Handle: 0x000c
        Value: 0a0d00002a
            Properties: 0x0a
              Read (0x02)
              Write (0x08)
            Value Handle: 0x000d
            Value UUID: Device Name (0x2a00)
        Handle: 0x000e
        Value: 0a0f00012a
            Properties: 0x0a
              Read (0x02)
              Write (0x08)
            Value Handle: 0x000f
            Value UUID: Appearance (0x2a01)
> HCI Event: Number of Completed Packets (0x13) plen 5                                                               #67 6.878848
        Num handles: 1
        Handle: 75 Address: DF:A9:FF:F6:B1:1A (OUI DF-A9-FF)
        Count: 1
        #66: len 20 (1 Kb/s)
        Latency: 160 msec (160-171 msec ~164 msec)
> ACL Data RX: Handle 75 flags 0x02 dlen 11                                                                          #68 6.879049
      ATT: Read By Type Request (0x08) len 6
        Handle range: 0x000f-0x0013
        Attribute type: Characteristic (0x2803)
zephyr.exe[1453948]: < HCI Command: Host Number of Completed Packets (0x03|0x0035) plen 5                            #69 6.897362
        Num handles: 1
        Handle: 75 Address: DF:A9:FF:F6:B1:1A (OUI DF-A9-FF)
        Count: 1
zephyr.exe[1453948]: < ACL Data TX: Handle 75 flags 0x00 dlen 20                                                     #70 6.897434
      ATT: Read By Type Response (0x09) len 15
        Attribute data length: 7
        Attribute data list: 2 entries
        Handle: 0x0010
        Value: 021100a62a
            Properties: 0x02
              Read (0x02)
            Value Handle: 0x0011
            Value UUID: Central Address Resolution (0x2aa6)
        Handle: 0x0012
        Value: 021300042a
            Properties: 0x02
              Read (0x02)
            Value Handle: 0x0013
            Value UUID: Peripheral Preferred Connection Parameters (0x2a04)
> HCI Event: Number of Completed Packets (0x13) plen 5                                                               #71 7.053828
        Num handles: 1
        Handle: 75 Address: DF:A9:FF:F6:B1:1A (OUI DF-A9-FF)
        Count: 1
        #70: len 20 (1 Kb/s)
        Latency: 156 msec (156-171 msec ~160 msec)
> ACL Data RX: Handle 75 flags 0x02 dlen 11                                                                          #72 7.054088
      ATT: Read By Type Request (0x08) len 6
        Handle range: 0x0013-0x0013
        Attribute type: Characteristic (0x2803)
zephyr.exe[1453948]: < HCI Command: Host Number of Completed Packets (0x03|0x0035) plen 5                            #73 7.057456
        Num handles: 1
        Handle: 75 Address: DF:A9:FF:F6:B1:1A (OUI DF-A9-FF)
        Count: 1
zephyr.exe[1453948]: < ACL Data TX: Handle 75 flags 0x00 dlen 9                                                      #74 7.057495
      ATT: Error Response (0x01) len 4
        Read By Type Request (0x08)
        Handle: 0x0013
        Error: Attribute Not Found (0x0a)
> HCI Event: Number of Completed Packets (0x13) plen 5                                                               #75 7.228830
        Num handles: 1
        Handle: 75 Address: DF:A9:FF:F6:B1:1A (OUI DF-A9-FF)
        Count: 1
        #74: len 9 (0 Kb/s)
        Latency: 171 msec (156-171 msec ~165 msec)
> ACL Data RX: Handle 75 flags 0x02 dlen 11                                                                          #76 7.229088
      SMP: Pairing Request (0x01) len 6
        IO capability: KeyboardDisplay (0x04)
        OOB data: Authentication data not present (0x00)
        Authentication requirement: Bonding, MITM, SC, No Keypresses (0x0d)
        Max encryption key size: 7
        Initiator key distribution: IdKey (0x02)
        Responder key distribution: IdKey (0x02)
zephyr.exe[1453948]: < HCI Command: Host Number of Completed Packets (0x03|0x0035) plen 5                            #77 7.237676
        Num handles: 1
        Handle: 75 Address: DF:A9:FF:F6:B1:1A (OUI DF-A9-FF)
        Count: 1
zephyr.exe[1453948]: < ACL Data TX: Handle 75 flags 0x00 dlen 6                                                      #78 7.237799
      SMP: Pairing Failed (0x05) len 1
        Reason: Encryption key size (0x06)
> HCI Event: Number of Completed Packets (0x13) plen 5                                                               #79 7.403812
        Num handles: 1
        Handle: 75 Address: DF:A9:FF:F6:B1:1A (OUI DF-A9-FF)
        Count: 1
        #78: len 6 (0 Kb/s)
        Latency: 166 msec (156-171 msec ~165 msec)
> HCI Event: Disconnect Complete (0x05) plen 4                                                                       #80 7.491506
        Status: Success (0x00)
        Handle: 75 Address: DF:A9:FF:F6:B1:1A (OUI DF-A9-FF)
        Reason: Remote User Terminated Connection (0x13)
zephyr.exe[1453948]: < HCI Command: LE Set Extended Advertising Parameters (0x08|0x0036) plen 25                     #81 8.607102
        Handle: 0x00
        Properties: 0x0013
          Connectable
          Scannable
          Use legacy advertising PDUs: ADV_IND
        Min advertising interval: 100.000 msec (0x00a0)
        Max advertising interval: 150.000 msec (0x00f0)
        Channel map: 37, 38, 39 (0x07)
        Own address type: Random (0x01)
        Peer address type: Public (0x00)
        Peer address: 00:00:00:00:00:00 (OUI 00-00-00)
        Filter policy: Allow Scan Request from Any, Allow Connect Request from Any (0x00)
        TX power: Host has no preference (0x7f)
        Primary PHY: LE 1M (0x01)
        Secondary max skip: 0x00
        Secondary PHY: LE 1M (0x01)
        SID: 0x00
        Scan request notifications: Disabled (0x00)
> HCI Event: Command Complete (0x0e) plen 5                                                                          #82 8.607956
      LE Set Extended Advertising Parameters (0x08|0x0036) ncmd 1
        Status: Success (0x00)
        TX power (selected): 0 dbm (0x00)
zephyr.exe[1453948]: < HCI Command: LE Set Advertising Set Random Address (0x08|0x0035) plen 7                       #83 8.616970
        Advertising handle: 0x00
        Advertising random address: 48:61:8E:DB:C6:F9 (Resolvable)
> HCI Event: Command Complete (0x0e) plen 4                                                                          #84 8.617521
      LE Set Advertising Set Random Address (0x08|0x0035) ncmd 1
        Status: Success (0x00)
zephyr.exe[1453948]: < HCI Command: LE Set Extended Advertising Data (0x08|0x0037) plen 22                           #85 8.637008
        Handle: 0x00
        Operation: Complete extended advertising data (0x03)
        Fragment preference: Minimize fragmentation (0x01)
        Data length: 0x12
        Flags: 0x04
          BR/EDR Not Supported
        Name (complete): Tester_F6B11A
> HCI Event: Command Complete (0x0e) plen 4                                                                          #86 8.637740
      LE Set Extended Advertising Data (0x08|0x0037) ncmd 1
        Status: Success (0x00)
zephyr.exe[1453948]: < HCI Command: LE Set Extended Scan Response Data (0x08|0x0038) plen 4                          #87 8.657019
        Handle: 0x00
        Operation: Complete scan response data (0x03)
        Fragment preference: Minimize fragmentation (0x01)
        Data length: 0x00
> HCI Event: Command Complete (0x0e) plen 4                                                                          #88 8.657561
      LE Set Extended Scan Response Data (0x08|0x0038) ncmd 1
        Status: Success (0x00)
zephyr.exe[1453948]: < HCI Command: LE Set Extended Advertising Enable (0x08|0x0039) plen 6                          #89 8.677049
        Extended advertising: Enabled (0x01)
        Number of sets: 1 (0x01)
        Entry 0
          Handle: 0x00
          Duration: 0 ms (0x00)
          Max ext adv events: 0
> HCI Event: Command Complete (0x0e) plen 4                                                                          #90 8.677826
      LE Set Extended Advertising Enable (0x08|0x0039) ncmd 1
        Status: Success (0x00)
> HCI Event: LE Meta Event (0x3e) plen 31                                                                            #91 9.094657
      LE Enhanced Connection Complete (0x0a)
        Status: Success (0x00)
        Handle: 93
        Role: Peripheral (0x01)
        Peer address type: Public (0x00)
        Peer address: DF:A9:FF:F6:B1:1A (OUI DF-A9-FF)
        Local resolvable private address: 00:00:00:00:00:00 (Non-Resolvable)
        Peer resolvable private address: 00:00:00:00:00:00 (Non-Resolvable)
        Connection interval: 87.50 msec (0x0046)
        Connection latency: 0 (0x0000)
        Supervision timeout: 20000 msec (0x07d0)
        Central clock accuracy: 0x01
> HCI Event: LE Meta Event (0x3e) plen 6                                                                             #92 9.094746
      LE Advertising Set Terminated (0x12)
        Status: Success (0x00)
        Handle: 0
        Connection handle: 93
        Number of completed extended advertising events: 0
zephyr.exe[1453948]: < HCI Command: LE Read Remote Used Features (0x08|0x0016) plen 2                                #93 9.097520
        Handle: 93 Address: DF:A9:FF:F6:B1:1A (OUI DF-A9-FF)
> HCI Event: Command Status (0x0f) plen 4                                                                            #94 9.097976
      LE Read Remote Used Features (0x08|0x0016) ncmd 1
        Status: Success (0x00)
> HCI Event: LE Meta Event (0x3e) plen 12                                                                            #95 9.358426
      LE Read Remote Used Features (0x04)
        Status: Success (0x00)
        Handle: 93 Address: DF:A9:FF:F6:B1:1A (OUI DF-A9-FF)
        Features: 0x2d 0x49 0x00 0xf7 0x67 0xd8 0x00 0x00
          LE Encryption
          Extended Reject Indication
          Peripheral-initiated Features Exchange
          LE Data Packet Length Extension
          LE 2M PHY
          LE Coded PHY
          Channel Selection Algorithm #2
          Periodic Advertising Sync Transfer - Sender
          Periodic Advertising Sync Transfer - Recipient
          Sleep Clock Accuracy Updates
          Connected Isochronous Stream - Central
          Connected Isochronous Stream - Peripheral
          Isochronous Broadcaster
          Synchronized Receiver
          Connected Isochronous Stream (Host Support)
          LE Power Control Request
          LE Power Control Request
          Connection Subrating
          Connection Subrating (Host Support)
          Unknown features (0x0000d80000000000)
> ACL Data RX: Handle 93 flags 0x02 dlen 11                                                                          #96 9.795694
      SMP: Pairing Request (0x01) len 6
        IO capability: KeyboardDisplay (0x04)
        OOB data: Authentication data not present (0x00)
        Authentication requirement: Bonding, MITM, SC, No Keypresses (0x0d)
        Max encryption key size: 8
        Initiator key distribution: IdKey (0x02)
        Responder key distribution: IdKey (0x02)
zephyr.exe[1453948]: < HCI Command: Host Number of Completed Packets (0x03|0x0035) plen 5                            #97 9.797580
        Num handles: 1
        Handle: 93 Address: DF:A9:FF:F6:B1:1A (OUI DF-A9-FF)
        Count: 1
zephyr.exe[1453948]: < ACL Data TX: Handle 93 flags 0x00 dlen 6                                                      #98 9.797840
      SMP: Pairing Failed (0x05) len 1
        Reason: Encryption key size (0x06)
> HCI Event: Number of Completed Packets (0x13) plen 5                                                               #99 9.970555
        Num handles: 1
        Handle: 93 Address: DF:A9:FF:F6:B1:1A (OUI DF-A9-FF)
        Count: 1
        #98: len 6 (0 Kb/s)
        Latency: 172 msec (172-172 msec ~172 msec)
> HCI Event: Disconnect Complete (0x05) plen 4                                                                     #100 10.058259
        Status: Success (0x00)
        Handle: 93 Address: DF:A9:FF:F6:B1:1A (OUI DF-A9-FF)
        Reason: Remote User Terminated Connection (0x13)
zephyr.exe[1453948]: < HCI Command: LE Set Extended Advertising Parameters (0x08|0x0036) plen 25                   #101 10.707116
        Handle: 0x00
        Properties: 0x0013
          Connectable
          Scannable
          Use legacy advertising PDUs: ADV_IND
        Min advertising interval: 100.000 msec (0x00a0)
        Max advertising interval: 150.000 msec (0x00f0)
        Channel map: 37, 38, 39 (0x07)
        Own address type: Random (0x01)
        Peer address type: Public (0x00)
        Peer address: 00:00:00:00:00:00 (OUI 00-00-00)
        Filter policy: Allow Scan Request from Any, Allow Connect Request from Any (0x00)
        TX power: Host has no preference (0x7f)
        Primary PHY: LE 1M (0x01)
        Secondary max skip: 0x00
        Secondary PHY: LE 1M (0x01)
        SID: 0x00
        Scan request notifications: Disabled (0x00)
> HCI Event: Command Complete (0x0e) plen 5                                                                        #102 10.707891
      LE Set Extended Advertising Parameters (0x08|0x0036) ncmd 1
        Status: Success (0x00)
        TX power (selected): 0 dbm (0x00)
zephyr.exe[1453948]: < HCI Command: LE Set Advertising Set Random Address (0x08|0x0035) plen 7                     #103 10.717043
        Advertising handle: 0x00
        Advertising random address: 48:61:8E:DB:C6:F9 (Resolvable)
> HCI Event: Command Complete (0x0e) plen 4                                                                        #104 10.717601
      LE Set Advertising Set Random Address (0x08|0x0035) ncmd 1
        Status: Success (0x00)
zephyr.exe[1453948]: < HCI Command: LE Set Extended Advertising Data (0x08|0x0037) plen 22                         #105 10.737030
        Handle: 0x00
        Operation: Complete extended advertising data (0x03)
        Fragment preference: Minimize fragmentation (0x01)
        Data length: 0x12
        Flags: 0x04
          BR/EDR Not Supported
        Name (complete): Tester_F6B11A
> HCI Event: Command Complete (0x0e) plen 4                                                                        #106 10.737721
      LE Set Extended Advertising Data (0x08|0x0037) ncmd 1
        Status: Success (0x00)
zephyr.exe[1453948]: < HCI Command: LE Set Extended Scan Response Data (0x08|0x0038) plen 4                        #107 10.757019
        Handle: 0x00
        Operation: Complete scan response data (0x03)
        Fragment preference: Minimize fragmentation (0x01)
        Data length: 0x00
> HCI Event: Command Complete (0x0e) plen 4                                                                        #108 10.757601
      LE Set Extended Scan Response Data (0x08|0x0038) ncmd 1
        Status: Success (0x00)
zephyr.exe[1453948]: < HCI Command: LE Set Extended Advertising Enable (0x08|0x0039) plen 6                        #109 10.777046
        Extended advertising: Enabled (0x01)
        Number of sets: 1 (0x01)
        Entry 0
          Handle: 0x00
          Duration: 0 ms (0x00)
          Max ext adv events: 0
> HCI Event: Command Complete (0x0e) plen 4                                                                        #110 10.777632
      LE Set Extended Advertising Enable (0x08|0x0039) ncmd 1
        Status: Success (0x00)
> HCI Event: LE Meta Event (0x3e) plen 31                                                                          #111 11.088212
      LE Enhanced Connection Complete (0x0a)
        Status: Success (0x00)
        Handle: 111
        Role: Peripheral (0x01)
        Peer address type: Public (0x00)
        Peer address: DF:A9:FF:F6:B1:1A (OUI DF-A9-FF)
        Local resolvable private address: 00:00:00:00:00:00 (Non-Resolvable)
        Peer resolvable private address: 00:00:00:00:00:00 (Non-Resolvable)
        Connection interval: 87.50 msec (0x0046)
        Connection latency: 0 (0x0000)
        Supervision timeout: 20000 msec (0x07d0)
        Central clock accuracy: 0x01
> HCI Event: LE Meta Event (0x3e) plen 6                                                                           #112 11.088383
      LE Advertising Set Terminated (0x12)
        Status: Success (0x00)
        Handle: 0
        Connection handle: 111
        Number of completed extended advertising events: 0
zephyr.exe[1453948]: < HCI Command: LE Read Remote Used Features (0x08|0x0016) plen 2                              #113 11.097983
        Handle: 111 Address: DF:A9:FF:F6:B1:1A (OUI DF-A9-FF)
> HCI Event: Command Status (0x0f) plen 4                                                                          #114 11.098402
      LE Read Remote Used Features (0x08|0x0016) ncmd 1
        Status: Success (0x00)
> HCI Event: LE Meta Event (0x3e) plen 12                                                                          #115 11.352091
      LE Read Remote Used Features (0x04)
        Status: Success (0x00)
        Handle: 111 Address: DF:A9:FF:F6:B1:1A (OUI DF-A9-FF)
        Features: 0x2d 0x49 0x00 0xf7 0x67 0xd8 0x00 0x00
          LE Encryption
          Extended Reject Indication
          Peripheral-initiated Features Exchange
          LE Data Packet Length Extension
          LE 2M PHY
          LE Coded PHY
          Channel Selection Algorithm #2
          Periodic Advertising Sync Transfer - Sender
          Periodic Advertising Sync Transfer - Recipient
          Sleep Clock Accuracy Updates
          Connected Isochronous Stream - Central
          Connected Isochronous Stream - Peripheral
          Isochronous Broadcaster
          Synchronized Receiver
          Connected Isochronous Stream (Host Support)
          LE Power Control Request
          LE Power Control Request
          Connection Subrating
          Connection Subrating (Host Support)
          Unknown features (0x0000d80000000000)
> ACL Data RX: Handle 111 flags 0x02 dlen 11                                                                       #116 11.789347
      SMP: Pairing Request (0x01) len 6
        IO capability: KeyboardDisplay (0x04)
        OOB data: Authentication data not present (0x00)
        Authentication requirement: Bonding, MITM, SC, No Keypresses (0x0d)
        Max encryption key size: 9
        Initiator key distribution: IdKey (0x02)
        Responder key distribution: IdKey (0x02)
zephyr.exe[1453948]: < HCI Command: Host Number of Completed Packets (0x03|0x0035) plen 5                          #117 11.797188
        Num handles: 1
        Handle: 111 Address: DF:A9:FF:F6:B1:1A (OUI DF-A9-FF)
        Count: 1
zephyr.exe[1453948]: < ACL Data TX: Handle 111 flags 0x00 dlen 6                                                   #118 11.797304
      SMP: Pairing Failed (0x05) len 1
        Reason: Encryption key size (0x06)
> HCI Event: Number of Completed Packets (0x13) plen 5                                                             #119 11.964253
        Num handles: 1
        Handle: 111 Address: DF:A9:FF:F6:B1:1A (OUI DF-A9-FF)
        Count: 1
        #118: len 6 (0 Kb/s)
        Latency: 166 msec (166-166 msec ~166 msec)
> HCI Event: Disconnect Complete (0x05) plen 4                                                                     #120 12.051964
        Status: Success (0x00)
        Handle: 111 Address: DF:A9:FF:F6:B1:1A (OUI DF-A9-FF)
        Reason: Remote User Terminated Connection (0x13)
zephyr.exe[1453948]: < HCI Command: LE Set Extended Advertising Parameters (0x08|0x0036) plen 25                   #121 12.807282
        Handle: 0x00
        Properties: 0x0013
          Connectable
          Scannable
          Use legacy advertising PDUs: ADV_IND
        Min advertising interval: 100.000 msec (0x00a0)
        Max advertising interval: 150.000 msec (0x00f0)
        Channel map: 37, 38, 39 (0x07)
        Own address type: Random (0x01)
        Peer address type: Public (0x00)
        Peer address: 00:00:00:00:00:00 (OUI 00-00-00)
        Filter policy: Allow Scan Request from Any, Allow Connect Request from Any (0x00)
        TX power: Host has no preference (0x7f)
        Primary PHY: LE 1M (0x01)
        Secondary max skip: 0x00
        Secondary PHY: LE 1M (0x01)
        SID: 0x00
        Scan request notifications: Disabled (0x00)
> HCI Event: Command Complete (0x0e) plen 5                                                                        #122 12.807995
      LE Set Extended Advertising Parameters (0x08|0x0036) ncmd 1
        Status: Success (0x00)
        TX power (selected): 0 dbm (0x00)
zephyr.exe[1453948]: < HCI Command: LE Set Advertising Set Random Address (0x08|0x0035) plen 7                     #123 12.817120
        Advertising handle: 0x00
        Advertising random address: 48:61:8E:DB:C6:F9 (Resolvable)
> HCI Event: Command Complete (0x0e) plen 4                                                                        #124 12.817749
      LE Set Advertising Set Random Address (0x08|0x0035) ncmd 1
        Status: Success (0x00)
zephyr.exe[1453948]: < HCI Command: LE Set Extended Advertising Data (0x08|0x0037) plen 22                         #125 12.837074
        Handle: 0x00
        Operation: Complete extended advertising data (0x03)
        Fragment preference: Minimize fragmentation (0x01)
        Data length: 0x12
        Flags: 0x04
          BR/EDR Not Supported
        Name (complete): Tester_F6B11A
> HCI Event: Command Complete (0x0e) plen 4                                                                        #126 12.837832
      LE Set Extended Advertising Data (0x08|0x0037) ncmd 1
        Status: Success (0x00)
zephyr.exe[1453948]: < HCI Command: LE Set Extended Scan Response Data (0x08|0x0038) plen 4                        #127 12.857070
        Handle: 0x00
        Operation: Complete scan response data (0x03)
        Fragment preference: Minimize fragmentation (0x01)
        Data length: 0x00
> HCI Event: Command Complete (0x0e) plen 4                                                                        #128 12.857582
      LE Set Extended Scan Response Data (0x08|0x0038) ncmd 1
        Status: Success (0x00)
zephyr.exe[1453948]: < HCI Command: LE Set Extended Advertising Enable (0x08|0x0039) plen 6                        #129 12.877053
        Extended advertising: Enabled (0x01)
        Number of sets: 1 (0x01)
        Entry 0
          Handle: 0x00
          Duration: 0 ms (0x00)
          Max ext adv events: 0
> HCI Event: Command Complete (0x0e) plen 4                                                                        #130 12.877611
      LE Set Extended Advertising Enable (0x08|0x0039) ncmd 1
        Status: Success (0x00)
> HCI Event: LE Meta Event (0x3e) plen 31                                                                          #131 12.996424
      LE Enhanced Connection Complete (0x0a)
        Status: Success (0x00)
        Handle: 129
        Role: Peripheral (0x01)
        Peer address type: Public (0x00)
        Peer address: DF:A9:FF:F6:B1:1A (OUI DF-A9-FF)
        Local resolvable private address: 00:00:00:00:00:00 (Non-Resolvable)
        Peer resolvable private address: 00:00:00:00:00:00 (Non-Resolvable)
        Connection interval: 87.50 msec (0x0046)
        Connection latency: 0 (0x0000)
        Supervision timeout: 20000 msec (0x07d0)
        Central clock accuracy: 0x01
> HCI Event: LE Meta Event (0x3e) plen 6                                                                           #132 12.996427
      LE Advertising Set Terminated (0x12)
        Status: Success (0x00)
        Handle: 0
        Connection handle: 129
        Number of completed extended advertising events: 0
zephyr.exe[1453948]: < HCI Command: LE Read Remote Used Features (0x08|0x0016) plen 2                              #133 12.997231
        Handle: 129 Address: DF:A9:FF:F6:B1:1A (OUI DF-A9-FF)
> HCI Event: Command Status (0x0f) plen 4                                                                          #134 12.997686
      LE Read Remote Used Features (0x08|0x0016) ncmd 1
        Status: Success (0x00)
> HCI Event: LE Meta Event (0x3e) plen 12                                                                          #135 13.260300
      LE Read Remote Used Features (0x04)
        Status: Success (0x00)
        Handle: 129 Address: DF:A9:FF:F6:B1:1A (OUI DF-A9-FF)
        Features: 0x2d 0x49 0x00 0xf7 0x67 0xd8 0x00 0x00
          LE Encryption
          Extended Reject Indication
          Peripheral-initiated Features Exchange
          LE Data Packet Length Extension
          LE 2M PHY
          LE Coded PHY
          Channel Selection Algorithm #2
          Periodic Advertising Sync Transfer - Sender
          Periodic Advertising Sync Transfer - Recipient
          Sleep Clock Accuracy Updates
          Connected Isochronous Stream - Central
          Connected Isochronous Stream - Peripheral
          Isochronous Broadcaster
          Synchronized Receiver
          Connected Isochronous Stream (Host Support)
          LE Power Control Request
          LE Power Control Request
          Connection Subrating
          Connection Subrating (Host Support)
          Unknown features (0x0000d80000000000)
> ACL Data RX: Handle 129 flags 0x02 dlen 11                                                                       #136 13.697559
      SMP: Pairing Request (0x01) len 6
        IO capability: KeyboardDisplay (0x04)
        OOB data: Authentication data not present (0x00)
        Authentication requirement: Bonding, MITM, SC, No Keypresses (0x0d)
        Max encryption key size: 10
        Initiator key distribution: IdKey (0x02)
        Responder key distribution: IdKey (0x02)
zephyr.exe[1453948]: < HCI Command: Host Number of Completed Packets (0x03|0x0035) plen 5                          #137 13.717489
        Num handles: 1
        Handle: 129 Address: DF:A9:FF:F6:B1:1A (OUI DF-A9-FF)
        Count: 1
zephyr.exe[1453948]: < ACL Data TX: Handle 129 flags 0x00 dlen 6                                                   #138 13.717660
      SMP: Pairing Failed (0x05) len 1
        Reason: Encryption key size (0x06)
> HCI Event: Number of Completed Packets (0x13) plen 5                                                             #139 13.872459
        Num handles: 1
        Handle: 129 Address: DF:A9:FF:F6:B1:1A (OUI DF-A9-FF)
        Count: 1
        #138: len 6 (0 Kb/s)
        Latency: 154 msec (154-154 msec ~154 msec)
> HCI Event: Disconnect Complete (0x05) plen 4                                                                     #140 13.960118
        Status: Success (0x00)
        Handle: 129 Address: DF:A9:FF:F6:B1:1A (OUI DF-A9-FF)
        Reason: Remote User Terminated Connection (0x13)
zephyr.exe[1453948]: < HCI Command: LE Set Extended Advertising Parameters (0x08|0x0036) plen 25                   #141 14.917117
        Handle: 0x00
        Properties: 0x0013
          Connectable
          Scannable
          Use legacy advertising PDUs: ADV_IND
        Min advertising interval: 100.000 msec (0x00a0)
        Max advertising interval: 150.000 msec (0x00f0)
        Channel map: 37, 38, 39 (0x07)
        Own address type: Random (0x01)
        Peer address type: Public (0x00)
        Peer address: 00:00:00:00:00:00 (OUI 00-00-00)
        Filter policy: Allow Scan Request from Any, Allow Connect Request from Any (0x00)
        TX power: Host has no preference (0x7f)
        Primary PHY: LE 1M (0x01)
        Secondary max skip: 0x00
        Secondary PHY: LE 1M (0x01)
        SID: 0x00
        Scan request notifications: Disabled (0x00)
> HCI Event: Command Complete (0x0e) plen 5                                                                        #142 14.918069
      LE Set Extended Advertising Parameters (0x08|0x0036) ncmd 1
        Status: Success (0x00)
        TX power (selected): 0 dbm (0x00)
zephyr.exe[1453948]: < HCI Command: LE Set Advertising Set Random Address (0x08|0x0035) plen 7                     #143 14.937063
        Advertising handle: 0x00
        Advertising random address: 48:61:8E:DB:C6:F9 (Resolvable)
> HCI Event: Command Complete (0x0e) plen 4                                                                        #144 14.937602
      LE Set Advertising Set Random Address (0x08|0x0035) ncmd 1
        Status: Success (0x00)
zephyr.exe[1453948]: < HCI Command: LE Set Extended Advertising Data (0x08|0x0037) plen 22                         #145 14.957058
        Handle: 0x00
        Operation: Complete extended advertising data (0x03)
        Fragment preference: Minimize fragmentation (0x01)
        Data length: 0x12
        Flags: 0x04
          BR/EDR Not Supported
        Name (complete): Tester_F6B11A
> HCI Event: Command Complete (0x0e) plen 4                                                                        #146 14.957732
      LE Set Extended Advertising Data (0x08|0x0037) ncmd 1
        Status: Success (0x00)
zephyr.exe[1453948]: < HCI Command: LE Set Extended Scan Response Data (0x08|0x0038) plen 4                        #147 14.977066
        Handle: 0x00
        Operation: Complete scan response data (0x03)
        Fragment preference: Minimize fragmentation (0x01)
        Data length: 0x00
> HCI Event: Command Complete (0x0e) plen 4                                                                        #148 14.977573
      LE Set Extended Scan Response Data (0x08|0x0038) ncmd 1
        Status: Success (0x00)
zephyr.exe[1453948]: < HCI Command: LE Set Extended Advertising Enable (0x08|0x0039) plen 6                        #149 14.997079
        Extended advertising: Enabled (0x01)
        Number of sets: 1 (0x01)
        Entry 0
          Handle: 0x00
          Duration: 0 ms (0x00)
          Max ext adv events: 0
> HCI Event: Command Complete (0x0e) plen 4                                                                        #150 14.997629
      LE Set Extended Advertising Enable (0x08|0x0039) ncmd 1
        Status: Success (0x00)
> HCI Event: LE Meta Event (0x3e) plen 31                                                                          #151 15.110572
      LE Enhanced Connection Complete (0x0a)
        Status: Success (0x00)
        Handle: 147
        Role: Peripheral (0x01)
        Peer address type: Public (0x00)
        Peer address: DF:A9:FF:F6:B1:1A (OUI DF-A9-FF)
        Local resolvable private address: 00:00:00:00:00:00 (Non-Resolvable)
        Peer resolvable private address: 00:00:00:00:00:00 (Non-Resolvable)
        Connection interval: 87.50 msec (0x0046)
        Connection latency: 0 (0x0000)
        Supervision timeout: 20000 msec (0x07d0)
        Central clock accuracy: 0x01
> HCI Event: LE Meta Event (0x3e) plen 6                                                                           #152 15.110755
      LE Advertising Set Terminated (0x12)
        Status: Success (0x00)
        Handle: 0
        Connection handle: 147
        Number of completed extended advertising events: 0
zephyr.exe[1453948]: < HCI Command: LE Read Remote Used Features (0x08|0x0016) plen 2                              #153 15.117962
        Handle: 147 Address: DF:A9:FF:F6:B1:1A (OUI DF-A9-FF)
> HCI Event: Command Status (0x0f) plen 4                                                                          #154 15.118427
      LE Read Remote Used Features (0x08|0x0016) ncmd 1
        Status: Success (0x00)
> HCI Event: LE Meta Event (0x3e) plen 12                                                                          #155 15.374570
      LE Read Remote Used Features (0x04)
        Status: Success (0x00)
        Handle: 147 Address: DF:A9:FF:F6:B1:1A (OUI DF-A9-FF)
        Features: 0x2d 0x49 0x00 0xf7 0x67 0xd8 0x00 0x00
          LE Encryption
          Extended Reject Indication
          Peripheral-initiated Features Exchange
          LE Data Packet Length Extension
          LE 2M PHY
          LE Coded PHY
          Channel Selection Algorithm #2
          Periodic Advertising Sync Transfer - Sender
          Periodic Advertising Sync Transfer - Recipient
          Sleep Clock Accuracy Updates
          Connected Isochronous Stream - Central
          Connected Isochronous Stream - Peripheral
          Isochronous Broadcaster
          Synchronized Receiver
          Connected Isochronous Stream (Host Support)
          LE Power Control Request
          LE Power Control Request
          Connection Subrating
          Connection Subrating (Host Support)
          Unknown features (0x0000d80000000000)
> ACL Data RX: Handle 147 flags 0x02 dlen 11                                                                       #156 15.811738
      SMP: Pairing Request (0x01) len 6
        IO capability: KeyboardDisplay (0x04)
        OOB data: Authentication data not present (0x00)
        Authentication requirement: Bonding, MITM, SC, No Keypresses (0x0d)
        Max encryption key size: 11
        Initiator key distribution: IdKey (0x02)
        Responder key distribution: IdKey (0x02)
zephyr.exe[1453948]: < HCI Command: Host Number of Completed Packets (0x03|0x0035) plen 5                          #157 15.817246
        Num handles: 1
        Handle: 147 Address: DF:A9:FF:F6:B1:1A (OUI DF-A9-FF)
        Count: 1
zephyr.exe[1453948]: < ACL Data TX: Handle 147 flags 0x00 dlen 6                                                   #158 15.817409
      SMP: Pairing Failed (0x05) len 1
        Reason: Encryption key size (0x06)
> HCI Event: Number of Completed Packets (0x13) plen 5                                                             #159 15.986601
        Num handles: 1
        Handle: 147 Address: DF:A9:FF:F6:B1:1A (OUI DF-A9-FF)
        Count: 1
        #158: len 6 (0 Kb/s)
        Latency: 169 msec (169-169 msec ~169 msec)
> HCI Event: Disconnect Complete (0x05) plen 4                                                                     #160 16.074347
        Status: Success (0x00)
        Handle: 147 Address: DF:A9:FF:F6:B1:1A (OUI DF-A9-FF)
        Reason: Remote User Terminated Connection (0x13)
zephyr.exe[1453948]: < HCI Command: LE Set Extended Advertising Parameters (0x08|0x0036) plen 25                   #161 17.037615
        Handle: 0x00
        Properties: 0x0013
          Connectable
          Scannable
          Use legacy advertising PDUs: ADV_IND
        Min advertising interval: 100.000 msec (0x00a0)
        Max advertising interval: 150.000 msec (0x00f0)
        Channel map: 37, 38, 39 (0x07)
        Own address type: Random (0x01)
        Peer address type: Public (0x00)
        Peer address: 00:00:00:00:00:00 (OUI 00-00-00)
        Filter policy: Allow Scan Request from Any, Allow Connect Request from Any (0x00)
        TX power: Host has no preference (0x7f)
        Primary PHY: LE 1M (0x01)
        Secondary max skip: 0x00
        Secondary PHY: LE 1M (0x01)
        SID: 0x00
        Scan request notifications: Disabled (0x00)
> HCI Event: Command Complete (0x0e) plen 5                                                                        #162 17.038469
      LE Set Extended Advertising Parameters (0x08|0x0036) ncmd 1
        Status: Success (0x00)
        TX power (selected): 0 dbm (0x00)
zephyr.exe[1453948]: < HCI Command: LE Set Advertising Set Random Address (0x08|0x0035) plen 7                     #163 17.057450
        Advertising handle: 0x00
        Advertising random address: 48:61:8E:DB:C6:F9 (Resolvable)
> HCI Event: Command Complete (0x0e) plen 4                                                                        #164 17.058014
      LE Set Advertising Set Random Address (0x08|0x0035) ncmd 1
        Status: Success (0x00)
zephyr.exe[1453948]: < HCI Command: LE Set Extended Advertising Data (0x08|0x0037) plen 22                         #165 17.077108
        Handle: 0x00
        Operation: Complete extended advertising data (0x03)
        Fragment preference: Minimize fragmentation (0x01)
        Data length: 0x12
        Flags: 0x04
          BR/EDR Not Supported
        Name (complete): Tester_F6B11A
> HCI Event: Command Complete (0x0e) plen 4                                                                        #166 17.077884
      LE Set Extended Advertising Data (0x08|0x0037) ncmd 1
        Status: Success (0x00)
zephyr.exe[1453948]: < HCI Command: LE Set Extended Scan Response Data (0x08|0x0038) plen 4                        #167 17.097121
        Handle: 0x00
        Operation: Complete scan response data (0x03)
        Fragment preference: Minimize fragmentation (0x01)
        Data length: 0x00
> HCI Event: Command Complete (0x0e) plen 4                                                                        #168 17.097630
      LE Set Extended Scan Response Data (0x08|0x0038) ncmd 1
        Status: Success (0x00)
zephyr.exe[1453948]: < HCI Command: LE Set Extended Advertising Enable (0x08|0x0039) plen 6                        #169 17.117077
        Extended advertising: Enabled (0x01)
        Number of sets: 1 (0x01)
        Entry 0
          Handle: 0x00
          Duration: 0 ms (0x00)
          Max ext adv events: 0
> HCI Event: Command Complete (0x0e) plen 4                                                                        #170 17.117600
      LE Set Extended Advertising Enable (0x08|0x0039) ncmd 1
        Status: Success (0x00)
> HCI Event: LE Meta Event (0x3e) plen 31                                                                          #171 17.540346
      LE Enhanced Connection Complete (0x0a)
        Status: Success (0x00)
        Handle: 165
        Role: Peripheral (0x01)
        Peer address type: Public (0x00)
        Peer address: DF:A9:FF:F6:B1:1A (OUI DF-A9-FF)
        Local resolvable private address: 00:00:00:00:00:00 (Non-Resolvable)
        Peer resolvable private address: 00:00:00:00:00:00 (Non-Resolvable)
        Connection interval: 87.50 msec (0x0046)
        Connection latency: 0 (0x0000)
        Supervision timeout: 20000 msec (0x07d0)
        Central clock accuracy: 0x01
> HCI Event: LE Meta Event (0x3e) plen 6                                                                           #172 17.540493
      LE Advertising Set Terminated (0x12)
        Status: Success (0x00)
        Handle: 0
        Connection handle: 165
        Number of completed extended advertising events: 0
zephyr.exe[1453948]: < HCI Command: LE Read Remote Used Features (0x08|0x0016) plen 2                              #173 17.558002
        Handle: 165 Address: DF:A9:FF:F6:B1:1A (OUI DF-A9-FF)
> HCI Event: Command Status (0x0f) plen 4                                                                          #174 17.558468
      LE Read Remote Used Features (0x08|0x0016) ncmd 1
        Status: Success (0x00)
> HCI Event: LE Meta Event (0x3e) plen 12                                                                          #175 17.804352
      LE Read Remote Used Features (0x04)
        Status: Success (0x00)
        Handle: 165 Address: DF:A9:FF:F6:B1:1A (OUI DF-A9-FF)
        Features: 0x2d 0x49 0x00 0xf7 0x67 0xd8 0x00 0x00
          LE Encryption
          Extended Reject Indication
          Peripheral-initiated Features Exchange
          LE Data Packet Length Extension
          LE 2M PHY
          LE Coded PHY
          Channel Selection Algorithm #2
          Periodic Advertising Sync Transfer - Sender
          Periodic Advertising Sync Transfer - Recipient
          Sleep Clock Accuracy Updates
          Connected Isochronous Stream - Central
          Connected Isochronous Stream - Peripheral
          Isochronous Broadcaster
          Synchronized Receiver
          Connected Isochronous Stream (Host Support)
          LE Power Control Request
          LE Power Control Request
          Connection Subrating
          Connection Subrating (Host Support)
          Unknown features (0x0000d80000000000)
> ACL Data RX: Handle 165 flags 0x02 dlen 11                                                                       #176 18.241562
      SMP: Pairing Request (0x01) len 6
        IO capability: KeyboardDisplay (0x04)
        OOB data: Authentication data not present (0x00)
        Authentication requirement: Bonding, MITM, SC, No Keypresses (0x0d)
        Max encryption key size: 12
        Initiator key distribution: IdKey (0x02)
        Responder key distribution: IdKey (0x02)
zephyr.exe[1453948]: < HCI Command: Host Number of Completed Packets (0x03|0x0035) plen 5                          #177 18.257596
        Num handles: 1
        Handle: 165 Address: DF:A9:FF:F6:B1:1A (OUI DF-A9-FF)
        Count: 1
zephyr.exe[1453948]: < ACL Data TX: Handle 165 flags 0x00 dlen 6                                                   #178 18.257785
      SMP: Pairing Failed (0x05) len 1
        Reason: Encryption key size (0x06)
> HCI Event: Number of Completed Packets (0x13) plen 5                                                             #179 18.416344
        Num handles: 1
        Handle: 165 Address: DF:A9:FF:F6:B1:1A (OUI DF-A9-FF)
        Count: 1
        #178: len 6 (0 Kb/s)
        Latency: 158 msec (158-158 msec ~158 msec)
> HCI Event: Disconnect Complete (0x05) plen 4                                                                     #180 18.504083
        Status: Success (0x00)
        Handle: 165 Address: DF:A9:FF:F6:B1:1A (OUI DF-A9-FF)
        Reason: Remote User Terminated Connection (0x13)
zephyr.exe[1453948]: < HCI Command: LE Set Extended Advertising Parameters (0x08|0x0036) plen 25                   #181 19.157710
        Handle: 0x00
        Properties: 0x0013
          Connectable
          Scannable
          Use legacy advertising PDUs: ADV_IND
        Min advertising interval: 100.000 msec (0x00a0)
        Max advertising interval: 150.000 msec (0x00f0)
        Channel map: 37, 38, 39 (0x07)
        Own address type: Random (0x01)
        Peer address type: Public (0x00)
        Peer address: 00:00:00:00:00:00 (OUI 00-00-00)
        Filter policy: Allow Scan Request from Any, Allow Connect Request from Any (0x00)
        TX power: Host has no preference (0x7f)
        Primary PHY: LE 1M (0x01)
        Secondary max skip: 0x00
        Secondary PHY: LE 1M (0x01)
        SID: 0x00
        Scan request notifications: Disabled (0x00)
> HCI Event: Command Complete (0x0e) plen 5                                                                        #182 19.158596
      LE Set Extended Advertising Parameters (0x08|0x0036) ncmd 1
        Status: Success (0x00)
        TX power (selected): 0 dbm (0x00)
zephyr.exe[1453948]: < HCI Command: LE Set Advertising Set Random Address (0x08|0x0035) plen 7                     #183 19.177199
        Advertising handle: 0x00
        Advertising random address: 48:61:8E:DB:C6:F9 (Resolvable)
> HCI Event: Command Complete (0x0e) plen 4                                                                        #184 19.177823
      LE Set Advertising Set Random Address (0x08|0x0035) ncmd 1
        Status: Success (0x00)
zephyr.exe[1453948]: < HCI Command: LE Set Extended Advertising Data (0x08|0x0037) plen 22                         #185 19.197121
        Handle: 0x00
        Operation: Complete extended advertising data (0x03)
        Fragment preference: Minimize fragmentation (0x01)
        Data length: 0x12
        Flags: 0x04
          BR/EDR Not Supported
        Name (complete): Tester_F6B11A
> HCI Event: Command Complete (0x0e) plen 4                                                                        #186 19.197789
      LE Set Extended Advertising Data (0x08|0x0037) ncmd 1
        Status: Success (0x00)
zephyr.exe[1453948]: < HCI Command: LE Set Extended Scan Response Data (0x08|0x0038) plen 4                        #187 19.217103
        Handle: 0x00
        Operation: Complete scan response data (0x03)
        Fragment preference: Minimize fragmentation (0x01)
        Data length: 0x00
> HCI Event: Command Complete (0x0e) plen 4                                                                        #188 19.217512
      LE Set Extended Scan Response Data (0x08|0x0038) ncmd 1
        Status: Success (0x00)
zephyr.exe[1453948]: < HCI Command: LE Set Extended Advertising Enable (0x08|0x0039) plen 6                        #189 19.237101
        Extended advertising: Enabled (0x01)
        Number of sets: 1 (0x01)
        Entry 0
          Handle: 0x00
          Duration: 0 ms (0x00)
          Max ext adv events: 0
> HCI Event: Command Complete (0x0e) plen 4                                                                        #190 19.237696
      LE Set Extended Advertising Enable (0x08|0x0039) ncmd 1
        Status: Success (0x00)
> HCI Event: LE Meta Event (0x3e) plen 31                                                                          #191 19.353192
      LE Enhanced Connection Complete (0x0a)
        Status: Success (0x00)
        Handle: 183
        Role: Peripheral (0x01)
        Peer address type: Public (0x00)
        Peer address: DF:A9:FF:F6:B1:1A (OUI DF-A9-FF)
        Local resolvable private address: 00:00:00:00:00:00 (Non-Resolvable)
        Peer resolvable private address: 00:00:00:00:00:00 (Non-Resolvable)
        Connection interval: 87.50 msec (0x0046)
        Connection latency: 0 (0x0000)
        Supervision timeout: 20000 msec (0x07d0)
        Central clock accuracy: 0x01
> HCI Event: LE Meta Event (0x3e) plen 6                                                                           #192 19.353403
      LE Advertising Set Terminated (0x12)
        Status: Success (0x00)
        Handle: 0
        Connection handle: 183
        Number of completed extended advertising events: 0
zephyr.exe[1453948]: < HCI Command: LE Read Remote Used Features (0x08|0x0016) plen 2                              #193 19.358003
        Handle: 183 Address: DF:A9:FF:F6:B1:1A (OUI DF-A9-FF)
> HCI Event: Command Status (0x0f) plen 4                                                                          #194 19.358486
      LE Read Remote Used Features (0x08|0x0016) ncmd 1
        Status: Success (0x00)
> HCI Event: LE Meta Event (0x3e) plen 12                                                                          #195 19.617083
      LE Read Remote Used Features (0x04)
        Status: Success (0x00)
        Handle: 183 Address: DF:A9:FF:F6:B1:1A (OUI DF-A9-FF)
        Features: 0x2d 0x49 0x00 0xf7 0x67 0xd8 0x00 0x00
          LE Encryption
          Extended Reject Indication
          Peripheral-initiated Features Exchange
          LE Data Packet Length Extension
          LE 2M PHY
          LE Coded PHY
          Channel Selection Algorithm #2
          Periodic Advertising Sync Transfer - Sender
          Periodic Advertising Sync Transfer - Recipient
          Sleep Clock Accuracy Updates
          Connected Isochronous Stream - Central
          Connected Isochronous Stream - Peripheral
          Isochronous Broadcaster
          Synchronized Receiver
          Connected Isochronous Stream (Host Support)
          LE Power Control Request
          LE Power Control Request
          Connection Subrating
          Connection Subrating (Host Support)
          Unknown features (0x0000d80000000000)
> ACL Data RX: Handle 183 flags 0x02 dlen 11                                                                       #196 20.054310
      SMP: Pairing Request (0x01) len 6
        IO capability: KeyboardDisplay (0x04)
        OOB data: Authentication data not present (0x00)
        Authentication requirement: Bonding, MITM, SC, No Keypresses (0x0d)
        Max encryption key size: 13
        Initiator key distribution: IdKey (0x02)
        Responder key distribution: IdKey (0x02)
zephyr.exe[1453948]: < HCI Command: Host Number of Completed Packets (0x03|0x0035) plen 5                          #197 20.057578
        Num handles: 1
        Handle: 183 Address: DF:A9:FF:F6:B1:1A (OUI DF-A9-FF)
        Count: 1
zephyr.exe[1453948]: < ACL Data TX: Handle 183 flags 0x00 dlen 6                                                   #198 20.057771
      SMP: Pairing Failed (0x05) len 1
        Reason: Encryption key size (0x06)
> HCI Event: Number of Completed Packets (0x13) plen 5                                                             #199 20.229194
        Num handles: 1
        Handle: 183 Address: DF:A9:FF:F6:B1:1A (OUI DF-A9-FF)
        Count: 1
        #198: len 6 (0 Kb/s)
        Latency: 171 msec (171-171 msec ~171 msec)
> HCI Event: Disconnect Complete (0x05) plen 4                                                                     #200 20.317005
        Status: Success (0x00)
        Handle: 183 Address: DF:A9:FF:F6:B1:1A (OUI DF-A9-FF)
        Reason: Remote User Terminated Connection (0x13)
zephyr.exe[1453948]: < HCI Command: LE Set Extended Advertising Parameters (0x08|0x0036) plen 25                   #201 21.267648
        Handle: 0x00
        Properties: 0x0013
          Connectable
          Scannable
          Use legacy advertising PDUs: ADV_IND
        Min advertising interval: 100.000 msec (0x00a0)
        Max advertising interval: 150.000 msec (0x00f0)
        Channel map: 37, 38, 39 (0x07)
        Own address type: Random (0x01)
        Peer address type: Public (0x00)
        Peer address: 00:00:00:00:00:00 (OUI 00-00-00)
        Filter policy: Allow Scan Request from Any, Allow Connect Request from Any (0x00)
        TX power: Host has no preference (0x7f)
        Primary PHY: LE 1M (0x01)
        Secondary max skip: 0x00
        Secondary PHY: LE 1M (0x01)
        SID: 0x00
        Scan request notifications: Disabled (0x00)
> HCI Event: Command Complete (0x0e) plen 5                                                                        #202 21.268433
      LE Set Extended Advertising Parameters (0x08|0x0036) ncmd 1
        Status: Success (0x00)
        TX power (selected): 0 dbm (0x00)
zephyr.exe[1453948]: < HCI Command: LE Set Advertising Set Random Address (0x08|0x0035) plen 7                     #203 21.277150
        Advertising handle: 0x00
        Advertising random address: 48:61:8E:DB:C6:F9 (Resolvable)
> HCI Event: Command Complete (0x0e) plen 4                                                                        #204 21.277624
      LE Set Advertising Set Random Address (0x08|0x0035) ncmd 1
        Status: Success (0x00)
zephyr.exe[1453948]: < HCI Command: LE Set Extended Advertising Data (0x08|0x0037) plen 22                         #205 21.297114
        Handle: 0x00
        Operation: Complete extended advertising data (0x03)
        Fragment preference: Minimize fragmentation (0x01)
        Data length: 0x12
        Flags: 0x04
          BR/EDR Not Supported
        Name (complete): Tester_F6B11A
> HCI Event: Command Complete (0x0e) plen 4                                                                        #206 21.297837
      LE Set Extended Advertising Data (0x08|0x0037) ncmd 1
        Status: Success (0x00)
zephyr.exe[1453948]: < HCI Command: LE Set Extended Scan Response Data (0x08|0x0038) plen 4                        #207 21.317167
        Handle: 0x00
        Operation: Complete scan response data (0x03)
        Fragment preference: Minimize fragmentation (0x01)
        Data length: 0x00
> HCI Event: Command Complete (0x0e) plen 4                                                                        #208 21.317658
      LE Set Extended Scan Response Data (0x08|0x0038) ncmd 1
        Status: Success (0x00)
zephyr.exe[1453948]: < HCI Command: LE Set Extended Advertising Enable (0x08|0x0039) plen 6                        #209 21.337142
        Extended advertising: Enabled (0x01)
        Number of sets: 1 (0x01)
        Entry 0
          Handle: 0x00
          Duration: 0 ms (0x00)
          Max ext adv events: 0
> HCI Event: Command Complete (0x0e) plen 4                                                                        #210 21.337793
      LE Set Extended Advertising Enable (0x08|0x0039) ncmd 1
        Status: Success (0x00)
> HCI Event: LE Meta Event (0x3e) plen 31                                                                          #211 21.551030
      LE Enhanced Connection Complete (0x0a)
        Status: Success (0x00)
        Handle: 201
        Role: Peripheral (0x01)
        Peer address type: Public (0x00)
        Peer address: DF:A9:FF:F6:B1:1A (OUI DF-A9-FF)
        Local resolvable private address: 00:00:00:00:00:00 (Non-Resolvable)
        Peer resolvable private address: 00:00:00:00:00:00 (Non-Resolvable)
        Connection interval: 87.50 msec (0x0046)
        Connection latency: 0 (0x0000)
        Supervision timeout: 20000 msec (0x07d0)
        Central clock accuracy: 0x01
> HCI Event: LE Meta Event (0x3e) plen 6                                                                           #212 21.551035
      LE Advertising Set Terminated (0x12)
        Status: Success (0x00)
        Handle: 0
        Connection handle: 201
        Number of completed extended advertising events: 0
zephyr.exe[1453948]: < HCI Command: LE Read Remote Used Features (0x08|0x0016) plen 2                              #213 21.558022
        Handle: 201 Address: DF:A9:FF:F6:B1:1A (OUI DF-A9-FF)
> HCI Event: Command Status (0x0f) plen 4                                                                          #214 21.558497
      LE Read Remote Used Features (0x08|0x0016) ncmd 1
        Status: Success (0x00)
> HCI Event: LE Meta Event (0x3e) plen 12                                                                          #215 21.814741
      LE Read Remote Used Features (0x04)
        Status: Success (0x00)
        Handle: 201 Address: DF:A9:FF:F6:B1:1A (OUI DF-A9-FF)
        Features: 0x2d 0x49 0x00 0xf7 0x67 0xd8 0x00 0x00
          LE Encryption
          Extended Reject Indication
          Peripheral-initiated Features Exchange
          LE Data Packet Length Extension
          LE 2M PHY
          LE Coded PHY
          Channel Selection Algorithm #2
          Periodic Advertising Sync Transfer - Sender
          Periodic Advertising Sync Transfer - Recipient
          Sleep Clock Accuracy Updates
          Connected Isochronous Stream - Central
          Connected Isochronous Stream - Peripheral
          Isochronous Broadcaster
          Synchronized Receiver
          Connected Isochronous Stream (Host Support)
          LE Power Control Request
          LE Power Control Request
          Connection Subrating
          Connection Subrating (Host Support)
          Unknown features (0x0000d80000000000)
> ACL Data RX: Handle 201 flags 0x02 dlen 11                                                                       #216 22.251940
      SMP: Pairing Request (0x01) len 6
        IO capability: KeyboardDisplay (0x04)
        OOB data: Authentication data not present (0x00)
        Authentication requirement: Bonding, MITM, SC, No Keypresses (0x0d)
        Max encryption key size: 14
        Initiator key distribution: IdKey (0x02)
        Responder key distribution: IdKey (0x02)
zephyr.exe[1453948]: < HCI Command: Host Number of Completed Packets (0x03|0x0035) plen 5                          #217 22.257609
        Num handles: 1
        Handle: 201 Address: DF:A9:FF:F6:B1:1A (OUI DF-A9-FF)
        Count: 1
zephyr.exe[1453948]: < ACL Data TX: Handle 201 flags 0x00 dlen 6                                                   #218 22.257791
      SMP: Pairing Failed (0x05) len 1
        Reason: Encryption key size (0x06)
> HCI Event: Number of Completed Packets (0x13) plen 5                                                             #219 22.426791
        Num handles: 1
        Handle: 201 Address: DF:A9:FF:F6:B1:1A (OUI DF-A9-FF)
        Count: 1
        #218: len 6 (0 Kb/s)
        Latency: 169 msec (169-169 msec ~169 msec)
> HCI Event: Disconnect Complete (0x05) plen 4                                                                     #220 22.514501
        Status: Success (0x00)
        Handle: 201 Address: DF:A9:FF:F6:B1:1A (OUI DF-A9-FF)
        Reason: Remote User Terminated Connection (0x13)
zephyr.exe[1453948]: < HCI Command: LE Set Extended Advertising Parameters (0x08|0x0036) plen 25                   #221 23.377739
        Handle: 0x00
        Properties: 0x0013
          Connectable
          Scannable
          Use legacy advertising PDUs: ADV_IND
        Min advertising interval: 100.000 msec (0x00a0)
        Max advertising interval: 150.000 msec (0x00f0)
        Channel map: 37, 38, 39 (0x07)
        Own address type: Random (0x01)
        Peer address type: Public (0x00)
        Peer address: 00:00:00:00:00:00 (OUI 00-00-00)
        Filter policy: Allow Scan Request from Any, Allow Connect Request from Any (0x00)
        TX power: Host has no preference (0x7f)
        Primary PHY: LE 1M (0x01)
        Secondary max skip: 0x00
        Secondary PHY: LE 1M (0x01)
        SID: 0x00
        Scan request notifications: Disabled (0x00)
> HCI Event: Command Complete (0x0e) plen 5                                                                        #222 23.378586
      LE Set Extended Advertising Parameters (0x08|0x0036) ncmd 1
        Status: Success (0x00)
        TX power (selected): 0 dbm (0x00)
zephyr.exe[1453948]: < HCI Command: LE Set Advertising Set Random Address (0x08|0x0035) plen 7                     #223 23.