Bluetooth monitor ver 5.72
= Note: Linux version 6.14.0-36-generic (x86_64)                       0.305543
= Note: Bluetooth subsystem version 2.22                               0.305546
= New Index: 00:00:00:00:00:00 (Primary,UART,hci1)              [hci1] 0.305546
= New Index: 48:5F:99:8E:E0:64 (Primary,USB,hci0)               [hci0] 0.305547
= Open Index: 00:00:00:00:00:00                                 [hci1] 0.478840
= Index Info: 00:00:00:00:00:00 (Nordic Semiconductor ASA)      [hci1] 0.478844
@ USER Open: main (privileged) version 2.22            {0x0001} [hci1] 0.478847
< HCI Command: Reset (0x03|0x0003) plen 0                    #1 [hci1] 0.479217
> HCI Event: Command Complete (0x0e) plen 4                  #2 [hci1] 0.479693
      Reset (0x03|0x0003) ncmd 1
        Status: Success (0x00)
< HCI Command: Read Local Supported... (0x04|0x0003) plen 0  #3 [hci1] 0.498833
> HCI Event: Command Complete (0x0e) plen 12                 #4 [hci1] 0.499327
      Read Local Supported Features (0x04|0x0003) ncmd 1
        Status: Success (0x00)
        Features: 0x00 0x00 0x00 0x00 0x60 0x00 0x00 0x00
          BR/EDR Not Supported
          LE Supported (Controller)
< HCI Command: Read Local Version In.. (0x04|0x0001) plen 0  #5 [hci1] 0.518843
> HCI Event: Command Complete (0x0e) plen 12                 #6 [hci1] 0.519413
      Read Local Version Information (0x04|0x0001) ncmd 1
        Status: Success (0x00)
        HCI version: Reserved (0x0f) - Revision 12393 (0x3069)
        LMP version: Reserved (0x0f) - Subversion 12393 (0x3069)
        Manufacturer: Nordic Semiconductor ASA (89)
< HCI Command: Read Local Supported... (0x04|0x0002) plen 0  #7 [hci1] 0.538845
> HCI Event: Command Complete (0x0e) plen 68                 #8 [hci1] 0.539901
      Read Local Supported Commands (0x04|0x0002) ncmd 1
        Status: Success (0x00)
        Commands: 119 entries
          Disconnect (Octet 0 - Bit 5)
          Read Remote Version Information (Octet 2 - Bit 7)
          Set Event Mask (Octet 5 - Bit 6)
          Reset (Octet 5 - Bit 7)
          Read Connection Accept Timeout (Octet 7 - Bit 2)
          Write Connection Accept Timeout (Octet 7 - Bit 3)
          Read Transmit Power Level (Octet 10 - Bit 2)
          Set Controller To Host Flow Control (Octet 10 - Bit 5)
          Host Buffer Size (Octet 10 - Bit 6)
          Host Number of Completed Packets (Octet 10 - Bit 7)
          Read Local Version Information (Octet 14 - Bit 3)
          Read Local Supported Features (Octet 14 - Bit 5)
          Read BD ADDR (Octet 15 - Bit 1)
          Read RSSI (Octet 15 - Bit 5)
          Set Event Mask Page 2 (Octet 22 - Bit 2)
          LE Set Event Mask (Octet 25 - Bit 0)
          LE Read Buffer Size (Octet 25 - Bit 1)
          LE Read Local Supported Features (Octet 25 - Bit 2)
          LE Set Random Address (Octet 25 - Bit 4)
          LE Set Advertising Parameters (Octet 25 - Bit 5)
          LE Read Advertising Channel TX Power (Octet 25 - Bit 6)
          LE Set Advertising Data (Octet 25 - Bit 7)
          LE Set Scan Response Data (Octet 26 - Bit 0)
          LE Set Advertise Enable (Octet 26 - Bit 1)
          LE Set Scan Parameters (Octet 26 - Bit 2)
          LE Set Scan Enable (Octet 26 - Bit 3)
          LE Create Connection (Octet 26 - Bit 4)
          LE Create Connection Cancel (Octet 26 - Bit 5)
          LE Read Accept List Size (Octet 26 - Bit 6)
          LE Clear Accept List (Octet 26 - Bit 7)
          LE Add Device To Accept List (Octet 27 - Bit 0)
          LE Remove Device From Accept List (Octet 27 - Bit 1)
          LE Connection Update (Octet 27 - Bit 2)
          LE Set Host Channel Classification (Octet 27 - Bit 3)
          LE Read Channel Map (Octet 27 - Bit 4)
          LE Read Remote Used Features (Octet 27 - Bit 5)
          LE Encrypt (Octet 27 - Bit 6)
          LE Rand (Octet 27 - Bit 7)
          LE Start Encryption (Octet 28 - Bit 0)
          LE Long Term Key Request Reply (Octet 28 - Bit 1)
          LE Long Term Key Request Neg Reply (Octet 28 - Bit 2)
          LE Read Supported States (Octet 28 - Bit 3)
          LE Receiver Test (Octet 28 - Bit 4)
          LE Transmitter Test (Octet 28 - Bit 5)
          LE Test End (Octet 28 - Bit 6)
          Read Authenticated Payload Timeout (Octet 32 - Bit 4)
          Write Authenticated Payload Timeout (Octet 32 - Bit 5)
          LE Set Data Length (Octet 33 - Bit 6)
          LE Read Suggested Default Data Length (Octet 33 - Bit 7)
          LE Write Suggested Default Data Length (Octet 34 - Bit 0)
          LE Add Device To Resolving List (Octet 34 - Bit 3)
          LE Remove Device From Resolving List (Octet 34 - Bit 4)
          LE Clear Resolving List (Octet 34 - Bit 5)
          LE Read Resolving List Size (Octet 34 - Bit 6)
          LE Set Address Resolution Enable (Octet 35 - Bit 1)
          LE Set Resolvable Private Address Timeout (Octet 35 - Bit 2)
          LE Read Maximum Data Length (Octet 35 - Bit 3)
          LE Read PHY (Octet 35 - Bit 4)
          LE Set Default PHY (Octet 35 - Bit 5)
          LE Set PHY (Octet 35 - Bit 6)
          LE Enhanced Receiver Test (Octet 35 - Bit 7)
          LE Enhanced Transmitter Test (Octet 36 - Bit 0)
          LE Set Advertising Set Random Address (Octet 36 - Bit 1)
          LE Set Extended Advertising Parameters (Octet 36 - Bit 2)
          LE Set Extended Advertising Data (Octet 36 - Bit 3)
          LE Set Extended Scan Response Data (Octet 36 - Bit 4)
          LE Set Extended Advertising Enable (Octet 36 - Bit 5)
          LE Read Maximum Advertising Data Length (Octet 36 - Bit 6)
          LE Read Number of Supported Advertising Sets (Octet 36 - Bit 7)
          LE Remove Advertising Set (Octet 37 - Bit 0)
          LE Clear Advertising Sets (Octet 37 - Bit 1)
          LE Set Periodic Advertising Parameters (Octet 37 - Bit 2)
          LE Set Periodic Advertising Data (Octet 37 - Bit 3)
          LE Set Periodic Advertising Enable (Octet 37 - Bit 4)
          LE Set Extended Scan Parameters (Octet 37 - Bit 5)
          LE Set Extended Scan Enable (Octet 37 - Bit 6)
          LE Extended Create Connection (Octet 37 - Bit 7)
          LE Periodic Advertising Create Sync (Octet 38 - Bit 0)
          LE Periodic Advertising Create Sync Cancel (Octet 38 - Bit 1)
          LE Periodic Advertising Terminate Sync (Octet 38 - Bit 2)
          LE Add Device To Periodic Advertiser List (Octet 38 - Bit 3)
          LE Remove Device From Periodic Advertiser List (Octet 38 - Bit 4)
          LE Clear Periodic Advertiser List (Octet 38 - Bit 5)
          LE Read Periodic Advertiser List Size (Octet 38 - Bit 6)
          LE Read Transmit Power (Octet 38 - Bit 7)
          LE Read RF Path Compensation (Octet 39 - Bit 0)
          LE Write RF Path Compensation (Octet 39 - Bit 1)
          LE Set Privacy Mode (Octet 39 - Bit 2)
          LE Periodic Advertising Receive Enable (Octet 40 - Bit 5)
          LE Periodic Advertising Sync Transfer (Octet 40 - Bit 6)
          LE Periodic Advertising Set Info Transfer (Octet 40 - Bit 7)
          LE Periodic Advertising Sync Transfer Parameters (Octet 41 - Bit 0)
          LE Set Default Periodic Advertisng Sync Transfer Parameters (Octet 41 - Bit 1)
          LE Read Buffer v2 (Octet 41 - Bit 5)
          LE Read ISO TX Sync (Octet 41 - Bit 6)
          LE Set Connected Isochronous Group Parameters (Octet 41 - Bit 7)
          LE Set Connected Isochronous Group Parameters Test (Octet 42 - Bit 0)
          LE Create Connected Isochronous Stream (Octet 42 - Bit 1)
          LE Remove Connected Isochronous Group (Octet 42 - Bit 2)
          LE Accept Connected Isochronous Stream Request (Octet 42 - Bit 3)
          LE Reject Connected Isochronous Stream Request (Octet 42 - Bit 4)
          LE Create Broadcast Isochronous Group (Octet 42 - Bit 5)
          LE Create Broadcast Isochronous Group Test (Octet 42 - Bit 6)
          LE Terminate Broadcast Isochronous Group (Octet 42 - Bit 7)
          LE Broadcast Isochronous Group Create Sync (Octet 43 - Bit 0)
          LE Broadcast Isochronous Group Terminate Sync (Octet 43 - Bit 1)
          LE Request Peer SCA (Octet 43 - Bit 2)
          LE Setup Isochronous Data Path (Octet 43 - Bit 3)
          LE Remove Isochronous Data Path (Octet 43 - Bit 4)
          LE Isochronous Transmit Test (Octet 43 - Bit 5)
          LE Isochronous Receive Test (Octet 43 - Bit 6)
          LE Isochronous Read Test Counters (Octet 43 - Bit 7)
          LE Isochronous Read Test Counters (Octet 44 - Bit 0)
          LE Set Host Feature (Octet 44 - Bit 1)
          Octet 44 - Bit 2 
          Octet 45 - Bit 6 
          Octet 46 - Bit 0 
          Octet 46 - Bit 1 
          Octet 46 - Bit 2 
< HCI Command: Host Buffer Size (0x03|0x0033) plen 7         #9 [hci1] 0.558834
        ACL MTU: 255  ACL max packet: 16
        SCO MTU: 0    SCO max packet: 0
> HCI Event: Command Complete (0x0e) plen 4                 #10 [hci1] 0.559342
      Host Buffer Size (0x03|0x0033) ncmd 1
        Status: Success (0x00)
< HCI Command: Set Controller To Ho.. (0x03|0x0031) plen 1  #11 [hci1] 0.578838
        Flow control: ACL Data Packets (0x01)
> HCI Event: Command Complete (0x0e) plen 4                 #12 [hci1] 0.579330
      Set Controller To Host Flow Control (0x03|0x0031) ncmd 1
        Status: Success (0x00)
< HCI Command: LE Read Local Suppor.. (0x08|0x0003) plen 0  #13 [hci1] 0.598750
> HCI Event: Command Complete (0x0e) plen 12                #14 [hci1] 0.599196
      LE Read Local Supported Features (0x08|0x0003) ncmd 1
        Status: Success (0x00)
        Features: 0xfd 0x79 0x00 0xf7 0x30 0x01 0x00 0x00
          LE Encryption
          Extended Reject Indication
          Peripheral-initiated Features Exchange
          LE Ping
          LE Data Packet Length Extension
          LL Privacy
          Extended Scanner Filter Policies
          LE 2M PHY
          LE Coded PHY
          LE Extended Advertising
          LE Periodic Advertising
          Channel Selection Algorithm #2
          Periodic Advertising Sync Transfer - Sender
          Periodic Advertising Sync Transfer - Recipient
          Sleep Clock Accuracy Updates
          Connected Isochronous Stream - Central
          Connected Isochronous Stream - Peripheral
          Isochronous Broadcaster
          Synchronized Receiver
          Periodic Advertising ADI support
          Connection Subrating
          Unknown features (0x0000010000000000)
< HCI Command: LE Set Host Feature (0x08|0x0074) plen 2     #15 [hci1] 0.618868
        Bit Number: 32
          Connected Isochronous Stream (Host Support)
        Bit Value: 1
> HCI Event: Command Complete (0x0e) plen 4                 #16 [hci1] 0.619353
      LE Set Host Feature (0x08|0x0074) ncmd 1
        Status: Success (0x00)
< HCI Command: LE Read Buffer v2 (0x08|0x0060) plen 0       #17 [hci1] 0.638849
> HCI Event: Command Complete (0x0e) plen 10                #18 [hci1] 0.639339
      LE Read Buffer v2 (0x08|0x0060) ncmd 1
        Status: Success (0x00)
        ACL MTU: 27
        ACL max packet: 3
        ISO MTU: 318
        ISO max packet: 3
< HCI Command: LE Read Maximum Adve.. (0x08|0x003a) plen 0  #19 [hci1] 0.658873
> HCI Event: Command Complete (0x0e) plen 6                 #20 [hci1] 0.659374
      LE Read Maximum Advertising Data Length (0x08|0x003a) ncmd 1
        Status: Success (0x00)
        Max length: 1650
< HCI Command: LE Read Supported St.. (0x08|0x001c) plen 0  #21 [hci1] 0.678848
> HCI Event: Command Complete (0x0e) plen 12                #22 [hci1] 0.679381
      LE Read Supported States (0x08|0x001c) ncmd 1
        Status: Success (0x00)
        States: 0x000003ff3e0306ff
          Non-connectable Advertising State
          Scannable Advertising State
          Connectable Advertising State
          High Duty Cycle Directed Advertising State
          Passive Scanning State
          Active Scanning State
          Initiating State
            and Connection State (Central Role)
          Connection State (Peripheral Role)
          Scannable Advertising State
            and Passive Scanning State
          Connectable Advertising State
            and Passive Scanning State
          Non-connectable Advertising State
            and Initiating State
          Scannable Advertising State
            and Initiating State
          Active Scanning State
            and Connection State (Central Role)
          Passive Scanning State
            and Connection State (Peripheral Role)
          Active Scanning State
            and Connection State (Peripheral Role)
          Initiating State
            and Connection State (Central Role)
            and Central Role & Central Role
          Low Duty Cycle Directed Advertising State
          Connectable Advertising State
            and Initiating State
            and Central Role & Peripheral Role
          High Duty Cycle Directed Advertising State
            and Initiating State
            and Central Role & Peripheral Role
          Low Duty Cycle Directed Advertising State
            and Initiating State
            and Central Role & Peripheral Role
          Connectable Advertising State
            and Connection State (Central Role)
            and Central Role & Peripheral Role
          High Duty Cycle Directed Advertising State
            and Connection State (Central Role)
            and Central Role & Peripheral Role
          Low Duty Cycle Directed Advertising State
            and Connection State (Central Role)
            and Central Role & Peripheral Role
          Connectable Advertising State
            and Connection State (Peripheral Role)
            and Central Role & Peripheral Role
          High Duty Cycle Directed Advertising State
            and Connection State (Peripheral Role)
            and Peripheral Role & Peripheral Role
          Low Duty Cycle Directed Advertising State
            and Connection State (Peripheral Role)
            and Peripheral Role & Peripheral Role
          Initiating State
            and Connection State (Peripheral Role)
            and Central Role & Peripheral Role
< HCI Command: LE Read Maximum Data.. (0x08|0x002f) plen 0  #23 [hci1] 0.698874
> HCI Event: Command Complete (0x0e) plen 12                #24 [hci1] 0.699387
      LE Read Maximum Data Length (0x08|0x002f) ncmd 1
        Status: Success (0x00)
        Max TX octets: 251
        Max TX time: 2704
        Max RX octets: 251
        Max RX time: 2704
< HCI Command: LE Write Suggested D.. (0x08|0x0024) plen 4  #25 [hci1] 0.718840
        TX octets: 251
        TX time: 2704
> HCI Event: Command Complete (0x0e) plen 4                 #26 [hci1] 0.719336
      LE Write Suggested Default Data Length (0x08|0x0024) ncmd 1
        Status: Success (0x00)
< HCI Command: LE Read Resolving Li.. (0x08|0x002a) plen 0  #27 [hci1] 0.738835
> HCI Event: Command Complete (0x0e) plen 5                 #28 [hci1] 0.739218
      LE Read Resolving List Size (0x08|0x002a) ncmd 1
        Status: Success (0x00)
        Size: 8
< HCI Command: LE Set Host Feature (0x08|0x0074) plen 2     #29 [hci1] 0.758849
        Bit Number: 38
          Connection Subrating (Host Support)
        Bit Value: 1
> HCI Event: Command Complete (0x0e) plen 4                 #30 [hci1] 0.759276
      LE Set Host Feature (0x08|0x0074) ncmd 1
        Status: Success (0x00)
< HCI Command: LE Set Event Mask (0x08|0x0001) plen 8       #31 [hci1] 0.778834
        Mask: 0x000002063f87fa5e
          LE Advertising Report
          LE Connection Update Complete
          LE Read Remote Used Features Complete
          LE Long Term Key Request
          LE Data Length Change
          LE Enhanced Connection Complete
          LE PHY Update Complete
          LE Extended Advertising Report
          LE Periodic Advertising Sync Established
          LE Periodic Advertising Report
          LE Periodic Advertising Sync Lost
          LE Extended Scan Timeout
          LE Extended Advertising Set Terminated
          LE Scan Request Received
          LE Periodic Advertising Sync Transfer Rvc
          LE CIS Established
          LE CIS Request
          LE Create BIG Complete
          LE Terminate BIG Complete
          LE BIG Sync Estabilished Complete
          LE BIG Sync Lost
          LE BIG Info Advertising Report
          LE Subrate Change
          Unknown mask (0x0000020000000000)
> HCI Event: Command Complete (0x0e) plen 4                 #32 [hci1] 0.779397
      LE Set Event Mask (0x08|0x0001) ncmd 1
        Status: Success (0x00)
< HCI Command: Set Event Mask (0x03|0x0001) plen 8          #33 [hci1] 0.798844
        Mask: 0x2000800002008890
          Disconnection Complete
          Encryption Change
          Read Remote Version Information Complete
          Hardware Error
          Data Buffer Overflow
          Encryption Key Refresh Complete
          LE Meta
> HCI Event: Command Complete (0x0e) plen 4                 #34 [hci1] 0.799368
      Set Event Mask (0x03|0x0001) ncmd 1
        Status: Success (0x00)
< HCI Command: Read BD ADDR (0x04|0x0009) plen 0            #35 [hci1] 0.818839
> HCI Event: Command Complete (0x0e) plen 10                #36 [hci1] 0.819280
      Read BD ADDR (0x04|0x0009) ncmd 1
        Status: Success (0x00)
        Address: 00:00:00:00:00:00 (OUI 00-00-00)
< HCI Command: LE Set Random Address (0x08|0x0005) plen 6   #37 [hci1] 0.838852
        Address: D5:B6:CC:31:DB:3B (Static)
> HCI Event: Command Complete (0x0e) plen 4                 #38 [hci1] 0.839369
      LE Set Random Address (0x08|0x0005) ncmd 1
        Status: Success (0x00)
< HCI Command: LE Set Extended Adv.. (0x08|0x0036) plen 25  #39 [hci1] 3.389270
        Handle: 0x00
        Properties: 0x0013
          Connectable
          Scannable
          Use legacy advertising PDUs: ADV_IND
        Min advertising interval: 100.000 msec (0x00a0)
        Max advertising interval: 150.000 msec (0x00f0)
        Channel map: 37, 38, 39 (0x07)
        Own address type: Random (0x01)
        Peer address type: Public (0x00)
        Peer address: 00:00:00:00:00:00 (OUI 00-00-00)
        Filter policy: Allow Scan Request from Any, Allow Connect Request from Any (0x00)
        TX power: Host has no preference (0x7f)
        Primary PHY: LE 1M (0x01)
        Secondary max skip: 0x00
        Secondary PHY: LE 1M (0x01)
        SID: 0x00
        Scan request notifications: Disabled (0x00)
> HCI Event: Command Complete (0x0e) plen 5                 #40 [hci1] 3.390147
      LE Set Extended Advertising Parameters (0x08|0x0036) ncmd 1
        Status: Success (0x00)
        TX power (selected): 0 dbm (0x00)
< HCI Command: LE Set Advertising S.. (0x08|0x0035) plen 7  #41 [hci1] 3.399171
        Advertising handle: 0x00
        Advertising random address: D5:B6:CC:31:DB:3B (Static)
> HCI Event: Command Complete (0x0e) plen 4                 #42 [hci1] 3.399763
      LE Set Advertising Set Random Address (0x08|0x0035) ncmd 1
        Status: Success (0x00)
< HCI Command: LE Set Extended Adv.. (0x08|0x0037) plen 22  #43 [hci1] 3.418982
        Handle: 0x00
        Operation: Complete extended advertising data (0x03)
        Fragment preference: Minimize fragmentation (0x01)
        Data length: 0x12
        Flags: 0x06
          LE General Discoverable Mode
          BR/EDR Not Supported
        Name (complete): Tester_F6B11A
> HCI Event: Command Complete (0x0e) plen 4                 #44 [hci1] 3.419651
      LE Set Extended Advertising Data (0x08|0x0037) ncmd 1
        Status: Success (0x00)
< HCI Command: LE Set Extended Scan.. (0x08|0x0038) plen 4  #45 [hci1] 3.438848
        Handle: 0x00
        Operation: Complete scan response data (0x03)
        Fragment preference: Minimize fragmentation (0x01)
        Data length: 0x00
> HCI Event: Command Complete (0x0e) plen 4                 #46 [hci1] 3.439250
      LE Set Extended Scan Response Data (0x08|0x0038) ncmd 1
        Status: Success (0x00)
< HCI Command: LE Set Extended Adve.. (0x08|0x0039) plen 6  #47 [hci1] 3.458873
        Extended advertising: Enabled (0x01)
        Number of sets: 1 (0x01)
        Entry 0
          Handle: 0x00
          Duration: 0 ms (0x00)
          Max ext adv events: 0
> HCI Event: Command Complete (0x0e) plen 4                 #48 [hci1] 3.459533
      LE Set Extended Advertising Enable (0x08|0x0039) ncmd 1
        Status: Success (0x00)
> HCI Event: LE Meta Event (0x3e) plen 31                   #49 [hci1] 3.564183
      LE Enhanced Connection Complete (0x0a)
        Status: Success (0x00)
        Handle: 975
        Role: Peripheral (0x01)
        Peer address type: Public (0x00)
        Peer address: DF:A9:FF:F6:B1:1A (OUI DF-A9-FF)
        Local resolvable private address: 00:00:00:00:00:00 (Non-Resolvable)
        Peer resolvable private address: 00:00:00:00:00:00 (Non-Resolvable)
        Connection interval: 87.50 msec (0x0046)
        Connection latency: 0 (0x0000)
        Supervision timeout: 25120 msec (0x09d0)
        Central clock accuracy: 0x01
> HCI Event: LE Meta Event (0x3e) plen 6                    #50 [hci1] 3.564354
      LE Advertising Set Terminated (0x12)
        Status: Success (0x00)
        Handle: 0
        Connection handle: 975
        Number of completed extended advertising events: 0
< HCI Command: LE Read Remote Used... (0x08|0x0016) plen 2  #51 [hci1] 3.579051
        Handle: 975 Address: DF:A9:FF:F6:B1:1A (OUI DF-A9-FF)
< ACL Data TX: Handle 975 flags 0x00 dlen 7                 #52 [hci1] 3.579059
      ATT: Exchange MTU Request (0x02) len 2
        Client RX MTU: 251
> HCI Event: Command Status (0x0f) plen 4                   #53 [hci1] 3.579587
      LE Read Remote Used Features (0x08|0x0016) ncmd 1
        Status: Success (0x00)
> HCI Event: Number of Completed Packets (0x13) plen 5      #54 [hci1] 3.740107
        Num handles: 1
        Handle: 975 Address: DF:A9:FF:F6:B1:1A (OUI DF-A9-FF)
        Count: 1
        #52: len 7 (0 Kb/s)
        Latency: 161 msec (161-161 msec ~161 msec)
> HCI Event: LE Meta Event (0x3e) plen 12                   #55 [hci1] 3.828095
      LE Read Remote Used Features (0x04)
        Status: Success (0x00)
        Handle: 975 Address: DF:A9:FF:F6:B1:1A (OUI DF-A9-FF)
        Features: 0x2d 0x49 0x00 0xf7 0x67 0xd9 0x00 0x80
          LE Encryption
          Extended Reject Indication
          Peripheral-initiated Features Exchange
          LE Data Packet Length Extension
          LE 2M PHY
          LE Coded PHY
          Channel Selection Algorithm #2
          Periodic Advertising Sync Transfer - Sender
          Periodic Advertising Sync Transfer - Recipient
          Sleep Clock Accuracy Updates
          Connected Isochronous Stream - Central
          Connected Isochronous Stream - Peripheral
          Isochronous Broadcaster
          Synchronized Receiver
          Connected Isochronous Stream (Host Support)
          LE Power Control Request
          LE Power Control Request
          Connection Subrating
          Connection Subrating (Host Support)
          Unknown features (0x8000d90000000000)
> ACL Data RX: Handle 975 flags 0x02 dlen 11                #56 [hci1] 6.277789
      SMP: Pairing Request (0x01) len 6
        IO capability: KeyboardDisplay (0x04)
        OOB data: Authentication data not present (0x00)
        Authentication requirement: Bonding, MITM, SC, No Keypresses (0x0d)
        Max encryption key size: 16
        Initiator key distribution: EncKey IdKey (0x03)
        Responder key distribution: EncKey IdKey Sign (0x07)
> ACL Data RX: Handle 975 flags 0x02 dlen 7                 #57 [hci1] 6.278245
      ATT: Exchange MTU Response (0x03) len 2
        Server RX MTU: 23
< HCI Command: Host Number of Compl.. (0x03|0x0035) plen 5  #58 [hci1] 6.279109
        Num handles: 1
        Handle: 975 Address: DF:A9:FF:F6:B1:1A (OUI DF-A9-FF)
        Count: 1
< ACL Data TX: Handle 975 flags 0x00 dlen 11                #59 [hci1] 6.279120
      SMP: Pairing Response (0x02) len 6
        IO capability: DisplayOnly (0x00)
        OOB data: Authentication data not present (0x00)
        Authentication requirement: Bonding, No MITM, SC, No Keypresses (0x09)
        Max encryption key size: 16
        Initiator key distribution: IdKey (0x02)
        Responder key distribution: <none> (0x00)
< HCI Command: Host Number of Compl.. (0x03|0x0035) plen 5  #60 [hci1] 6.279279
        Num handles: 1
        Handle: 975 Address: DF:A9:FF:F6:B1:1A (OUI DF-A9-FF)
        Count: 1
> HCI Event: Number of Completed Packets (0x13) plen 5      #61 [hci1] 6.452889
        Num handles: 1
        Handle: 975 Address: DF:A9:FF:F6:B1:1A (OUI DF-A9-FF)
        Count: 1
        #59: len 11 (0 Kb/s)
        Latency: 173 msec (161-173 msec ~167 msec)
> ACL Data RX: Handle 975 flags 0x02 dlen 27                #62 [hci1] 6.453193
> ACL Data RX: Handle 975 flags 0x01 dlen 27                #63 [hci1] 6.453686
> ACL Data RX: Handle 975 flags 0x01 dlen 15                #64 [hci1] 6.454156
      SMP: Pairing Public Key (0x0c) len 64
        X: 3926b9c5a577a9c0020314a5ad3c641ec30278ce508357e4d17f8004132e96e4
        Y: 8088c93ae5dd638fb35d228c09082c3debaa6d2511f3be1d1d63b2a8b78c8c9f
< HCI Command: Host Number of Compl.. (0x03|0x0035) plen 5  #65 [hci1] 6.459171
        Num handles: 1
        Handle: 975 Address: DF:A9:FF:F6:B1:1A (OUI DF-A9-FF)
        Count: 1
< HCI Command: Host Number of Compl.. (0x03|0x0035) plen 5  #66 [hci1] 6.459219
        Num handles: 1
        Handle: 975 Address: DF:A9:FF:F6:B1:1A (OUI DF-A9-FF)
        Count: 1
< HCI Command: Host Number of Compl.. (0x03|0x0035) plen 5  #67 [hci1] 6.459358
        Num handles: 1
        Handle: 975 Address: DF:A9:FF:F6:B1:1A (OUI DF-A9-FF)
        Count: 1
< ACL Data TX: Handle 975 flags 0x00 dlen 27                #68 [hci1] 6.459391
< ACL Data TX: Handle 975 flags 0x01 dlen 27                #69 [hci1] 6.459403
< ACL Data TX: Handle 975 flags 0x01 dlen 15                #70 [hci1] 6.459442
      SMP: Pairing Public Key (0x0c) len 64
        X: 98308440221e2d910f0e54b71e7ec652857aa9b5a0dc65028824cc19db1226e9
        Y: 67a4816bcb62efb21701e31fdb27561a6217575fb007a8bbdabe7e28b6f68482
> HCI Event: Number of Completed Packets (0x13) plen 5      #71 [hci1] 6.540738
        Num handles: 1
        Handle: 975 Address: DF:A9:FF:F6:B1:1A (OUI DF-A9-FF)
        Count: 1
        #68: len 27 (2 Kb/s)
        Latency: 81 msec (81-173 msec ~124 msec)
> HCI Event: Number of Completed Packets (0x13) plen 5      #72 [hci1] 6.541487
        Num handles: 1
        Handle: 975 Address: DF:A9:FF:F6:B1:1A (OUI DF-A9-FF)
        Count: 1
        #69: len 27 (2 Kb/s)
        Latency: 82 msec (81-173 msec ~103 msec)
> HCI Event: Number of Completed Packets (0x13) plen 5      #73 [hci1] 6.627621
        Num handles: 1
        Handle: 975 Address: DF:A9:FF:F6:B1:1A (OUI DF-A9-FF)
        Count: 1
        #70: len 15 (0 Kb/s)
        Latency: 168 msec (81-173 msec ~135 msec)
> ACL Data RX: Handle 975 flags 0x02 dlen 21                #74 [hci1] 7.677945
      SMP: Pairing Confirm (0x03) len 16
        Confim value: 331c97ce867028addb1fa60f23d3f966
< HCI Command: Host Number of Compl.. (0x03|0x0035) plen 5  #75 [hci1] 7.679626
        Num handles: 1
        Handle: 975 Address: DF:A9:FF:F6:B1:1A (OUI DF-A9-FF)
        Count: 1
< ACL Data TX: Handle 975 flags 0x00 dlen 21                #76 [hci1] 7.679759
      SMP: Pairing Confirm (0x03) len 16
        Confim value: 9999bb16acd8fe7a8f098ad6287d9d91
> HCI Event: Number of Completed Packets (0x13) plen 5      #77 [hci1] 7.852846
        Num handles: 1
        Handle: 975 Address: DF:A9:FF:F6:B1:1A (OUI DF-A9-FF)
        Count: 1
        #76: len 21 (0 Kb/s)
        Latency: 173 msec (81-173 msec ~154 msec)
> ACL Data RX: Handle 975 flags 0x02 dlen 21                #78 [hci1] 7.853090
      SMP: Pairing Random (0x04) len 16
        Random value: c8f0f2ee657832120000000000000000
< HCI Command: Host Number of Compl.. (0x03|0x0035) plen 5  #79 [hci1] 7.859298
        Num handles: 1
        Handle: 975 Address: DF:A9:FF:F6:B1:1A (OUI DF-A9-FF)
        Count: 1
< ACL Data TX: Handle 975 flags 0x00 dlen 21                #80 [hci1] 7.859397
      SMP: Pairing Random (0x04) len 16
        Random value: 8e6108f966a694cbe26df70bb96773e6
> HCI Event: Number of Completed Packets (0x13) plen 5      #81 [hci1] 8.027684
        Num handles: 1
        Handle: 975 Address: DF:A9:FF:F6:B1:1A (OUI DF-A9-FF)
        Count: 1
        #80: len 21 (1 Kb/s)
        Latency: 168 msec (81-173 msec ~161 msec)
> ACL Data RX: Handle 975 flags 0x02 dlen 21                #82 [hci1] 8.115478
      SMP: Pairing Confirm (0x03) len 16
        Confim value: 3936a6103299e3ed5a724c544639ed7e
< HCI Command: Host Number of Compl.. (0x03|0x0035) plen 5  #83 [hci1] 8.119452
        Num handles: 1
        Handle: 975 Address: DF:A9:FF:F6:B1:1A (OUI DF-A9-FF)
        Count: 1
< ACL Data TX: Handle 975 flags 0x00 dlen 21                #84 [hci1] 8.119561
      SMP: Pairing Confirm (0x03) len 16
        Confim value: 1afe1378d7d1d8b49b366bb734e868d0
> HCI Event: Number of Completed Packets (0x13) plen 5      #85 [hci1] 8.290382
        Num handles: 1
        Handle: 975 Address: DF:A9:FF:F6:B1:1A (OUI DF-A9-FF)
        Count: 1
        #84: len 21 (0 Kb/s)
        Latency: 170 msec (81-173 msec ~166 msec)
> ACL Data RX: Handle 975 flags 0x02 dlen 21                #86 [hci1] 8.290645
      SMP: Pairing Random (0x04) len 16
        Random value: cb6f4813ee6376140000000000000000
< HCI Command: Host Number of Compl.. (0x03|0x0035) plen 5  #87 [hci1] 8.299207
        Num handles: 1
        Handle: 975 Address: DF:A9:FF:F6:B1:1A (OUI DF-A9-FF)
        Count: 1
< ACL Data TX: Handle 975 flags 0x00 dlen 21                #88 [hci1] 8.299232
      SMP: Pairing Random (0x04) len 16
        Random value: 4d02679f89a05211af56d8b3da64d21e
> HCI Event: Number of Completed Packets (0x13) plen 5      #89 [hci1] 8.465125
        Num handles: 1
        Handle: 975 Address: DF:A9:FF:F6:B1:1A (OUI DF-A9-FF)
        Count: 1
        #88: len 21 (1 Kb/s)
        Latency: 165 msec (81-173 msec ~165 msec)
> ACL Data RX: Handle 975 flags 0x02 dlen 21                #90 [hci1] 8.553028
      SMP: Pairing Confirm (0x03) len 16
        Confim value: b5f9cd9a8ec16067f73186dca8949598
< HCI Command: Host Number of Compl.. (0x03|0x0035) plen 5  #91 [hci1] 8.559105
        Num handles: 1
        Handle: 975 Address: DF:A9:FF:F6:B1:1A (OUI DF-A9-FF)
        Count: 1
< ACL Data TX: Handle 975 flags 0x00 dlen 21                #92 [hci1] 8.559190
      SMP: Pairing Confirm (0x03) len 16
        Confim value: 0071d2253f4ea26de0c49cde9c3bf7d3
> HCI Event: Number of Completed Packets (0x13) plen 5      #93 [hci1] 8.727831
        Num handles: 1
        Handle: 975 Address: DF:A9:FF:F6:B1:1A (OUI DF-A9-FF)
        Count: 1
        #92: len 21 (1 Kb/s)
        Latency: 168 msec (81-173 msec ~167 msec)
> ACL Data RX: Handle 975 flags 0x02 dlen 21                #94 [hci1] 8.728133
      SMP: Pairing Random (0x04) len 16
        Random value: 30e8eab06fab05f00000000000000000
< HCI Command: Host Number of Compl.. (0x03|0x0035) plen 5  #95 [hci1] 8.739649
        Num handles: 1
        Handle: 975 Address: DF:A9:FF:F6:B1:1A (OUI DF-A9-FF)
        Count: 1
< ACL Data TX: Handle 975 flags 0x00 dlen 21                #96 [hci1] 8.739707
      SMP: Pairing Random (0x04) len 16
        Random value: 5e8286bc235a02440d0c3424a2acf8fd
> HCI Event: Number of Completed Packets (0x13) plen 5      #97 [hci1] 8.902690
        Num handles: 1
        Handle: 975 Address: DF:A9:FF:F6:B1:1A (OUI DF-A9-FF)
        Count: 1
        #96: len 21 (1 Kb/s)
        Latency: 162 msec (81-173 msec ~165 msec)
> ACL Data RX: Handle 975 flags 0x02 dlen 21                #98 [hci1] 8.990505
      SMP: Pairing Confirm (0x03) len 16
        Confim value: f2bf839accb18a8a2e4733eacd1d216f
< HCI Command: Host Number of Compl.. (0x03|0x0035) plen 5  #99 [hci1] 8.999424
        Num handles: 1
        Handle: 975 Address: DF:A9:FF:F6:B1:1A (OUI DF-A9-FF)
        Count: 1
< ACL Data TX: Handle 975 flags 0x00 dlen 21               #100 [hci1] 8.999505
      SMP: Pairing Confirm (0x03) len 16
        Confim value: 9af47f60c5a1341d902fd296208f29b3
> HCI Event: Number of Completed Packets (0x13) plen 5     #101 [hci1] 9.165281
        Num handles: 1
        Handle: 975 Address: DF:A9:FF:F6:B1:1A (OUI DF-A9-FF)
        Count: 1
        #100: len 21 (1 Kb/s)
        Latency: 165 msec (81-173 msec ~165 msec)
> ACL Data RX: Handle 975 flags 0x02 dlen 21               #102 [hci1] 9.165661
      SMP: Pairing Random (0x04) len 16
        Random value: 75de2f3e73b24c910000000000000000
< HCI Command: Host Number of Comp.. (0x03|0x0035) plen 5  #103 [hci1] 9.179697
        Num handles: 1
        Handle: 975 Address: DF:A9:FF:F6:B1:1A (OUI DF-A9-FF)
        Count: 1
< ACL Data TX: Handle 975 flags 0x00 dlen 21               #104 [hci1] 9.179804
      SMP: Pairing Random (0x04) len 16
        Random value: 5c4a1bcadd27bd58e945097b00bad7ac
> HCI Event: Number of Completed Packets (0x13) plen 5     #105 [hci1] 9.340070
        Num handles: 1
        Handle: 975 Address: DF:A9:FF:F6:B1:1A (OUI DF-A9-FF)
        Count: 1
        #104: len 21 (1 Kb/s)
        Latency: 160 msec (81-173 msec ~162 msec)
> ACL Data RX: Handle 975 flags 0x02 dlen 21               #106 [hci1] 9.427962
      SMP: Pairing Confirm (0x03) len 16
        Confim value: 4039e4af391515d1635765bec20d5b28
< HCI Command: Host Number of Comp.. (0x03|0x0035) plen 5  #107 [hci1] 9.439162
        Num handles: 1
        Handle: 975 Address: DF:A9:FF:F6:B1:1A (OUI DF-A9-FF)
        Count: 1
< ACL Data TX: Handle 975 flags 0x00 dlen 21               #108 [hci1] 9.439206
      SMP: Pairing Confirm (0x03) len 16
        Confim value: 48c7d1327ec75a1a39a2f10f63b0b332
> HCI Event: Number of Completed Packets (0x13) plen 5     #109 [hci1] 9.602762
        Num handles: 1
        Handle: 975 Address: DF:A9:FF:F6:B1:1A (OUI DF-A9-FF)
        Count: 1
        #108: len 21 (1 Kb/s)
        Latency: 163 msec (81-173 msec ~163 msec)
> ACL Data RX: Handle 975 flags 0x02 dlen 21               #110 [hci1] 9.603088
      SMP: Pairing Random (0x04) len 16
        Random value: 59ceef4ab80ae41b0000000000000000
< HCI Command: Host Number of Comp.. (0x03|0x0035) plen 5  #111 [hci1] 9.619360
        Num handles: 1
        Handle: 975 Address: DF:A9:FF:F6:B1:1A (OUI DF-A9-FF)
        Count: 1
< ACL Data TX: Handle 975 flags 0x00 dlen 21               #112 [hci1] 9.619498
      SMP: Pairing Random (0x04) len 16
        Random value: 32527e6e64e79f33b2e374394db8ab2d
> HCI Event: Number of Completed Packets (0x13) plen 5     #113 [hci1] 9.777518
        Num handles: 1
        Handle: 975 Address: DF:A9:FF:F6:B1:1A (OUI DF-A9-FF)
        Count: 1
        #112: len 21 (1 Kb/s)
        Latency: 158 msec (81-173 msec ~160 msec)
> ACL Data RX: Handle 975 flags 0x02 dlen 21               #114 [hci1] 9.865465
      SMP: Pairing Confirm (0x03) len 16
        Confim value: cff9433b7966eb9fe44f40efe34823ce
< HCI Command: Host Number of Comp.. (0x03|0x0035) plen 5  #115 [hci1] 9.879174
        Num handles: 1
        Handle: 975 Address: DF:A9:FF:F6:B1:1A (OUI DF-A9-FF)
        Count: 1
< ACL Data TX: Handle 975 flags 0x00 dlen 21               #116 [hci1] 9.879201
      SMP: Pairing Confirm (0x03) len 16
        Confim value: 8d47b5e8021485b827691e12f86c38e3
> HCI Event: Number of Completed Packets (0x13) plen 5    #117 [hci1] 10.040317
        Num handles: 1
        Handle: 975 Address: DF:A9:FF:F6:B1:1A (OUI DF-A9-FF)
        Count: 1
        #116: len 21 (1 Kb/s)
        Latency: 161 msec (81-173 msec ~160 msec)
> ACL Data RX: Handle 975 flags 0x02 dlen 21              #118 [hci1] 10.040590
      SMP: Pairing Random (0x04) len 16
        Random value: d4947bcfc5353f4f0000000000000000
< HCI Command: Host Number of Com.. (0x03|0x0035) plen 5  #119 [hci1] 10.059668
        Num handles: 1
        Handle: 975 Address: DF:A9:FF:F6:B1:1A (OUI DF-A9-FF)
        Count: 1
< ACL Data TX: Handle 975 flags 0x00 dlen 21              #120 [hci1] 10.059739
      SMP: Pairing Random (0x04) len 16
        Random value: dddbdfe2838e9a8cc6964353c850fef7
> HCI Event: Number of Completed Packets (0x13) plen 5    #121 [hci1] 10.215032
        Num handles: 1
        Handle: 975 Address: DF:A9:FF:F6:B1:1A (OUI DF-A9-FF)
        Count: 1
        #120: len 21 (1 Kb/s)
        Latency: 155 msec (81-173 msec ~158 msec)
> ACL Data RX: Handle 975 flags 0x02 dlen 21              #122 [hci1] 10.302916
      SMP: Pairing Confirm (0x03) len 16
        Confim value: f78d78941f042ce6d5b14f83bfac513c
< HCI Command: Host Number of Com.. (0x03|0x0035) plen 5  #123 [hci1] 10.319134
        Num handles: 1
        Handle: 975 Address: DF:A9:FF:F6:B1:1A (OUI DF-A9-FF)
        Count: 1
< ACL Data TX: Handle 975 flags 0x00 dlen 21              #124 [hci1] 10.319162
      SMP: Pairing Confirm (0x03) len 16
        Confim value: 5b7bbdb31a0ea8e04615e90fb6407878
> HCI Event: Number of Completed Packets (0x13) plen 5    #125 [hci1] 10.477838
        Num handles: 1
        Handle: 975 Address: DF:A9:FF:F6:B1:1A (OUI DF-A9-FF)
        Count: 1
        #124: len 21 (1 Kb/s)
        Latency: 158 msec (81-173 msec ~158 msec)
> ACL Data RX: Handle 975 flags 0x02 dlen 21              #126 [hci1] 10.478052
      SMP: Pairing Random (0x04) len 16
        Random value: b06a743575d04d850000000000000000
< HCI Command: Host Number of Com.. (0x03|0x0035) plen 5  #127 [hci1] 10.479067
        Num handles: 1
        Handle: 975 Address: DF:A9:FF:F6:B1:1A (OUI DF-A9-FF)
        Count: 1
< ACL Data TX: Handle 975 flags 0x00 dlen 21              #128 [hci1] 10.479129
      SMP: Pairing Random (0x04) len 16
        Random value: eb9f1915536596b6fc3db1c86b2b1970
> HCI Event: Number of Completed Packets (0x13) plen 5    #129 [hci1] 10.652547
        Num handles: 1
        Handle: 975 Address: DF:A9:FF:F6:B1:1A (OUI DF-A9-FF)
        Count: 1
        #128: len 21 (0 Kb/s)
        Latency: 173 msec (81-173 msec ~165 msec)
> ACL Data RX: Handle 975 flags 0x02 dlen 21              #130 [hci1] 10.740481
      SMP: Pairing Confirm (0x03) len 16
        Confim value: 120914258ad38eba75cf0374037b309c
< HCI Command: Host Number of Com.. (0x03|0x0035) plen 5  #131 [hci1] 10.758887
        Num handles: 1
        Handle: 975 Address: DF:A9:FF:F6:B1:1A (OUI DF-A9-FF)
        Count: 1
< ACL Data TX: Handle 975 flags 0x00 dlen 21              #132 [hci1] 10.759136
      SMP: Pairing Confirm (0x03) len 16
        Confim value: 7b22f12961187b9c6d816a4d1493fc80
> HCI Event: Number of Completed Packets (0x13) plen 5    #133 [hci1] 10.915203
        Num handles: 1
        Handle: 975 Address: DF:A9:FF:F6:B1:1A (OUI DF-A9-FF)
        Count: 1
        #132: len 21 (1 Kb/s)
        Latency: 156 msec (81-173 msec ~160 msec)
> ACL Data RX: Handle 975 flags 0x02 dlen 21              #134 [hci1] 10.915640
      SMP: Pairing Random (0x04) len 16
        Random value: e037f5b807daf5c50000000000000000
< HCI Command: Host Number of Com.. (0x03|0x0035) plen 5  #135 [hci1] 10.918943
        Num handles: 1
        Handle: 975 Address: DF:A9:FF:F6:B1:1A (OUI DF-A9-FF)
        Count: 1
< ACL Data TX: Handle 975 flags 0x00 dlen 21              #136 [hci1] 10.918953
      SMP: Pairing Random (0x04) len 16
        Random value: 5c794dc9ad9f2c3f295ebd5ad5e1c3cf
> HCI Event: Number of Completed Packets (0x13) plen 5    #137 [hci1] 11.090201
        Num handles: 1
        Handle: 975 Address: DF:A9:FF:F6:B1:1A (OUI DF-A9-FF)
        Count: 1
        #136: len 21 (0 Kb/s)
        Latency: 171 msec (81-173 msec ~166 msec)
> ACL Data RX: Handle 975 flags 0x02 dlen 21              #138 [hci1] 11.090589
      SMP: Pairing Confirm (0x03) len 16
        Confim value: 26ecc6a0bb12a94bb2aaf3832a67cd1d
< HCI Command: Host Number of Com.. (0x03|0x0035) plen 5  #139 [hci1] 11.099144
        Num handles: 1
        Handle: 975 Address: DF:A9:FF:F6:B1:1A (OUI DF-A9-FF)
        Count: 1
< ACL Data TX: Handle 975 flags 0x00 dlen 21              #140 [hci1] 11.099178
      SMP: Pairing Confirm (0x03) len 16
        Confim value: f77bf41e545e58b06f47264361f3be85
> HCI Event: Number of Completed Packets (0x13) plen 5    #141 [hci1] 11.265209
        Num handles: 1
        Handle: 975 Address: DF:A9:FF:F6:B1:1A (OUI DF-A9-FF)
        Count: 1
        #140: len 21 (1 Kb/s)
        Latency: 166 msec (81-173 msec ~166 msec)
> ACL Data RX: Handle 975 flags 0x02 dlen 21              #142 [hci1] 11.265569
      SMP: Pairing Random (0x04) len 16
        Random value: 1836d609bbb15ea80000000000000000
< HCI Command: Host Number of Com.. (0x03|0x0035) plen 5  #143 [hci1] 11.279138
        Num handles: 1
        Handle: 975 Address: DF:A9:FF:F6:B1:1A (OUI DF-A9-FF)
        Count: 1
< ACL Data TX: Handle 975 flags 0x00 dlen 21              #144 [hci1] 11.279168
      SMP: Pairing Random (0x04) len 16
        Random value: 5c2fff312cdf99c9491988e877355a9a
> HCI Event: Number of Completed Packets (0x13) plen 5    #145 [hci1] 11.440057
        Num handles: 1
        Handle: 975 Address: DF:A9:FF:F6:B1:1A (OUI DF-A9-FF)
        Count: 1
        #144: len 21 (1 Kb/s)
        Latency: 160 msec (81-173 msec ~163 msec)
> ACL Data RX: Handle 975 flags 0x02 dlen 21              #146 [hci1] 11.527910
      SMP: Pairing Confirm (0x03) len 16
        Confim value: e73635678856af03af58b7fb11532c3c
< HCI Command: Host Number of Com.. (0x03|0x0035) plen 5  #147 [hci1] 11.539462
        Num handles: 1
        Handle: 975 Address: DF:A9:FF:F6:B1:1A (OUI DF-A9-FF)
        Count: 1
< ACL Data TX: Handle 975 flags 0x00 dlen 21              #148 [hci1] 11.539486
      SMP: Pairing Confirm (0x03) len 16
        Confim value: 6441e21942a04202b0f6ac23c87d4477
> HCI Event: Number of Completed Packets (0x13) plen 5    #149 [hci1] 11.702676
        Num handles: 1
        Handle: 975 Address: DF:A9:FF:F6:B1:1A (OUI DF-A9-FF)
        Count: 1
        #148: len 21 (1 Kb/s)
        Latency: 163 msec (81-173 msec ~163 msec)
> ACL Data RX: Handle 975 flags 0x02 dlen 21              #150 [hci1] 11.703086
      SMP: Pairing Random (0x04) len 16
        Random value: 67c9f8d47fc6a61a0000000000000000
< HCI Command: Host Number of Com.. (0x03|0x0035) plen 5  #151 [hci1] 11.719249
        Num handles: 1
        Handle: 975 Address: DF:A9:FF:F6:B1:1A (OUI DF-A9-FF)
        Count: 1
< ACL Data TX: Handle 975 flags 0x00 dlen 21              #152 [hci1] 11.719337
      SMP: Pairing Random (0x04) len 16
        Random value: c629a3a987d808e808655d558dfc1155
> HCI Event: Number of Completed Packets (0x13) plen 5    #153 [hci1] 11.877570
        Num handles: 1
        Handle: 975 Address: DF:A9:FF:F6:B1:1A (OUI DF-A9-FF)
        Count: 1
        #152: len 21 (1 Kb/s)
        Latency: 158 msec (81-173 msec ~160 msec)
> ACL Data RX: Handle 975 flags 0x02 dlen 21              #154 [hci1] 11.965380
      SMP: Pairing Confirm (0x03) len 16
        Confim value: 686d788b236c59bd12132b31ed4a3631
< HCI Command: Host Number of Com.. (0x03|0x0035) plen 5  #155 [hci1] 11.979317
        Num handles: 1
        Handle: 975 Address: DF:A9:FF:F6:B1:1A (OUI DF-A9-FF)
        Count: 1
< ACL Data TX: Handle 975 flags 0x00 dlen 21              #156 [hci1] 11.979398
      SMP: Pairing Confirm (0x03) len 16
        Confim value: 93710077697973bf17bae2423a627b84
> HCI Event: Number of Completed Packets (0x13) plen 5    #157 [hci1] 12.140242
        Num handles: 1
        Handle: 975 Address: DF:A9:FF:F6:B1:1A (OUI DF-A9-FF)
        Count: 1
        #156: len 21 (1 Kb/s)
        Latency: 160 msec (81-173 msec ~160 msec)
> ACL Data RX: Handle 975 flags 0x02 dlen 21              #158 [hci1] 12.140552
      SMP: Pairing Random (0x04) len 16
        Random value: 420f8e50ad5b592d0000000000000000
< HCI Command: Host Number of Com.. (0x03|0x0035) plen 5  #159 [hci1] 12.159622
        Num handles: 1
        Handle: 975 Address: DF:A9:FF:F6:B1:1A (OUI DF-A9-FF)
        Count: 1
< ACL Data TX: Handle 975 flags 0x00 dlen 21              #160 [hci1] 12.159700
      SMP: Pairing Random (0x04) len 16
        Random value: 92f20f6ad8f13724432c7fd6001c45ff
> HCI Event: Number of Completed Packets (0x13) plen 5    #161 [hci1] 12.314999
        Num handles: 1
        Handle: 975 Address: DF:A9:FF:F6:B1:1A (OUI DF-A9-FF)
        Count: 1
        #160: len 21 (1 Kb/s)
        Latency: 155 msec (81-173 msec ~158 msec)
> ACL Data RX: Handle 975 flags 0x02 dlen 21              #162 [hci1] 12.402892
      SMP: Pairing Confirm (0x03) len 16
        Confim value: e2ef2e10515d4f59fd5becb66abebbcc
< HCI Command: Host Number of Com.. (0x03|0x0035) plen 5  #163 [hci1] 12.419174
        Num handles: 1
        Handle: 975 Address: DF:A9:FF:F6:B1:1A (OUI DF-A9-FF)
        Count: 1
< ACL Data TX: Handle 975 flags 0x00 dlen 21              #164 [hci1] 12.419224
      SMP: Pairing Confirm (0x03) len 16
        Confim value: b53c6a1b007596d1559562dca409824a
> HCI Event: Number of Completed Packets (0x13) plen 5    #165 [hci1] 12.577720
        Num handles: 1
        Handle: 975 Address: DF:A9:FF:F6:B1:1A (OUI DF-A9-FF)
        Count: 1
        #164: len 21 (1 Kb/s)
        Latency: 158 msec (81-173 msec ~158 msec)
> ACL Data RX: Handle 975 flags 0x02 dlen 21              #166 [hci1] 12.578100
      SMP: Pairing Random (0x04) len 16
        Random value: b75fb3fe35c6bcbb0000000000000000
< HCI Command: Host Number of Com.. (0x03|0x0035) plen 5  #167 [hci1] 12.579505
        Num handles: 1
        Handle: 975 Address: DF:A9:FF:F6:B1:1A (OUI DF-A9-FF)
        Count: 1
< ACL Data TX: Handle 975 flags 0x00 dlen 21              #168 [hci1] 12.579604
      SMP: Pairing Random (0x04) len 16
        Random value: 23ac32ebbb5e14c8a6b9622f296d277f
> HCI Event: Number of Completed Packets (0x13) plen 5    #169 [hci1] 12.752582
        Num handles: 1
        Handle: 975 Address: DF:A9:FF:F6:B1:1A (OUI DF-A9-FF)
        Count: 1
        #168: len 21 (0 Kb/s)
        Latency: 172 msec (81-173 msec ~165 msec)
> ACL Data RX: Handle 975 flags 0x02 dlen 21              #170 [hci1] 12.840339
      SMP: Pairing Confirm (0x03) len 16
        Confim value: d949320f0986ec4ec3f0c823d5f80390
< HCI Command: Host Number of Com.. (0x03|0x0035) plen 5  #171 [hci1] 12.859577
        Num handles: 1
        Handle: 975 Address: DF:A9:FF:F6:B1:1A (OUI DF-A9-FF)
        Count: 1
< ACL Data TX: Handle 975 flags 0x00 dlen 21              #172 [hci1] 12.859677
      SMP: Pairing Confirm (0x03) len 16
        Confim value: db21c891aac4096cd17e15aa4c71165f
> HCI Event: Number of Completed Packets (0x13) plen 5    #173 [hci1] 13.015220
        Num handles: 1
        Handle: 975 Address: DF:A9:FF:F6:B1:1A (OUI DF-A9-FF)
        Count: 1
        #172: len 21 (1 Kb/s)
        Latency: 155 msec (81-173 msec ~160 msec)
> ACL Data RX: Handle 975 flags 0x02 dlen 21              #174 [hci1] 13.015641
      SMP: Pairing Random (0x04) len 16
        Random value: 7f18dbe0ec010b480000000000000000
< HCI Command: Host Number of Com.. (0x03|0x0035) plen 5  #175 [hci1] 13.019671
        Num handles: 1
        Handle: 975 Address: DF:A9:FF:F6:B1:1A (OUI DF-A9-FF)
        Count: 1
< ACL Data TX: Handle 975 flags 0x00 dlen 21              #176 [hci1] 13.019769
      SMP: Pairing Random (0x04) len 16
        Random value: 297efe85e67448a15f56bd27e3a3cf1d
> HCI Event: Number of Completed Packets (0x13) plen 5    #177 [hci1] 13.190029
        Num handles: 1
        Handle: 975 Address: DF:A9:FF:F6:B1:1A (OUI DF-A9-FF)
        Count: 1
        #176: len 21 (0 Kb/s)
        Latency: 170 msec (81-173 msec ~165 msec)
> ACL Data RX: Handle 975 flags 0x02 dlen 21              #178 [hci1] 13.277905
      SMP: Pairing Confirm (0x03) len 16
        Confim value: 7a429240eca77ab2191a1334bfa5cf02
< HCI Command: Host Number of Com.. (0x03|0x0035) plen 5  #179 [hci1] 13.279275
        Num handles: 1
        Handle: 975 Address: DF:A9:FF:F6:B1:1A (OUI DF-A9-FF)
        Count: 1
< ACL Data TX: Handle 975 flags 0x00 dlen 21              #180 [hci1] 13.279310
      SMP: Pairing Confirm (0x03) len 16
        Confim value: 639601c09f8f47b73ed96e5835e8f254
> HCI Event: Number of Completed Packets (0x13) plen 5    #181 [hci1] 13.452702
        Num handles: 1
        Handle: 975 Address: DF:A9:FF:F6:B1:1A (OUI DF-A9-FF)
        Count: 1
        #180: len 21 (0 Kb/s)
        Latency: 173 msec (81-173 msec ~169 msec)
> ACL Data RX: Handle 975 flags 0x02 dlen 21              #182 [hci1] 13.453113
      SMP: Pairing Random (0x04) len 16
        Random value: 5019d3a5968c38170000000000000000
< HCI Command: Host Number of Com.. (0x03|0x0035) plen 5  #183 [hci1] 13.459261
        Num handles: 1
        Handle: 975 Address: DF:A9:FF:F6:B1:1A (OUI DF-A9-FF)
        Count: 1
< ACL Data TX: Handle 975 flags 0x00 dlen 21              #184 [hci1] 13.459341
      SMP: Pairing Random (0x04) len 16
        Random value: 25a9493fd3ce4faf02be7293595bb7c6
> HCI Event: Number of Completed Packets (0x13) plen 5    #185 [hci1] 13.627468
        Num handles: 1
        Handle: 975 Address: DF:A9:FF:F6:B1:1A (OUI DF-A9-FF)
        Count: 1
        #184: len 21 (1 Kb/s)
        Latency: 168 msec (81-173 msec ~168 msec)
> ACL Data RX: Handle 975 flags 0x02 dlen 21              #186 [hci1] 13.715408
      SMP: Pairing Confirm (0x03) len 16
        Confim value: c2151eae6f15ae9f4a157496be4b563e
< HCI Command: Host Number of Com.. (0x03|0x0035) plen 5  #187 [hci1] 13.719579
        Num handles: 1
        Handle: 975 Address: DF:A9:FF:F6:B1:1A (OUI DF-A9-FF)
        Count: 1
< ACL Data TX: Handle 975 flags 0x00 dlen 21              #188 [hci1] 13.719751
      SMP: Pairing Confirm (0x03) len 16
        Confim value: 53ed568c546e105a6825acd1ec128e33
> HCI Event: Number of Completed Packets (0x13) plen 5    #189 [hci1] 13.890226
        Num handles: 1
        Handle: 975 Address: DF:A9:FF:F6:B1:1A (OUI DF-A9-FF)
        Count: 1
        #188: len 21 (0 Kb/s)
        Latency: 170 msec (81-173 msec ~169 msec)
> ACL Data RX: Handle 975 flags 0x02 dlen 21              #190 [hci1] 13.890522
      SMP: Pairing Random (0x04) len 16
        Random value: caa9e069db55e2350000000000000000
< HCI Command: Host Number of Com.. (0x03|0x0035) plen 5  #191 [hci1] 13.899293
        Num handles: 1
        Handle: 975 Address: DF:A9:FF:F6:B1:1A (OUI DF-A9-FF)
        Count: 1
< ACL Data TX: Handle 975 flags 0x00 dlen 21              #192 [hci1] 13.899375
      SMP: Pairing Random (0x04) len 16
        Random value: 58f6b41f855a6f6c3560debd84e2affc
> HCI Event: Number of Completed Packets (0x13) plen 5    #193 [hci1] 14.065023
        Num handles: 1
        Handle: 975 Address: DF:A9:FF:F6:B1:1A (OUI DF-A9-FF)
        Count: 1
        #192: len 21 (1 Kb/s)
        Latency: 165 msec (81-173 msec ~167 msec)
> ACL Data RX: Handle 975 flags 0x02 dlen 21              #194 [hci1] 14.152816
      SMP: Pairing Confirm (0x03) len 16
        Confim value: 70c7475b0799468daa64937d3b5c6125
< HCI Command: Host Number of Com.. (0x03|0x0035) plen 5  #195 [hci1] 14.159558
        Num handles: 1
        Handle: 975 Address: DF:A9:FF:F6:B1:1A (OUI DF-A9-FF)
        Count: 1
< ACL Data TX: Handle 975 flags 0x00 dlen 21              #196 [hci1] 14.159702
      SMP: Pairing Confirm (0x03) len 16
        Confim value: b03d201ac409f0c095c735bca80025ed
> HCI Event: Number of Completed Packets (0x13) plen 5    #197 [hci1] 14.327709
        Num handles: 1
        Handle: 975 Address: DF:A9:FF:F6:B1:1A (OUI DF-A9-FF)
        Count: 1
        #196: len 21 (1 Kb/s)
        Latency: 168 msec (81-173 msec ~167 msec)
> ACL Data RX: Handle 975 flags 0x02 dlen 21              #198 [hci1] 14.328042
      SMP: Pairing Random (0x04) len 16
        Random value: 391d8c386bc2ec740000000000000000
< HCI Command: Host Number of Com.. (0x03|0x0035) plen 5  #199 [hci1] 14.339786
        Num handles: 1
        Handle: 975 Address: DF:A9:FF:F6:B1:1A (OUI DF-A9-FF)
        Count: 1
< ACL Data TX: Handle 975 flags 0x00 dlen 21              #200 [hci1] 14.339865
      SMP: Pairing Random (0x04) len 16
        Random value: b67e7216d5bf664139eda2b542549666
> HCI Event: Number of Completed Packets (0x13) plen 5    #201 [hci1] 14.502485
        Num handles: 1
        Handle: 975 Address: DF:A9:FF:F6:B1:1A (OUI DF-A9-FF)
        Count: 1
        #200: len 21 (1 Kb/s)
        Latency: 162 msec (81-173 msec ~165 msec)
> ACL Data RX: Handle 975 flags 0x02 dlen 21              #202 [hci1] 14.590386
      SMP: Pairing Confirm (0x03) len 16
        Confim value: 370ffbaeb014fdc52718b17d0b247520
< HCI Command: Host Number of Com.. (0x03|0x0035) plen 5  #203 [hci1] 14.599567
        Num handles: 1
        Handle: 975 Address: DF:A9:FF:F6:B1:1A (OUI DF-A9-FF)
        Count: 1
< ACL Data TX: Handle 975 flags 0x00 dlen 21              #204 [hci1] 14.599651
      SMP: Pairing Confirm (0x03) len 16
        Confim value: d585eda145546c503790a7fc89ef738c
> HCI Event: Number of Completed Packets (0x13) plen 5    #205 [hci1] 14.765248
        Num handles: 1
        Handle: 975 Address: DF:A9:FF:F6:B1:1A (OUI DF-A9-FF)
        Count: 1
        #204: len 21 (1 Kb/s)
        Latency: 165 msec (81-173 msec ~165 msec)
> ACL Data RX: Handle 975 flags 0x02 dlen 21              #206 [hci1] 14.765645
      SMP: Pairing Random (0x04) len 16
        Random value: 6c440f2a5c9c295e0000000000000000
< HCI Command: Host Number of Com.. (0x03|0x0035) plen 5  #207 [hci1] 14.779794
        Num handles: 1
        Handle: 975 Address: DF:A9:FF:F6:B1:1A (OUI DF-A9-FF)
        Count: 1
< ACL Data TX: Handle 975 flags 0x00 dlen 21              #208 [hci1] 14.779878
      SMP: Pairing Random (0x04) len 16
        Random value: ed17f76500c95219dd01e09d1e63f87b
> HCI Event: Number of Completed Packets (0x13) plen 5    #209 [hci1] 14.939996
        Num handles: 1
        Handle: 975 Address: DF:A9:FF:F6:B1:1A (OUI DF-A9-FF)
        Count: 1
        #208: len 21 (1 Kb/s)
        Latency: 160 msec (81-173 msec ~162 msec)
> ACL Data RX: Handle 975 flags 0x02 dlen 21              #210 [hci1] 15.027870
      SMP: Pairing Confirm (0x03) len 16
        Confim value: 581104dba7e3d3267639ebb4964b1249
< HCI Command: Host Number of Com.. (0x03|0x0035) plen 5  #211 [hci1] 15.039284
        Num handles: 1
        Handle: 975 Address: DF:A9:FF:F6:B1:1A (OUI DF-A9-FF)
        Count: 1
< ACL Data TX: Handle 975 flags 0x00 dlen 21              #212 [hci1] 15.039378
      SMP: Pairing Confirm (0x03) len 16
        Confim value: f621a61810067305aa6fd057a733df22
> HCI Event: Number of Completed Packets (0x13) plen 5    #213 [hci1] 15.202702
        Num handles: 1
        Handle: 975 Address: DF:A9:FF:F6:B1:1A (OUI DF-A9-FF)
        Count: 1
        #212: len 21 (1 Kb/s)
        Latency: 163 msec (81-173 msec ~163 msec)
> ACL Data RX: Handle 975 flags 0x02 dlen 21              #214 [hci1] 15.203006
      SMP: Pairing Random (0x04) len 16
        Random value: b00d60c430a4d1570000000000000000
< HCI Command: Host Number of Com.. (0x03|0x0035) plen 5  #215 [hci1] 15.219694
        Num handles: 1
        Handle: 975 Address: DF:A9:FF:F6:B1:1A (OUI DF-A9-FF)
        Count: 1
< ACL Data TX: Handle 975 flags 0x00 dlen 21              #216 [hci1] 15.219772
      SMP: Pairing Random (0x04) len 16
        Random value: 81d35d47e1f6006d79c974bd9d9e1ee3
> HCI Event: Number of Completed Packets (0x13) plen 5    #217 [hci1] 15.377626
        Num handles: 1
        Handle: 975 Address: DF:A9:FF:F6:B1:1A (OUI DF-A9-FF)
        Count: 1
        #216: len 21 (1 Kb/s)
        Latency: 157 msec (81-173 msec ~160 msec)
> ACL Data RX: Handle 975 flags 0x02 dlen 21              #218 [hci1] 15.465322
      SMP: Pairing Confirm (0x03) len 16
        Confim value: 128cddec6bc7d959a2199ad5ab852387
< HCI Command: Host Number of Com.. (0x03|0x0035) plen 5  #219 [hci1] 15.479213
        Num handles: 1
        Handle: 975 Address: DF:A9:FF:F6:B1:1A (OUI DF-A9-FF)
        Count: 1
< ACL Data TX: Handle 975 flags 0x00 dlen 21              #220 [hci1] 15.479220
      SMP: Pairing Confirm (0x03) len 16
        Confim value: d5987095745994cac085065720e3c26d
> HCI Event: Number of Completed Packets (0x13) plen 5    #221 [hci1] 15.640174
        Num handles: 1
        Handle: 975 Address: DF:A9:FF:F6:B1:1A (OUI DF-A9-FF)
        Count: 1
        #220: len 21 (1 Kb/s)
        Latency: 160 msec (81-173 msec ~160 msec)
> ACL Data RX: Handle 975 flags 0x02 dlen 21              #222 [hci1] 15.640576
      SMP: Pairing Random (0x04) len 16
        Random value: 0b4ee83f789c9f890000000000000000
< HCI Command: Host Number of Com.. (0x03|0x0035) plen 5  #223 [hci1] 15.659804
        Num handles: 1
        Handle: 975 Address: DF:A9:FF:F6:B1:1A (OUI DF-A9-FF)
        Count: 1
< ACL Data TX: Handle 975 flags 0x00 dlen 21              #224 [hci1] 15.659944
      SMP: Pairing Random (0x04) len 16
        Random value: e7f7e0c2476823e41736a7e381bafb7c
> HCI Event: Number of Completed Packets (0x13) plen 5    #225 [hci1] 15.815022
        Num handles: 1
        Handle: 975 Address: DF:A9:FF:F6:B1:1A (OUI DF-A9-FF)
        Count: 1
        #224: len 21 (1 Kb/s)
        Latency: 155 msec (81-173 msec ~157 msec)
> ACL Data RX: Handle 975 flags 0x02 dlen 21              #226 [hci1] 15.902858
      SMP: Pairing Confirm (0x03) len 16
        Confim value: 6fcf3222d14e93af187863661f6c7e3d
< HCI Command: Host Number of Com.. (0x03|0x0035) plen 5  #227 [hci1] 15.919388
        Num handles: 1
        Handle: 975 Address: DF:A9:FF:F6:B1:1A (OUI DF-A9-FF)
        Count: 1
< ACL Data TX: Handle 975 flags 0x00 dlen 21              #228 [hci1] 15.919450
      SMP: Pairing Confirm (0x03) len 16
        Confim value: 942ecf1027d7c79d792d99ab5f128975
> HCI Event: Number of Completed Packets (0x13) plen 5    #229 [hci1] 16.077757
        Num handles: 1
        Handle: 975 Address: DF:A9:FF:F6:B1:1A (OUI DF-A9-FF)
        Count: 1
        #228: len 21 (1 Kb/s)
        Latency: 158 msec (81-173 msec ~158 msec)
> ACL Data RX: Handle 975 flags 0x02 dlen 21              #230 [hci1] 16.078021
      SMP: Pairing Random (0x04) len 16
        Random value: 2e40cabec9411b250000000000000000
< HCI Command: Host Number of Com.. (0x03|0x0035) plen 5  #231 [hci1] 16.079544
        Num handles: 1
        Handle: 975 Address: DF:A9:FF:F6:B1:1A (OUI DF-A9-FF)
        Count: 1
< ACL Data TX: Handle 975 flags 0x00 dlen 21              #232 [hci1] 16.079665
      SMP: Pairing Random (0x04) len 16
        Random value: fc8b40d9b0b09bc4296bf8753a8f6e1f
> HCI Event: Number of Completed Packets (0x13) plen 5    #233 [hci1] 16.252479
        Num handles: 1
        Handle: 975 Address: DF:A9:FF:F6:B1:1A (OUI DF-A9-FF)
        Count: 1
        #232: len 21 (0 Kb/s)
        Latency: 172 msec (81-173 msec ~165 msec)
> ACL Data RX: Handle 975 flags 0x02 dlen 21              #234 [hci1] 16.515251
      SMP: Pairing DHKey Check (0x0d) len 16
        E: 1d0becc15db87831fb7bc0958a16a1a7
< HCI Command: Host Number of Com.. (0x03|0x0035) plen 5  #235 [hci1] 16.519321
        Num handles: 1
        Handle: 975 Address: DF:A9:FF:F6:B1:1A (OUI DF-A9-FF)
        Count: 1
< ACL Data TX: Handle 975 flags 0x00 dlen 21              #236 [hci1] 16.519400
      SMP: Pairing DHKey Check (0x0d) len 16
        E: e42945574b2de7efd590aa10f275fc76
> HCI Event: Number of Completed Packets (0x13) plen 5    #237 [hci1] 16.689998
        Num handles: 1
        Handle: 975 Address: DF:A9:FF:F6:B1:1A (OUI DF-A9-FF)
        Count: 1
        #236: len 21 (0 Kb/s)
        Latency: 170 msec (81-173 msec ~168 msec)
> HCI Event: LE Meta Event (0x3e) plen 13                 #238 [hci1] 16.778076
      LE Long Term Key Request (0x05)
        Handle: 975 Address: DF:A9:FF:F6:B1:1A (OUI DF-A9-FF)
        Random number: 0x0000000000000000
        Encrypted diversifier: 0x0000
< HCI Command: LE Long Term Key... (0x08|0x001a) plen 18  #239 [hci1] 16.779318
        Handle: 975 Address: DF:A9:FF:F6:B1:1A (OUI DF-A9-FF)
        Long term key: 88c958bd8381b969f74467db3c3e8af6
> HCI Event: Command Complete (0x0e) plen 6               #240 [hci1] 16.780063
      LE Long Term Key Request Reply (0x08|0x001a) ncmd 1
        Status: Success (0x00)
        Handle: 975 Address: DF:A9:FF:F6:B1:1A (OUI DF-A9-FF)
> HCI Event: Encryption Change (0x08) plen 4              #241 [hci1] 17.215349
        Status: Success (0x00)
        Handle: 975 Address: DF:A9:FF:F6:B1:1A (OUI DF-A9-FF)
        Encryption: Enabled with AES-CCM (0x01)
> ACL Data RX: Handle 975 flags 0x02 dlen 21              #242 [hci1] 17.302821
      SMP: Identity Information (0x08) len 16
        Identity resolving key: 5f6a8f02f952fc893275612e04fe0e94
< HCI Command: Host Number of Com.. (0x03|0x0035) plen 5  #243 [hci1] 17.329879
        Num handles: 1
        Handle: 975 Address: DF:A9:FF:F6:B1:1A (OUI DF-A9-FF)
        Count: 1
> ACL Data RX: Handle 975 flags 0x02 dlen 12              #244 [hci1] 17.477683
      SMP: Identity Address Information (0x09) len 7
        Address: DF:A9:FF:F6:B1:1A (OUI DF-A9-FF)
< HCI Command: LE Add Device To... (0x08|0x0027) plen 39  #245 [hci1] 17.479389
        Address type: Public (0x00)
        Address: DF:A9:FF:F6:B1:1A (OUI DF-A9-FF)
        Peer identity resolving key: 5f6a8f02f952fc893275612e04fe0e94
        Local identity resolving key: 00000000000000000000000000000000
> HCI Event: Command Complete (0x0e) plen 4               #246 [hci1] 17.480370
      LE Add Device To Resolving List (0x08|0x0027) ncmd 1
        Status: Success (0x00)
< HCI Command: LE Set Privacy Mode (0x08|0x004e) plen 8   #247 [hci1] 17.499113
        Peer Identity address type: Public (0x00)
        Peer Identity address: DF:A9:FF:F6:B1:1A (OUI DF-A9-FF)
        Privacy Mode: Use Device Privacy (0x01)
> HCI Event: Command Complete (0x0e) plen 4               #248 [hci1] 17.499653
      LE Set Privacy Mode (0x08|0x004e) ncmd 1
        Status: Success (0x00)
< HCI Command: LE Set Address Res.. (0x08|0x002d) plen 1  #249 [hci1] 17.519322
        Address resolution: Enabled (0x01)
> HCI Event: Command Complete (0x0e) plen 4               #250 [hci1] 17.519820
      LE Set Address Resolution Enable (0x08|0x002d) ncmd 1
        Status: Success (0x00)
< HCI Command: Host Number of Com.. (0x03|0x0035) plen 5  #251 [hci1] 17.539192
        Num handles: 1
        Handle: 975 Address: DF:A9:FF:F6:B1:1A (OUI DF-A9-FF)
        Count: 1
> ACL Data RX: Handle 975 flags 0x02 dlen 13              #252 [hci1] 17.565171
      ATT: Find By Type Value Request (0x06) len 8
        Handle range: 0x0001-0xffff
        Attribute type: Primary Service (0x2800)
          UUID: Generic Telephony Bearer (0x184c)
< HCI Command: Host Number of Com.. (0x03|0x0035) plen 5  #253 [hci1] 17.579369
        Num handles: 1
        Handle: 975 Address: DF:A9:FF:F6:B1:1A (OUI DF-A9-FF)
        Count: 1
< ACL Data TX: Handle 975 flags 0x00 dlen 9               #254 [hci1] 17.579467
      ATT: Find By Type Value Response (0x07) len 4
        Handle range: 0x002a-0x0056
> HCI Event: Number of Completed Packets (0x13) plen 5    #255 [hci1] 17.740142
        Num handles: 1
        Handle: 975 Address: DF:A9:FF:F6:B1:1A (OUI DF-A9-FF)
        Count: 1
        #254: len 9 (0 Kb/s)
        Latency: 160 msec (81-173 msec ~164 msec)
> ACL Data RX: Handle 975 flags 0x02 dlen 13              #256 [hci1] 17.740446
      ATT: Find By Type Value Request (0x06) len 8
        Handle range: 0x0057-0xffff
        Attribute type: Primary Service (0x2800)
          UUID: Generic Telephony Bearer (0x184c)
< HCI Command: Host Number of Com.. (0x03|0x0035) plen 5  #257 [hci1] 17.759775
        Num handles: 1
        Handle: 975 Address: DF:A9:FF:F6:B1:1A (OUI DF-A9-FF)
        Count: 1
< ACL Data TX: Handle 975 flags 0x00 dlen 9               #258 [hci1] 17.759990
      ATT: Error Response (0x01) len 4
        Find By Type Value Request (0x06)
        Handle: 0x0057
        Error: Attribute Not Found (0x0a)
> HCI Event: Number of Completed Packets (0x13) plen 5    #259 [hci1] 17.915133
        Num handles: 1
        Handle: 975 Address: DF:A9:FF:F6:B1:1A (OUI DF-A9-FF)
        Count: 1
        #258: len 9 (0 Kb/s)
        Latency: 155 msec (81-173 msec ~159 msec)
> ACL Data RX: Handle 975 flags 0x02 dlen 11              #260 [hci1] 17.915315
      ATT: Read By Type Request (0x08) len 6
        Handle range: 0x002a-0x0056
        Attribute type: Characteristic (0x2803)
< HCI Command: Host Number of Com.. (0x03|0x0035) plen 5  #261 [hci1] 17.919693
        Num handles: 1
        Handle: 975 Address: DF:A9:FF:F6:B1:1A (OUI DF-A9-FF)
        Count: 1
< ACL Data TX: Handle 975 flags 0x00 dlen 20              #262 [hci1] 17.919869
      ATT: Read By Type Response (0x09) len 15
        Attribute data length: 7
        Attribute data list: 2 entries
        Handle: 0x002b
        Value: 122c00b32b
            Properties: 0x12
              Read (0x02)
              Notify (0x10)
            Value Handle: 0x002c
            Value UUID: Bearer Provider Name (0x2bb3)
        Handle: 0x002e
        Value: 022f00b42b
            Properties: 0x02
              Read (0x02)
            Value Handle: 0x002f
            Value UUID: Bearer UCI (0x2bb4)
> HCI Event: Number of Completed Packets (0x13) plen 5    #263 [hci1] 18.090127
        Num handles: 1
        Handle: 975 Address: DF:A9:FF:F6:B1:1A (OUI DF-A9-FF)
        Count: 1
        #262: len 20 (0 Kb/s)
        Latency: 170 msec (81-173 msec ~165 msec)
> ACL Data RX: Handle 975 flags 0x02 dlen 11              #264 [hci1] 18.090394
      ATT: Read By Type Request (0x08) len 6
        Handle range: 0x002f-0x0056
        Attribute type: Characteristic (0x2803)
< HCI Command: Host Number of Com.. (0x03|0x0035) plen 5  #265 [hci1] 18.099253
        Num handles: 1
        Handle: 975 Address: DF:A9:FF:F6:B1:1A (OUI DF-A9-FF)
        Count: 1
< ACL Data TX: Handle 975 flags 0x00 dlen 20              #266 [hci1] 18.099262
      ATT: Read By Type Response (0x09) len 15
        Attribute data length: 7
        Attribute data list: 2 entries
        Handle: 0x0030
        Value: 123100b52b
            Properties: 0x12
              Read (0x02)
              Notify (0x10)
            Value Handle: 0x0031
            Value UUID: Bearer Technology (0x2bb5)
        Handle: 0x0033
        Value: 123400b62b
            Properties: 0x12
              Read (0x02)
              Notify (0x10)
            Value Handle: 0x0034
            Value UUID: Bearer URI Schemes Supported List (0x2bb6)
> HCI Event: Number of Completed Packets (0x13) plen 5    #267 [hci1] 18.265094
        Num handles: 1
        Handle: 975 Address: DF:A9:FF:F6:B1:1A (OUI DF-A9-FF)
        Count: 1
        #266: len 20 (0 Kb/s)
        Latency: 165 msec (81-173 msec ~165 msec)
> ACL Data RX: Handle 975 flags 0x02 dlen 11              #268 [hci1] 18.265355
      ATT: Read By Type Request (0x08) len 6
        Handle range: 0x0034-0x0056
        Attribute type: Characteristic (0x2803)
< HCI Command: Host Number of Com.. (0x03|0x0035) plen 5  #269 [hci1] 18.279766
        Num handles: 1
        Handle: 975 Address: DF:A9:FF:F6:B1:1A (OUI DF-A9-FF)
        Count: 1
< ACL Data TX: Handle 975 flags 0x00 dlen 20              #270 [hci1] 18.279857
      ATT: Read By Type Response (0x09) len 15
        Attribute data length: 7
        Attribute data list: 2 entries
        Handle: 0x0036
        Value: 123700b72b
            Properties: 0x12
              Read (0x02)
              Notify (0x10)
            Value Handle: 0x0037
            Value UUID: Bearer Signal Strength (0x2bb7)
        Handle: 0x0039
        Value: 0e3a00b82b
            Properties: 0x0e
              Read (0x02)
              Write Without Response (0x04)
              Write (0x08)
            Value Handle: 0x003a
            Value UUID: Bearer Signal Strength Reporting Interval (0x2bb8)
> HCI Event: Number of Completed Packets (0x13) plen 5    #271 [hci1] 18.440082
        Num handles: 1
        Handle: 975 Address: DF:A9:FF:F6:B1:1A (OUI DF-A9-FF)
        Count: 1
        #270: len 20 (1 Kb/s)
        Latency: 160 msec (81-173 msec ~162 msec)
> ACL Data RX: Handle 975 flags 0x02 dlen 11              #272 [hci1] 18.440310
      ATT: Read By Type Request (0x08) len 6
        Handle range: 0x003a-0x0056
        Attribute type: Characteristic (0x2803)
< HCI Command: Host Number of Com.. (0x03|0x0035) plen 5  #273 [hci1] 18.459388
        Num handles: 1
        Handle: 975 Address: DF:A9:FF:F6:B1:1A (OUI DF-A9-FF)
        Count: 1
< ACL Data TX: Handle 975 flags 0x00 dlen 20              #274 [hci1] 18.459426
      ATT: Read By Type Response (0x09) len 15
        Attribute data length: 7
        Attribute data list: 2 entries
        Handle: 0x003b
        Value: 123c00b92b
            Properties: 0x12
              Read (0x02)
              Notify (0x10)
            Value Handle: 0x003c
            Value UUID: Bearer List Current Calls (0x2bb9)
        Handle: 0x003e
        Value: 023f00ba2b
            Properties: 0x02
              Read (0x02)
            Value Handle: 0x003f
            Value UUID: Content Control ID (0x2bba)
> HCI Event: Number of Completed Packets (0x13) plen 5    #275 [hci1] 18.615110
        Num handles: 1
        Handle: 975 Address: DF:A9:FF:F6:B1:1A (OUI DF-A9-FF)
        Count: 1
        #274: len 20 (1 Kb/s)
        Latency: 155 msec (81-173 msec ~159 msec)
> ACL Data RX: Handle 975 flags 0x02 dlen 11              #276 [hci1] 18.615355
      ATT: Read By Type Request (0x08) len 6
        Handle range: 0x003f-0x0056
        Attribute type: Characteristic (0x2803)
< HCI Command: Host Number of Com.. (0x03|0x0035) plen 5  #277 [hci1] 18.619641
        Num handles: 1
        Handle: 975 Address: DF:A9:FF:F6:B1:1A (OUI DF-A9-FF)
        Count: 1
< ACL Data TX: Handle 975 flags 0x00 dlen 20              #278 [hci1] 18.619741
      ATT: Read By Type Response (0x09) len 15
        Attribute data length: 7
        Attribute data list: 2 entries
        Handle: 0x0040
        Value: 124100bb2b
            Properties: 0x12
              Read (0x02)
              Notify (0x10)
            Value Handle: 0x0041
            Value UUID: Status Flags (0x2bbb)
        Handle: 0x0043
        Value: 124400bc2b
            Properties: 0x12
              Read (0x02)
              Notify (0x10)
            Value Handle: 0x0044
            Value UUID: Incoming Call Target Bearer URI (0x2bbc)
> HCI Event: Number of Completed Packets (0x13) plen 5    #279 [hci1] 18.790088
        Num handles: 1
        Handle: 975 Address: DF:A9:FF:F6:B1:1A (OUI DF-A9-FF)
        Count: 1
        #278: len 20 (0 Kb/s)
        Latency: 170 msec (81-173 msec ~164 msec)
> ACL Data RX: Handle 975 flags 0x02 dlen 11              #280 [hci1] 18.790294
      ATT: Read By Type Request (0x08) len 6
        Handle range: 0x0044-0x0056
        Attribute type: Characteristic (0x2803)
< HCI Command: Host Number of Com.. (0x03|0x0035) plen 5  #281 [hci1] 18.799785
        Num handles: 1
        Handle: 975 Address: DF:A9:FF:F6:B1:1A (OUI DF-A9-FF)
        Count: 1
< ACL Data TX: Handle 975 flags 0x00 dlen 20              #282 [hci1] 18.799865
      ATT: Read By Type Response (0x09) len 15
        Attribute data length: 7
        Attribute data list: 2 entries
        Handle: 0x0046
        Value: 124700bd2b
            Properties: 0x12
              Read (0x02)
              Notify (0x10)
            Value Handle: 0x0047
            Value UUID: Call State (0x2bbd)
        Handle: 0x0049
        Value: 1c4a00be2b
            Properties: 0x1c
              Write Without Response (0x04)
              Write (0x08)
              Notify (0x10)
            Value Handle: 0x004a
            Value UUID: Call Control Point (0x2bbe)
> HCI Event: Number of Completed Packets (0x13) plen 5    #283 [hci1] 18.965130
        Num handles: 1
        Handle: 975 Address: DF:A9:FF:F6:B1:1A (OUI DF-A9-FF)
        Count: 1
        #282: len 20 (0 Kb/s)
        Latency: 165 msec (81-173 msec ~165 msec)
> ACL Data RX: Handle 975 flags 0x02 dlen 11              #284 [hci1] 18.965295
      ATT: Read By Type Request (0x08) len 6
        Handle range: 0x004a-0x0056
        Attribute type: Characteristic (0x2803)
< HCI Command: Host Number of Com.. (0x03|0x0035) plen 5  #285 [hci1] 18.979229
        Num handles: 1
        Handle: 975 Address: DF:A9:FF:F6:B1:1A (OUI DF-A9-FF)
        Count: 1
< ACL Data TX: Handle 975 flags 0x00 dlen 20              #286 [hci1] 18.979253
      ATT: Read By Type Response (0x09) len 15
        Attribute data length: 7
        Attribute data list: 2 entries
        Handle: 0x004c
        Value: 024d00bf2b
            Properties: 0x02
              Read (0x02)
            Value Handle: 0x004d
            Value UUID: Call Control Point Optional Opcodes (0x2bbf)
        Handle: 0x004e
        Value: 104f00c02b
            Properties: 0x10
              Notify (0x10)
            Value Handle: 0x004f
            Value UUID: Termination Reason (0x2bc0)
> HCI Event: Number of Completed Packets (0x13) plen 5    #287 [hci1] 19.140077
        Num handles: 1
        Handle: 975 Address: DF:A9:FF:F6:B1:1A (OUI DF-A9-FF)
        Count: 1
        #286: len 20 (1 Kb/s)
        Latency: 160 msec (81-173 msec ~162 msec)
> ACL Data RX: Handle 975 flags 0x02 dlen 11              #288 [hci1] 19.140311
      ATT: Read By Type Request (0x08) len 6
        Handle range: 0x004f-0x0056
        Attribute type: Characteristic (0x2803)
< HCI Command: Host Number of Com.. (0x03|0x0035) plen 5  #289 [hci1] 19.159817
        Num handles: 1
        Handle: 975 Address: DF:A9:FF:F6:B1:1A (OUI DF-A9-FF)
        Count: 1
< ACL Data TX: Handle 975 flags 0x00 dlen 20              #290 [hci1] 19.159912
      ATT: Read By Type Response (0x09) len 15
        Attribute data length: 7
        Attribute data list: 2 entries
        Handle: 0x0051
        Value: 125200c12b
            Properties: 0x12
              Read (0x02)
              Notify (0x10)
            Value Handle: 0x0052
            Value UUID: Incoming Call (0x2bc1)
        Handle: 0x0054
        Value: 125500c22b
            Properties: 0x12
              Read (0x02)
              Notify (0x10)
            Value Handle: 0x0055
            Value UUID: Call Friendly Name (0x2bc2)
> HCI Event: Number of Completed Packets (0x13) plen 5    #291 [hci1] 19.315074
        Num handles: 1
        Handle: 975 Address: DF:A9:FF:F6:B1:1A (OUI DF-A9-FF)
        Count: 1
        #290: len 20 (1 Kb/s)
        Latency: 155 msec (81-173 msec ~159 msec)
> ACL Data RX: Handle 975 flags 0x02 dlen 11              #292 [hci1] 19.315286
      ATT: Read By Type Request (0x08) len 6
        Handle range: 0x0055-0x0056
        Attribute type: Characteristic (0x2803)
< HCI Command: Host Number of Com.. (0x03|0x0035) plen 5  #293 [hci1] 19.319668
        Num handles: 1
        Handle: 975 Address: DF:A9:FF:F6:B1:1A (OUI DF-A9-FF)
        Count: 1
< ACL Data TX: Handle 975 flags 0x00 dlen 9               #294 [hci1] 19.319874
      ATT: Error Response (0x01) len 4
        Read By Type Request (0x08)
        Handle: 0x0055
        Error: Attribute Not Found (0x0a)
> HCI Event: Number of Completed Packets (0x13) plen 5    #295 [hci1] 19.490034
        Num handles: 1
        Handle: 975 Address: DF:A9:FF:F6:B1:1A (OUI DF-A9-FF)
        Count: 1
        #294: len 9 (0 Kb/s)
        Latency: 170 msec (81-173 msec ~164 msec)
> ACL Data RX: Handle 975 flags 0x02 dlen 9               #296 [hci1] 19.490286
      ATT: Find Information Request (0x04) len 4
        Handle range: 0x002d-0x002d
< HCI Command: Host Number of Com.. (0x03|0x0035) plen 5  #297 [hci1] 19.499408
        Num handles: 1
        Handle: 975 Address: DF:A9:FF:F6:B1:1A (OUI DF-A9-FF)
        Count: 1
< ACL Data TX: Handle 975 flags 0x00 dlen 10              #298 [hci1] 19.499453
      ATT: Find Information Response (0x05) len 5
        Format: UUID-16 (0x01)
        Handle: 0x002d
        UUID: Client Characteristic Configuration (0x2902)
> HCI Event: Number of Completed Packets (0x13) plen 5    #299 [hci1] 19.665124
        Num handles: 1
        Handle: 975 Address: DF:A9:FF:F6:B1:1A (OUI DF-A9-FF)
        Count: 1
        #298: len 10 (0 Kb/s)
        Latency: 165 msec (81-173 msec ~165 msec)
> ACL Data RX: Handle 975 flags 0x02 dlen 9               #300 [hci1] 19.665215
      ATT: Find Information Request (0x04) len 4
        Handle range: 0x0032-0x0032
< HCI Command: Host Number of Com.. (0x03|0x0035) plen 5  #301 [hci1] 19.679800
        Num handles: 1
        Handle: 975 Address: DF:A9:FF:F6:B1:1A (OUI DF-A9-FF)
        Count: 1
< ACL Data TX: Handle 975 flags 0x00 dlen 10              #302 [hci1] 19.679880
      ATT: Find Information Response (0x05) len 5
        Format: UUID-16 (0x01)
        Handle: 0x0032
        UUID: Client Characteristic Configuration (0x2902)
> HCI Event: Number of Completed Packets (0x13) plen 5    #303 [hci1] 19.840058
        Num handles: 1
        Handle: 975 Address: DF:A9:FF:F6:B1:1A (OUI DF-A9-FF)
        Count: 1
        #302: len 10 (0 Kb/s)
        Latency: 160 msec (81-173 msec ~162 msec)
> ACL Data RX: Handle 975 flags 0x02 dlen 9               #304 [hci1] 19.840238
      ATT: Find Information Request (0x04) len 4
        Handle range: 0x0035-0x0035
< HCI Command: Host Number of Com.. (0x03|0x0035) plen 5  #305 [hci1] 19.859598
        Num handles: 1
        Handle: 975 Address: DF:A9:FF:F6:B1:1A (OUI DF-A9-FF)
        Count: 1
< ACL Data TX: Handle 975 flags 0x00 dlen 10              #306 [hci1] 19.859682
      ATT: Find Information Response (0x05) len 5
        Format: UUID-16 (0x01)
        Handle: 0x0035
        UUID: Client Characteristic Configuration (0x2902)
> HCI Event: Number of Completed Packets (0x13) plen 5    #307 [hci1] 20.015114
        Num handles: 1
        Handle: 975 Address: DF:A9:FF:F6:B1:1A (OUI DF-A9-FF)
        Count: 1
        #306: len 10 (0 Kb/s)
        Latency: 155 msec (81-173 msec ~159 msec)
> ACL Data RX: Handle 975 flags 0x02 dlen 9               #308 [hci1] 20.015270
      ATT: Find Information Request (0x04) len 4
        Handle range: 0x0038-0x0038
< HCI Command: Host Number of Com.. (0x03|0x0035) plen 5  #309 [hci1] 20.019576
        Num handles: 1
        Handle: 975 Address: DF:A9:FF:F6:B1:1A (OUI DF-A9-FF)
        Count: 1
< ACL Data TX: Handle 975 flags 0x00 dlen 10              #310 [hci1] 20.019694
      ATT: Find Information Response (0x05) len 5
        Format: UUID-16 (0x01)
        Handle: 0x0038
        UUID: Client Characteristic Configuration (0x2902)
> HCI Event: Number of Completed Packets (0x13) plen 5    #311 [hci1] 20.190064
        Num handles: 1
        Handle: 975 Address: DF:A9:FF:F6:B1:1A (OUI DF-A9-FF)
        Count: 1
        #310: len 10 (0 Kb/s)
        Latency: 170 msec (81-173 msec ~164 msec)
> ACL Data RX: Handle 975 flags 0x02 dlen 9               #312 [hci1] 20.190247
      ATT: Find Information Request (0x04) len 4
        Handle range: 0x003d-0x003d
< HCI Command: Host Number of Com.. (0x03|0x0035) plen 5  #313 [hci1] 20.199790
        Num handles: 1
        Handle: 975 Address: DF:A9:FF:F6:B1:1A (OUI DF-A9-FF)
        Count: 1
< ACL Data TX: Handle 975 flags 0x00 dlen 10              #314 [hci1] 20.199904
      ATT: Find Information Response (0x05) len 5
        Format: UUID-16 (0x01)
        Handle: 0x003d
        UUID: Client Characteristic Configuration (0x2902)
> HCI Event: Number of Completed Packets (0x13) plen 5    #315 [hci1] 20.364992
        Num handles: 1
        Handle: 975 Address: DF:A9:FF:F6:B1:1A (OUI DF-A9-FF)
        Count: 1
        #314: len 10 (0 Kb/s)
        Latency: 165 msec (81-173 msec ~164 msec)
> ACL Data RX: Handle 975 flags 0x02 dlen 9               #316 [hci1] 20.365270
      ATT: Find Information Request (0x04) len 4
        Handle range: 0x0042-0x0042
< HCI Command: Host Number of Com.. (0x03|0x0035) plen 5  #317 [hci1] 20.379726
        Num handles: 1
        Handle: 975 Address: DF:A9:FF:F6:B1:1A (OUI DF-A9-FF)
        Count: 1
< ACL Data TX: Handle 975 flags 0x00 dlen 10              #318 [hci1] 20.379804
      ATT: Find Information Response (0x05) len 5
        Format: UUID-16 (0x01)
        Handle: 0x0042
        UUID: Client Characteristic Configuration (0x2902)
> HCI Event: Number of Completed Packets (0x13) plen 5    #319 [hci1] 20.540016
        Num handles: 1
        Handle: 975 Address: DF:A9:FF:F6:B1:1A (OUI DF-A9-FF)
        Count: 1
        #318: len 10 (0 Kb/s)
        Latency: 160 msec (81-173 msec ~162 msec)
> ACL Data RX: Handle 975 flags 0x02 dlen 9               #320 [hci1] 20.540265
      ATT: Find Information Request (0x04) len 4
        Handle range: 0x0045-0x0045
< HCI Command: Host Number of Com.. (0x03|0x0035) plen 5  #321 [hci1] 20.559411
        Num handles: 1
        Handle: 975 Address: DF:A9:FF:F6:B1:1A (OUI DF-A9-FF)
        Count: 1
< ACL Data TX: Handle 975 flags 0x00 dlen 10              #322 [hci1] 20.559458
      ATT: Find Information Response (0x05) len 5
        Format: UUID-16 (0x01)
        Handle: 0x0045
        UUID: Client Characteristic Configuration (0x2902)
> HCI Event: Number of Completed Packets (0x13) plen 5    #323 [hci1] 20.715105
        Num handles: 1
        Handle: 975 Address: DF:A9:FF:F6:B1:1A (OUI DF-A9-FF)
        Count: 1
        #322: len 10 (0 Kb/s)
        Latency: 155 msec (81-173 msec ~159 msec)
> ACL Data RX: Handle 975 flags 0x02 dlen 9               #324 [hci1] 20.715236
      ATT: Find Information Request (0x04) len 4
        Handle range: 0x0048-0x0048
< HCI Command: Host Number of Com.. (0x03|0x0035) plen 5  #325 [hci1] 20.719813
        Num handles: 1
        Handle: 975 Address: DF:A9:FF:F6:B1:1A (OUI DF-A9-FF)
        Count: 1
< ACL Data TX: Handle 975 flags 0x00 dlen 10              #326 [hci1] 20.719886
      ATT: Find Information Response (0x05) len 5
        Format: UUID-16 (0x01)
        Handle: 0x0048
        UUID: Client Characteristic Configuration (0x2902)
> HCI Event: Number of Completed Packets (0x13) plen 5    #327 [hci1] 20.889997
        Num handles: 1
        Handle: 975 Address: DF:A9:FF:F6:B1:1A (OUI DF-A9-FF)
        Count: 1
        #326: len 10 (0 Kb/s)
        Latency: 170 msec (81-173 msec ~164 msec)
> ACL Data RX: Handle 975 flags 0x02 dlen 9               #328 [hci1] 20.890248
      ATT: Find Information Request (0x04) len 4
        Handle range: 0x004b-0x004b
< HCI Command: Host Number of Com.. (0x03|0x0035) plen 5  #329 [hci1] 20.899779
        Num handles: 1
        Handle: 975 Address: DF:A9:FF:F6:B1:1A (OUI DF-A9-FF)
        Count: 1
< ACL Data TX: Handle 975 flags 0x00 dlen 10              #330 [hci1] 20.899900
      ATT: Find Information Response (0x05) len 5
        Format: UUID-16 (0x01)
        Handle: 0x004b
        UUID: Client Characteristic Configuration (0x2902)
> HCI Event: Number of Completed Packets (0x13) plen 5    #331 [hci1] 21.064988
        Num handles: 1
        Handle: 975 Address: DF:A9:FF:F6:B1:1A (OUI DF-A9-FF)
        Count: 1
        #330: len 10 (0 Kb/s)
        Latency: 165 msec (81-173 msec ~164 msec)
> ACL Data RX: Handle 975 flags 0x02 dlen 9               #332 [hci1] 21.065197
      ATT: Find Information Request (0x04) len 4
        Handle range: 0x0050-0x0050
< HCI Command: Host Number of Com.. (0x03|0x0035) plen 5  #333 [hci1] 21.079439
        Num handles: 1
        Handle: 975 Address: DF:A9:FF:F6:B1:1A (OUI DF-A9-FF)
        Count: 1
< ACL Data TX: Handle 975 flags 0x00 dlen 10              #334 [hci1] 21.079489
      ATT: Find Information Response (0x05) len 5
        Format: UUID-16 (0x01)
        Handle: 0x0050
        UUID: Client Characteristic Configuration (0x2902)
> HCI Event: Number of Completed Packets (0x13) plen 5    #335 [hci1] 21.240019
        Num handles: 1
        Handle: 975 Address: DF:A9:FF:F6:B1:1A (OUI DF-A9-FF)
        Count: 1
        #334: len 10 (0 Kb/s)
        Latency: 160 msec (81-173 msec ~162 msec)
> ACL Data RX: Handle 975 flags 0x02 dlen 9               #336 [hci1] 21.240220
      ATT: Find Information Request (0x04) len 4
        Handle range: 0x0053-0x0053
< HCI Command: Host Number of Com.. (0x03|0x0035) plen 5  #337 [hci1] 21.259759
        Num handles: 1
        Handle: 975 Address: DF:A9:FF:F6:B1:1A (OUI DF-A9-FF)
        Count: 1
< ACL Data TX: Handle 975 flags 0x00 dlen 10              #338 [hci1] 21.259832
      ATT: Find Information Response (0x05) len 5
        Format: UUID-16 (0x01)
        Handle: 0x0053
        UUID: Client Characteristic Configuration (0x2902)
> HCI Event: Number of Completed Packets (0x13) plen 5    #339 [hci1] 21.415111
        Num handles: 1
        Handle: 975 Address: DF:A9:FF:F6:B1:1A (OUI DF-A9-FF)
        Count: 1
        #338: len 10 (0 Kb/s)
        Latency: 155 msec (81-173 msec ~158 msec)
> ACL Data RX: Handle 975 flags 0x02 dlen 9               #340 [hci1] 21.415218
      ATT: Find Information Request (0x04) len 4
        Handle range: 0x0056-0x0056
< HCI Command: Host Number of Com.. (0x03|0x0035) plen 5  #341 [hci1] 21.419628
        Num handles: 1
        Handle: 975 Address: DF:A9:FF:F6:B1:1A (OUI DF-A9-FF)
        Count: 1
< ACL Data TX: Handle 975 flags 0x00 dlen 10              #342 [hci1] 21.419790
      ATT: Find Information Response (0x05) len 5
        Format: UUID-16 (0x01)
        Handle: 0x0056
        UUID: Client Characteristic Configuration (0x2902)
> HCI Event: Number of Completed Packets (0x13) plen 5    #343 [hci1] 21.590047
        Num handles: 1
        Handle: 975 Address: DF:A9:FF:F6:B1:1A (OUI DF-A9-FF)
        Count: 1
        #342: len 10 (0 Kb/s)
        Latency: 170 msec (81-173 msec ~164 msec)
> ACL Data RX: Handle 975 flags 0x02 dlen 9               #344 [hci1] 21.590221
      ATT: Write Request (0x12) len 4
        Handle: 0x0048
          Data: 0000
< HCI Command: Host Number of Com.. (0x03|0x0035) plen 5  #345 [hci1] 21.599343
        Num handles: 1
        Handle: 975 Address: DF:A9:FF:F6:B1:1A (OUI DF-A9-FF)
        Count: 1
< ACL Data TX: Handle 975 flags 0x00 dlen 5               #346 [hci1] 21.599389
      ATT: Write Response (0x13) len 0
> HCI Event: Number of Completed Packets (0x13) plen 5    #347 [hci1] 21.765051
        Num handles: 1
        Handle: 975 Address: DF:A9:FF:F6:B1:1A (OUI DF-A9-FF)
        Count: 1
        #346: len 5 (0 Kb/s)
        Latency: 165 msec (81-173 msec ~165 msec)
> ACL Data RX: Handle 975 flags 0x02 dlen 9               #348 [hci1] 21.765312
      ATT: Write Request (0x12) len 4
        Handle: 0x0048
          Data: 0100
< HCI Command: Host Number of Com.. (0x03|0x0035) plen 5  #349 [hci1] 21.779938
        Num handles: 1
        Handle: 975 Address: DF:A9:FF:F6:B1:1A (OUI DF-A9-FF)
        Count: 1
< ACL Data TX: Handle 975 flags 0x00 dlen 5               #350 [hci1] 21.780050
      ATT: Write Response (0x13) len 0
> HCI Event: Number of Completed Packets (0x13) plen 5    #351 [hci1] 21.940001
        Num handles: 1
        Handle: 975 Address: DF:A9:FF:F6:B1:1A (OUI DF-A9-FF)
        Count: 1
        #350: len 5 (0 Kb/s)
        Latency: 159 msec (81-173 msec ~162 msec)
> ACL Data RX: Handle 975 flags 0x02 dlen 9               #352 [hci1] 21.940203
      ATT: Write Request (0x12) len 4
        Handle: 0x0053
          Data: 0000
< HCI Command: Host Number of Com.. (0x03|0x0035) plen 5  #353 [hci1] 21.959801
        Num handles: 1
        Handle: 975 Address: DF:A9:FF:F6:B1:1A (OUI DF-A9-FF)
        Count: 1
< ACL Data TX: Handle 975 flags 0x00 dlen 5               #354 [hci1] 21.959907
      ATT: Write Response (0x13) len 0
> HCI Event: Number of Completed Packets (0x13) plen 5    #355 [hci1] 22.115056
        Num handles: 1
        Handle: 975 Address: DF:A9:FF:F6:B1:1A (OUI DF-A9-FF)
        Count: 1
        #354: len 5 (0 Kb/s)
        Latency: 155 msec (81-173 msec ~158 msec)
> ACL Data RX: Handle 975 flags 0x02 dlen 9               #356 [hci1] 22.115225
      ATT: Write Request (0x12) len 4
        Handle: 0x0053
          Data: 0100
< HCI Command: Host Number of Com.. (0x03|0x0035) plen 5  #357 [hci1] 22.119218
        Num handles: 1
        Handle: 975 Address: DF:A9:FF:F6:B1:1A (OUI DF-A9-FF)
        Count: 1
< ACL Data TX: Handle 975 flags 0x00 dlen 5               #358 [hci1] 22.119235
      ATT: Write Response (0x13) len 0
> HCI Event: Number of Completed Packets (0x13) plen 5    #359 [hci1] 22.290017
        Num handles: 1
        Handle: 975 Address: DF:A9:FF:F6:B1:1A (OUI DF-A9-FF)
        Count: 1
        #358: len 5 (0 Kb/s)
        Latency: 170 msec (81-173 msec ~164 msec)
> ACL Data RX: Handle 975 flags 0x02 dlen 9               #360 [hci1] 22.290211
      ATT: Write Request (0x12) len 4
        Handle: 0x0050
          Data: 0000
< HCI Command: Host Number of Com.. (0x03|0x0035) plen 5  #361 [hci1] 22.299752
        Num handles: 1
        Handle: 975 Address: DF:A9:FF:F6:B1:1A (OUI DF-A9-FF)
        Count: 1
< ACL Data TX: Handle 975 flags 0x00 dlen 5               #362 [hci1] 22.299843
      ATT: Write Response (0x13) len 0
> HCI Event: Number of Completed Packets (0x13) plen 5    #363 [hci1] 22.465112
        Num handles: 1
        Handle: 975 Address: DF:A9:FF:F6:B1:1A (OUI DF-A9-FF)
        Count: 1
        #362: len 5 (0 Kb/s)
        Latency: 165 msec (81-173 msec ~165 msec)
> ACL Data RX: Handle 975 flags 0x02 dlen 9               #364 [hci1] 22.465230
      ATT: Write Request (0x12) len 4
        Handle: 0x0050
          Data: 0100
< HCI Command: Host Number of Com.. (0x03|0x0035) plen 5  #365 [hci1] 22.479482
        Num handles: 1
        Handle: 975 Address: DF:A9:FF:F6:B1:1A (OUI DF-A9-FF)
        Count: 1
< ACL Data TX: Handle 975 flags 0x00 dlen 5               #366 [hci1] 22.479530
      ATT: Write Response (0x13) len 0
> HCI Event: Number of Completed Packets (0x13) plen 5    #367 [hci1] 22.640006
        Num handles: 1
        Handle: 975 Address: DF:A9:FF:F6:B1:1A (OUI DF-A9-FF)
        Count: 1
        #366: len 5 (0 Kb/s)
        Latency: 160 msec (81-173 msec ~162 msec)
> ACL Data RX: Handle 975 flags 0x02 dlen 9               #368 [hci1] 22.640201
      ATT: Write Request (0x12) len 4
        Handle: 0x004b
          Data: 0000
< HCI Command: Host Number of Com.. (0x03|0x0035) plen 5  #369 [hci1] 22.659264
        Num handles: 1
        Handle: 975 Address: DF:A9:FF:F6:B1:1A (OUI DF-A9-FF)
        Count: 1
< ACL Data TX: Handle 975 flags 0x00 dlen 5               #370 [hci1] 22.659373
      ATT: Write Response (0x13) len 0
> HCI Event: Number of Completed Packets (0x13) plen 5    #371 [hci1] 22.815054
        Num handles: 1
        Handle: 975 Address: DF:A9:FF:F6:B1:1A (OUI DF-A9-FF)
        Count: 1
        #370: len 5 (0 Kb/s)
        Latency: 155 msec (81-173 msec ~159 msec)
> ACL Data RX: Handle 975 flags 0x02 dlen 9               #372 [hci1] 22.815208
      ATT: Write Request (0x12) len 4
        Handle: 0x004b
          Data: 0100
< HCI Command: Host Number of Com.. (0x03|0x0035) plen 5  #373 [hci1] 22.819805
        Num handles: 1
        Handle: 975 Address: DF:A9:FF:F6:B1:1A (OUI DF-A9-FF)
        Count: 1
< ACL Data TX: Handle 975 flags 0x00 dlen 5               #374 [hci1] 22.819884
      ATT: Write Response (0x13) len 0
> HCI Event: Number of Completed Packets (0x13) plen 5    #375 [hci1] 22.990110
        Num handles: 1
        Handle: 975 Address: DF:A9:FF:F6:B1:1A (OUI DF-A9-FF)
        Count: 1
        #374: len 5 (0 Kb/s)
        Latency: 170 msec (81-173 msec ~164 msec)
> ACL Data RX: Handle 975 flags 0x02 dlen 9               #376 [hci1] 22.990221
      ATT: Write Request (0x12) len 4
        Handle: 0x0045
          Data: 0000
< HCI Command: Host Number of Com.. (0x03|0x0035) plen 5  #377 [hci1] 22.999666
        Num handles: 1
        Handle: 975 Address: DF:A9:FF:F6:B1:1A (OUI DF-A9-FF)
        Count: 1
< ACL Data TX: Handle 975 flags 0x00 dlen 5               #378 [hci1] 22.999837
      ATT: Write Response (0x13) len 0
> HCI Event: Number of Completed Packets (0x13) plen 5    #379 [hci1] 23.165024
        Num handles: 1
        Handle: 975 Address: DF:A9:FF:F6:B1:1A (OUI DF-A9-FF)
        Count: 1
        #378: len 5 (0 Kb/s)
        Latency: 165 msec (81-173 msec ~164 msec)
> ACL Data RX: Handle 975 flags 0x02 dlen 9               #380 [hci1] 23.165203
      ATT: Write Request (0x12) len 4
        Handle: 0x0045
          Data: 0100
< HCI Command: Host Number of Com.. (0x03|0x0035) plen 5  #381 [hci1] 23.179285
        Num handles: 1
        Handle: 975 Address: DF:A9:FF:F6:B1:1A (OUI DF-A9-FF)
        Count: 1
< ACL Data TX: Handle 975 flags 0x00 dlen 5               #382 [hci1] 23.179293
      ATT: Write Response (0x13) len 0
> HCI Event: Number of Completed Packets (0x13) plen 5    #383 [hci1] 23.340020
        Num handles: 1
        Handle: 975 Address: DF:A9:FF:F6:B1:1A (OUI DF-A9-FF)
        Count: 1
        #382: len 5 (0 Kb/s)
        Latency: 160 msec (81-173 msec ~162 msec)
> ACL Data RX: Handle 975 flags 0x02 dlen 9               #384 [hci1] 23.340266
      ATT: Write Request (0x12) len 4
        Handle: 0x0056
          Data: 0000
< HCI Command: Host Number of Com.. (0x03|0x0035) plen 5  #385 [hci1] 23.359675
        Num handles: 1
        Handle: 975 Address: DF:A9:FF:F6:B1:1A (OUI DF-A9-FF)
        Count: 1
< ACL Data TX: Handle 975 flags 0x00 dlen 5               #386 [hci1] 23.359763
      ATT: Write Response (0x13) len 0
> HCI Event: Number of Completed Packets (0x13) plen 5    #387 [hci1] 23.515084
        Num handles: 1
        Handle: 975 Address: DF:A9:FF:F6:B1:1A (OUI DF-A9-FF)
        Count: 1
        #386: len 5 (0 Kb/s)
        Latency: 155 msec (81-173 msec ~159 msec)
> ACL Data RX: Handle 975 flags 0x02 dlen 9               #388 [hci1] 23.515171
      ATT: Write Request (0x12) len 4
        Handle: 0x0056
          Data: 0100
< HCI Command: Host Number of Com.. (0x03|0x0035) plen 5  #389 [hci1] 23.519753
        Num handles: 1
        Handle: 975 Address: DF:A9:FF:F6:B1:1A (OUI DF-A9-FF)
        Count: 1
< ACL Data TX: Handle 975 flags 0x00 dlen 5               #390 [hci1] 23.519843
      ATT: Write Response (0x13) len 0
> HCI Event: Number of Completed Packets (0x13) plen 5    #391 [hci1] 23.690067
        Num handles: 1
        Handle: 975 Address: DF:A9:FF:F6:B1:1A (OUI DF-A9-FF)
        Count: 1
        #390: len 5 (0 Kb/s)
        Latency: 170 msec (81-173 msec ~164 msec)
> ACL Data RX: Handle 975 flags 0x02 dlen 9               #392 [hci1] 23.690180
      ATT: Write Request (0x12) len 4
        Handle: 0x0038
          Data: 0000
< HCI Command: Host Number of Com.. (0x03|0x0035) plen 5  #393 [hci1] 23.699301
        Num handles: 1
        Handle: 975 Address: DF:A9:FF:F6:B1:1A (OUI DF-A9-FF)
        Count: 1
< ACL Data TX: Handle 975 flags 0x00 dlen 5               #394 [hci1] 23.699308
      ATT: Write Response (0x13) len 0
> HCI Event: Number of Completed Packets (0x13) plen 5    #395 [hci1] 23.865124
        Num handles: 1
        Handle: 975 Address: DF:A9:FF:F6:B1:1A (OUI DF-A9-FF)
        Count: 1
        #394: len 5 (0 Kb/s)
        Latency: 165 msec (81-173 msec ~165 msec)
> ACL Data RX: Handle 975 flags 0x02 dlen 9               #396 [hci1] 23.865249
      ATT: Write Request (0x12) len 4
        Handle: 0x0038
          Data: 0100
< HCI Command: Host Number of Com.. (0x03|0x0035) plen 5  #397 [hci1] 23.879781
        Num handles: 1
        Handle: 975 Address: DF:A9:FF:F6:B1:1A (OUI DF-A9-FF)
        Count: 1
< ACL Data TX: Handle 975 flags 0x00 dlen 5               #398 [hci1] 23.879892
      ATT: Write Response (0x13) len 0
> HCI Event: Number of Completed Packets (0x13) plen 5    #399 [hci1] 24.039933
        Num handles: 1
        Handle: 975 Address: DF:A9:FF:F6:B1:1A (OUI DF-A9-FF)
        Count: 1
        #398: len 5 (0 Kb/s)
        Latency: 160 msec (81-173 msec ~162 msec)
> ACL Data RX: Handle 975 flags 0x02 dlen 7               #400 [hci1] 24.040169
      ATT: Read Request (0x0a) len 2
        Handle: 0x0041
< HCI Command: Host Number of Com.. (0x03|0x0035) plen 5  #401 [hci1] 24.059855
        Num handles: 1
        Handle: 975 Address: DF:A9:FF:F6:B1:1A (OUI DF-A9-FF)
        Count: 1
< ACL Data TX: Handle 975 flags 0x00 dlen 7               #402 [hci1] 24.059907
      ATT: Read Response (0x0b) len 2
> HCI Event: Number of Completed Packets (0x13) plen 5    #403 [hci1] 24.214971
        Num handles: 1
        Handle: 975 Address: DF:A9:FF:F6:B1:1A (OUI DF-A9-FF)
        Count: 1
        #402: len 7 (0 Kb/s)
        Latency: 155 msec (81-173 msec ~158 msec)
> ACL Data RX: Handle 975 flags 0x02 dlen 7               #404 [hci1] 24.215134
      ATT: Read Request (0x0a) len 2
        Handle: 0x004d
< HCI Command: Host Number of Com.. (0x03|0x0035) plen 5  #405 [hci1] 24.219530
        Num handles: 1
        Handle: 975 Address: DF:A9:FF:F6:B1:1A (OUI DF-A9-FF)
        Count: 1
< ACL Data TX: Handle 975 flags 0x00 dlen 7               #406 [hci1] 24.219612
      ATT: Read Response (0x0b) len 2
> HCI Event: Number of Completed Packets (0x13) plen 5    #407 [hci1] 24.390088
        Num handles: 1
        Handle: 975 Address: DF:A9:FF:F6:B1:1A (OUI DF-A9-FF)
        Count: 1
        #406: len 7 (0 Kb/s)
        Latency: 170 msec (81-173 msec ~164 msec)
> ACL Data RX: Handle 975 flags 0x02 dlen 21              #408 [hci1] 24.390390
      ATT: Write Command (0x52) len 16
        Handle: 0x004a
          Data: 04424c5545544f4f544831323334
< HCI Command: Host Number of Com.. (0x03|0x0035) plen 5  #409 [hci1] 24.399876
        Num handles: 1
        Handle: 975 Address: DF:A9:FF:F6:B1:1A (OUI DF-A9-FF)
        Count: 1
< ACL Data TX: Handle 975 flags 0x00 dlen 10              #410 [hci1] 24.400320
      ATT: Handle Value Notification (0x1b) len 5
        Handle: 0x004a
          Data: 040006
> HCI Event: Number of Completed Packets (0x13) plen 5    #411 [hci1] 24.564858
        Num handles: 1
        Handle: 975 Address: DF:A9:FF:F6:B1:1A (OUI DF-A9-FF)
        Count: 1
        #410: len 10 (0 Kb/s)
        Latency: 164 msec (81-173 msec ~164 msec)
> HCI Event: Disconnect Complete (0x05) plen 4            #412 [hci1] 25.965131
        Status: Success (0x00)
        Handle: 975 Address: DF:A9:FF:F6:B1:1A (OUI DF-A9-FF)
        Reason: Remote User Terminated Connection (0x13)
< HCI Command: Reset (0x03|0x0003) plen 0                 #413 [hci1] 31.829206
> HCI Event: Command Complete (0x0e) plen 4               #414 [hci1] 31.829677
      Reset (0x03|0x0003) ncmd 1
        Status: Success (0x00)
@ USER Close: main                                    {0x0001} [hci1] 31.839164
= Close Index: 00:00:00:00:00:00                               [hci1] 31.839172
