Bluetooth monitor ver 5.72
= Note: Linux version 7.0.0-31-generic (x86_64)                        0.783914
= Note: Bluetooth subsystem version 2.22                               0.783916
= New Index: 00:00:00:00:00:00 (Primary,UART,hci2)              [hci2] 0.783916
= New Index: 00:00:00:00:00:00 (Primary,UART,hci1)              [hci1] 0.783917
= New Index: 48:5F:99:8E:E0:64 (Primary,USB,hci0)               [hci0] 0.783917
= Open Index: 00:00:00:00:00:00                                 [hci1] 0.857050
= Index Info: 00:00:00:00:00:00 (Nordic Semiconductor ASA)      [hci1] 0.857055
@ USER Open: main (privileged) version 2.22            {0x0001} [hci1] 0.857057
< HCI Command: Reset (0x03|0x0003) plen 0                    #1 [hci1] 0.857397
> HCI Event: Command Complete (0x0e) plen 4                  #2 [hci1] 0.857862
      Reset (0x03|0x0003) ncmd 1
        Status: Success (0x00)
< HCI Command: Read Local Supported... (0x04|0x0003) plen 0  #3 [hci1] 0.877016
> HCI Event: Command Complete (0x0e) plen 12                 #4 [hci1] 0.877607
      Read Local Supported Features (0x04|0x0003) ncmd 1
        Status: Success (0x00)
        Features: 0x00 0x00 0x00 0x00 0x60 0x00 0x00 0x00
          BR/EDR Not Supported
          LE Supported (Controller)
< HCI Command: Read Local Version In.. (0x04|0x0001) plen 0  #5 [hci1] 0.897053
> HCI Event: Command Complete (0x0e) plen 12                 #6 [hci1] 0.897598
      Read Local Version Information (0x04|0x0001) ncmd 1
        Status: Success (0x00)
        HCI version: Reserved (0x11) - Revision 12345 (0x3039)
        LMP version: Reserved (0x11) - Subversion 12345 (0x3039)
        Manufacturer: Nordic Semiconductor ASA (89)
< HCI Command: Read Local Supported... (0x04|0x0002) plen 0  #7 [hci1] 0.917087
> HCI Event: Command Complete (0x0e) plen 68                 #8 [hci1] 0.918187
      Read Local Supported Commands (0x04|0x0002) ncmd 1
        Status: Success (0x00)
        Commands: 115 entries
          Disconnect (Octet 0 - Bit 5)
          Read Remote Version Information (Octet 2 - Bit 7)
          Set Event Mask (Octet 5 - Bit 6)
          Reset (Octet 5 - Bit 7)
          Read Connection Accept Timeout (Octet 7 - Bit 2)
          Write Connection Accept Timeout (Octet 7 - Bit 3)
          Read Transmit Power Level (Octet 10 - Bit 2)
          Set Controller To Host Flow Control (Octet 10 - Bit 5)
          Host Buffer Size (Octet 10 - Bit 6)
          Host Number of Completed Packets (Octet 10 - Bit 7)
          Read Local Version Information (Octet 14 - Bit 3)
          Read Local Supported Features (Octet 14 - Bit 5)
          Read BD ADDR (Octet 15 - Bit 1)
          Read RSSI (Octet 15 - Bit 5)
          Set Event Mask Page 2 (Octet 22 - Bit 2)
          LE Set Event Mask (Octet 25 - Bit 0)
          LE Read Buffer Size (Octet 25 - Bit 1)
          LE Read Local Supported Features (Octet 25 - Bit 2)
          LE Set Random Address (Octet 25 - Bit 4)
          LE Set Advertising Parameters (Octet 25 - Bit 5)
          LE Read Advertising Channel TX Power (Octet 25 - Bit 6)
          LE Set Advertising Data (Octet 25 - Bit 7)
          LE Set Scan Response Data (Octet 26 - Bit 0)
          LE Set Advertise Enable (Octet 26 - Bit 1)
          LE Set Scan Parameters (Octet 26 - Bit 2)
          LE Set Scan Enable (Octet 26 - Bit 3)
          LE Create Connection (Octet 26 - Bit 4)
          LE Create Connection Cancel (Octet 26 - Bit 5)
          LE Read Accept List Size (Octet 26 - Bit 6)
          LE Clear Accept List (Octet 26 - Bit 7)
          LE Add Device To Accept List (Octet 27 - Bit 0)
          LE Remove Device From Accept List (Octet 27 - Bit 1)
          LE Connection Update (Octet 27 - Bit 2)
          LE Set Host Channel Classification (Octet 27 - Bit 3)
          LE Read Channel Map (Octet 27 - Bit 4)
          LE Read Remote Used Features (Octet 27 - Bit 5)
          LE Encrypt (Octet 27 - Bit 6)
          LE Rand (Octet 27 - Bit 7)
          LE Start Encryption (Octet 28 - Bit 0)
          LE Long Term Key Request Reply (Octet 28 - Bit 1)
          LE Long Term Key Request Neg Reply (Octet 28 - Bit 2)
          LE Read Supported States (Octet 28 - Bit 3)
          Read Authenticated Payload Timeout (Octet 32 - Bit 4)
          Write Authenticated Payload Timeout (Octet 32 - Bit 5)
          LE Set Data Length (Octet 33 - Bit 6)
          LE Read Suggested Default Data Length (Octet 33 - Bit 7)
          LE Write Suggested Default Data Length (Octet 34 - Bit 0)
          LE Add Device To Resolving List (Octet 34 - Bit 3)
          LE Remove Device From Resolving List (Octet 34 - Bit 4)
          LE Clear Resolving List (Octet 34 - Bit 5)
          LE Read Resolving List Size (Octet 34 - Bit 6)
          LE Set Address Resolution Enable (Octet 35 - Bit 1)
          LE Set Resolvable Private Address Timeout (Octet 35 - Bit 2)
          LE Read Maximum Data Length (Octet 35 - Bit 3)
          LE Read PHY (Octet 35 - Bit 4)
          LE Set Default PHY (Octet 35 - Bit 5)
          LE Set PHY (Octet 35 - Bit 6)
          LE Set Advertising Set Random Address (Octet 36 - Bit 1)
          LE Set Extended Advertising Parameters (Octet 36 - Bit 2)
          LE Set Extended Advertising Data (Octet 36 - Bit 3)
          LE Set Extended Scan Response Data (Octet 36 - Bit 4)
          LE Set Extended Advertising Enable (Octet 36 - Bit 5)
          LE Read Maximum Advertising Data Length (Octet 36 - Bit 6)
          LE Read Number of Supported Advertising Sets (Octet 36 - Bit 7)
          LE Remove Advertising Set (Octet 37 - Bit 0)
          LE Clear Advertising Sets (Octet 37 - Bit 1)
          LE Set Periodic Advertising Parameters (Octet 37 - Bit 2)
          LE Set Periodic Advertising Data (Octet 37 - Bit 3)
          LE Set Periodic Advertising Enable (Octet 37 - Bit 4)
          LE Set Extended Scan Parameters (Octet 37 - Bit 5)
          LE Set Extended Scan Enable (Octet 37 - Bit 6)
          LE Extended Create Connection (Octet 37 - Bit 7)
          LE Periodic Advertising Create Sync (Octet 38 - Bit 0)
          LE Periodic Advertising Create Sync Cancel (Octet 38 - Bit 1)
          LE Periodic Advertising Terminate Sync (Octet 38 - Bit 2)
          LE Add Device To Periodic Advertiser List (Octet 38 - Bit 3)
          LE Remove Device From Periodic Advertiser List (Octet 38 - Bit 4)
          LE Clear Periodic Advertiser List (Octet 38 - Bit 5)
          LE Read Periodic Advertiser List Size (Octet 38 - Bit 6)
          LE Read Transmit Power (Octet 38 - Bit 7)
          LE Read RF Path Compensation (Octet 39 - Bit 0)
          LE Write RF Path Compensation (Octet 39 - Bit 1)
          LE Set Privacy Mode (Octet 39 - Bit 2)
          LE Periodic Advertising Receive Enable (Octet 40 - Bit 5)
          LE Periodic Advertising Sync Transfer (Octet 40 - Bit 6)
          LE Periodic Advertising Set Info Transfer (Octet 40 - Bit 7)
          LE Periodic Advertising Sync Transfer Parameters (Octet 41 - Bit 0)
          LE Set Default Periodic Advertisng Sync Transfer Parameters (Octet 41 - Bit 1)
          LE Read Buffer v2 (Octet 41 - Bit 5)
          LE Read ISO TX Sync (Octet 41 - Bit 6)
          LE Set Connected Isochronous Group Parameters (Octet 41 - Bit 7)
          LE Set Connected Isochronous Group Parameters Test (Octet 42 - Bit 0)
          LE Create Connected Isochronous Stream (Octet 42 - Bit 1)
          LE Remove Connected Isochronous Group (Octet 42 - Bit 2)
          LE Accept Connected Isochronous Stream Request (Octet 42 - Bit 3)
          LE Reject Connected Isochronous Stream Request (Octet 42 - Bit 4)
          LE Create Broadcast Isochronous Group (Octet 42 - Bit 5)
          LE Create Broadcast Isochronous Group Test (Octet 42 - Bit 6)
          LE Terminate Broadcast Isochronous Group (Octet 42 - Bit 7)
          LE Broadcast Isochronous Group Create Sync (Octet 43 - Bit 0)
          LE Broadcast Isochronous Group Terminate Sync (Octet 43 - Bit 1)
          LE Request Peer SCA (Octet 43 - Bit 2)
          LE Setup Isochronous Data Path (Octet 43 - Bit 3)
          LE Remove Isochronous Data Path (Octet 43 - Bit 4)
          LE Isochronous Transmit Test (Octet 43 - Bit 5)
          LE Isochronous Receive Test (Octet 43 - Bit 6)
          LE Isochronous Read Test Counters (Octet 43 - Bit 7)
          LE Isochronous Read Test Counters (Octet 44 - Bit 0)
          LE Set Host Feature (Octet 44 - Bit 1)
          Octet 44 - Bit 2 
          Octet 45 - Bit 6 
          Octet 46 - Bit 0 
          Octet 46 - Bit 1 
          Octet 46 - Bit 2 
          Octet 47 - Bit 4 
< HCI Command: Host Buffer Size (0x03|0x0033) plen 7         #9 [hci1] 0.937023
        ACL MTU: 255  ACL max packet: 16
        SCO MTU: 0    SCO max packet: 0
> HCI Event: Command Complete (0x0e) plen 4                 #10 [hci1] 0.937498
      Host Buffer Size (0x03|0x0033) ncmd 1
        Status: Success (0x00)
< HCI Command: Set Controller To Ho.. (0x03|0x0031) plen 1  #11 [hci1] 0.957050
        Flow control: ACL Data Packets (0x01)
> HCI Event: Command Complete (0x0e) plen 4                 #12 [hci1] 0.957398
      Set Controller To Host Flow Control (0x03|0x0031) ncmd 1
        Status: Success (0x00)
< HCI Command: LE Read Local Suppor.. (0x08|0x0003) plen 0  #13 [hci1] 0.977021
> HCI Event: Command Complete (0x0e) plen 12                #14 [hci1] 0.977505
      LE Read Local Supported Features (0x08|0x0003) ncmd 1
        Status: Success (0x00)
        Features: 0xfd 0x79 0x00 0xf7 0x30 0x01 0x00 0x00
          LE Encryption
          Extended Reject Indication
          Peripheral-initiated Features Exchange
          LE Ping
          LE Data Packet Length Extension
          LL Privacy
          Extended Scanner Filter Policies
          LE 2M PHY
          LE Coded PHY
          LE Extended Advertising
          LE Periodic Advertising
          Channel Selection Algorithm #2
          Periodic Advertising Sync Transfer - Sender
          Periodic Advertising Sync Transfer - Recipient
          Sleep Clock Accuracy Updates
          Connected Isochronous Stream - Central
          Connected Isochronous Stream - Peripheral
          Isochronous Broadcaster
          Synchronized Receiver
          Periodic Advertising ADI support
          Connection Subrating
          Unknown features (0x0000010000000000)
< HCI Command: LE Set Host Feature (0x08|0x0074) plen 2     #15 [hci1] 0.997034
        Bit Number: 32
          Connected Isochronous Stream (Host Support)
        Bit Value: 1
> HCI Event: Command Complete (0x0e) plen 4                 #16 [hci1] 0.997505
      LE Set Host Feature (0x08|0x0074) ncmd 1
        Status: Success (0x00)
< HCI Command: LE Read Buffer v2 (0x08|0x0060) plen 0       #17 [hci1] 1.017024
> HCI Event: Command Complete (0x0e) plen 10                #18 [hci1] 1.017485
      LE Read Buffer v2 (0x08|0x0060) ncmd 1
        Status: Success (0x00)
        ACL MTU: 27
        ACL max packet: 3
        ISO MTU: 318
        ISO max packet: 3
< HCI Command: LE Read Maximum Adve.. (0x08|0x003a) plen 0  #19 [hci1] 1.037054
> HCI Event: Command Complete (0x0e) plen 6                 #20 [hci1] 1.037500
      LE Read Maximum Advertising Data Length (0x08|0x003a) ncmd 1
        Status: Success (0x00)
        Max length: 1650
< HCI Command: LE Read Supported St.. (0x08|0x001c) plen 0  #21 [hci1] 1.057026
> HCI Event: Command Complete (0x0e) plen 12                #22 [hci1] 1.057530
      LE Read Supported States (0x08|0x001c) ncmd 1
        Status: Success (0x00)
        States: 0x000003ff3e0306ff
          Non-connectable Advertising State
          Scannable Advertising State
          Connectable Advertising State
          High Duty Cycle Directed Advertising State
          Passive Scanning State
          Active Scanning State
          Initiating State
            and Connection State (Central Role)
          Connection State (Peripheral Role)
          Scannable Advertising State
            and Passive Scanning State
          Connectable Advertising State
            and Passive Scanning State
          Non-connectable Advertising State
            and Initiating State
          Scannable Advertising State
            and Initiating State
          Active Scanning State
            and Connection State (Central Role)
          Passive Scanning State
            and Connection State (Peripheral Role)
          Active Scanning State
            and Connection State (Peripheral Role)
          Initiating State
            and Connection State (Central Role)
            and Central Role & Central Role
          Low Duty Cycle Directed Advertising State
          Connectable Advertising State
            and Initiating State
            and Central Role & Peripheral Role
          High Duty Cycle Directed Advertising State
            and Initiating State
            and Central Role & Peripheral Role
          Low Duty Cycle Directed Advertising State
            and Initiating State
            and Central Role & Peripheral Role
          Connectable Advertising State
            and Connection State (Central Role)
            and Central Role & Peripheral Role
          High Duty Cycle Directed Advertising State
            and Connection State (Central Role)
            and Central Role & Peripheral Role
          Low Duty Cycle Directed Advertising State
            and Connection State (Central Role)
            and Central Role & Peripheral Role
          Connectable Advertising State
            and Connection State (Peripheral Role)
            and Central Role & Peripheral Role
          High Duty Cycle Directed Advertising State
            and Connection State (Peripheral Role)
            and Peripheral Role & Peripheral Role
          Low Duty Cycle Directed Advertising State
            and Connection State (Peripheral Role)
            and Peripheral Role & Peripheral Role
          Initiating State
            and Connection State (Peripheral Role)
            and Central Role & Peripheral Role
< HCI Command: LE Read Maximum Data.. (0x08|0x002f) plen 0  #23 [hci1] 1.077018
> HCI Event: Command Complete (0x0e) plen 12                #24 [hci1] 1.077645
      LE Read Maximum Data Length (0x08|0x002f) ncmd 1
        Status: Success (0x00)
        Max TX octets: 251
        Max TX time: 2704
        Max RX octets: 251
        Max RX time: 2704
< HCI Command: LE Write Suggested D.. (0x08|0x0024) plen 4  #25 [hci1] 1.097009
        TX octets: 251
        TX time: 2704
> HCI Event: Command Complete (0x0e) plen 4                 #26 [hci1] 1.097543
      LE Write Suggested Default Data Length (0x08|0x0024) ncmd 1
        Status: Success (0x00)
< HCI Command: LE Read Resolving Li.. (0x08|0x002a) plen 0  #27 [hci1] 1.116996
> HCI Event: Command Complete (0x0e) plen 5                 #28 [hci1] 1.117535
      LE Read Resolving List Size (0x08|0x002a) ncmd 1
        Status: Success (0x00)
        Size: 8
< HCI Command: LE Set Host Feature (0x08|0x0074) plen 2     #29 [hci1] 1.137088
        Bit Number: 38
          Connection Subrating (Host Support)
        Bit Value: 1
> HCI Event: Command Complete (0x0e) plen 4                 #30 [hci1] 1.137515
      LE Set Host Feature (0x08|0x0074) ncmd 1
        Status: Success (0x00)
< HCI Command: LE Set Event Mask (0x08|0x0001) plen 8       #31 [hci1] 1.157089
        Mask: 0x000002063f87fa5e
          LE Advertising Report
          LE Connection Update Complete
          LE Read Remote Used Features Complete
          LE Long Term Key Request
          LE Data Length Change
          LE Enhanced Connection Complete
          LE PHY Update Complete
          LE Extended Advertising Report
          LE Periodic Advertising Sync Established
          LE Periodic Advertising Report
          LE Periodic Advertising Sync Lost
          LE Extended Scan Timeout
          LE Extended Advertising Set Terminated
          LE Scan Request Received
          LE Periodic Advertising Sync Transfer Rvc
          LE CIS Established
          LE CIS Request
          LE Create BIG Complete
          LE Terminate BIG Complete
          LE BIG Sync Estabilished Complete
          LE BIG Sync Lost
          LE BIG Info Advertising Report
          LE Subrate Change
          Unknown mask (0x0000020000000000)
> HCI Event: Command Complete (0x0e) plen 4                 #32 [hci1] 1.157639
      LE Set Event Mask (0x08|0x0001) ncmd 1
        Status: Success (0x00)
< HCI Command: Set Event Mask (0x03|0x0001) plen 8          #33 [hci1] 1.177047
        Mask: 0x2000800002008890
          Disconnection Complete
          Encryption Change
          Read Remote Version Information Complete
          Hardware Error
          Data Buffer Overflow
          Encryption Key Refresh Complete
          LE Meta
> HCI Event: Command Complete (0x0e) plen 4                 #34 [hci1] 1.177639
      Set Event Mask (0x03|0x0001) ncmd 1
        Status: Success (0x00)
< HCI Command: Read BD ADDR (0x04|0x0009) plen 0            #35 [hci1] 1.197052
> HCI Event: Command Complete (0x0e) plen 10                #36 [hci1] 1.197679
      Read BD ADDR (0x04|0x0009) ncmd 1
        Status: Success (0x00)
        Address: 00:00:00:00:00:00 (OUI 00-00-00)
< HCI Command: LE Set Random Address (0x08|0x0005) plen 6   #37 [hci1] 1.217060
        Address: D5:B6:CC:31:DB:3B (Static)
> HCI Event: Command Complete (0x0e) plen 4                 #38 [hci1] 1.217609
      LE Set Random Address (0x08|0x0005) ncmd 1
        Status: Success (0x00)
< HCI Command: LE Extended Create... (0x08|0x0043) plen 26  #39 [hci1] 4.867365
        Filter policy: Accept list is not used (0x00)
        Own address type: Random (0x01)
        Peer address type: Public (0x00)
        Peer address: DF:A9:FF:F6:B1:1A (OUI DF-A9-FF)
        Initiating PHYs: 0x01
        Entry 0: LE 1M
          Scan interval: 60.000 msec (0x0060)
          Scan window: 60.000 msec (0x0060)
          Min connection interval: 30.00 msec (0x0018)
          Max connection interval: 50.00 msec (0x0028)
          Connection latency: 0 (0x0000)
          Supervision timeout: 4000 msec (0x0190)
          Min connection length: 0.000 msec (0x0000)
          Max connection length: 0.000 msec (0x0000)
> HCI Event: Command Status (0x0f) plen 4                   #40 [hci1] 4.868366
      LE Extended Create Connection (0x08|0x0043) ncmd 1
        Status: Success (0x00)
> HCI Event: LE Meta Event (0x3e) plen 31                   #41 [hci1] 4.971907
      LE Enhanced Connection Complete (0x0a)
        Status: Success (0x00)
        Handle: 504
        Role: Central (0x00)
        Peer address type: Public (0x00)
        Peer address: DF:A9:FF:F6:B1:1A (OUI DF-A9-FF)
        Local resolvable private address: 00:00:00:00:00:00 (Non-Resolvable)
        Peer resolvable private address: 00:00:00:00:00:00 (Non-Resolvable)
        Connection interval: 50.00 msec (0x0028)
        Connection latency: 0 (0x0000)
        Supervision timeout: 4000 msec (0x0190)
        Central clock accuracy: 0x00
< HCI Command: LE Read Remote Used... (0x08|0x0016) plen 2  #42 [hci1] 4.977618
        Handle: 504 Address: DF:A9:FF:F6:B1:1A (OUI DF-A9-FF)
> HCI Event: Command Status (0x0f) plen 4                   #43 [hci1] 4.978057
      LE Read Remote Used Features (0x08|0x0016) ncmd 1
        Status: Success (0x00)
< HCI Command: LE Set PHY (0x08|0x0032) plen 7              #44 [hci1] 4.997492
        Handle: 504 Address: DF:A9:FF:F6:B1:1A (OUI DF-A9-FF)
        All PHYs preference: 0x00
        TX PHYs preference: 0x02
          LE 2M
        RX PHYs preference: 0x02
          LE 2M
        PHY options preference: Reserved (0x0000)
> HCI Event: Command Status (0x0f) plen 4                   #45 [hci1] 4.998069
      LE Set PHY (0x08|0x0032) ncmd 1
        Status: Success (0x00)
> HCI Event: LE Meta Event (0x3e) plen 12                   #46 [hci1] 5.123369
      LE Read Remote Used Features (0x04)
        Status: Success (0x00)
        Handle: 504 Address: DF:A9:FF:F6:B1:1A (OUI DF-A9-FF)
        Features: 0x2d 0x49 0x00 0xf7 0x67 0xd9 0x00 0x80
          LE Encryption
          Extended Reject Indication
          Peripheral-initiated Features Exchange
          LE Data Packet Length Extension
          LE 2M PHY
          LE Coded PHY
          Channel Selection Algorithm #2
          Periodic Advertising Sync Transfer - Sender
          Periodic Advertising Sync Transfer - Recipient
          Sleep Clock Accuracy Updates
          Connected Isochronous Stream - Central
          Connected Isochronous Stream - Peripheral
          Isochronous Broadcaster
          Synchronized Receiver
          Connected Isochronous Stream (Host Support)
          LE Power Control Request
          LE Power Control Request
          Connection Subrating
          Connection Subrating (Host Support)
          Unknown features (0x8000d90000000000)
> HCI Event: LE Meta Event (0x3e) plen 6                    #47 [hci1] 5.572632
      LE PHY Update Complete (0x0c)
        Status: Success (0x00)
        Handle: 504 Address: DF:A9:FF:F6:B1:1A (OUI DF-A9-FF)
        TX PHY: LE 2M (0x02)
        RX PHY: LE 2M (0x02)
< ACL Data TX: Handle 504 flags 0x00 dlen 11                #48 [hci1] 5.907288
      SMP: Pairing Request (0x01) len 6
        IO capability: KeyboardDisplay (0x04)
        OOB data: Authentication data not present (0x00)
        Authentication requirement: Bonding, No MITM, SC, No Keypresses (0x09)
        Max encryption key size: 16
        Initiator key distribution: EncKey (0x01)
        Responder key distribution: EncKey IdKey (0x03)
> HCI Event: Number of Completed Packets (0x13) plen 5      #49 [hci1] 5.923066
        Num handles: 1
        Handle: 504 Address: DF:A9:FF:F6:B1:1A (OUI DF-A9-FF)
        Count: 1
        #48: len 11 (5 Kb/s)
        Latency: 15 msec (15-15 msec ~15 msec)
> ACL Data RX: Handle 504 flags 0x02 dlen 11                #50 [hci1] 5.973211
      SMP: Pairing Response (0x02) len 6
        IO capability: KeyboardDisplay (0x04)
        OOB data: Authentication data not present (0x00)
        Authentication requirement: Bonding, MITM, SC, No Keypresses (0x0d)
        Max encryption key size: 16
        Initiator key distribution: EncKey (0x01)
        Responder key distribution: EncKey IdKey (0x03)
< HCI Command: Host Number of Compl.. (0x03|0x0035) plen 5  #51 [hci1] 5.977120
        Num handles: 1
        Handle: 504 Address: DF:A9:FF:F6:B1:1A (OUI DF-A9-FF)
        Count: 1
< ACL Data TX: Handle 504 flags 0x00 dlen 27                #52 [hci1] 5.977127
< ACL Data TX: Handle 504 flags 0x01 dlen 27                #53 [hci1] 5.977128
< ACL Data TX: Handle 504 flags 0x01 dlen 15                #54 [hci1] 5.977128
      SMP: Pairing Public Key (0x0c) len 64
        X: 98308440221e2d910f0e54b71e7ec652857aa9b5a0dc65028824cc19db1226e9
        Y: 67a4816bcb62efb21701e31fdb27561a6217575fb007a8bbdabe7e28b6f68482
> HCI Event: Number of Completed Packets (0x13) plen 5      #55 [hci1] 6.023253
        Num handles: 1
        Handle: 504 Address: DF:A9:FF:F6:B1:1A (OUI DF-A9-FF)
        Count: 1
        #52: len 27 (4 Kb/s)
        Latency: 46 msec (15-46 msec ~30 msec)
> HCI Event: Number of Completed Packets (0x13) plen 5      #56 [hci1] 6.023627
        Num handles: 1
        Handle: 504 Address: DF:A9:FF:F6:B1:1A (OUI DF-A9-FF)
        Count: 1
        #53: len 27 (4 Kb/s)
        Latency: 46 msec (15-46 msec ~38 msec)
> HCI Event: Number of Completed Packets (0x13) plen 5      #57 [hci1] 6.024175
        Num handles: 1
        Handle: 504 Address: DF:A9:FF:F6:B1:1A (OUI DF-A9-FF)
        Count: 1
        #54: len 15 (2 Kb/s)
        Latency: 47 msec (15-47 msec ~42 msec)
> ACL Data RX: Handle 504 flags 0x02 dlen 27                #58 [hci1] 6.073450
> ACL Data RX: Handle 504 flags 0x01 dlen 27                #59 [hci1] 6.073819
> ACL Data RX: Handle 504 flags 0x01 dlen 15                #60 [hci1] 6.074199
      SMP: Pairing Public Key (0x0c) len 64
        X: 7546bfea3d881ca6f145488d34eb6c7c8c1392465241813229fb2c66dc04e934
        Y: 5b46db6c846c295e049ef72c0bf73ed57e2ede076bfedc5de10d52695b514ce6
< HCI Command: Host Number of Compl.. (0x03|0x0035) plen 5  #61 [hci1] 6.077628
        Num handles: 1
        Handle: 504 Address: DF:A9:FF:F6:B1:1A (OUI DF-A9-FF)
        Count: 1
< HCI Command: Host Number of Compl.. (0x03|0x0035) plen 5  #62 [hci1] 6.077787
        Num handles: 1
        Handle: 504 Address: DF:A9:FF:F6:B1:1A (OUI DF-A9-FF)
        Count: 1
< HCI Command: Host Number of Compl.. (0x03|0x0035) plen 5  #63 [hci1] 6.077866
        Num handles: 1
        Handle: 504 Address: DF:A9:FF:F6:B1:1A (OUI DF-A9-FF)
        Count: 1
> ACL Data RX: Handle 504 flags 0x02 dlen 21                #64 [hci1] 6.173437
      SMP: Pairing Confirm (0x03) len 16
        Confim value: 7d6cb9f1683eb3cdc02f98d3318c61ea
< HCI Command: Host Number of Compl.. (0x03|0x0035) plen 5  #65 [hci1] 6.177072
        Num handles: 1
        Handle: 504 Address: DF:A9:FF:F6:B1:1A (OUI DF-A9-FF)
        Count: 1
< ACL Data TX: Handle 504 flags 0x00 dlen 21                #66 [hci1] 6.177111
      SMP: Pairing Random (0x04) len 16
        Random value: 8e6108f966a694cbe26df70bb96773e6
> HCI Event: Number of Completed Packets (0x13) plen 5      #67 [hci1] 6.223052
        Num handles: 1
        Handle: 504 Address: DF:A9:FF:F6:B1:1A (OUI DF-A9-FF)
        Count: 1
        #66: len 21 (3 Kb/s)
        Latency: 45 msec (15-47 msec ~44 msec)
> ACL Data RX: Handle 504 flags 0x02 dlen 21                #68 [hci1] 6.473338
      SMP: Pairing Random (0x04) len 16
        Random value: 6a50639c3d1d69463d1dd7ddd624ab14
< HCI Command: Host Number of Compl.. (0x03|0x0035) plen 5  #69 [hci1] 6.477352
        Num handles: 1
        Handle: 504 Address: DF:A9:FF:F6:B1:1A (OUI DF-A9-FF)
        Count: 1
< ACL Data TX: Handle 504 flags 0x00 dlen 21                #70 [hci1] 6.927533
      SMP: Pairing DHKey Check (0x0d) len 16
        E: 293a54476af6780b05b3ae36d38687fd
> HCI Event: Number of Completed Packets (0x13) plen 5      #71 [hci1] 6.973159
        Num handles: 1
        Handle: 504 Address: DF:A9:FF:F6:B1:1A (OUI DF-A9-FF)
        Count: 1
        #70: len 21 (3 Kb/s)
        Latency: 45 msec (15-47 msec ~45 msec)
> ACL Data RX: Handle 504 flags 0x02 dlen 21                #72 [hci1] 7.023341
      SMP: Pairing DHKey Check (0x0d) len 16
        E: fd022afc2cd10eaa225ab904b2fcde9c
< HCI Command: LE Start Encryption (0x08|0x0019) plen 28    #73 [hci1] 7.037639
        Handle: 504 Address: DF:A9:FF:F6:B1:1A (OUI DF-A9-FF)
        Random number: 0x0000000000000000
        Encrypted diversifier: 0x0000
        Long term key: 0ca9371fd0bf76b40b6f191fcfa0c518
> HCI Event: Command Status (0x0f) plen 4                   #74 [hci1] 7.038700
      LE Start Encryption (0x08|0x0019) ncmd 1
        Status: Success (0x00)
< HCI Command: Host Number of Compl.. (0x03|0x0035) plen 5  #75 [hci1] 7.057389
        Num handles: 1
        Handle: 504 Address: DF:A9:FF:F6:B1:1A (OUI DF-A9-FF)
        Count: 1
> HCI Event: Encryption Change (0x08) plen 4                #76 [hci1] 7.373066
        Status: Success (0x00)
        Handle: 504 Address: DF:A9:FF:F6:B1:1A (OUI DF-A9-FF)
        Encryption: Enabled with AES-CCM (0x01)
> ACL Data RX: Handle 504 flags 0x02 dlen 21                #77 [hci1] 7.423334
      SMP: Identity Information (0x08) len 16
        Identity resolving key: 6cf0d45ffcfbbc186cdd142739e03843
< HCI Command: Host Number of Compl.. (0x03|0x0035) plen 5  #78 [hci1] 7.437553
        Num handles: 1
        Handle: 504 Address: DF:A9:FF:F6:B1:1A (OUI DF-A9-FF)
        Count: 1
> ACL Data RX: Handle 504 flags 0x02 dlen 12                #79 [hci1] 7.523231
      SMP: Identity Address Information (0x09) len 7
        Address: DF:A9:FF:F6:B1:1A (OUI DF-A9-FF)
< HCI Command: LE Add Device To Re.. (0x08|0x0027) plen 39  #80 [hci1] 7.537394
        Address type: Public (0x00)
        Address: DF:A9:FF:F6:B1:1A (OUI DF-A9-FF)
        Peer identity resolving key: 6cf0d45ffcfbbc186cdd142739e03843
        Local identity resolving key: 00000000000000000000000000000000
> HCI Event: Command Complete (0x0e) plen 4                 #81 [hci1] 7.538364
      LE Add Device To Resolving List (0x08|0x0027) ncmd 1
        Status: Success (0x00)
< HCI Command: LE Set Privacy Mode (0x08|0x004e) plen 8     #82 [hci1] 7.557415
        Peer Identity address type: Public (0x00)
        Peer Identity address: DF:A9:FF:F6:B1:1A (OUI DF-A9-FF)
        Privacy Mode: Use Device Privacy (0x01)
> HCI Event: Command Complete (0x0e) plen 4                 #83 [hci1] 7.557977
      LE Set Privacy Mode (0x08|0x004e) ncmd 1
        Status: Success (0x00)
< HCI Command: LE Set Address Resol.. (0x08|0x002d) plen 1  #84 [hci1] 7.577460
        Address resolution: Enabled (0x01)
> HCI Event: Command Complete (0x0e) plen 4                 #85 [hci1] 7.578059
      LE Set Address Resolution Enable (0x08|0x002d) ncmd 1
        Status: Success (0x00)
< HCI Command: Host Number of Compl.. (0x03|0x0035) plen 5  #86 [hci1] 7.597226
        Num handles: 1
        Handle: 504 Address: DF:A9:FF:F6:B1:1A (OUI DF-A9-FF)
        Count: 1
> HCI Event: Disconnect Complete (0x05) plen 4              #87 [hci1] 8.272779
        Status: Success (0x00)
        Handle: 504 Address: DF:A9:FF:F6:B1:1A (OUI DF-A9-FF)
        Reason: Remote User Terminated Connection (0x13)
< HCI Command: LE Extended Create... (0x08|0x0043) plen 26  #88 [hci1] 8.967608
        Filter policy: Accept list is not used (0x00)
        Own address type: Random (0x01)
        Peer address type: Public (0x00)
        Peer address: DF:A9:FF:F6:B1:1A (OUI DF-A9-FF)
        Initiating PHYs: 0x01
        Entry 0: LE 1M
          Scan interval: 60.000 msec (0x0060)
          Scan window: 60.000 msec (0x0060)
          Min connection interval: 30.00 msec (0x0018)
          Max connection interval: 50.00 msec (0x0028)
          Connection latency: 0 (0x0000)
          Supervision timeout: 4000 msec (0x0190)
          Min connection length: 0.000 msec (0x0000)
          Max connection length: 0.000 msec (0x0000)
> HCI Event: Command Status (0x0f) plen 4                   #89 [hci1] 8.968647
      LE Extended Create Connection (0x08|0x0043) ncmd 1
        Status: Success (0x00)
> HCI Event: LE Meta Event (0x3e) plen 31                   #90 [hci1] 9.010538
      LE Enhanced Connection Complete (0x0a)
        Status: Success (0x00)
        Handle: 522
        Role: Central (0x00)
        Peer address type: Public (0x00)
        Peer address: DF:A9:FF:F6:B1:1A (OUI DF-A9-FF)
        Local resolvable private address: 00:00:00:00:00:00 (Non-Resolvable)
        Peer resolvable private address: 00:00:00:00:00:00 (Non-Resolvable)
        Connection interval: 50.00 msec (0x0028)
        Connection latency: 0 (0x0000)
        Supervision timeout: 4000 msec (0x0190)
        Central clock accuracy: 0x00
< HCI Command: LE Read Remote Used... (0x08|0x0016) plen 2  #91 [hci1] 9.017701
        Handle: 522 Address: DF:A9:FF:F6:B1:1A (OUI DF-A9-FF)
> HCI Event: Command Status (0x0f) plen 4                   #92 [hci1] 9.018322
      LE Read Remote Used Features (0x08|0x0016) ncmd 1
        Status: Success (0x00)
< HCI Command: LE Set PHY (0x08|0x0032) plen 7              #93 [hci1] 9.037219
        Handle: 522 Address: DF:A9:FF:F6:B1:1A (OUI DF-A9-FF)
        All PHYs preference: 0x00
        TX PHYs preference: 0x02
          LE 2M
        RX PHYs preference: 0x02
          LE 2M
        PHY options preference: Reserved (0x0000)
> HCI Event: Command Status (0x0f) plen 4                   #94 [hci1] 9.037858
      LE Set PHY (0x08|0x0032) ncmd 1
        Status: Success (0x00)
> HCI Event: LE Meta Event (0x3e) plen 12                   #95 [hci1] 9.161842
      LE Read Remote Used Features (0x04)
        Status: Success (0x00)
        Handle: 522 Address: DF:A9:FF:F6:B1:1A (OUI DF-A9-FF)
        Features: 0x2d 0x49 0x00 0xf7 0x67 0xd9 0x00 0x80
          LE Encryption
          Extended Reject Indication
          Peripheral-initiated Features Exchange
          LE Data Packet Length Extension
          LE 2M PHY
          LE Coded PHY
          Channel Selection Algorithm #2
          Periodic Advertising Sync Transfer - Sender
          Periodic Advertising Sync Transfer - Recipient
          Sleep Clock Accuracy Updates
          Connected Isochronous Stream - Central
          Connected Isochronous Stream - Peripheral
          Isochronous Broadcaster
          Synchronized Receiver
          Connected Isochronous Stream (Host Support)
          LE Power Control Request
          LE Power Control Request
          Connection Subrating
          Connection Subrating (Host Support)
          Unknown features (0x8000d90000000000)
> HCI Event: LE Meta Event (0x3e) plen 6                    #96 [hci1] 9.611362
      LE PHY Update Complete (0x0c)
        Status: Success (0x00)
        Handle: 522 Address: DF:A9:FF:F6:B1:1A (OUI DF-A9-FF)
        TX PHY: LE 2M (0x02)
        RX PHY: LE 2M (0x02)
< ACL Data TX: Handle 522 flags 0x00 dlen 7                #97 [hci1] 10.007771
      ATT: Read Request (0x0a) len 2
        Handle: 0x0007
> HCI Event: Number of Completed Packets (0x13) plen 5     #98 [hci1] 10.011546
        Num handles: 1
        Handle: 522 Address: DF:A9:FF:F6:B1:1A (OUI DF-A9-FF)
        Count: 1
        #97: len 7 (18 Kb/s)
        Latency: 3 msec (3-3 msec ~3 msec)
> ACL Data RX: Handle 522 flags 0x02 dlen 9                #99 [hci1] 10.061618
      ATT: Error Response (0x01) len 4
        Read Request (0x0a)
        Handle: 0x0007
        Error: Insufficient Encryption (0x0f)
< HCI Command: Host Number of Com.. (0x03|0x0035) plen 5  #100 [hci1] 10.077300
        Num handles: 1
        Handle: 522 Address: DF:A9:FF:F6:B1:1A (OUI DF-A9-FF)
        Count: 1
< HCI Command: LE Start Encrypt.. (0x08|0x0019) plen 28  #101 [hci1] 311.190903
        Handle: 522 Address: DF:A9:FF:F6:B1:1A (OUI DF-A9-FF)
        Random number: 0x0000000000000000
        Encrypted diversifier: 0x0000
        Long term key: 0ca9371fd0bf76b40b6f191fcfa0c518
> HCI Event: Command Status (0x0f) plen 4                #102 [hci1] 311.191940
      LE Start Encryption (0x08|0x0019) ncmd 1
        Status: Success (0x00)
> HCI Event: Encryption Change (0x08) plen 4             #103 [hci1] 311.405121
        Status: PIN or Key Missing (0x06)
        Handle: 522 Address: DF:A9:FF:F6:B1:1A (OUI DF-A9-FF)
        Encryption: Disabled (0x00)
< ACL Data TX: Handle 522 flags 0x00 dlen 11             #104 [hci1] 311.421392
      SMP: Pairing Request (0x01) len 6
        IO capability: KeyboardDisplay (0x04)
        OOB data: Authentication data not present (0x00)
        Authentication requirement: Bonding, No MITM, SC, No Keypresses (0x09)
        Max encryption key size: 16
        Initiator key distribution: EncKey (0x01)
        Responder key distribution: EncKey IdKey (0x03)
> HCI Event: Number of Completed Packets (0x13) plen 5   #105 [hci1] 311.505205
        Num handles: 1
        Handle: 522 Address: DF:A9:FF:F6:B1:1A (OUI DF-A9-FF)
        Count: 1
        #104: len 11 (1 Kb/s)
        Latency: 83 msec (3-83 msec ~43 msec)
> ACL Data RX: Handle 522 flags 0x02 dlen 11             #106 [hci1] 311.555358
      SMP: Pairing Response (0x02) len 6
        IO capability: KeyboardDisplay (0x04)
        OOB data: Authentication data not present (0x00)
        Authentication requirement: Bonding, MITM, SC, No Keypresses (0x0d)
        Max encryption key size: 16
        Initiator key distribution: EncKey (0x01)
        Responder key distribution: EncKey IdKey (0x03)
< HCI Command: Host Number of Co.. (0x03|0x0035) plen 5  #107 [hci1] 311.561116
        Num handles: 1
        Handle: 522 Address: DF:A9:FF:F6:B1:1A (OUI DF-A9-FF)
        Count: 1
< ACL Data TX: Handle 522 flags 0x00 dlen 27             #108 [hci1] 311.561148
< ACL Data TX: Handle 522 flags 0x01 dlen 27             #109 [hci1] 311.561179
< ACL Data TX: Handle 522 flags 0x01 dlen 15             #110 [hci1] 311.561190
      SMP: Pairing Public Key (0x0c) len 64
        X: 98308440221e2d910f0e54b71e7ec652857aa9b5a0dc65028824cc19db1226e9
        Y: 67a4816bcb62efb21701e31fdb27561a6217575fb007a8bbdabe7e28b6f68482
> HCI Event: Number of Completed Packets (0x13) plen 5   #111 [hci1] 311.605476
        Num handles: 1
        Handle: 522 Address: DF:A9:FF:F6:B1:1A (OUI DF-A9-FF)
        Count: 1
        #108: len 27 (4 Kb/s)
        Latency: 44 msec (3-83 msec ~44 msec)
> HCI Event: Number of Completed Packets (0x13) plen 5   #112 [hci1] 311.605815
        Num handles: 1
        Handle: 522 Address: DF:A9:FF:F6:B1:1A (OUI DF-A9-FF)
        Count: 1
        #109: len 27 (4 Kb/s)
        Latency: 44 msec (3-83 msec ~44 msec)
> HCI Event: Number of Completed Packets (0x13) plen 5   #113 [hci1] 311.606234
        Num handles: 1
        Handle: 522 Address: DF:A9:FF:F6:B1:1A (OUI DF-A9-FF)
        Count: 1
        #110: len 15 (2 Kb/s)
        Latency: 45 msec (3-83 msec ~44 msec)
> ACL Data RX: Handle 522 flags 0x02 dlen 27             #114 [hci1] 311.655518
> ACL Data RX: Handle 522 flags 0x01 dlen 27             #115 [hci1] 311.655920
> ACL Data RX: Handle 522 flags 0x01 dlen 15             #116 [hci1] 311.656242
      SMP: Pairing Public Key (0x0c) len 64
        X: da7f8881aaa5dac5a418091a3f9792c2690f3e84faff219de788753471b938ae
        Y: 53102ff64f2a54de508e89cb325af4bfb285b8d42fb0c49fa4ab6cca5fcb9ed0
> ACL Data RX: Handle 522 flags 0x02 dlen 21             #117 [hci1] 311.656897
      SMP: Pairing Confirm (0x03) len 16
        Confim value: 21bbde315e798c41f419b3eecf67689d
< HCI Command: Host Number of Co.. (0x03|0x0035) plen 5  #118 [hci1] 311.660855
        Num handles: 1
        Handle: 522 Address: DF:A9:FF:F6:B1:1A (OUI DF-A9-FF)
        Count: 1
< HCI Command: Host Number of Co.. (0x03|0x0035) plen 5  #119 [hci1] 311.660865
        Num handles: 1
        Handle: 522 Address: DF:A9:FF:F6:B1:1A (OUI DF-A9-FF)
        Count: 1
< HCI Command: Host Number of Co.. (0x03|0x0035) plen 5  #120 [hci1] 311.660883
        Num handles: 1
        Handle: 522 Address: DF:A9:FF:F6:B1:1A (OUI DF-A9-FF)
        Count: 1
< HCI Command: Host Number of Co.. (0x03|0x0035) plen 5  #121 [hci1] 311.660976
        Num handles: 1
        Handle: 522 Address: DF:A9:FF:F6:B1:1A (OUI DF-A9-FF)
        Count: 1
< ACL Data TX: Handle 522 flags 0x00 dlen 21             #122 [hci1] 311.660981
      SMP: Pairing Random (0x04) len 16
        Random value: 5da095555cc64d02679f89a05211af56
> HCI Event: Number of Completed Packets (0x13) plen 5   #123 [hci1] 311.705280
        Num handles: 1
        Handle: 522 Address: DF:A9:FF:F6:B1:1A (OUI DF-A9-FF)
        Count: 1
        #122: len 21 (3 Kb/s)
        Latency: 44 msec (3-83 msec ~44 msec)
> ACL Data RX: Handle 522 flags 0x02 dlen 21             #124 [hci1] 311.955443
      SMP: Pairing Random (0x04) len 16
        Random value: acae3d3f17d97050b577b57daa152189
< HCI Command: Host Number of Co.. (0x03|0x0035) plen 5  #125 [hci1] 311.961072
        Num handles: 1
        Handle: 522 Address: DF:A9:FF:F6:B1:1A (OUI DF-A9-FF)
        Count: 1
< ACL Data TX: Handle 522 flags 0x00 dlen 21             #126 [hci1] 312.231601
      SMP: Pairing DHKey Check (0x0d) len 16
        E: cb37cbf5f7ada531b73873a2cf9c9970
> HCI Event: Number of Completed Packets (0x13) plen 5   #127 [hci1] 312.255202
        Num handles: 1
        Handle: 522 Address: DF:A9:FF:F6:B1:1A (OUI DF-A9-FF)
        Count: 1
        #126: len 21 (7 Kb/s)
        Latency: 23 msec (3-83 msec ~34 msec)
> ACL Data RX: Handle 522 flags 0x02 dlen 21             #128 [hci1] 312.305347
      SMP: Pairing DHKey Check (0x0d) len 16
        E: fd81c298fa420f0e145c0ffb2d9b0ce2
< HCI Command: LE Start Encrypt.. (0x08|0x0019) plen 28  #129 [hci1] 312.321575
        Handle: 522 Address: DF:A9:FF:F6:B1:1A (OUI DF-A9-FF)
        Random number: 0x0000000000000000
        Encrypted diversifier: 0x0000
        Long term key: 52a6c562d897fc8e8a195ecb05f72f08
> HCI Event: Command Status (0x0f) plen 4                #130 [hci1] 312.322640
      LE Start Encryption (0x08|0x0019) ncmd 1
        Status: Success (0x00)
< HCI Command: Host Number of Co.. (0x03|0x0035) plen 5  #131 [hci1] 312.341151
        Num handles: 1
        Handle: 522 Address: DF:A9:FF:F6:B1:1A (OUI DF-A9-FF)
        Count: 1
> HCI Event: Encryption Change (0x08) plen 4             #132 [hci1] 312.655140
        Status: Success (0x00)
        Handle: 522 Address: DF:A9:FF:F6:B1:1A (OUI DF-A9-FF)
        Encryption: Enabled with AES-CCM (0x01)
< HCI Command: LE Set Address Re.. (0x08|0x002d) plen 1  #133 [hci1] 312.660934
        Address resolution: Disabled (0x00)
> HCI Event: Command Complete (0x0e) plen 4              #134 [hci1] 312.661481
      LE Set Address Resolution Enable (0x08|0x002d) ncmd 1
        Status: Success (0x00)
< HCI Command: LE Remove Device... (0x08|0x0028) plen 7  #135 [hci1] 312.680915
        Address type: Public (0x00)
        Address: DF:A9:FF:F6:B1:1A (OUI DF-A9-FF)
> HCI Event: Command Complete (0x0e) plen 4              #136 [hci1] 312.681532
      LE Remove Device From Resolving List (0x08|0x0028) ncmd 1
        Status: Success (0x00)
> ACL Data RX: Handle 522 flags 0x02 dlen 21             #137 [hci1] 312.705381
      SMP: Identity Information (0x08) len 16
        Identity resolving key: 6cf0d45ffcfbbc186cdd142739e03843
< HCI Command: Host Number of Co.. (0x03|0x0035) plen 5  #138 [hci1] 312.721006
        Num handles: 1
        Handle: 522 Address: DF:A9:FF:F6:B1:1A (OUI DF-A9-FF)
        Count: 1
> ACL Data RX: Handle 522 flags 0x02 dlen 12             #139 [hci1] 312.755350
      SMP: Identity Address Information (0x09) len 7
        Address: DF:A9:FF:F6:B1:1A (OUI DF-A9-FF)
< HCI Command: LE Add Device To.. (0x08|0x0027) plen 39  #140 [hci1] 312.760992
        Address type: Public (0x00)
        Address: DF:A9:FF:F6:B1:1A (OUI DF-A9-FF)
        Peer identity resolving key: 6cf0d45ffcfbbc186cdd142739e03843
        Local identity resolving key: 00000000000000000000000000000000
> HCI Event: Command Complete (0x0e) plen 4              #141 [hci1] 312.762027
      LE Add Device To Resolving List (0x08|0x0027) ncmd 1
        Status: Success (0x00)
< HCI Command: LE Set Privacy Mode (0x08|0x004e) plen 8  #142 [hci1] 312.780925
        Peer Identity address type: Public (0x00)
        Peer Identity address: DF:A9:FF:F6:B1:1A (OUI DF-A9-FF)
        Privacy Mode: Use Device Privacy (0x01)
> HCI Event: Command Complete (0x0e) plen 4              #143 [hci1] 312.781582
      LE Set Privacy Mode (0x08|0x004e) ncmd 1
        Status: Success (0x00)
< HCI Command: LE Set Address Re.. (0x08|0x002d) plen 1  #144 [hci1] 312.800976
        Address resolution: Enabled (0x01)
> HCI Event: Command Complete (0x0e) plen 4              #145 [hci1] 312.801459
      LE Set Address Resolution Enable (0x08|0x002d) ncmd 1
        Status: Success (0x00)
< HCI Command: Host Number of Co.. (0x03|0x0035) plen 5  #146 [hci1] 312.820937
        Num handles: 1
        Handle: 522 Address: DF:A9:FF:F6:B1:1A (OUI DF-A9-FF)
        Count: 1
< ACL Data TX: Handle 522 flags 0x00 dlen 7              #147 [hci1] 313.271463
      ATT: Read Request (0x0a) len 2
        Handle: 0x0007
> HCI Event: Number of Completed Packets (0x13) plen 5   #148 [hci1] 313.305263
        Num handles: 1
        Handle: 522 Address: DF:A9:FF:F6:B1:1A (OUI DF-A9-FF)
        Count: 1
        #147: len 7 (1 Kb/s)
        Latency: 33 msec (3-83 msec ~33 msec)
> ACL Data RX: Handle 522 flags 0x02 dlen 27             #149 [hci1] 313.355441
      ATT: Read Response (0x0b) len 22
< HCI Command: Host Number of Co.. (0x03|0x0035) plen 5  #150 [hci1] 313.360947
        Num handles: 1
        Handle: 522 Address: DF:A9:FF:F6:B1:1A (OUI DF-A9-FF)
        Count: 1
< ACL Data TX: Handle 522 flags 0x00 dlen 9              #151 [hci1] 313.360993
      ATT: Read Blob Request (0x0c) len 4
        Handle: 0x0007
        Offset: 0x0016
> HCI Event: Number of Completed Packets (0x13) plen 5   #152 [hci1] 313.405158
        Num handles: 1
        Handle: 522 Address: DF:A9:FF:F6:B1:1A (OUI DF-A9-FF)
        Count: 1
        #151: len 9 (1 Kb/s)
        Latency: 44 msec (3-83 msec ~39 msec)
> ACL Data RX: Handle 522 flags 0x02 dlen 21             #153 [hci1] 313.655485
      ATT: Read Blob Response (0x0d) len 16
        77 69 6c 6c 20 62 65 20 70 75 74 20 68 65 72 65  will be put here
< HCI Command: Host Number of Co.. (0x03|0x0035) plen 5  #154 [hci1] 313.660934
        Num handles: 1
        Handle: 522 Address: DF:A9:FF:F6:B1:1A (OUI DF-A9-FF)
        Count: 1
> HCI Event: Disconnect Complete (0x05) plen 4           #155 [hci1] 313.754926
        Status: Success (0x00)
        Handle: 522 Address: DF:A9:FF:F6:B1:1A (OUI DF-A9-FF)
        Reason: Remote User Terminated Connection (0x13)
< HCI Command: Reset (0x03|0x0003) plen 0                #156 [hci1] 320.880989
> HCI Event: Command Complete (0x0e) plen 4              #157 [hci1] 320.881557
      Reset (0x03|0x0003) ncmd 1
        Status: Success (0x00)
@ USER Close: main                                   {0x0001} [hci1] 320.900868
= Close Index: 00:00:00:00:00:00                              [hci1] 320.904205
