Bluetooth monitor ver 5.72
= Note: Linux version 6.14.0-36-generic (x86_64)                       0.853960
= Note: Bluetooth subsystem version 2.22                               0.853962
= New Index: 00:00:00:00:00:00 (Primary,UART,hci1)              [hci1] 0.853963
= New Index: 48:5F:99:8E:E0:64 (Primary,USB,hci0)               [hci0] 0.853964
= Open Index: 00:00:00:00:00:00                                 [hci1] 0.967777
= Index Info: 00:00:00:00:00:00 (Nordic Semiconductor ASA)      [hci1] 0.967796
@ USER Open: main (privileged) version 2.22            {0x0001} [hci1] 0.967805
< HCI Command: Reset (0x03|0x0003) plen 0                    #1 [hci1] 0.968965
> HCI Event: Command Complete (0x0e) plen 4                  #2 [hci1] 0.969453
      Reset (0x03|0x0003) ncmd 1
        Status: Success (0x00)
< HCI Command: Read Local Supported... (0x04|0x0003) plen 0  #3 [hci1] 0.987560
> HCI Event: Command Complete (0x0e) plen 12                 #4 [hci1] 0.988063
      Read Local Supported Features (0x04|0x0003) ncmd 1
        Status: Success (0x00)
        Features: 0x00 0x00 0x00 0x00 0x60 0x00 0x00 0x00
          BR/EDR Not Supported
          LE Supported (Controller)
< HCI Command: Read Local Version In.. (0x04|0x0001) plen 0  #5 [hci1] 1.007205
> HCI Event: Command Complete (0x0e) plen 12                 #6 [hci1] 1.007774
      Read Local Version Information (0x04|0x0001) ncmd 1
        Status: Success (0x00)
        HCI version: Reserved (0x0f) - Revision 12393 (0x3069)
        LMP version: Reserved (0x0f) - Subversion 12393 (0x3069)
        Manufacturer: Nordic Semiconductor ASA (89)
< HCI Command: Read Local Supported... (0x04|0x0002) plen 0  #7 [hci1] 1.027103
> HCI Event: Command Complete (0x0e) plen 68                 #8 [hci1] 1.028153
      Read Local Supported Commands (0x04|0x0002) ncmd 1
        Status: Success (0x00)
        Commands: 119 entries
          Disconnect (Octet 0 - Bit 5)
          Read Remote Version Information (Octet 2 - Bit 7)
          Set Event Mask (Octet 5 - Bit 6)
          Reset (Octet 5 - Bit 7)
          Read Connection Accept Timeout (Octet 7 - Bit 2)
          Write Connection Accept Timeout (Octet 7 - Bit 3)
          Read Transmit Power Level (Octet 10 - Bit 2)
          Set Controller To Host Flow Control (Octet 10 - Bit 5)
          Host Buffer Size (Octet 10 - Bit 6)
          Host Number of Completed Packets (Octet 10 - Bit 7)
          Read Local Version Information (Octet 14 - Bit 3)
          Read Local Supported Features (Octet 14 - Bit 5)
          Read BD ADDR (Octet 15 - Bit 1)
          Read RSSI (Octet 15 - Bit 5)
          Set Event Mask Page 2 (Octet 22 - Bit 2)
          LE Set Event Mask (Octet 25 - Bit 0)
          LE Read Buffer Size (Octet 25 - Bit 1)
          LE Read Local Supported Features (Octet 25 - Bit 2)
          LE Set Random Address (Octet 25 - Bit 4)
          LE Set Advertising Parameters (Octet 25 - Bit 5)
          LE Read Advertising Channel TX Power (Octet 25 - Bit 6)
          LE Set Advertising Data (Octet 25 - Bit 7)
          LE Set Scan Response Data (Octet 26 - Bit 0)
          LE Set Advertise Enable (Octet 26 - Bit 1)
          LE Set Scan Parameters (Octet 26 - Bit 2)
          LE Set Scan Enable (Octet 26 - Bit 3)
          LE Create Connection (Octet 26 - Bit 4)
          LE Create Connection Cancel (Octet 26 - Bit 5)
          LE Read Accept List Size (Octet 26 - Bit 6)
          LE Clear Accept List (Octet 26 - Bit 7)
          LE Add Device To Accept List (Octet 27 - Bit 0)
          LE Remove Device From Accept List (Octet 27 - Bit 1)
          LE Connection Update (Octet 27 - Bit 2)
          LE Set Host Channel Classification (Octet 27 - Bit 3)
          LE Read Channel Map (Octet 27 - Bit 4)
          LE Read Remote Used Features (Octet 27 - Bit 5)
          LE Encrypt (Octet 27 - Bit 6)
          LE Rand (Octet 27 - Bit 7)
          LE Start Encryption (Octet 28 - Bit 0)
          LE Long Term Key Request Reply (Octet 28 - Bit 1)
          LE Long Term Key Request Neg Reply (Octet 28 - Bit 2)
          LE Read Supported States (Octet 28 - Bit 3)
          LE Receiver Test (Octet 28 - Bit 4)
          LE Transmitter Test (Octet 28 - Bit 5)
          LE Test End (Octet 28 - Bit 6)
          Read Authenticated Payload Timeout (Octet 32 - Bit 4)
          Write Authenticated Payload Timeout (Octet 32 - Bit 5)
          LE Set Data Length (Octet 33 - Bit 6)
          LE Read Suggested Default Data Length (Octet 33 - Bit 7)
          LE Write Suggested Default Data Length (Octet 34 - Bit 0)
          LE Add Device To Resolving List (Octet 34 - Bit 3)
          LE Remove Device From Resolving List (Octet 34 - Bit 4)
          LE Clear Resolving List (Octet 34 - Bit 5)
          LE Read Resolving List Size (Octet 34 - Bit 6)
          LE Set Address Resolution Enable (Octet 35 - Bit 1)
          LE Set Resolvable Private Address Timeout (Octet 35 - Bit 2)
          LE Read Maximum Data Length (Octet 35 - Bit 3)
          LE Read PHY (Octet 35 - Bit 4)
          LE Set Default PHY (Octet 35 - Bit 5)
          LE Set PHY (Octet 35 - Bit 6)
          LE Enhanced Receiver Test (Octet 35 - Bit 7)
          LE Enhanced Transmitter Test (Octet 36 - Bit 0)
          LE Set Advertising Set Random Address (Octet 36 - Bit 1)
          LE Set Extended Advertising Parameters (Octet 36 - Bit 2)
          LE Set Extended Advertising Data (Octet 36 - Bit 3)
          LE Set Extended Scan Response Data (Octet 36 - Bit 4)
          LE Set Extended Advertising Enable (Octet 36 - Bit 5)
          LE Read Maximum Advertising Data Length (Octet 36 - Bit 6)
          LE Read Number of Supported Advertising Sets (Octet 36 - Bit 7)
          LE Remove Advertising Set (Octet 37 - Bit 0)
          LE Clear Advertising Sets (Octet 37 - Bit 1)
          LE Set Periodic Advertising Parameters (Octet 37 - Bit 2)
          LE Set Periodic Advertising Data (Octet 37 - Bit 3)
          LE Set Periodic Advertising Enable (Octet 37 - Bit 4)
          LE Set Extended Scan Parameters (Octet 37 - Bit 5)
          LE Set Extended Scan Enable (Octet 37 - Bit 6)
          LE Extended Create Connection (Octet 37 - Bit 7)
          LE Periodic Advertising Create Sync (Octet 38 - Bit 0)
          LE Periodic Advertising Create Sync Cancel (Octet 38 - Bit 1)
          LE Periodic Advertising Terminate Sync (Octet 38 - Bit 2)
          LE Add Device To Periodic Advertiser List (Octet 38 - Bit 3)
          LE Remove Device From Periodic Advertiser List (Octet 38 - Bit 4)
          LE Clear Periodic Advertiser List (Octet 38 - Bit 5)
          LE Read Periodic Advertiser List Size (Octet 38 - Bit 6)
          LE Read Transmit Power (Octet 38 - Bit 7)
          LE Read RF Path Compensation (Octet 39 - Bit 0)
          LE Write RF Path Compensation (Octet 39 - Bit 1)
          LE Set Privacy Mode (Octet 39 - Bit 2)
          LE Periodic Advertising Receive Enable (Octet 40 - Bit 5)
          LE Periodic Advertising Sync Transfer (Octet 40 - Bit 6)
          LE Periodic Advertising Set Info Transfer (Octet 40 - Bit 7)
          LE Periodic Advertising Sync Transfer Parameters (Octet 41 - Bit 0)
          LE Set Default Periodic Advertisng Sync Transfer Parameters (Octet 41 - Bit 1)
          LE Read Buffer v2 (Octet 41 - Bit 5)
          LE Read ISO TX Sync (Octet 41 - Bit 6)
          LE Set Connected Isochronous Group Parameters (Octet 41 - Bit 7)
          LE Set Connected Isochronous Group Parameters Test (Octet 42 - Bit 0)
          LE Create Connected Isochronous Stream (Octet 42 - Bit 1)
          LE Remove Connected Isochronous Group (Octet 42 - Bit 2)
          LE Accept Connected Isochronous Stream Request (Octet 42 - Bit 3)
          LE Reject Connected Isochronous Stream Request (Octet 42 - Bit 4)
          LE Create Broadcast Isochronous Group (Octet 42 - Bit 5)
          LE Create Broadcast Isochronous Group Test (Octet 42 - Bit 6)
          LE Terminate Broadcast Isochronous Group (Octet 42 - Bit 7)
          LE Broadcast Isochronous Group Create Sync (Octet 43 - Bit 0)
          LE Broadcast Isochronous Group Terminate Sync (Octet 43 - Bit 1)
          LE Request Peer SCA (Octet 43 - Bit 2)
          LE Setup Isochronous Data Path (Octet 43 - Bit 3)
          LE Remove Isochronous Data Path (Octet 43 - Bit 4)
          LE Isochronous Transmit Test (Octet 43 - Bit 5)
          LE Isochronous Receive Test (Octet 43 - Bit 6)
          LE Isochronous Read Test Counters (Octet 43 - Bit 7)
          LE Isochronous Read Test Counters (Octet 44 - Bit 0)
          LE Set Host Feature (Octet 44 - Bit 1)
          Octet 44 - Bit 2 
          Octet 45 - Bit 6 
          Octet 46 - Bit 0 
          Octet 46 - Bit 1 
          Octet 46 - Bit 2 
< HCI Command: Host Buffer Size (0x03|0x0033) plen 7         #9 [hci1] 1.047118
        ACL MTU: 255  ACL max packet: 16
        SCO MTU: 0    SCO max packet: 0
> HCI Event: Command Complete (0x0e) plen 4                 #10 [hci1] 1.047589
      Host Buffer Size (0x03|0x0033) ncmd 1
        Status: Success (0x00)
< HCI Command: Set Controller To Ho.. (0x03|0x0031) plen 1  #11 [hci1] 1.067110
        Flow control: ACL Data Packets (0x01)
> HCI Event: Command Complete (0x0e) plen 4                 #12 [hci1] 1.067550
      Set Controller To Host Flow Control (0x03|0x0031) ncmd 1
        Status: Success (0x00)
< HCI Command: LE Read Local Suppor.. (0x08|0x0003) plen 0  #13 [hci1] 1.087041
> HCI Event: Command Complete (0x0e) plen 12                #14 [hci1] 1.087514
      LE Read Local Supported Features (0x08|0x0003) ncmd 1
        Status: Success (0x00)
        Features: 0xfd 0x79 0x00 0xf7 0x30 0x01 0x00 0x00
          LE Encryption
          Extended Reject Indication
          Peripheral-initiated Features Exchange
          LE Ping
          LE Data Packet Length Extension
          LL Privacy
          Extended Scanner Filter Policies
          LE 2M PHY
          LE Coded PHY
          LE Extended Advertising
          LE Periodic Advertising
          Channel Selection Algorithm #2
          Periodic Advertising Sync Transfer - Sender
          Periodic Advertising Sync Transfer - Recipient
          Sleep Clock Accuracy Updates
          Connected Isochronous Stream - Central
          Connected Isochronous Stream - Peripheral
          Isochronous Broadcaster
          Synchronized Receiver
          Periodic Advertising ADI support
          Connection Subrating
          Unknown features (0x0000010000000000)
< HCI Command: LE Set Host Feature (0x08|0x0074) plen 2     #15 [hci1] 1.107079
        Bit Number: 32
          Connected Isochronous Stream (Host Support)
        Bit Value: 1
> HCI Event: Command Complete (0x0e) plen 4                 #16 [hci1] 1.107516
      LE Set Host Feature (0x08|0x0074) ncmd 1
        Status: Success (0x00)
< HCI Command: LE Read Buffer v2 (0x08|0x0060) plen 0       #17 [hci1] 1.127047
> HCI Event: Command Complete (0x0e) plen 10                #18 [hci1] 1.127547
      LE Read Buffer v2 (0x08|0x0060) ncmd 1
        Status: Success (0x00)
        ACL MTU: 27
        ACL max packet: 3
        ISO MTU: 318
        ISO max packet: 3
< HCI Command: LE Read Maximum Adve.. (0x08|0x003a) plen 0  #19 [hci1] 1.147112
> HCI Event: Command Complete (0x0e) plen 6                 #20 [hci1] 1.147507
      LE Read Maximum Advertising Data Length (0x08|0x003a) ncmd 1
        Status: Success (0x00)
        Max length: 1650
< HCI Command: LE Read Supported St.. (0x08|0x001c) plen 0  #21 [hci1] 1.167043
> HCI Event: Command Complete (0x0e) plen 12                #22 [hci1] 1.167565
      LE Read Supported States (0x08|0x001c) ncmd 1
        Status: Success (0x00)
        States: 0x000003ff3e0306ff
          Non-connectable Advertising State
          Scannable Advertising State
          Connectable Advertising State
          High Duty Cycle Directed Advertising State
          Passive Scanning State
          Active Scanning State
          Initiating State
            and Connection State (Central Role)
          Connection State (Peripheral Role)
          Scannable Advertising State
            and Passive Scanning State
          Connectable Advertising State
            and Passive Scanning State
          Non-connectable Advertising State
            and Initiating State
          Scannable Advertising State
            and Initiating State
          Active Scanning State
            and Connection State (Central Role)
          Passive Scanning State
            and Connection State (Peripheral Role)
          Active Scanning State
            and Connection State (Peripheral Role)
          Initiating State
            and Connection State (Central Role)
            and Central Role & Central Role
          Low Duty Cycle Directed Advertising State
          Connectable Advertising State
            and Initiating State
            and Central Role & Peripheral Role
          High Duty Cycle Directed Advertising State
            and Initiating State
            and Central Role & Peripheral Role
          Low Duty Cycle Directed Advertising State
            and Initiating State
            and Central Role & Peripheral Role
          Connectable Advertising State
            and Connection State (Central Role)
            and Central Role & Peripheral Role
          High Duty Cycle Directed Advertising State
            and Connection State (Central Role)
            and Central Role & Peripheral Role
          Low Duty Cycle Directed Advertising State
            and Connection State (Central Role)
            and Central Role & Peripheral Role
          Connectable Advertising State
            and Connection State (Peripheral Role)
            and Central Role & Peripheral Role
          High Duty Cycle Directed Advertising State
            and Connection State (Peripheral Role)
            and Peripheral Role & Peripheral Role
          Low Duty Cycle Directed Advertising State
            and Connection State (Peripheral Role)
            and Peripheral Role & Peripheral Role
          Initiating State
            and Connection State (Peripheral Role)
            and Central Role & Peripheral Role
< HCI Command: LE Read Maximum Data.. (0x08|0x002f) plen 0  #23 [hci1] 1.187084
> HCI Event: Command Complete (0x0e) plen 12                #24 [hci1] 1.187551
      LE Read Maximum Data Length (0x08|0x002f) ncmd 1
        Status: Success (0x00)
        Max TX octets: 251
        Max TX time: 2704
        Max RX octets: 251
        Max RX time: 2704
< HCI Command: LE Write Suggested D.. (0x08|0x0024) plen 4  #25 [hci1] 1.207119
        TX octets: 251
        TX time: 2704
> HCI Event: Command Complete (0x0e) plen 4                 #26 [hci1] 1.207619
      LE Write Suggested Default Data Length (0x08|0x0024) ncmd 1
        Status: Success (0x00)
< HCI Command: LE Read Resolving Li.. (0x08|0x002a) plen 0  #27 [hci1] 1.227071
> HCI Event: Command Complete (0x0e) plen 5                 #28 [hci1] 1.227521
      LE Read Resolving List Size (0x08|0x002a) ncmd 1
        Status: Success (0x00)
        Size: 8
< HCI Command: LE Set Event Mask (0x08|0x0001) plen 8       #29 [hci1] 1.247065
        Mask: 0x000002023f87fa5e
          LE Advertising Report
          LE Connection Update Complete
          LE Read Remote Used Features Complete
          LE Long Term Key Request
          LE Data Length Change
          LE Enhanced Connection Complete
          LE PHY Update Complete
          LE Extended Advertising Report
          LE Periodic Advertising Sync Established
          LE Periodic Advertising Report
          LE Periodic Advertising Sync Lost
          LE Extended Scan Timeout
          LE Extended Advertising Set Terminated
          LE Scan Request Received
          LE Periodic Advertising Sync Transfer Rvc
          LE CIS Established
          LE CIS Request
          LE Create BIG Complete
          LE Terminate BIG Complete
          LE BIG Sync Estabilished Complete
          LE BIG Sync Lost
          LE BIG Info Advertising Report
          Unknown mask (0x0000020000000000)
> HCI Event: Command Complete (0x0e) plen 4                 #30 [hci1] 1.247609
      LE Set Event Mask (0x08|0x0001) ncmd 1
        Status: Success (0x00)
< HCI Command: Set Event Mask (0x03|0x0001) plen 8          #31 [hci1] 1.267068
        Mask: 0x2000800002008890
          Disconnection Complete
          Encryption Change
          Read Remote Version Information Complete
          Hardware Error
          Data Buffer Overflow
          Encryption Key Refresh Complete
          LE Meta
> HCI Event: Command Complete (0x0e) plen 4                 #32 [hci1] 1.267542
      Set Event Mask (0x03|0x0001) ncmd 1
        Status: Success (0x00)
< HCI Command: Read BD ADDR (0x04|0x0009) plen 0            #33 [hci1] 1.287061
> HCI Event: Command Complete (0x0e) plen 10                #34 [hci1] 1.287564
      Read BD ADDR (0x04|0x0009) ncmd 1
        Status: Success (0x00)
        Address: 00:00:00:00:00:00 (OUI 00-00-00)
< HCI Command: LE Set Random Address (0x08|0x0005) plen 6   #35 [hci1] 1.307084
        Address: D5:B6:CC:31:DB:3B (Static)
> HCI Event: Command Complete (0x0e) plen 4                 #36 [hci1] 1.307622
      LE Set Random Address (0x08|0x0005) ncmd 1
        Status: Success (0x00)
< HCI Command: LE Set Extended Adv.. (0x08|0x0036) plen 25  #37 [hci1] 3.897650
        Handle: 0x00
        Properties: 0x0013
          Connectable
          Scannable
          Use legacy advertising PDUs: ADV_IND
        Min advertising interval: 100.000 msec (0x00a0)
        Max advertising interval: 150.000 msec (0x00f0)
        Channel map: 37, 38, 39 (0x07)
        Own address type: Random (0x01)
        Peer address type: Public (0x00)
        Peer address: 00:00:00:00:00:00 (OUI 00-00-00)
        Filter policy: Allow Scan Request from Any, Allow Connect Request from Any (0x00)
        TX power: Host has no preference (0x7f)
        Primary PHY: LE 1M (0x01)
        Secondary max skip: 0x00
        Secondary PHY: LE 1M (0x01)
        SID: 0x00
        Scan request notifications: Disabled (0x00)
> HCI Event: Command Complete (0x0e) plen 5                 #38 [hci1] 3.898564
      LE Set Extended Advertising Parameters (0x08|0x0036) ncmd 1
        Status: Success (0x00)
        TX power (selected): 0 dbm (0x00)
< HCI Command: LE Set Advertising S.. (0x08|0x0035) plen 7  #39 [hci1] 3.907586
        Advertising handle: 0x00
        Advertising random address: D5:B6:CC:31:DB:3B (Static)
> HCI Event: Command Complete (0x0e) plen 4                 #40 [hci1] 3.908061
      LE Set Advertising Set Random Address (0x08|0x0035) ncmd 1
        Status: Success (0x00)
< HCI Command: LE Set Extended Adv.. (0x08|0x0037) plen 22  #41 [hci1] 3.927388
        Handle: 0x00
        Operation: Complete extended advertising data (0x03)
        Fragment preference: Minimize fragmentation (0x01)
        Data length: 0x12
        Flags: 0x06
          LE General Discoverable Mode
          BR/EDR Not Supported
        Name (complete): Tester_F6B11A
> HCI Event: Command Complete (0x0e) plen 4                 #42 [hci1] 3.928127
      LE Set Extended Advertising Data (0x08|0x0037) ncmd 1
        Status: Success (0x00)
< HCI Command: LE Set Extended Scan.. (0x08|0x0038) plen 4  #43 [hci1] 3.947152
        Handle: 0x00
        Operation: Complete scan response data (0x03)
        Fragment preference: Minimize fragmentation (0x01)
        Data length: 0x00
> HCI Event: Command Complete (0x0e) plen 4                 #44 [hci1] 3.947648
      LE Set Extended Scan Response Data (0x08|0x0038) ncmd 1
        Status: Success (0x00)
< HCI Command: LE Set Extended Adve.. (0x08|0x0039) plen 6  #45 [hci1] 3.967118
        Extended advertising: Enabled (0x01)
        Number of sets: 1 (0x01)
        Entry 0
          Handle: 0x00
          Duration: 0 ms (0x00)
          Max ext adv events: 0
> HCI Event: Command Complete (0x0e) plen 4                 #46 [hci1] 3.967684
      LE Set Extended Advertising Enable (0x08|0x0039) ncmd 1
        Status: Success (0x00)
> HCI Event: LE Meta Event (0x3e) plen 31                   #47 [hci1] 4.081013
      LE Enhanced Connection Complete (0x0a)
        Status: Success (0x00)
        Handle: 1443
        Role: Peripheral (0x01)
        Peer address type: Public (0x00)
        Peer address: DF:A9:FF:F6:B1:1A (OUI DF-A9-FF)
        Local resolvable private address: 00:00:00:00:00:00 (Non-Resolvable)
        Peer resolvable private address: 00:00:00:00:00:00 (Non-Resolvable)
        Connection interval: 87.50 msec (0x0046)
        Connection latency: 0 (0x0000)
        Supervision timeout: 25120 msec (0x09d0)
        Central clock accuracy: 0x01
> HCI Event: LE Meta Event (0x3e) plen 6                    #48 [hci1] 4.081139
      LE Advertising Set Terminated (0x12)
        Status: Success (0x00)
        Handle: 0
        Connection handle: 1443
        Number of completed extended advertising events: 0
< HCI Command: LE Read Remote Used... (0x08|0x0016) plen 2  #49 [hci1] 4.088298
        Handle: 1443 Address: DF:A9:FF:F6:B1:1A (OUI DF-A9-FF)
< ACL Data TX: Handle 1443 flags 0x00 dlen 7                #50 [hci1] 4.088322
      ATT: Exchange MTU Request (0x02) len 2
        Client RX MTU: 251
> HCI Event: Command Status (0x0f) plen 4                   #51 [hci1] 4.088791
      LE Read Remote Used Features (0x08|0x0016) ncmd 1
        Status: Success (0x00)
> HCI Event: Number of Completed Packets (0x13) plen 5      #52 [hci1] 4.256915
        Num handles: 1
        Handle: 1443 Address: DF:A9:FF:F6:B1:1A (OUI DF-A9-FF)
        Count: 1
        #50: len 7 (0 Kb/s)
        Latency: 168 msec (168-168 msec ~168 msec)
> HCI Event: LE Meta Event (0x3e) plen 12                   #53 [hci1] 4.344845
      LE Read Remote Used Features (0x04)
        Status: Success (0x00)
        Handle: 1443 Address: DF:A9:FF:F6:B1:1A (OUI DF-A9-FF)
        Features: 0x2d 0x49 0x00 0xf7 0x67 0xd8 0x00 0x00
          LE Encryption
          Extended Reject Indication
          Peripheral-initiated Features Exchange
          LE Data Packet Length Extension
          LE 2M PHY
          LE Coded PHY
          Channel Selection Algorithm #2
          Periodic Advertising Sync Transfer - Sender
          Periodic Advertising Sync Transfer - Recipient
          Sleep Clock Accuracy Updates
          Connected Isochronous Stream - Central
          Connected Isochronous Stream - Peripheral
          Isochronous Broadcaster
          Synchronized Receiver
          Connected Isochronous Stream (Host Support)
          LE Power Control Request
          LE Power Control Request
          Connection Subrating
          Connection Subrating (Host Support)
          Unknown features (0x0000d80000000000)
> ACL Data RX: Handle 1443 flags 0x02 dlen 11               #54 [hci1] 6.794531
      SMP: Pairing Request (0x01) len 6
        IO capability: KeyboardDisplay (0x04)
        OOB data: Authentication data not present (0x00)
        Authentication requirement: Bonding, MITM, SC, No Keypresses (0x0d)
        Max encryption key size: 16
        Initiator key distribution: EncKey IdKey (0x03)
        Responder key distribution: EncKey IdKey Sign (0x07)
> ACL Data RX: Handle 1443 flags 0x02 dlen 7                #55 [hci1] 6.794983
      ATT: Exchange MTU Response (0x03) len 2
        Server RX MTU: 23
< HCI Command: Host Number of Compl.. (0x03|0x0035) plen 5  #56 [hci1] 6.807208
        Num handles: 1
        Handle: 1443 Address: DF:A9:FF:F6:B1:1A (OUI DF-A9-FF)
        Count: 1
< ACL Data TX: Handle 1443 flags 0x00 dlen 11               #57 [hci1] 6.807269
      SMP: Pairing Response (0x02) len 6
        IO capability: DisplayOnly (0x00)
        OOB data: Authentication data not present (0x00)
        Authentication requirement: Bonding, No MITM, SC, No Keypresses (0x09)
        Max encryption key size: 16
        Initiator key distribution: IdKey (0x02)
        Responder key distribution: <none> (0x00)
< HCI Command: Host Number of Compl.. (0x03|0x0035) plen 5  #58 [hci1] 6.807431
        Num handles: 1
        Handle: 1443 Address: DF:A9:FF:F6:B1:1A (OUI DF-A9-FF)
        Count: 1
> HCI Event: Number of Completed Packets (0x13) plen 5      #59 [hci1] 6.969659
        Num handles: 1
        Handle: 1443 Address: DF:A9:FF:F6:B1:1A (OUI DF-A9-FF)
        Count: 1
        #57: len 11 (0 Kb/s)
        Latency: 162 msec (162-168 msec ~165 msec)
> ACL Data RX: Handle 1443 flags 0x02 dlen 27               #60 [hci1] 6.969937
> ACL Data RX: Handle 1443 flags 0x01 dlen 27               #61 [hci1] 6.970432
> ACL Data RX: Handle 1443 flags 0x01 dlen 15               #62 [hci1] 6.970904
      SMP: Pairing Public Key (0x0c) len 64
        X: ea28e875fec32d62f55f1a64168998f60b659673b7c53a92171d177e157ed84e
        Y: 2bcd8734208121042ee80e3f8ff7ebcd9a319d34537db807404e31a86ca8029b
< HCI Command: Host Number of Compl.. (0x03|0x0035) plen 5  #63 [hci1] 6.988092
        Num handles: 1
        Handle: 1443 Address: DF:A9:FF:F6:B1:1A (OUI DF-A9-FF)
        Count: 1
< HCI Command: Host Number of Compl.. (0x03|0x0035) plen 5  #64 [hci1] 6.988367
        Num handles: 1
        Handle: 1443 Address: DF:A9:FF:F6:B1:1A (OUI DF-A9-FF)
        Count: 1
< HCI Command: Host Number of Compl.. (0x03|0x0035) plen 5  #65 [hci1] 6.988768
        Num handles: 1
        Handle: 1443 Address: DF:A9:FF:F6:B1:1A (OUI DF-A9-FF)
        Count: 1
< ACL Data TX: Handle 1443 flags 0x00 dlen 27               #66 [hci1] 6.988923
< ACL Data TX: Handle 1443 flags 0x01 dlen 27               #67 [hci1] 6.988940
< ACL Data TX: Handle 1443 flags 0x01 dlen 15               #68 [hci1] 6.988944
      SMP: Pairing Public Key (0x0c) len 64
        X: 98308440221e2d910f0e54b71e7ec652857aa9b5a0dc65028824cc19db1226e9
        Y: 67a4816bcb62efb21701e31fdb27561a6217575fb007a8bbdabe7e28b6f68482
> HCI Event: Number of Completed Packets (0x13) plen 5      #69 [hci1] 7.057530
        Num handles: 1
        Handle: 1443 Address: DF:A9:FF:F6:B1:1A (OUI DF-A9-FF)
        Count: 1
        #66: len 27 (3 Kb/s)
        Latency: 68 msec (68-168 msec ~117 msec)
> HCI Event: Number of Completed Packets (0x13) plen 5      #70 [hci1] 7.058125
        Num handles: 1
        Handle: 1443 Address: DF:A9:FF:F6:B1:1A (OUI DF-A9-FF)
        Count: 1
        #67: len 27 (3 Kb/s)
        Latency: 69 msec (68-168 msec ~93 msec)
> HCI Event: Number of Completed Packets (0x13) plen 5      #71 [hci1] 7.144368
        Num handles: 1
        Handle: 1443 Address: DF:A9:FF:F6:B1:1A (OUI DF-A9-FF)
        Count: 1
        #68: len 15 (0 Kb/s)
        Latency: 155 msec (68-168 msec ~124 msec)
> ACL Data RX: Handle 1443 flags 0x02 dlen 21               #72 [hci1] 8.107125
      SMP: Pairing Confirm (0x03) len 16
        Confim value: e0df3fa769e6e0f3ff2027252bfc02f9
< HCI Command: Host Number of Compl.. (0x03|0x0035) plen 5  #73 [hci1] 8.127475
        Num handles: 1
        Handle: 1443 Address: DF:A9:FF:F6:B1:1A (OUI DF-A9-FF)
        Count: 1
< ACL Data TX: Handle 1443 flags 0x00 dlen 21               #74 [hci1] 8.127548
      SMP: Pairing Confirm (0x03) len 16
        Confim value: b75648f8c01f657327fba22c52ecaaa5
> HCI Event: Number of Completed Packets (0x13) plen 5      #75 [hci1] 8.281990
        Num handles: 1
        Handle: 1443 Address: DF:A9:FF:F6:B1:1A (OUI DF-A9-FF)
        Count: 1
        #74: len 21 (1 Kb/s)
        Latency: 154 msec (68-168 msec ~139 msec)
> ACL Data RX: Handle 1443 flags 0x02 dlen 21               #76 [hci1] 8.282300
      SMP: Pairing Random (0x04) len 16
        Random value: a5a51299da33efa10000000000000000
< HCI Command: Host Number of Compl.. (0x03|0x0035) plen 5  #77 [hci1] 8.287807
        Num handles: 1
        Handle: 1443 Address: DF:A9:FF:F6:B1:1A (OUI DF-A9-FF)
        Count: 1
< ACL Data TX: Handle 1443 flags 0x00 dlen 21               #78 [hci1] 8.287831
      SMP: Pairing Random (0x04) len 16
        Random value: 8e6108f966a694cbe26df70bb96773e6
> HCI Event: Number of Completed Packets (0x13) plen 5      #79 [hci1] 8.456752
        Num handles: 1
        Handle: 1443 Address: DF:A9:FF:F6:B1:1A (OUI DF-A9-FF)
        Count: 1
        #78: len 21 (1 Kb/s)
        Latency: 168 msec (68-168 msec ~154 msec)
> ACL Data RX: Handle 1443 flags 0x02 dlen 21               #80 [hci1] 8.544615
      SMP: Pairing Confirm (0x03) len 16
        Confim value: ef404af474148fa04c8106ace0032d7a
< HCI Command: Host Number of Compl.. (0x03|0x0035) plen 5  #81 [hci1] 8.547160
        Num handles: 1
        Handle: 1443 Address: DF:A9:FF:F6:B1:1A (OUI DF-A9-FF)
        Count: 1
< ACL Data TX: Handle 1443 flags 0x00 dlen 21               #82 [hci1] 8.547429
      SMP: Pairing Confirm (0x03) len 16
        Confim value: ecb3197d296ab82bd81b0997443eee2e
> HCI Event: Number of Completed Packets (0x13) plen 5      #83 [hci1] 8.719467
        Num handles: 1
        Handle: 1443 Address: DF:A9:FF:F6:B1:1A (OUI DF-A9-FF)
        Count: 1
        #82: len 21 (0 Kb/s)
        Latency: 172 msec (68-172 msec ~163 msec)
> ACL Data RX: Handle 1443 flags 0x02 dlen 21               #84 [hci1] 8.719786
      SMP: Pairing Random (0x04) len 16
        Random value: 7d454fa012a2327e0000000000000000
< HCI Command: Host Number of Compl.. (0x03|0x0035) plen 5  #85 [hci1] 8.727251
        Num handles: 1
        Handle: 1443 Address: DF:A9:FF:F6:B1:1A (OUI DF-A9-FF)
        Count: 1
< ACL Data TX: Handle 1443 flags 0x00 dlen 21               #86 [hci1] 8.727337
      SMP: Pairing Random (0x04) len 16
        Random value: 4d02679f89a05211af56d8b3da64d21e
> HCI Event: Number of Completed Packets (0x13) plen 5      #87 [hci1] 8.894257
        Num handles: 1
        Handle: 1443 Address: DF:A9:FF:F6:B1:1A (OUI DF-A9-FF)
        Count: 1
        #86: len 21 (1 Kb/s)
        Latency: 166 msec (68-172 msec ~165 msec)
> ACL Data RX: Handle 1443 flags 0x02 dlen 21               #88 [hci1] 8.982101
      SMP: Pairing Confirm (0x03) len 16
        Confim value: 44ebee069444489dcf938fe061c05284
< HCI Command: Host Number of Compl.. (0x03|0x0035) plen 5  #89 [hci1] 8.987133
        Num handles: 1
        Handle: 1443 Address: DF:A9:FF:F6:B1:1A (OUI DF-A9-FF)
        Count: 1
< ACL Data TX: Handle 1443 flags 0x00 dlen 21               #90 [hci1] 8.987155
      SMP: Pairing Confirm (0x03) len 16
        Confim value: 295d543e74cb68b7939f86017c5ba5b4
> HCI Event: Number of Completed Packets (0x13) plen 5      #91 [hci1] 9.156950
        Num handles: 1
        Handle: 1443 Address: DF:A9:FF:F6:B1:1A (OUI DF-A9-FF)
        Count: 1
        #90: len 21 (0 Kb/s)
        Latency: 169 msec (68-172 msec ~167 msec)
> ACL Data RX: Handle 1443 flags 0x02 dlen 21               #92 [hci1] 9.157276
      SMP: Pairing Random (0x04) len 16
        Random value: 1b14a8e7195bc07a0000000000000000
< HCI Command: Host Number of Compl.. (0x03|0x0035) plen 5  #93 [hci1] 9.167253
        Num handles: 1
        Handle: 1443 Address: DF:A9:FF:F6:B1:1A (OUI DF-A9-FF)
        Count: 1
< ACL Data TX: Handle 1443 flags 0x00 dlen 21               #94 [hci1] 9.167261
      SMP: Pairing Random (0x04) len 16
        Random value: 5e8286bc235a02440d0c3424a2acf8fd
> HCI Event: Number of Completed Packets (0x13) plen 5      #95 [hci1] 9.332034
        Num handles: 1
        Handle: 1443 Address: DF:A9:FF:F6:B1:1A (OUI DF-A9-FF)
        Count: 1
        #94: len 21 (1 Kb/s)
        Latency: 164 msec (68-172 msec ~166 msec)
> ACL Data RX: Handle 1443 flags 0x02 dlen 21               #96 [hci1] 9.332297
      SMP: Pairing Confirm (0x03) len 16
        Confim value: c200bc478e984cbfc9fa465b7ccd05a9
< HCI Command: Host Number of Compl.. (0x03|0x0035) plen 5  #97 [hci1] 9.347353
        Num handles: 1
        Handle: 1443 Address: DF:A9:FF:F6:B1:1A (OUI DF-A9-FF)
        Count: 1
< ACL Data TX: Handle 1443 flags 0x00 dlen 21               #98 [hci1] 9.347424
      SMP: Pairing Confirm (0x03) len 16
        Confim value: 2dbdc96bbd18f9ca419fd1e4eb511d71
> HCI Event: Number of Completed Packets (0x13) plen 5      #99 [hci1] 9.507003
        Num handles: 1
        Handle: 1443 Address: DF:A9:FF:F6:B1:1A (OUI DF-A9-FF)
        Count: 1
        #98: len 21 (1 Kb/s)
        Latency: 159 msec (68-172 msec ~162 msec)
> ACL Data RX: Handle 1443 flags 0x02 dlen 21              #100 [hci1] 9.507288
      SMP: Pairing Random (0x04) len 16
        Random value: df414486622539ec0000000000000000
< HCI Command: Host Number of Comp.. (0x03|0x0035) plen 5  #101 [hci1] 9.527819
        Num handles: 1
        Handle: 1443 Address: DF:A9:FF:F6:B1:1A (OUI DF-A9-FF)
        Count: 1
< ACL Data TX: Handle 1443 flags 0x00 dlen 21              #102 [hci1] 9.528010
      SMP: Pairing Random (0x04) len 16
        Random value: 5c4a1bcadd27bd58e945097b00bad7ac
> HCI Event: Number of Completed Packets (0x13) plen 5     #103 [hci1] 9.681738
        Num handles: 1
        Handle: 1443 Address: DF:A9:FF:F6:B1:1A (OUI DF-A9-FF)
        Count: 1
        #102: len 21 (1 Kb/s)
        Latency: 153 msec (68-172 msec ~158 msec)
> ACL Data RX: Handle 1443 flags 0x02 dlen 21              #104 [hci1] 9.769651
      SMP: Pairing Confirm (0x03) len 16
        Confim value: d6c6959e1a88bec10cfb040064a44c52
< HCI Command: Host Number of Comp.. (0x03|0x0035) plen 5  #105 [hci1] 9.787210
        Num handles: 1
        Handle: 1443 Address: DF:A9:FF:F6:B1:1A (OUI DF-A9-FF)
        Count: 1
< ACL Data TX: Handle 1443 flags 0x00 dlen 21              #106 [hci1] 9.787284
      SMP: Pairing Confirm (0x03) len 16
        Confim value: fcec71353ea8f1efd5cfc1245dbeb983
> HCI Event: Number of Completed Packets (0x13) plen 5     #107 [hci1] 9.944416
        Num handles: 1
        Handle: 1443 Address: DF:A9:FF:F6:B1:1A (OUI DF-A9-FF)
        Count: 1
        #106: len 21 (1 Kb/s)
        Latency: 157 msec (68-172 msec ~157 msec)
> ACL Data RX: Handle 1443 flags 0x02 dlen 21              #108 [hci1] 9.944806
      SMP: Pairing Random (0x04) len 16
        Random value: f3653ff95bc157630000000000000000
< HCI Command: Host Number of Comp.. (0x03|0x0035) plen 5  #109 [hci1] 9.947864
        Num handles: 1
        Handle: 1443 Address: DF:A9:FF:F6:B1:1A (OUI DF-A9-FF)
        Count: 1
< ACL Data TX: Handle 1443 flags 0x00 dlen 21              #110 [hci1] 9.947957
      SMP: Pairing Random (0x04) len 16
        Random value: 32527e6e64e79f33b2e374394db8ab2d
> HCI Event: Number of Completed Packets (0x13) plen 5    #111 [hci1] 10.119253
        Num handles: 1
        Handle: 1443 Address: DF:A9:FF:F6:B1:1A (OUI DF-A9-FF)
        Count: 1
        #110: len 21 (0 Kb/s)
        Latency: 171 msec (68-172 msec ~164 msec)
> ACL Data RX: Handle 1443 flags 0x02 dlen 21             #112 [hci1] 10.207192
      SMP: Pairing Confirm (0x03) len 16
        Confim value: f9faca9d9dbddb3a8078dc242c335207
< HCI Command: Host Number of Com.. (0x03|0x0035) plen 5  #113 [hci1] 10.207898
        Num handles: 1
        Handle: 1443 Address: DF:A9:FF:F6:B1:1A (OUI DF-A9-FF)
        Count: 1
< ACL Data TX: Handle 1443 flags 0x00 dlen 21             #114 [hci1] 10.208054
      SMP: Pairing Confirm (0x03) len 16
        Confim value: dc0bcec2081e7b7131a827900a59212f
> HCI Event: Number of Completed Packets (0x13) plen 5    #115 [hci1] 10.381913
        Num handles: 1
        Handle: 1443 Address: DF:A9:FF:F6:B1:1A (OUI DF-A9-FF)
        Count: 1
        #114: len 21 (0 Kb/s)
        Latency: 173 msec (68-173 msec ~169 msec)
> ACL Data RX: Handle 1443 flags 0x02 dlen 21             #116 [hci1] 10.382333
      SMP: Pairing Random (0x04) len 16
        Random value: c5203b931edaced60000000000000000
< HCI Command: Host Number of Com.. (0x03|0x0035) plen 5  #117 [hci1] 10.388073
        Num handles: 1
        Handle: 1443 Address: DF:A9:FF:F6:B1:1A (OUI DF-A9-FF)
        Count: 1
< ACL Data TX: Handle 1443 flags 0x00 dlen 21             #118 [hci1] 10.388323
      SMP: Pairing Random (0x04) len 16
        Random value: dddbdfe2838e9a8cc6964353c850fef7
> HCI Event: Number of Completed Packets (0x13) plen 5    #119 [hci1] 10.556690
        Num handles: 1
        Handle: 1443 Address: DF:A9:FF:F6:B1:1A (OUI DF-A9-FF)
        Count: 1
        #118: len 21 (1 Kb/s)
        Latency: 168 msec (68-173 msec ~168 msec)
> ACL Data RX: Handle 1443 flags 0x02 dlen 21             #120 [hci1] 10.644555
      SMP: Pairing Confirm (0x03) len 16
        Confim value: f929e52d5c1e02b8707ac9d79e0ed82b
< HCI Command: Host Number of Com.. (0x03|0x0035) plen 5  #121 [hci1] 10.647830
        Num handles: 1
        Handle: 1443 Address: DF:A9:FF:F6:B1:1A (OUI DF-A9-FF)
        Count: 1
< ACL Data TX: Handle 1443 flags 0x00 dlen 21             #122 [hci1] 10.647934
      SMP: Pairing Confirm (0x03) len 16
        Confim value: d80c35626b215d79e0c68905ad7245c9
> HCI Event: Number of Completed Packets (0x13) plen 5    #123 [hci1] 10.819456
        Num handles: 1
        Handle: 1443 Address: DF:A9:FF:F6:B1:1A (OUI DF-A9-FF)
        Count: 1
        #122: len 21 (0 Kb/s)
        Latency: 171 msec (68-173 msec ~170 msec)
> ACL Data RX: Handle 1443 flags 0x02 dlen 21             #124 [hci1] 10.819780
      SMP: Pairing Random (0x04) len 16
        Random value: fafd290bcfd3134e0000000000000000
< HCI Command: Host Number of Com.. (0x03|0x0035) plen 5  #125 [hci1] 10.828052
        Num handles: 1
        Handle: 1443 Address: DF:A9:FF:F6:B1:1A (OUI DF-A9-FF)
        Count: 1
< ACL Data TX: Handle 1443 flags 0x00 dlen 21             #126 [hci1] 10.828258
      SMP: Pairing Random (0x04) len 16
        Random value: eb9f1915536596b6fc3db1c86b2b1970
> HCI Event: Number of Completed Packets (0x13) plen 5    #127 [hci1] 10.994196
        Num handles: 1
        Handle: 1443 Address: DF:A9:FF:F6:B1:1A (OUI DF-A9-FF)
        Count: 1
        #126: len 21 (1 Kb/s)
        Latency: 165 msec (68-173 msec ~168 msec)
> ACL Data RX: Handle 1443 flags 0x02 dlen 21             #128 [hci1] 11.082108
      SMP: Pairing Confirm (0x03) len 16
        Confim value: dc542a4ab070c577ffd098c8b640beb8
< HCI Command: Host Number of Com.. (0x03|0x0035) plen 5  #129 [hci1] 11.087415
        Num handles: 1
        Handle: 1443 Address: DF:A9:FF:F6:B1:1A (OUI DF-A9-FF)
        Count: 1
< ACL Data TX: Handle 1443 flags 0x00 dlen 21             #130 [hci1] 11.087461
      SMP: Pairing Confirm (0x03) len 16
        Confim value: bce7391e5e3c98d404c848bced7fe76e
> HCI Event: Number of Completed Packets (0x13) plen 5    #131 [hci1] 11.257041
        Num handles: 1
        Handle: 1443 Address: DF:A9:FF:F6:B1:1A (OUI DF-A9-FF)
        Count: 1
        #130: len 21 (0 Kb/s)
        Latency: 169 msec (68-173 msec ~168 msec)
> ACL Data RX: Handle 1443 flags 0x02 dlen 21             #132 [hci1] 11.257264
      SMP: Pairing Random (0x04) len 16
        Random value: de572c86b1edc7830000000000000000
< HCI Command: Host Number of Com.. (0x03|0x0035) plen 5  #133 [hci1] 11.267931
        Num handles: 1
        Handle: 1443 Address: DF:A9:FF:F6:B1:1A (OUI DF-A9-FF)
        Count: 1
< ACL Data TX: Handle 1443 flags 0x00 dlen 21             #134 [hci1] 11.268007
      SMP: Pairing Random (0x04) len 16
        Random value: 5c794dc9ad9f2c3f295ebd5ad5e1c3cf
> HCI Event: Number of Completed Packets (0x13) plen 5    #135 [hci1] 11.431694
        Num handles: 1
        Handle: 1443 Address: DF:A9:FF:F6:B1:1A (OUI DF-A9-FF)
        Count: 1
        #134: len 21 (1 Kb/s)
        Latency: 163 msec (68-173 msec ~166 msec)
> ACL Data RX: Handle 1443 flags 0x02 dlen 21             #136 [hci1] 11.519501
      SMP: Pairing Confirm (0x03) len 16
        Confim value: 03d910af23a08dc08d32c6ead4448078
< HCI Command: Host Number of Com.. (0x03|0x0035) plen 5  #137 [hci1] 11.527941
        Num handles: 1
        Handle: 1443 Address: DF:A9:FF:F6:B1:1A (OUI DF-A9-FF)
        Count: 1
< ACL Data TX: Handle 1443 flags 0x00 dlen 21             #138 [hci1] 11.528030
      SMP: Pairing Confirm (0x03) len 16
        Confim value: 89faddccfaedbb2d7e7d55a87f4232b4
> HCI Event: Number of Completed Packets (0x13) plen 5    #139 [hci1] 11.694401
        Num handles: 1
        Handle: 1443 Address: DF:A9:FF:F6:B1:1A (OUI DF-A9-FF)
        Count: 1
        #138: len 21 (1 Kb/s)
        Latency: 166 msec (68-173 msec ~166 msec)
> ACL Data RX: Handle 1443 flags 0x02 dlen 21             #140 [hci1] 11.694731
      SMP: Pairing Random (0x04) len 16
        Random value: 06491a22981132710000000000000000
< HCI Command: Host Number of Com.. (0x03|0x0035) plen 5  #141 [hci1] 11.707828
        Num handles: 1
        Handle: 1443 Address: DF:A9:FF:F6:B1:1A (OUI DF-A9-FF)
        Count: 1
< ACL Data TX: Handle 1443 flags 0x00 dlen 21             #142 [hci1] 11.707893
      SMP: Pairing Random (0x04) len 16
        Random value: 5c2fff312cdf99c9491988e877355a9a
> HCI Event: Number of Completed Packets (0x13) plen 5    #143 [hci1] 11.869126
        Num handles: 1
        Handle: 1443 Address: DF:A9:FF:F6:B1:1A (OUI DF-A9-FF)
        Count: 1
        #142: len 21 (1 Kb/s)
        Latency: 161 msec (68-173 msec ~163 msec)
> ACL Data RX: Handle 1443 flags 0x02 dlen 21             #144 [hci1] 11.957065
      SMP: Pairing Confirm (0x03) len 16
        Confim value: 7fb583929ae7df7c0a34425f31de6dac
< HCI Command: Host Number of Com.. (0x03|0x0035) plen 5  #145 [hci1] 11.967681
        Num handles: 1
        Handle: 1443 Address: DF:A9:FF:F6:B1:1A (OUI DF-A9-FF)
        Count: 1
< ACL Data TX: Handle 1443 flags 0x00 dlen 21             #146 [hci1] 11.967846
      SMP: Pairing Confirm (0x03) len 16
        Confim value: e9ed17dc4a8d6a5f79253d273bc36e7e
> HCI Event: Number of Completed Packets (0x13) plen 5    #147 [hci1] 12.131864
        Num handles: 1
        Handle: 1443 Address: DF:A9:FF:F6:B1:1A (OUI DF-A9-FF)
        Count: 1
        #146: len 21 (1 Kb/s)
        Latency: 164 msec (68-173 msec ~163 msec)
> ACL Data RX: Handle 1443 flags 0x02 dlen 21             #148 [hci1] 12.132218
      SMP: Pairing Random (0x04) len 16
        Random value: 7bc748ba2d2edfb50000000000000000
< HCI Command: Host Number of Com.. (0x03|0x0035) plen 5  #149 [hci1] 12.148033
        Num handles: 1
        Handle: 1443 Address: DF:A9:FF:F6:B1:1A (OUI DF-A9-FF)
        Count: 1
< ACL Data TX: Handle 1443 flags 0x00 dlen 21             #150 [hci1] 12.148201
      SMP: Pairing Random (0x04) len 16
        Random value: c629a3a987d808e808655d558dfc1155
> HCI Event: Number of Completed Packets (0x13) plen 5    #151 [hci1] 12.306631
        Num handles: 1
        Handle: 1443 Address: DF:A9:FF:F6:B1:1A (OUI DF-A9-FF)
        Count: 1
        #150: len 21 (1 Kb/s)
        Latency: 158 msec (68-173 msec ~161 msec)
> ACL Data RX: Handle 1443 flags 0x02 dlen 21             #152 [hci1] 12.394515
      SMP: Pairing Confirm (0x03) len 16
        Confim value: d11b373e91c68e8da5ee00491cea3c47
< HCI Command: Host Number of Com.. (0x03|0x0035) plen 5  #153 [hci1] 12.407911
        Num handles: 1
        Handle: 1443 Address: DF:A9:FF:F6:B1:1A (OUI DF-A9-FF)
        Count: 1
< ACL Data TX: Handle 1443 flags 0x00 dlen 21             #154 [hci1] 12.408009
      SMP: Pairing Confirm (0x03) len 16
        Confim value: 54189b7cd9b6afa76482e8d944e32004
> HCI Event: Number of Completed Packets (0x13) plen 5    #155 [hci1] 12.569417
        Num handles: 1
        Handle: 1443 Address: DF:A9:FF:F6:B1:1A (OUI DF-A9-FF)
        Count: 1
        #154: len 21 (1 Kb/s)
        Latency: 161 msec (68-173 msec ~161 msec)
> ACL Data RX: Handle 1443 flags 0x02 dlen 21             #156 [hci1] 12.569706
      SMP: Pairing Random (0x04) len 16
        Random value: 496a3dc707953cbe0000000000000000
< HCI Command: Host Number of Com.. (0x03|0x0035) plen 5  #157 [hci1] 12.588141
        Num handles: 1
        Handle: 1443 Address: DF:A9:FF:F6:B1:1A (OUI DF-A9-FF)
        Count: 1
< ACL Data TX: Handle 1443 flags 0x00 dlen 21             #158 [hci1] 12.588269
      SMP: Pairing Random (0x04) len 16
        Random value: 92f20f6ad8f13724432c7fd6001c45ff
> HCI Event: Number of Completed Packets (0x13) plen 5    #159 [hci1] 12.744131
        Num handles: 1
        Handle: 1443 Address: DF:A9:FF:F6:B1:1A (OUI DF-A9-FF)
        Count: 1
        #158: len 21 (1 Kb/s)
        Latency: 155 msec (68-173 msec ~158 msec)
> ACL Data RX: Handle 1443 flags 0x02 dlen 21             #160 [hci1] 12.832050
      SMP: Pairing Confirm (0x03) len 16
        Confim value: 06f3c31ff6e33b1d416510ed3c205239
< HCI Command: Host Number of Com.. (0x03|0x0035) plen 5  #161 [hci1] 12.847861
        Num handles: 1
        Handle: 1443 Address: DF:A9:FF:F6:B1:1A (OUI DF-A9-FF)
        Count: 1
< ACL Data TX: Handle 1443 flags 0x00 dlen 21             #162 [hci1] 12.847952
      SMP: Pairing Confirm (0x03) len 16
        Confim value: 5b92e3327fc83e35d5d8f776594e52da
> HCI Event: Number of Completed Packets (0x13) plen 5    #163 [hci1] 13.006890
        Num handles: 1
        Handle: 1443 Address: DF:A9:FF:F6:B1:1A (OUI DF-A9-FF)
        Count: 1
        #162: len 21 (1 Kb/s)
        Latency: 158 msec (68-173 msec ~158 msec)
> ACL Data RX: Handle 1443 flags 0x02 dlen 21             #164 [hci1] 13.007192
      SMP: Pairing Random (0x04) len 16
        Random value: 04337e53823de5550000000000000000
< HCI Command: Host Number of Com.. (0x03|0x0035) plen 5  #165 [hci1] 13.008035
        Num handles: 1
        Handle: 1443 Address: DF:A9:FF:F6:B1:1A (OUI DF-A9-FF)
        Count: 1
< ACL Data TX: Handle 1443 flags 0x00 dlen 21             #166 [hci1] 13.008149
      SMP: Pairing Random (0x04) len 16
        Random value: 23ac32ebbb5e14c8a6b9622f296d277f
> HCI Event: Number of Completed Packets (0x13) plen 5    #167 [hci1] 13.181658
        Num handles: 1
        Handle: 1443 Address: DF:A9:FF:F6:B1:1A (OUI DF-A9-FF)
        Count: 1
        #166: len 21 (0 Kb/s)
        Latency: 173 msec (68-173 msec ~166 msec)
> ACL Data RX: Handle 1443 flags 0x02 dlen 21             #168 [hci1] 13.269494
      SMP: Pairing Confirm (0x03) len 16
        Confim value: adafd8c4a37a8b0332f8c89840b0ac76
< HCI Command: Host Number of Com.. (0x03|0x0035) plen 5  #169 [hci1] 13.287838
        Num handles: 1
        Handle: 1443 Address: DF:A9:FF:F6:B1:1A (OUI DF-A9-FF)
        Count: 1
< ACL Data TX: Handle 1443 flags 0x00 dlen 21             #170 [hci1] 13.287991
      SMP: Pairing Confirm (0x03) len 16
        Confim value: d061659f3aa340cbef353fa5c43bc6c2
> HCI Event: Number of Completed Packets (0x13) plen 5    #171 [hci1] 13.444348
        Num handles: 1
        Handle: 1443 Address: DF:A9:FF:F6:B1:1A (OUI DF-A9-FF)
        Count: 1
        #170: len 21 (1 Kb/s)
        Latency: 156 msec (68-173 msec ~161 msec)
> ACL Data RX: Handle 1443 flags 0x02 dlen 21             #172 [hci1] 13.444682
      SMP: Pairing Random (0x04) len 16
        Random value: f4535a8f0ff211340000000000000000
< HCI Command: Host Number of Com.. (0x03|0x0035) plen 5  #173 [hci1] 13.448019
        Num handles: 1
        Handle: 1443 Address: DF:A9:FF:F6:B1:1A (OUI DF-A9-FF)
        Count: 1
< ACL Data TX: Handle 1443 flags 0x00 dlen 21             #174 [hci1] 13.448130
      SMP: Pairing Random (0x04) len 16
        Random value: 297efe85e67448a15f56bd27e3a3cf1d
> HCI Event: Number of Completed Packets (0x13) plen 5    #175 [hci1] 13.619097
        Num handles: 1
        Handle: 1443 Address: DF:A9:FF:F6:B1:1A (OUI DF-A9-FF)
        Count: 1
        #174: len 21 (0 Kb/s)
        Latency: 170 msec (68-173 msec ~166 msec)
> ACL Data RX: Handle 1443 flags 0x02 dlen 21             #176 [hci1] 13.706961
      SMP: Pairing Confirm (0x03) len 16
        Confim value: 9f00bbab330af51a96d599c6994d5916
< HCI Command: Host Number of Com.. (0x03|0x0035) plen 5  #177 [hci1] 13.707767
        Num handles: 1
        Handle: 1443 Address: DF:A9:FF:F6:B1:1A (OUI DF-A9-FF)
        Count: 1
< ACL Data TX: Handle 1443 flags 0x00 dlen 21             #178 [hci1] 13.707858
      SMP: Pairing Confirm (0x03) len 16
        Confim value: 8337a249b5e6cbfd50b57b2b6c1308ba
> HCI Event: Number of Completed Packets (0x13) plen 5    #179 [hci1] 13.881803
        Num handles: 1
        Handle: 1443 Address: DF:A9:FF:F6:B1:1A (OUI DF-A9-FF)
        Count: 1
        #178: len 21 (0 Kb/s)
        Latency: 173 msec (68-173 msec ~170 msec)
> ACL Data RX: Handle 1443 flags 0x02 dlen 21             #180 [hci1] 13.882252
      SMP: Pairing Random (0x04) len 16
        Random value: dd09e6891f82bab00000000000000000
< HCI Command: Host Number of Com.. (0x03|0x0035) plen 5  #181 [hci1] 13.888114
        Num handles: 1
        Handle: 1443 Address: DF:A9:FF:F6:B1:1A (OUI DF-A9-FF)
        Count: 1
< ACL Data TX: Handle 1443 flags 0x00 dlen 21             #182 [hci1] 13.888294
      SMP: Pairing Random (0x04) len 16
        Random value: 25a9493fd3ce4faf02be7293595bb7c6
> HCI Event: Number of Completed Packets (0x13) plen 5    #183 [hci1] 14.056593
        Num handles: 1
        Handle: 1443 Address: DF:A9:FF:F6:B1:1A (OUI DF-A9-FF)
        Count: 1
        #182: len 21 (1 Kb/s)
        Latency: 168 msec (68-173 msec ~169 msec)
> ACL Data RX: Handle 1443 flags 0x02 dlen 21             #184 [hci1] 14.144465
      SMP: Pairing Confirm (0x03) len 16
        Confim value: 5672e73f174d1e25f346df730ca585f4
< HCI Command: Host Number of Com.. (0x03|0x0035) plen 5  #185 [hci1] 14.147905
        Num handles: 1
        Handle: 1443 Address: DF:A9:FF:F6:B1:1A (OUI DF-A9-FF)
        Count: 1
< ACL Data TX: Handle 1443 flags 0x00 dlen 21             #186 [hci1] 14.148062
      SMP: Pairing Confirm (0x03) len 16
        Confim value: b552c9fc1ee4a3064de47711dd76fe4d
> HCI Event: Number of Completed Packets (0x13) plen 5    #187 [hci1] 14.319367
        Num handles: 1
        Handle: 1443 Address: DF:A9:FF:F6:B1:1A (OUI DF-A9-FF)
        Count: 1
        #186: len 21 (0 Kb/s)
        Latency: 171 msec (68-173 msec ~170 msec)
> ACL Data RX: Handle 1443 flags 0x02 dlen 21             #188 [hci1] 14.319680
      SMP: Pairing Random (0x04) len 16
        Random value: 1c0a6644dc3c54320000000000000000
< HCI Command: Host Number of Com.. (0x03|0x0035) plen 5  #189 [hci1] 14.327953
        Num handles: 1
        Handle: 1443 Address: DF:A9:FF:F6:B1:1A (OUI DF-A9-FF)
        Count: 1
< ACL Data TX: Handle 1443 flags 0x00 dlen 21             #190 [hci1] 14.328100
      SMP: Pairing Random (0x04) len 16
        Random value: 58f6b41f855a6f6c3560debd84e2affc
> HCI Event: Number of Completed Packets (0x13) plen 5    #191 [hci1] 14.494156
        Num handles: 1
        Handle: 1443 Address: DF:A9:FF:F6:B1:1A (OUI DF-A9-FF)
        Count: 1
        #190: len 21 (1 Kb/s)
        Latency: 166 msec (68-173 msec ~168 msec)
> ACL Data RX: Handle 1443 flags 0x02 dlen 21             #192 [hci1] 14.582012
      SMP: Pairing Confirm (0x03) len 16
        Confim value: 5656c7a3f56fb1d9478389636e146f1e
< HCI Command: Host Number of Com.. (0x03|0x0035) plen 5  #193 [hci1] 14.587998
        Num handles: 1
        Handle: 1443 Address: DF:A9:FF:F6:B1:1A (OUI DF-A9-FF)
        Count: 1
< ACL Data TX: Handle 1443 flags 0x00 dlen 21             #194 [hci1] 14.588115
      SMP: Pairing Confirm (0x03) len 16
        Confim value: 1c621f63dc4dcc34b93d471111b1db30
> HCI Event: Number of Completed Packets (0x13) plen 5    #195 [hci1] 14.756825
        Num handles: 1
        Handle: 1443 Address: DF:A9:FF:F6:B1:1A (OUI DF-A9-FF)
        Count: 1
        #194: len 21 (1 Kb/s)
        Latency: 168 msec (68-173 msec ~168 msec)
> ACL Data RX: Handle 1443 flags 0x02 dlen 21             #196 [hci1] 14.757192
      SMP: Pairing Random (0x04) len 16
        Random value: 26aedf581f6fec3d0000000000000000
< HCI Command: Host Number of Com.. (0x03|0x0035) plen 5  #197 [hci1] 14.768049
        Num handles: 1
        Handle: 1443 Address: DF:A9:FF:F6:B1:1A (OUI DF-A9-FF)
        Count: 1
< ACL Data TX: Handle 1443 flags 0x00 dlen 21             #198 [hci1] 14.768225
      SMP: Pairing Random (0x04) len 16
        Random value: b67e7216d5bf664139eda2b542549666
> HCI Event: Number of Completed Packets (0x13) plen 5    #199 [hci1] 14.931589
        Num handles: 1
        Handle: 1443 Address: DF:A9:FF:F6:B1:1A (OUI DF-A9-FF)
        Count: 1
        #198: len 21 (1 Kb/s)
        Latency: 163 msec (68-173 msec ~165 msec)
> ACL Data RX: Handle 1443 flags 0x02 dlen 21             #200 [hci1] 15.019397
      SMP: Pairing Confirm (0x03) len 16
        Confim value: 6de09765f2b39de3573cd70373b1a436
< HCI Command: Host Number of Com.. (0x03|0x0035) plen 5  #201 [hci1] 15.027997
        Num handles: 1
        Handle: 1443 Address: DF:A9:FF:F6:B1:1A (OUI DF-A9-FF)
        Count: 1
< ACL Data TX: Handle 1443 flags 0x00 dlen 21             #202 [hci1] 15.028114
      SMP: Pairing Confirm (0x03) len 16
        Confim value: 84d3474c6a8113aa56e2d696d3d6eee3
> HCI Event: Number of Completed Packets (0x13) plen 5    #203 [hci1] 15.194194
        Num handles: 1
        Handle: 1443 Address: DF:A9:FF:F6:B1:1A (OUI DF-A9-FF)
        Count: 1
        #202: len 21 (1 Kb/s)
        Latency: 166 msec (68-173 msec ~165 msec)
> ACL Data RX: Handle 1443 flags 0x02 dlen 21             #204 [hci1] 15.194610
      SMP: Pairing Random (0x04) len 16
        Random value: e0dd0a7d924d85b70000000000000000
< HCI Command: Host Number of Com.. (0x03|0x0035) plen 5  #205 [hci1] 15.208089
        Num handles: 1
        Handle: 1443 Address: DF:A9:FF:F6:B1:1A (OUI DF-A9-FF)
        Count: 1
< ACL Data TX: Handle 1443 flags 0x00 dlen 21             #206 [hci1] 15.208267
      SMP: Pairing Random (0x04) len 16
        Random value: ed17f76500c95219dd01e09d1e63f87b
> HCI Event: Number of Completed Packets (0x13) plen 5    #207 [hci1] 15.369139
        Num handles: 1
        Handle: 1443 Address: DF:A9:FF:F6:B1:1A (OUI DF-A9-FF)
        Count: 1
        #206: len 21 (1 Kb/s)
        Latency: 160 msec (68-173 msec ~163 msec)
> ACL Data RX: Handle 1443 flags 0x02 dlen 21             #208 [hci1] 15.456941
      SMP: Pairing Confirm (0x03) len 16
        Confim value: 9b69b1e62a79c493ac5e857d381cbdda
< HCI Command: Host Number of Com.. (0x03|0x0035) plen 5  #209 [hci1] 15.467818
        Num handles: 1
        Handle: 1443 Address: DF:A9:FF:F6:B1:1A (OUI DF-A9-FF)
        Count: 1
< ACL Data TX: Handle 1443 flags 0x00 dlen 21             #210 [hci1] 15.467901
      SMP: Pairing Confirm (0x03) len 16
        Confim value: f60ae60d387fcd610b735e0a2310fc78
> HCI Event: Number of Completed Packets (0x13) plen 5    #211 [hci1] 15.631815
        Num handles: 1
        Handle: 1443 Address: DF:A9:FF:F6:B1:1A (OUI DF-A9-FF)
        Count: 1
        #210: len 21 (1 Kb/s)
        Latency: 163 msec (68-173 msec ~163 msec)
> ACL Data RX: Handle 1443 flags 0x02 dlen 21             #212 [hci1] 15.632087
      SMP: Pairing Random (0x04) len 16
        Random value: b0cf8068653505100000000000000000
< HCI Command: Host Number of Com.. (0x03|0x0035) plen 5  #213 [hci1] 15.648142
        Num handles: 1
        Handle: 1443 Address: DF:A9:FF:F6:B1:1A (OUI DF-A9-FF)
        Count: 1
< ACL Data TX: Handle 1443 flags 0x00 dlen 21             #214 [hci1] 15.648334
      SMP: Pairing Random (0x04) len 16
        Random value: 81d35d47e1f6006d79c974bd9d9e1ee3
> HCI Event: Number of Completed Packets (0x13) plen 5    #215 [hci1] 15.806520
        Num handles: 1
        Handle: 1443 Address: DF:A9:FF:F6:B1:1A (OUI DF-A9-FF)
        Count: 1
        #214: len 21 (1 Kb/s)
        Latency: 158 msec (68-173 msec ~160 msec)
> ACL Data RX: Handle 1443 flags 0x02 dlen 21             #216 [hci1] 15.894471
      SMP: Pairing Confirm (0x03) len 16
        Confim value: 08b6e2b2701ca66e06789773e64437f9
< HCI Command: Host Number of Com.. (0x03|0x0035) plen 5  #217 [hci1] 15.907947
        Num handles: 1
        Handle: 1443 Address: DF:A9:FF:F6:B1:1A (OUI DF-A9-FF)
        Count: 1
< ACL Data TX: Handle 1443 flags 0x00 dlen 21             #218 [hci1] 15.908048
      SMP: Pairing Confirm (0x03) len 16
        Confim value: a9d5e8d2d063f975c30573a421739978
> HCI Event: Number of Completed Packets (0x13) plen 5    #219 [hci1] 16.069271
        Num handles: 1
        Handle: 1443 Address: DF:A9:FF:F6:B1:1A (OUI DF-A9-FF)
        Count: 1
        #218: len 21 (1 Kb/s)
        Latency: 161 msec (68-173 msec ~161 msec)
> ACL Data RX: Handle 1443 flags 0x02 dlen 21             #220 [hci1] 16.069593
      SMP: Pairing Random (0x04) len 16
        Random value: 64462c6b160884510000000000000000
< HCI Command: Host Number of Com.. (0x03|0x0035) plen 5  #221 [hci1] 16.088147
        Num handles: 1
        Handle: 1443 Address: DF:A9:FF:F6:B1:1A (OUI DF-A9-FF)
        Count: 1
< ACL Data TX: Handle 1443 flags 0x00 dlen 21             #222 [hci1] 16.088333
      SMP: Pairing Random (0x04) len 16
        Random value: e7f7e0c2476823e41736a7e381bafb7c
> HCI Event: Number of Completed Packets (0x13) plen 5    #223 [hci1] 16.244083
        Num handles: 1
        Handle: 1443 Address: DF:A9:FF:F6:B1:1A (OUI DF-A9-FF)
        Count: 1
        #222: len 21 (1 Kb/s)
        Latency: 155 msec (68-173 msec ~158 msec)
> ACL Data RX: Handle 1443 flags 0x02 dlen 21             #224 [hci1] 16.331901
      SMP: Pairing Confirm (0x03) len 16
        Confim value: 0f9c20195738422a24eda0f7b18816c4
< HCI Command: Host Number of Com.. (0x03|0x0035) plen 5  #225 [hci1] 16.347601
        Num handles: 1
        Handle: 1443 Address: DF:A9:FF:F6:B1:1A (OUI DF-A9-FF)
        Count: 1
< ACL Data TX: Handle 1443 flags 0x00 dlen 21             #226 [hci1] 16.347658
      SMP: Pairing Confirm (0x03) len 16
        Confim value: 9450c7a140a853a46a75248859403011
> HCI Event: Number of Completed Packets (0x13) plen 5    #227 [hci1] 16.506716
        Num handles: 1
        Handle: 1443 Address: DF:A9:FF:F6:B1:1A (OUI DF-A9-FF)
        Count: 1
        #226: len 21 (1 Kb/s)
        Latency: 159 msec (68-173 msec ~158 msec)
> ACL Data RX: Handle 1443 flags 0x02 dlen 21             #228 [hci1] 16.507136
      SMP: Pairing Random (0x04) len 16
        Random value: 21b45a0a841e5c220000000000000000
