Bluetooth monitor ver 5.72
= Note: Linux version 7.0.0-31-generic (x86_64)                        0.565198
= Note: Bluetooth subsystem version 2.22                               0.565213
= New Index: 00:00:00:00:00:00 (Primary,UART,hci2)              [hci2] 0.565214
= New Index: 00:00:00:00:00:00 (Primary,UART,hci1)              [hci1] 0.565215
= New Index: 48:5F:99:8E:E0:64 (Primary,USB,hci0)               [hci0] 0.565215
= Open Index: 00:00:00:00:00:00                                 [hci1] 0.618328
= Index Info: 00:00:00:00:00:00 (Nordic Semiconductor ASA)      [hci1] 0.618332
@ USER Open: main (privileged) version 2.22            {0x0001} [hci1] 0.618335
< HCI Command: Reset (0x03|0x0003) plen 0                    #1 [hci1] 0.618675
> HCI Event: Command Complete (0x0e) plen 4                  #2 [hci1] 0.619223
      Reset (0x03|0x0003) ncmd 1
        Status: Success (0x00)
< HCI Command: Read Local Supported... (0x04|0x0003) plen 0  #3 [hci1] 0.638313
> HCI Event: Command Complete (0x0e) plen 12                 #4 [hci1] 0.638843
      Read Local Supported Features (0x04|0x0003) ncmd 1
        Status: Success (0x00)
        Features: 0x00 0x00 0x00 0x00 0x60 0x00 0x00 0x00
          BR/EDR Not Supported
          LE Supported (Controller)
< HCI Command: Read Local Version In.. (0x04|0x0001) plen 0  #5 [hci1] 0.658353
> HCI Event: Command Complete (0x0e) plen 12                 #6 [hci1] 0.658865
      Read Local Version Information (0x04|0x0001) ncmd 1
        Status: Success (0x00)
        HCI version: Reserved (0x11) - Revision 12345 (0x3039)
        LMP version: Reserved (0x11) - Subversion 12345 (0x3039)
        Manufacturer: Nordic Semiconductor ASA (89)
< HCI Command: Read Local Supported... (0x04|0x0002) plen 0  #7 [hci1] 0.678346
> HCI Event: Command Complete (0x0e) plen 68                 #8 [hci1] 0.679507
      Read Local Supported Commands (0x04|0x0002) ncmd 1
        Status: Success (0x00)
        Commands: 115 entries
          Disconnect (Octet 0 - Bit 5)
          Read Remote Version Information (Octet 2 - Bit 7)
          Set Event Mask (Octet 5 - Bit 6)
          Reset (Octet 5 - Bit 7)
          Read Connection Accept Timeout (Octet 7 - Bit 2)
          Write Connection Accept Timeout (Octet 7 - Bit 3)
          Read Transmit Power Level (Octet 10 - Bit 2)
          Set Controller To Host Flow Control (Octet 10 - Bit 5)
          Host Buffer Size (Octet 10 - Bit 6)
          Host Number of Completed Packets (Octet 10 - Bit 7)
          Read Local Version Information (Octet 14 - Bit 3)
          Read Local Supported Features (Octet 14 - Bit 5)
          Read BD ADDR (Octet 15 - Bit 1)
          Read RSSI (Octet 15 - Bit 5)
          Set Event Mask Page 2 (Octet 22 - Bit 2)
          LE Set Event Mask (Octet 25 - Bit 0)
          LE Read Buffer Size (Octet 25 - Bit 1)
          LE Read Local Supported Features (Octet 25 - Bit 2)
          LE Set Random Address (Octet 25 - Bit 4)
          LE Set Advertising Parameters (Octet 25 - Bit 5)
          LE Read Advertising Channel TX Power (Octet 25 - Bit 6)
          LE Set Advertising Data (Octet 25 - Bit 7)
          LE Set Scan Response Data (Octet 26 - Bit 0)
          LE Set Advertise Enable (Octet 26 - Bit 1)
          LE Set Scan Parameters (Octet 26 - Bit 2)
          LE Set Scan Enable (Octet 26 - Bit 3)
          LE Create Connection (Octet 26 - Bit 4)
          LE Create Connection Cancel (Octet 26 - Bit 5)
          LE Read Accept List Size (Octet 26 - Bit 6)
          LE Clear Accept List (Octet 26 - Bit 7)
          LE Add Device To Accept List (Octet 27 - Bit 0)
          LE Remove Device From Accept List (Octet 27 - Bit 1)
          LE Connection Update (Octet 27 - Bit 2)
          LE Set Host Channel Classification (Octet 27 - Bit 3)
          LE Read Channel Map (Octet 27 - Bit 4)
          LE Read Remote Used Features (Octet 27 - Bit 5)
          LE Encrypt (Octet 27 - Bit 6)
          LE Rand (Octet 27 - Bit 7)
          LE Start Encryption (Octet 28 - Bit 0)
          LE Long Term Key Request Reply (Octet 28 - Bit 1)
          LE Long Term Key Request Neg Reply (Octet 28 - Bit 2)
          LE Read Supported States (Octet 28 - Bit 3)
          Read Authenticated Payload Timeout (Octet 32 - Bit 4)
          Write Authenticated Payload Timeout (Octet 32 - Bit 5)
          LE Set Data Length (Octet 33 - Bit 6)
          LE Read Suggested Default Data Length (Octet 33 - Bit 7)
          LE Write Suggested Default Data Length (Octet 34 - Bit 0)
          LE Add Device To Resolving List (Octet 34 - Bit 3)
          LE Remove Device From Resolving List (Octet 34 - Bit 4)
          LE Clear Resolving List (Octet 34 - Bit 5)
          LE Read Resolving List Size (Octet 34 - Bit 6)
          LE Set Address Resolution Enable (Octet 35 - Bit 1)
          LE Set Resolvable Private Address Timeout (Octet 35 - Bit 2)
          LE Read Maximum Data Length (Octet 35 - Bit 3)
          LE Read PHY (Octet 35 - Bit 4)
          LE Set Default PHY (Octet 35 - Bit 5)
          LE Set PHY (Octet 35 - Bit 6)
          LE Set Advertising Set Random Address (Octet 36 - Bit 1)
          LE Set Extended Advertising Parameters (Octet 36 - Bit 2)
          LE Set Extended Advertising Data (Octet 36 - Bit 3)
          LE Set Extended Scan Response Data (Octet 36 - Bit 4)
          LE Set Extended Advertising Enable (Octet 36 - Bit 5)
          LE Read Maximum Advertising Data Length (Octet 36 - Bit 6)
          LE Read Number of Supported Advertising Sets (Octet 36 - Bit 7)
          LE Remove Advertising Set (Octet 37 - Bit 0)
          LE Clear Advertising Sets (Octet 37 - Bit 1)
          LE Set Periodic Advertising Parameters (Octet 37 - Bit 2)
          LE Set Periodic Advertising Data (Octet 37 - Bit 3)
          LE Set Periodic Advertising Enable (Octet 37 - Bit 4)
          LE Set Extended Scan Parameters (Octet 37 - Bit 5)
          LE Set Extended Scan Enable (Octet 37 - Bit 6)
          LE Extended Create Connection (Octet 37 - Bit 7)
          LE Periodic Advertising Create Sync (Octet 38 - Bit 0)
          LE Periodic Advertising Create Sync Cancel (Octet 38 - Bit 1)
          LE Periodic Advertising Terminate Sync (Octet 38 - Bit 2)
          LE Add Device To Periodic Advertiser List (Octet 38 - Bit 3)
          LE Remove Device From Periodic Advertiser List (Octet 38 - Bit 4)
          LE Clear Periodic Advertiser List (Octet 38 - Bit 5)
          LE Read Periodic Advertiser List Size (Octet 38 - Bit 6)
          LE Read Transmit Power (Octet 38 - Bit 7)
          LE Read RF Path Compensation (Octet 39 - Bit 0)
          LE Write RF Path Compensation (Octet 39 - Bit 1)
          LE Set Privacy Mode (Octet 39 - Bit 2)
          LE Periodic Advertising Receive Enable (Octet 40 - Bit 5)
          LE Periodic Advertising Sync Transfer (Octet 40 - Bit 6)
          LE Periodic Advertising Set Info Transfer (Octet 40 - Bit 7)
          LE Periodic Advertising Sync Transfer Parameters (Octet 41 - Bit 0)
          LE Set Default Periodic Advertisng Sync Transfer Parameters (Octet 41 - Bit 1)
          LE Read Buffer v2 (Octet 41 - Bit 5)
          LE Read ISO TX Sync (Octet 41 - Bit 6)
          LE Set Connected Isochronous Group Parameters (Octet 41 - Bit 7)
          LE Set Connected Isochronous Group Parameters Test (Octet 42 - Bit 0)
          LE Create Connected Isochronous Stream (Octet 42 - Bit 1)
          LE Remove Connected Isochronous Group (Octet 42 - Bit 2)
          LE Accept Connected Isochronous Stream Request (Octet 42 - Bit 3)
          LE Reject Connected Isochronous Stream Request (Octet 42 - Bit 4)
          LE Create Broadcast Isochronous Group (Octet 42 - Bit 5)
          LE Create Broadcast Isochronous Group Test (Octet 42 - Bit 6)
          LE Terminate Broadcast Isochronous Group (Octet 42 - Bit 7)
          LE Broadcast Isochronous Group Create Sync (Octet 43 - Bit 0)
          LE Broadcast Isochronous Group Terminate Sync (Octet 43 - Bit 1)
          LE Request Peer SCA (Octet 43 - Bit 2)
          LE Setup Isochronous Data Path (Octet 43 - Bit 3)
          LE Remove Isochronous Data Path (Octet 43 - Bit 4)
          LE Isochronous Transmit Test (Octet 43 - Bit 5)
          LE Isochronous Receive Test (Octet 43 - Bit 6)
          LE Isochronous Read Test Counters (Octet 43 - Bit 7)
          LE Isochronous Read Test Counters (Octet 44 - Bit 0)
          LE Set Host Feature (Octet 44 - Bit 1)
          Octet 44 - Bit 2 
          Octet 45 - Bit 6 
          Octet 46 - Bit 0 
          Octet 46 - Bit 1 
          Octet 46 - Bit 2 
          Octet 47 - Bit 4 
< HCI Command: Host Buffer Size (0x03|0x0033) plen 7         #9 [hci1] 0.698348
        ACL MTU: 255  ACL max packet: 16
        SCO MTU: 0    SCO max packet: 0
> HCI Event: Command Complete (0x0e) plen 4                 #10 [hci1] 0.698950
      Host Buffer Size (0x03|0x0033) ncmd 1
        Status: Success (0x00)
< HCI Command: Set Controller To Ho.. (0x03|0x0031) plen 1  #11 [hci1] 0.718360
        Flow control: ACL Data Packets (0x01)
> HCI Event: Command Complete (0x0e) plen 4                 #12 [hci1] 0.718846
      Set Controller To Host Flow Control (0x03|0x0031) ncmd 1
        Status: Success (0x00)
< HCI Command: LE Read Local Suppor.. (0x08|0x0003) plen 0  #13 [hci1] 0.738705
> HCI Event: Command Complete (0x0e) plen 12                #14 [hci1] 0.739237
      LE Read Local Supported Features (0x08|0x0003) ncmd 1
        Status: Success (0x00)
        Features: 0xfd 0x79 0x00 0xf7 0x30 0x01 0x00 0x00
          LE Encryption
          Extended Reject Indication
          Peripheral-initiated Features Exchange
          LE Ping
          LE Data Packet Length Extension
          LL Privacy
          Extended Scanner Filter Policies
          LE 2M PHY
          LE Coded PHY
          LE Extended Advertising
          LE Periodic Advertising
          Channel Selection Algorithm #2
          Periodic Advertising Sync Transfer - Sender
          Periodic Advertising Sync Transfer - Recipient
          Sleep Clock Accuracy Updates
          Connected Isochronous Stream - Central
          Connected Isochronous Stream - Peripheral
          Isochronous Broadcaster
          Synchronized Receiver
          Periodic Advertising ADI support
          Connection Subrating
          Unknown features (0x0000010000000000)
< HCI Command: LE Set Host Feature (0x08|0x0074) plen 2     #15 [hci1] 0.758345
        Bit Number: 32
          Connected Isochronous Stream (Host Support)
        Bit Value: 1
> HCI Event: Command Complete (0x0e) plen 4                 #16 [hci1] 0.758750
      LE Set Host Feature (0x08|0x0074) ncmd 1
        Status: Success (0x00)
< HCI Command: LE Read Buffer v2 (0x08|0x0060) plen 0       #17 [hci1] 0.778326
> HCI Event: Command Complete (0x0e) plen 10                #18 [hci1] 0.778938
      LE Read Buffer v2 (0x08|0x0060) ncmd 1
        Status: Success (0x00)
        ACL MTU: 27
        ACL max packet: 3
        ISO MTU: 318
        ISO max packet: 3
< HCI Command: LE Read Maximum Adve.. (0x08|0x003a) plen 0  #19 [hci1] 0.798356
> HCI Event: Command Complete (0x0e) plen 6                 #20 [hci1] 0.798845
      LE Read Maximum Advertising Data Length (0x08|0x003a) ncmd 1
        Status: Success (0x00)
        Max length: 1650
< HCI Command: LE Read Supported St.. (0x08|0x001c) plen 0  #21 [hci1] 0.818341
> HCI Event: Command Complete (0x0e) plen 12                #22 [hci1] 0.818875
      LE Read Supported States (0x08|0x001c) ncmd 1
        Status: Success (0x00)
        States: 0x000003ff3e0306ff
          Non-connectable Advertising State
          Scannable Advertising State
          Connectable Advertising State
          High Duty Cycle Directed Advertising State
          Passive Scanning State
          Active Scanning State
          Initiating State
            and Connection State (Central Role)
          Connection State (Peripheral Role)
          Scannable Advertising State
            and Passive Scanning State
          Connectable Advertising State
            and Passive Scanning State
          Non-connectable Advertising State
            and Initiating State
          Scannable Advertising State
            and Initiating State
          Active Scanning State
            and Connection State (Central Role)
          Passive Scanning State
            and Connection State (Peripheral Role)
          Active Scanning State
            and Connection State (Peripheral Role)
          Initiating State
            and Connection State (Central Role)
            and Central Role & Central Role
          Low Duty Cycle Directed Advertising State
          Connectable Advertising State
            and Initiating State
            and Central Role & Peripheral Role
          High Duty Cycle Directed Advertising State
            and Initiating State
            and Central Role & Peripheral Role
          Low Duty Cycle Directed Advertising State
            and Initiating State
            and Central Role & Peripheral Role
          Connectable Advertising State
            and Connection State (Central Role)
            and Central Role & Peripheral Role
          High Duty Cycle Directed Advertising State
            and Connection State (Central Role)
            and Central Role & Peripheral Role
          Low Duty Cycle Directed Advertising State
            and Connection State (Central Role)
            and Central Role & Peripheral Role
          Connectable Advertising State
            and Connection State (Peripheral Role)
            and Central Role & Peripheral Role
          High Duty Cycle Directed Advertising State
            and Connection State (Peripheral Role)
            and Peripheral Role & Peripheral Role
          Low Duty Cycle Directed Advertising State
            and Connection State (Peripheral Role)
            and Peripheral Role & Peripheral Role
          Initiating State
            and Connection State (Peripheral Role)
            and Central Role & Peripheral Role
< HCI Command: LE Read Maximum Data.. (0x08|0x002f) plen 0  #23 [hci1] 0.838324
> HCI Event: Command Complete (0x0e) plen 12                #24 [hci1] 0.838852
      LE Read Maximum Data Length (0x08|0x002f) ncmd 1
        Status: Success (0x00)
        Max TX octets: 251
        Max TX time: 2704
        Max RX octets: 251
        Max RX time: 2704
< HCI Command: LE Write Suggested D.. (0x08|0x0024) plen 4  #25 [hci1] 0.858314
        TX octets: 251
        TX time: 2704
> HCI Event: Command Complete (0x0e) plen 4                 #26 [hci1] 0.858878
      LE Write Suggested Default Data Length (0x08|0x0024) ncmd 1
        Status: Success (0x00)
< HCI Command: LE Read Resolving Li.. (0x08|0x002a) plen 0  #27 [hci1] 0.878316
> HCI Event: Command Complete (0x0e) plen 5                 #28 [hci1] 0.878796
      LE Read Resolving List Size (0x08|0x002a) ncmd 1
        Status: Success (0x00)
        Size: 8
< HCI Command: LE Set Host Feature (0x08|0x0074) plen 2     #29 [hci1] 0.898317
        Bit Number: 38
          Connection Subrating (Host Support)
        Bit Value: 1
> HCI Event: Command Complete (0x0e) plen 4                 #30 [hci1] 0.898774
      LE Set Host Feature (0x08|0x0074) ncmd 1
        Status: Success (0x00)
< HCI Command: LE Set Event Mask (0x08|0x0001) plen 8       #31 [hci1] 0.918310
        Mask: 0x000002063f87fa5e
          LE Advertising Report
          LE Connection Update Complete
          LE Read Remote Used Features Complete
          LE Long Term Key Request
          LE Data Length Change
          LE Enhanced Connection Complete
          LE PHY Update Complete
          LE Extended Advertising Report
          LE Periodic Advertising Sync Established
          LE Periodic Advertising Report
          LE Periodic Advertising Sync Lost
          LE Extended Scan Timeout
          LE Extended Advertising Set Terminated
          LE Scan Request Received
          LE Periodic Advertising Sync Transfer Rvc
          LE CIS Established
          LE CIS Request
          LE Create BIG Complete
          LE Terminate BIG Complete
          LE BIG Sync Estabilished Complete
          LE BIG Sync Lost
          LE BIG Info Advertising Report
          LE Subrate Change
          Unknown mask (0x0000020000000000)
> HCI Event: Command Complete (0x0e) plen 4                 #32 [hci1] 0.918891
      LE Set Event Mask (0x08|0x0001) ncmd 1
        Status: Success (0x00)
< HCI Command: Set Event Mask (0x03|0x0001) plen 8          #33 [hci1] 0.938277
        Mask: 0x2000800002008890
          Disconnection Complete
          Encryption Change
          Read Remote Version Information Complete
          Hardware Error
          Data Buffer Overflow
          Encryption Key Refresh Complete
          LE Meta
> HCI Event: Command Complete (0x0e) plen 4                 #34 [hci1] 0.938894
      Set Event Mask (0x03|0x0001) ncmd 1
        Status: Success (0x00)
< HCI Command: Read BD ADDR (0x04|0x0009) plen 0            #35 [hci1] 0.958305
> HCI Event: Command Complete (0x0e) plen 10                #36 [hci1] 0.958790
      Read BD ADDR (0x04|0x0009) ncmd 1
        Status: Success (0x00)
        Address: 00:00:00:00:00:00 (OUI 00-00-00)
< HCI Command: LE Set Random Address (0x08|0x0005) plen 6   #37 [hci1] 0.978318
        Address: D5:B6:CC:31:DB:3B (Static)
> HCI Event: Command Complete (0x0e) plen 4                 #38 [hci1] 0.978986
      LE Set Random Address (0x08|0x0005) ncmd 1
        Status: Success (0x00)
< HCI Command: LE Extended Create... (0x08|0x0043) plen 26  #39 [hci1] 3.158448
        Filter policy: Accept list is not used (0x00)
        Own address type: Random (0x01)
        Peer address type: Public (0x00)
        Peer address: DF:A9:FF:F6:B1:1A (OUI DF-A9-FF)
        Initiating PHYs: 0x01
        Entry 0: LE 1M
          Scan interval: 60.000 msec (0x0060)
          Scan window: 60.000 msec (0x0060)
          Min connection interval: 30.00 msec (0x0018)
          Max connection interval: 50.00 msec (0x0028)
          Connection latency: 0 (0x0000)
          Supervision timeout: 4000 msec (0x0190)
          Min connection length: 0.000 msec (0x0000)
          Max connection length: 0.000 msec (0x0000)
> HCI Event: Command Status (0x0f) plen 4                   #40 [hci1] 3.159327
      LE Extended Create Connection (0x08|0x0043) ncmd 1
        Status: Success (0x00)
> HCI Event: LE Meta Event (0x3e) plen 31                   #41 [hci1] 3.248225
      LE Enhanced Connection Complete (0x0a)
        Status: Success (0x00)
        Handle: 1332
        Role: Central (0x00)
        Peer address type: Public (0x00)
        Peer address: DF:A9:FF:F6:B1:1A (OUI DF-A9-FF)
        Local resolvable private address: 00:00:00:00:00:00 (Non-Resolvable)
        Peer resolvable private address: 00:00:00:00:00:00 (Non-Resolvable)
        Connection interval: 50.00 msec (0x0028)
        Connection latency: 0 (0x0000)
        Supervision timeout: 4000 msec (0x0190)
        Central clock accuracy: 0x00
< HCI Command: LE Read Remote Used... (0x08|0x0016) plen 2  #42 [hci1] 3.258688
        Handle: 1332 Address: DF:A9:FF:F6:B1:1A (OUI DF-A9-FF)
> HCI Event: Command Status (0x0f) plen 4                   #43 [hci1] 3.259189
      LE Read Remote Used Features (0x08|0x0016) ncmd 1
        Status: Success (0x00)
< HCI Command: LE Set PHY (0x08|0x0032) plen 7              #44 [hci1] 3.278548
        Handle: 1332 Address: DF:A9:FF:F6:B1:1A (OUI DF-A9-FF)
        All PHYs preference: 0x00
        TX PHYs preference: 0x02
          LE 2M
        RX PHYs preference: 0x02
          LE 2M
        PHY options preference: Reserved (0x0000)
> HCI Event: Command Status (0x0f) plen 4                   #45 [hci1] 3.279274
      LE Set PHY (0x08|0x0032) ncmd 1
        Status: Success (0x00)
> HCI Event: LE Meta Event (0x3e) plen 12                   #46 [hci1] 3.399654
      LE Read Remote Used Features (0x04)
        Status: Success (0x00)
        Handle: 1332 Address: DF:A9:FF:F6:B1:1A (OUI DF-A9-FF)
        Features: 0x2d 0x49 0x00 0xf7 0x67 0xd9 0x00 0x80
          LE Encryption
          Extended Reject Indication
          Peripheral-initiated Features Exchange
          LE Data Packet Length Extension
          LE 2M PHY
          LE Coded PHY
          Channel Selection Algorithm #2
          Periodic Advertising Sync Transfer - Sender
          Periodic Advertising Sync Transfer - Recipient
          Sleep Clock Accuracy Updates
          Connected Isochronous Stream - Central
          Connected Isochronous Stream - Peripheral
          Isochronous Broadcaster
          Synchronized Receiver
          Connected Isochronous Stream (Host Support)
          LE Power Control Request
          LE Power Control Request
          Connection Subrating
          Connection Subrating (Host Support)
          Unknown features (0x8000d90000000000)
> HCI Event: LE Meta Event (0x3e) plen 6                    #47 [hci1] 3.899080
      LE PHY Update Complete (0x0c)
        Status: Success (0x00)
        Handle: 1332 Address: DF:A9:FF:F6:B1:1A (OUI DF-A9-FF)
        TX PHY: LE 2M (0x02)
        RX PHY: LE 2M (0x02)
< ACL Data TX: Handle 1332 flags 0x00 dlen 11               #48 [hci1] 4.298464
      SMP: Pairing Request (0x01) len 6
        IO capability: KeyboardDisplay (0x04)
        OOB data: Authentication data not present (0x00)
        Authentication requirement: No bonding, No MITM, SC, No Keypresses (0x08)
        Max encryption key size: 16
        Initiator key distribution: <none> (0x00)
        Responder key distribution: <none> (0x00)
> HCI Event: Number of Completed Packets (0x13) plen 5      #49 [hci1] 4.349374
        Num handles: 1
        Handle: 1332 Address: DF:A9:FF:F6:B1:1A (OUI DF-A9-FF)
        Count: 1
        #48: len 11 (1 Kb/s)
        Latency: 50 msec (50-50 msec ~50 msec)
> ACL Data RX: Handle 1332 flags 0x02 dlen 11               #50 [hci1] 4.399448
      SMP: Pairing Response (0x02) len 6
        IO capability: KeyboardOnly (0x02)
        OOB data: Authentication data not present (0x00)
        Authentication requirement: Bonding, MITM, SC, No Keypresses (0xcd)
        Max encryption key size: 16
        Initiator key distribution: <none> (0x00)
        Responder key distribution: <none> (0x00)
< HCI Command: Host Number of Compl.. (0x03|0x0035) plen 5  #51 [hci1] 4.418547
        Num handles: 1
        Handle: 1332 Address: DF:A9:FF:F6:B1:1A (OUI DF-A9-FF)
        Count: 1
< ACL Data TX: Handle 1332 flags 0x00 dlen 27               #52 [hci1] 4.418597
< ACL Data TX: Handle 1332 flags 0x01 dlen 27               #53 [hci1] 4.418601
< ACL Data TX: Handle 1332 flags 0x01 dlen 15               #54 [hci1] 4.418616
      SMP: Pairing Public Key (0x0c) len 64
        X: 98308440221e2d910f0e54b71e7ec652857aa9b5a0dc65028824cc19db1226e9
        Y: 67a4816bcb62efb21701e31fdb27561a6217575fb007a8bbdabe7e28b6f68482
> HCI Event: Number of Completed Packets (0x13) plen 5      #55 [hci1] 4.449427
        Num handles: 1
        Handle: 1332 Address: DF:A9:FF:F6:B1:1A (OUI DF-A9-FF)
        Count: 1
        #52: len 27 (7 Kb/s)
        Latency: 30 msec (30-50 msec ~40 msec)
> HCI Event: Number of Completed Packets (0x13) plen 5      #56 [hci1] 4.450010
        Num handles: 1
        Handle: 1332 Address: DF:A9:FF:F6:B1:1A (OUI DF-A9-FF)
        Count: 1
        #53: len 27 (6 Kb/s)
        Latency: 31 msec (30-50 msec ~36 msec)
> HCI Event: Number of Completed Packets (0x13) plen 5      #57 [hci1] 4.450510
        Num handles: 1
        Handle: 1332 Address: DF:A9:FF:F6:B1:1A (OUI DF-A9-FF)
        Count: 1
        #54: len 15 (3 Kb/s)
        Latency: 31 msec (30-50 msec ~34 msec)
> ACL Data RX: Handle 1332 flags 0x02 dlen 27               #58 [hci1] 4.499745
> ACL Data RX: Handle 1332 flags 0x01 dlen 27               #59 [hci1] 4.500206
> ACL Data RX: Handle 1332 flags 0x01 dlen 15               #60 [hci1] 4.500605
      SMP: Pairing Public Key (0x0c) len 64
        X: 3f74acbac666e2b36dd064a53a109e6fe83d357ee0d7049b3250da58e7a4459f
        Y: feca7ba4ab58744765651b2dffbc51efbecda5bbb8599815378822fdb39c5f15
< HCI Command: Host Number of Compl.. (0x03|0x0035) plen 5  #61 [hci1] 4.518535
        Num handles: 1
        Handle: 1332 Address: DF:A9:FF:F6:B1:1A (OUI DF-A9-FF)
        Count: 1
< HCI Command: Host Number of Compl.. (0x03|0x0035) plen 5  #62 [hci1] 4.518645
        Num handles: 1
        Handle: 1332 Address: DF:A9:FF:F6:B1:1A (OUI DF-A9-FF)
        Count: 1
< HCI Command: Host Number of Compl.. (0x03|0x0035) plen 5  #63 [hci1] 4.518809
        Num handles: 1
        Handle: 1332 Address: DF:A9:FF:F6:B1:1A (OUI DF-A9-FF)
        Count: 1
< ACL Data TX: Handle 1332 flags 0x00 dlen 21               #64 [hci1] 4.518823
      SMP: Pairing Confirm (0x03) len 16
        Confim value: 1636e4d4cb5cdd876998a3824f51bbae
> HCI Event: Number of Completed Packets (0x13) plen 5      #65 [hci1] 4.549454
        Num handles: 1
        Handle: 1332 Address: DF:A9:FF:F6:B1:1A (OUI DF-A9-FF)
        Count: 1
        #64: len 21 (5 Kb/s)
        Latency: 30 msec (30-50 msec ~32 msec)
> ACL Data RX: Handle 1332 flags 0x02 dlen 21               #66 [hci1] 5.349538
      SMP: Pairing Confirm (0x03) len 16
        Confim value: 43a272d325fdadba51206b2c9453f3fc
< HCI Command: Host Number of Compl.. (0x03|0x0035) plen 5  #67 [hci1] 5.358551
        Num handles: 1
        Handle: 1332 Address: DF:A9:FF:F6:B1:1A (OUI DF-A9-FF)
        Count: 1
< ACL Data TX: Handle 1332 flags 0x00 dlen 21               #68 [hci1] 5.358561
      SMP: Pairing Random (0x04) len 16
        Random value: 8e6108f966a694cbe26df70bb96773e6
> HCI Event: Number of Completed Packets (0x13) plen 5      #69 [hci1] 5.399353
        Num handles: 1
        Handle: 1332 Address: DF:A9:FF:F6:B1:1A (OUI DF-A9-FF)
        Count: 1
        #68: len 21 (4 Kb/s)
        Latency: 40 msec (30-50 msec ~36 msec)
> ACL Data RX: Handle 1332 flags 0x02 dlen 21               #70 [hci1] 5.599751
      SMP: Pairing Random (0x04) len 16
        Random value: 530503ed3ec1031cf7a253bd4e3cc2f0
< HCI Command: Host Number of Compl.. (0x03|0x0035) plen 5  #71 [hci1] 5.618559
        Num handles: 1
        Handle: 1332 Address: DF:A9:FF:F6:B1:1A (OUI DF-A9-FF)
        Count: 1
< ACL Data TX: Handle 1332 flags 0x00 dlen 21               #72 [hci1] 5.618599
      SMP: Pairing Confirm (0x03) len 16
        Confim value: 8178736d7fb6517ed3b2cdcad83f877a
> HCI Event: Number of Completed Packets (0x13) plen 5      #73 [hci1] 5.649358
        Num handles: 1
        Handle: 1332 Address: DF:A9:FF:F6:B1:1A (OUI DF-A9-FF)
        Count: 1
        #72: len 21 (5 Kb/s)
        Latency: 30 msec (30-50 msec ~33 msec)
> ACL Data RX: Handle 1332 flags 0x02 dlen 21               #74 [hci1] 5.699670
      SMP: Pairing Confirm (0x03) len 16
        Confim value: 4c137991658b25e2e8f09936bda42010
< HCI Command: Host Number of Compl.. (0x03|0x0035) plen 5  #75 [hci1] 5.718614
        Num handles: 1
        Handle: 1332 Address: DF:A9:FF:F6:B1:1A (OUI DF-A9-FF)
        Count: 1
< ACL Data TX: Handle 1332 flags 0x00 dlen 21               #76 [hci1] 5.718722
      SMP: Pairing Random (0x04) len 16
        Random value: 4d02679f89a05211af56d8b3da64d21e
> HCI Event: Number of Completed Packets (0x13) plen 5      #77 [hci1] 5.749498
        Num handles: 1
        Handle: 1332 Address: DF:A9:FF:F6:B1:1A (OUI DF-A9-FF)
        Count: 1
        #76: len 21 (5 Kb/s)
        Latency: 30 msec (30-50 msec ~32 msec)
> ACL Data RX: Handle 1332 flags 0x02 dlen 21               #78 [hci1] 5.999746
      SMP: Pairing Random (0x04) len 16
        Random value: c3b4b9e734deac8a1e7fac3b47695d91
< HCI Command: Host Number of Compl.. (0x03|0x0035) plen 5  #79 [hci1] 6.018367
        Num handles: 1
        Handle: 1332 Address: DF:A9:FF:F6:B1:1A (OUI DF-A9-FF)
        Count: 1
< ACL Data TX: Handle 1332 flags 0x00 dlen 21               #80 [hci1] 6.018460
      SMP: Pairing Confirm (0x03) len 16
        Confim value: 8a7a1648f7ead2e85f3efc2169635fc2
> HCI Event: Number of Completed Packets (0x13) plen 5      #81 [hci1] 6.049400
        Num handles: 1
        Handle: 1332 Address: DF:A9:FF:F6:B1:1A (OUI DF-A9-FF)
        Count: 1
        #80: len 21 (5 Kb/s)
        Latency: 30 msec (30-50 msec ~31 msec)
> ACL Data RX: Handle 1332 flags 0x02 dlen 21               #82 [hci1] 6.099731
      SMP: Pairing Confirm (0x03) len 16
        Confim value: e3e10d4ea652c038be1b035ab32ea43e
< HCI Command: Host Number of Compl.. (0x03|0x0035) plen 5  #83 [hci1] 6.118806
        Num handles: 1
        Handle: 1332 Address: DF:A9:FF:F6:B1:1A (OUI DF-A9-FF)
        Count: 1
< ACL Data TX: Handle 1332 flags 0x00 dlen 21               #84 [hci1] 6.118982
      SMP: Pairing Random (0x04) len 16
        Random value: 5e8286bc235a02440d0c3424a2acf8fd
> HCI Event: Number of Completed Packets (0x13) plen 5      #85 [hci1] 6.149414
        Num handles: 1
        Handle: 1332 Address: DF:A9:FF:F6:B1:1A (OUI DF-A9-FF)
        Count: 1
        #84: len 21 (5 Kb/s)
        Latency: 30 msec (30-50 msec ~31 msec)
> ACL Data RX: Handle 1332 flags 0x02 dlen 21               #86 [hci1] 6.399690
      SMP: Pairing Random (0x04) len 16
        Random value: 5f4be63e79133c3cfc42b19dd6ad2fc1
< HCI Command: Host Number of Compl.. (0x03|0x0035) plen 5  #87 [hci1] 6.418967
        Num handles: 1
        Handle: 1332 Address: DF:A9:FF:F6:B1:1A (OUI DF-A9-FF)
        Count: 1
< ACL Data TX: Handle 1332 flags 0x00 dlen 21               #88 [hci1] 6.419089
      SMP: Pairing Confirm (0x03) len 16
        Confim value: 8c092dbcfbde1bd27df6286179923704
> HCI Event: Number of Completed Packets (0x13) plen 5      #89 [hci1] 6.449420
        Num handles: 1
        Handle: 1332 Address: DF:A9:FF:F6:B1:1A (OUI DF-A9-FF)
        Count: 1
        #88: len 21 (5 Kb/s)
        Latency: 30 msec (30-50 msec ~30 msec)
> ACL Data RX: Handle 1332 flags 0x02 dlen 21               #90 [hci1] 6.499675
      SMP: Pairing Confirm (0x03) len 16
        Confim value: c2fc8d6ce4ddeccb0bd555182993dea7
< HCI Command: Host Number of Compl.. (0x03|0x0035) plen 5  #91 [hci1] 6.518629
        Num handles: 1
        Handle: 1332 Address: DF:A9:FF:F6:B1:1A (OUI DF-A9-FF)
        Count: 1
< ACL Data TX: Handle 1332 flags 0x00 dlen 21               #92 [hci1] 6.518685
      SMP: Pairing Random (0x04) len 16
        Random value: 5c4a1bcadd27bd58e945097b00bad7ac
> HCI Event: Number of Completed Packets (0x13) plen 5      #93 [hci1] 6.549407
        Num handles: 1
        Handle: 1332 Address: DF:A9:FF:F6:B1:1A (OUI DF-A9-FF)
        Count: 1
        #92: len 21 (5 Kb/s)
        Latency: 30 msec (30-50 msec ~30 msec)
> ACL Data RX: Handle 1332 flags 0x02 dlen 21               #94 [hci1] 6.799623
      SMP: Pairing Random (0x04) len 16
        Random value: 7fdf90ef7f00e638ba9bc52651ac2613
< HCI Command: Host Number of Compl.. (0x03|0x0035) plen 5  #95 [hci1] 6.818591
        Num handles: 1
        Handle: 1332 Address: DF:A9:FF:F6:B1:1A (OUI DF-A9-FF)
        Count: 1
< ACL Data TX: Handle 1332 flags 0x00 dlen 21               #96 [hci1] 6.818636
      SMP: Pairing Confirm (0x03) len 16
        Confim value: 1d476329c6abfaeccdeed1294e466eea
> HCI Event: Number of Completed Packets (0x13) plen 5      #97 [hci1] 6.849463
        Num handles: 1
        Handle: 1332 Address: DF:A9:FF:F6:B1:1A (OUI DF-A9-FF)
        Count: 1
        #96: len 21 (5 Kb/s)
        Latency: 30 msec (30-50 msec ~30 msec)
> ACL Data RX: Handle 1332 flags 0x02 dlen 21               #98 [hci1] 6.899674
      SMP: Pairing Confirm (0x03) len 16
        Confim value: c90debce7e86e938a5000191933f869c
< HCI Command: Host Number of Compl.. (0x03|0x0035) plen 5  #99 [hci1] 6.918479
        Num handles: 1
        Handle: 1332 Address: DF:A9:FF:F6:B1:1A (OUI DF-A9-FF)
        Count: 1
< ACL Data TX: Handle 1332 flags 0x00 dlen 21              #100 [hci1] 6.918519
      SMP: Pairing Random (0x04) len 16
        Random value: 32527e6e64e79f33b2e374394db8ab2d
> HCI Event: Number of Completed Packets (0x13) plen 5     #101 [hci1] 6.949670
        Num handles: 1
        Handle: 1332 Address: DF:A9:FF:F6:B1:1A (OUI DF-A9-FF)
        Count: 1
        #100: len 21 (5 Kb/s)
        Latency: 31 msec (30-50 msec ~30 msec)
> ACL Data RX: Handle 1332 flags 0x02 dlen 21              #102 [hci1] 7.199853
      SMP: Pairing Random (0x04) len 16
        Random value: b359d7e99cc0a73f19e652e67584b0c6
< HCI Command: Host Number of Comp.. (0x03|0x0035) plen 5  #103 [hci1] 7.218961
        Num handles: 1
        Handle: 1332 Address: DF:A9:FF:F6:B1:1A (OUI DF-A9-FF)
        Count: 1
< ACL Data TX: Handle 1332 flags 0x00 dlen 21              #104 [hci1] 7.219056
      SMP: Pairing Confirm (0x03) len 16
        Confim value: db944bfe8c5c7c3ea544d1061fb5662f
> HCI Event: Number of Completed Packets (0x13) plen 5     #105 [hci1] 7.249543
        Num handles: 1
        Handle: 1332 Address: DF:A9:FF:F6:B1:1A (OUI DF-A9-FF)
        Count: 1
        #104: len 21 (5 Kb/s)
        Latency: 30 msec (30-50 msec ~30 msec)
> ACL Data RX: Handle 1332 flags 0x02 dlen 21              #106 [hci1] 7.299625
      SMP: Pairing Confirm (0x03) len 16
        Confim value: b43e407b92154ccd43de6b6087f68729
< HCI Command: Host Number of Comp.. (0x03|0x0035) plen 5  #107 [hci1] 7.318604
        Num handles: 1
        Handle: 1332 Address: DF:A9:FF:F6:B1:1A (OUI DF-A9-FF)
        Count: 1
< ACL Data TX: Handle 1332 flags 0x00 dlen 21              #108 [hci1] 7.318659
      SMP: Pairing Random (0x04) len 16
        Random value: dddbdfe2838e9a8cc6964353c850fef7
> HCI Event: Number of Completed Packets (0x13) plen 5     #109 [hci1] 7.349469
        Num handles: 1
        Handle: 1332 Address: DF:A9:FF:F6:B1:1A (OUI DF-A9-FF)
        Count: 1
        #108: len 21 (5 Kb/s)
        Latency: 30 msec (30-50 msec ~30 msec)
> ACL Data RX: Handle 1332 flags 0x02 dlen 21              #110 [hci1] 7.599523
      SMP: Pairing Random (0x04) len 16
        Random value: cc5955ac5f560ad8ca1d677de7fca634
< HCI Command: Host Number of Comp.. (0x03|0x0035) plen 5  #111 [hci1] 7.619029
        Num handles: 1
        Handle: 1332 Address: DF:A9:FF:F6:B1:1A (OUI DF-A9-FF)
        Count: 1
< ACL Data TX: Handle 1332 flags 0x00 dlen 21              #112 [hci1] 7.619130
      SMP: Pairing Confirm (0x03) len 16
        Confim value: f72c4771819e12739ea91918cdda2635
> HCI Event: Number of Completed Packets (0x13) plen 5     #113 [hci1] 7.649420
        Num handles: 1
        Handle: 1332 Address: DF:A9:FF:F6:B1:1A (OUI DF-A9-FF)
        Count: 1
        #112: len 21 (5 Kb/s)
        Latency: 30 msec (30-50 msec ~30 msec)
> ACL Data RX: Handle 1332 flags 0x02 dlen 21              #114 [hci1] 7.699526
      SMP: Pairing Confirm (0x03) len 16
        Confim value: 491ca9e1d6e68a73eb2f8752511b1d8c
< HCI Command: Host Number of Comp.. (0x03|0x0035) plen 5  #115 [hci1] 7.718815
        Num handles: 1
        Handle: 1332 Address: DF:A9:FF:F6:B1:1A (OUI DF-A9-FF)
        Count: 1
< ACL Data TX: Handle 1332 flags 0x00 dlen 21              #116 [hci1] 7.719434
      SMP: Pairing Random (0x04) len 16
        Random value: eb9f1915536596b6fc3db1c86b2b1970
> HCI Event: Number of Completed Packets (0x13) plen 5     #117 [hci1] 7.749458
        Num handles: 1
        Handle: 1332 Address: DF:A9:FF:F6:B1:1A (OUI DF-A9-FF)
        Count: 1
        #116: len 21 (5 Kb/s)
        Latency: 30 msec (30-50 msec ~30 msec)
> ACL Data RX: Handle 1332 flags 0x02 dlen 21              #118 [hci1] 7.999579
      SMP: Pairing Random (0x04) len 16
        Random value: 78be2c98b332e90d681e6a19a8968887
< HCI Command: Host Number of Comp.. (0x03|0x0035) plen 5  #119 [hci1] 8.020549
        Num handles: 1
        Handle: 1332 Address: DF:A9:FF:F6:B1:1A (OUI DF-A9-FF)
        Count: 1
< ACL Data TX: Handle 1332 flags 0x00 dlen 21              #120 [hci1] 8.020790
      SMP: Pairing Confirm (0x03) len 16
        Confim value: 2f45dee24667c340cc69e3ceb78b8af7
> HCI Event: Number of Completed Packets (0x13) plen 5     #121 [hci1] 8.049352
        Num handles: 1
        Handle: 1332 Address: DF:A9:FF:F6:B1:1A (OUI DF-A9-FF)
        Count: 1
        #120: len 21 (6 Kb/s)
        Latency: 28 msec (28-50 msec ~29 msec)
> ACL Data RX: Handle 1332 flags 0x02 dlen 21              #122 [hci1] 8.099666
      SMP: Pairing Confirm (0x03) len 16
        Confim value: 64b27cbb77856d9caa7170f9ed93b441
< HCI Command: Host Number of Comp.. (0x03|0x0035) plen 5  #123 [hci1] 8.118466
        Num handles: 1
        Handle: 1332 Address: DF:A9:FF:F6:B1:1A (OUI DF-A9-FF)
        Count: 1
< ACL Data TX: Handle 1332 flags 0x00 dlen 21              #124 [hci1] 8.118475
      SMP: Pairing Random (0x04) len 16
        Random value: 5c794dc9ad9f2c3f295ebd5ad5e1c3cf
> HCI Event: Number of Completed Packets (0x13) plen 5     #125 [hci1] 8.149386
        Num handles: 1
        Handle: 1332 Address: DF:A9:FF:F6:B1:1A (OUI DF-A9-FF)
        Count: 1
        #124: len 21 (5 Kb/s)
        Latency: 30 msec (28-50 msec ~30 msec)
> ACL Data RX: Handle 1332 flags 0x02 dlen 21              #126 [hci1] 8.349590
      SMP: Pairing Random (0x04) len 16
        Random value: 6d90bbb3a3391ebd50639ee12a38f70d
< HCI Command: Host Number of Comp.. (0x03|0x0035) plen 5  #127 [hci1] 8.358417
        Num handles: 1
        Handle: 1332 Address: DF:A9:FF:F6:B1:1A (OUI DF-A9-FF)
        Count: 1
< ACL Data TX: Handle 1332 flags 0x00 dlen 21              #128 [hci1] 8.358497
      SMP: Pairing Confirm (0x03) len 16
        Confim value: 51e1fda82a82c9a8b4762f3db6874a32
> HCI Event: Number of Completed Packets (0x13) plen 5     #129 [hci1] 8.399347
        Num handles: 1
        Handle: 1332 Address: DF:A9:FF:F6:B1:1A (OUI DF-A9-FF)
        Count: 1
        #128: len 21 (4 Kb/s)
        Latency: 40 msec (28-50 msec ~35 msec)
> ACL Data RX: Handle 1332 flags 0x02 dlen 21              #130 [hci1] 8.449552
      SMP: Pairing Confirm (0x03) len 16
        Confim value: 2fe7ea944b077c7da8fca42c5e5d8ec4
< HCI Command: Host Number of Comp.. (0x03|0x0035) plen 5  #131 [hci1] 8.458598
        Num handles: 1
        Handle: 1332 Address: DF:A9:FF:F6:B1:1A (OUI DF-A9-FF)
        Count: 1
< ACL Data TX: Handle 1332 flags 0x00 dlen 21              #132 [hci1] 8.458630
      SMP: Pairing Random (0x04) len 16
        Random value: 5c2fff312cdf99c9491988e877355a9a
> HCI Event: Number of Completed Packets (0x13) plen 5     #133 [hci1] 8.499363
        Num handles: 1
        Handle: 1332 Address: DF:A9:FF:F6:B1:1A (OUI DF-A9-FF)
        Count: 1
        #132: len 21 (4 Kb/s)
        Latency: 40 msec (28-50 msec ~38 msec)
> ACL Data RX: Handle 1332 flags 0x02 dlen 21              #134 [hci1] 8.749508
      SMP: Pairing Random (0x04) len 16
        Random value: 3a67bbbb477b52c0ffdeb30e0d9c2ab9
< HCI Command: Host Number of Comp.. (0x03|0x0035) plen 5  #135 [hci1] 8.759059
        Num handles: 1
        Handle: 1332 Address: DF:A9:FF:F6:B1:1A (OUI DF-A9-FF)
        Count: 1
< ACL Data TX: Handle 1332 flags 0x00 dlen 21              #136 [hci1] 8.759145
      SMP: Pairing Confirm (0x03) len 16
        Confim value: 6bf508766b001b8cb7e4cf86f58aa85e
> HCI Event: Number of Completed Packets (0x13) plen 5     #137 [hci1] 8.799363
        Num handles: 1
        Handle: 1332 Address: DF:A9:FF:F6:B1:1A (OUI DF-A9-FF)
        Count: 1
        #136: len 21 (4 Kb/s)
        Latency: 40 msec (28-50 msec ~39 msec)
> ACL Data RX: Handle 1332 flags 0x02 dlen 21              #138 [hci1] 8.849644
      SMP: Pairing Confirm (0x03) len 16
        Confim value: 30a74676acc5374397dae03984082825
< HCI Command: Host Number of Comp.. (0x03|0x0035) plen 5  #139 [hci1] 8.858609
        Num handles: 1
        Handle: 1332 Address: DF:A9:FF:F6:B1:1A (OUI DF-A9-FF)
        Count: 1
< ACL Data TX: Handle 1332 flags 0x00 dlen 21              #140 [hci1] 8.858642
      SMP: Pairing Random (0x04) len 16
        Random value: c629a3a987d808e808655d558dfc1155
> HCI Event: Number of Completed Packets (0x13) plen 5     #141 [hci1] 8.899448
        Num handles: 1
        Handle: 1332 Address: DF:A9:FF:F6:B1:1A (OUI DF-A9-FF)
        Count: 1
        #140: len 21 (4 Kb/s)
        Latency: 40 msec (28-50 msec ~39 msec)
> ACL Data RX: Handle 1332 flags 0x02 dlen 21              #142 [hci1] 9.149590
      SMP: Pairing Random (0x04) len 16
        Random value: e64b732fa6083da64bc78176b3c4f0b6
< HCI Command: Host Number of Comp.. (0x03|0x0035) plen 5  #143 [hci1] 9.159135
        Num handles: 1
        Handle: 1332 Address: DF:A9:FF:F6:B1:1A (OUI DF-A9-FF)
        Count: 1
< ACL Data TX: Handle 1332 flags 0x00 dlen 21              #144 [hci1] 9.159258
      SMP: Pairing Confirm (0x03) len 16
        Confim value: a7a255b301a89eb411ca41c890f146b2
> HCI Event: Number of Completed Packets (0x13) plen 5     #145 [hci1] 9.199369
        Num handles: 1
        Handle: 1332 Address: DF:A9:FF:F6:B1:1A (OUI DF-A9-FF)
        Count: 1
        #144: len 21 (4 Kb/s)
        Latency: 40 msec (28-50 msec ~40 msec)
> ACL Data RX: Handle 1332 flags 0x02 dlen 21              #146 [hci1] 9.249540
      SMP: Pairing Confirm (0x03) len 16
        Confim value: 9bc693730506b88eb0173dc69ee754fb
< HCI Command: Host Number of Comp.. (0x03|0x0035) plen 5  #147 [hci1] 9.258960
        Num handles: 1
        Handle: 1332 Address: DF:A9:FF:F6:B1:1A (OUI DF-A9-FF)
        Count: 1
< ACL Data TX: Handle 1332 flags 0x00 dlen 21              #148 [hci1] 9.259072
      SMP: Pairing Random (0x04) len 16
        Random value: 92f20f6ad8f13724432c7fd6001c45ff
> HCI Event: Number of Completed Packets (0x13) plen 5     #149 [hci1] 9.299419
        Num handles: 1
        Handle: 1332 Address: DF:A9:FF:F6:B1:1A (OUI DF-A9-FF)
        Count: 1
        #148: len 21 (4 Kb/s)
        Latency: 40 msec (28-50 msec ~40 msec)
> ACL Data RX: Handle 1332 flags 0x02 dlen 21              #150 [hci1] 9.549508
      SMP: Pairing Random (0x04) len 16
        Random value: 89c78aa43388494bd7afa90bd2a2e87d
< HCI Command: Host Number of Comp.. (0x03|0x0035) plen 5  #151 [hci1] 9.558660
        Num handles: 1
        Handle: 1332 Address: DF:A9:FF:F6:B1:1A (OUI DF-A9-FF)
        Count: 1
< ACL Data TX: Handle 1332 flags 0x00 dlen 21              #152 [hci1] 9.558763
      SMP: Pairing Confirm (0x03) len 16
        Confim value: bae5dbfc4f54bec21d2c0f1b3d49a425
> HCI Event: Number of Completed Packets (0x13) plen 5     #153 [hci1] 9.599524
        Num handles: 1
        Handle: 1332 Address: DF:A9:FF:F6:B1:1A (OUI DF-A9-FF)
        Count: 1
        #152: len 21 (4 Kb/s)
        Latency: 40 msec (28-50 msec ~40 msec)
> ACL Data RX: Handle 1332 flags 0x02 dlen 21              #154 [hci1] 9.649562
      SMP: Pairing Confirm (0x03) len 16
        Confim value: 8d03719e8cdb65b9d66b20f15a60c7fb
< HCI Command: Host Number of Comp.. (0x03|0x0035) plen 5  #155 [hci1] 9.658614
        Num handles: 1
        Handle: 1332 Address: DF:A9:FF:F6:B1:1A (OUI DF-A9-FF)
        Count: 1
< ACL Data TX: Handle 1332 flags 0x00 dlen 21              #156 [hci1] 9.658662
      SMP: Pairing Random (0x04) len 16
        Random value: 23ac32ebbb5e14c8a6b9622f296d277f
> HCI Event: Number of Completed Packets (0x13) plen 5     #157 [hci1] 9.699439
        Num handles: 1
        Handle: 1332 Address: DF:A9:FF:F6:B1:1A (OUI DF-A9-FF)
        Count: 1
        #156: len 21 (4 Kb/s)
        Latency: 40 msec (28-50 msec ~40 msec)
> ACL Data RX: Handle 1332 flags 0x02 dlen 21              #158 [hci1] 9.949482
      SMP: Pairing Random (0x04) len 16
        Random value: f8dd332f86125f2c84181c26dcc4a785
< HCI Command: Host Number of Comp.. (0x03|0x0035) plen 5  #159 [hci1] 9.958881
        Num handles: 1
        Handle: 1332 Address: DF:A9:FF:F6:B1:1A (OUI DF-A9-FF)
        Count: 1
< ACL Data TX: Handle 1332 flags 0x00 dlen 21              #160 [hci1] 9.958962
      SMP: Pairing Confirm (0x03) len 16
        Confim value: 9d634e41092c2bc0b64e94cb5066abb2
> HCI Event: Number of Completed Packets (0x13) plen 5     #161 [hci1] 9.999283
        Num handles: 1
        Handle: 1332 Address: DF:A9:FF:F6:B1:1A (OUI DF-A9-FF)
        Count: 1
        #160: len 21 (4 Kb/s)
        Latency: 40 msec (28-50 msec ~40 msec)
> ACL Data RX: Handle 1332 flags 0x02 dlen 21             #162 [hci1] 10.049522
      SMP: Pairing Confirm (0x03) len 16
        Confim value: 62426fb52fd45ec8342c5e23ee695de8
< HCI Command: Host Number of Com.. (0x03|0x0035) plen 5  #163 [hci1] 10.058641
        Num handles: 1
        Handle: 1332 Address: DF:A9:FF:F6:B1:1A (OUI DF-A9-FF)
        Count: 1
< ACL Data TX: Handle 1332 flags 0x00 dlen 21             #164 [hci1] 10.058692
      SMP: Pairing Random (0x04) len 16
        Random value: 297efe85e67448a15f56bd27e3a3cf1d
> HCI Event: Number of Completed Packets (0x13) plen 5    #165 [hci1] 10.099415
        Num handles: 1
        Handle: 1332 Address: DF:A9:FF:F6:B1:1A (OUI DF-A9-FF)
        Count: 1
        #164: len 21 (4 Kb/s)
        Latency: 40 msec (28-50 msec ~40 msec)
> ACL Data RX: Handle 1332 flags 0x02 dlen 21             #166 [hci1] 10.349441
      SMP: Pairing Random (0x04) len 16
        Random value: eaf213fbc83f52d153ee7f537507ee68
< HCI Command: Host Number of Com.. (0x03|0x0035) plen 5  #167 [hci1] 10.359069
        Num handles: 1
        Handle: 1332 Address: DF:A9:FF:F6:B1:1A (OUI DF-A9-FF)
        Count: 1
< ACL Data TX: Handle 1332 flags 0x00 dlen 21             #168 [hci1] 10.359274
      SMP: Pairing Confirm (0x03) len 16
        Confim value: 7d756ad170653036c479a7184ad5a9bb
> HCI Event: Number of Completed Packets (0x13) plen 5    #169 [hci1] 10.399272
        Num handles: 1
        Handle: 1332 Address: DF:A9:FF:F6:B1:1A (OUI DF-A9-FF)
        Count: 1
        #168: len 21 (4 Kb/s)
        Latency: 39 msec (28-50 msec ~40 msec)
> ACL Data RX: Handle 1332 flags 0x02 dlen 21             #170 [hci1] 10.449414
      SMP: Pairing Confirm (0x03) len 16
        Confim value: 0f6e85abb32058009c96f06e10897e4d
< HCI Command: Host Number of Com.. (0x03|0x0035) plen 5  #171 [hci1] 10.458647
        Num handles: 1
        Handle: 1332 Address: DF:A9:FF:F6:B1:1A (OUI DF-A9-FF)
        Count: 1
< ACL Data TX: Handle 1332 flags 0x00 dlen 21             #172 [hci1] 10.458683
      SMP: Pairing Random (0x04) len 16
        Random value: 25a9493fd3ce4faf02be7293595bb7c6
> HCI Event: Number of Completed Packets (0x13) plen 5    #173 [hci1] 10.499295
        Num handles: 1
        Handle: 1332 Address: DF:A9:FF:F6:B1:1A (OUI DF-A9-FF)
        Count: 1
        #172: len 21 (4 Kb/s)
        Latency: 40 msec (28-50 msec ~40 msec)
> ACL Data RX: Handle 1332 flags 0x02 dlen 21             #174 [hci1] 10.749611
      SMP: Pairing Random (0x04) len 16
        Random value: e5cd3ec8ee9d9080e20ca9f08cf831e2
< HCI Command: Host Number of Com.. (0x03|0x0035) plen 5  #175 [hci1] 10.759013
        Num handles: 1
        Handle: 1332 Address: DF:A9:FF:F6:B1:1A (OUI DF-A9-FF)
        Count: 1
< ACL Data TX: Handle 1332 flags 0x00 dlen 21             #176 [hci1] 10.759169
      SMP: Pairing Confirm (0x03) len 16
        Confim value: 46c0352de71ed3540831b78cc98ddd7b
> HCI Event: Number of Completed Packets (0x13) plen 5    #177 [hci1] 10.799262
        Num handles: 1
        Handle: 1332 Address: DF:A9:FF:F6:B1:1A (OUI DF-A9-FF)
        Count: 1
        #176: len 21 (4 Kb/s)
        Latency: 40 msec (28-50 msec ~40 msec)
> ACL Data RX: Handle 1332 flags 0x02 dlen 21             #178 [hci1] 10.849682
      SMP: Pairing Confirm (0x03) len 16
        Confim value: 137071997885898057fa10f015e60f59
< HCI Command: Host Number of Com.. (0x03|0x0035) plen 5  #179 [hci1] 10.859085
        Num handles: 1
        Handle: 1332 Address: DF:A9:FF:F6:B1:1A (OUI DF-A9-FF)
        Count: 1
< ACL Data TX: Handle 1332 flags 0x00 dlen 21             #180 [hci1] 10.859184
      SMP: Pairing Random (0x04) len 16
        Random value: 58f6b41f855a6f6c3560debd84e2affc
> HCI Event: Number of Completed Packets (0x13) plen 5    #181 [hci1] 10.899282
        Num handles: 1
        Handle: 1332 Address: DF:A9:FF:F6:B1:1A (OUI DF-A9-FF)
        Count: 1
        #180: len 21 (4 Kb/s)
        Latency: 40 msec (28-50 msec ~40 msec)
> ACL Data RX: Handle 1332 flags 0x02 dlen 21             #182 [hci1] 11.099599
      SMP: Pairing Random (0x04) len 16
        Random value: 7ab75c7148919d2d47be1a1aed04ec85
< HCI Command: Host Number of Com.. (0x03|0x0035) plen 5  #183 [hci1] 11.118720
        Num handles: 1
        Handle: 1332 Address: DF:A9:FF:F6:B1:1A (OUI DF-A9-FF)
        Count: 1
< ACL Data TX: Handle 1332 flags 0x00 dlen 21             #184 [hci1] 11.118814
      SMP: Pairing Confirm (0x03) len 16
        Confim value: da39aa4a127ae3c041a4b865a597d209
> HCI Event: Number of Completed Packets (0x13) plen 5    #185 [hci1] 11.149285
        Num handles: 1
        Handle: 1332 Address: DF:A9:FF:F6:B1:1A (OUI DF-A9-FF)
        Count: 1
        #184: len 21 (5 Kb/s)
        Latency: 30 msec (28-50 msec ~35 msec)
> ACL Data RX: Handle 1332 flags 0x02 dlen 21             #186 [hci1] 11.199501
      SMP: Pairing Confirm (0x03) len 16
        Confim value: 9e2296642ceb9cf071c140888a4f3ee7
< HCI Command: Host Number of Com.. (0x03|0x0035) plen 5  #187 [hci1] 11.218943
        Num handles: 1
        Handle: 1332 Address: DF:A9:FF:F6:B1:1A (OUI DF-A9-FF)
        Count: 1
< ACL Data TX: Handle 1332 flags 0x00 dlen 21             #188 [hci1] 11.219024
      SMP: Pairing Random (0x04) len 16
        Random value: b67e7216d5bf664139eda2b542549666
> HCI Event: Number of Completed Packets (0x13) plen 5    #189 [hci1] 11.249415
        Num handles: 1
        Handle: 1332 Address: DF:A9:FF:F6:B1:1A (OUI DF-A9-FF)
        Count: 1
        #188: len 21 (5 Kb/s)
        Latency: 30 msec (28-50 msec ~32 msec)
> ACL Data RX: Handle 1332 flags 0x02 dlen 21             #190 [hci1] 11.499537
      SMP: Pairing Random (0x04) len 16
        Random value: f90274a5ff04087237a8adfd62cf902a
< HCI Command: Host Number of Com.. (0x03|0x0035) plen 5  #191 [hci1] 11.519079
        Num handles: 1
        Handle: 1332 Address: DF:A9:FF:F6:B1:1A (OUI DF-A9-FF)
        Count: 1
< ACL Data TX: Handle 1332 flags 0x00 dlen 21             #192 [hci1] 11.519156
      SMP: Pairing Confirm (0x03) len 16
        Confim value: 883430aa1a253a833e00ec93ffcd8f59
> HCI Event: Number of Completed Packets (0x13) plen 5    #193 [hci1] 11.549317
        Num handles: 1
        Handle: 1332 Address: DF:A9:FF:F6:B1:1A (OUI DF-A9-FF)
        Count: 1
        #192: len 21 (5 Kb/s)
        Latency: 30 msec (28-50 msec ~31 msec)
> ACL Data RX: Handle 1332 flags 0x02 dlen 21             #194 [hci1] 11.599538
      SMP: Pairing Confirm (0x03) len 16
        Confim value: f00e9b019dfc6a898e6a2f81f8b96096
< HCI Command: Host Number of Com.. (0x03|0x0035) plen 5  #195 [hci1] 11.618710
        Num handles: 1
        Handle: 1332 Address: DF:A9:FF:F6:B1:1A (OUI DF-A9-FF)
        Count: 1
< ACL Data TX: Handle 1332 flags 0x00 dlen 21             #196 [hci1] 11.618771
      SMP: Pairing Random (0x04) len 16
        Random value: ed17f76500c95219dd01e09d1e63f87b
> HCI Event: Number of Completed Packets (0x13) plen 5    #197 [hci1] 11.649280
        Num handles: 1
        Handle: 1332 Address: DF:A9:FF:F6:B1:1A (OUI DF-A9-FF)
        Count: 1
        #196: len 21 (5 Kb/s)
        Latency: 30 msec (28-50 msec ~31 msec)
> ACL Data RX: Handle 1332 flags 0x02 dlen 21             #198 [hci1] 11.899407
      SMP: Pairing Random (0x04) len 16
        Random value: 520664923bed620497f04b8d3dd0dd6e
< HCI Command: Host Number of Com.. (0x03|0x0035) plen 5  #199 [hci1] 11.919090
        Num handles: 1
        Handle: 1332 Address: DF:A9:FF:F6:B1:1A (OUI DF-A9-FF)
        Count: 1
< ACL Data TX: Handle 1332 flags 0x00 dlen 21             #200 [hci1] 11.919215
      SMP: Pairing Confirm (0x03) len 16
        Confim value: cb82ffd791a841212a215e352f7ddc0b
> HCI Event: Number of Completed Packets (0x13) plen 5    #201 [hci1] 11.949321
        Num handles: 1
        Handle: 1332 Address: DF:A9:FF:F6:B1:1A (OUI DF-A9-FF)
        Count: 1
        #200: len 21 (5 Kb/s)
        Latency: 30 msec (28-50 msec ~30 msec)
> ACL Data RX: Handle 1332 flags 0x02 dlen 21             #202 [hci1] 11.999388
      SMP: Pairing Confirm (0x03) len 16
        Confim value: 1261b639383366b1b3839badca8050e1
< HCI Command: Host Number of Com.. (0x03|0x0035) plen 5  #203 [hci1] 12.018578
        Num handles: 1
        Handle: 1332 Address: DF:A9:FF:F6:B1:1A (OUI DF-A9-FF)
        Count: 1
< ACL Data TX: Handle 1332 flags 0x00 dlen 21             #204 [hci1] 12.018612
      SMP: Pairing Random (0x04) len 16
        Random value: 81d35d47e1f6006d79c974bd9d9e1ee3
> HCI Event: Number of Completed Packets (0x13) plen 5    #205 [hci1] 12.049236
        Num handles: 1
        Handle: 1332 Address: DF:A9:FF:F6:B1:1A (OUI DF-A9-FF)
        Count: 1
        #204: len 21 (5 Kb/s)
        Latency: 30 msec (28-50 msec ~30 msec)
> ACL Data RX: Handle 1332 flags 0x02 dlen 21             #206 [hci1] 12.299575
      SMP: Pairing Random (0x04) len 16
        Random value: 91d9b5e68692f745f904279d6bd0ffac
< HCI Command: Host Number of Com.. (0x03|0x0035) plen 5  #207 [hci1] 12.319094
        Num handles: 1
        Handle: 1332 Address: DF:A9:FF:F6:B1:1A (OUI DF-A9-FF)
        Count: 1
< ACL Data TX: Handle 1332 flags 0x00 dlen 21             #208 [hci1] 12.319206
      SMP: Pairing Confirm (0x03) len 16
        Confim value: 14db91205e7973c5be0471393514d25a
> HCI Event: Number of Completed Packets (0x13) plen 5    #209 [hci1] 12.349304
        Num handles: 1
        Handle: 1332 Address: DF:A9:FF:F6:B1:1A (OUI DF-A9-FF)
        Count: 1
        #208: len 21 (5 Kb/s)
        Latency: 30 msec (28-50 msec ~30 msec)
> ACL Data RX: Handle 1332 flags 0x02 dlen 21             #210 [hci1] 12.399407
      SMP: Pairing Confirm (0x03) len 16
        Confim value: 12dfd99dd13a5f87b5a791050fe98ae1
< HCI Command: Host Number of Com.. (0x03|0x0035) plen 5  #211 [hci1] 12.418954
        Num handles: 1
        Handle: 1332 Address: DF:A9:FF:F6:B1:1A (OUI DF-A9-FF)
        Count: 1
< ACL Data TX: Handle 1332 flags 0x00 dlen 21             #212 [hci1] 12.419026
      SMP: Pairing Random (0x04) len 16
        Random value: e7f7e0c2476823e41736a7e381bafb7c
> HCI Event: Number of Completed Packets (0x13) plen 5    #213 [hci1] 12.449326
        Num handles: 1
        Handle: 1332 Address: DF:A9:FF:F6:B1:1A (OUI DF-A9-FF)
        Count: 1
        #212: len 21 (5 Kb/s)
        Latency: 30 msec (28-50 msec ~30 msec)
> ACL Data RX: Handle 1332 flags 0x02 dlen 21             #214 [hci1] 12.699456
      SMP: Pairing Random (0x04) len 16
        Random value: 3b8fe1d2928dd9be1ae5779e0cf5a9ad
< HCI Command: Host Number of Com.. (0x03|0x0035) plen 5  #215 [hci1] 12.718727
        Num handles: 1
        Handle: 1332 Address: DF:A9:FF:F6:B1:1A (OUI DF-A9-FF)
        Count: 1
< ACL Data TX: Handle 1332 flags 0x00 dlen 21             #216 [hci1] 12.718766
      SMP: Pairing Confirm (0x03) len 16
        Confim value: 3bd4716ff790031b526b0ab586a3c815
> HCI Event: Number of Completed Packets (0x13) plen 5    #217 [hci1] 12.749284
        Num handles: 1
        Handle: 1332 Address: DF:A9:FF:F6:B1:1A (OUI DF-A9-FF)
        Count: 1
        #216: len 21 (5 Kb/s)
        Latency: 30 msec (28-50 msec ~30 msec)
> ACL Data RX: Handle 1332 flags 0x02 dlen 21             #218 [hci1] 12.799448
      SMP: Pairing Confirm (0x03) len 16
        Confim value: cfc4c8e7d7f7e09832194cabbe600d60
< HCI Command: Host Number of Com.. (0x03|0x0035) plen 5  #219 [hci1] 12.818888
        Num handles: 1
        Handle: 1332 Address: DF:A9:FF:F6:B1:1A (OUI DF-A9-FF)
        Count: 1
< ACL Data TX: Handle 1332 flags 0x00 dlen 21             #220 [hci1] 12.818966
      SMP: Pairing Random (0x04) len 16
        Random value: fc8b40d9b0b09bc4296bf8753a8f6e1f
> HCI Event: Number of Completed Packets (0x13) plen 5    #221 [hci1] 12.849289
        Num handles: 1
        Handle: 1332 Address: DF:A9:FF:F6:B1:1A (OUI DF-A9-FF)
        Count: 1
        #220: len 21 (5 Kb/s)
        Latency: 30 msec (28-50 msec ~30 msec)
> ACL Data RX: Handle 1332 flags 0x02 dlen 21             #222 [hci1] 13.099374
      SMP: Pairing Random (0x04) len 16
        Random value: c6171c5c032d5855d497e0726454bb52
< HCI Command: Host Number of Com.. (0x03|0x0035) plen 5  #223 [hci1] 13.119254
        Num handles: 1
        Handle: 1332 Address: DF:A9:FF:F6:B1:1A (OUI DF-A9-FF)
        Count: 1
< ACL Data TX: Handle 1332 flags 0x00 dlen 21             #224 [hci1] 13.119320
      SMP: Pairing DHKey Check (0x0d) len 16
        E: 72f9b964eaa9a2e1c7f23cf6b9a46a3e
> HCI Event: Number of Completed Packets (0x13) plen 5    #225 [hci1] 13.149273
        Num handles: 1
        Handle: 1332 Address: DF:A9:FF:F6:B1:1A (OUI DF-A9-FF)
        Count: 1
        #224: len 21 (5 Kb/s)
        Latency: 29 msec (28-50 msec ~30 msec)
> ACL Data RX: Handle 1332 flags 0x02 dlen 21             #226 [hci1] 13.199392
      SMP: Pairing DHKey Check (0x0d) len 16
        E: 4dcc33f82217faaaf91f72abac66d485
< HCI Command: LE Start Encryption (0x08|0x0019) plen 28  #227 [hci1] 13.218600
        Handle: 1332 Address: DF:A9:FF:F6:B1:1A (OUI DF-A9-FF)
        Random number: 0x0000000000000000
        Encrypted diversifier: 0x0000
        Long term key: 7cf07b40d614b7d1d094dc9c67b80f3f
> HCI Event: Command Status (0x0f) plen 4                 #228 [hci1] 13.219529
      LE Start Encryption (0x08|0x0019) ncmd 1
        Status: Success (0x00)
< HCI Command: Host Number of Com.. (0x03|0x0035) plen 5  #229 [hci1] 13.238514
        Num handles: 1
        Handle: 1332 Address: DF:A9:FF:F6:B1:1A (OUI DF-A9-FF)
        Count: 1
> HCI Event: Encryption Change (0x08) plen 4              #230 [hci1] 13.549199
        Status: Success (0x00)
        Handle: 1332 Address: DF:A9:FF:F6:B1:1A (OUI DF-A9-FF)
        Encryption: Enabled with AES-CCM (0x01)
< HCI Command: Disconnect (0x01|0x0006) plen 3            #231 [hci1] 14.318534
        Handle: 1332 Address: DF:A9:FF:F6:B1:1A (OUI DF-A9-FF)
        Reason: Remote User Terminated Connection (0x13)
> HCI Event: Command Status (0x0f) plen 4                 #232 [hci1] 14.319136
      Disconnect (0x01|0x0006) ncmd 1
        Status: Success (0x00)
> HCI Event: Disconnect Complete (0x05) plen 4            #233 [hci1] 14.399273
        Status: Success (0x00)
        Handle: 1332 Address: DF:A9:FF:F6:B1:1A (OUI DF-A9-FF)
        Reason: Connection Terminated By Local Host (0x16)
< HCI Command: Reset (0x03|0x0003) plen 0                 #234 [hci1] 21.388703
> HCI Event: Command Complete (0x0e) plen 4               #235 [hci1] 21.389250
      Reset (0x03|0x0003) ncmd 1
        Status: Success (0x00)
@ USER Close: main                                    {0x0001} [hci1] 21.398531
= Close Index: 00:00:00:00:00:00                               [hci1] 21.402434
