Bluetooth monitor ver 5.72
= Note: Linux version 6.14.0-36-generic (x86_64)                       0.352578
= Note: Bluetooth subsystem version 2.22                               0.352579
= New Index: 00:00:00:00:00:00 (Primary,UART,hci1)              [hci1] 0.352580
= New Index: 48:5F:99:8E:E0:64 (Primary,USB,hci0)               [hci0] 0.352581
= Open Index: 00:00:00:00:00:00                                 [hci1] 0.466457
= Index Info: 00:00:00:00:00:00 (Nordic Semiconductor ASA)      [hci1] 0.466476
@ USER Open: main (privileged) version 2.22            {0x0001} [hci1] 0.466485
< HCI Command: Reset (0x03|0x0003) plen 0                    #1 [hci1] 0.467638
> HCI Event: Command Complete (0x0e) plen 4                  #2 [hci1] 0.468133
      Reset (0x03|0x0003) ncmd 1
        Status: Success (0x00)
< HCI Command: Read Local Supported... (0x04|0x0003) plen 0  #3 [hci1] 0.486200
> HCI Event: Command Complete (0x0e) plen 12                 #4 [hci1] 0.486727
      Read Local Supported Features (0x04|0x0003) ncmd 1
        Status: Success (0x00)
        Features: 0x00 0x00 0x00 0x00 0x60 0x00 0x00 0x00
          BR/EDR Not Supported
          LE Supported (Controller)
< HCI Command: Read Local Version In.. (0x04|0x0001) plen 0  #5 [hci1] 0.505912
> HCI Event: Command Complete (0x0e) plen 12                 #6 [hci1] 0.506390
      Read Local Version Information (0x04|0x0001) ncmd 1
        Status: Success (0x00)
        HCI version: Reserved (0x0f) - Revision 12393 (0x3069)
        LMP version: Reserved (0x0f) - Subversion 12393 (0x3069)
        Manufacturer: Nordic Semiconductor ASA (89)
< HCI Command: Read Local Supported... (0x04|0x0002) plen 0  #7 [hci1] 0.525840
> HCI Event: Command Complete (0x0e) plen 68                 #8 [hci1] 0.526940
      Read Local Supported Commands (0x04|0x0002) ncmd 1
        Status: Success (0x00)
        Commands: 119 entries
          Disconnect (Octet 0 - Bit 5)
          Read Remote Version Information (Octet 2 - Bit 7)
          Set Event Mask (Octet 5 - Bit 6)
          Reset (Octet 5 - Bit 7)
          Read Connection Accept Timeout (Octet 7 - Bit 2)
          Write Connection Accept Timeout (Octet 7 - Bit 3)
          Read Transmit Power Level (Octet 10 - Bit 2)
          Set Controller To Host Flow Control (Octet 10 - Bit 5)
          Host Buffer Size (Octet 10 - Bit 6)
          Host Number of Completed Packets (Octet 10 - Bit 7)
          Read Local Version Information (Octet 14 - Bit 3)
          Read Local Supported Features (Octet 14 - Bit 5)
          Read BD ADDR (Octet 15 - Bit 1)
          Read RSSI (Octet 15 - Bit 5)
          Set Event Mask Page 2 (Octet 22 - Bit 2)
          LE Set Event Mask (Octet 25 - Bit 0)
          LE Read Buffer Size (Octet 25 - Bit 1)
          LE Read Local Supported Features (Octet 25 - Bit 2)
          LE Set Random Address (Octet 25 - Bit 4)
          LE Set Advertising Parameters (Octet 25 - Bit 5)
          LE Read Advertising Channel TX Power (Octet 25 - Bit 6)
          LE Set Advertising Data (Octet 25 - Bit 7)
          LE Set Scan Response Data (Octet 26 - Bit 0)
          LE Set Advertise Enable (Octet 26 - Bit 1)
          LE Set Scan Parameters (Octet 26 - Bit 2)
          LE Set Scan Enable (Octet 26 - Bit 3)
          LE Create Connection (Octet 26 - Bit 4)
          LE Create Connection Cancel (Octet 26 - Bit 5)
          LE Read Accept List Size (Octet 26 - Bit 6)
          LE Clear Accept List (Octet 26 - Bit 7)
          LE Add Device To Accept List (Octet 27 - Bit 0)
          LE Remove Device From Accept List (Octet 27 - Bit 1)
          LE Connection Update (Octet 27 - Bit 2)
          LE Set Host Channel Classification (Octet 27 - Bit 3)
          LE Read Channel Map (Octet 27 - Bit 4)
          LE Read Remote Used Features (Octet 27 - Bit 5)
          LE Encrypt (Octet 27 - Bit 6)
          LE Rand (Octet 27 - Bit 7)
          LE Start Encryption (Octet 28 - Bit 0)
          LE Long Term Key Request Reply (Octet 28 - Bit 1)
          LE Long Term Key Request Neg Reply (Octet 28 - Bit 2)
          LE Read Supported States (Octet 28 - Bit 3)
          LE Receiver Test (Octet 28 - Bit 4)
          LE Transmitter Test (Octet 28 - Bit 5)
          LE Test End (Octet 28 - Bit 6)
          Read Authenticated Payload Timeout (Octet 32 - Bit 4)
          Write Authenticated Payload Timeout (Octet 32 - Bit 5)
          LE Set Data Length (Octet 33 - Bit 6)
          LE Read Suggested Default Data Length (Octet 33 - Bit 7)
          LE Write Suggested Default Data Length (Octet 34 - Bit 0)
          LE Add Device To Resolving List (Octet 34 - Bit 3)
          LE Remove Device From Resolving List (Octet 34 - Bit 4)
          LE Clear Resolving List (Octet 34 - Bit 5)
          LE Read Resolving List Size (Octet 34 - Bit 6)
          LE Set Address Resolution Enable (Octet 35 - Bit 1)
          LE Set Resolvable Private Address Timeout (Octet 35 - Bit 2)
          LE Read Maximum Data Length (Octet 35 - Bit 3)
          LE Read PHY (Octet 35 - Bit 4)
          LE Set Default PHY (Octet 35 - Bit 5)
          LE Set PHY (Octet 35 - Bit 6)
          LE Enhanced Receiver Test (Octet 35 - Bit 7)
          LE Enhanced Transmitter Test (Octet 36 - Bit 0)
          LE Set Advertising Set Random Address (Octet 36 - Bit 1)
          LE Set Extended Advertising Parameters (Octet 36 - Bit 2)
          LE Set Extended Advertising Data (Octet 36 - Bit 3)
          LE Set Extended Scan Response Data (Octet 36 - Bit 4)
          LE Set Extended Advertising Enable (Octet 36 - Bit 5)
          LE Read Maximum Advertising Data Length (Octet 36 - Bit 6)
          LE Read Number of Supported Advertising Sets (Octet 36 - Bit 7)
          LE Remove Advertising Set (Octet 37 - Bit 0)
          LE Clear Advertising Sets (Octet 37 - Bit 1)
          LE Set Periodic Advertising Parameters (Octet 37 - Bit 2)
          LE Set Periodic Advertising Data (Octet 37 - Bit 3)
          LE Set Periodic Advertising Enable (Octet 37 - Bit 4)
          LE Set Extended Scan Parameters (Octet 37 - Bit 5)
          LE Set Extended Scan Enable (Octet 37 - Bit 6)
          LE Extended Create Connection (Octet 37 - Bit 7)
          LE Periodic Advertising Create Sync (Octet 38 - Bit 0)
          LE Periodic Advertising Create Sync Cancel (Octet 38 - Bit 1)
          LE Periodic Advertising Terminate Sync (Octet 38 - Bit 2)
          LE Add Device To Periodic Advertiser List (Octet 38 - Bit 3)
          LE Remove Device From Periodic Advertiser List (Octet 38 - Bit 4)
          LE Clear Periodic Advertiser List (Octet 38 - Bit 5)
          LE Read Periodic Advertiser List Size (Octet 38 - Bit 6)
          LE Read Transmit Power (Octet 38 - Bit 7)
          LE Read RF Path Compensation (Octet 39 - Bit 0)
          LE Write RF Path Compensation (Octet 39 - Bit 1)
          LE Set Privacy Mode (Octet 39 - Bit 2)
          LE Periodic Advertising Receive Enable (Octet 40 - Bit 5)
          LE Periodic Advertising Sync Transfer (Octet 40 - Bit 6)
          LE Periodic Advertising Set Info Transfer (Octet 40 - Bit 7)
          LE Periodic Advertising Sync Transfer Parameters (Octet 41 - Bit 0)
          LE Set Default Periodic Advertisng Sync Transfer Parameters (Octet 41 - Bit 1)
          LE Read Buffer v2 (Octet 41 - Bit 5)
          LE Read ISO TX Sync (Octet 41 - Bit 6)
          LE Set Connected Isochronous Group Parameters (Octet 41 - Bit 7)
          LE Set Connected Isochronous Group Parameters Test (Octet 42 - Bit 0)
          LE Create Connected Isochronous Stream (Octet 42 - Bit 1)
          LE Remove Connected Isochronous Group (Octet 42 - Bit 2)
          LE Accept Connected Isochronous Stream Request (Octet 42 - Bit 3)
          LE Reject Connected Isochronous Stream Request (Octet 42 - Bit 4)
          LE Create Broadcast Isochronous Group (Octet 42 - Bit 5)
          LE Create Broadcast Isochronous Group Test (Octet 42 - Bit 6)
          LE Terminate Broadcast Isochronous Group (Octet 42 - Bit 7)
          LE Broadcast Isochronous Group Create Sync (Octet 43 - Bit 0)
          LE Broadcast Isochronous Group Terminate Sync (Octet 43 - Bit 1)
          LE Request Peer SCA (Octet 43 - Bit 2)
          LE Setup Isochronous Data Path (Octet 43 - Bit 3)
          LE Remove Isochronous Data Path (Octet 43 - Bit 4)
          LE Isochronous Transmit Test (Octet 43 - Bit 5)
          LE Isochronous Receive Test (Octet 43 - Bit 6)
          LE Isochronous Read Test Counters (Octet 43 - Bit 7)
          LE Isochronous Read Test Counters (Octet 44 - Bit 0)
          LE Set Host Feature (Octet 44 - Bit 1)
          Octet 44 - Bit 2 
          Octet 45 - Bit 6 
          Octet 46 - Bit 0 
          Octet 46 - Bit 1 
          Octet 46 - Bit 2 
< HCI Command: Host Buffer Size (0x03|0x0033) plen 7         #9 [hci1] 0.545814
        ACL MTU: 255  ACL max packet: 16
        SCO MTU: 0    SCO max packet: 0
> HCI Event: Command Complete (0x0e) plen 4                 #10 [hci1] 0.546307
      Host Buffer Size (0x03|0x0033) ncmd 1
        Status: Success (0x00)
< HCI Command: Set Controller To Ho.. (0x03|0x0031) plen 1  #11 [hci1] 0.565809
        Flow control: ACL Data Packets (0x01)
> HCI Event: Command Complete (0x0e) plen 4                 #12 [hci1] 0.566208
      Set Controller To Host Flow Control (0x03|0x0031) ncmd 1
        Status: Success (0x00)
< HCI Command: LE Read Local Suppor.. (0x08|0x0003) plen 0  #13 [hci1] 0.585877
> HCI Event: Command Complete (0x0e) plen 12                #14 [hci1] 0.586318
      LE Read Local Supported Features (0x08|0x0003) ncmd 1
        Status: Success (0x00)
        Features: 0xfd 0x79 0x00 0xf7 0x30 0x01 0x00 0x00
          LE Encryption
          Extended Reject Indication
          Peripheral-initiated Features Exchange
          LE Ping
          LE Data Packet Length Extension
          LL Privacy
          Extended Scanner Filter Policies
          LE 2M PHY
          LE Coded PHY
          LE Extended Advertising
          LE Periodic Advertising
          Channel Selection Algorithm #2
          Periodic Advertising Sync Transfer - Sender
          Periodic Advertising Sync Transfer - Recipient
          Sleep Clock Accuracy Updates
          Connected Isochronous Stream - Central
          Connected Isochronous Stream - Peripheral
          Isochronous Broadcaster
          Synchronized Receiver
          Periodic Advertising ADI support
          Connection Subrating
          Unknown features (0x0000010000000000)
< HCI Command: LE Set Host Feature (0x08|0x0074) plen 2     #15 [hci1] 0.605810
        Bit Number: 32
          Connected Isochronous Stream (Host Support)
        Bit Value: 1
> HCI Event: Command Complete (0x0e) plen 4                 #16 [hci1] 0.606271
      LE Set Host Feature (0x08|0x0074) ncmd 1
        Status: Success (0x00)
< HCI Command: LE Read Buffer v2 (0x08|0x0060) plen 0       #17 [hci1] 0.625814
> HCI Event: Command Complete (0x0e) plen 10                #18 [hci1] 0.626327
      LE Read Buffer v2 (0x08|0x0060) ncmd 1
        Status: Success (0x00)
        ACL MTU: 27
        ACL max packet: 3
        ISO MTU: 318
        ISO max packet: 3
< HCI Command: LE Read Maximum Adve.. (0x08|0x003a) plen 0  #19 [hci1] 0.645885
> HCI Event: Command Complete (0x0e) plen 6                 #20 [hci1] 0.646335
      LE Read Maximum Advertising Data Length (0x08|0x003a) ncmd 1
        Status: Success (0x00)
        Max length: 1650
< HCI Command: LE Read Supported St.. (0x08|0x001c) plen 0  #21 [hci1] 0.665823
> HCI Event: Command Complete (0x0e) plen 12                #22 [hci1] 0.666306
      LE Read Supported States (0x08|0x001c) ncmd 1
        Status: Success (0x00)
        States: 0x000003ff3e0306ff
          Non-connectable Advertising State
          Scannable Advertising State
          Connectable Advertising State
          High Duty Cycle Directed Advertising State
          Passive Scanning State
          Active Scanning State
          Initiating State
            and Connection State (Central Role)
          Connection State (Peripheral Role)
          Scannable Advertising State
            and Passive Scanning State
          Connectable Advertising State
            and Passive Scanning State
          Non-connectable Advertising State
            and Initiating State
          Scannable Advertising State
            and Initiating State
          Active Scanning State
            and Connection State (Central Role)
          Passive Scanning State
            and Connection State (Peripheral Role)
          Active Scanning State
            and Connection State (Peripheral Role)
          Initiating State
            and Connection State (Central Role)
            and Central Role & Central Role
          Low Duty Cycle Directed Advertising State
          Connectable Advertising State
            and Initiating State
            and Central Role & Peripheral Role
          High Duty Cycle Directed Advertising State
            and Initiating State
            and Central Role & Peripheral Role
          Low Duty Cycle Directed Advertising State
            and Initiating State
            and Central Role & Peripheral Role
          Connectable Advertising State
            and Connection State (Central Role)
            and Central Role & Peripheral Role
          High Duty Cycle Directed Advertising State
            and Connection State (Central Role)
            and Central Role & Peripheral Role
          Low Duty Cycle Directed Advertising State
            and Connection State (Central Role)
            and Central Role & Peripheral Role
          Connectable Advertising State
            and Connection State (Peripheral Role)
            and Central Role & Peripheral Role
          High Duty Cycle Directed Advertising State
            and Connection State (Peripheral Role)
            and Peripheral Role & Peripheral Role
          Low Duty Cycle Directed Advertising State
            and Connection State (Peripheral Role)
            and Peripheral Role & Peripheral Role
          Initiating State
            and Connection State (Peripheral Role)
            and Central Role & Peripheral Role
< HCI Command: LE Read Maximum Data.. (0x08|0x002f) plen 0  #23 [hci1] 0.685831
> HCI Event: Command Complete (0x0e) plen 12                #24 [hci1] 0.686290
      LE Read Maximum Data Length (0x08|0x002f) ncmd 1
        Status: Success (0x00)
        Max TX octets: 251
        Max TX time: 2704
        Max RX octets: 251
        Max RX time: 2704
< HCI Command: LE Write Suggested D.. (0x08|0x0024) plen 4  #25 [hci1] 0.705834
        TX octets: 251
        TX time: 2704
> HCI Event: Command Complete (0x0e) plen 4                 #26 [hci1] 0.706322
      LE Write Suggested Default Data Length (0x08|0x0024) ncmd 1
        Status: Success (0x00)
< HCI Command: LE Read Resolving Li.. (0x08|0x002a) plen 0  #27 [hci1] 0.725849
> HCI Event: Command Complete (0x0e) plen 5                 #28 [hci1] 0.726262
      LE Read Resolving List Size (0x08|0x002a) ncmd 1
        Status: Success (0x00)
        Size: 8
< HCI Command: LE Set Event Mask (0x08|0x0001) plen 8       #29 [hci1] 0.745838
        Mask: 0x000002023f87fa5e
          LE Advertising Report
          LE Connection Update Complete
          LE Read Remote Used Features Complete
          LE Long Term Key Request
          LE Data Length Change
          LE Enhanced Connection Complete
          LE PHY Update Complete
          LE Extended Advertising Report
          LE Periodic Advertising Sync Established
          LE Periodic Advertising Report
          LE Periodic Advertising Sync Lost
          LE Extended Scan Timeout
          LE Extended Advertising Set Terminated
          LE Scan Request Received
          LE Periodic Advertising Sync Transfer Rvc
          LE CIS Established
          LE CIS Request
          LE Create BIG Complete
          LE Terminate BIG Complete
          LE BIG Sync Estabilished Complete
          LE BIG Sync Lost
          LE BIG Info Advertising Report
          Unknown mask (0x0000020000000000)
> HCI Event: Command Complete (0x0e) plen 4                 #30 [hci1] 0.746333
      LE Set Event Mask (0x08|0x0001) ncmd 1
        Status: Success (0x00)
< HCI Command: Set Event Mask (0x03|0x0001) plen 8          #31 [hci1] 0.765845
        Mask: 0x2000800002008890
          Disconnection Complete
          Encryption Change
          Read Remote Version Information Complete
          Hardware Error
          Data Buffer Overflow
          Encryption Key Refresh Complete
          LE Meta
> HCI Event: Command Complete (0x0e) plen 4                 #32 [hci1] 0.766363
      Set Event Mask (0x03|0x0001) ncmd 1
        Status: Success (0x00)
< HCI Command: Read BD ADDR (0x04|0x0009) plen 0            #33 [hci1] 0.785838
> HCI Event: Command Complete (0x0e) plen 10                #34 [hci1] 0.786312
      Read BD ADDR (0x04|0x0009) ncmd 1
        Status: Success (0x00)
        Address: 00:00:00:00:00:00 (OUI 00-00-00)
< HCI Command: LE Set Random Address (0x08|0x0005) plen 6   #35 [hci1] 0.805872
        Address: D5:B6:CC:31:DB:3B (Static)
> HCI Event: Command Complete (0x0e) plen 4                 #36 [hci1] 0.806360
      LE Set Random Address (0x08|0x0005) ncmd 1
        Status: Success (0x00)
< HCI Command: LE Set Extended Adv.. (0x08|0x0036) plen 25  #37 [hci1] 3.365920
        Handle: 0x00
        Properties: 0x0013
          Connectable
          Scannable
          Use legacy advertising PDUs: ADV_IND
        Min advertising interval: 100.000 msec (0x00a0)
        Max advertising interval: 150.000 msec (0x00f0)
        Channel map: 37, 38, 39 (0x07)
        Own address type: Random (0x01)
        Peer address type: Public (0x00)
        Peer address: 00:00:00:00:00:00 (OUI 00-00-00)
        Filter policy: Allow Scan Request from Any, Allow Connect Request from Any (0x00)
        TX power: Host has no preference (0x7f)
        Primary PHY: LE 1M (0x01)
        Secondary max skip: 0x00
        Secondary PHY: LE 1M (0x01)
        SID: 0x00
        Scan request notifications: Disabled (0x00)
> HCI Event: Command Complete (0x0e) plen 5                 #38 [hci1] 3.366721
      LE Set Extended Advertising Parameters (0x08|0x0036) ncmd 1
        Status: Success (0x00)
        TX power (selected): 0 dbm (0x00)
< HCI Command: LE Set Advertising S.. (0x08|0x0035) plen 7  #39 [hci1] 3.385918
        Advertising handle: 0x00
        Advertising random address: D5:B6:CC:31:DB:3B (Static)
> HCI Event: Command Complete (0x0e) plen 4                 #40 [hci1] 3.386467
      LE Set Advertising Set Random Address (0x08|0x0035) ncmd 1
        Status: Success (0x00)
< HCI Command: LE Set Extended Adv.. (0x08|0x0037) plen 22  #41 [hci1] 3.405876
        Handle: 0x00
        Operation: Complete extended advertising data (0x03)
        Fragment preference: Minimize fragmentation (0x01)
        Data length: 0x12
        Flags: 0x06
          LE General Discoverable Mode
          BR/EDR Not Supported
        Name (complete): Tester_F6B11A
> HCI Event: Command Complete (0x0e) plen 4                 #42 [hci1] 3.406568
      LE Set Extended Advertising Data (0x08|0x0037) ncmd 1
        Status: Success (0x00)
< HCI Command: LE Set Extended Scan.. (0x08|0x0038) plen 4  #43 [hci1] 3.425902
        Handle: 0x00
        Operation: Complete scan response data (0x03)
        Fragment preference: Minimize fragmentation (0x01)
        Data length: 0x00
> HCI Event: Command Complete (0x0e) plen 4                 #44 [hci1] 3.426375
      LE Set Extended Scan Response Data (0x08|0x0038) ncmd 1
        Status: Success (0x00)
< HCI Command: LE Set Extended Adve.. (0x08|0x0039) plen 6  #45 [hci1] 3.445893
        Extended advertising: Enabled (0x01)
        Number of sets: 1 (0x01)
        Entry 0
          Handle: 0x00
          Duration: 0 ms (0x00)
          Max ext adv events: 0
> HCI Event: Command Complete (0x0e) plen 4                 #46 [hci1] 3.446419
      LE Set Extended Advertising Enable (0x08|0x0039) ncmd 1
        Status: Success (0x00)
> HCI Event: LE Meta Event (0x3e) plen 31                   #47 [hci1] 3.556677
      LE Enhanced Connection Complete (0x0a)
        Status: Success (0x00)
        Handle: 3441
        Role: Peripheral (0x01)
        Peer address type: Public (0x00)
        Peer address: DF:A9:FF:F6:B1:1A (OUI DF-A9-FF)
        Local resolvable private address: 00:00:00:00:00:00 (Non-Resolvable)
        Peer resolvable private address: 00:00:00:00:00:00 (Non-Resolvable)
        Connection interval: 87.50 msec (0x0046)
        Connection latency: 0 (0x0000)
        Supervision timeout: 25120 msec (0x09d0)
        Central clock accuracy: 0x01
> HCI Event: LE Meta Event (0x3e) plen 6                    #48 [hci1] 3.556921
      LE Advertising Set Terminated (0x12)
        Status: Success (0x00)
        Handle: 0
        Connection handle: 3441
        Number of completed extended advertising events: 0
< HCI Command: LE Read Remote Used... (0x08|0x0016) plen 2  #49 [hci1] 3.566987
        Handle: 3441 Address: DF:A9:FF:F6:B1:1A (OUI DF-A9-FF)
< ACL Data TX: Handle 3441 flags 0x00 dlen 7                #50 [hci1] 3.567009
      ATT: Exchange MTU Request (0x02) len 2
        Client RX MTU: 251
> HCI Event: Command Status (0x0f) plen 4                   #51 [hci1] 3.567592
      LE Read Remote Used Features (0x08|0x0016) ncmd 1
        Status: Success (0x00)
> HCI Event: Number of Completed Packets (0x13) plen 5      #52 [hci1] 3.732653
        Num handles: 1
        Handle: 3441 Address: DF:A9:FF:F6:B1:1A (OUI DF-A9-FF)
        Count: 1
        #50: len 7 (0 Kb/s)
        Latency: 165 msec (165-165 msec ~165 msec)
> HCI Event: LE Meta Event (0x3e) plen 12                   #53 [hci1] 3.820586
      LE Read Remote Used Features (0x04)
        Status: Success (0x00)
        Handle: 3441 Address: DF:A9:FF:F6:B1:1A (OUI DF-A9-FF)
        Features: 0x2d 0x49 0x00 0xf7 0x67 0xd8 0x00 0x00
          LE Encryption
          Extended Reject Indication
          Peripheral-initiated Features Exchange
          LE Data Packet Length Extension
          LE 2M PHY
          LE Coded PHY
          Channel Selection Algorithm #2
          Periodic Advertising Sync Transfer - Sender
          Periodic Advertising Sync Transfer - Recipient
          Sleep Clock Accuracy Updates
          Connected Isochronous Stream - Central
          Connected Isochronous Stream - Peripheral
          Isochronous Broadcaster
          Synchronized Receiver
          Connected Isochronous Stream (Host Support)
          LE Power Control Request
          LE Power Control Request
          Connection Subrating
          Connection Subrating (Host Support)
          Unknown features (0x0000d80000000000)
> ACL Data RX: Handle 3441 flags 0x02 dlen 11               #54 [hci1] 6.270261
      SMP: Pairing Request (0x01) len 6
        IO capability: KeyboardDisplay (0x04)
        OOB data: Authentication data not present (0x00)
        Authentication requirement: Bonding, MITM, SC, No Keypresses (0x0d)
        Max encryption key size: 16
        Initiator key distribution: EncKey IdKey (0x03)
        Responder key distribution: EncKey IdKey Sign (0x07)
> ACL Data RX: Handle 3441 flags 0x02 dlen 7                #55 [hci1] 6.270688
      ATT: Exchange MTU Response (0x03) len 2
        Server RX MTU: 23
< HCI Command: Host Number of Compl.. (0x03|0x0035) plen 5  #56 [hci1] 6.286143
        Num handles: 1
        Handle: 3441 Address: DF:A9:FF:F6:B1:1A (OUI DF-A9-FF)
        Count: 1
< ACL Data TX: Handle 3441 flags 0x00 dlen 11               #57 [hci1] 6.286243
      SMP: Pairing Response (0x02) len 6
        IO capability: DisplayOnly (0x00)
        OOB data: Authentication data not present (0x00)
        Authentication requirement: Bonding, No MITM, SC, No Keypresses (0x09)
        Max encryption key size: 16
        Initiator key distribution: IdKey (0x02)
        Responder key distribution: <none> (0x00)
< HCI Command: Host Number of Compl.. (0x03|0x0035) plen 5  #58 [hci1] 6.286477
        Num handles: 1
        Handle: 3441 Address: DF:A9:FF:F6:B1:1A (OUI DF-A9-FF)
        Count: 1
> HCI Event: Number of Completed Packets (0x13) plen 5      #59 [hci1] 6.445344
        Num handles: 1
        Handle: 3441 Address: DF:A9:FF:F6:B1:1A (OUI DF-A9-FF)
        Count: 1
        #57: len 11 (0 Kb/s)
        Latency: 159 msec (159-165 msec ~162 msec)
> ACL Data RX: Handle 3441 flags 0x02 dlen 27               #60 [hci1] 6.445647
> ACL Data RX: Handle 3441 flags 0x01 dlen 27               #61 [hci1] 6.446164
> ACL Data RX: Handle 3441 flags 0x01 dlen 15               #62 [hci1] 6.446604
      SMP: Pairing Public Key (0x0c) len 64
        X: 10c4e764d17664f99f2897c86d8f260abd6b4740bed1a5e4a93f6827fcc4c26f
        Y: 78ad540ba40ac1731ea9b86e44079dee4cb111d786416bcf57de8fa1b7a22dbb
< HCI Command: Host Number of Compl.. (0x03|0x0035) plen 5  #63 [hci1] 6.466443
        Num handles: 1
        Handle: 3441 Address: DF:A9:FF:F6:B1:1A (OUI DF-A9-FF)
        Count: 1
< HCI Command: Host Number of Compl.. (0x03|0x0035) plen 5  #64 [hci1] 6.466647
        Num handles: 1
        Handle: 3441 Address: DF:A9:FF:F6:B1:1A (OUI DF-A9-FF)
        Count: 1
< HCI Command: Host Number of Compl.. (0x03|0x0035) plen 5  #65 [hci1] 6.466997
        Num handles: 1
        Handle: 3441 Address: DF:A9:FF:F6:B1:1A (OUI DF-A9-FF)
        Count: 1
< ACL Data TX: Handle 3441 flags 0x00 dlen 27               #66 [hci1] 6.467151
< ACL Data TX: Handle 3441 flags 0x01 dlen 27               #67 [hci1] 6.467168
< ACL Data TX: Handle 3441 flags 0x01 dlen 15               #68 [hci1] 6.467187
      SMP: Pairing Public Key (0x0c) len 64
        X: 98308440221e2d910f0e54b71e7ec652857aa9b5a0dc65028824cc19db1226e9
        Y: 67a4816bcb62efb21701e31fdb27561a6217575fb007a8bbdabe7e28b6f68482
> HCI Event: Number of Completed Packets (0x13) plen 5      #69 [hci1] 6.533242
        Num handles: 1
        Handle: 3441 Address: DF:A9:FF:F6:B1:1A (OUI DF-A9-FF)
        Count: 1
        #66: len 27 (3 Kb/s)
        Latency: 66 msec (66-165 msec ~114 msec)
> HCI Event: Number of Completed Packets (0x13) plen 5      #70 [hci1] 6.533887
        Num handles: 1
        Handle: 3441 Address: DF:A9:FF:F6:B1:1A (OUI DF-A9-FF)
        Count: 1
        #67: len 27 (3 Kb/s)
        Latency: 66 msec (66-165 msec ~90 msec)
> HCI Event: Number of Completed Packets (0x13) plen 5      #71 [hci1] 6.620046
        Num handles: 1
        Handle: 3441 Address: DF:A9:FF:F6:B1:1A (OUI DF-A9-FF)
        Count: 1
        #68: len 15 (0 Kb/s)
        Latency: 152 msec (66-165 msec ~121 msec)
> ACL Data RX: Handle 3441 flags 0x02 dlen 21               #72 [hci1] 7.670434
      SMP: Pairing Confirm (0x03) len 16
        Confim value: 2540c047d97f4c80fe5a637cfc40f2fa
< HCI Command: Host Number of Compl.. (0x03|0x0035) plen 5  #73 [hci1] 7.686681
        Num handles: 1
        Handle: 3441 Address: DF:A9:FF:F6:B1:1A (OUI DF-A9-FF)
        Count: 1
< ACL Data TX: Handle 3441 flags 0x00 dlen 21               #74 [hci1] 7.686848
      SMP: Pairing Confirm (0x03) len 16
        Confim value: 7f6689d5367677e8e3d7b47b822c30bf
> HCI Event: Number of Completed Packets (0x13) plen 5      #75 [hci1] 7.845166
        Num handles: 1
        Handle: 3441 Address: DF:A9:FF:F6:B1:1A (OUI DF-A9-FF)
        Count: 1
        #74: len 21 (1 Kb/s)
        Latency: 158 msec (66-165 msec ~139 msec)
> ACL Data RX: Handle 3441 flags 0x02 dlen 21               #76 [hci1] 7.845610
      SMP: Pairing Random (0x04) len 16
        Random value: eff6a1dde35622510000000000000000
< HCI Command: Host Number of Compl.. (0x03|0x0035) plen 5  #77 [hci1] 7.846014
        Num handles: 1
        Handle: 3441 Address: DF:A9:FF:F6:B1:1A (OUI DF-A9-FF)
        Count: 1
< ACL Data TX: Handle 3441 flags 0x00 dlen 21               #78 [hci1] 7.846070
      SMP: Pairing Random (0x04) len 16
        Random value: 8e6108f966a694cbe26df70bb96773e6
> HCI Event: Number of Completed Packets (0x13) plen 5      #79 [hci1] 8.020078
        Num handles: 1
        Handle: 3441 Address: DF:A9:FF:F6:B1:1A (OUI DF-A9-FF)
        Count: 1
        #78: len 21 (0 Kb/s)
        Latency: 174 msec (66-174 msec ~157 msec)
> ACL Data RX: Handle 3441 flags 0x02 dlen 21               #80 [hci1] 8.107941
      SMP: Pairing Confirm (0x03) len 16
        Confim value: d8ca851d9b16eb2de51920546146b695
< HCI Command: Host Number of Compl.. (0x03|0x0035) plen 5  #81 [hci1] 8.126287
        Num handles: 1
        Handle: 3441 Address: DF:A9:FF:F6:B1:1A (OUI DF-A9-FF)
        Count: 1
< ACL Data TX: Handle 3441 flags 0x00 dlen 21               #82 [hci1] 8.126320
      SMP: Pairing Confirm (0x03) len 16
        Confim value: 382394afc21aa448b7d48b0f4b5fcec5
> HCI Event: Number of Completed Packets (0x13) plen 5      #83 [hci1] 8.282685
        Num handles: 1
        Handle: 3441 Address: DF:A9:FF:F6:B1:1A (OUI DF-A9-FF)
        Count: 1
        #82: len 21 (1 Kb/s)
        Latency: 156 msec (66-174 msec ~156 msec)
> ACL Data RX: Handle 3441 flags 0x02 dlen 21               #84 [hci1] 8.283016
      SMP: Pairing Random (0x04) len 16
        Random value: 28f6511d54a450fa0000000000000000
< HCI Command: Host Number of Compl.. (0x03|0x0035) plen 5  #85 [hci1] 8.286799
        Num handles: 1
        Handle: 3441 Address: DF:A9:FF:F6:B1:1A (OUI DF-A9-FF)
        Count: 1
< ACL Data TX: Handle 3441 flags 0x00 dlen 21               #86 [hci1] 8.286964
      SMP: Pairing Random (0x04) len 16
        Random value: 4d02679f89a05211af56d8b3da64d21e
> HCI Event: Number of Completed Packets (0x13) plen 5      #87 [hci1] 8.457505
        Num handles: 1
        Handle: 3441 Address: DF:A9:FF:F6:B1:1A (OUI DF-A9-FF)
        Count: 1
        #86: len 21 (0 Kb/s)
        Latency: 170 msec (66-174 msec ~163 msec)
> ACL Data RX: Handle 3441 flags 0x02 dlen 21               #88 [hci1] 8.545351
      SMP: Pairing Confirm (0x03) len 16
        Confim value: 8852e7d4edc160dae23c962339ea1309
< HCI Command: Host Number of Compl.. (0x03|0x0035) plen 5  #89 [hci1] 8.546533
        Num handles: 1
        Handle: 3441 Address: DF:A9:FF:F6:B1:1A (OUI DF-A9-FF)
        Count: 1
< ACL Data TX: Handle 3441 flags 0x00 dlen 21               #90 [hci1] 8.546591
      SMP: Pairing Confirm (0x03) len 16
        Confim value: 4d274ae7bc1cf364c5cc0384b51078bb
> HCI Event: Number of Completed Packets (0x13) plen 5      #91 [hci1] 8.720210
        Num handles: 1
        Handle: 3441 Address: DF:A9:FF:F6:B1:1A (OUI DF-A9-FF)
        Count: 1
        #90: len 21 (0 Kb/s)
        Latency: 173 msec (66-174 msec ~168 msec)
> ACL Data RX: Handle 3441 flags 0x02 dlen 21               #92 [hci1] 8.720538
      SMP: Pairing Random (0x04) len 16
        Random value: e57fcd048192591a0000000000000000
< HCI Command: Host Number of Compl.. (0x03|0x0035) plen 5  #93 [hci1] 8.726734
        Num handles: 1
        Handle: 3441 Address: DF:A9:FF:F6:B1:1A (OUI DF-A9-FF)
        Count: 1
< ACL Data TX: Handle 3441 flags 0x00 dlen 21               #94 [hci1] 8.726820
      SMP: Pairing Random (0x04) len 16
        Random value: 5e8286bc235a02440d0c3424a2acf8fd
> HCI Event: Number of Completed Packets (0x13) plen 5      #95 [hci1] 8.895023
        Num handles: 1
        Handle: 3441 Address: DF:A9:FF:F6:B1:1A (OUI DF-A9-FF)
        Count: 1
        #94: len 21 (1 Kb/s)
        Latency: 168 msec (66-174 msec ~168 msec)
> ACL Data RX: Handle 3441 flags 0x02 dlen 21               #96 [hci1] 8.982784
      SMP: Pairing Confirm (0x03) len 16
        Confim value: 90348885721c8094cd1fa6dbc8ab5695
< HCI Command: Host Number of Compl.. (0x03|0x0035) plen 5  #97 [hci1] 8.986428
        Num handles: 1
        Handle: 3441 Address: DF:A9:FF:F6:B1:1A (OUI DF-A9-FF)
        Count: 1
< ACL Data TX: Handle 3441 flags 0x00 dlen 21               #98 [hci1] 8.986540
      SMP: Pairing Confirm (0x03) len 16
        Confim value: 7e572f61207531fd14d2dd674d0d1b3f
> HCI Event: Number of Completed Packets (0x13) plen 5      #99 [hci1] 9.157699
        Num handles: 1
        Handle: 3441 Address: DF:A9:FF:F6:B1:1A (OUI DF-A9-FF)
        Count: 1
        #98: len 21 (0 Kb/s)
        Latency: 171 msec (66-174 msec ~169 msec)
> ACL Data RX: Handle 3441 flags 0x02 dlen 21              #100 [hci1] 9.158024
      SMP: Pairing Random (0x04) len 16
        Random value: 7dd2dc0be199c6f50000000000000000
< HCI Command: Host Number of Comp.. (0x03|0x0035) plen 5  #101 [hci1] 9.166107
        Num handles: 1
        Handle: 3441 Address: DF:A9:FF:F6:B1:1A (OUI DF-A9-FF)
        Count: 1
< ACL Data TX: Handle 3441 flags 0x00 dlen 21              #102 [hci1] 9.166146
      SMP: Pairing Random (0x04) len 16
        Random value: 5c4a1bcadd27bd58e945097b00bad7ac
> HCI Event: Number of Completed Packets (0x13) plen 5     #103 [hci1] 9.332519
        Num handles: 1
        Handle: 3441 Address: DF:A9:FF:F6:B1:1A (OUI DF-A9-FF)
        Count: 1
        #102: len 21 (1 Kb/s)
        Latency: 166 msec (66-174 msec ~168 msec)
> ACL Data RX: Handle 3441 flags 0x02 dlen 21              #104 [hci1] 9.420456
      SMP: Pairing Confirm (0x03) len 16
        Confim value: dfa37d42fb1aa315618f896c2b0734e6
< HCI Command: Host Number of Comp.. (0x03|0x0035) plen 5  #105 [hci1] 9.426544
        Num handles: 1
        Handle: 3441 Address: DF:A9:FF:F6:B1:1A (OUI DF-A9-FF)
        Count: 1
< ACL Data TX: Handle 3441 flags 0x00 dlen 21              #106 [hci1] 9.426683
      SMP: Pairing Confirm (0x03) len 16
        Confim value: c1b932a76ff62bb7df6a940c197ba91a
> HCI Event: Number of Completed Packets (0x13) plen 5     #107 [hci1] 9.595197
        Num handles: 1
        Handle: 3441 Address: DF:A9:FF:F6:B1:1A (OUI DF-A9-FF)
        Count: 1
        #106: len 21 (1 Kb/s)
        Latency: 168 msec (66-174 msec ~168 msec)
> ACL Data RX: Handle 3441 flags 0x02 dlen 21              #108 [hci1] 9.595585
      SMP: Pairing Random (0x04) len 16
        Random value: be62150aaeb85cf00000000000000000
< HCI Command: Host Number of Comp.. (0x03|0x0035) plen 5  #109 [hci1] 9.606835
        Num handles: 1
        Handle: 3441 Address: DF:A9:FF:F6:B1:1A (OUI DF-A9-FF)
        Count: 1
< ACL Data TX: Handle 3441 flags 0x00 dlen 21              #110 [hci1] 9.606986
      SMP: Pairing Random (0x04) len 16
        Random value: 32527e6e64e79f33b2e374394db8ab2d
> HCI Event: Number of Completed Packets (0x13) plen 5     #111 [hci1] 9.769979
        Num handles: 1
        Handle: 3441 Address: DF:A9:FF:F6:B1:1A (OUI DF-A9-FF)
        Count: 1
        #110: len 21 (1 Kb/s)
        Latency: 162 msec (66-174 msec ~165 msec)
> ACL Data RX: Handle 3441 flags 0x02 dlen 21              #112 [hci1] 9.857911
      SMP: Pairing Confirm (0x03) len 16
        Confim value: 3ca822df2c1b08e38fdd3bdda495b17c
< HCI Command: Host Number of Comp.. (0x03|0x0035) plen 5  #113 [hci1] 9.866538
        Num handles: 1
        Handle: 3441 Address: DF:A9:FF:F6:B1:1A (OUI DF-A9-FF)
        Count: 1
< ACL Data TX: Handle 3441 flags 0x00 dlen 21              #114 [hci1] 9.866724
      SMP: Pairing Confirm (0x03) len 16
        Confim value: 58b2a99b83e870fc5857893e70b72612
> HCI Event: Number of Completed Packets (0x13) plen 5    #115 [hci1] 10.032735
        Num handles: 1
        Handle: 3441 Address: DF:A9:FF:F6:B1:1A (OUI DF-A9-FF)
        Count: 1
        #114: len 21 (1 Kb/s)
        Latency: 166 msec (66-174 msec ~165 msec)
> ACL Data RX: Handle 3441 flags 0x02 dlen 21             #116 [hci1] 10.033040
      SMP: Pairing Random (0x04) len 16
        Random value: f27b57ab999a30e20000000000000000
< HCI Command: Host Number of Com.. (0x03|0x0035) plen 5  #117 [hci1] 10.046804
        Num handles: 1
        Handle: 3441 Address: DF:A9:FF:F6:B1:1A (OUI DF-A9-FF)
        Count: 1
< ACL Data TX: Handle 3441 flags 0x00 dlen 21             #118 [hci1] 10.047009
      SMP: Pairing Random (0x04) len 16
        Random value: dddbdfe2838e9a8cc6964353c850fef7
> HCI Event: Number of Completed Packets (0x13) plen 5    #119 [hci1] 10.207509
        Num handles: 1
        Handle: 3441 Address: DF:A9:FF:F6:B1:1A (OUI DF-A9-FF)
        Count: 1
        #118: len 21 (1 Kb/s)
        Latency: 160 msec (66-174 msec ~163 msec)
> ACL Data RX: Handle 3441 flags 0x02 dlen 21             #120 [hci1] 10.295216
      SMP: Pairing Confirm (0x03) len 16
        Confim value: d2ae3f91a66f2403d76a06d2325b1e80
< HCI Command: Host Number of Com.. (0x03|0x0035) plen 5  #121 [hci1] 10.306615
        Num handles: 1
        Handle: 3441 Address: DF:A9:FF:F6:B1:1A (OUI DF-A9-FF)
        Count: 1
< ACL Data TX: Handle 3441 flags 0x00 dlen 21             #122 [hci1] 10.306768
      SMP: Pairing Confirm (0x03) len 16
        Confim value: f337831c88af50d5c057d1bd217d28ee
> HCI Event: Number of Completed Packets (0x13) plen 5    #123 [hci1] 10.470121
        Num handles: 1
        Handle: 3441 Address: DF:A9:FF:F6:B1:1A (OUI DF-A9-FF)
        Count: 1
        #122: len 21 (1 Kb/s)
        Latency: 163 msec (66-174 msec ~163 msec)
> ACL Data RX: Handle 3441 flags 0x02 dlen 21             #124 [hci1] 10.470508
      SMP: Pairing Random (0x04) len 16
        Random value: e3137a9d113b7ab90000000000000000
< HCI Command: Host Number of Com.. (0x03|0x0035) plen 5  #125 [hci1] 10.486770
        Num handles: 1
        Handle: 3441 Address: DF:A9:FF:F6:B1:1A (OUI DF-A9-FF)
        Count: 1
< ACL Data TX: Handle 3441 flags 0x00 dlen 21             #126 [hci1] 10.486909
      SMP: Pairing Random (0x04) len 16
        Random value: eb9f1915536596b6fc3db1c86b2b1970
> HCI Event: Number of Completed Packets (0x13) plen 5    #127 [hci1] 10.644998
        Num handles: 1
        Handle: 3441 Address: DF:A9:FF:F6:B1:1A (OUI DF-A9-FF)
        Count: 1
        #126: len 21 (1 Kb/s)
        Latency: 158 msec (66-174 msec ~160 msec)
> ACL Data RX: Handle 3441 flags 0x02 dlen 21             #128 [hci1] 10.732728
      SMP: Pairing Confirm (0x03) len 16
        Confim value: e2bed795fc8e02b59d9426c65e4a0d77
< HCI Command: Host Number of Com.. (0x03|0x0035) plen 5  #129 [hci1] 10.746449
        Num handles: 1
        Handle: 3441 Address: DF:A9:FF:F6:B1:1A (OUI DF-A9-FF)
        Count: 1
< ACL Data TX: Handle 3441 flags 0x00 dlen 21             #130 [hci1] 10.746613
      SMP: Pairing Confirm (0x03) len 16
        Confim value: ca2e4acb4bb25e43d0132d4a67fa2a38
> HCI Event: Number of Completed Packets (0x13) plen 5    #131 [hci1] 10.907627
        Num handles: 1
        Handle: 3441 Address: DF:A9:FF:F6:B1:1A (OUI DF-A9-FF)
        Count: 1
        #130: len 21 (1 Kb/s)
        Latency: 161 msec (66-174 msec ~160 msec)
> ACL Data RX: Handle 3441 flags 0x02 dlen 21             #132 [hci1] 10.907979
      SMP: Pairing Random (0x04) len 16
        Random value: cb704428c80929ea0000000000000000
< HCI Command: Host Number of Com.. (0x03|0x0035) plen 5  #133 [hci1] 10.926846
        Num handles: 1
        Handle: 3441 Address: DF:A9:FF:F6:B1:1A (OUI DF-A9-FF)
        Count: 1
< ACL Data TX: Handle 3441 flags 0x00 dlen 21             #134 [hci1] 10.927020
      SMP: Pairing Random (0x04) len 16
        Random value: 5c794dc9ad9f2c3f295ebd5ad5e1c3cf
> HCI Event: Number of Completed Packets (0x13) plen 5    #135 [hci1] 11.082393
        Num handles: 1
        Handle: 3441 Address: DF:A9:FF:F6:B1:1A (OUI DF-A9-FF)
        Count: 1
        #134: len 21 (1 Kb/s)
        Latency: 155 msec (66-174 msec ~158 msec)
> ACL Data RX: Handle 3441 flags 0x02 dlen 21             #136 [hci1] 11.170317
      SMP: Pairing Confirm (0x03) len 16
        Confim value: e99e023a6d57cfdffeb32a4e1ac60fc7
< HCI Command: Host Number of Com.. (0x03|0x0035) plen 5  #137 [hci1] 11.186297
        Num handles: 1
        Handle: 3441 Address: DF:A9:FF:F6:B1:1A (OUI DF-A9-FF)
        Count: 1
< ACL Data TX: Handle 3441 flags 0x00 dlen 21             #138 [hci1] 11.186365
      SMP: Pairing Confirm (0x03) len 16
        Confim value: 066aee4ad9595de819f5bfe7a061fe0b
> HCI Event: Number of Completed Packets (0x13) plen 5    #139 [hci1] 11.345100
        Num handles: 1
        Handle: 3441 Address: DF:A9:FF:F6:B1:1A (OUI DF-A9-FF)
        Count: 1
        #138: len 21 (1 Kb/s)
        Latency: 158 msec (66-174 msec ~158 msec)
> ACL Data RX: Handle 3441 flags 0x02 dlen 21             #140 [hci1] 11.345504
      SMP: Pairing Random (0x04) len 16
        Random value: 9920860b1ca5aa290000000000000000
< HCI Command: Host Number of Com.. (0x03|0x0035) plen 5  #141 [hci1] 11.346721
        Num handles: 1
        Handle: 3441 Address: DF:A9:FF:F6:B1:1A (OUI DF-A9-FF)
        Count: 1
< ACL Data TX: Handle 3441 flags 0x00 dlen 21             #142 [hci1] 11.346850
      SMP: Pairing Random (0x04) len 16
        Random value: 5c2fff312cdf99c9491988e877355a9a
> HCI Event: Number of Completed Packets (0x13) plen 5    #143 [hci1] 11.519895
        Num handles: 1
        Handle: 3441 Address: DF:A9:FF:F6:B1:1A (OUI DF-A9-FF)
        Count: 1
        #142: len 21 (0 Kb/s)
        Latency: 173 msec (66-174 msec ~165 msec)
> ACL Data RX: Handle 3441 flags 0x02 dlen 21             #144 [hci1] 11.607675
      SMP: Pairing Confirm (0x03) len 16
        Confim value: 71bb4c63e020dab72c878d1dcbc091fd
< HCI Command: Host Number of Com.. (0x03|0x0035) plen 5  #145 [hci1] 11.626162
        Num handles: 1
        Handle: 3441 Address: DF:A9:FF:F6:B1:1A (OUI DF-A9-FF)
        Count: 1
< ACL Data TX: Handle 3441 flags 0x00 dlen 21             #146 [hci1] 11.626248
      SMP: Pairing Confirm (0x03) len 16
        Confim value: aee596dd3e9cfa7b23bd67d8f7342209
> HCI Event: Number of Completed Packets (0x13) plen 5    #147 [hci1] 11.782561
        Num handles: 1
        Handle: 3441 Address: DF:A9:FF:F6:B1:1A (OUI DF-A9-FF)
        Count: 1
        #146: len 21 (1 Kb/s)
        Latency: 156 msec (66-174 msec ~161 msec)
> ACL Data RX: Handle 3441 flags 0x02 dlen 21             #148 [hci1] 11.782914
      SMP: Pairing Random (0x04) len 16
        Random value: c26ab97b32df341c0000000000000000
< HCI Command: Host Number of Com.. (0x03|0x0035) plen 5  #149 [hci1] 11.785966
        Num handles: 1
        Handle: 3441 Address: DF:A9:FF:F6:B1:1A (OUI DF-A9-FF)
        Count: 1
< ACL Data TX: Handle 3441 flags 0x00 dlen 21             #150 [hci1] 11.785989
      SMP: Pairing Random (0x04) len 16
        Random value: c629a3a987d808e808655d558dfc1155
> HCI Event: Number of Completed Packets (0x13) plen 5    #151 [hci1] 11.957339
        Num handles: 1
        Handle: 3441 Address: DF:A9:FF:F6:B1:1A (OUI DF-A9-FF)
        Count: 1
        #150: len 21 (0 Kb/s)
        Latency: 171 msec (66-174 msec ~166 msec)
> ACL Data RX: Handle 3441 flags 0x02 dlen 21             #152 [hci1] 12.045237
      SMP: Pairing Confirm (0x03) len 16
        Confim value: 81fa7d35a776eb74ffbe4f571e39a0ab
< HCI Command: Host Number of Com.. (0x03|0x0035) plen 5  #153 [hci1] 12.045978
        Num handles: 1
        Handle: 3441 Address: DF:A9:FF:F6:B1:1A (OUI DF-A9-FF)
        Count: 1
< ACL Data TX: Handle 3441 flags 0x00 dlen 21             #154 [hci1] 12.045987
      SMP: Pairing Confirm (0x03) len 16
        Confim value: 44bc63453d872b86b0a2d3afe10236ca
> HCI Event: Number of Completed Packets (0x13) plen 5    #155 [hci1] 12.220034
        Num handles: 1
        Handle: 3441 Address: DF:A9:FF:F6:B1:1A (OUI DF-A9-FF)
        Count: 1
        #154: len 21 (0 Kb/s)
        Latency: 174 msec (66-174 msec ~170 msec)
> ACL Data RX: Handle 3441 flags 0x02 dlen 21             #156 [hci1] 12.220407
      SMP: Pairing Random (0x04) len 16
        Random value: 783e4907cbf67ac50000000000000000
< HCI Command: Host Number of Com.. (0x03|0x0035) plen 5  #157 [hci1] 12.226113
        Num handles: 1
        Handle: 3441 Address: DF:A9:FF:F6:B1:1A (OUI DF-A9-FF)
        Count: 1
< ACL Data TX: Handle 3441 flags 0x00 dlen 21             #158 [hci1] 12.226132
      SMP: Pairing Random (0x04) len 16
        Random value: 92f20f6ad8f13724432c7fd6001c45ff
> HCI Event: Number of Completed Packets (0x13) plen 5    #159 [hci1] 12.394825
        Num handles: 1
        Handle: 3441 Address: DF:A9:FF:F6:B1:1A (OUI DF-A9-FF)
        Count: 1
        #158: len 21 (1 Kb/s)
        Latency: 168 msec (66-174 msec ~169 msec)
> ACL Data RX: Handle 3441 flags 0x02 dlen 21             #160 [hci1] 12.482743
      SMP: Pairing Confirm (0x03) len 16
        Confim value: 1d1657f8f618fdea2adb04e0257ab5dc
< HCI Command: Host Number of Com.. (0x03|0x0035) plen 5  #161 [hci1] 12.485962
        Num handles: 1
        Handle: 3441 Address: DF:A9:FF:F6:B1:1A (OUI DF-A9-FF)
        Count: 1
< ACL Data TX: Handle 3441 flags 0x00 dlen 21             #162 [hci1] 12.486009
      SMP: Pairing Confirm (0x03) len 16
        Confim value: 44e662876fc3bf052273f525d0dcf951
> HCI Event: Number of Completed Packets (0x13) plen 5    #163 [hci1] 12.657612
        Num handles: 1
        Handle: 3441 Address: DF:A9:FF:F6:B1:1A (OUI DF-A9-FF)
        Count: 1
        #162: len 21 (0 Kb/s)
        Latency: 171 msec (66-174 msec ~170 msec)
> ACL Data RX: Handle 3441 flags 0x02 dlen 21             #164 [hci1] 12.657903
      SMP: Pairing Random (0x04) len 16
        Random value: d8cd6130aa2d8a340000000000000000
< HCI Command: Host Number of Com.. (0x03|0x0035) plen 5  #165 [hci1] 12.666158
        Num handles: 1
        Handle: 3441 Address: DF:A9:FF:F6:B1:1A (OUI DF-A9-FF)
        Count: 1
< ACL Data TX: Handle 3441 flags 0x00 dlen 21             #166 [hci1] 12.666166
      SMP: Pairing Random (0x04) len 16
        Random value: 23ac32ebbb5e14c8a6b9622f296d277f
> HCI Event: Number of Completed Packets (0x13) plen 5    #167 [hci1] 12.832357
        Num handles: 1
        Handle: 3441 Address: DF:A9:FF:F6:B1:1A (OUI DF-A9-FF)
        Count: 1
        #166: len 21 (1 Kb/s)
        Latency: 166 msec (66-174 msec ~168 msec)
> ACL Data RX: Handle 3441 flags 0x02 dlen 21             #168 [hci1] 12.920334
      SMP: Pairing Confirm (0x03) len 16
        Confim value: 9f878f539073014f1544f17f988f346b
< HCI Command: Host Number of Com.. (0x03|0x0035) plen 5  #169 [hci1] 12.926553
        Num handles: 1
        Handle: 3441 Address: DF:A9:FF:F6:B1:1A (OUI DF-A9-FF)
        Count: 1
< ACL Data TX: Handle 3441 flags 0x00 dlen 21             #170 [hci1] 12.926604
      SMP: Pairing Confirm (0x03) len 16
        Confim value: 13aa779a158a1f0a26873f971a9a8c1a
> HCI Event: Number of Completed Packets (0x13) plen 5    #171 [hci1] 13.095144
        Num handles: 1
        Handle: 3441 Address: DF:A9:FF:F6:B1:1A (OUI DF-A9-FF)
        Count: 1
        #170: len 21 (1 Kb/s)
        Latency: 168 msec (66-174 msec ~168 msec)
> ACL Data RX: Handle 3441 flags 0x02 dlen 21             #172 [hci1] 13.095403
      SMP: Pairing Random (0x04) len 16
        Random value: 5480fc8a20743d340000000000000000
< HCI Command: Host Number of Com.. (0x03|0x0035) plen 5  #173 [hci1] 13.106252
        Num handles: 1
        Handle: 3441 Address: DF:A9:FF:F6:B1:1A (OUI DF-A9-FF)
        Count: 1
< ACL Data TX: Handle 3441 flags 0x00 dlen 21             #174 [hci1] 13.106345
      SMP: Pairing Random (0x04) len 16
        Random value: 297efe85e67448a15f56bd27e3a3cf1d
> HCI Event: Number of Completed Packets (0x13) plen 5    #175 [hci1] 13.269900
        Num handles: 1
        Handle: 3441 Address: DF:A9:FF:F6:B1:1A (OUI DF-A9-FF)
        Count: 1
        #174: len 21 (1 Kb/s)
        Latency: 163 msec (66-174 msec ~165 msec)
> ACL Data RX: Handle 3441 flags 0x02 dlen 21             #176 [hci1] 13.357734
      SMP: Pairing Confirm (0x03) len 16
        Confim value: 345c7056f604baa0811bdaeace94a916
< HCI Command: Host Number of Com.. (0x03|0x0035) plen 5  #177 [hci1] 13.366359
        Num handles: 1
        Handle: 3441 Address: DF:A9:FF:F6:B1:1A (OUI DF-A9-FF)
        Count: 1
< ACL Data TX: Handle 3441 flags 0x00 dlen 21             #178 [hci1] 13.366479
      SMP: Pairing Confirm (0x03) len 16
        Confim value: 9159c7eeb031447f80ca99b30473270d
> HCI Event: Number of Completed Packets (0x13) plen 5    #179 [hci1] 13.532519
        Num handles: 1
        Handle: 3441 Address: DF:A9:FF:F6:B1:1A (OUI DF-A9-FF)
        Count: 1
        #178: len 21 (1 Kb/s)
        Latency: 166 msec (66-174 msec ~166 msec)
> ACL Data RX: Handle 3441 flags 0x02 dlen 21             #180 [hci1] 13.532946
      SMP: Pairing Random (0x04) len 16
        Random value: f7230a77c7917a840000000000000000
< HCI Command: Host Number of Com.. (0x03|0x0035) plen 5  #181 [hci1] 13.546539
        Num handles: 1
        Handle: 3441 Address: DF:A9:FF:F6:B1:1A (OUI DF-A9-FF)
        Count: 1
< ACL Data TX: Handle 3441 flags 0x00 dlen 21             #182 [hci1] 13.546606
      SMP: Pairing Random (0x04) len 16
        Random value: 25a9493fd3ce4faf02be7293595bb7c6
> HCI Event: Number of Completed Packets (0x13) plen 5    #183 [hci1] 13.707368
        Num handles: 1
        Handle: 3441 Address: DF:A9:FF:F6:B1:1A (OUI DF-A9-FF)
        Count: 1
        #182: len 21 (1 Kb/s)
        Latency: 160 msec (66-174 msec ~163 msec)
> ACL Data RX: Handle 3441 flags 0x02 dlen 21             #184 [hci1] 13.795119
      SMP: Pairing Confirm (0x03) len 16
        Confim value: fda4e682137878ca0ffeae9dd14229ae
< HCI Command: Host Number of Com.. (0x03|0x0035) plen 5  #185 [hci1] 13.806630
        Num handles: 1
        Handle: 3441 Address: DF:A9:FF:F6:B1:1A (OUI DF-A9-FF)
        Count: 1
< ACL Data TX: Handle 3441 flags 0x00 dlen 21             #186 [hci1] 13.806780
      SMP: Pairing Confirm (0x03) len 16
        Confim value: 702ed9683cf40485f5cbf32382a0f12c
> HCI Event: Number of Completed Packets (0x13) plen 5    #187 [hci1] 13.970064
        Num handles: 1
        Handle: 3441 Address: DF:A9:FF:F6:B1:1A (OUI DF-A9-FF)
        Count: 1
        #186: len 21 (1 Kb/s)
        Latency: 163 msec (66-174 msec ~163 msec)
> ACL Data RX: Handle 3441 flags 0x02 dlen 21             #188 [hci1] 13.970353
      SMP: Pairing Random (0x04) len 16
        Random value: 076a023900882c3f0000000000000000
< HCI Command: Host Number of Com.. (0x03|0x0035) plen 5  #189 [hci1] 13.986636
        Num handles: 1
        Handle: 3441 Address: DF:A9:FF:F6:B1:1A (OUI DF-A9-FF)
        Count: 1
< ACL Data TX: Handle 3441 flags 0x00 dlen 21             #190 [hci1] 13.986779
      SMP: Pairing Random (0x04) len 16
        Random value: 58f6b41f855a6f6c3560debd84e2affc
> HCI Event: Number of Completed Packets (0x13) plen 5    #191 [hci1] 14.144805
        Num handles: 1
        Handle: 3441 Address: DF:A9:FF:F6:B1:1A (OUI DF-A9-FF)
        Count: 1
        #190: len 21 (1 Kb/s)
        Latency: 158 msec (66-174 msec ~160 msec)
> ACL Data RX: Handle 3441 flags 0x02 dlen 21             #192 [hci1] 14.232719
      SMP: Pairing Confirm (0x03) len 16
        Confim value: 91f722aed73e76419a89ff59fe333d92
< HCI Command: Host Number of Com.. (0x03|0x0035) plen 5  #193 [hci1] 14.246594
        Num handles: 1
        Handle: 3441 Address: DF:A9:FF:F6:B1:1A (OUI DF-A9-FF)
        Count: 1
< ACL Data TX: Handle 3441 flags 0x00 dlen 21             #194 [hci1] 14.246771
      SMP: Pairing Confirm (0x03) len 16
        Confim value: 16ea485746a9d9c1bccfb6f0ef525d56
> HCI Event: Number of Completed Packets (0x13) plen 5    #195 [hci1] 14.407578
        Num handles: 1
        Handle: 3441 Address: DF:A9:FF:F6:B1:1A (OUI DF-A9-FF)
        Count: 1
        #194: len 21 (1 Kb/s)
        Latency: 160 msec (66-174 msec ~160 msec)
> ACL Data RX: Handle 3441 flags 0x02 dlen 21             #196 [hci1] 14.407820
      SMP: Pairing Random (0x04) len 16
        Random value: 57efe25197f51d6d0000000000000000
< HCI Command: Host Number of Com.. (0x03|0x0035) plen 5  #197 [hci1] 14.426768
        Num handles: 1
        Handle: 3441 Address: DF:A9:FF:F6:B1:1A (OUI DF-A9-FF)
        Count: 1
< ACL Data TX: Handle 3441 flags 0x00 dlen 21             #198 [hci1] 14.426909
      SMP: Pairing Random (0x04) len 16
        Random value: b67e7216d5bf664139eda2b542549666
> HCI Event: Number of Completed Packets (0x13) plen 5    #199 [hci1] 14.582264
        Num handles: 1
        Handle: 3441 Address: DF:A9:FF:F6:B1:1A (OUI DF-A9-FF)
        Count: 1
        #198: len 21 (1 Kb/s)
        Latency: 155 msec (66-174 msec ~158 msec)
> ACL Data RX: Handle 3441 flags 0x02 dlen 21             #200 [hci1] 14.670135
      SMP: Pairing Confirm (0x03) len 16
        Confim value: ffc22d409116955570f0d8ebc0f53505
< HCI Command: Host Number of Com.. (0x03|0x0035) plen 5  #201 [hci1] 14.686518
        Num handles: 1
        Handle: 3441 Address: DF:A9:FF:F6:B1:1A (OUI DF-A9-FF)
        Count: 1
< ACL Data TX: Handle 3441 flags 0x00 dlen 21             #202 [hci1] 14.686536
      SMP: Pairing Confirm (0x03) len 16
        Confim value: 880408803a36c22fa72e4d6afea6832f
> HCI Event: Number of Completed Packets (0x13) plen 5    #203 [hci1] 14.844973
        Num handles: 1
        Handle: 3441 Address: DF:A9:FF:F6:B1:1A (OUI DF-A9-FF)
        Count: 1
        #202: len 21 (1 Kb/s)
        Latency: 158 msec (66-174 msec ~158 msec)
> ACL Data RX: Handle 3441 flags 0x02 dlen 21             #204 [hci1] 14.845408
      SMP: Pairing Random (0x04) len 16
        Random value: b7a062f14dcb13390000000000000000
< HCI Command: Host Number of Com.. (0x03|0x0035) plen 5  #205 [hci1] 14.846756
        Num handles: 1
        Handle: 3441 Address: DF:A9:FF:F6:B1:1A (OUI DF-A9-FF)
        Count: 1
< ACL Data TX: Handle 3441 flags 0x00 dlen 21             #206 [hci1] 14.846873
      SMP: Pairing Random (0x04) len 16
        Random value: ed17f76500c95219dd01e09d1e63f87b
> HCI Event: Number of Completed Packets (0x13) plen 5    #207 [hci1] 15.019732
        Num handles: 1
        Handle: 3441 Address: DF:A9:FF:F6:B1:1A (OUI DF-A9-FF)
        Count: 1
        #206: len 21 (0 Kb/s)
        Latency: 172 msec (66-174 msec ~165 msec)
> ACL Data RX: Handle 3441 flags 0x02 dlen 21             #208 [hci1] 15.107624
      SMP: Pairing Confirm (0x03) len 16
        Confim value: de98741e32e088687ffc57c96a50c5dc
< HCI Command: Host Number of Com.. (0x03|0x0035) plen 5  #209 [hci1] 15.126620
        Num handles: 1
        Handle: 3441 Address: DF:A9:FF:F6:B1:1A (OUI DF-A9-FF)
        Count: 1
< ACL Data TX: Handle 3441 flags 0x00 dlen 21             #210 [hci1] 15.126788
      SMP: Pairing Confirm (0x03) len 16
        Confim value: 48970cefadbe5fb223696039e7b62663
> HCI Event: Number of Completed Packets (0x13) plen 5    #211 [hci1] 15.282517
        Num handles: 1
        Handle: 3441 Address: DF:A9:FF:F6:B1:1A (OUI DF-A9-FF)
        Count: 1
        #210: len 21 (1 Kb/s)
        Latency: 155 msec (66-174 msec ~160 msec)
> ACL Data RX: Handle 3441 flags 0x02 dlen 21             #212 [hci1] 15.282848
      SMP: Pairing Random (0x04) len 16
        Random value: 89d31e259d34262c0000000000000000
< HCI Command: Host Number of Com.. (0x03|0x0035) plen 5  #213 [hci1] 15.286223
        Num handles: 1
        Handle: 3441 Address: DF:A9:FF:F6:B1:1A (OUI DF-A9-FF)
        Count: 1
< ACL Data TX: Handle 3441 flags 0x00 dlen 21             #214 [hci1] 15.286351
      SMP: Pairing Random (0x04) len 16
        Random value: 81d35d47e1f6006d79c974bd9d9e1ee3
> HCI Event: Number of Completed Packets (0x13) plen 5    #215 [hci1] 15.457260
        Num handles: 1
        Handle: 3441 Address: DF:A9:FF:F6:B1:1A (OUI DF-A9-FF)
        Count: 1
        #214: len 21 (0 Kb/s)
        Latency: 170 msec (66-174 msec ~165 msec)
> ACL Data RX: Handle 3441 flags 0x02 dlen 21             #216 [hci1] 15.545067
      SMP: Pairing Confirm (0x03) len 16
        Confim value: 03af3ce03666c22f01cd325cd58196f7
< HCI Command: Host Number of Com.. (0x03|0x0035) plen 5  #217 [hci1] 15.546594
        Num handles: 1
        Handle: 3441 Address: DF:A9:FF:F6:B1:1A (OUI DF-A9-FF)
        Count: 1
< ACL Data TX: Handle 3441 flags 0x00 dlen 21             #218 [hci1] 15.546688
      SMP: Pairing Confirm (0x03) len 16
        Confim value: 25a7c9f872f2bb4d5100d8ee366e1d10
> HCI Event: Number of Completed Packets (0x13) plen 5    #219 [hci1] 15.719966
        Num handles: 1
        Handle: 3441 Address: DF:A9:FF:F6:B1:1A (OUI DF-A9-FF)
        Count: 1
        #218: len 21 (0 Kb/s)
        Latency: 173 msec (66-174 msec ~169 msec)
> ACL Data RX: Handle 3441 flags 0x02 dlen 21             #220 [hci1] 15.720336
      SMP: Pairing Random (0x04) len 16
        Random value: 3d2a3305caf116040000000000000000
< HCI Command: Host Number of Com.. (0x03|0x0035) plen 5  #221 [hci1] 15.726906
        Num handles: 1
        Handle: 3441 Address: DF:A9:FF:F6:B1:1A (OUI DF-A9-FF)
        Count: 1
< ACL Data TX: Handle 3441 flags 0x00 dlen 21             #222 [hci1] 15.727051
      SMP: Pairing Random (0x04) len 16
        Random value: e7f7e0c2476823e41736a7e381bafb7c
> HCI Event: Number of Completed Packets (0x13) plen 5    #223 [hci1] 15.894761
        Num handles: 1
        Handle: 3441 Address: DF:A9:FF:F6:B1:1A (OUI DF-A9-FF)
        Count: 1
        #222: len 21 (1 Kb/s)
        Latency: 167 msec (66-174 msec ~168 msec)
> ACL Data RX: Handle 3441 flags 0x02 dlen 21             #224 [hci1] 15.982639
      SMP: Pairing Confirm (0x03) len 16
        Confim value: b4ec3c4817ac5739946beb3e8f39db0e
< HCI Command: Host Number of Com.. (0x03|0x0035) plen 5  #225 [hci1] 15.986472
        Num handles: 1
        Handle: 3441 Address: DF:A9:FF:F6:B1:1A (OUI DF-A9-FF)
        Count: 1
< ACL Data TX: Handle 3441 flags 0x00 dlen 21             #226 [hci1] 15.986541
      SMP: Pairing Confirm (0x03) len 16
        Confim value: e9ac53bf5111240341c62c3b7aec687f
> HCI Event: Number of Completed Packets (0x13) plen 5    #227 [hci1] 16.157490
        Num handles: 1
        Handle: 3441 Address: DF:A9:FF:F6:B1:1A (OUI DF-A9-FF)
        Count: 1
        #226: len 21 (0 Kb/s)
        Latency: 170 msec (66-174 msec ~169 msec)
> ACL Data RX: Handle 3441 flags 0x02 dlen 21             #228 [hci1] 16.157867
      SMP: Pairing Random (0x04) len 16
        Random value: 2d433eda6915f9860000000000000000
