Bluetooth monitor ver 5.72
= Note: Linux version 6.14.0-36-generic (x86_64)                       0.289879
= Note: Bluetooth subsystem version 2.22                               0.289881
= New Index: 00:00:00:00:00:00 (Primary,UART,hci1)              [hci1] 0.289882
= New Index: 48:5F:99:8E:E0:64 (Primary,USB,hci0)               [hci0] 0.289882
= Open Index: 00:00:00:00:00:00                                 [hci1] 0.303190
= Index Info: 00:00:00:00:00:00 (Nordic Semiconductor ASA)      [hci1] 0.303195
@ USER Open: main (privileged) version 2.22            {0x0001} [hci1] 0.303197
< HCI Command: Reset (0x03|0x0003) plen 0                    #1 [hci1] 0.303482
> HCI Event: Command Complete (0x0e) plen 4                  #2 [hci1] 0.304043
      Reset (0x03|0x0003) ncmd 1
        Status: Success (0x00)
< HCI Command: Read Local Supported... (0x04|0x0003) plen 0  #3 [hci1] 0.323109
> HCI Event: Command Complete (0x0e) plen 12                 #4 [hci1] 0.323578
      Read Local Supported Features (0x04|0x0003) ncmd 1
        Status: Success (0x00)
        Features: 0x00 0x00 0x00 0x00 0x60 0x00 0x00 0x00
          BR/EDR Not Supported
          LE Supported (Controller)
< HCI Command: Read Local Version In.. (0x04|0x0001) plen 0  #5 [hci1] 0.343117
> HCI Event: Command Complete (0x0e) plen 12                 #6 [hci1] 0.343659
      Read Local Version Information (0x04|0x0001) ncmd 1
        Status: Success (0x00)
        HCI version: Reserved (0x0f) - Revision 12393 (0x3069)
        LMP version: Reserved (0x0f) - Subversion 12393 (0x3069)
        Manufacturer: Nordic Semiconductor ASA (89)
< HCI Command: Read Local Supported... (0x04|0x0002) plen 0  #7 [hci1] 0.363121
> HCI Event: Command Complete (0x0e) plen 68                 #8 [hci1] 0.364251
      Read Local Supported Commands (0x04|0x0002) ncmd 1
        Status: Success (0x00)
        Commands: 119 entries
          Disconnect (Octet 0 - Bit 5)
          Read Remote Version Information (Octet 2 - Bit 7)
          Set Event Mask (Octet 5 - Bit 6)
          Reset (Octet 5 - Bit 7)
          Read Connection Accept Timeout (Octet 7 - Bit 2)
          Write Connection Accept Timeout (Octet 7 - Bit 3)
          Read Transmit Power Level (Octet 10 - Bit 2)
          Set Controller To Host Flow Control (Octet 10 - Bit 5)
          Host Buffer Size (Octet 10 - Bit 6)
          Host Number of Completed Packets (Octet 10 - Bit 7)
          Read Local Version Information (Octet 14 - Bit 3)
          Read Local Supported Features (Octet 14 - Bit 5)
          Read BD ADDR (Octet 15 - Bit 1)
          Read RSSI (Octet 15 - Bit 5)
          Set Event Mask Page 2 (Octet 22 - Bit 2)
          LE Set Event Mask (Octet 25 - Bit 0)
          LE Read Buffer Size (Octet 25 - Bit 1)
          LE Read Local Supported Features (Octet 25 - Bit 2)
          LE Set Random Address (Octet 25 - Bit 4)
          LE Set Advertising Parameters (Octet 25 - Bit 5)
          LE Read Advertising Channel TX Power (Octet 25 - Bit 6)
          LE Set Advertising Data (Octet 25 - Bit 7)
          LE Set Scan Response Data (Octet 26 - Bit 0)
          LE Set Advertise Enable (Octet 26 - Bit 1)
          LE Set Scan Parameters (Octet 26 - Bit 2)
          LE Set Scan Enable (Octet 26 - Bit 3)
          LE Create Connection (Octet 26 - Bit 4)
          LE Create Connection Cancel (Octet 26 - Bit 5)
          LE Read Accept List Size (Octet 26 - Bit 6)
          LE Clear Accept List (Octet 26 - Bit 7)
          LE Add Device To Accept List (Octet 27 - Bit 0)
          LE Remove Device From Accept List (Octet 27 - Bit 1)
          LE Connection Update (Octet 27 - Bit 2)
          LE Set Host Channel Classification (Octet 27 - Bit 3)
          LE Read Channel Map (Octet 27 - Bit 4)
          LE Read Remote Used Features (Octet 27 - Bit 5)
          LE Encrypt (Octet 27 - Bit 6)
          LE Rand (Octet 27 - Bit 7)
          LE Start Encryption (Octet 28 - Bit 0)
          LE Long Term Key Request Reply (Octet 28 - Bit 1)
          LE Long Term Key Request Neg Reply (Octet 28 - Bit 2)
          LE Read Supported States (Octet 28 - Bit 3)
          LE Receiver Test (Octet 28 - Bit 4)
          LE Transmitter Test (Octet 28 - Bit 5)
          LE Test End (Octet 28 - Bit 6)
          Read Authenticated Payload Timeout (Octet 32 - Bit 4)
          Write Authenticated Payload Timeout (Octet 32 - Bit 5)
          LE Set Data Length (Octet 33 - Bit 6)
          LE Read Suggested Default Data Length (Octet 33 - Bit 7)
          LE Write Suggested Default Data Length (Octet 34 - Bit 0)
          LE Add Device To Resolving List (Octet 34 - Bit 3)
          LE Remove Device From Resolving List (Octet 34 - Bit 4)
          LE Clear Resolving List (Octet 34 - Bit 5)
          LE Read Resolving List Size (Octet 34 - Bit 6)
          LE Set Address Resolution Enable (Octet 35 - Bit 1)
          LE Set Resolvable Private Address Timeout (Octet 35 - Bit 2)
          LE Read Maximum Data Length (Octet 35 - Bit 3)
          LE Read PHY (Octet 35 - Bit 4)
          LE Set Default PHY (Octet 35 - Bit 5)
          LE Set PHY (Octet 35 - Bit 6)
          LE Enhanced Receiver Test (Octet 35 - Bit 7)
          LE Enhanced Transmitter Test (Octet 36 - Bit 0)
          LE Set Advertising Set Random Address (Octet 36 - Bit 1)
          LE Set Extended Advertising Parameters (Octet 36 - Bit 2)
          LE Set Extended Advertising Data (Octet 36 - Bit 3)
          LE Set Extended Scan Response Data (Octet 36 - Bit 4)
          LE Set Extended Advertising Enable (Octet 36 - Bit 5)
          LE Read Maximum Advertising Data Length (Octet 36 - Bit 6)
          LE Read Number of Supported Advertising Sets (Octet 36 - Bit 7)
          LE Remove Advertising Set (Octet 37 - Bit 0)
          LE Clear Advertising Sets (Octet 37 - Bit 1)
          LE Set Periodic Advertising Parameters (Octet 37 - Bit 2)
          LE Set Periodic Advertising Data (Octet 37 - Bit 3)
          LE Set Periodic Advertising Enable (Octet 37 - Bit 4)
          LE Set Extended Scan Parameters (Octet 37 - Bit 5)
          LE Set Extended Scan Enable (Octet 37 - Bit 6)
          LE Extended Create Connection (Octet 37 - Bit 7)
          LE Periodic Advertising Create Sync (Octet 38 - Bit 0)
          LE Periodic Advertising Create Sync Cancel (Octet 38 - Bit 1)
          LE Periodic Advertising Terminate Sync (Octet 38 - Bit 2)
          LE Add Device To Periodic Advertiser List (Octet 38 - Bit 3)
          LE Remove Device From Periodic Advertiser List (Octet 38 - Bit 4)
          LE Clear Periodic Advertiser List (Octet 38 - Bit 5)
          LE Read Periodic Advertiser List Size (Octet 38 - Bit 6)
          LE Read Transmit Power (Octet 38 - Bit 7)
          LE Read RF Path Compensation (Octet 39 - Bit 0)
          LE Write RF Path Compensation (Octet 39 - Bit 1)
          LE Set Privacy Mode (Octet 39 - Bit 2)
          LE Periodic Advertising Receive Enable (Octet 40 - Bit 5)
          LE Periodic Advertising Sync Transfer (Octet 40 - Bit 6)
          LE Periodic Advertising Set Info Transfer (Octet 40 - Bit 7)
          LE Periodic Advertising Sync Transfer Parameters (Octet 41 - Bit 0)
          LE Set Default Periodic Advertisng Sync Transfer Parameters (Octet 41 - Bit 1)
          LE Read Buffer v2 (Octet 41 - Bit 5)
          LE Read ISO TX Sync (Octet 41 - Bit 6)
          LE Set Connected Isochronous Group Parameters (Octet 41 - Bit 7)
          LE Set Connected Isochronous Group Parameters Test (Octet 42 - Bit 0)
          LE Create Connected Isochronous Stream (Octet 42 - Bit 1)
          LE Remove Connected Isochronous Group (Octet 42 - Bit 2)
          LE Accept Connected Isochronous Stream Request (Octet 42 - Bit 3)
          LE Reject Connected Isochronous Stream Request (Octet 42 - Bit 4)
          LE Create Broadcast Isochronous Group (Octet 42 - Bit 5)
          LE Create Broadcast Isochronous Group Test (Octet 42 - Bit 6)
          LE Terminate Broadcast Isochronous Group (Octet 42 - Bit 7)
          LE Broadcast Isochronous Group Create Sync (Octet 43 - Bit 0)
          LE Broadcast Isochronous Group Terminate Sync (Octet 43 - Bit 1)
          LE Request Peer SCA (Octet 43 - Bit 2)
          LE Setup Isochronous Data Path (Octet 43 - Bit 3)
          LE Remove Isochronous Data Path (Octet 43 - Bit 4)
          LE Isochronous Transmit Test (Octet 43 - Bit 5)
          LE Isochronous Receive Test (Octet 43 - Bit 6)
          LE Isochronous Read Test Counters (Octet 43 - Bit 7)
          LE Isochronous Read Test Counters (Octet 44 - Bit 0)
          LE Set Host Feature (Octet 44 - Bit 1)
          Octet 44 - Bit 2 
          Octet 45 - Bit 6 
          Octet 46 - Bit 0 
          Octet 46 - Bit 1 
          Octet 46 - Bit 2 
< HCI Command: Host Buffer Size (0x03|0x0033) plen 7         #9 [hci1] 0.383125
        ACL MTU: 255  ACL max packet: 16
        SCO MTU: 0    SCO max packet: 0
> HCI Event: Command Complete (0x0e) plen 4                 #10 [hci1] 0.383646
      Host Buffer Size (0x03|0x0033) ncmd 1
        Status: Success (0x00)
< HCI Command: Set Controller To Ho.. (0x03|0x0031) plen 1  #11 [hci1] 0.403112
        Flow control: ACL Data Packets (0x01)
> HCI Event: Command Complete (0x0e) plen 4                 #12 [hci1] 0.403571
      Set Controller To Host Flow Control (0x03|0x0031) ncmd 1
        Status: Success (0x00)
< HCI Command: LE Read Local Suppor.. (0x08|0x0003) plen 0  #13 [hci1] 0.423113
> HCI Event: Command Complete (0x0e) plen 12                #14 [hci1] 0.423646
      LE Read Local Supported Features (0x08|0x0003) ncmd 1
        Status: Success (0x00)
        Features: 0xfd 0x79 0x00 0xf7 0x30 0x01 0x00 0x00
          LE Encryption
          Extended Reject Indication
          Peripheral-initiated Features Exchange
          LE Ping
          LE Data Packet Length Extension
          LL Privacy
          Extended Scanner Filter Policies
          LE 2M PHY
          LE Coded PHY
          LE Extended Advertising
          LE Periodic Advertising
          Channel Selection Algorithm #2
          Periodic Advertising Sync Transfer - Sender
          Periodic Advertising Sync Transfer - Recipient
          Sleep Clock Accuracy Updates
          Connected Isochronous Stream - Central
          Connected Isochronous Stream - Peripheral
          Isochronous Broadcaster
          Synchronized Receiver
          Periodic Advertising ADI support
          Connection Subrating
          Unknown features (0x0000010000000000)
< HCI Command: LE Set Host Feature (0x08|0x0074) plen 2     #15 [hci1] 0.443127
        Bit Number: 32
          Connected Isochronous Stream (Host Support)
        Bit Value: 1
> HCI Event: Command Complete (0x0e) plen 4                 #16 [hci1] 0.443638
      LE Set Host Feature (0x08|0x0074) ncmd 1
        Status: Success (0x00)
< HCI Command: LE Read Buffer v2 (0x08|0x0060) plen 0       #17 [hci1] 0.463113
> HCI Event: Command Complete (0x0e) plen 10                #18 [hci1] 0.463624
      LE Read Buffer v2 (0x08|0x0060) ncmd 1
        Status: Success (0x00)
        ACL MTU: 27
        ACL max packet: 3
        ISO MTU: 318
        ISO max packet: 3
< HCI Command: LE Read Maximum Adve.. (0x08|0x003a) plen 0  #19 [hci1] 0.483140
> HCI Event: Command Complete (0x0e) plen 6                 #20 [hci1] 0.483621
      LE Read Maximum Advertising Data Length (0x08|0x003a) ncmd 1
        Status: Success (0x00)
        Max length: 1650
< HCI Command: LE Read Supported St.. (0x08|0x001c) plen 0  #21 [hci1] 0.503134
> HCI Event: Command Complete (0x0e) plen 12                #22 [hci1] 0.503715
      LE Read Supported States (0x08|0x001c) ncmd 1
        Status: Success (0x00)
        States: 0x000003ff3e0306ff
          Non-connectable Advertising State
          Scannable Advertising State
          Connectable Advertising State
          High Duty Cycle Directed Advertising State
          Passive Scanning State
          Active Scanning State
          Initiating State
            and Connection State (Central Role)
          Connection State (Peripheral Role)
          Scannable Advertising State
            and Passive Scanning State
          Connectable Advertising State
            and Passive Scanning State
          Non-connectable Advertising State
            and Initiating State
          Scannable Advertising State
            and Initiating State
          Active Scanning State
            and Connection State (Central Role)
          Passive Scanning State
            and Connection State (Peripheral Role)
          Active Scanning State
            and Connection State (Peripheral Role)
          Initiating State
            and Connection State (Central Role)
            and Central Role & Central Role
          Low Duty Cycle Directed Advertising State
          Connectable Advertising State
            and Initiating State
            and Central Role & Peripheral Role
          High Duty Cycle Directed Advertising State
            and Initiating State
            and Central Role & Peripheral Role
          Low Duty Cycle Directed Advertising State
            and Initiating State
            and Central Role & Peripheral Role
          Connectable Advertising State
            and Connection State (Central Role)
            and Central Role & Peripheral Role
          High Duty Cycle Directed Advertising State
            and Connection State (Central Role)
            and Central Role & Peripheral Role
          Low Duty Cycle Directed Advertising State
            and Connection State (Central Role)
            and Central Role & Peripheral Role
          Connectable Advertising State
            and Connection State (Peripheral Role)
            and Central Role & Peripheral Role
          High Duty Cycle Directed Advertising State
            and Connection State (Peripheral Role)
            and Peripheral Role & Peripheral Role
          Low Duty Cycle Directed Advertising State
            and Connection State (Peripheral Role)
            and Peripheral Role & Peripheral Role
          Initiating State
            and Connection State (Peripheral Role)
            and Central Role & Peripheral Role
< HCI Command: LE Read Maximum Data.. (0x08|0x002f) plen 0  #23 [hci1] 0.523079
> HCI Event: Command Complete (0x0e) plen 12                #24 [hci1] 0.523633
      LE Read Maximum Data Length (0x08|0x002f) ncmd 1
        Status: Success (0x00)
        Max TX octets: 251
        Max TX time: 2704
        Max RX octets: 251
        Max RX time: 2704
< HCI Command: LE Write Suggested D.. (0x08|0x0024) plen 4  #25 [hci1] 0.543128
        TX octets: 251
        TX time: 2704
> HCI Event: Command Complete (0x0e) plen 4                 #26 [hci1] 0.543622
      LE Write Suggested Default Data Length (0x08|0x0024) ncmd 1
        Status: Success (0x00)
< HCI Command: LE Read Resolving Li.. (0x08|0x002a) plen 0  #27 [hci1] 0.563123
> HCI Event: Command Complete (0x0e) plen 5                 #28 [hci1] 0.563536
      LE Read Resolving List Size (0x08|0x002a) ncmd 1
        Status: Success (0x00)
        Size: 8
< HCI Command: LE Set Event Mask (0x08|0x0001) plen 8       #29 [hci1] 0.583116
        Mask: 0x000002023f87fa5e
          LE Advertising Report
          LE Connection Update Complete
          LE Read Remote Used Features Complete
          LE Long Term Key Request
          LE Data Length Change
          LE Enhanced Connection Complete
          LE PHY Update Complete
          LE Extended Advertising Report
          LE Periodic Advertising Sync Established
          LE Periodic Advertising Report
          LE Periodic Advertising Sync Lost
          LE Extended Scan Timeout
          LE Extended Advertising Set Terminated
          LE Scan Request Received
          LE Periodic Advertising Sync Transfer Rvc
          LE CIS Established
          LE CIS Request
          LE Create BIG Complete
          LE Terminate BIG Complete
          LE BIG Sync Estabilished Complete
          LE BIG Sync Lost
          LE BIG Info Advertising Report
          Unknown mask (0x0000020000000000)
> HCI Event: Command Complete (0x0e) plen 4                 #30 [hci1] 0.583774
      LE Set Event Mask (0x08|0x0001) ncmd 1
        Status: Success (0x00)
< HCI Command: Set Event Mask (0x03|0x0001) plen 8          #31 [hci1] 0.603126
        Mask: 0x2000800002008890
          Disconnection Complete
          Encryption Change
          Read Remote Version Information Complete
          Hardware Error
          Data Buffer Overflow
          Encryption Key Refresh Complete
          LE Meta
> HCI Event: Command Complete (0x0e) plen 4                 #32 [hci1] 0.603642
      Set Event Mask (0x03|0x0001) ncmd 1
        Status: Success (0x00)
< HCI Command: Read BD ADDR (0x04|0x0009) plen 0            #33 [hci1] 0.623125
> HCI Event: Command Complete (0x0e) plen 10                #34 [hci1] 0.623683
      Read BD ADDR (0x04|0x0009) ncmd 1
        Status: Success (0x00)
        Address: 00:00:00:00:00:00 (OUI 00-00-00)
< HCI Command: LE Set Random Address (0x08|0x0005) plen 6   #35 [hci1] 0.643133
        Address: D5:B6:CC:31:DB:3B (Static)
> HCI Event: Command Complete (0x0e) plen 4                 #36 [hci1] 0.643619
      LE Set Random Address (0x08|0x0005) ncmd 1
        Status: Success (0x00)
< HCI Command: LE Set Extended Adv.. (0x08|0x0036) plen 25  #37 [hci1] 4.923219
        Handle: 0x00
        Properties: 0x0013
          Connectable
          Scannable
          Use legacy advertising PDUs: ADV_IND
        Min advertising interval: 100.000 msec (0x00a0)
        Max advertising interval: 150.000 msec (0x00f0)
        Channel map: 37, 38, 39 (0x07)
        Own address type: Random (0x01)
        Peer address type: Public (0x00)
        Peer address: 00:00:00:00:00:00 (OUI 00-00-00)
        Filter policy: Allow Scan Request from Any, Allow Connect Request from Any (0x00)
        TX power: Host has no preference (0x7f)
        Primary PHY: LE 1M (0x01)
        Secondary max skip: 0x00
        Secondary PHY: LE 1M (0x01)
        SID: 0x00
        Scan request notifications: Disabled (0x00)
> HCI Event: Command Complete (0x0e) plen 5                 #38 [hci1] 4.924068
      LE Set Extended Advertising Parameters (0x08|0x0036) ncmd 1
        Status: Success (0x00)
        TX power (selected): 0 dbm (0x00)
< HCI Command: LE Set Advertising S.. (0x08|0x0035) plen 7  #39 [hci1] 4.943221
        Advertising handle: 0x00
        Advertising random address: D5:B6:CC:31:DB:3B (Static)
> HCI Event: Command Complete (0x0e) plen 4                 #40 [hci1] 4.943755
      LE Set Advertising Set Random Address (0x08|0x0035) ncmd 1
        Status: Success (0x00)
< HCI Command: LE Set Extended Adv.. (0x08|0x0037) plen 22  #41 [hci1] 4.963235
        Handle: 0x00
        Operation: Complete extended advertising data (0x03)
        Fragment preference: Minimize fragmentation (0x01)
        Data length: 0x12
        Flags: 0x06
          LE General Discoverable Mode
          BR/EDR Not Supported
        Name (complete): Tester_F6B11A
> HCI Event: Command Complete (0x0e) plen 4                 #42 [hci1] 4.963930
      LE Set Extended Advertising Data (0x08|0x0037) ncmd 1
        Status: Success (0x00)
< HCI Command: LE Set Extended Scan.. (0x08|0x0038) plen 4  #43 [hci1] 4.983116
        Handle: 0x00
        Operation: Complete scan response data (0x03)
        Fragment preference: Minimize fragmentation (0x01)
        Data length: 0x00
> HCI Event: Command Complete (0x0e) plen 4                 #44 [hci1] 4.983613
      LE Set Extended Scan Response Data (0x08|0x0038) ncmd 1
        Status: Success (0x00)
< HCI Command: LE Set Extended Adve.. (0x08|0x0039) plen 6  #45 [hci1] 5.003179
        Extended advertising: Enabled (0x01)
        Number of sets: 1 (0x01)
        Entry 0
          Handle: 0x00
          Duration: 0 ms (0x00)
          Max ext adv events: 0
> HCI Event: Command Complete (0x0e) plen 4                 #46 [hci1] 5.003723
      LE Set Extended Advertising Enable (0x08|0x0039) ncmd 1
        Status: Success (0x00)
> HCI Event: LE Meta Event (0x3e) plen 31                   #47 [hci1] 5.328059
      LE Enhanced Connection Complete (0x0a)
        Status: Success (0x00)
        Handle: 1335
        Role: Peripheral (0x01)
        Peer address type: Public (0x00)
        Peer address: DF:A9:FF:F6:B1:1A (OUI DF-A9-FF)
        Local resolvable private address: 00:00:00:00:00:00 (Non-Resolvable)
        Peer resolvable private address: 00:00:00:00:00:00 (Non-Resolvable)
        Connection interval: 87.50 msec (0x0046)
        Connection latency: 0 (0x0000)
        Supervision timeout: 20000 msec (0x07d0)
        Central clock accuracy: 0x01
> HCI Event: LE Meta Event (0x3e) plen 6                    #48 [hci1] 5.328143
      LE Advertising Set Terminated (0x12)
        Status: Success (0x00)
        Handle: 0
        Connection handle: 1335
        Number of completed extended advertising events: 0
< HCI Command: LE Read Remote Used... (0x08|0x0016) plen 2  #49 [hci1] 5.343336
        Handle: 1335 Address: DF:A9:FF:F6:B1:1A (OUI DF-A9-FF)
> HCI Event: Command Status (0x0f) plen 4                   #50 [hci1] 5.343859
      LE Read Remote Used Features (0x08|0x0016) ncmd 1
        Status: Success (0x00)
> HCI Event: LE Meta Event (0x3e) plen 12                   #51 [hci1] 5.591914
      LE Read Remote Used Features (0x04)
        Status: Success (0x00)
        Handle: 1335 Address: DF:A9:FF:F6:B1:1A (OUI DF-A9-FF)
        Features: 0x2d 0x49 0x00 0xf7 0x67 0xd8 0x00 0x00
          LE Encryption
          Extended Reject Indication
          Peripheral-initiated Features Exchange
          LE Data Packet Length Extension
          LE 2M PHY
          LE Coded PHY
          Channel Selection Algorithm #2
          Periodic Advertising Sync Transfer - Sender
          Periodic Advertising Sync Transfer - Recipient
          Sleep Clock Accuracy Updates
          Connected Isochronous Stream - Central
          Connected Isochronous Stream - Peripheral
          Isochronous Broadcaster
          Synchronized Receiver
          Connected Isochronous Stream (Host Support)
          LE Power Control Request
          LE Power Control Request
          Connection Subrating
          Connection Subrating (Host Support)
          Unknown features (0x0000d80000000000)
< ACL Data TX: Handle 1335 flags 0x00 dlen 16              #52 [hci1] 10.353449
      LE L2CAP: Connection Parameter Update Request (0x12) ident 1 len 8
        Min interval: 24
        Max interval: 40
        Peripheral latency: 0
        Timeout multiplier: 42
> HCI Event: Number of Completed Packets (0x13) plen 5     #53 [hci1] 10.491460
        Num handles: 1
        Handle: 1335 Address: DF:A9:FF:F6:B1:1A (OUI DF-A9-FF)
        Count: 1
        #52: len 16 (0 Kb/s)
        Latency: 138 msec (138-138 msec ~138 msec)
> ACL Data RX: Handle 1335 flags 0x02 dlen 10              #54 [hci1] 10.491750
      LE L2CAP: Connection Parameter Update Response (0x13) ident 1 len 2
        Result: Connection Parameters accepted (0x0000)
< HCI Command: Host Number of Comp.. (0x03|0x0035) plen 5  #55 [hci1] 10.503959
        Num handles: 1
        Handle: 1335 Address: DF:A9:FF:F6:B1:1A (OUI DF-A9-FF)
        Count: 1
> ACL Data RX: Handle 1335 flags 0x02 dlen 11              #56 [hci1] 13.203906
      SMP: Pairing Request (0x01) len 6
        IO capability: KeyboardDisplay (0x04)
        OOB data: Authentication data not present (0x00)
        Authentication requirement: Bonding, No MITM, Legacy, No Keypresses (0x01)
        Max encryption key size: 16
        Initiator key distribution: EncKey IdKey Sign (0x07)
        Responder key distribution: EncKey IdKey Sign (0x07)
< HCI Command: Host Number of Comp.. (0x03|0x0035) plen 5  #57 [hci1] 13.223292
        Num handles: 1
        Handle: 1335 Address: DF:A9:FF:F6:B1:1A (OUI DF-A9-FF)
        Count: 1
< ACL Data TX: Handle 1335 flags 0x00 dlen 11              #58 [hci1] 13.223354
      SMP: Pairing Response (0x02) len 6
        IO capability: NoInputNoOutput (0x03)
        OOB data: Authentication data not present (0x00)
        Authentication requirement: Bonding, No MITM, Legacy, No Keypresses (0x01)
        Max encryption key size: 16
        Initiator key distribution: EncKey IdKey (0x03)
        Responder key distribution: EncKey (0x01)
> HCI Event: Number of Completed Packets (0x13) plen 5     #59 [hci1] 13.379008
        Num handles: 1
        Handle: 1335 Address: DF:A9:FF:F6:B1:1A (OUI DF-A9-FF)
        Count: 1
        #58: len 11 (0 Kb/s)
        Latency: 155 msec (138-155 msec ~146 msec)
> ACL Data RX: Handle 1335 flags 0x02 dlen 21              #60 [hci1] 13.379272
      SMP: Pairing Confirm (0x03) len 16
        Confim value: 7b5736550260d430b49f33b0f33faa25
< HCI Command: Host Number of Comp.. (0x03|0x0035) plen 5  #61 [hci1] 13.383564
        Num handles: 1
        Handle: 1335 Address: DF:A9:FF:F6:B1:1A (OUI DF-A9-FF)
        Count: 1
< ACL Data TX: Handle 1335 flags 0x00 dlen 21              #62 [hci1] 13.383612
      SMP: Pairing Confirm (0x03) len 16
        Confim value: da9c45dd7031e04493b907413e4a0ff7
> HCI Event: Number of Completed Packets (0x13) plen 5     #63 [hci1] 13.553963
        Num handles: 1
        Handle: 1335 Address: DF:A9:FF:F6:B1:1A (OUI DF-A9-FF)
        Count: 1
        #62: len 21 (0 Kb/s)
        Latency: 170 msec (138-170 msec ~158 msec)
> ACL Data RX: Handle 1335 flags 0x02 dlen 21              #64 [hci1] 13.554289
      SMP: Pairing Random (0x04) len 16
        Random value: 5eb9ec33d0fb287d0000000000000000
< HCI Command: Host Number of Comp.. (0x03|0x0035) plen 5  #65 [hci1] 13.564003
        Num handles: 1
        Handle: 1335 Address: DF:A9:FF:F6:B1:1A (OUI DF-A9-FF)
        Count: 1
< ACL Data TX: Handle 1335 flags 0x00 dlen 21              #66 [hci1] 13.564108
      SMP: Pairing Random (0x04) len 16
        Random value: 8e6108f966a694cbe26df70bb96773e6
> HCI Event: Number of Completed Packets (0x13) plen 5     #67 [hci1] 13.728717
        Num handles: 1
        Handle: 1335 Address: DF:A9:FF:F6:B1:1A (OUI DF-A9-FF)
        Count: 1
        #66: len 21 (1 Kb/s)
        Latency: 164 msec (138-170 msec ~161 msec)
> HCI Event: LE Meta Event (0x3e) plen 13                  #68 [hci1] 13.816788
      LE Long Term Key Request (0x05)
        Handle: 1335 Address: DF:A9:FF:F6:B1:1A (OUI DF-A9-FF)
        Random number: 0x0000000000000000
        Encrypted diversifier: 0x0000
< HCI Command: LE Long Term Key R.. (0x08|0x001a) plen 18  #69 [hci1] 13.823409
        Handle: 1335 Address: DF:A9:FF:F6:B1:1A (OUI DF-A9-FF)
        Long term key: 5c46da6d52a3133d2644c2a5000fff83
> HCI Event: Command Complete (0x0e) plen 6                #70 [hci1] 13.824154
      LE Long Term Key Request Reply (0x08|0x001a) ncmd 1
        Status: Success (0x00)
        Handle: 1335 Address: DF:A9:FF:F6:B1:1A (OUI DF-A9-FF)
> HCI Event: Encryption Change (0x08) plen 4               #71 [hci1] 14.253991
        Status: Success (0x00)
        Handle: 1335 Address: DF:A9:FF:F6:B1:1A (OUI DF-A9-FF)
        Encryption: Enabled with AES-CCM (0x01)
< ACL Data TX: Handle 1335 flags 0x00 dlen 21              #72 [hci1] 14.373714
      SMP: Encryption Information (0x06) len 16
        Long term key: 5da095555cc64d02679f89a05211af56
< ACL Data TX: Handle 1335 flags 0x00 dlen 15              #73 [hci1] 14.373736
      SMP: Central Identification (0x07) len 10
        EDIV: 0x825e
        Rand: 0x84c81ed264dab3d8
> HCI Event: Number of Completed Packets (0x13) plen 5     #74 [hci1] 14.429298
        Num handles: 1
        Handle: 1335 Address: DF:A9:FF:F6:B1:1A (OUI DF-A9-FF)
        Count: 1
        #72: len 21 (3 Kb/s)
        Latency: 55 msec (55-170 msec ~108 msec)
> HCI Event: Number of Completed Packets (0x13) plen 5     #75 [hci1] 14.516575
        Num handles: 1
        Handle: 1335 Address: DF:A9:FF:F6:B1:1A (OUI DF-A9-FF)
        Count: 1
        #73: len 15 (0 Kb/s)
        Latency: 142 msec (55-170 msec ~125 msec)
> ACL Data RX: Handle 1335 flags 0x02 dlen 21              #76 [hci1] 14.516785
      SMP: Encryption Information (0x06) len 16
        Long term key: 797645b24f7cd949d5479ec82b094f11
> ACL Data RX: Handle 1335 flags 0x02 dlen 15              #77 [hci1] 14.517198
      SMP: Central Identification (0x07) len 10
        EDIV: 0x10ff
        Rand: 0xc8f108d2672fc67f
> ACL Data RX: Handle 1335 flags 0x02 dlen 21              #78 [hci1] 14.517781
      SMP: Identity Information (0x08) len 16
        Identity resolving key: d5d57df9de15ef54f97fbc07d1630a70
< HCI Command: Host Number of Comp.. (0x03|0x0035) plen 5  #79 [hci1] 14.523812
        Num handles: 1
        Handle: 1335 Address: DF:A9:FF:F6:B1:1A (OUI DF-A9-FF)
        Count: 1
< HCI Command: Host Number of Comp.. (0x03|0x0035) plen 5  #80 [hci1] 14.523994
        Num handles: 1
        Handle: 1335 Address: DF:A9:FF:F6:B1:1A (OUI DF-A9-FF)
        Count: 1
< HCI Command: Host Number of Comp.. (0x03|0x0035) plen 5  #81 [hci1] 14.524111
        Num handles: 1
        Handle: 1335 Address: DF:A9:FF:F6:B1:1A (OUI DF-A9-FF)
        Count: 1
> ACL Data RX: Handle 1335 flags 0x02 dlen 12              #82 [hci1] 14.603930
      SMP: Identity Address Information (0x09) len 7
        Address: DF:A9:FF:F6:B1:1A (OUI DF-A9-FF)
> ACL Data RX: Handle 1335 flags 0x02 dlen 26              #83 [hci1] 14.604748
      LE L2CAP: Enhanced Credit Connection Request (0x17) ident 1 len 18
        PSM: 39 (0x0027)
        MTU: 64
        MPS: 64
        Credits: 5
        Source CID: 84
        Source CID: 83
        Source CID: 82
        Source CID: 81
        Source CID: 80
< HCI Command: LE Add Device To R.. (0x08|0x0027) plen 39  #84 [hci1] 14.623330
        Address type: Public (0x00)
        Address: DF:A9:FF:F6:B1:1A (OUI DF-A9-FF)
        Peer identity resolving key: d5d57df9de15ef54f97fbc07d1630a70
        Local identity resolving key: 00000000000000000000000000000000
> HCI Event: Command Complete (0x0e) plen 4                #85 [hci1] 14.624270
      LE Add Device To Resolving List (0x08|0x0027) ncmd 1
        Status: Success (0x00)
< HCI Command: LE Set Privacy Mode (0x08|0x004e) plen 8    #86 [hci1] 14.643377
        Peer Identity address type: Public (0x00)
        Peer Identity address: DF:A9:FF:F6:B1:1A (OUI DF-A9-FF)
        Privacy Mode: Use Device Privacy (0x01)
> HCI Event: Command Complete (0x0e) plen 4                #87 [hci1] 14.643962
      LE Set Privacy Mode (0x08|0x004e) ncmd 1
        Status: Success (0x00)
< HCI Command: LE Set Address Reso.. (0x08|0x002d) plen 1  #88 [hci1] 14.663495
        Address resolution: Enabled (0x01)
> HCI Event: Command Complete (0x0e) plen 4                #89 [hci1] 14.663928
      LE Set Address Resolution Enable (0x08|0x002d) ncmd 1
        Status: Success (0x00)
< HCI Command: Host Number of Comp.. (0x03|0x0035) plen 5  #90 [hci1] 14.683529
        Num handles: 1
        Handle: 1335 Address: DF:A9:FF:F6:B1:1A (OUI DF-A9-FF)
        Count: 1
< HCI Command: Host Number of Comp.. (0x03|0x0035) plen 5  #91 [hci1] 14.683895
        Num handles: 1
        Handle: 1335 Address: DF:A9:FF:F6:B1:1A (OUI DF-A9-FF)
        Count: 1
< ACL Data TX: Handle 1335 flags 0x00 dlen 26              #92 [hci1] 14.684041
      LE L2CAP: Enhanced Credit Connection Response (0x18) ident 1 len 18
        MTU: 249
        MPS: 251
        Credits: 1
        Result: Connection successful (0x0000)
        Destination CID: 64
        Destination CID: 65
        Destination CID: 66
        Destination CID: 67
        Destination CID: 68
> HCI Event: Number of Completed Packets (0x13) plen 5     #93 [hci1] 14.778705
        Num handles: 1
        Handle: 1335 Address: DF:A9:FF:F6:B1:1A (OUI DF-A9-FF)
        Count: 1
        #92: len 26 (2 Kb/s)
        Latency: 94 msec (55-170 msec ~110 msec)
< ACL Data TX: Handle 1335 flags 0x00 dlen 13              #94 [hci1] 17.433859
      Channel: 80 len 9 sdu 7 [PSM 39 mode Enhanced Credit (0x81)] {chan 4}
      ATT: Read By Type Request (0x08) len 6
        Handle range: 0x0210-0x0217
        Attribute type: Characteristic (0x2803)
> HCI Event: Number of Completed Packets (0x13) plen 5     #95 [hci1] 17.578886
        Num handles: 1
        Handle: 1335 Address: DF:A9:FF:F6:B1:1A (OUI DF-A9-FF)
        Count: 1
        #94: len 13 (0 Kb/s)
        Latency: 145 msec (55-170 msec ~127 msec)
        Channel: 80 [PSM 39 mode Enhanced Credit (0x81)] {chan 4}
        Channel Latency: 145 msec (145-145 msec ~145 msec)
> ACL Data RX: Handle 1335 flags 0x02 dlen 27              #96 [hci1] 17.579270
> ACL Data RX: Handle 1335 flags 0x01 dlen 2               #97 [hci1] 17.579349
      Channel: 68 len 25 sdu 23 [PSM 39 mode Enhanced Credit (0x81)] {chan 4}
      ATT: Read By Type Response (0x09) len 22
        Attribute data length: 7
        Attribute data list: 3 entries
        Handle: 0x0211
        Value: 1212022b2a
            Properties: 0x12
              Read (0x02)
              Notify (0x10)
            Value Handle: 0x0212
            Value UUID: Current Time (0x2a2b)
        Handle: 0x0214
        Value: 0215020f2a
            Properties: 0x02
              Read (0x02)
            Value Handle: 0x0215
            Value UUID: Local Time Information (0x2a0f)
        Handle: 0x0216
        Value: 021702142a
            Properties: 0x02
              Read (0x02)
            Value Handle: 0x0217
            Value UUID: Reference Time Information (0x2a14)
< HCI Command: Host Number of Comp.. (0x03|0x0035) plen 5  #98 [hci1] 17.583341
        Num handles: 1
        Handle: 1335 Address: DF:A9:FF:F6:B1:1A (OUI DF-A9-FF)
        Count: 1
< HCI Command: Host Number of Comp.. (0x03|0x0035) plen 5  #99 [hci1] 17.583450
        Num handles: 1
        Handle: 1335 Address: DF:A9:FF:F6:B1:1A (OUI DF-A9-FF)
        Count: 1
< ACL Data TX: Handle 1335 flags 0x00 dlen 13             #100 [hci1] 17.583511
      Channel: 80 len 9 sdu 7 [PSM 39 mode Enhanced Credit (0x81)] {chan 4}
      ATT: Read By Type Request (0x08) len 6
        Handle range: 0x0217-0x0217
        Attribute type: Characteristic (0x2803)
< ACL Data TX: Handle 1335 flags 0x00 dlen 12             #101 [hci1] 17.583541
      LE L2CAP: LE Flow Control Credit (0x16) ident 2 len 4
        Source CID: 68
        Credits: 1
> HCI Event: Number of Completed Packets (0x13) plen 5    #102 [hci1] 17.666642
        Num handles: 1
        Handle: 1335 Address: DF:A9:FF:F6:B1:1A (OUI DF-A9-FF)
        Count: 1
        #100: len 13 (1 Kb/s)
        Latency: 83 msec (55-170 msec ~105 msec)
        Channel: 80 [PSM 39 mode Enhanced Credit (0x81)] {chan 4}
        Channel Latency: 83 msec (83-145 msec ~114 msec)
> HCI Event: Number of Completed Packets (0x13) plen 5    #103 [hci1] 17.753768
        Num handles: 1
        Handle: 1335 Address: DF:A9:FF:F6:B1:1A (OUI DF-A9-FF)
        Count: 1
        #101: len 12 (0 Kb/s)
        Latency: 170 msec (55-170 msec ~137 msec)
        Channel: 80 [PSM 39 mode Enhanced Credit (0x81)] {chan 4}
        Channel Latency: 170 msec (83-170 msec ~142 msec)
> ACL Data RX: Handle 1335 flags 0x02 dlen 11             #104 [hci1] 17.753964
      Channel: 68 len 7 sdu 5 [PSM 39 mode Enhanced Credit (0x81)] {chan 4}
      ATT: Error Response (0x01) len 4
        Read By Type Request (0x08)
        Handle: 0x0217
        Error: Attribute Not Found (0x0a)
< HCI Command: Host Number of Com.. (0x03|0x0035) plen 5  #105 [hci1] 17.763404
        Num handles: 1
        Handle: 1335 Address: DF:A9:FF:F6:B1:1A (OUI DF-A9-FF)
        Count: 1
< ACL Data TX: Handle 1335 flags 0x00 dlen 12             #106 [hci1] 17.763409
      LE L2CAP: LE Flow Control Credit (0x16) ident 3 len 4
        Source CID: 68
        Credits: 1
> HCI Event: Number of Completed Packets (0x13) plen 5    #107 [hci1] 17.928802
        Num handles: 1
        Handle: 1335 Address: DF:A9:FF:F6:B1:1A (OUI DF-A9-FF)
        Count: 1
        #106: len 12 (0 Kb/s)
        Latency: 165 msec (55-170 msec ~151 msec)
        Channel: 80 [PSM 39 mode Enhanced Credit (0x81)] {chan 4}
        Channel Latency: 165 msec (83-170 msec ~153 msec)
> HCI Event: Disconnect Complete (0x05) plen 4            #108 [hci1] 20.203780
        Status: Success (0x00)
        Handle: 1335 Address: DF:A9:FF:F6:B1:1A (OUI DF-A9-FF)
        Reason: Remote User Terminated Connection (0x13)
< HCI Command: LE Set Extended A.. (0x08|0x0036) plen 25  #109 [hci1] 20.813846
        Handle: 0x00
        Properties: 0x0013
          Connectable
          Scannable
          Use legacy advertising PDUs: ADV_IND
        Min advertising interval: 100.000 msec (0x00a0)
        Max advertising interval: 150.000 msec (0x00f0)
        Channel map: 37, 38, 39 (0x07)
        Own address type: Random (0x01)
        Peer address type: Public (0x00)
        Peer address: 00:00:00:00:00:00 (OUI 00-00-00)
        Filter policy: Allow Scan Request from Any, Allow Connect Request from Any (0x00)
        TX power: Host has no preference (0x7f)
        Primary PHY: LE 1M (0x01)
        Secondary max skip: 0x00
        Secondary PHY: LE 1M (0x01)
        SID: 0x00
        Scan request notifications: Disabled (0x00)
> HCI Event: Command Complete (0x0e) plen 5               #110 [hci1] 20.814716
      LE Set Extended Advertising Parameters (0x08|0x0036) ncmd 1
        Status: Success (0x00)
        TX power (selected): 0 dbm (0x00)
< HCI Command: LE Set Advertising.. (0x08|0x0035) plen 7  #111 [hci1] 20.823454
        Advertising handle: 0x00
        Advertising random address: D5:B6:CC:31:DB:3B (Static)
> HCI Event: Command Complete (0x0e) plen 4               #112 [hci1] 20.824060
      LE Set Advertising Set Random Address (0x08|0x0035) ncmd 1
        Status: Success (0x00)
< HCI Command: LE Set Extended A.. (0x08|0x0037) plen 22  #113 [hci1] 20.843362
        Handle: 0x00
        Operation: Complete extended advertising data (0x03)
        Fragment preference: Minimize fragmentation (0x01)
        Data length: 0x12
        Flags: 0x06
          LE General Discoverable Mode
          BR/EDR Not Supported
        Name (complete): Tester_F6B11A
> HCI Event: Command Complete (0x0e) plen 4               #114 [hci1] 20.844087
      LE Set Extended Advertising Data (0x08|0x0037) ncmd 1
        Status: Success (0x00)
< HCI Command: LE Set Extended Sc.. (0x08|0x0038) plen 4  #115 [hci1] 20.863300
        Handle: 0x00
        Operation: Complete scan response data (0x03)
        Fragment preference: Minimize fragmentation (0x01)
        Data length: 0x00
> HCI Event: Command Complete (0x0e) plen 4               #116 [hci1] 20.863799
      LE Set Extended Scan Response Data (0x08|0x0038) ncmd 1
        Status: Success (0x00)
< HCI Command: LE Set Extended Ad.. (0x08|0x0039) plen 6  #117 [hci1] 20.883322
        Extended advertising: Enabled (0x01)
        Number of sets: 1 (0x01)
        Entry 0
          Handle: 0x00
          Duration: 0 ms (0x00)
          Max ext adv events: 0
> HCI Event: Command Complete (0x0e) plen 4               #118 [hci1] 20.883935
      LE Set Extended Advertising Enable (0x08|0x0039) ncmd 1
        Status: Success (0x00)
> HCI Event: LE Meta Event (0x3e) plen 31                 #119 [hci1] 21.204510
      LE Enhanced Connection Complete (0x0a)
        Status: Success (0x00)
        Handle: 1353
        Role: Peripheral (0x01)
        Peer address type: Public (0x00)
        Peer address: DF:A9:FF:F6:B1:1A (OUI DF-A9-FF)
        Local resolvable private address: 00:00:00:00:00:00 (Non-Resolvable)
        Peer resolvable private address: 00:00:00:00:00:00 (Non-Resolvable)
        Connection interval: 87.50 msec (0x0046)
        Connection latency: 0 (0x0000)
        Supervision timeout: 20000 msec (0x07d0)
        Central clock accuracy: 0x01
> HCI Event: LE Meta Event (0x3e) plen 6                  #120 [hci1] 21.204582
      LE Advertising Set Terminated (0x12)
        Status: Success (0x00)
        Handle: 0
        Connection handle: 1353
        Number of completed extended advertising events: 0
< HCI Command: LE Read Remote Use.. (0x08|0x0016) plen 2  #121 [hci1] 21.223566
        Handle: 1353 Address: DF:A9:FF:F6:B1:1A (OUI DF-A9-FF)
> HCI Event: Command Status (0x0f) plen 4                 #122 [hci1] 21.224116
      LE Read Remote Used Features (0x08|0x0016) ncmd 1
        Status: Success (0x00)
> HCI Event: LE Meta Event (0x3e) plen 12                 #123 [hci1] 21.468261
      LE Read Remote Used Features (0x04)
        Status: Success (0x00)
        Handle: 1353 Address: DF:A9:FF:F6:B1:1A (OUI DF-A9-FF)
        Features: 0x2d 0x49 0x00 0xf7 0x67 0xd8 0x00 0x00
          LE Encryption
          Extended Reject Indication
          Peripheral-initiated Features Exchange
          LE Data Packet Length Extension
          LE 2M PHY
          LE Coded PHY
          Channel Selection Algorithm #2
          Periodic Advertising Sync Transfer - Sender
          Periodic Advertising Sync Transfer - Recipient
          Sleep Clock Accuracy Updates
          Connected Isochronous Stream - Central
          Connected Isochronous Stream - Peripheral
          Isochronous Broadcaster
          Synchronized Receiver
          Connected Isochronous Stream (Host Support)
          LE Power Control Request
          LE Power Control Request
          Connection Subrating
          Connection Subrating (Host Support)
          Unknown features (0x0000d80000000000)
< ACL Data TX: Handle 1353 flags 0x00 dlen 16             #124 [hci1] 26.233540
      LE L2CAP: Connection Parameter Update Request (0x12) ident 4 len 8
        Min interval: 24
        Max interval: 40
        Peripheral latency: 0
        Timeout multiplier: 42
> HCI Event: Number of Completed Packets (0x13) plen 5    #125 [hci1] 26.367926
        Num handles: 1
        Handle: 1353 Address: DF:A9:FF:F6:B1:1A (OUI DF-A9-FF)
        Count: 1
        #124: len 16 (0 Kb/s)
        Latency: 134 msec (134-134 msec ~134 msec)
> ACL Data RX: Handle 1353 flags 0x02 dlen 10             #126 [hci1] 26.368064
      LE L2CAP: Connection Parameter Update Response (0x13) ident 4 len 2
        Result: Connection Parameters accepted (0x0000)
< HCI Command: Host Number of Com.. (0x03|0x0035) plen 5  #127 [hci1] 26.383815
        Num handles: 1
        Handle: 1353 Address: DF:A9:FF:F6:B1:1A (OUI DF-A9-FF)
        Count: 1
> HCI Event: LE Meta Event (0x3e) plen 13                 #128 [hci1] 29.168232
      LE Long Term Key Request (0x05)
        Handle: 1353 Address: DF:A9:FF:F6:B1:1A (OUI DF-A9-FF)
        Random number: 0x84c81ed264dab3d8
        Encrypted diversifier: 0x825e
< HCI Command: LE Long Term Key... (0x08|0x001a) plen 18  #129 [hci1] 29.183864
        Handle: 1353 Address: DF:A9:FF:F6:B1:1A (OUI DF-A9-FF)
        Long term key: 5da095555cc64d02679f89a05211af56
> HCI Event: Command Complete (0x0e) plen 6               #130 [hci1] 29.184654
      LE Long Term Key Request Reply (0x08|0x001a) ncmd 1
        Status: Success (0x00)
        Handle: 1353 Address: DF:A9:FF:F6:B1:1A (OUI DF-A9-FF)
> HCI Event: Encryption Change (0x08) plen 4              #131 [hci1] 29.605502
        Status: Success (0x00)
        Handle: 1353 Address: DF:A9:FF:F6:B1:1A (OUI DF-A9-FF)
        Encryption: Enabled with AES-CCM (0x01)
> ACL Data RX: Handle 1353 flags 0x02 dlen 26             #132 [hci1] 29.693216
      LE L2CAP: Enhanced Credit Connection Request (0x17) ident 2 len 18
        PSM: 39 (0x0027)
        MTU: 64
        MPS: 64
        Credits: 5
        Source CID: 84
        Source CID: 83
        Source CID: 82
        Source CID: 81
        Source CID: 80
< HCI Command: Host Number of Com.. (0x03|0x0035) plen 5  #133 [hci1] 29.704011
        Num handles: 1
        Handle: 1353 Address: DF:A9:FF:F6:B1:1A (OUI DF-A9-FF)
        Count: 1
< ACL Data TX: Handle 1353 flags 0x00 dlen 26             #134 [hci1] 29.704267
      LE L2CAP: Enhanced Credit Connection Response (0x18) ident 2 len 18
        MTU: 249
        MPS: 251
        Credits: 1
        Result: Connection successful (0x0000)
        Destination CID: 64
        Destination CID: 65
        Destination CID: 66
        Destination CID: 67
        Destination CID: 68
> HCI Event: Number of Completed Packets (0x13) plen 5    #135 [hci1] 29.867579
        Num handles: 1
        Handle: 1353 Address: DF:A9:FF:F6:B1:1A (OUI DF-A9-FF)
        Count: 1
        #134: len 26 (1 Kb/s)
        Latency: 163 msec (134-163 msec ~148 msec)
< ACL Data TX: Handle 1353 flags 0x00 dlen 13             #136 [hci1] 32.284238
      Channel: 80 len 9 sdu 7 [PSM 39 mode Enhanced Credit (0x81)] {chan 9}
      ATT: Read By Type Request (0x08) len 6
        Handle range: 0x00e0-0x00e6
        Attribute type: Characteristic (0x2803)
> HCI Event: Number of Completed Packets (0x13) plen 5    #137 [hci1] 32.405313
        Num handles: 1
        Handle: 1353 Address: DF:A9:FF:F6:B1:1A (OUI DF-A9-FF)
        Count: 1
        #136: len 13 (0 Kb/s)
        Latency: 121 msec (121-163 msec ~134 msec)
        Channel: 80 [PSM 39 mode Enhanced Credit (0x81)] {chan 9}
        Channel Latency: 121 msec (121-121 msec ~121 msec)
> ACL Data RX: Handle 1353 flags 0x02 dlen 15             #138 [hci1] 32.405454
      Channel: 68 len 11 sdu 9 [PSM 39 mode Enhanced Credit (0x81)] {chan 9}
      ATT: Read By Type Response (0x09) len 8
        Attribute data length: 7
        Attribute data list: 1 entry
        Handle: 0x00e1
        Value: 8ae20005b0
            Properties: 0x8a
              Read (0x02)
              Write (0x08)
            Unknown fields (0x80)
            Value Handle: 0x00e2
            Value UUID: Unknown (0xb005)
< HCI Command: Host Number of Com.. (0x03|0x0035) plen 5  #139 [hci1] 32.423620
        Num handles: 1
        Handle: 1353 Address: DF:A9:FF:F6:B1:1A (OUI DF-A9-FF)
        Count: 1
< ACL Data TX: Handle 1353 flags 0x00 dlen 13             #140 [hci1] 32.423693
      Channel: 80 len 9 sdu 7 [PSM 39 mode Enhanced Credit (0x81)] {chan 9}
      ATT: Read By Type Request (0x08) len 6
        Handle range: 0x00e2-0x00e6
        Attribute type: Characteristic (0x2803)
< ACL Data TX: Handle 1353 flags 0x00 dlen 12             #141 [hci1] 32.423806
      LE L2CAP: LE Flow Control Credit (0x16) ident 5 len 4
        Source CID: 68
        Credits: 1
> HCI Event: Number of Completed Packets (0x13) plen 5    #142 [hci1] 32.493115
        Num handles: 1
        Handle: 1353 Address: DF:A9:FF:F6:B1:1A (OUI DF-A9-FF)
        Count: 1
        #140: len 13 (1 Kb/s)
        Latency: 69 msec (69-163 msec ~102 msec)
        Channel: 80 [PSM 39 mode Enhanced Credit (0x81)] {chan 9}
        Channel Latency: 69 msec (69-121 msec ~95 msec)
> HCI Event: Number of Completed Packets (0x13) plen 5    #143 [hci1] 32.580204
        Num handles: 1
        Handle: 1353 Address: DF:A9:FF:F6:B1:1A (OUI DF-A9-FF)
        Count: 1
        #141: len 12 (0 Kb/s)
        Latency: 156 msec (69-163 msec ~129 msec)
        Channel: 80 [PSM 39 mode Enhanced Credit (0x81)] {chan 9}
        Channel Latency: 156 msec (69-156 msec ~125 msec)
> ACL Data RX: Handle 1353 flags 0x02 dlen 11             #144 [hci1] 32.580484
      Channel: 68 len 7 sdu 5 [PSM 39 mode Enhanced Credit (0x81)] {chan 9}
      ATT: Error Response (0x01) len 4
        Read By Type Request (0x08)
        Handle: 0x00e2
        Error: Attribute Not Found (0x0a)
< HCI Command: Host Number of Com.. (0x03|0x0035) plen 5  #145 [hci1] 32.583511
        Num handles: 1
        Handle: 1353 Address: DF:A9:FF:F6:B1:1A (OUI DF-A9-FF)
        Count: 1
< ACL Data TX: Handle 1353 flags 0x00 dlen 12             #146 [hci1] 32.583586
      LE L2CAP: LE Flow Control Credit (0x16) ident 6 len 4
        Source CID: 68
        Credits: 1
> HCI Event: Number of Completed Packets (0x13) plen 5    #147 [hci1] 32.755123
        Num handles: 1
        Handle: 1353 Address: DF:A9:FF:F6:B1:1A (OUI DF-A9-FF)
        Count: 1
        #146: len 12 (0 Kb/s)
        Latency: 171 msec (69-171 msec ~150 msec)
        Channel: 80 [PSM 39 mode Enhanced Credit (0x81)] {chan 9}
        Channel Latency: 171 msec (69-171 msec ~148 msec)
> HCI Event: Disconnect Complete (0x05) plen 4            #148 [hci1] 35.117848
        Status: Success (0x00)
        Handle: 1353 Address: DF:A9:FF:F6:B1:1A (OUI DF-A9-FF)
        Reason: Remote User Terminated Connection (0x13)
< HCI Command: LE Set Extended A.. (0x08|0x0036) plen 25  #149 [hci1] 35.653540
        Handle: 0x00
        Properties: 0x0013
          Connectable
          Scannable
          Use legacy advertising PDUs: ADV_IND
        Min advertising interval: 100.000 msec (0x00a0)
        Max advertising interval: 150.000 msec (0x00f0)
        Channel map: 37, 38, 39 (0x07)
        Own address type: Random (0x01)
        Peer address type: Public (0x00)
        Peer address: 00:00:00:00:00:00 (OUI 00-00-00)
        Filter policy: Allow Scan Request from Any, Allow Connect Request from Any (0x00)
        TX power: Host has no preference (0x7f)
        Primary PHY: LE 1M (0x01)
        Secondary max skip: 0x00
        Secondary PHY: LE 1M (0x01)
        SID: 0x00
        Scan request notifications: Disabled (0x00)
> HCI Event: Command Complete (0x0e) plen 5               #150 [hci1] 35.654282
      LE Set Extended Advertising Parameters (0x08|0x0036) ncmd 1
        Status: Success (0x00)
        TX power (selected): 0 dbm (0x00)
< HCI Command: LE Set Advertising.. (0x08|0x0035) plen 7  #151 [hci1] 35.663514
        Advertising handle: 0x00
        Advertising random address: D5:B6:CC:31:DB:3B (Static)
> HCI Event: Command Complete (0x0e) plen 4               #152 [hci1] 35.664046
      LE Set Advertising Set Random Address (0x08|0x0035) ncmd 1
        Status: Success (0x00)
< HCI Command: LE Set Extended A.. (0x08|0x0037) plen 22  #153 [hci1] 35.683471
        Handle: 0x00
        Operation: Complete extended advertising data (0x03)
        Fragment preference: Minimize fragmentation (0x01)
        Data length: 0x12
        Flags: 0x06
          LE General Discoverable Mode
          BR/EDR Not Supported
        Name (complete): Tester_F6B11A
> HCI Event: Command Complete (0x0e) plen 4               #154 [hci1] 35.684199
      LE Set Extended Advertising Data (0x08|0x0037) ncmd 1
        Status: Success (0x00)
< HCI Command: LE Set Extended Sc.. (0x08|0x0038) plen 4  #155 [hci1] 35.703472
        Handle: 0x00
        Operation: Complete scan response data (0x03)
        Fragment preference: Minimize fragmentation (0x01)
        Data length: 0x00
> HCI Event: Command Complete (0x0e) plen 4               #156 [hci1] 35.703992
      LE Set Extended Scan Response Data (0x08|0x0038) ncmd 1
        Status: Success (0x00)
< HCI Command: LE Set Extended Ad.. (0x08|0x0039) plen 6  #157 [hci1] 35.723478
        Extended advertising: Enabled (0x01)
        Number of sets: 1 (0x01)
        Entry 0
          Handle: 0x00
          Duration: 0 ms (0x00)
          Max ext adv events: 0
> HCI Event: Command Complete (0x0e) plen 4               #158 [hci1] 35.724011
      LE Set Extended Advertising Enable (0x08|0x0039) ncmd 1
        Status: Success (0x00)
> HCI Event: LE Meta Event (0x3e) plen 31                 #159 [hci1] 36.042970
      LE Enhanced Connection Complete (0x0a)
        Status: Success (0x00)
        Handle: 1371
        Role: Peripheral (0x01)
        Peer address type: Public (0x00)
        Peer address: DF:A9:FF:F6:B1:1A (OUI DF-A9-FF)
        Local resolvable private address: 00:00:00:00:00:00 (Non-Resolvable)
        Peer resolvable private address: 00:00:00:00:00:00 (Non-Resolvable)
        Connection interval: 87.50 msec (0x0046)
        Connection latency: 0 (0x0000)
        Supervision timeout: 20000 msec (0x07d0)
        Central clock accuracy: 0x01
> HCI Event: LE Meta Event (0x3e) plen 6                  #160 [hci1] 36.042972
      LE Advertising Set Terminated (0x12)
        Status: Success (0x00)
        Handle: 0
        Connection handle: 1371
        Number of completed extended advertising events: 0
< HCI Command: LE Read Remote Use.. (0x08|0x0016) plen 2  #161 [hci1] 36.043720
        Handle: 1371 Address: DF:A9:FF:F6:B1:1A (OUI DF-A9-FF)
> HCI Event: Command Status (0x0f) plen 4                 #162 [hci1] 36.044184
      LE Read Remote Used Features (0x08|0x0016) ncmd 1
        Status: Success (0x00)
> HCI Event: LE Meta Event (0x3e) plen 12                 #163 [hci1] 36.307430
      LE Read Remote Used Features (0x04)
        Status: Success (0x00)
        Handle: 1371 Address: DF:A9:FF:F6:B1:1A (OUI DF-A9-FF)
        Features: 0x2d 0x49 0x00 0xf7 0x67 0xd8 0x00 0x00
          LE Encryption
          Extended Reject Indication
          Peripheral-initiated Features Exchange
          LE Data Packet Length Extension
          LE 2M PHY
          LE Coded PHY
          Channel Selection Algorithm #2
          Periodic Advertising Sync Transfer - Sender
          Periodic Advertising Sync Transfer - Recipient
          Sleep Clock Accuracy Updates
          Connected Isochronous Stream - Central
          Connected Isochronous Stream - Peripheral
          Isochronous Broadcaster
          Synchronized Receiver
          Connected Isochronous Stream (Host Support)
          LE Power Control Request
          LE Power Control Request
          Connection Subrating
          Connection Subrating (Host Support)
          Unknown features (0x0000d80000000000)
< ACL Data TX: Handle 1371 flags 0x00 dlen 16             #164 [hci1] 41.053843
      LE L2CAP: Connection Parameter Update Request (0x12) ident 7 len 8
        Min interval: 24
        Max interval: 40
        Peripheral latency: 0
        Timeout multiplier: 42
> HCI Event: Number of Completed Packets (0x13) plen 5    #165 [hci1] 41.206400
        Num handles: 1
        Handle: 1371 Address: DF:A9:FF:F6:B1:1A (OUI DF-A9-FF)
        Count: 1
        #164: len 16 (0 Kb/s)
        Latency: 152 msec (152-152 msec ~152 msec)
> ACL Data RX: Handle 1371 flags 0x02 dlen 10             #166 [hci1] 41.206518
      LE L2CAP: Connection Parameter Update Response (0x13) ident 7 len 2
        Result: Connection Parameters accepted (0x0000)
< HCI Command: Host Number of Com.. (0x03|0x0035) plen 5  #167 [hci1] 41.223842
        Num handles: 1
        Handle: 1371 Address: DF:A9:FF:F6:B1:1A (OUI DF-A9-FF)
        Count: 1
> HCI Event: LE Meta Event (0x3e) plen 13                 #168 [hci1] 44.006796
      LE Long Term Key Request (0x05)
        Handle: 1371 Address: DF:A9:FF:F6:B1:1A (OUI DF-A9-FF)
        Random number: 0x84c81ed264dab3d8
        Encrypted diversifier: 0x825e
< HCI Command: LE Long Term Key... (0x08|0x001a) plen 18  #169 [hci1] 44.024077
        Handle: 1371 Address: DF:A9:FF:F6:B1:1A (OUI DF-A9-FF)
        Long term key: 5da095555cc64d02679f89a05211af56
> HCI Event: Command Complete (0x0e) plen 6               #170 [hci1] 44.025084
      LE Long Term Key Request Reply (0x08|0x001a) ncmd 1
        Status: Success (0x00)
        Handle: 1371 Address: DF:A9:FF:F6:B1:1A (OUI DF-A9-FF)
> HCI Event: Encryption Change (0x08) plen 4              #171 [hci1] 44.443930
        Status: Success (0x00)
        Handle: 1371 Address: DF:A9:FF:F6:B1:1A (OUI DF-A9-FF)
        Encryption: Enabled with AES-CCM (0x01)
> ACL Data RX: Handle 1371 flags 0x02 dlen 26             #172 [hci1] 44.531621
      LE L2CAP: Enhanced Credit Connection Request (0x17) ident 3 len 18
        PSM: 39 (0x0027)
        MTU: 64
        MPS: 64
        Credits: 5
        Source CID: 84
        Source CID: 83
        Source CID: 82
        Source CID: 81
        Source CID: 80
< HCI Command: Host Number of Com.. (0x03|0x0035) plen 5  #173 [hci1] 44.544000
        Num handles: 1
        Handle: 1371 Address: DF:A9:FF:F6:B1:1A (OUI DF-A9-FF)
        Count: 1
< ACL Data TX: Handle 1371 flags 0x00 dlen 26             #174 [hci1] 44.544238
      LE L2CAP: Enhanced Credit Connection Response (0x18) ident 3 len 18
        MTU: 249
        MPS: 251
        Credits: 1
        Result: Connection successful (0x0000)
        Destination CID: 64
        Destination CID: 65
        Destination CID: 66
        Destination CID: 67
        Destination CID: 68
> HCI Event: Number of Completed Packets (0x13) plen 5    #175 [hci1] 44.706132
        Num handles: 1
        Handle: 1371 Address: DF:A9:FF:F6:B1:1A (OUI DF-A9-FF)
        Count: 1
        #174: len 26 (1 Kb/s)
        Latency: 161 msec (152-161 msec ~157 msec)
< ACL Data TX: Handle 1371 flags 0x00 dlen 13             #176 [hci1] 47.154216
      Channel: 80 len 9 sdu 7 [PSM 39 mode Enhanced Credit (0x81)] {chan 14}
      ATT: Read By Type Request (0x08) len 6
        Handle range: 0x0150-0x0152
        Attribute type: Characteristic (0x2803)
> HCI Event: Number of Completed Packets (0x13) plen 5    #177 [hci1] 47.243706
        Num handles: 1
        Handle: 1371 Address: DF:A9:FF:F6:B1:1A (OUI DF-A9-FF)
        Count: 1
        #176: len 13 (1 Kb/s)
        Latency: 89 msec (89-161 msec ~123 msec)
        Channel: 80 [PSM 39 mode Enhanced Credit (0x81)] {chan 14}
        Channel Latency: 89 msec (89-89 msec ~89 msec)
> ACL Data RX: Handle 1371 flags 0x02 dlen 15             #178 [hci1] 47.244002
      Channel: 68 len 11 sdu 9 [PSM 39 mode Enhanced Credit (0x81)] {chan 14}
      ATT: Read By Type Response (0x09) len 8
        Attribute data length: 7
        Attribute data list: 1 entry
        Handle: 0x0151
        Value: 02520108b0
            Properties: 0x02
              Read (0x02)
            Value Handle: 0x0152
            Value UUID: Unknown (0xb008)
< HCI Command: Host Number of Com.. (0x03|0x0035) plen 5  #179 [hci1] 47.263876
        Num handles: 1
        Handle: 1371 Address: DF:A9:FF:F6:B1:1A (OUI DF-A9-FF)
        Count: 1
< ACL Data TX: Handle 1371 flags 0x00 dlen 13             #180 [hci1] 47.263902
      Channel: 80 len 9 sdu 7 [PSM 39 mode Enhanced Credit (0x81)] {chan 14}
      ATT: Read By Type Request (0x08) len 6
        Handle range: 0x0152-0x0152
        Attribute type: Characteristic (0x2803)
< ACL Data TX: Handle 1371 flags 0x00 dlen 12             #181 [hci1] 47.264046
      LE L2CAP: LE Flow Control Credit (0x16) ident 8 len 4
        Source CID: 68
        Credits: 1
> HCI Event: Number of Completed Packets (0x13) plen 5    #182 [hci1] 47.331548
        Num handles: 1
        Handle: 1371 Address: DF:A9:FF:F6:B1:1A (OUI DF-A9-FF)
        Count: 1
        #180: len 13 (1 Kb/s)
        Latency: 67 msec (67-161 msec ~95 msec)
        Channel: 80 [PSM 39 mode Enhanced Credit (0x81)] {chan 14}
        Channel Latency: 67 msec (67-89 msec ~78 msec)
> HCI Event: Number of Completed Packets (0x13) plen 5    #183 [hci1] 47.418646
        Num handles: 1
        Handle: 1371 Address: DF:A9:FF:F6:B1:1A (OUI DF-A9-FF)
        Count: 1
        #181: len 12 (0 Kb/s)
        Latency: 154 msec (67-161 msec ~125 msec)
        Channel: 80 [PSM 39 mode Enhanced Credit (0x81)] {chan 14}
        Channel Latency: 154 msec (67-154 msec ~116 msec)
> ACL Data RX: Handle 1371 flags 0x02 dlen 11             #184 [hci1] 47.418973
      Channel: 68 len 7 sdu 5 [PSM 39 mode Enhanced Credit (0x81)] {chan 14}
      ATT: Error Response (0x01) len 4
        Read By Type Request (0x08)
        Handle: 0x0152
        Error: Attribute Not Found (0x0a)
< HCI Command: Host Number of Com.. (0x03|0x0035) plen 5  #185 [hci1] 47.423822
        Num handles: 1
        Handle: 1371 Address: DF:A9:FF:F6:B1:1A (OUI DF-A9-FF)
        Count: 1
< ACL Data TX: Handle 1371 flags 0x00 dlen 12             #186 [hci1] 47.423828
      LE L2CAP: LE Flow Control Credit (0x16) ident 9 len 4
        Source CID: 68
        Credits: 1
> HCI Event: Number of Completed Packets (0x13) plen 5    #187 [hci1] 47.593570
        Num handles: 1
        Handle: 1371 Address: DF:A9:FF:F6:B1:1A (OUI DF-A9-FF)
        Count: 1
        #186: len 12 (0 Kb/s)
        Latency: 169 msec (67-169 msec ~147 msec)
        Channel: 80 [PSM 39 mode Enhanced Credit (0x81)] {chan 14}
        Channel Latency: 169 msec (67-169 msec ~143 msec)
