Bluetooth monitor ver 5.72
= Note: Linux version 6.14.0-36-generic (x86_64)                       0.202800
= Note: Bluetooth subsystem version 2.22                               0.202802
= New Index: 00:00:00:00:00:00 (Primary,UART,hci1)              [hci1] 0.202803
= New Index: 48:5F:99:8E:E0:64 (Primary,USB,hci0)               [hci0] 0.202804
= Open Index: 00:00:00:00:00:00                                 [hci1] 0.316291
= Index Info: 00:00:00:00:00:00 (Nordic Semiconductor ASA)      [hci1] 0.316308
@ USER Open: main (privileged) version 2.22            {0x0001} [hci1] 0.316318
< HCI Command: Reset (0x03|0x0003) plen 0                    #1 [hci1] 0.317637
> HCI Event: Command Complete (0x0e) plen 4                  #2 [hci1] 0.318134
      Reset (0x03|0x0003) ncmd 1
        Status: Success (0x00)
< HCI Command: Read Local Supported... (0x04|0x0003) plen 0  #3 [hci1] 0.336109
> HCI Event: Command Complete (0x0e) plen 12                 #4 [hci1] 0.336722
      Read Local Supported Features (0x04|0x0003) ncmd 1
        Status: Success (0x00)
        Features: 0x00 0x00 0x00 0x00 0x60 0x00 0x00 0x00
          BR/EDR Not Supported
          LE Supported (Controller)
< HCI Command: Read Local Version In.. (0x04|0x0001) plen 0  #5 [hci1] 0.355789
> HCI Event: Command Complete (0x0e) plen 12                 #6 [hci1] 0.356234
      Read Local Version Information (0x04|0x0001) ncmd 1
        Status: Success (0x00)
        HCI version: Reserved (0x0f) - Revision 12393 (0x3069)
        LMP version: Reserved (0x0f) - Subversion 12393 (0x3069)
        Manufacturer: Nordic Semiconductor ASA (89)
< HCI Command: Read Local Supported... (0x04|0x0002) plen 0  #7 [hci1] 0.375720
> HCI Event: Command Complete (0x0e) plen 68                 #8 [hci1] 0.376783
      Read Local Supported Commands (0x04|0x0002) ncmd 1
        Status: Success (0x00)
        Commands: 119 entries
          Disconnect (Octet 0 - Bit 5)
          Read Remote Version Information (Octet 2 - Bit 7)
          Set Event Mask (Octet 5 - Bit 6)
          Reset (Octet 5 - Bit 7)
          Read Connection Accept Timeout (Octet 7 - Bit 2)
          Write Connection Accept Timeout (Octet 7 - Bit 3)
          Read Transmit Power Level (Octet 10 - Bit 2)
          Set Controller To Host Flow Control (Octet 10 - Bit 5)
          Host Buffer Size (Octet 10 - Bit 6)
          Host Number of Completed Packets (Octet 10 - Bit 7)
          Read Local Version Information (Octet 14 - Bit 3)
          Read Local Supported Features (Octet 14 - Bit 5)
          Read BD ADDR (Octet 15 - Bit 1)
          Read RSSI (Octet 15 - Bit 5)
          Set Event Mask Page 2 (Octet 22 - Bit 2)
          LE Set Event Mask (Octet 25 - Bit 0)
          LE Read Buffer Size (Octet 25 - Bit 1)
          LE Read Local Supported Features (Octet 25 - Bit 2)
          LE Set Random Address (Octet 25 - Bit 4)
          LE Set Advertising Parameters (Octet 25 - Bit 5)
          LE Read Advertising Channel TX Power (Octet 25 - Bit 6)
          LE Set Advertising Data (Octet 25 - Bit 7)
          LE Set Scan Response Data (Octet 26 - Bit 0)
          LE Set Advertise Enable (Octet 26 - Bit 1)
          LE Set Scan Parameters (Octet 26 - Bit 2)
          LE Set Scan Enable (Octet 26 - Bit 3)
          LE Create Connection (Octet 26 - Bit 4)
          LE Create Connection Cancel (Octet 26 - Bit 5)
          LE Read Accept List Size (Octet 26 - Bit 6)
          LE Clear Accept List (Octet 26 - Bit 7)
          LE Add Device To Accept List (Octet 27 - Bit 0)
          LE Remove Device From Accept List (Octet 27 - Bit 1)
          LE Connection Update (Octet 27 - Bit 2)
          LE Set Host Channel Classification (Octet 27 - Bit 3)
          LE Read Channel Map (Octet 27 - Bit 4)
          LE Read Remote Used Features (Octet 27 - Bit 5)
          LE Encrypt (Octet 27 - Bit 6)
          LE Rand (Octet 27 - Bit 7)
          LE Start Encryption (Octet 28 - Bit 0)
          LE Long Term Key Request Reply (Octet 28 - Bit 1)
          LE Long Term Key Request Neg Reply (Octet 28 - Bit 2)
          LE Read Supported States (Octet 28 - Bit 3)
          LE Receiver Test (Octet 28 - Bit 4)
          LE Transmitter Test (Octet 28 - Bit 5)
          LE Test End (Octet 28 - Bit 6)
          Read Authenticated Payload Timeout (Octet 32 - Bit 4)
          Write Authenticated Payload Timeout (Octet 32 - Bit 5)
          LE Set Data Length (Octet 33 - Bit 6)
          LE Read Suggested Default Data Length (Octet 33 - Bit 7)
          LE Write Suggested Default Data Length (Octet 34 - Bit 0)
          LE Add Device To Resolving List (Octet 34 - Bit 3)
          LE Remove Device From Resolving List (Octet 34 - Bit 4)
          LE Clear Resolving List (Octet 34 - Bit 5)
          LE Read Resolving List Size (Octet 34 - Bit 6)
          LE Set Address Resolution Enable (Octet 35 - Bit 1)
          LE Set Resolvable Private Address Timeout (Octet 35 - Bit 2)
          LE Read Maximum Data Length (Octet 35 - Bit 3)
          LE Read PHY (Octet 35 - Bit 4)
          LE Set Default PHY (Octet 35 - Bit 5)
          LE Set PHY (Octet 35 - Bit 6)
          LE Enhanced Receiver Test (Octet 35 - Bit 7)
          LE Enhanced Transmitter Test (Octet 36 - Bit 0)
          LE Set Advertising Set Random Address (Octet 36 - Bit 1)
          LE Set Extended Advertising Parameters (Octet 36 - Bit 2)
          LE Set Extended Advertising Data (Octet 36 - Bit 3)
          LE Set Extended Scan Response Data (Octet 36 - Bit 4)
          LE Set Extended Advertising Enable (Octet 36 - Bit 5)
          LE Read Maximum Advertising Data Length (Octet 36 - Bit 6)
          LE Read Number of Supported Advertising Sets (Octet 36 - Bit 7)
          LE Remove Advertising Set (Octet 37 - Bit 0)
          LE Clear Advertising Sets (Octet 37 - Bit 1)
          LE Set Periodic Advertising Parameters (Octet 37 - Bit 2)
          LE Set Periodic Advertising Data (Octet 37 - Bit 3)
          LE Set Periodic Advertising Enable (Octet 37 - Bit 4)
          LE Set Extended Scan Parameters (Octet 37 - Bit 5)
          LE Set Extended Scan Enable (Octet 37 - Bit 6)
          LE Extended Create Connection (Octet 37 - Bit 7)
          LE Periodic Advertising Create Sync (Octet 38 - Bit 0)
          LE Periodic Advertising Create Sync Cancel (Octet 38 - Bit 1)
          LE Periodic Advertising Terminate Sync (Octet 38 - Bit 2)
          LE Add Device To Periodic Advertiser List (Octet 38 - Bit 3)
          LE Remove Device From Periodic Advertiser List (Octet 38 - Bit 4)
          LE Clear Periodic Advertiser List (Octet 38 - Bit 5)
          LE Read Periodic Advertiser List Size (Octet 38 - Bit 6)
          LE Read Transmit Power (Octet 38 - Bit 7)
          LE Read RF Path Compensation (Octet 39 - Bit 0)
          LE Write RF Path Compensation (Octet 39 - Bit 1)
          LE Set Privacy Mode (Octet 39 - Bit 2)
          LE Periodic Advertising Receive Enable (Octet 40 - Bit 5)
          LE Periodic Advertising Sync Transfer (Octet 40 - Bit 6)
          LE Periodic Advertising Set Info Transfer (Octet 40 - Bit 7)
          LE Periodic Advertising Sync Transfer Parameters (Octet 41 - Bit 0)
          LE Set Default Periodic Advertisng Sync Transfer Parameters (Octet 41 - Bit 1)
          LE Read Buffer v2 (Octet 41 - Bit 5)
          LE Read ISO TX Sync (Octet 41 - Bit 6)
          LE Set Connected Isochronous Group Parameters (Octet 41 - Bit 7)
          LE Set Connected Isochronous Group Parameters Test (Octet 42 - Bit 0)
          LE Create Connected Isochronous Stream (Octet 42 - Bit 1)
          LE Remove Connected Isochronous Group (Octet 42 - Bit 2)
          LE Accept Connected Isochronous Stream Request (Octet 42 - Bit 3)
          LE Reject Connected Isochronous Stream Request (Octet 42 - Bit 4)
          LE Create Broadcast Isochronous Group (Octet 42 - Bit 5)
          LE Create Broadcast Isochronous Group Test (Octet 42 - Bit 6)
          LE Terminate Broadcast Isochronous Group (Octet 42 - Bit 7)
          LE Broadcast Isochronous Group Create Sync (Octet 43 - Bit 0)
          LE Broadcast Isochronous Group Terminate Sync (Octet 43 - Bit 1)
          LE Request Peer SCA (Octet 43 - Bit 2)
          LE Setup Isochronous Data Path (Octet 43 - Bit 3)
          LE Remove Isochronous Data Path (Octet 43 - Bit 4)
          LE Isochronous Transmit Test (Octet 43 - Bit 5)
          LE Isochronous Receive Test (Octet 43 - Bit 6)
          LE Isochronous Read Test Counters (Octet 43 - Bit 7)
          LE Isochronous Read Test Counters (Octet 44 - Bit 0)
          LE Set Host Feature (Octet 44 - Bit 1)
          Octet 44 - Bit 2 
          Octet 45 - Bit 6 
          Octet 46 - Bit 0 
          Octet 46 - Bit 1 
          Octet 46 - Bit 2 
< HCI Command: Host Buffer Size (0x03|0x0033) plen 7         #9 [hci1] 0.395722
        ACL MTU: 255  ACL max packet: 16
        SCO MTU: 0    SCO max packet: 0
> HCI Event: Command Complete (0x0e) plen 4                 #10 [hci1] 0.396234
      Host Buffer Size (0x03|0x0033) ncmd 1
        Status: Success (0x00)
< HCI Command: Set Controller To Ho.. (0x03|0x0031) plen 1  #11 [hci1] 0.415735
        Flow control: ACL Data Packets (0x01)
> HCI Event: Command Complete (0x0e) plen 4                 #12 [hci1] 0.416230
      Set Controller To Host Flow Control (0x03|0x0031) ncmd 1
        Status: Success (0x00)
< HCI Command: LE Read Local Suppor.. (0x08|0x0003) plen 0  #13 [hci1] 0.435723
> HCI Event: Command Complete (0x0e) plen 12                #14 [hci1] 0.436233
      LE Read Local Supported Features (0x08|0x0003) ncmd 1
        Status: Success (0x00)
        Features: 0xfd 0x79 0x00 0xf7 0x30 0x01 0x00 0x00
          LE Encryption
          Extended Reject Indication
          Peripheral-initiated Features Exchange
          LE Ping
          LE Data Packet Length Extension
          LL Privacy
          Extended Scanner Filter Policies
          LE 2M PHY
          LE Coded PHY
          LE Extended Advertising
          LE Periodic Advertising
          Channel Selection Algorithm #2
          Periodic Advertising Sync Transfer - Sender
          Periodic Advertising Sync Transfer - Recipient
          Sleep Clock Accuracy Updates
          Connected Isochronous Stream - Central
          Connected Isochronous Stream - Peripheral
          Isochronous Broadcaster
          Synchronized Receiver
          Periodic Advertising ADI support
          Connection Subrating
          Unknown features (0x0000010000000000)
< HCI Command: LE Set Host Feature (0x08|0x0074) plen 2     #15 [hci1] 0.455730
        Bit Number: 32
          Connected Isochronous Stream (Host Support)
        Bit Value: 1
> HCI Event: Command Complete (0x0e) plen 4                 #16 [hci1] 0.456137
      LE Set Host Feature (0x08|0x0074) ncmd 1
        Status: Success (0x00)
< HCI Command: LE Read Buffer v2 (0x08|0x0060) plen 0       #17 [hci1] 0.475717
> HCI Event: Command Complete (0x0e) plen 10                #18 [hci1] 0.476229
      LE Read Buffer v2 (0x08|0x0060) ncmd 1
        Status: Success (0x00)
        ACL MTU: 27
        ACL max packet: 3
        ISO MTU: 318
        ISO max packet: 3
< HCI Command: LE Read Maximum Adve.. (0x08|0x003a) plen 0  #19 [hci1] 0.495725
> HCI Event: Command Complete (0x0e) plen 6                 #20 [hci1] 0.496167
      LE Read Maximum Advertising Data Length (0x08|0x003a) ncmd 1
        Status: Success (0x00)
        Max length: 1650
< HCI Command: LE Read Supported St.. (0x08|0x001c) plen 0  #21 [hci1] 0.515725
> HCI Event: Command Complete (0x0e) plen 12                #22 [hci1] 0.516254
      LE Read Supported States (0x08|0x001c) ncmd 1
        Status: Success (0x00)
        States: 0x000003ff3e0306ff
          Non-connectable Advertising State
          Scannable Advertising State
          Connectable Advertising State
          High Duty Cycle Directed Advertising State
          Passive Scanning State
          Active Scanning State
          Initiating State
            and Connection State (Central Role)
          Connection State (Peripheral Role)
          Scannable Advertising State
            and Passive Scanning State
          Connectable Advertising State
            and Passive Scanning State
          Non-connectable Advertising State
            and Initiating State
          Scannable Advertising State
            and Initiating State
          Active Scanning State
            and Connection State (Central Role)
          Passive Scanning State
            and Connection State (Peripheral Role)
          Active Scanning State
            and Connection State (Peripheral Role)
          Initiating State
            and Connection State (Central Role)
            and Central Role & Central Role
          Low Duty Cycle Directed Advertising State
          Connectable Advertising State
            and Initiating State
            and Central Role & Peripheral Role
          High Duty Cycle Directed Advertising State
            and Initiating State
            and Central Role & Peripheral Role
          Low Duty Cycle Directed Advertising State
            and Initiating State
            and Central Role & Peripheral Role
          Connectable Advertising State
            and Connection State (Central Role)
            and Central Role & Peripheral Role
          High Duty Cycle Directed Advertising State
            and Connection State (Central Role)
            and Central Role & Peripheral Role
          Low Duty Cycle Directed Advertising State
            and Connection State (Central Role)
            and Central Role & Peripheral Role
          Connectable Advertising State
            and Connection State (Peripheral Role)
            and Central Role & Peripheral Role
          High Duty Cycle Directed Advertising State
            and Connection State (Peripheral Role)
            and Peripheral Role & Peripheral Role
          Low Duty Cycle Directed Advertising State
            and Connection State (Peripheral Role)
            and Peripheral Role & Peripheral Role
          Initiating State
            and Connection State (Peripheral Role)
            and Central Role & Peripheral Role
< HCI Command: LE Read Maximum Data.. (0x08|0x002f) plen 0  #23 [hci1] 0.535714
> HCI Event: Command Complete (0x0e) plen 12                #24 [hci1] 0.536191
      LE Read Maximum Data Length (0x08|0x002f) ncmd 1
        Status: Success (0x00)
        Max TX octets: 251
        Max TX time: 2704
        Max RX octets: 251
        Max RX time: 2704
< HCI Command: LE Write Suggested D.. (0x08|0x0024) plen 4  #25 [hci1] 0.555727
        TX octets: 251
        TX time: 2704
> HCI Event: Command Complete (0x0e) plen 4                 #26 [hci1] 0.556239
      LE Write Suggested Default Data Length (0x08|0x0024) ncmd 1
        Status: Success (0x00)
< HCI Command: LE Read Resolving Li.. (0x08|0x002a) plen 0  #27 [hci1] 0.575727
> HCI Event: Command Complete (0x0e) plen 5                 #28 [hci1] 0.576120
      LE Read Resolving List Size (0x08|0x002a) ncmd 1
        Status: Success (0x00)
        Size: 8
< HCI Command: LE Set Event Mask (0x08|0x0001) plen 8       #29 [hci1] 0.595708
        Mask: 0x000002023f87fa5e
          LE Advertising Report
          LE Connection Update Complete
          LE Read Remote Used Features Complete
          LE Long Term Key Request
          LE Data Length Change
          LE Enhanced Connection Complete
          LE PHY Update Complete
          LE Extended Advertising Report
          LE Periodic Advertising Sync Established
          LE Periodic Advertising Report
          LE Periodic Advertising Sync Lost
          LE Extended Scan Timeout
          LE Extended Advertising Set Terminated
          LE Scan Request Received
          LE Periodic Advertising Sync Transfer Rvc
          LE CIS Established
          LE CIS Request
          LE Create BIG Complete
          LE Terminate BIG Complete
          LE BIG Sync Estabilished Complete
          LE BIG Sync Lost
          LE BIG Info Advertising Report
          Unknown mask (0x0000020000000000)
> HCI Event: Command Complete (0x0e) plen 4                 #30 [hci1] 0.596182
      LE Set Event Mask (0x08|0x0001) ncmd 1
        Status: Success (0x00)
< HCI Command: Set Event Mask (0x03|0x0001) plen 8          #31 [hci1] 0.615779
        Mask: 0x2000800002008890
          Disconnection Complete
          Encryption Change
          Read Remote Version Information Complete
          Hardware Error
          Data Buffer Overflow
          Encryption Key Refresh Complete
          LE Meta
> HCI Event: Command Complete (0x0e) plen 4                 #32 [hci1] 0.616266
      Set Event Mask (0x03|0x0001) ncmd 1
        Status: Success (0x00)
< HCI Command: Read BD ADDR (0x04|0x0009) plen 0            #33 [hci1] 0.635731
> HCI Event: Command Complete (0x0e) plen 10                #34 [hci1] 0.636237
      Read BD ADDR (0x04|0x0009) ncmd 1
        Status: Success (0x00)
        Address: 00:00:00:00:00:00 (OUI 00-00-00)
< HCI Command: LE Set Random Address (0x08|0x0005) plen 6   #35 [hci1] 0.655731
        Address: D5:B6:CC:31:DB:3B (Static)
> HCI Event: Command Complete (0x0e) plen 4                 #36 [hci1] 0.656269
      LE Set Random Address (0x08|0x0005) ncmd 1
        Status: Success (0x00)
< HCI Command: LE Extended Create... (0x08|0x0043) plen 26  #37 [hci1] 7.215896
        Filter policy: Accept list is not used (0x00)
        Own address type: Random (0x01)
        Peer address type: Public (0x00)
        Peer address: DF:A9:FF:F6:B1:1A (OUI DF-A9-FF)
        Initiating PHYs: 0x01
        Entry 0: LE 1M
          Scan interval: 60.000 msec (0x0060)
          Scan window: 60.000 msec (0x0060)
          Min connection interval: 50.00 msec (0x0028)
          Max connection interval: 70.00 msec (0x0038)
          Connection latency: 0 (0x0000)
          Supervision timeout: 4000 msec (0x0190)
          Min connection length: 0.000 msec (0x0000)
          Max connection length: 0.000 msec (0x0000)
> HCI Event: Command Status (0x0f) plen 4                   #38 [hci1] 7.216753
      LE Extended Create Connection (0x08|0x0043) ncmd 1
        Status: Success (0x00)
> HCI Event: LE Meta Event (0x3e) plen 31                   #39 [hci1] 7.292085
      LE Enhanced Connection Complete (0x0a)
        Status: Success (0x00)
        Handle: 3276
        Role: Central (0x00)
        Peer address type: Public (0x00)
        Peer address: DF:A9:FF:F6:B1:1A (OUI DF-A9-FF)
        Local resolvable private address: 00:00:00:00:00:00 (Non-Resolvable)
        Peer resolvable private address: 00:00:00:00:00:00 (Non-Resolvable)
        Connection interval: 70.00 msec (0x0038)
        Connection latency: 0 (0x0000)
        Supervision timeout: 4000 msec (0x0190)
        Central clock accuracy: 0x00
< HCI Command: LE Read Remote Used... (0x08|0x0016) plen 2  #40 [hci1] 7.296142
        Handle: 3276 Address: DF:A9:FF:F6:B1:1A (OUI DF-A9-FF)
< ACL Data TX: Handle 3276 flags 0x00 dlen 7                #41 [hci1] 7.296153
      ATT: Exchange MTU Request (0x02) len 2
        Client RX MTU: 251
> HCI Event: Command Status (0x0f) plen 4                   #42 [hci1] 7.296563
      LE Read Remote Used Features (0x08|0x0016) ncmd 1
        Status: Success (0x00)
< HCI Command: LE Set PHY (0x08|0x0032) plen 7              #43 [hci1] 7.315861
        Handle: 3276 Address: DF:A9:FF:F6:B1:1A (OUI DF-A9-FF)
        All PHYs preference: 0x00
        TX PHYs preference: 0x02
          LE 2M
        RX PHYs preference: 0x02
          LE 2M
        PHY options preference: Reserved (0x0000)
> HCI Event: Command Status (0x0f) plen 4                   #44 [hci1] 7.316311
      LE Set PHY (0x08|0x0032) ncmd 1
        Status: Success (0x00)
< HCI Command: LE Extended Create... (0x08|0x0043) plen 26  #45 [hci1] 7.355872
        Filter policy: Accept list is not used (0x00)
        Own address type: Random (0x01)
        Peer address type: Public (0x00)
        Peer address: 64:23:B5:94:C5:F1 (OUI 64-23-B5)
        Initiating PHYs: 0x01
        Entry 0: LE 1M
          Scan interval: 60.000 msec (0x0060)
          Scan window: 60.000 msec (0x0060)
          Min connection interval: 50.00 msec (0x0028)
          Max connection interval: 70.00 msec (0x0038)
          Connection latency: 0 (0x0000)
          Supervision timeout: 4000 msec (0x0190)
          Min connection length: 0.000 msec (0x0000)
          Max connection length: 0.000 msec (0x0000)
> HCI Event: Command Status (0x0f) plen 4                   #46 [hci1] 7.356790
      LE Extended Create Connection (0x08|0x0043) ncmd 1
        Status: Success (0x00)
> HCI Event: Number of Completed Packets (0x13) plen 5      #47 [hci1] 7.364335
        Num handles: 1
        Handle: 3276 Address: DF:A9:FF:F6:B1:1A (OUI DF-A9-FF)
        Count: 1
        #41: len 7 (0 Kb/s)
        Latency: 68 msec (68-68 msec ~68 msec)
> HCI Event: LE Meta Event (0x3e) plen 31                   #48 [hci1] 7.397799
      LE Enhanced Connection Complete (0x0a)
        Status: Success (0x00)
        Handle: 1711
        Role: Central (0x00)
        Peer address type: Public (0x00)
        Peer address: 64:23:B5:94:C5:F1 (OUI 64-23-B5)
        Local resolvable private address: 00:00:00:00:00:00 (Non-Resolvable)
        Peer resolvable private address: 00:00:00:00:00:00 (Non-Resolvable)
        Connection interval: 70.00 msec (0x0038)
        Connection latency: 0 (0x0000)
        Supervision timeout: 4000 msec (0x0190)
        Central clock accuracy: 0x00
< HCI Command: LE Read Remote Used... (0x08|0x0016) plen 2  #49 [hci1] 7.415977
        Handle: 1711 Address: 64:23:B5:94:C5:F1 (OUI 64-23-B5)
< ACL Data TX: Handle 1711 flags 0x00 dlen 7                #50 [hci1] 7.415984
      ATT: Exchange MTU Request (0x02) len 2
        Client RX MTU: 251
> HCI Event: Command Status (0x0f) plen 4                   #51 [hci1] 7.416506
      LE Read Remote Used Features (0x08|0x0016) ncmd 1
        Status: Success (0x00)
< HCI Command: LE Set PHY (0x08|0x0032) plen 7              #52 [hci1] 7.435928
        Handle: 1711 Address: 64:23:B5:94:C5:F1 (OUI 64-23-B5)
        All PHYs preference: 0x00
        TX PHYs preference: 0x02
          LE 2M
        RX PHYs preference: 0x02
          LE 2M
        PHY options preference: Reserved (0x0000)
> HCI Event: Command Status (0x0f) plen 4                   #53 [hci1] 7.436476
      LE Set PHY (0x08|0x0032) ncmd 1
        Status: Success (0x00)
> HCI Event: Number of Completed Packets (0x13) plen 5      #54 [hci1] 7.464365
        Num handles: 1
        Handle: 1711 Address: 64:23:B5:94:C5:F1 (OUI 64-23-B5)
        Count: 1
        #50: len 7 (1 Kb/s)
        Latency: 48 msec (48-48 msec ~48 msec)
> HCI Event: LE Meta Event (0x3e) plen 12                   #55 [hci1] 7.504472
      LE Read Remote Used Features (0x04)
        Status: Success (0x00)
        Handle: 3276 Address: DF:A9:FF:F6:B1:1A (OUI DF-A9-FF)
        Features: 0x2d 0x49 0x00 0xf7 0x67 0xd9 0x00 0x80
          LE Encryption
          Extended Reject Indication
          Peripheral-initiated Features Exchange
          LE Data Packet Length Extension
          LE 2M PHY
          LE Coded PHY
          Channel Selection Algorithm #2
          Periodic Advertising Sync Transfer - Sender
          Periodic Advertising Sync Transfer - Recipient
          Sleep Clock Accuracy Updates
          Connected Isochronous Stream - Central
          Connected Isochronous Stream - Peripheral
          Isochronous Broadcaster
          Synchronized Receiver
          Connected Isochronous Stream (Host Support)
          LE Power Control Request
          LE Power Control Request
          Connection Subrating
          Connection Subrating (Host Support)
          Unknown features (0x8000d90000000000)
> HCI Event: LE Meta Event (0x3e) plen 12                   #56 [hci1] 7.604488
      LE Read Remote Used Features (0x04)
        Status: Success (0x00)
        Handle: 1711 Address: 64:23:B5:94:C5:F1 (OUI 64-23-B5)
        Features: 0x2d 0x49 0x00 0xf7 0x67 0xd9 0x00 0x80
          LE Encryption
          Extended Reject Indication
          Peripheral-initiated Features Exchange
          LE Data Packet Length Extension
          LE 2M PHY
          LE Coded PHY
          Channel Selection Algorithm #2
          Periodic Advertising Sync Transfer - Sender
          Periodic Advertising Sync Transfer - Recipient
          Sleep Clock Accuracy Updates
          Connected Isochronous Stream - Central
          Connected Isochronous Stream - Peripheral
          Isochronous Broadcaster
          Synchronized Receiver
          Connected Isochronous Stream (Host Support)
          LE Power Control Request
          LE Power Control Request
          Connection Subrating
          Connection Subrating (Host Support)
          Unknown features (0x8000d90000000000)
> HCI Event: LE Meta Event (0x3e) plen 6                    #57 [hci1] 8.203828
      LE PHY Update Complete (0x0c)
        Status: Success (0x00)
        Handle: 3276 Address: DF:A9:FF:F6:B1:1A (OUI DF-A9-FF)
        TX PHY: LE 2M (0x02)
        RX PHY: LE 2M (0x02)
> HCI Event: LE Meta Event (0x3e) plen 6                    #58 [hci1] 8.303838
      LE PHY Update Complete (0x0c)
        Status: Success (0x00)
        Handle: 1711 Address: 64:23:B5:94:C5:F1 (OUI 64-23-B5)
        TX PHY: LE 2M (0x02)
        RX PHY: LE 2M (0x02)
> ACL Data RX: Handle 3276 flags 0x02 dlen 6                #59 [hci1] 8.344268
      SMP: Security Request (0x0b) len 1
        Authentication requirement: Bonding, No MITM, SC, No Keypresses (0x09)
> ACL Data RX: Handle 3276 flags 0x02 dlen 7                #60 [hci1] 8.344635
      ATT: Exchange MTU Response (0x03) len 2
        Server RX MTU: 64
< HCI Command: Host Number of Compl.. (0x03|0x0035) plen 5  #61 [hci1] 8.356439
        Num handles: 1
        Handle: 3276 Address: DF:A9:FF:F6:B1:1A (OUI DF-A9-FF)
        Count: 1
< ACL Data TX: Handle 3276 flags 0x00 dlen 11               #62 [hci1] 8.356587
      SMP: Pairing Request (0x01) len 6
        IO capability: NoInputNoOutput (0x03)
        OOB data: Authentication data not present (0x00)
        Authentication requirement: Bonding, No MITM, SC, No Keypresses (0x09)
        Max encryption key size: 16
        Initiator key distribution: EncKey (0x01)
        Responder key distribution: EncKey IdKey (0x03)
< HCI Command: Host Number of Compl.. (0x03|0x0035) plen 5  #63 [hci1] 8.357103
        Num handles: 1
        Handle: 3276 Address: DF:A9:FF:F6:B1:1A (OUI DF-A9-FF)
        Count: 1
> HCI Event: Number of Completed Packets (0x13) plen 5      #64 [hci1] 8.414323
        Num handles: 1
        Handle: 3276 Address: DF:A9:FF:F6:B1:1A (OUI DF-A9-FF)
        Count: 1
        #62: len 11 (1 Kb/s)
        Latency: 57 msec (57-68 msec ~62 msec)
> ACL Data RX: Handle 1711 flags 0x02 dlen 6                #65 [hci1] 8.444228
      SMP: Security Request (0x0b) len 1
        Authentication requirement: Bonding, No MITM, SC, No Keypresses (0x09)
> ACL Data RX: Handle 1711 flags 0x02 dlen 7                #66 [hci1] 8.444727
      ATT: Exchange MTU Response (0x03) len 2
        Server RX MTU: 64
< HCI Command: Host Number of Compl.. (0x03|0x0035) plen 5  #67 [hci1] 8.456405
        Num handles: 1
        Handle: 1711 Address: 64:23:B5:94:C5:F1 (OUI 64-23-B5)
        Count: 1
< ACL Data TX: Handle 1711 flags 0x00 dlen 11               #68 [hci1] 8.456546
      SMP: Pairing Request (0x01) len 6
        IO capability: NoInputNoOutput (0x03)
        OOB data: Authentication data not present (0x00)
        Authentication requirement: Bonding, No MITM, SC, No Keypresses (0x09)
        Max encryption key size: 16
        Initiator key distribution: EncKey (0x01)
        Responder key distribution: EncKey IdKey (0x03)
< HCI Command: Host Number of Compl.. (0x03|0x0035) plen 5  #69 [hci1] 8.456994
        Num handles: 1
        Handle: 1711 Address: 64:23:B5:94:C5:F1 (OUI 64-23-B5)
        Count: 1
> ACL Data RX: Handle 3276 flags 0x02 dlen 11               #70 [hci1] 8.484300
      SMP: Pairing Response (0x02) len 6
        IO capability: KeyboardDisplay (0x04)
        OOB data: Authentication data not present (0x00)
        Authentication requirement: Bonding, No MITM, SC, No Keypresses (0x09)
        Max encryption key size: 16
        Initiator key distribution: EncKey (0x01)
        Responder key distribution: EncKey IdKey (0x03)
< HCI Command: Host Number of Compl.. (0x03|0x0035) plen 5  #71 [hci1] 8.496388
        Num handles: 1
        Handle: 3276 Address: DF:A9:FF:F6:B1:1A (OUI DF-A9-FF)
        Count: 1
< ACL Data TX: Handle 3276 flags 0x00 dlen 27               #72 [hci1] 8.496434
< ACL Data TX: Handle 3276 flags 0x01 dlen 27               #73 [hci1] 8.496498
> HCI Event: Number of Completed Packets (0x13) plen 5      #74 [hci1] 8.514213
        Num handles: 1
        Handle: 1711 Address: 64:23:B5:94:C5:F1 (OUI 64-23-B5)
        Count: 1
        #68: len 11 (1 Kb/s)
        Latency: 57 msec (48-57 msec ~53 msec)
< ACL Data TX: Handle 3276 flags 0x01 dlen 15               #75 [hci1] 8.516239
      SMP: Pairing Public Key (0x0c) len 64
        X: 98308440221e2d910f0e54b71e7ec652857aa9b5a0dc65028824cc19db1226e9
        Y: 67a4816bcb62efb21701e31fdb27561a6217575fb007a8bbdabe7e28b6f68482
> HCI Event: Number of Completed Packets (0x13) plen 5      #76 [hci1] 8.554245
        Num handles: 1
        Handle: 3276 Address: DF:A9:FF:F6:B1:1A (OUI DF-A9-FF)
        Count: 1
        #72: len 27 (3 Kb/s)
        Latency: 57 msec (57-68 msec ~60 msec)
> HCI Event: Number of Completed Packets (0x13) plen 5      #77 [hci1] 8.554689
        Num handles: 1
        Handle: 3276 Address: DF:A9:FF:F6:B1:1A (OUI DF-A9-FF)
        Count: 1
        #73: len 27 (3 Kb/s)
        Latency: 58 msec (57-68 msec ~59 msec)
> HCI Event: Number of Completed Packets (0x13) plen 5      #78 [hci1] 8.555319
        Num handles: 1
        Handle: 3276 Address: DF:A9:FF:F6:B1:1A (OUI DF-A9-FF)
        Count: 1
        #75: len 15 (3 Kb/s)
        Latency: 39 msec (39-68 msec ~49 msec)
> ACL Data RX: Handle 1711 flags 0x02 dlen 11               #79 [hci1] 8.584299
      SMP: Pairing Response (0x02) len 6
        IO capability: KeyboardDisplay (0x04)
        OOB data: Authentication data not present (0x00)
        Authentication requirement: Bonding, No MITM, SC, No Keypresses (0x09)
        Max encryption key size: 16
        Initiator key distribution: EncKey (0x01)
        Responder key distribution: EncKey IdKey (0x03)
< HCI Command: Host Number of Compl.. (0x03|0x0035) plen 5  #80 [hci1] 8.596352
        Num handles: 1
        Handle: 1711 Address: 64:23:B5:94:C5:F1 (OUI 64-23-B5)
        Count: 1
< ACL Data TX: Handle 1711 flags 0x00 dlen 27               #81 [hci1] 8.596435
< ACL Data TX: Handle 1711 flags 0x01 dlen 27               #82 [hci1] 8.596456
< ACL Data TX: Handle 1711 flags 0x01 dlen 15               #83 [hci1] 8.596527
      SMP: Pairing Public Key (0x0c) len 64
        X: 98308440221e2d910f0e54b71e7ec652857aa9b5a0dc65028824cc19db1226e9
        Y: 67a4816bcb62efb21701e31fdb27561a6217575fb007a8bbdabe7e28b6f68482
> ACL Data RX: Handle 3276 flags 0x02 dlen 27               #84 [hci1] 8.624454
> ACL Data RX: Handle 3276 flags 0x01 dlen 27               #85 [hci1] 8.624942
> ACL Data RX: Handle 3276 flags 0x01 dlen 15               #86 [hci1] 8.625283
      SMP: Pairing Public Key (0x0c) len 64
        X: 9a5922e4b0d9bf61ff31a937afb6fb1a54a0bc9673ba908101e531a84da9040a
        Y: 914b35a899c28c18029cfbd16a9fd4179feec271047b16e0aa0c4f597ad5e52e
< HCI Command: Host Number of Compl.. (0x03|0x0035) plen 5  #87 [hci1] 8.636115
        Num handles: 1
        Handle: 3276 Address: DF:A9:FF:F6:B1:1A (OUI DF-A9-FF)
        Count: 1
< HCI Command: Host Number of Compl.. (0x03|0x0035) plen 5  #88 [hci1] 8.636263
        Num handles: 1
        Handle: 3276 Address: DF:A9:FF:F6:B1:1A (OUI DF-A9-FF)
        Count: 1
< HCI Command: Host Number of Compl.. (0x03|0x0035) plen 5  #89 [hci1] 8.636326
        Num handles: 1
        Handle: 3276 Address: DF:A9:FF:F6:B1:1A (OUI DF-A9-FF)
        Count: 1
> HCI Event: Number of Completed Packets (0x13) plen 5      #90 [hci1] 8.654311
        Num handles: 1
        Handle: 1711 Address: 64:23:B5:94:C5:F1 (OUI 64-23-B5)
        Count: 1
        #81: len 27 (3 Kb/s)
        Latency: 57 msec (48-57 msec ~55 msec)
> HCI Event: Number of Completed Packets (0x13) plen 5      #91 [hci1] 8.654711
        Num handles: 1
        Handle: 1711 Address: 64:23:B5:94:C5:F1 (OUI 64-23-B5)
        Count: 1
        #82: len 27 (3 Kb/s)
        Latency: 58 msec (48-58 msec ~56 msec)
> HCI Event: Number of Completed Packets (0x13) plen 5      #92 [hci1] 8.655261
        Num handles: 1
        Handle: 1711 Address: 64:23:B5:94:C5:F1 (OUI 64-23-B5)
        Count: 1
        #83: len 15 (2 Kb/s)
        Latency: 58 msec (48-58 msec ~57 msec)
> ACL Data RX: Handle 3276 flags 0x02 dlen 21               #93 [hci1] 8.694461
      SMP: Pairing Confirm (0x03) len 16
        Confim value: f890a9a69f3902a5524b6e85aa81b6f0
< HCI Command: Host Number of Compl.. (0x03|0x0035) plen 5  #94 [hci1] 8.695816
        Num handles: 1
        Handle: 3276 Address: DF:A9:FF:F6:B1:1A (OUI DF-A9-FF)
        Count: 1
< ACL Data TX: Handle 3276 flags 0x00 dlen 21               #95 [hci1] 8.695912
      SMP: Pairing Random (0x04) len 16
        Random value: 8e6108f966a694cbe26df70bb96773e6
> ACL Data RX: Handle 1711 flags 0x02 dlen 27               #96 [hci1] 8.724476
> ACL Data RX: Handle 1711 flags 0x01 dlen 27               #97 [hci1] 8.724992
> ACL Data RX: Handle 1711 flags 0x01 dlen 15               #98 [hci1] 8.725326
      SMP: Pairing Public Key (0x0c) len 64
        X: 5372c1a8150c220e52babb7c27339f207eb66b4112847e1cb3644cebb6fc74f2
        Y: 0adf9783b2f92836cfe675e7718e358dc110fd88cae1606e8dbdc83d24d2bf96
> ACL Data RX: Handle 1711 flags 0x02 dlen 21               #99 [hci1] 8.725860
      SMP: Pairing Confirm (0x03) len 16
        Confim value: e94769233d72d4f12c5a7500c06c482b
< HCI Command: Host Number of Comp.. (0x03|0x0035) plen 5  #100 [hci1] 8.736553
        Num handles: 1
        Handle: 1711 Address: 64:23:B5:94:C5:F1 (OUI 64-23-B5)
        Count: 1
< HCI Command: Host Number of Comp.. (0x03|0x0035) plen 5  #101 [hci1] 8.736864
        Num handles: 1
        Handle: 1711 Address: 64:23:B5:94:C5:F1 (OUI 64-23-B5)
        Count: 1
< HCI Command: Host Number of Comp.. (0x03|0x0035) plen 5  #102 [hci1] 8.737014
        Num handles: 1
        Handle: 1711 Address: 64:23:B5:94:C5:F1 (OUI 64-23-B5)
        Count: 1
< HCI Command: Host Number of Comp.. (0x03|0x0035) plen 5  #103 [hci1] 8.737279
        Num handles: 1
        Handle: 1711 Address: 64:23:B5:94:C5:F1 (OUI 64-23-B5)
        Count: 1
< ACL Data TX: Handle 1711 flags 0x00 dlen 21              #104 [hci1] 8.737428
      SMP: Pairing Random (0x04) len 16
        Random value: 5da095555cc64d02679f89a05211af56
> HCI Event: Number of Completed Packets (0x13) plen 5     #105 [hci1] 8.764348
        Num handles: 1
        Handle: 3276 Address: DF:A9:FF:F6:B1:1A (OUI DF-A9-FF)
        Count: 1
        #95: len 21 (2 Kb/s)
        Latency: 68 msec (39-68 msec ~58 msec)
> HCI Event: Number of Completed Packets (0x13) plen 5     #106 [hci1] 8.794274
        Num handles: 1
        Handle: 1711 Address: 64:23:B5:94:C5:F1 (OUI 64-23-B5)
        Count: 1
        #104: len 21 (3 Kb/s)
        Latency: 56 msec (48-58 msec ~57 msec)
> ACL Data RX: Handle 3276 flags 0x02 dlen 21              #107 [hci1] 8.834585
      SMP: Pairing Random (0x04) len 16
        Random value: 36340594a443a9980000000000000000
< HCI Command: Host Number of Comp.. (0x03|0x0035) plen 5  #108 [hci1] 8.836608
        Num handles: 1
        Handle: 3276 Address: DF:A9:FF:F6:B1:1A (OUI DF-A9-FF)
        Count: 1
< ACL Data TX: Handle 3276 flags 0x00 dlen 21              #109 [hci1] 8.836773
      SMP: Pairing DHKey Check (0x0d) len 16
        E: 6c29d655257cfdeff473f701e47c6b2d
> ACL Data RX: Handle 1711 flags 0x02 dlen 21              #110 [hci1] 8.864473
      SMP: Pairing Random (0x04) len 16
        Random value: 546b3d5f30c48add0000000000000000
< HCI Command: Host Number of Comp.. (0x03|0x0035) plen 5  #111 [hci1] 8.876600
        Num handles: 1
        Handle: 1711 Address: 64:23:B5:94:C5:F1 (OUI 64-23-B5)
        Count: 1
< ACL Data TX: Handle 1711 flags 0x00 dlen 21              #112 [hci1] 8.876763
      SMP: Pairing DHKey Check (0x0d) len 16
        E: 7580cbbfbc3b87d2b057f93884385a7e
> HCI Event: Number of Completed Packets (0x13) plen 5     #113 [hci1] 8.904284
        Num handles: 1
        Handle: 3276 Address: DF:A9:FF:F6:B1:1A (OUI DF-A9-FF)
        Count: 1
        #109: len 21 (2 Kb/s)
        Latency: 67 msec (39-68 msec ~63 msec)
> HCI Event: Number of Completed Packets (0x13) plen 5     #114 [hci1] 8.934283
        Num handles: 1
        Handle: 1711 Address: 64:23:B5:94:C5:F1 (OUI 64-23-B5)
        Count: 1
        #112: len 21 (2 Kb/s)
        Latency: 57 msec (48-58 msec ~57 msec)
> ACL Data RX: Handle 3276 flags 0x02 dlen 21              #115 [hci1] 9.184478
      SMP: Pairing DHKey Check (0x0d) len 16
        E: 4068b3b00ab7e969914b51e0622163f1
< HCI Command: LE Start Encryption (0x08|0x0019) plen 28   #116 [hci1] 9.196066
        Handle: 3276 Address: DF:A9:FF:F6:B1:1A (OUI DF-A9-FF)
        Random number: 0x0000000000000000
        Encrypted diversifier: 0x0000
        Long term key: 4750be221a2df1b90819004b6836d4a4
> HCI Event: Command Status (0x0f) plen 4                  #117 [hci1] 9.196935
      LE Start Encryption (0x08|0x0019) ncmd 1
        Status: Success (0x00)
> ACL Data RX: Handle 1711 flags 0x02 dlen 21              #118 [hci1] 9.214485
      SMP: Pairing DHKey Check (0x0d) len 16
        E: 8025ec007c64c1f05317f4da95ac3e1e
< HCI Command: Host Number of Comp.. (0x03|0x0035) plen 5  #119 [hci1] 9.215912
        Num handles: 1
        Handle: 3276 Address: DF:A9:FF:F6:B1:1A (OUI DF-A9-FF)
        Count: 1
< HCI Command: LE Start Encryption (0x08|0x0019) plen 28   #120 [hci1] 9.216218
        Handle: 1711 Address: 64:23:B5:94:C5:F1 (OUI 64-23-B5)
        Random number: 0x0000000000000000
        Encrypted diversifier: 0x0000
        Long term key: f9b803227d7b84af1256514a63369261
> HCI Event: Command Status (0x0f) plen 4                  #121 [hci1] 9.217069
      LE Start Encryption (0x08|0x0019) ncmd 1
        Status: Success (0x00)
< HCI Command: Host Number of Comp.. (0x03|0x0035) plen 5  #122 [hci1] 9.236131
        Num handles: 1
        Handle: 1711 Address: 64:23:B5:94:C5:F1 (OUI 64-23-B5)
        Count: 1
> HCI Event: Encryption Change (0x08) plen 4               #123 [hci1] 9.674160
        Status: Success (0x00)
        Handle: 3276 Address: DF:A9:FF:F6:B1:1A (OUI DF-A9-FF)
        Encryption: Enabled with AES-CCM (0x01)
> HCI Event: Encryption Change (0x08) plen 4               #124 [hci1] 9.704250
        Status: Success (0x00)
        Handle: 1711 Address: 64:23:B5:94:C5:F1 (OUI 64-23-B5)
        Encryption: Enabled with AES-CCM (0x01)
> ACL Data RX: Handle 3276 flags 0x02 dlen 21              #125 [hci1] 9.744492
      SMP: Identity Information (0x08) len 16
        Identity resolving key: f4f0337193c9c3b62723b810af0db32e
< HCI Command: Host Number of Comp.. (0x03|0x0035) plen 5  #126 [hci1] 9.756459
        Num handles: 1
        Handle: 3276 Address: DF:A9:FF:F6:B1:1A (OUI DF-A9-FF)
        Count: 1
> ACL Data RX: Handle 1711 flags 0x02 dlen 21              #127 [hci1] 9.774448
      SMP: Identity Information (0x08) len 16
        Identity resolving key: 6de3438b68e0be07728e8c4ec9457b87
< HCI Command: Host Number of Comp.. (0x03|0x0035) plen 5  #128 [hci1] 9.776349
        Num handles: 1
        Handle: 1711 Address: 64:23:B5:94:C5:F1 (OUI 64-23-B5)
        Count: 1
> ACL Data RX: Handle 3276 flags 0x02 dlen 12              #129 [hci1] 9.884397
      SMP: Identity Address Information (0x09) len 7
        Address: DF:A9:FF:F6:B1:1A (OUI DF-A9-FF)
< HCI Command: LE Add Device To R.. (0x08|0x0027) plen 39  #130 [hci1] 9.896547
        Address type: Public (0x00)
        Address: DF:A9:FF:F6:B1:1A (OUI DF-A9-FF)
        Peer identity resolving key: f4f0337193c9c3b62723b810af0db32e
        Local identity resolving key: 00000000000000000000000000000000
> HCI Event: Command Complete (0x0e) plen 4                #131 [hci1] 9.897515
      LE Add Device To Resolving List (0x08|0x0027) ncmd 1
        Status: Success (0x00)
> ACL Data RX: Handle 1711 flags 0x02 dlen 12              #132 [hci1] 9.914446
      SMP: Identity Address Information (0x09) len 7
        Address: 64:23:B5:94:C5:F1 (OUI 64-23-B5)
< HCI Command: LE Set Privacy Mode (0x08|0x004e) plen 8    #133 [hci1] 9.916148
        Peer Identity address type: Public (0x00)
        Peer Identity address: DF:A9:FF:F6:B1:1A (OUI DF-A9-FF)
        Privacy Mode: Use Device Privacy (0x01)
> HCI Event: Command Complete (0x0e) plen 4                #134 [hci1] 9.916748
      LE Set Privacy Mode (0x08|0x004e) ncmd 1
        Status: Success (0x00)
< HCI Command: LE Set Address Reso.. (0x08|0x002d) plen 1  #135 [hci1] 9.935916
        Address resolution: Enabled (0x01)
> HCI Event: Command Complete (0x0e) plen 4                #136 [hci1] 9.936403
      LE Set Address Resolution Enable (0x08|0x002d) ncmd 1
        Status: Success (0x00)
< HCI Command: Host Number of Comp.. (0x03|0x0035) plen 5  #137 [hci1] 9.955862
        Num handles: 1
        Handle: 3276 Address: DF:A9:FF:F6:B1:1A (OUI DF-A9-FF)
        Count: 1
< HCI Command: LE Set Address Reso.. (0x08|0x002d) plen 1  #138 [hci1] 9.956131
        Address resolution: Disabled (0x00)
> HCI Event: Command Complete (0x0e) plen 4                #139 [hci1] 9.956542
      LE Set Address Resolution Enable (0x08|0x002d) ncmd 1
        Status: Success (0x00)
< HCI Command: LE Add Device To R.. (0x08|0x0027) plen 39  #140 [hci1] 9.975844
        Address type: Public (0x00)
        Address: 64:23:B5:94:C5:F1 (OUI 64-23-B5)
        Peer identity resolving key: 6de3438b68e0be07728e8c4ec9457b87
        Local identity resolving key: 00000000000000000000000000000000
> HCI Event: Command Complete (0x0e) plen 4                #141 [hci1] 9.976794
      LE Add Device To Resolving List (0x08|0x0027) ncmd 1
        Status: Success (0x00)
< HCI Command: LE Set Privacy Mode (0x08|0x004e) plen 8    #142 [hci1] 9.995893
        Peer Identity address type: Public (0x00)
        Peer Identity address: 64:23:B5:94:C5:F1 (OUI 64-23-B5)
        Privacy Mode: Use Device Privacy (0x01)
> HCI Event: Command Complete (0x0e) plen 4                #143 [hci1] 9.996504
      LE Set Privacy Mode (0x08|0x004e) ncmd 1
        Status: Success (0x00)
< HCI Command: LE Set Address Res.. (0x08|0x002d) plen 1  #144 [hci1] 10.015888
        Address resolution: Enabled (0x01)
> HCI Event: Command Complete (0x0e) plen 4               #145 [hci1] 10.016293
      LE Set Address Resolution Enable (0x08|0x002d) ncmd 1
        Status: Success (0x00)
< HCI Command: Host Number of Com.. (0x03|0x0035) plen 5  #146 [hci1] 10.035859
        Num handles: 1
        Handle: 1711 Address: 64:23:B5:94:C5:F1 (OUI 64-23-B5)
        Count: 1
< ACL Data TX: Handle 3276 flags 0x00 dlen 13             #147 [hci1] 10.526525
      ATT: Find By Type Value Request (0x06) len 8
        Handle range: 0x0001-0xffff
        Attribute type: Primary Service (0x2800)
          UUID: Common Audio (0x1853)
> HCI Event: Number of Completed Packets (0x13) plen 5    #148 [hci1] 10.584296
        Num handles: 1
        Handle: 3276 Address: DF:A9:FF:F6:B1:1A (OUI DF-A9-FF)
        Count: 1
        #147: len 13 (1 Kb/s)
        Latency: 57 msec (39-68 msec ~60 msec)
> ACL Data RX: Handle 3276 flags 0x02 dlen 9              #149 [hci1] 10.654329
      ATT: Find By Type Value Response (0x07) len 4
        Handle range: 0x02c0-0x02c1
< HCI Command: Host Number of Com.. (0x03|0x0035) plen 5  #150 [hci1] 10.656403
        Num handles: 1
        Handle: 3276 Address: DF:A9:FF:F6:B1:1A (OUI DF-A9-FF)
        Count: 1
< ACL Data TX: Handle 3276 flags 0x00 dlen 11             #151 [hci1] 10.656610
      ATT: Read By Type Request (0x08) len 6
        Handle range: 0x02c1-0x02c1
        Attribute type: Include (0x2802)
> HCI Event: Number of Completed Packets (0x13) plen 5    #152 [hci1] 10.724271
        Num handles: 1
        Handle: 3276 Address: DF:A9:FF:F6:B1:1A (OUI DF-A9-FF)
        Count: 1
        #151: len 11 (1 Kb/s)
        Latency: 67 msec (39-68 msec ~64 msec)
> ACL Data RX: Handle 3276 flags 0x02 dlen 14             #153 [hci1] 10.794393
      ATT: Read By Type Response (0x09) len 9
        Attribute data length: 8
        Attribute data list: 1 entry
        Handle: 0x02c1
        Value: e002ea024618
< HCI Command: Host Number of Com.. (0x03|0x0035) plen 5  #154 [hci1] 10.796427
        Num handles: 1
        Handle: 3276 Address: DF:A9:FF:F6:B1:1A (OUI DF-A9-FF)
        Count: 1
< ACL Data TX: Handle 3276 flags 0x00 dlen 13             #155 [hci1] 10.796588
      ATT: Find By Type Value Request (0x06) len 8
        Handle range: 0x0001-0xffff
        Attribute type: Primary Service (0x2800)
          UUID: Coordinated Set Identification (0x1846)
> HCI Event: Number of Completed Packets (0x13) plen 5    #156 [hci1] 10.864257
        Num handles: 1
        Handle: 3276 Address: DF:A9:FF:F6:B1:1A (OUI DF-A9-FF)
        Count: 1
        #155: len 13 (1 Kb/s)
        Latency: 67 msec (39-68 msec ~65 msec)
> ACL Data RX: Handle 3276 flags 0x02 dlen 9              #157 [hci1] 10.934312
      ATT: Find By Type Value Response (0x07) len 4
        Handle range: 0x02e0-0x02ea
< HCI Command: Host Number of Com.. (0x03|0x0035) plen 5  #158 [hci1] 10.936130
        Num handles: 1
        Handle: 3276 Address: DF:A9:FF:F6:B1:1A (OUI DF-A9-FF)
        Count: 1
< ACL Data TX: Handle 3276 flags 0x00 dlen 13             #159 [hci1] 10.936180
      ATT: Find By Type Value Request (0x06) len 8
        Handle range: 0x02eb-0xffff
        Attribute type: Primary Service (0x2800)
          UUID: Coordinated Set Identification (0x1846)
> HCI Event: Number of Completed Packets (0x13) plen 5    #160 [hci1] 11.004331
        Num handles: 1
        Handle: 3276 Address: DF:A9:FF:F6:B1:1A (OUI DF-A9-FF)
        Count: 1
        #159: len 13 (1 Kb/s)
        Latency: 68 msec (39-68 msec ~67 msec)
> ACL Data RX: Handle 3276 flags 0x02 dlen 9              #161 [hci1] 11.074310
      ATT: Error Response (0x01) len 4
        Find By Type Value Request (0x06)
        Handle: 0x02eb
        Error: Attribute Not Found (0x0a)
< HCI Command: Host Number of Com.. (0x03|0x0035) plen 5  #162 [hci1] 11.076605
        Num handles: 1
        Handle: 3276 Address: DF:A9:FF:F6:B1:1A (OUI DF-A9-FF)
        Count: 1
< ACL Data TX: Handle 3276 flags 0x00 dlen 11             #163 [hci1] 11.076781
      ATT: Read By Type Request (0x08) len 6
        Handle range: 0x02e0-0x02ea
        Attribute type: Characteristic (0x2803)
> HCI Event: Number of Completed Packets (0x13) plen 5    #164 [hci1] 11.144355
        Num handles: 1
        Handle: 3276 Address: DF:A9:FF:F6:B1:1A (OUI DF-A9-FF)
        Count: 1
        #163: len 11 (1 Kb/s)
        Latency: 67 msec (39-68 msec ~67 msec)
> ACL Data RX: Handle 3276 flags 0x02 dlen 27             #165 [hci1] 11.214507
> ACL Data RX: Handle 3276 flags 0x01 dlen 7              #166 [hci1] 11.214792
      ATT: Read By Type Response (0x09) len 29
        Attribute data length: 7
        Attribute data list: 4 entries
        Handle: 0x02e1
        Value: 02e202842b
            Properties: 0x02
              Read (0x02)
            Value Handle: 0x02e2
            Value UUID: Set Identity Resolving Key (0x2b84)
        Handle: 0x02e3
        Value: 1ae402862b
            Properties: 0x1a
              Read (0x02)
              Write (0x08)
              Notify (0x10)
            Value Handle: 0x02e4
            Value UUID: Set Member Lock (0x2b86)
        Handle: 0x02e6
        Value: 12e702852b
            Properties: 0x12
              Read (0x02)
              Notify (0x10)
            Value Handle: 0x02e7
            Value UUID: Coordinated Set Size (0x2b85)
        Handle: 0x02e9
        Value: 02ea02872b
            Properties: 0x02
              Read (0x02)
            Value Handle: 0x02ea
            Value UUID: Set Member Rank (0x2b87)
< HCI Command: Host Number of Com.. (0x03|0x0035) plen 5  #167 [hci1] 11.215974
        Num handles: 1
        Handle: 3276 Address: DF:A9:FF:F6:B1:1A (OUI DF-A9-FF)
        Count: 1
< HCI Command: Host Number of Com.. (0x03|0x0035) plen 5  #168 [hci1] 11.215999
        Num handles: 1
        Handle: 3276 Address: DF:A9:FF:F6:B1:1A (OUI DF-A9-FF)
        Count: 1
< ACL Data TX: Handle 3276 flags 0x00 dlen 9              #169 [hci1] 11.216107
      ATT: Find Information Request (0x04) len 4
        Handle range: 0x02e4-0x02ea
> HCI Event: Number of Completed Packets (0x13) plen 5    #170 [hci1] 11.284262
        Num handles: 1
        Handle: 3276 Address: DF:A9:FF:F6:B1:1A (OUI DF-A9-FF)
        Count: 1
        #169: len 9 (1 Kb/s)
        Latency: 68 msec (39-68 msec ~67 msec)
> ACL Data RX: Handle 3276 flags 0x02 dlen 27             #171 [hci1] 11.354406
> ACL Data RX: Handle 3276 flags 0x01 dlen 7              #172 [hci1] 11.354804
      ATT: Find Information Response (0x05) len 29
        Format: UUID-16 (0x01)
        Handle: 0x02e4
        UUID: Set Member Lock (0x2b86)
        Handle: 0x02e5
        UUID: Client Characteristic Configuration (0x2902)
        Handle: 0x02e6
        UUID: Characteristic (0x2803)
        Handle: 0x02e7
        UUID: Coordinated Set Size (0x2b85)
        Handle: 0x02e8
        UUID: Client Characteristic Configuration (0x2902)
        Handle: 0x02e9
        UUID: Characteristic (0x2803)
        Handle: 0x02ea
        UUID: Set Member Rank (0x2b87)
< HCI Command: Host Number of Com.. (0x03|0x0035) plen 5  #173 [hci1] 11.356616
        Num handles: 1
        Handle: 3276 Address: DF:A9:FF:F6:B1:1A (OUI DF-A9-FF)
        Count: 1
< HCI Command: Host Number of Com.. (0x03|0x0035) plen 5  #174 [hci1] 11.356741
        Num handles: 1
        Handle: 3276 Address: DF:A9:FF:F6:B1:1A (OUI DF-A9-FF)
        Count: 1
< ACL Data TX: Handle 3276 flags 0x00 dlen 9              #175 [hci1] 11.356895
      ATT: Find Information Request (0x04) len 4
        Handle range: 0x02e7-0x02ea
> HCI Event: Number of Completed Packets (0x13) plen 5    #176 [hci1] 11.424216
        Num handles: 1
        Handle: 3276 Address: DF:A9:FF:F6:B1:1A (OUI DF-A9-FF)
        Count: 1
        #175: len 9 (1 Kb/s)
        Latency: 67 msec (39-68 msec ~67 msec)
> ACL Data RX: Handle 3276 flags 0x02 dlen 22             #177 [hci1] 11.494429
      ATT: Find Information Response (0x05) len 17
        Format: UUID-16 (0x01)
        Handle: 0x02e7
        UUID: Coordinated Set Size (0x2b85)
        Handle: 0x02e8
        UUID: Client Characteristic Configuration (0x2902)
        Handle: 0x02e9
        UUID: Characteristic (0x2803)
        Handle: 0x02ea
        UUID: Set Member Rank (0x2b87)
< HCI Command: Host Number of Com.. (0x03|0x0035) plen 5  #178 [hci1] 11.496340
        Num handles: 1
        Handle: 3276 Address: DF:A9:FF:F6:B1:1A (OUI DF-A9-FF)
        Count: 1
< ACL Data TX: Handle 3276 flags 0x00 dlen 11             #179 [hci1] 11.496441
      ATT: Read By Type Request (0x08) len 6
        Handle range: 0x02ea-0x02ea
        Attribute type: Characteristic (0x2803)
> HCI Event: Number of Completed Packets (0x13) plen 5    #180 [hci1] 11.564273
        Num handles: 1
        Handle: 3276 Address: DF:A9:FF:F6:B1:1A (OUI DF-A9-FF)
        Count: 1
        #179: len 11 (1 Kb/s)
        Latency: 67 msec (39-68 msec ~67 msec)
> ACL Data RX: Handle 3276 flags 0x02 dlen 9              #181 [hci1] 11.634235
      ATT: Error Response (0x01) len 4
        Read By Type Request (0x08)
        Handle: 0x02ea
        Error: Attribute Not Found (0x0a)
< HCI Command: Host Number of Com.. (0x03|0x0035) plen 5  #182 [hci1] 11.636542
        Num handles: 1
        Handle: 3276 Address: DF:A9:FF:F6:B1:1A (OUI DF-A9-FF)
        Count: 1
< ACL Data TX: Handle 3276 flags 0x00 dlen 9              #183 [hci1] 11.636647
      ATT: Write Request (0x12) len 4
        Handle: 0x02e5
          Data: 0100
> HCI Event: Number of Completed Packets (0x13) plen 5    #184 [hci1] 11.704161
        Num handles: 1
        Handle: 3276 Address: DF:A9:FF:F6:B1:1A (OUI DF-A9-FF)
        Count: 1
        #183: len 9 (1 Kb/s)
        Latency: 67 msec (39-68 msec ~67 msec)
> ACL Data RX: Handle 3276 flags 0x02 dlen 5              #185 [hci1] 11.774198
      ATT: Write Response (0x13) len 0
< HCI Command: Host Number of Com.. (0x03|0x0035) plen 5  #186 [hci1] 11.776460
        Num handles: 1
        Handle: 3276 Address: DF:A9:FF:F6:B1:1A (OUI DF-A9-FF)
        Count: 1
< ACL Data TX: Handle 3276 flags 0x00 dlen 9              #187 [hci1] 11.776558
      ATT: Write Request (0x12) len 4
        Handle: 0x02e8
          Data: 0100
> HCI Event: Number of Completed Packets (0x13) plen 5    #188 [hci1] 11.844151
        Num handles: 1
        Handle: 3276 Address: DF:A9:FF:F6:B1:1A (OUI DF-A9-FF)
        Count: 1
        #187: len 9 (1 Kb/s)
        Latency: 67 msec (39-68 msec ~67 msec)
> ACL Data RX: Handle 3276 flags 0x02 dlen 5              #189 [hci1] 11.914201
      ATT: Write Response (0x13) len 0
< HCI Command: Host Number of Com.. (0x03|0x0035) plen 5  #190 [hci1] 11.916460
        Num handles: 1
        Handle: 3276 Address: DF:A9:FF:F6:B1:1A (OUI DF-A9-FF)
        Count: 1
< ACL Data TX: Handle 3276 flags 0x00 dlen 7              #191 [hci1] 11.916606
      ATT: Read Request (0x0a) len 2
        Handle: 0x02e2
> HCI Event: Number of Completed Packets (0x13) plen 5    #192 [hci1] 11.984173
        Num handles: 1
        Handle: 3276 Address: DF:A9:FF:F6:B1:1A (OUI DF-A9-FF)
        Count: 1
        #191: len 7 (0 Kb/s)
        Latency: 67 msec (39-68 msec ~67 msec)
> ACL Data RX: Handle 3276 flags 0x02 dlen 22             #193 [hci1] 12.054367
      ATT: Read Response (0x0b) len 17
< HCI Command: Host Number of Com.. (0x03|0x0035) plen 5  #194 [hci1] 12.056485
        Num handles: 1
        Handle: 3276 Address: DF:A9:FF:F6:B1:1A (OUI DF-A9-FF)
        Count: 1
< ACL Data TX: Handle 3276 flags 0x00 dlen 7              #195 [hci1] 12.056596
      ATT: Read Request (0x0a) len 2
        Handle: 0x02e7
> HCI Event: Number of Completed Packets (0x13) plen 5    #196 [hci1] 12.124211
        Num handles: 1
        Handle: 3276 Address: DF:A9:FF:F6:B1:1A (OUI DF-A9-FF)
        Count: 1
        #195: len 7 (0 Kb/s)
        Latency: 67 msec (39-68 msec ~67 msec)
> ACL Data RX: Handle 3276 flags 0x02 dlen 6              #197 [hci1] 12.194272
      ATT: Read Response (0x0b) len 1
< HCI Command: Host Number of Com.. (0x03|0x0035) plen 5  #198 [hci1] 12.196419
        Num handles: 1
        Handle: 3276 Address: DF:A9:FF:F6:B1:1A (OUI DF-A9-FF)
        Count: 1
< ACL Data TX: Handle 3276 flags 0x00 dlen 7              #199 [hci1] 12.196538
      ATT: Read Request (0x0a) len 2
        Handle: 0x02ea
> HCI Event: Number of Completed Packets (0x13) plen 5    #200 [hci1] 12.264160
        Num handles: 1
        Handle: 3276 Address: DF:A9:FF:F6:B1:1A (OUI DF-A9-FF)
        Count: 1
        #199: len 7 (0 Kb/s)
        Latency: 67 msec (39-68 msec ~67 msec)
> ACL Data RX: Handle 3276 flags 0x02 dlen 6              #201 [hci1] 12.334164
      ATT: Read Response (0x0b) len 1
< HCI Command: Host Number of Com.. (0x03|0x0035) plen 5  #202 [hci1] 12.337607
        Num handles: 1
        Handle: 3276 Address: DF:A9:FF:F6:B1:1A (OUI DF-A9-FF)
        Count: 1
< ACL Data TX: Handle 3276 flags 0x00 dlen 11             #203 [hci1] 12.365998
      ATT: Read By Type Request (0x08) len 6
        Handle range: 0x0001-0xffff
        Attribute type: Characteristic (0x2803)
> HCI Event: Number of Completed Packets (0x13) plen 5    #204 [hci1] 12.404234
        Num handles: 1
        Handle: 3276 Address: DF:A9:FF:F6:B1:1A (OUI DF-A9-FF)
        Count: 1
        #203: len 11 (2 Kb/s)
        Latency: 38 msec (38-68 msec ~52 msec)
> ACL Data RX: Handle 3276 flags 0x02 dlen 27             #205 [hci1] 12.474415
> ACL Data RX: Handle 3276 flags 0x01 dlen 27             #206 [hci1] 12.474934
> ACL Data RX: Handle 3276 flags 0x01 dlen 8              #207 [hci1] 12.475236
      ATT: Read By Type Response (0x09) len 57
        Attribute data length: 7
        Attribute data list: 8 entries
        Handle: 0x0002
        Value: 0a0300002a
            Properties: 0x0a
              Read (0x02)
              Write (0x08)
            Value Handle: 0x0003
            Value UUID: Device Name (0x2a00)
        Handle: 0x0004
        Value: 0a0500012a
            Properties: 0x0a
              Read (0x02)
              Write (0x08)
            Value Handle: 0x0005
            Value UUID: Appearance (0x2a01)
        Handle: 0x0006
        Value: 4e07000945
            Properties: 0x4e
              Read (0x02)
              Write Without Response (0x04)
              Write (0x08)
              Authorize (0x40)
              Extended Properties (0x80)
            Value Handle: 0x0007
            Value UUID: Unknown (0x4509)
        Handle: 0x0008
        Value: 020900042a
            Properties: 0x02
              Read (0x02)
            Value Handle: 0x0009
            Value UUID: Peripheral Preferred Connection Parameters (0x2a04)
        Handle: 0x000a
        Value: 120b00192a
            Properties: 0x12
              Read (0x02)
              Notify (0x10)
            Value Handle: 0x000b
            Value UUID: Battery Level (0x2a19)
        Handle: 0x000e
        Value: 020f00a62a
            Properties: 0x02
              Read (0x02)
            Value Handle: 0x000f
            Value UUID: Central Address Resolution (0x2aa6)
        Handle: 0x0041
        Value: 204200052a
            Properties: 0x20
              Indicate (0x20)
            Value Handle: 0x0042
            Value UUID: Service Changed (0x2a05)
        Handle: 0x0044
        Value: 0a4500292b
            Properties: 0x0a
              Read (0x02)
              Write (0x08)
            Value Handle: 0x0045
            Value UUID: Client Supported Features (0x2b29)
< HCI Command: Host Number of Com.. (0x03|0x0035) plen 5  #208 [hci1] 12.476742
        Num handles: 1
        Handle: 3276 Address: DF:A9:FF:F6:B1:1A (OUI DF-A9-FF)
        Count: 1
< HCI Command: Host Number of Com.. (0x03|0x0035) plen 5  #209 [hci1] 12.477045
        Num handles: 1
        Handle: 3276 Address: DF:A9:FF:F6:B1:1A (OUI DF-A9-FF)
        Count: 1
< HCI Command: Host Number of Com.. (0x03|0x0035) plen 5  #210 [hci1] 12.477096
        Num handles: 1
        Handle: 3276 Address: DF:A9:FF:F6:B1:1A (OUI DF-A9-FF)
        Count: 1
