Bluetooth monitor ver 5.84
btmon[1470427]: = Note: Linux version 6.8.0-83-generic (x86_64)                                                          0.055689
btmon[1470427]: = Note: Bluetooth subsystem version 2.22                                                                 0.055691
= New Index: 00:00:00:00:00:00 (Primary,UART,hci0)                                                                       0.055691
= Open Index: 00:00:00:00:00:00                                                                                          0.062921
= Index Info: 00:00:00:00:00:00 (Nordic Semiconductor ASA)                                                               0.062925
zephyr.exe[1470429]: @ USER Open: main (privileged) version 2.22                                                {0x0001} 0.062927
zephyr.exe[1470429]: < HCI Command: Reset (0x03|0x0003) plen 0                                                        #1 0.063164
> HCI Event: Command Complete (0x0e) plen 4                                                                           #2 0.064049
      Reset (0x03|0x0003) ncmd 1
        Status: Success (0x00)
zephyr.exe[1470429]: < HCI Command: Read Local Supported Features (0x04|0x0003) plen 0                                #3 0.082905
> HCI Event: Command Complete (0x0e) plen 12                                                                          #4 0.083969
      Read Local Supported Features (0x04|0x0003) ncmd 1
        Status: Success (0x00)
        Features: 0x00 0x00 0x00 0x00 0x60 0x00 0x00 0x00
          BR/EDR Not Supported
          LE Supported (Controller)
zephyr.exe[1470429]: < HCI Command: Read Local Version Information (0x04|0x0001) plen 0                               #5 0.102912
> HCI Event: Command Complete (0x0e) plen 12                                                                          #6 0.103540
      Read Local Version Information (0x04|0x0001) ncmd 1
        Status: Success (0x00)
        HCI version: Reserved (0x0e) - Revision 12520 (0x30e8)
        LMP version: Reserved (0x0e) - Subversion 12520 (0x30e8)
        Manufacturer: Nordic Semiconductor ASA (89)
zephyr.exe[1470429]: < HCI Command: Read Local Supported Commands (0x04|0x0002) plen 0                                #7 0.122921
> HCI Event: Command Complete (0x0e) plen 68                                                                          #8 0.124213
      Read Local Supported Commands (0x04|0x0002) ncmd 1
        Status: Success (0x00)
        Commands: 119 entries
          Disconnect (Octet 0 - Bit 5)
          Read Remote Version Information (Octet 2 - Bit 7)
          Set Event Mask (Octet 5 - Bit 6)
          Reset (Octet 5 - Bit 7)
          Read Connection Accept Timeout (Octet 7 - Bit 2)
          Write Connection Accept Timeout (Octet 7 - Bit 3)
          Read Transmit Power Level (Octet 10 - Bit 2)
          Set Controller To Host Flow Control (Octet 10 - Bit 5)
          Host Buffer Size (Octet 10 - Bit 6)
          Host Number of Completed Packets (Octet 10 - Bit 7)
          Read Local Version Information (Octet 14 - Bit 3)
          Read Local Supported Features (Octet 14 - Bit 5)
          Read BD ADDR (Octet 15 - Bit 1)
          Read RSSI (Octet 15 - Bit 5)
          Set Event Mask Page 2 (Octet 22 - Bit 2)
          LE Set Event Mask (Octet 25 - Bit 0)
          LE Read Buffer Size (Octet 25 - Bit 1)
          LE Read Local Supported Features (Octet 25 - Bit 2)
          LE Set Random Address (Octet 25 - Bit 4)
          LE Set Advertising Parameters (Octet 25 - Bit 5)
          LE Read Advertising Channel TX Power (Octet 25 - Bit 6)
          LE Set Advertising Data (Octet 25 - Bit 7)
          LE Set Scan Response Data (Octet 26 - Bit 0)
          LE Set Advertise Enable (Octet 26 - Bit 1)
          LE Set Scan Parameters (Octet 26 - Bit 2)
          LE Set Scan Enable (Octet 26 - Bit 3)
          LE Create Connection (Octet 26 - Bit 4)
          LE Create Connection Cancel (Octet 26 - Bit 5)
          LE Read Accept List Size (Octet 26 - Bit 6)
          LE Clear Accept List (Octet 26 - Bit 7)
          LE Add Device To Accept List (Octet 27 - Bit 0)
          LE Remove Device From Accept List (Octet 27 - Bit 1)
          LE Connection Update (Octet 27 - Bit 2)
          LE Set Host Channel Classification (Octet 27 - Bit 3)
          LE Read Channel Map (Octet 27 - Bit 4)
          LE Read Remote Used Features (Octet 27 - Bit 5)
          LE Encrypt (Octet 27 - Bit 6)
          LE Rand (Octet 27 - Bit 7)
          LE Start Encryption (Octet 28 - Bit 0)
          LE Long Term Key Request Reply (Octet 28 - Bit 1)
          LE Long Term Key Request Neg Reply (Octet 28 - Bit 2)
          LE Read Supported States (Octet 28 - Bit 3)
          LE Receiver Test (Octet 28 - Bit 4)
          LE Transmitter Test (Octet 28 - Bit 5)
          LE Test End (Octet 28 - Bit 6)
          Read Authenticated Payload Timeout (Octet 32 - Bit 4)
          Write Authenticated Payload Timeout (Octet 32 - Bit 5)
          LE Set Data Length (Octet 33 - Bit 6)
          LE Read Suggested Default Data Length (Octet 33 - Bit 7)
          LE Write Suggested Default Data Length (Octet 34 - Bit 0)
          LE Add Device To Resolving List (Octet 34 - Bit 3)
          LE Remove Device From Resolving List (Octet 34 - Bit 4)
          LE Clear Resolving List (Octet 34 - Bit 5)
          LE Read Resolving List Size (Octet 34 - Bit 6)
          LE Set Address Resolution Enable (Octet 35 - Bit 1)
          LE Set Resolvable Private Address Timeout (Octet 35 - Bit 2)
          LE Read Maximum Data Length (Octet 35 - Bit 3)
          LE Read PHY (Octet 35 - Bit 4)
          LE Set Default PHY (Octet 35 - Bit 5)
          LE Set PHY (Octet 35 - Bit 6)
          LE Enhanced Receiver Test (Octet 35 - Bit 7)
          LE Enhanced Transmitter Test (Octet 36 - Bit 0)
          LE Set Advertising Set Random Address (Octet 36 - Bit 1)
          LE Set Extended Advertising Parameters (Octet 36 - Bit 2)
          LE Set Extended Advertising Data (Octet 36 - Bit 3)
          LE Set Extended Scan Response Data (Octet 36 - Bit 4)
          LE Set Extended Advertising Enable (Octet 36 - Bit 5)
          LE Read Maximum Advertising Data Length (Octet 36 - Bit 6)
          LE Read Number of Supported Advertising Sets (Octet 36 - Bit 7)
          LE Remove Advertising Set (Octet 37 - Bit 0)
          LE Clear Advertising Sets (Octet 37 - Bit 1)
          LE Set Periodic Advertising Parameters (Octet 37 - Bit 2)
          LE Set Periodic Advertising Data (Octet 37 - Bit 3)
          LE Set Periodic Advertising Enable (Octet 37 - Bit 4)
          LE Set Extended Scan Parameters (Octet 37 - Bit 5)
          LE Set Extended Scan Enable (Octet 37 - Bit 6)
          LE Extended Create Connection (Octet 37 - Bit 7)
          LE Periodic Advertising Create Sync (Octet 38 - Bit 0)
          LE Periodic Advertising Create Sync Cancel (Octet 38 - Bit 1)
          LE Periodic Advertising Terminate Sync (Octet 38 - Bit 2)
          LE Add Device To Periodic Advertiser List (Octet 38 - Bit 3)
          LE Remove Device From Periodic Advertiser List (Octet 38 - Bit 4)
          LE Clear Periodic Advertiser List (Octet 38 - Bit 5)
          LE Read Periodic Advertiser List Size (Octet 38 - Bit 6)
          LE Read Transmit Power (Octet 38 - Bit 7)
          LE Read RF Path Compensation (Octet 39 - Bit 0)
          LE Write RF Path Compensation (Octet 39 - Bit 1)
          LE Set Privacy Mode (Octet 39 - Bit 2)
          LE Periodic Advertising Receive Enable (Octet 40 - Bit 5)
          LE Periodic Advertising Sync Transfer (Octet 40 - Bit 6)
          LE Periodic Advertising Set Info Transfer (Octet 40 - Bit 7)
          LE Periodic Advertising Sync Transfer Parameters (Octet 41 - Bit 0)
          LE Set Default Periodic Advertisng Sync Transfer Parameters (Octet 41 - Bit 1)
          LE Read Buffer v2 (Octet 41 - Bit 5)
          LE Read ISO TX Sync (Octet 41 - Bit 6)
          LE Set Connected Isochronous Group Parameters (Octet 41 - Bit 7)
          LE Set Connected Isochronous Group Parameters Test (Octet 42 - Bit 0)
          LE Create Connected Isochronous Stream (Octet 42 - Bit 1)
          LE Remove Connected Isochronous Group (Octet 42 - Bit 2)
          LE Accept Connected Isochronous Stream Request (Octet 42 - Bit 3)
          LE Reject Connected Isochronous Stream Request (Octet 42 - Bit 4)
          LE Create Broadcast Isochronous Group (Octet 42 - Bit 5)
          LE Create Broadcast Isochronous Group Test (Octet 42 - Bit 6)
          LE Terminate Broadcast Isochronous Group (Octet 42 - Bit 7)
          LE Broadcast Isochronous Group Create Sync (Octet 43 - Bit 0)
          LE Broadcast Isochronous Group Terminate Sync (Octet 43 - Bit 1)
          LE Request Peer SCA (Octet 43 - Bit 2)
          LE Setup Isochronous Data Path (Octet 43 - Bit 3)
          LE Remove Isochronous Data Path (Octet 43 - Bit 4)
          LE Isochronous Transmit Test (Octet 43 - Bit 5)
          LE Isochronous Receive Test (Octet 43 - Bit 6)
          LE Isochronous Read Test Counters (Octet 43 - Bit 7)
          LE Isochronous Read Test Counters (Octet 44 - Bit 0)
          LE Set Host Feature (Octet 44 - Bit 1)
          LE Read ISO link quality (Octet 44 - Bit 2)
          Octet 45 - Bit 6 
          Octet 46 - Bit 0 
          Octet 46 - Bit 1 
          Octet 46 - Bit 2 
zephyr.exe[1470429]: < HCI Command: Host Buffer Size (0x03|0x0033) plen 7                                             #9 0.142908
        ACL MTU: 255  ACL max packet: 16
        SCO MTU: 0    SCO max packet: 0
> HCI Event: Command Complete (0x0e) plen 4                                                                          #10 0.143586
      Host Buffer Size (0x03|0x0033) ncmd 1
        Status: Success (0x00)
zephyr.exe[1470429]: < HCI Command: Set Controller To Host Flow Control (0x03|0x0031) plen 1                         #11 0.162905
        Flow control: ACL Data Packets (0x01)
> HCI Event: Command Complete (0x0e) plen 4                                                                          #12 0.163396
      Set Controller To Host Flow Control (0x03|0x0031) ncmd 1
        Status: Success (0x00)
zephyr.exe[1470429]: < HCI Command: LE Read Local Supported Features (0x08|0x0003) plen 0                            #13 0.182913
> HCI Event: Command Complete (0x0e) plen 12                                                                         #14 0.183541
      LE Read Local Supported Features (0x08|0x0003) ncmd 1
        Status: Success (0x00)
        Features: 0xfd 0x79 0x00 0xf7 0x30 0x01 0x00 0x00
          LE Encryption
          Extended Reject Indication
          Peripheral-initiated Features Exchange
          LE Ping
          LE Data Packet Length Extension
          LL Privacy
          Extended Scanner Filter Policies
          LE 2M PHY
          LE Coded PHY
          LE Extended Advertising
          LE Periodic Advertising
          Channel Selection Algorithm #2
          Periodic Advertising Sync Transfer - Sender
          Periodic Advertising Sync Transfer - Recipient
          Sleep Clock Accuracy Updates
          Connected Isochronous Stream - Central
          Connected Isochronous Stream - Peripheral
          Isochronous Broadcaster
          Synchronized Receiver
          Periodic Advertising ADI support
          Connection Subrating
          Unknown features (0x0000010000000000)
zephyr.exe[1470429]: < HCI Command: LE Set Host Feature (0x08|0x0074) plen 2                                         #15 0.202907
        Bit Number: 32
          Connected Isochronous Stream (Host Support)
        Bit Value: 1
> HCI Event: Command Complete (0x0e) plen 4                                                                          #16 0.203587
      LE Set Host Feature (0x08|0x0074) ncmd 1
        Status: Success (0x00)
zephyr.exe[1470429]: < HCI Command: LE Read Buffer v2 (0x08|0x0060) plen 0                                           #17 0.222906
> HCI Event: Command Complete (0x0e) plen 10                                                                         #18 0.223735
      LE Read Buffer v2 (0x08|0x0060) ncmd 1
        Status: Success (0x00)
        ACL MTU: 27
        ACL max packet: 3
        ISO MTU: 318
        ISO max packet: 3
zephyr.exe[1470429]: < HCI Command: LE Read Maximum Advertising Data Length (0x08|0x003a) plen 0                     #19 0.242933
> HCI Event: Command Complete (0x0e) plen 6                                                                          #20 0.243796
      LE Read Maximum Advertising Data Length (0x08|0x003a) ncmd 1
        Status: Success (0x00)
        Max length: 1650
zephyr.exe[1470429]: < HCI Command: LE Read Supported States (0x08|0x001c) plen 0                                    #21 0.262918
> HCI Event: Command Complete (0x0e) plen 12                                                                         #22 0.263887
      LE Read Supported States (0x08|0x001c) ncmd 1
        Status: Success (0x00)
        States: 0x000003ff3e0306ff
          Non-connectable Advertising State
          Scannable Advertising State
          Connectable Advertising State
          High Duty Cycle Directed Advertising State
          Passive Scanning State
          Active Scanning State
          Initiating State
            and Connection State (Central Role)
          Connection State (Peripheral Role)
          Scannable Advertising State
            and Passive Scanning State
          Connectable Advertising State
            and Passive Scanning State
          Non-connectable Advertising State
            and Initiating State
          Scannable Advertising State
            and Initiating State
          Active Scanning State
            and Connection State (Central Role)
          Passive Scanning State
            and Connection State (Peripheral Role)
          Active Scanning State
            and Connection State (Peripheral Role)
          Initiating State
            and Connection State (Central Role)
            and Central Role & Central Role
          Low Duty Cycle Directed Advertising State
          Connectable Advertising State
            and Initiating State
            and Central Role & Peripheral Role
          High Duty Cycle Directed Advertising State
            and Initiating State
            and Central Role & Peripheral Role
          Low Duty Cycle Directed Advertising State
            and Initiating State
            and Central Role & Peripheral Role
          Connectable Advertising State
            and Connection State (Central Role)
            and Central Role & Peripheral Role
          High Duty Cycle Directed Advertising State
            and Connection State (Central Role)
            and Central Role & Peripheral Role
          Low Duty Cycle Directed Advertising State
            and Connection State (Central Role)
            and Central Role & Peripheral Role
          Connectable Advertising State
            and Connection State (Peripheral Role)
            and Central Role & Peripheral Role
          High Duty Cycle Directed Advertising State
            and Connection State (Peripheral Role)
            and Peripheral Role & Peripheral Role
          Low Duty Cycle Directed Advertising State
            and Connection State (Peripheral Role)
            and Peripheral Role & Peripheral Role
          Initiating State
            and Connection State (Peripheral Role)
            and Central Role & Peripheral Role
zephyr.exe[1470429]: < HCI Command: LE Read Maximum Data Length (0x08|0x002f) plen 0                                 #23 0.282906
> HCI Event: Command Complete (0x0e) plen 12                                                                         #24 0.283573
      LE Read Maximum Data Length (0x08|0x002f) ncmd 1
        Status: Success (0x00)
        Max TX octets: 251
        Max TX time: 2704
        Max RX octets: 251
        Max RX time: 2704
zephyr.exe[1470429]: < HCI Command: LE Write Suggested Default Data Length (0x08|0x0024) plen 4                      #25 0.302888
        TX octets: 251
        TX time: 2704
> HCI Event: Command Complete (0x0e) plen 4                                                                          #26 0.303906
      LE Write Suggested Default Data Length (0x08|0x0024) ncmd 1
        Status: Success (0x00)
zephyr.exe[1470429]: < HCI Command: LE Read Resolving List Size (0x08|0x002a) plen 0                                 #27 0.322932
> HCI Event: Command Complete (0x0e) plen 5                                                                          #28 0.323933
      LE Read Resolving List Size (0x08|0x002a) ncmd 1
        Status: Success (0x00)
        Size: 8
zephyr.exe[1470429]: < HCI Command: LE Set Event Mask (0x08|0x0001) plen 8                                           #29 0.342915
        Mask: 0x000002023f87fa5e
          LE Advertising Report
          LE Connection Update Complete
          LE Read Remote Used Features Complete
          LE Long Term Key Request
          LE Data Length Change
          LE Enhanced Connection Complete
          LE PHY Update Complete
          LE Extended Advertising Report
          LE Periodic Advertising Sync Established
          LE Periodic Advertising Report
          LE Periodic Advertising Sync Lost
          LE Extended Scan Timeout
          LE Extended Advertising Set Terminated
          LE Scan Request Received
          LE Periodic Advertising Sync Transfer Rvc
          LE CIS Established
          LE CIS Request
          LE Create BIG Complete
          LE Terminate BIG Complete
          LE BIG Sync Established Complete
          LE BIG Sync Lost
          LE BIG Info Advertising Report
          Unknown mask (0x0000020000000000)
> HCI Event: Command Complete (0x0e) plen 4                                                                          #30 0.343807
      LE Set Event Mask (0x08|0x0001) ncmd 1
        Status: Success (0x00)
zephyr.exe[1470429]: < HCI Command: Set Event Mask (0x03|0x0001) plen 8                                              #31 0.362912
        Mask: 0x2000800002008890
          Disconnection Complete
          Encryption Change
          Read Remote Version Information Complete
          Hardware Error
          Data Buffer Overflow
          Encryption Key Refresh Complete
          LE Meta
> HCI Event: Command Complete (0x0e) plen 4                                                                          #32 0.363978
      Set Event Mask (0x03|0x0001) ncmd 1
        Status: Success (0x00)
zephyr.exe[1470429]: < HCI Command: Read BD ADDR (0x04|0x0009) plen 0                                                #33 0.382913
> HCI Event: Command Complete (0x0e) plen 10                                                                         #34 0.383558
      Read BD ADDR (0x04|0x0009) ncmd 1
        Status: Success (0x00)
        Address: 00:00:00:00:00:00 (OUI 00-00-00)
zephyr.exe[1470429]: < HCI Command: LE Set Random Address (0x08|0x0005) plen 6                                       #35 0.402922
        Address: D5:B6:CC:31:DB:3B (Static)
> HCI Event: Command Complete (0x0e) plen 4                                                                          #36 0.403559
      LE Set Random Address (0x08|0x0005) ncmd 1
        Status: Success (0x00)
zephyr.exe[1470429]: < HCI Command: LE Extended Create Connection (0x08|0x0043) plen 26                              #37 5.603013
        Filter policy: Accept list is not used (0x00)
        Own address type: Random (0x01)
        Peer address type: Public (0x00)
        Peer address: DF:A9:FF:F6:B1:1A (OUI DF-A9-FF)
        Initiating PHYs: 0x01
        Entry 0: LE 1M
          Scan interval: 60.000 msec (0x0060)
          Scan window: 60.000 msec (0x0060)
          Min connection interval: 30.00 msec (0x0018)
          Max connection interval: 50.00 msec (0x0028)
          Connection latency: 0 (0x0000)
          Supervision timeout: 4000 msec (0x0190)
          Min connection length: 0.000 msec (0x0000)
          Max connection length: 0.000 msec (0x0000)
> HCI Event: Command Status (0x0f) plen 4                                                                            #38 5.604260
      LE Extended Create Connection (0x08|0x0043) ncmd 1
        Status: Success (0x00)
> HCI Event: LE Meta Event (0x3e) plen 31                                                                            #39 5.664594
      LE Enhanced Connection Complete (0x0a)
        Status: Success (0x00)
        Handle: 234
        Role: Central (0x00)
        Peer address type: Public (0x00)
        Peer address: DF:A9:FF:F6:B1:1A (OUI DF-A9-FF)
        Local resolvable private address: 00:00:00:00:00:00 (Non-Resolvable)
        Peer resolvable private address: 00:00:00:00:00:00 (Non-Resolvable)
        Connection interval: 50.00 msec (0x0028)
        Connection latency: 0 (0x0000)
        Supervision timeout: 4000 msec (0x0190)
        Central clock accuracy: 0x00
zephyr.exe[1470429]: < HCI Command: LE Read Remote Used Features (0x08|0x0016) plen 2                                #40 5.683048
        Handle: 234 Address: DF:A9:FF:F6:B1:1A (OUI DF-A9-FF)
> HCI Event: Command Status (0x0f) plen 4                                                                            #41 5.683735
      LE Read Remote Used Features (0x08|0x0016) ncmd 1
        Status: Success (0x00)
zephyr.exe[1470429]: < HCI Command: LE Set PHY (0x08|0x0032) plen 7                                                  #42 5.703070
        Handle: 234 Address: DF:A9:FF:F6:B1:1A (OUI DF-A9-FF)
        All PHYs preference: 0x00
        TX PHYs preference: 0x02
          LE 2M
        RX PHYs preference: 0x02
          LE 2M
        PHY options preference: Reserved (0x0000)
> HCI Event: Command Status (0x0f) plen 4                                                                            #43 5.703964
      LE Set PHY (0x08|0x0032) ncmd 1
        Status: Success (0x00)
> HCI Event: LE Meta Event (0x3e) plen 12                                                                            #44 5.815894
      LE Read Remote Used Features (0x04)
        Status: Success (0x00)
        Handle: 234 Address: DF:A9:FF:F6:B1:1A (OUI DF-A9-FF)
        Features: 0x2d 0x49 0x00 0xf7 0x67 0xd8 0x00 0x00
          LE Encryption
          Extended Reject Indication
          Peripheral-initiated Features Exchange
          LE Data Packet Length Extension
          LE 2M PHY
          LE Coded PHY
          Channel Selection Algorithm #2
          Periodic Advertising Sync Transfer - Sender
          Periodic Advertising Sync Transfer - Recipient
          Sleep Clock Accuracy Updates
          Connected Isochronous Stream - Central
          Connected Isochronous Stream - Peripheral
          Isochronous Broadcaster
          Synchronized Receiver
          Connected Isochronous Stream (Host Support)
          LE Power Control Request
          LE Power Control Request
          Connection Subrating
          Connection Subrating (Host Support)
          Unknown features (0x0000d80000000000)
> HCI Event: LE Meta Event (0x3e) plen 6                                                                             #45 6.315662
      LE PHY Update Complete (0x0c)
        Status: Success (0x00)
        Handle: 234 Address: DF:A9:FF:F6:B1:1A (OUI DF-A9-FF)
        TX PHY: LE 2M (0x02)
        RX PHY: LE 2M (0x02)
zephyr.exe[1470429]: < ACL Data TX: Handle 234 [1/3] flags 0x00 dlen 11                                              #46 6.703073
      SMP: Pairing Request (0x01) len 6
        IO capability: DisplayOnly (0x00)
        OOB data: Authentication data not present (0x00)
        Authentication requirement: Bonding, No MITM, SC, No Keypresses (0x09)
        Max encryption key size: 16
        Initiator key distribution: EncKey Sign (0x05)
        Responder key distribution: EncKey IdKey Sign (0x07)
> HCI Event: Number of Completed Packets (0x13) plen 5                                                               #47 6.715847
        Num handles: 1
        Handle: 234 Address: DF:A9:FF:F6:B1:1A (OUI DF-A9-FF)
        Count: 1
        Buffers: 0/3
        #46: len 11 (7 Kb/s)
        Latency: 12 msec (12-12 msec ~12 msec)
> ACL Data RX: Handle 234 flags 0x02 dlen 11                                                                         #48 6.766053
      SMP: Pairing Response (0x02) len 6
        IO capability: KeyboardDisplay (0x04)
        OOB data: Authentication data from remote device present (0x01)
        Authentication requirement: No bonding, MITM, SC, No Keypresses (0x0c)
        Max encryption key size: 16
        Initiator key distribution: <none> (0x00)
        Responder key distribution: <none> (0x00)
zephyr.exe[1470429]: < HCI Command: Host Number of Completed Packets (0x03|0x0035) plen 5                            #49 6.783102
        Num handles: 1
        Handle: 234 Address: DF:A9:FF:F6:B1:1A (OUI DF-A9-FF)
        Count: 1
zephyr.exe[1470429]: < ACL Data TX: Handle 234 [1/3] flags 0x00 dlen 27                                              #50 6.783110
zephyr.exe[1470429]: < ACL Data TX: Handle 234 flags 0x01 dlen 27                                                    #51 6.783111
zephyr.exe[1470429]: < ACL Data TX: Handle 234 flags 0x01 dlen 15                                                    #52 6.783111
      SMP: Pairing Public Key (0x0c) len 64
        X[32]: 98308440221e2d910f0e54b71e7ec652857aa9b5a0dc65028824cc19db1226e9
        Y[32]: 67a4816bcb62efb21701e31fdb27561a6217575fb007a8bbdabe7e28b6f68482
> HCI Event: Number of Completed Packets (0x13) plen 5                                                               #53 6.815791
        Num handles: 1
        Handle: 234 Address: DF:A9:FF:F6:B1:1A (OUI DF-A9-FF)
        Count: 1
        Buffers: 0/3
        #50: len 27 (6 Kb/s)
        Latency: 32 msec (12-32 msec ~22 msec)
> HCI Event: Number of Completed Packets (0x13) plen 5                                                               #54 6.816409
        Num handles: 1
        Handle: 234 Address: DF:A9:FF:F6:B1:1A (OUI DF-A9-FF)
        Count: 1
        Buffers: underflow/3
        #51: len 27 (6 Kb/s)
        Latency: 33 msec (12-33 msec ~28 msec)
> HCI Event: Number of Completed Packets (0x13) plen 5                                                               #55 6.816711
        Num handles: 1
        Handle: 234 Address: DF:A9:FF:F6:B1:1A (OUI DF-A9-FF)
        Count: 1
        Buffers: underflow/3
        #52: len 15 (3 Kb/s)
        Latency: 33 msec (12-33 msec ~30 msec)
> ACL Data RX: Handle 234 flags 0x02 dlen 27                                                                         #56 6.866080
> ACL Data RX: Handle 234 flags 0x01 dlen 27                                                                         #57 6.866670
> ACL Data RX: Handle 234 flags 0x01 dlen 15                                                                         #58 6.867383
      SMP: Pairing Public Key (0x0c) len 64
        X[32]: 0150dba040a4b7eae26a2c2a0436ea166b4167ba5503ab5b2809c7d75ad8c751
        Y[32]: ebc51268998781c0162ff5be89cf2d5870859a39d8f4c55b80e59c9a8948f037
zephyr.exe[1470429]: < HCI Command: Host Number of Completed Packets (0x03|0x0035) plen 5                            #59 6.883074
        Num handles: 1
        Handle: 234 Address: DF:A9:FF:F6:B1:1A (OUI DF-A9-FF)
        Count: 1
zephyr.exe[1470429]: < HCI Command: Host Number of Completed Packets (0x03|0x0035) plen 5                            #60 6.883085
        Num handles: 1
        Handle: 234 Address: DF:A9:FF:F6:B1:1A (OUI DF-A9-FF)
        Count: 1
zephyr.exe[1470429]: < HCI Command: Host Number of Completed Packets (0x03|0x0035) plen 5                            #61 6.883168
        Num handles: 1
        Handle: 234 Address: DF:A9:FF:F6:B1:1A (OUI DF-A9-FF)
        Count: 1
zephyr.exe[1470429]: < ACL Data TX: Handle 234 [1/3] flags 0x00 dlen 21                                              #62 6.883202
      SMP: Pairing Random (0x04) len 16
        Random value[16]: 5da095555cc64d02679f89a05211af56
> HCI Event: Number of Completed Packets (0x13) plen 5                                                               #63 6.916217
        Num handles: 1
        Handle: 234 Address: DF:A9:FF:F6:B1:1A (OUI DF-A9-FF)
        Count: 1
        Buffers: 0/3
        #62: len 21 (5 Kb/s)
        Latency: 33 msec (12-33 msec ~31 msec)
> ACL Data RX: Handle 234 flags 0x02 dlen 21                                                                         #64 6.965984
      SMP: Pairing Random (0x04) len 16
        Random value[16]: 96a7e4827042b3fd5694064317e8957e
zephyr.exe[1470429]: < HCI Command: Host Number of Completed Packets (0x03|0x0035) plen 5                            #65 6.983210
        Num handles: 1
        Handle: 234 Address: DF:A9:FF:F6:B1:1A (OUI DF-A9-FF)
        Count: 1
zephyr.exe[1470429]: < ACL Data TX: Handle 234 [1/3] flags 0x00 dlen 21                                              #66 6.983265
      SMP: Pairing DHKey Check (0x0d) len 16
        E[16]: fa9814db41b90cf4903f511bc6461bb0
> HCI Event: Number of Completed Packets (0x13) plen 5                                                               #67 7.015979
        Num handles: 1
        Handle: 234 Address: DF:A9:FF:F6:B1:1A (OUI DF-A9-FF)
        Count: 1
        Buffers: 0/3
        #66: len 21 (5 Kb/s)
        Latency: 32 msec (12-33 msec ~32 msec)
> ACL Data RX: Handle 234 flags 0x02 dlen 21                                                                         #68 7.066013
      SMP: Pairing DHKey Check (0x0d) len 16
        E[16]: b2254660ed445d91d721ae2cc8d78665
zephyr.exe[1470429]: < HCI Command: LE Start Encryption (0x08|0x0019) plen 28                                        #69 7.083219
        Handle: 234 Address: DF:A9:FF:F6:B1:1A (OUI DF-A9-FF)
        Random number: 0x0000000000000000
        Encrypted diversifier: 0x0000
        Long term key[16]: fca23920a92e16133db63c5a8f41e84b
> HCI Event: Command Status (0x0f) plen 4                                                                            #70 7.084381
      LE Start Encryption (0x08|0x0019) ncmd 1
        Status: Success (0x00)
zephyr.exe[1470429]: < HCI Command: Host Number of Completed Packets (0x03|0x0035) plen 5                            #71 7.103051
        Num handles: 1
        Handle: 234 Address: DF:A9:FF:F6:B1:1A (OUI DF-A9-FF)
        Count: 1
> HCI Event: Encryption Change (0x08) plen 4                                                                         #72 7.416402
        Status: Success (0x00)
        Handle: 234 Address: DF:A9:FF:F6:B1:1A (OUI DF-A9-FF)
        Encryption: Enabled with AES-CCM (0x01)
zephyr.exe[1470429]: < HCI Command: Disconnect (0x01|0x0006) plen 3                                                  #73 7.713016
        Handle: 234 Address: DF:A9:FF:F6:B1:1A (OUI DF-A9-FF)
        Reason: Remote User Terminated Connection (0x13)
> HCI Event: Command Status (0x0f) plen 4                                                                            #74 7.713807
      Disconnect (0x01|0x0006) ncmd 1
        Status: Success (0x00)
> HCI Event: Disconnect Complete (0x05) plen 4                                                                       #75 7.765787
        Status: Success (0x00)
        Handle: 234 Address: DF:A9:FF:F6:B1:1A (OUI DF-A9-FF)
        Reason: Connection Terminated By Local Host (0x16)
zephyr.exe[1470429]: < HCI Command: LE Extended Create Connection (0x08|0x0043) plen 26                             #76 10.833082
        Filter policy: Accept list is not used (0x00)
        Own address type: Random (0x01)
        Peer address type: Public (0x00)
        Peer address: DF:A9:FF:F6:B1:1A (OUI DF-A9-FF)
        Initiating PHYs: 0x01
        Entry 0: LE 1M
          Scan interval: 60.000 msec (0x0060)
          Scan window: 60.000 msec (0x0060)
          Min connection interval: 30.00 msec (0x0018)
          Max connection interval: 50.00 msec (0x0028)
          Connection latency: 0 (0x0000)
          Supervision timeout: 4000 msec (0x0190)
          Min connection length: 0.000 msec (0x0000)
          Max connection length: 0.000 msec (0x0000)
> HCI Event: Command Status (0x0f) plen 4                                                                           #77 10.834376
      LE Extended Create Connection (0x08|0x0043) ncmd 1
        Status: Success (0x00)
> HCI Event: LE Meta Event (0x3e) plen 31                                                                           #78 10.899769
      LE Enhanced Connection Complete (0x0a)
        Status: Success (0x00)
        Handle: 252
        Role: Central (0x00)
        Peer address type: Public (0x00)
        Peer address: DF:A9:FF:F6:B1:1A (OUI DF-A9-FF)
        Local resolvable private address: 00:00:00:00:00:00 (Non-Resolvable)
        Peer resolvable private address: 00:00:00:00:00:00 (Non-Resolvable)
        Connection interval: 50.00 msec (0x0028)
        Connection latency: 0 (0x0000)
        Supervision timeout: 4000 msec (0x0190)
        Central clock accuracy: 0x00
zephyr.exe[1470429]: < HCI Command: LE Read Remote Used Features (0x08|0x0016) plen 2                               #79 10.903183
        Handle: 252 Address: DF:A9:FF:F6:B1:1A (OUI DF-A9-FF)
> HCI Event: Command Status (0x0f) plen 4                                                                           #80 10.903612
      LE Read Remote Used Features (0x08|0x0016) ncmd 1
        Status: Success (0x00)
zephyr.exe[1470429]: < HCI Command: LE Set PHY (0x08|0x0032) plen 7                                                 #81 10.923052
        Handle: 252 Address: DF:A9:FF:F6:B1:1A (OUI DF-A9-FF)
        All PHYs preference: 0x00
        TX PHYs preference: 0x02
          LE 2M
        RX PHYs preference: 0x02
          LE 2M
        PHY options preference: Reserved (0x0000)
> HCI Event: Command Status (0x0f) plen 4                                                                           #82 10.924031
      LE Set PHY (0x08|0x0032) ncmd 1
        Status: Success (0x00)
> HCI Event: LE Meta Event (0x3e) plen 12                                                                           #83 11.051352
      LE Read Remote Used Features (0x04)
        Status: Success (0x00)
        Handle: 252 Address: DF:A9:FF:F6:B1:1A (OUI DF-A9-FF)
        Features: 0x2d 0x49 0x00 0xf7 0x67 0xd8 0x00 0x00
          LE Encryption
          Extended Reject Indication
          Peripheral-initiated Features Exchange
          LE Data Packet Length Extension
          LE 2M PHY
          LE Coded PHY
          Channel Selection Algorithm #2
          Periodic Advertising Sync Transfer - Sender
          Periodic Advertising Sync Transfer - Recipient
          Sleep Clock Accuracy Updates
          Connected Isochronous Stream - Central
          Connected Isochronous Stream - Peripheral
          Isochronous Broadcaster
          Synchronized Receiver
          Connected Isochronous Stream (Host Support)
          LE Power Control Request
          LE Power Control Request
          Connection Subrating
          Connection Subrating (Host Support)
          Unknown features (0x0000d80000000000)
> HCI Event: LE Meta Event (0x3e) plen 6                                                                            #84 11.550583
      LE PHY Update Complete (0x0c)
        Status: Success (0x00)
        Handle: 252 Address: DF:A9:FF:F6:B1:1A (OUI DF-A9-FF)
        TX PHY: LE 2M (0x02)
        RX PHY: LE 2M (0x02)
zephyr.exe[1470429]: < ACL Data TX: Handle 252 [1/3] flags 0x00 dlen 11                                             #85 11.973100
      SMP: Pairing Request (0x01) len 6
        IO capability: DisplayOnly (0x00)
        OOB data: Authentication data from remote device present (0x01)
        Authentication requirement: Bonding, No MITM, SC, No Keypresses (0x09)
        Max encryption key size: 16
        Initiator key distribution: EncKey Sign (0x05)
        Responder key distribution: EncKey IdKey Sign (0x07)
> HCI Event: Number of Completed Packets (0x13) plen 5                                                              #86 12.001102
        Num handles: 1
        Handle: 252 Address: DF:A9:FF:F6:B1:1A (OUI DF-A9-FF)
        Count: 1
        Buffers: 0/3
        #85: len 11 (3 Kb/s)
        Latency: 28 msec (28-28 msec ~28 msec)
> ACL Data RX: Handle 252 flags 0x02 dlen 11                                                                        #87 12.051162
      SMP: Pairing Response (0x02) len 6
        IO capability: KeyboardDisplay (0x04)
        OOB data: Authentication data not present (0x00)
        Authentication requirement: No bonding, MITM, SC, No Keypresses (0x0c)
        Max encryption key size: 16
        Initiator key distribution: <none> (0x00)
        Responder key distribution: <none> (0x00)
zephyr.exe[1470429]: < HCI Command: Host Number of Completed Packets (0x03|0x0035) plen 5                           #88 12.063270
        Num handles: 1
        Handle: 252 Address: DF:A9:FF:F6:B1:1A (OUI DF-A9-FF)
        Count: 1
zephyr.exe[1470429]: < ACL Data TX: Handle 252 [1/3] flags 0x00 dlen 27                                             #89 12.063294
zephyr.exe[1470429]: < ACL Data TX: Handle 252 flags 0x01 dlen 27                                                   #90 12.063339
zephyr.exe[1470429]: < ACL Data TX: Handle 252 flags 0x01 dlen 15                                                   #91 12.063342
      SMP: Pairing Public Key (0x0c) len 64
        X[32]: 98308440221e2d910f0e54b71e7ec652857aa9b5a0dc65028824cc19db1226e9
        Y[32]: 67a4816bcb62efb21701e31fdb27561a6217575fb007a8bbdabe7e28b6f68482
> HCI Event: Number of Completed Packets (0x13) plen 5                                                              #92 12.100864
        Num handles: 1
        Handle: 252 Address: DF:A9:FF:F6:B1:1A (OUI DF-A9-FF)
        Count: 1
        Buffers: 0/3
        #89: len 27 (5 Kb/s)
        Latency: 37 msec (28-37 msec ~32 msec)
> HCI Event: Number of Completed Packets (0x13) plen 5                                                              #93 12.101316
        Num handles: 1
        Handle: 252 Address: DF:A9:FF:F6:B1:1A (OUI DF-A9-FF)
        Count: 1
        Buffers: underflow/3
        #90: len 27 (5 Kb/s)
        Latency: 37 msec (28-37 msec ~35 msec)
> HCI Event: Number of Completed Packets (0x13) plen 5                                                              #94 12.101875
        Num handles: 1
        Handle: 252 Address: DF:A9:FF:F6:B1:1A (OUI DF-A9-FF)
        Count: 1
        Buffers: underflow/3
        #91: len 15 (3 Kb/s)
        Latency: 38 msec (28-38 msec ~36 msec)
> ACL Data RX: Handle 252 flags 0x02 dlen 27                                                                        #95 12.151390
> ACL Data RX: Handle 252 flags 0x01 dlen 27                                                                        #96 12.151895
> ACL Data RX: Handle 252 flags 0x01 dlen 15                                                                        #97 12.152564
      SMP: Pairing Public Key (0x0c) len 64
        X[32]: e09d25330386cd75cf203da3d2055582ba519404b43c2094ef92694b44510246
        Y[32]: 86f1648704bfb83bb1cabfaa332e3d7c9c9a945a5dbceb533ace11548ebf02ad
zephyr.exe[1470429]: < HCI Command: Host Number of Completed Packets (0x03|0x0035) plen 5                           #98 12.163310
        Num handles: 1
        Handle: 252 Address: DF:A9:FF:F6:B1:1A (OUI DF-A9-FF)
        Count: 1
zephyr.exe[1470429]: < HCI Command: Host Number of Completed Packets (0x03|0x0035) plen 5                           #99 12.163403
        Num handles: 1
        Handle: 252 Address: DF:A9:FF:F6:B1:1A (OUI DF-A9-FF)
        Count: 1
zephyr.exe[1470429]: < HCI Command: Host Number of Completed Packets (0x03|0x0035) plen 5                          #100 12.163479
        Num handles: 1
        Handle: 252 Address: DF:A9:FF:F6:B1:1A (OUI DF-A9-FF)
        Count: 1
zephyr.exe[1470429]: < ACL Data TX: Handle 252 [1/3] flags 0x00 dlen 21                                            #101 12.163539
      SMP: Pairing Random (0x04) len 16
        Random value[16]: a2acf8fd71a45c4a1bcadd27bd58e945
> HCI Event: Number of Completed Packets (0x13) plen 5                                                             #102 12.200961
        Num handles: 1
        Handle: 252 Address: DF:A9:FF:F6:B1:1A (OUI DF-A9-FF)
        Count: 1
        Buffers: 0/3
        #101: len 21 (4 Kb/s)
        Latency: 37 msec (28-38 msec ~37 msec)
> ACL Data RX: Handle 252 flags 0x02 dlen 21                                                                       #103 12.251480
      SMP: Pairing Random (0x04) len 16
        Random value[16]: 50214c53e1e7cefc05d10a7a329ee73b
zephyr.exe[1470429]: < HCI Command: Host Number of Completed Packets (0x03|0x0035) plen 5                          #104 12.263237
        Num handles: 1
        Handle: 252 Address: DF:A9:FF:F6:B1:1A (OUI DF-A9-FF)
        Count: 1
zephyr.exe[1470429]: < ACL Data TX: Handle 252 [1/3] flags 0x00 dlen 21                                            #105 12.263288
      SMP: Pairing DHKey Check (0x0d) len 16
        E[16]: 4e1745815dca6a9c56108874286a04f6
> HCI Event: Number of Completed Packets (0x13) plen 5                                                             #106 12.300945
        Num handles: 1
        Handle: 252 Address: DF:A9:FF:F6:B1:1A (OUI DF-A9-FF)
        Count: 1
        Buffers: 0/3
        #105: len 21 (4 Kb/s)
        Latency: 37 msec (28-38 msec ~37 msec)
> ACL Data RX: Handle 252 flags 0x02 dlen 21                                                                       #107 12.351327
      SMP: Pairing DHKey Check (0x0d) len 16
        E[16]: d69f2e16ee081ce4d63a0c1f3ea229b6
zephyr.exe[1470429]: < HCI Command: LE Start Encryption (0x08|0x0019) plen 28                                      #108 12.363316
        Handle: 252 Address: DF:A9:FF:F6:B1:1A (OUI DF-A9-FF)
        Random number: 0x0000000000000000
        Encrypted diversifier: 0x0000
        Long term key[16]: 3fa9adc9219c30d2a8e2059c233b3a66
> HCI Event: Command Status (0x0f) plen 4                                                                          #109 12.364856
      LE Start Encryption (0x08|0x0019) ncmd 1
        Status: Success (0x00)
zephyr.exe[1470429]: < HCI Command: Host Number of Completed Packets (0x03|0x0035) plen 5                          #110 12.383082
        Num handles: 1
        Handle: 252 Address: DF:A9:FF:F6:B1:1A (OUI DF-A9-FF)
        Count: 1
> HCI Event: Encryption Change (0x08) plen 4                                                                       #111 12.700896
        Status: Success (0x00)
        Handle: 252 Address: DF:A9:FF:F6:B1:1A (OUI DF-A9-FF)
        Encryption: Enabled with AES-CCM (0x01)
zephyr.exe[1470429]: < HCI Command: Disconnect (0x01|0x0006) plen 3                                                #112 12.993172
        Handle: 252 Address: DF:A9:FF:F6:B1:1A (OUI DF-A9-FF)
        Reason: Remote User Terminated Connection (0x13)
> HCI Event: Command Status (0x0f) plen 4                                                                          #113 12.993760
      Disconnect (0x01|0x0006) ncmd 1
        Status: Success (0x00)
> HCI Event: Disconnect Complete (0x05) plen 4                                                                     #114 13.050789
        Status: Success (0x00)
        Handle: 252 Address: DF:A9:FF:F6:B1:1A (OUI DF-A9-FF)
        Reason: Connection Terminated By Local Host (0x16)
zephyr.exe[1470429]: < HCI Command: LE Extended Create Connection (0x08|0x0043) plen 26                            #115 18.183248
        Filter policy: Accept list is not used (0x00)
        Own address type: Random (0x01)
        Peer address type: Public (0x00)
        Peer address: DF:A9:FF:F6:B1:1A (OUI DF-A9-FF)
        Initiating PHYs: 0x01
        Entry 0: LE 1M
          Scan interval: 60.000 msec (0x0060)
          Scan window: 60.000 msec (0x0060)
          Min connection interval: 30.00 msec (0x0018)
          Max connection interval: 50.00 msec (0x0028)
          Connection latency: 0 (0x0000)
          Supervision timeout: 4000 msec (0x0190)
          Min connection length: 0.000 msec (0x0000)
          Max connection length: 0.000 msec (0x0000)
> HCI Event: Command Status (0x0f) plen 4                                                                          #116 18.184441
      LE Extended Create Connection (0x08|0x0043) ncmd 1
        Status: Success (0x00)
> HCI Event: LE Meta Event (0x3e) plen 31                                                                          #117 18.235152
      LE Enhanced Connection Complete (0x0a)
        Status: Success (0x00)
        Handle: 270
        Role: Central (0x00)
        Peer address type: Public (0x00)
        Peer address: DF:A9:FF:F6:B1:1A (OUI DF-A9-FF)
        Local resolvable private address: 00:00:00:00:00:00 (Non-Resolvable)
        Peer resolvable private address: 00:00:00:00:00:00 (Non-Resolvable)
        Connection interval: 50.00 msec (0x0028)
        Connection latency: 0 (0x0000)
        Supervision timeout: 4000 msec (0x0190)
        Central clock accuracy: 0x00
zephyr.exe[1470429]: < HCI Command: LE Read Remote Used Features (0x08|0x0016) plen 2                              #118 18.243293
        Handle: 270 Address: DF:A9:FF:F6:B1:1A (OUI DF-A9-FF)
> HCI Event: Command Status (0x0f) plen 4                                                                          #119 18.243977
      LE Read Remote Used Features (0x08|0x0016) ncmd 1
        Status: Success (0x00)
zephyr.exe[1470429]: < HCI Command: LE Set PHY (0x08|0x0032) plen 7                                                #120 18.263218
        Handle: 270 Address: DF:A9:FF:F6:B1:1A (OUI DF-A9-FF)
        All PHYs preference: 0x00
        TX PHYs preference: 0x02
          LE 2M
        RX PHYs preference: 0x02
          LE 2M
        PHY options preference: Reserved (0x0000)
> HCI Event: Command Status (0x0f) plen 4                                                                          #121 18.264269
      LE Set PHY (0x08|0x0032) ncmd 1
        Status: Success (0x00)
> HCI Event: LE Meta Event (0x3e) plen 12                                                                          #122 18.386762
      LE Read Remote Used Features (0x04)
        Status: Success (0x00)
        Handle: 270 Address: DF:A9:FF:F6:B1:1A (OUI DF-A9-FF)
        Features: 0x2d 0x49 0x00 0xf7 0x67 0xd8 0x00 0x00
          LE Encryption
          Extended Reject Indication
          Peripheral-initiated Features Exchange
          LE Data Packet Length Extension
          LE 2M PHY
          LE Coded PHY
          Channel Selection Algorithm #2
          Periodic Advertising Sync Transfer - Sender
          Periodic Advertising Sync Transfer - Recipient
          Sleep Clock Accuracy Updates
          Connected Isochronous Stream - Central
          Connected Isochronous Stream - Peripheral
          Isochronous Broadcaster
          Synchronized Receiver
          Connected Isochronous Stream (Host Support)
          LE Power Control Request
          LE Power Control Request
          Connection Subrating
          Connection Subrating (Host Support)
          Unknown features (0x0000d80000000000)
> HCI Event: LE Meta Event (0x3e) plen 6                                                                           #123 18.886232
      LE PHY Update Complete (0x0c)
        Status: Success (0x00)
        Handle: 270 Address: DF:A9:FF:F6:B1:1A (OUI DF-A9-FF)
        TX PHY: LE 2M (0x02)
        RX PHY: LE 2M (0x02)
zephyr.exe[1470429]: < ACL Data TX: Handle 270 [1/3] flags 0x00 dlen 11                                            #124 19.323288
      SMP: Pairing Request (0x01) len 6
        IO capability: DisplayOnly (0x00)
        OOB data: Authentication data from remote device present (0x01)
        Authentication requirement: Bonding, No MITM, SC, No Keypresses (0x09)
        Max encryption key size: 16
        Initiator key distribution: EncKey Sign (0x05)
        Responder key distribution: EncKey IdKey Sign (0x07)
> HCI Event: Number of Completed Packets (0x13) plen 5                                                             #125 19.336488
        Num handles: 1
        Handle: 270 Address: DF:A9:FF:F6:B1:1A (OUI DF-A9-FF)
        Count: 1
        Buffers: 0/3
        #124: len 11 (6 Kb/s)
        Latency: 13 msec (13-13 msec ~13 msec)
> ACL Data RX: Handle 270 flags 0x02 dlen 11                                                                       #126 19.386601
      SMP: Pairing Response (0x02) len 6
        IO capability: KeyboardDisplay (0x04)
        OOB data: Authentication data from remote device present (0x01)
        Authentication requirement: No bonding, MITM, SC, No Keypresses (0x0c)
        Max encryption key size: 16
        Initiator key distribution: <none> (0x00)
        Responder key distribution: <none> (0x00)
zephyr.exe[1470429]: < HCI Command: Host Number of Completed Packets (0x03|0x0035) plen 5                          #127 19.40