Bluetooth monitor ver 5.84
btmon[836770]: = Note: Linux version 6.8.0-83-generic (x86_64)                                                           0.391524
btmon[836770]: = Note: Bluetooth subsystem version 2.22                                                                  0.391525
= New Index: 00:00:00:00:00:00 (Primary,UART,hci0)                                                                       0.391526
= Open Index: 00:00:00:00:00:00                                                                                          0.398734
= Index Info: 00:00:00:00:00:00 (Nordic Semiconductor ASA)                                                               0.398738
zephyr.exe[836772]: @ USER Open: main (privileged) version 2.22                                                 {0x0001} 0.398741
zephyr.exe[836772]: < HCI Command: Reset (0x03|0x0003) plen 0                                                         #1 0.398948
> HCI Event: Command Complete (0x0e) plen 4                                                                           #2 0.399967
      Reset (0x03|0x0003) ncmd 1
        Status: Success (0x00)
zephyr.exe[836772]: < HCI Command: Read Local Supported Features (0x04|0x0003) plen 0                                 #3 0.418691
> HCI Event: Command Complete (0x0e) plen 12                                                                          #4 0.419693
      Read Local Supported Features (0x04|0x0003) ncmd 1
        Status: Success (0x00)
        Features: 0x00 0x00 0x00 0x00 0x60 0x00 0x00 0x00
          BR/EDR Not Supported
          LE Supported (Controller)
zephyr.exe[836772]: < HCI Command: Read Local Version Information (0x04|0x0001) plen 0                                #5 0.438678
> HCI Event: Command Complete (0x0e) plen 12                                                                          #6 0.439153
      Read Local Version Information (0x04|0x0001) ncmd 1
        Status: Success (0x00)
        HCI version: Reserved (0x0e) - Revision 12520 (0x30e8)
        LMP version: Reserved (0x0e) - Subversion 12520 (0x30e8)
        Manufacturer: Nordic Semiconductor ASA (89)
zephyr.exe[836772]: < HCI Command: Read Local Supported Commands (0x04|0x0002) plen 0                                 #7 0.458688
> HCI Event: Command Complete (0x0e) plen 68                                                                          #8 0.459941
      Read Local Supported Commands (0x04|0x0002) ncmd 1
        Status: Success (0x00)
        Commands: 119 entries
          Disconnect (Octet 0 - Bit 5)
          Read Remote Version Information (Octet 2 - Bit 7)
          Set Event Mask (Octet 5 - Bit 6)
          Reset (Octet 5 - Bit 7)
          Read Connection Accept Timeout (Octet 7 - Bit 2)
          Write Connection Accept Timeout (Octet 7 - Bit 3)
          Read Transmit Power Level (Octet 10 - Bit 2)
          Set Controller To Host Flow Control (Octet 10 - Bit 5)
          Host Buffer Size (Octet 10 - Bit 6)
          Host Number of Completed Packets (Octet 10 - Bit 7)
          Read Local Version Information (Octet 14 - Bit 3)
          Read Local Supported Features (Octet 14 - Bit 5)
          Read BD ADDR (Octet 15 - Bit 1)
          Read RSSI (Octet 15 - Bit 5)
          Set Event Mask Page 2 (Octet 22 - Bit 2)
          LE Set Event Mask (Octet 25 - Bit 0)
          LE Read Buffer Size (Octet 25 - Bit 1)
          LE Read Local Supported Features (Octet 25 - Bit 2)
          LE Set Random Address (Octet 25 - Bit 4)
          LE Set Advertising Parameters (Octet 25 - Bit 5)
          LE Read Advertising Channel TX Power (Octet 25 - Bit 6)
          LE Set Advertising Data (Octet 25 - Bit 7)
          LE Set Scan Response Data (Octet 26 - Bit 0)
          LE Set Advertise Enable (Octet 26 - Bit 1)
          LE Set Scan Parameters (Octet 26 - Bit 2)
          LE Set Scan Enable (Octet 26 - Bit 3)
          LE Create Connection (Octet 26 - Bit 4)
          LE Create Connection Cancel (Octet 26 - Bit 5)
          LE Read Accept List Size (Octet 26 - Bit 6)
          LE Clear Accept List (Octet 26 - Bit 7)
          LE Add Device To Accept List (Octet 27 - Bit 0)
          LE Remove Device From Accept List (Octet 27 - Bit 1)
          LE Connection Update (Octet 27 - Bit 2)
          LE Set Host Channel Classification (Octet 27 - Bit 3)
          LE Read Channel Map (Octet 27 - Bit 4)
          LE Read Remote Used Features (Octet 27 - Bit 5)
          LE Encrypt (Octet 27 - Bit 6)
          LE Rand (Octet 27 - Bit 7)
          LE Start Encryption (Octet 28 - Bit 0)
          LE Long Term Key Request Reply (Octet 28 - Bit 1)
          LE Long Term Key Request Neg Reply (Octet 28 - Bit 2)
          LE Read Supported States (Octet 28 - Bit 3)
          LE Receiver Test (Octet 28 - Bit 4)
          LE Transmitter Test (Octet 28 - Bit 5)
          LE Test End (Octet 28 - Bit 6)
          Read Authenticated Payload Timeout (Octet 32 - Bit 4)
          Write Authenticated Payload Timeout (Octet 32 - Bit 5)
          LE Set Data Length (Octet 33 - Bit 6)
          LE Read Suggested Default Data Length (Octet 33 - Bit 7)
          LE Write Suggested Default Data Length (Octet 34 - Bit 0)
          LE Add Device To Resolving List (Octet 34 - Bit 3)
          LE Remove Device From Resolving List (Octet 34 - Bit 4)
          LE Clear Resolving List (Octet 34 - Bit 5)
          LE Read Resolving List Size (Octet 34 - Bit 6)
          LE Set Address Resolution Enable (Octet 35 - Bit 1)
          LE Set Resolvable Private Address Timeout (Octet 35 - Bit 2)
          LE Read Maximum Data Length (Octet 35 - Bit 3)
          LE Read PHY (Octet 35 - Bit 4)
          LE Set Default PHY (Octet 35 - Bit 5)
          LE Set PHY (Octet 35 - Bit 6)
          LE Enhanced Receiver Test (Octet 35 - Bit 7)
          LE Enhanced Transmitter Test (Octet 36 - Bit 0)
          LE Set Advertising Set Random Address (Octet 36 - Bit 1)
          LE Set Extended Advertising Parameters (Octet 36 - Bit 2)
          LE Set Extended Advertising Data (Octet 36 - Bit 3)
          LE Set Extended Scan Response Data (Octet 36 - Bit 4)
          LE Set Extended Advertising Enable (Octet 36 - Bit 5)
          LE Read Maximum Advertising Data Length (Octet 36 - Bit 6)
          LE Read Number of Supported Advertising Sets (Octet 36 - Bit 7)
          LE Remove Advertising Set (Octet 37 - Bit 0)
          LE Clear Advertising Sets (Octet 37 - Bit 1)
          LE Set Periodic Advertising Parameters (Octet 37 - Bit 2)
          LE Set Periodic Advertising Data (Octet 37 - Bit 3)
          LE Set Periodic Advertising Enable (Octet 37 - Bit 4)
          LE Set Extended Scan Parameters (Octet 37 - Bit 5)
          LE Set Extended Scan Enable (Octet 37 - Bit 6)
          LE Extended Create Connection (Octet 37 - Bit 7)
          LE Periodic Advertising Create Sync (Octet 38 - Bit 0)
          LE Periodic Advertising Create Sync Cancel (Octet 38 - Bit 1)
          LE Periodic Advertising Terminate Sync (Octet 38 - Bit 2)
          LE Add Device To Periodic Advertiser List (Octet 38 - Bit 3)
          LE Remove Device From Periodic Advertiser List (Octet 38 - Bit 4)
          LE Clear Periodic Advertiser List (Octet 38 - Bit 5)
          LE Read Periodic Advertiser List Size (Octet 38 - Bit 6)
          LE Read Transmit Power (Octet 38 - Bit 7)
          LE Read RF Path Compensation (Octet 39 - Bit 0)
          LE Write RF Path Compensation (Octet 39 - Bit 1)
          LE Set Privacy Mode (Octet 39 - Bit 2)
          LE Periodic Advertising Receive Enable (Octet 40 - Bit 5)
          LE Periodic Advertising Sync Transfer (Octet 40 - Bit 6)
          LE Periodic Advertising Set Info Transfer (Octet 40 - Bit 7)
          LE Periodic Advertising Sync Transfer Parameters (Octet 41 - Bit 0)
          LE Set Default Periodic Advertisng Sync Transfer Parameters (Octet 41 - Bit 1)
          LE Read Buffer v2 (Octet 41 - Bit 5)
          LE Read ISO TX Sync (Octet 41 - Bit 6)
          LE Set Connected Isochronous Group Parameters (Octet 41 - Bit 7)
          LE Set Connected Isochronous Group Parameters Test (Octet 42 - Bit 0)
          LE Create Connected Isochronous Stream (Octet 42 - Bit 1)
          LE Remove Connected Isochronous Group (Octet 42 - Bit 2)
          LE Accept Connected Isochronous Stream Request (Octet 42 - Bit 3)
          LE Reject Connected Isochronous Stream Request (Octet 42 - Bit 4)
          LE Create Broadcast Isochronous Group (Octet 42 - Bit 5)
          LE Create Broadcast Isochronous Group Test (Octet 42 - Bit 6)
          LE Terminate Broadcast Isochronous Group (Octet 42 - Bit 7)
          LE Broadcast Isochronous Group Create Sync (Octet 43 - Bit 0)
          LE Broadcast Isochronous Group Terminate Sync (Octet 43 - Bit 1)
          LE Request Peer SCA (Octet 43 - Bit 2)
          LE Setup Isochronous Data Path (Octet 43 - Bit 3)
          LE Remove Isochronous Data Path (Octet 43 - Bit 4)
          LE Isochronous Transmit Test (Octet 43 - Bit 5)
          LE Isochronous Receive Test (Octet 43 - Bit 6)
          LE Isochronous Read Test Counters (Octet 43 - Bit 7)
          LE Isochronous Read Test Counters (Octet 44 - Bit 0)
          LE Set Host Feature (Octet 44 - Bit 1)
          LE Read ISO link quality (Octet 44 - Bit 2)
          Octet 45 - Bit 6 
          Octet 46 - Bit 0 
          Octet 46 - Bit 1 
          Octet 46 - Bit 2 
zephyr.exe[836772]: < HCI Command: Host Buffer Size (0x03|0x0033) plen 7                                              #9 0.478677
        ACL MTU: 255  ACL max packet: 16
        SCO MTU: 0    SCO max packet: 0
> HCI Event: Command Complete (0x0e) plen 4                                                                          #10 0.479436
      Host Buffer Size (0x03|0x0033) ncmd 1
        Status: Success (0x00)
zephyr.exe[836772]: < HCI Command: Set Controller To Host Flow Control (0x03|0x0031) plen 1                          #11 0.498683
        Flow control: ACL Data Packets (0x01)
> HCI Event: Command Complete (0x0e) plen 4                                                                          #12 0.499448
      Set Controller To Host Flow Control (0x03|0x0031) ncmd 1
        Status: Success (0x00)
zephyr.exe[836772]: < HCI Command: LE Read Local Supported Features (0x08|0x0003) plen 0                             #13 0.518680
> HCI Event: Command Complete (0x0e) plen 12                                                                         #14 0.519417
      LE Read Local Supported Features (0x08|0x0003) ncmd 1
        Status: Success (0x00)
        Features: 0xfd 0x79 0x00 0xf7 0x30 0x01 0x00 0x00
          LE Encryption
          Extended Reject Indication
          Peripheral-initiated Features Exchange
          LE Ping
          LE Data Packet Length Extension
          LL Privacy
          Extended Scanner Filter Policies
          LE 2M PHY
          LE Coded PHY
          LE Extended Advertising
          LE Periodic Advertising
          Channel Selection Algorithm #2
          Periodic Advertising Sync Transfer - Sender
          Periodic Advertising Sync Transfer - Recipient
          Sleep Clock Accuracy Updates
          Connected Isochronous Stream - Central
          Connected Isochronous Stream - Peripheral
          Isochronous Broadcaster
          Synchronized Receiver
          Periodic Advertising ADI support
          Connection Subrating
          Unknown features (0x0000010000000000)
zephyr.exe[836772]: < HCI Command: LE Set Host Feature (0x08|0x0074) plen 2                                          #15 0.538683
        Bit Number: 32
          Connected Isochronous Stream (Host Support)
        Bit Value: 1
> HCI Event: Command Complete (0x0e) plen 4                                                                          #16 0.539289
      LE Set Host Feature (0x08|0x0074) ncmd 1
        Status: Success (0x00)
zephyr.exe[836772]: < HCI Command: LE Read Buffer v2 (0x08|0x0060) plen 0                                            #17 0.558695
> HCI Event: Command Complete (0x0e) plen 10                                                                         #18 0.559790
      LE Read Buffer v2 (0x08|0x0060) ncmd 1
        Status: Success (0x00)
        ACL MTU: 27
        ACL max packet: 3
        ISO MTU: 318
        ISO max packet: 3
zephyr.exe[836772]: < HCI Command: LE Read Maximum Advertising Data Length (0x08|0x003a) plen 0                      #19 0.578678
> HCI Event: Command Complete (0x0e) plen 6                                                                          #20 0.579213
      LE Read Maximum Advertising Data Length (0x08|0x003a) ncmd 1
        Status: Success (0x00)
        Max length: 1650
zephyr.exe[836772]: < HCI Command: LE Read Supported States (0x08|0x001c) plen 0                                     #21 0.598681
> HCI Event: Command Complete (0x0e) plen 12                                                                         #22 0.599245
      LE Read Supported States (0x08|0x001c) ncmd 1
        Status: Success (0x00)
        States: 0x000003ff3e0306ff
          Non-connectable Advertising State
          Scannable Advertising State
          Connectable Advertising State
          High Duty Cycle Directed Advertising State
          Passive Scanning State
          Active Scanning State
          Initiating State
            and Connection State (Central Role)
          Connection State (Peripheral Role)
          Scannable Advertising State
            and Passive Scanning State
          Connectable Advertising State
            and Passive Scanning State
          Non-connectable Advertising State
            and Initiating State
          Scannable Advertising State
            and Initiating State
          Active Scanning State
            and Connection State (Central Role)
          Passive Scanning State
            and Connection State (Peripheral Role)
          Active Scanning State
            and Connection State (Peripheral Role)
          Initiating State
            and Connection State (Central Role)
            and Central Role & Central Role
          Low Duty Cycle Directed Advertising State
          Connectable Advertising State
            and Initiating State
            and Central Role & Peripheral Role
          High Duty Cycle Directed Advertising State
            and Initiating State
            and Central Role & Peripheral Role
          Low Duty Cycle Directed Advertising State
            and Initiating State
            and Central Role & Peripheral Role
          Connectable Advertising State
            and Connection State (Central Role)
            and Central Role & Peripheral Role
          High Duty Cycle Directed Advertising State
            and Connection State (Central Role)
            and Central Role & Peripheral Role
          Low Duty Cycle Directed Advertising State
            and Connection State (Central Role)
            and Central Role & Peripheral Role
          Connectable Advertising State
            and Connection State (Peripheral Role)
            and Central Role & Peripheral Role
          High Duty Cycle Directed Advertising State
            and Connection State (Peripheral Role)
            and Peripheral Role & Peripheral Role
          Low Duty Cycle Directed Advertising State
            and Connection State (Peripheral Role)
            and Peripheral Role & Peripheral Role
          Initiating State
            and Connection State (Peripheral Role)
            and Central Role & Peripheral Role
zephyr.exe[836772]: < HCI Command: LE Read Maximum Data Length (0x08|0x002f) plen 0                                  #23 0.618685
> HCI Event: Command Complete (0x0e) plen 12                                                                         #24 0.619648
      LE Read Maximum Data Length (0x08|0x002f) ncmd 1
        Status: Success (0x00)
        Max TX octets: 251
        Max TX time: 2704
        Max RX octets: 251
        Max RX time: 2704
zephyr.exe[836772]: < HCI Command: LE Write Suggested Default Data Length (0x08|0x0024) plen 4                       #25 0.638681
        TX octets: 251
        TX time: 2704
> HCI Event: Command Complete (0x0e) plen 4                                                                          #26 0.639539
      LE Write Suggested Default Data Length (0x08|0x0024) ncmd 1
        Status: Success (0x00)
zephyr.exe[836772]: < HCI Command: LE Read Resolving List Size (0x08|0x002a) plen 0                                  #27 0.658680
> HCI Event: Command Complete (0x0e) plen 5                                                                          #28 0.659371
      LE Read Resolving List Size (0x08|0x002a) ncmd 1
        Status: Success (0x00)
        Size: 8
zephyr.exe[836772]: < HCI Command: LE Set Event Mask (0x08|0x0001) plen 8                                            #29 0.678683
        Mask: 0x000002023f87fa5e
          LE Advertising Report
          LE Connection Update Complete
          LE Read Remote Used Features Complete
          LE Long Term Key Request
          LE Data Length Change
          LE Enhanced Connection Complete
          LE PHY Update Complete
          LE Extended Advertising Report
          LE Periodic Advertising Sync Established
          LE Periodic Advertising Report
          LE Periodic Advertising Sync Lost
          LE Extended Scan Timeout
          LE Extended Advertising Set Terminated
          LE Scan Request Received
          LE Periodic Advertising Sync Transfer Rvc
          LE CIS Established
          LE CIS Request
          LE Create BIG Complete
          LE Terminate BIG Complete
          LE BIG Sync Established Complete
          LE BIG Sync Lost
          LE BIG Info Advertising Report
          Unknown mask (0x0000020000000000)
> HCI Event: Command Complete (0x0e) plen 4                                                                          #30 0.679328
      LE Set Event Mask (0x08|0x0001) ncmd 1
        Status: Success (0x00)
zephyr.exe[836772]: < HCI Command: Set Event Mask (0x03|0x0001) plen 8                                               #31 0.698692
        Mask: 0x2000800002008890
          Disconnection Complete
          Encryption Change
          Read Remote Version Information Complete
          Hardware Error
          Data Buffer Overflow
          Encryption Key Refresh Complete
          LE Meta
> HCI Event: Command Complete (0x0e) plen 4                                                                          #32 0.699412
      Set Event Mask (0x03|0x0001) ncmd 1
        Status: Success (0x00)
zephyr.exe[836772]: < HCI Command: Read BD ADDR (0x04|0x0009) plen 0                                                 #33 0.718687
> HCI Event: Command Complete (0x0e) plen 10                                                                         #34 0.719322
      Read BD ADDR (0x04|0x0009) ncmd 1
        Status: Success (0x00)
        Address: 00:00:00:00:00:00 (OUI 00-00-00)
zephyr.exe[836772]: < HCI Command: LE Set Random Address (0x08|0x0005) plen 6                                        #35 0.738695
        Address: D5:B6:CC:31:DB:3B (Static)
> HCI Event: Command Complete (0x0e) plen 4                                                                          #36 0.739374
      LE Set Random Address (0x08|0x0005) ncmd 1
        Status: Success (0x00)
zephyr.exe[836772]: < HCI Command: LE Set Extended Advertising Parameters (0x08|0x0036) plen 25                      #37 1.358743
        Handle: 0x00
        Properties: 0x0001
          Connectable
        Min advertising interval: 100.000 msec (0x00a0)
        Max advertising interval: 150.000 msec (0x00f0)
        Channel map: 37, 38, 39 (0x07)
        Own address type: Random (0x01)
        Peer address type: Public (0x00)
        Peer address: 00:00:00:00:00:00 (OUI 00-00-00)
        Filter policy: Allow Scan Request from Any, Allow Connect Request from Any (0x00)
        TX power: Host has no preference (0x7f)
        Primary PHY: LE 1M (0x01)
        Secondary max skip: 0x00
        Secondary PHY: LE 2M (0x02)
        SID: 0x00
        Scan request notifications: Disabled (0x00)
> HCI Event: Command Complete (0x0e) plen 5                                                                          #38 1.359981
      LE Set Extended Advertising Parameters (0x08|0x0036) ncmd 1
        Status: Success (0x00)
        TX power (selected): 0 dbm (0x00)
zephyr.exe[836772]: < HCI Command: LE Set Advertising Set Random Address (0x08|0x0035) plen 7                        #39 1.378700
        Advertising handle: 0x00
        Advertising random address: D5:B6:CC:31:DB:3B (Static)
> HCI Event: Command Complete (0x0e) plen 4                                                                          #40 1.379375
      LE Set Advertising Set Random Address (0x08|0x0035) ncmd 1
        Status: Success (0x00)
zephyr.exe[836772]: < HCI Command: LE Set Extended Advertising Data (0x08|0x0037) plen 39                            #41 1.398671
        Handle: 0x00
        Operation: Complete extended advertising data (0x03)
        Fragment preference: Minimize fragmentation (0x01)
        Data length: 0x23
        Flags: 0x06
          LE General Discoverable Mode
          BR/EDR Not Supported
        Name (complete): Tester_F6B11A
        Flags: 0x06
          LE General Discoverable Mode
          BR/EDR Not Supported
        16-bit Service UUIDs (complete): 1 entry
          Audio Stream Control (0x184e)
        Service Data: Audio Stream Control (0x184e)
          Data[6]: 01ff0fff0f00
> HCI Event: Command Complete (0x0e) plen 4                                                                          #42 1.399782
      LE Set Extended Advertising Data (0x08|0x0037) ncmd 1
        Status: Success (0x00)
zephyr.exe[836772]: < HCI Command: LE Set Extended Advertising Enable (0x08|0x0039) plen 6                           #43 1.418694
        Extended advertising: Enabled (0x01)
        Number of sets: 1 (0x01)
        Entry 0
          Handle: 0x00
          Duration: 0 ms (0x00)
          Max ext adv events: 0
> HCI Event: Command Complete (0x0e) plen 4                                                                          #44 1.419824
      LE Set Extended Advertising Enable (0x08|0x0039) ncmd 1
        Status: Success (0x00)
> HCI Event: LE Meta Event (0x3e) plen 31                                                                            #45 3.005994
      LE Enhanced Connection Complete (0x0a)
        Status: Success (0x00)
        Handle: 201
        Role: Peripheral (0x01)
        Peer address type: Random (0x01)
        Peer address: C7:1B:DC:08:AA:BB (Static)
        Local resolvable private address: 00:00:00:00:00:00 (Non-Resolvable)
        Peer resolvable private address: 00:00:00:00:00:00 (Non-Resolvable)
        Connection interval: 60.00 msec (0x0030)
        Connection latency: 0 (0x0000)
        Supervision timeout: 25120 msec (0x09d0)
        Central clock accuracy: 0x01
> HCI Event: LE Meta Event (0x3e) plen 6                                                                             #46 3.006283
      LE Advertising Set Terminated (0x12)
        Status: Success (0x00)
        Handle: 0
        Connection handle: 201
        Number of completed extended advertising events: 0
zephyr.exe[836772]: < HCI Command: LE Read Remote Used Features (0x08|0x0016) plen 2                                 #47 3.018888
        Handle: 201 Address: C7:1B:DC:08:AA:BB (Static)
> HCI Event: Command Status (0x0f) plen 4                                                                            #48 3.019496
      LE Read Remote Used Features (0x08|0x0016) ncmd 1
        Status: Success (0x00)
zephyr.exe[836772]: < ACL Data TX: Handle 201 [1/3] flags 0x00 dlen 7                                                #49 3.038721
      ATT: Exchange MTU Request (0x02) len 2
        Client RX MTU: 251
> HCI Event: Number of Completed Packets (0x13) plen 5                                                               #50 3.128181
        Num handles: 1
        Handle: 201 Address: C7:1B:DC:08:AA:BB (Static)
        Count: 1
        Buffers: 0/3
        #49: len 7 (0 Kb/s)
        Latency: 89 msec (89-89 msec ~89 msec)
> HCI Event: LE Meta Event (0x3e) plen 12                                                                            #51 3.188447
      LE Read Remote Used Features (0x04)
        Status: Success (0x00)
        Handle: 201 Address: C7:1B:DC:08:AA:BB (Static)
        Features: 0x2d 0x49 0x00 0xf7 0x67 0xd8 0x00 0x00
          LE Encryption
          Extended Reject Indication
          Peripheral-initiated Features Exchange
          LE Data Packet Length Extension
          LE 2M PHY
          LE Coded PHY
          Channel Selection Algorithm #2
          Periodic Advertising Sync Transfer - Sender
          Periodic Advertising Sync Transfer - Recipient
          Sleep Clock Accuracy Updates
          Connected Isochronous Stream - Central
          Connected Isochronous Stream - Peripheral
          Isochronous Broadcaster
          Synchronized Receiver
          Connected Isochronous Stream (Host Support)
          LE Power Control Request
          LE Power Control Request
          Connection Subrating
          Connection Subrating (Host Support)
          Unknown features (0x0000d80000000000)
> ACL Data RX: Handle 201 flags 0x02 dlen 7                                                                          #52 3.488345
      ATT: Exchange MTU Request (0x02) len 2
        Client RX MTU: 64
> ACL Data RX: Handle 201 flags 0x02 dlen 7                                                                          #53 3.488611
      ATT: Exchange MTU Response (0x03) len 2
        Server RX MTU: 64
zephyr.exe[836772]: < HCI Command: Host Number of Completed Packets (0x03|0x0035) plen 5                             #54 3.498847
        Num handles: 1
        Handle: 201 Address: C7:1B:DC:08:AA:BB (Static)
        Count: 1
zephyr.exe[836772]: < ACL Data TX: Handle 201 [1/3] flags 0x00 dlen 7                                                #55 3.498869
      ATT: Exchange MTU Response (0x03) len 2
        Server RX MTU: 251
zephyr.exe[836772]: < HCI Command: Host Number of Completed Packets (0x03|0x0035) plen 5                             #56 3.498911
        Num handles: 1
        Handle: 201 Address: C7:1B:DC:08:AA:BB (Static)
        Count: 1
zephyr.exe[836772]: < HCI Command: LE Remove Advertising Set (0x08|0x003c) plen 1                                    #57 3.548714
        Handle: 0
> HCI Event: Command Complete (0x0e) plen 4                                                                          #58 3.549401
      LE Remove Advertising Set (0x08|0x003c) ncmd 1
        Status: Success (0x00)
zephyr.exe[836772]: < HCI Command: LE Set Extended Advertising Parameters (0x08|0x0036) plen 25                      #59 3.558748
        Handle: 0x00
        Properties: 0x0001
          Connectable
        Min advertising interval: 100.000 msec (0x00a0)
        Max advertising interval: 150.000 msec (0x00f0)
        Channel map: 37, 38, 39 (0x07)
        Own address type: Random (0x01)
        Peer address type: Public (0x00)
        Peer address: 00:00:00:00:00:00 (OUI 00-00-00)
        Filter policy: Allow Scan Request from Any, Allow Connect Request from Any (0x00)
        TX power: Host has no preference (0x7f)
        Primary PHY: LE 1M (0x01)
        Secondary max skip: 0x00
        Secondary PHY: LE 2M (0x02)
        SID: 0x01
        Scan request notifications: Disabled (0x00)
> HCI Event: Command Complete (0x0e) plen 5                                                                          #60 3.559734
      LE Set Extended Advertising Parameters (0x08|0x0036) ncmd 1
        Status: Success (0x00)
        TX power (selected): 0 dbm (0x00)
zephyr.exe[836772]: < HCI Command: LE Set Advertising Set Random Address (0x08|0x0035) plen 7                        #61 3.578718
        Advertising handle: 0x00
        Advertising random address: D5:B6:CC:31:DB:3B (Static)
> HCI Event: Command Complete (0x0e) plen 4                                                                          #62 3.579576
      LE Set Advertising Set Random Address (0x08|0x0035) ncmd 1
        Status: Success (0x00)
zephyr.exe[836772]: < HCI Command: LE Set Extended Advertising Data (0x08|0x0037) plen 39                            #63 3.598729
        Handle: 0x00
        Operation: Complete extended advertising data (0x03)
        Fragment preference: Minimize fragmentation (0x01)
        Data length: 0x23
        Flags: 0x06
          LE General Discoverable Mode
          BR/EDR Not Supported
        Name (complete): Tester_F6B11A
        Flags: 0x06
          LE General Discoverable Mode
          BR/EDR Not Supported
        16-bit Service UUIDs (complete): 1 entry
          Audio Stream Control (0x184e)
        Service Data: Audio Stream Control (0x184e)
          Data[6]: 01ff0fff0f00
> HCI Event: Command Complete (0x0e) plen 4                                                                          #64 3.599862
      LE Set Extended Advertising Data (0x08|0x0037) ncmd 1
        Status: Success (0x00)
> HCI Event: Number of Completed Packets (0x13) plen 5                                                               #65 3.608084
        Num handles: 1
        Handle: 201 Address: C7:1B:DC:08:AA:BB (Static)
        Count: 1
        Buffers: 0/3
        #55: len 7 (0 Kb/s)
        Latency: 109 msec (89-109 msec ~99 msec)
zephyr.exe[836772]: < HCI Command: LE Set Extended Advertising Enable (0x08|0x0039) plen 6                           #66 3.618695
        Extended advertising: Enabled (0x01)
        Number of sets: 1 (0x01)
        Entry 0
          Handle: 0x00
          Duration: 0 ms (0x00)
          Max ext adv events: 0
> HCI Event: Command Complete (0x0e) plen 4                                                                          #67 3.619318
      LE Set Extended Advertising Enable (0x08|0x0039) ncmd 1
        Status: Success (0x00)
> ACL Data RX: Handle 201 flags 0x02 dlen 11                                                                         #68 5.588203
      SMP: Pairing Request (0x01) len 6
        IO capability: KeyboardDisplay (0x04)
        OOB data: Authentication data not present (0x00)
        Authentication requirement: Bonding, No MITM, SC, No Keypresses (0x09)
        Max encryption key size: 16
        Initiator key distribution: EncKey IdKey (0x03)
        Responder key distribution: EncKey IdKey Sign (0x07)
zephyr.exe[836772]: < HCI Command: Host Number of Completed Packets (0x03|0x0035) plen 5                             #69 5.598861
        Num handles: 1
        Handle: 201 Address: C7:1B:DC:08:AA:BB (Static)
        Count: 1
zephyr.exe[836772]: < ACL Data TX: Handle 201 [1/3] flags 0x00 dlen 11                                               #70 5.598884
      SMP: Pairing Response (0x02) len 6
        IO capability: NoInputNoOutput (0x03)
        OOB data: Authentication data not present (0x00)
        Authentication requirement: Bonding, No MITM, SC, No Keypresses (0x09)
        Max encryption key size: 16
        Initiator key distribution: IdKey (0x02)
        Responder key distribution: Sign (0x04)
> HCI Event: Number of Completed Packets (0x13) plen 5                                                               #71 5.708214
        Num handles: 1
        Handle: 201 Address: C7:1B:DC:08:AA:BB (Static)
        Count: 1
        Buffers: 0/3
        #70: len 11 (0 Kb/s)
        Latency: 109 msec (89-109 msec ~104 msec)
> ACL Data RX: Handle 201 flags 0x02 dlen 27                                                                         #72 5.708747
> ACL Data RX: Handle 201 flags 0x01 dlen 27                                                                         #73 5.708797
zephyr.exe[836772]: < HCI Command: Host Number of Completed Packets (0x03|0x0035) plen 5                             #74 5.718859
        Num handles: 1
        Handle: 201 Address: C7:1B:DC:08:AA:BB (Static)
        Count: 1
> ACL Data RX: Handle 201 flags 0x01 dlen 15                                                                         #75 5.768283
      SMP: Pairing Public Key (0x0c) len 64
        X[32]: 5a584c14a84991047392bc12336bf1375454a243f943882cf37d057372f60d09
        Y[32]: a0d1ed03e1475d3ff914fa045523631172720ef6cb0f96fa1129e6761a4e9e81
zephyr.exe[836772]: < HCI Command: Host Number of Completed Packets (0x03|0x0035) plen 5                             #76 5.778872
        Num handles: 1
        Handle: 201 Address: C7:1B:DC:08:AA:BB (Static)
        Count: 1
zephyr.exe[836772]: < HCI Command: Host Number of Completed Packets (0x03|0x0035) plen 5                             #77 5.778891
        Num handles: 1
        Handle: 201 Address: C7:1B:DC:08:AA:BB (Static)
        Count: 1
zephyr.exe[836772]: < ACL Data TX: Handle 201 [1/3] flags 0x00 dlen 27                                               #78 5.778957
zephyr.exe[836772]: < ACL Data TX: Handle 201 flags 0x01 dlen 27                                                     #79 5.778959
zephyr.exe[836772]: < ACL Data TX: Handle 201 flags 0x01 dlen 15                                                     #80 5.778960
      SMP: Pairing Public Key (0x0c) len 64
        X[32]: 98308440221e2d910f0e54b71e7ec652857aa9b5a0dc65028824cc19db1226e9
        Y[32]: 67a4816bcb62efb21701e31fdb27561a6217575fb007a8bbdabe7e28b6f68482
> HCI Event: Number of Completed Packets (0x13) plen 5                                                               #81 5.828502
        Num handles: 1
        Handle: 201 Address: C7:1B:DC:08:AA:BB (Static)
        Count: 1
        Buffers: 0/3
        #78: len 27 (4 Kb/s)
        Latency: 49 msec (49-109 msec ~76 msec)
> HCI Event: Number of Completed Packets (0x13) plen 5                                                               #82 5.828939
        Num handles: 1
        Handle: 201 Address: C7:1B:DC:08:AA:BB (Static)
        Count: 1
        Buffers: underflow/3
        #79: len 27 (4 Kb/s)
        Latency: 49 msec (49-109 msec ~63 msec)
zephyr.exe[836772]: < ACL Data TX: Handle 201 [1/3] flags 0x00 dlen 21                                               #83 5.838762
      SMP: Pairing Confirm (0x03) len 16
        Confirm value[16]: 62f1d9de35ee8b285548c56a6c90198f
> HCI Event: Number of Completed Packets (0x13) plen 5                                                               #84 5.888171
        Num handles: 1
        Handle: 201 Address: C7:1B:DC:08:AA:BB (Static)
        Count: 1
        Buffers: 0/3
        #80: len 15 (1 Kb/s)
        Latency: 109 msec (49-109 msec ~86 msec)
> HCI Event: Number of Completed Packets (0x13) plen 5                                                               #85 5.948428
        Num handles: 1
        Handle: 201 Address: C7:1B:DC:08:AA:BB (Static)
        Count: 1
        Buffers: underflow/3
        #83: len 21 (1 Kb/s)
        Latency: 109 msec (49-109 msec ~98 msec)
> ACL Data RX: Handle 201 flags 0x02 dlen 21                                                                         #86 5.948430
      SMP: Pairing Random (0x04) len 16
        Random value[16]: 33ffa05fd69ab0770000000000000000
zephyr.exe[836772]: < HCI Command: Host Number of Completed Packets (0x03|0x0035) plen 5                             #87 5.958865
        Num handles: 1
        Handle: 201 Address: C7:1B:DC:08:AA:BB (Static)
        Count: 1
zephyr.exe[836772]: < ACL Data TX: Handle 201 [1/3] flags 0x00 dlen 21                                               #88 5.958924
      SMP: Pairing Random (0x04) len 16
        Random value[16]: 8e6108f966a694cbe26df70bb96773e6
> HCI Event: Number of Completed Packets (0x13) plen 5                                                               #89 6.067947
        Num handles: 1
        Handle: 201 Address: C7:1B:DC:08:AA:BB (Static)
        Count: 1
        Buffers: 0/3
        #88: len 21 (1 Kb/s)
        Latency: 109 msec (49-109 msec ~103 msec)
> ACL Data RX: Handle 201 flags 0x02 dlen 21                                                                         #90 6.248174
      SMP: Pairing DHKey Check (0x0d) len 16
        E[16]: 7852d752cba359d32dec2a9998f7d609
zephyr.exe[836772]: < HCI Command: Host Number of Completed Packets (0x03|0x0035) plen 5                             #91 6.258982
        Num handles: 1
        Handle: 201 Address: C7:1B:DC:08:AA:BB (Static)
        Count: 1
zephyr.exe[836772]: < ACL Data TX: Handle 201 [1/3] flags 0x00 dlen 21                                               #92 6.259045
      SMP: Pairing DHKey Check (0x0d) len 16
        E[16]: 930372a9b76fdb5ea6af7846664ada35
> HCI Event: Number of Completed Packets (0x13) plen 5                                                               #93 6.367944
        Num handles: 1
        Handle: 201 Address: C7:1B:DC:08:AA:BB (Static)
        Count: 1
        Buffers: 0/3
        #92: len 21 (1 Kb/s)
        Latency: 108 msec (49-109 msec ~106 msec)
> HCI Event: LE Meta Event (0x3e) plen 13                                                                            #94 6.428575
      LE Long Term Key Request (0x05)
        Handle: 201 Address: C7:1B:DC:08:AA:BB (Static)
        Random number: 0x0000000000000000
        Encrypted diversifier: 0x0000
zephyr.exe[836772]: < HCI Command: LE Long Term Key Request Reply (0x08|0x001a) plen 18                              #95 6.438834
        Handle: 201 Address: C7:1B:DC:08:AA:BB (Static)
        Long term key[16]: 433de4375eb8888a0fa8562244a959f9
> HCI Event: Command Complete (0x0e) plen 6                                                                          #96 6.439585
      LE Long Term Key Request Reply (0x08|0x001a) ncmd 1
        Status: Success (0x00)
        Handle: 201 Address: C7:1B:DC:08:AA:BB (Static)
> HCI Event: Encryption Change (0x08) plen 4                                                                         #97 6.728197
        Status: Success (0x00)
        Handle: 201 Address: C7:1B:DC:08:AA:BB (Static)
        Encryption: Enabled with AES-CCM (0x01)
zephyr.exe[836772]: < ACL Data TX: Handle 201 [1/3] flags 0x00 dlen 21                                               #98 6.848871
      SMP: Signing Information (0x0a) len 16
        Signature key[16]: 5da095555cc64d02679f89a05211af56
> HCI Event: Number of Completed Packets (0x13) plen 5                                                               #99 7.028127
        Num handles: 1
        Handle: 201 Address: C7:1B:DC:08:AA:BB (Static)
        Count: 1
        Buffers: 0/3
        #98: len 21 (0 Kb/s)
        Latency: 179 msec (49-179 msec ~142 msec)
> ACL Data RX: Handle 201 flags 0x02 dlen 21                                                                        #100 7.028325
      SMP: Identity Information (0x08) len 16
        Identity resolving key[16]: d32dfd664b2eff8f83b137e1e4c78587
zephyr.exe[836772]: < HCI Command: Host Number of Completed Packets (0x03|0x0035) plen 5                            #101 7.038840
        Num handles: 1
        Handle: 201 Address: C7:1B:DC:08:AA:BB (Static)
        Count: 1
> ACL Data RX: Handle 201 flags 0x02 dlen 12                                                                        #102 7.088188
      SMP: Identity Address Information (0x09) len 7
        Address: C7:1B:DC:08:AA:BB (Static)
zephyr.exe[836772]: < HCI Command: LE Set Extended Advertising Enable (0x08|0x0039) plen 6                          #103 7.098941
        Extended advertising: Disabled (0x00)
        Number of sets: 1 (0x01)
        Entry 0
          Handle: 0x00
          Duration: 0 ms (0x00)
          Max ext adv events: 0
> HCI Event: Command Complete (0x0e) plen 4                                                                         #104 7.099611
      LE Set Extended Advertising Enable (0x08|0x0039) ncmd 1
        Status: Success (0x00)
zephyr.exe[836772]: < HCI Command: LE Add Device To Resolving List (0x08|0x0027) plen 39                            #105 7.118842
        Address type: Random (0x01)
        Address: C7:1B:DC:08:AA:BB (Static)
        Peer identity resolving key[16]: d32dfd664b2eff8f83b137e1e4c78587
        Local identity resolving key[16]: 00000000000000000000000000000000
> HCI Event: Command Complete (0x0e) plen 4                                                                         #106 7.120250
      LE Add Device To Resolving List (0x08|0x0027) ncmd 1
        Status: Success (0x00)
zephyr.exe[836772]: < HCI Command: LE Set Privacy Mode (0x08|0x004e) plen 8                                         #107 7.138839
        Peer Identity address type: Random (0x01)
        Peer Identity address: C7:1B:DC:08:AA:BB (Static)
        Privacy Mode: Use Device Privacy (0x01)
> HCI Event: Command Complete (0x0e) plen 4                                                                         #108 7.139906
      LE Set Privacy Mode (0x08|0x004e) ncmd 1
        Status: Success (0x00)
> ACL Data RX: Handle 201 flags 0x02 dlen 13                                                                        #109 7.148795
      ATT: Find By Type Value Request (0x06) len 8
        Handle range: 0x0001-0xffff
        Attribute type: Primary Service (0x2800)
          UUID: Broadcast Audio Scan (0x184f)
zephyr.exe[836772]: < HCI Command: LE Set Address Resolution Enable (0x08|0x002d) plen 1                            #110 7.158843
        Address resolution: Enabled (0x01)
> HCI Event: Command Complete (0x0e) plen 4                                                                         #111 7.159904
      LE Set Address Resolution Enable (0x08|0x002d) ncmd 1
        Status: Success (0x00)
zephyr.exe[836772]: < HCI Command: LE Set Extended Advertising Enable (0x08|0x0039) plen 6                          #112 7.178851
        Extended advertising: Enabled (0x01)
        Number of sets: 1 (0x01)
        Entry 0
          Handle: 0x00
          Duration: 0 ms (0x00)
          Max ext adv events: 0
> HCI Event: Command Complete (0x0e) plen 4                                                                         #113 7.179604
      LE Set Extended Advertising Enable (0x08|0x0039) ncmd 1
        Status: Success (0x00)
zephyr.exe[836772]: < HCI Command: Host Number of Completed Packets (0x03|0x0035) plen 5                            #114 7.198794
        Num handles: 1
        Handle: 201 Address: C7:1B:DC:08:AA:BB (Static)
        Count: 1
zephyr.exe[836772]: < HCI Command: Host Number of Completed Packets (0x03|0x0035) plen 5                            #115 7.198919
        Num handles: 1
        Handle: 201 Address: C7:1B:DC:08:AA:BB (Static)
        Count: 1
zephyr.exe[836772]: < ACL Data TX: Handle 201 [1/3] flags 0x00 dlen 9                                               #116 7.198942
      ATT: Find By Type Value Response (0x07) len 4
        Handle range: 0x0047-0x004c
> HCI Event: Number of Completed Packets (0x13) plen 5                                                              #117 7.268005
        Num handles: 1
        Handle: 201 Address: C7:1B:DC:08:AA:BB (Static)
        Count: 1
        Buffers: 0/3
        #116: len 9 (1 Kb/s)
        Latency: 69 msec (49-179 msec ~105 msec)
> ACL Data RX: Handle 201 flags 0x02 dlen 13                                                                        #118 7.268276
      ATT: Find By Type Value Request (0x06) len 8
        Handle range: 0x004d-0xffff
        Attribute type: Primary Service (0x2800)
          UUID: Broadcast Audio Scan (0x184f)
zephyr.exe[836772]: < HCI Command: Host Number of Completed Packets (0x03|0x0035) plen 5                            #119 7.278846
        Num handles: 1
        Handle: 201 Address: C7:1B:DC:08:AA:BB (Static)
        Count: 1
zephyr.exe[836772]: < ACL Data TX: Handle 201 [1/3] flags 0x00 dlen 9                                               #120 7.278906
      ATT: Error Response (0x01) len 4
        Find By Type Value Request (0x06)
        Handle: 0x004d
        Error: Attribute Not Found (0x0a)
> HCI Event: Number of Completed Packets (0x13) plen 5                                                              #121 7.387953
        Num handles: 1
        Handle: 201 Address: C7:1B:DC:08:AA:BB (Static)
        Count: 1
        Buffers: 0/3
        #120: len 9 (0 Kb/s)
        Latency: 109 msec (49-179 msec ~107 msec)
> ACL Data RX: Handle 201 flags 0x02 dlen 11                                                                        #122 7.388500
      ATT: Read By Type Request (0x08) len 6
        Handle range: 0x0047-0x004c
        Attribute type: Characteristic (0x2803)
zephyr.exe[836772]: < HCI Command: Host Number of Completed Packets (0x03|0x0035) plen 5                            #123 7.398908
        Num handles: 1
        Handle: 201 Address: C7:1B:DC:08:AA:BB (Static)
        Count: 1
zephyr.exe[836772]: < ACL Data TX: Handle 201 [1/3] flags 0x00 dlen 20                                              #124 7.398957
      ATT: Read By Type Response (0x09) len 15
        Attribute data length: 7
        Attribute data list: 2 entries
        Handle: 0x0048
        Value[5]: 0c4900c72b
            Properties: 0x0c
              Write Without Response (0x04)
              Write (0x08)
            Value Handle: 0x0049
            Value UUID: Broadcast Audio Scan Control Point (0x2bc7)
        Handle: 0x004a
        Value[5]: 124b00c82b
            Properties: 0x12
              Read (0x02)
              Notify (0x10)
            Value Handle: 0x004b
            Value UUID: Broadcast Receive State (0x2bc8)
> HCI Event: Number of Completed Packets (0x13) plen 5                                                              #125 7.508202
        Num handles: 1
        Handle: 201 Address: C7:1B:DC:08:AA:BB (Static)
        Count: 1
        Buffers: 0/3
        #124: len 20 (1 Kb/s)
        Latency: 109 msec (49-179 msec ~108 msec)
> ACL Data RX: Handle 201 flags 0x02 dlen 11                                                                        #126 7.508286
      ATT: Read By Type Request (0x08) len 6
        Handle range: 0x004b-0x004c
        Attribute type: Characteristic (0x2803)
zephyr.exe[836772]: < HCI Command: Host Number of Completed Packets (0x03|0x0035) plen 5                            #127 7.518907
        Num handles: 1
        Handle: 201 Address: C7:1B:DC:08:AA:BB (Static)
        Count: 1
zephyr.exe[836772]: < ACL Data TX: Handle 201 [1/3] flags 0x00 dlen 9                                               #128 7.518965
      ATT: Error Response (0x01) len 4
        Read By Type Request (0x08)
        Handle: 0x004b
        Error: Attribute Not Found (0x0a)
> HCI Event: Number of Completed Packets (0x13) plen 5                                                              #129 7.627988
        Num handles: 1
        Handle: 201 Address: C7:1B:DC:08:AA:BB (Static)
        Count: 1
        Buffers: 0/3
        #128: len 9 (0 Kb/s)
        Latency: 109 msec (49-179 msec ~108 msec)
> ACL Data RX: Handle 201 flags 0x02 dlen 9                                                                         #130 7.628311
      ATT: Find Information Request (0x04) len 4
        Handle range: 0x004c-0x004c
zephyr.exe[836772]: < HCI Command: Host Number of Completed Packets (0x03|0x0035) plen 5                            #131 7.638827
        Num handles: 1
        Handle: 201 Address: C7:1B:DC:08:AA:BB (Static)
        Count: 1
zephyr.exe[836772]: < ACL Data TX: Handle 201 [1/3] flags 0x00 dlen 10                                              #132 7.638874
      ATT: Find Information Response (0x05) len 5
        Format: UUID-16 (0x01)
        Handle: 0x004c
        UUID: Client Characteristic Configuration (0x2902)
> HCI Event: Number of Completed Packets (0x13) plen 5                                                              #133 7.748013
        Num handles: 1
        Handle: 201 Address: C7:1B:DC:08:AA:BB (Static)
        Count: 1
        Buffers: 0/3
        #132: len 10 (0 Kb/s)
        Latency: 109 msec (49-179 msec ~108 msec)
> ACL Data RX: Handle 201 flags 0x02 dlen 9                                                                         #134 7.748282
      ATT: Write Request (0x12) len 4
        Handle: 0x004c
          Data[2]: 0000
zephyr.exe[836772]: < HCI Command: Host Number of Completed Packets (0x03|0x0035) plen 5                            #135 7.758900
        Num handles: 1
        Handle: 201 Address: C7:1B:DC:08:AA:BB (Static)
        Count: 1
zephyr.exe[836772]: < ACL Data TX: Handle 201 [1/3] flags 0x00 dlen 5                                               #136 7.758953
      ATT: Write Response (0x13) len 0
> HCI Event: Number of Completed Packets (0x13) plen 5                                                              #137 7.868133
        Num handles: 1
        Handle: 201 Address: C7:1B:DC:08:AA:BB (Static)
        Count: 1
        Buffers: 0/3
        #136: len 5 (0 Kb/s)
        Latency: 109 msec (49-179 msec ~109 msec)
> ACL Data RX: Handle 201 flags 0x02 dlen 9                                                                         #138 7.868136
      ATT: Write Request (0x12) len 4
        Handle: 0x004c
          Data[2]: 0100
zephyr.exe[836772]: < HCI Command: Host Number of Completed Packets (0x03|0x0035) plen 5                            #139 7.878839
        Num handles: 1
        Handle: 201 Address: C7:1B:DC:08:AA:BB (Static)
        Count: 1
zephyr.exe[836772]: < ACL Data TX: Handle 201 [1/3] flags 0x00 dlen 5                                               #140 7.878884
      ATT: Write Response (0x13) len 0
> HCI Event: Number of Completed Packets (0x13) plen 5                                                              #141 7.988182
        Num handles: 1
        Handle: 201 Address: C7:1B:DC:08:AA:BB (Static)
        Count: 1
        Buffers: 0/3
        #140: len 5 (0 Kb/s)
        Latency: 109 msec (49-179 msec ~109 msec)
> ACL Data RX: Handle 201 flags 0x02 dlen 7                                                                         #142 7.988288
      ATT: Read Request (0x0a) len 2
        Handle: 0x004b
zephyr.exe[836772]: < HCI Command: Host Number of Completed Packets (0x03|0x0035) plen 5                            #143 7.998896
        Num handles: 1
        Handle: 201 Address: C7:1B:DC:08:AA:BB (Static)
        Count: 1
zephyr.exe[836772]: < ACL Data TX: Handle 201 [1/3] flags 0x00 dlen 5                                               #144 7.998958
      ATT: Read Response (0x0b) len 0
        Value[0]: 
> HCI Event: Number of Completed Packets (0x13) plen 5                                                              #145 8.108391
        Num handles: 1
        Handle: 201 Address: C7:1B:DC:08:AA:BB (Static)
        Count: 1
        Buffers: 0/3
        #144: len 5 (0 Kb/s)
        Latency: 109 msec (49-179 msec ~109 msec)
> ACL Data RX: Handle 201 flags 0x02 dlen 27                                                                        #146 8.288687
> ACL Data RX: Handle 201 flags 0x01 dlen 1                                                                         #147 8.289074
      ATT: Write Command (0x52) len 23
        Handle: 0x0049
          Data[21]: 0201bbaa08dc1bc70057e90901401f010100000000
zephyr.exe[836772]: < HCI Command: Host Number of Completed Packets (0x03|0x0035) plen 5                            #148 8.298975
        Num handles: 1
        Handle: 201 Address: C7:1B:DC:08:AA:BB (Static)
        Count: 1
zephyr.exe[836772]: < HCI Command: Host Number of Completed Packets (0x03|0x0035) plen 5                            #149 8.299196
        Num handles: 1
        Handle: 201 Address: C7:1B:DC:08:AA:BB (Static)
        Count: 1
zephyr.exe[836772]: < ACL Data TX: Handle 201 [1/3] flags 0x00 dlen 27                                              #150 8.299204
      ATT: Handle Value Notification (0x1b) len 22
        Handle: 0x004b
          Data[20]: 0001bbaa08dc1bc70057e9090000010000000000
> HCI Event: Number of Completed Packets (0x13) plen 5                                                              #151 8.408589
        Num handles: 1
        Handle: 201 Address: C7:1B:DC:08:AA:BB (Static)
        Count: 1
        Buffers: 0/3
        #150: len 27 (1 Kb/s)
        Latency: 109 msec (49-179 msec ~109 msec)
zephyr.exe[836772]: < HCI Command: LE Periodic Advertising Sync Transfer Parameters (0x08|0x005c) plen 8            #152 8.658865
        Connection handle: 201
        Mode: Enabled with report events enabled (0x02)
        Skip: 0x05
        Sync timeout: 10000 msec (0x03e8)
        Sync CTE type: 0x0000
zephyr.exe[836772]: < ACL Data TX: Handle 201 [1/3] flags 0x00 dlen 27                                              #153 8.658873
      ATT: Handle Value Notification (0x1b) len 22
        Handle: 0x004b
          Data[20]: 0001bbaa08dc1bc70057e9090100010000000000
> HCI Event: Command Complete (0x0e) plen 6                                                                         #154 8.659565
      LE Periodic Advertising Sync Transfer Parameters (0x08|0x005c) ncmd 1
        Status: Success (0x00)
        Connection handle: 201
> HCI Event: Number of Completed Packets (0x13) plen 5                                                              #155 8.767927
        Num handles: 1
        Handle: 201 Address: C7:1B:DC:08:AA:BB (Static)
        Count: 1
        Buffers: 0/3
        #153: len 27 (1 Kb/s)
        Latency: 109 msec (49-179 msec ~109 msec)
> HCI Event: LE Meta Event (0x3e) plen 20                                                                           #156 8.860168
      LE Periodic Advertising Sync Transfer Received (0x18)
        Status: Success (0x00)
        Handle: 201
        Connection handle: 201
        Service data: 0x0000
        Sync handle: 90
        SID: 0x00
        Address type:: Random (0x01)
        Address:: C7:1B:DC:08:AA:BB (Static)
        PHY:: LE 1M (0x01)
        Periodic advertising Interval: 120.000
        Accuracy: 0.3125 msec (0x0001)
> HCI Event: LE Meta Event (0x3e) plen 48                                                                           #157 8.860170
      LE Periodic Advertising Report (0x0f)
        Sync handle: 90
        TX power: 127 dbm (0x7f)
        RSSI: -17 dBm (0xef)
        CTE Type: No Constant Tone Extension (0xff)
        Data status: [0;32mComplete[0m
        Data length: 0x28
        Service Data: Basic Audio Announcement (0x1851)
          Presentation Delay: 40000
          Number of Subgroups: 1
            Subgroup #0:
            Number of BIS(s): 1
            Codec: LC3 (0x06)
            Codec Specific Configuration: #0: len 0x02 type 0x01
            Codec Specific Configuration: Sampling Frequency: 16 Khz (0x03)
            Codec Specific Configuration: #1: len 0x02 type 0x02
            Codec Specific Configuration: Frame Duration: 10 ms (0x01)
            Codec Specific Configuration: #2: len 0x03 type 0x04
            Codec Specific Configuration: Frame Length: 40 (0x0028)
            Metadata: #0: len 0x03 type 0x02
            Metadata: Context: 0x0004
            Metadata: Context	Media (0x0004)
            Metadata: #1: len 0x01 type 0x09
              BIS #0:
              Index: 1
              Codec Specific Configuration: #0: len 0x05 type 0x03
              Codec Specific Configuration: Location: 0x00000001
              Codec Specific Configuration: Location: Front Left (0x00000001)
> HCI Event: LE Meta Event (0x3e) plen 20                                                                           #158 8.860170
      LE Broadcast Isochronous Group Info Advertising Report (0x22)
        Sync Handle: 0x005a
        Number BIS: 1
        NSE: 3
        ISO Interval: 10.00 msec (0x0008)
        BN: 1
        PTO: 1
        IRC: 2
        Maximum PDU: 40
        SDU Interval: 10000 us (0x002710)
        Maximum SDU: 40
        PHY: LE 1M (0x01)
        Framing: Unframed (0x00)
        Encryption: 0x00
zephyr.exe[836772]: < HCI Command: LE Broadcast Isochronous Group Create Sync (0x08|0x006b) plen 25                 #159 8.879301
        BIG Handle: 0x00
        BIG Sync Handle: 0x005a
        Encryption: Unencrypted (0x00)
        Broadcast Code[16]: 00000000000000000000000000000000
        Maximum Number Subevents: 0x00
        Timeout: 200 ms (0x0014)
        Number of BIS: 1
        BIS ID: 0x01
zephyr.exe[836772]: < ACL Data TX: Handle 201 [1/3] flags 0x00 dlen 27                                              #160 8.879308
zephyr.exe[836772]: < ACL Data TX: Handle 201 flags 0x01 dlen 6                                                     #161 8.879309
      ATT: Handle Value Notification (0x1b) len 28
        Handle: 0x004b
          Data[26]: 0001bbaa08dc1bc70057e9090200010000000006030204000109
> HCI Event: Command Status (0x0f) plen 4                                                                           #162 8.880214
      LE Broadcast Isochronous Group Create Sync (0x08|0x006b) ncmd 1
        Status: Success (0x00)
> HCI Event: Number of Completed Packets (0x13) plen 5                                                              #163 8.948002
        Num handles: 1
        Handle: 201 Address: C7:1B:DC:08:AA:BB (Static)
        Count: 1
        Buffers: 0/3
        #160: len 27 (3 Kb/s)
        Latency: 68 msec (49-179 msec ~88 msec)
> HCI Event: Number of Completed Packets (0x13) plen 5                                                              #164 9.008073
        Num handles: 1
        Handle: 201 Address: C7:1B:DC:08:AA:BB (Static)
        Count: 1
        Buffers: underflow/3
        #161: len 6 (0 Kb/s)
        Latency: 128 msec (49-179 msec ~108 msec)
> HCI Event: LE Meta Event (0x3e) plen 48                                                                           #165 9.579558
      LE Periodic Advertising Report (0x0f)
        Sync handle: 90
        TX power: 127 dbm (0x7f)
        RSSI: -17 dBm (0xef)
        CTE Type: No Constant Tone Extension (0xff)
        Data status: [0;32mComplete[0m
        Data length: 0x28
        Service Data: Basic Audio Announcement (0x1851)
          Presentation Delay: 40000
          Number of Subgroups: 1
            Subgroup #0:
            Number of BIS(s): 1
            Codec: LC3 (0x06)
            Codec Specific Configuration: #0: len 0x02 type 0x01
            Codec Specific Configuration: Sampling Frequency: 16 Khz (0x03)
            Codec Specific Configuration: #1: len 0x02 type 0x02
            Codec Specific Configuration: Frame Duration: 10 ms (0x01)
            Codec Specific Configuration: #2: len 0x03 type 0x04
            Codec Specific Configuration: Frame Length: 40 (0x0028)
            Metadata: #0: len 0x03 type 0x02
            Metadata: Context: 0x0004
            Metadata: Context	Media (0x0004)
            Metadata: #1: len 0x01 type 0x09
              BIS #0:
              Index: 1
              Codec Specific Configuration: #0: len 0x05 type 0x03
              Codec Specific Configuration: Location: 0x00000001
              Codec Specific Configuration: Location: Front Left (0x00000001)
> HCI Event: LE Meta Event (0x3e) plen 20                                                                           #166 9.579673
      LE Broadcast Isochronous Group Info Advertising Report (0x22)
        Sync Handle: 0x005a
        Number BIS: 1
        NSE: 3
        ISO Interval: 10.00 msec (0x0008)
        BN: 1
        PTO: 1
        IRC: 2
        Maximum PDU: 40
        SDU Interval: 10000 us (0x002710)
        Maximum SDU: 40
        PHY: LE 1M (0x01)
        Framing: Unframed (0x00)
        Encryption: 0x00
> HCI Event: LE Meta Event (0x3e) plen 17                                                                           #167 9.585327
      LE Broadcast Isochronous Group Sync Established (0x1d)
        Status: Success (0x00)
        BIG Handle: 0x00
        Transport Latency: 11500 us (0x002cec)
        NSE: 3
        BN: 1
        PTO: 1
        IRC: 2
        Maximum PDU: 40
        ISO Interval: 10.00 msec (0x0008)
        Connection Handle #0: 70
zephyr.exe[836772]: < HCI Command: LE Setup Isochronous Data Path (0x08|0x006e) plen 13                             #168 9.599073
        Handle: 70
        Data Path Direction: Output (Controller to Host) (0x01)
        Data Path: HCI (0x00)
        Coding Format: Transparent (0x03)
        Company Codec ID: Ericsson Technology Licensing (0)
        Vendor Codec ID: 0
        Controller Delay: 0 us (0x000000)
        Codec Configuration Length: 0
        Codec Configuration[0]: 
> HCI Event: Command Complete (0x0e) plen 6                                                                         #169 9.599866
      LE Setup Isochronous Data Path (0x08|0x006e) ncmd 1
        Status: Success (0x00)
        Handle: 70
> ISO Data RX: Handle 70 SN 139 flags 0x02 dlen 4 slen 32768                                                        #170 9.605517
> ISO Data RX: Handle 70 SN 140 flags 0x06 dlen 8 slen 32768                                                        #171 9.605518
        invalid packet size (4 != 8)
        8c 00 00 80                                      ....            
> ISO Data RX: Handle 70 SN 141 flags 0x06 dlen 8 slen 32768                                                        #172 9.606762
        invalid packet size (4 != 8)
        8d 00 00 80                                      ....            
> ISO Data RX: Handle 70 SN 142 flags 0x06 dlen 8 slen 32768                                                        #173 9.616570
        invalid packet size (4 != 8)
        8e 00 00 80                                      ....            
zephyr.exe[836772]: < ACL Data TX: Handle 201 [1/3] flags 0x00 dlen 27                                              #174 9.618999
zephyr.exe[836772]: < ACL Data TX: Handle 201 flags 0x01 dlen 6                                                     #175 9.619024
      ATT: Handle Value Notification (0x1b) len 28
        Handle: 0x004b
          Data[26]: 0001bbaa08dc1bc70057e9090200010100000006030204000109
> ISO Data RX: Handle 70 SN 143 flags 0x06 dlen 8 slen 32768                                                        #176 9.626447
        invalid packet size (4 != 8)
        8f 00 00 80                                      ....            
> ISO Data RX: Handle 70 SN 144 flags 0x06 dlen 8 slen 32768                                                        #177 9.636688
        invalid packet size (4 != 8)
        90 00 00 80                                      ....            
> ISO Data RX: Handle 70 SN 145 flags 0x06 dlen 8 slen 32768                                                        #178 9.646685
        invalid packet size (4 != 8)
        91 00 00 80                                      ....            
> ISO Data RX: Handle 70 SN 146 flags 0x06 dlen 8 slen 32768                                                        #179 9.656822
        invalid packet size (4 != 8)
        92 00 00 80                                      ....            
> ISO Data RX: Handle 70 SN 147 flags 0x06 dlen 8 slen 32768                                                        #180 9.666730
        invalid packet size (4 != 8)
        93 00 00 80                                      ....            
> HCI Event: Number of Completed Packets (0x13) plen 5                                                              #181 9.668522
        Num handles: 1
        Handle: 201 Address: C7:1B:DC:08:AA:BB (Static)
        Count: 1
        Buffers: 0/3
        #174: len 27 (4 Kb/s)
        Latency: 49 msec (49-179 msec ~79 msec)
> ISO Data RX: Handle 70 SN 148 flags 0x06 dlen 8 slen 32768                                                        #182 9.676567
        invalid packet size (4 != 8)
        94 00 00 80                                      ....            
> ISO Data RX: Handle 70 SN 149 flags 0x06 dlen 8 slen 32768                                                        #183 9.686404
        invalid packet size (4 != 8)
        95 00 00 80                                      ....            
> ISO Data RX: Handle 70 SN 150 flags 0x06 dlen 8 slen 32768                                                        #184 9.696513
        invalid packet size (4 != 8)
        96 00 00 80                                      ....            
> ISO Data RX: Handle 70 SN 151 flags 0x06 dlen 8 slen 32768                                                        #185 9.706687
        invalid packet size (4 != 8)
        97 00 00 80                                      ....            
> ISO Data RX: Handle 70 SN 152 flags 0x06 dlen 8 slen 32768                                                        #186 9.716486
        invalid packet size (4 != 8)
        98 00 00 80                                      ....            
> ISO Data RX: Handle 70 SN 153 flags 0x06 dlen 8 slen 32768                                                        #187 9.726491
        invalid packet size (4 != 8)
        99 00 00 80                                      ....            
> HCI Event: Number of Completed Packets (0x13) plen 5                                                              #188 9.728156
        Num handles: 1
        Handle: 201 Address: C7:1B:DC:08:AA:BB (Static)
        Count: 1
        Buffers: underflow/3
        #175: len 6 (0 Kb/s)
        Latency: 109 msec (49-179 msec ~94 msec)
> ACL Data RX: Handle 201 flags 0x02 dlen 18                                                                        #189 9.728367
      ATT: Write Command (0x52) len 13
        Handle: 0x0049
         