Bluetooth monitor ver 5.72
= Note: Linux version 6.14.0-36-generic (x86_64)                       0.775046
= Note: Bluetooth subsystem version 2.22                               0.775048
= New Index: 00:00:00:00:00:00 (Primary,UART,hci1)              [hci1] 0.775048
= New Index: 48:5F:99:8E:E0:64 (Primary,USB,hci0)               [hci0] 0.775049
= Open Index: 00:00:00:00:00:00                                 [hci1] 1.288921
= Index Info: 00:00:00:00:00:00 (Nordic Semiconductor ASA)      [hci1] 1.288936
@ USER Open: main (privileged) version 2.22            {0x0001} [hci1] 1.288944
< HCI Command: Reset (0x03|0x0003) plen 0                    #1 [hci1] 1.290289
> HCI Event: Command Complete (0x0e) plen 4                  #2 [hci1] 1.290870
      Reset (0x03|0x0003) ncmd 1
        Status: Success (0x00)
< HCI Command: Read Local Supported... (0x04|0x0003) plen 0  #3 [hci1] 1.308704
> HCI Event: Command Complete (0x0e) plen 12                 #4 [hci1] 1.309312
      Read Local Supported Features (0x04|0x0003) ncmd 1
        Status: Success (0x00)
        Features: 0x00 0x00 0x00 0x00 0x60 0x00 0x00 0x00
          BR/EDR Not Supported
          LE Supported (Controller)
< HCI Command: Read Local Version In.. (0x04|0x0001) plen 0  #5 [hci1] 1.328383
> HCI Event: Command Complete (0x0e) plen 12                 #6 [hci1] 1.328926
      Read Local Version Information (0x04|0x0001) ncmd 1
        Status: Success (0x00)
        HCI version: Reserved (0x0f) - Revision 12393 (0x3069)
        LMP version: Reserved (0x0f) - Subversion 12393 (0x3069)
        Manufacturer: Nordic Semiconductor ASA (89)
< HCI Command: Read Local Supported... (0x04|0x0002) plen 0  #7 [hci1] 1.348263
> HCI Event: Command Complete (0x0e) plen 68                 #8 [hci1] 1.349330
      Read Local Supported Commands (0x04|0x0002) ncmd 1
        Status: Success (0x00)
        Commands: 119 entries
          Disconnect (Octet 0 - Bit 5)
          Read Remote Version Information (Octet 2 - Bit 7)
          Set Event Mask (Octet 5 - Bit 6)
          Reset (Octet 5 - Bit 7)
          Read Connection Accept Timeout (Octet 7 - Bit 2)
          Write Connection Accept Timeout (Octet 7 - Bit 3)
          Read Transmit Power Level (Octet 10 - Bit 2)
          Set Controller To Host Flow Control (Octet 10 - Bit 5)
          Host Buffer Size (Octet 10 - Bit 6)
          Host Number of Completed Packets (Octet 10 - Bit 7)
          Read Local Version Information (Octet 14 - Bit 3)
          Read Local Supported Features (Octet 14 - Bit 5)
          Read BD ADDR (Octet 15 - Bit 1)
          Read RSSI (Octet 15 - Bit 5)
          Set Event Mask Page 2 (Octet 22 - Bit 2)
          LE Set Event Mask (Octet 25 - Bit 0)
          LE Read Buffer Size (Octet 25 - Bit 1)
          LE Read Local Supported Features (Octet 25 - Bit 2)
          LE Set Random Address (Octet 25 - Bit 4)
          LE Set Advertising Parameters (Octet 25 - Bit 5)
          LE Read Advertising Channel TX Power (Octet 25 - Bit 6)
          LE Set Advertising Data (Octet 25 - Bit 7)
          LE Set Scan Response Data (Octet 26 - Bit 0)
          LE Set Advertise Enable (Octet 26 - Bit 1)
          LE Set Scan Parameters (Octet 26 - Bit 2)
          LE Set Scan Enable (Octet 26 - Bit 3)
          LE Create Connection (Octet 26 - Bit 4)
          LE Create Connection Cancel (Octet 26 - Bit 5)
          LE Read Accept List Size (Octet 26 - Bit 6)
          LE Clear Accept List (Octet 26 - Bit 7)
          LE Add Device To Accept List (Octet 27 - Bit 0)
          LE Remove Device From Accept List (Octet 27 - Bit 1)
          LE Connection Update (Octet 27 - Bit 2)
          LE Set Host Channel Classification (Octet 27 - Bit 3)
          LE Read Channel Map (Octet 27 - Bit 4)
          LE Read Remote Used Features (Octet 27 - Bit 5)
          LE Encrypt (Octet 27 - Bit 6)
          LE Rand (Octet 27 - Bit 7)
          LE Start Encryption (Octet 28 - Bit 0)
          LE Long Term Key Request Reply (Octet 28 - Bit 1)
          LE Long Term Key Request Neg Reply (Octet 28 - Bit 2)
          LE Read Supported States (Octet 28 - Bit 3)
          LE Receiver Test (Octet 28 - Bit 4)
          LE Transmitter Test (Octet 28 - Bit 5)
          LE Test End (Octet 28 - Bit 6)
          Read Authenticated Payload Timeout (Octet 32 - Bit 4)
          Write Authenticated Payload Timeout (Octet 32 - Bit 5)
          LE Set Data Length (Octet 33 - Bit 6)
          LE Read Suggested Default Data Length (Octet 33 - Bit 7)
          LE Write Suggested Default Data Length (Octet 34 - Bit 0)
          LE Add Device To Resolving List (Octet 34 - Bit 3)
          LE Remove Device From Resolving List (Octet 34 - Bit 4)
          LE Clear Resolving List (Octet 34 - Bit 5)
          LE Read Resolving List Size (Octet 34 - Bit 6)
          LE Set Address Resolution Enable (Octet 35 - Bit 1)
          LE Set Resolvable Private Address Timeout (Octet 35 - Bit 2)
          LE Read Maximum Data Length (Octet 35 - Bit 3)
          LE Read PHY (Octet 35 - Bit 4)
          LE Set Default PHY (Octet 35 - Bit 5)
          LE Set PHY (Octet 35 - Bit 6)
          LE Enhanced Receiver Test (Octet 35 - Bit 7)
          LE Enhanced Transmitter Test (Octet 36 - Bit 0)
          LE Set Advertising Set Random Address (Octet 36 - Bit 1)
          LE Set Extended Advertising Parameters (Octet 36 - Bit 2)
          LE Set Extended Advertising Data (Octet 36 - Bit 3)
          LE Set Extended Scan Response Data (Octet 36 - Bit 4)
          LE Set Extended Advertising Enable (Octet 36 - Bit 5)
          LE Read Maximum Advertising Data Length (Octet 36 - Bit 6)
          LE Read Number of Supported Advertising Sets (Octet 36 - Bit 7)
          LE Remove Advertising Set (Octet 37 - Bit 0)
          LE Clear Advertising Sets (Octet 37 - Bit 1)
          LE Set Periodic Advertising Parameters (Octet 37 - Bit 2)
          LE Set Periodic Advertising Data (Octet 37 - Bit 3)
          LE Set Periodic Advertising Enable (Octet 37 - Bit 4)
          LE Set Extended Scan Parameters (Octet 37 - Bit 5)
          LE Set Extended Scan Enable (Octet 37 - Bit 6)
          LE Extended Create Connection (Octet 37 - Bit 7)
          LE Periodic Advertising Create Sync (Octet 38 - Bit 0)
          LE Periodic Advertising Create Sync Cancel (Octet 38 - Bit 1)
          LE Periodic Advertising Terminate Sync (Octet 38 - Bit 2)
          LE Add Device To Periodic Advertiser List (Octet 38 - Bit 3)
          LE Remove Device From Periodic Advertiser List (Octet 38 - Bit 4)
          LE Clear Periodic Advertiser List (Octet 38 - Bit 5)
          LE Read Periodic Advertiser List Size (Octet 38 - Bit 6)
          LE Read Transmit Power (Octet 38 - Bit 7)
          LE Read RF Path Compensation (Octet 39 - Bit 0)
          LE Write RF Path Compensation (Octet 39 - Bit 1)
          LE Set Privacy Mode (Octet 39 - Bit 2)
          LE Periodic Advertising Receive Enable (Octet 40 - Bit 5)
          LE Periodic Advertising Sync Transfer (Octet 40 - Bit 6)
          LE Periodic Advertising Set Info Transfer (Octet 40 - Bit 7)
          LE Periodic Advertising Sync Transfer Parameters (Octet 41 - Bit 0)
          LE Set Default Periodic Advertisng Sync Transfer Parameters (Octet 41 - Bit 1)
          LE Read Buffer v2 (Octet 41 - Bit 5)
          LE Read ISO TX Sync (Octet 41 - Bit 6)
          LE Set Connected Isochronous Group Parameters (Octet 41 - Bit 7)
          LE Set Connected Isochronous Group Parameters Test (Octet 42 - Bit 0)
          LE Create Connected Isochronous Stream (Octet 42 - Bit 1)
          LE Remove Connected Isochronous Group (Octet 42 - Bit 2)
          LE Accept Connected Isochronous Stream Request (Octet 42 - Bit 3)
          LE Reject Connected Isochronous Stream Request (Octet 42 - Bit 4)
          LE Create Broadcast Isochronous Group (Octet 42 - Bit 5)
          LE Create Broadcast Isochronous Group Test (Octet 42 - Bit 6)
          LE Terminate Broadcast Isochronous Group (Octet 42 - Bit 7)
          LE Broadcast Isochronous Group Create Sync (Octet 43 - Bit 0)
          LE Broadcast Isochronous Group Terminate Sync (Octet 43 - Bit 1)
          LE Request Peer SCA (Octet 43 - Bit 2)
          LE Setup Isochronous Data Path (Octet 43 - Bit 3)
          LE Remove Isochronous Data Path (Octet 43 - Bit 4)
          LE Isochronous Transmit Test (Octet 43 - Bit 5)
          LE Isochronous Receive Test (Octet 43 - Bit 6)
          LE Isochronous Read Test Counters (Octet 43 - Bit 7)
          LE Isochronous Read Test Counters (Octet 44 - Bit 0)
          LE Set Host Feature (Octet 44 - Bit 1)
          Octet 44 - Bit 2 
          Octet 45 - Bit 6 
          Octet 46 - Bit 0 
          Octet 46 - Bit 1 
          Octet 46 - Bit 2 
< HCI Command: Host Buffer Size (0x03|0x0033) plen 7         #9 [hci1] 1.368225
        ACL MTU: 255  ACL max packet: 16
        SCO MTU: 0    SCO max packet: 0
> HCI Event: Command Complete (0x0e) plen 4                 #10 [hci1] 1.368819
      Host Buffer Size (0x03|0x0033) ncmd 1
        Status: Success (0x00)
< HCI Command: Set Controller To Ho.. (0x03|0x0031) plen 1  #11 [hci1] 1.388250
        Flow control: ACL Data Packets (0x01)
> HCI Event: Command Complete (0x0e) plen 4                 #12 [hci1] 1.388628
      Set Controller To Host Flow Control (0x03|0x0031) ncmd 1
        Status: Success (0x00)
< HCI Command: LE Read Local Suppor.. (0x08|0x0003) plen 0  #13 [hci1] 1.408249
> HCI Event: Command Complete (0x0e) plen 12                #14 [hci1] 1.408829
      LE Read Local Supported Features (0x08|0x0003) ncmd 1
        Status: Success (0x00)
        Features: 0xfd 0x79 0x00 0xf7 0x30 0x01 0x00 0x00
          LE Encryption
          Extended Reject Indication
          Peripheral-initiated Features Exchange
          LE Ping
          LE Data Packet Length Extension
          LL Privacy
          Extended Scanner Filter Policies
          LE 2M PHY
          LE Coded PHY
          LE Extended Advertising
          LE Periodic Advertising
          Channel Selection Algorithm #2
          Periodic Advertising Sync Transfer - Sender
          Periodic Advertising Sync Transfer - Recipient
          Sleep Clock Accuracy Updates
          Connected Isochronous Stream - Central
          Connected Isochronous Stream - Peripheral
          Isochronous Broadcaster
          Synchronized Receiver
          Periodic Advertising ADI support
          Connection Subrating
          Unknown features (0x0000010000000000)
< HCI Command: LE Set Host Feature (0x08|0x0074) plen 2     #15 [hci1] 1.428259
        Bit Number: 32
          Connected Isochronous Stream (Host Support)
        Bit Value: 1
> HCI Event: Command Complete (0x0e) plen 4                 #16 [hci1] 1.428630
      LE Set Host Feature (0x08|0x0074) ncmd 1
        Status: Success (0x00)
< HCI Command: LE Read Buffer v2 (0x08|0x0060) plen 0       #17 [hci1] 1.448268
> HCI Event: Command Complete (0x0e) plen 10                #18 [hci1] 1.448701
      LE Read Buffer v2 (0x08|0x0060) ncmd 1
        Status: Success (0x00)
        ACL MTU: 27
        ACL max packet: 3
        ISO MTU: 318
        ISO max packet: 3
< HCI Command: LE Read Maximum Adve.. (0x08|0x003a) plen 0  #19 [hci1] 1.468296
> HCI Event: Command Complete (0x0e) plen 6                 #20 [hci1] 1.468718
      LE Read Maximum Advertising Data Length (0x08|0x003a) ncmd 1
        Status: Success (0x00)
        Max length: 1650
< HCI Command: LE Read Supported St.. (0x08|0x001c) plen 0  #21 [hci1] 1.488257
> HCI Event: Command Complete (0x0e) plen 12                #22 [hci1] 1.488776
      LE Read Supported States (0x08|0x001c) ncmd 1
        Status: Success (0x00)
        States: 0x000003ff3e0306ff
          Non-connectable Advertising State
          Scannable Advertising State
          Connectable Advertising State
          High Duty Cycle Directed Advertising State
          Passive Scanning State
          Active Scanning State
          Initiating State
            and Connection State (Central Role)
          Connection State (Peripheral Role)
          Scannable Advertising State
            and Passive Scanning State
          Connectable Advertising State
            and Passive Scanning State
          Non-connectable Advertising State
            and Initiating State
          Scannable Advertising State
            and Initiating State
          Active Scanning State
            and Connection State (Central Role)
          Passive Scanning State
            and Connection State (Peripheral Role)
          Active Scanning State
            and Connection State (Peripheral Role)
          Initiating State
            and Connection State (Central Role)
            and Central Role & Central Role
          Low Duty Cycle Directed Advertising State
          Connectable Advertising State
            and Initiating State
            and Central Role & Peripheral Role
          High Duty Cycle Directed Advertising State
            and Initiating State
            and Central Role & Peripheral Role
          Low Duty Cycle Directed Advertising State
            and Initiating State
            and Central Role & Peripheral Role
          Connectable Advertising State
            and Connection State (Central Role)
            and Central Role & Peripheral Role
          High Duty Cycle Directed Advertising State
            and Connection State (Central Role)
            and Central Role & Peripheral Role
          Low Duty Cycle Directed Advertising State
            and Connection State (Central Role)
            and Central Role & Peripheral Role
          Connectable Advertising State
            and Connection State (Peripheral Role)
            and Central Role & Peripheral Role
          High Duty Cycle Directed Advertising State
            and Connection State (Peripheral Role)
            and Peripheral Role & Peripheral Role
          Low Duty Cycle Directed Advertising State
            and Connection State (Peripheral Role)
            and Peripheral Role & Peripheral Role
          Initiating State
            and Connection State (Peripheral Role)
            and Central Role & Peripheral Role
< HCI Command: LE Read Maximum Data.. (0x08|0x002f) plen 0  #23 [hci1] 1.508229
> HCI Event: Command Complete (0x0e) plen 12                #24 [hci1] 1.508766
      LE Read Maximum Data Length (0x08|0x002f) ncmd 1
        Status: Success (0x00)
        Max TX octets: 251
        Max TX time: 2704
        Max RX octets: 251
        Max RX time: 2704
< HCI Command: LE Write Suggested D.. (0x08|0x0024) plen 4  #25 [hci1] 1.528240
        TX octets: 251
        TX time: 2704
> HCI Event: Command Complete (0x0e) plen 4                 #26 [hci1] 1.528653
      LE Write Suggested Default Data Length (0x08|0x0024) ncmd 1
        Status: Success (0x00)
< HCI Command: LE Read Resolving Li.. (0x08|0x002a) plen 0  #27 [hci1] 1.548256
> HCI Event: Command Complete (0x0e) plen 5                 #28 [hci1] 1.548693
      LE Read Resolving List Size (0x08|0x002a) ncmd 1
        Status: Success (0x00)
        Size: 8
< HCI Command: LE Set Event Mask (0x08|0x0001) plen 8       #29 [hci1] 1.568212
        Mask: 0x000002023f87fa5e
          LE Advertising Report
          LE Connection Update Complete
          LE Read Remote Used Features Complete
          LE Long Term Key Request
          LE Data Length Change
          LE Enhanced Connection Complete
          LE PHY Update Complete
          LE Extended Advertising Report
          LE Periodic Advertising Sync Established
          LE Periodic Advertising Report
          LE Periodic Advertising Sync Lost
          LE Extended Scan Timeout
          LE Extended Advertising Set Terminated
          LE Scan Request Received
          LE Periodic Advertising Sync Transfer Rvc
          LE CIS Established
          LE CIS Request
          LE Create BIG Complete
          LE Terminate BIG Complete
          LE BIG Sync Estabilished Complete
          LE BIG Sync Lost
          LE BIG Info Advertising Report
          Unknown mask (0x0000020000000000)
> HCI Event: Command Complete (0x0e) plen 4                 #30 [hci1] 1.568662
      LE Set Event Mask (0x08|0x0001) ncmd 1
        Status: Success (0x00)
< HCI Command: Set Event Mask (0x03|0x0001) plen 8          #31 [hci1] 1.588230
        Mask: 0x2000800002008890
          Disconnection Complete
          Encryption Change
          Read Remote Version Information Complete
          Hardware Error
          Data Buffer Overflow
          Encryption Key Refresh Complete
          LE Meta
> HCI Event: Command Complete (0x0e) plen 4                 #32 [hci1] 1.588701
      Set Event Mask (0x03|0x0001) ncmd 1
        Status: Success (0x00)
< HCI Command: Read BD ADDR (0x04|0x0009) plen 0            #33 [hci1] 1.608230
> HCI Event: Command Complete (0x0e) plen 10                #34 [hci1] 1.608644
      Read BD ADDR (0x04|0x0009) ncmd 1
        Status: Success (0x00)
        Address: 00:00:00:00:00:00 (OUI 00-00-00)
< HCI Command: LE Set Random Address (0x08|0x0005) plen 6   #35 [hci1] 1.628237
        Address: D5:B6:CC:31:DB:3B (Static)
> HCI Event: Command Complete (0x0e) plen 4                 #36 [hci1] 1.628794
      LE Set Random Address (0x08|0x0005) ncmd 1
        Status: Success (0x00)
< HCI Command: LE Set Extended Adv.. (0x08|0x0036) plen 25  #37 [hci1] 4.208879
        Handle: 0x00
        Properties: 0x0013
          Connectable
          Scannable
          Use legacy advertising PDUs: ADV_IND
        Min advertising interval: 100.000 msec (0x00a0)
        Max advertising interval: 150.000 msec (0x00f0)
        Channel map: 37, 38, 39 (0x07)
        Own address type: Random (0x01)
        Peer address type: Public (0x00)
        Peer address: 00:00:00:00:00:00 (OUI 00-00-00)
        Filter policy: Allow Scan Request from Any, Allow Connect Request from Any (0x00)
        TX power: Host has no preference (0x7f)
        Primary PHY: LE 1M (0x01)
        Secondary max skip: 0x00
        Secondary PHY: LE 1M (0x01)
        SID: 0x00
        Scan request notifications: Disabled (0x00)
> HCI Event: Command Complete (0x0e) plen 5                 #38 [hci1] 4.209680
      LE Set Extended Advertising Parameters (0x08|0x0036) ncmd 1
        Status: Success (0x00)
        TX power (selected): 0 dbm (0x00)
< HCI Command: LE Set Advertising S.. (0x08|0x0035) plen 7  #39 [hci1] 4.228402
        Advertising handle: 0x00
        Advertising random address: D5:B6:CC:31:DB:3B (Static)
> HCI Event: Command Complete (0x0e) plen 4                 #40 [hci1] 4.228939
      LE Set Advertising Set Random Address (0x08|0x0035) ncmd 1
        Status: Success (0x00)
< HCI Command: LE Set Extended Adv.. (0x08|0x0037) plen 22  #41 [hci1] 4.248300
        Handle: 0x00
        Operation: Complete extended advertising data (0x03)
        Fragment preference: Minimize fragmentation (0x01)
        Data length: 0x12
        Flags: 0x06
          LE General Discoverable Mode
          BR/EDR Not Supported
        Name (complete): Tester_F6B11A
> HCI Event: Command Complete (0x0e) plen 4                 #42 [hci1] 4.249064
      LE Set Extended Advertising Data (0x08|0x0037) ncmd 1
        Status: Success (0x00)
< HCI Command: LE Set Extended Scan.. (0x08|0x0038) plen 4  #43 [hci1] 4.268241
        Handle: 0x00
        Operation: Complete scan response data (0x03)
        Fragment preference: Minimize fragmentation (0x01)
        Data length: 0x00
> HCI Event: Command Complete (0x0e) plen 4                 #44 [hci1] 4.268635
      LE Set Extended Scan Response Data (0x08|0x0038) ncmd 1
        Status: Success (0x00)
< HCI Command: LE Set Extended Adve.. (0x08|0x0039) plen 6  #45 [hci1] 4.288293
        Extended advertising: Enabled (0x01)
        Number of sets: 1 (0x01)
        Entry 0
          Handle: 0x00
          Duration: 0 ms (0x00)
          Max ext adv events: 0
> HCI Event: Command Complete (0x0e) plen 4                 #46 [hci1] 4.288873
      LE Set Extended Advertising Enable (0x08|0x0039) ncmd 1
        Status: Success (0x00)
> HCI Event: LE Meta Event (0x3e) plen 31                   #47 [hci1] 4.405121
      LE Enhanced Connection Complete (0x0a)
        Status: Success (0x00)
        Handle: 129
        Role: Peripheral (0x01)
        Peer address type: Public (0x00)
        Peer address: DF:A9:FF:F6:B1:1A (OUI DF-A9-FF)
        Local resolvable private address: 00:00:00:00:00:00 (Non-Resolvable)
        Peer resolvable private address: 00:00:00:00:00:00 (Non-Resolvable)
        Connection interval: 87.50 msec (0x0046)
        Connection latency: 0 (0x0000)
        Supervision timeout: 25120 msec (0x09d0)
        Central clock accuracy: 0x01
> HCI Event: LE Meta Event (0x3e) plen 6                    #48 [hci1] 4.405174
      LE Advertising Set Terminated (0x12)
        Status: Success (0x00)
        Handle: 0
        Connection handle: 129
        Number of completed extended advertising events: 0
< HCI Command: LE Read Remote Used... (0x08|0x0016) plen 2  #49 [hci1] 4.409460
        Handle: 129 Address: DF:A9:FF:F6:B1:1A (OUI DF-A9-FF)
< ACL Data TX: Handle 129 flags 0x00 dlen 7                 #50 [hci1] 4.409486
      ATT: Exchange MTU Request (0x02) len 2
        Client RX MTU: 251
> HCI Event: Command Status (0x0f) plen 4                   #51 [hci1] 4.410035
      LE Read Remote Used Features (0x08|0x0016) ncmd 1
        Status: Success (0x00)
> HCI Event: Number of Completed Packets (0x13) plen 5      #52 [hci1] 4.581035
        Num handles: 1
        Handle: 129 Address: DF:A9:FF:F6:B1:1A (OUI DF-A9-FF)
        Count: 1
        #50: len 7 (0 Kb/s)
        Latency: 171 msec (171-171 msec ~171 msec)
> HCI Event: LE Meta Event (0x3e) plen 12                   #53 [hci1] 4.668908
      LE Read Remote Used Features (0x04)
        Status: Success (0x00)
        Handle: 129 Address: DF:A9:FF:F6:B1:1A (OUI DF-A9-FF)
        Features: 0x2d 0x49 0x00 0xf7 0x67 0xd8 0x00 0x00
          LE Encryption
          Extended Reject Indication
          Peripheral-initiated Features Exchange
          LE Data Packet Length Extension
          LE 2M PHY
          LE Coded PHY
          Channel Selection Algorithm #2
          Periodic Advertising Sync Transfer - Sender
          Periodic Advertising Sync Transfer - Recipient
          Sleep Clock Accuracy Updates
          Connected Isochronous Stream - Central
          Connected Isochronous Stream - Peripheral
          Isochronous Broadcaster
          Synchronized Receiver
          Connected Isochronous Stream (Host Support)
          LE Power Control Request
          LE Power Control Request
          Connection Subrating
          Connection Subrating (Host Support)
          Unknown features (0x0000d80000000000)
> ACL Data RX: Handle 129 flags 0x02 dlen 11                #54 [hci1] 7.118564
      SMP: Pairing Request (0x01) len 6
        IO capability: KeyboardDisplay (0x04)
        OOB data: Authentication data not present (0x00)
        Authentication requirement: Bonding, MITM, SC, No Keypresses (0x0d)
        Max encryption key size: 16
        Initiator key distribution: EncKey IdKey (0x03)
        Responder key distribution: EncKey IdKey Sign (0x07)
> ACL Data RX: Handle 129 flags 0x02 dlen 7                 #55 [hci1] 7.119043
      ATT: Exchange MTU Response (0x03) len 2
        Server RX MTU: 23
< HCI Command: Host Number of Compl.. (0x03|0x0035) plen 5  #56 [hci1] 7.128866
        Num handles: 1
        Handle: 129 Address: DF:A9:FF:F6:B1:1A (OUI DF-A9-FF)
        Count: 1
< ACL Data TX: Handle 129 flags 0x00 dlen 11                #57 [hci1] 7.129134
      SMP: Pairing Response (0x02) len 6
        IO capability: DisplayOnly (0x00)
        OOB data: Authentication data not present (0x00)
        Authentication requirement: Bonding, No MITM, SC, No Keypresses (0x09)
        Max encryption key size: 16
        Initiator key distribution: IdKey (0x02)
        Responder key distribution: <none> (0x00)
< HCI Command: Host Number of Compl.. (0x03|0x0035) plen 5  #58 [hci1] 7.129257
        Num handles: 1
        Handle: 129 Address: DF:A9:FF:F6:B1:1A (OUI DF-A9-FF)
        Count: 1
> HCI Event: Number of Completed Packets (0x13) plen 5      #59 [hci1] 7.293726
        Num handles: 1
        Handle: 129 Address: DF:A9:FF:F6:B1:1A (OUI DF-A9-FF)
        Count: 1
        #57: len 11 (0 Kb/s)
        Latency: 164 msec (164-171 msec ~168 msec)
> ACL Data RX: Handle 129 flags 0x02 dlen 27                #60 [hci1] 7.294114
> ACL Data RX: Handle 129 flags 0x01 dlen 27                #61 [hci1] 7.294538
> ACL Data RX: Handle 129 flags 0x01 dlen 15                #62 [hci1] 7.294951
      SMP: Pairing Public Key (0x0c) len 64
        X: 27421aefd3abb71977b478d9243005805ea71f02cd8489fef727b7a4dc682407
        Y: 42357d2f27bcdf49ebfd8790860fe409a559c98cce0aadc12f72618de6de8a39
< HCI Command: Host Number of Compl.. (0x03|0x0035) plen 5  #63 [hci1] 7.309338
        Num handles: 1
        Handle: 129 Address: DF:A9:FF:F6:B1:1A (OUI DF-A9-FF)
        Count: 1
< HCI Command: Host Number of Compl.. (0x03|0x0035) plen 5  #64 [hci1] 7.309564
        Num handles: 1
        Handle: 129 Address: DF:A9:FF:F6:B1:1A (OUI DF-A9-FF)
        Count: 1
< HCI Command: Host Number of Compl.. (0x03|0x0035) plen 5  #65 [hci1] 7.309929
        Num handles: 1
        Handle: 129 Address: DF:A9:FF:F6:B1:1A (OUI DF-A9-FF)
        Count: 1
< ACL Data TX: Handle 129 flags 0x00 dlen 27                #66 [hci1] 7.310137
< ACL Data TX: Handle 129 flags 0x01 dlen 27                #67 [hci1] 7.310148
< ACL Data TX: Handle 129 flags 0x01 dlen 15                #68 [hci1] 7.310231
      SMP: Pairing Public Key (0x0c) len 64
        X: 98308440221e2d910f0e54b71e7ec652857aa9b5a0dc65028824cc19db1226e9
        Y: 67a4816bcb62efb21701e31fdb27561a6217575fb007a8bbdabe7e28b6f68482
> HCI Event: Number of Completed Packets (0x13) plen 5      #69 [hci1] 7.381718
        Num handles: 1
        Handle: 129 Address: DF:A9:FF:F6:B1:1A (OUI DF-A9-FF)
        Count: 1
        #66: len 27 (3 Kb/s)
        Latency: 71 msec (71-171 msec ~119 msec)
> HCI Event: Number of Completed Packets (0x13) plen 5      #70 [hci1] 7.382268
        Num handles: 1
        Handle: 129 Address: DF:A9:FF:F6:B1:1A (OUI DF-A9-FF)
        Count: 1
        #67: len 27 (3 Kb/s)
        Latency: 72 msec (71-171 msec ~95 msec)
> HCI Event: Number of Completed Packets (0x13) plen 5      #71 [hci1] 7.468356
        Num handles: 1
        Handle: 129 Address: DF:A9:FF:F6:B1:1A (OUI DF-A9-FF)
        Count: 1
        #68: len 15 (0 Kb/s)
        Latency: 158 msec (71-171 msec ~127 msec)
> ACL Data RX: Handle 129 flags 0x02 dlen 21                #72 [hci1] 8.431224
      SMP: Pairing Confirm (0x03) len 16
        Confim value: d38df5073d86fcaf5f608b0f58badbd0
< HCI Command: Host Number of Compl.. (0x03|0x0035) plen 5  #73 [hci1] 8.449204
        Num handles: 1
        Handle: 129 Address: DF:A9:FF:F6:B1:1A (OUI DF-A9-FF)
        Count: 1
< ACL Data TX: Handle 129 flags 0x00 dlen 21                #74 [hci1] 8.449446
      SMP: Pairing Confirm (0x03) len 16
        Confim value: d9e8a4b49370e74e0f5d18351c04bfed
> HCI Event: Number of Completed Packets (0x13) plen 5      #75 [hci1] 8.606112
        Num handles: 1
        Handle: 129 Address: DF:A9:FF:F6:B1:1A (OUI DF-A9-FF)
        Count: 1
        #74: len 21 (1 Kb/s)
        Latency: 156 msec (71-171 msec ~141 msec)
> ACL Data RX: Handle 129 flags 0x02 dlen 21                #76 [hci1] 8.606432
      SMP: Pairing Random (0x04) len 16
        Random value: c7c80760ca1df5630000000000000000
< HCI Command: Host Number of Compl.. (0x03|0x0035) plen 5  #77 [hci1] 8.609211
        Num handles: 1
        Handle: 129 Address: DF:A9:FF:F6:B1:1A (OUI DF-A9-FF)
        Count: 1
< ACL Data TX: Handle 129 flags 0x00 dlen 21                #78 [hci1] 8.609297
      SMP: Pairing Random (0x04) len 16
        Random value: 8e6108f966a694cbe26df70bb96773e6
> HCI Event: Number of Completed Packets (0x13) plen 5      #79 [hci1] 8.780869
        Num handles: 1
        Handle: 129 Address: DF:A9:FF:F6:B1:1A (OUI DF-A9-FF)
        Count: 1
        #78: len 21 (0 Kb/s)
        Latency: 171 msec (71-171 msec ~156 msec)
> ACL Data RX: Handle 129 flags 0x02 dlen 21                #80 [hci1] 8.868735
      SMP: Pairing Confirm (0x03) len 16
        Confim value: 412359dca5722c3d957a8196a5f6a0ba
< HCI Command: Host Number of Compl.. (0x03|0x0035) plen 5  #81 [hci1] 8.888956
        Num handles: 1
        Handle: 129 Address: DF:A9:FF:F6:B1:1A (OUI DF-A9-FF)
        Count: 1
< ACL Data TX: Handle 129 flags 0x00 dlen 21                #82 [hci1] 8.889177
      SMP: Pairing Confirm (0x03) len 16
        Confim value: 3d4e9ff59c300e6d82d2670a2b9038fc
> HCI Event: Number of Completed Packets (0x13) plen 5      #83 [hci1] 9.043654
        Num handles: 1
        Handle: 129 Address: DF:A9:FF:F6:B1:1A (OUI DF-A9-FF)
        Count: 1
        #82: len 21 (1 Kb/s)
        Latency: 154 msec (71-171 msec ~155 msec)
> ACL Data RX: Handle 129 flags 0x02 dlen 21                #84 [hci1] 9.043985
      SMP: Pairing Random (0x04) len 16
        Random value: 07af8878e8515b870000000000000000
< HCI Command: Host Number of Compl.. (0x03|0x0035) plen 5  #85 [hci1] 9.049222
        Num handles: 1
        Handle: 129 Address: DF:A9:FF:F6:B1:1A (OUI DF-A9-FF)
        Count: 1
< ACL Data TX: Handle 129 flags 0x00 dlen 21                #86 [hci1] 9.049307
      SMP: Pairing Random (0x04) len 16
        Random value: 4d02679f89a05211af56d8b3da64d21e
> HCI Event: Number of Completed Packets (0x13) plen 5      #87 [hci1] 9.218407
        Num handles: 1
        Handle: 129 Address: DF:A9:FF:F6:B1:1A (OUI DF-A9-FF)
        Count: 1
        #86: len 21 (0 Kb/s)
        Latency: 169 msec (71-171 msec ~162 msec)
> ACL Data RX: Handle 129 flags 0x02 dlen 21                #88 [hci1] 9.306152
      SMP: Pairing Confirm (0x03) len 16
        Confim value: 2ab77edbbadbe90ec500a75960c732a0
< HCI Command: Host Number of Compl.. (0x03|0x0035) plen 5  #89 [hci1] 9.308581
        Num handles: 1
        Handle: 129 Address: DF:A9:FF:F6:B1:1A (OUI DF-A9-FF)
        Count: 1
< ACL Data TX: Handle 129 flags 0x00 dlen 21                #90 [hci1] 9.308735
      SMP: Pairing Confirm (0x03) len 16
        Confim value: 1ac0f6ef384a7aecb7a69a17596fc0a9
> HCI Event: Number of Completed Packets (0x13) plen 5      #91 [hci1] 9.481071
        Num handles: 1
        Handle: 129 Address: DF:A9:FF:F6:B1:1A (OUI DF-A9-FF)
        Count: 1
        #90: len 21 (0 Kb/s)
        Latency: 172 msec (71-172 msec ~167 msec)
> ACL Data RX: Handle 129 flags 0x02 dlen 21                #92 [hci1] 9.481371
      SMP: Pairing Random (0x04) len 16
        Random value: 9199baa68612bfb10000000000000000
< HCI Command: Host Number of Compl.. (0x03|0x0035) plen 5  #93 [hci1] 9.489229
        Num handles: 1
        Handle: 129 Address: DF:A9:FF:F6:B1:1A (OUI DF-A9-FF)
        Count: 1
< ACL Data TX: Handle 129 flags 0x00 dlen 21                #94 [hci1] 9.489320
      SMP: Pairing Random (0x04) len 16
        Random value: 5e8286bc235a02440d0c3424a2acf8fd
> HCI Event: Number of Completed Packets (0x13) plen 5      #95 [hci1] 9.655883
        Num handles: 1
        Handle: 129 Address: DF:A9:FF:F6:B1:1A (OUI DF-A9-FF)
        Count: 1
        #94: len 21 (1 Kb/s)
        Latency: 166 msec (71-172 msec ~166 msec)
> ACL Data RX: Handle 129 flags 0x02 dlen 21                #96 [hci1] 9.743750
      SMP: Pairing Confirm (0x03) len 16
        Confim value: ef775182e1bf710fe34bd23b2dac5219
< HCI Command: Host Number of Compl.. (0x03|0x0035) plen 5  #97 [hci1] 9.748611
        Num handles: 1
        Handle: 129 Address: DF:A9:FF:F6:B1:1A (OUI DF-A9-FF)
        Count: 1
< ACL Data TX: Handle 129 flags 0x00 dlen 21                #98 [hci1] 9.748767
      SMP: Pairing Confirm (0x03) len 16
        Confim value: aff970be981d972f216e0c0f88103635
> HCI Event: Number of Completed Packets (0x13) plen 5      #99 [hci1] 9.918585
        Num handles: 1
        Handle: 129 Address: DF:A9:FF:F6:B1:1A (OUI DF-A9-FF)
        Count: 1
        #98: len 21 (0 Kb/s)
        Latency: 169 msec (71-172 msec ~168 msec)
> ACL Data RX: Handle 129 flags 0x02 dlen 21               #100 [hci1] 9.918908
      SMP: Pairing Random (0x04) len 16
        Random value: 4d359a3b715eaa490000000000000000
< HCI Command: Host Number of Comp.. (0x03|0x0035) plen 5  #101 [hci1] 9.929285
        Num handles: 1
        Handle: 129 Address: DF:A9:FF:F6:B1:1A (OUI DF-A9-FF)
        Count: 1
< ACL Data TX: Handle 129 flags 0x00 dlen 21               #102 [hci1] 9.929443
      SMP: Pairing Random (0x04) len 16
        Random value: 5c4a1bcadd27bd58e945097b00bad7ac
> HCI Event: Number of Completed Packets (0x13) plen 5    #103 [hci1] 10.093330
        Num handles: 1
        Handle: 129 Address: DF:A9:FF:F6:B1:1A (OUI DF-A9-FF)
        Count: 1
        #102: len 21 (1 Kb/s)
        Latency: 163 msec (71-172 msec ~166 msec)
> ACL Data RX: Handle 129 flags 0x02 dlen 21              #104 [hci1] 10.181243
      SMP: Pairing Confirm (0x03) len 16
        Confim value: 2d0ce52575ae4714c0d222bb743631c1
< HCI Command: Host Number of Com.. (0x03|0x0035) plen 5  #105 [hci1] 10.188938
        Num handles: 1
        Handle: 129 Address: DF:A9:FF:F6:B1:1A (OUI DF-A9-FF)
        Count: 1
< ACL Data TX: Handle 129 flags 0x00 dlen 21              #106 [hci1] 10.189170
      SMP: Pairing Confirm (0x03) len 16
        Confim value: b1a0a3e6666919bc520b28dd5335552d
> HCI Event: Number of Completed Packets (0x13) plen 5    #107 [hci1] 10.355994
        Num handles: 1
        Handle: 129 Address: DF:A9:FF:F6:B1:1A (OUI DF-A9-FF)
        Count: 1
        #106: len 21 (1 Kb/s)
        Latency: 166 msec (71-172 msec ~166 msec)
> ACL Data RX: Handle 129 flags 0x02 dlen 21              #108 [hci1] 10.356354
      SMP: Pairing Random (0x04) len 16
        Random value: e02df0e386eb6bc50000000000000000
< HCI Command: Host Number of Com.. (0x03|0x0035) plen 5  #109 [hci1] 10.368678
        Num handles: 1
        Handle: 129 Address: DF:A9:FF:F6:B1:1A (OUI DF-A9-FF)
        Count: 1
< ACL Data TX: Handle 129 flags 0x00 dlen 21              #110 [hci1] 10.368756
      SMP: Pairing Random (0x04) len 16
        Random value: 32527e6e64e79f33b2e374394db8ab2d
> HCI Event: Number of Completed Packets (0x13) plen 5    #111 [hci1] 10.530832
        Num handles: 1
        Handle: 129 Address: DF:A9:FF:F6:B1:1A (OUI DF-A9-FF)
        Count: 1
        #110: len 21 (1 Kb/s)
        Latency: 162 msec (71-172 msec ~164 msec)
> ACL Data RX: Handle 129 flags 0x02 dlen 21              #112 [hci1] 10.618758
      SMP: Pairing Confirm (0x03) len 16
        Confim value: e019bdc88e7afff561a46c29da3c71a2
< HCI Command: Host Number of Com.. (0x03|0x0035) plen 5  #113 [hci1] 10.628999
        Num handles: 1
        Handle: 129 Address: DF:A9:FF:F6:B1:1A (OUI DF-A9-FF)
        Count: 1
< ACL Data TX: Handle 129 flags 0x00 dlen 21              #114 [hci1] 10.629242
      SMP: Pairing Confirm (0x03) len 16
        Confim value: 63fa3eae0e3c7ef18beeb9d343e260bc
> HCI Event: Number of Completed Packets (0x13) plen 5    #115 [hci1] 10.793600
        Num handles: 1
        Handle: 129 Address: DF:A9:FF:F6:B1:1A (OUI DF-A9-FF)
        Count: 1
        #114: len 21 (1 Kb/s)
        Latency: 164 msec (71-172 msec ~164 msec)
> ACL Data RX: Handle 129 flags 0x02 dlen 21              #116 [hci1] 10.793885
      SMP: Pairing Random (0x04) len 16
        Random value: f47cc7721df620b70000000000000000
< HCI Command: Host Number of Com.. (0x03|0x0035) plen 5  #117 [hci1] 10.809221
        Num handles: 1
        Handle: 129 Address: DF:A9:FF:F6:B1:1A (OUI DF-A9-FF)
        Count: 1
< ACL Data TX: Handle 129 flags 0x00 dlen 21              #118 [hci1] 10.809324
      SMP: Pairing Random (0x04) len 16
        Random value: dddbdfe2838e9a8cc6964353c850fef7
> HCI Event: Number of Completed Packets (0x13) plen 5    #119 [hci1] 10.968244
        Num handles: 1
        Handle: 129 Address: DF:A9:FF:F6:B1:1A (OUI DF-A9-FF)
        Count: 1
        #118: len 21 (1 Kb/s)
        Latency: 158 msec (71-172 msec ~161 msec)
> ACL Data RX: Handle 129 flags 0x02 dlen 21              #120 [hci1] 11.056298
      SMP: Pairing Confirm (0x03) len 16
        Confim value: 54e6e2b4baf0da4a22475402255cee71
< HCI Command: Host Number of Com.. (0x03|0x0035) plen 5  #121 [hci1] 11.068986
        Num handles: 1
        Handle: 129 Address: DF:A9:FF:F6:B1:1A (OUI DF-A9-FF)
        Count: 1
< ACL Data TX: Handle 129 flags 0x00 dlen 21              #122 [hci1] 11.069214
      SMP: Pairing Confirm (0x03) len 16
        Confim value: d4d799451ab06ecd85d14836ffa9d173
> HCI Event: Number of Completed Packets (0x13) plen 5    #123 [hci1] 11.230978
        Num handles: 1
        Handle: 129 Address: DF:A9:FF:F6:B1:1A (OUI DF-A9-FF)
        Count: 1
        #122: len 21 (1 Kb/s)
        Latency: 161 msec (71-172 msec ~161 msec)
> ACL Data RX: Handle 129 flags 0x02 dlen 21              #124 [hci1] 11.231350
      SMP: Pairing Random (0x04) len 16
        Random value: 16cd4afe549aac030000000000000000
< HCI Command: Host Number of Com.. (0x03|0x0035) plen 5  #125 [hci1] 11.249003
        Num handles: 1
        Handle: 129 Address: DF:A9:FF:F6:B1:1A (OUI DF-A9-FF)
        Count: 1
< ACL Data TX: Handle 129 flags 0x00 dlen 21              #126 [hci1] 11.249084
      SMP: Pairing Random (0x04) len 16
        Random value: eb9f1915536596b6fc3db1c86b2b1970
> HCI Event: Number of Completed Packets (0x13) plen 5    #127 [hci1] 11.405794
        Num handles: 1
        Handle: 129 Address: DF:A9:FF:F6:B1:1A (OUI DF-A9-FF)
        Count: 1
        #126: len 21 (1 Kb/s)
        Latency: 156 msec (71-172 msec ~159 msec)
> ACL Data RX: Handle 129 flags 0x02 dlen 21              #128 [hci1] 11.493730
      SMP: Pairing Confirm (0x03) len 16
        Confim value: faf061b53e4c74cdf532378b955944d9
< HCI Command: Host Number of Com.. (0x03|0x0035) plen 5  #129 [hci1] 11.509217
        Num handles: 1
        Handle: 129 Address: DF:A9:FF:F6:B1:1A (OUI DF-A9-FF)
        Count: 1
< ACL Data TX: Handle 129 flags 0x00 dlen 21              #130 [hci1] 11.509507
      SMP: Pairing Confirm (0x03) len 16
        Confim value: 362004fa2582ed10449e38ab0d976c17
> HCI Event: Number of Completed Packets (0x13) plen 5    #131 [hci1] 11.668413
        Num handles: 1
        Handle: 129 Address: DF:A9:FF:F6:B1:1A (OUI DF-A9-FF)
        Count: 1
        #130: len 21 (1 Kb/s)
        Latency: 158 msec (71-172 msec ~159 msec)
> ACL Data RX: Handle 129 flags 0x02 dlen 21              #132 [hci1] 11.668869
      SMP: Pairing Random (0x04) len 16
        Random value: b72ce266f2fe86370000000000000000
< HCI Command: Host Number of Com.. (0x03|0x0035) plen 5  #133 [hci1] 11.689279
        Num handles: 1
        Handle: 129 Address: DF:A9:FF:F6:B1:1A (OUI DF-A9-FF)
        Count: 1
< ACL Data TX: Handle 129 flags 0x00 dlen 21              #134 [hci1] 11.689446
      SMP: Pairing Random (0x04) len 16
        Random value: 5c794dc9ad9f2c3f295ebd5ad5e1c3cf
> HCI Event: Number of Completed Packets (0x13) plen 5    #135 [hci1] 11.843311
        Num handles: 1
        Handle: 129 Address: DF:A9:FF:F6:B1:1A (OUI DF-A9-FF)
        Count: 1
        #134: len 21 (1 Kb/s)
        Latency: 153 msec (71-172 msec ~156 msec)
> ACL Data RX: Handle 129 flags 0x02 dlen 21              #136 [hci1] 11.931084
      SMP: Pairing Confirm (0x03) len 16
        Confim value: 55e6cd1db595bdda1dbcdc9955c7396a
< HCI Command: Host Number of Com.. (0x03|0x0035) plen 5  #137 [hci1] 11.948974
        Num handles: 1
        Handle: 129 Address: DF:A9:FF:F6:B1:1A (OUI DF-A9-FF)
        Count: 1
< ACL Data TX: Handle 129 flags 0x00 dlen 21              #138 [hci1] 11.949210
      SMP: Pairing Confirm (0x03) len 16
        Confim value: 0ec5a60bf335a41f3e70e93819febed5
> HCI Event: Number of Completed Packets (0x13) plen 5    #139 [hci1] 12.105955
        Num handles: 1
        Handle: 129 Address: DF:A9:FF:F6:B1:1A (OUI DF-A9-FF)
        Count: 1
        #138: len 21 (1 Kb/s)
        Latency: 156 msec (71-172 msec ~156 msec)
> ACL Data RX: Handle 129 flags 0x02 dlen 21              #140 [hci1] 12.106299
      SMP: Pairing Random (0x04) len 16
        Random value: 0a73814bbc84b93f0000000000000000
< HCI Command: Host Number of Com.. (0x03|0x0035) plen 5  #141 [hci1] 12.108436
        Num handles: 1
        Handle: 129 Address: DF:A9:FF:F6:B1:1A (OUI DF-A9-FF)
        Count: 1
< ACL Data TX: Handle 129 flags 0x00 dlen 21              #142 [hci1] 12.108444
      SMP: Pairing Random (0x04) len 16
        Random value: 5c2fff312cdf99c9491988e877355a9a
> HCI Event: Number of Completed Packets (0x13) plen 5    #143 [hci1] 12.281279
        Num handles: 1
        Handle: 129 Address: DF:A9:FF:F6:B1:1A (OUI DF-A9-FF)
        Count: 1
        #142: len 21 (0 Kb/s)
        Latency: 172 msec (71-172 msec ~164 msec)
> ACL Data RX: Handle 129 flags 0x02 dlen 21              #144 [hci1] 12.368572
      SMP: Pairing Confirm (0x03) len 16
        Confim value: 5a61ecbd8f8f0f9e2fad892847fd481f
< HCI Command: Host Number of Com.. (0x03|0x0035) plen 5  #145 [hci1] 12.388332
        Num handles: 1
        Handle: 129 Address: DF:A9:FF:F6:B1:1A (OUI DF-A9-FF)
        Count: 1
< ACL Data TX: Handle 129 flags 0x00 dlen 21              #146 [hci1] 12.388375
      SMP: Pairing Confirm (0x03) len 16
        Confim value: c977c5195e80c759cb083e7ef2f0385a
> HCI Event: Number of Completed Packets (0x13) plen 5    #147 [hci1] 12.543406
        Num handles: 1
        Handle: 129 Address: DF:A9:FF:F6:B1:1A (OUI DF-A9-FF)
        Count: 1
        #146: len 21 (1 Kb/s)
        Latency: 155 msec (71-172 msec ~159 msec)
> ACL Data RX: Handle 129 flags 0x02 dlen 21              #148 [hci1] 12.543791
      SMP: Pairing Random (0x04) len 16
        Random value: 64b210ecb92aa5a10000000000000000
< HCI Command: Host Number of Com.. (0x03|0x0035) plen 5  #149 [hci1] 12.548824
        Num handles: 1
        Handle: 129 Address: DF:A9:FF:F6:B1:1A (OUI DF-A9-FF)
        Count: 1
< ACL Data TX: Handle 129 flags 0x00 dlen 21              #150 [hci1] 12.548975
      SMP: Pairing Random (0x04) len 16
        Random value: c629a3a987d808e808655d558dfc1155
> HCI Event: Number of Completed Packets (0x13) plen 5    #151 [hci1] 12.718187
        Num handles: 1
        Handle: 129 Address: DF:A9:FF:F6:B1:1A (OUI DF-A9-FF)
        Count: 1
        #150: len 21 (0 Kb/s)
        Latency: 169 msec (71-172 msec ~164 msec)
> ACL Data RX: Handle 129 flags 0x02 dlen 21              #152 [hci1] 12.806047
      SMP: Pairing Confirm (0x03) len 16
        Confim value: fc81ca4175da5fc932aeba1eef3e33fb
< HCI Command: Host Number of Com.. (0x03|0x0035) plen 5  #153 [hci1] 12.808394
        Num handles: 1
        Handle: 129 Address: DF:A9:FF:F6:B1:1A (OUI DF-A9-FF)
        Count: 1
< ACL Data TX: Handle 129 flags 0x00 dlen 21              #154 [hci1] 12.808403
      SMP: Pairing Confirm (0x03) len 16
        Confim value: 5f5ed1634be2120e0355feb44e4671d9
> HCI Event: Number of Completed Packets (0x13) plen 5    #155 [hci1] 12.980942
        Num handles: 1
        Handle: 129 Address: DF:A9:FF:F6:B1:1A (OUI DF-A9-FF)
        Count: 1
        #154: len 21 (0 Kb/s)
        Latency: 172 msec (71-172 msec ~168 msec)
> ACL Data RX: Handle 129 flags 0x02 dlen 21              #156 [hci1] 12.981220
      SMP: Pairing Random (0x04) len 16
        Random value: 8009973607b6c8ad0000000000000000
< HCI Command: Host Number of Com.. (0x03|0x0035) plen 5  #157 [hci1] 12.988407
        Num handles: 1
        Handle: 129 Address: DF:A9:FF:F6:B1:1A (OUI DF-A9-FF)
        Count: 1
< ACL Data TX: Handle 129 flags 0x00 dlen 21              #158 [hci1] 12.988477
      SMP: Pairing Random (0x04) len 16
        Random value: 92f20f6ad8f13724432c7fd6001c45ff
> HCI Event: Number of Completed Packets (0x13) plen 5    #159 [hci1] 13.155979
        Num handles: 1
        Handle: 129 Address: DF:A9:FF:F6:B1:1A (OUI DF-A9-FF)
        Count: 1
        #158: len 21 (1 Kb/s)
        Latency: 167 msec (71-172 msec ~168 msec)
> ACL Data RX: Handle 129 flags 0x02 dlen 21              #160 [hci1] 13.156267
      SMP: Pairing Confirm (0x03) len 16
        Confim value: ce9151116067fbcd94bb6859d2e7f412
< HCI Command: Host Number of Com.. (0x03|0x0035) plen 5  #161 [hci1] 13.168564
        Num handles: 1
        Handle: 129 Address: DF:A9:FF:F6:B1:1A (OUI DF-A9-FF)
        Count: 1
< ACL Data TX: Handle 129 flags 0x00 dlen 21              #162 [hci1] 13.168635
      SMP: Pairing Confirm (0x03) len 16
        Confim value: e7153757690f668970dd4294aa0593bc
> HCI Event: Number of Completed Packets (0x13) plen 5    #163 [hci1] 13.330967
        Num handles: 1
        Handle: 129 Address: DF:A9:FF:F6:B1:1A (OUI DF-A9-FF)
        Count: 1
        #162: len 21 (1 Kb/s)
        Latency: 162 msec (71-172 msec ~165 msec)
> ACL Data RX: Handle 129 flags 0x02 dlen 21              #164 [hci1] 13.331285
      SMP: Pairing Random (0x04) len 16
        Random value: eb64a9dab8d575cb0000000000000000
< HCI Command: Host Number of Com.. (0x03|0x0035) plen 5  #165 [hci1] 13.349124
        Num handles: 1
        Handle: 129 Address: DF:A9:FF:F6:B1:1A (OUI DF-A9-FF)
        Count: 1
< ACL Data TX: Handle 129 flags 0x00 dlen 21              #166 [hci1] 13.349226
      SMP: Pairing Random (0x04) len 16
        Random value: 23ac32ebbb5e14c8a6b9622f296d277f
> HCI Event: Number of Completed Packets (0x13) plen 5    #167 [hci1] 13.505728
        Num handles: 1
        Handle: 129 Address: DF:A9:FF:F6:B1:1A (OUI DF-A9-FF)
        Count: 1
        #166: len 21 (1 Kb/s)
        Latency: 156 msec (71-172 msec ~160 msec)
> ACL Data RX: Handle 129 flags 0x02 dlen 21              #168 [hci1] 13.593551
      SMP: Pairing Confirm (0x03) len 16
        Confim value: 50ede9ff057db8e01c7f2363bd8f36ad
< HCI Command: Host Number of Com.. (0x03|0x0035) plen 5  #169 [hci1] 13.609011
        Num handles: 1
        Handle: 129 Address: DF:A9:FF:F6:B1:1A (OUI DF-A9-FF)
        Count: 1
< ACL Data TX: Handle 129 flags 0x00 dlen 21              #170 [hci1] 13.609275
      SMP: Pairing Confirm (0x03) len 16
        Confim value: c5c3ff99671f809014ae5fd4ac4cc196
> HCI Event: Number of Completed Packets (0x13) plen 5    #171 [hci1] 13.768378
        Num handles: 1
        Handle: 129 Address: DF:A9:FF:F6:B1:1A (OUI DF-A9-FF)
        Count: 1
        #170: len 21 (1 Kb/s)
        Latency: 159 msec (71-172 msec ~159 msec)
> ACL Data RX: Handle 129 flags 0x02 dlen 21              #172 [hci1] 13.768723
      SMP: Pairing Random (0x04) len 16
        Random value: 86d139dc612623e00000000000000000
< HCI Command: Host Number of Com.. (0x03|0x0035) plen 5  #173 [hci1] 13.788926
        Num handles: 1
        Handle: 129 Address: DF:A9:FF:F6:B1:1A (OUI DF-A9-FF)
        Count: 1
< ACL Data TX: Handle 129 flags 0x00 dlen 21              #174 [hci1] 13.789169
      SMP: Pairing Random (0x04) len 16
        Random value: 297efe85e67448a15f56bd27e3a3cf1d
> HCI Event: Number of Completed Packets (0x13) plen 5    #175 [hci1] 13.943240
        Num handles: 1
        Handle: 129 Address: DF:A9:FF:F6:B1:1A (OUI DF-A9-FF)
        Count: 1
        #174: len 21 (1 Kb/s)
        Latency: 154 msec (71-172 msec ~157 msec)
> ACL Data RX: Handle 129 flags 0x02 dlen 21              #176 [hci1] 14.031084
      SMP: Pairing Confirm (0x03) len 16
        Confim value: 46a099c3252f4450236a0bf98120842d
< HCI Command: Host Number of Com.. (0x03|0x0035) plen 5  #177 [hci1] 14.048998
        Num handles: 1
        Handle: 129 Address: DF:A9:FF:F6:B1:1A (OUI DF-A9-FF)
        Count: 1
< ACL Data TX: Handle 129 flags 0x00 dlen 21              #178 [hci1] 14.049244
      SMP: Pairing Confirm (0x03) len 16
        Confim value: a63eda4af54ef51007a152558a0c671f
> HCI Event: Number of Completed Packets (0x13) plen 5    #179 [hci1] 14.205866
        Num handles: 1
        Handle: 129 Address: DF:A9:FF:F6:B1:1A (OUI DF-A9-FF)
        Count: 1
        #178: len 21 (1 Kb/s)
        Latency: 156 msec (71-172 msec ~156 msec)
> ACL Data RX: Handle 129 flags 0x02 dlen 21              #180 [hci1] 14.206297
      SMP: Pairing Random (0x04) len 16
        Random value: c373e0a26722f2080000000000000000
< HCI Command: Host Number of Com.. (0x03|0x0035) plen 5  #181 [hci1] 14.209246
        Num handles: 1
        Handle: 129 Address: DF:A9:FF:F6:B1:1A (OUI DF-A9-FF)
        Count: 1
< ACL Data TX: Handle 129 flags 0x00 dlen 21              #182 [hci1] 14.209353
      SMP: Pairing Random (0x04) len 16
        Random value: 25a9493fd3ce4faf02be7293595bb7c6
> HCI Event: Number of Completed Packets (0x13) plen 5    #183 [hci1] 14.380771
        Num handles: 1
        Handle: 129 Address: DF:A9:FF:F6:B1:1A (OUI DF-A9-FF)
        Count: 1
        #182: len 21 (0 Kb/s)
        Latency: 171 msec (71-172 msec ~164 msec)
> ACL Data RX: Handle 129 flags 0x02 dlen 21              #184 [hci1] 14.468562
      SMP: Pairing Confirm (0x03) len 16
        Confim value: 6c9451a64beb2ff6001f528856562a0c
< HCI Command: Host Number of Com.. (0x03|0x0035) plen 5  #185 [hci1] 14.489053
        Num handles: 1
        Handle: 129 Address: DF:A9:FF:F6:B1:1A (OUI DF-A9-FF)
        Count: 1
< ACL Data TX: Handle 129 flags 0x00 dlen 21              #186 [hci1] 14.489283
      SMP: Pairing Confirm (0x03) len 16
        Confim value: 248c4fd5856092e373fcc6834261c622
> HCI Event: Number of Completed Packets (0x13) plen 5    #187 [hci1] 14.643383
        Num handles: 1
        Handle: 129 Address: DF:A9:FF:F6:B1:1A (OUI DF-A9-FF)
        Count: 1
        #186: len 21 (1 Kb/s)
        Latency: 154 msec (71-172 msec ~159 msec)
> ACL Data RX: Handle 129 flags 0x02 dlen 21              #188 [hci1] 14.643718
      SMP: Pairing Random (0x04) len 16
        Random value: fec98f9b9a95a1ad0000000000000000
< HCI Command: Host Number of Com.. (0x03|0x0035) plen 5  #189 [hci1] 14.649118
        Num handles: 1
        Handle: 129 Address: DF:A9:FF:F6:B1:1A (OUI DF-A9-FF)
        Count: 1
< ACL Data TX: Handle 129 flags 0x00 dlen 21              #190 [hci1] 14.649277
      SMP: Pairing Random (0x04) len 16
        Random value: 58f6b41f855a6f6c3560debd84e2affc
> HCI Event: Number of Completed Packets (0x13) plen 5    #191 [hci1] 14.818152
        Num handles: 1
        Handle: 129 Address: DF:A9:FF:F6:B1:1A (OUI DF-A9-FF)
        Count: 1
        #190: len 21 (1 Kb/s)
        Latency: 168 msec (71-172 msec ~163 msec)
> ACL Data RX: Handle 129 flags 0x02 dlen 21              #192 [hci1] 14.906023
      SMP: Pairing Confirm (0x03) len 16
        Confim value: fc6cc40de12c3f1ae06fccfe238f6cb0
< HCI Command: Host Number of Com.. (0x03|0x0035) plen 5  #193 [hci1] 14.908909
        Num handles: 1
        Handle: 129 Address: DF:A9:FF:F6:B1:1A (OUI DF-A9-FF)
        Count: 1
< ACL Data TX: Handle 129 flags 0x00 dlen 21              #194 [hci1] 14.909168
      SMP: Pairing Confirm (0x03) len 16
        Confim value: 4d24d8f11fc882ee62742f8bac6ff589
> HCI Event: Number of Completed Packets (0x13) plen 5    #195 [hci1] 15.080896
        Num handles: 1
        Handle: 129 Address: DF:A9:FF:F6:B1:1A (OUI DF-A9-FF)
        Count: 1
        #194: len 21 (0 Kb/s)
        Latency: 171 msec (71-172 msec ~167 msec)
> ACL Data RX: Handle 129 flags 0x02 dlen 21              #196 [hci1] 15.081208
      SMP: Pairing Random (0x04) len 16
        Random value: 1e7c7c2405ca84a30000000000000000
< HCI Command: Host Number of Com.. (0x03|0x0035) plen 5  #197 [hci1] 15.088533
        Num handles: 1
        Handle: 129 Address: DF:A9:FF:F6:B1:1A (OUI DF-A9-FF)
        Count: 1
< ACL Data TX: Handle 129 flags 0x00 dlen 21              #198 [hci1] 15.088613
      SMP: Pairing Random (0x04) len 16
        Random value: b67e7216d5bf664139eda2b542549666
> HCI Event: Number of Completed Packets (0x13) plen 5    #199 [hci1] 15.255741
        Num handles: 1
        Handle: 129 Address: DF:A9:FF:F6:B1:1A (OUI DF-A9-FF)
        Count: 1
        #198: len 21 (1 Kb/s)
        Latency: 167 msec (71-172 msec ~167 msec)
> ACL Data RX: Handle 129 flags 0x02 dlen 21              #200 [hci1] 15.343593
      SMP: Pairing Confirm (0x03) len 16
        Confim value: 8c9083b163fe53bf96d160d5d02b5d91
< HCI Command: Host Number of Com.. (0x03|0x0035) plen 5  #201 [hci1] 15.348600
        Num handles: 1
        Handle: 129 Address: DF:A9:FF:F6:B1:1A (OUI DF-A9-FF)
        Count: 1
< ACL Data TX: Handle 129 flags 0x00 dlen 21              #202 [hci1] 15.348708
      SMP: Pairing Confirm (0x03) len 16
        Confim value: 35560b76ec215e5e80bf15deef8d9746
> HCI Event: Number of Completed Packets (0x13) plen 5    #203 [hci1] 15.518369
        Num handles: 1
        Handle: 129 Address: DF:A9:FF:F6:B1:1A (OUI DF-A9-FF)
        Count: 1
        #202: len 21 (0 Kb/s)
        Latency: 169 msec (71-172 msec ~168 msec)
> ACL Data RX: Handle 129 flags 0x02 dlen 21              #204 [hci1] 15.518712
      SMP: Pairing Random (0x04) len 16
        Random value: bff4ce27d3609f0a0000000000000000
< HCI Command: Host Number of Com.. (0x03|0x0035) plen 5  #205 [hci1] 15.529224
        Num handles: 1
        Handle: 129 Address: DF:A9:FF:F6:B1:1A (OUI DF-A9-FF)
        Count: 1
< ACL Data TX: Handle 129 flags 0x00 dlen 21              #206 [hci1] 15.529366
      SMP: Pairing Random (0x04) len 16
        Random value: ed17f76500c95219dd01e09d1e63f87b
> HCI Event: Number of Completed Packets (0x13) plen 5    #207 [hci1] 15.693169
        Num handles: 1
        Handle: 129 Address: DF:A9:FF:F6:B1:1A (OUI DF-A9-FF)
        Count: 1
        #206: len 21 (1 Kb/s)
        Latency: 163 msec (71-172 msec ~166 msec)
> ACL Data RX: Handle 129 flags 0x02 dlen 21              #208 [hci1] 15.781042
      SMP: Pairing Confirm (0x03) len 16
        Confim value: 3649fd5d562f503113d9f1053a5acd74
< HCI Command: Host Number of Com.. (0x03|0x0035) plen 5  #209 [hci1] 15.788946
        Num handles: 1
        Handle: 129 Address: DF:A9:FF:F6:B1:1A (OUI DF-A9-FF)
        Count: 1
< ACL Data TX: Handle 129 flags 0x00 dlen 21              #210 [hci1] 15.789207
      SMP: Pairing Confirm (0x03) len 16
        Confim value: a24f49e08740451a56d640670519e9c1
> HCI Event: Number of Completed Packets (0x13) plen 5    #211 [hci1] 15.955839
        Num handles: 1
        Handle: 129 Address: DF:A9:FF:F6:B1:1A (OUI DF-A9-FF)
        Count: 1
        #210: len 21 (1 Kb/s)
        Latency: 166 msec (71-172 msec ~166 msec)
> ACL Data RX: Handle 129 flags 0x02 dlen 21              #212 [hci1] 15.956197
      SMP: Pairing Random (0x04) len 16
        Random value: 124c714b3e6af23d0000000000000000
< HCI Command: Host Number of Com.. (0x03|0x0035) plen 5  #213 [hci1] 15.968526
        Num handles: 1
        Handle: 129 Address: DF:A9:FF:F6:B1:1A (OUI DF-A9-FF)
        Count: 1
< ACL Data TX: Handle 129 flags 0x00 dlen 21              #214 [hci1] 15.968598
      SMP: Pairing Random (0x04) len 16
        Random value: 81d35d47e1f6006d79c974bd9d9e1ee3
> HCI Event: Number of Completed Packets (0x13) plen 5    #215 [hci1] 16.130727
        Num handles: 1
        Handle: 129 Address: DF:A9:FF:F6:B1:1A (OUI DF-A9-FF)
        Count: 1
        #214: len 21 (1 Kb/s)
        Latency: 162 msec (71-172 msec ~164 msec)
> ACL Data RX: Handle 129 flags 0x02 dlen 21              #216 [hci1] 16.218485
      SMP: Pairing Confirm (0x03) len 16
        Confim value: d7a1d5261db5d8c630d453fa401f6708
< HCI Command: Host Number of Com.. (0x03|0x0035) plen 5  #217 [hci1] 16.228973
        Num handles: 1
        Handle: 129 Address: DF:A9:FF:F6:B1:1A (OUI DF-A9-FF)
        Count: 1
< ACL Data TX: Handle 129 flags 0x00 dlen 21              #218 [hci1] 16.229162
      SMP: Pairing Confirm (0x03) len 16
        Confim value: 8718eef69266937f2cd6ad673ea6ca9b
> HCI Event: Number of Completed Packets (0x13) plen 5    #219 [hci1] 16.393334
        Num handles: 1
        Handle: 129 Address: DF:A9:FF:F6:B1:1A (OUI DF-A9-FF)
        Count: 1
        #218: len 21 (1 Kb/s)
        Latency: 164 msec (71-172 msec ~164 msec)
> ACL Data RX: Handle 129 flags 0x02 dlen 21              #220 [hci1] 16.393736
      SMP: Pairing Random (0x04) len 16
        Random value: 8fa66c700d18d8ca0000000000000000
< HCI Command: Host Number of Com.. (0x03|0x0035) plen 5  #221 [hci1] 16.409024
        Num handles: 1
        Handle: 129 Address: DF:A9:FF:F6:B1:1A (OUI DF-A9-FF)
        Count: 1
< ACL Data TX: Handle 129 flags 0x00 dlen 21              #222 [hci1] 16.409123
      SMP: Pairing Random (0x04) len 16
        Random value: e7f7e0c2476823e41736a7e381bafb7c
> HCI Event: Number of Completed Packets (0x13) plen 5    #223 [hci1] 16.568093
        Num handles: 1
        Handle: 129 Address: DF:A9:FF:F6:B1:1A (OUI DF-A9-FF)
        Count: 1
        #222: len 21 (1 Kb/s)
        Latency: 158 msec (71-172 msec ~161 msec)
> ACL Data RX: Handle 129 flags 0x02 dlen 21              #224 [hci1] 16.655953
      SMP: Pairing Confirm (0x03) len 16
        Confim value: 57f8f812128f1e2bb4d7e80cf9f287a1
< HCI Command: Host Number of Com.. (0x03|0x0035) plen 5  #225 [hci1] 16.669047
        Num handles: 1
        Handle: 129 Address: DF:A9:FF:F6:B1:1A (OUI DF-A9-FF)
        Count: 1
< ACL Data TX: Handle 129 flags 0x00 dlen 21              #226 [hci1] 16.669244
      SMP: Pairing Confirm (0x03) len 16
        Confim value: 04ea5f357a0e368cc9228c890eaa167d
> HCI Event: Number of Completed Packets (0x13) plen 5    #227 [hci1] 16.830881
        Num handles: 1
        Handle: 129 Address: DF:A9:FF:F6:B1:1A (OUI DF-A9-FF)
        Count: 1
        #226: len 21 (1 Kb/s)
        Latency: 161 msec (71-172 msec ~161 msec)
> ACL Data RX: Handle 129 flags 0x02 dlen 21              #228 [hci1] 16.831099
      SMP: Pairing Random (0x04) len 16
        Random value: d263589233af2f780000000000000000
< HCI Command: Host Number of Com.. (0x03|0x0035) plen 5  #229 [hci1] 16.849134
        Num handles: 1
        Handle: 129 Address: DF:A9:FF:F6:B1:1A (OUI DF-A9-FF)
        Count: 1
