Bluetooth monitor ver 5.72
btmon[2103281]: = Note: Linux version 6.14.0-35-generic (x86_64)                                                         0.640944
btmon[2103281]: = Note: Bluetooth subsystem version 2.22                                                                 0.640946
= New Index: 00:00:00:00:00:00 (Primary,UART,hci1)                                                                       0.640947
= New Index: 48:5F:99:8E:E0:64 (Primary,USB,hci0)                                                                        0.640948
= Open Index: 00:00:00:00:00:00                                                                                          1.156577
= Index Info: 00:00:00:00:00:00 (Nordic Semiconductor ASA)                                                               1.156588
zephyr.exe[2103283]: @ USER Open: main (privileged) version 2.22                                                {0x0001} 1.156596
zephyr.exe[2103283]: < HCI Command: Reset (0x03|0x0003) plen 0                                                        #1 1.157005
> HCI Event: Command Complete (0x0e) plen 4                                                                           #2 1.157468
      Reset (0x03|0x0003) ncmd 1
        Status: Success (0x00)
zephyr.exe[2103283]: < HCI Command: Read Local Supported Features (0x04|0x0003) plen 0                                #3 1.174886
> HCI Event: Command Complete (0x0e) plen 12                                                                          #4 1.175325
      Read Local Supported Features (0x04|0x0003) ncmd 1
        Status: Success (0x00)
        Features: 0x00 0x00 0x00 0x00 0x60 0x00 0x00 0x00
          BR/EDR Not Supported
          LE Supported (Controller)
zephyr.exe[2103283]: < HCI Command: Read Local Version Information (0x04|0x0001) plen 0                               #5 1.194814
> HCI Event: Command Complete (0x0e) plen 12                                                                          #6 1.195344
      Read Local Version Information (0x04|0x0001) ncmd 1
        Status: Success (0x00)
        HCI version: Reserved (0x0e) - Revision 12520 (0x30e8)
        LMP version: Reserved (0x0e) - Subversion 12520 (0x30e8)
        Manufacturer: Nordic Semiconductor ASA (89)
zephyr.exe[2103283]: < HCI Command: Read Local Supported Commands (0x04|0x0002) plen 0                                #7 1.214952
> HCI Event: Command Complete (0x0e) plen 68                                                                          #8 1.216076
      Read Local Supported Commands (0x04|0x0002) ncmd 1
        Status: Success (0x00)
        Commands: 119 entries
          Disconnect (Octet 0 - Bit 5)
          Read Remote Version Information (Octet 2 - Bit 7)
          Set Event Mask (Octet 5 - Bit 6)
          Reset (Octet 5 - Bit 7)
          Read Connection Accept Timeout (Octet 7 - Bit 2)
          Write Connection Accept Timeout (Octet 7 - Bit 3)
          Read Transmit Power Level (Octet 10 - Bit 2)
          Set Controller To Host Flow Control (Octet 10 - Bit 5)
          Host Buffer Size (Octet 10 - Bit 6)
          Host Number of Completed Packets (Octet 10 - Bit 7)
          Read Local Version Information (Octet 14 - Bit 3)
          Read Local Supported Features (Octet 14 - Bit 5)
          Read BD ADDR (Octet 15 - Bit 1)
          Read RSSI (Octet 15 - Bit 5)
          Set Event Mask Page 2 (Octet 22 - Bit 2)
          LE Set Event Mask (Octet 25 - Bit 0)
          LE Read Buffer Size (Octet 25 - Bit 1)
          LE Read Local Supported Features (Octet 25 - Bit 2)
          LE Set Random Address (Octet 25 - Bit 4)
          LE Set Advertising Parameters (Octet 25 - Bit 5)
          LE Read Advertising Channel TX Power (Octet 25 - Bit 6)
          LE Set Advertising Data (Octet 25 - Bit 7)
          LE Set Scan Response Data (Octet 26 - Bit 0)
          LE Set Advertise Enable (Octet 26 - Bit 1)
          LE Set Scan Parameters (Octet 26 - Bit 2)
          LE Set Scan Enable (Octet 26 - Bit 3)
          LE Create Connection (Octet 26 - Bit 4)
          LE Create Connection Cancel (Octet 26 - Bit 5)
          LE Read Accept List Size (Octet 26 - Bit 6)
          LE Clear Accept List (Octet 26 - Bit 7)
          LE Add Device To Accept List (Octet 27 - Bit 0)
          LE Remove Device From Accept List (Octet 27 - Bit 1)
          LE Connection Update (Octet 27 - Bit 2)
          LE Set Host Channel Classification (Octet 27 - Bit 3)
          LE Read Channel Map (Octet 27 - Bit 4)
          LE Read Remote Used Features (Octet 27 - Bit 5)
          LE Encrypt (Octet 27 - Bit 6)
          LE Rand (Octet 27 - Bit 7)
          LE Start Encryption (Octet 28 - Bit 0)
          LE Long Term Key Request Reply (Octet 28 - Bit 1)
          LE Long Term Key Request Neg Reply (Octet 28 - Bit 2)
          LE Read Supported States (Octet 28 - Bit 3)
          LE Receiver Test (Octet 28 - Bit 4)
          LE Transmitter Test (Octet 28 - Bit 5)
          LE Test End (Octet 28 - Bit 6)
          Read Authenticated Payload Timeout (Octet 32 - Bit 4)
          Write Authenticated Payload Timeout (Octet 32 - Bit 5)
          LE Set Data Length (Octet 33 - Bit 6)
          LE Read Suggested Default Data Length (Octet 33 - Bit 7)
          LE Write Suggested Default Data Length (Octet 34 - Bit 0)
          LE Add Device To Resolving List (Octet 34 - Bit 3)
          LE Remove Device From Resolving List (Octet 34 - Bit 4)
          LE Clear Resolving List (Octet 34 - Bit 5)
          LE Read Resolving List Size (Octet 34 - Bit 6)
          LE Set Address Resolution Enable (Octet 35 - Bit 1)
          LE Set Resolvable Private Address Timeout (Octet 35 - Bit 2)
          LE Read Maximum Data Length (Octet 35 - Bit 3)
          LE Read PHY (Octet 35 - Bit 4)
          LE Set Default PHY (Octet 35 - Bit 5)
          LE Set PHY (Octet 35 - Bit 6)
          LE Enhanced Receiver Test (Octet 35 - Bit 7)
          LE Enhanced Transmitter Test (Octet 36 - Bit 0)
          LE Set Advertising Set Random Address (Octet 36 - Bit 1)
          LE Set Extended Advertising Parameters (Octet 36 - Bit 2)
          LE Set Extended Advertising Data (Octet 36 - Bit 3)
          LE Set Extended Scan Response Data (Octet 36 - Bit 4)
          LE Set Extended Advertising Enable (Octet 36 - Bit 5)
          LE Read Maximum Advertising Data Length (Octet 36 - Bit 6)
          LE Read Number of Supported Advertising Sets (Octet 36 - Bit 7)
          LE Remove Advertising Set (Octet 37 - Bit 0)
          LE Clear Advertising Sets (Octet 37 - Bit 1)
          LE Set Periodic Advertising Parameters (Octet 37 - Bit 2)
          LE Set Periodic Advertising Data (Octet 37 - Bit 3)
          LE Set Periodic Advertising Enable (Octet 37 - Bit 4)
          LE Set Extended Scan Parameters (Octet 37 - Bit 5)
          LE Set Extended Scan Enable (Octet 37 - Bit 6)
          LE Extended Create Connection (Octet 37 - Bit 7)
          LE Periodic Advertising Create Sync (Octet 38 - Bit 0)
          LE Periodic Advertising Create Sync Cancel (Octet 38 - Bit 1)
          LE Periodic Advertising Terminate Sync (Octet 38 - Bit 2)
          LE Add Device To Periodic Advertiser List (Octet 38 - Bit 3)
          LE Remove Device From Periodic Advertiser List (Octet 38 - Bit 4)
          LE Clear Periodic Advertiser List (Octet 38 - Bit 5)
          LE Read Periodic Advertiser List Size (Octet 38 - Bit 6)
          LE Read Transmit Power (Octet 38 - Bit 7)
          LE Read RF Path Compensation (Octet 39 - Bit 0)
          LE Write RF Path Compensation (Octet 39 - Bit 1)
          LE Set Privacy Mode (Octet 39 - Bit 2)
          LE Periodic Advertising Receive Enable (Octet 40 - Bit 5)
          LE Periodic Advertising Sync Transfer (Octet 40 - Bit 6)
          LE Periodic Advertising Set Info Transfer (Octet 40 - Bit 7)
          LE Periodic Advertising Sync Transfer Parameters (Octet 41 - Bit 0)
          LE Set Default Periodic Advertisng Sync Transfer Parameters (Octet 41 - Bit 1)
          LE Read Buffer v2 (Octet 41 - Bit 5)
          LE Read ISO TX Sync (Octet 41 - Bit 6)
          LE Set Connected Isochronous Group Parameters (Octet 41 - Bit 7)
          LE Set Connected Isochronous Group Parameters Test (Octet 42 - Bit 0)
          LE Create Connected Isochronous Stream (Octet 42 - Bit 1)
          LE Remove Connected Isochronous Group (Octet 42 - Bit 2)
          LE Accept Connected Isochronous Stream Request (Octet 42 - Bit 3)
          LE Reject Connected Isochronous Stream Request (Octet 42 - Bit 4)
          LE Create Broadcast Isochronous Group (Octet 42 - Bit 5)
          LE Create Broadcast Isochronous Group Test (Octet 42 - Bit 6)
          LE Terminate Broadcast Isochronous Group (Octet 42 - Bit 7)
          LE Broadcast Isochronous Group Create Sync (Octet 43 - Bit 0)
          LE Broadcast Isochronous Group Terminate Sync (Octet 43 - Bit 1)
          LE Request Peer SCA (Octet 43 - Bit 2)
          LE Setup Isochronous Data Path (Octet 43 - Bit 3)
          LE Remove Isochronous Data Path (Octet 43 - Bit 4)
          LE Isochronous Transmit Test (Octet 43 - Bit 5)
          LE Isochronous Receive Test (Octet 43 - Bit 6)
          LE Isochronous Read Test Counters (Octet 43 - Bit 7)
          LE Isochronous Read Test Counters (Octet 44 - Bit 0)
          LE Set Host Feature (Octet 44 - Bit 1)
          Octet 44 - Bit 2 
          Octet 45 - Bit 6 
          Octet 46 - Bit 0 
          Octet 46 - Bit 1 
          Octet 46 - Bit 2 
zephyr.exe[2103283]: < HCI Command: Host Buffer Size (0x03|0x0033) plen 7                                             #9 1.234957
        ACL MTU: 255  ACL max packet: 16
        SCO MTU: 0    SCO max packet: 0
> HCI Event: Command Complete (0x0e) plen 4                                                                          #10 1.235464
      Host Buffer Size (0x03|0x0033) ncmd 1
        Status: Success (0x00)
zephyr.exe[2103283]: < HCI Command: Set Controller To Host Flow Control (0x03|0x0031) plen 1                         #11 1.254982
        Flow control: ACL Data Packets (0x01)
> HCI Event: Command Complete (0x0e) plen 4                                                                          #12 1.255403
      Set Controller To Host Flow Control (0x03|0x0031) ncmd 1
        Status: Success (0x00)
zephyr.exe[2103283]: < HCI Command: LE Read Local Supported Features (0x08|0x0003) plen 0                            #13 1.274931
> HCI Event: Command Complete (0x0e) plen 12                                                                         #14 1.275502
      LE Read Local Supported Features (0x08|0x0003) ncmd 1
        Status: Success (0x00)
        Features: 0xfd 0x79 0x00 0xf7 0x30 0x01 0x00 0x00
          LE Encryption
          Extended Reject Indication
          Peripheral-initiated Features Exchange
          LE Ping
          LE Data Packet Length Extension
          LL Privacy
          Extended Scanner Filter Policies
          LE 2M PHY
          LE Coded PHY
          LE Extended Advertising
          LE Periodic Advertising
          Channel Selection Algorithm #2
          Periodic Advertising Sync Transfer - Sender
          Periodic Advertising Sync Transfer - Recipient
          Sleep Clock Accuracy Updates
          Connected Isochronous Stream - Central
          Connected Isochronous Stream - Peripheral
          Isochronous Broadcaster
          Synchronized Receiver
          Periodic Advertising ADI support
          Connection Subrating
          Unknown features (0x0000010000000000)
zephyr.exe[2103283]: < HCI Command: LE Set Host Feature (0x08|0x0074) plen 2                                         #15 1.294988
        Bit Number: 32
          Connected Isochronous Stream (Host Support)
        Bit Value: 1
> HCI Event: Command Complete (0x0e) plen 4                                                                          #16 1.295425
      LE Set Host Feature (0x08|0x0074) ncmd 1
        Status: Success (0x00)
zephyr.exe[2103283]: < HCI Command: LE Read Buffer v2 (0x08|0x0060) plen 0                                           #17 1.314915
> HCI Event: Command Complete (0x0e) plen 10                                                                         #18 1.315346
      LE Read Buffer v2 (0x08|0x0060) ncmd 1
        Status: Success (0x00)
        ACL MTU: 27
        ACL max packet: 3
        ISO MTU: 318
        ISO max packet: 3
zephyr.exe[2103283]: < HCI Command: LE Read Maximum Advertising Data Length (0x08|0x003a) plen 0                     #19 1.334994
> HCI Event: Command Complete (0x0e) plen 6                                                                          #20 1.335433
      LE Read Maximum Advertising Data Length (0x08|0x003a) ncmd 1
        Status: Success (0x00)
        Max length: 1650
zephyr.exe[2103283]: < HCI Command: LE Read Supported States (0x08|0x001c) plen 0                                    #21 1.354993
> HCI Event: Command Complete (0x0e) plen 12                                                                         #22 1.355490
      LE Read Supported States (0x08|0x001c) ncmd 1
        Status: Success (0x00)
        States: 0x000003ff3e0306ff
          Non-connectable Advertising State
          Scannable Advertising State
          Connectable Advertising State
          High Duty Cycle Directed Advertising State
          Passive Scanning State
          Active Scanning State
          Initiating State
            and Connection State (Central Role)
          Connection State (Peripheral Role)
          Scannable Advertising State
            and Passive Scanning State
          Connectable Advertising State
            and Passive Scanning State
          Non-connectable Advertising State
            and Initiating State
          Scannable Advertising State
            and Initiating State
          Active Scanning State
            and Connection State (Central Role)
          Passive Scanning State
            and Connection State (Peripheral Role)
          Active Scanning State
            and Connection State (Peripheral Role)
          Initiating State
            and Connection State (Central Role)
            and Central Role & Central Role
          Low Duty Cycle Directed Advertising State
          Connectable Advertising State
            and Initiating State
            and Central Role & Peripheral Role
          High Duty Cycle Directed Advertising State
            and Initiating State
            and Central Role & Peripheral Role
          Low Duty Cycle Directed Advertising State
            and Initiating State
            and Central Role & Peripheral Role
          Connectable Advertising State
            and Connection State (Central Role)
            and Central Role & Peripheral Role
          High Duty Cycle Directed Advertising State
            and Connection State (Central Role)
            and Central Role & Peripheral Role
          Low Duty Cycle Directed Advertising State
            and Connection State (Central Role)
            and Central Role & Peripheral Role
          Connectable Advertising State
            and Connection State (Peripheral Role)
            and Central Role & Peripheral Role
          High Duty Cycle Directed Advertising State
            and Connection State (Peripheral Role)
            and Peripheral Role & Peripheral Role
          Low Duty Cycle Directed Advertising State
            and Connection State (Peripheral Role)
            and Peripheral Role & Peripheral Role
          Initiating State
            and Connection State (Peripheral Role)
            and Central Role & Peripheral Role
zephyr.exe[2103283]: < HCI Command: LE Read Maximum Data Length (0x08|0x002f) plen 0                                 #23 1.374930
> HCI Event: Command Complete (0x0e) plen 12                                                                         #24 1.375403
      LE Read Maximum Data Length (0x08|0x002f) ncmd 1
        Status: Success (0x00)
        Max TX octets: 251
        Max TX time: 2704
        Max RX octets: 251
        Max RX time: 2704
zephyr.exe[2103283]: < HCI Command: LE Write Suggested Default Data Length (0x08|0x0024) plen 4                      #25 1.394812
        TX octets: 251
        TX time: 2704
> HCI Event: Command Complete (0x0e) plen 4                                                                          #26 1.395240
      LE Write Suggested Default Data Length (0x08|0x0024) ncmd 1
        Status: Success (0x00)
zephyr.exe[2103283]: < HCI Command: LE Read Resolving List Size (0x08|0x002a) plen 0                                 #27 1.414940
> HCI Event: Command Complete (0x0e) plen 5                                                                          #28 1.415362
      LE Read Resolving List Size (0x08|0x002a) ncmd 1
        Status: Success (0x00)
        Size: 8
zephyr.exe[2103283]: < HCI Command: LE Set Event Mask (0x08|0x0001) plen 8                                           #29 1.434974
        Mask: 0x000002023f87fa5e
          LE Advertising Report
          LE Connection Update Complete
          LE Read Remote Used Features Complete
          LE Long Term Key Request
          LE Data Length Change
          LE Enhanced Connection Complete
          LE PHY Update Complete
          LE Extended Advertising Report
          LE Periodic Advertising Sync Established
          LE Periodic Advertising Report
          LE Periodic Advertising Sync Lost
          LE Extended Scan Timeout
          LE Extended Advertising Set Terminated
          LE Scan Request Received
          LE Periodic Advertising Sync Transfer Rvc
          LE CIS Established
          LE CIS Request
          LE Create BIG Complete
          LE Terminate BIG Complete
          LE BIG Sync Estabilished Complete
          LE BIG Sync Lost
          LE BIG Info Advertising Report
          Unknown mask (0x0000020000000000)
> HCI Event: Command Complete (0x0e) plen 4                                                                          #30 1.435489
      LE Set Event Mask (0x08|0x0001) ncmd 1
        Status: Success (0x00)
zephyr.exe[2103283]: < HCI Command: Set Event Mask (0x03|0x0001) plen 8                                              #31 1.457370
        Mask: 0x2000800002008890
          Disconnection Complete
          Encryption Change
          Read Remote Version Information Complete
          Hardware Error
          Data Buffer Overflow
          Encryption Key Refresh Complete
          LE Meta
> HCI Event: Command Complete (0x0e) plen 4                                                                          #32 1.457913
      Set Event Mask (0x03|0x0001) ncmd 1
        Status: Success (0x00)
zephyr.exe[2103283]: < HCI Command: Read BD ADDR (0x04|0x0009) plen 0                                                #33 1.475376
> HCI Event: Command Complete (0x0e) plen 10                                                                         #34 1.475848
      Read BD ADDR (0x04|0x0009) ncmd 1
        Status: Success (0x00)
        Address: 00:00:00:00:00:00 (OUI 00-00-00)
zephyr.exe[2103283]: < HCI Command: LE Set Random Address (0x08|0x0005) plen 6                                       #35 1.494952
        Address: D5:B6:CC:31:DB:3B (Static)
> HCI Event: Command Complete (0x0e) plen 4                                                                          #36 1.495433
      LE Set Random Address (0x08|0x0005) ncmd 1
        Status: Success (0x00)
zephyr.exe[2103283]: < HCI Command: LE Extended Create Connection (0x08|0x0043) plen 26                              #37 3.695103
        Filter policy: Accept list is not used (0x00)
        Own address type: Random (0x01)
        Peer address type: Public (0x00)
        Peer address: DF:A9:FF:F6:B1:1A (OUI DF-A9-FF)
        Initiating PHYs: 0x01
        Entry 0: LE 1M
          Scan interval: 60.000 msec (0x0060)
          Scan window: 60.000 msec (0x0060)
          Min connection interval: 30.00 msec (0x0018)
          Max connection interval: 50.00 msec (0x0028)
          Connection latency: 0 (0x0000)
          Supervision timeout: 4000 msec (0x0190)
          Min connection length: 0.000 msec (0x0000)
          Max connection length: 0.000 msec (0x0000)
> HCI Event: Command Status (0x0f) plen 4                                                                            #38 3.695989
      LE Extended Create Connection (0x08|0x0043) ncmd 1
        Status: Success (0x00)
> HCI Event: LE Meta Event (0x3e) plen 31                                                                            #39 3.794943
      LE Enhanced Connection Complete (0x0a)
        Status: Success (0x00)
        Handle: 486
        Role: Central (0x00)
        Peer address type: Public (0x00)
        Peer address: DF:A9:FF:F6:B1:1A (OUI DF-A9-FF)
        Local resolvable private address: 00:00:00:00:00:00 (Non-Resolvable)
        Peer resolvable private address: 00:00:00:00:00:00 (Non-Resolvable)
        Connection interval: 50.00 msec (0x0028)
        Connection latency: 0 (0x0000)
        Supervision timeout: 4000 msec (0x0190)
        Central clock accuracy: 0x00
zephyr.exe[2103283]: < HCI Command: LE Read Remote Used Features (0x08|0x0016) plen 2                                #40 3.815167
        Handle: 486 Address: DF:A9:FF:F6:B1:1A (OUI DF-A9-FF)
> HCI Event: Command Status (0x0f) plen 4                                                                            #41 3.815628
      LE Read Remote Used Features (0x08|0x0016) ncmd 1
        Status: Success (0x00)
zephyr.exe[2103283]: < HCI Command: LE Set PHY (0x08|0x0032) plen 7                                                  #42 3.834951
        Handle: 486 Address: DF:A9:FF:F6:B1:1A (OUI DF-A9-FF)
        All PHYs preference: 0x00
        TX PHYs preference: 0x02
          LE 2M
        RX PHYs preference: 0x02
          LE 2M
        PHY options preference: Reserved (0x0000)
> HCI Event: Command Status (0x0f) plen 4                                                                            #43 3.835395
      LE Set PHY (0x08|0x0032) ncmd 1
        Status: Success (0x00)
> ACL Data RX: Handle 486 flags 0x02 dlen 6                                                                          #44 3.846395
      SMP: Security Request (0x0b) len 1
        Authentication requirement: No bonding, MITM, SC, No Keypresses (0x0c)
zephyr.exe[2103283]: < HCI Command: Host Number of Completed Packets (0x03|0x0035) plen 5                            #45 3.855095
        Num handles: 1
        Handle: 486 Address: DF:A9:FF:F6:B1:1A (OUI DF-A9-FF)
        Count: 1
zephyr.exe[2103283]: < ACL Data TX: Handle 486 flags 0x00 dlen 11                                                    #46 3.855127
      SMP: Pairing Request (0x01) len 6
        IO capability: DisplayOnly (0x00)
        OOB data: Authentication data not present (0x00)
        Authentication requirement: Bonding, No MITM, SC, No Keypresses (0x09)
        Max encryption key size: 16
        Initiator key distribution: EncKey (0x01)
        Responder key distribution: EncKey IdKey (0x03)
> HCI Event: Number of Completed Packets (0x13) plen 5                                                               #47 3.946438
        Num handles: 1
        Handle: 486 Address: DF:A9:FF:F6:B1:1A (OUI DF-A9-FF)
        Count: 1
        #46: len 11 (0 Kb/s)
        Latency: 91 msec (91-91 msec ~91 msec)
> HCI Event: LE Meta Event (0x3e) plen 12                                                                            #48 3.946640
      LE Read Remote Used Features (0x04)
        Status: Success (0x00)
        Handle: 486 Address: DF:A9:FF:F6:B1:1A (OUI DF-A9-FF)
        Features: 0x2d 0x49 0x00 0xf7 0x67 0xd8 0x00 0x00
          LE Encryption
          Extended Reject Indication
          Peripheral-initiated Features Exchange
          LE Data Packet Length Extension
          LE 2M PHY
          LE Coded PHY
          Channel Selection Algorithm #2
          Periodic Advertising Sync Transfer - Sender
          Periodic Advertising Sync Transfer - Recipient
          Sleep Clock Accuracy Updates
          Connected Isochronous Stream - Central
          Connected Isochronous Stream - Peripheral
          Isochronous Broadcaster
          Synchronized Receiver
          Connected Isochronous Stream (Host Support)
          LE Power Control Request
          LE Power Control Request
          Connection Subrating
          Connection Subrating (Host Support)
          Unknown features (0x0000d80000000000)
> ACL Data RX: Handle 486 flags 0x02 dlen 11                                                                         #49 3.996426
      SMP: Pairing Response (0x02) len 6
        IO capability: KeyboardDisplay (0x04)
        OOB data: Authentication data not present (0x00)
        Authentication requirement: No bonding, MITM, SC, No Keypresses (0x0c)
        Max encryption key size: 16
        Initiator key distribution: <none> (0x00)
        Responder key distribution: <none> (0x00)
zephyr.exe[2103283]: < HCI Command: Host Number of Completed Packets (0x03|0x0035) plen 5                            #50 4.015207
        Num handles: 1
        Handle: 486 Address: DF:A9:FF:F6:B1:1A (OUI DF-A9-FF)
        Count: 1
zephyr.exe[2103283]: < ACL Data TX: Handle 486 flags 0x00 dlen 27                                                    #51 4.015216
zephyr.exe[2103283]: < ACL Data TX: Handle 486 flags 0x01 dlen 27                                                    #52 4.015217
zephyr.exe[2103283]: < ACL Data TX: Handle 486 flags 0x01 dlen 15                                                    #53 4.015217
      SMP: Pairing Public Key (0x0c) len 64
        X: 98308440221e2d910f0e54b71e7ec652857aa9b5a0dc65028824cc19db1226e9
        Y: 67a4816bcb62efb21701e31fdb27561a6217575fb007a8bbdabe7e28b6f68482
> HCI Event: Number of Completed Packets (0x13) plen 5                                                               #54 4.046485
        Num handles: 1
        Handle: 486 Address: DF:A9:FF:F6:B1:1A (OUI DF-A9-FF)
        Count: 1
        #51: len 27 (6 Kb/s)
        Latency: 31 msec (31-91 msec ~61 msec)
> HCI Event: Number of Completed Packets (0x13) plen 5                                                               #55 4.096592
        Num handles: 1
        Handle: 486 Address: DF:A9:FF:F6:B1:1A (OUI DF-A9-FF)
        Count: 1
        #52: len 27 (2 Kb/s)
        Latency: 81 msec (31-91 msec ~71 msec)
> HCI Event: Number of Completed Packets (0x13) plen 5                                                               #56 4.196377
        Num handles: 1
        Handle: 486 Address: DF:A9:FF:F6:B1:1A (OUI DF-A9-FF)
        Count: 1
        #53: len 15 (0 Kb/s)
        Latency: 181 msec (31-181 msec ~126 msec)
> ACL Data RX: Handle 486 flags 0x02 dlen 27                                                                         #57 4.246658
> ACL Data RX: Handle 486 flags 0x01 dlen 27                                                                         #58 4.247257
> ACL Data RX: Handle 486 flags 0x01 dlen 15                                                                         #59 4.247832
      SMP: Pairing Public Key (0x0c) len 64
        X: e87586dcb32a7aecff38ce6a931ed67572fa949b9cbf0d0ec0a379954530897c
        Y: f961d131a828d348ae3d67db0cc5e91006b695ace91bd70303f0f5c9699f2654
zephyr.exe[2103283]: < HCI Command: Host Number of Completed Packets (0x03|0x0035) plen 5                            #60 4.255198
        Num handles: 1
        Handle: 486 Address: DF:A9:FF:F6:B1:1A (OUI DF-A9-FF)
        Count: 1
zephyr.exe[2103283]: < HCI Command: Host Number of Completed Packets (0x03|0x0035) plen 5                            #61 4.255204
        Num handles: 1
        Handle: 486 Address: DF:A9:FF:F6:B1:1A (OUI DF-A9-FF)
        Count: 1
zephyr.exe[2103283]: < HCI Command: Host Number of Completed Packets (0x03|0x0035) plen 5                            #62 4.255367
        Num handles: 1
        Handle: 486 Address: DF:A9:FF:F6:B1:1A (OUI DF-A9-FF)
        Count: 1
zephyr.exe[2103283]: < ACL Data TX: Handle 486 flags 0x00 dlen 21                                                    #63 4.255439
      SMP: Pairing Confirm (0x03) len 16
        Confim value: 3ad31bbbd6fc233ebc97d336ed019260
> HCI Event: Number of Completed Packets (0x13) plen 5                                                               #64 4.296432
        Num handles: 1
        Handle: 486 Address: DF:A9:FF:F6:B1:1A (OUI DF-A9-FF)
        Count: 1
        #63: len 21 (4 Kb/s)
        Latency: 40 msec (31-181 msec ~83 msec)
> HCI Event: LE Meta Event (0x3e) plen 6                                                                             #65 4.445761
      LE PHY Update Complete (0x0c)
        Status: Success (0x00)
        Handle: 486 Address: DF:A9:FF:F6:B1:1A (OUI DF-A9-FF)
        TX PHY: LE 2M (0x02)
        RX PHY: LE 2M (0x02)
> ACL Data RX: Handle 486 flags 0x02 dlen 21                                                                         #66 4.896497
      SMP: Pairing Confirm (0x03) len 16
        Confim value: 0ee4cee2b7902303f4ae07fd23e84e97
zephyr.exe[2103283]: < HCI Command: Host Number of Completed Packets (0x03|0x0035) plen 5                            #67 4.915073
        Num handles: 1
        Handle: 486 Address: DF:A9:FF:F6:B1:1A (OUI DF-A9-FF)
        Count: 1
zephyr.exe[2103283]: < ACL Data TX: Handle 486 flags 0x00 dlen 21                                                    #68 4.915140
      SMP: Pairing Random (0x04) len 16
        Random value: 8e6108f966a694cbe26df70bb96773e6
> HCI Event: Number of Completed Packets (0x13) plen 5                                                               #69 4.946276
        Num handles: 1
        Handle: 486 Address: DF:A9:FF:F6:B1:1A (OUI DF-A9-FF)
        Count: 1
        #68: len 21 (5 Kb/s)
        Latency: 31 msec (31-181 msec ~57 msec)
> ACL Data RX: Handle 486 flags 0x02 dlen 21                                                                         #70 5.196420
      SMP: Pairing Random (0x04) len 16
        Random value: aa4bf388145a9df1b4c0ebabb66a1d1a
zephyr.exe[2103283]: < HCI Command: Host Number of Completed Packets (0x03|0x0035) plen 5                            #71 5.215820
        Num handles: 1
        Handle: 486 Address: DF:A9:FF:F6:B1:1A (OUI DF-A9-FF)
        Count: 1
zephyr.exe[2103283]: < ACL Data TX: Handle 486 flags 0x00 dlen 21                                                    #72 5.215897
      SMP: Pairing Confirm (0x03) len 16
        Confim value: 9391907dd348feaebab506dce31cc533
> HCI Event: Number of Completed Packets (0x13) plen 5                                                               #73 5.246235
        Num handles: 1
        Handle: 486 Address: DF:A9:FF:F6:B1:1A (OUI DF-A9-FF)
        Count: 1
        #72: len 21 (5 Kb/s)
        Latency: 30 msec (30-181 msec ~43 msec)
> ACL Data RX: Handle 486 flags 0x02 dlen 21                                                                         #74 5.296343
      SMP: Pairing Confirm (0x03) len 16
        Confim value: 488c61ac215b4b3ca25ef135efcbc032
zephyr.exe[2103283]: < HCI Command: Host Number of Completed Packets (0x03|0x0035) plen 5                            #75 5.315546
        Num handles: 1
        Handle: 486 Address: DF:A9:FF:F6:B1:1A (OUI DF-A9-FF)
        Count: 1
zephyr.exe[2103283]: < ACL Data TX: Handle 486 flags 0x00 dlen 21                                                    #76 5.315568
      SMP: Pairing Random (0x04) len 16
        Random value: 4d02679f89a05211af56d8b3da64d21e
> HCI Event: Number of Completed Packets (0x13) plen 5                                                               #77 5.346290
        Num handles: 1
        Handle: 486 Address: DF:A9:FF:F6:B1:1A (OUI DF-A9-FF)
        Count: 1
        #76: len 21 (5 Kb/s)
        Latency: 30 msec (30-181 msec ~37 msec)
> ACL Data RX: Handle 486 flags 0x02 dlen 21                                                                         #78 5.596371
      SMP: Pairing Random (0x04) len 16
        Random value: cbaf02576ccf45911a15fd418a3e78c6
zephyr.exe[2103283]: < HCI Command: Host Number of Completed Packets (0x03|0x0035) plen 5                            #79 5.615220
        Num handles: 1
        Handle: 486 Address: DF:A9:FF:F6:B1:1A (OUI DF-A9-FF)
        Count: 1
zephyr.exe[2103283]: < ACL Data TX: Handle 486 flags 0x00 dlen 21                                                    #80 5.615269
      SMP: Pairing Confirm (0x03) len 16
        Confim value: 2676ce5cf856d28c363e32fc6b56eb0c
> HCI Event: Number of Completed Packets (0x13) plen 5                                                               #81 5.646220
        Num handles: 1
        Handle: 486 Address: DF:A9:FF:F6:B1:1A (OUI DF-A9-FF)
        Count: 1
        #80: len 21 (5 Kb/s)
        Latency: 30 msec (30-181 msec ~34 msec)
> ACL Data RX: Handle 486 flags 0x02 dlen 21                                                                         #82 5.696374
      SMP: Pairing Confirm (0x03) len 16
        Confim value: 0f3bc9abf40b96000f20c6219c0d7af7
zephyr.exe[2103283]: < HCI Command: Host Number of Completed Packets (0x03|0x0035) plen 5                            #83 5.715251
        Num handles: 1
        Handle: 486 Address: DF:A9:FF:F6:B1:1A (OUI DF-A9-FF)
        Count: 1
zephyr.exe[2103283]: < ACL Data TX: Handle 486 flags 0x00 dlen 21                                                    #84 5.715369
      SMP: Pairing Random (0x04) len 16
        Random value: 5e8286bc235a02440d0c3424a2acf8fd
> HCI Event: Number of Completed Packets (0x13) plen 5                                                               #85 5.746192
        Num handles: 1
        Handle: 486 Address: DF:A9:FF:F6:B1:1A (OUI DF-A9-FF)
        Count: 1
        #84: len 21 (5 Kb/s)
        Latency: 30 msec (30-181 msec ~32 msec)
> ACL Data RX: Handle 486 flags 0x02 dlen 21                                                                         #86 5.996288
      SMP: Pairing Random (0x04) len 16
        Random value: 5e879a67de81896c48c2a1c0949a007e
zephyr.exe[2103283]: < HCI Command: Host Number of Completed Packets (0x03|0x0035) plen 5                            #87 6.015710
        Num handles: 1
        Handle: 486 Address: DF:A9:FF:F6:B1:1A (OUI DF-A9-FF)
        Count: 1
zephyr.exe[2103283]: < ACL Data TX: Handle 486 flags 0x00 dlen 21                                                    #88 6.015841
      SMP: Pairing Confirm (0x03) len 16
        Confim value: 4ec6fbbf9219809d76983e0ff8d37dcd
> HCI Event: Number of Completed Packets (0x13) plen 5                                                               #89 6.046313
        Num handles: 1
        Handle: 486 Address: DF:A9:FF:F6:B1:1A (OUI DF-A9-FF)
        Count: 1
        #88: len 21 (5 Kb/s)
        Latency: 30 msec (30-181 msec ~31 msec)
> ACL Data RX: Handle 486 flags 0x02 dlen 21                                                                         #90 6.096478
      SMP: Pairing Confirm (0x03) len 16
        Confim value: 094d3a7f4bb47a2da1cf496bc17187b4
zephyr.exe[2103283]: < HCI Command: Host Number of Completed Packets (0x03|0x0035) plen 5                            #91 6.115214
        Num handles: 1
        Handle: 486 Address: DF:A9:FF:F6:B1:1A (OUI DF-A9-FF)
        Count: 1
zephyr.exe[2103283]: < ACL Data TX: Handle 486 flags 0x00 dlen 21                                                    #92 6.115342
      SMP: Pairing Random (0x04) len 16
        Random value: 5c4a1bcadd27bd58e945097b00bad7ac
> HCI Event: Number of Completed Packets (0x13) plen 5                                                               #93 6.146176
        Num handles: 1
        Handle: 486 Address: DF:A9:FF:F6:B1:1A (OUI DF-A9-FF)
        Count: 1
        #92: len 21 (5 Kb/s)
        Latency: 30 msec (30-181 msec ~31 msec)
> ACL Data RX: Handle 486 flags 0x02 dlen 21                                                                         #94 6.396302
      SMP: Pairing Random (0x04) len 16
        Random value: e6fe59db5fc9f655a05054aaab382371
zephyr.exe[2103283]: < HCI Command: Host Number of Completed Packets (0x03|0x0035) plen 5                            #95 6.415683
        Num handles: 1
        Handle: 486 Address: DF:A9:FF:F6:B1:1A (OUI DF-A9-FF)
        Count: 1
zephyr.exe[2103283]: < ACL Data TX: Handle 486 flags 0x00 dlen 21                                                    #96 6.415797
      SMP: Pairing Confirm (0x03) len 16
        Confim value: 095f638980f45602cbd9b6e3e759430d
> HCI Event: Number of Completed Packets (0x13) plen 5                                                               #97 6.446170
        Num handles: 1
        Handle: 486 Address: DF:A9:FF:F6:B1:1A (OUI DF-A9-FF)
        Count: 1
        #96: len 21 (5 Kb/s)
        Latency: 30 msec (30-181 msec ~30 msec)
> ACL Data RX: Handle 486 flags 0x02 dlen 21                                                                         #98 6.496254
      SMP: Pairing Confirm (0x03) len 16
        Confim value: 5e436c05306a87e312e464036249a4cc
zephyr.exe[2103283]: < HCI Command: Host Number of Completed Packets (0x03|0x0035) plen 5                            #99 6.515537
        Num handles: 1
        Handle: 486 Address: DF:A9:FF:F6:B1:1A (OUI DF-A9-FF)
        Count: 1
zephyr.exe[2103283]: < ACL Data TX: Handle 486 flags 0x00 dlen 21                                                   #100 6.515624
      SMP: Pairing Random (0x04) len 16
        Random value: 32527e6e64e79f33b2e374394db8ab2d
> HCI Event: Number of Completed Packets (0x13) plen 5                                                              #101 6.546148
        Num handles: 1
        Handle: 486 Address: DF:A9:FF:F6:B1:1A (OUI DF-A9-FF)
        Count: 1
        #100: len 21 (5 Kb/s)
        Latency: 30 msec (30-181 msec ~30 msec)
> ACL Data RX: Handle 486 flags 0x02 dlen 21                                                                        #102 6.796443
      SMP: Pairing Random (0x04) len 16
        Random value: 2a7c1a14243f585cca89d4c0e4108d13
zephyr.exe[2103283]: < HCI Command: Host Number of Completed Packets (0x03|0x0035) plen 5                           #103 6.815709
        Num handles: 1
        Handle: 486 Address: DF:A9:FF:F6:B1:1A (OUI DF-A9-FF)
        Count: 1
zephyr.exe[2103283]: < ACL Data TX: Handle 486 flags 0x00 dlen 21                                                   #104 6.815793
      SMP: Pairing Confirm (0x03) len 16
        Confim value: 0474bf3605414886527bff694a2bac0d
> HCI Event: Number of Completed Packets (0x13) plen 5                                                              #105 6.846081
        Num handles: 1
        Handle: 486 Address: DF:A9:FF:F6:B1:1A (OUI DF-A9-FF)
        Count: 1
        #104: len 21 (5 Kb/s)
        Latency: 30 msec (30-181 msec ~30 msec)
> ACL Data RX: Handle 486 flags 0x02 dlen 21                                                                        #106 6.896377
      SMP: Pairing Confirm (0x03) len 16
        Confim value: c478b561ddf04e8565863bd4002da458
zephyr.exe[2103283]: < HCI Command: Host Number of Completed Packets (0x03|0x0035) plen 5                           #107 6.915233
        Num handles: 1
        Handle: 486 Address: DF:A9:FF:F6:B1:1A (OUI DF-A9-FF)
        Count: 1
zephyr.exe[2103283]: < ACL Data TX: Handle 486 flags 0x00 dlen 21                                                   #108 6.915307
      SMP: Pairing Random (0x04) len 16
        Random value: dddbdfe2838e9a8cc6964353c850fef7
> HCI Event: Number of Completed Packets (0x13) plen 5                                                              #109 6.946116
        Num handles: 1
        Handle: 486 Address: DF:A9:FF:F6:B1:1A (OUI DF-A9-FF)
        Count: 1
        #108: len 21 (5 Kb/s)
        Latency: 30 msec (30-181 msec ~30 msec)
> ACL Data RX: Handle 486 flags 0x02 dlen 21                                                                        #110 7.196249
      SMP: Pairing Random (0x04) len 16
        Random value: 2ea9fbb1a2bdbdd1a9751e03925b2b13
zephyr.exe[2103283]: < HCI Command: Host Number of Completed Packets (0x03|0x0035) plen 5                           #111 7.215250
        Num handles: 1
        Handle: 486 Address: DF:A9:FF:F6:B1:1A (OUI DF-A9-FF)
        Count: 1
zephyr.exe[2103283]: < ACL Data TX: Handle 486 flags 0x00 dlen 21                                                   #112 7.215259
      SMP: Pairing Confirm (0x03) len 16
        Confim value: bcd2fd43a0c793865d007e1cc4d344a7
> HCI Event: Number of Completed Packets (0x13) plen 5                                                              #113 7.246226
        Num handles: 1
        Handle: 486 Address: DF:A9:FF:F6:B1:1A (OUI DF-A9-FF)
        Count: 1
        #112: len 21 (5 Kb/s)
        Latency: 30 msec (30-181 msec ~30 msec)
> ACL Data RX: Handle 486 flags 0x02 dlen 21                                                                        #114 7.296290
      SMP: Pairing Confirm (0x03) len 16
        Confim value: f52293b3fdffd2ad0b130edae5d0dae3
zephyr.exe[2103283]: < HCI Command: Host Number of Completed Packets (0x03|0x0035) plen 5                           #115 7.315537
        Num handles: 1
        Handle: 486 Address: DF:A9:FF:F6:B1:1A (OUI DF-A9-FF)
        Count: 1
zephyr.exe[2103283]: < ACL Data TX: Handle 486 flags 0x00 dlen 21                                                   #116 7.315664
      SMP: Pairing Random (0x04) len 16
        Random value: eb9f1915536596b6fc3db1c86b2b1970
> HCI Event: Number of Completed Packets (0x13) plen 5                                                              #117 7.346163
        Num handles: 1
        Handle: 486 Address: DF:A9:FF:F6:B1:1A (OUI DF-A9-FF)
        Count: 1
        #116: len 21 (5 Kb/s)
        Latency: 30 msec (30-181 msec ~30 msec)
> ACL Data RX: Handle 486 flags 0x02 dlen 21                                                                        #118 7.596355
      SMP: Pairing Random (0x04) len 16
        Random value: 376f59958e5c7247635e6eb44d932a63
zephyr.exe[2103283]: < HCI Command: Host Number of Completed Packets (0x03|0x0035) plen 5                           #119 7.615577
        Num handles: 1
        Handle: 486 Address: DF:A9:FF:F6:B1:1A (OUI DF-A9-FF)
        Count: 1
zephyr.exe[2103283]: < ACL Data TX: Handle 486 flags 0x00 dlen 21                                                   #120 7.615685
      SMP: Pairing Confirm (0x03) len 16
        Confim value: 7a988634dc48d116563109de22d59547
> HCI Event: Number of Completed Packets (0x13) plen 5                                                              #121 7.646114
        Num handles: 1
        Handle: 486 Address: DF:A9:FF:F6:B1:1A (OUI DF-A9-FF)
        Count: 1
        #120: len 21 (5 Kb/s)
        Latency: 30 msec (30-181 msec ~30 msec)
> ACL Data RX: Handle 486 flags 0x02 dlen 21                                                                        #122 7.696236
      SMP: Pairing Confirm (0x03) len 16
        Confim value: a8ce05787ade1489baf4fd01c02bfa80
zephyr.exe[2103283]: < HCI Command: Host Number of Completed Packets (0x03|0x0035) plen 5                           #123 7.715350
        Num handles: 1
        Handle: 486 Address: DF:A9:FF:F6:B1:1A (OUI DF-A9-FF)
        Count: 1
zephyr.exe[2103283]: < ACL Data TX: Handle 486 flags 0x00 dlen 21                                                   #124 7.715501
      SMP: Pairing Random (0x04) len 16
        Random value: 5c794dc9ad9f2c3f295ebd5ad5e1c3cf
> HCI Event: Number of Completed Packets (0x13) plen 5                                                              #125 7.746136
        Num handles: 1
        Handle: 486 Address: DF:A9:FF:F6:B1:1A (OUI DF-A9-FF)
        Count: 1
        #124: len 21 (5 Kb/s)
        Latency: 30 msec (30-181 msec ~30 msec)
> ACL Data RX: Handle 486 flags 0x02 dlen 21                                                                        #126 7.996174
      SMP: Pairing Random (0x04) len 16
        Random value: caf8d2e1dd75038e5ccc4254e76ff833
zephyr.exe[2103283]: < HCI Command: Host Number of Completed Packets (0x03|0x0035) plen 5                           #127 8.015290
        Num handles: 1
        Handle: 486 Address: DF:A9:FF:F6:B1:1A (OUI DF-A9-FF)
        Count: 1
zephyr.exe[2103283]: < ACL Data TX: Handle 486 flags 0x00 dlen 21                                                   #128 8.015379
      SMP: Pairing Confirm (0x03) len 16
        Confim value: 499d3ea671197e66e4ed2ab0bcaa0959
> HCI Event: Number of Completed Packets (0x13) plen 5                                                              #129 8.046068
        Num handles: 1
        Handle: 486 Address: DF:A9:FF:F6:B1:1A (OUI DF-A9-FF)
        Count: 1
        #128: len 21 (5 Kb/s)
        Latency: 30 msec (30-181 msec ~30 msec)
> ACL Data RX: Handle 486 flags 0x02 dlen 21                                                                        #130 8.096244
      SMP: Pairing Confirm (0x03) len 16
        Confim value: a848070ab60933b8da3ab11f7ce207ac
zephyr.exe[2103283]: < HCI Command: Host Number of Completed Packets (0x03|0x0035) plen 5                           #131 8.115542
        Num handles: 1
        Handle: 486 Address: DF:A9:FF:F6:B1:1A (OUI DF-A9-FF)
        Count: 1
zephyr.exe[2103283]: < ACL Data TX: Handle 486 flags 0x00 dlen 21                                                   #132 8.115639
      SMP: Pairing Random (0x04) len 16
        Random value: 5c2fff312cdf99c9491988e877355a9a
> HCI Event: Number of Completed Packets (0x13) plen 5                                                              #133 8.146033
        Num handles: 1
        Handle: 486 Address: DF:A9:FF:F6:B1:1A (OUI DF-A9-FF)
        Count: 1
        #132: len 21 (5 Kb/s)
        Latency: 30 msec (30-181 msec ~30 msec)
> ACL Data RX: Handle 486 flags 0x02 dlen 21                                                                        #134 8.396214
      SMP: Pairing Random (0x04) len 16
        Random value: acab41f4c3a03fb73a8956a377ea40f5
zephyr.exe[2103283]: < HCI Command: Host Number of Completed Packets (0x03|0x0035) plen 5                           #135 8.415647
        Num handles: 1
        Handle: 486 Address: DF:A9:FF:F6:B1:1A (OUI DF-A9-FF)
        Count: 1
zephyr.exe[2103283]: < ACL Data TX: Handle 486 flags 0x00 dlen 21                                                   #136 8.415736
      SMP: Pairing Confirm (0x03) len 16
        Confim value: d0a0df598e1a7996fcb6b6a9093d2d96
> HCI Event: Number of Completed Packets (0x13) plen 5                                                              #137 8.446022
        Num handles: 1
        Handle: 486 Address: DF:A9:FF:F6:B1:1A (OUI DF-A9-FF)
        Count: 1
        #136: len 21 (5 Kb/s)
        Latency: 30 msec (30-181 msec ~30 msec)
> ACL Data RX: Handle 486 flags 0x02 dlen 21                                                                        #138 8.496403
      SMP: Pairing Confirm (0x03) len 16
        Confim value: d041ce60af729717f7e8455c5c58244b
zephyr.exe[2103283]: < HCI Command: Host Number of Completed Packets (0x03|0x0035) plen 5                           #139 8.515563
        Num handles: 1
        Handle: 486 Address: DF:A9:FF:F6:B1:1A (OUI DF-A9-FF)
        Count: 1
zephyr.exe[2103283]: < ACL Data TX: Handle 486 flags 0x00 dlen 21                                                   #140 8.515643
      SMP: Pairing Random (0x04) len 16
        Random value: c629a3a987d808e808655d558dfc1155
> HCI Event: Number of Completed Packets (0x13) plen 5                                                              #141 8.546104
        Num handles: 1
        Handle: 486 Address: DF:A9:FF:F6:B1:1A (OUI DF-A9-FF)
        Count: 1
        #140: len 21 (5 Kb/s)
        Latency: 30 msec (30-181 msec ~30 msec)
> ACL Data RX: Handle 486 flags 0x02 dlen 21                                                                        #142 8.796254
      SMP: Pairing Random (0x04) len 16
        Random value: e332c471b7b73113e29da8a3513cf259
zephyr.exe[2103283]: < HCI Command: Host Number of Completed Packets (0x03|0x0035) plen 5                           #143 8.815696
        Num handles: 1
        Handle: 486 Address: DF:A9:FF:F6:B1:1A (OUI DF-A9-FF)
        Count: 1
zephyr.exe[2103283]: < ACL Data TX: Handle 486 flags 0x00 dlen 21                                                   #144 8.815792
      SMP: Pairing Confirm (0x03) len 16
        Confim value: 7eb6f3fa535332e7f3417a2eb58265c1
> HCI Event: Number of Completed Packets (0x13) plen 5                                                              #145 8.846022
        Num handles: 1
        Handle: 486 Address: DF:A9:FF:F6:B1:1A (OUI DF-A9-FF)
        Count: 1
        #144: len 21 (5 Kb/s)
        Latency: 30 msec (30-181 msec ~30 msec)
> ACL Data RX: Handle 486 flags 0x02 dlen 21                                                                        #146 8.896196
      SMP: Pairing Confirm (0x03) len 16
        Confim value: 0ee916012bce991f22ceffcecbb4a07f
zephyr.exe[2103283]: < HCI Command: Host Number of Completed Packets (0x03|0x0035) plen 5                           #147 8.915564
        Num handles: 1
        Handle: 486 Address: DF:A9:FF:F6:B1:1A (OUI DF-A9-FF)
        Count: 1
zephyr.exe[2103283]: < ACL Data TX: Handle 486 flags 0x00 dlen 21                                                   #148 8.915589
      SMP: Pairing Random (0x04) len 16
        Random value: 92f20f6ad8f13724432c7fd6001c45ff
> HCI Event: Number of Completed Packets (0x13) plen 5                                                              #149 8.946039
        Num handles: 1
        Handle: 486 Address: DF:A9:FF:F6:B1:1A (OUI DF-A9-FF)
        Count: 1
        #148: len 21 (5 Kb/s)
        Latency: 30 msec (30-181 msec ~30 msec)
> ACL Data RX: Handle 486 flags 0x02 dlen 21                                                                        #150 9.196202
      SMP: Pairing Random (0x04) len 16
        Random value: b277b9396cd32733795274950bde3851
zephyr.exe[2103283]: < HCI Command: Host Number of Completed Packets (0x03|0x0035) plen 5                           #151 9.215618
        Num handles: 1
        Handle: 486 Address: DF:A9:FF:F6:B1:1A (OUI DF-A9-FF)
        Count: 1
zephyr.exe[2103283]: < ACL Data TX: Handle 486 flags 0x00 dlen 21                                                   #152 9.215749
      SMP: Pairing Confirm (0x03) len 16
        Confim value: 644412dc3fa7800bbc97d290966c5c87
> HCI Event: Number of Completed Packets (0x13) plen 5                                                              #153 9.246018
        Num handles: 1
        Handle: 486 Address: DF:A9:FF:F6:B1:1A (OUI DF-A9-FF)
        Count: 1
        #152: len 21 (5 Kb/s)
        Latency: 30 msec (30-181 msec ~30 msec)
> ACL Data RX: Handle 486 flags 0x02 dlen 21                                                                        #154 9.296183
      SMP: Pairing Confirm (0x03) len 16
        Confim value: eb5d39a01b8f37359c36fb7ee8fef797
zephyr.exe[2103283]: < HCI Command: Host Number of Completed Packets (0x03|0x0035) plen 5                           #155 9.315295
        Num handles: 1
        Handle: 486 Address: DF:A9:FF:F6:B1:1A (OUI DF-A9-FF)
        Count: 1
zephyr.exe[2103283]: < ACL Data TX: Handle 486 flags 0x00 dlen 21                                                   #156 9.315421
      SMP: Pairing Random (0x04) len 16
        Random value: 23ac32ebbb5e14c8a6b9622f296d277f
> HCI Event: Number of Completed Packets (0x13) plen 5                                                              #157 9.346047
        Num handles: 1
        Handle: 486 Address: DF:A9:FF:F6:B1:1A (OUI DF-A9-FF)
        Count: 1
        #156: len 21 (5 Kb/s)
        Latency: 30 msec (30-181 msec ~30 msec)
> ACL Data RX: Handle 486 flags 0x02 dlen 21                                                                        #158 9.596194
      SMP: Pairing Random (0x04) len 16
        Random value: a0a1bb6bd84cade8633038fa7989810e
zephyr.exe[2103283]: < HCI Command: Host Number of Completed Packets (0x03|0x0035) plen 5                           #159 9.615734
        Num handles: 1
        Handle: 486 Address: DF:A9:FF:F6:B1:1A (OUI DF-A9-FF)
        Count: 1
zephyr.exe[2103283]: < ACL Data TX: Handle 486 flags 0x00 dlen 21                                                   #160 9.615863
      SMP: Pairing Confirm (0x03) len 16
        Confim value: 74404256f7dbb9de805b8612dd63d209
> HCI Event: Number of Completed Packets (0x13) plen 5                                                              #161 9.646039
        Num handles: 1
        Handle: 486 Address: DF:A9:FF:F6:B1:1A (OUI DF-A9-FF)
        Count: 1
        #160: len 21 (5 Kb/s)
        Latency: 30 msec (30-181 msec ~30 msec)
> ACL Data RX: Handle 486 flags 0x02 dlen 21                                                                        #162 9.696198
      SMP: Pairing Confirm (0x03) len 16
        Confim value: dd31a72a95b89e091c7b0823795f0dc8
zephyr.exe[2103283]: < HCI Command: Host Number of Completed Packets (0x03|0x0035) plen 5                           #163 9.715498
        Num handles: 1
        Handle: 486 Address: DF:A9:FF:F6:B1:1A (OUI DF-A9-FF)
        Count: 1
zephyr.exe[2103283]: < ACL Data TX: Handle 486 flags 0x00 dlen 21                                                   #164 9.715598
      SMP: Pairing Random (0x04) len 16
        Random value: 297efe85e67448a15f56bd27e3a3cf1d
> HCI Event: Number of Completed Packets (0x13) plen 5                                                              #165 9.746096
        Num handles: 1
        Handle: 486 Address: DF:A9:FF:F6:B1:1A (OUI DF-A9-FF)
        Count: 1
        #164: len 21 (5 Kb/s)
        Latency: 30 msec (30-181 msec ~30 msec)
> ACL Data RX: Handle 486 flags 0x02 dlen 21                                                                        #166 9.996086
      SMP: Pairing Random (0x04) len 16
        Random value: 711aa86a30bc92444500b093b1377800
zephyr.exe[2103283]: < HCI Command: Host Number of Completed Packets (0x03|0x0035) plen 5                          #167 10.015653
        Num handles: 1
        Handle: 486 Address: DF:A9:FF:F6:B1:1A (OUI DF-A9-FF)
        Count: 1
zephyr.exe[2103283]: < ACL Data TX: Handle 486 flags 0x00 dlen 21                                                  #168 10.015757
      SMP: Pairing Confirm (0x03) len 16
        Confim value: da00f273b9da3a370e35d3e83f9117f2
> HCI Event: Number of Completed Packets (0x13) plen 5                                                             #169 10.046011
        Num handles: 1
        Handle: 486 Address: DF:A9:FF:F6:B1:1A (OUI DF-A9-FF)
        Count: 1
        #168: len 21 (5 Kb/s)
        Latency: 30 msec (30-181 msec ~30 msec)
> ACL Data RX: Handle 486 flags 0x02 dlen 21                                                                       #170 10.096150
      SMP: Pairing Confirm (0x03) len 16
        Confim value: ac82b1628de7d569753e53aac3ccfec1
zephyr.exe[2103283]: < HCI Command: Host Number of Completed Packets (0x03|0x0035) plen 5                          #171 10.115623
        Num handles: 1
        Handle: 486 Address: DF:A9:FF:F6:B1:1A (OUI DF-A9-FF)
        Count: 1
zephyr.exe[2103283]: < ACL Data TX: Handle 486 flags 0x00 dlen 21                                                  #172 10.115795
      SMP: Pairing Random (0x04) len 16
        Random value: 25a9493fd3ce4faf02be7293595bb7c6
> HCI Event: Number of Completed Packets (0x13) plen 5                                                             #173 10.146025
        Num handles: 1
        Handle: 486 Address: DF:A9:FF:F6:B1:1A (OUI DF-A9-FF)
        Count: 1
        #172: len 21 (5 Kb/s)
        Latency: 30 msec (30-181 msec ~30 msec)
> ACL Data RX: Handle 486 flags 0x02 dlen 21                                                                       #174 10.396214
      SMP: Pairing Random (0x04) len 16
        Random value: 2a8b9ed6e9fce19606ccda6007200dd8
zephyr.exe[2103283]: < HCI Command: Host Number of Completed Packets (0x03|0x0035) plen 5                          #175 10.415712
        Num handles: 1
        Handle: 486 Address: DF:A9:FF:F6:B1:1A (OUI DF-A9-FF)
        Count: 1
zephyr.exe[2103283]: < ACL Data TX: Handle 486 flags 0x00 dlen 21                                                  #176 10.415793
      SMP: Pairing Confirm (0x03) len 16
        Confim value: f64ab9381e3dea02adf4b14bd1d6c398
> HCI Event: Number of Completed Packets (0x13) plen 5                                                             #177 10.446025
        Num handles: 1
        Handle: 486 Address: DF:A9:FF:F6:B1:1A (OUI DF-A9-FF)
        Count: 1
        #176: len 21 (5 Kb/s)
        Latency: 30 msec (30-181 msec ~30 msec)
> ACL Data RX: Handle 486 flags 0x02 dlen 21                                                                       #178 10.496087
      SMP: Pairing Confirm (0x03) len 16
        Confim value: a1541510dd316b41e1268d0ee009fdc5
zephyr.exe[2103283]: < HCI Command: Host Number of Completed Packets (0x03|0x0035) plen 5                          #179 10.515569
        Num handles: 1
        Handle: 486 Address: DF:A9:FF:F6:B1:1A (OUI DF-A9-FF)
        Count: 1
zephyr.exe[2103283]: < ACL Data TX: Handle 486 flags 0x00 dlen 21                                                  #180 10.515677
      SMP: Pairing Random (0x04) len 16
        Random value: 58f6b41f855a6f6c3560debd84e2affc
> HCI Event: Number of Completed Packets (0x13) plen 5                                                             #181 10.546060
        Num handles: 1
        Handle: 486 Address: DF:A9:FF:F6:B1:1A (OUI DF-A9-FF)
        Count: 1
        #180: len 21 (5 Kb/s)
        Latency: 30 msec (30-181 msec ~30 msec)
> ACL Data RX: Handle 486 flags 0x02 dlen 21                                                                       #182 10.796206
      SMP: Pairing Random (0x04) len 16
        Random value: 10ddf891b824e870c9ddf2a310bd6a89
zephyr.exe[2103283]: < HCI Command: Host Number of Completed Packets (0x03|0x0035) plen 5                          #183 10.815710
        Num handles: 1
        Handle: 486 Address: DF:A9:FF:F6:B1:1A (OUI DF-A9-FF)
        Count: 1
zephyr.exe[2103283]: < ACL Data TX: Handle 486 flags 0x00 dlen 21                                                  #184 10.815836
      SMP: Pairing Confirm (0x03) len 16
        Confim value: 712462670052588d1d1a825b29385010
> HCI Event: Number of Completed Packets (0x13) plen 5                                                             #185 10.846006
        Num handles: 1
        Handle: 486 Address: DF:A9:FF:F6:B1:1A (OUI DF-A9-FF)
        Count: 1
        #184: len 21 (5 Kb/s)
        Latency: 30 msec (30-181 msec ~30 msec)
> ACL Data RX: Handle 486 flags 0x02 dlen 21                                                                       #186 10.896141
      SMP: Pairing Confirm (0x03) len 16
        Confim value: f3175d6f680f3286389d84cd8e9dab4a
zephyr.exe[2103283]: < HCI Command: Host Number of Completed Packets (0x03|0x0035) plen 5                          #187 10.915578
        Num handles: 1
        Handle: 486 Address: DF:A9:FF:F6:B1:1A (OUI DF-A9-FF)
        Count: 1
zephyr.exe[2103283]: < ACL Data TX: Handle 486 flags 0x00 dlen 21                                                  #188 10.915744
      SMP: Pairing Random (0x04) len 16
        Random value: b67e7216d5bf664139eda2b542549666
> HCI Event: Number of Completed Packets (0x13) plen 5                                                             #189 10.946019
        Num handles: 1
        Handle: 486 Address: DF:A9:FF:F6:B1:1A (OUI DF-A9-FF)
        Count: 1
        #188: len 21 (5 Kb/s)
        Latency: 30 msec (30-181 msec ~30 msec)
> ACL Data RX: Handle 486 flags 0x02 dlen 21                                                                       #190 11.196189
      SMP: Pairing Random (0x04) len 16
        Random value: a83955bb928e33a4f3bb76dea2c7fe42
zephyr.exe[2103283]: < HCI Command: Host Number of Completed Packets (0x03|0x0035) plen 5                          #191 11.215729
        Num handles: 1
        Handle: 486 Address: DF:A9:FF:F6:B1:1A (OUI DF-A9-FF)
        Count: 1
zephyr.exe[2103283]: < ACL Data TX: Handle 486 flags 0x00 dlen 21                                                  #192 11.215896
      SMP: Pairing Confirm (0x03) len 16
        Confim value: 35673b85c675a1cc1e6af1164e7ae3e0
> HCI Event: Number of Completed Packets (0x13) plen 5                                                             #193 11.245935
        Num handles: 1
        Handle: 486 Address: DF:A9:FF:F6:B1:1A (OUI DF-A9-FF)
        Count: 1
        #192: len 21 (5 Kb/s)
        Latency: 30 msec (30-181 msec ~30 msec)
> ACL Data RX: Handle 486 flags 0x02 dlen 21                                                                       #194 11.296183
      SMP: Pairing Confirm (0x03) len 16
        Confim value: 493a5b4ee1311c06950926f7bf44e638
zephyr.exe[2103283]: < HCI Command: Host Number of Completed Packets (0x03|0x0035) plen 5                          #195 11.315639
        Num handles: 1
        Handle: 486 Address: DF:A9:FF:F6:B1:1A (OUI DF-A9-FF)
        Count: 1
zephyr.exe[2103283]: < ACL Data TX: Handle 486 flags 0x00 dlen 21                                                  #196 11.315875
      SMP: Pairing Random (0x04) len 16
        Random value: ed17f76500c95219dd01e09d1e63f87b
> HCI Event: Number of Completed Packets (0x13) plen 5                                                             #197 11.345994
        Num handles: 1
        Handle: 486 Address: DF:A9:FF:F6:B1:1A (OUI DF-A9-FF)
        Count: 1
        #196: len 21 (5 Kb/s)
        Latency: 30 msec (30-181 msec ~30 msec)
> ACL Data RX: Handle 486 flags 0x02 dlen 21                                                                       #198 11.596159
      SMP: Pairing Random (0x04) len 16
        Random value: b80890b5acd391422a2f22d0d1377574
zephyr.exe[2103283]: < HCI Command: Host Number of Completed Packets (0x03|0x0035) plen 5                          #199 11.615341
        Num handles: 1
        Handle: 486 Address: DF:A9:FF:F6:B1:1A (OUI DF-A9-FF)
        Count: 1
zephyr.exe[2103283]: < ACL Data TX: Handle 486 flags 0x00 dlen 21                                                  #200 11.615442
      SMP: Pairing Confirm (0x03) len 16
        Confim value: 8d32078a9d3823282b89d7da4103dcea
> HCI Event: Number of Completed Packets (0x13) plen 5                                                             #201 11.645948
        Num handles: 1
        Handle: 486 Address: DF:A9:FF:F6:B1:1A (OUI DF-A9-FF)
        Count: 1
        #200: len 21 (5 Kb/s)
        Latency: 30 msec (30-181 msec ~30 msec)
> ACL Data RX: Handle 486 flags 0x02 dlen 21                                                                       #202 11.696076
      SMP: Pairing Confirm (0x03) len 16
        Confim value: 933f3bd19006cd7f5d2ae8a2fe0c9718
zephyr.exe[2103283]: < HCI Command: Host Number of Completed Packets (0x03|0x0035) plen 5                          #203 11.715513
        Num handles: 1
        Handle: 486 Address: DF:A9:FF:F6:B1:1A (OUI DF-A9-FF)
        Count: 1
zephyr.exe[2103283]: < ACL Data TX: Handle 486 flags 0x00 dlen 21                                                  #204 11.715611
      SMP: Pairing Random (0x04) len 16
        Random value: 81d35d47e1f6006d79c974bd9d9e1ee3
> HCI Event: Number of Completed Packets (0x13) plen 5                                                             #205 11.745846
        Num handles: 1
        Handle: 486 Address: DF:A9:FF:F6:B1:1A (OUI DF-A9-FF)
        Count: 1
        #204: len 21 (5 Kb/s)
        Latency: 30 msec (30-181 msec ~30 msec)
> ACL Data RX: Handle 486 flags 0x02 dlen 21                                                                       #206 11.996159
      SMP: Pairing Random (0x04) len 16
        Random value: 43f3c7217acc0d9a5343f47af247bcd1
zephyr.exe[2103283]: < HCI Command: Host Number of Completed Packets (0x03|0x0035) plen 5                          #207 12.015696
        Num handles: 1
        Handle: 486 Address: DF:A9:FF:F6:B1:1A (OUI DF-A9-FF)
        Count: 1
zephyr.exe[2103283]: < ACL Data TX: Handle 486 flags 0x00 dlen 21                                                  #208 12.015786
      SMP: Pairing Confirm (0x03) len 16
        Confim value: 10c19c237939348877755da1c4fe2ea5
> HCI Event: Number of Completed Packets (0x13) plen 5                                                             #209 12.045814
        Num handles: 1
        Handle: 486 Address: DF:A9:FF:F6:B1:1A (OUI DF-A9-FF)
        Count: 1
        #208: len 21 (5 Kb/s)
        Latency: 30 msec (30-181 msec ~30 msec)
> ACL Data RX: Handle 486 flags 0x02 dlen 21                                                                       #210 12.096153
      SMP: Pairing Confirm (0x03) len 16
        Confim value: 2a2b63aa071bdbd4f72664ae52f0e541
zephyr.exe[2103283]: < HCI Command: Host Number of Completed Packets (0x03|0x0035) plen 5                          #211 12.115622
        Num handles: 1
        Handle: 486 Address: DF:A9:FF:F6:B1:1A (OUI DF-A9-FF)
        Count: 1
zephyr.exe[2103283]: < ACL Data TX: Handle 486 flags 0x00 dlen 21                                                  #212 12.115757
      SMP: Pairing Random (0x04) len 16
        Random value: e7f7e0c2476823e41736a7e381bafb7c
> HCI Event: Number of Completed Packets (0x13) plen 5                                                             #213 12.146104
        Num handles: 1
        Handle: 486 Address: DF:A9:FF:F6:B1:1A (OUI DF-A9-FF)
  