Bluetooth monitor ver 5.72
= Note: Linux version 6.14.0-36-generic (x86_64)                       0.978071
= Note: Bluetooth subsystem version 2.22                               0.978072
= New Index: 00:00:00:00:00:00 (Primary,UART,hci1)              [hci1] 0.978073
= New Index: 48:5F:99:8E:E0:64 (Primary,USB,hci0)               [hci0] 0.978073
= Open Index: 00:00:00:00:00:00                                 [hci1] 1.491687
= Index Info: 00:00:00:00:00:00 (Nordic Semiconductor ASA)      [hci1] 1.491701
@ USER Open: main (privileged) version 2.22            {0x0001} [hci1] 1.491709
< HCI Command: Reset (0x03|0x0003) plen 0                    #1 [hci1] 1.492769
> HCI Event: Command Complete (0x0e) plen 4                  #2 [hci1] 1.493400
      Reset (0x03|0x0003) ncmd 1
        Status: Success (0x00)
< HCI Command: Read Local Supported... (0x04|0x0003) plen 0  #3 [hci1] 1.511103
> HCI Event: Command Complete (0x0e) plen 12                 #4 [hci1] 1.511621
      Read Local Supported Features (0x04|0x0003) ncmd 1
        Status: Success (0x00)
        Features: 0x00 0x00 0x00 0x00 0x60 0x00 0x00 0x00
          BR/EDR Not Supported
          LE Supported (Controller)
< HCI Command: Read Local Version In.. (0x04|0x0001) plen 0  #5 [hci1] 1.531068
> HCI Event: Command Complete (0x0e) plen 12                 #6 [hci1] 1.531563
      Read Local Version Information (0x04|0x0001) ncmd 1
        Status: Success (0x00)
        HCI version: Reserved (0x0f) - Revision 12393 (0x3069)
        LMP version: Reserved (0x0f) - Subversion 12393 (0x3069)
        Manufacturer: Nordic Semiconductor ASA (89)
< HCI Command: Read Local Supported... (0x04|0x0002) plen 0  #7 [hci1] 1.551059
> HCI Event: Command Complete (0x0e) plen 68                 #8 [hci1] 1.552144
      Read Local Supported Commands (0x04|0x0002) ncmd 1
        Status: Success (0x00)
        Commands: 119 entries
          Disconnect (Octet 0 - Bit 5)
          Read Remote Version Information (Octet 2 - Bit 7)
          Set Event Mask (Octet 5 - Bit 6)
          Reset (Octet 5 - Bit 7)
          Read Connection Accept Timeout (Octet 7 - Bit 2)
          Write Connection Accept Timeout (Octet 7 - Bit 3)
          Read Transmit Power Level (Octet 10 - Bit 2)
          Set Controller To Host Flow Control (Octet 10 - Bit 5)
          Host Buffer Size (Octet 10 - Bit 6)
          Host Number of Completed Packets (Octet 10 - Bit 7)
          Read Local Version Information (Octet 14 - Bit 3)
          Read Local Supported Features (Octet 14 - Bit 5)
          Read BD ADDR (Octet 15 - Bit 1)
          Read RSSI (Octet 15 - Bit 5)
          Set Event Mask Page 2 (Octet 22 - Bit 2)
          LE Set Event Mask (Octet 25 - Bit 0)
          LE Read Buffer Size (Octet 25 - Bit 1)
          LE Read Local Supported Features (Octet 25 - Bit 2)
          LE Set Random Address (Octet 25 - Bit 4)
          LE Set Advertising Parameters (Octet 25 - Bit 5)
          LE Read Advertising Channel TX Power (Octet 25 - Bit 6)
          LE Set Advertising Data (Octet 25 - Bit 7)
          LE Set Scan Response Data (Octet 26 - Bit 0)
          LE Set Advertise Enable (Octet 26 - Bit 1)
          LE Set Scan Parameters (Octet 26 - Bit 2)
          LE Set Scan Enable (Octet 26 - Bit 3)
          LE Create Connection (Octet 26 - Bit 4)
          LE Create Connection Cancel (Octet 26 - Bit 5)
          LE Read Accept List Size (Octet 26 - Bit 6)
          LE Clear Accept List (Octet 26 - Bit 7)
          LE Add Device To Accept List (Octet 27 - Bit 0)
          LE Remove Device From Accept List (Octet 27 - Bit 1)
          LE Connection Update (Octet 27 - Bit 2)
          LE Set Host Channel Classification (Octet 27 - Bit 3)
          LE Read Channel Map (Octet 27 - Bit 4)
          LE Read Remote Used Features (Octet 27 - Bit 5)
          LE Encrypt (Octet 27 - Bit 6)
          LE Rand (Octet 27 - Bit 7)
          LE Start Encryption (Octet 28 - Bit 0)
          LE Long Term Key Request Reply (Octet 28 - Bit 1)
          LE Long Term Key Request Neg Reply (Octet 28 - Bit 2)
          LE Read Supported States (Octet 28 - Bit 3)
          LE Receiver Test (Octet 28 - Bit 4)
          LE Transmitter Test (Octet 28 - Bit 5)
          LE Test End (Octet 28 - Bit 6)
          Read Authenticated Payload Timeout (Octet 32 - Bit 4)
          Write Authenticated Payload Timeout (Octet 32 - Bit 5)
          LE Set Data Length (Octet 33 - Bit 6)
          LE Read Suggested Default Data Length (Octet 33 - Bit 7)
          LE Write Suggested Default Data Length (Octet 34 - Bit 0)
          LE Add Device To Resolving List (Octet 34 - Bit 3)
          LE Remove Device From Resolving List (Octet 34 - Bit 4)
          LE Clear Resolving List (Octet 34 - Bit 5)
          LE Read Resolving List Size (Octet 34 - Bit 6)
          LE Set Address Resolution Enable (Octet 35 - Bit 1)
          LE Set Resolvable Private Address Timeout (Octet 35 - Bit 2)
          LE Read Maximum Data Length (Octet 35 - Bit 3)
          LE Read PHY (Octet 35 - Bit 4)
          LE Set Default PHY (Octet 35 - Bit 5)
          LE Set PHY (Octet 35 - Bit 6)
          LE Enhanced Receiver Test (Octet 35 - Bit 7)
          LE Enhanced Transmitter Test (Octet 36 - Bit 0)
          LE Set Advertising Set Random Address (Octet 36 - Bit 1)
          LE Set Extended Advertising Parameters (Octet 36 - Bit 2)
          LE Set Extended Advertising Data (Octet 36 - Bit 3)
          LE Set Extended Scan Response Data (Octet 36 - Bit 4)
          LE Set Extended Advertising Enable (Octet 36 - Bit 5)
          LE Read Maximum Advertising Data Length (Octet 36 - Bit 6)
          LE Read Number of Supported Advertising Sets (Octet 36 - Bit 7)
          LE Remove Advertising Set (Octet 37 - Bit 0)
          LE Clear Advertising Sets (Octet 37 - Bit 1)
          LE Set Periodic Advertising Parameters (Octet 37 - Bit 2)
          LE Set Periodic Advertising Data (Octet 37 - Bit 3)
          LE Set Periodic Advertising Enable (Octet 37 - Bit 4)
          LE Set Extended Scan Parameters (Octet 37 - Bit 5)
          LE Set Extended Scan Enable (Octet 37 - Bit 6)
          LE Extended Create Connection (Octet 37 - Bit 7)
          LE Periodic Advertising Create Sync (Octet 38 - Bit 0)
          LE Periodic Advertising Create Sync Cancel (Octet 38 - Bit 1)
          LE Periodic Advertising Terminate Sync (Octet 38 - Bit 2)
          LE Add Device To Periodic Advertiser List (Octet 38 - Bit 3)
          LE Remove Device From Periodic Advertiser List (Octet 38 - Bit 4)
          LE Clear Periodic Advertiser List (Octet 38 - Bit 5)
          LE Read Periodic Advertiser List Size (Octet 38 - Bit 6)
          LE Read Transmit Power (Octet 38 - Bit 7)
          LE Read RF Path Compensation (Octet 39 - Bit 0)
          LE Write RF Path Compensation (Octet 39 - Bit 1)
          LE Set Privacy Mode (Octet 39 - Bit 2)
          LE Periodic Advertising Receive Enable (Octet 40 - Bit 5)
          LE Periodic Advertising Sync Transfer (Octet 40 - Bit 6)
          LE Periodic Advertising Set Info Transfer (Octet 40 - Bit 7)
          LE Periodic Advertising Sync Transfer Parameters (Octet 41 - Bit 0)
          LE Set Default Periodic Advertisng Sync Transfer Parameters (Octet 41 - Bit 1)
          LE Read Buffer v2 (Octet 41 - Bit 5)
          LE Read ISO TX Sync (Octet 41 - Bit 6)
          LE Set Connected Isochronous Group Parameters (Octet 41 - Bit 7)
          LE Set Connected Isochronous Group Parameters Test (Octet 42 - Bit 0)
          LE Create Connected Isochronous Stream (Octet 42 - Bit 1)
          LE Remove Connected Isochronous Group (Octet 42 - Bit 2)
          LE Accept Connected Isochronous Stream Request (Octet 42 - Bit 3)
          LE Reject Connected Isochronous Stream Request (Octet 42 - Bit 4)
          LE Create Broadcast Isochronous Group (Octet 42 - Bit 5)
          LE Create Broadcast Isochronous Group Test (Octet 42 - Bit 6)
          LE Terminate Broadcast Isochronous Group (Octet 42 - Bit 7)
          LE Broadcast Isochronous Group Create Sync (Octet 43 - Bit 0)
          LE Broadcast Isochronous Group Terminate Sync (Octet 43 - Bit 1)
          LE Request Peer SCA (Octet 43 - Bit 2)
          LE Setup Isochronous Data Path (Octet 43 - Bit 3)
          LE Remove Isochronous Data Path (Octet 43 - Bit 4)
          LE Isochronous Transmit Test (Octet 43 - Bit 5)
          LE Isochronous Receive Test (Octet 43 - Bit 6)
          LE Isochronous Read Test Counters (Octet 43 - Bit 7)
          LE Isochronous Read Test Counters (Octet 44 - Bit 0)
          LE Set Host Feature (Octet 44 - Bit 1)
          Octet 44 - Bit 2 
          Octet 45 - Bit 6 
          Octet 46 - Bit 0 
          Octet 46 - Bit 1 
          Octet 46 - Bit 2 
< HCI Command: Host Buffer Size (0x03|0x0033) plen 7         #9 [hci1] 1.571111
        ACL MTU: 255  ACL max packet: 16
        SCO MTU: 0    SCO max packet: 0
> HCI Event: Command Complete (0x0e) plen 4                 #10 [hci1] 1.571695
      Host Buffer Size (0x03|0x0033) ncmd 1
        Status: Success (0x00)
< HCI Command: Set Controller To Ho.. (0x03|0x0031) plen 1  #11 [hci1] 1.591082
        Flow control: ACL Data Packets (0x01)
> HCI Event: Command Complete (0x0e) plen 4                 #12 [hci1] 1.591622
      Set Controller To Host Flow Control (0x03|0x0031) ncmd 1
        Status: Success (0x00)
< HCI Command: LE Read Local Suppor.. (0x08|0x0003) plen 0  #13 [hci1] 1.611088
> HCI Event: Command Complete (0x0e) plen 12                #14 [hci1] 1.611594
      LE Read Local Supported Features (0x08|0x0003) ncmd 1
        Status: Success (0x00)
        Features: 0xfd 0x79 0x00 0xf7 0x30 0x01 0x00 0x00
          LE Encryption
          Extended Reject Indication
          Peripheral-initiated Features Exchange
          LE Ping
          LE Data Packet Length Extension
          LL Privacy
          Extended Scanner Filter Policies
          LE 2M PHY
          LE Coded PHY
          LE Extended Advertising
          LE Periodic Advertising
          Channel Selection Algorithm #2
          Periodic Advertising Sync Transfer - Sender
          Periodic Advertising Sync Transfer - Recipient
          Sleep Clock Accuracy Updates
          Connected Isochronous Stream - Central
          Connected Isochronous Stream - Peripheral
          Isochronous Broadcaster
          Synchronized Receiver
          Periodic Advertising ADI support
          Connection Subrating
          Unknown features (0x0000010000000000)
< HCI Command: LE Set Host Feature (0x08|0x0074) plen 2     #15 [hci1] 1.631085
        Bit Number: 32
          Connected Isochronous Stream (Host Support)
        Bit Value: 1
> HCI Event: Command Complete (0x0e) plen 4                 #16 [hci1] 1.631498
      LE Set Host Feature (0x08|0x0074) ncmd 1
        Status: Success (0x00)
< HCI Command: LE Read Buffer v2 (0x08|0x0060) plen 0       #17 [hci1] 1.651094
> HCI Event: Command Complete (0x0e) plen 10                #18 [hci1] 1.651609
      LE Read Buffer v2 (0x08|0x0060) ncmd 1
        Status: Success (0x00)
        ACL MTU: 27
        ACL max packet: 3
        ISO MTU: 318
        ISO max packet: 3
< HCI Command: LE Read Maximum Adve.. (0x08|0x003a) plen 0  #19 [hci1] 1.671103
> HCI Event: Command Complete (0x0e) plen 6                 #20 [hci1] 1.671537
      LE Read Maximum Advertising Data Length (0x08|0x003a) ncmd 1
        Status: Success (0x00)
        Max length: 1650
< HCI Command: LE Read Supported St.. (0x08|0x001c) plen 0  #21 [hci1] 1.691082
> HCI Event: Command Complete (0x0e) plen 12                #22 [hci1] 1.691614
      LE Read Supported States (0x08|0x001c) ncmd 1
        Status: Success (0x00)
        States: 0x000003ff3e0306ff
          Non-connectable Advertising State
          Scannable Advertising State
          Connectable Advertising State
          High Duty Cycle Directed Advertising State
          Passive Scanning State
          Active Scanning State
          Initiating State
            and Connection State (Central Role)
          Connection State (Peripheral Role)
          Scannable Advertising State
            and Passive Scanning State
          Connectable Advertising State
            and Passive Scanning State
          Non-connectable Advertising State
            and Initiating State
          Scannable Advertising State
            and Initiating State
          Active Scanning State
            and Connection State (Central Role)
          Passive Scanning State
            and Connection State (Peripheral Role)
          Active Scanning State
            and Connection State (Peripheral Role)
          Initiating State
            and Connection State (Central Role)
            and Central Role & Central Role
          Low Duty Cycle Directed Advertising State
          Connectable Advertising State
            and Initiating State
            and Central Role & Peripheral Role
          High Duty Cycle Directed Advertising State
            and Initiating State
            and Central Role & Peripheral Role
          Low Duty Cycle Directed Advertising State
            and Initiating State
            and Central Role & Peripheral Role
          Connectable Advertising State
            and Connection State (Central Role)
            and Central Role & Peripheral Role
          High Duty Cycle Directed Advertising State
            and Connection State (Central Role)
            and Central Role & Peripheral Role
          Low Duty Cycle Directed Advertising State
            and Connection State (Central Role)
            and Central Role & Peripheral Role
          Connectable Advertising State
            and Connection State (Peripheral Role)
            and Central Role & Peripheral Role
          High Duty Cycle Directed Advertising State
            and Connection State (Peripheral Role)
            and Peripheral Role & Peripheral Role
          Low Duty Cycle Directed Advertising State
            and Connection State (Peripheral Role)
            and Peripheral Role & Peripheral Role
          Initiating State
            and Connection State (Peripheral Role)
            and Central Role & Peripheral Role
< HCI Command: LE Read Maximum Data.. (0x08|0x002f) plen 0  #23 [hci1] 1.711076
> HCI Event: Command Complete (0x0e) plen 12                #24 [hci1] 1.711645
      LE Read Maximum Data Length (0x08|0x002f) ncmd 1
        Status: Success (0x00)
        Max TX octets: 251
        Max TX time: 2704
        Max RX octets: 251
        Max RX time: 2704
< HCI Command: LE Write Suggested D.. (0x08|0x0024) plen 4  #25 [hci1] 1.731072
        TX octets: 251
        TX time: 2704
> HCI Event: Command Complete (0x0e) plen 4                 #26 [hci1] 1.731505
      LE Write Suggested Default Data Length (0x08|0x0024) ncmd 1
        Status: Success (0x00)
< HCI Command: LE Set Resolvable Pr.. (0x08|0x002e) plen 2  #27 [hci1] 1.751089
        Timeout: 30 seconds
> HCI Event: Command Complete (0x0e) plen 4                 #28 [hci1] 1.751538
      LE Set Resolvable Private Address Timeout (0x08|0x002e) ncmd 1
        Status: Success (0x00)
< HCI Command: LE Read Resolving Li.. (0x08|0x002a) plen 0  #29 [hci1] 1.771073
> HCI Event: Command Complete (0x0e) plen 5                 #30 [hci1] 1.771577
      LE Read Resolving List Size (0x08|0x002a) ncmd 1
        Status: Success (0x00)
        Size: 8
< HCI Command: LE Set Event Mask (0x08|0x0001) plen 8       #31 [hci1] 1.791096
        Mask: 0x000002023f87fa5e
          LE Advertising Report
          LE Connection Update Complete
          LE Read Remote Used Features Complete
          LE Long Term Key Request
          LE Data Length Change
          LE Enhanced Connection Complete
          LE PHY Update Complete
          LE Extended Advertising Report
          LE Periodic Advertising Sync Established
          LE Periodic Advertising Report
          LE Periodic Advertising Sync Lost
          LE Extended Scan Timeout
          LE Extended Advertising Set Terminated
          LE Scan Request Received
          LE Periodic Advertising Sync Transfer Rvc
          LE CIS Established
          LE CIS Request
          LE Create BIG Complete
          LE Terminate BIG Complete
          LE BIG Sync Estabilished Complete
          LE BIG Sync Lost
          LE BIG Info Advertising Report
          Unknown mask (0x0000020000000000)
> HCI Event: Command Complete (0x0e) plen 4                 #32 [hci1] 1.791814
      LE Set Event Mask (0x08|0x0001) ncmd 1
        Status: Success (0x00)
< HCI Command: Set Event Mask (0x03|0x0001) plen 8          #33 [hci1] 1.811081
        Mask: 0x2000800002008890
          Disconnection Complete
          Encryption Change
          Read Remote Version Information Complete
          Hardware Error
          Data Buffer Overflow
          Encryption Key Refresh Complete
          LE Meta
> HCI Event: Command Complete (0x0e) plen 4                 #34 [hci1] 1.811629
      Set Event Mask (0x03|0x0001) ncmd 1
        Status: Success (0x00)
< HCI Command: Read BD ADDR (0x04|0x0009) plen 0            #35 [hci1] 1.831077
> HCI Event: Command Complete (0x0e) plen 10                #36 [hci1] 1.831568
      Read BD ADDR (0x04|0x0009) ncmd 1
        Status: Success (0x00)
        Address: 00:00:00:00:00:00 (OUI 00-00-00)
< HCI Command: LE Set Random Address (0x08|0x0005) plen 6   #37 [hci1] 1.851075
        Address: D5:B6:CC:31:DB:3B (Static)
> HCI Event: Command Complete (0x0e) plen 4                 #38 [hci1] 1.851549
      LE Set Random Address (0x08|0x0005) ncmd 1
        Status: Success (0x00)
< HCI Command: LE Set Random Address (0x08|0x0005) plen 6   #39 [hci1] 1.981106
        Address: 48:61:8E:DB:C6:F9 (Resolvable)
> HCI Event: Command Complete (0x0e) plen 4                 #40 [hci1] 1.981636
      LE Set Random Address (0x08|0x0005) ncmd 1
        Status: Success (0x00)
< HCI Command: LE Extended Create... (0x08|0x0043) plen 26  #41 [hci1] 7.001027
        Filter policy: Accept list is not used (0x00)
        Own address type: Random (0x03)
        Peer address type: Public (0x00)
        Peer address: DF:A9:FF:F6:B1:1A (OUI DF-A9-FF)
        Initiating PHYs: 0x01
        Entry 0: LE 1M
          Scan interval: 60.000 msec (0x0060)
          Scan window: 60.000 msec (0x0060)
          Min connection interval: 50.00 msec (0x0028)
          Max connection interval: 70.00 msec (0x0038)
          Connection latency: 0 (0x0000)
          Supervision timeout: 4000 msec (0x0190)
          Min connection length: 0.000 msec (0x0000)
          Max connection length: 0.000 msec (0x0000)
> HCI Event: Command Status (0x0f) plen 4                   #42 [hci1] 7.001971
      LE Extended Create Connection (0x08|0x0043) ncmd 1
        Status: Success (0x00)
> HCI Event: LE Meta Event (0x3e) plen 31                   #43 [hci1] 7.062367
      LE Enhanced Connection Complete (0x0a)
        Status: Success (0x00)
        Handle: 162
        Role: Central (0x00)
        Peer address type: Public (0x00)
        Peer address: DF:A9:FF:F6:B1:1A (OUI DF-A9-FF)
        Local resolvable private address: 48:61:8E:DB:C6:F9 (Resolvable)
        Peer resolvable private address: 00:00:00:00:00:00 (Non-Resolvable)
        Connection interval: 70.00 msec (0x0038)
        Connection latency: 0 (0x0000)
        Supervision timeout: 4000 msec (0x0190)
        Central clock accuracy: 0x00
< HCI Command: LE Read Remote Used... (0x08|0x0016) plen 2  #44 [hci1] 7.076404
        Handle: 162 Address: DF:A9:FF:F6:B1:1A (OUI DF-A9-FF)
< ACL Data TX: Handle 162 flags 0x00 dlen 7                 #45 [hci1] 7.076431
      ATT: Exchange MTU Request (0x02) len 2
        Client RX MTU: 251
> HCI Event: Command Status (0x0f) plen 4                   #46 [hci1] 7.076946
      LE Read Remote Used Features (0x08|0x0016) ncmd 1
        Status: Success (0x00)
< HCI Command: LE Set PHY (0x08|0x0032) plen 7              #47 [hci1] 7.090998
        Handle: 162 Address: DF:A9:FF:F6:B1:1A (OUI DF-A9-FF)
        All PHYs preference: 0x00
        TX PHYs preference: 0x02
          LE 2M
        RX PHYs preference: 0x02
          LE 2M
        PHY options preference: Reserved (0x0000)
> HCI Event: Command Status (0x0f) plen 4                   #48 [hci1] 7.091520
      LE Set PHY (0x08|0x0032) ncmd 1
        Status: Success (0x00)
> HCI Event: Number of Completed Packets (0x13) plen 5      #49 [hci1] 7.134627
        Num handles: 1
        Handle: 162 Address: DF:A9:FF:F6:B1:1A (OUI DF-A9-FF)
        Count: 1
        #45: len 7 (0 Kb/s)
        Latency: 58 msec (58-58 msec ~58 msec)
> HCI Event: LE Meta Event (0x3e) plen 12                   #50 [hci1] 7.274711
      LE Read Remote Used Features (0x04)
        Status: Success (0x00)
        Handle: 162 Address: DF:A9:FF:F6:B1:1A (OUI DF-A9-FF)
        Features: 0x2d 0x49 0x00 0xf7 0x67 0xd8 0x00 0x00
          LE Encryption
          Extended Reject Indication
          Peripheral-initiated Features Exchange
          LE Data Packet Length Extension
          LE 2M PHY
          LE Coded PHY
          Channel Selection Algorithm #2
          Periodic Advertising Sync Transfer - Sender
          Periodic Advertising Sync Transfer - Recipient
          Sleep Clock Accuracy Updates
          Connected Isochronous Stream - Central
          Connected Isochronous Stream - Peripheral
          Isochronous Broadcaster
          Synchronized Receiver
          Connected Isochronous Stream (Host Support)
          LE Power Control Request
          LE Power Control Request
          Connection Subrating
          Connection Subrating (Host Support)
          Unknown features (0x0000d80000000000)
> HCI Event: LE Meta Event (0x3e) plen 6                    #51 [hci1] 7.973968
      LE PHY Update Complete (0x0c)
        Status: Success (0x00)
        Handle: 162 Address: DF:A9:FF:F6:B1:1A (OUI DF-A9-FF)
        TX PHY: LE 2M (0x02)
        RX PHY: LE 2M (0x02)
> ACL Data RX: Handle 162 flags 0x02 dlen 6                 #52 [hci1] 8.114399
      SMP: Security Request (0x0b) len 1
        Authentication requirement: Bonding, No MITM, SC, No Keypresses (0x09)
> ACL Data RX: Handle 162 flags 0x02 dlen 7                 #53 [hci1] 8.114934
      ATT: Exchange MTU Response (0x03) len 2
        Server RX MTU: 23
< HCI Command: Host Number of Compl.. (0x03|0x0035) plen 5  #54 [hci1] 8.131232
        Num handles: 1
        Handle: 162 Address: DF:A9:FF:F6:B1:1A (OUI DF-A9-FF)
        Count: 1
< ACL Data TX: Handle 162 flags 0x00 dlen 11                #55 [hci1] 8.131328
      SMP: Pairing Request (0x01) len 6
        IO capability: NoInputNoOutput (0x03)
        OOB data: Authentication data not present (0x00)
        Authentication requirement: Bonding, No MITM, SC, No Keypresses (0x09)
        Max encryption key size: 16
        Initiator key distribution: EncKey IdKey (0x03)
        Responder key distribution: EncKey IdKey (0x03)
< HCI Command: Host Number of Compl.. (0x03|0x0035) plen 5  #56 [hci1] 8.131358
        Num handles: 1
        Handle: 162 Address: DF:A9:FF:F6:B1:1A (OUI DF-A9-FF)
        Count: 1
> HCI Event: Number of Completed Packets (0x13) plen 5      #57 [hci1] 8.184588
        Num handles: 1
        Handle: 162 Address: DF:A9:FF:F6:B1:1A (OUI DF-A9-FF)
        Count: 1
        #55: len 11 (1 Kb/s)
        Latency: 53 msec (53-58 msec ~55 msec)
> ACL Data RX: Handle 162 flags 0x02 dlen 11                #58 [hci1] 8.254631
      SMP: Pairing Response (0x02) len 6
        IO capability: KeyboardDisplay (0x04)
        OOB data: Authentication data not present (0x00)
        Authentication requirement: Bonding, No MITM, SC, No Keypresses (0x09)
        Max encryption key size: 16
        Initiator key distribution: EncKey IdKey (0x03)
        Responder key distribution: EncKey IdKey (0x03)
< HCI Command: Host Number of Compl.. (0x03|0x0035) plen 5  #59 [hci1] 8.271215
        Num handles: 1
        Handle: 162 Address: DF:A9:FF:F6:B1:1A (OUI DF-A9-FF)
        Count: 1
< ACL Data TX: Handle 162 flags 0x00 dlen 27                #60 [hci1] 8.271286
< ACL Data TX: Handle 162 flags 0x01 dlen 27                #61 [hci1] 8.271295
< ACL Data TX: Handle 162 flags 0x01 dlen 15                #62 [hci1] 8.271296
      SMP: Pairing Public Key (0x0c) len 64
        X: 68f6ada634ce84d11617383d57f070fe3445c38b33b569efa5eb771a0dc8aea5
        Y: 83c407aaa8337331fdc418e55085d75e6c1c6e5d42f8bf9c18fb5a2a7d4f31aa
> HCI Event: Number of Completed Packets (0x13) plen 5      #63 [hci1] 8.324580
        Num handles: 1
        Handle: 162 Address: DF:A9:FF:F6:B1:1A (OUI DF-A9-FF)
        Count: 1
        #60: len 27 (4 Kb/s)
        Latency: 53 msec (53-58 msec ~54 msec)
> HCI Event: Number of Completed Packets (0x13) plen 5      #64 [hci1] 8.325045
        Num handles: 1
        Handle: 162 Address: DF:A9:FF:F6:B1:1A (OUI DF-A9-FF)
        Count: 1
        #61: len 27 (4 Kb/s)
        Latency: 53 msec (53-58 msec ~54 msec)
> HCI Event: Number of Completed Packets (0x13) plen 5      #65 [hci1] 8.325482
        Num handles: 1
        Handle: 162 Address: DF:A9:FF:F6:B1:1A (OUI DF-A9-FF)
        Count: 1
        #62: len 15 (2 Kb/s)
        Latency: 54 msec (53-58 msec ~54 msec)
> ACL Data RX: Handle 162 flags 0x02 dlen 27                #66 [hci1] 8.394691
> ACL Data RX: Handle 162 flags 0x01 dlen 27                #67 [hci1] 8.395153
> ACL Data RX: Handle 162 flags 0x01 dlen 15                #68 [hci1] 8.395590
      SMP: Pairing Public Key (0x0c) len 64
        X: 6de24c909df0f572aea7cdf4517b1f50bc61f18436ebd4edef632b1c7ad93ca6
        Y: 2c234aa1e342ce77b808951f04e59b9c50540286620329894cbdb40cc056a959
> ACL Data RX: Handle 162 flags 0x02 dlen 21                #69 [hci1] 8.396084
      SMP: Pairing Confirm (0x03) len 16
        Confim value: e18f3def08be9adfb34d0fdd9b86d283
< HCI Command: Host Number of Compl.. (0x03|0x0035) plen 5  #70 [hci1] 8.411265
        Num handles: 1
        Handle: 162 Address: DF:A9:FF:F6:B1:1A (OUI DF-A9-FF)
        Count: 1
< HCI Command: Host Number of Compl.. (0x03|0x0035) plen 5  #71 [hci1] 8.411271
        Num handles: 1
        Handle: 162 Address: DF:A9:FF:F6:B1:1A (OUI DF-A9-FF)
        Count: 1
< HCI Command: Host Number of Compl.. (0x03|0x0035) plen 5  #72 [hci1] 8.411312
        Num handles: 1
        Handle: 162 Address: DF:A9:FF:F6:B1:1A (OUI DF-A9-FF)
        Count: 1
< HCI Command: Host Number of Compl.. (0x03|0x0035) plen 5  #73 [hci1] 8.411352
        Num handles: 1
        Handle: 162 Address: DF:A9:FF:F6:B1:1A (OUI DF-A9-FF)
        Count: 1
< ACL Data TX: Handle 162 flags 0x00 dlen 21                #74 [hci1] 8.411434
      SMP: Pairing Random (0x04) len 16
        Random value: 555cc64d02679f89a05211af56d8b3da
> HCI Event: Number of Completed Packets (0x13) plen 5      #75 [hci1] 8.464503
        Num handles: 1
        Handle: 162 Address: DF:A9:FF:F6:B1:1A (OUI DF-A9-FF)
        Count: 1
        #74: len 21 (3 Kb/s)
        Latency: 53 msec (53-58 msec ~53 msec)
> ACL Data RX: Handle 162 flags 0x02 dlen 21                #76 [hci1] 8.534732
      SMP: Pairing Random (0x04) len 16
        Random value: b38be277df4272ee0000000000000000
< HCI Command: Host Number of Compl.. (0x03|0x0035) plen 5  #77 [hci1] 8.551334
        Num handles: 1
        Handle: 162 Address: DF:A9:FF:F6:B1:1A (OUI DF-A9-FF)
        Count: 1
< ACL Data TX: Handle 162 flags 0x00 dlen 21                #78 [hci1] 8.551422
      SMP: Pairing DHKey Check (0x0d) len 16
        E: 4e785caf53084142a18005fe0007a316
> HCI Event: Number of Completed Packets (0x13) plen 5      #79 [hci1] 8.604541
        Num handles: 1
        Handle: 162 Address: DF:A9:FF:F6:B1:1A (OUI DF-A9-FF)
        Count: 1
        #78: len 21 (3 Kb/s)
        Latency: 53 msec (53-58 msec ~53 msec)
> ACL Data RX: Handle 162 flags 0x02 dlen 21                #80 [hci1] 8.814727
      SMP: Pairing DHKey Check (0x0d) len 16
        E: 2ffb9a08020c0314783c65bd334abc75
< HCI Command: LE Start Encryption (0x08|0x0019) plen 28    #81 [hci1] 8.831334
        Handle: 162 Address: DF:A9:FF:F6:B1:1A (OUI DF-A9-FF)
        Random number: 0x0000000000000000
        Encrypted diversifier: 0x0000
        Long term key: d7a9025e5a36b2523e0675f788d36e92
> HCI Event: Command Status (0x0f) plen 4                   #82 [hci1] 8.832211
      LE Start Encryption (0x08|0x0019) ncmd 1
        Status: Success (0x00)
< HCI Command: Host Number of Compl.. (0x03|0x0035) plen 5  #83 [hci1] 8.851126
        Num handles: 1
        Handle: 162 Address: DF:A9:FF:F6:B1:1A (OUI DF-A9-FF)
        Count: 1
> HCI Event: Encryption Change (0x08) plen 4                #84 [hci1] 9.304425
        Status: Success (0x00)
        Handle: 162 Address: DF:A9:FF:F6:B1:1A (OUI DF-A9-FF)
        Encryption: Enabled with AES-CCM (0x01)
> ACL Data RX: Handle 162 flags 0x02 dlen 21                #85 [hci1] 9.374733
      SMP: Identity Information (0x08) len 16
        Identity resolving key: 3d2b913b58a30c6356841a6becfd39a8
< HCI Command: Host Number of Compl.. (0x03|0x0035) plen 5  #86 [hci1] 9.391223
        Num handles: 1
        Handle: 162 Address: DF:A9:FF:F6:B1:1A (OUI DF-A9-FF)
        Count: 1
> ACL Data RX: Handle 162 flags 0x02 dlen 12                #87 [hci1] 9.444571
      SMP: Identity Address Information (0x09) len 7
        Address: DF:A9:FF:F6:B1:1A (OUI DF-A9-FF)
< HCI Command: LE Add Device To Re.. (0x08|0x0027) plen 39  #88 [hci1] 9.451304
        Address type: Public (0x00)
        Address: DF:A9:FF:F6:B1:1A (OUI DF-A9-FF)
        Peer identity resolving key: 3d2b913b58a30c6356841a6becfd39a8
        Local identity resolving key: 08aad2e1be87e47b88aeb19de6889efb
> HCI Event: Command Complete (0x0e) plen 4                 #89 [hci1] 9.452251
      LE Add Device To Resolving List (0x08|0x0027) ncmd 1
        Status: Success (0x00)
< HCI Command: LE Set Privacy Mode (0x08|0x004e) plen 8     #90 [hci1] 9.471196
        Peer Identity address type: Public (0x00)
        Peer Identity address: DF:A9:FF:F6:B1:1A (OUI DF-A9-FF)
        Privacy Mode: Use Device Privacy (0x01)
> HCI Event: Command Complete (0x0e) plen 4                 #91 [hci1] 9.471758
      LE Set Privacy Mode (0x08|0x004e) ncmd 1
        Status: Success (0x00)
< HCI Command: LE Set Address Resol.. (0x08|0x002d) plen 1  #92 [hci1] 9.491204
        Address resolution: Enabled (0x01)
> HCI Event: Command Complete (0x0e) plen 4                 #93 [hci1] 9.491727
      LE Set Address Resolution Enable (0x08|0x002d) ncmd 1
        Status: Success (0x00)
< HCI Command: Host Number of Compl.. (0x03|0x0035) plen 5  #94 [hci1] 9.511118
        Num handles: 1
        Handle: 162 Address: DF:A9:FF:F6:B1:1A (OUI DF-A9-FF)
        Count: 1
< HCI Command: LE Extended Create... (0x08|0x0043) plen 26  #95 [hci1] 9.511225
        Filter policy: Accept list is not used (0x00)
        Own address type: Random (0x03)
        Peer address type: Public (0x00)
        Peer address: 64:23:B5:94:C5:F1 (OUI 64-23-B5)
        Initiating PHYs: 0x01
        Entry 0: LE 1M
          Scan interval: 60.000 msec (0x0060)
          Scan window: 60.000 msec (0x0060)
          Min connection interval: 50.00 msec (0x0028)
          Max connection interval: 70.00 msec (0x0038)
          Connection latency: 0 (0x0000)
          Supervision timeout: 4000 msec (0x0190)
          Min connection length: 0.000 msec (0x0000)
          Max connection length: 0.000 msec (0x0000)
< ACL Data TX: Handle 162 flags 0x00 dlen 21                #96 [hci1] 9.511227
      SMP: Identity Information (0x08) len 16
        Identity resolving key: 08aad2e1be87e47b88aeb19de6889efb
< ACL Data TX: Handle 162 flags 0x00 dlen 12                #97 [hci1] 9.511227
      SMP: Identity Address Information (0x09) len 7
        Address: D5:B6:CC:31:DB:3B (Static)
> HCI Event: Command Status (0x0f) plen 4                   #98 [hci1] 9.512460
      LE Extended Create Connection (0x08|0x0043) ncmd 1
        Status: Success (0x00)
> HCI Event: Number of Completed Packets (0x13) plen 5      #99 [hci1] 9.514457
        Num handles: 1
        Handle: 162 Address: DF:A9:FF:F6:B1:1A (OUI DF-A9-FF)
        Count: 1
        #96: len 21 (56 Kb/s)
        Latency: 3 msec (3-58 msec ~28 msec)
> HCI Event: Number of Completed Packets (0x13) plen 5     #100 [hci1] 9.514925
        Num handles: 1
        Handle: 162 Address: DF:A9:FF:F6:B1:1A (OUI DF-A9-FF)
        Count: 1
        #97: len 12 (32 Kb/s)
        Latency: 3 msec (3-58 msec ~15 msec)
< ACL Data TX: Handle 162 flags 0x00 dlen 11               #101 [hci1] 9.531229
      ATT: Read By Type Request (0x08) len 6
        Handle range: 0x0001-0xffff
        Attribute type: Central Address Resolution (0x2aa6)
> HCI Event: Number of Completed Packets (0x13) plen 5     #102 [hci1] 9.584455
        Num handles: 1
        Handle: 162 Address: DF:A9:FF:F6:B1:1A (OUI DF-A9-FF)
        Count: 1
        #101: len 11 (1 Kb/s)
        Latency: 53 msec (3-58 msec ~34 msec)
> ACL Data RX: Handle 162 flags 0x02 dlen 9                #103 [hci1] 9.654706
      ATT: Read By Type Response (0x09) len 4
        Attribute data length: 3
        Attribute data list: 1 entry
        Handle: 0x000f
        Value: 01
< HCI Command: Host Number of Comp.. (0x03|0x0035) plen 5  #104 [hci1] 9.671265
        Num handles: 1
        Handle: 162 Address: DF:A9:FF:F6:B1:1A (OUI DF-A9-FF)
        Count: 1
> HCI Event: LE Meta Event (0x3e) plen 31                  #105 [hci1] 9.742508
      LE Enhanced Connection Complete (0x0a)
        Status: Success (0x00)
        Handle: 37
        Role: Central (0x00)
        Peer address type: Public (0x00)
        Peer address: 64:23:B5:94:C5:F1 (OUI 64-23-B5)
        Local resolvable private address: 48:61:8E:DB:C6:F9 (Resolvable)
          Identity type: Random (0x01)
          Identity: D5:B6:CC:31:DB:3B (Static)
        Peer resolvable private address: 00:00:00:00:00:00 (Non-Resolvable)
        Connection interval: 70.00 msec (0x0038)
        Connection latency: 0 (0x0000)
        Supervision timeout: 4000 msec (0x0190)
        Central clock accuracy: 0x00
< HCI Command: LE Read Remote Used.. (0x08|0x0016) plen 2  #106 [hci1] 9.751321
        Handle: 37 Address: 64:23:B5:94:C5:F1 (OUI 64-23-B5)
< ACL Data TX: Handle 37 flags 0x00 dlen 7                 #107 [hci1] 9.751338
      ATT: Exchange MTU Request (0x02) len 2
        Client RX MTU: 251
> HCI Event: Command Status (0x0f) plen 4                  #108 [hci1] 9.751848
      LE Read Remote Used Features (0x08|0x0016) ncmd 1
        Status: Success (0x00)
> HCI Event: Number of Completed Packets (0x13) plen 5     #109 [hci1] 9.754585
        Num handles: 1
        Handle: 37 Address: 64:23:B5:94:C5:F1 (OUI 64-23-B5)
        Count: 1
        #107: len 7 (18 Kb/s)
        Latency: 3 msec (3-3 msec ~3 msec)
< HCI Command: LE Set PHY (0x08|0x0032) plen 7             #110 [hci1] 9.771187
        Handle: 37 Address: 64:23:B5:94:C5:F1 (OUI 64-23-B5)
        All PHYs preference: 0x00
        TX PHYs preference: 0x02
          LE 2M
        RX PHYs preference: 0x02
          LE 2M
        PHY options preference: Reserved (0x0000)
> HCI Event: Command Status (0x0f) plen 4                  #111 [hci1] 9.771743
      LE Set PHY (0x08|0x0032) ncmd 1
        Status: Success (0x00)
> HCI Event: LE Meta Event (0x3e) plen 12                  #112 [hci1] 9.894588
      LE Read Remote Used Features (0x04)
        Status: Success (0x00)
        Handle: 37 Address: 64:23:B5:94:C5:F1 (OUI 64-23-B5)
        Features: 0x2d 0x49 0x00 0xf7 0x67 0xd8 0x00 0x00
          LE Encryption
          Extended Reject Indication
          Peripheral-initiated Features Exchange
          LE Data Packet Length Extension
          LE 2M PHY
          LE Coded PHY
          Channel Selection Algorithm #2
          Periodic Advertising Sync Transfer - Sender
          Periodic Advertising Sync Transfer - Recipient
          Sleep Clock Accuracy Updates
          Connected Isochronous Stream - Central
          Connected Isochronous Stream - Peripheral
          Isochronous Broadcaster
          Synchronized Receiver
          Connected Isochronous Stream (Host Support)
          LE Power Control Request
          LE Power Control Request
          Connection Subrating
          Connection Subrating (Host Support)
          Unknown features (0x0000d80000000000)
> HCI Event: LE Meta Event (0x3e) plen 6                  #113 [hci1] 10.593955
      LE PHY Update Complete (0x0c)
        Status: Success (0x00)
        Handle: 37 Address: 64:23:B5:94:C5:F1 (OUI 64-23-B5)
        TX PHY: LE 2M (0x02)
        RX PHY: LE 2M (0x02)
> ACL Data RX: Handle 37 flags 0x02 dlen 6                #114 [hci1] 10.804435
      SMP: Security Request (0x0b) len 1
        Authentication requirement: Bonding, No MITM, SC, No Keypresses (0x09)
> ACL Data RX: Handle 37 flags 0x02 dlen 7                #115 [hci1] 10.804821
      ATT: Exchange MTU Response (0x03) len 2
        Server RX MTU: 23
< HCI Command: Host Number of Com.. (0x03|0x0035) plen 5  #116 [hci1] 10.811259
        Num handles: 1
        Handle: 37 Address: 64:23:B5:94:C5:F1 (OUI 64-23-B5)
        Count: 1
< ACL Data TX: Handle 37 flags 0x00 dlen 11               #117 [hci1] 10.811266
      SMP: Pairing Request (0x01) len 6
        IO capability: NoInputNoOutput (0x03)
        OOB data: Authentication data not present (0x00)
        Authentication requirement: Bonding, No MITM, SC, No Keypresses (0x09)
        Max encryption key size: 16
        Initiator key distribution: EncKey IdKey (0x03)
        Responder key distribution: EncKey IdKey (0x03)
< HCI Command: Host Number of Com.. (0x03|0x0035) plen 5  #118 [hci1] 10.811277
        Num handles: 1
        Handle: 37 Address: 64:23:B5:94:C5:F1 (OUI 64-23-B5)
        Count: 1
> HCI Event: Number of Completed Packets (0x13) plen 5    #119 [hci1] 10.874504
        Num handles: 1
        Handle: 37 Address: 64:23:B5:94:C5:F1 (OUI 64-23-B5)
        Count: 1
        #117: len 11 (1 Kb/s)
        Latency: 63 msec (3-63 msec ~33 msec)
> ACL Data RX: Handle 37 flags 0x02 dlen 11               #120 [hci1] 10.944492
      SMP: Pairing Response (0x02) len 6
        IO capability: KeyboardDisplay (0x04)
        OOB data: Authentication data not present (0x00)
        Authentication requirement: Bonding, No MITM, SC, No Keypresses (0x09)
        Max encryption key size: 16
        Initiator key distribution: EncKey IdKey (0x03)
        Responder key distribution: EncKey IdKey (0x03)
< HCI Command: Host Number of Com.. (0x03|0x0035) plen 5  #121 [hci1] 10.951242
        Num handles: 1
        Handle: 37 Address: 64:23:B5:94:C5:F1 (OUI 64-23-B5)
        Count: 1
< ACL Data TX: Handle 37 flags 0x00 dlen 27               #122 [hci1] 10.951301
< ACL Data TX: Handle 37 flags 0x01 dlen 27               #123 [hci1] 10.951310
< ACL Data TX: Handle 37 flags 0x01 dlen 15               #124 [hci1] 10.951311
      SMP: Pairing Public Key (0x0c) len 64
        X: 68f6ada634ce84d11617383d57f070fe3445c38b33b569efa5eb771a0dc8aea5
        Y: 83c407aaa8337331fdc418e55085d75e6c1c6e5d42f8bf9c18fb5a2a7d4f31aa
> HCI Event: Number of Completed Packets (0x13) plen 5    #125 [hci1] 11.014429
        Num handles: 1
        Handle: 37 Address: 64:23:B5:94:C5:F1 (OUI 64-23-B5)
        Count: 1
        #122: len 27 (3 Kb/s)
        Latency: 63 msec (3-63 msec ~48 msec)
> HCI Event: Number of Completed Packets (0x13) plen 5    #126 [hci1] 11.014896
        Num handles: 1
        Handle: 37 Address: 64:23:B5:94:C5:F1 (OUI 64-23-B5)
        Count: 1
        #123: len 27 (3 Kb/s)
        Latency: 63 msec (3-63 msec ~55 msec)
> HCI Event: Number of Completed Packets (0x13) plen 5    #127 [hci1] 11.015457
        Num handles: 1
        Handle: 37 Address: 64:23:B5:94:C5:F1 (OUI 64-23-B5)
        Count: 1
        #124: len 15 (1 Kb/s)
        Latency: 64 msec (3-64 msec ~60 msec)
> ACL Data RX: Handle 37 flags 0x02 dlen 27               #128 [hci1] 11.084709
> ACL Data RX: Handle 37 flags 0x01 dlen 27               #129 [hci1] 11.085142
> ACL Data RX: Handle 37 flags 0x01 dlen 15               #130 [hci1] 11.085553
      SMP: Pairing Public Key (0x0c) len 64
        X: 744ac8c983de197b478babdd4d1d6caae88c182373d5556c1a517dc313c35f6d
        Y: 5170871f125b6e146342ea58d572abb5b40d28d4f2122c6bd8cf510a2569850d
< HCI Command: Host Number of Com.. (0x03|0x0035) plen 5  #131 [hci1] 11.091262
        Num handles: 1
        Handle: 37 Address: 64:23:B5:94:C5:F1 (OUI 64-23-B5)
        Count: 1
< HCI Command: Host Number of Com.. (0x03|0x0035) plen 5  #132 [hci1] 11.091270
        Num handles: 1
        Handle: 37 Address: 64:23:B5:94:C5:F1 (OUI 64-23-B5)
        Count: 1
< HCI Command: Host Number of Com.. (0x03|0x0035) plen 5  #133 [hci1] 11.091271
        Num handles: 1
        Handle: 37 Address: 64:23:B5:94:C5:F1 (OUI 64-23-B5)
        Count: 1
> ACL Data RX: Handle 37 flags 0x02 dlen 21               #134 [hci1] 11.154577
      SMP: Pairing Confirm (0x03) len 16
        Confim value: 74ceaf93d0370dd0e0916c07a5b5c1ca
< HCI Command: Host Number of Com.. (0x03|0x0035) plen 5  #135 [hci1] 11.171255
        Num handles: 1
        Handle: 37 Address: 64:23:B5:94:C5:F1 (OUI 64-23-B5)
        Count: 1
< ACL Data TX: Handle 37 flags 0x00 dlen 21               #136 [hci1] 11.171332
      SMP: Pairing Random (0x04) len 16
        Random value: 1ec8845e8286bc235a02440d0c3424a2
> HCI Event: Number of Completed Packets (0x13) plen 5    #137 [hci1] 11.224538
        Num handles: 1
        Handle: 37 Address: 64:23:B5:94:C5:F1 (OUI 64-23-B5)
        Count: 1
        #136: len 21 (3 Kb/s)
        Latency: 53 msec (3-64 msec ~56 msec)
> ACL Data RX: Handle 37 flags 0x02 dlen 21               #138 [hci1] 11.294563
      SMP: Pairing Random (0x04) len 16
        Random value: d18387a3aba3fd190000000000000000
< HCI Command: Host Number of Com.. (0x03|0x0035) plen 5  #139 [hci1] 11.311279
        Num handles: 1
        Handle: 37 Address: 64:23:B5:94:C5:F1 (OUI 64-23-B5)
        Count: 1
< ACL Data TX: Handle 37 flags 0x00 dlen 21               #140 [hci1] 11.311416
      SMP: Pairing DHKey Check (0x0d) len 16
        E: 0ce26258d389e2bd898caf428fbe9004
> HCI Event: Number of Completed Packets (0x13) plen 5    #141 [hci1] 11.364500
        Num handles: 1
        Handle: 37 Address: 64:23:B5:94:C5:F1 (OUI 64-23-B5)
        Count: 1
        #140: len 21 (3 Kb/s)
        Latency: 53 msec (3-64 msec ~54 msec)
> ACL Data RX: Handle 37 flags 0x02 dlen 21               #142 [hci1] 11.644605
      SMP: Pairing DHKey Check (0x0d) len 16
        E: 78567a99a4b7d3307c783abff355208a
< HCI Command: LE Start Encryption (0x08|0x0019) plen 28  #143 [hci1] 11.651309
        Handle: 37 Address: 64:23:B5:94:C5:F1 (OUI 64-23-B5)
        Random number: 0x0000000000000000
        Encrypted diversifier: 0x0000
        Long term key: dc192a03ad89978bbe04e832257529c4
> HCI Event: Command Status (0x0f) plen 4                 #144 [hci1] 11.652158
      LE Start Encryption (0x08|0x0019) ncmd 1
        Status: Success (0x00)
< HCI Command: Host Number of Com.. (0x03|0x0035) plen 5  #145 [hci1] 11.671175
        Num handles: 1
        Handle: 37 Address: 64:23:B5:94:C5:F1 (OUI 64-23-B5)
        Count: 1
> HCI Event: Encryption Change (0x08) plen 4              #146 [hci1] 12.134419
        Status: Success (0x00)
        Handle: 37 Address: 64:23:B5:94:C5:F1 (OUI 64-23-B5)
        Encryption: Enabled with AES-CCM (0x01)
> ACL Data RX: Handle 37 flags 0x02 dlen 21               #147 [hci1] 12.204636
      SMP: Identity Information (0x08) len 16
        Identity resolving key: 4ee476f0631ab1e5cf309fcf38c7aa7f
< HCI Command: Host Number of Com.. (0x03|0x0035) plen 5  #148 [hci1] 12.211158
        Num handles: 1
        Handle: 37 Address: 64:23:B5:94:C5:F1 (OUI 64-23-B5)
        Count: 1
> ACL Data RX: Handle 37 flags 0x02 dlen 12               #149 [hci1] 12.274458
      SMP: Identity Address Information (0x09) len 7
        Address: 64:23:B5:94:C5:F1 (OUI 64-23-B5)
< HCI Command: LE Set Address Res.. (0x08|0x002d) plen 1  #150 [hci1] 12.291293
        Address resolution: Disabled (0x00)
> HCI Event: Command Complete (0x0e) plen 4               #151 [hci1] 12.291718
      LE Set Address Resolution Enable (0x08|0x002d) ncmd 1
        Status: Success (0x00)
< HCI Command: LE Add Device To... (0x08|0x0027) plen 39  #152 [hci1] 12.311155
        Address type: Public (0x00)
        Address: 64:23:B5:94:C5:F1 (OUI 64-23-B5)
        Peer identity resolving key: 4ee476f0631ab1e5cf309fcf38c7aa7f
        Local identity resolving key: 08aad2e1be87e47b88aeb19de6889efb
> HCI Event: Command Complete (0x0e) plen 4               #153 [hci1] 12.312139
      LE Add Device To Resolving List (0x08|0x0027) ncmd 1
        Status: Success (0x00)
< HCI Command: LE Set Privacy Mode (0x08|0x004e) plen 8   #154 [hci1] 12.331163
        Peer Identity address type: Public (0x00)
        Peer Identity address: 64:23:B5:94:C5:F1 (OUI 64-23-B5)
        Privacy Mode: Use Device Privacy (0x01)
> HCI Event: Command Complete (0x0e) plen 4               #155 [hci1] 12.331742
      LE Set Privacy Mode (0x08|0x004e) ncmd 1
        Status: Success (0x00)
< HCI Command: LE Extended Creat.. (0x08|0x0043) plen 26  #156 [hci1] 12.351204
        Filter policy: Accept list is not used (0x00)
        Own address type: Random (0x03)
        Peer address type: Public (0x00)
        Peer address: B8:7C:99:F9:E0:AE (OUI B8-7C-99)
        Initiating PHYs: 0x01
        Entry 0: LE 1M
          Scan interval: 60.000 msec (0x0060)
          Scan window: 60.000 msec (0x0060)
          Min connection interval: 50.00 msec (0x0028)
          Max connection interval: 70.00 msec (0x0038)
          Connection latency: 0 (0x0000)
          Supervision timeout: 4000 msec (0x0190)
          Min connection length: 0.000 msec (0x0000)
          Max connection length: 0.000 msec (0x0000)
> HCI Event: Command Status (0x0f) plen 4                 #157 [hci1] 12.352414
      LE Extended Create Connection (0x08|0x0043) ncmd 1
        Status: Success (0x00)
< HCI Command: LE Set Address Res.. (0x08|0x002d) plen 1  #158 [hci1] 12.371272
        Address resolution: Enabled (0x01)
> HCI Event: Command Complete (0x0e) plen 4               #159 [hci1] 12.371748
      LE Set Address Resolution Enable (0x08|0x002d) ncmd 1
        Status: Command Disallowed (0x0c)
< HCI Command: Host Number of Com.. (0x03|0x0035) plen 5  #160 [hci1] 12.391207
        Num handles: 1
        Handle: 37 Address: 64:23:B5:94:C5:F1 (OUI 64-23-B5)
        Count: 1
< ACL Data TX: Handle 37 flags 0x00 dlen 21               #161 [hci1] 12.391275
      SMP: Identity Information (0x08) len 16
        Identity resolving key: 08aad2e1be87e47b88aeb19de6889efb
< ACL Data TX: Handle 37 flags 0x00 dlen 12               #162 [hci1] 12.391279
      SMP: Identity Address Information (0x09) len 7
        Address: D5:B6:CC:31:DB:3B (Static)
> HCI Event: LE Meta Event (0x3e) plen 31                 #163 [hci1] 12.403521
      LE Enhanced Connection Complete (0x0a)
        Status: Success (0x00)
        Handle: 38
        Role: Central (0x00)
        Peer address type: Public (0x00)
        Peer address: B8:7C:99:F9:E0:AE (OUI B8-7C-99)
        Local resolvable private address: 48:61:8E:DB:C6:F9 (Resolvable)
          Identity type: Random (0x01)
          Identity: D5:B6:CC:31:DB:3B (Static)
        Peer resolvable private address: 00:00:00:00:00:00 (Non-Resolvable)
        Connection interval: 70.00 msec (0x0038)
        Connection latency: 0 (0x0000)
        Supervision timeout: 4000 msec (0x0190)
        Central clock accuracy: 0x00
< HCI Command: LE Read Remote Use.. (0x08|0x0016) plen 2  #164 [hci1] 12.411280
        Handle: 38 Address: B8:7C:99:F9:E0:AE (OUI B8-7C-99)
< ACL Data TX: Handle 38 flags 0x00 dlen 7                #165 [hci1] 12.411287
      ATT: Exchange MTU Request (0x02) len 2
        Client RX MTU: 251
> HCI Event: Command Status (0x0f) plen 4                 #166 [hci1] 12.411846
      LE Read Remote Used Features (0x08|0x0016) ncmd 1
        Status: Success (0x00)
> HCI Event: Number of Completed Packets (0x13) plen 5    #167 [hci1] 12.414436
        Num handles: 1
        Handle: 37 Address: 64:23:B5:94:C5:F1 (OUI 64-23-B5)
        Count: 1
        #161: len 21 (7 Kb/s)
        Latency: 23 msec (3-64 msec ~39 msec)
> HCI Event: Number of Completed Packets (0x13) plen 5    #168 [hci1] 12.414866
        Num handles: 1
        Handle: 37 Address: 64:23:B5:94:C5:F1 (OUI 64-23-B5)
        Count: 1
        #162: len 12 (4 Kb/s)
        Latency: 23 msec (3-64 msec ~31 msec)
< HCI Command: LE Set PHY (0x08|0x0032) plen 7            #169 [hci1] 12.431243
        Handle: 38 Address: B8:7C:99:F9:E0:AE (OUI B8-7C-99)
        All PHYs preference: 0x00
        TX PHYs preference: 0x02
          LE 2M
        RX PHYs preference: 0x02
          LE 2M
        PHY options preference: Reserved (0x0000)
> HCI Event: Command Status (0x0f) plen 4                 #170 [hci1] 12.431805
      LE Set PHY (0x08|0x0032) ncmd 1
        Status: Success (0x00)
> HCI Event: Number of Completed Packets (0x13) plen 5    #171 [hci1] 12.444444
        Num handles: 1
        Handle: 38 Address: B8:7C:99:F9:E0:AE (OUI B8-7C-99)
        Count: 1
        #165: len 7 (1 Kb/s)
        Latency: 33 msec (33-33 msec ~33 msec)
< ACL Data TX: Handle 37 flags 0x00 dlen 11               #172 [hci1] 12.451282
      ATT: Read By Type Request (0x08) len 6
        Handle range: 0x000f-0xffff
        Attribute type: Central Address Resolution (0x2aa6)
> HCI Event: Number of Completed Packets (0x13) plen 5    #173 [hci1] 12.484421
        Num handles: 1
        Handle: 37 Address: 64:23:B5:94:C5:F1 (OUI 64-23-B5)
        Count: 1
        #172: len 11 (2 Kb/s)
        Latency: 33 msec (3-64 msec ~32 msec)
> ACL Data RX: Handle 38 flags 0x02 dlen 7                #174 [hci1] 12.514585
      ATT: Exchange MTU Response (0x03) len 2
        Server RX MTU: 23
< HCI Command: Host Number of Com.. (0x03|0x0035) plen 5  #175 [hci1] 12.531260
        Num handles: 1
        Handle: 38 Address: B8:7C:99:F9:E0:AE (OUI B8-7C-99)
        Count: 1
> ACL Data RX: Handle 37 flags 0x02 dlen 9                #176 [hci1] 12.554405
      ATT: Read By Type Response (0x09) len 4
        Attribute data length: 3
        Attribute data list: 1 entry
        Handle: 0x000f
        Value: 01
< HCI Command: Host Number of Com.. (0x03|0x0035) plen 5  #177 [hci1] 12.571313
        Num handles: 1
        Handle: 37 Address: 64:23:B5:94:C5:F1 (OUI 64-23-B5)
        Count: 1
> HCI Event: LE Meta Event (0x3e) plen 12                 #178 [hci1] 12.584534
      LE Read Remote Used Features (0x04)
        Status: Success (0x00)
        Handle: 38 Address: B8:7C:99:F9:E0:AE (OUI B8-7C-99)
        Features: 0x2d 0x49 0x00 0xf7 0x67 0xd8 0x00 0x00
          LE Encryption
          Extended Reject Indication
          Peripheral-initiated Features Exchange
          LE Data Packet Length Extension
          LE 2M PHY
          LE Coded PHY
          Channel Selection Algorithm #2
          Periodic Advertising Sync Transfer - Sender
          Periodic Advertising Sync Transfer - Recipient
          Sleep Clock Accuracy Updates
          Connected Isochronous Stream - Central
          Connected Isochronous Stream - Peripheral
          Isochronous Broadcaster
          Synchronized Receiver
          Connected Isochronous Stream (Host Support)
          LE Power Control Request
          LE Power Control Request
          Connection Subrating
          Connection Subrating (Host Support)
          Unknown features (0x0000d80000000000)
> HCI Event: LE Meta Event (0x3e) plen 6                  #179 [hci1] 13.283950
      LE PHY Update Complete (0x0c)
        Status: Success (0x00)
        Handle: 38 Address: B8:7C:99:F9:E0:AE (OUI B8-7C-99)
        TX PHY: LE 2M (0x02)
        RX PHY: LE 2M (0x02)
< ACL Data TX: Handle 38 flags 0x00 dlen 11               #180 [hci1] 22.551331
      SMP: Pairing Request (0x01) len 6
        IO capability: NoInputNoOutput (0x03)
        OOB data: Authentication data not present (0x00)
        Authentication requirement: Bonding, No MITM, SC, No Keypresses (0x09)
        Max encryption key size: 16
        Initiator key distribution: EncKey IdKey (0x03)
        Responder key distribution: EncKey IdKey (0x03)
> HCI Event: Number of Completed Packets (0x13) plen 5    #181 [hci1] 22.594211
        Num handles: 1
        Handle: 38 Address: B8:7C:99:F9:E0:AE (OUI B8-7C-99)
        Count: 1
        #180: len 11 (2 Kb/s)
        Latency: 42 msec (33-42 msec ~38 msec)
> ACL Data RX: Handle 38 flags 0x02 dlen 11               #182 [hci1] 22.664205
      SMP: Pairing Response (0x02) len 6
        IO capability: KeyboardDisplay (0x04)
        OOB data: Authentication data not present (0x00)
        Authentication requirement: Bonding, No MITM, SC, No Keypresses (0x09)
        Max encryption key size: 16
        Initiator key distribution: EncKey IdKey (0x03)
        Responder key distribution: EncKey IdKey (0x03)
< HCI Command: Host Number of Com.. (0x03|0x0035) plen 5  #183 [hci1] 22.671279
        Num handles: 1
        Handle: 38 Address: B8:7C:99:F9:E0:AE (OUI B8-7C-99)
        Count: 1
< ACL Data TX: Handle 38 flags 0x00 dlen 27               #184 [hci1] 22.671415
< ACL Data TX: Handle 38 flags 0x01 dlen 27               #185 [hci1] 22.671420
< ACL Data TX: Handle 38 flags 0x01 dlen 15               #186 [hci1] 22.671431
      SMP: Pairing Public Key (0x0c) len 64
        X: 68f6ada634ce84d11617383d57f070fe3445c38b33b569efa5eb771a0dc8aea5
        Y: 83c407aaa8337331fdc418e55085d75e6c1c6e5d42f8bf9c18fb5a2a7d4f31aa
> HCI Event: Number of Completed Packets (0x13) plen 5    #187 [hci1] 22.734195
        Num handles: 1
        Handle: 38 Address: B8:7C:99:F9:E0:AE (OUI B8-7C-99)
        Count: 1
        #184: len 27 (3 Kb/s)
        Latency: 62 msec (33-62 msec ~50 msec)
> HCI Event: Number of Completed Packets (0x13) plen 5    #188 [hci1] 22.734600
        Num handles: 1
        Handle: 38 Address: B8:7C:99:F9:E0:AE (OUI B8-7C-99)
        Count: 1
        #185: len 27 (3 Kb/s)
        Latency: 63 msec (33-63 msec ~56 msec)
> HCI Event: Number of Completed Packets (0x13) plen 5    #189 [hci1] 22.735097
        Num handles: 1
        Handle: 38 Address: B8:7C:99:F9:E0:AE (OUI B8-7C-99)
        Count: 1
        #186: len 15 (1 Kb/s)
        Latency: 63 msec (33-63 msec ~60 msec)
> ACL Data RX: Handle 38 flags 0x02 dlen 27               #190 [hci1] 22.804379
> ACL Data RX: Handle 38 flags 0x01 dlen 27               #191 [hci1] 22.804880
> ACL Data RX: Handle 38 flags 0x01 dlen 15               #192 [hci1] 22.805298
      SMP: Pairing Public Key (0x0c) len 64
        X: 06d90a4348d5fba0980f85e8c8e4785d0a15e8721fb4dd36da276081d370fb33
        Y: 191872da7d2164b611f39d592570b9c272b25864fb1e6ab944cec1bd3331c20f
< HCI Command: Host Number of Com.. (0x03|0x0035) plen 5  #193 [hci1] 22.811376
        Num handles: 1
        Handle: 38 Address: B8:7C:99:F9:E0:AE (OUI B8-7C-99)
        Count: 1
< HCI Command: Host Number of Com.. (0x03|0x0035) plen 5  #194 [hci1] 22.811467
        Num handles: 1
        Handle: 38 Address: B8:7C:99:F9:E0:AE (OUI B8-7C-99)
        Count: 1
< HCI Command: Host Number of Com.. (0x03|0x0035) plen 5  #195 [hci1] 22.811471
        Num handles: 1
        Handle: 38 Address: B8:7C:99:F9:E0:AE (OUI B8-7C-99)
        Count: 1
> ACL Data RX: Handle 38 flags 0x02 dlen 21               #196 [hci1] 22.874306
      SMP: Pairing Confirm (0x03) len 16
        Confim value: 271d2845550a1790613a20cc6e6a86c7
< HCI Command: Host Number of Com.. (0x03|0x0035) plen 5  #197 [hci1] 22.891268
        Num handles: 1
        Handle: 38 Address: B8:7C:99:F9:E0:AE (OUI B8-7C-99)
        Count: 1
< ACL Data TX: Handle 38 flags 0x00 dlen 21               #198 [hci1] 22.891333
      SMP: Pairing Random (0x04) len 16
        Random value: fd71a45c4a1bcadd27bd58e945097b00
> HCI Event: Number of Completed Packets (0x13) plen 5    #199 [hci1] 22.944186
        Num handles: 1
        Handle: 38 Address: B8:7C:99:F9:E0:AE (OUI B8-7C-99)
        Count: 1
        #198: len 21 (3 Kb/s)
        Latency: 52 msec (33-63 msec ~56 msec)
> ACL Data RX: Handle 38 flags 0x02 dlen 21               #200 [hci1] 23.014405
      SMP: Pairing Random (0x04) len 16
        Random value: c08375aae524dde40000000000000000
< HCI Command: Host Number of Com.. (0x03|0x0035) plen 5  #201 [hci1] 23.031357
        Num handles: 1
        Handle: 38 Address: B8:7C:99:F9:E0:AE (OUI B8-7C-99)
        Count: 1
< ACL Data TX: Handle 38 flags 0x00 dlen 21               #202 [hci1] 23.031364
      SMP: Pairing DHKey Check (0x0d) len 16
        E: 68e03370dd94b0439bfe7cd660ee17d7
> HCI Event: Number of Completed Packets (0x13) plen 5    #203 [hci1] 23.084234
        Num handles: 1
        Handle: 38 Address: B8:7C:99:F9:E0:AE (OUI B8-7C-99)
        Count: 1
        #202: len 21 (3 Kb/s)
        Latency: 52 msec (33-63 msec ~54 msec)
> ACL Data RX: Handle 38 flags 0x02 dlen 21               #204 [hci1] 23.364428
      SMP: Pairing DHKey Check (0x0d) len 16
        E: a7d3d0edae5b6babbdcf250defff992d
< HCI Command: LE Start Encryption (0x08|0x0019) plen 28  #205 [hci1] 23.371346
        Handle: 38 Address: B8:7C:99:F9:E0:AE (OUI B8-7C-99)
        Random number: 0x0000000000000000
        Encrypted diversifier: 0x0000
        Long term key: 7c9a1d27e26ea8e6ba5a44b1d543fdbb
> HCI Event: Command Status (0x0f) plen 4                 #206 [hci1] 23.372208
      LE Start Encryption (0x08|0x0019) ncmd 1
        Status: Success (0x00)
< HCI Command: Host Number of Com.. (0x03|0x0035) plen 5  #207 [hci1] 23.391280
        Num handles: 1
        Handle: 38 Address: B8:7C:99:F9:E0:AE (OUI B8-7C-99)
        Count: 1
> HCI Event: Encryption Change (0x08) plen 4              #208 [hci1] 23.854080
        Status: Success (0x00)
        Handle: 38 Address: B8:7C:99:F9:E0:AE (OUI B8-7C-99)
        Encryption: Enabled with AES-CCM (0x01)
> ACL Data RX: Handle 38 flags 0x02 dlen 21               #209 [hci1] 23.924468
      SMP: Identity Information (0x08) len 16
        Identity resolving key: ce32e4629a89e58305190016e4f44be5
< HCI Command: Host Number of Com.. (0x03|0x0035) plen 5  #210 [hci1] 23.931313
        Num handles: 1
        Handle: 38 Address: B8:7C:99:F9:E0:AE (OUI B8-7C-99)
        Count: 1
> ACL Data RX: Handle 38 flags 0x02 dlen 12               #211 [hci1] 23.994246
      SMP: Identity Address Information (0x09) len 7
        Address: B8:7C:99:F9:E0:AE (OUI B8-7C-99)
< HCI Command: LE Set Address Res.. (0x08|0x002d) plen 1  #212 [hci1] 24.011337
        Address resolution: Disabled (0x00)
> HCI Event: Command Complete (0x0e) plen 4               #213 [hci1] 24.011827
      LE Set Address Resolution Enable (0x08|0x002d) ncmd 1
        Status: Success (0x00)
