Bluetooth monitor ver 5.72
= Note: Linux version 6.14.0-36-generic (x86_64)                       0.645390
= Note: Bluetooth subsystem version 2.22                               0.645391
= New Index: 00:00:00:00:00:00 (Primary,UART,hci1)              [hci1] 0.645392
= New Index: 48:5F:99:8E:E0:64 (Primary,USB,hci0)               [hci0] 0.645392
= Open Index: 00:00:00:00:00:00                                 [hci1] 0.788829
= Index Info: 00:00:00:00:00:00 (Nordic Semiconductor ASA)      [hci1] 0.788840
@ USER Open: main (privileged) version 2.22            {0x0001} [hci1] 0.788846
< HCI Command: Reset (0x03|0x0003) plen 0                    #1 [hci1] 0.789664
> HCI Event: Command Complete (0x0e) plen 4                  #2 [hci1] 0.790130
      Reset (0x03|0x0003) ncmd 1
        Status: Success (0x00)
< HCI Command: Read Local Supported... (0x04|0x0003) plen 0  #3 [hci1] 0.808570
> HCI Event: Command Complete (0x0e) plen 12                 #4 [hci1] 0.809127
      Read Local Supported Features (0x04|0x0003) ncmd 1
        Status: Success (0x00)
        Features: 0x00 0x00 0x00 0x00 0x60 0x00 0x00 0x00
          BR/EDR Not Supported
          LE Supported (Controller)
< HCI Command: Read Local Version In.. (0x04|0x0001) plen 0  #5 [hci1] 0.828529
> HCI Event: Command Complete (0x0e) plen 12                 #6 [hci1] 0.829037
      Read Local Version Information (0x04|0x0001) ncmd 1
        Status: Success (0x00)
        HCI version: Reserved (0x0f) - Revision 12393 (0x3069)
        LMP version: Reserved (0x0f) - Subversion 12393 (0x3069)
        Manufacturer: Nordic Semiconductor ASA (89)
< HCI Command: Read Local Supported... (0x04|0x0002) plen 0  #7 [hci1] 0.848536
> HCI Event: Command Complete (0x0e) plen 68                 #8 [hci1] 0.849537
      Read Local Supported Commands (0x04|0x0002) ncmd 1
        Status: Success (0x00)
        Commands: 119 entries
          Disconnect (Octet 0 - Bit 5)
          Read Remote Version Information (Octet 2 - Bit 7)
          Set Event Mask (Octet 5 - Bit 6)
          Reset (Octet 5 - Bit 7)
          Read Connection Accept Timeout (Octet 7 - Bit 2)
          Write Connection Accept Timeout (Octet 7 - Bit 3)
          Read Transmit Power Level (Octet 10 - Bit 2)
          Set Controller To Host Flow Control (Octet 10 - Bit 5)
          Host Buffer Size (Octet 10 - Bit 6)
          Host Number of Completed Packets (Octet 10 - Bit 7)
          Read Local Version Information (Octet 14 - Bit 3)
          Read Local Supported Features (Octet 14 - Bit 5)
          Read BD ADDR (Octet 15 - Bit 1)
          Read RSSI (Octet 15 - Bit 5)
          Set Event Mask Page 2 (Octet 22 - Bit 2)
          LE Set Event Mask (Octet 25 - Bit 0)
          LE Read Buffer Size (Octet 25 - Bit 1)
          LE Read Local Supported Features (Octet 25 - Bit 2)
          LE Set Random Address (Octet 25 - Bit 4)
          LE Set Advertising Parameters (Octet 25 - Bit 5)
          LE Read Advertising Channel TX Power (Octet 25 - Bit 6)
          LE Set Advertising Data (Octet 25 - Bit 7)
          LE Set Scan Response Data (Octet 26 - Bit 0)
          LE Set Advertise Enable (Octet 26 - Bit 1)
          LE Set Scan Parameters (Octet 26 - Bit 2)
          LE Set Scan Enable (Octet 26 - Bit 3)
          LE Create Connection (Octet 26 - Bit 4)
          LE Create Connection Cancel (Octet 26 - Bit 5)
          LE Read Accept List Size (Octet 26 - Bit 6)
          LE Clear Accept List (Octet 26 - Bit 7)
          LE Add Device To Accept List (Octet 27 - Bit 0)
          LE Remove Device From Accept List (Octet 27 - Bit 1)
          LE Connection Update (Octet 27 - Bit 2)
          LE Set Host Channel Classification (Octet 27 - Bit 3)
          LE Read Channel Map (Octet 27 - Bit 4)
          LE Read Remote Used Features (Octet 27 - Bit 5)
          LE Encrypt (Octet 27 - Bit 6)
          LE Rand (Octet 27 - Bit 7)
          LE Start Encryption (Octet 28 - Bit 0)
          LE Long Term Key Request Reply (Octet 28 - Bit 1)
          LE Long Term Key Request Neg Reply (Octet 28 - Bit 2)
          LE Read Supported States (Octet 28 - Bit 3)
          LE Receiver Test (Octet 28 - Bit 4)
          LE Transmitter Test (Octet 28 - Bit 5)
          LE Test End (Octet 28 - Bit 6)
          Read Authenticated Payload Timeout (Octet 32 - Bit 4)
          Write Authenticated Payload Timeout (Octet 32 - Bit 5)
          LE Set Data Length (Octet 33 - Bit 6)
          LE Read Suggested Default Data Length (Octet 33 - Bit 7)
          LE Write Suggested Default Data Length (Octet 34 - Bit 0)
          LE Add Device To Resolving List (Octet 34 - Bit 3)
          LE Remove Device From Resolving List (Octet 34 - Bit 4)
          LE Clear Resolving List (Octet 34 - Bit 5)
          LE Read Resolving List Size (Octet 34 - Bit 6)
          LE Set Address Resolution Enable (Octet 35 - Bit 1)
          LE Set Resolvable Private Address Timeout (Octet 35 - Bit 2)
          LE Read Maximum Data Length (Octet 35 - Bit 3)
          LE Read PHY (Octet 35 - Bit 4)
          LE Set Default PHY (Octet 35 - Bit 5)
          LE Set PHY (Octet 35 - Bit 6)
          LE Enhanced Receiver Test (Octet 35 - Bit 7)
          LE Enhanced Transmitter Test (Octet 36 - Bit 0)
          LE Set Advertising Set Random Address (Octet 36 - Bit 1)
          LE Set Extended Advertising Parameters (Octet 36 - Bit 2)
          LE Set Extended Advertising Data (Octet 36 - Bit 3)
          LE Set Extended Scan Response Data (Octet 36 - Bit 4)
          LE Set Extended Advertising Enable (Octet 36 - Bit 5)
          LE Read Maximum Advertising Data Length (Octet 36 - Bit 6)
          LE Read Number of Supported Advertising Sets (Octet 36 - Bit 7)
          LE Remove Advertising Set (Octet 37 - Bit 0)
          LE Clear Advertising Sets (Octet 37 - Bit 1)
          LE Set Periodic Advertising Parameters (Octet 37 - Bit 2)
          LE Set Periodic Advertising Data (Octet 37 - Bit 3)
          LE Set Periodic Advertising Enable (Octet 37 - Bit 4)
          LE Set Extended Scan Parameters (Octet 37 - Bit 5)
          LE Set Extended Scan Enable (Octet 37 - Bit 6)
          LE Extended Create Connection (Octet 37 - Bit 7)
          LE Periodic Advertising Create Sync (Octet 38 - Bit 0)
          LE Periodic Advertising Create Sync Cancel (Octet 38 - Bit 1)
          LE Periodic Advertising Terminate Sync (Octet 38 - Bit 2)
          LE Add Device To Periodic Advertiser List (Octet 38 - Bit 3)
          LE Remove Device From Periodic Advertiser List (Octet 38 - Bit 4)
          LE Clear Periodic Advertiser List (Octet 38 - Bit 5)
          LE Read Periodic Advertiser List Size (Octet 38 - Bit 6)
          LE Read Transmit Power (Octet 38 - Bit 7)
          LE Read RF Path Compensation (Octet 39 - Bit 0)
          LE Write RF Path Compensation (Octet 39 - Bit 1)
          LE Set Privacy Mode (Octet 39 - Bit 2)
          LE Periodic Advertising Receive Enable (Octet 40 - Bit 5)
          LE Periodic Advertising Sync Transfer (Octet 40 - Bit 6)
          LE Periodic Advertising Set Info Transfer (Octet 40 - Bit 7)
          LE Periodic Advertising Sync Transfer Parameters (Octet 41 - Bit 0)
          LE Set Default Periodic Advertisng Sync Transfer Parameters (Octet 41 - Bit 1)
          LE Read Buffer v2 (Octet 41 - Bit 5)
          LE Read ISO TX Sync (Octet 41 - Bit 6)
          LE Set Connected Isochronous Group Parameters (Octet 41 - Bit 7)
          LE Set Connected Isochronous Group Parameters Test (Octet 42 - Bit 0)
          LE Create Connected Isochronous Stream (Octet 42 - Bit 1)
          LE Remove Connected Isochronous Group (Octet 42 - Bit 2)
          LE Accept Connected Isochronous Stream Request (Octet 42 - Bit 3)
          LE Reject Connected Isochronous Stream Request (Octet 42 - Bit 4)
          LE Create Broadcast Isochronous Group (Octet 42 - Bit 5)
          LE Create Broadcast Isochronous Group Test (Octet 42 - Bit 6)
          LE Terminate Broadcast Isochronous Group (Octet 42 - Bit 7)
          LE Broadcast Isochronous Group Create Sync (Octet 43 - Bit 0)
          LE Broadcast Isochronous Group Terminate Sync (Octet 43 - Bit 1)
          LE Request Peer SCA (Octet 43 - Bit 2)
          LE Setup Isochronous Data Path (Octet 43 - Bit 3)
          LE Remove Isochronous Data Path (Octet 43 - Bit 4)
          LE Isochronous Transmit Test (Octet 43 - Bit 5)
          LE Isochronous Receive Test (Octet 43 - Bit 6)
          LE Isochronous Read Test Counters (Octet 43 - Bit 7)
          LE Isochronous Read Test Counters (Octet 44 - Bit 0)
          LE Set Host Feature (Octet 44 - Bit 1)
          Octet 44 - Bit 2 
          Octet 45 - Bit 6 
          Octet 46 - Bit 0 
          Octet 46 - Bit 1 
          Octet 46 - Bit 2 
< HCI Command: Host Buffer Size (0x03|0x0033) plen 7         #9 [hci1] 0.868544
        ACL MTU: 255  ACL max packet: 16
        SCO MTU: 0    SCO max packet: 0
> HCI Event: Command Complete (0x0e) plen 4                 #10 [hci1] 0.869123
      Host Buffer Size (0x03|0x0033) ncmd 1
        Status: Success (0x00)
< HCI Command: Set Controller To Ho.. (0x03|0x0031) plen 1  #11 [hci1] 0.888544
        Flow control: ACL Data Packets (0x01)
> HCI Event: Command Complete (0x0e) plen 4                 #12 [hci1] 0.889033
      Set Controller To Host Flow Control (0x03|0x0031) ncmd 1
        Status: Success (0x00)
< HCI Command: LE Read Local Suppor.. (0x08|0x0003) plen 0  #13 [hci1] 0.908526
> HCI Event: Command Complete (0x0e) plen 12                #14 [hci1] 0.909040
      LE Read Local Supported Features (0x08|0x0003) ncmd 1
        Status: Success (0x00)
        Features: 0xfd 0x79 0x00 0xf7 0x30 0x01 0x00 0x00
          LE Encryption
          Extended Reject Indication
          Peripheral-initiated Features Exchange
          LE Ping
          LE Data Packet Length Extension
          LL Privacy
          Extended Scanner Filter Policies
          LE 2M PHY
          LE Coded PHY
          LE Extended Advertising
          LE Periodic Advertising
          Channel Selection Algorithm #2
          Periodic Advertising Sync Transfer - Sender
          Periodic Advertising Sync Transfer - Recipient
          Sleep Clock Accuracy Updates
          Connected Isochronous Stream - Central
          Connected Isochronous Stream - Peripheral
          Isochronous Broadcaster
          Synchronized Receiver
          Periodic Advertising ADI support
          Connection Subrating
          Unknown features (0x0000010000000000)
< HCI Command: LE Set Host Feature (0x08|0x0074) plen 2     #15 [hci1] 0.928530
        Bit Number: 32
          Connected Isochronous Stream (Host Support)
        Bit Value: 1
> HCI Event: Command Complete (0x0e) plen 4                 #16 [hci1] 0.928992
      LE Set Host Feature (0x08|0x0074) ncmd 1
        Status: Success (0x00)
< HCI Command: LE Read Buffer v2 (0x08|0x0060) plen 0       #17 [hci1] 0.948530
> HCI Event: Command Complete (0x0e) plen 10                #18 [hci1] 0.949140
      LE Read Buffer v2 (0x08|0x0060) ncmd 1
        Status: Success (0x00)
        ACL MTU: 27
        ACL max packet: 3
        ISO MTU: 318
        ISO max packet: 3
< HCI Command: LE Read Maximum Adve.. (0x08|0x003a) plen 0  #19 [hci1] 0.968591
> HCI Event: Command Complete (0x0e) plen 6                 #20 [hci1] 0.969057
      LE Read Maximum Advertising Data Length (0x08|0x003a) ncmd 1
        Status: Success (0x00)
        Max length: 1650
< HCI Command: LE Read Supported St.. (0x08|0x001c) plen 0  #21 [hci1] 0.988540
> HCI Event: Command Complete (0x0e) plen 12                #22 [hci1] 0.989031
      LE Read Supported States (0x08|0x001c) ncmd 1
        Status: Success (0x00)
        States: 0x000003ff3e0306ff
          Non-connectable Advertising State
          Scannable Advertising State
          Connectable Advertising State
          High Duty Cycle Directed Advertising State
          Passive Scanning State
          Active Scanning State
          Initiating State
            and Connection State (Central Role)
          Connection State (Peripheral Role)
          Scannable Advertising State
            and Passive Scanning State
          Connectable Advertising State
            and Passive Scanning State
          Non-connectable Advertising State
            and Initiating State
          Scannable Advertising State
            and Initiating State
          Active Scanning State
            and Connection State (Central Role)
          Passive Scanning State
            and Connection State (Peripheral Role)
          Active Scanning State
            and Connection State (Peripheral Role)
          Initiating State
            and Connection State (Central Role)
            and Central Role & Central Role
          Low Duty Cycle Directed Advertising State
          Connectable Advertising State
            and Initiating State
            and Central Role & Peripheral Role
          High Duty Cycle Directed Advertising State
            and Initiating State
            and Central Role & Peripheral Role
          Low Duty Cycle Directed Advertising State
            and Initiating State
            and Central Role & Peripheral Role
          Connectable Advertising State
            and Connection State (Central Role)
            and Central Role & Peripheral Role
          High Duty Cycle Directed Advertising State
            and Connection State (Central Role)
            and Central Role & Peripheral Role
          Low Duty Cycle Directed Advertising State
            and Connection State (Central Role)
            and Central Role & Peripheral Role
          Connectable Advertising State
            and Connection State (Peripheral Role)
            and Central Role & Peripheral Role
          High Duty Cycle Directed Advertising State
            and Connection State (Peripheral Role)
            and Peripheral Role & Peripheral Role
          Low Duty Cycle Directed Advertising State
            and Connection State (Peripheral Role)
            and Peripheral Role & Peripheral Role
          Initiating State
            and Connection State (Peripheral Role)
            and Central Role & Peripheral Role
< HCI Command: LE Read Maximum Data.. (0x08|0x002f) plen 0  #23 [hci1] 1.008532
> HCI Event: Command Complete (0x0e) plen 12                #24 [hci1] 1.009098
      LE Read Maximum Data Length (0x08|0x002f) ncmd 1
        Status: Success (0x00)
        Max TX octets: 251
        Max TX time: 2704
        Max RX octets: 251
        Max RX time: 2704
< HCI Command: LE Write Suggested D.. (0x08|0x0024) plen 4  #25 [hci1] 1.028553
        TX octets: 251
        TX time: 2704
> HCI Event: Command Complete (0x0e) plen 4                 #26 [hci1] 1.029140
      LE Write Suggested Default Data Length (0x08|0x0024) ncmd 1
        Status: Success (0x00)
< HCI Command: LE Read Resolving Li.. (0x08|0x002a) plen 0  #27 [hci1] 1.048527
> HCI Event: Command Complete (0x0e) plen 5                 #28 [hci1] 1.048998
      LE Read Resolving List Size (0x08|0x002a) ncmd 1
        Status: Success (0x00)
        Size: 8
< HCI Command: LE Set Host Feature (0x08|0x0074) plen 2     #29 [hci1] 1.068532
        Bit Number: 38
          Connection Subrating (Host Support)
        Bit Value: 1
> HCI Event: Command Complete (0x0e) plen 4                 #30 [hci1] 1.069001
      LE Set Host Feature (0x08|0x0074) ncmd 1
        Status: Success (0x00)
< HCI Command: LE Set Event Mask (0x08|0x0001) plen 8       #31 [hci1] 1.088546
        Mask: 0x000002063f87fa5e
          LE Advertising Report
          LE Connection Update Complete
          LE Read Remote Used Features Complete
          LE Long Term Key Request
          LE Data Length Change
          LE Enhanced Connection Complete
          LE PHY Update Complete
          LE Extended Advertising Report
          LE Periodic Advertising Sync Established
          LE Periodic Advertising Report
          LE Periodic Advertising Sync Lost
          LE Extended Scan Timeout
          LE Extended Advertising Set Terminated
          LE Scan Request Received
          LE Periodic Advertising Sync Transfer Rvc
          LE CIS Established
          LE CIS Request
          LE Create BIG Complete
          LE Terminate BIG Complete
          LE BIG Sync Estabilished Complete
          LE BIG Sync Lost
          LE BIG Info Advertising Report
          LE Subrate Change
          Unknown mask (0x0000020000000000)
> HCI Event: Command Complete (0x0e) plen 4                 #32 [hci1] 1.089084
      LE Set Event Mask (0x08|0x0001) ncmd 1
        Status: Success (0x00)
< HCI Command: Set Event Mask (0x03|0x0001) plen 8          #33 [hci1] 1.108540
        Mask: 0x2000800002008890
          Disconnection Complete
          Encryption Change
          Read Remote Version Information Complete
          Hardware Error
          Data Buffer Overflow
          Encryption Key Refresh Complete
          LE Meta
> HCI Event: Command Complete (0x0e) plen 4                 #34 [hci1] 1.109006
      Set Event Mask (0x03|0x0001) ncmd 1
        Status: Success (0x00)
< HCI Command: Read BD ADDR (0x04|0x0009) plen 0            #35 [hci1] 1.128547
> HCI Event: Command Complete (0x0e) plen 10                #36 [hci1] 1.129030
      Read BD ADDR (0x04|0x0009) ncmd 1
        Status: Success (0x00)
        Address: 00:00:00:00:00:00 (OUI 00-00-00)
< HCI Command: LE Set Random Address (0x08|0x0005) plen 6   #37 [hci1] 1.148518
        Address: D5:B6:CC:31:DB:3B (Static)
> HCI Event: Command Complete (0x0e) plen 4                 #38 [hci1] 1.149014
      LE Set Random Address (0x08|0x0005) ncmd 1
        Status: Success (0x00)
< HCI Command: LE Set Extended Adv.. (0x08|0x0036) plen 25  #39 [hci1] 3.729025
        Handle: 0x00
        Properties: 0x0013
          Connectable
          Scannable
          Use legacy advertising PDUs: ADV_IND
        Min advertising interval: 100.000 msec (0x00a0)
        Max advertising interval: 150.000 msec (0x00f0)
        Channel map: 37, 38, 39 (0x07)
        Own address type: Random (0x01)
        Peer address type: Public (0x00)
        Peer address: 00:00:00:00:00:00 (OUI 00-00-00)
        Filter policy: Allow Scan Request from Any, Allow Connect Request from Any (0x00)
        TX power: Host has no preference (0x7f)
        Primary PHY: LE 1M (0x01)
        Secondary max skip: 0x00
        Secondary PHY: LE 1M (0x01)
        SID: 0x00
        Scan request notifications: Disabled (0x00)
> HCI Event: Command Complete (0x0e) plen 5                 #40 [hci1] 3.729882
      LE Set Extended Advertising Parameters (0x08|0x0036) ncmd 1
        Status: Success (0x00)
        TX power (selected): 0 dbm (0x00)
< HCI Command: LE Set Advertising S.. (0x08|0x0035) plen 7  #41 [hci1] 3.748725
        Advertising handle: 0x00
        Advertising random address: D5:B6:CC:31:DB:3B (Static)
> HCI Event: Command Complete (0x0e) plen 4                 #42 [hci1] 3.749202
      LE Set Advertising Set Random Address (0x08|0x0035) ncmd 1
        Status: Success (0x00)
< HCI Command: LE Set Extended Adv.. (0x08|0x0037) plen 22  #43 [hci1] 3.768579
        Handle: 0x00
        Operation: Complete extended advertising data (0x03)
        Fragment preference: Minimize fragmentation (0x01)
        Data length: 0x12
        Flags: 0x06
          LE General Discoverable Mode
          BR/EDR Not Supported
        Name (complete): Tester_F6B11A
> HCI Event: Command Complete (0x0e) plen 4                 #44 [hci1] 3.769310
      LE Set Extended Advertising Data (0x08|0x0037) ncmd 1
        Status: Success (0x00)
< HCI Command: LE Set Extended Scan.. (0x08|0x0038) plen 4  #45 [hci1] 3.788536
        Handle: 0x00
        Operation: Complete scan response data (0x03)
        Fragment preference: Minimize fragmentation (0x01)
        Data length: 0x00
> HCI Event: Command Complete (0x0e) plen 4                 #46 [hci1] 3.789047
      LE Set Extended Scan Response Data (0x08|0x0038) ncmd 1
        Status: Success (0x00)
< HCI Command: LE Set Extended Adve.. (0x08|0x0039) plen 6  #47 [hci1] 3.808511
        Extended advertising: Enabled (0x01)
        Number of sets: 1 (0x01)
        Entry 0
          Handle: 0x00
          Duration: 0 ms (0x00)
          Max ext adv events: 0
> HCI Event: Command Complete (0x0e) plen 4                 #48 [hci1] 3.809128
      LE Set Extended Advertising Enable (0x08|0x0039) ncmd 1
        Status: Success (0x00)
> HCI Event: LE Meta Event (0x3e) plen 31                   #49 [hci1] 3.920157
      LE Enhanced Connection Complete (0x0a)
        Status: Success (0x00)
        Handle: 2883
        Role: Peripheral (0x01)
        Peer address type: Public (0x00)
        Peer address: DF:A9:FF:F6:B1:1A (OUI DF-A9-FF)
        Local resolvable private address: 00:00:00:00:00:00 (Non-Resolvable)
        Peer resolvable private address: 00:00:00:00:00:00 (Non-Resolvable)
        Connection interval: 87.50 msec (0x0046)
        Connection latency: 0 (0x0000)
        Supervision timeout: 25120 msec (0x09d0)
        Central clock accuracy: 0x01
> HCI Event: LE Meta Event (0x3e) plen 6                    #50 [hci1] 3.920161
      LE Advertising Set Terminated (0x12)
        Status: Success (0x00)
        Handle: 0
        Connection handle: 2883
        Number of completed extended advertising events: 0
< HCI Command: LE Read Remote Used... (0x08|0x0016) plen 2  #51 [hci1] 3.929018
        Handle: 2883 Address: DF:A9:FF:F6:B1:1A (OUI DF-A9-FF)
< ACL Data TX: Handle 2883 flags 0x00 dlen 7                #52 [hci1] 3.929035
      ATT: Exchange MTU Request (0x02) len 2
        Client RX MTU: 251
> HCI Event: Command Status (0x0f) plen 4                   #53 [hci1] 3.929566
      LE Read Remote Used Features (0x08|0x0016) ncmd 1
        Status: Success (0x00)
> HCI Event: Number of Completed Packets (0x13) plen 5      #54 [hci1] 4.095916
        Num handles: 1
        Handle: 2883 Address: DF:A9:FF:F6:B1:1A (OUI DF-A9-FF)
        Count: 1
        #52: len 7 (0 Kb/s)
        Latency: 166 msec (166-166 msec ~166 msec)
> HCI Event: LE Meta Event (0x3e) plen 12                   #55 [hci1] 4.183969
      LE Read Remote Used Features (0x04)
        Status: Success (0x00)
        Handle: 2883 Address: DF:A9:FF:F6:B1:1A (OUI DF-A9-FF)
        Features: 0x2d 0x49 0x00 0xf7 0x67 0xd9 0x00 0x80
          LE Encryption
          Extended Reject Indication
          Peripheral-initiated Features Exchange
          LE Data Packet Length Extension
          LE 2M PHY
          LE Coded PHY
          Channel Selection Algorithm #2
          Periodic Advertising Sync Transfer - Sender
          Periodic Advertising Sync Transfer - Recipient
          Sleep Clock Accuracy Updates
          Connected Isochronous Stream - Central
          Connected Isochronous Stream - Peripheral
          Isochronous Broadcaster
          Synchronized Receiver
          Connected Isochronous Stream (Host Support)
          LE Power Control Request
          LE Power Control Request
          Connection Subrating
          Connection Subrating (Host Support)
          Unknown features (0x8000d90000000000)
> ACL Data RX: Handle 2883 flags 0x02 dlen 11               #56 [hci1] 6.633586
      SMP: Pairing Request (0x01) len 6
        IO capability: KeyboardDisplay (0x04)
        OOB data: Authentication data not present (0x00)
        Authentication requirement: Bonding, MITM, SC, No Keypresses (0x0d)
        Max encryption key size: 16
        Initiator key distribution: EncKey IdKey (0x03)
        Responder key distribution: EncKey IdKey Sign (0x07)
> ACL Data RX: Handle 2883 flags 0x02 dlen 7                #57 [hci1] 6.634181
      ATT: Exchange MTU Response (0x03) len 2
        Server RX MTU: 23
< HCI Command: Host Number of Compl.. (0x03|0x0035) plen 5  #58 [hci1] 6.649172
        Num handles: 1
        Handle: 2883 Address: DF:A9:FF:F6:B1:1A (OUI DF-A9-FF)
        Count: 1
< ACL Data TX: Handle 2883 flags 0x00 dlen 11               #59 [hci1] 6.649333
      SMP: Pairing Response (0x02) len 6
        IO capability: DisplayOnly (0x00)
        OOB data: Authentication data not present (0x00)
        Authentication requirement: Bonding, No MITM, SC, No Keypresses (0x09)
        Max encryption key size: 16
        Initiator key distribution: IdKey (0x02)
        Responder key distribution: <none> (0x00)
< HCI Command: Host Number of Compl.. (0x03|0x0035) plen 5  #60 [hci1] 6.649636
        Num handles: 1
        Handle: 2883 Address: DF:A9:FF:F6:B1:1A (OUI DF-A9-FF)
        Count: 1
> HCI Event: Number of Completed Packets (0x13) plen 5      #61 [hci1] 6.808679
        Num handles: 1
        Handle: 2883 Address: DF:A9:FF:F6:B1:1A (OUI DF-A9-FF)
        Count: 1
        #59: len 11 (0 Kb/s)
        Latency: 159 msec (159-166 msec ~163 msec)
> ACL Data RX: Handle 2883 flags 0x02 dlen 27               #62 [hci1] 6.809066
> ACL Data RX: Handle 2883 flags 0x01 dlen 27               #63 [hci1] 6.809564
> ACL Data RX: Handle 2883 flags 0x01 dlen 15               #64 [hci1] 6.809982
      SMP: Pairing Public Key (0x0c) len 64
        X: 1a73ba4f32a28f495da4d49dded50fdfa713cac28b021f5e318af5c01830b4c5
        Y: d3cbbd644c8166e1b64f6cd356fcb81000d2d64b84d0170b535dff1d4c119343
< HCI Command: Host Number of Compl.. (0x03|0x0035) plen 5  #65 [hci1] 6.829316
        Num handles: 1
        Handle: 2883 Address: DF:A9:FF:F6:B1:1A (OUI DF-A9-FF)
        Count: 1
< HCI Command: Host Number of Compl.. (0x03|0x0035) plen 5  #66 [hci1] 6.829500
        Num handles: 1
        Handle: 2883 Address: DF:A9:FF:F6:B1:1A (OUI DF-A9-FF)
        Count: 1
< HCI Command: Host Number of Compl.. (0x03|0x0035) plen 5  #67 [hci1] 6.829808
        Num handles: 1
        Handle: 2883 Address: DF:A9:FF:F6:B1:1A (OUI DF-A9-FF)
        Count: 1
< ACL Data TX: Handle 2883 flags 0x00 dlen 27               #68 [hci1] 6.830417
< ACL Data TX: Handle 2883 flags 0x01 dlen 27               #69 [hci1] 6.830435
< ACL Data TX: Handle 2883 flags 0x01 dlen 15               #70 [hci1] 6.830439
      SMP: Pairing Public Key (0x0c) len 64
        X: 98308440221e2d910f0e54b71e7ec652857aa9b5a0dc65028824cc19db1226e9
        Y: 67a4816bcb62efb21701e31fdb27561a6217575fb007a8bbdabe7e28b6f68482
> HCI Event: Number of Completed Packets (0x13) plen 5      #71 [hci1] 6.896641
        Num handles: 1
        Handle: 2883 Address: DF:A9:FF:F6:B1:1A (OUI DF-A9-FF)
        Count: 1
        #68: len 27 (3 Kb/s)
        Latency: 66 msec (66-166 msec ~114 msec)
> HCI Event: Number of Completed Packets (0x13) plen 5      #72 [hci1] 6.897306
        Num handles: 1
        Handle: 2883 Address: DF:A9:FF:F6:B1:1A (OUI DF-A9-FF)
        Count: 1
        #69: len 27 (3 Kb/s)
        Latency: 66 msec (66-166 msec ~90 msec)
> HCI Event: Number of Completed Packets (0x13) plen 5      #73 [hci1] 6.983392
        Num handles: 1
        Handle: 2883 Address: DF:A9:FF:F6:B1:1A (OUI DF-A9-FF)
        Count: 1
        #70: len 15 (0 Kb/s)
        Latency: 152 msec (66-166 msec ~121 msec)
> ACL Data RX: Handle 2883 flags 0x02 dlen 21               #74 [hci1] 7.946300
      SMP: Pairing Confirm (0x03) len 16
        Confim value: f23345b924540edbe7cb66d33e59770d
< HCI Command: Host Number of Compl.. (0x03|0x0035) plen 5  #75 [hci1] 7.949231
        Num handles: 1
        Handle: 2883 Address: DF:A9:FF:F6:B1:1A (OUI DF-A9-FF)
        Count: 1
< ACL Data TX: Handle 2883 flags 0x00 dlen 21               #76 [hci1] 7.949385
      SMP: Pairing Confirm (0x03) len 16
        Confim value: 7fdfd550df2b9f803364426cb91e78db
> HCI Event: Number of Completed Packets (0x13) plen 5      #77 [hci1] 8.121282
        Num handles: 1
        Handle: 2883 Address: DF:A9:FF:F6:B1:1A (OUI DF-A9-FF)
        Count: 1
        #76: len 21 (0 Kb/s)
        Latency: 171 msec (66-171 msec ~146 msec)
> ACL Data RX: Handle 2883 flags 0x02 dlen 21               #78 [hci1] 8.121467
      SMP: Pairing Random (0x04) len 16
        Random value: e4087a9b7c75ab530000000000000000
< HCI Command: Host Number of Compl.. (0x03|0x0035) plen 5  #79 [hci1] 8.129238
        Num handles: 1
        Handle: 2883 Address: DF:A9:FF:F6:B1:1A (OUI DF-A9-FF)
        Count: 1
< ACL Data TX: Handle 2883 flags 0x00 dlen 21               #80 [hci1] 8.129328
      SMP: Pairing Random (0x04) len 16
        Random value: 8e6108f966a694cbe26df70bb96773e6
> HCI Event: Number of Completed Packets (0x13) plen 5      #81 [hci1] 8.295885
        Num handles: 1
        Handle: 2883 Address: DF:A9:FF:F6:B1:1A (OUI DF-A9-FF)
        Count: 1
        #80: len 21 (1 Kb/s)
        Latency: 166 msec (66-171 msec ~156 msec)
> ACL Data RX: Handle 2883 flags 0x02 dlen 21               #82 [hci1] 8.383798
      SMP: Pairing Confirm (0x03) len 16
        Confim value: 3ec0e27d1630177405560a4bcfc276a6
< HCI Command: Host Number of Compl.. (0x03|0x0035) plen 5  #83 [hci1] 8.389130
        Num handles: 1
        Handle: 2883 Address: DF:A9:FF:F6:B1:1A (OUI DF-A9-FF)
        Count: 1
< ACL Data TX: Handle 2883 flags 0x00 dlen 21               #84 [hci1] 8.389216
      SMP: Pairing Confirm (0x03) len 16
        Confim value: 875b9d9f2bc771320aeab5e20eaa2a13
> HCI Event: Number of Completed Packets (0x13) plen 5      #85 [hci1] 8.558607
        Num handles: 1
        Handle: 2883 Address: DF:A9:FF:F6:B1:1A (OUI DF-A9-FF)
        Count: 1
        #84: len 21 (0 Kb/s)
        Latency: 169 msec (66-171 msec ~163 msec)
> ACL Data RX: Handle 2883 flags 0x02 dlen 21               #86 [hci1] 8.558919
      SMP: Pairing Random (0x04) len 16
        Random value: 9401cf59eda776600000000000000000
< HCI Command: Host Number of Compl.. (0x03|0x0035) plen 5  #87 [hci1] 8.569333
        Num handles: 1
        Handle: 2883 Address: DF:A9:FF:F6:B1:1A (OUI DF-A9-FF)
        Count: 1
< ACL Data TX: Handle 2883 flags 0x00 dlen 21               #88 [hci1] 8.569408
      SMP: Pairing Random (0x04) len 16
        Random value: 4d02679f89a05211af56d8b3da64d21e
> HCI Event: Number of Completed Packets (0x13) plen 5      #89 [hci1] 8.733370
        Num handles: 1
        Handle: 2883 Address: DF:A9:FF:F6:B1:1A (OUI DF-A9-FF)
        Count: 1
        #88: len 21 (1 Kb/s)
        Latency: 163 msec (66-171 msec ~163 msec)
> ACL Data RX: Handle 2883 flags 0x02 dlen 21               #90 [hci1] 8.821223
      SMP: Pairing Confirm (0x03) len 16
        Confim value: 8ace592dd67373d966e8c0c9c8644f89
< HCI Command: Host Number of Compl.. (0x03|0x0035) plen 5  #91 [hci1] 8.828984
        Num handles: 1
        Handle: 2883 Address: DF:A9:FF:F6:B1:1A (OUI DF-A9-FF)
        Count: 1
< ACL Data TX: Handle 2883 flags 0x00 dlen 21               #92 [hci1] 8.829106
      SMP: Pairing Confirm (0x03) len 16
        Confim value: e102a7362a886b6bbe8888441ba48214
> HCI Event: Number of Completed Packets (0x13) plen 5      #93 [hci1] 8.996113
        Num handles: 1
        Handle: 2883 Address: DF:A9:FF:F6:B1:1A (OUI DF-A9-FF)
        Count: 1
        #92: len 21 (1 Kb/s)
        Latency: 167 msec (66-171 msec ~165 msec)
> ACL Data RX: Handle 2883 flags 0x02 dlen 21               #94 [hci1] 8.996473
      SMP: Pairing Random (0x04) len 16
        Random value: 22dedd68743c036c0000000000000000
< HCI Command: Host Number of Compl.. (0x03|0x0035) plen 5  #95 [hci1] 9.008799
        Num handles: 1
        Handle: 2883 Address: DF:A9:FF:F6:B1:1A (OUI DF-A9-FF)
        Count: 1
< ACL Data TX: Handle 2883 flags 0x00 dlen 21               #96 [hci1] 9.008829
      SMP: Pairing Random (0x04) len 16
        Random value: 5e8286bc235a02440d0c3424a2acf8fd
> HCI Event: Number of Completed Packets (0x13) plen 5      #97 [hci1] 9.170902
        Num handles: 1
        Handle: 2883 Address: DF:A9:FF:F6:B1:1A (OUI DF-A9-FF)
        Count: 1
        #96: len 21 (1 Kb/s)
        Latency: 162 msec (66-171 msec ~163 msec)
> ACL Data RX: Handle 2883 flags 0x02 dlen 21               #98 [hci1] 9.258709
      SMP: Pairing Confirm (0x03) len 16
        Confim value: 1dba18d0ad08456c9623a0add1268a20
< HCI Command: Host Number of Compl.. (0x03|0x0035) plen 5  #99 [hci1] 9.269044
        Num handles: 1
        Handle: 2883 Address: DF:A9:FF:F6:B1:1A (OUI DF-A9-FF)
        Count: 1
< ACL Data TX: Handle 2883 flags 0x00 dlen 21              #100 [hci1] 9.269151
      SMP: Pairing Confirm (0x03) len 16
        Confim value: 4aab0fdfc2264c860205314389713c23
> HCI Event: Number of Completed Packets (0x13) plen 5     #101 [hci1] 9.433591
        Num handles: 1
        Handle: 2883 Address: DF:A9:FF:F6:B1:1A (OUI DF-A9-FF)
        Count: 1
        #100: len 21 (1 Kb/s)
        Latency: 164 msec (66-171 msec ~164 msec)
> ACL Data RX: Handle 2883 flags 0x02 dlen 21              #102 [hci1] 9.433983
      SMP: Pairing Random (0x04) len 16
        Random value: af9869fd63f863560000000000000000
< HCI Command: Host Number of Comp.. (0x03|0x0035) plen 5  #103 [hci1] 9.449314
        Num handles: 1
        Handle: 2883 Address: DF:A9:FF:F6:B1:1A (OUI DF-A9-FF)
        Count: 1
< ACL Data TX: Handle 2883 flags 0x00 dlen 21              #104 [hci1] 9.449400
      SMP: Pairing Random (0x04) len 16
        Random value: 5c4a1bcadd27bd58e945097b00bad7ac
> HCI Event: Number of Completed Packets (0x13) plen 5     #105 [hci1] 9.608389
        Num handles: 1
        Handle: 2883 Address: DF:A9:FF:F6:B1:1A (OUI DF-A9-FF)
        Count: 1
        #104: len 21 (1 Kb/s)
        Latency: 158 msec (66-171 msec ~161 msec)
> ACL Data RX: Handle 2883 flags 0x02 dlen 21              #106 [hci1] 9.696288
      SMP: Pairing Confirm (0x03) len 16
        Confim value: e6ee908378b240234a739bfdc34ea166
< HCI Command: Host Number of Comp.. (0x03|0x0035) plen 5  #107 [hci1] 9.708695
        Num handles: 1
        Handle: 2883 Address: DF:A9:FF:F6:B1:1A (OUI DF-A9-FF)
        Count: 1
< ACL Data TX: Handle 2883 flags 0x00 dlen 21              #108 [hci1] 9.708743
      SMP: Pairing Confirm (0x03) len 16
        Confim value: 163ca0ca71674feedc202f515e4d6253
> HCI Event: Number of Completed Packets (0x13) plen 5     #109 [hci1] 9.871109
        Num handles: 1
        Handle: 2883 Address: DF:A9:FF:F6:B1:1A (OUI DF-A9-FF)
        Count: 1
        #108: len 21 (1 Kb/s)
        Latency: 162 msec (66-171 msec ~161 msec)
> ACL Data RX: Handle 2883 flags 0x02 dlen 21              #110 [hci1] 9.871471
      SMP: Pairing Random (0x04) len 16
        Random value: 5607e90b023425340000000000000000
< HCI Command: Host Number of Comp.. (0x03|0x0035) plen 5  #111 [hci1] 9.889323
        Num handles: 1
        Handle: 2883 Address: DF:A9:FF:F6:B1:1A (OUI DF-A9-FF)
        Count: 1
< ACL Data TX: Handle 2883 flags 0x00 dlen 21              #112 [hci1] 9.889351
      SMP: Pairing Random (0x04) len 16
        Random value: 32527e6e64e79f33b2e374394db8ab2d
> HCI Event: Number of Completed Packets (0x13) plen 5    #113 [hci1] 10.045917
        Num handles: 1
        Handle: 2883 Address: DF:A9:FF:F6:B1:1A (OUI DF-A9-FF)
        Count: 1
        #112: len 21 (1 Kb/s)
        Latency: 156 msec (66-171 msec ~159 msec)
> ACL Data RX: Handle 2883 flags 0x02 dlen 21             #114 [hci1] 10.133714
      SMP: Pairing Confirm (0x03) len 16
        Confim value: 78d570e662425446a6bc015eaab8fe1e
< HCI Command: Host Number of Com.. (0x03|0x0035) plen 5  #115 [hci1] 10.149152
        Num handles: 1
        Handle: 2883 Address: DF:A9:FF:F6:B1:1A (OUI DF-A9-FF)
        Count: 1
< ACL Data TX: Handle 2883 flags 0x00 dlen 21             #116 [hci1] 10.149236
      SMP: Pairing Confirm (0x03) len 16
        Confim value: e5d9ab4b8185a0097ee174136e5e2557
> HCI Event: Number of Completed Packets (0x13) plen 5    #117 [hci1] 10.308565
        Num handles: 1
        Handle: 2883 Address: DF:A9:FF:F6:B1:1A (OUI DF-A9-FF)
        Count: 1
        #116: len 21 (1 Kb/s)
        Latency: 159 msec (66-171 msec ~159 msec)
> ACL Data RX: Handle 2883 flags 0x02 dlen 21             #118 [hci1] 10.308918
      SMP: Pairing Random (0x04) len 16
        Random value: 8ee3cbe7292652020000000000000000
< HCI Command: Host Number of Com.. (0x03|0x0035) plen 5  #119 [hci1] 10.329125
        Num handles: 1
        Handle: 2883 Address: DF:A9:FF:F6:B1:1A (OUI DF-A9-FF)
        Count: 1
< ACL Data TX: Handle 2883 flags 0x00 dlen 21             #120 [hci1] 10.329141
      SMP: Pairing Random (0x04) len 16
        Random value: dddbdfe2838e9a8cc6964353c850fef7
> HCI Event: Number of Completed Packets (0x13) plen 5    #121 [hci1] 10.483391
        Num handles: 1
        Handle: 2883 Address: DF:A9:FF:F6:B1:1A (OUI DF-A9-FF)
        Count: 1
        #120: len 21 (1 Kb/s)
        Latency: 154 msec (66-171 msec ~156 msec)
> ACL Data RX: Handle 2883 flags 0x02 dlen 21             #122 [hci1] 10.571217
      SMP: Pairing Confirm (0x03) len 16
        Confim value: 1b7bc78fd80602522e37e288d148e01c
< HCI Command: Host Number of Com.. (0x03|0x0035) plen 5  #123 [hci1] 10.589202
        Num handles: 1
        Handle: 2883 Address: DF:A9:FF:F6:B1:1A (OUI DF-A9-FF)
        Count: 1
< ACL Data TX: Handle 2883 flags 0x00 dlen 21             #124 [hci1] 10.589313
      SMP: Pairing Confirm (0x03) len 16
        Confim value: 794038f9753d611db0c8d27cf4c12c13
> HCI Event: Number of Completed Packets (0x13) plen 5    #125 [hci1] 10.746137
        Num handles: 1
        Handle: 2883 Address: DF:A9:FF:F6:B1:1A (OUI DF-A9-FF)
        Count: 1
        #124: len 21 (1 Kb/s)
        Latency: 156 msec (66-171 msec ~156 msec)
> ACL Data RX: Handle 2883 flags 0x02 dlen 21             #126 [hci1] 10.746416
      SMP: Pairing Random (0x04) len 16
        Random value: a730823300bb389f0000000000000000
< HCI Command: Host Number of Com.. (0x03|0x0035) plen 5  #127 [hci1] 10.749230
        Num handles: 1
        Handle: 2883 Address: DF:A9:FF:F6:B1:1A (OUI DF-A9-FF)
        Count: 1
< ACL Data TX: Handle 2883 flags 0x00 dlen 21             #128 [hci1] 10.749385
      SMP: Pairing Random (0x04) len 16
        Random value: eb9f1915536596b6fc3db1c86b2b1970
> HCI Event: Number of Completed Packets (0x13) plen 5    #129 [hci1] 10.920915
        Num handles: 1
        Handle: 2883 Address: DF:A9:FF:F6:B1:1A (OUI DF-A9-FF)
        Count: 1
        #128: len 21 (0 Kb/s)
        Latency: 171 msec (66-171 msec ~164 msec)
> ACL Data RX: Handle 2883 flags 0x02 dlen 21             #130 [hci1] 11.008727
      SMP: Pairing Confirm (0x03) len 16
        Confim value: 4f17bb5150b14ec106c5cce1ef21dd79
< HCI Command: Host Number of Com.. (0x03|0x0035) plen 5  #131 [hci1] 11.029185
        Num handles: 1
        Handle: 2883 Address: DF:A9:FF:F6:B1:1A (OUI DF-A9-FF)
        Count: 1
< ACL Data TX: Handle 2883 flags 0x00 dlen 21             #132 [hci1] 11.029270
      SMP: Pairing Confirm (0x03) len 16
        Confim value: 3d9261640a754d5a2f4b5daf7e894bc0
> HCI Event: Number of Completed Packets (0x13) plen 5    #133 [hci1] 11.183578
        Num handles: 1
        Handle: 2883 Address: DF:A9:FF:F6:B1:1A (OUI DF-A9-FF)
        Count: 1
        #132: len 21 (1 Kb/s)
        Latency: 154 msec (66-171 msec ~159 msec)
> ACL Data RX: Handle 2883 flags 0x02 dlen 21             #134 [hci1] 11.183924
      SMP: Pairing Random (0x04) len 16
        Random value: 227964e5c029086b0000000000000000
< HCI Command: Host Number of Com.. (0x03|0x0035) plen 5  #135 [hci1] 11.189156
        Num handles: 1
        Handle: 2883 Address: DF:A9:FF:F6:B1:1A (OUI DF-A9-FF)
        Count: 1
< ACL Data TX: Handle 2883 flags 0x00 dlen 21             #136 [hci1] 11.189243
      SMP: Pairing Random (0x04) len 16
        Random value: 5c794dc9ad9f2c3f295ebd5ad5e1c3cf
> HCI Event: Number of Completed Packets (0x13) plen 5    #137 [hci1] 11.358401
        Num handles: 1
        Handle: 2883 Address: DF:A9:FF:F6:B1:1A (OUI DF-A9-FF)
        Count: 1
        #136: len 21 (0 Kb/s)
        Latency: 169 msec (66-171 msec ~164 msec)
> ACL Data RX: Handle 2883 flags 0x02 dlen 21             #138 [hci1] 11.446331
      SMP: Pairing Confirm (0x03) len 16
        Confim value: cd57a8a4b2ed5fff8e59dfbd5d52202d
< HCI Command: Host Number of Com.. (0x03|0x0035) plen 5  #139 [hci1] 11.449111
        Num handles: 1
        Handle: 2883 Address: DF:A9:FF:F6:B1:1A (OUI DF-A9-FF)
        Count: 1
< ACL Data TX: Handle 2883 flags 0x00 dlen 21             #140 [hci1] 11.449209
      SMP: Pairing Confirm (0x03) len 16
        Confim value: 237b4cb069628210b4cbb0616ea19387
> HCI Event: Number of Completed Packets (0x13) plen 5    #141 [hci1] 11.621029
        Num handles: 1
        Handle: 2883 Address: DF:A9:FF:F6:B1:1A (OUI DF-A9-FF)
        Count: 1
        #140: len 21 (0 Kb/s)
        Latency: 171 msec (66-171 msec ~168 msec)
> ACL Data RX: Handle 2883 flags 0x02 dlen 21             #142 [hci1] 11.621416
      SMP: Pairing Random (0x04) len 16
        Random value: 4943e370d49b068e0000000000000000
< HCI Command: Host Number of Com.. (0x03|0x0035) plen 5  #143 [hci1] 11.629450
        Num handles: 1
        Handle: 2883 Address: DF:A9:FF:F6:B1:1A (OUI DF-A9-FF)
        Count: 1
< ACL Data TX: Handle 2883 flags 0x00 dlen 21             #144 [hci1] 11.629553
      SMP: Pairing Random (0x04) len 16
        Random value: 5c2fff312cdf99c9491988e877355a9a
> HCI Event: Number of Completed Packets (0x13) plen 5    #145 [hci1] 11.795887
        Num handles: 1
        Handle: 2883 Address: DF:A9:FF:F6:B1:1A (OUI DF-A9-FF)
        Count: 1
        #144: len 21 (1 Kb/s)
        Latency: 166 msec (66-171 msec ~167 msec)
> ACL Data RX: Handle 2883 flags 0x02 dlen 21             #146 [hci1] 11.883735
      SMP: Pairing Confirm (0x03) len 16
        Confim value: 178e8e92f721dbea041e722f27f5475b
< HCI Command: Host Number of Com.. (0x03|0x0035) plen 5  #147 [hci1] 11.888922
        Num handles: 1
        Handle: 2883 Address: DF:A9:FF:F6:B1:1A (OUI DF-A9-FF)
        Count: 1
< ACL Data TX: Handle 2883 flags 0x00 dlen 21             #148 [hci1] 11.888973
      SMP: Pairing Confirm (0x03) len 16
        Confim value: 013f23c8e275d622e9fbfdc00cf62af6
> HCI Event: Number of Completed Packets (0x13) plen 5    #149 [hci1] 12.058614
        Num handles: 1
        Handle: 2883 Address: DF:A9:FF:F6:B1:1A (OUI DF-A9-FF)
        Count: 1
        #148: len 21 (0 Kb/s)
        Latency: 169 msec (66-171 msec ~168 msec)
> ACL Data RX: Handle 2883 flags 0x02 dlen 21             #150 [hci1] 12.058880
      SMP: Pairing Random (0x04) len 16
        Random value: db3b552bab3d02d80000000000000000
< HCI Command: Host Number of Com.. (0x03|0x0035) plen 5  #151 [hci1] 12.069027
        Num handles: 1
        Handle: 2883 Address: DF:A9:FF:F6:B1:1A (OUI DF-A9-FF)
        Count: 1
< ACL Data TX: Handle 2883 flags 0x00 dlen 21             #152 [hci1] 12.069059
      SMP: Pairing Random (0x04) len 16
        Random value: c629a3a987d808e808655d558dfc1155
> HCI Event: Number of Completed Packets (0x13) plen 5    #153 [hci1] 12.233376
        Num handles: 1
        Handle: 2883 Address: DF:A9:FF:F6:B1:1A (OUI DF-A9-FF)
        Count: 1
        #152: len 21 (1 Kb/s)
        Latency: 164 msec (66-171 msec ~166 msec)
> ACL Data RX: Handle 2883 flags 0x02 dlen 21             #154 [hci1] 12.321202
      SMP: Pairing Confirm (0x03) len 16
        Confim value: c02707c04389601c156cc3d71040cf1b
< HCI Command: Host Number of Com.. (0x03|0x0035) plen 5  #155 [hci1] 12.328695
        Num handles: 1
        Handle: 2883 Address: DF:A9:FF:F6:B1:1A (OUI DF-A9-FF)
        Count: 1
< ACL Data TX: Handle 2883 flags 0x00 dlen 21             #156 [hci1] 12.328726
      SMP: Pairing Confirm (0x03) len 16
        Confim value: 20080dcf27400d6ee2ba141630873f7e
> HCI Event: Number of Completed Packets (0x13) plen 5    #157 [hci1] 12.496063
        Num handles: 1
        Handle: 2883 Address: DF:A9:FF:F6:B1:1A (OUI DF-A9-FF)
        Count: 1
        #156: len 21 (1 Kb/s)
        Latency: 167 msec (66-171 msec ~166 msec)
> ACL Data RX: Handle 2883 flags 0x02 dlen 21             #158 [hci1] 12.496415
      SMP: Pairing Random (0x04) len 16
        Random value: 366b7f2fa7f755260000000000000000
< HCI Command: Host Number of Com.. (0x03|0x0035) plen 5  #159 [hci1] 12.509345
        Num handles: 1
        Handle: 2883 Address: DF:A9:FF:F6:B1:1A (OUI DF-A9-FF)
        Count: 1
< ACL Data TX: Handle 2883 flags 0x00 dlen 21             #160 [hci1] 12.509513
      SMP: Pairing Random (0x04) len 16
        Random value: 92f20f6ad8f13724432c7fd6001c45ff
> HCI Event: Number of Completed Packets (0x13) plen 5    #161 [hci1] 12.670825
        Num handles: 1
        Handle: 2883 Address: DF:A9:FF:F6:B1:1A (OUI DF-A9-FF)
        Count: 1
        #160: len 21 (1 Kb/s)
        Latency: 161 msec (66-171 msec ~164 msec)
> ACL Data RX: Handle 2883 flags 0x02 dlen 21             #162 [hci1] 12.758694
      SMP: Pairing Confirm (0x03) len 16
        Confim value: 74bbb659494c97459e120568d6f6706d
< HCI Command: Host Number of Com.. (0x03|0x0035) plen 5  #163 [hci1] 12.769133
        Num handles: 1
        Handle: 2883 Address: DF:A9:FF:F6:B1:1A (OUI DF-A9-FF)
        Count: 1
< ACL Data TX: Handle 2883 flags 0x00 dlen 21             #164 [hci1] 12.769223
      SMP: Pairing Confirm (0x03) len 16
        Confim value: 7b0648c3d0d1b659275678f5e2284e73
> HCI Event: Number of Completed Packets (0x13) plen 5    #165 [hci1] 12.933628
        Num handles: 1
        Handle: 2883 Address: DF:A9:FF:F6:B1:1A (OUI DF-A9-FF)
        Count: 1
        #164: len 21 (1 Kb/s)
        Latency: 164 msec (66-171 msec ~164 msec)
> ACL Data RX: Handle 2883 flags 0x02 dlen 21             #166 [hci1] 12.933870
      SMP: Pairing Random (0x04) len 16
        Random value: b26580af23b36a440000000000000000
< HCI Command: Host Number of Com.. (0x03|0x0035) plen 5  #167 [hci1] 12.949441
        Num handles: 1
        Handle: 2883 Address: DF:A9:FF:F6:B1:1A (OUI DF-A9-FF)
        Count: 1
< ACL Data TX: Handle 2883 flags 0x00 dlen 21             #168 [hci1] 12.949613
      SMP: Pairing Random (0x04) len 16
        Random value: 23ac32ebbb5e14c8a6b9622f296d277f
> HCI Event: Number of Completed Packets (0x13) plen 5    #169 [hci1] 13.108305
        Num handles: 1
        Handle: 2883 Address: DF:A9:FF:F6:B1:1A (OUI DF-A9-FF)
        Count: 1
        #168: len 21 (1 Kb/s)
        Latency: 158 msec (66-171 msec ~161 msec)
> ACL Data RX: Handle 2883 flags 0x02 dlen 21             #170 [hci1] 13.196191
      SMP: Pairing Confirm (0x03) len 16
        Confim value: 9ce2defb73763b780faa5908ef33b312
< HCI Command: Host Number of Com.. (0x03|0x0035) plen 5  #171 [hci1] 13.208968
        Num handles: 1
        Handle: 2883 Address: DF:A9:FF:F6:B1:1A (OUI DF-A9-FF)
        Count: 1
< ACL Data TX: Handle 2883 flags 0x00 dlen 21             #172 [hci1] 13.209020
      SMP: Pairing Confirm (0x03) len 16
        Confim value: add220ae73964219c1d830142d1c5e23
> HCI Event: Number of Completed Packets (0x13) plen 5    #173 [hci1] 13.371039
        Num handles: 1
        Handle: 2883 Address: DF:A9:FF:F6:B1:1A (OUI DF-A9-FF)
        Count: 1
        #172: len 21 (1 Kb/s)
        Latency: 162 msec (66-171 msec ~161 msec)
> ACL Data RX: Handle 2883 flags 0x02 dlen 21             #174 [hci1] 13.371379
      SMP: Pairing Random (0x04) len 16
        Random value: 3183ecab716e001f0000000000000000
< HCI Command: Host Number of Com.. (0x03|0x0035) plen 5  #175 [hci1] 13.388944
        Num handles: 1
        Handle: 2883 Address: DF:A9:FF:F6:B1:1A (OUI DF-A9-FF)
        Count: 1
< ACL Data TX: Handle 2883 flags 0x00 dlen 21             #176 [hci1] 13.389004
      SMP: Pairing Random (0x04) len 16
        Random value: 297efe85e67448a15f56bd27e3a3cf1d
> HCI Event: Number of Completed Packets (0x13) plen 5    #177 [hci1] 13.545841
        Num handles: 1
        Handle: 2883 Address: DF:A9:FF:F6:B1:1A (OUI DF-A9-FF)
        Count: 1
        #176: len 21 (1 Kb/s)
        Latency: 156 msec (66-171 msec ~159 msec)
> ACL Data RX: Handle 2883 flags 0x02 dlen 21             #178 [hci1] 13.633684
      SMP: Pairing Confirm (0x03) len 16
        Confim value: ba1f09db9832659e1e5a76dd59e9b166
< HCI Command: Host Number of Com.. (0x03|0x0035) plen 5  #179 [hci1] 13.649187
        Num handles: 1
        Handle: 2883 Address: DF:A9:FF:F6:B1:1A (OUI DF-A9-FF)
        Count: 1
< ACL Data TX: Handle 2883 flags 0x00 dlen 21             #180 [hci1] 13.649312
      SMP: Pairing Confirm (0x03) len 16
        Confim value: a5bed7f2a59241118083a8a00528aff0
> HCI Event: Number of Completed Packets (0x13) plen 5    #181 [hci1] 13.808493
        Num handles: 1
        Handle: 2883 Address: DF:A9:FF:F6:B1:1A (OUI DF-A9-FF)
        Count: 1
        #180: len 21 (1 Kb/s)
        Latency: 159 msec (66-171 msec ~159 msec)
> ACL Data RX: Handle 2883 flags 0x02 dlen 21             #182 [hci1] 13.808874
      SMP: Pairing Random (0x04) len 16
        Random value: 431a40205d3308980000000000000000
< HCI Command: Host Number of Com.. (0x03|0x0035) plen 5  #183 [hci1] 13.829087
        Num handles: 1
        Handle: 2883 Address: DF:A9:FF:F6:B1:1A (OUI DF-A9-FF)
        Count: 1
< ACL Data TX: Handle 2883 flags 0x00 dlen 21             #184 [hci1] 13.829170
      SMP: Pairing Random (0x04) len 16
        Random value: 25a9493fd3ce4faf02be7293595bb7c6
> HCI Event: Number of Completed Packets (0x13) plen 5    #185 [hci1] 13.983326
        Num handles: 1
        Handle: 2883 Address: DF:A9:FF:F6:B1:1A (OUI DF-A9-FF)
        Count: 1
        #184: len 21 (1 Kb/s)
        Latency: 154 msec (66-171 msec ~156 msec)
> ACL Data RX: Handle 2883 flags 0x02 dlen 21             #186 [hci1] 14.071287
      SMP: Pairing Confirm (0x03) len 16
        Confim value: 66cd9d876a887897ffa1713c74774f0c
< HCI Command: Host Number of Com.. (0x03|0x0035) plen 5  #187 [hci1] 14.089120
        Num handles: 1
        Handle: 2883 Address: DF:A9:FF:F6:B1:1A (OUI DF-A9-FF)
        Count: 1
< ACL Data TX: Handle 2883 flags 0x00 dlen 21             #188 [hci1] 14.089358
      SMP: Pairing Confirm (0x03) len 16
        Confim value: 8a6488d7abb0cf05cc2f85b6a67080e7
> HCI Event: Number of Completed Packets (0x13) plen 5    #189 [hci1] 14.246074
        Num handles: 1
        Handle: 2883 Address: DF:A9:FF:F6:B1:1A (OUI DF-A9-FF)
        Count: 1
        #188: len 21 (1 Kb/s)
        Latency: 156 msec (66-171 msec ~156 msec)
> ACL Data RX: Handle 2883 flags 0x02 dlen 21             #190 [hci1] 14.246455
      SMP: Pairing Random (0x04) len 16
        Random value: fe1111add4d9d6800000000000000000
< HCI Command: Host Number of Com.. (0x03|0x0035) plen 5  #191 [hci1] 14.249440
        Num handles: 1
        Handle: 2883 Address: DF:A9:FF:F6:B1:1A (OUI DF-A9-FF)
        Count: 1
< ACL Data TX: Handle 2883 flags 0x00 dlen 21             #192 [hci1] 14.249515
      SMP: Pairing Random (0x04) len 16
        Random value: 58f6b41f855a6f6c3560debd84e2affc
> HCI Event: Number of Completed Packets (0x13) plen 5    #193 [hci1] 14.420762
        Num handles: 1
        Handle: 2883 Address: DF:A9:FF:F6:B1:1A (OUI DF-A9-FF)
        Count: 1
        #192: len 21 (0 Kb/s)
        Latency: 171 msec (66-171 msec ~163 msec)
> ACL Data RX: Handle 2883 flags 0x02 dlen 21             #194 [hci1] 14.508727
      SMP: Pairing Confirm (0x03) len 16
        Confim value: 34ebbdc0605727ca8b80f610e90cdb26
< HCI Command: Host Number of Com.. (0x03|0x0035) plen 5  #195 [hci1] 14.529075
        Num handles: 1
        Handle: 2883 Address: DF:A9:FF:F6:B1:1A (OUI DF-A9-FF)
        Count: 1
< ACL Data TX: Handle 2883 flags 0x00 dlen 21             #196 [hci1] 14.529162
      SMP: Pairing Confirm (0x03) len 16
        Confim value: 890f9629c35d8b017740c729497c72bf
> HCI Event: Number of Completed Packets (0x13) plen 5    #197 [hci1] 14.683499
        Num handles: 1
        Handle: 2883 Address: DF:A9:FF:F6:B1:1A (OUI DF-A9-FF)
        Count: 1
        #196: len 21 (1 Kb/s)
        Latency: 154 msec (66-171 msec ~159 msec)
> ACL Data RX: Handle 2883 flags 0x02 dlen 21             #198 [hci1] 14.683830
      SMP: Pairing Random (0x04) len 16
        Random value: d3c1234abae9197f0000000000000000
< HCI Command: Host Number of Com.. (0x03|0x0035) plen 5  #199 [hci1] 14.689452
        Num handles: 1
        Handle: 2883 Address: DF:A9:FF:F6:B1:1A (OUI DF-A9-FF)
        Count: 1
< ACL Data TX: Handle 2883 flags 0x00 dlen 21             #200 [hci1] 14.689633
      SMP: Pairing Random (0x04) len 16
        Random value: b67e7216d5bf664139eda2b542549666
> HCI Event: Number of Completed Packets (0x13) plen 5    #201 [hci1] 14.858289
        Num handles: 1
        Handle: 2883 Address: DF:A9:FF:F6:B1:1A (OUI DF-A9-FF)
        Count: 1
        #200: len 21 (1 Kb/s)
        Latency: 168 msec (66-171 msec ~163 msec)
> ACL Data RX: Handle 2883 flags 0x02 dlen 21             #202 [hci1] 14.946198
      SMP: Pairing Confirm (0x03) len 16
        Confim value: fd836be22c22ac60bc1988e64425de7d
< HCI Command: Host Number of Com.. (0x03|0x0035) plen 5  #203 [hci1] 14.948899
        Num handles: 1
        Handle: 2883 Address: DF:A9:FF:F6:B1:1A (OUI DF-A9-FF)
        Count: 1
< ACL Data TX: Handle 2883 flags 0x00 dlen 21             #204 [hci1] 14.948953
      SMP: Pairing Confirm (0x03) len 16
        Confim value: a9cfcb8a541ee413cfd3f8ec094bc78e
> HCI Event: Number of Completed Packets (0x13) plen 5    #205 [hci1] 15.121026
        Num handles: 1
        Handle: 2883 Address: DF:A9:FF:F6:B1:1A (OUI DF-A9-FF)
        Count: 1
        #204: len 21 (0 Kb/s)
        Latency: 172 msec (66-172 msec ~167 msec)
> ACL Data RX: Handle 2883 flags 0x02 dlen 21             #206 [hci1] 15.121422
      SMP: Pairing Random (0x04) len 16
        Random value: fe9ea9831d45ed660000000000000000
< HCI Command: Host Number of Com.. (0x03|0x0035) plen 5  #207 [hci1] 15.129091
        Num handles: 1
        Handle: 2883 Address: DF:A9:FF:F6:B1:1A (OUI DF-A9-FF)
        Count: 1
< ACL Data TX: Handle 2883 flags 0x00 dlen 21             #208 [hci1] 15.129147
      SMP: Pairing Random (0x04) len 16
        Random value: ed17f76500c95219dd01e09d1e63f87b
> HCI Event: Number of Completed Packets (0x13) plen 5    #209 [hci1] 15.295886
        Num handles: 1
        Handle: 2883 Address: DF:A9:FF:F6:B1:1A (OUI DF-A9-FF)
        Count: 1
        #208: len 21 (1 Kb/s)
        Latency: 166 msec (66-172 msec ~167 msec)
> ACL Data RX: Handle 2883 flags 0x02 dlen 21             #210 [hci1] 15.383739
      SMP: Pairing Confirm (0x03) len 16
        Confim value: b6e848f98089d196e0e9efc1f74c1325
< HCI Command: Host Number of Com.. (0x03|0x0035) plen 5  #211 [hci1] 15.388863
        Num handles: 1
        Handle: 2883 Address: DF:A9:FF:F6:B1:1A (OUI DF-A9-FF)
        Count: 1
< ACL Data TX: Handle 2883 flags 0x00 dlen 21             #212 [hci1] 15.388899
      SMP: Pairing Confirm (0x03) len 16
        Confim value: 44918b29c0c56298917bfe3b9a6ca748
> HCI Event: Number of Completed Packets (0x13) plen 5    #213 [hci1] 15.558483
        Num handles: 1
        Handle: 2883 Address: DF:A9:FF:F6:B1:1A (OUI DF-A9-FF)
        Count: 1
        #212: len 21 (0 Kb/s)
        Latency: 169 msec (66-172 msec ~168 msec)
> ACL Data RX: Handle 2883 flags 0x02 dlen 21             #214 [hci1] 15.558928
      SMP: Pairing Random (0x04) len 16
        Random value: 117021f8a6ac46900000000000000000
< HCI Command: Host Number of Com.. (0x03|0x0035) plen 5  #215 [hci1] 15.569423
        Num handles: 1
        Handle: 2883 Address: DF:A9:FF:F6:B1:1A (OUI DF-A9-FF)
        Count: 1
< ACL Data TX: Handle 2883 flags 0x00 dlen 21             #216 [hci1] 15.569476
      SMP: Pairing Random (0x04) len 16
        Random value: 81d35d47e1f6006d79c974bd9d9e1ee3
> HCI Event: Number of Completed Packets (0x13) plen 5    #217 [hci1] 15.733364
        Num handles: 1
        Handle: 2883 Address: DF:A9:FF:F6:B1:1A (OUI DF-A9-FF)
        Count: 1
        #216: len 21 (1 Kb/s)
        Latency: 163 msec (66-172 msec ~166 msec)
> ACL Data RX: Handle 2883 flags 0x02 dlen 21             #218 [hci1] 15.821161
      SMP: Pairing Confirm (0x03) len 16
        Confim value: e065675432d20f222bf2f3639775a009
< HCI Command: Host Number of Com.. (0x03|0x0035) plen 5  #219 [hci1] 15.829190
        Num handles: 1
        Handle: 2883 Address: DF:A9:FF:F6:B1:1A (OUI DF-A9-FF)
        Count: 1
< ACL Data TX: Handle 2883 flags 0x00 dlen 21             #220 [hci1] 15.829272
      SMP: Pairing Confirm (0x03) len 16
        Confim value: 97962868a05aaf3a108e62ed568e567f
> HCI Event: Number of Completed Packets (0x13) plen 5    #221 [hci1] 15.995940
        Num handles: 1
        Handle: 2883 Address: DF:A9:FF:F6:B1:1A (OUI DF-A9-FF)
        Count: 1
        #220: len 21 (1 Kb/s)
        Latency: 166 msec (66-172 msec ~166 msec)
> ACL Data RX: Handle 2883 flags 0x02 dlen 21             #222 [hci1] 15.996306
      SMP: Pairing Random (0x04) len 16
        Random value: 8ab88b92b2e15e350000000000000000
< HCI Command: Host Number of Com.. (0x03|0x0035) plen 5  #223 [hci1] 16.009239
        Num handles: 1
        Handle: 2883 Address: DF:A9:FF:F6:B1:1A (OUI DF-A9-FF)
        Count: 1
< ACL Data TX: Handle 2883 flags 0x00 dlen 21             #224 [hci1] 16.009397
      SMP: Pairing Random (0x04) len 16
        Random value: e7f7e0c2476823e41736a7e381bafb7c
> HCI Event: Number of Completed Packets (0x13) plen 5    #225 [hci1] 16.170775
        Num handles: 1
        Handle: 2883 Address: DF:A9:FF:F6:B1:1A (OUI DF-A9-FF)
        Count: 1
        #224: len 21 (1 Kb/s)
        Latency: 161 msec (66-172 msec ~163 msec)
> ACL Data RX: Handle 2883 flags 0x02 dlen 21             #226 [hci1] 16.258701
      SMP: Pairing Confirm (0x03) len 16
        Confim value: ebd80f97f6f574330d5a5735c935e7ee
< HCI Command: Host Number of Com.. (0x03|0x0035) plen 5  #227 [hci1] 16.269168
        Num handles: 1
        Handle: 2883 Address: DF:A9:FF:F6:B1:1A (OUI DF-A9-FF)
        Count: 1
< ACL Data TX: Handle 2883 flags 0x00 dlen 21             #228 [hci1] 16.269365
      SMP: Pairing Confirm (0x03) len 16
        Confim value: 9606708a25ec7158f1ae862cc3c2f0ad
> HCI Event: Number of Completed Packets (0x13) plen 5    #229 [hci1] 16.433533
        Num handles: 1
        Handle: 2883 Address: DF:A9:FF:F6:B1:1A (OUI DF-A9-FF)
        Count: 1
        #228: len 21 (1 Kb/s)
        Latency: 164 msec (66-172 msec ~164 msec)
> ACL Data RX: Handle 2883 flags 0x02 dlen 21             #230 [hci1] 16.433846
      SMP: Pairing Random (0x04) len 16
        Random value: ea90e65ec21f47b10000000000000000
< HCI Command: Host Number of Com.. (0x03|0x0035) plen 5  #231 [hci1] 16.449137
        Num handles: 1
        Handle: 2883 Address: DF:A9:FF:F6:B1:1A (OUI DF-A9-FF)
        Count: 1
< ACL Data TX: Handle 2883 flags 0x00 dlen 21             #232 [hci1] 16.449185
      SMP: Pairing Random (0x04) len 16
        Random value: fc8b40d9b0b09bc4296bf8753a8f6e1f
> HCI Event: Number of Completed Packets (0x13) plen 5    #233 [hci1] 16.608332
        Num handles: 1
        Handle: 2883 Address: DF:A9:FF:F6:B1:1A (OUI DF-A9-FF)
        Count: 1
        #232: len 21 (1 Kb/s)
        Latency: 159 msec (66-172 msec ~161 msec)
> ACL Data RX: Handle 2883 flags 0x02 dlen 21             #234 [hci1] 16.783610
      SMP: Pairing DHKey Check (0x0d) len 16
        E: d36d499b71d6db333ea7f0335b4f77da
< HCI Command: Host Number of Com.. (0x03|0x0035) plen 5  #235 [hci1] 16.789506
        Num handles: 1
        Handle: 2883 Address: DF:A9:FF:F6:B1:1A (OUI DF-A9-FF)
        Count: 1
< ACL Data TX: Handle 2883 flags 0x00 dlen 21             #236 [hci1] 16.789608
      SMP: Pairing DHKey Check (0x0d) len 16
        E: a3f267d562c0d753da4364eaf77e7221
> HCI Event: Number of Completed Packets (0x13) plen 5    #237 [hci1] 16.958360
        Num handles: 1
        Handle: 2883 Address: DF:A9:FF:F6:B1:1A (OUI DF-A9-FF)
        Count: 1
        #236: len 21 (1 Kb/s)
        Latency: 168 msec (66-172 msec ~165 msec)
> HCI Event: LE Meta Event (0x3e) plen 13                 #238 [hci1] 17.046378
      LE Long Term Key Request (0x05)
        Handle: 2883 Address: DF:A9:FF:F6:B1:1A (OUI DF-A9-FF)
        Random number: 0x0000000000000000
        Encrypted diversifier: 0x0000
< HCI Command: LE Long Term Key... (0x08|0x001a) plen 18  #239 [hci1] 17.049056
        Handle: 2883 Address: DF:A9:FF:F6:B1:1A (OUI DF-A9-FF)
        Long term key: 0166a03376298d535b2246934305ae07
> HCI Event: Command Complete (0x0e) plen 6               #240 [hci1] 17.049753
      LE Long Term Key Request Reply (0x08|0x001a) ncmd 1
        Status: Success (0x00)
        Handle: 2883 Address: DF:A9:FF:F6:B1:1A (OUI DF-A9-FF)
> HCI Event: Encryption Change (0x08) plen 4              #241 [hci1] 17.483600
        Status: Success (0x00)
        Handle: 2883 Address: DF:A9:FF:F6:B1:1A (OUI DF-A9-FF)
        Encryption: Enabled with AES-CCM (0x01)
> ACL Data RX: Handle 2883 flags 0x02 dlen 21             #242 [hci1] 17.571140
      SMP: Identity Information (0x08) len 16
        Identity resolving key: b2241ac3d953e2ae91ffa0709b393044
< HCI Command: Host Number of Com.. (0x03|0x0035) plen 5  #243 [hci1] 17.599630
        Num handles: 1
        Handle: 2883 Address: DF:A9:FF:F6:B1:1A (OUI DF-A9-FF)
        Count: 1
> ACL Data RX: Handle 2883 flags 0x02 dlen 12             #244 [hci1] 17.745991
      SMP: Identity Address Information (0x09) len 7
        Address: DF:A9:FF:F6:B1:1A (OUI DF-A9-FF)
< HCI Command: LE Add Device To... (0x08|0x0027) plen 39  #245 [hci1] 17.749353
        Address type: Public (0x00)
        Address: DF:A9:FF:F6:B1:1A (OUI DF-A9-FF)
        Peer identity resolving key: b2241ac3d953e2ae91ffa0709b393044
        Local identity resolving key: 00000000000000000000000000000000
> HCI Event: Command Complete (0x0e) plen 4               #246 [hci1] 17.750460
      LE Add Device To Resolving List (0x08|0x0027) ncmd 1
        Status: Success (0x00)
< HCI Command: LE Set Privacy Mode (0x08|0x004e) plen 8   #247 [hci1] 17.769089
        Peer Identity address type: Public (0x00)
        Peer Identity address: DF:A9:FF:F6:B1:1A (OUI DF-A9-FF)
        Privacy Mode: Use Device Privacy (0x01)
> HCI Event: Command Complete (0x0e) plen 4               #248 [hci1] 17.769679
      LE Set Privacy Mode (0x08|0x004e) ncmd 1
        Status: Success (0x00)
< HCI Command: LE Set Address Res.. (0x08|0x002d) plen 1  #249 [hci1] 17.789019
        Address resolution: Enabled (0x01)
> HCI Event: Command Complete (0x0e) plen 4               #250 [hci1] 17.789457
      LE Set Address Resolution Enable (0x08|0x002d) ncmd 1
        Status: Success (0x00)
< HCI Command: Host Number of Com.. (0x03|0x0035) plen 5  #251 [hci1] 17.809040
        Num handles: 1
        Handle: 2883 Address: DF:A9:FF:F6:B1:1A (OUI DF-A9-FF)
        Count: 1
> ACL Data RX: Handle 2883 flags 0x02 dlen 13             #252 [hci1] 17.833570
      ATT: Find By Type Value Request (0x06) len 8
        Handle range: 0x0001-0xffff
        Attribute type: Primary Service (0x2800)
          UUID: Generic Telephony Bearer (0x184c)
< HCI Command: Host Number of Com.. (0x03|0x0035) plen 5  #253 [hci1] 17.849352
        Num handles: 1
        Handle: 2883 Address: DF:A9:FF:F6:B1:1A (OUI DF-A9-FF)
        Count: 1
< ACL Data TX: Handle 2883 flags 0x00 dlen 9              #254 [hci1] 17.849502
      ATT: Find By Type Value Response (0x07) len 4
        Handle range: 0x002a-0x0056
> HCI Event: Number of Completed Packets (0x13) plen 5    #255 [hci1] 18.008454
        Num handles: 1
        Handle: 2883 Address: DF:A9:FF:F6:B1:1A (OUI DF-A9-FF)
        Count: 1
        #254: len 9 (0 Kb/s)
        Latency: 158 msec (66-172 msec ~162 msec)
> ACL Data RX: Handle 2883 flags 0x02 dlen 13             #256 [hci1] 18.008698
      ATT: Find By Type Value Request (0x06) len 8
        Handle range: 0x0057-0xffff
        Attribute type: Primary Service (0x2800)
          UUID: Generic Telephony Bearer (0x184c)
< HCI Command: Host Number of Com.. (0x03|0x0035) plen 5  #257 [hci1] 18.028827
        Num handles: 1
        Handle: 2883 Address: DF:A9:FF:F6:B1:1A (OUI DF-A9-FF)
        Count: 1
< ACL Data TX: Handle 2883 flags 0x00 dlen 9              #258 [hci1] 18.028921
      ATT: Error Response (0x01) len 4
        Find By Type Value Request (0x06)
        Handle: 0x0057
        Error: Attribute Not Found (0x0a)
> HCI Event: Number of Completed Packets (0x13) plen 5    #259 [hci1] 18.183402
        Num handles: 1
        Handle: 2883 Address: DF:A9:FF:F6:B1:1A (OUI DF-A9-FF)
        Count: 1
        #258: len 9 (0 Kb/s)
        Latency: 154 msec (66-172 msec ~158 msec)
> ACL Data RX: Handle 2883 flags 0x02 dlen 11             #260 [hci1] 18.183681
      ATT: Read By Type Request (0x08) len 6
        Handle range: 0x002a-0x0056
        Attribute type: Characteristic (0x2803)
< HCI Command: Host Number of Com.. (0x03|0x0035) plen 5  #261 [hci1] 18.188956
        Num handles: 1
        Handle: 2883 Address: DF:A9:FF:F6:B1:1A (OUI DF-A9-FF)
        Count: 1
< ACL Data TX: Handle 2883 flags 0x00 dlen 20             #262 [hci1] 18.188992
      ATT: Read By Type Response (0x09) len 15
        Attribute data length: 7
        Attribute data list: 2 entries
        Handle: 0x002b
        Value: 122c00b32b
            Properties: 0x12
              Read (0x02)
              Notify (0x10)
            Value Handle: 0x002c
            Value UUID: Bearer Provider Name (0x2bb3)
        Handle: 0x002e
        Value: 022f00b42b
            Properties: 0x02
              Read (0x02)
            Value Handle: 0x002f
            Value UUID: Bearer UCI (0x2bb4)
> HCI Event: Number of Completed Packets (0x13) plen 5    #263 [hci1] 18.358509
        Num handles: 1
        Handle: 2883 Address: DF:A9:FF:F6:B1:1A (OUI DF-A9-FF)
        Count: 1
        #262: len 20 (0 Kb/s)
        Latency: 169 msec (66-172 msec ~163 msec)
> ACL Data RX: Handle 2883 flags 0x02 dlen 11             #264 [hci1] 18.358680
      ATT: Read By Type Request (0x08) len 6
        Handle range: 0x002f-0x0056
        Attribute type: Characteristic (0x2803)
< HCI Command: Host Number of Com.. (0x03|0x0035) plen 5  #265 [hci1] 18.369461
        Num handles: 1
        Handle: 2883 Address: DF:A9:FF:F6:B1:1A (OUI DF-A9-FF)
        Count: 1
< ACL Data TX: Handle 2883 flags 0x00 dlen 20             #266 [hci1] 18.369616
      ATT: Read By Type Response (0x09) len 15
        Attribute data length: 7
        Attribute data list: 2 entries
        Handle: 0x0030
        Value: 123100b52b
            Properties: 0x12
              Read (0x02)
              Notify (0x10)
            Value Handle: 0x0031
            Value UUID: Bearer Technology (0x2bb5)
        Handle: 0x0033
        Value: 123400b62b
            Properties: 0x12
              Read (0x02)
              Notify (0x10)
            Value Handle: 0x0034
            Value UUID: Bearer URI Schemes Supported List (0x2bb6)
> HCI Event: Number of Completed Packets (0x13) plen 5    #267 [hci1] 18.533417
        Num handles: 1
        Handle: 2883 Address: DF:A9:FF:F6:B1:1A (OUI DF-A9-FF)
        Count: 1
        #266: len 20 (0 Kb/s)
        Latency: 163 msec (66-172 msec ~163 msec)
> ACL Data RX: Handle 2883 flags 0x02 dlen 11             #268 [hci1] 18.533669
      ATT: Read By Type Request (0x08) len 6
        Handle range: 0x0034-0x0056
        Attribute type: Characteristic (0x2803)
< HCI Command: Host Number of Com.. (0x03|0x0035) plen 5  #269 [hci1] 18.548962
        Num handles: 1
        Handle: 2883 Address: DF:A9:FF:F6:B1:1A (OUI DF-A9-FF)
        Count: 1
< ACL Data TX: Handle 2883 flags 0x00 dlen 20             #270 [hci1] 18.548998
      ATT: Read By Type Response (0x09) len 15
        Attribute data length: 7
        Attribute data list: 2 entries
        Handle: 0x0036
        Value: 123700b72b
            Properties: 0x12
              Read (0x02)
              Notify (0x10)
            Value Handle: 0x0037
            Value UUID: Bearer Signal Strength (0x2bb7)
        Handle: 0x0039
        Value: 0e3a00b82b
            Properties: 0x0e
              Read (0x02)
              Write Without Response (0x04)
              Write (0x08)
            Value Handle: 0x003a
            Value UUID: Bearer Signal Strength Reporting Interval (0x2bb8)
> HCI Event: Number of Completed Packets (0x13) plen 5    #271 [hci1] 18.708422
        Num handles: 1
        Handle: 2883 Address: DF:A9:FF:F6:B1:1A (OUI DF-A9-FF)
        Count: 1
        #270: len 20 (1 Kb/s)
        Latency: 159 msec (66-172 msec ~161 msec)
> ACL Data RX: Handle 2883 flags 0x02 dlen 11             #272 [hci1] 18.708634
      ATT: Read By Type Request (0x08) len 6
        Handle range: 0x003a-0x0056
        Attribute type: Characteristic (0x2803)
< HCI Command: Host Number of Com.. (0x03|0x0035) plen 5  #273 [hci1] 18.709160
        Num handles: 1
        Handle: 2883 Address: DF:A9:FF:F6:B1:1A (OUI DF-A9-FF)
        Count: 1
< ACL Data TX: Handle 2883 flags 0x00 dlen 20             #274 [hci1] 18.709263
      ATT: Read By Type Response (0x09) len 15
        Attribute data length: 7
        Attribute data list: 2 entries
        Handle: 0x003b
        Value: 123c00b92b
            Properties: 0x12
              Read (0x02)
              Notify (0x10)
            Value Handle: 0x003c
            Value UUID: Bearer List Current Calls (0x2bb9)
        Handle: 0x003e
        Value: 023f00ba2b
            Properties: 0x02
              Read (0x02)
            Value Handle: 0x003f
            Value UUID: Content Control ID (0x2bba)
> HCI Event: Number of Completed Packets (0x13) plen 5    #275 [hci1] 18.883419
        Num handles: 1
        Handle: 2883 Address: DF:A9:FF:F6:B1:1A (OUI DF-A9-FF)
        Count: 1
        #274: len 20 (0 Kb/s)
        Latency: 174 msec (66-174 msec ~167 msec)
> ACL Data RX: Handle 2883 flags 0x02 dlen 11             #276 [hci1] 18.883728
      ATT: Read By Type Request (0x08) len 6
        Handle range: 0x003f-0x0056
        Attribute type: Characteristic (0x2803)
< HCI Command: Host Number of Com.. (0x03|0x0035) plen 5  #277 [hci1] 18.889423
        Num handles: 1
        Handle: 2883 Address: DF:A9:FF:F6:B1:1A (OUI DF-A9-FF)
        Count: 1
< ACL Data TX: Handle 2883 flags 0x00 dlen 20             #278 [hci1] 18.889539
      ATT: Read By Type Response (0x09) len 15
        Attribute data length: 7
        Attribute data list: 2 entries
        Handle: 0x0040
        Value: 124100bb2b
            Properties: 0x12
              Read (0x02)
              Notify (0x10)
            Value Handle: 0x0041
            Value UUID: Status Flags (0x2bbb)
        Handle: 0x0043
        Value: 124400bc2b
            Properties: 0x12
              Read (0x02)
              Notify (0x10)
            Value Handle: 0x0044
            Value UUID: Incoming Call Target Bearer URI (0x2bbc)
> HCI Event: Number of Completed Packets (0x13) plen 5    #279 [hci1] 19.058401
        Num handles: 1
        Handle: 2883 Address: DF:A9:FF:F6:B1:1A (OUI DF-A9-FF)
        Count: 1
        #278: len 20 (0 Kb/s)
        Latency: 168 msec (66-174 msec ~168 msec)
> ACL Data RX: Handle 2883 flags 0x02 dlen 11             #280 [hci1] 19.058661
      ATT: Read By Type Request (0x08) len 6
        Handle range: 0x0044-0x0056
        Attribute type: Characteristic (0x2803)
< HCI Command: Host Number of Com.. (0x03|0x0035) plen 5  #281 [hci1] 19.069428
        Num handles: 1
        Handle: 2883 Address: DF:A9:FF:F6:B1:1A (OUI DF-A9-FF)
        Count: 1
< ACL Data TX: Handle 2883 flags 0x00 dlen 20             #282 [hci1] 19.069574
      ATT: Read By Type Response (0x09) len 15
        Attribute data length: 7
        Attribute data list: 2 entries
        Handle: 0x0046
        Value: 124700bd2b
            Properties: 0x12
              Read (0x02)
              Notify (0x10)
            Value Handle: 0x0047
            Value UUID: Call State (0x2bbd)
        Handle: 0x0049
        Value: 1c4a00be2b
            Properties: 0x1c
              Write Without Response (0x04)
              Write (0x08)
              Notify (0x10)
            Value Handle: 0x004a
            Value UUID: Call Control Point (0x2bbe)
> HCI Event: Number of Completed Packets (0x13) plen 5    #283 [hci1] 19.233466
        Num handles: 1
        Handle: 2883 Address: DF:A9:FF:F6:B1:1A (OUI DF-A9-FF)
        Count: 1
        #282: len 20 (0 Kb/s)
        Latency: 163 msec (66-174 msec ~166 msec)
> ACL Data RX: Handle 2883 flags 0x02 dlen 11             #284 [hci1] 19.233644
      ATT: Read By Type Request (0x08) len 6
        Handle range: 0x004a-0x0056
        Attribute type: Characteristic (0x2803)
< HCI Command: Host Number of Com.. (0x03|0x0035) plen 5  #285 [hci1] 19.249195
        Num handles: 1
        Handle: 2883 Address: DF:A9:FF:F6:B1:1A (OUI DF-A9-FF)
        Count: 1
< ACL Data TX: Handle 2883 flags 0x00 dlen 20             #286 [hci1] 19.249271
      ATT: Read By Type Response (0x09) len 15
        Attribute data length: 7
        Attribute data list: 2 entries
        Handle: 0x004c
        Value: 024d00bf2b
            Properties: 0x02
              Read (0x02)
            Value Handle: 0x004d
            Value UUID: Call Control Point Optional Opcodes (0x2bbf)
        Handle: 0x004e
        Value: 104f00c02b
            Properties: 0x10
              Notify (0x10)
            Value Handle: 0x004f
            Value UUID: Termination Reason (0x2bc0)
> HCI Event: Number of Completed Packets (0x13) plen 5    #287 [hci1] 19.408472
        Num handles: 1
        Handle: 2883 Address: DF:A9:FF:F6:B1:1A (OUI DF-A9-FF)
        Count: 1
        #286: len 20 (1 Kb/s)
        Latency: 159 msec (66-174 msec ~162 msec)
> ACL Data RX: Handle 2883 flags 0x02 dlen 11             #288 [hci1] 19.408667
      ATT: Read By Type Request (0x08) len 6
        Handle range: 0x004f-0x0056
        Attribute type: Characteristic (0x2803)
< HCI Command: Host Number of Com.. (0x03|0x0035) plen 5  #289 [hci1] 19.409373
        Num handles: 1
        Handle: 2883 Address: DF:A9:FF:F6:B1:1A (OUI DF-A9-FF)
        Count: 1
< ACL Data TX: Handle 2883 flags 0x00 dlen 20             #290 [hci1] 19.409427
      ATT: Read By Type Response (0x09) len 15
        Attribute data length: 7
        Attribute data list: 2 entries
        Handle: 0x0051
        Value: 125200c12b
            Properties: 0x12
              Read (0x02)
              Notify (0x10)
            Value Handle: 0x0052
            Value UUID: Incoming Call (0x2bc1)
        Handle: 0x0054
        Value: 125500c22b
            Properties: 0x12
              Read (0x02)
              Notify (0x10)
            Value Handle: 0x0055
            Value UUID: Call Friendly Name (0x2bc2)
> HCI Event: Number of Completed Packets (0x13) plen 5    #291 [hci1] 19.583432
        Num handles: 1
        Handle: 2883 Address: DF:A9:FF:F6:B1:1A (OUI DF-A9-FF)
        Count: 1
        #290: len 20 (0 Kb/s)
        Latency: 174 msec (66-174 msec ~168 msec)
> ACL Data RX: Handle 2883 flags 0x02 dlen 11             #292 [hci1] 19.583664
      ATT: Read By Type Request (0x08) len 6
        Handle range: 0x0055-0x0056
        Attribute type: Characteristic (0x2803)
< HCI Command: Host Number of Com.. (0x03|0x0035) plen 5  #293 [hci1] 19.589061
        Num handles: 1
        Handle: 2883 Address: DF:A9:FF:F6:B1:1A (OUI DF-A9-FF)
        Count: 1
< ACL Data TX: Handle 2883 flags 0x00 dlen 9              #294 [hci1] 19.589163
      ATT: Error Response (0x01) len 4
        Read By Type Request (0x08)
        Handle: 0x0055
        Error: Attribute Not Found (0x0a)
> HCI Event: Number of Completed Packets (0x13) plen 5    #295 [hci1] 19.758413
        Num handles: 1
        Handle: 2883 Address: DF:A9:FF:F6:B1:1A (OUI DF-A9-FF)
        Count: 1
        #294: len 9 (0 Kb/s)
        Latency: 169 msec (66-174 msec ~168 msec)
> ACL Data RX: Handle 2883 flags 0x02 dlen 9              #296 [hci1] 19.758584
      ATT: Find Information Request (0x04) len 4
        Handle range: 0x002d-0x002d
< HCI Command: Host Number of Com.. (0x03|0x0035) plen 5  #297 [hci1] 19.768987
        Num handles: 1
        Handle: 2883 Address: DF:A9:FF:F6:B1:1A (OUI DF-A9-FF)
        Count: 1
< ACL Data TX: Handle 2883 flags 0x00 dlen 10             #298 [hci1] 19.769029
      ATT: Find Information Response (0x05) len 5
        Format: UUID-16 (0x01)
        Handle: 0x002d
        UUID: Client Characteristic Configuration (0x2902)
> HCI Event: Number of Completed Packets (0x13) plen 5    #299 [hci1] 19.933369
        Num handles: 1
        Handle: 2883 Address: DF:A9:FF:F6:B1:1A (OUI DF-A9-FF)
        Count: 1
        #298: len 10 (0 Kb/s)
        Latency: 164 msec (66-174 msec ~166 msec)
> ACL Data RX: Handle 2883 flags 0x02 dlen 9              #300 [hci1] 19.933652
      ATT: Find Information Request (0x04) len 4
        Handle range: 0x0032-0x0032
< HCI Command: Host Number of Com.. (0x03|0x0035) plen 5  #301 [hci1] 19.949081
        Num handles: 1
        Handle: 2883 Address: DF:A9:FF:F6:B1:1A (OUI DF-A9-FF)
        Count: 1
< ACL Data TX: Handle 2883 flags 0x00 dlen 10             #302 [hci1] 19.949131
      ATT: Find Information Response (0x05) len 5
        Format: UUID-16 (0x01)
        Handle: 0x0032
        UUID: Client Characteristic Configuration (0x2902)
> HCI Event: Number of Completed Packets (0x13) plen 5    #303 [hci1] 20.108356
        Num handles: 1
        Handle: 2883 Address: DF:A9:FF:F6:B1:1A (OUI DF-A9-FF)
        Count: 1
        #302: len 10 (0 Kb/s)
        Latency: 159 msec (66-174 msec ~162 msec)
> ACL Data RX: Handle 2883 flags 0x02 dlen 9              #304 [hci1] 20.108627
      ATT: Find Information Request (0x04) len 4
        Handle range: 0x0035-0x0035
< HCI Command: Host Number of Com.. (0x03|0x0035) plen 5  #305 [hci1] 20.109195
        Num handles: 1
        Handle: 2883 Address: DF:A9:FF:F6:B1:1A (OUI DF-A9-FF)
        Count: 1
< ACL Data TX: Handle 2883 flags 0x00 dlen 10             #306 [hci1] 20.109242
      ATT: Find Information Response (0x05) len 5
        Format: UUID-16 (0x01)
        Handle: 0x0035
        UUID: Client Characteristic Configuration (0x2902)
> HCI Event: Number of Completed Packets (0x13) plen 5    #307 [hci1] 20.283433
        Num handles: 1
        Handle: 2883 Address: DF:A9:FF:F6:B1:1A (OUI DF-A9-FF)
        Count: 1
        #306: len 10 (0 Kb/s)
        Latency: 174 msec (66-174 msec ~168 msec)
> ACL Data RX: Handle 2883 flags 0x02 dlen 9              #308 [hci1] 20.283663
      ATT: Find Information Request (0x04) len 4
        Handle range: 0x0038-0x0038
< HCI Command: Host Number of Com.. (0x03|0x0035) plen 5  #309 [hci1] 20.289424
        Num handles: 1
        Handle: 2883 Address: DF:A9:FF:F6:B1:1A (OUI DF-A9-FF)
        Count: 1
< ACL Data TX: Handle 2883 flags 0x00 dlen 10             #310 [hci1] 20.289537
      ATT: Find Information Response (0x05) len 5
        Format: UUID-16 (0x01)
        Handle: 0x0038
        UUID: Client Characteristic Configuration (0x2902)
> HCI Event: Number of Completed Packets (0x13) plen 5    #311 [hci1] 20.458362
        Num handles: 1
        Handle: 2883 Address: DF:A9:FF:F6:B1:1A (OUI DF-A9-FF)
        Count: 1
        #310: len 10 (0 Kb/s)
        Latency: 168 msec (66-174 msec ~168 msec)
> ACL Data RX: Handle 2883 flags 0x02 dlen 9              #312 [hci1] 20.458613
      ATT: Find Information Request (0x04) len 4
        Handle range: 0x003d-0x003d
< HCI Command: Host Number of Com.. (0x03|0x0035) plen 5  #313 [hci1] 20.469100
        Num handles: 1
        Handle: 2883 Address: DF:A9:FF:F6:B1:1A (OUI DF-A9-FF)
        Count: 1
< ACL Data TX: Handle 2883 flags 0x00 dlen 10             #314 [hci1] 20.469145
      ATT: Find Information Response (0x05) len 5
        Format: UUID-16 (0x01)
        Handle: 0x003d
        UUID: Client Characteristic Configuration (0x2902)
> HCI Event: Number of Completed Packets (0x13) plen 5    #315 [hci1] 20.633409
        Num handles: 1
        Handle: 2883 Address: DF:A9:FF:F6:B1:1A (OUI DF-A9-FF)
        Count: 1
        #314: len 10 (0 Kb/s)
        Latency: 164 msec (66-174 msec ~166 msec)
> ACL Data RX: Handle 2883 flags 0x02 dlen 9              #316 [hci1] 20.633583
      ATT: Find Information Request (0x04) len 4
        Handle range: 0x0042-0x0042
< HCI Command: Host Number of Com.. (0x03|0x0035) plen 5  #317 [hci1] 20.649458
        Num handles: 1
        Handle: 2883 Address: DF:A9:FF:F6:B1:1A (OUI DF-A9-FF)
        Count: 1
< ACL Data TX: Handle 2883 flags 0x00 dlen 10             #318 [hci1] 20.649507
      ATT: Find Information Response (0x05) len 5
        Format: UUID-16 (0x01)
        Handle: 0x0042
        UUID: Client Characteristic Configuration (0x2902)
> HCI Event: Number of Completed Packets (0x13) plen 5    #319 [hci1] 20.808408
        Num handles: 1
        Handle: 2883 Address: DF:A9:FF:F6:B1:1A (OUI DF-A9-FF)
        Count: 1
        #318: len 10 (0 Kb/s)
        Latency: 158 msec (66-174 msec ~162 msec)
> ACL Data RX: Handle 2883 flags 0x02 dlen 9              #320 [hci1] 20.808638
      ATT: Find Information Request (0x04) len 4
        Handle range: 0x0045-0x0045
< HCI Command: Host Number of Com.. (0x03|0x0035) plen 5  #321 [hci1] 20.808970
        Num handles: 1
        Handle: 2883 Address: DF:A9:FF:F6:B1:1A (OUI DF-A9-FF)
        Count: 1
< ACL Data TX: Handle 2883 flags 0x00 dlen 10             #322 [hci1] 20.809062
      ATT: Find Information Response (0x05) len 5
        Format: UUID-16 (0x01)
        Handle: 0x0045
        UUID: Client Characteristic Configuration (0x2902)
> HCI Event: Number of Completed Packets (0x13) plen 5    #323 [hci1] 20.983474
        Num handles: 1
        Handle: 2883 Address: DF:A9:FF:F6:B1:1A (OUI DF-A9-FF)
        Count: 1
        #322: len 10 (0 Kb/s)
        Latency: 174 msec (66-174 msec ~168 msec)
> ACL Data RX: Handle 2883 flags 0x02 dlen 9              #324 [hci1] 20.983574
      ATT: Find Information Request (0x04) len 4
        Handle range: 0x0048-0x0048
< HCI Command: Host Number of Com.. (0x03|0x0035) plen 5  #325 [hci1] 20.989177
        Num handles: 1
        Handle: 2883 Address: DF:A9:FF:F6:B1:1A (OUI DF-A9-FF)
        Count: 1
< ACL Data TX: Handle 2883 flags 0x00 dlen 10             #326 [hci1] 20.989239
      ATT: Find Information Response (0x05) len 5
        Format: UUID-16 (0x01)
        Handle: 0x0048
        UUID: Client Characteristic Configuration (0x2902)
> HCI Event: Number of Completed Packets (0x13) plen 5    #327 [hci1] 21.158347
        Num handles: 1
        Handle: 2883 Address: DF:A9:FF:F6:B1:1A (OUI DF-A9-FF)
        Count: 1
        #326: len 10 (0 Kb/s)
        Latency: 169 msec (66-174 msec ~168 msec)
> ACL Data RX: Handle 2883 flags 0x02 dlen 9              #328 [hci1] 21.158585
      ATT: Find Information Request (0x04) len 4
        Handle range: 0x004b-0x004b
< HCI Command: Host Number of Com.. (0x03|0x0035) plen 5  #329 [hci1] 21.169034
        Num handles: 1
        Handle: 2883 Address: DF:A9:FF:F6:B1:1A (OUI DF-A9-FF)
        Count: 1
< ACL Data TX: Handle 2883 flags 0x00 dlen 10             #330 [hci1] 21.169085
      ATT: Find Information Response (0x05) len 5
        Format: UUID-16 (0x01)
        Handle: 0x004b
        UUID: Client Characteristic Configuration (0x2902)
> HCI Event: Number of Completed Packets (0x13) plen 5    #331 [hci1] 21.333411
        Num handles: 1
        Handle: 2883 Address: DF:A9:FF:F6:B1:1A (OUI DF-A9-FF)
        Count: 1
        #330: len 10 (0 Kb/s)
        Latency: 164 msec (66-174 msec ~166 msec)
> ACL Data RX: Handle 2883 flags 0x02 dlen 9              #332 [hci1] 21.333565
      ATT: Find Information Request (0x04) len 4
        Handle range: 0x0050-0x0050
< HCI Command: Host Number of Com.. (0x03|0x0035) plen 5  #333 [hci1] 21.349381
        Num handles: 1
        Handle: 2883 Address: DF:A9:FF:F6:B1:1A (OUI DF-A9-FF)
        Count: 1
< ACL Data TX: Handle 2883 flags 0x00 dlen 10             #334 [hci1] 21.349452
      ATT: Find Information Response (0x05) len 5
        Format: UUID-16 (0x01)
        Handle: 0x0050
        UUID: Client Characteristic Configuration (0x2902)
> HCI Event: Number of Completed Packets (0x13) plen 5    #335 [hci1] 21.508400
        Num handles: 1
        Handle: 2883 Address: DF:A9:FF:F6:B1:1A (OUI DF-A9-FF)
        Count: 1
        #334: len 10 (0 Kb/s)
        Latency: 158 msec (66-174 msec ~162 msec)
> ACL Data RX: Handle 2883 flags 0x02 dlen 9              #336 [hci1] 21.508604
      ATT: Find Information Request (0x04) len 4
        Handle range: 0x0053-0x0053
< HCI Command: Host Number of Com.. (0x03|0x0035) plen 5  #337 [hci1] 21.509063
        Num handles: 1
        Handle: 2883 Address: DF:A9:FF:F6:B1:1A (OUI DF-A9-FF)
        Count: 1
< ACL Data TX: Handle 2883 flags 0x00 dlen 10             #338 [hci1] 21.509136
      ATT: Find Information Response (0x05) len 5
        Format: UUID-16 (0x01)
        Handle: 0x0053
        UUID: Client Characteristic Configuration (0x2902)
> HCI Event: Number of Completed Packets (0x13) plen 5    #339 [hci1] 21.683403
        Num handles: 1
        Handle: 2883 Address: DF:A9:FF:F6:B1:1A (OUI DF-A9-FF)
        Count: 1
        #338: len 10 (0 Kb/s)
        Latency: 174 msec (66-174 msec ~168 msec)
> ACL Data RX: Handle 2883 flags 0x02 dlen 9              #340 [hci1] 21.683622
      ATT: Find Information Request (0x04) len 4
        Handle range: 0x0056-0x0056
< HCI Command: Host Number of Com.. (0x03|0x0035) plen 5  #341 [hci1] 21.689330
        Num handles: 1
        Handle: 2883 Address: DF:A9:FF:F6:B1:1A (OUI DF-A9-FF)
        Count: 1
< ACL Data TX: Handle 2883 flags 0x00 dlen 10             #342 [hci1] 21.689507
      ATT: Find Information Response (0x05) len 5
        Format: UUID-16 (0x01)
        Handle: 0x0056
        UUID: Client Characteristic Configuration (0x2902)
> HCI Event: Number of Completed Packets (0x13) plen 5    #343 [hci1] 21.858358
        Num handles: 1
        Handle: 2883 Address: DF:A9:FF:F6:B1:1A (OUI DF-A9-FF)
        Count: 1
        #342: len 10 (0 Kb/s)
        Latency: 168 msec (66-174 msec ~168 msec)
> ACL Data RX: Handle 2883 flags 0x02 dlen 9              #344 [hci1] 21.858642
      ATT: Write Request (0x12) len 4
        Handle: 0x0048
          Data: 0000
< HCI Command: Host Number of Com.. (0x03|0x0035) plen 5  #345 [hci1] 21.869149
        Num handles: 1
        Handle: 2883 Address: DF:A9:FF:F6:B1:1A (OUI DF-A9-FF)
        Count: 1
< ACL Data TX: Handle 2883 flags 0x00 dlen 5              #346 [hci1] 21.869198
      ATT: Write Response (0x13) len 0
> HCI Event: Number of Completed Packets (0x13) plen 5    #347 [hci1] 22.033412
        Num handles: 1
        Handle: 2883 Address: DF:A9:FF:F6:B1:1A (OUI DF-A9-FF)
        Count: 1
        #346: len 5 (0 Kb/s)
        Latency: 164 msec (66-174 msec ~166 msec)
> ACL Data RX: Handle 2883 flags 0x02 dlen 9              #348 [hci1] 22.033562
      ATT: Write Request (0x12) len 4
        Handle: 0x0048
          Data: 0100
< HCI Command: Host Number of Com.. (0x03|0x0035) plen 5  #349 [hci1] 22.049151
        Num handles: 1
        Handle: 2883 Address: DF:A9:FF:F6:B1:1A (OUI DF-A9-FF)
        Count: 1
< ACL Data TX: Handle 2883 flags 0x00 dlen 5              #350 [hci1] 22.049232
      ATT: Write Response (0x13) len 0
> HCI Event: Number of Completed Packets (0x13) plen 5    #351 [hci1] 22.208444
        Num handles: 1
        Handle: 2883 Address: DF:A9:FF:F6:B1:1A (OUI DF-A9-FF)
        Count: 1
        #350: len 5 (0 Kb/s)
        Latency: 159 msec (66-174 msec ~162 msec)
> ACL Data RX: Handle 2883 flags 0x02 dlen 9              #352 [hci1] 22.208533
      ATT: Write Request (0x12) len 4
        Handle: 0x0053
          Data: 0000
< HCI Command: Host Number of Com.. (0x03|0x0035) plen 5  #353 [hci1] 22.209231
        Num handles: 1
        Handle: 2883 Address: DF:A9:FF:F6:B1:1A (OUI DF-A9-FF)
        Count: 1
< ACL Data TX: Handle 2883 flags 0x00 dlen 5              #354 [hci1] 22.209330
      ATT: Write Response (0x13) len 0
> HCI Event: Number of Completed Packets (0x13) plen 5    #355 [hci1] 22.383349
        Num handles: 1
        Handle: 2883 Address: DF:A9:FF:F6:B1:1A (OUI DF-A9-FF)
        Count: 1
        #354: len 5 (0 Kb/s)
        Latency: 174 msec (66-174 msec ~168 msec)
> ACL Data RX: Handle 2883 flags 0x02 dlen 9              #356 [hci1] 22.383613
      ATT: Write Request (0x12) len 4
        Handle: 0x0053
          Data: 0100
< HCI Command: Host Number of Com.. (0x03|0x0035) plen 5  #357 [hci1] 22.389465
        Num handles: 1
        Handle: 2883 Address: DF:A9:FF:F6:B1:1A (OUI DF-A9-FF)
        Count: 1
< ACL Data TX: Handle 2883 flags 0x00 dlen 5              #358 [hci1] 22.389552
      ATT: Write Response (0x13) len 0
> HCI Event: Number of Completed Packets (0x13) plen 5    #359 [hci1] 22.558439
        Num handles: 1
        Handle: 2883 Address: DF:A9:FF:F6:B1:1A (OUI DF-A9-FF)
        Count: 1
        #358: len 5 (0 Kb/s)
        Latency: 168 msec (66-174 msec ~168 msec)
> ACL Data RX: Handle 2883 flags 0x02 dlen 9              #360 [hci1] 22.558655
      ATT: Write Request (0x12) len 4
        Handle: 0x0050
          Data: 0000
< HCI Command: Host Number of Com.. (0x03|0x0035) plen 5  #361 [hci1] 22.569080
        Num handles: 1
        Handle: 2883 Address: DF:A9:FF:F6:B1:1A (OUI DF-A9-FF)
        Count: 1
< ACL Data TX: Handle 2883 flags 0x00 dlen 5              #362 [hci1] 22.569125
      ATT: Write Response (0x13) len 0
> HCI Event: Number of Completed Packets (0x13) plen 5    #363 [hci1] 22.733422
        Num handles: 1
        Handle: 2883 Address: DF:A9:FF:F6:B1:1A (OUI DF-A9-FF)
        Count: 1
        #362: len 5 (0 Kb/s)
        Latency: 164 msec (66-174 msec ~166 msec)
> ACL Data RX: Handle 2883 flags 0x02 dlen 9              #364 [hci1] 22.733647
      ATT: Write Request (0x12) len 4
        Handle: 0x0050
          Data: 0100
< HCI Command: Host Number of Com.. (0x03|0x0035) plen 5  #365 [hci1] 22.749407
        Num handles: 1
        Handle: 2883 Address: DF:A9:FF:F6:B1:1A (OUI DF-A9-FF)
        Count: 1
< ACL Data TX: Handle 2883 flags 0x00 dlen 5              #366 [hci1] 22.749496
      ATT: Write Response (0x13) len 0
> HCI Event: Number of Completed Packets (0x13) plen 5    #367 [hci1] 22.908357
        Num handles: 1
        Handle: 2883 Address: DF:A9:FF:F6:B1:1A (OUI DF-A9-FF)
        Count: 1
        #366: len 5 (0 Kb/s)
        Latency: 158 msec (66-174 msec ~162 msec)
> ACL Data RX: Handle 2883 flags 0x02 dlen 9              #368 [hci1] 22.908556
      ATT: Write Request (0x12) len 4
        Handle: 0x004b
          Data: 0000
< HCI Command: Host Number of Com.. (0x03|0x0035) plen 5  #369 [hci1] 22.909007
        Num handles: 1
        Handle: 2883 Address: DF:A9:FF:F6:B1:1A (OUI DF-A9-FF)
        Count: 1
< ACL Data TX: Handle 2883 flags 0x00 dlen 5              #370 [hci1] 22.909015
      ATT: Write Response (0x13) len 0
> HCI Event: Number of Completed Packets (0x13) plen 5    #371 [hci1] 23.083379
        Num handles: 1
        Handle: 2883 Address: DF:A9:FF:F6:B1:1A (OUI DF-A9-FF)
        Count: 1
        #370: len 5 (0 Kb/s)
        Latency: 174 msec (66-174 msec ~168 msec)
> ACL Data RX: Handle 2883 flags 0x02 dlen 9              #372 [hci1] 23.083561
      ATT: Write Request (0x12) len 4
        Handle: 0x004b
          Data: 0100
< HCI Command: Host Number of Com.. (0x03|0x0035) plen 5  #373 [hci1] 23.089106
        Num handles: 1
        Handle: 2883 Address: DF:A9:FF:F6:B1:1A (OUI DF-A9-FF)
        Count: 1
< ACL Data TX: Handle 2883 flags 0x00 dlen 5              #374 [hci1] 23.089148
      ATT: Write Response (0x13) len 0
> HCI Event: Number of Completed Packets (0x13) plen 5    #375 [hci1] 23.258454
        Num handles: 1
        Handle: 2883 Address: DF:A9:FF:F6:B1:1A (OUI DF-A9-FF)
        Count: 1
        #374: len 5 (0 Kb/s)
        Latency: 169 msec (66-174 msec ~168 msec)
> ACL Data RX: Handle 2883 flags 0x02 dlen 9              #376 [hci1] 23.258518
      ATT: Write Request (0x12) len 4
        Handle: 0x0045
          Data: 0000
< HCI Command: Host Number of Com.. (0x03|0x0035) plen 5  #377 [hci1] 23.269426
        Num handles: 1
        Handle: 2883 Address: DF:A9:FF:F6:B1:1A (OUI DF-A9-FF)
        Count: 1
< ACL Data TX: Handle 2883 flags 0x00 dlen 5              #378 [hci1] 23.269582
      ATT: Write Response (0x13) len 0
> HCI Event: Number of Completed Packets (0x13) plen 5    #379 [hci1] 23.433311
        Num handles: 1
        Handle: 2883 Address: DF:A9:FF:F6:B1:1A (OUI DF-A9-FF)
        Count: 1
        #378: len 5 (0 Kb/s)
        Latency: 163 msec (66-174 msec ~166 msec)
> ACL Data RX: Handle 2883 flags 0x02 dlen 9              #380 [hci1] 23.433611
      ATT: Write Request (0x12) len 4
        Handle: 0x0045
          Data: 0100
< HCI Command: Host Number of Com.. (0x03|0x0035) plen 5  #381 [hci1] 23.449470
        Num handles: 1
        Handle: 2883 Address: DF:A9:FF:F6:B1:1A (OUI DF-A9-FF)
        Count: 1
< ACL Data TX: Handle 2883 flags 0x00 dlen 5              #382 [hci1] 23.449493
      ATT: Write Response (0x13) len 0
> HCI Event: Number of Completed Packets (0x13) plen 5    #383 [hci1] 23.608332
        Num handles: 1
        Handle: 2883 Address: DF:A9:FF:F6:B1:1A (OUI DF-A9-FF)
        Count: 1
        #382: len 5 (0 Kb/s)
        Latency: 158 msec (66-174 msec ~162 msec)
> ACL Data RX: Handle 2883 flags 0x02 dlen 9              #384 [hci1] 23.608546
      ATT: Write Request (0x12) len 4
        Handle: 0x0056
          Data: 0000
< HCI Command: Host Number of Com.. (0x03|0x0035) plen 5  #385 [hci1] 23.609273
        Num handles: 1
        Handle: 2883 Address: DF:A9:FF:F6:B1:1A (OUI DF-A9-FF)
        Count: 1
< ACL Data TX: Handle 2883 flags 0x00 dlen 5              #386 [hci1] 23.609289
      ATT: Write Response (0x13) len 0
> HCI Event: Number of Completed Packets (0x13) plen 5    #387 [hci1] 23.783357
        Num handles: 1
        Handle: 2883 Address: DF:A9:FF:F6:B1:1A (OUI DF-A9-FF)
        Count: 1
        #386: len 5 (0 Kb/s)
        Latency: 174 msec (66-174 msec ~168 msec)
> ACL Data RX: Handle 2883 flags 0x02 dlen 9              #388 [hci1] 23.783460
      ATT: Write Request (0x12) len 4
        Handle: 0x0056
          Data: 0100
< HCI Command: Host Number of Com.. (0x03|0x0035) plen 5  #389 [hci1] 23.789124
        Num handles: 1
        Handle: 2883 Address: DF:A9:FF:F6:B1:1A (OUI DF-A9-FF)
        Count: 1
< ACL Data TX: Handle 2883 flags 0x00 dlen 5              #390 [hci1] 23.789158
      ATT: Write Response (0x13) len 0
> HCI Event: Number of Completed Packets (0x13) plen 5    #391 [hci1] 23.958342
        Num handles: 1
        Handle: 2883 Address: DF:A9:FF:F6:B1:1A (OUI DF-A9-FF)
        Count: 1
        #390: len 5 (0 Kb/s)
        Latency: 169 msec (66-174 msec ~168 msec)
> ACL Data RX: Handle 2883 flags 0x02 dlen 9              #392 [hci1] 23.958713
      ATT: Write Request (0x12) len 4
        Handle: 0x0038
          Data: 0000
< HCI Command: Host Number of Com.. (0x03|0x0035) plen 5  #393 [hci1] 23.969429
        Num handles: 1
        Handle: 2883 Address: DF:A9:FF:F6:B1:1A (OUI DF-A9-FF)
        Count: 1
< ACL Data TX: Handle 2883 flags 0x00 dlen 5              #394 [hci1] 23.969549
      ATT: Write Response (0x13) len 0
> HCI Event: Number of Completed Packets (0x13) plen 5    #395 [hci1] 24.133383
        Num handles: 1
        Handle: 2883 Address: DF:A9:FF:F6:B1:1A (OUI DF-A9-FF)
        Count: 1
        #394: len 5 (0 Kb/s)
        Latency: 163 msec (66-174 msec ~166 msec)
> ACL Data RX: Handle 2883 flags 0x02 dlen 9              #396 [hci1] 24.133527
      ATT: Write Request (0x12) len 4
        Handle: 0x0038
          Data: 0100
< HCI Command: Host Number of Com.. (0x03|0x0035) plen 5  #397 [hci1] 24.149285
        Num handles: 1
        Handle: 2883 Address: DF:A9:FF:F6:B1:1A (OUI DF-A9-FF)
        Count: 1
< ACL Data TX: Handle 2883 flags 0x00 dlen 5              #398 [hci1] 24.149390
      ATT: Write Response (0x13) len 0
> HCI Event: Number of Completed Packets (0x13) plen 5    #399 [hci1] 24.308278
        Num handles: 1
        Handle: 2883 Address: DF:A9:FF:F6:B1:1A (OUI DF-A9-FF)
        Count: 1
        #398: len 5 (0 Kb/s)
        Latency: 158 msec (66-174 msec ~162 msec)
> ACL Data RX: Handle 2883 flags 0x02 dlen 7              #400 [hci1] 24.308499
      ATT: Read Request (0x0a) len 2
        Handle: 0x0041
< HCI Command: Host Number of Com.. (0x03|0x0035) plen 5  #401 [hci1] 24.309467
        Num handles: 1
        Handle: 2883 Address: DF:A9:FF:F6:B1:1A (OUI DF-A9-FF)
        Count: 1
< ACL Data TX: Handle 2883 flags 0x00 dlen 7              #402 [hci1] 24.309550
      ATT: Read Response (0x0b) len 2
> HCI Event: Number of Completed Packets (0x13) plen 5    #403 [hci1] 24.483303
        Num handles: 1
        Handle: 2883 Address: DF:A9:FF:F6:B1:1A (OUI DF-A9-FF)
        Count: 1
        #402: len 7 (0 Kb/s)
        Latency: 173 msec (66-174 msec ~168 msec)
> ACL Data RX: Handle 2883 flags 0x02 dlen 7              #404 [hci1] 24.483602
      ATT: Read Request (0x0a) len 2
        Handle: 0x004d
< HCI Command: Host Number of Com.. (0x03|0x0035) plen 5  #405 [hci1] 24.489579
        Num handles: 1
        Handle: 2883 Address: DF:A9:FF:F6:B1:1A (OUI DF-A9-FF)
        Count: 1
< ACL Data TX: Handle 2883 flags 0x00 dlen 7              #406 [hci1] 24.489704
      ATT: Read Response (0x0b) len 2
> HCI Event: Number of Completed Packets (0x13) plen 5    #407 [hci1] 24.658418
        Num handles: 1
        Handle: 2883 Address: DF:A9:FF:F6:B1:1A (OUI DF-A9-FF)
        Count: 1
        #406: len 7 (0 Kb/s)
        Latency: 168 msec (66-174 msec ~168 msec)
> ACL Data RX: Handle 2883 flags 0x02 dlen 21             #408 [hci1] 24.658870
      ATT: Write Command (0x52) len 16
        Handle: 0x004a
          Data: 04424c5545544f4f544831323334
< HCI Command: Host Number of Com.. (0x03|0x0035) plen 5  #409 [hci1] 24.669580
        Num handles: 1
        Handle: 2883 Address: DF:A9:FF:F6:B1:1A (OUI DF-A9-FF)
        Count: 1
< ACL Data TX: Handle 2883 flags 0x00 dlen 10             #410 [hci1] 24.670077
      ATT: Handle Value Notification (0x1b) len 5
        Handle: 0x004a
          Data: 040006
> HCI Event: Number of Completed Packets (0x13) plen 5    #411 [hci1] 24.833241
        Num handles: 1
        Handle: 2883 Address: DF:A9:FF:F6:B1:1A (OUI DF-A9-FF)
        Count: 1
        #410: len 10 (0 Kb/s)
        Latency: 163 msec (66-174 msec ~165 msec)
> HCI Event: Disconnect Complete (0x05) plen 4            #412 [hci1] 26.233433
        Status: Success (0x00)
        Handle: 2883 Address: DF:A9:FF:F6:B1:1A (OUI DF-A9-FF)
        Reason: Remote User Terminated Connection (0x13)
< HCI Command: Reset (0x03|0x0003) plen 0                 #413 [hci1] 32.188965
> HCI Event: Command Complete (0x0e) plen 4               #414 [hci1] 32.189476
      Reset (0x03|0x0003) ncmd 1
        Status: Success (0x00)
@ USER Close: main                                    {0x0001} [hci1] 32.208859
= Close Index: 00:00:00:00:00:00                               [hci1] 32.208867
