Bluetooth monitor ver 5.72
btmon[1801068]: = Note: Linux version 6.14.0-36-generic (x86_64)                                                         0.870995
btmon[1801068]: = Note: Bluetooth subsystem version 2.22                                                                 0.870997
= New Index: 00:00:00:00:00:00 (Primary,UART,hci1)                                                                       0.870998
= New Index: 48:5F:99:8E:E0:64 (Primary,USB,hci0)                                                                        0.870998
= Open Index: 00:00:00:00:00:00                                                                                          1.384867
= Index Info: 00:00:00:00:00:00 (Nordic Semiconductor ASA)                                                               1.384878
zephyr.exe[1801070]: @ USER Open: main (privileged) version 2.22                                                {0x0001} 1.384881
zephyr.exe[1801070]: < HCI Command: Reset (0x03|0x0003) plen 0                                                        #1 1.385150
> HCI Event: Command Complete (0x0e) plen 4                                                                           #2 1.385663
      Reset (0x03|0x0003) ncmd 1
        Status: Success (0x00)
zephyr.exe[1801070]: < HCI Command: Read Local Supported Features (0x04|0x0003) plen 0                                #3 1.404793
> HCI Event: Command Complete (0x0e) plen 12                                                                          #4 1.405267
      Read Local Supported Features (0x04|0x0003) ncmd 1
        Status: Success (0x00)
        Features: 0x00 0x00 0x00 0x00 0x60 0x00 0x00 0x00
          BR/EDR Not Supported
          LE Supported (Controller)
zephyr.exe[1801070]: < HCI Command: Read Local Version Information (0x04|0x0001) plen 0                               #5 1.424842
> HCI Event: Command Complete (0x0e) plen 12                                                                          #6 1.425454
      Read Local Version Information (0x04|0x0001) ncmd 1
        Status: Success (0x00)
        HCI version: Reserved (0x0f) - Revision 12393 (0x3069)
        LMP version: Reserved (0x0f) - Subversion 12393 (0x3069)
        Manufacturer: Nordic Semiconductor ASA (89)
zephyr.exe[1801070]: < HCI Command: Read Local Supported Commands (0x04|0x0002) plen 0                                #7 1.444850
> HCI Event: Command Complete (0x0e) plen 68                                                                          #8 1.445962
      Read Local Supported Commands (0x04|0x0002) ncmd 1
        Status: Success (0x00)
        Commands: 119 entries
          Disconnect (Octet 0 - Bit 5)
          Read Remote Version Information (Octet 2 - Bit 7)
          Set Event Mask (Octet 5 - Bit 6)
          Reset (Octet 5 - Bit 7)
          Read Connection Accept Timeout (Octet 7 - Bit 2)
          Write Connection Accept Timeout (Octet 7 - Bit 3)
          Read Transmit Power Level (Octet 10 - Bit 2)
          Set Controller To Host Flow Control (Octet 10 - Bit 5)
          Host Buffer Size (Octet 10 - Bit 6)
          Host Number of Completed Packets (Octet 10 - Bit 7)
          Read Local Version Information (Octet 14 - Bit 3)
          Read Local Supported Features (Octet 14 - Bit 5)
          Read BD ADDR (Octet 15 - Bit 1)
          Read RSSI (Octet 15 - Bit 5)
          Set Event Mask Page 2 (Octet 22 - Bit 2)
          LE Set Event Mask (Octet 25 - Bit 0)
          LE Read Buffer Size (Octet 25 - Bit 1)
          LE Read Local Supported Features (Octet 25 - Bit 2)
          LE Set Random Address (Octet 25 - Bit 4)
          LE Set Advertising Parameters (Octet 25 - Bit 5)
          LE Read Advertising Channel TX Power (Octet 25 - Bit 6)
          LE Set Advertising Data (Octet 25 - Bit 7)
          LE Set Scan Response Data (Octet 26 - Bit 0)
          LE Set Advertise Enable (Octet 26 - Bit 1)
          LE Set Scan Parameters (Octet 26 - Bit 2)
          LE Set Scan Enable (Octet 26 - Bit 3)
          LE Create Connection (Octet 26 - Bit 4)
          LE Create Connection Cancel (Octet 26 - Bit 5)
          LE Read Accept List Size (Octet 26 - Bit 6)
          LE Clear Accept List (Octet 26 - Bit 7)
          LE Add Device To Accept List (Octet 27 - Bit 0)
          LE Remove Device From Accept List (Octet 27 - Bit 1)
          LE Connection Update (Octet 27 - Bit 2)
          LE Set Host Channel Classification (Octet 27 - Bit 3)
          LE Read Channel Map (Octet 27 - Bit 4)
          LE Read Remote Used Features (Octet 27 - Bit 5)
          LE Encrypt (Octet 27 - Bit 6)
          LE Rand (Octet 27 - Bit 7)
          LE Start Encryption (Octet 28 - Bit 0)
          LE Long Term Key Request Reply (Octet 28 - Bit 1)
          LE Long Term Key Request Neg Reply (Octet 28 - Bit 2)
          LE Read Supported States (Octet 28 - Bit 3)
          LE Receiver Test (Octet 28 - Bit 4)
          LE Transmitter Test (Octet 28 - Bit 5)
          LE Test End (Octet 28 - Bit 6)
          Read Authenticated Payload Timeout (Octet 32 - Bit 4)
          Write Authenticated Payload Timeout (Octet 32 - Bit 5)
          LE Set Data Length (Octet 33 - Bit 6)
          LE Read Suggested Default Data Length (Octet 33 - Bit 7)
          LE Write Suggested Default Data Length (Octet 34 - Bit 0)
          LE Add Device To Resolving List (Octet 34 - Bit 3)
          LE Remove Device From Resolving List (Octet 34 - Bit 4)
          LE Clear Resolving List (Octet 34 - Bit 5)
          LE Read Resolving List Size (Octet 34 - Bit 6)
          LE Set Address Resolution Enable (Octet 35 - Bit 1)
          LE Set Resolvable Private Address Timeout (Octet 35 - Bit 2)
          LE Read Maximum Data Length (Octet 35 - Bit 3)
          LE Read PHY (Octet 35 - Bit 4)
          LE Set Default PHY (Octet 35 - Bit 5)
          LE Set PHY (Octet 35 - Bit 6)
          LE Enhanced Receiver Test (Octet 35 - Bit 7)
          LE Enhanced Transmitter Test (Octet 36 - Bit 0)
          LE Set Advertising Set Random Address (Octet 36 - Bit 1)
          LE Set Extended Advertising Parameters (Octet 36 - Bit 2)
          LE Set Extended Advertising Data (Octet 36 - Bit 3)
          LE Set Extended Scan Response Data (Octet 36 - Bit 4)
          LE Set Extended Advertising Enable (Octet 36 - Bit 5)
          LE Read Maximum Advertising Data Length (Octet 36 - Bit 6)
          LE Read Number of Supported Advertising Sets (Octet 36 - Bit 7)
          LE Remove Advertising Set (Octet 37 - Bit 0)
          LE Clear Advertising Sets (Octet 37 - Bit 1)
          LE Set Periodic Advertising Parameters (Octet 37 - Bit 2)
          LE Set Periodic Advertising Data (Octet 37 - Bit 3)
          LE Set Periodic Advertising Enable (Octet 37 - Bit 4)
          LE Set Extended Scan Parameters (Octet 37 - Bit 5)
          LE Set Extended Scan Enable (Octet 37 - Bit 6)
          LE Extended Create Connection (Octet 37 - Bit 7)
          LE Periodic Advertising Create Sync (Octet 38 - Bit 0)
          LE Periodic Advertising Create Sync Cancel (Octet 38 - Bit 1)
          LE Periodic Advertising Terminate Sync (Octet 38 - Bit 2)
          LE Add Device To Periodic Advertiser List (Octet 38 - Bit 3)
          LE Remove Device From Periodic Advertiser List (Octet 38 - Bit 4)
          LE Clear Periodic Advertiser List (Octet 38 - Bit 5)
          LE Read Periodic Advertiser List Size (Octet 38 - Bit 6)
          LE Read Transmit Power (Octet 38 - Bit 7)
          LE Read RF Path Compensation (Octet 39 - Bit 0)
          LE Write RF Path Compensation (Octet 39 - Bit 1)
          LE Set Privacy Mode (Octet 39 - Bit 2)
          LE Periodic Advertising Receive Enable (Octet 40 - Bit 5)
          LE Periodic Advertising Sync Transfer (Octet 40 - Bit 6)
          LE Periodic Advertising Set Info Transfer (Octet 40 - Bit 7)
          LE Periodic Advertising Sync Transfer Parameters (Octet 41 - Bit 0)
          LE Set Default Periodic Advertisng Sync Transfer Parameters (Octet 41 - Bit 1)
          LE Read Buffer v2 (Octet 41 - Bit 5)
          LE Read ISO TX Sync (Octet 41 - Bit 6)
          LE Set Connected Isochronous Group Parameters (Octet 41 - Bit 7)
          LE Set Connected Isochronous Group Parameters Test (Octet 42 - Bit 0)
          LE Create Connected Isochronous Stream (Octet 42 - Bit 1)
          LE Remove Connected Isochronous Group (Octet 42 - Bit 2)
          LE Accept Connected Isochronous Stream Request (Octet 42 - Bit 3)
          LE Reject Connected Isochronous Stream Request (Octet 42 - Bit 4)
          LE Create Broadcast Isochronous Group (Octet 42 - Bit 5)
          LE Create Broadcast Isochronous Group Test (Octet 42 - Bit 6)
          LE Terminate Broadcast Isochronous Group (Octet 42 - Bit 7)
          LE Broadcast Isochronous Group Create Sync (Octet 43 - Bit 0)
          LE Broadcast Isochronous Group Terminate Sync (Octet 43 - Bit 1)
          LE Request Peer SCA (Octet 43 - Bit 2)
          LE Setup Isochronous Data Path (Octet 43 - Bit 3)
          LE Remove Isochronous Data Path (Octet 43 - Bit 4)
          LE Isochronous Transmit Test (Octet 43 - Bit 5)
          LE Isochronous Receive Test (Octet 43 - Bit 6)
          LE Isochronous Read Test Counters (Octet 43 - Bit 7)
          LE Isochronous Read Test Counters (Octet 44 - Bit 0)
          LE Set Host Feature (Octet 44 - Bit 1)
          Octet 44 - Bit 2 
          Octet 45 - Bit 6 
          Octet 46 - Bit 0 
          Octet 46 - Bit 1 
          Octet 46 - Bit 2 
zephyr.exe[1801070]: < HCI Command: Host Buffer Size (0x03|0x0033) plen 7                                             #9 1.464768
        ACL MTU: 255  ACL max packet: 16
        SCO MTU: 0    SCO max packet: 0
> HCI Event: Command Complete (0x0e) plen 4                                                                          #10 1.465299
      Host Buffer Size (0x03|0x0033) ncmd 1
        Status: Success (0x00)
zephyr.exe[1801070]: < HCI Command: Set Controller To Host Flow Control (0x03|0x0031) plen 1                         #11 1.484869
        Flow control: ACL Data Packets (0x01)
> HCI Event: Command Complete (0x0e) plen 4                                                                          #12 1.485365
      Set Controller To Host Flow Control (0x03|0x0031) ncmd 1
        Status: Success (0x00)
zephyr.exe[1801070]: < HCI Command: LE Read Local Supported Features (0x08|0x0003) plen 0                            #13 1.504850
> HCI Event: Command Complete (0x0e) plen 12                                                                         #14 1.505435
      LE Read Local Supported Features (0x08|0x0003) ncmd 1
        Status: Success (0x00)
        Features: 0xfd 0x79 0x00 0xf7 0x30 0x01 0x00 0x00
          LE Encryption
          Extended Reject Indication
          Peripheral-initiated Features Exchange
          LE Ping
          LE Data Packet Length Extension
          LL Privacy
          Extended Scanner Filter Policies
          LE 2M PHY
          LE Coded PHY
          LE Extended Advertising
          LE Periodic Advertising
          Channel Selection Algorithm #2
          Periodic Advertising Sync Transfer - Sender
          Periodic Advertising Sync Transfer - Recipient
          Sleep Clock Accuracy Updates
          Connected Isochronous Stream - Central
          Connected Isochronous Stream - Peripheral
          Isochronous Broadcaster
          Synchronized Receiver
          Periodic Advertising ADI support
          Connection Subrating
          Unknown features (0x0000010000000000)
zephyr.exe[1801070]: < HCI Command: LE Set Host Feature (0x08|0x0074) plen 2                                         #15 1.524753
        Bit Number: 32
          Connected Isochronous Stream (Host Support)
        Bit Value: 1
> HCI Event: Command Complete (0x0e) plen 4                                                                          #16 1.525170
      LE Set Host Feature (0x08|0x0074) ncmd 1
        Status: Success (0x00)
zephyr.exe[1801070]: < HCI Command: LE Read Buffer v2 (0x08|0x0060) plen 0                                           #17 1.544822
> HCI Event: Command Complete (0x0e) plen 10                                                                         #18 1.545345
      LE Read Buffer v2 (0x08|0x0060) ncmd 1
        Status: Success (0x00)
        ACL MTU: 27
        ACL max packet: 3
        ISO MTU: 318
        ISO max packet: 3
zephyr.exe[1801070]: < HCI Command: LE Read Maximum Advertising Data Length (0x08|0x003a) plen 0                     #19 1.564802
> HCI Event: Command Complete (0x0e) plen 6                                                                          #20 1.565210
      LE Read Maximum Advertising Data Length (0x08|0x003a) ncmd 1
        Status: Success (0x00)
        Max length: 1650
zephyr.exe[1801070]: < HCI Command: LE Read Supported States (0x08|0x001c) plen 0                                    #21 1.584811
> HCI Event: Command Complete (0x0e) plen 12                                                                         #22 1.585293
      LE Read Supported States (0x08|0x001c) ncmd 1
        Status: Success (0x00)
        States: 0x000003ff3e0306ff
          Non-connectable Advertising State
          Scannable Advertising State
          Connectable Advertising State
          High Duty Cycle Directed Advertising State
          Passive Scanning State
          Active Scanning State
          Initiating State
            and Connection State (Central Role)
          Connection State (Peripheral Role)
          Scannable Advertising State
            and Passive Scanning State
          Connectable Advertising State
            and Passive Scanning State
          Non-connectable Advertising State
            and Initiating State
          Scannable Advertising State
            and Initiating State
          Active Scanning State
            and Connection State (Central Role)
          Passive Scanning State
            and Connection State (Peripheral Role)
          Active Scanning State
            and Connection State (Peripheral Role)
          Initiating State
            and Connection State (Central Role)
            and Central Role & Central Role
          Low Duty Cycle Directed Advertising State
          Connectable Advertising State
            and Initiating State
            and Central Role & Peripheral Role
          High Duty Cycle Directed Advertising State
            and Initiating State
            and Central Role & Peripheral Role
          Low Duty Cycle Directed Advertising State
            and Initiating State
            and Central Role & Peripheral Role
          Connectable Advertising State
            and Connection State (Central Role)
            and Central Role & Peripheral Role
          High Duty Cycle Directed Advertising State
            and Connection State (Central Role)
            and Central Role & Peripheral Role
          Low Duty Cycle Directed Advertising State
            and Connection State (Central Role)
            and Central Role & Peripheral Role
          Connectable Advertising State
            and Connection State (Peripheral Role)
            and Central Role & Peripheral Role
          High Duty Cycle Directed Advertising State
            and Connection State (Peripheral Role)
            and Peripheral Role & Peripheral Role
          Low Duty Cycle Directed Advertising State
            and Connection State (Peripheral Role)
            and Peripheral Role & Peripheral Role
          Initiating State
            and Connection State (Peripheral Role)
            and Central Role & Peripheral Role
zephyr.exe[1801070]: < HCI Command: LE Read Maximum Data Length (0x08|0x002f) plen 0                                 #23 1.604750
> HCI Event: Command Complete (0x0e) plen 12                                                                         #24 1.605285
      LE Read Maximum Data Length (0x08|0x002f) ncmd 1
        Status: Success (0x00)
        Max TX octets: 251
        Max TX time: 2704
        Max RX octets: 251
        Max RX time: 2704
zephyr.exe[1801070]: < HCI Command: LE Write Suggested Default Data Length (0x08|0x0024) plen 4                      #25 1.624740
        TX octets: 251
        TX time: 2704
> HCI Event: Command Complete (0x0e) plen 4                                                                          #26 1.625245
      LE Write Suggested Default Data Length (0x08|0x0024) ncmd 1
        Status: Success (0x00)
zephyr.exe[1801070]: < HCI Command: LE Read Resolving List Size (0x08|0x002a) plen 0                                 #27 1.644756
> HCI Event: Command Complete (0x0e) plen 5                                                                          #28 1.645249
      LE Read Resolving List Size (0x08|0x002a) ncmd 1
        Status: Success (0x00)
        Size: 8
zephyr.exe[1801070]: < HCI Command: LE Set Event Mask (0x08|0x0001) plen 8                                           #29 1.664820
        Mask: 0x000002023f87fa5e
          LE Advertising Report
          LE Connection Update Complete
          LE Read Remote Used Features Complete
          LE Long Term Key Request
          LE Data Length Change
          LE Enhanced Connection Complete
          LE PHY Update Complete
          LE Extended Advertising Report
          LE Periodic Advertising Sync Established
          LE Periodic Advertising Report
          LE Periodic Advertising Sync Lost
          LE Extended Scan Timeout
          LE Extended Advertising Set Terminated
          LE Scan Request Received
          LE Periodic Advertising Sync Transfer Rvc
          LE CIS Established
          LE CIS Request
          LE Create BIG Complete
          LE Terminate BIG Complete
          LE BIG Sync Estabilished Complete
          LE BIG Sync Lost
          LE BIG Info Advertising Report
          Unknown mask (0x0000020000000000)
> HCI Event: Command Complete (0x0e) plen 4                                                                          #30 1.665341
      LE Set Event Mask (0x08|0x0001) ncmd 1
        Status: Success (0x00)
zephyr.exe[1801070]: < HCI Command: Set Event Mask (0x03|0x0001) plen 8                                              #31 1.684780
        Mask: 0x2000800002008890
          Disconnection Complete
          Encryption Change
          Read Remote Version Information Complete
          Hardware Error
          Data Buffer Overflow
          Encryption Key Refresh Complete
          LE Meta
> HCI Event: Command Complete (0x0e) plen 4                                                                          #32 1.685338
      Set Event Mask (0x03|0x0001) ncmd 1
        Status: Success (0x00)
zephyr.exe[1801070]: < HCI Command: Read BD ADDR (0x04|0x0009) plen 0                                                #33 1.704810
> HCI Event: Command Complete (0x0e) plen 10                                                                         #34 1.705273
      Read BD ADDR (0x04|0x0009) ncmd 1
        Status: Success (0x00)
        Address: 00:00:00:00:00:00 (OUI 00-00-00)
zephyr.exe[1801070]: < HCI Command: LE Set Random Address (0x08|0x0005) plen 6                                       #35 1.724942
        Address: D5:B6:CC:31:DB:3B (Static)
> HCI Event: Command Complete (0x0e) plen 4                                                                          #36 1.725445
      LE Set Random Address (0x08|0x0005) ncmd 1
        Status: Success (0x00)
zephyr.exe[1801070]: < HCI Command: LE Extended Create Connection (0x08|0x0043) plen 26                              #37 3.964867
        Filter policy: Accept list is not used (0x00)
        Own address type: Random (0x01)
        Peer address type: Public (0x00)
        Peer address: DF:A9:FF:F6:B1:1A (OUI DF-A9-FF)
        Initiating PHYs: 0x01
        Entry 0: LE 1M
          Scan interval: 60.000 msec (0x0060)
          Scan window: 60.000 msec (0x0060)
          Min connection interval: 30.00 msec (0x0018)
          Max connection interval: 50.00 msec (0x0028)
          Connection latency: 0 (0x0000)
          Supervision timeout: 4000 msec (0x0190)
          Min connection length: 0.000 msec (0x0000)
          Max connection length: 0.000 msec (0x0000)
> HCI Event: Command Status (0x0f) plen 4                                                                            #38 3.965907
      LE Extended Create Connection (0x08|0x0043) ncmd 1
        Status: Success (0x00)
> HCI Event: LE Meta Event (0x3e) plen 31                                                                            #39 4.045971
      LE Enhanced Connection Complete (0x0a)
        Status: Success (0x00)
        Handle: 1044
        Role: Central (0x00)
        Peer address type: Public (0x00)
        Peer address: DF:A9:FF:F6:B1:1A (OUI DF-A9-FF)
        Local resolvable private address: 00:00:00:00:00:00 (Non-Resolvable)
        Peer resolvable private address: 00:00:00:00:00:00 (Non-Resolvable)
        Connection interval: 50.00 msec (0x0028)
        Connection latency: 0 (0x0000)
        Supervision timeout: 4000 msec (0x0190)
        Central clock accuracy: 0x00
zephyr.exe[1801070]: < HCI Command: LE Read Remote Used Features (0x08|0x0016) plen 2                                #40 4.065031
        Handle: 1044 Address: DF:A9:FF:F6:B1:1A (OUI DF-A9-FF)
> HCI Event: Command Status (0x0f) plen 4                                                                            #41 4.065485
      LE Read Remote Used Features (0x08|0x0016) ncmd 1
        Status: Success (0x00)
zephyr.exe[1801070]: < HCI Command: LE Set PHY (0x08|0x0032) plen 7                                                  #42 4.084964
        Handle: 1044 Address: DF:A9:FF:F6:B1:1A (OUI DF-A9-FF)
        All PHYs preference: 0x00
        TX PHYs preference: 0x02
          LE 2M
        RX PHYs preference: 0x02
          LE 2M
        PHY options preference: Reserved (0x0000)
> HCI Event: Command Status (0x0f) plen 4                                                                            #43 4.085474
      LE Set PHY (0x08|0x0032) ncmd 1
        Status: Success (0x00)
> HCI Event: LE Meta Event (0x3e) plen 12                                                                            #44 4.197308
      LE Read Remote Used Features (0x04)
        Status: Success (0x00)
        Handle: 1044 Address: DF:A9:FF:F6:B1:1A (OUI DF-A9-FF)
        Features: 0x2d 0x49 0x00 0xf7 0x67 0xd8 0x00 0x00
          LE Encryption
          Extended Reject Indication
          Peripheral-initiated Features Exchange
          LE Data Packet Length Extension
          LE 2M PHY
          LE Coded PHY
          Channel Selection Algorithm #2
          Periodic Advertising Sync Transfer - Sender
          Periodic Advertising Sync Transfer - Recipient
          Sleep Clock Accuracy Updates
          Connected Isochronous Stream - Central
          Connected Isochronous Stream - Peripheral
          Isochronous Broadcaster
          Synchronized Receiver
          Connected Isochronous Stream (Host Support)
          LE Power Control Request
          LE Power Control Request
          Connection Subrating
          Connection Subrating (Host Support)
          Unknown features (0x0000d80000000000)
> HCI Event: LE Meta Event (0x3e) plen 6                                                                             #45 4.696686
      LE PHY Update Complete (0x0c)
        Status: Success (0x00)
        Handle: 1044 Address: DF:A9:FF:F6:B1:1A (OUI DF-A9-FF)
        TX PHY: LE 2M (0x02)
        RX PHY: LE 2M (0x02)
zephyr.exe[1801070]: < ACL Data TX: Handle 1044 flags 0x00 dlen 11                                                   #46 5.095011
      SMP: Pairing Request (0x01) len 6
        IO capability: NoInputNoOutput (0x03)
        OOB data: Authentication data not present (0x00)
        Authentication requirement: No bonding, No MITM, SC, No Keypresses (0x08)
        Max encryption key size: 16
        Initiator key distribution: <none> (0x00)
        Responder key distribution: <none> (0x00)
> HCI Event: Number of Completed Packets (0x13) plen 5                                                               #47 5.097127
        Num handles: 1
        Handle: 1044 Address: DF:A9:FF:F6:B1:1A (OUI DF-A9-FF)
        Count: 1
        #46: len 11 (44 Kb/s)
        Latency: 2 msec (2-2 msec ~2 msec)
> ACL Data RX: Handle 1044 flags 0x02 dlen 11                                                                        #48 5.147350
      SMP: Pairing Response (0x02) len 6
        IO capability: DisplayYesNo (0x01)
        OOB data: Authentication data not present (0x00)
        Authentication requirement: No bonding, No MITM, SC, No Keypresses (0x08)
        Max encryption key size: 16
        Initiator key distribution: <none> (0x00)
        Responder key distribution: <none> (0x00)
zephyr.exe[1801070]: < HCI Command: Host Number of Completed Packets (0x03|0x0035) plen 5                            #49 5.164900
        Num handles: 1
        Handle: 1044 Address: DF:A9:FF:F6:B1:1A (OUI DF-A9-FF)
        Count: 1
zephyr.exe[1801070]: < ACL Data TX: Handle 1044 flags 0x00 dlen 27                                                   #50 5.164910
zephyr.exe[1801070]: < ACL Data TX: Handle 1044 flags 0x01 dlen 27                                                   #51 5.164911
zephyr.exe[1801070]: < ACL Data TX: Handle 1044 flags 0x01 dlen 15                                                   #52 5.164911
      SMP: Pairing Public Key (0x0c) len 64
        X: 98308440221e2d910f0e54b71e7ec652857aa9b5a0dc65028824cc19db1226e9
        Y: 67a4816bcb62efb21701e31fdb27561a6217575fb007a8bbdabe7e28b6f68482
> HCI Event: Number of Completed Packets (0x13) plen 5                                                               #53 5.197078
        Num handles: 1
        Handle: 1044 Address: DF:A9:FF:F6:B1:1A (OUI DF-A9-FF)
        Count: 1
        #50: len 27 (6 Kb/s)
        Latency: 32 msec (2-32 msec ~17 msec)
> HCI Event: Number of Completed Packets (0x13) plen 5                                                               #54 5.197653
        Num handles: 1
        Handle: 1044 Address: DF:A9:FF:F6:B1:1A (OUI DF-A9-FF)
        Count: 1
        #51: len 27 (6 Kb/s)
        Latency: 32 msec (2-32 msec ~24 msec)
> HCI Event: Number of Completed Packets (0x13) plen 5                                                               #55 5.198128
        Num handles: 1
        Handle: 1044 Address: DF:A9:FF:F6:B1:1A (OUI DF-A9-FF)
        Count: 1
        #52: len 15 (3 Kb/s)
        Latency: 33 msec (2-33 msec ~29 msec)
> ACL Data RX: Handle 1044 flags 0x02 dlen 27                                                                        #56 5.297469
> ACL Data RX: Handle 1044 flags 0x01 dlen 27                                                                        #57 5.297843
> ACL Data RX: Handle 1044 flags 0x01 dlen 15                                                                        #58 5.298257
      SMP: Pairing Public Key (0x0c) len 64
        X: df3541fb6ae7e40b0f70e4021b0a072f289bbd29870530467cc4c4ca62a7028e
        Y: 5734eb249cacc675ece1ab031fb45d71a21b81388a755c94729ed7f3eeee1198
zephyr.exe[1801070]: < HCI Command: Host Number of Completed Packets (0x03|0x0035) plen 5                            #59 5.304953
        Num handles: 1
        Handle: 1044 Address: DF:A9:FF:F6:B1:1A (OUI DF-A9-FF)
        Count: 1
zephyr.exe[1801070]: < HCI Command: Host Number of Completed Packets (0x03|0x0035) plen 5                            #60 5.305140
        Num handles: 1
        Handle: 1044 Address: DF:A9:FF:F6:B1:1A (OUI DF-A9-FF)
        Count: 1
zephyr.exe[1801070]: < HCI Command: Host Number of Completed Packets (0x03|0x0035) plen 5                            #61 5.305171
        Num handles: 1
        Handle: 1044 Address: DF:A9:FF:F6:B1:1A (OUI DF-A9-FF)
        Count: 1
> ACL Data RX: Handle 1044 flags 0x02 dlen 21                                                                        #62 5.397344
      SMP: Pairing Confirm (0x03) len 16
        Confim value: cd7f151354562a6e6e164b51eda08d0b
zephyr.exe[1801070]: < HCI Command: Host Number of Completed Packets (0x03|0x0035) plen 5                            #63 5.404926
        Num handles: 1
        Handle: 1044 Address: DF:A9:FF:F6:B1:1A (OUI DF-A9-FF)
        Count: 1
zephyr.exe[1801070]: < ACL Data TX: Handle 1044 flags 0x00 dlen 21                                                   #64 5.404959
      SMP: Pairing Random (0x04) len 16
        Random value: 8e6108f966a694cbe26df70bb96773e6
> HCI Event: Number of Completed Packets (0x13) plen 5                                                               #65 5.447219
        Num handles: 1
        Handle: 1044 Address: DF:A9:FF:F6:B1:1A (OUI DF-A9-FF)
        Count: 1
        #64: len 21 (4 Kb/s)
        Latency: 42 msec (2-42 msec ~35 msec)
> ACL Data RX: Handle 1044 flags 0x02 dlen 21                                                                        #66 5.697351
      SMP: Pairing Random (0x04) len 16
        Random value: 7198e8be5ac0c900d5b54a88650536f7
zephyr.exe[1801070]: < HCI Command: Host Number of Completed Packets (0x03|0x0035) plen 5                            #67 5.705142
        Num handles: 1
        Handle: 1044 Address: DF:A9:FF:F6:B1:1A (OUI DF-A9-FF)
        Count: 1
zephyr.exe[1801070]: < ACL Data TX: Handle 1044 flags 0x00 dlen 21                                                   #68 5.705185
      SMP: Pairing DHKey Check (0x0d) len 16
        E: 5f9a9fb5708d4df105f10e063c49dee6
> HCI Event: Number of Completed Packets (0x13) plen 5                                                               #69 5.747112
        Num handles: 1
        Handle: 1044 Address: DF:A9:FF:F6:B1:1A (OUI DF-A9-FF)
        Count: 1
        #68: len 21 (4 Kb/s)
        Latency: 41 msec (2-42 msec ~38 msec)
> ACL Data RX: Handle 1044 flags 0x02 dlen 21                                                                        #70 5.797327
      SMP: Pairing DHKey Check (0x0d) len 16
        E: fdda7766a1dec5063e8ec6db6956cfb0
zephyr.exe[1801070]: < HCI Command: LE Start Encryption (0x08|0x0019) plen 28                                        #71 5.805095
        Handle: 1044 Address: DF:A9:FF:F6:B1:1A (OUI DF-A9-FF)
        Random number: 0x0000000000000000
        Encrypted diversifier: 0x0000
        Long term key: 51c9c90a587b74a26981fcd66e4d8e52
> HCI Event: Command Status (0x0f) plen 4                                                                            #72 5.806017
      LE Start Encryption (0x08|0x0019) ncmd 1
        Status: Success (0x00)
zephyr.exe[1801070]: < HCI Command: Host Number of Completed Packets (0x03|0x0035) plen 5                            #73 5.824887
        Num handles: 1
        Handle: 1044 Address: DF:A9:FF:F6:B1:1A (OUI DF-A9-FF)
        Count: 1
> HCI Event: Encryption Change (0x08) plen 4                                                                         #74 6.147014
        Status: Success (0x00)
        Handle: 1044 Address: DF:A9:FF:F6:B1:1A (OUI DF-A9-FF)
        Encryption: Enabled with AES-CCM (0x01)
zephyr.exe[1801070]: < HCI Command: Disconnect (0x01|0x0006) plen 3                                                  #75 7.114991
        Handle: 1044 Address: DF:A9:FF:F6:B1:1A (OUI DF-A9-FF)
        Reason: Remote User Terminated Connection (0x13)
> HCI Event: Command Status (0x0f) plen 4                                                                            #76 7.115837
      Disconnect (0x01|0x0006) ncmd 1
        Status: Success (0x00)
> HCI Event: Disconnect Complete (0x05) plen 4                                                                       #77 7.197053
        Status: Success (0x00)
        Handle: 1044 Address: DF:A9:FF:F6:B1:1A (OUI DF-A9-FF)
        Reason: Connection Terminated By Local Host (0x16)
zephyr.exe[1801070]: < HCI Command: LE Extended Create Connection (0x08|0x0043) plen 26                              #78 8.284977
        Filter policy: Accept list is not used (0x00)
        Own address type: Random (0x01)
        Peer address type: Public (0x00)
        Peer address: DF:A9:FF:F6:B1:1A (OUI DF-A9-FF)
        Initiating PHYs: 0x01
        Entry 0: LE 1M
          Scan interval: 60.000 msec (0x0060)
          Scan window: 60.000 msec (0x0060)
          Min connection interval: 30.00 msec (0x0018)
          Max connection interval: 50.00 msec (0x0028)
          Connection latency: 0 (0x0000)
          Supervision timeout: 4000 msec (0x0190)
          Min connection length: 0.000 msec (0x0000)
          Max connection length: 0.000 msec (0x0000)
> HCI Event: Command Status (0x0f) plen 4                                                                            #79 8.285981
      LE Extended Create Connection (0x08|0x0043) ncmd 1
        Status: Success (0x00)
> HCI Event: LE Meta Event (0x3e) plen 31                                                                            #80 8.353292
      LE Enhanced Connection Complete (0x0a)
        Status: Success (0x00)
        Handle: 1062
        Role: Central (0x00)
        Peer address type: Public (0x00)
        Peer address: DF:A9:FF:F6:B1:1A (OUI DF-A9-FF)
        Local resolvable private address: 00:00:00:00:00:00 (Non-Resolvable)
        Peer resolvable private address: 00:00:00:00:00:00 (Non-Resolvable)
        Connection interval: 50.00 msec (0x0028)
        Connection latency: 0 (0x0000)
        Supervision timeout: 4000 msec (0x0190)
        Central clock accuracy: 0x00
zephyr.exe[1801070]: < HCI Command: LE Read Remote Used Features (0x08|0x0016) plen 2                                #81 8.365072
        Handle: 1062 Address: DF:A9:FF:F6:B1:1A (OUI DF-A9-FF)
> HCI Event: Command Status (0x0f) plen 4                                                                            #82 8.365645
      LE Read Remote Used Features (0x08|0x0016) ncmd 1
        Status: Success (0x00)
zephyr.exe[1801070]: < HCI Command: LE Set PHY (0x08|0x0032) plen 7                                                  #83 8.384984
        Handle: 1062 Address: DF:A9:FF:F6:B1:1A (OUI DF-A9-FF)
        All PHYs preference: 0x00
        TX PHYs preference: 0x02
          LE 2M
        RX PHYs preference: 0x02
          LE 2M
        PHY options preference: Reserved (0x0000)
> HCI Event: Command Status (0x0f) plen 4                                                                            #84 8.385517
      LE Set PHY (0x08|0x0032) ncmd 1
        Status: Success (0x00)
> HCI Event: LE Meta Event (0x3e) plen 12                                                                            #85 8.504824
      LE Read Remote Used Features (0x04)
        Status: Success (0x00)
        Handle: 1062 Address: DF:A9:FF:F6:B1:1A (OUI DF-A9-FF)
        Features: 0x2d 0x49 0x00 0xf7 0x67 0xd8 0x00 0x00
          LE Encryption
          Extended Reject Indication
          Peripheral-initiated Features Exchange
          LE Data Packet Length Extension
          LE 2M PHY
          LE Coded PHY
          Channel Selection Algorithm #2
          Periodic Advertising Sync Transfer - Sender
          Periodic Advertising Sync Transfer - Recipient
          Sleep Clock Accuracy Updates
          Connected Isochronous Stream - Central
          Connected Isochronous Stream - Peripheral
          Isochronous Broadcaster
          Synchronized Receiver
          Connected Isochronous Stream (Host Support)
          LE Power Control Request
          LE Power Control Request
          Connection Subrating
          Connection Subrating (Host Support)
          Unknown features (0x0000d80000000000)
> HCI Event: LE Meta Event (0x3e) plen 6                                                                             #86 9.004136
      LE PHY Update Complete (0x0c)
        Status: Success (0x00)
        Handle: 1062 Address: DF:A9:FF:F6:B1:1A (OUI DF-A9-FF)
        TX PHY: LE 2M (0x02)
        RX PHY: LE 2M (0x02)
zephyr.exe[1801070]: < ACL Data TX: Handle 1062 flags 0x00 dlen 11                                                   #87 9.445004
      SMP: Pairing Request (0x01) len 6
        IO capability: NoInputNoOutput (0x03)
        OOB data: Authentication data not present (0x00)
        Authentication requirement: No bonding, No MITM, SC, No Keypresses (0x08)
        Max encryption key size: 16
        Initiator key distribution: <none> (0x00)
        Responder key distribution: <none> (0x00)
> HCI Event: Number of Completed Packets (0x13) plen 5                                                               #88 9.454649
        Num handles: 1
        Handle: 1062 Address: DF:A9:FF:F6:B1:1A (OUI DF-A9-FF)
        Count: 1
        #87: len 11 (9 Kb/s)
        Latency: 9 msec (9-9 msec ~9 msec)
> ACL Data RX: Handle 1062 flags 0x02 dlen 11                                                                        #89 9.504630
      SMP: Pairing Response (0x02) len 6
        IO capability: DisplayYesNo (0x01)
        OOB data: Authentication data not present (0x00)
        Authentication requirement: No bonding, No MITM, SC, No Keypresses (0x08)
        Max encryption key size: 16
        Initiator key distribution: <none> (0x00)
        Responder key distribution: <none> (0x00)
zephyr.exe[1801070]: < HCI Command: Host Number of Completed Packets (0x03|0x0035) plen 5                            #90 9.504953
        Num handles: 1
        Handle: 1062 Address: DF:A9:FF:F6:B1:1A (OUI DF-A9-FF)
        Count: 1
zephyr.exe[1801070]: < ACL Data TX: Handle 1062 flags 0x00 dlen 27                                                   #91 9.504963
zephyr.exe[1801070]: < ACL Data TX: Handle 1062 flags 0x01 dlen 27                                                   #92 9.504976
zephyr.exe[1801070]: < ACL Data TX: Handle 1062 flags 0x01 dlen 15                                                   #93 9.504977
      SMP: Pairing Public Key (0x0c) len 64
        X: 98308440221e2d910f0e54b71e7ec652857aa9b5a0dc65028824cc19db1226e9
        Y: 67a4816bcb62efb21701e31fdb27561a6217575fb007a8bbdabe7e28b6f68482
> HCI Event: Number of Completed Packets (0x13) plen 5                                                               #94 9.554547
        Num handles: 1
        Handle: 1062 Address: DF:A9:FF:F6:B1:1A (OUI DF-A9-FF)
        Count: 1
        #91: len 27 (4 Kb/s)
        Latency: 49 msec (9-49 msec ~29 msec)
> HCI Event: Number of Completed Packets (0x13) plen 5                                                               #95 9.555026
        Num handles: 1
        Handle: 1062 Address: DF:A9:FF:F6:B1:1A (OUI DF-A9-FF)
        Count: 1
        #92: len 27 (4 Kb/s)
        Latency: 50 msec (9-50 msec ~39 msec)
> HCI Event: Number of Completed Packets (0x13) plen 5                                                               #96 9.555609
        Num handles: 1
        Handle: 1062 Address: DF:A9:FF:F6:B1:1A (OUI DF-A9-FF)
        Count: 1
        #93: len 15 (2 Kb/s)
        Latency: 50 msec (9-50 msec ~45 msec)
> ACL Data RX: Handle 1062 flags 0x02 dlen 27                                                                        #97 9.604758
> ACL Data RX: Handle 1062 flags 0x01 dlen 27                                                                        #98 9.605359
> ACL Data RX: Handle 1062 flags 0x01 dlen 15                                                                        #99 9.605641
      SMP: Pairing Public Key (0x0c) len 64
        X: fae01ab844769d49111915f518aa06ed1ab7643b77143d6fe19f3da1ebada893
        Y: 6485522e2eec654fbbfd86bcf208a91d8f959c67e8593197fabd6f46a39275c1
zephyr.exe[1801070]: < HCI Command: Host Number of Completed Packets (0x03|0x0035) plen 5                           #100 9.625091
        Num handles: 1
        Handle: 1062 Address: DF:A9:FF:F6:B1:1A (OUI DF-A9-FF)
        Count: 1
zephyr.exe[1801070]: < HCI Command: Host Number of Completed Packets (0x03|0x0035) plen 5                           #101 9.625110
        Num handles: 1
        Handle: 1062 Address: DF:A9:FF:F6:B1:1A (OUI DF-A9-FF)
        Count: 1
zephyr.exe[1801070]: < HCI Command: Host Number of Completed Packets (0x03|0x0035) plen 5                           #102 9.625130
        Num handles: 1
        Handle: 1062 Address: DF:A9:FF:F6:B1:1A (OUI DF-A9-FF)
        Count: 1
> ACL Data RX: Handle 1062 flags 0x02 dlen 21                                                                       #103 9.704768
      SMP: Pairing Confirm (0x03) len 16
        Confim value: 99ded5209e9fcaa53e10237bc7861c6c
zephyr.exe[1801070]: < HCI Command: Host Number of Completed Packets (0x03|0x0035) plen 5                           #104 9.704991
        Num handles: 1
        Handle: 1062 Address: DF:A9:FF:F6:B1:1A (OUI DF-A9-FF)
        Count: 1
zephyr.exe[1801070]: < ACL Data TX: Handle 1062 flags 0x00 dlen 21                                                  #105 9.705019
      SMP: Pairing Random (0x04) len 16
        Random value: 5da095555cc64d02679f89a05211af56
> HCI Event: Number of Completed Packets (0x13) plen 5                                                              #106 9.754545
        Num handles: 1
        Handle: 1062 Address: DF:A9:FF:F6:B1:1A (OUI DF-A9-FF)
        Count: 1
        #105: len 21 (3 Kb/s)
        Latency: 49 msec (9-50 msec ~47 msec)
> ACL Data RX: Handle 1062 flags 0x02 dlen 21                                                                      #107 10.004850
      SMP: Pairing Random (0x04) len 16
        Random value: 67fc3bbb5a1d5948b9c6f3ab9803555b
zephyr.exe[1801070]: < HCI Command: Host Number of Completed Packets (0x03|0x0035) plen 5                          #108 10.005065
        Num handles: 1
        Handle: 1062 Address: DF:A9:FF:F6:B1:1A (OUI DF-A9-FF)
        Count: 1
zephyr.exe[1801070]: < ACL Data TX: Handle 1062 flags 0x00 dlen 21                                                 #109 10.005109
      SMP: Pairing DHKey Check (0x0d) len 16
        E: b621272b5a4bd75fd8a0470025ddc82c
> HCI Event: Number of Completed Packets (0x13) plen 5                                                             #110 10.054585
        Num handles: 1
        Handle: 1062 Address: DF:A9:FF:F6:B1:1A (OUI DF-A9-FF)
        Count: 1
        #109: len 21 (3 Kb/s)
        Latency: 49 msec (9-50 msec ~48 msec)
> ACL Data RX: Handle 1062 flags 0x02 dlen 21                                                                      #111 10.104772
      SMP: Pairing DHKey Check (0x0d) len 16
        E: 4bd3d4142ed4d8c712cbc574c87c37de
zephyr.exe[1801070]: < HCI Command: LE Start Encryption (0x08|0x0019) plen 28                                      #112 10.105029
        Handle: 1062 Address: DF:A9:FF:F6:B1:1A (OUI DF-A9-FF)
        Random number: 0x0000000000000000
        Encrypted diversifier: 0x0000
        Long term key: b719f71ecaa5613ec0addf2066455390
> HCI Event: Command Status (0x0f) plen 4                                                                          #113 10.105959
      LE Start Encryption (0x08|0x0019) ncmd 1
        Status: Success (0x00)
zephyr.exe[1801070]: < HCI Command: Host Number of Completed Packets (0x03|0x0035) plen 5                          #114 10.124993
        Num handles: 1
        Handle: 1062 Address: DF:A9:FF:F6:B1:1A (OUI DF-A9-FF)
        Count: 1
> HCI Event: Encryption Change (0x08) plen 4                                                                       #115 10.454493
        Status: Success (0x00)
        Handle: 1062 Address: DF:A9:FF:F6:B1:1A (OUI DF-A9-FF)
        Encryption: Enabled with AES-CCM (0x01)
zephyr.exe[1801070]: < HCI Command: Disconnect (0x01|0x0006) plen 3                                                #116 10.486189
        Handle: 1062 Address: DF:A9:FF:F6:B1:1A (OUI DF-A9-FF)
        Reason: Remote User Terminated Connection (0x13)
> HCI Event: Command Status (0x0f) plen 4                                                                          #117 10.486660
      Disconnect (0x01|0x0006) ncmd 1
        Status: Success (0x00)
> HCI Event: Disconnect Complete (0x05) plen 4                                                                     #118 10.554538
        Status: Success (0x00)
        Handle: 1062 Address: DF:A9:FF:F6:B1:1A (OUI DF-A9-FF)
        Reason: Connection Terminated By Local Host (0x16)
zephyr.exe[1801070]: < HCI Command: LE Extended Create Connection (0x08|0x0043) plen 26                            #119 11.745060
        Filter policy: Accept list is not used (0x00)
        Own address type: Random (0x01)
        Peer address type: Public (0x00)
        Peer address: DF:A9:FF:F6:B1:1A (OUI DF-A9-FF)
        Initiating PHYs: 0x01
        Entry 0: LE 1M
          Scan interval: 60.000 msec (0x0060)
          Scan window: 60.000 msec (0x0060)
          Min connection interval: 30.00 msec (0x0018)
          Max connection interval: 50.00 msec (0x0028)
          Connection latency: 0 (0x0000)
          Supervision timeout: 4000 msec (0x0190)
          Min connection length: 0.000 msec (0x0000)
          Max connection length: 0.000 msec (0x0000)
> HCI Event: Command Status (0x0f) plen 4                                                                          #120 11.745990
      LE Extended Create Connection (0x08|0x0043) ncmd 1
        Status: Success (0x00)
> HCI Event: LE Meta Event (0x3e) plen 31                                                                          #121 11.840153
      LE Enhanced Connection Complete (0x0a)
        Status: Success (0x00)
        Handle: 1080
        Role: Central (0x00)
        Peer address type: Public (0x00)
        Peer address: DF:A9:FF:F6:B1:1A (OUI DF-A9-FF)
        Local resolvable private address: 00:00:00:00:00:00 (Non-Resolvable)
        Peer resolvable private address: 00:00:00:00:00:00 (Non-Resolvable)
        Connection interval: 50.00 msec (0x0028)
        Connection latency: 0 (0x0000)
        Supervision timeout: 4000 msec (0x0190)
        Central clock accuracy: 0x00
zephyr.exe[1801070]: < HCI Command: LE Read Remote Used Features (0x08|0x0016) plen 2                              #122 11.845121
        Handle: 1080 Address: DF:A9:FF:F6:B1:1A (OUI DF-A9-FF)
> HCI Event: Command Status (0x0f) plen 4                                                                          #123 11.845584
      LE Read Remote Used Features (0x08|0x0016) ncmd 1
        Status: Success (0x00)
zephyr.exe[1801070]: < HCI Command: LE Set PHY (0x08|0x0032) plen 7                                                #124 11.865036
        Handle: 1080 Address: DF:A9:FF:F6:B1:1A (OUI DF-A9-FF)
        All PHYs preference: 0x00
        TX PHYs preference: 0x02
          LE 2M
        RX PHYs preference: 0x02
          LE 2M
        PHY options preference: Reserved (0x0000)
> HCI Event: Command Status (0x0f) plen 4                                                                          #125 11.865566
      LE Set PHY (0x08|0x0032) ncmd 1
        Status: Success (0x00)
> HCI Event: LE Meta Event (0x3e) plen 12                                                                          #126 11.991636
      LE Read Remote Used Features (0x04)
        Status: Success (0x00)
        Handle: 1080 Address: DF:A9:FF:F6:B1:1A (OUI DF-A9-FF)
        Features: 0x2d 0x49 0x00 0xf7 0x67 0xd8 0x00 0x00
          LE Encryption
          Extended Reject Indication
          Peripheral-initiated Features Exchange
          LE Data Packet Length Extension
          LE 2M PHY
          LE Coded PHY
          Channel Selection Algorithm #2
          Periodic Advertising Sync Transfer - Sender
          Periodic Advertising Sync Transfer - Recipient
          Sleep Clock Accuracy Updates
          Connected Isochronous Stream - Central
          Connected Isochronous Stream - Peripheral
          Isochronous Broadcaster
          Synchronized Receiver
          Connected Isochronous Stream (Host Support)
          LE Power Control Request
          LE Power Control Request
          Connection Subrating
          Connection Subrating (Host Support)
          Unknown features (0x0000d80000000000)
> HCI Event: LE Meta Event (0x3e) plen 6                                                                           #127 12.490882
      LE PHY Update Complete (0x0c)
        Status: Success (0x00)
        Handle: 1080 Address: DF:A9:FF:F6:B1:1A (OUI DF-A9-FF)
        TX PHY: LE 2M (0x02)
        RX PHY: LE 2M (0x02)
zephyr.exe[1801070]: < ACL Data TX: Handle 1080 flags 0x00 dlen 11                                                 #128 12.925034
      SMP: Pairing Request (0x01) len 6
        IO capability: NoInputNoOutput (0x03)
        OOB data: Authentication data not present (0x00)
        Authentication requirement: No bonding, No MITM, SC, No Keypresses (0x08)
        Max encryption key size: 16
        Initiator key distribution: <none> (0x00)
        Responder key distribution: <none> (0x00)
> HCI Event: Number of Completed Packets (0x13) plen 5                                                             #129 12.941348
        Num handles: 1
        Handle: 1080 Address: DF:A9:FF:F6:B1:1A (OUI DF-A9-FF)
        Count: 1
        #128: len 11 (5 Kb/s)
        Latency: 16 msec (16-16 msec ~16 msec)
> ACL Data RX: Handle 10