Bluetooth monitor ver 5.84
btmon[861080]: = Note: Linux version 6.8.0-83-generic (x86_64)                                                           0.656441
btmon[861080]: = Note: Bluetooth subsystem version 2.22                                                                  0.656443
= New Index: 00:00:00:00:00:00 (Primary,UART,hci0)                                                                       0.656444
= Open Index: 00:00:00:00:00:00                                                                                          0.663872
= Index Info: 00:00:00:00:00:00 (Nordic Semiconductor ASA)                                                               0.663877
zephyr.exe[861082]: @ USER Open: main (privileged) version 2.22                                                 {0x0001} 0.663879
zephyr.exe[861082]: < HCI Command: Reset (0x03|0x0003) plen 0                                                         #1 0.664033
> HCI Event: Command Complete (0x0e) plen 4                                                                           #2 0.664866
      Reset (0x03|0x0003) ncmd 1
        Status: Success (0x00)
zephyr.exe[861082]: < HCI Command: Read Local Supported Features (0x04|0x0003) plen 0                                 #3 0.683812
> HCI Event: Command Complete (0x0e) plen 12                                                                          #4 0.684460
      Read Local Supported Features (0x04|0x0003) ncmd 1
        Status: Success (0x00)
        Features: 0x00 0x00 0x00 0x00 0x60 0x00 0x00 0x00
          BR/EDR Not Supported
          LE Supported (Controller)
zephyr.exe[861082]: < HCI Command: Read Local Version Information (0x04|0x0001) plen 0                                #5 0.703809
> HCI Event: Command Complete (0x0e) plen 12                                                                          #6 0.704340
      Read Local Version Information (0x04|0x0001) ncmd 1
        Status: Success (0x00)
        HCI version: Reserved (0x0e) - Revision 12520 (0x30e8)
        LMP version: Reserved (0x0e) - Subversion 12520 (0x30e8)
        Manufacturer: Nordic Semiconductor ASA (89)
zephyr.exe[861082]: < HCI Command: Read Local Supported Commands (0x04|0x0002) plen 0                                 #7 0.723813
> HCI Event: Command Complete (0x0e) plen 68                                                                          #8 0.725148
      Read Local Supported Commands (0x04|0x0002) ncmd 1
        Status: Success (0x00)
        Commands: 119 entries
          Disconnect (Octet 0 - Bit 5)
          Read Remote Version Information (Octet 2 - Bit 7)
          Set Event Mask (Octet 5 - Bit 6)
          Reset (Octet 5 - Bit 7)
          Read Connection Accept Timeout (Octet 7 - Bit 2)
          Write Connection Accept Timeout (Octet 7 - Bit 3)
          Read Transmit Power Level (Octet 10 - Bit 2)
          Set Controller To Host Flow Control (Octet 10 - Bit 5)
          Host Buffer Size (Octet 10 - Bit 6)
          Host Number of Completed Packets (Octet 10 - Bit 7)
          Read Local Version Information (Octet 14 - Bit 3)
          Read Local Supported Features (Octet 14 - Bit 5)
          Read BD ADDR (Octet 15 - Bit 1)
          Read RSSI (Octet 15 - Bit 5)
          Set Event Mask Page 2 (Octet 22 - Bit 2)
          LE Set Event Mask (Octet 25 - Bit 0)
          LE Read Buffer Size (Octet 25 - Bit 1)
          LE Read Local Supported Features (Octet 25 - Bit 2)
          LE Set Random Address (Octet 25 - Bit 4)
          LE Set Advertising Parameters (Octet 25 - Bit 5)
          LE Read Advertising Channel TX Power (Octet 25 - Bit 6)
          LE Set Advertising Data (Octet 25 - Bit 7)
          LE Set Scan Response Data (Octet 26 - Bit 0)
          LE Set Advertise Enable (Octet 26 - Bit 1)
          LE Set Scan Parameters (Octet 26 - Bit 2)
          LE Set Scan Enable (Octet 26 - Bit 3)
          LE Create Connection (Octet 26 - Bit 4)
          LE Create Connection Cancel (Octet 26 - Bit 5)
          LE Read Accept List Size (Octet 26 - Bit 6)
          LE Clear Accept List (Octet 26 - Bit 7)
          LE Add Device To Accept List (Octet 27 - Bit 0)
          LE Remove Device From Accept List (Octet 27 - Bit 1)
          LE Connection Update (Octet 27 - Bit 2)
          LE Set Host Channel Classification (Octet 27 - Bit 3)
          LE Read Channel Map (Octet 27 - Bit 4)
          LE Read Remote Used Features (Octet 27 - Bit 5)
          LE Encrypt (Octet 27 - Bit 6)
          LE Rand (Octet 27 - Bit 7)
          LE Start Encryption (Octet 28 - Bit 0)
          LE Long Term Key Request Reply (Octet 28 - Bit 1)
          LE Long Term Key Request Neg Reply (Octet 28 - Bit 2)
          LE Read Supported States (Octet 28 - Bit 3)
          LE Receiver Test (Octet 28 - Bit 4)
          LE Transmitter Test (Octet 28 - Bit 5)
          LE Test End (Octet 28 - Bit 6)
          Read Authenticated Payload Timeout (Octet 32 - Bit 4)
          Write Authenticated Payload Timeout (Octet 32 - Bit 5)
          LE Set Data Length (Octet 33 - Bit 6)
          LE Read Suggested Default Data Length (Octet 33 - Bit 7)
          LE Write Suggested Default Data Length (Octet 34 - Bit 0)
          LE Add Device To Resolving List (Octet 34 - Bit 3)
          LE Remove Device From Resolving List (Octet 34 - Bit 4)
          LE Clear Resolving List (Octet 34 - Bit 5)
          LE Read Resolving List Size (Octet 34 - Bit 6)
          LE Set Address Resolution Enable (Octet 35 - Bit 1)
          LE Set Resolvable Private Address Timeout (Octet 35 - Bit 2)
          LE Read Maximum Data Length (Octet 35 - Bit 3)
          LE Read PHY (Octet 35 - Bit 4)
          LE Set Default PHY (Octet 35 - Bit 5)
          LE Set PHY (Octet 35 - Bit 6)
          LE Enhanced Receiver Test (Octet 35 - Bit 7)
          LE Enhanced Transmitter Test (Octet 36 - Bit 0)
          LE Set Advertising Set Random Address (Octet 36 - Bit 1)
          LE Set Extended Advertising Parameters (Octet 36 - Bit 2)
          LE Set Extended Advertising Data (Octet 36 - Bit 3)
          LE Set Extended Scan Response Data (Octet 36 - Bit 4)
          LE Set Extended Advertising Enable (Octet 36 - Bit 5)
          LE Read Maximum Advertising Data Length (Octet 36 - Bit 6)
          LE Read Number of Supported Advertising Sets (Octet 36 - Bit 7)
          LE Remove Advertising Set (Octet 37 - Bit 0)
          LE Clear Advertising Sets (Octet 37 - Bit 1)
          LE Set Periodic Advertising Parameters (Octet 37 - Bit 2)
          LE Set Periodic Advertising Data (Octet 37 - Bit 3)
          LE Set Periodic Advertising Enable (Octet 37 - Bit 4)
          LE Set Extended Scan Parameters (Octet 37 - Bit 5)
          LE Set Extended Scan Enable (Octet 37 - Bit 6)
          LE Extended Create Connection (Octet 37 - Bit 7)
          LE Periodic Advertising Create Sync (Octet 38 - Bit 0)
          LE Periodic Advertising Create Sync Cancel (Octet 38 - Bit 1)
          LE Periodic Advertising Terminate Sync (Octet 38 - Bit 2)
          LE Add Device To Periodic Advertiser List (Octet 38 - Bit 3)
          LE Remove Device From Periodic Advertiser List (Octet 38 - Bit 4)
          LE Clear Periodic Advertiser List (Octet 38 - Bit 5)
          LE Read Periodic Advertiser List Size (Octet 38 - Bit 6)
          LE Read Transmit Power (Octet 38 - Bit 7)
          LE Read RF Path Compensation (Octet 39 - Bit 0)
          LE Write RF Path Compensation (Octet 39 - Bit 1)
          LE Set Privacy Mode (Octet 39 - Bit 2)
          LE Periodic Advertising Receive Enable (Octet 40 - Bit 5)
          LE Periodic Advertising Sync Transfer (Octet 40 - Bit 6)
          LE Periodic Advertising Set Info Transfer (Octet 40 - Bit 7)
          LE Periodic Advertising Sync Transfer Parameters (Octet 41 - Bit 0)
          LE Set Default Periodic Advertisng Sync Transfer Parameters (Octet 41 - Bit 1)
          LE Read Buffer v2 (Octet 41 - Bit 5)
          LE Read ISO TX Sync (Octet 41 - Bit 6)
          LE Set Connected Isochronous Group Parameters (Octet 41 - Bit 7)
          LE Set Connected Isochronous Group Parameters Test (Octet 42 - Bit 0)
          LE Create Connected Isochronous Stream (Octet 42 - Bit 1)
          LE Remove Connected Isochronous Group (Octet 42 - Bit 2)
          LE Accept Connected Isochronous Stream Request (Octet 42 - Bit 3)
          LE Reject Connected Isochronous Stream Request (Octet 42 - Bit 4)
          LE Create Broadcast Isochronous Group (Octet 42 - Bit 5)
          LE Create Broadcast Isochronous Group Test (Octet 42 - Bit 6)
          LE Terminate Broadcast Isochronous Group (Octet 42 - Bit 7)
          LE Broadcast Isochronous Group Create Sync (Octet 43 - Bit 0)
          LE Broadcast Isochronous Group Terminate Sync (Octet 43 - Bit 1)
          LE Request Peer SCA (Octet 43 - Bit 2)
          LE Setup Isochronous Data Path (Octet 43 - Bit 3)
          LE Remove Isochronous Data Path (Octet 43 - Bit 4)
          LE Isochronous Transmit Test (Octet 43 - Bit 5)
          LE Isochronous Receive Test (Octet 43 - Bit 6)
          LE Isochronous Read Test Counters (Octet 43 - Bit 7)
          LE Isochronous Read Test Counters (Octet 44 - Bit 0)
          LE Set Host Feature (Octet 44 - Bit 1)
          LE Read ISO link quality (Octet 44 - Bit 2)
          Octet 45 - Bit 6 
          Octet 46 - Bit 0 
          Octet 46 - Bit 1 
          Octet 46 - Bit 2 
zephyr.exe[861082]: < HCI Command: Host Buffer Size (0x03|0x0033) plen 7                                              #9 0.743810
        ACL MTU: 255  ACL max packet: 16
        SCO MTU: 0    SCO max packet: 0
> HCI Event: Command Complete (0x0e) plen 4                                                                          #10 0.744495
      Host Buffer Size (0x03|0x0033) ncmd 1
        Status: Success (0x00)
zephyr.exe[861082]: < HCI Command: Set Controller To Host Flow Control (0x03|0x0031) plen 1                          #11 0.763814
        Flow control: ACL Data Packets (0x01)
> HCI Event: Command Complete (0x0e) plen 4                                                                          #12 0.764445
      Set Controller To Host Flow Control (0x03|0x0031) ncmd 1
        Status: Success (0x00)
zephyr.exe[861082]: < HCI Command: LE Read Local Supported Features (0x08|0x0003) plen 0                             #13 0.783811
> HCI Event: Command Complete (0x0e) plen 12                                                                         #14 0.784383
      LE Read Local Supported Features (0x08|0x0003) ncmd 1
        Status: Success (0x00)
        Features: 0xfd 0x79 0x00 0xf7 0x30 0x01 0x00 0x00
          LE Encryption
          Extended Reject Indication
          Peripheral-initiated Features Exchange
          LE Ping
          LE Data Packet Length Extension
          LL Privacy
          Extended Scanner Filter Policies
          LE 2M PHY
          LE Coded PHY
          LE Extended Advertising
          LE Periodic Advertising
          Channel Selection Algorithm #2
          Periodic Advertising Sync Transfer - Sender
          Periodic Advertising Sync Transfer - Recipient
          Sleep Clock Accuracy Updates
          Connected Isochronous Stream - Central
          Connected Isochronous Stream - Peripheral
          Isochronous Broadcaster
          Synchronized Receiver
          Periodic Advertising ADI support
          Connection Subrating
          Unknown features (0x0000010000000000)
zephyr.exe[861082]: < HCI Command: LE Set Host Feature (0x08|0x0074) plen 2                                          #15 0.803808
        Bit Number: 32
          Connected Isochronous Stream (Host Support)
        Bit Value: 1
> HCI Event: Command Complete (0x0e) plen 4                                                                          #16 0.804534
      LE Set Host Feature (0x08|0x0074) ncmd 1
        Status: Success (0x00)
zephyr.exe[861082]: < HCI Command: LE Read Buffer v2 (0x08|0x0060) plen 0                                            #17 0.823759
> HCI Event: Command Complete (0x0e) plen 10                                                                         #18 0.824559
      LE Read Buffer v2 (0x08|0x0060) ncmd 1
        Status: Success (0x00)
        ACL MTU: 27
        ACL max packet: 3
        ISO MTU: 318
        ISO max packet: 3
zephyr.exe[861082]: < HCI Command: LE Read Maximum Advertising Data Length (0x08|0x003a) plen 0                      #19 0.843805
> HCI Event: Command Complete (0x0e) plen 6                                                                          #20 0.844545
      LE Read Maximum Advertising Data Length (0x08|0x003a) ncmd 1
        Status: Success (0x00)
        Max length: 1650
zephyr.exe[861082]: < HCI Command: LE Read Supported States (0x08|0x001c) plen 0                                     #21 0.863790
> HCI Event: Command Complete (0x0e) plen 12                                                                         #22 0.864398
      LE Read Supported States (0x08|0x001c) ncmd 1
        Status: Success (0x00)
        States: 0x000003ff3e0306ff
          Non-connectable Advertising State
          Scannable Advertising State
          Connectable Advertising State
          High Duty Cycle Directed Advertising State
          Passive Scanning State
          Active Scanning State
          Initiating State
            and Connection State (Central Role)
          Connection State (Peripheral Role)
          Scannable Advertising State
            and Passive Scanning State
          Connectable Advertising State
            and Passive Scanning State
          Non-connectable Advertising State
            and Initiating State
          Scannable Advertising State
            and Initiating State
          Active Scanning State
            and Connection State (Central Role)
          Passive Scanning State
            and Connection State (Peripheral Role)
          Active Scanning State
            and Connection State (Peripheral Role)
          Initiating State
            and Connection State (Central Role)
            and Central Role & Central Role
          Low Duty Cycle Directed Advertising State
          Connectable Advertising State
            and Initiating State
            and Central Role & Peripheral Role
          High Duty Cycle Directed Advertising State
            and Initiating State
            and Central Role & Peripheral Role
          Low Duty Cycle Directed Advertising State
            and Initiating State
            and Central Role & Peripheral Role
          Connectable Advertising State
            and Connection State (Central Role)
            and Central Role & Peripheral Role
          High Duty Cycle Directed Advertising State
            and Connection State (Central Role)
            and Central Role & Peripheral Role
          Low Duty Cycle Directed Advertising State
            and Connection State (Central Role)
            and Central Role & Peripheral Role
          Connectable Advertising State
            and Connection State (Peripheral Role)
            and Central Role & Peripheral Role
          High Duty Cycle Directed Advertising State
            and Connection State (Peripheral Role)
            and Peripheral Role & Peripheral Role
          Low Duty Cycle Directed Advertising State
            and Connection State (Peripheral Role)
            and Peripheral Role & Peripheral Role
          Initiating State
            and Connection State (Peripheral Role)
            and Central Role & Peripheral Role
zephyr.exe[861082]: < HCI Command: LE Read Maximum Data Length (0x08|0x002f) plen 0                                  #23 0.883819
> HCI Event: Command Complete (0x0e) plen 12                                                                         #24 0.885499
      LE Read Maximum Data Length (0x08|0x002f) ncmd 1
        Status: Success (0x00)
        Max TX octets: 251
        Max TX time: 2704
        Max RX octets: 251
        Max RX time: 2704
zephyr.exe[861082]: < HCI Command: LE Write Suggested Default Data Length (0x08|0x0024) plen 4                       #25 0.903814
        TX octets: 251
        TX time: 2704
> HCI Event: Command Complete (0x0e) plen 4                                                                          #26 0.904477
      LE Write Suggested Default Data Length (0x08|0x0024) ncmd 1
        Status: Success (0x00)
zephyr.exe[861082]: < HCI Command: LE Read Resolving List Size (0x08|0x002a) plen 0                                  #27 0.923810
> HCI Event: Command Complete (0x0e) plen 5                                                                          #28 0.924495
      LE Read Resolving List Size (0x08|0x002a) ncmd 1
        Status: Success (0x00)
        Size: 8
zephyr.exe[861082]: < HCI Command: LE Set Event Mask (0x08|0x0001) plen 8                                            #29 0.943813
        Mask: 0x000002023f87fa5e
          LE Advertising Report
          LE Connection Update Complete
          LE Read Remote Used Features Complete
          LE Long Term Key Request
          LE Data Length Change
          LE Enhanced Connection Complete
          LE PHY Update Complete
          LE Extended Advertising Report
          LE Periodic Advertising Sync Established
          LE Periodic Advertising Report
          LE Periodic Advertising Sync Lost
          LE Extended Scan Timeout
          LE Extended Advertising Set Terminated
          LE Scan Request Received
          LE Periodic Advertising Sync Transfer Rvc
          LE CIS Established
          LE CIS Request
          LE Create BIG Complete
          LE Terminate BIG Complete
          LE BIG Sync Established Complete
          LE BIG Sync Lost
          LE BIG Info Advertising Report
          Unknown mask (0x0000020000000000)
> HCI Event: Command Complete (0x0e) plen 4                                                                          #30 0.944458
      LE Set Event Mask (0x08|0x0001) ncmd 1
        Status: Success (0x00)
zephyr.exe[861082]: < HCI Command: Set Event Mask (0x03|0x0001) plen 8                                               #31 0.963813
        Mask: 0x2000800002008890
          Disconnection Complete
          Encryption Change
          Read Remote Version Information Complete
          Hardware Error
          Data Buffer Overflow
          Encryption Key Refresh Complete
          LE Meta
> HCI Event: Command Complete (0x0e) plen 4                                                                          #32 0.964432
      Set Event Mask (0x03|0x0001) ncmd 1
        Status: Success (0x00)
zephyr.exe[861082]: < HCI Command: Read BD ADDR (0x04|0x0009) plen 0                                                 #33 0.983810
> HCI Event: Command Complete (0x0e) plen 10                                                                         #34 0.984415
      Read BD ADDR (0x04|0x0009) ncmd 1
        Status: Success (0x00)
        Address: 00:00:00:00:00:00 (OUI 00-00-00)
zephyr.exe[861082]: < HCI Command: LE Set Random Address (0x08|0x0005) plen 6                                        #35 1.003834
        Address: D5:B6:CC:31:DB:3B (Static)
> HCI Event: Command Complete (0x0e) plen 4                                                                          #36 1.004823
      LE Set Random Address (0x08|0x0005) ncmd 1
        Status: Success (0x00)
zephyr.exe[861082]: < HCI Command: LE Set Extended Advertising Parameters (0x08|0x0036) plen 25                      #37 3.443889
        Handle: 0x00
        Properties: 0x0013
          Connectable
          Scannable
          Use legacy advertising PDUs: ADV_IND
        Min advertising interval: 100.000 msec (0x00a0)
        Max advertising interval: 150.000 msec (0x00f0)
        Channel map: 37, 38, 39 (0x07)
        Own address type: Random (0x01)
        Peer address type: Public (0x00)
        Peer address: 00:00:00:00:00:00 (OUI 00-00-00)
        Filter policy: Allow Scan Request from Any, Allow Connect Request from Any (0x00)
        TX power: Host has no preference (0x7f)
        Primary PHY: LE 1M (0x01)
        Secondary max skip: 0x00
        Secondary PHY: LE 1M (0x01)
        SID: 0x00
        Scan request notifications: Disabled (0x00)
> HCI Event: Command Complete (0x0e) plen 5                                                                          #38 3.444971
      LE Set Extended Advertising Parameters (0x08|0x0036) ncmd 1
        Status: Success (0x00)
        TX power (selected): 0 dbm (0x00)
zephyr.exe[861082]: < HCI Command: LE Set Advertising Set Random Address (0x08|0x0035) plen 7                        #39 3.463842
        Advertising handle: 0x00
        Advertising random address: D5:B6:CC:31:DB:3B (Static)
> HCI Event: Command Complete (0x0e) plen 4                                                                          #40 3.464532
      LE Set Advertising Set Random Address (0x08|0x0035) ncmd 1
        Status: Success (0x00)
zephyr.exe[861082]: < HCI Command: LE Set Extended Advertising Data (0x08|0x0037) plen 22                            #41 3.483810
        Handle: 0x00
        Operation: Complete extended advertising data (0x03)
        Fragment preference: Minimize fragmentation (0x01)
        Data length: 0x12
        Flags: 0x06
          LE General Discoverable Mode
          BR/EDR Not Supported
        Name (complete): Tester_F6B11A
> HCI Event: Command Complete (0x0e) plen 4                                                                          #42 3.484918
      LE Set Extended Advertising Data (0x08|0x0037) ncmd 1
        Status: Success (0x00)
zephyr.exe[861082]: < HCI Command: LE Set Extended Scan Response Data (0x08|0x0038) plen 4                           #43 3.503779
        Handle: 0x00
        Operation: Complete scan response data (0x03)
        Fragment preference: Minimize fragmentation (0x01)
        Data length: 0x00
> HCI Event: Command Complete (0x0e) plen 4                                                                          #44 3.504235
      LE Set Extended Scan Response Data (0x08|0x0038) ncmd 1
        Status: Success (0x00)
zephyr.exe[861082]: < HCI Command: LE Set Extended Advertising Enable (0x08|0x0039) plen 6                           #45 3.523855
        Extended advertising: Enabled (0x01)
        Number of sets: 1 (0x01)
        Entry 0
          Handle: 0x00
          Duration: 0 ms (0x00)
          Max ext adv events: 0
> HCI Event: Command Complete (0x0e) plen 4                                                                          #46 3.524412
      LE Set Extended Advertising Enable (0x08|0x0039) ncmd 1
        Status: Success (0x00)
> HCI Event: LE Meta Event (0x3e) plen 31                                                                            #47 3.641874
      LE Enhanced Connection Complete (0x0a)
        Status: Success (0x00)
        Handle: 39
        Role: Peripheral (0x01)
        Peer address type: Public (0x00)
        Peer address: DF:A9:FF:F6:B1:1A (OUI DF-A9-FF)
        Local resolvable private address: 00:00:00:00:00:00 (Non-Resolvable)
        Peer resolvable private address: 00:00:00:00:00:00 (Non-Resolvable)
        Connection interval: 87.50 msec (0x0046)
        Connection latency: 0 (0x0000)
        Supervision timeout: 25120 msec (0x09d0)
        Central clock accuracy: 0x01
> HCI Event: LE Meta Event (0x3e) plen 6                                                                             #48 3.641957
      LE Advertising Set Terminated (0x12)
        Status: Success (0x00)
        Handle: 0
        Connection handle: 39
        Number of completed extended advertising events: 0
zephyr.exe[861082]: < HCI Command: LE Read Remote Used Features (0x08|0x0016) plen 2                                 #49 3.643949
        Handle: 39 Address: DF:A9:FF:F6:B1:1A (OUI DF-A9-FF)
> HCI Event: Command Status (0x0f) plen 4                                                                            #50 3.644580
      LE Read Remote Used Features (0x08|0x0016) ncmd 1
        Status: Success (0x00)
zephyr.exe[861082]: < ACL Data TX: Handle 39 [1/3] flags 0x00 dlen 7                                                 #51 3.663806
      ATT: Exchange MTU Request (0x02) len 2
        Client RX MTU: 251
> HCI Event: Number of Completed Packets (0x13) plen 5                                                               #52 3.817920
        Num handles: 1
        Handle: 39 Address: DF:A9:FF:F6:B1:1A (OUI DF-A9-FF)
        Count: 1
        Buffers: 0/3
        #51: len 7 (0 Kb/s)
        Latency: 154 msec (154-154 msec ~154 msec)
> HCI Event: LE Meta Event (0x3e) plen 12                                                                            #53 3.905612
      LE Read Remote Used Features (0x04)
        Status: Success (0x00)
        Handle: 39 Address: DF:A9:FF:F6:B1:1A (OUI DF-A9-FF)
        Features: 0x2d 0x49 0x00 0xf7 0x67 0xd8 0x00 0x00
          LE Encryption
          Extended Reject Indication
          Peripheral-initiated Features Exchange
          LE Data Packet Length Extension
          LE 2M PHY
          LE Coded PHY
          Channel Selection Algorithm #2
          Periodic Advertising Sync Transfer - Sender
          Periodic Advertising Sync Transfer - Recipient
          Sleep Clock Accuracy Updates
          Connected Isochronous Stream - Central
          Connected Isochronous Stream - Peripheral
          Isochronous Broadcaster
          Synchronized Receiver
          Connected Isochronous Stream (Host Support)
          LE Power Control Request
          LE Power Control Request
          Connection Subrating
          Connection Subrating (Host Support)
          Unknown features (0x0000d80000000000)
> ACL Data RX: Handle 39 flags 0x02 dlen 11                                                                          #54 6.355487
      SMP: Pairing Request (0x01) len 6
        IO capability: KeyboardDisplay (0x04)
        OOB data: Authentication data not present (0x00)
        Authentication requirement: Bonding, No MITM, SC, No Keypresses (0x09)
        Max encryption key size: 16
        Initiator key distribution: EncKey IdKey (0x03)
        Responder key distribution: EncKey IdKey Sign (0x07)
> ACL Data RX: Handle 39 flags 0x02 dlen 7                                                                           #55 6.355982
      ATT: Exchange MTU Response (0x03) len 2
        Server RX MTU: 23
zephyr.exe[861082]: < HCI Command: Host Number of Completed Packets (0x03|0x0035) plen 5                             #56 6.363946
        Num handles: 1
        Handle: 39 Address: DF:A9:FF:F6:B1:1A (OUI DF-A9-FF)
        Count: 1
zephyr.exe[861082]: < ACL Data TX: Handle 39 [1/3] flags 0x00 dlen 11                                                #57 6.363974
      SMP: Pairing Response (0x02) len 6
        IO capability: DisplayOnly (0x00)
        OOB data: Authentication data not present (0x00)
        Authentication requirement: Bonding, No MITM, SC, No Keypresses (0x09)
        Max encryption key size: 16
        Initiator key distribution: IdKey (0x02)
        Responder key distribution: Sign (0x04)
zephyr.exe[861082]: < HCI Command: Host Number of Completed Packets (0x03|0x0035) plen 5                             #58 6.363992
        Num handles: 1
        Handle: 39 Address: DF:A9:FF:F6:B1:1A (OUI DF-A9-FF)
        Count: 1
> HCI Event: Number of Completed Packets (0x13) plen 5                                                               #59 6.530969
        Num handles: 1
        Handle: 39 Address: DF:A9:FF:F6:B1:1A (OUI DF-A9-FF)
        Count: 1
        Buffers: 0/3
        #57: len 11 (0 Kb/s)
        Latency: 166 msec (154-166 msec ~160 msec)
> ACL Data RX: Handle 39 flags 0x02 dlen 27                                                                          #60 6.530971
> ACL Data RX: Handle 39 flags 0x01 dlen 27                                                                          #61 6.531420
> ACL Data RX: Handle 39 flags 0x01 dlen 15                                                                          #62 6.531868
      SMP: Pairing Public Key (0x0c) len 64
        X[32]: 2ea2d5914fbea2efc323edce73ea80725cbb932ce8cf91ed43434d15f1fa5661
        Y[32]: ef54aeb8e222976d94de9b82ac25dba9d179349becc23c1295856fba05ab2d64
zephyr.exe[861082]: < HCI Command: Host Number of Completed Packets (0x03|0x0035) plen 5                             #63 6.544044
        Num handles: 1
        Handle: 39 Address: DF:A9:FF:F6:B1:1A (OUI DF-A9-FF)
        Count: 1
zephyr.exe[861082]: < HCI Command: Host Number of Completed Packets (0x03|0x0035) plen 5                             #64 6.544129
        Num handles: 1
        Handle: 39 Address: DF:A9:FF:F6:B1:1A (OUI DF-A9-FF)
        Count: 1
zephyr.exe[861082]: < HCI Command: Host Number of Completed Packets (0x03|0x0035) plen 5                             #65 6.544173
        Num handles: 1
        Handle: 39 Address: DF:A9:FF:F6:B1:1A (OUI DF-A9-FF)
        Count: 1
zephyr.exe[861082]: < ACL Data TX: Handle 39 [1/3] flags 0x00 dlen 27                                                #66 6.544177
zephyr.exe[861082]: < ACL Data TX: Handle 39 flags 0x01 dlen 27                                                      #67 6.544178
zephyr.exe[861082]: < ACL Data TX: Handle 39 flags 0x01 dlen 15                                                      #68 6.544179
      SMP: Pairing Public Key (0x0c) len 64
        X[32]: 98308440221e2d910f0e54b71e7ec652857aa9b5a0dc65028824cc19db1226e9
        Y[32]: 67a4816bcb62efb21701e31fdb27561a6217575fb007a8bbdabe7e28b6f68482
> HCI Event: Number of Completed Packets (0x13) plen 5                                                               #69 6.618351
        Num handles: 1
        Handle: 39 Address: DF:A9:FF:F6:B1:1A (OUI DF-A9-FF)
        Count: 1
        Buffers: 0/3
        #66: len 27 (2 Kb/s)
        Latency: 74 msec (74-166 msec ~117 msec)
> HCI Event: Number of Completed Packets (0x13) plen 5                                                               #70 6.618977
        Num handles: 1
        Handle: 39 Address: DF:A9:FF:F6:B1:1A (OUI DF-A9-FF)
        Count: 1
        Buffers: underflow/3
        #67: len 27 (2 Kb/s)
        Latency: 74 msec (74-166 msec ~96 msec)
zephyr.exe[861082]: < ACL Data TX: Handle 39 [1/3] flags 0x00 dlen 21                                                #71 6.623928
      SMP: Pairing Confirm (0x03) len 16
        Confirm value[16]: a8d09d4b6738693e3a09b76410f5a8e4
> HCI Event: Number of Completed Packets (0x13) plen 5                                                               #72 6.705369
        Num handles: 1
        Handle: 39 Address: DF:A9:FF:F6:B1:1A (OUI DF-A9-FF)
        Count: 1
        Buffers: 0/3
        #68: len 15 (0 Kb/s)
        Latency: 161 msec (74-166 msec ~128 msec)
> HCI Event: Number of Completed Packets (0x13) plen 5                                                               #73 6.793030
        Num handles: 1
        Handle: 39 Address: DF:A9:FF:F6:B1:1A (OUI DF-A9-FF)
        Count: 1
        Buffers: underflow/3
        #71: len 21 (0 Kb/s)
        Latency: 169 msec (74-169 msec ~148 msec)
> ACL Data RX: Handle 39 flags 0x02 dlen 21                                                                          #74 6.793150
      SMP: Pairing Random (0x04) len 16
        Random value[16]: 4c6d4c9a0edef4d20000000000000000
zephyr.exe[861082]: < HCI Command: Host Number of Completed Packets (0x03|0x0035) plen 5                             #75 6.803977
        Num handles: 1
        Handle: 39 Address: DF:A9:FF:F6:B1:1A (OUI DF-A9-FF)
        Count: 1
zephyr.exe[861082]: < ACL Data TX: Handle 39 [1/3] flags 0x00 dlen 21                                                #76 6.804040
      SMP: Pairing Random (0x04) len 16
        Random value[16]: 8e6108f966a694cbe26df70bb96773e6
> HCI Event: Number of Completed Packets (0x13) plen 5                                                               #77 6.967653
        Num handles: 1
        Handle: 39 Address: DF:A9:FF:F6:B1:1A (OUI DF-A9-FF)
        Count: 1
        Buffers: 0/3
        #76: len 21 (1 Kb/s)
        Latency: 163 msec (74-169 msec ~156 msec)
> ACL Data RX: Handle 39 flags 0x02 dlen 21                                                                          #78 7.142902
      SMP: Pairing DHKey Check (0x0d) len 16
        E[16]: e3fc3f953a73223bd9591a58729c3012
zephyr.exe[861082]: < HCI Command: Host Number of Completed Packets (0x03|0x0035) plen 5                             #79 7.144079
        Num handles: 1
        Handle: 39 Address: DF:A9:FF:F6:B1:1A (OUI DF-A9-FF)
        Count: 1
zephyr.exe[861082]: < ACL Data TX: Handle 39 [1/3] flags 0x00 dlen 21                                                #80 7.144182
      SMP: Pairing DHKey Check (0x0d) len 16
        E[16]: c865282b168554172a110432ee9d1540
> HCI Event: Number of Completed Packets (0x13) plen 5                                                               #81 7.317756
        Num handles: 1
        Handle: 39 Address: DF:A9:FF:F6:B1:1A (OUI DF-A9-FF)
        Count: 1
        Buffers: 0/3
        #80: len 21 (0 Kb/s)
        Latency: 173 msec (74-173 msec ~164 msec)
> HCI Event: LE Meta Event (0x3e) plen 13                                                                            #82 7.405759
      LE Long Term Key Request (0x05)
        Handle: 39 Address: DF:A9:FF:F6:B1:1A (OUI DF-A9-FF)
        Random number: 0x0000000000000000
        Encrypted diversifier: 0x0000
zephyr.exe[861082]: < HCI Command: LE Long Term Key Request Reply (0x08|0x001a) plen 18                              #83 7.423963
        Handle: 39 Address: DF:A9:FF:F6:B1:1A (OUI DF-A9-FF)
        Long term key[16]: bacc9640aee12d54ba5f519b31e800e3
> HCI Event: Command Complete (0x0e) plen 6                                                                          #84 7.424668
      LE Long Term Key Request Reply (0x08|0x001a) ncmd 1
        Status: Success (0x00)
        Handle: 39 Address: DF:A9:FF:F6:B1:1A (OUI DF-A9-FF)
> HCI Event: Encryption Change (0x08) plen 4                                                                         #85 7.843282
        Status: Success (0x00)
        Handle: 39 Address: DF:A9:FF:F6:B1:1A (OUI DF-A9-FF)
        Encryption: Enabled with AES-CCM (0x01)
zephyr.exe[861082]: < ACL Data TX: Handle 39 [1/3] flags 0x00 dlen 21                                                #86 7.953965
      SMP: Signing Information (0x0a) len 16
        Signature key[16]: 5da095555cc64d02679f89a05211af56
> HCI Event: Number of Completed Packets (0x13) plen 5                                                               #87 8.105517
        Num handles: 1
        Handle: 39 Address: DF:A9:FF:F6:B1:1A (OUI DF-A9-FF)
        Count: 1
        Buffers: 0/3
        #86: len 21 (1 Kb/s)
        Latency: 151 msec (74-173 msec ~158 msec)
> ACL Data RX: Handle 39 flags 0x02 dlen 21                                                                          #88 8.105603
      SMP: Identity Information (0x08) len 16
        Identity resolving key[16]: 7be218a5232db3a4f589647bf4406646
> ACL Data RX: Handle 39 flags 0x02 dlen 12                                                                          #89 8.105954
      SMP: Identity Address Information (0x09) len 7
        Address: DF:A9:FF:F6:B1:1A (OUI DF-A9-FF)
zephyr.exe[861082]: < HCI Command: Host Number of Completed Packets (0x03|0x0035) plen 5                             #90 8.123962
        Num handles: 1
        Handle: 39 Address: DF:A9:FF:F6:B1:1A (OUI DF-A9-FF)
        Count: 1
zephyr.exe[861082]: < HCI Command: LE Add Device To Resolving List (0x08|0x0027) plen 39                             #91 8.123995
        Address type: Public (0x00)
        Address: DF:A9:FF:F6:B1:1A (OUI DF-A9-FF)
        Peer identity resolving key[16]: 7be218a5232db3a4f589647bf4406646
        Local identity resolving key[16]: 00000000000000000000000000000000
> HCI Event: Command Complete (0x0e) plen 4                                                                          #92 8.125059
      LE Add Device To Resolving List (0x08|0x0027) ncmd 1
        Status: Success (0x00)
zephyr.exe[861082]: < HCI Command: LE Set Privacy Mode (0x08|0x004e) plen 8                                          #93 8.143914
        Peer Identity address type: Public (0x00)
        Peer Identity address: DF:A9:FF:F6:B1:1A (OUI DF-A9-FF)
        Privacy Mode: Use Device Privacy (0x01)
> HCI Event: Command Complete (0x0e) plen 4                                                                          #94 8.144954
      LE Set Privacy Mode (0x08|0x004e) ncmd 1
        Status: Success (0x00)
zephyr.exe[861082]: < HCI Command: LE Set Address Resolution Enable (0x08|0x002d) plen 1                             #95 8.163920
        Address resolution: Enabled (0x01)
> HCI Event: Command Complete (0x0e) plen 4                                                                          #96 8.164585
      LE Set Address Resolution Enable (0x08|0x002d) ncmd 1
        Status: Success (0x00)
zephyr.exe[861082]: < HCI Command: Host Number of Completed Packets (0x03|0x0035) plen 5                             #97 8.183952
        Num handles: 1
        Handle: 39 Address: DF:A9:FF:F6:B1:1A (OUI DF-A9-FF)
        Count: 1
> ACL Data RX: Handle 39 flags 0x02 dlen 13                                                                          #98 8.367954
      ATT: Find By Type Value Request (0x06) len 8
        Handle range: 0x0001-0xffff
        Attribute type: Primary Service (0x2800)
          UUID: Generic Telephony Bearer (0x184c)
zephyr.exe[861082]: < HCI Command: Host Number of Completed Packets (0x03|0x0035) plen 5                             #99 8.384024
        Num handles: 1
        Handle: 39 Address: DF:A9:FF:F6:B1:1A (OUI DF-A9-FF)
        Count: 1
zephyr.exe[861082]: < ACL Data TX: Handle 39 [1/3] flags 0x00 dlen 9                                                #100 8.384032
      ATT: Find By Type Value Response (0x07) len 4
        Handle range: 0x0024-0x0050
> HCI Event: Number of Completed Packets (0x13) plen 5                                                              #101 8.542919
        Num handles: 1
        Handle: 39 Address: DF:A9:FF:F6:B1:1A (OUI DF-A9-FF)
        Count: 1
        Buffers: 0/3
        #100: len 9 (0 Kb/s)
        Latency: 158 msec (74-173 msec ~158 msec)
> ACL Data RX: Handle 39 flags 0x02 dlen 13                                                                         #102 8.543053
      ATT: Find By Type Value Request (0x06) len 8
        Handle range: 0x0051-0xffff
        Attribute type: Primary Service (0x2800)
          UUID: Generic Telephony Bearer (0x184c)
zephyr.exe[861082]: < HCI Command: Host Number of Completed Packets (0x03|0x0035) plen 5                            #103 8.543842
        Num handles: 1
        Handle: 39 Address: DF:A9:FF:F6:B1:1A (OUI DF-A9-FF)
        Count: 1
zephyr.exe[861082]: < ACL Data TX: Handle 39 [1/3] flags 0x00 dlen 9                                                #104 8.543912
      ATT: Error Response (0x01) len 4
        Find By Type Value Request (0x06)
        Handle: 0x0051
        Error: Attribute Not Found (0x0a)
> HCI Event: Number of Completed Packets (0x13) plen 5                                                              #105 8.717713
        Num handles: 1
        Handle: 39 Address: DF:A9:FF:F6:B1:1A (OUI DF-A9-FF)
        Count: 1
        Buffers: 0/3
        #104: len 9 (0 Kb/s)
        Latency: 173 msec (74-173 msec ~166 msec)
> ACL Data RX: Handle 39 flags 0x02 dlen 11                                                                         #106 8.718046
      ATT: Read By Type Request (0x08) len 6
        Handle range: 0x0024-0x0050
        Attribute type: Characteristic (0x2803)
zephyr.exe[861082]: < HCI Command: Host Number of Completed Packets (0x03|0x0035) plen 5                            #107 8.724015
        Num handles: 1
        Handle: 39 Address: DF:A9:FF:F6:B1:1A (OUI DF-A9-FF)
        Count: 1
zephyr.exe[861082]: < ACL Data TX: Handle 39 [1/3] flags 0x00 dlen 20                                               #108 8.724021
      ATT: Read By Type Response (0x09) len 15
        Attribute data length: 7
        Attribute data list: 2 entries
        Handle: 0x0025
        Value[5]: 122600b32b
            Properties: 0x12
              Read (0x02)
              Notify (0x10)
            Value Handle: 0x0026
            Value UUID: Bearer Provider Name (0x2bb3)
        Handle: 0x0028
        Value[5]: 022900b42b
            Properties: 0x02
              Read (0x02)
            Value Handle: 0x0029
            Value UUID: Bearer UCI (0x2bb4)
> HCI Event: Number of Completed Packets (0x13) plen 5                                                              #109 8.892751
        Num handles: 1
        Handle: 39 Address: DF:A9:FF:F6:B1:1A (OUI DF-A9-FF)
        Count: 1
        Buffers: 0/3
        #108: len 20 (0 Kb/s)
        Latency: 168 msec (74-173 msec ~167 msec)
> ACL Data RX: Handle 39 flags 0x02 dlen 11                                                                         #110 8.893042
      ATT: Read By Type Request (0x08) len 6
        Handle range: 0x0029-0x0050
        Attribute type: Characteristic (0x2803)
zephyr.exe[861082]: < HCI Command: Host Number of Completed Packets (0x03|0x0035) plen 5                            #111 8.904005
        Num handles: 1
        Handle: 39 Address: DF:A9:FF:F6:B1:1A (OUI DF-A9-FF)
        Count: 1
zephyr.exe[861082]: < ACL Data TX: Handle 39 [1/3] flags 0x00 dlen 20                                               #112 8.904011
      ATT: Read By Type Response (0x09) len 15
        Attribute data length: 7
        Attribute data list: 2 entries
        Handle: 0x002a
        Value[5]: 122b00b52b
            Properties: 0x12
              Read (0x02)
              Notify (0x10)
            Value Handle: 0x002b
            Value UUID: Bearer Technology (0x2bb5)
        Handle: 0x002d
        Value[5]: 122e00b62b
            Properties: 0x12
              Read (0x02)
              Notify (0x10)
            Value Handle: 0x002e
            Value UUID: Bearer URI Schemes Supported List (0x2bb6)
> HCI Event: Number of Completed Packets (0x13) plen 5                                                              #113 9.067724
        Num handles: 1
        Handle: 39 Address: DF:A9:FF:F6:B1:1A (OUI DF-A9-FF)
        Count: 1
        Buffers: 0/3
        #112: len 20 (0 Kb/s)
        Latency: 163 msec (74-173 msec ~165 msec)
> ACL Data RX: Handle 39 flags 0x02 dlen 11                                                                         #114 9.068092
      ATT: Read By Type Request (0x08) len 6
        Handle range: 0x002e-0x0050
        Attribute type: Characteristic (0x2803)
zephyr.exe[861082]: < HCI Command: Host Number of Completed Packets (0x03|0x0035) plen 5                            #115 9.083987
        Num handles: 1
        Handle: 39 Address: DF:A9:FF:F6:B1:1A (OUI DF-A9-FF)
        Count: 1
zephyr.exe[861082]: < ACL Data TX: Handle 39 [1/3] flags 0x00 dlen 20                                               #116 9.084008
      ATT: Read By Type Response (0x09) len 15
        Attribute data length: 7
        Attribute data list: 2 entries
        Handle: 0x0030
        Value[5]: 123100b72b
            Properties: 0x12
              Read (0x02)
              Notify (0x10)
            Value Handle: 0x0031
            Value UUID: Bearer Signal Strength (0x2bb7)
        Handle: 0x0033
        Value[5]: 0e3400b82b
            Properties: 0x0e
              Read (0x02)
              Write Without Response (0x04)
              Write (0x08)
            Value Handle: 0x0034
            Value UUID: Bearer Signal Strength Reporting Interval (0x2bb8)
> HCI Event: Number of Completed Packets (0x13) plen 5                                                              #117 9.242818
        Num handles: 1
        Handle: 39 Address: DF:A9:FF:F6:B1:1A (OUI DF-A9-FF)
        Count: 1
        Buffers: 0/3
        #116: len 20 (1 Kb/s)
        Latency: 158 msec (74-173 msec ~162 msec)
> ACL Data RX: Handle 39 flags 0x02 dlen 11                                                                         #118 9.243227
      ATT: Read By Type Request (0x08) len 6
        Handle range: 0x0034-0x0050
        Attribute type: Characteristic (0x2803)
zephyr.exe[861082]: < HCI Command: Host Number of Completed Packets (0x03|0x0035) plen 5                            #119 9.244009
        Num handles: 1
        Handle: 39 Address: DF:A9:FF:F6:B1:1A (OUI DF-A9-FF)
        Count: 1
zephyr.exe[861082]: < ACL Data TX: Handle 39 [1/3] flags 0x00 dlen 20                                               #120 9.244029
      ATT: Read By Type Response (0x09) len 15
        Attribute data length: 7
        Attribute data list: 2 entries
        Handle: 0x0035
        Value[5]: 123600b92b
            Properties: 0x12
              Read (0x02)
              Notify (0x10)
            Value Handle: 0x0036
            Value UUID: Bearer List Current Calls (0x2bb9)
        Handle: 0x0038
        Value[5]: 023900ba2b
            Properties: 0x02
              Read (0x02)
            Value Handle: 0x0039
            Value UUID: Content Control ID (0x2bba)
> HCI Event: Number of Completed Packets (0x13) plen 5                                                              #121 9.418132
        Num handles: 1
        Handle: 39 Address: DF:A9:FF:F6:B1:1A (OUI DF-A9-FF)
        Count: 1
        Buffers: 0/3
        #120: len 20 (0 Kb/s)
        Latency: 174 msec (74-174 msec ~168 msec)
> ACL Data RX: Handle 39 flags 0x02 dlen 11                                                                         #122 9.418711
      ATT: Read By Type Request (0x08) len 6
        Handle range: 0x0039-0x0050
        Attribute type: Characteristic (0x2803)
zephyr.exe[861082]: < HCI Command: Host Number of Completed Packets (0x03|0x0035) plen 5                            #123 9.424009
        Num handles: 1
        Handle: 39 Address: DF:A9:FF:F6:B1:1A (OUI DF-A9-FF)
        Count: 1
zephyr.exe[861082]: < ACL Data TX: Handle 39 [1/3] flags 0x00 dlen 20                                               #124 9.424014
      ATT: Read By Type Response (0x09) len 15
        Attribute data length: 7
        Attribute data list: 2 entries
        Handle: 0x003a
        Value[5]: 123b00bb2b
            Properties: 0x12
              Read (0x02)
              Notify (0x10)
            Value Handle: 0x003b
            Value UUID: Status Flags (0x2bbb)
        Handle: 0x003d
        Value[5]: 123e00bc2b
            Properties: 0x12
              Read (0x02)
              Notify (0x10)
            Value Handle: 0x003e
            Value UUID: Incoming Call Target Bearer URI (0x2bbc)
> HCI Event: Number of Completed Packets (0x13) plen 5                                                              #125 9.592974
        Num handles: 1
        Handle: 39 Address: DF:A9:FF:F6:B1:1A (OUI DF-A9-FF)
        Count: 1
        Buffers: 0/3
        #124: len 20 (0 Kb/s)
        Latency: 168 msec (74-174 msec ~168 msec)
> ACL Data RX: Handle 39 flags 0x02 dlen 11                                                                         #126 9.593020
      ATT: Read By Type Request (0x08) len 6
        Handle range: 0x003e-0x0050
        Attribute type: Characteristic (0x2803)
zephyr.exe[861082]: < HCI Command: Host Number of Completed Packets (0x03|0x0035) plen 5                            #127 9.604018
        Num handles: 1
        Handle: 39 Address: DF:A9:FF:F6:B1:1A (OUI DF-A9-FF)
        Count: 1
zephyr.exe[861082]: < ACL Data TX: Handle 39 [1/3] flags 0x00 dlen 20                                               #128 9.604023
      ATT: Read By Type Response (0x09) len 15
        Attribute data length: 7
        Attribute data list: 2 entries
        Handle: 0x0040
        Value[5]: 124100bd2b
            Properties: 0x12
              Read (0x02)
              Notify (0x10)
            Value Handle: 0x0041
            Value UUID: Call State (0x2bbd)
        Handle: 0x0043
        Value[5]: 1c4400be2b
            Properties: 0x1c
              Write Without Response (0x04)
              Write (0x08)
              Notify (0x10)
            Value Handle: 0x0044
            Value UUID: Call Control Point (0x2bbe)
> HCI Event: Number of Completed Packets (0x13) plen 5                                                              #129 9.767998
        Num handles: 1
        Handle: 39 Address: DF:A9:FF:F6:B1:1A (OUI DF-A9-FF)
        Count: 1
        Buffers: 0/3
        #128: len 20 (0 Kb/s)
        Latency: 163 msec (74-174 msec ~166 msec)
> ACL Data RX: Handle 39 flags 0x02 dlen 11                                                                         #130 9.768001
      ATT: Read By Type Request (0x08) len 6
        Handle range: 0x0044-0x0050
        Attribute type: Characteristic (0x2803)
zephyr.exe[861082]: < HCI Command: Host Number of Completed Packets (0x03|0x0035) plen 5                            #131 9.784022
        Num handles: 1
        Handle: 39 Address: DF:A9:FF:F6:B1:1A (OUI DF-A9-FF)
        Count: 1
zephyr.exe[861082]: < ACL Data TX: Handle 39 [1/3] flags 0x00 dlen 20                                               #132 9.784028
      ATT: Read By Type Response (0x09) len 15
        Attribute data length: 7
        Attribute data list: 2 entries
        Handle: 0x0046
        Value[5]: 024700bf2b
            Properties: 0x02
              Read (0x02)
            Value Handle: 0x0047
            Value UUID: Call Control Point Optional Opcodes (0x2bbf)
        Handle: 0x0048
        Value[5]: 104900c02b
            Properties: 0x10
              Notify (0x10)
            Value Handle: 0x0049
            Value UUID: Termination Reason (0x2bc0)
> HCI Event: Number of Completed Packets (0x13) plen 5                                                              #133 9.942704
        Num handles: 1
        Handle: 39 Address: DF:A9:FF:F6:B1:1A (OUI DF-A9-FF)
        Count: 1
        Buffers: 0/3
        #132: len 20 (1 Kb/s)
        Latency: 158 msec (74-174 msec ~162 msec)
> ACL Data RX: Handle 39 flags 0x02 dlen 11                                                                         #134 9.943008
      ATT: Read By Type Request (0x08) len 6
        Handle range: 0x0049-0x0050
        Attribute type: Characteristic (0x2803)
zephyr.exe[861082]: < HCI Command: Host Number of Completed Packets (0x03|0x0035) plen 5                            #135 9.943951
        Num handles: 1
        Handle: 39 Address: DF:A9:FF:F6:B1:1A (OUI DF-A9-FF)
        Count: 1
zephyr.exe[861082]: < ACL Data TX: Handle 39 [1/3] flags 0x00 dlen 20                                               #136 9.943972
      ATT: Read By Type Response (0x09) len 15
        Attribute data length: 7
        Attribute data list: 2 entries
        Handle: 0x004b
        Value[5]: 124c00c12b
            Properties: 0x12
              Read (0x02)
              Notify (0x10)
            Value Handle: 0x004c
            Value UUID: Incoming Call (0x2bc1)
        Handle: 0x004e
        Value[5]: 124f00c22b
            Properties: 0x12
              Read (0x02)
              Notify (0x10)
            Value Handle: 0x004f
            Value UUID: Call Friendly Name (0x2bc2)
> HCI Event: Number of Completed Packets (0x13) plen 5                                                             #137 10.117988
        Num handles: 1
        Handle: 39 Address: DF:A9:FF:F6:B1:1A (OUI DF-A9-FF)
        Count: 1
        Buffers: 0/3
        #136: len 20 (0 Kb/s)
        Latency: 174 msec (74-174 msec ~168 msec)
> ACL Data RX: Handle 39 flags 0x02 dlen 11                                                                        #138 10.118047
      ATT: Read By Type Request (0x08) len 6
        Handle range: 0x004f-0x0050
        Attribute type: Characteristic (0x2803)
zephyr.exe[861082]: < HCI Command: Host Number of Completed Packets (0x03|0x0035) plen 5                           #139 10.124020
        Num handles: 1
        Handle: 39 Address: DF:A9:FF:F6:B1:1A (OUI DF-A9-FF)
        Count: 1
zephyr.exe[861082]: < ACL Data TX: Handle 39 [1/3] flags 0x00 dlen 9                                               #140 10.124025
      ATT: Error Response (0x01) len 4
        Read By Type Request (0x08)
        Handle: 0x004f
        Error: Attribute Not Found (0x0a)
> HCI Event: Number of Completed Packets (0x13) plen 5                                                             #141 10.292654
        Num handles: 1
        Handle: 39 Address: DF:A9:FF:F6:B1:1A (OUI DF-A9-FF)
        Count: 1
        Buffers: 0/3
        #140: len 9 (0 Kb/s)
        Latency: 168 msec (74-174 msec ~168 msec)
> ACL Data RX: Handle 39 flags 0x02 dlen 9                                                                         #142 10.292967
      ATT: Find Information Request (0x04) len 4
        Handle range: 0x0027-0x0027
zephyr.exe[861082]: < HCI Command: Host Number of Completed Packets (0x03|0x0035) plen 5                           #143 10.303956
        Num handles: 1
        Handle: 39 Address: DF:A9:FF:F6:B1:1A (OUI DF-A9-FF)
        Count: 1
zephyr.exe[861082]: < ACL Data TX: Handle 39 [1/3] flags 0x00 dlen 10                                              #144 10.303961
      ATT: Find Information Response (0x05) len 5
        Format: UUID-16 (0x01)
        Handle: 0x0027
        UUID: Client Characteristic Configuration (0x2902)
> HCI Event: Number of Completed Packets (0x13) plen 5                                                             #145 10.467713
        Num handles: 1
        Handle: 39 Address: DF:A9:FF:F6:B1:1A (OUI DF-A9-FF)
        Count: 1
        Buffers: 0/3
        #144: len 10 (0 Kb/s)
        Latency: 163 msec (74-174 msec ~166 msec)
> ACL Data RX: Handle 39 flags 0x02 dlen 9                                                                         #146 10.467901
      ATT: Find Information Request (0x04) len 4
        Handle range: 0x002c-0x002c
zephyr.exe[861082]: < HCI Command: Host Number of Completed Packets (0x03|0x0035) plen 5                           #147 10.484015
        Num handles: 1
        Handle: 39 Address: DF:A9:FF:F6:B1:1A (OUI DF-A9-FF)
        Count: 1
zephyr.exe[861082]: < ACL Data TX: Handle 39 [1/3] flags 0x00 dlen 10                                              #148 10.484021
      ATT: Find Information Response (0x05) len 5
        Format: UUID-16 (0x01)
        Handle: 0x002c
        UUID: Client Characteristic Configuration (0x2902)
> HCI Event: Number of Completed Packets (0x13) plen 5                                                             #149 10.642896
        Num handles: 1
        Handle: 39 Address: DF:A9:FF:F6:B1:1A (OUI DF-A9-FF)
        Count: 1
        Buffers: 0/3
        #148: len 10 (0 Kb/s)
        Latency: 158 msec (74-174 msec ~162 msec)
> ACL Data RX: Handle 39 flags 0x02 dlen 9                                                                         #150 10.642898
      ATT: Find Information Request (0x04) len 4
        Handle range: 0x002f-0x002f
zephyr.exe[861082]: < HCI Command: Host Number of Completed Packets (0x03|0x0035) plen 5                           #151 10.643987
        Num handles: 1
        Handle: 39 Address: DF:A9:FF:F6:B1:1A (OUI DF-A9-FF)
        Count: 1
zephyr.exe[861082]: < ACL Data TX: Handle 39 [1/3] flags 0x00 dlen 10                                              #152 10.643992
      ATT: Find Information Response (0x05) len 5
        Format: UUID-16 (0x01)
        Handle: 0x002f
        UUID: Client Characteristic Configuration (0x2902)
> HCI Event: Number of Completed Packets (0x13) plen 5                                                             #153 10.817883
        Num handles: 1
        Handle: 39 Address: DF:A9:FF:F6:B1:1A (OUI DF-A9-FF)
        Count: 1
        Buffers: 0/3
        #152: len 10 (0 Kb/s)
        Latency: 173 msec (74-174 msec ~168 msec)
> ACL Data RX: Handle 39 flags 0x02 dlen 9                                                                         #154 10.817962
      ATT: Find Information Request (0x04) len 4
        Handle range: 0x0032-0x0032
zephyr.exe[861082]: < HCI Command: Host Number of Completed Packets (0x03|0x0035) plen 5                           #155 10.823988
        Num handles: 1
        Handle: 39 Address: DF:A9:FF:F6:B1:1A (OUI DF-A9-FF)
        Count: 1
zephyr.exe[861082]: < ACL Data TX: Handle 39 [1/3] flags 0x00 dlen 10                                              #156 10.823993
      ATT: Find Information Response (0x05) len 5
        Format: UUID-16 (0x01)
        Handle: 0x0032
        UUID: Client Characteristic Configuration (0x2902)
> HCI Event: Number of Completed Packets (0x13) plen 5                                                             #157 10.992970
        Num handles: 1
        Handle: 39 Address: DF:A9:FF:F6:B1:1A (OUI DF-A9-FF)
        Count: 1
        Buffers: 0/3
        #156: len 10 (0 Kb/s)
        Latency: 168 msec (74-174 msec ~168 msec)
> ACL Data RX: Handle 39 flags 0x02 dlen 9                                                                         #158 10.992973
      ATT: Find Information Request (0x04) len 4
        Handle range: 0x0037-0x0037
zephyr.exe[861082]: < HCI Command: Host Number of Completed Packets (0x03|0x0035) plen 5                           #159 11.003978
        Num handles: 1
        Handle: 39 Address: DF:A9:FF:F6:B1:1A (OUI DF-A9-FF)
        Count: 1
zephyr.exe[861082]: < ACL Data TX: Handle 39 [1/3] flags 0x00 dlen 10                                              #160 11.003999
      ATT: Find Information Response (0x05) len 5
        Format: UUID-16 (0x01)
        Handle: 0x0037
        UUID: Client Characteristic Configuration (0x2902)
> HCI Event: Number of Completed Packets (0x13) plen 5                                                             #161 11.167720
        Num handles: 1
        Handle: 39 Address: DF:A9:FF:F6:B1:1A (OUI DF-A9-FF)
        Count: 1
        Buffers: 0/3
        #160: len 10 (0 Kb/s)
        Latency: 163 msec (74-174 msec ~166 msec)
> ACL Data RX: Handle 39 flags 0x02 dlen 9                                                                         #162 11.167944
      ATT: Find Information Request (0x04) len 4
        Handle range: 0x003c-0x003c
zephyr.exe[861082]: < HCI Command: Host Number of Completed Packets (0x03|0x0035) plen 5                           #163 11.184028
        Num handles: 1
        Handle: 39 Address: DF:A9:FF:F6:B1:1A (OUI DF-A9-FF)
        Count: 1
zephyr.exe[861082]: < ACL Data TX: Handle 39 [1/3] flags 0x00 dlen 10                                              #164 11.184033
      ATT: Find Information Response (0x05) len 5
        Format: UUID-16 (0x01)
        Handle: 0x003c
        UUID: Client Characteristic Configuration (0x2902)
> HCI Event: Number of Completed Packets (0x13) plen 5                                                             #165 11.342790
        Num handles: 1
        Handle: 39 Address: DF:A9:FF:F6:B1:1A (OUI DF-A9-FF)
        Count: 1
        Buffers: 0/3
        #164: len 10 (0 Kb/s)
        Latency: 158 msec (74-174 msec ~162 msec)
> ACL Data RX: Handle 39 flags 0x02 dlen 9                                                                         #166 11.342914
      ATT: Find Information Request (0x04) len 4
        Handle range: 0x003f-0x003f
zephyr.exe[861082]: < HCI Command: Host Number of Completed Packets (0x03|0x0035) plen 5                           #167 11.343856
        Num handles: 1
        Handle: 39 Address: DF:A9:FF:F6:B1:1A (OUI DF-A9-FF)
        Count: 1
zephyr.exe[861082]: < ACL Data TX: Handle 39 [1/3] flags 0x00 dlen 10                                              #168 11.343912
      ATT: Find Information Response (0x05) len 5
        Format: UUID-16 (0x01)
        Handle: 0x003f
        UUID: Client Characteristic Configuration (0x2902)
> HCI Event: Number of Completed Packets (0x13) plen 5                                                             #169 11.517965
        Num handles: 1
        Handle: 39 Address: DF:A9:FF:F6:B1:1A (OUI DF-A9-FF)
        Count: 1
        Buffers: 0/3
        #168: len 10 (0 Kb/s)
        Latency: 174 msec (74-174 msec ~168 msec)
> ACL Data RX: Handle 39 flags 0x02 dlen 9                                                                         #170 11.517967
      ATT: Find Information Request (0x04) len 4
        Handle range: 0x0042-0x0042
zephyr.exe[861082]: < HCI Command: Host Number of Completed Packets (0x03|0x0035) plen 5                           #171 11.524014
        Num handles: 1
        Handle: 39 Address: DF:A9:FF:F6:B1:1A (OUI DF-A9-FF)
        Count: 1
zephyr.exe[861082]: < ACL Data TX: Handle 39 [1/3] flags 0x00 dlen 10                                              #172 11.524028
      ATT: Find Information Response (0x05) len 5
        Format: UUID-16 (0x01)
        Handle: 0x0042
        UUID: Client Characteristic Configuration (0x2902)
> HCI Event: Number of Completed Packets (0x13) plen 5                                                             #173 11.692794
        Num handles: 1
        Handle: 39 Address: DF:A9:FF:F6:B1:1A (OUI DF-A9-FF)
        Count: 1
        Buffers: 0/3
        #172: len 10 (0 Kb/s)
        Latency: 168 msec (74-174 msec ~168 msec)
> ACL Data RX: Handle 39 flags 0x02 dlen 9                                                                         #174 11.692893
      ATT: Find Information Request (0x04) len 4
        Handle range: 0x0045-0x0045
zephyr.exe[861082]: < HCI Command: Host Number of Completed Packets (0x03|0x0035) plen 5                           #175 11.704024
        Num handles: 1
        Handle: 39 Address: DF:A9:FF:F6:B1:1A (OUI DF-A9-FF)
        Count: 1
zephyr.exe[861082]: < ACL Data TX: Handle 39 [1/3] flags 0x00 dlen 10                                              #176 11.704030
      ATT: Find Information Response (0x05) len 5
        Format: UUID-16 (0x01)
        Handle: 0x0045
        UUID: Client Characteristic Configuration (0x2902)
> HCI Event: Number of Completed Packets (0x13) plen 5                                                             #177 11.867885
        Num handles: 1
        Handle: 39 Address: DF:A9:FF:F6:B1:1A (OUI DF-A9-FF)
        Count: 1
        Buffers: 0/3
        #176: len 10 (0 Kb/s)
        Latency: 163 msec (74-174 msec ~166 msec)
> ACL Data RX: Handle 39 flags 0x02 dlen 9                                                                         #178 11.867887
      ATT: Find Information Request (0x04) len 4
        Handle range: 0x004a-0x004a
zephyr.exe[861082]: < HCI Command: Host Number of Completed Packets (0x03|0x0035) plen 5                           #179 11.883997
        Num handles: 1
        Handle: 39 Address: DF:A9:FF:F6:B1:1A (OUI DF-A9-FF)
        Count: 1
zephyr.exe[861082]: < ACL Data TX: Handle 39 [1/3] flags 0x00 dlen 10                                              #180 11.884002
      ATT: Find Information Response (0x05) len 5
        Format: UUID-16 (0x01)
        Handle: 0x004a
        UUID: Client Characteristic Configuration (0x2902)
> HCI Event: Number of Completed Packets (0x13) plen 5                                                             #181 12.042771
        Num handles: 1
        Handle: 39 Address: DF:A9:FF:F6:B1:1A (OUI DF-A9-FF)
        Count: 1
        Buffers: 0/3
        #180: len 10 (0 Kb/s)
        Latency: 158 msec (74-174 msec ~162 msec)
> ACL Data RX: Handle 39 flags 0x02 dlen 9                                                                         #182 12.042979
      ATT: Find Information Request (0x04) len 4
        Handle range: 0x004d-0x004d
zephyr.exe[861082]: < HCI Command: Host Number of Completed Packets (0x03|0x0035) plen 5                           #183 12.044000
        Num handles: 1
        Handle: 39 Address: DF:A9:FF:F6:B1:1A (OUI DF-A9-FF)
        Count: 1
zephyr.exe[861082]: < ACL Data TX: Handle 39 [1/3] flags 0x00 dlen 10                                              #184 12.044006
      ATT: Find Information Response (0x05) len 5
        Format: UUID-16 (0x01)
        Handle: 0x004d
        UUID: Client Characteristic Configuration (0x2902)
> HCI Event: Number of Completed Packets (0x13) plen 5                                                             #185 12.217973
        Num handles: 1
        Handle: 39 Address: DF:A9:FF:F6:B1:1A (OUI DF-A9-FF)
        Count: 1
        Buffers: 0/3
        #184: len 10 (0 Kb/s)
        Latency: 173 msec (74-174 msec ~168 msec)
> ACL Data RX: Handle 39 flags 0x02 dlen 9                                                                         #186 12.217975
      ATT: Find Information Request (0x04) len 4
        Handle range: 0x0050-0x0050
zephyr.exe[861082]: < HCI Command: Host Number of Completed Packets (0x03|0x0035) plen 5                           #187 12.223986
        Num handles: 1
        Handle: 39 Address: DF:A9:FF:F6:B1:1A (OUI DF-A9-FF)
        Count: 1
zephyr.exe[861082]: < ACL Data TX: Handle 39 [1/3] flags 0x00 dlen 10                                              #188 12.223992
      ATT: Find Information Response (0x05) len 5
        Format: UUID-16 (0x01)
        Handle: 0x0050
        UUID: Client Characteristic Configuration (0x2902)
> HCI Event: Number of Completed Packets (0x13) plen 5                                                             #189 12.392741
        Num handles: 1
        Handle: 39 Address: DF:A9:FF:F6:B1:1A (OUI DF-A9-FF)
        Count: 1
        Buffers: 0/3
        #188: len 10 (0 Kb/s)
        Late