Bluetooth monitor ver 5.72
btmon[1616561]: = Note: Linux version 6.14.0-36-generic (x86_64)                                                         0.561931
btmon[1616561]: = Note: Bluetooth subsystem version 2.22                                                                 0.561933
= New Index: 00:00:00:00:00:00 (Primary,UART,hci1)                                                                       0.561934
= New Index: 48:5F:99:8E:E0:64 (Primary,USB,hci0)                                                                        0.561934
= Open Index: 00:00:00:00:00:00                                                                                          1.076158
= Index Info: 00:00:00:00:00:00 (Nordic Semiconductor ASA)                                                               1.076174
zephyr.exe[1616563]: @ USER Open: main (privileged) version 2.22                                                {0x0001} 1.076205
zephyr.exe[1616563]: < HCI Command: Reset (0x03|0x0003) plen 0                                                        #1 1.077369
> HCI Event: Command Complete (0x0e) plen 4                                                                           #2 1.077865
      Reset (0x03|0x0003) ncmd 1
        Status: Success (0x00)
zephyr.exe[1616563]: < HCI Command: Read Local Supported Features (0x04|0x0003) plen 0                                #3 1.095984
> HCI Event: Command Complete (0x0e) plen 12                                                                          #4 1.096520
      Read Local Supported Features (0x04|0x0003) ncmd 1
        Status: Success (0x00)
        Features: 0x00 0x00 0x00 0x00 0x60 0x00 0x00 0x00
          BR/EDR Not Supported
          LE Supported (Controller)
zephyr.exe[1616563]: < HCI Command: Read Local Version Information (0x04|0x0001) plen 0                               #5 1.115732
> HCI Event: Command Complete (0x0e) plen 12                                                                          #6 1.116257
      Read Local Version Information (0x04|0x0001) ncmd 1
        Status: Success (0x00)
        HCI version: Reserved (0x0f) - Revision 12393 (0x3069)
        LMP version: Reserved (0x0f) - Subversion 12393 (0x3069)
        Manufacturer: Nordic Semiconductor ASA (89)
zephyr.exe[1616563]: < HCI Command: Read Local Supported Commands (0x04|0x0002) plen 0                                #7 1.135679
> HCI Event: Command Complete (0x0e) plen 68                                                                          #8 1.136733
      Read Local Supported Commands (0x04|0x0002) ncmd 1
        Status: Success (0x00)
        Commands: 119 entries
          Disconnect (Octet 0 - Bit 5)
          Read Remote Version Information (Octet 2 - Bit 7)
          Set Event Mask (Octet 5 - Bit 6)
          Reset (Octet 5 - Bit 7)
          Read Connection Accept Timeout (Octet 7 - Bit 2)
          Write Connection Accept Timeout (Octet 7 - Bit 3)
          Read Transmit Power Level (Octet 10 - Bit 2)
          Set Controller To Host Flow Control (Octet 10 - Bit 5)
          Host Buffer Size (Octet 10 - Bit 6)
          Host Number of Completed Packets (Octet 10 - Bit 7)
          Read Local Version Information (Octet 14 - Bit 3)
          Read Local Supported Features (Octet 14 - Bit 5)
          Read BD ADDR (Octet 15 - Bit 1)
          Read RSSI (Octet 15 - Bit 5)
          Set Event Mask Page 2 (Octet 22 - Bit 2)
          LE Set Event Mask (Octet 25 - Bit 0)
          LE Read Buffer Size (Octet 25 - Bit 1)
          LE Read Local Supported Features (Octet 25 - Bit 2)
          LE Set Random Address (Octet 25 - Bit 4)
          LE Set Advertising Parameters (Octet 25 - Bit 5)
          LE Read Advertising Channel TX Power (Octet 25 - Bit 6)
          LE Set Advertising Data (Octet 25 - Bit 7)
          LE Set Scan Response Data (Octet 26 - Bit 0)
          LE Set Advertise Enable (Octet 26 - Bit 1)
          LE Set Scan Parameters (Octet 26 - Bit 2)
          LE Set Scan Enable (Octet 26 - Bit 3)
          LE Create Connection (Octet 26 - Bit 4)
          LE Create Connection Cancel (Octet 26 - Bit 5)
          LE Read Accept List Size (Octet 26 - Bit 6)
          LE Clear Accept List (Octet 26 - Bit 7)
          LE Add Device To Accept List (Octet 27 - Bit 0)
          LE Remove Device From Accept List (Octet 27 - Bit 1)
          LE Connection Update (Octet 27 - Bit 2)
          LE Set Host Channel Classification (Octet 27 - Bit 3)
          LE Read Channel Map (Octet 27 - Bit 4)
          LE Read Remote Used Features (Octet 27 - Bit 5)
          LE Encrypt (Octet 27 - Bit 6)
          LE Rand (Octet 27 - Bit 7)
          LE Start Encryption (Octet 28 - Bit 0)
          LE Long Term Key Request Reply (Octet 28 - Bit 1)
          LE Long Term Key Request Neg Reply (Octet 28 - Bit 2)
          LE Read Supported States (Octet 28 - Bit 3)
          LE Receiver Test (Octet 28 - Bit 4)
          LE Transmitter Test (Octet 28 - Bit 5)
          LE Test End (Octet 28 - Bit 6)
          Read Authenticated Payload Timeout (Octet 32 - Bit 4)
          Write Authenticated Payload Timeout (Octet 32 - Bit 5)
          LE Set Data Length (Octet 33 - Bit 6)
          LE Read Suggested Default Data Length (Octet 33 - Bit 7)
          LE Write Suggested Default Data Length (Octet 34 - Bit 0)
          LE Add Device To Resolving List (Octet 34 - Bit 3)
          LE Remove Device From Resolving List (Octet 34 - Bit 4)
          LE Clear Resolving List (Octet 34 - Bit 5)
          LE Read Resolving List Size (Octet 34 - Bit 6)
          LE Set Address Resolution Enable (Octet 35 - Bit 1)
          LE Set Resolvable Private Address Timeout (Octet 35 - Bit 2)
          LE Read Maximum Data Length (Octet 35 - Bit 3)
          LE Read PHY (Octet 35 - Bit 4)
          LE Set Default PHY (Octet 35 - Bit 5)
          LE Set PHY (Octet 35 - Bit 6)
          LE Enhanced Receiver Test (Octet 35 - Bit 7)
          LE Enhanced Transmitter Test (Octet 36 - Bit 0)
          LE Set Advertising Set Random Address (Octet 36 - Bit 1)
          LE Set Extended Advertising Parameters (Octet 36 - Bit 2)
          LE Set Extended Advertising Data (Octet 36 - Bit 3)
          LE Set Extended Scan Response Data (Octet 36 - Bit 4)
          LE Set Extended Advertising Enable (Octet 36 - Bit 5)
          LE Read Maximum Advertising Data Length (Octet 36 - Bit 6)
          LE Read Number of Supported Advertising Sets (Octet 36 - Bit 7)
          LE Remove Advertising Set (Octet 37 - Bit 0)
          LE Clear Advertising Sets (Octet 37 - Bit 1)
          LE Set Periodic Advertising Parameters (Octet 37 - Bit 2)
          LE Set Periodic Advertising Data (Octet 37 - Bit 3)
          LE Set Periodic Advertising Enable (Octet 37 - Bit 4)
          LE Set Extended Scan Parameters (Octet 37 - Bit 5)
          LE Set Extended Scan Enable (Octet 37 - Bit 6)
          LE Extended Create Connection (Octet 37 - Bit 7)
          LE Periodic Advertising Create Sync (Octet 38 - Bit 0)
          LE Periodic Advertising Create Sync Cancel (Octet 38 - Bit 1)
          LE Periodic Advertising Terminate Sync (Octet 38 - Bit 2)
          LE Add Device To Periodic Advertiser List (Octet 38 - Bit 3)
          LE Remove Device From Periodic Advertiser List (Octet 38 - Bit 4)
          LE Clear Periodic Advertiser List (Octet 38 - Bit 5)
          LE Read Periodic Advertiser List Size (Octet 38 - Bit 6)
          LE Read Transmit Power (Octet 38 - Bit 7)
          LE Read RF Path Compensation (Octet 39 - Bit 0)
          LE Write RF Path Compensation (Octet 39 - Bit 1)
          LE Set Privacy Mode (Octet 39 - Bit 2)
          LE Periodic Advertising Receive Enable (Octet 40 - Bit 5)
          LE Periodic Advertising Sync Transfer (Octet 40 - Bit 6)
          LE Periodic Advertising Set Info Transfer (Octet 40 - Bit 7)
          LE Periodic Advertising Sync Transfer Parameters (Octet 41 - Bit 0)
          LE Set Default Periodic Advertisng Sync Transfer Parameters (Octet 41 - Bit 1)
          LE Read Buffer v2 (Octet 41 - Bit 5)
          LE Read ISO TX Sync (Octet 41 - Bit 6)
          LE Set Connected Isochronous Group Parameters (Octet 41 - Bit 7)
          LE Set Connected Isochronous Group Parameters Test (Octet 42 - Bit 0)
          LE Create Connected Isochronous Stream (Octet 42 - Bit 1)
          LE Remove Connected Isochronous Group (Octet 42 - Bit 2)
          LE Accept Connected Isochronous Stream Request (Octet 42 - Bit 3)
          LE Reject Connected Isochronous Stream Request (Octet 42 - Bit 4)
          LE Create Broadcast Isochronous Group (Octet 42 - Bit 5)
          LE Create Broadcast Isochronous Group Test (Octet 42 - Bit 6)
          LE Terminate Broadcast Isochronous Group (Octet 42 - Bit 7)
          LE Broadcast Isochronous Group Create Sync (Octet 43 - Bit 0)
          LE Broadcast Isochronous Group Terminate Sync (Octet 43 - Bit 1)
          LE Request Peer SCA (Octet 43 - Bit 2)
          LE Setup Isochronous Data Path (Octet 43 - Bit 3)
          LE Remove Isochronous Data Path (Octet 43 - Bit 4)
          LE Isochronous Transmit Test (Octet 43 - Bit 5)
          LE Isochronous Receive Test (Octet 43 - Bit 6)
          LE Isochronous Read Test Counters (Octet 43 - Bit 7)
          LE Isochronous Read Test Counters (Octet 44 - Bit 0)
          LE Set Host Feature (Octet 44 - Bit 1)
          Octet 44 - Bit 2 
          Octet 45 - Bit 6 
          Octet 46 - Bit 0 
          Octet 46 - Bit 1 
          Octet 46 - Bit 2 
zephyr.exe[1616563]: < HCI Command: Host Buffer Size (0x03|0x0033) plen 7                                             #9 1.155683
        ACL MTU: 255  ACL max packet: 16
        SCO MTU: 0    SCO max packet: 0
> HCI Event: Command Complete (0x0e) plen 4                                                                          #10 1.156307
      Host Buffer Size (0x03|0x0033) ncmd 1
        Status: Success (0x00)
zephyr.exe[1616563]: < HCI Command: Set Controller To Host Flow Control (0x03|0x0031) plen 1                         #11 1.175672
        Flow control: ACL Data Packets (0x01)
> HCI Event: Command Complete (0x0e) plen 4                                                                          #12 1.176167
      Set Controller To Host Flow Control (0x03|0x0031) ncmd 1
        Status: Success (0x00)
zephyr.exe[1616563]: < HCI Command: LE Read Local Supported Features (0x08|0x0003) plen 0                            #13 1.195677
> HCI Event: Command Complete (0x0e) plen 12                                                                         #14 1.196113
      LE Read Local Supported Features (0x08|0x0003) ncmd 1
        Status: Success (0x00)
        Features: 0xfd 0x79 0x00 0xf7 0x30 0x01 0x00 0x00
          LE Encryption
          Extended Reject Indication
          Peripheral-initiated Features Exchange
          LE Ping
          LE Data Packet Length Extension
          LL Privacy
          Extended Scanner Filter Policies
          LE 2M PHY
          LE Coded PHY
          LE Extended Advertising
          LE Periodic Advertising
          Channel Selection Algorithm #2
          Periodic Advertising Sync Transfer - Sender
          Periodic Advertising Sync Transfer - Recipient
          Sleep Clock Accuracy Updates
          Connected Isochronous Stream - Central
          Connected Isochronous Stream - Peripheral
          Isochronous Broadcaster
          Synchronized Receiver
          Periodic Advertising ADI support
          Connection Subrating
          Unknown features (0x0000010000000000)
zephyr.exe[1616563]: < HCI Command: LE Set Host Feature (0x08|0x0074) plen 2                                         #15 1.215718
        Bit Number: 32
          Connected Isochronous Stream (Host Support)
        Bit Value: 1
> HCI Event: Command Complete (0x0e) plen 4                                                                          #16 1.216138
      LE Set Host Feature (0x08|0x0074) ncmd 1
        Status: Success (0x00)
zephyr.exe[1616563]: < HCI Command: LE Read Buffer v2 (0x08|0x0060) plen 0                                           #17 1.235680
> HCI Event: Command Complete (0x0e) plen 10                                                                         #18 1.236204
      LE Read Buffer v2 (0x08|0x0060) ncmd 1
        Status: Success (0x00)
        ACL MTU: 27
        ACL max packet: 3
        ISO MTU: 318
        ISO max packet: 3
zephyr.exe[1616563]: < HCI Command: LE Read Maximum Advertising Data Length (0x08|0x003a) plen 0                     #19 1.255700
> HCI Event: Command Complete (0x0e) plen 6                                                                          #20 1.256121
      LE Read Maximum Advertising Data Length (0x08|0x003a) ncmd 1
        Status: Success (0x00)
        Max length: 1650
zephyr.exe[1616563]: < HCI Command: LE Read Supported States (0x08|0x001c) plen 0                                    #21 1.275680
> HCI Event: Command Complete (0x0e) plen 12                                                                         #22 1.276249
      LE Read Supported States (0x08|0x001c) ncmd 1
        Status: Success (0x00)
        States: 0x000003ff3e0306ff
          Non-connectable Advertising State
          Scannable Advertising State
          Connectable Advertising State
          High Duty Cycle Directed Advertising State
          Passive Scanning State
          Active Scanning State
          Initiating State
            and Connection State (Central Role)
          Connection State (Peripheral Role)
          Scannable Advertising State
            and Passive Scanning State
          Connectable Advertising State
            and Passive Scanning State
          Non-connectable Advertising State
            and Initiating State
          Scannable Advertising State
            and Initiating State
          Active Scanning State
            and Connection State (Central Role)
          Passive Scanning State
            and Connection State (Peripheral Role)
          Active Scanning State
            and Connection State (Peripheral Role)
          Initiating State
            and Connection State (Central Role)
            and Central Role & Central Role
          Low Duty Cycle Directed Advertising State
          Connectable Advertising State
            and Initiating State
            and Central Role & Peripheral Role
          High Duty Cycle Directed Advertising State
            and Initiating State
            and Central Role & Peripheral Role
          Low Duty Cycle Directed Advertising State
            and Initiating State
            and Central Role & Peripheral Role
          Connectable Advertising State
            and Connection State (Central Role)
            and Central Role & Peripheral Role
          High Duty Cycle Directed Advertising State
            and Connection State (Central Role)
            and Central Role & Peripheral Role
          Low Duty Cycle Directed Advertising State
            and Connection State (Central Role)
            and Central Role & Peripheral Role
          Connectable Advertising State
            and Connection State (Peripheral Role)
            and Central Role & Peripheral Role
          High Duty Cycle Directed Advertising State
            and Connection State (Peripheral Role)
            and Peripheral Role & Peripheral Role
          Low Duty Cycle Directed Advertising State
            and Connection State (Peripheral Role)
            and Peripheral Role & Peripheral Role
          Initiating State
            and Connection State (Peripheral Role)
            and Central Role & Peripheral Role
zephyr.exe[1616563]: < HCI Command: LE Read Maximum Data Length (0x08|0x002f) plen 0                                 #23 1.295674
> HCI Event: Command Complete (0x0e) plen 12                                                                         #24 1.296172
      LE Read Maximum Data Length (0x08|0x002f) ncmd 1
        Status: Success (0x00)
        Max TX octets: 251
        Max TX time: 2704
        Max RX octets: 251
        Max RX time: 2704
zephyr.exe[1616563]: < HCI Command: LE Write Suggested Default Data Length (0x08|0x0024) plen 4                      #25 1.315675
        TX octets: 251
        TX time: 2704
> HCI Event: Command Complete (0x0e) plen 4                                                                          #26 1.316120
      LE Write Suggested Default Data Length (0x08|0x0024) ncmd 1
        Status: Success (0x00)
zephyr.exe[1616563]: < HCI Command: LE Read Resolving List Size (0x08|0x002a) plen 0                                 #27 1.335682
> HCI Event: Command Complete (0x0e) plen 5                                                                          #28 1.336076
      LE Read Resolving List Size (0x08|0x002a) ncmd 1
        Status: Success (0x00)
        Size: 8
zephyr.exe[1616563]: < HCI Command: LE Set Event Mask (0x08|0x0001) plen 8                                           #29 1.355677
        Mask: 0x000002023f87fa5e
          LE Advertising Report
          LE Connection Update Complete
          LE Read Remote Used Features Complete
          LE Long Term Key Request
          LE Data Length Change
          LE Enhanced Connection Complete
          LE PHY Update Complete
          LE Extended Advertising Report
          LE Periodic Advertising Sync Established
          LE Periodic Advertising Report
          LE Periodic Advertising Sync Lost
          LE Extended Scan Timeout
          LE Extended Advertising Set Terminated
          LE Scan Request Received
          LE Periodic Advertising Sync Transfer Rvc
          LE CIS Established
          LE CIS Request
          LE Create BIG Complete
          LE Terminate BIG Complete
          LE BIG Sync Estabilished Complete
          LE BIG Sync Lost
          LE BIG Info Advertising Report
          Unknown mask (0x0000020000000000)
> HCI Event: Command Complete (0x0e) plen 4                                                                          #30 1.356144
      LE Set Event Mask (0x08|0x0001) ncmd 1
        Status: Success (0x00)
zephyr.exe[1616563]: < HCI Command: Set Event Mask (0x03|0x0001) plen 8                                              #31 1.375686
        Mask: 0x2000800002008890
          Disconnection Complete
          Encryption Change
          Read Remote Version Information Complete
          Hardware Error
          Data Buffer Overflow
          Encryption Key Refresh Complete
          LE Meta
> HCI Event: Command Complete (0x0e) plen 4                                                                          #32 1.376263
      Set Event Mask (0x03|0x0001) ncmd 1
        Status: Success (0x00)
zephyr.exe[1616563]: < HCI Command: Read BD ADDR (0x04|0x0009) plen 0                                                #33 1.395701
> HCI Event: Command Complete (0x0e) plen 10                                                                         #34 1.396144
      Read BD ADDR (0x04|0x0009) ncmd 1
        Status: Success (0x00)
        Address: 00:00:00:00:00:00 (OUI 00-00-00)
zephyr.exe[1616563]: < HCI Command: LE Set Random Address (0x08|0x0005) plen 6                                       #35 1.415677
        Address: D5:B6:CC:31:DB:3B (Static)
> HCI Event: Command Complete (0x0e) plen 4                                                                          #36 1.416215
      LE Set Random Address (0x08|0x0005) ncmd 1
        Status: Success (0x00)
zephyr.exe[1616563]: < HCI Command: LE Set Extended Advertising Parameters (0x08|0x0036) plen 25                     #37 3.935790
        Handle: 0x00
        Properties: 0x0013
          Connectable
          Scannable
          Use legacy advertising PDUs: ADV_IND
        Min advertising interval: 100.000 msec (0x00a0)
        Max advertising interval: 150.000 msec (0x00f0)
        Channel map: 37, 38, 39 (0x07)
        Own address type: Random (0x01)
        Peer address type: Public (0x00)
        Peer address: 00:00:00:00:00:00 (OUI 00-00-00)
        Filter policy: Allow Scan Request from Any, Allow Connect Request from Any (0x00)
        TX power: Host has no preference (0x7f)
        Primary PHY: LE 1M (0x01)
        Secondary max skip: 0x00
        Secondary PHY: LE 1M (0x01)
        SID: 0x00
        Scan request notifications: Disabled (0x00)
> HCI Event: Command Complete (0x0e) plen 5                                                                          #38 3.936542
      LE Set Extended Advertising Parameters (0x08|0x0036) ncmd 1
        Status: Success (0x00)
        TX power (selected): 0 dbm (0x00)
zephyr.exe[1616563]: < HCI Command: LE Set Advertising Set Random Address (0x08|0x0035) plen 7                       #39 3.955745
        Advertising handle: 0x00
        Advertising random address: D5:B6:CC:31:DB:3B (Static)
> HCI Event: Command Complete (0x0e) plen 4                                                                          #40 3.956265
      LE Set Advertising Set Random Address (0x08|0x0035) ncmd 1
        Status: Success (0x00)
zephyr.exe[1616563]: < HCI Command: LE Set Extended Advertising Data (0x08|0x0037) plen 22                           #41 3.975797
        Handle: 0x00
        Operation: Complete extended advertising data (0x03)
        Fragment preference: Minimize fragmentation (0x01)
        Data length: 0x12
        Flags: 0x06
          LE General Discoverable Mode
          BR/EDR Not Supported
        Name (complete): Tester_F6B11A
> HCI Event: Command Complete (0x0e) plen 4                                                                          #42 3.976566
      LE Set Extended Advertising Data (0x08|0x0037) ncmd 1
        Status: Success (0x00)
zephyr.exe[1616563]: < HCI Command: LE Set Extended Scan Response Data (0x08|0x0038) plen 4                          #43 3.995760
        Handle: 0x00
        Operation: Complete scan response data (0x03)
        Fragment preference: Minimize fragmentation (0x01)
        Data length: 0x00
> HCI Event: Command Complete (0x0e) plen 4                                                                          #44 3.996298
      LE Set Extended Scan Response Data (0x08|0x0038) ncmd 1
        Status: Success (0x00)
zephyr.exe[1616563]: < HCI Command: LE Set Extended Advertising Enable (0x08|0x0039) plen 6                          #45 4.015748
        Extended advertising: Enabled (0x01)
        Number of sets: 1 (0x01)
        Entry 0
          Handle: 0x00
          Duration: 0 ms (0x00)
          Max ext adv events: 0
> HCI Event: Command Complete (0x0e) plen 4                                                                          #46 4.016426
      LE Set Extended Advertising Enable (0x08|0x0039) ncmd 1
        Status: Success (0x00)
> HCI Event: LE Meta Event (0x3e) plen 31                                                                            #47 4.125723
      LE Enhanced Connection Complete (0x0a)
        Status: Success (0x00)
        Handle: 1335
        Role: Peripheral (0x01)
        Peer address type: Public (0x00)
        Peer address: DF:A9:FF:F6:B1:1A (OUI DF-A9-FF)
        Local resolvable private address: 00:00:00:00:00:00 (Non-Resolvable)
        Peer resolvable private address: 00:00:00:00:00:00 (Non-Resolvable)
        Connection interval: 87.50 msec (0x0046)
        Connection latency: 0 (0x0000)
        Supervision timeout: 25120 msec (0x09d0)
        Central clock accuracy: 0x01
> HCI Event: LE Meta Event (0x3e) plen 6                                                                             #48 4.125725
      LE Advertising Set Terminated (0x12)
        Status: Success (0x00)
        Handle: 0
        Connection handle: 1335
        Number of completed extended advertising events: 0
zephyr.exe[1616563]: < HCI Command: LE Read Remote Used Features (0x08|0x0016) plen 2                                #49 4.135961
        Handle: 1335 Address: DF:A9:FF:F6:B1:1A (OUI DF-A9-FF)
zephyr.exe[1616563]: < ACL Data TX: Handle 1335 flags 0x00 dlen 7                                                    #50 4.135971
      ATT: Exchange MTU Request (0x02) len 2
        Client RX MTU: 251
> HCI Event: Command Status (0x0f) plen 4                                                                            #51 4.136415
      LE Read Remote Used Features (0x08|0x0016) ncmd 1
        Status: Success (0x00)
> HCI Event: Number of Completed Packets (0x13) plen 5                                                               #52 4.301734
        Num handles: 1
        Handle: 1335 Address: DF:A9:FF:F6:B1:1A (OUI DF-A9-FF)
        Count: 1
        #50: len 7 (0 Kb/s)
        Latency: 165 msec (165-165 msec ~165 msec)
> HCI Event: LE Meta Event (0x3e) plen 12                                                                            #53 4.389582
      LE Read Remote Used Features (0x04)
        Status: Success (0x00)
        Handle: 1335 Address: DF:A9:FF:F6:B1:1A (OUI DF-A9-FF)
        Features: 0x2d 0x49 0x00 0xf7 0x67 0xd8 0x00 0x00
          LE Encryption
          Extended Reject Indication
          Peripheral-initiated Features Exchange
          LE Data Packet Length Extension
          LE 2M PHY
          LE Coded PHY
          Channel Selection Algorithm #2
          Periodic Advertising Sync Transfer - Sender
          Periodic Advertising Sync Transfer - Recipient
          Sleep Clock Accuracy Updates
          Connected Isochronous Stream - Central
          Connected Isochronous Stream - Peripheral
          Isochronous Broadcaster
          Synchronized Receiver
          Connected Isochronous Stream (Host Support)
          LE Power Control Request
          LE Power Control Request
          Connection Subrating
          Connection Subrating (Host Support)
          Unknown features (0x0000d80000000000)
> ACL Data RX: Handle 1335 flags 0x02 dlen 11                                                                        #54 6.839297
      SMP: Pairing Request (0x01) len 6
        IO capability: KeyboardDisplay (0x04)
        OOB data: Authentication data not present (0x00)
        Authentication requirement: Bonding, No MITM, SC, No Keypresses (0x09)
        Max encryption key size: 16
        Initiator key distribution: EncKey IdKey (0x03)
        Responder key distribution: EncKey IdKey Sign (0x07)
> ACL Data RX: Handle 1335 flags 0x02 dlen 7                                                                         #55 6.839667
      ATT: Exchange MTU Response (0x03) len 2
        Server RX MTU: 23
zephyr.exe[1616563]: < HCI Command: Host Number of Completed Packets (0x03|0x0035) plen 5                            #56 6.856365
        Num handles: 1
        Handle: 1335 Address: DF:A9:FF:F6:B1:1A (OUI DF-A9-FF)
        Count: 1
zephyr.exe[1616563]: < ACL Data TX: Handle 1335 flags 0x00 dlen 11                                                   #57 6.856614
      SMP: Pairing Response (0x02) len 6
        IO capability: NoInputNoOutput (0x03)
        OOB data: Authentication data not present (0x00)
        Authentication requirement: Bonding, No MITM, SC, No Keypresses (0x09)
        Max encryption key size: 16
        Initiator key distribution: IdKey (0x02)
        Responder key distribution: <none> (0x00)
zephyr.exe[1616563]: < HCI Command: Host Number of Completed Packets (0x03|0x0035) plen 5                            #58 6.856804
        Num handles: 1
        Handle: 1335 Address: DF:A9:FF:F6:B1:1A (OUI DF-A9-FF)
        Count: 1
> HCI Event: Number of Completed Packets (0x13) plen 5                                                               #59 7.014325
        Num handles: 1
        Handle: 1335 Address: DF:A9:FF:F6:B1:1A (OUI DF-A9-FF)
        Count: 1
        #57: len 11 (0 Kb/s)
        Latency: 157 msec (157-165 msec ~161 msec)
> ACL Data RX: Handle 1335 flags 0x02 dlen 27                                                                        #60 7.014630
> ACL Data RX: Handle 1335 flags 0x01 dlen 27                                                                        #61 7.015229
> ACL Data RX: Handle 1335 flags 0x01 dlen 15                                                                        #62 7.015589
      SMP: Pairing Public Key (0x0c) len 64
        X: 6f70a2d8c9d96c9aade9a3c576e16098263e02815a074fe63b98ca3a9da24ea8
        Y: 1b46c057cc10f0d3333bee5daf5a0bd827c1459a4d40ea25bd3508b57911593a
zephyr.exe[1616563]: < HCI Command: Host Number of Completed Packets (0x03|0x0035) plen 5                            #63 7.015846
        Num handles: 1
        Handle: 1335 Address: DF:A9:FF:F6:B1:1A (OUI DF-A9-FF)
        Count: 1
zephyr.exe[1616563]: < HCI Command: Host Number of Completed Packets (0x03|0x0035) plen 5                            #64 7.035883
        Num handles: 1
        Handle: 1335 Address: DF:A9:FF:F6:B1:1A (OUI DF-A9-FF)
        Count: 1
zephyr.exe[1616563]: < HCI Command: Host Number of Completed Packets (0x03|0x0035) plen 5                            #65 7.036023
        Num handles: 1
        Handle: 1335 Address: DF:A9:FF:F6:B1:1A (OUI DF-A9-FF)
        Count: 1
zephyr.exe[1616563]: < ACL Data TX: Handle 1335 flags 0x00 dlen 27                                                   #66 7.036103
zephyr.exe[1616563]: < ACL Data TX: Handle 1335 flags 0x01 dlen 27                                                   #67 7.036106
zephyr.exe[1616563]: < ACL Data TX: Handle 1335 flags 0x01 dlen 15                                                   #68 7.036114
      SMP: Pairing Public Key (0x0c) len 64
        X: 98308440221e2d910f0e54b71e7ec652857aa9b5a0dc65028824cc19db1226e9
        Y: 67a4816bcb62efb21701e31fdb27561a6217575fb007a8bbdabe7e28b6f68482
> HCI Event: Number of Completed Packets (0x13) plen 5                                                               #69 7.102284
        Num handles: 1
        Handle: 1335 Address: DF:A9:FF:F6:B1:1A (OUI DF-A9-FF)
        Count: 1
        #66: len 27 (3 Kb/s)
        Latency: 66 msec (66-165 msec ~113 msec)
> HCI Event: Number of Completed Packets (0x13) plen 5                                                               #70 7.102888
        Num handles: 1
        Handle: 1335 Address: DF:A9:FF:F6:B1:1A (OUI DF-A9-FF)
        Count: 1
        #67: len 27 (3 Kb/s)
        Latency: 66 msec (66-165 msec ~90 msec)
zephyr.exe[1616563]: < ACL Data TX: Handle 1335 flags 0x00 dlen 21                                                   #71 7.116161
      SMP: Pairing Confirm (0x03) len 16
        Confim value: aaeb2e94795d0ad56ed053a5eb66bff2
> HCI Event: Number of Completed Packets (0x13) plen 5                                                               #72 7.189108
        Num handles: 1
        Handle: 1335 Address: DF:A9:FF:F6:B1:1A (OUI DF-A9-FF)
        Count: 1
        #68: len 15 (0 Kb/s)
        Latency: 152 msec (66-165 msec ~121 msec)
> HCI Event: Number of Completed Packets (0x13) plen 5                                                               #73 7.276761
        Num handles: 1
        Handle: 1335 Address: DF:A9:FF:F6:B1:1A (OUI DF-A9-FF)
        Count: 1
        #71: len 21 (1 Kb/s)
        Latency: 160 msec (66-165 msec ~141 msec)
> ACL Data RX: Handle 1335 flags 0x02 dlen 21                                                                        #74 7.277077
      SMP: Pairing Random (0x04) len 16
        Random value: 16ed3b84fb0d834d0000000000000000
zephyr.exe[1616563]: < HCI Command: Host Number of Completed Packets (0x03|0x0035) plen 5                            #75 7.296230
        Num handles: 1
        Handle: 1335 Address: DF:A9:FF:F6:B1:1A (OUI DF-A9-FF)
        Count: 1
zephyr.exe[1616563]: < ACL Data TX: Handle 1335 flags 0x00 dlen 21                                                   #76 7.296363
      SMP: Pairing Random (0x04) len 16
        Random value: 8e6108f966a694cbe26df70bb96773e6
> HCI Event: Number of Completed Packets (0x13) plen 5                                                               #77 7.451466
        Num handles: 1
        Handle: 1335 Address: DF:A9:FF:F6:B1:1A (OUI DF-A9-FF)
        Count: 1
        #76: len 21 (1 Kb/s)
        Latency: 155 msec (66-165 msec ~148 msec)
> ACL Data RX: Handle 1335 flags 0x02 dlen 21                                                                        #78 7.626945
      SMP: Pairing DHKey Check (0x0d) len 16
        E: 03300faa694dfa246744dc8fecabe608
zephyr.exe[1616563]: < HCI Command: Host Number of Completed Packets (0x03|0x0035) plen 5                            #79 7.636594
        Num handles: 1
        Handle: 1335 Address: DF:A9:FF:F6:B1:1A (OUI DF-A9-FF)
        Count: 1
zephyr.exe[1616563]: < ACL Data TX: Handle 1335 flags 0x00 dlen 21                                                   #80 7.636806
      SMP: Pairing DHKey Check (0x0d) len 16
        E: 4151b4aea41b7efae1c05280e8adaec4
> HCI Event: Number of Completed Packets (0x13) plen 5                                                               #81 7.801462
        Num handles: 1
        Handle: 1335 Address: DF:A9:FF:F6:B1:1A (OUI DF-A9-FF)
        Count: 1
        #80: len 21 (1 Kb/s)
        Latency: 164 msec (66-165 msec ~156 msec)
> HCI Event: LE Meta Event (0x3e) plen 13                                                                            #82 7.889590
      LE Long Term Key Request (0x05)
        Handle: 1335 Address: DF:A9:FF:F6:B1:1A (OUI DF-A9-FF)
        Random number: 0x0000000000000000
        Encrypted diversifier: 0x0000
zephyr.exe[1616563]: < HCI Command: LE Long Term Key Request Reply (0x08|0x001a) plen 18                             #83 7.896055
        Handle: 1335 Address: DF:A9:FF:F6:B1:1A (OUI DF-A9-FF)
        Long term key: c7c1eb189a4f8d2ae7a8597e55a537e1
> HCI Event: Command Complete (0x0e) plen 6                                                                          #84 7.896787
      LE Long Term Key Request Reply (0x08|0x001a) ncmd 1
        Status: Success (0x00)
        Handle: 1335 Address: DF:A9:FF:F6:B1:1A (OUI DF-A9-FF)
> HCI Event: Encryption Change (0x08) plen 4                                                                         #85 8.326821
        Status: Success (0x00)
        Handle: 1335 Address: DF:A9:FF:F6:B1:1A (OUI DF-A9-FF)
        Encryption: Enabled with AES-CCM (0x01)
> ACL Data RX: Handle 1335 flags 0x02 dlen 21                                                                        #86 8.414377
      SMP: Identity Information (0x08) len 16
        Identity resolving key: 36ef46eb6f3bbcb8b9898e500b8509d9
zephyr.exe[1616563]: < HCI Command: Host Number of Completed Packets (0x03|0x0035) plen 5                            #87 8.446200
        Num handles: 1
        Handle: 1335 Address: DF:A9:FF:F6:B1:1A (OUI DF-A9-FF)
        Count: 1
> ACL Data RX: Handle 1335 flags 0x02 dlen 12                                                                        #88 8.501790
      SMP: Identity Address Information (0x09) len 7
        Address: DF:A9:FF:F6:B1:1A (OUI DF-A9-FF)
> ACL Data RX: Handle 1335 flags 0x02 dlen 13                                                                        #89 8.502280
      ATT: Find By Type Value Request (0x06) len 8
        Handle range: 0x0001-0xffff
        Attribute type: Primary Service (0x2800)
          UUID: Coordinated Set Identification (0x1846)
zephyr.exe[1616563]: < HCI Command: LE Add Device To Resolving List (0x08|0x0027) plen 39                            #90 8.515949
        Address type: Public (0x00)
        Address: DF:A9:FF:F6:B1:1A (OUI DF-A9-FF)
        Peer identity resolving key: 36ef46eb6f3bbcb8b9898e500b8509d9
        Local identity resolving key: 00000000000000000000000000000000
> HCI Event: Command Complete (0x0e) plen 4                                                                          #91 8.516906
      LE Add Device To Resolving List (0x08|0x0027) ncmd 1
        Status: Success (0x00)
zephyr.exe[1616563]: < HCI Command: LE Set Privacy Mode (0x08|0x004e) plen 8                                         #92 8.535793
        Peer Identity address type: Public (0x00)
        Peer Identity address: DF:A9:FF:F6:B1:1A (OUI DF-A9-FF)
        Privacy Mode: Use Device Privacy (0x01)
> HCI Event: Command Complete (0x0e) plen 4                                                                          #93 8.536350
      LE Set Privacy Mode (0x08|0x004e) ncmd 1
        Status: Success (0x00)
zephyr.exe[1616563]: < HCI Command: LE Set Address Resolution Enable (0x08|0x002d) plen 1                            #94 8.555866
        Address resolution: Enabled (0x01)
> HCI Event: Command Complete (0x0e) plen 4                                                                          #95 8.556287
      LE Set Address Resolution Enable (0x08|0x002d) ncmd 1
        Status: Success (0x00)
zephyr.exe[1616563]: < HCI Command: Host Number of Completed Packets (0x03|0x0035) plen 5                            #96 8.575786
        Num handles: 1
        Handle: 1335 Address: DF:A9:FF:F6:B1:1A (OUI DF-A9-FF)
        Count: 1
zephyr.exe[1616563]: < HCI Command: Host Number of Completed Packets (0x03|0x0035) plen 5                            #97 8.576083
        Num handles: 1
        Handle: 1335 Address: DF:A9:FF:F6:B1:1A (OUI DF-A9-FF)
        Count: 1
zephyr.exe[1616563]: < ACL Data TX: Handle 1335 flags 0x00 dlen 9                                                    #98 8.576187
      ATT: Find By Type Value Response (0x07) len 4
        Handle range: 0x0024-0x002f
> HCI Event: Number of Completed Packets (0x13) plen 5                                                               #99 8.676698
        Num handles: 1
        Handle: 1335 Address: DF:A9:FF:F6:B1:1A (OUI DF-A9-FF)
        Count: 1
        #98: len 9 (0 Kb/s)
        Latency: 100 msec (66-165 msec ~128 msec)
> ACL Data RX: Handle 1335 flags 0x02 dlen 13                                                                       #100 8.676909
      ATT: Find By Type Value Request (0x06) len 8
        Handle range: 0x0030-0xffff
        Attribute type: Primary Service (0x2800)
          UUID: Coordinated Set Identification (0x1846)
zephyr.exe[1616563]: < HCI Command: Host Number of Completed Packets (0x03|0x0035) plen 5                           #101 8.696329
        Num handles: 1
        Handle: 1335 Address: DF:A9:FF:F6:B1:1A (OUI DF-A9-FF)
        Count: 1
zephyr.exe[1616563]: < ACL Data TX: Handle 1335 flags 0x00 dlen 9                                                   #102 8.696442
      ATT: Error Response (0x01) len 4
        Find By Type Value Request (0x06)
        Handle: 0x0030
        Error: Attribute Not Found (0x0a)
> HCI Event: Number of Completed Packets (0x13) plen 5                                                              #103 8.851663
        Num handles: 1
        Handle: 1335 Address: DF:A9:FF:F6:B1:1A (OUI DF-A9-FF)
        Count: 1
        #102: len 9 (0 Kb/s)
        Latency: 155 msec (66-165 msec ~141 msec)
> ACL Data RX: Handle 1335 flags 0x02 dlen 11                                                                       #104 8.851837
      ATT: Read By Type Request (0x08) len 6
        Handle range: 0x0024-0x002f
        Attribute type: Characteristic (0x2803)
zephyr.exe[1616563]: < HCI Command: Host Number of Completed Packets (0x03|0x0035) plen 5                           #105 8.855963
        Num handles: 1
        Handle: 1335 Address: DF:A9:FF:F6:B1:1A (OUI DF-A9-FF)
        Count: 1
zephyr.exe[1616563]: < ACL Data TX: Handle 1335 flags 0x00 dlen 20                                                  #106 8.855993
      ATT: Read By Type Response (0x09) len 15
        Attribute data length: 7
        Attribute data list: 2 entries
        Handle: 0x0025
        Value: 122600842b
            Properties: 0x12
              Read (0x02)
              Notify (0x10)
            Value Handle: 0x0026
            Value UUID: Set Identity Resolving Key (0x2b84)
        Handle: 0x0028
        Value: 122900852b
            Properties: 0x12
              Read (0x02)
              Notify (0x10)
            Value Handle: 0x0029
            Value UUID: Coordinated Set Size (0x2b85)
> HCI Event: Number of Completed Packets (0x13) plen 5                                                              #107 9.026707
        Num handles: 1
        Handle: 1335 Address: DF:A9:FF:F6:B1:1A (OUI DF-A9-FF)
        Count: 1
        #106: len 20 (0 Kb/s)
        Latency: 170 msec (66-170 msec ~156 msec)
> ACL Data RX: Handle 1335 flags 0x02 dlen 11                                                                       #108 9.027013
      ATT: Read By Type Request (0x08) len 6
        Handle range: 0x0029-0x002f
        Attribute type: Characteristic (0x2803)
zephyr.exe[1616563]: < HCI Command: Host Number of Completed Packets (0x03|0x0035) plen 5                           #109 9.035988
        Num handles: 1
        Handle: 1335 Address: DF:A9:FF:F6:B1:1A (OUI DF-A9-FF)
        Count: 1
zephyr.exe[1616563]: < ACL Data TX: Handle 1335 flags 0x00 dlen 20                                                  #110 9.036023
      ATT: Read By Type Response (0x09) len 15
        Attribute data length: 7
        Attribute data list: 2 entries
        Handle: 0x002b
        Value: 1a2c00862b
            Properties: 0x1a
              Read (0x02)
              Write (0x08)
              Notify (0x10)
            Value Handle: 0x002c
            Value UUID: Set Member Lock (0x2b86)
        Handle: 0x002e
        Value: 022f00872b
            Properties: 0x02
              Read (0x02)
            Value Handle: 0x002f
            Value UUID: Set Member Rank (0x2b87)
> HCI Event: Number of Completed Packets (0x13) plen 5                                                              #111 9.201751
        Num handles: 1
        Handle: 1335 Address: DF:A9:FF:F6:B1:1A (OUI DF-A9-FF)
        Count: 1
        #110: len 20 (0 Kb/s)
        Latency: 165 msec (66-170 msec ~161 msec)
> ACL Data RX: Handle 1335 flags 0x02 dlen 11                                                                       #112 9.201940
      ATT: Read By Type Request (0x08) len 6
        Handle range: 0x002f-0x002f
        Attribute type: Characteristic (0x2803)
zephyr.exe[1616563]: < HCI Command: Host Number of Completed Packets (0x03|0x0035) plen 5                           #113 9.216311
        Num handles: 1
        Handle: 1335 Address: DF:A9:FF:F6:B1:1A (OUI DF-A9-FF)
        Count: 1
zephyr.exe[1616563]: < ACL Data TX: Handle 1335 flags 0x00 dlen 9                                                   #114 9.216493
      ATT: Error Response (0x01) len 4
        Read By Type Request (0x08)
        Handle: 0x002f
        Error: Attribute Not Found (0x0a)
> HCI Event: Number of Completed Packets (0x13) plen 5                                                              #115 9.376615
        Num handles: 1
        Handle: 1335 Address: DF:A9:FF:F6:B1:1A (OUI DF-A9-FF)
        Count: 1
        #114: len 9 (0 Kb/s)
        Latency: 160 msec (66-170 msec ~160 msec)
> ACL Data RX: Handle 1335 flags 0x02 dlen 9                                                                        #116 9.376849
      ATT: Find Information Request (0x04) len 4
        Handle range: 0x0027-0x0027
zephyr.exe[1616563]: < HCI Command: Host Number of Completed Packets (0x03|0x0035) plen 5                           #117 9.396089
        Num handles: 1
        Handle: 1335 Address: DF:A9:FF:F6:B1:1A (OUI DF-A9-FF)
        Count: 1
zephyr.exe[1616563]: < ACL Data TX: Handle 1335 flags 0x00 dlen 10                                                  #118 9.396138
      ATT: Find Information Response (0x05) len 5
        Format: UUID-16 (0x01)
        Handle: 0x0027
        UUID: Client Characteristic Configuration (0x2902)
> HCI Event: Number of Completed Packets (0x13) plen 5                                                              #119 9.551715
        Num handles: 1
        Handle: 1335 Address: DF:A9:FF:F6:B1:1A (OUI DF-A9-FF)
        Count: 1
        #118: len 10 (0 Kb/s)
        Latency: 155 msec (66-170 msec ~158 msec)
> ACL Data RX: Handle 1335 flags 0x02 dlen 9                                                                        #120 9.551748
      ATT: Find Information Request (0x04) len 4
        Handle range: 0x002a-0x002a
zephyr.exe[1616563]: < HCI Command: Host Number of Completed Packets (0x03|0x0035) plen 5                           #121 9.556239
        Num handles: 1
        Handle: 1335 Address: DF:A9:FF:F6:B1:1A (OUI DF-A9-FF)
        Count: 1
zephyr.exe[1616563]: < ACL Data TX: Handle 1335 flags 0x00 dlen 10                                                  #122 9.556321
      ATT: Find Information Response (0x05) len 5
        Format: UUID-16 (0x01)
        Handle: 0x002a
        UUID: Client Characteristic Configuration (0x2902)
> HCI Event: Number of Completed Packets (0x13) plen 5                                                              #123 9.726552
        Num handles: 1
        Handle: 1335 Address: DF:A9:FF:F6:B1:1A (OUI DF-A9-FF)
        Count: 1
        #122: len 10 (0 Kb/s)
        Latency: 170 msec (66-170 msec ~164 msec)
> ACL Data RX: Handle 1335 flags 0x02 dlen 9                                                                        #124 9.726821
      ATT: Find Information Request (0x04) len 4
        Handle range: 0x002d-0x002d
zephyr.exe[1616563]: < HCI Command: Host Number of Completed Packets (0x03|0x0035) plen 5                           #125 9.736415
        Num handles: 1
        Handle: 1335 Address: DF:A9:FF:F6:B1:1A (OUI DF-A9-FF)
        Count: 1
zephyr.exe[1616563]: < ACL Data TX: Handle 1335 flags 0x00 dlen 10                                                  #126 9.736436
      ATT: Find Information Response (0x05) len 5
        Format: UUID-16 (0x01)
        Handle: 0x002d
        UUID: Client Characteristic Configuration (0x2902)
> HCI Event: Number of Completed Packets (0x13) plen 5                                                              #127 9.901623
        Num handles: 1
        Handle: 1335 Address: DF:A9:FF:F6:B1:1A (OUI DF-A9-FF)
        Count: 1
        #126: len 10 (0 Kb/s)
        Latency: 165 msec (66-170 msec ~164 msec)
> ACL Data RX: Handle 1335 flags 0x02 dlen 9                                                                        #128 9.901846
      ATT: Write Request (0x12) len 4
        Handle: 0x002d
          Data: 0000
zephyr.exe[1616563]: < HCI Command: Host Number of Completed Packets (0x03|0x0035) plen 5                           #129 9.916110
        Num handles: 1
        Handle: 1335 Address: DF:A9:FF:F6:B1:1A (OUI DF-A9-FF)
        Count: 1
zephyr.exe[1616563]: < ACL Data TX: Handle 1335 flags 0x00 dlen 5                                                   #130 9.916158
      ATT: Write Response (0x13) len 0
> HCI Event: Number of Completed Packets (0x13) plen 5                                                             #131 10.076592
        Num handles: 1
        Handle: 1335 Address: DF:A9:FF:F6:B1:1A (OUI DF-A9-FF)
        Count: 1
        #130: len 5 (0 Kb/s)
        Latency: 160 msec (66-170 msec ~162 msec)
> ACL Data RX: Handle 1335 flags 0x02 dlen 9                                                                       #132 10.076797
      ATT: Write Request (0x12) len 4
        Handle: 0x002d
          Data: 0100
zephyr.exe[1616563]: < HCI Command: Host Number of Completed Packets (0x03|0x0035) plen 5                          #133 10.096062
        Num handles: 1
        Handle: 1335 Address: DF:A9:FF:F6:B1:1A (OUI DF-A9-FF)
        Count: 1
zephyr.exe[1616563]: < ACL Data TX: Handle 1335 flags 0x00 dlen 5                                                  #134 10.096099
      ATT: Write Response (0x13) len 0
> HCI Event: Number of Completed Packets (0x13) plen 5                                                             #135 10.251643
        Num handles: 1
        Handle: 1335 Address: DF:A9:FF:F6:B1:1A (OUI DF-A9-FF)
        Count: 1
        #134: len 5 (0 Kb/s)
        Latency: 155 msec (66-170 msec ~159 msec)
> ACL Data RX: Handle 1335 flags 0x02 dlen 7                                                                       #136 10.251829
      ATT: Read Request (0x0a) len 2
        Handle: 0x002c
zephyr.exe[1616563]: < HCI Command: Host Number of Completed Packets (0x03|0x0035) plen 5                          #137 10.256117
        Num handles: 1
        Handle: 1335 Address: DF:A9:FF:F6:B1:1A (OUI DF-A9-FF)
        Count: 1
zephyr.exe[1616563]: < ACL Data TX: Handle 1335 flags 0x00 dlen 6                                                  #138 10.256154
      ATT: Read Response (0x0b) len 1
> HCI Event: Number of Completed Packets (0x13) plen 5                                                             #139 10.426552
        Num handles: 1
        Handle: 1335 Address: DF:A9:FF:F6:B1:1A (OUI DF-A9-FF)
        Count: 1
        #138: len 6 (0 Kb/s)
        Latency: 170 msec (66-170 msec ~164 msec)
> ACL Data RX: Handle 1335 flags 0x02 dlen 8                                                                       #140 10.426798
      ATT: Write Request (0x12) len 3
        Handle: 0x002c
          Data: 02
zephyr.exe[1616563]: < HCI Command: Host Number of Completed Packets (0x03|0x0035) plen 5                          #141 10.436086
        Num handles: 1
        Handle: 1335 Address: DF:A9:FF:F6:B1:1A (OUI DF-A9-FF)
        Count: 1
zephyr.exe[1616563]: < ACL Data TX: Handle 1335 flags 0x00 dlen 5                                                  #142 10.436115
      ATT: Write Response (0x13) len 0
> HCI Event: Number of Completed Packets (0x13) plen 5                                                             #143 10.601366
        Num handles: 1
        Handle: 1335 Address: DF:A9:FF:F6:B1:1A (OUI DF-A9-FF)
        Count: 1
        #142: len 5 (0 Kb/s)
        Latency: 165 msec (66-170 msec ~164 msec)
> HCI Event: Disconnect Complete (0x05) plen 4                                                                     #144 10.689255
        Status: Success (0x00)
        Handle: 1335 Address: DF:A9:FF:F6:B1:1A (OUI DF-A9-FF)
        Reason: Remote User Terminated Connection (0x13)
zephyr.exe[1616563]: < HCI Command: LE Set Extended Advertising Parameters (0x08|0x0036) plen 25                   #145 12.126028
        Handle: 0x00
        Properties: 0x0013
          Connectable
          Scannable
          Use legacy advertising PDUs: ADV_IND
        Min advertising interval: 100.000 msec (0x00a0)
        Max advertising interval: 150.000 msec (0x00f0)
        Channel map: 37, 38, 39 (0x07)
        Own address type: Random (0x01)
        Peer address type: Public (0x00)
        Peer address: 00:00:00:00:00:00 (OUI 00-00-00)
        Filter policy: Allow Scan Request from Any, Allow Connect Request from Any (0x00)
        TX power: Host has no preference (0x7f)
        Primary PHY: LE 1M (0x01)
        Secondary max skip: 0x00
        Secondary PHY: LE 1M (0x01)
        SID: 0x00
        Scan request notifications: Disabled (0x00)
> HCI Event: Command Complete (0x0e) plen 5                                                                        #146 12.126836
      LE Set Extended Advertising Parameters (0x08|0x0036) ncmd 1
        Status: Success (0x00)
        TX power (selected): 0 dbm (0x00)
zephyr.exe[1616563]: < HCI Command: LE Set Advertising Set Random Address (0x08|0x0035) plen 7                     #147 12.135871
        Advertising handle: 0x00
        Advertising random address: D5:B6:CC:31:DB:3B (Static)
> HCI Event: Command Complete (0x0e) plen 4                                                                        #148 12.136404
      LE Set Advertising Set Random Address (0x08|0x0035) ncmd 1
        Status: Success (0x00)
zephyr.exe[1616563]: < HCI Command: LE Set Extended Advertising Data (0x08|0x0037) plen 22                         #149 12.155816
        Handle: 0x00
        Operation: Complete extended advertising data (0x03)
        Fragment preference: Minimize fragmentation (0x01)
        Data length: 0x12
        Flags: 0x06
          LE General Discoverable Mode
          BR/EDR Not Supported
        Name (complete): Tester_F6B11A
> HCI Event: Command Complete (0x0e) plen 4                                                                        #150 12.156597
      LE Set Extended Advertising Data (0x08|0x0037) ncmd 1
        Status: Success (0x00)
zephyr.exe[1616563]: < HCI Command: LE Set Extended Scan Response Data (0x08|0x0038) plen 4                        #151 12.175797
        Handle: 0x00
        Operation: Complete scan response data (0x03)
        Fragment preference: Minimize fragmentation (0x01)
        Data length: 0x00
> HCI Event: Command Complete (0x0e) plen 4                                                                        #152 12.176293
      LE Set Extended Scan Response Data (0x08|0x0038) ncmd 1
        Status: Success (0x00)
zephyr.exe[1616563]: < HCI Command: LE Set Extended Advertising Enable (0x08|0x0039) plen 6                        #153 12.195823
        Extended advertising: Enabled (0x01)
        Number of sets: 1 (0x01)
        Entry 0
          Handle: 0x00
          Duration: 0 ms (0x00)
          Max ext adv events: 0
> HCI Event: Command Complete (0x0e) plen 4                                                                        #154 12.196469
      LE Set Extended Advertising Enable (0x08|0x0039) ncmd 1
        Status: Success (0x00)
> HCI Event: LE Meta Event (0x3e) plen 31                                                                          #155 12.315096
      LE Enhanced Connection Complete (0x0a)
        Status: Success (0x00)
        Handle: 1353
        Role: Peripheral (0x01)
        Peer address type: Public (0x00)
        Peer address: DF:A9:FF:F6:B1:1A (OUI DF-A9-FF)
        Local resolvable private address: 00:00:00:00:00:00 (Non-Resolvable)
        Peer resolvable private address: 00:00:00:00:00:00 (Non-Resolvable)
        Connection interval: 87.50 msec (0x0046)
        Connection latency: 0 (0x0000)
        Supervision timeout: 25120 msec (0x09d0)
        Central clock accuracy: 0x01
> HCI Event: LE Meta Event (0x3e) plen 6                                                                           #156 12.315126
      LE Advertising Set Terminated (0x12)
        Status: Success (0x00)
        Handle: 0
        Connection handle: 1353
        Number of completed extended advertising events: 0
zephyr.exe[1616563]: < HCI Command: LE Read Remote Used Features (0x08|0x0016) plen 2                              #157 12.316820
        Handle: 1353 Address: DF:A9:FF:F6:B1:1A (OUI DF-A9-FF)
zephyr.exe[1616563]: < ACL Data TX: Handle 1353 flags 0x00 dlen 6                                                  #158 12.316844
      SMP: Security Request (0x0b) len 1
        Authentication requirement: Bonding, No MITM, SC, No Keypresses (0x09)
zephyr.exe[1616563]: < ACL Data TX: Handle 1353 flags 0x00 dlen 7                                                  #159 12.316880
      ATT: Exchange MTU Request (0x02) len 2
        Client RX MTU: 251
> HCI Event: Command Status (0x0f) plen 4                                                                          #160 12.317461
      LE Read Remote Used Features (0x08|0x0016) ncmd 1
        Status: Success (0x00)
> HCI Event: Number of Completed Packets (0x13) plen 5                                                             #161 12.404084
        Num handles: 1
        Handle: 1353 Address: DF:A9:FF:F6:B1:1A (OUI DF-A9-FF)
        Count: 1
        #158: len 6 (0 Kb/s)
        Latency: 87 msec (87-87 msec ~87 msec)
> HCI Event: Number of Completed Packets (0x13) plen 5                                                             #162 12.491140
        Num handles: 1
        Handle: 1353 Address: DF:A9:FF:F6:B1:1A (OUI DF-A9-FF)
        Count: 1
        #159: len 7 (0 Kb/s)
        Latency: 174 msec (87-174 msec ~130 msec)
> HCI Event: LE Meta Event (0x3e) plen 12                                                                          #163 12.578919
      LE Read Remote Used Features (0x04)
        Status: Success (0x00)
        Handle: 1353 Address: DF:A9:FF:F6:B1:1A (OUI DF-A9-FF)
        Features: 0x2d 0x49 0x00 0xf7 0x67 0xd8 0x00 0x00
          LE Encryption
          Extended Reject Indication
          Peripheral-initiated Features Exchange
          LE Data Packet Length Extension
          LE 2M PHY
          LE Coded PHY
          Channel Selection Algorithm #2
          Periodic Advertising Sync Transfer - Sender
          Periodic Advertising Sync Transfer - Recipient
          Sleep Clock Accuracy Updates
          Connected Isochronous Stream - Central
          Connected Isochronous Stream - Peripheral
          Isochronous Broadcaster
          Synchronized Receiver
          Connected Isochronous Stream (Host Support)
          LE Power Control Request
          LE Power Control Request
          Connection Subrating
          Connection Subrating (Host Support)
          Unknown features (0x0000d80000000000)
> ACL Data RX: Handle 1353 flags 0x02 dlen 7                                                                       #164 13.016098
      ATT: Exchange MTU Response (0x03) len 2
        Server RX MTU: 23
zephyr.exe[1616563]: < HCI Command: Host Number of Completed Packets (0x03|0x0035) plen 5                          #165 13.036252
        Num handles: 1
        Handle: 1353 Address: DF:A9:FF:F6:B1:1A (OUI DF-A9-FF)
        Count: 1
> HCI Event: LE Meta Event (0x3e) plen 13                                                                          #166 13.104094
      LE Long Term Key Request (0x05)
        Handle: 1353 Address: DF:A9:FF:F6:B1:1A (OUI DF-A9-FF)
        Random number: 0x0000000000000000
        Encrypted diversifier: 0x0000
zephyr.exe[1616563]: < HCI Command: LE Long Term Key Request Reply (0x08|0x001a) plen 18                           #167 13.115937
        Handle: 1353 Address: DF:A9:FF:F6:B1:1A (OUI DF-A9-FF)
        Long term key: c7c1eb189a4f8d2ae7a8597e55a537e1
> HCI Event: Command Complete (0x0e) plen 6                                                                        #168 13.116642
      LE Long Term Key Request Reply (0x08|0x001a) ncmd 1
        Status: Success (0x00)
        Handle: 1353 Address: DF:A9:FF:F6:B1:1A (OUI DF-A9-FF)
> HCI Event: Encryption Change (0x08) plen 4                                                                       #169 13.541339
        Status: Success (0x00)
        Handle: 1353 Address: DF:A9:FF:F6:B1:1A (OUI DF-A9-FF)
        Encryption: Enabled with AES-CCM (0x01)
> ACL Data RX: Handle 1353 flags 0x02 dlen 7                                                                       #170 13.628742
      ATT: Read Request (0x0a) len 2
        Handle: 0x002c
zephyr.exe[1616563]: < HCI Command: Host Number of Completed Packets (0x03|0x0035) plen 5                          #171 13.635954
        Num handles: 1
        Handle: 1353 Address: DF:A9:FF:F6:B1:1A (OUI DF-A9-FF)
        Count: 1
zephyr.exe[1616563]: < ACL Data TX: Handle 1353 flags 0x00 dlen 6                                                  #172 13.636069
      ATT: Read Response (0x0b) len 1
> HCI Event: Number of Completed Packets (0x13) plen 5                                                             #173 13.803539
        Num handles: 1
        Handle: 1353 Address: DF:A9:FF:F6:B1:1A (OUI DF-A9-FF)
        Count: 1
        #172: len 6 (0 Kb/s)
        Latency: 167 msec (87-174 msec ~149 msec)
> ACL Data RX: Handle 1353 flags 0x02 dlen 8                                                                       #174 43.815268
      ATT: Write Request (0x12) len 3
        Handle: 0x002c
          Data: 02
zephyr.exe[1616563]: < HCI Command: Host Number of Completed Packets (0x03|0x0035) plen 5                          #175 43.816625
        Num handles: 1
        Handle: 1353 Address: DF:A9:FF:F6:B1:1A (OUI DF-A9-FF)
        Count: 1
zephyr.exe[1616563]: < ACL Data TX: Handle 1353 flags 0x00 dlen 9                                                  #176 43.816845
      ATT: Error Response (0x01) len 4
        Write Request (0x12)
        Handle: 0x002c
        Error: Reserved (0x84)
> HCI Event: Number of Completed Packets (0x13) plen 5                                                             #177 43.990057
        Num handles: 1
        Handle: 1353 Address: DF:A9:FF:F6:B1:1A (OUI DF-A9-FF)
        Count: 1
        #176: len 9 (0 Kb/s)
        Latency: 173 msec (87-174 msec ~161 msec)
> HCI Event: Disconnect Complete (0x05) plen 4                                                                     #178 44.077936
        Status: Success (0x00)
        Handle: 1353 Address: DF:A9:FF:F6:B1:1A (OUI DF-A9-FF)
        Reason: Remote User Terminated Connection (0x13)
zephyr.exe[1616563]: < HCI Command: LE Set Extended Advertising Parameters (0x08|0x0036) plen 25                   #179 75.336830
        Handle: 0x00
        Properties: 0x0013
          Connectable
          Scannable
          Use legacy advertising PDUs: ADV_IND
        Min advertising interval: 100.000 msec (0x00a0)
        Max advertising interval: 150.000 msec (0x00f0)
        Channel map: 37, 38, 39 (0x07)
        Own address type: Random (0x01)
        Peer address type: Public (0x00)
        Peer address: 00:00:00:00:00:00 (OUI 00-00-00)
        Filter policy: Allow Scan Request from Any, Allow Connect Request from Any (0x00)
        TX power: Host has no preference (0x7f)
        Primary PHY: LE 1M (0x01)
        Secondary max skip: 0x00
        Secondary PHY: LE 1M (0x01)
        SID: 0x00
        Scan request notifications: Disabled (0x00)
> HCI Event: Command Complete (0x0e) plen 5                                                                        #180 75.337648
      LE Set Extended Advertising Parameters (0x08|0x0036) ncmd 1
        Status: Success (0x00)
        TX power (selected): 0 dbm (0x00)
zephyr.exe[1616563]: < HCI Command: LE Set Advertising Set Random Address (0x08|0x0035) plen 7                     #181 75.356472
        Advertising handle: 0x00
        Advertising random address: D5:B6:CC:31:DB:3B (Static)
> HCI Event: Command Complete (0x0e) plen 4                                                                        #182 75.356985
      LE Set Advertising Set Random Address (0x08|0x0035) ncmd 1
        Status: Success (0x00)
zephyr.exe[1616563]: < HCI Command: LE Set Extended Advertising Data (0x08|0x0037) plen 22                         #183 75.376531
        Handle: 0x00
        Operation: Complete extended advertising data (0x03)
        Fragment preference: Minimize fragmentation (0x01)
        Data length: 0x12
        Flags: 0x06
          LE General Discoverable Mode
          BR/EDR Not Supported
        Name (complete): Tester_F6B11A
> HCI Event: Command Complete (0x0e) plen 4                                                                        #184 75.377332
      LE Set Extended Advertising Data (0x08|0x0037) ncmd 1
        Status: Success (0x00)
zephyr.exe[1616563]: < HCI Command: LE Set Extended Scan Response Data (0x08|0x0038) plen 4                        #185 75.396452
        Handle: 0x00
        Operation: Complete scan response data (0x03)
        Fragment preference: Minimize fragmentation (0x01)
        Data length: 0x00
> HCI Event: Command Complete (0x0e) plen 4                                                                        #186 75.397001
      LE Set Extended Scan Response Data (0x08|0x0038) ncmd 1
        Status: Success (0x00)
zephyr.exe[1616563]: < HCI Command: LE Set Extended Advertising Enable (0x08|0x0039) plen 6                        #187 75.416479
        Extended advertising: Enabled (0x01)
        Number of sets: 1 (0x01)
        Entry 0
          Handle: 0x00
          Duration: 0 ms (0x00)
          Max ext adv events: 0
> HCI Event: Command Complete (0x0e) plen 4                                                                        #188 75.417050
      LE Set Extended Advertising Enable (0x08|0x0039) ncmd 1
        Status: Success (0x00)
> HCI Event: LE Meta Event (0x3e) plen 31                                                                          #189 75.526105
      LE Enhanced Connection Complete (0x0a)
        Status: Success (0x00)
        Handle: 1371
        Role: Peripheral (0x01)
        Peer address type: Public (0x00)
        Peer address: DF:A9:FF:F6:B1:1A (OUI DF-A9-FF)
        Local resolvable private address: 00:00:00:00:00:00 (Non-Resolvable)
        Peer resolvable private address: 00:00:00:00:00:00 (Non-Resolvable)
        Connection interval: 87.50 msec (0x0046)
        Connection latency: 0 (0x0000)
        Supervision timeout: 25120 msec (0x09d0)
        Central clock accuracy: 0x01
> HCI Event: LE Meta Event (0x3e) plen 6                                                                           #190 75.526166
      LE Advertising Set Terminated (0x12)
        Status: Success (0x00)
        Handle: 0
        Connection handle: 1371
        Number of completed extended advertising events: 0
zephyr.exe[1616563]: < HCI Command: LE Read Remote Used Features (0x08|0x0016) plen 2                              #191 75.537566
        Handle: 1371 Address: DF:A9:FF:F6:B1:1A (OUI DF-A9-FF)
zephyr.exe[1616563]: < ACL Data TX: Handle 1371 flags 0x00 dlen 6                                                  #192 75.537590
      SMP: Security Request (0x0b) len 1
        Authentication requirement: Bonding, No MITM, SC, No Keypresses (0x09)
zephyr.exe[1616563]: < ACL Data TX: Handle 1371 flags 0x00 dlen 7                                                  #193 75.537595
      ATT: Exchange MTU Request (0x02) len