Bluetooth monitor ver 5.84
btmon[1293333]: = Note: Linux version 6.8.0-83-generic (x86_64)                                                          0.852533
btmon[1293333]: = Note: Bluetooth subsystem version 2.22                                                                 0.852535
= New Index: 00:00:00:00:00:00 (Primary,UART,hci0)                                                                       0.852536
= Open Index: 00:00:00:00:00:00                                                                                          1.357031
= Index Info: 00:00:00:00:00:00 (Nordic Semiconductor ASA)                                                               1.357041
zephyr.exe[1293335]: @ USER Open: main (privileged) version 2.22                                                {0x0001} 1.357045
zephyr.exe[1293335]: < HCI Command: Reset (0x03|0x0003) plen 0                                                        #1 1.357254
> HCI Event: Command Complete (0x0e) plen 4                                                                           #2 1.357702
      Reset (0x03|0x0003) ncmd 1
        Status: Success (0x00)
zephyr.exe[1293335]: < HCI Command: Read Local Supported Features (0x04|0x0003) plen 0                                #3 1.377041
> HCI Event: Command Complete (0x0e) plen 12                                                                          #4 1.377623
      Read Local Supported Features (0x04|0x0003) ncmd 1
        Status: Success (0x00)
        Features: 0x00 0x00 0x00 0x00 0x60 0x00 0x00 0x00
          BR/EDR Not Supported
          LE Supported (Controller)
zephyr.exe[1293335]: < HCI Command: Read Local Version Information (0x04|0x0001) plen 0                               #5 1.397002
> HCI Event: Command Complete (0x0e) plen 12                                                                          #6 1.397525
      Read Local Version Information (0x04|0x0001) ncmd 1
        Status: Success (0x00)
        HCI version: Reserved (0x0e) - Revision 12520 (0x30e8)
        LMP version: Reserved (0x0e) - Subversion 12520 (0x30e8)
        Manufacturer: Nordic Semiconductor ASA (89)
zephyr.exe[1293335]: < HCI Command: Read Local Supported Commands (0x04|0x0002) plen 0                                #7 1.417035
> HCI Event: Command Complete (0x0e) plen 68                                                                          #8 1.418073
      Read Local Supported Commands (0x04|0x0002) ncmd 1
        Status: Success (0x00)
        Commands: 119 entries
          Disconnect (Octet 0 - Bit 5)
          Read Remote Version Information (Octet 2 - Bit 7)
          Set Event Mask (Octet 5 - Bit 6)
          Reset (Octet 5 - Bit 7)
          Read Connection Accept Timeout (Octet 7 - Bit 2)
          Write Connection Accept Timeout (Octet 7 - Bit 3)
          Read Transmit Power Level (Octet 10 - Bit 2)
          Set Controller To Host Flow Control (Octet 10 - Bit 5)
          Host Buffer Size (Octet 10 - Bit 6)
          Host Number of Completed Packets (Octet 10 - Bit 7)
          Read Local Version Information (Octet 14 - Bit 3)
          Read Local Supported Features (Octet 14 - Bit 5)
          Read BD ADDR (Octet 15 - Bit 1)
          Read RSSI (Octet 15 - Bit 5)
          Set Event Mask Page 2 (Octet 22 - Bit 2)
          LE Set Event Mask (Octet 25 - Bit 0)
          LE Read Buffer Size (Octet 25 - Bit 1)
          LE Read Local Supported Features (Octet 25 - Bit 2)
          LE Set Random Address (Octet 25 - Bit 4)
          LE Set Advertising Parameters (Octet 25 - Bit 5)
          LE Read Advertising Channel TX Power (Octet 25 - Bit 6)
          LE Set Advertising Data (Octet 25 - Bit 7)
          LE Set Scan Response Data (Octet 26 - Bit 0)
          LE Set Advertise Enable (Octet 26 - Bit 1)
          LE Set Scan Parameters (Octet 26 - Bit 2)
          LE Set Scan Enable (Octet 26 - Bit 3)
          LE Create Connection (Octet 26 - Bit 4)
          LE Create Connection Cancel (Octet 26 - Bit 5)
          LE Read Accept List Size (Octet 26 - Bit 6)
          LE Clear Accept List (Octet 26 - Bit 7)
          LE Add Device To Accept List (Octet 27 - Bit 0)
          LE Remove Device From Accept List (Octet 27 - Bit 1)
          LE Connection Update (Octet 27 - Bit 2)
          LE Set Host Channel Classification (Octet 27 - Bit 3)
          LE Read Channel Map (Octet 27 - Bit 4)
          LE Read Remote Used Features (Octet 27 - Bit 5)
          LE Encrypt (Octet 27 - Bit 6)
          LE Rand (Octet 27 - Bit 7)
          LE Start Encryption (Octet 28 - Bit 0)
          LE Long Term Key Request Reply (Octet 28 - Bit 1)
          LE Long Term Key Request Neg Reply (Octet 28 - Bit 2)
          LE Read Supported States (Octet 28 - Bit 3)
          LE Receiver Test (Octet 28 - Bit 4)
          LE Transmitter Test (Octet 28 - Bit 5)
          LE Test End (Octet 28 - Bit 6)
          Read Authenticated Payload Timeout (Octet 32 - Bit 4)
          Write Authenticated Payload Timeout (Octet 32 - Bit 5)
          LE Set Data Length (Octet 33 - Bit 6)
          LE Read Suggested Default Data Length (Octet 33 - Bit 7)
          LE Write Suggested Default Data Length (Octet 34 - Bit 0)
          LE Add Device To Resolving List (Octet 34 - Bit 3)
          LE Remove Device From Resolving List (Octet 34 - Bit 4)
          LE Clear Resolving List (Octet 34 - Bit 5)
          LE Read Resolving List Size (Octet 34 - Bit 6)
          LE Set Address Resolution Enable (Octet 35 - Bit 1)
          LE Set Resolvable Private Address Timeout (Octet 35 - Bit 2)
          LE Read Maximum Data Length (Octet 35 - Bit 3)
          LE Read PHY (Octet 35 - Bit 4)
          LE Set Default PHY (Octet 35 - Bit 5)
          LE Set PHY (Octet 35 - Bit 6)
          LE Enhanced Receiver Test (Octet 35 - Bit 7)
          LE Enhanced Transmitter Test (Octet 36 - Bit 0)
          LE Set Advertising Set Random Address (Octet 36 - Bit 1)
          LE Set Extended Advertising Parameters (Octet 36 - Bit 2)
          LE Set Extended Advertising Data (Octet 36 - Bit 3)
          LE Set Extended Scan Response Data (Octet 36 - Bit 4)
          LE Set Extended Advertising Enable (Octet 36 - Bit 5)
          LE Read Maximum Advertising Data Length (Octet 36 - Bit 6)
          LE Read Number of Supported Advertising Sets (Octet 36 - Bit 7)
          LE Remove Advertising Set (Octet 37 - Bit 0)
          LE Clear Advertising Sets (Octet 37 - Bit 1)
          LE Set Periodic Advertising Parameters (Octet 37 - Bit 2)
          LE Set Periodic Advertising Data (Octet 37 - Bit 3)
          LE Set Periodic Advertising Enable (Octet 37 - Bit 4)
          LE Set Extended Scan Parameters (Octet 37 - Bit 5)
          LE Set Extended Scan Enable (Octet 37 - Bit 6)
          LE Extended Create Connection (Octet 37 - Bit 7)
          LE Periodic Advertising Create Sync (Octet 38 - Bit 0)
          LE Periodic Advertising Create Sync Cancel (Octet 38 - Bit 1)
          LE Periodic Advertising Terminate Sync (Octet 38 - Bit 2)
          LE Add Device To Periodic Advertiser List (Octet 38 - Bit 3)
          LE Remove Device From Periodic Advertiser List (Octet 38 - Bit 4)
          LE Clear Periodic Advertiser List (Octet 38 - Bit 5)
          LE Read Periodic Advertiser List Size (Octet 38 - Bit 6)
          LE Read Transmit Power (Octet 38 - Bit 7)
          LE Read RF Path Compensation (Octet 39 - Bit 0)
          LE Write RF Path Compensation (Octet 39 - Bit 1)
          LE Set Privacy Mode (Octet 39 - Bit 2)
          LE Periodic Advertising Receive Enable (Octet 40 - Bit 5)
          LE Periodic Advertising Sync Transfer (Octet 40 - Bit 6)
          LE Periodic Advertising Set Info Transfer (Octet 40 - Bit 7)
          LE Periodic Advertising Sync Transfer Parameters (Octet 41 - Bit 0)
          LE Set Default Periodic Advertisng Sync Transfer Parameters (Octet 41 - Bit 1)
          LE Read Buffer v2 (Octet 41 - Bit 5)
          LE Read ISO TX Sync (Octet 41 - Bit 6)
          LE Set Connected Isochronous Group Parameters (Octet 41 - Bit 7)
          LE Set Connected Isochronous Group Parameters Test (Octet 42 - Bit 0)
          LE Create Connected Isochronous Stream (Octet 42 - Bit 1)
          LE Remove Connected Isochronous Group (Octet 42 - Bit 2)
          LE Accept Connected Isochronous Stream Request (Octet 42 - Bit 3)
          LE Reject Connected Isochronous Stream Request (Octet 42 - Bit 4)
          LE Create Broadcast Isochronous Group (Octet 42 - Bit 5)
          LE Create Broadcast Isochronous Group Test (Octet 42 - Bit 6)
          LE Terminate Broadcast Isochronous Group (Octet 42 - Bit 7)
          LE Broadcast Isochronous Group Create Sync (Octet 43 - Bit 0)
          LE Broadcast Isochronous Group Terminate Sync (Octet 43 - Bit 1)
          LE Request Peer SCA (Octet 43 - Bit 2)
          LE Setup Isochronous Data Path (Octet 43 - Bit 3)
          LE Remove Isochronous Data Path (Octet 43 - Bit 4)
          LE Isochronous Transmit Test (Octet 43 - Bit 5)
          LE Isochronous Receive Test (Octet 43 - Bit 6)
          LE Isochronous Read Test Counters (Octet 43 - Bit 7)
          LE Isochronous Read Test Counters (Octet 44 - Bit 0)
          LE Set Host Feature (Octet 44 - Bit 1)
          LE Read ISO link quality (Octet 44 - Bit 2)
          Octet 45 - Bit 6 
          Octet 46 - Bit 0 
          Octet 46 - Bit 1 
          Octet 46 - Bit 2 
zephyr.exe[1293335]: < HCI Command: Host Buffer Size (0x03|0x0033) plen 7                                             #9 1.437042
        ACL MTU: 255  ACL max packet: 16
        SCO MTU: 0    SCO max packet: 0
> HCI Event: Command Complete (0x0e) plen 4                                                                          #10 1.437518
      Host Buffer Size (0x03|0x0033) ncmd 1
        Status: Success (0x00)
zephyr.exe[1293335]: < HCI Command: Set Controller To Host Flow Control (0x03|0x0031) plen 1                         #11 1.457037
        Flow control: ACL Data Packets (0x01)
> HCI Event: Command Complete (0x0e) plen 4                                                                          #12 1.457505
      Set Controller To Host Flow Control (0x03|0x0031) ncmd 1
        Status: Success (0x00)
zephyr.exe[1293335]: < HCI Command: LE Read Local Supported Features (0x08|0x0003) plen 0                            #13 1.477037
> HCI Event: Command Complete (0x0e) plen 12                                                                         #14 1.477500
      LE Read Local Supported Features (0x08|0x0003) ncmd 1
        Status: Success (0x00)
        Features: 0xfd 0x79 0x00 0xf7 0x30 0x01 0x00 0x00
          LE Encryption
          Extended Reject Indication
          Peripheral-initiated Features Exchange
          LE Ping
          LE Data Packet Length Extension
          LL Privacy
          Extended Scanner Filter Policies
          LE 2M PHY
          LE Coded PHY
          LE Extended Advertising
          LE Periodic Advertising
          Channel Selection Algorithm #2
          Periodic Advertising Sync Transfer - Sender
          Periodic Advertising Sync Transfer - Recipient
          Sleep Clock Accuracy Updates
          Connected Isochronous Stream - Central
          Connected Isochronous Stream - Peripheral
          Isochronous Broadcaster
          Synchronized Receiver
          Periodic Advertising ADI support
          Connection Subrating
          Unknown features (0x0000010000000000)
zephyr.exe[1293335]: < HCI Command: LE Set Host Feature (0x08|0x0074) plen 2                                         #15 1.497001
        Bit Number: 32
          Connected Isochronous Stream (Host Support)
        Bit Value: 1
> HCI Event: Command Complete (0x0e) plen 4                                                                          #16 1.497451
      LE Set Host Feature (0x08|0x0074) ncmd 1
        Status: Success (0x00)
zephyr.exe[1293335]: < HCI Command: LE Read Buffer v2 (0x08|0x0060) plen 0                                           #17 1.517033
> HCI Event: Command Complete (0x0e) plen 10                                                                         #18 1.517510
      LE Read Buffer v2 (0x08|0x0060) ncmd 1
        Status: Success (0x00)
        ACL MTU: 27
        ACL max packet: 3
        ISO MTU: 318
        ISO max packet: 3
zephyr.exe[1293335]: < HCI Command: LE Read Maximum Advertising Data Length (0x08|0x003a) plen 0                     #19 1.537045
> HCI Event: Command Complete (0x0e) plen 6                                                                          #20 1.537500
      LE Read Maximum Advertising Data Length (0x08|0x003a) ncmd 1
        Status: Success (0x00)
        Max length: 1650
zephyr.exe[1293335]: < HCI Command: LE Read Supported States (0x08|0x001c) plen 0                                    #21 1.557045
> HCI Event: Command Complete (0x0e) plen 12                                                                         #22 1.557517
      LE Read Supported States (0x08|0x001c) ncmd 1
        Status: Success (0x00)
        States: 0x000003ff3e0306ff
          Non-connectable Advertising State
          Scannable Advertising State
          Connectable Advertising State
          High Duty Cycle Directed Advertising State
          Passive Scanning State
          Active Scanning State
          Initiating State
            and Connection State (Central Role)
          Connection State (Peripheral Role)
          Scannable Advertising State
            and Passive Scanning State
          Connectable Advertising State
            and Passive Scanning State
          Non-connectable Advertising State
            and Initiating State
          Scannable Advertising State
            and Initiating State
          Active Scanning State
            and Connection State (Central Role)
          Passive Scanning State
            and Connection State (Peripheral Role)
          Active Scanning State
            and Connection State (Peripheral Role)
          Initiating State
            and Connection State (Central Role)
            and Central Role & Central Role
          Low Duty Cycle Directed Advertising State
          Connectable Advertising State
            and Initiating State
            and Central Role & Peripheral Role
          High Duty Cycle Directed Advertising State
            and Initiating State
            and Central Role & Peripheral Role
          Low Duty Cycle Directed Advertising State
            and Initiating State
            and Central Role & Peripheral Role
          Connectable Advertising State
            and Connection State (Central Role)
            and Central Role & Peripheral Role
          High Duty Cycle Directed Advertising State
            and Connection State (Central Role)
            and Central Role & Peripheral Role
          Low Duty Cycle Directed Advertising State
            and Connection State (Central Role)
            and Central Role & Peripheral Role
          Connectable Advertising State
            and Connection State (Peripheral Role)
            and Central Role & Peripheral Role
          High Duty Cycle Directed Advertising State
            and Connection State (Peripheral Role)
            and Peripheral Role & Peripheral Role
          Low Duty Cycle Directed Advertising State
            and Connection State (Peripheral Role)
            and Peripheral Role & Peripheral Role
          Initiating State
            and Connection State (Peripheral Role)
            and Central Role & Peripheral Role
zephyr.exe[1293335]: < HCI Command: LE Read Maximum Data Length (0x08|0x002f) plen 0                                 #23 1.577029
> HCI Event: Command Complete (0x0e) plen 12                                                                         #24 1.577513
      LE Read Maximum Data Length (0x08|0x002f) ncmd 1
        Status: Success (0x00)
        Max TX octets: 251
        Max TX time: 2704
        Max RX octets: 251
        Max RX time: 2704
zephyr.exe[1293335]: < HCI Command: LE Write Suggested Default Data Length (0x08|0x0024) plen 4                      #25 1.597041
        TX octets: 251
        TX time: 2704
> HCI Event: Command Complete (0x0e) plen 4                                                                          #26 1.597521
      LE Write Suggested Default Data Length (0x08|0x0024) ncmd 1
        Status: Success (0x00)
zephyr.exe[1293335]: < HCI Command: LE Read Resolving List Size (0x08|0x002a) plen 0                                 #27 1.617039
> HCI Event: Command Complete (0x0e) plen 5                                                                          #28 1.617456
      LE Read Resolving List Size (0x08|0x002a) ncmd 1
        Status: Success (0x00)
        Size: 8
zephyr.exe[1293335]: < HCI Command: LE Set Event Mask (0x08|0x0001) plen 8                                           #29 1.637031
        Mask: 0x000002023f87fa5e
          LE Advertising Report
          LE Connection Update Complete
          LE Read Remote Used Features Complete
          LE Long Term Key Request
          LE Data Length Change
          LE Enhanced Connection Complete
          LE PHY Update Complete
          LE Extended Advertising Report
          LE Periodic Advertising Sync Established
          LE Periodic Advertising Report
          LE Periodic Advertising Sync Lost
          LE Extended Scan Timeout
          LE Extended Advertising Set Terminated
          LE Scan Request Received
          LE Periodic Advertising Sync Transfer Rvc
          LE CIS Established
          LE CIS Request
          LE Create BIG Complete
          LE Terminate BIG Complete
          LE BIG Sync Established Complete
          LE BIG Sync Lost
          LE BIG Info Advertising Report
          Unknown mask (0x0000020000000000)
> HCI Event: Command Complete (0x0e) plen 4                                                                          #30 1.637552
      LE Set Event Mask (0x08|0x0001) ncmd 1
        Status: Success (0x00)
zephyr.exe[1293335]: < HCI Command: Set Event Mask (0x03|0x0001) plen 8                                              #31 1.657035
        Mask: 0x2000800002008890
          Disconnection Complete
          Encryption Change
          Read Remote Version Information Complete
          Hardware Error
          Data Buffer Overflow
          Encryption Key Refresh Complete
          LE Meta
> HCI Event: Command Complete (0x0e) plen 4                                                                          #32 1.657544
      Set Event Mask (0x03|0x0001) ncmd 1
        Status: Success (0x00)
zephyr.exe[1293335]: < HCI Command: Read BD ADDR (0x04|0x0009) plen 0                                                #33 1.677046
> HCI Event: Command Complete (0x0e) plen 10                                                                         #34 1.677541
      Read BD ADDR (0x04|0x0009) ncmd 1
        Status: Success (0x00)
        Address: 00:00:00:00:00:00 (OUI 00-00-00)
zephyr.exe[1293335]: < HCI Command: LE Set Random Address (0x08|0x0005) plen 6                                       #35 1.697048
        Address: D5:B6:CC:31:DB:3B (Static)
> HCI Event: Command Complete (0x0e) plen 4                                                                          #36 1.697527
      LE Set Random Address (0x08|0x0005) ncmd 1
        Status: Success (0x00)
zephyr.exe[1293335]: < HCI Command: LE Set Extended Advertising Parameters (0x08|0x0036) plen 25                     #37 5.927152
        Handle: 0x00
        Properties: 0x0013
          Connectable
          Scannable
          Use legacy advertising PDUs: ADV_IND
        Min advertising interval: 100.000 msec (0x00a0)
        Max advertising interval: 150.000 msec (0x00f0)
        Channel map: 37, 38, 39 (0x07)
        Own address type: Random (0x01)
        Peer address type: Public (0x00)
        Peer address: 00:00:00:00:00:00 (OUI 00-00-00)
        Filter policy: Allow Scan Request from Any, Allow Connect Request from Any (0x00)
        TX power: Host has no preference (0x7f)
        Primary PHY: LE 1M (0x01)
        Secondary max skip: 0x00
        Secondary PHY: LE 1M (0x01)
        SID: 0x00
        Scan request notifications: Disabled (0x00)
> HCI Event: Command Complete (0x0e) plen 5                                                                          #38 5.928026
      LE Set Extended Advertising Parameters (0x08|0x0036) ncmd 1
        Status: Success (0x00)
        TX power (selected): 0 dbm (0x00)
zephyr.exe[1293335]: < HCI Command: LE Set Advertising Set Random Address (0x08|0x0035) plen 7                       #39 5.937052
        Advertising handle: 0x00
        Advertising random address: D5:B6:CC:31:DB:3B (Static)
> HCI Event: Command Complete (0x0e) plen 4                                                                          #40 5.937547
      LE Set Advertising Set Random Address (0x08|0x0035) ncmd 1
        Status: Success (0x00)
zephyr.exe[1293335]: < HCI Command: LE Set Extended Advertising Data (0x08|0x0037) plen 22                           #41 5.957134
        Handle: 0x00
        Operation: Complete extended advertising data (0x03)
        Fragment preference: Minimize fragmentation (0x01)
        Data length: 0x12
        Flags: 0x06
          LE General Discoverable Mode
          BR/EDR Not Supported
        Name (complete): Tester_2CB6EE
> HCI Event: Command Complete (0x0e) plen 4                                                                          #42 5.957824
      LE Set Extended Advertising Data (0x08|0x0037) ncmd 1
        Status: Success (0x00)
zephyr.exe[1293335]: < HCI Command: LE Set Extended Scan Response Data (0x08|0x0038) plen 4                          #43 5.977019
        Handle: 0x00
        Operation: Complete scan response data (0x03)
        Fragment preference: Minimize fragmentation (0x01)
        Data length: 0x00
> HCI Event: Command Complete (0x0e) plen 4                                                                          #44 5.977472
      LE Set Extended Scan Response Data (0x08|0x0038) ncmd 1
        Status: Success (0x00)
zephyr.exe[1293335]: < HCI Command: LE Set Extended Advertising Enable (0x08|0x0039) plen 6                          #45 5.997022
        Extended advertising: Enabled (0x01)
        Number of sets: 1 (0x01)
        Entry 0
          Handle: 0x00
          Duration: 0 ms (0x00)
          Max ext adv events: 0
> HCI Event: Command Complete (0x0e) plen 4                                                                          #46 5.997595
      LE Set Extended Advertising Enable (0x08|0x0039) ncmd 1
        Status: Success (0x00)
> HCI Event: LE Meta Event (0x3e) plen 31                                                                            #47 6.531575
      LE Enhanced Connection Complete (0x0a)
        Status: Success (0x00)
        Handle: 669
        Role: Peripheral (0x01)
        Peer address type: Public (0x00)
        Peer address: C0:07:E8:2C:B6:EE (OUI C0-07-E8)
        Local resolvable private address: 00:00:00:00:00:00 (Non-Resolvable)
        Peer resolvable private address: 00:00:00:00:00:00 (Non-Resolvable)
        Connection interval: 62.50 msec (0x0032)
        Connection latency: 0 (0x0000)
        Supervision timeout: 20000 msec (0x07d0)
        Central clock accuracy: 0x07
> HCI Event: LE Meta Event (0x3e) plen 6                                                                             #48 6.531849
      LE Advertising Set Terminated (0x12)
        Status: Success (0x00)
        Handle: 0
        Connection handle: 669
        Number of completed extended advertising events: 0
zephyr.exe[1293335]: < HCI Command: LE Read Remote Used Features (0x08|0x0016) plen 2                                #49 6.537190
        Handle: 669 Address: C0:07:E8:2C:B6:EE (OUI C0-07-E8)
> HCI Event: Command Status (0x0f) plen 4                                                                            #50 6.537714
      LE Read Remote Used Features (0x08|0x0016) ncmd 1
        Status: Success (0x00)
zephyr.exe[1293335]: < HCI Command: LE Set PHY (0x08|0x0032) plen 7                                                  #51 6.557047
        Handle: 669 Address: C0:07:E8:2C:B6:EE (OUI C0-07-E8)
        All PHYs preference: 0x00
        TX PHYs preference: 0x02
          LE 2M
        RX PHYs preference: 0x02
          LE 2M
        PHY options preference: Reserved (0x0000)
> HCI Event: Command Status (0x0f) plen 4                                                                            #52 6.557537
      LE Set PHY (0x08|0x0032) ncmd 1
        Status: Success (0x00)
> HCI Event: LE Meta Event (0x3e) plen 12                                                                            #53 6.720502
      LE Read Remote Used Features (0x04)
        Status: Success (0x00)
        Handle: 669 Address: C0:07:E8:2C:B6:EE (OUI C0-07-E8)
        Features: 0x2d 0x49 0x01 0xf7 0xef 0x39 0x00 0x80
          LE Encryption
          Extended Reject Indication
          Peripheral-initiated Features Exchange
          LE Data Packet Length Extension
          LE 2M PHY
          LE Coded PHY
          Channel Selection Algorithm #2
          Minimum Number of Used Channels Procedure
          Periodic Advertising Sync Transfer - Sender
          Periodic Advertising Sync Transfer - Recipient
          Sleep Clock Accuracy Updates
          Connected Isochronous Stream - Central
          Connected Isochronous Stream - Peripheral
          Isochronous Broadcaster
          Synchronized Receiver
          Connected Isochronous Stream (Host Support)
          LE Power Control Request
          LE Power Control Request
          LE Path Loss Monitoring
          Connection Subrating
          Connection Subrating (Host Support)
          Channel Classification
          Unknown features (0x8000390000000000)
> HCI Event: LE Meta Event (0x3e) plen 6                                                                             #54 7.219743
      LE PHY Update Complete (0x0c)
        Status: Success (0x00)
        Handle: 669 Address: C0:07:E8:2C:B6:EE (OUI C0-07-E8)
        TX PHY: LE 2M (0x02)
        RX PHY: LE 2M (0x02)
zephyr.exe[1293335]: < ACL Data TX: Handle 669 [1/3] flags 0x00 dlen 16                                             #55 11.547315
      LE L2CAP: Connection Parameter Update Request (0x12) ident 1 len 8
        Min interval: 24
        Max interval: 40
        Peripheral latency: 0
        Timeout multiplier: 42
> HCI Event: Number of Completed Packets (0x13) plen 5                                                              #56 11.657632
        Num handles: 1
        Handle: 669 Address: C0:07:E8:2C:B6:EE (OUI C0-07-E8)
        Count: 1
        Buffers: 0/3
        #55: len 16 (1 Kb/s)
        Latency: 110 msec (110-110 msec ~110 msec)
> ACL Data RX: Handle 669 flags 0x02 dlen 10                                                                        #57 11.657832
      LE L2CAP: Connection Parameter Update Response (0x13) ident 1 len 2
        Result: Connection Parameters accepted (0x0000)
zephyr.exe[1293335]: < HCI Command: Host Number of Completed Packets (0x03|0x0035) plen 5                           #58 11.677357
        Num handles: 1
        Handle: 669 Address: C0:07:E8:2C:B6:EE (OUI C0-07-E8)
        Count: 1
> ACL Data RX: Handle 669 flags 0x02 dlen 11                                                                        #59 14.220202
      SMP: Pairing Request (0x01) len 6
        IO capability: KeyboardDisplay (0x04)
        OOB data: Authentication data not present (0x00)
        Authentication requirement: Bonding, No MITM, Legacy, No Keypresses (0x01)
        Max encryption key size: 16
        Initiator key distribution: EncKey IdKey Sign (0x07)
        Responder key distribution: EncKey IdKey Sign (0x07)
zephyr.exe[1293335]: < HCI Command: Host Number of Completed Packets (0x03|0x0035) plen 5                           #60 14.237398
        Num handles: 1
        Handle: 669 Address: C0:07:E8:2C:B6:EE (OUI C0-07-E8)
        Count: 1
zephyr.exe[1293335]: < ACL Data TX: Handle 669 [1/3] flags 0x00 dlen 11                                             #61 14.237409
      SMP: Pairing Response (0x02) len 6
        IO capability: NoInputNoOutput (0x03)
        OOB data: Authentication data not present (0x00)
        Authentication requirement: Bonding, No MITM, Legacy, No Keypresses (0x01)
        Max encryption key size: 16
        Initiator key distribution: EncKey IdKey Sign (0x07)
        Responder key distribution: EncKey Sign (0x05)
> HCI Event: Number of Completed Packets (0x13) plen 5                                                              #62 14.345232
        Num handles: 1
        Handle: 669 Address: C0:07:E8:2C:B6:EE (OUI C0-07-E8)
        Count: 1
        Buffers: 0/3
        #61: len 11 (0 Kb/s)
        Latency: 107 msec (107-110 msec ~109 msec)
> ACL Data RX: Handle 669 flags 0x02 dlen 21                                                                        #63 14.345508
      SMP: Pairing Confirm (0x03) len 16
        Confirm value[16]: 64840fd6cc88b252bc4b7a423d7eb52c
zephyr.exe[1293335]: < HCI Command: Host Number of Completed Packets (0x03|0x0035) plen 5                           #64 14.357351
        Num handles: 1
        Handle: 669 Address: C0:07:E8:2C:B6:EE (OUI C0-07-E8)
        Count: 1
zephyr.exe[1293335]: < ACL Data TX: Handle 669 [1/3] flags 0x00 dlen 21                                             #65 14.357376
      SMP: Pairing Confirm (0x03) len 16
        Confirm value[16]: 9cc011b59f9603478615e2e41424d094
> HCI Event: Number of Completed Packets (0x13) plen 5                                                              #66 14.470204
        Num handles: 1
        Handle: 669 Address: C0:07:E8:2C:B6:EE (OUI C0-07-E8)
        Count: 1
        Buffers: 0/3
        #65: len 21 (1 Kb/s)
        Latency: 112 msec (107-112 msec ~110 msec)
> ACL Data RX: Handle 669 flags 0x02 dlen 21                                                                        #67 14.470547
      SMP: Pairing Random (0x04) len 16
        Random value[16]: 9fe1cd94f9c1eb430000000000000000
zephyr.exe[1293335]: < HCI Command: Host Number of Completed Packets (0x03|0x0035) plen 5                           #68 14.477346
        Num handles: 1
        Handle: 669 Address: C0:07:E8:2C:B6:EE (OUI C0-07-E8)
        Count: 1
zephyr.exe[1293335]: < ACL Data TX: Handle 669 [1/3] flags 0x00 dlen 21                                             #69 14.477368
      SMP: Pairing Random (0x04) len 16
        Random value[16]: 8e6108f966a694cbe26df70bb96773e6
> HCI Event: Number of Completed Packets (0x13) plen 5                                                              #70 14.595051
        Num handles: 1
        Handle: 669 Address: C0:07:E8:2C:B6:EE (OUI C0-07-E8)
        Count: 1
        Buffers: 0/3
        #69: len 21 (1 Kb/s)
        Latency: 117 msec (107-117 msec ~114 msec)
> HCI Event: LE Meta Event (0x3e) plen 13                                                                           #71 14.658059
      LE Long Term Key Request (0x05)
        Handle: 669 Address: C0:07:E8:2C:B6:EE (OUI C0-07-E8)
        Random number: 0x0000000000000000
        Encrypted diversifier: 0x0000
zephyr.exe[1293335]: < HCI Command: LE Long Term Key Request Reply (0x08|0x001a) plen 18                            #72 14.677267
        Handle: 669 Address: C0:07:E8:2C:B6:EE (OUI C0-07-E8)
        Long term key[16]: 6632cd9b4cb66cc69cbfb3cb6ab25220
> HCI Event: Command Complete (0x0e) plen 6                                                                         #73 14.677926
      LE Long Term Key Request Reply (0x08|0x001a) ncmd 1
        Status: Success (0x00)
        Handle: 669 Address: C0:07:E8:2C:B6:EE (OUI C0-07-E8)
> HCI Event: Encryption Change (0x08) plen 4                                                                        #74 14.970351
        Status: Success (0x00)
        Handle: 669 Address: C0:07:E8:2C:B6:EE (OUI C0-07-E8)
        Encryption: Enabled with AES-CCM (0x01)
zephyr.exe[1293335]: < ACL Data TX: Handle 669 [1/3] flags 0x00 dlen 21                                             #75 15.087303
      SMP: Encryption Information (0x06) len 16
        Long term key[16]: 5da095555cc64d02679f89a05211af56
zephyr.exe[1293335]: < ACL Data TX: Handle 669 [2/3] flags 0x00 dlen 15                                             #76 15.087318
      SMP: Central Identification (0x07) len 10
        EDIV: 0x825e
        Rand: 0x84c81ed264dab3d8
zephyr.exe[1293335]: < ACL Data TX: Handle 669 [3/3] flags 0x00 dlen 21                                             #77 15.087320
      SMP: Signing Information (0x0a) len 16
        Signature key[16]: bc235a02440d0c3424a2acf8fd71a45c
> HCI Event: Number of Completed Packets (0x13) plen 5                                                              #78 15.095538
        Num handles: 1
        Handle: 669 Address: C0:07:E8:2C:B6:EE (OUI C0-07-E8)
        Count: 1
        Buffers: 2/3
        #75: len 21 (21 Kb/s)
        Latency: 8 msec (8-117 msec ~61 msec)
> HCI Event: Number of Completed Packets (0x13) plen 5                                                              #79 15.096028
        Num handles: 1
        Handle: 669 Address: C0:07:E8:2C:B6:EE (OUI C0-07-E8)
        Count: 1
        Buffers: 1/3
        #76: len 15 (15 Kb/s)
        Latency: 8 msec (8-117 msec ~34 msec)
> HCI Event: Number of Completed Packets (0x13) plen 5                                                              #80 15.157763
        Num handles: 1
        Handle: 669 Address: C0:07:E8:2C:B6:EE (OUI C0-07-E8)
        Count: 1
        Buffers: 0/3
        #77: len 21 (2 Kb/s)
        Latency: 70 msec (8-117 msec ~52 msec)
> ACL Data RX: Handle 669 flags 0x02 dlen 21                                                                        #81 15.158001
      SMP: Encryption Information (0x06) len 16
        Long term key[16]: 84141c49a7c9dea203c7f27c6dda04a7
> ACL Data RX: Handle 669 flags 0x02 dlen 15                                                                        #82 15.158279
      SMP: Central Identification (0x07) len 10
        EDIV: 0x72f3
        Rand: 0xa9a27fc3b17ee40b
> ACL Data RX: Handle 669 flags 0x02 dlen 21                                                                        #83 15.158777
      SMP: Identity Information (0x08) len 16
        Identity resolving key[16]: e3d628630b3e937813909aaae5240437
zephyr.exe[1293335]: < HCI Command: Host Number of Completed Packets (0x03|0x0035) plen 5                           #84 15.177295
        Num handles: 1
        Handle: 669 Address: C0:07:E8:2C:B6:EE (OUI C0-07-E8)
        Count: 1
zephyr.exe[1293335]: < HCI Command: Host Number of Completed Packets (0x03|0x0035) plen 5                           #85 15.177516
        Num handles: 1
        Handle: 669 Address: C0:07:E8:2C:B6:EE (OUI C0-07-E8)
        Count: 1
zephyr.exe[1293335]: < HCI Command: Host Number of Completed Packets (0x03|0x0035) plen 5                           #86 15.177589
        Num handles: 1
        Handle: 669 Address: C0:07:E8:2C:B6:EE (OUI C0-07-E8)
        Count: 1
> ACL Data RX: Handle 669 flags 0x02 dlen 12                                                                        #87 15.177872
      SMP: Identity Address Information (0x09) len 7
        Address: C0:07:E8:2C:B6:EE (OUI C0-07-E8)
zephyr.exe[1293335]: < HCI Command: LE Add Device To Resolving List (0x08|0x0027) plen 39                           #88 15.197236
        Address type: Public (0x00)
        Address: C0:07:E8:2C:B6:EE (OUI C0-07-E8)
        Peer identity resolving key[16]: e3d628630b3e937813909aaae5240437
        Local identity resolving key[16]: 00000000000000000000000000000000
> HCI Event: Command Complete (0x0e) plen 4                                                                         #89 15.198104
      LE Add Device To Resolving List (0x08|0x0027) ncmd 1
        Status: Success (0x00)
zephyr.exe[1293335]: < HCI Command: LE Set Privacy Mode (0x08|0x004e) plen 8                                        #90 15.217294
        Peer Identity address type: Public (0x00)
        Peer Identity address: C0:07:E8:2C:B6:EE (OUI C0-07-E8)
        Privacy Mode: Use Device Privacy (0x01)
> HCI Event: Command Complete (0x0e) plen 4                                                                         #91 15.217792
      LE Set Privacy Mode (0x08|0x004e) ncmd 1
        Status: Success (0x00)
> ACL Data RX: Handle 669 flags 0x02 dlen 21                                                                        #92 15.220402
      SMP: Signing Information (0x0a) len 16
        Signature key[16]: 144baf1908e2d2365c2786d884cb855c
> ACL Data RX: Handle 669 flags 0x02 dlen 26                                                                        #93 15.220873
      LE L2CAP: Enhanced Credit Connection Request (0x17) ident 1 len 18
        PSM: 39 (0x0027)
        MTU: 64
        MPS: 64
        Credits: 5
        Source CID: 84
        Source CID: 83
        Source CID: 82
        Source CID: 81
        Source CID: 80
zephyr.exe[1293335]: < HCI Command: LE Set Address Resolution Enable (0x08|0x002d) plen 1                           #94 15.237288
        Address resolution: Enabled (0x01)
> HCI Event: Command Complete (0x0e) plen 4                                                                         #95 15.237733
      LE Set Address Resolution Enable (0x08|0x002d) ncmd 1
        Status: Success (0x00)
zephyr.exe[1293335]: < HCI Command: Host Number of Completed Packets (0x03|0x0035) plen 5                           #96 15.257239
        Num handles: 1
        Handle: 669 Address: C0:07:E8:2C:B6:EE (OUI C0-07-E8)
        Count: 1
zephyr.exe[1293335]: < HCI Command: Host Number of Completed Packets (0x03|0x0035) plen 5                           #97 15.257314
        Num handles: 1
        Handle: 669 Address: C0:07:E8:2C:B6:EE (OUI C0-07-E8)
        Count: 1
zephyr.exe[1293335]: < HCI Command: Host Number of Completed Packets (0x03|0x0035) plen 5                           #98 15.257318
        Num handles: 1
        Handle: 669 Address: C0:07:E8:2C:B6:EE (OUI C0-07-E8)
        Count: 1
zephyr.exe[1293335]: < ACL Data TX: Handle 669 [1/3] flags 0x00 dlen 26                                             #99 15.257319
      LE L2CAP: Enhanced Credit Connection Response (0x18) ident 1 len 18
        MTU: 249
        MPS: 251
        Credits: 1
        Result: Connection successful (0x0000)
        Destination CID: 64
        Destination CID: 65
        Destination CID: 66
        Destination CID: 67
        Destination CID: 68
> HCI Event: Number of Completed Packets (0x13) plen 5                                                             #100 15.345132
        Num handles: 1
        Handle: 669 Address: C0:07:E8:2C:B6:EE (OUI C0-07-E8)
        Count: 1
        Buffers: 0/3
        #99: len 26 (2 Kb/s)
        Latency: 87 msec (8-117 msec ~70 msec)
zephyr.exe[1293335]: < ACL Data TX: Handle 669 [1/3] flags 0x00 dlen 11                                            #101 17.577371
      Channel: 80 len 7 sdu 5 [PSM 39 mode Enhanced Credit (0x81)] {chan 4}
      ATT: Find Information Request (0x04) len 4
        Handle range: 0x0023-0x0023
> HCI Event: Number of Completed Packets (0x13) plen 5                                                             #102 17.657723
        Num handles: 1
        Handle: 669 Address: C0:07:E8:2C:B6:EE (OUI C0-07-E8)
        Count: 1
        Buffers: 0/3
        #101: len 11 (1 Kb/s)
        Latency: 80 msec (8-117 msec ~75 msec)
        Channel: 80 [PSM 39 mode Enhanced Credit (0x81)] {chan 4}
        Channel Latency: 80 msec (80-80 msec ~80 msec)
> ACL Data RX: Handle 669 flags 0x02 dlen 12                                                                       #103 17.657989
      Channel: 68 len 8 sdu 6 [PSM 39 mode Enhanced Credit (0x81)] {chan 4}
      ATT: Find Information Response (0x05) len 5
        Format: UUID-16 (0x01)
        Handle: 0x0023
        UUID: Client Characteristic Configuration (0x2902)
zephyr.exe[1293335]: < HCI Command: Host Number of Completed Packets (0x03|0x0035) plen 5                          #104 17.677408
        Num handles: 1
        Handle: 669 Address: C0:07:E8:2C:B6:EE (OUI C0-07-E8)
        Count: 1
zephyr.exe[1293335]: < ACL Data TX: Handle 669 [1/3] flags 0x00 dlen 12                                            #105 17.677730
      LE L2CAP: LE Flow Control Credit (0x16) ident 2 len 4
        Source CID: 68
        Credits: 1
> HCI Event: Number of Completed Packets (0x13) plen 5                                                             #106 17.782649
        Num handles: 1
        Handle: 669 Address: C0:07:E8:2C:B6:EE (OUI C0-07-E8)
        Count: 1
        Buffers: 0/3
        #105: len 12 (0 Kb/s)
        Latency: 104 msec (8-117 msec ~90 msec)
        Channel: 80 [PSM 39 mode Enhanced Credit (0x81)] {chan 4}
        Channel Latency: 104 msec (80-104 msec ~92 msec)
> HCI Event: Disconnect Complete (0x05) plen 4                                                                     #107 20.282888
        Status: Success (0x00)
        Handle: 669 Address: C0:07:E8:2C:B6:EE (OUI C0-07-E8)
        Reason: Remote User Terminated Connection (0x13)
zephyr.exe[1293335]: < HCI Command: LE Set Extended Advertising Parameters (0x08|0x0036) plen 25                   #108 20.727316
        Handle: 0x00
        Properties: 0x0013
          Connectable
          Scannable
          Use legacy advertising PDUs: ADV_IND
        Min advertising interval: 100.000 msec (0x00a0)
        Max advertising interval: 150.000 msec (0x00f0)
        Channel map: 37, 38, 39 (0x07)
        Own address type: Random (0x01)
        Peer address type: Public (0x00)
        Peer address: 00:00:00:00:00:00 (OUI 00-00-00)
        Filter policy: Allow Scan Request from Any, Allow Connect Request from Any (0x00)
        TX power: Host has no preference (0x7f)
        Primary PHY: LE 1M (0x01)
        Secondary max skip: 0x00
        Secondary PHY: LE 1M (0x01)
        SID: 0x00
        Scan request notifications: Disabled (0x00)
> HCI Event: Command Complete (0x0e) plen 5                                                                        #109 20.728302
      LE Set Extended Advertising Parameters (0x08|0x0036) ncmd 1
        Status: Success (0x00)
        TX power (selected): 0 dbm (0x00)
zephyr.exe[1293335]: < HCI Command: LE Set Advertising Set Random Address (0x08|0x0035) plen 7                     #110 20.737366
        Advertising handle: 0x00
        Advertising random address: D5:B6:CC:31:DB:3B (Static)
> HCI Event: Command Complete (0x0e) plen 4                                                                        #111 20.737840
      LE Set Advertising Set Random Address (0x08|0x0035) ncmd 1
        Status: Success (0x00)
zephyr.exe[1293335]: < HCI Command: LE Set Extended Advertising Data (0x08|0x0037) plen 22                         #112 20.757304
        Handle: 0x00
        Operation: Complete extended advertising data (0x03)
        Fragment preference: Minimize fragmentation (0x01)
        Data length: 0x12
        Flags: 0x06
          LE General Discoverable Mode
          BR/EDR Not Supported
        Name (complete): Tester_2CB6EE
> HCI Event: Command Complete (0x0e) plen 4                                                                        #113 20.757907
      LE Set Extended Advertising Data (0x08|0x0037) ncmd 1
        Status: Success (0x00)
zephyr.exe[1293335]: < HCI Command: LE Set Extended Scan Response Data (0x08|0x0038) plen 4                        #114 20.777316
        Handle: 0x00
        Operation: Complete scan response data (0x03)
        Fragment preference: Minimize fragmentation (0x01)
        Data length: 0x00
> HCI Event: Command Complete (0x0e) plen 4                                                                        #115 20.777759
      LE Set Extended Scan Response Data (0x08|0x0038) ncmd 1
        Status: Success (0x00)
zephyr.exe[1293335]: < HCI Command: LE Set Extended Advertising Enable (0x08|0x0039) plen 6                        #116 20.797418
        Extended advertising: Enabled (0x01)
        Number of sets: 1 (0x01)
        Entry 0
          Handle: 0x00
          Duration: 0 ms (0x00)
          Max ext adv events: 0
> HCI Event: Command Complete (0x0e) plen 4                                                                        #117 20.798015
      LE Set Extended Advertising Enable (0x08|0x0039) ncmd 1
        Status: Success (0x00)
> HCI Event: LE Meta Event (0x3e) plen 31                                                                          #118 21.333167
      LE Enhanced Connection Complete (0x0a)
        Status: Success (0x00)
        Handle: 687
        Role: Peripheral (0x01)
        Peer address type: Public (0x00)
        Peer address: C0:07:E8:2C:B6:EE (OUI C0-07-E8)
        Local resolvable private address: 00:00:00:00:00:00 (Non-Resolvable)
        Peer resolvable private address: 00:00:00:00:00:00 (Non-Resolvable)
        Connection interval: 62.50 msec (0x0032)
        Connection latency: 0 (0x0000)
        Supervision timeout: 20000 msec (0x07d0)
        Central clock accuracy: 0x07
> HCI Event: LE Meta Event (0x3e) plen 6                                                                           #119 21.333471
      LE Advertising Set Terminated (0x12)
        Status: Success (0x00)
        Handle: 0
        Connection handle: 687
        Number of completed extended advertising events: 0
zephyr.exe[1293335]: < HCI Command: LE Read Remote Used Features (0x08|0x0016) plen 2                              #120 21.340029
        Handle: 687 Address: C0:07:E8:2C:B6:EE (OUI C0-07-E8)
> HCI Event: Command Status (0x0f) plen 4                                                                          #121 21.340502
      LE Read Remote Used Features (0x08|0x0016) ncmd 1
        Status: Success (0x00)
zephyr.exe[1293335]: < HCI Command: LE Set PHY (0x08|0x0032) plen 7                                                #122 21.357309
        Handle: 687 Address: C0:07:E8:2C:B6:EE (OUI C0-07-E8)
        All PHYs preference: 0x00
        TX PHYs preference: 0x02
          LE 2M
        RX PHYs preference: 0x02
          LE 2M
        PHY options preference: Reserved (0x0000)
> HCI Event: Command Status (0x0f) plen 4                                                                          #123 21.357818
      LE Set PHY (0x08|0x0032) ncmd 1
        Status: Success (0x00)
> HCI Event: LE Meta Event (0x3e) plen 12                                                                          #124 21.522036
      LE Read Remote Used Features (0x04)
        Status: Success (0x00)
        Handle: 687 Address: C0:07:E8:2C:B6:EE (OUI C0-07-E8)
        Features: 0x2d 0x49 0x01 0xf7 0xef 0x39 0x00 0x80
          LE Encryption
          Extended Reject Indication
          Peripheral-initiated Features Exchange
          LE Data Packet Length Extension
          LE 2M PHY
          LE Coded PHY
          Channel Selection Algorithm #2
          Minimum Number of Used Channels Procedure
          Periodic Advertising Sync Transfer - Sender
          Periodic Advertising Sync Transfer - Recipient
          Sleep Clock Accuracy Updates
          Connected Isochronous Stream - Central
          Connected Isochronous Stream - Peripheral
          Isochronous Broadcaster
          Synchronized Receiver
          Connected Isochronous Stream (Host Support)
          LE Power Control Request
          LE Power Control Request
          LE Path Loss Monitoring
          Connection Subrating
          Connection Subrating (Host Support)
          Channel Classification
          Unknown features (0x8000390000000000)
> HCI Event: LE Meta Event (0x3e) plen 6                                                                           #125 22.021329
      LE PHY Update Complete (0x0c)
        Status: Success (0x00)
        Handle: 687 Address: C0:07:E8:2C:B6:EE (OUI C0-07-E8)
        TX PHY: LE 2M (0x02)
        RX PHY: LE 2M (0x02)
zephyr.exe[1293335]: < ACL Data TX: Handle 687 [1/3] flags 0x00 dlen 16                                            #126 26.347476
      LE L2CAP: Connection Parameter Update Request (0x12) ident 3 len 8
        Min interval: 24
        Max interval: 40
        Peripheral latency: 0
        Timeout multiplier: 42
> HCI Event: Number of Completed Packets (0x13) plen 5                                                             #127 26.459273
        Num handles: 1
        Handle: 687 Address: C0:07:E8:2C:B6:EE (OUI C0-07-E8)
        Count: 1
        Buffers: 0/3
        #126: len 16 (1 Kb/s)
        Latency: 111 msec (111-111 msec ~111 msec)
> ACL Data RX: Handle 687 flags 0x02 dlen 10                                                                       #128 26.459456
      LE L2CAP: Connection Parameter Update Response (0x13) ident 3 len 2
        Result: Connection Parameters accepted (0x0000)
zephyr.exe[1293335]: < HCI Command: Host Number of Completed Packets (0x03|0x0035) plen 5                          #129 26.477460
        Num handles: 1
        Handle: 687 Address: C0:07:E8:2C:B6:EE (OUI C0-07-E8)
        Count: 1
> HCI Event: LE Meta Event (0x3e) plen 13                                                                          #130 29.084752
      LE Long Term Key Request (0x05)
        Handle: 687 Address: C0:07:E8:2C:B6:EE (OUI C0-07-E8)
        Random number: 0x84c81ed264dab3d8
        Encrypted diversifier: 0x825e
zephyr.exe[1293335]: < HCI Command: LE Long Term Key Request Reply (0x08|0x001a) plen 18                           #131 29.097535
        Handle: 687 Address: C0:07:E8:2C:B6:EE (OUI C0-07-E8)
        Long term key[16]: 5da095555cc64d02679f89a05211af56
> HCI Event: Command Complete (0x0e) plen 6                                                                        #132 29.098449
      LE Long Term Key Request Reply (0x08|0x001a) ncmd 1
        Status: Success (0x00)
        Handle: 687 Address: C0:07:E8:2C:B6:EE (OUI C0-07-E8)
> HCI Event: Encryption Change (0x08) plen 4                                                                       #133 29.396943
        Status: Success (0x00)
        Handle: 687 Address: C0:07:E8:2C:B6:EE (OUI C0-07-E8)
        Encryption: Enabled with AES-CCM (0x01)
> ACL Data RX: Handle 687 flags 0x02 dlen 26                                                                       #134 29.459587
      LE L2CAP: Enhanced Credit Connection Request (0x17) ident 2 len 18
        PSM: 39 (0x0027)
        MTU: 64
        MPS: 64
        Credits: 5
        Source CID: 84
        Source CID: 83
        Source CID: 82
        Source CID: 81
        Source CID: 80
zephyr.exe[1293335]: < HCI Command: Host Number of Completed Packets (0x03|0x0035) plen 5                          #135 29.477563
        Num handles: 1
        Handle: 687 Address: C0:07:E8:2C:B6:EE (OUI C0-07-E8)
        Count: 1
zephyr.exe[1293335]: < ACL Data TX: Handle 687 [1/3] flags 0x00 dlen 26                                            #136 29.477588
      LE L2CAP: Enhanced Credit Connection Response (0x18) ident 2 len 18
        MTU: 249
        MPS: 251
        Credits: 1
        Result: Connection successful (0x0000)
        Destination CID: 64
        Destination CID: 65
        Destination CID: 66
        Destination CID: 67
        Destination CID: 68
> HCI Event: Number of Completed Packets (0x13) plen 5                                                             #137 29.584234
        Num handles: 1
        Handle: 687 Address: C0:07:E8:2C:B6:EE (OUI C0-07-E8)
        Count: 1
        Buffers: 0/3
        #136: len 26 (1 Kb/s)
        Latency: 106 msec (106-111 msec ~109 msec)
zephyr.exe[1293335]: < ACL Data TX: Handle 687 [1/3] flags 0x00 dlen 11                                            #138 32.417602
      Channel: 80 len 7 sdu 5 [PSM 39 mode Enhanced Credit (0x81)] {chan 9}
      ATT: Find Information Request (0x04) len 4
        Handle range: 0x0023-0x0023
> HCI Event: Number of Completed Packets (0x13) plen 5                                                             #139 32.521847
        Num handles: 1
        Handle: 687 Address: C0:07:E8:2C:B6:EE (OUI C0-07-E8)
        Count: 1
        Buffers: 0/3
        #138: len 11 (0 Kb/s)
        Latency: 104 msec (104-111 msec ~106 msec)
        Channel: 80 [PSM 39 mode Enhanced Credit (0x81)] {chan 9}
        Channel Latency: 104 msec (104-104 msec ~104 msec)
> ACL Data RX: Handle 687 flags 0x02 dlen 12                                                                       #140 32.522093
      Channel: 68 len 8 sdu 6 [PSM 39 mode Enhanced Credit (0x81)] {chan 9}
      ATT: Find Information Response (0x05) len 5
        Format: UUID-16 (0x01)
        Handle: 0x0023
        UUID: Client Characteristic Configuration (0x2902)
zephyr.exe[1293335]: < HCI Command: Host Number of Completed Packets (0x03|0x0035) plen 5                          #141 32.537650
        Num handles: 1
        Handle: 687 Address: C0:07:E8:2C:B6:EE (OUI C0-07-E8)
        Count: 1
zephyr.exe[1293335]: < ACL Data TX: Handle 687 [1/3] flags 0x00 dlen 12                                            #142 32.537668
      LE L2CAP: LE Flow Control Credit (0x16) ident 4 len 4
        Source CID: 68
        Credits: 1
> HCI Event: Number of Completed Packets (0x13) plen 5                                                             #143 32.646775
        Num handles: 1
        Handle: 687 Address: C0:07:E8:2C:B6:EE (OUI C0-07-E8)
        Count: 1
        Buffers: 0/3
        #142: len 12 (0 Kb/s)
        Latency: 109 msec (104-111 msec ~107 msec)
        Channel: 80 [PSM 39 mode Enhanced Credit (0x81)] {chan 9}
        Channel Latency: 109 msec (104-109 msec ~106 msec)
> HCI Event: Disconnect Complete (0x05) plen 4                                                                     #144 35.022059
        Status: Success (0x00)
        Handle: 687 Address: C0:07:E8:2C:B6:EE (OUI C0-07-E8)
        Reason: Remote User Terminated Connection (0x13)
zephyr.exe[1293335]: < HCI Command: LE Set Extended Advertising Parameters (0x08|0x0036) plen 25                   #145 35.637646
        Handle: 0x00
        Properties: 0x0013
          Connectable
          Scannable
          Use legacy advertising PDUs: ADV_IND
        Min advertising interval: 100.000 msec (0x00a0)
        Max advertising interval: 150.000 msec (0x00f0)
        Channel map: 37, 38, 39 (0x07)
        Own address type: Random (0x01)
        Peer address type: Public (0x00)
        Peer address: 00:00:00:00:00:00 (OUI 00-00-00)
        Filter policy: Allow Scan Request from Any, Allow Connect Request from Any (0x00)
        TX power: Host has no preference (0x7f)
        Primary PHY: LE 1M (0x01)
        Secondary max skip: 0x00
        Secondary PHY: LE 1M (0x01)
        SID: 0x00
        Scan request notifications: Disabled (0x00)
> HCI Event: Command Complete (0x0e) plen 5                                                                        #146 35.638463
      LE Set Extended Advertising Parameters (0x08|0x0036) ncmd 1
        Status: Success (0x00)
        TX power (selected): 0 dbm (0x00)
zephyr.exe[1293335]: < HCI Command: LE Set Advertising Set Random Address (0x08|0x0035) plen 7                     #147 35.657607
        Advertising handle: 0x00
        Advertising random address: D5:B6:CC:31:DB:3B (Static)
> HCI Event: Command Complete (0x0e) plen 4                                                                        #148 35.658274
      LE Set Advertising Set Random Address (0x08|0x0035) ncmd 1
        Status: Success (0x00)
zephyr.exe[1293335]: < HCI Command: LE Set Extended Advertising Data (0x08|0x0037) plen 22                         #149 35.677613
        Handle: 0x00
        Operation: Complete extended advertising data (0x03)
        Fragment preference: Minimize fragmentation (0x01)
        Data length: 0x12
        Flags: 0x06
          LE General Discoverable Mode
          BR/EDR Not Supported
        Name (complete): Tester_2CB6EE
> HCI Event: Command Complete (0x0e) plen 4                                                                        #150 35.678285
      LE Set Extended Advertising Data (0x08|0x0037) ncmd 1
        Status: Success (0x00)
zephyr.exe[1293335]: < HCI Command: LE Set Extended Scan Response Data (0x08|0x0038) plen 4                        #151 35.697613
        Handle: 0x00
        Operation: Complete scan response data (0x03)
        Fragment preference: Minimize fragmentation (0x01)
        Data length: 0x00
> HCI Event: Command Complete (0x0e) plen 4                                                                        #152 35.698067
      LE Set Extended Scan Response Data (0x08|0x0038) ncmd 1
        Status: Success (0x00)
zephyr.exe[1293335]: < HCI Command: LE Set Extended Advertising Enable (0x08|0x0039) plen 6                        #153 35.717608
        Extended advertising: Enabled (0x01)
        Number of sets: 1 (0x01)
        Entry 0
          Handle: 0x00
          Duration: 0 ms (0x00)
          Max ext adv events: 0
> HCI Event: Command Complete (0x0e) plen 4                                                                        #154 35.718227
      LE Set Extended Advertising Enable (0x08|0x0039) ncmd 1
        Status: Success (0x00)
> HCI Event: LE Meta Event (0x3e) plen 31                                                                          #155 36.155820
      LE Enhanced Connection Complete (0x0a)
        Status: Success (0x00)
        Handle: 705
        Role: Peripheral (0x01)
        Peer address type: Public (0x00)
        Peer address: C0:07:E8:2C:B6:EE (OUI C0-07-E8)
        Local resolvable private address: 00:00:00:00:00:00 (Non-Resolvable)
        Peer resolvable private address: 00:00:00:00:00:00 (Non-Resolvable)
        Connection interval: 62.50 msec (0x0032)
        Connection latency: 0 (0x0000)
        Supervision timeout: 20000 msec (0x07d0)
        Central clock accuracy: 0x07
> HCI Event: LE Meta Event (0x3e) plen 6                                                                           #156 36.155873
      LE Advertising Set Terminated (0x12)
        Status: Success (0x00)
        Handle: 0
        Connection handle: 705
        Number of completed extended advertising events: 0
zephyr.exe[1293335]: < HCI Command: LE Read Remote Used Features (0x08|0x0016) plen 2                              #157 36.157681
        Handle: 705 Address: C0:07:E8:2C:B6:EE (OUI C0-07-E8)
> HCI Event: Command Status (0x0f) plen 4                                                                          #158 36.158060
      LE Read Remote Used Features (0x08|0x0016) ncmd 1
        Status: Success (0x00)
zephyr.exe[1293335]: < HCI Command: LE Set PHY (0x08|0x0032) plen 7                                                #159 36.177585
        Handle: 705 Address: C0:07:E8:2C:B6:EE (OUI C0-07-E8)
        All PHYs preference: 0x00
        TX PHYs preference: 0x02
          LE 2M
        RX PHYs preference: 0x02
          LE 2M
        PHY options preference: Reserved (0x0000)
> HCI Event: Command Status (0x0f) plen 4                                                                          #160 36.178303
      LE Set PHY (0x08|0x0032) ncmd 1
        Status: Success (0x00)
> HCI Event: LE Meta Event (0x3e) plen 12                                                                          #161 36.344769
      LE Read Remote Used Features (0x04)
        Status: Success (0x00)
        Handle: 705 Address: C0:07:E8:2C:B6:EE (OUI C0-07-E8)
        Features: 0x2d 0x49 0x01 0xf7 0xef 0x39 0x00 0x80
          LE Encryption
          Extended Reject Indication
          Peripheral-initiated Features Exchange
          LE Data Packet Length Extension
          LE 2M PHY
          LE Coded PHY
          Channel Selection Algorithm #2
          Minimum Number of Used Channels Procedure
          Periodic Advertising Sync Transfer - Sender
          Periodic Advertising Sync Transfer - Recipient
          Sleep Clock Accuracy Updates
          Connected Isochronous Stream - Central
          Connected Isochronous Stream - Peripheral
          Isochronous Broadcaster
          Synchronized Receiver
          Connected Isochronous Stream (Host Support)
          LE Power Control Request
          LE Power Control Request
          LE Path Loss Monitoring
          Connection Subrating
          Connection Subrating (Host Support)
          Channel Classification
          Unknown features (0x8000390000000000)
> HCI Event: LE Meta Event (0x3e) plen 6                                                                           #162 36.843958
      LE PHY Update Complete (0x0c)
        Status: Success (0x00)
        Handle: 705 Address: C0:07:E8:2C:B6:EE (OUI C0-07-E8)
        TX PHY: LE 2M (0x02)
        RX PHY: LE 2M (0x02)
zephyr.exe[1293335]: < ACL Data TX: Handle 705 [1/3] flags 0x00 dlen 16                                            #163 41.167894
      LE L2CAP: Connection Parameter Update Request (0x12) ident 5 len 8
        Min interval: 24
        Max interval: 40
        Peripheral latency: 0
        Timeout multiplier: 42
> HCI Event: Number of Completed Packets (0x13) plen 5                                                             #164 41.281852
        Num handles: 1
        Handle: 705 Address: C0:07:E8:2C:B6:EE (OUI C0-07-E8)
        Count: 1
        Buffers: 0/3
        #163: len 16 (1 Kb/s)
        Latency: 113 msec (113-113 msec ~113 msec)
> ACL Data RX: Handle 705 flags 0x02 dlen 10                                                                       #165 41.281995
      LE L2CAP: Connection Parameter Update Response (0x13) ident 5 len 2
        Result: Connection Parameters accepted (0x0000)
zephyr.exe[1293335]: < HCI Command: Host Number of Completed Packets (0x03|0x0035) plen 5                          #166 41.297773
        Num handles: 1
        Handle: 705 Address: C0:07:E8:2C:B6:EE (OUI C0-07-E8)
        Count: 1
> HCI Event: LE Meta Event (0x3e) plen 13                                                                          #167 43.907294
      LE Long Term Key Request (0x05)
        Handle: 705 Address: C0:07:E8:2C:B6:EE (OUI C0-07-E8)
        Random number: 0x84c81ed264dab3d8
        Encrypted diversifier: 0x825e
zephyr.exe[1293335]: < HCI Command: LE Long Term Key Request Reply (0x08|0x001a) plen 18                           #168 43.917762
        Handle: 705 Address: C0:07:E8:2C:B6:EE (OUI C0-07-E8)
        Long term key[16]: 5da095555cc64d02679f89a05211af56
> HCI Event: Command Complete (0x0e) plen 6                                                                        #169 43.918453
      LE Long Term Key Request Reply (0x08|0x001a) ncmd 1
        Status: Success (0x00)
        Handle: 705 Address: C0:07:E8:2C:B6:EE (OUI C0-07-E8)
> HCI Event: Encryption Change (0x08) plen 4                                                                       #170 44.219561
        Status: Success (0x00)
        Handle: 705 Address: C0:07:E8:2C:B6:EE (OUI C0-07-E8)
        Encryption: Enabled with AES-CCM (0x01)
> ACL Data RX: Handle 705 flags 0x02 dlen 26                                                                       #171 44.282172
      LE L2CAP: Enhanced Credit Connection Request (0x17) ident 3 len 18
        PSM: 39 (0x0027)
        MTU: 64
        MPS: 64
        Credits: 5
        Source CID: 84
        Source CID: 83
        Source CID: 82
        Source CID: 81
        Source CID: 80
zephyr.exe[1293335]: < HCI Command: Host Number of Completed Packets (0x03|0x0035) plen 5                          #172 44.297799
        Num handles: 1
        Handle: 705 Address: C0:07:E8:2C:B6:EE (OUI C0-07-E8)
        Count: 1
zephyr.exe[1293335]: < ACL Data TX: Handle 705 [1/3] flags 0x00 dlen 26                                            #173 44.297988
      LE L2CAP: Enhanced Credit Connection Response (0x18) ident 3 len 18
        MTU: 249
        MPS: 251
        Credits: 1
        Result: Connection successful (0x0000)
        Destination CID: 64
        Destination CID: 65
        Destination CID: 66
        Destination CID: 67
        Destination CID: 68
> HCI Event: Number of Completed Packets (0x13) plen 5                                                             #174 44.406910
        Num handles: 1
        Handle: 705 Address: C0:07:E8:2C:B6:EE (OUI C0-07-E8)
        Count: 1
        Buffers: 0/3
        #173: len 26 (1 Kb/s)
        Latency: 108 msec (108-113 msec ~111 msec)
zephyr.exe[1293335]: < ACL Data TX: Handle 705 [1/3] flags 0x00 dlen 11                                            #175 47.327931
      Channel: 80 len 7 sdu 5 [PSM 39 mode Enhanced Credit (0x81)] {chan 14}
      ATT: Find Information Request (0x04) len 4
        Handle range: 0x0033-0x0033
> HCI Event: Number of Completed Packets (0x13) plen 5                                                             #176 47.406989
        Num handles: 1
        Handle: 705 Address: C0:07:E8:2C:B6:EE (OUI C0-07-E8)
        Count: 1
        Buffers: 0/3
        #175: len 11 (1 Kb/s)
        Latency: 79 msec (79-113 msec ~95 msec)
        Channel: 80 [PSM 39 mode Enhanced Credit (0x81)] {chan 14}
        Channel Latency: 79 msec (79-79 msec ~79 msec)
> ACL Data RX: Handle 705 flags 0x02 dlen 12                                                                       #177 47.407141
      Channel: 68 len 8 sdu 6 [PSM 39 mode Enhanced Credit (0x81)] {chan 14}
      ATT: Find Information Response (0x05) len 5
        Format: UUID-16 (0x01)
        Handle: 0x0033
        UUID: Client Characteristic Configuration (0x2902)
zephyr.exe[1293335]: < HCI Command: Host Number of Completed Packets (0x03|0x0035) plen 5                          #178 47.417897
        Num handles: 1
        Handle: 705 Address: C0:07:E8:2C:B6:EE (OUI C0-07-E8)
        Count: 1
zephyr.exe[1293335]: < ACL Data TX: Handle 705 [1/3] flags 0x00 dlen 12                                            #179 47.417925
      LE L2CAP: LE Flow Control Credit (0x16) ident 6 len 4
        Source CID: 68
        Credits: 1
> HCI Event: Number of Completed Packets (0x13) plen 5                                                             #180 47.531890
        Num handles: 1
        Handle: 705 Address: C0:07:E8:2C:B6:EE (OUI C0-07-E8)
        Count: 1
        Buffers: 0/3
        #179: len 12 (0 Kb/s)
        Latency: 113 msec (79-113 msec ~104 msec)
        Channel: 80 [PSM 39 mode Enhanced Credit (0x81)] {chan 14}
        Channel Latency: 113 msec (79-113 msec ~96 msec)
> HCI Event: Disconnect Complete (0x05) plen 4                                                                     #181 49.969555
        Status: Success (0x00)
        Handle: 705 Address: C0:07:E8:2C:B6:EE (OUI C0-07-E8)
        Reason: Remote User Terminated Connection (0x13)
zephyr.exe[1293335]: < HCI Command: LE Set Extended Advertising Parameters (0x08|0x0036) plen 25                   #182 50.467865
        Handle: 0x00
        Properties: 0x0013
          Connectable
          Scannable
          Use legacy advertising PDUs: ADV_IND
        Min advertising interval: 100.000 msec (0x00a0)
        Max advertising interval: 150.000 msec (0x00f0)
        Channel map: 37, 38, 39 (0x07)
        Own address type: Random (0x01)
        Peer address type: Public (0x00)
        Peer address: 00:00:00:00:00:00 (OUI 00-00-00)
        Filter policy: Allow Scan Request from Any, Allow Connect Request from Any (0x00)
        TX power: Host has no preference (0x7f)
        Primary PHY: LE 1M (0x01)
        Secondary max skip: 0x00
        Secondary PHY: LE 1M (0x01)
        SID: 0x00
        Scan request notifications: Disabled (0x00)
> HCI Event: Command Complete (0x0e) plen 5                                                                        #183 50.468735
      LE Set Extended Advertising Parameters (0x08|0x0036) ncmd 1
        Status: Success (0x00)
        TX power (selected): 0 dbm (0x00)
zephyr.exe[1293335]: < HCI Command: LE Set Advertising Set Random Address (0x08|0x0035) plen 7                     #184 50.477862
        Advertising handle: 0x00
        Advertising random address: D5:B6:CC:31:DB:3B (Static)
> HCI Event: Command Complete (0x0e) plen 4                                                                        #185 50.478460
      LE Set Advertising Set Random Address (0x08|0x0035) ncmd 1
        Status: Success (0x00)
zephyr.exe[1293335]: < HCI Command: LE Set Extended Advertising Data (0x08|0x0037) plen 22                         #186 50.497859
        Handle: 0x00
        Operation: Complete extended advertising data (0x03)
        Fragment preference: Minimize fragmentation (0x01)
        Data length: 0x12
        Flags: 0x06
          LE General Discoverable Mode
          BR/EDR Not Supported
        Name (complete): Tester_2CB6EE
> HCI Event: Command Complete (0x0e) plen 4                                                                        #187 50.498538
      LE Set Extended Advertising Data (0x08|0x0037) ncmd 1
        Status: Success (0x00)
zephyr.exe[1293335]: < HCI Command: LE Set Extended Scan Response Data (0x08|0x0038) plen 4                        #188 50.517857
        Handle: 0x00
        Operation: Complete scan response data (0x03)
        Fragment preference: Minimize fragmentation (0x01)
        Data length: 0x00
> HCI Event: Command Complete (0x0e) plen 4                                                                        #189 50.518339
      LE Set Extended Scan Response Data (0x08|0x0038) ncmd 1
        Status: Success (0x00)
zephyr.exe[1293335]: < HCI Command: LE Set Extended Advertising Enable (0x08|0x0039) plen 6                        #190 50.537855
        Extended advertising: Enabled (0x01)
        Number of sets: 1 (0x01)
        Entry 0
          Handle: 0x00
          Duration: 0 ms (0x00)
          Max ext adv events: 0
> HCI Event: Command Complete (0x0e) plen 4                                                                        #191 50.538399
      LE Set Extended Advertising Enable (0x08|0x0039) ncmd 1
        Status: Success (0x00)
> HCI Event: LE Meta Event (0x3e) plen 31                                                                          #192 50.961662
      LE Enhanced Connection Complete (0x0a)
        Status: Success (0x00)
        Handle: 723
        Role: Peripheral (0x01)
        Peer address type: Public (0x00)
        Peer address: C0:07:E8:2C:B6:EE (OUI C0-07-E8)
        Local resolvable private address: 00:00:00:00:00:00 (Non-Resolvable)
        Peer resolvable private address: 00:00:00:00:00:00 (Non-Resolvable)
        Connection interval: 62.50 msec (0x0032)
        Connection latency: 0 (0x0000)
        Supervision timeout: 20000 msec (0x07d0)
        Central clock accuracy: 0x07
> HCI Event: LE Meta Event (0x3e) plen 6                                                                           #193 50.961754
      LE Advertising Set Terminated (0x12)
        Status: Success (0x00)
        Handle: 0
        Connection handle: 723
        Number of completed extended advertising events: 0
zephyr.exe[1293335]: < HCI Command: LE Read Remote Used Features (0x08|0x0016) plen 2                              #194 50.977946
        Handle: 723 Address: C0:07:E8:2C:B6:EE (OUI C0-07-E8)
> HCI Event: Command Status (0x0f) plen 4                                                                          #195 50.978325
      LE Read Remote Used Features (0x08|0x0016) ncmd 1
        Status: Success (0x00)
zephyr.exe[1293335]: < HCI Command: LE Set PHY (0x08|0x0032) plen 7                                                #196 50.997825
        Handle: 723 Address: C0:07:E8:2C:B6:EE (OUI C0-07-E8)
        All PHYs preference: 0x00
        TX PHYs preference: 0x02
          LE 2M
        RX PHYs preference: 0x02
          LE 2M
        PHY options preference: Reserved (0x0000)
> HCI Event: Command Status (0x0f) plen 4                                                                          #197 50.998439
      LE Set PHY (0x08|0x0032) ncmd 1
        Status: Success (0x00)
> HCI Event: LE Meta Event (0x3e) plen 12                                                                          #198 51.150601
      LE Read Remote Used Features (0x04)
        Status: Success (0x00)
        Handle: 723 Address: C0:07:E8:2C:B6:EE (OUI C0-07-E8)
        Features: 0x2d 0x49 0x01 0xf7 0xef 0x39 0x00 0x80
          LE Encryption
          Extended Reject Indication
          Peripheral-initiated Features Exchange
          LE Data Packet Length Extension
          LE 2M PHY
          LE Coded PHY
          Channel Selection Algorithm #2
          Minimum Number of Used Channels Procedure
          Periodic Advertising Sync Transfer - Sender
          Periodic Advertising Sync Transfer - Recipient
          Sleep Clock Accuracy Updates
          Connected Isochronous Stream - Central
          Connected Isochronous Stream - Peripheral
          Isochronous Broadcaster
          Synchronized Receiver
          Connected Isochronous Stream (Host Support)
          LE Power Control Request
          LE Power Control Request
          LE Path Loss Monitoring
          Connection Subrating
          Connection Subrating (Host Support)
          Channel Classification
          Unknown features (0x8000390000000000)
> HCI Event: LE Meta Event (0x3e) plen 6                                                                           #199 51.649817
      LE PHY Update Complete (0x0c)
        Status: Success (0x00)
        Handle: 723 Address: C0:07:E8:2C:B6:EE (OUI C0-07-E8)
        TX PHY: LE 2M (0x02)
        RX PHY: LE 2M (0x02)
zephyr.exe[1293335]: < ACL