Bluetooth monitor ver 5.72
= Note: Linux version 6.14.0-36-generic (x86_64)                       0.199163
= Note: Bluetooth subsystem version 2.22                               0.199165
= New Index: 00:00:00:00:00:00 (Primary,UART,hci1)              [hci1] 0.199166
= New Index: 48:5F:99:8E:E0:64 (Primary,USB,hci0)               [hci0] 0.199166
= Open Index: 00:00:00:00:00:00                                 [hci1] 0.312912
= Index Info: 00:00:00:00:00:00 (Nordic Semiconductor ASA)      [hci1] 0.312925
@ USER Open: main (privileged) version 2.22            {0x0001} [hci1] 0.312933
< HCI Command: Reset (0x03|0x0003) plen 0                    #1 [hci1] 0.314166
> HCI Event: Command Complete (0x0e) plen 4                  #2 [hci1] 0.314775
      Reset (0x03|0x0003) ncmd 1
        Status: Success (0x00)
< HCI Command: Read Local Supported... (0x04|0x0003) plen 0  #3 [hci1] 0.332718
> HCI Event: Command Complete (0x0e) plen 12                 #4 [hci1] 0.333247
      Read Local Supported Features (0x04|0x0003) ncmd 1
        Status: Success (0x00)
        Features: 0x00 0x00 0x00 0x00 0x60 0x00 0x00 0x00
          BR/EDR Not Supported
          LE Supported (Controller)
< HCI Command: Read Local Version In.. (0x04|0x0001) plen 0  #5 [hci1] 0.352351
> HCI Event: Command Complete (0x0e) plen 12                 #6 [hci1] 0.352872
      Read Local Version Information (0x04|0x0001) ncmd 1
        Status: Success (0x00)
        HCI version: Reserved (0x0f) - Revision 12393 (0x3069)
        LMP version: Reserved (0x0f) - Subversion 12393 (0x3069)
        Manufacturer: Nordic Semiconductor ASA (89)
< HCI Command: Read Local Supported... (0x04|0x0002) plen 0  #7 [hci1] 0.372315
> HCI Event: Command Complete (0x0e) plen 68                 #8 [hci1] 0.373436
      Read Local Supported Commands (0x04|0x0002) ncmd 1
        Status: Success (0x00)
        Commands: 119 entries
          Disconnect (Octet 0 - Bit 5)
          Read Remote Version Information (Octet 2 - Bit 7)
          Set Event Mask (Octet 5 - Bit 6)
          Reset (Octet 5 - Bit 7)
          Read Connection Accept Timeout (Octet 7 - Bit 2)
          Write Connection Accept Timeout (Octet 7 - Bit 3)
          Read Transmit Power Level (Octet 10 - Bit 2)
          Set Controller To Host Flow Control (Octet 10 - Bit 5)
          Host Buffer Size (Octet 10 - Bit 6)
          Host Number of Completed Packets (Octet 10 - Bit 7)
          Read Local Version Information (Octet 14 - Bit 3)
          Read Local Supported Features (Octet 14 - Bit 5)
          Read BD ADDR (Octet 15 - Bit 1)
          Read RSSI (Octet 15 - Bit 5)
          Set Event Mask Page 2 (Octet 22 - Bit 2)
          LE Set Event Mask (Octet 25 - Bit 0)
          LE Read Buffer Size (Octet 25 - Bit 1)
          LE Read Local Supported Features (Octet 25 - Bit 2)
          LE Set Random Address (Octet 25 - Bit 4)
          LE Set Advertising Parameters (Octet 25 - Bit 5)
          LE Read Advertising Channel TX Power (Octet 25 - Bit 6)
          LE Set Advertising Data (Octet 25 - Bit 7)
          LE Set Scan Response Data (Octet 26 - Bit 0)
          LE Set Advertise Enable (Octet 26 - Bit 1)
          LE Set Scan Parameters (Octet 26 - Bit 2)
          LE Set Scan Enable (Octet 26 - Bit 3)
          LE Create Connection (Octet 26 - Bit 4)
          LE Create Connection Cancel (Octet 26 - Bit 5)
          LE Read Accept List Size (Octet 26 - Bit 6)
          LE Clear Accept List (Octet 26 - Bit 7)
          LE Add Device To Accept List (Octet 27 - Bit 0)
          LE Remove Device From Accept List (Octet 27 - Bit 1)
          LE Connection Update (Octet 27 - Bit 2)
          LE Set Host Channel Classification (Octet 27 - Bit 3)
          LE Read Channel Map (Octet 27 - Bit 4)
          LE Read Remote Used Features (Octet 27 - Bit 5)
          LE Encrypt (Octet 27 - Bit 6)
          LE Rand (Octet 27 - Bit 7)
          LE Start Encryption (Octet 28 - Bit 0)
          LE Long Term Key Request Reply (Octet 28 - Bit 1)
          LE Long Term Key Request Neg Reply (Octet 28 - Bit 2)
          LE Read Supported States (Octet 28 - Bit 3)
          LE Receiver Test (Octet 28 - Bit 4)
          LE Transmitter Test (Octet 28 - Bit 5)
          LE Test End (Octet 28 - Bit 6)
          Read Authenticated Payload Timeout (Octet 32 - Bit 4)
          Write Authenticated Payload Timeout (Octet 32 - Bit 5)
          LE Set Data Length (Octet 33 - Bit 6)
          LE Read Suggested Default Data Length (Octet 33 - Bit 7)
          LE Write Suggested Default Data Length (Octet 34 - Bit 0)
          LE Add Device To Resolving List (Octet 34 - Bit 3)
          LE Remove Device From Resolving List (Octet 34 - Bit 4)
          LE Clear Resolving List (Octet 34 - Bit 5)
          LE Read Resolving List Size (Octet 34 - Bit 6)
          LE Set Address Resolution Enable (Octet 35 - Bit 1)
          LE Set Resolvable Private Address Timeout (Octet 35 - Bit 2)
          LE Read Maximum Data Length (Octet 35 - Bit 3)
          LE Read PHY (Octet 35 - Bit 4)
          LE Set Default PHY (Octet 35 - Bit 5)
          LE Set PHY (Octet 35 - Bit 6)
          LE Enhanced Receiver Test (Octet 35 - Bit 7)
          LE Enhanced Transmitter Test (Octet 36 - Bit 0)
          LE Set Advertising Set Random Address (Octet 36 - Bit 1)
          LE Set Extended Advertising Parameters (Octet 36 - Bit 2)
          LE Set Extended Advertising Data (Octet 36 - Bit 3)
          LE Set Extended Scan Response Data (Octet 36 - Bit 4)
          LE Set Extended Advertising Enable (Octet 36 - Bit 5)
          LE Read Maximum Advertising Data Length (Octet 36 - Bit 6)
          LE Read Number of Supported Advertising Sets (Octet 36 - Bit 7)
          LE Remove Advertising Set (Octet 37 - Bit 0)
          LE Clear Advertising Sets (Octet 37 - Bit 1)
          LE Set Periodic Advertising Parameters (Octet 37 - Bit 2)
          LE Set Periodic Advertising Data (Octet 37 - Bit 3)
          LE Set Periodic Advertising Enable (Octet 37 - Bit 4)
          LE Set Extended Scan Parameters (Octet 37 - Bit 5)
          LE Set Extended Scan Enable (Octet 37 - Bit 6)
          LE Extended Create Connection (Octet 37 - Bit 7)
          LE Periodic Advertising Create Sync (Octet 38 - Bit 0)
          LE Periodic Advertising Create Sync Cancel (Octet 38 - Bit 1)
          LE Periodic Advertising Terminate Sync (Octet 38 - Bit 2)
          LE Add Device To Periodic Advertiser List (Octet 38 - Bit 3)
          LE Remove Device From Periodic Advertiser List (Octet 38 - Bit 4)
          LE Clear Periodic Advertiser List (Octet 38 - Bit 5)
          LE Read Periodic Advertiser List Size (Octet 38 - Bit 6)
          LE Read Transmit Power (Octet 38 - Bit 7)
          LE Read RF Path Compensation (Octet 39 - Bit 0)
          LE Write RF Path Compensation (Octet 39 - Bit 1)
          LE Set Privacy Mode (Octet 39 - Bit 2)
          LE Periodic Advertising Receive Enable (Octet 40 - Bit 5)
          LE Periodic Advertising Sync Transfer (Octet 40 - Bit 6)
          LE Periodic Advertising Set Info Transfer (Octet 40 - Bit 7)
          LE Periodic Advertising Sync Transfer Parameters (Octet 41 - Bit 0)
          LE Set Default Periodic Advertisng Sync Transfer Parameters (Octet 41 - Bit 1)
          LE Read Buffer v2 (Octet 41 - Bit 5)
          LE Read ISO TX Sync (Octet 41 - Bit 6)
          LE Set Connected Isochronous Group Parameters (Octet 41 - Bit 7)
          LE Set Connected Isochronous Group Parameters Test (Octet 42 - Bit 0)
          LE Create Connected Isochronous Stream (Octet 42 - Bit 1)
          LE Remove Connected Isochronous Group (Octet 42 - Bit 2)
          LE Accept Connected Isochronous Stream Request (Octet 42 - Bit 3)
          LE Reject Connected Isochronous Stream Request (Octet 42 - Bit 4)
          LE Create Broadcast Isochronous Group (Octet 42 - Bit 5)
          LE Create Broadcast Isochronous Group Test (Octet 42 - Bit 6)
          LE Terminate Broadcast Isochronous Group (Octet 42 - Bit 7)
          LE Broadcast Isochronous Group Create Sync (Octet 43 - Bit 0)
          LE Broadcast Isochronous Group Terminate Sync (Octet 43 - Bit 1)
          LE Request Peer SCA (Octet 43 - Bit 2)
          LE Setup Isochronous Data Path (Octet 43 - Bit 3)
          LE Remove Isochronous Data Path (Octet 43 - Bit 4)
          LE Isochronous Transmit Test (Octet 43 - Bit 5)
          LE Isochronous Receive Test (Octet 43 - Bit 6)
          LE Isochronous Read Test Counters (Octet 43 - Bit 7)
          LE Isochronous Read Test Counters (Octet 44 - Bit 0)
          LE Set Host Feature (Octet 44 - Bit 1)
          Octet 44 - Bit 2 
          Octet 45 - Bit 6 
          Octet 46 - Bit 0 
          Octet 46 - Bit 1 
          Octet 46 - Bit 2 
< HCI Command: Host Buffer Size (0x03|0x0033) plen 7         #9 [hci1] 0.392313
        ACL MTU: 255  ACL max packet: 16
        SCO MTU: 0    SCO max packet: 0
> HCI Event: Command Complete (0x0e) plen 4                 #10 [hci1] 0.392819
      Host Buffer Size (0x03|0x0033) ncmd 1
        Status: Success (0x00)
< HCI Command: Set Controller To Ho.. (0x03|0x0031) plen 1  #11 [hci1] 0.412321
        Flow control: ACL Data Packets (0x01)
> HCI Event: Command Complete (0x0e) plen 4                 #12 [hci1] 0.412783
      Set Controller To Host Flow Control (0x03|0x0031) ncmd 1
        Status: Success (0x00)
< HCI Command: LE Read Local Suppor.. (0x08|0x0003) plen 0  #13 [hci1] 0.432283
> HCI Event: Command Complete (0x0e) plen 12                #14 [hci1] 0.432797
      LE Read Local Supported Features (0x08|0x0003) ncmd 1
        Status: Success (0x00)
        Features: 0xfd 0x79 0x00 0xf7 0x30 0x01 0x00 0x00
          LE Encryption
          Extended Reject Indication
          Peripheral-initiated Features Exchange
          LE Ping
          LE Data Packet Length Extension
          LL Privacy
          Extended Scanner Filter Policies
          LE 2M PHY
          LE Coded PHY
          LE Extended Advertising
          LE Periodic Advertising
          Channel Selection Algorithm #2
          Periodic Advertising Sync Transfer - Sender
          Periodic Advertising Sync Transfer - Recipient
          Sleep Clock Accuracy Updates
          Connected Isochronous Stream - Central
          Connected Isochronous Stream - Peripheral
          Isochronous Broadcaster
          Synchronized Receiver
          Periodic Advertising ADI support
          Connection Subrating
          Unknown features (0x0000010000000000)
< HCI Command: LE Set Host Feature (0x08|0x0074) plen 2     #15 [hci1] 0.452290
        Bit Number: 32
          Connected Isochronous Stream (Host Support)
        Bit Value: 1
> HCI Event: Command Complete (0x0e) plen 4                 #16 [hci1] 0.452782
      LE Set Host Feature (0x08|0x0074) ncmd 1
        Status: Success (0x00)
< HCI Command: LE Read Buffer v2 (0x08|0x0060) plen 0       #17 [hci1] 0.472303
> HCI Event: Command Complete (0x0e) plen 10                #18 [hci1] 0.472764
      LE Read Buffer v2 (0x08|0x0060) ncmd 1
        Status: Success (0x00)
        ACL MTU: 27
        ACL max packet: 3
        ISO MTU: 318
        ISO max packet: 3
< HCI Command: LE Read Maximum Adve.. (0x08|0x003a) plen 0  #19 [hci1] 0.492343
> HCI Event: Command Complete (0x0e) plen 6                 #20 [hci1] 0.492729
      LE Read Maximum Advertising Data Length (0x08|0x003a) ncmd 1
        Status: Success (0x00)
        Max length: 1650
< HCI Command: LE Read Supported St.. (0x08|0x001c) plen 0  #21 [hci1] 0.512313
> HCI Event: Command Complete (0x0e) plen 12                #22 [hci1] 0.512804
      LE Read Supported States (0x08|0x001c) ncmd 1
        Status: Success (0x00)
        States: 0x000003ff3e0306ff
          Non-connectable Advertising State
          Scannable Advertising State
          Connectable Advertising State
          High Duty Cycle Directed Advertising State
          Passive Scanning State
          Active Scanning State
          Initiating State
            and Connection State (Central Role)
          Connection State (Peripheral Role)
          Scannable Advertising State
            and Passive Scanning State
          Connectable Advertising State
            and Passive Scanning State
          Non-connectable Advertising State
            and Initiating State
          Scannable Advertising State
            and Initiating State
          Active Scanning State
            and Connection State (Central Role)
          Passive Scanning State
            and Connection State (Peripheral Role)
          Active Scanning State
            and Connection State (Peripheral Role)
          Initiating State
            and Connection State (Central Role)
            and Central Role & Central Role
          Low Duty Cycle Directed Advertising State
          Connectable Advertising State
            and Initiating State
            and Central Role & Peripheral Role
          High Duty Cycle Directed Advertising State
            and Initiating State
            and Central Role & Peripheral Role
          Low Duty Cycle Directed Advertising State
            and Initiating State
            and Central Role & Peripheral Role
          Connectable Advertising State
            and Connection State (Central Role)
            and Central Role & Peripheral Role
          High Duty Cycle Directed Advertising State
            and Connection State (Central Role)
            and Central Role & Peripheral Role
          Low Duty Cycle Directed Advertising State
            and Connection State (Central Role)
            and Central Role & Peripheral Role
          Connectable Advertising State
            and Connection State (Peripheral Role)
            and Central Role & Peripheral Role
          High Duty Cycle Directed Advertising State
            and Connection State (Peripheral Role)
            and Peripheral Role & Peripheral Role
          Low Duty Cycle Directed Advertising State
            and Connection State (Peripheral Role)
            and Peripheral Role & Peripheral Role
          Initiating State
            and Connection State (Peripheral Role)
            and Central Role & Peripheral Role
< HCI Command: LE Read Maximum Data.. (0x08|0x002f) plen 0  #23 [hci1] 0.532311
> HCI Event: Command Complete (0x0e) plen 12                #24 [hci1] 0.532818
      LE Read Maximum Data Length (0x08|0x002f) ncmd 1
        Status: Success (0x00)
        Max TX octets: 251
        Max TX time: 2704
        Max RX octets: 251
        Max RX time: 2704
< HCI Command: LE Write Suggested D.. (0x08|0x0024) plen 4  #25 [hci1] 0.552317
        TX octets: 251
        TX time: 2704
> HCI Event: Command Complete (0x0e) plen 4                 #26 [hci1] 0.552777
      LE Write Suggested Default Data Length (0x08|0x0024) ncmd 1
        Status: Success (0x00)
< HCI Command: LE Read Resolving Li.. (0x08|0x002a) plen 0  #27 [hci1] 0.572324
> HCI Event: Command Complete (0x0e) plen 5                 #28 [hci1] 0.572704
      LE Read Resolving List Size (0x08|0x002a) ncmd 1
        Status: Success (0x00)
        Size: 8
< HCI Command: LE Set Event Mask (0x08|0x0001) plen 8       #29 [hci1] 0.592304
        Mask: 0x000002023f87fa5e
          LE Advertising Report
          LE Connection Update Complete
          LE Read Remote Used Features Complete
          LE Long Term Key Request
          LE Data Length Change
          LE Enhanced Connection Complete
          LE PHY Update Complete
          LE Extended Advertising Report
          LE Periodic Advertising Sync Established
          LE Periodic Advertising Report
          LE Periodic Advertising Sync Lost
          LE Extended Scan Timeout
          LE Extended Advertising Set Terminated
          LE Scan Request Received
          LE Periodic Advertising Sync Transfer Rvc
          LE CIS Established
          LE CIS Request
          LE Create BIG Complete
          LE Terminate BIG Complete
          LE BIG Sync Estabilished Complete
          LE BIG Sync Lost
          LE BIG Info Advertising Report
          Unknown mask (0x0000020000000000)
> HCI Event: Command Complete (0x0e) plen 4                 #30 [hci1] 0.592804
      LE Set Event Mask (0x08|0x0001) ncmd 1
        Status: Success (0x00)
< HCI Command: Set Event Mask (0x03|0x0001) plen 8          #31 [hci1] 0.612318
        Mask: 0x2000800002008890
          Disconnection Complete
          Encryption Change
          Read Remote Version Information Complete
          Hardware Error
          Data Buffer Overflow
          Encryption Key Refresh Complete
          LE Meta
> HCI Event: Command Complete (0x0e) plen 4                 #32 [hci1] 0.612828
      Set Event Mask (0x03|0x0001) ncmd 1
        Status: Success (0x00)
< HCI Command: Read BD ADDR (0x04|0x0009) plen 0            #33 [hci1] 0.632320
> HCI Event: Command Complete (0x0e) plen 10                #34 [hci1] 0.632774
      Read BD ADDR (0x04|0x0009) ncmd 1
        Status: Success (0x00)
        Address: 00:00:00:00:00:00 (OUI 00-00-00)
< HCI Command: LE Set Random Address (0x08|0x0005) plen 6   #35 [hci1] 0.652328
        Address: D5:B6:CC:31:DB:3B (Static)
> HCI Event: Command Complete (0x0e) plen 4                 #36 [hci1] 0.652850
      LE Set Random Address (0x08|0x0005) ncmd 1
        Status: Success (0x00)
< HCI Command: LE Set Extended Adv.. (0x08|0x0036) plen 25  #37 [hci1] 3.222356
        Handle: 0x00
        Properties: 0x0013
          Connectable
          Scannable
          Use legacy advertising PDUs: ADV_IND
        Min advertising interval: 100.000 msec (0x00a0)
        Max advertising interval: 150.000 msec (0x00f0)
        Channel map: 37, 38, 39 (0x07)
        Own address type: Random (0x01)
        Peer address type: Public (0x00)
        Peer address: 00:00:00:00:00:00 (OUI 00-00-00)
        Filter policy: Allow Scan Request from Any, Allow Connect Request from Any (0x00)
        TX power: Host has no preference (0x7f)
        Primary PHY: LE 1M (0x01)
        Secondary max skip: 0x00
        Secondary PHY: LE 1M (0x01)
        SID: 0x00
        Scan request notifications: Disabled (0x00)
> HCI Event: Command Complete (0x0e) plen 5                 #38 [hci1] 3.223126
      LE Set Extended Advertising Parameters (0x08|0x0036) ncmd 1
        Status: Success (0x00)
        TX power (selected): 0 dbm (0x00)
< HCI Command: LE Set Advertising S.. (0x08|0x0035) plen 7  #39 [hci1] 3.232278
        Advertising handle: 0x00
        Advertising random address: D5:B6:CC:31:DB:3B (Static)
> HCI Event: Command Complete (0x0e) plen 4                 #40 [hci1] 3.232821
      LE Set Advertising Set Random Address (0x08|0x0035) ncmd 1
        Status: Success (0x00)
< HCI Command: LE Set Extended Adv.. (0x08|0x0037) plen 22  #41 [hci1] 3.252345
        Handle: 0x00
        Operation: Complete extended advertising data (0x03)
        Fragment preference: Minimize fragmentation (0x01)
        Data length: 0x12
        Flags: 0x06
          LE General Discoverable Mode
          BR/EDR Not Supported
        Name (complete): Tester_F6B11A
> HCI Event: Command Complete (0x0e) plen 4                 #42 [hci1] 3.253041
      LE Set Extended Advertising Data (0x08|0x0037) ncmd 1
        Status: Success (0x00)
< HCI Command: LE Set Extended Scan.. (0x08|0x0038) plen 4  #43 [hci1] 3.272318
        Handle: 0x00
        Operation: Complete scan response data (0x03)
        Fragment preference: Minimize fragmentation (0x01)
        Data length: 0x00
> HCI Event: Command Complete (0x0e) plen 4                 #44 [hci1] 3.272770
      LE Set Extended Scan Response Data (0x08|0x0038) ncmd 1
        Status: Success (0x00)
< HCI Command: LE Set Extended Adve.. (0x08|0x0039) plen 6  #45 [hci1] 3.292331
        Extended advertising: Enabled (0x01)
        Number of sets: 1 (0x01)
        Entry 0
          Handle: 0x00
          Duration: 0 ms (0x00)
          Max ext adv events: 0
> HCI Event: Command Complete (0x0e) plen 4                 #46 [hci1] 3.292907
      LE Set Extended Advertising Enable (0x08|0x0039) ncmd 1
        Status: Success (0x00)
> HCI Event: LE Meta Event (0x3e) plen 31                   #47 [hci1] 3.407708
      LE Enhanced Connection Complete (0x0a)
        Status: Success (0x00)
        Handle: 1749
        Role: Peripheral (0x01)
        Peer address type: Public (0x00)
        Peer address: DF:A9:FF:F6:B1:1A (OUI DF-A9-FF)
        Local resolvable private address: 00:00:00:00:00:00 (Non-Resolvable)
        Peer resolvable private address: 00:00:00:00:00:00 (Non-Resolvable)
        Connection interval: 87.50 msec (0x0046)
        Connection latency: 0 (0x0000)
        Supervision timeout: 25120 msec (0x09d0)
        Central clock accuracy: 0x01
> HCI Event: LE Meta Event (0x3e) plen 6                    #48 [hci1] 3.407746
      LE Advertising Set Terminated (0x12)
        Status: Success (0x00)
        Handle: 0
        Connection handle: 1749
        Number of completed extended advertising events: 0
< HCI Command: LE Read Remote Used... (0x08|0x0016) plen 2  #49 [hci1] 3.412599
        Handle: 1749 Address: DF:A9:FF:F6:B1:1A (OUI DF-A9-FF)
< ACL Data TX: Handle 1749 flags 0x00 dlen 7                #50 [hci1] 3.412606
      ATT: Exchange MTU Request (0x02) len 2
        Client RX MTU: 251
> HCI Event: Command Status (0x0f) plen 4                   #51 [hci1] 3.413029
      LE Read Remote Used Features (0x08|0x0016) ncmd 1
        Status: Success (0x00)
> HCI Event: Number of Completed Packets (0x13) plen 5      #52 [hci1] 3.583576
        Num handles: 1
        Handle: 1749 Address: DF:A9:FF:F6:B1:1A (OUI DF-A9-FF)
        Count: 1
        #50: len 7 (0 Kb/s)
        Latency: 170 msec (170-170 msec ~170 msec)
> HCI Event: LE Meta Event (0x3e) plen 12                   #53 [hci1] 3.671496
      LE Read Remote Used Features (0x04)
        Status: Success (0x00)
        Handle: 1749 Address: DF:A9:FF:F6:B1:1A (OUI DF-A9-FF)
        Features: 0x2d 0x49 0x00 0xf7 0x67 0xd9 0x00 0x80
          LE Encryption
          Extended Reject Indication
          Peripheral-initiated Features Exchange
          LE Data Packet Length Extension
          LE 2M PHY
          LE Coded PHY
          Channel Selection Algorithm #2
          Periodic Advertising Sync Transfer - Sender
          Periodic Advertising Sync Transfer - Recipient
          Sleep Clock Accuracy Updates
          Connected Isochronous Stream - Central
          Connected Isochronous Stream - Peripheral
          Isochronous Broadcaster
          Synchronized Receiver
          Connected Isochronous Stream (Host Support)
          LE Power Control Request
          LE Power Control Request
          Connection Subrating
          Connection Subrating (Host Support)
          Unknown features (0x8000d90000000000)
> ACL Data RX: Handle 1749 flags 0x02 dlen 11               #54 [hci1] 6.121255
      SMP: Pairing Request (0x01) len 6
        IO capability: KeyboardDisplay (0x04)
        OOB data: Authentication data not present (0x00)
        Authentication requirement: Bonding, MITM, SC, No Keypresses (0x0d)
        Max encryption key size: 16
        Initiator key distribution: EncKey IdKey (0x03)
        Responder key distribution: EncKey IdKey Sign (0x07)
> ACL Data RX: Handle 1749 flags 0x02 dlen 7                #55 [hci1] 6.121628
      ATT: Exchange MTU Response (0x03) len 2
        Server RX MTU: 23
< HCI Command: Host Number of Compl.. (0x03|0x0035) plen 5  #56 [hci1] 6.132943
        Num handles: 1
        Handle: 1749 Address: DF:A9:FF:F6:B1:1A (OUI DF-A9-FF)
        Count: 1
< ACL Data TX: Handle 1749 flags 0x00 dlen 11               #57 [hci1] 6.133124
      SMP: Pairing Response (0x02) len 6
        IO capability: DisplayOnly (0x00)
        OOB data: Authentication data not present (0x00)
        Authentication requirement: Bonding, No MITM, SC, No Keypresses (0x09)
        Max encryption key size: 16
        Initiator key distribution: IdKey (0x02)
        Responder key distribution: <none> (0x00)
< HCI Command: Host Number of Compl.. (0x03|0x0035) plen 5  #58 [hci1] 6.133432
        Num handles: 1
        Handle: 1749 Address: DF:A9:FF:F6:B1:1A (OUI DF-A9-FF)
        Count: 1
> HCI Event: Number of Completed Packets (0x13) plen 5      #59 [hci1] 6.296295
        Num handles: 1
        Handle: 1749 Address: DF:A9:FF:F6:B1:1A (OUI DF-A9-FF)
        Count: 1
        #57: len 11 (0 Kb/s)
        Latency: 163 msec (163-170 msec ~167 msec)
> ACL Data RX: Handle 1749 flags 0x02 dlen 27               #60 [hci1] 6.296659
> ACL Data RX: Handle 1749 flags 0x01 dlen 27               #61 [hci1] 6.297110
> ACL Data RX: Handle 1749 flags 0x01 dlen 15               #62 [hci1] 6.297552
      SMP: Pairing Public Key (0x0c) len 64
        X: 873ae11d899740c46a2b26d62491fc28a3b45a87e46865866a33ac48648f4d7d
        Y: 671aa713c5fc239e626edbd41189bd15111a1903658325207175eb9ef6d832e7
< HCI Command: Host Number of Compl.. (0x03|0x0035) plen 5  #63 [hci1] 6.312551
        Num handles: 1
        Handle: 1749 Address: DF:A9:FF:F6:B1:1A (OUI DF-A9-FF)
        Count: 1
< HCI Command: Host Number of Compl.. (0x03|0x0035) plen 5  #64 [hci1] 6.312691
        Num handles: 1
        Handle: 1749 Address: DF:A9:FF:F6:B1:1A (OUI DF-A9-FF)
        Count: 1
< HCI Command: Host Number of Compl.. (0x03|0x0035) plen 5  #65 [hci1] 6.312800
        Num handles: 1
        Handle: 1749 Address: DF:A9:FF:F6:B1:1A (OUI DF-A9-FF)
        Count: 1
< ACL Data TX: Handle 1749 flags 0x00 dlen 27               #66 [hci1] 6.312871
< ACL Data TX: Handle 1749 flags 0x01 dlen 27               #67 [hci1] 6.312872
< ACL Data TX: Handle 1749 flags 0x01 dlen 15               #68 [hci1] 6.312873
      SMP: Pairing Public Key (0x0c) len 64
        X: 98308440221e2d910f0e54b71e7ec652857aa9b5a0dc65028824cc19db1226e9
        Y: 67a4816bcb62efb21701e31fdb27561a6217575fb007a8bbdabe7e28b6f68482
> HCI Event: Number of Completed Packets (0x13) plen 5      #69 [hci1] 6.384215
        Num handles: 1
        Handle: 1749 Address: DF:A9:FF:F6:B1:1A (OUI DF-A9-FF)
        Count: 1
        #66: len 27 (3 Kb/s)
        Latency: 71 msec (71-170 msec ~119 msec)
> HCI Event: Number of Completed Packets (0x13) plen 5      #70 [hci1] 6.384872
        Num handles: 1
        Handle: 1749 Address: DF:A9:FF:F6:B1:1A (OUI DF-A9-FF)
        Count: 1
        #67: len 27 (3 Kb/s)
        Latency: 72 msec (71-170 msec ~95 msec)
> HCI Event: Number of Completed Packets (0x13) plen 5      #71 [hci1] 6.471057
        Num handles: 1
        Handle: 1749 Address: DF:A9:FF:F6:B1:1A (OUI DF-A9-FF)
        Count: 1
        #68: len 15 (0 Kb/s)
        Latency: 158 msec (71-170 msec ~126 msec)
> ACL Data RX: Handle 1749 flags 0x02 dlen 21               #72 [hci1] 7.433920
      SMP: Pairing Confirm (0x03) len 16
        Confim value: 66e861426f3dc93bcfef48666c4929c0
< HCI Command: Host Number of Compl.. (0x03|0x0035) plen 5  #73 [hci1] 7.452950
        Num handles: 1
        Handle: 1749 Address: DF:A9:FF:F6:B1:1A (OUI DF-A9-FF)
        Count: 1
< ACL Data TX: Handle 1749 flags 0x00 dlen 21               #74 [hci1] 7.453078
      SMP: Pairing Confirm (0x03) len 16
        Confim value: 80e70c0fce8312287f1e5ad5318c8a2b
> HCI Event: Number of Completed Packets (0x13) plen 5      #75 [hci1] 7.608782
        Num handles: 1
        Handle: 1749 Address: DF:A9:FF:F6:B1:1A (OUI DF-A9-FF)
        Count: 1
        #74: len 21 (1 Kb/s)
        Latency: 155 msec (71-170 msec ~141 msec)
> ACL Data RX: Handle 1749 flags 0x02 dlen 21               #76 [hci1] 7.609074
      SMP: Pairing Random (0x04) len 16
        Random value: dc60ac3607c71cbc0000000000000000
< HCI Command: Host Number of Compl.. (0x03|0x0035) plen 5  #77 [hci1] 7.612597
        Num handles: 1
        Handle: 1749 Address: DF:A9:FF:F6:B1:1A (OUI DF-A9-FF)
        Count: 1
< ACL Data TX: Handle 1749 flags 0x00 dlen 21               #78 [hci1] 7.612603
      SMP: Pairing Random (0x04) len 16
        Random value: 8e6108f966a694cbe26df70bb96773e6
> HCI Event: Number of Completed Packets (0x13) plen 5      #79 [hci1] 7.783510
        Num handles: 1
        Handle: 1749 Address: DF:A9:FF:F6:B1:1A (OUI DF-A9-FF)
        Count: 1
        #78: len 21 (0 Kb/s)
        Latency: 170 msec (71-170 msec ~156 msec)
> ACL Data RX: Handle 1749 flags 0x02 dlen 21               #80 [hci1] 7.871329
      SMP: Pairing Confirm (0x03) len 16
        Confim value: 8a1110632a91b6708b8b21323a49398c
< HCI Command: Host Number of Compl.. (0x03|0x0035) plen 5  #81 [hci1] 7.872654
        Num handles: 1
        Handle: 1749 Address: DF:A9:FF:F6:B1:1A (OUI DF-A9-FF)
        Count: 1
< ACL Data TX: Handle 1749 flags 0x00 dlen 21               #82 [hci1] 7.872728
      SMP: Pairing Confirm (0x03) len 16
        Confim value: dd7bf638b56b1a69e8a14087facaac1f
> HCI Event: Number of Completed Packets (0x13) plen 5      #83 [hci1] 8.046274
        Num handles: 1
        Handle: 1749 Address: DF:A9:FF:F6:B1:1A (OUI DF-A9-FF)
        Count: 1
        #82: len 21 (0 Kb/s)
        Latency: 173 msec (71-173 msec ~164 msec)
> ACL Data RX: Handle 1749 flags 0x02 dlen 21               #84 [hci1] 8.046569
      SMP: Pairing Random (0x04) len 16
        Random value: 4d50122b4486a8940000000000000000
< HCI Command: Host Number of Compl.. (0x03|0x0035) plen 5  #85 [hci1] 8.052884
        Num handles: 1
        Handle: 1749 Address: DF:A9:FF:F6:B1:1A (OUI DF-A9-FF)
        Count: 1
< ACL Data TX: Handle 1749 flags 0x00 dlen 21               #86 [hci1] 8.053004
      SMP: Pairing Random (0x04) len 16
        Random value: 4d02679f89a05211af56d8b3da64d21e
> HCI Event: Number of Completed Packets (0x13) plen 5      #87 [hci1] 8.221030
        Num handles: 1
        Handle: 1749 Address: DF:A9:FF:F6:B1:1A (OUI DF-A9-FF)
        Count: 1
        #86: len 21 (1 Kb/s)
        Latency: 168 msec (71-173 msec ~166 msec)
> ACL Data RX: Handle 1749 flags 0x02 dlen 21               #88 [hci1] 8.308869
      SMP: Pairing Confirm (0x03) len 16
        Confim value: 341532f47f3ac07412a780c6dd559f49
< HCI Command: Host Number of Compl.. (0x03|0x0035) plen 5  #89 [hci1] 8.312399
        Num handles: 1
        Handle: 1749 Address: DF:A9:FF:F6:B1:1A (OUI DF-A9-FF)
        Count: 1
< ACL Data TX: Handle 1749 flags 0x00 dlen 21               #90 [hci1] 8.312404
      SMP: Pairing Confirm (0x03) len 16
        Confim value: f369d4bf7d4adc55bbd4a6988de3ff65
> HCI Event: Number of Completed Packets (0x13) plen 5      #91 [hci1] 8.483699
        Num handles: 1
        Handle: 1749 Address: DF:A9:FF:F6:B1:1A (OUI DF-A9-FF)
        Count: 1
        #90: len 21 (0 Kb/s)
        Latency: 171 msec (71-173 msec ~168 msec)
> ACL Data RX: Handle 1749 flags 0x02 dlen 21               #92 [hci1] 8.484105
      SMP: Pairing Random (0x04) len 16
        Random value: b850d6d8fc9862fe0000000000000000
< HCI Command: Host Number of Compl.. (0x03|0x0035) plen 5  #93 [hci1] 8.493190
        Num handles: 1
        Handle: 1749 Address: DF:A9:FF:F6:B1:1A (OUI DF-A9-FF)
        Count: 1
< ACL Data TX: Handle 1749 flags 0x00 dlen 21               #94 [hci1] 8.493263
      SMP: Pairing Random (0x04) len 16
        Random value: 5e8286bc235a02440d0c3424a2acf8fd
> HCI Event: Number of Completed Packets (0x13) plen 5      #95 [hci1] 8.658481
        Num handles: 1
        Handle: 1749 Address: DF:A9:FF:F6:B1:1A (OUI DF-A9-FF)
        Count: 1
        #94: len 21 (1 Kb/s)
        Latency: 165 msec (71-173 msec ~167 msec)
> ACL Data RX: Handle 1749 flags 0x02 dlen 21               #96 [hci1] 8.746334
      SMP: Pairing Confirm (0x03) len 16
        Confim value: 6160b3a862674237438f1e57c5f94813
< HCI Command: Host Number of Compl.. (0x03|0x0035) plen 5  #97 [hci1] 8.752572
        Num handles: 1
        Handle: 1749 Address: DF:A9:FF:F6:B1:1A (OUI DF-A9-FF)
        Count: 1
< ACL Data TX: Handle 1749 flags 0x00 dlen 21               #98 [hci1] 8.752645
      SMP: Pairing Confirm (0x03) len 16
        Confim value: 3693ef23bf42e87f27f457851ef55a71
> HCI Event: Number of Completed Packets (0x13) plen 5      #99 [hci1] 8.921184
        Num handles: 1
        Handle: 1749 Address: DF:A9:FF:F6:B1:1A (OUI DF-A9-FF)
        Count: 1
        #98: len 21 (1 Kb/s)
        Latency: 168 msec (71-173 msec ~167 msec)
> ACL Data RX: Handle 1749 flags 0x02 dlen 21              #100 [hci1] 8.921548
      SMP: Pairing Random (0x04) len 16
        Random value: 26b360ae18ebba030000000000000000
< HCI Command: Host Number of Comp.. (0x03|0x0035) plen 5  #101 [hci1] 8.933161
        Num handles: 1
        Handle: 1749 Address: DF:A9:FF:F6:B1:1A (OUI DF-A9-FF)
        Count: 1
< ACL Data TX: Handle 1749 flags 0x00 dlen 21              #102 [hci1] 8.933333
      SMP: Pairing Random (0x04) len 16
        Random value: 5c4a1bcadd27bd58e945097b00bad7ac
> HCI Event: Number of Completed Packets (0x13) plen 5     #103 [hci1] 9.096051
        Num handles: 1
        Handle: 1749 Address: DF:A9:FF:F6:B1:1A (OUI DF-A9-FF)
        Count: 1
        #102: len 21 (1 Kb/s)
        Latency: 162 msec (71-173 msec ~165 msec)
> ACL Data RX: Handle 1749 flags 0x02 dlen 21              #104 [hci1] 9.183877
      SMP: Pairing Confirm (0x03) len 16
        Confim value: 1bd3756570af25d133aae9c11b61aa1c
< HCI Command: Host Number of Comp.. (0x03|0x0035) plen 5  #105 [hci1] 9.193065
        Num handles: 1
        Handle: 1749 Address: DF:A9:FF:F6:B1:1A (OUI DF-A9-FF)
        Count: 1
< ACL Data TX: Handle 1749 flags 0x00 dlen 21              #106 [hci1] 9.193164
      SMP: Pairing Confirm (0x03) len 16
        Confim value: 074088a71ad0fcc542a365acb0bd8eb7
> HCI Event: Number of Completed Packets (0x13) plen 5     #107 [hci1] 9.358743
        Num handles: 1
        Handle: 1749 Address: DF:A9:FF:F6:B1:1A (OUI DF-A9-FF)
        Count: 1
        #106: len 21 (1 Kb/s)
        Latency: 165 msec (71-173 msec ~165 msec)
> ACL Data RX: Handle 1749 flags 0x02 dlen 21              #108 [hci1] 9.359048
      SMP: Pairing Random (0x04) len 16
        Random value: dbf69d563d41e31b0000000000000000
< HCI Command: Host Number of Comp.. (0x03|0x0035) plen 5  #109 [hci1] 9.373133
        Num handles: 1
        Handle: 1749 Address: DF:A9:FF:F6:B1:1A (OUI DF-A9-FF)
        Count: 1
< ACL Data TX: Handle 1749 flags 0x00 dlen 21              #110 [hci1] 9.373284
      SMP: Pairing Random (0x04) len 16
        Random value: 32527e6e64e79f33b2e374394db8ab2d
> HCI Event: Number of Completed Packets (0x13) plen 5     #111 [hci1] 9.533540
        Num handles: 1
        Handle: 1749 Address: DF:A9:FF:F6:B1:1A (OUI DF-A9-FF)
        Count: 1
        #110: len 21 (1 Kb/s)
        Latency: 160 msec (71-173 msec ~162 msec)
> ACL Data RX: Handle 1749 flags 0x02 dlen 21              #112 [hci1] 9.621452
      SMP: Pairing Confirm (0x03) len 16
        Confim value: 2425ecbbac3a5d01a588a5a753df8729
< HCI Command: Host Number of Comp.. (0x03|0x0035) plen 5  #113 [hci1] 9.633068
        Num handles: 1
        Handle: 1749 Address: DF:A9:FF:F6:B1:1A (OUI DF-A9-FF)
        Count: 1
< ACL Data TX: Handle 1749 flags 0x00 dlen 21              #114 [hci1] 9.633218
      SMP: Pairing Confirm (0x03) len 16
        Confim value: 0fb2e94fa8182f8d786eb36921594e82
> HCI Event: Number of Completed Packets (0x13) plen 5     #115 [hci1] 9.796187
        Num handles: 1
        Handle: 1749 Address: DF:A9:FF:F6:B1:1A (OUI DF-A9-FF)
        Count: 1
        #114: len 21 (1 Kb/s)
        Latency: 162 msec (71-173 msec ~162 msec)
> ACL Data RX: Handle 1749 flags 0x02 dlen 21              #116 [hci1] 9.796507
      SMP: Pairing Random (0x04) len 16
        Random value: edee2bfe049ef15f0000000000000000
< HCI Command: Host Number of Comp.. (0x03|0x0035) plen 5  #117 [hci1] 9.812661
        Num handles: 1
        Handle: 1749 Address: DF:A9:FF:F6:B1:1A (OUI DF-A9-FF)
        Count: 1
< ACL Data TX: Handle 1749 flags 0x00 dlen 21              #118 [hci1] 9.812728
      SMP: Pairing Random (0x04) len 16
        Random value: dddbdfe2838e9a8cc6964353c850fef7
> HCI Event: Number of Completed Packets (0x13) plen 5     #119 [hci1] 9.970917
        Num handles: 1
        Handle: 1749 Address: DF:A9:FF:F6:B1:1A (OUI DF-A9-FF)
        Count: 1
        #118: len 21 (1 Kb/s)
        Latency: 158 msec (71-173 msec ~160 msec)
> ACL Data RX: Handle 1749 flags 0x02 dlen 21             #120 [hci1] 10.058823
      SMP: Pairing Confirm (0x03) len 16
        Confim value: 6c3a8053e32d24032b599fcd0f4d9b71
< HCI Command: Host Number of Com.. (0x03|0x0035) plen 5  #121 [hci1] 10.073077
        Num handles: 1
        Handle: 1749 Address: DF:A9:FF:F6:B1:1A (OUI DF-A9-FF)
        Count: 1
< ACL Data TX: Handle 1749 flags 0x00 dlen 21             #122 [hci1] 10.073186
      SMP: Pairing Confirm (0x03) len 16
        Confim value: bfc56ebeb3654b4a65975dae1f261920
> HCI Event: Number of Completed Packets (0x13) plen 5    #123 [hci1] 10.233744
        Num handles: 1
        Handle: 1749 Address: DF:A9:FF:F6:B1:1A (OUI DF-A9-FF)
        Count: 1
        #122: len 21 (1 Kb/s)
        Latency: 160 msec (71-173 msec ~160 msec)
> ACL Data RX: Handle 1749 flags 0x02 dlen 21             #124 [hci1] 10.234010
      SMP: Pairing Random (0x04) len 16
        Random value: 352260aec9a3e22e0000000000000000
< HCI Command: Host Number of Com.. (0x03|0x0035) plen 5  #125 [hci1] 10.253173
        Num handles: 1
        Handle: 1749 Address: DF:A9:FF:F6:B1:1A (OUI DF-A9-FF)
        Count: 1
< ACL Data TX: Handle 1749 flags 0x00 dlen 21             #126 [hci1] 10.253291
      SMP: Pairing Random (0x04) len 16
        Random value: eb9f1915536596b6fc3db1c86b2b1970
> HCI Event: Number of Completed Packets (0x13) plen 5    #127 [hci1] 10.408451
        Num handles: 1
        Handle: 1749 Address: DF:A9:FF:F6:B1:1A (OUI DF-A9-FF)
        Count: 1
        #126: len 21 (1 Kb/s)
        Latency: 155 msec (71-173 msec ~157 msec)
> ACL Data RX: Handle 1749 flags 0x02 dlen 21             #128 [hci1] 10.496281
      SMP: Pairing Confirm (0x03) len 16
        Confim value: f5da152d1421d4b1fb46077c9004a636
< HCI Command: Host Number of Com.. (0x03|0x0035) plen 5  #129 [hci1] 10.513120
        Num handles: 1
        Handle: 1749 Address: DF:A9:FF:F6:B1:1A (OUI DF-A9-FF)
        Count: 1
< ACL Data TX: Handle 1749 flags 0x00 dlen 21             #130 [hci1] 10.513220
      SMP: Pairing Confirm (0x03) len 16
        Confim value: 63a31fc74425f63141deb993542f9a58
> HCI Event: Number of Completed Packets (0x13) plen 5    #131 [hci1] 10.671198
        Num handles: 1
        Handle: 1749 Address: DF:A9:FF:F6:B1:1A (OUI DF-A9-FF)
        Count: 1
        #130: len 21 (1 Kb/s)
        Latency: 157 msec (71-173 msec ~157 msec)
> ACL Data RX: Handle 1749 flags 0x02 dlen 21             #132 [hci1] 10.671545
      SMP: Pairing Random (0x04) len 16
        Random value: 334951420df940e60000000000000000
< HCI Command: Host Number of Com.. (0x03|0x0035) plen 5  #133 [hci1] 10.673201
        Num handles: 1
        Handle: 1749 Address: DF:A9:FF:F6:B1:1A (OUI DF-A9-FF)
        Count: 1
< ACL Data TX: Handle 1749 flags 0x00 dlen 21             #134 [hci1] 10.673319
      SMP: Pairing Random (0x04) len 16
        Random value: 5c794dc9ad9f2c3f295ebd5ad5e1c3cf
> HCI Event: Number of Completed Packets (0x13) plen 5    #135 [hci1] 10.845968
        Num handles: 1
        Handle: 1749 Address: DF:A9:FF:F6:B1:1A (OUI DF-A9-FF)
        Count: 1
        #134: len 21 (0 Kb/s)
        Latency: 172 msec (71-173 msec ~165 msec)
> ACL Data RX: Handle 1749 flags 0x02 dlen 21             #136 [hci1] 10.933822
      SMP: Pairing Confirm (0x03) len 16
        Confim value: 1232d5d7a05a52276d9dc2f313fb70aa
< HCI Command: Host Number of Com.. (0x03|0x0035) plen 5  #137 [hci1] 10.953186
        Num handles: 1
        Handle: 1749 Address: DF:A9:FF:F6:B1:1A (OUI DF-A9-FF)
        Count: 1
< ACL Data TX: Handle 1749 flags 0x00 dlen 21             #138 [hci1] 10.953301
      SMP: Pairing Confirm (0x03) len 16
        Confim value: 83d28427b150e2c4cfd68a0a19fb085e
> HCI Event: Number of Completed Packets (0x13) plen 5    #139 [hci1] 11.108648
        Num handles: 1
        Handle: 1749 Address: DF:A9:FF:F6:B1:1A (OUI DF-A9-FF)
        Count: 1
        #138: len 21 (1 Kb/s)
        Latency: 155 msec (71-173 msec ~160 msec)
> ACL Data RX: Handle 1749 flags 0x02 dlen 21             #140 [hci1] 11.109242
      SMP: Pairing Random (0x04) len 16
        Random value: dd933fc450c0add40000000000000000
< HCI Command: Host Number of Com.. (0x03|0x0035) plen 5  #141 [hci1] 11.113215
        Num handles: 1
        Handle: 1749 Address: DF:A9:FF:F6:B1:1A (OUI DF-A9-FF)
        Count: 1
< ACL Data TX: Handle 1749 flags 0x00 dlen 21             #142 [hci1] 11.113327
      SMP: Pairing Random (0x04) len 16
        Random value: 5c2fff312cdf99c9491988e877355a9a
> HCI Event: Number of Completed Packets (0x13) plen 5    #143 [hci1] 11.283491
        Num handles: 1
        Handle: 1749 Address: DF:A9:FF:F6:B1:1A (OUI DF-A9-FF)
        Count: 1
        #142: len 21 (0 Kb/s)
        Latency: 170 msec (71-173 msec ~165 msec)
> ACL Data RX: Handle 1749 flags 0x02 dlen 21             #144 [hci1] 11.371356
      SMP: Pairing Confirm (0x03) len 16
        Confim value: 41ae75308e464848a287339be0999b05
< HCI Command: Host Number of Com.. (0x03|0x0035) plen 5  #145 [hci1] 11.372517
        Num handles: 1
        Handle: 1749 Address: DF:A9:FF:F6:B1:1A (OUI DF-A9-FF)
        Count: 1
< ACL Data TX: Handle 1749 flags 0x00 dlen 21             #146 [hci1] 11.372585
      SMP: Pairing Confirm (0x03) len 16
        Confim value: 3cf1cd382d82ac23b9e84bf5d15c494b
> HCI Event: Number of Completed Packets (0x13) plen 5    #147 [hci1] 11.546114
        Num handles: 1
        Handle: 1749 Address: DF:A9:FF:F6:B1:1A (OUI DF-A9-FF)
        Count: 1
        #146: len 21 (0 Kb/s)
        Latency: 173 msec (71-173 msec ~169 msec)
> ACL Data RX: Handle 1749 flags 0x02 dlen 21             #148 [hci1] 11.546551
      SMP: Pairing Random (0x04) len 16
        Random value: 9a82c0afdf219c4a0000000000000000
< HCI Command: Host Number of Com.. (0x03|0x0035) plen 5  #149 [hci1] 11.553145
        Num handles: 1
        Handle: 1749 Address: DF:A9:FF:F6:B1:1A (OUI DF-A9-FF)
        Count: 1
< ACL Data TX: Handle 1749 flags 0x00 dlen 21             #150 [hci1] 11.553243
      SMP: Pairing Random (0x04) len 16
        Random value: c629a3a987d808e808655d558dfc1155
> HCI Event: Number of Completed Packets (0x13) plen 5    #151 [hci1] 11.720920
        Num handles: 1
        Handle: 1749 Address: DF:A9:FF:F6:B1:1A (OUI DF-A9-FF)
        Count: 1
        #150: len 21 (1 Kb/s)
        Latency: 167 msec (71-173 msec ~168 msec)
> ACL Data RX: Handle 1749 flags 0x02 dlen 21             #152 [hci1] 11.808823
      SMP: Pairing Confirm (0x03) len 16
        Confim value: 3d556908f1561db6d57277d72d291541
< HCI Command: Host Number of Com.. (0x03|0x0035) plen 5  #153 [hci1] 11.812664
        Num handles: 1
        Handle: 1749 Address: DF:A9:FF:F6:B1:1A (OUI DF-A9-FF)
        Count: 1
< ACL Data TX: Handle 1749 flags 0x00 dlen 21             #154 [hci1] 11.812763
      SMP: Pairing Confirm (0x03) len 16
        Confim value: f33f45f69d7f752da674e92047e3cfa2
> HCI Event: Number of Completed Packets (0x13) plen 5    #155 [hci1] 11.983698
        Num handles: 1
        Handle: 1749 Address: DF:A9:FF:F6:B1:1A (OUI DF-A9-FF)
        Count: 1
        #154: len 21 (0 Kb/s)
        Latency: 170 msec (71-173 msec ~169 msec)
> ACL Data RX: Handle 1749 flags 0x02 dlen 21             #156 [hci1] 11.983973
      SMP: Pairing Random (0x04) len 16
        Random value: 16f84b3e4f691e100000000000000000
< HCI Command: Host Number of Com.. (0x03|0x0035) plen 5  #157 [hci1] 11.993298
        Num handles: 1
        Handle: 1749 Address: DF:A9:FF:F6:B1:1A (OUI DF-A9-FF)
        Count: 1
< ACL Data TX: Handle 1749 flags 0x00 dlen 21             #158 [hci1] 11.993478
      SMP: Pairing Random (0x04) len 16
        Random value: 92f20f6ad8f13724432c7fd6001c45ff
> HCI Event: Number of Completed Packets (0x13) plen 5    #159 [hci1] 12.158450
        Num handles: 1
        Handle: 1749 Address: DF:A9:FF:F6:B1:1A (OUI DF-A9-FF)
        Count: 1
        #158: len 21 (1 Kb/s)
        Latency: 164 msec (71-173 msec ~167 msec)
> ACL Data RX: Handle 1749 flags 0x02 dlen 21             #160 [hci1] 12.246268
      SMP: Pairing Confirm (0x03) len 16
        Confim value: 6f1567295553f556fb11e7135da0c95e
< HCI Command: Host Number of Com.. (0x03|0x0035) plen 5  #161 [hci1] 12.253115
        Num handles: 1
        Handle: 1749 Address: DF:A9:FF:F6:B1:1A (OUI DF-A9-FF)
        Count: 1
< ACL Data TX: Handle 1749 flags 0x00 dlen 21             #162 [hci1] 12.253190
      SMP: Pairing Confirm (0x03) len 16
        Confim value: ee0af2ce3580cdc49f5bb781bc9d303d
> HCI Event: Number of Completed Packets (0x13) plen 5    #163 [hci1] 12.421147
        Num handles: 1
        Handle: 1749 Address: DF:A9:FF:F6:B1:1A (OUI DF-A9-FF)
        Count: 1
        #162: len 21 (1 Kb/s)
        Latency: 167 msec (71-173 msec ~167 msec)
> ACL Data RX: Handle 1749 flags 0x02 dlen 21             #164 [hci1] 12.421487
      SMP: Pairing Random (0x04) len 16
        Random value: e68354de76aaa0cf0000000000000000
< HCI Command: Host Number of Com.. (0x03|0x0035) plen 5  #165 [hci1] 12.433355
        Num handles: 1
        Handle: 1749 Address: DF:A9:FF:F6:B1:1A (OUI DF-A9-FF)
        Count: 1
< ACL Data TX: Handle 1749 flags 0x00 dlen 21             #166 [hci1] 12.433532
      SMP: Pairing Random (0x04) len 16
        Random value: 23ac32ebbb5e14c8a6b9622f296d277f
> HCI Event: Number of Completed Packets (0x13) plen 5    #167 [hci1] 12.595954
        Num handles: 1
        Handle: 1749 Address: DF:A9:FF:F6:B1:1A (OUI DF-A9-FF)
        Count: 1
        #166: len 21 (1 Kb/s)
        Latency: 162 msec (71-173 msec ~165 msec)
> ACL Data RX: Handle 1749 flags 0x02 dlen 21             #168 [hci1] 12.683849
      SMP: Pairing Confirm (0x03) len 16
        Confim value: 3d6bffba440b6e156c1e82860c2ce5f6
< HCI Command: Host Number of Com.. (0x03|0x0035) plen 5  #169 [hci1] 12.692721
        Num handles: 1
        Handle: 1749 Address: DF:A9:FF:F6:B1:1A (OUI DF-A9-FF)
        Count: 1
< ACL Data TX: Handle 1749 flags 0x00 dlen 21             #170 [hci1] 12.692809
      SMP: Pairing Confirm (0x03) len 16
        Confim value: a5c3d72dd8bd2e53c179ce3ba26999c7
> HCI Event: Number of Completed Packets (0x13) plen 5    #171 [hci1] 12.858686
        Num handles: 1
        Handle: 1749 Address: DF:A9:FF:F6:B1:1A (OUI DF-A9-FF)
        Count: 1
        #170: len 21 (1 Kb/s)
        Latency: 165 msec (71-173 msec ~165 msec)
> ACL Data RX: Handle 1749 flags 0x02 dlen 21             #172 [hci1] 12.859027
      SMP: Pairing Random (0x04) len 16
        Random value: fb487bfa99db15f50000000000000000
< HCI Command: Host Number of Com.. (0x03|0x0035) plen 5  #173 [hci1] 12.872799
        Num handles: 1
        Handle: 1749 Address: DF:A9:FF:F6:B1:1A (OUI DF-A9-FF)
        Count: 1
< ACL Data TX: Handle 1749 flags 0x00 dlen 21             #174 [hci1] 12.872868
      SMP: Pairing Random (0x04) len 16
        Random value: 297efe85e67448a15f56bd27e3a3cf1d
> HCI Event: Number of Completed Packets (0x13) plen 5    #175 [hci1] 13.033364
        Num handles: 1
        Handle: 1749 Address: DF:A9:FF:F6:B1:1A (OUI DF-A9-FF)
        Count: 1
        #174: len 21 (1 Kb/s)
        Latency: 160 msec (71-173 msec ~162 msec)
> ACL Data RX: Handle 1749 flags 0x02 dlen 21             #176 [hci1] 13.121278
      SMP: Pairing Confirm (0x03) len 16
        Confim value: 55fce49bf69b42efeb02e4ae4ce991c9
< HCI Command: Host Number of Com.. (0x03|0x0035) plen 5  #177 [hci1] 13.132870
        Num handles: 1
        Handle: 1749 Address: DF:A9:FF:F6:B1:1A (OUI DF-A9-FF)
        Count: 1
< ACL Data TX: Handle 1749 flags 0x00 dlen 21             #178 [hci1] 13.133076
      SMP: Pairing Confirm (0x03) len 16
        Confim value: 222acc4cd2d525d6e7e1a48aea7e4748
> HCI Event: Number of Completed Packets (0x13) plen 5    #179 [hci1] 13.296158
        Num handles: 1
        Handle: 1749 Address: DF:A9:FF:F6:B1:1A (OUI DF-A9-FF)
        Count: 1
        #178: len 21 (1 Kb/s)
        Latency: 163 msec (71-173 msec ~163 msec)
> ACL Data RX: Handle 1749 flags 0x02 dlen 21             #180 [hci1] 13.296497
      SMP: Pairing Random (0x04) len 16
        Random value: d0d1d67de3d046030000000000000000
< HCI Command: Host Number of Com.. (0x03|0x0035) plen 5  #181 [hci1] 13.313147
        Num handles: 1
        Handle: 1749 Address: DF:A9:FF:F6:B1:1A (OUI DF-A9-FF)
        Count: 1
< ACL Data TX: Handle 1749 flags 0x00 dlen 21             #182 [hci1] 13.313231
      SMP: Pairing Random (0x04) len 16
        Random value: 25a9493fd3ce4faf02be7293595bb7c6
> HCI Event: Number of Completed Packets (0x13) plen 5    #183 [hci1] 13.470886
        Num handles: 1
        Handle: 1749 Address: DF:A9:FF:F6:B1:1A (OUI DF-A9-FF)
        Count: 1
        #182: len 21 (1 Kb/s)
        Latency: 157 msec (71-173 msec ~160 msec)
> ACL Data RX: Handle 1749 flags 0x02 dlen 21             #184 [hci1] 13.558789
      SMP: Pairing Confirm (0x03) len 16
        Confim value: 7a24c8f3548180bce01897fd1fca36b0
< HCI Command: Host Number of Com.. (0x03|0x0035) plen 5  #185 [hci1] 13.573077
        Num handles: 1
        Handle: 1749 Address: DF:A9:FF:F6:B1:1A (OUI DF-A9-FF)
        Count: 1
< ACL Data TX: Handle 1749 flags 0x00 dlen 21             #186 [hci1] 13.573176
      SMP: Pairing Confirm (0x03) len 16
        Confim value: f162bf0fe5c40e94cb62ced4378316e2
> HCI Event: Number of Completed Packets (0x13) plen 5    #187 [hci1] 13.733606
        Num handles: 1
        Handle: 1749 Address: DF:A9:FF:F6:B1:1A (OUI DF-A9-FF)
        Count: 1
        #186: len 21 (1 Kb/s)
        Latency: 160 msec (71-173 msec ~160 msec)
> ACL Data RX: Handle 1749 flags 0x02 dlen 21             #188 [hci1] 13.733958
      SMP: Pairing Random (0x04) len 16
        Random value: ab89593e073e54e40000000000000000
< HCI Command: Host Number of Com.. (0x03|0x0035) plen 5  #189 [hci1] 13.753320
        Num handles: 1
        Handle: 1749 Address: DF:A9:FF:F6:B1:1A (OUI DF-A9-FF)
        Count: 1
< ACL Data TX: Handle 1749 flags 0x00 dlen 21             #190 [hci1] 13.753510
      SMP: Pairing Random (0x04) len 16
        Random value: 58f6b41f855a6f6c3560debd84e2affc
> HCI Event: Number of Completed Packets (0x13) plen 5    #191 [hci1] 13.908466
        Num handles: 1
        Handle: 1749 Address: DF:A9:FF:F6:B1:1A (OUI DF-A9-FF)
        Count: 1
        #190: len 21 (1 Kb/s)
        Latency: 154 msec (71-173 msec ~157 msec)
> ACL Data RX: Handle 1749 flags 0x02 dlen 21             #192 [hci1] 13.996341
      SMP: Pairing Confirm (0x03) len 16
        Confim value: 07f48470e61bd5d83db16fd213f9e106
< HCI Command: Host Number of Com.. (0x03|0x0035) plen 5  #193 [hci1] 14.013193
        Num handles: 1
        Handle: 1749 Address: DF:A9:FF:F6:B1:1A (OUI DF-A9-FF)
        Count: 1
< ACL Data TX: Handle 1749 flags 0x00 dlen 21             #194 [hci1] 14.013283
      SMP: Pairing Confirm (0x03) len 16
        Confim value: c8a1449e2d238e9c54ec2e85d3f3c26c
> HCI Event: Number of Completed Packets (0x13) plen 5    #195 [hci1] 14.171082
        Num handles: 1
        Handle: 1749 Address: DF:A9:FF:F6:B1:1A (OUI DF-A9-FF)
        Count: 1
        #194: len 21 (1 Kb/s)
        Latency: 157 msec (71-173 msec ~157 msec)
> ACL Data RX: Handle 1749 flags 0x02 dlen 21             #196 [hci1] 14.171474
      SMP: Pairing Random (0x04) len 16
        Random value: 49c5c9eff986f2970000000000000000
< HCI Command: Host Number of Com.. (0x03|0x0035) plen 5  #197 [hci1] 14.173000
        Num handles: 1
        Handle: 1749 Address: DF:A9:FF:F6:B1:1A (OUI DF-A9-FF)
        Count: 1
< ACL Data TX: Handle 1749 flags 0x00 dlen 21             #198 [hci1] 14.173099
      SMP: Pairing Random (0x04) len 16
        Random value: b67e7216d5bf664139eda2b542549666
> HCI Event: Number of Completed Packets (0x13) plen 5    #199 [hci1] 14.345925
        Num handles: 1
        Handle: 1749 Address: DF:A9:FF:F6:B1:1A (OUI DF-A9-FF)
        Count: 1
        #198: len 21 (0 Kb/s)
        Latency: 172 msec (71-173 msec ~165 msec)
> ACL Data RX: Handle 1749 flags 0x02 dlen 21             #200 [hci1] 14.433804
      SMP: Pairing Confirm (0x03) len 16
        Confim value: 668294ab3e5feb10937fe9d64eb8cb4e
< HCI Command: Host Number of Com.. (0x03|0x0035) plen 5  #201 [hci1] 14.452650
        Num handles: 1
        Handle: 1749 Address: DF:A9:FF:F6:B1:1A (OUI DF-A9-FF)
        Count: 1
< ACL Data TX: Handle 1749 flags 0x00 dlen 21             #202 [hci1] 14.452683
      SMP: Pairing Confirm (0x03) len 16
        Confim value: 180f6c6e7a3abac4b9535387c699c018
> HCI Event: Number of Completed Packets (0x13) plen 5    #203 [hci1] 14.608583
        Num handles: 1
        Handle: 1749 Address: DF:A9:FF:F6:B1:1A (OUI DF-A9-FF)
        Count: 1
        #202: len 21 (1 Kb/s)
        Latency: 155 msec (71-173 msec ~160 msec)
> ACL Data RX: Handle 1749 flags 0x02 dlen 21             #204 [hci1] 14.608980
      SMP: Pairing Random (0x04) len 16
        Random value: 41e70f073e7c14400000000000000000
< HCI Command: Host Number of Com.. (0x03|0x0035) plen 5  #205 [hci1] 14.613280
        Num handles: 1
        Handle: 1749 Address: DF:A9:FF:F6:B1:1A (OUI DF-A9-FF)
        Count: 1
< ACL Data TX: Handle 1749 flags 0x00 dlen 21             #206 [hci1] 14.613408
      SMP: Pairing Random (0x04) len 16
        Random value: ed17f76500c95219dd01e09d1e63f87b
> HCI Event: Number of Completed Packets (0x13) plen 5    #207 [hci1] 14.783399
        Num handles: 1
        Handle: 1749 Address: DF:A9:FF:F6:B1:1A (OUI DF-A9-FF)
        Count: 1
        #206: len 21 (0 Kb/s)
        Latency: 169 msec (71-173 msec ~165 msec)
> ACL Data RX: Handle 1749 flags 0x02 dlen 21             #208 [hci1] 14.871290
      SMP: Pairing Confirm (0x03) len 16
        Confim value: b6aaf81aa996aaded5fd4a77d299cf58
< HCI Command: Host Number of Com.. (0x03|0x0035) plen 5  #209 [hci1] 14.872441
        Num handles: 1
        Handle: 1749 Address: DF:A9:FF:F6:B1:1A (OUI DF-A9-FF)
        Count: 1
< ACL Data TX: Handle 1749 flags 0x00 dlen 21             #210 [hci1] 14.872515
      SMP: Pairing Confirm (0x03) len 16
        Confim value: b138db57bb5600b5836be61994e50186
> HCI Event: Number of Completed Packets (0x13) plen 5    #211 [hci1] 15.046109
        Num handles: 1
        Handle: 1749 Address: DF:A9:FF:F6:B1:1A (OUI DF-A9-FF)
        Count: 1
        #210: len 21 (0 Kb/s)
        Latency: 173 msec (71-173 msec ~169 msec)
> ACL Data RX: Handle 1749 flags 0x02 dlen 21             #212 [hci1] 15.046473
      SMP: Pairing Random (0x04) len 16
        Random value: 6cad13e06ff248bc0000000000000000
< HCI Command: Host Number of Com.. (0x03|0x0035) plen 5  #213 [hci1] 15.053297
        Num handles: 1
        Handle: 1749 Address: DF:A9:FF:F6:B1:1A (OUI DF-A9-FF)
        Count: 1
< ACL Data TX: Handle 1749 flags 0x00 dlen 21             #214 [hci1] 15.053468
      SMP: Pairing Random (0x04) len 16
        Random value: 81d35d47e1f6006d79c974bd9d9e1ee3
> HCI Event: Number of Completed Packets (0x13) plen 5    #215 [hci1] 15.220866
        Num handles: 1
        Handle: 1749 Address: DF:A9:FF:F6:B1:1A (OUI DF-A9-FF)
        Count: 1
        #214: len 21 (1 Kb/s)
        Latency: 167 msec (71-173 msec ~168 msec)
> ACL Data RX: Handle 1749 flags 0x02 dlen 21             #216 [hci1] 15.308749
      SMP: Pairing Confirm (0x03) len 16
        Confim value: 21389cf7ce402359e7e07154e42fcb59
< HCI Command: Host Number of Com.. (0x03|0x0035) plen 5  #217 [hci1] 15.312724
        Num handles: 1
        Handle: 1749 Address: DF:A9:FF:F6:B1:1A (OUI DF-A9-FF)
        Count: 1
< ACL Data TX: Handle 1749 flags 0x00 dlen 21             #218 [hci1] 15.312796
      SMP: Pairing Confirm (0x03) len 16
        Confim value: cd253c79d9cdaca1f06208300e9ea321
> HCI Event: Number of Completed Packets (0x13) plen 5    #219 [hci1] 15.483534
        Num handles: 1
        Handle: 1749 Address: DF:A9:FF:F6:B1:1A (OUI DF-A9-FF)
        Count: 1
        #218: len 21 (0 Kb/s)
        Latency: 170 msec (71-173 msec ~169 msec)
> ACL Data RX: Handle 1749 flags 0x02 dlen 21             #220 [hci1] 15.483927
      SMP: Pairing Random (0x04) len 16
        Random value: 480819de9b152c3e0000000000000000
< HCI Command: Host Number of Com.. (0x03|0x0035) plen 5  #221 [hci1] 15.492814
        Num handles: 1
        Handle: 1749 Address: DF:A9:FF:F6:B1:1A (OUI DF-A9-FF)
        Count: 1
< ACL Data TX: Handle 1749 flags 0x00 dlen 21             #222 [hci1] 15.492885
      SMP: Pairing Random (0x04) len 16
        Random value: e7f7e0c2476823e41736a7e381bafb7c
> HCI Event: Number of Completed Packets (0x13) plen 5    #223 [hci1] 15.658389
        Num handles: 1
        Handle: 1749 Address: DF:A9:FF:F6:B1:1A (OUI DF-A9-FF)
        Count: 1
        #222: len 21 (1 Kb/s)
        Latency: 165 msec (71-173 msec ~167 msec)
> ACL Data RX: Handle 1749 flags 0x02 dlen 21             #224 [hci1] 15.746296
      SMP: Pairing Confirm (0x03) len 16
        Confim value: f481ab50b9f3bbf58cd12ecbf8866a69
< HCI Command: Host Number of Com.. (0x03|0x0035) plen 5  #225 [hci1] 15.752895
        Num handles: 1
        Handle: 1749 Address: DF:A9:FF:F6:B1:1A (OUI DF-A9-FF)
        Count: 1
< ACL Data TX: Handle 1749 flags 0x00 dlen 21             #226 [hci1] 15.752976
      SMP: Pairing Confirm (0x03) len 16
        Confim value: 57bfe3b2350249557e253390040afb18
> HCI Event: Number of Completed Packets (0x13) plen 5    #227 [hci1] 15.921101
        Num handles: 1
        Handle: 1749 Address: DF:A9:FF:F6:B1:1A (OUI DF-A9-FF)
        Count: 1
        #226: len 21 (1 Kb/s)
        Latency: 168 msec (71-173 msec ~167 msec)
> ACL Data RX: Handle 1749 flags 0x02 dlen 21             #228 [hci1] 15.921383
      SMP: Pairing Random (0x04) len 16
        Random value: 496b73bf9e7f808f0000000000000000
