Bluetooth monitor ver 5.72
= Note: Linux version 6.14.0-36-generic (x86_64)                       0.728035
= Note: Bluetooth subsystem version 2.22                               0.728037
= New Index: 00:00:00:00:00:00 (Primary,UART,hci1)              [hci1] 0.728038
= New Index: 48:5F:99:8E:E0:64 (Primary,USB,hci0)               [hci0] 0.728038
= Open Index: 00:00:00:00:00:00                                 [hci1] 0.841700
= Index Info: 00:00:00:00:00:00 (Nordic Semiconductor ASA)      [hci1] 0.841716
@ USER Open: main (privileged) version 2.22            {0x0001} [hci1] 0.841724
< HCI Command: Reset (0x03|0x0003) plen 0                    #1 [hci1] 0.842799
> HCI Event: Command Complete (0x0e) plen 4                  #2 [hci1] 0.843285
      Reset (0x03|0x0003) ncmd 1
        Status: Success (0x00)
< HCI Command: Read Local Supported... (0x04|0x0003) plen 0  #3 [hci1] 0.861188
> HCI Event: Command Complete (0x0e) plen 12                 #4 [hci1] 0.861692
      Read Local Supported Features (0x04|0x0003) ncmd 1
        Status: Success (0x00)
        Features: 0x00 0x00 0x00 0x00 0x60 0x00 0x00 0x00
          BR/EDR Not Supported
          LE Supported (Controller)
< HCI Command: Read Local Version In.. (0x04|0x0001) plen 0  #5 [hci1] 0.881195
> HCI Event: Command Complete (0x0e) plen 12                 #6 [hci1] 0.881664
      Read Local Version Information (0x04|0x0001) ncmd 1
        Status: Success (0x00)
        HCI version: Reserved (0x0f) - Revision 12393 (0x3069)
        LMP version: Reserved (0x0f) - Subversion 12393 (0x3069)
        Manufacturer: Nordic Semiconductor ASA (89)
< HCI Command: Read Local Supported... (0x04|0x0002) plen 0  #7 [hci1] 0.901177
> HCI Event: Command Complete (0x0e) plen 68                 #8 [hci1] 0.902238
      Read Local Supported Commands (0x04|0x0002) ncmd 1
        Status: Success (0x00)
        Commands: 119 entries
          Disconnect (Octet 0 - Bit 5)
          Read Remote Version Information (Octet 2 - Bit 7)
          Set Event Mask (Octet 5 - Bit 6)
          Reset (Octet 5 - Bit 7)
          Read Connection Accept Timeout (Octet 7 - Bit 2)
          Write Connection Accept Timeout (Octet 7 - Bit 3)
          Read Transmit Power Level (Octet 10 - Bit 2)
          Set Controller To Host Flow Control (Octet 10 - Bit 5)
          Host Buffer Size (Octet 10 - Bit 6)
          Host Number of Completed Packets (Octet 10 - Bit 7)
          Read Local Version Information (Octet 14 - Bit 3)
          Read Local Supported Features (Octet 14 - Bit 5)
          Read BD ADDR (Octet 15 - Bit 1)
          Read RSSI (Octet 15 - Bit 5)
          Set Event Mask Page 2 (Octet 22 - Bit 2)
          LE Set Event Mask (Octet 25 - Bit 0)
          LE Read Buffer Size (Octet 25 - Bit 1)
          LE Read Local Supported Features (Octet 25 - Bit 2)
          LE Set Random Address (Octet 25 - Bit 4)
          LE Set Advertising Parameters (Octet 25 - Bit 5)
          LE Read Advertising Channel TX Power (Octet 25 - Bit 6)
          LE Set Advertising Data (Octet 25 - Bit 7)
          LE Set Scan Response Data (Octet 26 - Bit 0)
          LE Set Advertise Enable (Octet 26 - Bit 1)
          LE Set Scan Parameters (Octet 26 - Bit 2)
          LE Set Scan Enable (Octet 26 - Bit 3)
          LE Create Connection (Octet 26 - Bit 4)
          LE Create Connection Cancel (Octet 26 - Bit 5)
          LE Read Accept List Size (Octet 26 - Bit 6)
          LE Clear Accept List (Octet 26 - Bit 7)
          LE Add Device To Accept List (Octet 27 - Bit 0)
          LE Remove Device From Accept List (Octet 27 - Bit 1)
          LE Connection Update (Octet 27 - Bit 2)
          LE Set Host Channel Classification (Octet 27 - Bit 3)
          LE Read Channel Map (Octet 27 - Bit 4)
          LE Read Remote Used Features (Octet 27 - Bit 5)
          LE Encrypt (Octet 27 - Bit 6)
          LE Rand (Octet 27 - Bit 7)
          LE Start Encryption (Octet 28 - Bit 0)
          LE Long Term Key Request Reply (Octet 28 - Bit 1)
          LE Long Term Key Request Neg Reply (Octet 28 - Bit 2)
          LE Read Supported States (Octet 28 - Bit 3)
          LE Receiver Test (Octet 28 - Bit 4)
          LE Transmitter Test (Octet 28 - Bit 5)
          LE Test End (Octet 28 - Bit 6)
          Read Authenticated Payload Timeout (Octet 32 - Bit 4)
          Write Authenticated Payload Timeout (Octet 32 - Bit 5)
          LE Set Data Length (Octet 33 - Bit 6)
          LE Read Suggested Default Data Length (Octet 33 - Bit 7)
          LE Write Suggested Default Data Length (Octet 34 - Bit 0)
          LE Add Device To Resolving List (Octet 34 - Bit 3)
          LE Remove Device From Resolving List (Octet 34 - Bit 4)
          LE Clear Resolving List (Octet 34 - Bit 5)
          LE Read Resolving List Size (Octet 34 - Bit 6)
          LE Set Address Resolution Enable (Octet 35 - Bit 1)
          LE Set Resolvable Private Address Timeout (Octet 35 - Bit 2)
          LE Read Maximum Data Length (Octet 35 - Bit 3)
          LE Read PHY (Octet 35 - Bit 4)
          LE Set Default PHY (Octet 35 - Bit 5)
          LE Set PHY (Octet 35 - Bit 6)
          LE Enhanced Receiver Test (Octet 35 - Bit 7)
          LE Enhanced Transmitter Test (Octet 36 - Bit 0)
          LE Set Advertising Set Random Address (Octet 36 - Bit 1)
          LE Set Extended Advertising Parameters (Octet 36 - Bit 2)
          LE Set Extended Advertising Data (Octet 36 - Bit 3)
          LE Set Extended Scan Response Data (Octet 36 - Bit 4)
          LE Set Extended Advertising Enable (Octet 36 - Bit 5)
          LE Read Maximum Advertising Data Length (Octet 36 - Bit 6)
          LE Read Number of Supported Advertising Sets (Octet 36 - Bit 7)
          LE Remove Advertising Set (Octet 37 - Bit 0)
          LE Clear Advertising Sets (Octet 37 - Bit 1)
          LE Set Periodic Advertising Parameters (Octet 37 - Bit 2)
          LE Set Periodic Advertising Data (Octet 37 - Bit 3)
          LE Set Periodic Advertising Enable (Octet 37 - Bit 4)
          LE Set Extended Scan Parameters (Octet 37 - Bit 5)
          LE Set Extended Scan Enable (Octet 37 - Bit 6)
          LE Extended Create Connection (Octet 37 - Bit 7)
          LE Periodic Advertising Create Sync (Octet 38 - Bit 0)
          LE Periodic Advertising Create Sync Cancel (Octet 38 - Bit 1)
          LE Periodic Advertising Terminate Sync (Octet 38 - Bit 2)
          LE Add Device To Periodic Advertiser List (Octet 38 - Bit 3)
          LE Remove Device From Periodic Advertiser List (Octet 38 - Bit 4)
          LE Clear Periodic Advertiser List (Octet 38 - Bit 5)
          LE Read Periodic Advertiser List Size (Octet 38 - Bit 6)
          LE Read Transmit Power (Octet 38 - Bit 7)
          LE Read RF Path Compensation (Octet 39 - Bit 0)
          LE Write RF Path Compensation (Octet 39 - Bit 1)
          LE Set Privacy Mode (Octet 39 - Bit 2)
          LE Periodic Advertising Receive Enable (Octet 40 - Bit 5)
          LE Periodic Advertising Sync Transfer (Octet 40 - Bit 6)
          LE Periodic Advertising Set Info Transfer (Octet 40 - Bit 7)
          LE Periodic Advertising Sync Transfer Parameters (Octet 41 - Bit 0)
          LE Set Default Periodic Advertisng Sync Transfer Parameters (Octet 41 - Bit 1)
          LE Read Buffer v2 (Octet 41 - Bit 5)
          LE Read ISO TX Sync (Octet 41 - Bit 6)
          LE Set Connected Isochronous Group Parameters (Octet 41 - Bit 7)
          LE Set Connected Isochronous Group Parameters Test (Octet 42 - Bit 0)
          LE Create Connected Isochronous Stream (Octet 42 - Bit 1)
          LE Remove Connected Isochronous Group (Octet 42 - Bit 2)
          LE Accept Connected Isochronous Stream Request (Octet 42 - Bit 3)
          LE Reject Connected Isochronous Stream Request (Octet 42 - Bit 4)
          LE Create Broadcast Isochronous Group (Octet 42 - Bit 5)
          LE Create Broadcast Isochronous Group Test (Octet 42 - Bit 6)
          LE Terminate Broadcast Isochronous Group (Octet 42 - Bit 7)
          LE Broadcast Isochronous Group Create Sync (Octet 43 - Bit 0)
          LE Broadcast Isochronous Group Terminate Sync (Octet 43 - Bit 1)
          LE Request Peer SCA (Octet 43 - Bit 2)
          LE Setup Isochronous Data Path (Octet 43 - Bit 3)
          LE Remove Isochronous Data Path (Octet 43 - Bit 4)
          LE Isochronous Transmit Test (Octet 43 - Bit 5)
          LE Isochronous Receive Test (Octet 43 - Bit 6)
          LE Isochronous Read Test Counters (Octet 43 - Bit 7)
          LE Isochronous Read Test Counters (Octet 44 - Bit 0)
          LE Set Host Feature (Octet 44 - Bit 1)
          Octet 44 - Bit 2 
          Octet 45 - Bit 6 
          Octet 46 - Bit 0 
          Octet 46 - Bit 1 
          Octet 46 - Bit 2 
< HCI Command: Host Buffer Size (0x03|0x0033) plen 7         #9 [hci1] 0.921181
        ACL MTU: 255  ACL max packet: 16
        SCO MTU: 0    SCO max packet: 0
> HCI Event: Command Complete (0x0e) plen 4                 #10 [hci1] 0.921652
      Host Buffer Size (0x03|0x0033) ncmd 1
        Status: Success (0x00)
< HCI Command: Set Controller To Ho.. (0x03|0x0031) plen 1  #11 [hci1] 0.941180
        Flow control: ACL Data Packets (0x01)
> HCI Event: Command Complete (0x0e) plen 4                 #12 [hci1] 0.941665
      Set Controller To Host Flow Control (0x03|0x0031) ncmd 1
        Status: Success (0x00)
< HCI Command: LE Read Local Suppor.. (0x08|0x0003) plen 0  #13 [hci1] 0.961187
> HCI Event: Command Complete (0x0e) plen 12                #14 [hci1] 0.961651
      LE Read Local Supported Features (0x08|0x0003) ncmd 1
        Status: Success (0x00)
        Features: 0xfd 0x79 0x00 0xf7 0x30 0x01 0x00 0x00
          LE Encryption
          Extended Reject Indication
          Peripheral-initiated Features Exchange
          LE Ping
          LE Data Packet Length Extension
          LL Privacy
          Extended Scanner Filter Policies
          LE 2M PHY
          LE Coded PHY
          LE Extended Advertising
          LE Periodic Advertising
          Channel Selection Algorithm #2
          Periodic Advertising Sync Transfer - Sender
          Periodic Advertising Sync Transfer - Recipient
          Sleep Clock Accuracy Updates
          Connected Isochronous Stream - Central
          Connected Isochronous Stream - Peripheral
          Isochronous Broadcaster
          Synchronized Receiver
          Periodic Advertising ADI support
          Connection Subrating
          Unknown features (0x0000010000000000)
< HCI Command: LE Set Host Feature (0x08|0x0074) plen 2     #15 [hci1] 0.981204
        Bit Number: 32
          Connected Isochronous Stream (Host Support)
        Bit Value: 1
> HCI Event: Command Complete (0x0e) plen 4                 #16 [hci1] 0.981544
      LE Set Host Feature (0x08|0x0074) ncmd 1
        Status: Success (0x00)
< HCI Command: LE Read Buffer v2 (0x08|0x0060) plen 0       #17 [hci1] 1.001176
> HCI Event: Command Complete (0x0e) plen 10                #18 [hci1] 1.001616
      LE Read Buffer v2 (0x08|0x0060) ncmd 1
        Status: Success (0x00)
        ACL MTU: 27
        ACL max packet: 3
        ISO MTU: 318
        ISO max packet: 3
< HCI Command: LE Read Maximum Adve.. (0x08|0x003a) plen 0  #19 [hci1] 1.021220
> HCI Event: Command Complete (0x0e) plen 6                 #20 [hci1] 1.021642
      LE Read Maximum Advertising Data Length (0x08|0x003a) ncmd 1
        Status: Success (0x00)
        Max length: 1650
< HCI Command: LE Read Supported St.. (0x08|0x001c) plen 0  #21 [hci1] 1.041188
> HCI Event: Command Complete (0x0e) plen 12                #22 [hci1] 1.041632
      LE Read Supported States (0x08|0x001c) ncmd 1
        Status: Success (0x00)
        States: 0x000003ff3e0306ff
          Non-connectable Advertising State
          Scannable Advertising State
          Connectable Advertising State
          High Duty Cycle Directed Advertising State
          Passive Scanning State
          Active Scanning State
          Initiating State
            and Connection State (Central Role)
          Connection State (Peripheral Role)
          Scannable Advertising State
            and Passive Scanning State
          Connectable Advertising State
            and Passive Scanning State
          Non-connectable Advertising State
            and Initiating State
          Scannable Advertising State
            and Initiating State
          Active Scanning State
            and Connection State (Central Role)
          Passive Scanning State
            and Connection State (Peripheral Role)
          Active Scanning State
            and Connection State (Peripheral Role)
          Initiating State
            and Connection State (Central Role)
            and Central Role & Central Role
          Low Duty Cycle Directed Advertising State
          Connectable Advertising State
            and Initiating State
            and Central Role & Peripheral Role
          High Duty Cycle Directed Advertising State
            and Initiating State
            and Central Role & Peripheral Role
          Low Duty Cycle Directed Advertising State
            and Initiating State
            and Central Role & Peripheral Role
          Connectable Advertising State
            and Connection State (Central Role)
            and Central Role & Peripheral Role
          High Duty Cycle Directed Advertising State
            and Connection State (Central Role)
            and Central Role & Peripheral Role
          Low Duty Cycle Directed Advertising State
            and Connection State (Central Role)
            and Central Role & Peripheral Role
          Connectable Advertising State
            and Connection State (Peripheral Role)
            and Central Role & Peripheral Role
          High Duty Cycle Directed Advertising State
            and Connection State (Peripheral Role)
            and Peripheral Role & Peripheral Role
          Low Duty Cycle Directed Advertising State
            and Connection State (Peripheral Role)
            and Peripheral Role & Peripheral Role
          Initiating State
            and Connection State (Peripheral Role)
            and Central Role & Peripheral Role
< HCI Command: LE Read Maximum Data.. (0x08|0x002f) plen 0  #23 [hci1] 1.061179
> HCI Event: Command Complete (0x0e) plen 12                #24 [hci1] 1.061681
      LE Read Maximum Data Length (0x08|0x002f) ncmd 1
        Status: Success (0x00)
        Max TX octets: 251
        Max TX time: 2704
        Max RX octets: 251
        Max RX time: 2704
< HCI Command: LE Write Suggested D.. (0x08|0x0024) plen 4  #25 [hci1] 1.081179
        TX octets: 251
        TX time: 2704
> HCI Event: Command Complete (0x0e) plen 4                 #26 [hci1] 1.081684
      LE Write Suggested Default Data Length (0x08|0x0024) ncmd 1
        Status: Success (0x00)
< HCI Command: LE Read Resolving Li.. (0x08|0x002a) plen 0  #27 [hci1] 1.101212
> HCI Event: Command Complete (0x0e) plen 5                 #28 [hci1] 1.101685
      LE Read Resolving List Size (0x08|0x002a) ncmd 1
        Status: Success (0x00)
        Size: 8
< HCI Command: LE Set Event Mask (0x08|0x0001) plen 8       #29 [hci1] 1.121190
        Mask: 0x000002023f87fa5e
          LE Advertising Report
          LE Connection Update Complete
          LE Read Remote Used Features Complete
          LE Long Term Key Request
          LE Data Length Change
          LE Enhanced Connection Complete
          LE PHY Update Complete
          LE Extended Advertising Report
          LE Periodic Advertising Sync Established
          LE Periodic Advertising Report
          LE Periodic Advertising Sync Lost
          LE Extended Scan Timeout
          LE Extended Advertising Set Terminated
          LE Scan Request Received
          LE Periodic Advertising Sync Transfer Rvc
          LE CIS Established
          LE CIS Request
          LE Create BIG Complete
          LE Terminate BIG Complete
          LE BIG Sync Estabilished Complete
          LE BIG Sync Lost
          LE BIG Info Advertising Report
          Unknown mask (0x0000020000000000)
> HCI Event: Command Complete (0x0e) plen 4                 #30 [hci1] 1.121696
      LE Set Event Mask (0x08|0x0001) ncmd 1
        Status: Success (0x00)
< HCI Command: Set Event Mask (0x03|0x0001) plen 8          #31 [hci1] 1.141181
        Mask: 0x2000800002008890
          Disconnection Complete
          Encryption Change
          Read Remote Version Information Complete
          Hardware Error
          Data Buffer Overflow
          Encryption Key Refresh Complete
          LE Meta
> HCI Event: Command Complete (0x0e) plen 4                 #32 [hci1] 1.141721
      Set Event Mask (0x03|0x0001) ncmd 1
        Status: Success (0x00)
< HCI Command: Read BD ADDR (0x04|0x0009) plen 0            #33 [hci1] 1.161184
> HCI Event: Command Complete (0x0e) plen 10                #34 [hci1] 1.161647
      Read BD ADDR (0x04|0x0009) ncmd 1
        Status: Success (0x00)
        Address: 00:00:00:00:00:00 (OUI 00-00-00)
< HCI Command: LE Set Random Address (0x08|0x0005) plen 6   #35 [hci1] 1.181207
        Address: D5:B6:CC:31:DB:3B (Static)
> HCI Event: Command Complete (0x0e) plen 4                 #36 [hci1] 1.181882
      LE Set Random Address (0x08|0x0005) ncmd 1
        Status: Success (0x00)
< HCI Command: LE Set Extended Adv.. (0x08|0x0036) plen 25  #37 [hci1] 4.611689
        Handle: 0x00
        Properties: 0x0013
          Connectable
          Scannable
          Use legacy advertising PDUs: ADV_IND
        Min advertising interval: 100.000 msec (0x00a0)
        Max advertising interval: 150.000 msec (0x00f0)
        Channel map: 37, 38, 39 (0x07)
        Own address type: Random (0x01)
        Peer address type: Public (0x00)
        Peer address: 00:00:00:00:00:00 (OUI 00-00-00)
        Filter policy: Allow Scan Request from Any, Allow Connect Request from Any (0x00)
        TX power: Host has no preference (0x7f)
        Primary PHY: LE 1M (0x01)
        Secondary max skip: 0x00
        Secondary PHY: LE 1M (0x01)
        SID: 0x00
        Scan request notifications: Disabled (0x00)
> HCI Event: Command Complete (0x0e) plen 5                 #38 [hci1] 4.612507
      LE Set Extended Advertising Parameters (0x08|0x0036) ncmd 1
        Status: Success (0x00)
        TX power (selected): 0 dbm (0x00)
< HCI Command: LE Set Advertising S.. (0x08|0x0035) plen 7  #39 [hci1] 4.621225
        Advertising handle: 0x00
        Advertising random address: D5:B6:CC:31:DB:3B (Static)
> HCI Event: Command Complete (0x0e) plen 4                 #40 [hci1] 4.621763
      LE Set Advertising Set Random Address (0x08|0x0035) ncmd 1
        Status: Success (0x00)
< HCI Command: LE Set Extended Adv.. (0x08|0x0037) plen 22  #41 [hci1] 4.641224
        Handle: 0x00
        Operation: Complete extended advertising data (0x03)
        Fragment preference: Minimize fragmentation (0x01)
        Data length: 0x12
        Flags: 0x04
          BR/EDR Not Supported
        Name (complete): Tester_F6B11A
> HCI Event: Command Complete (0x0e) plen 4                 #42 [hci1] 4.641913
      LE Set Extended Advertising Data (0x08|0x0037) ncmd 1
        Status: Success (0x00)
< HCI Command: LE Set Extended Scan.. (0x08|0x0038) plen 4  #43 [hci1] 4.661234
        Handle: 0x00
        Operation: Complete scan response data (0x03)
        Fragment preference: Minimize fragmentation (0x01)
        Data length: 0x00
> HCI Event: Command Complete (0x0e) plen 4                 #44 [hci1] 4.661757
      LE Set Extended Scan Response Data (0x08|0x0038) ncmd 1
        Status: Success (0x00)
< HCI Command: LE Set Extended Adve.. (0x08|0x0039) plen 6  #45 [hci1] 4.681197
        Extended advertising: Enabled (0x01)
        Number of sets: 1 (0x01)
        Entry 0
          Handle: 0x00
          Duration: 0 ms (0x00)
          Max ext adv events: 0
> HCI Event: Command Complete (0x0e) plen 4                 #46 [hci1] 4.681844
      LE Set Extended Advertising Enable (0x08|0x0039) ncmd 1
        Status: Success (0x00)
> HCI Event: LE Meta Event (0x3e) plen 31                   #47 [hci1] 5.006139
      LE Enhanced Connection Complete (0x0a)
        Status: Success (0x00)
        Handle: 2631
        Role: Peripheral (0x01)
        Peer address type: Public (0x00)
        Peer address: DF:A9:FF:F6:B1:1A (OUI DF-A9-FF)
        Local resolvable private address: 00:00:00:00:00:00 (Non-Resolvable)
        Peer resolvable private address: 00:00:00:00:00:00 (Non-Resolvable)
        Connection interval: 87.50 msec (0x0046)
        Connection latency: 0 (0x0000)
        Supervision timeout: 20000 msec (0x07d0)
        Central clock accuracy: 0x01
> HCI Event: LE Meta Event (0x3e) plen 6                    #48 [hci1] 5.006260
      LE Advertising Set Terminated (0x12)
        Status: Success (0x00)
        Handle: 0
        Connection handle: 2631
        Number of completed extended advertising events: 0
< HCI Command: LE Read Remote Used... (0x08|0x0016) plen 2  #49 [hci1] 5.022053
        Handle: 2631 Address: DF:A9:FF:F6:B1:1A (OUI DF-A9-FF)
> HCI Event: Command Status (0x0f) plen 4                   #50 [hci1] 5.022569
      LE Read Remote Used Features (0x08|0x0016) ncmd 1
        Status: Success (0x00)
> HCI Event: LE Meta Event (0x3e) plen 12                   #51 [hci1] 5.270169
      LE Read Remote Used Features (0x04)
        Status: Success (0x00)
        Handle: 2631 Address: DF:A9:FF:F6:B1:1A (OUI DF-A9-FF)
        Features: 0x2d 0x49 0x00 0xf7 0x67 0xd9 0x00 0x80
          LE Encryption
          Extended Reject Indication
          Peripheral-initiated Features Exchange
          LE Data Packet Length Extension
          LE 2M PHY
          LE Coded PHY
          Channel Selection Algorithm #2
          Periodic Advertising Sync Transfer - Sender
          Periodic Advertising Sync Transfer - Recipient
          Sleep Clock Accuracy Updates
          Connected Isochronous Stream - Central
          Connected Isochronous Stream - Peripheral
          Isochronous Broadcaster
          Synchronized Receiver
          Connected Isochronous Stream (Host Support)
          LE Power Control Request
          LE Power Control Request
          Connection Subrating
          Connection Subrating (Host Support)
          Unknown features (0x8000d90000000000)
> ACL Data RX: Handle 2631 flags 0x02 dlen 11               #52 [hci1] 7.719767
      SMP: Pairing Request (0x01) len 6
        IO capability: KeyboardDisplay (0x04)
        OOB data: Authentication data not present (0x00)
        Authentication requirement: Bonding, No MITM, SC, No Keypresses (0x09)
        Max encryption key size: 16
        Initiator key distribution: EncKey IdKey (0x03)
        Responder key distribution: EncKey IdKey Sign (0x07)
< HCI Command: Host Number of Compl.. (0x03|0x0035) plen 5  #53 [hci1] 7.721747
        Num handles: 1
        Handle: 2631 Address: DF:A9:FF:F6:B1:1A (OUI DF-A9-FF)
        Count: 1
< ACL Data TX: Handle 2631 flags 0x00 dlen 11               #54 [hci1] 7.721829
      SMP: Pairing Response (0x02) len 6
        IO capability: NoInputNoOutput (0x03)
        OOB data: Authentication data not present (0x00)
        Authentication requirement: Bonding, No MITM, SC, No Keypresses (0x09)
        Max encryption key size: 16
        Initiator key distribution: IdKey (0x02)
        Responder key distribution: <none> (0x00)
> HCI Event: Number of Completed Packets (0x13) plen 5      #55 [hci1] 7.894811
        Num handles: 1
        Handle: 2631 Address: DF:A9:FF:F6:B1:1A (OUI DF-A9-FF)
        Count: 1
        #54: len 11 (0 Kb/s)
        Latency: 172 msec (172-172 msec ~172 msec)
> ACL Data RX: Handle 2631 flags 0x02 dlen 27               #56 [hci1] 7.895188
> ACL Data RX: Handle 2631 flags 0x01 dlen 27               #57 [hci1] 7.895728
> ACL Data RX: Handle 2631 flags 0x01 dlen 15               #58 [hci1] 7.896195
      SMP: Pairing Public Key (0x0c) len 64
        X: a0426d811f7a0bc93ac2231e40558356381385909cfbc4adf146a92c3670bcc8
        Y: 20a4cb668094a20b28e402385a984f8aaad4c404d13b2dc287ab1df02d2766a2
< HCI Command: Host Number of Compl.. (0x03|0x0035) plen 5  #59 [hci1] 7.901758
        Num handles: 1
        Handle: 2631 Address: DF:A9:FF:F6:B1:1A (OUI DF-A9-FF)
        Count: 1
< HCI Command: Host Number of Compl.. (0x03|0x0035) plen 5  #60 [hci1] 7.901908
        Num handles: 1
        Handle: 2631 Address: DF:A9:FF:F6:B1:1A (OUI DF-A9-FF)
        Count: 1
< HCI Command: Host Number of Compl.. (0x03|0x0035) plen 5  #61 [hci1] 7.902080
        Num handles: 1
        Handle: 2631 Address: DF:A9:FF:F6:B1:1A (OUI DF-A9-FF)
        Count: 1
< ACL Data TX: Handle 2631 flags 0x00 dlen 27               #62 [hci1] 7.902149
< ACL Data TX: Handle 2631 flags 0x01 dlen 27               #63 [hci1] 7.902181
< ACL Data TX: Handle 2631 flags 0x01 dlen 15               #64 [hci1] 7.902198
      SMP: Pairing Public Key (0x0c) len 64
        X: 98308440221e2d910f0e54b71e7ec652857aa9b5a0dc65028824cc19db1226e9
        Y: 67a4816bcb62efb21701e31fdb27561a6217575fb007a8bbdabe7e28b6f68482
> HCI Event: Number of Completed Packets (0x13) plen 5      #65 [hci1] 7.982769
        Num handles: 1
        Handle: 2631 Address: DF:A9:FF:F6:B1:1A (OUI DF-A9-FF)
        Count: 1
        #62: len 27 (2 Kb/s)
        Latency: 80 msec (80-172 msec ~126 msec)
> HCI Event: Number of Completed Packets (0x13) plen 5      #66 [hci1] 7.983383
        Num handles: 1
        Handle: 2631 Address: DF:A9:FF:F6:B1:1A (OUI DF-A9-FF)
        Count: 1
        #63: len 27 (2 Kb/s)
        Latency: 81 msec (80-172 msec ~104 msec)
< ACL Data TX: Handle 2631 flags 0x00 dlen 21               #67 [hci1] 8.001346
      SMP: Pairing Confirm (0x03) len 16
        Confim value: f8185e64067e911d91d11af065bbb05e
> HCI Event: Number of Completed Packets (0x13) plen 5      #68 [hci1] 8.069633
        Num handles: 1
        Handle: 2631 Address: DF:A9:FF:F6:B1:1A (OUI DF-A9-FF)
        Count: 1
        #64: len 15 (0 Kb/s)
        Latency: 167 msec (80-172 msec ~135 msec)
> HCI Event: Number of Completed Packets (0x13) plen 5      #69 [hci1] 8.157253
        Num handles: 1
        Handle: 2631 Address: DF:A9:FF:F6:B1:1A (OUI DF-A9-FF)
        Count: 1
        #67: len 21 (1 Kb/s)
        Latency: 155 msec (80-172 msec ~145 msec)
> ACL Data RX: Handle 2631 flags 0x02 dlen 21               #70 [hci1] 8.157688
      SMP: Pairing Random (0x04) len 16
        Random value: ce017ca987de372b0000000000000000
< HCI Command: Host Number of Compl.. (0x03|0x0035) plen 5  #71 [hci1] 8.161980
        Num handles: 1
        Handle: 2631 Address: DF:A9:FF:F6:B1:1A (OUI DF-A9-FF)
        Count: 1
< ACL Data TX: Handle 2631 flags 0x00 dlen 21               #72 [hci1] 8.162149
      SMP: Pairing Random (0x04) len 16
        Random value: 8e6108f966a694cbe26df70bb96773e6
> HCI Event: Number of Completed Packets (0x13) plen 5      #73 [hci1] 8.332096
        Num handles: 1
        Handle: 2631 Address: DF:A9:FF:F6:B1:1A (OUI DF-A9-FF)
        Count: 1
        #72: len 21 (0 Kb/s)
        Latency: 169 msec (80-172 msec ~157 msec)
> ACL Data RX: Handle 2631 flags 0x02 dlen 21               #74 [hci1] 8.507488
      SMP: Pairing DHKey Check (0x0d) len 16
        E: 84783ed5cf59fe28d7f7c8b8147d0bfe
< HCI Command: Host Number of Compl.. (0x03|0x0035) plen 5  #75 [hci1] 8.521431
        Num handles: 1
        Handle: 2631 Address: DF:A9:FF:F6:B1:1A (OUI DF-A9-FF)
        Count: 1
< ACL Data TX: Handle 2631 flags 0x00 dlen 21               #76 [hci1] 8.521456
      SMP: Pairing DHKey Check (0x0d) len 16
        E: 8c49621e2c107a918e796441f432a58f
> HCI Event: Number of Completed Packets (0x13) plen 5      #77 [hci1] 8.682103
        Num handles: 1
        Handle: 2631 Address: DF:A9:FF:F6:B1:1A (OUI DF-A9-FF)
        Count: 1
        #76: len 21 (1 Kb/s)
        Latency: 160 msec (80-172 msec ~159 msec)
> HCI Event: LE Meta Event (0x3e) plen 13                   #78 [hci1] 8.770283
      LE Long Term Key Request (0x05)
        Handle: 2631 Address: DF:A9:FF:F6:B1:1A (OUI DF-A9-FF)
        Random number: 0x0000000000000000
        Encrypted diversifier: 0x0000
< HCI Command: LE Long Term Key Re.. (0x08|0x001a) plen 18  #79 [hci1] 8.781601
        Handle: 2631 Address: DF:A9:FF:F6:B1:1A (OUI DF-A9-FF)
        Long term key: d1651a28d34dd575bc2011c708373bab
> HCI Event: Command Complete (0x0e) plen 6                 #80 [hci1] 8.782366
      LE Long Term Key Request Reply (0x08|0x001a) ncmd 1
        Status: Success (0x00)
        Handle: 2631 Address: DF:A9:FF:F6:B1:1A (OUI DF-A9-FF)
> HCI Event: Encryption Change (0x08) plen 4                #81 [hci1] 9.207350
        Status: Success (0x00)
        Handle: 2631 Address: DF:A9:FF:F6:B1:1A (OUI DF-A9-FF)
        Encryption: Enabled with AES-CCM (0x01)
> ACL Data RX: Handle 2631 flags 0x02 dlen 21               #82 [hci1] 9.294987
      SMP: Identity Information (0x08) len 16
        Identity resolving key: edeec26fda7676a96d3bef296ef4d681
< HCI Command: Host Number of Compl.. (0x03|0x0035) plen 5  #83 [hci1] 9.331870
        Num handles: 1
        Handle: 2631 Address: DF:A9:FF:F6:B1:1A (OUI DF-A9-FF)
        Count: 1
> ACL Data RX: Handle 2631 flags 0x02 dlen 12               #84 [hci1] 9.382242
      SMP: Identity Address Information (0x09) len 7
        Address: DF:A9:FF:F6:B1:1A (OUI DF-A9-FF)
> ACL Data RX: Handle 2631 flags 0x02 dlen 13               #85 [hci1] 9.382842
      ATT: Find By Type Value Request (0x06) len 8
        Handle range: 0x0001-0xffff
        Attribute type: Primary Service (0x2800)
          UUID: Object Transfer (0x1825)
< HCI Command: LE Add Device To Re.. (0x08|0x0027) plen 39  #86 [hci1] 9.401807
        Address type: Public (0x00)
        Address: DF:A9:FF:F6:B1:1A (OUI DF-A9-FF)
        Peer identity resolving key: edeec26fda7676a96d3bef296ef4d681
        Local identity resolving key: 00000000000000000000000000000000
> HCI Event: Command Complete (0x0e) plen 4                 #87 [hci1] 9.402762
      LE Add Device To Resolving List (0x08|0x0027) ncmd 1
        Status: Success (0x00)
< HCI Command: LE Set Privacy Mode (0x08|0x004e) plen 8     #88 [hci1] 9.421220
        Peer Identity address type: Public (0x00)
        Peer Identity address: DF:A9:FF:F6:B1:1A (OUI DF-A9-FF)
        Privacy Mode: Use Device Privacy (0x01)
> HCI Event: Command Complete (0x0e) plen 4                 #89 [hci1] 9.421704
      LE Set Privacy Mode (0x08|0x004e) ncmd 1
        Status: Success (0x00)
< HCI Command: LE Set Address Resol.. (0x08|0x002d) plen 1  #90 [hci1] 9.441334
        Address resolution: Enabled (0x01)
> HCI Event: Command Complete (0x0e) plen 4                 #91 [hci1] 9.441750
      LE Set Address Resolution Enable (0x08|0x002d) ncmd 1
        Status: Success (0x00)
< HCI Command: Host Number of Compl.. (0x03|0x0035) plen 5  #92 [hci1] 9.461300
        Num handles: 1
        Handle: 2631 Address: DF:A9:FF:F6:B1:1A (OUI DF-A9-FF)
        Count: 1
< HCI Command: Host Number of Compl.. (0x03|0x0035) plen 5  #93 [hci1] 9.461472
        Num handles: 1
        Handle: 2631 Address: DF:A9:FF:F6:B1:1A (OUI DF-A9-FF)
        Count: 1
< ACL Data TX: Handle 2631 flags 0x00 dlen 9                #94 [hci1] 9.461478
      ATT: Find By Type Value Response (0x07) len 4
        Handle range: 0x0021-0x0033
> HCI Event: Number of Completed Packets (0x13) plen 5      #95 [hci1] 9.557236
        Num handles: 1
        Handle: 2631 Address: DF:A9:FF:F6:B1:1A (OUI DF-A9-FF)
        Count: 1
        #94: len 9 (0 Kb/s)
        Latency: 95 msec (80-172 msec ~127 msec)
> ACL Data RX: Handle 2631 flags 0x02 dlen 13               #96 [hci1] 9.557558
      ATT: Find By Type Value Request (0x06) len 8
        Handle range: 0x0034-0xffff
        Attribute type: Primary Service (0x2800)
          UUID: Object Transfer (0x1825)
< HCI Command: Host Number of Compl.. (0x03|0x0035) plen 5  #97 [hci1] 9.561431
        Num handles: 1
        Handle: 2631 Address: DF:A9:FF:F6:B1:1A (OUI DF-A9-FF)
        Count: 1
< ACL Data TX: Handle 2631 flags 0x00 dlen 9                #98 [hci1] 9.561563
      ATT: Error Response (0x01) len 4
        Find By Type Value Request (0x06)
        Handle: 0x0034
        Error: Attribute Not Found (0x0a)
> HCI Event: Number of Completed Packets (0x13) plen 5      #99 [hci1] 9.732161
        Num handles: 1
        Handle: 2631 Address: DF:A9:FF:F6:B1:1A (OUI DF-A9-FF)
        Count: 1
        #98: len 9 (0 Kb/s)
        Latency: 170 msec (80-172 msec ~149 msec)
> ACL Data RX: Handle 2631 flags 0x02 dlen 11              #100 [hci1] 9.732461
      ATT: Read By Type Request (0x08) len 6
        Handle range: 0x0021-0x0033
        Attribute type: Characteristic (0x2803)
< HCI Command: Host Number of Comp.. (0x03|0x0035) plen 5  #101 [hci1] 9.741417
        Num handles: 1
        Handle: 2631 Address: DF:A9:FF:F6:B1:1A (OUI DF-A9-FF)
        Count: 1
< ACL Data TX: Handle 2631 flags 0x00 dlen 20              #102 [hci1] 9.741424
      ATT: Read By Type Response (0x09) len 15
        Attribute data length: 7
        Attribute data list: 2 entries
        Handle: 0x0022
        Value: 022300bd2a
            Properties: 0x02
              Read (0x02)
            Value Handle: 0x0023
            Value UUID: OTS Feature (0x2abd)
        Handle: 0x0024
        Value: 0a2500be2a
            Properties: 0x0a
              Read (0x02)
              Write (0x08)
            Value Handle: 0x0025
            Value UUID: Object Name (0x2abe)
> HCI Event: Number of Completed Packets (0x13) plen 5     #103 [hci1] 9.907257
        Num handles: 1
        Handle: 2631 Address: DF:A9:FF:F6:B1:1A (OUI DF-A9-FF)
        Count: 1
        #102: len 20 (0 Kb/s)
        Latency: 165 msec (80-172 msec ~157 msec)
> ACL Data RX: Handle 2631 flags 0x02 dlen 11              #104 [hci1] 9.907472
      ATT: Read By Type Request (0x08) len 6
        Handle range: 0x0025-0x0033
        Attribute type: Characteristic (0x2803)
< HCI Command: Host Number of Comp.. (0x03|0x0035) plen 5  #105 [hci1] 9.921341
        Num handles: 1
        Handle: 2631 Address: DF:A9:FF:F6:B1:1A (OUI DF-A9-FF)
        Count: 1
< ACL Data TX: Handle 2631 flags 0x00 dlen 20              #106 [hci1] 9.921347
      ATT: Read By Type Response (0x09) len 15
        Attribute data length: 7
        Attribute data list: 2 entries
        Handle: 0x0026
        Value: 022700bf2a
            Properties: 0x02
              Read (0x02)
            Value Handle: 0x0027
            Value UUID: Object Type (0x2abf)
        Handle: 0x0028
        Value: 022900c02a
            Properties: 0x02
              Read (0x02)
            Value Handle: 0x0029
            Value UUID: Object Size (0x2ac0)
< ACL Data TX: Handle 2631 flags 0x00 dlen 16             #107 [hci1] 10.031292
      LE L2CAP: Connection Parameter Update Request (0x12) ident 1 len 8
        Min interval: 24
        Max interval: 40
        Peripheral latency: 0
        Timeout multiplier: 42
> HCI Event: Number of Completed Packets (0x13) plen 5    #108 [hci1] 10.082247
        Num handles: 1
        Handle: 2631 Address: DF:A9:FF:F6:B1:1A (OUI DF-A9-FF)
        Count: 1
        #106: len 20 (1 Kb/s)
        Latency: 160 msec (80-172 msec ~159 msec)
> ACL Data RX: Handle 2631 flags 0x02 dlen 11             #109 [hci1] 10.082396
      ATT: Read By Type Request (0x08) len 6
        Handle range: 0x0029-0x0033
        Attribute type: Characteristic (0x2803)
< HCI Command: Host Number of Com.. (0x03|0x0035) plen 5  #110 [hci1] 10.101384
        Num handles: 1
        Handle: 2631 Address: DF:A9:FF:F6:B1:1A (OUI DF-A9-FF)
        Count: 1
< ACL Data TX: Handle 2631 flags 0x00 dlen 20             #111 [hci1] 10.101393
      ATT: Read By Type Response (0x09) len 15
        Attribute data length: 7
        Attribute data list: 2 entries
        Handle: 0x002a
        Value: 022b00c32a
            Properties: 0x02
              Read (0x02)
            Value Handle: 0x002b
            Value UUID: Object ID (0x2ac3)
        Handle: 0x002c
        Value: 022d00c42a
            Properties: 0x02
              Read (0x02)
            Value Handle: 0x002d
            Value UUID: Object Properties (0x2ac4)
> HCI Event: Number of Completed Packets (0x13) plen 5    #112 [hci1] 10.169802
        Num handles: 1
        Handle: 2631 Address: DF:A9:FF:F6:B1:1A (OUI DF-A9-FF)
        Count: 1
        #107: len 16 (0 Kb/s)
        Latency: 138 msec (80-172 msec ~148 msec)
> ACL Data RX: Handle 2631 flags 0x02 dlen 10             #113 [hci1] 10.169923
      LE L2CAP: Connection Parameter Update Response (0x13) ident 1 len 2
        Result: Connection Parameters accepted (0x0000)
< HCI Command: Host Number of Com.. (0x03|0x0035) plen 5  #114 [hci1] 10.182030
        Num handles: 1
        Handle: 2631 Address: DF:A9:FF:F6:B1:1A (OUI DF-A9-FF)
        Count: 1
> HCI Event: Number of Completed Packets (0x13) plen 5    #115 [hci1] 10.257260
        Num handles: 1
        Handle: 2631 Address: DF:A9:FF:F6:B1:1A (OUI DF-A9-FF)
        Count: 1
        #111: len 20 (1 Kb/s)
        Latency: 155 msec (80-172 msec ~152 msec)
> ACL Data RX: Handle 2631 flags 0x02 dlen 11             #116 [hci1] 10.257442
      ATT: Read By Type Request (0x08) len 6
        Handle range: 0x002d-0x0033
        Attribute type: Characteristic (0x2803)
< HCI Command: Host Number of Com.. (0x03|0x0035) plen 5  #117 [hci1] 10.261396
        Num handles: 1
        Handle: 2631 Address: DF:A9:FF:F6:B1:1A (OUI DF-A9-FF)
        Count: 1
< ACL Data TX: Handle 2631 flags 0x00 dlen 20             #118 [hci1] 10.261434
      ATT: Read By Type Response (0x09) len 15
        Attribute data length: 7
        Attribute data list: 2 entries
        Handle: 0x002e
        Value: 282f00c52a
            Properties: 0x28
              Write (0x08)
              Indicate (0x20)
            Value Handle: 0x002f
            Value UUID: Object Action Control Point (0x2ac5)
        Handle: 0x0031
        Value: 283200c62a
            Properties: 0x28
              Write (0x08)
              Indicate (0x20)
            Value Handle: 0x0032
            Value UUID: Object List Control Point (0x2ac6)
> HCI Event: Number of Completed Packets (0x13) plen 5    #119 [hci1] 10.432166
        Num handles: 1
        Handle: 2631 Address: DF:A9:FF:F6:B1:1A (OUI DF-A9-FF)
        Count: 1
        #118: len 20 (0 Kb/s)
        Latency: 170 msec (80-172 msec ~161 msec)
> ACL Data RX: Handle 2631 flags 0x02 dlen 11             #120 [hci1] 10.432436
      ATT: Read By Type Request (0x08) len 6
        Handle range: 0x0032-0x0033
        Attribute type: Characteristic (0x2803)
< HCI Command: Host Number of Com.. (0x03|0x0035) plen 5  #121 [hci1] 10.441471
        Num handles: 1
        Handle: 2631 Address: DF:A9:FF:F6:B1:1A (OUI DF-A9-FF)
        Count: 1
< ACL Data TX: Handle 2631 flags 0x00 dlen 9              #122 [hci1] 10.441582
      ATT: Error Response (0x01) len 4
        Read By Type Request (0x08)
        Handle: 0x0032
        Error: Attribute Not Found (0x0a)
> HCI Event: Number of Completed Packets (0x13) plen 5    #123 [hci1] 10.607274
        Num handles: 1
        Handle: 2631 Address: DF:A9:FF:F6:B1:1A (OUI DF-A9-FF)
        Count: 1
        #122: len 9 (0 Kb/s)
        Latency: 165 msec (80-172 msec ~163 msec)
> ACL Data RX: Handle 2631 flags 0x02 dlen 9              #124 [hci1] 10.607448
      ATT: Find Information Request (0x04) len 4
        Handle range: 0x0030-0x0030
< HCI Command: Host Number of Com.. (0x03|0x0035) plen 5  #125 [hci1] 10.621359
        Num handles: 1
        Handle: 2631 Address: DF:A9:FF:F6:B1:1A (OUI DF-A9-FF)
        Count: 1
< ACL Data TX: Handle 2631 flags 0x00 dlen 10             #126 [hci1] 10.621366
      ATT: Find Information Response (0x05) len 5
        Format: UUID-16 (0x01)
        Handle: 0x0030
        UUID: Client Characteristic Configuration (0x2902)
> HCI Event: Number of Completed Packets (0x13) plen 5    #127 [hci1] 10.782200
        Num handles: 1
        Handle: 2631 Address: DF:A9:FF:F6:B1:1A (OUI DF-A9-FF)
        Count: 1
        #126: len 10 (0 Kb/s)
        Latency: 160 msec (80-172 msec ~162 msec)
> ACL Data RX: Handle 2631 flags 0x02 dlen 9              #128 [hci1] 10.782379
      ATT: Find Information Request (0x04) len 4
        Handle range: 0x0033-0x0033
< HCI Command: Host Number of Com.. (0x03|0x0035) plen 5  #129 [hci1] 10.801520
        Num handles: 1
        Handle: 2631 Address: DF:A9:FF:F6:B1:1A (OUI DF-A9-FF)
        Count: 1
< ACL Data TX: Handle 2631 flags 0x00 dlen 10             #130 [hci1] 10.801560
      ATT: Find Information Response (0x05) len 5
        Format: UUID-16 (0x01)
        Handle: 0x0033
        UUID: Client Characteristic Configuration (0x2902)
> HCI Event: Number of Completed Packets (0x13) plen 5    #131 [hci1] 10.957195
        Num handles: 1
        Handle: 2631 Address: DF:A9:FF:F6:B1:1A (OUI DF-A9-FF)
        Count: 1
        #130: len 10 (0 Kb/s)
        Latency: 155 msec (80-172 msec ~158 msec)
> ACL Data RX: Handle 2631 flags 0x02 dlen 7              #132 [hci1] 10.957339
      ATT: Read Request (0x0a) len 2
        Handle: 0x0023
< HCI Command: Host Number of Com.. (0x03|0x0035) plen 5  #133 [hci1] 10.961467
        Num handles: 1
        Handle: 2631 Address: DF:A9:FF:F6:B1:1A (OUI DF-A9-FF)
        Count: 1
< ACL Data TX: Handle 2631 flags 0x00 dlen 13             #134 [hci1] 10.961479
      ATT: Read Response (0x0b) len 8
> HCI Event: Number of Completed Packets (0x13) plen 5    #135 [hci1] 11.132175
        Num handles: 1
        Handle: 2631 Address: DF:A9:FF:F6:B1:1A (OUI DF-A9-FF)
        Count: 1
        #134: len 13 (0 Kb/s)
        Latency: 170 msec (80-172 msec ~164 msec)
> ACL Data RX: Handle 2631 flags 0x02 dlen 13             #136 [hci1] 11.132470
      ATT: Find By Type Value Request (0x06) len 8
        Handle range: 0x0001-0xffff
        Attribute type: Primary Service (0x2800)
          UUID: Object Transfer (0x1825)
< HCI Command: Host Number of Com.. (0x03|0x0035) plen 5  #137 [hci1] 11.141997
        Num handles: 1
        Handle: 2631 Address: DF:A9:FF:F6:B1:1A (OUI DF-A9-FF)
        Count: 1
< ACL Data TX: Handle 2631 flags 0x00 dlen 9              #138 [hci1] 11.142105
      ATT: Find By Type Value Response (0x07) len 4
        Handle range: 0x0021-0x0033
> HCI Event: Number of Completed Packets (0x13) plen 5    #139 [hci1] 11.307219
        Num handles: 1
        Handle: 2631 Address: DF:A9:FF:F6:B1:1A (OUI DF-A9-FF)
        Count: 1
        #138: len 9 (0 Kb/s)
        Latency: 165 msec (80-172 msec ~164 msec)
> ACL Data RX: Handle 2631 flags 0x02 dlen 13             #140 [hci1] 11.307497
      ATT: Find By Type Value Request (0x06) len 8
        Handle range: 0x0034-0xffff
        Attribute type: Primary Service (0x2800)
          UUID: Object Transfer (0x1825)
< HCI Command: Host Number of Com.. (0x03|0x0035) plen 5  #141 [hci1] 11.322011
        Num handles: 1
        Handle: 2631 Address: DF:A9:FF:F6:B1:1A (OUI DF-A9-FF)
        Count: 1
< ACL Data TX: Handle 2631 flags 0x00 dlen 9              #142 [hci1] 11.322149
      ATT: Error Response (0x01) len 4
        Find By Type Value Request (0x06)
        Handle: 0x0034
        Error: Attribute Not Found (0x0a)
> HCI Event: Number of Completed Packets (0x13) plen 5    #143 [hci1] 11.482227
        Num handles: 1
        Handle: 2631 Address: DF:A9:FF:F6:B1:1A (OUI DF-A9-FF)
        Count: 1
        #142: len 9 (0 Kb/s)
        Latency: 160 msec (80-172 msec ~162 msec)
> ACL Data RX: Handle 2631 flags 0x02 dlen 11             #144 [hci1] 11.482479
      ATT: Read By Type Request (0x08) len 6
        Handle range: 0x0021-0x0033
        Attribute type: Characteristic (0x2803)
< HCI Command: Host Number of Com.. (0x03|0x0035) plen 5  #145 [hci1] 11.501440
        Num handles: 1
        Handle: 2631 Address: DF:A9:FF:F6:B1:1A (OUI DF-A9-FF)
        Count: 1
< ACL Data TX: Handle 2631 flags 0x00 dlen 20             #146 [hci1] 11.501513
      ATT: Read By Type Response (0x09) len 15
        Attribute data length: 7
        Attribute data list: 2 entries
        Handle: 0x0022
        Value: 022300bd2a
            Properties: 0x02
              Read (0x02)
            Value Handle: 0x0023
            Value UUID: OTS Feature (0x2abd)
        Handle: 0x0024
        Value: 0a2500be2a
            Properties: 0x0a
              Read (0x02)
              Write (0x08)
            Value Handle: 0x0025
            Value UUID: Object Name (0x2abe)
> HCI Event: Number of Completed Packets (0x13) plen 5    #147 [hci1] 11.657238
        Num handles: 1
        Handle: 2631 Address: DF:A9:FF:F6:B1:1A (OUI DF-A9-FF)
        Count: 1
        #146: len 20 (1 Kb/s)
        Latency: 155 msec (80-172 msec ~159 msec)
> ACL Data RX: Handle 2631 flags 0x02 dlen 11             #148 [hci1] 11.657402
      ATT: Read By Type Request (0x08) len 6
        Handle range: 0x0025-0x0033
        Attribute type: Characteristic (0x2803)
< HCI Command: Host Number of Com.. (0x03|0x0035) plen 5  #149 [hci1] 11.661973
        Num handles: 1
        Handle: 2631 Address: DF:A9:FF:F6:B1:1A (OUI DF-A9-FF)
        Count: 1
< ACL Data TX: Handle 2631 flags 0x00 dlen 20             #150 [hci1] 11.662132
      ATT: Read By Type Response (0x09) len 15
        Attribute data length: 7
        Attribute data list: 2 entries
        Handle: 0x0026
        Value: 022700bf2a
            Properties: 0x02
              Read (0x02)
            Value Handle: 0x0027
            Value UUID: Object Type (0x2abf)
        Handle: 0x0028
        Value: 022900c02a
            Properties: 0x02
              Read (0x02)
            Value Handle: 0x0029
            Value UUID: Object Size (0x2ac0)
> HCI Event: Number of Completed Packets (0x13) plen 5    #151 [hci1] 11.832193
        Num handles: 1
        Handle: 2631 Address: DF:A9:FF:F6:B1:1A (OUI DF-A9-FF)
        Count: 1
        #150: len 20 (0 Kb/s)
        Latency: 170 msec (80-172 msec ~164 msec)
> ACL Data RX: Handle 2631 flags 0x02 dlen 11             #152 [hci1] 11.832488
      ATT: Read By Type Request (0x08) len 6
        Handle range: 0x0029-0x0033
        Attribute type: Characteristic (0x2803)
< HCI Command: Host Number of Com.. (0x03|0x0035) plen 5  #153 [hci1] 11.841657
        Num handles: 1
        Handle: 2631 Address: DF:A9:FF:F6:B1:1A (OUI DF-A9-FF)
        Count: 1
< ACL Data TX: Handle 2631 flags 0x00 dlen 20             #154 [hci1] 11.841740
      ATT: Read By Type Response (0x09) len 15
        Attribute data length: 7
        Attribute data list: 2 entries
        Handle: 0x002a
        Value: 022b00c32a
            Properties: 0x02
              Read (0x02)
            Value Handle: 0x002b
            Value UUID: Object ID (0x2ac3)
        Handle: 0x002c
        Value: 022d00c42a
            Properties: 0x02
              Read (0x02)
            Value Handle: 0x002d
            Value UUID: Object Properties (0x2ac4)
> HCI Event: Number of Completed Packets (0x13) plen 5    #155 [hci1] 12.007181
        Num handles: 1
        Handle: 2631 Address: DF:A9:FF:F6:B1:1A (OUI DF-A9-FF)
        Count: 1
        #154: len 20 (0 Kb/s)
        Latency: 165 msec (80-172 msec ~165 msec)
> ACL Data RX: Handle 2631 flags 0x02 dlen 11             #156 [hci1] 12.007400
      ATT: Read By Type Request (0x08) len 6
        Handle range: 0x002d-0x0033
        Attribute type: Characteristic (0x2803)
< HCI Command: Host Number of Com.. (0x03|0x0035) plen 5  #157 [hci1] 12.021823
        Num handles: 1
        Handle: 2631 Address: DF:A9:FF:F6:B1:1A (OUI DF-A9-FF)
        Count: 1
< ACL Data TX: Handle 2631 flags 0x00 dlen 20             #158 [hci1] 12.021898
      ATT: Read By Type Response (0x09) len 15
        Attribute data length: 7
        Attribute data list: 2 entries
        Handle: 0x002e
        Value: 282f00c52a
            Properties: 0x28
              Write (0x08)
              Indicate (0x20)
            Value Handle: 0x002f
            Value UUID: Object Action Control Point (0x2ac5)
        Handle: 0x0031
        Value: 283200c62a
            Properties: 0x28
              Write (0x08)
              Indicate (0x20)
            Value Handle: 0x0032
            Value UUID: Object List Control Point (0x2ac6)
> HCI Event: Number of Completed Packets (0x13) plen 5    #159 [hci1] 12.182186
        Num handles: 1
        Handle: 2631 Address: DF:A9:FF:F6:B1:1A (OUI DF-A9-FF)
        Count: 1
        #158: len 20 (1 Kb/s)
        Latency: 160 msec (80-172 msec ~162 msec)
> ACL Data RX: Handle 2631 flags 0x02 dlen 11             #160 [hci1] 12.182494
      ATT: Read By Type Request (0x08) len 6
        Handle range: 0x0032-0x0033
        Attribute type: Characteristic (0x2803)
< HCI Command: Host Number of Com.. (0x03|0x0035) plen 5  #161 [hci1] 12.201880
        Num handles: 1
        Handle: 2631 Address: DF:A9:FF:F6:B1:1A (OUI DF-A9-FF)
        Count: 1
< ACL Data TX: Handle 2631 flags 0x00 dlen 9              #162 [hci1] 12.201964
      ATT: Error Response (0x01) len 4
        Read By Type Request (0x08)
        Handle: 0x0032
        Error: Attribute Not Found (0x0a)
> HCI Event: Number of Completed Packets (0x13) plen 5    #163 [hci1] 12.357217
        Num handles: 1
        Handle: 2631 Address: DF:A9:FF:F6:B1:1A (OUI DF-A9-FF)
        Count: 1
        #162: len 9 (0 Kb/s)
        Latency: 155 msec (80-172 msec ~158 msec)
> ACL Data RX: Handle 2631 flags 0x02 dlen 9              #164 [hci1] 12.357351
      ATT: Find Information Request (0x04) len 4
        Handle range: 0x0030-0x0030
< HCI Command: Host Number of Com.. (0x03|0x0035) plen 5  #165 [hci1] 12.361595
        Num handles: 1
        Handle: 2631 Address: DF:A9:FF:F6:B1:1A (OUI DF-A9-FF)
        Count: 1
< ACL Data TX: Handle 2631 flags 0x00 dlen 10             #166 [hci1] 12.361638
      ATT: Find Information Response (0x05) len 5
        Format: UUID-16 (0x01)
        Handle: 0x0030
        UUID: Client Characteristic Configuration (0x2902)
> HCI Event: Number of Completed Packets (0x13) plen 5    #167 [hci1] 12.532135
        Num handles: 1
        Handle: 2631 Address: DF:A9:FF:F6:B1:1A (OUI DF-A9-FF)
        Count: 1
        #166: len 10 (0 Kb/s)
        Latency: 170 msec (80-172 msec ~164 msec)
> ACL Data RX: Handle 2631 flags 0x02 dlen 9              #168 [hci1] 12.532361
      ATT: Find Information Request (0x04) len 4
        Handle range: 0x0033-0x0033
< HCI Command: Host Number of Com.. (0x03|0x0035) plen 5  #169 [hci1] 12.541596
        Num handles: 1
        Handle: 2631 Address: DF:A9:FF:F6:B1:1A (OUI DF-A9-FF)
        Count: 1
< ACL Data TX: Handle 2631 flags 0x00 dlen 10             #170 [hci1] 12.541633
      ATT: Find Information Response (0x05) len 5
        Format: UUID-16 (0x01)
        Handle: 0x0033
        UUID: Client Characteristic Configuration (0x2902)
> HCI Event: Number of Completed Packets (0x13) plen 5    #171 [hci1] 12.707136
        Num handles: 1
        Handle: 2631 Address: DF:A9:FF:F6:B1:1A (OUI DF-A9-FF)
        Count: 1
        #170: len 10 (0 Kb/s)
        Latency: 165 msec (80-172 msec ~165 msec)
> ACL Data RX: Handle 2631 flags 0x02 dlen 7              #172 [hci1] 12.707325
      ATT: Read Request (0x0a) len 2
        Handle: 0x0023
< HCI Command: Host Number of Com.. (0x03|0x0035) plen 5  #173 [hci1] 12.721918
        Num handles: 1
        Handle: 2631 Address: DF:A9:FF:F6:B1:1A (OUI DF-A9-FF)
        Count: 1
< ACL Data TX: Handle 2631 flags 0x00 dlen 13             #174 [hci1] 12.722027
      ATT: Read Response (0x0b) len 8
> HCI Event: Number of Completed Packets (0x13) plen 5    #175 [hci1] 12.882196
        Num handles: 1
        Handle: 2631 Address: DF:A9:FF:F6:B1:1A (OUI DF-A9-FF)
        Count: 1
        #174: len 13 (0 Kb/s)
        Latency: 160 msec (80-172 msec ~162 msec)
> ACL Data RX: Handle 2631 flags 0x02 dlen 9              #176 [hci1] 12.882352
      ATT: Write Request (0x12) len 4
        Handle: 0x0030
          Data: 0000
< HCI Command: Host Number of Com.. (0x03|0x0035) plen 5  #177 [hci1] 12.901811
        Num handles: 1
        Handle: 2631 Address: DF:A9:FF:F6:B1:1A (OUI DF-A9-FF)
        Count: 1
< ACL Data TX: Handle 2631 flags 0x00 dlen 5              #178 [hci1] 12.901910
      ATT: Write Response (0x13) len 0
> HCI Event: Number of Completed Packets (0x13) plen 5    #179 [hci1] 13.057172
        Num handles: 1
        Handle: 2631 Address: DF:A9:FF:F6:B1:1A (OUI DF-A9-FF)
        Count: 1
        #178: len 5 (0 Kb/s)
        Latency: 155 msec (80-172 msec ~158 msec)
> ACL Data RX: Handle 2631 flags 0x02 dlen 9              #180 [hci1] 13.057366
      ATT: Write Request (0x12) len 4
        Handle: 0x0030
          Data: 0200
< HCI Command: Host Number of Com.. (0x03|0x0035) plen 5  #181 [hci1] 13.061427
        Num handles: 1
        Handle: 2631 Address: DF:A9:FF:F6:B1:1A (OUI DF-A9-FF)
        Count: 1
< ACL Data TX: Handle 2631 flags 0x00 dlen 5              #182 [hci1] 13.061478
      ATT: Write Response (0x13) len 0
> HCI Event: Number of Completed Packets (0x13) plen 5    #183 [hci1] 13.232126
        Num handles: 1
        Handle: 2631 Address: DF:A9:FF:F6:B1:1A (OUI DF-A9-FF)
        Count: 1
        #182: len 5 (0 Kb/s)
        Latency: 170 msec (80-172 msec ~164 msec)
> ACL Data RX: Handle 2631 flags 0x02 dlen 9              #184 [hci1] 13.232395
      ATT: Write Request (0x12) len 4
        Handle: 0x0033
          Data: 0000
< HCI Command: Host Number of Com.. (0x03|0x0035) plen 5  #185 [hci1] 13.241850
        Num handles: 1
        Handle: 2631 Address: DF:A9:FF:F6:B1:1A (OUI DF-A9-FF)
        Count: 1
< ACL Data TX: Handle 2631 flags 0x00 dlen 5              #186 [hci1] 13.241972
      ATT: Write Response (0x13) len 0
> HCI Event: Number of Completed Packets (0x13) plen 5    #187 [hci1] 13.407152
        Num handles: 1
        Handle: 2631 Address: DF:A9:FF:F6:B1:1A (OUI DF-A9-FF)
        Count: 1
        #186: len 5 (0 Kb/s)
        Latency: 165 msec (80-172 msec ~164 msec)
> ACL Data RX: Handle 2631 flags 0x02 dlen 9              #188 [hci1] 13.407349
      ATT: Write Request (0x12) len 4
        Handle: 0x0033
          Data: 0200
< HCI Command: Host Number of Com.. (0x03|0x0035) plen 5  #189 [hci1] 13.421911
        Num handles: 1
        Handle: 2631 Address: DF:A9:FF:F6:B1:1A (OUI DF-A9-FF)
        Count: 1
< ACL Data TX: Handle 2631 flags 0x00 dlen 5              #190 [hci1] 13.422002
      ATT: Write Response (0x13) len 0
> HCI Event: Number of Completed Packets (0x13) plen 5    #191 [hci1] 13.582113
        Num handles: 1
        Handle: 2631 Address: DF:A9:FF:F6:B1:1A (OUI DF-A9-FF)
        Count: 1
        #190: len 5 (0 Kb/s)
        Latency: 160 msec (80-172 msec ~162 msec)
> ACL Data RX: Handle 2631 flags 0x02 dlen 9              #192 [hci1] 13.582388
      ATT: Write Request (0x12) len 4
        Handle: 0x0033
          Data: 0000
< HCI Command: Host Number of Com.. (0x03|0x0035) plen 5  #193 [hci1] 13.601827
        Num handles: 1
        Handle: 2631 Address: DF:A9:FF:F6:B1:1A (OUI DF-A9-FF)
        Count: 1
< ACL Data TX: Handle 2631 flags 0x00 dlen 5              #194 [hci1] 13.601874
      ATT: Write Response (0x13) len 0
> HCI Event: Number of Completed Packets (0x13) plen 5    #195 [hci1] 13.757215
        Num handles: 1
        Handle: 2631 Address: DF:A9:FF:F6:B1:1A (OUI DF-A9-FF)
        Count: 1
        #194: len 5 (0 Kb/s)
        Latency: 155 msec (80-172 msec ~158 msec)
> ACL Data RX: Handle 2631 flags 0x02 dlen 9              #196 [hci1] 13.757414
      ATT: Write Request (0x12) len 4
        Handle: 0x0033
          Data: 0200
< HCI Command: Host Number of Com.. (0x03|0x0035) plen 5  #197 [hci1] 13.761938
        Num handles: 1
        Handle: 2631 Address: DF:A9:FF:F6:B1:1A (OUI DF-A9-FF)
        Count: 1
< ACL Data TX: Handle 2631 flags 0x00 dlen 5              #198 [hci1] 13.762148
      ATT: Write Response (0x13) len 0
> HCI Event: Number of Completed Packets (0x13) plen 5    #199 [hci1] 13.932166
        Num handles: 1
        Handle: 2631 Address: DF:A9:FF:F6:B1:1A (OUI DF-A9-FF)
        Count: 1
        #198: len 5 (0 Kb/s)
        Latency: 170 msec (80-172 msec ~164 msec)
> ACL Data RX: Handle 2631 flags 0x02 dlen 18             #200 [hci1] 13.932518
      LE L2CAP: LE Connection Request (0x14) ident 1 len 10
        PSM: 37 (0x0025)
        Source CID: 84
        MTU: 1024
        MPS: 32
        Credits: 3
< HCI Command: Host Number of Com.. (0x03|0x0035) plen 5  #201 [hci1] 13.941900
        Num handles: 1
        Handle: 2631 Address: DF:A9:FF:F6:B1:1A (OUI DF-A9-FF)
        Count: 1
< ACL Data TX: Handle 2631 flags 0x00 dlen 18             #202 [hci1] 13.942015
      LE L2CAP: LE Connection Response (0x15) ident 1 len 10
        Destination CID: 64
        MTU: 255
        MPS: 251
        Credits: 1
        Result: Connection successful (0x0000)
> HCI Event: Number of Completed Packets (0x13) plen 5    #203 [hci1] 14.107112
        Num handles: 1
        Handle: 2631 Address: DF:A9:FF:F6:B1:1A (OUI DF-A9-FF)
        Count: 1
        #202: len 18 (0 Kb/s)
        Latency: 165 msec (80-172 msec ~164 msec)
> ACL Data RX: Handle 2631 flags 0x02 dlen 8              #204 [hci1] 14.107347
      ATT: Write Request (0x12) len 3
        Handle: 0x0032
          Data: 01
< HCI Command: Host Number of Com.. (0x03|0x0035) plen 5  #205 [hci1] 14.122112
        Num handles: 1
        Handle: 2631 Address: DF:A9:FF:F6:B1:1A (OUI DF-A9-FF)
        Count: 1
< ACL Data TX: Handle 2631 flags 0x00 dlen 5              #206 [hci1] 14.122326
      ATT: Write Response (0x13) len 0
< ACL Data TX: Handle 2631 flags 0x00 dlen 10             #207 [hci1] 14.122382
      ATT: Handle Value Indication (0x1d) len 5
        Handle: 0x0032
          Data: 700101
> HCI Event: Number of Completed Packets (0x13) plen 5    #208 [hci1] 14.195015
        Num handles: 1
        Handle: 2631 Address: DF:A9:FF:F6:B1:1A (OUI DF-A9-FF)
        Count: 1
        #206: len 5 (0 Kb/s)
        Latency: 72 msec (72-172 msec ~118 msec)
> HCI Event: Number of Completed Packets (0x13) plen 5    #209 [hci1] 14.282138
        Num handles: 1
        Handle: 2631 Address: DF:A9:FF:F6:B1:1A (OUI DF-A9-FF)
        Count: 1
        #207: len 10 (0 Kb/s)
        Latency: 159 msec (72-172 msec ~139 msec)
> ACL Data RX: Handle 2631 flags 0x02 dlen 5              #210 [hci1] 14.282206
      ATT: Handle Value Confirmation (0x1e) len 0
> ACL Data RX: Handle 2631 flags 0x02 dlen 7              #211 [hci1] 14.282611
      ATT: Read Request (0x0a) len 2
        Handle: 0x0025
< HCI Command: Host Number of Com.. (0x03|0x0035) plen 5  #212 [hci1] 14.301552
        Num handles: 1
        Handle: 2631 Address: DF:A9:FF:F6:B1:1A (OUI DF-A9-FF)
        Count: 1
< HCI Command: Host Number of Com.. (0x03|0x0035) plen 5  #213 [hci1] 14.301665
        Num handles: 1
        Handle: 2631 Address: DF:A9:FF:F6:B1:1A (OUI DF-A9-FF)
        Count: 1
< ACL Data TX: Handle 2631 flags 0x00 dlen 14             #214 [hci1] 14.301669
      ATT: Read Response (0x0b) len 9
> HCI Event: Number of Completed Packets (0x13) plen 5    #215 [hci1] 14.457160
        Num handles: 1
        Handle: 2631 Address: DF:A9:FF:F6:B1:1A (OUI DF-A9-FF)
        Count: 1
        #214: len 14 (0 Kb/s)
        Latency: 155 msec (72-172 msec ~147 msec)
> ACL Data RX: Handle 2631 flags 0x02 dlen 7              #216 [hci1] 14.457349
      ATT: Read Request (0x0a) len 2
        Handle: 0x0027
< HCI Command: Host Number of Com.. (0x03|0x0035) plen 5  #217 [hci1] 14.462027
        Num handles: 1
        Handle: 2631 Address: DF:A9:FF:F6:B1:1A (OUI DF-A9-FF)
        Count: 1
< ACL Data TX: Handle 2631 flags 0x00 dlen 7              #218 [hci1] 14.462130
      ATT: Read Response (0x0b) len 2
> HCI Event: Number of Completed Packets (0x13) plen 5    #219 [hci1] 14.632173
        Num handles: 1
        Handle: 2631 Address: DF:A9:FF:F6:B1:1A (OUI DF-A9-FF)
        Count: 1
        #218: len 7 (0 Kb/s)
        Latency: 170 msec (72-172 msec ~158 msec)
> ACL Data RX: Handle 2631 flags 0x02 dlen 7              #220 [hci1] 14.632313
      ATT: Read Request (0x0a) len 2
        Handle: 0x0029
< HCI Command: Host Number of Com.. (0x03|0x0035) plen 5  #221 [hci1] 14.641794
        Num handles: 1
        Handle: 2631 Address: DF:A9:FF:F6:B1:1A (OUI DF-A9-FF)
        Count: 1
< ACL Data TX: Handle 2631 flags 0x00 dlen 13             #222 [hci1] 14.641853
      ATT: Read Response (0x0b) len 8
> HCI Event: Number of Completed Packets (0x13) plen 5    #223 [hci1] 14.807143
        Num handles: 1
        Handle: 2631 Address: DF:A9:FF:F6:B1:1A (OUI DF-A9-FF)
        Count: 1
        #222: len 13 (0 Kb/s)
        Latency: 165 msec (72-172 msec ~161 msec)
> ACL Data RX: Handle 2631 flags 0x02 dlen 7              #224 [hci1] 14.807299
      ATT: Read Request (0x0a) len 2
        Handle: 0x002d
< HCI Command: Host Number of Com.. (0x03|0x0035) plen 5  #225 [hci1] 14.821564
        Num handles: 1
        Handle: 2631 Address: DF:A9:FF:F6:B1:1A (OUI DF-A9-FF)
        Count: 1
< ACL Data TX: Handle 2631 flags 0x00 dlen 9              #226 [hci1] 14.821592
      ATT: Read Response (0x0b) len 4
> HCI Event: Number of Completed Packets (0x13) plen 5    #227 [hci1] 14.982099
        Num handles: 1
        Handle: 2631 Address: DF:A9:FF:F6:B1:1A (OUI DF-A9-FF)
        Count: 1
        #226: len 9 (0 Kb/s)
        Latency: 160 msec (72-172 msec ~161 msec)
> ACL Data RX: Handle 2631 flags 0x02 dlen 7              #228 [hci1] 14.982243
      ATT: Read Request (0x0a) len 2
        Handle: 0x002b
< HCI Command: Host Number of Com.. (0x03|0x0035) plen 5  #229 [hci1] 15.001603
        Num handles: 1
        Handle: 2631 Address: DF:A9:FF:F6:B1:1A (OUI DF-A9-FF)
        Count: 1
< ACL Data TX: Handle 2631 flags 0x00 dlen 11             #230 [hci1] 15.001613
      ATT: Read Response (0x0b) len 6
> HCI Event: Number of Completed Packets (0x13) plen 5    #231 [hci1] 15.157133
        Num handles: 1
        Handle: 2631 Address: DF:A9:FF:F6:B1:1A (OUI DF-A9-FF)
        Count: 1
        #230: len 11 (0 Kb/s)
        Latency: 155 msec (72-172 msec ~158 msec)
> ACL Data RX: Handle 2631 flags 0x02 dlen 8              #232 [hci1] 15.157273
      ATT: Write Request (0x12) len 3
        Handle: 0x0032
          Data: 04
< HCI Command: Host Number of Com.. (0x03|0x0035) plen 5  #233 [hci1] 15.161863
        Num handles: 1
        Handle: 2631 Address: DF:A9:FF:F6:B1:1A (OUI DF-A9-FF)
        Count: 1
< ACL Data TX: Handle 2631 flags 0x00 dlen 5              #234 [hci1] 15.162088
      ATT: Write Response (0x13) len 0
< ACL Data TX: Handle 2631 flags 0x00 dlen 10             #235 [hci1] 15.162261
      ATT: Handle Value Indication (0x1d) len 5
        Handle: 0x0032
          Data: 700401
> HCI Event: Number of Completed Packets (0x13) plen 5    #236 [hci1] 15.245022
        Num handles: 1
        Handle: 2631 Address: DF:A9:FF:F6:B1:1A (OUI DF-A9-FF)
        Count: 1
        #234: len 5 (0 Kb/s)
        Latency: 82 msec (72-172 msec ~120 msec)
> HCI Event: Number of Completed Packets (0x13) plen 5    #237 [hci1] 15.332040
        Num handles: 1
        Handle: 2631 Address: DF:A9:FF:F6:B1:1A (OUI DF-A9-FF)
        Count: 1
        #235: len 10 (0 Kb/s)
        Latency: 169 msec (72-172 msec ~145 msec)
> ACL Data RX: Handle 2631 flags 0x02 dlen 5              #238 [hci1] 15.332204
      ATT: Handle Value Confirmation (0x1e) len 0
> ACL Data RX: Handle 2631 flags 0x02 dlen 7              #239 [hci1] 15.332579
      ATT: Read Request (0x0a) len 2
        Handle: 0x0025
< HCI Command: Host Number of Com.. (0x03|0x0035) plen 5  #240 [hci1] 15.341445
        Num handles: 1
        Handle: 2631 Address: DF:A9:FF:F6:B1:1A (OUI DF-A9-FF)
        Count: 1
< HCI Command: Host Number of Com.. (0x03|0x0035) plen 5  #241 [hci1] 15.341563
        Num handles: 1
        Handle: 2631 Address: DF:A9:FF:F6:B1:1A (OUI DF-A9-FF)
        Count: 1
< ACL Data TX: Handle 2631 flags 0x00 dlen 27             #242 [hci1] 15.341570
      ATT: Read Response (0x0b) len 22
> HCI Event: Number of Completed Packets (0x13) plen 5    #243 [hci1] 15.507080
        Num handles: 1
        Handle: 2631 Address: DF:A9:FF:F6:B1:1A (OUI DF-A9-FF)
        Count: 1
        #242: len 27 (1 Kb/s)
        Latency: 165 msec (72-172 msec ~155 msec)
> ACL Data RX: Handle 2631 flags 0x02 dlen 9              #244 [hci1] 15.507321
      ATT: Read Blob Request (0x0c) len 4
        Handle: 0x0025
        Offset: 0x0016
< HCI Command: Host Number of Com.. (0x03|0x0035) plen 5  #245 [hci1] 15.521748
        Num handles: 1
        Handle: 2631 Address: DF:A9:FF:F6:B1:1A (OUI DF-A9-FF)
        Count: 1
< ACL Data TX: Handle 2631 flags 0x00 dlen 11             #246 [hci1] 15.521846
      ATT: Read Blob Response (0x0d) len 6
        67 20 6e 61 6d 65                                g name          
> HCI Event: Number of Completed Packets (0x13) plen 5    #247 [hci1] 15.682064
        Num handles: 1
        Handle: 2631 Address: DF:A9:FF:F6:B1:1A (OUI DF-A9-FF)
        Count: 1
        #246: len 11 (0 Kb/s)
        Latency: 160 msec (72-172 msec ~157 msec)
> ACL Data RX: Handle 2631 flags 0x02 dlen 7              #248 [hci1] 15.682321
      ATT: Read Request (0x0a) len 2
        Handle: 0x0027
< HCI Command: Host Number of Com.. (0x03|0x0035) plen 5  #249 [hci1] 15.701616
        Num handles: 1
        Handle: 2631 Address: DF:A9:FF:F6:B1:1A (OUI DF-A9-FF)
        Count: 1
< ACL Data TX: Handle 2631 flags 0x00 dlen 7              #250 [hci1] 15.701667
      ATT: Read Response (0x0b) len 2
> HCI Event: Number of Completed Packets (0x13) plen 5    #251 [hci1] 15.857136
        Num handles: 1
        Handle: 2631 Address: DF:A9:FF:F6:B1:1A (OUI DF-A9-FF)
        Count: 1
        #250: len 7 (0 Kb/s)
        Latency: 155 msec (72-172 msec ~156 msec)
> ACL Data RX: Handle 2631 flags 0x02 dlen 7              #252 [hci1] 15.857309
      ATT: Read Request (0x0a) len 2
        Handle: 0x0029
< HCI Command: Host Number of Com.. (0x03|0x0035) plen 5  #253 [hci1] 15.861542
        Num handles: 1
        Handle: 2631 Address: DF:A9:FF:F6:B1:1A (OUI DF-A9-FF)
        Count: 1
< ACL Data TX: Handle 2631 flags 0x00 dlen 13             #254 [hci1] 15.861595
      ATT: Read Response (0x0b) len 8
> HCI Event: Number of Completed Packets (0x13) plen 5    #255 [hci1] 16.032110
        Num handles: 1
        Handle: 2631 Address: DF:A9:FF:F6:B1:1A (OUI DF-A9-FF)
        Count: 1
        #254: len 13 (0 Kb/s)
        Latency: 170 msec (72-172 msec ~163 msec)
> ACL Data RX: Handle 2631 flags 0x02 dlen 7              #256 [hci1] 16.032246
      ATT: Read Request (0x0a) len 2
        Handle: 0x002d
< HCI Command: Host Number of Com.. (0x03|0x0035) plen 5  #257 [hci1] 16.041575
        Num handles: 1
        Handle: 2631 Address: DF:A9:FF:F6:B1:1A (OUI DF-A9-FF)
        Count: 1
< ACL Data TX: Handle 2631 flags 0x00 dlen 9              #258 [hci1] 16.041609
      ATT: Read Response (0x0b) len 4
> HCI Event: Number of Completed Packets (0x13) plen 5    #259 [hci1] 16.207081
        Num handles: 1
        Handle: 2631 Address: DF:A9:FF:F6:B1:1A (OUI DF-A9-FF)
        Count: 1
        #258: len 9 (0 Kb/s)
        Latency: 165 msec (72-172 msec ~164 msec)
> ACL Data RX: Handle 2631 flags 0x02 dlen 7              #260 [hci1] 16.207347
      ATT: Read Request (0x0a) len 2
        Handle: 0x002b
< HCI Command: Host Number of Com.. (0x03|0x0035) plen 5  #261 [hci1] 16.221982
        Num handles: 1
        Handle: 2631 Address: DF:A9:FF:F6:B1:1A (OUI DF-A9-FF)
        Count: 1
< ACL Data TX: Handle 2631 flags 0x00 dlen 11             #262 [hci1] 16.222091
      ATT: Read Response (0x0b) len 6
> HCI Event: Number of Completed Packets (0x13) plen 5    #263 [hci1] 16.382170
        Num handles: 1
        Handle: 2631 Address: DF:A9:FF:F6:B1:1A (OUI DF-A9-FF)
        Count: 1
        #262: len 11 (0 Kb/s)
        Latency: 160 msec (72-172 msec ~162 msec)
> ACL Data RX: Handle 2631 flags 0x02 dlen 17             #264 [hci1] 16.382434
      ATT: Write Request (0x12) len 12
        Handle: 0x002f
          Data: 06200000002000000000
< HCI Command: Host Number of Com.. (0x03|0x0035) plen 5  #265 [hci1] 16.401544
        Num handles: 1
        Handle: 2631 Address: DF:A9:FF:F6:B1:1A (OUI DF-A9-FF)
        Count: 1
< ACL Data TX: Handle 2631 flags 0x00 dlen 5              #266 [hci1] 16.401644
      ATT: Write Response (0x13) len 0
< ACL Data TX: Handle 2631 flags 0x00 dlen 10             #267 [hci1] 16.401741
      ATT: Handle Value Indication (0x1d) len 5
        Handle: 0x002f
          Data: 600601
> HCI Event: Number of Completed Packets (0x13) plen 5    #268 [hci1] 16.470056
        Num handles: 1
        Handle: 2631 Address: DF:A9:FF:F6:B1:1A (OUI DF-A9-FF)
        Count: 1
        #266: len 5 (0 Kb/s)
        Latency: 68 msec (68-172 msec ~115 msec)
> HCI Event: Number of Completed Packets (0x13) plen 5    #269 [hci1] 16.557153
        Num handles: 1
        Handle: 2631 Address: DF:A9:FF:F6:B1:1A (OUI DF-A9-FF)
        Count: 1
        #267: len 10 (0 Kb/s)
        Latency: 155 msec (68-172 msec ~135 msec)
> ACL Data RX: Handle 2631 flags 0x02 dlen 5              #270 [hci1] 16.557233
      ATT: Handle Value Confirmation (0x1e) len 0
> ACL Data RX: Handle 2631 flags 0x02 dlen 27             #271 [hci1] 16.557967
> ACL Data RX: Handle 2631 flags 0x01 dlen 11             #272 [hci1] 16.558369
      Channel: 64 len 34 sdu 32 [PSM 37 mode LE Flow Control (0x80)] {chan 0}
        20 00 20 1f 1e 1d 1c 1b 1a 19 18 17 16 15 14 13   . .............
        12 11 10 0f 0e 0d 0c 0b 0a 09 08 07 06 05 04 03  ................
        02 01                                            ..              
< HCI Command: Host Number of Com.. (0x03|0x0035) plen 5  #273 [hci1] 16.561788
        Num handles: 1
        Handle: 2631 Address: DF:A9:FF:F6:B1:1A (OUI DF-A9-FF)
        Count: 1
< HCI Command: Host Number of Com.. (0x03|0x0035) plen 5  #274 [hci1] 16.561979
        Num handles: 1
        Handle: 2631 Address: DF:A9:FF:F6:B1:1A (OUI DF-A9-FF)
        Count: 1
< HCI Command: Host Number of Com.. (0x03|0x0035) plen 5  #275 [hci1] 16.562089
        Num handles: 1
        Handle: 2631 Address: DF:A9:FF:F6:B1:1A (OUI DF-A9-FF)
        Count: 1
< ACL Data TX: Handle 2631 flags 0x00 dlen 12             #276 [hci1] 16.562185
      LE L2CAP: LE Flow Control Credit (0x16) ident 2 len 4
        Source CID: 64
        Credits: 1
> HCI Event: Number of Completed Packets (0x13) plen 5    #277 [hci1] 16.732064
        Num handles: 1
        Handle: 2631 Address: DF:A9:FF:F6:B1:1A (OUI DF-A9-FF)
        Count: 1
        #276: len 12 (0 Kb/s)
        Latency: 169 msec (68-172 msec ~152 msec)
> ACL Data RX: Handle 2631 flags 0x02 dlen 16             #278 [hci1] 21.719663
      ATT: Write Request (0x12) len 11
        Handle: 0x002f
          Data: 050000000040000000
< HCI Command: Host Number of Com.. (0x03|0x0035) plen 5  #279 [hci1] 21.721544
        Num handles: 1
        Handle: 2631 Address: DF:A9:FF:F6:B1:1A (OUI DF-A9-FF)
        Count: 1
< ACL Data TX: Handle 2631 flags 0x00 dlen 5              #280 [hci1] 21.721689
      ATT: Write Response (0x13) len 0
< ACL Data TX: Handle 2631 flags 0x00 dlen 10             #281 [hci1] 21.721794
      ATT: Handle Value Indication (0x1d) len 5
        Handle: 0x002f
          Data: 600501
> HCI Event: Number of Completed Packets (0x13) plen 5    #282 [hci1] 21.807370
        Num handles: 1
        Handle: 2631 Address: DF:A9:FF:F6:B1:1A (OUI DF-A9-FF)
        Count: 1
        #280: len 5 (0 Kb/s)
        Latency: 85 msec (68-172 msec ~119 msec)
> HCI Event: Number of Completed Packets (0x13) plen 5    #283 [hci1] 21.894590
        Num handles: 1
        Handle: 2631 Address: DF:A9:FF:F6:B1:1A (OUI DF-A9-FF)
        Count: 1
        #281: len 10 (0 Kb/s)
        Latency: 172 msec (68-172 msec ~145 msec)
> ACL Data RX: Handle 2631 flags 0x02 dlen 5              #284 [hci1] 21.894692
      ATT: Handle Value Confirmation (0x1e) len 0
< HCI Command: Host Number of Com.. (0x03|0x0035) plen 5  #285 [hci1] 21.901810
        Num handles: 1
        Handle: 2631 Address: DF:A9:FF:F6:B1:1A (OUI DF-A9-FF)
        Count: 1
< ACL Data TX: Handle 2631 flags 0x00 dlen 27             #286 [hci1] 21.901847
< ACL Data TX: Handle 2631 flags 0x01 dlen 9              #287 [hci1] 21.901860
      Channel: 84 len 32 sdu 64 [PSM 37 mode LE Flow Control (0x80)] {chan 0}
        40 00 00 00 00 00 00 00 00 00 00 00 00 00 00 00  @...............
        00 00 00 00 00 00 00 00 00 00 00 00 00 00 00 00  ................
< ACL Data TX: Handle 2631 flags 0x00 dlen 27             #288 [hci1] 21.901908
> HCI Event: Number of Completed Packets (0x13) plen 5    #289 [hci1] 21.982564
        Num handles: 1
        Handle: 2631 Address: DF:A9:FF:F6:B1:1A (OUI DF-A9-FF)
        Count: 1
        #286: len 27 (2 Kb/s)
        Latency: 80 msec (68-172 msec ~113 msec)
        Channel: 84 [PSM 37 mode LE Flow Control (0x80)] {chan 0}
        Channel Latency: 80 msec (80-80 msec ~80 msec)
> HCI Event: Number of Completed Packets (0x13) plen 5    #290 [hci1] 21.983067
        Num handles: 1
        Handle: 2631 Address: DF:A9:FF:F6:B1:1A (OUI DF-A9-FF)
        Count: 1
        #287: len 9 (0 Kb/s)
        Latency: 81 msec (68-172 msec ~97 msec)
< ACL Data TX: Handle 2631 flags 0x01 dlen 9              #291 [hci1] 22.001529
      Channel: 84 len 32 sdu 34 [PSM 37 mode LE Flow Control (0x80)] {chan 0}
        00 00 20 1f 1e 1d 1c 1b 1a 19 18 17 16 15 14 13  .. .............
        12 11 10 0f 0e 0d 0c 0b 0a 09 08 07 06 05 04 03  ................
< ACL Data TX: Handle 2631 flags 0x00 dlen 6              #292 [hci1] 22.001539
      Channel: 84 len 2 sdu 2 [PSM 37 mode LE Flow Control (0x80)] {chan 0}
        02 01                                            ..              
> HCI Event: Number of Completed Packets (0x13) plen 5    #293 [hci1] 22.069518
        Num handles: 1
        Handle: 2631 Address: DF:A9:FF:F6:B1:1A (OUI DF-A9-FF)
        Count: 1
        #288: len 27 (1 Kb/s)
        Latency: 167 msec (68-172 msec ~132 msec)
        Channel: 84 [PSM 37 mode LE Flow Control (0x80)] {chan 0}
        Channel Latency: 167 msec (80-167 msec ~124 msec)
> ACL Data RX: Handle 2631 flags 0x02 dlen 12             #294 [hci1] 22.069723
      LE L2CAP: LE Flow Control Credit (0x16) ident 2 len 4
        Source CID: 84
        Credits: 1
> HCI Event: Number of Completed Packets (0x13) plen 5    #295 [hci1] 22.070142
        Num handles: 1
        Handle: 2631 Address: DF:A9:FF:F6:B1:1A (OUI DF-A9-FF)
        Count: 1
        #291: len 9 (1 Kb/s)
        Latency: 68 msec (68-172 msec ~100 msec)
        Channel: 84 [PSM 37 mode LE Flow Control (0x80)] {chan 0}
        Channel Latency: 68 msec (68-167 msec ~96 msec)
< HCI Command: Host Number of Com.. (0x03|0x0035) plen 5  #296 [hci1] 22.081642
        Num handles: 1
        Handle: 2631 Address: DF:A9:FF:F6:B1:1A (OUI DF-A9-FF)
        Count: 1
> HCI Event: Number of Completed Packets (0x13) plen 5    #297 [hci1] 22.157168
        Num handles: 1
        Handle: 2631 Address: DF:A9:FF:F6:B1:1A (OUI DF-A9-FF)
        Count: 1
        #292: len 6 (0 Kb/s)
        Latency: 155 msec (68-172 msec ~128 msec)
> ACL Data RX: Handle 2631 flags 0x02 dlen 12             #298 [hci1] 22.157296
      LE L2CAP: LE Flow Control Credit (0x16) ident 3 len 4
        Source CID: 84
        Credits: 1
> ACL Data RX: Handle 2631 flags 0x02 dlen 16             #299 [hci1] 22.157758
      ATT: Write Request (0x12) len 11
        Handle: 0x002f
          Data: 030000000040000000
< HCI Command: Host Number of Com.. (0x03|0x0035) plen 5  #300 [hci1] 22.162128
        Num handles: 1
        Handle: 2631 Address: DF:A9:FF:F6:B1:1A (OUI DF-A9-FF)
        Count: 1
< HCI Command: Host Number of Com.. (0x03|0x0035) plen 5  #301 [hci1] 22.162364
        Num handles: 1
        Handle: 2631 Address: DF:A9:FF:F6:B1:1A (OUI DF-A9-FF)
        Count: 1
< ACL Data TX: Handle 2631 flags 0x00 dlen 5              #302 [hci1] 22.162607
      ATT: Write Response (0x13) len 0
< ACL Data TX: Handle 2631 flags 0x00 dlen 14             #303 [hci1] 22.162718
      ATT: Handle Value Indication (0x1d) len 9
        Handle: 0x002f
          Data: 600301f3a60026
> HCI Event: Number of Completed Packets (0x13) plen 5    #304 [hci1] 22.244862
        Num handles: 1
        Handle: 2631 Address: DF:A9:FF:F6:B1:1A (OUI DF-A9-FF)
        Count: 1
        #302: len 5 (0 Kb/s)
        Latency: 82 msec (68-172 msec ~105 msec)
> HCI Event: Number of Completed Packets (0x13) plen 5    #305 [hci1] 22.332090
        Num handles: 1
        Handle: 2631 Address: DF:A9:FF:F6:B1:1A (OUI DF-A9-FF)
        Count: 1
        #303: len 14 (0 Kb/s)
        Latency: 169 msec (68-172 msec ~137 msec)
> ACL Data RX: Handle 2631 flags 0x02 dlen 5              #306 [hci1] 22.332095
      ATT: Handle Value Confirmation (0x1e) len 0
> ACL Data RX: Handle 2631 flags 0x02 dlen 12             #307 [hci1] 22.332578
      LE L2CAP: Disconnection Request (0x06) ident 4 len 4
        Destination CID: 64
        Source CID: 84
< HCI Command: Host Number of Com.. (0x03|0x0035) plen 5  #308 [hci1] 22.341861
        Num handles: 1
        Handle: 2631 Address: DF:A9:FF:F6:B1:1A (OUI DF-A9-FF)
        Count: 1
< HCI Command: Host Number of Com.. (0x03|0x0035) plen 5  #309 [hci1] 22.342271
        Num handles: 1
        Handle: 2631 Address: DF:A9:FF:F6:B1:1A (OUI DF-A9-FF)
        Count: 1
< ACL Data TX: Handle 2631 flags 0x00 dlen 12             #310 [hci1] 22.342325
      LE L2CAP: Disconnection Response (0x07) ident 4 len 4
        Destination CID: 64
        Source CID: 84
> HCI Event: Number of Completed Packets (0x13) plen 5    #311 [hci1] 22.506897
        Num handles: 1
        Handle: 2631 Address: DF:A9:FF:F6:B1:1A (OUI DF-A9-FF)
        Count: 1
        #310: len 12 (0 Kb/s)
        Latency: 164 msec (68-172 msec ~150 msec)
> HCI Event: Disconnect Complete (0x05) plen 4            #312 [hci1] 23.907136
        Status: Success (0x00)
        Handle: 2631 Address: DF:A9:FF:F6:B1:1A (OUI DF-A9-FF)
        Reason: Remote User Terminated Connection (0x13)
< HCI Command: Reset (0x03|0x0003) plen 0                 #313 [hci1] 31.381616
> HCI Event: Command Complete (0x0e) plen 4               #314 [hci1] 31.382139
      Reset (0x03|0x0003) ncmd 1
        Status: Success (0x00)
@ USER Close: main                                    {0x0001} [hci1] 31.401529
= Close Index: 00:00:00:00:00:00                               [hci1] 31.401540
