Bluetooth monitor ver 5.72
= Note: Linux version 6.14.0-36-generic (x86_64)                       0.083822
= Note: Bluetooth subsystem version 2.22                               0.083824
= New Index: 00:00:00:00:00:00 (Primary,UART,hci1)              [hci1] 0.083825
= New Index: 48:5F:99:8E:E0:64 (Primary,USB,hci0)               [hci0] 0.083825
= Open Index: 00:00:00:00:00:00                                 [hci1] 0.597556
= Index Info: 00:00:00:00:00:00 (Nordic Semiconductor ASA)      [hci1] 0.597575
@ USER Open: main (privileged) version 2.22            {0x0001} [hci1] 0.597583
< HCI Command: Reset (0x03|0x0003) plen 0                    #1 [hci1] 0.598723
> HCI Event: Command Complete (0x0e) plen 4                  #2 [hci1] 0.599302
      Reset (0x03|0x0003) ncmd 1
        Status: Success (0x00)
< HCI Command: Read Local Supported... (0x04|0x0003) plen 0  #3 [hci1] 0.617383
> HCI Event: Command Complete (0x0e) plen 12                 #4 [hci1] 0.617963
      Read Local Supported Features (0x04|0x0003) ncmd 1
        Status: Success (0x00)
        Features: 0x00 0x00 0x00 0x00 0x60 0x00 0x00 0x00
          BR/EDR Not Supported
          LE Supported (Controller)
< HCI Command: Read Local Version In.. (0x04|0x0001) plen 0  #5 [hci1] 0.637086
> HCI Event: Command Complete (0x0e) plen 12                 #6 [hci1] 0.637555
      Read Local Version Information (0x04|0x0001) ncmd 1
        Status: Success (0x00)
        HCI version: Reserved (0x0f) - Revision 12393 (0x3069)
        LMP version: Reserved (0x0f) - Subversion 12393 (0x3069)
        Manufacturer: Nordic Semiconductor ASA (89)
< HCI Command: Read Local Supported... (0x04|0x0002) plen 0  #7 [hci1] 0.656976
> HCI Event: Command Complete (0x0e) plen 68                 #8 [hci1] 0.658028
      Read Local Supported Commands (0x04|0x0002) ncmd 1
        Status: Success (0x00)
        Commands: 119 entries
          Disconnect (Octet 0 - Bit 5)
          Read Remote Version Information (Octet 2 - Bit 7)
          Set Event Mask (Octet 5 - Bit 6)
          Reset (Octet 5 - Bit 7)
          Read Connection Accept Timeout (Octet 7 - Bit 2)
          Write Connection Accept Timeout (Octet 7 - Bit 3)
          Read Transmit Power Level (Octet 10 - Bit 2)
          Set Controller To Host Flow Control (Octet 10 - Bit 5)
          Host Buffer Size (Octet 10 - Bit 6)
          Host Number of Completed Packets (Octet 10 - Bit 7)
          Read Local Version Information (Octet 14 - Bit 3)
          Read Local Supported Features (Octet 14 - Bit 5)
          Read BD ADDR (Octet 15 - Bit 1)
          Read RSSI (Octet 15 - Bit 5)
          Set Event Mask Page 2 (Octet 22 - Bit 2)
          LE Set Event Mask (Octet 25 - Bit 0)
          LE Read Buffer Size (Octet 25 - Bit 1)
          LE Read Local Supported Features (Octet 25 - Bit 2)
          LE Set Random Address (Octet 25 - Bit 4)
          LE Set Advertising Parameters (Octet 25 - Bit 5)
          LE Read Advertising Channel TX Power (Octet 25 - Bit 6)
          LE Set Advertising Data (Octet 25 - Bit 7)
          LE Set Scan Response Data (Octet 26 - Bit 0)
          LE Set Advertise Enable (Octet 26 - Bit 1)
          LE Set Scan Parameters (Octet 26 - Bit 2)
          LE Set Scan Enable (Octet 26 - Bit 3)
          LE Create Connection (Octet 26 - Bit 4)
          LE Create Connection Cancel (Octet 26 - Bit 5)
          LE Read Accept List Size (Octet 26 - Bit 6)
          LE Clear Accept List (Octet 26 - Bit 7)
          LE Add Device To Accept List (Octet 27 - Bit 0)
          LE Remove Device From Accept List (Octet 27 - Bit 1)
          LE Connection Update (Octet 27 - Bit 2)
          LE Set Host Channel Classification (Octet 27 - Bit 3)
          LE Read Channel Map (Octet 27 - Bit 4)
          LE Read Remote Used Features (Octet 27 - Bit 5)
          LE Encrypt (Octet 27 - Bit 6)
          LE Rand (Octet 27 - Bit 7)
          LE Start Encryption (Octet 28 - Bit 0)
          LE Long Term Key Request Reply (Octet 28 - Bit 1)
          LE Long Term Key Request Neg Reply (Octet 28 - Bit 2)
          LE Read Supported States (Octet 28 - Bit 3)
          LE Receiver Test (Octet 28 - Bit 4)
          LE Transmitter Test (Octet 28 - Bit 5)
          LE Test End (Octet 28 - Bit 6)
          Read Authenticated Payload Timeout (Octet 32 - Bit 4)
          Write Authenticated Payload Timeout (Octet 32 - Bit 5)
          LE Set Data Length (Octet 33 - Bit 6)
          LE Read Suggested Default Data Length (Octet 33 - Bit 7)
          LE Write Suggested Default Data Length (Octet 34 - Bit 0)
          LE Add Device To Resolving List (Octet 34 - Bit 3)
          LE Remove Device From Resolving List (Octet 34 - Bit 4)
          LE Clear Resolving List (Octet 34 - Bit 5)
          LE Read Resolving List Size (Octet 34 - Bit 6)
          LE Set Address Resolution Enable (Octet 35 - Bit 1)
          LE Set Resolvable Private Address Timeout (Octet 35 - Bit 2)
          LE Read Maximum Data Length (Octet 35 - Bit 3)
          LE Read PHY (Octet 35 - Bit 4)
          LE Set Default PHY (Octet 35 - Bit 5)
          LE Set PHY (Octet 35 - Bit 6)
          LE Enhanced Receiver Test (Octet 35 - Bit 7)
          LE Enhanced Transmitter Test (Octet 36 - Bit 0)
          LE Set Advertising Set Random Address (Octet 36 - Bit 1)
          LE Set Extended Advertising Parameters (Octet 36 - Bit 2)
          LE Set Extended Advertising Data (Octet 36 - Bit 3)
          LE Set Extended Scan Response Data (Octet 36 - Bit 4)
          LE Set Extended Advertising Enable (Octet 36 - Bit 5)
          LE Read Maximum Advertising Data Length (Octet 36 - Bit 6)
          LE Read Number of Supported Advertising Sets (Octet 36 - Bit 7)
          LE Remove Advertising Set (Octet 37 - Bit 0)
          LE Clear Advertising Sets (Octet 37 - Bit 1)
          LE Set Periodic Advertising Parameters (Octet 37 - Bit 2)
          LE Set Periodic Advertising Data (Octet 37 - Bit 3)
          LE Set Periodic Advertising Enable (Octet 37 - Bit 4)
          LE Set Extended Scan Parameters (Octet 37 - Bit 5)
          LE Set Extended Scan Enable (Octet 37 - Bit 6)
          LE Extended Create Connection (Octet 37 - Bit 7)
          LE Periodic Advertising Create Sync (Octet 38 - Bit 0)
          LE Periodic Advertising Create Sync Cancel (Octet 38 - Bit 1)
          LE Periodic Advertising Terminate Sync (Octet 38 - Bit 2)
          LE Add Device To Periodic Advertiser List (Octet 38 - Bit 3)
          LE Remove Device From Periodic Advertiser List (Octet 38 - Bit 4)
          LE Clear Periodic Advertiser List (Octet 38 - Bit 5)
          LE Read Periodic Advertiser List Size (Octet 38 - Bit 6)
          LE Read Transmit Power (Octet 38 - Bit 7)
          LE Read RF Path Compensation (Octet 39 - Bit 0)
          LE Write RF Path Compensation (Octet 39 - Bit 1)
          LE Set Privacy Mode (Octet 39 - Bit 2)
          LE Periodic Advertising Receive Enable (Octet 40 - Bit 5)
          LE Periodic Advertising Sync Transfer (Octet 40 - Bit 6)
          LE Periodic Advertising Set Info Transfer (Octet 40 - Bit 7)
          LE Periodic Advertising Sync Transfer Parameters (Octet 41 - Bit 0)
          LE Set Default Periodic Advertisng Sync Transfer Parameters (Octet 41 - Bit 1)
          LE Read Buffer v2 (Octet 41 - Bit 5)
          LE Read ISO TX Sync (Octet 41 - Bit 6)
          LE Set Connected Isochronous Group Parameters (Octet 41 - Bit 7)
          LE Set Connected Isochronous Group Parameters Test (Octet 42 - Bit 0)
          LE Create Connected Isochronous Stream (Octet 42 - Bit 1)
          LE Remove Connected Isochronous Group (Octet 42 - Bit 2)
          LE Accept Connected Isochronous Stream Request (Octet 42 - Bit 3)
          LE Reject Connected Isochronous Stream Request (Octet 42 - Bit 4)
          LE Create Broadcast Isochronous Group (Octet 42 - Bit 5)
          LE Create Broadcast Isochronous Group Test (Octet 42 - Bit 6)
          LE Terminate Broadcast Isochronous Group (Octet 42 - Bit 7)
          LE Broadcast Isochronous Group Create Sync (Octet 43 - Bit 0)
          LE Broadcast Isochronous Group Terminate Sync (Octet 43 - Bit 1)
          LE Request Peer SCA (Octet 43 - Bit 2)
          LE Setup Isochronous Data Path (Octet 43 - Bit 3)
          LE Remove Isochronous Data Path (Octet 43 - Bit 4)
          LE Isochronous Transmit Test (Octet 43 - Bit 5)
          LE Isochronous Receive Test (Octet 43 - Bit 6)
          LE Isochronous Read Test Counters (Octet 43 - Bit 7)
          LE Isochronous Read Test Counters (Octet 44 - Bit 0)
          LE Set Host Feature (Octet 44 - Bit 1)
          Octet 44 - Bit 2 
          Octet 45 - Bit 6 
          Octet 46 - Bit 0 
          Octet 46 - Bit 1 
          Octet 46 - Bit 2 
< HCI Command: Host Buffer Size (0x03|0x0033) plen 7         #9 [hci1] 0.676970
        ACL MTU: 255  ACL max packet: 16
        SCO MTU: 0    SCO max packet: 0
> HCI Event: Command Complete (0x0e) plen 4                 #10 [hci1] 0.677473
      Host Buffer Size (0x03|0x0033) ncmd 1
        Status: Success (0x00)
< HCI Command: Set Controller To Ho.. (0x03|0x0031) plen 1  #11 [hci1] 0.696942
        Flow control: ACL Data Packets (0x01)
> HCI Event: Command Complete (0x0e) plen 4                 #12 [hci1] 0.697327
      Set Controller To Host Flow Control (0x03|0x0031) ncmd 1
        Status: Success (0x00)
< HCI Command: LE Read Local Suppor.. (0x08|0x0003) plen 0  #13 [hci1] 0.716973
> HCI Event: Command Complete (0x0e) plen 12                #14 [hci1] 0.717475
      LE Read Local Supported Features (0x08|0x0003) ncmd 1
        Status: Success (0x00)
        Features: 0xfd 0x79 0x00 0xf7 0x30 0x01 0x00 0x00
          LE Encryption
          Extended Reject Indication
          Peripheral-initiated Features Exchange
          LE Ping
          LE Data Packet Length Extension
          LL Privacy
          Extended Scanner Filter Policies
          LE 2M PHY
          LE Coded PHY
          LE Extended Advertising
          LE Periodic Advertising
          Channel Selection Algorithm #2
          Periodic Advertising Sync Transfer - Sender
          Periodic Advertising Sync Transfer - Recipient
          Sleep Clock Accuracy Updates
          Connected Isochronous Stream - Central
          Connected Isochronous Stream - Peripheral
          Isochronous Broadcaster
          Synchronized Receiver
          Periodic Advertising ADI support
          Connection Subrating
          Unknown features (0x0000010000000000)
< HCI Command: LE Set Host Feature (0x08|0x0074) plen 2     #15 [hci1] 0.736977
        Bit Number: 32
          Connected Isochronous Stream (Host Support)
        Bit Value: 1
> HCI Event: Command Complete (0x0e) plen 4                 #16 [hci1] 0.737442
      LE Set Host Feature (0x08|0x0074) ncmd 1
        Status: Success (0x00)
< HCI Command: LE Read Buffer v2 (0x08|0x0060) plen 0       #17 [hci1] 0.756994
> HCI Event: Command Complete (0x0e) plen 10                #18 [hci1] 0.757505
      LE Read Buffer v2 (0x08|0x0060) ncmd 1
        Status: Success (0x00)
        ACL MTU: 27
        ACL max packet: 3
        ISO MTU: 318
        ISO max packet: 3
< HCI Command: LE Read Maximum Adve.. (0x08|0x003a) plen 0  #19 [hci1] 0.777000
> HCI Event: Command Complete (0x0e) plen 6                 #20 [hci1] 0.777493
      LE Read Maximum Advertising Data Length (0x08|0x003a) ncmd 1
        Status: Success (0x00)
        Max length: 1650
< HCI Command: LE Read Supported St.. (0x08|0x001c) plen 0  #21 [hci1] 0.796950
> HCI Event: Command Complete (0x0e) plen 12                #22 [hci1] 0.797421
      LE Read Supported States (0x08|0x001c) ncmd 1
        Status: Success (0x00)
        States: 0x000003ff3e0306ff
          Non-connectable Advertising State
          Scannable Advertising State
          Connectable Advertising State
          High Duty Cycle Directed Advertising State
          Passive Scanning State
          Active Scanning State
          Initiating State
            and Connection State (Central Role)
          Connection State (Peripheral Role)
          Scannable Advertising State
            and Passive Scanning State
          Connectable Advertising State
            and Passive Scanning State
          Non-connectable Advertising State
            and Initiating State
          Scannable Advertising State
            and Initiating State
          Active Scanning State
            and Connection State (Central Role)
          Passive Scanning State
            and Connection State (Peripheral Role)
          Active Scanning State
            and Connection State (Peripheral Role)
          Initiating State
            and Connection State (Central Role)
            and Central Role & Central Role
          Low Duty Cycle Directed Advertising State
          Connectable Advertising State
            and Initiating State
            and Central Role & Peripheral Role
          High Duty Cycle Directed Advertising State
            and Initiating State
            and Central Role & Peripheral Role
          Low Duty Cycle Directed Advertising State
            and Initiating State
            and Central Role & Peripheral Role
          Connectable Advertising State
            and Connection State (Central Role)
            and Central Role & Peripheral Role
          High Duty Cycle Directed Advertising State
            and Connection State (Central Role)
            and Central Role & Peripheral Role
          Low Duty Cycle Directed Advertising State
            and Connection State (Central Role)
            and Central Role & Peripheral Role
          Connectable Advertising State
            and Connection State (Peripheral Role)
            and Central Role & Peripheral Role
          High Duty Cycle Directed Advertising State
            and Connection State (Peripheral Role)
            and Peripheral Role & Peripheral Role
          Low Duty Cycle Directed Advertising State
            and Connection State (Peripheral Role)
            and Peripheral Role & Peripheral Role
          Initiating State
            and Connection State (Peripheral Role)
            and Central Role & Peripheral Role
< HCI Command: LE Read Maximum Data.. (0x08|0x002f) plen 0  #23 [hci1] 0.817004
> HCI Event: Command Complete (0x0e) plen 12                #24 [hci1] 0.817536
      LE Read Maximum Data Length (0x08|0x002f) ncmd 1
        Status: Success (0x00)
        Max TX octets: 251
        Max TX time: 2704
        Max RX octets: 251
        Max RX time: 2704
< HCI Command: LE Write Suggested D.. (0x08|0x0024) plen 4  #25 [hci1] 0.836983
        TX octets: 251
        TX time: 2704
> HCI Event: Command Complete (0x0e) plen 4                 #26 [hci1] 0.837409
      LE Write Suggested Default Data Length (0x08|0x0024) ncmd 1
        Status: Success (0x00)
< HCI Command: LE Read Resolving Li.. (0x08|0x002a) plen 0  #27 [hci1] 0.856976
> HCI Event: Command Complete (0x0e) plen 5                 #28 [hci1] 0.857425
      LE Read Resolving List Size (0x08|0x002a) ncmd 1
        Status: Success (0x00)
        Size: 8
< HCI Command: LE Set Event Mask (0x08|0x0001) plen 8       #29 [hci1] 0.876961
        Mask: 0x000002023f87fa5e
          LE Advertising Report
          LE Connection Update Complete
          LE Read Remote Used Features Complete
          LE Long Term Key Request
          LE Data Length Change
          LE Enhanced Connection Complete
          LE PHY Update Complete
          LE Extended Advertising Report
          LE Periodic Advertising Sync Established
          LE Periodic Advertising Report
          LE Periodic Advertising Sync Lost
          LE Extended Scan Timeout
          LE Extended Advertising Set Terminated
          LE Scan Request Received
          LE Periodic Advertising Sync Transfer Rvc
          LE CIS Established
          LE CIS Request
          LE Create BIG Complete
          LE Terminate BIG Complete
          LE BIG Sync Estabilished Complete
          LE BIG Sync Lost
          LE BIG Info Advertising Report
          Unknown mask (0x0000020000000000)
> HCI Event: Command Complete (0x0e) plen 4                 #30 [hci1] 0.877473
      LE Set Event Mask (0x08|0x0001) ncmd 1
        Status: Success (0x00)
< HCI Command: Set Event Mask (0x03|0x0001) plen 8          #31 [hci1] 0.896978
        Mask: 0x2000800002008890
          Disconnection Complete
          Encryption Change
          Read Remote Version Information Complete
          Hardware Error
          Data Buffer Overflow
          Encryption Key Refresh Complete
          LE Meta
> HCI Event: Command Complete (0x0e) plen 4                 #32 [hci1] 0.897491
      Set Event Mask (0x03|0x0001) ncmd 1
        Status: Success (0x00)
< HCI Command: Read BD ADDR (0x04|0x0009) plen 0            #33 [hci1] 0.916973
> HCI Event: Command Complete (0x0e) plen 10                #34 [hci1] 0.917393
      Read BD ADDR (0x04|0x0009) ncmd 1
        Status: Success (0x00)
        Address: 00:00:00:00:00:00 (OUI 00-00-00)
< HCI Command: LE Set Random Address (0x08|0x0005) plen 6   #35 [hci1] 0.936984
        Address: D5:B6:CC:31:DB:3B (Static)
> HCI Event: Command Complete (0x0e) plen 4                 #36 [hci1] 0.937538
      LE Set Random Address (0x08|0x0005) ncmd 1
        Status: Success (0x00)
< HCI Command: LE Set Extended Adv.. (0x08|0x0036) plen 25  #37 [hci1] 3.527528
        Handle: 0x00
        Properties: 0x0013
          Connectable
          Scannable
          Use legacy advertising PDUs: ADV_IND
        Min advertising interval: 100.000 msec (0x00a0)
        Max advertising interval: 150.000 msec (0x00f0)
        Channel map: 37, 38, 39 (0x07)
        Own address type: Random (0x01)
        Peer address type: Public (0x00)
        Peer address: 00:00:00:00:00:00 (OUI 00-00-00)
        Filter policy: Allow Scan Request from Any, Allow Connect Request from Any (0x00)
        TX power: Host has no preference (0x7f)
        Primary PHY: LE 1M (0x01)
        Secondary max skip: 0x00
        Secondary PHY: LE 1M (0x01)
        SID: 0x00
        Scan request notifications: Disabled (0x00)
> HCI Event: Command Complete (0x0e) plen 5                 #38 [hci1] 3.528354
      LE Set Extended Advertising Parameters (0x08|0x0036) ncmd 1
        Status: Success (0x00)
        TX power (selected): 0 dbm (0x00)
< HCI Command: LE Set Advertising S.. (0x08|0x0035) plen 7  #39 [hci1] 3.537339
        Advertising handle: 0x00
        Advertising random address: D5:B6:CC:31:DB:3B (Static)
> HCI Event: Command Complete (0x0e) plen 4                 #40 [hci1] 3.537910
      LE Set Advertising Set Random Address (0x08|0x0035) ncmd 1
        Status: Success (0x00)
< HCI Command: LE Set Extended Adv.. (0x08|0x0037) plen 22  #41 [hci1] 3.557118
        Handle: 0x00
        Operation: Complete extended advertising data (0x03)
        Fragment preference: Minimize fragmentation (0x01)
        Data length: 0x12
        Flags: 0x06
          LE General Discoverable Mode
          BR/EDR Not Supported
        Name (complete): Tester_F6B11A
> HCI Event: Command Complete (0x0e) plen 4                 #42 [hci1] 3.558012
      LE Set Extended Advertising Data (0x08|0x0037) ncmd 1
        Status: Success (0x00)
< HCI Command: LE Set Extended Scan.. (0x08|0x0038) plen 4  #43 [hci1] 3.576975
        Handle: 0x00
        Operation: Complete scan response data (0x03)
        Fragment preference: Minimize fragmentation (0x01)
        Data length: 0x00
> HCI Event: Command Complete (0x0e) plen 4                 #44 [hci1] 3.577482
      LE Set Extended Scan Response Data (0x08|0x0038) ncmd 1
        Status: Success (0x00)
< HCI Command: LE Set Extended Adve.. (0x08|0x0039) plen 6  #45 [hci1] 3.597020
        Extended advertising: Enabled (0x01)
        Number of sets: 1 (0x01)
        Entry 0
          Handle: 0x00
          Duration: 0 ms (0x00)
          Max ext adv events: 0
> HCI Event: Command Complete (0x0e) plen 4                 #46 [hci1] 3.597620
      LE Set Extended Advertising Enable (0x08|0x0039) ncmd 1
        Status: Success (0x00)
> HCI Event: LE Meta Event (0x3e) plen 31                   #47 [hci1] 3.704589
      LE Enhanced Connection Complete (0x0a)
        Status: Success (0x00)
        Handle: 327
        Role: Peripheral (0x01)
        Peer address type: Public (0x00)
        Peer address: DF:A9:FF:F6:B1:1A (OUI DF-A9-FF)
        Local resolvable private address: 00:00:00:00:00:00 (Non-Resolvable)
        Peer resolvable private address: 00:00:00:00:00:00 (Non-Resolvable)
        Connection interval: 87.50 msec (0x0046)
        Connection latency: 0 (0x0000)
        Supervision timeout: 25120 msec (0x09d0)
        Central clock accuracy: 0x01
> HCI Event: LE Meta Event (0x3e) plen 6                    #48 [hci1] 3.704592
      LE Advertising Set Terminated (0x12)
        Status: Success (0x00)
        Handle: 0
        Connection handle: 327
        Number of completed extended advertising events: 0
< HCI Command: LE Read Remote Used... (0x08|0x0016) plen 2  #49 [hci1] 3.717903
        Handle: 327 Address: DF:A9:FF:F6:B1:1A (OUI DF-A9-FF)
< ACL Data TX: Handle 327 flags 0x00 dlen 7                 #50 [hci1] 3.717927
      ATT: Exchange MTU Request (0x02) len 2
        Client RX MTU: 251
> HCI Event: Command Status (0x0f) plen 4                   #51 [hci1] 3.718471
      LE Read Remote Used Features (0x08|0x0016) ncmd 1
        Status: Success (0x00)
> HCI Event: Number of Completed Packets (0x13) plen 5      #52 [hci1] 3.880483
        Num handles: 1
        Handle: 327 Address: DF:A9:FF:F6:B1:1A (OUI DF-A9-FF)
        Count: 1
        #50: len 7 (0 Kb/s)
        Latency: 162 msec (162-162 msec ~162 msec)
> HCI Event: LE Meta Event (0x3e) plen 12                   #53 [hci1] 3.968283
      LE Read Remote Used Features (0x04)
        Status: Success (0x00)
        Handle: 327 Address: DF:A9:FF:F6:B1:1A (OUI DF-A9-FF)
        Features: 0x2d 0x49 0x00 0xf7 0x67 0xd8 0x00 0x00
          LE Encryption
          Extended Reject Indication
          Peripheral-initiated Features Exchange
          LE Data Packet Length Extension
          LE 2M PHY
          LE Coded PHY
          Channel Selection Algorithm #2
          Periodic Advertising Sync Transfer - Sender
          Periodic Advertising Sync Transfer - Recipient
          Sleep Clock Accuracy Updates
          Connected Isochronous Stream - Central
          Connected Isochronous Stream - Peripheral
          Isochronous Broadcaster
          Synchronized Receiver
          Connected Isochronous Stream (Host Support)
          LE Power Control Request
          LE Power Control Request
          Connection Subrating
          Connection Subrating (Host Support)
          Unknown features (0x0000d80000000000)
> ACL Data RX: Handle 327 flags 0x02 dlen 11                #54 [hci1] 6.418063
      SMP: Pairing Request (0x01) len 6
        IO capability: KeyboardDisplay (0x04)
        OOB data: Authentication data not present (0x00)
        Authentication requirement: Bonding, MITM, SC, No Keypresses (0x0d)
        Max encryption key size: 16
        Initiator key distribution: EncKey IdKey (0x03)
        Responder key distribution: EncKey IdKey Sign (0x07)
> ACL Data RX: Handle 327 flags 0x02 dlen 7                 #55 [hci1] 6.418557
      ATT: Exchange MTU Response (0x03) len 2
        Server RX MTU: 23
< HCI Command: Host Number of Compl.. (0x03|0x0035) plen 5  #56 [hci1] 6.437606
        Num handles: 1
        Handle: 327 Address: DF:A9:FF:F6:B1:1A (OUI DF-A9-FF)
        Count: 1
< ACL Data TX: Handle 327 flags 0x00 dlen 11                #57 [hci1] 6.437837
      SMP: Pairing Response (0x02) len 6
        IO capability: DisplayOnly (0x00)
        OOB data: Authentication data not present (0x00)
        Authentication requirement: Bonding, No MITM, SC, No Keypresses (0x09)
        Max encryption key size: 16
        Initiator key distribution: IdKey (0x02)
        Responder key distribution: <none> (0x00)
< HCI Command: Host Number of Compl.. (0x03|0x0035) plen 5  #58 [hci1] 6.438075
        Num handles: 1
        Handle: 327 Address: DF:A9:FF:F6:B1:1A (OUI DF-A9-FF)
        Count: 1
> HCI Event: Number of Completed Packets (0x13) plen 5      #59 [hci1] 6.593047
        Num handles: 1
        Handle: 327 Address: DF:A9:FF:F6:B1:1A (OUI DF-A9-FF)
        Count: 1
        #57: len 11 (0 Kb/s)
        Latency: 155 msec (155-162 msec ~158 msec)
> ACL Data RX: Handle 327 flags 0x02 dlen 27                #60 [hci1] 6.593447
> ACL Data RX: Handle 327 flags 0x01 dlen 27                #61 [hci1] 6.594103
> ACL Data RX: Handle 327 flags 0x01 dlen 15                #62 [hci1] 6.594399
      SMP: Pairing Public Key (0x0c) len 64
        X: b48a87dd489206992c7267bd8a37f8bd830063567d3180a3518bdcae8f1e05bd
        Y: 90291c0add4eb33e71e848a670de7d3f59e85d598cd455eb7566009bb65cd75b
< HCI Command: Host Number of Compl.. (0x03|0x0035) plen 5  #63 [hci1] 6.597816
        Num handles: 1
        Handle: 327 Address: DF:A9:FF:F6:B1:1A (OUI DF-A9-FF)
        Count: 1
< HCI Command: Host Number of Compl.. (0x03|0x0035) plen 5  #64 [hci1] 6.597893
        Num handles: 1
        Handle: 327 Address: DF:A9:FF:F6:B1:1A (OUI DF-A9-FF)
        Count: 1
< HCI Command: Host Number of Compl.. (0x03|0x0035) plen 5  #65 [hci1] 6.598367
        Num handles: 1
        Handle: 327 Address: DF:A9:FF:F6:B1:1A (OUI DF-A9-FF)
        Count: 1
< ACL Data TX: Handle 327 flags 0x00 dlen 27                #66 [hci1] 6.598515
< ACL Data TX: Handle 327 flags 0x01 dlen 27                #67 [hci1] 6.598532
< ACL Data TX: Handle 327 flags 0x01 dlen 15                #68 [hci1] 6.598536
      SMP: Pairing Public Key (0x0c) len 64
        X: 98308440221e2d910f0e54b71e7ec652857aa9b5a0dc65028824cc19db1226e9
        Y: 67a4816bcb62efb21701e31fdb27561a6217575fb007a8bbdabe7e28b6f68482
> HCI Event: Number of Completed Packets (0x13) plen 5      #69 [hci1] 6.680990
        Num handles: 1
        Handle: 327 Address: DF:A9:FF:F6:B1:1A (OUI DF-A9-FF)
        Count: 1
        #66: len 27 (2 Kb/s)
        Latency: 82 msec (82-162 msec ~120 msec)
> HCI Event: Number of Completed Packets (0x13) plen 5      #70 [hci1] 6.681645
        Num handles: 1
        Handle: 327 Address: DF:A9:FF:F6:B1:1A (OUI DF-A9-FF)
        Count: 1
        #67: len 27 (2 Kb/s)
        Latency: 83 msec (82-162 msec ~101 msec)
> HCI Event: Number of Completed Packets (0x13) plen 5      #71 [hci1] 6.767897
        Num handles: 1
        Handle: 327 Address: DF:A9:FF:F6:B1:1A (OUI DF-A9-FF)
        Count: 1
        #68: len 15 (0 Kb/s)
        Latency: 169 msec (82-169 msec ~135 msec)
> ACL Data RX: Handle 327 flags 0x02 dlen 21                #72 [hci1] 7.730692
      SMP: Pairing Confirm (0x03) len 16
        Confim value: deac091bf8aa29cbd102e755fa74fac6
< HCI Command: Host Number of Compl.. (0x03|0x0035) plen 5  #73 [hci1] 7.737368
        Num handles: 1
        Handle: 327 Address: DF:A9:FF:F6:B1:1A (OUI DF-A9-FF)
        Count: 1
< ACL Data TX: Handle 327 flags 0x00 dlen 21                #74 [hci1] 7.737511
      SMP: Pairing Confirm (0x03) len 16
        Confim value: 2df06d29b934b9ff47cd5eae30e12fc2
> HCI Event: Number of Completed Packets (0x13) plen 5      #75 [hci1] 7.905488
        Num handles: 1
        Handle: 327 Address: DF:A9:FF:F6:B1:1A (OUI DF-A9-FF)
        Count: 1
        #74: len 21 (1 Kb/s)
        Latency: 167 msec (82-169 msec ~151 msec)
> ACL Data RX: Handle 327 flags 0x02 dlen 21                #76 [hci1] 7.905892
      SMP: Pairing Random (0x04) len 16
        Random value: 6a80e74ef2a7bce00000000000000000
< HCI Command: Host Number of Compl.. (0x03|0x0035) plen 5  #77 [hci1] 7.917921
        Num handles: 1
        Handle: 327 Address: DF:A9:FF:F6:B1:1A (OUI DF-A9-FF)
        Count: 1
< ACL Data TX: Handle 327 flags 0x00 dlen 21                #78 [hci1] 7.918051
      SMP: Pairing Random (0x04) len 16
        Random value: 8e6108f966a694cbe26df70bb96773e6
> HCI Event: Number of Completed Packets (0x13) plen 5      #79 [hci1] 8.080322
        Num handles: 1
        Handle: 327 Address: DF:A9:FF:F6:B1:1A (OUI DF-A9-FF)
        Count: 1
        #78: len 21 (1 Kb/s)
        Latency: 162 msec (82-169 msec ~157 msec)
> ACL Data RX: Handle 327 flags 0x02 dlen 21                #80 [hci1] 8.168106
      SMP: Pairing Confirm (0x03) len 16
        Confim value: 5ae471999806d6eb114b200ef9406dc3
< HCI Command: Host Number of Compl.. (0x03|0x0035) plen 5  #81 [hci1] 8.177400
        Num handles: 1
        Handle: 327 Address: DF:A9:FF:F6:B1:1A (OUI DF-A9-FF)
        Count: 1
< ACL Data TX: Handle 327 flags 0x00 dlen 21                #82 [hci1] 8.177557
      SMP: Pairing Confirm (0x03) len 16
        Confim value: d10cc7aef5294ae87a23eef4d5ccdc71
> HCI Event: Number of Completed Packets (0x13) plen 5      #83 [hci1] 8.343008
        Num handles: 1
        Handle: 327 Address: DF:A9:FF:F6:B1:1A (OUI DF-A9-FF)
        Count: 1
        #82: len 21 (1 Kb/s)
        Latency: 165 msec (82-169 msec ~161 msec)
> ACL Data RX: Handle 327 flags 0x02 dlen 21                #84 [hci1] 8.343357
      SMP: Pairing Random (0x04) len 16
        Random value: 7ce0514be0ec67740000000000000000
< HCI Command: Host Number of Compl.. (0x03|0x0035) plen 5  #85 [hci1] 8.357842
        Num handles: 1
        Handle: 327 Address: DF:A9:FF:F6:B1:1A (OUI DF-A9-FF)
        Count: 1
< ACL Data TX: Handle 327 flags 0x00 dlen 21                #86 [hci1] 8.357983
      SMP: Pairing Random (0x04) len 16
        Random value: 4d02679f89a05211af56d8b3da64d21e
> HCI Event: Number of Completed Packets (0x13) plen 5      #87 [hci1] 8.517767
        Num handles: 1
        Handle: 327 Address: DF:A9:FF:F6:B1:1A (OUI DF-A9-FF)
        Count: 1
        #86: len 21 (1 Kb/s)
        Latency: 159 msec (82-169 msec ~160 msec)
> ACL Data RX: Handle 327 flags 0x02 dlen 21                #88 [hci1] 8.605658
      SMP: Pairing Confirm (0x03) len 16
        Confim value: c0d54a62d35b40c51595bec7571c3303
< HCI Command: Host Number of Compl.. (0x03|0x0035) plen 5  #89 [hci1] 8.617649
        Num handles: 1
        Handle: 327 Address: DF:A9:FF:F6:B1:1A (OUI DF-A9-FF)
        Count: 1
< ACL Data TX: Handle 327 flags 0x00 dlen 21                #90 [hci1] 8.617865
      SMP: Pairing Confirm (0x03) len 16
        Confim value: 6e7d10e638c0bda9e5b8e9277f50924b
> HCI Event: Number of Completed Packets (0x13) plen 5      #91 [hci1] 8.780541
        Num handles: 1
        Handle: 327 Address: DF:A9:FF:F6:B1:1A (OUI DF-A9-FF)
        Count: 1
        #90: len 21 (1 Kb/s)
        Latency: 162 msec (82-169 msec ~161 msec)
> ACL Data RX: Handle 327 flags 0x02 dlen 21                #92 [hci1] 8.780828
      SMP: Pairing Random (0x04) len 16
        Random value: 381fb18b5e7dc0830000000000000000
< HCI Command: Host Number of Compl.. (0x03|0x0035) plen 5  #93 [hci1] 8.797932
        Num handles: 1
        Handle: 327 Address: DF:A9:FF:F6:B1:1A (OUI DF-A9-FF)
        Count: 1
< ACL Data TX: Handle 327 flags 0x00 dlen 21                #94 [hci1] 8.798090
      SMP: Pairing Random (0x04) len 16
        Random value: 5e8286bc235a02440d0c3424a2acf8fd
> HCI Event: Number of Completed Packets (0x13) plen 5      #95 [hci1] 8.955329
        Num handles: 1
        Handle: 327 Address: DF:A9:FF:F6:B1:1A (OUI DF-A9-FF)
        Count: 1
        #94: len 21 (1 Kb/s)
        Latency: 157 msec (82-169 msec ~159 msec)
> ACL Data RX: Handle 327 flags 0x02 dlen 21                #96 [hci1] 9.043158
      SMP: Pairing Confirm (0x03) len 16
        Confim value: 0af312692e437c38a37cdbbe5ffd0785
< HCI Command: Host Number of Compl.. (0x03|0x0035) plen 5  #97 [hci1] 9.057721
        Num handles: 1
        Handle: 327 Address: DF:A9:FF:F6:B1:1A (OUI DF-A9-FF)
        Count: 1
< ACL Data TX: Handle 327 flags 0x00 dlen 21                #98 [hci1] 9.057924
      SMP: Pairing Confirm (0x03) len 16
        Confim value: 22426de1543b119cf41d5729baf79ca1
> HCI Event: Number of Completed Packets (0x13) plen 5      #99 [hci1] 9.217916
        Num handles: 1
        Handle: 327 Address: DF:A9:FF:F6:B1:1A (OUI DF-A9-FF)
        Count: 1
        #98: len 21 (1 Kb/s)
        Latency: 159 msec (82-169 msec ~159 msec)
> ACL Data RX: Handle 327 flags 0x02 dlen 21               #100 [hci1] 9.218300
      SMP: Pairing Random (0x04) len 16
        Random value: 39a22255b48066a70000000000000000
< HCI Command: Host Number of Comp.. (0x03|0x0035) plen 5  #101 [hci1] 9.237957
        Num handles: 1
        Handle: 327 Address: DF:A9:FF:F6:B1:1A (OUI DF-A9-FF)
        Count: 1
< ACL Data TX: Handle 327 flags 0x00 dlen 21               #102 [hci1] 9.238045
      SMP: Pairing Random (0x04) len 16
        Random value: 5c4a1bcadd27bd58e945097b00bad7ac
> HCI Event: Number of Completed Packets (0x13) plen 5     #103 [hci1] 9.392746
        Num handles: 1
        Handle: 327 Address: DF:A9:FF:F6:B1:1A (OUI DF-A9-FF)
        Count: 1
        #102: len 21 (1 Kb/s)
        Latency: 154 msec (82-169 msec ~157 msec)
> ACL Data RX: Handle 327 flags 0x02 dlen 21               #104 [hci1] 9.480616
      SMP: Pairing Confirm (0x03) len 16
        Confim value: aee1f9bb5a42b1b1d44a9a36ec734c7b
< HCI Command: Host Number of Comp.. (0x03|0x0035) plen 5  #105 [hci1] 9.497494
        Num handles: 1
        Handle: 327 Address: DF:A9:FF:F6:B1:1A (OUI DF-A9-FF)
        Count: 1
< ACL Data TX: Handle 327 flags 0x00 dlen 21               #106 [hci1] 9.497708
      SMP: Pairing Confirm (0x03) len 16
        Confim value: f45fc58d2202b035beb05474b7f01bf5
> HCI Event: Number of Completed Packets (0x13) plen 5     #107 [hci1] 9.655421
        Num handles: 1
        Handle: 327 Address: DF:A9:FF:F6:B1:1A (OUI DF-A9-FF)
        Count: 1
        #106: len 21 (1 Kb/s)
        Latency: 157 msec (82-169 msec ~157 msec)
> ACL Data RX: Handle 327 flags 0x02 dlen 21               #108 [hci1] 9.655801
      SMP: Pairing Random (0x04) len 16
        Random value: 3a047683d89949530000000000000000
< HCI Command: Host Number of Comp.. (0x03|0x0035) plen 5  #109 [hci1] 9.657823
        Num handles: 1
        Handle: 327 Address: DF:A9:FF:F6:B1:1A (OUI DF-A9-FF)
        Count: 1
< ACL Data TX: Handle 327 flags 0x00 dlen 21               #110 [hci1] 9.657925
      SMP: Pairing Random (0x04) len 16
        Random value: 32527e6e64e79f33b2e374394db8ab2d
> HCI Event: Number of Completed Packets (0x13) plen 5     #111 [hci1] 9.830301
        Num handles: 1
        Handle: 327 Address: DF:A9:FF:F6:B1:1A (OUI DF-A9-FF)
        Count: 1
        #110: len 21 (0 Kb/s)
        Latency: 172 msec (82-172 msec ~164 msec)
> ACL Data RX: Handle 327 flags 0x02 dlen 21               #112 [hci1] 9.918132
      SMP: Pairing Confirm (0x03) len 16
        Confim value: abfbba6ed0ef2fd94b517122cff6145a
< HCI Command: Host Number of Comp.. (0x03|0x0035) plen 5  #113 [hci1] 9.937643
        Num handles: 1
        Handle: 327 Address: DF:A9:FF:F6:B1:1A (OUI DF-A9-FF)
        Count: 1
< ACL Data TX: Handle 327 flags 0x00 dlen 21               #114 [hci1] 9.937820
      SMP: Pairing Confirm (0x03) len 16
        Confim value: 4414444a7b4651f71b81f065e39a0560
> HCI Event: Number of Completed Packets (0x13) plen 5    #115 [hci1] 10.092949
        Num handles: 1
        Handle: 327 Address: DF:A9:FF:F6:B1:1A (OUI DF-A9-FF)
        Count: 1
        #114: len 21 (1 Kb/s)
        Latency: 155 msec (82-172 msec ~160 msec)
> ACL Data RX: Handle 327 flags 0x02 dlen 21              #116 [hci1] 10.093266
      SMP: Pairing Random (0x04) len 16
        Random value: 6330aec91ae931b10000000000000000
< HCI Command: Host Number of Com.. (0x03|0x0035) plen 5  #117 [hci1] 10.097903
        Num handles: 1
        Handle: 327 Address: DF:A9:FF:F6:B1:1A (OUI DF-A9-FF)
        Count: 1
< ACL Data TX: Handle 327 flags 0x00 dlen 21              #118 [hci1] 10.098030
      SMP: Pairing Random (0x04) len 16
        Random value: dddbdfe2838e9a8cc6964353c850fef7
> HCI Event: Number of Completed Packets (0x13) plen 5    #119 [hci1] 10.267708
        Num handles: 1
        Handle: 327 Address: DF:A9:FF:F6:B1:1A (OUI DF-A9-FF)
        Count: 1
        #118: len 21 (0 Kb/s)
        Latency: 169 msec (82-172 msec ~164 msec)
> ACL Data RX: Handle 327 flags 0x02 dlen 21              #120 [hci1] 10.355633
      SMP: Pairing Confirm (0x03) len 16
        Confim value: ffb3a1960681e2a428acbb5abc9dad60
< HCI Command: Host Number of Com.. (0x03|0x0035) plen 5  #121 [hci1] 10.357577
        Num handles: 1
        Handle: 327 Address: DF:A9:FF:F6:B1:1A (OUI DF-A9-FF)
        Count: 1
< ACL Data TX: Handle 327 flags 0x00 dlen 21              #122 [hci1] 10.357757
      SMP: Pairing Confirm (0x03) len 16
        Confim value: 273f3b9beaf9700416ad7daf0d8a6c55
> HCI Event: Number of Completed Packets (0x13) plen 5    #123 [hci1] 10.530405
        Num handles: 1
        Handle: 327 Address: DF:A9:FF:F6:B1:1A (OUI DF-A9-FF)
        Count: 1
        #122: len 21 (0 Kb/s)
        Latency: 172 msec (82-172 msec ~168 msec)
> ACL Data RX: Handle 327 flags 0x02 dlen 21              #124 [hci1] 10.530724
      SMP: Pairing Random (0x04) len 16
        Random value: fef5a18d60bf69a70000000000000000
< HCI Command: Host Number of Com.. (0x03|0x0035) plen 5  #125 [hci1] 10.537843
        Num handles: 1
        Handle: 327 Address: DF:A9:FF:F6:B1:1A (OUI DF-A9-FF)
        Count: 1
< ACL Data TX: Handle 327 flags 0x00 dlen 21              #126 [hci1] 10.538000
      SMP: Pairing Random (0x04) len 16
        Random value: eb9f1915536596b6fc3db1c86b2b1970
> HCI Event: Number of Completed Packets (0x13) plen 5    #127 [hci1] 10.705194
        Num handles: 1
        Handle: 327 Address: DF:A9:FF:F6:B1:1A (OUI DF-A9-FF)
        Count: 1
        #126: len 21 (1 Kb/s)
        Latency: 167 msec (82-172 msec ~167 msec)
> ACL Data RX: Handle 327 flags 0x02 dlen 21              #128 [hci1] 10.793160
      SMP: Pairing Confirm (0x03) len 16
        Confim value: c62a181b588e1294e5a44f509ab7713b
< HCI Command: Host Number of Com.. (0x03|0x0035) plen 5  #129 [hci1] 10.797306
        Num handles: 1
        Handle: 327 Address: DF:A9:FF:F6:B1:1A (OUI DF-A9-FF)
        Count: 1
< ACL Data TX: Handle 327 flags 0x00 dlen 21              #130 [hci1] 10.797446
      SMP: Pairing Confirm (0x03) len 16
        Confim value: fb5e70eea6ea93c4438d3c4121dad04f
> HCI Event: Number of Completed Packets (0x13) plen 5    #131 [hci1] 10.967934
        Num handles: 1
        Handle: 327 Address: DF:A9:FF:F6:B1:1A (OUI DF-A9-FF)
        Count: 1
        #130: len 21 (0 Kb/s)
        Latency: 170 msec (82-172 msec ~169 msec)
> ACL Data RX: Handle 327 flags 0x02 dlen 21              #132 [hci1] 10.968219
      SMP: Pairing Random (0x04) len 16
        Random value: 6c7db7f001be725b0000000000000000
< HCI Command: Host Number of Com.. (0x03|0x0035) plen 5  #133 [hci1] 10.977926
        Num handles: 1
        Handle: 327 Address: DF:A9:FF:F6:B1:1A (OUI DF-A9-FF)
        Count: 1
< ACL Data TX: Handle 327 flags 0x00 dlen 21              #134 [hci1] 10.978064
      SMP: Pairing Random (0x04) len 16
        Random value: 5c794dc9ad9f2c3f295ebd5ad5e1c3cf
> HCI Event: Number of Completed Packets (0x13) plen 5    #135 [hci1] 11.142737
        Num handles: 1
        Handle: 327 Address: DF:A9:FF:F6:B1:1A (OUI DF-A9-FF)
        Count: 1
        #134: len 21 (1 Kb/s)
        Latency: 164 msec (82-172 msec ~166 msec)
> ACL Data RX: Handle 327 flags 0x02 dlen 21              #136 [hci1] 11.230625
      SMP: Pairing Confirm (0x03) len 16
        Confim value: ca0704f2e68b3ea867a4bd9c1e6fcadf
< HCI Command: Host Number of Com.. (0x03|0x0035) plen 5  #137 [hci1] 11.237345
        Num handles: 1
        Handle: 327 Address: DF:A9:FF:F6:B1:1A (OUI DF-A9-FF)
        Count: 1
< ACL Data TX: Handle 327 flags 0x00 dlen 21              #138 [hci1] 11.237476
      SMP: Pairing Confirm (0x03) len 16
        Confim value: ad02eac68323a788064ec277b732933d
> HCI Event: Number of Completed Packets (0x13) plen 5    #139 [hci1] 11.405393
        Num handles: 1
        Handle: 327 Address: DF:A9:FF:F6:B1:1A (OUI DF-A9-FF)
        Count: 1
        #138: len 21 (1 Kb/s)
        Latency: 167 msec (82-172 msec ~167 msec)
> ACL Data RX: Handle 327 flags 0x02 dlen 21              #140 [hci1] 11.405785
      SMP: Pairing Random (0x04) len 16
        Random value: 7e993e64501102230000000000000000
< HCI Command: Host Number of Com.. (0x03|0x0035) plen 5  #141 [hci1] 11.417867
        Num handles: 1
        Handle: 327 Address: DF:A9:FF:F6:B1:1A (OUI DF-A9-FF)
        Count: 1
< ACL Data TX: Handle 327 flags 0x00 dlen 21              #142 [hci1] 11.418037
      SMP: Pairing Random (0x04) len 16
        Random value: 5c2fff312cdf99c9491988e877355a9a
> HCI Event: Number of Completed Packets (0x13) plen 5    #143 [hci1] 11.580250
        Num handles: 1
        Handle: 327 Address: DF:A9:FF:F6:B1:1A (OUI DF-A9-FF)
        Count: 1
        #142: len 21 (1 Kb/s)
        Latency: 162 msec (82-172 msec ~164 msec)
> ACL Data RX: Handle 327 flags 0x02 dlen 21              #144 [hci1] 11.668032
      SMP: Pairing Confirm (0x03) len 16
        Confim value: 40dd864583017bea5787c1a788f52ff2
< HCI Command: Host Number of Com.. (0x03|0x0035) plen 5  #145 [hci1] 11.677404
        Num handles: 1
        Handle: 327 Address: DF:A9:FF:F6:B1:1A (OUI DF-A9-FF)
        Count: 1
< ACL Data TX: Handle 327 flags 0x00 dlen 21              #146 [hci1] 11.677520
      SMP: Pairing Confirm (0x03) len 16
        Confim value: 448e38a963d418f6c43e787ec45dfc15
> HCI Event: Number of Completed Packets (0x13) plen 5    #147 [hci1] 11.842828
        Num handles: 1
        Handle: 327 Address: DF:A9:FF:F6:B1:1A (OUI DF-A9-FF)
        Count: 1
        #146: len 21 (1 Kb/s)
        Latency: 165 msec (82-172 msec ~165 msec)
> ACL Data RX: Handle 327 flags 0x02 dlen 21              #148 [hci1] 11.843189
      SMP: Pairing Random (0x04) len 16
        Random value: e5b22418730af9e80000000000000000
< HCI Command: Host Number of Com.. (0x03|0x0035) plen 5  #149 [hci1] 11.857898
        Num handles: 1
        Handle: 327 Address: DF:A9:FF:F6:B1:1A (OUI DF-A9-FF)
        Count: 1
< ACL Data TX: Handle 327 flags 0x00 dlen 21              #150 [hci1] 11.857984
      SMP: Pairing Random (0x04) len 16
        Random value: c629a3a987d808e808655d558dfc1155
> HCI Event: Number of Completed Packets (0x13) plen 5    #151 [hci1] 12.017646
        Num handles: 1
        Handle: 327 Address: DF:A9:FF:F6:B1:1A (OUI DF-A9-FF)
        Count: 1
        #150: len 21 (1 Kb/s)
        Latency: 159 msec (82-172 msec ~162 msec)
> ACL Data RX: Handle 327 flags 0x02 dlen 21              #152 [hci1] 12.105520
      SMP: Pairing Confirm (0x03) len 16
        Confim value: 8f1d17631525c0bb369d18dc5b0e09ac
< HCI Command: Host Number of Com.. (0x03|0x0035) plen 5  #153 [hci1] 12.117690
        Num handles: 1
        Handle: 327 Address: DF:A9:FF:F6:B1:1A (OUI DF-A9-FF)
        Count: 1
< ACL Data TX: Handle 327 flags 0x00 dlen 21              #154 [hci1] 12.117927
      SMP: Pairing Confirm (0x03) len 16
        Confim value: fe81e058a6c7f09c6a555c213af14e32
> HCI Event: Number of Completed Packets (0x13) plen 5    #155 [hci1] 12.280402
        Num handles: 1
        Handle: 327 Address: DF:A9:FF:F6:B1:1A (OUI DF-A9-FF)
        Count: 1
        #154: len 21 (1 Kb/s)
        Latency: 162 msec (82-172 msec ~162 msec)
> ACL Data RX: Handle 327 flags 0x02 dlen 21              #156 [hci1] 12.280676
      SMP: Pairing Random (0x04) len 16
        Random value: 40b845cadaac94f40000000000000000
< HCI Command: Host Number of Com.. (0x03|0x0035) plen 5  #157 [hci1] 12.297800
        Num handles: 1
        Handle: 327 Address: DF:A9:FF:F6:B1:1A (OUI DF-A9-FF)
        Count: 1
< ACL Data TX: Handle 327 flags 0x00 dlen 21              #158 [hci1] 12.297945
      SMP: Pairing Random (0x04) len 16
        Random value: 92f20f6ad8f13724432c7fd6001c45ff
> HCI Event: Number of Completed Packets (0x13) plen 5    #159 [hci1] 12.455161
        Num handles: 1
        Handle: 327 Address: DF:A9:FF:F6:B1:1A (OUI DF-A9-FF)
        Count: 1
        #158: len 21 (1 Kb/s)
        Latency: 157 msec (82-172 msec ~159 msec)
> ACL Data RX: Handle 327 flags 0x02 dlen 21              #160 [hci1] 12.542975
      SMP: Pairing Confirm (0x03) len 16
        Confim value: 1bc7565c00b25444c94aac917fe6eca8
< HCI Command: Host Number of Com.. (0x03|0x0035) plen 5  #161 [hci1] 12.557794
        Num handles: 1
        Handle: 327 Address: DF:A9:FF:F6:B1:1A (OUI DF-A9-FF)
        Count: 1
< ACL Data TX: Handle 327 flags 0x00 dlen 21              #162 [hci1] 12.558052
      SMP: Pairing Confirm (0x03) len 16
        Confim value: c7a42073436d2add752da8fcae6c16da
> HCI Event: Number of Completed Packets (0x13) plen 5    #163 [hci1] 12.717867
        Num handles: 1
        Handle: 327 Address: DF:A9:FF:F6:B1:1A (OUI DF-A9-FF)
        Count: 1
        #162: len 21 (1 Kb/s)
        Latency: 159 msec (82-172 msec ~159 msec)
> ACL Data RX: Handle 327 flags 0x02 dlen 21              #164 [hci1] 12.718211
      SMP: Pairing Random (0x04) len 16
        Random value: 5869f015e1a832f00000000000000000
< HCI Command: Host Number of Com.. (0x03|0x0035) plen 5  #165 [hci1] 12.737998
        Num handles: 1
        Handle: 327 Address: DF:A9:FF:F6:B1:1A (OUI DF-A9-FF)
        Count: 1
< ACL Data TX: Handle 327 flags 0x00 dlen 21              #166 [hci1] 12.738099
      SMP: Pairing Random (0x04) len 16
        Random value: 23ac32ebbb5e14c8a6b9622f296d277f
> HCI Event: Number of Completed Packets (0x13) plen 5    #167 [hci1] 12.892670
        Num handles: 1
        Handle: 327 Address: DF:A9:FF:F6:B1:1A (OUI DF-A9-FF)
        Count: 1
        #166: len 21 (1 Kb/s)
        Latency: 154 msec (82-172 msec ~157 msec)
> ACL Data RX: Handle 327 flags 0x02 dlen 21              #168 [hci1] 12.980447
      SMP: Pairing Confirm (0x03) len 16
        Confim value: 9ec215e9ef7a17f49df333fcc221e899
< HCI Command: Host Number of Com.. (0x03|0x0035) plen 5  #169 [hci1] 12.997692
        Num handles: 1
        Handle: 327 Address: DF:A9:FF:F6:B1:1A (OUI DF-A9-FF)
        Count: 1
< ACL Data TX: Handle 327 flags 0x00 dlen 21              #170 [hci1] 12.997922
      SMP: Pairing Confirm (0x03) len 16
        Confim value: fff7a39f0c60a083addaafe73c8112ad
> HCI Event: Number of Completed Packets (0x13) plen 5    #171 [hci1] 13.155266
        Num handles: 1
        Handle: 327 Address: DF:A9:FF:F6:B1:1A (OUI DF-A9-FF)
        Count: 1
        #170: len 21 (1 Kb/s)
        Latency: 157 msec (82-172 msec ~157 msec)
> ACL Data RX: Handle 327 flags 0x02 dlen 21              #172 [hci1] 13.155689
      SMP: Pairing Random (0x04) len 16
        Random value: b2cbeff9b25f42d10000000000000000
< HCI Command: Host Number of Com.. (0x03|0x0035) plen 5  #173 [hci1] 13.157916
        Num handles: 1
        Handle: 327 Address: DF:A9:FF:F6:B1:1A (OUI DF-A9-FF)
        Count: 1
< ACL Data TX: Handle 327 flags 0x00 dlen 21              #174 [hci1] 13.158022
      SMP: Pairing Random (0x04) len 16
        Random value: 297efe85e67448a15f56bd27e3a3cf1d
> HCI Event: Number of Completed Packets (0x13) plen 5    #175 [hci1] 13.330111
        Num handles: 1
        Handle: 327 Address: DF:A9:FF:F6:B1:1A (OUI DF-A9-FF)
        Count: 1
        #174: len 21 (0 Kb/s)
        Latency: 172 msec (82-172 msec ~164 msec)
> ACL Data RX: Handle 327 flags 0x02 dlen 21              #176 [hci1] 13.417963
      SMP: Pairing Confirm (0x03) len 16
        Confim value: 676df3d406bc19151c7735722b6b4ceb
< HCI Command: Host Number of Com.. (0x03|0x0035) plen 5  #177 [hci1] 13.437589
        Num handles: 1
        Handle: 327 Address: DF:A9:FF:F6:B1:1A (OUI DF-A9-FF)
        Count: 1
< ACL Data TX: Handle 327 flags 0x00 dlen 21              #178 [hci1] 13.437796
      SMP: Pairing Confirm (0x03) len 16
        Confim value: 3985630393cde2949343ef63cda1cea9
> HCI Event: Number of Completed Packets (0x13) plen 5    #179 [hci1] 13.592825
        Num handles: 1
        Handle: 327 Address: DF:A9:FF:F6:B1:1A (OUI DF-A9-FF)
        Count: 1
        #178: len 21 (1 Kb/s)
        Latency: 155 msec (82-172 msec ~159 msec)
> ACL Data RX: Handle 327 flags 0x02 dlen 21              #180 [hci1] 13.593260
      SMP: Pairing Random (0x04) len 16
        Random value: 70768c7a2c168b8a0000000000000000
< HCI Command: Host Number of Com.. (0x03|0x0035) plen 5  #181 [hci1] 13.598043
        Num handles: 1
        Handle: 327 Address: DF:A9:FF:F6:B1:1A (OUI DF-A9-FF)
        Count: 1
< ACL Data TX: Handle 327 flags 0x00 dlen 21              #182 [hci1] 13.598148
      SMP: Pairing Random (0x04) len 16
        Random value: 25a9493fd3ce4faf02be7293595bb7c6
> HCI Event: Number of Completed Packets (0x13) plen 5    #183 [hci1] 13.767617
        Num handles: 1
        Handle: 327 Address: DF:A9:FF:F6:B1:1A (OUI DF-A9-FF)
        Count: 1
        #182: len 21 (0 Kb/s)
        Latency: 169 msec (82-172 msec ~164 msec)
> ACL Data RX: Handle 327 flags 0x02 dlen 21              #184 [hci1] 13.855430
      SMP: Pairing Confirm (0x03) len 16
        Confim value: eda2a26435e394379c157e6493c7c32d
< HCI Command: Host Number of Com.. (0x03|0x0035) plen 5  #185 [hci1] 13.857092
        Num handles: 1
        Handle: 327 Address: DF:A9:FF:F6:B1:1A (OUI DF-A9-FF)
        Count: 1
< ACL Data TX: Handle 327 flags 0x00 dlen 21              #186 [hci1] 13.857141
      SMP: Pairing Confirm (0x03) len 16
        Confim value: d57afc41d69ca4c859955be7fd4c0cf3
> HCI Event: Number of Completed Packets (0x13) plen 5    #187 [hci1] 14.030254
        Num handles: 1
        Handle: 327 Address: DF:A9:FF:F6:B1:1A (OUI DF-A9-FF)
        Count: 1
        #186: len 21 (0 Kb/s)
        Latency: 173 msec (82-173 msec ~168 msec)
> ACL Data RX: Handle 327 flags 0x02 dlen 21              #188 [hci1] 14.030681
      SMP: Pairing Random (0x04) len 16
        Random value: 0bb01eb50086d4470000000000000000
< HCI Command: Host Number of Com.. (0x03|0x0035) plen 5  #189 [hci1] 14.037235
        Num handles: 1
        Handle: 327 Address: DF:A9:FF:F6:B1:1A (OUI DF-A9-FF)
        Count: 1
< ACL Data TX: Handle 327 flags 0x00 dlen 21              #190 [hci1] 14.037279
      SMP: Pairing Random (0x04) len 16
        Random value: 58f6b41f855a6f6c3560debd84e2affc
> HCI Event: Number of Completed Packets (0x13) plen 5    #191 [hci1] 14.205088
        Num handles: 1
        Handle: 327 Address: DF:A9:FF:F6:B1:1A (OUI DF-A9-FF)
        Count: 1
        #190: len 21 (1 Kb/s)
        Latency: 167 msec (82-173 msec ~168 msec)
> ACL Data RX: Handle 327 flags 0x02 dlen 21              #192 [hci1] 14.292966
      SMP: Pairing Confirm (0x03) len 16
        Confim value: f51b5679923566f8817f4842926e5479
< HCI Command: Host Number of Com.. (0x03|0x0035) plen 5  #193 [hci1] 14.297240
        Num handles: 1
        Handle: 327 Address: DF:A9:FF:F6:B1:1A (OUI DF-A9-FF)
        Count: 1
< ACL Data TX: Handle 327 flags 0x00 dlen 21              #194 [hci1] 14.297346
      SMP: Pairing Confirm (0x03) len 16
        Confim value: 067f730162cd0c617664bd756f00708c
> HCI Event: Number of Completed Packets (0x13) plen 5    #195 [hci1] 14.467763
        Num handles: 1
        Handle: 327 Address: DF:A9:FF:F6:B1:1A (OUI DF-A9-FF)
        Count: 1
        #194: len 21 (0 Kb/s)
        Latency: 170 msec (82-173 msec ~169 msec)
> ACL Data RX: Handle 327 flags 0x02 dlen 21              #196 [hci1] 14.468117
      SMP: Pairing Random (0x04) len 16
        Random value: 538fd99ba53bf80c0000000000000000
< HCI Command: Host Number of Com.. (0x03|0x0035) plen 5  #197 [hci1] 14.477981
        Num handles: 1
        Handle: 327 Address: DF:A9:FF:F6:B1:1A (OUI DF-A9-FF)
        Count: 1
< ACL Data TX: Handle 327 flags 0x00 dlen 21              #198 [hci1] 14.478153
      SMP: Pairing Random (0x04) len 16
        Random value: b67e7216d5bf664139eda2b542549666
> HCI Event: Number of Completed Packets (0x13) plen 5    #199 [hci1] 14.642669
        Num handles: 1
        Handle: 327 Address: DF:A9:FF:F6:B1:1A (OUI DF-A9-FF)
        Count: 1
        #198: len 21 (1 Kb/s)
        Latency: 164 msec (82-173 msec ~166 msec)
> ACL Data RX: Handle 327 flags 0x02 dlen 21              #200 [hci1] 14.730467
      SMP: Pairing Confirm (0x03) len 16
        Confim value: 35cb42b8cebb25025efce8ff13df41e6
< HCI Command: Host Number of Com.. (0x03|0x0035) plen 5  #201 [hci1] 14.737477
        Num handles: 1
        Handle: 327 Address: DF:A9:FF:F6:B1:1A (OUI DF-A9-FF)
        Count: 1
< ACL Data TX: Handle 327 flags 0x00 dlen 21              #202 [hci1] 14.737618
      SMP: Pairing Confirm (0x03) len 16
        Confim value: 668bdfbe5fb023141a30956d63c14ab9
> HCI Event: Number of Completed Packets (0x13) plen 5    #203 [hci1] 14.905266
        Num handles: 1
        Handle: 327 Address: DF:A9:FF:F6:B1:1A (OUI DF-A9-FF)
        Count: 1
        #202: len 21 (1 Kb/s)
        Latency: 167 msec (82-173 msec ~167 msec)
> ACL Data RX: Handle 327 flags 0x02 dlen 21              #204 [hci1] 14.905732
      SMP: Pairing Random (0x04) len 16
        Random value: a4299580784926f90000000000000000
< HCI Command: Host Number of Com.. (0x03|0x0035) plen 5  #205 [hci1] 14.917960
        Num handles: 1
        Handle: 327 Address: DF:A9:FF:F6:B1:1A (OUI DF-A9-FF)
        Count: 1
< ACL Data TX: Handle 327 flags 0x00 dlen 21              #206 [hci1] 14.918112
      SMP: Pairing Random (0x04) len 16
        Random value: ed17f76500c95219dd01e09d1e63f87b
> HCI Event: Number of Completed Packets (0x13) plen 5    #207 [hci1] 15.080065
        Num handles: 1
        Handle: 327 Address: DF:A9:FF:F6:B1:1A (OUI DF-A9-FF)
        Count: 1
        #206: len 21 (1 Kb/s)
        Latency: 161 msec (82-173 msec ~164 msec)
> ACL Data RX: Handle 327 flags 0x02 dlen 21              #208 [hci1] 15.168019
      SMP: Pairing Confirm (0x03) len 16
        Confim value: 985c4c205a2126fdf43b2a58f89b4c17
< HCI Command: Host Number of Com.. (0x03|0x0035) plen 5  #209 [hci1] 15.177688
        Num handles: 1
        Handle: 327 Address: DF:A9:FF:F6:B1:1A (OUI DF-A9-FF)
        Count: 1
< ACL Data TX: Handle 327 flags 0x00 dlen 21              #210 [hci1] 15.177904
      SMP: Pairing Confirm (0x03) len 16
        Confim value: 1905a926379719f6f52bd78e7763b26c
> HCI Event: Number of Completed Packets (0x13) plen 5    #211 [hci1] 15.342770
        Num handles: 1
        Handle: 327 Address: DF:A9:FF:F6:B1:1A (OUI DF-A9-FF)
        Count: 1
        #210: len 21 (1 Kb/s)
        Latency: 164 msec (82-173 msec ~164 msec)
> ACL Data RX: Handle 327 flags 0x02 dlen 21              #212 [hci1] 15.343146
      SMP: Pairing Random (0x04) len 16
        Random value: 2c1c8577b8719df90000000000000000
< HCI Command: Host Number of Com.. (0x03|0x0035) plen 5  #213 [hci1] 15.357941
        Num handles: 1
        Handle: 327 Address: DF:A9:FF:F6:B1:1A (OUI DF-A9-FF)
        Count: 1
< ACL Data TX: Handle 327 flags 0x00 dlen 21              #214 [hci1] 15.358096
      SMP: Pairing Random (0x04) len 16
        Random value: 81d35d47e1f6006d79c974bd9d9e1ee3
> HCI Event: Number of Completed Packets (0x13) plen 5    #215 [hci1] 15.517553
        Num handles: 1
        Handle: 327 Address: DF:A9:FF:F6:B1:1A (OUI DF-A9-FF)
        Count: 1
        #214: len 21 (1 Kb/s)
        Latency: 159 msec (82-173 msec ~162 msec)
> ACL Data RX: Handle 327 flags 0x02 dlen 21              #216 [hci1] 15.605493
      SMP: Pairing Confirm (0x03) len 16
        Confim value: d1be4dcc20d6056a6ebb873227dc2ffc
< HCI Command: Host Number of Com.. (0x03|0x0035) plen 5  #217 [hci1] 15.617593
        Num handles: 1
        Handle: 327 Address: DF:A9:FF:F6:B1:1A (OUI DF-A9-FF)
        Count: 1
< ACL Data TX: Handle 327 flags 0x00 dlen 21              #218 [hci1] 15.617752
      SMP: Pairing Confirm (0x03) len 16
        Confim value: 93fcbd6d2c931a54bb9dd159a586efec
> HCI Event: Number of Completed Packets (0x13) plen 5    #219 [hci1] 15.780313
        Num handles: 1
        Handle: 327 Address: DF:A9:FF:F6:B1:1A (OUI DF-A9-FF)
        Count: 1
        #218: len 21 (1 Kb/s)
        Latency: 162 msec (82-173 msec ~162 msec)
> ACL Data RX: Handle 327 flags 0x02 dlen 21              #220 [hci1] 15.780630
      SMP: Pairing Random (0x04) len 16
        Random value: 606627a0de0e9c0c0000000000000000
< HCI Command: Host Number of Com.. (0x03|0x0035) plen 5  #221 [hci1] 15.797999
        Num handles: 1
        Handle: 327 Address: DF:A9:FF:F6:B1:1A (OUI DF-A9-FF)
        Count: 1
< ACL Data TX: Handle 327 flags 0x00 dlen 21              #222 [hci1] 15.798153
      SMP: Pairing Random (0x04) len 16
        Random value: e7f7e0c2476823e41736a7e381bafb7c
> HCI Event: Number of Completed Packets (0x13) plen 5    #223 [hci1] 15.955064
        Num handles: 1
        Handle: 327 Address: DF:A9:FF:F6:B1:1A (OUI DF-A9-FF)
        Count: 1
        #222: len 21 (1 Kb/s)
        Latency: 156 msec (82-173 msec ~159 msec)
> ACL Data RX: Handle 327 flags 0x02 dlen 21              #224 [hci1] 16.042894
      SMP: Pairing Confirm (0x03) len 16
        Confim value: 172d050b9bce64a838dc982cb2f4b9ef
< HCI Command: Host Number of Com.. (0x03|0x0035) plen 5  #225 [hci1] 16.057790
        Num handles: 1
        Handle: 327 Address: DF:A9:FF:F6:B1:1A (OUI DF-A9-FF)
        Count: 1
< ACL Data TX: Handle 327 flags 0x00 dlen 21              #226 [hci1] 16.058011
      SMP: Pairing Confirm (0x03) len 16
        Confim value: cae76d168cc1c36a9286d37f16d19022
> HCI Event: Number of Completed Packets (0x13) plen 5    #227 [hci1] 16.217880
        Num handles: 1
        Handle: 327 Address: DF:A9:FF:F6:B1:1A (OUI DF-A9-FF)
        Count: 1
        #226: len 21 (1 Kb/s)
        Latency: 159 msec (82-173 msec ~159 msec)
> ACL Data RX: Handle 327 flags 0x02 dlen 21              #228 [hci1] 16.218113
      SMP: Pairing Random (0x04) len 16
        Random value: 5e4ebd826910f41d0000000000000000
< HCI Command: Host Number of Com.. (0x03|0x0035) plen 5  #229 [hci1] 16.237973
        Num handles: 1
        Handle: 327 Address: DF:A9:FF:F6:B1:1A (OUI DF-A9-FF)
        Count: 1
