Bluetooth monitor ver 5.72
= Note: Linux version 6.14.0-36-generic (x86_64)                       0.654263
= Note: Bluetooth subsystem version 2.22                               0.654266
= New Index: 00:00:00:00:00:00 (Primary,UART,hci1)              [hci1] 0.654267
= New Index: 48:5F:99:8E:E0:64 (Primary,USB,hci0)               [hci0] 0.654267
= Open Index: 00:00:00:00:00:00                                 [hci1] 0.767993
= Index Info: 00:00:00:00:00:00 (Nordic Semiconductor ASA)      [hci1] 0.768012
@ USER Open: main (privileged) version 2.22            {0x0001} [hci1] 0.768023
< HCI Command: Reset (0x03|0x0003) plen 0                    #1 [hci1] 0.769460
> HCI Event: Command Complete (0x0e) plen 4                  #2 [hci1] 0.769959
      Reset (0x03|0x0003) ncmd 1
        Status: Success (0x00)
< HCI Command: Read Local Supported... (0x04|0x0003) plen 0  #3 [hci1] 0.787858
> HCI Event: Command Complete (0x0e) plen 12                 #4 [hci1] 0.788415
      Read Local Supported Features (0x04|0x0003) ncmd 1
        Status: Success (0x00)
        Features: 0x00 0x00 0x00 0x00 0x60 0x00 0x00 0x00
          BR/EDR Not Supported
          LE Supported (Controller)
< HCI Command: Read Local Version In.. (0x04|0x0001) plen 0  #5 [hci1] 0.807532
> HCI Event: Command Complete (0x0e) plen 12                 #6 [hci1] 0.808044
      Read Local Version Information (0x04|0x0001) ncmd 1
        Status: Success (0x00)
        HCI version: Reserved (0x0f) - Revision 12393 (0x3069)
        LMP version: Reserved (0x0f) - Subversion 12393 (0x3069)
        Manufacturer: Nordic Semiconductor ASA (89)
< HCI Command: Read Local Supported... (0x04|0x0002) plen 0  #7 [hci1] 0.827399
> HCI Event: Command Complete (0x0e) plen 68                 #8 [hci1] 0.828479
      Read Local Supported Commands (0x04|0x0002) ncmd 1
        Status: Success (0x00)
        Commands: 119 entries
          Disconnect (Octet 0 - Bit 5)
          Read Remote Version Information (Octet 2 - Bit 7)
          Set Event Mask (Octet 5 - Bit 6)
          Reset (Octet 5 - Bit 7)
          Read Connection Accept Timeout (Octet 7 - Bit 2)
          Write Connection Accept Timeout (Octet 7 - Bit 3)
          Read Transmit Power Level (Octet 10 - Bit 2)
          Set Controller To Host Flow Control (Octet 10 - Bit 5)
          Host Buffer Size (Octet 10 - Bit 6)
          Host Number of Completed Packets (Octet 10 - Bit 7)
          Read Local Version Information (Octet 14 - Bit 3)
          Read Local Supported Features (Octet 14 - Bit 5)
          Read BD ADDR (Octet 15 - Bit 1)
          Read RSSI (Octet 15 - Bit 5)
          Set Event Mask Page 2 (Octet 22 - Bit 2)
          LE Set Event Mask (Octet 25 - Bit 0)
          LE Read Buffer Size (Octet 25 - Bit 1)
          LE Read Local Supported Features (Octet 25 - Bit 2)
          LE Set Random Address (Octet 25 - Bit 4)
          LE Set Advertising Parameters (Octet 25 - Bit 5)
          LE Read Advertising Channel TX Power (Octet 25 - Bit 6)
          LE Set Advertising Data (Octet 25 - Bit 7)
          LE Set Scan Response Data (Octet 26 - Bit 0)
          LE Set Advertise Enable (Octet 26 - Bit 1)
          LE Set Scan Parameters (Octet 26 - Bit 2)
          LE Set Scan Enable (Octet 26 - Bit 3)
          LE Create Connection (Octet 26 - Bit 4)
          LE Create Connection Cancel (Octet 26 - Bit 5)
          LE Read Accept List Size (Octet 26 - Bit 6)
          LE Clear Accept List (Octet 26 - Bit 7)
          LE Add Device To Accept List (Octet 27 - Bit 0)
          LE Remove Device From Accept List (Octet 27 - Bit 1)
          LE Connection Update (Octet 27 - Bit 2)
          LE Set Host Channel Classification (Octet 27 - Bit 3)
          LE Read Channel Map (Octet 27 - Bit 4)
          LE Read Remote Used Features (Octet 27 - Bit 5)
          LE Encrypt (Octet 27 - Bit 6)
          LE Rand (Octet 27 - Bit 7)
          LE Start Encryption (Octet 28 - Bit 0)
          LE Long Term Key Request Reply (Octet 28 - Bit 1)
          LE Long Term Key Request Neg Reply (Octet 28 - Bit 2)
          LE Read Supported States (Octet 28 - Bit 3)
          LE Receiver Test (Octet 28 - Bit 4)
          LE Transmitter Test (Octet 28 - Bit 5)
          LE Test End (Octet 28 - Bit 6)
          Read Authenticated Payload Timeout (Octet 32 - Bit 4)
          Write Authenticated Payload Timeout (Octet 32 - Bit 5)
          LE Set Data Length (Octet 33 - Bit 6)
          LE Read Suggested Default Data Length (Octet 33 - Bit 7)
          LE Write Suggested Default Data Length (Octet 34 - Bit 0)
          LE Add Device To Resolving List (Octet 34 - Bit 3)
          LE Remove Device From Resolving List (Octet 34 - Bit 4)
          LE Clear Resolving List (Octet 34 - Bit 5)
          LE Read Resolving List Size (Octet 34 - Bit 6)
          LE Set Address Resolution Enable (Octet 35 - Bit 1)
          LE Set Resolvable Private Address Timeout (Octet 35 - Bit 2)
          LE Read Maximum Data Length (Octet 35 - Bit 3)
          LE Read PHY (Octet 35 - Bit 4)
          LE Set Default PHY (Octet 35 - Bit 5)
          LE Set PHY (Octet 35 - Bit 6)
          LE Enhanced Receiver Test (Octet 35 - Bit 7)
          LE Enhanced Transmitter Test (Octet 36 - Bit 0)
          LE Set Advertising Set Random Address (Octet 36 - Bit 1)
          LE Set Extended Advertising Parameters (Octet 36 - Bit 2)
          LE Set Extended Advertising Data (Octet 36 - Bit 3)
          LE Set Extended Scan Response Data (Octet 36 - Bit 4)
          LE Set Extended Advertising Enable (Octet 36 - Bit 5)
          LE Read Maximum Advertising Data Length (Octet 36 - Bit 6)
          LE Read Number of Supported Advertising Sets (Octet 36 - Bit 7)
          LE Remove Advertising Set (Octet 37 - Bit 0)
          LE Clear Advertising Sets (Octet 37 - Bit 1)
          LE Set Periodic Advertising Parameters (Octet 37 - Bit 2)
          LE Set Periodic Advertising Data (Octet 37 - Bit 3)
          LE Set Periodic Advertising Enable (Octet 37 - Bit 4)
          LE Set Extended Scan Parameters (Octet 37 - Bit 5)
          LE Set Extended Scan Enable (Octet 37 - Bit 6)
          LE Extended Create Connection (Octet 37 - Bit 7)
          LE Periodic Advertising Create Sync (Octet 38 - Bit 0)
          LE Periodic Advertising Create Sync Cancel (Octet 38 - Bit 1)
          LE Periodic Advertising Terminate Sync (Octet 38 - Bit 2)
          LE Add Device To Periodic Advertiser List (Octet 38 - Bit 3)
          LE Remove Device From Periodic Advertiser List (Octet 38 - Bit 4)
          LE Clear Periodic Advertiser List (Octet 38 - Bit 5)
          LE Read Periodic Advertiser List Size (Octet 38 - Bit 6)
          LE Read Transmit Power (Octet 38 - Bit 7)
          LE Read RF Path Compensation (Octet 39 - Bit 0)
          LE Write RF Path Compensation (Octet 39 - Bit 1)
          LE Set Privacy Mode (Octet 39 - Bit 2)
          LE Periodic Advertising Receive Enable (Octet 40 - Bit 5)
          LE Periodic Advertising Sync Transfer (Octet 40 - Bit 6)
          LE Periodic Advertising Set Info Transfer (Octet 40 - Bit 7)
          LE Periodic Advertising Sync Transfer Parameters (Octet 41 - Bit 0)
          LE Set Default Periodic Advertisng Sync Transfer Parameters (Octet 41 - Bit 1)
          LE Read Buffer v2 (Octet 41 - Bit 5)
          LE Read ISO TX Sync (Octet 41 - Bit 6)
          LE Set Connected Isochronous Group Parameters (Octet 41 - Bit 7)
          LE Set Connected Isochronous Group Parameters Test (Octet 42 - Bit 0)
          LE Create Connected Isochronous Stream (Octet 42 - Bit 1)
          LE Remove Connected Isochronous Group (Octet 42 - Bit 2)
          LE Accept Connected Isochronous Stream Request (Octet 42 - Bit 3)
          LE Reject Connected Isochronous Stream Request (Octet 42 - Bit 4)
          LE Create Broadcast Isochronous Group (Octet 42 - Bit 5)
          LE Create Broadcast Isochronous Group Test (Octet 42 - Bit 6)
          LE Terminate Broadcast Isochronous Group (Octet 42 - Bit 7)
          LE Broadcast Isochronous Group Create Sync (Octet 43 - Bit 0)
          LE Broadcast Isochronous Group Terminate Sync (Octet 43 - Bit 1)
          LE Request Peer SCA (Octet 43 - Bit 2)
          LE Setup Isochronous Data Path (Octet 43 - Bit 3)
          LE Remove Isochronous Data Path (Octet 43 - Bit 4)
          LE Isochronous Transmit Test (Octet 43 - Bit 5)
          LE Isochronous Receive Test (Octet 43 - Bit 6)
          LE Isochronous Read Test Counters (Octet 43 - Bit 7)
          LE Isochronous Read Test Counters (Octet 44 - Bit 0)
          LE Set Host Feature (Octet 44 - Bit 1)
          Octet 44 - Bit 2 
          Octet 45 - Bit 6 
          Octet 46 - Bit 0 
          Octet 46 - Bit 1 
          Octet 46 - Bit 2 
< HCI Command: Host Buffer Size (0x03|0x0033) plen 7         #9 [hci1] 0.847431
        ACL MTU: 255  ACL max packet: 16
        SCO MTU: 0    SCO max packet: 0
> HCI Event: Command Complete (0x0e) plen 4                 #10 [hci1] 0.847938
      Host Buffer Size (0x03|0x0033) ncmd 1
        Status: Success (0x00)
< HCI Command: Set Controller To Ho.. (0x03|0x0031) plen 1  #11 [hci1] 0.867407
        Flow control: ACL Data Packets (0x01)
> HCI Event: Command Complete (0x0e) plen 4                 #12 [hci1] 0.867828
      Set Controller To Host Flow Control (0x03|0x0031) ncmd 1
        Status: Success (0x00)
< HCI Command: LE Read Local Suppor.. (0x08|0x0003) plen 0  #13 [hci1] 0.887420
> HCI Event: Command Complete (0x0e) plen 12                #14 [hci1] 0.887862
      LE Read Local Supported Features (0x08|0x0003) ncmd 1
        Status: Success (0x00)
        Features: 0xfd 0x79 0x00 0xf7 0x30 0x01 0x00 0x00
          LE Encryption
          Extended Reject Indication
          Peripheral-initiated Features Exchange
          LE Ping
          LE Data Packet Length Extension
          LL Privacy
          Extended Scanner Filter Policies
          LE 2M PHY
          LE Coded PHY
          LE Extended Advertising
          LE Periodic Advertising
          Channel Selection Algorithm #2
          Periodic Advertising Sync Transfer - Sender
          Periodic Advertising Sync Transfer - Recipient
          Sleep Clock Accuracy Updates
          Connected Isochronous Stream - Central
          Connected Isochronous Stream - Peripheral
          Isochronous Broadcaster
          Synchronized Receiver
          Periodic Advertising ADI support
          Connection Subrating
          Unknown features (0x0000010000000000)
< HCI Command: LE Set Host Feature (0x08|0x0074) plen 2     #15 [hci1] 0.907414
        Bit Number: 32
          Connected Isochronous Stream (Host Support)
        Bit Value: 1
> HCI Event: Command Complete (0x0e) plen 4                 #16 [hci1] 0.907866
      LE Set Host Feature (0x08|0x0074) ncmd 1
        Status: Success (0x00)
< HCI Command: LE Read Buffer v2 (0x08|0x0060) plen 0       #17 [hci1] 0.927379
> HCI Event: Command Complete (0x0e) plen 10                #18 [hci1] 0.927852
      LE Read Buffer v2 (0x08|0x0060) ncmd 1
        Status: Success (0x00)
        ACL MTU: 27
        ACL max packet: 3
        ISO MTU: 318
        ISO max packet: 3
< HCI Command: LE Read Maximum Adve.. (0x08|0x003a) plen 0  #19 [hci1] 0.947456
> HCI Event: Command Complete (0x0e) plen 6                 #20 [hci1] 0.947834
      LE Read Maximum Advertising Data Length (0x08|0x003a) ncmd 1
        Status: Success (0x00)
        Max length: 1650
< HCI Command: LE Read Supported St.. (0x08|0x001c) plen 0  #21 [hci1] 0.967367
> HCI Event: Command Complete (0x0e) plen 12                #22 [hci1] 0.967840
      LE Read Supported States (0x08|0x001c) ncmd 1
        Status: Success (0x00)
        States: 0x000003ff3e0306ff
          Non-connectable Advertising State
          Scannable Advertising State
          Connectable Advertising State
          High Duty Cycle Directed Advertising State
          Passive Scanning State
          Active Scanning State
          Initiating State
            and Connection State (Central Role)
          Connection State (Peripheral Role)
          Scannable Advertising State
            and Passive Scanning State
          Connectable Advertising State
            and Passive Scanning State
          Non-connectable Advertising State
            and Initiating State
          Scannable Advertising State
            and Initiating State
          Active Scanning State
            and Connection State (Central Role)
          Passive Scanning State
            and Connection State (Peripheral Role)
          Active Scanning State
            and Connection State (Peripheral Role)
          Initiating State
            and Connection State (Central Role)
            and Central Role & Central Role
          Low Duty Cycle Directed Advertising State
          Connectable Advertising State
            and Initiating State
            and Central Role & Peripheral Role
          High Duty Cycle Directed Advertising State
            and Initiating State
            and Central Role & Peripheral Role
          Low Duty Cycle Directed Advertising State
            and Initiating State
            and Central Role & Peripheral Role
          Connectable Advertising State
            and Connection State (Central Role)
            and Central Role & Peripheral Role
          High Duty Cycle Directed Advertising State
            and Connection State (Central Role)
            and Central Role & Peripheral Role
          Low Duty Cycle Directed Advertising State
            and Connection State (Central Role)
            and Central Role & Peripheral Role
          Connectable Advertising State
            and Connection State (Peripheral Role)
            and Central Role & Peripheral Role
          High Duty Cycle Directed Advertising State
            and Connection State (Peripheral Role)
            and Peripheral Role & Peripheral Role
          Low Duty Cycle Directed Advertising State
            and Connection State (Peripheral Role)
            and Peripheral Role & Peripheral Role
          Initiating State
            and Connection State (Peripheral Role)
            and Central Role & Peripheral Role
< HCI Command: LE Read Maximum Data.. (0x08|0x002f) plen 0  #23 [hci1] 0.987402
> HCI Event: Command Complete (0x0e) plen 12                #24 [hci1] 0.987814
      LE Read Maximum Data Length (0x08|0x002f) ncmd 1
        Status: Success (0x00)
        Max TX octets: 251
        Max TX time: 2704
        Max RX octets: 251
        Max RX time: 2704
< HCI Command: LE Write Suggested D.. (0x08|0x0024) plen 4  #25 [hci1] 1.007437
        TX octets: 251
        TX time: 2704
> HCI Event: Command Complete (0x0e) plen 4                 #26 [hci1] 1.007907
      LE Write Suggested Default Data Length (0x08|0x0024) ncmd 1
        Status: Success (0x00)
< HCI Command: LE Read Resolving Li.. (0x08|0x002a) plen 0  #27 [hci1] 1.027405
> HCI Event: Command Complete (0x0e) plen 5                 #28 [hci1] 1.027838
      LE Read Resolving List Size (0x08|0x002a) ncmd 1
        Status: Success (0x00)
        Size: 8
< HCI Command: LE Set Event Mask (0x08|0x0001) plen 8       #29 [hci1] 1.047425
        Mask: 0x000002023f87fa5e
          LE Advertising Report
          LE Connection Update Complete
          LE Read Remote Used Features Complete
          LE Long Term Key Request
          LE Data Length Change
          LE Enhanced Connection Complete
          LE PHY Update Complete
          LE Extended Advertising Report
          LE Periodic Advertising Sync Established
          LE Periodic Advertising Report
          LE Periodic Advertising Sync Lost
          LE Extended Scan Timeout
          LE Extended Advertising Set Terminated
          LE Scan Request Received
          LE Periodic Advertising Sync Transfer Rvc
          LE CIS Established
          LE CIS Request
          LE Create BIG Complete
          LE Terminate BIG Complete
          LE BIG Sync Estabilished Complete
          LE BIG Sync Lost
          LE BIG Info Advertising Report
          Unknown mask (0x0000020000000000)
> HCI Event: Command Complete (0x0e) plen 4                 #30 [hci1] 1.047976
      LE Set Event Mask (0x08|0x0001) ncmd 1
        Status: Success (0x00)
< HCI Command: Set Event Mask (0x03|0x0001) plen 8          #31 [hci1] 1.067430
        Mask: 0x2000800002008890
          Disconnection Complete
          Encryption Change
          Read Remote Version Information Complete
          Hardware Error
          Data Buffer Overflow
          Encryption Key Refresh Complete
          LE Meta
> HCI Event: Command Complete (0x0e) plen 4                 #32 [hci1] 1.067918
      Set Event Mask (0x03|0x0001) ncmd 1
        Status: Success (0x00)
< HCI Command: Read BD ADDR (0x04|0x0009) plen 0            #33 [hci1] 1.087423
> HCI Event: Command Complete (0x0e) plen 10                #34 [hci1] 1.087886
      Read BD ADDR (0x04|0x0009) ncmd 1
        Status: Success (0x00)
        Address: 00:00:00:00:00:00 (OUI 00-00-00)
< HCI Command: LE Set Random Address (0x08|0x0005) plen 6   #35 [hci1] 1.107445
        Address: D5:B6:CC:31:DB:3B (Static)
> HCI Event: Command Complete (0x0e) plen 4                 #36 [hci1] 1.107910
      LE Set Random Address (0x08|0x0005) ncmd 1
        Status: Success (0x00)
< HCI Command: LE Set Extended Adv.. (0x08|0x0036) plen 25  #37 [hci1] 3.658003
        Handle: 0x00
        Properties: 0x0013
          Connectable
          Scannable
          Use legacy advertising PDUs: ADV_IND
        Min advertising interval: 100.000 msec (0x00a0)
        Max advertising interval: 150.000 msec (0x00f0)
        Channel map: 37, 38, 39 (0x07)
        Own address type: Random (0x01)
        Peer address type: Public (0x00)
        Peer address: 00:00:00:00:00:00 (OUI 00-00-00)
        Filter policy: Allow Scan Request from Any, Allow Connect Request from Any (0x00)
        TX power: Host has no preference (0x7f)
        Primary PHY: LE 1M (0x01)
        Secondary max skip: 0x00
        Secondary PHY: LE 1M (0x01)
        SID: 0x00
        Scan request notifications: Disabled (0x00)
> HCI Event: Command Complete (0x0e) plen 5                 #38 [hci1] 3.658853
      LE Set Extended Advertising Parameters (0x08|0x0036) ncmd 1
        Status: Success (0x00)
        TX power (selected): 0 dbm (0x00)
< HCI Command: LE Set Advertising S.. (0x08|0x0035) plen 7  #39 [hci1] 3.667849
        Advertising handle: 0x00
        Advertising random address: D5:B6:CC:31:DB:3B (Static)
> HCI Event: Command Complete (0x0e) plen 4                 #40 [hci1] 3.668362
      LE Set Advertising Set Random Address (0x08|0x0035) ncmd 1
        Status: Success (0x00)
< HCI Command: LE Set Extended Adv.. (0x08|0x0037) plen 22  #41 [hci1] 3.687673
        Handle: 0x00
        Operation: Complete extended advertising data (0x03)
        Fragment preference: Minimize fragmentation (0x01)
        Data length: 0x12
        Flags: 0x06
          LE General Discoverable Mode
          BR/EDR Not Supported
        Name (complete): Tester_F6B11A
> HCI Event: Command Complete (0x0e) plen 4                 #42 [hci1] 3.688383
      LE Set Extended Advertising Data (0x08|0x0037) ncmd 1
        Status: Success (0x00)
< HCI Command: LE Set Extended Scan.. (0x08|0x0038) plen 4  #43 [hci1] 3.707504
        Handle: 0x00
        Operation: Complete scan response data (0x03)
        Fragment preference: Minimize fragmentation (0x01)
        Data length: 0x00
> HCI Event: Command Complete (0x0e) plen 4                 #44 [hci1] 3.707991
      LE Set Extended Scan Response Data (0x08|0x0038) ncmd 1
        Status: Success (0x00)
< HCI Command: LE Set Extended Adve.. (0x08|0x0039) plen 6  #45 [hci1] 3.727469
        Extended advertising: Enabled (0x01)
        Number of sets: 1 (0x01)
        Entry 0
          Handle: 0x00
          Duration: 0 ms (0x00)
          Max ext adv events: 0
> HCI Event: Command Complete (0x0e) plen 4                 #46 [hci1] 3.728072
      LE Set Extended Advertising Enable (0x08|0x0039) ncmd 1
        Status: Success (0x00)
> HCI Event: LE Meta Event (0x3e) plen 31                   #47 [hci1] 3.840203
      LE Enhanced Connection Complete (0x0a)
        Status: Success (0x00)
        Handle: 1245
        Role: Peripheral (0x01)
        Peer address type: Public (0x00)
        Peer address: DF:A9:FF:F6:B1:1A (OUI DF-A9-FF)
        Local resolvable private address: 00:00:00:00:00:00 (Non-Resolvable)
        Peer resolvable private address: 00:00:00:00:00:00 (Non-Resolvable)
        Connection interval: 87.50 msec (0x0046)
        Connection latency: 0 (0x0000)
        Supervision timeout: 25120 msec (0x09d0)
        Central clock accuracy: 0x01
> HCI Event: LE Meta Event (0x3e) plen 6                    #48 [hci1] 3.840210
      LE Advertising Set Terminated (0x12)
        Status: Success (0x00)
        Handle: 0
        Connection handle: 1245
        Number of completed extended advertising events: 0
< HCI Command: LE Read Remote Used... (0x08|0x0016) plen 2  #49 [hci1] 3.848813
        Handle: 1245 Address: DF:A9:FF:F6:B1:1A (OUI DF-A9-FF)
< ACL Data TX: Handle 1245 flags 0x00 dlen 7                #50 [hci1] 3.848852
      ATT: Exchange MTU Request (0x02) len 2
        Client RX MTU: 251
> HCI Event: Command Status (0x0f) plen 4                   #51 [hci1] 3.849275
      LE Read Remote Used Features (0x08|0x0016) ncmd 1
        Status: Success (0x00)
> HCI Event: Number of Completed Packets (0x13) plen 5      #52 [hci1] 4.016145
        Num handles: 1
        Handle: 1245 Address: DF:A9:FF:F6:B1:1A (OUI DF-A9-FF)
        Count: 1
        #50: len 7 (0 Kb/s)
        Latency: 167 msec (167-167 msec ~167 msec)
> HCI Event: LE Meta Event (0x3e) plen 12                   #53 [hci1] 4.104066
      LE Read Remote Used Features (0x04)
        Status: Success (0x00)
        Handle: 1245 Address: DF:A9:FF:F6:B1:1A (OUI DF-A9-FF)
        Features: 0x2d 0x49 0x00 0xf7 0x67 0xd9 0x00 0x80
          LE Encryption
          Extended Reject Indication
          Peripheral-initiated Features Exchange
          LE Data Packet Length Extension
          LE 2M PHY
          LE Coded PHY
          Channel Selection Algorithm #2
          Periodic Advertising Sync Transfer - Sender
          Periodic Advertising Sync Transfer - Recipient
          Sleep Clock Accuracy Updates
          Connected Isochronous Stream - Central
          Connected Isochronous Stream - Peripheral
          Isochronous Broadcaster
          Synchronized Receiver
          Connected Isochronous Stream (Host Support)
          LE Power Control Request
          LE Power Control Request
          Connection Subrating
          Connection Subrating (Host Support)
          Unknown features (0x8000d90000000000)
> ACL Data RX: Handle 1245 flags 0x02 dlen 11               #54 [hci1] 6.553705
      SMP: Pairing Request (0x01) len 6
        IO capability: KeyboardDisplay (0x04)
        OOB data: Authentication data not present (0x00)
        Authentication requirement: Bonding, MITM, SC, No Keypresses (0x0d)
        Max encryption key size: 16
        Initiator key distribution: EncKey IdKey (0x03)
        Responder key distribution: EncKey IdKey Sign (0x07)
> ACL Data RX: Handle 1245 flags 0x02 dlen 7                #55 [hci1] 6.554274
      ATT: Exchange MTU Response (0x03) len 2
        Server RX MTU: 23
< HCI Command: Host Number of Compl.. (0x03|0x0035) plen 5  #56 [hci1] 6.567637
        Num handles: 1
        Handle: 1245 Address: DF:A9:FF:F6:B1:1A (OUI DF-A9-FF)
        Count: 1
< ACL Data TX: Handle 1245 flags 0x00 dlen 11               #57 [hci1] 6.567709
      SMP: Pairing Response (0x02) len 6
        IO capability: DisplayOnly (0x00)
        OOB data: Authentication data not present (0x00)
        Authentication requirement: Bonding, No MITM, SC, No Keypresses (0x09)
        Max encryption key size: 16
        Initiator key distribution: IdKey (0x02)
        Responder key distribution: <none> (0x00)
< HCI Command: Host Number of Compl.. (0x03|0x0035) plen 5  #58 [hci1] 6.568060
        Num handles: 1
        Handle: 1245 Address: DF:A9:FF:F6:B1:1A (OUI DF-A9-FF)
        Count: 1
> HCI Event: Number of Completed Packets (0x13) plen 5      #59 [hci1] 6.728823
        Num handles: 1
        Handle: 1245 Address: DF:A9:FF:F6:B1:1A (OUI DF-A9-FF)
        Count: 1
        #57: len 11 (0 Kb/s)
        Latency: 161 msec (161-167 msec ~164 msec)
> ACL Data RX: Handle 1245 flags 0x02 dlen 27               #60 [hci1] 6.729139
> ACL Data RX: Handle 1245 flags 0x01 dlen 27               #61 [hci1] 6.729723
> ACL Data RX: Handle 1245 flags 0x01 dlen 15               #62 [hci1] 6.730153
      SMP: Pairing Public Key (0x0c) len 64
        X: 25d46cc033cd8ea0f7aa6bc67fef088a10cb74d6820db4e80d95d7ce2f42a9e7
        Y: 1de450b0eb44fede003de9d1fbbf3c29fc12ce852b0274ec5691e05742d58294
< HCI Command: Host Number of Compl.. (0x03|0x0035) plen 5  #63 [hci1] 6.748600
        Num handles: 1
        Handle: 1245 Address: DF:A9:FF:F6:B1:1A (OUI DF-A9-FF)
        Count: 1
< HCI Command: Host Number of Compl.. (0x03|0x0035) plen 5  #64 [hci1] 6.748893
        Num handles: 1
        Handle: 1245 Address: DF:A9:FF:F6:B1:1A (OUI DF-A9-FF)
        Count: 1
< HCI Command: Host Number of Compl.. (0x03|0x0035) plen 5  #65 [hci1] 6.749301
        Num handles: 1
        Handle: 1245 Address: DF:A9:FF:F6:B1:1A (OUI DF-A9-FF)
        Count: 1
< ACL Data TX: Handle 1245 flags 0x00 dlen 27               #66 [hci1] 6.749485
< ACL Data TX: Handle 1245 flags 0x01 dlen 27               #67 [hci1] 6.749503
< ACL Data TX: Handle 1245 flags 0x01 dlen 15               #68 [hci1] 6.749545
      SMP: Pairing Public Key (0x0c) len 64
        X: 98308440221e2d910f0e54b71e7ec652857aa9b5a0dc65028824cc19db1226e9
        Y: 67a4816bcb62efb21701e31fdb27561a6217575fb007a8bbdabe7e28b6f68482
> HCI Event: Number of Completed Packets (0x13) plen 5      #69 [hci1] 6.816756
        Num handles: 1
        Handle: 1245 Address: DF:A9:FF:F6:B1:1A (OUI DF-A9-FF)
        Count: 1
        #66: len 27 (3 Kb/s)
        Latency: 67 msec (67-167 msec ~115 msec)
> HCI Event: Number of Completed Packets (0x13) plen 5      #70 [hci1] 6.817461
        Num handles: 1
        Handle: 1245 Address: DF:A9:FF:F6:B1:1A (OUI DF-A9-FF)
        Count: 1
        #67: len 27 (3 Kb/s)
        Latency: 67 msec (67-167 msec ~91 msec)
> HCI Event: Number of Completed Packets (0x13) plen 5      #71 [hci1] 6.903685
        Num handles: 1
        Handle: 1245 Address: DF:A9:FF:F6:B1:1A (OUI DF-A9-FF)
        Count: 1
        #68: len 15 (0 Kb/s)
        Latency: 154 msec (67-167 msec ~122 msec)
> ACL Data RX: Handle 1245 flags 0x02 dlen 21               #72 [hci1] 7.866465
      SMP: Pairing Confirm (0x03) len 16
        Confim value: 7fdd8ba1c0b50ef030eb14bc1b8a75f7
< HCI Command: Host Number of Compl.. (0x03|0x0035) plen 5  #73 [hci1] 7.867894
        Num handles: 1
        Handle: 1245 Address: DF:A9:FF:F6:B1:1A (OUI DF-A9-FF)
        Count: 1
< ACL Data TX: Handle 1245 flags 0x00 dlen 21               #74 [hci1] 7.867964
      SMP: Pairing Confirm (0x03) len 16
        Confim value: edc944a1447c0c0667917fa14b9a9b72
> HCI Event: Number of Completed Packets (0x13) plen 5      #75 [hci1] 8.041285
        Num handles: 1
        Handle: 1245 Address: DF:A9:FF:F6:B1:1A (OUI DF-A9-FF)
        Count: 1
        #74: len 21 (0 Kb/s)
        Latency: 173 msec (67-173 msec ~148 msec)
> ACL Data RX: Handle 1245 flags 0x02 dlen 21               #76 [hci1] 8.041561
      SMP: Pairing Random (0x04) len 16
        Random value: 7ddca7430e18f56e0000000000000000
< HCI Command: Host Number of Compl.. (0x03|0x0035) plen 5  #77 [hci1] 8.047771
        Num handles: 1
        Handle: 1245 Address: DF:A9:FF:F6:B1:1A (OUI DF-A9-FF)
        Count: 1
< ACL Data TX: Handle 1245 flags 0x00 dlen 21               #78 [hci1] 8.047823
      SMP: Pairing Random (0x04) len 16
        Random value: 8e6108f966a694cbe26df70bb96773e6
> HCI Event: Number of Completed Packets (0x13) plen 5      #79 [hci1] 8.216024
        Num handles: 1
        Handle: 1245 Address: DF:A9:FF:F6:B1:1A (OUI DF-A9-FF)
        Count: 1
        #78: len 21 (1 Kb/s)
        Latency: 168 msec (67-173 msec ~158 msec)
> ACL Data RX: Handle 1245 flags 0x02 dlen 21               #80 [hci1] 8.303954
      SMP: Pairing Confirm (0x03) len 16
        Confim value: 5b2ca0993b18b0e53317f27a92ff68f9
< HCI Command: Host Number of Compl.. (0x03|0x0035) plen 5  #81 [hci1] 8.308044
        Num handles: 1
        Handle: 1245 Address: DF:A9:FF:F6:B1:1A (OUI DF-A9-FF)
        Count: 1
< ACL Data TX: Handle 1245 flags 0x00 dlen 21               #82 [hci1] 8.308182
      SMP: Pairing Confirm (0x03) len 16
        Confim value: 17335b5ec13dd0d4bf1388dba6c44536
> HCI Event: Number of Completed Packets (0x13) plen 5      #83 [hci1] 8.478709
        Num handles: 1
        Handle: 1245 Address: DF:A9:FF:F6:B1:1A (OUI DF-A9-FF)
        Count: 1
        #82: len 21 (0 Kb/s)
        Latency: 170 msec (67-173 msec ~164 msec)
> ACL Data RX: Handle 1245 flags 0x02 dlen 21               #84 [hci1] 8.479149
      SMP: Pairing Random (0x04) len 16
        Random value: a21fc96532a5ab750000000000000000
< HCI Command: Host Number of Compl.. (0x03|0x0035) plen 5  #85 [hci1] 8.488460
        Num handles: 1
        Handle: 1245 Address: DF:A9:FF:F6:B1:1A (OUI DF-A9-FF)
        Count: 1
< ACL Data TX: Handle 1245 flags 0x00 dlen 21               #86 [hci1] 8.488643
      SMP: Pairing Random (0x04) len 16
        Random value: 4d02679f89a05211af56d8b3da64d21e
> HCI Event: Number of Completed Packets (0x13) plen 5      #87 [hci1] 8.653545
        Num handles: 1
        Handle: 1245 Address: DF:A9:FF:F6:B1:1A (OUI DF-A9-FF)
        Count: 1
        #86: len 21 (1 Kb/s)
        Latency: 164 msec (67-173 msec ~164 msec)
> ACL Data RX: Handle 1245 flags 0x02 dlen 21               #88 [hci1] 8.741450
      SMP: Pairing Confirm (0x03) len 16
        Confim value: eada407369c745cbc19d95b457a3060e
< HCI Command: Host Number of Compl.. (0x03|0x0035) plen 5  #89 [hci1] 8.747559
        Num handles: 1
        Handle: 1245 Address: DF:A9:FF:F6:B1:1A (OUI DF-A9-FF)
        Count: 1
< ACL Data TX: Handle 1245 flags 0x00 dlen 21               #90 [hci1] 8.747625
      SMP: Pairing Confirm (0x03) len 16
        Confim value: b00a3c88c74bf7b0135a9b88f196ad4b
> HCI Event: Number of Completed Packets (0x13) plen 5      #91 [hci1] 8.916273
        Num handles: 1
        Handle: 1245 Address: DF:A9:FF:F6:B1:1A (OUI DF-A9-FF)
        Count: 1
        #90: len 21 (1 Kb/s)
        Latency: 168 msec (67-173 msec ~166 msec)
> ACL Data RX: Handle 1245 flags 0x02 dlen 21               #92 [hci1] 8.916643
      SMP: Pairing Random (0x04) len 16
        Random value: 9835d9f0d9b2a7340000000000000000
< HCI Command: Host Number of Compl.. (0x03|0x0035) plen 5  #93 [hci1] 8.928342
        Num handles: 1
        Handle: 1245 Address: DF:A9:FF:F6:B1:1A (OUI DF-A9-FF)
        Count: 1
< ACL Data TX: Handle 1245 flags 0x00 dlen 21               #94 [hci1] 8.928482
      SMP: Pairing Random (0x04) len 16
        Random value: 5e8286bc235a02440d0c3424a2acf8fd
> HCI Event: Number of Completed Packets (0x13) plen 5      #95 [hci1] 9.091030
        Num handles: 1
        Handle: 1245 Address: DF:A9:FF:F6:B1:1A (OUI DF-A9-FF)
        Count: 1
        #94: len 21 (1 Kb/s)
        Latency: 162 msec (67-173 msec ~164 msec)
> ACL Data RX: Handle 1245 flags 0x02 dlen 21               #96 [hci1] 9.178872
      SMP: Pairing Confirm (0x03) len 16
        Confim value: 9ec61cbaf31c9ac1da1e6677deb4477e
< HCI Command: Host Number of Compl.. (0x03|0x0035) plen 5  #97 [hci1] 9.187797
        Num handles: 1
        Handle: 1245 Address: DF:A9:FF:F6:B1:1A (OUI DF-A9-FF)
        Count: 1
< ACL Data TX: Handle 1245 flags 0x00 dlen 21               #98 [hci1] 9.187904
      SMP: Pairing Confirm (0x03) len 16
        Confim value: 846394dda3746ecda108d6731c12453e
> HCI Event: Number of Completed Packets (0x13) plen 5      #99 [hci1] 9.353729
        Num handles: 1
        Handle: 1245 Address: DF:A9:FF:F6:B1:1A (OUI DF-A9-FF)
        Count: 1
        #98: len 21 (1 Kb/s)
        Latency: 165 msec (67-173 msec ~165 msec)
> ACL Data RX: Handle 1245 flags 0x02 dlen 21              #100 [hci1] 9.354122
      SMP: Pairing Random (0x04) len 16
        Random value: 26e2d21d8677b2d10000000000000000
< HCI Command: Host Number of Comp.. (0x03|0x0035) plen 5  #101 [hci1] 9.368344
        Num handles: 1
        Handle: 1245 Address: DF:A9:FF:F6:B1:1A (OUI DF-A9-FF)
        Count: 1
< ACL Data TX: Handle 1245 flags 0x00 dlen 21              #102 [hci1] 9.368505
      SMP: Pairing Random (0x04) len 16
        Random value: 5c4a1bcadd27bd58e945097b00bad7ac
> HCI Event: Number of Completed Packets (0x13) plen 5     #103 [hci1] 9.528597
        Num handles: 1
        Handle: 1245 Address: DF:A9:FF:F6:B1:1A (OUI DF-A9-FF)
        Count: 1
        #102: len 21 (1 Kb/s)
        Latency: 160 msec (67-173 msec ~162 msec)
> ACL Data RX: Handle 1245 flags 0x02 dlen 21              #104 [hci1] 9.616359
      SMP: Pairing Confirm (0x03) len 16
        Confim value: 7f9040670c491029189aff89d93ea0ea
< HCI Command: Host Number of Comp.. (0x03|0x0035) plen 5  #105 [hci1] 9.627637
        Num handles: 1
        Handle: 1245 Address: DF:A9:FF:F6:B1:1A (OUI DF-A9-FF)
        Count: 1
< ACL Data TX: Handle 1245 flags 0x00 dlen 21              #106 [hci1] 9.627716
      SMP: Pairing Confirm (0x03) len 16
        Confim value: ef095de2b3493f804aff5c91c7d7e1d7
> HCI Event: Number of Completed Packets (0x13) plen 5     #107 [hci1] 9.791188
        Num handles: 1
        Handle: 1245 Address: DF:A9:FF:F6:B1:1A (OUI DF-A9-FF)
        Count: 1
        #106: len 21 (1 Kb/s)
        Latency: 163 msec (67-173 msec ~163 msec)
> ACL Data RX: Handle 1245 flags 0x02 dlen 21              #108 [hci1] 9.791623
      SMP: Pairing Random (0x04) len 16
        Random value: 33a067372e482b190000000000000000
< HCI Command: Host Number of Comp.. (0x03|0x0035) plen 5  #109 [hci1] 9.808322
        Num handles: 1
        Handle: 1245 Address: DF:A9:FF:F6:B1:1A (OUI DF-A9-FF)
        Count: 1
< ACL Data TX: Handle 1245 flags 0x00 dlen 21              #110 [hci1] 9.808405
      SMP: Pairing Random (0x04) len 16
        Random value: 32527e6e64e79f33b2e374394db8ab2d
> HCI Event: Number of Completed Packets (0x13) plen 5     #111 [hci1] 9.966047
        Num handles: 1
        Handle: 1245 Address: DF:A9:FF:F6:B1:1A (OUI DF-A9-FF)
        Count: 1
        #110: len 21 (1 Kb/s)
        Latency: 157 msec (67-173 msec ~160 msec)
> ACL Data RX: Handle 1245 flags 0x02 dlen 21             #112 [hci1] 10.053917
      SMP: Pairing Confirm (0x03) len 16
        Confim value: 819ed3577ffd8f0cb897257f47b4e1c8
< HCI Command: Host Number of Com.. (0x03|0x0035) plen 5  #113 [hci1] 10.068145
        Num handles: 1
        Handle: 1245 Address: DF:A9:FF:F6:B1:1A (OUI DF-A9-FF)
        Count: 1
< ACL Data TX: Handle 1245 flags 0x00 dlen 21             #114 [hci1] 10.068324
      SMP: Pairing Confirm (0x03) len 16
        Confim value: 915d3416fcb249ea208b00974e0f5693
> HCI Event: Number of Completed Packets (0x13) plen 5    #115 [hci1] 10.228742
        Num handles: 1
        Handle: 1245 Address: DF:A9:FF:F6:B1:1A (OUI DF-A9-FF)
        Count: 1
        #114: len 21 (1 Kb/s)
        Latency: 160 msec (67-173 msec ~160 msec)
> ACL Data RX: Handle 1245 flags 0x02 dlen 21             #116 [hci1] 10.229006
      SMP: Pairing Random (0x04) len 16
        Random value: 4f2c3cecd14649650000000000000000
< HCI Command: Host Number of Com.. (0x03|0x0035) plen 5  #117 [hci1] 10.248414
        Num handles: 1
        Handle: 1245 Address: DF:A9:FF:F6:B1:1A (OUI DF-A9-FF)
        Count: 1
< ACL Data TX: Handle 1245 flags 0x00 dlen 21             #118 [hci1] 10.248578
      SMP: Pairing Random (0x04) len 16
        Random value: dddbdfe2838e9a8cc6964353c850fef7
> HCI Event: Number of Completed Packets (0x13) plen 5    #119 [hci1] 10.403561
        Num handles: 1
        Handle: 1245 Address: DF:A9:FF:F6:B1:1A (OUI DF-A9-FF)
        Count: 1
        #118: len 21 (1 Kb/s)
        Latency: 154 msec (67-173 msec ~157 msec)
> ACL Data RX: Handle 1245 flags 0x02 dlen 21             #120 [hci1] 10.491481
      SMP: Pairing Confirm (0x03) len 16
        Confim value: 96ca3b0fec31fb7efa224d9555d69a4b
< HCI Command: Host Number of Com.. (0x03|0x0035) plen 5  #121 [hci1] 10.508203
        Num handles: 1
        Handle: 1245 Address: DF:A9:FF:F6:B1:1A (OUI DF-A9-FF)
        Count: 1
< ACL Data TX: Handle 1245 flags 0x00 dlen 21             #122 [hci1] 10.508364
      SMP: Pairing Confirm (0x03) len 16
        Confim value: 0d098dd0eec94786116e5dc57bd8e356
> HCI Event: Number of Completed Packets (0x13) plen 5    #123 [hci1] 10.666226
        Num handles: 1
        Handle: 1245 Address: DF:A9:FF:F6:B1:1A (OUI DF-A9-FF)
        Count: 1
        #122: len 21 (1 Kb/s)
        Latency: 157 msec (67-173 msec ~157 msec)
> ACL Data RX: Handle 1245 flags 0x02 dlen 21             #124 [hci1] 10.666660
      SMP: Pairing Random (0x04) len 16
        Random value: 90e9d0772337dd910000000000000000
< HCI Command: Host Number of Com.. (0x03|0x0035) plen 5  #125 [hci1] 10.668242
        Num handles: 1
        Handle: 1245 Address: DF:A9:FF:F6:B1:1A (OUI DF-A9-FF)
        Count: 1
< ACL Data TX: Handle 1245 flags 0x00 dlen 21             #126 [hci1] 10.668391
      SMP: Pairing Random (0x04) len 16
        Random value: eb9f1915536596b6fc3db1c86b2b1970
> HCI Event: Number of Completed Packets (0x13) plen 5    #127 [hci1] 10.841073
        Num handles: 1
        Handle: 1245 Address: DF:A9:FF:F6:B1:1A (OUI DF-A9-FF)
        Count: 1
        #126: len 21 (0 Kb/s)
        Latency: 172 msec (67-173 msec ~165 msec)
> ACL Data RX: Handle 1245 flags 0x02 dlen 21             #128 [hci1] 10.928888
      SMP: Pairing Confirm (0x03) len 16
        Confim value: d8cfd8d9504a8bb55b7532184fe27beb
< HCI Command: Host Number of Com.. (0x03|0x0035) plen 5  #129 [hci1] 10.948126
        Num handles: 1
        Handle: 1245 Address: DF:A9:FF:F6:B1:1A (OUI DF-A9-FF)
        Count: 1
< ACL Data TX: Handle 1245 flags 0x00 dlen 21             #130 [hci1] 10.948253
      SMP: Pairing Confirm (0x03) len 16
        Confim value: fa6d4589caddf931e59e6858c1c1a7c3
> HCI Event: Number of Completed Packets (0x13) plen 5    #131 [hci1] 11.103772
        Num handles: 1
        Handle: 1245 Address: DF:A9:FF:F6:B1:1A (OUI DF-A9-FF)
        Count: 1
        #130: len 21 (1 Kb/s)
        Latency: 155 msec (67-173 msec ~160 msec)
> ACL Data RX: Handle 1245 flags 0x02 dlen 21             #132 [hci1] 11.103993
      SMP: Pairing Random (0x04) len 16
        Random value: 32f56ed3552833840000000000000000
< HCI Command: Host Number of Com.. (0x03|0x0035) plen 5  #133 [hci1] 11.108329
        Num handles: 1
        Handle: 1245 Address: DF:A9:FF:F6:B1:1A (OUI DF-A9-FF)
        Count: 1
< ACL Data TX: Handle 1245 flags 0x00 dlen 21             #134 [hci1] 11.108475
      SMP: Pairing Random (0x04) len 16
        Random value: 5c794dc9ad9f2c3f295ebd5ad5e1c3cf
> HCI Event: Number of Completed Packets (0x13) plen 5    #135 [hci1] 11.278571
        Num handles: 1
        Handle: 1245 Address: DF:A9:FF:F6:B1:1A (OUI DF-A9-FF)
        Count: 1
        #134: len 21 (0 Kb/s)
        Latency: 170 msec (67-173 msec ~165 msec)
> ACL Data RX: Handle 1245 flags 0x02 dlen 21             #136 [hci1] 11.366371
      SMP: Pairing Confirm (0x03) len 16
        Confim value: 6bd4467a7bd61d26e72c75706375a279
< HCI Command: Host Number of Com.. (0x03|0x0035) plen 5  #137 [hci1] 11.367767
        Num handles: 1
        Handle: 1245 Address: DF:A9:FF:F6:B1:1A (OUI DF-A9-FF)
        Count: 1
< ACL Data TX: Handle 1245 flags 0x00 dlen 21             #138 [hci1] 11.367861
      SMP: Pairing Confirm (0x03) len 16
        Confim value: f08247de3d624ccc6b187f13b1278227
> HCI Event: Number of Completed Packets (0x13) plen 5    #139 [hci1] 11.541206
        Num handles: 1
        Handle: 1245 Address: DF:A9:FF:F6:B1:1A (OUI DF-A9-FF)
        Count: 1
        #138: len 21 (0 Kb/s)
        Latency: 173 msec (67-173 msec ~169 msec)
> ACL Data RX: Handle 1245 flags 0x02 dlen 21             #140 [hci1] 11.541514
      SMP: Pairing Random (0x04) len 16
        Random value: 64ecfa515249cd2e0000000000000000
< HCI Command: Host Number of Com.. (0x03|0x0035) plen 5  #141 [hci1] 11.548364
        Num handles: 1
        Handle: 1245 Address: DF:A9:FF:F6:B1:1A (OUI DF-A9-FF)
        Count: 1
< ACL Data TX: Handle 1245 flags 0x00 dlen 21             #142 [hci1] 11.548496
      SMP: Pairing Random (0x04) len 16
        Random value: 5c2fff312cdf99c9491988e877355a9a
> HCI Event: Number of Completed Packets (0x13) plen 5    #143 [hci1] 11.716169
        Num handles: 1
        Handle: 1245 Address: DF:A9:FF:F6:B1:1A (OUI DF-A9-FF)
        Count: 1
        #142: len 21 (1 Kb/s)
        Latency: 167 msec (67-173 msec ~168 msec)
> ACL Data RX: Handle 1245 flags 0x02 dlen 21             #144 [hci1] 11.716552
      SMP: Pairing Confirm (0x03) len 16
        Confim value: e65e3a8ac7262a3b4d95d55476aac668
< HCI Command: Host Number of Com.. (0x03|0x0035) plen 5  #145 [hci1] 11.727775
        Num handles: 1
        Handle: 1245 Address: DF:A9:FF:F6:B1:1A (OUI DF-A9-FF)
        Count: 1
< ACL Data TX: Handle 1245 flags 0x00 dlen 21             #146 [hci1] 11.727834
      SMP: Pairing Confirm (0x03) len 16
        Confim value: 3d1240d588c6b43d0608c1b1d1211981
> HCI Event: Number of Completed Packets (0x13) plen 5    #147 [hci1] 11.891258
        Num handles: 1
        Handle: 1245 Address: DF:A9:FF:F6:B1:1A (OUI DF-A9-FF)
        Count: 1
        #146: len 21 (1 Kb/s)
        Latency: 163 msec (67-173 msec ~165 msec)
> ACL Data RX: Handle 1245 flags 0x02 dlen 21             #148 [hci1] 11.891561
      SMP: Pairing Random (0x04) len 16
        Random value: 09fc152572d310520000000000000000
< HCI Command: Host Number of Com.. (0x03|0x0035) plen 5  #149 [hci1] 11.908384
        Num handles: 1
        Handle: 1245 Address: DF:A9:FF:F6:B1:1A (OUI DF-A9-FF)
        Count: 1
< ACL Data TX: Handle 1245 flags 0x00 dlen 21             #150 [hci1] 11.908560
      SMP: Pairing Random (0x04) len 16
        Random value: c629a3a987d808e808655d558dfc1155
> HCI Event: Number of Completed Packets (0x13) plen 5    #151 [hci1] 12.066049
        Num handles: 1
        Handle: 1245 Address: DF:A9:FF:F6:B1:1A (OUI DF-A9-FF)
        Count: 1
        #150: len 21 (1 Kb/s)
        Latency: 157 msec (67-173 msec ~161 msec)
> ACL Data RX: Handle 1245 flags 0x02 dlen 21             #152 [hci1] 12.153881
      SMP: Pairing Confirm (0x03) len 16
        Confim value: 3f0eff558d772c91fbd505fb37d1fd71
< HCI Command: Host Number of Com.. (0x03|0x0035) plen 5  #153 [hci1] 12.168136
        Num handles: 1
        Handle: 1245 Address: DF:A9:FF:F6:B1:1A (OUI DF-A9-FF)
        Count: 1
< ACL Data TX: Handle 1245 flags 0x00 dlen 21             #154 [hci1] 12.168204
      SMP: Pairing Confirm (0x03) len 16
        Confim value: fdfe2c10e1abbd1ebb7a8f46edf55925
> HCI Event: Number of Completed Packets (0x13) plen 5    #155 [hci1] 12.328663
        Num handles: 1
        Handle: 1245 Address: DF:A9:FF:F6:B1:1A (OUI DF-A9-FF)
        Count: 1
        #154: len 21 (1 Kb/s)
        Latency: 160 msec (67-173 msec ~161 msec)
> ACL Data RX: Handle 1245 flags 0x02 dlen 21             #156 [hci1] 12.329038
      SMP: Pairing Random (0x04) len 16
        Random value: 3717d7b2262566600000000000000000
< HCI Command: Host Number of Com.. (0x03|0x0035) plen 5  #157 [hci1] 12.348329
        Num handles: 1
        Handle: 1245 Address: DF:A9:FF:F6:B1:1A (OUI DF-A9-FF)
        Count: 1
< ACL Data TX: Handle 1245 flags 0x00 dlen 21             #158 [hci1] 12.348416
      SMP: Pairing Random (0x04) len 16
        Random value: 92f20f6ad8f13724432c7fd6001c45ff
> HCI Event: Number of Completed Packets (0x13) plen 5    #159 [hci1] 12.503477
        Num handles: 1
        Handle: 1245 Address: DF:A9:FF:F6:B1:1A (OUI DF-A9-FF)
        Count: 1
        #158: len 21 (1 Kb/s)
        Latency: 155 msec (67-173 msec ~158 msec)
> ACL Data RX: Handle 1245 flags 0x02 dlen 21             #160 [hci1] 12.591506
      SMP: Pairing Confirm (0x03) len 16
        Confim value: a4e14773eaf024f51a961bf7135cf0ad
< HCI Command: Host Number of Com.. (0x03|0x0035) plen 5  #161 [hci1] 12.608166
        Num handles: 1
        Handle: 1245 Address: DF:A9:FF:F6:B1:1A (OUI DF-A9-FF)
        Count: 1
< ACL Data TX: Handle 1245 flags 0x00 dlen 21             #162 [hci1] 12.608360
      SMP: Pairing Confirm (0x03) len 16
        Confim value: 0c506884b0f30d252b22fc874c464190
> HCI Event: Number of Completed Packets (0x13) plen 5    #163 [hci1] 12.766168
        Num handles: 1
        Handle: 1245 Address: DF:A9:FF:F6:B1:1A (OUI DF-A9-FF)
        Count: 1
        #162: len 21 (1 Kb/s)
        Latency: 157 msec (67-173 msec ~157 msec)
> ACL Data RX: Handle 1245 flags 0x02 dlen 21             #164 [hci1] 12.766495
      SMP: Pairing Random (0x04) len 16
        Random value: 81d320f65b75b9ec0000000000000000
< HCI Command: Host Number of Com.. (0x03|0x0035) plen 5  #165 [hci1] 12.768356
        Num handles: 1
        Handle: 1245 Address: DF:A9:FF:F6:B1:1A (OUI DF-A9-FF)
        Count: 1
< ACL Data TX: Handle 1245 flags 0x00 dlen 21             #166 [hci1] 12.768518
      SMP: Pairing Random (0x04) len 16
        Random value: 23ac32ebbb5e14c8a6b9622f296d277f
> HCI Event: Number of Completed Packets (0x13) plen 5    #167 [hci1] 12.940909
        Num handles: 1
        Handle: 1245 Address: DF:A9:FF:F6:B1:1A (OUI DF-A9-FF)
        Count: 1
        #166: len 21 (0 Kb/s)
        Latency: 172 msec (67-173 msec ~165 msec)
> ACL Data RX: Handle 1245 flags 0x02 dlen 21             #168 [hci1] 13.028891
      SMP: Pairing Confirm (0x03) len 16
        Confim value: 8d263f14b4675ea63bd269c498ecf23a
< HCI Command: Host Number of Com.. (0x03|0x0035) plen 5  #169 [hci1] 13.047720
        Num handles: 1
        Handle: 1245 Address: DF:A9:FF:F6:B1:1A (OUI DF-A9-FF)
        Count: 1
< ACL Data TX: Handle 1245 flags 0x00 dlen 21             #170 [hci1] 13.047768
      SMP: Pairing Confirm (0x03) len 16
        Confim value: d859e7515df914deedb7aa3c22d1ea45
> HCI Event: Number of Completed Packets (0x13) plen 5    #171 [hci1] 13.203760
        Num handles: 1
        Handle: 1245 Address: DF:A9:FF:F6:B1:1A (OUI DF-A9-FF)
        Count: 1
        #170: len 21 (1 Kb/s)
        Latency: 155 msec (67-173 msec ~160 msec)
> ACL Data RX: Handle 1245 flags 0x02 dlen 21             #172 [hci1] 13.204104
      SMP: Pairing Random (0x04) len 16
        Random value: d1ba62fcea3ee18a0000000000000000
< HCI Command: Host Number of Com.. (0x03|0x0035) plen 5  #173 [hci1] 13.208162
        Num handles: 1
        Handle: 1245 Address: DF:A9:FF:F6:B1:1A (OUI DF-A9-FF)
        Count: 1
< ACL Data TX: Handle 1245 flags 0x00 dlen 21             #174 [hci1] 13.208259
      SMP: Pairing Random (0x04) len 16
        Random value: 297efe85e67448a15f56bd27e3a3cf1d
> HCI Event: Number of Completed Packets (0x13) plen 5    #175 [hci1] 13.378459
        Num handles: 1
        Handle: 1245 Address: DF:A9:FF:F6:B1:1A (OUI DF-A9-FF)
        Count: 1
        #174: len 21 (0 Kb/s)
        Latency: 170 msec (67-173 msec ~165 msec)
> ACL Data RX: Handle 1245 flags 0x02 dlen 21             #176 [hci1] 13.466362
      SMP: Pairing Confirm (0x03) len 16
        Confim value: e2925e0b1269c649fdca4b517fcf2bda
< HCI Command: Host Number of Com.. (0x03|0x0035) plen 5  #177 [hci1] 13.467810
        Num handles: 1
        Handle: 1245 Address: DF:A9:FF:F6:B1:1A (OUI DF-A9-FF)
        Count: 1
< ACL Data TX: Handle 1245 flags 0x00 dlen 21             #178 [hci1] 13.467922
      SMP: Pairing Confirm (0x03) len 16
        Confim value: d713f25a04a0efcc6e70da803eb0181e
> HCI Event: Number of Completed Packets (0x13) plen 5    #179 [hci1] 13.641234
        Num handles: 1
        Handle: 1245 Address: DF:A9:FF:F6:B1:1A (OUI DF-A9-FF)
        Count: 1
        #178: len 21 (0 Kb/s)
        Latency: 173 msec (67-173 msec ~169 msec)
> ACL Data RX: Handle 1245 flags 0x02 dlen 21             #180 [hci1] 13.641443
      SMP: Pairing Random (0x04) len 16
        Random value: 235a884012d6d4a10000000000000000
< HCI Command: Host Number of Com.. (0x03|0x0035) plen 5  #181 [hci1] 13.648435
        Num handles: 1
        Handle: 1245 Address: DF:A9:FF:F6:B1:1A (OUI DF-A9-FF)
        Count: 1
< ACL Data TX: Handle 1245 flags 0x00 dlen 21             #182 [hci1] 13.648541
      SMP: Pairing Random (0x04) len 16
        Random value: 25a9493fd3ce4faf02be7293595bb7c6
> HCI Event: Number of Completed Packets (0x13) plen 5    #183 [hci1] 13.815964
        Num handles: 1
        Handle: 1245 Address: DF:A9:FF:F6:B1:1A (OUI DF-A9-FF)
        Count: 1
        #182: len 21 (1 Kb/s)
        Latency: 167 msec (67-173 msec ~168 msec)
> ACL Data RX: Handle 1245 flags 0x02 dlen 21             #184 [hci1] 13.903770
      SMP: Pairing Confirm (0x03) len 16
        Confim value: 2775626df451b7e57e018286934b45de
< HCI Command: Host Number of Com.. (0x03|0x0035) plen 5  #185 [hci1] 13.907865
        Num handles: 1
        Handle: 1245 Address: DF:A9:FF:F6:B1:1A (OUI DF-A9-FF)
        Count: 1
< ACL Data TX: Handle 1245 flags 0x00 dlen 21             #186 [hci1] 13.907921
      SMP: Pairing Confirm (0x03) len 16
        Confim value: 50396f34c9b362c34503f977e7a0e5c1
> HCI Event: Number of Completed Packets (0x13) plen 5    #187 [hci1] 14.078659
        Num handles: 1
        Handle: 1245 Address: DF:A9:FF:F6:B1:1A (OUI DF-A9-FF)
        Count: 1
        #186: len 21 (0 Kb/s)
        Latency: 170 msec (67-173 msec ~169 msec)
> ACL Data RX: Handle 1245 flags 0x02 dlen 21             #188 [hci1] 14.079013
      SMP: Pairing Random (0x04) len 16
        Random value: b98f0e0ee13946950000000000000000
< HCI Command: Host Number of Com.. (0x03|0x0035) plen 5  #189 [hci1] 14.088384
        Num handles: 1
        Handle: 1245 Address: DF:A9:FF:F6:B1:1A (OUI DF-A9-FF)
        Count: 1
< ACL Data TX: Handle 1245 flags 0x00 dlen 21             #190 [hci1] 14.088515
      SMP: Pairing Random (0x04) len 16
        Random value: 58f6b41f855a6f6c3560debd84e2affc
> HCI Event: Number of Completed Packets (0x13) plen 5    #191 [hci1] 14.253458
        Num handles: 1
        Handle: 1245 Address: DF:A9:FF:F6:B1:1A (OUI DF-A9-FF)
        Count: 1
        #190: len 21 (1 Kb/s)
        Latency: 164 msec (67-173 msec ~167 msec)
> ACL Data RX: Handle 1245 flags 0x02 dlen 21             #192 [hci1] 14.341386
      SMP: Pairing Confirm (0x03) len 16
        Confim value: 7d3ec1ac8316405148beaf085bdb5fb7
< HCI Command: Host Number of Com.. (0x03|0x0035) plen 5  #193 [hci1] 14.348153
        Num handles: 1
        Handle: 1245 Address: DF:A9:FF:F6:B1:1A (OUI DF-A9-FF)
        Count: 1
< ACL Data TX: Handle 1245 flags 0x00 dlen 21             #194 [hci1] 14.348311
      SMP: Pairing Confirm (0x03) len 16
        Confim value: b8bd31536bc9c3f2dd24de9a2cefb4b1
> HCI Event: Number of Completed Packets (0x13) plen 5    #195 [hci1] 14.516114
        Num handles: 1
        Handle: 1245 Address: DF:A9:FF:F6:B1:1A (OUI DF-A9-FF)
        Count: 1
        #194: len 21 (1 Kb/s)
        Latency: 167 msec (67-173 msec ~167 msec)
> ACL Data RX: Handle 1245 flags 0x02 dlen 21             #196 [hci1] 14.516512
      SMP: Pairing Random (0x04) len 16
        Random value: 480d1df52d82fbd70000000000000000
< HCI Command: Host Number of Com.. (0x03|0x0035) plen 5  #197 [hci1] 14.528528
        Num handles: 1
        Handle: 1245 Address: DF:A9:FF:F6:B1:1A (OUI DF-A9-FF)
        Count: 1
< ACL Data TX: Handle 1245 flags 0x00 dlen 21             #198 [hci1] 14.528611
      SMP: Pairing Random (0x04) len 16
        Random value: b67e7216d5bf664139eda2b542549666
> HCI Event: Number of Completed Packets (0x13) plen 5    #199 [hci1] 14.690958
        Num handles: 1
        Handle: 1245 Address: DF:A9:FF:F6:B1:1A (OUI DF-A9-FF)
        Count: 1
        #198: len 21 (1 Kb/s)
        Latency: 162 msec (67-173 msec ~164 msec)
> ACL Data RX: Handle 1245 flags 0x02 dlen 21             #200 [hci1] 14.778816
      SMP: Pairing Confirm (0x03) len 16
        Confim value: 0cdab67ed96a06e90e680ec92d27fad7
< HCI Command: Host Number of Com.. (0x03|0x0035) plen 5  #201 [hci1] 14.787649
        Num handles: 1
        Handle: 1245 Address: DF:A9:FF:F6:B1:1A (OUI DF-A9-FF)
        Count: 1
< ACL Data TX: Handle 1245 flags 0x00 dlen 21             #202 [hci1] 14.787732
      SMP: Pairing Confirm (0x03) len 16
        Confim value: f83d29e7e068ba538e649ea57c5912f0
> HCI Event: Number of Completed Packets (0x13) plen 5    #203 [hci1] 14.953657
        Num handles: 1
        Handle: 1245 Address: DF:A9:FF:F6:B1:1A (OUI DF-A9-FF)
        Count: 1
        #202: len 21 (1 Kb/s)
        Latency: 165 msec (67-173 msec ~165 msec)
> ACL Data RX: Handle 1245 flags 0x02 dlen 21             #204 [hci1] 14.954027
      SMP: Pairing Random (0x04) len 16
        Random value: a38005f0ac931d7e0000000000000000
< HCI Command: Host Number of Com.. (0x03|0x0035) plen 5  #205 [hci1] 14.968364
        Num handles: 1
        Handle: 1245 Address: DF:A9:FF:F6:B1:1A (OUI DF-A9-FF)
        Count: 1
< ACL Data TX: Handle 1245 flags 0x00 dlen 21             #206 [hci1] 14.968493
      SMP: Pairing Random (0x04) len 16
        Random value: ed17f76500c95219dd01e09d1e63f87b
> HCI Event: Number of Completed Packets (0x13) plen 5    #207 [hci1] 15.128427
        Num handles: 1
        Handle: 1245 Address: DF:A9:FF:F6:B1:1A (OUI DF-A9-FF)
        Count: 1
        #206: len 21 (1 Kb/s)
        Latency: 159 msec (67-173 msec ~162 msec)
> ACL Data RX: Handle 1245 flags 0x02 dlen 21             #208 [hci1] 15.216446
      SMP: Pairing Confirm (0x03) len 16
        Confim value: 5284d0579585aa71e069d76eb593a42c
< HCI Command: Host Number of Com.. (0x03|0x0035) plen 5  #209 [hci1] 15.228011
        Num handles: 1
        Handle: 1245 Address: DF:A9:FF:F6:B1:1A (OUI DF-A9-FF)
        Count: 1
< ACL Data TX: Handle 1245 flags 0x00 dlen 21             #210 [hci1] 15.228088
      SMP: Pairing Confirm (0x03) len 16
        Confim value: 1de1e34148fc1126eff80f5fef5a58be
> HCI Event: Number of Completed Packets (0x13) plen 5    #211 [hci1] 15.391087
        Num handles: 1
        Handle: 1245 Address: DF:A9:FF:F6:B1:1A (OUI DF-A9-FF)
        Count: 1
        #210: len 21 (1 Kb/s)
        Latency: 162 msec (67-173 msec ~162 msec)
> ACL Data RX: Handle 1245 flags 0x02 dlen 21             #212 [hci1] 15.391485
      SMP: Pairing Random (0x04) len 16
        Random value: 093f4b686b96f90e0000000000000000
< HCI Command: Host Number of Com.. (0x03|0x0035) plen 5  #213 [hci1] 15.408391
        Num handles: 1
        Handle: 1245 Address: DF:A9:FF:F6:B1:1A (OUI DF-A9-FF)
        Count: 1
< ACL Data TX: Handle 1245 flags 0x00 dlen 21             #214 [hci1] 15.408485
      SMP: Pairing Random (0x04) len 16
        Random value: 81d35d47e1f6006d79c974bd9d9e1ee3
> HCI Event: Number of Completed Packets (0x13) plen 5    #215 [hci1] 15.565909
        Num handles: 1
        Handle: 1245 Address: DF:A9:FF:F6:B1:1A (OUI DF-A9-FF)
        Count: 1
        #214: len 21 (1 Kb/s)
        Latency: 157 msec (67-173 msec ~160 msec)
> ACL Data RX: Handle 1245 flags 0x02 dlen 21             #216 [hci1] 15.653768
      SMP: Pairing Confirm (0x03) len 16
        Confim value: cb6da1b85ad791d20fceffd455d1f899
< HCI Command: Host Number of Com.. (0x03|0x0035) plen 5  #217 [hci1] 15.668101
        Num handles: 1
        Handle: 1245 Address: DF:A9:FF:F6:B1:1A (OUI DF-A9-FF)
        Count: 1
< ACL Data TX: Handle 1245 flags 0x00 dlen 21             #218 [hci1] 15.668184
      SMP: Pairing Confirm (0x03) len 16
        Confim value: ae590c20b5655d7aea553080fa0741cf
> HCI Event: Number of Completed Packets (0x13) plen 5    #219 [hci1] 15.828623
        Num handles: 1
        Handle: 1245 Address: DF:A9:FF:F6:B1:1A (OUI DF-A9-FF)
        Count: 1
        #218: len 21 (1 Kb/s)
        Latency: 160 msec (67-173 msec ~160 msec)
> ACL Data RX: Handle 1245 flags 0x02 dlen 21             #220 [hci1] 15.828980
      SMP: Pairing Random (0x04) len 16
        Random value: 8903bc2fa481d8dd0000000000000000
< HCI Command: Host Number of Com.. (0x03|0x0035) plen 5  #221 [hci1] 15.848350
        Num handles: 1
        Handle: 1245 Address: DF:A9:FF:F6:B1:1A (OUI DF-A9-FF)
        Count: 1
< ACL Data TX: Handle 1245 flags 0x00 dlen 21             #222 [hci1] 15.848550
      SMP: Pairing Random (0x04) len 16
        Random value: e7f7e0c2476823e41736a7e381bafb7c
> HCI Event: Number of Completed Packets (0x13) plen 5    #223 [hci1] 16.003453
        Num handles: 1
        Handle: 1245 Address: DF:A9:FF:F6:B1:1A (OUI DF-A9-FF)
        Count: 1
        #222: len 21 (1 Kb/s)
        Latency: 154 msec (67-173 msec ~157 msec)
> ACL Data RX: Handle 1245 flags 0x02 dlen 21             #224 [hci1] 16.091307
      SMP: Pairing Confirm (0x03) len 16
        Confim value: b524d7c16967890cc2d775101c5144b6
< HCI Command: Host Number of Com.. (0x03|0x0035) plen 5  #225 [hci1] 16.108020
        Num handles: 1
        Handle: 1245 Address: DF:A9:FF:F6:B1:1A (OUI DF-A9-FF)
        Count: 1
< ACL Data TX: Handle 1245 flags 0x00 dlen 21             #226 [hci1] 16.108080
      SMP: Pairing Confirm (0x03) len 16
        Confim value: 1b13f3eb4b5d169f6c1a197954b2afab
> HCI Event: Number of Completed Packets (0x13) plen 5    #227 [hci1] 16.266152
        Num handles: 1
        Handle: 1245 Address: DF:A9:FF:F6:B1:1A (OUI DF-A9-FF)
        Count: 1
        #226: len 21 (1 Kb/s)
        Latency: 158 msec (67-173 msec ~157 msec)
> ACL Data RX: Handle 1245 flags 0x02 dlen 21             #228 [hci1] 16.266493
      SMP: Pairing Random (0x04) len 16
        Random value: 644e7db448d50d930000000000000000
