Bluetooth monitor ver 5.84
btmon[1668505]: = Note: Linux version 6.8.0-83-generic (x86_64)                                                          0.707221
btmon[1668505]: = Note: Bluetooth subsystem version 2.22                                                                 0.707222
= New Index: 00:00:00:00:00:00 (Primary,UART,hci0)                                                                       0.707223
= Open Index: 00:00:00:00:00:00                                                                                          1.210768
= Index Info: 00:00:00:00:00:00 (Nordic Semiconductor ASA)                                                               1.210932
zephyr.exe[1668507]: @ USER Open: main (privileged) version 2.22                                                {0x0001} 1.210979
zephyr.exe[1668507]: < HCI Command: Reset (0x03|0x0003) plen 0                                                        #1 1.211462
> HCI Event: Command Complete (0x0e) plen 4                                                                           #2 1.212105
      Reset (0x03|0x0003) ncmd 1
        Status: Success (0x00)
zephyr.exe[1668507]: < HCI Command: Read Local Supported Features (0x04|0x0003) plen 0                                #3 1.230767
> HCI Event: Command Complete (0x0e) plen 12                                                                          #4 1.231688
      Read Local Supported Features (0x04|0x0003) ncmd 1
        Status: Success (0x00)
        Features: 0x00 0x00 0x00 0x00 0x60 0x00 0x00 0x00
          BR/EDR Not Supported
          LE Supported (Controller)
zephyr.exe[1668507]: < HCI Command: Read Local Version Information (0x04|0x0001) plen 0                               #5 1.250778
> HCI Event: Command Complete (0x0e) plen 12                                                                          #6 1.251669
      Read Local Version Information (0x04|0x0001) ncmd 1
        Status: Success (0x00)
        HCI version: Reserved (0x0e) - Revision 12520 (0x30e8)
        LMP version: Reserved (0x0e) - Subversion 12520 (0x30e8)
        Manufacturer: Nordic Semiconductor ASA (89)
zephyr.exe[1668507]: < HCI Command: Read Local Supported Commands (0x04|0x0002) plen 0                                #7 1.270786
> HCI Event: Command Complete (0x0e) plen 68                                                                          #8 1.272279
      Read Local Supported Commands (0x04|0x0002) ncmd 1
        Status: Success (0x00)
        Commands: 119 entries
          Disconnect (Octet 0 - Bit 5)
          Read Remote Version Information (Octet 2 - Bit 7)
          Set Event Mask (Octet 5 - Bit 6)
          Reset (Octet 5 - Bit 7)
          Read Connection Accept Timeout (Octet 7 - Bit 2)
          Write Connection Accept Timeout (Octet 7 - Bit 3)
          Read Transmit Power Level (Octet 10 - Bit 2)
          Set Controller To Host Flow Control (Octet 10 - Bit 5)
          Host Buffer Size (Octet 10 - Bit 6)
          Host Number of Completed Packets (Octet 10 - Bit 7)
          Read Local Version Information (Octet 14 - Bit 3)
          Read Local Supported Features (Octet 14 - Bit 5)
          Read BD ADDR (Octet 15 - Bit 1)
          Read RSSI (Octet 15 - Bit 5)
          Set Event Mask Page 2 (Octet 22 - Bit 2)
          LE Set Event Mask (Octet 25 - Bit 0)
          LE Read Buffer Size (Octet 25 - Bit 1)
          LE Read Local Supported Features (Octet 25 - Bit 2)
          LE Set Random Address (Octet 25 - Bit 4)
          LE Set Advertising Parameters (Octet 25 - Bit 5)
          LE Read Advertising Channel TX Power (Octet 25 - Bit 6)
          LE Set Advertising Data (Octet 25 - Bit 7)
          LE Set Scan Response Data (Octet 26 - Bit 0)
          LE Set Advertise Enable (Octet 26 - Bit 1)
          LE Set Scan Parameters (Octet 26 - Bit 2)
          LE Set Scan Enable (Octet 26 - Bit 3)
          LE Create Connection (Octet 26 - Bit 4)
          LE Create Connection Cancel (Octet 26 - Bit 5)
          LE Read Accept List Size (Octet 26 - Bit 6)
          LE Clear Accept List (Octet 26 - Bit 7)
          LE Add Device To Accept List (Octet 27 - Bit 0)
          LE Remove Device From Accept List (Octet 27 - Bit 1)
          LE Connection Update (Octet 27 - Bit 2)
          LE Set Host Channel Classification (Octet 27 - Bit 3)
          LE Read Channel Map (Octet 27 - Bit 4)
          LE Read Remote Used Features (Octet 27 - Bit 5)
          LE Encrypt (Octet 27 - Bit 6)
          LE Rand (Octet 27 - Bit 7)
          LE Start Encryption (Octet 28 - Bit 0)
          LE Long Term Key Request Reply (Octet 28 - Bit 1)
          LE Long Term Key Request Neg Reply (Octet 28 - Bit 2)
          LE Read Supported States (Octet 28 - Bit 3)
          LE Receiver Test (Octet 28 - Bit 4)
          LE Transmitter Test (Octet 28 - Bit 5)
          LE Test End (Octet 28 - Bit 6)
          Read Authenticated Payload Timeout (Octet 32 - Bit 4)
          Write Authenticated Payload Timeout (Octet 32 - Bit 5)
          LE Set Data Length (Octet 33 - Bit 6)
          LE Read Suggested Default Data Length (Octet 33 - Bit 7)
          LE Write Suggested Default Data Length (Octet 34 - Bit 0)
          LE Add Device To Resolving List (Octet 34 - Bit 3)
          LE Remove Device From Resolving List (Octet 34 - Bit 4)
          LE Clear Resolving List (Octet 34 - Bit 5)
          LE Read Resolving List Size (Octet 34 - Bit 6)
          LE Set Address Resolution Enable (Octet 35 - Bit 1)
          LE Set Resolvable Private Address Timeout (Octet 35 - Bit 2)
          LE Read Maximum Data Length (Octet 35 - Bit 3)
          LE Read PHY (Octet 35 - Bit 4)
          LE Set Default PHY (Octet 35 - Bit 5)
          LE Set PHY (Octet 35 - Bit 6)
          LE Enhanced Receiver Test (Octet 35 - Bit 7)
          LE Enhanced Transmitter Test (Octet 36 - Bit 0)
          LE Set Advertising Set Random Address (Octet 36 - Bit 1)
          LE Set Extended Advertising Parameters (Octet 36 - Bit 2)
          LE Set Extended Advertising Data (Octet 36 - Bit 3)
          LE Set Extended Scan Response Data (Octet 36 - Bit 4)
          LE Set Extended Advertising Enable (Octet 36 - Bit 5)
          LE Read Maximum Advertising Data Length (Octet 36 - Bit 6)
          LE Read Number of Supported Advertising Sets (Octet 36 - Bit 7)
          LE Remove Advertising Set (Octet 37 - Bit 0)
          LE Clear Advertising Sets (Octet 37 - Bit 1)
          LE Set Periodic Advertising Parameters (Octet 37 - Bit 2)
          LE Set Periodic Advertising Data (Octet 37 - Bit 3)
          LE Set Periodic Advertising Enable (Octet 37 - Bit 4)
          LE Set Extended Scan Parameters (Octet 37 - Bit 5)
          LE Set Extended Scan Enable (Octet 37 - Bit 6)
          LE Extended Create Connection (Octet 37 - Bit 7)
          LE Periodic Advertising Create Sync (Octet 38 - Bit 0)
          LE Periodic Advertising Create Sync Cancel (Octet 38 - Bit 1)
          LE Periodic Advertising Terminate Sync (Octet 38 - Bit 2)
          LE Add Device To Periodic Advertiser List (Octet 38 - Bit 3)
          LE Remove Device From Periodic Advertiser List (Octet 38 - Bit 4)
          LE Clear Periodic Advertiser List (Octet 38 - Bit 5)
          LE Read Periodic Advertiser List Size (Octet 38 - Bit 6)
          LE Read Transmit Power (Octet 38 - Bit 7)
          LE Read RF Path Compensation (Octet 39 - Bit 0)
          LE Write RF Path Compensation (Octet 39 - Bit 1)
          LE Set Privacy Mode (Octet 39 - Bit 2)
          LE Periodic Advertising Receive Enable (Octet 40 - Bit 5)
          LE Periodic Advertising Sync Transfer (Octet 40 - Bit 6)
          LE Periodic Advertising Set Info Transfer (Octet 40 - Bit 7)
          LE Periodic Advertising Sync Transfer Parameters (Octet 41 - Bit 0)
          LE Set Default Periodic Advertisng Sync Transfer Parameters (Octet 41 - Bit 1)
          LE Read Buffer v2 (Octet 41 - Bit 5)
          LE Read ISO TX Sync (Octet 41 - Bit 6)
          LE Set Connected Isochronous Group Parameters (Octet 41 - Bit 7)
          LE Set Connected Isochronous Group Parameters Test (Octet 42 - Bit 0)
          LE Create Connected Isochronous Stream (Octet 42 - Bit 1)
          LE Remove Connected Isochronous Group (Octet 42 - Bit 2)
          LE Accept Connected Isochronous Stream Request (Octet 42 - Bit 3)
          LE Reject Connected Isochronous Stream Request (Octet 42 - Bit 4)
          LE Create Broadcast Isochronous Group (Octet 42 - Bit 5)
          LE Create Broadcast Isochronous Group Test (Octet 42 - Bit 6)
          LE Terminate Broadcast Isochronous Group (Octet 42 - Bit 7)
          LE Broadcast Isochronous Group Create Sync (Octet 43 - Bit 0)
          LE Broadcast Isochronous Group Terminate Sync (Octet 43 - Bit 1)
          LE Request Peer SCA (Octet 43 - Bit 2)
          LE Setup Isochronous Data Path (Octet 43 - Bit 3)
          LE Remove Isochronous Data Path (Octet 43 - Bit 4)
          LE Isochronous Transmit Test (Octet 43 - Bit 5)
          LE Isochronous Receive Test (Octet 43 - Bit 6)
          LE Isochronous Read Test Counters (Octet 43 - Bit 7)
          LE Isochronous Read Test Counters (Octet 44 - Bit 0)
          LE Set Host Feature (Octet 44 - Bit 1)
          LE Read ISO link quality (Octet 44 - Bit 2)
          Octet 45 - Bit 6 
          Octet 46 - Bit 0 
          Octet 46 - Bit 1 
          Octet 46 - Bit 2 
zephyr.exe[1668507]: < HCI Command: Host Buffer Size (0x03|0x0033) plen 7                                             #9 1.290777
        ACL MTU: 255  ACL max packet: 16
        SCO MTU: 0    SCO max packet: 0
> HCI Event: Command Complete (0x0e) plen 4                                                                          #10 1.291612
      Host Buffer Size (0x03|0x0033) ncmd 1
        Status: Success (0x00)
zephyr.exe[1668507]: < HCI Command: Set Controller To Host Flow Control (0x03|0x0031) plen 1                         #11 1.310725
        Flow control: ACL Data Packets (0x01)
> HCI Event: Command Complete (0x0e) plen 4                                                                          #12 1.311823
      Set Controller To Host Flow Control (0x03|0x0031) ncmd 1
        Status: Success (0x00)
zephyr.exe[1668507]: < HCI Command: LE Read Local Supported Features (0x08|0x0003) plen 0                            #13 1.330749
> HCI Event: Command Complete (0x0e) plen 12                                                                         #14 1.331788
      LE Read Local Supported Features (0x08|0x0003) ncmd 1
        Status: Success (0x00)
        Features: 0xfd 0x79 0x00 0xf7 0x30 0x01 0x00 0x00
          LE Encryption
          Extended Reject Indication
          Peripheral-initiated Features Exchange
          LE Ping
          LE Data Packet Length Extension
          LL Privacy
          Extended Scanner Filter Policies
          LE 2M PHY
          LE Coded PHY
          LE Extended Advertising
          LE Periodic Advertising
          Channel Selection Algorithm #2
          Periodic Advertising Sync Transfer - Sender
          Periodic Advertising Sync Transfer - Recipient
          Sleep Clock Accuracy Updates
          Connected Isochronous Stream - Central
          Connected Isochronous Stream - Peripheral
          Isochronous Broadcaster
          Synchronized Receiver
          Periodic Advertising ADI support
          Connection Subrating
          Unknown features (0x0000010000000000)
zephyr.exe[1668507]: < HCI Command: LE Set Host Feature (0x08|0x0074) plen 2                                         #15 1.350799
        Bit Number: 32
          Connected Isochronous Stream (Host Support)
        Bit Value: 1
> HCI Event: Command Complete (0x0e) plen 4                                                                          #16 1.351506
      LE Set Host Feature (0x08|0x0074) ncmd 1
        Status: Success (0x00)
zephyr.exe[1668507]: < HCI Command: LE Read Buffer v2 (0x08|0x0060) plen 0                                           #17 1.370743
> HCI Event: Command Complete (0x0e) plen 10                                                                         #18 1.372043
      LE Read Buffer v2 (0x08|0x0060) ncmd 1
        Status: Success (0x00)
        ACL MTU: 27
        ACL max packet: 3
        ISO MTU: 318
        ISO max packet: 3
zephyr.exe[1668507]: < HCI Command: LE Read Maximum Advertising Data Length (0x08|0x003a) plen 0                     #19 1.390761
> HCI Event: Command Complete (0x0e) plen 6                                                                          #20 1.391753
      LE Read Maximum Advertising Data Length (0x08|0x003a) ncmd 1
        Status: Success (0x00)
        Max length: 1650
zephyr.exe[1668507]: < HCI Command: LE Read Supported States (0x08|0x001c) plen 0                                    #21 1.410746
> HCI Event: Command Complete (0x0e) plen 12                                                                         #22 1.411620
      LE Read Supported States (0x08|0x001c) ncmd 1
        Status: Success (0x00)
        States: 0x000003ff3e0306ff
          Non-connectable Advertising State
          Scannable Advertising State
          Connectable Advertising State
          High Duty Cycle Directed Advertising State
          Passive Scanning State
          Active Scanning State
          Initiating State
            and Connection State (Central Role)
          Connection State (Peripheral Role)
          Scannable Advertising State
            and Passive Scanning State
          Connectable Advertising State
            and Passive Scanning State
          Non-connectable Advertising State
            and Initiating State
          Scannable Advertising State
            and Initiating State
          Active Scanning State
            and Connection State (Central Role)
          Passive Scanning State
            and Connection State (Peripheral Role)
          Active Scanning State
            and Connection State (Peripheral Role)
          Initiating State
            and Connection State (Central Role)
            and Central Role & Central Role
          Low Duty Cycle Directed Advertising State
          Connectable Advertising State
            and Initiating State
            and Central Role & Peripheral Role
          High Duty Cycle Directed Advertising State
            and Initiating State
            and Central Role & Peripheral Role
          Low Duty Cycle Directed Advertising State
            and Initiating State
            and Central Role & Peripheral Role
          Connectable Advertising State
            and Connection State (Central Role)
            and Central Role & Peripheral Role
          High Duty Cycle Directed Advertising State
            and Connection State (Central Role)
            and Central Role & Peripheral Role
          Low Duty Cycle Directed Advertising State
            and Connection State (Central Role)
            and Central Role & Peripheral Role
          Connectable Advertising State
            and Connection State (Peripheral Role)
            and Central Role & Peripheral Role
          High Duty Cycle Directed Advertising State
            and Connection State (Peripheral Role)
            and Peripheral Role & Peripheral Role
          Low Duty Cycle Directed Advertising State
            and Connection State (Peripheral Role)
            and Peripheral Role & Peripheral Role
          Initiating State
            and Connection State (Peripheral Role)
            and Central Role & Peripheral Role
zephyr.exe[1668507]: < HCI Command: LE Read Maximum Data Length (0x08|0x002f) plen 0                                 #23 1.430748
> HCI Event: Command Complete (0x0e) plen 12                                                                         #24 1.431985
      LE Read Maximum Data Length (0x08|0x002f) ncmd 1
        Status: Success (0x00)
        Max TX octets: 251
        Max TX time: 2704
        Max RX octets: 251
        Max RX time: 2704
zephyr.exe[1668507]: < HCI Command: LE Write Suggested Default Data Length (0x08|0x0024) plen 4                      #25 1.450740
        TX octets: 251
        TX time: 2704
> HCI Event: Command Complete (0x0e) plen 4                                                                          #26 1.451941
      LE Write Suggested Default Data Length (0x08|0x0024) ncmd 1
        Status: Success (0x00)
zephyr.exe[1668507]: < HCI Command: LE Read Resolving List Size (0x08|0x002a) plen 0                                 #27 1.470738
> HCI Event: Command Complete (0x0e) plen 5                                                                          #28 1.471623
      LE Read Resolving List Size (0x08|0x002a) ncmd 1
        Status: Success (0x00)
        Size: 8
zephyr.exe[1668507]: < HCI Command: LE Set Event Mask (0x08|0x0001) plen 8                                           #29 1.490780
        Mask: 0x000002023f87fa5e
          LE Advertising Report
          LE Connection Update Complete
          LE Read Remote Used Features Complete
          LE Long Term Key Request
          LE Data Length Change
          LE Enhanced Connection Complete
          LE PHY Update Complete
          LE Extended Advertising Report
          LE Periodic Advertising Sync Established
          LE Periodic Advertising Report
          LE Periodic Advertising Sync Lost
          LE Extended Scan Timeout
          LE Extended Advertising Set Terminated
          LE Scan Request Received
          LE Periodic Advertising Sync Transfer Rvc
          LE CIS Established
          LE CIS Request
          LE Create BIG Complete
          LE Terminate BIG Complete
          LE BIG Sync Established Complete
          LE BIG Sync Lost
          LE BIG Info Advertising Report
          Unknown mask (0x0000020000000000)
> HCI Event: Command Complete (0x0e) plen 4                                                                          #30 1.491416
      LE Set Event Mask (0x08|0x0001) ncmd 1
        Status: Success (0x00)
zephyr.exe[1668507]: < HCI Command: Set Event Mask (0x03|0x0001) plen 8                                              #31 1.510742
        Mask: 0x2000800002008890
          Disconnection Complete
          Encryption Change
          Read Remote Version Information Complete
          Hardware Error
          Data Buffer Overflow
          Encryption Key Refresh Complete
          LE Meta
> HCI Event: Command Complete (0x0e) plen 4                                                                          #32 1.511545
      Set Event Mask (0x03|0x0001) ncmd 1
        Status: Success (0x00)
zephyr.exe[1668507]: < HCI Command: Read BD ADDR (0x04|0x0009) plen 0                                                #33 1.530745
> HCI Event: Command Complete (0x0e) plen 10                                                                         #34 1.531474
      Read BD ADDR (0x04|0x0009) ncmd 1
        Status: Success (0x00)
        Address: 00:00:00:00:00:00 (OUI 00-00-00)
zephyr.exe[1668507]: < HCI Command: LE Set Random Address (0x08|0x0005) plen 6                                       #35 1.550715
        Address: D5:B6:CC:31:DB:3B (Static)
> HCI Event: Command Complete (0x0e) plen 4                                                                          #36 1.551551
      LE Set Random Address (0x08|0x0005) ncmd 1
        Status: Success (0x00)
zephyr.exe[1668507]: < HCI Command: LE Set Extended Advertising Parameters (0x08|0x0036) plen 25                     #37 2.200743
        Handle: 0x00
        Properties: 0x0001
          Connectable
        Min advertising interval: 100.000 msec (0x00a0)
        Max advertising interval: 150.000 msec (0x00f0)
        Channel map: 37, 38, 39 (0x07)
        Own address type: Random (0x01)
        Peer address type: Public (0x00)
        Peer address: 00:00:00:00:00:00 (OUI 00-00-00)
        Filter policy: Allow Scan Request from Any, Allow Connect Request from Any (0x00)
        TX power: Host has no preference (0x7f)
        Primary PHY: LE 1M (0x01)
        Secondary max skip: 0x00
        Secondary PHY: LE 2M (0x02)
        SID: 0x00
        Scan request notifications: Disabled (0x00)
> HCI Event: Command Complete (0x0e) plen 5                                                                          #38 2.202267
      LE Set Extended Advertising Parameters (0x08|0x0036) ncmd 1
        Status: Success (0x00)
        TX power (selected): 0 dbm (0x00)
zephyr.exe[1668507]: < HCI Command: LE Set Advertising Set Random Address (0x08|0x0035) plen 7                       #39 2.210786
        Advertising handle: 0x00
        Advertising random address: D5:B6:CC:31:DB:3B (Static)
> HCI Event: Command Complete (0x0e) plen 4                                                                          #40 2.211413
      LE Set Advertising Set Random Address (0x08|0x0035) ncmd 1
        Status: Success (0x00)
zephyr.exe[1668507]: < HCI Command: LE Set Extended Advertising Data (0x08|0x0037) plen 39                           #41 2.230780
        Handle: 0x00
        Operation: Complete extended advertising data (0x03)
        Fragment preference: Minimize fragmentation (0x01)
        Data length: 0x23
        Flags: 0x06
          LE General Discoverable Mode
          BR/EDR Not Supported
        Name (complete): Tester_2CB6EE
        Flags: 0x06
          LE General Discoverable Mode
          BR/EDR Not Supported
        16-bit Service UUIDs (complete): 1 entry
          Audio Stream Control (0x184e)
        Service Data: Audio Stream Control (0x184e)
          Data[6]: 01ff0fff0f00
> HCI Event: Command Complete (0x0e) plen 4                                                                          #42 2.232169
      LE Set Extended Advertising Data (0x08|0x0037) ncmd 1
        Status: Success (0x00)
zephyr.exe[1668507]: < HCI Command: LE Set Extended Advertising Enable (0x08|0x0039) plen 6                          #43 2.250776
        Extended advertising: Enabled (0x01)
        Number of sets: 1 (0x01)
        Entry 0
          Handle: 0x00
          Duration: 0 ms (0x00)
          Max ext adv events: 0
> HCI Event: Command Complete (0x0e) plen 4                                                                          #44 2.251640
      LE Set Extended Advertising Enable (0x08|0x0039) ncmd 1
        Status: Success (0x00)
> HCI Event: LE Meta Event (0x3e) plen 31                                                                            #45 4.173146
      LE Enhanced Connection Complete (0x0a)
        Status: Success (0x00)
        Handle: 381
        Role: Peripheral (0x01)
        Peer address type: Public (0x00)
        Peer address: C0:07:E8:2C:B6:EE (OUI C0-07-E8)
        Local resolvable private address: 00:00:00:00:00:00 (Non-Resolvable)
        Peer resolvable private address: 00:00:00:00:00:00 (Non-Resolvable)
        Connection interval: 60.00 msec (0x0030)
        Connection latency: 0 (0x0000)
        Supervision timeout: 25120 msec (0x09d0)
        Central clock accuracy: 0x07
> HCI Event: LE Meta Event (0x3e) plen 6                                                                             #46 4.173152
      LE Advertising Set Terminated (0x12)
        Status: Success (0x00)
        Handle: 0
        Connection handle: 381
        Number of completed extended advertising events: 0
zephyr.exe[1668507]: < HCI Command: LE Read Remote Used Features (0x08|0x0016) plen 2                                #47 4.190947
        Handle: 381 Address: C0:07:E8:2C:B6:EE (OUI C0-07-E8)
> HCI Event: Command Status (0x0f) plen 4                                                                            #48 4.191789
      LE Read Remote Used Features (0x08|0x0016) ncmd 1
        Status: Success (0x00)
zephyr.exe[1668507]: < HCI Command: LE Set PHY (0x08|0x0032) plen 7                                                  #49 4.210855
        Handle: 381 Address: C0:07:E8:2C:B6:EE (OUI C0-07-E8)
        All PHYs preference: 0x00
        TX PHYs preference: 0x02
          LE 2M
        RX PHYs preference: 0x02
          LE 2M
        PHY options preference: Reserved (0x0000)
> HCI Event: Command Status (0x0f) plen 4                                                                            #50 4.211948
      LE Set PHY (0x08|0x0032) ncmd 1
        Status: Success (0x00)
zephyr.exe[1668507]: < ACL Data TX: Handle 381 [1/3] flags 0x00 dlen 7                                               #51 4.230868
      ATT: Exchange MTU Request (0x02) len 2
        Client RX MTU: 251
> HCI Event: Number of Completed Packets (0x13) plen 5                                                               #52 4.295145
        Num handles: 1
        Handle: 381 Address: C0:07:E8:2C:B6:EE (OUI C0-07-E8)
        Count: 1
        Buffers: 0/3
        #51: len 7 (0 Kb/s)
        Latency: 64 msec (64-64 msec ~64 msec)
zephyr.exe[1668507]: < HCI Command: LE Remove Advertising Set (0x08|0x003c) plen 1                                   #53 4.350958
        Handle: 0
> HCI Event: Command Complete (0x0e) plen 4                                                                          #54 4.351793
      LE Remove Advertising Set (0x08|0x003c) ncmd 1
        Status: Success (0x00)
> HCI Event: LE Meta Event (0x3e) plen 12                                                                            #55 4.355416
      LE Read Remote Used Features (0x04)
        Status: Success (0x00)
        Handle: 381 Address: C0:07:E8:2C:B6:EE (OUI C0-07-E8)
        Features: 0x2d 0x49 0x01 0xf7 0xef 0x39 0x00 0x80
          LE Encryption
          Extended Reject Indication
          Peripheral-initiated Features Exchange
          LE Data Packet Length Extension
          LE 2M PHY
          LE Coded PHY
          Channel Selection Algorithm #2
          Minimum Number of Used Channels Procedure
          Periodic Advertising Sync Transfer - Sender
          Periodic Advertising Sync Transfer - Recipient
          Sleep Clock Accuracy Updates
          Connected Isochronous Stream - Central
          Connected Isochronous Stream - Peripheral
          Isochronous Broadcaster
          Synchronized Receiver
          Connected Isochronous Stream (Host Support)
          LE Power Control Request
          LE Power Control Request
          LE Path Loss Monitoring
          Connection Subrating
          Connection Subrating (Host Support)
          Channel Classification
          Unknown features (0x8000390000000000)
> HCI Event: LE Meta Event (0x3e) plen 6                                                                             #56 4.355811
      LE PHY Update Complete (0x0c)
        Status: Success (0x00)
        Handle: 381 Address: C0:07:E8:2C:B6:EE (OUI C0-07-E8)
        TX PHY: LE 2M (0x02)
        RX PHY: LE 2M (0x02)
zephyr.exe[1668507]: < HCI Command: LE Set Extended Advertising Parameters (0x08|0x0036) plen 25                     #57 4.370873
        Handle: 0x00
        Properties: 0x0001
          Connectable
        Min advertising interval: 100.000 msec (0x00a0)
        Max advertising interval: 150.000 msec (0x00f0)
        Channel map: 37, 38, 39 (0x07)
        Own address type: Random (0x01)
        Peer address type: Public (0x00)
        Peer address: 00:00:00:00:00:00 (OUI 00-00-00)
        Filter policy: Allow Scan Request from Any, Allow Connect Request from Any (0x00)
        TX power: Host has no preference (0x7f)
        Primary PHY: LE 1M (0x01)
        Secondary max skip: 0x00
        Secondary PHY: LE 2M (0x02)
        SID: 0x01
        Scan request notifications: Disabled (0x00)
> HCI Event: Command Complete (0x0e) plen 5                                                                          #58 4.372043
      LE Set Extended Advertising Parameters (0x08|0x0036) ncmd 1
        Status: Success (0x00)
        TX power (selected): 0 dbm (0x00)
zephyr.exe[1668507]: < HCI Command: LE Set Advertising Set Random Address (0x08|0x0035) plen 7                       #59 4.390778
        Advertising handle: 0x00
        Advertising random address: D5:B6:CC:31:DB:3B (Static)
> HCI Event: Command Complete (0x0e) plen 4                                                                          #60 4.391582
      LE Set Advertising Set Random Address (0x08|0x0035) ncmd 1
        Status: Success (0x00)
zephyr.exe[1668507]: < HCI Command: LE Set Extended Advertising Data (0x08|0x0037) plen 39                           #61 4.410811
        Handle: 0x00
        Operation: Complete extended advertising data (0x03)
        Fragment preference: Minimize fragmentation (0x01)
        Data length: 0x23
        Flags: 0x06
          LE General Discoverable Mode
          BR/EDR Not Supported
        Name (complete): Tester_2CB6EE
        Flags: 0x06
          LE General Discoverable Mode
          BR/EDR Not Supported
        16-bit Service UUIDs (complete): 1 entry
          Audio Stream Control (0x184e)
        Service Data: Audio Stream Control (0x184e)
          Data[6]: 01ff0fff0f00
> HCI Event: Command Complete (0x0e) plen 4                                                                          #62 4.412357
      LE Set Extended Advertising Data (0x08|0x0037) ncmd 1
        Status: Success (0x00)
zephyr.exe[1668507]: < HCI Command: LE Set Extended Advertising Enable (0x08|0x0039) plen 6                          #63 4.430809
        Extended advertising: Enabled (0x01)
        Number of sets: 1 (0x01)
        Entry 0
          Handle: 0x00
          Duration: 0 ms (0x00)
          Max ext adv events: 0
> HCI Event: Command Complete (0x0e) plen 4                                                                          #64 4.431802
      LE Set Extended Advertising Enable (0x08|0x0039) ncmd 1
        Status: Success (0x00)
> ACL Data RX: Handle 381 flags 0x02 dlen 7                                                                          #65 4.655123
      ATT: Exchange MTU Request (0x02) len 2
        Client RX MTU: 64
> ACL Data RX: Handle 381 flags 0x02 dlen 7                                                                          #66 4.655562
      ATT: Exchange MTU Response (0x03) len 2
        Server RX MTU: 64
zephyr.exe[1668507]: < HCI Command: Host Number of Completed Packets (0x03|0x0035) plen 5                            #67 4.670890
        Num handles: 1
        Handle: 381 Address: C0:07:E8:2C:B6:EE (OUI C0-07-E8)
        Count: 1
zephyr.exe[1668507]: < ACL Data TX: Handle 381 [1/3] flags 0x00 dlen 7                                               #68 4.671325
      ATT: Exchange MTU Response (0x03) len 2
        Server RX MTU: 251
zephyr.exe[1668507]: < HCI Command: Host Number of Completed Packets (0x03|0x0035) plen 5                            #69 4.671831
        Num handles: 1
        Handle: 381 Address: C0:07:E8:2C:B6:EE (OUI C0-07-E8)
        Count: 1
> HCI Event: Number of Completed Packets (0x13) plen 5                                                               #70 4.775128
        Num handles: 1
        Handle: 381 Address: C0:07:E8:2C:B6:EE (OUI C0-07-E8)
        Count: 1
        Buffers: 0/3
        #68: len 7 (0 Kb/s)
        Latency: 103 msec (64-103 msec ~84 msec)
> ACL Data RX: Handle 381 flags 0x02 dlen 11                                                                         #71 6.755237
      SMP: Pairing Request (0x01) len 6
        IO capability: KeyboardDisplay (0x04)
        OOB data: Authentication data not present (0x00)
        Authentication requirement: Bonding, No MITM, SC, No Keypresses (0x09)
        Max encryption key size: 16
        Initiator key distribution: EncKey IdKey (0x03)
        Responder key distribution: EncKey IdKey Sign (0x07)
zephyr.exe[1668507]: < HCI Command: Host Number of Completed Packets (0x03|0x0035) plen 5                            #72 6.770935
        Num handles: 1
        Handle: 381 Address: C0:07:E8:2C:B6:EE (OUI C0-07-E8)
        Count: 1
zephyr.exe[1668507]: < ACL Data TX: Handle 381 [1/3] flags 0x00 dlen 11                                              #73 6.771068
      SMP: Pairing Response (0x02) len 6
        IO capability: NoInputNoOutput (0x03)
        OOB data: Authentication data not present (0x00)
        Authentication requirement: Bonding, No MITM, SC, No Keypresses (0x09)
        Max encryption key size: 16
        Initiator key distribution: IdKey (0x02)
        Responder key distribution: Sign (0x04)
> HCI Event: Number of Completed Packets (0x13) plen 5                                                               #74 6.875269
        Num handles: 1
        Handle: 381 Address: C0:07:E8:2C:B6:EE (OUI C0-07-E8)
        Count: 1
        Buffers: 0/3
        #73: len 11 (0 Kb/s)
        Latency: 104 msec (64-104 msec ~94 msec)
> ACL Data RX: Handle 381 flags 0x02 dlen 27                                                                         #75 6.875601
> ACL Data RX: Handle 381 flags 0x01 dlen 27                                                                         #76 6.875942
> ACL Data RX: Handle 381 flags 0x01 dlen 15                                                                         #77 6.876330
      SMP: Pairing Public Key (0x0c) len 64
        X[32]: e237178e3bcac020cf55fe6686c8702b4ce49786671a4aff56a4e5041317f819
        Y[32]: 815f7770bdcd2bdd384ffbb84453304f4bae379b5c86570080bbb81dbe194dab
zephyr.exe[1668507]: < HCI Command: Host Number of Completed Packets (0x03|0x0035) plen 5                            #78 6.890995
        Num handles: 1
        Handle: 381 Address: C0:07:E8:2C:B6:EE (OUI C0-07-E8)
        Count: 1
zephyr.exe[1668507]: < HCI Command: Host Number of Completed Packets (0x03|0x0035) plen 5                            #79 6.891098
        Num handles: 1
        Handle: 381 Address: C0:07:E8:2C:B6:EE (OUI C0-07-E8)
        Count: 1
zephyr.exe[1668507]: < HCI Command: Host Number of Completed Packets (0x03|0x0035) plen 5                            #80 6.891116
        Num handles: 1
        Handle: 381 Address: C0:07:E8:2C:B6:EE (OUI C0-07-E8)
        Count: 1
zephyr.exe[1668507]: < ACL Data TX: Handle 381 [1/3] flags 0x00 dlen 27                                              #81 6.891131
zephyr.exe[1668507]: < ACL Data TX: Handle 381 flags 0x01 dlen 27                                                    #82 6.891145
zephyr.exe[1668507]: < ACL Data TX: Handle 381 flags 0x01 dlen 15                                                    #83 6.891158
      SMP: Pairing Public Key (0x0c) len 64
        X[32]: 98308440221e2d910f0e54b71e7ec652857aa9b5a0dc65028824cc19db1226e9
        Y[32]: 67a4816bcb62efb21701e31fdb27561a6217575fb007a8bbdabe7e28b6f68482
> HCI Event: Number of Completed Packets (0x13) plen 5                                                               #84 6.935586
        Num handles: 1
        Handle: 381 Address: C0:07:E8:2C:B6:EE (OUI C0-07-E8)
        Count: 1
        Buffers: 0/3
        #81: len 27 (4 Kb/s)
        Latency: 44 msec (44-104 msec ~69 msec)
> HCI Event: Number of Completed Packets (0x13) plen 5                                                               #85 6.936094
        Num handles: 1
        Handle: 381 Address: C0:07:E8:2C:B6:EE (OUI C0-07-E8)
        Count: 1
        Buffers: underflow/3
        #82: len 27 (4 Kb/s)
        Latency: 44 msec (44-104 msec ~57 msec)
zephyr.exe[1668507]: < ACL Data TX: Handle 381 [1/3] flags 0x00 dlen 21                                              #86 6.950814
      SMP: Pairing Confirm (0x03) len 16
        Confirm value[16]: 13a33f6937eb05f042a83dadbc04fbfd
> HCI Event: Number of Completed Packets (0x13) plen 5                                                               #87 6.995087
        Num handles: 1
        Handle: 381 Address: C0:07:E8:2C:B6:EE (OUI C0-07-E8)
        Count: 1
        Buffers: 0/3
        #83: len 15 (1 Kb/s)
        Latency: 103 msec (44-104 msec ~80 msec)
> HCI Event: Number of Completed Packets (0x13) plen 5                                                               #88 7.055246
        Num handles: 1
        Handle: 381 Address: C0:07:E8:2C:B6:EE (OUI C0-07-E8)
        Count: 1
        Buffers: underflow/3
        #86: len 21 (1 Kb/s)
        Latency: 104 msec (44-104 msec ~92 msec)
> ACL Data RX: Handle 381 flags 0x02 dlen 21                                                                         #89 7.055569
      SMP: Pairing Random (0x04) len 16
        Random value[16]: 808cb33d028087ad0000000000000000
zephyr.exe[1668507]: < HCI Command: Host Number of Completed Packets (0x03|0x0035) plen 5                            #90 7.070977
        Num handles: 1
        Handle: 381 Address: C0:07:E8:2C:B6:EE (OUI C0-07-E8)
        Count: 1
zephyr.exe[1668507]: < ACL Data TX: Handle 381 [1/3] flags 0x00 dlen 21                                              #91 7.071425
      SMP: Pairing Random (0x04) len 16
        Random value[16]: 8e6108f966a694cbe26df70bb96773e6
> HCI Event: Number of Completed Packets (0x13) plen 5                                                               #92 7.175083
        Num handles: 1
        Handle: 381 Address: C0:07:E8:2C:B6:EE (OUI C0-07-E8)
        Count: 1
        Buffers: 0/3
        #91: len 21 (1 Kb/s)
        Latency: 103 msec (44-104 msec ~98 msec)
> ACL Data RX: Handle 381 flags 0x02 dlen 21                                                                         #93 7.235425
      SMP: Pairing DHKey Check (0x0d) len 16
        E[16]: 093391204dc1635180650b54e62467cc
zephyr.exe[1668507]: < HCI Command: Host Number of Completed Packets (0x03|0x0035) plen 5                            #94 7.250983
        Num handles: 1
        Handle: 381 Address: C0:07:E8:2C:B6:EE (OUI C0-07-E8)
        Count: 1
zephyr.exe[1668507]: < ACL Data TX: Handle 381 [1/3] flags 0x00 dlen 21                                              #95 7.251109
      SMP: Pairing DHKey Check (0x0d) len 16
        E[16]: 2194e349c1c010b3c11da3ba03b16aed
> HCI Event: Number of Completed Packets (0x13) plen 5                                                               #96 7.355141
        Num handles: 1
        Handle: 381 Address: C0:07:E8:2C:B6:EE (OUI C0-07-E8)
        Count: 1
        Buffers: 0/3
        #95: len 21 (1 Kb/s)
        Latency: 104 msec (44-104 msec ~101 msec)
> HCI Event: LE Meta Event (0x3e) plen 13                                                                            #97 7.415603
      LE Long Term Key Request (0x05)
        Handle: 381 Address: C0:07:E8:2C:B6:EE (OUI C0-07-E8)
        Random number: 0x0000000000000000
        Encrypted diversifier: 0x0000
zephyr.exe[1668507]: < HCI Command: LE Long Term Key Request Reply (0x08|0x001a) plen 18                             #98 7.430924
        Handle: 381 Address: C0:07:E8:2C:B6:EE (OUI C0-07-E8)
        Long term key[16]: 7d0a9f5098d5fed8967c6c74878cf7e6
> HCI Event: Command Complete (0x0e) plen 6                                                                          #99 7.431716
      LE Long Term Key Request Reply (0x08|0x001a) ncmd 1
        Status: Success (0x00)
        Handle: 381 Address: C0:07:E8:2C:B6:EE (OUI C0-07-E8)
> HCI Event: Encryption Change (0x08) plen 4                                                                        #100 7.715412
        Status: Success (0x00)
        Handle: 381 Address: C0:07:E8:2C:B6:EE (OUI C0-07-E8)
        Encryption: Enabled with AES-CCM (0x01)
zephyr.exe[1668507]: < ACL Data TX: Handle 381 [1/3] flags 0x00 dlen 21                                             #101 7.840894
      SMP: Signing Information (0x0a) len 16
        Signature key[16]: 5da095555cc64d02679f89a05211af56
> HCI Event: Number of Completed Packets (0x13) plen 5                                                              #102 7.955311
        Num handles: 1
        Handle: 381 Address: C0:07:E8:2C:B6:EE (OUI C0-07-E8)
        Count: 1
        Buffers: 0/3
        #101: len 21 (1 Kb/s)
        Latency: 114 msec (44-114 msec ~107 msec)
> ACL Data RX: Handle 381 flags 0x02 dlen 21                                                                        #103 7.955921
      SMP: Identity Information (0x08) len 16
        Identity resolving key[16]: d95942b96df69a649833f07b439dab9d
> ACL Data RX: Handle 381 flags 0x02 dlen 12                                                                        #104 7.955928
      SMP: Identity Address Information (0x09) len 7
        Address: C0:07:E8:2C:B6:EE (OUI C0-07-E8)
zephyr.exe[1668507]: < HCI Command: Host Number of Completed Packets (0x03|0x0035) plen 5                           #105 7.970953
        Num handles: 1
        Handle: 381 Address: C0:07:E8:2C:B6:EE (OUI C0-07-E8)
        Count: 1
zephyr.exe[1668507]: < HCI Command: LE Set Extended Advertising Enable (0x08|0x0039) plen 6                         #106 7.971471
        Extended advertising: Disabled (0x00)
        Number of sets: 1 (0x01)
        Entry 0
          Handle: 0x00
          Duration: 0 ms (0x00)
          Max ext adv events: 0
> HCI Event: Command Complete (0x0e) plen 4                                                                         #107 7.972262
      LE Set Extended Advertising Enable (0x08|0x0039) ncmd 1
        Status: Success (0x00)
zephyr.exe[1668507]: < HCI Command: LE Add Device To Resolving List (0x08|0x0027) plen 39                           #108 7.990948
        Address type: Public (0x00)
        Address: C0:07:E8:2C:B6:EE (OUI C0-07-E8)
        Peer identity resolving key[16]: d95942b96df69a649833f07b439dab9d
        Local identity resolving key[16]: 00000000000000000000000000000000
> HCI Event: Command Complete (0x0e) plen 4                                                                         #109 7.992791
      LE Add Device To Resolving List (0x08|0x0027) ncmd 1
        Status: Success (0x00)
zephyr.exe[1668507]: < HCI Command: LE Set Privacy Mode (0x08|0x004e) plen 8                                        #110 8.010847
        Peer Identity address type: Public (0x00)
        Peer Identity address: C0:07:E8:2C:B6:EE (OUI C0-07-E8)
        Privacy Mode: Use Device Privacy (0x01)
> HCI Event: Command Complete (0x0e) plen 4                                                                         #111 8.011925
      LE Set Privacy Mode (0x08|0x004e) ncmd 1
        Status: Success (0x00)
zephyr.exe[1668507]: < HCI Command: LE Set Address Resolution Enable (0x08|0x002d) plen 1                           #112 8.030879
        Address resolution: Enabled (0x01)
> HCI Event: Command Complete (0x0e) plen 4                                                                         #113 8.031723
      LE Set Address Resolution Enable (0x08|0x002d) ncmd 1
        Status: Success (0x00)
zephyr.exe[1668507]: < HCI Command: LE Set Extended Advertising Enable (0x08|0x0039) plen 6                         #114 8.050891
        Extended advertising: Enabled (0x01)
        Number of sets: 1 (0x01)
        Entry 0
          Handle: 0x00
          Duration: 0 ms (0x00)
          Max ext adv events: 0
> HCI Event: Command Complete (0x0e) plen 4                                                                         #115 8.051824
      LE Set Extended Advertising Enable (0x08|0x0039) ncmd 1
        Status: Success (0x00)
zephyr.exe[1668507]: < HCI Command: Host Number of Completed Packets (0x03|0x0035) plen 5                           #116 8.070911
        Num handles: 1
        Handle: 381 Address: C0:07:E8:2C:B6:EE (OUI C0-07-E8)
        Count: 1
> ACL Data RX: Handle 381 flags 0x02 dlen 13                                                                        #117 8.075273
      ATT: Find By Type Value Request (0x06) len 8
        Handle range: 0x0001-0xffff
        Attribute type: Primary Service (0x2800)
          UUID: Broadcast Audio Scan (0x184f)
zephyr.exe[1668507]: < HCI Command: Host Number of Completed Packets (0x03|0x0035) plen 5                           #118 8.090967
        Num handles: 1
        Handle: 381 Address: C0:07:E8:2C:B6:EE (OUI C0-07-E8)
        Count: 1
zephyr.exe[1668507]: < ACL Data TX: Handle 381 [1/3] flags 0x00 dlen 9                                              #119 8.091068
      ATT: Find By Type Value Response (0x07) len 4
        Handle range: 0x0047-0x004c
> HCI Event: Number of Completed Packets (0x13) plen 5                                                              #120 8.195234
        Num handles: 1
        Handle: 381 Address: C0:07:E8:2C:B6:EE (OUI C0-07-E8)
        Count: 1
        Buffers: 0/3
        #119: len 9 (0 Kb/s)
        Latency: 104 msec (44-114 msec ~105 msec)
> ACL Data RX: Handle 381 flags 0x02 dlen 13                                                                        #121 8.195455
      ATT: Find By Type Value Request (0x06) len 8
        Handle range: 0x004d-0xffff
        Attribute type: Primary Service (0x2800)
          UUID: Broadcast Audio Scan (0x184f)
zephyr.exe[1668507]: < HCI Command: Host Number of Completed Packets (0x03|0x0035) plen 5                           #122 8.210748
        Num handles: 1
        Handle: 381 Address: C0:07:E8:2C:B6:EE (OUI C0-07-E8)
        Count: 1
zephyr.exe[1668507]: < ACL Data TX: Handle 381 [1/3] flags 0x00 dlen 9                                              #123 8.210912
      ATT: Error Response (0x01) len 4
        Find By Type Value Request (0x06)
        Handle: 0x004d
        Error: Attribute Not Found (0x0a)
> HCI Event: Number of Completed Packets (0x13) plen 5                                                              #124 8.315253
        Num handles: 1
        Handle: 381 Address: C0:07:E8:2C:B6:EE (OUI C0-07-E8)
        Count: 1
        Buffers: 0/3
        #123: len 9 (0 Kb/s)
        Latency: 104 msec (44-114 msec ~105 msec)
> ACL Data RX: Handle 381 flags 0x02 dlen 11                                                                        #125 8.315520
      ATT: Read By Type Request (0x08) len 6
        Handle range: 0x0047-0x004c
        Attribute type: Characteristic (0x2803)
zephyr.exe[1668507]: < HCI Command: Host Number of Completed Packets (0x03|0x0035) plen 5                           #126 8.330843
        Num handles: 1
        Handle: 381 Address: C0:07:E8:2C:B6:EE (OUI C0-07-E8)
        Count: 1
zephyr.exe[1668507]: < ACL Data TX: Handle 381 [1/3] flags 0x00 dlen 20                                             #127 8.330975
      ATT: Read By Type Response (0x09) len 15
        Attribute data length: 7
        Attribute data list: 2 entries
        Handle: 0x0048
        Value[5]: 0c4900c72b
            Properties: 0x0c
              Write Without Response (0x04)
              Write (0x08)
            Value Handle: 0x0049
            Value UUID: Broadcast Audio Scan Control Point (0x2bc7)
        Handle: 0x004a
        Value[5]: 124b00c82b
            Properties: 0x12
              Read (0x02)
              Notify (0x10)
            Value Handle: 0x004b
            Value UUID: Broadcast Receive State (0x2bc8)
> HCI Event: Number of Completed Packets (0x13) plen 5                                                              #128 8.435234
        Num handles: 1
        Handle: 381 Address: C0:07:E8:2C:B6:EE (OUI C0-07-E8)
        Count: 1
        Buffers: 0/3
        #127: len 20 (1 Kb/s)
        Latency: 104 msec (44-114 msec ~104 msec)
> ACL Data RX: Handle 381 flags 0x02 dlen 11                                                                        #129 8.435435
      ATT: Read By Type Request (0x08) len 6
        Handle range: 0x004b-0x004c
        Attribute type: Characteristic (0x2803)
zephyr.exe[1668507]: < HCI Command: Host Number of Completed Packets (0x03|0x0035) plen 5                           #130 8.450713
        Num handles: 1
        Handle: 381 Address: C0:07:E8:2C:B6:EE (OUI C0-07-E8)
        Count: 1
zephyr.exe[1668507]: < ACL Data TX: Handle 381 [1/3] flags 0x00 dlen 9                                              #131 8.451983
      ATT: Error Response (0x01) len 4
        Read By Type Request (0x08)
        Handle: 0x004b
        Error: Attribute Not Found (0x0a)
> HCI Event: Number of Completed Packets (0x13) plen 5                                                              #132 8.555211
        Num handles: 1
        Handle: 381 Address: C0:07:E8:2C:B6:EE (OUI C0-07-E8)
        Count: 1
        Buffers: 0/3
        #131: len 9 (0 Kb/s)
        Latency: 103 msec (44-114 msec ~103 msec)
> ACL Data RX: Handle 381 flags 0x02 dlen 9                                                                         #133 8.555409
      ATT: Find Information Request (0x04) len 4
        Handle range: 0x004c-0x004c
zephyr.exe[1668507]: < HCI Command: Host Number of Completed Packets (0x03|0x0035) plen 5                           #134 8.570723
        Num handles: 1
        Handle: 381 Address: C0:07:E8:2C:B6:EE (OUI C0-07-E8)
        Count: 1
zephyr.exe[1668507]: < ACL Data TX: Handle 381 [1/3] flags 0x00 dlen 10                                             #135 8.575088
      ATT: Find Information Response (0x05) len 5
        Format: UUID-16 (0x01)
        Handle: 0x004c
        UUID: Client Characteristic Configuration (0x2902)
> HCI Event: Number of Completed Packets (0x13) plen 5                                                              #136 8.675257
        Num handles: 1
        Handle: 381 Address: C0:07:E8:2C:B6:EE (OUI C0-07-E8)
        Count: 1
        Buffers: 0/3
        #135: len 10 (0 Kb/s)
        Latency: 100 msec (44-114 msec ~102 msec)
> ACL Data RX: Handle 381 flags 0x02 dlen 9                                                                         #137 8.675476
      ATT: Write Request (0x12) len 4
        Handle: 0x004c
          Data[2]: 0000
zephyr.exe[1668507]: < HCI Command: Host Number of Completed Packets (0x03|0x0035) plen 5                           #138 8.697082
        Num handles: 1
        Handle: 381 Address: C0:07:E8:2C:B6:EE (OUI C0-07-E8)
        Count: 1
zephyr.exe[1668507]: < ACL Data TX: Handle 381 [1/3] flags 0x00 dlen 5                                              #139 8.698535
      ATT: Write Response (0x13) len 0
> HCI Event: Number of Completed Packets (0x13) plen 5                                                              #140 8.795246
        Num handles: 1
        Handle: 381 Address: C0:07:E8:2C:B6:EE (OUI C0-07-E8)
        Count: 1
        Buffers: 0/3
        #139: len 5 (0 Kb/s)
        Latency: 96 msec (44-114 msec ~99 msec)
> ACL Data RX: Handle 381 flags 0x02 dlen 9                                                                         #141 8.796424
      ATT: Write Request (0x12) len 4
        Handle: 0x004c
          Data[2]: 0100
zephyr.exe[1668507]: < HCI Command: Host Number of Completed Packets (0x03|0x0035) plen 5                           #142 8.818778
        Num handles: 1
        Handle: 381 Address: C0:07:E8:2C:B6:EE (OUI C0-07-E8)
        Count: 1
zephyr.exe[1668507]: < ACL Data TX: Handle 381 [1/3] flags 0x00 dlen 5                                              #143 8.820503
      ATT: Write Response (0x13) len 0
> HCI Event: Number of Completed Packets (0x13) plen 5                                                              #144 8.915188
        Num handles: 1
        Handle: 381 Address: C0:07:E8:2C:B6:EE (OUI C0-07-E8)
        Count: 1
        Buffers: 0/3
        #143: len 5 (0 Kb/s)
        Latency: 94 msec (44-114 msec ~97 msec)
> ACL Data RX: Handle 381 flags 0x02 dlen 7                                                                         #145 8.915467
      ATT: Read Request (0x0a) len 2
        Handle: 0x004b
zephyr.exe[1668507]: < HCI Command: Host Number of Completed Packets (0x03|0x0035) plen 5                           #146 8.930702
        Num handles: 1
        Handle: 381 Address: C0:07:E8:2C:B6:EE (OUI C0-07-E8)
        Count: 1
zephyr.exe[1668507]: < ACL Data TX: Handle 381 [1/3] flags 0x00 dlen 5                                              #147 8.930821
      ATT: Read Response (0x0b) len 0
        Value[0]: 
> HCI Event: Number of Completed Packets (0x13) plen 5                                                              #148 9.035141
        Num handles: 1
        Handle: 381 Address: C0:07:E8:2C:B6:EE (OUI C0-07-E8)
        Count: 1
        Buffers: 0/3
        #147: len 5 (0 Kb/s)
        Latency: 104 msec (44-114 msec ~100 msec)
> ACL Data RX: Handle 381 flags 0x02 dlen 27                                                                        #149 9.155543
> ACL Data RX: Handle 381 flags 0x01 dlen 1                                                                         #150 9.155626
      ATT: Write Request (0x12) len 23
        Handle: 0x0049
          Data[21]: 0200eeb62ce807c000f74d3f02401f010000000000
zephyr.exe[1668507]: < HCI Command: Host Number of Completed Packets (0x03|0x0035) plen 5                           #151 9.170709
        Num handles: 1
        Handle: 381 Address: C0:07:E8:2C:B6:EE (OUI C0-07-E8)
        Count: 1
zephyr.exe[1668507]: < HCI Command: Host Number of Completed Packets (0x03|0x0035) plen 5                           #152 9.172232
        Num handles: 1
        Handle: 381 Address: C0:07:E8:2C:B6:EE (OUI C0-07-E8)
        Count: 1
zephyr.exe[1668507]: < ACL Data TX: Handle 381 [1/3] flags 0x00 dlen 5                                              #153 9.173679
      ATT: Write Response (0x13) len 0
zephyr.exe[1668507]: < ACL Data TX: Handle 381 [2/3] flags 0x00 dlen 27                                             #154 9.174954
      ATT: Handle Value Notification (0x1b) len 22
        Handle: 0x004b
          Data[20]: 0000eeb62ce807c000f74d3f0000010000000000
> HCI Event: Number of Completed Packets (0x13) plen 5                                                              #155 9.215587
        Num handles: 1
        Handle: 381 Address: C0:07:E8:2C:B6:EE (OUI C0-07-E8)
        Count: 1
        Buffers: 1/3
        #153: len 5 (0 Kb/s)
        Latency: 41 msec (41-114 msec ~71 msec)
> HCI Event: Number of Completed Packets (0x13) plen 5                                                              #156 9.275219
        Num handles: 1
        Handle: 381 Address: C0:07:E8:2C:B6:EE (OUI C0-07-E8)
        Count: 1
        Buffers: 0/3
        #154: len 27 (2 Kb/s)
        Latency: 100 msec (41-114 msec ~85 msec)
zephyr.exe[1668507]: < HCI Command: LE Periodic Advertising Create Sync (0x08|0x0044) plen 14                       #157 9.460879
        Options: 0x0000
        Use advertising SID, Advertiser Address Type and address
        Reporting initially enabled
        SID: 0x00
        Adv address type: Public (0x00)
        Adv address: C0:07:E8:2C:B6:EE (OUI C0-07-E8)
        Skip: 0x0005
        Sync timeout: 10000 msec (0x03e8)
        Sync CTE type: 0x0000
> HCI Event: Command Status (0x0f) plen 4                                                                           #158 9.462633
      LE Periodic Advertising Create Sync (0x08|0x0044) ncmd 1
        Status: Success (0x00)
zephyr.exe[1668507]: < HCI Command: LE Set Random Address (0x08|0x0005) plen 6                                      #159 9.470848
        Address: 04:C8:1E:D2:64:DA (Non-Resolvable)
> HCI Event: Command Complete (0x0e) plen 4                                                                         #160 9.471491
      LE Set Random Address (0x08|0x0005) ncmd 1
        Status: Success (0x00)
zephyr.exe[1668507]: < HCI Command: LE Set Extended Scan Parameters (0x08|0x0041) plen 13                           #161 9.490818
        Own address type: Random (0x01)
        Filter policy: Accept all advertisement (0x00)
        PHYs: 0x05
        Entry 0: LE 1M
          Type: Passive (0x00)
          Interval: 60.000 msec (0x0060)
          Window: 30.000 msec (0x0030)
        Entry 1: LE Coded
          Type: Passive (0x00)
          Interval: 60.000 msec (0x0060)
          Window: 30.000 msec (0x0030)
> HCI Event: Command Complete (0x0e) plen 4                                                                         #162 9.491853
      LE Set Extended Scan Parameters (0x08|0x0041) ncmd 1
        Status: Success (0x00)
zephyr.exe[1668507]: < HCI Command: LE Set Extended Scan Enable (0x08|0x0042) plen 6                                #163 9.510879
        Extended scan: Enabled (0x01)
        Filter duplicates: Enabled (0x01)
        Duration: 0 msec (0x0000)
        Period: 0.00 sec (0x0000)
> HCI Event: Command Complete (0x0e) plen 4                                                                         #164 9.511669
      LE Set Extended Scan Enable (0x08|0x0042) ncmd 1
        Status: Success (0x00)
> HCI Event: LE Meta Event (0x3e) plen 41                                                                           #165 9.589374
      LE Extended Advertising Report (0x0d)
        Num reports: 1
        Entry 0
          Event type: 0x0010
            Props: 0x0010
              Use legacy advertising PDUs
            Data status: [0;32mComplete[0m
          Legacy PDU Type: ADV_NONCONN_IND (0x0010)
          Address type: Random (0x01)
          Address: 2E:A8:29:01:E3:24 (Non-Resolvable)
          Primary PHY: LE 1M
          Secondary PHY: No packets
          SID: no ADI field (0xff)
          TX power: 127 dBm
          RSSI: -101 dBm (0x9b)
          Periodic advertising interval: 0.00 msec (0x0000)
          Direct address type: Reserved (0xff)
          Direct address: 00-00-00-00-00-00
          Data length: 0x0f
        02 01 1a 0b ff 4c 00 09 06 03 d4 0a 03 0a 49     .....L........I 
        Flags: 0x1a
          LE General Discoverable Mode
          Simultaneous LE and BR/EDR (Controller)
          Simultaneous LE and BR/EDR (Host)
        Company: Apple, Inc. (76)
          Type: Apple TV (9)
          Data[6]: 03d40a030a49
> HCI Event: LE Meta Event (0x3e) plen 43                                                                           #166 9.641371
      LE Extended Advertising Report (0x0d)
        Num reports: 1
        Entry 0
          Event type: 0x0013
            Props: 0x0013
              Connectable
              Scannable
              Use legacy advertising PDUs
            Data status: [0;32mComplete[0m
          Legacy PDU Type: ADV_IND (0x0013)
          Address type: Random (0x01)
          Address: 54:FC:B1:6F:A7:69 (Resolvable)
          Primary PHY: LE 1M
          Secondary PHY: No packets
          SID: no ADI field (0xff)
          TX power: 127 dBm
          RSSI: -95 dBm (0xa1)
          Periodic advertising interval: 0.00 msec (0x0000)
          Direct address type: Reserved (0xff)
          Direct address: 00-00-00-00-00-00
          Data length: 0x11
        02 01 1a 02 0a 01 0a ff 4c 00 10 05 0c 18 31 03  ........L.....1.
        c1                                               .               
        Flags: 0x1a
          LE General Discoverable Mode
          Simultaneous LE and BR/EDR (Controller)
          Simultaneous LE and BR/EDR (Host)
        TX power: 1 dBm
        Company: Apple, Inc. (76)
          Type: Unknown (16)
          Data[5]: 0c183103c1
> HCI Event: LE Meta Event (0x3e) plen 48                                                                           #167 9.887258
      LE Extended Advertising Report (0x0d)
        Num reports: 1
        Entry 0
          Event type: 0x0000
            Props: 0x0000
            Data status: [0;32mComplete[0m
          Address type: Public (0x00)
          Address: C0:07:E8:2C:B6:EE (OUI C0-07-E8)
          Primary PHY: LE 1M
          Secondary PHY: LE 1M
          SID: 0x00
          TX power: 127 dBm
          RSSI: -57 dBm (0xc7)
          Periodic advertising interval: 150.00 msec (0x0078)
          Direct address type: Reserved (0xff)
          Direct address: 00-00-00-00-00-00
          Data length: 0x16
        06 16 52 18 f7 4d 3f 0e 09 50 54 53 2d 42 41 53  ..R..M?..PTS-BAS
        53 2d 42 36 45 45                                S-B6EE          
        Service Data: Broadcast Audio Announcement (0x1852)
        Broadcast ID: 4148727 (0x3f4df7)
        Name (complete): PTS-BASS-B6EE
> HCI Event: LE Meta Event (0x3e) plen 55                                                                           #168 9.956824
      LE Extended Advertising Report (0x0d)
        Num reports: 1
        Entry 0
          Event type: 0x0010
            Props: 0x0010
              Use legacy advertising PDUs
            Data status: [0;32mComplete[0m
          Legacy PDU Type: ADV_NONCONN_IND (0x0010)
          Address type: Random (0x01)
          Address: 1D:8C:B3:FE:88:32 (Non-Resolvable)
          Primary PHY: LE 1M
          Secondary PHY: No packets
          SID: no ADI field (0xff)
          TX power: 127 dBm
          RSSI: -97 dBm (0x9f)
          Periodic advertising interval: 0.00 msec (0x0000)
          Direct address type: Reserved (0xff)
          Direct address: 00-00-00-00-00-00
          Data length: 0x1d
        1c ff 06 00 01 09 21 0a 4d e0 8a 52 d2 d4 4c 41  ......!.M..R..LA
        50 54 4f 50 2d 45 35 32 45 4f 44 32 49           PTOP-E52EOD2I   
        Company: Microsoft (6)
          Data[25]: 0109210a4de08a52d2d44c4150544f502d453532454f443249
> HCI Event: LE Meta Event (0x3e) plen 41                                                                           #169 9.969352
      LE Extended Advertising Report (0x0d)
        Num reports: 1
        Entry 0
          Event type: 0x0010
            Props: 0x0010
              Use legacy advertising PDUs
            Data status: [0;32mComplete[0m
          Legacy PDU Type: ADV_NONCONN_IND (0x0010)
          Address type: Random (0x01)
          Address: 2E:A8:29:01:E3:24 (Non-Resolvable)
          Primary PHY: LE 1M
          Secondary PHY: No packets
          SID: no ADI field (0xff)
          TX power: 127 dBm
          RSSI: -99 dBm (0x9d)
          Periodic advertising interval: 0.00 msec (0x0000)
          Direct address type: Reserved (0xff)
          Direct address: 00-00-00-00-00-00
          Data length: 0x0f
        02 01 1a 0b ff 4c 00 09 06 03 d4 0a 03 0a 49     .....L........I 
        Flags: 0x1a
          LE General Discoverable Mode
          Simultaneous LE and BR/EDR (Controller)
          Simultaneous LE and BR/EDR (Host)
        Company: Apple, Inc. (76)
          Type: Apple TV (9)
          Data[6]: 03d40a030a49
> HCI Event: LE Meta Event (0x3e) plen 16                                                                          #170 10.011030
      LE Periodic Advertising Sync Established (0x0e)
        Status: Success (0x00)
        Sync handle: 235
        Advertising SID: 0x00
        Advertiser address type: Resolved Public (0x02)
        Advertiser address: C0:07:E8:2C:B6:EE (OUI C0-07-E8)
        Advertiser PHY: LE 1M (0x01)
        Periodic advertising interval: 150.00 msec (0x0078)
        Advertiser clock accuracy: 0x07
> HCI Event: LE Meta Event (0x3e) plen 48                                                                          #171 10.011823
      LE Periodic Advertising Report (0x0f)
        Sync handle: 235
        TX power: 127 dbm (0x7f)
        RSSI: -58 dBm (0xc6)
        CTE Type: No Constant Tone Extension (0xff)
        Data status: [0;32mComplete[0m
        Data length: 0x28
        Service Data: Basic Audio Announcement (0x1851)
          Presentation Delay: 40000
          Number of Subgroups: 1
            Subgroup #0:
            Number of BIS(s): 1
            Codec: LC3 (0x06)
            Codec Specific Configuration: #0: len 0x02 type 0x01
            Codec Specific Configuration: Sampling Frequency: 16 Khz (0x03)
            Codec Specific Configuration: #1: len 0x02 type 0x02
            Codec Specific Configuration: Frame Duration: 10 ms (0x01)
            Codec Specific Configuration: #2: len 0x03 type 0x04
            Codec Specific Configuration: Frame Length: 40 (0x0028)
            Metadata: #0: len 0x03 type 0x02
            Metadata: Context: 0x0004
            Metadata: Context	Media (0x0004)
            Metadata: #1: len 0x01 type 0x09
              BIS #0:
              Index: 1
              Codec Specific Configuration: #0: len 0x05 type 0x03
              Codec Specific Configuration: Location: 0x00000001
              Codec Specific Configuration: Location: Front Left (0x00000001)
> HCI Event: LE Meta Event (0x3e) plen 20                                                                          #172 10.011824
      LE Broadcast Isochronous Group Info Advertising Report (0x22)
        Sync Handle: 0x00eb
        Number BIS: 1
        NSE: 4
        ISO Interval: 10.00 msec (0x0008)
        BN: 1
        PTO: 1
        IRC: 3
        Maximum PDU: 40
        SDU Interval: 10000 us (0x002710)
        Maximum SDU: 40
        PHY: LE 1M (0x01)
        Framing: Unframed (0x00)
        Encryption: 0x00
> HCI Event: LE Meta Event (0x3e) plen 57                                                                          #173 10.020020
      LE Extended Advertising Report (0x0d)
        Num reports: 1
        Entry 0
          Event type: 0x0010
            Props: 0x0010
              Use legacy advertising PDUs
            Data status: [0;32mComplete[0m
          Legacy PDU Type: ADV_NONCONN_IND (0x0010)
          Address type: Random (0x01)
          Address: 30:F6:2D:E9:D7:1E (Non-Resolvable)
          Primary PHY: LE 1M
          Secondary PHY: No packets
          SID: no ADI field (0xff)
          TX power: 127 dBm
          RSSI: -99 dBm (0x9d)
          Periodic advertising interval: 0.00 msec (0x0000)
          Direct address type: Reserved (0xff)
          Direct address: 00-00-00-00-00-00
          Data length: 0x1f
        1e ff 06 00 01 0f 20 22 13 35 7e 7e 38 39 dd 67  ...... ".5~~89.g
        47 6c 4d af fe 18 18 9f 41 f9 b7 03 ff 1a 71     GlM.....A.....q 
        Company: Microsoft (6)
          Data[27]: 010f202213357e7e3839dd67476c4daffe18189f41f9b703ff1a71
zephyr.exe[1668507]: < HCI Command: LE Set Extended Scan Enable (0x08|0x0042) plen 6                               #174 10.030967
        Extended scan: Disabled (0x00)
        Filter duplicates: Disabled (0x00)
        Duration: 0 msec (0x0000)
        Period: 0.00 sec (0x0000)
> HCI Event: Command Complete (0x0e) plen 4                                                                        #175 10.036344
      LE Set Extended Scan Enable (0x08|0x0042) ncmd 1
        Status: Success (0x00)
zephyr.exe[1668507]: < ACL Data TX: Handle 381 [1/3] flags 0x00 dlen 27                                            #176 10.051422
zephyr.exe[1668507]: < ACL Data TX: Handle 381 flags 0x01 dlen 6                                                   #177 10.051807
      ATT: Handle Value Notification (0x1b) len 28
        Handle: 0x004b
          Data[26]: 0000eeb62ce807c000f74d3f0200010000000006030204000109
> HCI Event: Number of Completed Packets (0x13) plen 5                                                             #178 10.060300
        Num handles: 1
        Handle: 381 Address: C0:07:E8:2C:B6:EE (OUI C0-07-E8)
        Count: 1
        Buffers: 0/3
        #176: len 27 (27 Kb/s)
        Latency: 8 msec (8-114 msec ~47 msec)
> HCI Event: Number of Completed Packets (0x13) plen 5                                                             #179 10.115215
        Num handles: 1
        Handle: 381 Address: C0:07:E8:2C:B6:EE (OUI C0-07-E8)
        Count: 1
        Buffers: underflow/3
        #177: len 6 (0 Kb/s)
        Latency: 63 msec (8-114 msec ~55 msec)
> ACL Data RX: Handle 381 flags 0x02 dlen 10                                                                       #180 10.115772
      ATT: Write Request (0x12) len 5
        Handle: 0x0049
          Data[3]: 000107
zephyr.exe[1668507]: < HCI Command: Host Number of Completed Packets (0x03|0x0035) plen 5                          #181 10.133463
        Num handles: 1
        Handle: 381 Address: C0:07:E8:2C:B6:EE (OUI C0-07-E8)
        Count: 1
zephyr.exe[1668507]: < ACL Data TX: Handle 381 [1/3] flags 0x00 dlen 9                                             #182 10.134610
      ATT: Error Response (0x01) len 4
        Write Request (0x12)
        Handle: 0x0049
        Error: Reserved (0xfc)
> HCI Event: Number of Completed Packets (0x13) plen 5                                                             #183 10.235205
        Num handles: 1
        Handle: 381 Address: C0:07:E8:2C:B6:EE (OUI C0-07-E8)
        Count: 1
        Buffers: 0/3
        #182: len 9 (0 Kb/s)
        Latency: 100 msec (8-114 msec ~77 msec)
> HCI Event: LE Meta Event (0x3e) plen 48                                                                          #184 10.911298
      LE Periodic Advertising Report (0x0f)
        Sync handle: 235
        TX power: 127 dbm (0x7f)
        RSSI: -57 dBm (0xc7)
        CTE Type: No Constant Tone Extension (0xff)
        Data status: [0;32mComplete[0m
        Data length: 0x28
        Service Data: Basic Audio Announcement (0x1851)
          Presentation Delay: 40000
          Number of Subgroups: 1
            Subgroup #0:
            Number of BIS(s): 1
            Codec: LC3 (0x06)
            Codec Specific Configuration: #0: len 0x02 type 0x01
            Codec Specific Configuration: Sampling Frequency: 16 Khz (0x03)
            Codec Specific Configuration: #1: len 0x02 type 0x02
            Codec Specific Configuration: Frame Duration: 10 ms (0x01)
            Codec Specific Configuration: #2: len 0x03 type 0x04
            Codec Specific Configuration: Frame Length: 40 (0x0028)
            Metadata: #0: len 0x03 type 0x02
            Metadata: Context: 0x0004
            Metadata: Context	Media (0x0004)
            Metadata: #1: len 0x01 type 0x09
              BIS #0:
              Index: 1
              Codec Specific Configuration: #0: len 0x05 type 0x03
              Codec Specific Configuration: Location: 0x00000001
              Codec Specific Configuration: Location: Front Left (0x00000001)
> HCI Event: LE Meta Event (0x3e) plen 20                                                                          #185 10.911525
      LE Broadcast Isochronous Group Info Advertising Report (0x22)
        Sync Handle: 0x00eb
        Number BIS: 1
        NSE: 4
        ISO Interval: 10.00 msec (0x0008)
        BN: 1
        PTO: 1
        IRC: 3
        Maximum PDU: 40
        SDU Interval: 10000 us (0x002710)
        Maximum SDU: 40
        PHY: LE 1M (0x01)
        Framing: Unframed (0x00)
        Encryption: 0x00
> HCI Event: LE Meta Event (0x3e) plen 48                                                                          #186 11.811381
      LE Periodic Advertising Report (0x0f)
        Sync handle: 235
        TX power: 127 dbm (0x7f)
        RSSI: -58 dBm (0xc6)
        CTE Type: No Constant Tone Extension (0xff)
        Data status: [0;32mComplete[0m
        Data length: 0x28
        Service Data: Basic Audio Announcement (0x1851)
          Presentation Delay: 40000
          Number of Subgroups: 1
            Subgroup #0:
            Number of BIS(s): 1
            Codec: LC3 (0x06)
            Codec Specific Configuration: #0: len 0x02 type 0x01
            Codec Specific Configuration: Sampling Frequency: 16 Khz (0x03)
            Codec Specific Configuration: #1: len 0x02 type 0x02
            Codec Specific Configuration: Frame Duration: 10 ms (0x01)
            Codec Specific Configuration: #2: len 0x03 type 0x04
            Codec Specific Configuration: Frame Length: 40 (0x0028)
            Metadata: #0: len 0x03 type 0x02
            Metadata: Context: 0x0004
            Metadata: Context	Media (0x0004)
            Metadata: #1: len 0x01 type 0x09
              BIS #0:
              Index: 1
              Codec Specific Configuration: #0: len 0x05 type 0x03
              Codec Specific Configuration: Location: 0x00000001
              Codec Specific Configuration: Location: Front Left (0x00000001)
> HCI Event: LE Meta Event (0x3e) plen 20                                                                          #187 11.811559
      LE Broadcast Isochronous Group Info Advertising Report (0x22)
        Sync Handle: 0x00eb
        Number BIS: 1
        NSE: 4
        ISO Interval: 10.00 msec (0x0008)
        BN: 1
        PTO: 1
        IRC: 3
        Maximum PDU: 40
        SDU Interval: 10000 us (0x002710)
        Maximum SDU: 40
        PHY: LE 1M (0x01)
        Framing: Unframed (0x00)
        Encryption: 0x00
> HCI Event: LE Meta Event (0x3e) plen 48                                                                          #188 12.711378
      LE Periodic Advertising Report (0x0f)
        Sync handle: 235
        TX power: 127 dbm (0x7f)
        RSSI: -59 dBm (0xc5)
        CTE Type: No Constant Tone Extension (0xff)
        Data status: [0;32mComplete[0m
        Data length: 0x28
        Service Data: Basic Audio Announcement (0x1851)
          Presentation Delay: 40000
          Number of Subgroups: 1
            Subgroup #0:
            Number of BIS(s): 1
            Codec: LC3 (0x06)
            Codec Specific Configuration: #0: len 0x02 type 0x01
            Codec Specific Configuration: Sampling Frequency: 16 Khz (0x03)
            Codec Specific Configuration: #1: len 0x02 type 0x02
            Codec Specific Configuration: Frame Duration: 10 ms (0x01)
            Codec Specific Configuration: #2: len 0x03 type 0x04
            Codec Specific Configuration: Frame Length: 40 (0x0028)
            Metadata: #0: len 0x03 type 0x02
            Metadata: Context: 0x0004
            Metadata: Context	Media (0x0004)
            Metadata: #1: len 0x01 type 0x09
              BIS #0:
              Index: 1
              Codec Specific Configuration: #0: len 0x05 type 0x03
              Codec Specific Configuration: Location: 0x00000001
              Codec Specific Configuration: Location: Front Left (0x00000001)
> HCI Event: LE Meta Event (0x3e) plen 20                                                                          #189 12.711613
      LE Broadcast Isochronous Group Info Advertising Report (0x22)
        Sync Handle: 0x00eb
        Number BIS: 1
        NSE: 4
        ISO Interval: 10.00 msec (0x0008)
        BN: 1
        PTO: 1
        IRC: 3
        Maximum PDU: 40
        SDU Interval: 10000 us (0x002710)
        Maximum SDU: 40
        PHY: LE 1M (0x01)
        Framing: Unframed (0x00)
        Encryption: 0x00
> HCI Event: LE Meta Event (0x3e) plen 48                                                                          #190 13.611405
      LE Periodic Advertising Report (0x0f)
        Sync handle: 235
        TX power: 127 dbm (0x7f)
        RSSI: -58 dBm (0xc6)
        CTE Type: No Constant Tone Extension (0xff)
        Data status: [0;32mComplete[0m
        Data length: 0x28
        Service Data: Basic Audio Announcement (0x1851)
          Presentation Delay: 40000
          Number of Subgroups: 1
            Subgroup #0:
            Number of BIS(s): 1
            Codec: LC3 (0x06)
            Codec Specific Configuration: #0: len 0x02 type 0x01
            Codec Specific Configuration: Sampling Frequency: 16 Khz (0x03)
            Codec Specific Configuration: #1: len 0x02 type 0x02
            Codec Specific Configuration: Frame Duration: 10 ms (0x01)
            Codec Specific Configuration: #2: len 0x03 type 0x04
            Codec Specific Configuration: Frame Length: 40 (0x0028)
            Metadata: #0: len 0x03 type 0x02
            Metadata: Context: 0x0004
            Metadata: Context	Media (0x0004)
            Metadata: #1: len 0x01 type 0x09
              BIS #0:
              Index: 1
              Codec Specific Configuration: #0: len 0x05 type 0x03
              Codec Specific Configuration: Location: 0x00000001
              Codec Specific Configuration: Location: Front Left (0x00000001)
> HCI Event: LE Meta Event (0x3e) plen 20                                                                          #191 13.611676
      LE Broadcast Isochronous Group Info Advertising Report (0x22)
        Sync Handle: 0x00eb
        Number BIS: 1
        NSE: 4
        ISO Interval: 10.00 msec (0x0008)
        BN: 1
        PTO: 1
        IRC: 3
        Maximum PDU: 40
        SDU Interval: 10000 us (0x002710)
        Maximum SDU: 40
        PHY: LE 1M (0x01)
        Framing: Unframed (0x00)
        Encryption: 0x00
> HCI Event: LE Meta Event (0x3e) plen 48                                                                          #192 14.511413
      LE Periodic Advertising Report (0x0f)
        Sync handle: 235
        TX power: 127 dbm (0x7f)
        RSSI: -57 dBm (0xc7)
        CTE Type: No Constant Tone Extension (0xff)
        Data status: [0;32mComplete[0m
        Data length: 0x28
        Service Data: Basic Audio Announcement (0x1851)
          Presentation Delay: 40000
          Number of Subgroups: 1
            Subgroup #0:
            Number of BIS(s): 1
            Codec: LC3 (0x06)
            Codec Specific Configuration: #0: len 0x02 type 0x01
            Codec Specific Configuration: Sampling Frequency: 16 Khz (0x03)
            Codec Specific Configuration: #1: len 0x02 type 0x02
            Codec Specific Configuration: Frame Duration: 10 ms (0x01)
            Codec Specific Configuration: #2: len 0x03 type 0x04
            Codec Specific Configuration: Frame Length: 40 (0x0028)
            Metadata: #0: len 0x03 type 0x02
            Metadata: Context: 0x0004
            Metadata: Context	Media (0x0004)
            Metadata: #1: len 0x01 type 0x09
              BIS #0:
              Index: 1
              Codec Specific Configuration: #0: len 0x05 type 0x03
              Codec Specific Configuration: Location: 0x00000001
              Codec Specific Configuration: Location: Front Left (0x00000001)
> HCI Event: LE Meta Event (0x3e) plen 20                                                                          #193 14.511605
      LE Broadcast Isochronous Group Info Advertising Report (0x22)
        Sync Handle: 0x00eb
        Number BIS: 1
        NSE: 4
        ISO Interval: 10.00 msec (0x0008)
        BN: 1
        PTO: 1
        IRC: 3
        Maximum PDU: 40
        SDU Interval: 10000 us (0x002710)
        Maximum SDU: 40
        PHY: LE 1M (0x01)
        Framing: Unframed (0x00)
        Encryption: 0x00
> ACL Data RX: Handle 381 flags 0x02 dlen 10                                                                       #194 15.215284
      ATT: Write Request (0x12) len 5
        Handle: 0x0049
          Data[3]: 01e907
zephyr.exe[1668507]: < HCI Command: Host Number of Completed Packets (0x03|0x0035) plen 5                          #195 15.231475
        Num handles: 1
        Handle: 381 Address: C0:07:E8:2C:B6:EE (OUI C0-07-E8)
        Count: 1
zephyr.exe[1668507]: < ACL Data TX: Handle 381 [1/3] flags 0x00 dlen 9                                             #196 15.231600
      ATT: Error Response (0x01) len 4
        Write Request (0x12)
        Handle: 0x0049
        Error: Reserved (0xfc)
> HCI Event: Number of Completed Packets (0x13) plen 5                                                             #197 15.335243
        Num handles: 1
        Handle: 381 Address: C0:07:E8:2C:B6:EE (OUI C0-07-E8)
        Count: 1
        Buffers: 0/3
        #196: len 9 (0 Kb/s)
        Latency: 103 msec (8-114 msec ~90 msec)
> HCI Event: LE Meta Event (0x3e) plen 48                                                                          #198 15.411415
      LE Periodic Advertising Report (0x0f)
        Sync handle: 235
        TX power: 127 dbm (0x7f)
        RSSI: -59 dBm (0xc5)
        CTE Type: No Constant Tone Extension (0xff)
        Data status: [0;32mComplete[0m
        Data length: 0x28
        Service Data: Basic Audio Announcement (0x1851)
          Presentation Delay: 40000
          Number of Subgroups: 1
            Subgroup #0:
            Number of BIS(s): 1
            Codec: LC3 (0x06)
            Codec Specific Configuration: #0: len 0x02 type 0x01
            Codec Specific Configuration: Sampling Frequency: 16 Khz (0x03)
            Codec Specific Configuration: #1: len 0x02 type 0x02
            Codec Specific Configuration: Frame Duration: 10 ms (0x01)
            Codec Specific Configuration: #2: len 0x03 type 0x04
            Codec Specific Configuration: Frame Length: 40 (0x0028)
            Metadata: #0: len 0x03 type 0x02
            Metadata: Context: 0x0004
            Metadata: Context	Media (0x0004)
            Metadata: #1: len 0x01 type 0x09
              BIS #0:
              Index: 1
              Codec Specific Configuration: #0: len 0x05 type 0x03
              Codec Specific Configuration: Location: 0x00000001
              Codec Specific Configuration: Location: Front Left (0x00000001)
> HCI Event: LE Meta Event (0x3e) plen 20                                                                          #199 15.411929
      LE Broadcast Isochronous Group Info Advertising Report (0x22)
        Sync Handle: 0x00eb
        Number BIS: 1
        NSE: 4
        ISO Interval: 10.00 msec (0x0008)
        BN: 1
        PTO: 1
        IRC: 3
        Maximum PDU: 40
        SDU Interval: 10000 us (0x002710)
        Maximum SDU: 40
        PHY: LE 1M (0x01)
        Framing: Unframed (0x00)
        Encryption: 0x00
> HCI Event: LE Meta Event (0x3e) plen 48                                                                          #200 16.311366
      LE Periodic Advertising Report (0x0f)
        Sync handle: 235
        TX power: 127 dbm (0x7f)
        RSSI: -59 dBm (0xc5)
        CTE Type: No Constant Tone Extension (0xff)
        Data status: [0;32mComplete[0m
        Data length: 0x28
        Service Data: Basic Audio Announcement (0x1851)
          Presentation Delay: 40000
          Number of Subgroups: 1
            Subgroup #0:
            Number of BIS(s): 1
            Codec: LC3 (0x06)
            Codec Specific Configuration: #0: len 0x02 type 0x01
            Codec Specific Configuration: Sampling Frequency: 16 Khz (0x03)
            Codec Specific Configuration: #1: len 0x02 type 0x02
            Codec Specific Configuration: Frame Duration: 10 ms (0x01)
            Codec Specific Configuration: #2: len 0x03 type 0x04
            Codec Specific Configuration: Frame Length: 40 (0x0028)
            Metadata: #0: len 0x03 type 0x02
            Metadata: Context: 0x0004
            Metadata: Context	Media (0x0004)
            Metadata: #1: len 0x01 type 0x09
              BIS #0:
              Index: 1
              Codec Specific Configuration: #0: len 0x05 type 0x03
              Codec Specific Configuration: Location: 0x00000001
              Codec Specific Configuration: Location: Front Left (0x00000001)
> HCI Event: LE Meta Event (0x3e) plen 20                                                                          #201 16.311645
      LE Broadcast Isochronous Group Info Advertising Report (0x22)
        Sync Handle: 0x00eb
        Number BIS: 1
        NSE: 4
        ISO Interval: 10.00 msec (0x0008)
        BN: 1
        PTO: 1
        IRC: 3
        Maximum PDU: 40
        SDU Interval: 10000 us (0x002710)
        Maximum SDU: 40
        PHY: LE 1M (0x01)
        Framing: Unframed (0x00)
        Encryption: 0x00
> HCI Event: LE Meta Event (0x3e) plen 48                                                                          #202 17.211368
      LE Periodic Advertising Report (0x0f)
        Sync handle: 235
        TX power: 127 dbm (0x7f)
        RSSI: -58 dBm (0xc6)
        CTE Type: No Constant Tone Extension (0xff)
        Data status: [0;32mComplete[0m
        Data length: 0x28
        Service Data: Basic Audio Announcement (0x1851)
          Presentation Delay: 40000
          Number of Subgroups: 1
            Subgroup #0:
            Number of BIS(s): 1
            Codec: LC3 (0x06)
            Codec Specific Configuration: #0: len 0x02 type 0x01
            Codec Specific Configuration: Sampling Frequency: 16 Khz (0x03)
            Codec Specific Configuration: #1: len 0x02 type 0x02
            Codec Specific Configuration: Frame Duration: 10 ms (0x01)
            Codec Specific Configuration: #2: len 0x03 type 0x04
            Codec Specific Configuration: Frame Length: 40 (0x0028)
            Metadata: #0: len 0x03 type 0x02
            Metadata: Context: 0x0004
            Metadata: Context	Media (0x0004)
            Metadata: #1: len 0x01 type 0x09
              BIS #0:
              Index: 1
              Codec Specific Configuration: #0: len 0x05 type 0x03
              Codec Specific Configuration: Location: 0x00000001
              Codec Specific Configuration: Location: Front Left (0x00000001)
> HCI Event: LE Meta Event (0x3e) plen 20                                                                          #203 17.211596
      LE Broadcast Isochronous Group Info Advertising Report (0x22)
        Sync Handle: 0x00eb
        Number BIS: 1
        NSE: 4
        ISO Interval: 10.00 msec (0x0008)
        BN: 1
        PTO: 1
        IRC: 3
        Maximum PDU: 40
        SDU Interval: 10000 us (0x002710)
        Maximum SDU: 40
        PHY: LE 1M (0x01)
        Framing: Unframed (0x00)
        Encryption: 0x00
> HCI Event: LE Meta Event (0x3e) plen 48                                                                          #204 18.111382
      LE Periodic Advertising Report (0x0f)
        Sync handle: 235
        TX power: 127 dbm (0x7f)
        RSSI: -58 dBm (0xc6)
        CTE Type: No Constant Tone Extension (0xff)
        Data status: [0;32mComplete[0m
        Data length: 0x28
        Service Data: Basic Audio Announcement (0x1851)
          Presentation Delay: 40000
          Number of Subgroups: 1
            Subgroup #0:
            Number of BIS(s): 1
            Codec: LC3 (0x06)
            Codec Specific Configuration: #0: len 0x02 type 0x01
            Codec Specific Configuration: Sampling Frequency: 16 Khz (0x03)
            Codec Specific Configuration: #1: len 0x02 type 0x02
            Codec Specific Configuration: Frame Duration: 10 ms (0x01)
            Codec Specific Configuration: #2: len 0x03 type 0x04
            Codec Specific Configuration: Frame Length: 40 (0x0028)
            Metadata: #0: len 0x03 type 0x02
            Metadata: Context: 0x0004
            Metadata: Context	Media (0x0004)
            Metadata: #1: len 0x01 type 0x09
              BIS #0:
              Index: 1
              Codec Specific Configuration: #0: len 0x05 type 0x03
              Codec Specific Configuration: Location: 0x00000001
              Codec Specific Configuration: Location: Front Left (0x00000001)
> HCI Event: LE Meta Event (0x3e) plen 20                                                                          #205 18.111708
      LE Broadcast Isochronous Group Info Advertising Report (0x22)
        Sync Handle: 0x00eb
        Number BIS: 1
        NSE: 4
        ISO Interval: 10.00 msec (0x0008)
        BN: 1
        PTO: 1
        IRC: 3
        Maximum PDU: 40
        SDU Interval: 10000 us (0x002710)
        Maximum SDU: 40
        PHY: LE 1M (0x01)
        Framing: Unframed (0x00)
        Encryption: 0x00
> HCI Event: LE Meta Event (0x3e) plen 48                                                                          #206 19.011361
      LE Periodic Advertising Report (0x0f)
        Sync handle: 235
        TX power: 127 dbm (0x7f)
        RSSI: -58 dBm (0xc6)
        CTE Type: No Constant Tone Extension (0xff)
        Data status: [0;32mComplete[0m
        Data length: 0x28
        Service Data: Basic Audio Announcement (0x1851)
          Presentation Delay: 40000
          Number of Subgroups: 1
            Subgroup #0:
            Number of BIS(s): 1
            Codec: LC3 (0x06)
            Codec Specific Configuration: #0: len 0x02 type 0x01
            Codec Specific Configuration: Sampling Frequency: 16 Khz (0x03)
            Codec Specific Configuration: #1: len 0x02 type 0x02
            Codec Specific Configuration: Frame Duration: 10 ms (0x01)
            Codec Specific Configuration: #2: len 0x03 type 0x04
            Codec Specific Configuration: Frame Length: 40 (0x0028)
            Metadata: #0: len 0x03 type 0x02
            Metadata: Context: 0x0004
            Metadata: Context	Media (0x0004)
            Metadata: #1: len 0x01 type 0x09
              BIS #0:
              Index: 1
              Codec Specific Configuration: #0: len 0x05 type 0x03
              Codec Specific Configuration: Location: 0x00000001
              Codec Specific Configuration: Location: Front Left (0x00000001)
> HCI Event: LE Meta Event (0x3e) plen 20                                                                          #207 19.011941
      LE Broadcast Isochronous Group Info Advertising Report (0x22)
        Sync Handle: 0x00eb
        Number BIS: 1
        NSE: 4
        ISO Interval: 10.00 msec (0x0008)
        BN: 1
        PTO: 1
        IRC: 3
        Maximum PDU: 40
        SDU Interval: 10000 us (0x002710)
        Maximum SDU: 40
        PHY: LE 1M (0x01)
        Framing: Unframed (0x00)
        Encryption: 0x00
> HCI Event: LE Meta Event (0x3e) plen 48                                                                          #208 19.911509
      LE Periodic Advertising Report (0x0f)
        Sync handle: 235
        TX power: 127 dbm (0x7f)
        RSSI: -58 dBm (0xc6)
        CTE Type: No Constant Tone Extension (0xff)
        Data status: [0;32mComplete[0m
        Data length: 0x28
        Service Data: Basic Audio Announcement (0x1851)
          Presentation Delay: 40000
          Number of Subgroups: 1
            Subgroup #0:
            Number of BIS(s): 1
            Codec: LC3 (0x06)
            Codec Specific Configuration: #0: len 0x02 type 0x01
            Codec Specific Configuration: Sampling Frequency: 16 Khz (0x03)
            Codec Specific Configuration: #1: len 0x02 type 0x02
            Codec Specific Configuration: Frame Duration: 10 ms (0x01)
            Codec Specific Configuration: #2: len 0x03 type 0x04
            Codec Specific Configuration: Frame Length: 40 (0x0028)
            Metadata: #0: len 0x03 type 0x02
            Metadata: Context: 0x0004
            Metadata: Context	Media (0x0004)
            Metadata: #1: len 0x01 type 0x09
              BIS #0:
              Index: 1
              Codec Specific Configuration: #0: len 0x05 type 0x03
              Codec Specific Configuration: Location: 0x00000001
              Codec Specific Configuration: Location: Front Left (0x00000001)
> HCI Event: LE Meta Event (0x3e) plen 20                                                                          #209 19.911689
      LE Broadcast Isochronous Group Info Advertising Report (0x22)
        Sync Handle: 0x00eb
        Number BIS: 1
        NSE: 4
        ISO Interval: 10.00 msec (0x0008)
        BN: 1
        PTO: 1
        IRC: 3
        Maximum PDU: 40
        SDU Interval: 10000 us (0x002710)
        Maximum SDU: 40
        PHY: LE 1M (0x01)
        Framing: Unframed (0x00)
        Encryption: 0x00
> ACL Data RX: Handle 381 flags 0x02 dlen 27                                                                       #210 20.315538
> ACL Data RX: Handle 381 flags 0x01 dlen 3                                                                        #211 20.315867
      ATT: Write Request (0x12) len 25
        Handle: 0x0049
          Data[23]: 0200eeb62ce807c00134120002401f010000000000b038
zephyr.exe[1668507]: < HCI Command: Host Number of Completed Packets (0x03|0x0035) plen 5                          #212 20.334259
        Num handles: 1
        Handle: 381 Address: C0:07:E8:2C:B6:EE (OUI C0-07-E8)
        Count: 1
zephyr.exe[1668507]: < HCI Command: Host Number of Completed Packets (0x03|0x0035) plen 5                          #213 20.334573
        Num handles: 1
        Handle: 381 Address: C0:07:E8:2C:B6:EE (OUI C0-07-E8)
        Count: 1
zephyr.exe[1668507]: < ACL Data TX: Handle 381 [1/3] flags 0x00 dlen 9                                             #214 20.334677
      ATT: Error Response (0x01) len 4
        Write Request (0x12)
        Handle: 0x0049
        Error: Reserved (0xfc)
> HCI Event: Number of Completed Packets (0x13) plen 5                                                             #215 20.435233
        Num handles: 1
        Handle: 381 Address: C0:07:E8:2C:B6:EE (OUI C0-07-E8)
        Count: 1
        Buffers: 0/3
        #214: len 9 (0 Kb/s)
        Latency: 100 msec (8-114 msec ~95 msec)
> HCI Event: LE Meta Event (0x3e) plen 48                                                                          #216 20.811478
      LE Periodic Advertising Report (0x0f)
        Sync handle: 235
        TX power: 127 dbm (0x7f)
        RSSI: -58 dBm (0xc6)
        CTE Type: No Constant Tone Extension (0xff)
        Data status: [0;32mComplete[0m
        Data length: 0x28
        Service Data: Basic Audio Announcement (0x1851)
          Presentation Delay: 40000
          Number of Subgroups: 1
            Subgroup #0:
            Number of BIS(s): 1
            Codec: LC3 (0x06)
            Codec Specific Configuration: #0: len 0x02 type 0x01
            Codec Specific Configuration: Sampling Frequency: 16 Khz (0x03)
            Codec Specific Configuration: #1: len 0x02 type 0x02
            Codec Specific Configuration: Frame Duration: 10 ms (0x01)
            Codec Specific Configuration: #2: len 0x03 type 0x04
            Codec Specific Configuration: Frame Length: 40 (0x0028)
            Metadata: #0: len 0x03 type 0x02
            Metadata: Context: 0x0004
            Metadata: Context	Media (0x0004)
            Metadata: #1: len 0x01 type 0x09
              BIS #0:
              Index: 1
              Codec Specific Configuration: #0: len 0x05 type 0x03
              Codec Specific Configuration: Location: 0x00000001
              Codec Specific Configuration: Location: Front Left (0x00000001)
> HCI Event: LE Meta Event (0x3e) plen 20                                                                          #217 20.812016
      LE Broadcast Isochronous Group Info Advertising Report (0x22)
        Sync Handle: 0x00eb
        Number BIS: 1
        NSE: 4
        ISO Interval: 10.00 msec (0x0008)
        BN: 1
        PTO: 1
        IRC: 3
        Maximum PDU: 40
        SDU Interval: 10000 us (0x002710)
        Maximum SDU: 40
        PHY: LE 1M (0x01)
        Framing: Unframed (0x00)
        Encryption: 0x00
> HCI Event: LE Meta Event (0x3e) plen 48                                                                          #218 21.711418
      LE Periodic Advertising Report (0x0f)
        Sync handle: 235
        TX power: 127 dbm (0x7f)
        RSSI: -58 dBm (0xc6)
        CTE Type: No Constant Tone Extension (0xff)
        Data status: [0;32mComplete[0m
        Data length: 0x28
        Service Data: Basic Audio Announcement (0x1851)
          Presentation Delay: 40000
          Number of Subgroups: 1
            Subgroup #0:
            Number of BIS(s): 1
            Codec: LC3 (0x06)
            Codec Specific Configuration: #0: len 0x02 type 0x01
            Codec Specific Configuration: Sampling Frequency: 16 Khz (0x03)
            Codec Specific Configuration: #1: len 0x02 type 0x02
            Codec Specific Configuration: Frame Duration: 10 ms (0x01)
            Codec Specific Configuration: #2: len 0x03 type 0x04
            Codec Specific Configuration: Frame Length: 40 (0x0028)
            Metadata: #0: len 0x03 type 0x02
            Metadata: Context: 0x0004
            Metadata: Context	Media (0x0004)
            Metadata: #1: len 0x01 type 0x09
              BIS #0:
              Index: 1
              Codec Specific Configuration: #0: len 0x05 type 0x03
              Codec Specific Configuration: Location: 0x00000001
              Codec Specific Configuration: Location: Front Left (0x00000001)
> HCI Event: LE Meta Event (0x3e) plen 20                                                                          #219 21.711715
      LE Broadcast Isochronous Group Info Advertising Report (0x22)
        Sync Handle: 0x00eb
        Number BIS: 1
        NSE: 4
        ISO Interval: 10.00 msec (0x0008)
        BN: 1
        PTO: 1
        IRC: 3
        Maximum PDU: 40
        SDU Interval: 10000 us (0x002710)
        Maximum SDU: 40
        PHY: LE 1M (0x01)
        Framing: Unframed (0x00)
        Encryption: 0x00
> HCI Event: LE Meta Event (0x3e) plen 48                                                                          #220 22.611430
      LE Periodic Advertising Report (0x0f)
        Sync handle: 235
        TX power: 127 dbm (0x7f)
        RSSI: -57 dBm (0xc7)
        CTE Type: No Constant Tone Extension (0xff)
        Data status: [0;32mComplete[0m
        Data length: 0x28
        Service Data: Basic Audio Announcement (0x1851)
          Presentation Delay: 40000
          Number of Subgroups: 1
            Subgroup #0:
            Number of BIS(s): 1
            Codec: LC3 (0x06)
            Codec Specific Configuration: #0: len 0x02 type 0x01
            Codec Specific Configuration: Sampling Frequency: 16 Khz (0x03)
            Codec Specific Configuration: #1: len 0x02 type 0x02
            Codec Specific Configuration: Frame Duration: 10 ms (0x01)
            Codec Specific Configuration: #2: len 0x03 type 0x04
            Codec Specific Configuration: Frame Length: 40 (0x0028)
            Metadata: #0: len 0x03 type 0x02
            Metadata: Context: 0x0004
            Metadata: Context	Media (0x0004)
            Metadata: #1: len 0x01 type 0x09
              BIS #0:
              Index: 1
              Codec Specific Configuration: #0: len 0x05 type 0x03
              Codec Specific Configuration: Location: 0x00000001
              Codec Specific Configuration: Location: Front Left (0x00000001)
> HCI Event: LE Meta Event (0x3e) plen 20                                                                          #221 22.611745
      LE Broadcast Isochronous Group Info Advertising Report (0x22)
        Sync Handle: 0x00eb
        Number BIS: 1
        NSE: 4
        ISO Interval: 10.00 msec (0x0008)
        BN: 1
        PTO: 1
        IRC: 3
        Maximum PDU: 40
        SDU Interval: 10000 us (0x002710)
        Maximum SDU: 40
        PHY: LE 1M (0x01)
        Framing: Unframed (0x00)
        Encryption: 0x00
> HCI Event: LE Meta Event (0x3e) plen 48                                                                          #222 23.511475
      LE Periodic Advertising Report (0x0f)
        Sync handle: 235
        TX power: 127 dbm (0x7f)
    