Bluetooth monitor ver 5.72
= Note: Linux version 6.14.0-36-generic (x86_64)                       0.255846
= Note: Bluetooth subsystem version 2.22                               0.255849
= New Index: 00:00:00:00:00:00 (Primary,UART,hci1)              [hci1] 0.255850
= New Index: 48:5F:99:8E:E0:64 (Primary,USB,hci0)               [hci0] 0.255850
= Open Index: 00:00:00:00:00:00                                 [hci1] 0.769647
= Index Info: 00:00:00:00:00:00 (Nordic Semiconductor ASA)      [hci1] 0.769663
@ USER Open: main (privileged) version 2.22            {0x0001} [hci1] 0.769672
< HCI Command: Reset (0x03|0x0003) plen 0                    #1 [hci1] 0.770875
> HCI Event: Command Complete (0x0e) plen 4                  #2 [hci1] 0.771331
      Reset (0x03|0x0003) ncmd 1
        Status: Success (0x00)
< HCI Command: Read Local Supported... (0x04|0x0003) plen 0  #3 [hci1] 0.789472
> HCI Event: Command Complete (0x0e) plen 12                 #4 [hci1] 0.790020
      Read Local Supported Features (0x04|0x0003) ncmd 1
        Status: Success (0x00)
        Features: 0x00 0x00 0x00 0x00 0x60 0x00 0x00 0x00
          BR/EDR Not Supported
          LE Supported (Controller)
< HCI Command: Read Local Version In.. (0x04|0x0001) plen 0  #5 [hci1] 0.809075
> HCI Event: Command Complete (0x0e) plen 12                 #6 [hci1] 0.809539
      Read Local Version Information (0x04|0x0001) ncmd 1
        Status: Success (0x00)
        HCI version: Reserved (0x0f) - Revision 12393 (0x3069)
        LMP version: Reserved (0x0f) - Subversion 12393 (0x3069)
        Manufacturer: Nordic Semiconductor ASA (89)
< HCI Command: Read Local Supported... (0x04|0x0002) plen 0  #7 [hci1] 0.829053
> HCI Event: Command Complete (0x0e) plen 68                 #8 [hci1] 0.830118
      Read Local Supported Commands (0x04|0x0002) ncmd 1
        Status: Success (0x00)
        Commands: 119 entries
          Disconnect (Octet 0 - Bit 5)
          Read Remote Version Information (Octet 2 - Bit 7)
          Set Event Mask (Octet 5 - Bit 6)
          Reset (Octet 5 - Bit 7)
          Read Connection Accept Timeout (Octet 7 - Bit 2)
          Write Connection Accept Timeout (Octet 7 - Bit 3)
          Read Transmit Power Level (Octet 10 - Bit 2)
          Set Controller To Host Flow Control (Octet 10 - Bit 5)
          Host Buffer Size (Octet 10 - Bit 6)
          Host Number of Completed Packets (Octet 10 - Bit 7)
          Read Local Version Information (Octet 14 - Bit 3)
          Read Local Supported Features (Octet 14 - Bit 5)
          Read BD ADDR (Octet 15 - Bit 1)
          Read RSSI (Octet 15 - Bit 5)
          Set Event Mask Page 2 (Octet 22 - Bit 2)
          LE Set Event Mask (Octet 25 - Bit 0)
          LE Read Buffer Size (Octet 25 - Bit 1)
          LE Read Local Supported Features (Octet 25 - Bit 2)
          LE Set Random Address (Octet 25 - Bit 4)
          LE Set Advertising Parameters (Octet 25 - Bit 5)
          LE Read Advertising Channel TX Power (Octet 25 - Bit 6)
          LE Set Advertising Data (Octet 25 - Bit 7)
          LE Set Scan Response Data (Octet 26 - Bit 0)
          LE Set Advertise Enable (Octet 26 - Bit 1)
          LE Set Scan Parameters (Octet 26 - Bit 2)
          LE Set Scan Enable (Octet 26 - Bit 3)
          LE Create Connection (Octet 26 - Bit 4)
          LE Create Connection Cancel (Octet 26 - Bit 5)
          LE Read Accept List Size (Octet 26 - Bit 6)
          LE Clear Accept List (Octet 26 - Bit 7)
          LE Add Device To Accept List (Octet 27 - Bit 0)
          LE Remove Device From Accept List (Octet 27 - Bit 1)
          LE Connection Update (Octet 27 - Bit 2)
          LE Set Host Channel Classification (Octet 27 - Bit 3)
          LE Read Channel Map (Octet 27 - Bit 4)
          LE Read Remote Used Features (Octet 27 - Bit 5)
          LE Encrypt (Octet 27 - Bit 6)
          LE Rand (Octet 27 - Bit 7)
          LE Start Encryption (Octet 28 - Bit 0)
          LE Long Term Key Request Reply (Octet 28 - Bit 1)
          LE Long Term Key Request Neg Reply (Octet 28 - Bit 2)
          LE Read Supported States (Octet 28 - Bit 3)
          LE Receiver Test (Octet 28 - Bit 4)
          LE Transmitter Test (Octet 28 - Bit 5)
          LE Test End (Octet 28 - Bit 6)
          Read Authenticated Payload Timeout (Octet 32 - Bit 4)
          Write Authenticated Payload Timeout (Octet 32 - Bit 5)
          LE Set Data Length (Octet 33 - Bit 6)
          LE Read Suggested Default Data Length (Octet 33 - Bit 7)
          LE Write Suggested Default Data Length (Octet 34 - Bit 0)
          LE Add Device To Resolving List (Octet 34 - Bit 3)
          LE Remove Device From Resolving List (Octet 34 - Bit 4)
          LE Clear Resolving List (Octet 34 - Bit 5)
          LE Read Resolving List Size (Octet 34 - Bit 6)
          LE Set Address Resolution Enable (Octet 35 - Bit 1)
          LE Set Resolvable Private Address Timeout (Octet 35 - Bit 2)
          LE Read Maximum Data Length (Octet 35 - Bit 3)
          LE Read PHY (Octet 35 - Bit 4)
          LE Set Default PHY (Octet 35 - Bit 5)
          LE Set PHY (Octet 35 - Bit 6)
          LE Enhanced Receiver Test (Octet 35 - Bit 7)
          LE Enhanced Transmitter Test (Octet 36 - Bit 0)
          LE Set Advertising Set Random Address (Octet 36 - Bit 1)
          LE Set Extended Advertising Parameters (Octet 36 - Bit 2)
          LE Set Extended Advertising Data (Octet 36 - Bit 3)
          LE Set Extended Scan Response Data (Octet 36 - Bit 4)
          LE Set Extended Advertising Enable (Octet 36 - Bit 5)
          LE Read Maximum Advertising Data Length (Octet 36 - Bit 6)
          LE Read Number of Supported Advertising Sets (Octet 36 - Bit 7)
          LE Remove Advertising Set (Octet 37 - Bit 0)
          LE Clear Advertising Sets (Octet 37 - Bit 1)
          LE Set Periodic Advertising Parameters (Octet 37 - Bit 2)
          LE Set Periodic Advertising Data (Octet 37 - Bit 3)
          LE Set Periodic Advertising Enable (Octet 37 - Bit 4)
          LE Set Extended Scan Parameters (Octet 37 - Bit 5)
          LE Set Extended Scan Enable (Octet 37 - Bit 6)
          LE Extended Create Connection (Octet 37 - Bit 7)
          LE Periodic Advertising Create Sync (Octet 38 - Bit 0)
          LE Periodic Advertising Create Sync Cancel (Octet 38 - Bit 1)
          LE Periodic Advertising Terminate Sync (Octet 38 - Bit 2)
          LE Add Device To Periodic Advertiser List (Octet 38 - Bit 3)
          LE Remove Device From Periodic Advertiser List (Octet 38 - Bit 4)
          LE Clear Periodic Advertiser List (Octet 38 - Bit 5)
          LE Read Periodic Advertiser List Size (Octet 38 - Bit 6)
          LE Read Transmit Power (Octet 38 - Bit 7)
          LE Read RF Path Compensation (Octet 39 - Bit 0)
          LE Write RF Path Compensation (Octet 39 - Bit 1)
          LE Set Privacy Mode (Octet 39 - Bit 2)
          LE Periodic Advertising Receive Enable (Octet 40 - Bit 5)
          LE Periodic Advertising Sync Transfer (Octet 40 - Bit 6)
          LE Periodic Advertising Set Info Transfer (Octet 40 - Bit 7)
          LE Periodic Advertising Sync Transfer Parameters (Octet 41 - Bit 0)
          LE Set Default Periodic Advertisng Sync Transfer Parameters (Octet 41 - Bit 1)
          LE Read Buffer v2 (Octet 41 - Bit 5)
          LE Read ISO TX Sync (Octet 41 - Bit 6)
          LE Set Connected Isochronous Group Parameters (Octet 41 - Bit 7)
          LE Set Connected Isochronous Group Parameters Test (Octet 42 - Bit 0)
          LE Create Connected Isochronous Stream (Octet 42 - Bit 1)
          LE Remove Connected Isochronous Group (Octet 42 - Bit 2)
          LE Accept Connected Isochronous Stream Request (Octet 42 - Bit 3)
          LE Reject Connected Isochronous Stream Request (Octet 42 - Bit 4)
          LE Create Broadcast Isochronous Group (Octet 42 - Bit 5)
          LE Create Broadcast Isochronous Group Test (Octet 42 - Bit 6)
          LE Terminate Broadcast Isochronous Group (Octet 42 - Bit 7)
          LE Broadcast Isochronous Group Create Sync (Octet 43 - Bit 0)
          LE Broadcast Isochronous Group Terminate Sync (Octet 43 - Bit 1)
          LE Request Peer SCA (Octet 43 - Bit 2)
          LE Setup Isochronous Data Path (Octet 43 - Bit 3)
          LE Remove Isochronous Data Path (Octet 43 - Bit 4)
          LE Isochronous Transmit Test (Octet 43 - Bit 5)
          LE Isochronous Receive Test (Octet 43 - Bit 6)
          LE Isochronous Read Test Counters (Octet 43 - Bit 7)
          LE Isochronous Read Test Counters (Octet 44 - Bit 0)
          LE Set Host Feature (Octet 44 - Bit 1)
          Octet 44 - Bit 2 
          Octet 45 - Bit 6 
          Octet 46 - Bit 0 
          Octet 46 - Bit 1 
          Octet 46 - Bit 2 
< HCI Command: Host Buffer Size (0x03|0x0033) plen 7         #9 [hci1] 0.849082
        ACL MTU: 255  ACL max packet: 16
        SCO MTU: 0    SCO max packet: 0
> HCI Event: Command Complete (0x0e) plen 4                 #10 [hci1] 0.849517
      Host Buffer Size (0x03|0x0033) ncmd 1
        Status: Success (0x00)
< HCI Command: Set Controller To Ho.. (0x03|0x0031) plen 1  #11 [hci1] 0.868950
        Flow control: ACL Data Packets (0x01)
> HCI Event: Command Complete (0x0e) plen 4                 #12 [hci1] 0.869346
      Set Controller To Host Flow Control (0x03|0x0031) ncmd 1
        Status: Success (0x00)
< HCI Command: LE Read Local Suppor.. (0x08|0x0003) plen 0  #13 [hci1] 0.889087
> HCI Event: Command Complete (0x0e) plen 12                #14 [hci1] 0.889576
      LE Read Local Supported Features (0x08|0x0003) ncmd 1
        Status: Success (0x00)
        Features: 0xfd 0x79 0x00 0xf7 0x30 0x01 0x00 0x00
          LE Encryption
          Extended Reject Indication
          Peripheral-initiated Features Exchange
          LE Ping
          LE Data Packet Length Extension
          LL Privacy
          Extended Scanner Filter Policies
          LE 2M PHY
          LE Coded PHY
          LE Extended Advertising
          LE Periodic Advertising
          Channel Selection Algorithm #2
          Periodic Advertising Sync Transfer - Sender
          Periodic Advertising Sync Transfer - Recipient
          Sleep Clock Accuracy Updates
          Connected Isochronous Stream - Central
          Connected Isochronous Stream - Peripheral
          Isochronous Broadcaster
          Synchronized Receiver
          Periodic Advertising ADI support
          Connection Subrating
          Unknown features (0x0000010000000000)
< HCI Command: LE Set Host Feature (0x08|0x0074) plen 2     #15 [hci1] 0.909087
        Bit Number: 32
          Connected Isochronous Stream (Host Support)
        Bit Value: 1
> HCI Event: Command Complete (0x0e) plen 4                 #16 [hci1] 0.909484
      LE Set Host Feature (0x08|0x0074) ncmd 1
        Status: Success (0x00)
< HCI Command: LE Read Buffer v2 (0x08|0x0060) plen 0       #17 [hci1] 0.929077
> HCI Event: Command Complete (0x0e) plen 10                #18 [hci1] 0.929603
      LE Read Buffer v2 (0x08|0x0060) ncmd 1
        Status: Success (0x00)
        ACL MTU: 27
        ACL max packet: 3
        ISO MTU: 318
        ISO max packet: 3
< HCI Command: LE Read Maximum Adve.. (0x08|0x003a) plen 0  #19 [hci1] 0.949102
> HCI Event: Command Complete (0x0e) plen 6                 #20 [hci1] 0.949596
      LE Read Maximum Advertising Data Length (0x08|0x003a) ncmd 1
        Status: Success (0x00)
        Max length: 1650
< HCI Command: LE Read Supported St.. (0x08|0x001c) plen 0  #21 [hci1] 0.969048
> HCI Event: Command Complete (0x0e) plen 12                #22 [hci1] 0.969571
      LE Read Supported States (0x08|0x001c) ncmd 1
        Status: Success (0x00)
        States: 0x000003ff3e0306ff
          Non-connectable Advertising State
          Scannable Advertising State
          Connectable Advertising State
          High Duty Cycle Directed Advertising State
          Passive Scanning State
          Active Scanning State
          Initiating State
            and Connection State (Central Role)
          Connection State (Peripheral Role)
          Scannable Advertising State
            and Passive Scanning State
          Connectable Advertising State
            and Passive Scanning State
          Non-connectable Advertising State
            and Initiating State
          Scannable Advertising State
            and Initiating State
          Active Scanning State
            and Connection State (Central Role)
          Passive Scanning State
            and Connection State (Peripheral Role)
          Active Scanning State
            and Connection State (Peripheral Role)
          Initiating State
            and Connection State (Central Role)
            and Central Role & Central Role
          Low Duty Cycle Directed Advertising State
          Connectable Advertising State
            and Initiating State
            and Central Role & Peripheral Role
          High Duty Cycle Directed Advertising State
            and Initiating State
            and Central Role & Peripheral Role
          Low Duty Cycle Directed Advertising State
            and Initiating State
            and Central Role & Peripheral Role
          Connectable Advertising State
            and Connection State (Central Role)
            and Central Role & Peripheral Role
          High Duty Cycle Directed Advertising State
            and Connection State (Central Role)
            and Central Role & Peripheral Role
          Low Duty Cycle Directed Advertising State
            and Connection State (Central Role)
            and Central Role & Peripheral Role
          Connectable Advertising State
            and Connection State (Peripheral Role)
            and Central Role & Peripheral Role
          High Duty Cycle Directed Advertising State
            and Connection State (Peripheral Role)
            and Peripheral Role & Peripheral Role
          Low Duty Cycle Directed Advertising State
            and Connection State (Peripheral Role)
            and Peripheral Role & Peripheral Role
          Initiating State
            and Connection State (Peripheral Role)
            and Central Role & Peripheral Role
< HCI Command: LE Read Maximum Data.. (0x08|0x002f) plen 0  #23 [hci1] 0.989071
> HCI Event: Command Complete (0x0e) plen 12                #24 [hci1] 0.989534
      LE Read Maximum Data Length (0x08|0x002f) ncmd 1
        Status: Success (0x00)
        Max TX octets: 251
        Max TX time: 2704
        Max RX octets: 251
        Max RX time: 2704
< HCI Command: LE Write Suggested D.. (0x08|0x0024) plen 4  #25 [hci1] 1.009045
        TX octets: 251
        TX time: 2704
> HCI Event: Command Complete (0x0e) plen 4                 #26 [hci1] 1.009468
      LE Write Suggested Default Data Length (0x08|0x0024) ncmd 1
        Status: Success (0x00)
< HCI Command: LE Read Resolving Li.. (0x08|0x002a) plen 0  #27 [hci1] 1.029090
> HCI Event: Command Complete (0x0e) plen 5                 #28 [hci1] 1.029492
      LE Read Resolving List Size (0x08|0x002a) ncmd 1
        Status: Success (0x00)
        Size: 8
< HCI Command: LE Set Event Mask (0x08|0x0001) plen 8       #29 [hci1] 1.049070
        Mask: 0x000002023f87fa5e
          LE Advertising Report
          LE Connection Update Complete
          LE Read Remote Used Features Complete
          LE Long Term Key Request
          LE Data Length Change
          LE Enhanced Connection Complete
          LE PHY Update Complete
          LE Extended Advertising Report
          LE Periodic Advertising Sync Established
          LE Periodic Advertising Report
          LE Periodic Advertising Sync Lost
          LE Extended Scan Timeout
          LE Extended Advertising Set Terminated
          LE Scan Request Received
          LE Periodic Advertising Sync Transfer Rvc
          LE CIS Established
          LE CIS Request
          LE Create BIG Complete
          LE Terminate BIG Complete
          LE BIG Sync Estabilished Complete
          LE BIG Sync Lost
          LE BIG Info Advertising Report
          Unknown mask (0x0000020000000000)
> HCI Event: Command Complete (0x0e) plen 4                 #30 [hci1] 1.049529
      LE Set Event Mask (0x08|0x0001) ncmd 1
        Status: Success (0x00)
< HCI Command: Set Event Mask (0x03|0x0001) plen 8          #31 [hci1] 1.069084
        Mask: 0x2000800002008890
          Disconnection Complete
          Encryption Change
          Read Remote Version Information Complete
          Hardware Error
          Data Buffer Overflow
          Encryption Key Refresh Complete
          LE Meta
> HCI Event: Command Complete (0x0e) plen 4                 #32 [hci1] 1.069605
      Set Event Mask (0x03|0x0001) ncmd 1
        Status: Success (0x00)
< HCI Command: Read BD ADDR (0x04|0x0009) plen 0            #33 [hci1] 1.089049
> HCI Event: Command Complete (0x0e) plen 10                #34 [hci1] 1.089541
      Read BD ADDR (0x04|0x0009) ncmd 1
        Status: Success (0x00)
        Address: 00:00:00:00:00:00 (OUI 00-00-00)
< HCI Command: LE Set Random Address (0x08|0x0005) plen 6   #35 [hci1] 1.109113
        Address: D5:B6:CC:31:DB:3B (Static)
> HCI Event: Command Complete (0x0e) plen 4                 #36 [hci1] 1.109563
      LE Set Random Address (0x08|0x0005) ncmd 1
        Status: Success (0x00)
< HCI Command: LE Set Extended Adv.. (0x08|0x0036) plen 25  #37 [hci1] 3.719123
        Handle: 0x00
        Properties: 0x0013
          Connectable
          Scannable
          Use legacy advertising PDUs: ADV_IND
        Min advertising interval: 100.000 msec (0x00a0)
        Max advertising interval: 150.000 msec (0x00f0)
        Channel map: 37, 38, 39 (0x07)
        Own address type: Random (0x01)
        Peer address type: Public (0x00)
        Peer address: 00:00:00:00:00:00 (OUI 00-00-00)
        Filter policy: Allow Scan Request from Any, Allow Connect Request from Any (0x00)
        TX power: Host has no preference (0x7f)
        Primary PHY: LE 1M (0x01)
        Secondary max skip: 0x00
        Secondary PHY: LE 1M (0x01)
        SID: 0x00
        Scan request notifications: Disabled (0x00)
> HCI Event: Command Complete (0x0e) plen 5                 #38 [hci1] 3.719844
      LE Set Extended Advertising Parameters (0x08|0x0036) ncmd 1
        Status: Success (0x00)
        TX power (selected): 0 dbm (0x00)
< HCI Command: LE Set Advertising S.. (0x08|0x0035) plen 7  #39 [hci1] 3.729113
        Advertising handle: 0x00
        Advertising random address: D5:B6:CC:31:DB:3B (Static)
> HCI Event: Command Complete (0x0e) plen 4                 #40 [hci1] 3.729592
      LE Set Advertising Set Random Address (0x08|0x0035) ncmd 1
        Status: Success (0x00)
< HCI Command: LE Set Extended Adv.. (0x08|0x0037) plen 22  #41 [hci1] 3.749107
        Handle: 0x00
        Operation: Complete extended advertising data (0x03)
        Fragment preference: Minimize fragmentation (0x01)
        Data length: 0x12
        Flags: 0x06
          LE General Discoverable Mode
          BR/EDR Not Supported
        Name (complete): Tester_F6B11A
> HCI Event: Command Complete (0x0e) plen 4                 #42 [hci1] 3.749837
      LE Set Extended Advertising Data (0x08|0x0037) ncmd 1
        Status: Success (0x00)
< HCI Command: LE Set Extended Scan.. (0x08|0x0038) plen 4  #43 [hci1] 3.769105
        Handle: 0x00
        Operation: Complete scan response data (0x03)
        Fragment preference: Minimize fragmentation (0x01)
        Data length: 0x00
> HCI Event: Command Complete (0x0e) plen 4                 #44 [hci1] 3.769623
      LE Set Extended Scan Response Data (0x08|0x0038) ncmd 1
        Status: Success (0x00)
< HCI Command: LE Set Extended Adve.. (0x08|0x0039) plen 6  #45 [hci1] 3.789110
        Extended advertising: Enabled (0x01)
        Number of sets: 1 (0x01)
        Entry 0
          Handle: 0x00
          Duration: 0 ms (0x00)
          Max ext adv events: 0
> HCI Event: Command Complete (0x0e) plen 4                 #46 [hci1] 3.789652
      LE Set Extended Advertising Enable (0x08|0x0039) ncmd 1
        Status: Success (0x00)
> HCI Event: LE Meta Event (0x3e) plen 31                   #47 [hci1] 3.912129
      LE Enhanced Connection Complete (0x0a)
        Status: Success (0x00)
        Handle: 417
        Role: Peripheral (0x01)
        Peer address type: Public (0x00)
        Peer address: DF:A9:FF:F6:B1:1A (OUI DF-A9-FF)
        Local resolvable private address: 00:00:00:00:00:00 (Non-Resolvable)
        Peer resolvable private address: 00:00:00:00:00:00 (Non-Resolvable)
        Connection interval: 87.50 msec (0x0046)
        Connection latency: 0 (0x0000)
        Supervision timeout: 25120 msec (0x09d0)
        Central clock accuracy: 0x01
> HCI Event: LE Meta Event (0x3e) plen 6                    #48 [hci1] 3.912136
      LE Advertising Set Terminated (0x12)
        Status: Success (0x00)
        Handle: 0
        Connection handle: 417
        Number of completed extended advertising events: 0
< HCI Command: LE Read Remote Used... (0x08|0x0016) plen 2  #49 [hci1] 3.930138
        Handle: 417 Address: DF:A9:FF:F6:B1:1A (OUI DF-A9-FF)
< ACL Data TX: Handle 417 flags 0x00 dlen 7                 #50 [hci1] 3.930161
      ATT: Exchange MTU Request (0x02) len 2
        Client RX MTU: 251
> HCI Event: Command Status (0x0f) plen 4                   #51 [hci1] 3.930704
      LE Read Remote Used Features (0x08|0x0016) ncmd 1
        Status: Success (0x00)
> HCI Event: Number of Completed Packets (0x13) plen 5      #52 [hci1] 4.087821
        Num handles: 1
        Handle: 417 Address: DF:A9:FF:F6:B1:1A (OUI DF-A9-FF)
        Count: 1
        #50: len 7 (0 Kb/s)
        Latency: 157 msec (157-157 msec ~157 msec)
> HCI Event: LE Meta Event (0x3e) plen 12                   #53 [hci1] 4.175720
      LE Read Remote Used Features (0x04)
        Status: Success (0x00)
        Handle: 417 Address: DF:A9:FF:F6:B1:1A (OUI DF-A9-FF)
        Features: 0x2d 0x49 0x00 0xf7 0x67 0xd8 0x00 0x00
          LE Encryption
          Extended Reject Indication
          Peripheral-initiated Features Exchange
          LE Data Packet Length Extension
          LE 2M PHY
          LE Coded PHY
          Channel Selection Algorithm #2
          Periodic Advertising Sync Transfer - Sender
          Periodic Advertising Sync Transfer - Recipient
          Sleep Clock Accuracy Updates
          Connected Isochronous Stream - Central
          Connected Isochronous Stream - Peripheral
          Isochronous Broadcaster
          Synchronized Receiver
          Connected Isochronous Stream (Host Support)
          LE Power Control Request
          LE Power Control Request
          Connection Subrating
          Connection Subrating (Host Support)
          Unknown features (0x0000d80000000000)
> ACL Data RX: Handle 417 flags 0x02 dlen 11                #54 [hci1] 6.625423
      SMP: Pairing Request (0x01) len 6
        IO capability: KeyboardDisplay (0x04)
        OOB data: Authentication data not present (0x00)
        Authentication requirement: Bonding, MITM, SC, No Keypresses (0x0d)
        Max encryption key size: 16
        Initiator key distribution: EncKey IdKey (0x03)
        Responder key distribution: EncKey IdKey Sign (0x07)
> ACL Data RX: Handle 417 flags 0x02 dlen 7                 #55 [hci1] 6.625849
      ATT: Exchange MTU Response (0x03) len 2
        Server RX MTU: 23
< HCI Command: Host Number of Compl.. (0x03|0x0035) plen 5  #56 [hci1] 6.629087
        Num handles: 1
        Handle: 417 Address: DF:A9:FF:F6:B1:1A (OUI DF-A9-FF)
        Count: 1
< ACL Data TX: Handle 417 flags 0x00 dlen 11                #57 [hci1] 6.629119
      SMP: Pairing Response (0x02) len 6
        IO capability: DisplayOnly (0x00)
        OOB data: Authentication data not present (0x00)
        Authentication requirement: Bonding, No MITM, SC, No Keypresses (0x09)
        Max encryption key size: 16
        Initiator key distribution: IdKey (0x02)
        Responder key distribution: <none> (0x00)
< HCI Command: Host Number of Compl.. (0x03|0x0035) plen 5  #58 [hci1] 6.629146
        Num handles: 1
        Handle: 417 Address: DF:A9:FF:F6:B1:1A (OUI DF-A9-FF)
        Count: 1
> HCI Event: Number of Completed Packets (0x13) plen 5      #59 [hci1] 6.800459
        Num handles: 1
        Handle: 417 Address: DF:A9:FF:F6:B1:1A (OUI DF-A9-FF)
        Count: 1
        #57: len 11 (0 Kb/s)
        Latency: 171 msec (157-171 msec ~164 msec)
> ACL Data RX: Handle 417 flags 0x02 dlen 27                #60 [hci1] 6.800830
> ACL Data RX: Handle 417 flags 0x01 dlen 27                #61 [hci1] 6.801382
> ACL Data RX: Handle 417 flags 0x01 dlen 15                #62 [hci1] 6.801789
      SMP: Pairing Public Key (0x0c) len 64
        X: 28096ec75ba87d3d5b16f446a57ce953f3ec04495f8e4755631afb925a3812c3
        Y: f543ae8fae8b266dfceedf99a750fe04c065bb49fe4f8f9ba6011855d79de839
< HCI Command: Host Number of Compl.. (0x03|0x0035) plen 5  #63 [hci1] 6.809406
        Num handles: 1
        Handle: 417 Address: DF:A9:FF:F6:B1:1A (OUI DF-A9-FF)
        Count: 1
< HCI Command: Host Number of Compl.. (0x03|0x0035) plen 5  #64 [hci1] 6.809411
        Num handles: 1
        Handle: 417 Address: DF:A9:FF:F6:B1:1A (OUI DF-A9-FF)
        Count: 1
< HCI Command: Host Number of Compl.. (0x03|0x0035) plen 5  #65 [hci1] 6.809494
        Num handles: 1
        Handle: 417 Address: DF:A9:FF:F6:B1:1A (OUI DF-A9-FF)
        Count: 1
< ACL Data TX: Handle 417 flags 0x00 dlen 27                #66 [hci1] 6.809544
< ACL Data TX: Handle 417 flags 0x01 dlen 27                #67 [hci1] 6.809548
< ACL Data TX: Handle 417 flags 0x01 dlen 15                #68 [hci1] 6.809558
      SMP: Pairing Public Key (0x0c) len 64
        X: 98308440221e2d910f0e54b71e7ec652857aa9b5a0dc65028824cc19db1226e9
        Y: 67a4816bcb62efb21701e31fdb27561a6217575fb007a8bbdabe7e28b6f68482
> HCI Event: Number of Completed Packets (0x13) plen 5      #69 [hci1] 6.888359
        Num handles: 1
        Handle: 417 Address: DF:A9:FF:F6:B1:1A (OUI DF-A9-FF)
        Count: 1
        #66: len 27 (2 Kb/s)
        Latency: 78 msec (78-171 msec ~121 msec)
> HCI Event: Number of Completed Packets (0x13) plen 5      #70 [hci1] 6.889047
        Num handles: 1
        Handle: 417 Address: DF:A9:FF:F6:B1:1A (OUI DF-A9-FF)
        Count: 1
        #67: len 27 (2 Kb/s)
        Latency: 79 msec (78-171 msec ~100 msec)
> HCI Event: Number of Completed Packets (0x13) plen 5      #71 [hci1] 6.975230
        Num handles: 1
        Handle: 417 Address: DF:A9:FF:F6:B1:1A (OUI DF-A9-FF)
        Count: 1
        #68: len 15 (0 Kb/s)
        Latency: 165 msec (78-171 msec ~133 msec)
> ACL Data RX: Handle 417 flags 0x02 dlen 21                #72 [hci1] 7.938053
      SMP: Pairing Confirm (0x03) len 16
        Confim value: c4c663917a69a4f67fcaa0620b9b34fc
< HCI Command: Host Number of Compl.. (0x03|0x0035) plen 5  #73 [hci1] 7.949912
        Num handles: 1
        Handle: 417 Address: DF:A9:FF:F6:B1:1A (OUI DF-A9-FF)
        Count: 1
< ACL Data TX: Handle 417 flags 0x00 dlen 21                #74 [hci1] 7.950121
      SMP: Pairing Confirm (0x03) len 16
        Confim value: bd69eefc5fca19cfeae3a7efe44dd49b
> HCI Event: Number of Completed Packets (0x13) plen 5      #75 [hci1] 8.112919
        Num handles: 1
        Handle: 417 Address: DF:A9:FF:F6:B1:1A (OUI DF-A9-FF)
        Count: 1
        #74: len 21 (1 Kb/s)
        Latency: 162 msec (78-171 msec ~147 msec)
> ACL Data RX: Handle 417 flags 0x02 dlen 21                #76 [hci1] 8.113272
      SMP: Pairing Random (0x04) len 16
        Random value: 25065658dd343ed20000000000000000
< HCI Command: Host Number of Compl.. (0x03|0x0035) plen 5  #77 [hci1] 8.130027
        Num handles: 1
        Handle: 417 Address: DF:A9:FF:F6:B1:1A (OUI DF-A9-FF)
        Count: 1
< ACL Data TX: Handle 417 flags 0x00 dlen 21                #78 [hci1] 8.130141
      SMP: Pairing Random (0x04) len 16
        Random value: 8e6108f966a694cbe26df70bb96773e6
> HCI Event: Number of Completed Packets (0x13) plen 5      #79 [hci1] 8.287739
        Num handles: 1
        Handle: 417 Address: DF:A9:FF:F6:B1:1A (OUI DF-A9-FF)
        Count: 1
        #78: len 21 (1 Kb/s)
        Latency: 157 msec (78-171 msec ~152 msec)
> ACL Data RX: Handle 417 flags 0x02 dlen 21                #80 [hci1] 8.375526
      SMP: Pairing Confirm (0x03) len 16
        Confim value: 0fcb9d13273f577bb0d09dca12e71f01
< HCI Command: Host Number of Compl.. (0x03|0x0035) plen 5  #81 [hci1] 8.389466
        Num handles: 1
        Handle: 417 Address: DF:A9:FF:F6:B1:1A (OUI DF-A9-FF)
        Count: 1
< ACL Data TX: Handle 417 flags 0x00 dlen 21                #82 [hci1] 8.389585
      SMP: Pairing Confirm (0x03) len 16
        Confim value: 826ed3d6a43ba10bf9fc347f20800a6b
> HCI Event: Number of Completed Packets (0x13) plen 5      #83 [hci1] 8.550424
        Num handles: 1
        Handle: 417 Address: DF:A9:FF:F6:B1:1A (OUI DF-A9-FF)
        Count: 1
        #82: len 21 (1 Kb/s)
        Latency: 160 msec (78-171 msec ~156 msec)
> ACL Data RX: Handle 417 flags 0x02 dlen 21                #84 [hci1] 8.550793
      SMP: Pairing Random (0x04) len 16
        Random value: 261f0b5064d1b8070000000000000000
< HCI Command: Host Number of Compl.. (0x03|0x0035) plen 5  #85 [hci1] 8.570030
        Num handles: 1
        Handle: 417 Address: DF:A9:FF:F6:B1:1A (OUI DF-A9-FF)
        Count: 1
< ACL Data TX: Handle 417 flags 0x00 dlen 21                #86 [hci1] 8.570184
      SMP: Pairing Random (0x04) len 16
        Random value: 4d02679f89a05211af56d8b3da64d21e
> HCI Event: Number of Completed Packets (0x13) plen 5      #87 [hci1] 8.725189
        Num handles: 1
        Handle: 417 Address: DF:A9:FF:F6:B1:1A (OUI DF-A9-FF)
        Count: 1
        #86: len 21 (1 Kb/s)
        Latency: 155 msec (78-171 msec ~155 msec)
> ACL Data RX: Handle 417 flags 0x02 dlen 21                #88 [hci1] 8.813082
      SMP: Pairing Confirm (0x03) len 16
        Confim value: 9df7440824ce423700b0aa3751b5542b
< HCI Command: Host Number of Compl.. (0x03|0x0035) plen 5  #89 [hci1] 8.829784
        Num handles: 1
        Handle: 417 Address: DF:A9:FF:F6:B1:1A (OUI DF-A9-FF)
        Count: 1
< ACL Data TX: Handle 417 flags 0x00 dlen 21                #90 [hci1] 8.830005
      SMP: Pairing Confirm (0x03) len 16
        Confim value: c97af340bdad67bb37200edd6f3fce91
> HCI Event: Number of Completed Packets (0x13) plen 5      #91 [hci1] 8.987922
        Num handles: 1
        Handle: 417 Address: DF:A9:FF:F6:B1:1A (OUI DF-A9-FF)
        Count: 1
        #90: len 21 (1 Kb/s)
        Latency: 157 msec (78-171 msec ~156 msec)
> ACL Data RX: Handle 417 flags 0x02 dlen 21                #92 [hci1] 8.988259
      SMP: Pairing Random (0x04) len 16
        Random value: 39bc37152e3b8dd40000000000000000
< HCI Command: Host Number of Compl.. (0x03|0x0035) plen 5  #93 [hci1] 8.989780
        Num handles: 1
        Handle: 417 Address: DF:A9:FF:F6:B1:1A (OUI DF-A9-FF)
        Count: 1
< ACL Data TX: Handle 417 flags 0x00 dlen 21                #94 [hci1] 8.989848
      SMP: Pairing Random (0x04) len 16
        Random value: 5e8286bc235a02440d0c3424a2acf8fd
> HCI Event: Number of Completed Packets (0x13) plen 5      #95 [hci1] 9.162688
        Num handles: 1
        Handle: 417 Address: DF:A9:FF:F6:B1:1A (OUI DF-A9-FF)
        Count: 1
        #94: len 21 (0 Kb/s)
        Latency: 172 msec (78-172 msec ~164 msec)
> ACL Data RX: Handle 417 flags 0x02 dlen 21                #96 [hci1] 9.250506
      SMP: Pairing Confirm (0x03) len 16
        Confim value: 3bd6f26d2cddf3dbc02b3ccb05446e53
< HCI Command: Host Number of Compl.. (0x03|0x0035) plen 5  #97 [hci1] 9.269687
        Num handles: 1
        Handle: 417 Address: DF:A9:FF:F6:B1:1A (OUI DF-A9-FF)
        Count: 1
< ACL Data TX: Handle 417 flags 0x00 dlen 21                #98 [hci1] 9.269888
      SMP: Pairing Confirm (0x03) len 16
        Confim value: ca09f5366236bdd6a8bfa8b3c695f37c
> HCI Event: Number of Completed Packets (0x13) plen 5      #99 [hci1] 9.425360
        Num handles: 1
        Handle: 417 Address: DF:A9:FF:F6:B1:1A (OUI DF-A9-FF)
        Count: 1
        #98: len 21 (1 Kb/s)
        Latency: 155 msec (78-172 msec ~160 msec)
> ACL Data RX: Handle 417 flags 0x02 dlen 21               #100 [hci1] 9.425685
      SMP: Pairing Random (0x04) len 16
        Random value: 43ba2b2c930f13220000000000000000
< HCI Command: Host Number of Comp.. (0x03|0x0035) plen 5  #101 [hci1] 9.429371
        Num handles: 1
        Handle: 417 Address: DF:A9:FF:F6:B1:1A (OUI DF-A9-FF)
        Count: 1
< ACL Data TX: Handle 417 flags 0x00 dlen 21               #102 [hci1] 9.429423
      SMP: Pairing Random (0x04) len 16
        Random value: 5c4a1bcadd27bd58e945097b00bad7ac
> HCI Event: Number of Completed Packets (0x13) plen 5     #103 [hci1] 9.600343
        Num handles: 1
        Handle: 417 Address: DF:A9:FF:F6:B1:1A (OUI DF-A9-FF)
        Count: 1
        #102: len 21 (0 Kb/s)
        Latency: 170 msec (78-172 msec ~165 msec)
> ACL Data RX: Handle 417 flags 0x02 dlen 21               #104 [hci1] 9.600614
      SMP: Pairing Confirm (0x03) len 16
        Confim value: fd08e87165ad372beae90bff3ff94d26
< HCI Command: Host Number of Comp.. (0x03|0x0035) plen 5  #105 [hci1] 9.609380
        Num handles: 1
        Handle: 417 Address: DF:A9:FF:F6:B1:1A (OUI DF-A9-FF)
        Count: 1
< ACL Data TX: Handle 417 flags 0x00 dlen 21               #106 [hci1] 9.609386
      SMP: Pairing Confirm (0x03) len 16
        Confim value: e8eaf33b94cfbaa4b11121722117a9ff
> HCI Event: Number of Completed Packets (0x13) plen 5     #107 [hci1] 9.775371
        Num handles: 1
        Handle: 417 Address: DF:A9:FF:F6:B1:1A (OUI DF-A9-FF)
        Count: 1
        #106: len 21 (1 Kb/s)
        Latency: 165 msec (78-172 msec ~165 msec)
> ACL Data RX: Handle 417 flags 0x02 dlen 21               #108 [hci1] 9.775682
      SMP: Pairing Random (0x04) len 16
        Random value: 8a76d33fc53235b40000000000000000
< HCI Command: Host Number of Comp.. (0x03|0x0035) plen 5  #109 [hci1] 9.790002
        Num handles: 1
        Handle: 417 Address: DF:A9:FF:F6:B1:1A (OUI DF-A9-FF)
        Count: 1
< ACL Data TX: Handle 417 flags 0x00 dlen 21               #110 [hci1] 9.790098
      SMP: Pairing Random (0x04) len 16
        Random value: 32527e6e64e79f33b2e374394db8ab2d
> HCI Event: Number of Completed Packets (0x13) plen 5     #111 [hci1] 9.950116
        Num handles: 1
        Handle: 417 Address: DF:A9:FF:F6:B1:1A (OUI DF-A9-FF)
        Count: 1
        #110: len 21 (1 Kb/s)
        Latency: 160 msec (78-172 msec ~162 msec)
> ACL Data RX: Handle 417 flags 0x02 dlen 21              #112 [hci1] 10.037979
      SMP: Pairing Confirm (0x03) len 16
        Confim value: d7f6bef7ac98e20f79ca5f8964f8879a
< HCI Command: Host Number of Com.. (0x03|0x0035) plen 5  #113 [hci1] 10.049846
        Num handles: 1
        Handle: 417 Address: DF:A9:FF:F6:B1:1A (OUI DF-A9-FF)
        Count: 1
< ACL Data TX: Handle 417 flags 0x00 dlen 21              #114 [hci1] 10.050094
      SMP: Pairing Confirm (0x03) len 16
        Confim value: ff5c753c2d7e76c7806c698e8c9359b6
> HCI Event: Number of Completed Packets (0x13) plen 5    #115 [hci1] 10.212794
        Num handles: 1
        Handle: 417 Address: DF:A9:FF:F6:B1:1A (OUI DF-A9-FF)
        Count: 1
        #114: len 21 (1 Kb/s)
        Latency: 162 msec (78-172 msec ~162 msec)
> ACL Data RX: Handle 417 flags 0x02 dlen 21              #116 [hci1] 10.213208
      SMP: Pairing Random (0x04) len 16
        Random value: 5176e1e339e542de0000000000000000
< HCI Command: Host Number of Com.. (0x03|0x0035) plen 5  #117 [hci1] 10.230067
        Num handles: 1
        Handle: 417 Address: DF:A9:FF:F6:B1:1A (OUI DF-A9-FF)
        Count: 1
< ACL Data TX: Handle 417 flags 0x00 dlen 21              #118 [hci1] 10.230194
      SMP: Pairing Random (0x04) len 16
        Random value: dddbdfe2838e9a8cc6964353c850fef7
> HCI Event: Number of Completed Packets (0x13) plen 5    #119 [hci1] 10.387619
        Num handles: 1
        Handle: 417 Address: DF:A9:FF:F6:B1:1A (OUI DF-A9-FF)
        Count: 1
        #118: len 21 (1 Kb/s)
        Latency: 157 msec (78-172 msec ~160 msec)
> ACL Data RX: Handle 417 flags 0x02 dlen 21              #120 [hci1] 10.475470
      SMP: Pairing Confirm (0x03) len 16
        Confim value: bbc8fa5eb190a4169fc7132a88158cd4
< HCI Command: Host Number of Com.. (0x03|0x0035) plen 5  #121 [hci1] 10.489365
        Num handles: 1
        Handle: 417 Address: DF:A9:FF:F6:B1:1A (OUI DF-A9-FF)
        Count: 1
< ACL Data TX: Handle 417 flags 0x00 dlen 21              #122 [hci1] 10.489497
      SMP: Pairing Confirm (0x03) len 16
        Confim value: 86f21f2e3bc1d33503b6e2e7e3ef7ae9
> HCI Event: Number of Completed Packets (0x13) plen 5    #123 [hci1] 10.650339
        Num handles: 1
        Handle: 417 Address: DF:A9:FF:F6:B1:1A (OUI DF-A9-FF)
        Count: 1
        #122: len 21 (1 Kb/s)
        Latency: 160 msec (78-172 msec ~160 msec)
> ACL Data RX: Handle 417 flags 0x02 dlen 21              #124 [hci1] 10.650732
      SMP: Pairing Random (0x04) len 16
        Random value: 2d02ff48a0441b270000000000000000
< HCI Command: Host Number of Com.. (0x03|0x0035) plen 5  #125 [hci1] 10.670108
        Num handles: 1
        Handle: 417 Address: DF:A9:FF:F6:B1:1A (OUI DF-A9-FF)
        Count: 1
< ACL Data TX: Handle 417 flags 0x00 dlen 21              #126 [hci1] 10.670298
      SMP: Pairing Random (0x04) len 16
        Random value: eb9f1915536596b6fc3db1c86b2b1970
> HCI Event: Number of Completed Packets (0x13) plen 5    #127 [hci1] 10.825155
        Num handles: 1
        Handle: 417 Address: DF:A9:FF:F6:B1:1A (OUI DF-A9-FF)
        Count: 1
        #126: len 21 (1 Kb/s)
        Latency: 154 msec (78-172 msec ~157 msec)
> ACL Data RX: Handle 417 flags 0x02 dlen 21              #128 [hci1] 10.913104
      SMP: Pairing Confirm (0x03) len 16
        Confim value: 19ca03f705b41a157109a7287cb321bc
< HCI Command: Host Number of Com.. (0x03|0x0035) plen 5  #129 [hci1] 10.929746
        Num handles: 1
        Handle: 417 Address: DF:A9:FF:F6:B1:1A (OUI DF-A9-FF)
        Count: 1
< ACL Data TX: Handle 417 flags 0x00 dlen 21              #130 [hci1] 10.929963
      SMP: Pairing Confirm (0x03) len 16
        Confim value: d3a08ec0efe637c527e3e25b4b706445
> HCI Event: Number of Completed Packets (0x13) plen 5    #131 [hci1] 11.087828
        Num handles: 1
        Handle: 417 Address: DF:A9:FF:F6:B1:1A (OUI DF-A9-FF)
        Count: 1
        #130: len 21 (1 Kb/s)
        Latency: 157 msec (78-172 msec ~157 msec)
> ACL Data RX: Handle 417 flags 0x02 dlen 21              #132 [hci1] 11.088156
      SMP: Pairing Random (0x04) len 16
        Random value: c94b0cfacbf701120000000000000000
< HCI Command: Host Number of Com.. (0x03|0x0035) plen 5  #133 [hci1] 11.089898
        Num handles: 1
        Handle: 417 Address: DF:A9:FF:F6:B1:1A (OUI DF-A9-FF)
        Count: 1
< ACL Data TX: Handle 417 flags 0x00 dlen 21              #134 [hci1] 11.090027
      SMP: Pairing Random (0x04) len 16
        Random value: 5c794dc9ad9f2c3f295ebd5ad5e1c3cf
> HCI Event: Number of Completed Packets (0x13) plen 5    #135 [hci1] 11.262628
        Num handles: 1
        Handle: 417 Address: DF:A9:FF:F6:B1:1A (OUI DF-A9-FF)
        Count: 1
        #134: len 21 (0 Kb/s)
        Latency: 172 msec (78-172 msec ~165 msec)
> ACL Data RX: Handle 417 flags 0x02 dlen 21              #136 [hci1] 11.350539
      SMP: Pairing Confirm (0x03) len 16
        Confim value: 21dcc2a090e3b7b75a7e36e289030d0d
< HCI Command: Host Number of Com.. (0x03|0x0035) plen 5  #137 [hci1] 11.369783
        Num handles: 1
        Handle: 417 Address: DF:A9:FF:F6:B1:1A (OUI DF-A9-FF)
        Count: 1
< ACL Data TX: Handle 417 flags 0x00 dlen 21              #138 [hci1] 11.370048
      SMP: Pairing Confirm (0x03) len 16
        Confim value: 35781ffe1f1d650f494996b8aa611cac
> HCI Event: Number of Completed Packets (0x13) plen 5    #139 [hci1] 11.525258
        Num handles: 1
        Handle: 417 Address: DF:A9:FF:F6:B1:1A (OUI DF-A9-FF)
        Count: 1
        #138: len 21 (1 Kb/s)
        Latency: 155 msec (78-172 msec ~160 msec)
> ACL Data RX: Handle 417 flags 0x02 dlen 21              #140 [hci1] 11.525590
      SMP: Pairing Random (0x04) len 16
        Random value: a41956a3f9a31bae0000000000000000
< HCI Command: Host Number of Com.. (0x03|0x0035) plen 5  #141 [hci1] 11.529990
        Num handles: 1
        Handle: 417 Address: DF:A9:FF:F6:B1:1A (OUI DF-A9-FF)
        Count: 1
< ACL Data TX: Handle 417 flags 0x00 dlen 21              #142 [hci1] 11.530096
      SMP: Pairing Random (0x04) len 16
        Random value: 5c2fff312cdf99c9491988e877355a9a
> HCI Event: Number of Completed Packets (0x13) plen 5    #143 [hci1] 11.700065
        Num handles: 1
        Handle: 417 Address: DF:A9:FF:F6:B1:1A (OUI DF-A9-FF)
        Count: 1
        #142: len 21 (0 Kb/s)
        Latency: 169 msec (78-172 msec ~165 msec)
> ACL Data RX: Handle 417 flags 0x02 dlen 21              #144 [hci1] 11.788027
      SMP: Pairing Confirm (0x03) len 16
        Confim value: 699f8f9f1a5e6ce532822234adc51bc7
< HCI Command: Host Number of Com.. (0x03|0x0035) plen 5  #145 [hci1] 11.789819
        Num handles: 1
        Handle: 417 Address: DF:A9:FF:F6:B1:1A (OUI DF-A9-FF)
        Count: 1
< ACL Data TX: Handle 417 flags 0x00 dlen 21              #146 [hci1] 11.790032
      SMP: Pairing Confirm (0x03) len 16
        Confim value: c267596a1bac08ca200709e356136675
> HCI Event: Number of Completed Packets (0x13) plen 5    #147 [hci1] 11.962820
        Num handles: 1
        Handle: 417 Address: DF:A9:FF:F6:B1:1A (OUI DF-A9-FF)
        Count: 1
        #146: len 21 (0 Kb/s)
        Latency: 172 msec (78-172 msec ~168 msec)
> ACL Data RX: Handle 417 flags 0x02 dlen 21              #148 [hci1] 11.963153
      SMP: Pairing Random (0x04) len 16
        Random value: 3dc0c53cd53a19550000000000000000
< HCI Command: Host Number of Com.. (0x03|0x0035) plen 5  #149 [hci1] 11.970021
        Num handles: 1
        Handle: 417 Address: DF:A9:FF:F6:B1:1A (OUI DF-A9-FF)
        Count: 1
< ACL Data TX: Handle 417 flags 0x00 dlen 21              #150 [hci1] 11.970134
      SMP: Pairing Random (0x04) len 16
        Random value: c629a3a987d808e808655d558dfc1155
> HCI Event: Number of Completed Packets (0x13) plen 5    #151 [hci1] 12.137690
        Num handles: 1
        Handle: 417 Address: DF:A9:FF:F6:B1:1A (OUI DF-A9-FF)
        Count: 1
        #150: len 21 (1 Kb/s)
        Latency: 167 msec (78-172 msec ~168 msec)
> ACL Data RX: Handle 417 flags 0x02 dlen 21              #152 [hci1] 12.225505
      SMP: Pairing Confirm (0x03) len 16
        Confim value: 48d8dd5a445bf7aad8f0a1e3b7876aae
< HCI Command: Host Number of Com.. (0x03|0x0035) plen 5  #153 [hci1] 12.229475
        Num handles: 1
        Handle: 417 Address: DF:A9:FF:F6:B1:1A (OUI DF-A9-FF)
        Count: 1
< ACL Data TX: Handle 417 flags 0x00 dlen 21              #154 [hci1] 12.229667
      SMP: Pairing Confirm (0x03) len 16
        Confim value: e707b0feb40293b7f9f451a38bb4b5b1
> HCI Event: Number of Completed Packets (0x13) plen 5    #155 [hci1] 12.400272
        Num handles: 1
        Handle: 417 Address: DF:A9:FF:F6:B1:1A (OUI DF-A9-FF)
        Count: 1
        #154: len 21 (0 Kb/s)
        Latency: 170 msec (78-172 msec ~169 msec)
> ACL Data RX: Handle 417 flags 0x02 dlen 21              #156 [hci1] 12.400679
      SMP: Pairing Random (0x04) len 16
        Random value: 928de3df2fb930cb0000000000000000
< HCI Command: Host Number of Com.. (0x03|0x0035) plen 5  #157 [hci1] 12.410111
        Num handles: 1
        Handle: 417 Address: DF:A9:FF:F6:B1:1A (OUI DF-A9-FF)
        Count: 1
< ACL Data TX: Handle 417 flags 0x00 dlen 21              #158 [hci1] 12.410242
      SMP: Pairing Random (0x04) len 16
        Random value: 92f20f6ad8f13724432c7fd6001c45ff
> HCI Event: Number of Completed Packets (0x13) plen 5    #159 [hci1] 12.575068
        Num handles: 1
        Handle: 417 Address: DF:A9:FF:F6:B1:1A (OUI DF-A9-FF)
        Count: 1
        #158: len 21 (1 Kb/s)
        Latency: 164 msec (78-172 msec ~167 msec)
> ACL Data RX: Handle 417 flags 0x02 dlen 21              #160 [hci1] 12.662901
      SMP: Pairing Confirm (0x03) len 16
        Confim value: 99625255c595860a974e93cc9e8f6f45
< HCI Command: Host Number of Com.. (0x03|0x0035) plen 5  #161 [hci1] 12.669804
        Num handles: 1
        Handle: 417 Address: DF:A9:FF:F6:B1:1A (OUI DF-A9-FF)
        Count: 1
< ACL Data TX: Handle 417 flags 0x00 dlen 21              #162 [hci1] 12.670013
      SMP: Pairing Confirm (0x03) len 16
        Confim value: 9c69f452bcbe4eda85f820179dc552f8
> HCI Event: Number of Completed Packets (0x13) plen 5    #163 [hci1] 12.837736
        Num handles: 1
        Handle: 417 Address: DF:A9:FF:F6:B1:1A (OUI DF-A9-FF)
        Count: 1
        #162: len 21 (1 Kb/s)
        Latency: 167 msec (78-172 msec ~167 msec)
> ACL Data RX: Handle 417 flags 0x02 dlen 21              #164 [hci1] 12.838129
      SMP: Pairing Random (0x04) len 16
        Random value: e70c624d4e6aafe20000000000000000
< HCI Command: Host Number of Com.. (0x03|0x0035) plen 5  #165 [hci1] 12.849990
        Num handles: 1
        Handle: 417 Address: DF:A9:FF:F6:B1:1A (OUI DF-A9-FF)
        Count: 1
< ACL Data TX: Handle 417 flags 0x00 dlen 21              #166 [hci1] 12.850087
      SMP: Pairing Random (0x04) len 16
        Random value: 23ac32ebbb5e14c8a6b9622f296d277f
> HCI Event: Number of Completed Packets (0x13) plen 5    #167 [hci1] 13.012550
        Num handles: 1
        Handle: 417 Address: DF:A9:FF:F6:B1:1A (OUI DF-A9-FF)
        Count: 1
        #166: len 21 (1 Kb/s)
        Latency: 162 msec (78-172 msec ~164 msec)
> ACL Data RX: Handle 417 flags 0x02 dlen 21              #168 [hci1] 13.100496
      SMP: Pairing Confirm (0x03) len 16
        Confim value: 5d68405a31c723bc47e13e0fa4ac43de
< HCI Command: Host Number of Com.. (0x03|0x0035) plen 5  #169 [hci1] 13.109773
        Num handles: 1
        Handle: 417 Address: DF:A9:FF:F6:B1:1A (OUI DF-A9-FF)
        Count: 1
< ACL Data TX: Handle 417 flags 0x00 dlen 21              #170 [hci1] 13.109994
      SMP: Pairing Confirm (0x03) len 16
        Confim value: 966c9aa4bec6c596b2543777f62f608a
> HCI Event: Number of Completed Packets (0x13) plen 5    #171 [hci1] 13.275279
        Num handles: 1
        Handle: 417 Address: DF:A9:FF:F6:B1:1A (OUI DF-A9-FF)
        Count: 1
        #170: len 21 (1 Kb/s)
        Latency: 165 msec (78-172 msec ~165 msec)
> ACL Data RX: Handle 417 flags 0x02 dlen 21              #172 [hci1] 13.275513
      SMP: Pairing Random (0x04) len 16
        Random value: 834c91c69730ff640000000000000000
< HCI Command: Host Number of Com.. (0x03|0x0035) plen 5  #173 [hci1] 13.290053
        Num handles: 1
        Handle: 417 Address: DF:A9:FF:F6:B1:1A (OUI DF-A9-FF)
        Count: 1
< ACL Data TX: Handle 417 flags 0x00 dlen 21              #174 [hci1] 13.290159
      SMP: Pairing Random (0x04) len 16
        Random value: 297efe85e67448a15f56bd27e3a3cf1d
> HCI Event: Number of Completed Packets (0x13) plen 5    #175 [hci1] 13.449998
        Num handles: 1
        Handle: 417 Address: DF:A9:FF:F6:B1:1A (OUI DF-A9-FF)
        Count: 1
        #174: len 21 (1 Kb/s)
        Latency: 159 msec (78-172 msec ~162 msec)
> ACL Data RX: Handle 417 flags 0x02 dlen 21              #176 [hci1] 13.537904
      SMP: Pairing Confirm (0x03) len 16
        Confim value: 824f3669e3a6fb9c47d21efaa658a87d
< HCI Command: Host Number of Com.. (0x03|0x0035) plen 5  #177 [hci1] 13.549850
        Num handles: 1
        Handle: 417 Address: DF:A9:FF:F6:B1:1A (OUI DF-A9-FF)
        Count: 1
< ACL Data TX: Handle 417 flags 0x00 dlen 21              #178 [hci1] 13.550096
      SMP: Pairing Confirm (0x03) len 16
        Confim value: 8648257e51d07483568fccf1fa555877
> HCI Event: Number of Completed Packets (0x13) plen 5    #179 [hci1] 13.712778
        Num handles: 1
        Handle: 417 Address: DF:A9:FF:F6:B1:1A (OUI DF-A9-FF)
        Count: 1
        #178: len 21 (1 Kb/s)
        Latency: 162 msec (78-172 msec ~162 msec)
> ACL Data RX: Handle 417 flags 0x02 dlen 21              #180 [hci1] 13.713106
      SMP: Pairing Random (0x04) len 16
        Random value: d1dbe4973e94fbdb0000000000000000
< HCI Command: Host Number of Com.. (0x03|0x0035) plen 5  #181 [hci1] 13.730040
        Num handles: 1
        Handle: 417 Address: DF:A9:FF:F6:B1:1A (OUI DF-A9-FF)
        Count: 1
< ACL Data TX: Handle 417 flags 0x00 dlen 21              #182 [hci1] 13.730140
      SMP: Pairing Random (0x04) len 16
        Random value: 25a9493fd3ce4faf02be7293595bb7c6
> HCI Event: Number of Completed Packets (0x13) plen 5    #183 [hci1] 13.887459
        Num handles: 1
        Handle: 417 Address: DF:A9:FF:F6:B1:1A (OUI DF-A9-FF)
        Count: 1
        #182: len 21 (1 Kb/s)
        Latency: 157 msec (78-172 msec ~159 msec)
> ACL Data RX: Handle 417 flags 0x02 dlen 21              #184 [hci1] 13.975292
      SMP: Pairing Confirm (0x03) len 16
        Confim value: ac1f3b65ad7aa586627b7e4858418862
< HCI Command: Host Number of Com.. (0x03|0x0035) plen 5  #185 [hci1] 13.989419
        Num handles: 1
        Handle: 417 Address: DF:A9:FF:F6:B1:1A (OUI DF-A9-FF)
        Count: 1
< ACL Data TX: Handle 417 flags 0x00 dlen 21              #186 [hci1] 13.989522
      SMP: Pairing Confirm (0x03) len 16
        Confim value: 14192b09fe62ec2bd0434506380fcd1f
> HCI Event: Number of Completed Packets (0x13) plen 5    #187 [hci1] 14.150275
        Num handles: 1
        Handle: 417 Address: DF:A9:FF:F6:B1:1A (OUI DF-A9-FF)
        Count: 1
        #186: len 21 (1 Kb/s)
        Latency: 160 msec (78-172 msec ~160 msec)
> ACL Data RX: Handle 417 flags 0x02 dlen 21              #188 [hci1] 14.150513
      SMP: Pairing Random (0x04) len 16
        Random value: b13e25397909d3ae0000000000000000
< HCI Command: Host Number of Com.. (0x03|0x0035) plen 5  #189 [hci1] 14.170067
        Num handles: 1
        Handle: 417 Address: DF:A9:FF:F6:B1:1A (OUI DF-A9-FF)
        Count: 1
< ACL Data TX: Handle 417 flags 0x00 dlen 21              #190 [hci1] 14.170170
      SMP: Pairing Random (0x04) len 16
        Random value: 58f6b41f855a6f6c3560debd84e2affc
> HCI Event: Number of Completed Packets (0x13) plen 5    #191 [hci1] 14.325034
        Num handles: 1
        Handle: 417 Address: DF:A9:FF:F6:B1:1A (OUI DF-A9-FF)
        Count: 1
        #190: len 21 (1 Kb/s)
        Latency: 154 msec (78-172 msec ~157 msec)
> ACL Data RX: Handle 417 flags 0x02 dlen 21              #192 [hci1] 14.412873
      SMP: Pairing Confirm (0x03) len 16
        Confim value: f630c7594272695553795bd54885ac1c
< HCI Command: Host Number of Com.. (0x03|0x0035) plen 5  #193 [hci1] 14.429849
        Num handles: 1
        Handle: 417 Address: DF:A9:FF:F6:B1:1A (OUI DF-A9-FF)
        Count: 1
< ACL Data TX: Handle 417 flags 0x00 dlen 21              #194 [hci1] 14.430140
      SMP: Pairing Confirm (0x03) len 16
        Confim value: 95c79cdee7713c30077ad40e9c86a9cd
> HCI Event: Number of Completed Packets (0x13) plen 5    #195 [hci1] 14.587902
        Num handles: 1
        Handle: 417 Address: DF:A9:FF:F6:B1:1A (OUI DF-A9-FF)
        Count: 1
        #194: len 21 (1 Kb/s)
        Latency: 157 msec (78-172 msec ~157 msec)
> ACL Data RX: Handle 417 flags 0x02 dlen 21              #196 [hci1] 14.588073
      SMP: Pairing Random (0x04) len 16
        Random value: f8fa012e97b25f360000000000000000
< HCI Command: Host Number of Com.. (0x03|0x0035) plen 5  #197 [hci1] 14.589982
        Num handles: 1
        Handle: 417 Address: DF:A9:FF:F6:B1:1A (OUI DF-A9-FF)
        Count: 1
< ACL Data TX: Handle 417 flags 0x00 dlen 21              #198 [hci1] 14.590098
      SMP: Pairing Random (0x04) len 16
        Random value: b67e7216d5bf664139eda2b542549666
> HCI Event: Number of Completed Packets (0x13) plen 5    #199 [hci1] 14.762431
        Num handles: 1
        Handle: 417 Address: DF:A9:FF:F6:B1:1A (OUI DF-A9-FF)
        Count: 1
        #198: len 21 (0 Kb/s)
        Latency: 172 msec (78-172 msec ~165 msec)
> ACL Data RX: Handle 417 flags 0x02 dlen 21              #200 [hci1] 14.850302
      SMP: Pairing Confirm (0x03) len 16
        Confim value: 2c4783e2d55b133989852569e6928372
< HCI Command: Host Number of Com.. (0x03|0x0035) plen 5  #201 [hci1] 14.869850
        Num handles: 1
        Handle: 417 Address: DF:A9:FF:F6:B1:1A (OUI DF-A9-FF)
        Count: 1
< ACL Data TX: Handle 417 flags 0x00 dlen 21              #202 [hci1] 14.870045
      SMP: Pairing Confirm (0x03) len 16
        Confim value: ecfd0fd690e47f0b6f51c4e547e90265
> HCI Event: Number of Completed Packets (0x13) plen 5    #203 [hci1] 15.025128
        Num handles: 1
        Handle: 417 Address: DF:A9:FF:F6:B1:1A (OUI DF-A9-FF)
        Count: 1
        #202: len 21 (1 Kb/s)
        Latency: 155 msec (78-172 msec ~160 msec)
> ACL Data RX: Handle 417 flags 0x02 dlen 21              #204 [hci1] 15.025562
      SMP: Pairing Random (0x04) len 16
        Random value: 0f6fa8f5f08ec9a80000000000000000
< HCI Command: Host Number of Com.. (0x03|0x0035) plen 5  #205 [hci1] 15.030194
        Num handles: 1
        Handle: 417 Address: DF:A9:FF:F6:B1:1A (OUI DF-A9-FF)
        Count: 1
< ACL Data TX: Handle 417 flags 0x00 dlen 21              #206 [hci1] 15.030277
      SMP: Pairing Random (0x04) len 16
        Random value: ed17f76500c95219dd01e09d1e63f87b
> HCI Event: Number of Completed Packets (0x13) plen 5    #207 [hci1] 15.199979
        Num handles: 1
        Handle: 417 Address: DF:A9:FF:F6:B1:1A (OUI DF-A9-FF)
        Count: 1
        #206: len 21 (0 Kb/s)
        Latency: 169 msec (78-172 msec ~164 msec)
> ACL Data RX: Handle 417 flags 0x02 dlen 21              #208 [hci1] 15.287840
      SMP: Pairing Confirm (0x03) len 16
        Confim value: e7d7364d2f66fd757067e9ab4d4e0826
< HCI Command: Host Number of Com.. (0x03|0x0035) plen 5  #209 [hci1] 15.289562
        Num handles: 1
        Handle: 417 Address: DF:A9:FF:F6:B1:1A (OUI DF-A9-FF)
        Count: 1
< ACL Data TX: Handle 417 flags 0x00 dlen 21              #210 [hci1] 15.289728
      SMP: Pairing Confirm (0x03) len 16
        Confim value: 071658e31819f6afae972ee12b076888
> HCI Event: Number of Completed Packets (0x13) plen 5    #211 [hci1] 15.462759
        Num handles: 1
        Handle: 417 Address: DF:A9:FF:F6:B1:1A (OUI DF-A9-FF)
        Count: 1
        #210: len 21 (0 Kb/s)
        Latency: 173 msec (78-173 msec ~168 msec)
> ACL Data RX: Handle 417 flags 0x02 dlen 21              #212 [hci1] 15.462961
      SMP: Pairing Random (0x04) len 16
        Random value: 31bd0b21b4c8672a0000000000000000
< HCI Command: Host Number of Com.. (0x03|0x0035) plen 5  #213 [hci1] 15.469967
        Num handles: 1
        Handle: 417 Address: DF:A9:FF:F6:B1:1A (OUI DF-A9-FF)
        Count: 1
< ACL Data TX: Handle 417 flags 0x00 dlen 21              #214 [hci1] 15.470074
      SMP: Pairing Random (0x04) len 16
        Random value: 81d35d47e1f6006d79c974bd9d9e1ee3
> HCI Event: Number of Completed Packets (0x13) plen 5    #215 [hci1] 15.637577
        Num handles: 1
        Handle: 417 Address: DF:A9:FF:F6:B1:1A (OUI DF-A9-FF)
        Count: 1
        #214: len 21 (1 Kb/s)
        Latency: 167 msec (78-173 msec ~168 msec)
> ACL Data RX: Handle 417 flags 0x02 dlen 21              #216 [hci1] 15.725342
      SMP: Pairing Confirm (0x03) len 16
        Confim value: 24517b765f0f787607b988529917dc1f
< HCI Command: Host Number of Com.. (0x03|0x0035) plen 5  #217 [hci1] 15.729825
        Num handles: 1
        Handle: 417 Address: DF:A9:FF:F6:B1:1A (OUI DF-A9-FF)
        Count: 1
< ACL Data TX: Handle 417 flags 0x00 dlen 21              #218 [hci1] 15.730052
      SMP: Pairing Confirm (0x03) len 16
        Confim value: 7940da4dea67c8d27f3dd2c1c613ffa9
> HCI Event: Number of Completed Packets (0x13) plen 5    #219 [hci1] 15.900147
        Num handles: 1
        Handle: 417 Address: DF:A9:FF:F6:B1:1A (OUI DF-A9-FF)
        Count: 1
        #218: len 21 (0 Kb/s)
        Latency: 170 msec (78-173 msec ~169 msec)
> ACL Data RX: Handle 417 flags 0x02 dlen 21              #220 [hci1] 15.900559
      SMP: Pairing Random (0x04) len 16
        Random value: a5caa23699b9e3460000000000000000
< HCI Command: Host Number of Com.. (0x03|0x0035) plen 5  #221 [hci1] 15.910102
        Num handles: 1
        Handle: 417 Address: DF:A9:FF:F6:B1:1A (OUI DF-A9-FF)
        Count: 1
< ACL Data TX: Handle 417 flags 0x00 dlen 21              #222 [hci1] 15.910228
      SMP: Pairing Random (0x04) len 16
        Random value: e7f7e0c2476823e41736a7e381bafb7c
> HCI Event: Number of Completed Packets (0x13) plen 5    #223 [hci1] 16.074981
        Num handles: 1
        Handle: 417 Address: DF:A9:FF:F6:B1:1A (OUI DF-A9-FF)
        Count: 1
        #222: len 21 (1 Kb/s)
        Latency: 164 msec (78-173 msec ~166 msec)
> ACL Data RX: Handle 417 flags 0x02 dlen 21              #224 [hci1] 16.162792
      SMP: Pairing Confirm (0x03) len 16
        Confim value: 007b718013c9b9a248e541d00b9470a6
< HCI Command: Host Number of Com.. (0x03|0x0035) plen 5  #225 [hci1] 16.169503
        Num handles: 1
        Handle: 417 Address: DF:A9:FF:F6:B1:1A (OUI DF-A9-FF)
        Count: 1
< ACL Data TX: Handle 417 flags 0x00 dlen 21              #226 [hci1] 16.169647
      SMP: Pairing Confirm (0x03) len 16
        Confim value: 92c6d1cda80e8a8211d14458f52e3fdf
> HCI Event: Number of Completed Packets (0x13) plen 5    #227 [hci1] 16.337667
        Num handles: 1
        Handle: 417 Address: DF:A9:FF:F6:B1:1A (OUI DF-A9-FF)
        Count: 1
        #226: len 21 (1 Kb/s)
        Latency: 168 msec (78-173 msec ~167 msec)
> ACL Data RX: Handle 417 flags 0x02 dlen 21              #228 [hci1] 16.337961
      SMP: Pairing Random (0x04) len 16
        Random value: 441d8d4a6d8e3b140000000000000000
< HCI Command: Host Number of Com.. (0x03|0x0035) plen 5  #229 [hci1] 16.350134
        Num handles: 1
        Handle: 417 Address: DF:A9:FF:F6:B1:1A (OUI DF-A9-FF)
        Count: 1
