Bluetooth monitor ver 5.84
btmon[1553032]: = Note: Linux version 6.8.0-83-generic (x86_64)                                                          0.536252
btmon[1553032]: = Note: Bluetooth subsystem version 2.22                                                                 0.536254
= New Index: 00:00:00:00:00:00 (Primary,UART,hci0)                                                                       0.536255
= Open Index: 00:00:00:00:00:00                                                                                          0.543522
= Index Info: 00:00:00:00:00:00 (Nordic Semiconductor ASA)                                                               0.543526
zephyr.exe[1553034]: @ USER Open: main (privileged) version 2.22                                                {0x0001} 0.543529
zephyr.exe[1553034]: < HCI Command: Reset (0x03|0x0003) plen 0                                                        #1 0.543821
> HCI Event: Command Complete (0x0e) plen 4                                                                           #2 0.544521
      Reset (0x03|0x0003) ncmd 1
        Status: Success (0x00)
zephyr.exe[1553034]: < HCI Command: Read Local Supported Features (0x04|0x0003) plen 0                                #3 0.563432
> HCI Event: Command Complete (0x0e) plen 12                                                                          #4 0.564088
      Read Local Supported Features (0x04|0x0003) ncmd 1
        Status: Success (0x00)
        Features: 0x00 0x00 0x00 0x00 0x60 0x00 0x00 0x00
          BR/EDR Not Supported
          LE Supported (Controller)
zephyr.exe[1553034]: < HCI Command: Read Local Version Information (0x04|0x0001) plen 0                               #5 0.583437
> HCI Event: Command Complete (0x0e) plen 12                                                                          #6 0.584182
      Read Local Version Information (0x04|0x0001) ncmd 1
        Status: Success (0x00)
        HCI version: Reserved (0x0e) - Revision 12520 (0x30e8)
        LMP version: Reserved (0x0e) - Subversion 12520 (0x30e8)
        Manufacturer: Nordic Semiconductor ASA (89)
zephyr.exe[1553034]: < HCI Command: Read Local Supported Commands (0x04|0x0002) plen 0                                #7 0.603437
> HCI Event: Command Complete (0x0e) plen 68                                                                          #8 0.604558
      Read Local Supported Commands (0x04|0x0002) ncmd 1
        Status: Success (0x00)
        Commands: 119 entries
          Disconnect (Octet 0 - Bit 5)
          Read Remote Version Information (Octet 2 - Bit 7)
          Set Event Mask (Octet 5 - Bit 6)
          Reset (Octet 5 - Bit 7)
          Read Connection Accept Timeout (Octet 7 - Bit 2)
          Write Connection Accept Timeout (Octet 7 - Bit 3)
          Read Transmit Power Level (Octet 10 - Bit 2)
          Set Controller To Host Flow Control (Octet 10 - Bit 5)
          Host Buffer Size (Octet 10 - Bit 6)
          Host Number of Completed Packets (Octet 10 - Bit 7)
          Read Local Version Information (Octet 14 - Bit 3)
          Read Local Supported Features (Octet 14 - Bit 5)
          Read BD ADDR (Octet 15 - Bit 1)
          Read RSSI (Octet 15 - Bit 5)
          Set Event Mask Page 2 (Octet 22 - Bit 2)
          LE Set Event Mask (Octet 25 - Bit 0)
          LE Read Buffer Size (Octet 25 - Bit 1)
          LE Read Local Supported Features (Octet 25 - Bit 2)
          LE Set Random Address (Octet 25 - Bit 4)
          LE Set Advertising Parameters (Octet 25 - Bit 5)
          LE Read Advertising Channel TX Power (Octet 25 - Bit 6)
          LE Set Advertising Data (Octet 25 - Bit 7)
          LE Set Scan Response Data (Octet 26 - Bit 0)
          LE Set Advertise Enable (Octet 26 - Bit 1)
          LE Set Scan Parameters (Octet 26 - Bit 2)
          LE Set Scan Enable (Octet 26 - Bit 3)
          LE Create Connection (Octet 26 - Bit 4)
          LE Create Connection Cancel (Octet 26 - Bit 5)
          LE Read Accept List Size (Octet 26 - Bit 6)
          LE Clear Accept List (Octet 26 - Bit 7)
          LE Add Device To Accept List (Octet 27 - Bit 0)
          LE Remove Device From Accept List (Octet 27 - Bit 1)
          LE Connection Update (Octet 27 - Bit 2)
          LE Set Host Channel Classification (Octet 27 - Bit 3)
          LE Read Channel Map (Octet 27 - Bit 4)
          LE Read Remote Used Features (Octet 27 - Bit 5)
          LE Encrypt (Octet 27 - Bit 6)
          LE Rand (Octet 27 - Bit 7)
          LE Start Encryption (Octet 28 - Bit 0)
          LE Long Term Key Request Reply (Octet 28 - Bit 1)
          LE Long Term Key Request Neg Reply (Octet 28 - Bit 2)
          LE Read Supported States (Octet 28 - Bit 3)
          LE Receiver Test (Octet 28 - Bit 4)
          LE Transmitter Test (Octet 28 - Bit 5)
          LE Test End (Octet 28 - Bit 6)
          Read Authenticated Payload Timeout (Octet 32 - Bit 4)
          Write Authenticated Payload Timeout (Octet 32 - Bit 5)
          LE Set Data Length (Octet 33 - Bit 6)
          LE Read Suggested Default Data Length (Octet 33 - Bit 7)
          LE Write Suggested Default Data Length (Octet 34 - Bit 0)
          LE Add Device To Resolving List (Octet 34 - Bit 3)
          LE Remove Device From Resolving List (Octet 34 - Bit 4)
          LE Clear Resolving List (Octet 34 - Bit 5)
          LE Read Resolving List Size (Octet 34 - Bit 6)
          LE Set Address Resolution Enable (Octet 35 - Bit 1)
          LE Set Resolvable Private Address Timeout (Octet 35 - Bit 2)
          LE Read Maximum Data Length (Octet 35 - Bit 3)
          LE Read PHY (Octet 35 - Bit 4)
          LE Set Default PHY (Octet 35 - Bit 5)
          LE Set PHY (Octet 35 - Bit 6)
          LE Enhanced Receiver Test (Octet 35 - Bit 7)
          LE Enhanced Transmitter Test (Octet 36 - Bit 0)
          LE Set Advertising Set Random Address (Octet 36 - Bit 1)
          LE Set Extended Advertising Parameters (Octet 36 - Bit 2)
          LE Set Extended Advertising Data (Octet 36 - Bit 3)
          LE Set Extended Scan Response Data (Octet 36 - Bit 4)
          LE Set Extended Advertising Enable (Octet 36 - Bit 5)
          LE Read Maximum Advertising Data Length (Octet 36 - Bit 6)
          LE Read Number of Supported Advertising Sets (Octet 36 - Bit 7)
          LE Remove Advertising Set (Octet 37 - Bit 0)
          LE Clear Advertising Sets (Octet 37 - Bit 1)
          LE Set Periodic Advertising Parameters (Octet 37 - Bit 2)
          LE Set Periodic Advertising Data (Octet 37 - Bit 3)
          LE Set Periodic Advertising Enable (Octet 37 - Bit 4)
          LE Set Extended Scan Parameters (Octet 37 - Bit 5)
          LE Set Extended Scan Enable (Octet 37 - Bit 6)
          LE Extended Create Connection (Octet 37 - Bit 7)
          LE Periodic Advertising Create Sync (Octet 38 - Bit 0)
          LE Periodic Advertising Create Sync Cancel (Octet 38 - Bit 1)
          LE Periodic Advertising Terminate Sync (Octet 38 - Bit 2)
          LE Add Device To Periodic Advertiser List (Octet 38 - Bit 3)
          LE Remove Device From Periodic Advertiser List (Octet 38 - Bit 4)
          LE Clear Periodic Advertiser List (Octet 38 - Bit 5)
          LE Read Periodic Advertiser List Size (Octet 38 - Bit 6)
          LE Read Transmit Power (Octet 38 - Bit 7)
          LE Read RF Path Compensation (Octet 39 - Bit 0)
          LE Write RF Path Compensation (Octet 39 - Bit 1)
          LE Set Privacy Mode (Octet 39 - Bit 2)
          LE Periodic Advertising Receive Enable (Octet 40 - Bit 5)
          LE Periodic Advertising Sync Transfer (Octet 40 - Bit 6)
          LE Periodic Advertising Set Info Transfer (Octet 40 - Bit 7)
          LE Periodic Advertising Sync Transfer Parameters (Octet 41 - Bit 0)
          LE Set Default Periodic Advertisng Sync Transfer Parameters (Octet 41 - Bit 1)
          LE Read Buffer v2 (Octet 41 - Bit 5)
          LE Read ISO TX Sync (Octet 41 - Bit 6)
          LE Set Connected Isochronous Group Parameters (Octet 41 - Bit 7)
          LE Set Connected Isochronous Group Parameters Test (Octet 42 - Bit 0)
          LE Create Connected Isochronous Stream (Octet 42 - Bit 1)
          LE Remove Connected Isochronous Group (Octet 42 - Bit 2)
          LE Accept Connected Isochronous Stream Request (Octet 42 - Bit 3)
          LE Reject Connected Isochronous Stream Request (Octet 42 - Bit 4)
          LE Create Broadcast Isochronous Group (Octet 42 - Bit 5)
          LE Create Broadcast Isochronous Group Test (Octet 42 - Bit 6)
          LE Terminate Broadcast Isochronous Group (Octet 42 - Bit 7)
          LE Broadcast Isochronous Group Create Sync (Octet 43 - Bit 0)
          LE Broadcast Isochronous Group Terminate Sync (Octet 43 - Bit 1)
          LE Request Peer SCA (Octet 43 - Bit 2)
          LE Setup Isochronous Data Path (Octet 43 - Bit 3)
          LE Remove Isochronous Data Path (Octet 43 - Bit 4)
          LE Isochronous Transmit Test (Octet 43 - Bit 5)
          LE Isochronous Receive Test (Octet 43 - Bit 6)
          LE Isochronous Read Test Counters (Octet 43 - Bit 7)
          LE Isochronous Read Test Counters (Octet 44 - Bit 0)
          LE Set Host Feature (Octet 44 - Bit 1)
          LE Read ISO link quality (Octet 44 - Bit 2)
          Octet 45 - Bit 6 
          Octet 46 - Bit 0 
          Octet 46 - Bit 1 
          Octet 46 - Bit 2 
zephyr.exe[1553034]: < HCI Command: Host Buffer Size (0x03|0x0033) plen 7                                             #9 0.623411
        ACL MTU: 255  ACL max packet: 16
        SCO MTU: 0    SCO max packet: 0
> HCI Event: Command Complete (0x0e) plen 4                                                                          #10 0.624293
      Host Buffer Size (0x03|0x0033) ncmd 1
        Status: Success (0x00)
zephyr.exe[1553034]: < HCI Command: Set Controller To Host Flow Control (0x03|0x0031) plen 1                         #11 0.643429
        Flow control: ACL Data Packets (0x01)
> HCI Event: Command Complete (0x0e) plen 4                                                                          #12 0.644032
      Set Controller To Host Flow Control (0x03|0x0031) ncmd 1
        Status: Success (0x00)
zephyr.exe[1553034]: < HCI Command: LE Read Local Supported Features (0x08|0x0003) plen 0                            #13 0.663437
> HCI Event: Command Complete (0x0e) plen 12                                                                         #14 0.664244
      LE Read Local Supported Features (0x08|0x0003) ncmd 1
        Status: Success (0x00)
        Features: 0xfd 0x79 0x00 0xf7 0x30 0x01 0x00 0x00
          LE Encryption
          Extended Reject Indication
          Peripheral-initiated Features Exchange
          LE Ping
          LE Data Packet Length Extension
          LL Privacy
          Extended Scanner Filter Policies
          LE 2M PHY
          LE Coded PHY
          LE Extended Advertising
          LE Periodic Advertising
          Channel Selection Algorithm #2
          Periodic Advertising Sync Transfer - Sender
          Periodic Advertising Sync Transfer - Recipient
          Sleep Clock Accuracy Updates
          Connected Isochronous Stream - Central
          Connected Isochronous Stream - Peripheral
          Isochronous Broadcaster
          Synchronized Receiver
          Periodic Advertising ADI support
          Connection Subrating
          Unknown features (0x0000010000000000)
zephyr.exe[1553034]: < HCI Command: LE Set Host Feature (0x08|0x0074) plen 2                                         #15 0.683471
        Bit Number: 32
          Connected Isochronous Stream (Host Support)
        Bit Value: 1
> HCI Event: Command Complete (0x0e) plen 4                                                                          #16 0.683967
      LE Set Host Feature (0x08|0x0074) ncmd 1
        Status: Success (0x00)
zephyr.exe[1553034]: < HCI Command: LE Read Buffer v2 (0x08|0x0060) plen 0                                           #17 0.703437
> HCI Event: Command Complete (0x0e) plen 10                                                                         #18 0.704145
      LE Read Buffer v2 (0x08|0x0060) ncmd 1
        Status: Success (0x00)
        ACL MTU: 27
        ACL max packet: 3
        ISO MTU: 318
        ISO max packet: 3
zephyr.exe[1553034]: < HCI Command: LE Read Maximum Advertising Data Length (0x08|0x003a) plen 0                     #19 0.723458
> HCI Event: Command Complete (0x0e) plen 6                                                                          #20 0.724303
      LE Read Maximum Advertising Data Length (0x08|0x003a) ncmd 1
        Status: Success (0x00)
        Max length: 1650
zephyr.exe[1553034]: < HCI Command: LE Read Supported States (0x08|0x001c) plen 0                                    #21 0.743437
> HCI Event: Command Complete (0x0e) plen 12                                                                         #22 0.744120
      LE Read Supported States (0x08|0x001c) ncmd 1
        Status: Success (0x00)
        States: 0x000003ff3e0306ff
          Non-connectable Advertising State
          Scannable Advertising State
          Connectable Advertising State
          High Duty Cycle Directed Advertising State
          Passive Scanning State
          Active Scanning State
          Initiating State
            and Connection State (Central Role)
          Connection State (Peripheral Role)
          Scannable Advertising State
            and Passive Scanning State
          Connectable Advertising State
            and Passive Scanning State
          Non-connectable Advertising State
            and Initiating State
          Scannable Advertising State
            and Initiating State
          Active Scanning State
            and Connection State (Central Role)
          Passive Scanning State
            and Connection State (Peripheral Role)
          Active Scanning State
            and Connection State (Peripheral Role)
          Initiating State
            and Connection State (Central Role)
            and Central Role & Central Role
          Low Duty Cycle Directed Advertising State
          Connectable Advertising State
            and Initiating State
            and Central Role & Peripheral Role
          High Duty Cycle Directed Advertising State
            and Initiating State
            and Central Role & Peripheral Role
          Low Duty Cycle Directed Advertising State
            and Initiating State
            and Central Role & Peripheral Role
          Connectable Advertising State
            and Connection State (Central Role)
            and Central Role & Peripheral Role
          High Duty Cycle Directed Advertising State
            and Connection State (Central Role)
            and Central Role & Peripheral Role
          Low Duty Cycle Directed Advertising State
            and Connection State (Central Role)
            and Central Role & Peripheral Role
          Connectable Advertising State
            and Connection State (Peripheral Role)
            and Central Role & Peripheral Role
          High Duty Cycle Directed Advertising State
            and Connection State (Peripheral Role)
            and Peripheral Role & Peripheral Role
          Low Duty Cycle Directed Advertising State
            and Connection State (Peripheral Role)
            and Peripheral Role & Peripheral Role
          Initiating State
            and Connection State (Peripheral Role)
            and Central Role & Peripheral Role
zephyr.exe[1553034]: < HCI Command: LE Read Maximum Data Length (0x08|0x002f) plen 0                                 #23 0.763404
> HCI Event: Command Complete (0x0e) plen 12                                                                         #24 0.764229
      LE Read Maximum Data Length (0x08|0x002f) ncmd 1
        Status: Success (0x00)
        Max TX octets: 251
        Max TX time: 2704
        Max RX octets: 251
        Max RX time: 2704
zephyr.exe[1553034]: < HCI Command: LE Write Suggested Default Data Length (0x08|0x0024) plen 4                      #25 0.783436
        TX octets: 251
        TX time: 2704
> HCI Event: Command Complete (0x0e) plen 4                                                                          #26 0.784510
      LE Write Suggested Default Data Length (0x08|0x0024) ncmd 1
        Status: Success (0x00)
zephyr.exe[1553034]: < HCI Command: LE Read Resolving List Size (0x08|0x002a) plen 0                                 #27 0.803435
> HCI Event: Command Complete (0x0e) plen 5                                                                          #28 0.804043
      LE Read Resolving List Size (0x08|0x002a) ncmd 1
        Status: Success (0x00)
        Size: 8
zephyr.exe[1553034]: < HCI Command: LE Set Event Mask (0x08|0x0001) plen 8                                           #29 0.823439
        Mask: 0x000002023f87fa5e
          LE Advertising Report
          LE Connection Update Complete
          LE Read Remote Used Features Complete
          LE Long Term Key Request
          LE Data Length Change
          LE Enhanced Connection Complete
          LE PHY Update Complete
          LE Extended Advertising Report
          LE Periodic Advertising Sync Established
          LE Periodic Advertising Report
          LE Periodic Advertising Sync Lost
          LE Extended Scan Timeout
          LE Extended Advertising Set Terminated
          LE Scan Request Received
          LE Periodic Advertising Sync Transfer Rvc
          LE CIS Established
          LE CIS Request
          LE Create BIG Complete
          LE Terminate BIG Complete
          LE BIG Sync Established Complete
          LE BIG Sync Lost
          LE BIG Info Advertising Report
          Unknown mask (0x0000020000000000)
> HCI Event: Command Complete (0x0e) plen 4                                                                          #30 0.824243
      LE Set Event Mask (0x08|0x0001) ncmd 1
        Status: Success (0x00)
zephyr.exe[1553034]: < HCI Command: Set Event Mask (0x03|0x0001) plen 8                                              #31 0.843445
        Mask: 0x2000800002008890
          Disconnection Complete
          Encryption Change
          Read Remote Version Information Complete
          Hardware Error
          Data Buffer Overflow
          Encryption Key Refresh Complete
          LE Meta
> HCI Event: Command Complete (0x0e) plen 4                                                                          #32 0.844329
      Set Event Mask (0x03|0x0001) ncmd 1
        Status: Success (0x00)
zephyr.exe[1553034]: < HCI Command: Read BD ADDR (0x04|0x0009) plen 0                                                #33 0.863436
> HCI Event: Command Complete (0x0e) plen 10                                                                         #34 0.864198
      Read BD ADDR (0x04|0x0009) ncmd 1
        Status: Success (0x00)
        Address: 00:00:00:00:00:00 (OUI 00-00-00)
zephyr.exe[1553034]: < HCI Command: LE Set Random Address (0x08|0x0005) plen 6                                       #35 0.883470
        Address: D5:B6:CC:31:DB:3B (Static)
> HCI Event: Command Complete (0x0e) plen 4                                                                          #36 0.884127
      LE Set Random Address (0x08|0x0005) ncmd 1
        Status: Success (0x00)
zephyr.exe[1553034]: < HCI Command: LE Set Extended Advertising Parameters (0x08|0x0036) plen 25                     #37 3.333479
        Handle: 0x00
        Properties: 0x0013
          Connectable
          Scannable
          Use legacy advertising PDUs: ADV_IND
        Min advertising interval: 100.000 msec (0x00a0)
        Max advertising interval: 150.000 msec (0x00f0)
        Channel map: 37, 38, 39 (0x07)
        Own address type: Random (0x01)
        Peer address type: Public (0x00)
        Peer address: 00:00:00:00:00:00 (OUI 00-00-00)
        Filter policy: Allow Scan Request from Any, Allow Connect Request from Any (0x00)
        TX power: Host has no preference (0x7f)
        Primary PHY: LE 1M (0x01)
        Secondary max skip: 0x00
        Secondary PHY: LE 1M (0x01)
        SID: 0x00
        Scan request notifications: Disabled (0x00)
> HCI Event: Command Complete (0x0e) plen 5                                                                          #38 3.334287
      LE Set Extended Advertising Parameters (0x08|0x0036) ncmd 1
        Status: Success (0x00)
        TX power (selected): 0 dbm (0x00)
zephyr.exe[1553034]: < HCI Command: LE Set Advertising Set Random Address (0x08|0x0035) plen 7                       #39 3.343474
        Advertising handle: 0x00
        Advertising random address: D5:B6:CC:31:DB:3B (Static)
> HCI Event: Command Complete (0x0e) plen 4                                                                          #40 3.344272
      LE Set Advertising Set Random Address (0x08|0x0035) ncmd 1
        Status: Success (0x00)
zephyr.exe[1553034]: < HCI Command: LE Set Extended Advertising Data (0x08|0x0037) plen 22                           #41 3.363473
        Handle: 0x00
        Operation: Complete extended advertising data (0x03)
        Fragment preference: Minimize fragmentation (0x01)
        Data length: 0x12
        Flags: 0x06
          LE General Discoverable Mode
          BR/EDR Not Supported
        Name (complete): Tester_F6B11A
> HCI Event: Command Complete (0x0e) plen 4                                                                          #42 3.364350
      LE Set Extended Advertising Data (0x08|0x0037) ncmd 1
        Status: Success (0x00)
zephyr.exe[1553034]: < HCI Command: LE Set Extended Scan Response Data (0x08|0x0038) plen 4                          #43 3.383473
        Handle: 0x00
        Operation: Complete scan response data (0x03)
        Fragment preference: Minimize fragmentation (0x01)
        Data length: 0x00
> HCI Event: Command Complete (0x0e) plen 4                                                                          #44 3.384033
      LE Set Extended Scan Response Data (0x08|0x0038) ncmd 1
        Status: Success (0x00)
zephyr.exe[1553034]: < HCI Command: LE Set Extended Advertising Enable (0x08|0x0039) plen 6                          #45 3.403467
        Extended advertising: Enabled (0x01)
        Number of sets: 1 (0x01)
        Entry 0
          Handle: 0x00
          Duration: 0 ms (0x00)
          Max ext adv events: 0
> HCI Event: Command Complete (0x0e) plen 4                                                                          #46 3.404530
      LE Set Extended Advertising Enable (0x08|0x0039) ncmd 1
        Status: Success (0x00)
> HCI Event: LE Meta Event (0x3e) plen 31                                                                            #47 3.520031
      LE Enhanced Connection Complete (0x0a)
        Status: Success (0x00)
        Handle: 1119
        Role: Peripheral (0x01)
        Peer address type: Public (0x00)
        Peer address: DF:A9:FF:F6:B1:1A (OUI DF-A9-FF)
        Local resolvable private address: 00:00:00:00:00:00 (Non-Resolvable)
        Peer resolvable private address: 00:00:00:00:00:00 (Non-Resolvable)
        Connection interval: 87.50 msec (0x0046)
        Connection latency: 0 (0x0000)
        Supervision timeout: 25120 msec (0x09d0)
        Central clock accuracy: 0x01
> HCI Event: LE Meta Event (0x3e) plen 6                                                                             #48 3.520104
      LE Advertising Set Terminated (0x12)
        Status: Success (0x00)
        Handle: 0
        Connection handle: 1119
        Number of completed extended advertising events: 0
zephyr.exe[1553034]: < HCI Command: LE Read Remote Used Features (0x08|0x0016) plen 2                                #49 3.523551
        Handle: 1119 Address: DF:A9:FF:F6:B1:1A (OUI DF-A9-FF)
> HCI Event: Command Status (0x0f) plen 4                                                                            #50 3.524144
      LE Read Remote Used Features (0x08|0x0016) ncmd 1
        Status: Success (0x00)
zephyr.exe[1553034]: < ACL Data TX: Handle 1119 [1/3] flags 0x00 dlen 7                                              #51 3.543441
      ATT: Exchange MTU Request (0x02) len 2
        Client RX MTU: 251
> HCI Event: Number of Completed Packets (0x13) plen 5                                                               #52 3.696026
        Num handles: 1
        Handle: 1119 Address: DF:A9:FF:F6:B1:1A (OUI DF-A9-FF)
        Count: 1
        Buffers: 0/3
        #51: len 7 (0 Kb/s)
        Latency: 152 msec (152-152 msec ~152 msec)
> HCI Event: LE Meta Event (0x3e) plen 12                                                                            #53 3.784027
      LE Read Remote Used Features (0x04)
        Status: Success (0x00)
        Handle: 1119 Address: DF:A9:FF:F6:B1:1A (OUI DF-A9-FF)
        Features: 0x2d 0x49 0x00 0xf7 0x67 0xd8 0x00 0x00
          LE Encryption
          Extended Reject Indication
          Peripheral-initiated Features Exchange
          LE Data Packet Length Extension
          LE 2M PHY
          LE Coded PHY
          Channel Selection Algorithm #2
          Periodic Advertising Sync Transfer - Sender
          Periodic Advertising Sync Transfer - Recipient
          Sleep Clock Accuracy Updates
          Connected Isochronous Stream - Central
          Connected Isochronous Stream - Peripheral
          Isochronous Broadcaster
          Synchronized Receiver
          Connected Isochronous Stream (Host Support)
          LE Power Control Request
          LE Power Control Request
          Connection Subrating
          Connection Subrating (Host Support)
          Unknown features (0x0000d80000000000)
> ACL Data RX: Handle 1119 flags 0x02 dlen 7                                                                         #54 4.221175
      ATT: Exchange MTU Request (0x02) len 2
        Client RX MTU: 64
> ACL Data RX: Handle 1119 flags 0x02 dlen 7                                                                         #55 4.221729
      ATT: Exchange MTU Response (0x03) len 2
        Server RX MTU: 64
zephyr.exe[1553034]: < HCI Command: Host Number of Completed Packets (0x03|0x0035) plen 5                            #56 4.223541
        Num handles: 1
        Handle: 1119 Address: DF:A9:FF:F6:B1:1A (OUI DF-A9-FF)
        Count: 1
zephyr.exe[1553034]: < ACL Data TX: Handle 1119 [1/3] flags 0x00 dlen 7                                              #57 4.223568
      ATT: Exchange MTU Response (0x03) len 2
        Server RX MTU: 251
zephyr.exe[1553034]: < HCI Command: Host Number of Completed Packets (0x03|0x0035) plen 5                            #58 4.223645
        Num handles: 1
        Handle: 1119 Address: DF:A9:FF:F6:B1:1A (OUI DF-A9-FF)
        Count: 1
> HCI Event: Number of Completed Packets (0x13) plen 5                                                               #59 4.396053
        Num handles: 1
        Handle: 1119 Address: DF:A9:FF:F6:B1:1A (OUI DF-A9-FF)
        Count: 1
        Buffers: 0/3
        #57: len 7 (0 Kb/s)
        Latency: 172 msec (152-172 msec ~162 msec)
> ACL Data RX: Handle 1119 flags 0x02 dlen 11                                                                        #60 6.321291
      SMP: Pairing Request (0x01) len 6
        IO capability: KeyboardDisplay (0x04)
        OOB data: Authentication data not present (0x00)
        Authentication requirement: Bonding, No MITM, SC, No Keypresses (0x09)
        Max encryption key size: 16
        Initiator key distribution: EncKey IdKey (0x03)
        Responder key distribution: EncKey IdKey Sign (0x07)
zephyr.exe[1553034]: < HCI Command: Host Number of Completed Packets (0x03|0x0035) plen 5                            #61 6.323519
        Num handles: 1
        Handle: 1119 Address: DF:A9:FF:F6:B1:1A (OUI DF-A9-FF)
        Count: 1
zephyr.exe[1553034]: < ACL Data TX: Handle 1119 [1/3] flags 0x00 dlen 11                                             #62 6.323581
      SMP: Pairing Response (0x02) len 6
        IO capability: NoInputNoOutput (0x03)
        OOB data: Authentication data not present (0x00)
        Authentication requirement: Bonding, No MITM, SC, No Keypresses (0x09)
        Max encryption key size: 16
        Initiator key distribution: IdKey (0x02)
        Responder key distribution: Sign (0x04)
> HCI Event: Number of Completed Packets (0x13) plen 5                                                               #63 6.496423
        Num handles: 1
        Handle: 1119 Address: DF:A9:FF:F6:B1:1A (OUI DF-A9-FF)
        Count: 1
        Buffers: 0/3
        #62: len 11 (0 Kb/s)
        Latency: 172 msec (152-172 msec ~167 msec)
> ACL Data RX: Handle 1119 flags 0x02 dlen 27                                                                        #64 6.496948
> ACL Data RX: Handle 1119 flags 0x01 dlen 27                                                                        #65 6.497442
> ACL Data RX: Handle 1119 flags 0x01 dlen 15                                                                        #66 6.497756
      SMP: Pairing Public Key (0x0c) len 64
        X[32]: 328b1f4c4046db14db4c98be08d88aba5e3c56133412796ac5af4bf33580438b
        Y[32]: bdc7d9ee7688c98eb26b3f5e228490d5891abbc6d8bab8d9d69824a38cd1a509
zephyr.exe[1553034]: < HCI Command: Host Number of Completed Packets (0x03|0x0035) plen 5                            #67 6.503664
        Num handles: 1
        Handle: 1119 Address: DF:A9:FF:F6:B1:1A (OUI DF-A9-FF)
        Count: 1
zephyr.exe[1553034]: < HCI Command: Host Number of Completed Packets (0x03|0x0035) plen 5                            #68 6.503762
        Num handles: 1
        Handle: 1119 Address: DF:A9:FF:F6:B1:1A (OUI DF-A9-FF)
        Count: 1
zephyr.exe[1553034]: < HCI Command: Host Number of Completed Packets (0x03|0x0035) plen 5                            #69 6.503808
        Num handles: 1
        Handle: 1119 Address: DF:A9:FF:F6:B1:1A (OUI DF-A9-FF)
        Count: 1
zephyr.exe[1553034]: < ACL Data TX: Handle 1119 [1/3] flags 0x00 dlen 27                                             #70 6.503864
zephyr.exe[1553034]: < ACL Data TX: Handle 1119 flags 0x01 dlen 27                                                   #71 6.503866
zephyr.exe[1553034]: < ACL Data TX: Handle 1119 flags 0x01 dlen 15                                                   #72 6.503866
      SMP: Pairing Public Key (0x0c) len 64
        X[32]: 98308440221e2d910f0e54b71e7ec652857aa9b5a0dc65028824cc19db1226e9
        Y[32]: 67a4816bcb62efb21701e31fdb27561a6217575fb007a8bbdabe7e28b6f68482
> HCI Event: Number of Completed Packets (0x13) plen 5                                                               #73 6.584188
        Num handles: 1
        Handle: 1119 Address: DF:A9:FF:F6:B1:1A (OUI DF-A9-FF)
        Count: 1
        Buffers: 0/3
        #70: len 27 (2 Kb/s)
        Latency: 80 msec (80-172 msec ~124 msec)
> HCI Event: Number of Completed Packets (0x13) plen 5                                                               #74 6.584741
        Num handles: 1
        Handle: 1119 Address: DF:A9:FF:F6:B1:1A (OUI DF-A9-FF)
        Count: 1
        Buffers: underflow/3
        #71: len 27 (2 Kb/s)
        Latency: 80 msec (80-172 msec ~102 msec)
zephyr.exe[1553034]: < ACL Data TX: Handle 1119 [1/3] flags 0x00 dlen 21                                             #75 6.603484
      SMP: Pairing Confirm (0x03) len 16
        Confirm value[16]: c54d06db39f26d6408b0f8804d8b3169
> HCI Event: Number of Completed Packets (0x13) plen 5                                                               #76 6.671206
        Num handles: 1
        Handle: 1119 Address: DF:A9:FF:F6:B1:1A (OUI DF-A9-FF)
        Count: 1
        Buffers: 0/3
        #72: len 15 (0 Kb/s)
        Latency: 167 msec (80-172 msec ~134 msec)
> HCI Event: Number of Completed Packets (0x13) plen 5                                                               #77 6.758817
        Num handles: 1
        Handle: 1119 Address: DF:A9:FF:F6:B1:1A (OUI DF-A9-FF)
        Count: 1
        Buffers: underflow/3
        #75: len 21 (1 Kb/s)
        Latency: 155 msec (80-172 msec ~145 msec)
> ACL Data RX: Handle 1119 flags 0x02 dlen 21                                                                        #78 6.758955
      SMP: Pairing Random (0x04) len 16
        Random value[16]: 2f347a68b639785b0000000000000000
zephyr.exe[1553034]: < HCI Command: Host Number of Completed Packets (0x03|0x0035) plen 5                            #79 6.763575
        Num handles: 1
        Handle: 1119 Address: DF:A9:FF:F6:B1:1A (OUI DF-A9-FF)
        Count: 1
zephyr.exe[1553034]: < ACL Data TX: Handle 1119 [1/3] flags 0x00 dlen 21                                             #80 6.763602
      SMP: Pairing Random (0x04) len 16
        Random value[16]: 8e6108f966a694cbe26df70bb96773e6
> HCI Event: Number of Completed Packets (0x13) plen 5                                                               #81 6.933606
        Num handles: 1
        Handle: 1119 Address: DF:A9:FF:F6:B1:1A (OUI DF-A9-FF)
        Count: 1
        Buffers: 0/3
        #80: len 21 (0 Kb/s)
        Latency: 170 msec (80-172 msec ~157 msec)
> ACL Data RX: Handle 1119 flags 0x02 dlen 21                                                                        #82 7.108886
      SMP: Pairing DHKey Check (0x0d) len 16
        E[16]: f1d65681426803d37de299b8dfe46106
zephyr.exe[1553034]: < HCI Command: Host Number of Completed Packets (0x03|0x0035) plen 5                            #83 7.123670
        Num handles: 1
        Handle: 1119 Address: DF:A9:FF:F6:B1:1A (OUI DF-A9-FF)
        Count: 1
zephyr.exe[1553034]: < ACL Data TX: Handle 1119 [1/3] flags 0x00 dlen 21                                             #84 7.123698
      SMP: Pairing DHKey Check (0x0d) len 16
        E[16]: 1da161d34fec58596a01aa074b066e1d
> HCI Event: Number of Completed Packets (0x13) plen 5                                                               #85 7.284001
        Num handles: 1
        Handle: 1119 Address: DF:A9:FF:F6:B1:1A (OUI DF-A9-FF)
        Count: 1
        Buffers: 0/3
        #84: len 21 (1 Kb/s)
        Latency: 160 msec (80-172 msec ~158 msec)
> HCI Event: LE Meta Event (0x3e) plen 13                                                                            #86 7.371731
      LE Long Term Key Request (0x05)
        Handle: 1119 Address: DF:A9:FF:F6:B1:1A (OUI DF-A9-FF)
        Random number: 0x0000000000000000
        Encrypted diversifier: 0x0000
zephyr.exe[1553034]: < HCI Command: LE Long Term Key Request Reply (0x08|0x001a) plen 18                             #87 7.383567
        Handle: 1119 Address: DF:A9:FF:F6:B1:1A (OUI DF-A9-FF)
        Long term key[16]: 3f04a2c27601e85a4b787e9223c93aea
> HCI Event: Command Complete (0x0e) plen 6                                                                          #88 7.384544
      LE Long Term Key Request Reply (0x08|0x001a) ncmd 1
        Status: Success (0x00)
        Handle: 1119 Address: DF:A9:FF:F6:B1:1A (OUI DF-A9-FF)
> HCI Event: Encryption Change (0x08) plen 4                                                                         #89 7.809252
        Status: Success (0x00)
        Handle: 1119 Address: DF:A9:FF:F6:B1:1A (OUI DF-A9-FF)
        Encryption: Enabled with AES-CCM (0x01)
zephyr.exe[1553034]: < ACL Data TX: Handle 1119 [1/3] flags 0x00 dlen 21                                             #90 7.933618
      SMP: Signing Information (0x0a) len 16
        Signature key[16]: 5da095555cc64d02679f89a05211af56
> HCI Event: Number of Completed Packets (0x13) plen 5                                                               #91 8.071536
        Num handles: 1
        Handle: 1119 Address: DF:A9:FF:F6:B1:1A (OUI DF-A9-FF)
        Count: 1
        Buffers: 0/3
        #90: len 21 (1 Kb/s)
        Latency: 137 msec (80-172 msec ~148 msec)
> ACL Data RX: Handle 1119 flags 0x02 dlen 21                                                                        #92 8.071637
      SMP: Identity Information (0x08) len 16
        Identity resolving key[16]: 792b4596364f0bef6a302b87fdad5855
> ACL Data RX: Handle 1119 flags 0x02 dlen 12                                                                        #93 8.071855
      SMP: Identity Address Information (0x09) len 7
        Address: DF:A9:FF:F6:B1:1A (OUI DF-A9-FF)
zephyr.exe[1553034]: < HCI Command: Host Number of Completed Packets (0x03|0x0035) plen 5                            #94 8.083637
        Num handles: 1
        Handle: 1119 Address: DF:A9:FF:F6:B1:1A (OUI DF-A9-FF)
        Count: 1
zephyr.exe[1553034]: < HCI Command: LE Add Device To Resolving List (0x08|0x0027) plen 39                            #95 8.083777
        Address type: Public (0x00)
        Address: DF:A9:FF:F6:B1:1A (OUI DF-A9-FF)
        Peer identity resolving key[16]: 792b4596364f0bef6a302b87fdad5855
        Local identity resolving key[16]: 00000000000000000000000000000000
> HCI Event: Command Complete (0x0e) plen 4                                                                          #96 8.084869
      LE Add Device To Resolving List (0x08|0x0027) ncmd 1
        Status: Success (0x00)
zephyr.exe[1553034]: < HCI Command: LE Set Privacy Mode (0x08|0x004e) plen 8                                         #97 8.103640
        Peer Identity address type: Public (0x00)
        Peer Identity address: DF:A9:FF:F6:B1:1A (OUI DF-A9-FF)
        Privacy Mode: Use Device Privacy (0x01)
> HCI Event: Command Complete (0x0e) plen 4                                                                          #98 8.104175
      LE Set Privacy Mode (0x08|0x004e) ncmd 1
        Status: Success (0x00)
zephyr.exe[1553034]: < HCI Command: LE Set Address Resolution Enable (0x08|0x002d) plen 1                            #99 8.123550
        Address resolution: Enabled (0x01)
> HCI Event: Command Complete (0x0e) plen 4                                                                         #100 8.124027
      LE Set Address Resolution Enable (0x08|0x002d) ncmd 1
        Status: Success (0x00)
zephyr.exe[1553034]: < HCI Command: Host Number of Completed Packets (0x03|0x0035) plen 5                           #101 8.143548
        Num handles: 1
        Handle: 1119 Address: DF:A9:FF:F6:B1:1A (OUI DF-A9-FF)
        Count: 1
> ACL Data RX: Handle 1119 flags 0x02 dlen 13                                                                       #102 8.333745
      ATT: Find By Type Value Request (0x06) len 8
        Handle range: 0x0001-0xffff
        Attribute type: Primary Service (0x2800)
          UUID: Audio Stream Control (0x184e)
zephyr.exe[1553034]: < HCI Command: Host Number of Completed Packets (0x03|0x0035) plen 5                           #103 8.343655
        Num handles: 1
        Handle: 1119 Address: DF:A9:FF:F6:B1:1A (OUI DF-A9-FF)
        Count: 1
zephyr.exe[1553034]: < ACL Data TX: Handle 1119 [1/3] flags 0x00 dlen 9                                             #104 8.343682
      ATT: Find By Type Value Response (0x07) len 4
        Handle range: 0x0037-0x0046
> HCI Event: Number of Completed Packets (0x13) plen 5                                                              #105 8.508834
        Num handles: 1
        Handle: 1119 Address: DF:A9:FF:F6:B1:1A (OUI DF-A9-FF)
        Count: 1
        Buffers: 0/3
        #104: len 9 (0 Kb/s)
        Latency: 165 msec (80-172 msec ~156 msec)
> ACL Data RX: Handle 1119 flags 0x02 dlen 13                                                                       #106 8.508965
      ATT: Find By Type Value Request (0x06) len 8
        Handle range: 0x0047-0xffff
        Attribute type: Primary Service (0x2800)
          UUID: Audio Stream Control (0x184e)
zephyr.exe[1553034]: < HCI Command: Host Number of Completed Packets (0x03|0x0035) plen 5                           #107 8.523691
        Num handles: 1
        Handle: 1119 Address: DF:A9:FF:F6:B1:1A (OUI DF-A9-FF)
        Count: 1
zephyr.exe[1553034]: < ACL Data TX: Handle 1119 [1/3] flags 0x00 dlen 9                                             #108 8.523719
      ATT: Error Response (0x01) len 4
        Find By Type Value Request (0x06)
        Handle: 0x0047
        Error: Attribute Not Found (0x0a)
> HCI Event: Number of Completed Packets (0x13) plen 5                                                              #109 8.683715
        Num handles: 1
        Handle: 1119 Address: DF:A9:FF:F6:B1:1A (OUI DF-A9-FF)
        Count: 1
        Buffers: 0/3
        #108: len 9 (0 Kb/s)
        Latency: 159 msec (80-172 msec ~158 msec)
> ACL Data RX: Handle 1119 flags 0x02 dlen 11                                                                       #110 8.683860
      ATT: Read By Type Request (0x08) len 6
        Handle range: 0x0037-0x0046
        Attribute type: Characteristic (0x2803)
zephyr.exe[1553034]: < HCI Command: Host Number of Completed Packets (0x03|0x0035) plen 5                           #111 8.703604
        Num handles: 1
        Handle: 1119 Address: DF:A9:FF:F6:B1:1A (OUI DF-A9-FF)
        Count: 1
zephyr.exe[1553034]: < ACL Data TX: Handle 1119 [1/3] flags 0x00 dlen 27                                            #112 8.703668
zephyr.exe[1553034]: < ACL Data TX: Handle 1119 flags 0x01 dlen 14                                                  #113 8.703672
      ATT: Read By Type Response (0x09) len 36
        Attribute data length: 7
        Attribute data list: 5 entries
        Handle: 0x0038
        Value[5]: 1c3900c62b
            Properties: 0x1c
              Write Without Response (0x04)
              Write (0x08)
              Notify (0x10)
            Value Handle: 0x0039
            Value UUID: ASE Control Point (0x2bc6)
        Handle: 0x003b
        Value[5]: 123c00c42b
            Properties: 0x12
              Read (0x02)
              Notify (0x10)
            Value Handle: 0x003c
            Value UUID: Sink ASE (0x2bc4)
        Handle: 0x003e
        Value[5]: 123f00c42b
            Properties: 0x12
              Read (0x02)
              Notify (0x10)
            Value Handle: 0x003f
            Value UUID: Sink ASE (0x2bc4)
        Handle: 0x0041
        Value[5]: 124200c52b
            Properties: 0x12
              Read (0x02)
              Notify (0x10)
            Value Handle: 0x0042
            Value UUID: Source ASE (0x2bc5)
        Handle: 0x0044
        Value[5]: 124500c52b
            Properties: 0x12
              Read (0x02)
              Notify (0x10)
            Value Handle: 0x0045
            Value UUID: Source ASE (0x2bc5)
> HCI Event: Number of Completed Packets (0x13) plen 5                                                              #114 8.771854
        Num handles: 1
        Handle: 1119 Address: DF:A9:FF:F6:B1:1A (OUI DF-A9-FF)
        Count: 1
        Buffers: 0/3
        #112: len 27 (3 Kb/s)
        Latency: 68 msec (68-172 msec ~113 msec)
> HCI Event: Number of Completed Packets (0x13) plen 5                                                              #115 8.858736
        Num handles: 1
        Handle: 1119 Address: DF:A9:FF:F6:B1:1A (OUI DF-A9-FF)
        Count: 1
        Buffers: underflow/3
        #113: len 14 (0 Kb/s)
        Latency: 155 msec (68-172 msec ~134 msec)
> ACL Data RX: Handle 1119 flags 0x02 dlen 11                                                                       #116 8.858850
      ATT: Read By Type Request (0x08) len 6
        Handle range: 0x0045-0x0046
        Attribute type: Characteristic (0x2803)
zephyr.exe[1553034]: < HCI Command: Host Number of Completed Packets (0x03|0x0035) plen 5                           #117 8.863569
        Num handles: 1
        Handle: 1119 Address: DF:A9:FF:F6:B1:1A (OUI DF-A9-FF)
        Count: 1
zephyr.exe[1553034]: < ACL Data TX: Handle 1119 [1/3] flags 0x00 dlen 9                                             #118 8.863575
      ATT: Error Response (0x01) len 4
        Read By Type Request (0x08)
        Handle: 0x0045
        Error: Attribute Not Found (0x0a)
> HCI Event: Number of Completed Packets (0x13) plen 5                                                              #119 9.033737
        Num handles: 1
        Handle: 1119 Address: DF:A9:FF:F6:B1:1A (OUI DF-A9-FF)
        Count: 1
        Buffers: 0/3
        #118: len 9 (0 Kb/s)
        Latency: 170 msec (68-172 msec ~152 msec)
> ACL Data RX: Handle 1119 flags 0x02 dlen 9                                                                        #120 9.033876
      ATT: Find Information Request (0x04) len 4
        Handle range: 0x003a-0x003a
zephyr.exe[1553034]: < HCI Command: Host Number of Completed Packets (0x03|0x0035) plen 5                           #121 9.043567
        Num handles: 1
        Handle: 1119 Address: DF:A9:FF:F6:B1:1A (OUI DF-A9-FF)
        Count: 1
zephyr.exe[1553034]: < ACL Data TX: Handle 1119 [1/3] flags 0x00 dlen 10                                            #122 9.043595
      ATT: Find Information Response (0x05) len 5
        Format: UUID-16 (0x01)
        Handle: 0x003a
        UUID: Client Characteristic Configuration (0x2902)
> HCI Event: Number of Completed Packets (0x13) plen 5                                                              #123 9.208958
        Num handles: 1
        Handle: 1119 Address: DF:A9:FF:F6:B1:1A (OUI DF-A9-FF)
        Count: 1
        Buffers: 0/3
        #122: len 10 (0 Kb/s)
        Latency: 165 msec (68-172 msec ~158 msec)
> ACL Data RX: Handle 1119 flags 0x02 dlen 9                                                                        #124 9.208961
      ATT: Find Information Request (0x04) len 4
        Handle range: 0x003d-0x003d
zephyr.exe[1553034]: < HCI Command: Host Number of Completed Packets (0x03|0x0035) plen 5                           #125 9.223702
        Num handles: 1
        Handle: 1119 Address: DF:A9:FF:F6:B1:1A (OUI DF-A9-FF)
        Count: 1
zephyr.exe[1553034]: < ACL Data TX: Handle 1119 [1/3] flags 0x00 dlen 10                                            #126 9.223730
      ATT: Find Information Response (0x05) len 5
        Format: UUID-16 (0x01)
        Handle: 0x003d
        UUID: Client Characteristic Configuration (0x2902)
> HCI Event: Number of Completed Packets (0x13) plen 5                                                              #127 9.383682
        Num handles: 1
        Handle: 1119 Address: DF:A9:FF:F6:B1:1A (OUI DF-A9-FF)
        Count: 1
        Buffers: 0/3
        #126: len 10 (0 Kb/s)
        Latency: 159 msec (68-172 msec ~159 msec)
> ACL Data RX: Handle 1119 flags 0x02 dlen 9                                                                        #128 9.383745
      ATT: Find Information Request (0x04) len 4
        Handle range: 0x0040-0x0040
zephyr.exe[1553034]: < HCI Command: Host Number of Completed Packets (0x03|0x0035) plen 5                           #129 9.403697
        Num handles: 1
        Handle: 1119 Address: DF:A9:FF:F6:B1:1A (OUI DF-A9-FF)
        Count: 1
zephyr.exe[1553034]: < ACL Data TX: Handle 1119 [1/3] flags 0x00 dlen 10                                            #130 9.403724
      ATT: Find Information Response (0x05) len 5
        Format: UUID-16 (0x01)
        Handle: 0x0040
        UUID: Client Characteristic Configuration (0x2902)
> HCI Event: Number of Completed Packets (0x13) plen 5                                                              #131 9.558713
        Num handles: 1
        Handle: 1119 Address: DF:A9:FF:F6:B1:1A (OUI DF-A9-FF)
        Count: 1
        Buffers: 0/3
        #130: len 10 (0 Kb/s)
        Latency: 154 msec (68-172 msec ~157 msec)
> ACL Data RX: Handle 1119 flags 0x02 dlen 9                                                                        #132 9.559293
      ATT: Find Information Request (0x04) len 4
        Handle range: 0x0043-0x0043
zephyr.exe[1553034]: < HCI Command: Host Number of Completed Packets (0x03|0x0035) plen 5                           #133 9.563654
        Num handles: 1
        Handle: 1119 Address: DF:A9:FF:F6:B1:1A (OUI DF-A9-FF)
        Count: 1
zephyr.exe[1553034]: < ACL Data TX: Handle 1119 [1/3] flags 0x00 dlen 10                                            #134 9.563678
      ATT: Find Information Response (0x05) len 5
        Format: UUID-16 (0x01)
        Handle: 0x0043
        UUID: Client Characteristic Configuration (0x2902)
> HCI Event: Number of Completed Packets (0x13) plen 5                                                              #135 9.733700
        Num handles: 1
        Handle: 1119 Address: DF:A9:FF:F6:B1:1A (OUI DF-A9-FF)
        Count: 1
        Buffers: 0/3
        #134: len 10 (0 Kb/s)
        Latency: 170 msec (68-172 msec ~163 msec)
> ACL Data RX: Handle 1119 flags 0x02 dlen 9                                                                        #136 9.733929
      ATT: Find Information Request (0x04) len 4
        Handle range: 0x0046-0x0046
zephyr.exe[1553034]: < HCI Command: Host Number of Completed Packets (0x03|0x0035) plen 5                           #137 9.743606
        Num handles: 1
        Handle: 1119 Address: DF:A9:FF:F6:B1:1A (OUI DF-A9-FF)
        Count: 1
zephyr.exe[1553034]: < ACL Data TX: Handle 1119 [1/3] flags 0x00 dlen 10                                            #138 9.743670
      ATT: Find Information Response (0x05) len 5
        Format: UUID-16 (0x01)
        Handle: 0x0046
        UUID: Client Characteristic Configuration (0x2902)
> HCI Event: Number of Completed Packets (0x13) plen 5                                                              #139 9.908689
        Num handles: 1
        Handle: 1119 Address: DF:A9:FF:F6:B1:1A (OUI DF-A9-FF)
        Count: 1
        Buffers: 0/3
        #138: len 10 (0 Kb/s)
        Latency: 165 msec (68-172 msec ~164 msec)
> ACL Data RX: Handle 1119 flags 0x02 dlen 9                                                                        #140 9.908692
      ATT: Write Request (0x12) len 4
        Handle: 0x003a
          Data[2]: 0000
zephyr.exe[1553034]: < HCI Command: Host Number of Completed Packets (0x03|0x0035) plen 5                           #141 9.923616
        Num handles: 1
        Handle: 1119 Address: DF:A9:FF:F6:B1:1A (OUI DF-A9-FF)
        Count: 1
zephyr.exe[1553034]: < ACL Data TX: Handle 1119 [1/3] flags 0x00 dlen 5                                             #142 9.923622
      ATT: Write Response (0x13) len 0
> HCI Event: Number of Completed Packets (0x13) plen 5                                                             #143 10.083492
        Num handles: 1
        Handle: 1119 Address: DF:A9:FF:F6:B1:1A (OUI DF-A9-FF)
        Count: 1
        Buffers: 0/3
        #142: len 5 (0 Kb/s)
        Latency: 159 msec (68-172 msec ~162 msec)
> ACL Data RX: Handle 1119 flags 0x02 dlen 9                                                                       #144 10.083856
      ATT: Write Request (0x12) len 4
        Handle: 0x003a
          Data[2]: 0100
zephyr.exe[1553034]: < HCI Command: Host Number of Completed Packets (0x03|0x0035) plen 5                          #145 10.103633
        Num handles: 1
        Handle: 1119 Address: DF:A9:FF:F6:B1:1A (OUI DF-A9-FF)
        Count: 1
zephyr.exe[1553034]: < ACL Data TX: Handle 1119 [1/3] flags 0x00 dlen 5                                            #146 10.103660
      ATT: Write Response (0x13) len 0
> HCI Event: Number of Completed Packets (0x13) plen 5                                                             #147 10.258650
        Num handles: 1
        Handle: 1119 Address: DF:A9:FF:F6:B1:1A (OUI DF-A9-FF)
        Count: 1
        Buffers: 0/3
        #146: len 5 (0 Kb/s)
        Latency: 154 msec (68-172 msec ~158 msec)
> ACL Data RX: Handle 1119 flags 0x02 dlen 9                                                                       #148 10.258717
      ATT: Write Request (0x12) len 4
        Handle: 0x003d
          Data[2]: 0000
zephyr.exe[1553034]: < HCI Command: Host Number of Completed Packets (0x03|0x0035) plen 5                          #149 10.263719
        Num handles: 1
        Handle: 1119 Address: DF:A9:FF:F6:B1:1A (OUI DF-A9-FF)
        Count: 1
zephyr.exe[1553034]: < ACL Data TX: Handle 1119 [1/3] flags 0x00 dlen 5                                            #150 10.263745
      ATT: Write Response (0x13) len 0
> HCI Event: Number of Completed Packets (0x13) plen 5                                                             #151 10.433811
        Num handles: 1
        Handle: 1119 Address: DF:A9:FF:F6:B1:1A (OUI DF-A9-FF)
        Count: 1
        Buffers: 0/3
        #150: len 5 (0 Kb/s)
        Latency: 170 msec (68-172 msec ~164 msec)
> ACL Data RX: Handle 1119 flags 0x02 dlen 9                                                                       #152 10.434010
      ATT: Write Request (0x12) len 4
        Handle: 0x003d
          Data[2]: 0100
zephyr.exe[1553034]: < HCI Command: Host Number of Completed Packets (0x03|0x0035) plen 5                          #153 10.443628
        Num handles: 1
        Handle: 1119 Address: DF:A9:FF:F6:B1:1A (OUI DF-A9-FF)
        Count: 1
zephyr.exe[1553034]: < ACL Data TX: Handle 1119 [1/3] flags 0x00 dlen 5                                            #154 10.443656
      ATT: Write Response (0x13) len 0
> HCI Event: Number of Completed Packets (0x13) plen 5                                                             #155 10.608613
        Num handles: 1
        Handle: 1119 Address: DF:A9:FF:F6:B1:1A (OUI DF-A9-FF)
        Count: 1
        Buffers: 0/3
        #154: len 5 (0 Kb/s)
        Latency: 164 msec (68-172 msec ~164 msec)
> ACL Data RX: Handle 1119 flags 0x02 dlen 9                                                                       #156 10.608615
      ATT: Write Request (0x12) len 4
        Handle: 0x0040
          Data[2]: 0000
zephyr.exe[1553034]: < HCI Command: Host Number of Completed Packets (0x03|0x0035) plen 5                          #157 10.623604
        Num handles: 1
        Handle: 1119 Address: DF:A9:FF:F6:B1:1A (OUI DF-A9-FF)
        Count: 1
zephyr.exe[1553034]: < ACL Data TX: Handle 1119 [1/3] flags 0x00 dlen 5                                            #158 10.623682
      ATT: Write Response (0x13) len 0
> HCI Event: Number of Completed Packets (0x13) plen 5                                                             #159 10.783605
        Num handles: 1
        Handle: 1119 Address: DF:A9:FF:F6:B1:1A (OUI DF-A9-FF)
        Count: 1
        Buffers: 0/3
        #158: len 5 (0 Kb/s)
        Latency: 159 msec (68-172 msec ~162 msec)
> ACL Data RX: Handle 1119 flags 0x02 dlen 9                                                                       #160 10.783878
      ATT: Write Request (0x12) len 4
        Handle: 0x0040
          Data[2]: 0100
zephyr.exe[1553034]: < HCI Command: Host Number of Completed Packets (0x03|0x0035) plen 5                          #161 10.803634
        Num handles: 1
        Handle: 1119 Address: DF:A9:FF:F6:B1:1A (OUI DF-A9-FF)
        Count: 1
zephyr.exe[1553034]: < ACL Data TX: Handle 1119 [1/3] flags 0x00 dlen 5                                            #162 10.803640
      ATT: Write Response (0x13) len 0
> HCI Event: Number of Completed Packets (0x13) plen 5                                                             #163 10.958790
        Num handles: 1
        Handle: 1119 Address: DF:A9:FF:F6:B1:1A (OUI DF-A9-FF)
        Count: 1
        Buffers: 0/3
        #162: len 5 (0 Kb/s)
        Latency: 155 msec (68-172 msec ~158 msec)
> ACL Data RX: Handle 1119 flags 0x02 dlen 9                                                                       #164 10.958792
      ATT: Write Request (0x12) len 4
        Handle: 0x0043
          Data[2]: 0000
zephyr.exe[1553034]: < HCI Command: Host Number of Completed Packets (0x03|0x0035) plen 5                          #165 10.963636
        Num handles: 1
        Handle: 1119 Address: DF:A9:FF:F6:B1:1A (OUI DF-A9-FF)
        Count: 1
zephyr.exe[1553034]: < ACL Data TX: Handle 1119 [1/3] flags 0x00 dlen 5                                            #166 10.963694
      ATT: Write Response (0x13) len 0
> HCI Event: Number of Completed Packets (0x13) plen 5                                                             #167 11.133752
        Num handles: 1
        Handle: 1119 Address: DF:A9:FF:F6:B1:1A (OUI DF-A9-FF)
        Count: 1
        Buffers: 0/3
        #166: len 5 (0 Kb/s)
        Latency: 170 msec (68-172 msec ~164 msec)
> ACL Data RX: Handle 1119 flags 0x02 dlen 9                                                                       #168 11.133755
      ATT: Write Request (0x12) len 4
        Handle: 0x0043
          Data[2]: 0100
zephyr.exe[1553034]: < HCI Command: Host Number of Completed Packets (0x03|0x0035) plen 5                          #169 11.143648
        Num handles: 1
        Handle: 1119 Address: DF:A9:FF:F6:B1:1A (OUI DF-A9-FF)
        Count: 1
zephyr.exe[1553034]: < ACL Data TX: Handle 1119 [1/3] flags 0x00 dlen 5                                            #170 11.143674
      ATT: Write Response (0x13) len 0
> HCI Event: Number of Completed Packets (0x13) plen 5                                                             #171 11.308587
        Num handles: 1
        Handle: 1119 Address: DF:A9:FF:F6:B1:1A (OUI DF-A9-FF)
        Count: 1
        Buffers: 0/3
        #170: len 5 (0 Kb/s)
        Latency: 164 msec (68-172 msec ~164 msec)
> ACL Data RX: Handle 1119 flags 0x02 dlen 9                                                                       #172 11.308879
      ATT: Write Request (0x12) len 4
        Handle: 0x0046
          Data[2]: 0000
zephyr.exe[1553034]: < HCI Command: Host Number of Completed Packets (0x03|0x0035) plen 5                          #173 11.323624
        Num handles: 1
        Handle: 1119 Address: DF:A9:FF:F6:B1:1A (OUI DF-A9-FF)
        Count: 1
zephyr.exe[1553034]: < ACL Data TX: Handle 1119 [1/3] flags 0x00 dlen 5                                            #174 11.323689
      ATT: Write Response (0x13) len 0
> HCI Event: Number of Completed Packets (0x13) plen 5                                                             #175 11.483812
        Num handles: 1
        Handle: 1119 Address: DF:A9:FF:F6:B1:1A (OUI DF-A9-FF)
        Count: 1
        Buffers: 0/3
        #174: len 5 (0 Kb/s)
        Latency: 160 msec (68-172 msec ~162 msec)
> ACL Data RX: Handle 1119 flags 0x02 dlen 9                                                                       #176 11.483815
      ATT: Write Request (0x12) len 4
        Handle: 0x0046
          Data[2]: 0100
zephyr.exe[1553034]: < HCI Command: Host Number of Completed Packets (0x03|0x0035) plen 5                          #177 11.503637
        Num handles: 1
        Handle: 1119 Address: DF:A9:FF:F6:B1:1A (OUI DF-A9-FF)
        Count: 1
zephyr.exe[1553034]: < ACL Data TX: Handle 1119 [1/3] flags 0x00 dlen 5                                            #178 11.503696
      ATT: Write Response (0x13) len 0
> HCI Event: Number of Completed Packets (0x13) plen 5                                                             #179 11.658395
        Num handles: 1
        Handle: 1119 Address: DF:A9:FF:F6:B1:1A (OUI DF-A9-FF)
        Count: 1
        Buffers: 0/3
        #178: len 5 (0 Kb/s)
        Latency: 154 msec (68-172 msec ~158 msec)
> ACL Data RX: Handle 1119 flags 0x02 dlen 7                                                                       #180 11.658678
      ATT: Read Request (0x0a) len 2
        Handle: 0x003c
zephyr.exe[1553034]: < HCI Command: Host Number of Completed Packets (0x03|0x0035) plen 5                          #181 11.663681
        Num handles: 1
        Handle: 1119 Address: DF:A9:FF:F6:B1:1A (OUI DF-A9-FF)
        Count: 1
zephyr.exe[1553034]: < ACL Data TX: Handle 1119 [1/3] flags 0x00 dlen 7                                            #182 11.663732
      ATT: Read Response (0x0b) len 2
        Value[2]: 0100
> HCI Event: Number of Completed Packets (0x13) plen 5                                                             #183 11.833738
        Num handles: 1
        Handle: 1119 Address: DF:A9:FF:F6:B1:1A (OUI DF-A9-FF)
        Count: 1
        Buffers: 0/3
        #182: len 7 (0 Kb/s)
        Latency: 170 msec (68-172 msec ~164 msec)
> ACL Data RX: Handle 1119 flags 0x02 dlen 7                                                                       #184 11.833995
      ATT: Read Request (0x0a) len 2
        Handle: 0x003f
zephyr.exe[1553034]: < HCI Command: Host Number of Completed Packets (0x03|0x0035) plen 5                          #185 11.843651
        Num handles: 1
        Handle: 1119 Address: DF:A9:FF:F6:B1:1A (OUI DF-A9-FF)
        Count: 1
zephyr.exe[1553034]: < ACL Data TX: Handle 1119 [1/3] flags 0x00 dlen 7                                            #186 11.843679
      ATT: Read Response (0x0b) len 2
        Value[2]: 0200
> HCI Event: Number of Completed Packets (0x13) plen 5                                                             #187 12.008595
        Num handles: 1
        Handle: 1119 Address: DF:A9:FF:F6:B1:1A (OUI DF-A9-FF)
        Count: 1
        Buffers: 0/3
        #186: len 7 (0 Kb/s)
        Latency: 164 msec (68-172 msec ~164 msec)
> ACL Data RX: Handle 1119 flags 0x02 dlen 7                                                                       #188 12.008744
      ATT: Read Request (0x0a) len 2
        Handle: 0x0042
zephyr.exe[1553034]: < HCI Command: Host Number of Completed Packets (0x03|0x0035) plen 5                          #189 12.023644
        Num handles: 1
        Handle: 1119 Address: DF:A9:FF:F6:B1:1A (OUI DF-A9-FF)
        Count: 1
zephyr.exe[1553034]: < ACL Data TX: Handle 1119 [1/3] flags 0x00 dlen 7                                            #190 12.023671
      ATT: Read Response (0x0b) len 2
        Value[2]: 0300
> HCI Event: Number of Completed Packets (0x13) plen 5                                                             #191 12.183598
        Num handles: 1
        Handle: 1119 Address: DF:A9:FF:F6:B1:1A (OUI DF-A9-FF)
        Count: 1
        Buffers: 0/3
        #190: len 7 (0 Kb/s)
        Latency: 159 msec (68-172 msec ~162 msec)
> ACL Data RX: Handle 1119 flags 0x02 dlen 7                                                                       #192 12.183727
      ATT: Read Request (0x0a) len 2
        Handle: 0x0045
zephyr.exe[1553034]: < HCI Command: Host Number of Completed Packets (0x03|0x0035) plen 5                          #193 12.203682
        Num handles: 1
        Handle: 1119 Address: DF:A9:FF:F6:B1:1A (OUI DF-A9-FF)
        Count: 1
zephyr.exe[1553034]: < ACL Data TX: Handle 1119 [1/3] flags 0x00 dlen 7                                            #194 12.203729
      ATT: Read Response (0x0b) len 2
        Value[2]: 0400
> HCI Event: Number of Completed Packets (0x13) plen 5                                                             #195 12.358587
        Num handles: 1
        Handle: 1119 Address: DF:A9:FF:F6:B1:1A (OUI DF-A9-FF)
        Count: 1
        Buffers: 0/3
        #194: len 7 (0 Kb/s)
        Latency: 154 msec (68-172 msec ~158 msec)
> ACL Data RX: Handle 1119 flags 0x02 dlen 27                                                                      #196 12.359229
> ACL Data RX: Handle 1119 flags 0x01 dlen 7                                                                       #197 12.359230
      ATT: Write Command (0x52) len 29
        Handle: 0x0039
          Data[27]: 010101010206000000001002010302020105030100000003042800
zephyr.exe[1553034]: < HCI Command: Host Number of Completed Packets (0x03|0x0035) plen 5                          #198 12.363738
        Num handles: 1
        Handle: 1119 Address: DF:A9:FF:F6:B1:1A (OUI DF-A9-FF)
        Count: 1
zephyr.exe[1553034]: < HCI Command: Host Number of Completed Packets (0x03|0x0035) plen 5                          #199 12.363942
        Num handles: 1
        Handle: 1119 Address: DF:A9:FF:F6:B1:1A (OUI DF-A9-FF)
        Count: 1
zephyr.exe[1553034]: < ACL Data TX: Handle 1119 [1/3] flags 0x00 dlen 12                                           #200 12.364038
      ATT: Handle Value Notification (0x1b) len 7
        Handle: 0x0039
          Data[5]: 0101010000
zephyr.exe[1553034]: < ACL Data TX: Handle 1119 [2/3] flags 0x00 dlen 27                                           #201 12.364041
zephyr.exe[1553034]: < ACL Data TX: Handle 1119 flags 0x01 dlen 21                                                 #202 12.364082
      ATT: Handle Value Notification (0x1b) len 43
        Handle: 0x003c
          Data[41]: 01010002020a00102700409c00102700409c0006000000001002010302020105030100000003042800
> HCI Event: Number of Completed Packets (0x13) plen 5                                                             #203 12.446373
        Num handles: 1
        Handle: 1119 Address: DF:A9:FF:F6:B1:1A (OUI DF-A9-FF)
        Count: 1
        Buffers: 1/3
        #200: len 12 (1 Kb/s)
        Latency: 82 msec (68-172 msec ~120 msec)
> HCI Event: Number of Completed Packets (0x13) plen 5                                                             #204 12.447084
        Num handles: 1
        Handle: 1119 Address: DF:A9:FF:F6:B1:1A (OUI DF-A9-FF)
        Count: 1
        Buffers: 0/3
        #201: len 27 (2 Kb/s)
        Latency: 83 msec (68-172 msec ~101 msec)
> HCI Event: Number of Completed Packets (0x13) plen 5                                                             #205 12.533813
        Num handles: 1
        Handle: 1119 Address: DF:A9:FF:F6:B1:1A (OUI DF-A9-FF)
        Count: 1
        Buffers: underflow/3
        #202: len 21 (0 Kb/s)
        Latency: 169 msec (68-172 msec ~135 msec)
> ACL Data RX: Handle 1119 flags 0x02 dlen 25                                                                      #206 12.533895
      ATT: Write Command (0x52) len 20
        Handle: 0x0039
          Data[18]: 020101010110270000022800020a00a86100
zephyr.exe[1553034]: < HCI Command: Host Number of Completed Packets (0x03|0x0035) plen 5                          #207 12.543734
        Num handles: 1
        Handle: 1119 Address: DF:A9:FF:F6:B1:1A (OUI DF-A9-FF)
        Count: 1
zephyr.exe[1553034]: < ACL Data TX: Handle 1119 [1/3] flags 0x00 dlen 12                                           #208 12.543757
      ATT: Handle Value Notification (0x1b) len 7
        Handle: 0x0039
          Data[5]: 0201010000
zephyr.exe[1553034]: < ACL Data TX: Handle 1119 [2/3] flags 0x00 dlen 24                                           #209 12.543840
      ATT: Handle Value Notification (0x1b) len 19
        Handle: 0x003c
          Data[17]: 0102010110270000022800020a00a86100
> HCI Event: Number of Completed Packets (0x13) plen 5                                                             #210 12.621548
        Num handles: 1
        Handle: 1119 Address: DF:A9:FF:F6:B1:1A (OUI DF-A9-FF)
        Count: 1
        Buffers: 1/3
        #208: len 12 (1 Kb/s)
        Latency: 77 msec (68-172 msec ~106 msec)
> HCI Event: Number of Completed Packets (0x13) plen 5                                                             #211 12.708598
        Num handles: 1
        Handle: 1119 Address: DF:A9:FF:F6:B1:1A (OUI DF-A9-FF)
        Count: 1
        Buffers: 0/3
        #209: len 24 (1 Kb/s)
        Latency: 164 msec (68-172 msec ~135 msec)
> ACL Data RX: Handle 1119 flags 0x02 dlen 15                                                                      #212 12.709107
      ATT: Write Command (0x52) len 10
        Handle: 0x0039
          Data[8]: 0301010403020100
zephyr.exe[1553034]: < HCI Command: Host Number of Completed Packets (0x03|0x0035) plen 5                          #213 12.723714
        Num handles: 1
        Handle: 1119 Address: DF:A9:FF:F6:B1:1A (OUI DF-A9-FF)
        Count: 1
zephyr.exe[1553034]: < ACL Data TX: Handle 1119 [1/3] flags 0x00 dlen 12                                           #214 12.723767
      ATT: Handle Value Notification (0x1b) len 7
        Handle: 0x0039
          Data[5]: 0301010000
zephyr.exe[1553034]: < ACL Data TX: Handle 1119 [2/3] flags 0x00 dlen 16                                           #215 12.723815
      ATT: Handle Value Notification (0x1b) len 11
        Handle: 0x003c
          Data[9]: 010301010403020100
> HCI Event: Number of Completed Packets (0x13) plen 5                                                             #216 12.796389
        Num handles: 1
        Handle: 1119 Address: DF:A9:FF:F6:B1:1A (OUI DF-A9-FF)
        Count: 1
        Buffers: 1/3
        #214: len 12 (1 Kb/s)
        Latency: 72 msec (68-172 msec ~104 msec)
> HCI Event: Number of Completed Packets (0x13) plen 5                                                             #217 12.883483
        Num handles: 1
        Handle: 1119 Address: DF:A9:FF:F6:B1:1A (OUI DF-A9-FF)
        Count: 1
        Buffers: 0/3
        #215: len 16 (0 Kb/s)
        Latency: 159 msec (68-172 msec ~131 msec)
> HCI Event: Disconnect Complete (0x05) plen 4                                                                     #218 12.971035
        Status: Success (0x00)
        Handle: 1119 Address: DF:A9:FF:F6:B1:1A (OUI DF-A9-FF)
        Reason: Remote User Terminated Connection (0x13)
zephyr.exe[1553034]: < HCI Command: LE Set Extended Advertising Parameters (0x08|0x0036) plen 25                   #219 14.453659
        Handle: 0x00
        Properties: 0x0013
          Connectable
          Scannable
          Use legacy advertising PDUs: ADV_IND
        Min advertising interval: 100.000 msec (0x00a0)
        Max advertising interval: 150.000 msec (0x00f0)
        Channel map: 37, 38, 39 (0x07)
        Own address type: Random (0x01)
        Peer address type: Public (0x00)
        Peer address: 00:00:00:00:00:00 (OUI 00-00-00)
        Filter policy: Allow Scan Request from Any, Allow Connect Request from Any (0x00)
        TX power: Host has no preference (0x7f)
        Primary PHY: LE 1M (0x01)
        Secondary max skip: 0x00
        Secondary PHY: LE 1M (0x01)
        SID: 0x00
        Scan request notifications: Disabled (0x00)
> HCI Event: Command Complete (0x0e) plen 5                                                                        #220 14.454746
      LE Set Extended Advertising Parameters (0x08|0x0036) ncmd 1
        Status: Success (0x00)
        TX power (selected): 0 dbm (0x00)
zephyr.exe[1553034]: < HCI Command: LE Set Advertising Set Random Address (0x08|0x0035) plen 7                     #221 14.463687
        Advertising handle: 0x00
        Advertising random address: D5:B6:CC:31:DB:3B (Static)
> HCI Event: Command Complete (0x0e) plen 4                                                                        #222 14.464392
      LE Set Advertising Set Random Address (0x08|0x0035) ncmd 1
        Status: Success (0x00)
zephyr.exe[1553034]: < HCI Command: LE Set Extended Advertising Data (0x08|0x0037) plen 22                         #223 14.483635
        Handle: 0x00
        Operation: Complete extended advertising data (0x03)
        Fragment preference: Minimize fragmentation (0x01)
        Data length: 0x12
        Flags: 0x06
          LE General Discoverable Mode
          BR/EDR Not Supported
        Name (complete): Tester_F6B11A
> HCI Event: Command Complete (0x0e) plen 4                                                                        #224 14.484718
      LE Set Extended Advertising Data (0x08|0x0037) ncmd 1
        Status: Success (0x00)
zephyr.exe[1553034]: < HCI Command: LE Set Extended Scan Response Data (0x08|0x0038) plen 4                        #225 14.503634
        Handle: 0x00
        Operation: Complete scan response data (0x03)
        Fragment preference: Minimize fragmentation (0x01)
        Data length: 0x00
> HCI Event: Command Complete (0x0e) plen 4                                                                        #226 14.504293
      LE Set Extended Scan Response Data (0x08|0x0038) ncmd 1
        Status: Success (0x00)
zephyr.exe[1553034]: < HCI Command: LE Set Extended Advertising Enable (0x08|0x0039) plen 6                        #227 14.523636
        Extended advertising: Enabled (0x01)
        Number of sets: 1 (0x01)
        Entry 0
          Handle: 0x00
          Duration: 0 ms (0x00)
          Max ext adv events: 0
> HCI Event: Command Complete (0x0e) plen 4                                                                        #228 14.524409
      LE Set Extended Advertising Enable (0x08|0x0039) ncmd 1
        Status: Success (0x00)
> HCI Event: LE Meta Event (0x3e) plen 31                                                                          #229 14.631937
      LE Enhanced Connection Complete (0x0a)
        Status: Success (0x00)
        Handle: 1137
        Role: Peripheral (0x01)
        Peer address type: Public (0x00)
        Peer address: DF:A9:FF:F6:B1:1A (OUI DF-A9-FF)
        Local resolvable private address: 00:00:00:00:00:00 (Non-Resolvable)
        Peer resolvable private address: 00:00:00:00:00:00 (Non-Resolvable)
        Connection interval: 87.50 msec (0x0046)
        Connection latency: 0 (0x0000)
        Supervision timeout: 25120 msec (0x09d0)
        Central clock accuracy: 0x01
> HCI Event: LE Meta Event (0x3e) plen 6                                                                           #230 14.632003
      LE Advertising Set Terminated (0x12)
        Status: Success (0x00)
        Handle: 0
        Connection handle: 1137
        Number of completed extended advertising events: 0
zephyr.exe[1553034]: < HCI Command: LE Read Remote Used Features (0x08|0x0016) plen 2                              #231 14.643847
        Handle: 1137 Address: DF:A9:FF:F6:B1:1A (OUI DF-A9-FF)
> HCI Event: Command Status (0x0f) plen 4                                                                          #232 14.644726
      LE Read Remote Used Features (0x08|0x0016) ncmd 1
        Status: Success (0x00)
zephyr.exe[1553034]: < ACL