Bluetooth monitor ver 5.72
= Note: Linux version 7.0.0-31-generic (x86_64)                        0.020022
= Note: Bluetooth subsystem version 2.22                               0.020024
= New Index: 00:00:00:00:00:00 (Primary,UART,hci1)              [hci1] 0.020025
= New Index: 48:5F:99:8E:E0:64 (Primary,USB,hci0)               [hci0] 0.020025
= Open Index: 00:00:00:00:00:00                                 [hci1] 0.163601
= Index Info: 00:00:00:00:00:00 (Nordic Semiconductor ASA)      [hci1] 0.163613
@ USER Open: main (privileged) version 2.22            {0x0001} [hci1] 0.163623
< HCI Command: Reset (0x03|0x0003) plen 0                    #1 [hci1] 0.164500
> HCI Event: Command Complete (0x0e) plen 4                  #2 [hci1] 0.165001
      Reset (0x03|0x0003) ncmd 1
        Status: Success (0x00)
< HCI Command: Read Local Supported... (0x04|0x0003) plen 0  #3 [hci1] 0.183364
> HCI Event: Command Complete (0x0e) plen 12                 #4 [hci1] 0.183961
      Read Local Supported Features (0x04|0x0003) ncmd 1
        Status: Success (0x00)
        Features: 0x00 0x00 0x00 0x00 0x60 0x00 0x00 0x00
          BR/EDR Not Supported
          LE Supported (Controller)
< HCI Command: Read Local Version In.. (0x04|0x0001) plen 0  #5 [hci1] 0.203301
> HCI Event: Command Complete (0x0e) plen 12                 #6 [hci1] 0.203825
      Read Local Version Information (0x04|0x0001) ncmd 1
        Status: Success (0x00)
        HCI version: Reserved (0x11) - Revision 12345 (0x3039)
        LMP version: Reserved (0x11) - Subversion 12345 (0x3039)
        Manufacturer: Nordic Semiconductor ASA (89)
< HCI Command: Read Local Supported... (0x04|0x0002) plen 0  #7 [hci1] 0.223272
> HCI Event: Command Complete (0x0e) plen 68                 #8 [hci1] 0.224314
      Read Local Supported Commands (0x04|0x0002) ncmd 1
        Status: Success (0x00)
        Commands: 115 entries
          Disconnect (Octet 0 - Bit 5)
          Read Remote Version Information (Octet 2 - Bit 7)
          Set Event Mask (Octet 5 - Bit 6)
          Reset (Octet 5 - Bit 7)
          Read Connection Accept Timeout (Octet 7 - Bit 2)
          Write Connection Accept Timeout (Octet 7 - Bit 3)
          Read Transmit Power Level (Octet 10 - Bit 2)
          Set Controller To Host Flow Control (Octet 10 - Bit 5)
          Host Buffer Size (Octet 10 - Bit 6)
          Host Number of Completed Packets (Octet 10 - Bit 7)
          Read Local Version Information (Octet 14 - Bit 3)
          Read Local Supported Features (Octet 14 - Bit 5)
          Read BD ADDR (Octet 15 - Bit 1)
          Read RSSI (Octet 15 - Bit 5)
          Set Event Mask Page 2 (Octet 22 - Bit 2)
          LE Set Event Mask (Octet 25 - Bit 0)
          LE Read Buffer Size (Octet 25 - Bit 1)
          LE Read Local Supported Features (Octet 25 - Bit 2)
          LE Set Random Address (Octet 25 - Bit 4)
          LE Set Advertising Parameters (Octet 25 - Bit 5)
          LE Read Advertising Channel TX Power (Octet 25 - Bit 6)
          LE Set Advertising Data (Octet 25 - Bit 7)
          LE Set Scan Response Data (Octet 26 - Bit 0)
          LE Set Advertise Enable (Octet 26 - Bit 1)
          LE Set Scan Parameters (Octet 26 - Bit 2)
          LE Set Scan Enable (Octet 26 - Bit 3)
          LE Create Connection (Octet 26 - Bit 4)
          LE Create Connection Cancel (Octet 26 - Bit 5)
          LE Read Accept List Size (Octet 26 - Bit 6)
          LE Clear Accept List (Octet 26 - Bit 7)
          LE Add Device To Accept List (Octet 27 - Bit 0)
          LE Remove Device From Accept List (Octet 27 - Bit 1)
          LE Connection Update (Octet 27 - Bit 2)
          LE Set Host Channel Classification (Octet 27 - Bit 3)
          LE Read Channel Map (Octet 27 - Bit 4)
          LE Read Remote Used Features (Octet 27 - Bit 5)
          LE Encrypt (Octet 27 - Bit 6)
          LE Rand (Octet 27 - Bit 7)
          LE Start Encryption (Octet 28 - Bit 0)
          LE Long Term Key Request Reply (Octet 28 - Bit 1)
          LE Long Term Key Request Neg Reply (Octet 28 - Bit 2)
          LE Read Supported States (Octet 28 - Bit 3)
          Read Authenticated Payload Timeout (Octet 32 - Bit 4)
          Write Authenticated Payload Timeout (Octet 32 - Bit 5)
          LE Set Data Length (Octet 33 - Bit 6)
          LE Read Suggested Default Data Length (Octet 33 - Bit 7)
          LE Write Suggested Default Data Length (Octet 34 - Bit 0)
          LE Add Device To Resolving List (Octet 34 - Bit 3)
          LE Remove Device From Resolving List (Octet 34 - Bit 4)
          LE Clear Resolving List (Octet 34 - Bit 5)
          LE Read Resolving List Size (Octet 34 - Bit 6)
          LE Set Address Resolution Enable (Octet 35 - Bit 1)
          LE Set Resolvable Private Address Timeout (Octet 35 - Bit 2)
          LE Read Maximum Data Length (Octet 35 - Bit 3)
          LE Read PHY (Octet 35 - Bit 4)
          LE Set Default PHY (Octet 35 - Bit 5)
          LE Set PHY (Octet 35 - Bit 6)
          LE Set Advertising Set Random Address (Octet 36 - Bit 1)
          LE Set Extended Advertising Parameters (Octet 36 - Bit 2)
          LE Set Extended Advertising Data (Octet 36 - Bit 3)
          LE Set Extended Scan Response Data (Octet 36 - Bit 4)
          LE Set Extended Advertising Enable (Octet 36 - Bit 5)
          LE Read Maximum Advertising Data Length (Octet 36 - Bit 6)
          LE Read Number of Supported Advertising Sets (Octet 36 - Bit 7)
          LE Remove Advertising Set (Octet 37 - Bit 0)
          LE Clear Advertising Sets (Octet 37 - Bit 1)
          LE Set Periodic Advertising Parameters (Octet 37 - Bit 2)
          LE Set Periodic Advertising Data (Octet 37 - Bit 3)
          LE Set Periodic Advertising Enable (Octet 37 - Bit 4)
          LE Set Extended Scan Parameters (Octet 37 - Bit 5)
          LE Set Extended Scan Enable (Octet 37 - Bit 6)
          LE Extended Create Connection (Octet 37 - Bit 7)
          LE Periodic Advertising Create Sync (Octet 38 - Bit 0)
          LE Periodic Advertising Create Sync Cancel (Octet 38 - Bit 1)
          LE Periodic Advertising Terminate Sync (Octet 38 - Bit 2)
          LE Add Device To Periodic Advertiser List (Octet 38 - Bit 3)
          LE Remove Device From Periodic Advertiser List (Octet 38 - Bit 4)
          LE Clear Periodic Advertiser List (Octet 38 - Bit 5)
          LE Read Periodic Advertiser List Size (Octet 38 - Bit 6)
          LE Read Transmit Power (Octet 38 - Bit 7)
          LE Read RF Path Compensation (Octet 39 - Bit 0)
          LE Write RF Path Compensation (Octet 39 - Bit 1)
          LE Set Privacy Mode (Octet 39 - Bit 2)
          LE Periodic Advertising Receive Enable (Octet 40 - Bit 5)
          LE Periodic Advertising Sync Transfer (Octet 40 - Bit 6)
          LE Periodic Advertising Set Info Transfer (Octet 40 - Bit 7)
          LE Periodic Advertising Sync Transfer Parameters (Octet 41 - Bit 0)
          LE Set Default Periodic Advertisng Sync Transfer Parameters (Octet 41 - Bit 1)
          LE Read Buffer v2 (Octet 41 - Bit 5)
          LE Read ISO TX Sync (Octet 41 - Bit 6)
          LE Set Connected Isochronous Group Parameters (Octet 41 - Bit 7)
          LE Set Connected Isochronous Group Parameters Test (Octet 42 - Bit 0)
          LE Create Connected Isochronous Stream (Octet 42 - Bit 1)
          LE Remove Connected Isochronous Group (Octet 42 - Bit 2)
          LE Accept Connected Isochronous Stream Request (Octet 42 - Bit 3)
          LE Reject Connected Isochronous Stream Request (Octet 42 - Bit 4)
          LE Create Broadcast Isochronous Group (Octet 42 - Bit 5)
          LE Create Broadcast Isochronous Group Test (Octet 42 - Bit 6)
          LE Terminate Broadcast Isochronous Group (Octet 42 - Bit 7)
          LE Broadcast Isochronous Group Create Sync (Octet 43 - Bit 0)
          LE Broadcast Isochronous Group Terminate Sync (Octet 43 - Bit 1)
          LE Request Peer SCA (Octet 43 - Bit 2)
          LE Setup Isochronous Data Path (Octet 43 - Bit 3)
          LE Remove Isochronous Data Path (Octet 43 - Bit 4)
          LE Isochronous Transmit Test (Octet 43 - Bit 5)
          LE Isochronous Receive Test (Octet 43 - Bit 6)
          LE Isochronous Read Test Counters (Octet 43 - Bit 7)
          LE Isochronous Read Test Counters (Octet 44 - Bit 0)
          LE Set Host Feature (Octet 44 - Bit 1)
          Octet 44 - Bit 2 
          Octet 45 - Bit 6 
          Octet 46 - Bit 0 
          Octet 46 - Bit 1 
          Octet 46 - Bit 2 
          Octet 47 - Bit 4 
< HCI Command: Host Buffer Size (0x03|0x0033) plen 7         #9 [hci1] 0.243297
        ACL MTU: 255  ACL max packet: 16
        SCO MTU: 0    SCO max packet: 0
> HCI Event: Command Complete (0x0e) plen 4                 #10 [hci1] 0.243850
      Host Buffer Size (0x03|0x0033) ncmd 1
        Status: Success (0x00)
< HCI Command: Set Controller To Ho.. (0x03|0x0031) plen 1  #11 [hci1] 0.263283
        Flow control: ACL Data Packets (0x01)
> HCI Event: Command Complete (0x0e) plen 4                 #12 [hci1] 0.263737
      Set Controller To Host Flow Control (0x03|0x0031) ncmd 1
        Status: Success (0x00)
< HCI Command: LE Read Local Suppor.. (0x08|0x0003) plen 0  #13 [hci1] 0.283296
> HCI Event: Command Complete (0x0e) plen 12                #14 [hci1] 0.283857
      LE Read Local Supported Features (0x08|0x0003) ncmd 1
        Status: Success (0x00)
        Features: 0xfd 0x79 0x00 0xf7 0x30 0x01 0x00 0x00
          LE Encryption
          Extended Reject Indication
          Peripheral-initiated Features Exchange
          LE Ping
          LE Data Packet Length Extension
          LL Privacy
          Extended Scanner Filter Policies
          LE 2M PHY
          LE Coded PHY
          LE Extended Advertising
          LE Periodic Advertising
          Channel Selection Algorithm #2
          Periodic Advertising Sync Transfer - Sender
          Periodic Advertising Sync Transfer - Recipient
          Sleep Clock Accuracy Updates
          Connected Isochronous Stream - Central
          Connected Isochronous Stream - Peripheral
          Isochronous Broadcaster
          Synchronized Receiver
          Periodic Advertising ADI support
          Connection Subrating
          Unknown features (0x0000010000000000)
< HCI Command: LE Set Host Feature (0x08|0x0074) plen 2     #15 [hci1] 0.303306
        Bit Number: 32
          Connected Isochronous Stream (Host Support)
        Bit Value: 1
> HCI Event: Command Complete (0x0e) plen 4                 #16 [hci1] 0.303854
      LE Set Host Feature (0x08|0x0074) ncmd 1
        Status: Success (0x00)
< HCI Command: LE Read Buffer v2 (0x08|0x0060) plen 0       #17 [hci1] 0.323300
> HCI Event: Command Complete (0x0e) plen 10                #18 [hci1] 0.323762
      LE Read Buffer v2 (0x08|0x0060) ncmd 1
        Status: Success (0x00)
        ACL MTU: 27
        ACL max packet: 3
        ISO MTU: 318
        ISO max packet: 3
< HCI Command: LE Read Maximum Adve.. (0x08|0x003a) plen 0  #19 [hci1] 0.343342
> HCI Event: Command Complete (0x0e) plen 6                 #20 [hci1] 0.343854
      LE Read Maximum Advertising Data Length (0x08|0x003a) ncmd 1
        Status: Success (0x00)
        Max length: 1650
< HCI Command: LE Read Supported St.. (0x08|0x001c) plen 0  #21 [hci1] 0.363316
> HCI Event: Command Complete (0x0e) plen 12                #22 [hci1] 0.363934
      LE Read Supported States (0x08|0x001c) ncmd 1
        Status: Success (0x00)
        States: 0x000003ff3e0306ff
          Non-connectable Advertising State
          Scannable Advertising State
          Connectable Advertising State
          High Duty Cycle Directed Advertising State
          Passive Scanning State
          Active Scanning State
          Initiating State
            and Connection State (Central Role)
          Connection State (Peripheral Role)
          Scannable Advertising State
            and Passive Scanning State
          Connectable Advertising State
            and Passive Scanning State
          Non-connectable Advertising State
            and Initiating State
          Scannable Advertising State
            and Initiating State
          Active Scanning State
            and Connection State (Central Role)
          Passive Scanning State
            and Connection State (Peripheral Role)
          Active Scanning State
            and Connection State (Peripheral Role)
          Initiating State
            and Connection State (Central Role)
            and Central Role & Central Role
          Low Duty Cycle Directed Advertising State
          Connectable Advertising State
            and Initiating State
            and Central Role & Peripheral Role
          High Duty Cycle Directed Advertising State
            and Initiating State
            and Central Role & Peripheral Role
          Low Duty Cycle Directed Advertising State
            and Initiating State
            and Central Role & Peripheral Role
          Connectable Advertising State
            and Connection State (Central Role)
            and Central Role & Peripheral Role
          High Duty Cycle Directed Advertising State
            and Connection State (Central Role)
            and Central Role & Peripheral Role
          Low Duty Cycle Directed Advertising State
            and Connection State (Central Role)
            and Central Role & Peripheral Role
          Connectable Advertising State
            and Connection State (Peripheral Role)
            and Central Role & Peripheral Role
          High Duty Cycle Directed Advertising State
            and Connection State (Peripheral Role)
            and Peripheral Role & Peripheral Role
          Low Duty Cycle Directed Advertising State
            and Connection State (Peripheral Role)
            and Peripheral Role & Peripheral Role
          Initiating State
            and Connection State (Peripheral Role)
            and Central Role & Peripheral Role
< HCI Command: LE Read Maximum Data.. (0x08|0x002f) plen 0  #23 [hci1] 0.383354
> HCI Event: Command Complete (0x0e) plen 12                #24 [hci1] 0.383849
      LE Read Maximum Data Length (0x08|0x002f) ncmd 1
        Status: Success (0x00)
        Max TX octets: 251
        Max TX time: 2704
        Max RX octets: 251
        Max RX time: 2704
< HCI Command: LE Write Suggested D.. (0x08|0x0024) plen 4  #25 [hci1] 0.403312
        TX octets: 251
        TX time: 2704
> HCI Event: Command Complete (0x0e) plen 4                 #26 [hci1] 0.403873
      LE Write Suggested Default Data Length (0x08|0x0024) ncmd 1
        Status: Success (0x00)
< HCI Command: LE Read Resolving Li.. (0x08|0x002a) plen 0  #27 [hci1] 0.423318
> HCI Event: Command Complete (0x0e) plen 5                 #28 [hci1] 0.423789
      LE Read Resolving List Size (0x08|0x002a) ncmd 1
        Status: Success (0x00)
        Size: 8
< HCI Command: LE Set Host Feature (0x08|0x0074) plen 2     #29 [hci1] 0.443322
        Bit Number: 38
          Connection Subrating (Host Support)
        Bit Value: 1
> HCI Event: Command Complete (0x0e) plen 4                 #30 [hci1] 0.443761
      LE Set Host Feature (0x08|0x0074) ncmd 1
        Status: Success (0x00)
< HCI Command: LE Set Event Mask (0x08|0x0001) plen 8       #31 [hci1] 0.463314
        Mask: 0x000002063f87fa5e
          LE Advertising Report
          LE Connection Update Complete
          LE Read Remote Used Features Complete
          LE Long Term Key Request
          LE Data Length Change
          LE Enhanced Connection Complete
          LE PHY Update Complete
          LE Extended Advertising Report
          LE Periodic Advertising Sync Established
          LE Periodic Advertising Report
          LE Periodic Advertising Sync Lost
          LE Extended Scan Timeout
          LE Extended Advertising Set Terminated
          LE Scan Request Received
          LE Periodic Advertising Sync Transfer Rvc
          LE CIS Established
          LE CIS Request
          LE Create BIG Complete
          LE Terminate BIG Complete
          LE BIG Sync Estabilished Complete
          LE BIG Sync Lost
          LE BIG Info Advertising Report
          LE Subrate Change
          Unknown mask (0x0000020000000000)
> HCI Event: Command Complete (0x0e) plen 4                 #32 [hci1] 0.463871
      LE Set Event Mask (0x08|0x0001) ncmd 1
        Status: Success (0x00)
< HCI Command: Set Event Mask (0x03|0x0001) plen 8          #33 [hci1] 0.483329
        Mask: 0x2000800002008890
          Disconnection Complete
          Encryption Change
          Read Remote Version Information Complete
          Hardware Error
          Data Buffer Overflow
          Encryption Key Refresh Complete
          LE Meta
> HCI Event: Command Complete (0x0e) plen 4                 #34 [hci1] 0.483850
      Set Event Mask (0x03|0x0001) ncmd 1
        Status: Success (0x00)
< HCI Command: Read BD ADDR (0x04|0x0009) plen 0            #35 [hci1] 0.503319
> HCI Event: Command Complete (0x0e) plen 10                #36 [hci1] 0.503819
      Read BD ADDR (0x04|0x0009) ncmd 1
        Status: Success (0x00)
        Address: 00:00:00:00:00:00 (OUI 00-00-00)
< HCI Command: LE Set Random Address (0x08|0x0005) plen 6   #37 [hci1] 0.523335
        Address: D5:B6:CC:31:DB:3B (Static)
> HCI Event: Command Complete (0x0e) plen 4                 #38 [hci1] 0.523862
      LE Set Random Address (0x08|0x0005) ncmd 1
        Status: Success (0x00)
< HCI Command: LE Set Extended Adv.. (0x08|0x0036) plen 25  #39 [hci1] 1.483371
        Handle: 0x00
        Properties: 0x0001
          Connectable
        Min advertising interval: 100.000 msec (0x00a0)
        Max advertising interval: 150.000 msec (0x00f0)
        Channel map: 37, 38, 39 (0x07)
        Own address type: Random (0x01)
        Peer address type: Public (0x00)
        Peer address: 00:00:00:00:00:00 (OUI 00-00-00)
        Filter policy: Allow Scan Request from Any, Allow Connect Request from Any (0x00)
        TX power: Host has no preference (0x7f)
        Primary PHY: LE 1M (0x01)
        Secondary max skip: 0x00
        Secondary PHY: LE 2M (0x02)
        SID: 0x00
        Scan request notifications: Disabled (0x00)
> HCI Event: Command Complete (0x0e) plen 5                 #40 [hci1] 1.484217
      LE Set Extended Advertising Parameters (0x08|0x0036) ncmd 1
        Status: Success (0x00)
        TX power (selected): 0 dbm (0x00)
< HCI Command: LE Set Advertising S.. (0x08|0x0035) plen 7  #41 [hci1] 1.503314
        Advertising handle: 0x00
        Advertising random address: D5:B6:CC:31:DB:3B (Static)
> HCI Event: Command Complete (0x0e) plen 4                 #42 [hci1] 1.503904
      LE Set Advertising Set Random Address (0x08|0x0035) ncmd 1
        Status: Success (0x00)
< HCI Command: LE Set Extended Adv.. (0x08|0x0037) plen 30  #43 [hci1] 1.523327
        Handle: 0x00
        Operation: Complete extended advertising data (0x03)
        Fragment preference: Minimize fragmentation (0x01)
        Data length: 0x1a
        Flags: 0x06
          LE General Discoverable Mode
          BR/EDR Not Supported
        Service Data: Common Audio (0x1853)
          Data: 01
        Service Data: Audio Stream Control (0x184e)
          Data: 014400400000
        Resolvable Set Identifier: 48-61-8E-0C-80-97
          Hash: 0x c8097
          Random: 0x48618e
> HCI Event: Command Complete (0x0e) plen 4                 #44 [hci1] 1.524182
      LE Set Extended Advertising Data (0x08|0x0037) ncmd 1
        Status: Success (0x00)
< HCI Command: LE Set Extended Adve.. (0x08|0x0039) plen 6  #45 [hci1] 1.543326
        Extended advertising: Enabled (0x01)
        Number of sets: 1 (0x01)
        Entry 0
          Handle: 0x00
          Duration: 0 ms (0x00)
          Max ext adv events: 0
> HCI Event: Command Complete (0x0e) plen 4                 #46 [hci1] 1.543865
      LE Set Extended Advertising Enable (0x08|0x0039) ncmd 1
        Status: Success (0x00)
> HCI Event: LE Meta Event (0x3e) plen 31                   #47 [hci1] 3.560437
      LE Enhanced Connection Complete (0x0a)
        Status: Success (0x00)
        Handle: 2325
        Role: Peripheral (0x01)
        Peer address type: Public (0x00)
        Peer address: DF:A9:FF:F6:B1:1A (OUI DF-A9-FF)
        Local resolvable private address: 00:00:00:00:00:00 (Non-Resolvable)
        Peer resolvable private address: 00:00:00:00:00:00 (Non-Resolvable)
        Connection interval: 150.00 msec (0x0078)
        Connection latency: 0 (0x0000)
        Supervision timeout: 25120 msec (0x09d0)
        Central clock accuracy: 0x01
> HCI Event: LE Meta Event (0x3e) plen 6                    #48 [hci1] 3.560510
      LE Advertising Set Terminated (0x12)
        Status: Success (0x00)
        Handle: 0
        Connection handle: 2325
        Number of completed extended advertising events: 0
< HCI Command: LE Read Remote Used... (0x08|0x0016) plen 2  #49 [hci1] 3.563631
        Handle: 2325 Address: DF:A9:FF:F6:B1:1A (OUI DF-A9-FF)
< ACL Data TX: Handle 2325 flags 0x00 dlen 7                #50 [hci1] 3.563641
      ATT: Exchange MTU Request (0x02) len 2
        Client RX MTU: 251
> HCI Event: Command Status (0x0f) plen 4                   #51 [hci1] 3.564094
      LE Read Remote Used Features (0x08|0x0016) ncmd 1
        Status: Success (0x00)
< HCI Command: LE Remove Advertisin.. (0x08|0x003c) plen 1  #52 [hci1] 3.663390
        Handle: 0
> HCI Event: Command Complete (0x0e) plen 4                 #53 [hci1] 3.663817
      LE Remove Advertising Set (0x08|0x003c) ncmd 1
        Status: Success (0x00)
< HCI Command: LE Set Extended Adv.. (0x08|0x0036) plen 25  #54 [hci1] 3.683394
        Handle: 0x00
        Properties: 0x0001
          Connectable
        Min advertising interval: 100.000 msec (0x00a0)
        Max advertising interval: 150.000 msec (0x00f0)
        Channel map: 37, 38, 39 (0x07)
        Own address type: Random (0x01)
        Peer address type: Public (0x00)
        Peer address: 00:00:00:00:00:00 (OUI 00-00-00)
        Filter policy: Allow Scan Request from Any, Allow Connect Request from Any (0x00)
        TX power: Host has no preference (0x7f)
        Primary PHY: LE 1M (0x01)
        Secondary max skip: 0x00
        Secondary PHY: LE 2M (0x02)
        SID: 0x01
        Scan request notifications: Disabled (0x00)
> HCI Event: Command Complete (0x0e) plen 5                 #55 [hci1] 3.684213
      LE Set Extended Advertising Parameters (0x08|0x0036) ncmd 1
        Status: Success (0x00)
        TX power (selected): 0 dbm (0x00)
< HCI Command: LE Set Advertising S.. (0x08|0x0035) plen 7  #56 [hci1] 3.703391
        Advertising handle: 0x00
        Advertising random address: D5:B6:CC:31:DB:3B (Static)
> HCI Event: Command Complete (0x0e) plen 4                 #57 [hci1] 3.703920
      LE Set Advertising Set Random Address (0x08|0x0035) ncmd 1
        Status: Success (0x00)
< HCI Command: LE Set Extended Adv.. (0x08|0x0037) plen 22  #58 [hci1] 3.723351
        Handle: 0x00
        Operation: Complete extended advertising data (0x03)
        Fragment preference: Minimize fragmentation (0x01)
        Data length: 0x12
        Flags: 0x06
          LE General Discoverable Mode
          BR/EDR Not Supported
        Name (complete): Tester_F6B11A
> HCI Event: Command Complete (0x0e) plen 4                 #59 [hci1] 3.724082
      LE Set Extended Advertising Data (0x08|0x0037) ncmd 1
        Status: Success (0x00)
< HCI Command: LE Set Extended Adve.. (0x08|0x0039) plen 6  #60 [hci1] 3.743378
        Extended advertising: Enabled (0x01)
        Number of sets: 1 (0x01)
        Entry 0
          Handle: 0x00
          Duration: 0 ms (0x00)
          Max ext adv events: 0
> HCI Event: Command Complete (0x0e) plen 4                 #61 [hci1] 3.743958
      LE Set Extended Advertising Enable (0x08|0x0039) ncmd 1
        Status: Success (0x00)
> HCI Event: Number of Completed Packets (0x13) plen 5      #62 [hci1] 3.862415
        Num handles: 1
        Handle: 2325 Address: DF:A9:FF:F6:B1:1A (OUI DF-A9-FF)
        Count: 1
        #50: len 7 (0 Kb/s)
        Latency: 298 msec (298-298 msec ~298 msec)
> HCI Event: LE Meta Event (0x3e) plen 12                   #63 [hci1] 4.012669
      LE Read Remote Used Features (0x04)
        Status: Success (0x00)
        Handle: 2325 Address: DF:A9:FF:F6:B1:1A (OUI DF-A9-FF)
        Features: 0x2d 0x49 0x00 0xf7 0x67 0xd9 0x00 0x80
          LE Encryption
          Extended Reject Indication
          Peripheral-initiated Features Exchange
          LE Data Packet Length Extension
          LE 2M PHY
          LE Coded PHY
          Channel Selection Algorithm #2
          Periodic Advertising Sync Transfer - Sender
          Periodic Advertising Sync Transfer - Recipient
          Sleep Clock Accuracy Updates
          Connected Isochronous Stream - Central
          Connected Isochronous Stream - Peripheral
          Isochronous Broadcaster
          Synchronized Receiver
          Connected Isochronous Stream (Host Support)
          LE Power Control Request
          LE Power Control Request
          Connection Subrating
          Connection Subrating (Host Support)
          Unknown features (0x8000d90000000000)
> ACL Data RX: Handle 2325 flags 0x02 dlen 7                #64 [hci1] 4.762472
      ATT: Exchange MTU Request (0x02) len 2
        Client RX MTU: 64
> ACL Data RX: Handle 2325 flags 0x02 dlen 7                #65 [hci1] 4.762899
      ATT: Exchange MTU Response (0x03) len 2
        Server RX MTU: 64
< HCI Command: Host Number of Compl.. (0x03|0x0035) plen 5  #66 [hci1] 4.763304
        Num handles: 1
        Handle: 2325 Address: DF:A9:FF:F6:B1:1A (OUI DF-A9-FF)
        Count: 1
< ACL Data TX: Handle 2325 flags 0x00 dlen 7                #67 [hci1] 4.763369
      ATT: Exchange MTU Response (0x03) len 2
        Server RX MTU: 251
< HCI Command: Host Number of Compl.. (0x03|0x0035) plen 5  #68 [hci1] 4.763513
        Num handles: 1
        Handle: 2325 Address: DF:A9:FF:F6:B1:1A (OUI DF-A9-FF)
        Count: 1
> HCI Event: Number of Completed Packets (0x13) plen 5      #69 [hci1] 5.062484
        Num handles: 1
        Handle: 2325 Address: DF:A9:FF:F6:B1:1A (OUI DF-A9-FF)
        Count: 1
        #67: len 7 (0 Kb/s)
        Latency: 299 msec (298-299 msec ~298 msec)
> ACL Data RX: Handle 2325 flags 0x02 dlen 11               #70 [hci1] 7.012467
      SMP: Pairing Request (0x01) len 6
        IO capability: KeyboardDisplay (0x04)
        OOB data: Authentication data not present (0x00)
        Authentication requirement: Bonding, No MITM, SC, No Keypresses (0x09)
        Max encryption key size: 16
        Initiator key distribution: EncKey IdKey Sign (0x07)
        Responder key distribution: EncKey IdKey Sign (0x07)
< HCI Command: Host Number of Compl.. (0x03|0x0035) plen 5  #71 [hci1] 7.023542
        Num handles: 1
        Handle: 2325 Address: DF:A9:FF:F6:B1:1A (OUI DF-A9-FF)
        Count: 1
< ACL Data TX: Handle 2325 flags 0x00 dlen 11               #72 [hci1] 7.023626
      SMP: Pairing Response (0x02) len 6
        IO capability: NoInputNoOutput (0x03)
        OOB data: Authentication data not present (0x00)
        Authentication requirement: Bonding, No MITM, SC, No Keypresses (0x09)
        Max encryption key size: 16
        Initiator key distribution: IdKey (0x02)
        Responder key distribution: <none> (0x00)
> HCI Event: Number of Completed Packets (0x13) plen 5      #73 [hci1] 7.312588
        Num handles: 1
        Handle: 2325 Address: DF:A9:FF:F6:B1:1A (OUI DF-A9-FF)
        Count: 1
        #72: len 11 (0 Kb/s)
        Latency: 288 msec (288-299 msec ~293 msec)
> ACL Data RX: Handle 2325 flags 0x02 dlen 27               #74 [hci1] 7.312801
> ACL Data RX: Handle 2325 flags 0x01 dlen 27               #75 [hci1] 7.313160
< HCI Command: Host Number of Compl.. (0x03|0x0035) plen 5  #76 [hci1] 7.323689
        Num handles: 1
        Handle: 2325 Address: DF:A9:FF:F6:B1:1A (OUI DF-A9-FF)
        Count: 1
> ACL Data RX: Handle 2325 flags 0x01 dlen 15               #77 [hci1] 7.462505
      SMP: Pairing Public Key (0x0c) len 64
        X: 64a382392a5ea02ec565a3e8d2d9700cd08d8d0071dd7afd4f8848a6cf400907
        Y: 2116992c4a759c8beca102129fabe01451241dced576f2b7edd714b1a30123d4
< HCI Command: Host Number of Compl.. (0x03|0x0035) plen 5  #78 [hci1] 7.463567
        Num handles: 1
        Handle: 2325 Address: DF:A9:FF:F6:B1:1A (OUI DF-A9-FF)
        Count: 1
< HCI Command: Host Number of Compl.. (0x03|0x0035) plen 5  #79 [hci1] 7.463753
        Num handles: 1
        Handle: 2325 Address: DF:A9:FF:F6:B1:1A (OUI DF-A9-FF)
        Count: 1
< ACL Data TX: Handle 2325 flags 0x00 dlen 27               #80 [hci1] 7.463793
< ACL Data TX: Handle 2325 flags 0x01 dlen 27               #81 [hci1] 7.463798
< ACL Data TX: Handle 2325 flags 0x01 dlen 15               #82 [hci1] 7.463814
      SMP: Pairing Public Key (0x0c) len 64
        X: 98308440221e2d910f0e54b71e7ec652857aa9b5a0dc65028824cc19db1226e9
        Y: 67a4816bcb62efb21701e31fdb27561a6217575fb007a8bbdabe7e28b6f68482
> HCI Event: Number of Completed Packets (0x13) plen 5      #83 [hci1] 7.612778
        Num handles: 1
        Handle: 2325 Address: DF:A9:FF:F6:B1:1A (OUI DF-A9-FF)
        Count: 1
        #80: len 27 (1 Kb/s)
        Latency: 148 msec (148-299 msec ~221 msec)
> HCI Event: Number of Completed Packets (0x13) plen 5      #84 [hci1] 7.613309
        Num handles: 1
        Handle: 2325 Address: DF:A9:FF:F6:B1:1A (OUI DF-A9-FF)
        Count: 1
        #81: len 27 (1 Kb/s)
        Latency: 149 msec (148-299 msec ~185 msec)
< ACL Data TX: Handle 2325 flags 0x00 dlen 21               #85 [hci1] 7.623704
      SMP: Pairing Confirm (0x03) len 16
        Confim value: c934336353fd11de62dfe8581f36052f
> HCI Event: Number of Completed Packets (0x13) plen 5      #86 [hci1] 7.762499
        Num handles: 1
        Handle: 2325 Address: DF:A9:FF:F6:B1:1A (OUI DF-A9-FF)
        Count: 1
        #82: len 15 (0 Kb/s)
        Latency: 298 msec (148-299 msec ~242 msec)
> HCI Event: Number of Completed Packets (0x13) plen 5      #87 [hci1] 7.912528
        Num handles: 1
        Handle: 2325 Address: DF:A9:FF:F6:B1:1A (OUI DF-A9-FF)
        Count: 1
        #85: len 21 (0 Kb/s)
        Latency: 288 msec (148-299 msec ~265 msec)
> ACL Data RX: Handle 2325 flags 0x02 dlen 21               #88 [hci1] 7.912737
      SMP: Pairing Random (0x04) len 16
        Random value: d8ee98f22b2eef270000000000000000
< HCI Command: Host Number of Compl.. (0x03|0x0035) plen 5  #89 [hci1] 7.923943
        Num handles: 1
        Handle: 2325 Address: DF:A9:FF:F6:B1:1A (OUI DF-A9-FF)
        Count: 1
< ACL Data TX: Handle 2325 flags 0x00 dlen 21               #90 [hci1] 7.924043
      SMP: Pairing Random (0x04) len 16
        Random value: f966a694cbe26df70bb96773e6cc6f5d
> HCI Event: Number of Completed Packets (0x13) plen 5      #91 [hci1] 8.212370
        Num handles: 1
        Handle: 2325 Address: DF:A9:FF:F6:B1:1A (OUI DF-A9-FF)
        Count: 1
        #90: len 21 (0 Kb/s)
        Latency: 288 msec (148-299 msec ~276 msec)
> ACL Data RX: Handle 2325 flags 0x02 dlen 21               #92 [hci1] 8.362680
      SMP: Pairing DHKey Check (0x0d) len 16
        E: bfa27fb02ec864670e26ea4125cc5673
< HCI Command: Host Number of Compl.. (0x03|0x0035) plen 5  #93 [hci1] 8.363518
        Num handles: 1
        Handle: 2325 Address: DF:A9:FF:F6:B1:1A (OUI DF-A9-FF)
        Count: 1
< ACL Data TX: Handle 2325 flags 0x00 dlen 21               #94 [hci1] 8.363562
      SMP: Pairing DHKey Check (0x0d) len 16
        E: ddaff277807e0beeb232fd4b030c1575
> HCI Event: Number of Completed Packets (0x13) plen 5      #95 [hci1] 8.662308
        Num handles: 1
        Handle: 2325 Address: DF:A9:FF:F6:B1:1A (OUI DF-A9-FF)
        Count: 1
        #94: len 21 (0 Kb/s)
        Latency: 298 msec (148-299 msec ~287 msec)
> HCI Event: LE Meta Event (0x3e) plen 13                   #96 [hci1] 8.812779
      LE Long Term Key Request (0x05)
        Handle: 2325 Address: DF:A9:FF:F6:B1:1A (OUI DF-A9-FF)
        Random number: 0x0000000000000000
        Encrypted diversifier: 0x0000
< HCI Command: LE Long Term Key Re.. (0x08|0x001a) plen 18  #97 [hci1] 8.823401
        Handle: 2325 Address: DF:A9:FF:F6:B1:1A (OUI DF-A9-FF)
        Long term key: ec2230182347b44ab334c8e8c5c55bd7
> HCI Event: Command Complete (0x0e) plen 6                 #98 [hci1] 8.824141
      LE Long Term Key Request Reply (0x08|0x001a) ncmd 1
        Status: Success (0x00)
        Handle: 2325 Address: DF:A9:FF:F6:B1:1A (OUI DF-A9-FF)
> HCI Event: Encryption Change (0x08) plen 4                #99 [hci1] 9.562527
        Status: Success (0x00)
        Handle: 2325 Address: DF:A9:FF:F6:B1:1A (OUI DF-A9-FF)
        Encryption: Enabled with AES-CCM (0x01)
< ACL Data TX: Handle 2325 flags 0x00 dlen 11              #100 [hci1] 9.673942
      ATT: Read By Type Request (0x08) len 6
        Handle range: 0x0001-0xffff
        Attribute type: Central Address Resolution (0x2aa6)
> ACL Data RX: Handle 2325 flags 0x02 dlen 21              #101 [hci1] 9.712635
      SMP: Identity Information (0x08) len 16
        Identity resolving key: 3ccaffb4cc4e16c5d5c15483739edbd7
< HCI Command: Host Number of Comp.. (0x03|0x0035) plen 5  #102 [hci1] 9.723720
        Num handles: 1
        Handle: 2325 Address: DF:A9:FF:F6:B1:1A (OUI DF-A9-FF)
        Count: 1
> HCI Event: Number of Completed Packets (0x13) plen 5     #103 [hci1] 9.862441
        Num handles: 1
        Handle: 2325 Address: DF:A9:FF:F6:B1:1A (OUI DF-A9-FF)
        Count: 1
        #100: len 11 (0 Kb/s)
        Latency: 188 msec (148-299 msec ~238 msec)
> ACL Data RX: Handle 2325 flags 0x02 dlen 12             #104 [hci1] 10.012555
      SMP: Identity Address Information (0x09) len 7
        Address: DF:A9:FF:F6:B1:1A (OUI DF-A9-FF)
< HCI Command: LE Set Extended Ad.. (0x08|0x0039) plen 6  #105 [hci1] 10.023833
        Extended advertising: Disabled (0x00)
        Number of sets: 1 (0x01)
        Entry 0
          Handle: 0x00
          Duration: 0 ms (0x00)
          Max ext adv events: 0
> HCI Event: Command Complete (0x0e) plen 4               #106 [hci1] 10.024370
      LE Set Extended Advertising Enable (0x08|0x0039) ncmd 1
        Status: Success (0x00)
< HCI Command: LE Add Device To... (0x08|0x0027) plen 39  #107 [hci1] 10.043725
        Address type: Public (0x00)
        Address: DF:A9:FF:F6:B1:1A (OUI DF-A9-FF)
        Peer identity resolving key: 3ccaffb4cc4e16c5d5c15483739edbd7
        Local identity resolving key: 00000000000000000000000000000000
> HCI Event: Command Complete (0x0e) plen 4               #108 [hci1] 10.044746
      LE Add Device To Resolving List (0x08|0x0027) ncmd 1
        Status: Success (0x00)
< HCI Command: LE Set Privacy Mode (0x08|0x004e) plen 8   #109 [hci1] 10.063438
        Peer Identity address type: Public (0x00)
        Peer Identity address: DF:A9:FF:F6:B1:1A (OUI DF-A9-FF)
        Privacy Mode: Use Device Privacy (0x01)
> HCI Event: Command Complete (0x0e) plen 4               #110 [hci1] 10.064021
      LE Set Privacy Mode (0x08|0x004e) ncmd 1
        Status: Success (0x00)
< HCI Command: LE Set Address Res.. (0x08|0x002d) plen 1  #111 [hci1] 10.083385
        Address resolution: Enabled (0x01)
> HCI Event: Command Complete (0x0e) plen 4               #112 [hci1] 10.083765
      LE Set Address Resolution Enable (0x08|0x002d) ncmd 1
        Status: Success (0x00)
< HCI Command: LE Set Extended Ad.. (0x08|0x0039) plen 6  #113 [hci1] 10.103621
        Extended advertising: Enabled (0x01)
        Number of sets: 1 (0x01)
        Entry 0
          Handle: 0x00
          Duration: 0 ms (0x00)
          Max ext adv events: 0
> HCI Event: Command Complete (0x0e) plen 4               #114 [hci1] 10.104178
      LE Set Extended Advertising Enable (0x08|0x0039) ncmd 1
        Status: Success (0x00)
< HCI Command: Host Number of Com.. (0x03|0x0035) plen 5  #115 [hci1] 10.123441
        Num handles: 1
        Handle: 2325 Address: DF:A9:FF:F6:B1:1A (OUI DF-A9-FF)
        Count: 1
> ACL Data RX: Handle 2325 flags 0x02 dlen 13             #116 [hci1] 10.162548
      ATT: Find By Type Value Request (0x06) len 8
        Handle range: 0x0001-0xffff
        Attribute type: Primary Service (0x2800)
          UUID: Hearing Aid (0x1854)
< HCI Command: Host Number of Com.. (0x03|0x0035) plen 5  #117 [hci1] 10.163964
        Num handles: 1
        Handle: 2325 Address: DF:A9:FF:F6:B1:1A (OUI DF-A9-FF)
        Count: 1
< ACL Data TX: Handle 2325 flags 0x00 dlen 9              #118 [hci1] 10.164035
      ATT: Find By Type Value Response (0x07) len 4
        Handle range: 0x00b5-0x00bd
> ACL Data RX: Handle 2325 flags 0x02 dlen 9              #119 [hci1] 10.312400
      ATT: Read By Type Response (0x09) len 4
        Attribute data length: 3
        Attribute data list: 1 entry
        Handle: 0x000f
        Value: 01
< HCI Command: Host Number of Com.. (0x03|0x0035) plen 5  #120 [hci1] 10.323495
        Num handles: 1
        Handle: 2325 Address: DF:A9:FF:F6:B1:1A (OUI DF-A9-FF)
        Count: 1
> HCI Event: Number of Completed Packets (0x13) plen 5    #121 [hci1] 10.462494
        Num handles: 1
        Handle: 2325 Address: DF:A9:FF:F6:B1:1A (OUI DF-A9-FF)
        Count: 1
        #118: len 9 (0 Kb/s)
        Latency: 298 msec (148-299 msec ~268 msec)
> ACL Data RX: Handle 2325 flags 0x02 dlen 13             #122 [hci1] 10.462580
      ATT: Find By Type Value Request (0x06) len 8
        Handle range: 0x00be-0xffff
        Attribute type: Primary Service (0x2800)
          UUID: Hearing Aid (0x1854)
< HCI Command: Host Number of Com.. (0x03|0x0035) plen 5  #123 [hci1] 10.463375
        Num handles: 1
        Handle: 2325 Address: DF:A9:FF:F6:B1:1A (OUI DF-A9-FF)
        Count: 1
< ACL Data TX: Handle 2325 flags 0x00 dlen 9              #124 [hci1] 10.463469
      ATT: Error Response (0x01) len 4
        Find By Type Value Request (0x06)
        Handle: 0x00be
        Error: Attribute Not Found (0x0a)
> HCI Event: Number of Completed Packets (0x13) plen 5    #125 [hci1] 10.762395
        Num handles: 1
        Handle: 2325 Address: DF:A9:FF:F6:B1:1A (OUI DF-A9-FF)
        Count: 1
        #124: len 9 (0 Kb/s)
        Latency: 298 msec (148-299 msec ~283 msec)
> ACL Data RX: Handle 2325 flags 0x02 dlen 11             #126 [hci1] 10.762549
      ATT: Read By Type Request (0x08) len 6
        Handle range: 0x00b5-0x00bd
        Attribute type: Characteristic (0x2803)
< HCI Command: Host Number of Com.. (0x03|0x0035) plen 5  #127 [hci1] 10.764005
        Num handles: 1
        Handle: 2325 Address: DF:A9:FF:F6:B1:1A (OUI DF-A9-FF)
        Count: 1
< ACL Data TX: Handle 2325 flags 0x00 dlen 27             #128 [hci1] 10.764080
      ATT: Read By Type Response (0x09) len 22
        Attribute data length: 7
        Attribute data list: 3 entries
        Handle: 0x00b6
        Value: 02b700da2b
            Properties: 0x02
              Read (0x02)
            Value Handle: 0x00b7
            Value UUID: Hearing Aid Features (0x2bda)
        Handle: 0x00b8
        Value: 28b900db2b
            Properties: 0x28
              Write (0x08)
              Indicate (0x20)
            Value Handle: 0x00b9
            Value UUID: Hearing Aid Preset Control Point (0x2bdb)
        Handle: 0x00bb
        Value: 12bc00dc2b
            Properties: 0x12
              Read (0x02)
              Notify (0x10)
            Value Handle: 0x00bc
            Value UUID: Active Preset Index (0x2bdc)
> HCI Event: Number of Completed Packets (0x13) plen 5    #129 [hci1] 11.062479
        Num handles: 1
        Handle: 2325 Address: DF:A9:FF:F6:B1:1A (OUI DF-A9-FF)
        Count: 1
        #128: len 27 (0 Kb/s)
        Latency: 298 msec (148-299 msec ~291 msec)
> ACL Data RX: Handle 2325 flags 0x02 dlen 11             #130 [hci1] 11.062553
      ATT: Read By Type Request (0x08) len 6
        Handle range: 0x00bc-0x00bd
        Attribute type: Characteristic (0x2803)
< HCI Command: Host Number of Com.. (0x03|0x0035) plen 5  #131 [hci1] 11.063605
        Num handles: 1
        Handle: 2325 Address: DF:A9:FF:F6:B1:1A (OUI DF-A9-FF)
        Count: 1
< ACL Data TX: Handle 2325 flags 0x00 dlen 9              #132 [hci1] 11.063700
      ATT: Error Response (0x01) len 4
        Read By Type Request (0x08)
        Handle: 0x00bc
        Error: Attribute Not Found (0x0a)
> HCI Event: Number of Completed Packets (0x13) plen 5    #133 [hci1] 11.362498
        Num handles: 1
        Handle: 2325 Address: DF:A9:FF:F6:B1:1A (OUI DF-A9-FF)
        Count: 1
        #132: len 9 (0 Kb/s)
        Latency: 298 msec (148-299 msec ~294 msec)
> ACL Data RX: Handle 2325 flags 0x02 dlen 9              #134 [hci1] 11.362500
      ATT: Find Information Request (0x04) len 4
        Handle range: 0x00ba-0x00ba
< HCI Command: Host Number of Com.. (0x03|0x0035) plen 5  #135 [hci1] 11.363509
        Num handles: 1
        Handle: 2325 Address: DF:A9:FF:F6:B1:1A (OUI DF-A9-FF)
        Count: 1
< ACL Data TX: Handle 2325 flags 0x00 dlen 10             #136 [hci1] 11.363575
      ATT: Find Information Response (0x05) len 5
        Format: UUID-16 (0x01)
        Handle: 0x00ba
        UUID: Client Characteristic Configuration (0x2902)
> HCI Event: Number of Completed Packets (0x13) plen 5    #137 [hci1] 11.662395
        Num handles: 1
        Handle: 2325 Address: DF:A9:FF:F6:B1:1A (OUI DF-A9-FF)
        Count: 1
        #136: len 10 (0 Kb/s)
        Latency: 298 msec (148-299 msec ~296 msec)
> ACL Data RX: Handle 2325 flags 0x02 dlen 9              #138 [hci1] 11.662556
      ATT: Find Information Request (0x04) len 4
        Handle range: 0x00bd-0x00bd
< HCI Command: Host Number of Com.. (0x03|0x0035) plen 5  #139 [hci1] 11.663996
        Num handles: 1
        Handle: 2325 Address: DF:A9:FF:F6:B1:1A (OUI DF-A9-FF)
        Count: 1
< ACL Data TX: Handle 2325 flags 0x00 dlen 10             #140 [hci1] 11.664078
      ATT: Find Information Response (0x05) len 5
        Format: UUID-16 (0x01)
        Handle: 0x00bd
        UUID: Client Characteristic Configuration (0x2902)
> HCI Event: Number of Completed Packets (0x13) plen 5    #141 [hci1] 11.962407
        Num handles: 1
        Handle: 2325 Address: DF:A9:FF:F6:B1:1A (OUI DF-A9-FF)
        Count: 1
        #140: len 10 (0 Kb/s)
        Latency: 298 msec (148-299 msec ~297 msec)
> ACL Data RX: Handle 2325 flags 0x02 dlen 13             #142 [hci1] 11.962548
      ATT: Find By Type Value Request (0x06) len 8
        Handle range: 0x0001-0xffff
        Attribute type: Primary Service (0x2800)
          UUID: Published Audio Capabilities (0x1850)
< HCI Command: Host Number of Com.. (0x03|0x0035) plen 5  #143 [hci1] 11.963618
        Num handles: 1
        Handle: 2325 Address: DF:A9:FF:F6:B1:1A (OUI DF-A9-FF)
        Count: 1
< ACL Data TX: Handle 2325 flags 0x00 dlen 9              #144 [hci1] 11.963659
      ATT: Find By Type Value Response (0x07) len 4
        Handle range: 0x003f-0x0051
> HCI Event: Number of Completed Packets (0x13) plen 5    #145 [hci1] 12.262373
        Num handles: 1
        Handle: 2325 Address: DF:A9:FF:F6:B1:1A (OUI DF-A9-FF)
        Count: 1
        #144: len 9 (0 Kb/s)
        Latency: 298 msec (148-299 msec ~298 msec)
> ACL Data RX: Handle 2325 flags 0x02 dlen 13             #146 [hci1] 12.262580
      ATT: Find By Type Value Request (0x06) len 8
        Handle range: 0x0052-0xffff
        Attribute type: Primary Service (0x2800)
          UUID: Published Audio Capabilities (0x1850)
< HCI Command: Host Number of Com.. (0x03|0x0035) plen 5  #147 [hci1] 12.264169
        Num handles: 1
        Handle: 2325 Address: DF:A9:FF:F6:B1:1A (OUI DF-A9-FF)
        Count: 1
< ACL Data TX: Handle 2325 flags 0x00 dlen 9              #148 [hci1] 12.264376
      ATT: Error Response (0x01) len 4
        Find By Type Value Request (0x06)
        Handle: 0x0052
        Error: Attribute Not Found (0x0a)
> HCI Event: Number of Completed Packets (0x13) plen 5    #149 [hci1] 12.562366
        Num handles: 1
        Handle: 2325 Address: DF:A9:FF:F6:B1:1A (OUI DF-A9-FF)
        Count: 1
        #148: len 9 (0 Kb/s)
        Latency: 297 msec (148-299 msec ~298 msec)
> ACL Data RX: Handle 2325 flags 0x02 dlen 11             #150 [hci1] 12.562621
      ATT: Read By Type Request (0x08) len 6
        Handle range: 0x003f-0x0051
        Attribute type: Characteristic (0x2803)
< HCI Command: Host Number of Com.. (0x03|0x0035) plen 5  #151 [hci1] 12.563872
        Num handles: 1
        Handle: 2325 Address: DF:A9:FF:F6:B1:1A (OUI DF-A9-FF)
        Count: 1
< ACL Data TX: Handle 2325 flags 0x00 dlen 27             #152 [hci1] 12.564026
< ACL Data TX: Handle 2325 flags 0x01 dlen 21             #153 [hci1] 12.564035
      ATT: Read By Type Response (0x09) len 43
        Attribute data length: 7
        Attribute data list: 6 entries
        Handle: 0x0040
        Value: 124100c92b
            Properties: 0x12
              Read (0x02)
              Notify (0x10)
            Value Handle: 0x0041
            Value UUID: Sink PAC (0x2bc9)
        Handle: 0x0043
        Value: 1a4400ca2b
            Properties: 0x1a
              Read (0x02)
              Write (0x08)
              Notify (0x10)
            Value Handle: 0x0044
            Value UUID: Sink Audio Locations (0x2bca)
        Handle: 0x0046
        Value: 124700cb2b
            Properties: 0x12
              Read (0x02)
              Notify (0x10)
            Value Handle: 0x0047
            Value UUID: Source PAC (0x2bcb)
        Handle: 0x0049
        Value: 1a4a00cc2b
            Properties: 0x1a
              Read (0x02)
              Write (0x08)
              Notify (0x10)
            Value Handle: 0x004a
            Value UUID: Source Audio Locations (0x2bcc)
        Handle: 0x004c
        Value: 124d00cd2b
            Properties: 0x12
              Read (0x02)
              Notify (0x10)
            Value Handle: 0x004d
            Value UUID: Available Audio Contexts (0x2bcd)
        Handle: 0x004f
        Value: 125000ce2b
            Properties: 0x12
              Read (0x02)
              Notify (0x10)
            Value Handle: 0x0050
            Value UUID: Supported Audio Contexts (0x2bce)
> HCI Event: Number of Completed Packets (0x13) plen 5    #154 [hci1] 12.712827
        Num handles: 1
        Handle: 2325 Address: DF:A9:FF:F6:B1:1A (OUI DF-A9-FF)
        Count: 1
        #152: len 27 (1 Kb/s)
        Latency: 148 msec (148-299 msec ~223 msec)
> HCI Event: Number of Completed Packets (0x13) plen 5    #155 [hci1] 12.862377
        Num handles: 1
        Handle: 2325 Address: DF:A9:FF:F6:B1:1A (OUI DF-A9-FF)
        Count: 1
        #153: len 21 (0 Kb/s)
        Latency: 298 msec (148-299 msec ~260 msec)
> ACL Data RX: Handle 2325 flags 0x02 dlen 11             #156 [hci1] 12.862475
      ATT: Read By Type Request (0x08) len 6
        Handle range: 0x0050-0x0051
        Attribute type: Characteristic (0x2803)
< HCI Command: Host Number of Com.. (0x03|0x0035) plen 5  #157 [hci1] 12.863593
        Num handles: 1
        Handle: 2325 Address: DF:A9:FF:F6:B1:1A (OUI DF-A9-FF)
        Count: 1
< ACL Data TX: Handle 2325 flags 0x00 dlen 9              #158 [hci1] 12.863674
      ATT: Error Response (0x01) len 4
        Read By Type Request (0x08)
        Handle: 0x0050
        Error: Attribute Not Found (0x0a)
> HCI Event: Number of Completed Packets (0x13) plen 5    #159 [hci1] 13.162369
        Num handles: 1
        Handle: 2325 Address: DF:A9:FF:F6:B1:1A (OUI DF-A9-FF)
        Count: 1
        #158: len 9 (0 Kb/s)
        Latency: 298 msec (148-299 msec ~279 msec)
> ACL Data RX: Handle 2325 flags 0x02 dlen 9              #160 [hci1] 13.162626
      ATT: Find Information Request (0x04) len 4
        Handle range: 0x0042-0x0042
< HCI Command: Host Number of Com.. (0x03|0x0035) plen 5  #161 [hci1] 13.163571
        Num handles: 1
        Handle: 2325 Address: DF:A9:FF:F6:B1:1A (OUI DF-A9-FF)
        Count: 1
< ACL Data TX: Handle 2325 flags 0x00 dlen 10             #162 [hci1] 13.163631
      ATT: Find Information Response (0x05) len 5
        Format: UUID-16 (0x01)
        Handle: 0x0042
        UUID: Client Characteristic Configuration (0x2902)
> HCI Event: Number of Completed Packets (0x13) plen 5    #163 [hci1] 13.462284
        Num handles: 1
        Handle: 2325 Address: DF:A9:FF:F6:B1:1A (OUI DF-A9-FF)
        Count: 1
        #162: len 10 (0 Kb/s)
        Latency: 298 msec (148-299 msec ~289 msec)
> ACL Data RX: Handle 2325 flags 0x02 dlen 9              #164 [hci1] 13.462503
      ATT: Find Information Request (0x04) len 4
        Handle range: 0x0045-0x0045
< HCI Command: Host Number of Com.. (0x03|0x0035) plen 5  #165 [hci1] 13.463592
        Num handles: 1
        Handle: 2325 Address: DF:A9:FF:F6:B1:1A (OUI DF-A9-FF)
        Count: 1
< ACL Data TX: Handle 2325 flags 0x00 dlen 10             #166 [hci1] 13.463617
      ATT: Find Information Response (0x05) len 5
        Format: UUID-16 (0x01)
        Handle: 0x0045
        UUID: Client Characteristic Configuration (0x2902)
> HCI Event: Number of Completed Packets (0x13) plen 5    #167 [hci1] 13.762339
        Num handles: 1
        Handle: 2325 Address: DF:A9:FF:F6:B1:1A (OUI DF-A9-FF)
        Count: 1
        #166: len 10 (0 Kb/s)
        Latency: 298 msec (148-299 msec ~293 msec)
> ACL Data RX: Handle 2325 flags 0x02 dlen 9              #168 [hci1] 13.762557
      ATT: Find Information Request (0x04) len 4
        Handle range: 0x0048-0x0048
< HCI Command: Host Number of Com.. (0x03|0x0035) plen 5  #169 [hci1] 13.763982
        Num handles: 1
        Handle: 2325 Address: DF:A9:FF:F6:B1:1A (OUI DF-A9-FF)
        Count: 1
< ACL Data TX: Handle 2325 flags 0x00 dlen 10             #170 [hci1] 13.764059
      ATT: Find Information Response (0x05) len 5
        Format: UUID-16 (0x01)
        Handle: 0x0048
        UUID: Client Characteristic Configuration (0x2902)
> HCI Event: Number of Completed Packets (0x13) plen 5    #171 [hci1] 14.062368
        Num handles: 1
        Handle: 2325 Address: DF:A9:FF:F6:B1:1A (OUI DF-A9-FF)
        Count: 1
        #170: len 10 (0 Kb/s)
        Latency: 298 msec (148-299 msec ~296 msec)
> ACL Data RX: Handle 2325 flags 0x02 dlen 9              #172 [hci1] 14.062476
      ATT: Find Information Request (0x04) len 4
        Handle range: 0x004b-0x004b
< HCI Command: Host Number of Com.. (0x03|0x0035) plen 5  #173 [hci1] 14.063597
        Num handles: 1
        Handle: 2325 Address: DF:A9:FF:F6:B1:1A (OUI DF-A9-FF)
        Count: 1
< ACL Data TX: Handle 2325 flags 0x00 dlen 10             #174 [hci1] 14.063630
      ATT: Find Information Response (0x05) len 5
        Format: UUID-16 (0x01)
        Handle: 0x004b
        UUID: Client Characteristic Configuration (0x2902)
> HCI Event: Number of Completed Packets (0x13) plen 5    #175 [hci1] 14.362304
        Num handles: 1
        Handle: 2325 Address: DF:A9:FF:F6:B1:1A (OUI DF-A9-FF)
        Count: 1
        #174: len 10 (0 Kb/s)
        Latency: 298 msec (148-299 msec ~297 msec)
> ACL Data RX: Handle 2325 flags 0x02 dlen 9              #176 [hci1] 14.362570
      ATT: Find Information Request (0x04) len 4
        Handle range: 0x004e-0x004e
< HCI Command: Host Number of Com.. (0x03|0x0035) plen 5  #177 [hci1] 14.363403
        Num handles: 1
        Handle: 2325 Address: DF:A9:FF:F6:B1:1A (OUI DF-A9-FF)
        Count: 1
< ACL Data TX: Handle 2325 flags 0x00 dlen 10             #178 [hci1] 14.363422
      ATT: Find Information Response (0x05) len 5
        Format: UUID-16 (0x01)
        Handle: 0x004e
        UUID: Client Characteristic Configuration (0x2902)
> HCI Event: Number of Completed Packets (0x13) plen 5    #179 [hci1] 14.662387
        Num handles: 1
        Handle: 2325 Address: DF:A9:FF:F6:B1:1A (OUI DF-A9-FF)
        Count: 1
        #178: len 10 (0 Kb/s)
        Latency: 298 msec (148-299 msec ~298 msec)
> ACL Data RX: Handle 2325 flags 0x02 dlen 9              #180 [hci1] 14.662468
      ATT: Find Information Request (0x04) len 4
        Handle range: 0x0051-0x0051
< HCI Command: Host Number of Com.. (0x03|0x0035) plen 5  #181 [hci1] 14.663597
        Num handles: 1
        Handle: 2325 Address: DF:A9:FF:F6:B1:1A (OUI DF-A9-FF)
        Count: 1
< ACL Data TX: Handle 2325 flags 0x00 dlen 10             #182 [hci1] 14.663649
      ATT: Find Information Response (0x05) len 5
        Format: UUID-16 (0x01)
        Handle: 0x0051
        UUID: Client Characteristic Configuration (0x2902)
> HCI Event: Number of Completed Packets (0x13) plen 5    #183 [hci1] 14.962332
        Num handles: 1
        Handle: 2325 Address: DF:A9:FF:F6:B1:1A (OUI DF-A9-FF)
        Count: 1
        #182: len 10 (0 Kb/s)
        Latency: 298 msec (148-299 msec ~298 msec)
> ACL Data RX: Handle 2325 flags 0x02 dlen 13             #184 [hci1] 14.962514
      ATT: Find By Type Value Request (0x06) len 8
        Handle range: 0x0001-0xffff
        Attribute type: Primary Service (0x2800)
          UUID: Audio Stream Control (0x184e)
< HCI Command: Host Number of Com.. (0x03|0x0035) plen 5  #185 [hci1] 14.963670
        Num handles: 1
        Handle: 2325 Address: DF:A9:FF:F6:B1:1A (OUI DF-A9-FF)
        Count: 1
< ACL Data TX: Handle 2325 flags 0x00 dlen 9              #186 [hci1] 14.963677
      ATT: Find By Type Value Response (0x07) len 4
        Handle range: 0x0052-0x0061
> HCI Event: Number of Completed Packets (0x13) plen 5    #187 [hci1] 15.262265
        Num handles: 1
        Handle: 2325 Address: DF:A9:FF:F6:B1:1A (OUI DF-A9-FF)
        Count: 1
        #186: len 9 (0 Kb/s)
        Latency: 298 msec (148-299 msec ~298 msec)
> ACL Data RX: Handle 2325 flags 0x02 dlen 13             #188 [hci1] 15.262504
      ATT: Find By Type Value Request (0x06) len 8
        Handle range: 0x0062-0xffff
        Attribute type: Primary Service (0x2800)
          UUID: Audio Stream Control (0x184e)
< HCI Command: Host Number of Com.. (0x03|0x0035) plen 5  #189 [hci1] 15.264182
        Num handles: 1
        Handle: 2325 Address: DF:A9:FF:F6:B1:1A (OUI DF-A9-FF)
        Count: 1
< ACL Data TX: Handle 2325 flags 0x00 dlen 9              #190 [hci1] 15.264381
      ATT: Error Response (0x01) len 4
        Find By Type Value Request (0x06)
        Handle: 0x0062
        Error: Attribute Not Found (0x0a)
> HCI Event: Number of Completed Packets (0x13) plen 5    #191 [hci1] 15.562361
        Num handles: 1
        Handle: 2325 Address: DF:A9:FF:F6:B1:1A (OUI DF-A9-FF)
        Count: 1
        #190: len 9 (0 Kb/s)
        Latency: 297 msec (148-299 msec ~298 msec)
> ACL Data RX: Handle 2325 flags 0x02 dlen 11             #192 [hci1] 15.562580
      ATT: Read By Type Request (0x08) len 6
        Handle range: 0x0052-0x0061
        Attribute type: Characteristic (0x2803)
< HCI Command: Host Number of Com.. (0x03|0x0035) plen 5  #193 [hci1] 15.563579
        Num handles: 1
        Handle: 2325 Address: DF:A9:FF:F6:B1:1A (OUI DF-A9-FF)
        Count: 1
< ACL Data TX: Handle 2325 flags 0x00 dlen 27             #194 [hci1] 15.563607
< ACL Data TX: Handle 2325 flags 0x01 dlen 14             #195 [hci1] 15.563610
      ATT: Read By Type Response (0x09) len 36
        Attribute data length: 7
        Attribute data list: 5 entries
        Handle: 0x0053
        Value: 1c5400c62b
            Properties: 0x1c
              Write Without Response (0x04)
              Write (0x08)
              Notify (0x10)
            Value Handle: 0x0054
            Value UUID: ASE Control Point (0x2bc6)
        Handle: 0x0056
        Value: 125700c42b
            Properties: 0x12
              Read (0x02)
              Notify (0x10)
            Value Handle: 0x0057
            Value UUID: Sink ASE (0x2bc4)
        Handle: 0x0059
        Value: 125a00c42b
            Properties: 0x12
              Read (0x02)
              Notify (0x10)
            Value Handle: 0x005a
            Value UUID: Sink ASE (0x2bc4)
        Handle: 0x005c
        Value: 125d00c52b
            Properties: 0x12
              Read (0x02)
              Notify (0x10)
            Value Handle: 0x005d
            Value UUID: Source ASE (0x2bc5)
        Handle: 0x005f
        Value: 126000c52b
            Properties: 0x12
              Read (0x02)
              Notify (0x10)
            Value Handle: 0x0060
            Value UUID: Source ASE (0x2bc5)
> HCI Event: Number of Completed Packets (0x13) plen 5    #196 [hci1] 15.712741
        Num handles: 1
        Handle: 2325 Address: DF:A9:FF:F6:B1:1A (OUI DF-A9-FF)
        Count: 1
        #194: len 27 (1 Kb/s)
        Latency: 149 msec (148-299 msec ~223 msec)
> HCI Event: Number of Completed Packets (0x13) plen 5    #197 [hci1] 15.862334
        Num handles: 1
        Handle: 2325 Address: DF:A9:FF:F6:B1:1A (OUI DF-A9-FF)
        Count: 1
        #195: len 14 (0 Kb/s)
        Latency: 298 msec (148-299 msec ~261 msec)
> ACL Data RX: Handle 2325 flags 0x02 dlen 11             #198 [hci1] 15.862465
      ATT: Read By Type Request (0x08) len 6
        Handle range: 0x0060-0x0061
        Attribute type: Characteristic (0x2803)
< HCI Command: Host Number of Com.. (0x03|0x0035) plen 5  #199 [hci1] 15.864046
        Num handles: 1
        Handle: 2325 Address: DF:A9:FF:F6:B1:1A (OUI DF-A9-FF)
        Count: 1
< ACL Data TX: Handle 2325 flags 0x00 dlen 9              #200 [hci1] 15.864252
      ATT: Error Response (0x01) len 4
        Read By Type Request (0x08)
        Handle: 0x0060
        Error: Attribute Not Found (0x0a)
> HCI Event: Number of Completed Packets (0x13) plen 5    #201 [hci1] 16.162317
        Num handles: 1
        Handle: 2325 Address: DF:A9:FF:F6:B1:1A (OUI DF-A9-FF)
        Count: 1
        #200: len 9 (0 Kb/s)
        Latency: 298 msec (148-299 msec ~279 msec)
> ACL Data RX: Handle 2325 flags 0x02 dlen 9              #202 [hci1] 16.162460
      ATT: Find Information Request (0x04) len 4
        Handle range: 0x0055-0x0055
< HCI Command: Host Number of Com.. (0x03|0x0035) plen 5  #203 [hci1] 16.163712
        Num handles: 1
        Handle: 2325 Address: DF:A9:FF:F6:B1:1A (OUI DF-A9-FF)
        Count: 1
< ACL Data TX: Handle 2325 flags 0x00 dlen 10             #204 [hci1] 16.163795
      ATT: Find Information Response (0x05) len 5
        Format: UUID-16 (0x01)
        Handle: 0x0055
        UUID: Client Characteristic Configuration (0x2902)
> HCI Event: Number of Completed Packets (0x13) plen 5    #205 [hci1] 16.462264
        Num handles: 1
        Handle: 2325 Address: DF:A9:FF:F6:B1:1A (OUI DF-A9-FF)
        Count: 1
        #204: len 10 (0 Kb/s)
        Latency: 298 msec (148-299 msec ~289 msec)
> ACL Data RX: Handle 2325 flags 0x02 dlen 9              #206 [hci1] 16.462530
      ATT: Find Information Request (0x04) len 4
        Handle range: 0x0058-0x0058
< HCI Command: Host Number of Com.. (0x03|0x0035) plen 5  #207 [hci1] 16.463714
        Num handles: 1
        Handle: 2325 Address: DF:A9:FF:F6:B1:1A (OUI DF-A9-FF)
        Count: 1
< ACL Data TX: Handle 2325 flags 0x00 dlen 10             #208 [hci1] 16.463736
      ATT: Find Information Response (0x05) len 5
        Format: UUID-16 (0x01)
        Handle: 0x0058
        UUID: Client Characteristic Configuration (0x2902)
> HCI Event: Number of Completed Packets (0x13) plen 5    #209 [hci1] 16.762279
        Num handles: 1
        Handle: 2325 Address: DF:A9:FF:F6:B1:1A (OUI DF-A9-FF)
        Count: 1
        #208: len 10 (0 Kb/s)
        Latency: 298 msec (148-299 msec ~293 msec)
> ACL Data RX: Handle 2325 flags 0x02 dlen 9              #210 [hci1] 16.762489
      ATT: Find Information Request (0x04) len 4
        Handle range: 0x005b-0x005b
< HCI Command: Host Number of Com.. (0x03|0x0035) plen 5  #211 [hci1] 16.763988
        Num handles: 1
        Handle: 2325 Address: DF:A9:FF:F6:B1:1A (OUI DF-A9-FF)
        Count: 1
< ACL Data TX: Handle 2325 flags 0x00 dlen 10             #212 [hci1] 16.764059
      ATT: Find Information Response (0x05) len 5
        Format: UUID-16 (0x01)
        Handle: 0x005b
        UUID: Client Characteristic Configuration (0x2902)
> HCI Event: Number of Completed Packets (0x13) plen 5    #213 [hci1] 17.062260
        Num handles: 1
        Handle: 2325 Address: DF:A9:FF:F6:B1:1A (OUI DF-A9-FF)
        Count: 1
        #212: len 10 (0 Kb/s)
        Latency: 298 msec (148-299 msec ~295 msec)
> ACL Data RX: Handle 2325 flags 0x02 dlen 9              #214 [hci1] 17.062455
      ATT: Find Information Request (0x04) len 4
        Handle range: 0x005e-0x005e
< HCI Command: Host Number of Com.. (0x03|0x0035) plen 5  #215 [hci1] 17.063745
        Num handles: 1
        Handle: 2325 Address: DF:A9:FF:F6:B1:1A (OUI DF-A9-FF)
        Count: 1
< ACL Data TX: Handle 2325 flags 0x00 dlen 10             #216 [hci1] 17.063830
      ATT: Find Information Response (0x05) len 5
        Format: UUID-16 (0x01)
        Handle: 0x005e
        UUID: Client Characteristic Configuration (0x2902)
> HCI Event: Number of Completed Packets (0x13) plen 5    #217 [hci1] 17.362255
        Num handles: 1
        Handle: 2325 Address: DF:A9:FF:F6:B1:1A (OUI DF-A9-FF)
        Count: 1
        #216: len 10 (0 Kb/s)
        Latency: 298 msec (148-299 msec ~297 msec)
> ACL Data RX: Handle 2325 flags 0x02 dlen 9              #218 [hci1] 17.362442
      ATT: Find Information Request (0x04) len 4
        Handle range: 0x0061-0x0061
< HCI Command: Host Number of Com.. (0x03|0x0035) plen 5  #219 [hci1] 17.364080
        Num handles: 1
        Handle: 2325 Address: DF:A9:FF:F6:B1:1A (OUI DF-A9-FF)
        Count: 1
< ACL Data TX: Handle 2325 flags 0x00 dlen 10             #220 [hci1] 17.364170
      ATT: Find Information Response (0x05) len 5
        Format: UUID-16 (0x01)
        Handle: 0x0061
        UUID: Client Characteristic Configuration (0x2902)
> HCI Event: Number of Completed Packets (0x13) plen 5    #221 [hci1] 17.662278
        Num handles: 1
        Handle: 2325 Address: DF:A9:FF:F6:B1:1A (OUI DF-A9-FF)
        Count: 1
        #220: len 10 (0 Kb/s)
        Latency: 298 msec (148-299 msec ~297 msec)
> ACL Data RX: Handle 2325 flags 0x02 dlen 13             #222 [hci1] 17.662524
      ATT: Find By Type Value Request (0x06) len 8
        Handle range: 0x0001-0xffff
        Attribute type: Primary Service (0x2800)
          UUID: Common Audio (0x1853)
< HCI Command: Host Number of Com.. (0x03|0x0035) plen 5  #223 [hci1] 17.663599
        Num handles: 1
        Handle: 2325 Address: DF:A9:FF:F6:B1:1A (OUI DF-A9-FF)
        Count: 1
< ACL Data TX: Handle 2325 flags 0x00 dlen 9              #224 [hci1] 17.663606
      ATT: Find By Type Value Response (0x07) len 4
        Handle range: 0x00b3-0x00b4
> HCI Event: Number of Completed Packets (0x13) plen 5    #225 [hci1] 17.962292
        Num handles: 1
        Handle: 2325 Address: DF:A9:FF:F6:B1:1A (OUI DF-A9-FF)
        Count: 1
        #224: len 9 (0 Kb/s)
        Latency: 298 msec (148-299 msec ~298 msec)
> ACL Data RX: Handle 2325 flags 0x02 dlen 13             #226 [hci1] 17.962550
      ATT: Find By Type Value Request (0x06) len 8
        Handle range: 0x00b5-0xffff
        Attribute type: Primary Service (0x2800)
          UUID: Common Audio (0x1853)
< HCI Command: Host Number of Com.. (0x03|0x0035) plen 5  #227 [hci1] 17.963637
        Num handles: 1
        Handle: 2325 Address: DF:A9:FF:F6:B1:1A (OUI DF-A9-FF)
        Count: 1
< ACL Data TX: Handle 2325 flags 0x00 dlen 9              #228 [hci1] 17.963755
      ATT: Error Response (0x01) len 4
        Find By Type Value Request (0x06)
        Handle: 0x00b5
        Error: Attribute Not Found (0x0a)
> HCI Event: Number of Completed Packets (0x13) plen 5    #229 [hci1] 18.262215
        Num handles: 1
        Handle: 2325 Address: DF:A9:FF:F6:B1:1A (OUI DF-A9-FF)
        Count: 1
        #228: len 9 (0 Kb/s)
        Latency: 298 msec (148-299 msec ~298 msec)
> ACL Data RX: Handle 2325 flags 0x02 dlen 11             #230 [hci1] 18.262480
      ATT: Read By Type Request (0x08) len 6
        Handle range: 0x00b3-0x00b4
        Attribute type: Include (0x2802)
< HCI Command: Host Number of Com.. (0x03|0x0035) plen 5  #231 [hci1] 18.264010
        Num handles: 1
        Handle: 2325 Address: DF:A9:FF:F6:B1:1A (OUI DF-A9-FF)
        Count: 1
< ACL Data TX: Handle 2325 flags 0x00 dlen 14             #232 [hci1] 18.264083
      ATT: Read By Type Response (0x09) len 9
        Attribute data length: 8
        Attribute data list: 1 entry
        Handle: 0x00b4
        Value: a700b2004618
> HCI Event: Number of Completed Packets (0x13) plen 5    #233 [hci1] 18.562315
        Num handles: 1
        Handle: 2325 Address: DF:A9:FF:F6:B1:1A (OUI DF-A9-FF)
        Count: 1
        #232: len 14 (0 Kb/s)
        Latency: 298 msec (148-299 msec ~298 msec)
> ACL Data RX: Handle 2325 flags 0x02 dlen 11             #234 [hci1] 18.562480
      ATT: Read By Type Request (0x08) len 6
        Handle range: 0x00a7-0x00b2
        Attribute type: Characteristic (0x2803)
< HCI Command: Host Number of Com.. (0x03|0x0035) plen 5  #235 [hci1] 18.563695
        Num handles: 1
        Handle: 2325 Address: DF:A9:FF:F6:B1:1A (OUI DF-A9-FF)
        Count: 1
< ACL Data TX: Handle 2325 flags 0x00 dlen 27             #236 [hci1] 18.563735
< ACL Data TX: Handle 2325 flags 0x01 dlen 7              #237 [hci1] 18.563738
      ATT: Read By Type Response (0x09) len 29
        Attribute data length: 7
        Attribute data list: 4 entries
        Handle: 0x00a8
        Value: 12a900842b
            Properties: 0x12
              Read (0x02)
              Notify (0x10)
            Value Handle: 0x00a9
            Value UUID: Set Identity Resolving Key (0x2b84)
        Handle: 0x00ab
        Value: 12ac00852b
            Properties: 0x12
              Read (0x02)
              Notify (0x10)
            Value Handle: 0x00ac
            Value UUID: Coordinated Set Size (0x2b85)
        Handle: 0x00ae
        Value: 1aaf00862b
            Properties: 0x1a
              Read (0x02)
              Write (0x08)
              Notify (0x10)
            Value Handle: 0x00af
            Value UUID: Set Member Lock (0x2b86)
        Handle: 0x00b1
        Value: 02b200872b
            Properties: 0x02
              Read (0x02)
            Value Handle: 0x00b2
            Value UUID: Set Member Rank (0x2b87)
> HCI Event: Number of Completed Packets (0x13) plen 5    #238 [hci1] 18.712638
        Num handles: 1
        Handle: 2325 Address: DF:A9:FF:F6:B1:1A (OUI DF-A9-FF)
        Count: 1
        #236: len 27 (1 Kb/s)
        Latency: 148 msec (148-299 msec ~223 msec)
> HCI Event: Number of Completed Packets (0x13) plen 5    #239 [hci1] 18.862230
        Num handles: 1
        Handle: 2325 Address: DF:A9:FF:F6:B1:1A (OUI DF-A9-FF)
        Count: 1
        #237: len 7 (0 Kb/s)
        Latency: 298 msec (148-299 msec ~261 msec)
> ACL Data RX: Handle 2325 flags 0x02 dlen 11             #240 [hci1] 18.862392
      ATT: Read By Type Request (0x08) len 6
        Handle range: 0x00b2-0x00b2
        Attribute type: Characteristic (0x2803)
< HCI Command: Host Number of Com.. (0x03|0x0035) plen 5  #241 [hci1] 18.864211
        Num handles: 1
        Handle: 2325 Address: DF:A9:FF:F6:B1:1A (OUI DF-A9-FF)
        Count: 1
< ACL Data TX: Handle 2325 flags 0x00 dlen 9              #242 [hci1] 18.864384
      ATT: Error Response (0x01) len 4
        Read By Type Request (0x08)
        Handle: 0x00b2
        Error: Attribute Not Found (0x0a)
> HCI Event: Number of Completed Packets (0x13) plen 5    #243 [hci1] 19.162290
        Num handles: 1
        Handle: 2325 Address: DF:A9:FF:F6:B1:1A (OUI DF-A9-FF)
        Count: 1
        #242: len 9 (0 Kb/s)
        Latency: 297 msec (148-299 msec ~279 msec)
> ACL Data RX: Handle 2325 flags 0x02 dlen 9              #244 [hci1] 19.162425
      ATT: Find Information Request (0x04) len 4
        Handle range: 0x00aa-0x00aa
< HCI Command: Host Number of Com.. (0x03|0x0035) plen 5  #245 [hci1] 19.163648
        Num handles: 1
        Handle: 2325 Address: DF:A9:FF:F6:B1:1A (OUI DF-A9-FF)
        Count: 1
< ACL Data TX: Handle 2325 flags 0x00 dlen 10             #246 [hci1] 19.163726
      ATT: Find Information Response (0x05) len 5
        Format: UUID-16 (0x01)
        Handle: 0x00aa
        UUID: Client Characteristic Configuration (0x2902)
> HCI Event: Number of Completed Packets (0x13) plen 5    #247 [hci1] 19.462256
        Num handles: 1
        Handle: 2325 Address: DF:A9:FF:F6:B1:1A (OUI DF-A9-FF)
        Count: 1
        #246: len 10 (0 Kb/s)
        Latency: 298 msec (148-299 msec ~289 msec)
> ACL Data RX: Handle 2325 flags 0x02 dlen 9              #248 [hci1] 19.462451
      ATT: Find Information Request (0x04) len 4
        Handle range: 0x00ad-0x00ad
< HCI Command: Host Number of Com.. (0x03|0x0035) plen 5  #249 [hci1] 19.463784
        Num handles: 1
        Handle: 2325 Address: DF:A9:FF:F6:B1:1A (OUI DF-A9-FF)
        Count: 1
< ACL Data TX: Handle 2325 flags 0x00 dlen 10             #250 [hci1] 19.463823
      ATT: Find Information Response (0x05) len 5
        Format: UUID-16 (0x01)
        Handle: 0x00ad
        UUID: Client Characteristic Configuration (0x2902)
> HCI Event: Number of Completed Packets (0x13) plen 5    #251 [hci1] 19.762218
        Num handles: 1
        Handle: 2325 Address: DF:A9:FF:F6:B1:1A (OUI DF-A9-FF)
        Count: 1
        #250: len 10 (0 Kb/s)
        Latency: 298 msec (148-299 msec ~293 msec)
> ACL Data RX: Handle 2325 flags 0x02 dlen 9              #252 [hci1] 19.762457
      ATT: Find Information Request (0x04) len 4
        Handle range: 0x00b0-0x00b0
< HCI Command: Host Number of Com.. (0x03|0x0035) plen 5  #253 [hci1] 19.764155
        Num handles: 1
        Handle: 2325 Address: DF:A9:FF:F6:B1:1A (OUI DF-A9-FF)
        Count: 1
< ACL Data TX: Handle 2325 flags 0x00 dlen 10             #254 [hci1] 19.764211
      ATT: Find Information Response (0x05) len 5
        Format: UUID-16 (0x01)
        Handle: 0x00b0
        UUID: Client Characteristic Configuration (0x2902)
> HCI Event: Number of Completed Packets (0x13) plen 5    #255 [hci1] 20.062303
        Num handles: 1
        Handle: 2325 Address: DF:A9:FF:F6:B1:1A (OUI DF-A9-FF)
        Count: 1
        #254: len 10 (0 Kb/s)
        Latency: 298 msec (148-299 msec ~295 msec)
> ACL Data RX: Handle 2325 flags 0x02 dlen 9              #256 [hci1] 20.062375
      ATT: Write Request (0x12) len 4
        Handle: 0x004e
          Data: 0000
< HCI Command: Host Number of Com.. (0x03|0x0035) plen 5  #257 [hci1] 20.063659
        Num handles: 1
        Handle: 2325 Address: DF:A9:FF:F6:B1:1A (OUI DF-A9-FF)
        Count: 1
< ACL Data TX: Handle 2325 flags 0x00 dlen 5              #258 [hci1] 20.063690
      ATT: Write Response (0x13) len 0
> HCI Event: Number of Completed Packets (0x13) plen 5    #259 [hci1] 20.362298
        Num handles: 1
        Handle: 2325 Address: DF:A9:FF:F6:B1:1A (OUI DF-A9-FF)
        Count: 1
        #258: len 5 (0 Kb/s)
        Latency: 298 msec (148-299 msec ~297 msec)
> ACL Data RX: Handle 2325 flags 0x02 dlen 9              #260 [hci1] 20.362358
      ATT: Write Request (0x12) len 4
        Handle: 0x004e
          Data: 0100
< HCI Command: Host Number of Com.. (0x03|0x0035) plen 5  #261 [hci1] 20.363942
        Num handles: 1
        Handle: 2325 Address: DF:A9:FF:F6:B1:1A (OUI DF-A9-FF)
        Count: 1
< ACL Data TX: Handle 2325 flags 0x00 dlen 5              #262 [hci1] 20.363982
      ATT: Write Response (0x13) len 0
> HCI Event: Number of Completed Packets (0x13) plen 5    #263 [hci1] 20.662195
        Num handles: 1
        Handle: 2325 Address: DF:A9:FF:F6:B1:1A (OUI DF-A9-FF)
        Count: 1
        #262: len 5 (0 Kb/s)
        Latency: 298 msec (148-299 msec ~297 msec)
> ACL Data RX: Handle 2325 flags 0x02 dlen 9              #264 [hci1] 20.662398
      ATT: Write Request (0x12) len 4
        Handle: 0x0055
          Data: 0000
< HCI Command: Host Number of Com.. (0x03|0x0035) plen 5  #265 [hci1] 20.663689
        Num handles: 1
        Handle: 2325 Address: DF:A9:FF:F6:B1:1A (OUI DF-A9-FF)
        Count: 1
< ACL Data TX: Handle 2325 flags 0x00 dlen 5              #266 [hci1] 20.663726
      ATT: Write Response (0x13) len 0
> HCI Event: Number of Completed Packets (0x13) plen 5    #267 [hci1] 20.962172
        Num handles: 1
        Handle: 2325 Address: DF:A9:FF:F6:B1:1A (OUI DF-A9-FF)
        Count: 1
        #266: len 5 (0 Kb/s)
        Latency: 298 msec (148-299 msec ~298 msec)
> ACL Data RX: Handle 2325 flags 0x02 dlen 9              #268 [hci1] 20.962364
      ATT: Write Request (0x12) len 4
        Handle: 0x0055
          Data: 0100
< HCI Command: Host Number of Com.. (0x03|0x0035) plen 5  #269 [hci1] 20.970170
        Num handles: 1
        Handle: 2325 Address: DF:A9:FF:F6:B1:1A (OUI DF-A9-FF)
        Count: 1
< ACL Data TX: Handle 2325 flags 0x00 dlen 5              #270 [hci1] 20.971133
      ATT: Write Response (0x13) len 0
> HCI Event: Number of Completed Packets (0x13) plen 5    #271 [hci1] 21.262225
        Num handles: 1
        Handle: 2325 Address: DF:A9:FF:F6:B1:1A (OUI DF-A9-FF)
        Count: 1
        #270: len 5 (0 Kb/s)
        Latency: 291 msec (148-299 msec ~294 msec)
> ACL Data RX: Handle 2325 flags 0x02 dlen 9              #272 [hci1] 21.262366
      ATT: Write Request (0x12) len 4
        Handle: 0x0058
          Data: 0000
< HCI Command: Host Number of Com.. (0x03|0x0035) plen 5  #273 [hci1] 21.263561
        Num handles: 1
        Handle: 2325 Address: DF:A9:FF:F6:B1:1A (OUI DF-A9-FF)
        Count: 1
< ACL Data TX: Handle 2325 flags 0x00 dlen 5              #274 [hci1] 21.263583
      ATT: Write Response (0x13) len 0
> HCI Event: Number of Completed Packets (0x13) plen 5    #275 [hci1] 21.562250
        Num handles: 1
        Handle: 2325 Address: DF:A9:FF:F6:B1:1A (OUI DF-A9-FF)
        Count: 1
        #274: len 5 (0 Kb/s)
        Latency: 298 msec (148-299 msec ~296 msec)
> ACL Data RX: Handle 2325 flags 0x02 dlen 9              #276 [hci1] 21.562434
      ATT: Write Request (0x12) len 4
        Handle: 0x0058
          Data: 0100
< HCI Command: Host Number of Com.. (0x03|0x0035) plen 5  #277 [hci1] 21.563693
        Num handles: 1
        Handle: 2325 Address: DF:A9:FF:F6:B1:1A (OUI DF-A9-FF)
        Count: 1
< ACL Data TX: Handle 2325 flags 0x00 dlen 5              #278 [hci1] 21.563804
      ATT: Write Response (0x13) len 0
> HCI Event: Number of Completed Packets (0x13) plen 5    #279 [hci1] 21.862193
        Num handles: 1
        Handle: 2325 Address: DF:A9:FF:F6:B1:1A (OUI DF-A9-FF)
        Count: 1
        #278: len 5 (0 Kb/s)
        Latency: 298 msec (148-299 msec ~297 msec)
> ACL Data RX: Handle 2325 flags 0x02 dlen 9              #280 [hci1] 21.862399
      ATT: Write Request (0x12) len 4
        Handle: 0x005b
          Data: 0000
< HCI Command: Host Number of Com.. (0x03|0x0035) plen 5  #281 [hci1] 21.864153
        Num handles: 1
        Handle: 2325 Address: DF:A9:FF:F6:B1:1A (OUI DF-A9-FF)
        Count: 1
< ACL Data TX: Handle 2325 flags 0x00 dlen 5              #282 [hci1] 21.864269
      ATT: Write Response (0x13) len 0
> HCI Event: Number of Completed Packets (0x13) plen 5    #283 [hci1] 22.162223
        Num handles: 1
        Handle: 2325 Address: DF:A9:FF:F6:B1:1A (OUI DF-A9-FF)
        Count: 1
        #282: len 5 (0 Kb/s)
        Latency: 297 msec (148-299 msec ~297 msec)
> ACL Data RX: Handle 2325 flags 0x02 dlen 9              #284 [hci1] 22.162373
      ATT: Write Request (0x12) len 4
        Handle: 0x005b
          Data: 0100
< HCI Command: Host Number of Com.. (0x03|0x0035) plen 5  #285 [hci1] 22.163700
        Num handles: 1
        Handle: 2325 Address: DF:A9:FF:F6:B1:1A (OUI DF-A9-FF)
        Count: 1
< ACL Data TX: Handle 2325 flags 0x00 dlen 5              #286 [hci1] 22.163732
      ATT: Write Response (0x13) len 0
> HCI Event: Number of Completed Packets (0x13) plen 5    #287 [hci1] 22.462227
        Num handles: 1
        Handle: 2325 Address: DF:A9:FF:F6:B1:1A (OUI DF-A9-FF)
        Count: 1
        #286: len 5 (0 Kb/s)
        Latency: 298 msec (148-299 msec ~298 msec)
> ACL Data RX: Handle 2325 flags 0x02 dlen 9              #288 [hci1] 22.462357
      ATT: Write Request (0x12) len 4
        Handle: 0x005e
          Data: 0000
< HCI Command: Host Number of Com.. (0x03|0x0035) plen 5  #289 [hci1] 22.464205
        Num handles: 1
        Handle: 2325 Address: DF:A9:FF:F6:B1:1A (OUI DF-A9-FF)
        Count: 1
< ACL Data TX: Handle 2325 flags 0x00 dlen 5              #290 [hci1] 22.464321
      ATT: Write Response (0x13) len 0
> HCI Event: Number of Completed Packets (0x13) plen 5    #291 [hci1] 22.762219
        Num handles: 1
        Handle: 2325 Address: DF:A9:FF:F6:B1:1A (OUI DF-A9-FF)
        Count: 1
        #290: len 5 (0 Kb/s)
        Latency: 297 msec (148-299 msec ~298 msec)
> ACL Data RX: Handle 2325 flags 0x02 dlen 9              #292 [hci1] 22.762408
      ATT: Write Request (0x12) len 4
        Handle: 0x005e
          Data: 0100
< HCI Command: Host Number of Com.. (0x03|0x0035) plen 5  #293 [hci1] 22.764088
        Num handles: 1
        Handle: 2325 Address: DF:A9:FF:F6:B1:1A (OUI DF-A9-FF)
        Count: 1
< ACL Data TX: Handle 2325 flags 0x00 dlen 5              #294 [hci1] 22.764177
      ATT: Write Response (0x13) len 0
> HCI Event: Number of Completed Packets (0x13) plen 5    #295 [hci1] 23.062254
        Num handles: 1
        Handle: 2325 Address: DF:A9:FF:F6:B1:1A (OUI DF-A9-FF)
        Count: 1
        #294: len 5 (0 Kb/s)
        Latency: 298 msec (148-299 msec ~298 msec)
> ACL Data RX: Handle 2325 flags 0x02 dlen 9              #296 [hci1] 23.062380
      ATT: Write Request (0x12) len 4
        Handle: 0x0061
          Data: 0000
< HCI Command: Host Number of Com.. (0x03|0x0035) plen 5  #297 [hci1] 23.063793
        Num handles: 1
        Handle: 2325 Address: DF:A9:FF:F6:B1:1A (OUI DF-A9-FF)
        Count: 1
< ACL Data TX: Handle 2325 flags 0x00 dlen 5              #298 [hci1] 23.063807
      ATT: Write Response (0x13) len 0
> HCI Event: Number of Completed Packets (0x13) plen 5    #299 [hci1] 23.362239
        Num handles: 1
        Handle: 2325 Address: DF:A9:FF:F6:B1:1A (OUI DF-A9-FF)
        Count: 1
        #298: len 5 (0 Kb/s)
        Latency: 298 msec (148-299 msec ~298 msec)
> ACL Data RX: Handle 2325 flags 0x02 dlen 9              #300 [hci1] 23.362356
      ATT: Write Request (0x12) len 4
        Handle: 0x0061
          Data: 0100
< HCI Command: Host Number of Com.. (0x03|0x0035) plen 5  #301 [hci1] 23.364111
        Num handles: 1
        Handle: 2325 Address: DF:A9:FF:F6:B1:1A (OUI DF-A9-FF)
        Count: 1
< ACL Data TX: Handle 2325 flags 0x00 dlen 5              #302 [hci1] 23.364246
      ATT: Write Response (0x13) len 0
> HCI Event: Number of Completed Packets (0x13) plen 5    #303 [hci1] 23.662271
        Num handles: 1
        Handle: 2325 Address: DF:A9:FF:F6:B1:1A (OUI DF-A9-FF)
        Count: 1
        #302: len 5 (0 Kb/s)
        Latency: 298 msec (148-299 msec ~298 msec)
> ACL Data RX: Handle 2325 flags 0x02 dlen 7              #304 [hci1] 23.662300
      ATT: Read Request (0x0a) len 2
        Handle: 0x0057
< HCI Command: Host Number of Com.. (0x03|0x0035) plen 5  #305 [hci1] 23.664314
        Num handles: 1
        Handle: 2325 Address: DF:A9:FF:F6:B1:1A (OUI DF-A9-FF)
        Count: 1
< ACL Data TX: Handle 2325 flags 0x00 dlen 7              #306 [hci1] 23.664415
      ATT: Read Response (0x0b) len 2
> HCI Event: Number of Completed Packets (0x13) plen 5    #307 [hci1] 23.962142
        Num handles: 1
        Handle: 2325 Address: DF:A9:FF:F6:B1:1A (OUI DF-A9-FF)
        Count: 1
        #306: len 7 (0 Kb/s)
        Latency: 297 msec (148-299 msec ~297 msec)
> ACL Data RX: Handle 2325 flags 0x02 dlen 7              #308 [hci1] 23.962401
      ATT: Read Request (0x0a) len 2
        Handle: 0x005a
< HCI Command: Host Number of Com.. (0x03|0x0035) plen 5  #309 [hci1] 23.963957
        Num handles: 1
        Handle: 2325 Address: DF:A9:FF:F6:B1:1A (OUI DF-A9-FF)
        Count: 1
< ACL Data TX: Handle 2325 flags 0x00 dlen 7              #310 [hci1] 23.963979
      ATT: Read Response (0x0b) len 2
> HCI Event: Number of Completed Packets (0x13) plen 5    #311 [hci1] 24.262198
        Num handles: 1
        Handle: 2325 Address: DF:A9:FF:F6:B1:1A (OUI DF-A9-FF)
        Count: 1
        #310: len 7 (0 Kb/s)
        Latency: 298 msec (148-299 msec ~298 msec)
> ACL Data RX: Handle 2325 flags 0x02 dlen 7              #312 [hci1] 24.262288
      ATT: Read Request (0x0a) len 2
        Handle: 0x005d
< HCI Command: Host Number of Com.. (0x03|0x0035) plen 5  #313 [hci1] 24.263653
        Num handles: 1
        Handle: 2325 Address: DF:A9:FF:F6:B1:1A (OUI DF-A9-FF)
        Count: 1
< ACL Data TX: Handle 2325 flags 0x00 dlen 7              #314 [hci1] 24.263671
      ATT: Read Response (0x0b) len 2
> HCI Event: Number of Completed Packets (0x13) plen 5    #315 [hci1] 24.562207
        Num handles: 1
        Handle: 2325 Address: DF:A9:FF:F6:B1:1A (OUI DF-A9-FF)
        Count: 1
        #314: len 7 (0 Kb/s)
        Latency: 298 msec (148-299 msec ~298 msec)
> ACL Data RX: Handle 2325 flags 0x02 dlen 7              #316 [hci1] 24.562308
      ATT: Read Request (0x0a) len 2
        Handle: 0x0060
< HCI Command: Host Number of Com.. (0x03|0x0035) plen 5  #317 [hci1] 24.563757
        Num handles: 1
        Handle: 2325 Address: DF:A9:FF:F6:B1:1A (OUI DF-A9-FF)
        Count: 1
< ACL Data TX: Handle 2325 flags 0x00 dlen 7              #318 [hci1] 24.563770
      ATT: Read Response (0x0b) len 2
> HCI Event: Number of Completed Packets (0x13) plen 5    #319 [hci1] 24.862251
        Num handles: 1
        Handle: 2325 Address: DF:A9:FF:F6:B1:1A (OUI DF-A9-FF)
        Count: 1
        #318: len 7 (0 Kb/s)
        Latency: 298 msec (148-299 msec ~298 msec)
> ACL Data RX: Handle 2325 flags 0x02 dlen 9              #320 [hci1] 24.862345
      ATT: Write Request (0x12) len 4
        Handle: 0x00b0
          Data: 0000
< HCI Command: Host Number of Com.. (0x03|0x0035) plen 5  #321 [hci1] 24.863977
        Num handles: 1
        Handle: 2325 Address: DF:A9:FF:F6:B1:1A (OUI DF-A9-FF)
        Count: 1
< ACL Data TX: Handle 2325 flags 0x00 dlen 5              #322 [hci1] 24.863999
      ATT: Write Response (0x13) len 0
> HCI Event: Number of Completed Packets (0x13) plen 5    #323 [hci1] 25.162182
        Num handles: 1
        Handle: 2325 Address: DF:A9:FF:F6:B1:1A (OUI DF-A9-FF)
        Count: 1
        #322: len 5 (0 Kb/s)
        Latency: 298 msec (148-299 msec ~298 msec)
> ACL Data RX: Handle 2325 flags 0x02 dlen 9              #324 [hci1] 25.162246
      ATT: Write Request (0x12) len 4
        Handle: 0x00b0
          Data: 0100
< HCI Command: Host Number of Com.. (0x03|0x0035) plen 5  #325 [hci1] 25.163619
        Num handles: 1
        Handle: 2325 Address: DF:A9:FF:F6:B1:1A (OUI DF-A9-FF)
        Count: 1
< ACL Data TX: Handle 2325 flags 0x00 dlen 5              #326 [hci1] 25.163626
      ATT: Write Response (0x13) len 0
> HCI Event: Number of Completed Packets (0x13) plen 5    #327 [hci1] 25.462138
        Num handles: 1
        Handle: 2325 Address: DF:A9:FF:F6:B1:1A (OUI DF-A9-FF)
        Count: 1
        #326: len 5 (0 Kb/s)
        Latency: 298 msec (148-299 msec ~298 msec)
> ACL Data RX: Handle 2325 flags 0x02 dlen 7              #328 [hci1] 25.462275
      ATT: Read Request (0x0a) len 2
        Handle: 0x0044
< HCI Command: Host Number of Com.. (0x03|0x0035) plen 5  #329 [hci1] 25.464003
        Num handles: 1
        Handle: 2325 Address: DF:A9:FF:F6:B1:1A (OUI DF-A9-FF)
        Count: 1
< ACL Data TX: Handle 2325 flags 0x00 dlen 9              #330 [hci1] 25.464065
      ATT: Read Response (0x0b) len 4
> HCI Event: Number of Completed Packets (0x13) plen 5    #331 [hci1] 25.762102
        Num handles: 1
        Handle: 2325 Address: DF:A9:FF:F6:B1:1A (OUI DF-A9-FF)
        Count: 1
        #330: len 9 (0 Kb/s)
        Latency: 298 msec (148-299 msec ~298 msec)
> ACL Data RX: Handle 2325 flags 0x02 dlen 7              #332 [hci1] 25.762260
      ATT: Read Request (0x0a) len 2
        Handle: 0x0041
< HCI Command: Host Number of Com.. (0x03|0x0035) plen 5  #333 [hci1] 25.763651
        Num handles: 1
        Handle: 2325 Address: DF:A9:FF:F6:B1:1A (OUI DF-A9-FF)
        Count: 1
< ACL Data TX: Handle 2325 flags 0x00 dlen 27             #334 [hci1] 25.763665
< ACL Data TX: Handle 2325 flags 0x01 dlen 27             #335 [hci1] 25.763667
< ACL Data TX: Handle 2325 flags 0x01 dlen 12             #336 [hci1] 25.763679
      ATT: Read Response (0x0b) len 61
> HCI Event: Number of Completed Packets (0x13) plen 5    #337 [hci1] 25.912734
        Num handles: 1
        Handle: 2325 Address: DF:A9:FF:F6:B1:1A (OUI DF-A9-FF)
        Count: 1
        #334: len 27 (1 Kb/s)
        Latency: 149 msec (148-299 msec ~223 msec)
> HCI Event: Number of Completed Packets (0x13) plen 5    #338 [hci1] 25.913185
        Num handles: 1
        Handle: 2325 Address: DF:A9:FF:F6:B1:1A (OUI DF-A9-FF)
        Count: 1
        #335: len 27 (1 Kb/s)
        Latency: 149 msec (148-299 msec ~186 msec)
> HCI Event: Number of Completed Packets (0x13) plen 5    #339 [hci1] 26.062089
        Num handles: 1
        Handle: 2325 Address: DF:A9:FF:F6:B1:1A (OUI DF-A9-FF)
        Count: 1
        #336: len 12 (0 Kb/s)
        Latency: 298 msec (148-299 msec ~242 msec)
> ACL Data RX: Handle 2325 flags 0x02 dlen 7              #340 [hci1] 26.062273
      ATT: Read Request (0x0a) len 2
        Handle: 0x004d
< HCI Command: Host Number of Com.. (0x03|0x0035) plen 5  #341 [hci1] 26.063661
        Num handles: 1
        Handle: 2325 Address: DF:A9:FF:F6:B1:1A (OUI DF-A9-FF)
        Count: 1
< ACL Data TX: Handle 2325 flags 0x00 dlen 9              #342 [hci1] 26.063669
      ATT: Read Response (0x0b) len 4
> HCI Event: Number of Completed Packets (0x13) plen 5    #343 [hci1] 26.362124
        Num handles: 1
        Handle: 2325 Address: DF:A9:FF:F6:B1:1A (OUI DF-A9-FF)
        Count: 1
        #342: len 9 (0 Kb/s)
        Latency: 298 msec (148-299 msec ~270 msec)
> ACL Data RX: Handle 2325 flags 0x02 dlen 7              #344 [hci1] 26.362217
      ATT: Read Request (0x0a) len 2
        Handle: 0x0050
< HCI Command: Host Number of Com.. (0x03|0x0035) plen 5  #345 [hci1] 26.364065
        Num handles: 1
        Handle: 2325 Address: DF:A9:FF:F6:B1:1A (OUI DF-A9-FF)
        Count: 1
< ACL Data TX: Handle 2325 flags 0x00 dlen 9              #346 [hci1] 26.364207
      ATT: Read Response (0x0b) len 4
> HCI Event: Number of Completed Packets (0x13) plen 5    #347 [hci1] 26.662152
        Num handles: 1
        Handle: 2325 Address: DF:A9:FF:F6:B1:1A (OUI DF-A9-FF)
        Count: 1
        #346: len 9 (0 Kb/s)
        Latency: 297 msec (148-299 msec ~284 msec)
> ACL Data RX: Handle 2325 flags 0x02 dlen 9              #348 [hci1] 26.662291
      ATT: Write Request (0x12) len 4
        Handle: 0x00ba
          Data: 0000
< HCI Command: Host Number of Com.. (0x03|0x0035) plen 5  #349 [hci1] 26.664236
        Num handles: 1
        Handle: 2325 Address: DF:A9:FF:F6:B1:1A (OUI DF-A9-FF)
        Count: 1
< ACL Data TX: Handle 2325 flags 0x00 dlen 5              #350 [hci1] 26.664347
      ATT: Write Response (0x13) len 0
> HCI Event: Number of Completed Packets (0x13) plen 5    #351 [hci1] 26.962192
        Num handles: 1
        Handle: 2325 Address: DF:A9:FF:F6:B1:1A (OUI DF-A9-FF)
        Count: 1
        #350: len 5 (0 Kb/s)
        Latency: 297 msec (148-299 msec ~291 msec)
> ACL Data RX: Handle 2325 flags 0x02 dlen 9              #352 [hci1] 26.962294
      ATT: Write Request (0x12) len 4
        Handle: 0x00ba
          Data: 0200
< HCI Command: Host Number of Com.. (0x03|0x0035) plen 5  #353 [hci1] 26.964262
        Num handles: 1
        Handle: 2325 Address: DF:A9:FF:F6:B1:1A (OUI DF-A9-FF)
        Count: 1
< ACL Data TX: Handle 2325 flags 0x00 dlen 5              #354 [hci1] 26.964339
      ATT: Write Response (0x13) len 0
> HCI Event: Number of Completed Packets (0x13) plen 5    #355 [hci1] 27.262202
        Num handles: 1
        Handle: 2325 Address: DF:A9:FF:F6:B1:1A (OUI DF-A9-FF)
        Count: 1
        #354: len 5 (0 Kb/s)
        Latency: 297 msec (148-299 msec ~294 msec)
> ACL Data RX: Handle 2325 flags 0x02 dlen 9              #356 [hci1] 27.262264
      ATT: Write Request (0x12) len 4
        Handle: 0x00bd
          Data: 0000
< HCI Command: Host Number of Com.. (0x03|0x0035) plen 5  #357 [hci1] 27.263767
        Num handles: 1
        Handle: 2325 Address: DF:A9:FF:F6:B1:1A (OUI DF-A9-FF)
        Count: 1
< ACL Data TX: Handle 2325 flags 0x00 dlen 5              #358 [hci1] 27.263792
      ATT: Write Response (0x13) len 0
> HCI Event: Number of Completed Packets (0x13) plen 5    #359 [hci1] 27.562159
        Num handles: 1
        Handle: 2325 Address: DF:A9:FF:F6:B1:1A (OUI DF-A9-FF)
        Count: 1
        #358: len 5 (0 Kb/s)
        Latency: 298 msec (148-299 msec ~296 msec)
> ACL Data RX: Handle 2325 flags 0x02 dlen 9              #360 [hci1] 27.562247
      ATT: Write Request (0x12) len 4
        Handle: 0x00bd
          Data: 0100
< HCI Command: Host Number of Com.. (0x03|0x0035) plen 5  #361 [hci1] 27.563919
        Num handles: 1
        Handle: 2325 Address: DF:A9:FF:F6:B1:1A (OUI DF-A9-FF)
        Count: 1
< ACL Data TX: Handle 2325 flags 0x00 dlen 5              #362 [hci1] 27.563977
      ATT: Write Response (0x13) len 0
> HCI Event: Number of Completed Packets (0x13) plen 5    #363 [hci1] 27.862233
        Num handles: 1
        Handle: 2325 Address: DF:A9:FF:F6:B1:1A (OUI DF-A9-FF)
        Count: 1
        #362: len 5 (0 Kb/s)
        Latency: 298 msec (148-299 msec ~297 msec)
> ACL Data RX: Handle 2325 flags 0x02 dlen 7              #364 [hci1] 27.862301
      ATT: Read Request (0x0a) len 2
        Handle: 0x00b7
< HCI Command: Host Number of Com.. (0x03|0x0035) plen 5  #365 [hci1] 27.863815
        Num handles: 1
        Handle: 2325 Address: DF:A9:FF:F6:B1:1A (OUI DF-A9-FF)
        Count: 1
< ACL Data TX: Handle 2325 flags 0x00 dlen 6              #366 [hci1] 27.863833
      ATT: Read Response (0x0b) len 1
> HCI Event: Number of Completed Packets (0x13) plen 5    #367 [hci1] 28.162119
        Num handles: 1
        Handle: 2325 Address: DF:A9:FF:F6:B1:1A (OUI DF-A9-FF)
        Count: 1
        #366: len 6 (0 Kb/s)
        Latency: 298 msec (148-299 msec ~297 msec)
> ACL Data RX: Handle 2325 flags 0x02 dlen 7              #368 [hci1] 28.162304
      ATT: Read Request (0x0a) len 2
        Handle: 0x00b7
< HCI Command: Host Number of Com.. (0x03|0x0035) plen 5  #369 [hci1] 28.163700
        Num handles: 1
        Handle: 2325 Address: DF:A9:FF:F6:B1:1A (OUI DF-A9-FF)
        Count: 1
< ACL Data TX: Handle 2325 flags 0x00 dlen 6              #370 [hci1] 28.163729
      ATT: Read Response (0x0b) len 1
> HCI Event: Number of Completed Packets (0x13) plen 5    #371 [hci1] 28.462068
        Num handles: 1
        Handle: 2325 Address: DF:A9:FF:F6:B1:1A (OUI DF-A9-FF)
        Count: 1
        #370: len 6 (0 Kb/s)
        Latency: 298 msec (148-299 msec ~298 msec)
> HCI Event: Disconnect Complete (0x05) plen 4            #372 [hci1] 29.812185
        Status: Success (0x00)
        Handle: 2325 Address: DF:A9:FF:F6:B1:1A (OUI DF-A9-FF)
        Reason: Remote User Terminated Connection (0x13)
< HCI Command: Reset (0x03|0x0003) plen 0                 #373 [hci1] 35.063750
> HCI Event: Command Complete (0x0e) plen 4               #374 [hci1] 35.064341
      Reset (0x03|0x0003) ncmd 1
        Status: Success (0x00)
@ USER Close: main                                    {0x0001} [hci1] 35.083599
= Close Index: 00:00:00:00:00:00                               [hci1] 35.087176
