Bluetooth monitor ver 5.84
btmon[1449807]: = Note: Linux version 6.8.0-83-generic (x86_64)                                                          0.178444
btmon[1449807]: = Note: Bluetooth subsystem version 2.22                                                                 0.178446
= New Index: 00:00:00:00:00:00 (Primary,UART,hci0)                                                                       0.178447
= Open Index: 00:00:00:00:00:00                                                                                          0.685988
= Index Info: 00:00:00:00:00:00 (Nordic Semiconductor ASA)                                                               0.685992
zephyr.exe[1449809]: @ USER Open: main (privileged) version 2.22                                                {0x0001} 0.685995
zephyr.exe[1449809]: < HCI Command: Reset (0x03|0x0003) plen 0                                                        #1 0.686262
> HCI Event: Command Complete (0x0e) plen 4                                                                           #2 0.686876
      Reset (0x03|0x0003) ncmd 1
        Status: Success (0x00)
zephyr.exe[1449809]: < HCI Command: Read Local Supported Features (0x04|0x0003) plen 0                                #3 0.705933
> HCI Event: Command Complete (0x0e) plen 12                                                                          #4 0.706673
      Read Local Supported Features (0x04|0x0003) ncmd 1
        Status: Success (0x00)
        Features: 0x00 0x00 0x00 0x00 0x60 0x00 0x00 0x00
          BR/EDR Not Supported
          LE Supported (Controller)
zephyr.exe[1449809]: < HCI Command: Read Local Version Information (0x04|0x0001) plen 0                               #5 0.725917
> HCI Event: Command Complete (0x0e) plen 12                                                                          #6 0.727049
      Read Local Version Information (0x04|0x0001) ncmd 1
        Status: Success (0x00)
        HCI version: Reserved (0x0e) - Revision 12520 (0x30e8)
        LMP version: Reserved (0x0e) - Subversion 12520 (0x30e8)
        Manufacturer: Nordic Semiconductor ASA (89)
zephyr.exe[1449809]: < HCI Command: Read Local Supported Commands (0x04|0x0002) plen 0                                #7 0.745911
> HCI Event: Command Complete (0x0e) plen 68                                                                          #8 0.747224
      Read Local Supported Commands (0x04|0x0002) ncmd 1
        Status: Success (0x00)
        Commands: 119 entries
          Disconnect (Octet 0 - Bit 5)
          Read Remote Version Information (Octet 2 - Bit 7)
          Set Event Mask (Octet 5 - Bit 6)
          Reset (Octet 5 - Bit 7)
          Read Connection Accept Timeout (Octet 7 - Bit 2)
          Write Connection Accept Timeout (Octet 7 - Bit 3)
          Read Transmit Power Level (Octet 10 - Bit 2)
          Set Controller To Host Flow Control (Octet 10 - Bit 5)
          Host Buffer Size (Octet 10 - Bit 6)
          Host Number of Completed Packets (Octet 10 - Bit 7)
          Read Local Version Information (Octet 14 - Bit 3)
          Read Local Supported Features (Octet 14 - Bit 5)
          Read BD ADDR (Octet 15 - Bit 1)
          Read RSSI (Octet 15 - Bit 5)
          Set Event Mask Page 2 (Octet 22 - Bit 2)
          LE Set Event Mask (Octet 25 - Bit 0)
          LE Read Buffer Size (Octet 25 - Bit 1)
          LE Read Local Supported Features (Octet 25 - Bit 2)
          LE Set Random Address (Octet 25 - Bit 4)
          LE Set Advertising Parameters (Octet 25 - Bit 5)
          LE Read Advertising Channel TX Power (Octet 25 - Bit 6)
          LE Set Advertising Data (Octet 25 - Bit 7)
          LE Set Scan Response Data (Octet 26 - Bit 0)
          LE Set Advertise Enable (Octet 26 - Bit 1)
          LE Set Scan Parameters (Octet 26 - Bit 2)
          LE Set Scan Enable (Octet 26 - Bit 3)
          LE Create Connection (Octet 26 - Bit 4)
          LE Create Connection Cancel (Octet 26 - Bit 5)
          LE Read Accept List Size (Octet 26 - Bit 6)
          LE Clear Accept List (Octet 26 - Bit 7)
          LE Add Device To Accept List (Octet 27 - Bit 0)
          LE Remove Device From Accept List (Octet 27 - Bit 1)
          LE Connection Update (Octet 27 - Bit 2)
          LE Set Host Channel Classification (Octet 27 - Bit 3)
          LE Read Channel Map (Octet 27 - Bit 4)
          LE Read Remote Used Features (Octet 27 - Bit 5)
          LE Encrypt (Octet 27 - Bit 6)
          LE Rand (Octet 27 - Bit 7)
          LE Start Encryption (Octet 28 - Bit 0)
          LE Long Term Key Request Reply (Octet 28 - Bit 1)
          LE Long Term Key Request Neg Reply (Octet 28 - Bit 2)
          LE Read Supported States (Octet 28 - Bit 3)
          LE Receiver Test (Octet 28 - Bit 4)
          LE Transmitter Test (Octet 28 - Bit 5)
          LE Test End (Octet 28 - Bit 6)
          Read Authenticated Payload Timeout (Octet 32 - Bit 4)
          Write Authenticated Payload Timeout (Octet 32 - Bit 5)
          LE Set Data Length (Octet 33 - Bit 6)
          LE Read Suggested Default Data Length (Octet 33 - Bit 7)
          LE Write Suggested Default Data Length (Octet 34 - Bit 0)
          LE Add Device To Resolving List (Octet 34 - Bit 3)
          LE Remove Device From Resolving List (Octet 34 - Bit 4)
          LE Clear Resolving List (Octet 34 - Bit 5)
          LE Read Resolving List Size (Octet 34 - Bit 6)
          LE Set Address Resolution Enable (Octet 35 - Bit 1)
          LE Set Resolvable Private Address Timeout (Octet 35 - Bit 2)
          LE Read Maximum Data Length (Octet 35 - Bit 3)
          LE Read PHY (Octet 35 - Bit 4)
          LE Set Default PHY (Octet 35 - Bit 5)
          LE Set PHY (Octet 35 - Bit 6)
          LE Enhanced Receiver Test (Octet 35 - Bit 7)
          LE Enhanced Transmitter Test (Octet 36 - Bit 0)
          LE Set Advertising Set Random Address (Octet 36 - Bit 1)
          LE Set Extended Advertising Parameters (Octet 36 - Bit 2)
          LE Set Extended Advertising Data (Octet 36 - Bit 3)
          LE Set Extended Scan Response Data (Octet 36 - Bit 4)
          LE Set Extended Advertising Enable (Octet 36 - Bit 5)
          LE Read Maximum Advertising Data Length (Octet 36 - Bit 6)
          LE Read Number of Supported Advertising Sets (Octet 36 - Bit 7)
          LE Remove Advertising Set (Octet 37 - Bit 0)
          LE Clear Advertising Sets (Octet 37 - Bit 1)
          LE Set Periodic Advertising Parameters (Octet 37 - Bit 2)
          LE Set Periodic Advertising Data (Octet 37 - Bit 3)
          LE Set Periodic Advertising Enable (Octet 37 - Bit 4)
          LE Set Extended Scan Parameters (Octet 37 - Bit 5)
          LE Set Extended Scan Enable (Octet 37 - Bit 6)
          LE Extended Create Connection (Octet 37 - Bit 7)
          LE Periodic Advertising Create Sync (Octet 38 - Bit 0)
          LE Periodic Advertising Create Sync Cancel (Octet 38 - Bit 1)
          LE Periodic Advertising Terminate Sync (Octet 38 - Bit 2)
          LE Add Device To Periodic Advertiser List (Octet 38 - Bit 3)
          LE Remove Device From Periodic Advertiser List (Octet 38 - Bit 4)
          LE Clear Periodic Advertiser List (Octet 38 - Bit 5)
          LE Read Periodic Advertiser List Size (Octet 38 - Bit 6)
          LE Read Transmit Power (Octet 38 - Bit 7)
          LE Read RF Path Compensation (Octet 39 - Bit 0)
          LE Write RF Path Compensation (Octet 39 - Bit 1)
          LE Set Privacy Mode (Octet 39 - Bit 2)
          LE Periodic Advertising Receive Enable (Octet 40 - Bit 5)
          LE Periodic Advertising Sync Transfer (Octet 40 - Bit 6)
          LE Periodic Advertising Set Info Transfer (Octet 40 - Bit 7)
          LE Periodic Advertising Sync Transfer Parameters (Octet 41 - Bit 0)
          LE Set Default Periodic Advertisng Sync Transfer Parameters (Octet 41 - Bit 1)
          LE Read Buffer v2 (Octet 41 - Bit 5)
          LE Read ISO TX Sync (Octet 41 - Bit 6)
          LE Set Connected Isochronous Group Parameters (Octet 41 - Bit 7)
          LE Set Connected Isochronous Group Parameters Test (Octet 42 - Bit 0)
          LE Create Connected Isochronous Stream (Octet 42 - Bit 1)
          LE Remove Connected Isochronous Group (Octet 42 - Bit 2)
          LE Accept Connected Isochronous Stream Request (Octet 42 - Bit 3)
          LE Reject Connected Isochronous Stream Request (Octet 42 - Bit 4)
          LE Create Broadcast Isochronous Group (Octet 42 - Bit 5)
          LE Create Broadcast Isochronous Group Test (Octet 42 - Bit 6)
          LE Terminate Broadcast Isochronous Group (Octet 42 - Bit 7)
          LE Broadcast Isochronous Group Create Sync (Octet 43 - Bit 0)
          LE Broadcast Isochronous Group Terminate Sync (Octet 43 - Bit 1)
          LE Request Peer SCA (Octet 43 - Bit 2)
          LE Setup Isochronous Data Path (Octet 43 - Bit 3)
          LE Remove Isochronous Data Path (Octet 43 - Bit 4)
          LE Isochronous Transmit Test (Octet 43 - Bit 5)
          LE Isochronous Receive Test (Octet 43 - Bit 6)
          LE Isochronous Read Test Counters (Octet 43 - Bit 7)
          LE Isochronous Read Test Counters (Octet 44 - Bit 0)
          LE Set Host Feature (Octet 44 - Bit 1)
          LE Read ISO link quality (Octet 44 - Bit 2)
          Octet 45 - Bit 6 
          Octet 46 - Bit 0 
          Octet 46 - Bit 1 
          Octet 46 - Bit 2 
zephyr.exe[1449809]: < HCI Command: Host Buffer Size (0x03|0x0033) plen 7                                             #9 0.765880
        ACL MTU: 255  ACL max packet: 16
        SCO MTU: 0    SCO max packet: 0
> HCI Event: Command Complete (0x0e) plen 4                                                                          #10 0.766851
      Host Buffer Size (0x03|0x0033) ncmd 1
        Status: Success (0x00)
zephyr.exe[1449809]: < HCI Command: Set Controller To Host Flow Control (0x03|0x0031) plen 1                         #11 0.785914
        Flow control: ACL Data Packets (0x01)
> HCI Event: Command Complete (0x0e) plen 4                                                                          #12 0.786447
      Set Controller To Host Flow Control (0x03|0x0031) ncmd 1
        Status: Success (0x00)
zephyr.exe[1449809]: < HCI Command: LE Read Local Supported Features (0x08|0x0003) plen 0                            #13 0.805910
> HCI Event: Command Complete (0x0e) plen 12                                                                         #14 0.806610
      LE Read Local Supported Features (0x08|0x0003) ncmd 1
        Status: Success (0x00)
        Features: 0xfd 0x79 0x00 0xf7 0x30 0x01 0x00 0x00
          LE Encryption
          Extended Reject Indication
          Peripheral-initiated Features Exchange
          LE Ping
          LE Data Packet Length Extension
          LL Privacy
          Extended Scanner Filter Policies
          LE 2M PHY
          LE Coded PHY
          LE Extended Advertising
          LE Periodic Advertising
          Channel Selection Algorithm #2
          Periodic Advertising Sync Transfer - Sender
          Periodic Advertising Sync Transfer - Recipient
          Sleep Clock Accuracy Updates
          Connected Isochronous Stream - Central
          Connected Isochronous Stream - Peripheral
          Isochronous Broadcaster
          Synchronized Receiver
          Periodic Advertising ADI support
          Connection Subrating
          Unknown features (0x0000010000000000)
zephyr.exe[1449809]: < HCI Command: LE Set Host Feature (0x08|0x0074) plen 2                                         #15 0.825917
        Bit Number: 32
          Connected Isochronous Stream (Host Support)
        Bit Value: 1
> HCI Event: Command Complete (0x0e) plen 4                                                                          #16 0.826500
      LE Set Host Feature (0x08|0x0074) ncmd 1
        Status: Success (0x00)
zephyr.exe[1449809]: < HCI Command: LE Read Buffer v2 (0x08|0x0060) plen 0                                           #17 0.845917
> HCI Event: Command Complete (0x0e) plen 10                                                                         #18 0.847187
      LE Read Buffer v2 (0x08|0x0060) ncmd 1
        Status: Success (0x00)
        ACL MTU: 27
        ACL max packet: 3
        ISO MTU: 318
        ISO max packet: 3
zephyr.exe[1449809]: < HCI Command: LE Read Maximum Advertising Data Length (0x08|0x003a) plen 0                     #19 0.865900
> HCI Event: Command Complete (0x0e) plen 6                                                                          #20 0.866626
      LE Read Maximum Advertising Data Length (0x08|0x003a) ncmd 1
        Status: Success (0x00)
        Max length: 1650
zephyr.exe[1449809]: < HCI Command: LE Read Supported States (0x08|0x001c) plen 0                                    #21 0.885908
> HCI Event: Command Complete (0x0e) plen 12                                                                         #22 0.886706
      LE Read Supported States (0x08|0x001c) ncmd 1
        Status: Success (0x00)
        States: 0x000003ff3e0306ff
          Non-connectable Advertising State
          Scannable Advertising State
          Connectable Advertising State
          High Duty Cycle Directed Advertising State
          Passive Scanning State
          Active Scanning State
          Initiating State
            and Connection State (Central Role)
          Connection State (Peripheral Role)
          Scannable Advertising State
            and Passive Scanning State
          Connectable Advertising State
            and Passive Scanning State
          Non-connectable Advertising State
            and Initiating State
          Scannable Advertising State
            and Initiating State
          Active Scanning State
            and Connection State (Central Role)
          Passive Scanning State
            and Connection State (Peripheral Role)
          Active Scanning State
            and Connection State (Peripheral Role)
          Initiating State
            and Connection State (Central Role)
            and Central Role & Central Role
          Low Duty Cycle Directed Advertising State
          Connectable Advertising State
            and Initiating State
            and Central Role & Peripheral Role
          High Duty Cycle Directed Advertising State
            and Initiating State
            and Central Role & Peripheral Role
          Low Duty Cycle Directed Advertising State
            and Initiating State
            and Central Role & Peripheral Role
          Connectable Advertising State
            and Connection State (Central Role)
            and Central Role & Peripheral Role
          High Duty Cycle Directed Advertising State
            and Connection State (Central Role)
            and Central Role & Peripheral Role
          Low Duty Cycle Directed Advertising State
            and Connection State (Central Role)
            and Central Role & Peripheral Role
          Connectable Advertising State
            and Connection State (Peripheral Role)
            and Central Role & Peripheral Role
          High Duty Cycle Directed Advertising State
            and Connection State (Peripheral Role)
            and Peripheral Role & Peripheral Role
          Low Duty Cycle Directed Advertising State
            and Connection State (Peripheral Role)
            and Peripheral Role & Peripheral Role
          Initiating State
            and Connection State (Peripheral Role)
            and Central Role & Peripheral Role
zephyr.exe[1449809]: < HCI Command: LE Read Maximum Data Length (0x08|0x002f) plen 0                                 #23 0.905904
> HCI Event: Command Complete (0x0e) plen 12                                                                         #24 0.906512
      LE Read Maximum Data Length (0x08|0x002f) ncmd 1
        Status: Success (0x00)
        Max TX octets: 251
        Max TX time: 2704
        Max RX octets: 251
        Max RX time: 2704
zephyr.exe[1449809]: < HCI Command: LE Write Suggested Default Data Length (0x08|0x0024) plen 4                      #25 0.925920
        TX octets: 251
        TX time: 2704
> HCI Event: Command Complete (0x0e) plen 4                                                                          #26 0.927461
      LE Write Suggested Default Data Length (0x08|0x0024) ncmd 1
        Status: Success (0x00)
zephyr.exe[1449809]: < HCI Command: LE Read Resolving List Size (0x08|0x002a) plen 0                                 #27 0.945885
> HCI Event: Command Complete (0x0e) plen 5                                                                          #28 0.946729
      LE Read Resolving List Size (0x08|0x002a) ncmd 1
        Status: Success (0x00)
        Size: 8
zephyr.exe[1449809]: < HCI Command: LE Set Event Mask (0x08|0x0001) plen 8                                           #29 0.965911
        Mask: 0x000002023f87fa5e
          LE Advertising Report
          LE Connection Update Complete
          LE Read Remote Used Features Complete
          LE Long Term Key Request
          LE Data Length Change
          LE Enhanced Connection Complete
          LE PHY Update Complete
          LE Extended Advertising Report
          LE Periodic Advertising Sync Established
          LE Periodic Advertising Report
          LE Periodic Advertising Sync Lost
          LE Extended Scan Timeout
          LE Extended Advertising Set Terminated
          LE Scan Request Received
          LE Periodic Advertising Sync Transfer Rvc
          LE CIS Established
          LE CIS Request
          LE Create BIG Complete
          LE Terminate BIG Complete
          LE BIG Sync Established Complete
          LE BIG Sync Lost
          LE BIG Info Advertising Report
          Unknown mask (0x0000020000000000)
> HCI Event: Command Complete (0x0e) plen 4                                                                          #30 0.966800
      LE Set Event Mask (0x08|0x0001) ncmd 1
        Status: Success (0x00)
zephyr.exe[1449809]: < HCI Command: Set Event Mask (0x03|0x0001) plen 8                                              #31 0.985916
        Mask: 0x2000800002008890
          Disconnection Complete
          Encryption Change
          Read Remote Version Information Complete
          Hardware Error
          Data Buffer Overflow
          Encryption Key Refresh Complete
          LE Meta
> HCI Event: Command Complete (0x0e) plen 4                                                                          #32 0.986824
      Set Event Mask (0x03|0x0001) ncmd 1
        Status: Success (0x00)
zephyr.exe[1449809]: < HCI Command: Read BD ADDR (0x04|0x0009) plen 0                                                #33 1.005908
> HCI Event: Command Complete (0x0e) plen 10                                                                         #34 1.006699
      Read BD ADDR (0x04|0x0009) ncmd 1
        Status: Success (0x00)
        Address: 00:00:00:00:00:00 (OUI 00-00-00)
zephyr.exe[1449809]: < HCI Command: LE Set Random Address (0x08|0x0005) plen 6                                       #35 1.025916
        Address: D5:B6:CC:31:DB:3B (Static)
> HCI Event: Command Complete (0x0e) plen 4                                                                          #36 1.026697
      LE Set Random Address (0x08|0x0005) ncmd 1
        Status: Success (0x00)
zephyr.exe[1449809]: < HCI Command: LE Set Extended Advertising Parameters (0x08|0x0036) plen 25                     #37 5.245992
        Handle: 0x00
        Properties: 0x0013
          Connectable
          Scannable
          Use legacy advertising PDUs: ADV_IND
        Min advertising interval: 100.000 msec (0x00a0)
        Max advertising interval: 150.000 msec (0x00f0)
        Channel map: 37, 38, 39 (0x07)
        Own address type: Random (0x01)
        Peer address type: Public (0x00)
        Peer address: 00:00:00:00:00:00 (OUI 00-00-00)
        Filter policy: Allow Scan Request from Any, Allow Connect Request from Any (0x00)
        TX power: Host has no preference (0x7f)
        Primary PHY: LE 1M (0x01)
        Secondary max skip: 0x00
        Secondary PHY: LE 1M (0x01)
        SID: 0x00
        Scan request notifications: Disabled (0x00)
> HCI Event: Command Complete (0x0e) plen 5                                                                          #38 5.246794
      LE Set Extended Advertising Parameters (0x08|0x0036) ncmd 1
        Status: Success (0x00)
        TX power (selected): 0 dbm (0x00)
zephyr.exe[1449809]: < HCI Command: LE Set Advertising Set Random Address (0x08|0x0035) plen 7                       #39 5.265951
        Advertising handle: 0x00
        Advertising random address: D5:B6:CC:31:DB:3B (Static)
> HCI Event: Command Complete (0x0e) plen 4                                                                          #40 5.266797
      LE Set Advertising Set Random Address (0x08|0x0035) ncmd 1
        Status: Success (0x00)
zephyr.exe[1449809]: < HCI Command: LE Set Extended Advertising Data (0x08|0x0037) plen 22                           #41 5.285970
        Handle: 0x00
        Operation: Complete extended advertising data (0x03)
        Fragment preference: Minimize fragmentation (0x01)
        Data length: 0x12
        Flags: 0x06
          LE General Discoverable Mode
          BR/EDR Not Supported
        Name (complete): Tester_F6B11A
> HCI Event: Command Complete (0x0e) plen 4                                                                          #42 5.286808
      LE Set Extended Advertising Data (0x08|0x0037) ncmd 1
        Status: Success (0x00)
zephyr.exe[1449809]: < HCI Command: LE Set Extended Scan Response Data (0x08|0x0038) plen 4                          #43 5.305950
        Handle: 0x00
        Operation: Complete scan response data (0x03)
        Fragment preference: Minimize fragmentation (0x01)
        Data length: 0x00
> HCI Event: Command Complete (0x0e) plen 4                                                                          #44 5.306801
      LE Set Extended Scan Response Data (0x08|0x0038) ncmd 1
        Status: Success (0x00)
zephyr.exe[1449809]: < HCI Command: LE Set Extended Advertising Enable (0x08|0x0039) plen 6                          #45 5.325952
        Extended advertising: Enabled (0x01)
        Number of sets: 1 (0x01)
        Entry 0
          Handle: 0x00
          Duration: 0 ms (0x00)
          Max ext adv events: 0
> HCI Event: Command Complete (0x0e) plen 4                                                                          #46 5.326885
      LE Set Extended Advertising Enable (0x08|0x0039) ncmd 1
        Status: Success (0x00)
> HCI Event: LE Meta Event (0x3e) plen 31                                                                            #47 5.641868
      LE Enhanced Connection Complete (0x0a)
        Status: Success (0x00)
        Handle: 957
        Role: Peripheral (0x01)
        Peer address type: Public (0x00)
        Peer address: DF:A9:FF:F6:B1:1A (OUI DF-A9-FF)
        Local resolvable private address: 00:00:00:00:00:00 (Non-Resolvable)
        Peer resolvable private address: 00:00:00:00:00:00 (Non-Resolvable)
        Connection interval: 87.50 msec (0x0046)
        Connection latency: 0 (0x0000)
        Supervision timeout: 20000 msec (0x07d0)
        Central clock accuracy: 0x01
> HCI Event: LE Meta Event (0x3e) plen 6                                                                             #48 5.642005
      LE Advertising Set Terminated (0x12)
        Status: Success (0x00)
        Handle: 0
        Connection handle: 957
        Number of completed extended advertising events: 0
zephyr.exe[1449809]: < HCI Command: LE Read Remote Used Features (0x08|0x0016) plen 2                                #49 5.646024
        Handle: 957 Address: DF:A9:FF:F6:B1:1A (OUI DF-A9-FF)
> HCI Event: Command Status (0x0f) plen 4                                                                            #50 5.646749
      LE Read Remote Used Features (0x08|0x0016) ncmd 1
        Status: Success (0x00)
> HCI Event: LE Meta Event (0x3e) plen 12                                                                            #51 5.906009
      LE Read Remote Used Features (0x04)
        Status: Success (0x00)
        Handle: 957 Address: DF:A9:FF:F6:B1:1A (OUI DF-A9-FF)
        Features: 0x2d 0x49 0x00 0xf7 0x67 0xd8 0x00 0x00
          LE Encryption
          Extended Reject Indication
          Peripheral-initiated Features Exchange
          LE Data Packet Length Extension
          LE 2M PHY
          LE Coded PHY
          Channel Selection Algorithm #2
          Periodic Advertising Sync Transfer - Sender
          Periodic Advertising Sync Transfer - Recipient
          Sleep Clock Accuracy Updates
          Connected Isochronous Stream - Central
          Connected Isochronous Stream - Peripheral
          Isochronous Broadcaster
          Synchronized Receiver
          Connected Isochronous Stream (Host Support)
          LE Power Control Request
          LE Power Control Request
          Connection Subrating
          Connection Subrating (Host Support)
          Unknown features (0x0000d80000000000)
zephyr.exe[1449809]: < ACL Data TX: Handle 957 [1/3] flags 0x00 dlen 16                                             #52 10.656007
      LE L2CAP: Connection Parameter Update Request (0x12) ident 1 len 8
        Min interval: 24
        Max interval: 40
        Peripheral latency: 0
        Timeout multiplier: 42
> HCI Event: Number of Completed Packets (0x13) plen 5                                                              #53 10.805439
        Num handles: 1
        Handle: 957 Address: DF:A9:FF:F6:B1:1A (OUI DF-A9-FF)
        Count: 1
        Buffers: 0/3
        #52: len 16 (0 Kb/s)
        Latency: 149 msec (149-149 msec ~149 msec)
> ACL Data RX: Handle 957 flags 0x02 dlen 10                                                                        #54 10.805515
      LE L2CAP: Connection Parameter Update Response (0x13) ident 1 len 2
        Result: Connection Parameters accepted (0x0000)
zephyr.exe[1449809]: < HCI Command: Host Number of Completed Packets (0x03|0x0035) plen 5                           #55 10.806015
        Num handles: 1
        Handle: 957 Address: DF:A9:FF:F6:B1:1A (OUI DF-A9-FF)
        Count: 1
> ACL Data RX: Handle 957 flags 0x02 dlen 11                                                                        #56 13.517792
      SMP: Pairing Request (0x01) len 6
        IO capability: KeyboardDisplay (0x04)
        OOB data: Authentication data not present (0x00)
        Authentication requirement: Bonding, No MITM, Legacy, No Keypresses (0x01)
        Max encryption key size: 16
        Initiator key distribution: EncKey IdKey Sign (0x07)
        Responder key distribution: EncKey IdKey Sign (0x07)
zephyr.exe[1449809]: < HCI Command: Host Number of Completed Packets (0x03|0x0035) plen 5                           #57 13.526199
        Num handles: 1
        Handle: 957 Address: DF:A9:FF:F6:B1:1A (OUI DF-A9-FF)
        Count: 1
zephyr.exe[1449809]: < ACL Data TX: Handle 957 [1/3] flags 0x00 dlen 11                                             #58 13.526273
      SMP: Pairing Response (0x02) len 6
        IO capability: NoInputNoOutput (0x03)
        OOB data: Authentication data not present (0x00)
        Authentication requirement: Bonding, No MITM, Legacy, No Keypresses (0x01)
        Max encryption key size: 16
        Initiator key distribution: EncKey IdKey Sign (0x07)
        Responder key distribution: EncKey Sign (0x05)
> HCI Event: Number of Completed Packets (0x13) plen 5                                                              #59 13.692977
        Num handles: 1
        Handle: 957 Address: DF:A9:FF:F6:B1:1A (OUI DF-A9-FF)
        Count: 1
        Buffers: 0/3
        #58: len 11 (0 Kb/s)
        Latency: 166 msec (149-166 msec ~158 msec)
> ACL Data RX: Handle 957 flags 0x02 dlen 21                                                                        #60 13.693146
      SMP: Pairing Confirm (0x03) len 16
        Confirm value[16]: 80ccb98659e2acc3895ce89ae1592f74
zephyr.exe[1449809]: < HCI Command: Host Number of Completed Packets (0x03|0x0035) plen 5                           #61 13.706119
        Num handles: 1
        Handle: 957 Address: DF:A9:FF:F6:B1:1A (OUI DF-A9-FF)
        Count: 1
zephyr.exe[1449809]: < ACL Data TX: Handle 957 [1/3] flags 0x00 dlen 21                                             #62 13.706202
      SMP: Pairing Confirm (0x03) len 16
        Confirm value[16]: 372f6c353da1be04f36b544431c7f9dd
> HCI Event: Number of Completed Packets (0x13) plen 5                                                              #63 13.867700
        Num handles: 1
        Handle: 957 Address: DF:A9:FF:F6:B1:1A (OUI DF-A9-FF)
        Count: 1
        Buffers: 0/3
        #62: len 21 (1 Kb/s)
        Latency: 161 msec (149-166 msec ~159 msec)
> ACL Data RX: Handle 957 flags 0x02 dlen 21                                                                        #64 13.868455
      SMP: Pairing Random (0x04) len 16
        Random value[16]: 7f844069ee9d4ccb0000000000000000
zephyr.exe[1449809]: < HCI Command: Host Number of Completed Packets (0x03|0x0035) plen 5                           #65 13.886239
        Num handles: 1
        Handle: 957 Address: DF:A9:FF:F6:B1:1A (OUI DF-A9-FF)
        Count: 1
zephyr.exe[1449809]: < ACL Data TX: Handle 957 [1/3] flags 0x00 dlen 21                                             #66 13.886262
      SMP: Pairing Random (0x04) len 16
        Random value[16]: 8e6108f966a694cbe26df70bb96773e6
> HCI Event: Number of Completed Packets (0x13) plen 5                                                              #67 14.042833
        Num handles: 1
        Handle: 957 Address: DF:A9:FF:F6:B1:1A (OUI DF-A9-FF)
        Count: 1
        Buffers: 0/3
        #66: len 21 (1 Kb/s)
        Latency: 156 msec (149-166 msec ~158 msec)
> HCI Event: LE Meta Event (0x3e) plen 13                                                                           #68 14.130713
      LE Long Term Key Request (0x05)
        Handle: 957 Address: DF:A9:FF:F6:B1:1A (OUI DF-A9-FF)
        Random number: 0x0000000000000000
        Encrypted diversifier: 0x0000
zephyr.exe[1449809]: < HCI Command: LE Long Term Key Request Reply (0x08|0x001a) plen 18                            #69 14.146072
        Handle: 957 Address: DF:A9:FF:F6:B1:1A (OUI DF-A9-FF)
        Long term key[16]: 4fb47706fc471f47ad9263e81bfc6690
> HCI Event: Command Complete (0x0e) plen 6                                                                         #70 14.146869
      LE Long Term Key Request Reply (0x08|0x001a) ncmd 1
        Status: Success (0x00)
        Handle: 957 Address: DF:A9:FF:F6:B1:1A (OUI DF-A9-FF)
> HCI Event: Encryption Change (0x08) plen 4                                                                        #71 14.567895
        Status: Success (0x00)
        Handle: 957 Address: DF:A9:FF:F6:B1:1A (OUI DF-A9-FF)
        Encryption: Enabled with AES-CCM (0x01)
zephyr.exe[1449809]: < ACL Data TX: Handle 957 [1/3] flags 0x00 dlen 21                                             #72 14.696172
      SMP: Encryption Information (0x06) len 16
        Long term key[16]: 5da095555cc64d02679f89a05211af56
zephyr.exe[1449809]: < ACL Data TX: Handle 957 [2/3] flags 0x00 dlen 15                                             #73 14.696179
      SMP: Central Identification (0x07) len 10
        EDIV: 0x825e
        Rand: 0x84c81ed264dab3d8
zephyr.exe[1449809]: < ACL Data TX: Handle 957 [3/3] flags 0x00 dlen 21                                             #74 14.696180
      SMP: Signing Information (0x0a) len 16
        Signature key[16]: bc235a02440d0c3424a2acf8fd71a45c
> HCI Event: Number of Completed Packets (0x13) plen 5                                                              #75 14.743170
        Num handles: 1
        Handle: 957 Address: DF:A9:FF:F6:B1:1A (OUI DF-A9-FF)
        Count: 1
        Buffers: 2/3
        #72: len 21 (3 Kb/s)
        Latency: 46 msec (46-166 msec ~102 msec)
> HCI Event: Number of Completed Packets (0x13) plen 5                                                              #76 14.743825
        Num handles: 1
        Handle: 957 Address: DF:A9:FF:F6:B1:1A (OUI DF-A9-FF)
        Count: 1
        Buffers: 1/3
        #73: len 15 (2 Kb/s)
        Latency: 47 msec (46-166 msec ~75 msec)
> HCI Event: Number of Completed Packets (0x13) plen 5                                                              #77 14.830303
        Num handles: 1
        Handle: 957 Address: DF:A9:FF:F6:B1:1A (OUI DF-A9-FF)
        Count: 1
        Buffers: 0/3
        #74: len 21 (1 Kb/s)
        Latency: 134 msec (46-166 msec ~104 msec)
> ACL Data RX: Handle 957 flags 0x02 dlen 21                                                                        #78 14.830582
      SMP: Encryption Information (0x06) len 16
        Long term key[16]: c91209dfa13db1a83dbf68148a641579
> ACL Data RX: Handle 957 flags 0x02 dlen 15                                                                        #79 14.831023
      SMP: Central Identification (0x07) len 10
        EDIV: 0x7372
        Rand: 0x400def59349f4f57
> ACL Data RX: Handle 957 flags 0x02 dlen 21                                                                        #80 14.831807
      SMP: Identity Information (0x08) len 16
        Identity resolving key[16]: 2fec0732edf1779faee0593190acde21
zephyr.exe[1449809]: < HCI Command: Host Number of Completed Packets (0x03|0x0035) plen 5                           #81 14.846240
        Num handles: 1
        Handle: 957 Address: DF:A9:FF:F6:B1:1A (OUI DF-A9-FF)
        Count: 1
zephyr.exe[1449809]: < HCI Command: Host Number of Completed Packets (0x03|0x0035) plen 5                           #82 14.846327
        Num handles: 1
        Handle: 957 Address: DF:A9:FF:F6:B1:1A (OUI DF-A9-FF)
        Count: 1
zephyr.exe[1449809]: < HCI Command: Host Number of Completed Packets (0x03|0x0035) plen 5                           #83 14.846418
        Num handles: 1
        Handle: 957 Address: DF:A9:FF:F6:B1:1A (OUI DF-A9-FF)
        Count: 1
> ACL Data RX: Handle 957 flags 0x02 dlen 12                                                                        #84 14.918186
      SMP: Identity Address Information (0x09) len 7
        Address: DF:A9:FF:F6:B1:1A (OUI DF-A9-FF)
> ACL Data RX: Handle 957 flags 0x02 dlen 21                                                                        #85 14.918828
      SMP: Signing Information (0x0a) len 16
        Signature key[16]: 80e07be4ac3df7f23ba5c3cb3c38893c
> ACL Data RX: Handle 957 flags 0x02 dlen 26                                                                        #86 14.919309
      LE L2CAP: Enhanced Credit Connection Request (0x17) ident 1 len 18
        PSM: 39 (0x0027)
        MTU: 64
        MPS: 64
        Credits: 5
        Source CID: 84
        Source CID: 83
        Source CID: 82
        Source CID: 81
        Source CID: 80
zephyr.exe[1449809]: < HCI Command: LE Add Device To Resolving List (0x08|0x0027) plen 39                           #87 14.926134
        Address type: Public (0x00)
        Address: DF:A9:FF:F6:B1:1A (OUI DF-A9-FF)
        Peer identity resolving key[16]: 2fec0732edf1779faee0593190acde21
        Local identity resolving key[16]: 00000000000000000000000000000000
> HCI Event: Command Complete (0x0e) plen 4                                                                         #88 14.927239
      LE Add Device To Resolving List (0x08|0x0027) ncmd 1
        Status: Success (0x00)
zephyr.exe[1449809]: < HCI Command: LE Set Privacy Mode (0x08|0x004e) plen 8                                        #89 14.946067
        Peer Identity address type: Public (0x00)
        Peer Identity address: DF:A9:FF:F6:B1:1A (OUI DF-A9-FF)
        Privacy Mode: Use Device Privacy (0x01)
> HCI Event: Command Complete (0x0e) plen 4                                                                         #90 14.946946
      LE Set Privacy Mode (0x08|0x004e) ncmd 1
        Status: Success (0x00)
zephyr.exe[1449809]: < HCI Command: LE Set Address Resolution Enable (0x08|0x002d) plen 1                           #91 14.966092
        Address resolution: Enabled (0x01)
> HCI Event: Command Complete (0x0e) plen 4                                                                         #92 14.967258
      LE Set Address Resolution Enable (0x08|0x002d) ncmd 1
        Status: Success (0x00)
zephyr.exe[1449809]: < HCI Command: Host Number of Completed Packets (0x03|0x0035) plen 5                           #93 14.986145
        Num handles: 1
        Handle: 957 Address: DF:A9:FF:F6:B1:1A (OUI DF-A9-FF)
        Count: 1
zephyr.exe[1449809]: < HCI Command: Host Number of Completed Packets (0x03|0x0035) plen 5                           #94 14.986222
        Num handles: 1
        Handle: 957 Address: DF:A9:FF:F6:B1:1A (OUI DF-A9-FF)
        Count: 1
zephyr.exe[1449809]: < HCI Command: Host Number of Completed Packets (0x03|0x0035) plen 5                           #95 14.986226
        Num handles: 1
        Handle: 957 Address: DF:A9:FF:F6:B1:1A (OUI DF-A9-FF)
        Count: 1
zephyr.exe[1449809]: < ACL Data TX: Handle 957 [1/3] flags 0x00 dlen 26                                             #96 14.986279
      LE L2CAP: Enhanced Credit Connection Response (0x18) ident 1 len 18
        MTU: 249
        MPS: 251
        Credits: 1
        Result: Connection successful (0x0000)
        Destination CID: 64
        Destination CID: 65
        Destination CID: 66
        Destination CID: 67
        Destination CID: 68
> HCI Event: Number of Completed Packets (0x13) plen 5                                                              #97 15.092665
        Num handles: 1
        Handle: 957 Address: DF:A9:FF:F6:B1:1A (OUI DF-A9-FF)
        Count: 1
        Buffers: 0/3
        #96: len 26 (1 Kb/s)
        Latency: 106 msec (46-166 msec ~105 msec)
zephyr.exe[1449809]: < ACL Data TX: Handle 957 [1/3] flags 0x00 dlen 9                                              #98 18.726204
      Channel: 80 len 5 sdu 3 [PSM 39 mode Enhanced Credit (0x81)] {chan 4}
      ATT: Read Request (0x0a) len 2
        Handle: 0x01a7
> HCI Event: Number of Completed Packets (0x13) plen 5                                                              #99 18.855402
        Num handles: 1
        Handle: 957 Address: DF:A9:FF:F6:B1:1A (OUI DF-A9-FF)
        Count: 1
        Buffers: 0/3
        #98: len 9 (0 Kb/s)
        Latency: 129 msec (46-166 msec ~117 msec)
        Channel: 80 [PSM 39 mode Enhanced Credit (0x81)] {chan 4}
        Channel Latency: 129 msec (129-129 msec ~129 msec)
> ACL Data RX: Handle 957 flags 0x02 dlen 27                                                                       #100 18.855465
> ACL Data RX: Handle 957 flags 0x01 dlen 27                                                                       #101 18.856256
> ACL Data RX: Handle 957 flags 0x01 dlen 16                                                                       #102 18.856666
      Channel: 68 len 66 sdu 64 [PSM 39 mode Enhanced Credit (0x81)] {chan 4}
      ATT: Read Response (0x0b) len 63
        Value[63]: 001122334455667788990011223344556677889900112233445566778899001122334455667788990011223344556677889900112233445566778899001122
zephyr.exe[1449809]: < HCI Command: Host Number of Completed Packets (0x03|0x0035) plen 5                          #103 18.866225
        Num handles: 1
        Handle: 957 Address: DF:A9:FF:F6:B1:1A (OUI DF-A9-FF)
        Count: 1
zephyr.exe[1449809]: < HCI Command: Host Number of Completed Packets (0x03|0x0035) plen 5                          #104 18.866313
        Num handles: 1
        Handle: 957 Address: DF:A9:FF:F6:B1:1A (OUI DF-A9-FF)
        Count: 1
zephyr.exe[1449809]: < HCI Command: Host Number of Completed Packets (0x03|0x0035) plen 5                          #105 18.866350
        Num handles: 1
        Handle: 957 Address: DF:A9:FF:F6:B1:1A (OUI DF-A9-FF)
        Count: 1
zephyr.exe[1449809]: < ACL Data TX: Handle 957 [1/3] flags 0x00 dlen 11                                            #106 18.866353
      Channel: 80 len 7 sdu 5 [PSM 39 mode Enhanced Credit (0x81)] {chan 4}
      ATT: Read Blob Request (0x0c) len 4
        Handle: 0x01a7
        Offset: 0x003f
zephyr.exe[1449809]: < ACL Data TX: Handle 957 [2/3] flags 0x00 dlen 12                                            #107 18.866354
      LE L2CAP: LE Flow Control Credit (0x16) ident 2 len 4
        Source CID: 68
        Credits: 1
> HCI Event: Number of Completed Packets (0x13) plen 5                                                             #108 18.942953
        Num handles: 1
        Handle: 957 Address: DF:A9:FF:F6:B1:1A (OUI DF-A9-FF)
        Count: 1
        Buffers: 1/3
        #106: len 11 (1 Kb/s)
        Latency: 76 msec (46-166 msec ~96 msec)
        Channel: 80 [PSM 39 mode Enhanced Credit (0x81)] {chan 4}
        Channel Latency: 76 msec (76-129 msec ~102 msec)
> HCI Event: Number of Completed Packets (0x13) plen 5                                                             #109 19.030146
        Num handles: 1
        Handle: 957 Address: DF:A9:FF:F6:B1:1A (OUI DF-A9-FF)
        Count: 1
        Buffers: 0/3
        #107: len 12 (0 Kb/s)
        Latency: 163 msec (46-166 msec ~130 msec)
        Channel: 80 [PSM 39 mode Enhanced Credit (0x81)] {chan 4}
        Channel Latency: 163 msec (76-163 msec ~133 msec)
> ACL Data RX: Handle 957 flags 0x02 dlen 8                                                                        #110 19.030616
      Channel: 68 len 4 sdu 2 [PSM 39 mode Enhanced Credit (0x81)] {chan 4}
      ATT: Read Blob Response (0x0d) len 1
        Value[1]: 33
zephyr.exe[1449809]: < HCI Command: Host Number of Completed Packets (0x03|0x0035) plen 5                          #111 19.046186
        Num handles: 1
        Handle: 957 Address: DF:A9:FF:F6:B1:1A (OUI DF-A9-FF)
        Count: 1
zephyr.exe[1449809]: < ACL Data TX: Handle 957 [1/3] flags 0x00 dlen 12                                            #112 19.046270
      LE L2CAP: LE Flow Control Credit (0x16) ident 3 len 4
        Source CID: 68
        Credits: 1
> HCI Event: Number of Completed Packets (0x13) plen 5                                                             #113 19.205475
        Num handles: 1
        Handle: 957 Address: DF:A9:FF:F6:B1:1A (OUI DF-A9-FF)
        Count: 1
        Buffers: 0/3
        #112: len 12 (0 Kb/s)
        Latency: 159 msec (46-166 msec ~144 msec)
        Channel: 80 [PSM 39 mode Enhanced Credit (0x81)] {chan 4}
        Channel Latency: 159 msec (76-163 msec ~146 msec)
zephyr.exe[1449809]: < ACL Data TX: Handle 957 [1/3] flags 0x00 dlen 9                                             #114 21.096192
      Channel: 80 len 5 sdu 3 [PSM 39 mode Enhanced Credit (0x81)] {chan 4}
      ATT: Read Request (0x0a) len 2
        Handle: 0x01b0
> HCI Event: Number of Completed Packets (0x13) plen 5                                                             #115 21.217863
        Num handles: 1
        Handle: 957 Address: DF:A9:FF:F6:B1:1A (OUI DF-A9-FF)
        Count: 1
        Buffers: 0/3
        #114: len 9 (0 Kb/s)
        Latency: 121 msec (46-166 msec ~133 msec)
> ACL Data RX: Handle 957 flags 0x02 dlen 27                                                                       #116 21.217952
> ACL Data RX: Handle 957 flags 0x01 dlen 27                                                                       #117 21.218378
> ACL Data RX: Handle 957 flags 0x01 dlen 16                                                                       #118 21.219129
      Channel: 68 len 66 sdu 64 [PSM 39 mode Enhanced Credit (0x81)] {chan 4}
      ATT: Read Response (0x0b) len 63
        Value[63]: ffeeddccbbaa00112233445566778899ffeeddccbbaa00112233445566778899ffeeddccbbaa00112233445566778899ffeeddccbbaa001122334455667788
zephyr.exe[1449809]: < HCI Command: Host Number of Completed Packets (0x03|0x0035) plen 5                          #119 21.226273
        Num handles: 1
        Handle: 957 Address: DF:A9:FF:F6:B1:1A (OUI DF-A9-FF)
        Count: 1
zephyr.exe[1449809]: < HCI Command: Host Number of Completed Packets (0x03|0x0035) plen 5                          #120 21.226368
        Num handles: 1
        Handle: 957 Address: DF:A9:FF:F6:B1:1A (OUI DF-A9-FF)
        Count: 1
zephyr.exe[1449809]: < HCI Command: Host Number of Completed Packets (0x03|0x0035) plen 5                          #121 21.226372
        Num handles: 1
        Handle: 957 Address: DF:A9:FF:F6:B1:1A (OUI DF-A9-FF)
        Count: 1
zephyr.exe[1449809]: < ACL Data TX: Handle 957 [1/3] flags 0x00 dlen 11                                            #122 21.226452
      Channel: 80 len 7 sdu 5 [PSM 39 mode Enhanced Credit (0x81)] {chan 4}
      ATT: Read Blob Request (0x0c) len 4
        Handle: 0x01b0
        Offset: 0x003f
zephyr.exe[1449809]: < ACL Data TX: Handle 957 [2/3] flags 0x00 dlen 12                                            #123 21.226455
      LE L2CAP: LE Flow Control Credit (0x16) ident 4 len 4
        Source CID: 68
        Credits: 1
> HCI Event: Number of Completed Packets (0x13) plen 5                                                             #124 21.305466
        Num handles: 1
        Handle: 957 Address: DF:A9:FF:F6:B1:1A (OUI DF-A9-FF)
        Count: 1
        Buffers: 1/3
        #122: len 11 (1 Kb/s)
        Latency: 79 msec (46-166 msec ~106 msec)
> HCI Event: Number of Completed Packets (0x13) plen 5                                                             #125 21.392542
        Num handles: 1
        Handle: 957 Address: DF:A9:FF:F6:B1:1A (OUI DF-A9-FF)
        Count: 1
        Buffers: 0/3
        #123: len 12 (0 Kb/s)
        Latency: 166 msec (46-166 msec ~136 msec)
        Channel: 80 [PSM 39 mode Enhanced Credit (0x81)] {chan 4}
        Channel Latency: 166 msec (76-166 msec ~156 msec)
> ACL Data RX: Handle 957 flags 0x02 dlen 12                                                                       #126 21.392751
      LE L2CAP: LE Flow Control Credit (0x16) ident 2 len 4
        Source CID: 80
        Credits: 10
> ACL Data RX: Handle 957 flags 0x02 dlen 27                                                                       #127 21.393430
> ACL Data RX: Handle 957 flags 0x01 dlen 27                                                                       #128 21.394244
zephyr.exe[1449809]: < HCI Command: Host Number of Completed Packets (0x03|0x0035) plen 5                          #129 21.406212
        Num handles: 1
        Handle: 957 Address: DF:A9:FF:F6:B1:1A (OUI DF-A9-FF)
        Count: 1
zephyr.exe[1449809]: < HCI Command: Host Number of Completed Packets (0x03|0x0035) plen 5                          #130 21.406363
        Num handles: 1
        Handle: 957 Address: DF:A9:FF:F6:B1:1A (OUI DF-A9-FF)
        Count: 1
> ACL Data RX: Handle 957 flags 0x01 dlen 16                                                                       #131 21.407030
      Channel: 68 len 66 sdu 64 [PSM 39 mode Enhanced Credit (0x81)] {chan 4}
      ATT: Read Blob Response (0x0d) len 63
        Value[63]: 99ffeeddccbbaa00112233445566778899ffeeddccbbaa00112233445566778899ffeeddccbbaa00112233445566778899ffeeddccbbaa0011223344556677
zephyr.exe[1449809]: < HCI Command: Host Number of Completed Packets (0x03|0x0035) plen 5                          #132 21.426126
        Num handles: 1
        Handle: 957 Address: DF:A9:FF:F6:B1:1A (OUI DF-A9-FF)
        Count: 1
zephyr.exe[1449809]: < HCI Command: Host Number of Completed Packets (0x03|0x0035) plen 5                          #133 21.426135
        Num handles: 1
        Handle: 957 Address: DF:A9:FF:F6:B1:1A (OUI DF-A9-FF)
        Count: 1
zephyr.exe[1449809]: < ACL Data TX: Handle 957 [1/3] flags 0x00 dlen 11                                            #134 21.426385
      Channel: 80 len 7 sdu 5 [PSM 39 mode Enhanced Credit (0x81)] {chan 4}
      ATT: Read Blob Request (0x0c) len 4
        Handle: 0x01b0
        Offset: 0x007e
zephyr.exe[1449809]: < ACL Data TX: Handle 957 [2/3] flags 0x00 dlen 12                                            #135 21.426388
      LE L2CAP: LE Flow Control Credit (0x16) ident 5 len 4
        Source CID: 68
        Credits: 1
> HCI Event: Number of Completed Packets (0x13) plen 5                                                             #136 21.480503
        Num handles: 1
        Handle: 957 Address: DF:A9:FF:F6:B1:1A (OUI DF-A9-FF)
        Count: 1
        Buffers: 1/3
        #134: len 11 (1 Kb/s)
        Latency: 54 msec (46-166 msec ~95 msec)
        Channel: 80 [PSM 39 mode Enhanced Credit (0x81)] {chan 4}
        Channel Latency: 54 msec (54-166 msec ~105 msec)
> HCI Event: Number of Completed Packets (0x13) plen 5                                                             #137 21.567682
        Num handles: 1
        Handle: 957 Address: DF:A9:FF:F6:B1:1A (OUI DF-A9-FF)
        Count: 1
        Buffers: 0/3
        #135: len 12 (0 Kb/s)
        Latency: 141 msec (46-166 msec ~118 msec)
        Channel: 80 [PSM 39 mode Enhanced Credit (0x81)] {chan 4}
        Channel Latency: 141 msec (54-166 msec ~123 msec)
> ACL Data RX: Handle 957 flags 0x02 dlen 8                                                                        #138 21.567768
      Channel: 68 len 4 sdu 2 [PSM 39 mode Enhanced Credit (0x81)] {chan 4}
      ATT: Read Blob Response (0x0d) len 1
        Value[1]: 88
zephyr.exe[1449809]: < HCI Command: Host Number of Completed Packets (0x03|0x0035) plen 5                          #139 21.586393
        Num handles: 1
        Handle: 957 Address: DF:A9:FF:F6:B1:1A (OUI DF-A9-FF)
        Count: 1
zephyr.exe[1449809]: < ACL Data TX: Handle 957 [1/3] flags 0x00 dlen 12                                            #140 21.586399
      LE L2CAP: LE Flow Control Credit (0x16) ident 6 len 4
        Source CID: 68
        Credits: 1
> HCI Event: Number of Completed Packets (0x13) plen 5                                                             #141 21.742602
        Num handles: 1
        Handle: 957 Address: DF:A9:FF:F6:B1:1A (OUI DF-A9-FF)
        Count: 1
        Buffers: 0/3
        #140: len 12 (0 Kb/s)
        Latency: 156 msec (46-166 msec ~137 msec)
        Channel: 80 [PSM 39 mode Enhanced Credit (0x81)] {chan 4}
        Channel Latency: 156 msec (54-166 msec ~139 msec)
zephyr.exe[1449809]: < ACL Data TX: Handle 957 [1/3] flags 0x00 dlen 9                                             #142 23.636212
      Channel: 80 len 5 sdu 3 [PSM 39 mode Enhanced Credit (0x81)] {chan 4}
      ATT: Read Request (0x0a) len 2
        Handle: 0x01a4
> HCI Event: Number of Completed Packets (0x13) plen 5                                                             #143 23.755170
        Num handles: 1
        Handle: 957 Address: DF:A9:FF:F6:B1:1A (OUI DF-A9-FF)
        Count: 1
        Buffers: 0/3
        #142: len 9 (0 Kb/s)
        Latency: 118 msec (46-166 msec ~128 msec)
> ACL Data RX: Handle 957 flags 0x02 dlen 27                                                                       #144 23.755519
> ACL Data RX: Handle 957 flags 0x01 dlen 27                                                                       #145 23.756213
> ACL Data RX: Handle 957 flags 0x01 dlen 16                                                                       #146 23.756469
      Channel: 68 len 66 sdu 64 [PSM 39 mode Enhanced Credit (0x81)] {chan 4}
      ATT: Read Response (0x0b) len 63
        Value[63]: ffeeddccbbaa00112233445566778899ffeeddccbbaa00112233445566778899ffeeddccbbaa00112233445566778899ffeeddccbbaa001122334455667788
zephyr.exe[1449809]: < HCI Command: Host Number of Completed Packets (0x03|0x0035) plen 5                          #147 23.766351
        Num handles: 1
        Handle: 957 Address: DF:A9:FF:F6:B1:1A (OUI DF-A9-FF)
        Count: 1
zephyr.exe[1449809]: < HCI Command: Host Number of Completed Packets (0x03|0x0035) plen 5                          #148 23.766442
        Num handles: 1
        Handle: 957 Address: DF:A9:FF:F6:B1:1A (OUI DF-A9-FF)
        Count: 1
zephyr.exe[1449809]: < HCI Command: Host Number of Completed Packets (0x03|0x0035) plen 5                          #149 23.766482
        Num handles: 1
        Handle: 957 Address: DF:A9:FF:F6:B1:1A (OUI DF-A9-FF)
        Count: 1
zephyr.exe[1449809]: < ACL Data TX: Handle 957 [1/3] flags 0x00 dlen 11                                            #150 23.766544
      Channel: 80 len 7 sdu 5 [PSM 39 mode Enhanced Credit (0x81)] {chan 4}
      ATT: Read Blob Request (0x0c) len 4
        Handle: 0x01a4
        Offset: 0x003f
zephyr.exe[1449809]: < ACL Data TX: Handle 957 [2/3] flags 0x00 dlen 12                                            #151 23.766548
      LE L2CAP: LE Flow Control Credit (0x16) ident 7 len 4
        Source CID: 68
        Credits: 1
> HCI Event: Number of Completed Packets (0x13) plen 5                                                             #152 23.843009
        Num handles: 1
        Handle: 957 Address: DF:A9:FF:F6:B1:1A (OUI DF-A9-FF)
        Count: 1
        Buffers: 1/3
        #150: len 11 (1 Kb/s)
        Latency: 76 msec (46-166 msec ~102 msec)
        Channel: 80 [PSM 39 mode Enhanced Cr