Bluetooth monitor ver 5.72
= Note: Linux version 6.14.0-36-generic (x86_64)                       0.481713
= Note: Bluetooth subsystem version 2.22                               0.481715
= New Index: 00:00:00:00:00:00 (Primary,UART,hci1)              [hci1] 0.481716
= New Index: 48:5F:99:8E:E0:64 (Primary,USB,hci0)               [hci0] 0.481717
= Open Index: 00:00:00:00:00:00                                 [hci1] 0.494957
= Index Info: 00:00:00:00:00:00 (Nordic Semiconductor ASA)      [hci1] 0.494961
@ USER Open: main (privileged) version 2.22            {0x0001} [hci1] 0.494963
< HCI Command: Reset (0x03|0x0003) plen 0                    #1 [hci1] 0.495304
> HCI Event: Command Complete (0x0e) plen 4                  #2 [hci1] 0.495786
      Reset (0x03|0x0003) ncmd 1
        Status: Success (0x00)
< HCI Command: Read Local Supported... (0x04|0x0003) plen 0  #3 [hci1] 0.514909
> HCI Event: Command Complete (0x0e) plen 12                 #4 [hci1] 0.515353
      Read Local Supported Features (0x04|0x0003) ncmd 1
        Status: Success (0x00)
        Features: 0x00 0x00 0x00 0x00 0x60 0x00 0x00 0x00
          BR/EDR Not Supported
          LE Supported (Controller)
< HCI Command: Read Local Version In.. (0x04|0x0001) plen 0  #5 [hci1] 0.534878
> HCI Event: Command Complete (0x0e) plen 12                 #6 [hci1] 0.535466
      Read Local Version Information (0x04|0x0001) ncmd 1
        Status: Success (0x00)
        HCI version: Reserved (0x0f) - Revision 12393 (0x3069)
        LMP version: Reserved (0x0f) - Subversion 12393 (0x3069)
        Manufacturer: Nordic Semiconductor ASA (89)
< HCI Command: Read Local Supported... (0x04|0x0002) plen 0  #7 [hci1] 0.554933
> HCI Event: Command Complete (0x0e) plen 68                 #8 [hci1] 0.555998
      Read Local Supported Commands (0x04|0x0002) ncmd 1
        Status: Success (0x00)
        Commands: 119 entries
          Disconnect (Octet 0 - Bit 5)
          Read Remote Version Information (Octet 2 - Bit 7)
          Set Event Mask (Octet 5 - Bit 6)
          Reset (Octet 5 - Bit 7)
          Read Connection Accept Timeout (Octet 7 - Bit 2)
          Write Connection Accept Timeout (Octet 7 - Bit 3)
          Read Transmit Power Level (Octet 10 - Bit 2)
          Set Controller To Host Flow Control (Octet 10 - Bit 5)
          Host Buffer Size (Octet 10 - Bit 6)
          Host Number of Completed Packets (Octet 10 - Bit 7)
          Read Local Version Information (Octet 14 - Bit 3)
          Read Local Supported Features (Octet 14 - Bit 5)
          Read BD ADDR (Octet 15 - Bit 1)
          Read RSSI (Octet 15 - Bit 5)
          Set Event Mask Page 2 (Octet 22 - Bit 2)
          LE Set Event Mask (Octet 25 - Bit 0)
          LE Read Buffer Size (Octet 25 - Bit 1)
          LE Read Local Supported Features (Octet 25 - Bit 2)
          LE Set Random Address (Octet 25 - Bit 4)
          LE Set Advertising Parameters (Octet 25 - Bit 5)
          LE Read Advertising Channel TX Power (Octet 25 - Bit 6)
          LE Set Advertising Data (Octet 25 - Bit 7)
          LE Set Scan Response Data (Octet 26 - Bit 0)
          LE Set Advertise Enable (Octet 26 - Bit 1)
          LE Set Scan Parameters (Octet 26 - Bit 2)
          LE Set Scan Enable (Octet 26 - Bit 3)
          LE Create Connection (Octet 26 - Bit 4)
          LE Create Connection Cancel (Octet 26 - Bit 5)
          LE Read Accept List Size (Octet 26 - Bit 6)
          LE Clear Accept List (Octet 26 - Bit 7)
          LE Add Device To Accept List (Octet 27 - Bit 0)
          LE Remove Device From Accept List (Octet 27 - Bit 1)
          LE Connection Update (Octet 27 - Bit 2)
          LE Set Host Channel Classification (Octet 27 - Bit 3)
          LE Read Channel Map (Octet 27 - Bit 4)
          LE Read Remote Used Features (Octet 27 - Bit 5)
          LE Encrypt (Octet 27 - Bit 6)
          LE Rand (Octet 27 - Bit 7)
          LE Start Encryption (Octet 28 - Bit 0)
          LE Long Term Key Request Reply (Octet 28 - Bit 1)
          LE Long Term Key Request Neg Reply (Octet 28 - Bit 2)
          LE Read Supported States (Octet 28 - Bit 3)
          LE Receiver Test (Octet 28 - Bit 4)
          LE Transmitter Test (Octet 28 - Bit 5)
          LE Test End (Octet 28 - Bit 6)
          Read Authenticated Payload Timeout (Octet 32 - Bit 4)
          Write Authenticated Payload Timeout (Octet 32 - Bit 5)
          LE Set Data Length (Octet 33 - Bit 6)
          LE Read Suggested Default Data Length (Octet 33 - Bit 7)
          LE Write Suggested Default Data Length (Octet 34 - Bit 0)
          LE Add Device To Resolving List (Octet 34 - Bit 3)
          LE Remove Device From Resolving List (Octet 34 - Bit 4)
          LE Clear Resolving List (Octet 34 - Bit 5)
          LE Read Resolving List Size (Octet 34 - Bit 6)
          LE Set Address Resolution Enable (Octet 35 - Bit 1)
          LE Set Resolvable Private Address Timeout (Octet 35 - Bit 2)
          LE Read Maximum Data Length (Octet 35 - Bit 3)
          LE Read PHY (Octet 35 - Bit 4)
          LE Set Default PHY (Octet 35 - Bit 5)
          LE Set PHY (Octet 35 - Bit 6)
          LE Enhanced Receiver Test (Octet 35 - Bit 7)
          LE Enhanced Transmitter Test (Octet 36 - Bit 0)
          LE Set Advertising Set Random Address (Octet 36 - Bit 1)
          LE Set Extended Advertising Parameters (Octet 36 - Bit 2)
          LE Set Extended Advertising Data (Octet 36 - Bit 3)
          LE Set Extended Scan Response Data (Octet 36 - Bit 4)
          LE Set Extended Advertising Enable (Octet 36 - Bit 5)
          LE Read Maximum Advertising Data Length (Octet 36 - Bit 6)
          LE Read Number of Supported Advertising Sets (Octet 36 - Bit 7)
          LE Remove Advertising Set (Octet 37 - Bit 0)
          LE Clear Advertising Sets (Octet 37 - Bit 1)
          LE Set Periodic Advertising Parameters (Octet 37 - Bit 2)
          LE Set Periodic Advertising Data (Octet 37 - Bit 3)
          LE Set Periodic Advertising Enable (Octet 37 - Bit 4)
          LE Set Extended Scan Parameters (Octet 37 - Bit 5)
          LE Set Extended Scan Enable (Octet 37 - Bit 6)
          LE Extended Create Connection (Octet 37 - Bit 7)
          LE Periodic Advertising Create Sync (Octet 38 - Bit 0)
          LE Periodic Advertising Create Sync Cancel (Octet 38 - Bit 1)
          LE Periodic Advertising Terminate Sync (Octet 38 - Bit 2)
          LE Add Device To Periodic Advertiser List (Octet 38 - Bit 3)
          LE Remove Device From Periodic Advertiser List (Octet 38 - Bit 4)
          LE Clear Periodic Advertiser List (Octet 38 - Bit 5)
          LE Read Periodic Advertiser List Size (Octet 38 - Bit 6)
          LE Read Transmit Power (Octet 38 - Bit 7)
          LE Read RF Path Compensation (Octet 39 - Bit 0)
          LE Write RF Path Compensation (Octet 39 - Bit 1)
          LE Set Privacy Mode (Octet 39 - Bit 2)
          LE Periodic Advertising Receive Enable (Octet 40 - Bit 5)
          LE Periodic Advertising Sync Transfer (Octet 40 - Bit 6)
          LE Periodic Advertising Set Info Transfer (Octet 40 - Bit 7)
          LE Periodic Advertising Sync Transfer Parameters (Octet 41 - Bit 0)
          LE Set Default Periodic Advertisng Sync Transfer Parameters (Octet 41 - Bit 1)
          LE Read Buffer v2 (Octet 41 - Bit 5)
          LE Read ISO TX Sync (Octet 41 - Bit 6)
          LE Set Connected Isochronous Group Parameters (Octet 41 - Bit 7)
          LE Set Connected Isochronous Group Parameters Test (Octet 42 - Bit 0)
          LE Create Connected Isochronous Stream (Octet 42 - Bit 1)
          LE Remove Connected Isochronous Group (Octet 42 - Bit 2)
          LE Accept Connected Isochronous Stream Request (Octet 42 - Bit 3)
          LE Reject Connected Isochronous Stream Request (Octet 42 - Bit 4)
          LE Create Broadcast Isochronous Group (Octet 42 - Bit 5)
          LE Create Broadcast Isochronous Group Test (Octet 42 - Bit 6)
          LE Terminate Broadcast Isochronous Group (Octet 42 - Bit 7)
          LE Broadcast Isochronous Group Create Sync (Octet 43 - Bit 0)
          LE Broadcast Isochronous Group Terminate Sync (Octet 43 - Bit 1)
          LE Request Peer SCA (Octet 43 - Bit 2)
          LE Setup Isochronous Data Path (Octet 43 - Bit 3)
          LE Remove Isochronous Data Path (Octet 43 - Bit 4)
          LE Isochronous Transmit Test (Octet 43 - Bit 5)
          LE Isochronous Receive Test (Octet 43 - Bit 6)
          LE Isochronous Read Test Counters (Octet 43 - Bit 7)
          LE Isochronous Read Test Counters (Octet 44 - Bit 0)
          LE Set Host Feature (Octet 44 - Bit 1)
          Octet 44 - Bit 2 
          Octet 45 - Bit 6 
          Octet 46 - Bit 0 
          Octet 46 - Bit 1 
          Octet 46 - Bit 2 
< HCI Command: Host Buffer Size (0x03|0x0033) plen 7         #9 [hci1] 0.574913
        ACL MTU: 255  ACL max packet: 16
        SCO MTU: 0    SCO max packet: 0
> HCI Event: Command Complete (0x0e) plen 4                 #10 [hci1] 0.575377
      Host Buffer Size (0x03|0x0033) ncmd 1
        Status: Success (0x00)
< HCI Command: Set Controller To Ho.. (0x03|0x0031) plen 1  #11 [hci1] 0.594911
        Flow control: ACL Data Packets (0x01)
> HCI Event: Command Complete (0x0e) plen 4                 #12 [hci1] 0.595324
      Set Controller To Host Flow Control (0x03|0x0031) ncmd 1
        Status: Success (0x00)
< HCI Command: LE Read Local Suppor.. (0x08|0x0003) plen 0  #13 [hci1] 0.614924
> HCI Event: Command Complete (0x0e) plen 12                #14 [hci1] 0.615483
      LE Read Local Supported Features (0x08|0x0003) ncmd 1
        Status: Success (0x00)
        Features: 0xfd 0x79 0x00 0xf7 0x30 0x01 0x00 0x00
          LE Encryption
          Extended Reject Indication
          Peripheral-initiated Features Exchange
          LE Ping
          LE Data Packet Length Extension
          LL Privacy
          Extended Scanner Filter Policies
          LE 2M PHY
          LE Coded PHY
          LE Extended Advertising
          LE Periodic Advertising
          Channel Selection Algorithm #2
          Periodic Advertising Sync Transfer - Sender
          Periodic Advertising Sync Transfer - Recipient
          Sleep Clock Accuracy Updates
          Connected Isochronous Stream - Central
          Connected Isochronous Stream - Peripheral
          Isochronous Broadcaster
          Synchronized Receiver
          Periodic Advertising ADI support
          Connection Subrating
          Unknown features (0x0000010000000000)
< HCI Command: LE Set Host Feature (0x08|0x0074) plen 2     #15 [hci1] 0.634892
        Bit Number: 32
          Connected Isochronous Stream (Host Support)
        Bit Value: 1
> HCI Event: Command Complete (0x0e) plen 4                 #16 [hci1] 0.635324
      LE Set Host Feature (0x08|0x0074) ncmd 1
        Status: Success (0x00)
< HCI Command: LE Read Buffer v2 (0x08|0x0060) plen 0       #17 [hci1] 0.654913
> HCI Event: Command Complete (0x0e) plen 10                #18 [hci1] 0.655403
      LE Read Buffer v2 (0x08|0x0060) ncmd 1
        Status: Success (0x00)
        ACL MTU: 27
        ACL max packet: 3
        ISO MTU: 318
        ISO max packet: 3
< HCI Command: LE Read Maximum Adve.. (0x08|0x003a) plen 0  #19 [hci1] 0.674943
> HCI Event: Command Complete (0x0e) plen 6                 #20 [hci1] 0.675381
      LE Read Maximum Advertising Data Length (0x08|0x003a) ncmd 1
        Status: Success (0x00)
        Max length: 1650
< HCI Command: LE Read Supported St.. (0x08|0x001c) plen 0  #21 [hci1] 0.694923
> HCI Event: Command Complete (0x0e) plen 12                #22 [hci1] 0.695367
      LE Read Supported States (0x08|0x001c) ncmd 1
        Status: Success (0x00)
        States: 0x000003ff3e0306ff
          Non-connectable Advertising State
          Scannable Advertising State
          Connectable Advertising State
          High Duty Cycle Directed Advertising State
          Passive Scanning State
          Active Scanning State
          Initiating State
            and Connection State (Central Role)
          Connection State (Peripheral Role)
          Scannable Advertising State
            and Passive Scanning State
          Connectable Advertising State
            and Passive Scanning State
          Non-connectable Advertising State
            and Initiating State
          Scannable Advertising State
            and Initiating State
          Active Scanning State
            and Connection State (Central Role)
          Passive Scanning State
            and Connection State (Peripheral Role)
          Active Scanning State
            and Connection State (Peripheral Role)
          Initiating State
            and Connection State (Central Role)
            and Central Role & Central Role
          Low Duty Cycle Directed Advertising State
          Connectable Advertising State
            and Initiating State
            and Central Role & Peripheral Role
          High Duty Cycle Directed Advertising State
            and Initiating State
            and Central Role & Peripheral Role
          Low Duty Cycle Directed Advertising State
            and Initiating State
            and Central Role & Peripheral Role
          Connectable Advertising State
            and Connection State (Central Role)
            and Central Role & Peripheral Role
          High Duty Cycle Directed Advertising State
            and Connection State (Central Role)
            and Central Role & Peripheral Role
          Low Duty Cycle Directed Advertising State
            and Connection State (Central Role)
            and Central Role & Peripheral Role
          Connectable Advertising State
            and Connection State (Peripheral Role)
            and Central Role & Peripheral Role
          High Duty Cycle Directed Advertising State
            and Connection State (Peripheral Role)
            and Peripheral Role & Peripheral Role
          Low Duty Cycle Directed Advertising State
            and Connection State (Peripheral Role)
            and Peripheral Role & Peripheral Role
          Initiating State
            and Connection State (Peripheral Role)
            and Central Role & Peripheral Role
< HCI Command: LE Read Maximum Data.. (0x08|0x002f) plen 0  #23 [hci1] 0.714916
> HCI Event: Command Complete (0x0e) plen 12                #24 [hci1] 0.715390
      LE Read Maximum Data Length (0x08|0x002f) ncmd 1
        Status: Success (0x00)
        Max TX octets: 251
        Max TX time: 2704
        Max RX octets: 251
        Max RX time: 2704
< HCI Command: LE Write Suggested D.. (0x08|0x0024) plen 4  #25 [hci1] 0.734930
        TX octets: 251
        TX time: 2704
> HCI Event: Command Complete (0x0e) plen 4                 #26 [hci1] 0.735527
      LE Write Suggested Default Data Length (0x08|0x0024) ncmd 1
        Status: Success (0x00)
< HCI Command: LE Read Resolving Li.. (0x08|0x002a) plen 0  #27 [hci1] 0.754922
> HCI Event: Command Complete (0x0e) plen 5                 #28 [hci1] 0.755358
      LE Read Resolving List Size (0x08|0x002a) ncmd 1
        Status: Success (0x00)
        Size: 8
< HCI Command: LE Set Event Mask (0x08|0x0001) plen 8       #29 [hci1] 0.774912
        Mask: 0x000002023f87fa5e
          LE Advertising Report
          LE Connection Update Complete
          LE Read Remote Used Features Complete
          LE Long Term Key Request
          LE Data Length Change
          LE Enhanced Connection Complete
          LE PHY Update Complete
          LE Extended Advertising Report
          LE Periodic Advertising Sync Established
          LE Periodic Advertising Report
          LE Periodic Advertising Sync Lost
          LE Extended Scan Timeout
          LE Extended Advertising Set Terminated
          LE Scan Request Received
          LE Periodic Advertising Sync Transfer Rvc
          LE CIS Established
          LE CIS Request
          LE Create BIG Complete
          LE Terminate BIG Complete
          LE BIG Sync Estabilished Complete
          LE BIG Sync Lost
          LE BIG Info Advertising Report
          Unknown mask (0x0000020000000000)
> HCI Event: Command Complete (0x0e) plen 4                 #30 [hci1] 0.775393
      LE Set Event Mask (0x08|0x0001) ncmd 1
        Status: Success (0x00)
< HCI Command: Set Event Mask (0x03|0x0001) plen 8          #31 [hci1] 0.794920
        Mask: 0x2000800002008890
          Disconnection Complete
          Encryption Change
          Read Remote Version Information Complete
          Hardware Error
          Data Buffer Overflow
          Encryption Key Refresh Complete
          LE Meta
> HCI Event: Command Complete (0x0e) plen 4                 #32 [hci1] 0.795567
      Set Event Mask (0x03|0x0001) ncmd 1
        Status: Success (0x00)
< HCI Command: Read BD ADDR (0x04|0x0009) plen 0            #33 [hci1] 0.814932
> HCI Event: Command Complete (0x0e) plen 10                #34 [hci1] 0.815355
      Read BD ADDR (0x04|0x0009) ncmd 1
        Status: Success (0x00)
        Address: 00:00:00:00:00:00 (OUI 00-00-00)
< HCI Command: LE Set Random Address (0x08|0x0005) plen 6   #35 [hci1] 0.834922
        Address: D5:B6:CC:31:DB:3B (Static)
> HCI Event: Command Complete (0x0e) plen 4                 #36 [hci1] 0.835394
      LE Set Random Address (0x08|0x0005) ncmd 1
        Status: Success (0x00)
< HCI Command: LE Extended Create... (0x08|0x0043) plen 26  #37 [hci1] 3.195021
        Filter policy: Accept list is not used (0x00)
        Own address type: Random (0x01)
        Peer address type: Public (0x00)
        Peer address: DF:A9:FF:F6:B1:1A (OUI DF-A9-FF)
        Initiating PHYs: 0x01
        Entry 0: LE 1M
          Scan interval: 60.000 msec (0x0060)
          Scan window: 60.000 msec (0x0060)
          Min connection interval: 30.00 msec (0x0018)
          Max connection interval: 50.00 msec (0x0028)
          Connection latency: 0 (0x0000)
          Supervision timeout: 4000 msec (0x0190)
          Min connection length: 0.000 msec (0x0000)
          Max connection length: 0.000 msec (0x0000)
> HCI Event: Command Status (0x0f) plen 4                   #38 [hci1] 3.195961
      LE Extended Create Connection (0x08|0x0043) ncmd 1
        Status: Success (0x00)
> HCI Event: LE Meta Event (0x3e) plen 31                   #39 [hci1] 3.267285
      LE Enhanced Connection Complete (0x0a)
        Status: Success (0x00)
        Handle: 1278
        Role: Central (0x00)
        Peer address type: Public (0x00)
        Peer address: DF:A9:FF:F6:B1:1A (OUI DF-A9-FF)
        Local resolvable private address: 00:00:00:00:00:00 (Non-Resolvable)
        Peer resolvable private address: 00:00:00:00:00:00 (Non-Resolvable)
        Connection interval: 50.00 msec (0x0028)
        Connection latency: 0 (0x0000)
        Supervision timeout: 4000 msec (0x0190)
        Central clock accuracy: 0x00
< HCI Command: LE Read Remote Used... (0x08|0x0016) plen 2  #40 [hci1] 3.275158
        Handle: 1278 Address: DF:A9:FF:F6:B1:1A (OUI DF-A9-FF)
> HCI Event: Command Status (0x0f) plen 4                   #41 [hci1] 3.275635
      LE Read Remote Used Features (0x08|0x0016) ncmd 1
        Status: Success (0x00)
< HCI Command: LE Set PHY (0x08|0x0032) plen 7              #42 [hci1] 3.295050
        Handle: 1278 Address: DF:A9:FF:F6:B1:1A (OUI DF-A9-FF)
        All PHYs preference: 0x00
        TX PHYs preference: 0x02
          LE 2M
        RX PHYs preference: 0x02
          LE 2M
        PHY options preference: Reserved (0x0000)
> HCI Event: Command Status (0x0f) plen 4                   #43 [hci1] 3.295647
      LE Set PHY (0x08|0x0032) ncmd 1
        Status: Success (0x00)
> HCI Event: LE Meta Event (0x3e) plen 12                   #44 [hci1] 3.418791
      LE Read Remote Used Features (0x04)
        Status: Success (0x00)
        Handle: 1278 Address: DF:A9:FF:F6:B1:1A (OUI DF-A9-FF)
        Features: 0x2d 0x49 0x00 0xf7 0x67 0xd8 0x00 0x00
          LE Encryption
          Extended Reject Indication
          Peripheral-initiated Features Exchange
          LE Data Packet Length Extension
          LE 2M PHY
          LE Coded PHY
          Channel Selection Algorithm #2
          Periodic Advertising Sync Transfer - Sender
          Periodic Advertising Sync Transfer - Recipient
          Sleep Clock Accuracy Updates
          Connected Isochronous Stream - Central
          Connected Isochronous Stream - Peripheral
          Isochronous Broadcaster
          Synchronized Receiver
          Connected Isochronous Stream (Host Support)
          LE Power Control Request
          LE Power Control Request
          Connection Subrating
          Connection Subrating (Host Support)
          Unknown features (0x0000d80000000000)
> HCI Event: LE Meta Event (0x3e) plen 6                    #45 [hci1] 3.918137
      LE PHY Update Complete (0x0c)
        Status: Success (0x00)
        Handle: 1278 Address: DF:A9:FF:F6:B1:1A (OUI DF-A9-FF)
        TX PHY: LE 2M (0x02)
        RX PHY: LE 2M (0x02)
< ACL Data TX: Handle 1278 flags 0x00 dlen 18               #46 [hci1] 5.265034
      LE L2CAP: Enhanced Credit Connection Request (0x17) ident 1 len 10
        PSM: 128 (0x0080)
        MTU: 120
        MPS: 96
        Credits: 1
        Source CID: 64
> HCI Event: Number of Completed Packets (0x13) plen 5      #47 [hci1] 5.268615
        Num handles: 1
        Handle: 1278 Address: DF:A9:FF:F6:B1:1A (OUI DF-A9-FF)
        Count: 1
        #46: len 18 (48 Kb/s)
        Latency: 3 msec (3-3 msec ~3 msec)
> ACL Data RX: Handle 1278 flags 0x02 dlen 18               #48 [hci1] 5.318768
      LE L2CAP: Enhanced Credit Connection Response (0x18) ident 1 len 10
        MTU: 256
        MPS: 65
        Credits: 3
        Result: Connection successful (0x0000)
        Destination CID: 64
< HCI Command: Host Number of Compl.. (0x03|0x0035) plen 5  #49 [hci1] 5.335075
        Num handles: 1
        Handle: 1278 Address: DF:A9:FF:F6:B1:1A (OUI DF-A9-FF)
        Count: 1
< ACL Data TX: Handle 1278 flags 0x00 dlen 27               #50 [hci1] 6.406691
< ACL Data TX: Handle 1278 flags 0x01 dlen 27               #51 [hci1] 6.406723
< ACL Data TX: Handle 1278 flags 0x01 dlen 15               #52 [hci1] 6.406728
      Channel: 64 len 65 sdu 256 [PSM 128 mode Enhanced Credit (0x81)] {chan 0}
        00 01 00 00 00 00 00 00 00 00 00 00 00 00 00 00  ................
        00 00 00 00 00 00 00 00 00 00 00 00 00 00 00 00  ................
        00 00 00 00 00 00 00 00 00 00 00 00 00 00 00 00  ................
        00 00 00 00 00 00 00 00 00 00 00 00 00 00 00 00  ................
        00                                               .               
> HCI Event: Number of Completed Packets (0x13) plen 5      #53 [hci1] 6.418595
        Num handles: 1
        Handle: 1278 Address: DF:A9:FF:F6:B1:1A (OUI DF-A9-FF)
        Count: 1
        #50: len 27 (19 Kb/s)
        Latency: 11 msec (3-11 msec ~7 msec)
        Channel: 64 [PSM 128 mode Enhanced Credit (0x81)] {chan 0}
        Channel Latency: 11 msec (11-11 msec ~11 msec)
> HCI Event: Number of Completed Packets (0x13) plen 5      #54 [hci1] 6.419104
        Num handles: 1
        Handle: 1278 Address: DF:A9:FF:F6:B1:1A (OUI DF-A9-FF)
        Count: 1
        #51: len 27 (18 Kb/s)
        Latency: 12 msec (3-12 msec ~10 msec)
> HCI Event: Number of Completed Packets (0x13) plen 5      #55 [hci1] 6.419432
        Num handles: 1
        Handle: 1278 Address: DF:A9:FF:F6:B1:1A (OUI DF-A9-FF)
        Count: 1
        #52: len 15 (10 Kb/s)
        Latency: 12 msec (3-12 msec ~11 msec)
< ACL Data TX: Handle 1278 flags 0x00 dlen 27               #56 [hci1] 6.435074
< ACL Data TX: Handle 1278 flags 0x01 dlen 27               #57 [hci1] 6.435180
< ACL Data TX: Handle 1278 flags 0x01 dlen 15               #58 [hci1] 6.435184
      Channel: 64 len 65 sdu 193 [PSM 128 mode Enhanced Credit (0x81)] {chan 0}
        00 00 00 00 00 00 00 00 00 00 00 00 00 00 00 00  ................
        00 00 00 00 00 00 00 00 00 00 00 00 00 00 00 00  ................
        00 00 00 00 00 00 00 00 00 00 00 00 00 00 00 00  ................
        00 00 00 00 00 00 00 00 00 00 00 00 00 00 00 00  ................
        00                                               .               
> HCI Event: Number of Completed Packets (0x13) plen 5      #59 [hci1] 6.468576
        Num handles: 1
        Handle: 1278 Address: DF:A9:FF:F6:B1:1A (OUI DF-A9-FF)
        Count: 1
        #56: len 27 (6 Kb/s)
        Latency: 33 msec (3-33 msec ~22 msec)
        Channel: 64 [PSM 128 mode Enhanced Credit (0x81)] {chan 0}
        Channel Latency: 33 msec (11-33 msec ~22 msec)
> HCI Event: Number of Completed Packets (0x13) plen 5      #60 [hci1] 6.468927
        Num handles: 1
        Handle: 1278 Address: DF:A9:FF:F6:B1:1A (OUI DF-A9-FF)
        Count: 1
        #57: len 27 (6 Kb/s)
        Latency: 33 msec (3-33 msec ~28 msec)
> HCI Event: Number of Completed Packets (0x13) plen 5      #61 [hci1] 6.469536
        Num handles: 1
        Handle: 1278 Address: DF:A9:FF:F6:B1:1A (OUI DF-A9-FF)
        Count: 1
        #58: len 15 (3 Kb/s)
        Latency: 34 msec (3-34 msec ~31 msec)
< ACL Data TX: Handle 1278 flags 0x00 dlen 27               #62 [hci1] 6.475145
< ACL Data TX: Handle 1278 flags 0x01 dlen 27               #63 [hci1] 6.475285
< ACL Data TX: Handle 1278 flags 0x01 dlen 15               #64 [hci1] 6.475294
      Channel: 64 len 65 sdu 128 [PSM 128 mode Enhanced Credit (0x81)] {chan 0}
        00 00 00 00 00 00 00 00 00 00 00 00 00 00 00 00  ................
        00 00 00 00 00 00 00 00 00 00 00 00 00 00 00 00  ................
        00 00 00 00 00 00 00 00 00 00 00 00 00 00 00 00  ................
        00 00 00 00 00 00 00 00 00 00 00 00 00 00 00 00  ................
        00                                               .               
> HCI Event: Number of Completed Packets (0x13) plen 5      #65 [hci1] 6.518569
        Num handles: 1
        Handle: 1278 Address: DF:A9:FF:F6:B1:1A (OUI DF-A9-FF)
        Count: 1
        #62: len 27 (5 Kb/s)
        Latency: 43 msec (3-43 msec ~37 msec)
        Channel: 64 [PSM 128 mode Enhanced Credit (0x81)] {chan 0}
        Channel Latency: 43 msec (11-43 msec ~33 msec)
> HCI Event: Number of Completed Packets (0x13) plen 5      #66 [hci1] 6.518952
        Num handles: 1
        Handle: 1278 Address: DF:A9:FF:F6:B1:1A (OUI DF-A9-FF)
        Count: 1
        #63: len 27 (5 Kb/s)
        Latency: 43 msec (3-43 msec ~40 msec)
> HCI Event: Number of Completed Packets (0x13) plen 5      #67 [hci1] 6.519495
        Num handles: 1
        Handle: 1278 Address: DF:A9:FF:F6:B1:1A (OUI DF-A9-FF)
        Count: 1
        #64: len 15 (2 Kb/s)
        Latency: 44 msec (3-44 msec ~42 msec)
> ACL Data RX: Handle 1278 flags 0x02 dlen 12               #68 [hci1] 6.568610
      LE L2CAP: LE Flow Control Credit (0x16) ident 1 len 4
        Source CID: 64
        Credits: 3
< HCI Command: Host Number of Compl.. (0x03|0x0035) plen 5  #69 [hci1] 6.575482
        Num handles: 1
        Handle: 1278 Address: DF:A9:FF:F6:B1:1A (OUI DF-A9-FF)
        Count: 1
< ACL Data TX: Handle 1278 flags 0x00 dlen 27               #70 [hci1] 6.575688
< ACL Data TX: Handle 1278 flags 0x01 dlen 27               #71 [hci1] 6.575707
< ACL Data TX: Handle 1278 flags 0x01 dlen 13               #72 [hci1] 6.575711
      Channel: 64 len 63 sdu 63 [PSM 128 mode Enhanced Credit (0x81)] {chan 0}
        00 00 00 00 00 00 00 00 00 00 00 00 00 00 00 00  ................
        00 00 00 00 00 00 00 00 00 00 00 00 00 00 00 00  ................
        00 00 00 00 00 00 00 00 00 00 00 00 00 00 00 00  ................
        00 00 00 00 00 00 00 00 00 00 00 00 00 00 00     ............... 
> HCI Event: Number of Completed Packets (0x13) plen 5      #73 [hci1] 6.618426
        Num handles: 1
        Handle: 1278 Address: DF:A9:FF:F6:B1:1A (OUI DF-A9-FF)
        Count: 1
        #70: len 27 (5 Kb/s)
        Latency: 42 msec (3-44 msec ~42 msec)
        Channel: 64 [PSM 128 mode Enhanced Credit (0x81)] {chan 0}
        Channel Latency: 42 msec (11-43 msec ~37 msec)
> HCI Event: Number of Completed Packets (0x13) plen 5      #74 [hci1] 6.619087
        Num handles: 1
        Handle: 1278 Address: DF:A9:FF:F6:B1:1A (OUI DF-A9-FF)
        Count: 1
        #71: len 27 (5 Kb/s)
        Latency: 43 msec (3-44 msec ~42 msec)
> HCI Event: Number of Completed Packets (0x13) plen 5      #75 [hci1] 6.619484
        Num handles: 1
        Handle: 1278 Address: DF:A9:FF:F6:B1:1A (OUI DF-A9-FF)
        Count: 1
        #72: len 13 (2 Kb/s)
        Latency: 43 msec (3-44 msec ~43 msec)
< ACL Data TX: Handle 1278 flags 0x00 dlen 27               #76 [hci1] 8.426281
< ACL Data TX: Handle 1278 flags 0x01 dlen 27               #77 [hci1] 8.426290
< ACL Data TX: Handle 1278 flags 0x01 dlen 15               #78 [hci1] 8.426304
      Channel: 64 len 65 sdu 256 [PSM 128 mode Enhanced Credit (0x81)] {chan 0}
        00 01 00 00 00 00 00 00 00 00 00 00 00 00 00 00  ................
        00 00 00 00 00 00 00 00 00 00 00 00 00 00 00 00  ................
        00 00 00 00 00 00 00 00 00 00 00 00 00 00 00 00  ................
        00 00 00 00 00 00 00 00 00 00 00 00 00 00 00 00  ................
        00                                               .               
> HCI Event: Number of Completed Packets (0x13) plen 5      #79 [hci1] 8.468485
        Num handles: 1
        Handle: 1278 Address: DF:A9:FF:F6:B1:1A (OUI DF-A9-FF)
        Count: 1
        #76: len 27 (5 Kb/s)
        Latency: 42 msec (3-44 msec ~42 msec)
        Channel: 64 [PSM 128 mode Enhanced Credit (0x81)] {chan 0}
        Channel Latency: 42 msec (11-43 msec ~40 msec)
> HCI Event: Number of Completed Packets (0x13) plen 5      #80 [hci1] 8.469067
        Num handles: 1
        Handle: 1278 Address: DF:A9:FF:F6:B1:1A (OUI DF-A9-FF)
        Count: 1
        #77: len 27 (5 Kb/s)
        Latency: 42 msec (3-44 msec ~42 msec)
> HCI Event: Number of Completed Packets (0x13) plen 5      #81 [hci1] 8.469437
        Num handles: 1
        Handle: 1278 Address: DF:A9:FF:F6:B1:1A (OUI DF-A9-FF)
        Count: 1
        #78: len 15 (2 Kb/s)
        Latency: 43 msec (3-44 msec ~42 msec)
< ACL Data TX: Handle 1278 flags 0x00 dlen 27               #82 [hci1] 8.475341
< ACL Data TX: Handle 1278 flags 0x01 dlen 27               #83 [hci1] 8.475426
< ACL Data TX: Handle 1278 flags 0x01 dlen 15               #84 [hci1] 8.475435
      Channel: 64 len 65 sdu 193 [PSM 128 mode Enhanced Credit (0x81)] {chan 0}
        00 00 00 00 00 00 00 00 00 00 00 00 00 00 00 00  ................
        00 00 00 00 00 00 00 00 00 00 00 00 00 00 00 00  ................
        00 00 00 00 00 00 00 00 00 00 00 00 00 00 00 00  ................
        00 00 00 00 00 00 00 00 00 00 00 00 00 00 00 00  ................
        00                                               .               
> HCI Event: Number of Completed Packets (0x13) plen 5      #85 [hci1] 8.518557
        Num handles: 1
        Handle: 1278 Address: DF:A9:FF:F6:B1:1A (OUI DF-A9-FF)
        Count: 1
        #82: len 27 (5 Kb/s)
        Latency: 43 msec (3-44 msec ~43 msec)
        Channel: 64 [PSM 128 mode Enhanced Credit (0x81)] {chan 0}
        Channel Latency: 43 msec (11-43 msec ~41 msec)
> HCI Event: Number of Completed Packets (0x13) plen 5      #86 [hci1] 8.518893
        Num handles: 1
        Handle: 1278 Address: DF:A9:FF:F6:B1:1A (OUI DF-A9-FF)
        Count: 1
        #83: len 27 (5 Kb/s)
        Latency: 43 msec (3-44 msec ~43 msec)
> HCI Event: Number of Completed Packets (0x13) plen 5      #87 [hci1] 8.519489
        Num handles: 1
        Handle: 1278 Address: DF:A9:FF:F6:B1:1A (OUI DF-A9-FF)
        Count: 1
        #84: len 15 (2 Kb/s)
        Latency: 44 msec (3-44 msec ~43 msec)
> ACL Data RX: Handle 1278 flags 0x02 dlen 12               #88 [hci1] 8.568548
      LE L2CAP: LE Flow Control Credit (0x16) ident 2 len 4
        Source CID: 64
        Credits: 3
< HCI Command: Host Number of Compl.. (0x03|0x0035) plen 5  #89 [hci1] 8.575609
        Num handles: 1
        Handle: 1278 Address: DF:A9:FF:F6:B1:1A (OUI DF-A9-FF)
        Count: 1
< ACL Data TX: Handle 1278 flags 0x00 dlen 27               #90 [hci1] 8.575829
< ACL Data TX: Handle 1278 flags 0x01 dlen 27               #91 [hci1] 8.575842
< ACL Data TX: Handle 1278 flags 0x01 dlen 15               #92 [hci1] 8.575846
      Channel: 64 len 65 sdu 128 [PSM 128 mode Enhanced Credit (0x81)] {chan 0}
        00 00 00 00 00 00 00 00 00 00 00 00 00 00 00 00  ................
        00 00 00 00 00 00 00 00 00 00 00 00 00 00 00 00  ................
        00 00 00 00 00 00 00 00 00 00 00 00 00 00 00 00  ................
        00 00 00 00 00 00 00 00 00 00 00 00 00 00 00 00  ................
        00                                               .               
> HCI Event: Number of Completed Packets (0x13) plen 5      #93 [hci1] 8.618456
        Num handles: 1
        Handle: 1278 Address: DF:A9:FF:F6:B1:1A (OUI DF-A9-FF)
        Count: 1
        #90: len 27 (5 Kb/s)
        Latency: 42 msec (3-44 msec ~43 msec)
        Channel: 64 [PSM 128 mode Enhanced Credit (0x81)] {chan 0}
        Channel Latency: 42 msec (11-43 msec ~42 msec)
> HCI Event: Number of Completed Packets (0x13) plen 5      #94 [hci1] 8.619108
        Num handles: 1
        Handle: 1278 Address: DF:A9:FF:F6:B1:1A (OUI DF-A9-FF)
        Count: 1
        #91: len 27 (5 Kb/s)
        Latency: 43 msec (3-44 msec ~43 msec)
> HCI Event: Number of Completed Packets (0x13) plen 5      #95 [hci1] 8.619467
        Num handles: 1
        Handle: 1278 Address: DF:A9:FF:F6:B1:1A (OUI DF-A9-FF)
        Count: 1
        #92: len 15 (2 Kb/s)
        Latency: 43 msec (3-44 msec ~43 msec)
< ACL Data TX: Handle 1278 flags 0x00 dlen 27               #96 [hci1] 8.635287
< ACL Data TX: Handle 1278 flags 0x01 dlen 27               #97 [hci1] 8.635360
< ACL Data TX: Handle 1278 flags 0x01 dlen 13               #98 [hci1] 8.635409
      Channel: 64 len 63 sdu 63 [PSM 128 mode Enhanced Credit (0x81)] {chan 0}
        00 00 00 00 00 00 00 00 00 00 00 00 00 00 00 00  ................
        00 00 00 00 00 00 00 00 00 00 00 00 00 00 00 00  ................
        00 00 00 00 00 00 00 00 00 00 00 00 00 00 00 00  ................
        00 00 00 00 00 00 00 00 00 00 00 00 00 00 00     ............... 
> HCI Event: Number of Completed Packets (0x13) plen 5      #99 [hci1] 8.668499
        Num handles: 1
        Handle: 1278 Address: DF:A9:FF:F6:B1:1A (OUI DF-A9-FF)
        Count: 1
        #96: len 27 (6 Kb/s)
        Latency: 33 msec (3-44 msec ~38 msec)
        Channel: 64 [PSM 128 mode Enhanced Credit (0x81)] {chan 0}
        Channel Latency: 33 msec (11-43 msec ~37 msec)
> HCI Event: Number of Completed Packets (0x13) plen 5     #100 [hci1] 8.668923
        Num handles: 1
        Handle: 1278 Address: DF:A9:FF:F6:B1:1A (OUI DF-A9-FF)
        Count: 1
        #97: len 27 (6 Kb/s)
        Latency: 33 msec (3-44 msec ~35 msec)
> HCI Event: Number of Completed Packets (0x13) plen 5     #101 [hci1] 8.669450
        Num handles: 1
        Handle: 1278 Address: DF:A9:FF:F6:B1:1A (OUI DF-A9-FF)
        Count: 1
        #98: len 13 (3 Kb/s)
        Latency: 34 msec (3-44 msec ~34 msec)
< ACL Data TX: Handle 1278 flags 0x00 dlen 27             #102 [hci1] 10.446766
< ACL Data TX: Handle 1278 flags 0x01 dlen 27             #103 [hci1] 10.446794
< ACL Data TX: Handle 1278 flags 0x01 dlen 15             #104 [hci1] 10.446798
      Channel: 64 len 65 sdu 256 [PSM 128 mode Enhanced Credit (0x81)] {chan 0}
        00 01 00 00 00 00 00 00 00 00 00 00 00 00 00 00  ................
        00 00 00 00 00 00 00 00 00 00 00 00 00 00 00 00  ................
        00 00 00 00 00 00 00 00 00 00 00 00 00 00 00 00  ................
        00 00 00 00 00 00 00 00 00 00 00 00 00 00 00 00  ................
        00                                               .               
> HCI Event: Number of Completed Packets (0x13) plen 5    #105 [hci1] 10.468349
        Num handles: 1
        Handle: 1278 Address: DF:A9:FF:F6:B1:1A (OUI DF-A9-FF)
        Count: 1
        #102: len 27 (10 Kb/s)
        Latency: 21 msec (3-44 msec ~28 msec)
        Channel: 64 [PSM 128 mode Enhanced Credit (0x81)] {chan 0}
        Channel Latency: 21 msec (11-43 msec ~29 msec)
> HCI Event: Number of Completed Packets (0x13) plen 5    #106 [hci1] 10.468813
        Num handles: 1
        Handle: 1278 Address: DF:A9:FF:F6:B1:1A (OUI DF-A9-FF)
        Count: 1
        #103: len 27 (9 Kb/s)
        Latency: 22 msec (3-44 msec ~25 msec)
> HCI Event: Number of Completed Packets (0x13) plen 5    #107 [hci1] 10.469424
        Num handles: 1
        Handle: 1278 Address: DF:A9:FF:F6:B1:1A (OUI DF-A9-FF)
        Count: 1
        #104: len 15 (5 Kb/s)
        Latency: 22 msec (3-44 msec ~23 msec)
> ACL Data RX: Handle 1278 flags 0x02 dlen 12             #108 [hci1] 10.518594
      LE L2CAP: LE Flow Control Credit (0x16) ident 3 len 4
        Source CID: 64
        Credits: 3
< HCI Command: Host Number of Com.. (0x03|0x0035) plen 5  #109 [hci1] 10.535408
        Num handles: 1
        Handle: 1278 Address: DF:A9:FF:F6:B1:1A (OUI DF-A9-FF)
        Count: 1
< ACL Data TX: Handle 1278 flags 0x00 dlen 27             #110 [hci1] 10.535616
< ACL Data TX: Handle 1278 flags 0x01 dlen 27             #111 [hci1] 10.535634
< ACL Data TX: Handle 1278 flags 0x01 dlen 15             #112 [hci1] 10.535637
      Channel: 64 len 65 sdu 193 [PSM 128 mode Enhanced Credit (0x81)] {chan 0}
        00 00 00 00 00 00 00 00 00 00 00 00 00 00 00 00  ................
        00 00 00 00 00 00 00 00 00 00 00 00 00 00 00 00  ................
        00 00 00 00 00 00 00 00 00 00 00 00 00 00 00 00  ................
        00 00 00 00 00 00 00 00 00 00 00 00 00 00 00 00  ................
        00                                               .               
> HCI Event: Number of Completed Packets (0x13) plen 5    #113 [hci1] 10.568459
        Num handles: 1
        Handle: 1278 Address: DF:A9:FF:F6:B1:1A (OUI DF-A9-FF)
        Count: 1
        #110: len 27 (6 Kb/s)
        Latency: 32 msec (3-44 msec ~28 msec)
        Channel: 64 [PSM 128 mode Enhanced Credit (0x81)] {chan 0}
        Channel Latency: 32 msec (11-43 msec ~31 msec)
> HCI Event: Number of Completed Packets (0x13) plen 5    #114 [hci1] 10.568919
        Num handles: 1
        Handle: 1278 Address: DF:A9:FF:F6:B1:1A (OUI DF-A9-FF)
        Count: 1
        #111: len 27 (6 Kb/s)
        Latency: 33 msec (3-44 msec ~30 msec)
> HCI Event: Number of Completed Packets (0x13) plen 5    #115 [hci1] 10.569394
        Num handles: 1
        Handle: 1278 Address: DF:A9:FF:F6:B1:1A (OUI DF-A9-FF)
        Count: 1
        #112: len 15 (3 Kb/s)
        Latency: 33 msec (3-44 msec ~32 msec)
< ACL Data TX: Handle 1278 flags 0x00 dlen 27             #116 [hci1] 10.575185
< ACL Data TX: Handle 1278 flags 0x01 dlen 27             #117 [hci1] 10.575282
< ACL Data TX: Handle 1278 flags 0x01 dlen 15             #118 [hci1] 10.575298
      Channel: 64 len 65 sdu 128 [PSM 128 mode Enhanced Credit (0x81)] {chan 0}
        00 00 00 00 00 00 00 00 00 00 00 00 00 00 00 00  ................
        00 00 00 00 00 00 00 00 00 00 00 00 00 00 00 00  ................
        00 00 00 00 00 00 00 00 00 00 00 00 00 00 00 00  ................
        00 00 00 00 00 00 00 00 00 00 00 00 00 00 00 00  ................
        00                                               .               
> HCI Event: Number of Completed Packets (0x13) plen 5    #119 [hci1] 10.618349
        Num handles: 1
        Handle: 1278 Address: DF:A9:FF:F6:B1:1A (OUI DF-A9-FF)
        Count: 1
        #116: len 27 (5 Kb/s)
        Latency: 43 msec (3-44 msec ~37 msec)
        Channel: 64 [PSM 128 mode Enhanced Credit (0x81)] {chan 0}
        Channel Latency: 43 msec (11-43 msec ~37 msec)
> HCI Event: Number of Completed Packets (0x13) plen 5    #120 [hci1] 10.618945
        Num handles: 1
        Handle: 1278 Address: DF:A9:FF:F6:B1:1A (OUI DF-A9-FF)
        Count: 1
        #117: len 27 (5 Kb/s)
        Latency: 43 msec (3-44 msec ~40 msec)
> HCI Event: Number of Completed Packets (0x13) plen 5    #121 [hci1] 10.619391
        Num handles: 1
        Handle: 1278 Address: DF:A9:FF:F6:B1:1A (OUI DF-A9-FF)
        Count: 1
        #118: len 15 (2 Kb/s)
        Latency: 44 msec (3-44 msec ~42 msec)
< ACL Data TX: Handle 1278 flags 0x00 dlen 27             #122 [hci1] 10.635108
< ACL Data TX: Handle 1278 flags 0x01 dlen 27             #123 [hci1] 10.635206
< ACL Data TX: Handle 1278 flags 0x01 dlen 13             #124 [hci1] 10.635215
      Channel: 64 len 63 sdu 63 [PSM 128 mode Enhanced Credit (0x81)] {chan 0}
        00 00 00 00 00 00 00 00 00 00 00 00 00 00 00 00  ................
        00 00 00 00 00 00 00 00 00 00 00 00 00 00 00 00  ................
        00 00 00 00 00 00 00 00 00 00 00 00 00 00 00 00  ................
        00 00 00 00 00 00 00 00 00 00 00 00 00 00 00     ............... 
> HCI Event: Number of Completed Packets (0x13) plen 5    #125 [hci1] 10.668561
        Num handles: 1
        Handle: 1278 Address: DF:A9:FF:F6:B1:1A (OUI DF-A9-FF)
        Count: 1
        #122: len 27 (6 Kb/s)
        Latency: 33 msec (3-44 msec ~37 msec)
        Channel: 64 [PSM 128 mode Enhanced Credit (0x81)] {chan 0}
        Channel Latency: 33 msec (11-43 msec ~35 msec)
> HCI Event: Number of Completed Packets (0x13) plen 5    #126 [hci1] 10.668806
        Num handles: 1
        Handle: 1278 Address: DF:A9:FF:F6:B1:1A (OUI DF-A9-FF)
        Count: 1
        #123: len 27 (6 Kb/s)
        Latency: 33 msec (3-44 msec ~35 msec)
> HCI Event: Number of Completed Packets (0x13) plen 5    #127 [hci1] 10.669329
        Num handles: 1
        Handle: 1278 Address: DF:A9:FF:F6:B1:1A (OUI DF-A9-FF)
        Count: 1
        #124: len 13 (3 Kb/s)
        Latency: 34 msec (3-44 msec ~34 msec)
> ACL Data RX: Handle 1278 flags 0x02 dlen 12             #128 [hci1] 10.718606
      LE L2CAP: LE Flow Control Credit (0x16) ident 4 len 4
        Source CID: 64
        Credits: 3
< HCI Command: Host Number of Com.. (0x03|0x0035) plen 5  #129 [hci1] 10.735641
        Num handles: 1
        Handle: 1278 Address: DF:A9:FF:F6:B1:1A (OUI DF-A9-FF)
        Count: 1
< ACL Data TX: Handle 1278 flags 0x00 dlen 27             #130 [hci1] 12.476836
< ACL Data TX: Handle 1278 flags 0x01 dlen 27             #131 [hci1] 12.476863
< ACL Data TX: Handle 1278 flags 0x01 dlen 15             #132 [hci1] 12.476867
      Channel: 64 len 65 sdu 256 [PSM 128 mode Enhanced Credit (0x81)] {chan 0}
        00 01 00 00 00 00 00 00 00 00 00 00 00 00 00 00  ................
        00 00 00 00 00 00 00 00 00 00 00 00 00 00 00 00  ................
        00 00 00 00 00 00 00 00 00 00 00 00 00 00 00 00  ................
        00 00 00 00 00 00 00 00 00 00 00 00 00 00 00 00  ................
        00                                               .               
> HCI Event: Number of Completed Packets (0x13) plen 5    #133 [hci1] 12.518493
        Num handles: 1
        Handle: 1278 Address: DF:A9:FF:F6:B1:1A (OUI DF-A9-FF)
        Count: 1
        #130: len 27 (5 Kb/s)
        Latency: 41 msec (3-44 msec ~38 msec)
        Channel: 64 [PSM 128 mode Enhanced Credit (0x81)] {chan 0}
        Channel Latency: 41 msec (11-43 msec ~38 msec)
> HCI Event: Number of Completed Packets (0x13) plen 5    #134 [hci1] 12.518808
        Num handles: 1
        Handle: 1278 Address: DF:A9:FF:F6:B1:1A (OUI DF-A9-FF)
        Count: 1
        #131: len 27 (5 Kb/s)
        Latency: 41 msec (3-44 msec ~40 msec)
> HCI Event: Number of Completed Packets (0x13) plen 5    #135 [hci1] 12.519458
        Num handles: 1
        Handle: 1278 Address: DF:A9:FF:F6:B1:1A (OUI DF-A9-FF)
        Count: 1
        #132: len 15 (2 Kb/s)
        Latency: 42 msec (3-44 msec ~41 msec)
< ACL Data TX: Handle 1278 flags 0x00 dlen 27             #136 [hci1] 12.535445
< ACL Data TX: Handle 1278 flags 0x01 dlen 27             #137 [hci1] 12.535522
< ACL Data TX: Handle 1278 flags 0x01 dlen 15             #138 [hci1] 12.535551
      Channel: 64 len 65 sdu 193 [PSM 128 mode Enhanced Credit (0x81)] {chan 0}
        00 00 00 00 00 00 00 00 00 00 00 00 00 00 00 00  ................
        00 00 00 00 00 00 00 00 00 00 00 00 00 00 00 00  ................
        00 00 00 00 00 00 00 00 00 00 00 00 00 00 00 00  ................
        00 00 00 00 00 00 00 00 00 00 00 00 00 00 00 00  ................
        00                                               .               
> HCI Event: Number of Completed Packets (0x13) plen 5    #139 [hci1] 12.568336
        Num handles: 1
        Handle: 1278 Address: DF:A9:FF:F6:B1:1A (OUI DF-A9-FF)
        Count: 1
        #136: len 27 (6 Kb/s)
        Latency: 32 msec (3-44 msec ~37 msec)
        Channel: 64 [PSM 128 mode Enhanced Credit (0x81)] {chan 0}
        Channel Latency: 32 msec (11-43 msec ~35 msec)
> HCI Event: Number of Completed Packets (0x13) plen 5    #140 [hci1] 12.568857
        Num handles: 1
        Handle: 1278 Address: DF:A9:FF:F6:B1:1A (OUI DF-A9-FF)
        Count: 1
        #137: len 27 (6 Kb/s)
        Latency: 33 msec (3-44 msec ~35 msec)
> HCI Event: Number of Completed Packets (0x13) plen 5    #141 [hci1] 12.569320
        Num handles: 1
        Handle: 1278 Address: DF:A9:FF:F6:B1:1A (OUI DF-A9-FF)
        Count: 1
        #138: len 15 (3 Kb/s)
        Latency: 33 msec (3-44 msec ~34 msec)
< ACL Data TX: Handle 1278 flags 0x00 dlen 27             #142 [hci1] 12.575462
< ACL Data TX: Handle 1278 flags 0x01 dlen 27             #143 [hci1] 12.575728
< ACL Data TX: Handle 1278 flags 0x01 dlen 15             #144 [hci1] 12.575753
      Channel: 64 len 65 sdu 128 [PSM 128 mode Enhanced Credit (0x81)] {chan 0}
        00 00 00 00 00 00 00 00 00 00 00 00 00 00 00 00  ................
        00 00 00 00 00 00 00 00 00 00 00 00 00 00 00 00  ................
        00 00 00 00 00 00 00 00 00 00 00 00 00 00 00 00  ................
        00 00 00 00 00 00 00 00 00 00 00 00 00 00 00 00  ................
        00                                               .               
> HCI Event: Number of Completed Packets (0x13) plen 5    #145 [hci1] 12.618348
        Num handles: 1
        Handle: 1278 Address: DF:A9:FF:F6:B1:1A (OUI DF-A9-FF)
        Count: 1
        #142: len 27 (5 Kb/s)
        Latency: 42 msec (3-44 msec ~38 msec)
        Channel: 64 [PSM 128 mode Enhanced Credit (0x81)] {chan 0}
        Channel Latency: 42 msec (11-43 msec ~39 msec)
> HCI Event: Number of Completed Packets (0x13) plen 5    #146 [hci1] 12.618853
        Num handles: 1
        Handle: 1278 Address: DF:A9:FF:F6:B1:1A (OUI DF-A9-FF)
        Count: 1
        #143: len 27 (5 Kb/s)
        Latency: 43 msec (3-44 msec ~40 msec)
> HCI Event: Number of Completed Packets (0x13) plen 5    #147 [hci1] 12.619378
        Num handles: 1
        Handle: 1278 Address: DF:A9:FF:F6:B1:1A (OUI DF-A9-FF)
        Count: 1
        #144: len 15 (2 Kb/s)
        Latency: 43 msec (3-44 msec ~42 msec)
> ACL Data RX: Handle 1278 flags 0x02 dlen 12             #148 [hci1] 12.668556
      LE L2CAP: LE Flow Control Credit (0x16) ident 5 len 4
        Source CID: 64
        Credits: 3
< HCI Command: Host Number of Com.. (0x03|0x0035) plen 5  #149 [hci1] 12.675539
        Num handles: 1
        Handle: 1278 Address: DF:A9:FF:F6:B1:1A (OUI DF-A9-FF)
        Count: 1
< ACL Data TX: Handle 1278 flags 0x00 dlen 27             #150 [hci1] 12.675716
< ACL Data TX: Handle 1278 flags 0x01 dlen 27             #151 [hci1] 12.675735
< ACL Data TX: Handle 1278 flags 0x01 dlen 13             #152 [hci1] 12.675739
      Channel: 64 len 63 sdu 63 [PSM 128 mode Enhanced Credit (0x81)] {chan 0}
        00 00 00 00 00 00 00 00 00 00 00 00 00 00 00 00  ................
        00 00 00 00 00 00 00 00 00 00 00 00 00 00 00 00  ................
        00 00 00 00 00 00 00 00 00 00 00 00 00 00 00 00  ................
        00 00 00 00 00 00 00 00 00 00 00 00 00 00 00     ............... 
> HCI Event: Number of Completed Packets (0x13) plen 5    #153 [hci1] 12.718418
        Num handles: 1
        Handle: 1278 Address: DF:A9:FF:F6:B1:1A (OUI DF-A9-FF)
        Count: 1
        #150: len 27 (5 Kb/s)
        Latency: 42 msec (3-44 msec ~42 msec)
        Channel: 64 [PSM 128 mode Enhanced Credit (0x81)] {chan 0}
        Channel Latency: 42 msec (11-43 msec ~40 msec)
> HCI Event: Number of Completed Packets (0x13) plen 5    #154 [hci1] 12.718882
        Num handles: 1
        Handle: 1278 Address: DF:A9:FF:F6:B1:1A (OUI DF-A9-FF)
        Count: 1
        #151: len 27 (5 Kb/s)
        Latency: 43 msec (3-44 msec ~42 msec)
> HCI Event: Number of Completed Packets (0x13) plen 5    #155 [hci1] 12.719321
        Num handles: 1
        Handle: 1278 Address: DF:A9:FF:F6:B1:1A (OUI DF-A9-FF)
        Count: 1
        #152: len 13 (2 Kb/s)
        Latency: 43 msec (3-44 msec ~43 msec)
< ACL Data TX: Handle 1278 flags 0x00 dlen 27             #156 [hci1] 14.495412
< ACL Data TX: Handle 1278 flags 0x01 dlen 27             #157 [hci1] 14.495421
< ACL Data TX: Handle 1278 flags 0x01 dlen 15             #158 [hci1] 14.495422
      Channel: 64 len 65 sdu 256 [PSM 128 mode Enhanced Credit (0x81)] {chan 0}
        00 01 00 00 00 00 00 00 00 00 00 00 00 00 00 00  ................
        00 00 00 00 00 00 00 00 00 00 00 00 00 00 00 00  ................
        00 00 00 00 00 00 00 00 00 00 00 00 00 00 00 00  ................
        00 00 00 00 00 00 00 00 00 00 00 00 00 00 00 00  ................
        00                                               .               
> HCI Event: Number of Completed Packets (0x13) plen 5    #159 [hci1] 14.518261
        Num handles: 1
        Handle: 1278 Address: DF:A9:FF:F6:B1:1A (OUI DF-A9-FF)
        Count: 1
        #156: len 27 (9 Kb/s)
        Latency: 22 msec (3-44 msec ~33 msec)
        Channel: 64 [PSM 128 mode Enhanced Credit (0x81)] {chan 0}
        Channel Latency: 22 msec (11-43 msec ~31 msec)
> HCI Event: Number of Completed Packets (0x13) plen 5    #160 [hci1] 14.518841
        Num handles: 1
        Handle: 1278 Address: DF:A9:FF:F6:B1:1A (OUI DF-A9-FF)
        Count: 1
        #157: len 27 (9 Kb/s)
        Latency: 23 msec (3-44 msec ~28 msec)
> HCI Event: Number of Completed Packets (0x13) plen 5    #161 [hci1] 14.519381
        Num handles: 1
        Handle: 1278 Address: DF:A9:FF:F6:B1:1A (OUI DF-A9-FF)
        Count: 1
        #158: len 15 (5 Kb/s)
        Latency: 23 msec (3-44 msec ~26 msec)
< ACL Data TX: Handle 1278 flags 0x00 dlen 27             #162 [hci1] 14.535146
< ACL Data TX: Handle 1278 flags 0x01 dlen 27             #163 [hci1] 14.535263
< ACL Data TX: Handle 1278 flags 0x01 dlen 15             #164 [hci1] 14.535272
      Channel: 64 len 65 sdu 193 [PSM 128 mode Enhanced Credit (0x81)] {chan 0}
        00 00 00 00 00 00 00 00 00 00 00 00 00 00 00 00  ................
        00 00 00 00 00 00 00 00 00 00 00 00 00 00 00 00  ................
        00 00 00 00 00 00 00 00 00 00 00 00 00 00 00 00  ................
        00 00 00 00 00 00 00 00 00 00 00 00 00 00 00 00  ................
        00                                               .               
> HCI Event: Number of Completed Packets (0x13) plen 5    #165 [hci1] 14.568303
        Num handles: 1
        Handle: 1278 Address: DF:A9:FF:F6:B1:1A (OUI DF-A9-FF)
        Count: 1
        #162: len 27 (6 Kb/s)
        Latency: 33 msec (3-44 msec ~29 msec)
        Channel: 64 [PSM 128 mode Enhanced Credit (0x81)] {chan 0}
        Channel Latency: 33 msec (11-43 msec ~32 msec)
> HCI Event: Number of Completed Packets (0x13) plen 5    #166 [hci1] 14.568880
        Num handles: 1
        Handle: 1278 Address: DF:A9:FF:F6:B1:1A (OUI DF-A9-FF)
        Count: 1
        #163: len 27 (6 Kb/s)
        Latency: 33 msec (3-44 msec ~31 msec)
> HCI Event: Number of Completed Packets (0x13) plen 5    #167 [hci1] 14.569297
        Num handles: 1
        Handle: 1278 Address: DF:A9:FF:F6:B1:1A (OUI DF-A9-FF)
        Count: 1
        #164: len 15 (3 Kb/s)
        Latency: 34 msec (3-44 msec ~32 msec)
> ACL Data RX: Handle 1278 flags 0x02 dlen 12             #168 [hci1] 14.618364
      LE L2CAP: LE Flow Control Credit (0x16) ident 6 len 4
        Source CID: 64
        Credits: 3
< HCI Command: Host Number of Com.. (0x03|0x0035) plen 5  #169 [hci1] 14.635462
        Num handles: 1
        Handle: 1278 Address: DF:A9:FF:F6:B1:1A (OUI DF-A9-FF)
        Count: 1
< ACL Data TX: Handle 1278 flags 0x00 dlen 27             #170 [hci1] 14.635682
< ACL Data TX: Handle 1278 flags 0x01 dlen 27             #171 [hci1] 14.635702
< ACL Data TX: Handle 1278 flags 0x01 dlen 15             #172 [hci1] 14.635705
      Channel: 64 len 65 sdu 128 [PSM 128 mode Enhanced Credit (0x81)] {chan 0}
        00 00 00 00 00 00 00 00 00 00 00 00 00 00 00 00  ................
        00 00 00 00 00 00 00 00 00 00 00 00 00 00 00 00  ................
        00 00 00 00 00 00 00 00 00 00 00 00 00 00 00 00  ................
        00 00 00 00 00 00 00 00 00 00 00 00 00 00 00 00  ................
        00                                               .               
> HCI Event: Number of Completed Packets (0x13) plen 5    #173 [hci1] 14.668305
        Num handles: 1
        Handle: 1278 Address: DF:A9:FF:F6:B1:1A (OUI DF-A9-FF)
        Count: 1
        #170: len 27 (6 Kb/s)
        Latency: 32 msec (3-44 msec ~32 msec)
        Channel: 64 [PSM 128 mode Enhanced Credit (0x81)] {chan 0}
        Channel Latency: 32 msec (11-43 msec ~32 msec)
> HCI Event: Number of Completed Packets (0x13) plen 5    #174 [hci1] 14.668768
        Num handles: 1
        Handle: 1278 Address: DF:A9:FF:F6:B1:1A (OUI DF-A9-FF)
        Count: 1
        #171: len 27 (6 Kb/s)
        Latency: 33 msec (3-44 msec ~32 msec)
> HCI Event: Number of Completed Packets (0x13) plen 5    #175 [hci1] 14.669329
        Num handles: 1
        Handle: 1278 Address: DF:A9:FF:F6:B1:1A (OUI DF-A9-FF)
        Count: 1
        #172: len 15 (3 Kb/s)
        Latency: 33 msec (3-44 msec ~33 msec)
< ACL Data TX: Handle 1278 flags 0x00 dlen 27             #176 [hci1] 14.675461
< ACL Data TX: Handle 1278 flags 0x01 dlen 27             #177 [hci1] 14.675714
< ACL Data TX: Handle 1278 flags 0x01 dlen 13             #178 [hci1] 14.675739
      Channel: 64 len 63 sdu 63 [PSM 128 mode Enhanced Credit (0x81)] {chan 0}
        00 00 00 00 00 00 00 00 00 00 00 00 00 00 00 00  ................
        00 00 00 00 00 00 00 00 00 00 00 00 00 00 00 00  ................
        00 00 00 00 00 00 00 00 00 00 00 00 00 00 00 00  ................
        00 00 00 00 00 00 00 00 00 00 00 00 00 00 00     ............... 
> HCI Event: Number of Completed Packets (0x13) plen 5    #179 [hci1] 14.718267
        Num handles: 1
        Handle: 1278 Address: DF:A9:FF:F6:B1:1A (OUI DF-A9-FF)
        Count: 1
        #176: len 27 (5 Kb/s)
        Latency: 42 msec (3-44 msec ~38 msec)
        Channel: 64 [PSM 128 mode Enhanced Credit (0x81)] {chan 0}
        Channel Latency: 42 msec (11-43 msec ~37 msec)
> HCI Event: Number of Completed Packets (0x13) plen 5    #180 [hci1] 14.718769
        Num handles: 1
        Handle: 1278 Address: DF:A9:FF:F6:B1:1A (OUI DF-A9-FF)
        Count: 1
        #177: len 27 (5 Kb/s)
        Latency: 43 msec (3-44 msec ~40 msec)
> HCI Event: Number of Completed Packets (0x13) plen 5    #181 [hci1] 14.719410
        Num handles: 1
        Handle: 1278 Address: DF:A9:FF:F6:B1:1A (OUI DF-A9-FF)
        Count: 1
        #178: len 13 (2 Kb/s)
        Latency: 43 msec (3-44 msec ~42 msec)
> ACL Data RX: Handle 1278 flags 0x02 dlen 14             #182 [hci1] 16.018424
      LE L2CAP: Enhanced Credit Reconfigure Request (0x19) ident 7 len 6
        MTU: 256
        MPS: 66
        Source CID: 64
< HCI Command: Host Number of Com.. (0x03|0x0035) plen 5  #183 [hci1] 16.035670
        Num handles: 1
        Handle: 1278 Address: DF:A9:FF:F6:B1:1A (OUI DF-A9-FF)
        Count: 1
< ACL Data TX: Handle 1278 flags 0x00 dlen 10             #184 [hci1] 16.035859
      LE L2CAP: Enhanced Credit Reconfigure Respond (0x1a) ident 7 len 2
        Result: Reconfiguration successful (0x0000)
> HCI Event: Number of Completed Packets (0x13) plen 5    #185 [hci1] 16.068315
        Num handles: 1
        Handle: 1278 Address: DF:A9:FF:F6:B1:1A (OUI DF-A9-FF)
        Count: 1
        #184: len 10 (2 Kb/s)
        Latency: 32 msec (3-44 msec ~37 msec)
< ACL Data TX: Handle 1278 flags 0x00 dlen 27             #186 [hci1] 18.526829
< ACL Data TX: Handle 1278 flags 0x01 dlen 27             #187 [hci1] 18.526857
< ACL Data TX: Handle 1278 flags 0x01 dlen 16             #188 [hci1] 18.526861
      Channel: 64 len 66 sdu 256 [PSM 128 mode Enhanced Credit (0x81)] {chan 0}
        00 01 00 00 00 00 00 00 00 00 00 00 00 00 00 00  ................
        00 00 00 00 00 00 00 00 00 00 00 00 00 00 00 00  ................
        00 00 00 00 00 00 00 00 00 00 00 00 00 00 00 00  ................
        00 00 00 00 00 00 00 00 00 00 00 00 00 00 00 00  ................
        00 00                                            ..              
> HCI Event: Number of Completed Packets (0x13) plen 5    #189 [hci1] 18.568218
        Num handles: 1
        Handle: 1278 Address: DF:A9:FF:F6:B1:1A (OUI DF-A9-FF)
        Count: 1
        #186: len 27 (5 Kb/s)
        Latency: 41 msec (3-44 msec ~39 msec)
        Channel: 64 [PSM 128 mode Enhanced Credit (0x81)] {chan 0}
        Channel Latency: 41 msec (11-43 msec ~39 msec)
> HCI Event: Number of Completed Packets (0x13) plen 5    #190 [hci1] 18.568670
        Num handles: 1
        Handle: 1278 Address: DF:A9:FF:F6:B1:1A (OUI DF-A9-FF)
        Count: 1
        #187: len 27 (5 Kb/s)
        Latency: 41 msec (3-44 msec ~40 msec)
> HCI Event: Number of Completed Packets (0x13) plen 5    #191 [hci1] 18.569177
        Num handles: 1
        Handle: 1278 Address: DF:A9:FF:F6:B1:1A (OUI DF-A9-FF)
        Count: 1
        #188: len 16 (3 Kb/s)
        Latency: 42 msec (3-44 msec ~41 msec)
> ACL Data RX: Handle 1278 flags 0x02 dlen 12             #192 [hci1] 18.618288
      LE L2CAP: LE Flow Control Credit (0x16) ident 8 len 4
        Source CID: 64
        Credits: 3
< HCI Command: Host Number of Com.. (0x03|0x0035) plen 5  #193 [hci1] 18.635446
        Num handles: 1
        Handle: 1278 Address: DF:A9:FF:F6:B1:1A (OUI DF-A9-FF)
        Count: 1
< ACL Data TX: Handle 1278 flags 0x00 dlen 27             #194 [hci1] 18.635624
< ACL Data TX: Handle 1278 flags 0x01 dlen 27             #195 [hci1] 18.635642
< ACL Data TX: Handle 1278 flags 0x01 dlen 16             #196 [hci1] 18.635646
      Channel: 64 len 66 sdu 192 [PSM 128 mode Enhanced Credit (0x81)] {chan 0}
        00 00 00 00 00 00 00 00 00 00 00 00 00 00 00 00  ................
        00 00 00 00 00 00 00 00 00 00 00 00 00 00 00 00  ................
        00 00 00 00 00 00 00 00 00 00 00 00 00 00 00 00  ................
        00 00 00 00 00 00 00 00 00 00 00 00 00 00 00 00  ................
        00 00                                            ..              
> HCI Event: Number of Completed Packets (0x13) plen 5    #197 [hci1] 18.668206
        Num handles: 1
        Handle: 1278 Address: DF:A9:FF:F6:B1:1A (OUI DF-A9-FF)
        Count: 1
        #194: len 27 (6 Kb/s)
        Latency: 32 msec (3-44 msec ~37 msec)
        Channel: 64 [PSM 128 mode Enhanced Credit (0x81)] {chan 0}
        Channel Latency: 32 msec (11-43 msec ~36 msec)
> HCI Event: Number of Completed Packets (0x13) plen 5    #198 [hci1] 18.668737
        Num handles: 1
        Handle: 1278 Address: DF:A9:FF:F6:B1:1A (OUI DF-A9-FF)
        Count: 1
        #195: len 27 (6 Kb/s)
        Latency: 33 msec (3-44 msec ~35 msec)
