Bluetooth monitor ver 5.84
btmon[3326735]: = Note: Linux version 6.8.0-83-generic (x86_64)                                                          0.611328
btmon[3326735]: = Note: Bluetooth subsystem version 2.22                                                                 0.611330
= New Index: 00:00:00:00:00:00 (Primary,UART,hci0)                                                                       0.611331
= Open Index: 00:00:00:00:00:00                                                                                          1.115659
= Index Info: 00:00:00:00:00:00 (Nordic Semiconductor ASA)                                                               1.115663
zephyr.exe[3326737]: @ USER Open: main (privileged) version 2.22                                                {0x0001} 1.115665
zephyr.exe[3326737]: < HCI Command: Reset (0x03|0x0003) plen 0                                                        #1 1.115853
> HCI Event: Command Complete (0x0e) plen 4                                                                           #2 1.116458
      Reset (0x03|0x0003) ncmd 1
        Status: Success (0x00)
zephyr.exe[3326737]: < HCI Command: Read Local Supported Features (0x04|0x0003) plen 0                                #3 1.135680
> HCI Event: Command Complete (0x0e) plen 12                                                                          #4 1.136248
      Read Local Supported Features (0x04|0x0003) ncmd 1
        Status: Success (0x00)
        Features: 0x00 0x00 0x00 0x00 0x60 0x00 0x00 0x00
          BR/EDR Not Supported
          LE Supported (Controller)
zephyr.exe[3326737]: < HCI Command: Read Local Version Information (0x04|0x0001) plen 0                               #5 1.155709
> HCI Event: Command Complete (0x0e) plen 12                                                                          #6 1.156437
      Read Local Version Information (0x04|0x0001) ncmd 1
        Status: Success (0x00)
        HCI version: Reserved (0x0e) - Revision 12520 (0x30e8)
        LMP version: Reserved (0x0e) - Subversion 12520 (0x30e8)
        Manufacturer: Nordic Semiconductor ASA (89)
zephyr.exe[3326737]: < HCI Command: Read Local Supported Commands (0x04|0x0002) plen 0                                #7 1.175618
> HCI Event: Command Complete (0x0e) plen 68                                                                          #8 1.177185
      Read Local Supported Commands (0x04|0x0002) ncmd 1
        Status: Success (0x00)
        Commands: 119 entries
          Disconnect (Octet 0 - Bit 5)
          Read Remote Version Information (Octet 2 - Bit 7)
          Set Event Mask (Octet 5 - Bit 6)
          Reset (Octet 5 - Bit 7)
          Read Connection Accept Timeout (Octet 7 - Bit 2)
          Write Connection Accept Timeout (Octet 7 - Bit 3)
          Read Transmit Power Level (Octet 10 - Bit 2)
          Set Controller To Host Flow Control (Octet 10 - Bit 5)
          Host Buffer Size (Octet 10 - Bit 6)
          Host Number of Completed Packets (Octet 10 - Bit 7)
          Read Local Version Information (Octet 14 - Bit 3)
          Read Local Supported Features (Octet 14 - Bit 5)
          Read BD ADDR (Octet 15 - Bit 1)
          Read RSSI (Octet 15 - Bit 5)
          Set Event Mask Page 2 (Octet 22 - Bit 2)
          LE Set Event Mask (Octet 25 - Bit 0)
          LE Read Buffer Size (Octet 25 - Bit 1)
          LE Read Local Supported Features (Octet 25 - Bit 2)
          LE Set Random Address (Octet 25 - Bit 4)
          LE Set Advertising Parameters (Octet 25 - Bit 5)
          LE Read Advertising Channel TX Power (Octet 25 - Bit 6)
          LE Set Advertising Data (Octet 25 - Bit 7)
          LE Set Scan Response Data (Octet 26 - Bit 0)
          LE Set Advertise Enable (Octet 26 - Bit 1)
          LE Set Scan Parameters (Octet 26 - Bit 2)
          LE Set Scan Enable (Octet 26 - Bit 3)
          LE Create Connection (Octet 26 - Bit 4)
          LE Create Connection Cancel (Octet 26 - Bit 5)
          LE Read Accept List Size (Octet 26 - Bit 6)
          LE Clear Accept List (Octet 26 - Bit 7)
          LE Add Device To Accept List (Octet 27 - Bit 0)
          LE Remove Device From Accept List (Octet 27 - Bit 1)
          LE Connection Update (Octet 27 - Bit 2)
          LE Set Host Channel Classification (Octet 27 - Bit 3)
          LE Read Channel Map (Octet 27 - Bit 4)
          LE Read Remote Used Features (Octet 27 - Bit 5)
          LE Encrypt (Octet 27 - Bit 6)
          LE Rand (Octet 27 - Bit 7)
          LE Start Encryption (Octet 28 - Bit 0)
          LE Long Term Key Request Reply (Octet 28 - Bit 1)
          LE Long Term Key Request Neg Reply (Octet 28 - Bit 2)
          LE Read Supported States (Octet 28 - Bit 3)
          LE Receiver Test (Octet 28 - Bit 4)
          LE Transmitter Test (Octet 28 - Bit 5)
          LE Test End (Octet 28 - Bit 6)
          Read Authenticated Payload Timeout (Octet 32 - Bit 4)
          Write Authenticated Payload Timeout (Octet 32 - Bit 5)
          LE Set Data Length (Octet 33 - Bit 6)
          LE Read Suggested Default Data Length (Octet 33 - Bit 7)
          LE Write Suggested Default Data Length (Octet 34 - Bit 0)
          LE Add Device To Resolving List (Octet 34 - Bit 3)
          LE Remove Device From Resolving List (Octet 34 - Bit 4)
          LE Clear Resolving List (Octet 34 - Bit 5)
          LE Read Resolving List Size (Octet 34 - Bit 6)
          LE Set Address Resolution Enable (Octet 35 - Bit 1)
          LE Set Resolvable Private Address Timeout (Octet 35 - Bit 2)
          LE Read Maximum Data Length (Octet 35 - Bit 3)
          LE Read PHY (Octet 35 - Bit 4)
          LE Set Default PHY (Octet 35 - Bit 5)
          LE Set PHY (Octet 35 - Bit 6)
          LE Enhanced Receiver Test (Octet 35 - Bit 7)
          LE Enhanced Transmitter Test (Octet 36 - Bit 0)
          LE Set Advertising Set Random Address (Octet 36 - Bit 1)
          LE Set Extended Advertising Parameters (Octet 36 - Bit 2)
          LE Set Extended Advertising Data (Octet 36 - Bit 3)
          LE Set Extended Scan Response Data (Octet 36 - Bit 4)
          LE Set Extended Advertising Enable (Octet 36 - Bit 5)
          LE Read Maximum Advertising Data Length (Octet 36 - Bit 6)
          LE Read Number of Supported Advertising Sets (Octet 36 - Bit 7)
          LE Remove Advertising Set (Octet 37 - Bit 0)
          LE Clear Advertising Sets (Octet 37 - Bit 1)
          LE Set Periodic Advertising Parameters (Octet 37 - Bit 2)
          LE Set Periodic Advertising Data (Octet 37 - Bit 3)
          LE Set Periodic Advertising Enable (Octet 37 - Bit 4)
          LE Set Extended Scan Parameters (Octet 37 - Bit 5)
          LE Set Extended Scan Enable (Octet 37 - Bit 6)
          LE Extended Create Connection (Octet 37 - Bit 7)
          LE Periodic Advertising Create Sync (Octet 38 - Bit 0)
          LE Periodic Advertising Create Sync Cancel (Octet 38 - Bit 1)
          LE Periodic Advertising Terminate Sync (Octet 38 - Bit 2)
          LE Add Device To Periodic Advertiser List (Octet 38 - Bit 3)
          LE Remove Device From Periodic Advertiser List (Octet 38 - Bit 4)
          LE Clear Periodic Advertiser List (Octet 38 - Bit 5)
          LE Read Periodic Advertiser List Size (Octet 38 - Bit 6)
          LE Read Transmit Power (Octet 38 - Bit 7)
          LE Read RF Path Compensation (Octet 39 - Bit 0)
          LE Write RF Path Compensation (Octet 39 - Bit 1)
          LE Set Privacy Mode (Octet 39 - Bit 2)
          LE Periodic Advertising Receive Enable (Octet 40 - Bit 5)
          LE Periodic Advertising Sync Transfer (Octet 40 - Bit 6)
          LE Periodic Advertising Set Info Transfer (Octet 40 - Bit 7)
          LE Periodic Advertising Sync Transfer Parameters (Octet 41 - Bit 0)
          LE Set Default Periodic Advertisng Sync Transfer Parameters (Octet 41 - Bit 1)
          LE Read Buffer v2 (Octet 41 - Bit 5)
          LE Read ISO TX Sync (Octet 41 - Bit 6)
          LE Set Connected Isochronous Group Parameters (Octet 41 - Bit 7)
          LE Set Connected Isochronous Group Parameters Test (Octet 42 - Bit 0)
          LE Create Connected Isochronous Stream (Octet 42 - Bit 1)
          LE Remove Connected Isochronous Group (Octet 42 - Bit 2)
          LE Accept Connected Isochronous Stream Request (Octet 42 - Bit 3)
          LE Reject Connected Isochronous Stream Request (Octet 42 - Bit 4)
          LE Create Broadcast Isochronous Group (Octet 42 - Bit 5)
          LE Create Broadcast Isochronous Group Test (Octet 42 - Bit 6)
          LE Terminate Broadcast Isochronous Group (Octet 42 - Bit 7)
          LE Broadcast Isochronous Group Create Sync (Octet 43 - Bit 0)
          LE Broadcast Isochronous Group Terminate Sync (Octet 43 - Bit 1)
          LE Request Peer SCA (Octet 43 - Bit 2)
          LE Setup Isochronous Data Path (Octet 43 - Bit 3)
          LE Remove Isochronous Data Path (Octet 43 - Bit 4)
          LE Isochronous Transmit Test (Octet 43 - Bit 5)
          LE Isochronous Receive Test (Octet 43 - Bit 6)
          LE Isochronous Read Test Counters (Octet 43 - Bit 7)
          LE Isochronous Read Test Counters (Octet 44 - Bit 0)
          LE Set Host Feature (Octet 44 - Bit 1)
          LE Read ISO link quality (Octet 44 - Bit 2)
          Octet 45 - Bit 6 
          Octet 46 - Bit 0 
          Octet 46 - Bit 1 
          Octet 46 - Bit 2 
zephyr.exe[3326737]: < HCI Command: Host Buffer Size (0x03|0x0033) plen 7                                             #9 1.195695
        ACL MTU: 255  ACL max packet: 16
        SCO MTU: 0    SCO max packet: 0
> HCI Event: Command Complete (0x0e) plen 4                                                                          #10 1.196284
      Host Buffer Size (0x03|0x0033) ncmd 1
        Status: Success (0x00)
zephyr.exe[3326737]: < HCI Command: Set Controller To Host Flow Control (0x03|0x0031) plen 1                         #11 1.215654
        Flow control: ACL Data Packets (0x01)
> HCI Event: Command Complete (0x0e) plen 4                                                                          #12 1.216090
      Set Controller To Host Flow Control (0x03|0x0031) ncmd 1
        Status: Success (0x00)
zephyr.exe[3326737]: < HCI Command: LE Read Local Supported Features (0x08|0x0003) plen 0                            #13 1.235682
> HCI Event: Command Complete (0x0e) plen 12                                                                         #14 1.236340
      LE Read Local Supported Features (0x08|0x0003) ncmd 1
        Status: Success (0x00)
        Features: 0xfd 0x79 0x00 0xf7 0x30 0x01 0x00 0x00
          LE Encryption
          Extended Reject Indication
          Peripheral-initiated Features Exchange
          LE Ping
          LE Data Packet Length Extension
          LL Privacy
          Extended Scanner Filter Policies
          LE 2M PHY
          LE Coded PHY
          LE Extended Advertising
          LE Periodic Advertising
          Channel Selection Algorithm #2
          Periodic Advertising Sync Transfer - Sender
          Periodic Advertising Sync Transfer - Recipient
          Sleep Clock Accuracy Updates
          Connected Isochronous Stream - Central
          Connected Isochronous Stream - Peripheral
          Isochronous Broadcaster
          Synchronized Receiver
          Periodic Advertising ADI support
          Connection Subrating
          Unknown features (0x0000010000000000)
zephyr.exe[3326737]: < HCI Command: LE Set Host Feature (0x08|0x0074) plen 2                                         #15 1.255683
        Bit Number: 32
          Connected Isochronous Stream (Host Support)
        Bit Value: 1
> HCI Event: Command Complete (0x0e) plen 4                                                                          #16 1.256376
      LE Set Host Feature (0x08|0x0074) ncmd 1
        Status: Success (0x00)
zephyr.exe[3326737]: < HCI Command: LE Read Buffer v2 (0x08|0x0060) plen 0                                           #17 1.275686
> HCI Event: Command Complete (0x0e) plen 10                                                                         #18 1.276910
      LE Read Buffer v2 (0x08|0x0060) ncmd 1
        Status: Success (0x00)
        ACL MTU: 27
        ACL max packet: 3
        ISO MTU: 318
        ISO max packet: 3
zephyr.exe[3326737]: < HCI Command: LE Read Maximum Advertising Data Length (0x08|0x003a) plen 0                     #19 1.295690
> HCI Event: Command Complete (0x0e) plen 6                                                                          #20 1.296343
      LE Read Maximum Advertising Data Length (0x08|0x003a) ncmd 1
        Status: Success (0x00)
        Max length: 1650
zephyr.exe[3326737]: < HCI Command: LE Read Supported States (0x08|0x001c) plen 0                                    #21 1.315682
> HCI Event: Command Complete (0x0e) plen 12                                                                         #22 1.316333
      LE Read Supported States (0x08|0x001c) ncmd 1
        Status: Success (0x00)
        States: 0x000003ff3e0306ff
          Non-connectable Advertising State
          Scannable Advertising State
          Connectable Advertising State
          High Duty Cycle Directed Advertising State
          Passive Scanning State
          Active Scanning State
          Initiating State
            and Connection State (Central Role)
          Connection State (Peripheral Role)
          Scannable Advertising State
            and Passive Scanning State
          Connectable Advertising State
            and Passive Scanning State
          Non-connectable Advertising State
            and Initiating State
          Scannable Advertising State
            and Initiating State
          Active Scanning State
            and Connection State (Central Role)
          Passive Scanning State
            and Connection State (Peripheral Role)
          Active Scanning State
            and Connection State (Peripheral Role)
          Initiating State
            and Connection State (Central Role)
            and Central Role & Central Role
          Low Duty Cycle Directed Advertising State
          Connectable Advertising State
            and Initiating State
            and Central Role & Peripheral Role
          High Duty Cycle Directed Advertising State
            and Initiating State
            and Central Role & Peripheral Role
          Low Duty Cycle Directed Advertising State
            and Initiating State
            and Central Role & Peripheral Role
          Connectable Advertising State
            and Connection State (Central Role)
            and Central Role & Peripheral Role
          High Duty Cycle Directed Advertising State
            and Connection State (Central Role)
            and Central Role & Peripheral Role
          Low Duty Cycle Directed Advertising State
            and Connection State (Central Role)
            and Central Role & Peripheral Role
          Connectable Advertising State
            and Connection State (Peripheral Role)
            and Central Role & Peripheral Role
          High Duty Cycle Directed Advertising State
            and Connection State (Peripheral Role)
            and Peripheral Role & Peripheral Role
          Low Duty Cycle Directed Advertising State
            and Connection State (Peripheral Role)
            and Peripheral Role & Peripheral Role
          Initiating State
            and Connection State (Peripheral Role)
            and Central Role & Peripheral Role
zephyr.exe[3326737]: < HCI Command: LE Read Maximum Data Length (0x08|0x002f) plen 0                                 #23 1.335687
> HCI Event: Command Complete (0x0e) plen 12                                                                         #24 1.336706
      LE Read Maximum Data Length (0x08|0x002f) ncmd 1
        Status: Success (0x00)
        Max TX octets: 251
        Max TX time: 2704
        Max RX octets: 251
        Max RX time: 2704
zephyr.exe[3326737]: < HCI Command: LE Write Suggested Default Data Length (0x08|0x0024) plen 4                      #25 1.355634
        TX octets: 251
        TX time: 2704
> HCI Event: Command Complete (0x0e) plen 4                                                                          #26 1.356369
      LE Write Suggested Default Data Length (0x08|0x0024) ncmd 1
        Status: Success (0x00)
zephyr.exe[3326737]: < HCI Command: LE Read Resolving List Size (0x08|0x002a) plen 0                                 #27 1.375688
> HCI Event: Command Complete (0x0e) plen 5                                                                          #28 1.376501
      LE Read Resolving List Size (0x08|0x002a) ncmd 1
        Status: Success (0x00)
        Size: 8
zephyr.exe[3326737]: < HCI Command: LE Set Event Mask (0x08|0x0001) plen 8                                           #29 1.395673
        Mask: 0x000002023f87fa5e
          LE Advertising Report
          LE Connection Update Complete
          LE Read Remote Used Features Complete
          LE Long Term Key Request
          LE Data Length Change
          LE Enhanced Connection Complete
          LE PHY Update Complete
          LE Extended Advertising Report
          LE Periodic Advertising Sync Established
          LE Periodic Advertising Report
          LE Periodic Advertising Sync Lost
          LE Extended Scan Timeout
          LE Extended Advertising Set Terminated
          LE Scan Request Received
          LE Periodic Advertising Sync Transfer Rvc
          LE CIS Established
          LE CIS Request
          LE Create BIG Complete
          LE Terminate BIG Complete
          LE BIG Sync Established Complete
          LE BIG Sync Lost
          LE BIG Info Advertising Report
          Unknown mask (0x0000020000000000)
> HCI Event: Command Complete (0x0e) plen 4                                                                          #30 1.396412
      LE Set Event Mask (0x08|0x0001) ncmd 1
        Status: Success (0x00)
zephyr.exe[3326737]: < HCI Command: Set Event Mask (0x03|0x0001) plen 8                                              #31 1.415681
        Mask: 0x2000800002008890
          Disconnection Complete
          Encryption Change
          Read Remote Version Information Complete
          Hardware Error
          Data Buffer Overflow
          Encryption Key Refresh Complete
          LE Meta
> HCI Event: Command Complete (0x0e) plen 4                                                                          #32 1.416456
      Set Event Mask (0x03|0x0001) ncmd 1
        Status: Success (0x00)
zephyr.exe[3326737]: < HCI Command: Read BD ADDR (0x04|0x0009) plen 0                                                #33 1.435677
> HCI Event: Command Complete (0x0e) plen 10                                                                         #34 1.436371
      Read BD ADDR (0x04|0x0009) ncmd 1
        Status: Success (0x00)
        Address: 00:00:00:00:00:00 (OUI 00-00-00)
zephyr.exe[3326737]: < HCI Command: LE Set Random Address (0x08|0x0005) plen 6                                       #35 1.455690
        Address: D5:B6:CC:31:DB:3B (Static)
> HCI Event: Command Complete (0x0e) plen 4                                                                          #36 1.456496
      LE Set Random Address (0x08|0x0005) ncmd 1
        Status: Success (0x00)
zephyr.exe[3326737]: < HCI Command: LE Extended Create Connection (0x08|0x0043) plen 26                              #37 5.525724
        Filter policy: Accept list is not used (0x00)
        Own address type: Random (0x01)
        Peer address type: Public (0x00)
        Peer address: DF:A9:FF:F6:B1:1A (OUI DF-A9-FF)
        Initiating PHYs: 0x01
        Entry 0: LE 1M
          Scan interval: 60.000 msec (0x0060)
          Scan window: 60.000 msec (0x0060)
          Min connection interval: 30.00 msec (0x0018)
          Max connection interval: 50.00 msec (0x0028)
          Connection latency: 0 (0x0000)
          Supervision timeout: 4000 msec (0x0190)
          Min connection length: 0.000 msec (0x0000)
          Max connection length: 0.000 msec (0x0000)
> HCI Event: Command Status (0x0f) plen 4                                                                            #38 5.527224
      LE Extended Create Connection (0x08|0x0043) ncmd 1
        Status: Success (0x00)
> HCI Event: LE Meta Event (0x3e) plen 31                                                                            #39 5.638733
      LE Enhanced Connection Complete (0x0a)
        Status: Success (0x00)
        Handle: 594
        Role: Central (0x00)
        Peer address type: Public (0x00)
        Peer address: DF:A9:FF:F6:B1:1A (OUI DF-A9-FF)
        Local resolvable private address: 00:00:00:00:00:00 (Non-Resolvable)
        Peer resolvable private address: 00:00:00:00:00:00 (Non-Resolvable)
        Connection interval: 50.00 msec (0x0028)
        Connection latency: 0 (0x0000)
        Supervision timeout: 4000 msec (0x0190)
        Central clock accuracy: 0x00
zephyr.exe[3326737]: < HCI Command: LE Read Remote Used Features (0x08|0x0016) plen 2                                #40 5.655863
        Handle: 594 Address: DF:A9:FF:F6:B1:1A (OUI DF-A9-FF)
> HCI Event: Command Status (0x0f) plen 4                                                                            #41 5.656786
      LE Read Remote Used Features (0x08|0x0016) ncmd 1
        Status: Success (0x00)
zephyr.exe[3326737]: < HCI Command: LE Set PHY (0x08|0x0032) plen 7                                                  #42 5.675709
        Handle: 594 Address: DF:A9:FF:F6:B1:1A (OUI DF-A9-FF)
        All PHYs preference: 0x00
        TX PHYs preference: 0x02
          LE 2M
        RX PHYs preference: 0x02
          LE 2M
        PHY options preference: Reserved (0x0000)
> HCI Event: Command Status (0x0f) plen 4                                                                            #43 5.676666
      LE Set PHY (0x08|0x0032) ncmd 1
        Status: Success (0x00)
> HCI Event: LE Meta Event (0x3e) plen 12                                                                            #44 5.790554
      LE Read Remote Used Features (0x04)
        Status: Success (0x00)
        Handle: 594 Address: DF:A9:FF:F6:B1:1A (OUI DF-A9-FF)
        Features: 0x2d 0x49 0x00 0xf7 0x67 0xd8 0x00 0x00
          LE Encryption
          Extended Reject Indication
          Peripheral-initiated Features Exchange
          LE Data Packet Length Extension
          LE 2M PHY
          LE Coded PHY
          Channel Selection Algorithm #2
          Periodic Advertising Sync Transfer - Sender
          Periodic Advertising Sync Transfer - Recipient
          Sleep Clock Accuracy Updates
          Connected Isochronous Stream - Central
          Connected Isochronous Stream - Peripheral
          Isochronous Broadcaster
          Synchronized Receiver
          Connected Isochronous Stream (Host Support)
          LE Power Control Request
          LE Power Control Request
          Connection Subrating
          Connection Subrating (Host Support)
          Unknown features (0x0000d80000000000)
> HCI Event: LE Meta Event (0x3e) plen 6                                                                             #45 6.289229
      LE PHY Update Complete (0x0c)
        Status: Success (0x00)
        Handle: 594 Address: DF:A9:FF:F6:B1:1A (OUI DF-A9-FF)
        TX PHY: LE 2M (0x02)
        RX PHY: LE 2M (0x02)
zephyr.exe[3326737]: < ACL Data TX: Handle 594 [1/3] flags 0x00 dlen 11                                              #46 6.575632
      SMP: Pairing Request (0x01) len 6
        IO capability: KeyboardDisplay (0x04)
        OOB data: Authentication data not present (0x00)
        Authentication requirement: Bonding, No MITM, SC, No Keypresses (0x09)
        Max encryption key size: 16
        Initiator key distribution: EncKey Sign (0x05)
        Responder key distribution: EncKey IdKey Sign (0x07)
> HCI Event: Number of Completed Packets (0x13) plen 5                                                               #47 6.589771
        Num handles: 1
        Handle: 594 Address: DF:A9:FF:F6:B1:1A (OUI DF-A9-FF)
        Count: 1
        Buffers: 0/3
        #46: len 11 (6 Kb/s)
        Latency: 14 msec (14-14 msec ~14 msec)
> ACL Data RX: Handle 594 flags 0x02 dlen 11                                                                         #48 6.640127
      SMP: Pairing Response (0x02) len 6
        IO capability: KeyboardDisplay (0x04)
        OOB data: Authentication data not present (0x00)
        Authentication requirement: Bonding, MITM, SC, No Keypresses (0x0d)
        Max encryption key size: 16
        Initiator key distribution: EncKey Sign (0x05)
        Responder key distribution: EncKey IdKey Sign (0x07)
zephyr.exe[3326737]: < HCI Command: Host Number of Completed Packets (0x03|0x0035) plen 5                            #49 6.655865
        Num handles: 1
        Handle: 594 Address: DF:A9:FF:F6:B1:1A (OUI DF-A9-FF)
        Count: 1
zephyr.exe[3326737]: < ACL Data TX: Handle 594 [1/3] flags 0x00 dlen 27                                              #50 6.655929
zephyr.exe[3326737]: < ACL Data TX: Handle 594 flags 0x01 dlen 27                                                    #51 6.655934
zephyr.exe[3326737]: < ACL Data TX: Handle 594 flags 0x01 dlen 15                                                    #52 6.655934
      SMP: Pairing Public Key (0x0c) len 64
        X[32]: 98308440221e2d910f0e54b71e7ec652857aa9b5a0dc65028824cc19db1226e9
        Y[32]: 67a4816bcb62efb21701e31fdb27561a6217575fb007a8bbdabe7e28b6f68482
> HCI Event: Number of Completed Packets (0x13) plen 5                                                               #53 6.689818
        Num handles: 1
        Handle: 594 Address: DF:A9:FF:F6:B1:1A (OUI DF-A9-FF)
        Count: 1
        Buffers: 0/3
        #50: len 27 (6 Kb/s)
        Latency: 33 msec (14-33 msec ~24 msec)
> HCI Event: Number of Completed Packets (0x13) plen 5                                                               #54 6.690193
        Num handles: 1
        Handle: 594 Address: DF:A9:FF:F6:B1:1A (OUI DF-A9-FF)
        Count: 1
        Buffers: underflow/3
        #51: len 27 (6 Kb/s)
        Latency: 34 msec (14-34 msec ~29 msec)
> HCI Event: Number of Completed Packets (0x13) plen 5                                                               #55 6.690748
        Num handles: 1
        Handle: 594 Address: DF:A9:FF:F6:B1:1A (OUI DF-A9-FF)
        Count: 1
        Buffers: underflow/3
        #52: len 15 (3 Kb/s)
        Latency: 34 msec (14-34 msec ~31 msec)
> ACL Data RX: Handle 594 flags 0x02 dlen 27                                                                         #56 6.740444
> ACL Data RX: Handle 594 flags 0x01 dlen 27                                                                         #57 6.740671
> ACL Data RX: Handle 594 flags 0x01 dlen 15                                                                         #58 6.740901
      SMP: Pairing Public Key (0x0c) len 64
        X[32]: 72898d00612e617e7d96c9506cb48c1645dd43503bd09df4c752beb681b0f856
        Y[32]: 45c8210f9413cd650903a8161a9f2bc654fc386a85ef71c9a8c6e4612f32d0f1
zephyr.exe[3326737]: < HCI Command: Host Number of Completed Packets (0x03|0x0035) plen 5                            #59 6.755882
        Num handles: 1
        Handle: 594 Address: DF:A9:FF:F6:B1:1A (OUI DF-A9-FF)
        Count: 1
zephyr.exe[3326737]: < HCI Command: Host Number of Completed Packets (0x03|0x0035) plen 5                            #60 6.755961
        Num handles: 1
        Handle: 594 Address: DF:A9:FF:F6:B1:1A (OUI DF-A9-FF)
        Count: 1
zephyr.exe[3326737]: < HCI Command: Host Number of Completed Packets (0x03|0x0035) plen 5                            #61 6.756001
        Num handles: 1
        Handle: 594 Address: DF:A9:FF:F6:B1:1A (OUI DF-A9-FF)
        Count: 1
> ACL Data RX: Handle 594 flags 0x02 dlen 21                                                                         #62 6.840006
      SMP: Pairing Confirm (0x03) len 16
        Confirm value[16]: 01a0056424b9e504b586ee26376e5181
zephyr.exe[3326737]: < HCI Command: Host Number of Completed Packets (0x03|0x0035) plen 5                            #63 6.855866
        Num handles: 1
        Handle: 594 Address: DF:A9:FF:F6:B1:1A (OUI DF-A9-FF)
        Count: 1
zephyr.exe[3326737]: < ACL Data TX: Handle 594 [1/3] flags 0x00 dlen 21                                              #64 6.855932
      SMP: Pairing Random (0x04) len 16
        Random value[16]: 8e6108f966a694cbe26df70bb96773e6
> HCI Event: Number of Completed Packets (0x13) plen 5                                                               #65 6.889969
        Num handles: 1
        Handle: 594 Address: DF:A9:FF:F6:B1:1A (OUI DF-A9-FF)
        Count: 1
        Buffers: 0/3
        #64: len 21 (4 Kb/s)
        Latency: 34 msec (14-34 msec ~33 msec)
> ACL Data RX: Handle 594 flags 0x02 dlen 21                                                                         #66 7.139946
      SMP: Pairing Random (0x04) len 16
        Random value[16]: 45e0c01b2441b583a0a2d1d0d437d329
zephyr.exe[3326737]: < HCI Command: Host Number of Completed Packets (0x03|0x0035) plen 5                            #67 7.155967
        Num handles: 1
        Handle: 594 Address: DF:A9:FF:F6:B1:1A (OUI DF-A9-FF)
        Count: 1
zephyr.exe[3326737]: < ACL Data TX: Handle 594 [1/3] flags 0x00 dlen 21                                              #68 7.595814
      SMP: Pairing DHKey Check (0x0d) len 16
        E[16]: da0b98ccf61c5fa4577134f70fff2901
> HCI Event: Number of Completed Packets (0x13) plen 5                                                               #69 7.639739
        Num handles: 1
        Handle: 594 Address: DF:A9:FF:F6:B1:1A (OUI DF-A9-FF)
        Count: 1
        Buffers: 0/3
        #68: len 21 (3 Kb/s)
        Latency: 43 msec (14-43 msec ~38 msec)
> ACL Data RX: Handle 594 flags 0x02 dlen 21                                                                         #70 7.690480
      SMP: Pairing DHKey Check (0x0d) len 16
        E[16]: f6b8e6cfb52f9066bec8df1cc222028f
zephyr.exe[3326737]: < HCI Command: LE Start Encryption (0x08|0x0019) plen 28                                        #71 7.695921
        Handle: 594 Address: DF:A9:FF:F6:B1:1A (OUI DF-A9-FF)
        Random number: 0x0000000000000000
        Encrypted diversifier: 0x0000
        Long term key[16]: 81840b144be77a975be3796bf0e586c4
> HCI Event: Command Status (0x0f) plen 4                                                                            #72 7.697093
      LE Start Encryption (0x08|0x0019) ncmd 1
        Status: Success (0x00)
zephyr.exe[3326737]: < HCI Command: Host Number of Completed Packets (0x03|0x0035) plen 5                            #73 7.715724
        Num handles: 1
        Handle: 594 Address: DF:A9:FF:F6:B1:1A (OUI DF-A9-FF)
        Count: 1
> HCI Event: Encryption Change (0x08) plen 4                                                                         #74 8.040165
        Status: Success (0x00)
        Handle: 594 Address: DF:A9:FF:F6:B1:1A (OUI DF-A9-FF)
        Encryption: Enabled with AES-CCM (0x01)
> ACL Data RX: Handle 594 flags 0x02 dlen 21                                                                         #75 8.090346
      SMP: Identity Information (0x08) len 16
        Identity resolving key[16]: 6cf0d45ffcfbbc186cdd142739e03843
zephyr.exe[3326737]: < HCI Command: Host Number of Completed Packets (0x03|0x0035) plen 5                            #76 8.095874
        Num handles: 1
        Handle: 594 Address: DF:A9:FF:F6:B1:1A (OUI DF-A9-FF)
        Count: 1
> ACL Data RX: Handle 594 flags 0x02 dlen 12                                                                         #77 8.189987
      SMP: Identity Address Information (0x09) len 7
        Address: DF:A9:FF:F6:B1:1A (OUI DF-A9-FF)
zephyr.exe[3326737]: < HCI Command: LE Add Device To Resolving List (0x08|0x0027) plen 39                            #78 8.195899
        Address type: Public (0x00)
        Address: DF:A9:FF:F6:B1:1A (OUI DF-A9-FF)
        Peer identity resolving key[16]: 6cf0d45ffcfbbc186cdd142739e03843
        Local identity resolving key[16]: 00000000000000000000000000000000
> HCI Event: Command Complete (0x0e) plen 4                                                                          #79 8.197625
      LE Add Device To Resolving List (0x08|0x0027) ncmd 1
        Status: Success (0x00)
zephyr.exe[3326737]: < HCI Command: LE Set Privacy Mode (0x08|0x004e) plen 8                                         #80 8.215734
        Peer Identity address type: Public (0x00)
        Peer Identity address: DF:A9:FF:F6:B1:1A (OUI DF-A9-FF)
        Privacy Mode: Use Device Privacy (0x01)
> HCI Event: Command Complete (0x0e) plen 4                                                                          #81 8.216474
      LE Set Privacy Mode (0x08|0x004e) ncmd 1
        Status: Success (0x00)
zephyr.exe[3326737]: < HCI Command: LE Set Address Resolution Enable (0x08|0x002d) plen 1                            #82 8.235847
        Address resolution: Enabled (0x01)
> HCI Event: Command Complete (0x0e) plen 4                                                                          #83 8.236831
      LE Set Address Resolution Enable (0x08|0x002d) ncmd 1
        Status: Success (0x00)
zephyr.exe[3326737]: < HCI Command: Host Number of Completed Packets (0x03|0x0035) plen 5                            #84 8.255801
        Num handles: 1
        Handle: 594 Address: DF:A9:FF:F6:B1:1A (OUI DF-A9-FF)
        Count: 1
> ACL Data RX: Handle 594 flags 0x02 dlen 21                                                                         #85 8.290485
      SMP: Signing Information (0x0a) len 16
        Signature key[16]: ccd451a320c7aeeeeea13a37a9e83922
zephyr.exe[3326737]: < HCI Command: Host Number of Completed Packets (0x03|0x0035) plen 5                            #86 8.295805
        Num handles: 1
        Handle: 594 Address: DF:A9:FF:F6:B1:1A (OUI DF-A9-FF)
        Count: 1
zephyr.exe[3326737]: < ACL Data TX: Handle 594 [1/3] flags 0x00 dlen 21                                              #87 8.295829
      SMP: Signing Information (0x0a) len 16
        Signature key[16]: 5da095555cc64d02679f89a05211af56
> HCI Event: Number of Completed Packets (0x13) plen 5                                                               #88 8.340098
        Num handles: 1
        Handle: 594 Address: DF:A9:FF:F6:B1:1A (OUI DF-A9-FF)
        Count: 1
        Buffers: 0/3
        #87: len 21 (3 Kb/s)
        Latency: 44 msec (14-44 msec ~41 msec)
> HCI Event: Disconnect Complete (0x05) plen 4                                                                       #89 8.889505
        Status: Success (0x00)
        Handle: 594 Address: DF:A9:FF:F6:B1:1A (OUI DF-A9-FF)
        Reason: Remote User Terminated Connection (0x13)
zephyr.exe[3326737]: < HCI Command: LE Extended Create Connection (0x08|0x0043) plen 26                              #90 9.635815
        Filter policy: Accept list is not used (0x00)
        Own address type: Random (0x01)
        Peer address type: Public (0x00)
        Peer address: DF:A9:FF:F6:B1:1A (OUI DF-A9-FF)
        Initiating PHYs: 0x01
        Entry 0: LE 1M
          Scan interval: 60.000 msec (0x0060)
          Scan window: 60.000 msec (0x0060)
          Min connection interval: 30.00 msec (0x0018)
          Max connection interval: 50.00 msec (0x0028)
          Connection latency: 0 (0x0000)
          Supervision timeout: 4000 msec (0x0190)
          Min connection length: 0.000 msec (0x0000)
          Max connection length: 0.000 msec (0x0000)
> HCI Event: Command Status (0x0f) plen 4                                                                            #91 9.637267
      LE Extended Create Connection (0x08|0x0043) ncmd 1
        Status: Success (0x00)
> HCI Event: LE Meta Event (0x3e) plen 31                                                                            #92 9.747412
      LE Enhanced Connection Complete (0x0a)
        Status: Success (0x00)
        Handle: 612
        Role: Central (0x00)
        Peer address type: Public (0x00)
        Peer address: DF:A9:FF:F6:B1:1A (OUI DF-A9-FF)
        Local resolvable private address: 00:00:00:00:00:00 (Non-Resolvable)
        Peer resolvable private address: 00:00:00:00:00:00 (Non-Resolvable)
        Connection interval: 50.00 msec (0x0028)
        Connection latency: 0 (0x0000)
        Supervision timeout: 4000 msec (0x0190)
        Central clock accuracy: 0x00
zephyr.exe[3326737]: < HCI Command: LE Read Remote Used Features (0x08|0x0016) plen 2                                #93 9.755824
        Handle: 612 Address: DF:A9:FF:F6:B1:1A (OUI DF-A9-FF)
> HCI Event: Command Status (0x0f) plen 4                                                                            #94 9.756412
      LE Read Remote Used Features (0x08|0x0016) ncmd 1
        Status: Success (0x00)
zephyr.exe[3326737]: < HCI Command: LE Set PHY (0x08|0x0032) plen 7                                                  #95 9.775823
        Handle: 612 Address: DF:A9:FF:F6:B1:1A (OUI DF-A9-FF)
        All PHYs preference: 0x00
        TX PHYs preference: 0x02
          LE 2M
        RX PHYs preference: 0x02
          LE 2M
        PHY options preference: Reserved (0x0000)
> HCI Event: Command Status (0x0f) plen 4                                                                            #96 9.776622
      LE Set PHY (0x08|0x0032) ncmd 1
        Status: Success (0x00)
> HCI Event: LE Meta Event (0x3e) plen 12                                                                            #97 9.899462
      LE Read Remote Used Features (0x04)
        Status: Success (0x00)
        Handle: 612 Address: DF:A9:FF:F6:B1:1A (OUI DF-A9-FF)
        Features: 0x2d 0x49 0x00 0xf7 0x67 0xd8 0x00 0x00
          LE Encryption
          Extended Reject Indication
          Peripheral-initiated Features Exchange
          LE Data Packet Length Extension
          LE 2M PHY
          LE Coded PHY
          Channel Selection Algorithm #2
          Periodic Advertising Sync Transfer - Sender
          Periodic Advertising Sync Transfer - Recipient
          Sleep Clock Accuracy Updates
          Connected Isochronous Stream - Central
          Connected Isochronous Stream - Peripheral
          Isochronous Broadcaster
          Synchronized Receiver
          Connected Isochronous Stream (Host Support)
          LE Power Control Request
          LE Power Control Request
          Connection Subrating
          Connection Subrating (Host Support)
          Unknown features (0x0000d80000000000)
> HCI Event: LE Meta Event (0x3e) plen 6                                                                            #98 10.398160
      LE PHY Update Complete (0x0c)
        Status: Success (0x00)
        Handle: 612 Address: DF:A9:FF:F6:B1:1A (OUI DF-A9-FF)
        TX PHY: LE 2M (0x02)
        RX PHY: LE 2M (0x02)
zephyr.exe[3326737]: < ACL Data TX: Handle 612 [1/3] flags 0x00 dlen 7                                              #99 10.675755
      ATT: Read Request (0x0a) len 2
        Handle: 0x0007
> HCI Event: Number of Completed Packets (0x13) plen 5                                                             #100 10.698613
        Num handles: 1
        Handle: 612 Address: DF:A9:FF:F6:B1:1A (OUI DF-A9-FF)
        Count: 1
        Buffers: 0/3
        #99: len 7 (2 Kb/s)
        Latency: 22 msec (22-22 msec ~22 msec)
> ACL Data RX: Handle 612 flags 0x02 dlen 9                                                                        #101 10.748628
      ATT: Error Response (0x01) len 4
        Read Request (0x0a)
        Handle: 0x0007
        Error: Insufficient Encryption (0x0f)
zephyr.exe[3326737]: < HCI Command: Host Number of Completed Packets (0x03|0x0035) plen 5                          #102 10.755869
        Num handles: 1
        Handle: 612 Address: DF:A9:FF:F6:B1:1A (OUI DF-A9-FF)
        Count: 1
zephyr.exe[3326737]: < HCI Command: LE Start Encryption (0x08|0x0019) plen 28                                     #103 311.809470
        Handle: 612 Address: DF:A9:FF:F6:B1:1A (OUI DF-A9-FF)
        Random number: 0x0000000000000000
        Encrypted diversifier: 0x0000
        Long term key[16]: 81840b144be77a975be3796bf0e586c4
> HCI Event: Command Status (0x0f) plen 4                                                                         #104 311.810458
      LE Start Encryption (0x08|0x0019) ncmd 1
        Status: Success (0x00)
> HCI Event: Encryption Change (0x08) plen 4                                                                      #105 312.034685
        Status: PIN or Key Missing (0x06)
        Handle: 612 Address: DF:A9:FF:F6:B1:1A (OUI DF-A9-FF)
        Encryption: Disabled (0x00)
zephyr.exe[3326737]: < ACL Data TX: Handle 612 [1/3] flags 0x00 dlen 11                                           #106 312.039558
      SMP: Pairing Request (0x01) len 6
        IO capability: KeyboardDisplay (0x04)
        OOB data: Authentication data not present (0x00)
        Authentication requirement: Bonding, No MITM, SC, No Keypresses (0x09)
        Max encryption key size: 16
        Initiator key distribution: EncKey Sign (0x05)
        Responder key distribution: EncKey IdKey Sign (0x07)
> HCI Event: Number of Completed Packets (0x13) plen 5                                                            #107 312.134876
        Num handles: 1
        Handle: 612 Address: DF:A9:FF:F6:B1:1A (OUI DF-A9-FF)
        Count: 1
        Buffers: 0/3
        #106: len 11 (0 Kb/s)
        Latency: 95 msec (22-95 msec ~59 msec)
> ACL Data RX: Handle 612 flags 0x02 dlen 11                                                                      #108 312.134878
      SMP: Pairing Response (0x02) len 6
        IO capability: KeyboardDisplay (0x04)
        OOB data: Authentication data not present (0x00)
        Authentication requirement: Bonding, MITM, SC, No Keypresses (0x0d)
        Max encryption key size: 16
        Initiator key distribution: EncKey Sign (0x05)
        Responder key distribution: EncKey IdKey Sign (0x07)
zephyr.exe[3326737]: < HCI Command: Host Number of Completed Packets (0x03|0x0035) plen 5                         #109 312.139544
        Num handles: 1
        Handle: 612 Address: DF:A9:FF:F6:B1:1A (OUI DF-A9-FF)
        Count: 1
zephyr.exe[3326737]: < ACL Data TX: Handle 612 [1/3] flags 0x00 dlen 27                                           #110 312.139550
zephyr.exe[3326737]: < ACL Data TX: Handle 612 flags 0x01 dlen 27                                                 #111 312.139606
zephyr.exe[3326737]: < ACL Data TX: Handle 612 flags 0x01 dlen 15                                                 #112 312.139626
      SMP: Pairing Public Key (0x0c) len 64
        X[32]: 98308440221e2d910f0e54b71e7ec652857aa9b5a0dc65028824cc19db1226e9
        Y[32]: 67a4816bcb62efb21701e31fdb27561a6217575fb007a8bbdabe7e28b6f68482
> HCI Event: Number of Completed Packets (0x13) plen 5                                                            #113 312.183948
        Num handles: 1
        Handle: 612 Address: DF:A9:FF:F6:B1:1A (OUI DF-A9-FF)
        Count: 1
        Buffers: 0/3
        #110: len 27 (4 Kb/s)
        Latency: 44 msec (22-95 msec ~51 msec)
> HCI Event: Number of Completed Packets (0x13) plen 5                                                            #114 312.184501
        Num handles: 1
        Handle: 612 Address: DF:A9:FF:F6:B1:1A (OUI DF-A9-FF)
        Count: 1
        Buffers: underflow/3
        #111: len 27 (4 Kb/s)
        Latency: 44 msec (22-95 msec ~48 msec)
> HCI Event: Number of Completed Packets (0x13) plen 5                                                            #115 312.185055
        Num handles: 1
        Handle: 612 Address: DF:A9:FF:F6:B1:1A (OUI DF-A9-FF)
        Count: 1
        Buffers: underflow/3
        #112: len 15 (2 Kb/s)
        Latency: 45 msec (22-95 msec ~46 msec)
> ACL Data RX: Handle 612 flags 0x02 dlen 27                                                                      #116 312.234672
> ACL Data RX: Handle 612 flags 0x01 dlen 27                                                                      #117 312.234871
> ACL Data RX: Handle 612 flags 0x01 dlen 15                                                                      #118 312.235361
      SMP: Pairing Public Key (0x0c) len 64
        X[32]: b59602390582a373edb905a31fb26abef30595b4cb2c3007f05e86c38c9b485e
        Y[32]: 085bb923747a0330662a13851631bc0273387842ca87e916430c1bf6e05bb72a
zephyr.exe[3326737]: < HCI Command: Host Number of Completed Packets (0x03|0x0035) plen 5                         #119 312.239575
        Num handles: 1
        Handle: 612 Address: DF:A9:FF:F6:B1:1A (OUI DF-A9-FF)
        Count: 1
zephyr.exe[3326737]: < HCI Command: Host Number of Completed Packets (0x03|0x0035) plen 5                         #120 312.239709
        Num handles: 1
        Handle: 612 Address: DF:A9:FF:F6:B1:1A (OUI DF-A9-FF)
        Count: 1
zephyr.exe[3326737]: < HCI Command: Host Number of Completed Packets (0x03|0x0035) plen 5                         #121 312.239713
        Num handles: 1
        Handle: 612 Address: DF:A9:FF:F6:B1:1A (OUI DF-A9-FF)
        Count: 1
> ACL Data RX: Handle 612 flags 0x02 dlen 21                                                                      #122 312.240698
      SMP: Pairing Confirm (0x03) len 16
        Confirm value[16]: 5d77bb45f17e96aedba5a83ffdc3867a
zephyr.exe[3326737]: < HCI Command: Host Number of Completed Packets (0x03|0x0035) plen 5                         #123 312.259477
        Num handles: 1
        Handle: 612 Address: DF:A9:FF:F6:B1:1A (OUI DF-A9-FF)
        Count: 1
zephyr.exe[3326737]: < ACL Data TX: Handle 612 [1/3] flags 0x00 dlen 21                                           #124 312.259537
      SMP: Pairing Random (0x04) len 16
        Random value[16]: da64d21ec8845e8286bc235a02440d0c
> HCI Event: Number of Completed Packets (0x13) plen 5                                                            #125 312.283925
        Num handles: 1
        Handle: 612 Address: DF:A9:FF:F6:B1:1A (OUI DF-A9-FF)
        Count: 1
        Buffers: 0/3
        #124: len 21 (7 Kb/s)
        Latency: 24 msec (22-95 msec ~35 msec)
> ACL Data RX: Handle 612 flags 0x02 dlen 21                                                                      #126 312.534613
      SMP: Pairing Random (0x04) len 16
        Random value[16]: dc1f6e9e068bc5a7619c70baacb6dd84
zephyr.exe[3326737]: < HCI Command: Host Number of Completed Packets (0x03|0x0035) plen 5                         #127 312.539570
        Num handles: 1
        Handle: 612 Address: DF:A9:FF:F6:B1:1A (OUI DF-A9-FF)
        Count: 1
zephyr.exe[3326737]: < ACL Data TX: Handle 612 [1/3] flags 0x00 dlen 21                                           #128 312.859541
      SMP: Pairing DHKey Check (0x0d) len 16
        E[16]: cbae2199327c60fff67563df17df5b78
> HCI Event: Number of Completed Packets (0x13) plen 5                                                            #129 312.884326
        Num handles: 1
        Handle: 612 Address: DF:A9:FF:F6:B1:1A (OUI DF-A9-FF)
        Count: 1
        Buffers: 0/3
        #128: len 21 (7 Kb/s)
        Latency: 24 msec (22-95 msec ~30 msec)
> ACL Data RX: Handle 612 flags 0x02 dlen 21                                                                      #130 312.934209
      SMP: Pairing DHKey Check (0x0d) len 16
        E[16]: 3a6afdb282156b0f2576c8e1b01e2654
zephyr.exe[3326737]: < HCI Command: LE Start Encryption (0x08|0x0019) plen 28                                     #131 312.939503
        Handle: 612 Address: DF:A9:FF:F6:B1:1A (OUI DF-A9-FF)
        Random number: 0x0000000000000000
        Encrypted diversifier: 0x0000
        Long term key[16]: f0fa40cd1b47fd5619ee19df21d188d3
> HCI Event: Command Status (0x0f) plen 4                                                                         #132 312.940680
      LE Start Encryption (0x08|0x0019) ncmd 1
        Status: Success (0x00)
zephyr.exe[3326737]: < HCI Command: Host Number of Completed Packets (0x03|0x0035) plen 5                         #133 312.959432
        Num handles: 1
        Handle: 612 Address: DF:A9:FF:F6:B1:1A (OUI DF-A9-FF)
        Count: 1
> HCI Event: Encryption Change (0x08) plen 4                                                                      #134 313.284041
        Status: Success (0x00)
        Handle: 612 Address: DF:A9:FF:F6:B1:1A (OUI DF-A9-FF)
        Encryption: Enabled with AES-CCM (0x01)
zephyr.exe[3326737]: < HCI Command: LE Set Address Resolution Enable (0x08|0x002d) plen 1                         #135 313.299482
        Address resolution: Disabled (0x00)
> HCI Event: Command Complete (0x0e) plen 4                                                                       #136 313.300243
      LE Set Address Resolution Enable (0x08|0x002d) ncmd 1
        Status: Success (0x00)
zephyr.exe[3326737]: < HCI Command: LE Remove Device From Resolving List (0x08|0x0028) plen 7                     #137 313.319490
      