Bluetooth monitor ver 5.72
= Note: Linux version 7.0.0-31-generic (x86_64)                        0.646498
= Note: Bluetooth subsystem version 2.22                               0.646500
= New Index: 00:00:00:00:00:00 (Primary,UART,hci1)              [hci1] 0.646500
= New Index: 48:5F:99:8E:E0:64 (Primary,USB,hci0)               [hci0] 0.646501
= Open Index: 00:00:00:00:00:00                                 [hci1] 0.790175
= Index Info: 00:00:00:00:00:00 (Nordic Semiconductor ASA)      [hci1] 0.790189
@ USER Open: main (privileged) version 2.22            {0x0001} [hci1] 0.790195
< HCI Command: Reset (0x03|0x0003) plen 0                    #1 [hci1] 0.790999
> HCI Event: Command Complete (0x0e) plen 4                  #2 [hci1] 0.791465
      Reset (0x03|0x0003) ncmd 1
        Status: Success (0x00)
< HCI Command: Read Local Supported... (0x04|0x0003) plen 0  #3 [hci1] 0.809824
> HCI Event: Command Complete (0x0e) plen 12                 #4 [hci1] 0.810309
      Read Local Supported Features (0x04|0x0003) ncmd 1
        Status: Success (0x00)
        Features: 0x00 0x00 0x00 0x00 0x60 0x00 0x00 0x00
          BR/EDR Not Supported
          LE Supported (Controller)
< HCI Command: Read Local Version In.. (0x04|0x0001) plen 0  #5 [hci1] 0.829840
> HCI Event: Command Complete (0x0e) plen 12                 #6 [hci1] 0.830346
      Read Local Version Information (0x04|0x0001) ncmd 1
        Status: Success (0x00)
        HCI version: Reserved (0x11) - Revision 12345 (0x3039)
        LMP version: Reserved (0x11) - Subversion 12345 (0x3039)
        Manufacturer: Nordic Semiconductor ASA (89)
< HCI Command: Read Local Supported... (0x04|0x0002) plen 0  #7 [hci1] 0.849792
> HCI Event: Command Complete (0x0e) plen 68                 #8 [hci1] 0.850797
      Read Local Supported Commands (0x04|0x0002) ncmd 1
        Status: Success (0x00)
        Commands: 115 entries
          Disconnect (Octet 0 - Bit 5)
          Read Remote Version Information (Octet 2 - Bit 7)
          Set Event Mask (Octet 5 - Bit 6)
          Reset (Octet 5 - Bit 7)
          Read Connection Accept Timeout (Octet 7 - Bit 2)
          Write Connection Accept Timeout (Octet 7 - Bit 3)
          Read Transmit Power Level (Octet 10 - Bit 2)
          Set Controller To Host Flow Control (Octet 10 - Bit 5)
          Host Buffer Size (Octet 10 - Bit 6)
          Host Number of Completed Packets (Octet 10 - Bit 7)
          Read Local Version Information (Octet 14 - Bit 3)
          Read Local Supported Features (Octet 14 - Bit 5)
          Read BD ADDR (Octet 15 - Bit 1)
          Read RSSI (Octet 15 - Bit 5)
          Set Event Mask Page 2 (Octet 22 - Bit 2)
          LE Set Event Mask (Octet 25 - Bit 0)
          LE Read Buffer Size (Octet 25 - Bit 1)
          LE Read Local Supported Features (Octet 25 - Bit 2)
          LE Set Random Address (Octet 25 - Bit 4)
          LE Set Advertising Parameters (Octet 25 - Bit 5)
          LE Read Advertising Channel TX Power (Octet 25 - Bit 6)
          LE Set Advertising Data (Octet 25 - Bit 7)
          LE Set Scan Response Data (Octet 26 - Bit 0)
          LE Set Advertise Enable (Octet 26 - Bit 1)
          LE Set Scan Parameters (Octet 26 - Bit 2)
          LE Set Scan Enable (Octet 26 - Bit 3)
          LE Create Connection (Octet 26 - Bit 4)
          LE Create Connection Cancel (Octet 26 - Bit 5)
          LE Read Accept List Size (Octet 26 - Bit 6)
          LE Clear Accept List (Octet 26 - Bit 7)
          LE Add Device To Accept List (Octet 27 - Bit 0)
          LE Remove Device From Accept List (Octet 27 - Bit 1)
          LE Connection Update (Octet 27 - Bit 2)
          LE Set Host Channel Classification (Octet 27 - Bit 3)
          LE Read Channel Map (Octet 27 - Bit 4)
          LE Read Remote Used Features (Octet 27 - Bit 5)
          LE Encrypt (Octet 27 - Bit 6)
          LE Rand (Octet 27 - Bit 7)
          LE Start Encryption (Octet 28 - Bit 0)
          LE Long Term Key Request Reply (Octet 28 - Bit 1)
          LE Long Term Key Request Neg Reply (Octet 28 - Bit 2)
          LE Read Supported States (Octet 28 - Bit 3)
          Read Authenticated Payload Timeout (Octet 32 - Bit 4)
          Write Authenticated Payload Timeout (Octet 32 - Bit 5)
          LE Set Data Length (Octet 33 - Bit 6)
          LE Read Suggested Default Data Length (Octet 33 - Bit 7)
          LE Write Suggested Default Data Length (Octet 34 - Bit 0)
          LE Add Device To Resolving List (Octet 34 - Bit 3)
          LE Remove Device From Resolving List (Octet 34 - Bit 4)
          LE Clear Resolving List (Octet 34 - Bit 5)
          LE Read Resolving List Size (Octet 34 - Bit 6)
          LE Set Address Resolution Enable (Octet 35 - Bit 1)
          LE Set Resolvable Private Address Timeout (Octet 35 - Bit 2)
          LE Read Maximum Data Length (Octet 35 - Bit 3)
          LE Read PHY (Octet 35 - Bit 4)
          LE Set Default PHY (Octet 35 - Bit 5)
          LE Set PHY (Octet 35 - Bit 6)
          LE Set Advertising Set Random Address (Octet 36 - Bit 1)
          LE Set Extended Advertising Parameters (Octet 36 - Bit 2)
          LE Set Extended Advertising Data (Octet 36 - Bit 3)
          LE Set Extended Scan Response Data (Octet 36 - Bit 4)
          LE Set Extended Advertising Enable (Octet 36 - Bit 5)
          LE Read Maximum Advertising Data Length (Octet 36 - Bit 6)
          LE Read Number of Supported Advertising Sets (Octet 36 - Bit 7)
          LE Remove Advertising Set (Octet 37 - Bit 0)
          LE Clear Advertising Sets (Octet 37 - Bit 1)
          LE Set Periodic Advertising Parameters (Octet 37 - Bit 2)
          LE Set Periodic Advertising Data (Octet 37 - Bit 3)
          LE Set Periodic Advertising Enable (Octet 37 - Bit 4)
          LE Set Extended Scan Parameters (Octet 37 - Bit 5)
          LE Set Extended Scan Enable (Octet 37 - Bit 6)
          LE Extended Create Connection (Octet 37 - Bit 7)
          LE Periodic Advertising Create Sync (Octet 38 - Bit 0)
          LE Periodic Advertising Create Sync Cancel (Octet 38 - Bit 1)
          LE Periodic Advertising Terminate Sync (Octet 38 - Bit 2)
          LE Add Device To Periodic Advertiser List (Octet 38 - Bit 3)
          LE Remove Device From Periodic Advertiser List (Octet 38 - Bit 4)
          LE Clear Periodic Advertiser List (Octet 38 - Bit 5)
          LE Read Periodic Advertiser List Size (Octet 38 - Bit 6)
          LE Read Transmit Power (Octet 38 - Bit 7)
          LE Read RF Path Compensation (Octet 39 - Bit 0)
          LE Write RF Path Compensation (Octet 39 - Bit 1)
          LE Set Privacy Mode (Octet 39 - Bit 2)
          LE Periodic Advertising Receive Enable (Octet 40 - Bit 5)
          LE Periodic Advertising Sync Transfer (Octet 40 - Bit 6)
          LE Periodic Advertising Set Info Transfer (Octet 40 - Bit 7)
          LE Periodic Advertising Sync Transfer Parameters (Octet 41 - Bit 0)
          LE Set Default Periodic Advertisng Sync Transfer Parameters (Octet 41 - Bit 1)
          LE Read Buffer v2 (Octet 41 - Bit 5)
          LE Read ISO TX Sync (Octet 41 - Bit 6)
          LE Set Connected Isochronous Group Parameters (Octet 41 - Bit 7)
          LE Set Connected Isochronous Group Parameters Test (Octet 42 - Bit 0)
          LE Create Connected Isochronous Stream (Octet 42 - Bit 1)
          LE Remove Connected Isochronous Group (Octet 42 - Bit 2)
          LE Accept Connected Isochronous Stream Request (Octet 42 - Bit 3)
          LE Reject Connected Isochronous Stream Request (Octet 42 - Bit 4)
          LE Create Broadcast Isochronous Group (Octet 42 - Bit 5)
          LE Create Broadcast Isochronous Group Test (Octet 42 - Bit 6)
          LE Terminate Broadcast Isochronous Group (Octet 42 - Bit 7)
          LE Broadcast Isochronous Group Create Sync (Octet 43 - Bit 0)
          LE Broadcast Isochronous Group Terminate Sync (Octet 43 - Bit 1)
          LE Request Peer SCA (Octet 43 - Bit 2)
          LE Setup Isochronous Data Path (Octet 43 - Bit 3)
          LE Remove Isochronous Data Path (Octet 43 - Bit 4)
          LE Isochronous Transmit Test (Octet 43 - Bit 5)
          LE Isochronous Receive Test (Octet 43 - Bit 6)
          LE Isochronous Read Test Counters (Octet 43 - Bit 7)
          LE Isochronous Read Test Counters (Octet 44 - Bit 0)
          LE Set Host Feature (Octet 44 - Bit 1)
          Octet 44 - Bit 2 
          Octet 45 - Bit 6 
          Octet 46 - Bit 0 
          Octet 46 - Bit 1 
          Octet 46 - Bit 2 
          Octet 47 - Bit 4 
< HCI Command: Host Buffer Size (0x03|0x0033) plen 7         #9 [hci1] 0.869777
        ACL MTU: 255  ACL max packet: 16
        SCO MTU: 0    SCO max packet: 0
> HCI Event: Command Complete (0x0e) plen 4                 #10 [hci1] 0.870257
      Host Buffer Size (0x03|0x0033) ncmd 1
        Status: Success (0x00)
< HCI Command: Set Controller To Ho.. (0x03|0x0031) plen 1  #11 [hci1] 0.889782
        Flow control: ACL Data Packets (0x01)
> HCI Event: Command Complete (0x0e) plen 4                 #12 [hci1] 0.890208
      Set Controller To Host Flow Control (0x03|0x0031) ncmd 1
        Status: Success (0x00)
< HCI Command: LE Read Local Suppor.. (0x08|0x0003) plen 0  #13 [hci1] 0.909766
> HCI Event: Command Complete (0x0e) plen 12                #14 [hci1] 0.910260
      LE Read Local Supported Features (0x08|0x0003) ncmd 1
        Status: Success (0x00)
        Features: 0xfd 0x79 0x00 0xf7 0x30 0x01 0x00 0x00
          LE Encryption
          Extended Reject Indication
          Peripheral-initiated Features Exchange
          LE Ping
          LE Data Packet Length Extension
          LL Privacy
          Extended Scanner Filter Policies
          LE 2M PHY
          LE Coded PHY
          LE Extended Advertising
          LE Periodic Advertising
          Channel Selection Algorithm #2
          Periodic Advertising Sync Transfer - Sender
          Periodic Advertising Sync Transfer - Recipient
          Sleep Clock Accuracy Updates
          Connected Isochronous Stream - Central
          Connected Isochronous Stream - Peripheral
          Isochronous Broadcaster
          Synchronized Receiver
          Periodic Advertising ADI support
          Connection Subrating
          Unknown features (0x0000010000000000)
< HCI Command: LE Set Host Feature (0x08|0x0074) plen 2     #15 [hci1] 0.929768
        Bit Number: 32
          Connected Isochronous Stream (Host Support)
        Bit Value: 1
> HCI Event: Command Complete (0x0e) plen 4                 #16 [hci1] 0.930195
      LE Set Host Feature (0x08|0x0074) ncmd 1
        Status: Success (0x00)
< HCI Command: LE Read Buffer v2 (0x08|0x0060) plen 0       #17 [hci1] 0.949764
> HCI Event: Command Complete (0x0e) plen 10                #18 [hci1] 0.950272
      LE Read Buffer v2 (0x08|0x0060) ncmd 1
        Status: Success (0x00)
        ACL MTU: 27
        ACL max packet: 3
        ISO MTU: 318
        ISO max packet: 3
< HCI Command: LE Read Maximum Adve.. (0x08|0x003a) plen 0  #19 [hci1] 0.969797
> HCI Event: Command Complete (0x0e) plen 6                 #20 [hci1] 0.970228
      LE Read Maximum Advertising Data Length (0x08|0x003a) ncmd 1
        Status: Success (0x00)
        Max length: 1650
< HCI Command: LE Read Supported St.. (0x08|0x001c) plen 0  #21 [hci1] 0.989713
> HCI Event: Command Complete (0x0e) plen 12                #22 [hci1] 0.990202
      LE Read Supported States (0x08|0x001c) ncmd 1
        Status: Success (0x00)
        States: 0x000003ff3e0306ff
          Non-connectable Advertising State
          Scannable Advertising State
          Connectable Advertising State
          High Duty Cycle Directed Advertising State
          Passive Scanning State
          Active Scanning State
          Initiating State
            and Connection State (Central Role)
          Connection State (Peripheral Role)
          Scannable Advertising State
            and Passive Scanning State
          Connectable Advertising State
            and Passive Scanning State
          Non-connectable Advertising State
            and Initiating State
          Scannable Advertising State
            and Initiating State
          Active Scanning State
            and Connection State (Central Role)
          Passive Scanning State
            and Connection State (Peripheral Role)
          Active Scanning State
            and Connection State (Peripheral Role)
          Initiating State
            and Connection State (Central Role)
            and Central Role & Central Role
          Low Duty Cycle Directed Advertising State
          Connectable Advertising State
            and Initiating State
            and Central Role & Peripheral Role
          High Duty Cycle Directed Advertising State
            and Initiating State
            and Central Role & Peripheral Role
          Low Duty Cycle Directed Advertising State
            and Initiating State
            and Central Role & Peripheral Role
          Connectable Advertising State
            and Connection State (Central Role)
            and Central Role & Peripheral Role
          High Duty Cycle Directed Advertising State
            and Connection State (Central Role)
            and Central Role & Peripheral Role
          Low Duty Cycle Directed Advertising State
            and Connection State (Central Role)
            and Central Role & Peripheral Role
          Connectable Advertising State
            and Connection State (Peripheral Role)
            and Central Role & Peripheral Role
          High Duty Cycle Directed Advertising State
            and Connection State (Peripheral Role)
            and Peripheral Role & Peripheral Role
          Low Duty Cycle Directed Advertising State
            and Connection State (Peripheral Role)
            and Peripheral Role & Peripheral Role
          Initiating State
            and Connection State (Peripheral Role)
            and Central Role & Peripheral Role
< HCI Command: LE Read Maximum Data.. (0x08|0x002f) plen 0  #23 [hci1] 1.009778
> HCI Event: Command Complete (0x0e) plen 12                #24 [hci1] 1.010315
      LE Read Maximum Data Length (0x08|0x002f) ncmd 1
        Status: Success (0x00)
        Max TX octets: 251
        Max TX time: 2704
        Max RX octets: 251
        Max RX time: 2704
< HCI Command: LE Write Suggested D.. (0x08|0x0024) plen 4  #25 [hci1] 1.029766
        TX octets: 251
        TX time: 2704
> HCI Event: Command Complete (0x0e) plen 4                 #26 [hci1] 1.030202
      LE Write Suggested Default Data Length (0x08|0x0024) ncmd 1
        Status: Success (0x00)
< HCI Command: LE Read Resolving Li.. (0x08|0x002a) plen 0  #27 [hci1] 1.049773
> HCI Event: Command Complete (0x0e) plen 5                 #28 [hci1] 1.050218
      LE Read Resolving List Size (0x08|0x002a) ncmd 1
        Status: Success (0x00)
        Size: 8
< HCI Command: LE Set Host Feature (0x08|0x0074) plen 2     #29 [hci1] 1.069780
        Bit Number: 38
          Connection Subrating (Host Support)
        Bit Value: 1
> HCI Event: Command Complete (0x0e) plen 4                 #30 [hci1] 1.070281
      LE Set Host Feature (0x08|0x0074) ncmd 1
        Status: Success (0x00)
< HCI Command: LE Set Event Mask (0x08|0x0001) plen 8       #31 [hci1] 1.089770
        Mask: 0x000002063f87fa5e
          LE Advertising Report
          LE Connection Update Complete
          LE Read Remote Used Features Complete
          LE Long Term Key Request
          LE Data Length Change
          LE Enhanced Connection Complete
          LE PHY Update Complete
          LE Extended Advertising Report
          LE Periodic Advertising Sync Established
          LE Periodic Advertising Report
          LE Periodic Advertising Sync Lost
          LE Extended Scan Timeout
          LE Extended Advertising Set Terminated
          LE Scan Request Received
          LE Periodic Advertising Sync Transfer Rvc
          LE CIS Established
          LE CIS Request
          LE Create BIG Complete
          LE Terminate BIG Complete
          LE BIG Sync Estabilished Complete
          LE BIG Sync Lost
          LE BIG Info Advertising Report
          LE Subrate Change
          Unknown mask (0x0000020000000000)
> HCI Event: Command Complete (0x0e) plen 4                 #32 [hci1] 1.090281
      LE Set Event Mask (0x08|0x0001) ncmd 1
        Status: Success (0x00)
< HCI Command: Set Event Mask (0x03|0x0001) plen 8          #33 [hci1] 1.109775
        Mask: 0x2000800002008890
          Disconnection Complete
          Encryption Change
          Read Remote Version Information Complete
          Hardware Error
          Data Buffer Overflow
          Encryption Key Refresh Complete
          LE Meta
> HCI Event: Command Complete (0x0e) plen 4                 #34 [hci1] 1.110316
      Set Event Mask (0x03|0x0001) ncmd 1
        Status: Success (0x00)
< HCI Command: Read BD ADDR (0x04|0x0009) plen 0            #35 [hci1] 1.129786
> HCI Event: Command Complete (0x0e) plen 10                #36 [hci1] 1.130195
      Read BD ADDR (0x04|0x0009) ncmd 1
        Status: Success (0x00)
        Address: 00:00:00:00:00:00 (OUI 00-00-00)
< HCI Command: LE Set Random Address (0x08|0x0005) plen 6   #37 [hci1] 1.149782
        Address: D5:B6:CC:31:DB:3B (Static)
> HCI Event: Command Complete (0x0e) plen 4                 #38 [hci1] 1.150325
      LE Set Random Address (0x08|0x0005) ncmd 1
        Status: Success (0x00)
< HCI Command: LE Extended Create... (0x08|0x0043) plen 26  #39 [hci1] 3.509999
        Filter policy: Accept list is not used (0x00)
        Own address type: Random (0x01)
        Peer address type: Public (0x00)
        Peer address: DF:A9:FF:F6:B1:1A (OUI DF-A9-FF)
        Initiating PHYs: 0x01
        Entry 0: LE 1M
          Scan interval: 60.000 msec (0x0060)
          Scan window: 60.000 msec (0x0060)
          Min connection interval: 50.00 msec (0x0028)
          Max connection interval: 70.00 msec (0x0038)
          Connection latency: 0 (0x0000)
          Supervision timeout: 4000 msec (0x0190)
          Min connection length: 0.000 msec (0x0000)
          Max connection length: 0.000 msec (0x0000)
> HCI Event: Command Status (0x0f) plen 4                   #40 [hci1] 3.510895
      LE Extended Create Connection (0x08|0x0043) ncmd 1
        Status: Success (0x00)
> HCI Event: LE Meta Event (0x3e) plen 31                   #41 [hci1] 3.588893
      LE Enhanced Connection Complete (0x0a)
        Status: Success (0x00)
        Handle: 108
        Role: Central (0x00)
        Peer address type: Public (0x00)
        Peer address: DF:A9:FF:F6:B1:1A (OUI DF-A9-FF)
        Local resolvable private address: 00:00:00:00:00:00 (Non-Resolvable)
        Peer resolvable private address: 00:00:00:00:00:00 (Non-Resolvable)
        Connection interval: 70.00 msec (0x0038)
        Connection latency: 0 (0x0000)
        Supervision timeout: 4000 msec (0x0190)
        Central clock accuracy: 0x00
< HCI Command: LE Read Remote Used... (0x08|0x0016) plen 2  #42 [hci1] 3.589928
        Handle: 108 Address: DF:A9:FF:F6:B1:1A (OUI DF-A9-FF)
< ACL Data TX: Handle 108 flags 0x00 dlen 7                 #43 [hci1] 3.589934
      ATT: Exchange MTU Request (0x02) len 2
        Client RX MTU: 251
> HCI Event: Command Status (0x0f) plen 4                   #44 [hci1] 3.590430
      LE Read Remote Used Features (0x08|0x0016) ncmd 1
        Status: Success (0x00)
< HCI Command: LE Set PHY (0x08|0x0032) plen 7              #45 [hci1] 3.609841
        Handle: 108 Address: DF:A9:FF:F6:B1:1A (OUI DF-A9-FF)
        All PHYs preference: 0x00
        TX PHYs preference: 0x02
          LE 2M
        RX PHYs preference: 0x02
          LE 2M
        PHY options preference: Reserved (0x0000)
> HCI Event: Command Status (0x0f) plen 4                   #46 [hci1] 3.610363
      LE Set PHY (0x08|0x0032) ncmd 1
        Status: Success (0x00)
> HCI Event: Number of Completed Packets (0x13) plen 5      #47 [hci1] 3.731270
        Num handles: 1
        Handle: 108 Address: DF:A9:FF:F6:B1:1A (OUI DF-A9-FF)
        Count: 1
        #43: len 7 (0 Kb/s)
        Latency: 141 msec (141-141 msec ~141 msec)
> HCI Event: LE Meta Event (0x3e) plen 12                   #48 [hci1] 3.731420
      LE Read Remote Used Features (0x04)
        Status: Success (0x00)
        Handle: 108 Address: DF:A9:FF:F6:B1:1A (OUI DF-A9-FF)
        Features: 0x2d 0x49 0x00 0xf7 0x67 0xd9 0x00 0x80
          LE Encryption
          Extended Reject Indication
          Peripheral-initiated Features Exchange
          LE Data Packet Length Extension
          LE 2M PHY
          LE Coded PHY
          Channel Selection Algorithm #2
          Periodic Advertising Sync Transfer - Sender
          Periodic Advertising Sync Transfer - Recipient
          Sleep Clock Accuracy Updates
          Connected Isochronous Stream - Central
          Connected Isochronous Stream - Peripheral
          Isochronous Broadcaster
          Synchronized Receiver
          Connected Isochronous Stream (Host Support)
          LE Power Control Request
          LE Power Control Request
          Connection Subrating
          Connection Subrating (Host Support)
          Unknown features (0x8000d90000000000)
> HCI Event: LE Meta Event (0x3e) plen 6                    #49 [hci1] 4.360598
      LE PHY Update Complete (0x0c)
        Status: Success (0x00)
        Handle: 108 Address: DF:A9:FF:F6:B1:1A (OUI DF-A9-FF)
        TX PHY: LE 2M (0x02)
        RX PHY: LE 2M (0x02)
> ACL Data RX: Handle 108 flags 0x02 dlen 6                 #50 [hci1] 4.641020
      SMP: Security Request (0x0b) len 1
        Authentication requirement: Bonding, No MITM, SC, No Keypresses (0x09)
> ACL Data RX: Handle 108 flags 0x02 dlen 7                 #51 [hci1] 4.641453
      ATT: Exchange MTU Response (0x03) len 2
        Server RX MTU: 23
< HCI Command: Host Number of Compl.. (0x03|0x0035) plen 5  #52 [hci1] 4.649980
        Num handles: 1
        Handle: 108 Address: DF:A9:FF:F6:B1:1A (OUI DF-A9-FF)
        Count: 1
< ACL Data TX: Handle 108 flags 0x00 dlen 11                #53 [hci1] 4.650028
      SMP: Pairing Request (0x01) len 6
        IO capability: DisplayOnly (0x00)
        OOB data: Authentication data not present (0x00)
        Authentication requirement: Bonding, No MITM, SC, No Keypresses (0x09)
        Max encryption key size: 16
        Initiator key distribution: EncKey (0x01)
        Responder key distribution: EncKey IdKey (0x03)
< HCI Command: Host Number of Compl.. (0x03|0x0035) plen 5  #54 [hci1] 4.650251
        Num handles: 1
        Handle: 108 Address: DF:A9:FF:F6:B1:1A (OUI DF-A9-FF)
        Count: 1
> HCI Event: Number of Completed Packets (0x13) plen 5      #55 [hci1] 4.711109
        Num handles: 1
        Handle: 108 Address: DF:A9:FF:F6:B1:1A (OUI DF-A9-FF)
        Count: 1
        #53: len 11 (1 Kb/s)
        Latency: 61 msec (61-141 msec ~101 msec)
> ACL Data RX: Handle 108 flags 0x02 dlen 11                #56 [hci1] 4.781080
      SMP: Pairing Response (0x02) len 6
        IO capability: KeyboardDisplay (0x04)
        OOB data: Authentication data not present (0x00)
        Authentication requirement: Bonding, No MITM, SC, No Keypresses (0x09)
        Max encryption key size: 16
        Initiator key distribution: EncKey (0x01)
        Responder key distribution: EncKey IdKey (0x03)
< HCI Command: Host Number of Compl.. (0x03|0x0035) plen 5  #57 [hci1] 4.789966
        Num handles: 1
        Handle: 108 Address: DF:A9:FF:F6:B1:1A (OUI DF-A9-FF)
        Count: 1
< ACL Data TX: Handle 108 flags 0x00 dlen 27                #58 [hci1] 4.790019
< ACL Data TX: Handle 108 flags 0x01 dlen 27                #59 [hci1] 4.790030
< ACL Data TX: Handle 108 flags 0x01 dlen 15                #60 [hci1] 4.790032
      SMP: Pairing Public Key (0x0c) len 64
        X: 98308440221e2d910f0e54b71e7ec652857aa9b5a0dc65028824cc19db1226e9
        Y: 67a4816bcb62efb21701e31fdb27561a6217575fb007a8bbdabe7e28b6f68482
> HCI Event: Number of Completed Packets (0x13) plen 5      #61 [hci1] 4.851028
        Num handles: 1
        Handle: 108 Address: DF:A9:FF:F6:B1:1A (OUI DF-A9-FF)
        Count: 1
        #58: len 27 (3 Kb/s)
        Latency: 61 msec (61-141 msec ~81 msec)
> HCI Event: Number of Completed Packets (0x13) plen 5      #62 [hci1] 4.851603
        Num handles: 1
        Handle: 108 Address: DF:A9:FF:F6:B1:1A (OUI DF-A9-FF)
        Count: 1
        #59: len 27 (3 Kb/s)
        Latency: 61 msec (61-141 msec ~71 msec)
> HCI Event: Number of Completed Packets (0x13) plen 5      #63 [hci1] 4.852003
        Num handles: 1
        Handle: 108 Address: DF:A9:FF:F6:B1:1A (OUI DF-A9-FF)
        Count: 1
        #60: len 15 (1 Kb/s)
        Latency: 61 msec (61-141 msec ~66 msec)
> ACL Data RX: Handle 108 flags 0x02 dlen 27                #64 [hci1] 4.921276
> ACL Data RX: Handle 108 flags 0x01 dlen 27                #65 [hci1] 4.921718
> ACL Data RX: Handle 108 flags 0x01 dlen 15                #66 [hci1] 4.922090
      SMP: Pairing Public Key (0x0c) len 64
        X: 936a2454113a4976ffa3e41b161ff82a11cf66267dd75bc1719e2e66ce106dda
        Y: 20cefb8c2432b348cd62068a0c4c8d2ecb0cca367f6f9900bd4fa714c088659c
> ACL Data RX: Handle 108 flags 0x02 dlen 21                #67 [hci1] 4.922673
      SMP: Pairing Confirm (0x03) len 16
        Confim value: da22db89f952db529e71a354a7bd9f67
< HCI Command: Host Number of Compl.. (0x03|0x0035) plen 5  #68 [hci1] 4.929988
        Num handles: 1
        Handle: 108 Address: DF:A9:FF:F6:B1:1A (OUI DF-A9-FF)
        Count: 1
< HCI Command: Host Number of Compl.. (0x03|0x0035) plen 5  #69 [hci1] 4.930017
        Num handles: 1
        Handle: 108 Address: DF:A9:FF:F6:B1:1A (OUI DF-A9-FF)
        Count: 1
< HCI Command: Host Number of Compl.. (0x03|0x0035) plen 5  #70 [hci1] 4.930086
        Num handles: 1
        Handle: 108 Address: DF:A9:FF:F6:B1:1A (OUI DF-A9-FF)
        Count: 1
< HCI Command: Host Number of Compl.. (0x03|0x0035) plen 5  #71 [hci1] 4.930107
        Num handles: 1
        Handle: 108 Address: DF:A9:FF:F6:B1:1A (OUI DF-A9-FF)
        Count: 1
< ACL Data TX: Handle 108 flags 0x00 dlen 21                #72 [hci1] 4.930188
      SMP: Pairing Random (0x04) len 16
        Random value: 8e6108f966a694cbe26df70bb96773e6
> HCI Event: Number of Completed Packets (0x13) plen 5      #73 [hci1] 4.991012
        Num handles: 1
        Handle: 108 Address: DF:A9:FF:F6:B1:1A (OUI DF-A9-FF)
        Count: 1
        #72: len 21 (2 Kb/s)
        Latency: 60 msec (60-141 msec ~63 msec)
> ACL Data RX: Handle 108 flags 0x02 dlen 21                #74 [hci1] 5.061314
      SMP: Pairing Random (0x04) len 16
        Random value: 7335d3986e9265290000000000000000
< HCI Command: Host Number of Compl.. (0x03|0x0035) plen 5  #75 [hci1] 5.070729
        Num handles: 1
        Handle: 108 Address: DF:A9:FF:F6:B1:1A (OUI DF-A9-FF)
        Count: 1
< ACL Data TX: Handle 108 flags 0x00 dlen 21                #76 [hci1] 5.070849
      SMP: Pairing DHKey Check (0x0d) len 16
        E: b3d8b86b3706460e66b93ca0318bda45
> HCI Event: Number of Completed Packets (0x13) plen 5      #77 [hci1] 5.131118
        Num handles: 1
        Handle: 108 Address: DF:A9:FF:F6:B1:1A (OUI DF-A9-FF)
        Count: 1
        #76: len 21 (2 Kb/s)
        Latency: 60 msec (60-141 msec ~62 msec)
> ACL Data RX: Handle 108 flags 0x02 dlen 21                #78 [hci1] 5.341264
      SMP: Pairing DHKey Check (0x0d) len 16
        E: b0dae61872b7eeb63d2a12148ada3fcc
< HCI Command: LE Start Encryption (0x08|0x0019) plen 28    #79 [hci1] 5.350043
        Handle: 108 Address: DF:A9:FF:F6:B1:1A (OUI DF-A9-FF)
        Random number: 0x0000000000000000
        Encrypted diversifier: 0x0000
        Long term key: 4358f554dbd253a8658fe90e5cb565cb
> HCI Event: Command Status (0x0f) plen 4                   #80 [hci1] 5.350864
      LE Start Encryption (0x08|0x0019) ncmd 1
        Status: Success (0x00)
< HCI Command: Host Number of Compl.. (0x03|0x0035) plen 5  #81 [hci1] 5.370079
        Num handles: 1
        Handle: 108 Address: DF:A9:FF:F6:B1:1A (OUI DF-A9-FF)
        Count: 1
> HCI Event: Encryption Change (0x08) plen 4                #82 [hci1] 5.830955
        Status: Success (0x00)
        Handle: 108 Address: DF:A9:FF:F6:B1:1A (OUI DF-A9-FF)
        Encryption: Enabled with AES-CCM (0x01)
> ACL Data RX: Handle 108 flags 0x02 dlen 21                #83 [hci1] 5.901253
      SMP: Identity Information (0x08) len 16
        Identity resolving key: 925be9355ee8a9f93c0c3d7b419afd3b
< HCI Command: Host Number of Compl.. (0x03|0x0035) plen 5  #84 [hci1] 5.909989
        Num handles: 1
        Handle: 108 Address: DF:A9:FF:F6:B1:1A (OUI DF-A9-FF)
        Count: 1
< ACL Data TX: Handle 108 flags 0x00 dlen 13                #85 [hci1] 5.950501
      ATT: Find By Type Value Request (0x06) len 8
        Handle range: 0x0001-0xffff
        Attribute type: Primary Service (0x2800)
          UUID: Generic Media Control (0x1849)
> HCI Event: Number of Completed Packets (0x13) plen 5      #86 [hci1] 5.971054
        Num handles: 1
        Handle: 108 Address: DF:A9:FF:F6:B1:1A (OUI DF-A9-FF)
        Count: 1
        #85: len 13 (5 Kb/s)
        Latency: 20 msec (20-141 msec ~41 msec)
> ACL Data RX: Handle 108 flags 0x02 dlen 12                #87 [hci1] 6.041159
      SMP: Identity Address Information (0x09) len 7
        Address: DF:A9:FF:F6:B1:1A (OUI DF-A9-FF)
< HCI Command: LE Add Device To Re.. (0x08|0x0027) plen 39  #88 [hci1] 6.050004
        Address type: Public (0x00)
        Address: DF:A9:FF:F6:B1:1A (OUI DF-A9-FF)
        Peer identity resolving key: 925be9355ee8a9f93c0c3d7b419afd3b
        Local identity resolving key: 00000000000000000000000000000000
> HCI Event: Command Complete (0x0e) plen 4                 #89 [hci1] 6.050923
      LE Add Device To Resolving List (0x08|0x0027) ncmd 1
        Status: Success (0x00)
< HCI Command: LE Set Privacy Mode (0x08|0x004e) plen 8     #90 [hci1] 6.069880
        Peer Identity address type: Public (0x00)
        Peer Identity address: DF:A9:FF:F6:B1:1A (OUI DF-A9-FF)
        Privacy Mode: Use Device Privacy (0x01)
> HCI Event: Command Complete (0x0e) plen 4                 #91 [hci1] 6.070439
      LE Set Privacy Mode (0x08|0x004e) ncmd 1
        Status: Success (0x00)
< HCI Command: LE Set Address Resol.. (0x08|0x002d) plen 1  #92 [hci1] 6.090922
        Address resolution: Enabled (0x01)
> HCI Event: Command Complete (0x0e) plen 4                 #93 [hci1] 6.092114
      LE Set Address Resolution Enable (0x08|0x002d) ncmd 1
        Status: Success (0x00)
< HCI Command: Host Number of Compl.. (0x03|0x0035) plen 5  #94 [hci1] 6.109778
        Num handles: 1
        Handle: 108 Address: DF:A9:FF:F6:B1:1A (OUI DF-A9-FF)
        Count: 1
> ACL Data RX: Handle 108 flags 0x02 dlen 9                 #95 [hci1] 6.181058
      ATT: Find By Type Value Response (0x07) len 4
        Handle range: 0x0120-0x015e
< HCI Command: Host Number of Compl.. (0x03|0x0035) plen 5  #96 [hci1] 6.190001
        Num handles: 1
        Handle: 108 Address: DF:A9:FF:F6:B1:1A (OUI DF-A9-FF)
        Count: 1
< ACL Data TX: Handle 108 flags 0x00 dlen 11                #97 [hci1] 6.190078
      ATT: Read By Type Request (0x08) len 6
        Handle range: 0x0121-0x015e
        Attribute type: Characteristic (0x2803)
> HCI Event: Number of Completed Packets (0x13) plen 5      #98 [hci1] 6.250971
        Num handles: 1
        Handle: 108 Address: DF:A9:FF:F6:B1:1A (OUI DF-A9-FF)
        Count: 1
        #97: len 11 (1 Kb/s)
        Latency: 60 msec (20-141 msec ~51 msec)
> ACL Data RX: Handle 108 flags 0x02 dlen 27                #99 [hci1] 6.321374
      ATT: Read By Type Response (0x09) len 22
        Attribute data length: 7
        Attribute data list: 3 entries
        Handle: 0x0122
        Value: 122301932b
            Properties: 0x12
              Read (0x02)
              Notify (0x10)
            Value Handle: 0x0123
            Value UUID: Media Player Name (0x2b93)
        Handle: 0x0125
        Value: 022601942b
            Properties: 0x02
              Read (0x02)
            Value Handle: 0x0126
            Value UUID: Media Player Icon Object ID (0x2b94)
        Handle: 0x0127
        Value: 022801952b
            Properties: 0x02
              Read (0x02)
            Value Handle: 0x0128
            Value UUID: Media Player Icon URL (0x2b95)
< HCI Command: Host Number of Comp.. (0x03|0x0035) plen 5  #100 [hci1] 6.329923
        Num handles: 1
        Handle: 108 Address: DF:A9:FF:F6:B1:1A (OUI DF-A9-FF)
        Count: 1
< ACL Data TX: Handle 108 flags 0x00 dlen 11               #101 [hci1] 6.329950
      ATT: Read By Type Request (0x08) len 6
        Handle range: 0x0128-0x015e
        Attribute type: Characteristic (0x2803)
> HCI Event: Number of Completed Packets (0x13) plen 5     #102 [hci1] 6.390963
        Num handles: 1
        Handle: 108 Address: DF:A9:FF:F6:B1:1A (OUI DF-A9-FF)
        Count: 1
        #101: len 11 (1 Kb/s)
        Latency: 61 msec (20-141 msec ~56 msec)
> ACL Data RX: Handle 108 flags 0x02 dlen 27               #103 [hci1] 6.462119
      ATT: Read By Type Response (0x09) len 22
        Attribute data length: 7
        Attribute data list: 3 entries
        Handle: 0x0129
        Value: 102a01962b
            Properties: 0x10
              Notify (0x10)
            Value Handle: 0x012a
            Value UUID: Track Changed (0x2b96)
        Handle: 0x012c
        Value: 122d01972b
            Properties: 0x12
              Read (0x02)
              Notify (0x10)
            Value Handle: 0x012d
            Value UUID: Track Title (0x2b97)
        Handle: 0x012f
        Value: 123001982b
            Properties: 0x12
              Read (0x02)
              Notify (0x10)
            Value Handle: 0x0130
            Value UUID: Track Duration (0x2b98)
< HCI Command: Host Number of Comp.. (0x03|0x0035) plen 5  #104 [hci1] 6.470178
        Num handles: 1
        Handle: 108 Address: DF:A9:FF:F6:B1:1A (OUI DF-A9-FF)
        Count: 1
< ACL Data TX: Handle 108 flags 0x00 dlen 11               #105 [hci1] 6.472109
      ATT: Read By Type Request (0x08) len 6
        Handle range: 0x0130-0x015e
        Attribute type: Characteristic (0x2803)
> HCI Event: Number of Completed Packets (0x13) plen 5     #106 [hci1] 6.531115
        Num handles: 1
        Handle: 108 Address: DF:A9:FF:F6:B1:1A (OUI DF-A9-FF)
        Count: 1
        #105: len 11 (1 Kb/s)
        Latency: 59 msec (20-141 msec ~57 msec)
> ACL Data RX: Handle 108 flags 0x02 dlen 27               #107 [hci1] 6.602082
      ATT: Read By Type Response (0x09) len 22
        Attribute data length: 7
        Attribute data list: 3 entries
        Handle: 0x0132
        Value: 1e3301992b
            Properties: 0x1e
              Read (0x02)
              Write Without Response (0x04)
              Write (0x08)
              Notify (0x10)
            Value Handle: 0x0133
            Value UUID: Track Position (0x2b99)
        Handle: 0x0135
        Value: 1e36019a2b
            Properties: 0x1e
              Read (0x02)
              Write Without Response (0x04)
              Write (0x08)
              Notify (0x10)
            Value Handle: 0x0136
            Value UUID: Playback Speed (0x2b9a)
        Handle: 0x0138
        Value: 1239019b2b
            Properties: 0x12
              Read (0x02)
              Notify (0x10)
            Value Handle: 0x0139
            Value UUID: Seeking Speed (0x2b9b)
< HCI Command: Host Number of Comp.. (0x03|0x0035) plen 5  #108 [hci1] 6.610106
        Num handles: 1
        Handle: 108 Address: DF:A9:FF:F6:B1:1A (OUI DF-A9-FF)
        Count: 1
< ACL Data TX: Handle 108 flags 0x00 dlen 11               #109 [hci1] 6.610118
      ATT: Read By Type Request (0x08) len 6
        Handle range: 0x0139-0x015e
        Attribute type: Characteristic (0x2803)
> HCI Event: Number of Completed Packets (0x13) plen 5     #110 [hci1] 6.671113
        Num handles: 1
        Handle: 108 Address: DF:A9:FF:F6:B1:1A (OUI DF-A9-FF)
        Count: 1
        #109: len 11 (1 Kb/s)
        Latency: 60 msec (20-141 msec ~59 msec)
> ACL Data RX: Handle 108 flags 0x02 dlen 27               #111 [hci1] 6.741294
      ATT: Read By Type Response (0x09) len 22
        Attribute data length: 7
        Attribute data list: 3 entries
        Handle: 0x013b
        Value: 023c019c2b
            Properties: 0x02
              Read (0x02)
            Value Handle: 0x013c
            Value UUID: Current Track Segments Object ID (0x2b9c)
        Handle: 0x013d
        Value: 1e3e019d2b
            Properties: 0x1e
              Read (0x02)
              Write Without Response (0x04)
              Write (0x08)
              Notify (0x10)
            Value Handle: 0x013e
            Value UUID: Current Track Object ID (0x2b9d)
        Handle: 0x0140
        Value: 1e41019e2b
            Properties: 0x1e
              Read (0x02)
              Write Without Response (0x04)
              Write (0x08)
              Notify (0x10)
            Value Handle: 0x0141
            Value UUID: Next Track Object ID (0x2b9e)
< HCI Command: Host Number of Comp.. (0x03|0x0035) plen 5  #112 [hci1] 6.749990
        Num handles: 1
        Handle: 108 Address: DF:A9:FF:F6:B1:1A (OUI DF-A9-FF)
        Count: 1
< ACL Data TX: Handle 108 flags 0x00 dlen 11               #113 [hci1] 6.750026
      ATT: Read By Type Request (0x08) len 6
        Handle range: 0x0141-0x015e
        Attribute type: Characteristic (0x2803)
> HCI Event: Number of Completed Packets (0x13) plen 5     #114 [hci1] 6.810919
        Num handles: 1
        Handle: 108 Address: DF:A9:FF:F6:B1:1A (OUI DF-A9-FF)
        Count: 1
        #113: len 11 (1 Kb/s)
        Latency: 60 msec (20-141 msec ~60 msec)
> ACL Data RX: Handle 108 flags 0x02 dlen 27               #115 [hci1] 6.881245
      ATT: Read By Type Response (0x09) len 22
        Attribute data length: 7
        Attribute data list: 3 entries
        Handle: 0x0143
        Value: 1e4401a02b
            Properties: 0x1e
              Read (0x02)
              Write Without Response (0x04)
              Write (0x08)
              Notify (0x10)
            Value Handle: 0x0144
            Value UUID: Current Group Object ID (0x2ba0)
        Handle: 0x0146
        Value: 1e4701a12b
            Properties: 0x1e
              Read (0x02)
              Write Without Response (0x04)
              Write (0x08)
              Notify (0x10)
            Value Handle: 0x0147
            Value UUID: Playing Order (0x2ba1)
        Handle: 0x0149
        Value: 024a01a22b
            Properties: 0x02
              Read (0x02)
            Value Handle: 0x014a
            Value UUID: Playing Orders Supported (0x2ba2)
< HCI Command: Host Number of Comp.. (0x03|0x0035) plen 5  #116 [hci1] 6.889926
        Num handles: 1
        Handle: 108 Address: DF:A9:FF:F6:B1:1A (OUI DF-A9-FF)
        Count: 1
< ACL Data TX: Handle 108 flags 0x00 dlen 11               #117 [hci1] 6.889954
      ATT: Read By Type Request (0x08) len 6
        Handle range: 0x014a-0x015e
        Attribute type: Characteristic (0x2803)
> HCI Event: Number of Completed Packets (0x13) plen 5     #118 [hci1] 6.950927
        Num handles: 1
        Handle: 108 Address: DF:A9:FF:F6:B1:1A (OUI DF-A9-FF)
        Count: 1
        #117: len 11 (1 Kb/s)
        Latency: 60 msec (20-141 msec ~60 msec)
> ACL Data RX: Handle 108 flags 0x02 dlen 27               #119 [hci1] 7.021320
      ATT: Read By Type Response (0x09) len 22
        Attribute data length: 7
        Attribute data list: 3 entries
        Handle: 0x014b
        Value: 124c01a32b
            Properties: 0x12
              Read (0x02)
              Notify (0x10)
            Value Handle: 0x014c
            Value UUID: Media State (0x2ba3)
        Handle: 0x014e
        Value: 1c4f01a42b
            Properties: 0x1c
              Write Without Response (0x04)
              Write (0x08)
              Notify (0x10)
            Value Handle: 0x014f
            Value UUID: Media Control Point (0x2ba4)
        Handle: 0x0151
        Value: 125201a52b
            Properties: 0x12
              Read (0x02)
              Notify (0x10)
            Value Handle: 0x0152
            Value UUID: Media Control Point Opcodes Supported (0x2ba5)
< HCI Command: Host Number of Comp.. (0x03|0x0035) plen 5  #120 [hci1] 7.029988
        Num handles: 1
        Handle: 108 Address: DF:A9:FF:F6:B1:1A (OUI DF-A9-FF)
        Count: 1
< ACL Data TX: Handle 108 flags 0x00 dlen 11               #121 [hci1] 7.030018
      ATT: Read By Type Request (0x08) len 6
        Handle range: 0x0152-0x015e
        Attribute type: Characteristic (0x2803)
> HCI Event: Number of Completed Packets (0x13) plen 5     #122 [hci1] 7.091015
        Num handles: 1
        Handle: 108 Address: DF:A9:FF:F6:B1:1A (OUI DF-A9-FF)
        Count: 1
        #121: len 11 (1 Kb/s)
        Latency: 60 msec (20-141 msec ~60 msec)
> ACL Data RX: Handle 108 flags 0x02 dlen 27               #123 [hci1] 7.161322
      ATT: Read By Type Response (0x09) len 22
        Attribute data length: 7
        Attribute data list: 3 entries
        Handle: 0x0154
        Value: 125501a62b
            Properties: 0x12
              Read (0x02)
              Notify (0x10)
            Value Handle: 0x0155
            Value UUID: Search Results Object ID (0x2ba6)
        Handle: 0x0157
        Value: 1c5801a72b
            Properties: 0x1c
              Write Without Response (0x04)
              Write (0x08)
              Notify (0x10)
            Value Handle: 0x0158
            Value UUID: Search Control Point (0x2ba7)
        Handle: 0x015a
        Value: 025b01ba2b
            Properties: 0x02
              Read (0x02)
            Value Handle: 0x015b
            Value UUID: Content Control ID (0x2bba)
< HCI Command: Host Number of Comp.. (0x03|0x0035) plen 5  #124 [hci1] 7.170087
        Num handles: 1
        Handle: 108 Address: DF:A9:FF:F6:B1:1A (OUI DF-A9-FF)
        Count: 1
< ACL Data TX: Handle 108 flags 0x00 dlen 11               #125 [hci1] 7.170136
      ATT: Read By Type Request (0x08) len 6
        Handle range: 0x015b-0x015e
        Attribute type: Characteristic (0x2803)
> HCI Event: Number of Completed Packets (0x13) plen 5     #126 [hci1] 7.230980
        Num handles: 1
        Handle: 108 Address: DF:A9:FF:F6:B1:1A (OUI DF-A9-FF)
        Count: 1
        #125: len 11 (1 Kb/s)
        Latency: 60 msec (20-141 msec ~60 msec)
> ACL Data RX: Handle 108 flags 0x02 dlen 13               #127 [hci1] 7.301075
      ATT: Read By Type Response (0x09) len 8
        Attribute data length: 7
        Attribute data list: 1 entry
        Handle: 0x015c
        Value: 125d019f2b
            Properties: 0x12
              Read (0x02)
              Notify (0x10)
            Value Handle: 0x015d
            Value UUID: Parent Group Object ID (0x2b9f)
< HCI Command: Host Number of Comp.. (0x03|0x0035) plen 5  #128 [hci1] 7.310150
        Num handles: 1
        Handle: 108 Address: DF:A9:FF:F6:B1:1A (OUI DF-A9-FF)
        Count: 1
< ACL Data TX: Handle 108 flags 0x00 dlen 11               #129 [hci1] 7.310209
      ATT: Read By Type Request (0x08) len 6
        Handle range: 0x015d-0x015e
        Attribute type: Characteristic (0x2803)
> HCI Event: Number of Completed Packets (0x13) plen 5     #130 [hci1] 7.370955
        Num handles: 1
        Handle: 108 Address: DF:A9:FF:F6:B1:1A (OUI DF-A9-FF)
        Count: 1
        #129: len 11 (1 Kb/s)
        Latency: 60 msec (20-141 msec ~60 msec)
> ACL Data RX: Handle 108 flags 0x02 dlen 9                #131 [hci1] 7.441017
      ATT: Error Response (0x01) len 4
        Read By Type Request (0x08)
        Handle: 0x015d
        Error: Attribute Not Found (0x0a)
< HCI Command: Host Number of Comp.. (0x03|0x0035) plen 5  #132 [hci1] 7.450214
        Num handles: 1
        Handle: 108 Address: DF:A9:FF:F6:B1:1A (OUI DF-A9-FF)
        Count: 1
< ACL Data TX: Handle 108 flags 0x00 dlen 9                #133 [hci1] 7.450279
      ATT: Find Information Request (0x04) len 4
        Handle range: 0x0123-0x015e
> HCI Event: Number of Completed Packets (0x13) plen 5     #134 [hci1] 7.511012
        Num handles: 1
        Handle: 108 Address: DF:A9:FF:F6:B1:1A (OUI DF-A9-FF)
        Count: 1
        #133: len 9 (1 Kb/s)
        Latency: 60 msec (20-141 msec ~60 msec)
> ACL Data RX: Handle 108 flags 0x02 dlen 26               #135 [hci1] 7.581292
      ATT: Find Information Response (0x05) len 21
        Format: UUID-16 (0x01)
        Handle: 0x0123
        UUID: Media Player Name (0x2b93)
        Handle: 0x0124
        UUID: Client Characteristic Configuration (0x2902)
        Handle: 0x0125
        UUID: Characteristic (0x2803)
        Handle: 0x0126
        UUID: Media Player Icon Object ID (0x2b94)
        Handle: 0x0127
        UUID: Characteristic (0x2803)
< HCI Command: Host Number of Comp.. (0x03|0x0035) plen 5  #136 [hci1] 7.590127
        Num handles: 1
        Handle: 108 Address: DF:A9:FF:F6:B1:1A (OUI DF-A9-FF)
        Count: 1
< ACL Data TX: Handle 108 flags 0x00 dlen 9                #137 [hci1] 7.590169
      ATT: Write Request (0x12) len 4
        Handle: 0x0124
          Data: 0100
> HCI Event: Number of Completed Packets (0x13) plen 5     #138 [hci1] 7.650978
        Num handles: 1
        Handle: 108 Address: DF:A9:FF:F6:B1:1A (OUI DF-A9-FF)
        Count: 1
        #137: len 9 (1 Kb/s)
        Latency: 60 msec (20-141 msec ~60 msec)
> ACL Data RX: Handle 108 flags 0x02 dlen 5                #139 [hci1] 7.721002
      ATT: Write Response (0x13) len 0
< HCI Command: Host Number of Comp.. (0x03|0x0035) plen 5  #140 [hci1] 7.730183
        Num handles: 1
        Handle: 108 Address: DF:A9:FF:F6:B1:1A (OUI DF-A9-FF)
        Count: 1
< ACL Data TX: Handle 108 flags 0x00 dlen 9                #141 [hci1] 7.730259
      ATT: Find Information Request (0x04) len 4
        Handle range: 0x012a-0x015e
> HCI Event: Number of Completed Packets (0x13) plen 5     #142 [hci1] 7.791015
        Num handles: 1
        Handle: 108 Address: DF:A9:FF:F6:B1:1A (OUI DF-A9-FF)
        Count: 1
        #141: len 9 (1 Kb/s)
        Latency: 60 msec (20-141 msec ~60 msec)
> ACL Data RX: Handle 108 flags 0x02 dlen 26               #143 [hci1] 7.861362
      ATT: Find Information Response (0x05) len 21
        Format: UUID-16 (0x01)
        Handle: 0x012a
        UUID: Track Changed (0x2b96)
        Handle: 0x012b
        UUID: Client Characteristic Configuration (0x2902)
        Handle: 0x012c
        UUID: Characteristic (0x2803)
        Handle: 0x012d
        UUID: Track Title (0x2b97)
        Handle: 0x012e
        UUID: Client Characteristic Configuration (0x2902)
< HCI Command: Host Number of Comp.. (0x03|0x0035) plen 5  #144 [hci1] 7.869997
        Num handles: 1
        Handle: 108 Address: DF:A9:FF:F6:B1:1A (OUI DF-A9-FF)
        Count: 1
< ACL Data TX: Handle 108 flags 0x00 dlen 9                #145 [hci1] 7.870037
      ATT: Write Request (0x12) len 4
        Handle: 0x012b
          Data: 0100
> HCI Event: Number of Completed Packets (0x13) plen 5     #146 [hci1] 7.931045
        Num handles: 1
        Handle: 108 Address: DF:A9:FF:F6:B1:1A (OUI DF-A9-FF)
        Count: 1
        #145: len 9 (1 Kb/s)
        Latency: 61 msec (20-141 msec ~60 msec)
> ACL Data RX: Handle 108 flags 0x02 dlen 5                #147 [hci1] 8.001042
      ATT: Write Response (0x13) len 0
< HCI Command: Host Number of Comp.. (0x03|0x0035) plen 5  #148 [hci1] 8.010038
        Num handles: 1
        Handle: 108 Address: DF:A9:FF:F6:B1:1A (OUI DF-A9-FF)
        Count: 1
< ACL Data TX: Handle 108 flags 0x00 dlen 9                #149 [hci1] 8.010074
      ATT: Find Information Request (0x04) len 4
        Handle range: 0x0130-0x015e
> HCI Event: Number of Completed Packets (0x13) plen 5     #150 [hci1] 8.070929
        Num handles: 1
        Handle: 108 Address: DF:A9:FF:F6:B1:1A (OUI DF-A9-FF)
        Count: 1
        #149: len 9 (1 Kb/s)
        Latency: 60 msec (20-141 msec ~60 msec)
> ACL Data RX: Handle 108 flags 0x02 dlen 26               #151 [hci1] 8.141306
      ATT: Find Information Response (0x05) len 21
        Format: UUID-16 (0x01)
        Handle: 0x0130
        UUID: Track Duration (0x2b98)
        Handle: 0x0131
        UUID: Client Characteristic Configuration (0x2902)
        Handle: 0x0132
        UUID: Characteristic (0x2803)
        Handle: 0x0133
        UUID: Track Position (0x2b99)
        Handle: 0x0134
        UUID: Client Characteristic Configuration (0x2902)
< HCI Command: Host Number of Comp.. (0x03|0x0035) plen 5  #152 [hci1] 8.150173
        Num handles: 1
        Handle: 108 Address: DF:A9:FF:F6:B1:1A (OUI DF-A9-FF)
        Count: 1
< ACL Data TX: Handle 108 flags 0x00 dlen 9                #153 [hci1] 8.150191
      ATT: Write Request (0x12) len 4
        Handle: 0x0131
          Data: 0100
> HCI Event: Number of Completed Packets (0x13) plen 5     #154 [hci1] 8.210911
        Num handles: 1
        Handle: 108 Address: DF:A9:FF:F6:B1:1A (OUI DF-A9-FF)
        Count: 1
        #153: len 9 (1 Kb/s)
        Latency: 60 msec (20-141 msec ~60 msec)
> ACL Data RX: Handle 108 flags 0x02 dlen 5                #155 [hci1] 8.280966
      ATT: Write Response (0x13) len 0
< HCI Command: Host Number of Comp.. (0x03|0x0035) plen 5  #156 [hci1] 8.290280
        Num handles: 1
        Handle: 108 Address: DF:A9:FF:F6:B1:1A (OUI DF-A9-FF)
        Count: 1
< ACL Data TX: Handle 108 flags 0x00 dlen 9                #157 [hci1] 8.290363
      ATT: Find Information Request (0x04) len 4
        Handle range: 0x0133-0x015e
> HCI Event: Number of Completed Packets (0x13) plen 5     #158 [hci1] 8.351015
        Num handles: 1
        Handle: 108 Address: DF:A9:FF:F6:B1:1A (OUI DF-A9-FF)
        Count: 1
        #157: len 9 (1 Kb/s)
        Latency: 60 msec (20-141 msec ~60 msec)
> ACL Data RX: Handle 108 flags 0x02 dlen 26               #159 [hci1] 8.421277
      ATT: Find Information Response (0x05) len 21
        Format: UUID-16 (0x01)
        Handle: 0x0133
        UUID: Track Position (0x2b99)
        Handle: 0x0134
        UUID: Client Characteristic Configuration (0x2902)
        Handle: 0x0135
        UUID: Characteristic (0x2803)
        Handle: 0x0136
        UUID: Playback Speed (0x2b9a)
        Handle: 0x0137
        UUID: Client Characteristic Configuration (0x2902)
< HCI Command: Host Number of Comp.. (0x03|0x0035) plen 5  #160 [hci1] 8.429959
        Num handles: 1
        Handle: 108 Address: DF:A9:FF:F6:B1:1A (OUI DF-A9-FF)
        Count: 1
< ACL Data TX: Handle 108 flags 0x00 dlen 9                #161 [hci1] 8.429986
      ATT: Write Request (0x12) len 4
        Handle: 0x0134
          Data: 0100
> HCI Event: Number of Completed Packets (0x13) plen 5     #162 [hci1] 8.490971
        Num handles: 1
        Handle: 108 Address: DF:A9:FF:F6:B1:1A (OUI DF-A9-FF)
        Count: 1
        #161: len 9 (1 Kb/s)
        Latency: 60 msec (20-141 msec ~60 msec)
> ACL Data RX: Handle 108 flags 0x02 dlen 5                #163 [hci1] 8.560934
      ATT: Write Response (0x13) len 0
< HCI Command: Host Number of Comp.. (0x03|0x0035) plen 5  #164 [hci1] 8.570050
        Num handles: 1
        Handle: 108 Address: DF:A9:FF:F6:B1:1A (OUI DF-A9-FF)
        Count: 1
< ACL Data TX: Handle 108 flags 0x00 dlen 9                #165 [hci1] 8.570183
      ATT: Find Information Request (0x04) len 4
        Handle range: 0x0136-0x015e
> HCI Event: Number of Completed Packets (0x13) plen 5     #166 [hci1] 8.630957
        Num handles: 1
        Handle: 108 Address: DF:A9:FF:F6:B1:1A (OUI DF-A9-FF)
        Count: 1
        #165: len 9 (1 Kb/s)
        Latency: 60 msec (20-141 msec ~60 msec)
> ACL Data RX: Handle 108 flags 0x02 dlen 26               #167 [hci1] 8.701209
      ATT: Find Information Response (0x05) len 21
        Format: UUID-16 (0x01)
        Handle: 0x0136
        UUID: Playback Speed (0x2b9a)
        Handle: 0x0137
        UUID: Client Characteristic Configuration (0x2902)
        Handle: 0x0138
        UUID: Characteristic (0x2803)
        Handle: 0x0139
        UUID: Seeking Speed (0x2b9b)
        Handle: 0x013a
        UUID: Client Characteristic Configuration (0x2902)
< HCI Command: Host Number of Comp.. (0x03|0x0035) plen 5  #168 [hci1] 8.710057
        Num handles: 1
        Handle: 108 Address: DF:A9:FF:F6:B1:1A (OUI DF-A9-FF)
        Count: 1
< ACL Data TX: Handle 108 flags 0x00 dlen 9                #169 [hci1] 8.710128
      ATT: Write Request (0x12) len 4
        Handle: 0x0137
          Data: 0100
> HCI Event: Number of Completed Packets (0x13) plen 5     #170 [hci1] 8.770973
        Num handles: 1
        Handle: 108 Address: DF:A9:FF:F6:B1:1A (OUI DF-A9-FF)
        Count: 1
        #169: len 9 (1 Kb/s)
        Latency: 60 msec (20-141 msec ~60 msec)
> ACL Data RX: Handle 108 flags 0x02 dlen 5                #171 [hci1] 8.841029
      ATT: Write Response (0x13) len 0
< HCI Command: Host Number of Comp.. (0x03|0x0035) plen 5  #172 [hci1] 8.850209
        Num handles: 1
        Handle: 108 Address: DF:A9:FF:F6:B1:1A (OUI DF-A9-FF)
        Count: 1
< ACL Data TX: Handle 108 flags 0x00 dlen 9                #173 [hci1] 8.850226
      ATT: Find Information Request (0x04) len 4
        Handle range: 0x0139-0x015e
> HCI Event: Number of Completed Packets (0x13) plen 5     #174 [hci1] 8.910950
        Num handles: 1
        Handle: 108 Address: DF:A9:FF:F6:B1:1A (OUI DF-A9-FF)
        Count: 1
        #173: len 9 (1 Kb/s)
        Latency: 60 msec (20-141 msec ~60 msec)
> ACL Data RX: Handle 108 flags 0x02 dlen 26               #175 [hci1] 8.981293
      ATT: Find Information Response (0x05) len 21
        Format: UUID-16 (0x01)
        Handle: 0x0139
        UUID: Seeking Speed (0x2b9b)
        Handle: 0x013a
        UUID: Client Characteristic Configuration (0x2902)
        Handle: 0x013b
        UUID: Characteristic (0x2803)
        Handle: 0x013c
        UUID: Current Track Segments Object ID (0x2b9c)
        Handle: 0x013d
        UUID: Characteristic (0x2803)
< HCI Command: Host Number of Comp.. (0x03|0x0035) plen 5  #176 [hci1] 8.989956
        Num handles: 1
        Handle: 108 Address: DF:A9:FF:F6:B1:1A (OUI DF-A9-FF)
        Count: 1
< ACL Data TX: Handle 108 flags 0x00 dlen 9                #177 [hci1] 8.990011
      ATT: Write Request (0x12) len 4
        Handle: 0x013a
          Data: 0100
> HCI Event: Number of Completed Packets (0x13) plen 5     #178 [hci1] 9.050959
        Num handles: 1
        Handle: 108 Address: DF:A9:FF:F6:B1:1A (OUI DF-A9-FF)
        Count: 1
        #177: len 9 (1 Kb/s)
        Latency: 60 msec (20-141 msec ~60 msec)
> ACL Data RX: Handle 108 flags 0x02 dlen 5                #179 [hci1] 9.120927
      ATT: Write Response (0x13) len 0
< HCI Command: Host Number of Comp.. (0x03|0x0035) plen 5  #180 [hci1] 9.130075
        Num handles: 1
        Handle: 108 Address: DF:A9:FF:F6:B1:1A (OUI DF-A9-FF)
        Count: 1
< ACL Data TX: Handle 108 flags 0x00 dlen 9                #181 [hci1] 9.130174
      ATT: Find Information Request (0x04) len 4
        Handle range: 0x013e-0x015e
> HCI Event: Number of Completed Packets (0x13) plen 5     #182 [hci1] 9.190999
        Num handles: 1
        Handle: 108 Address: DF:A9:FF:F6:B1:1A (OUI DF-A9-FF)
        Count: 1
        #181: len 9 (1 Kb/s)
        Latency: 60 msec (20-141 msec ~60 msec)
> ACL Data RX: Handle 108 flags 0x02 dlen 26               #183 [hci1] 9.261272
      ATT: Find Information Response (0x05) len 21
        Format: UUID-16 (0x01)
        Handle: 0x013e
        UUID: Current Track Object ID (0x2b9d)
        Handle: 0x013f
        UUID: Client Characteristic Configuration (0x2902)
        Handle: 0x0140
        UUID: Characteristic (0x2803)
        Handle: 0x0141
        UUID: Next Track Object ID (0x2b9e)
        Handle: 0x0142
        UUID: Client Characteristic Configuration (0x2902)
< HCI Command: Host Number of Comp.. (0x03|0x0035) plen 5  #184 [hci1] 9.269985
        Num handles: 1
        Handle: 108 Address: DF:A9:FF:F6:B1:1A (OUI DF-A9-FF)
        Count: 1
< ACL Data TX: Handle 108 flags 0x00 dlen 9                #185 [hci1] 9.270037
      ATT: Write Request (0x12) len 4
        Handle: 0x013f
          Data: 0100
> HCI Event: Number of Completed Packets (0x13) plen 5     #186 [hci1] 9.330938
        Num handles: 1
        Handle: 108 Address: DF:A9:FF:F6:B1:1A (OUI DF-A9-FF)
        Count: 1
        #185: len 9 (1 Kb/s)
        Latency: 60 msec (20-141 msec ~60 msec)
> ACL Data RX: Handle 108 flags 0x02 dlen 5                #187 [hci1] 9.400962
      ATT: Write Response (0x13) len 0
< HCI Command: Host Number of Comp.. (0x03|0x0035) plen 5  #188 [hci1] 9.409962
        Num handles: 1
        Handle: 108 Address: DF:A9:FF:F6:B1:1A (OUI DF-A9-FF)
        Count: 1
< ACL Data TX: Handle 108 flags 0x00 dlen 9                #189 [hci1] 9.410011
      ATT: Find Information Request (0x04) len 4
        Handle range: 0x0141-0x015e
> HCI Event: Number of Completed Packets (0x13) plen 5     #190 [hci1] 9.471013
        Num handles: 1
        Handle: 108 Address: DF:A9:FF:F6:B1:1A (OUI DF-A9-FF)
        Count: 1
        #189: len 9 (1 Kb/s)
        Latency: 61 msec (20-141 msec ~60 msec)
> ACL Data RX: Handle 108 flags 0x02 dlen 26               #191 [hci1] 9.541247
      ATT: Find Information Response (0x05) len 21
        Format: UUID-16 (0x01)
        Handle: 0x0141
        UUID: Next Track Object ID (0x2b9e)
        Handle: 0x0142
        UUID: Client Characteristic Configuration (0x2902)
        Handle: 0x0143
        UUID: Characteristic (0x2803)
        Handle: 0x0144
        UUID: Current Group Object ID (0x2ba0)
        Handle: 0x0145
        UUID: Client Characteristic Configuration (0x2902)
< HCI Command: Host Number of Comp.. (0x03|0x0035) plen 5  #192 [hci1] 9.550205
        Num handles: 1
        Handle: 108 Address: DF:A9:FF:F6:B1:1A (OUI DF-A9-FF)
        Count: 1
< ACL Data TX: Handle 108 flags 0x00 dlen 9                #193 [hci1] 9.550299
      ATT: Write Request (0x12) len 4
        Handle: 0x0142
          Data: 0100
> HCI Event: Number of Completed Packets (0x13) plen 5     #194 [hci1] 9.610915
        Num handles: 1
        Handle: 108 Address: DF:A9:FF:F6:B1:1A (OUI DF-A9-FF)
        Count: 1
        #193: len 9 (1 Kb/s)
        Latency: 60 msec (20-141 msec ~60 msec)
> ACL Data RX: Handle 108 flags 0x02 dlen 5                #195 [hci1] 9.680917
      ATT: Write Response (0x13) len 0
< HCI Command: Host Number of Comp.. (0x03|0x0035) plen 5  #196 [hci1] 9.690043
        Num handles: 1
        Handle: 108 Address: DF:A9:FF:F6:B1:1A (OUI DF-A9-FF)
        Count: 1
< ACL Data TX: Handle 108 flags 0x00 dlen 9                #197 [hci1] 9.690114
      ATT: Find Information Request (0x04) len 4
        Handle range: 0x015d-0x015e
> HCI Event: Number of Completed Packets (0x13) plen 5     #198 [hci1] 9.750914
        Num handles: 1
        Handle: 108 Address: DF:A9:FF:F6:B1:1A (OUI DF-A9-FF)
        Count: 1
        #197: len 9 (1 Kb/s)
        Latency: 60 msec (20-141 msec ~60 msec)
> ACL Data RX: Handle 108 flags 0x02 dlen 14               #199 [hci1] 9.821041
      ATT: Find Information Response (0x05) len 9
        Format: UUID-16 (0x01)
        Handle: 0x015d
        UUID: Parent Group Object ID (0x2b9f)
        Handle: 0x015e
        UUID: Client Characteristic Configuration (0x2902)
< HCI Command: Host Number of Comp.. (0x03|0x0035) plen 5  #200 [hci1] 9.830018
        Num handles: 1
        Handle: 108 Address: DF:A9:FF:F6:B1:1A (OUI DF-A9-FF)
        Count: 1
< ACL Data TX: Handle 108 flags 0x00 dlen 9                #201 [hci1] 9.830089
      ATT: Write Request (0x12) len 4
        Handle: 0x015e
          Data: 0100
> HCI Event: Number of Completed Packets (0x13) plen 5     #202 [hci1] 9.890873
        Num handles: 1
        Handle: 108 Address: DF:A9:FF:F6:B1:1A (OUI DF-A9-FF)
        Count: 1
        #201: len 9 (1 Kb/s)
        Latency: 60 msec (20-141 msec ~60 msec)
> ACL Data RX: Handle 108 flags 0x02 dlen 5                #203 [hci1] 9.960954
      ATT: Write Response (0x13) len 0
< HCI Command: Host Number of Comp.. (0x03|0x0035) plen 5  #204 [hci1] 9.970005
        Num handles: 1
        Handle: 108 Address: DF:A9:FF:F6:B1:1A (OUI DF-A9-FF)
        Count: 1
< ACL Data TX: Handle 108 flags 0x00 dlen 9                #205 [hci1] 9.970084
      ATT: Find Information Request (0x04) len 4
        Handle range: 0x0144-0x015e
> HCI Event: Number of Completed Packets (0x13) plen 5    #206 [hci1] 10.030935
        Num handles: 1
        Handle: 108 Address: DF:A9:FF:F6:B1:1A (OUI DF-A9-FF)
        Count: 1
        #205: len 9 (1 Kb/s)
        Latency: 60 msec (20-141 msec ~60 msec)
> ACL Data RX: Handle 108 flags 0x02 dlen 26              #207 [hci1] 10.101236
      ATT: Find Information Response (0x05) len 21
        Format: UUID-16 (0x01)
        Handle: 0x0144
        UUID: Current Group Object ID (0x2ba0)
        Handle: 0x0145
        UUID: Client Characteristic Configuration (0x2902)
        Handle: 0x0146
        UUID: Characteristic (0x2803)
        Handle: 0x0147
        UUID: Playing Order (0x2ba1)
        Handle: 0x0148
        UUID: Client Characteristic Configuration (0x2902)
< HCI Command: Host Number of Com.. (0x03|0x0035) plen 5  #208 [hci1] 10.110077
        Num handles: 1
        Handle: 108 Address: DF:A9:FF:F6:B1:1A (OUI DF-A9-FF)
        Count: 1
< ACL Data TX: Handle 108 flags 0x00 dlen 9               #209 [hci1] 10.110128
      ATT: Write Request (0x12) len 4
        Handle: 0x0145
          Data: 0100
> HCI Event: Number of Completed Packets (0x13) plen 5    #210 [hci1] 10.170975
        Num handles: 1
        Handle: 108 Address: DF:A9:FF:F6:B1:1A (OUI DF-A9-FF)
        Count: 1
        #209: len 9 (1 Kb/s)
        Latency: 60 msec (20-141 msec ~60 msec)
> ACL Data RX: Handle 108 flags 0x02 dlen 5               #211 [hci1] 10.240897
      ATT: Write Response (0x13) len 0
< HCI Command: Host Number of Com.. (0x03|0x0035) plen 5  #212 [hci1] 10.250019
        Num handles: 1
        Handle: 108 Address: DF:A9:FF:F6:B1:1A (OUI DF-A9-FF)
        Count: 1
< ACL Data TX: Handle 108 flags 0x00 dlen 9               #213 [hci1] 10.250070
      ATT: Find Information Request (0x04) len 4
        Handle range: 0x0147-0x015e
> HCI Event: Number of Completed Packets (0x13) plen 5    #214 [hci1] 10.310866
        Num handles: 1
        Handle: 108 Address: DF:A9:FF:F6:B1:1A (OUI DF-A9-FF)
        Count: 1
        #213: len 9 (1 Kb/s)
        Latency: 60 msec (20-141 msec ~60 msec)
> ACL Data RX: Handle 108 flags 0x02 dlen 26              #215 [hci1] 10.381235
      ATT: Find Information Response (0x05) len 21
        Format: UUID-16 (0x01)
        Handle: 0x0147
        UUID: Playing Order (0x2ba1)
        Handle: 0x0148
        UUID: Client Characteristic Configuration (0x2902)
        Handle: 0x0149
        UUID: Characteristic (0x2803)
        Handle: 0x014a
        UUID: Playing Orders Supported (0x2ba2)
        Handle: 0x014b
        UUID: Characteristic (0x2803)
< HCI Command: Host Number of Com.. (0x03|0x0035) plen 5  #216 [hci1] 10.389918
        Num handles: 1
        Handle: 108 Address: DF:A9:FF:F6:B1:1A (OUI DF-A9-FF)
        Count: 1
< ACL Data TX: Handle 108 flags 0x00 dlen 9               #217 [hci1] 10.389985
      ATT: Write Request (0x12) len 4
        Handle: 0x0148
          Data: 0100
> HCI Event: Number of Completed Packets (0x13) plen 5    #218 [hci1] 10.450910
        Num handles: 1
        Handle: 108 Address: DF:A9:FF:F6:B1:1A (OUI DF-A9-FF)
        Count: 1
        #217: len 9 (1 Kb/s)
        Latency: 60 msec (20-141 msec ~60 msec)
> ACL Data RX: Handle 108 flags 0x02 dlen 5               #219 [hci1] 10.520947
      ATT: Write Response (0x13) len 0
< HCI Command: Host Number of Com.. (0x03|0x0035) plen 5  #220 [hci1] 10.530390
        Num handles: 1
        Handle: 108 Address: DF:A9:FF:F6:B1:1A (OUI DF-A9-FF)
        Count: 1
< ACL Data TX: Handle 108 flags 0x00 dlen 9               #221 [hci1] 10.530466
      ATT: Find Information Request (0x04) len 4
        Handle range: 0x014c-0x015e
> HCI Event: Number of Completed Packets (0x13) plen 5    #222 [hci1] 10.590949
        Num handles: 1
        Handle: 108 Address: DF:A9:FF:F6:B1:1A (OUI DF-A9-FF)
        Count: 1
        #221: len 9 (1 Kb/s)
        Latency: 60 msec (20-141 msec ~60 msec)
> ACL Data RX: Handle 108 flags 0x02 dlen 26              #223 [hci1] 10.661226
      ATT: Find Information Response (0x05) len 21
        Format: UUID-16 (0x01)
        Handle: 0x014c
        UUID: Media State (0x2ba3)
        Handle: 0x014d
        UUID: Client Characteristic Configuration (0x2902)
        Handle: 0x014e
        UUID: Characteristic (0x2803)
        Handle: 0x014f
        UUID: Media Control Point (0x2ba4)
        Handle: 0x0150
        UUID: Client Characteristic Configuration (0x2902)
< HCI Command: Host Number of Com.. (0x03|0x0035) plen 5  #224 [hci1] 10.670008
        Num handles: 1
        Handle: 108 Address: DF:A9:FF:F6:B1:1A (OUI DF-A9-FF)
        Count: 1
< ACL Data TX: Handle 108 flags 0x00 dlen 9               #225 [hci1] 10.670059
      ATT: Write Request (0x12) len 4
        Handle: 0x014d
          Data: 0100
> HCI Event: Number of Completed Packets (0x13) plen 5    #226 [hci1] 10.730918
        Num handles: 1
        Handle: 108 Address: DF:A9:FF:F6:B1:1A (OUI DF-A9-FF)
        Count: 1
        #225: len 9 (1 Kb/s)
        Latency: 60 msec (20-141 msec ~60 msec)
> ACL Data RX: Handle 108 flags 0x02 dlen 5               #227 [hci1] 10.800951
      ATT: Write Response (0x13) len 0
< HCI Command: Host Number of Com.. (0x03|0x0035) plen 5  #228 [hci1] 10.810174
        Num handles: 1
        Handle: 108 Address: DF:A9:FF:F6:B1:1A (OUI DF-A9-FF)
        Count: 1
< ACL Data TX: Handle 108 flags 0x00 dlen 9               #229 [hci1] 10.810220
      ATT: Find Information Request (0x04) len 4
        Handle range: 0x014f-0x015e
> HCI Event: Number of Completed Packets (0x13) plen 5    #230 [hci1] 10.870892
        Num handles: 1
        Handle: 108 Address: DF:A9:FF:F6:B1:1A (OUI DF-A9-FF)
        Count: 1
        #229: len 9 (1 Kb/s)
        Latency: 60 msec (20-141 msec ~60 msec)
> ACL Data RX: Handle 108 flags 0x02 dlen 26              #231 [hci1] 10.941184
      ATT: Find Information Response (0x05) len 21
        Format: UUID-16 (0x01)
        Handle: 0x014f
        UUID: Media Control Point (0x2ba4)
        Handle: 0x0150
        UUID: Client Characteristic Configuration (0x2902)
        Handle: 0x0151
        UUID: Characteristic (0x2803)
        Handle: 0x0152
        UUID: Media Control Point Opcodes Supported (0x2ba5)
        Handle: 0x0153
        UUID: Client Characteristic Configuration (0x2902)
< HCI Command: Host Number of Com.. (0x03|0x0035) plen 5  #232 [hci1] 10.950070
        Num handles: 1
        Handle: 108 Address: DF:A9:FF:F6:B1:1A (OUI DF-A9-FF)
        Count: 1
< ACL Data TX: Handle 108 flags 0x00 dlen 9               #233 [hci1] 10.950159
      ATT: Write Request (0x12) len 4
        Handle: 0x0150
          Data: 0100
> HCI Event: Number of Completed Packets (0x13) plen 5    #234 [hci1] 11.010998
        Num handles: 1
        Handle: 108 Address: DF:A9:FF:F6:B1:1A (OUI DF-A9-FF)
        Count: 1
        #233: len 9 (1 Kb/s)
        Latency: 60 msec (20-141 msec ~60 msec)
> ACL Data RX: Handle 108 flags 0x02 dlen 5               #235 [hci1] 11.080965
      ATT: Write Response (0x13) len 0
< HCI Command: Host Number of Com.. (0x03|0x0035) plen 5  #236 [hci1] 11.090093
        Num handles: 1
        Handle: 108 Address: DF:A9:FF:F6:B1:1A (OUI DF-A9-FF)
        Count: 1
< ACL Data TX: Handle 108 flags 0x00 dlen 9               #237 [hci1] 11.090119
      ATT: Find Information Request (0x04) len 4
        Handle range: 0x0152-0x015e
> HCI Event: Number of Completed Packets (0x13) plen 5    #238 [hci1] 11.150941
        Num handles: 1
        Handle: 108 Address: DF:A9:FF:F6:B1:1A (OUI DF-A9-FF)
        Count: 1
        #237: len 9 (1 Kb/s)
        Latency: 60 msec (20-141 msec ~60 msec)
> ACL Data RX: Handle 108 flags 0x02 dlen 26              #239 [hci1] 11.221290
      ATT: Find Information Response (0x05) len 21
        Format: UUID-16 (0x01)
        Handle: 0x0152
        UUID: Media Control Point Opcodes Supported (0x2ba5)
        Handle: 0x0153
        UUID: Client Characteristic Configuration (0x2902)
        Handle: 0x0154
        UUID: Characteristic (0x2803)
        Handle: 0x0155
        UUID: Search Results Object ID (0x2ba6)
        Handle: 0x0156
        UUID: Client Characteristic Configuration (0x2902)
< HCI Command: Host Number of Com.. (0x03|0x0035) plen 5  #240 [hci1] 11.230015
        Num handles: 1
        Handle: 108 Address: DF:A9:FF:F6:B1:1A (OUI DF-A9-FF)
        Count: 1
< ACL Data TX: Handle 108 flags 0x00 dlen 9               #241 [hci1] 11.230070
      ATT: Write Request (0x12) len 4
        Handle: 0x0153
          Data: 0100
> HCI Event: Number of Completed Packets (0x13) plen 5    #242 [hci1] 11.290915
        Num handles: 1
        Handle: 108 Address: DF:A9:FF:F6:B1:1A (OUI DF-A9-FF)
        Count: 1
        #241: len 9 (1 Kb/s)
        Latency: 60 msec (20-141 msec ~60 msec)
> ACL Data RX: Handle 108 flags 0x02 dlen 5               #243 [hci1] 11.360907
      ATT: Write Response (0x13) len 0
< HCI Command: Host Number of Com.. (0x03|0x0035) plen 5  #244 [hci1] 11.370174
        Num handles: 1
        Handle: 108 Address: DF:A9:FF:F6:B1:1A (OUI DF-A9-FF)
        Count: 1
< ACL Data TX: Handle 108 flags 0x00 dlen 9               #245 [hci1] 11.370191
      ATT: Find Information Request (0x04) len 4
        Handle range: 0x0158-0x015e
> HCI Event: Number of Completed Packets (0x13) plen 5    #246 [hci1] 11.430906
        Num handles: 1
        Handle: 108 Address: DF:A9:FF:F6:B1:1A (OUI DF-A9-FF)
        Count: 1
        #245: len 9 (1 Kb/s)
        Latency: 60 msec (20-141 msec ~60 msec)
> ACL Data RX: Handle 108 flags 0x02 dlen 26              #247 [hci1] 11.501179
      ATT: Find Information Response (0x05) len 21
        Format: UUID-16 (0x01)
        Handle: 0x0158
        UUID: Search Control Point (0x2ba7)
        Handle: 0x0159
        UUID: Client Characteristic Configuration (0x2902)
        Handle: 0x015a
        UUID: Characteristic (0x2803)
        Handle: 0x015b
        UUID: Content Control ID (0x2bba)
        Handle: 0x015c
        UUID: Characteristic (0x2803)
< HCI Command: Host Number of Com.. (0x03|0x0035) plen 5  #248 [hci1] 11.510456
        Num handles: 1
        Handle: 108 Address: DF:A9:FF:F6:B1:1A (OUI DF-A9-FF)
        Count: 1
< ACL Data TX: Handle 108 flags 0x00 dlen 9               #249 [hci1] 11.510552
      ATT: Write Request (0x12) len 4
        Handle: 0x0159
          Data: 0100
> HCI Event: Number of Completed Packets (0x13) plen 5    #250 [hci1] 11.570882
        Num handles: 1
        Handle: 108 Address: DF:A9:FF:F6:B1:1A (OUI DF-A9-FF)
        Count: 1
        #249: len 9 (1 Kb/s)
        Latency: 60 msec (20-141 msec ~60 msec)
> ACL Data RX: Handle 108 flags 0x02 dlen 5               #251 [hci1] 11.640910
      ATT: Write Response (0x13) len 0
< HCI Command: Host Number of Com.. (0x03|0x0035) plen 5  #252 [hci1] 11.649943
        Num handles: 1
        Handle: 108 Address: DF:A9:FF:F6:B1:1A (OUI DF-A9-FF)
        Count: 1
< ACL Data TX: Handle 108 flags 0x00 dlen 9               #253 [hci1] 11.649969
      ATT: Find Information Request (0x04) len 4
        Handle range: 0x0155-0x015e
> HCI Event: Number of Completed Packets (0x13) plen 5    #254 [hci1] 11.710878
        Num handles: 1
        Handle: 108 Address: DF:A9:FF:F6:B1:1A (OUI DF-A9-FF)
        Count: 1
        #253: len 9 (1 Kb/s)
        Latency: 60 msec (20-141 msec ~60 msec)
> ACL Data RX: Handle 108 flags 0x02 dlen 26              #255 [hci1] 11.781262
      ATT: Find Information Response (0x05) len 21
        Format: UUID-16 (0x01)
        Handle: 0x0155
        UUID: Search Results Object ID (0x2ba6)
        Handle: 0x0156
        UUID: Client Characteristic Configuration (0x2902)
        Handle: 0x0157
        UUID: Characteristic (0x2803)
        Handle: 0x0158
        UUID: Search Control Point (0x2ba7)
        Handle: 0x0159
        UUID: Client Characteristic Configuration (0x2902)
< HCI Command: Host Number of Com.. (0x03|0x0035) plen 5  #256 [hci1] 11.790073
        Num handles: 1
        Handle: 108 Address: DF:A9:FF:F6:B1:1A (OUI DF-A9-FF)
        Count: 1
< ACL Data TX: Handle 108 flags 0x00 dlen 9               #257 [hci1] 11.790109
      ATT: Write Request (0x12) len 4
        Handle: 0x0156
          Data: 0100
> HCI Event: Number of Completed Packets (0x13) plen 5    #258 [hci1] 11.850954
        Num handles: 1
        Handle: 108 Address: DF:A9:FF:F6:B1:1A (OUI DF-A9-FF)
        Count: 1
        #257: len 9 (1 Kb/s)
        Latency: 60 msec (20-141 msec ~60 msec)
> ACL Data RX: Handle 108 flags 0x02 dlen 5               #259 [hci1] 11.920862
      ATT: Write Response (0x13) len 0
< HCI Command: Host Number of Com.. (0x03|0x0035) plen 5  #260 [hci1] 11.929988
        Num handles: 1
        Handle: 108 Address: DF:A9:FF:F6:B1:1A (OUI DF-A9-FF)
        Count: 1
< ACL Data TX: Handle 108 flags 0x00 dlen 11              #261 [hci1] 11.930059
      ATT: Read By Type Request (0x08) len 6
        Handle range: 0x0121-0x015e
        Attribute type: Include (0x2802)
> HCI Event: Number of Completed Packets (0x13) plen 5    #262 [hci1] 11.991061
        Num handles: 1
        Handle: 108 Address: DF:A9:FF:F6:B1:1A (OUI DF-A9-FF)
        Count: 1
        #261: len 11 (1 Kb/s)
        Latency: 61 msec (20-141 msec ~60 msec)
> ACL Data RX: Handle 108 flags 0x02 dlen 14              #263 [hci1] 12.060990
      ATT: Read By Type Response (0x09) len 9
        Attribute data length: 8
        Attribute data list: 1 entry
        Handle: 0x0121
        Value: 70018f012518
< HCI Command: Host Number of Com.. (0x03|0x0035) plen 5  #264 [hci1] 12.070434
        Num handles: 1
        Handle: 108 Address: DF:A9:FF:F6:B1:1A (OUI DF-A9-FF)
        Count: 1
< ACL Data TX: Handle 108 flags 0x00 dlen 11              #265 [hci1] 12.070503
      ATT: Read By Type Request (0x08) len 6
        Handle range: 0x0170-0x018f
        Attribute type: Characteristic (0x2803)
> HCI Event: Number of Completed Packets (0x13) plen 5    #266 [hci1] 12.130956
        Num handles: 1
        Handle: 108 Address: DF:A9:FF:F6:B1:1A (OUI DF-A9-FF)
        Count: 1
        #265: len 11 (1 Kb/s)
        Latency: 60 msec (20-141 msec ~60 msec)
> ACL Data RX: Handle 108 flags 0x02 dlen 27              #267 [hci1] 12.201187
      ATT: Read By Type Response (0x09) len 22
        Attribute data length: 7
        Attribute data list: 3 entries
        Handle: 0x0171
        Value: 027201bd2a
            Properties: 0x02
              Read (0x02)
            Value Handle: 0x0172
            Value UUID: OTS Feature (0x2abd)
        Handle: 0x0173
        Value: 0a7401be2a
            Properties: 0x0a
              Read (0x02)
              Write (0x08)
            Value Handle: 0x0174
            Value UUID: Object Name (0x2abe)
        Handle: 0x0175
        Value: 027601bf2a
            Properties: 0x02
              Read (0x02)
            Value Handle: 0x0176
            Value UUID: Object Type (0x2abf)
< HCI Command: Host Number of Com.. (0x03|0x0035) plen 5  #268 [hci1] 12.210216
        Num handles: 1
        Handle: 108 Address: DF:A9:FF:F6:B1:1A (OUI DF-A9-FF)
        Count: 1
< ACL Data TX: Handle 108 flags 0x00 dlen 11              #269 [hci1] 12.210278
      ATT: Read By Type Request (0x08) len 6
        Handle range: 0x0176-0x018f
        Attribute type: Characteristic (0x2803)
> HCI Event: Number of Completed Packets (0x13) plen 5    #270 [hci1] 12.270931
        Num handles: 1
        Handle: 108 Address: DF:A9:FF:F6:B1:1A (OUI DF-A9-FF)
        Count: 1
        #269: len 11 (1 Kb/s)
        Latency: 60 msec (20-141 msec ~60 msec)
> ACL Data RX: Handle 108 flags 0x02 dlen 27              #271 [hci1] 12.341211
      ATT: Read By Type Response (0x09) len 22
        Attribute data length: 7
        Attribute data list: 3 entries
        Handle: 0x0177
        Value: 027801c02a
            Properties: 0x02
              Read (0x02)
            Value Handle: 0x0178
            Value UUID: Object Size (0x2ac0)
        Handle: 0x0179
        Value: 0a7a01c12a
            Properties: 0x0a
              Read (0x02)
              Write (0x08)
            Value Handle: 0x017a
            Value UUID: Object First-Created (0x2ac1)
        Handle: 0x017b
        Value: 0a7c01c22a
            Properties: 0x0a
              Read (0x02)
              Write (0x08)
            Value Handle: 0x017c
            Value UUID: Object Last-Modified (0x2ac2)
< HCI Command: Host Number of Com.. (0x03|0x0035) plen 5  #272 [hci1] 12.350444
        Num handles: 1
        Handle: 108 Address: DF:A9:FF:F6:B1:1A (OUI DF-A9-FF)
        Count: 1
< ACL Data TX: Handle 108 flags 0x00 dlen 11              #273 [hci1] 12.350557
      ATT: Read By Type Request (0x08) len 6
        Handle range: 0x017c-0x018f
        Attribute type: Characteristic (0x2803)
> HCI Event: Number of Completed Packets (0x13) plen 5    #274 [hci1] 12.410884
        Num handles: 1
        Handle: 108 Address: DF:A9:FF:F6:B1:1A (OUI DF-A9-FF)
        Count: 1
        #273: len 11 (1 Kb/s)
        Latency: 60 msec (20-141 msec ~60 msec)
> ACL Data RX: Handle 108 flags 0x02 dlen 27              #275 [hci1] 12.481168
      ATT: Read By Type Response (0x09) len 22
        Attribute data length: 7
        Attribute data list: 3 entries
        Handle: 0x017d
        Value: 027e01c32a
            Properties: 0x02
              Read (0x02)
            Value Handle: 0x017e
            Value UUID: Object ID (0x2ac3)
        Handle: 0x017f
        Value: 0a8001c42a
            Properties: 0x0a
              Read (0x02)
              Write (0x08)
            Value Handle: 0x0180
            Value UUID: Object Properties (0x2ac4)
        Handle: 0x0181
        Value: 288201c52a
            Properties: 0x28
              Write (0x08)
              Indicate (0x20)
            Value Handle: 0x0182
            Value UUID: Object Action Control Point (0x2ac5)
< HCI Command: Host Number of Com.. (0x03|0x0035) plen 5  #276 [hci1] 12.490060
        Num handles: 1
        Handle: 108 Address: DF:A9:FF:F6:B1:1A (OUI DF-A9-FF)
        Count: 1
< ACL Data TX: Handle 108 flags 0x00 dlen 9               #277 [hci1] 12.490112
      ATT: Find Information Request (0x04) len 4
        Handle range: 0x0182-0x018f
> HCI Event: Number of Completed Packets (0x13) plen 5    #278 [hci1] 12.550992
        Num handles: 1
        Handle: 108 Address: DF:A9:FF:F6:B1:1A (OUI DF-A9-FF)
        Count: 1
        #277: len 9 (1 Kb/s)
        Latency: 60 msec (20-141 msec ~60 msec)
> ACL Data RX: Handle 108 flags 0x02 dlen 26              #279 [hci1] 12.621102
      ATT: Find Information Response (0x05) len 21
        Format: UUID-16 (0x01)
        Handle: 0x0182
        UUID: Object Action Control Point (0x2ac5)
        Handle: 0x0183
        UUID: Client Characteristic Configuration (0x2902)
        Handle: 0x0184
        UUID: Characteristic (0x2803)
        Handle: 0x0185
        UUID: Object List Control Point (0x2ac6)
        Handle: 0x0186
        UUID: Client Characteristic Configuration (0x2902)
< HCI Command: Host Number of Com.. (0x03|0x0035) plen 5  #280 [hci1] 12.630058
        Num handles: 1
        Handle: 108 Address: DF:A9:FF:F6:B1:1A (OUI DF-A9-FF)
        Count: 1
< ACL Data TX: Handle 108 flags 0x00 dlen 11              #281 [hci1] 12.630174
      ATT: Read By Type Request (0x08) len 6
        Handle range: 0x0182-0x018f
        Attribute type: Characteristic (0x2803)
> HCI Event: Number of Completed Packets (0x13) plen 5    #282 [hci1] 12.690921
        Num handles: 1
        Handle: 108 Address: DF:A9:FF:F6:B1:1A (OUI DF-A9-FF)
        Count: 1
        #281: len 11 (1 Kb/s)
        Latency: 60 msec (20-141 msec ~60 msec)
> ACL Data RX: Handle 108 flags 0x02 dlen 27              #283 [hci1] 12.761227
      ATT: Read By Type Response (0x09) len 22
        Attribute data length: 7
        Attribute data list: 3 entries
        Handle: 0x0184
        Value: 288501c62a
            Properties: 0x28
              Write (0x08)
              Indicate (0x20)
            Value Handle: 0x0185
            Value UUID: Object List Control Point (0x2ac6)
        Handle: 0x0187
        Value: 0a8801c72a
            Properties: 0x0a
              Read (0x02)
              Write (0x08)
            Value Handle: 0x0188
            Value UUID: Object List Filter (0x2ac7)
        Handle: 0x0189
        Value: 208a01c82a
            Properties: 0x20
              Indicate (0x20)
            Value Handle: 0x018a
            Value UUID: Object Changed (0x2ac8)
< HCI Command: Host Number of Com.. (0x03|0x0035) plen 5  #284 [hci1] 12.770067
        Num handles: 1
        Handle: 108 Address: DF:A9:FF:F6:B1:1A (OUI DF-A9-FF)
        Count: 1
< ACL Data TX: Handle 108 flags 0x00 dlen 9               #285 [hci1] 12.770092
      ATT: Write Request (0x12) len 4
        Handle: 0x0183
          Data: 0200
> HCI Event: Number of Completed Packets (0x13) plen 5    #286 [hci1] 12.830863
        Num handles: 1
        Handle: 108 Address: DF:A9:FF:F6:B1:1A (OUI DF-A9-FF)
        Count: 1
        #285: len 9 (1 Kb/s)
        Latency: 60 msec (20-141 msec ~60 msec)
> ACL Data RX: Handle 108 flags 0x02 dlen 5               #287 [hci1] 12.900813
      ATT: Write Response (0x13) len 0
< HCI Command: Host Number of Com.. (0x03|0x0035) plen 5  #288 [hci1] 12.910010
        Num handles: 1
        Handle: 108 Address: DF:A9:FF:F6:B1:1A (OUI DF-A9-FF)
        Count: 1
< ACL Data TX: Handle 108 flags 0x00 dlen 9               #289 [hci1] 12.910056
      ATT: Find Information Request (0x04) len 4
        Handle range: 0x0185-0x018f
> HCI Event: Number of Completed Packets (0x13) plen 5    #290 [hci1] 12.970882
        Num handles: 1
        Handle: 108 Address: DF:A9:FF:F6:B1:1A (OUI DF-A9-FF)
        Count: 1
        #289: len 9 (1 Kb/s)
        Latency: 60 msec (20-141 msec ~60 msec)
> ACL Data RX: Handle 108 flags 0x02 dlen 26              #291 [hci1] 13.041201
      ATT: Find Information Response (0x05) len 21
        Format: UUID-16 (0x01)
        Handle: 0x0185
        UUID: Object List Control Point (0x2ac6)
        Handle: 0x0186
        UUID: Client Characteristic Configuration (0x2902)
        Handle: 0x0187
        UUID: Characteristic (0x2803)
        Handle: 0x0188
        UUID: Object List Filter (0x2ac7)
        Handle: 0x0189
        UUID: Characteristic (0x2803)
< HCI Command: Host Number of Com.. (0x03|0x0035) plen 5  #292 [hci1] 13.050421
        Num handles: 1
        Handle: 108 Address: DF:A9:FF:F6:B1:1A (OUI DF-A9-FF)
        Count: 1
< ACL Data TX: Handle 108 flags 0x00 dlen 11              #293 [hci1] 13.050575
      ATT: Read By Type Request (0x08) len 6
        Handle range: 0x018a-0x018f
        Attribute type: Characteristic (0x2803)
> HCI Event: Number of Completed Packets (0x13) plen 5    #294 [hci1] 13.110847
        Num handles: 1
        Handle: 108 Address: DF:A9:FF:F6:B1:1A (OUI DF-A9-FF)
        Count: 1
        #293: len 11 (1 Kb/s)
        Latency: 60 msec (20-141 msec ~60 msec)
> ACL Data RX: Handle 108 flags 0x02 dlen 20              #295 [hci1] 13.181112
      ATT: Read By Type Response (0x09) len 15
        Attribute data length: 7
        Attribute data list: 2 entries
        Handle: 0x018c
        Value: 0a8d01c72a
            Properties: 0x0a
              Read (0x02)
              Write (0x08)
            Value Handle: 0x018d
            Value UUID: Object List Filter (0x2ac7)
        Handle: 0x018e
        Value: 0a8f01c72a
            Properties: 0x0a
              Read (0x02)
              Write (0x08)
            Value Handle: 0x018f
            Value UUID: Object List Filter (0x2ac7)
< HCI Command: Host Number of Com.. (0x03|0x0035) plen 5  #296 [hci1] 13.190171
        Num handles: 1
        Handle: 108 Address: DF:A9:FF:F6:B1:1A (OUI DF-A9-FF)
        Count: 1
< ACL Data TX: Handle 108 flags 0x00 dlen 9               #297 [hci1] 13.190203
      ATT: Write Request (0x12) len 4
        Handle: 0x0186
          Data: 0200
> HCI Event: Number of Completed Packets (0x13) plen 5    #298 [hci1] 13.250809
        Num handles: 1
        Handle: 108 Address: DF:A9:FF:F6:B1:1A (OUI DF-A9-FF)
        Count: 1
        #297: len 9 (1 Kb/s)
        Latency: 60 msec (20-141 msec ~60 msec)
> ACL Data RX: Handle 108 flags 0x02 dlen 5               #299 [hci1] 13.320861
      ATT: Write Response (0x13) len 0
< HCI Command: Host Number of Com.. (0x03|0x0035) plen 5  #300 [hci1] 13.330074
        Num handles: 1
        Handle: 108 Address: DF:A9:FF:F6:B1:1A (OUI DF-A9-FF)
        Count: 1
< ACL Data TX: Handle 108 flags 0x00 dlen 11              #301 [hci1] 13.330233
      ATT: Read By Type Request (0x08) len 6
        Handle range: 0x018f-0x018f
        Attribute type: Characteristic (0x2803)
> HCI Event: Number of Completed Packets (0x13) plen 5    #302 [hci1] 13.390853
        Num handles: 1
        Handle: 108 Address: DF:A9:FF:F6:B1:1A (OUI DF-A9-FF)
        Count: 1
        #301: len 11 (1 Kb/s)
        Latency: 60 msec (20-141 msec ~60 msec)
> ACL Data RX: Handle 108 flags 0x02 dlen 9               #303 [hci1] 13.460900
      ATT: Error Response (0x01) len 4
        Read By Type Request (0x08)
        Handle: 0x018f
        Error: Attribute Not Found (0x0a)
< HCI Command: Host Number of Com.. (0x03|0x0035) plen 5  #304 [hci1] 13.470329
        Num handles: 1
        Handle: 108 Address: DF:A9:FF:F6:B1:1A (OUI DF-A9-FF)
        Count: 1
< ACL Data TX: Handle 108 flags 0x00 dlen 8               #305 [hci1] 15.490082
      ATT: Write Request (0x12) len 3
        Handle: 0x014f
          Data: 01
> HCI Event: Number of Completed Packets (0x13) plen 5    #306 [hci1] 15.560804
        Num handles: 1
        Handle: 108 Address: DF:A9:FF:F6:B1:1A (OUI DF-A9-FF)
        Count: 1
        #305: len 8 (0 Kb/s)
        Latency: 70 msec (20-141 msec ~65 msec)
> ACL Data RX: Handle 108 flags 0x02 dlen 5               #307 [hci1] 15.630932
      ATT: Write Response (0x13) len 0
> ACL Data RX: Handle 108 flags 0x02 dlen 9               #308 [hci1] 15.631360
      ATT: Handle Value Notification (0x1b) len 4
        Handle: 0x014f
          Data: 0102
< HCI Command: Host Number of Com.. (0x03|0x0035) plen 5  #309 [hci1] 15.650818
        Num handles: 1
        Handle: 108 Address: DF:A9:FF:F6:B1:1A (OUI DF-A9-FF)
        Count: 1
< HCI Command: Host Number of Com.. (0x03|0x0035) plen 5  #310 [hci1] 15.651265
        Num handles: 1
        Handle: 108 Address: DF:A9:FF:F6:B1:1A (OUI DF-A9-FF)
        Count: 1
< ACL Data TX: Handle 108 flags 0x00 dlen 8               #311 [hci1] 16.710697
      ATT: Write Request (0x12) len 3
        Handle: 0x014f
          Data: 01
> HCI Event: Number of Completed Packets (0x13) plen 5    #312 [hci1] 16.750777
        Num handles: 1
        Handle: 108 Address: DF:A9:FF:F6:B1:1A (OUI DF-A9-FF)
        Count: 1
        #311: len 8 (1 Kb/s)
        Latency: 40 msec (20-141 msec ~52 msec)
> ACL Data RX: Handle 108 flags 0x02 dlen 5               #313 [hci1] 16.820769
      ATT: Write Response (0x13) len 0
> ACL Data RX: Handle 108 flags 0x02 dlen 9               #314 [hci1] 16.821334
      ATT: Handle Value Notification (0x1b) len 4
        Handle: 0x014f
          Data: 0103
< HCI Command: Host Number of Com.. (0x03|0x0035) plen 5  #315 [hci1] 16.830741
        Num handles: 1
        Handle: 108 Address: DF:A9:FF:F6:B1:1A (OUI DF-A9-FF)
        Count: 1
< HCI Command: Host Number of Com.. (0x03|0x0035) plen 5  #316 [hci1] 16.831093
        Num handles: 1
        Handle: 108 Address: DF:A9:FF:F6:B1:1A (OUI DF-A9-FF)
        Count: 1
< ACL Data TX: Handle 108 flags 0x00 dlen 8               #317 [hci1] 17.920035
      ATT: Write Request (0x12) len 3
        Handle: 0x014f
          Data: 01
> HCI Event: Number of Completed Packets (0x13) plen 5    #318 [hci1] 17.940786
        Num handles: 1
        Handle: 108 Address: DF:A9:FF:F6:B1:1A (OUI DF-A9-FF)
        Count: 1
        #317: len 8 (3 Kb/s)
        Latency: 20 msec (20-141 msec ~36 msec)
> ACL Data RX: Handle 108 flags 0x02 dlen 5               #319 [hci1] 18.010772
      ATT: Write Response (0x13) len 0
> ACL Data RX: Handle 108 flags 0x02 dlen 9               #320 [hci1] 18.011232
      ATT: Handle Value Notification (0x1b) len 4
        Handle: 0x014f
          Data: 0104
< HCI Command: Host Number of Com.. (0x03|0x0035) plen 5  #321 [hci1] 18.030300
        Num handles: 1
        Handle: 108 Address: DF:A9:FF:F6:B1:1A (OUI DF-A9-FF)
        Count: 1
< HCI Command: Host Number of Com.. (0x03|0x0035) plen 5  #322 [hci1] 18.030490
        Num handles: 1
        Handle: 108 Address: DF:A9:FF:F6:B1:1A (OUI DF-A9-FF)
        Count: 1
> HCI Event: Disconnect Complete (0x05) plen 4            #323 [hci1] 19.480523
        Status: Success (0x00)
        Handle: 108 Address: DF:A9:FF:F6:B1:1A (OUI DF-A9-FF)
        Reason: Remote User Terminated Connection (0x13)
< HCI Command: Reset (0x03|0x0003) plen 0                 #324 [hci1] 24.610102
> HCI Event: Command Complete (0x0e) plen 4               #325 [hci1] 24.610570
      Reset (0x03|0x0003) ncmd 1
        Status: Success (0x00)
@ USER Close: main                                    {0x0001} [hci1] 24.630003
= Close Index: 00:00:00:00:00:00                               [hci1] 24.633177
