Bluetooth monitor ver 5.72
= Note: Linux version 6.14.0-36-generic (x86_64)                       0.199845
= Note: Bluetooth subsystem version 2.22                               0.199847
= New Index: 00:00:00:00:00:00 (Primary,UART,hci1)              [hci1] 0.199848
= New Index: 48:5F:99:8E:E0:64 (Primary,USB,hci0)               [hci0] 0.199848
= Open Index: 00:00:00:00:00:00                                 [hci1] 0.714039
= Index Info: 00:00:00:00:00:00 (Nordic Semiconductor ASA)      [hci1] 0.714058
@ USER Open: main (privileged) version 2.22            {0x0001} [hci1] 0.714067
< HCI Command: Reset (0x03|0x0003) plen 0                    #1 [hci1] 0.715303
> HCI Event: Command Complete (0x0e) plen 4                  #2 [hci1] 0.715830
      Reset (0x03|0x0003) ncmd 1
        Status: Success (0x00)
< HCI Command: Read Local Supported... (0x04|0x0003) plen 0  #3 [hci1] 0.733710
> HCI Event: Command Complete (0x0e) plen 12                 #4 [hci1] 0.734165
      Read Local Supported Features (0x04|0x0003) ncmd 1
        Status: Success (0x00)
        Features: 0x00 0x00 0x00 0x00 0x60 0x00 0x00 0x00
          BR/EDR Not Supported
          LE Supported (Controller)
< HCI Command: Read Local Version In.. (0x04|0x0001) plen 0  #5 [hci1] 0.753466
> HCI Event: Command Complete (0x0e) plen 12                 #6 [hci1] 0.753961
      Read Local Version Information (0x04|0x0001) ncmd 1
        Status: Success (0x00)
        HCI version: Reserved (0x0f) - Revision 12393 (0x3069)
        LMP version: Reserved (0x0f) - Subversion 12393 (0x3069)
        Manufacturer: Nordic Semiconductor ASA (89)
< HCI Command: Read Local Supported... (0x04|0x0002) plen 0  #7 [hci1] 0.773491
> HCI Event: Command Complete (0x0e) plen 68                 #8 [hci1] 0.774536
      Read Local Supported Commands (0x04|0x0002) ncmd 1
        Status: Success (0x00)
        Commands: 119 entries
          Disconnect (Octet 0 - Bit 5)
          Read Remote Version Information (Octet 2 - Bit 7)
          Set Event Mask (Octet 5 - Bit 6)
          Reset (Octet 5 - Bit 7)
          Read Connection Accept Timeout (Octet 7 - Bit 2)
          Write Connection Accept Timeout (Octet 7 - Bit 3)
          Read Transmit Power Level (Octet 10 - Bit 2)
          Set Controller To Host Flow Control (Octet 10 - Bit 5)
          Host Buffer Size (Octet 10 - Bit 6)
          Host Number of Completed Packets (Octet 10 - Bit 7)
          Read Local Version Information (Octet 14 - Bit 3)
          Read Local Supported Features (Octet 14 - Bit 5)
          Read BD ADDR (Octet 15 - Bit 1)
          Read RSSI (Octet 15 - Bit 5)
          Set Event Mask Page 2 (Octet 22 - Bit 2)
          LE Set Event Mask (Octet 25 - Bit 0)
          LE Read Buffer Size (Octet 25 - Bit 1)
          LE Read Local Supported Features (Octet 25 - Bit 2)
          LE Set Random Address (Octet 25 - Bit 4)
          LE Set Advertising Parameters (Octet 25 - Bit 5)
          LE Read Advertising Channel TX Power (Octet 25 - Bit 6)
          LE Set Advertising Data (Octet 25 - Bit 7)
          LE Set Scan Response Data (Octet 26 - Bit 0)
          LE Set Advertise Enable (Octet 26 - Bit 1)
          LE Set Scan Parameters (Octet 26 - Bit 2)
          LE Set Scan Enable (Octet 26 - Bit 3)
          LE Create Connection (Octet 26 - Bit 4)
          LE Create Connection Cancel (Octet 26 - Bit 5)
          LE Read Accept List Size (Octet 26 - Bit 6)
          LE Clear Accept List (Octet 26 - Bit 7)
          LE Add Device To Accept List (Octet 27 - Bit 0)
          LE Remove Device From Accept List (Octet 27 - Bit 1)
          LE Connection Update (Octet 27 - Bit 2)
          LE Set Host Channel Classification (Octet 27 - Bit 3)
          LE Read Channel Map (Octet 27 - Bit 4)
          LE Read Remote Used Features (Octet 27 - Bit 5)
          LE Encrypt (Octet 27 - Bit 6)
          LE Rand (Octet 27 - Bit 7)
          LE Start Encryption (Octet 28 - Bit 0)
          LE Long Term Key Request Reply (Octet 28 - Bit 1)
          LE Long Term Key Request Neg Reply (Octet 28 - Bit 2)
          LE Read Supported States (Octet 28 - Bit 3)
          LE Receiver Test (Octet 28 - Bit 4)
          LE Transmitter Test (Octet 28 - Bit 5)
          LE Test End (Octet 28 - Bit 6)
          Read Authenticated Payload Timeout (Octet 32 - Bit 4)
          Write Authenticated Payload Timeout (Octet 32 - Bit 5)
          LE Set Data Length (Octet 33 - Bit 6)
          LE Read Suggested Default Data Length (Octet 33 - Bit 7)
          LE Write Suggested Default Data Length (Octet 34 - Bit 0)
          LE Add Device To Resolving List (Octet 34 - Bit 3)
          LE Remove Device From Resolving List (Octet 34 - Bit 4)
          LE Clear Resolving List (Octet 34 - Bit 5)
          LE Read Resolving List Size (Octet 34 - Bit 6)
          LE Set Address Resolution Enable (Octet 35 - Bit 1)
          LE Set Resolvable Private Address Timeout (Octet 35 - Bit 2)
          LE Read Maximum Data Length (Octet 35 - Bit 3)
          LE Read PHY (Octet 35 - Bit 4)
          LE Set Default PHY (Octet 35 - Bit 5)
          LE Set PHY (Octet 35 - Bit 6)
          LE Enhanced Receiver Test (Octet 35 - Bit 7)
          LE Enhanced Transmitter Test (Octet 36 - Bit 0)
          LE Set Advertising Set Random Address (Octet 36 - Bit 1)
          LE Set Extended Advertising Parameters (Octet 36 - Bit 2)
          LE Set Extended Advertising Data (Octet 36 - Bit 3)
          LE Set Extended Scan Response Data (Octet 36 - Bit 4)
          LE Set Extended Advertising Enable (Octet 36 - Bit 5)
          LE Read Maximum Advertising Data Length (Octet 36 - Bit 6)
          LE Read Number of Supported Advertising Sets (Octet 36 - Bit 7)
          LE Remove Advertising Set (Octet 37 - Bit 0)
          LE Clear Advertising Sets (Octet 37 - Bit 1)
          LE Set Periodic Advertising Parameters (Octet 37 - Bit 2)
          LE Set Periodic Advertising Data (Octet 37 - Bit 3)
          LE Set Periodic Advertising Enable (Octet 37 - Bit 4)
          LE Set Extended Scan Parameters (Octet 37 - Bit 5)
          LE Set Extended Scan Enable (Octet 37 - Bit 6)
          LE Extended Create Connection (Octet 37 - Bit 7)
          LE Periodic Advertising Create Sync (Octet 38 - Bit 0)
          LE Periodic Advertising Create Sync Cancel (Octet 38 - Bit 1)
          LE Periodic Advertising Terminate Sync (Octet 38 - Bit 2)
          LE Add Device To Periodic Advertiser List (Octet 38 - Bit 3)
          LE Remove Device From Periodic Advertiser List (Octet 38 - Bit 4)
          LE Clear Periodic Advertiser List (Octet 38 - Bit 5)
          LE Read Periodic Advertiser List Size (Octet 38 - Bit 6)
          LE Read Transmit Power (Octet 38 - Bit 7)
          LE Read RF Path Compensation (Octet 39 - Bit 0)
          LE Write RF Path Compensation (Octet 39 - Bit 1)
          LE Set Privacy Mode (Octet 39 - Bit 2)
          LE Periodic Advertising Receive Enable (Octet 40 - Bit 5)
          LE Periodic Advertising Sync Transfer (Octet 40 - Bit 6)
          LE Periodic Advertising Set Info Transfer (Octet 40 - Bit 7)
          LE Periodic Advertising Sync Transfer Parameters (Octet 41 - Bit 0)
          LE Set Default Periodic Advertisng Sync Transfer Parameters (Octet 41 - Bit 1)
          LE Read Buffer v2 (Octet 41 - Bit 5)
          LE Read ISO TX Sync (Octet 41 - Bit 6)
          LE Set Connected Isochronous Group Parameters (Octet 41 - Bit 7)
          LE Set Connected Isochronous Group Parameters Test (Octet 42 - Bit 0)
          LE Create Connected Isochronous Stream (Octet 42 - Bit 1)
          LE Remove Connected Isochronous Group (Octet 42 - Bit 2)
          LE Accept Connected Isochronous Stream Request (Octet 42 - Bit 3)
          LE Reject Connected Isochronous Stream Request (Octet 42 - Bit 4)
          LE Create Broadcast Isochronous Group (Octet 42 - Bit 5)
          LE Create Broadcast Isochronous Group Test (Octet 42 - Bit 6)
          LE Terminate Broadcast Isochronous Group (Octet 42 - Bit 7)
          LE Broadcast Isochronous Group Create Sync (Octet 43 - Bit 0)
          LE Broadcast Isochronous Group Terminate Sync (Octet 43 - Bit 1)
          LE Request Peer SCA (Octet 43 - Bit 2)
          LE Setup Isochronous Data Path (Octet 43 - Bit 3)
          LE Remove Isochronous Data Path (Octet 43 - Bit 4)
          LE Isochronous Transmit Test (Octet 43 - Bit 5)
          LE Isochronous Receive Test (Octet 43 - Bit 6)
          LE Isochronous Read Test Counters (Octet 43 - Bit 7)
          LE Isochronous Read Test Counters (Octet 44 - Bit 0)
          LE Set Host Feature (Octet 44 - Bit 1)
          Octet 44 - Bit 2 
          Octet 45 - Bit 6 
          Octet 46 - Bit 0 
          Octet 46 - Bit 1 
          Octet 46 - Bit 2 
< HCI Command: Host Buffer Size (0x03|0x0033) plen 7         #9 [hci1] 0.793450
        ACL MTU: 255  ACL max packet: 16
        SCO MTU: 0    SCO max packet: 0
> HCI Event: Command Complete (0x0e) plen 4                 #10 [hci1] 0.793906
      Host Buffer Size (0x03|0x0033) ncmd 1
        Status: Success (0x00)
< HCI Command: Set Controller To Ho.. (0x03|0x0031) plen 1  #11 [hci1] 0.813509
        Flow control: ACL Data Packets (0x01)
> HCI Event: Command Complete (0x0e) plen 4                 #12 [hci1] 0.813883
      Set Controller To Host Flow Control (0x03|0x0031) ncmd 1
        Status: Success (0x00)
< HCI Command: LE Read Local Suppor.. (0x08|0x0003) plen 0  #13 [hci1] 0.833481
> HCI Event: Command Complete (0x0e) plen 12                #14 [hci1] 0.833988
      LE Read Local Supported Features (0x08|0x0003) ncmd 1
        Status: Success (0x00)
        Features: 0xfd 0x79 0x00 0xf7 0x30 0x01 0x00 0x00
          LE Encryption
          Extended Reject Indication
          Peripheral-initiated Features Exchange
          LE Ping
          LE Data Packet Length Extension
          LL Privacy
          Extended Scanner Filter Policies
          LE 2M PHY
          LE Coded PHY
          LE Extended Advertising
          LE Periodic Advertising
          Channel Selection Algorithm #2
          Periodic Advertising Sync Transfer - Sender
          Periodic Advertising Sync Transfer - Recipient
          Sleep Clock Accuracy Updates
          Connected Isochronous Stream - Central
          Connected Isochronous Stream - Peripheral
          Isochronous Broadcaster
          Synchronized Receiver
          Periodic Advertising ADI support
          Connection Subrating
          Unknown features (0x0000010000000000)
< HCI Command: LE Set Host Feature (0x08|0x0074) plen 2     #15 [hci1] 0.853470
        Bit Number: 32
          Connected Isochronous Stream (Host Support)
        Bit Value: 1
> HCI Event: Command Complete (0x0e) plen 4                 #16 [hci1] 0.853871
      LE Set Host Feature (0x08|0x0074) ncmd 1
        Status: Success (0x00)
< HCI Command: LE Read Buffer v2 (0x08|0x0060) plen 0       #17 [hci1] 0.873463
> HCI Event: Command Complete (0x0e) plen 10                #18 [hci1] 0.873923
      LE Read Buffer v2 (0x08|0x0060) ncmd 1
        Status: Success (0x00)
        ACL MTU: 27
        ACL max packet: 3
        ISO MTU: 318
        ISO max packet: 3
< HCI Command: LE Read Maximum Adve.. (0x08|0x003a) plen 0  #19 [hci1] 0.893480
> HCI Event: Command Complete (0x0e) plen 6                 #20 [hci1] 0.894099
      LE Read Maximum Advertising Data Length (0x08|0x003a) ncmd 1
        Status: Success (0x00)
        Max length: 1650
< HCI Command: LE Read Supported St.. (0x08|0x001c) plen 0  #21 [hci1] 0.913474
> HCI Event: Command Complete (0x0e) plen 12                #22 [hci1] 0.914046
      LE Read Supported States (0x08|0x001c) ncmd 1
        Status: Success (0x00)
        States: 0x000003ff3e0306ff
          Non-connectable Advertising State
          Scannable Advertising State
          Connectable Advertising State
          High Duty Cycle Directed Advertising State
          Passive Scanning State
          Active Scanning State
          Initiating State
            and Connection State (Central Role)
          Connection State (Peripheral Role)
          Scannable Advertising State
            and Passive Scanning State
          Connectable Advertising State
            and Passive Scanning State
          Non-connectable Advertising State
            and Initiating State
          Scannable Advertising State
            and Initiating State
          Active Scanning State
            and Connection State (Central Role)
          Passive Scanning State
            and Connection State (Peripheral Role)
          Active Scanning State
            and Connection State (Peripheral Role)
          Initiating State
            and Connection State (Central Role)
            and Central Role & Central Role
          Low Duty Cycle Directed Advertising State
          Connectable Advertising State
            and Initiating State
            and Central Role & Peripheral Role
          High Duty Cycle Directed Advertising State
            and Initiating State
            and Central Role & Peripheral Role
          Low Duty Cycle Directed Advertising State
            and Initiating State
            and Central Role & Peripheral Role
          Connectable Advertising State
            and Connection State (Central Role)
            and Central Role & Peripheral Role
          High Duty Cycle Directed Advertising State
            and Connection State (Central Role)
            and Central Role & Peripheral Role
          Low Duty Cycle Directed Advertising State
            and Connection State (Central Role)
            and Central Role & Peripheral Role
          Connectable Advertising State
            and Connection State (Peripheral Role)
            and Central Role & Peripheral Role
          High Duty Cycle Directed Advertising State
            and Connection State (Peripheral Role)
            and Peripheral Role & Peripheral Role
          Low Duty Cycle Directed Advertising State
            and Connection State (Peripheral Role)
            and Peripheral Role & Peripheral Role
          Initiating State
            and Connection State (Peripheral Role)
            and Central Role & Peripheral Role
< HCI Command: LE Read Maximum Data.. (0x08|0x002f) plen 0  #23 [hci1] 0.933460
> HCI Event: Command Complete (0x0e) plen 12                #24 [hci1] 0.933993
      LE Read Maximum Data Length (0x08|0x002f) ncmd 1
        Status: Success (0x00)
        Max TX octets: 251
        Max TX time: 2704
        Max RX octets: 251
        Max RX time: 2704
< HCI Command: LE Write Suggested D.. (0x08|0x0024) plen 4  #25 [hci1] 0.953446
        TX octets: 251
        TX time: 2704
> HCI Event: Command Complete (0x0e) plen 4                 #26 [hci1] 0.953978
      LE Write Suggested Default Data Length (0x08|0x0024) ncmd 1
        Status: Success (0x00)
< HCI Command: LE Set Resolvable Pr.. (0x08|0x002e) plen 2  #27 [hci1] 0.973515
        Timeout: 30 seconds
> HCI Event: Command Complete (0x0e) plen 4                 #28 [hci1] 0.973980
      LE Set Resolvable Private Address Timeout (0x08|0x002e) ncmd 1
        Status: Success (0x00)
< HCI Command: LE Read Resolving Li.. (0x08|0x002a) plen 0  #29 [hci1] 0.993492
> HCI Event: Command Complete (0x0e) plen 5                 #30 [hci1] 0.993915
      LE Read Resolving List Size (0x08|0x002a) ncmd 1
        Status: Success (0x00)
        Size: 8
< HCI Command: LE Set Event Mask (0x08|0x0001) plen 8       #31 [hci1] 1.013466
        Mask: 0x000002023f87fa5e
          LE Advertising Report
          LE Connection Update Complete
          LE Read Remote Used Features Complete
          LE Long Term Key Request
          LE Data Length Change
          LE Enhanced Connection Complete
          LE PHY Update Complete
          LE Extended Advertising Report
          LE Periodic Advertising Sync Established
          LE Periodic Advertising Report
          LE Periodic Advertising Sync Lost
          LE Extended Scan Timeout
          LE Extended Advertising Set Terminated
          LE Scan Request Received
          LE Periodic Advertising Sync Transfer Rvc
          LE CIS Established
          LE CIS Request
          LE Create BIG Complete
          LE Terminate BIG Complete
          LE BIG Sync Estabilished Complete
          LE BIG Sync Lost
          LE BIG Info Advertising Report
          Unknown mask (0x0000020000000000)
> HCI Event: Command Complete (0x0e) plen 4                 #32 [hci1] 1.014043
      LE Set Event Mask (0x08|0x0001) ncmd 1
        Status: Success (0x00)
< HCI Command: Set Event Mask (0x03|0x0001) plen 8          #33 [hci1] 1.033494
        Mask: 0x2000800002008890
          Disconnection Complete
          Encryption Change
          Read Remote Version Information Complete
          Hardware Error
          Data Buffer Overflow
          Encryption Key Refresh Complete
          LE Meta
> HCI Event: Command Complete (0x0e) plen 4                 #34 [hci1] 1.034082
      Set Event Mask (0x03|0x0001) ncmd 1
        Status: Success (0x00)
< HCI Command: Read BD ADDR (0x04|0x0009) plen 0            #35 [hci1] 1.053371
> HCI Event: Command Complete (0x0e) plen 10                #36 [hci1] 1.053860
      Read BD ADDR (0x04|0x0009) ncmd 1
        Status: Success (0x00)
        Address: 00:00:00:00:00:00 (OUI 00-00-00)
< HCI Command: LE Set Random Address (0x08|0x0005) plen 6   #37 [hci1] 1.073480
        Address: D5:B6:CC:31:DB:3B (Static)
> HCI Event: Command Complete (0x0e) plen 4                 #38 [hci1] 1.074066
      LE Set Random Address (0x08|0x0005) ncmd 1
        Status: Success (0x00)
< HCI Command: LE Set Random Address (0x08|0x0005) plen 6   #39 [hci1] 1.173469
        Address: 48:61:8E:DB:C6:F9 (Resolvable)
> HCI Event: Command Complete (0x0e) plen 4                 #40 [hci1] 1.173973
      LE Set Random Address (0x08|0x0005) ncmd 1
        Status: Success (0x00)
< HCI Command: LE Extended Create... (0x08|0x0043) plen 26  #41 [hci1] 5.233652
        Filter policy: Accept list is not used (0x00)
        Own address type: Random (0x03)
        Peer address type: Public (0x00)
        Peer address: DF:A9:FF:F6:B1:1A (OUI DF-A9-FF)
        Initiating PHYs: 0x01
        Entry 0: LE 1M
          Scan interval: 60.000 msec (0x0060)
          Scan window: 60.000 msec (0x0060)
          Min connection interval: 50.00 msec (0x0028)
          Max connection interval: 70.00 msec (0x0038)
          Connection latency: 0 (0x0000)
          Supervision timeout: 4000 msec (0x0190)
          Min connection length: 0.000 msec (0x0000)
          Max connection length: 0.000 msec (0x0000)
> HCI Event: Command Status (0x0f) plen 4                   #42 [hci1] 5.234635
      LE Extended Create Connection (0x08|0x0043) ncmd 1
        Status: Success (0x00)
> HCI Event: LE Meta Event (0x3e) plen 31                   #43 [hci1] 5.332756
      LE Enhanced Connection Complete (0x0a)
        Status: Success (0x00)
        Handle: 36
        Role: Central (0x00)
        Peer address type: Public (0x00)
        Peer address: DF:A9:FF:F6:B1:1A (OUI DF-A9-FF)
        Local resolvable private address: 48:61:8E:DB:C6:F9 (Resolvable)
        Peer resolvable private address: 00:00:00:00:00:00 (Non-Resolvable)
        Connection interval: 70.00 msec (0x0038)
        Connection latency: 0 (0x0000)
        Supervision timeout: 4000 msec (0x0190)
        Central clock accuracy: 0x00
< HCI Command: LE Read Remote Used... (0x08|0x0016) plen 2  #44 [hci1] 5.333679
        Handle: 36 Address: DF:A9:FF:F6:B1:1A (OUI DF-A9-FF)
< ACL Data TX: Handle 36 flags 0x00 dlen 7                  #45 [hci1] 5.333685
      ATT: Exchange MTU Request (0x02) len 2
        Client RX MTU: 251
> HCI Event: Command Status (0x0f) plen 4                   #46 [hci1] 5.334280
      LE Read Remote Used Features (0x08|0x0016) ncmd 1
        Status: Success (0x00)
> HCI Event: Number of Completed Packets (0x13) plen 5      #47 [hci1] 5.334871
        Num handles: 1
        Handle: 36 Address: DF:A9:FF:F6:B1:1A (OUI DF-A9-FF)
        Count: 1
        #45: len 7 (56 Kb/s)
        Latency: 1 msec (1-1 msec ~1 msec)
< HCI Command: LE Set PHY (0x08|0x0032) plen 7              #48 [hci1] 5.353546
        Handle: 36 Address: DF:A9:FF:F6:B1:1A (OUI DF-A9-FF)
        All PHYs preference: 0x00
        TX PHYs preference: 0x02
          LE 2M
        RX PHYs preference: 0x02
          LE 2M
        PHY options preference: Reserved (0x0000)
> HCI Event: Command Status (0x0f) plen 4                   #49 [hci1] 5.354093
      LE Set PHY (0x08|0x0032) ncmd 1
        Status: Success (0x00)
> HCI Event: LE Meta Event (0x3e) plen 12                   #50 [hci1] 5.475021
      LE Read Remote Used Features (0x04)
        Status: Success (0x00)
        Handle: 36 Address: DF:A9:FF:F6:B1:1A (OUI DF-A9-FF)
        Features: 0x2d 0x49 0x00 0xf7 0x67 0xd8 0x00 0x00
          LE Encryption
          Extended Reject Indication
          Peripheral-initiated Features Exchange
          LE Data Packet Length Extension
          LE 2M PHY
          LE Coded PHY
          Channel Selection Algorithm #2
          Periodic Advertising Sync Transfer - Sender
          Periodic Advertising Sync Transfer - Recipient
          Sleep Clock Accuracy Updates
          Connected Isochronous Stream - Central
          Connected Isochronous Stream - Peripheral
          Isochronous Broadcaster
          Synchronized Receiver
          Connected Isochronous Stream (Host Support)
          LE Power Control Request
          LE Power Control Request
          Connection Subrating
          Connection Subrating (Host Support)
          Unknown features (0x0000d80000000000)
> HCI Event: LE Meta Event (0x3e) plen 6                    #51 [hci1] 6.174310
      LE PHY Update Complete (0x0c)
        Status: Success (0x00)
        Handle: 36 Address: DF:A9:FF:F6:B1:1A (OUI DF-A9-FF)
        TX PHY: LE 2M (0x02)
        RX PHY: LE 2M (0x02)
> ACL Data RX: Handle 36 flags 0x02 dlen 6                  #52 [hci1] 6.384791
      SMP: Security Request (0x0b) len 1
        Authentication requirement: Bonding, No MITM, SC, No Keypresses (0x09)
> ACL Data RX: Handle 36 flags 0x02 dlen 7                  #53 [hci1] 6.385241
      ATT: Exchange MTU Response (0x03) len 2
        Server RX MTU: 23
< HCI Command: Host Number of Compl.. (0x03|0x0035) plen 5  #54 [hci1] 6.393535
        Num handles: 1
        Handle: 36 Address: DF:A9:FF:F6:B1:1A (OUI DF-A9-FF)
        Count: 1
< ACL Data TX: Handle 36 flags 0x00 dlen 11                 #55 [hci1] 6.393659
      SMP: Pairing Request (0x01) len 6
        IO capability: NoInputNoOutput (0x03)
        OOB data: Authentication data not present (0x00)
        Authentication requirement: Bonding, No MITM, SC, No Keypresses (0x09)
        Max encryption key size: 16
        Initiator key distribution: EncKey IdKey (0x03)
        Responder key distribution: EncKey IdKey (0x03)
< HCI Command: Host Number of Compl.. (0x03|0x0035) plen 5  #56 [hci1] 6.393846
        Num handles: 1
        Handle: 36 Address: DF:A9:FF:F6:B1:1A (OUI DF-A9-FF)
        Count: 1
> HCI Event: Number of Completed Packets (0x13) plen 5      #57 [hci1] 6.454833
        Num handles: 1
        Handle: 36 Address: DF:A9:FF:F6:B1:1A (OUI DF-A9-FF)
        Count: 1
        #55: len 11 (1 Kb/s)
        Latency: 61 msec (1-61 msec ~31 msec)
> ACL Data RX: Handle 36 flags 0x02 dlen 11                 #58 [hci1] 6.524931
      SMP: Pairing Response (0x02) len 6
        IO capability: KeyboardDisplay (0x04)
        OOB data: Authentication data not present (0x00)
        Authentication requirement: Bonding, No MITM, SC, No Keypresses (0x09)
        Max encryption key size: 16
        Initiator key distribution: EncKey IdKey (0x03)
        Responder key distribution: EncKey IdKey (0x03)
< HCI Command: Host Number of Compl.. (0x03|0x0035) plen 5  #59 [hci1] 6.533598
        Num handles: 1
        Handle: 36 Address: DF:A9:FF:F6:B1:1A (OUI DF-A9-FF)
        Count: 1
< ACL Data TX: Handle 36 flags 0x00 dlen 27                 #60 [hci1] 6.533710
< ACL Data TX: Handle 36 flags 0x01 dlen 27                 #61 [hci1] 6.533714
< ACL Data TX: Handle 36 flags 0x01 dlen 15                 #62 [hci1] 6.533715
      SMP: Pairing Public Key (0x0c) len 64
        X: 68f6ada634ce84d11617383d57f070fe3445c38b33b569efa5eb771a0dc8aea5
        Y: 83c407aaa8337331fdc418e55085d75e6c1c6e5d42f8bf9c18fb5a2a7d4f31aa
> HCI Event: Number of Completed Packets (0x13) plen 5      #63 [hci1] 6.594834
        Num handles: 1
        Handle: 36 Address: DF:A9:FF:F6:B1:1A (OUI DF-A9-FF)
        Count: 1
        #60: len 27 (3 Kb/s)
        Latency: 61 msec (1-61 msec ~46 msec)
> HCI Event: Number of Completed Packets (0x13) plen 5      #64 [hci1] 6.595257
        Num handles: 1
        Handle: 36 Address: DF:A9:FF:F6:B1:1A (OUI DF-A9-FF)
        Count: 1
        #61: len 27 (3 Kb/s)
        Latency: 61 msec (1-61 msec ~53 msec)
> HCI Event: Number of Completed Packets (0x13) plen 5      #65 [hci1] 6.595822
        Num handles: 1
        Handle: 36 Address: DF:A9:FF:F6:B1:1A (OUI DF-A9-FF)
        Count: 1
        #62: len 15 (1 Kb/s)
        Latency: 62 msec (1-62 msec ~57 msec)
> ACL Data RX: Handle 36 flags 0x02 dlen 27                 #66 [hci1] 6.665087
> ACL Data RX: Handle 36 flags 0x01 dlen 27                 #67 [hci1] 6.665559
> ACL Data RX: Handle 36 flags 0x01 dlen 15                 #68 [hci1] 6.665882
      SMP: Pairing Public Key (0x0c) len 64
        X: 081ce45b0325bbc15536ffa006e473e1086aa7a0ef4342cb901a65580d4308bb
        Y: a38196dbb19c2e4fa6364051fe4867a42de86c90cfa484755782fef5dba60b3b
> ACL Data RX: Handle 36 flags 0x02 dlen 21                 #69 [hci1] 6.666456
      SMP: Pairing Confirm (0x03) len 16
        Confim value: 07fa582826f0c0e4ef34fbaef217e1f6
< HCI Command: Host Number of Compl.. (0x03|0x0035) plen 5  #70 [hci1] 6.673721
        Num handles: 1
        Handle: 36 Address: DF:A9:FF:F6:B1:1A (OUI DF-A9-FF)
        Count: 1
< HCI Command: Host Number of Compl.. (0x03|0x0035) plen 5  #71 [hci1] 6.673827
        Num handles: 1
        Handle: 36 Address: DF:A9:FF:F6:B1:1A (OUI DF-A9-FF)
        Count: 1
< HCI Command: Host Number of Compl.. (0x03|0x0035) plen 5  #72 [hci1] 6.673928
        Num handles: 1
        Handle: 36 Address: DF:A9:FF:F6:B1:1A (OUI DF-A9-FF)
        Count: 1
< HCI Command: Host Number of Compl.. (0x03|0x0035) plen 5  #73 [hci1] 6.674012
        Num handles: 1
        Handle: 36 Address: DF:A9:FF:F6:B1:1A (OUI DF-A9-FF)
        Count: 1
< ACL Data TX: Handle 36 flags 0x00 dlen 21                 #74 [hci1] 6.674033
      SMP: Pairing Random (0x04) len 16
        Random value: 555cc64d02679f89a05211af56d8b3da
> HCI Event: Number of Completed Packets (0x13) plen 5      #75 [hci1] 6.734825
        Num handles: 1
        Handle: 36 Address: DF:A9:FF:F6:B1:1A (OUI DF-A9-FF)
        Count: 1
        #74: len 21 (2 Kb/s)
        Latency: 60 msec (1-62 msec ~59 msec)
> ACL Data RX: Handle 36 flags 0x02 dlen 21                 #76 [hci1] 6.805109
      SMP: Pairing Random (0x04) len 16
        Random value: c59d6fe102b465640000000000000000
< HCI Command: Host Number of Compl.. (0x03|0x0035) plen 5  #77 [hci1] 6.813682
        Num handles: 1
        Handle: 36 Address: DF:A9:FF:F6:B1:1A (OUI DF-A9-FF)
        Count: 1
< ACL Data TX: Handle 36 flags 0x00 dlen 21                 #78 [hci1] 6.813776
      SMP: Pairing DHKey Check (0x0d) len 16
        E: ec146f23eaec8b07e4b52b2b942fb940
> HCI Event: Number of Completed Packets (0x13) plen 5      #79 [hci1] 6.874918
        Num handles: 1
        Handle: 36 Address: DF:A9:FF:F6:B1:1A (OUI DF-A9-FF)
        Count: 1
        #78: len 21 (2 Kb/s)
        Latency: 61 msec (1-62 msec ~60 msec)
> ACL Data RX: Handle 36 flags 0x02 dlen 21                 #80 [hci1] 7.085062
      SMP: Pairing DHKey Check (0x0d) len 16
        E: 381544c5c9daff8d6a96d6b33930d8f8
< HCI Command: LE Start Encryption (0x08|0x0019) plen 28    #81 [hci1] 7.093710
        Handle: 36 Address: DF:A9:FF:F6:B1:1A (OUI DF-A9-FF)
        Random number: 0x0000000000000000
        Encrypted diversifier: 0x0000
        Long term key: bd38274b024431d08a300a6aa8bc2891
> HCI Event: Command Status (0x0f) plen 4                   #82 [hci1] 7.094619
      LE Start Encryption (0x08|0x0019) ncmd 1
        Status: Success (0x00)
< HCI Command: Host Number of Compl.. (0x03|0x0035) plen 5  #83 [hci1] 7.113504
        Num handles: 1
        Handle: 36 Address: DF:A9:FF:F6:B1:1A (OUI DF-A9-FF)
        Count: 1
> HCI Event: Encryption Change (0x08) plen 4                #84 [hci1] 7.574723
        Status: Success (0x00)
        Handle: 36 Address: DF:A9:FF:F6:B1:1A (OUI DF-A9-FF)
        Encryption: Enabled with AES-CCM (0x01)
> ACL Data RX: Handle 36 flags 0x02 dlen 21                 #85 [hci1] 7.645070
      SMP: Identity Information (0x08) len 16
        Identity resolving key: 9ad273e8f04dc2f031c10b6b03c2ddb7
< HCI Command: Host Number of Compl.. (0x03|0x0035) plen 5  #86 [hci1] 7.653560
        Num handles: 1
        Handle: 36 Address: DF:A9:FF:F6:B1:1A (OUI DF-A9-FF)
        Count: 1
> ACL Data RX: Handle 36 flags 0x02 dlen 12                 #87 [hci1] 7.714877
      SMP: Identity Address Information (0x09) len 7
        Address: DF:A9:FF:F6:B1:1A (OUI DF-A9-FF)
< HCI Command: LE Add Device To Re.. (0x08|0x0027) plen 39  #88 [hci1] 7.733737
        Address type: Public (0x00)
        Address: DF:A9:FF:F6:B1:1A (OUI DF-A9-FF)
        Peer identity resolving key: 9ad273e8f04dc2f031c10b6b03c2ddb7
        Local identity resolving key: 08aad2e1be87e47b88aeb19de6889efb
> HCI Event: Command Complete (0x0e) plen 4                 #89 [hci1] 7.734625
      LE Add Device To Resolving List (0x08|0x0027) ncmd 1
        Status: Success (0x00)
< HCI Command: LE Set Privacy Mode (0x08|0x004e) plen 8     #90 [hci1] 7.753546
        Peer Identity address type: Public (0x00)
        Peer Identity address: DF:A9:FF:F6:B1:1A (OUI DF-A9-FF)
        Privacy Mode: Use Device Privacy (0x01)
> HCI Event: Command Complete (0x0e) plen 4                 #91 [hci1] 7.754026
      LE Set Privacy Mode (0x08|0x004e) ncmd 1
        Status: Success (0x00)
< HCI Command: LE Set Address Resol.. (0x08|0x002d) plen 1  #92 [hci1] 7.773530
        Address resolution: Enabled (0x01)
> HCI Event: Command Complete (0x0e) plen 4                 #93 [hci1] 7.773870
      LE Set Address Resolution Enable (0x08|0x002d) ncmd 1
        Status: Success (0x00)
< HCI Command: Host Number of Compl.. (0x03|0x0035) plen 5  #94 [hci1] 7.793561
        Num handles: 1
        Handle: 36 Address: DF:A9:FF:F6:B1:1A (OUI DF-A9-FF)
        Count: 1
< HCI Command: LE Extended Create... (0x08|0x0043) plen 26  #95 [hci1] 7.793627
        Filter policy: Accept list is not used (0x00)
        Own address type: Random (0x03)
        Peer address type: Public (0x00)
        Peer address: 64:23:B5:94:C5:F1 (OUI 64-23-B5)
        Initiating PHYs: 0x01
        Entry 0: LE 1M
          Scan interval: 60.000 msec (0x0060)
          Scan window: 60.000 msec (0x0060)
          Min connection interval: 50.00 msec (0x0028)
          Max connection interval: 70.00 msec (0x0038)
          Connection latency: 0 (0x0000)
          Supervision timeout: 4000 msec (0x0190)
          Min connection length: 0.000 msec (0x0000)
          Max connection length: 0.000 msec (0x0000)
< ACL Data TX: Handle 36 flags 0x00 dlen 21                 #96 [hci1] 7.793632
      SMP: Identity Information (0x08) len 16
        Identity resolving key: 08aad2e1be87e47b88aeb19de6889efb
< ACL Data TX: Handle 36 flags 0x00 dlen 12                 #97 [hci1] 7.793640
      SMP: Identity Address Information (0x09) len 7
        Address: D5:B6:CC:31:DB:3B (Static)
> HCI Event: Command Status (0x0f) plen 4                   #98 [hci1] 7.794904
      LE Extended Create Connection (0x08|0x0043) ncmd 1
        Status: Success (0x00)
> HCI Event: Number of Completed Packets (0x13) plen 5      #99 [hci1] 7.854987
        Num handles: 1
        Handle: 36 Address: DF:A9:FF:F6:B1:1A (OUI DF-A9-FF)
        Count: 1
        #96: len 21 (2 Kb/s)
        Latency: 61 msec (1-62 msec ~60 msec)
> HCI Event: LE Meta Event (0x3e) plen 31                  #100 [hci1] 7.897665
      LE Enhanced Connection Complete (0x0a)
        Status: Success (0x00)
        Handle: 19
        Role: Central (0x00)
        Peer address type: Public (0x00)
        Peer address: 64:23:B5:94:C5:F1 (OUI 64-23-B5)
        Local resolvable private address: 48:61:8E:DB:C6:F9 (Resolvable)
          Identity type: Random (0x01)
          Identity: D5:B6:CC:31:DB:3B (Static)
        Peer resolvable private address: 00:00:00:00:00:00 (Non-Resolvable)
        Connection interval: 70.00 msec (0x0038)
        Connection latency: 0 (0x0000)
        Supervision timeout: 4000 msec (0x0190)
        Central clock accuracy: 0x00
< HCI Command: LE Read Remote Used.. (0x08|0x0016) plen 2  #101 [hci1] 7.913721
        Handle: 19 Address: 64:23:B5:94:C5:F1 (OUI 64-23-B5)
< ACL Data TX: Handle 19 flags 0x00 dlen 7                 #102 [hci1] 7.913727
      ATT: Exchange MTU Request (0x02) len 2
        Client RX MTU: 251
> HCI Event: Command Status (0x0f) plen 4                  #103 [hci1] 7.914216
      LE Read Remote Used Features (0x08|0x0016) ncmd 1
        Status: Success (0x00)
> HCI Event: Number of Completed Packets (0x13) plen 5     #104 [hci1] 7.924820
        Num handles: 1
        Handle: 36 Address: DF:A9:FF:F6:B1:1A (OUI DF-A9-FF)
        Count: 1
        #97: len 12 (0 Kb/s)
        Latency: 131 msec (1-131 msec ~95 msec)
< HCI Command: LE Set PHY (0x08|0x0032) plen 7             #105 [hci1] 7.933598
        Handle: 19 Address: 64:23:B5:94:C5:F1 (OUI 64-23-B5)
        All PHYs preference: 0x00
        TX PHYs preference: 0x02
          LE 2M
        RX PHYs preference: 0x02
          LE 2M
        PHY options preference: Reserved (0x0000)
> HCI Event: Command Status (0x0f) plen 4                  #106 [hci1] 7.934078
      LE Set PHY (0x08|0x0032) ncmd 1
        Status: Success (0x00)
< ACL Data TX: Handle 36 flags 0x00 dlen 11                #107 [hci1] 7.953737
      ATT: Read By Type Request (0x08) len 6
        Handle range: 0x0001-0xffff
        Attribute type: Central Address Resolution (0x2aa6)
> HCI Event: Number of Completed Packets (0x13) plen 5     #108 [hci1] 7.954826
        Num handles: 1
        Handle: 19 Address: 64:23:B5:94:C5:F1 (OUI 64-23-B5)
        Count: 1
        #102: len 7 (1 Kb/s)
        Latency: 41 msec (41-41 msec ~41 msec)
> HCI Event: Number of Completed Packets (0x13) plen 5     #109 [hci1] 7.994799
        Num handles: 1
        Handle: 36 Address: DF:A9:FF:F6:B1:1A (OUI DF-A9-FF)
        Count: 1
        #107: len 11 (2 Kb/s)
        Latency: 41 msec (1-131 msec ~68 msec)
> ACL Data RX: Handle 19 flags 0x02 dlen 7                 #110 [hci1] 8.025012
      ATT: Exchange MTU Response (0x03) len 2
        Server RX MTU: 23
< HCI Command: Host Number of Comp.. (0x03|0x0035) plen 5  #111 [hci1] 8.033623
        Num handles: 1
        Handle: 19 Address: 64:23:B5:94:C5:F1 (OUI 64-23-B5)
        Count: 1
> ACL Data RX: Handle 36 flags 0x02 dlen 9                 #112 [hci1] 8.064870
      ATT: Read By Type Response (0x09) len 4
        Attribute data length: 3
        Attribute data list: 1 entry
        Handle: 0x000f
        Value: 01
< HCI Command: Host Number of Comp.. (0x03|0x0035) plen 5  #113 [hci1] 8.073671
        Num handles: 1
        Handle: 36 Address: DF:A9:FF:F6:B1:1A (OUI DF-A9-FF)
        Count: 1
> HCI Event: LE Meta Event (0x3e) plen 12                  #114 [hci1] 8.095101
      LE Read Remote Used Features (0x04)
        Status: Success (0x00)
        Handle: 19 Address: 64:23:B5:94:C5:F1 (OUI 64-23-B5)
        Features: 0x2d 0x49 0x00 0xf7 0x67 0xd8 0x00 0x00
          LE Encryption
          Extended Reject Indication
          Peripheral-initiated Features Exchange
          LE Data Packet Length Extension
          LE 2M PHY
          LE Coded PHY
          Channel Selection Algorithm #2
          Periodic Advertising Sync Transfer - Sender
          Periodic Advertising Sync Transfer - Recipient
          Sleep Clock Accuracy Updates
          Connected Isochronous Stream - Central
          Connected Isochronous Stream - Peripheral
          Isochronous Broadcaster
          Synchronized Receiver
          Connected Isochronous Stream (Host Support)
          LE Power Control Request
          LE Power Control Request
          Connection Subrating
          Connection Subrating (Host Support)
          Unknown features (0x0000d80000000000)
> HCI Event: LE Meta Event (0x3e) plen 6                   #115 [hci1] 8.794265
      LE PHY Update Complete (0x0c)
        Status: Success (0x00)
        Handle: 19 Address: 64:23:B5:94:C5:F1 (OUI 64-23-B5)
        TX PHY: LE 2M (0x02)
        RX PHY: LE 2M (0x02)
< ACL Data TX: Handle 19 flags 0x00 dlen 11               #116 [hci1] 18.023730
      SMP: Pairing Request (0x01) len 6
        IO capability: NoInputNoOutput (0x03)
        OOB data: Authentication data not present (0x00)
        Authentication requirement: Bonding, No MITM, SC, No Keypresses (0x09)
        Max encryption key size: 16
        Initiator key distribution: EncKey IdKey (0x03)
        Responder key distribution: EncKey IdKey (0x03)
> HCI Event: Number of Completed Packets (0x13) plen 5    #117 [hci1] 18.034574
        Num handles: 1
        Handle: 19 Address: 64:23:B5:94:C5:F1 (OUI 64-23-B5)
        Count: 1
        #116: len 11 (8 Kb/s)
        Latency: 10 msec (10-41 msec ~25 msec)
> ACL Data RX: Handle 19 flags 0x02 dlen 11               #118 [hci1] 18.104722
      SMP: Pairing Response (0x02) len 6
        IO capability: KeyboardDisplay (0x04)
        OOB data: Authentication data not present (0x00)
        Authentication requirement: Bonding, No MITM, SC, No Keypresses (0x09)
        Max encryption key size: 16
        Initiator key distribution: EncKey IdKey (0x03)
        Responder key distribution: EncKey IdKey (0x03)
< HCI Command: Host Number of Com.. (0x03|0x0035) plen 5  #119 [hci1] 18.113711
        Num handles: 1
        Handle: 19 Address: 64:23:B5:94:C5:F1 (OUI 64-23-B5)
        Count: 1
< ACL Data TX: Handle 19 flags 0x00 dlen 27               #120 [hci1] 18.113762
< ACL Data TX: Handle 19 flags 0x01 dlen 27               #121 [hci1] 18.113771
< ACL Data TX: Handle 19 flags 0x01 dlen 15               #122 [hci1] 18.113785
      SMP: Pairing Public Key (0x0c) len 64
        X: 68f6ada634ce84d11617383d57f070fe3445c38b33b569efa5eb771a0dc8aea5
        Y: 83c407aaa8337331fdc418e55085d75e6c1c6e5d42f8bf9c18fb5a2a7d4f31aa
> HCI Event: Number of Completed Packets (0x13) plen 5    #123 [hci1] 18.174633
        Num handles: 1
        Handle: 19 Address: 64:23:B5:94:C5:F1 (OUI 64-23-B5)
        Count: 1
        #120: len 27 (3 Kb/s)
        Latency: 60 msec (10-60 msec ~43 msec)
> HCI Event: Number of Completed Packets (0x13) plen 5    #124 [hci1] 18.175120
        Num handles: 1
        Handle: 19 Address: 64:23:B5:94:C5:F1 (OUI 64-23-B5)
        Count: 1
        #121: len 27 (3 Kb/s)
        Latency: 61 msec (10-61 msec ~52 msec)
> HCI Event: Number of Completed Packets (0x13) plen 5    #125 [hci1] 18.175603
        Num handles: 1
        Handle: 19 Address: 64:23:B5:94:C5:F1 (OUI 64-23-B5)
        Count: 1
        #122: len 15 (1 Kb/s)
        Latency: 61 msec (10-61 msec ~57 msec)
> ACL Data RX: Handle 19 flags 0x02 dlen 27               #126 [hci1] 18.244912
> ACL Data RX: Handle 19 flags 0x01 dlen 27               #127 [hci1] 18.245349
> ACL Data RX: Handle 19 flags 0x01 dlen 15               #128 [hci1] 18.245611
      SMP: Pairing Public Key (0x0c) len 64
        X: 033438b93ffe45de342cbea3d7340dcee5dc69270b5e75de01c684c7ac582fd3
        Y: bdd30ccb4eddb42decba9a23b5ae3298bf065e9757917937a848dcd5ae872cb7
> ACL Data RX: Handle 19 flags 0x02 dlen 21               #129 [hci1] 18.246198
      SMP: Pairing Confirm (0x03) len 16
        Confim value: 4361d2e0ffbece01198ac0b6ac14f9dc
< HCI Command: Host Number of Com.. (0x03|0x0035) plen 5  #130 [hci1] 18.253806
        Num handles: 1
        Handle: 19 Address: 64:23:B5:94:C5:F1 (OUI 64-23-B5)
        Count: 1
< HCI Command: Host Number of Com.. (0x03|0x0035) plen 5  #131 [hci1] 18.253828
        Num handles: 1
        Handle: 19 Address: 64:23:B5:94:C5:F1 (OUI 64-23-B5)
        Count: 1
< HCI Command: Host Number of Com.. (0x03|0x0035) plen 5  #132 [hci1] 18.253901
        Num handles: 1
        Handle: 19 Address: 64:23:B5:94:C5:F1 (OUI 64-23-B5)
        Count: 1
< HCI Command: Host Number of Com.. (0x03|0x0035) plen 5  #133 [hci1] 18.253905
        Num handles: 1
        Handle: 19 Address: 64:23:B5:94:C5:F1 (OUI 64-23-B5)
        Count: 1
< ACL Data TX: Handle 19 flags 0x00 dlen 21               #134 [hci1] 18.253997
      SMP: Pairing Random (0x04) len 16
        Random value: 1ec8845e8286bc235a02440d0c3424a2
> HCI Event: Number of Completed Packets (0x13) plen 5    #135 [hci1] 18.314708
        Num handles: 1
        Handle: 19 Address: 64:23:B5:94:C5:F1 (OUI 64-23-B5)
        Count: 1
        #134: len 21 (2 Kb/s)
        Latency: 60 msec (10-61 msec ~58 msec)
> ACL Data RX: Handle 19 flags 0x02 dlen 21               #136 [hci1] 18.384806
      SMP: Pairing Random (0x04) len 16
        Random value: 0142ff01cade265b0000000000000000
< HCI Command: Host Number of Com.. (0x03|0x0035) plen 5  #137 [hci1] 18.393785
        Num handles: 1
        Handle: 19 Address: 64:23:B5:94:C5:F1 (OUI 64-23-B5)
        Count: 1
< ACL Data TX: Handle 19 flags 0x00 dlen 21               #138 [hci1] 18.393887
      SMP: Pairing DHKey Check (0x0d) len 16
        E: 4835bbacd1b878c00d5e2d54840028c1
> HCI Event: Number of Completed Packets (0x13) plen 5    #139 [hci1] 18.454717
        Num handles: 1
        Handle: 19 Address: 64:23:B5:94:C5:F1 (OUI 64-23-B5)
        Count: 1
        #138: len 21 (2 Kb/s)
        Latency: 60 msec (10-61 msec ~59 msec)
> ACL Data RX: Handle 19 flags 0x02 dlen 21               #140 [hci1] 18.664830
      SMP: Pairing DHKey Check (0x0d) len 16
        E: b3f824e9370a88473e827020b5e5eb55
< HCI Command: LE Start Encryption (0x08|0x0019) plen 28  #141 [hci1] 18.673837
        Handle: 19 Address: 64:23:B5:94:C5:F1 (OUI 64-23-B5)
        Random number: 0x0000000000000000
        Encrypted diversifier: 0x0000
        Long term key: eb7d2bbc0895be82c2712b33e717dfd9
> HCI Event: Command Status (0x0f) plen 4                 #142 [hci1] 18.674806
      LE Start Encryption (0x08|0x0019) ncmd 1
        Status: Success (0x00)
< HCI Command: Host Number of Com.. (0x03|0x0035) plen 5  #143 [hci1] 18.693659
        Num handles: 1
        Handle: 19 Address: 64:23:B5:94:C5:F1 (OUI 64-23-B5)
        Count: 1
> HCI Event: Encryption Change (0x08) plen 4              #144 [hci1] 19.154584
        Status: Success (0x00)
        Handle: 19 Address: 64:23:B5:94:C5:F1 (OUI 64-23-B5)
        Encryption: Enabled with AES-CCM (0x01)
> ACL Data RX: Handle 19 flags 0x02 dlen 21               #145 [hci1] 19.224890
      SMP: Identity Information (0x08) len 16
        Identity resolving key: e65b4ac5ec5f3b39fe263897281851bb
< HCI Command: Host Number of Com.. (0x03|0x0035) plen 5  #146 [hci1] 19.233736
        Num handles: 1
        Handle: 19 Address: 64:23:B5:94:C5:F1 (OUI 64-23-B5)
        Count: 1
> ACL Data RX: Handle 19 flags 0x02 dlen 12               #147 [hci1] 19.294749
      SMP: Identity Address Information (0x09) len 7
        Address: 64:23:B5:94:C5:F1 (OUI 64-23-B5)
< HCI Command: LE Set Address Res.. (0x08|0x002d) plen 1  #148 [hci1] 19.313832
        Address resolution: Disabled (0x00)
> HCI Event: Command Complete (0x0e) plen 4               #149 [hci1] 19.314254
      LE Set Address Resolution Enable (0x08|0x002d) ncmd 1
        Status: Success (0x00)
< HCI Command: LE Extended Creat.. (0x08|0x0043) plen 26  #150 [hci1] 19.333708
        Filter policy: Accept list is not used (0x00)
        Own address type: Random (0x03)
        Peer address type: Public (0x00)
        Peer address: B8:7C:99:F9:E0:AE (OUI B8-7C-99)
        Initiating PHYs: 0x01
        Entry 0: LE 1M
          Scan interval: 60.000 msec (0x0060)
          Scan window: 60.000 msec (0x0060)
          Min connection interval: 50.00 msec (0x0028)
          Max connection interval: 70.00 msec (0x0038)
          Connection latency: 0 (0x0000)
          Supervision timeout: 4000 msec (0x0190)
          Min connection length: 0.000 msec (0x0000)
          Max connection length: 0.000 msec (0x0000)
> HCI Event: Command Status (0x0f) plen 4                 #151 [hci1] 19.334891
      LE Extended Create Connection (0x08|0x0043) ncmd 1
        Status: Success (0x00)
> HCI Event: LE Meta Event (0x3e) plen 31                 #152 [hci1] 19.346167
      LE Enhanced Connection Complete (0x0a)
        Status: Success (0x00)
        Handle: 20
        Role: Central (0x00)
        Peer address type: Public (0x00)
        Peer address: B8:7C:99:F9:E0:AE (OUI B8-7C-99)
        Local resolvable private address: 48:61:8E:DB:C6:F9 (Resolvable)
          Identity type: Random (0x01)
          Identity: D5:B6:CC:31:DB:3B (Static)
        Peer resolvable private address: 00:00:00:00:00:00 (Non-Resolvable)
        Connection interval: 70.00 msec (0x0038)
        Connection latency: 0 (0x0000)
        Supervision timeout: 4000 msec (0x0190)
        Central clock accuracy: 0x00
< HCI Command: LE Add Device To... (0x08|0x0027) plen 39  #153 [hci1] 19.353808
        Address type: Public (0x00)
        Address: 64:23:B5:94:C5:F1 (OUI 64-23-B5)
        Peer identity resolving key: e65b4ac5ec5f3b39fe263897281851bb
        Local identity resolving key: 08aad2e1be87e47b88aeb19de6889efb
> HCI Event: Command Complete (0x0e) plen 4               #154 [hci1] 19.354715
      LE Add Device To Resolving List (0x08|0x0027) ncmd 1
        Status: Success (0x00)
< HCI Command: LE Set Privacy Mode (0x08|0x004e) plen 8   #155 [hci1] 19.373704
        Peer Identity address type: Public (0x00)
        Peer Identity address: 64:23:B5:94:C5:F1 (OUI 64-23-B5)
        Privacy Mode: Use Device Privacy (0x01)
> HCI Event: Command Complete (0x0e) plen 4               #156 [hci1] 19.374212
      LE Set Privacy Mode (0x08|0x004e) ncmd 1
        Status: Success (0x00)
< HCI Command: LE Set Address Res.. (0x08|0x002d) plen 1  #157 [hci1] 19.393677
        Address resolution: Enabled (0x01)
> HCI Event: Command Complete (0x0e) plen 4               #158 [hci1] 19.394116
      LE Set Address Resolution Enable (0x08|0x002d) ncmd 1
        Status: Success (0x00)
< HCI Command: Host Number of Com.. (0x03|0x0035) plen 5  #159 [hci1] 19.413673
        Num handles: 1
        Handle: 19 Address: 64:23:B5:94:C5:F1 (OUI 64-23-B5)
        Count: 1
< ACL Data TX: Handle 19 flags 0x00 dlen 21               #160 [hci1] 19.413814
      SMP: Identity Information (0x08) len 16
        Identity resolving key: 08aad2e1be87e47b88aeb19de6889efb
< HCI Command: LE Read Remote Use.. (0x08|0x0016) plen 2  #161 [hci1] 19.413877
        Handle: 20 Address: B8:7C:99:F9:E0:AE (OUI B8-7C-99)
< ACL Data TX: Handle 19 flags 0x00 dlen 12               #162 [hci1] 19.413882
      SMP: Identity Address Information (0x09) len 7
        Address: D5:B6:CC:31:DB:3B (Static)
< ACL Data TX: Handle 20 flags 0x00 dlen 7                #163 [hci1] 19.413892
      ATT: Exchange MTU Request (0x02) len 2
        Client RX MTU: 251
> HCI Event: Command Status (0x0f) plen 4                 #164 [hci1] 19.414624
      LE Read Remote Used Features (0x08|0x0016) ncmd 1
        Status: Success (0x00)
< HCI Command: LE Set PHY (0x08|0x0032) plen 7            #165 [hci1] 19.433701
        Handle: 20 Address: B8:7C:99:F9:E0:AE (OUI B8-7C-99)
        All PHYs preference: 0x00
        TX PHYs preference: 0x02
          LE 2M
        RX PHYs preference: 0x02
          LE 2M
        PHY options preference: Reserved (0x0000)
> HCI Event: Command Status (0x0f) plen 4                 #166 [hci1] 19.434230
      LE Set PHY (0x08|0x0032) ncmd 1
        Status: Success (0x00)
> HCI Event: Number of Completed Packets (0x13) plen 5    #167 [hci1] 19.434511
        Num handles: 1
        Handle: 19 Address: 64:23:B5:94:C5:F1 (OUI 64-23-B5)
        Count: 1
        #160: len 21 (8 Kb/s)
        Latency: 20 msec (10-61 msec ~40 msec)
> HCI Event: Number of Completed Packets (0x13) plen 5    #168 [hci1] 19.435074
        Num handles: 1
        Handle: 19 Address: 64:23:B5:94:C5:F1 (OUI 64-23-B5)
        Count: 1
        #162: len 12 (4 Kb/s)
        Latency: 21 msec (10-61 msec ~30 msec)
< ACL Data TX: Handle 19 flags 0x00 dlen 11               #169 [hci1] 19.453896
      ATT: Read By Type Request (0x08) len 6
        Handle range: 0x000f-0xffff
        Attribute type: Central Address Resolution (0x2aa6)
> HCI Event: Number of Completed Packets (0x13) plen 5    #170 [hci1] 19.464687
        Num handles: 1
        Handle: 20 Address: B8:7C:99:F9:E0:AE (OUI B8-7C-99)
        Count: 1
        #163: len 7 (1 Kb/s)
        Latency: 50 msec (50-50 msec ~50 msec)
> HCI Event: Number of Completed Packets (0x13) plen 5    #171 [hci1] 19.504562
        Num handles: 1
        Handle: 19 Address: 64:23:B5:94:C5:F1 (OUI 64-23-B5)
        Count: 1
        #169: len 11 (1 Kb/s)
        Latency: 50 msec (10-61 msec ~40 msec)
> ACL Data RX: Handle 20 flags 0x02 dlen 7                #172 [hci1] 19.534723
      ATT: Exchange MTU Response (0x03) len 2
        Server RX MTU: 23
< HCI Command: Host Number of Com.. (0x03|0x0035) plen 5  #173 [hci1] 19.553724
        Num handles: 1
        Handle: 20 Address: B8:7C:99:F9:E0:AE (OUI B8-7C-99)
        Count: 1
> ACL Data RX: Handle 19 flags 0x02 dlen 9                #174 [hci1] 19.574732
      ATT: Read By Type Response (0x09) len 4
        Attribute data length: 3
        Attribute data list: 1 entry
        Handle: 0x000f
        Value: 01
< HCI Command: Host Number of Com.. (0x03|0x0035) plen 5  #175 [hci1] 19.593794
        Num handles: 1
        Handle: 19 Address: 64:23:B5:94:C5:F1 (OUI 64-23-B5)
        Count: 1
> HCI Event: LE Meta Event (0x3e) plen 12                 #176 [hci1] 19.604861
      LE Read Remote Used Features (0x04)
        Status: Success (0x00)
        Handle: 20 Address: B8:7C:99:F9:E0:AE (OUI B8-7C-99)
        Features: 0x2d 0x49 0x00 0xf7 0x67 0xd8 0x00 0x00
          LE Encryption
          Extended Reject Indication
          Peripheral-initiated Features Exchange
          LE Data Packet Length Extension
          LE 2M PHY
          LE Coded PHY
          Channel Selection Algorithm #2
          Periodic Advertising Sync Transfer - Sender
          Periodic Advertising Sync Transfer - Recipient
          Sleep Clock Accuracy Updates
          Connected Isochronous Stream - Central
          Connected Isochronous Stream - Peripheral
          Isochronous Broadcaster
          Synchronized Receiver
          Connected Isochronous Stream (Host Support)
          LE Power Control Request
          LE Power Control Request
          Connection Subrating
          Connection Subrating (Host Support)
          Unknown features (0x0000d80000000000)
> HCI Event: LE Meta Event (0x3e) plen 6                  #177 [hci1] 20.304134
      LE PHY Update Complete (0x0c)
        Status: Success (0x00)
        Handle: 20 Address: B8:7C:99:F9:E0:AE (OUI B8-7C-99)
        TX PHY: LE 2M (0x02)
        RX PHY: LE 2M (0x02)
< ACL Data TX: Handle 20 flags 0x00 dlen 11               #178 [hci1] 29.563915
      SMP: Pairing Request (0x01) len 6
        IO capability: NoInputNoOutput (0x03)
        OOB data: Authentication data not present (0x00)
        Authentication requirement: Bonding, No MITM, SC, No Keypresses (0x09)
        Max encryption key size: 16
        Initiator key distribution: EncKey IdKey (0x03)
        Responder key distribution: EncKey IdKey (0x03)
> HCI Event: Number of Completed Packets (0x13) plen 5    #179 [hci1] 29.614396
        Num handles: 1
        Handle: 20 Address: B8:7C:99:F9:E0:AE (OUI B8-7C-99)
        Count: 1
        #178: len 11 (1 Kb/s)
        Latency: 50 msec (50-50 msec ~50 msec)
> ACL Data RX: Handle 20 flags 0x02 dlen 11               #180 [hci1] 29.684565
      SMP: Pairing Response (0x02) len 6
        IO capability: KeyboardDisplay (0x04)
        OOB data: Authentication data not present (0x00)
        Authentication requirement: Bonding, No MITM, SC, No Keypresses (0x09)
        Max encryption key size: 16
        Initiator key distribution: EncKey IdKey (0x03)
        Responder key distribution: EncKey IdKey (0x03)
< HCI Command: Host Number of Com.. (0x03|0x0035) plen 5  #181 [hci1] 29.693921
        Num handles: 1
        Handle: 20 Address: B8:7C:99:F9:E0:AE (OUI B8-7C-99)
        Count: 1
< ACL Data TX: Handle 20 flags 0x00 dlen 27               #182 [hci1] 29.694013
< ACL Data TX: Handle 20 flags 0x01 dlen 27               #183 [hci1] 29.694016
< ACL Data TX: Handle 20 flags 0x01 dlen 15               #184 [hci1] 29.694016
      SMP: Pairing Public Key (0x0c) len 64
        X: 68f6ada634ce84d11617383d57f070fe3445c38b33b569efa5eb771a0dc8aea5
        Y: 83c407aaa8337331fdc418e55085d75e6c1c6e5d42f8bf9c18fb5a2a7d4f31aa
> HCI Event: Number of Completed Packets (0x13) plen 5    #185 [hci1] 29.754444
        Num handles: 1
        Handle: 20 Address: B8:7C:99:F9:E0:AE (OUI B8-7C-99)
        Count: 1
        #182: len 27 (3 Kb/s)
        Latency: 60 msec (50-60 msec ~55 msec)
> HCI Event: Number of Completed Packets (0x13) plen 5    #186 [hci1] 29.754873
        Num handles: 1
        Handle: 20 Address: B8:7C:99:F9:E0:AE (OUI B8-7C-99)
        Count: 1
        #183: len 27 (3 Kb/s)
        Latency: 60 msec (50-60 msec ~58 msec)
> HCI Event: Number of Completed Packets (0x13) plen 5    #187 [hci1] 29.755384
        Num handles: 1
        Handle: 20 Address: B8:7C:99:F9:E0:AE (OUI B8-7C-99)
        Count: 1
        #184: len 15 (1 Kb/s)
        Latency: 61 msec (50-61 msec ~59 msec)
> ACL Data RX: Handle 20 flags 0x02 dlen 27               #188 [hci1] 29.824660
> ACL Data RX: Handle 20 flags 0x01 dlen 27               #189 [hci1] 29.825123
> ACL Data RX: Handle 20 flags 0x01 dlen 15               #190 [hci1] 29.825431
      SMP: Pairing Public Key (0x0c) len 64
        X: 9dd7338412b15fb4ab6c83b6a9191a40b57632f35019e92798171d2d504d8f38
        Y: 981baaf35313bfc1be3b71436c84d9d3704adcb778d28e2c231c7596ffc4d52c
> ACL Data RX: Handle 20 flags 0x02 dlen 21               #191 [hci1] 29.826096
      SMP: Pairing Confirm (0x03) len 16
        Confim value: 7701df96347edd1854ee6d43d85d830d
< HCI Command: Host Number of Com.. (0x03|0x0035) plen 5  #192 [hci1] 29.834008
        Num handles: 1
        Handle: 20 Address: B8:7C:99:F9:E0:AE (OUI B8-7C-99)
        Count: 1
< HCI Command: Host Number of Com.. (0x03|0x0035) plen 5  #193 [hci1] 29.834116
        Num handles: 1
        Handle: 20 Address: B8:7C:99:F9:E0:AE (OUI B8-7C-99)
        Count: 1
< HCI Command: Host Number of Com.. (0x03|0x0035) plen 5  #194 [hci1] 29.834134
        Num handles: 1
        Handle: 20 Address: B8:7C:99:F9:E0:AE (OUI B8-7C-99)
        Count: 1
< HCI Command: Host Number of Com.. (0x03|0x0035) plen 5  #195 [hci1] 29.834221
        Num handles: 1
        Handle: 20 Address: B8:7C:99:F9:E0:AE (OUI B8-7C-99)
        Count: 1
< ACL Data TX: Handle 20 flags 0x00 dlen 21               #196 [hci1] 29.834231
      SMP: Pairing Random (0x04) len 16
        Random value: fd71a45c4a1bcadd27bd58e945097b00
> HCI Event: Number of Completed Packets (0x13) plen 5    #197 [hci1] 29.894414
        Num handles: 1
        Handle: 20 Address: B8:7C:99:F9:E0:AE (OUI B8-7C-99)
        Count: 1
        #196: len 21 (2 Kb/s)
        Latency: 60 msec (50-61 msec ~59 msec)
> ACL Data RX: Handle 20 flags 0x02 dlen 21               #198 [hci1] 29.964594
      SMP: Pairing Random (0x04) len 16
        Random value: 90069fc0abf120c30000000000000000
< HCI Command: Host Number of Com.. (0x03|0x0035) plen 5  #199 [hci1] 29.973926
        Num handles: 1
        Handle: 20 Address: B8:7C:99:F9:E0:AE (OUI B8-7C-99)
        Count: 1
< ACL Data TX: Handle 20 flags 0x00 dlen 21               #200 [hci1] 29.974015
      SMP: Pairing DHKey Check (0x0d) len 16
        E: f341bd0bb93a63a3c4c012f55c89c5c4
> HCI Event: Number of Completed Packets (0x13) plen 5    #201 [hci1] 30.034426
        Num handles: 1
        Handle: 20 Address: B8:7C:99:F9:E0:AE (OUI B8-7C-99)
        Count: 1
        #200: len 21 (2 Kb/s)
        Latency: 60 msec (50-61 msec ~60 msec)
> ACL Data RX: Handle 20 flags 0x02 dlen 21               #202 [hci1] 30.314641
      SMP: Pairing DHKey Check (0x0d) len 16
        E: 0a0dce9e29e8a27c0cd0ff5445d89c90
< HCI Command: LE Start Encryption (0x08|0x0019) plen 28  #203 [hci1] 30.334025
        Handle: 20 Address: B8:7C:99:F9:E0:AE (OUI B8-7C-99)
        Random number: 0x0000000000000000
        Encrypted diversifier: 0x0000
        Long term key: 6c8d5fc87b5aaf6d412c9ee764a8ee2e
> HCI Event: Command Status (0x0f) plen 4                 #204 [hci1] 30.334858
      LE Start Encryption (0x08|0x0019) ncmd 1
        Status: Success (0x00)
< HCI Command: Host Number of Com.. (0x03|0x0035) plen 5  #205 [hci1] 30.353794
        Num handles: 1
        Handle: 20 Address: B8:7C:99:F9:E0:AE (OUI B8-7C-99)
        Count: 1
> HCI Event: Encryption Change (0x08) plen 4              #206 [hci1] 30.804328
        Status: Success (0x00)
        Handle: 20 Address: B8:7C:99:F9:E0:AE (OUI B8-7C-99)
        Encryption: Enabled with AES-CCM (0x01)
> ACL Data RX: Handle 20 flags 0x02 dlen 21               #207 [hci1] 30.874567
      SMP: Identity Information (0x08) len 16
        Identity resolving key: 33e522a2e871b481cb8a64c34d6dc6bf
< HCI Command: Host Number of Com.. (0x03|0x0035) plen 5  #208 [hci1] 30.893880
        Num handles: 1
        Handle: 20 Address: B8:7C:99:F9:E0:AE (OUI B8-7C-99)
        Count: 1
> ACL Data RX: Handle 20 flags 0x02 dlen 12               #209 [hci1] 30.944503
      SMP: Identity Address Information (0x09) len 7
        Address: B8:7C:99:F9:E0:AE (OUI B8-7C-99)
< HCI Command: LE Set Address Res.. (0x08|0x002d) plen 1  #210 [hci1] 30.954012
        Address resolution: Disabled (0x00)
> HCI Event: Command Complete (0x0e) plen 4               #211 [hci1] 30.954435
      LE Set Address Resolution Enable (0x08|0x002d) ncmd 1
        Status: Success (0x00)
< HCI Command: LE Add Device To... (0x08|0x0027) plen 39  #212 [hci1] 30.973838
        Address type: Public (0x00)
        Address: B8:7C:99:F9:E0:AE (OUI B8-7C-99)
        Peer identity resolving key: 33e522a2e871b481cb8a64c34d6dc6bf
        Local identity resolving key: 08aad2e1be87e47b88aeb19de6889efb
