Bluetooth monitor ver 5.72
= Note: Linux version 6.14.0-36-generic (x86_64)                       0.970147
= Note: Bluetooth subsystem version 2.22                               0.970149
= New Index: 00:00:00:00:00:00 (Primary,UART,hci1)              [hci1] 0.970150
= New Index: 48:5F:99:8E:E0:64 (Primary,USB,hci0)               [hci0] 0.970151
= Open Index: 00:00:00:00:00:00                                 [hci1] 1.483952
= Index Info: 00:00:00:00:00:00 (Nordic Semiconductor ASA)      [hci1] 1.483971
@ USER Open: main (privileged) version 2.22            {0x0001} [hci1] 1.483979
< HCI Command: Reset (0x03|0x0003) plen 0                    #1 [hci1] 1.485223
> HCI Event: Command Complete (0x0e) plen 4                  #2 [hci1] 1.485747
      Reset (0x03|0x0003) ncmd 1
        Status: Success (0x00)
< HCI Command: Read Local Supported... (0x04|0x0003) plen 0  #3 [hci1] 1.503672
> HCI Event: Command Complete (0x0e) plen 12                 #4 [hci1] 1.504261
      Read Local Supported Features (0x04|0x0003) ncmd 1
        Status: Success (0x00)
        Features: 0x00 0x00 0x00 0x00 0x60 0x00 0x00 0x00
          BR/EDR Not Supported
          LE Supported (Controller)
< HCI Command: Read Local Version In.. (0x04|0x0001) plen 0  #5 [hci1] 1.523432
> HCI Event: Command Complete (0x0e) plen 12                 #6 [hci1] 1.523951
      Read Local Version Information (0x04|0x0001) ncmd 1
        Status: Success (0x00)
        HCI version: Reserved (0x0f) - Revision 12393 (0x3069)
        LMP version: Reserved (0x0f) - Subversion 12393 (0x3069)
        Manufacturer: Nordic Semiconductor ASA (89)
< HCI Command: Read Local Supported... (0x04|0x0002) plen 0  #7 [hci1] 1.543346
> HCI Event: Command Complete (0x0e) plen 68                 #8 [hci1] 1.544409
      Read Local Supported Commands (0x04|0x0002) ncmd 1
        Status: Success (0x00)
        Commands: 119 entries
          Disconnect (Octet 0 - Bit 5)
          Read Remote Version Information (Octet 2 - Bit 7)
          Set Event Mask (Octet 5 - Bit 6)
          Reset (Octet 5 - Bit 7)
          Read Connection Accept Timeout (Octet 7 - Bit 2)
          Write Connection Accept Timeout (Octet 7 - Bit 3)
          Read Transmit Power Level (Octet 10 - Bit 2)
          Set Controller To Host Flow Control (Octet 10 - Bit 5)
          Host Buffer Size (Octet 10 - Bit 6)
          Host Number of Completed Packets (Octet 10 - Bit 7)
          Read Local Version Information (Octet 14 - Bit 3)
          Read Local Supported Features (Octet 14 - Bit 5)
          Read BD ADDR (Octet 15 - Bit 1)
          Read RSSI (Octet 15 - Bit 5)
          Set Event Mask Page 2 (Octet 22 - Bit 2)
          LE Set Event Mask (Octet 25 - Bit 0)
          LE Read Buffer Size (Octet 25 - Bit 1)
          LE Read Local Supported Features (Octet 25 - Bit 2)
          LE Set Random Address (Octet 25 - Bit 4)
          LE Set Advertising Parameters (Octet 25 - Bit 5)
          LE Read Advertising Channel TX Power (Octet 25 - Bit 6)
          LE Set Advertising Data (Octet 25 - Bit 7)
          LE Set Scan Response Data (Octet 26 - Bit 0)
          LE Set Advertise Enable (Octet 26 - Bit 1)
          LE Set Scan Parameters (Octet 26 - Bit 2)
          LE Set Scan Enable (Octet 26 - Bit 3)
          LE Create Connection (Octet 26 - Bit 4)
          LE Create Connection Cancel (Octet 26 - Bit 5)
          LE Read Accept List Size (Octet 26 - Bit 6)
          LE Clear Accept List (Octet 26 - Bit 7)
          LE Add Device To Accept List (Octet 27 - Bit 0)
          LE Remove Device From Accept List (Octet 27 - Bit 1)
          LE Connection Update (Octet 27 - Bit 2)
          LE Set Host Channel Classification (Octet 27 - Bit 3)
          LE Read Channel Map (Octet 27 - Bit 4)
          LE Read Remote Used Features (Octet 27 - Bit 5)
          LE Encrypt (Octet 27 - Bit 6)
          LE Rand (Octet 27 - Bit 7)
          LE Start Encryption (Octet 28 - Bit 0)
          LE Long Term Key Request Reply (Octet 28 - Bit 1)
          LE Long Term Key Request Neg Reply (Octet 28 - Bit 2)
          LE Read Supported States (Octet 28 - Bit 3)
          LE Receiver Test (Octet 28 - Bit 4)
          LE Transmitter Test (Octet 28 - Bit 5)
          LE Test End (Octet 28 - Bit 6)
          Read Authenticated Payload Timeout (Octet 32 - Bit 4)
          Write Authenticated Payload Timeout (Octet 32 - Bit 5)
          LE Set Data Length (Octet 33 - Bit 6)
          LE Read Suggested Default Data Length (Octet 33 - Bit 7)
          LE Write Suggested Default Data Length (Octet 34 - Bit 0)
          LE Add Device To Resolving List (Octet 34 - Bit 3)
          LE Remove Device From Resolving List (Octet 34 - Bit 4)
          LE Clear Resolving List (Octet 34 - Bit 5)
          LE Read Resolving List Size (Octet 34 - Bit 6)
          LE Set Address Resolution Enable (Octet 35 - Bit 1)
          LE Set Resolvable Private Address Timeout (Octet 35 - Bit 2)
          LE Read Maximum Data Length (Octet 35 - Bit 3)
          LE Read PHY (Octet 35 - Bit 4)
          LE Set Default PHY (Octet 35 - Bit 5)
          LE Set PHY (Octet 35 - Bit 6)
          LE Enhanced Receiver Test (Octet 35 - Bit 7)
          LE Enhanced Transmitter Test (Octet 36 - Bit 0)
          LE Set Advertising Set Random Address (Octet 36 - Bit 1)
          LE Set Extended Advertising Parameters (Octet 36 - Bit 2)
          LE Set Extended Advertising Data (Octet 36 - Bit 3)
          LE Set Extended Scan Response Data (Octet 36 - Bit 4)
          LE Set Extended Advertising Enable (Octet 36 - Bit 5)
          LE Read Maximum Advertising Data Length (Octet 36 - Bit 6)
          LE Read Number of Supported Advertising Sets (Octet 36 - Bit 7)
          LE Remove Advertising Set (Octet 37 - Bit 0)
          LE Clear Advertising Sets (Octet 37 - Bit 1)
          LE Set Periodic Advertising Parameters (Octet 37 - Bit 2)
          LE Set Periodic Advertising Data (Octet 37 - Bit 3)
          LE Set Periodic Advertising Enable (Octet 37 - Bit 4)
          LE Set Extended Scan Parameters (Octet 37 - Bit 5)
          LE Set Extended Scan Enable (Octet 37 - Bit 6)
          LE Extended Create Connection (Octet 37 - Bit 7)
          LE Periodic Advertising Create Sync (Octet 38 - Bit 0)
          LE Periodic Advertising Create Sync Cancel (Octet 38 - Bit 1)
          LE Periodic Advertising Terminate Sync (Octet 38 - Bit 2)
          LE Add Device To Periodic Advertiser List (Octet 38 - Bit 3)
          LE Remove Device From Periodic Advertiser List (Octet 38 - Bit 4)
          LE Clear Periodic Advertiser List (Octet 38 - Bit 5)
          LE Read Periodic Advertiser List Size (Octet 38 - Bit 6)
          LE Read Transmit Power (Octet 38 - Bit 7)
          LE Read RF Path Compensation (Octet 39 - Bit 0)
          LE Write RF Path Compensation (Octet 39 - Bit 1)
          LE Set Privacy Mode (Octet 39 - Bit 2)
          LE Periodic Advertising Receive Enable (Octet 40 - Bit 5)
          LE Periodic Advertising Sync Transfer (Octet 40 - Bit 6)
          LE Periodic Advertising Set Info Transfer (Octet 40 - Bit 7)
          LE Periodic Advertising Sync Transfer Parameters (Octet 41 - Bit 0)
          LE Set Default Periodic Advertisng Sync Transfer Parameters (Octet 41 - Bit 1)
          LE Read Buffer v2 (Octet 41 - Bit 5)
          LE Read ISO TX Sync (Octet 41 - Bit 6)
          LE Set Connected Isochronous Group Parameters (Octet 41 - Bit 7)
          LE Set Connected Isochronous Group Parameters Test (Octet 42 - Bit 0)
          LE Create Connected Isochronous Stream (Octet 42 - Bit 1)
          LE Remove Connected Isochronous Group (Octet 42 - Bit 2)
          LE Accept Connected Isochronous Stream Request (Octet 42 - Bit 3)
          LE Reject Connected Isochronous Stream Request (Octet 42 - Bit 4)
          LE Create Broadcast Isochronous Group (Octet 42 - Bit 5)
          LE Create Broadcast Isochronous Group Test (Octet 42 - Bit 6)
          LE Terminate Broadcast Isochronous Group (Octet 42 - Bit 7)
          LE Broadcast Isochronous Group Create Sync (Octet 43 - Bit 0)
          LE Broadcast Isochronous Group Terminate Sync (Octet 43 - Bit 1)
          LE Request Peer SCA (Octet 43 - Bit 2)
          LE Setup Isochronous Data Path (Octet 43 - Bit 3)
          LE Remove Isochronous Data Path (Octet 43 - Bit 4)
          LE Isochronous Transmit Test (Octet 43 - Bit 5)
          LE Isochronous Receive Test (Octet 43 - Bit 6)
          LE Isochronous Read Test Counters (Octet 43 - Bit 7)
          LE Isochronous Read Test Counters (Octet 44 - Bit 0)
          LE Set Host Feature (Octet 44 - Bit 1)
          Octet 44 - Bit 2 
          Octet 45 - Bit 6 
          Octet 46 - Bit 0 
          Octet 46 - Bit 1 
          Octet 46 - Bit 2 
< HCI Command: Host Buffer Size (0x03|0x0033) plen 7         #9 [hci1] 1.563342
        ACL MTU: 255  ACL max packet: 16
        SCO MTU: 0    SCO max packet: 0
> HCI Event: Command Complete (0x0e) plen 4                 #10 [hci1] 1.563893
      Host Buffer Size (0x03|0x0033) ncmd 1
        Status: Success (0x00)
< HCI Command: Set Controller To Ho.. (0x03|0x0031) plen 1  #11 [hci1] 1.583313
        Flow control: ACL Data Packets (0x01)
> HCI Event: Command Complete (0x0e) plen 4                 #12 [hci1] 1.583877
      Set Controller To Host Flow Control (0x03|0x0031) ncmd 1
        Status: Success (0x00)
< HCI Command: LE Read Local Suppor.. (0x08|0x0003) plen 0  #13 [hci1] 1.603335
> HCI Event: Command Complete (0x0e) plen 12                #14 [hci1] 1.603884
      LE Read Local Supported Features (0x08|0x0003) ncmd 1
        Status: Success (0x00)
        Features: 0xfd 0x79 0x00 0xf7 0x30 0x01 0x00 0x00
          LE Encryption
          Extended Reject Indication
          Peripheral-initiated Features Exchange
          LE Ping
          LE Data Packet Length Extension
          LL Privacy
          Extended Scanner Filter Policies
          LE 2M PHY
          LE Coded PHY
          LE Extended Advertising
          LE Periodic Advertising
          Channel Selection Algorithm #2
          Periodic Advertising Sync Transfer - Sender
          Periodic Advertising Sync Transfer - Recipient
          Sleep Clock Accuracy Updates
          Connected Isochronous Stream - Central
          Connected Isochronous Stream - Peripheral
          Isochronous Broadcaster
          Synchronized Receiver
          Periodic Advertising ADI support
          Connection Subrating
          Unknown features (0x0000010000000000)
< HCI Command: LE Set Host Feature (0x08|0x0074) plen 2     #15 [hci1] 1.623343
        Bit Number: 32
          Connected Isochronous Stream (Host Support)
        Bit Value: 1
> HCI Event: Command Complete (0x0e) plen 4                 #16 [hci1] 1.623784
      LE Set Host Feature (0x08|0x0074) ncmd 1
        Status: Success (0x00)
< HCI Command: LE Read Buffer v2 (0x08|0x0060) plen 0       #17 [hci1] 1.643341
> HCI Event: Command Complete (0x0e) plen 10                #18 [hci1] 1.643822
      LE Read Buffer v2 (0x08|0x0060) ncmd 1
        Status: Success (0x00)
        ACL MTU: 27
        ACL max packet: 3
        ISO MTU: 318
        ISO max packet: 3
< HCI Command: LE Read Maximum Adve.. (0x08|0x003a) plen 0  #19 [hci1] 1.663367
> HCI Event: Command Complete (0x0e) plen 6                 #20 [hci1] 1.663822
      LE Read Maximum Advertising Data Length (0x08|0x003a) ncmd 1
        Status: Success (0x00)
        Max length: 1650
< HCI Command: LE Read Supported St.. (0x08|0x001c) plen 0  #21 [hci1] 1.683358
> HCI Event: Command Complete (0x0e) plen 12                #22 [hci1] 1.683880
      LE Read Supported States (0x08|0x001c) ncmd 1
        Status: Success (0x00)
        States: 0x000003ff3e0306ff
          Non-connectable Advertising State
          Scannable Advertising State
          Connectable Advertising State
          High Duty Cycle Directed Advertising State
          Passive Scanning State
          Active Scanning State
          Initiating State
            and Connection State (Central Role)
          Connection State (Peripheral Role)
          Scannable Advertising State
            and Passive Scanning State
          Connectable Advertising State
            and Passive Scanning State
          Non-connectable Advertising State
            and Initiating State
          Scannable Advertising State
            and Initiating State
          Active Scanning State
            and Connection State (Central Role)
          Passive Scanning State
            and Connection State (Peripheral Role)
          Active Scanning State
            and Connection State (Peripheral Role)
          Initiating State
            and Connection State (Central Role)
            and Central Role & Central Role
          Low Duty Cycle Directed Advertising State
          Connectable Advertising State
            and Initiating State
            and Central Role & Peripheral Role
          High Duty Cycle Directed Advertising State
            and Initiating State
            and Central Role & Peripheral Role
          Low Duty Cycle Directed Advertising State
            and Initiating State
            and Central Role & Peripheral Role
          Connectable Advertising State
            and Connection State (Central Role)
            and Central Role & Peripheral Role
          High Duty Cycle Directed Advertising State
            and Connection State (Central Role)
            and Central Role & Peripheral Role
          Low Duty Cycle Directed Advertising State
            and Connection State (Central Role)
            and Central Role & Peripheral Role
          Connectable Advertising State
            and Connection State (Peripheral Role)
            and Central Role & Peripheral Role
          High Duty Cycle Directed Advertising State
            and Connection State (Peripheral Role)
            and Peripheral Role & Peripheral Role
          Low Duty Cycle Directed Advertising State
            and Connection State (Peripheral Role)
            and Peripheral Role & Peripheral Role
          Initiating State
            and Connection State (Peripheral Role)
            and Central Role & Peripheral Role
< HCI Command: LE Read Maximum Data.. (0x08|0x002f) plen 0  #23 [hci1] 1.703342
> HCI Event: Command Complete (0x0e) plen 12                #24 [hci1] 1.703860
      LE Read Maximum Data Length (0x08|0x002f) ncmd 1
        Status: Success (0x00)
        Max TX octets: 251
        Max TX time: 2704
        Max RX octets: 251
        Max RX time: 2704
< HCI Command: LE Write Suggested D.. (0x08|0x0024) plen 4  #25 [hci1] 1.723329
        TX octets: 251
        TX time: 2704
> HCI Event: Command Complete (0x0e) plen 4                 #26 [hci1] 1.723810
      LE Write Suggested Default Data Length (0x08|0x0024) ncmd 1
        Status: Success (0x00)
< HCI Command: LE Read Resolving Li.. (0x08|0x002a) plen 0  #27 [hci1] 1.743316
> HCI Event: Command Complete (0x0e) plen 5                 #28 [hci1] 1.743704
      LE Read Resolving List Size (0x08|0x002a) ncmd 1
        Status: Success (0x00)
        Size: 8
< HCI Command: LE Set Event Mask (0x08|0x0001) plen 8       #29 [hci1] 1.763340
        Mask: 0x000002023f87fa5e
          LE Advertising Report
          LE Connection Update Complete
          LE Read Remote Used Features Complete
          LE Long Term Key Request
          LE Data Length Change
          LE Enhanced Connection Complete
          LE PHY Update Complete
          LE Extended Advertising Report
          LE Periodic Advertising Sync Established
          LE Periodic Advertising Report
          LE Periodic Advertising Sync Lost
          LE Extended Scan Timeout
          LE Extended Advertising Set Terminated
          LE Scan Request Received
          LE Periodic Advertising Sync Transfer Rvc
          LE CIS Established
          LE CIS Request
          LE Create BIG Complete
          LE Terminate BIG Complete
          LE BIG Sync Estabilished Complete
          LE BIG Sync Lost
          LE BIG Info Advertising Report
          Unknown mask (0x0000020000000000)
> HCI Event: Command Complete (0x0e) plen 4                 #30 [hci1] 1.763802
      LE Set Event Mask (0x08|0x0001) ncmd 1
        Status: Success (0x00)
< HCI Command: Set Event Mask (0x03|0x0001) plen 8          #31 [hci1] 1.783350
        Mask: 0x2000800002008890
          Disconnection Complete
          Encryption Change
          Read Remote Version Information Complete
          Hardware Error
          Data Buffer Overflow
          Encryption Key Refresh Complete
          LE Meta
> HCI Event: Command Complete (0x0e) plen 4                 #32 [hci1] 1.783909
      Set Event Mask (0x03|0x0001) ncmd 1
        Status: Success (0x00)
< HCI Command: Read BD ADDR (0x04|0x0009) plen 0            #33 [hci1] 1.803347
> HCI Event: Command Complete (0x0e) plen 10                #34 [hci1] 1.803921
      Read BD ADDR (0x04|0x0009) ncmd 1
        Status: Success (0x00)
        Address: 00:00:00:00:00:00 (OUI 00-00-00)
< HCI Command: LE Set Random Address (0x08|0x0005) plen 6   #35 [hci1] 1.823385
        Address: D5:B6:CC:31:DB:3B (Static)
> HCI Event: Command Complete (0x0e) plen 4                 #36 [hci1] 1.823851
      LE Set Random Address (0x08|0x0005) ncmd 1
        Status: Success (0x00)
< HCI Command: LE Set Extended Adv.. (0x08|0x0036) plen 25  #37 [hci1] 4.253861
        Handle: 0x00
        Properties: 0x0013
          Connectable
          Scannable
          Use legacy advertising PDUs: ADV_IND
        Min advertising interval: 100.000 msec (0x00a0)
        Max advertising interval: 150.000 msec (0x00f0)
        Channel map: 37, 38, 39 (0x07)
        Own address type: Random (0x01)
        Peer address type: Public (0x00)
        Peer address: 00:00:00:00:00:00 (OUI 00-00-00)
        Filter policy: Allow Scan Request from Any, Allow Connect Request from Any (0x00)
        TX power: Host has no preference (0x7f)
        Primary PHY: LE 1M (0x01)
        Secondary max skip: 0x00
        Secondary PHY: LE 1M (0x01)
        SID: 0x00
        Scan request notifications: Disabled (0x00)
> HCI Event: Command Complete (0x0e) plen 5                 #38 [hci1] 4.254667
      LE Set Extended Advertising Parameters (0x08|0x0036) ncmd 1
        Status: Success (0x00)
        TX power (selected): 0 dbm (0x00)
< HCI Command: LE Set Advertising S.. (0x08|0x0035) plen 7  #39 [hci1] 4.263310
        Advertising handle: 0x00
        Advertising random address: D5:B6:CC:31:DB:3B (Static)
> HCI Event: Command Complete (0x0e) plen 4                 #40 [hci1] 4.263811
      LE Set Advertising Set Random Address (0x08|0x0035) ncmd 1
        Status: Success (0x00)
< HCI Command: LE Set Extended Adv.. (0x08|0x0037) plen 22  #41 [hci1] 4.283344
        Handle: 0x00
        Operation: Complete extended advertising data (0x03)
        Fragment preference: Minimize fragmentation (0x01)
        Data length: 0x12
        Flags: 0x06
          LE General Discoverable Mode
          BR/EDR Not Supported
        Name (complete): Tester_F6B11A
> HCI Event: Command Complete (0x0e) plen 4                 #42 [hci1] 4.284043
      LE Set Extended Advertising Data (0x08|0x0037) ncmd 1
        Status: Success (0x00)
< HCI Command: LE Set Extended Scan.. (0x08|0x0038) plen 4  #43 [hci1] 4.303346
        Handle: 0x00
        Operation: Complete scan response data (0x03)
        Fragment preference: Minimize fragmentation (0x01)
        Data length: 0x00
> HCI Event: Command Complete (0x0e) plen 4                 #44 [hci1] 4.303821
      LE Set Extended Scan Response Data (0x08|0x0038) ncmd 1
        Status: Success (0x00)
< HCI Command: LE Set Extended Adve.. (0x08|0x0039) plen 6  #45 [hci1] 4.323373
        Extended advertising: Enabled (0x01)
        Number of sets: 1 (0x01)
        Entry 0
          Handle: 0x00
          Duration: 0 ms (0x00)
          Max ext adv events: 0
> HCI Event: Command Complete (0x0e) plen 4                 #46 [hci1] 4.323945
      LE Set Extended Advertising Enable (0x08|0x0039) ncmd 1
        Status: Success (0x00)
> HCI Event: LE Meta Event (0x3e) plen 31                   #47 [hci1] 4.441402
      LE Enhanced Connection Complete (0x0a)
        Status: Success (0x00)
        Handle: 327
        Role: Peripheral (0x01)
        Peer address type: Public (0x00)
        Peer address: DF:A9:FF:F6:B1:1A (OUI DF-A9-FF)
        Local resolvable private address: 00:00:00:00:00:00 (Non-Resolvable)
        Peer resolvable private address: 00:00:00:00:00:00 (Non-Resolvable)
        Connection interval: 87.50 msec (0x0046)
        Connection latency: 0 (0x0000)
        Supervision timeout: 25120 msec (0x09d0)
        Central clock accuracy: 0x01
> HCI Event: LE Meta Event (0x3e) plen 6                    #48 [hci1] 4.441537
      LE Advertising Set Terminated (0x12)
        Status: Success (0x00)
        Handle: 0
        Connection handle: 327
        Number of completed extended advertising events: 0
< HCI Command: LE Read Remote Used... (0x08|0x0016) plen 2  #49 [hci1] 4.444379
        Handle: 327 Address: DF:A9:FF:F6:B1:1A (OUI DF-A9-FF)
< ACL Data TX: Handle 327 flags 0x00 dlen 7                 #50 [hci1] 4.444399
      ATT: Exchange MTU Request (0x02) len 2
        Client RX MTU: 251
> HCI Event: Command Status (0x0f) plen 4                   #51 [hci1] 4.444928
      LE Read Remote Used Features (0x08|0x0016) ncmd 1
        Status: Success (0x00)
> HCI Event: Number of Completed Packets (0x13) plen 5      #52 [hci1] 4.617309
        Num handles: 1
        Handle: 327 Address: DF:A9:FF:F6:B1:1A (OUI DF-A9-FF)
        Count: 1
        #50: len 7 (0 Kb/s)
        Latency: 172 msec (172-172 msec ~172 msec)
> HCI Event: LE Meta Event (0x3e) plen 12                   #53 [hci1] 4.705297
      LE Read Remote Used Features (0x04)
        Status: Success (0x00)
        Handle: 327 Address: DF:A9:FF:F6:B1:1A (OUI DF-A9-FF)
        Features: 0x2d 0x49 0x00 0xf7 0x67 0xd8 0x00 0x00
          LE Encryption
          Extended Reject Indication
          Peripheral-initiated Features Exchange
          LE Data Packet Length Extension
          LE 2M PHY
          LE Coded PHY
          Channel Selection Algorithm #2
          Periodic Advertising Sync Transfer - Sender
          Periodic Advertising Sync Transfer - Recipient
          Sleep Clock Accuracy Updates
          Connected Isochronous Stream - Central
          Connected Isochronous Stream - Peripheral
          Isochronous Broadcaster
          Synchronized Receiver
          Connected Isochronous Stream (Host Support)
          LE Power Control Request
          LE Power Control Request
          Connection Subrating
          Connection Subrating (Host Support)
          Unknown features (0x0000d80000000000)
> ACL Data RX: Handle 327 flags 0x02 dlen 11                #54 [hci1] 7.154963
      SMP: Pairing Request (0x01) len 6
        IO capability: KeyboardDisplay (0x04)
        OOB data: Authentication data not present (0x00)
        Authentication requirement: Bonding, MITM, SC, No Keypresses (0x0d)
        Max encryption key size: 16
        Initiator key distribution: EncKey IdKey (0x03)
        Responder key distribution: EncKey IdKey Sign (0x07)
> ACL Data RX: Handle 327 flags 0x02 dlen 7                 #55 [hci1] 7.155391
      ATT: Exchange MTU Response (0x03) len 2
        Server RX MTU: 23
< HCI Command: Host Number of Compl.. (0x03|0x0035) plen 5  #56 [hci1] 7.163899
        Num handles: 1
        Handle: 327 Address: DF:A9:FF:F6:B1:1A (OUI DF-A9-FF)
        Count: 1
< ACL Data TX: Handle 327 flags 0x00 dlen 11                #57 [hci1] 7.164127
      SMP: Pairing Response (0x02) len 6
        IO capability: DisplayOnly (0x00)
        OOB data: Authentication data not present (0x00)
        Authentication requirement: Bonding, No MITM, SC, No Keypresses (0x09)
        Max encryption key size: 16
        Initiator key distribution: IdKey (0x02)
        Responder key distribution: <none> (0x00)
< HCI Command: Host Number of Compl.. (0x03|0x0035) plen 5  #58 [hci1] 7.164287
        Num handles: 1
        Handle: 327 Address: DF:A9:FF:F6:B1:1A (OUI DF-A9-FF)
        Count: 1
> HCI Event: Number of Completed Packets (0x13) plen 5      #59 [hci1] 7.330080
        Num handles: 1
        Handle: 327 Address: DF:A9:FF:F6:B1:1A (OUI DF-A9-FF)
        Count: 1
        #57: len 11 (0 Kb/s)
        Latency: 165 msec (165-172 msec ~169 msec)
> ACL Data RX: Handle 327 flags 0x02 dlen 27                #60 [hci1] 7.330293
> ACL Data RX: Handle 327 flags 0x01 dlen 27                #61 [hci1] 7.330914
> ACL Data RX: Handle 327 flags 0x01 dlen 15                #62 [hci1] 7.331338
      SMP: Pairing Public Key (0x0c) len 64
        X: 7f8771c5550fffee46478404028fdb811cc88716f7a46779c16796d4a9dd4693
        Y: 89a45d9e22519c88498088cd23899cb1a7734a7df6862d2a9da8451acaa2740e
< HCI Command: Host Number of Compl.. (0x03|0x0035) plen 5  #63 [hci1] 7.344316
        Num handles: 1
        Handle: 327 Address: DF:A9:FF:F6:B1:1A (OUI DF-A9-FF)
        Count: 1
< HCI Command: Host Number of Compl.. (0x03|0x0035) plen 5  #64 [hci1] 7.344466
        Num handles: 1
        Handle: 327 Address: DF:A9:FF:F6:B1:1A (OUI DF-A9-FF)
        Count: 1
< HCI Command: Host Number of Compl.. (0x03|0x0035) plen 5  #65 [hci1] 7.344787
        Num handles: 1
        Handle: 327 Address: DF:A9:FF:F6:B1:1A (OUI DF-A9-FF)
        Count: 1
< ACL Data TX: Handle 327 flags 0x00 dlen 27                #66 [hci1] 7.345011
< ACL Data TX: Handle 327 flags 0x01 dlen 27                #67 [hci1] 7.345028
< ACL Data TX: Handle 327 flags 0x01 dlen 15                #68 [hci1] 7.345030
      SMP: Pairing Public Key (0x0c) len 64
        X: 98308440221e2d910f0e54b71e7ec652857aa9b5a0dc65028824cc19db1226e9
        Y: 67a4816bcb62efb21701e31fdb27561a6217575fb007a8bbdabe7e28b6f68482
> HCI Event: Number of Completed Packets (0x13) plen 5      #69 [hci1] 7.418010
        Num handles: 1
        Handle: 327 Address: DF:A9:FF:F6:B1:1A (OUI DF-A9-FF)
        Count: 1
        #66: len 27 (3 Kb/s)
        Latency: 72 msec (72-172 msec ~121 msec)
> HCI Event: Number of Completed Packets (0x13) plen 5      #70 [hci1] 7.418594
        Num handles: 1
        Handle: 327 Address: DF:A9:FF:F6:B1:1A (OUI DF-A9-FF)
        Count: 1
        #67: len 27 (2 Kb/s)
        Latency: 73 msec (72-172 msec ~97 msec)
> HCI Event: Number of Completed Packets (0x13) plen 5      #71 [hci1] 7.504859
        Num handles: 1
        Handle: 327 Address: DF:A9:FF:F6:B1:1A (OUI DF-A9-FF)
        Count: 1
        #68: len 15 (0 Kb/s)
        Latency: 159 msec (72-172 msec ~128 msec)
> ACL Data RX: Handle 327 flags 0x02 dlen 21                #72 [hci1] 8.467630
      SMP: Pairing Confirm (0x03) len 16
        Confim value: 57d5340f0142336290fd7402b73b56ec
< HCI Command: Host Number of Compl.. (0x03|0x0035) plen 5  #73 [hci1] 8.483589
        Num handles: 1
        Handle: 327 Address: DF:A9:FF:F6:B1:1A (OUI DF-A9-FF)
        Count: 1
< ACL Data TX: Handle 327 flags 0x00 dlen 21                #74 [hci1] 8.483701
      SMP: Pairing Confirm (0x03) len 16
        Confim value: 02ea5abeaafe41673aecab1e010d09ae
> HCI Event: Number of Completed Packets (0x13) plen 5      #75 [hci1] 8.642393
        Num handles: 1
        Handle: 327 Address: DF:A9:FF:F6:B1:1A (OUI DF-A9-FF)
        Count: 1
        #74: len 21 (1 Kb/s)
        Latency: 158 msec (72-172 msec ~143 msec)
> ACL Data RX: Handle 327 flags 0x02 dlen 21                #76 [hci1] 8.642807
      SMP: Pairing Random (0x04) len 16
        Random value: 78ae8a3a6965feba0000000000000000
< HCI Command: Host Number of Compl.. (0x03|0x0035) plen 5  #77 [hci1] 8.644172
        Num handles: 1
        Handle: 327 Address: DF:A9:FF:F6:B1:1A (OUI DF-A9-FF)
        Count: 1
< ACL Data TX: Handle 327 flags 0x00 dlen 21                #78 [hci1] 8.644280
      SMP: Pairing Random (0x04) len 16
        Random value: 8e6108f966a694cbe26df70bb96773e6
> HCI Event: Number of Completed Packets (0x13) plen 5      #79 [hci1] 8.817269
        Num handles: 1
        Handle: 327 Address: DF:A9:FF:F6:B1:1A (OUI DF-A9-FF)
        Count: 1
        #78: len 21 (0 Kb/s)
        Latency: 172 msec (72-172 msec ~158 msec)
> ACL Data RX: Handle 327 flags 0x02 dlen 21                #80 [hci1] 8.905093
      SMP: Pairing Confirm (0x03) len 16
        Confim value: 0c679a366d93621f3d851adb8a82a1e4
< HCI Command: Host Number of Compl.. (0x03|0x0035) plen 5  #81 [hci1] 8.923640
        Num handles: 1
        Handle: 327 Address: DF:A9:FF:F6:B1:1A (OUI DF-A9-FF)
        Count: 1
< ACL Data TX: Handle 327 flags 0x00 dlen 21                #82 [hci1] 8.923771
      SMP: Pairing Confirm (0x03) len 16
        Confim value: 06442e63cb8f2773d3c02bb39fc766df
> HCI Event: Number of Completed Packets (0x13) plen 5      #83 [hci1] 9.079937
        Num handles: 1
        Handle: 327 Address: DF:A9:FF:F6:B1:1A (OUI DF-A9-FF)
        Count: 1
        #82: len 21 (1 Kb/s)
        Latency: 156 msec (72-172 msec ~157 msec)
> ACL Data RX: Handle 327 flags 0x02 dlen 21                #84 [hci1] 9.080323
      SMP: Pairing Random (0x04) len 16
        Random value: 0bb1b419b118aaad0000000000000000
< HCI Command: Host Number of Compl.. (0x03|0x0035) plen 5  #85 [hci1] 9.083973
        Num handles: 1
        Handle: 327 Address: DF:A9:FF:F6:B1:1A (OUI DF-A9-FF)
        Count: 1
< ACL Data TX: Handle 327 flags 0x00 dlen 21                #86 [hci1] 9.083996
      SMP: Pairing Random (0x04) len 16
        Random value: 4d02679f89a05211af56d8b3da64d21e
> HCI Event: Number of Completed Packets (0x13) plen 5      #87 [hci1] 9.254775
        Num handles: 1
        Handle: 327 Address: DF:A9:FF:F6:B1:1A (OUI DF-A9-FF)
        Count: 1
        #86: len 21 (0 Kb/s)
        Latency: 170 msec (72-172 msec ~164 msec)
> ACL Data RX: Handle 327 flags 0x02 dlen 21                #88 [hci1] 9.342712
      SMP: Pairing Confirm (0x03) len 16
        Confim value: 7da32633e4595638a28cfe665917f2dc
< HCI Command: Host Number of Compl.. (0x03|0x0035) plen 5  #89 [hci1] 9.343694
        Num handles: 1
        Handle: 327 Address: DF:A9:FF:F6:B1:1A (OUI DF-A9-FF)
        Count: 1
< ACL Data TX: Handle 327 flags 0x00 dlen 21                #90 [hci1] 9.343884
      SMP: Pairing Confirm (0x03) len 16
        Confim value: 29679fa23a9d36fe434384bc8a452d26
> HCI Event: Number of Completed Packets (0x13) plen 5      #91 [hci1] 9.517451
        Num handles: 1
        Handle: 327 Address: DF:A9:FF:F6:B1:1A (OUI DF-A9-FF)
        Count: 1
        #90: len 21 (0 Kb/s)
        Latency: 173 msec (72-173 msec ~168 msec)
> ACL Data RX: Handle 327 flags 0x02 dlen 21                #92 [hci1] 9.517702
      SMP: Pairing Random (0x04) len 16
        Random value: 8f7601a75ce406ca0000000000000000
< HCI Command: Host Number of Compl.. (0x03|0x0035) plen 5  #93 [hci1] 9.524181
        Num handles: 1
        Handle: 327 Address: DF:A9:FF:F6:B1:1A (OUI DF-A9-FF)
        Count: 1
< ACL Data TX: Handle 327 flags 0x00 dlen 21                #94 [hci1] 9.524292
      SMP: Pairing Random (0x04) len 16
        Random value: 5e8286bc235a02440d0c3424a2acf8fd
> HCI Event: Number of Completed Packets (0x13) plen 5      #95 [hci1] 9.692196
        Num handles: 1
        Handle: 327 Address: DF:A9:FF:F6:B1:1A (OUI DF-A9-FF)
        Count: 1
        #94: len 21 (1 Kb/s)
        Latency: 167 msec (72-173 msec ~168 msec)
> ACL Data RX: Handle 327 flags 0x02 dlen 21                #96 [hci1] 9.780147
      SMP: Pairing Confirm (0x03) len 16
        Confim value: 29297cea67ac627ad14f373e590ead55
< HCI Command: Host Number of Compl.. (0x03|0x0035) plen 5  #97 [hci1] 9.783463
        Num handles: 1
        Handle: 327 Address: DF:A9:FF:F6:B1:1A (OUI DF-A9-FF)
        Count: 1
< ACL Data TX: Handle 327 flags 0x00 dlen 21                #98 [hci1] 9.783574
      SMP: Pairing Confirm (0x03) len 16
        Confim value: 8ae82a8b41c3d37b6d1c4a648c1c321a
> HCI Event: Number of Completed Packets (0x13) plen 5      #99 [hci1] 9.954864
        Num handles: 1
        Handle: 327 Address: DF:A9:FF:F6:B1:1A (OUI DF-A9-FF)
        Count: 1
        #98: len 21 (0 Kb/s)
        Latency: 171 msec (72-173 msec ~169 msec)
> ACL Data RX: Handle 327 flags 0x02 dlen 21               #100 [hci1] 9.955291
      SMP: Pairing Random (0x04) len 16
        Random value: 53f881ac604afc0d0000000000000000
< HCI Command: Host Number of Comp.. (0x03|0x0035) plen 5  #101 [hci1] 9.964042
        Num handles: 1
        Handle: 327 Address: DF:A9:FF:F6:B1:1A (OUI DF-A9-FF)
        Count: 1
< ACL Data TX: Handle 327 flags 0x00 dlen 21               #102 [hci1] 9.964187
      SMP: Pairing Random (0x04) len 16
        Random value: 5c4a1bcadd27bd58e945097b00bad7ac
> HCI Event: Number of Completed Packets (0x13) plen 5    #103 [hci1] 10.129647
        Num handles: 1
        Handle: 327 Address: DF:A9:FF:F6:B1:1A (OUI DF-A9-FF)
        Count: 1
        #102: len 21 (1 Kb/s)
        Latency: 165 msec (72-173 msec ~167 msec)
> ACL Data RX: Handle 327 flags 0x02 dlen 21              #104 [hci1] 10.217496
      SMP: Pairing Confirm (0x03) len 16
        Confim value: fb93f6e59a90efcdfe7e69f736b62160
< HCI Command: Host Number of Com.. (0x03|0x0035) plen 5  #105 [hci1] 10.223921
        Num handles: 1
        Handle: 327 Address: DF:A9:FF:F6:B1:1A (OUI DF-A9-FF)
        Count: 1
< ACL Data TX: Handle 327 flags 0x00 dlen 21              #106 [hci1] 10.224163
      SMP: Pairing Confirm (0x03) len 16
        Confim value: 8198708a6974e2eaaca0b7a26abfc757
> HCI Event: Number of Completed Packets (0x13) plen 5    #107 [hci1] 10.392409
        Num handles: 1
        Handle: 327 Address: DF:A9:FF:F6:B1:1A (OUI DF-A9-FF)
        Count: 1
        #106: len 21 (1 Kb/s)
        Latency: 168 msec (72-173 msec ~167 msec)
> ACL Data RX: Handle 327 flags 0x02 dlen 21              #108 [hci1] 10.392684
      SMP: Pairing Random (0x04) len 16
        Random value: cc5d305e059549210000000000000000
< HCI Command: Host Number of Com.. (0x03|0x0035) plen 5  #109 [hci1] 10.404119
        Num handles: 1
        Handle: 327 Address: DF:A9:FF:F6:B1:1A (OUI DF-A9-FF)
        Count: 1
< ACL Data TX: Handle 327 flags 0x00 dlen 21              #110 [hci1] 10.404192
      SMP: Pairing Random (0x04) len 16
        Random value: 32527e6e64e79f33b2e374394db8ab2d
> HCI Event: Number of Completed Packets (0x13) plen 5    #111 [hci1] 10.567241
        Num handles: 1
        Handle: 327 Address: DF:A9:FF:F6:B1:1A (OUI DF-A9-FF)
        Count: 1
        #110: len 21 (1 Kb/s)
        Latency: 163 msec (72-173 msec ~165 msec)
> ACL Data RX: Handle 327 flags 0x02 dlen 21              #112 [hci1] 10.655018
      SMP: Pairing Confirm (0x03) len 16
        Confim value: 4b850503bcb5b308f229af9d0c571251
< HCI Command: Host Number of Com.. (0x03|0x0035) plen 5  #113 [hci1] 10.663645
        Num handles: 1
        Handle: 327 Address: DF:A9:FF:F6:B1:1A (OUI DF-A9-FF)
        Count: 1
< ACL Data TX: Handle 327 flags 0x00 dlen 21              #114 [hci1] 10.663808
      SMP: Pairing Confirm (0x03) len 16
        Confim value: 7e603a8ce4ceb26ba32b8a1ad6724bfd
> HCI Event: Number of Completed Packets (0x13) plen 5    #115 [hci1] 10.829822
        Num handles: 1
        Handle: 327 Address: DF:A9:FF:F6:B1:1A (OUI DF-A9-FF)
        Count: 1
        #114: len 21 (1 Kb/s)
        Latency: 166 msec (72-173 msec ~165 msec)
> ACL Data RX: Handle 327 flags 0x02 dlen 21              #116 [hci1] 10.830168
      SMP: Pairing Random (0x04) len 16
        Random value: 21486a422151f0d70000000000000000
< HCI Command: Host Number of Com.. (0x03|0x0035) plen 5  #117 [hci1] 10.844178
        Num handles: 1
        Handle: 327 Address: DF:A9:FF:F6:B1:1A (OUI DF-A9-FF)
        Count: 1
< ACL Data TX: Handle 327 flags 0x00 dlen 21              #118 [hci1] 10.844288
      SMP: Pairing Random (0x04) len 16
        Random value: dddbdfe2838e9a8cc6964353c850fef7
> HCI Event: Number of Completed Packets (0x13) plen 5    #119 [hci1] 11.004688
        Num handles: 1
        Handle: 327 Address: DF:A9:FF:F6:B1:1A (OUI DF-A9-FF)
        Count: 1
        #118: len 21 (1 Kb/s)
        Latency: 160 msec (72-173 msec ~163 msec)
> ACL Data RX: Handle 327 flags 0x02 dlen 21              #120 [hci1] 11.092540
      SMP: Pairing Confirm (0x03) len 16
        Confim value: eaee4ee306aa5ef60958300e08dd9a12
< HCI Command: Host Number of Com.. (0x03|0x0035) plen 5  #121 [hci1] 11.103663
        Num handles: 1
        Handle: 327 Address: DF:A9:FF:F6:B1:1A (OUI DF-A9-FF)
        Count: 1
< ACL Data TX: Handle 327 flags 0x00 dlen 21              #122 [hci1] 11.103776
      SMP: Pairing Confirm (0x03) len 16
        Confim value: 95e54a9f1a9f8bf433c6b346cf4f1672
> HCI Event: Number of Completed Packets (0x13) plen 5    #123 [hci1] 11.267334
        Num handles: 1
        Handle: 327 Address: DF:A9:FF:F6:B1:1A (OUI DF-A9-FF)
        Count: 1
        #122: len 21 (1 Kb/s)
        Latency: 163 msec (72-173 msec ~163 msec)
> ACL Data RX: Handle 327 flags 0x02 dlen 21              #124 [hci1] 11.267677
      SMP: Pairing Random (0x04) len 16
        Random value: 337812d2c3ac06470000000000000000
< HCI Command: Host Number of Com.. (0x03|0x0035) plen 5  #125 [hci1] 11.284176
        Num handles: 1
        Handle: 327 Address: DF:A9:FF:F6:B1:1A (OUI DF-A9-FF)
        Count: 1
< ACL Data TX: Handle 327 flags 0x00 dlen 21              #126 [hci1] 11.284280
      SMP: Pairing Random (0x04) len 16
        Random value: eb9f1915536596b6fc3db1c86b2b1970
> HCI Event: Number of Completed Packets (0x13) plen 5    #127 [hci1] 11.442142
        Num handles: 1
        Handle: 327 Address: DF:A9:FF:F6:B1:1A (OUI DF-A9-FF)
        Count: 1
        #126: len 21 (1 Kb/s)
        Latency: 157 msec (72-173 msec ~160 msec)
> ACL Data RX: Handle 327 flags 0x02 dlen 21              #128 [hci1] 11.530036
      SMP: Pairing Confirm (0x03) len 16
        Confim value: 2ce13cd2da1f68e7ada7cd08c6377a4d
< HCI Command: Host Number of Com.. (0x03|0x0035) plen 5  #129 [hci1] 11.543972
        Num handles: 1
        Handle: 327 Address: DF:A9:FF:F6:B1:1A (OUI DF-A9-FF)
        Count: 1
< ACL Data TX: Handle 327 flags 0x00 dlen 21              #130 [hci1] 11.544188
      SMP: Pairing Confirm (0x03) len 16
        Confim value: 1e5356de5cb172d9fd6fef38de48a86b
> HCI Event: Number of Completed Packets (0x13) plen 5    #131 [hci1] 11.704771
        Num handles: 1
        Handle: 327 Address: DF:A9:FF:F6:B1:1A (OUI DF-A9-FF)
        Count: 1
        #130: len 21 (1 Kb/s)
        Latency: 160 msec (72-173 msec ~160 msec)
> ACL Data RX: Handle 327 flags 0x02 dlen 21              #132 [hci1] 11.705120
      SMP: Pairing Random (0x04) len 16
        Random value: 7fe28c72b27987010000000000000000
< HCI Command: Host Number of Com.. (0x03|0x0035) plen 5  #133 [hci1] 11.724251
        Num handles: 1
        Handle: 327 Address: DF:A9:FF:F6:B1:1A (OUI DF-A9-FF)
        Count: 1
< ACL Data TX: Handle 327 flags 0x00 dlen 21              #134 [hci1] 11.724332
      SMP: Pairing Random (0x04) len 16
        Random value: 5c794dc9ad9f2c3f295ebd5ad5e1c3cf
> HCI Event: Number of Completed Packets (0x13) plen 5    #135 [hci1] 11.879695
        Num handles: 1
        Handle: 327 Address: DF:A9:FF:F6:B1:1A (OUI DF-A9-FF)
        Count: 1
        #134: len 21 (1 Kb/s)
        Latency: 155 msec (72-173 msec ~157 msec)
> ACL Data RX: Handle 327 flags 0x02 dlen 21              #136 [hci1] 11.967495
      SMP: Pairing Confirm (0x03) len 16
        Confim value: 7a66bb29005b49d497b697ebef3b5f7a
< HCI Command: Host Number of Com.. (0x03|0x0035) plen 5  #137 [hci1] 11.983955
        Num handles: 1
        Handle: 327 Address: DF:A9:FF:F6:B1:1A (OUI DF-A9-FF)
        Count: 1
< ACL Data TX: Handle 327 flags 0x00 dlen 21              #138 [hci1] 11.984162
      SMP: Pairing Confirm (0x03) len 16
        Confim value: 1628cdb85bb540a3b7464d5a257d4845
> HCI Event: Number of Completed Packets (0x13) plen 5    #139 [hci1] 12.142361
        Num handles: 1
        Handle: 327 Address: DF:A9:FF:F6:B1:1A (OUI DF-A9-FF)
        Count: 1
        #138: len 21 (1 Kb/s)
        Latency: 158 msec (72-173 msec ~158 msec)
> ACL Data RX: Handle 327 flags 0x02 dlen 21              #140 [hci1] 12.142742
      SMP: Pairing Random (0x04) len 16
        Random value: c8da7333f123ce7c0000000000000000
< HCI Command: Host Number of Com.. (0x03|0x0035) plen 5  #141 [hci1] 12.144098
        Num handles: 1
        Handle: 327 Address: DF:A9:FF:F6:B1:1A (OUI DF-A9-FF)
        Count: 1
< ACL Data TX: Handle 327 flags 0x00 dlen 21              #142 [hci1] 12.144245
      SMP: Pairing Random (0x04) len 16
        Random value: 5c2fff312cdf99c9491988e877355a9a
> HCI Event: Number of Completed Packets (0x13) plen 5    #143 [hci1] 12.317069
        Num handles: 1
        Handle: 327 Address: DF:A9:FF:F6:B1:1A (OUI DF-A9-FF)
        Count: 1
        #142: len 21 (0 Kb/s)
        Latency: 172 msec (72-173 msec ~165 msec)
> ACL Data RX: Handle 327 flags 0x02 dlen 21              #144 [hci1] 12.404917
      SMP: Pairing Confirm (0x03) len 16
        Confim value: 7b658ffd0bf1b31ffbd076f285e4c995
< HCI Command: Host Number of Com.. (0x03|0x0035) plen 5  #145 [hci1] 12.423812
        Num handles: 1
        Handle: 327 Address: DF:A9:FF:F6:B1:1A (OUI DF-A9-FF)
        Count: 1
< ACL Data TX: Handle 327 flags 0x00 dlen 21              #146 [hci1] 12.423971
      SMP: Pairing Confirm (0x03) len 16
        Confim value: 43b6084becefd5d1e1a69bffabc56636
> HCI Event: Number of Completed Packets (0x13) plen 5    #147 [hci1] 12.579861
        Num handles: 1
        Handle: 327 Address: DF:A9:FF:F6:B1:1A (OUI DF-A9-FF)
        Count: 1
        #146: len 21 (1 Kb/s)
        Latency: 155 msec (72-173 msec ~160 msec)
> ACL Data RX: Handle 327 flags 0x02 dlen 21              #148 [hci1] 12.580094
      SMP: Pairing Random (0x04) len 16
        Random value: 6b0c38208a77150e0000000000000000
< HCI Command: Host Number of Com.. (0x03|0x0035) plen 5  #149 [hci1] 12.584096
        Num handles: 1
        Handle: 327 Address: DF:A9:FF:F6:B1:1A (OUI DF-A9-FF)
        Count: 1
< ACL Data TX: Handle 327 flags 0x00 dlen 21              #150 [hci1] 12.584169
      SMP: Pairing Random (0x04) len 16
        Random value: c629a3a987d808e808655d558dfc1155
> HCI Event: Number of Completed Packets (0x13) plen 5    #151 [hci1] 12.754755
        Num handles: 1
        Handle: 327 Address: DF:A9:FF:F6:B1:1A (OUI DF-A9-FF)
        Count: 1
        #150: len 21 (0 Kb/s)
        Latency: 170 msec (72-173 msec ~165 msec)
> ACL Data RX: Handle 327 flags 0x02 dlen 21              #152 [hci1] 12.842459
      SMP: Pairing Confirm (0x03) len 16
        Confim value: 1df5d5cb2f1e4fcebb683da35a780073
< HCI Command: Host Number of Com.. (0x03|0x0035) plen 5  #153 [hci1] 12.843669
        Num handles: 1
        Handle: 327 Address: DF:A9:FF:F6:B1:1A (OUI DF-A9-FF)
        Count: 1
< ACL Data TX: Handle 327 flags 0x00 dlen 21              #154 [hci1] 12.843807
      SMP: Pairing Confirm (0x03) len 16
        Confim value: 361e212e7fa3d39bdc9212565dd3a863
> HCI Event: Number of Completed Packets (0x13) plen 5    #155 [hci1] 13.017372
        Num handles: 1
        Handle: 327 Address: DF:A9:FF:F6:B1:1A (OUI DF-A9-FF)
        Count: 1
        #154: len 21 (0 Kb/s)
        Latency: 173 msec (72-173 msec ~169 msec)
> ACL Data RX: Handle 327 flags 0x02 dlen 21              #156 [hci1] 13.017650
      SMP: Pairing Random (0x04) len 16
        Random value: bdb0cd8d5a28fa6b0000000000000000
< HCI Command: Host Number of Com.. (0x03|0x0035) plen 5  #157 [hci1] 13.024152
        Num handles: 1
        Handle: 327 Address: DF:A9:FF:F6:B1:1A (OUI DF-A9-FF)
        Count: 1
< ACL Data TX: Handle 327 flags 0x00 dlen 21              #158 [hci1] 13.024301
      SMP: Pairing Random (0x04) len 16
        Random value: 92f20f6ad8f13724432c7fd6001c45ff
> HCI Event: Number of Completed Packets (0x13) plen 5    #159 [hci1] 13.192019
        Num handles: 1
        Handle: 327 Address: DF:A9:FF:F6:B1:1A (OUI DF-A9-FF)
        Count: 1
        #158: len 21 (1 Kb/s)
        Latency: 167 msec (72-173 msec ~168 msec)
> ACL Data RX: Handle 327 flags 0x02 dlen 21              #160 [hci1] 13.279908
      SMP: Pairing Confirm (0x03) len 16
        Confim value: 36865ab086cce91e389760198824699a
< HCI Command: Host Number of Com.. (0x03|0x0035) plen 5  #161 [hci1] 13.283914
        Num handles: 1
        Handle: 327 Address: DF:A9:FF:F6:B1:1A (OUI DF-A9-FF)
        Count: 1
< ACL Data TX: Handle 327 flags 0x00 dlen 21              #162 [hci1] 13.284102
      SMP: Pairing Confirm (0x03) len 16
        Confim value: 4680a906abde7d12f3f51964d501e696
> HCI Event: Number of Completed Packets (0x13) plen 5    #163 [hci1] 13.454726
        Num handles: 1
        Handle: 327 Address: DF:A9:FF:F6:B1:1A (OUI DF-A9-FF)
        Count: 1
        #162: len 21 (0 Kb/s)
        Latency: 170 msec (72-173 msec ~169 msec)
> ACL Data RX: Handle 327 flags 0x02 dlen 21              #164 [hci1] 13.455116
      SMP: Pairing Random (0x04) len 16
        Random value: 93077e021271895c0000000000000000
< HCI Command: Host Number of Com.. (0x03|0x0035) plen 5  #165 [hci1] 13.464213
        Num handles: 1
        Handle: 327 Address: DF:A9:FF:F6:B1:1A (OUI DF-A9-FF)
        Count: 1
< ACL Data TX: Handle 327 flags 0x00 dlen 21              #166 [hci1] 13.464235
      SMP: Pairing Random (0x04) len 16
        Random value: 23ac32ebbb5e14c8a6b9622f296d277f
> HCI Event: Number of Completed Packets (0x13) plen 5    #167 [hci1] 13.629551
        Num handles: 1
        Handle: 327 Address: DF:A9:FF:F6:B1:1A (OUI DF-A9-FF)
        Count: 1
        #166: len 21 (1 Kb/s)
        Latency: 165 msec (72-173 msec ~167 msec)
> ACL Data RX: Handle 327 flags 0x02 dlen 21              #168 [hci1] 13.717386
      SMP: Pairing Confirm (0x03) len 16
        Confim value: 41344240ba4bbc1f8ca06abe8a2e2af7
< HCI Command: Host Number of Com.. (0x03|0x0035) plen 5  #169 [hci1] 13.723963
        Num handles: 1
        Handle: 327 Address: DF:A9:FF:F6:B1:1A (OUI DF-A9-FF)
        Count: 1
< ACL Data TX: Handle 327 flags 0x00 dlen 21              #170 [hci1] 13.724163
      SMP: Pairing Confirm (0x03) len 16
        Confim value: 998289012daf8d116882c98c81ef101b
> HCI Event: Number of Completed Packets (0x13) plen 5    #171 [hci1] 13.892329
        Num handles: 1
        Handle: 327 Address: DF:A9:FF:F6:B1:1A (OUI DF-A9-FF)
        Count: 1
        #170: len 21 (1 Kb/s)
        Latency: 168 msec (72-173 msec ~167 msec)
> ACL Data RX: Handle 327 flags 0x02 dlen 21              #172 [hci1] 13.892685
      SMP: Pairing Random (0x04) len 16
        Random value: d56bb69e73a6a7370000000000000000
< HCI Command: Host Number of Com.. (0x03|0x0035) plen 5  #173 [hci1] 13.904083
        Num handles: 1
        Handle: 327 Address: DF:A9:FF:F6:B1:1A (OUI DF-A9-FF)
        Count: 1
< ACL Data TX: Handle 327 flags 0x00 dlen 21              #174 [hci1] 13.904174
      SMP: Pairing Random (0x04) len 16
        Random value: 297efe85e67448a15f56bd27e3a3cf1d
> HCI Event: Number of Completed Packets (0x13) plen 5    #175 [hci1] 14.067059
        Num handles: 1
        Handle: 327 Address: DF:A9:FF:F6:B1:1A (OUI DF-A9-FF)
        Count: 1
        #174: len 21 (1 Kb/s)
        Latency: 162 msec (72-173 msec ~165 msec)
> ACL Data RX: Handle 327 flags 0x02 dlen 21              #176 [hci1] 14.154938
      SMP: Pairing Confirm (0x03) len 16
        Confim value: 28b1d48a0ed18981969209f21b440748
< HCI Command: Host Number of Com.. (0x03|0x0035) plen 5  #177 [hci1] 14.163823
        Num handles: 1
        Handle: 327 Address: DF:A9:FF:F6:B1:1A (OUI DF-A9-FF)
        Count: 1
< ACL Data TX: Handle 327 flags 0x00 dlen 21              #178 [hci1] 14.163993
      SMP: Pairing Confirm (0x03) len 16
        Confim value: 2e7b045cd49b70685a1215fa5f50983a
> HCI Event: Number of Completed Packets (0x13) plen 5    #179 [hci1] 14.329805
        Num handles: 1
        Handle: 327 Address: DF:A9:FF:F6:B1:1A (OUI DF-A9-FF)
        Count: 1
        #178: len 21 (1 Kb/s)
        Latency: 165 msec (72-173 msec ~165 msec)
> ACL Data RX: Handle 327 flags 0x02 dlen 21              #180 [hci1] 14.330143
      SMP: Pairing Random (0x04) len 16
        Random value: b21b261d23885c6b0000000000000000
< HCI Command: Host Number of Com.. (0x03|0x0035) plen 5  #181 [hci1] 14.344214
        Num handles: 1
        Handle: 327 Address: DF:A9:FF:F6:B1:1A (OUI DF-A9-FF)
        Count: 1
< ACL Data TX: Handle 327 flags 0x00 dlen 21              #182 [hci1] 14.344266
      SMP: Pairing Random (0x04) len 16
        Random value: 25a9493fd3ce4faf02be7293595bb7c6
> HCI Event: Number of Completed Packets (0x13) plen 5    #183 [hci1] 14.504525
        Num handles: 1
        Handle: 327 Address: DF:A9:FF:F6:B1:1A (OUI DF-A9-FF)
        Count: 1
        #182: len 21 (1 Kb/s)
        Latency: 160 msec (72-173 msec ~162 msec)
> ACL Data RX: Handle 327 flags 0x02 dlen 21              #184 [hci1] 14.592338
      SMP: Pairing Confirm (0x03) len 16
        Confim value: 3cdfa6f7641e98d23c043d696a5bd720
< HCI Command: Host Number of Com.. (0x03|0x0035) plen 5  #185 [hci1] 14.603636
        Num handles: 1
        Handle: 327 Address: DF:A9:FF:F6:B1:1A (OUI DF-A9-FF)
        Count: 1
< ACL Data TX: Handle 327 flags 0x00 dlen 21              #186 [hci1] 14.603782
      SMP: Pairing Confirm (0x03) len 16
        Confim value: 1ce75ccf6d1494b1409dc07bdd706baf
> HCI Event: Number of Completed Packets (0x13) plen 5    #187 [hci1] 14.767350
        Num handles: 1
        Handle: 327 Address: DF:A9:FF:F6:B1:1A (OUI DF-A9-FF)
        Count: 1
        #186: len 21 (1 Kb/s)
        Latency: 163 msec (72-173 msec ~163 msec)
> ACL Data RX: Handle 327 flags 0x02 dlen 21              #188 [hci1] 14.767560
      SMP: Pairing Random (0x04) len 16
        Random value: 5901fe6a8c3b8ccc0000000000000000
< HCI Command: Host Number of Com.. (0x03|0x0035) plen 5  #189 [hci1] 14.783985
        Num handles: 1
        Handle: 327 Address: DF:A9:FF:F6:B1:1A (OUI DF-A9-FF)
        Count: 1
< ACL Data TX: Handle 327 flags 0x00 dlen 21              #190 [hci1] 14.784146
      SMP: Pairing Random (0x04) len 16
        Random value: 58f6b41f855a6f6c3560debd84e2affc
> HCI Event: Number of Completed Packets (0x13) plen 5    #191 [hci1] 14.942006
        Num handles: 1
        Handle: 327 Address: DF:A9:FF:F6:B1:1A (OUI DF-A9-FF)
        Count: 1
        #190: len 21 (1 Kb/s)
        Latency: 157 msec (72-173 msec ~160 msec)
> ACL Data RX: Handle 327 flags 0x02 dlen 21              #192 [hci1] 15.029900
      SMP: Pairing Confirm (0x03) len 16
        Confim value: bdf1393cb91d1d1313b29f34b136829d
< HCI Command: Host Number of Com.. (0x03|0x0035) plen 5  #193 [hci1] 15.044011
        Num handles: 1
        Handle: 327 Address: DF:A9:FF:F6:B1:1A (OUI DF-A9-FF)
        Count: 1
< ACL Data TX: Handle 327 flags 0x00 dlen 21              #194 [hci1] 15.044300
      SMP: Pairing Confirm (0x03) len 16
        Confim value: 1cc1754c944d180cdcb1bfa766457581
> HCI Event: Number of Completed Packets (0x13) plen 5    #195 [hci1] 15.204776
        Num handles: 1
        Handle: 327 Address: DF:A9:FF:F6:B1:1A (OUI DF-A9-FF)
        Count: 1
        #194: len 21 (1 Kb/s)
        Latency: 160 msec (72-173 msec ~160 msec)
> ACL Data RX: Handle 327 flags 0x02 dlen 21              #196 [hci1] 15.205076
      SMP: Pairing Random (0x04) len 16
        Random value: aad54ad3cd4f15e90000000000000000
< HCI Command: Host Number of Com.. (0x03|0x0035) plen 5  #197 [hci1] 15.224171
        Num handles: 1
        Handle: 327 Address: DF:A9:FF:F6:B1:1A (OUI DF-A9-FF)
        Count: 1
< ACL Data TX: Handle 327 flags 0x00 dlen 21              #198 [hci1] 15.224391
      SMP: Pairing Random (0x04) len 16
        Random value: b67e7216d5bf664139eda2b542549666
> HCI Event: Number of Completed Packets (0x13) plen 5    #199 [hci1] 15.379506
        Num handles: 1
        Handle: 327 Address: DF:A9:FF:F6:B1:1A (OUI DF-A9-FF)
        Count: 1
        #198: len 21 (1 Kb/s)
        Latency: 155 msec (72-173 msec ~157 msec)
> ACL Data RX: Handle 327 flags 0x02 dlen 21              #200 [hci1] 15.467404
      SMP: Pairing Confirm (0x03) len 16
        Confim value: 07014057ea2bc09238802a8477f6995c
< HCI Command: Host Number of Com.. (0x03|0x0035) plen 5  #201 [hci1] 15.483776
        Num handles: 1
        Handle: 327 Address: DF:A9:FF:F6:B1:1A (OUI DF-A9-FF)
        Count: 1
< ACL Data TX: Handle 327 flags 0x00 dlen 21              #202 [hci1] 15.483957
      SMP: Pairing Confirm (0x03) len 16
        Confim value: 202b60212dd6a48335b56c2c0d6b6923
> HCI Event: Number of Completed Packets (0x13) plen 5    #203 [hci1] 15.642276
        Num handles: 1
        Handle: 327 Address: DF:A9:FF:F6:B1:1A (OUI DF-A9-FF)
        Count: 1
        #202: len 21 (1 Kb/s)
        Latency: 158 msec (72-173 msec ~158 msec)
> ACL Data RX: Handle 327 flags 0x02 dlen 21              #204 [hci1] 15.642538
      SMP: Pairing Random (0x04) len 16
        Random value: 05e859f47c7de3b60000000000000000
< HCI Command: Host Number of Com.. (0x03|0x0035) plen 5  #205 [hci1] 15.644047
        Num handles: 1
        Handle: 327 Address: DF:A9:FF:F6:B1:1A (OUI DF-A9-FF)
        Count: 1
< ACL Data TX: Handle 327 flags 0x00 dlen 21              #206 [hci1] 15.644119
      SMP: Pairing Random (0x04) len 16
        Random value: ed17f76500c95219dd01e09d1e63f87b
> HCI Event: Number of Completed Packets (0x13) plen 5    #207 [hci1] 15.817022
        Num handles: 1
        Handle: 327 Address: DF:A9:FF:F6:B1:1A (OUI DF-A9-FF)
        Count: 1
        #206: len 21 (0 Kb/s)
        Latency: 172 msec (72-173 msec ~165 msec)
> ACL Data RX: Handle 327 flags 0x02 dlen 21              #208 [hci1] 15.904848
      SMP: Pairing Confirm (0x03) len 16
        Confim value: 6818e0721b97f6e698bf72a8bd372e13
< HCI Command: Host Number of Com.. (0x03|0x0035) plen 5  #209 [hci1] 15.923795
        Num handles: 1
        Handle: 327 Address: DF:A9:FF:F6:B1:1A (OUI DF-A9-FF)
        Count: 1
< ACL Data TX: Handle 327 flags 0x00 dlen 21              #210 [hci1] 15.923960
      SMP: Pairing Confirm (0x03) len 16
        Confim value: d33f8eea3eb830552f27d4476c3d3354
> HCI Event: Number of Completed Packets (0x13) plen 5    #211 [hci1] 16.079667
        Num handles: 1
        Handle: 327 Address: DF:A9:FF:F6:B1:1A (OUI DF-A9-FF)
        Count: 1
        #210: len 21 (1 Kb/s)
        Latency: 155 msec (72-173 msec ~160 msec)
> ACL Data RX: Handle 327 flags 0x02 dlen 21              #212 [hci1] 16.080049
      SMP: Pairing Random (0x04) len 16
        Random value: daf34585250db6190000000000000000
< HCI Command: Host Number of Com.. (0x03|0x0035) plen 5  #213 [hci1] 16.084068
        Num handles: 1
        Handle: 327 Address: DF:A9:FF:F6:B1:1A (OUI DF-A9-FF)
        Count: 1
< ACL Data TX: Handle 327 flags 0x00 dlen 21              #214 [hci1] 16.084121
      SMP: Pairing Random (0x04) len 16
        Random value: 81d35d47e1f6006d79c974bd9d9e1ee3
> HCI Event: Number of Completed Packets (0x13) plen 5    #215 [hci1] 16.254409
        Num handles: 1
        Handle: 327 Address: DF:A9:FF:F6:B1:1A (OUI DF-A9-FF)
        Count: 1
        #214: len 21 (0 Kb/s)
        Latency: 170 msec (72-173 msec ~165 msec)
> ACL Data RX: Handle 327 flags 0x02 dlen 21              #216 [hci1] 16.342279
      SMP: Pairing Confirm (0x03) len 16
        Confim value: 4523bcef696b0573e0eb19aa36ab17ab
< HCI Command: Host Number of Com.. (0x03|0x0035) plen 5  #217 [hci1] 16.344092
        Num handles: 1
        Handle: 327 Address: DF:A9:FF:F6:B1:1A (OUI DF-A9-FF)
        Count: 1
< ACL Data TX: Handle 327 flags 0x00 dlen 21              #218 [hci1] 16.344309
      SMP: Pairing Confirm (0x03) len 16
        Confim value: 57965cbc6606139e9487f6318f748655
> HCI Event: Number of Completed Packets (0x13) plen 5    #219 [hci1] 16.517297
        Num handles: 1
        Handle: 327 Address: DF:A9:FF:F6:B1:1A (OUI DF-A9-FF)
        Count: 1
        #218: len 21 (0 Kb/s)
        Latency: 172 msec (72-173 msec ~169 msec)
> ACL Data RX: Handle 327 flags 0x02 dlen 21              #220 [hci1] 16.517443
      SMP: Pairing Random (0x04) len 16
        Random value: bf9150ac2b8fef320000000000000000
< HCI Command: Host Number of Com.. (0x03|0x0035) plen 5  #221 [hci1] 16.524191
        Num handles: 1
        Handle: 327 Address: DF:A9:FF:F6:B1:1A (OUI DF-A9-FF)
        Count: 1
< ACL Data TX: Handle 327 flags 0x00 dlen 21              #222 [hci1] 16.524347
      SMP: Pairing Random (0x04) len 16
        Random value: e7f7e0c2476823e41736a7e381bafb7c
> HCI Event: Number of Completed Packets (0x13) plen 5    #223 [hci1] 16.691989
        Num handles: 1
        Handle: 327 Address: DF:A9:FF:F6:B1:1A (OUI DF-A9-FF)
        Count: 1
        #222: len 21 (1 Kb/s)
        Latency: 167 msec (72-173 msec ~168 msec)
> ACL Data RX: Handle 327 flags 0x02 dlen 21              #224 [hci1] 16.779833
      SMP: Pairing Confirm (0x03) len 16
        Confim value: 4f517e5f8f23a8176bfc3a6f0adf6b68
< HCI Command: Host Number of Com.. (0x03|0x0035) plen 5  #225 [hci1] 16.783791
        Num handles: 1
        Handle: 327 Address: DF:A9:FF:F6:B1:1A (OUI DF-A9-FF)
        Count: 1
< ACL Data TX: Handle 327 flags 0x00 dlen 21              #226 [hci1] 16.783889
      SMP: Pairing Confirm (0x03) len 16
        Confim value: c297cbc696c0737c47950caa9ac35962
> HCI Event: Number of Completed Packets (0x13) plen 5    #227 [hci1] 16.954708
        Num handles: 1
        Handle: 327 Address: DF:A9:FF:F6:B1:1A (OUI DF-A9-FF)
        Count: 1
        #226: len 21 (0 Kb/s)
        Latency: 170 msec (72-173 msec ~169 msec)
> ACL Data RX: Handle 327 flags 0x02 dlen 21              #228 [hci1] 16.954945
      SMP: Pairing Random (0x04) len 16
        Random value: 138952323ed81fab0000000000000000
< HCI Command: Host Number of Com.. (0x03|0x0035) plen 5  #229 [hci1] 16.964172
        Num handles: 1
        Handle: 327 Address: DF:A9:FF:F6:B1:1A (OUI DF-A9-FF)
        Count: 1
