Bluetooth monitor ver 5.72
= Note: Linux version 6.14.0-36-generic (x86_64)                       0.377525
= Note: Bluetooth subsystem version 2.22                               0.377527
= New Index: 00:00:00:00:00:00 (Primary,UART,hci1)              [hci1] 0.377528
= New Index: 48:5F:99:8E:E0:64 (Primary,USB,hci0)               [hci0] 0.377528
= Open Index: 00:00:00:00:00:00                                 [hci1] 0.491435
= Index Info: 00:00:00:00:00:00 (Nordic Semiconductor ASA)      [hci1] 0.491451
@ USER Open: main (privileged) version 2.22            {0x0001} [hci1] 0.491460
< HCI Command: Reset (0x03|0x0003) plen 0                    #1 [hci1] 0.492766
> HCI Event: Command Complete (0x0e) plen 4                  #2 [hci1] 0.493312
      Reset (0x03|0x0003) ncmd 1
        Status: Success (0x00)
< HCI Command: Read Local Supported... (0x04|0x0003) plen 0  #3 [hci1] 0.511155
> HCI Event: Command Complete (0x0e) plen 12                 #4 [hci1] 0.511715
      Read Local Supported Features (0x04|0x0003) ncmd 1
        Status: Success (0x00)
        Features: 0x00 0x00 0x00 0x00 0x60 0x00 0x00 0x00
          BR/EDR Not Supported
          LE Supported (Controller)
< HCI Command: Read Local Version In.. (0x04|0x0001) plen 0  #5 [hci1] 0.530836
> HCI Event: Command Complete (0x0e) plen 12                 #6 [hci1] 0.531320
      Read Local Version Information (0x04|0x0001) ncmd 1
        Status: Success (0x00)
        HCI version: Reserved (0x0f) - Revision 12393 (0x3069)
        LMP version: Reserved (0x0f) - Subversion 12393 (0x3069)
        Manufacturer: Nordic Semiconductor ASA (89)
< HCI Command: Read Local Supported... (0x04|0x0002) plen 0  #7 [hci1] 0.550740
> HCI Event: Command Complete (0x0e) plen 68                 #8 [hci1] 0.551835
      Read Local Supported Commands (0x04|0x0002) ncmd 1
        Status: Success (0x00)
        Commands: 119 entries
          Disconnect (Octet 0 - Bit 5)
          Read Remote Version Information (Octet 2 - Bit 7)
          Set Event Mask (Octet 5 - Bit 6)
          Reset (Octet 5 - Bit 7)
          Read Connection Accept Timeout (Octet 7 - Bit 2)
          Write Connection Accept Timeout (Octet 7 - Bit 3)
          Read Transmit Power Level (Octet 10 - Bit 2)
          Set Controller To Host Flow Control (Octet 10 - Bit 5)
          Host Buffer Size (Octet 10 - Bit 6)
          Host Number of Completed Packets (Octet 10 - Bit 7)
          Read Local Version Information (Octet 14 - Bit 3)
          Read Local Supported Features (Octet 14 - Bit 5)
          Read BD ADDR (Octet 15 - Bit 1)
          Read RSSI (Octet 15 - Bit 5)
          Set Event Mask Page 2 (Octet 22 - Bit 2)
          LE Set Event Mask (Octet 25 - Bit 0)
          LE Read Buffer Size (Octet 25 - Bit 1)
          LE Read Local Supported Features (Octet 25 - Bit 2)
          LE Set Random Address (Octet 25 - Bit 4)
          LE Set Advertising Parameters (Octet 25 - Bit 5)
          LE Read Advertising Channel TX Power (Octet 25 - Bit 6)
          LE Set Advertising Data (Octet 25 - Bit 7)
          LE Set Scan Response Data (Octet 26 - Bit 0)
          LE Set Advertise Enable (Octet 26 - Bit 1)
          LE Set Scan Parameters (Octet 26 - Bit 2)
          LE Set Scan Enable (Octet 26 - Bit 3)
          LE Create Connection (Octet 26 - Bit 4)
          LE Create Connection Cancel (Octet 26 - Bit 5)
          LE Read Accept List Size (Octet 26 - Bit 6)
          LE Clear Accept List (Octet 26 - Bit 7)
          LE Add Device To Accept List (Octet 27 - Bit 0)
          LE Remove Device From Accept List (Octet 27 - Bit 1)
          LE Connection Update (Octet 27 - Bit 2)
          LE Set Host Channel Classification (Octet 27 - Bit 3)
          LE Read Channel Map (Octet 27 - Bit 4)
          LE Read Remote Used Features (Octet 27 - Bit 5)
          LE Encrypt (Octet 27 - Bit 6)
          LE Rand (Octet 27 - Bit 7)
          LE Start Encryption (Octet 28 - Bit 0)
          LE Long Term Key Request Reply (Octet 28 - Bit 1)
          LE Long Term Key Request Neg Reply (Octet 28 - Bit 2)
          LE Read Supported States (Octet 28 - Bit 3)
          LE Receiver Test (Octet 28 - Bit 4)
          LE Transmitter Test (Octet 28 - Bit 5)
          LE Test End (Octet 28 - Bit 6)
          Read Authenticated Payload Timeout (Octet 32 - Bit 4)
          Write Authenticated Payload Timeout (Octet 32 - Bit 5)
          LE Set Data Length (Octet 33 - Bit 6)
          LE Read Suggested Default Data Length (Octet 33 - Bit 7)
          LE Write Suggested Default Data Length (Octet 34 - Bit 0)
          LE Add Device To Resolving List (Octet 34 - Bit 3)
          LE Remove Device From Resolving List (Octet 34 - Bit 4)
          LE Clear Resolving List (Octet 34 - Bit 5)
          LE Read Resolving List Size (Octet 34 - Bit 6)
          LE Set Address Resolution Enable (Octet 35 - Bit 1)
          LE Set Resolvable Private Address Timeout (Octet 35 - Bit 2)
          LE Read Maximum Data Length (Octet 35 - Bit 3)
          LE Read PHY (Octet 35 - Bit 4)
          LE Set Default PHY (Octet 35 - Bit 5)
          LE Set PHY (Octet 35 - Bit 6)
          LE Enhanced Receiver Test (Octet 35 - Bit 7)
          LE Enhanced Transmitter Test (Octet 36 - Bit 0)
          LE Set Advertising Set Random Address (Octet 36 - Bit 1)
          LE Set Extended Advertising Parameters (Octet 36 - Bit 2)
          LE Set Extended Advertising Data (Octet 36 - Bit 3)
          LE Set Extended Scan Response Data (Octet 36 - Bit 4)
          LE Set Extended Advertising Enable (Octet 36 - Bit 5)
          LE Read Maximum Advertising Data Length (Octet 36 - Bit 6)
          LE Read Number of Supported Advertising Sets (Octet 36 - Bit 7)
          LE Remove Advertising Set (Octet 37 - Bit 0)
          LE Clear Advertising Sets (Octet 37 - Bit 1)
          LE Set Periodic Advertising Parameters (Octet 37 - Bit 2)
          LE Set Periodic Advertising Data (Octet 37 - Bit 3)
          LE Set Periodic Advertising Enable (Octet 37 - Bit 4)
          LE Set Extended Scan Parameters (Octet 37 - Bit 5)
          LE Set Extended Scan Enable (Octet 37 - Bit 6)
          LE Extended Create Connection (Octet 37 - Bit 7)
          LE Periodic Advertising Create Sync (Octet 38 - Bit 0)
          LE Periodic Advertising Create Sync Cancel (Octet 38 - Bit 1)
          LE Periodic Advertising Terminate Sync (Octet 38 - Bit 2)
          LE Add Device To Periodic Advertiser List (Octet 38 - Bit 3)
          LE Remove Device From Periodic Advertiser List (Octet 38 - Bit 4)
          LE Clear Periodic Advertiser List (Octet 38 - Bit 5)
          LE Read Periodic Advertiser List Size (Octet 38 - Bit 6)
          LE Read Transmit Power (Octet 38 - Bit 7)
          LE Read RF Path Compensation (Octet 39 - Bit 0)
          LE Write RF Path Compensation (Octet 39 - Bit 1)
          LE Set Privacy Mode (Octet 39 - Bit 2)
          LE Periodic Advertising Receive Enable (Octet 40 - Bit 5)
          LE Periodic Advertising Sync Transfer (Octet 40 - Bit 6)
          LE Periodic Advertising Set Info Transfer (Octet 40 - Bit 7)
          LE Periodic Advertising Sync Transfer Parameters (Octet 41 - Bit 0)
          LE Set Default Periodic Advertisng Sync Transfer Parameters (Octet 41 - Bit 1)
          LE Read Buffer v2 (Octet 41 - Bit 5)
          LE Read ISO TX Sync (Octet 41 - Bit 6)
          LE Set Connected Isochronous Group Parameters (Octet 41 - Bit 7)
          LE Set Connected Isochronous Group Parameters Test (Octet 42 - Bit 0)
          LE Create Connected Isochronous Stream (Octet 42 - Bit 1)
          LE Remove Connected Isochronous Group (Octet 42 - Bit 2)
          LE Accept Connected Isochronous Stream Request (Octet 42 - Bit 3)
          LE Reject Connected Isochronous Stream Request (Octet 42 - Bit 4)
          LE Create Broadcast Isochronous Group (Octet 42 - Bit 5)
          LE Create Broadcast Isochronous Group Test (Octet 42 - Bit 6)
          LE Terminate Broadcast Isochronous Group (Octet 42 - Bit 7)
          LE Broadcast Isochronous Group Create Sync (Octet 43 - Bit 0)
          LE Broadcast Isochronous Group Terminate Sync (Octet 43 - Bit 1)
          LE Request Peer SCA (Octet 43 - Bit 2)
          LE Setup Isochronous Data Path (Octet 43 - Bit 3)
          LE Remove Isochronous Data Path (Octet 43 - Bit 4)
          LE Isochronous Transmit Test (Octet 43 - Bit 5)
          LE Isochronous Receive Test (Octet 43 - Bit 6)
          LE Isochronous Read Test Counters (Octet 43 - Bit 7)
          LE Isochronous Read Test Counters (Octet 44 - Bit 0)
          LE Set Host Feature (Octet 44 - Bit 1)
          Octet 44 - Bit 2 
          Octet 45 - Bit 6 
          Octet 46 - Bit 0 
          Octet 46 - Bit 1 
          Octet 46 - Bit 2 
< HCI Command: Host Buffer Size (0x03|0x0033) plen 7         #9 [hci1] 0.570737
        ACL MTU: 255  ACL max packet: 16
        SCO MTU: 0    SCO max packet: 0
> HCI Event: Command Complete (0x0e) plen 4                 #10 [hci1] 0.571323
      Host Buffer Size (0x03|0x0033) ncmd 1
        Status: Success (0x00)
< HCI Command: Set Controller To Ho.. (0x03|0x0031) plen 1  #11 [hci1] 0.590687
        Flow control: ACL Data Packets (0x01)
> HCI Event: Command Complete (0x0e) plen 4                 #12 [hci1] 0.591247
      Set Controller To Host Flow Control (0x03|0x0031) ncmd 1
        Status: Success (0x00)
< HCI Command: LE Read Local Suppor.. (0x08|0x0003) plen 0  #13 [hci1] 0.610724
> HCI Event: Command Complete (0x0e) plen 12                #14 [hci1] 0.611185
      LE Read Local Supported Features (0x08|0x0003) ncmd 1
        Status: Success (0x00)
        Features: 0xfd 0x79 0x00 0xf7 0x30 0x01 0x00 0x00
          LE Encryption
          Extended Reject Indication
          Peripheral-initiated Features Exchange
          LE Ping
          LE Data Packet Length Extension
          LL Privacy
          Extended Scanner Filter Policies
          LE 2M PHY
          LE Coded PHY
          LE Extended Advertising
          LE Periodic Advertising
          Channel Selection Algorithm #2
          Periodic Advertising Sync Transfer - Sender
          Periodic Advertising Sync Transfer - Recipient
          Sleep Clock Accuracy Updates
          Connected Isochronous Stream - Central
          Connected Isochronous Stream - Peripheral
          Isochronous Broadcaster
          Synchronized Receiver
          Periodic Advertising ADI support
          Connection Subrating
          Unknown features (0x0000010000000000)
< HCI Command: LE Set Host Feature (0x08|0x0074) plen 2     #15 [hci1] 0.630694
        Bit Number: 32
          Connected Isochronous Stream (Host Support)
        Bit Value: 1
> HCI Event: Command Complete (0x0e) plen 4                 #16 [hci1] 0.631222
      LE Set Host Feature (0x08|0x0074) ncmd 1
        Status: Success (0x00)
< HCI Command: LE Read Buffer v2 (0x08|0x0060) plen 0       #17 [hci1] 0.650724
> HCI Event: Command Complete (0x0e) plen 10                #18 [hci1] 0.651201
      LE Read Buffer v2 (0x08|0x0060) ncmd 1
        Status: Success (0x00)
        ACL MTU: 27
        ACL max packet: 3
        ISO MTU: 318
        ISO max packet: 3
< HCI Command: LE Read Maximum Adve.. (0x08|0x003a) plen 0  #19 [hci1] 0.670764
> HCI Event: Command Complete (0x0e) plen 6                 #20 [hci1] 0.671206
      LE Read Maximum Advertising Data Length (0x08|0x003a) ncmd 1
        Status: Success (0x00)
        Max length: 1650
< HCI Command: LE Read Supported St.. (0x08|0x001c) plen 0  #21 [hci1] 0.690703
> HCI Event: Command Complete (0x0e) plen 12                #22 [hci1] 0.691301
      LE Read Supported States (0x08|0x001c) ncmd 1
        Status: Success (0x00)
        States: 0x000003ff3e0306ff
          Non-connectable Advertising State
          Scannable Advertising State
          Connectable Advertising State
          High Duty Cycle Directed Advertising State
          Passive Scanning State
          Active Scanning State
          Initiating State
            and Connection State (Central Role)
          Connection State (Peripheral Role)
          Scannable Advertising State
            and Passive Scanning State
          Connectable Advertising State
            and Passive Scanning State
          Non-connectable Advertising State
            and Initiating State
          Scannable Advertising State
            and Initiating State
          Active Scanning State
            and Connection State (Central Role)
          Passive Scanning State
            and Connection State (Peripheral Role)
          Active Scanning State
            and Connection State (Peripheral Role)
          Initiating State
            and Connection State (Central Role)
            and Central Role & Central Role
          Low Duty Cycle Directed Advertising State
          Connectable Advertising State
            and Initiating State
            and Central Role & Peripheral Role
          High Duty Cycle Directed Advertising State
            and Initiating State
            and Central Role & Peripheral Role
          Low Duty Cycle Directed Advertising State
            and Initiating State
            and Central Role & Peripheral Role
          Connectable Advertising State
            and Connection State (Central Role)
            and Central Role & Peripheral Role
          High Duty Cycle Directed Advertising State
            and Connection State (Central Role)
            and Central Role & Peripheral Role
          Low Duty Cycle Directed Advertising State
            and Connection State (Central Role)
            and Central Role & Peripheral Role
          Connectable Advertising State
            and Connection State (Peripheral Role)
            and Central Role & Peripheral Role
          High Duty Cycle Directed Advertising State
            and Connection State (Peripheral Role)
            and Peripheral Role & Peripheral Role
          Low Duty Cycle Directed Advertising State
            and Connection State (Peripheral Role)
            and Peripheral Role & Peripheral Role
          Initiating State
            and Connection State (Peripheral Role)
            and Central Role & Peripheral Role
< HCI Command: LE Read Maximum Data.. (0x08|0x002f) plen 0  #23 [hci1] 0.710725
> HCI Event: Command Complete (0x0e) plen 12                #24 [hci1] 0.711202
      LE Read Maximum Data Length (0x08|0x002f) ncmd 1
        Status: Success (0x00)
        Max TX octets: 251
        Max TX time: 2704
        Max RX octets: 251
        Max RX time: 2704
< HCI Command: LE Write Suggested D.. (0x08|0x0024) plen 4  #25 [hci1] 0.730710
        TX octets: 251
        TX time: 2704
> HCI Event: Command Complete (0x0e) plen 4                 #26 [hci1] 0.731186
      LE Write Suggested Default Data Length (0x08|0x0024) ncmd 1
        Status: Success (0x00)
< HCI Command: LE Read Resolving Li.. (0x08|0x002a) plen 0  #27 [hci1] 0.750732
> HCI Event: Command Complete (0x0e) plen 5                 #28 [hci1] 0.751204
      LE Read Resolving List Size (0x08|0x002a) ncmd 1
        Status: Success (0x00)
        Size: 8
< HCI Command: LE Set Event Mask (0x08|0x0001) plen 8       #29 [hci1] 0.770718
        Mask: 0x000002023f87fa5e
          LE Advertising Report
          LE Connection Update Complete
          LE Read Remote Used Features Complete
          LE Long Term Key Request
          LE Data Length Change
          LE Enhanced Connection Complete
          LE PHY Update Complete
          LE Extended Advertising Report
          LE Periodic Advertising Sync Established
          LE Periodic Advertising Report
          LE Periodic Advertising Sync Lost
          LE Extended Scan Timeout
          LE Extended Advertising Set Terminated
          LE Scan Request Received
          LE Periodic Advertising Sync Transfer Rvc
          LE CIS Established
          LE CIS Request
          LE Create BIG Complete
          LE Terminate BIG Complete
          LE BIG Sync Estabilished Complete
          LE BIG Sync Lost
          LE BIG Info Advertising Report
          Unknown mask (0x0000020000000000)
> HCI Event: Command Complete (0x0e) plen 4                 #30 [hci1] 0.771264
      LE Set Event Mask (0x08|0x0001) ncmd 1
        Status: Success (0x00)
< HCI Command: Set Event Mask (0x03|0x0001) plen 8          #31 [hci1] 0.790666
        Mask: 0x2000800002008890
          Disconnection Complete
          Encryption Change
          Read Remote Version Information Complete
          Hardware Error
          Data Buffer Overflow
          Encryption Key Refresh Complete
          LE Meta
> HCI Event: Command Complete (0x0e) plen 4                 #32 [hci1] 0.791130
      Set Event Mask (0x03|0x0001) ncmd 1
        Status: Success (0x00)
< HCI Command: Read BD ADDR (0x04|0x0009) plen 0            #33 [hci1] 0.810735
> HCI Event: Command Complete (0x0e) plen 10                #34 [hci1] 0.811162
      Read BD ADDR (0x04|0x0009) ncmd 1
        Status: Success (0x00)
        Address: 00:00:00:00:00:00 (OUI 00-00-00)
< HCI Command: LE Set Random Address (0x08|0x0005) plen 6   #35 [hci1] 0.830752
        Address: D5:B6:CC:31:DB:3B (Static)
> HCI Event: Command Complete (0x0e) plen 4                 #36 [hci1] 0.831301
      LE Set Random Address (0x08|0x0005) ncmd 1
        Status: Success (0x00)
< HCI Command: LE Set Extended Adv.. (0x08|0x0036) plen 25  #37 [hci1] 3.461205
        Handle: 0x00
        Properties: 0x0013
          Connectable
          Scannable
          Use legacy advertising PDUs: ADV_IND
        Min advertising interval: 100.000 msec (0x00a0)
        Max advertising interval: 150.000 msec (0x00f0)
        Channel map: 37, 38, 39 (0x07)
        Own address type: Random (0x01)
        Peer address type: Public (0x00)
        Peer address: 00:00:00:00:00:00 (OUI 00-00-00)
        Filter policy: Allow Scan Request from Any, Allow Connect Request from Any (0x00)
        TX power: Host has no preference (0x7f)
        Primary PHY: LE 1M (0x01)
        Secondary max skip: 0x00
        Secondary PHY: LE 1M (0x01)
        SID: 0x00
        Scan request notifications: Disabled (0x00)
> HCI Event: Command Complete (0x0e) plen 5                 #38 [hci1] 3.462040
      LE Set Extended Advertising Parameters (0x08|0x0036) ncmd 1
        Status: Success (0x00)
        TX power (selected): 0 dbm (0x00)
< HCI Command: LE Set Advertising S.. (0x08|0x0035) plen 7  #39 [hci1] 3.471182
        Advertising handle: 0x00
        Advertising random address: D5:B6:CC:31:DB:3B (Static)
> HCI Event: Command Complete (0x0e) plen 4                 #40 [hci1] 3.471803
      LE Set Advertising Set Random Address (0x08|0x0035) ncmd 1
        Status: Success (0x00)
< HCI Command: LE Set Extended Adv.. (0x08|0x0037) plen 22  #41 [hci1] 3.490892
        Handle: 0x00
        Operation: Complete extended advertising data (0x03)
        Fragment preference: Minimize fragmentation (0x01)
        Data length: 0x12
        Flags: 0x06
          LE General Discoverable Mode
          BR/EDR Not Supported
        Name (complete): Tester_F6B11A
> HCI Event: Command Complete (0x0e) plen 4                 #42 [hci1] 3.491688
      LE Set Extended Advertising Data (0x08|0x0037) ncmd 1
        Status: Success (0x00)
< HCI Command: LE Set Extended Scan.. (0x08|0x0038) plen 4  #43 [hci1] 3.510747
        Handle: 0x00
        Operation: Complete scan response data (0x03)
        Fragment preference: Minimize fragmentation (0x01)
        Data length: 0x00
> HCI Event: Command Complete (0x0e) plen 4                 #44 [hci1] 3.511249
      LE Set Extended Scan Response Data (0x08|0x0038) ncmd 1
        Status: Success (0x00)
< HCI Command: LE Set Extended Adve.. (0x08|0x0039) plen 6  #45 [hci1] 3.530747
        Extended advertising: Enabled (0x01)
        Number of sets: 1 (0x01)
        Entry 0
          Handle: 0x00
          Duration: 0 ms (0x00)
          Max ext adv events: 0
> HCI Event: Command Complete (0x0e) plen 4                 #46 [hci1] 3.531335
      LE Set Extended Advertising Enable (0x08|0x0039) ncmd 1
        Status: Success (0x00)
> HCI Event: LE Meta Event (0x3e) plen 31                   #47 [hci1] 3.644066
      LE Enhanced Connection Complete (0x0a)
        Status: Success (0x00)
        Handle: 2289
        Role: Peripheral (0x01)
        Peer address type: Public (0x00)
        Peer address: DF:A9:FF:F6:B1:1A (OUI DF-A9-FF)
        Local resolvable private address: 00:00:00:00:00:00 (Non-Resolvable)
        Peer resolvable private address: 00:00:00:00:00:00 (Non-Resolvable)
        Connection interval: 87.50 msec (0x0046)
        Connection latency: 0 (0x0000)
        Supervision timeout: 25120 msec (0x09d0)
        Central clock accuracy: 0x01
> HCI Event: LE Meta Event (0x3e) plen 6                    #48 [hci1] 3.644243
      LE Advertising Set Terminated (0x12)
        Status: Success (0x00)
        Handle: 0
        Connection handle: 2289
        Number of completed extended advertising events: 0
< HCI Command: LE Read Remote Used... (0x08|0x0016) plen 2  #49 [hci1] 3.651932
        Handle: 2289 Address: DF:A9:FF:F6:B1:1A (OUI DF-A9-FF)
< ACL Data TX: Handle 2289 flags 0x00 dlen 7                #50 [hci1] 3.651957
      ATT: Exchange MTU Request (0x02) len 2
        Client RX MTU: 251
> HCI Event: Command Status (0x0f) plen 4                   #51 [hci1] 3.652402
      LE Read Remote Used Features (0x08|0x0016) ncmd 1
        Status: Success (0x00)
> HCI Event: Number of Completed Packets (0x13) plen 5      #52 [hci1] 3.820071
        Num handles: 1
        Handle: 2289 Address: DF:A9:FF:F6:B1:1A (OUI DF-A9-FF)
        Count: 1
        #50: len 7 (0 Kb/s)
        Latency: 168 msec (168-168 msec ~168 msec)
> HCI Event: LE Meta Event (0x3e) plen 12                   #53 [hci1] 3.907938
      LE Read Remote Used Features (0x04)
        Status: Success (0x00)
        Handle: 2289 Address: DF:A9:FF:F6:B1:1A (OUI DF-A9-FF)
        Features: 0x2d 0x49 0x00 0xf7 0x67 0xd9 0x00 0x80
          LE Encryption
          Extended Reject Indication
          Peripheral-initiated Features Exchange
          LE Data Packet Length Extension
          LE 2M PHY
          LE Coded PHY
          Channel Selection Algorithm #2
          Periodic Advertising Sync Transfer - Sender
          Periodic Advertising Sync Transfer - Recipient
          Sleep Clock Accuracy Updates
          Connected Isochronous Stream - Central
          Connected Isochronous Stream - Peripheral
          Isochronous Broadcaster
          Synchronized Receiver
          Connected Isochronous Stream (Host Support)
          LE Power Control Request
          LE Power Control Request
          Connection Subrating
          Connection Subrating (Host Support)
          Unknown features (0x8000d90000000000)
> ACL Data RX: Handle 2289 flags 0x02 dlen 11               #54 [hci1] 6.357678
      SMP: Pairing Request (0x01) len 6
        IO capability: KeyboardDisplay (0x04)
        OOB data: Authentication data not present (0x00)
        Authentication requirement: Bonding, MITM, SC, No Keypresses (0x0d)
        Max encryption key size: 16
        Initiator key distribution: EncKey IdKey (0x03)
        Responder key distribution: EncKey IdKey Sign (0x07)
> ACL Data RX: Handle 2289 flags 0x02 dlen 7                #55 [hci1] 6.358088
      ATT: Exchange MTU Response (0x03) len 2
        Server RX MTU: 23
< HCI Command: Host Number of Compl.. (0x03|0x0035) plen 5  #56 [hci1] 6.371195
        Num handles: 1
        Handle: 2289 Address: DF:A9:FF:F6:B1:1A (OUI DF-A9-FF)
        Count: 1
< ACL Data TX: Handle 2289 flags 0x00 dlen 11               #57 [hci1] 6.371330
      SMP: Pairing Response (0x02) len 6
        IO capability: DisplayOnly (0x00)
        OOB data: Authentication data not present (0x00)
        Authentication requirement: Bonding, No MITM, SC, No Keypresses (0x09)
        Max encryption key size: 16
        Initiator key distribution: IdKey (0x02)
        Responder key distribution: <none> (0x00)
< HCI Command: Host Number of Compl.. (0x03|0x0035) plen 5  #58 [hci1] 6.371532
        Num handles: 1
        Handle: 2289 Address: DF:A9:FF:F6:B1:1A (OUI DF-A9-FF)
        Count: 1
> HCI Event: Number of Completed Packets (0x13) plen 5      #59 [hci1] 6.532735
        Num handles: 1
        Handle: 2289 Address: DF:A9:FF:F6:B1:1A (OUI DF-A9-FF)
        Count: 1
        #57: len 11 (0 Kb/s)
        Latency: 161 msec (161-168 msec ~164 msec)
> ACL Data RX: Handle 2289 flags 0x02 dlen 27               #60 [hci1] 6.533008
> ACL Data RX: Handle 2289 flags 0x01 dlen 27               #61 [hci1] 6.533609
> ACL Data RX: Handle 2289 flags 0x01 dlen 15               #62 [hci1] 6.533985
      SMP: Pairing Public Key (0x0c) len 64
        X: 57ee4f4f928cc723ec89042d5ccc001ec59da8e3cdbc6f617d451450cf495e3d
        Y: 3acbc31fd9d959bd4b53636c76677800aa3d732b69fec4b691d9f327e16f3393
< HCI Command: Host Number of Compl.. (0x03|0x0035) plen 5  #63 [hci1] 6.551776
        Num handles: 1
        Handle: 2289 Address: DF:A9:FF:F6:B1:1A (OUI DF-A9-FF)
        Count: 1
< HCI Command: Host Number of Compl.. (0x03|0x0035) plen 5  #64 [hci1] 6.552059
        Num handles: 1
        Handle: 2289 Address: DF:A9:FF:F6:B1:1A (OUI DF-A9-FF)
        Count: 1
< HCI Command: Host Number of Compl.. (0x03|0x0035) plen 5  #65 [hci1] 6.552451
        Num handles: 1
        Handle: 2289 Address: DF:A9:FF:F6:B1:1A (OUI DF-A9-FF)
        Count: 1
< ACL Data TX: Handle 2289 flags 0x00 dlen 27               #66 [hci1] 6.552573
< ACL Data TX: Handle 2289 flags 0x01 dlen 27               #67 [hci1] 6.552583
< ACL Data TX: Handle 2289 flags 0x01 dlen 15               #68 [hci1] 6.552605
      SMP: Pairing Public Key (0x0c) len 64
        X: 98308440221e2d910f0e54b71e7ec652857aa9b5a0dc65028824cc19db1226e9
        Y: 67a4816bcb62efb21701e31fdb27561a6217575fb007a8bbdabe7e28b6f68482
> HCI Event: Number of Completed Packets (0x13) plen 5      #69 [hci1] 6.620640
        Num handles: 1
        Handle: 2289 Address: DF:A9:FF:F6:B1:1A (OUI DF-A9-FF)
        Count: 1
        #66: len 27 (3 Kb/s)
        Latency: 68 msec (68-168 msec ~116 msec)
> HCI Event: Number of Completed Packets (0x13) plen 5      #70 [hci1] 6.621295
        Num handles: 1
        Handle: 2289 Address: DF:A9:FF:F6:B1:1A (OUI DF-A9-FF)
        Count: 1
        #67: len 27 (3 Kb/s)
        Latency: 68 msec (68-168 msec ~92 msec)
> HCI Event: Number of Completed Packets (0x13) plen 5      #71 [hci1] 6.707505
        Num handles: 1
        Handle: 2289 Address: DF:A9:FF:F6:B1:1A (OUI DF-A9-FF)
        Count: 1
        #68: len 15 (0 Kb/s)
        Latency: 154 msec (68-168 msec ~123 msec)
> ACL Data RX: Handle 2289 flags 0x02 dlen 21               #72 [hci1] 7.670339
      SMP: Pairing Confirm (0x03) len 16
        Confim value: 24fc1c7c30ccce34b3508a31326f4f81
< HCI Command: Host Number of Compl.. (0x03|0x0035) plen 5  #73 [hci1] 7.671071
        Num handles: 1
        Handle: 2289 Address: DF:A9:FF:F6:B1:1A (OUI DF-A9-FF)
        Count: 1
< ACL Data TX: Handle 2289 flags 0x00 dlen 21               #74 [hci1] 7.671096
      SMP: Pairing Confirm (0x03) len 16
        Confim value: 1395bb2523b48405a58998fe923dfbaa
> HCI Event: Number of Completed Packets (0x13) plen 5      #75 [hci1] 7.845177
        Num handles: 1
        Handle: 2289 Address: DF:A9:FF:F6:B1:1A (OUI DF-A9-FF)
        Count: 1
        #74: len 21 (0 Kb/s)
        Latency: 174 msec (68-174 msec ~148 msec)
> ACL Data RX: Handle 2289 flags 0x02 dlen 21               #76 [hci1] 7.845571
      SMP: Pairing Random (0x04) len 16
        Random value: 73316fa7a22c743d0000000000000000
< HCI Command: Host Number of Compl.. (0x03|0x0035) plen 5  #77 [hci1] 7.851380
        Num handles: 1
        Handle: 2289 Address: DF:A9:FF:F6:B1:1A (OUI DF-A9-FF)
        Count: 1
< ACL Data TX: Handle 2289 flags 0x00 dlen 21               #78 [hci1] 7.851497
      SMP: Pairing Random (0x04) len 16
        Random value: 8e6108f966a694cbe26df70bb96773e6
> HCI Event: Number of Completed Packets (0x13) plen 5      #79 [hci1] 8.019927
        Num handles: 1
        Handle: 2289 Address: DF:A9:FF:F6:B1:1A (OUI DF-A9-FF)
        Count: 1
        #78: len 21 (1 Kb/s)
        Latency: 168 msec (68-174 msec ~158 msec)
> ACL Data RX: Handle 2289 flags 0x02 dlen 21               #80 [hci1] 8.107845
      SMP: Pairing Confirm (0x03) len 16
        Confim value: 1257e9c4621edf49248bd82efc0d3139
< HCI Command: Host Number of Compl.. (0x03|0x0035) plen 5  #81 [hci1] 8.111480
        Num handles: 1
        Handle: 2289 Address: DF:A9:FF:F6:B1:1A (OUI DF-A9-FF)
        Count: 1
< ACL Data TX: Handle 2289 flags 0x00 dlen 21               #82 [hci1] 8.111643
      SMP: Pairing Confirm (0x03) len 16
        Confim value: 2006a87f5b0c765752c11ccae58cc865
> HCI Event: Number of Completed Packets (0x13) plen 5      #83 [hci1] 8.282695
        Num handles: 1
        Handle: 2289 Address: DF:A9:FF:F6:B1:1A (OUI DF-A9-FF)
        Count: 1
        #82: len 21 (0 Kb/s)
        Latency: 171 msec (68-174 msec ~164 msec)
> ACL Data RX: Handle 2289 flags 0x02 dlen 21               #84 [hci1] 8.282982
      SMP: Pairing Random (0x04) len 16
        Random value: d0a11491aa3966990000000000000000
< HCI Command: Host Number of Compl.. (0x03|0x0035) plen 5  #85 [hci1] 8.291647
        Num handles: 1
        Handle: 2289 Address: DF:A9:FF:F6:B1:1A (OUI DF-A9-FF)
        Count: 1
< ACL Data TX: Handle 2289 flags 0x00 dlen 21               #86 [hci1] 8.291740
      SMP: Pairing Random (0x04) len 16
        Random value: 4d02679f89a05211af56d8b3da64d21e
> HCI Event: Number of Completed Packets (0x13) plen 5      #87 [hci1] 8.457478
        Num handles: 1
        Handle: 2289 Address: DF:A9:FF:F6:B1:1A (OUI DF-A9-FF)
        Count: 1
        #86: len 21 (1 Kb/s)
        Latency: 165 msec (68-174 msec ~165 msec)
> ACL Data RX: Handle 2289 flags 0x02 dlen 21               #88 [hci1] 8.545337
      SMP: Pairing Confirm (0x03) len 16
        Confim value: f91b771c894078783c5e863c6cb29481
< HCI Command: Host Number of Compl.. (0x03|0x0035) plen 5  #89 [hci1] 8.551164
        Num handles: 1
        Handle: 2289 Address: DF:A9:FF:F6:B1:1A (OUI DF-A9-FF)
        Count: 1
< ACL Data TX: Handle 2289 flags 0x00 dlen 21               #90 [hci1] 8.551228
      SMP: Pairing Confirm (0x03) len 16
        Confim value: b933d047b497927f96f25f87f3dbfce7
> HCI Event: Number of Completed Packets (0x13) plen 5      #91 [hci1] 8.720148
        Num handles: 1
        Handle: 2289 Address: DF:A9:FF:F6:B1:1A (OUI DF-A9-FF)
        Count: 1
        #90: len 21 (1 Kb/s)
        Latency: 168 msec (68-174 msec ~167 msec)
> ACL Data RX: Handle 2289 flags 0x02 dlen 21               #92 [hci1] 8.720501
      SMP: Pairing Random (0x04) len 16
        Random value: 761ef8e51aa0a7550000000000000000
< HCI Command: Host Number of Compl.. (0x03|0x0035) plen 5  #93 [hci1] 8.731703
        Num handles: 1
        Handle: 2289 Address: DF:A9:FF:F6:B1:1A (OUI DF-A9-FF)
        Count: 1
< ACL Data TX: Handle 2289 flags 0x00 dlen 21               #94 [hci1] 8.731784
      SMP: Pairing Random (0x04) len 16
        Random value: 5e8286bc235a02440d0c3424a2acf8fd
> HCI Event: Number of Completed Packets (0x13) plen 5      #95 [hci1] 8.895019
        Num handles: 1
        Handle: 2289 Address: DF:A9:FF:F6:B1:1A (OUI DF-A9-FF)
        Count: 1
        #94: len 21 (1 Kb/s)
        Latency: 163 msec (68-174 msec ~165 msec)
> ACL Data RX: Handle 2289 flags 0x02 dlen 21               #96 [hci1] 8.982816
      SMP: Pairing Confirm (0x03) len 16
        Confim value: 1b21247029f942dc85a540d2a1b8a44d
< HCI Command: Host Number of Compl.. (0x03|0x0035) plen 5  #97 [hci1] 8.991097
        Num handles: 1
        Handle: 2289 Address: DF:A9:FF:F6:B1:1A (OUI DF-A9-FF)
        Count: 1
< ACL Data TX: Handle 2289 flags 0x00 dlen 21               #98 [hci1] 8.991155
      SMP: Pairing Confirm (0x03) len 16
        Confim value: c7202f9580b6c87abf2b061cf5d71038
> HCI Event: Number of Completed Packets (0x13) plen 5      #99 [hci1] 9.157646
        Num handles: 1
        Handle: 2289 Address: DF:A9:FF:F6:B1:1A (OUI DF-A9-FF)
        Count: 1
        #98: len 21 (1 Kb/s)
        Latency: 166 msec (68-174 msec ~165 msec)
> ACL Data RX: Handle 2289 flags 0x02 dlen 21              #100 [hci1] 9.158000
      SMP: Pairing Random (0x04) len 16
        Random value: 24b3b905cf2428930000000000000000
< HCI Command: Host Number of Comp.. (0x03|0x0035) plen 5  #101 [hci1] 9.171650
        Num handles: 1
        Handle: 2289 Address: DF:A9:FF:F6:B1:1A (OUI DF-A9-FF)
        Count: 1
< ACL Data TX: Handle 2289 flags 0x00 dlen 21              #102 [hci1] 9.171834
      SMP: Pairing Random (0x04) len 16
        Random value: 5c4a1bcadd27bd58e945097b00bad7ac
> HCI Event: Number of Completed Packets (0x13) plen 5     #103 [hci1] 9.332394
        Num handles: 1
        Handle: 2289 Address: DF:A9:FF:F6:B1:1A (OUI DF-A9-FF)
        Count: 1
        #102: len 21 (1 Kb/s)
        Latency: 160 msec (68-174 msec ~163 msec)
> ACL Data RX: Handle 2289 flags 0x02 dlen 21              #104 [hci1] 9.420253
      SMP: Pairing Confirm (0x03) len 16
        Confim value: f9c68b6dfbd4d0eca7fde809c9209d47
< HCI Command: Host Number of Comp.. (0x03|0x0035) plen 5  #105 [hci1] 9.431461
        Num handles: 1
        Handle: 2289 Address: DF:A9:FF:F6:B1:1A (OUI DF-A9-FF)
        Count: 1
< ACL Data TX: Handle 2289 flags 0x00 dlen 21              #106 [hci1] 9.431535
      SMP: Pairing Confirm (0x03) len 16
        Confim value: 2b3170d9a4f50d15a3eb39e4ce5fe0da
> HCI Event: Number of Completed Packets (0x13) plen 5     #107 [hci1] 9.595117
        Num handles: 1
        Handle: 2289 Address: DF:A9:FF:F6:B1:1A (OUI DF-A9-FF)
        Count: 1
        #106: len 21 (1 Kb/s)
        Latency: 163 msec (68-174 msec ~163 msec)
> ACL Data RX: Handle 2289 flags 0x02 dlen 21              #108 [hci1] 9.595518
      SMP: Pairing Random (0x04) len 16
        Random value: 23401f8741327bb80000000000000000
< HCI Command: Host Number of Comp.. (0x03|0x0035) plen 5  #109 [hci1] 9.611744
        Num handles: 1
        Handle: 2289 Address: DF:A9:FF:F6:B1:1A (OUI DF-A9-FF)
        Count: 1
< ACL Data TX: Handle 2289 flags 0x00 dlen 21              #110 [hci1] 9.611912
      SMP: Pairing Random (0x04) len 16
        Random value: 32527e6e64e79f33b2e374394db8ab2d
> HCI Event: Number of Completed Packets (0x13) plen 5     #111 [hci1] 9.770021
        Num handles: 1
        Handle: 2289 Address: DF:A9:FF:F6:B1:1A (OUI DF-A9-FF)
        Count: 1
        #110: len 21 (1 Kb/s)
        Latency: 158 msec (68-174 msec ~160 msec)
> ACL Data RX: Handle 2289 flags 0x02 dlen 21              #112 [hci1] 9.857851
      SMP: Pairing Confirm (0x03) len 16
        Confim value: 7a0c5704975be42f0e11eab8e6575fc6
< HCI Command: Host Number of Comp.. (0x03|0x0035) plen 5  #113 [hci1] 9.871314
        Num handles: 1
        Handle: 2289 Address: DF:A9:FF:F6:B1:1A (OUI DF-A9-FF)
        Count: 1
< ACL Data TX: Handle 2289 flags 0x00 dlen 21              #114 [hci1] 9.871448
      SMP: Pairing Confirm (0x03) len 16
        Confim value: 3185b30a774f34893d3753424d06276b
> HCI Event: Number of Completed Packets (0x13) plen 5    #115 [hci1] 10.032677
        Num handles: 1
        Handle: 2289 Address: DF:A9:FF:F6:B1:1A (OUI DF-A9-FF)
        Count: 1
        #114: len 21 (1 Kb/s)
        Latency: 161 msec (68-174 msec ~160 msec)
> ACL Data RX: Handle 2289 flags 0x02 dlen 21             #116 [hci1] 10.033032
      SMP: Pairing Random (0x04) len 16
        Random value: 5f76628b4fd0a5950000000000000000
< HCI Command: Host Number of Com.. (0x03|0x0035) plen 5  #117 [hci1] 10.051726
        Num handles: 1
        Handle: 2289 Address: DF:A9:FF:F6:B1:1A (OUI DF-A9-FF)
        Count: 1
< ACL Data TX: Handle 2289 flags 0x00 dlen 21             #118 [hci1] 10.051888
      SMP: Pairing Random (0x04) len 16
        Random value: dddbdfe2838e9a8cc6964353c850fef7
> HCI Event: Number of Completed Packets (0x13) plen 5    #119 [hci1] 10.207365
        Num handles: 1
        Handle: 2289 Address: DF:A9:FF:F6:B1:1A (OUI DF-A9-FF)
        Count: 1
        #118: len 21 (1 Kb/s)
        Latency: 155 msec (68-174 msec ~158 msec)
> ACL Data RX: Handle 2289 flags 0x02 dlen 21             #120 [hci1] 10.295282
      SMP: Pairing Confirm (0x03) len 16
        Confim value: f7ed4f2d66de2dbb746d38ce6ee09bdb
< HCI Command: Host Number of Com.. (0x03|0x0035) plen 5  #121 [hci1] 10.311459
        Num handles: 1
        Handle: 2289 Address: DF:A9:FF:F6:B1:1A (OUI DF-A9-FF)
        Count: 1
< ACL Data TX: Handle 2289 flags 0x00 dlen 21             #122 [hci1] 10.311643
      SMP: Pairing Confirm (0x03) len 16
        Confim value: 142d408e0b38ef793f7279f10e5011ca
> HCI Event: Number of Completed Packets (0x13) plen 5    #123 [hci1] 10.470084
        Num handles: 1
        Handle: 2289 Address: DF:A9:FF:F6:B1:1A (OUI DF-A9-FF)
        Count: 1
        #122: len 21 (1 Kb/s)
        Latency: 158 msec (68-174 msec ~158 msec)
> ACL Data RX: Handle 2289 flags 0x02 dlen 21             #124 [hci1] 10.470446
      SMP: Pairing Random (0x04) len 16
        Random value: 5fd42ad1ed488edc0000000000000000
< HCI Command: Host Number of Com.. (0x03|0x0035) plen 5  #125 [hci1] 10.471649
        Num handles: 1
        Handle: 2289 Address: DF:A9:FF:F6:B1:1A (OUI DF-A9-FF)
        Count: 1
< ACL Data TX: Handle 2289 flags 0x00 dlen 21             #126 [hci1] 10.471764
      SMP: Pairing Random (0x04) len 16
        Random value: eb9f1915536596b6fc3db1c86b2b1970
> HCI Event: Number of Completed Packets (0x13) plen 5    #127 [hci1] 10.644960
        Num handles: 1
        Handle: 2289 Address: DF:A9:FF:F6:B1:1A (OUI DF-A9-FF)
        Count: 1
        #126: len 21 (0 Kb/s)
        Latency: 173 msec (68-174 msec ~165 msec)
> ACL Data RX: Handle 2289 flags 0x02 dlen 21             #128 [hci1] 10.732720
      SMP: Pairing Confirm (0x03) len 16
        Confim value: a8736cab4acb6331b6d69cbf62df0761
< HCI Command: Host Number of Com.. (0x03|0x0035) plen 5  #129 [hci1] 10.751417
        Num handles: 1
        Handle: 2289 Address: DF:A9:FF:F6:B1:1A (OUI DF-A9-FF)
        Count: 1
< ACL Data TX: Handle 2289 flags 0x00 dlen 21             #130 [hci1] 10.751597
      SMP: Pairing Confirm (0x03) len 16
        Confim value: 600797cbf9e977467671c3629901dcd2
> HCI Event: Number of Completed Packets (0x13) plen 5    #131 [hci1] 10.907628
        Num handles: 1
        Handle: 2289 Address: DF:A9:FF:F6:B1:1A (OUI DF-A9-FF)
        Count: 1
        #130: len 21 (1 Kb/s)
        Latency: 156 msec (68-174 msec ~160 msec)
> ACL Data RX: Handle 2289 flags 0x02 dlen 21             #132 [hci1] 10.907997
      SMP: Pairing Random (0x04) len 16
        Random value: dd2581c74406176a0000000000000000
< HCI Command: Host Number of Com.. (0x03|0x0035) plen 5  #133 [hci1] 10.911601
        Num handles: 1
        Handle: 2289 Address: DF:A9:FF:F6:B1:1A (OUI DF-A9-FF)
        Count: 1
< ACL Data TX: Handle 2289 flags 0x00 dlen 21             #134 [hci1] 10.911745
      SMP: Pairing Random (0x04) len 16
        Random value: 5c794dc9ad9f2c3f295ebd5ad5e1c3cf
> HCI Event: Number of Completed Packets (0x13) plen 5    #135 [hci1] 11.082415
        Num handles: 1
        Handle: 2289 Address: DF:A9:FF:F6:B1:1A (OUI DF-A9-FF)
        Count: 1
        #134: len 21 (0 Kb/s)
        Latency: 170 msec (68-174 msec ~165 msec)
> ACL Data RX: Handle 2289 flags 0x02 dlen 21             #136 [hci1] 11.170305
      SMP: Pairing Confirm (0x03) len 16
        Confim value: c2f768b9d4fc613e2849b94ca53f97b5
< HCI Command: Host Number of Com.. (0x03|0x0035) plen 5  #137 [hci1] 11.171576
        Num handles: 1
        Handle: 2289 Address: DF:A9:FF:F6:B1:1A (OUI DF-A9-FF)
        Count: 1
< ACL Data TX: Handle 2289 flags 0x00 dlen 21             #138 [hci1] 11.171685
      SMP: Pairing Confirm (0x03) len 16
        Confim value: 87c4b1895c57ed694de3b3843d017c72
> HCI Event: Number of Completed Packets (0x13) plen 5    #139 [hci1] 11.345170
        Num handles: 1
        Handle: 2289 Address: DF:A9:FF:F6:B1:1A (OUI DF-A9-FF)
        Count: 1
        #138: len 21 (0 Kb/s)
        Latency: 173 msec (68-174 msec ~169 msec)
> ACL Data RX: Handle 2289 flags 0x02 dlen 21             #140 [hci1] 11.345465
      SMP: Pairing Random (0x04) len 16
        Random value: aa751c9fde6016fd0000000000000000
< HCI Command: Host Number of Com.. (0x03|0x0035) plen 5  #141 [hci1] 11.351645
        Num handles: 1
        Handle: 2289 Address: DF:A9:FF:F6:B1:1A (OUI DF-A9-FF)
        Count: 1
< ACL Data TX: Handle 2289 flags 0x00 dlen 21             #142 [hci1] 11.351732
      SMP: Pairing Random (0x04) len 16
        Random value: 5c2fff312cdf99c9491988e877355a9a
> HCI Event: Number of Completed Packets (0x13) plen 5    #143 [hci1] 11.519907
        Num handles: 1
        Handle: 2289 Address: DF:A9:FF:F6:B1:1A (OUI DF-A9-FF)
        Count: 1
        #142: len 21 (1 Kb/s)
        Latency: 168 msec (68-174 msec ~168 msec)
> ACL Data RX: Handle 2289 flags 0x02 dlen 21             #144 [hci1] 11.607771
      SMP: Pairing Confirm (0x03) len 16
        Confim value: 3d9d7cf2e8e4c15a4c7a5a85db76fd22
< HCI Command: Host Number of Com.. (0x03|0x0035) plen 5  #145 [hci1] 11.611165
        Num handles: 1
        Handle: 2289 Address: DF:A9:FF:F6:B1:1A (OUI DF-A9-FF)
        Count: 1
< ACL Data TX: Handle 2289 flags 0x00 dlen 21             #146 [hci1] 11.611241
      SMP: Pairing Confirm (0x03) len 16
        Confim value: 66af0d9ad9df485ea50f3398bc5901d8
> HCI Event: Number of Completed Packets (0x13) plen 5    #147 [hci1] 11.782574
        Num handles: 1
        Handle: 2289 Address: DF:A9:FF:F6:B1:1A (OUI DF-A9-FF)
        Count: 1
        #146: len 21 (0 Kb/s)
        Latency: 171 msec (68-174 msec ~170 msec)
> ACL Data RX: Handle 2289 flags 0x02 dlen 21             #148 [hci1] 11.783028
      SMP: Pairing Random (0x04) len 16
        Random value: 4bb0c624fdf52ab90000000000000000
< HCI Command: Host Number of Com.. (0x03|0x0035) plen 5  #149 [hci1] 11.791491
        Num handles: 1
        Handle: 2289 Address: DF:A9:FF:F6:B1:1A (OUI DF-A9-FF)
        Count: 1
< ACL Data TX: Handle 2289 flags 0x00 dlen 21             #150 [hci1] 11.791633
      SMP: Pairing Random (0x04) len 16
        Random value: c629a3a987d808e808655d558dfc1155
> HCI Event: Number of Completed Packets (0x13) plen 5    #151 [hci1] 11.957376
        Num handles: 1
        Handle: 2289 Address: DF:A9:FF:F6:B1:1A (OUI DF-A9-FF)
        Count: 1
        #150: len 21 (1 Kb/s)
        Latency: 165 msec (68-174 msec ~167 msec)
> ACL Data RX: Handle 2289 flags 0x02 dlen 21             #152 [hci1] 12.045408
      SMP: Pairing Confirm (0x03) len 16
        Confim value: e51c3c3d8c4d7644c56ee39e551b644b
< HCI Command: Host Number of Com.. (0x03|0x0035) plen 5  #153 [hci1] 12.051387
        Num handles: 1
        Handle: 2289 Address: DF:A9:FF:F6:B1:1A (OUI DF-A9-FF)
        Count: 1
< ACL Data TX: Handle 2289 flags 0x00 dlen 21             #154 [hci1] 12.051561
      SMP: Pairing Confirm (0x03) len 16
        Confim value: 04f34cd4bac8c41d15be5b6432d594ec
> HCI Event: Number of Completed Packets (0x13) plen 5    #155 [hci1] 12.220142
        Num handles: 1
        Handle: 2289 Address: DF:A9:FF:F6:B1:1A (OUI DF-A9-FF)
        Count: 1
        #154: len 21 (1 Kb/s)
        Latency: 168 msec (68-174 msec ~168 msec)
> ACL Data RX: Handle 2289 flags 0x02 dlen 21             #156 [hci1] 12.220531
      SMP: Pairing Random (0x04) len 16
        Random value: cbf9eb5bcaffc7d20000000000000000
< HCI Command: Host Number of Com.. (0x03|0x0035) plen 5  #157 [hci1] 12.231662
        Num handles: 1
        Handle: 2289 Address: DF:A9:FF:F6:B1:1A (OUI DF-A9-FF)
        Count: 1
< ACL Data TX: Handle 2289 flags 0x00 dlen 21             #158 [hci1] 12.231761
      SMP: Pairing Random (0x04) len 16
        Random value: 92f20f6ad8f13724432c7fd6001c45ff
> HCI Event: Number of Completed Packets (0x13) plen 5    #159 [hci1] 12.394898
        Num handles: 1
        Handle: 2289 Address: DF:A9:FF:F6:B1:1A (OUI DF-A9-FF)
        Count: 1
        #158: len 21 (1 Kb/s)
        Latency: 163 msec (68-174 msec ~165 msec)
> ACL Data RX: Handle 2289 flags 0x02 dlen 21             #160 [hci1] 12.482743
      SMP: Pairing Confirm (0x03) len 16
        Confim value: 633d5d012063fa2538d70c5d3c2240d4
< HCI Command: Host Number of Com.. (0x03|0x0035) plen 5  #161 [hci1] 12.491770
        Num handles: 1
        Handle: 2289 Address: DF:A9:FF:F6:B1:1A (OUI DF-A9-FF)
        Count: 1
< ACL Data TX: Handle 2289 flags 0x00 dlen 21             #162 [hci1] 12.491797
      SMP: Pairing Confirm (0x03) len 16
        Confim value: 89a05986f322397efa7ca96b0cac0f60
> HCI Event: Number of Completed Packets (0x13) plen 5    #163 [hci1] 12.657589
        Num handles: 1
        Handle: 2289 Address: DF:A9:FF:F6:B1:1A (OUI DF-A9-FF)
        Count: 1
        #162: len 21 (1 Kb/s)
        Latency: 165 msec (68-174 msec ~165 msec)
> ACL Data RX: Handle 2289 flags 0x02 dlen 21             #164 [hci1] 12.657936
      SMP: Pairing Random (0x04) len 16
        Random value: 164c632ff5e552f60000000000000000
< HCI Command: Host Number of Com.. (0x03|0x0035) plen 5  #165 [hci1] 12.671713
        Num handles: 1
        Handle: 2289 Address: DF:A9:FF:F6:B1:1A (OUI DF-A9-FF)
        Count: 1
< ACL Data TX: Handle 2289 flags 0x00 dlen 21             #166 [hci1] 12.671881
      SMP: Pairing Random (0x04) len 16
        Random value: 23ac32ebbb5e14c8a6b9622f296d277f
> HCI Event: Number of Completed Packets (0x13) plen 5    #167 [hci1] 12.832397
        Num handles: 1
        Handle: 2289 Address: DF:A9:FF:F6:B1:1A (OUI DF-A9-FF)
        Count: 1
        #166: len 21 (1 Kb/s)
        Latency: 160 msec (68-174 msec ~163 msec)
> ACL Data RX: Handle 2289 flags 0x02 dlen 21             #168 [hci1] 12.920318
      SMP: Pairing Confirm (0x03) len 16
        Confim value: badab82045af9e8bf16d0c6d2b8bdf1f
< HCI Command: Host Number of Com.. (0x03|0x0035) plen 5  #169 [hci1] 12.931485
        Num handles: 1
        Handle: 2289 Address: DF:A9:FF:F6:B1:1A (OUI DF-A9-FF)
        Count: 1
< ACL Data TX: Handle 2289 flags 0x00 dlen 21             #170 [hci1] 12.931610
      SMP: Pairing Confirm (0x03) len 16
        Confim value: 3918e0d3724475d1f6032524752eaab0
> HCI Event: Number of Completed Packets (0x13) plen 5    #171 [hci1] 13.095100
        Num handles: 1
        Handle: 2289 Address: DF:A9:FF:F6:B1:1A (OUI DF-A9-FF)
        Count: 1
        #170: len 21 (1 Kb/s)
        Latency: 163 msec (68-174 msec ~163 msec)
> ACL Data RX: Handle 2289 flags 0x02 dlen 21             #172 [hci1] 13.095471
      SMP: Pairing Random (0x04) len 16
        Random value: 1891a686512a8ca30000000000000000
< HCI Command: Host Number of Com.. (0x03|0x0035) plen 5  #173 [hci1] 13.111714
        Num handles: 1
        Handle: 2289 Address: DF:A9:FF:F6:B1:1A (OUI DF-A9-FF)
        Count: 1
< ACL Data TX: Handle 2289 flags 0x00 dlen 21             #174 [hci1] 13.111812
      SMP: Pairing Random (0x04) len 16
        Random value: 297efe85e67448a15f56bd27e3a3cf1d
> HCI Event: Number of Completed Packets (0x13) plen 5    #175 [hci1] 13.269849
        Num handles: 1
        Handle: 2289 Address: DF:A9:FF:F6:B1:1A (OUI DF-A9-FF)
        Count: 1
        #174: len 21 (1 Kb/s)
        Latency: 158 msec (68-174 msec ~160 msec)
> ACL Data RX: Handle 2289 flags 0x02 dlen 21             #176 [hci1] 13.357741
      SMP: Pairing Confirm (0x03) len 16
        Confim value: 71905f26f1e6fcfe8bf4d91c58c56f67
< HCI Command: Host Number of Com.. (0x03|0x0035) plen 5  #177 [hci1] 13.371167
        Num handles: 1
        Handle: 2289 Address: DF:A9:FF:F6:B1:1A (OUI DF-A9-FF)
        Count: 1
< ACL Data TX: Handle 2289 flags 0x00 dlen 21             #178 [hci1] 13.371243
      SMP: Pairing Confirm (0x03) len 16
        Confim value: e706f5f32380691ceda4c8bbe63f0bb7
> HCI Event: Number of Completed Packets (0x13) plen 5    #179 [hci1] 13.532577
        Num handles: 1
        Handle: 2289 Address: DF:A9:FF:F6:B1:1A (OUI DF-A9-FF)
        Count: 1
        #178: len 21 (1 Kb/s)
        Latency: 161 msec (68-174 msec ~161 msec)
> ACL Data RX: Handle 2289 flags 0x02 dlen 21             #180 [hci1] 13.532918
      SMP: Pairing Random (0x04) len 16
        Random value: 6a500d25bffa16870000000000000000
< HCI Command: Host Number of Com.. (0x03|0x0035) plen 5  #181 [hci1] 13.551628
        Num handles: 1
        Handle: 2289 Address: DF:A9:FF:F6:B1:1A (OUI DF-A9-FF)
        Count: 1
< ACL Data TX: Handle 2289 flags 0x00 dlen 21             #182 [hci1] 13.551799
      SMP: Pairing Random (0x04) len 16
        Random value: 25a9493fd3ce4faf02be7293595bb7c6
> HCI Event: Number of Completed Packets (0x13) plen 5    #183 [hci1] 13.707403
        Num handles: 1
        Handle: 2289 Address: DF:A9:FF:F6:B1:1A (OUI DF-A9-FF)
        Count: 1
        #182: len 21 (1 Kb/s)
        Latency: 155 msec (68-174 msec ~158 msec)
> ACL Data RX: Handle 2289 flags 0x02 dlen 21             #184 [hci1] 13.795291
      SMP: Pairing Confirm (0x03) len 16
        Confim value: cae005e5211b4e24dd31820c2d722ff4
< HCI Command: Host Number of Com.. (0x03|0x0035) plen 5  #185 [hci1] 13.811384
        Num handles: 1
        Handle: 2289 Address: DF:A9:FF:F6:B1:1A (OUI DF-A9-FF)
        Count: 1
< ACL Data TX: Handle 2289 flags 0x00 dlen 21             #186 [hci1] 13.811434
      SMP: Pairing Confirm (0x03) len 16
        Confim value: 7ecb70d6617e6315f7b41b72733dceee
> HCI Event: Number of Completed Packets (0x13) plen 5    #187 [hci1] 13.970050
        Num handles: 1
        Handle: 2289 Address: DF:A9:FF:F6:B1:1A (OUI DF-A9-FF)
        Count: 1
        #186: len 21 (1 Kb/s)
        Latency: 158 msec (68-174 msec ~158 msec)
> ACL Data RX: Handle 2289 flags 0x02 dlen 21             #188 [hci1] 13.970467
      SMP: Pairing Random (0x04) len 16
        Random value: 59b0c768082db18a0000000000000000
< HCI Command: Host Number of Com.. (0x03|0x0035) plen 5  #189 [hci1] 13.971616
        Num handles: 1
        Handle: 2289 Address: DF:A9:FF:F6:B1:1A (OUI DF-A9-FF)
        Count: 1
< ACL Data TX: Handle 2289 flags 0x00 dlen 21             #190 [hci1] 13.971692
      SMP: Pairing Random (0x04) len 16
        Random value: 58f6b41f855a6f6c3560debd84e2affc
> HCI Event: Number of Completed Packets (0x13) plen 5    #191 [hci1] 14.144841
        Num handles: 1
        Handle: 2289 Address: DF:A9:FF:F6:B1:1A (OUI DF-A9-FF)
        Count: 1
        #190: len 21 (0 Kb/s)
        Latency: 173 msec (68-174 msec ~165 msec)
> ACL Data RX: Handle 2289 flags 0x02 dlen 21             #192 [hci1] 14.232730
      SMP: Pairing Confirm (0x03) len 16
        Confim value: aa10fd3aabb6d7417381773e00e424bb
< HCI Command: Host Number of Com.. (0x03|0x0035) plen 5  #193 [hci1] 14.251585
        Num handles: 1
        Handle: 2289 Address: DF:A9:FF:F6:B1:1A (OUI DF-A9-FF)
        Count: 1
< ACL Data TX: Handle 2289 flags 0x00 dlen 21             #194 [hci1] 14.251735
      SMP: Pairing Confirm (0x03) len 16
        Confim value: 99884fa29f11a00f31892ac988033e59
> HCI Event: Number of Completed Packets (0x13) plen 5    #195 [hci1] 14.407559
        Num handles: 1
        Handle: 2289 Address: DF:A9:FF:F6:B1:1A (OUI DF-A9-FF)
        Count: 1
        #194: len 21 (1 Kb/s)
        Latency: 155 msec (68-174 msec ~160 msec)
> ACL Data RX: Handle 2289 flags 0x02 dlen 21             #196 [hci1] 14.407907
      SMP: Pairing Random (0x04) len 16
        Random value: 234fd00514189f1f0000000000000000
< HCI Command: Host Number of Com.. (0x03|0x0035) plen 5  #197 [hci1] 14.411661
        Num handles: 1
        Handle: 2289 Address: DF:A9:FF:F6:B1:1A (OUI DF-A9-FF)
        Count: 1
< ACL Data TX: Handle 2289 flags 0x00 dlen 21             #198 [hci1] 14.411827
      SMP: Pairing Random (0x04) len 16
        Random value: b67e7216d5bf664139eda2b542549666
> HCI Event: Number of Completed Packets (0x13) plen 5    #199 [hci1] 14.582396
        Num handles: 1
        Handle: 2289 Address: DF:A9:FF:F6:B1:1A (OUI DF-A9-FF)
        Count: 1
        #198: len 21 (0 Kb/s)
        Latency: 170 msec (68-174 msec ~165 msec)
> ACL Data RX: Handle 2289 flags 0x02 dlen 21             #200 [hci1] 14.670229
      SMP: Pairing Confirm (0x03) len 16
        Confim value: b26d2e514ca321d34eaf1ea086b22849
< HCI Command: Host Number of Com.. (0x03|0x0035) plen 5  #201 [hci1] 14.671061
        Num handles: 1
        Handle: 2289 Address: DF:A9:FF:F6:B1:1A (OUI DF-A9-FF)
        Count: 1
< ACL Data TX: Handle 2289 flags 0x00 dlen 21             #202 [hci1] 14.671069
      SMP: Pairing Confirm (0x03) len 16
        Confim value: 880ebe9a0d3609ffcd95734a4e5133bc
> HCI Event: Number of Completed Packets (0x13) plen 5    #203 [hci1] 14.845107
        Num handles: 1
        Handle: 2289 Address: DF:A9:FF:F6:B1:1A (OUI DF-A9-FF)
        Count: 1
        #202: len 21 (0 Kb/s)
        Latency: 174 msec (68-174 msec ~169 msec)
> ACL Data RX: Handle 2289 flags 0x02 dlen 21             #204 [hci1] 14.845406
      SMP: Pairing Random (0x04) len 16
        Random value: c669bbb1db8aaaf60000000000000000
< HCI Command: Host Number of Com.. (0x03|0x0035) plen 5  #205 [hci1] 14.851698
        Num handles: 1
        Handle: 2289 Address: DF:A9:FF:F6:B1:1A (OUI DF-A9-FF)
        Count: 1
< ACL Data TX: Handle 2289 flags 0x00 dlen 21             #206 [hci1] 14.851881
      SMP: Pairing Random (0x04) len 16
        Random value: ed17f76500c95219dd01e09d1e63f87b
> HCI Event: Number of Completed Packets (0x13) plen 5    #207 [hci1] 15.019875
        Num handles: 1
        Handle: 2289 Address: DF:A9:FF:F6:B1:1A (OUI DF-A9-FF)
        Count: 1
        #206: len 21 (1 Kb/s)
        Latency: 167 msec (68-174 msec ~168 msec)
> ACL Data RX: Handle 2289 flags 0x02 dlen 21             #208 [hci1] 15.107706
      SMP: Pairing Confirm (0x03) len 16
        Confim value: 2f4657c2ac82906026ef5584e9a344e6
< HCI Command: Host Number of Com.. (0x03|0x0035) plen 5  #209 [hci1] 15.111552
        Num handles: 1
        Handle: 2289 Address: DF:A9:FF:F6:B1:1A (OUI DF-A9-FF)
        Count: 1
< ACL Data TX: Handle 2289 flags 0x00 dlen 21             #210 [hci1] 15.111661
      SMP: Pairing Confirm (0x03) len 16
        Confim value: 2cb2ebaf5dab3b428bf40a247a5b44d7
> HCI Event: Number of Completed Packets (0x13) plen 5    #211 [hci1] 15.282559
        Num handles: 1
        Handle: 2289 Address: DF:A9:FF:F6:B1:1A (OUI DF-A9-FF)
        Count: 1
        #210: len 21 (0 Kb/s)
        Latency: 170 msec (68-174 msec ~169 msec)
> ACL Data RX: Handle 2289 flags 0x02 dlen 21             #212 [hci1] 15.282893
      SMP: Pairing Random (0x04) len 16
        Random value: c0c38fa1297965230000000000000000
< HCI Command: Host Number of Com.. (0x03|0x0035) plen 5  #213 [hci1] 15.291193
        Num handles: 1
        Handle: 2289 Address: DF:A9:FF:F6:B1:1A (OUI DF-A9-FF)
        Count: 1
< ACL Data TX: Handle 2289 flags 0x00 dlen 21             #214 [hci1] 15.291225
      SMP: Pairing Random (0x04) len 16
        Random value: 81d35d47e1f6006d79c974bd9d9e1ee3
> HCI Event: Number of Completed Packets (0x13) plen 5    #215 [hci1] 15.457332
        Num handles: 1
        Handle: 2289 Address: DF:A9:FF:F6:B1:1A (OUI DF-A9-FF)
        Count: 1
        #214: len 21 (1 Kb/s)
        Latency: 166 msec (68-174 msec ~168 msec)
> ACL Data RX: Handle 2289 flags 0x02 dlen 21             #216 [hci1] 15.545213
      SMP: Pairing Confirm (0x03) len 16
        Confim value: 2dd25acad62d5362a462ac1481bbdcd6
< HCI Command: Host Number of Com.. (0x03|0x0035) plen 5  #217 [hci1] 15.551336
        Num handles: 1
        Handle: 2289 Address: DF:A9:FF:F6:B1:1A (OUI DF-A9-FF)
        Count: 1
< ACL Data TX: Handle 2289 flags 0x00 dlen 21             #218 [hci1] 15.551476
      SMP: Pairing Confirm (0x03) len 16
        Confim value: 4b1df2627ad03a8a9dea2c2afe6736f7
> HCI Event: Number of Completed Packets (0x13) plen 5    #219 [hci1] 15.720060
        Num handles: 1
        Handle: 2289 Address: DF:A9:FF:F6:B1:1A (OUI DF-A9-FF)
        Count: 1
        #218: len 21 (1 Kb/s)
        Latency: 168 msec (68-174 msec ~168 msec)
> ACL Data RX: Handle 2289 flags 0x02 dlen 21             #220 [hci1] 15.720458
      SMP: Pairing Random (0x04) len 16
        Random value: 217459b95838e2690000000000000000
< HCI Command: Host Number of Com.. (0x03|0x0035) plen 5  #221 [hci1] 15.731715
        Num handles: 1
        Handle: 2289 Address: DF:A9:FF:F6:B1:1A (OUI DF-A9-FF)
        Count: 1
< ACL Data TX: Handle 2289 flags 0x00 dlen 21             #222 [hci1] 15.731860
      SMP: Pairing Random (0x04) len 16
        Random value: e7f7e0c2476823e41736a7e381bafb7c
> HCI Event: Number of Completed Packets (0x13) plen 5    #223 [hci1] 15.894830
        Num handles: 1
        Handle: 2289 Address: DF:A9:FF:F6:B1:1A (OUI DF-A9-FF)
        Count: 1
        #222: len 21 (1 Kb/s)
        Latency: 162 msec (68-174 msec ~165 msec)
> ACL Data RX: Handle 2289 flags 0x02 dlen 21             #224 [hci1] 15.982698
      SMP: Pairing Confirm (0x03) len 16
        Confim value: 1ac7cbc28abcc7d925448d48d0f43038
< HCI Command: Host Number of Com.. (0x03|0x0035) plen 5  #225 [hci1] 15.991536
        Num handles: 1
        Handle: 2289 Address: DF:A9:FF:F6:B1:1A (OUI DF-A9-FF)
        Count: 1
< ACL Data TX: Handle 2289 flags 0x00 dlen 21             #226 [hci1] 15.991638
      SMP: Pairing Confirm (0x03) len 16
        Confim value: 8fa421fbb0d7889db13b031c4c1d7992
> HCI Event: Number of Completed Packets (0x13) plen 5    #227 [hci1] 16.157652
        Num handles: 1
        Handle: 2289 Address: DF:A9:FF:F6:B1:1A (OUI DF-A9-FF)
        Count: 1
        #226: len 21 (1 Kb/s)
        Latency: 166 msec (68-174 msec ~165 msec)
> ACL Data RX: Handle 2289 flags 0x02 dlen 21             #228 [hci1] 16.157982
      SMP: Pairing Random (0x04) len 16
        Random value: 67d28c85179621b00000000000000000
