Bluetooth monitor ver 5.72
= Note: Linux version 6.14.0-36-generic (x86_64)                       0.302111
= Note: Bluetooth subsystem version 2.22                               0.302112
= New Index: 00:00:00:00:00:00 (Primary,UART,hci1)              [hci1] 0.302113
= New Index: 48:5F:99:8E:E0:64 (Primary,USB,hci0)               [hci0] 0.302114
= Open Index: 00:00:00:00:00:00                                 [hci1] 0.425225
= Index Info: 00:00:00:00:00:00 (Nordic Semiconductor ASA)      [hci1] 0.425230
@ USER Open: main (privileged) version 2.22            {0x0001} [hci1] 0.425233
< HCI Command: Reset (0x03|0x0003) plen 0                    #1 [hci1] 0.425633
> HCI Event: Command Complete (0x0e) plen 4                  #2 [hci1] 0.426150
      Reset (0x03|0x0003) ncmd 1
        Status: Success (0x00)
< HCI Command: Read Local Supported... (0x04|0x0003) plen 0  #3 [hci1] 0.445206
> HCI Event: Command Complete (0x0e) plen 12                 #4 [hci1] 0.445695
      Read Local Supported Features (0x04|0x0003) ncmd 1
        Status: Success (0x00)
        Features: 0x00 0x00 0x00 0x00 0x60 0x00 0x00 0x00
          BR/EDR Not Supported
          LE Supported (Controller)
< HCI Command: Read Local Version In.. (0x04|0x0001) plen 0  #5 [hci1] 0.465192
> HCI Event: Command Complete (0x0e) plen 12                 #6 [hci1] 0.465760
      Read Local Version Information (0x04|0x0001) ncmd 1
        Status: Success (0x00)
        HCI version: Reserved (0x0f) - Revision 12393 (0x3069)
        LMP version: Reserved (0x0f) - Subversion 12393 (0x3069)
        Manufacturer: Nordic Semiconductor ASA (89)
< HCI Command: Read Local Supported... (0x04|0x0002) plen 0  #7 [hci1] 0.485208
> HCI Event: Command Complete (0x0e) plen 68                 #8 [hci1] 0.486242
      Read Local Supported Commands (0x04|0x0002) ncmd 1
        Status: Success (0x00)
        Commands: 119 entries
          Disconnect (Octet 0 - Bit 5)
          Read Remote Version Information (Octet 2 - Bit 7)
          Set Event Mask (Octet 5 - Bit 6)
          Reset (Octet 5 - Bit 7)
          Read Connection Accept Timeout (Octet 7 - Bit 2)
          Write Connection Accept Timeout (Octet 7 - Bit 3)
          Read Transmit Power Level (Octet 10 - Bit 2)
          Set Controller To Host Flow Control (Octet 10 - Bit 5)
          Host Buffer Size (Octet 10 - Bit 6)
          Host Number of Completed Packets (Octet 10 - Bit 7)
          Read Local Version Information (Octet 14 - Bit 3)
          Read Local Supported Features (Octet 14 - Bit 5)
          Read BD ADDR (Octet 15 - Bit 1)
          Read RSSI (Octet 15 - Bit 5)
          Set Event Mask Page 2 (Octet 22 - Bit 2)
          LE Set Event Mask (Octet 25 - Bit 0)
          LE Read Buffer Size (Octet 25 - Bit 1)
          LE Read Local Supported Features (Octet 25 - Bit 2)
          LE Set Random Address (Octet 25 - Bit 4)
          LE Set Advertising Parameters (Octet 25 - Bit 5)
          LE Read Advertising Channel TX Power (Octet 25 - Bit 6)
          LE Set Advertising Data (Octet 25 - Bit 7)
          LE Set Scan Response Data (Octet 26 - Bit 0)
          LE Set Advertise Enable (Octet 26 - Bit 1)
          LE Set Scan Parameters (Octet 26 - Bit 2)
          LE Set Scan Enable (Octet 26 - Bit 3)
          LE Create Connection (Octet 26 - Bit 4)
          LE Create Connection Cancel (Octet 26 - Bit 5)
          LE Read Accept List Size (Octet 26 - Bit 6)
          LE Clear Accept List (Octet 26 - Bit 7)
          LE Add Device To Accept List (Octet 27 - Bit 0)
          LE Remove Device From Accept List (Octet 27 - Bit 1)
          LE Connection Update (Octet 27 - Bit 2)
          LE Set Host Channel Classification (Octet 27 - Bit 3)
          LE Read Channel Map (Octet 27 - Bit 4)
          LE Read Remote Used Features (Octet 27 - Bit 5)
          LE Encrypt (Octet 27 - Bit 6)
          LE Rand (Octet 27 - Bit 7)
          LE Start Encryption (Octet 28 - Bit 0)
          LE Long Term Key Request Reply (Octet 28 - Bit 1)
          LE Long Term Key Request Neg Reply (Octet 28 - Bit 2)
          LE Read Supported States (Octet 28 - Bit 3)
          LE Receiver Test (Octet 28 - Bit 4)
          LE Transmitter Test (Octet 28 - Bit 5)
          LE Test End (Octet 28 - Bit 6)
          Read Authenticated Payload Timeout (Octet 32 - Bit 4)
          Write Authenticated Payload Timeout (Octet 32 - Bit 5)
          LE Set Data Length (Octet 33 - Bit 6)
          LE Read Suggested Default Data Length (Octet 33 - Bit 7)
          LE Write Suggested Default Data Length (Octet 34 - Bit 0)
          LE Add Device To Resolving List (Octet 34 - Bit 3)
          LE Remove Device From Resolving List (Octet 34 - Bit 4)
          LE Clear Resolving List (Octet 34 - Bit 5)
          LE Read Resolving List Size (Octet 34 - Bit 6)
          LE Set Address Resolution Enable (Octet 35 - Bit 1)
          LE Set Resolvable Private Address Timeout (Octet 35 - Bit 2)
          LE Read Maximum Data Length (Octet 35 - Bit 3)
          LE Read PHY (Octet 35 - Bit 4)
          LE Set Default PHY (Octet 35 - Bit 5)
          LE Set PHY (Octet 35 - Bit 6)
          LE Enhanced Receiver Test (Octet 35 - Bit 7)
          LE Enhanced Transmitter Test (Octet 36 - Bit 0)
          LE Set Advertising Set Random Address (Octet 36 - Bit 1)
          LE Set Extended Advertising Parameters (Octet 36 - Bit 2)
          LE Set Extended Advertising Data (Octet 36 - Bit 3)
          LE Set Extended Scan Response Data (Octet 36 - Bit 4)
          LE Set Extended Advertising Enable (Octet 36 - Bit 5)
          LE Read Maximum Advertising Data Length (Octet 36 - Bit 6)
          LE Read Number of Supported Advertising Sets (Octet 36 - Bit 7)
          LE Remove Advertising Set (Octet 37 - Bit 0)
          LE Clear Advertising Sets (Octet 37 - Bit 1)
          LE Set Periodic Advertising Parameters (Octet 37 - Bit 2)
          LE Set Periodic Advertising Data (Octet 37 - Bit 3)
          LE Set Periodic Advertising Enable (Octet 37 - Bit 4)
          LE Set Extended Scan Parameters (Octet 37 - Bit 5)
          LE Set Extended Scan Enable (Octet 37 - Bit 6)
          LE Extended Create Connection (Octet 37 - Bit 7)
          LE Periodic Advertising Create Sync (Octet 38 - Bit 0)
          LE Periodic Advertising Create Sync Cancel (Octet 38 - Bit 1)
          LE Periodic Advertising Terminate Sync (Octet 38 - Bit 2)
          LE Add Device To Periodic Advertiser List (Octet 38 - Bit 3)
          LE Remove Device From Periodic Advertiser List (Octet 38 - Bit 4)
          LE Clear Periodic Advertiser List (Octet 38 - Bit 5)
          LE Read Periodic Advertiser List Size (Octet 38 - Bit 6)
          LE Read Transmit Power (Octet 38 - Bit 7)
          LE Read RF Path Compensation (Octet 39 - Bit 0)
          LE Write RF Path Compensation (Octet 39 - Bit 1)
          LE Set Privacy Mode (Octet 39 - Bit 2)
          LE Periodic Advertising Receive Enable (Octet 40 - Bit 5)
          LE Periodic Advertising Sync Transfer (Octet 40 - Bit 6)
          LE Periodic Advertising Set Info Transfer (Octet 40 - Bit 7)
          LE Periodic Advertising Sync Transfer Parameters (Octet 41 - Bit 0)
          LE Set Default Periodic Advertisng Sync Transfer Parameters (Octet 41 - Bit 1)
          LE Read Buffer v2 (Octet 41 - Bit 5)
          LE Read ISO TX Sync (Octet 41 - Bit 6)
          LE Set Connected Isochronous Group Parameters (Octet 41 - Bit 7)
          LE Set Connected Isochronous Group Parameters Test (Octet 42 - Bit 0)
          LE Create Connected Isochronous Stream (Octet 42 - Bit 1)
          LE Remove Connected Isochronous Group (Octet 42 - Bit 2)
          LE Accept Connected Isochronous Stream Request (Octet 42 - Bit 3)
          LE Reject Connected Isochronous Stream Request (Octet 42 - Bit 4)
          LE Create Broadcast Isochronous Group (Octet 42 - Bit 5)
          LE Create Broadcast Isochronous Group Test (Octet 42 - Bit 6)
          LE Terminate Broadcast Isochronous Group (Octet 42 - Bit 7)
          LE Broadcast Isochronous Group Create Sync (Octet 43 - Bit 0)
          LE Broadcast Isochronous Group Terminate Sync (Octet 43 - Bit 1)
          LE Request Peer SCA (Octet 43 - Bit 2)
          LE Setup Isochronous Data Path (Octet 43 - Bit 3)
          LE Remove Isochronous Data Path (Octet 43 - Bit 4)
          LE Isochronous Transmit Test (Octet 43 - Bit 5)
          LE Isochronous Receive Test (Octet 43 - Bit 6)
          LE Isochronous Read Test Counters (Octet 43 - Bit 7)
          LE Isochronous Read Test Counters (Octet 44 - Bit 0)
          LE Set Host Feature (Octet 44 - Bit 1)
          Octet 44 - Bit 2 
          Octet 45 - Bit 6 
          Octet 46 - Bit 0 
          Octet 46 - Bit 1 
          Octet 46 - Bit 2 
< HCI Command: Host Buffer Size (0x03|0x0033) plen 7         #9 [hci1] 0.505262
        ACL MTU: 255  ACL max packet: 16
        SCO MTU: 0    SCO max packet: 0
> HCI Event: Command Complete (0x0e) plen 4                 #10 [hci1] 0.505701
      Host Buffer Size (0x03|0x0033) ncmd 1
        Status: Success (0x00)
< HCI Command: Set Controller To Ho.. (0x03|0x0031) plen 1  #11 [hci1] 0.525238
        Flow control: ACL Data Packets (0x01)
> HCI Event: Command Complete (0x0e) plen 4                 #12 [hci1] 0.525750
      Set Controller To Host Flow Control (0x03|0x0031) ncmd 1
        Status: Success (0x00)
< HCI Command: LE Read Local Suppor.. (0x08|0x0003) plen 0  #13 [hci1] 0.545193
> HCI Event: Command Complete (0x0e) plen 12                #14 [hci1] 0.545728
      LE Read Local Supported Features (0x08|0x0003) ncmd 1
        Status: Success (0x00)
        Features: 0xfd 0x79 0x00 0xf7 0x30 0x01 0x00 0x00
          LE Encryption
          Extended Reject Indication
          Peripheral-initiated Features Exchange
          LE Ping
          LE Data Packet Length Extension
          LL Privacy
          Extended Scanner Filter Policies
          LE 2M PHY
          LE Coded PHY
          LE Extended Advertising
          LE Periodic Advertising
          Channel Selection Algorithm #2
          Periodic Advertising Sync Transfer - Sender
          Periodic Advertising Sync Transfer - Recipient
          Sleep Clock Accuracy Updates
          Connected Isochronous Stream - Central
          Connected Isochronous Stream - Peripheral
          Isochronous Broadcaster
          Synchronized Receiver
          Periodic Advertising ADI support
          Connection Subrating
          Unknown features (0x0000010000000000)
< HCI Command: LE Set Host Feature (0x08|0x0074) plen 2     #15 [hci1] 0.565207
        Bit Number: 32
          Connected Isochronous Stream (Host Support)
        Bit Value: 1
> HCI Event: Command Complete (0x0e) plen 4                 #16 [hci1] 0.565726
      LE Set Host Feature (0x08|0x0074) ncmd 1
        Status: Success (0x00)
< HCI Command: LE Read Buffer v2 (0x08|0x0060) plen 0       #17 [hci1] 0.585191
> HCI Event: Command Complete (0x0e) plen 10                #18 [hci1] 0.585700
      LE Read Buffer v2 (0x08|0x0060) ncmd 1
        Status: Success (0x00)
        ACL MTU: 27
        ACL max packet: 3
        ISO MTU: 318
        ISO max packet: 3
< HCI Command: LE Read Maximum Adve.. (0x08|0x003a) plen 0  #19 [hci1] 0.605222
> HCI Event: Command Complete (0x0e) plen 6                 #20 [hci1] 0.605727
      LE Read Maximum Advertising Data Length (0x08|0x003a) ncmd 1
        Status: Success (0x00)
        Max length: 1650
< HCI Command: LE Read Supported St.. (0x08|0x001c) plen 0  #21 [hci1] 0.625205
> HCI Event: Command Complete (0x0e) plen 12                #22 [hci1] 0.625719
      LE Read Supported States (0x08|0x001c) ncmd 1
        Status: Success (0x00)
        States: 0x000003ff3e0306ff
          Non-connectable Advertising State
          Scannable Advertising State
          Connectable Advertising State
          High Duty Cycle Directed Advertising State
          Passive Scanning State
          Active Scanning State
          Initiating State
            and Connection State (Central Role)
          Connection State (Peripheral Role)
          Scannable Advertising State
            and Passive Scanning State
          Connectable Advertising State
            and Passive Scanning State
          Non-connectable Advertising State
            and Initiating State
          Scannable Advertising State
            and Initiating State
          Active Scanning State
            and Connection State (Central Role)
          Passive Scanning State
            and Connection State (Peripheral Role)
          Active Scanning State
            and Connection State (Peripheral Role)
          Initiating State
            and Connection State (Central Role)
            and Central Role & Central Role
          Low Duty Cycle Directed Advertising State
          Connectable Advertising State
            and Initiating State
            and Central Role & Peripheral Role
          High Duty Cycle Directed Advertising State
            and Initiating State
            and Central Role & Peripheral Role
          Low Duty Cycle Directed Advertising State
            and Initiating State
            and Central Role & Peripheral Role
          Connectable Advertising State
            and Connection State (Central Role)
            and Central Role & Peripheral Role
          High Duty Cycle Directed Advertising State
            and Connection State (Central Role)
            and Central Role & Peripheral Role
          Low Duty Cycle Directed Advertising State
            and Connection State (Central Role)
            and Central Role & Peripheral Role
          Connectable Advertising State
            and Connection State (Peripheral Role)
            and Central Role & Peripheral Role
          High Duty Cycle Directed Advertising State
            and Connection State (Peripheral Role)
            and Peripheral Role & Peripheral Role
          Low Duty Cycle Directed Advertising State
            and Connection State (Peripheral Role)
            and Peripheral Role & Peripheral Role
          Initiating State
            and Connection State (Peripheral Role)
            and Central Role & Peripheral Role
< HCI Command: LE Read Maximum Data.. (0x08|0x002f) plen 0  #23 [hci1] 0.645191
> HCI Event: Command Complete (0x0e) plen 12                #24 [hci1] 0.645721
      LE Read Maximum Data Length (0x08|0x002f) ncmd 1
        Status: Success (0x00)
        Max TX octets: 251
        Max TX time: 2704
        Max RX octets: 251
        Max RX time: 2704
< HCI Command: LE Write Suggested D.. (0x08|0x0024) plen 4  #25 [hci1] 0.665223
        TX octets: 251
        TX time: 2704
> HCI Event: Command Complete (0x0e) plen 4                 #26 [hci1] 0.665790
      LE Write Suggested Default Data Length (0x08|0x0024) ncmd 1
        Status: Success (0x00)
< HCI Command: LE Read Resolving Li.. (0x08|0x002a) plen 0  #27 [hci1] 0.685208
> HCI Event: Command Complete (0x0e) plen 5                 #28 [hci1] 0.685586
      LE Read Resolving List Size (0x08|0x002a) ncmd 1
        Status: Success (0x00)
        Size: 8
< HCI Command: LE Set Host Feature (0x08|0x0074) plen 2     #29 [hci1] 0.705202
        Bit Number: 38
          Connection Subrating (Host Support)
        Bit Value: 1
> HCI Event: Command Complete (0x0e) plen 4                 #30 [hci1] 0.705696
      LE Set Host Feature (0x08|0x0074) ncmd 1
        Status: Success (0x00)
< HCI Command: LE Set Event Mask (0x08|0x0001) plen 8       #31 [hci1] 0.725195
        Mask: 0x000002063f87fa5e
          LE Advertising Report
          LE Connection Update Complete
          LE Read Remote Used Features Complete
          LE Long Term Key Request
          LE Data Length Change
          LE Enhanced Connection Complete
          LE PHY Update Complete
          LE Extended Advertising Report
          LE Periodic Advertising Sync Established
          LE Periodic Advertising Report
          LE Periodic Advertising Sync Lost
          LE Extended Scan Timeout
          LE Extended Advertising Set Terminated
          LE Scan Request Received
          LE Periodic Advertising Sync Transfer Rvc
          LE CIS Established
          LE CIS Request
          LE Create BIG Complete
          LE Terminate BIG Complete
          LE BIG Sync Estabilished Complete
          LE BIG Sync Lost
          LE BIG Info Advertising Report
          LE Subrate Change
          Unknown mask (0x0000020000000000)
> HCI Event: Command Complete (0x0e) plen 4                 #32 [hci1] 0.725736
      LE Set Event Mask (0x08|0x0001) ncmd 1
        Status: Success (0x00)
< HCI Command: Set Event Mask (0x03|0x0001) plen 8          #33 [hci1] 0.745220
        Mask: 0x2000800002008890
          Disconnection Complete
          Encryption Change
          Read Remote Version Information Complete
          Hardware Error
          Data Buffer Overflow
          Encryption Key Refresh Complete
          LE Meta
> HCI Event: Command Complete (0x0e) plen 4                 #34 [hci1] 0.745792
      Set Event Mask (0x03|0x0001) ncmd 1
        Status: Success (0x00)
< HCI Command: Read BD ADDR (0x04|0x0009) plen 0            #35 [hci1] 0.765201
> HCI Event: Command Complete (0x0e) plen 10                #36 [hci1] 0.765772
      Read BD ADDR (0x04|0x0009) ncmd 1
        Status: Success (0x00)
        Address: 00:00:00:00:00:00 (OUI 00-00-00)
< HCI Command: LE Set Random Address (0x08|0x0005) plen 6   #37 [hci1] 0.785212
        Address: D5:B6:CC:31:DB:3B (Static)
> HCI Event: Command Complete (0x0e) plen 4                 #38 [hci1] 0.785709
      LE Set Random Address (0x08|0x0005) ncmd 1
        Status: Success (0x00)
< HCI Command: LE Set Extended Adv.. (0x08|0x0036) plen 25  #39 [hci1] 3.225366
        Handle: 0x00
        Properties: 0x0013
          Connectable
          Scannable
          Use legacy advertising PDUs: ADV_IND
        Min advertising interval: 100.000 msec (0x00a0)
        Max advertising interval: 150.000 msec (0x00f0)
        Channel map: 37, 38, 39 (0x07)
        Own address type: Random (0x01)
        Peer address type: Public (0x00)
        Peer address: 00:00:00:00:00:00 (OUI 00-00-00)
        Filter policy: Allow Scan Request from Any, Allow Connect Request from Any (0x00)
        TX power: Host has no preference (0x7f)
        Primary PHY: LE 1M (0x01)
        Secondary max skip: 0x00
        Secondary PHY: LE 1M (0x01)
        SID: 0x00
        Scan request notifications: Disabled (0x00)
> HCI Event: Command Complete (0x0e) plen 5                 #40 [hci1] 3.226146
      LE Set Extended Advertising Parameters (0x08|0x0036) ncmd 1
        Status: Success (0x00)
        TX power (selected): 0 dbm (0x00)
< HCI Command: LE Set Advertising S.. (0x08|0x0035) plen 7  #41 [hci1] 3.245249
        Advertising handle: 0x00
        Advertising random address: D5:B6:CC:31:DB:3B (Static)
> HCI Event: Command Complete (0x0e) plen 4                 #42 [hci1] 3.245764
      LE Set Advertising Set Random Address (0x08|0x0035) ncmd 1
        Status: Success (0x00)
< HCI Command: LE Set Extended Adv.. (0x08|0x0037) plen 22  #43 [hci1] 3.265235
        Handle: 0x00
        Operation: Complete extended advertising data (0x03)
        Fragment preference: Minimize fragmentation (0x01)
        Data length: 0x12
        Flags: 0x06
          LE General Discoverable Mode
          BR/EDR Not Supported
        Name (complete): Tester_F6B11A
> HCI Event: Command Complete (0x0e) plen 4                 #44 [hci1] 3.265953
      LE Set Extended Advertising Data (0x08|0x0037) ncmd 1
        Status: Success (0x00)
< HCI Command: LE Set Extended Scan.. (0x08|0x0038) plen 4  #45 [hci1] 3.285270
        Handle: 0x00
        Operation: Complete scan response data (0x03)
        Fragment preference: Minimize fragmentation (0x01)
        Data length: 0x00
> HCI Event: Command Complete (0x0e) plen 4                 #46 [hci1] 3.285761
      LE Set Extended Scan Response Data (0x08|0x0038) ncmd 1
        Status: Success (0x00)
< HCI Command: LE Set Extended Adve.. (0x08|0x0039) plen 6  #47 [hci1] 3.305275
        Extended advertising: Enabled (0x01)
        Number of sets: 1 (0x01)
        Entry 0
          Handle: 0x00
          Duration: 0 ms (0x00)
          Max ext adv events: 0
> HCI Event: Command Complete (0x0e) plen 4                 #48 [hci1] 3.305818
      LE Set Extended Advertising Enable (0x08|0x0039) ncmd 1
        Status: Success (0x00)
> HCI Event: LE Meta Event (0x3e) plen 31                   #49 [hci1] 3.420885
      LE Enhanced Connection Complete (0x0a)
        Status: Success (0x00)
        Handle: 2595
        Role: Peripheral (0x01)
        Peer address type: Public (0x00)
        Peer address: DF:A9:FF:F6:B1:1A (OUI DF-A9-FF)
        Local resolvable private address: 00:00:00:00:00:00 (Non-Resolvable)
        Peer resolvable private address: 00:00:00:00:00:00 (Non-Resolvable)
        Connection interval: 87.50 msec (0x0046)
        Connection latency: 0 (0x0000)
        Supervision timeout: 25120 msec (0x09d0)
        Central clock accuracy: 0x01
> HCI Event: LE Meta Event (0x3e) plen 6                    #50 [hci1] 3.420891
      LE Advertising Set Terminated (0x12)
        Status: Success (0x00)
        Handle: 0
        Connection handle: 2595
        Number of completed extended advertising events: 0
< HCI Command: LE Read Remote Used... (0x08|0x0016) plen 2  #51 [hci1] 3.426186
        Handle: 2595 Address: DF:A9:FF:F6:B1:1A (OUI DF-A9-FF)
< ACL Data TX: Handle 2595 flags 0x00 dlen 7                #52 [hci1] 3.426208
      ATT: Exchange MTU Request (0x02) len 2
        Client RX MTU: 251
> HCI Event: Command Status (0x0f) plen 4                   #53 [hci1] 3.426776
      LE Read Remote Used Features (0x08|0x0016) ncmd 1
        Status: Success (0x00)
> HCI Event: Number of Completed Packets (0x13) plen 5      #54 [hci1] 3.596735
        Num handles: 1
        Handle: 2595 Address: DF:A9:FF:F6:B1:1A (OUI DF-A9-FF)
        Count: 1
        #52: len 7 (0 Kb/s)
        Latency: 170 msec (170-170 msec ~170 msec)
> HCI Event: LE Meta Event (0x3e) plen 12                   #55 [hci1] 3.684565
      LE Read Remote Used Features (0x04)
        Status: Success (0x00)
        Handle: 2595 Address: DF:A9:FF:F6:B1:1A (OUI DF-A9-FF)
        Features: 0x2d 0x49 0x00 0xf7 0x67 0xd9 0x00 0x80
          LE Encryption
          Extended Reject Indication
          Peripheral-initiated Features Exchange
          LE Data Packet Length Extension
          LE 2M PHY
          LE Coded PHY
          Channel Selection Algorithm #2
          Periodic Advertising Sync Transfer - Sender
          Periodic Advertising Sync Transfer - Recipient
          Sleep Clock Accuracy Updates
          Connected Isochronous Stream - Central
          Connected Isochronous Stream - Peripheral
          Isochronous Broadcaster
          Synchronized Receiver
          Connected Isochronous Stream (Host Support)
          LE Power Control Request
          LE Power Control Request
          Connection Subrating
          Connection Subrating (Host Support)
          Unknown features (0x8000d90000000000)
> ACL Data RX: Handle 2595 flags 0x02 dlen 7                #56 [hci1] 4.121843
      ATT: Exchange MTU Request (0x02) len 2
        Client RX MTU: 60
> ACL Data RX: Handle 2595 flags 0x02 dlen 7                #57 [hci1] 4.122228
      ATT: Exchange MTU Response (0x03) len 2
        Server RX MTU: 60
< HCI Command: Host Number of Compl.. (0x03|0x0035) plen 5  #58 [hci1] 4.125697
        Num handles: 1
        Handle: 2595 Address: DF:A9:FF:F6:B1:1A (OUI DF-A9-FF)
        Count: 1
< ACL Data TX: Handle 2595 flags 0x00 dlen 7                #59 [hci1] 4.125783
      ATT: Exchange MTU Response (0x03) len 2
        Server RX MTU: 251
< HCI Command: Host Number of Compl.. (0x03|0x0035) plen 5  #60 [hci1] 4.126072
        Num handles: 1
        Handle: 2595 Address: DF:A9:FF:F6:B1:1A (OUI DF-A9-FF)
        Count: 1
> HCI Event: Number of Completed Packets (0x13) plen 5      #61 [hci1] 4.296599
        Num handles: 1
        Handle: 2595 Address: DF:A9:FF:F6:B1:1A (OUI DF-A9-FF)
        Count: 1
        #59: len 7 (0 Kb/s)
        Latency: 170 msec (170-170 msec ~170 msec)
> ACL Data RX: Handle 2595 flags 0x02 dlen 11               #62 [hci1] 6.309289
      SMP: Pairing Request (0x01) len 6
        IO capability: KeyboardDisplay (0x04)
        OOB data: Authentication data not present (0x00)
        Authentication requirement: Bonding, No MITM, SC, No Keypresses (0x09)
        Max encryption key size: 16
        Initiator key distribution: EncKey IdKey (0x03)
        Responder key distribution: EncKey IdKey Sign (0x07)
< HCI Command: Host Number of Compl.. (0x03|0x0035) plen 5  #63 [hci1] 6.325858
        Num handles: 1
        Handle: 2595 Address: DF:A9:FF:F6:B1:1A (OUI DF-A9-FF)
        Count: 1
< ACL Data TX: Handle 2595 flags 0x00 dlen 11               #64 [hci1] 6.325965
      SMP: Pairing Response (0x02) len 6
        IO capability: NoInputNoOutput (0x03)
        OOB data: Authentication data not present (0x00)
        Authentication requirement: Bonding, No MITM, SC, No Keypresses (0x09)
        Max encryption key size: 16
        Initiator key distribution: IdKey (0x02)
        Responder key distribution: <none> (0x00)
> HCI Event: Number of Completed Packets (0x13) plen 5      #65 [hci1] 6.484430
        Num handles: 1
        Handle: 2595 Address: DF:A9:FF:F6:B1:1A (OUI DF-A9-FF)
        Count: 1
        #64: len 11 (0 Kb/s)
        Latency: 158 msec (158-170 msec ~164 msec)
> ACL Data RX: Handle 2595 flags 0x02 dlen 27               #66 [hci1] 6.484648
> ACL Data RX: Handle 2595 flags 0x01 dlen 27               #67 [hci1] 6.485251
> ACL Data RX: Handle 2595 flags 0x01 dlen 15               #68 [hci1] 6.485787
      SMP: Pairing Public Key (0x0c) len 64
        X: 0769cdd7d37735d94c9aedd2f30cd70eb0f25fd816f3aa3f5a053d83ce6aae70
        Y: 70423404696a683e34e3a324f25126ce457a2551f15541a3c21312c0c16a1b08
< HCI Command: Host Number of Compl.. (0x03|0x0035) plen 5  #69 [hci1] 6.485990
        Num handles: 1
        Handle: 2595 Address: DF:A9:FF:F6:B1:1A (OUI DF-A9-FF)
        Count: 1
< HCI Command: Host Number of Compl.. (0x03|0x0035) plen 5  #70 [hci1] 6.505780
        Num handles: 1
        Handle: 2595 Address: DF:A9:FF:F6:B1:1A (OUI DF-A9-FF)
        Count: 1
< HCI Command: Host Number of Compl.. (0x03|0x0035) plen 5  #71 [hci1] 6.506014
        Num handles: 1
        Handle: 2595 Address: DF:A9:FF:F6:B1:1A (OUI DF-A9-FF)
        Count: 1
< ACL Data TX: Handle 2595 flags 0x00 dlen 27               #72 [hci1] 6.506134
< ACL Data TX: Handle 2595 flags 0x01 dlen 27               #73 [hci1] 6.506151
< ACL Data TX: Handle 2595 flags 0x01 dlen 15               #74 [hci1] 6.506155
      SMP: Pairing Public Key (0x0c) len 64
        X: 98308440221e2d910f0e54b71e7ec652857aa9b5a0dc65028824cc19db1226e9
        Y: 67a4816bcb62efb21701e31fdb27561a6217575fb007a8bbdabe7e28b6f68482
> HCI Event: Number of Completed Packets (0x13) plen 5      #75 [hci1] 6.572358
        Num handles: 1
        Handle: 2595 Address: DF:A9:FF:F6:B1:1A (OUI DF-A9-FF)
        Count: 1
        #72: len 27 (3 Kb/s)
        Latency: 66 msec (66-170 msec ~115 msec)
> HCI Event: Number of Completed Packets (0x13) plen 5      #76 [hci1] 6.572887
        Num handles: 1
        Handle: 2595 Address: DF:A9:FF:F6:B1:1A (OUI DF-A9-FF)
        Count: 1
        #73: len 27 (3 Kb/s)
        Latency: 66 msec (66-170 msec ~91 msec)
< ACL Data TX: Handle 2595 flags 0x00 dlen 21               #77 [hci1] 6.585613
      SMP: Pairing Confirm (0x03) len 16
        Confim value: 2373974acad99aa2321ced9efc2a84ad
> HCI Event: Number of Completed Packets (0x13) plen 5      #78 [hci1] 6.659133
        Num handles: 1
        Handle: 2595 Address: DF:A9:FF:F6:B1:1A (OUI DF-A9-FF)
        Count: 1
        #74: len 15 (0 Kb/s)
        Latency: 152 msec (66-170 msec ~122 msec)
> HCI Event: Number of Completed Packets (0x13) plen 5      #79 [hci1] 6.746789
        Num handles: 1
        Handle: 2595 Address: DF:A9:FF:F6:B1:1A (OUI DF-A9-FF)
        Count: 1
        #77: len 21 (1 Kb/s)
        Latency: 161 msec (66-170 msec ~141 msec)
> ACL Data RX: Handle 2595 flags 0x02 dlen 21               #80 [hci1] 6.747162
      SMP: Pairing Random (0x04) len 16
        Random value: 3de37a99173cff500000000000000000
< HCI Command: Host Number of Compl.. (0x03|0x0035) plen 5  #81 [hci1] 6.765577
        Num handles: 1
        Handle: 2595 Address: DF:A9:FF:F6:B1:1A (OUI DF-A9-FF)
        Count: 1
< ACL Data TX: Handle 2595 flags 0x00 dlen 21               #82 [hci1] 6.765623
      SMP: Pairing Random (0x04) len 16
        Random value: 8e6108f966a694cbe26df70bb96773e6
> HCI Event: Number of Completed Packets (0x13) plen 5      #83 [hci1] 6.921587
        Num handles: 1
        Handle: 2595 Address: DF:A9:FF:F6:B1:1A (OUI DF-A9-FF)
        Count: 1
        #82: len 21 (1 Kb/s)
        Latency: 155 msec (66-170 msec ~148 msec)
> ACL Data RX: Handle 2595 flags 0x02 dlen 21               #84 [hci1] 7.096941
      SMP: Pairing DHKey Check (0x0d) len 16
        E: 7587aa8d4817a3a0827b23c258bfc495
< HCI Command: Host Number of Compl.. (0x03|0x0035) plen 5  #85 [hci1] 7.105625
        Num handles: 1
        Handle: 2595 Address: DF:A9:FF:F6:B1:1A (OUI DF-A9-FF)
        Count: 1
< ACL Data TX: Handle 2595 flags 0x00 dlen 21               #86 [hci1] 7.105665
      SMP: Pairing DHKey Check (0x0d) len 16
        E: 1267609911a6cf28e1f05486eb3e0ed8
> HCI Event: Number of Completed Packets (0x13) plen 5      #87 [hci1] 7.271598
        Num handles: 1
        Handle: 2595 Address: DF:A9:FF:F6:B1:1A (OUI DF-A9-FF)
        Count: 1
        #86: len 21 (1 Kb/s)
        Latency: 165 msec (66-170 msec ~157 msec)
> HCI Event: LE Meta Event (0x3e) plen 13                   #88 [hci1] 7.359691
      LE Long Term Key Request (0x05)
        Handle: 2595 Address: DF:A9:FF:F6:B1:1A (OUI DF-A9-FF)
        Random number: 0x0000000000000000
        Encrypted diversifier: 0x0000
< HCI Command: LE Long Term Key Re.. (0x08|0x001a) plen 18  #89 [hci1] 7.365733
        Handle: 2595 Address: DF:A9:FF:F6:B1:1A (OUI DF-A9-FF)
        Long term key: 5d544d6565a878e2b150c4ec4181bbbe
> HCI Event: Command Complete (0x0e) plen 6                 #90 [hci1] 7.366447
      LE Long Term Key Request Reply (0x08|0x001a) ncmd 1
        Status: Success (0x00)
        Handle: 2595 Address: DF:A9:FF:F6:B1:1A (OUI DF-A9-FF)
> HCI Event: Encryption Change (0x08) plen 4                #91 [hci1] 7.796891
        Status: Success (0x00)
        Handle: 2595 Address: DF:A9:FF:F6:B1:1A (OUI DF-A9-FF)
        Encryption: Enabled with AES-CCM (0x01)
> ACL Data RX: Handle 2595 flags 0x02 dlen 21               #92 [hci1] 7.884473
      SMP: Identity Information (0x08) len 16
        Identity resolving key: 13838aa04a3c876fcc28ae7f56a13d20
< HCI Command: Host Number of Compl.. (0x03|0x0035) plen 5  #93 [hci1] 7.916092
        Num handles: 1
        Handle: 2595 Address: DF:A9:FF:F6:B1:1A (OUI DF-A9-FF)
        Count: 1
> ACL Data RX: Handle 2595 flags 0x02 dlen 12               #94 [hci1] 8.059337
      SMP: Identity Address Information (0x09) len 7
        Address: DF:A9:FF:F6:B1:1A (OUI DF-A9-FF)
< HCI Command: LE Add Device To Re.. (0x08|0x0027) plen 39  #95 [hci1] 8.065961
        Address type: Public (0x00)
        Address: DF:A9:FF:F6:B1:1A (OUI DF-A9-FF)
        Peer identity resolving key: 13838aa04a3c876fcc28ae7f56a13d20
        Local identity resolving key: 00000000000000000000000000000000
> HCI Event: Command Complete (0x0e) plen 4                 #96 [hci1] 8.066888
      LE Add Device To Resolving List (0x08|0x0027) ncmd 1
        Status: Success (0x00)
< HCI Command: LE Set Privacy Mode (0x08|0x004e) plen 8     #97 [hci1] 8.085747
        Peer Identity address type: Public (0x00)
        Peer Identity address: DF:A9:FF:F6:B1:1A (OUI DF-A9-FF)
        Privacy Mode: Use Device Privacy (0x01)
> HCI Event: Command Complete (0x0e) plen 4                 #98 [hci1] 8.086342
      LE Set Privacy Mode (0x08|0x004e) ncmd 1
        Status: Success (0x00)
< HCI Command: LE Set Address Resol.. (0x08|0x002d) plen 1  #99 [hci1] 8.105732
        Address resolution: Enabled (0x01)
> HCI Event: Command Complete (0x0e) plen 4                #100 [hci1] 8.106176
      LE Set Address Resolution Enable (0x08|0x002d) ncmd 1
        Status: Success (0x00)
< HCI Command: Host Number of Comp.. (0x03|0x0035) plen 5  #101 [hci1] 8.125428
        Num handles: 1
        Handle: 2595 Address: DF:A9:FF:F6:B1:1A (OUI DF-A9-FF)
        Count: 1
> ACL Data RX: Handle 2595 flags 0x02 dlen 11              #102 [hci1] 8.234300
      ATT: Read By Group Type Request (0x10) len 6
        Handle range: 0x0001-0xffff
        Attribute group type: Primary Service (0x2800)
< HCI Command: Host Number of Comp.. (0x03|0x0035) plen 5  #103 [hci1] 8.245439
        Num handles: 1
        Handle: 2595 Address: DF:A9:FF:F6:B1:1A (OUI DF-A9-FF)
        Count: 1
< ACL Data TX: Handle 2595 flags 0x00 dlen 27              #104 [hci1] 8.245480
< ACL Data TX: Handle 2595 flags 0x01 dlen 15              #105 [hci1] 8.245522
      ATT: Read By Group Type Response (0x11) len 37
        Attribute data length: 6
        Attribute group list: 6 entries
        Handle range: 0x0001-0x000a
        UUID: Generic Attribute Profile (0x1801)
        Handle range: 0x000b-0x0011
        UUID: Generic Access Profile (0x1800)
        Handle range: 0x0012-0x0026
        UUID: Device Information (0x180a)
        Handle range: 0x0027-0x0029
        UUID: Immediate Alert (0x1802)
        Handle range: 0x002a-0x003c
        UUID: Published Audio Capabilities (0x1850)
        Handle range: 0x003d-0x004c
        UUID: Audio Stream Control (0x184e)
> HCI Event: Number of Completed Packets (0x13) plen 5     #106 [hci1] 8.322282
        Num handles: 1
        Handle: 2595 Address: DF:A9:FF:F6:B1:1A (OUI DF-A9-FF)
        Count: 1
        #104: len 27 (2 Kb/s)
        Latency: 76 msec (66-170 msec ~117 msec)
> HCI Event: Number of Completed Packets (0x13) plen 5     #107 [hci1] 8.409195
        Num handles: 1
        Handle: 2595 Address: DF:A9:FF:F6:B1:1A (OUI DF-A9-FF)
        Count: 1
        #105: len 15 (0 Kb/s)
        Latency: 163 msec (66-170 msec ~140 msec)
> ACL Data RX: Handle 2595 flags 0x02 dlen 11              #108 [hci1] 8.409479
      ATT: Read By Group Type Request (0x10) len 6
        Handle range: 0x004d-0xffff
        Attribute group type: Primary Service (0x2800)
< HCI Command: Host Number of Comp.. (0x03|0x0035) plen 5  #109 [hci1] 8.425962
        Num handles: 1
        Handle: 2595 Address: DF:A9:FF:F6:B1:1A (OUI DF-A9-FF)
        Count: 1
< ACL Data TX: Handle 2595 flags 0x00 dlen 9               #110 [hci1] 8.426117
      ATT: Error Response (0x01) len 4
        Read By Group Type Request (0x10)
        Handle: 0x004d
        Error: Attribute Not Found (0x0a)
> HCI Event: Number of Completed Packets (0x13) plen 5     #111 [hci1] 8.584275
        Num handles: 1
        Handle: 2595 Address: DF:A9:FF:F6:B1:1A (OUI DF-A9-FF)
        Count: 1
        #110: len 9 (0 Kb/s)
        Latency: 158 msec (66-170 msec ~149 msec)
> ACL Data RX: Handle 2595 flags 0x02 dlen 13              #112 [hci1] 8.584612
      ATT: Find By Type Value Request (0x06) len 8
        Handle range: 0x0001-0xffff
        Attribute type: Primary Service (0x2800)
          UUID: Published Audio Capabilities (0x1850)
< HCI Command: Host Number of Comp.. (0x03|0x0035) plen 5  #113 [hci1] 8.585457
        Num handles: 1
        Handle: 2595 Address: DF:A9:FF:F6:B1:1A (OUI DF-A9-FF)
        Count: 1
< ACL Data TX: Handle 2595 flags 0x00 dlen 9               #114 [hci1] 8.585479
      ATT: Find By Type Value Response (0x07) len 4
        Handle range: 0x002a-0x003c
> HCI Event: Number of Completed Packets (0x13) plen 5     #115 [hci1] 8.759293
        Num handles: 1
        Handle: 2595 Address: DF:A9:FF:F6:B1:1A (OUI DF-A9-FF)
        Count: 1
        #114: len 9 (0 Kb/s)
        Latency: 173 msec (66-173 msec ~161 msec)
> ACL Data RX: Handle 2595 flags 0x02 dlen 13              #116 [hci1] 8.759585
      ATT: Find By Type Value Request (0x06) len 8
        Handle range: 0x003d-0xffff
        Attribute type: Primary Service (0x2800)
          UUID: Published Audio Capabilities (0x1850)
< HCI Command: Host Number of Comp.. (0x03|0x0035) plen 5  #117 [hci1] 8.765853
        Num handles: 1
        Handle: 2595 Address: DF:A9:FF:F6:B1:1A (OUI DF-A9-FF)
        Count: 1
< ACL Data TX: Handle 2595 flags 0x00 dlen 9               #118 [hci1] 8.766014
      ATT: Error Response (0x01) len 4
        Find By Type Value Request (0x06)
        Handle: 0x003d
        Error: Attribute Not Found (0x0a)
> HCI Event: Number of Completed Packets (0x13) plen 5     #119 [hci1] 8.934211
        Num handles: 1
        Handle: 2595 Address: DF:A9:FF:F6:B1:1A (OUI DF-A9-FF)
        Count: 1
        #118: len 9 (0 Kb/s)
        Latency: 168 msec (66-173 msec ~164 msec)
> ACL Data RX: Handle 2595 flags 0x02 dlen 11              #120 [hci1] 8.934487
      ATT: Read By Type Request (0x08) len 6
        Handle range: 0x002a-0x003c
        Attribute type: Characteristic (0x2803)
< HCI Command: Host Number of Comp.. (0x03|0x0035) plen 5  #121 [hci1] 8.946048
        Num handles: 1
        Handle: 2595 Address: DF:A9:FF:F6:B1:1A (OUI DF-A9-FF)
        Count: 1
< ACL Data TX: Handle 2595 flags 0x00 dlen 27              #122 [hci1] 8.946128
< ACL Data TX: Handle 2595 flags 0x01 dlen 21              #123 [hci1] 8.946150
      ATT: Read By Type Response (0x09) len 43
        Attribute data length: 7
        Attribute data list: 6 entries
        Handle: 0x002b
        Value: 122c00c92b
            Properties: 0x12
              Read (0x02)
              Notify (0x10)
            Value Handle: 0x002c
            Value UUID: Sink PAC (0x2bc9)
        Handle: 0x002e
        Value: 1a2f00ca2b
            Properties: 0x1a
              Read (0x02)
              Write (0x08)
              Notify (0x10)
            Value Handle: 0x002f
            Value UUID: Sink Audio Locations (0x2bca)
        Handle: 0x0031
        Value: 123200cb2b
            Properties: 0x12
              Read (0x02)
              Notify (0x10)
            Value Handle: 0x0032
            Value UUID: Source PAC (0x2bcb)
        Handle: 0x0034
        Value: 1a3500cc2b
            Properties: 0x1a
              Read (0x02)
              Write (0x08)
              Notify (0x10)
            Value Handle: 0x0035
            Value UUID: Source Audio Locations (0x2bcc)
        Handle: 0x0037
        Value: 123800cd2b
            Properties: 0x12
              Read (0x02)
              Notify (0x10)
            Value Handle: 0x0038
            Value UUID: Available Audio Contexts (0x2bcd)
        Handle: 0x003a
        Value: 123b00ce2b
            Properties: 0x12
              Read (0x02)
              Notify (0x10)
            Value Handle: 0x003b
            Value UUID: Supported Audio Contexts (0x2bce)
> HCI Event: Number of Completed Packets (0x13) plen 5     #124 [hci1] 9.022287
        Num handles: 1
        Handle: 2595 Address: DF:A9:FF:F6:B1:1A (OUI DF-A9-FF)
        Count: 1
        #122: len 27 (2 Kb/s)
        Latency: 76 msec (66-173 msec ~120 msec)
> HCI Event: Number of Completed Packets (0x13) plen 5     #125 [hci1] 9.109205
        Num handles: 1
        Handle: 2595 Address: DF:A9:FF:F6:B1:1A (OUI DF-A9-FF)
        Count: 1
        #123: len 21 (1 Kb/s)
        Latency: 163 msec (66-173 msec ~141 msec)
> ACL Data RX: Handle 2595 flags 0x02 dlen 11              #126 [hci1] 9.109545
      ATT: Read By Type Request (0x08) len 6
        Handle range: 0x003b-0x003c
        Attribute type: Characteristic (0x2803)
< HCI Command: Host Number of Comp.. (0x03|0x0035) plen 5  #127 [hci1] 9.126047
        Num handles: 1
        Handle: 2595 Address: DF:A9:FF:F6:B1:1A (OUI DF-A9-FF)
        Count: 1
< ACL Data TX: Handle 2595 flags 0x00 dlen 9               #128 [hci1] 9.126206
      ATT: Error Response (0x01) len 4
        Read By Type Request (0x08)
        Handle: 0x003b
        Error: Attribute Not Found (0x0a)
> HCI Event: Number of Completed Packets (0x13) plen 5     #129 [hci1] 9.284247
        Num handles: 1
        Handle: 2595 Address: DF:A9:FF:F6:B1:1A (OUI DF-A9-FF)
        Count: 1
        #128: len 9 (0 Kb/s)
        Latency: 158 msec (66-173 msec ~149 msec)
> ACL Data RX: Handle 2595 flags 0x02 dlen 13              #130 [hci1] 9.284444
      ATT: Find By Type Value Request (0x06) len 8
        Handle range: 0x0001-0xffff
        Attribute type: Primary Service (0x2800)
          UUID: Published Audio Capabilities (0x1850)
< HCI Command: Host Number of Comp.. (0x03|0x0035) plen 5  #131 [hci1] 9.285694
        Num handles: 1
        Handle: 2595 Address: DF:A9:FF:F6:B1:1A (OUI DF-A9-FF)
        Count: 1
< ACL Data TX: Handle 2595 flags 0x00 dlen 9               #132 [hci1] 9.285765
      ATT: Find By Type Value Response (0x07) len 4
        Handle range: 0x002a-0x003c
> HCI Event: Number of Completed Packets (0x13) plen 5     #133 [hci1] 9.459193
        Num handles: 1
        Handle: 2595 Address: DF:A9:FF:F6:B1:1A (OUI DF-A9-FF)
        Count: 1
        #132: len 9 (0 Kb/s)
        Latency: 173 msec (66-173 msec ~161 msec)
> ACL Data RX: Handle 2595 flags 0x02 dlen 13              #134 [hci1] 9.459499
      ATT: Find By Type Value Request (0x06) len 8
        Handle range: 0x003d-0xffff
        Attribute type: Primary Service (0x2800)
          UUID: Published Audio Capabilities (0x1850)
< HCI Command: Host Number of Comp.. (0x03|0x0035) plen 5  #135 [hci1] 9.465819
        Num handles: 1
        Handle: 2595 Address: DF:A9:FF:F6:B1:1A (OUI DF-A9-FF)
        Count: 1
< ACL Data TX: Handle 2595 flags 0x00 dlen 9               #136 [hci1] 9.465961
      ATT: Error Response (0x01) len 4
        Find By Type Value Request (0x06)
        Handle: 0x003d
        Error: Attribute Not Found (0x0a)
> HCI Event: Number of Completed Packets (0x13) plen 5     #137 [hci1] 9.634219
        Num handles: 1
        Handle: 2595 Address: DF:A9:FF:F6:B1:1A (OUI DF-A9-FF)
        Count: 1
        #136: len 9 (0 Kb/s)
        Latency: 168 msec (66-173 msec ~164 msec)
> ACL Data RX: Handle 2595 flags 0x02 dlen 11              #138 [hci1] 9.634474
      ATT: Read By Type Request (0x08) len 6
        Handle range: 0x002a-0x003c
        Attribute type: Characteristic (0x2803)
< HCI Command: Host Number of Comp.. (0x03|0x0035) plen 5  #139 [hci1] 9.646156
        Num handles: 1
        Handle: 2595 Address: DF:A9:FF:F6:B1:1A (OUI DF-A9-FF)
        Count: 1
< ACL Data TX: Handle 2595 flags 0x00 dlen 27              #140 [hci1] 9.646226
< ACL Data TX: Handle 2595 flags 0x01 dlen 21              #141 [hci1] 9.646244
      ATT: Read By Type Response (0x09) len 43
        Attribute data length: 7
        Attribute data list: 6 entries
        Handle: 0x002b
        Value: 122c00c92b
            Properties: 0x12
              Read (0x02)
              Notify (0x10)
            Value Handle: 0x002c
            Value UUID: Sink PAC (0x2bc9)
        Handle: 0x002e
        Value: 1a2f00ca2b
            Properties: 0x1a
              Read (0x02)
              Write (0x08)
              Notify (0x10)
            Value Handle: 0x002f
            Value UUID: Sink Audio Locations (0x2bca)
        Handle: 0x0031
        Value: 123200cb2b
            Properties: 0x12
              Read (0x02)
              Notify (0x10)
            Value Handle: 0x0032
            Value UUID: Source PAC (0x2bcb)
        Handle: 0x0034
        Value: 1a3500cc2b
            Properties: 0x1a
              Read (0x02)
              Write (0x08)
              Notify (0x10)
            Value Handle: 0x0035
            Value UUID: Source Audio Locations (0x2bcc)
        Handle: 0x0037
        Value: 123800cd2b
            Properties: 0x12
              Read (0x02)
              Notify (0x10)
            Value Handle: 0x0038
            Value UUID: Available Audio Contexts (0x2bcd)
        Handle: 0x003a
        Value: 123b00ce2b
            Properties: 0x12
              Read (0x02)
              Notify (0x10)
            Value Handle: 0x003b
            Value UUID: Supported Audio Contexts (0x2bce)
> HCI Event: Number of Completed Packets (0x13) plen 5     #142 [hci1] 9.722215
        Num handles: 1
        Handle: 2595 Address: DF:A9:FF:F6:B1:1A (OUI DF-A9-FF)
        Count: 1
        #140: len 27 (2 Kb/s)
        Latency: 75 msec (66-173 msec ~120 msec)
> HCI Event: Number of Completed Packets (0x13) plen 5     #143 [hci1] 9.809198
        Num handles: 1
        Handle: 2595 Address: DF:A9:FF:F6:B1:1A (OUI DF-A9-FF)
        Count: 1
        #141: len 21 (1 Kb/s)
        Latency: 162 msec (66-173 msec ~141 msec)
> ACL Data RX: Handle 2595 flags 0x02 dlen 11              #144 [hci1] 9.809480
      ATT: Read By Type Request (0x08) len 6
        Handle range: 0x003b-0x003c
        Attribute type: Characteristic (0x2803)
< HCI Command: Host Number of Comp.. (0x03|0x0035) plen 5  #145 [hci1] 9.825582
        Num handles: 1
        Handle: 2595 Address: DF:A9:FF:F6:B1:1A (OUI DF-A9-FF)
        Count: 1
< ACL Data TX: Handle 2595 flags 0x00 dlen 9               #146 [hci1] 9.825725
      ATT: Error Response (0x01) len 4
        Read By Type Request (0x08)
        Handle: 0x003b
        Error: Attribute Not Found (0x0a)
> HCI Event: Number of Completed Packets (0x13) plen 5     #147 [hci1] 9.984160
        Num handles: 1
        Handle: 2595 Address: DF:A9:FF:F6:B1:1A (OUI DF-A9-FF)
        Count: 1
        #146: len 9 (0 Kb/s)
        Latency: 158 msec (66-173 msec ~150 msec)
> ACL Data RX: Handle 2595 flags 0x02 dlen 9               #148 [hci1] 9.984451
      ATT: Find Information Request (0x04) len 4
        Handle range: 0x002d-0x002d
< HCI Command: Host Number of Comp.. (0x03|0x0035) plen 5  #149 [hci1] 9.985892
        Num handles: 1
        Handle: 2595 Address: DF:A9:FF:F6:B1:1A (OUI DF-A9-FF)
        Count: 1
< ACL Data TX: Handle 2595 flags 0x00 dlen 10              #150 [hci1] 9.985916
      ATT: Find Information Response (0x05) len 5
        Format: UUID-16 (0x01)
        Handle: 0x002d
        UUID: Client Characteristic Configuration (0x2902)
> HCI Event: Number of Completed Packets (0x13) plen 5    #151 [hci1] 10.159178
        Num handles: 1
        Handle: 2595 Address: DF:A9:FF:F6:B1:1A (OUI DF-A9-FF)
        Count: 1
        #150: len 10 (0 Kb/s)
        Latency: 173 msec (66-173 msec ~161 msec)
> ACL Data RX: Handle 2595 flags 0x02 dlen 9              #152 [hci1] 10.159402
      ATT: Find Information Request (0x04) len 4
        Handle range: 0x0030-0x0030
< HCI Command: Host Number of Com.. (0x03|0x0035) plen 5  #153 [hci1] 10.165834
        Num handles: 1
        Handle: 2595 Address: DF:A9:FF:F6:B1:1A (OUI DF-A9-FF)
        Count: 1
< ACL Data TX: Handle 2595 flags 0x00 dlen 10             #154 [hci1] 10.165919
      ATT: Find Information Response (0x05) len 5
        Format: UUID-16 (0x01)
        Handle: 0x0030
        UUID: Client Characteristic Configuration (0x2902)
> HCI Event: Number of Completed Packets (0x13) plen 5    #155 [hci1] 10.334176
        Num handles: 1
        Handle: 2595 Address: DF:A9:FF:F6:B1:1A (OUI DF-A9-FF)
        Count: 1
        #154: len 10 (0 Kb/s)
        Latency: 168 msec (66-173 msec ~164 msec)
> ACL Data RX: Handle 2595 flags 0x02 dlen 9              #156 [hci1] 10.334424
      ATT: Find Information Request (0x04) len 4
        Handle range: 0x0033-0x0033
< HCI Command: Host Number of Com.. (0x03|0x0035) plen 5  #157 [hci1] 10.345485
        Num handles: 1
        Handle: 2595 Address: DF:A9:FF:F6:B1:1A (OUI DF-A9-FF)
        Count: 1
< ACL Data TX: Handle 2595 flags 0x00 dlen 10             #158 [hci1] 10.345561
      ATT: Find Information Response (0x05) len 5
        Format: UUID-16 (0x01)
        Handle: 0x0033
        UUID: Client Characteristic Configuration (0x2902)
> HCI Event: Number of Completed Packets (0x13) plen 5    #159 [hci1] 10.509244
        Num handles: 1
        Handle: 2595 Address: DF:A9:FF:F6:B1:1A (OUI DF-A9-FF)
        Count: 1
        #158: len 10 (0 Kb/s)
        Latency: 163 msec (66-173 msec ~164 msec)
> ACL Data RX: Handle 2595 flags 0x02 dlen 9              #160 [hci1] 10.509374
      ATT: Find Information Request (0x04) len 4
        Handle range: 0x0036-0x0036
< HCI Command: Host Number of Com.. (0x03|0x0035) plen 5  #161 [hci1] 10.526003
        Num handles: 1
        Handle: 2595 Address: DF:A9:FF:F6:B1:1A (OUI DF-A9-FF)
        Count: 1
< ACL Data TX: Handle 2595 flags 0x00 dlen 10             #162 [hci1] 10.526099
      ATT: Find Information Response (0x05) len 5
        Format: UUID-16 (0x01)
        Handle: 0x0036
        UUID: Client Characteristic Configuration (0x2902)
> HCI Event: Number of Completed Packets (0x13) plen 5    #163 [hci1] 10.684315
        Num handles: 1
        Handle: 2595 Address: DF:A9:FF:F6:B1:1A (OUI DF-A9-FF)
        Count: 1
        #162: len 10 (0 Kb/s)
        Latency: 158 msec (66-173 msec ~161 msec)
> ACL Data RX: Handle 2595 flags 0x02 dlen 9              #164 [hci1] 10.684424
      ATT: Find Information Request (0x04) len 4
        Handle range: 0x0039-0x0039
< HCI Command: Host Number of Com.. (0x03|0x0035) plen 5  #165 [hci1] 10.685661
        Num handles: 1
        Handle: 2595 Address: DF:A9:FF:F6:B1:1A (OUI DF-A9-FF)
        Count: 1
< ACL Data TX: Handle 2595 flags 0x00 dlen 10             #166 [hci1] 10.685708
      ATT: Find Information Response (0x05) len 5
        Format: UUID-16 (0x01)
        Handle: 0x0039
        UUID: Client Characteristic Configuration (0x2902)
> HCI Event: Number of Completed Packets (0x13) plen 5    #167 [hci1] 10.859203
        Num handles: 1
        Handle: 2595 Address: DF:A9:FF:F6:B1:1A (OUI DF-A9-FF)
        Count: 1
        #166: len 10 (0 Kb/s)
        Latency: 173 msec (66-173 msec ~167 msec)
> ACL Data RX: Handle 2595 flags 0x02 dlen 9              #168 [hci1] 10.859347
      ATT: Find Information Request (0x04) len 4
        Handle range: 0x003c-0x003c
< HCI Command: Host Number of Com.. (0x03|0x0035) plen 5  #169 [hci1] 10.865502
        Num handles: 1
        Handle: 2595 Address: DF:A9:FF:F6:B1:1A (OUI DF-A9-FF)
        Count: 1
< ACL Data TX: Handle 2595 flags 0x00 dlen 10             #170 [hci1] 10.865563
      ATT: Find Information Response (0x05) len 5
        Format: UUID-16 (0x01)
        Handle: 0x003c
        UUID: Client Characteristic Configuration (0x2902)
> HCI Event: Number of Completed Packets (0x13) plen 5    #171 [hci1] 11.034210
        Num handles: 1
        Handle: 2595 Address: DF:A9:FF:F6:B1:1A (OUI DF-A9-FF)
        Count: 1
        #170: len 10 (0 Kb/s)
        Latency: 168 msec (66-173 msec ~168 msec)
> ACL Data RX: Handle 2595 flags 0x02 dlen 7              #172 [hci1] 11.034400
      ATT: Read Request (0x0a) len 2
        Handle: 0x002d
< HCI Command: Host Number of Com.. (0x03|0x0035) plen 5  #173 [hci1] 11.046088
        Num handles: 1
        Handle: 2595 Address: DF:A9:FF:F6:B1:1A (OUI DF-A9-FF)
        Count: 1
< ACL Data TX: Handle 2595 flags 0x00 dlen 7              #174 [hci1] 11.046171
      ATT: Read Response (0x0b) len 2
> HCI Event: Number of Completed Packets (0x13) plen 5    #175 [hci1] 11.209156
        Num handles: 1
        Handle: 2595 Address: DF:A9:FF:F6:B1:1A (OUI DF-A9-FF)
        Count: 1
        #174: len 7 (0 Kb/s)
        Latency: 162 msec (66-173 msec ~165 msec)
> ACL Data RX: Handle 2595 flags 0x02 dlen 7              #176 [hci1] 11.209343
      ATT: Read Request (0x0a) len 2
        Handle: 0x0030
< HCI Command: Host Number of Com.. (0x03|0x0035) plen 5  #177 [hci1] 11.226224
        Num handles: 1
        Handle: 2595 Address: DF:A9:FF:F6:B1:1A (OUI DF-A9-FF)
        Count: 1
< ACL Data TX: Handle 2595 flags 0x00 dlen 7              #178 [hci1] 11.226394
      ATT: Read Response (0x0b) len 2
> HCI Event: Number of Completed Packets (0x13) plen 5    #179 [hci1] 11.384173
        Num handles: 1
        Handle: 2595 Address: DF:A9:FF:F6:B1:1A (OUI DF-A9-FF)
        Count: 1
        #178: len 7 (0 Kb/s)
        Latency: 157 msec (66-173 msec ~161 msec)
> ACL Data RX: Handle 2595 flags 0x02 dlen 7              #180 [hci1] 11.384321
      ATT: Read Request (0x0a) len 2
        Handle: 0x002f Type: Sink Audio Locations (0x2bca)
< HCI Command: Host Number of Com.. (0x03|0x0035) plen 5  #181 [hci1] 11.385580
        Num handles: 1
        Handle: 2595 Address: DF:A9:FF:F6:B1:1A (OUI DF-A9-FF)
        Count: 1
< ACL Data TX: Handle 2595 flags 0x00 dlen 9              #182 [hci1] 11.385605
      ATT: Read Response (0x0b) len 4
        Handle: 0x002f Type: Sink Audio Locations (0x2bca)
        Value: 06000000
           Location: 0x00000006
              Front Right (0x00000002)
              Front Center (0x00000004)
> HCI Event: Number of Completed Packets (0x13) plen 5    #183 [hci1] 11.559206
        Num handles: 1
        Handle: 2595 Address: DF:A9:FF:F6:B1:1A (OUI DF-A9-FF)
        Count: 1
        #182: len 9 (0 Kb/s)
        Latency: 173 msec (66-173 msec ~167 msec)
> ACL Data RX: Handle 2595 flags 0x02 dlen 11             #184 [hci1] 11.559411
      ATT: Write Request (0x12) len 6
        Handle: 0x002f Type: Sink Audio Locations (0x2bca)
          Data: 01000000
< HCI Command: Host Number of Com.. (0x03|0x0035) plen 5  #185 [hci1] 11.566089
        Num handles: 1
        Handle: 2595 Address: DF:A9:FF:F6:B1:1A (OUI DF-A9-FF)
        Count: 1
< ACL Data TX: Handle 2595 flags 0x00 dlen 5              #186 [hci1] 11.566346
      ATT: Write Response (0x13) len 0
> HCI Event: Number of Completed Packets (0x13) plen 5    #187 [hci1] 11.734218
        Num handles: 1
        Handle: 2595 Address: DF:A9:FF:F6:B1:1A (OUI DF-A9-FF)
        Count: 1
        #186: len 5 (0 Kb/s)
        Latency: 167 msec (66-173 msec ~167 msec)
> ACL Data RX: Handle 2595 flags 0x02 dlen 7              #188 [hci1] 11.734380
      ATT: Read Request (0x0a) len 2
        Handle: 0x0033
< HCI Command: Host Number of Com.. (0x03|0x0035) plen 5  #189 [hci1] 11.745788
        Num handles: 1
        Handle: 2595 Address: DF:A9:FF:F6:B1:1A (OUI DF-A9-FF)
        Count: 1
< ACL Data TX: Handle 2595 flags 0x00 dlen 7              #190 [hci1] 11.745864
      ATT: Read Response (0x0b) len 2
> HCI Event: Number of Completed Packets (0x13) plen 5    #191 [hci1] 11.909115
        Num handles: 1
        Handle: 2595 Address: DF:A9:FF:F6:B1:1A (OUI DF-A9-FF)
        Count: 1
        #190: len 7 (0 Kb/s)
        Latency: 163 msec (66-173 msec ~165 msec)
> ACL Data RX: Handle 2595 flags 0x02 dlen 7              #192 [hci1] 11.909379
      ATT: Read Request (0x0a) len 2
        Handle: 0x0036
< HCI Command: Host Number of Com.. (0x03|0x0035) plen 5  #193 [hci1] 11.925600
        Num handles: 1
        Handle: 2595 Address: DF:A9:FF:F6:B1:1A (OUI DF-A9-FF)
        Count: 1
< ACL Data TX: Handle 2595 flags 0x00 dlen 7              #194 [hci1] 11.925608
      ATT: Read Response (0x0b) len 2
> HCI Event: Number of Completed Packets (0x13) plen 5    #195 [hci1] 12.084160
        Num handles: 1
        Handle: 2595 Address: DF:A9:FF:F6:B1:1A (OUI DF-A9-FF)
        Count: 1
        #194: len 7 (0 Kb/s)
        Latency: 158 msec (66-173 msec ~162 msec)
> ACL Data RX: Handle 2595 flags 0x02 dlen 7              #196 [hci1] 12.084375
      ATT: Read Request (0x0a) len 2
        Handle: 0x0035 Type: Source Audio Locations (0x2bcc)
< HCI Command: Host Number of Com.. (0x03|0x0035) plen 5  #197 [hci1] 12.086107
        Num handles: 1
        Handle: 2595 Address: DF:A9:FF:F6:B1:1A (OUI DF-A9-FF)
        Count: 1
< ACL Data TX: Handle 2595 flags 0x00 dlen 9              #198 [hci1] 12.086203
      ATT: Read Response (0x0b) len 4
        Handle: 0x0035 Type: Source Audio Locations (0x2bcc)
        Value: 03000000
           Location: 0x00000003
              Front Left (0x00000001)
              Front Right (0x00000002)
> HCI Event: Number of Completed Packets (0x13) plen 5    #199 [hci1] 12.259181
        Num handles: 1
        Handle: 2595 Address: DF:A9:FF:F6:B1:1A (OUI DF-A9-FF)
        Count: 1
        #198: len 9 (0 Kb/s)
        Latency: 172 msec (66-173 msec ~167 msec)
> ACL Data RX: Handle 2595 flags 0x02 dlen 11             #200 [hci1] 12.259415
      ATT: Write Request (0x12) len 6
        Handle: 0x0035 Type: Source Audio Locations (0x2bcc)
          Data: 01000000
< HCI Command: Host Number of Com.. (0x03|0x0035) plen 5  #201 [hci1] 12.265644
        Num handles: 1
        Handle: 2595 Address: DF:A9:FF:F6:B1:1A (OUI DF-A9-FF)
        Count: 1
< ACL Data TX: Handle 2595 flags 0x00 dlen 5              #202 [hci1] 12.265763
      ATT: Write Response (0x13) len 0
> HCI Event: Number of Completed Packets (0x13) plen 5    #203 [hci1] 12.434194
        Num handles: 1
        Handle: 2595 Address: DF:A9:FF:F6:B1:1A (OUI DF-A9-FF)
        Count: 1
        #202: len 5 (0 Kb/s)
        Latency: 168 msec (66-173 msec ~167 msec)
> ACL Data RX: Handle 2595 flags 0x02 dlen 7              #204 [hci1] 12.434362
      ATT: Read Request (0x0a) len 2
        Handle: 0x0039
< HCI Command: Host Number of Com.. (0x03|0x0035) plen 5  #205 [hci1] 12.445555
        Num handles: 1
        Handle: 2595 Address: DF:A9:FF:F6:B1:1A (OUI DF-A9-FF)
        Count: 1
< ACL Data TX: Handle 2595 flags 0x00 dlen 7              #206 [hci1] 12.445658
      ATT: Read Response (0x0b) len 2
> HCI Event: Number of Completed Packets (0x13) plen 5    #207 [hci1] 12.609164
        Num handles: 1
        Handle: 2595 Address: DF:A9:FF:F6:B1:1A (OUI DF-A9-FF)
        Count: 1
        #206: len 7 (0 Kb/s)
        Latency: 163 msec (66-173 msec ~165 msec)
> ACL Data RX: Handle 2595 flags 0x02 dlen 7              #208 [hci1] 12.609343
      ATT: Read Request (0x0a) len 2
        Handle: 0x0038 Type: Available Audio Contexts (0x2bcd)
< HCI Command: Host Number of Com.. (0x03|0x0035) plen 5  #209 [hci1] 12.626090
        Num handles: 1
        Handle: 2595 Address: DF:A9:FF:F6:B1:1A (OUI DF-A9-FF)
        Count: 1
< ACL Data TX: Handle 2595 flags 0x00 dlen 9              #210 [hci1] 12.626167
      ATT: Read Response (0x0b) len 4
        Handle: 0x0038 Type: Available Audio Contexts (0x2bcd)
        Value: ff0fff0f
          Sink Context: 0x0fff
            Unspecified (0x0001)
            Conversational (0x0002)
            Media (0x0004)
            Game (0x0008)
            Instructional (0x0010)
            Voice Assistants (0x0020)
            Live (0x0040)
            Sound Effects (0x0080)
            Notifications (0x0100)
            Ringtone (0x0200)
            Alerts (0x0400)
            Emergency alarm (0x0800)
          Source Context: 0x0fff
            Unspecified (0x0001)
            Conversational (0x0002)
            Media (0x0004)
            Game (0x0008)
            Instructional (0x0010)
            Voice Assistants (0x0020)
            Live (0x0040)
            Sound Effects (0x0080)
            Notifications (0x0100)
            Ringtone (0x0200)
            Alerts (0x0400)
            Emergency alarm (0x0800)
> HCI Event: Number of Completed Packets (0x13) plen 5    #211 [hci1] 12.784170
        Num handles: 1
        Handle: 2595 Address: DF:A9:FF:F6:B1:1A (OUI DF-A9-FF)
        Count: 1
        #210: len 9 (0 Kb/s)
        Latency: 158 msec (66-173 msec ~161 msec)
> ACL Data RX: Handle 2595 flags 0x02 dlen 7              #212 [hci1] 12.784299
      ATT: Read Request (0x0a) len 2
        Handle: 0x003c
< HCI Command: Host Number of Com.. (0x03|0x0035) plen 5  #213 [hci1] 12.786081
        Num handles: 1
        Handle: 2595 Address: DF:A9:FF:F6:B1:1A (OUI DF-A9-FF)
        Count: 1
< ACL Data TX: Handle 2595 flags 0x00 dlen 7              #214 [hci1] 12.786106
      ATT: Read Response (0x0b) len 2
> HCI Event: Number of Completed Packets (0x13) plen 5    #215 [hci1] 12.959199
        Num handles: 1
        Handle: 2595 Address: DF:A9:FF:F6:B1:1A (OUI DF-A9-FF)
        Count: 1
        #214: len 7 (0 Kb/s)
        Latency: 173 msec (66-173 msec ~167 msec)
> ACL Data RX: Handle 2595 flags 0x02 dlen 7              #216 [hci1] 12.959407
      ATT: Read Request (0x0a) len 2
        Handle: 0x003b Type: Supported Audio Contexts (0x2bce)
< HCI Command: Host Number of Com.. (0x03|0x0035) plen 5  #217 [hci1] 12.966013
        Num handles: 1
        Handle: 2595 Address: DF:A9:FF:F6:B1:1A (OUI DF-A9-FF)
        Count: 1
< ACL Data TX: Handle 2595 flags 0x00 dlen 9              #218 [hci1] 12.966126
      ATT: Read Response (0x0b) len 4
        Handle: 0x003b Type: Supported Audio Contexts (0x2bce)
        Value: ff0fff0f
          Sink Context: 0x0fff
            Unspecified (0x0001)
            Conversational (0x0002)
            Media (0x0004)
            Game (0x0008)
            Instructional (0x0010)
            Voice Assistants (0x0020)
            Live (0x0040)
            Sound Effects (0x0080)
            Notifications (0x0100)
            Ringtone (0x0200)
            Alerts (0x0400)
            Emergency alarm (0x0800)
          Source Context: 0x0fff
            Unspecified (0x0001)
            Conversational (0x0002)
            Media (0x0004)
            Game (0x0008)
            Instructional (0x0010)
            Voice Assistants (0x0020)
            Live (0x0040)
            Sound Effects (0x0080)
            Notifications (0x0100)
            Ringtone (0x0200)
            Alerts (0x0400)
            Emergency alarm (0x0800)
> HCI Event: Number of Completed Packets (0x13) plen 5    #219 [hci1] 13.134000
        Num handles: 1
        Handle: 2595 Address: DF:A9:FF:F6:B1:1A (OUI DF-A9-FF)
        Count: 1
        #218: len 9 (0 Kb/s)
        Latency: 167 msec (66-173 msec ~167 msec)
> HCI Event: Disconnect Complete (0x05) plen 4            #220 [hci1] 14.534260
        Status: Success (0x00)
        Handle: 2595 Address: DF:A9:FF:F6:B1:1A (OUI DF-A9-FF)
        Reason: Remote User Terminated Connection (0x13)
< HCI Command: Reset (0x03|0x0003) plen 0                 #221 [hci1] 19.435901
> HCI Event: Command Complete (0x0e) plen 4               #222 [hci1] 19.436486
      Reset (0x03|0x0003) ncmd 1
        Status: Success (0x00)
@ USER Close: main                                    {0x0001} [hci1] 19.445426
= Close Index: 00:00:00:00:00:00                               [hci1] 19.445447
