Bluetooth monitor ver 5.72
= Note: Linux version 6.14.0-36-generic (x86_64)                       0.405525
= Note: Bluetooth subsystem version 2.22                               0.405527
= New Index: 00:00:00:00:00:00 (Primary,UART,hci1)              [hci1] 0.405528
= New Index: 48:5F:99:8E:E0:64 (Primary,USB,hci0)               [hci0] 0.405528
= Open Index: 00:00:00:00:00:00                                 [hci1] 0.519291
= Index Info: 00:00:00:00:00:00 (Nordic Semiconductor ASA)      [hci1] 0.519306
@ USER Open: main (privileged) version 2.22            {0x0001} [hci1] 0.519315
< HCI Command: Reset (0x03|0x0003) plen 0                    #1 [hci1] 0.520541
> HCI Event: Command Complete (0x0e) plen 4                  #2 [hci1] 0.521137
      Reset (0x03|0x0003) ncmd 1
        Status: Success (0x00)
< HCI Command: Read Local Supported... (0x04|0x0003) plen 0  #3 [hci1] 0.539019
> HCI Event: Command Complete (0x0e) plen 12                 #4 [hci1] 0.539575
      Read Local Supported Features (0x04|0x0003) ncmd 1
        Status: Success (0x00)
        Features: 0x00 0x00 0x00 0x00 0x60 0x00 0x00 0x00
          BR/EDR Not Supported
          LE Supported (Controller)
< HCI Command: Read Local Version In.. (0x04|0x0001) plen 0  #5 [hci1] 0.558786
> HCI Event: Command Complete (0x0e) plen 12                 #6 [hci1] 0.559308
      Read Local Version Information (0x04|0x0001) ncmd 1
        Status: Success (0x00)
        HCI version: Reserved (0x0f) - Revision 12393 (0x3069)
        LMP version: Reserved (0x0f) - Subversion 12393 (0x3069)
        Manufacturer: Nordic Semiconductor ASA (89)
< HCI Command: Read Local Supported... (0x04|0x0002) plen 0  #7 [hci1] 0.578692
> HCI Event: Command Complete (0x0e) plen 68                 #8 [hci1] 0.579746
      Read Local Supported Commands (0x04|0x0002) ncmd 1
        Status: Success (0x00)
        Commands: 119 entries
          Disconnect (Octet 0 - Bit 5)
          Read Remote Version Information (Octet 2 - Bit 7)
          Set Event Mask (Octet 5 - Bit 6)
          Reset (Octet 5 - Bit 7)
          Read Connection Accept Timeout (Octet 7 - Bit 2)
          Write Connection Accept Timeout (Octet 7 - Bit 3)
          Read Transmit Power Level (Octet 10 - Bit 2)
          Set Controller To Host Flow Control (Octet 10 - Bit 5)
          Host Buffer Size (Octet 10 - Bit 6)
          Host Number of Completed Packets (Octet 10 - Bit 7)
          Read Local Version Information (Octet 14 - Bit 3)
          Read Local Supported Features (Octet 14 - Bit 5)
          Read BD ADDR (Octet 15 - Bit 1)
          Read RSSI (Octet 15 - Bit 5)
          Set Event Mask Page 2 (Octet 22 - Bit 2)
          LE Set Event Mask (Octet 25 - Bit 0)
          LE Read Buffer Size (Octet 25 - Bit 1)
          LE Read Local Supported Features (Octet 25 - Bit 2)
          LE Set Random Address (Octet 25 - Bit 4)
          LE Set Advertising Parameters (Octet 25 - Bit 5)
          LE Read Advertising Channel TX Power (Octet 25 - Bit 6)
          LE Set Advertising Data (Octet 25 - Bit 7)
          LE Set Scan Response Data (Octet 26 - Bit 0)
          LE Set Advertise Enable (Octet 26 - Bit 1)
          LE Set Scan Parameters (Octet 26 - Bit 2)
          LE Set Scan Enable (Octet 26 - Bit 3)
          LE Create Connection (Octet 26 - Bit 4)
          LE Create Connection Cancel (Octet 26 - Bit 5)
          LE Read Accept List Size (Octet 26 - Bit 6)
          LE Clear Accept List (Octet 26 - Bit 7)
          LE Add Device To Accept List (Octet 27 - Bit 0)
          LE Remove Device From Accept List (Octet 27 - Bit 1)
          LE Connection Update (Octet 27 - Bit 2)
          LE Set Host Channel Classification (Octet 27 - Bit 3)
          LE Read Channel Map (Octet 27 - Bit 4)
          LE Read Remote Used Features (Octet 27 - Bit 5)
          LE Encrypt (Octet 27 - Bit 6)
          LE Rand (Octet 27 - Bit 7)
          LE Start Encryption (Octet 28 - Bit 0)
          LE Long Term Key Request Reply (Octet 28 - Bit 1)
          LE Long Term Key Request Neg Reply (Octet 28 - Bit 2)
          LE Read Supported States (Octet 28 - Bit 3)
          LE Receiver Test (Octet 28 - Bit 4)
          LE Transmitter Test (Octet 28 - Bit 5)
          LE Test End (Octet 28 - Bit 6)
          Read Authenticated Payload Timeout (Octet 32 - Bit 4)
          Write Authenticated Payload Timeout (Octet 32 - Bit 5)
          LE Set Data Length (Octet 33 - Bit 6)
          LE Read Suggested Default Data Length (Octet 33 - Bit 7)
          LE Write Suggested Default Data Length (Octet 34 - Bit 0)
          LE Add Device To Resolving List (Octet 34 - Bit 3)
          LE Remove Device From Resolving List (Octet 34 - Bit 4)
          LE Clear Resolving List (Octet 34 - Bit 5)
          LE Read Resolving List Size (Octet 34 - Bit 6)
          LE Set Address Resolution Enable (Octet 35 - Bit 1)
          LE Set Resolvable Private Address Timeout (Octet 35 - Bit 2)
          LE Read Maximum Data Length (Octet 35 - Bit 3)
          LE Read PHY (Octet 35 - Bit 4)
          LE Set Default PHY (Octet 35 - Bit 5)
          LE Set PHY (Octet 35 - Bit 6)
          LE Enhanced Receiver Test (Octet 35 - Bit 7)
          LE Enhanced Transmitter Test (Octet 36 - Bit 0)
          LE Set Advertising Set Random Address (Octet 36 - Bit 1)
          LE Set Extended Advertising Parameters (Octet 36 - Bit 2)
          LE Set Extended Advertising Data (Octet 36 - Bit 3)
          LE Set Extended Scan Response Data (Octet 36 - Bit 4)
          LE Set Extended Advertising Enable (Octet 36 - Bit 5)
          LE Read Maximum Advertising Data Length (Octet 36 - Bit 6)
          LE Read Number of Supported Advertising Sets (Octet 36 - Bit 7)
          LE Remove Advertising Set (Octet 37 - Bit 0)
          LE Clear Advertising Sets (Octet 37 - Bit 1)
          LE Set Periodic Advertising Parameters (Octet 37 - Bit 2)
          LE Set Periodic Advertising Data (Octet 37 - Bit 3)
          LE Set Periodic Advertising Enable (Octet 37 - Bit 4)
          LE Set Extended Scan Parameters (Octet 37 - Bit 5)
          LE Set Extended Scan Enable (Octet 37 - Bit 6)
          LE Extended Create Connection (Octet 37 - Bit 7)
          LE Periodic Advertising Create Sync (Octet 38 - Bit 0)
          LE Periodic Advertising Create Sync Cancel (Octet 38 - Bit 1)
          LE Periodic Advertising Terminate Sync (Octet 38 - Bit 2)
          LE Add Device To Periodic Advertiser List (Octet 38 - Bit 3)
          LE Remove Device From Periodic Advertiser List (Octet 38 - Bit 4)
          LE Clear Periodic Advertiser List (Octet 38 - Bit 5)
          LE Read Periodic Advertiser List Size (Octet 38 - Bit 6)
          LE Read Transmit Power (Octet 38 - Bit 7)
          LE Read RF Path Compensation (Octet 39 - Bit 0)
          LE Write RF Path Compensation (Octet 39 - Bit 1)
          LE Set Privacy Mode (Octet 39 - Bit 2)
          LE Periodic Advertising Receive Enable (Octet 40 - Bit 5)
          LE Periodic Advertising Sync Transfer (Octet 40 - Bit 6)
          LE Periodic Advertising Set Info Transfer (Octet 40 - Bit 7)
          LE Periodic Advertising Sync Transfer Parameters (Octet 41 - Bit 0)
          LE Set Default Periodic Advertisng Sync Transfer Parameters (Octet 41 - Bit 1)
          LE Read Buffer v2 (Octet 41 - Bit 5)
          LE Read ISO TX Sync (Octet 41 - Bit 6)
          LE Set Connected Isochronous Group Parameters (Octet 41 - Bit 7)
          LE Set Connected Isochronous Group Parameters Test (Octet 42 - Bit 0)
          LE Create Connected Isochronous Stream (Octet 42 - Bit 1)
          LE Remove Connected Isochronous Group (Octet 42 - Bit 2)
          LE Accept Connected Isochronous Stream Request (Octet 42 - Bit 3)
          LE Reject Connected Isochronous Stream Request (Octet 42 - Bit 4)
          LE Create Broadcast Isochronous Group (Octet 42 - Bit 5)
          LE Create Broadcast Isochronous Group Test (Octet 42 - Bit 6)
          LE Terminate Broadcast Isochronous Group (Octet 42 - Bit 7)
          LE Broadcast Isochronous Group Create Sync (Octet 43 - Bit 0)
          LE Broadcast Isochronous Group Terminate Sync (Octet 43 - Bit 1)
          LE Request Peer SCA (Octet 43 - Bit 2)
          LE Setup Isochronous Data Path (Octet 43 - Bit 3)
          LE Remove Isochronous Data Path (Octet 43 - Bit 4)
          LE Isochronous Transmit Test (Octet 43 - Bit 5)
          LE Isochronous Receive Test (Octet 43 - Bit 6)
          LE Isochronous Read Test Counters (Octet 43 - Bit 7)
          LE Isochronous Read Test Counters (Octet 44 - Bit 0)
          LE Set Host Feature (Octet 44 - Bit 1)
          Octet 44 - Bit 2 
          Octet 45 - Bit 6 
          Octet 46 - Bit 0 
          Octet 46 - Bit 1 
          Octet 46 - Bit 2 
< HCI Command: Host Buffer Size (0x03|0x0033) plen 7         #9 [hci1] 0.598656
        ACL MTU: 255  ACL max packet: 16
        SCO MTU: 0    SCO max packet: 0
> HCI Event: Command Complete (0x0e) plen 4                 #10 [hci1] 0.599113
      Host Buffer Size (0x03|0x0033) ncmd 1
        Status: Success (0x00)
< HCI Command: Set Controller To Ho.. (0x03|0x0031) plen 1  #11 [hci1] 0.618655
        Flow control: ACL Data Packets (0x01)
> HCI Event: Command Complete (0x0e) plen 4                 #12 [hci1] 0.619068
      Set Controller To Host Flow Control (0x03|0x0031) ncmd 1
        Status: Success (0x00)
< HCI Command: LE Read Local Suppor.. (0x08|0x0003) plen 0  #13 [hci1] 0.638682
> HCI Event: Command Complete (0x0e) plen 12                #14 [hci1] 0.639102
      LE Read Local Supported Features (0x08|0x0003) ncmd 1
        Status: Success (0x00)
        Features: 0xfd 0x79 0x00 0xf7 0x30 0x01 0x00 0x00
          LE Encryption
          Extended Reject Indication
          Peripheral-initiated Features Exchange
          LE Ping
          LE Data Packet Length Extension
          LL Privacy
          Extended Scanner Filter Policies
          LE 2M PHY
          LE Coded PHY
          LE Extended Advertising
          LE Periodic Advertising
          Channel Selection Algorithm #2
          Periodic Advertising Sync Transfer - Sender
          Periodic Advertising Sync Transfer - Recipient
          Sleep Clock Accuracy Updates
          Connected Isochronous Stream - Central
          Connected Isochronous Stream - Peripheral
          Isochronous Broadcaster
          Synchronized Receiver
          Periodic Advertising ADI support
          Connection Subrating
          Unknown features (0x0000010000000000)
< HCI Command: LE Set Host Feature (0x08|0x0074) plen 2     #15 [hci1] 0.658689
        Bit Number: 32
          Connected Isochronous Stream (Host Support)
        Bit Value: 1
> HCI Event: Command Complete (0x0e) plen 4                 #16 [hci1] 0.659064
      LE Set Host Feature (0x08|0x0074) ncmd 1
        Status: Success (0x00)
< HCI Command: LE Read Buffer v2 (0x08|0x0060) plen 0       #17 [hci1] 0.678680
> HCI Event: Command Complete (0x0e) plen 10                #18 [hci1] 0.679139
      LE Read Buffer v2 (0x08|0x0060) ncmd 1
        Status: Success (0x00)
        ACL MTU: 27
        ACL max packet: 3
        ISO MTU: 318
        ISO max packet: 3
< HCI Command: LE Read Maximum Adve.. (0x08|0x003a) plen 0  #19 [hci1] 0.698721
> HCI Event: Command Complete (0x0e) plen 6                 #20 [hci1] 0.699097
      LE Read Maximum Advertising Data Length (0x08|0x003a) ncmd 1
        Status: Success (0x00)
        Max length: 1650
< HCI Command: LE Read Supported St.. (0x08|0x001c) plen 0  #21 [hci1] 0.718734
> HCI Event: Command Complete (0x0e) plen 12                #22 [hci1] 0.719252
      LE Read Supported States (0x08|0x001c) ncmd 1
        Status: Success (0x00)
        States: 0x000003ff3e0306ff
          Non-connectable Advertising State
          Scannable Advertising State
          Connectable Advertising State
          High Duty Cycle Directed Advertising State
          Passive Scanning State
          Active Scanning State
          Initiating State
            and Connection State (Central Role)
          Connection State (Peripheral Role)
          Scannable Advertising State
            and Passive Scanning State
          Connectable Advertising State
            and Passive Scanning State
          Non-connectable Advertising State
            and Initiating State
          Scannable Advertising State
            and Initiating State
          Active Scanning State
            and Connection State (Central Role)
          Passive Scanning State
            and Connection State (Peripheral Role)
          Active Scanning State
            and Connection State (Peripheral Role)
          Initiating State
            and Connection State (Central Role)
            and Central Role & Central Role
          Low Duty Cycle Directed Advertising State
          Connectable Advertising State
            and Initiating State
            and Central Role & Peripheral Role
          High Duty Cycle Directed Advertising State
            and Initiating State
            and Central Role & Peripheral Role
          Low Duty Cycle Directed Advertising State
            and Initiating State
            and Central Role & Peripheral Role
          Connectable Advertising State
            and Connection State (Central Role)
            and Central Role & Peripheral Role
          High Duty Cycle Directed Advertising State
            and Connection State (Central Role)
            and Central Role & Peripheral Role
          Low Duty Cycle Directed Advertising State
            and Connection State (Central Role)
            and Central Role & Peripheral Role
          Connectable Advertising State
            and Connection State (Peripheral Role)
            and Central Role & Peripheral Role
          High Duty Cycle Directed Advertising State
            and Connection State (Peripheral Role)
            and Peripheral Role & Peripheral Role
          Low Duty Cycle Directed Advertising State
            and Connection State (Peripheral Role)
            and Peripheral Role & Peripheral Role
          Initiating State
            and Connection State (Peripheral Role)
            and Central Role & Peripheral Role
< HCI Command: LE Read Maximum Data.. (0x08|0x002f) plen 0  #23 [hci1] 0.738704
> HCI Event: Command Complete (0x0e) plen 12                #24 [hci1] 0.739216
      LE Read Maximum Data Length (0x08|0x002f) ncmd 1
        Status: Success (0x00)
        Max TX octets: 251
        Max TX time: 2704
        Max RX octets: 251
        Max RX time: 2704
< HCI Command: LE Write Suggested D.. (0x08|0x0024) plen 4  #25 [hci1] 0.758692
        TX octets: 251
        TX time: 2704
> HCI Event: Command Complete (0x0e) plen 4                 #26 [hci1] 0.759175
      LE Write Suggested Default Data Length (0x08|0x0024) ncmd 1
        Status: Success (0x00)
< HCI Command: LE Read Resolving Li.. (0x08|0x002a) plen 0  #27 [hci1] 0.778690
> HCI Event: Command Complete (0x0e) plen 5                 #28 [hci1] 0.779093
      LE Read Resolving List Size (0x08|0x002a) ncmd 1
        Status: Success (0x00)
        Size: 8
< HCI Command: LE Set Event Mask (0x08|0x0001) plen 8       #29 [hci1] 0.798674
        Mask: 0x000002023f87fa5e
          LE Advertising Report
          LE Connection Update Complete
          LE Read Remote Used Features Complete
          LE Long Term Key Request
          LE Data Length Change
          LE Enhanced Connection Complete
          LE PHY Update Complete
          LE Extended Advertising Report
          LE Periodic Advertising Sync Established
          LE Periodic Advertising Report
          LE Periodic Advertising Sync Lost
          LE Extended Scan Timeout
          LE Extended Advertising Set Terminated
          LE Scan Request Received
          LE Periodic Advertising Sync Transfer Rvc
          LE CIS Established
          LE CIS Request
          LE Create BIG Complete
          LE Terminate BIG Complete
          LE BIG Sync Estabilished Complete
          LE BIG Sync Lost
          LE BIG Info Advertising Report
          Unknown mask (0x0000020000000000)
> HCI Event: Command Complete (0x0e) plen 4                 #30 [hci1] 0.799158
      LE Set Event Mask (0x08|0x0001) ncmd 1
        Status: Success (0x00)
< HCI Command: Set Event Mask (0x03|0x0001) plen 8          #31 [hci1] 0.818694
        Mask: 0x2000800002008890
          Disconnection Complete
          Encryption Change
          Read Remote Version Information Complete
          Hardware Error
          Data Buffer Overflow
          Encryption Key Refresh Complete
          LE Meta
> HCI Event: Command Complete (0x0e) plen 4                 #32 [hci1] 0.819150
      Set Event Mask (0x03|0x0001) ncmd 1
        Status: Success (0x00)
< HCI Command: Read BD ADDR (0x04|0x0009) plen 0            #33 [hci1] 0.838698
> HCI Event: Command Complete (0x0e) plen 10                #34 [hci1] 0.839166
      Read BD ADDR (0x04|0x0009) ncmd 1
        Status: Success (0x00)
        Address: 00:00:00:00:00:00 (OUI 00-00-00)
< HCI Command: LE Set Random Address (0x08|0x0005) plen 6   #35 [hci1] 0.858692
        Address: D5:B6:CC:31:DB:3B (Static)
> HCI Event: Command Complete (0x0e) plen 4                 #36 [hci1] 0.859147
      LE Set Random Address (0x08|0x0005) ncmd 1
        Status: Success (0x00)
< HCI Command: LE Set Extended Adv.. (0x08|0x0036) plen 25  #37 [hci1] 3.399301
        Handle: 0x00
        Properties: 0x0013
          Connectable
          Scannable
          Use legacy advertising PDUs: ADV_IND
        Min advertising interval: 100.000 msec (0x00a0)
        Max advertising interval: 150.000 msec (0x00f0)
        Channel map: 37, 38, 39 (0x07)
        Own address type: Random (0x01)
        Peer address type: Public (0x00)
        Peer address: 00:00:00:00:00:00 (OUI 00-00-00)
        Filter policy: Allow Scan Request from Any, Allow Connect Request from Any (0x00)
        TX power: Host has no preference (0x7f)
        Primary PHY: LE 1M (0x01)
        Secondary max skip: 0x00
        Secondary PHY: LE 1M (0x01)
        SID: 0x00
        Scan request notifications: Disabled (0x00)
> HCI Event: Command Complete (0x0e) plen 5                 #38 [hci1] 3.400131
      LE Set Extended Advertising Parameters (0x08|0x0036) ncmd 1
        Status: Success (0x00)
        TX power (selected): 0 dbm (0x00)
< HCI Command: LE Set Advertising S.. (0x08|0x0035) plen 7  #39 [hci1] 3.418723
        Advertising handle: 0x00
        Advertising random address: D5:B6:CC:31:DB:3B (Static)
> HCI Event: Command Complete (0x0e) plen 4                 #40 [hci1] 3.419169
      LE Set Advertising Set Random Address (0x08|0x0035) ncmd 1
        Status: Success (0x00)
< HCI Command: LE Set Extended Adv.. (0x08|0x0037) plen 22  #41 [hci1] 3.438754
        Handle: 0x00
        Operation: Complete extended advertising data (0x03)
        Fragment preference: Minimize fragmentation (0x01)
        Data length: 0x12
        Flags: 0x06
          LE General Discoverable Mode
          BR/EDR Not Supported
        Name (complete): Tester_F6B11A
> HCI Event: Command Complete (0x0e) plen 4                 #42 [hci1] 3.439467
      LE Set Extended Advertising Data (0x08|0x0037) ncmd 1
        Status: Success (0x00)
< HCI Command: LE Set Extended Scan.. (0x08|0x0038) plen 4  #43 [hci1] 3.458734
        Handle: 0x00
        Operation: Complete scan response data (0x03)
        Fragment preference: Minimize fragmentation (0x01)
        Data length: 0x00
> HCI Event: Command Complete (0x0e) plen 4                 #44 [hci1] 3.459182
      LE Set Extended Scan Response Data (0x08|0x0038) ncmd 1
        Status: Success (0x00)
< HCI Command: LE Set Extended Adve.. (0x08|0x0039) plen 6  #45 [hci1] 3.478723
        Extended advertising: Enabled (0x01)
        Number of sets: 1 (0x01)
        Entry 0
          Handle: 0x00
          Duration: 0 ms (0x00)
          Max ext adv events: 0
> HCI Event: Command Complete (0x0e) plen 4                 #46 [hci1] 3.479255
      LE Set Extended Advertising Enable (0x08|0x0039) ncmd 1
        Status: Success (0x00)
> HCI Event: LE Meta Event (0x3e) plen 31                   #47 [hci1] 3.597499
      LE Enhanced Connection Complete (0x0a)
        Status: Success (0x00)
        Handle: 1191
        Role: Peripheral (0x01)
        Peer address type: Public (0x00)
        Peer address: DF:A9:FF:F6:B1:1A (OUI DF-A9-FF)
        Local resolvable private address: 00:00:00:00:00:00 (Non-Resolvable)
        Peer resolvable private address: 00:00:00:00:00:00 (Non-Resolvable)
        Connection interval: 87.50 msec (0x0046)
        Connection latency: 0 (0x0000)
        Supervision timeout: 25120 msec (0x09d0)
        Central clock accuracy: 0x01
> HCI Event: LE Meta Event (0x3e) plen 6                    #48 [hci1] 3.597607
      LE Advertising Set Terminated (0x12)
        Status: Success (0x00)
        Handle: 0
        Connection handle: 1191
        Number of completed extended advertising events: 0
< HCI Command: LE Read Remote Used... (0x08|0x0016) plen 2  #49 [hci1] 3.604581
        Handle: 1191 Address: DF:A9:FF:F6:B1:1A (OUI DF-A9-FF)
< ACL Data TX: Handle 1191 flags 0x00 dlen 7                #50 [hci1] 3.604593
      ATT: Exchange MTU Request (0x02) len 2
        Client RX MTU: 251
> HCI Event: Command Status (0x0f) plen 4                   #51 [hci1] 3.604968
      LE Read Remote Used Features (0x08|0x0016) ncmd 1
        Status: Success (0x00)
> HCI Event: Number of Completed Packets (0x13) plen 5      #52 [hci1] 3.773531
        Num handles: 1
        Handle: 1191 Address: DF:A9:FF:F6:B1:1A (OUI DF-A9-FF)
        Count: 1
        #50: len 7 (0 Kb/s)
        Latency: 168 msec (168-168 msec ~168 msec)
> HCI Event: LE Meta Event (0x3e) plen 12                   #53 [hci1] 3.861471
      LE Read Remote Used Features (0x04)
        Status: Success (0x00)
        Handle: 1191 Address: DF:A9:FF:F6:B1:1A (OUI DF-A9-FF)
        Features: 0x2d 0x49 0x00 0xf7 0x67 0xd9 0x00 0x80
          LE Encryption
          Extended Reject Indication
          Peripheral-initiated Features Exchange
          LE Data Packet Length Extension
          LE 2M PHY
          LE Coded PHY
          Channel Selection Algorithm #2
          Periodic Advertising Sync Transfer - Sender
          Periodic Advertising Sync Transfer - Recipient
          Sleep Clock Accuracy Updates
          Connected Isochronous Stream - Central
          Connected Isochronous Stream - Peripheral
          Isochronous Broadcaster
          Synchronized Receiver
          Connected Isochronous Stream (Host Support)
          LE Power Control Request
          LE Power Control Request
          Connection Subrating
          Connection Subrating (Host Support)
          Unknown features (0x8000d90000000000)
> ACL Data RX: Handle 1191 flags 0x02 dlen 11               #54 [hci1] 6.311139
      SMP: Pairing Request (0x01) len 6
        IO capability: KeyboardDisplay (0x04)
        OOB data: Authentication data not present (0x00)
        Authentication requirement: Bonding, MITM, SC, No Keypresses (0x0d)
        Max encryption key size: 16
        Initiator key distribution: EncKey IdKey (0x03)
        Responder key distribution: EncKey IdKey Sign (0x07)
> ACL Data RX: Handle 1191 flags 0x02 dlen 7                #55 [hci1] 6.311659
      ATT: Exchange MTU Response (0x03) len 2
        Server RX MTU: 23
< HCI Command: Host Number of Compl.. (0x03|0x0035) plen 5  #56 [hci1] 6.318883
        Num handles: 1
        Handle: 1191 Address: DF:A9:FF:F6:B1:1A (OUI DF-A9-FF)
        Count: 1
< ACL Data TX: Handle 1191 flags 0x00 dlen 11               #57 [hci1] 6.318962
      SMP: Pairing Response (0x02) len 6
        IO capability: DisplayOnly (0x00)
        OOB data: Authentication data not present (0x00)
        Authentication requirement: Bonding, No MITM, SC, No Keypresses (0x09)
        Max encryption key size: 16
        Initiator key distribution: IdKey (0x02)
        Responder key distribution: <none> (0x00)
< HCI Command: Host Number of Compl.. (0x03|0x0035) plen 5  #58 [hci1] 6.319106
        Num handles: 1
        Handle: 1191 Address: DF:A9:FF:F6:B1:1A (OUI DF-A9-FF)
        Count: 1
> HCI Event: Number of Completed Packets (0x13) plen 5      #59 [hci1] 6.486195
        Num handles: 1
        Handle: 1191 Address: DF:A9:FF:F6:B1:1A (OUI DF-A9-FF)
        Count: 1
        #57: len 11 (0 Kb/s)
        Latency: 167 msec (167-168 msec ~168 msec)
> ACL Data RX: Handle 1191 flags 0x02 dlen 27               #60 [hci1] 6.486559
> ACL Data RX: Handle 1191 flags 0x01 dlen 27               #61 [hci1] 6.487071
> ACL Data RX: Handle 1191 flags 0x01 dlen 15               #62 [hci1] 6.487569
      SMP: Pairing Public Key (0x0c) len 64
        X: b9572c814c5c20fd0be339bcc162ffa3f67ada2c072bac2f96b1419f5605eff1
        Y: 574d17ac87d77a7c2c35c4db6bec2adaf346b3dcd2409ddecd8b3792d242b92d
< HCI Command: Host Number of Compl.. (0x03|0x0035) plen 5  #63 [hci1] 6.499786
        Num handles: 1
        Handle: 1191 Address: DF:A9:FF:F6:B1:1A (OUI DF-A9-FF)
        Count: 1
< HCI Command: Host Number of Compl.. (0x03|0x0035) plen 5  #64 [hci1] 6.500021
        Num handles: 1
        Handle: 1191 Address: DF:A9:FF:F6:B1:1A (OUI DF-A9-FF)
        Count: 1
< HCI Command: Host Number of Compl.. (0x03|0x0035) plen 5  #65 [hci1] 6.500449
        Num handles: 1
        Handle: 1191 Address: DF:A9:FF:F6:B1:1A (OUI DF-A9-FF)
        Count: 1
< ACL Data TX: Handle 1191 flags 0x00 dlen 27               #66 [hci1] 6.500551
< ACL Data TX: Handle 1191 flags 0x01 dlen 27               #67 [hci1] 6.500569
< ACL Data TX: Handle 1191 flags 0x01 dlen 15               #68 [hci1] 6.500605
      SMP: Pairing Public Key (0x0c) len 64
        X: 98308440221e2d910f0e54b71e7ec652857aa9b5a0dc65028824cc19db1226e9
        Y: 67a4816bcb62efb21701e31fdb27561a6217575fb007a8bbdabe7e28b6f68482
> HCI Event: Number of Completed Packets (0x13) plen 5      #69 [hci1] 6.574120
        Num handles: 1
        Handle: 1191 Address: DF:A9:FF:F6:B1:1A (OUI DF-A9-FF)
        Count: 1
        #66: len 27 (2 Kb/s)
        Latency: 73 msec (73-168 msec ~120 msec)
> HCI Event: Number of Completed Packets (0x13) plen 5      #70 [hci1] 6.574770
        Num handles: 1
        Handle: 1191 Address: DF:A9:FF:F6:B1:1A (OUI DF-A9-FF)
        Count: 1
        #67: len 27 (2 Kb/s)
        Latency: 74 msec (73-168 msec ~97 msec)
> HCI Event: Number of Completed Packets (0x13) plen 5      #71 [hci1] 6.661036
        Num handles: 1
        Handle: 1191 Address: DF:A9:FF:F6:B1:1A (OUI DF-A9-FF)
        Count: 1
        #68: len 15 (0 Kb/s)
        Latency: 160 msec (73-168 msec ~128 msec)
> ACL Data RX: Handle 1191 flags 0x02 dlen 21               #72 [hci1] 7.623794
      SMP: Pairing Confirm (0x03) len 16
        Confim value: 65da4b561bb4731328fcc1760c56776f
< HCI Command: Host Number of Compl.. (0x03|0x0035) plen 5  #73 [hci1] 7.639042
        Num handles: 1
        Handle: 1191 Address: DF:A9:FF:F6:B1:1A (OUI DF-A9-FF)
        Count: 1
< ACL Data TX: Handle 1191 flags 0x00 dlen 21               #74 [hci1] 7.639092
      SMP: Pairing Confirm (0x03) len 16
        Confim value: d4a9744743de5b302089ccd07b017fbb
> HCI Event: Number of Completed Packets (0x13) plen 5      #75 [hci1] 7.798627
        Num handles: 1
        Handle: 1191 Address: DF:A9:FF:F6:B1:1A (OUI DF-A9-FF)
        Count: 1
        #74: len 21 (1 Kb/s)
        Latency: 159 msec (73-168 msec ~144 msec)
> ACL Data RX: Handle 1191 flags 0x02 dlen 21               #76 [hci1] 7.799018
      SMP: Pairing Random (0x04) len 16
        Random value: 228796c3e496d19a0000000000000000
< HCI Command: Host Number of Compl.. (0x03|0x0035) plen 5  #77 [hci1] 7.819386
        Num handles: 1
        Handle: 1191 Address: DF:A9:FF:F6:B1:1A (OUI DF-A9-FF)
        Count: 1
< ACL Data TX: Handle 1191 flags 0x00 dlen 21               #78 [hci1] 7.819512
      SMP: Pairing Random (0x04) len 16
        Random value: 8e6108f966a694cbe26df70bb96773e6
> HCI Event: Number of Completed Packets (0x13) plen 5      #79 [hci1] 7.973430
        Num handles: 1
        Handle: 1191 Address: DF:A9:FF:F6:B1:1A (OUI DF-A9-FF)
        Count: 1
        #78: len 21 (1 Kb/s)
        Latency: 153 msec (73-168 msec ~149 msec)
> ACL Data RX: Handle 1191 flags 0x02 dlen 21               #80 [hci1] 8.061320
      SMP: Pairing Confirm (0x03) len 16
        Confim value: fc9d4302217d9ba03489c361390f185e
< HCI Command: Host Number of Compl.. (0x03|0x0035) plen 5  #81 [hci1] 8.079336
        Num handles: 1
        Handle: 1191 Address: DF:A9:FF:F6:B1:1A (OUI DF-A9-FF)
        Count: 1
< ACL Data TX: Handle 1191 flags 0x00 dlen 21               #82 [hci1] 8.079461
      SMP: Pairing Confirm (0x03) len 16
        Confim value: 58ae6ced2039a39ae52d21547d576029
> HCI Event: Number of Completed Packets (0x13) plen 5      #83 [hci1] 8.236080
        Num handles: 1
        Handle: 1191 Address: DF:A9:FF:F6:B1:1A (OUI DF-A9-FF)
        Count: 1
        #82: len 21 (1 Kb/s)
        Latency: 156 msec (73-168 msec ~152 msec)
> ACL Data RX: Handle 1191 flags 0x02 dlen 21               #84 [hci1] 8.236378
      SMP: Pairing Random (0x04) len 16
        Random value: c95214b94751ae580000000000000000
< HCI Command: Host Number of Compl.. (0x03|0x0035) plen 5  #85 [hci1] 8.238713
        Num handles: 1
        Handle: 1191 Address: DF:A9:FF:F6:B1:1A (OUI DF-A9-FF)
        Count: 1
< ACL Data TX: Handle 1191 flags 0x00 dlen 21               #86 [hci1] 8.239179
      SMP: Pairing Random (0x04) len 16
        Random value: 4d02679f89a05211af56d8b3da64d21e
> HCI Event: Number of Completed Packets (0x13) plen 5      #87 [hci1] 8.411189
        Num handles: 1
        Handle: 1191 Address: DF:A9:FF:F6:B1:1A (OUI DF-A9-FF)
        Count: 1
        #86: len 21 (0 Kb/s)
        Latency: 172 msec (73-172 msec ~162 msec)
> ACL Data RX: Handle 1191 flags 0x02 dlen 21               #88 [hci1] 8.411442
      SMP: Pairing Confirm (0x03) len 16
        Confim value: c3fd8e73c12a5f9f870b39519c1fdacc
< HCI Command: Host Number of Compl.. (0x03|0x0035) plen 5  #89 [hci1] 8.418977
        Num handles: 1
        Handle: 1191 Address: DF:A9:FF:F6:B1:1A (OUI DF-A9-FF)
        Count: 1
< ACL Data TX: Handle 1191 flags 0x00 dlen 21               #90 [hci1] 8.419043
      SMP: Pairing Confirm (0x03) len 16
        Confim value: 74d643c2f91433672e0f09c05d615d5c
> HCI Event: Number of Completed Packets (0x13) plen 5      #91 [hci1] 8.586125
        Num handles: 1
        Handle: 1191 Address: DF:A9:FF:F6:B1:1A (OUI DF-A9-FF)
        Count: 1
        #90: len 21 (1 Kb/s)
        Latency: 167 msec (73-172 msec ~164 msec)
> ACL Data RX: Handle 1191 flags 0x02 dlen 21               #92 [hci1] 8.586451
      SMP: Pairing Random (0x04) len 16
        Random value: eede8f9b0c5066290000000000000000
< HCI Command: Host Number of Compl.. (0x03|0x0035) plen 5  #93 [hci1] 8.599334
        Num handles: 1
        Handle: 1191 Address: DF:A9:FF:F6:B1:1A (OUI DF-A9-FF)
        Count: 1
< ACL Data TX: Handle 1191 flags 0x00 dlen 21               #94 [hci1] 8.599489
      SMP: Pairing Random (0x04) len 16
        Random value: 5e8286bc235a02440d0c3424a2acf8fd
> HCI Event: Number of Completed Packets (0x13) plen 5      #95 [hci1] 8.761051
        Num handles: 1
        Handle: 1191 Address: DF:A9:FF:F6:B1:1A (OUI DF-A9-FF)
        Count: 1
        #94: len 21 (1 Kb/s)
        Latency: 161 msec (73-172 msec ~163 msec)
> ACL Data RX: Handle 1191 flags 0x02 dlen 21               #96 [hci1] 8.848836
      SMP: Pairing Confirm (0x03) len 16
        Confim value: af158bb106b294b6f489263fb4e1950a
< HCI Command: Host Number of Compl.. (0x03|0x0035) plen 5  #97 [hci1] 8.859365
        Num handles: 1
        Handle: 1191 Address: DF:A9:FF:F6:B1:1A (OUI DF-A9-FF)
        Count: 1
< ACL Data TX: Handle 1191 flags 0x00 dlen 21               #98 [hci1] 8.859531
      SMP: Pairing Confirm (0x03) len 16
        Confim value: ac0022e339ff62730af993cd8612dcab
> HCI Event: Number of Completed Packets (0x13) plen 5      #99 [hci1] 9.023733
        Num handles: 1
        Handle: 1191 Address: DF:A9:FF:F6:B1:1A (OUI DF-A9-FF)
        Count: 1
        #98: len 21 (1 Kb/s)
        Latency: 164 msec (73-172 msec ~163 msec)
> ACL Data RX: Handle 1191 flags 0x02 dlen 21              #100 [hci1] 9.023946
      SMP: Pairing Random (0x04) len 16
        Random value: 1b4b03b54555a75f0000000000000000
< HCI Command: Host Number of Comp.. (0x03|0x0035) plen 5  #101 [hci1] 9.039638
        Num handles: 1
        Handle: 1191 Address: DF:A9:FF:F6:B1:1A (OUI DF-A9-FF)
        Count: 1
< ACL Data TX: Handle 1191 flags 0x00 dlen 21              #102 [hci1] 9.039803
      SMP: Pairing Random (0x04) len 16
        Random value: 5c4a1bcadd27bd58e945097b00bad7ac
> HCI Event: Number of Completed Packets (0x13) plen 5     #103 [hci1] 9.198391
        Num handles: 1
        Handle: 1191 Address: DF:A9:FF:F6:B1:1A (OUI DF-A9-FF)
        Count: 1
        #102: len 21 (1 Kb/s)
        Latency: 158 msec (73-172 msec ~161 msec)
> ACL Data RX: Handle 1191 flags 0x02 dlen 21              #104 [hci1] 9.286341
      SMP: Pairing Confirm (0x03) len 16
        Confim value: 5f51117e4273530548af8140da53b6a9
< HCI Command: Host Number of Comp.. (0x03|0x0035) plen 5  #105 [hci1] 9.298906
        Num handles: 1
        Handle: 1191 Address: DF:A9:FF:F6:B1:1A (OUI DF-A9-FF)
        Count: 1
< ACL Data TX: Handle 1191 flags 0x00 dlen 21              #106 [hci1] 9.298963
      SMP: Pairing Confirm (0x03) len 16
        Confim value: fe3ec360efc7f416e63ab51832a76ac8
> HCI Event: Number of Completed Packets (0x13) plen 5     #107 [hci1] 9.461110
        Num handles: 1
        Handle: 1191 Address: DF:A9:FF:F6:B1:1A (OUI DF-A9-FF)
        Count: 1
        #106: len 21 (1 Kb/s)
        Latency: 162 msec (73-172 msec ~161 msec)
> ACL Data RX: Handle 1191 flags 0x02 dlen 21              #108 [hci1] 9.461427
      SMP: Pairing Random (0x04) len 16
        Random value: b76c30c6cd02a7250000000000000000
< HCI Command: Host Number of Comp.. (0x03|0x0035) plen 5  #109 [hci1] 9.479594
        Num handles: 1
        Handle: 1191 Address: DF:A9:FF:F6:B1:1A (OUI DF-A9-FF)
        Count: 1
< ACL Data TX: Handle 1191 flags 0x00 dlen 21              #110 [hci1] 9.479643
      SMP: Pairing Random (0x04) len 16
        Random value: 32527e6e64e79f33b2e374394db8ab2d
> HCI Event: Number of Completed Packets (0x13) plen 5     #111 [hci1] 9.635827
        Num handles: 1
        Handle: 1191 Address: DF:A9:FF:F6:B1:1A (OUI DF-A9-FF)
        Count: 1
        #110: len 21 (1 Kb/s)
        Latency: 156 msec (73-172 msec ~158 msec)
> ACL Data RX: Handle 1191 flags 0x02 dlen 21              #112 [hci1] 9.723822
      SMP: Pairing Confirm (0x03) len 16
        Confim value: 3a2503bca87d18b129465464bfea0850
< HCI Command: Host Number of Comp.. (0x03|0x0035) plen 5  #113 [hci1] 9.739400
        Num handles: 1
        Handle: 1191 Address: DF:A9:FF:F6:B1:1A (OUI DF-A9-FF)
        Count: 1
< ACL Data TX: Handle 1191 flags 0x00 dlen 21              #114 [hci1] 9.739572
      SMP: Pairing Confirm (0x03) len 16
        Confim value: 0e37200b18778f54edfa6371e0b3657b
> HCI Event: Number of Completed Packets (0x13) plen 5     #115 [hci1] 9.898575
        Num handles: 1
        Handle: 1191 Address: DF:A9:FF:F6:B1:1A (OUI DF-A9-FF)
        Count: 1
        #114: len 21 (1 Kb/s)
        Latency: 159 msec (73-172 msec ~158 msec)
> ACL Data RX: Handle 1191 flags 0x02 dlen 21              #116 [hci1] 9.898996
      SMP: Pairing Random (0x04) len 16
        Random value: 86360a41ad164aff0000000000000000
< HCI Command: Host Number of Comp.. (0x03|0x0035) plen 5  #117 [hci1] 9.919469
        Num handles: 1
        Handle: 1191 Address: DF:A9:FF:F6:B1:1A (OUI DF-A9-FF)
        Count: 1
< ACL Data TX: Handle 1191 flags 0x00 dlen 21              #118 [hci1] 9.919639
      SMP: Pairing Random (0x04) len 16
        Random value: dddbdfe2838e9a8cc6964353c850fef7
> HCI Event: Number of Completed Packets (0x13) plen 5    #119 [hci1] 10.073354
        Num handles: 1
        Handle: 1191 Address: DF:A9:FF:F6:B1:1A (OUI DF-A9-FF)
        Count: 1
        #118: len 21 (1 Kb/s)
        Latency: 153 msec (73-172 msec ~156 msec)
> ACL Data RX: Handle 1191 flags 0x02 dlen 21             #120 [hci1] 10.161375
      SMP: Pairing Confirm (0x03) len 16
        Confim value: 7a44da747f96ca187a3e7d806132d6ce
< HCI Command: Host Number of Com.. (0x03|0x0035) plen 5  #121 [hci1] 10.179616
        Num handles: 1
        Handle: 1191 Address: DF:A9:FF:F6:B1:1A (OUI DF-A9-FF)
        Count: 1
< ACL Data TX: Handle 1191 flags 0x00 dlen 21             #122 [hci1] 10.179719
      SMP: Pairing Confirm (0x03) len 16
        Confim value: 07a6e20d85856843b3271b866473e3c3
> HCI Event: Number of Completed Packets (0x13) plen 5    #123 [hci1] 10.336071
        Num handles: 1
        Handle: 1191 Address: DF:A9:FF:F6:B1:1A (OUI DF-A9-FF)
        Count: 1
        #122: len 21 (1 Kb/s)
        Latency: 156 msec (73-172 msec ~156 msec)
> ACL Data RX: Handle 1191 flags 0x02 dlen 21             #124 [hci1] 10.336378
      SMP: Pairing Random (0x04) len 16
        Random value: b7d2074114d7d06f0000000000000000
< HCI Command: Host Number of Com.. (0x03|0x0035) plen 5  #125 [hci1] 10.339610
        Num handles: 1
        Handle: 1191 Address: DF:A9:FF:F6:B1:1A (OUI DF-A9-FF)
        Count: 1
< ACL Data TX: Handle 1191 flags 0x00 dlen 21             #126 [hci1] 10.339773
      SMP: Pairing Random (0x04) len 16
        Random value: eb9f1915536596b6fc3db1c86b2b1970
> HCI Event: Number of Completed Packets (0x13) plen 5    #127 [hci1] 10.510879
        Num handles: 1
        Handle: 1191 Address: DF:A9:FF:F6:B1:1A (OUI DF-A9-FF)
        Count: 1
        #126: len 21 (0 Kb/s)
        Latency: 171 msec (73-172 msec ~163 msec)
> ACL Data RX: Handle 1191 flags 0x02 dlen 21             #128 [hci1] 10.598822
      SMP: Pairing Confirm (0x03) len 16
        Confim value: ee2be951e05a1f3fb86d6a1426681684
< HCI Command: Host Number of Com.. (0x03|0x0035) plen 5  #129 [hci1] 10.618975
        Num handles: 1
        Handle: 1191 Address: DF:A9:FF:F6:B1:1A (OUI DF-A9-FF)
        Count: 1
< ACL Data TX: Handle 1191 flags 0x00 dlen 21             #130 [hci1] 10.619019
      SMP: Pairing Confirm (0x03) len 16
        Confim value: f8dfca0af9c72e1482bf04b57a0235ae
> HCI Event: Number of Completed Packets (0x13) plen 5    #131 [hci1] 10.773569
        Num handles: 1
        Handle: 1191 Address: DF:A9:FF:F6:B1:1A (OUI DF-A9-FF)
        Count: 1
        #130: len 21 (1 Kb/s)
        Latency: 154 msec (73-172 msec ~159 msec)
> ACL Data RX: Handle 1191 flags 0x02 dlen 21             #132 [hci1] 10.773898
      SMP: Pairing Random (0x04) len 16
        Random value: d7b1d49714c4ef6e0000000000000000
< HCI Command: Host Number of Com.. (0x03|0x0035) plen 5  #133 [hci1] 10.779632
        Num handles: 1
        Handle: 1191 Address: DF:A9:FF:F6:B1:1A (OUI DF-A9-FF)
        Count: 1
< ACL Data TX: Handle 1191 flags 0x00 dlen 21             #134 [hci1] 10.779832
      SMP: Pairing Random (0x04) len 16
        Random value: 5c794dc9ad9f2c3f295ebd5ad5e1c3cf
> HCI Event: Number of Completed Packets (0x13) plen 5    #135 [hci1] 10.948396
        Num handles: 1
        Handle: 1191 Address: DF:A9:FF:F6:B1:1A (OUI DF-A9-FF)
        Count: 1
        #134: len 21 (1 Kb/s)
        Latency: 168 msec (73-172 msec ~163 msec)
> ACL Data RX: Handle 1191 flags 0x02 dlen 21             #136 [hci1] 11.036265
      SMP: Pairing Confirm (0x03) len 16
        Confim value: d07ff1aba06eb98340e7a94c07a8e655
< HCI Command: Host Number of Com.. (0x03|0x0035) plen 5  #137 [hci1] 11.039420
        Num handles: 1
        Handle: 1191 Address: DF:A9:FF:F6:B1:1A (OUI DF-A9-FF)
        Count: 1
< ACL Data TX: Handle 1191 flags 0x00 dlen 21             #138 [hci1] 11.039582
      SMP: Pairing Confirm (0x03) len 16
        Confim value: 0c4370a29613c6d612174a0c5f5f33ae
> HCI Event: Number of Completed Packets (0x13) plen 5    #139 [hci1] 11.211041
        Num handles: 1
        Handle: 1191 Address: DF:A9:FF:F6:B1:1A (OUI DF-A9-FF)
        Count: 1
        #138: len 21 (0 Kb/s)
        Latency: 171 msec (73-172 msec ~167 msec)
> ACL Data RX: Handle 1191 flags 0x02 dlen 21             #140 [hci1] 11.211406
      SMP: Pairing Random (0x04) len 16
        Random value: 55a852eabf68c7bb0000000000000000
< HCI Command: Host Number of Com.. (0x03|0x0035) plen 5  #141 [hci1] 11.219488
        Num handles: 1
        Handle: 1191 Address: DF:A9:FF:F6:B1:1A (OUI DF-A9-FF)
        Count: 1
< ACL Data TX: Handle 1191 flags 0x00 dlen 21             #142 [hci1] 11.219545
      SMP: Pairing Random (0x04) len 16
        Random value: 5c2fff312cdf99c9491988e877355a9a
> HCI Event: Number of Completed Packets (0x13) plen 5    #143 [hci1] 11.385839
        Num handles: 1
        Handle: 1191 Address: DF:A9:FF:F6:B1:1A (OUI DF-A9-FF)
        Count: 1
        #142: len 21 (1 Kb/s)
        Latency: 166 msec (73-172 msec ~166 msec)
> ACL Data RX: Handle 1191 flags 0x02 dlen 21             #144 [hci1] 11.473710
      SMP: Pairing Confirm (0x03) len 16
        Confim value: ba8a1ae5db54b8474a86a7fe10f8256b
< HCI Command: Host Number of Com.. (0x03|0x0035) plen 5  #145 [hci1] 11.479065
        Num handles: 1
        Handle: 1191 Address: DF:A9:FF:F6:B1:1A (OUI DF-A9-FF)
        Count: 1
< ACL Data TX: Handle 1191 flags 0x00 dlen 21             #146 [hci1] 11.479122
      SMP: Pairing Confirm (0x03) len 16
        Confim value: cce852c8861ae68028039ecc1b519e4b
> HCI Event: Number of Completed Packets (0x13) plen 5    #147 [hci1] 11.648580
        Num handles: 1
        Handle: 1191 Address: DF:A9:FF:F6:B1:1A (OUI DF-A9-FF)
        Count: 1
        #146: len 21 (0 Kb/s)
        Latency: 169 msec (73-172 msec ~168 msec)
> ACL Data RX: Handle 1191 flags 0x02 dlen 21             #148 [hci1] 11.648929
      SMP: Pairing Random (0x04) len 16
        Random value: 058eacbd31f6aad90000000000000000
< HCI Command: Host Number of Com.. (0x03|0x0035) plen 5  #149 [hci1] 11.659689
        Num handles: 1
        Handle: 1191 Address: DF:A9:FF:F6:B1:1A (OUI DF-A9-FF)
        Count: 1
< ACL Data TX: Handle 1191 flags 0x00 dlen 21             #150 [hci1] 11.659883
      SMP: Pairing Random (0x04) len 16
        Random value: c629a3a987d808e808655d558dfc1155
> HCI Event: Number of Completed Packets (0x13) plen 5    #151 [hci1] 11.823412
        Num handles: 1
        Handle: 1191 Address: DF:A9:FF:F6:B1:1A (OUI DF-A9-FF)
        Count: 1
        #150: len 21 (1 Kb/s)
        Latency: 163 msec (73-172 msec ~165 msec)
> ACL Data RX: Handle 1191 flags 0x02 dlen 21             #152 [hci1] 11.911190
      SMP: Pairing Confirm (0x03) len 16
        Confim value: 755225bc11f4a924a31f3ffd33a3e552
< HCI Command: Host Number of Com.. (0x03|0x0035) plen 5  #153 [hci1] 11.919357
        Num handles: 1
        Handle: 1191 Address: DF:A9:FF:F6:B1:1A (OUI DF-A9-FF)
        Count: 1
< ACL Data TX: Handle 1191 flags 0x00 dlen 21             #154 [hci1] 11.919507
      SMP: Pairing Confirm (0x03) len 16
        Confim value: 3900242a9038214bd9f6bc678dfba13d
> HCI Event: Number of Completed Packets (0x13) plen 5    #155 [hci1] 12.086041
        Num handles: 1
        Handle: 1191 Address: DF:A9:FF:F6:B1:1A (OUI DF-A9-FF)
        Count: 1
        #154: len 21 (1 Kb/s)
        Latency: 166 msec (73-172 msec ~166 msec)
> ACL Data RX: Handle 1191 flags 0x02 dlen 21             #156 [hci1] 12.086438
      SMP: Pairing Random (0x04) len 16
        Random value: 173701223f1ea36f0000000000000000
< HCI Command: Host Number of Com.. (0x03|0x0035) plen 5  #157 [hci1] 12.099669
        Num handles: 1
        Handle: 1191 Address: DF:A9:FF:F6:B1:1A (OUI DF-A9-FF)
        Count: 1
< ACL Data TX: Handle 1191 flags 0x00 dlen 21             #158 [hci1] 12.099828
      SMP: Pairing Random (0x04) len 16
        Random value: 92f20f6ad8f13724432c7fd6001c45ff
> HCI Event: Number of Completed Packets (0x13) plen 5    #159 [hci1] 12.260848
        Num handles: 1
        Handle: 1191 Address: DF:A9:FF:F6:B1:1A (OUI DF-A9-FF)
        Count: 1
        #158: len 21 (1 Kb/s)
        Latency: 161 msec (73-172 msec ~163 msec)
> ACL Data RX: Handle 1191 flags 0x02 dlen 21             #160 [hci1] 12.348707
      SMP: Pairing Confirm (0x03) len 16
        Confim value: ce99602e3677fe968a4714f2bc526732
< HCI Command: Host Number of Com.. (0x03|0x0035) plen 5  #161 [hci1] 12.358970
        Num handles: 1
        Handle: 1191 Address: DF:A9:FF:F6:B1:1A (OUI DF-A9-FF)
        Count: 1
< ACL Data TX: Handle 1191 flags 0x00 dlen 21             #162 [hci1] 12.359043
      SMP: Pairing Confirm (0x03) len 16
        Confim value: 734e7e94beca91b61354b7b41ec7ca73
> HCI Event: Number of Completed Packets (0x13) plen 5    #163 [hci1] 12.523657
        Num handles: 1
        Handle: 1191 Address: DF:A9:FF:F6:B1:1A (OUI DF-A9-FF)
        Count: 1
        #162: len 21 (1 Kb/s)
        Latency: 164 msec (73-172 msec ~164 msec)
> ACL Data RX: Handle 1191 flags 0x02 dlen 21             #164 [hci1] 12.523901
      SMP: Pairing Random (0x04) len 16
        Random value: 22f8544f320305130000000000000000
< HCI Command: Host Number of Com.. (0x03|0x0035) plen 5  #165 [hci1] 12.539704
        Num handles: 1
        Handle: 1191 Address: DF:A9:FF:F6:B1:1A (OUI DF-A9-FF)
        Count: 1
< ACL Data TX: Handle 1191 flags 0x00 dlen 21             #166 [hci1] 12.539806
      SMP: Pairing Random (0x04) len 16
        Random value: 23ac32ebbb5e14c8a6b9622f296d277f
> HCI Event: Number of Completed Packets (0x13) plen 5    #167 [hci1] 12.698338
        Num handles: 1
        Handle: 1191 Address: DF:A9:FF:F6:B1:1A (OUI DF-A9-FF)
        Count: 1
        #166: len 21 (1 Kb/s)
        Latency: 158 msec (73-172 msec ~161 msec)
> ACL Data RX: Handle 1191 flags 0x02 dlen 21             #168 [hci1] 12.786191
      SMP: Pairing Confirm (0x03) len 16
        Confim value: bd3df7adae779327eae8d731e33be5a6
< HCI Command: Host Number of Com.. (0x03|0x0035) plen 5  #169 [hci1] 12.799570
        Num handles: 1
        Handle: 1191 Address: DF:A9:FF:F6:B1:1A (OUI DF-A9-FF)
        Count: 1
< ACL Data TX: Handle 1191 flags 0x00 dlen 21             #170 [hci1] 12.799756
      SMP: Pairing Confirm (0x03) len 16
        Confim value: e4ebc16f4bed2ff6f6d7b00bb96806f5
> HCI Event: Number of Completed Packets (0x13) plen 5    #171 [hci1] 12.961060
        Num handles: 1
        Handle: 1191 Address: DF:A9:FF:F6:B1:1A (OUI DF-A9-FF)
        Count: 1
        #170: len 21 (1 Kb/s)
        Latency: 161 msec (73-172 msec ~161 msec)
> ACL Data RX: Handle 1191 flags 0x02 dlen 21             #172 [hci1] 12.961456
      SMP: Pairing Random (0x04) len 16
        Random value: 75ca918762f8300b0000000000000000
< HCI Command: Host Number of Com.. (0x03|0x0035) plen 5  #173 [hci1] 12.979693
        Num handles: 1
        Handle: 1191 Address: DF:A9:FF:F6:B1:1A (OUI DF-A9-FF)
        Count: 1
< ACL Data TX: Handle 1191 flags 0x00 dlen 21             #174 [hci1] 12.979853
      SMP: Pairing Random (0x04) len 16
        Random value: 297efe85e67448a15f56bd27e3a3cf1d
> HCI Event: Number of Completed Packets (0x13) plen 5    #175 [hci1] 13.135876
        Num handles: 1
        Handle: 1191 Address: DF:A9:FF:F6:B1:1A (OUI DF-A9-FF)
        Count: 1
        #174: len 21 (1 Kb/s)
        Latency: 156 msec (73-172 msec ~158 msec)
> ACL Data RX: Handle 1191 flags 0x02 dlen 21             #176 [hci1] 13.223700
      SMP: Pairing Confirm (0x03) len 16
        Confim value: 5aafcf9e0c41bcd73f768ba846c0b4f8
< HCI Command: Host Number of Com.. (0x03|0x0035) plen 5  #177 [hci1] 13.239474
        Num handles: 1
        Handle: 1191 Address: DF:A9:FF:F6:B1:1A (OUI DF-A9-FF)
        Count: 1
< ACL Data TX: Handle 1191 flags 0x00 dlen 21             #178 [hci1] 13.239661
      SMP: Pairing Confirm (0x03) len 16
        Confim value: 33b7c1e5e6560faa9dfc6530d9f1fe63
> HCI Event: Number of Completed Packets (0x13) plen 5    #179 [hci1] 13.398536
        Num handles: 1
        Handle: 1191 Address: DF:A9:FF:F6:B1:1A (OUI DF-A9-FF)
        Count: 1
        #178: len 21 (1 Kb/s)
        Latency: 158 msec (73-172 msec ~158 msec)
> ACL Data RX: Handle 1191 flags 0x02 dlen 21             #180 [hci1] 13.398901
      SMP: Pairing Random (0x04) len 16
        Random value: 0722003c3fc6d8350000000000000000
< HCI Command: Host Number of Com.. (0x03|0x0035) plen 5  #181 [hci1] 13.399717
        Num handles: 1
        Handle: 1191 Address: DF:A9:FF:F6:B1:1A (OUI DF-A9-FF)
        Count: 1
< ACL Data TX: Handle 1191 flags 0x00 dlen 21             #182 [hci1] 13.399895
      SMP: Pairing Random (0x04) len 16
        Random value: 25a9493fd3ce4faf02be7293595bb7c6
> HCI Event: Number of Completed Packets (0x13) plen 5    #183 [hci1] 13.573366
        Num handles: 1
        Handle: 1191 Address: DF:A9:FF:F6:B1:1A (OUI DF-A9-FF)
        Count: 1
        #182: len 21 (0 Kb/s)
        Latency: 173 msec (73-173 msec ~166 msec)
> ACL Data RX: Handle 1191 flags 0x02 dlen 21             #184 [hci1] 13.661164
      SMP: Pairing Confirm (0x03) len 16
        Confim value: 68b5bfd3d81b43e8080ef9901c2b6f32
< HCI Command: Host Number of Com.. (0x03|0x0035) plen 5  #185 [hci1] 13.679133
        Num handles: 1
        Handle: 1191 Address: DF:A9:FF:F6:B1:1A (OUI DF-A9-FF)
        Count: 1
< ACL Data TX: Handle 1191 flags 0x00 dlen 21             #186 [hci1] 13.679241
      SMP: Pairing Confirm (0x03) len 16
        Confim value: 67899959940f00b2e265e8f703a34d44
> HCI Event: Number of Completed Packets (0x13) plen 5    #187 [hci1] 13.836096
        Num handles: 1
        Handle: 1191 Address: DF:A9:FF:F6:B1:1A (OUI DF-A9-FF)
        Count: 1
        #186: len 21 (1 Kb/s)
        Latency: 156 msec (73-173 msec ~161 msec)
> ACL Data RX: Handle 1191 flags 0x02 dlen 21             #188 [hci1] 13.836438
      SMP: Pairing Random (0x04) len 16
        Random value: ef38d0fadc0fbced0000000000000000
< HCI Command: Host Number of Com.. (0x03|0x0035) plen 5  #189 [hci1] 13.839512
        Num handles: 1
        Handle: 1191 Address: DF:A9:FF:F6:B1:1A (OUI DF-A9-FF)
        Count: 1
< ACL Data TX: Handle 1191 flags 0x00 dlen 21             #190 [hci1] 13.839695
      SMP: Pairing Random (0x04) len 16
        Random value: 58f6b41f855a6f6c3560debd84e2affc
> HCI Event: Number of Completed Packets (0x13) plen 5    #191 [hci1] 14.010851
        Num handles: 1
        Handle: 1191 Address: DF:A9:FF:F6:B1:1A (OUI DF-A9-FF)
        Count: 1
        #190: len 21 (0 Kb/s)
        Latency: 171 msec (73-173 msec ~166 msec)
> ACL Data RX: Handle 1191 flags 0x02 dlen 21             #192 [hci1] 14.098698
      SMP: Pairing Confirm (0x03) len 16
        Confim value: c774beccef5a9fc035e28c9de73f4005
< HCI Command: Host Number of Com.. (0x03|0x0035) plen 5  #193 [hci1] 14.119153
        Num handles: 1
        Handle: 1191 Address: DF:A9:FF:F6:B1:1A (OUI DF-A9-FF)
        Count: 1
< ACL Data TX: Handle 1191 flags 0x00 dlen 21             #194 [hci1] 14.119254
      SMP: Pairing Confirm (0x03) len 16
        Confim value: 627a0d8230fcbc3c1d5bdf1d8c149e07
> HCI Event: Number of Completed Packets (0x13) plen 5    #195 [hci1] 14.273565
        Num handles: 1
        Handle: 1191 Address: DF:A9:FF:F6:B1:1A (OUI DF-A9-FF)
        Count: 1
        #194: len 21 (1 Kb/s)
        Latency: 154 msec (73-173 msec ~160 msec)
> ACL Data RX: Handle 1191 flags 0x02 dlen 21             #196 [hci1] 14.273896
      SMP: Pairing Random (0x04) len 16
        Random value: 2dbb86f5567040a00000000000000000
< HCI Command: Host Number of Com.. (0x03|0x0035) plen 5  #197 [hci1] 14.279786
        Num handles: 1
        Handle: 1191 Address: DF:A9:FF:F6:B1:1A (OUI DF-A9-FF)
        Count: 1
< ACL Data TX: Handle 1191 flags 0x00 dlen 21             #198 [hci1] 14.279942
      SMP: Pairing Random (0x04) len 16
        Random value: b67e7216d5bf664139eda2b542549666
> HCI Event: Number of Completed Packets (0x13) plen 5    #199 [hci1] 14.448285
        Num handles: 1
        Handle: 1191 Address: DF:A9:FF:F6:B1:1A (OUI DF-A9-FF)
        Count: 1
        #198: len 21 (1 Kb/s)
        Latency: 168 msec (73-173 msec ~164 msec)
> ACL Data RX: Handle 1191 flags 0x02 dlen 21             #200 [hci1] 14.536247
      SMP: Pairing Confirm (0x03) len 16
        Confim value: a799229e28caab1b87d444601ec7b7a3
< HCI Command: Host Number of Com.. (0x03|0x0035) plen 5  #201 [hci1] 14.539224
        Num handles: 1
        Handle: 1191 Address: DF:A9:FF:F6:B1:1A (OUI DF-A9-FF)
        Count: 1
< ACL Data TX: Handle 1191 flags 0x00 dlen 21             #202 [hci1] 14.539341
      SMP: Pairing Confirm (0x03) len 16
        Confim value: 02259b431d6756d2cc0668a7bb59929a
> HCI Event: Number of Completed Packets (0x13) plen 5    #203 [hci1] 14.711007
        Num handles: 1
        Handle: 1191 Address: DF:A9:FF:F6:B1:1A (OUI DF-A9-FF)
        Count: 1
        #202: len 21 (0 Kb/s)
        Latency: 171 msec (73-173 msec ~167 msec)
> ACL Data RX: Handle 1191 flags 0x02 dlen 21             #204 [hci1] 14.711422
      SMP: Pairing Random (0x04) len 16
        Random value: 6ff1033e99b696360000000000000000
< HCI Command: Host Number of Com.. (0x03|0x0035) plen 5  #205 [hci1] 14.719770
        Num handles: 1
        Handle: 1191 Address: DF:A9:FF:F6:B1:1A (OUI DF-A9-FF)
        Count: 1
< ACL Data TX: Handle 1191 flags 0x00 dlen 21             #206 [hci1] 14.719882
      SMP: Pairing Random (0x04) len 16
        Random value: ed17f76500c95219dd01e09d1e63f87b
> HCI Event: Number of Completed Packets (0x13) plen 5    #207 [hci1] 14.885850
        Num handles: 1
        Handle: 1191 Address: DF:A9:FF:F6:B1:1A (OUI DF-A9-FF)
        Count: 1
        #206: len 21 (1 Kb/s)
        Latency: 165 msec (73-173 msec ~166 msec)
> ACL Data RX: Handle 1191 flags 0x02 dlen 21             #208 [hci1] 14.973758
      SMP: Pairing Confirm (0x03) len 16
        Confim value: 83ce88cbf82d355cea4b9387500b96b0
< HCI Command: Host Number of Com.. (0x03|0x0035) plen 5  #209 [hci1] 14.979571
        Num handles: 1
        Handle: 1191 Address: DF:A9:FF:F6:B1:1A (OUI DF-A9-FF)
        Count: 1
< ACL Data TX: Handle 1191 flags 0x00 dlen 21             #210 [hci1] 14.979739
      SMP: Pairing Confirm (0x03) len 16
        Confim value: 989a24ddcb45efd3e7ee0cc6c7dca0df
> HCI Event: Number of Completed Packets (0x13) plen 5    #211 [hci1] 15.148522
        Num handles: 1
        Handle: 1191 Address: DF:A9:FF:F6:B1:1A (OUI DF-A9-FF)
        Count: 1
        #210: len 21 (1 Kb/s)
        Latency: 168 msec (73-173 msec ~167 msec)
> ACL Data RX: Handle 1191 flags 0x02 dlen 21             #212 [hci1] 15.148895
      SMP: Pairing Random (0x04) len 16
        Random value: da941cdfc5289e850000000000000000
< HCI Command: Host Number of Com.. (0x03|0x0035) plen 5  #213 [hci1] 15.159767
        Num handles: 1
        Handle: 1191 Address: DF:A9:FF:F6:B1:1A (OUI DF-A9-FF)
        Count: 1
< ACL Data TX: Handle 1191 flags 0x00 dlen 21             #214 [hci1] 15.159944
      SMP: Pairing Random (0x04) len 16
        Random value: 81d35d47e1f6006d79c974bd9d9e1ee3
> HCI Event: Number of Completed Packets (0x13) plen 5    #215 [hci1] 15.323320
        Num handles: 1
        Handle: 1191 Address: DF:A9:FF:F6:B1:1A (OUI DF-A9-FF)
        Count: 1
        #214: len 21 (1 Kb/s)
        Latency: 163 msec (73-173 msec ~165 msec)
> ACL Data RX: Handle 1191 flags 0x02 dlen 21             #216 [hci1] 15.411166
      SMP: Pairing Confirm (0x03) len 16
        Confim value: dab982dd0916526950cbf27e9306c441
< HCI Command: Host Number of Com.. (0x03|0x0035) plen 5  #217 [hci1] 15.419392
        Num handles: 1
        Handle: 1191 Address: DF:A9:FF:F6:B1:1A (OUI DF-A9-FF)
        Count: 1
< ACL Data TX: Handle 1191 flags 0x00 dlen 21             #218 [hci1] 15.419546
      SMP: Pairing Confirm (0x03) len 16
        Confim value: a0997d940028077df155d529e37c0b39
> HCI Event: Number of Completed Packets (0x13) plen 5    #219 [hci1] 15.586048
        Num handles: 1
        Handle: 1191 Address: DF:A9:FF:F6:B1:1A (OUI DF-A9-FF)
        Count: 1
        #218: len 21 (1 Kb/s)
        Latency: 166 msec (73-173 msec ~166 msec)
> ACL Data RX: Handle 1191 flags 0x02 dlen 21             #220 [hci1] 15.586390
      SMP: Pairing Random (0x04) len 16
        Random value: 0b7c454e2fe5d16b0000000000000000
< HCI Command: Host Number of Com.. (0x03|0x0035) plen 5  #221 [hci1] 15.599808
        Num handles: 1
        Handle: 1191 Address: DF:A9:FF:F6:B1:1A (OUI DF-A9-FF)
        Count: 1
< ACL Data TX: Handle 1191 flags 0x00 dlen 21             #222 [hci1] 15.599892
      SMP: Pairing Random (0x04) len 16
        Random value: e7f7e0c2476823e41736a7e381bafb7c
> HCI Event: Number of Completed Packets (0x13) plen 5    #223 [hci1] 15.760696
        Num handles: 1
        Handle: 1191 Address: DF:A9:FF:F6:B1:1A (OUI DF-A9-FF)
        Count: 1
        #222: len 21 (1 Kb/s)
        Latency: 160 msec (73-173 msec ~163 msec)
> ACL Data RX: Handle 1191 flags 0x02 dlen 21             #224 [hci1] 15.848643
      SMP: Pairing Confirm (0x03) len 16
        Confim value: 3f423e66f55ceb253c0d307110bdca04
< HCI Command: Host Number of Com.. (0x03|0x0035) plen 5  #225 [hci1] 15.859516
        Num handles: 1
        Handle: 1191 Address: DF:A9:FF:F6:B1:1A (OUI DF-A9-FF)
        Count: 1
< ACL Data TX: Handle 1191 flags 0x00 dlen 21             #226 [hci1] 15.859627
      SMP: Pairing Confirm (0x03) len 16
        Confim value: 377d823144e53eca4d5299e67fc64b67
> HCI Event: Number of Completed Packets (0x13) plen 5    #227 [hci1] 16.023607
        Num handles: 1
        Handle: 1191 Address: DF:A9:FF:F6:B1:1A (OUI DF-A9-FF)
        Count: 1
        #226: len 21 (1 Kb/s)
        Latency: 163 msec (73-173 msec ~163 msec)
> ACL Data RX: Handle 1191 flags 0x02 dlen 21             #228 [hci1] 16.023830
      SMP: Pairing Random (0x04) len 16
        Random value: 85130cb83402e2260000000000000000
