Bluetooth monitor ver 5.72
= Note: Linux version 6.14.0-36-generic (x86_64)                       0.885037
= Note: Bluetooth subsystem version 2.22                               0.885039
= New Index: 00:00:00:00:00:00 (Primary,UART,hci1)              [hci1] 0.885040
= New Index: 48:5F:99:8E:E0:64 (Primary,USB,hci0)               [hci0] 0.885040
= Open Index: 00:00:00:00:00:00                                 [hci1] 1.398187
= Index Info: 00:00:00:00:00:00 (Nordic Semiconductor ASA)      [hci1] 1.398192
@ USER Open: main (privileged) version 2.22            {0x0001} [hci1] 1.398195
< HCI Command: Reset (0x03|0x0003) plen 0                    #1 [hci1] 1.398626
> HCI Event: Command Complete (0x0e) plen 4                  #2 [hci1] 1.399099
      Reset (0x03|0x0003) ncmd 1
        Status: Success (0x00)
< HCI Command: Read Local Supported... (0x04|0x0003) plen 0  #3 [hci1] 1.418169
> HCI Event: Command Complete (0x0e) plen 12                 #4 [hci1] 1.418693
      Read Local Supported Features (0x04|0x0003) ncmd 1
        Status: Success (0x00)
        Features: 0x00 0x00 0x00 0x00 0x60 0x00 0x00 0x00
          BR/EDR Not Supported
          LE Supported (Controller)
< HCI Command: Read Local Version In.. (0x04|0x0001) plen 0  #5 [hci1] 1.438162
> HCI Event: Command Complete (0x0e) plen 12                 #6 [hci1] 1.438687
      Read Local Version Information (0x04|0x0001) ncmd 1
        Status: Success (0x00)
        HCI version: Reserved (0x0f) - Revision 12393 (0x3069)
        LMP version: Reserved (0x0f) - Subversion 12393 (0x3069)
        Manufacturer: Nordic Semiconductor ASA (89)
< HCI Command: Read Local Supported... (0x04|0x0002) plen 0  #7 [hci1] 1.458133
> HCI Event: Command Complete (0x0e) plen 68                 #8 [hci1] 1.459204
      Read Local Supported Commands (0x04|0x0002) ncmd 1
        Status: Success (0x00)
        Commands: 119 entries
          Disconnect (Octet 0 - Bit 5)
          Read Remote Version Information (Octet 2 - Bit 7)
          Set Event Mask (Octet 5 - Bit 6)
          Reset (Octet 5 - Bit 7)
          Read Connection Accept Timeout (Octet 7 - Bit 2)
          Write Connection Accept Timeout (Octet 7 - Bit 3)
          Read Transmit Power Level (Octet 10 - Bit 2)
          Set Controller To Host Flow Control (Octet 10 - Bit 5)
          Host Buffer Size (Octet 10 - Bit 6)
          Host Number of Completed Packets (Octet 10 - Bit 7)
          Read Local Version Information (Octet 14 - Bit 3)
          Read Local Supported Features (Octet 14 - Bit 5)
          Read BD ADDR (Octet 15 - Bit 1)
          Read RSSI (Octet 15 - Bit 5)
          Set Event Mask Page 2 (Octet 22 - Bit 2)
          LE Set Event Mask (Octet 25 - Bit 0)
          LE Read Buffer Size (Octet 25 - Bit 1)
          LE Read Local Supported Features (Octet 25 - Bit 2)
          LE Set Random Address (Octet 25 - Bit 4)
          LE Set Advertising Parameters (Octet 25 - Bit 5)
          LE Read Advertising Channel TX Power (Octet 25 - Bit 6)
          LE Set Advertising Data (Octet 25 - Bit 7)
          LE Set Scan Response Data (Octet 26 - Bit 0)
          LE Set Advertise Enable (Octet 26 - Bit 1)
          LE Set Scan Parameters (Octet 26 - Bit 2)
          LE Set Scan Enable (Octet 26 - Bit 3)
          LE Create Connection (Octet 26 - Bit 4)
          LE Create Connection Cancel (Octet 26 - Bit 5)
          LE Read Accept List Size (Octet 26 - Bit 6)
          LE Clear Accept List (Octet 26 - Bit 7)
          LE Add Device To Accept List (Octet 27 - Bit 0)
          LE Remove Device From Accept List (Octet 27 - Bit 1)
          LE Connection Update (Octet 27 - Bit 2)
          LE Set Host Channel Classification (Octet 27 - Bit 3)
          LE Read Channel Map (Octet 27 - Bit 4)
          LE Read Remote Used Features (Octet 27 - Bit 5)
          LE Encrypt (Octet 27 - Bit 6)
          LE Rand (Octet 27 - Bit 7)
          LE Start Encryption (Octet 28 - Bit 0)
          LE Long Term Key Request Reply (Octet 28 - Bit 1)
          LE Long Term Key Request Neg Reply (Octet 28 - Bit 2)
          LE Read Supported States (Octet 28 - Bit 3)
          LE Receiver Test (Octet 28 - Bit 4)
          LE Transmitter Test (Octet 28 - Bit 5)
          LE Test End (Octet 28 - Bit 6)
          Read Authenticated Payload Timeout (Octet 32 - Bit 4)
          Write Authenticated Payload Timeout (Octet 32 - Bit 5)
          LE Set Data Length (Octet 33 - Bit 6)
          LE Read Suggested Default Data Length (Octet 33 - Bit 7)
          LE Write Suggested Default Data Length (Octet 34 - Bit 0)
          LE Add Device To Resolving List (Octet 34 - Bit 3)
          LE Remove Device From Resolving List (Octet 34 - Bit 4)
          LE Clear Resolving List (Octet 34 - Bit 5)
          LE Read Resolving List Size (Octet 34 - Bit 6)
          LE Set Address Resolution Enable (Octet 35 - Bit 1)
          LE Set Resolvable Private Address Timeout (Octet 35 - Bit 2)
          LE Read Maximum Data Length (Octet 35 - Bit 3)
          LE Read PHY (Octet 35 - Bit 4)
          LE Set Default PHY (Octet 35 - Bit 5)
          LE Set PHY (Octet 35 - Bit 6)
          LE Enhanced Receiver Test (Octet 35 - Bit 7)
          LE Enhanced Transmitter Test (Octet 36 - Bit 0)
          LE Set Advertising Set Random Address (Octet 36 - Bit 1)
          LE Set Extended Advertising Parameters (Octet 36 - Bit 2)
          LE Set Extended Advertising Data (Octet 36 - Bit 3)
          LE Set Extended Scan Response Data (Octet 36 - Bit 4)
          LE Set Extended Advertising Enable (Octet 36 - Bit 5)
          LE Read Maximum Advertising Data Length (Octet 36 - Bit 6)
          LE Read Number of Supported Advertising Sets (Octet 36 - Bit 7)
          LE Remove Advertising Set (Octet 37 - Bit 0)
          LE Clear Advertising Sets (Octet 37 - Bit 1)
          LE Set Periodic Advertising Parameters (Octet 37 - Bit 2)
          LE Set Periodic Advertising Data (Octet 37 - Bit 3)
          LE Set Periodic Advertising Enable (Octet 37 - Bit 4)
          LE Set Extended Scan Parameters (Octet 37 - Bit 5)
          LE Set Extended Scan Enable (Octet 37 - Bit 6)
          LE Extended Create Connection (Octet 37 - Bit 7)
          LE Periodic Advertising Create Sync (Octet 38 - Bit 0)
          LE Periodic Advertising Create Sync Cancel (Octet 38 - Bit 1)
          LE Periodic Advertising Terminate Sync (Octet 38 - Bit 2)
          LE Add Device To Periodic Advertiser List (Octet 38 - Bit 3)
          LE Remove Device From Periodic Advertiser List (Octet 38 - Bit 4)
          LE Clear Periodic Advertiser List (Octet 38 - Bit 5)
          LE Read Periodic Advertiser List Size (Octet 38 - Bit 6)
          LE Read Transmit Power (Octet 38 - Bit 7)
          LE Read RF Path Compensation (Octet 39 - Bit 0)
          LE Write RF Path Compensation (Octet 39 - Bit 1)
          LE Set Privacy Mode (Octet 39 - Bit 2)
          LE Periodic Advertising Receive Enable (Octet 40 - Bit 5)
          LE Periodic Advertising Sync Transfer (Octet 40 - Bit 6)
          LE Periodic Advertising Set Info Transfer (Octet 40 - Bit 7)
          LE Periodic Advertising Sync Transfer Parameters (Octet 41 - Bit 0)
          LE Set Default Periodic Advertisng Sync Transfer Parameters (Octet 41 - Bit 1)
          LE Read Buffer v2 (Octet 41 - Bit 5)
          LE Read ISO TX Sync (Octet 41 - Bit 6)
          LE Set Connected Isochronous Group Parameters (Octet 41 - Bit 7)
          LE Set Connected Isochronous Group Parameters Test (Octet 42 - Bit 0)
          LE Create Connected Isochronous Stream (Octet 42 - Bit 1)
          LE Remove Connected Isochronous Group (Octet 42 - Bit 2)
          LE Accept Connected Isochronous Stream Request (Octet 42 - Bit 3)
          LE Reject Connected Isochronous Stream Request (Octet 42 - Bit 4)
          LE Create Broadcast Isochronous Group (Octet 42 - Bit 5)
          LE Create Broadcast Isochronous Group Test (Octet 42 - Bit 6)
          LE Terminate Broadcast Isochronous Group (Octet 42 - Bit 7)
          LE Broadcast Isochronous Group Create Sync (Octet 43 - Bit 0)
          LE Broadcast Isochronous Group Terminate Sync (Octet 43 - Bit 1)
          LE Request Peer SCA (Octet 43 - Bit 2)
          LE Setup Isochronous Data Path (Octet 43 - Bit 3)
          LE Remove Isochronous Data Path (Octet 43 - Bit 4)
          LE Isochronous Transmit Test (Octet 43 - Bit 5)
          LE Isochronous Receive Test (Octet 43 - Bit 6)
          LE Isochronous Read Test Counters (Octet 43 - Bit 7)
          LE Isochronous Read Test Counters (Octet 44 - Bit 0)
          LE Set Host Feature (Octet 44 - Bit 1)
          Octet 44 - Bit 2 
          Octet 45 - Bit 6 
          Octet 46 - Bit 0 
          Octet 46 - Bit 1 
          Octet 46 - Bit 2 
< HCI Command: Host Buffer Size (0x03|0x0033) plen 7         #9 [hci1] 1.478164
        ACL MTU: 255  ACL max packet: 16
        SCO MTU: 0    SCO max packet: 0
> HCI Event: Command Complete (0x0e) plen 4                 #10 [hci1] 1.478666
      Host Buffer Size (0x03|0x0033) ncmd 1
        Status: Success (0x00)
< HCI Command: Set Controller To Ho.. (0x03|0x0031) plen 1  #11 [hci1] 1.498160
        Flow control: ACL Data Packets (0x01)
> HCI Event: Command Complete (0x0e) plen 4                 #12 [hci1] 1.498581
      Set Controller To Host Flow Control (0x03|0x0031) ncmd 1
        Status: Success (0x00)
< HCI Command: LE Read Local Suppor.. (0x08|0x0003) plen 0  #13 [hci1] 1.518167
> HCI Event: Command Complete (0x0e) plen 12                #14 [hci1] 1.518664
      LE Read Local Supported Features (0x08|0x0003) ncmd 1
        Status: Success (0x00)
        Features: 0xfd 0x79 0x00 0xf7 0x30 0x01 0x00 0x00
          LE Encryption
          Extended Reject Indication
          Peripheral-initiated Features Exchange
          LE Ping
          LE Data Packet Length Extension
          LL Privacy
          Extended Scanner Filter Policies
          LE 2M PHY
          LE Coded PHY
          LE Extended Advertising
          LE Periodic Advertising
          Channel Selection Algorithm #2
          Periodic Advertising Sync Transfer - Sender
          Periodic Advertising Sync Transfer - Recipient
          Sleep Clock Accuracy Updates
          Connected Isochronous Stream - Central
          Connected Isochronous Stream - Peripheral
          Isochronous Broadcaster
          Synchronized Receiver
          Periodic Advertising ADI support
          Connection Subrating
          Unknown features (0x0000010000000000)
< HCI Command: LE Set Host Feature (0x08|0x0074) plen 2     #15 [hci1] 1.538168
        Bit Number: 32
          Connected Isochronous Stream (Host Support)
        Bit Value: 1
> HCI Event: Command Complete (0x0e) plen 4                 #16 [hci1] 1.538694
      LE Set Host Feature (0x08|0x0074) ncmd 1
        Status: Success (0x00)
< HCI Command: LE Read Buffer v2 (0x08|0x0060) plen 0       #17 [hci1] 1.558176
> HCI Event: Command Complete (0x0e) plen 10                #18 [hci1] 1.558689
      LE Read Buffer v2 (0x08|0x0060) ncmd 1
        Status: Success (0x00)
        ACL MTU: 27
        ACL max packet: 3
        ISO MTU: 318
        ISO max packet: 3
< HCI Command: LE Read Maximum Adve.. (0x08|0x003a) plen 0  #19 [hci1] 1.578156
> HCI Event: Command Complete (0x0e) plen 6                 #20 [hci1] 1.578583
      LE Read Maximum Advertising Data Length (0x08|0x003a) ncmd 1
        Status: Success (0x00)
        Max length: 1650
< HCI Command: LE Read Supported St.. (0x08|0x001c) plen 0  #21 [hci1] 1.598167
> HCI Event: Command Complete (0x0e) plen 12                #22 [hci1] 1.598673
      LE Read Supported States (0x08|0x001c) ncmd 1
        Status: Success (0x00)
        States: 0x000003ff3e0306ff
          Non-connectable Advertising State
          Scannable Advertising State
          Connectable Advertising State
          High Duty Cycle Directed Advertising State
          Passive Scanning State
          Active Scanning State
          Initiating State
            and Connection State (Central Role)
          Connection State (Peripheral Role)
          Scannable Advertising State
            and Passive Scanning State
          Connectable Advertising State
            and Passive Scanning State
          Non-connectable Advertising State
            and Initiating State
          Scannable Advertising State
            and Initiating State
          Active Scanning State
            and Connection State (Central Role)
          Passive Scanning State
            and Connection State (Peripheral Role)
          Active Scanning State
            and Connection State (Peripheral Role)
          Initiating State
            and Connection State (Central Role)
            and Central Role & Central Role
          Low Duty Cycle Directed Advertising State
          Connectable Advertising State
            and Initiating State
            and Central Role & Peripheral Role
          High Duty Cycle Directed Advertising State
            and Initiating State
            and Central Role & Peripheral Role
          Low Duty Cycle Directed Advertising State
            and Initiating State
            and Central Role & Peripheral Role
          Connectable Advertising State
            and Connection State (Central Role)
            and Central Role & Peripheral Role
          High Duty Cycle Directed Advertising State
            and Connection State (Central Role)
            and Central Role & Peripheral Role
          Low Duty Cycle Directed Advertising State
            and Connection State (Central Role)
            and Central Role & Peripheral Role
          Connectable Advertising State
            and Connection State (Peripheral Role)
            and Central Role & Peripheral Role
          High Duty Cycle Directed Advertising State
            and Connection State (Peripheral Role)
            and Peripheral Role & Peripheral Role
          Low Duty Cycle Directed Advertising State
            and Connection State (Peripheral Role)
            and Peripheral Role & Peripheral Role
          Initiating State
            and Connection State (Peripheral Role)
            and Central Role & Peripheral Role
< HCI Command: LE Read Maximum Data.. (0x08|0x002f) plen 0  #23 [hci1] 1.618161
> HCI Event: Command Complete (0x0e) plen 12                #24 [hci1] 1.618677
      LE Read Maximum Data Length (0x08|0x002f) ncmd 1
        Status: Success (0x00)
        Max TX octets: 251
        Max TX time: 2704
        Max RX octets: 251
        Max RX time: 2704
< HCI Command: LE Write Suggested D.. (0x08|0x0024) plen 4  #25 [hci1] 1.638177
        TX octets: 251
        TX time: 2704
> HCI Event: Command Complete (0x0e) plen 4                 #26 [hci1] 1.638691
      LE Write Suggested Default Data Length (0x08|0x0024) ncmd 1
        Status: Success (0x00)
< HCI Command: LE Read Resolving Li.. (0x08|0x002a) plen 0  #27 [hci1] 1.658176
> HCI Event: Command Complete (0x0e) plen 5                 #28 [hci1] 1.658620
      LE Read Resolving List Size (0x08|0x002a) ncmd 1
        Status: Success (0x00)
        Size: 8
< HCI Command: LE Set Event Mask (0x08|0x0001) plen 8       #29 [hci1] 1.678158
        Mask: 0x000002023f87fa5e
          LE Advertising Report
          LE Connection Update Complete
          LE Read Remote Used Features Complete
          LE Long Term Key Request
          LE Data Length Change
          LE Enhanced Connection Complete
          LE PHY Update Complete
          LE Extended Advertising Report
          LE Periodic Advertising Sync Established
          LE Periodic Advertising Report
          LE Periodic Advertising Sync Lost
          LE Extended Scan Timeout
          LE Extended Advertising Set Terminated
          LE Scan Request Received
          LE Periodic Advertising Sync Transfer Rvc
          LE CIS Established
          LE CIS Request
          LE Create BIG Complete
          LE Terminate BIG Complete
          LE BIG Sync Estabilished Complete
          LE BIG Sync Lost
          LE BIG Info Advertising Report
          Unknown mask (0x0000020000000000)
> HCI Event: Command Complete (0x0e) plen 4                 #30 [hci1] 1.678624
      LE Set Event Mask (0x08|0x0001) ncmd 1
        Status: Success (0x00)
< HCI Command: Set Event Mask (0x03|0x0001) plen 8          #31 [hci1] 1.698180
        Mask: 0x2000800002008890
          Disconnection Complete
          Encryption Change
          Read Remote Version Information Complete
          Hardware Error
          Data Buffer Overflow
          Encryption Key Refresh Complete
          LE Meta
> HCI Event: Command Complete (0x0e) plen 4                 #32 [hci1] 1.698632
      Set Event Mask (0x03|0x0001) ncmd 1
        Status: Success (0x00)
< HCI Command: Read BD ADDR (0x04|0x0009) plen 0            #33 [hci1] 1.718175
> HCI Event: Command Complete (0x0e) plen 10                #34 [hci1] 1.718656
      Read BD ADDR (0x04|0x0009) ncmd 1
        Status: Success (0x00)
        Address: 00:00:00:00:00:00 (OUI 00-00-00)
< HCI Command: LE Set Random Address (0x08|0x0005) plen 6   #35 [hci1] 1.738185
        Address: D5:B6:CC:31:DB:3B (Static)
> HCI Event: Command Complete (0x0e) plen 4                 #36 [hci1] 1.738669
      LE Set Random Address (0x08|0x0005) ncmd 1
        Status: Success (0x00)
< HCI Command: LE Set Extended Adv.. (0x08|0x0036) plen 25  #37 [hci1] 4.328903
        Handle: 0x00
        Properties: 0x0013
          Connectable
          Scannable
          Use legacy advertising PDUs: ADV_IND
        Min advertising interval: 100.000 msec (0x00a0)
        Max advertising interval: 150.000 msec (0x00f0)
        Channel map: 37, 38, 39 (0x07)
        Own address type: Random (0x01)
        Peer address type: Public (0x00)
        Peer address: 00:00:00:00:00:00 (OUI 00-00-00)
        Filter policy: Allow Scan Request from Any, Allow Connect Request from Any (0x00)
        TX power: Host has no preference (0x7f)
        Primary PHY: LE 1M (0x01)
        Secondary max skip: 0x00
        Secondary PHY: LE 1M (0x01)
        SID: 0x00
        Scan request notifications: Disabled (0x00)
> HCI Event: Command Complete (0x0e) plen 5                 #38 [hci1] 4.329714
      LE Set Extended Advertising Parameters (0x08|0x0036) ncmd 1
        Status: Success (0x00)
        TX power (selected): 0 dbm (0x00)
< HCI Command: LE Set Advertising S.. (0x08|0x0035) plen 7  #39 [hci1] 4.338614
        Advertising handle: 0x00
        Advertising random address: D5:B6:CC:31:DB:3B (Static)
> HCI Event: Command Complete (0x0e) plen 4                 #40 [hci1] 4.339222
      LE Set Advertising Set Random Address (0x08|0x0035) ncmd 1
        Status: Success (0x00)
< HCI Command: LE Set Extended Adv.. (0x08|0x0037) plen 22  #41 [hci1] 4.358308
        Handle: 0x00
        Operation: Complete extended advertising data (0x03)
        Fragment preference: Minimize fragmentation (0x01)
        Data length: 0x12
        Flags: 0x06
          LE General Discoverable Mode
          BR/EDR Not Supported
        Name (complete): Tester_F6B11A
> HCI Event: Command Complete (0x0e) plen 4                 #42 [hci1] 4.358992
      LE Set Extended Advertising Data (0x08|0x0037) ncmd 1
        Status: Success (0x00)
< HCI Command: LE Set Extended Scan.. (0x08|0x0038) plen 4  #43 [hci1] 4.378196
        Handle: 0x00
        Operation: Complete scan response data (0x03)
        Fragment preference: Minimize fragmentation (0x01)
        Data length: 0x00
> HCI Event: Command Complete (0x0e) plen 4                 #44 [hci1] 4.378706
      LE Set Extended Scan Response Data (0x08|0x0038) ncmd 1
        Status: Success (0x00)
< HCI Command: LE Set Extended Adve.. (0x08|0x0039) plen 6  #45 [hci1] 4.398207
        Extended advertising: Enabled (0x01)
        Number of sets: 1 (0x01)
        Entry 0
          Handle: 0x00
          Duration: 0 ms (0x00)
          Max ext adv events: 0
> HCI Event: Command Complete (0x0e) plen 4                 #46 [hci1] 4.398783
      LE Set Extended Advertising Enable (0x08|0x0039) ncmd 1
        Status: Success (0x00)
> HCI Event: LE Meta Event (0x3e) plen 31                   #47 [hci1] 4.510906
      LE Enhanced Connection Complete (0x0a)
        Status: Success (0x00)
        Handle: 345
        Role: Peripheral (0x01)
        Peer address type: Public (0x00)
        Peer address: DF:A9:FF:F6:B1:1A (OUI DF-A9-FF)
        Local resolvable private address: 00:00:00:00:00:00 (Non-Resolvable)
        Peer resolvable private address: 00:00:00:00:00:00 (Non-Resolvable)
        Connection interval: 87.50 msec (0x0046)
        Connection latency: 0 (0x0000)
        Supervision timeout: 25120 msec (0x09d0)
        Central clock accuracy: 0x01
> HCI Event: LE Meta Event (0x3e) plen 6                    #48 [hci1] 4.510933
      LE Advertising Set Terminated (0x12)
        Status: Success (0x00)
        Handle: 0
        Connection handle: 345
        Number of completed extended advertising events: 0
< HCI Command: LE Read Remote Used... (0x08|0x0016) plen 2  #49 [hci1] 4.519406
        Handle: 345 Address: DF:A9:FF:F6:B1:1A (OUI DF-A9-FF)
< ACL Data TX: Handle 345 flags 0x00 dlen 7                 #50 [hci1] 4.519468
      ATT: Exchange MTU Request (0x02) len 2
        Client RX MTU: 251
> HCI Event: Command Status (0x0f) plen 4                   #51 [hci1] 4.520069
      LE Read Remote Used Features (0x08|0x0016) ncmd 1
        Status: Success (0x00)
> HCI Event: Number of Completed Packets (0x13) plen 5      #52 [hci1] 4.686877
        Num handles: 1
        Handle: 345 Address: DF:A9:FF:F6:B1:1A (OUI DF-A9-FF)
        Count: 1
        #50: len 7 (0 Kb/s)
        Latency: 167 msec (167-167 msec ~167 msec)
> HCI Event: LE Meta Event (0x3e) plen 12                   #53 [hci1] 4.774762
      LE Read Remote Used Features (0x04)
        Status: Success (0x00)
        Handle: 345 Address: DF:A9:FF:F6:B1:1A (OUI DF-A9-FF)
        Features: 0x2d 0x49 0x00 0xf7 0x67 0xd8 0x00 0x00
          LE Encryption
          Extended Reject Indication
          Peripheral-initiated Features Exchange
          LE Data Packet Length Extension
          LE 2M PHY
          LE Coded PHY
          Channel Selection Algorithm #2
          Periodic Advertising Sync Transfer - Sender
          Periodic Advertising Sync Transfer - Recipient
          Sleep Clock Accuracy Updates
          Connected Isochronous Stream - Central
          Connected Isochronous Stream - Peripheral
          Isochronous Broadcaster
          Synchronized Receiver
          Connected Isochronous Stream (Host Support)
          LE Power Control Request
          LE Power Control Request
          Connection Subrating
          Connection Subrating (Host Support)
          Unknown features (0x0000d80000000000)
> ACL Data RX: Handle 345 flags 0x02 dlen 11                #54 [hci1] 7.224387
      SMP: Pairing Request (0x01) len 6
        IO capability: KeyboardDisplay (0x04)
        OOB data: Authentication data not present (0x00)
        Authentication requirement: Bonding, MITM, SC, No Keypresses (0x0d)
        Max encryption key size: 16
        Initiator key distribution: EncKey IdKey (0x03)
        Responder key distribution: EncKey IdKey Sign (0x07)
> ACL Data RX: Handle 345 flags 0x02 dlen 7                 #55 [hci1] 7.224900
      ATT: Exchange MTU Response (0x03) len 2
        Server RX MTU: 23
< HCI Command: Host Number of Compl.. (0x03|0x0035) plen 5  #56 [hci1] 7.238384
        Num handles: 1
        Handle: 345 Address: DF:A9:FF:F6:B1:1A (OUI DF-A9-FF)
        Count: 1
< ACL Data TX: Handle 345 flags 0x00 dlen 11                #57 [hci1] 7.238554
      SMP: Pairing Response (0x02) len 6
        IO capability: DisplayOnly (0x00)
        OOB data: Authentication data not present (0x00)
        Authentication requirement: Bonding, No MITM, SC, No Keypresses (0x09)
        Max encryption key size: 16
        Initiator key distribution: IdKey (0x02)
        Responder key distribution: <none> (0x00)
< HCI Command: Host Number of Compl.. (0x03|0x0035) plen 5  #58 [hci1] 7.238651
        Num handles: 1
        Handle: 345 Address: DF:A9:FF:F6:B1:1A (OUI DF-A9-FF)
        Count: 1
> HCI Event: Number of Completed Packets (0x13) plen 5      #59 [hci1] 7.399579
        Num handles: 1
        Handle: 345 Address: DF:A9:FF:F6:B1:1A (OUI DF-A9-FF)
        Count: 1
        #57: len 11 (0 Kb/s)
        Latency: 161 msec (161-167 msec ~164 msec)
> ACL Data RX: Handle 345 flags 0x02 dlen 27                #60 [hci1] 7.399843
> ACL Data RX: Handle 345 flags 0x01 dlen 27                #61 [hci1] 7.400326
> ACL Data RX: Handle 345 flags 0x01 dlen 15                #62 [hci1] 7.400774
      SMP: Pairing Public Key (0x0c) len 64
        X: 057901c72aeb28727ca47871300bc6fa8a445b2fd8e2a27a7c1a58a3458d8fc6
        Y: 5de3423c5784d3c500324f5d5e60327de38f3370b7fab0c8fc44c3cd80d29495
< HCI Command: Host Number of Compl.. (0x03|0x0035) plen 5  #63 [hci1] 7.418828
        Num handles: 1
        Handle: 345 Address: DF:A9:FF:F6:B1:1A (OUI DF-A9-FF)
        Count: 1
< HCI Command: Host Number of Compl.. (0x03|0x0035) plen 5  #64 [hci1] 7.418964
        Num handles: 1
        Handle: 345 Address: DF:A9:FF:F6:B1:1A (OUI DF-A9-FF)
        Count: 1
< HCI Command: Host Number of Compl.. (0x03|0x0035) plen 5  #65 [hci1] 7.419196
        Num handles: 1
        Handle: 345 Address: DF:A9:FF:F6:B1:1A (OUI DF-A9-FF)
        Count: 1
< ACL Data TX: Handle 345 flags 0x00 dlen 27                #66 [hci1] 7.419243
< ACL Data TX: Handle 345 flags 0x01 dlen 27                #67 [hci1] 7.419258
< ACL Data TX: Handle 345 flags 0x01 dlen 15                #68 [hci1] 7.419274
      SMP: Pairing Public Key (0x0c) len 64
        X: 98308440221e2d910f0e54b71e7ec652857aa9b5a0dc65028824cc19db1226e9
        Y: 67a4816bcb62efb21701e31fdb27561a6217575fb007a8bbdabe7e28b6f68482
> HCI Event: Number of Completed Packets (0x13) plen 5      #69 [hci1] 7.487427
        Num handles: 1
        Handle: 345 Address: DF:A9:FF:F6:B1:1A (OUI DF-A9-FF)
        Count: 1
        #66: len 27 (3 Kb/s)
        Latency: 68 msec (68-167 msec ~116 msec)
> HCI Event: Number of Completed Packets (0x13) plen 5      #70 [hci1] 7.488097
        Num handles: 1
        Handle: 345 Address: DF:A9:FF:F6:B1:1A (OUI DF-A9-FF)
        Count: 1
        #67: len 27 (3 Kb/s)
        Latency: 68 msec (68-167 msec ~92 msec)
> HCI Event: Number of Completed Packets (0x13) plen 5      #71 [hci1] 7.574217
        Num handles: 1
        Handle: 345 Address: DF:A9:FF:F6:B1:1A (OUI DF-A9-FF)
        Count: 1
        #68: len 15 (0 Kb/s)
        Latency: 154 msec (68-167 msec ~123 msec)
> ACL Data RX: Handle 345 flags 0x02 dlen 21                #72 [hci1] 8.537110
      SMP: Pairing Confirm (0x03) len 16
        Confim value: eeeb6a1e0e466e23263ea785d5a22cdc
< HCI Command: Host Number of Compl.. (0x03|0x0035) plen 5  #73 [hci1] 8.538652
        Num handles: 1
        Handle: 345 Address: DF:A9:FF:F6:B1:1A (OUI DF-A9-FF)
        Count: 1
< ACL Data TX: Handle 345 flags 0x00 dlen 21                #74 [hci1] 8.538842
      SMP: Pairing Confirm (0x03) len 16
        Confim value: 016b42f47f29a8bf097e4a3b8df919f4
> HCI Event: Number of Completed Packets (0x13) plen 5      #75 [hci1] 8.711997
        Num handles: 1
        Handle: 345 Address: DF:A9:FF:F6:B1:1A (OUI DF-A9-FF)
        Count: 1
        #74: len 21 (0 Kb/s)
        Latency: 173 msec (68-173 msec ~148 msec)
> ACL Data RX: Handle 345 flags 0x02 dlen 21                #76 [hci1] 8.712228
      SMP: Pairing Random (0x04) len 16
        Random value: 094cdfab2bff5d8a0000000000000000
< HCI Command: Host Number of Compl.. (0x03|0x0035) plen 5  #77 [hci1] 8.719181
        Num handles: 1
        Handle: 345 Address: DF:A9:FF:F6:B1:1A (OUI DF-A9-FF)
        Count: 1
< ACL Data TX: Handle 345 flags 0x00 dlen 21                #78 [hci1] 8.719308
      SMP: Pairing Random (0x04) len 16
        Random value: 8e6108f966a694cbe26df70bb96773e6
> HCI Event: Number of Completed Packets (0x13) plen 5      #79 [hci1] 8.886689
        Num handles: 1
        Handle: 345 Address: DF:A9:FF:F6:B1:1A (OUI DF-A9-FF)
        Count: 1
        #78: len 21 (1 Kb/s)
        Latency: 167 msec (68-173 msec ~157 msec)
> ACL Data RX: Handle 345 flags 0x02 dlen 21                #80 [hci1] 8.974537
      SMP: Pairing Confirm (0x03) len 16
        Confim value: e76708c10bb2a3518f7b04b14626c57f
< HCI Command: Host Number of Compl.. (0x03|0x0035) plen 5  #81 [hci1] 8.978832
        Num handles: 1
        Handle: 345 Address: DF:A9:FF:F6:B1:1A (OUI DF-A9-FF)
        Count: 1
< ACL Data TX: Handle 345 flags 0x00 dlen 21                #82 [hci1] 8.979064
      SMP: Pairing Confirm (0x03) len 16
        Confim value: 002f92d36424ce3965fd12c65234d149
> HCI Event: Number of Completed Packets (0x13) plen 5      #83 [hci1] 9.149438
        Num handles: 1
        Handle: 345 Address: DF:A9:FF:F6:B1:1A (OUI DF-A9-FF)
        Count: 1
        #82: len 21 (0 Kb/s)
        Latency: 170 msec (68-173 msec ~164 msec)
> ACL Data RX: Handle 345 flags 0x02 dlen 21                #84 [hci1] 9.149764
      SMP: Pairing Random (0x04) len 16
        Random value: e6c976ec1a676ae00000000000000000
< HCI Command: Host Number of Compl.. (0x03|0x0035) plen 5  #85 [hci1] 9.159201
        Num handles: 1
        Handle: 345 Address: DF:A9:FF:F6:B1:1A (OUI DF-A9-FF)
        Count: 1
< ACL Data TX: Handle 345 flags 0x00 dlen 21                #86 [hci1] 9.159297
      SMP: Pairing Random (0x04) len 16
        Random value: 4d02679f89a05211af56d8b3da64d21e
> HCI Event: Number of Completed Packets (0x13) plen 5      #87 [hci1] 9.324229
        Num handles: 1
        Handle: 345 Address: DF:A9:FF:F6:B1:1A (OUI DF-A9-FF)
        Count: 1
        #86: len 21 (1 Kb/s)
        Latency: 164 msec (68-173 msec ~164 msec)
> ACL Data RX: Handle 345 flags 0x02 dlen 21                #88 [hci1] 9.412017
      SMP: Pairing Confirm (0x03) len 16
        Confim value: bd864e598bca38490e85d1f9f1439207
< HCI Command: Host Number of Compl.. (0x03|0x0035) plen 5  #89 [hci1] 9.418647
        Num handles: 1
        Handle: 345 Address: DF:A9:FF:F6:B1:1A (OUI DF-A9-FF)
        Count: 1
< ACL Data TX: Handle 345 flags 0x00 dlen 21                #90 [hci1] 9.418785
      SMP: Pairing Confirm (0x03) len 16
        Confim value: 8235f3ce14365f9bee7a1ba7df58d053
> HCI Event: Number of Completed Packets (0x13) plen 5      #91 [hci1] 9.587013
        Num handles: 1
        Handle: 345 Address: DF:A9:FF:F6:B1:1A (OUI DF-A9-FF)
        Count: 1
        #90: len 21 (1 Kb/s)
        Latency: 168 msec (68-173 msec ~166 msec)
> ACL Data RX: Handle 345 flags 0x02 dlen 21                #92 [hci1] 9.587250
      SMP: Pairing Random (0x04) len 16
        Random value: 7ea6b3948017d2770000000000000000
< HCI Command: Host Number of Compl.. (0x03|0x0035) plen 5  #93 [hci1] 9.598971
        Num handles: 1
        Handle: 345 Address: DF:A9:FF:F6:B1:1A (OUI DF-A9-FF)
        Count: 1
< ACL Data TX: Handle 345 flags 0x00 dlen 21                #94 [hci1] 9.599143
      SMP: Pairing Random (0x04) len 16
        Random value: 5e8286bc235a02440d0c3424a2acf8fd
> HCI Event: Number of Completed Packets (0x13) plen 5      #95 [hci1] 9.761620
        Num handles: 1
        Handle: 345 Address: DF:A9:FF:F6:B1:1A (OUI DF-A9-FF)
        Count: 1
        #94: len 21 (1 Kb/s)
        Latency: 162 msec (68-173 msec ~164 msec)
> ACL Data RX: Handle 345 flags 0x02 dlen 21                #96 [hci1] 9.849593
      SMP: Pairing Confirm (0x03) len 16
        Confim value: 9d99c2c8674d7b2abe6a32a68d403dfb
< HCI Command: Host Number of Compl.. (0x03|0x0035) plen 5  #97 [hci1] 9.858931
        Num handles: 1
        Handle: 345 Address: DF:A9:FF:F6:B1:1A (OUI DF-A9-FF)
        Count: 1
< ACL Data TX: Handle 345 flags 0x00 dlen 21                #98 [hci1] 9.859206
      SMP: Pairing Confirm (0x03) len 16
        Confim value: 97b1a02ec1ed338c83d526d3d277c995
> HCI Event: Number of Completed Packets (0x13) plen 5     #99 [hci1] 10.024359
        Num handles: 1
        Handle: 345 Address: DF:A9:FF:F6:B1:1A (OUI DF-A9-FF)
        Count: 1
        #98: len 21 (1 Kb/s)
        Latency: 165 msec (68-173 msec ~164 msec)
> ACL Data RX: Handle 345 flags 0x02 dlen 21              #100 [hci1] 10.024864
      SMP: Pairing Random (0x04) len 16
        Random value: b223092ac00158a50000000000000000
< HCI Command: Host Number of Com.. (0x03|0x0035) plen 5  #101 [hci1] 10.039163
        Num handles: 1
        Handle: 345 Address: DF:A9:FF:F6:B1:1A (OUI DF-A9-FF)
        Count: 1
< ACL Data TX: Handle 345 flags 0x00 dlen 21              #102 [hci1] 10.039246
      SMP: Pairing Random (0x04) len 16
        Random value: 5c4a1bcadd27bd58e945097b00bad7ac
> HCI Event: Number of Completed Packets (0x13) plen 5    #103 [hci1] 10.199184
        Num handles: 1
        Handle: 345 Address: DF:A9:FF:F6:B1:1A (OUI DF-A9-FF)
        Count: 1
        #102: len 21 (1 Kb/s)
        Latency: 159 msec (68-173 msec ~162 msec)
> ACL Data RX: Handle 345 flags 0x02 dlen 21              #104 [hci1] 10.287060
      SMP: Pairing Confirm (0x03) len 16
        Confim value: c6dfa5f90a974a9c8a070545737ebad9
< HCI Command: Host Number of Com.. (0x03|0x0035) plen 5  #105 [hci1] 10.298692
        Num handles: 1
        Handle: 345 Address: DF:A9:FF:F6:B1:1A (OUI DF-A9-FF)
        Count: 1
< ACL Data TX: Handle 345 flags 0x00 dlen 21              #106 [hci1] 10.298850
      SMP: Pairing Confirm (0x03) len 16
        Confim value: d399ab7ce70f4610f1ae5a64370e1dfb
> HCI Event: Number of Completed Packets (0x13) plen 5    #107 [hci1] 10.461797
        Num handles: 1
        Handle: 345 Address: DF:A9:FF:F6:B1:1A (OUI DF-A9-FF)
        Count: 1
        #106: len 21 (1 Kb/s)
        Latency: 162 msec (68-173 msec ~162 msec)
> ACL Data RX: Handle 345 flags 0x02 dlen 21              #108 [hci1] 10.462182
      SMP: Pairing Random (0x04) len 16
        Random value: 16324904b1fa406e0000000000000000
< HCI Command: Host Number of Com.. (0x03|0x0035) plen 5  #109 [hci1] 10.478851
        Num handles: 1
        Handle: 345 Address: DF:A9:FF:F6:B1:1A (OUI DF-A9-FF)
        Count: 1
< ACL Data TX: Handle 345 flags 0x00 dlen 21              #110 [hci1] 10.479009
      SMP: Pairing Random (0x04) len 16
        Random value: 32527e6e64e79f33b2e374394db8ab2d
> HCI Event: Number of Completed Packets (0x13) plen 5    #111 [hci1] 10.636653
        Num handles: 1
        Handle: 345 Address: DF:A9:FF:F6:B1:1A (OUI DF-A9-FF)
        Count: 1
        #110: len 21 (1 Kb/s)
        Latency: 157 msec (68-173 msec ~160 msec)
> ACL Data RX: Handle 345 flags 0x02 dlen 21              #112 [hci1] 10.724472
      SMP: Pairing Confirm (0x03) len 16
        Confim value: 4ee863f33eba06e07c06a43fcd16bc48
< HCI Command: Host Number of Com.. (0x03|0x0035) plen 5  #113 [hci1] 10.738882
        Num handles: 1
        Handle: 345 Address: DF:A9:FF:F6:B1:1A (OUI DF-A9-FF)
        Count: 1
< ACL Data TX: Handle 345 flags 0x00 dlen 21              #114 [hci1] 10.739159
      SMP: Pairing Confirm (0x03) len 16
        Confim value: b0845aa41395a7505580ee4c694e9247
> HCI Event: Number of Completed Packets (0x13) plen 5    #115 [hci1] 10.899323
        Num handles: 1
        Handle: 345 Address: DF:A9:FF:F6:B1:1A (OUI DF-A9-FF)
        Count: 1
        #114: len 21 (1 Kb/s)
        Latency: 160 msec (68-173 msec ~160 msec)
> ACL Data RX: Handle 345 flags 0x02 dlen 21              #116 [hci1] 10.899692
      SMP: Pairing Random (0x04) len 16
        Random value: 48fd3ba9b17c03c40000000000000000
< HCI Command: Host Number of Com.. (0x03|0x0035) plen 5  #117 [hci1] 10.919088
        Num handles: 1
        Handle: 345 Address: DF:A9:FF:F6:B1:1A (OUI DF-A9-FF)
        Count: 1
< ACL Data TX: Handle 345 flags 0x00 dlen 21              #118 [hci1] 10.919204
      SMP: Pairing Random (0x04) len 16
        Random value: dddbdfe2838e9a8cc6964353c850fef7
> HCI Event: Number of Completed Packets (0x13) plen 5    #119 [hci1] 11.074125
        Num handles: 1
        Handle: 345 Address: DF:A9:FF:F6:B1:1A (OUI DF-A9-FF)
        Count: 1
        #118: len 21 (1 Kb/s)
        Latency: 154 msec (68-173 msec ~157 msec)
> ACL Data RX: Handle 345 flags 0x02 dlen 21              #120 [hci1] 11.162005
      SMP: Pairing Confirm (0x03) len 16
        Confim value: 29dce12db3574f51610112abbae76fdb
< HCI Command: Host Number of Com.. (0x03|0x0035) plen 5  #121 [hci1] 11.178929
        Num handles: 1
        Handle: 345 Address: DF:A9:FF:F6:B1:1A (OUI DF-A9-FF)
        Count: 1
< ACL Data TX: Handle 345 flags 0x00 dlen 21              #122 [hci1] 11.179146
      SMP: Pairing Confirm (0x03) len 16
        Confim value: bfd2739b7dbc30955a615295add7f355
> HCI Event: Number of Completed Packets (0x13) plen 5    #123 [hci1] 11.336899
        Num handles: 1
        Handle: 345 Address: DF:A9:FF:F6:B1:1A (OUI DF-A9-FF)
        Count: 1
        #122: len 21 (1 Kb/s)
        Latency: 157 msec (68-173 msec ~157 msec)
> ACL Data RX: Handle 345 flags 0x02 dlen 21              #124 [hci1] 11.337166
      SMP: Pairing Random (0x04) len 16
        Random value: 424d8d5e393b79170000000000000000
< HCI Command: Host Number of Com.. (0x03|0x0035) plen 5  #125 [hci1] 11.339077
        Num handles: 1
        Handle: 345 Address: DF:A9:FF:F6:B1:1A (OUI DF-A9-FF)
        Count: 1
< ACL Data TX: Handle 345 flags 0x00 dlen 21              #126 [hci1] 11.339203
      SMP: Pairing Random (0x04) len 16
        Random value: eb9f1915536596b6fc3db1c86b2b1970
> HCI Event: Number of Completed Packets (0x13) plen 5    #127 [hci1] 11.512350
        Num handles: 1
        Handle: 345 Address: DF:A9:FF:F6:B1:1A (OUI DF-A9-FF)
        Count: 1
        #126: len 21 (0 Kb/s)
        Latency: 173 msec (68-173 msec ~165 msec)
> ACL Data RX: Handle 345 flags 0x02 dlen 21              #128 [hci1] 11.599422
      SMP: Pairing Confirm (0x03) len 16
        Confim value: 83a741e2992af3e182ac131c1a4a29c0
< HCI Command: Host Number of Com.. (0x03|0x0035) plen 5  #129 [hci1] 11.618287
        Num handles: 1
        Handle: 345 Address: DF:A9:FF:F6:B1:1A (OUI DF-A9-FF)
        Count: 1
< ACL Data TX: Handle 345 flags 0x00 dlen 21              #130 [hci1] 11.618312
      SMP: Pairing Confirm (0x03) len 16
        Confim value: e1188bb4c4199f2eaeb4a524991c0058
> HCI Event: Number of Completed Packets (0x13) plen 5    #131 [hci1] 11.774334
        Num handles: 1
        Handle: 345 Address: DF:A9:FF:F6:B1:1A (OUI DF-A9-FF)
        Count: 1
        #130: len 21 (1 Kb/s)
        Latency: 156 msec (68-173 msec ~160 msec)
> ACL Data RX: Handle 345 flags 0x02 dlen 21              #132 [hci1] 11.774634
      SMP: Pairing Random (0x04) len 16
        Random value: 581e8bd49032b9090000000000000000
< HCI Command: Host Number of Com.. (0x03|0x0035) plen 5  #133 [hci1] 11.778408
        Num handles: 1
        Handle: 345 Address: DF:A9:FF:F6:B1:1A (OUI DF-A9-FF)
        Count: 1
< ACL Data TX: Handle 345 flags 0x00 dlen 21              #134 [hci1] 11.778419
      SMP: Pairing Random (0x04) len 16
        Random value: 5c794dc9ad9f2c3f295ebd5ad5e1c3cf
> HCI Event: Number of Completed Packets (0x13) plen 5    #135 [hci1] 11.949060
        Num handles: 1
        Handle: 345 Address: DF:A9:FF:F6:B1:1A (OUI DF-A9-FF)
        Count: 1
        #134: len 21 (0 Kb/s)
        Latency: 170 msec (68-173 msec ~165 msec)
> ACL Data RX: Handle 345 flags 0x02 dlen 21              #136 [hci1] 12.036904
      SMP: Pairing Confirm (0x03) len 16
        Confim value: c096c25e0e2464150aa302c96d3f402c
< HCI Command: Host Number of Com.. (0x03|0x0035) plen 5  #137 [hci1] 12.038282
        Num handles: 1
        Handle: 345 Address: DF:A9:FF:F6:B1:1A (OUI DF-A9-FF)
        Count: 1
< ACL Data TX: Handle 345 flags 0x00 dlen 21              #138 [hci1] 12.038373
      SMP: Pairing Confirm (0x03) len 16
        Confim value: 66cd1765e0269cd9266b3a43186ab042
> HCI Event: Number of Completed Packets (0x13) plen 5    #139 [hci1] 12.211874
        Num handles: 1
        Handle: 345 Address: DF:A9:FF:F6:B1:1A (OUI DF-A9-FF)
        Count: 1
        #138: len 21 (0 Kb/s)
        Latency: 173 msec (68-173 msec ~169 msec)
> ACL Data RX: Handle 345 flags 0x02 dlen 21              #140 [hci1] 12.212161
      SMP: Pairing Random (0x04) len 16
        Random value: f9046e40a4ce6da30000000000000000
< HCI Command: Host Number of Com.. (0x03|0x0035) plen 5  #141 [hci1] 12.219108
        Num handles: 1
        Handle: 345 Address: DF:A9:FF:F6:B1:1A (OUI DF-A9-FF)
        Count: 1
< ACL Data TX: Handle 345 flags 0x00 dlen 21              #142 [hci1] 12.219214
      SMP: Pairing Random (0x04) len 16
        Random value: 5c2fff312cdf99c9491988e877355a9a
> HCI Event: Number of Completed Packets (0x13) plen 5    #143 [hci1] 12.386601
        Num handles: 1
        Handle: 345 Address: DF:A9:FF:F6:B1:1A (OUI DF-A9-FF)
        Count: 1
        #142: len 21 (1 Kb/s)
        Latency: 167 msec (68-173 msec ~168 msec)
> ACL Data RX: Handle 345 flags 0x02 dlen 21              #144 [hci1] 12.474430
      SMP: Pairing Confirm (0x03) len 16
        Confim value: 7211de73f8fa69ac3bf334cfb06b7515
< HCI Command: Host Number of Com.. (0x03|0x0035) plen 5  #145 [hci1] 12.479067
        Num handles: 1
        Handle: 345 Address: DF:A9:FF:F6:B1:1A (OUI DF-A9-FF)
        Count: 1
< ACL Data TX: Handle 345 flags 0x00 dlen 21              #146 [hci1] 12.479291
      SMP: Pairing Confirm (0x03) len 16
        Confim value: 9ee3ccdff1463edc2e662de01424c3e7
> HCI Event: Number of Completed Packets (0x13) plen 5    #147 [hci1] 12.649323
        Num handles: 1
        Handle: 345 Address: DF:A9:FF:F6:B1:1A (OUI DF-A9-FF)
        Count: 1
        #146: len 21 (0 Kb/s)
        Latency: 170 msec (68-173 msec ~169 msec)
> ACL Data RX: Handle 345 flags 0x02 dlen 21              #148 [hci1] 12.649632
      SMP: Pairing Random (0x04) len 16
        Random value: ba79e56b36edb0180000000000000000
< HCI Command: Host Number of Com.. (0x03|0x0035) plen 5  #149 [hci1] 12.659213
        Num handles: 1
        Handle: 345 Address: DF:A9:FF:F6:B1:1A (OUI DF-A9-FF)
        Count: 1
< ACL Data TX: Handle 345 flags 0x00 dlen 21              #150 [hci1] 12.659317
      SMP: Pairing Random (0x04) len 16
        Random value: c629a3a987d808e808655d558dfc1155
> HCI Event: Number of Completed Packets (0x13) plen 5    #151 [hci1] 12.824214
        Num handles: 1
        Handle: 345 Address: DF:A9:FF:F6:B1:1A (OUI DF-A9-FF)
        Count: 1
        #150: len 21 (1 Kb/s)
        Latency: 164 msec (68-173 msec ~167 msec)
> ACL Data RX: Handle 345 flags 0x02 dlen 21              #152 [hci1] 12.911936
      SMP: Pairing Confirm (0x03) len 16
        Confim value: 5cfd34b456091bae9cd746945e36c4c1
< HCI Command: Host Number of Com.. (0x03|0x0035) plen 5  #153 [hci1] 12.918696
        Num handles: 1
        Handle: 345 Address: DF:A9:FF:F6:B1:1A (OUI DF-A9-FF)
        Count: 1
< ACL Data TX: Handle 345 flags 0x00 dlen 21              #154 [hci1] 12.918802
      SMP: Pairing Confirm (0x03) len 16
        Confim value: 8228bf072a3647512aa6d4e4a7f5ff45
> HCI Event: Number of Completed Packets (0x13) plen 5    #155 [hci1] 13.086844
        Num handles: 1
        Handle: 345 Address: DF:A9:FF:F6:B1:1A (OUI DF-A9-FF)
        Count: 1
        #154: len 21 (1 Kb/s)
        Latency: 168 msec (68-173 msec ~167 msec)
> ACL Data RX: Handle 345 flags 0x02 dlen 21              #156 [hci1] 13.087095
      SMP: Pairing Random (0x04) len 16
        Random value: 170a33bb377be7b20000000000000000
< HCI Command: Host Number of Com.. (0x03|0x0035) plen 5  #157 [hci1] 13.099207
        Num handles: 1
        Handle: 345 Address: DF:A9:FF:F6:B1:1A (OUI DF-A9-FF)
        Count: 1
< ACL Data TX: Handle 345 flags 0x00 dlen 21              #158 [hci1] 13.099365
      SMP: Pairing Random (0x04) len 16
        Random value: 92f20f6ad8f13724432c7fd6001c45ff
> HCI Event: Number of Completed Packets (0x13) plen 5    #159 [hci1] 13.261578
        Num handles: 1
        Handle: 345 Address: DF:A9:FF:F6:B1:1A (OUI DF-A9-FF)
        Count: 1
        #158: len 21 (1 Kb/s)
        Latency: 162 msec (68-173 msec ~164 msec)
> ACL Data RX: Handle 345 flags 0x02 dlen 21              #160 [hci1] 13.349427
      SMP: Pairing Confirm (0x03) len 16
        Confim value: 1d80e81962bddb28687123a4b51407d3
< HCI Command: Host Number of Com.. (0x03|0x0035) plen 5  #161 [hci1] 13.358916
        Num handles: 1
        Handle: 345 Address: DF:A9:FF:F6:B1:1A (OUI DF-A9-FF)
        Count: 1
< ACL Data TX: Handle 345 flags 0x00 dlen 21              #162 [hci1] 13.359138
      SMP: Pairing Confirm (0x03) len 16
        Confim value: b062ec2f7e2b88a1555673c29c8d1f86
> HCI Event: Number of Completed Packets (0x13) plen 5    #163 [hci1] 13.524282
        Num handles: 1
        Handle: 345 Address: DF:A9:FF:F6:B1:1A (OUI DF-A9-FF)
        Count: 1
        #162: len 21 (1 Kb/s)
        Latency: 165 msec (68-173 msec ~165 msec)
> ACL Data RX: Handle 345 flags 0x02 dlen 21              #164 [hci1] 13.524657
      SMP: Pairing Random (0x04) len 16
        Random value: 6c0f8dc18cc647c10000000000000000
< HCI Command: Host Number of Com.. (0x03|0x0035) plen 5  #165 [hci1] 13.539168
        Num handles: 1
        Handle: 345 Address: DF:A9:FF:F6:B1:1A (OUI DF-A9-FF)
        Count: 1
< ACL Data TX: Handle 345 flags 0x00 dlen 21              #166 [hci1] 13.539267
      SMP: Pairing Random (0x04) len 16
        Random value: 23ac32ebbb5e14c8a6b9622f296d277f
> HCI Event: Number of Completed Packets (0x13) plen 5    #167 [hci1] 13.699050
        Num handles: 1
        Handle: 345 Address: DF:A9:FF:F6:B1:1A (OUI DF-A9-FF)
        Count: 1
        #166: len 21 (1 Kb/s)
        Latency: 159 msec (68-173 msec ~162 msec)
> ACL Data RX: Handle 345 flags 0x02 dlen 21              #168 [hci1] 13.786985
      SMP: Pairing Confirm (0x03) len 16
        Confim value: 1d9f566513dd887e693a9304c7e0dc2a
< HCI Command: Host Number of Com.. (0x03|0x0035) plen 5  #169 [hci1] 13.798601
        Num handles: 1
        Handle: 345 Address: DF:A9:FF:F6:B1:1A (OUI DF-A9-FF)
        Count: 1
< ACL Data TX: Handle 345 flags 0x00 dlen 21              #170 [hci1] 13.798752
      SMP: Pairing Confirm (0x03) len 16
        Confim value: 4592bc717b85c7f2e8561d0d45229940
> HCI Event: Number of Completed Packets (0x13) plen 5    #171 [hci1] 13.961836
        Num handles: 1
        Handle: 345 Address: DF:A9:FF:F6:B1:1A (OUI DF-A9-FF)
        Count: 1
        #170: len 21 (1 Kb/s)
        Latency: 163 msec (68-173 msec ~162 msec)
> ACL Data RX: Handle 345 flags 0x02 dlen 21              #172 [hci1] 13.962124
      SMP: Pairing Random (0x04) len 16
        Random value: b9d3970540bca96b0000000000000000
< HCI Command: Host Number of Com.. (0x03|0x0035) plen 5  #173 [hci1] 13.978427
        Num handles: 1
        Handle: 345 Address: DF:A9:FF:F6:B1:1A (OUI DF-A9-FF)
        Count: 1
< ACL Data TX: Handle 345 flags 0x00 dlen 21              #174 [hci1] 13.978455
      SMP: Pairing Random (0x04) len 16
        Random value: 297efe85e67448a15f56bd27e3a3cf1d
> HCI Event: Number of Completed Packets (0x13) plen 5    #175 [hci1] 14.136509
        Num handles: 1
        Handle: 345 Address: DF:A9:FF:F6:B1:1A (OUI DF-A9-FF)
        Count: 1
        #174: len 21 (1 Kb/s)
        Latency: 158 msec (68-173 msec ~160 msec)
> ACL Data RX: Handle 345 flags 0x02 dlen 21              #176 [hci1] 14.224433
      SMP: Pairing Confirm (0x03) len 16
        Confim value: ea57e052c61a208da941683d06564082
< HCI Command: Host Number of Com.. (0x03|0x0035) plen 5  #177 [hci1] 14.238939
        Num handles: 1
        Handle: 345 Address: DF:A9:FF:F6:B1:1A (OUI DF-A9-FF)
        Count: 1
< ACL Data TX: Handle 345 flags 0x00 dlen 21              #178 [hci1] 14.239210
      SMP: Pairing Confirm (0x03) len 16
        Confim value: d8fe532da25ef416b4d5651cda5403ca
> HCI Event: Number of Completed Packets (0x13) plen 5    #179 [hci1] 14.399235
        Num handles: 1
        Handle: 345 Address: DF:A9:FF:F6:B1:1A (OUI DF-A9-FF)
        Count: 1
        #178: len 21 (1 Kb/s)
        Latency: 160 msec (68-173 msec ~160 msec)
> ACL Data RX: Handle 345 flags 0x02 dlen 21              #180 [hci1] 14.399571
      SMP: Pairing Random (0x04) len 16
        Random value: 39f68a18f4b5f5150000000000000000
< HCI Command: Host Number of Com.. (0x03|0x0035) plen 5  #181 [hci1] 14.418725
        Num handles: 1
        Handle: 345 Address: DF:A9:FF:F6:B1:1A (OUI DF-A9-FF)
        Count: 1
< ACL Data TX: Handle 345 flags 0x00 dlen 21              #182 [hci1] 14.418776
      SMP: Pairing Random (0x04) len 16
        Random value: 25a9493fd3ce4faf02be7293595bb7c6
> HCI Event: Number of Completed Packets (0x13) plen 5    #183 [hci1] 14.573961
        Num handles: 1
        Handle: 345 Address: DF:A9:FF:F6:B1:1A (OUI DF-A9-FF)
        Count: 1
        #182: len 21 (1 Kb/s)
        Latency: 155 msec (68-173 msec ~157 msec)
> ACL Data RX: Handle 345 flags 0x02 dlen 21              #184 [hci1] 14.661971
      SMP: Pairing Confirm (0x03) len 16
        Confim value: 65f42aba1f8bda6b75a739dc7c8eba6c
< HCI Command: Host Number of Com.. (0x03|0x0035) plen 5  #185 [hci1] 14.679014
        Num handles: 1
        Handle: 345 Address: DF:A9:FF:F6:B1:1A (OUI DF-A9-FF)
        Count: 1
< ACL Data TX: Handle 345 flags 0x00 dlen 21              #186 [hci1] 14.679257
      SMP: Pairing Confirm (0x03) len 16
        Confim value: c6f75365fa253a2739697145f249577c
> HCI Event: Number of Completed Packets (0x13) plen 5    #187 [hci1] 14.836847
        Num handles: 1
        Handle: 345 Address: DF:A9:FF:F6:B1:1A (OUI DF-A9-FF)
        Count: 1
        #186: len 21 (1 Kb/s)
        Latency: 157 msec (68-173 msec ~157 msec)
> ACL Data RX: Handle 345 flags 0x02 dlen 21              #188 [hci1] 14.837029
      SMP: Pairing Random (0x04) len 16
        Random value: 2999d1a62fac06940000000000000000
< HCI Command: Host Number of Com.. (0x03|0x0035) plen 5  #189 [hci1] 14.839197
        Num handles: 1
        Handle: 345 Address: DF:A9:FF:F6:B1:1A (OUI DF-A9-FF)
        Count: 1
< ACL Data TX: Handle 345 flags 0x00 dlen 21              #190 [hci1] 14.839284
      SMP: Pairing Random (0x04) len 16
        Random value: 58f6b41f855a6f6c3560debd84e2affc
> HCI Event: Number of Completed Packets (0x13) plen 5    #191 [hci1] 15.011539
        Num handles: 1
        Handle: 345 Address: DF:A9:FF:F6:B1:1A (OUI DF-A9-FF)
        Count: 1
        #190: len 21 (0 Kb/s)
        Latency: 172 msec (68-173 msec ~164 msec)
> ACL Data RX: Handle 345 flags 0x02 dlen 21              #192 [hci1] 15.099333
      SMP: Pairing Confirm (0x03) len 16
        Confim value: e3c603d213ac96dbcb271b81f0c60f90
< HCI Command: Host Number of Com.. (0x03|0x0035) plen 5  #193 [hci1] 15.118560
        Num handles: 1
        Handle: 345 Address: DF:A9:FF:F6:B1:1A (OUI DF-A9-FF)
        Count: 1
< ACL Data TX: Handle 345 flags 0x00 dlen 21              #194 [hci1] 15.118721
      SMP: Pairing Confirm (0x03) len 16
        Confim value: 0ecd258069a1c242a85533ae27546742
> HCI Event: Number of Completed Packets (0x13) plen 5    #195 [hci1] 15.274216
        Num handles: 1
        Handle: 345 Address: DF:A9:FF:F6:B1:1A (OUI DF-A9-FF)
        Count: 1
        #194: len 21 (1 Kb/s)
        Latency: 155 msec (68-173 msec ~160 msec)
> ACL Data RX: Handle 345 flags 0x02 dlen 21              #196 [hci1] 15.274681
      SMP: Pairing Random (0x04) len 16
        Random value: 80cd584d71bfd3180000000000000000
< HCI Command: Host Number of Com.. (0x03|0x0035) plen 5  #197 [hci1] 15.279151
        Num handles: 1
        Handle: 345 Address: DF:A9:FF:F6:B1:1A (OUI DF-A9-FF)
        Count: 1
< ACL Data TX: Handle 345 flags 0x00 dlen 21              #198 [hci1] 15.279274
      SMP: Pairing Random (0x04) len 16
        Random value: b67e7216d5bf664139eda2b542549666
> HCI Event: Number of Completed Packets (0x13) plen 5    #199 [hci1] 15.448987
        Num handles: 1
        Handle: 345 Address: DF:A9:FF:F6:B1:1A (OUI DF-A9-FF)
        Count: 1
        #198: len 21 (0 Kb/s)
        Latency: 169 msec (68-173 msec ~164 msec)
> ACL Data RX: Handle 345 flags 0x02 dlen 21              #200 [hci1] 15.536948
      SMP: Pairing Confirm (0x03) len 16
        Confim value: 71543fdcf24bf0e3f612a3f39e5a618c
< HCI Command: Host Number of Com.. (0x03|0x0035) plen 5  #201 [hci1] 15.539002
        Num handles: 1
        Handle: 345 Address: DF:A9:FF:F6:B1:1A (OUI DF-A9-FF)
        Count: 1
< ACL Data TX: Handle 345 flags 0x00 dlen 21              #202 [hci1] 15.539170
      SMP: Pairing Confirm (0x03) len 16
        Confim value: 54b26f1d8d95cf9e385daa9de789504c
> HCI Event: Number of Completed Packets (0x13) plen 5    #203 [hci1] 15.711765
        Num handles: 1
        Handle: 345 Address: DF:A9:FF:F6:B1:1A (OUI DF-A9-FF)
        Count: 1
        #202: len 21 (0 Kb/s)
        Latency: 172 msec (68-173 msec ~168 msec)
> ACL Data RX: Handle 345 flags 0x02 dlen 21              #204 [hci1] 15.712041
      SMP: Pairing Random (0x04) len 16
        Random value: 0f7448877f735d630000000000000000
< HCI Command: Host Number of Com.. (0x03|0x0035) plen 5  #205 [hci1] 15.719196
        Num handles: 1
        Handle: 345 Address: DF:A9:FF:F6:B1:1A (OUI DF-A9-FF)
        Count: 1
< ACL Data TX: Handle 345 flags 0x00 dlen 21              #206 [hci1] 15.719331
      SMP: Pairing Random (0x04) len 16
        Random value: ed17f76500c95219dd01e09d1e63f87b
> HCI Event: Number of Completed Packets (0x13) plen 5    #207 [hci1] 15.886431
        Num handles: 1
        Handle: 345 Address: DF:A9:FF:F6:B1:1A (OUI DF-A9-FF)
        Count: 1
        #206: len 21 (1 Kb/s)
        Latency: 167 msec (68-173 msec ~167 msec)
> ACL Data RX: Handle 345 flags 0x02 dlen 21              #208 [hci1] 15.974310
      SMP: Pairing Confirm (0x03) len 16
        Confim value: 91c9b403a9cbe5ab0d5a8f8b7adee571
< HCI Command: Host Number of Com.. (0x03|0x0035) plen 5  #209 [hci1] 15.978390
        Num handles: 1
        Handle: 345 Address: DF:A9:FF:F6:B1:1A (OUI DF-A9-FF)
        Count: 1
< ACL Data TX: Handle 345 flags 0x00 dlen 21              #210 [hci1] 15.978530
      SMP: Pairing Confirm (0x03) len 16
        Confim value: 66ddfdc40c7bb7290c293b562def1726
> HCI Event: Number of Completed Packets (0x13) plen 5    #211 [hci1] 16.149212
        Num handles: 1
        Handle: 345 Address: DF:A9:FF:F6:B1:1A (OUI DF-A9-FF)
        Count: 1
        #210: len 21 (0 Kb/s)
        Latency: 170 msec (68-173 msec ~169 msec)
> ACL Data RX: Handle 345 flags 0x02 dlen 21              #212 [hci1] 16.149498
      SMP: Pairing Random (0x04) len 16
        Random value: 93868d05f684772d0000000000000000
< HCI Command: Host Number of Com.. (0x03|0x0035) plen 5  #213 [hci1] 16.159138
        Num handles: 1
        Handle: 345 Address: DF:A9:FF:F6:B1:1A (OUI DF-A9-FF)
        Count: 1
< ACL Data TX: Handle 345 flags 0x00 dlen 21              #214 [hci1] 16.159317
      SMP: Pairing Random (0x04) len 16
        Random value: 81d35d47e1f6006d79c974bd9d9e1ee3
> HCI Event: Number of Completed Packets (0x13) plen 5    #215 [hci1] 16.323945
        Num handles: 1
        Handle: 345 Address: DF:A9:FF:F6:B1:1A (OUI DF-A9-FF)
        Count: 1
        #214: len 21 (1 Kb/s)
        Latency: 164 msec (68-173 msec ~166 msec)
> ACL Data RX: Handle 345 flags 0x02 dlen 21              #216 [hci1] 16.411958
      SMP: Pairing Confirm (0x03) len 16
        Confim value: 35050cebc21b7ba906299eceec94e9a5
< HCI Command: Host Number of Com.. (0x03|0x0035) plen 5  #217 [hci1] 16.418999
        Num handles: 1
        Handle: 345 Address: DF:A9:FF:F6:B1:1A (OUI DF-A9-FF)
        Count: 1
< ACL Data TX: Handle 345 flags 0x00 dlen 21              #218 [hci1] 16.419213
      SMP: Pairing Confirm (0x03) len 16
        Confim value: 4e85f26772113bdcedbabf8cd8aa1df8
> HCI Event: Number of Completed Packets (0x13) plen 5    #219 [hci1] 16.586647
        Num handles: 1
        Handle: 345 Address: DF:A9:FF:F6:B1:1A (OUI DF-A9-FF)
        Count: 1
        #218: len 21 (1 Kb/s)
        Latency: 167 msec (68-173 msec ~167 msec)
> ACL Data RX: Handle 345 flags 0x02 dlen 21              #220 [hci1] 16.586984
      SMP: Pairing Random (0x04) len 16
        Random value: 0861d34b69993efe0000000000000000
< HCI Command: Host Number of Com.. (0x03|0x0035) plen 5  #221 [hci1] 16.599095
        Num handles: 1
        Handle: 345 Address: DF:A9:FF:F6:B1:1A (OUI DF-A9-FF)
        Count: 1
< ACL Data TX: Handle 345 flags 0x00 dlen 21              #222 [hci1] 16.599117
      SMP: Pairing Random (0x04) len 16
        Random value: e7f7e0c2476823e41736a7e381bafb7c
> HCI Event: Number of Completed Packets (0x13) plen 5    #223 [hci1] 16.761468
        Num handles: 1
        Handle: 345 Address: DF:A9:FF:F6:B1:1A (OUI DF-A9-FF)
        Count: 1
        #222: len 21 (1 Kb/s)
        Latency: 162 msec (68-173 msec ~164 msec)
> ACL Data RX: Handle 345 flags 0x02 dlen 21              #224 [hci1] 16.849247
      SMP: Pairing Confirm (0x03) len 16
        Confim value: 48f05fd3ea88498ddf8fb879bc230281
< HCI Command: Host Number of Com.. (0x03|0x0035) plen 5  #225 [hci1] 16.858646
        Num handles: 1
        Handle: 345 Address: DF:A9:FF:F6:B1:1A (OUI DF-A9-FF)
        Count: 1
< ACL Data TX: Handle 345 flags 0x00 dlen 21              #226 [hci1] 16.858807
      SMP: Pairing Confirm (0x03) len 16
        Confim value: 22967c9c173f37aba1322eb7969b30e9
> HCI Event: Number of Completed Packets (0x13) plen 5    #227 [hci1] 17.024118
        Num handles: 1
        Handle: 345 Address: DF:A9:FF:F6:B1:1A (OUI DF-A9-FF)
        Count: 1
        #226: len 21 (1 Kb/s)
        Latency: 165 msec (68-173 msec ~165 msec)
> ACL Data RX: Handle 345 flags 0x02 dlen 21              #228 [hci1] 17.024512
      SMP: Pairing Random (0x04) len 16
        Random value: 3509a454485ad1e50000000000000000
< HCI Command: Host Number of Com.. (0x03|0x0035) plen 5  #229 [hci1] 17.039238
        Num handles: 1
        Handle: 345 Address: DF:A9:FF:F6:B1:1A (OUI DF-A9-FF)
        Count: 1
