Bluetooth monitor ver 5.72
= Note: Linux version 6.14.0-36-generic (x86_64)                       0.788621
= Note: Bluetooth subsystem version 2.22                               0.788623
= New Index: 00:00:00:00:00:00 (Primary,UART,hci1)              [hci1] 0.788624
= New Index: 48:5F:99:8E:E0:64 (Primary,USB,hci0)               [hci0] 0.788624
= Open Index: 00:00:00:00:00:00                                 [hci1] 0.901630
= Index Info: 00:00:00:00:00:00 (Nordic Semiconductor ASA)      [hci1] 0.901635
@ USER Open: main (privileged) version 2.22            {0x0001} [hci1] 0.901637
< HCI Command: Reset (0x03|0x0003) plen 0                    #1 [hci1] 0.902001
> HCI Event: Command Complete (0x0e) plen 4                  #2 [hci1] 0.902602
      Reset (0x03|0x0003) ncmd 1
        Status: Success (0x00)
< HCI Command: Read Local Supported... (0x04|0x0003) plen 0  #3 [hci1] 0.921641
> HCI Event: Command Complete (0x0e) plen 12                 #4 [hci1] 0.922107
      Read Local Supported Features (0x04|0x0003) ncmd 1
        Status: Success (0x00)
        Features: 0x00 0x00 0x00 0x00 0x60 0x00 0x00 0x00
          BR/EDR Not Supported
          LE Supported (Controller)
< HCI Command: Read Local Version In.. (0x04|0x0001) plen 0  #5 [hci1] 0.941652
> HCI Event: Command Complete (0x0e) plen 12                 #6 [hci1] 0.942083
      Read Local Version Information (0x04|0x0001) ncmd 1
        Status: Success (0x00)
        HCI version: Reserved (0x0f) - Revision 12393 (0x3069)
        LMP version: Reserved (0x0f) - Subversion 12393 (0x3069)
        Manufacturer: Nordic Semiconductor ASA (89)
< HCI Command: Read Local Supported... (0x04|0x0002) plen 0  #7 [hci1] 0.961623
> HCI Event: Command Complete (0x0e) plen 68                 #8 [hci1] 0.962709
      Read Local Supported Commands (0x04|0x0002) ncmd 1
        Status: Success (0x00)
        Commands: 119 entries
          Disconnect (Octet 0 - Bit 5)
          Read Remote Version Information (Octet 2 - Bit 7)
          Set Event Mask (Octet 5 - Bit 6)
          Reset (Octet 5 - Bit 7)
          Read Connection Accept Timeout (Octet 7 - Bit 2)
          Write Connection Accept Timeout (Octet 7 - Bit 3)
          Read Transmit Power Level (Octet 10 - Bit 2)
          Set Controller To Host Flow Control (Octet 10 - Bit 5)
          Host Buffer Size (Octet 10 - Bit 6)
          Host Number of Completed Packets (Octet 10 - Bit 7)
          Read Local Version Information (Octet 14 - Bit 3)
          Read Local Supported Features (Octet 14 - Bit 5)
          Read BD ADDR (Octet 15 - Bit 1)
          Read RSSI (Octet 15 - Bit 5)
          Set Event Mask Page 2 (Octet 22 - Bit 2)
          LE Set Event Mask (Octet 25 - Bit 0)
          LE Read Buffer Size (Octet 25 - Bit 1)
          LE Read Local Supported Features (Octet 25 - Bit 2)
          LE Set Random Address (Octet 25 - Bit 4)
          LE Set Advertising Parameters (Octet 25 - Bit 5)
          LE Read Advertising Channel TX Power (Octet 25 - Bit 6)
          LE Set Advertising Data (Octet 25 - Bit 7)
          LE Set Scan Response Data (Octet 26 - Bit 0)
          LE Set Advertise Enable (Octet 26 - Bit 1)
          LE Set Scan Parameters (Octet 26 - Bit 2)
          LE Set Scan Enable (Octet 26 - Bit 3)
          LE Create Connection (Octet 26 - Bit 4)
          LE Create Connection Cancel (Octet 26 - Bit 5)
          LE Read Accept List Size (Octet 26 - Bit 6)
          LE Clear Accept List (Octet 26 - Bit 7)
          LE Add Device To Accept List (Octet 27 - Bit 0)
          LE Remove Device From Accept List (Octet 27 - Bit 1)
          LE Connection Update (Octet 27 - Bit 2)
          LE Set Host Channel Classification (Octet 27 - Bit 3)
          LE Read Channel Map (Octet 27 - Bit 4)
          LE Read Remote Used Features (Octet 27 - Bit 5)
          LE Encrypt (Octet 27 - Bit 6)
          LE Rand (Octet 27 - Bit 7)
          LE Start Encryption (Octet 28 - Bit 0)
          LE Long Term Key Request Reply (Octet 28 - Bit 1)
          LE Long Term Key Request Neg Reply (Octet 28 - Bit 2)
          LE Read Supported States (Octet 28 - Bit 3)
          LE Receiver Test (Octet 28 - Bit 4)
          LE Transmitter Test (Octet 28 - Bit 5)
          LE Test End (Octet 28 - Bit 6)
          Read Authenticated Payload Timeout (Octet 32 - Bit 4)
          Write Authenticated Payload Timeout (Octet 32 - Bit 5)
          LE Set Data Length (Octet 33 - Bit 6)
          LE Read Suggested Default Data Length (Octet 33 - Bit 7)
          LE Write Suggested Default Data Length (Octet 34 - Bit 0)
          LE Add Device To Resolving List (Octet 34 - Bit 3)
          LE Remove Device From Resolving List (Octet 34 - Bit 4)
          LE Clear Resolving List (Octet 34 - Bit 5)
          LE Read Resolving List Size (Octet 34 - Bit 6)
          LE Set Address Resolution Enable (Octet 35 - Bit 1)
          LE Set Resolvable Private Address Timeout (Octet 35 - Bit 2)
          LE Read Maximum Data Length (Octet 35 - Bit 3)
          LE Read PHY (Octet 35 - Bit 4)
          LE Set Default PHY (Octet 35 - Bit 5)
          LE Set PHY (Octet 35 - Bit 6)
          LE Enhanced Receiver Test (Octet 35 - Bit 7)
          LE Enhanced Transmitter Test (Octet 36 - Bit 0)
          LE Set Advertising Set Random Address (Octet 36 - Bit 1)
          LE Set Extended Advertising Parameters (Octet 36 - Bit 2)
          LE Set Extended Advertising Data (Octet 36 - Bit 3)
          LE Set Extended Scan Response Data (Octet 36 - Bit 4)
          LE Set Extended Advertising Enable (Octet 36 - Bit 5)
          LE Read Maximum Advertising Data Length (Octet 36 - Bit 6)
          LE Read Number of Supported Advertising Sets (Octet 36 - Bit 7)
          LE Remove Advertising Set (Octet 37 - Bit 0)
          LE Clear Advertising Sets (Octet 37 - Bit 1)
          LE Set Periodic Advertising Parameters (Octet 37 - Bit 2)
          LE Set Periodic Advertising Data (Octet 37 - Bit 3)
          LE Set Periodic Advertising Enable (Octet 37 - Bit 4)
          LE Set Extended Scan Parameters (Octet 37 - Bit 5)
          LE Set Extended Scan Enable (Octet 37 - Bit 6)
          LE Extended Create Connection (Octet 37 - Bit 7)
          LE Periodic Advertising Create Sync (Octet 38 - Bit 0)
          LE Periodic Advertising Create Sync Cancel (Octet 38 - Bit 1)
          LE Periodic Advertising Terminate Sync (Octet 38 - Bit 2)
          LE Add Device To Periodic Advertiser List (Octet 38 - Bit 3)
          LE Remove Device From Periodic Advertiser List (Octet 38 - Bit 4)
          LE Clear Periodic Advertiser List (Octet 38 - Bit 5)
          LE Read Periodic Advertiser List Size (Octet 38 - Bit 6)
          LE Read Transmit Power (Octet 38 - Bit 7)
          LE Read RF Path Compensation (Octet 39 - Bit 0)
          LE Write RF Path Compensation (Octet 39 - Bit 1)
          LE Set Privacy Mode (Octet 39 - Bit 2)
          LE Periodic Advertising Receive Enable (Octet 40 - Bit 5)
          LE Periodic Advertising Sync Transfer (Octet 40 - Bit 6)
          LE Periodic Advertising Set Info Transfer (Octet 40 - Bit 7)
          LE Periodic Advertising Sync Transfer Parameters (Octet 41 - Bit 0)
          LE Set Default Periodic Advertisng Sync Transfer Parameters (Octet 41 - Bit 1)
          LE Read Buffer v2 (Octet 41 - Bit 5)
          LE Read ISO TX Sync (Octet 41 - Bit 6)
          LE Set Connected Isochronous Group Parameters (Octet 41 - Bit 7)
          LE Set Connected Isochronous Group Parameters Test (Octet 42 - Bit 0)
          LE Create Connected Isochronous Stream (Octet 42 - Bit 1)
          LE Remove Connected Isochronous Group (Octet 42 - Bit 2)
          LE Accept Connected Isochronous Stream Request (Octet 42 - Bit 3)
          LE Reject Connected Isochronous Stream Request (Octet 42 - Bit 4)
          LE Create Broadcast Isochronous Group (Octet 42 - Bit 5)
          LE Create Broadcast Isochronous Group Test (Octet 42 - Bit 6)
          LE Terminate Broadcast Isochronous Group (Octet 42 - Bit 7)
          LE Broadcast Isochronous Group Create Sync (Octet 43 - Bit 0)
          LE Broadcast Isochronous Group Terminate Sync (Octet 43 - Bit 1)
          LE Request Peer SCA (Octet 43 - Bit 2)
          LE Setup Isochronous Data Path (Octet 43 - Bit 3)
          LE Remove Isochronous Data Path (Octet 43 - Bit 4)
          LE Isochronous Transmit Test (Octet 43 - Bit 5)
          LE Isochronous Receive Test (Octet 43 - Bit 6)
          LE Isochronous Read Test Counters (Octet 43 - Bit 7)
          LE Isochronous Read Test Counters (Octet 44 - Bit 0)
          LE Set Host Feature (Octet 44 - Bit 1)
          Octet 44 - Bit 2 
          Octet 45 - Bit 6 
          Octet 46 - Bit 0 
          Octet 46 - Bit 1 
          Octet 46 - Bit 2 
< HCI Command: Host Buffer Size (0x03|0x0033) plen 7         #9 [hci1] 0.981633
        ACL MTU: 255  ACL max packet: 16
        SCO MTU: 0    SCO max packet: 0
> HCI Event: Command Complete (0x0e) plen 4                 #10 [hci1] 0.982098
      Host Buffer Size (0x03|0x0033) ncmd 1
        Status: Success (0x00)
< HCI Command: Set Controller To Ho.. (0x03|0x0031) plen 1  #11 [hci1] 1.001593
        Flow control: ACL Data Packets (0x01)
> HCI Event: Command Complete (0x0e) plen 4                 #12 [hci1] 1.001993
      Set Controller To Host Flow Control (0x03|0x0031) ncmd 1
        Status: Success (0x00)
< HCI Command: LE Read Local Suppor.. (0x08|0x0003) plen 0  #13 [hci1] 1.021624
> HCI Event: Command Complete (0x0e) plen 12                #14 [hci1] 1.022157
      LE Read Local Supported Features (0x08|0x0003) ncmd 1
        Status: Success (0x00)
        Features: 0xfd 0x79 0x00 0xf7 0x30 0x01 0x00 0x00
          LE Encryption
          Extended Reject Indication
          Peripheral-initiated Features Exchange
          LE Ping
          LE Data Packet Length Extension
          LL Privacy
          Extended Scanner Filter Policies
          LE 2M PHY
          LE Coded PHY
          LE Extended Advertising
          LE Periodic Advertising
          Channel Selection Algorithm #2
          Periodic Advertising Sync Transfer - Sender
          Periodic Advertising Sync Transfer - Recipient
          Sleep Clock Accuracy Updates
          Connected Isochronous Stream - Central
          Connected Isochronous Stream - Peripheral
          Isochronous Broadcaster
          Synchronized Receiver
          Periodic Advertising ADI support
          Connection Subrating
          Unknown features (0x0000010000000000)
< HCI Command: LE Set Host Feature (0x08|0x0074) plen 2     #15 [hci1] 1.041662
        Bit Number: 32
          Connected Isochronous Stream (Host Support)
        Bit Value: 1
> HCI Event: Command Complete (0x0e) plen 4                 #16 [hci1] 1.042121
      LE Set Host Feature (0x08|0x0074) ncmd 1
        Status: Success (0x00)
< HCI Command: LE Read Buffer v2 (0x08|0x0060) plen 0       #17 [hci1] 1.061643
> HCI Event: Command Complete (0x0e) plen 10                #18 [hci1] 1.062145
      LE Read Buffer v2 (0x08|0x0060) ncmd 1
        Status: Success (0x00)
        ACL MTU: 27
        ACL max packet: 3
        ISO MTU: 318
        ISO max packet: 3
< HCI Command: LE Read Maximum Adve.. (0x08|0x003a) plen 0  #19 [hci1] 1.081641
> HCI Event: Command Complete (0x0e) plen 6                 #20 [hci1] 1.082101
      LE Read Maximum Advertising Data Length (0x08|0x003a) ncmd 1
        Status: Success (0x00)
        Max length: 1650
< HCI Command: LE Read Supported St.. (0x08|0x001c) plen 0  #21 [hci1] 1.101660
> HCI Event: Command Complete (0x0e) plen 12                #22 [hci1] 1.102224
      LE Read Supported States (0x08|0x001c) ncmd 1
        Status: Success (0x00)
        States: 0x000003ff3e0306ff
          Non-connectable Advertising State
          Scannable Advertising State
          Connectable Advertising State
          High Duty Cycle Directed Advertising State
          Passive Scanning State
          Active Scanning State
          Initiating State
            and Connection State (Central Role)
          Connection State (Peripheral Role)
          Scannable Advertising State
            and Passive Scanning State
          Connectable Advertising State
            and Passive Scanning State
          Non-connectable Advertising State
            and Initiating State
          Scannable Advertising State
            and Initiating State
          Active Scanning State
            and Connection State (Central Role)
          Passive Scanning State
            and Connection State (Peripheral Role)
          Active Scanning State
            and Connection State (Peripheral Role)
          Initiating State
            and Connection State (Central Role)
            and Central Role & Central Role
          Low Duty Cycle Directed Advertising State
          Connectable Advertising State
            and Initiating State
            and Central Role & Peripheral Role
          High Duty Cycle Directed Advertising State
            and Initiating State
            and Central Role & Peripheral Role
          Low Duty Cycle Directed Advertising State
            and Initiating State
            and Central Role & Peripheral Role
          Connectable Advertising State
            and Connection State (Central Role)
            and Central Role & Peripheral Role
          High Duty Cycle Directed Advertising State
            and Connection State (Central Role)
            and Central Role & Peripheral Role
          Low Duty Cycle Directed Advertising State
            and Connection State (Central Role)
            and Central Role & Peripheral Role
          Connectable Advertising State
            and Connection State (Peripheral Role)
            and Central Role & Peripheral Role
          High Duty Cycle Directed Advertising State
            and Connection State (Peripheral Role)
            and Peripheral Role & Peripheral Role
          Low Duty Cycle Directed Advertising State
            and Connection State (Peripheral Role)
            and Peripheral Role & Peripheral Role
          Initiating State
            and Connection State (Peripheral Role)
            and Central Role & Peripheral Role
< HCI Command: LE Read Maximum Data.. (0x08|0x002f) plen 0  #23 [hci1] 1.121611
> HCI Event: Command Complete (0x0e) plen 12                #24 [hci1] 1.122159
      LE Read Maximum Data Length (0x08|0x002f) ncmd 1
        Status: Success (0x00)
        Max TX octets: 251
        Max TX time: 2704
        Max RX octets: 251
        Max RX time: 2704
< HCI Command: LE Write Suggested D.. (0x08|0x0024) plen 4  #25 [hci1] 1.141614
        TX octets: 251
        TX time: 2704
> HCI Event: Command Complete (0x0e) plen 4                 #26 [hci1] 1.142106
      LE Write Suggested Default Data Length (0x08|0x0024) ncmd 1
        Status: Success (0x00)
< HCI Command: LE Set Resolvable Pr.. (0x08|0x002e) plen 2  #27 [hci1] 1.161637
        Timeout: 30 seconds
> HCI Event: Command Complete (0x0e) plen 4                 #28 [hci1] 1.162017
      LE Set Resolvable Private Address Timeout (0x08|0x002e) ncmd 1
        Status: Success (0x00)
< HCI Command: LE Read Resolving Li.. (0x08|0x002a) plen 0  #29 [hci1] 1.181656
> HCI Event: Command Complete (0x0e) plen 5                 #30 [hci1] 1.182087
      LE Read Resolving List Size (0x08|0x002a) ncmd 1
        Status: Success (0x00)
        Size: 8
< HCI Command: LE Set Event Mask (0x08|0x0001) plen 8       #31 [hci1] 1.201624
        Mask: 0x000002023f87fa5e
          LE Advertising Report
          LE Connection Update Complete
          LE Read Remote Used Features Complete
          LE Long Term Key Request
          LE Data Length Change
          LE Enhanced Connection Complete
          LE PHY Update Complete
          LE Extended Advertising Report
          LE Periodic Advertising Sync Established
          LE Periodic Advertising Report
          LE Periodic Advertising Sync Lost
          LE Extended Scan Timeout
          LE Extended Advertising Set Terminated
          LE Scan Request Received
          LE Periodic Advertising Sync Transfer Rvc
          LE CIS Established
          LE CIS Request
          LE Create BIG Complete
          LE Terminate BIG Complete
          LE BIG Sync Estabilished Complete
          LE BIG Sync Lost
          LE BIG Info Advertising Report
          Unknown mask (0x0000020000000000)
> HCI Event: Command Complete (0x0e) plen 4                 #32 [hci1] 1.202149
      LE Set Event Mask (0x08|0x0001) ncmd 1
        Status: Success (0x00)
< HCI Command: Set Event Mask (0x03|0x0001) plen 8          #33 [hci1] 1.221658
        Mask: 0x2000800002008890
          Disconnection Complete
          Encryption Change
          Read Remote Version Information Complete
          Hardware Error
          Data Buffer Overflow
          Encryption Key Refresh Complete
          LE Meta
> HCI Event: Command Complete (0x0e) plen 4                 #34 [hci1] 1.222258
      Set Event Mask (0x03|0x0001) ncmd 1
        Status: Success (0x00)
< HCI Command: Read BD ADDR (0x04|0x0009) plen 0            #35 [hci1] 1.241636
> HCI Event: Command Complete (0x0e) plen 10                #36 [hci1] 1.242125
      Read BD ADDR (0x04|0x0009) ncmd 1
        Status: Success (0x00)
        Address: 00:00:00:00:00:00 (OUI 00-00-00)
< HCI Command: LE Set Random Address (0x08|0x0005) plen 6   #37 [hci1] 1.261641
        Address: D5:B6:CC:31:DB:3B (Static)
> HCI Event: Command Complete (0x0e) plen 4                 #38 [hci1] 1.262068
      LE Set Random Address (0x08|0x0005) ncmd 1
        Status: Success (0x00)
< HCI Command: LE Set Random Address (0x08|0x0005) plen 6   #39 [hci1] 1.371655
        Address: 48:61:8E:DB:C6:F9 (Resolvable)
> HCI Event: Command Complete (0x0e) plen 4                 #40 [hci1] 1.372240
      LE Set Random Address (0x08|0x0005) ncmd 1
        Status: Success (0x00)
< HCI Command: LE Extended Create... (0x08|0x0043) plen 26  #41 [hci1] 4.802134
        Filter policy: Accept list is not used (0x00)
        Own address type: Random (0x03)
        Peer address type: Public (0x00)
        Peer address: DF:A9:FF:F6:B1:1A (OUI DF-A9-FF)
        Initiating PHYs: 0x01
        Entry 0: LE 1M
          Scan interval: 60.000 msec (0x0060)
          Scan window: 60.000 msec (0x0060)
          Min connection interval: 50.00 msec (0x0028)
          Max connection interval: 70.00 msec (0x0038)
          Connection latency: 0 (0x0000)
          Supervision timeout: 4000 msec (0x0190)
          Min connection length: 0.000 msec (0x0000)
          Max connection length: 0.000 msec (0x0000)
> HCI Event: Command Status (0x0f) plen 4                   #42 [hci1] 4.803022
      LE Extended Create Connection (0x08|0x0043) ncmd 1
        Status: Success (0x00)
> HCI Event: LE Meta Event (0x3e) plen 31                   #43 [hci1] 5.084892
      LE Enhanced Connection Complete (0x0a)
        Status: Success (0x00)
        Handle: 360
        Role: Central (0x00)
        Peer address type: Public (0x00)
        Peer address: DF:A9:FF:F6:B1:1A (OUI DF-A9-FF)
        Local resolvable private address: 48:61:8E:DB:C6:F9 (Resolvable)
        Peer resolvable private address: 00:00:00:00:00:00 (Non-Resolvable)
        Connection interval: 70.00 msec (0x0038)
        Connection latency: 0 (0x0000)
        Supervision timeout: 4000 msec (0x0190)
        Central clock accuracy: 0x00
< HCI Command: LE Read Remote Used... (0x08|0x0016) plen 2  #44 [hci1] 5.102694
        Handle: 360 Address: DF:A9:FF:F6:B1:1A (OUI DF-A9-FF)
< ACL Data TX: Handle 360 flags 0x00 dlen 7                 #45 [hci1] 5.102720
      ATT: Exchange MTU Request (0x02) len 2
        Client RX MTU: 251
> HCI Event: Command Status (0x0f) plen 4                   #46 [hci1] 5.103172
      LE Read Remote Used Features (0x08|0x0016) ncmd 1
        Status: Success (0x00)
< HCI Command: LE Set PHY (0x08|0x0032) plen 7              #47 [hci1] 5.121982
        Handle: 360 Address: DF:A9:FF:F6:B1:1A (OUI DF-A9-FF)
        All PHYs preference: 0x00
        TX PHYs preference: 0x02
          LE 2M
        RX PHYs preference: 0x02
          LE 2M
        PHY options preference: Reserved (0x0000)
> HCI Event: Command Status (0x0f) plen 4                   #48 [hci1] 5.122561
      LE Set PHY (0x08|0x0032) ncmd 1
        Status: Success (0x00)
> HCI Event: Number of Completed Packets (0x13) plen 5      #49 [hci1] 5.157141
        Num handles: 1
        Handle: 360 Address: DF:A9:FF:F6:B1:1A (OUI DF-A9-FF)
        Count: 1
        #45: len 7 (1 Kb/s)
        Latency: 54 msec (54-54 msec ~54 msec)
> HCI Event: LE Meta Event (0x3e) plen 12                   #50 [hci1] 5.297223
      LE Read Remote Used Features (0x04)
        Status: Success (0x00)
        Handle: 360 Address: DF:A9:FF:F6:B1:1A (OUI DF-A9-FF)
        Features: 0x2d 0x49 0x00 0xf7 0x67 0xd9 0x00 0x80
          LE Encryption
          Extended Reject Indication
          Peripheral-initiated Features Exchange
          LE Data Packet Length Extension
          LE 2M PHY
          LE Coded PHY
          Channel Selection Algorithm #2
          Periodic Advertising Sync Transfer - Sender
          Periodic Advertising Sync Transfer - Recipient
          Sleep Clock Accuracy Updates
          Connected Isochronous Stream - Central
          Connected Isochronous Stream - Peripheral
          Isochronous Broadcaster
          Synchronized Receiver
          Connected Isochronous Stream (Host Support)
          LE Power Control Request
          LE Power Control Request
          Connection Subrating
          Connection Subrating (Host Support)
          Unknown features (0x8000d90000000000)
> HCI Event: LE Meta Event (0x3e) plen 6                    #51 [hci1] 5.996567
      LE PHY Update Complete (0x0c)
        Status: Success (0x00)
        Handle: 360 Address: DF:A9:FF:F6:B1:1A (OUI DF-A9-FF)
        TX PHY: LE 2M (0x02)
        RX PHY: LE 2M (0x02)
> ACL Data RX: Handle 360 flags 0x02 dlen 6                 #52 [hci1] 6.137008
      SMP: Security Request (0x0b) len 1
        Authentication requirement: Bonding, No MITM, SC, No Keypresses (0x09)
> ACL Data RX: Handle 360 flags 0x02 dlen 7                 #53 [hci1] 6.137427
      ATT: Exchange MTU Response (0x03) len 2
        Server RX MTU: 23
< HCI Command: Host Number of Compl.. (0x03|0x0035) plen 5  #54 [hci1] 6.141797
        Num handles: 1
        Handle: 360 Address: DF:A9:FF:F6:B1:1A (OUI DF-A9-FF)
        Count: 1
< ACL Data TX: Handle 360 flags 0x00 dlen 11                #55 [hci1] 6.141880
      SMP: Pairing Request (0x01) len 6
        IO capability: NoInputNoOutput (0x03)
        OOB data: Authentication data not present (0x00)
        Authentication requirement: Bonding, No MITM, SC, No Keypresses (0x09)
        Max encryption key size: 16
        Initiator key distribution: EncKey IdKey (0x03)
        Responder key distribution: EncKey IdKey (0x03)
< HCI Command: Host Number of Compl.. (0x03|0x0035) plen 5  #56 [hci1] 6.142071
        Num handles: 1
        Handle: 360 Address: DF:A9:FF:F6:B1:1A (OUI DF-A9-FF)
        Count: 1
> HCI Event: Number of Completed Packets (0x13) plen 5      #57 [hci1] 6.206920
        Num handles: 1
        Handle: 360 Address: DF:A9:FF:F6:B1:1A (OUI DF-A9-FF)
        Count: 1
        #55: len 11 (1 Kb/s)
        Latency: 65 msec (54-65 msec ~59 msec)
> ACL Data RX: Handle 360 flags 0x02 dlen 11                #58 [hci1] 6.277036
      SMP: Pairing Response (0x02) len 6
        IO capability: KeyboardDisplay (0x04)
        OOB data: Authentication data not present (0x00)
        Authentication requirement: Bonding, No MITM, SC, No Keypresses (0x09)
        Max encryption key size: 16
        Initiator key distribution: EncKey IdKey (0x03)
        Responder key distribution: EncKey IdKey (0x03)
< HCI Command: Host Number of Compl.. (0x03|0x0035) plen 5  #59 [hci1] 6.282155
        Num handles: 1
        Handle: 360 Address: DF:A9:FF:F6:B1:1A (OUI DF-A9-FF)
        Count: 1
< ACL Data TX: Handle 360 flags 0x00 dlen 27                #60 [hci1] 6.282304
< ACL Data TX: Handle 360 flags 0x01 dlen 27                #61 [hci1] 6.282322
< ACL Data TX: Handle 360 flags 0x01 dlen 15                #62 [hci1] 6.282353
      SMP: Pairing Public Key (0x0c) len 64
        X: 68f6ada634ce84d11617383d57f070fe3445c38b33b569efa5eb771a0dc8aea5
        Y: 83c407aaa8337331fdc418e55085d75e6c1c6e5d42f8bf9c18fb5a2a7d4f31aa
> HCI Event: Number of Completed Packets (0x13) plen 5      #63 [hci1] 6.346966
        Num handles: 1
        Handle: 360 Address: DF:A9:FF:F6:B1:1A (OUI DF-A9-FF)
        Count: 1
        #60: len 27 (3 Kb/s)
        Latency: 64 msec (54-65 msec ~62 msec)
> HCI Event: Number of Completed Packets (0x13) plen 5      #64 [hci1] 6.347500
        Num handles: 1
        Handle: 360 Address: DF:A9:FF:F6:B1:1A (OUI DF-A9-FF)
        Count: 1
        #61: len 27 (3 Kb/s)
        Latency: 65 msec (54-65 msec ~63 msec)
> HCI Event: Number of Completed Packets (0x13) plen 5      #65 [hci1] 6.347971
        Num handles: 1
        Handle: 360 Address: DF:A9:FF:F6:B1:1A (OUI DF-A9-FF)
        Count: 1
        #62: len 15 (1 Kb/s)
        Latency: 65 msec (54-65 msec ~64 msec)
> ACL Data RX: Handle 360 flags 0x02 dlen 27                #66 [hci1] 6.417162
> ACL Data RX: Handle 360 flags 0x01 dlen 27                #67 [hci1] 6.417756
> ACL Data RX: Handle 360 flags 0x01 dlen 15                #68 [hci1] 6.418075
      SMP: Pairing Public Key (0x0c) len 64
        X: 436b7095394a30f645f06e8aceef8645cdebf7a6f61446ebf175153d106c6b98
        Y: e9c73691dcb8eaccc5f0150aff329418cb546d3f29d3436e36b6ade9ed05ed9a
< HCI Command: Host Number of Compl.. (0x03|0x0035) plen 5  #69 [hci1] 6.422384
        Num handles: 1
        Handle: 360 Address: DF:A9:FF:F6:B1:1A (OUI DF-A9-FF)
        Count: 1
< HCI Command: Host Number of Compl.. (0x03|0x0035) plen 5  #70 [hci1] 6.422630
        Num handles: 1
        Handle: 360 Address: DF:A9:FF:F6:B1:1A (OUI DF-A9-FF)
        Count: 1
< HCI Command: Host Number of Compl.. (0x03|0x0035) plen 5  #71 [hci1] 6.422789
        Num handles: 1
        Handle: 360 Address: DF:A9:FF:F6:B1:1A (OUI DF-A9-FF)
        Count: 1
> ACL Data RX: Handle 360 flags 0x02 dlen 21                #72 [hci1] 6.487133
      SMP: Pairing Confirm (0x03) len 16
        Confim value: caa24be1f78f50447162d915d3d72660
< HCI Command: Host Number of Compl.. (0x03|0x0035) plen 5  #73 [hci1] 6.501853
        Num handles: 1
        Handle: 360 Address: DF:A9:FF:F6:B1:1A (OUI DF-A9-FF)
        Count: 1
< ACL Data TX: Handle 360 flags 0x00 dlen 21                #74 [hci1] 6.501947
      SMP: Pairing Random (0x04) len 16
        Random value: 555cc64d02679f89a05211af56d8b3da
> HCI Event: Number of Completed Packets (0x13) plen 5      #75 [hci1] 6.557044
        Num handles: 1
        Handle: 360 Address: DF:A9:FF:F6:B1:1A (OUI DF-A9-FF)
        Count: 1
        #74: len 21 (3 Kb/s)
        Latency: 55 msec (54-65 msec ~59 msec)
> ACL Data RX: Handle 360 flags 0x02 dlen 21                #76 [hci1] 6.627155
      SMP: Pairing Random (0x04) len 16
        Random value: 35b669cba358a48a0000000000000000
< HCI Command: Host Number of Compl.. (0x03|0x0035) plen 5  #77 [hci1] 6.642756
        Num handles: 1
        Handle: 360 Address: DF:A9:FF:F6:B1:1A (OUI DF-A9-FF)
        Count: 1
< ACL Data TX: Handle 360 flags 0x00 dlen 21                #78 [hci1] 6.642896
      SMP: Pairing DHKey Check (0x0d) len 16
        E: 350e224ddc5f61538588d3b15da88dbe
> HCI Event: Number of Completed Packets (0x13) plen 5      #79 [hci1] 6.697036
        Num handles: 1
        Handle: 360 Address: DF:A9:FF:F6:B1:1A (OUI DF-A9-FF)
        Count: 1
        #78: len 21 (3 Kb/s)
        Latency: 54 msec (54-65 msec ~57 msec)
> ACL Data RX: Handle 360 flags 0x02 dlen 21                #80 [hci1] 6.907130
      SMP: Pairing DHKey Check (0x0d) len 16
        E: 767c0666372023e0a6065218ae19538d
< HCI Command: LE Start Encryption (0x08|0x0019) plen 28    #81 [hci1] 6.921969
        Handle: 360 Address: DF:A9:FF:F6:B1:1A (OUI DF-A9-FF)
        Random number: 0x0000000000000000
        Encrypted diversifier: 0x0000
        Long term key: 8192fe6edd70d73a4d1c520cfa190c24
> HCI Event: Command Status (0x0f) plen 4                   #82 [hci1] 6.922883
      LE Start Encryption (0x08|0x0019) ncmd 1
        Status: Success (0x00)
< HCI Command: Host Number of Compl.. (0x03|0x0035) plen 5  #83 [hci1] 6.941888
        Num handles: 1
        Handle: 360 Address: DF:A9:FF:F6:B1:1A (OUI DF-A9-FF)
        Count: 1
> HCI Event: Encryption Change (0x08) plen 4                #84 [hci1] 7.396905
        Status: Success (0x00)
        Handle: 360 Address: DF:A9:FF:F6:B1:1A (OUI DF-A9-FF)
        Encryption: Enabled with AES-CCM (0x01)
< HCI Command: LE Extended Create... (0x08|0x0043) plen 26  #85 [hci1] 7.452133
        Filter policy: Accept list is not used (0x00)
        Own address type: Random (0x03)
        Peer address type: Public (0x00)
        Peer address: 64:23:B5:94:C5:F1 (OUI 64-23-B5)
        Initiating PHYs: 0x01
        Entry 0: LE 1M
          Scan interval: 60.000 msec (0x0060)
          Scan window: 60.000 msec (0x0060)
          Min connection interval: 50.00 msec (0x0028)
          Max connection interval: 70.00 msec (0x0038)
          Connection latency: 0 (0x0000)
          Supervision timeout: 4000 msec (0x0190)
          Min connection length: 0.000 msec (0x0000)
          Max connection length: 0.000 msec (0x0000)
> HCI Event: Command Status (0x0f) plen 4                   #86 [hci1] 7.453209
      LE Extended Create Connection (0x08|0x0043) ncmd 1
        Status: Success (0x00)
> ACL Data RX: Handle 360 flags 0x02 dlen 21                #87 [hci1] 7.467236
      SMP: Identity Information (0x08) len 16
        Identity resolving key: b44831fbbe03b97844b9fcc17b1ef1ba
< HCI Command: Host Number of Compl.. (0x03|0x0035) plen 5  #88 [hci1] 7.481980
        Num handles: 1
        Handle: 360 Address: DF:A9:FF:F6:B1:1A (OUI DF-A9-FF)
        Count: 1
> HCI Event: LE Meta Event (0x3e) plen 31                   #89 [hci1] 7.527598
      LE Enhanced Connection Complete (0x0a)
        Status: Success (0x00)
        Handle: 991
        Role: Central (0x00)
        Peer address type: Public (0x00)
        Peer address: 64:23:B5:94:C5:F1 (OUI 64-23-B5)
        Local resolvable private address: 48:61:8E:DB:C6:F9 (Resolvable)
        Peer resolvable private address: 00:00:00:00:00:00 (Non-Resolvable)
        Connection interval: 70.00 msec (0x0038)
        Connection latency: 0 (0x0000)
        Supervision timeout: 4000 msec (0x0190)
        Central clock accuracy: 0x00
> ACL Data RX: Handle 360 flags 0x02 dlen 12                #90 [hci1] 7.537001
      SMP: Identity Address Information (0x09) len 7
        Address: DF:A9:FF:F6:B1:1A (OUI DF-A9-FF)
< HCI Command: LE Read Remote Used... (0x08|0x0016) plen 2  #91 [hci1] 7.541950
        Handle: 991 Address: 64:23:B5:94:C5:F1 (OUI 64-23-B5)
< ACL Data TX: Handle 991 flags 0x00 dlen 7                 #92 [hci1] 7.541956
      ATT: Exchange MTU Request (0x02) len 2
        Client RX MTU: 251
> HCI Event: Command Status (0x0f) plen 4                   #93 [hci1] 7.542483
      LE Read Remote Used Features (0x08|0x0016) ncmd 1
        Status: Success (0x00)
< HCI Command: LE Set PHY (0x08|0x0032) plen 7              #94 [hci1] 7.561722
        Handle: 991 Address: 64:23:B5:94:C5:F1 (OUI 64-23-B5)
        All PHYs preference: 0x00
        TX PHYs preference: 0x02
          LE 2M
        RX PHYs preference: 0x02
          LE 2M
        PHY options preference: Reserved (0x0000)
> HCI Event: Command Status (0x0f) plen 4                   #95 [hci1] 7.562261
      LE Set PHY (0x08|0x0032) ncmd 1
        Status: Success (0x00)
> HCI Event: Number of Completed Packets (0x13) plen 5      #96 [hci1] 7.566939
        Num handles: 1
        Handle: 991 Address: 64:23:B5:94:C5:F1 (OUI 64-23-B5)
        Count: 1
        #92: len 7 (2 Kb/s)
        Latency: 24 msec (24-24 msec ~24 msec)
< HCI Command: LE Add Device To Re.. (0x08|0x0027) plen 39  #97 [hci1] 7.581931
        Address type: Public (0x00)
        Address: DF:A9:FF:F6:B1:1A (OUI DF-A9-FF)
        Peer identity resolving key: b44831fbbe03b97844b9fcc17b1ef1ba
        Local identity resolving key: 08aad2e1be87e47b88aeb19de6889efb
> HCI Event: Command Complete (0x0e) plen 4                 #98 [hci1] 7.582844
      LE Add Device To Resolving List (0x08|0x0027) ncmd 1
        Status: Success (0x00)
< HCI Command: LE Set Privacy Mode (0x08|0x004e) plen 8     #99 [hci1] 7.601807
        Peer Identity address type: Public (0x00)
        Peer Identity address: DF:A9:FF:F6:B1:1A (OUI DF-A9-FF)
        Privacy Mode: Use Device Privacy (0x01)
> HCI Event: Command Complete (0x0e) plen 4                #100 [hci1] 7.602349
      LE Set Privacy Mode (0x08|0x004e) ncmd 1
        Status: Success (0x00)
< HCI Command: LE Set Address Reso.. (0x08|0x002d) plen 1  #101 [hci1] 7.622075
        Address resolution: Enabled (0x01)
> HCI Event: Command Complete (0x0e) plen 4                #102 [hci1] 7.622488
      LE Set Address Resolution Enable (0x08|0x002d) ncmd 1
        Status: Success (0x00)
> ACL Data RX: Handle 991 flags 0x02 dlen 7                #103 [hci1] 7.637082
      ATT: Exchange MTU Response (0x03) len 2
        Server RX MTU: 23
< HCI Command: Host Number of Comp.. (0x03|0x0035) plen 5  #104 [hci1] 7.642078
        Num handles: 1
        Handle: 360 Address: DF:A9:FF:F6:B1:1A (OUI DF-A9-FF)
        Count: 1
< ACL Data TX: Handle 360 flags 0x00 dlen 21               #105 [hci1] 7.642260
      SMP: Identity Information (0x08) len 16
        Identity resolving key: 08aad2e1be87e47b88aeb19de6889efb
< ACL Data TX: Handle 360 flags 0x00 dlen 12               #106 [hci1] 7.642413
      SMP: Identity Address Information (0x09) len 7
        Address: D5:B6:CC:31:DB:3B (Static)
< HCI Command: Host Number of Comp.. (0x03|0x0035) plen 5  #107 [hci1] 7.642686
        Num handles: 1
        Handle: 991 Address: 64:23:B5:94:C5:F1 (OUI 64-23-B5)
        Count: 1
> HCI Event: Number of Completed Packets (0x13) plen 5     #108 [hci1] 7.676914
        Num handles: 1
        Handle: 360 Address: DF:A9:FF:F6:B1:1A (OUI DF-A9-FF)
        Count: 1
        #105: len 21 (4 Kb/s)
        Latency: 34 msec (34-65 msec ~45 msec)
> HCI Event: Number of Completed Packets (0x13) plen 5     #109 [hci1] 7.677429
        Num handles: 1
        Handle: 360 Address: DF:A9:FF:F6:B1:1A (OUI DF-A9-FF)
        Count: 1
        #106: len 12 (2 Kb/s)
        Latency: 35 msec (34-65 msec ~40 msec)
< ACL Data TX: Handle 360 flags 0x00 dlen 11               #110 [hci1] 7.682113
      ATT: Read By Type Request (0x08) len 6
        Handle range: 0x0001-0xffff
        Attribute type: Central Address Resolution (0x2aa6)
> HCI Event: LE Meta Event (0x3e) plen 12                  #111 [hci1] 7.707070
      LE Read Remote Used Features (0x04)
        Status: Success (0x00)
        Handle: 991 Address: 64:23:B5:94:C5:F1 (OUI 64-23-B5)
        Features: 0x2d 0x49 0x00 0xf7 0x67 0xd9 0x00 0x80
          LE Encryption
          Extended Reject Indication
          Peripheral-initiated Features Exchange
          LE Data Packet Length Extension
          LE 2M PHY
          LE Coded PHY
          Channel Selection Algorithm #2
          Periodic Advertising Sync Transfer - Sender
          Periodic Advertising Sync Transfer - Recipient
          Sleep Clock Accuracy Updates
          Connected Isochronous Stream - Central
          Connected Isochronous Stream - Peripheral
          Isochronous Broadcaster
          Synchronized Receiver
          Connected Isochronous Stream (Host Support)
          LE Power Control Request
          LE Power Control Request
          Connection Subrating
          Connection Subrating (Host Support)
          Unknown features (0x8000d90000000000)
> HCI Event: Number of Completed Packets (0x13) plen 5     #112 [hci1] 7.747041
        Num handles: 1
        Handle: 360 Address: DF:A9:FF:F6:B1:1A (OUI DF-A9-FF)
        Count: 1
        #110: len 11 (1 Kb/s)
        Latency: 64 msec (34-65 msec ~52 msec)
> ACL Data RX: Handle 360 flags 0x02 dlen 9                #113 [hci1] 7.817002
      ATT: Read By Type Response (0x09) len 4
        Attribute data length: 3
        Attribute data list: 1 entry
        Handle: 0x000f
        Value: 01
< HCI Command: Host Number of Comp.. (0x03|0x0035) plen 5  #114 [hci1] 7.822347
        Num handles: 1
        Handle: 360 Address: DF:A9:FF:F6:B1:1A (OUI DF-A9-FF)
        Count: 1
> HCI Event: LE Meta Event (0x3e) plen 6                   #115 [hci1] 8.406454
      LE PHY Update Complete (0x0c)
        Status: Success (0x00)
        Handle: 991 Address: 64:23:B5:94:C5:F1 (OUI 64-23-B5)
        TX PHY: LE 2M (0x02)
        RX PHY: LE 2M (0x02)
< ACL Data TX: Handle 991 flags 0x00 dlen 11              #116 [hci1] 17.652572
      SMP: Pairing Request (0x01) len 6
        IO capability: NoInputNoOutput (0x03)
        OOB data: Authentication data not present (0x00)
        Authentication requirement: Bonding, No MITM, SC, No Keypresses (0x09)
        Max encryption key size: 16
        Initiator key distribution: EncKey IdKey (0x03)
        Responder key distribution: EncKey IdKey (0x03)
> HCI Event: Number of Completed Packets (0x13) plen 5    #117 [hci1] 17.716697
        Num handles: 1
        Handle: 991 Address: 64:23:B5:94:C5:F1 (OUI 64-23-B5)
        Count: 1
        #116: len 11 (1 Kb/s)
        Latency: 64 msec (24-64 msec ~44 msec)
> ACL Data RX: Handle 991 flags 0x02 dlen 11              #118 [hci1] 17.786753
      SMP: Pairing Response (0x02) len 6
        IO capability: KeyboardDisplay (0x04)
        OOB data: Authentication data not present (0x00)
        Authentication requirement: Bonding, No MITM, SC, No Keypresses (0x09)
        Max encryption key size: 16
        Initiator key distribution: EncKey IdKey (0x03)
        Responder key distribution: EncKey IdKey (0x03)
< HCI Command: Host Number of Com.. (0x03|0x0035) plen 5  #119 [hci1] 17.802266
        Num handles: 1
        Handle: 991 Address: 64:23:B5:94:C5:F1 (OUI 64-23-B5)
        Count: 1
< ACL Data TX: Handle 991 flags 0x00 dlen 27              #120 [hci1] 17.802463
< ACL Data TX: Handle 991 flags 0x01 dlen 27              #121 [hci1] 17.802480
< ACL Data TX: Handle 991 flags 0x01 dlen 15              #122 [hci1] 17.802484
      SMP: Pairing Public Key (0x0c) len 64
        X: 68f6ada634ce84d11617383d57f070fe3445c38b33b569efa5eb771a0dc8aea5
        Y: 83c407aaa8337331fdc418e55085d75e6c1c6e5d42f8bf9c18fb5a2a7d4f31aa
> HCI Event: Number of Completed Packets (0x13) plen 5    #123 [hci1] 17.856696
        Num handles: 1
        Handle: 991 Address: 64:23:B5:94:C5:F1 (OUI 64-23-B5)
        Count: 1
        #120: len 27 (4 Kb/s)
        Latency: 54 msec (24-64 msec ~49 msec)
> HCI Event: Number of Completed Packets (0x13) plen 5    #124 [hci1] 17.857160
        Num handles: 1
        Handle: 991 Address: 64:23:B5:94:C5:F1 (OUI 64-23-B5)
        Count: 1
        #121: len 27 (4 Kb/s)
        Latency: 54 msec (24-64 msec ~52 msec)
> HCI Event: Number of Completed Packets (0x13) plen 5    #125 [hci1] 17.857670
        Num handles: 1
        Handle: 991 Address: 64:23:B5:94:C5:F1 (OUI 64-23-B5)
        Count: 1
        #122: len 15 (2 Kb/s)
        Latency: 55 msec (24-64 msec ~53 msec)
> ACL Data RX: Handle 991 flags 0x02 dlen 27              #126 [hci1] 17.926932
> ACL Data RX: Handle 991 flags 0x01 dlen 27              #127 [hci1] 17.927398
> ACL Data RX: Handle 991 flags 0x01 dlen 15              #128 [hci1] 17.927760
      SMP: Pairing Public Key (0x0c) len 64
        X: df02e95005435e488506561d161672ccf283940e895036b62e4ef8b1cf7c2362
        Y: 23f72b3bdc14583a04e0436abbd7d69ab555aded31b9a83ed4d9e09aa229bbfb
< HCI Command: Host Number of Com.. (0x03|0x0035) plen 5  #129 [hci1] 17.942172
        Num handles: 1
        Handle: 991 Address: 64:23:B5:94:C5:F1 (OUI 64-23-B5)
        Count: 1
< HCI Command: Host Number of Com.. (0x03|0x0035) plen 5  #130 [hci1] 17.942315
        Num handles: 1
        Handle: 991 Address: 64:23:B5:94:C5:F1 (OUI 64-23-B5)
        Count: 1
< HCI Command: Host Number of Com.. (0x03|0x0035) plen 5  #131 [hci1] 17.942358
        Num handles: 1
        Handle: 991 Address: 64:23:B5:94:C5:F1 (OUI 64-23-B5)
        Count: 1
> ACL Data RX: Handle 991 flags 0x02 dlen 21              #132 [hci1] 17.996869
      SMP: Pairing Confirm (0x03) len 16
        Confim value: 87f909957ff1e384129ef558f7739e64
< HCI Command: Host Number of Com.. (0x03|0x0035) plen 5  #133 [hci1] 18.001800
        Num handles: 1
        Handle: 991 Address: 64:23:B5:94:C5:F1 (OUI 64-23-B5)
        Count: 1
< ACL Data TX: Handle 991 flags 0x00 dlen 21              #134 [hci1] 18.001881
      SMP: Pairing Random (0x04) len 16
        Random value: 1ec8845e8286bc235a02440d0c3424a2
> HCI Event: Number of Completed Packets (0x13) plen 5    #135 [hci1] 18.066696
        Num handles: 1
        Handle: 991 Address: 64:23:B5:94:C5:F1 (OUI 64-23-B5)
        Count: 1
        #134: len 21 (2 Kb/s)
        Latency: 64 msec (24-64 msec ~59 msec)
> ACL Data RX: Handle 991 flags 0x02 dlen 21              #136 [hci1] 18.136950
      SMP: Pairing Random (0x04) len 16
        Random value: 45d46b398e4f10400000000000000000
< HCI Command: Host Number of Com.. (0x03|0x0035) plen 5  #137 [hci1] 18.142566
        Num handles: 1
        Handle: 991 Address: 64:23:B5:94:C5:F1 (OUI 64-23-B5)
        Count: 1
< ACL Data TX: Handle 991 flags 0x00 dlen 21              #138 [hci1] 18.142647
      SMP: Pairing DHKey Check (0x0d) len 16
        E: cd0d8a9a7d55688a5415aab1efebab53
> HCI Event: Number of Completed Packets (0x13) plen 5    #139 [hci1] 18.206655
        Num handles: 1
        Handle: 991 Address: 64:23:B5:94:C5:F1 (OUI 64-23-B5)
        Count: 1
        #138: len 21 (2 Kb/s)
        Latency: 64 msec (24-64 msec ~61 msec)
> ACL Data RX: Handle 991 flags 0x02 dlen 21              #140 [hci1] 18.486877
      SMP: Pairing DHKey Check (0x0d) len 16
        E: 960507abe8cda67cfafeaea30f5777c0
< HCI Command: LE Start Encryption (0x08|0x0019) plen 28  #141 [hci1] 18.502344
        Handle: 991 Address: 64:23:B5:94:C5:F1 (OUI 64-23-B5)
        Random number: 0x0000000000000000
        Encrypted diversifier: 0x0000
        Long term key: b35d4bc7ab4c27cf9e976d12ebdb52fc
> HCI Event: Command Status (0x0f) plen 4                 #142 [hci1] 18.503232
      LE Start Encryption (0x08|0x0019) ncmd 1
        Status: Success (0x00)
< HCI Command: Host Number of Com.. (0x03|0x0035) plen 5  #143 [hci1] 18.522028
        Num handles: 1
        Handle: 991 Address: 64:23:B5:94:C5:F1 (OUI 64-23-B5)
        Count: 1
> HCI Event: Encryption Change (0x08) plen 4              #144 [hci1] 18.976605
        Status: Success (0x00)
        Handle: 991 Address: 64:23:B5:94:C5:F1 (OUI 64-23-B5)
        Encryption: Enabled with AES-CCM (0x01)
> ACL Data RX: Handle 991 flags 0x02 dlen 21              #145 [hci1] 19.046932
      SMP: Identity Information (0x08) len 16
        Identity resolving key: 1b47c7eb88ca29472515194318ce79c0
< HCI Command: Host Number of Com.. (0x03|0x0035) plen 5  #146 [hci1] 19.062219
        Num handles: 1
        Handle: 991 Address: 64:23:B5:94:C5:F1 (OUI 64-23-B5)
        Count: 1
< HCI Command: LE Extended Creat.. (0x08|0x0043) plen 26  #147 [hci1] 19.081750
        Filter policy: Accept list is not used (0x00)
        Own address type: Random (0x03)
        Peer address type: Public (0x00)
        Peer address: B8:7C:99:F9:E0:AE (OUI B8-7C-99)
        Initiating PHYs: 0x01
        Entry 0: LE 1M
          Scan interval: 60.000 msec (0x0060)
          Scan window: 60.000 msec (0x0060)
          Min connection interval: 50.00 msec (0x0028)
          Max connection interval: 70.00 msec (0x0038)
          Connection latency: 0 (0x0000)
          Supervision timeout: 4000 msec (0x0190)
          Min connection length: 0.000 msec (0x0000)
          Max connection length: 0.000 msec (0x0000)
> HCI Event: Command Status (0x0f) plen 4                 #148 [hci1] 19.082790
      LE Extended Create Connection (0x08|0x0043) ncmd 1
        Status: Success (0x00)
> ACL Data RX: Handle 991 flags 0x02 dlen 12              #149 [hci1] 19.116874
      SMP: Identity Address Information (0x09) len 7
        Address: 64:23:B5:94:C5:F1 (OUI 64-23-B5)
< HCI Command: Host Number of Com.. (0x03|0x0035) plen 5  #150 [hci1] 19.121850
        Num handles: 1
        Handle: 991 Address: 64:23:B5:94:C5:F1 (OUI 64-23-B5)
        Count: 1
< ACL Data TX: Handle 991 flags 0x00 dlen 21              #151 [hci1] 19.121884
      SMP: Identity Information (0x08) len 16
        Identity resolving key: 08aad2e1be87e47b88aeb19de6889efb
< ACL Data TX: Handle 991 flags 0x00 dlen 12              #152 [hci1] 19.121913
      SMP: Identity Address Information (0x09) len 7
        Address: D5:B6:CC:31:DB:3B (Static)
> HCI Event: LE Meta Event (0x3e) plen 31                 #153 [hci1] 19.147655
      LE Enhanced Connection Complete (0x0a)
        Status: Success (0x00)
        Handle: 146
        Role: Central (0x00)
        Peer address type: Public (0x00)
        Peer address: B8:7C:99:F9:E0:AE (OUI B8-7C-99)
        Local resolvable private address: 48:61:8E:DB:C6:F9 (Resolvable)
          Identity type: Random (0x01)
          Identity: D5:B6:CC:31:DB:3B (Static)
        Peer resolvable private address: 00:00:00:00:00:00 (Non-Resolvable)
        Connection interval: 70.00 msec (0x0038)
        Connection latency: 0 (0x0000)
        Supervision timeout: 4000 msec (0x0190)
        Central clock accuracy: 0x00
< HCI Command: LE Read Remote Use.. (0x08|0x0016) plen 2  #154 [hci1] 19.161954
        Handle: 146 Address: B8:7C:99:F9:E0:AE (OUI B8-7C-99)
< ACL Data TX: Handle 146 flags 0x00 dlen 7               #155 [hci1] 19.161977
      ATT: Exchange MTU Request (0x02) len 2
        Client RX MTU: 251
> HCI Event: Command Status (0x0f) plen 4                 #156 [hci1] 19.162552
      LE Read Remote Used Features (0x08|0x0016) ncmd 1
        Status: Success (0x00)
< HCI Command: LE Set PHY (0x08|0x0032) plen 7            #157 [hci1] 19.181754
        Handle: 146 Address: B8:7C:99:F9:E0:AE (OUI B8-7C-99)
        All PHYs preference: 0x00
        TX PHYs preference: 0x02
          LE 2M
        RX PHYs preference: 0x02
          LE 2M
        PHY options preference: Reserved (0x0000)
> HCI Event: Command Status (0x0f) plen 4                 #158 [hci1] 19.182275
      LE Set PHY (0x08|0x0032) ncmd 1
        Status: Success (0x00)
> HCI Event: Number of Completed Packets (0x13) plen 5    #159 [hci1] 19.186696
        Num handles: 1
        Handle: 991 Address: 64:23:B5:94:C5:F1 (OUI 64-23-B5)
        Count: 1
        #151: len 21 (2 Kb/s)
        Latency: 64 msec (24-64 msec ~63 msec)
> HCI Event: Number of Completed Packets (0x13) plen 5    #160 [hci1] 19.187153
        Num handles: 1
        Handle: 991 Address: 64:23:B5:94:C5:F1 (OUI 64-23-B5)
        Count: 1
        #152: len 12 (1 Kb/s)
        Latency: 65 msec (24-65 msec ~64 msec)
< ACL Data TX: Handle 991 flags 0x00 dlen 11              #161 [hci1] 19.202083
      ATT: Read By Type Request (0x08) len 6
        Handle range: 0x000f-0xffff
        Attribute type: Central Address Resolution (0x2aa6)
> HCI Event: Number of Completed Packets (0x13) plen 5    #162 [hci1] 19.216660
        Num handles: 1
        Handle: 146 Address: B8:7C:99:F9:E0:AE (OUI B8-7C-99)
        Count: 1
        #155: len 7 (1 Kb/s)
        Latency: 54 msec (54-54 msec ~54 msec)
> HCI Event: Number of Completed Packets (0x13) plen 5    #163 [hci1] 19.256728
        Num handles: 1
        Handle: 991 Address: 64:23:B5:94:C5:F1 (OUI 64-23-B5)
        Count: 1
        #161: len 11 (1 Kb/s)
        Latency: 54 msec (24-65 msec ~59 msec)
> ACL Data RX: Handle 146 flags 0x02 dlen 7               #164 [hci1] 19.286853
      ATT: Exchange MTU Response (0x03) len 2
        Server RX MTU: 23
< HCI Command: Host Number of Com.. (0x03|0x0035) plen 5  #165 [hci1] 19.302392
        Num handles: 1
        Handle: 146 Address: B8:7C:99:F9:E0:AE (OUI B8-7C-99)
        Count: 1
> ACL Data RX: Handle 991 flags 0x02 dlen 9               #166 [hci1] 19.326709
      ATT: Read By Type Response (0x09) len 4
        Attribute data length: 3
        Attribute data list: 1 entry
        Handle: 0x000f
        Value: 01
< HCI Command: Host Number of Com.. (0x03|0x0035) plen 5  #167 [hci1] 19.342449
        Num handles: 1
        Handle: 991 Address: 64:23:B5:94:C5:F1 (OUI 64-23-B5)
        Count: 1
> HCI Event: LE Meta Event (0x3e) plen 12                 #168 [hci1] 19.356944
      LE Read Remote Used Features (0x04)
        Status: Success (0x00)
        Handle: 146 Address: B8:7C:99:F9:E0:AE (OUI B8-7C-99)
        Features: 0x2d 0x49 0x00 0xf7 0x67 0xd9 0x00 0x80
          LE Encryption
          Extended Reject Indication
          Peripheral-initiated Features Exchange
          LE Data Packet Length Extension
          LE 2M PHY
          LE Coded PHY
          Channel Selection Algorithm #2
          Periodic Advertising Sync Transfer - Sender
          Periodic Advertising Sync Transfer - Recipient
          Sleep Clock Accuracy Updates
          Connected Isochronous Stream - Central
          Connected Isochronous Stream - Peripheral
          Isochronous Broadcaster
          Synchronized Receiver
          Connected Isochronous Stream (Host Support)
          LE Power Control Request
          LE Power Control Request
          Connection Subrating
          Connection Subrating (Host Support)
          Unknown features (0x8000d90000000000)
> HCI Event: LE Meta Event (0x3e) plen 6                  #169 [hci1] 20.056187
      LE PHY Update Complete (0x0c)
        Status: Success (0x00)
        Handle: 146 Address: B8:7C:99:F9:E0:AE (OUI B8-7C-99)
        TX PHY: LE 2M (0x02)
        RX PHY: LE 2M (0x02)
< ACL Data TX: Handle 146 flags 0x00 dlen 11              #170 [hci1] 29.272666
      SMP: Pairing Request (0x01) len 6
        IO capability: NoInputNoOutput (0x03)
        OOB data: Authentication data not present (0x00)
        Authentication requirement: Bonding, No MITM, SC, No Keypresses (0x09)
        Max encryption key size: 16
        Initiator key distribution: EncKey IdKey (0x03)
        Responder key distribution: EncKey IdKey (0x03)
> HCI Event: Number of Completed Packets (0x13) plen 5    #171 [hci1] 29.296387
        Num handles: 1
        Handle: 146 Address: B8:7C:99:F9:E0:AE (OUI B8-7C-99)
        Count: 1
        #170: len 11 (3 Kb/s)
        Latency: 23 msec (23-54 msec ~39 msec)
> ACL Data RX: Handle 146 flags 0x02 dlen 11              #172 [hci1] 29.366542
      SMP: Pairing Response (0x02) len 6
        IO capability: KeyboardDisplay (0x04)
        OOB data: Authentication data not present (0x00)
        Authentication requirement: Bonding, No MITM, SC, No Keypresses (0x09)
        Max encryption key size: 16
        Initiator key distribution: EncKey IdKey (0x03)
        Responder key distribution: EncKey IdKey (0x03)
< HCI Command: Host Number of Com.. (0x03|0x0035) plen 5  #173 [hci1] 29.382518
        Num handles: 1
        Handle: 146 Address: B8:7C:99:F9:E0:AE (OUI B8-7C-99)
        Count: 1
< ACL Data TX: Handle 146 flags 0x00 dlen 27              #174 [hci1] 29.382689
< ACL Data TX: Handle 146 flags 0x01 dlen 27              #175 [hci1] 29.382708
< ACL Data TX: Handle 146 flags 0x01 dlen 15              #176 [hci1] 29.382713
      SMP: Pairing Public Key (0x0c) len 64
        X: 68f6ada634ce84d11617383d57f070fe3445c38b33b569efa5eb771a0dc8aea5
        Y: 83c407aaa8337331fdc418e55085d75e6c1c6e5d42f8bf9c18fb5a2a7d4f31aa
> HCI Event: Number of Completed Packets (0x13) plen 5    #177 [hci1] 29.436496
        Num handles: 1
        Handle: 146 Address: B8:7C:99:F9:E0:AE (OUI B8-7C-99)
        Count: 1
        #174: len 27 (4 Kb/s)
        Latency: 53 msec (23-54 msec ~46 msec)
> HCI Event: Number of Completed Packets (0x13) plen 5    #178 [hci1] 29.436938
        Num handles: 1
        Handle: 146 Address: B8:7C:99:F9:E0:AE (OUI B8-7C-99)
        Count: 1
        #175: len 27 (4 Kb/s)
        Latency: 54 msec (23-54 msec ~50 msec)
> HCI Event: Number of Completed Packets (0x13) plen 5    #179 [hci1] 29.437346
        Num handles: 1
        Handle: 146 Address: B8:7C:99:F9:E0:AE (OUI B8-7C-99)
        Count: 1
        #176: len 15 (2 Kb/s)
        Latency: 54 msec (23-54 msec ~52 msec)
> ACL Data RX: Handle 146 flags 0x02 dlen 27              #180 [hci1] 29.506619
> ACL Data RX: Handle 146 flags 0x01 dlen 27              #181 [hci1] 29.507117
> ACL Data RX: Handle 146 flags 0x01 dlen 15              #182 [hci1] 29.507489
      SMP: Pairing Public Key (0x0c) len 64
        X: 28bdb436be3394d4878d71a1febb044998e0465fe6b803cff80f3158785720f1
        Y: 0ba42e520cec67fa01280ca033c966d5f36864778564c6b9bd421f8b5b91c9f4
< HCI Command: Host Number of Com.. (0x03|0x0035) plen 5  #183 [hci1] 29.522258
        Num handles: 1
        Handle: 146 Address: B8:7C:99:F9:E0:AE (OUI B8-7C-99)
        Count: 1
< HCI Command: Host Number of Com.. (0x03|0x0035) plen 5  #184 [hci1] 29.522350
        Num handles: 1
        Handle: 146 Address: B8:7C:99:F9:E0:AE (OUI B8-7C-99)
        Count: 1
< HCI Command: Host Number of Com.. (0x03|0x0035) plen 5  #185 [hci1] 29.522461
        Num handles: 1
        Handle: 146 Address: B8:7C:99:F9:E0:AE (OUI B8-7C-99)
        Count: 1
> ACL Data RX: Handle 146 flags 0x02 dlen 21              #186 [hci1] 29.576651
      SMP: Pairing Confirm (0x03) len 16
        Confim value: 866a1e91034bc30f66cbe2c274f1daa8
< HCI Command: Host Number of Com.. (0x03|0x0035) plen 5  #187 [hci1] 29.582155
        Num handles: 1
        Handle: 146 Address: B8:7C:99:F9:E0:AE (OUI B8-7C-99)
        Count: 1
< ACL Data TX: Handle 146 flags 0x00 dlen 21              #188 [hci1] 29.582229
      SMP: Pairing Random (0x04) len 16
        Random value: fd71a45c4a1bcadd27bd58e945097b00
> HCI Event: Number of Completed Packets (0x13) plen 5    #189 [hci1] 29.646465
        Num handles: 1
        Handle: 146 Address: B8:7C:99:F9:E0:AE (OUI B8-7C-99)
        Count: 1
        #188: len 21 (2 Kb/s)
        Latency: 64 msec (23-64 msec ~58 msec)
> ACL Data RX: Handle 146 flags 0x02 dlen 21              #190 [hci1] 29.716710
      SMP: Pairing Random (0x04) len 16
        Random value: 6b03737100564e9f0000000000000000
< HCI Command: Host Number of Com.. (0x03|0x0035) plen 5  #191 [hci1] 29.722707
        Num handles: 1
        Handle: 146 Address: B8:7C:99:F9:E0:AE (OUI B8-7C-99)
        Count: 1
< ACL Data TX: Handle 146 flags 0x00 dlen 21              #192 [hci1] 29.722858
      SMP: Pairing DHKey Check (0x0d) len 16
        E: 3cfd02d56798a4b47a64213b286404d2
> HCI Event: Number of Completed Packets (0x13) plen 5    #193 [hci1] 29.786414
        Num handles: 1
        Handle: 146 Address: B8:7C:99:F9:E0:AE (OUI B8-7C-99)
        Count: 1
        #192: len 21 (2 Kb/s)
        Latency: 63 msec (23-64 msec ~60 msec)
> ACL Data RX: Handle 146 flags 0x02 dlen 21              #194 [hci1] 30.066636
      SMP: Pairing DHKey Check (0x0d) len 16
        E: e01b660af1efb294b71324080fd92bfc
< HCI Command: LE Start Encryption (0x08|0x0019) plen 28  #195 [hci1] 30.082230
        Handle: 146 Address: B8:7C:99:F9:E0:AE (OUI B8-7C-99)
        Random number: 0x0000000000000000
        Encrypted diversifier: 0x0000
        Long term key: 2d4a04a823e2a0829a319fa1aaa7c877
> HCI Event: Command Status (0x0f) plen 4                 #196 [hci1] 30.083098
      LE Start Encryption (0x08|0x0019) ncmd 1
        Status: Success (0x00)
< HCI Command: Host Number of Com.. (0x03|0x0035) plen 5  #197 [hci1] 30.102107
        Num handles: 1
        Handle: 146 Address: B8:7C:99:F9:E0:AE (OUI B8-7C-99)
        Count: 1
> HCI Event: Encryption Change (0x08) plen 4              #198 [hci1] 30.556350
        Status: Success (0x00)
        Handle: 146 Address: B8:7C:99:F9:E0:AE (OUI B8-7C-99)
        Encryption: Enabled with AES-CCM (0x01)
> ACL Data RX: Handle 146 flags 0x02 dlen 21              #199 [hci1] 30.626674
      SMP: Identity Information (0x08) len 16
        Identity resolving key: 82475ddb51919a17067236c5b57f01c6
< HCI Command: Host Number of Com.. (0x03|0x0035) plen 5  #200 [hci1] 30.642261
        Num handles: 1
        Handle: 146 Address: B8:7C:99:F9:E0:AE (OUI B8-7C-99)
        Count: 1
> ACL Data RX: Handle 146 flags 0x02 dlen 12              #201 [hci1] 30.696571
      SMP: Identity Address Information (0x09) len 7
        Address: B8:7C:99:F9:E0:AE (OUI B8-7C-99)
< HCI Command: LE Set Address Res.. (0x08|0x002d) plen 1  #202 [hci1] 30.702437
        Address resolution: Disabled (0x00)
> HCI Event: Command Complete (0x0e) plen 4               #203 [hci1] 30.702987
      LE Set Address Resolution Enable (0x08|0x002d) ncmd 1
        Status: Success (0x00)
< HCI Command: LE Add Device To... (0x08|0x0027) plen 39  #204 [hci1] 30.722338
        Address type: Public (0x00)
        Address: B8:7C:99:F9:E0:AE (OUI B8-7C-99)
        Peer identity resolving key: 82475ddb51919a17067236c5b57f01c6
        Local identity resolving key: 08aad2e1be87e47b88aeb19de6889efb
> HCI Event: Command Complete (0x0e) plen 4               #205 [hci1] 30.723328
      LE Add Device To Resolving List (0x08|0x0027) ncmd 1
        Status: Success (0x00)
< HCI Command: LE Set Privacy Mode (0x08|0x004e) plen 8   #206 [hci1] 30.742287
        Peer Identity address type: Public (0x00)
        Peer Identity address: B8:7C:99:F9:E0:AE (OUI B8-7C-99)
        Privacy Mode: Use Device Privacy (0x01)
> HCI Event: Command Complete (0x0e) plen 4               #207 [hci1] 30.742834
      LE Set Privacy Mode (0x08|0x004e) ncmd 1
        Status: Success (0x00)
< HCI Command: LE Set Address Res.. (0x08|0x002d) plen 1  #208 [hci1] 30.762289
        Address resolution: Enabled (0x01)
> HCI Event: Command Complete (0x0e) plen 4               #209 [hci1] 30.762747
      LE Set Address Resolution Enable (0x08|0x002d) ncmd 1
        Status: Success (0x00)
< HCI Command: Host Number of Com.. (0x03|0x0035) plen 5  #210 [hci1] 30.782206
        Num handles: 1
        Handle: 146 Address: B8:7C:99:F9:E0:AE (OUI B8-7C-99)
        Count: 1
< ACL Data TX: Handle 146 flags 0x00 dlen 21              #211 [hci1] 30.782349
      SMP: Identity Information (0x08) len 16
        Identity resolving key: 08aad2e1be87e47b88aeb19de6889efb
< ACL Data TX: Handle 146 flags 0x00 dlen 12              #212 [hci1] 30.782430
      SMP: Identity Address Information (0x09) len 7
        Address: D5:B6:CC:31:DB:3B (Static)
> HCI Event: Number of Completed Packets (0x13) plen 5    #213 [hci1] 30.836344
        Num handles: 1
        Handle: 146 Address: B8:7C:99:F9:E0:AE (OUI B8-7C-99)
        Count: 1
        #211: len 21 (3 Kb/s)
        Latency: 53 msec (23-64 msec ~57 msec)
