Bluetooth monitor ver 5.72
= Note: Linux version 6.14.0-36-generic (x86_64)                       0.959848
= Note: Bluetooth subsystem version 2.22                               0.959850
= New Index: 00:00:00:00:00:00 (Primary,UART,hci1)              [hci1] 0.959851
= New Index: 48:5F:99:8E:E0:64 (Primary,USB,hci0)               [hci0] 0.959851
= Open Index: 00:00:00:00:00:00                                 [hci1] 1.073774
= Index Info: 00:00:00:00:00:00 (Nordic Semiconductor ASA)      [hci1] 1.073791
@ USER Open: main (privileged) version 2.22            {0x0001} [hci1] 1.073799
< HCI Command: Reset (0x03|0x0003) plen 0                    #1 [hci1] 1.075145
> HCI Event: Command Complete (0x0e) plen 4                  #2 [hci1] 1.075699
      Reset (0x03|0x0003) ncmd 1
        Status: Success (0x00)
< HCI Command: Read Local Supported... (0x04|0x0003) plen 0  #3 [hci1] 1.093611
> HCI Event: Command Complete (0x0e) plen 12                 #4 [hci1] 1.094235
      Read Local Supported Features (0x04|0x0003) ncmd 1
        Status: Success (0x00)
        Features: 0x00 0x00 0x00 0x00 0x60 0x00 0x00 0x00
          BR/EDR Not Supported
          LE Supported (Controller)
< HCI Command: Read Local Version In.. (0x04|0x0001) plen 0  #5 [hci1] 1.113277
> HCI Event: Command Complete (0x0e) plen 12                 #6 [hci1] 1.113848
      Read Local Version Information (0x04|0x0001) ncmd 1
        Status: Success (0x00)
        HCI version: Reserved (0x0f) - Revision 12393 (0x3069)
        LMP version: Reserved (0x0f) - Subversion 12393 (0x3069)
        Manufacturer: Nordic Semiconductor ASA (89)
< HCI Command: Read Local Supported... (0x04|0x0002) plen 0  #7 [hci1] 1.133206
> HCI Event: Command Complete (0x0e) plen 68                 #8 [hci1] 1.134310
      Read Local Supported Commands (0x04|0x0002) ncmd 1
        Status: Success (0x00)
        Commands: 119 entries
          Disconnect (Octet 0 - Bit 5)
          Read Remote Version Information (Octet 2 - Bit 7)
          Set Event Mask (Octet 5 - Bit 6)
          Reset (Octet 5 - Bit 7)
          Read Connection Accept Timeout (Octet 7 - Bit 2)
          Write Connection Accept Timeout (Octet 7 - Bit 3)
          Read Transmit Power Level (Octet 10 - Bit 2)
          Set Controller To Host Flow Control (Octet 10 - Bit 5)
          Host Buffer Size (Octet 10 - Bit 6)
          Host Number of Completed Packets (Octet 10 - Bit 7)
          Read Local Version Information (Octet 14 - Bit 3)
          Read Local Supported Features (Octet 14 - Bit 5)
          Read BD ADDR (Octet 15 - Bit 1)
          Read RSSI (Octet 15 - Bit 5)
          Set Event Mask Page 2 (Octet 22 - Bit 2)
          LE Set Event Mask (Octet 25 - Bit 0)
          LE Read Buffer Size (Octet 25 - Bit 1)
          LE Read Local Supported Features (Octet 25 - Bit 2)
          LE Set Random Address (Octet 25 - Bit 4)
          LE Set Advertising Parameters (Octet 25 - Bit 5)
          LE Read Advertising Channel TX Power (Octet 25 - Bit 6)
          LE Set Advertising Data (Octet 25 - Bit 7)
          LE Set Scan Response Data (Octet 26 - Bit 0)
          LE Set Advertise Enable (Octet 26 - Bit 1)
          LE Set Scan Parameters (Octet 26 - Bit 2)
          LE Set Scan Enable (Octet 26 - Bit 3)
          LE Create Connection (Octet 26 - Bit 4)
          LE Create Connection Cancel (Octet 26 - Bit 5)
          LE Read Accept List Size (Octet 26 - Bit 6)
          LE Clear Accept List (Octet 26 - Bit 7)
          LE Add Device To Accept List (Octet 27 - Bit 0)
          LE Remove Device From Accept List (Octet 27 - Bit 1)
          LE Connection Update (Octet 27 - Bit 2)
          LE Set Host Channel Classification (Octet 27 - Bit 3)
          LE Read Channel Map (Octet 27 - Bit 4)
          LE Read Remote Used Features (Octet 27 - Bit 5)
          LE Encrypt (Octet 27 - Bit 6)
          LE Rand (Octet 27 - Bit 7)
          LE Start Encryption (Octet 28 - Bit 0)
          LE Long Term Key Request Reply (Octet 28 - Bit 1)
          LE Long Term Key Request Neg Reply (Octet 28 - Bit 2)
          LE Read Supported States (Octet 28 - Bit 3)
          LE Receiver Test (Octet 28 - Bit 4)
          LE Transmitter Test (Octet 28 - Bit 5)
          LE Test End (Octet 28 - Bit 6)
          Read Authenticated Payload Timeout (Octet 32 - Bit 4)
          Write Authenticated Payload Timeout (Octet 32 - Bit 5)
          LE Set Data Length (Octet 33 - Bit 6)
          LE Read Suggested Default Data Length (Octet 33 - Bit 7)
          LE Write Suggested Default Data Length (Octet 34 - Bit 0)
          LE Add Device To Resolving List (Octet 34 - Bit 3)
          LE Remove Device From Resolving List (Octet 34 - Bit 4)
          LE Clear Resolving List (Octet 34 - Bit 5)
          LE Read Resolving List Size (Octet 34 - Bit 6)
          LE Set Address Resolution Enable (Octet 35 - Bit 1)
          LE Set Resolvable Private Address Timeout (Octet 35 - Bit 2)
          LE Read Maximum Data Length (Octet 35 - Bit 3)
          LE Read PHY (Octet 35 - Bit 4)
          LE Set Default PHY (Octet 35 - Bit 5)
          LE Set PHY (Octet 35 - Bit 6)
          LE Enhanced Receiver Test (Octet 35 - Bit 7)
          LE Enhanced Transmitter Test (Octet 36 - Bit 0)
          LE Set Advertising Set Random Address (Octet 36 - Bit 1)
          LE Set Extended Advertising Parameters (Octet 36 - Bit 2)
          LE Set Extended Advertising Data (Octet 36 - Bit 3)
          LE Set Extended Scan Response Data (Octet 36 - Bit 4)
          LE Set Extended Advertising Enable (Octet 36 - Bit 5)
          LE Read Maximum Advertising Data Length (Octet 36 - Bit 6)
          LE Read Number of Supported Advertising Sets (Octet 36 - Bit 7)
          LE Remove Advertising Set (Octet 37 - Bit 0)
          LE Clear Advertising Sets (Octet 37 - Bit 1)
          LE Set Periodic Advertising Parameters (Octet 37 - Bit 2)
          LE Set Periodic Advertising Data (Octet 37 - Bit 3)
          LE Set Periodic Advertising Enable (Octet 37 - Bit 4)
          LE Set Extended Scan Parameters (Octet 37 - Bit 5)
          LE Set Extended Scan Enable (Octet 37 - Bit 6)
          LE Extended Create Connection (Octet 37 - Bit 7)
          LE Periodic Advertising Create Sync (Octet 38 - Bit 0)
          LE Periodic Advertising Create Sync Cancel (Octet 38 - Bit 1)
          LE Periodic Advertising Terminate Sync (Octet 38 - Bit 2)
          LE Add Device To Periodic Advertiser List (Octet 38 - Bit 3)
          LE Remove Device From Periodic Advertiser List (Octet 38 - Bit 4)
          LE Clear Periodic Advertiser List (Octet 38 - Bit 5)
          LE Read Periodic Advertiser List Size (Octet 38 - Bit 6)
          LE Read Transmit Power (Octet 38 - Bit 7)
          LE Read RF Path Compensation (Octet 39 - Bit 0)
          LE Write RF Path Compensation (Octet 39 - Bit 1)
          LE Set Privacy Mode (Octet 39 - Bit 2)
          LE Periodic Advertising Receive Enable (Octet 40 - Bit 5)
          LE Periodic Advertising Sync Transfer (Octet 40 - Bit 6)
          LE Periodic Advertising Set Info Transfer (Octet 40 - Bit 7)
          LE Periodic Advertising Sync Transfer Parameters (Octet 41 - Bit 0)
          LE Set Default Periodic Advertisng Sync Transfer Parameters (Octet 41 - Bit 1)
          LE Read Buffer v2 (Octet 41 - Bit 5)
          LE Read ISO TX Sync (Octet 41 - Bit 6)
          LE Set Connected Isochronous Group Parameters (Octet 41 - Bit 7)
          LE Set Connected Isochronous Group Parameters Test (Octet 42 - Bit 0)
          LE Create Connected Isochronous Stream (Octet 42 - Bit 1)
          LE Remove Connected Isochronous Group (Octet 42 - Bit 2)
          LE Accept Connected Isochronous Stream Request (Octet 42 - Bit 3)
          LE Reject Connected Isochronous Stream Request (Octet 42 - Bit 4)
          LE Create Broadcast Isochronous Group (Octet 42 - Bit 5)
          LE Create Broadcast Isochronous Group Test (Octet 42 - Bit 6)
          LE Terminate Broadcast Isochronous Group (Octet 42 - Bit 7)
          LE Broadcast Isochronous Group Create Sync (Octet 43 - Bit 0)
          LE Broadcast Isochronous Group Terminate Sync (Octet 43 - Bit 1)
          LE Request Peer SCA (Octet 43 - Bit 2)
          LE Setup Isochronous Data Path (Octet 43 - Bit 3)
          LE Remove Isochronous Data Path (Octet 43 - Bit 4)
          LE Isochronous Transmit Test (Octet 43 - Bit 5)
          LE Isochronous Receive Test (Octet 43 - Bit 6)
          LE Isochronous Read Test Counters (Octet 43 - Bit 7)
          LE Isochronous Read Test Counters (Octet 44 - Bit 0)
          LE Set Host Feature (Octet 44 - Bit 1)
          Octet 44 - Bit 2 
          Octet 45 - Bit 6 
          Octet 46 - Bit 0 
          Octet 46 - Bit 1 
          Octet 46 - Bit 2 
< HCI Command: Host Buffer Size (0x03|0x0033) plen 7         #9 [hci1] 1.153192
        ACL MTU: 255  ACL max packet: 16
        SCO MTU: 0    SCO max packet: 0
> HCI Event: Command Complete (0x0e) plen 4                 #10 [hci1] 1.153729
      Host Buffer Size (0x03|0x0033) ncmd 1
        Status: Success (0x00)
< HCI Command: Set Controller To Ho.. (0x03|0x0031) plen 1  #11 [hci1] 1.173219
        Flow control: ACL Data Packets (0x01)
> HCI Event: Command Complete (0x0e) plen 4                 #12 [hci1] 1.173727
      Set Controller To Host Flow Control (0x03|0x0031) ncmd 1
        Status: Success (0x00)
< HCI Command: LE Read Local Suppor.. (0x08|0x0003) plen 0  #13 [hci1] 1.193200
> HCI Event: Command Complete (0x0e) plen 12                #14 [hci1] 1.193697
      LE Read Local Supported Features (0x08|0x0003) ncmd 1
        Status: Success (0x00)
        Features: 0xfd 0x79 0x00 0xf7 0x30 0x01 0x00 0x00
          LE Encryption
          Extended Reject Indication
          Peripheral-initiated Features Exchange
          LE Ping
          LE Data Packet Length Extension
          LL Privacy
          Extended Scanner Filter Policies
          LE 2M PHY
          LE Coded PHY
          LE Extended Advertising
          LE Periodic Advertising
          Channel Selection Algorithm #2
          Periodic Advertising Sync Transfer - Sender
          Periodic Advertising Sync Transfer - Recipient
          Sleep Clock Accuracy Updates
          Connected Isochronous Stream - Central
          Connected Isochronous Stream - Peripheral
          Isochronous Broadcaster
          Synchronized Receiver
          Periodic Advertising ADI support
          Connection Subrating
          Unknown features (0x0000010000000000)
< HCI Command: LE Set Host Feature (0x08|0x0074) plen 2     #15 [hci1] 1.213207
        Bit Number: 32
          Connected Isochronous Stream (Host Support)
        Bit Value: 1
> HCI Event: Command Complete (0x0e) plen 4                 #16 [hci1] 1.213590
      LE Set Host Feature (0x08|0x0074) ncmd 1
        Status: Success (0x00)
< HCI Command: LE Read Buffer v2 (0x08|0x0060) plen 0       #17 [hci1] 1.233196
> HCI Event: Command Complete (0x0e) plen 10                #18 [hci1] 1.233634
      LE Read Buffer v2 (0x08|0x0060) ncmd 1
        Status: Success (0x00)
        ACL MTU: 27
        ACL max packet: 3
        ISO MTU: 318
        ISO max packet: 3
< HCI Command: LE Read Maximum Adve.. (0x08|0x003a) plen 0  #19 [hci1] 1.253236
> HCI Event: Command Complete (0x0e) plen 6                 #20 [hci1] 1.253710
      LE Read Maximum Advertising Data Length (0x08|0x003a) ncmd 1
        Status: Success (0x00)
        Max length: 1650
< HCI Command: LE Read Supported St.. (0x08|0x001c) plen 0  #21 [hci1] 1.273199
> HCI Event: Command Complete (0x0e) plen 12                #22 [hci1] 1.273701
      LE Read Supported States (0x08|0x001c) ncmd 1
        Status: Success (0x00)
        States: 0x000003ff3e0306ff
          Non-connectable Advertising State
          Scannable Advertising State
          Connectable Advertising State
          High Duty Cycle Directed Advertising State
          Passive Scanning State
          Active Scanning State
          Initiating State
            and Connection State (Central Role)
          Connection State (Peripheral Role)
          Scannable Advertising State
            and Passive Scanning State
          Connectable Advertising State
            and Passive Scanning State
          Non-connectable Advertising State
            and Initiating State
          Scannable Advertising State
            and Initiating State
          Active Scanning State
            and Connection State (Central Role)
          Passive Scanning State
            and Connection State (Peripheral Role)
          Active Scanning State
            and Connection State (Peripheral Role)
          Initiating State
            and Connection State (Central Role)
            and Central Role & Central Role
          Low Duty Cycle Directed Advertising State
          Connectable Advertising State
            and Initiating State
            and Central Role & Peripheral Role
          High Duty Cycle Directed Advertising State
            and Initiating State
            and Central Role & Peripheral Role
          Low Duty Cycle Directed Advertising State
            and Initiating State
            and Central Role & Peripheral Role
          Connectable Advertising State
            and Connection State (Central Role)
            and Central Role & Peripheral Role
          High Duty Cycle Directed Advertising State
            and Connection State (Central Role)
            and Central Role & Peripheral Role
          Low Duty Cycle Directed Advertising State
            and Connection State (Central Role)
            and Central Role & Peripheral Role
          Connectable Advertising State
            and Connection State (Peripheral Role)
            and Central Role & Peripheral Role
          High Duty Cycle Directed Advertising State
            and Connection State (Peripheral Role)
            and Peripheral Role & Peripheral Role
          Low Duty Cycle Directed Advertising State
            and Connection State (Peripheral Role)
            and Peripheral Role & Peripheral Role
          Initiating State
            and Connection State (Peripheral Role)
            and Central Role & Peripheral Role
< HCI Command: LE Read Maximum Data.. (0x08|0x002f) plen 0  #23 [hci1] 1.293194
> HCI Event: Command Complete (0x0e) plen 12                #24 [hci1] 1.293656
      LE Read Maximum Data Length (0x08|0x002f) ncmd 1
        Status: Success (0x00)
        Max TX octets: 251
        Max TX time: 2704
        Max RX octets: 251
        Max RX time: 2704
< HCI Command: LE Write Suggested D.. (0x08|0x0024) plen 4  #25 [hci1] 1.313232
        TX octets: 251
        TX time: 2704
> HCI Event: Command Complete (0x0e) plen 4                 #26 [hci1] 1.313802
      LE Write Suggested Default Data Length (0x08|0x0024) ncmd 1
        Status: Success (0x00)
< HCI Command: LE Read Resolving Li.. (0x08|0x002a) plen 0  #27 [hci1] 1.333208
> HCI Event: Command Complete (0x0e) plen 5                 #28 [hci1] 1.333653
      LE Read Resolving List Size (0x08|0x002a) ncmd 1
        Status: Success (0x00)
        Size: 8
< HCI Command: LE Set Event Mask (0x08|0x0001) plen 8       #29 [hci1] 1.353188
        Mask: 0x000002023f87fa5e
          LE Advertising Report
          LE Connection Update Complete
          LE Read Remote Used Features Complete
          LE Long Term Key Request
          LE Data Length Change
          LE Enhanced Connection Complete
          LE PHY Update Complete
          LE Extended Advertising Report
          LE Periodic Advertising Sync Established
          LE Periodic Advertising Report
          LE Periodic Advertising Sync Lost
          LE Extended Scan Timeout
          LE Extended Advertising Set Terminated
          LE Scan Request Received
          LE Periodic Advertising Sync Transfer Rvc
          LE CIS Established
          LE CIS Request
          LE Create BIG Complete
          LE Terminate BIG Complete
          LE BIG Sync Estabilished Complete
          LE BIG Sync Lost
          LE BIG Info Advertising Report
          Unknown mask (0x0000020000000000)
> HCI Event: Command Complete (0x0e) plen 4                 #30 [hci1] 1.353813
      LE Set Event Mask (0x08|0x0001) ncmd 1
        Status: Success (0x00)
< HCI Command: Set Event Mask (0x03|0x0001) plen 8          #31 [hci1] 1.373207
        Mask: 0x2000800002008890
          Disconnection Complete
          Encryption Change
          Read Remote Version Information Complete
          Hardware Error
          Data Buffer Overflow
          Encryption Key Refresh Complete
          LE Meta
> HCI Event: Command Complete (0x0e) plen 4                 #32 [hci1] 1.373814
      Set Event Mask (0x03|0x0001) ncmd 1
        Status: Success (0x00)
< HCI Command: Read BD ADDR (0x04|0x0009) plen 0            #33 [hci1] 1.393170
> HCI Event: Command Complete (0x0e) plen 10                #34 [hci1] 1.393675
      Read BD ADDR (0x04|0x0009) ncmd 1
        Status: Success (0x00)
        Address: 00:00:00:00:00:00 (OUI 00-00-00)
< HCI Command: LE Set Random Address (0x08|0x0005) plen 6   #35 [hci1] 1.413207
        Address: D5:B6:CC:31:DB:3B (Static)
> HCI Event: Command Complete (0x0e) plen 4                 #36 [hci1] 1.413716
      LE Set Random Address (0x08|0x0005) ncmd 1
        Status: Success (0x00)
< HCI Command: LE Set Extended Adv.. (0x08|0x0036) plen 25  #37 [hci1] 4.033805
        Handle: 0x00
        Properties: 0x0013
          Connectable
          Scannable
          Use legacy advertising PDUs: ADV_IND
        Min advertising interval: 100.000 msec (0x00a0)
        Max advertising interval: 150.000 msec (0x00f0)
        Channel map: 37, 38, 39 (0x07)
        Own address type: Random (0x01)
        Peer address type: Public (0x00)
        Peer address: 00:00:00:00:00:00 (OUI 00-00-00)
        Filter policy: Allow Scan Request from Any, Allow Connect Request from Any (0x00)
        TX power: Host has no preference (0x7f)
        Primary PHY: LE 1M (0x01)
        Secondary max skip: 0x00
        Secondary PHY: LE 1M (0x01)
        SID: 0x00
        Scan request notifications: Disabled (0x00)
> HCI Event: Command Complete (0x0e) plen 5                 #38 [hci1] 4.034601
      LE Set Extended Advertising Parameters (0x08|0x0036) ncmd 1
        Status: Success (0x00)
        TX power (selected): 0 dbm (0x00)
< HCI Command: LE Set Advertising S.. (0x08|0x0035) plen 7  #39 [hci1] 4.053529
        Advertising handle: 0x00
        Advertising random address: D5:B6:CC:31:DB:3B (Static)
> HCI Event: Command Complete (0x0e) plen 4                 #40 [hci1] 4.054012
      LE Set Advertising Set Random Address (0x08|0x0035) ncmd 1
        Status: Success (0x00)
< HCI Command: LE Set Extended Adv.. (0x08|0x0037) plen 22  #41 [hci1] 4.073291
        Handle: 0x00
        Operation: Complete extended advertising data (0x03)
        Fragment preference: Minimize fragmentation (0x01)
        Data length: 0x12
        Flags: 0x06
          LE General Discoverable Mode
          BR/EDR Not Supported
        Name (complete): Tester_F6B11A
> HCI Event: Command Complete (0x0e) plen 4                 #42 [hci1] 4.074022
      LE Set Extended Advertising Data (0x08|0x0037) ncmd 1
        Status: Success (0x00)
< HCI Command: LE Set Extended Scan.. (0x08|0x0038) plen 4  #43 [hci1] 4.093236
        Handle: 0x00
        Operation: Complete scan response data (0x03)
        Fragment preference: Minimize fragmentation (0x01)
        Data length: 0x00
> HCI Event: Command Complete (0x0e) plen 4                 #44 [hci1] 4.093781
      LE Set Extended Scan Response Data (0x08|0x0038) ncmd 1
        Status: Success (0x00)
< HCI Command: LE Set Extended Adve.. (0x08|0x0039) plen 6  #45 [hci1] 4.113246
        Extended advertising: Enabled (0x01)
        Number of sets: 1 (0x01)
        Entry 0
          Handle: 0x00
          Duration: 0 ms (0x00)
          Max ext adv events: 0
> HCI Event: Command Complete (0x0e) plen 4                 #46 [hci1] 4.113792
      LE Set Extended Advertising Enable (0x08|0x0039) ncmd 1
        Status: Success (0x00)
> HCI Event: LE Meta Event (0x3e) plen 31                   #47 [hci1] 4.221855
      LE Enhanced Connection Complete (0x0a)
        Status: Success (0x00)
        Handle: 3405
        Role: Peripheral (0x01)
        Peer address type: Public (0x00)
        Peer address: DF:A9:FF:F6:B1:1A (OUI DF-A9-FF)
        Local resolvable private address: 00:00:00:00:00:00 (Non-Resolvable)
        Peer resolvable private address: 00:00:00:00:00:00 (Non-Resolvable)
        Connection interval: 87.50 msec (0x0046)
        Connection latency: 0 (0x0000)
        Supervision timeout: 25120 msec (0x09d0)
        Central clock accuracy: 0x01
> HCI Event: LE Meta Event (0x3e) plen 6                    #48 [hci1] 4.221959
      LE Advertising Set Terminated (0x12)
        Status: Success (0x00)
        Handle: 0
        Connection handle: 3405
        Number of completed extended advertising events: 0
< HCI Command: LE Read Remote Used... (0x08|0x0016) plen 2  #49 [hci1] 4.234336
        Handle: 3405 Address: DF:A9:FF:F6:B1:1A (OUI DF-A9-FF)
< ACL Data TX: Handle 3405 flags 0x00 dlen 7                #50 [hci1] 4.234360
      ATT: Exchange MTU Request (0x02) len 2
        Client RX MTU: 251
> HCI Event: Command Status (0x0f) plen 4                   #51 [hci1] 4.234974
      LE Read Remote Used Features (0x08|0x0016) ncmd 1
        Status: Success (0x00)
> HCI Event: Number of Completed Packets (0x13) plen 5      #52 [hci1] 4.397921
        Num handles: 1
        Handle: 3405 Address: DF:A9:FF:F6:B1:1A (OUI DF-A9-FF)
        Count: 1
        #50: len 7 (0 Kb/s)
        Latency: 163 msec (163-163 msec ~163 msec)
> HCI Event: LE Meta Event (0x3e) plen 12                   #53 [hci1] 4.485802
      LE Read Remote Used Features (0x04)
        Status: Success (0x00)
        Handle: 3405 Address: DF:A9:FF:F6:B1:1A (OUI DF-A9-FF)
        Features: 0x2d 0x49 0x00 0xf7 0x67 0xd9 0x00 0x80
          LE Encryption
          Extended Reject Indication
          Peripheral-initiated Features Exchange
          LE Data Packet Length Extension
          LE 2M PHY
          LE Coded PHY
          Channel Selection Algorithm #2
          Periodic Advertising Sync Transfer - Sender
          Periodic Advertising Sync Transfer - Recipient
          Sleep Clock Accuracy Updates
          Connected Isochronous Stream - Central
          Connected Isochronous Stream - Peripheral
          Isochronous Broadcaster
          Synchronized Receiver
          Connected Isochronous Stream (Host Support)
          LE Power Control Request
          LE Power Control Request
          Connection Subrating
          Connection Subrating (Host Support)
          Unknown features (0x8000d90000000000)
> ACL Data RX: Handle 3405 flags 0x02 dlen 11               #54 [hci1] 6.935407
      SMP: Pairing Request (0x01) len 6
        IO capability: KeyboardDisplay (0x04)
        OOB data: Authentication data not present (0x00)
        Authentication requirement: Bonding, MITM, SC, No Keypresses (0x0d)
        Max encryption key size: 16
        Initiator key distribution: EncKey IdKey (0x03)
        Responder key distribution: EncKey IdKey Sign (0x07)
> ACL Data RX: Handle 3405 flags 0x02 dlen 7                #55 [hci1] 6.935888
      ATT: Exchange MTU Response (0x03) len 2
        Server RX MTU: 23
< HCI Command: Host Number of Compl.. (0x03|0x0035) plen 5  #56 [hci1] 6.953443
        Num handles: 1
        Handle: 3405 Address: DF:A9:FF:F6:B1:1A (OUI DF-A9-FF)
        Count: 1
< ACL Data TX: Handle 3405 flags 0x00 dlen 11               #57 [hci1] 6.953517
      SMP: Pairing Response (0x02) len 6
        IO capability: DisplayOnly (0x00)
        OOB data: Authentication data not present (0x00)
        Authentication requirement: Bonding, No MITM, SC, No Keypresses (0x09)
        Max encryption key size: 16
        Initiator key distribution: IdKey (0x02)
        Responder key distribution: <none> (0x00)
< HCI Command: Host Number of Compl.. (0x03|0x0035) plen 5  #58 [hci1] 6.953684
        Num handles: 1
        Handle: 3405 Address: DF:A9:FF:F6:B1:1A (OUI DF-A9-FF)
        Count: 1
> HCI Event: Number of Completed Packets (0x13) plen 5      #59 [hci1] 7.110466
        Num handles: 1
        Handle: 3405 Address: DF:A9:FF:F6:B1:1A (OUI DF-A9-FF)
        Count: 1
        #57: len 11 (0 Kb/s)
        Latency: 156 msec (156-163 msec ~160 msec)
> ACL Data RX: Handle 3405 flags 0x02 dlen 27               #60 [hci1] 7.110947
> ACL Data RX: Handle 3405 flags 0x01 dlen 27               #61 [hci1] 7.111332
> ACL Data RX: Handle 3405 flags 0x01 dlen 15               #62 [hci1] 7.111798
      SMP: Pairing Public Key (0x0c) len 64
        X: 52e9972981f6045c9531e844b9230be0f4ae355aaeaa69ea47642e932b4d8d96
        Y: d689006ee2e499342744f7ed3735b3845112dbb7e824f6f4c302c035662e4f45
< HCI Command: Host Number of Compl.. (0x03|0x0035) plen 5  #63 [hci1] 7.114187
        Num handles: 1
        Handle: 3405 Address: DF:A9:FF:F6:B1:1A (OUI DF-A9-FF)
        Count: 1
< HCI Command: Host Number of Compl.. (0x03|0x0035) plen 5  #64 [hci1] 7.114313
        Num handles: 1
        Handle: 3405 Address: DF:A9:FF:F6:B1:1A (OUI DF-A9-FF)
        Count: 1
< HCI Command: Host Number of Compl.. (0x03|0x0035) plen 5  #65 [hci1] 7.114718
        Num handles: 1
        Handle: 3405 Address: DF:A9:FF:F6:B1:1A (OUI DF-A9-FF)
        Count: 1
< ACL Data TX: Handle 3405 flags 0x00 dlen 27               #66 [hci1] 7.114856
< ACL Data TX: Handle 3405 flags 0x01 dlen 27               #67 [hci1] 7.114899
< ACL Data TX: Handle 3405 flags 0x01 dlen 15               #68 [hci1] 7.114920
      SMP: Pairing Public Key (0x0c) len 64
        X: 98308440221e2d910f0e54b71e7ec652857aa9b5a0dc65028824cc19db1226e9
        Y: 67a4816bcb62efb21701e31fdb27561a6217575fb007a8bbdabe7e28b6f68482
> HCI Event: Number of Completed Packets (0x13) plen 5      #69 [hci1] 7.198389
        Num handles: 1
        Handle: 3405 Address: DF:A9:FF:F6:B1:1A (OUI DF-A9-FF)
        Count: 1
        #66: len 27 (2 Kb/s)
        Latency: 83 msec (83-163 msec ~121 msec)
> HCI Event: Number of Completed Packets (0x13) plen 5      #70 [hci1] 7.199082
        Num handles: 1
        Handle: 3405 Address: DF:A9:FF:F6:B1:1A (OUI DF-A9-FF)
        Count: 1
        #67: len 27 (2 Kb/s)
        Latency: 84 msec (83-163 msec ~103 msec)
> HCI Event: Number of Completed Packets (0x13) plen 5      #71 [hci1] 7.285290
        Num handles: 1
        Handle: 3405 Address: DF:A9:FF:F6:B1:1A (OUI DF-A9-FF)
        Count: 1
        #68: len 15 (0 Kb/s)
        Latency: 170 msec (83-170 msec ~136 msec)
> ACL Data RX: Handle 3405 flags 0x02 dlen 21               #72 [hci1] 8.248125
      SMP: Pairing Confirm (0x03) len 16
        Confim value: 5d60c43b2711330875925bf206118cab
< HCI Command: Host Number of Compl.. (0x03|0x0035) plen 5  #73 [hci1] 8.253738
        Num handles: 1
        Handle: 3405 Address: DF:A9:FF:F6:B1:1A (OUI DF-A9-FF)
        Count: 1
< ACL Data TX: Handle 3405 flags 0x00 dlen 21               #74 [hci1] 8.253850
      SMP: Pairing Confirm (0x03) len 16
        Confim value: f99036e3096b94146eaada284674da9b
> HCI Event: Number of Completed Packets (0x13) plen 5      #75 [hci1] 8.422923
        Num handles: 1
        Handle: 3405 Address: DF:A9:FF:F6:B1:1A (OUI DF-A9-FF)
        Count: 1
        #74: len 21 (0 Kb/s)
        Latency: 169 msec (83-170 msec ~152 msec)
> ACL Data RX: Handle 3405 flags 0x02 dlen 21               #76 [hci1] 8.423318
      SMP: Pairing Random (0x04) len 16
        Random value: f70ebee9f5f985850000000000000000
< HCI Command: Host Number of Compl.. (0x03|0x0035) plen 5  #77 [hci1] 8.434189
        Num handles: 1
        Handle: 3405 Address: DF:A9:FF:F6:B1:1A (OUI DF-A9-FF)
        Count: 1
< ACL Data TX: Handle 3405 flags 0x00 dlen 21               #78 [hci1] 8.434311
      SMP: Pairing Random (0x04) len 16
        Random value: 8e6108f966a694cbe26df70bb96773e6
> HCI Event: Number of Completed Packets (0x13) plen 5      #79 [hci1] 8.597755
        Num handles: 1
        Handle: 3405 Address: DF:A9:FF:F6:B1:1A (OUI DF-A9-FF)
        Count: 1
        #78: len 21 (1 Kb/s)
        Latency: 163 msec (83-170 msec ~158 msec)
> ACL Data RX: Handle 3405 flags 0x02 dlen 21               #80 [hci1] 8.685567
      SMP: Pairing Confirm (0x03) len 16
        Confim value: 95492275262b7049c200038a24ede8c0
< HCI Command: Host Number of Compl.. (0x03|0x0035) plen 5  #81 [hci1] 8.693644
        Num handles: 1
        Handle: 3405 Address: DF:A9:FF:F6:B1:1A (OUI DF-A9-FF)
        Count: 1
< ACL Data TX: Handle 3405 flags 0x00 dlen 21               #82 [hci1] 8.693765
      SMP: Pairing Confirm (0x03) len 16
        Confim value: 9c1b7621158ffc5a1e8d55017d4a43a1
> HCI Event: Number of Completed Packets (0x13) plen 5      #83 [hci1] 8.860404
        Num handles: 1
        Handle: 3405 Address: DF:A9:FF:F6:B1:1A (OUI DF-A9-FF)
        Count: 1
        #82: len 21 (1 Kb/s)
        Latency: 166 msec (83-170 msec ~162 msec)
> ACL Data RX: Handle 3405 flags 0x02 dlen 21               #84 [hci1] 8.860765
      SMP: Pairing Random (0x04) len 16
        Random value: 129054ccc2c670ab0000000000000000
< HCI Command: Host Number of Compl.. (0x03|0x0035) plen 5  #85 [hci1] 8.874114
        Num handles: 1
        Handle: 3405 Address: DF:A9:FF:F6:B1:1A (OUI DF-A9-FF)
        Count: 1
< ACL Data TX: Handle 3405 flags 0x00 dlen 21               #86 [hci1] 8.874269
      SMP: Pairing Random (0x04) len 16
        Random value: 4d02679f89a05211af56d8b3da64d21e
> HCI Event: Number of Completed Packets (0x13) plen 5      #87 [hci1] 9.035178
        Num handles: 1
        Handle: 3405 Address: DF:A9:FF:F6:B1:1A (OUI DF-A9-FF)
        Count: 1
        #86: len 21 (1 Kb/s)
        Latency: 160 msec (83-170 msec ~161 msec)
> ACL Data RX: Handle 3405 flags 0x02 dlen 21               #88 [hci1] 9.123063
      SMP: Pairing Confirm (0x03) len 16
        Confim value: faa3c465fef5c265e0adc6d7cd10361b
< HCI Command: Host Number of Compl.. (0x03|0x0035) plen 5  #89 [hci1] 9.133655
        Num handles: 1
        Handle: 3405 Address: DF:A9:FF:F6:B1:1A (OUI DF-A9-FF)
        Count: 1
< ACL Data TX: Handle 3405 flags 0x00 dlen 21               #90 [hci1] 9.133717
      SMP: Pairing Confirm (0x03) len 16
        Confim value: c27c507eb3122541d2acb3ac8390ae15
> HCI Event: Number of Completed Packets (0x13) plen 5      #91 [hci1] 9.297916
        Num handles: 1
        Handle: 3405 Address: DF:A9:FF:F6:B1:1A (OUI DF-A9-FF)
        Count: 1
        #90: len 21 (1 Kb/s)
        Latency: 164 msec (83-170 msec ~162 msec)
> ACL Data RX: Handle 3405 flags 0x02 dlen 21               #92 [hci1] 9.298270
      SMP: Pairing Random (0x04) len 16
        Random value: f09ad19ca6093ee00000000000000000
< HCI Command: Host Number of Compl.. (0x03|0x0035) plen 5  #93 [hci1] 9.314342
        Num handles: 1
        Handle: 3405 Address: DF:A9:FF:F6:B1:1A (OUI DF-A9-FF)
        Count: 1
< ACL Data TX: Handle 3405 flags 0x00 dlen 21               #94 [hci1] 9.314490
      SMP: Pairing Random (0x04) len 16
        Random value: 5e8286bc235a02440d0c3424a2acf8fd
> HCI Event: Number of Completed Packets (0x13) plen 5      #95 [hci1] 9.472730
        Num handles: 1
        Handle: 3405 Address: DF:A9:FF:F6:B1:1A (OUI DF-A9-FF)
        Count: 1
        #94: len 21 (1 Kb/s)
        Latency: 158 msec (83-170 msec ~160 msec)
> ACL Data RX: Handle 3405 flags 0x02 dlen 21               #96 [hci1] 9.560555
      SMP: Pairing Confirm (0x03) len 16
        Confim value: 34158981423c156f13e8016f2cba30d4
< HCI Command: Host Number of Compl.. (0x03|0x0035) plen 5  #97 [hci1] 9.573906
        Num handles: 1
        Handle: 3405 Address: DF:A9:FF:F6:B1:1A (OUI DF-A9-FF)
        Count: 1
< ACL Data TX: Handle 3405 flags 0x00 dlen 21               #98 [hci1] 9.574045
      SMP: Pairing Confirm (0x03) len 16
        Confim value: 5d18862f87773a46f790365380889ca7
> HCI Event: Number of Completed Packets (0x13) plen 5      #99 [hci1] 9.735467
        Num handles: 1
        Handle: 3405 Address: DF:A9:FF:F6:B1:1A (OUI DF-A9-FF)
        Count: 1
        #98: len 21 (1 Kb/s)
        Latency: 161 msec (83-170 msec ~161 msec)
> ACL Data RX: Handle 3405 flags 0x02 dlen 21              #100 [hci1] 9.735903
      SMP: Pairing Random (0x04) len 16
        Random value: 6bdf3e9c66ba52890000000000000000
< HCI Command: Host Number of Comp.. (0x03|0x0035) plen 5  #101 [hci1] 9.754171
        Num handles: 1
        Handle: 3405 Address: DF:A9:FF:F6:B1:1A (OUI DF-A9-FF)
        Count: 1
< ACL Data TX: Handle 3405 flags 0x00 dlen 21              #102 [hci1] 9.754357
      SMP: Pairing Random (0x04) len 16
        Random value: 5c4a1bcadd27bd58e945097b00bad7ac
> HCI Event: Number of Completed Packets (0x13) plen 5     #103 [hci1] 9.910223
        Num handles: 1
        Handle: 3405 Address: DF:A9:FF:F6:B1:1A (OUI DF-A9-FF)
        Count: 1
        #102: len 21 (1 Kb/s)
        Latency: 155 msec (83-170 msec ~158 msec)
> ACL Data RX: Handle 3405 flags 0x02 dlen 21              #104 [hci1] 9.998030
      SMP: Pairing Confirm (0x03) len 16
        Confim value: 46f51d87e17d27df5e3d4f9c62c2bafc
< HCI Command: Host Number of Com.. (0x03|0x0035) plen 5  #105 [hci1] 10.013926
        Num handles: 1
        Handle: 3405 Address: DF:A9:FF:F6:B1:1A (OUI DF-A9-FF)
        Count: 1
< ACL Data TX: Handle 3405 flags 0x00 dlen 21             #106 [hci1] 10.014129
      SMP: Pairing Confirm (0x03) len 16
        Confim value: ff491b0378c78337604d4c5bb540d28b
> HCI Event: Number of Completed Packets (0x13) plen 5    #107 [hci1] 10.172923
        Num handles: 1
        Handle: 3405 Address: DF:A9:FF:F6:B1:1A (OUI DF-A9-FF)
        Count: 1
        #106: len 21 (1 Kb/s)
        Latency: 158 msec (83-170 msec ~158 msec)
> ACL Data RX: Handle 3405 flags 0x02 dlen 21             #108 [hci1] 10.173259
      SMP: Pairing Random (0x04) len 16
        Random value: f0528fc58a7a669a0000000000000000
< HCI Command: Host Number of Com.. (0x03|0x0035) plen 5  #109 [hci1] 10.174062
        Num handles: 1
        Handle: 3405 Address: DF:A9:FF:F6:B1:1A (OUI DF-A9-FF)
        Count: 1
< ACL Data TX: Handle 3405 flags 0x00 dlen 21             #110 [hci1] 10.174244
      SMP: Pairing Random (0x04) len 16
        Random value: 32527e6e64e79f33b2e374394db8ab2d
> HCI Event: Number of Completed Packets (0x13) plen 5    #111 [hci1] 10.347612
        Num handles: 1
        Handle: 3405 Address: DF:A9:FF:F6:B1:1A (OUI DF-A9-FF)
        Count: 1
        #110: len 21 (0 Kb/s)
        Latency: 173 msec (83-173 msec ~165 msec)
> ACL Data RX: Handle 3405 flags 0x02 dlen 21             #112 [hci1] 10.435522
      SMP: Pairing Confirm (0x03) len 16
        Confim value: d4d2e4f9b88104556b4d4c9603f380e9
< HCI Command: Host Number of Com.. (0x03|0x0035) plen 5  #113 [hci1] 10.453924
        Num handles: 1
        Handle: 3405 Address: DF:A9:FF:F6:B1:1A (OUI DF-A9-FF)
        Count: 1
< ACL Data TX: Handle 3405 flags 0x00 dlen 21             #114 [hci1] 10.454102
      SMP: Pairing Confirm (0x03) len 16
        Confim value: ec914d14f13462373967c49502804b15
> HCI Event: Number of Completed Packets (0x13) plen 5    #115 [hci1] 10.610414
        Num handles: 1
        Handle: 3405 Address: DF:A9:FF:F6:B1:1A (OUI DF-A9-FF)
        Count: 1
        #114: len 21 (1 Kb/s)
        Latency: 156 msec (83-173 msec ~161 msec)
> ACL Data RX: Handle 3405 flags 0x02 dlen 21             #116 [hci1] 10.610780
      SMP: Pairing Random (0x04) len 16
        Random value: 5a8ede8240df2fc10000000000000000
< HCI Command: Host Number of Com.. (0x03|0x0035) plen 5  #117 [hci1] 10.614128
        Num handles: 1
        Handle: 3405 Address: DF:A9:FF:F6:B1:1A (OUI DF-A9-FF)
        Count: 1
< ACL Data TX: Handle 3405 flags 0x00 dlen 21             #118 [hci1] 10.614244
      SMP: Pairing Random (0x04) len 16
        Random value: dddbdfe2838e9a8cc6964353c850fef7
> HCI Event: Number of Completed Packets (0x13) plen 5    #119 [hci1] 10.785161
        Num handles: 1
        Handle: 3405 Address: DF:A9:FF:F6:B1:1A (OUI DF-A9-FF)
        Count: 1
        #118: len 21 (0 Kb/s)
        Latency: 170 msec (83-173 msec ~166 msec)
> ACL Data RX: Handle 3405 flags 0x02 dlen 21             #120 [hci1] 10.873059
      SMP: Pairing Confirm (0x03) len 16
        Confim value: 5b5426461cd1354231595a3fb601a8b0
< HCI Command: Host Number of Com.. (0x03|0x0035) plen 5  #121 [hci1] 10.873572
        Num handles: 1
        Handle: 3405 Address: DF:A9:FF:F6:B1:1A (OUI DF-A9-FF)
        Count: 1
< ACL Data TX: Handle 3405 flags 0x00 dlen 21             #122 [hci1] 10.873671
      SMP: Pairing Confirm (0x03) len 16
        Confim value: 7430d821d0641e166525724c71b96fff
> HCI Event: Number of Completed Packets (0x13) plen 5    #123 [hci1] 11.047933
        Num handles: 1
        Handle: 3405 Address: DF:A9:FF:F6:B1:1A (OUI DF-A9-FF)
        Count: 1
        #122: len 21 (0 Kb/s)
        Latency: 174 msec (83-174 msec ~170 msec)
> ACL Data RX: Handle 3405 flags 0x02 dlen 21             #124 [hci1] 11.048279
      SMP: Pairing Random (0x04) len 16
        Random value: 9ad8921183dcb76c0000000000000000
< HCI Command: Host Number of Com.. (0x03|0x0035) plen 5  #125 [hci1] 11.054126
        Num handles: 1
        Handle: 3405 Address: DF:A9:FF:F6:B1:1A (OUI DF-A9-FF)
        Count: 1
< ACL Data TX: Handle 3405 flags 0x00 dlen 21             #126 [hci1] 11.054301
      SMP: Pairing Random (0x04) len 16
        Random value: eb9f1915536596b6fc3db1c86b2b1970
> HCI Event: Number of Completed Packets (0x13) plen 5    #127 [hci1] 11.222687
        Num handles: 1
        Handle: 3405 Address: DF:A9:FF:F6:B1:1A (OUI DF-A9-FF)
        Count: 1
        #126: len 21 (1 Kb/s)
        Latency: 168 msec (83-174 msec ~169 msec)
> ACL Data RX: Handle 3405 flags 0x02 dlen 21             #128 [hci1] 11.310536
      SMP: Pairing Confirm (0x03) len 16
        Confim value: 21cc6c92f26a834f860c5bfb40c57eb4
< HCI Command: Host Number of Com.. (0x03|0x0035) plen 5  #129 [hci1] 11.313984
        Num handles: 1
        Handle: 3405 Address: DF:A9:FF:F6:B1:1A (OUI DF-A9-FF)
        Count: 1
< ACL Data TX: Handle 3405 flags 0x00 dlen 21             #130 [hci1] 11.314139
      SMP: Pairing Confirm (0x03) len 16
        Confim value: 6c563ecfcc586d35a2d24826103c1f51
> HCI Event: Number of Completed Packets (0x13) plen 5    #131 [hci1] 11.485421
        Num handles: 1
        Handle: 3405 Address: DF:A9:FF:F6:B1:1A (OUI DF-A9-FF)
        Count: 1
        #130: len 21 (0 Kb/s)
        Latency: 171 msec (83-174 msec ~170 msec)
> ACL Data RX: Handle 3405 flags 0x02 dlen 21             #132 [hci1] 11.485758
      SMP: Pairing Random (0x04) len 16
        Random value: 3956713688bf52280000000000000000
< HCI Command: Host Number of Com.. (0x03|0x0035) plen 5  #133 [hci1] 11.494255
        Num handles: 1
        Handle: 3405 Address: DF:A9:FF:F6:B1:1A (OUI DF-A9-FF)
        Count: 1
< ACL Data TX: Handle 3405 flags 0x00 dlen 21             #134 [hci1] 11.494458
      SMP: Pairing Random (0x04) len 16
        Random value: 5c794dc9ad9f2c3f295ebd5ad5e1c3cf
> HCI Event: Number of Completed Packets (0x13) plen 5    #135 [hci1] 11.660158
        Num handles: 1
        Handle: 3405 Address: DF:A9:FF:F6:B1:1A (OUI DF-A9-FF)
        Count: 1
        #134: len 21 (1 Kb/s)
        Latency: 165 msec (83-174 msec ~167 msec)
> ACL Data RX: Handle 3405 flags 0x02 dlen 21             #136 [hci1] 11.748033
      SMP: Pairing Confirm (0x03) len 16
        Confim value: c8d73928894110e62edab4b6260e85ae
< HCI Command: Host Number of Com.. (0x03|0x0035) plen 5  #137 [hci1] 11.753883
        Num handles: 1
        Handle: 3405 Address: DF:A9:FF:F6:B1:1A (OUI DF-A9-FF)
        Count: 1
< ACL Data TX: Handle 3405 flags 0x00 dlen 21             #138 [hci1] 11.753969
      SMP: Pairing Confirm (0x03) len 16
        Confim value: 1750bd93749055d1a246fb6f3a3c01fc
> HCI Event: Number of Completed Packets (0x13) plen 5    #139 [hci1] 11.922994
        Num handles: 1
        Handle: 3405 Address: DF:A9:FF:F6:B1:1A (OUI DF-A9-FF)
        Count: 1
        #138: len 21 (0 Kb/s)
        Latency: 169 msec (83-174 msec ~168 msec)
> ACL Data RX: Handle 3405 flags 0x02 dlen 21             #140 [hci1] 11.923243
      SMP: Pairing Random (0x04) len 16
        Random value: b525af4ff53c241d0000000000000000
< HCI Command: Host Number of Com.. (0x03|0x0035) plen 5  #141 [hci1] 11.934164
        Num handles: 1
        Handle: 3405 Address: DF:A9:FF:F6:B1:1A (OUI DF-A9-FF)
        Count: 1
< ACL Data TX: Handle 3405 flags 0x00 dlen 21             #142 [hci1] 11.934259
      SMP: Pairing Random (0x04) len 16
        Random value: 5c2fff312cdf99c9491988e877355a9a
> HCI Event: Number of Completed Packets (0x13) plen 5    #143 [hci1] 12.097591
        Num handles: 1
        Handle: 3405 Address: DF:A9:FF:F6:B1:1A (OUI DF-A9-FF)
        Count: 1
        #142: len 21 (1 Kb/s)
        Latency: 163 msec (83-174 msec ~165 msec)
> ACL Data RX: Handle 3405 flags 0x02 dlen 21             #144 [hci1] 12.185528
      SMP: Pairing Confirm (0x03) len 16
        Confim value: a2a93c45b98f7cfadfd6fb16072b47bc
< HCI Command: Host Number of Com.. (0x03|0x0035) plen 5  #145 [hci1] 12.193998
        Num handles: 1
        Handle: 3405 Address: DF:A9:FF:F6:B1:1A (OUI DF-A9-FF)
        Count: 1
< ACL Data TX: Handle 3405 flags 0x00 dlen 21             #146 [hci1] 12.194169
      SMP: Pairing Confirm (0x03) len 16
        Confim value: 0cbf39ae65a6ab0868934868c1415157
> HCI Event: Number of Completed Packets (0x13) plen 5    #147 [hci1] 12.360420
        Num handles: 1
        Handle: 3405 Address: DF:A9:FF:F6:B1:1A (OUI DF-A9-FF)
        Count: 1
        #146: len 21 (1 Kb/s)
        Latency: 166 msec (83-174 msec ~166 msec)
> ACL Data RX: Handle 3405 flags 0x02 dlen 21             #148 [hci1] 12.360717
      SMP: Pairing Random (0x04) len 16
        Random value: 7f5c8ac8e3f54c310000000000000000
< HCI Command: Host Number of Com.. (0x03|0x0035) plen 5  #149 [hci1] 12.374177
        Num handles: 1
        Handle: 3405 Address: DF:A9:FF:F6:B1:1A (OUI DF-A9-FF)
        Count: 1
< ACL Data TX: Handle 3405 flags 0x00 dlen 21             #150 [hci1] 12.374367
      SMP: Pairing Random (0x04) len 16
        Random value: c629a3a987d808e808655d558dfc1155
> HCI Event: Number of Completed Packets (0x13) plen 5    #151 [hci1] 12.535162
        Num handles: 1
        Handle: 3405 Address: DF:A9:FF:F6:B1:1A (OUI DF-A9-FF)
        Count: 1
        #150: len 21 (1 Kb/s)
        Latency: 160 msec (83-174 msec ~163 msec)
> ACL Data RX: Handle 3405 flags 0x02 dlen 21             #152 [hci1] 12.623024
      SMP: Pairing Confirm (0x03) len 16
        Confim value: 8069dcbd8bafe8bacbb6cf0a0f15eb4e
< HCI Command: Host Number of Com.. (0x03|0x0035) plen 5  #153 [hci1] 12.633645
        Num handles: 1
        Handle: 3405 Address: DF:A9:FF:F6:B1:1A (OUI DF-A9-FF)
        Count: 1
< ACL Data TX: Handle 3405 flags 0x00 dlen 21             #154 [hci1] 12.633713
      SMP: Pairing Confirm (0x03) len 16
        Confim value: c1507edb999879b8b855379b0901c7b4
> HCI Event: Number of Completed Packets (0x13) plen 5    #155 [hci1] 12.797896
        Num handles: 1
        Handle: 3405 Address: DF:A9:FF:F6:B1:1A (OUI DF-A9-FF)
        Count: 1
        #154: len 21 (1 Kb/s)
        Latency: 164 msec (83-174 msec ~163 msec)
> ACL Data RX: Handle 3405 flags 0x02 dlen 21             #156 [hci1] 12.798243
      SMP: Pairing Random (0x04) len 16
        Random value: 8d0cdd194b36f9c10000000000000000
< HCI Command: Host Number of Com.. (0x03|0x0035) plen 5  #157 [hci1] 12.814197
        Num handles: 1
        Handle: 3405 Address: DF:A9:FF:F6:B1:1A (OUI DF-A9-FF)
        Count: 1
< ACL Data TX: Handle 3405 flags 0x00 dlen 21             #158 [hci1] 12.814273
      SMP: Pairing Random (0x04) len 16
        Random value: 92f20f6ad8f13724432c7fd6001c45ff
> HCI Event: Number of Completed Packets (0x13) plen 5    #159 [hci1] 12.972685
        Num handles: 1
        Handle: 3405 Address: DF:A9:FF:F6:B1:1A (OUI DF-A9-FF)
        Count: 1
        #158: len 21 (1 Kb/s)
        Latency: 158 msec (83-174 msec ~161 msec)
> ACL Data RX: Handle 3405 flags 0x02 dlen 21             #160 [hci1] 13.060506
      SMP: Pairing Confirm (0x03) len 16
        Confim value: a96c3b4a42dda315f9b4a5b7a0d00211
< HCI Command: Host Number of Com.. (0x03|0x0035) plen 5  #161 [hci1] 13.074070
        Num handles: 1
        Handle: 3405 Address: DF:A9:FF:F6:B1:1A (OUI DF-A9-FF)
        Count: 1
< ACL Data TX: Handle 3405 flags 0x00 dlen 21             #162 [hci1] 13.074192
      SMP: Pairing Confirm (0x03) len 16
        Confim value: cd2b38bca8e093939e09e28cb949cdcd
> HCI Event: Number of Completed Packets (0x13) plen 5    #163 [hci1] 13.235276
        Num handles: 1
        Handle: 3405 Address: DF:A9:FF:F6:B1:1A (OUI DF-A9-FF)
        Count: 1
        #162: len 21 (1 Kb/s)
        Latency: 161 msec (83-174 msec ~161 msec)
> ACL Data RX: Handle 3405 flags 0x02 dlen 21             #164 [hci1] 13.235820
      SMP: Pairing Random (0x04) len 16
        Random value: a1150700c5f0e5fc0000000000000000
< HCI Command: Host Number of Com.. (0x03|0x0035) plen 5  #165 [hci1] 13.253584
        Num handles: 1
        Handle: 3405 Address: DF:A9:FF:F6:B1:1A (OUI DF-A9-FF)
        Count: 1
< ACL Data TX: Handle 3405 flags 0x00 dlen 21             #166 [hci1] 13.253619
      SMP: Pairing Random (0x04) len 16
        Random value: 23ac32ebbb5e14c8a6b9622f296d277f
> HCI Event: Number of Completed Packets (0x13) plen 5    #167 [hci1] 13.410215
        Num handles: 1
        Handle: 3405 Address: DF:A9:FF:F6:B1:1A (OUI DF-A9-FF)
        Count: 1
        #166: len 21 (1 Kb/s)
        Latency: 156 msec (83-174 msec ~158 msec)
> ACL Data RX: Handle 3405 flags 0x02 dlen 21             #168 [hci1] 13.497958
      SMP: Pairing Confirm (0x03) len 16
        Confim value: 67227fb0aa681aabab624c4ed70673e2
< HCI Command: Host Number of Com.. (0x03|0x0035) plen 5  #169 [hci1] 13.513702
        Num handles: 1
        Handle: 3405 Address: DF:A9:FF:F6:B1:1A (OUI DF-A9-FF)
        Count: 1
< ACL Data TX: Handle 3405 flags 0x00 dlen 21             #170 [hci1] 13.513771
      SMP: Pairing Confirm (0x03) len 16
        Confim value: 5bfd0343029547f42086e6334466d4d0
> HCI Event: Number of Completed Packets (0x13) plen 5    #171 [hci1] 13.672889
        Num handles: 1
        Handle: 3405 Address: DF:A9:FF:F6:B1:1A (OUI DF-A9-FF)
        Count: 1
        #170: len 21 (1 Kb/s)
        Latency: 159 msec (83-174 msec ~158 msec)
> ACL Data RX: Handle 3405 flags 0x02 dlen 21             #172 [hci1] 13.673174
      SMP: Pairing Random (0x04) len 16
        Random value: 06f36ea81e6027f10000000000000000
< HCI Command: Host Number of Com.. (0x03|0x0035) plen 5  #173 [hci1] 13.674031
        Num handles: 1
        Handle: 3405 Address: DF:A9:FF:F6:B1:1A (OUI DF-A9-FF)
        Count: 1
< ACL Data TX: Handle 3405 flags 0x00 dlen 21             #174 [hci1] 13.674142
      SMP: Pairing Random (0x04) len 16
        Random value: 297efe85e67448a15f56bd27e3a3cf1d
> HCI Event: Number of Completed Packets (0x13) plen 5    #175 [hci1] 13.847616
        Num handles: 1
        Handle: 3405 Address: DF:A9:FF:F6:B1:1A (OUI DF-A9-FF)
        Count: 1
        #174: len 21 (0 Kb/s)
        Latency: 173 msec (83-174 msec ~166 msec)
> ACL Data RX: Handle 3405 flags 0x02 dlen 21             #176 [hci1] 13.935452
      SMP: Pairing Confirm (0x03) len 16
        Confim value: 051b9074359609146aabd748334551f2
< HCI Command: Host Number of Com.. (0x03|0x0035) plen 5  #177 [hci1] 13.953906
        Num handles: 1
        Handle: 3405 Address: DF:A9:FF:F6:B1:1A (OUI DF-A9-FF)
        Count: 1
< ACL Data TX: Handle 3405 flags 0x00 dlen 21             #178 [hci1] 13.954132
      SMP: Pairing Confirm (0x03) len 16
        Confim value: 3de374606fa5964af067de64ba3f4643
> HCI Event: Number of Completed Packets (0x13) plen 5    #179 [hci1] 14.110338
        Num handles: 1
        Handle: 3405 Address: DF:A9:FF:F6:B1:1A (OUI DF-A9-FF)
        Count: 1
        #178: len 21 (1 Kb/s)
        Latency: 156 msec (83-174 msec ~161 msec)
> ACL Data RX: Handle 3405 flags 0x02 dlen 21             #180 [hci1] 14.110700
      SMP: Pairing Random (0x04) len 16
        Random value: 7f030e89bb1048c30000000000000000
< HCI Command: Host Number of Com.. (0x03|0x0035) plen 5  #181 [hci1] 14.114190
        Num handles: 1
        Handle: 3405 Address: DF:A9:FF:F6:B1:1A (OUI DF-A9-FF)
        Count: 1
< ACL Data TX: Handle 3405 flags 0x00 dlen 21             #182 [hci1] 14.114338
      SMP: Pairing Random (0x04) len 16
        Random value: 25a9493fd3ce4faf02be7293595bb7c6
> HCI Event: Number of Completed Packets (0x13) plen 5    #183 [hci1] 14.285223
        Num handles: 1
        Handle: 3405 Address: DF:A9:FF:F6:B1:1A (OUI DF-A9-FF)
        Count: 1
        #182: len 21 (0 Kb/s)
        Latency: 170 msec (83-174 msec ~166 msec)
> ACL Data RX: Handle 3405 flags 0x02 dlen 21             #184 [hci1] 14.372968
      SMP: Pairing Confirm (0x03) len 16
        Confim value: f37581bb5fe8086af92989e264738fb3
< HCI Command: Host Number of Com.. (0x03|0x0035) plen 5  #185 [hci1] 14.373805
        Num handles: 1
        Handle: 3405 Address: DF:A9:FF:F6:B1:1A (OUI DF-A9-FF)
        Count: 1
< ACL Data TX: Handle 3405 flags 0x00 dlen 21             #186 [hci1] 14.373854
      SMP: Pairing Confirm (0x03) len 16
        Confim value: 09f3aa38513c72ae526c3c9b19d220b8
> HCI Event: Number of Completed Packets (0x13) plen 5    #187 [hci1] 14.547841
        Num handles: 1
        Handle: 3405 Address: DF:A9:FF:F6:B1:1A (OUI DF-A9-FF)
        Count: 1
        #186: len 21 (0 Kb/s)
        Latency: 173 msec (83-174 msec ~170 msec)
> ACL Data RX: Handle 3405 flags 0x02 dlen 21             #188 [hci1] 14.548222
      SMP: Pairing Random (0x04) len 16
        Random value: 1e282b6893ff28d90000000000000000
< HCI Command: Host Number of Com.. (0x03|0x0035) plen 5  #189 [hci1] 14.554360
        Num handles: 1
        Handle: 3405 Address: DF:A9:FF:F6:B1:1A (OUI DF-A9-FF)
        Count: 1
< ACL Data TX: Handle 3405 flags 0x00 dlen 21             #190 [hci1] 14.554560
      SMP: Pairing Random (0x04) len 16
        Random value: 58f6b41f855a6f6c3560debd84e2affc
> HCI Event: Number of Completed Packets (0x13) plen 5    #191 [hci1] 14.722674
        Num handles: 1
        Handle: 3405 Address: DF:A9:FF:F6:B1:1A (OUI DF-A9-FF)
        Count: 1
        #190: len 21 (1 Kb/s)
        Latency: 168 msec (83-174 msec ~169 msec)
> ACL Data RX: Handle 3405 flags 0x02 dlen 21             #192 [hci1] 14.810525
      SMP: Pairing Confirm (0x03) len 16
        Confim value: c689fc39956554e087f6690a21f23c21
< HCI Command: Host Number of Com.. (0x03|0x0035) plen 5  #193 [hci1] 14.814023
        Num handles: 1
        Handle: 3405 Address: DF:A9:FF:F6:B1:1A (OUI DF-A9-FF)
        Count: 1
< ACL Data TX: Handle 3405 flags 0x00 dlen 21             #194 [hci1] 14.814104
      SMP: Pairing Confirm (0x03) len 16
        Confim value: d98386ce1ad46d4d16890d7b7c4b9513
> HCI Event: Number of Completed Packets (0x13) plen 5    #195 [hci1] 14.985294
        Num handles: 1
        Handle: 3405 Address: DF:A9:FF:F6:B1:1A (OUI DF-A9-FF)
        Count: 1
        #194: len 21 (0 Kb/s)
        Latency: 171 msec (83-174 msec ~170 msec)
> ACL Data RX: Handle 3405 flags 0x02 dlen 21             #196 [hci1] 14.985661
      SMP: Pairing Random (0x04) len 16
        Random value: 18d503e1e3fe079d0000000000000000
< HCI Command: Host Number of Com.. (0x03|0x0035) plen 5  #197 [hci1] 14.994210
        Num handles: 1
        Handle: 3405 Address: DF:A9:FF:F6:B1:1A (OUI DF-A9-FF)
        Count: 1
< ACL Data TX: Handle 3405 flags 0x00 dlen 21             #198 [hci1] 14.994327
      SMP: Pairing Random (0x04) len 16
        Random value: b67e7216d5bf664139eda2b542549666
> HCI Event: Number of Completed Packets (0x13) plen 5    #199 [hci1] 15.160160
        Num handles: 1
        Handle: 3405 Address: DF:A9:FF:F6:B1:1A (OUI DF-A9-FF)
        Count: 1
        #198: len 21 (1 Kb/s)
        Latency: 165 msec (83-174 msec ~167 msec)
> ACL Data RX: Handle 3405 flags 0x02 dlen 21             #200 [hci1] 15.247923
      SMP: Pairing Confirm (0x03) len 16
        Confim value: 7e8207a60349f0bb7a03823b80e594dc
< HCI Command: Host Number of Com.. (0x03|0x0035) plen 5  #201 [hci1] 15.253979
        Num handles: 1
        Handle: 3405 Address: DF:A9:FF:F6:B1:1A (OUI DF-A9-FF)
        Count: 1
< ACL Data TX: Handle 3405 flags 0x00 dlen 21             #202 [hci1] 15.254140
      SMP: Pairing Confirm (0x03) len 16
        Confim value: d8073f5b7968f0d27dd75c884eb2d124
> HCI Event: Number of Completed Packets (0x13) plen 5    #203 [hci1] 15.422828
        Num handles: 1
        Handle: 3405 Address: DF:A9:FF:F6:B1:1A (OUI DF-A9-FF)
        Count: 1
        #202: len 21 (1 Kb/s)
        Latency: 168 msec (83-174 msec ~168 msec)
> ACL Data RX: Handle 3405 flags 0x02 dlen 21             #204 [hci1] 15.423218
      SMP: Pairing Random (0x04) len 16
        Random value: fca1b647d90957740000000000000000
< HCI Command: Host Number of Com.. (0x03|0x0035) plen 5  #205 [hci1] 15.434113
        Num handles: 1
        Handle: 3405 Address: DF:A9:FF:F6:B1:1A (OUI DF-A9-FF)
        Count: 1
< ACL Data TX: Handle 3405 flags 0x00 dlen 21             #206 [hci1] 15.434226
      SMP: Pairing Random (0x04) len 16
        Random value: ed17f76500c95219dd01e09d1e63f87b
> HCI Event: Number of Completed Packets (0x13) plen 5    #207 [hci1] 15.597578
        Num handles: 1
        Handle: 3405 Address: DF:A9:FF:F6:B1:1A (OUI DF-A9-FF)
        Count: 1
        #206: len 21 (1 Kb/s)
        Latency: 163 msec (83-174 msec ~165 msec)
> ACL Data RX: Handle 3405 flags 0x02 dlen 21             #208 [hci1] 15.685528
      SMP: Pairing Confirm (0x03) len 16
        Confim value: 2f46d788edb8c4de6da1451612f9b5ac
< HCI Command: Host Number of Com.. (0x03|0x0035) plen 5  #209 [hci1] 15.693947
        Num handles: 1
        Handle: 3405 Address: DF:A9:FF:F6:B1:1A (OUI DF-A9-FF)
        Count: 1
< ACL Data TX: Handle 3405 flags 0x00 dlen 21             #210 [hci1] 15.694102
      SMP: Pairing Confirm (0x03) len 16
        Confim value: 3a07ef1ba7314ecf6e1984cef33fed4d
> HCI Event: Number of Completed Packets (0x13) plen 5    #211 [hci1] 15.860321
        Num handles: 1
        Handle: 3405 Address: DF:A9:FF:F6:B1:1A (OUI DF-A9-FF)
        Count: 1
        #210: len 21 (1 Kb/s)
        Latency: 166 msec (83-174 msec ~166 msec)
> ACL Data RX: Handle 3405 flags 0x02 dlen 21             #212 [hci1] 15.860675
      SMP: Pairing Random (0x04) len 16
        Random value: b2d0a25e5e2a3d680000000000000000
< HCI Command: Host Number of Com.. (0x03|0x0035) plen 5  #213 [hci1] 15.874217
        Num handles: 1
        Handle: 3405 Address: DF:A9:FF:F6:B1:1A (OUI DF-A9-FF)
        Count: 1
< ACL Data TX: Handle 3405 flags 0x00 dlen 21             #214 [hci1] 15.874338
      SMP: Pairing Random (0x04) len 16
        Random value: 81d35d47e1f6006d79c974bd9d9e1ee3
> HCI Event: Number of Completed Packets (0x13) plen 5    #215 [hci1] 16.035145
        Num handles: 1
        Handle: 3405 Address: DF:A9:FF:F6:B1:1A (OUI DF-A9-FF)
        Count: 1
        #214: len 21 (1 Kb/s)
        Latency: 160 msec (83-174 msec ~163 msec)
> ACL Data RX: Handle 3405 flags 0x02 dlen 21             #216 [hci1] 16.122943
      SMP: Pairing Confirm (0x03) len 16
        Confim value: beb415ea022320b00d6b7ad30d641768
< HCI Command: Host Number of Com.. (0x03|0x0035) plen 5  #217 [hci1] 16.133955
        Num handles: 1
        Handle: 3405 Address: DF:A9:FF:F6:B1:1A (OUI DF-A9-FF)
        Count: 1
< ACL Data TX: Handle 3405 flags 0x00 dlen 21             #218 [hci1] 16.134053
      SMP: Pairing Confirm (0x03) len 16
        Confim value: 8bb2f30d4fb963a7d0961b8ba89928ca
> HCI Event: Number of Completed Packets (0x13) plen 5    #219 [hci1] 16.297888
        Num handles: 1
        Handle: 3405 Address: DF:A9:FF:F6:B1:1A (OUI DF-A9-FF)
        Count: 1
        #218: len 21 (1 Kb/s)
        Latency: 163 msec (83-174 msec ~163 msec)
> ACL Data RX: Handle 3405 flags 0x02 dlen 21             #220 [hci1] 16.298137
      SMP: Pairing Random (0x04) len 16
        Random value: a7e6be61b0cabd300000000000000000
< HCI Command: Host Number of Com.. (0x03|0x0035) plen 5  #221 [hci1] 16.314262
        Num handles: 1
        Handle: 3405 Address: DF:A9:FF:F6:B1:1A (OUI DF-A9-FF)
        Count: 1
< ACL Data TX: Handle 3405 flags 0x00 dlen 21             #222 [hci1] 16.314357
      SMP: Pairing Random (0x04) len 16
        Random value: e7f7e0c2476823e41736a7e381bafb7c
> HCI Event: Number of Completed Packets (0x13) plen 5    #223 [hci1] 16.472573
        Num handles: 1
        Handle: 3405 Address: DF:A9:FF:F6:B1:1A (OUI DF-A9-FF)
        Count: 1
        #222: len 21 (1 Kb/s)
        Latency: 158 msec (83-174 msec ~160 msec)
> ACL Data RX: Handle 3405 flags 0x02 dlen 21             #224 [hci1] 16.560482
      SMP: Pairing Confirm (0x03) len 16
        Confim value: cdee1174bf09ebea463c191a71d8f323
< HCI Command: Host Number of Com.. (0x03|0x0035) plen 5  #225 [hci1] 16.574107
        Num handles: 1
        Handle: 3405 Address: DF:A9:FF:F6:B1:1A (OUI DF-A9-FF)
        Count: 1
< ACL Data TX: Handle 3405 flags 0x00 dlen 21             #226 [hci1] 16.574270
      SMP: Pairing Confirm (0x03) len 16
        Confim value: 14f3711753128133c14b848efdb7d8fd
> HCI Event: Number of Completed Packets (0x13) plen 5    #227 [hci1] 16.735341
        Num handles: 1
        Handle: 3405 Address: DF:A9:FF:F6:B1:1A (OUI DF-A9-FF)
        Count: 1
        #226: len 21 (1 Kb/s)
        Latency: 161 msec (83-174 msec ~160 msec)
> ACL Data RX: Handle 3405 flags 0x02 dlen 21             #228 [hci1] 16.735645
      SMP: Pairing Random (0x04) len 16
        Random value: 8fc625eb71a17c550000000000000000
