Bluetooth monitor ver 5.72
= Note: Linux version 6.14.0-36-generic (x86_64)                       0.221380
= Note: Bluetooth subsystem version 2.22                               0.221382
= New Index: 00:00:00:00:00:00 (Primary,UART,hci1)              [hci1] 0.221383
= New Index: 48:5F:99:8E:E0:64 (Primary,USB,hci0)               [hci0] 0.221383
= Open Index: 00:00:00:00:00:00                                 [hci1] 0.335236
= Index Info: 00:00:00:00:00:00 (Nordic Semiconductor ASA)      [hci1] 0.335251
@ USER Open: main (privileged) version 2.22            {0x0001} [hci1] 0.335260
< HCI Command: Reset (0x03|0x0003) plen 0                    #1 [hci1] 0.336537
> HCI Event: Command Complete (0x0e) plen 4                  #2 [hci1] 0.337044
      Reset (0x03|0x0003) ncmd 1
        Status: Success (0x00)
< HCI Command: Read Local Supported... (0x04|0x0003) plen 0  #3 [hci1] 0.354628
> HCI Event: Command Complete (0x0e) plen 12                 #4 [hci1] 0.355118
      Read Local Supported Features (0x04|0x0003) ncmd 1
        Status: Success (0x00)
        Features: 0x00 0x00 0x00 0x00 0x60 0x00 0x00 0x00
          BR/EDR Not Supported
          LE Supported (Controller)
< HCI Command: Read Local Version In.. (0x04|0x0001) plen 0  #5 [hci1] 0.374591
> HCI Event: Command Complete (0x0e) plen 12                 #6 [hci1] 0.375049
      Read Local Version Information (0x04|0x0001) ncmd 1
        Status: Success (0x00)
        HCI version: Reserved (0x0f) - Revision 12393 (0x3069)
        LMP version: Reserved (0x0f) - Subversion 12393 (0x3069)
        Manufacturer: Nordic Semiconductor ASA (89)
< HCI Command: Read Local Supported... (0x04|0x0002) plen 0  #7 [hci1] 0.394614
> HCI Event: Command Complete (0x0e) plen 68                 #8 [hci1] 0.395678
      Read Local Supported Commands (0x04|0x0002) ncmd 1
        Status: Success (0x00)
        Commands: 119 entries
          Disconnect (Octet 0 - Bit 5)
          Read Remote Version Information (Octet 2 - Bit 7)
          Set Event Mask (Octet 5 - Bit 6)
          Reset (Octet 5 - Bit 7)
          Read Connection Accept Timeout (Octet 7 - Bit 2)
          Write Connection Accept Timeout (Octet 7 - Bit 3)
          Read Transmit Power Level (Octet 10 - Bit 2)
          Set Controller To Host Flow Control (Octet 10 - Bit 5)
          Host Buffer Size (Octet 10 - Bit 6)
          Host Number of Completed Packets (Octet 10 - Bit 7)
          Read Local Version Information (Octet 14 - Bit 3)
          Read Local Supported Features (Octet 14 - Bit 5)
          Read BD ADDR (Octet 15 - Bit 1)
          Read RSSI (Octet 15 - Bit 5)
          Set Event Mask Page 2 (Octet 22 - Bit 2)
          LE Set Event Mask (Octet 25 - Bit 0)
          LE Read Buffer Size (Octet 25 - Bit 1)
          LE Read Local Supported Features (Octet 25 - Bit 2)
          LE Set Random Address (Octet 25 - Bit 4)
          LE Set Advertising Parameters (Octet 25 - Bit 5)
          LE Read Advertising Channel TX Power (Octet 25 - Bit 6)
          LE Set Advertising Data (Octet 25 - Bit 7)
          LE Set Scan Response Data (Octet 26 - Bit 0)
          LE Set Advertise Enable (Octet 26 - Bit 1)
          LE Set Scan Parameters (Octet 26 - Bit 2)
          LE Set Scan Enable (Octet 26 - Bit 3)
          LE Create Connection (Octet 26 - Bit 4)
          LE Create Connection Cancel (Octet 26 - Bit 5)
          LE Read Accept List Size (Octet 26 - Bit 6)
          LE Clear Accept List (Octet 26 - Bit 7)
          LE Add Device To Accept List (Octet 27 - Bit 0)
          LE Remove Device From Accept List (Octet 27 - Bit 1)
          LE Connection Update (Octet 27 - Bit 2)
          LE Set Host Channel Classification (Octet 27 - Bit 3)
          LE Read Channel Map (Octet 27 - Bit 4)
          LE Read Remote Used Features (Octet 27 - Bit 5)
          LE Encrypt (Octet 27 - Bit 6)
          LE Rand (Octet 27 - Bit 7)
          LE Start Encryption (Octet 28 - Bit 0)
          LE Long Term Key Request Reply (Octet 28 - Bit 1)
          LE Long Term Key Request Neg Reply (Octet 28 - Bit 2)
          LE Read Supported States (Octet 28 - Bit 3)
          LE Receiver Test (Octet 28 - Bit 4)
          LE Transmitter Test (Octet 28 - Bit 5)
          LE Test End (Octet 28 - Bit 6)
          Read Authenticated Payload Timeout (Octet 32 - Bit 4)
          Write Authenticated Payload Timeout (Octet 32 - Bit 5)
          LE Set Data Length (Octet 33 - Bit 6)
          LE Read Suggested Default Data Length (Octet 33 - Bit 7)
          LE Write Suggested Default Data Length (Octet 34 - Bit 0)
          LE Add Device To Resolving List (Octet 34 - Bit 3)
          LE Remove Device From Resolving List (Octet 34 - Bit 4)
          LE Clear Resolving List (Octet 34 - Bit 5)
          LE Read Resolving List Size (Octet 34 - Bit 6)
          LE Set Address Resolution Enable (Octet 35 - Bit 1)
          LE Set Resolvable Private Address Timeout (Octet 35 - Bit 2)
          LE Read Maximum Data Length (Octet 35 - Bit 3)
          LE Read PHY (Octet 35 - Bit 4)
          LE Set Default PHY (Octet 35 - Bit 5)
          LE Set PHY (Octet 35 - Bit 6)
          LE Enhanced Receiver Test (Octet 35 - Bit 7)
          LE Enhanced Transmitter Test (Octet 36 - Bit 0)
          LE Set Advertising Set Random Address (Octet 36 - Bit 1)
          LE Set Extended Advertising Parameters (Octet 36 - Bit 2)
          LE Set Extended Advertising Data (Octet 36 - Bit 3)
          LE Set Extended Scan Response Data (Octet 36 - Bit 4)
          LE Set Extended Advertising Enable (Octet 36 - Bit 5)
          LE Read Maximum Advertising Data Length (Octet 36 - Bit 6)
          LE Read Number of Supported Advertising Sets (Octet 36 - Bit 7)
          LE Remove Advertising Set (Octet 37 - Bit 0)
          LE Clear Advertising Sets (Octet 37 - Bit 1)
          LE Set Periodic Advertising Parameters (Octet 37 - Bit 2)
          LE Set Periodic Advertising Data (Octet 37 - Bit 3)
          LE Set Periodic Advertising Enable (Octet 37 - Bit 4)
          LE Set Extended Scan Parameters (Octet 37 - Bit 5)
          LE Set Extended Scan Enable (Octet 37 - Bit 6)
          LE Extended Create Connection (Octet 37 - Bit 7)
          LE Periodic Advertising Create Sync (Octet 38 - Bit 0)
          LE Periodic Advertising Create Sync Cancel (Octet 38 - Bit 1)
          LE Periodic Advertising Terminate Sync (Octet 38 - Bit 2)
          LE Add Device To Periodic Advertiser List (Octet 38 - Bit 3)
          LE Remove Device From Periodic Advertiser List (Octet 38 - Bit 4)
          LE Clear Periodic Advertiser List (Octet 38 - Bit 5)
          LE Read Periodic Advertiser List Size (Octet 38 - Bit 6)
          LE Read Transmit Power (Octet 38 - Bit 7)
          LE Read RF Path Compensation (Octet 39 - Bit 0)
          LE Write RF Path Compensation (Octet 39 - Bit 1)
          LE Set Privacy Mode (Octet 39 - Bit 2)
          LE Periodic Advertising Receive Enable (Octet 40 - Bit 5)
          LE Periodic Advertising Sync Transfer (Octet 40 - Bit 6)
          LE Periodic Advertising Set Info Transfer (Octet 40 - Bit 7)
          LE Periodic Advertising Sync Transfer Parameters (Octet 41 - Bit 0)
          LE Set Default Periodic Advertisng Sync Transfer Parameters (Octet 41 - Bit 1)
          LE Read Buffer v2 (Octet 41 - Bit 5)
          LE Read ISO TX Sync (Octet 41 - Bit 6)
          LE Set Connected Isochronous Group Parameters (Octet 41 - Bit 7)
          LE Set Connected Isochronous Group Parameters Test (Octet 42 - Bit 0)
          LE Create Connected Isochronous Stream (Octet 42 - Bit 1)
          LE Remove Connected Isochronous Group (Octet 42 - Bit 2)
          LE Accept Connected Isochronous Stream Request (Octet 42 - Bit 3)
          LE Reject Connected Isochronous Stream Request (Octet 42 - Bit 4)
          LE Create Broadcast Isochronous Group (Octet 42 - Bit 5)
          LE Create Broadcast Isochronous Group Test (Octet 42 - Bit 6)
          LE Terminate Broadcast Isochronous Group (Octet 42 - Bit 7)
          LE Broadcast Isochronous Group Create Sync (Octet 43 - Bit 0)
          LE Broadcast Isochronous Group Terminate Sync (Octet 43 - Bit 1)
          LE Request Peer SCA (Octet 43 - Bit 2)
          LE Setup Isochronous Data Path (Octet 43 - Bit 3)
          LE Remove Isochronous Data Path (Octet 43 - Bit 4)
          LE Isochronous Transmit Test (Octet 43 - Bit 5)
          LE Isochronous Receive Test (Octet 43 - Bit 6)
          LE Isochronous Read Test Counters (Octet 43 - Bit 7)
          LE Isochronous Read Test Counters (Octet 44 - Bit 0)
          LE Set Host Feature (Octet 44 - Bit 1)
          Octet 44 - Bit 2 
          Octet 45 - Bit 6 
          Octet 46 - Bit 0 
          Octet 46 - Bit 1 
          Octet 46 - Bit 2 
< HCI Command: Host Buffer Size (0x03|0x0033) plen 7         #9 [hci1] 0.414570
        ACL MTU: 255  ACL max packet: 16
        SCO MTU: 0    SCO max packet: 0
> HCI Event: Command Complete (0x0e) plen 4                 #10 [hci1] 0.415106
      Host Buffer Size (0x03|0x0033) ncmd 1
        Status: Success (0x00)
< HCI Command: Set Controller To Ho.. (0x03|0x0031) plen 1  #11 [hci1] 0.434621
        Flow control: ACL Data Packets (0x01)
> HCI Event: Command Complete (0x0e) plen 4                 #12 [hci1] 0.435096
      Set Controller To Host Flow Control (0x03|0x0031) ncmd 1
        Status: Success (0x00)
< HCI Command: LE Read Local Suppor.. (0x08|0x0003) plen 0  #13 [hci1] 0.454623
> HCI Event: Command Complete (0x0e) plen 12                #14 [hci1] 0.455138
      LE Read Local Supported Features (0x08|0x0003) ncmd 1
        Status: Success (0x00)
        Features: 0xfd 0x79 0x00 0xf7 0x30 0x01 0x00 0x00
          LE Encryption
          Extended Reject Indication
          Peripheral-initiated Features Exchange
          LE Ping
          LE Data Packet Length Extension
          LL Privacy
          Extended Scanner Filter Policies
          LE 2M PHY
          LE Coded PHY
          LE Extended Advertising
          LE Periodic Advertising
          Channel Selection Algorithm #2
          Periodic Advertising Sync Transfer - Sender
          Periodic Advertising Sync Transfer - Recipient
          Sleep Clock Accuracy Updates
          Connected Isochronous Stream - Central
          Connected Isochronous Stream - Peripheral
          Isochronous Broadcaster
          Synchronized Receiver
          Periodic Advertising ADI support
          Connection Subrating
          Unknown features (0x0000010000000000)
< HCI Command: LE Set Host Feature (0x08|0x0074) plen 2     #15 [hci1] 0.474606
        Bit Number: 32
          Connected Isochronous Stream (Host Support)
        Bit Value: 1
> HCI Event: Command Complete (0x0e) plen 4                 #16 [hci1] 0.475096
      LE Set Host Feature (0x08|0x0074) ncmd 1
        Status: Success (0x00)
< HCI Command: LE Read Buffer v2 (0x08|0x0060) plen 0       #17 [hci1] 0.494567
> HCI Event: Command Complete (0x0e) plen 10                #18 [hci1] 0.495072
      LE Read Buffer v2 (0x08|0x0060) ncmd 1
        Status: Success (0x00)
        ACL MTU: 27
        ACL max packet: 3
        ISO MTU: 318
        ISO max packet: 3
< HCI Command: LE Read Maximum Adve.. (0x08|0x003a) plen 0  #19 [hci1] 0.514637
> HCI Event: Command Complete (0x0e) plen 6                 #20 [hci1] 0.515074
      LE Read Maximum Advertising Data Length (0x08|0x003a) ncmd 1
        Status: Success (0x00)
        Max length: 1650
< HCI Command: LE Read Supported St.. (0x08|0x001c) plen 0  #21 [hci1] 0.534620
> HCI Event: Command Complete (0x0e) plen 12                #22 [hci1] 0.535233
      LE Read Supported States (0x08|0x001c) ncmd 1
        Status: Success (0x00)
        States: 0x000003ff3e0306ff
          Non-connectable Advertising State
          Scannable Advertising State
          Connectable Advertising State
          High Duty Cycle Directed Advertising State
          Passive Scanning State
          Active Scanning State
          Initiating State
            and Connection State (Central Role)
          Connection State (Peripheral Role)
          Scannable Advertising State
            and Passive Scanning State
          Connectable Advertising State
            and Passive Scanning State
          Non-connectable Advertising State
            and Initiating State
          Scannable Advertising State
            and Initiating State
          Active Scanning State
            and Connection State (Central Role)
          Passive Scanning State
            and Connection State (Peripheral Role)
          Active Scanning State
            and Connection State (Peripheral Role)
          Initiating State
            and Connection State (Central Role)
            and Central Role & Central Role
          Low Duty Cycle Directed Advertising State
          Connectable Advertising State
            and Initiating State
            and Central Role & Peripheral Role
          High Duty Cycle Directed Advertising State
            and Initiating State
            and Central Role & Peripheral Role
          Low Duty Cycle Directed Advertising State
            and Initiating State
            and Central Role & Peripheral Role
          Connectable Advertising State
            and Connection State (Central Role)
            and Central Role & Peripheral Role
          High Duty Cycle Directed Advertising State
            and Connection State (Central Role)
            and Central Role & Peripheral Role
          Low Duty Cycle Directed Advertising State
            and Connection State (Central Role)
            and Central Role & Peripheral Role
          Connectable Advertising State
            and Connection State (Peripheral Role)
            and Central Role & Peripheral Role
          High Duty Cycle Directed Advertising State
            and Connection State (Peripheral Role)
            and Peripheral Role & Peripheral Role
          Low Duty Cycle Directed Advertising State
            and Connection State (Peripheral Role)
            and Peripheral Role & Peripheral Role
          Initiating State
            and Connection State (Peripheral Role)
            and Central Role & Peripheral Role
< HCI Command: LE Read Maximum Data.. (0x08|0x002f) plen 0  #23 [hci1] 0.554590
> HCI Event: Command Complete (0x0e) plen 12                #24 [hci1] 0.555122
      LE Read Maximum Data Length (0x08|0x002f) ncmd 1
        Status: Success (0x00)
        Max TX octets: 251
        Max TX time: 2704
        Max RX octets: 251
        Max RX time: 2704
< HCI Command: LE Write Suggested D.. (0x08|0x0024) plen 4  #25 [hci1] 0.574619
        TX octets: 251
        TX time: 2704
> HCI Event: Command Complete (0x0e) plen 4                 #26 [hci1] 0.575111
      LE Write Suggested Default Data Length (0x08|0x0024) ncmd 1
        Status: Success (0x00)
< HCI Command: LE Read Resolving Li.. (0x08|0x002a) plen 0  #27 [hci1] 0.594617
> HCI Event: Command Complete (0x0e) plen 5                 #28 [hci1] 0.595027
      LE Read Resolving List Size (0x08|0x002a) ncmd 1
        Status: Success (0x00)
        Size: 8
< HCI Command: LE Set Event Mask (0x08|0x0001) plen 8       #29 [hci1] 0.614599
        Mask: 0x000002023f87fa5e
          LE Advertising Report
          LE Connection Update Complete
          LE Read Remote Used Features Complete
          LE Long Term Key Request
          LE Data Length Change
          LE Enhanced Connection Complete
          LE PHY Update Complete
          LE Extended Advertising Report
          LE Periodic Advertising Sync Established
          LE Periodic Advertising Report
          LE Periodic Advertising Sync Lost
          LE Extended Scan Timeout
          LE Extended Advertising Set Terminated
          LE Scan Request Received
          LE Periodic Advertising Sync Transfer Rvc
          LE CIS Established
          LE CIS Request
          LE Create BIG Complete
          LE Terminate BIG Complete
          LE BIG Sync Estabilished Complete
          LE BIG Sync Lost
          LE BIG Info Advertising Report
          Unknown mask (0x0000020000000000)
> HCI Event: Command Complete (0x0e) plen 4                 #30 [hci1] 0.615074
      LE Set Event Mask (0x08|0x0001) ncmd 1
        Status: Success (0x00)
< HCI Command: Set Event Mask (0x03|0x0001) plen 8          #31 [hci1] 0.634584
        Mask: 0x2000800002008890
          Disconnection Complete
          Encryption Change
          Read Remote Version Information Complete
          Hardware Error
          Data Buffer Overflow
          Encryption Key Refresh Complete
          LE Meta
> HCI Event: Command Complete (0x0e) plen 4                 #32 [hci1] 0.635123
      Set Event Mask (0x03|0x0001) ncmd 1
        Status: Success (0x00)
< HCI Command: Read BD ADDR (0x04|0x0009) plen 0            #33 [hci1] 0.654602
> HCI Event: Command Complete (0x0e) plen 10                #34 [hci1] 0.655111
      Read BD ADDR (0x04|0x0009) ncmd 1
        Status: Success (0x00)
        Address: 00:00:00:00:00:00 (OUI 00-00-00)
< HCI Command: LE Set Random Address (0x08|0x0005) plen 6   #35 [hci1] 0.674653
        Address: D5:B6:CC:31:DB:3B (Static)
> HCI Event: Command Complete (0x0e) plen 4                 #36 [hci1] 0.675225
      LE Set Random Address (0x08|0x0005) ncmd 1
        Status: Success (0x00)
< HCI Command: LE Set Extended Adv.. (0x08|0x0036) plen 25  #37 [hci1] 3.205103
        Handle: 0x00
        Properties: 0x0013
          Connectable
          Scannable
          Use legacy advertising PDUs: ADV_IND
        Min advertising interval: 100.000 msec (0x00a0)
        Max advertising interval: 150.000 msec (0x00f0)
        Channel map: 37, 38, 39 (0x07)
        Own address type: Random (0x01)
        Peer address type: Public (0x00)
        Peer address: 00:00:00:00:00:00 (OUI 00-00-00)
        Filter policy: Allow Scan Request from Any, Allow Connect Request from Any (0x00)
        TX power: Host has no preference (0x7f)
        Primary PHY: LE 1M (0x01)
        Secondary max skip: 0x00
        Secondary PHY: LE 1M (0x01)
        SID: 0x00
        Scan request notifications: Disabled (0x00)
> HCI Event: Command Complete (0x0e) plen 5                 #38 [hci1] 3.205890
      LE Set Extended Advertising Parameters (0x08|0x0036) ncmd 1
        Status: Success (0x00)
        TX power (selected): 0 dbm (0x00)
< HCI Command: LE Set Advertising S.. (0x08|0x0035) plen 7  #39 [hci1] 3.215057
        Advertising handle: 0x00
        Advertising random address: D5:B6:CC:31:DB:3B (Static)
> HCI Event: Command Complete (0x0e) plen 4                 #40 [hci1] 3.215687
      LE Set Advertising Set Random Address (0x08|0x0035) ncmd 1
        Status: Success (0x00)
< HCI Command: LE Set Extended Adv.. (0x08|0x0037) plen 22  #41 [hci1] 3.234612
        Handle: 0x00
        Operation: Complete extended advertising data (0x03)
        Fragment preference: Minimize fragmentation (0x01)
        Data length: 0x12
        Flags: 0x06
          LE General Discoverable Mode
          BR/EDR Not Supported
        Name (complete): Tester_F6B11A
> HCI Event: Command Complete (0x0e) plen 4                 #42 [hci1] 3.235279
      LE Set Extended Advertising Data (0x08|0x0037) ncmd 1
        Status: Success (0x00)
< HCI Command: LE Set Extended Scan.. (0x08|0x0038) plen 4  #43 [hci1] 3.254705
        Handle: 0x00
        Operation: Complete scan response data (0x03)
        Fragment preference: Minimize fragmentation (0x01)
        Data length: 0x00
> HCI Event: Command Complete (0x0e) plen 4                 #44 [hci1] 3.255259
      LE Set Extended Scan Response Data (0x08|0x0038) ncmd 1
        Status: Success (0x00)
< HCI Command: LE Set Extended Adve.. (0x08|0x0039) plen 6  #45 [hci1] 3.274657
        Extended advertising: Enabled (0x01)
        Number of sets: 1 (0x01)
        Entry 0
          Handle: 0x00
          Duration: 0 ms (0x00)
          Max ext adv events: 0
> HCI Event: Command Complete (0x0e) plen 4                 #46 [hci1] 3.275276
      LE Set Extended Advertising Enable (0x08|0x0039) ncmd 1
        Status: Success (0x00)
> HCI Event: LE Meta Event (0x3e) plen 31                   #47 [hci1] 3.390993
      LE Enhanced Connection Complete (0x0a)
        Status: Success (0x00)
        Handle: 3477
        Role: Peripheral (0x01)
        Peer address type: Public (0x00)
        Peer address: DF:A9:FF:F6:B1:1A (OUI DF-A9-FF)
        Local resolvable private address: 00:00:00:00:00:00 (Non-Resolvable)
        Peer resolvable private address: 00:00:00:00:00:00 (Non-Resolvable)
        Connection interval: 87.50 msec (0x0046)
        Connection latency: 0 (0x0000)
        Supervision timeout: 25120 msec (0x09d0)
        Central clock accuracy: 0x01
> HCI Event: LE Meta Event (0x3e) plen 6                    #48 [hci1] 3.391258
      LE Advertising Set Terminated (0x12)
        Status: Success (0x00)
        Handle: 0
        Connection handle: 3477
        Number of completed extended advertising events: 0
< HCI Command: LE Read Remote Used... (0x08|0x0016) plen 2  #49 [hci1] 3.398773
        Handle: 3477 Address: DF:A9:FF:F6:B1:1A (OUI DF-A9-FF)
< ACL Data TX: Handle 3477 flags 0x00 dlen 7                #50 [hci1] 3.398795
      ATT: Exchange MTU Request (0x02) len 2
        Client RX MTU: 251
> HCI Event: Command Status (0x0f) plen 4                   #51 [hci1] 3.399345
      LE Read Remote Used Features (0x08|0x0016) ncmd 1
        Status: Success (0x00)
> HCI Event: Number of Completed Packets (0x13) plen 5      #52 [hci1] 3.566983
        Num handles: 1
        Handle: 3477 Address: DF:A9:FF:F6:B1:1A (OUI DF-A9-FF)
        Count: 1
        #50: len 7 (0 Kb/s)
        Latency: 168 msec (168-168 msec ~168 msec)
> HCI Event: LE Meta Event (0x3e) plen 12                   #53 [hci1] 3.654974
      LE Read Remote Used Features (0x04)
        Status: Success (0x00)
        Handle: 3477 Address: DF:A9:FF:F6:B1:1A (OUI DF-A9-FF)
        Features: 0x2d 0x49 0x00 0xf7 0x67 0xd9 0x00 0x80
          LE Encryption
          Extended Reject Indication
          Peripheral-initiated Features Exchange
          LE Data Packet Length Extension
          LE 2M PHY
          LE Coded PHY
          Channel Selection Algorithm #2
          Periodic Advertising Sync Transfer - Sender
          Periodic Advertising Sync Transfer - Recipient
          Sleep Clock Accuracy Updates
          Connected Isochronous Stream - Central
          Connected Isochronous Stream - Peripheral
          Isochronous Broadcaster
          Synchronized Receiver
          Connected Isochronous Stream (Host Support)
          LE Power Control Request
          LE Power Control Request
          Connection Subrating
          Connection Subrating (Host Support)
          Unknown features (0x8000d90000000000)
> ACL Data RX: Handle 3477 flags 0x02 dlen 11               #54 [hci1] 6.104663
      SMP: Pairing Request (0x01) len 6
        IO capability: KeyboardDisplay (0x04)
        OOB data: Authentication data not present (0x00)
        Authentication requirement: Bonding, MITM, SC, No Keypresses (0x0d)
        Max encryption key size: 16
        Initiator key distribution: EncKey IdKey (0x03)
        Responder key distribution: EncKey IdKey Sign (0x07)
> ACL Data RX: Handle 3477 flags 0x02 dlen 7                #55 [hci1] 6.105142
      ATT: Exchange MTU Response (0x03) len 2
        Server RX MTU: 23
< HCI Command: Host Number of Compl.. (0x03|0x0035) plen 5  #56 [hci1] 6.115187
        Num handles: 1
        Handle: 3477 Address: DF:A9:FF:F6:B1:1A (OUI DF-A9-FF)
        Count: 1
< ACL Data TX: Handle 3477 flags 0x00 dlen 11               #57 [hci1] 6.115310
      SMP: Pairing Response (0x02) len 6
        IO capability: DisplayOnly (0x00)
        OOB data: Authentication data not present (0x00)
        Authentication requirement: Bonding, No MITM, SC, No Keypresses (0x09)
        Max encryption key size: 16
        Initiator key distribution: IdKey (0x02)
        Responder key distribution: <none> (0x00)
< HCI Command: Host Number of Compl.. (0x03|0x0035) plen 5  #58 [hci1] 6.115772
        Num handles: 1
        Handle: 3477 Address: DF:A9:FF:F6:B1:1A (OUI DF-A9-FF)
        Count: 1
> HCI Event: Number of Completed Packets (0x13) plen 5      #59 [hci1] 6.279781
        Num handles: 1
        Handle: 3477 Address: DF:A9:FF:F6:B1:1A (OUI DF-A9-FF)
        Count: 1
        #57: len 11 (0 Kb/s)
        Latency: 164 msec (164-168 msec ~166 msec)
> ACL Data RX: Handle 3477 flags 0x02 dlen 27               #60 [hci1] 6.280080
> ACL Data RX: Handle 3477 flags 0x01 dlen 27               #61 [hci1] 6.280571
> ACL Data RX: Handle 3477 flags 0x01 dlen 15               #62 [hci1] 6.281028
      SMP: Pairing Public Key (0x0c) len 64
        X: 0e4bef326345b63db85a4dbd58d2f3ac946328cfaa97c17e89285e137b06425a
        Y: 1c8a6d1583958d2646cbef13decf44cedbc6528e3f3ace7805a72bc6e17f1b89
< HCI Command: Host Number of Compl.. (0x03|0x0035) plen 5  #63 [hci1] 6.295382
        Num handles: 1
        Handle: 3477 Address: DF:A9:FF:F6:B1:1A (OUI DF-A9-FF)
        Count: 1
< HCI Command: Host Number of Compl.. (0x03|0x0035) plen 5  #64 [hci1] 6.295633
        Num handles: 1
        Handle: 3477 Address: DF:A9:FF:F6:B1:1A (OUI DF-A9-FF)
        Count: 1
< HCI Command: Host Number of Compl.. (0x03|0x0035) plen 5  #65 [hci1] 6.295973
        Num handles: 1
        Handle: 3477 Address: DF:A9:FF:F6:B1:1A (OUI DF-A9-FF)
        Count: 1
< ACL Data TX: Handle 3477 flags 0x00 dlen 27               #66 [hci1] 6.296175
< ACL Data TX: Handle 3477 flags 0x01 dlen 27               #67 [hci1] 6.296192
< ACL Data TX: Handle 3477 flags 0x01 dlen 15               #68 [hci1] 6.296196
      SMP: Pairing Public Key (0x0c) len 64
        X: 98308440221e2d910f0e54b71e7ec652857aa9b5a0dc65028824cc19db1226e9
        Y: 67a4816bcb62efb21701e31fdb27561a6217575fb007a8bbdabe7e28b6f68482
> HCI Event: Number of Completed Packets (0x13) plen 5      #69 [hci1] 6.367681
        Num handles: 1
        Handle: 3477 Address: DF:A9:FF:F6:B1:1A (OUI DF-A9-FF)
        Count: 1
        #66: len 27 (3 Kb/s)
        Latency: 71 msec (71-168 msec ~118 msec)
> HCI Event: Number of Completed Packets (0x13) plen 5      #70 [hci1] 6.368296
        Num handles: 1
        Handle: 3477 Address: DF:A9:FF:F6:B1:1A (OUI DF-A9-FF)
        Count: 1
        #67: len 27 (3 Kb/s)
        Latency: 72 msec (71-168 msec ~95 msec)
> HCI Event: Number of Completed Packets (0x13) plen 5      #71 [hci1] 6.454534
        Num handles: 1
        Handle: 3477 Address: DF:A9:FF:F6:B1:1A (OUI DF-A9-FF)
        Count: 1
        #68: len 15 (0 Kb/s)
        Latency: 158 msec (71-168 msec ~126 msec)
> ACL Data RX: Handle 3477 flags 0x02 dlen 21               #72 [hci1] 7.417318
      SMP: Pairing Confirm (0x03) len 16
        Confim value: 7eca71c8823cf5a85c62b54bfddb4fde
< HCI Command: Host Number of Compl.. (0x03|0x0035) plen 5  #73 [hci1] 7.435252
        Num handles: 1
        Handle: 3477 Address: DF:A9:FF:F6:B1:1A (OUI DF-A9-FF)
        Count: 1
< ACL Data TX: Handle 3477 flags 0x00 dlen 21               #74 [hci1] 7.435363
      SMP: Pairing Confirm (0x03) len 16
        Confim value: c7b5d9cd6bd033a013ef8eebab6c5d95
> HCI Event: Number of Completed Packets (0x13) plen 5      #75 [hci1] 7.592245
        Num handles: 1
        Handle: 3477 Address: DF:A9:FF:F6:B1:1A (OUI DF-A9-FF)
        Count: 1
        #74: len 21 (1 Kb/s)
        Latency: 156 msec (71-168 msec ~141 msec)
> ACL Data RX: Handle 3477 flags 0x02 dlen 21               #76 [hci1] 7.592530
      SMP: Pairing Random (0x04) len 16
        Random value: 0708b2832261f2f90000000000000000
< HCI Command: Host Number of Compl.. (0x03|0x0035) plen 5  #77 [hci1] 7.595303
        Num handles: 1
        Handle: 3477 Address: DF:A9:FF:F6:B1:1A (OUI DF-A9-FF)
        Count: 1
< ACL Data TX: Handle 3477 flags 0x00 dlen 21               #78 [hci1] 7.595469
      SMP: Pairing Random (0x04) len 16
        Random value: 8e6108f966a694cbe26df70bb96773e6
> HCI Event: Number of Completed Packets (0x13) plen 5      #79 [hci1] 7.766967
        Num handles: 1
        Handle: 3477 Address: DF:A9:FF:F6:B1:1A (OUI DF-A9-FF)
        Count: 1
        #78: len 21 (0 Kb/s)
        Latency: 171 msec (71-171 msec ~156 msec)
> ACL Data RX: Handle 3477 flags 0x02 dlen 21               #80 [hci1] 7.854861
      SMP: Pairing Confirm (0x03) len 16
        Confim value: 154a5266dad72bdbcaa9506bac99eea5
< HCI Command: Host Number of Compl.. (0x03|0x0035) plen 5  #81 [hci1] 7.875410
        Num handles: 1
        Handle: 3477 Address: DF:A9:FF:F6:B1:1A (OUI DF-A9-FF)
        Count: 1
< ACL Data TX: Handle 3477 flags 0x00 dlen 21               #82 [hci1] 7.875505
      SMP: Pairing Confirm (0x03) len 16
        Confim value: 4c95ac131fd1a2c2d403dba903475172
> HCI Event: Number of Completed Packets (0x13) plen 5      #83 [hci1] 8.029726
        Num handles: 1
        Handle: 3477 Address: DF:A9:FF:F6:B1:1A (OUI DF-A9-FF)
        Count: 1
        #82: len 21 (1 Kb/s)
        Latency: 154 msec (71-171 msec ~155 msec)
> ACL Data RX: Handle 3477 flags 0x02 dlen 21               #84 [hci1] 8.030047
      SMP: Pairing Random (0x04) len 16
        Random value: 8c4880738f64a1d70000000000000000
< HCI Command: Host Number of Compl.. (0x03|0x0035) plen 5  #85 [hci1] 8.035531
        Num handles: 1
        Handle: 3477 Address: DF:A9:FF:F6:B1:1A (OUI DF-A9-FF)
        Count: 1
< ACL Data TX: Handle 3477 flags 0x00 dlen 21               #86 [hci1] 8.035736
      SMP: Pairing Random (0x04) len 16
        Random value: 4d02679f89a05211af56d8b3da64d21e
> HCI Event: Number of Completed Packets (0x13) plen 5      #87 [hci1] 8.204447
        Num handles: 1
        Handle: 3477 Address: DF:A9:FF:F6:B1:1A (OUI DF-A9-FF)
        Count: 1
        #86: len 21 (1 Kb/s)
        Latency: 168 msec (71-171 msec ~162 msec)
> ACL Data RX: Handle 3477 flags 0x02 dlen 21               #88 [hci1] 8.292368
      SMP: Pairing Confirm (0x03) len 16
        Confim value: 7dcbbcb817cfa7f38ec59453f062f787
< HCI Command: Host Number of Compl.. (0x03|0x0035) plen 5  #89 [hci1] 8.295255
        Num handles: 1
        Handle: 3477 Address: DF:A9:FF:F6:B1:1A (OUI DF-A9-FF)
        Count: 1
< ACL Data TX: Handle 3477 flags 0x00 dlen 21               #90 [hci1] 8.295475
      SMP: Pairing Confirm (0x03) len 16
        Confim value: 3efa38d4f79a289b8eb8370b2968f303
> HCI Event: Number of Completed Packets (0x13) plen 5      #91 [hci1] 8.467131
        Num handles: 1
        Handle: 3477 Address: DF:A9:FF:F6:B1:1A (OUI DF-A9-FF)
        Count: 1
        #90: len 21 (0 Kb/s)
        Latency: 171 msec (71-171 msec ~166 msec)
> ACL Data RX: Handle 3477 flags 0x02 dlen 21               #92 [hci1] 8.467530
      SMP: Pairing Random (0x04) len 16
        Random value: 82360672d5ec4fae0000000000000000
< HCI Command: Host Number of Compl.. (0x03|0x0035) plen 5  #93 [hci1] 8.475491
        Num handles: 1
        Handle: 3477 Address: DF:A9:FF:F6:B1:1A (OUI DF-A9-FF)
        Count: 1
< ACL Data TX: Handle 3477 flags 0x00 dlen 21               #94 [hci1] 8.475645
      SMP: Pairing Random (0x04) len 16
        Random value: 5e8286bc235a02440d0c3424a2acf8fd
> HCI Event: Number of Completed Packets (0x13) plen 5      #95 [hci1] 8.641903
        Num handles: 1
        Handle: 3477 Address: DF:A9:FF:F6:B1:1A (OUI DF-A9-FF)
        Count: 1
        #94: len 21 (1 Kb/s)
        Latency: 166 msec (71-171 msec ~166 msec)
> ACL Data RX: Handle 3477 flags 0x02 dlen 21               #96 [hci1] 8.729889
      SMP: Pairing Confirm (0x03) len 16
        Confim value: 81c15e26b7b453cc896c8d3736b70dae
< HCI Command: Host Number of Compl.. (0x03|0x0035) plen 5  #97 [hci1] 8.735276
        Num handles: 1
        Handle: 3477 Address: DF:A9:FF:F6:B1:1A (OUI DF-A9-FF)
        Count: 1
< ACL Data TX: Handle 3477 flags 0x00 dlen 21               #98 [hci1] 8.735461
      SMP: Pairing Confirm (0x03) len 16
        Confim value: a6cf03f558c76ae705bea06adeef83b3
> HCI Event: Number of Completed Packets (0x13) plen 5      #99 [hci1] 8.904650
        Num handles: 1
        Handle: 3477 Address: DF:A9:FF:F6:B1:1A (OUI DF-A9-FF)
        Count: 1
        #98: len 21 (0 Kb/s)
        Latency: 169 msec (71-171 msec ~167 msec)
> ACL Data RX: Handle 3477 flags 0x02 dlen 21              #100 [hci1] 8.904979
      SMP: Pairing Random (0x04) len 16
        Random value: 8a63b43751e1181c0000000000000000
< HCI Command: Host Number of Comp.. (0x03|0x0035) plen 5  #101 [hci1] 8.915553
        Num handles: 1
        Handle: 3477 Address: DF:A9:FF:F6:B1:1A (OUI DF-A9-FF)
        Count: 1
< ACL Data TX: Handle 3477 flags 0x00 dlen 21              #102 [hci1] 8.915779
      SMP: Pairing Random (0x04) len 16
        Random value: 5c4a1bcadd27bd58e945097b00bad7ac
> HCI Event: Number of Completed Packets (0x13) plen 5     #103 [hci1] 9.079494
        Num handles: 1
        Handle: 3477 Address: DF:A9:FF:F6:B1:1A (OUI DF-A9-FF)
        Count: 1
        #102: len 21 (1 Kb/s)
        Latency: 163 msec (71-171 msec ~165 msec)
> ACL Data RX: Handle 3477 flags 0x02 dlen 21              #104 [hci1] 9.167413
      SMP: Pairing Confirm (0x03) len 16
        Confim value: c0aa36a0270fce601ba9749cb17db19a
< HCI Command: Host Number of Comp.. (0x03|0x0035) plen 5  #105 [hci1] 9.175262
        Num handles: 1
        Handle: 3477 Address: DF:A9:FF:F6:B1:1A (OUI DF-A9-FF)
        Count: 1
< ACL Data TX: Handle 3477 flags 0x00 dlen 21              #106 [hci1] 9.175312
      SMP: Pairing Confirm (0x03) len 16
        Confim value: 1b0988e15d9fab87e04d1b1655a801a8
> HCI Event: Number of Completed Packets (0x13) plen 5     #107 [hci1] 9.342087
        Num handles: 1
        Handle: 3477 Address: DF:A9:FF:F6:B1:1A (OUI DF-A9-FF)
        Count: 1
        #106: len 21 (1 Kb/s)
        Latency: 166 msec (71-171 msec ~166 msec)
> ACL Data RX: Handle 3477 flags 0x02 dlen 21              #108 [hci1] 9.342534
      SMP: Pairing Random (0x04) len 16
        Random value: 38064737210f9e010000000000000000
< HCI Command: Host Number of Comp.. (0x03|0x0035) plen 5  #109 [hci1] 9.355521
        Num handles: 1
        Handle: 3477 Address: DF:A9:FF:F6:B1:1A (OUI DF-A9-FF)
        Count: 1
< ACL Data TX: Handle 3477 flags 0x00 dlen 21              #110 [hci1] 9.355711
      SMP: Pairing Random (0x04) len 16
        Random value: 32527e6e64e79f33b2e374394db8ab2d
> HCI Event: Number of Completed Packets (0x13) plen 5     #111 [hci1] 9.517048
        Num handles: 1
        Handle: 3477 Address: DF:A9:FF:F6:B1:1A (OUI DF-A9-FF)
        Count: 1
        #110: len 21 (1 Kb/s)
        Latency: 161 msec (71-171 msec ~163 msec)
> ACL Data RX: Handle 3477 flags 0x02 dlen 21              #112 [hci1] 9.604734
      SMP: Pairing Confirm (0x03) len 16
        Confim value: 882cd6bb6cd5bf9fda8009f8533f3259
< HCI Command: Host Number of Comp.. (0x03|0x0035) plen 5  #113 [hci1] 9.615219
        Num handles: 1
        Handle: 3477 Address: DF:A9:FF:F6:B1:1A (OUI DF-A9-FF)
        Count: 1
< ACL Data TX: Handle 3477 flags 0x00 dlen 21              #114 [hci1] 9.615410
      SMP: Pairing Confirm (0x03) len 16
        Confim value: 2259da01861eeb769816a3a9bed2a72d
> HCI Event: Number of Completed Packets (0x13) plen 5     #115 [hci1] 9.779586
        Num handles: 1
        Handle: 3477 Address: DF:A9:FF:F6:B1:1A (OUI DF-A9-FF)
        Count: 1
        #114: len 21 (1 Kb/s)
        Latency: 164 msec (71-171 msec ~163 msec)
> ACL Data RX: Handle 3477 flags 0x02 dlen 21              #116 [hci1] 9.779992
      SMP: Pairing Random (0x04) len 16
        Random value: 29feef38029f929d0000000000000000
< HCI Command: Host Number of Comp.. (0x03|0x0035) plen 5  #117 [hci1] 9.795575
        Num handles: 1
        Handle: 3477 Address: DF:A9:FF:F6:B1:1A (OUI DF-A9-FF)
        Count: 1
< ACL Data TX: Handle 3477 flags 0x00 dlen 21              #118 [hci1] 9.795751
      SMP: Pairing Random (0x04) len 16
        Random value: dddbdfe2838e9a8cc6964353c850fef7
> HCI Event: Number of Completed Packets (0x13) plen 5     #119 [hci1] 9.954394
        Num handles: 1
        Handle: 3477 Address: DF:A9:FF:F6:B1:1A (OUI DF-A9-FF)
        Count: 1
        #118: len 21 (1 Kb/s)
        Latency: 158 msec (71-171 msec ~161 msec)
> ACL Data RX: Handle 3477 flags 0x02 dlen 21             #120 [hci1] 10.042306
      SMP: Pairing Confirm (0x03) len 16
        Confim value: 37fa9e3b6271e6ee526ae0ac6792e5ec
< HCI Command: Host Number of Com.. (0x03|0x0035) plen 5  #121 [hci1] 10.055305
        Num handles: 1
        Handle: 3477 Address: DF:A9:FF:F6:B1:1A (OUI DF-A9-FF)
        Count: 1
< ACL Data TX: Handle 3477 flags 0x00 dlen 21             #122 [hci1] 10.055530
      SMP: Pairing Confirm (0x03) len 16
        Confim value: 097fd0039052c1a07573d61fa0f8eb2c
> HCI Event: Number of Completed Packets (0x13) plen 5    #123 [hci1] 10.217156
        Num handles: 1
        Handle: 3477 Address: DF:A9:FF:F6:B1:1A (OUI DF-A9-FF)
        Count: 1
        #122: len 21 (1 Kb/s)
        Latency: 161 msec (71-171 msec ~161 msec)
> ACL Data RX: Handle 3477 flags 0x02 dlen 21             #124 [hci1] 10.217544
      SMP: Pairing Random (0x04) len 16
        Random value: aa93ef139fa476840000000000000000
< HCI Command: Host Number of Com.. (0x03|0x0035) plen 5  #125 [hci1] 10.235607
        Num handles: 1
        Handle: 3477 Address: DF:A9:FF:F6:B1:1A (OUI DF-A9-FF)
        Count: 1
< ACL Data TX: Handle 3477 flags 0x00 dlen 21             #126 [hci1] 10.235769
      SMP: Pairing Random (0x04) len 16
        Random value: eb9f1915536596b6fc3db1c86b2b1970
> HCI Event: Number of Completed Packets (0x13) plen 5    #127 [hci1] 10.391928
        Num handles: 1
        Handle: 3477 Address: DF:A9:FF:F6:B1:1A (OUI DF-A9-FF)
        Count: 1
        #126: len 21 (1 Kb/s)
        Latency: 156 msec (71-171 msec ~158 msec)
> ACL Data RX: Handle 3477 flags 0x02 dlen 21             #128 [hci1] 10.479871
      SMP: Pairing Confirm (0x03) len 16
        Confim value: 831cbff0fdf31b237303467e35e40cae
< HCI Command: Host Number of Com.. (0x03|0x0035) plen 5  #129 [hci1] 10.495297
        Num handles: 1
        Handle: 3477 Address: DF:A9:FF:F6:B1:1A (OUI DF-A9-FF)
        Count: 1
< ACL Data TX: Handle 3477 flags 0x00 dlen 21             #130 [hci1] 10.495467
      SMP: Pairing Confirm (0x03) len 16
        Confim value: 3403d5d263eac205fb341e6b9625e5e9
> HCI Event: Number of Completed Packets (0x13) plen 5    #131 [hci1] 10.654594
        Num handles: 1
        Handle: 3477 Address: DF:A9:FF:F6:B1:1A (OUI DF-A9-FF)
        Count: 1
        #130: len 21 (1 Kb/s)
        Latency: 159 msec (71-171 msec ~158 msec)
> ACL Data RX: Handle 3477 flags 0x02 dlen 21             #132 [hci1] 10.654964
      SMP: Pairing Random (0x04) len 16
        Random value: 2d9c15990df2ac180000000000000000
< HCI Command: Host Number of Com.. (0x03|0x0035) plen 5  #133 [hci1] 10.675346
        Num handles: 1
        Handle: 3477 Address: DF:A9:FF:F6:B1:1A (OUI DF-A9-FF)
        Count: 1
< ACL Data TX: Handle 3477 flags 0x00 dlen 21             #134 [hci1] 10.675511
      SMP: Pairing Random (0x04) len 16
        Random value: 5c794dc9ad9f2c3f295ebd5ad5e1c3cf
> HCI Event: Number of Completed Packets (0x13) plen 5    #135 [hci1] 10.829359
        Num handles: 1
        Handle: 3477 Address: DF:A9:FF:F6:B1:1A (OUI DF-A9-FF)
        Count: 1
        #134: len 21 (1 Kb/s)
        Latency: 153 msec (71-171 msec ~156 msec)
> ACL Data RX: Handle 3477 flags 0x02 dlen 21             #136 [hci1] 10.917267
      SMP: Pairing Confirm (0x03) len 16
        Confim value: 31bb10a9b6d1a741be9b981db7b7ca37
< HCI Command: Host Number of Com.. (0x03|0x0035) plen 5  #137 [hci1] 10.935310
        Num handles: 1
        Handle: 3477 Address: DF:A9:FF:F6:B1:1A (OUI DF-A9-FF)
        Count: 1
< ACL Data TX: Handle 3477 flags 0x00 dlen 21             #138 [hci1] 10.935466
      SMP: Pairing Confirm (0x03) len 16
        Confim value: 1bd9b4d08dac38572c6cdb0895a4ca5d
> HCI Event: Number of Completed Packets (0x13) plen 5    #139 [hci1] 11.092083
        Num handles: 1
        Handle: 3477 Address: DF:A9:FF:F6:B1:1A (OUI DF-A9-FF)
        Count: 1
        #138: len 21 (1 Kb/s)
        Latency: 156 msec (71-171 msec ~156 msec)
> ACL Data RX: Handle 3477 flags 0x02 dlen 21             #140 [hci1] 11.092466
      SMP: Pairing Random (0x04) len 16
        Random value: 79e992a77e3e8d0f0000000000000000
< HCI Command: Host Number of Com.. (0x03|0x0035) plen 5  #141 [hci1] 11.095439
        Num handles: 1
        Handle: 3477 Address: DF:A9:FF:F6:B1:1A (OUI DF-A9-FF)
        Count: 1
< ACL Data TX: Handle 3477 flags 0x00 dlen 21             #142 [hci1] 11.095524
      SMP: Pairing Random (0x04) len 16
        Random value: 5c2fff312cdf99c9491988e877355a9a
> HCI Event: Number of Completed Packets (0x13) plen 5    #143 [hci1] 11.266928
        Num handles: 1
        Handle: 3477 Address: DF:A9:FF:F6:B1:1A (OUI DF-A9-FF)
        Count: 1
        #142: len 21 (0 Kb/s)
        Latency: 171 msec (71-171 msec ~163 msec)
> ACL Data RX: Handle 3477 flags 0x02 dlen 21             #144 [hci1] 11.354713
      SMP: Pairing Confirm (0x03) len 16
        Confim value: 92884194085eb5cdfbb7161f5b4c9c5c
< HCI Command: Host Number of Com.. (0x03|0x0035) plen 5  #145 [hci1] 11.375303
        Num handles: 1
        Handle: 3477 Address: DF:A9:FF:F6:B1:1A (OUI DF-A9-FF)
        Count: 1
< ACL Data TX: Handle 3477 flags 0x00 dlen 21             #146 [hci1] 11.375509
      SMP: Pairing Confirm (0x03) len 16
        Confim value: 920901deabcc52c42fbb2a41ac083c8c
> HCI Event: Number of Completed Packets (0x13) plen 5    #147 [hci1] 11.529576
        Num handles: 1
        Handle: 3477 Address: DF:A9:FF:F6:B1:1A (OUI DF-A9-FF)
        Count: 1
        #146: len 21 (1 Kb/s)
        Latency: 154 msec (71-171 msec ~159 msec)
> ACL Data RX: Handle 3477 flags 0x02 dlen 21             #148 [hci1] 11.529948
      SMP: Pairing Random (0x04) len 16
        Random value: 2f07cb4807ef283b0000000000000000
< HCI Command: Host Number of Com.. (0x03|0x0035) plen 5  #149 [hci1] 11.535557
        Num handles: 1
        Handle: 3477 Address: DF:A9:FF:F6:B1:1A (OUI DF-A9-FF)
        Count: 1
< ACL Data TX: Handle 3477 flags 0x00 dlen 21             #150 [hci1] 11.535745
      SMP: Pairing Random (0x04) len 16
        Random value: c629a3a987d808e808655d558dfc1155
> HCI Event: Number of Completed Packets (0x13) plen 5    #151 [hci1] 11.704331
        Num handles: 1
        Handle: 3477 Address: DF:A9:FF:F6:B1:1A (OUI DF-A9-FF)
        Count: 1
        #150: len 21 (1 Kb/s)
        Latency: 168 msec (71-171 msec ~163 msec)
> ACL Data RX: Handle 3477 flags 0x02 dlen 21             #152 [hci1] 11.792245
      SMP: Pairing Confirm (0x03) len 16
        Confim value: 6239eab08c6de0f54621847f48f2cea0
< HCI Command: Host Number of Com.. (0x03|0x0035) plen 5  #153 [hci1] 11.794852
        Num handles: 1
        Handle: 3477 Address: DF:A9:FF:F6:B1:1A (OUI DF-A9-FF)
        Count: 1
< ACL Data TX: Handle 3477 flags 0x00 dlen 21             #154 [hci1] 11.794924
      SMP: Pairing Confirm (0x03) len 16
        Confim value: e74f90098bed9d963a3fc6b977964fd1
> HCI Event: Number of Completed Packets (0x13) plen 5    #155 [hci1] 11.967094
        Num handles: 1
        Handle: 3477 Address: DF:A9:FF:F6:B1:1A (OUI DF-A9-FF)
        Count: 1
        #154: len 21 (0 Kb/s)
        Latency: 172 msec (71-172 msec ~167 msec)
> ACL Data RX: Handle 3477 flags 0x02 dlen 21             #156 [hci1] 11.967483
      SMP: Pairing Random (0x04) len 16
        Random value: 59f25cd4feb608ed0000000000000000
< HCI Command: Host Number of Com.. (0x03|0x0035) plen 5  #157 [hci1] 11.975520
        Num handles: 1
        Handle: 3477 Address: DF:A9:FF:F6:B1:1A (OUI DF-A9-FF)
        Count: 1
< ACL Data TX: Handle 3477 flags 0x00 dlen 21             #158 [hci1] 11.975654
      SMP: Pairing Random (0x04) len 16
        Random value: 92f20f6ad8f13724432c7fd6001c45ff
> HCI Event: Number of Completed Packets (0x13) plen 5    #159 [hci1] 12.141953
        Num handles: 1
        Handle: 3477 Address: DF:A9:FF:F6:B1:1A (OUI DF-A9-FF)
        Count: 1
        #158: len 21 (1 Kb/s)
        Latency: 166 msec (71-172 msec ~167 msec)
> ACL Data RX: Handle 3477 flags 0x02 dlen 21             #160 [hci1] 12.229692
      SMP: Pairing Confirm (0x03) len 16
        Confim value: d1230f399f1b82076ac8d70c072a23b1
< HCI Command: Host Number of Com.. (0x03|0x0035) plen 5  #161 [hci1] 12.235084
        Num handles: 1
        Handle: 3477 Address: DF:A9:FF:F6:B1:1A (OUI DF-A9-FF)
        Count: 1
< ACL Data TX: Handle 3477 flags 0x00 dlen 21             #162 [hci1] 12.235147
      SMP: Pairing Confirm (0x03) len 16
        Confim value: 9204dcf84464603f1d42b7c50ef80314
> HCI Event: Number of Completed Packets (0x13) plen 5    #163 [hci1] 12.404647
        Num handles: 1
        Handle: 3477 Address: DF:A9:FF:F6:B1:1A (OUI DF-A9-FF)
        Count: 1
        #162: len 21 (0 Kb/s)
        Latency: 169 msec (71-172 msec ~168 msec)
> ACL Data RX: Handle 3477 flags 0x02 dlen 21             #164 [hci1] 12.404961
      SMP: Pairing Random (0x04) len 16
        Random value: 45af5c8b22e90f1a0000000000000000
< HCI Command: Host Number of Com.. (0x03|0x0035) plen 5  #165 [hci1] 12.415453
        Num handles: 1
        Handle: 3477 Address: DF:A9:FF:F6:B1:1A (OUI DF-A9-FF)
        Count: 1
< ACL Data TX: Handle 3477 flags 0x00 dlen 21             #166 [hci1] 12.415615
      SMP: Pairing Random (0x04) len 16
        Random value: 23ac32ebbb5e14c8a6b9622f296d277f
> HCI Event: Number of Completed Packets (0x13) plen 5    #167 [hci1] 12.579339
        Num handles: 1
        Handle: 3477 Address: DF:A9:FF:F6:B1:1A (OUI DF-A9-FF)
        Count: 1
        #166: len 21 (1 Kb/s)
        Latency: 163 msec (71-172 msec ~166 msec)
> ACL Data RX: Handle 3477 flags 0x02 dlen 21             #168 [hci1] 12.667205
      SMP: Pairing Confirm (0x03) len 16
        Confim value: 6e161f3b3b4a31e0056747d22cb24b46
< HCI Command: Host Number of Com.. (0x03|0x0035) plen 5  #169 [hci1] 12.674946
        Num handles: 1
        Handle: 3477 Address: DF:A9:FF:F6:B1:1A (OUI DF-A9-FF)
        Count: 1
< ACL Data TX: Handle 3477 flags 0x00 dlen 21             #170 [hci1] 12.674982
      SMP: Pairing Confirm (0x03) len 16
        Confim value: 57d15ed886e24e27a88eafcf980e5b5b
> HCI Event: Number of Completed Packets (0x13) plen 5    #171 [hci1] 12.842127
        Num handles: 1
        Handle: 3477 Address: DF:A9:FF:F6:B1:1A (OUI DF-A9-FF)
        Count: 1
        #170: len 21 (1 Kb/s)
        Latency: 167 msec (71-172 msec ~166 msec)
> ACL Data RX: Handle 3477 flags 0x02 dlen 21             #172 [hci1] 12.842422
      SMP: Pairing Random (0x04) len 16
        Random value: ab6bdd5edef7c9be0000000000000000
< HCI Command: Host Number of Com.. (0x03|0x0035) plen 5  #173 [hci1] 12.855525
        Num handles: 1
        Handle: 3477 Address: DF:A9:FF:F6:B1:1A (OUI DF-A9-FF)
        Count: 1
< ACL Data TX: Handle 3477 flags 0x00 dlen 21             #174 [hci1] 12.855695
      SMP: Pairing Random (0x04) len 16
        Random value: 297efe85e67448a15f56bd27e3a3cf1d
> HCI Event: Number of Completed Packets (0x13) plen 5    #175 [hci1] 13.016925
        Num handles: 1
        Handle: 3477 Address: DF:A9:FF:F6:B1:1A (OUI DF-A9-FF)
        Count: 1
        #174: len 21 (1 Kb/s)
        Latency: 161 msec (71-172 msec ~163 msec)
> ACL Data RX: Handle 3477 flags 0x02 dlen 21             #176 [hci1] 13.104750
      SMP: Pairing Confirm (0x03) len 16
        Confim value: 4cd9f6e21e7e28665dbf48a0dc785090
< HCI Command: Host Number of Com.. (0x03|0x0035) plen 5  #177 [hci1] 13.115008
        Num handles: 1
        Handle: 3477 Address: DF:A9:FF:F6:B1:1A (OUI DF-A9-FF)
        Count: 1
< ACL Data TX: Handle 3477 flags 0x00 dlen 21             #178 [hci1] 13.115112
      SMP: Pairing Confirm (0x03) len 16
        Confim value: 94abd4b5c18a89af0928e182ae4c96bf
> HCI Event: Number of Completed Packets (0x13) plen 5    #179 [hci1] 13.279643
        Num handles: 1
        Handle: 3477 Address: DF:A9:FF:F6:B1:1A (OUI DF-A9-FF)
        Count: 1
        #178: len 21 (1 Kb/s)
        Latency: 164 msec (71-172 msec ~164 msec)
> ACL Data RX: Handle 3477 flags 0x02 dlen 21             #180 [hci1] 13.279895
      SMP: Pairing Random (0x04) len 16
        Random value: 3306b47d1d4175c80000000000000000
< HCI Command: Host Number of Com.. (0x03|0x0035) plen 5  #181 [hci1] 13.295530
        Num handles: 1
        Handle: 3477 Address: DF:A9:FF:F6:B1:1A (OUI DF-A9-FF)
        Count: 1
< ACL Data TX: Handle 3477 flags 0x00 dlen 21             #182 [hci1] 13.295717
      SMP: Pairing Random (0x04) len 16
        Random value: 25a9493fd3ce4faf02be7293595bb7c6
> HCI Event: Number of Completed Packets (0x13) plen 5    #183 [hci1] 13.454351
        Num handles: 1
        Handle: 3477 Address: DF:A9:FF:F6:B1:1A (OUI DF-A9-FF)
        Count: 1
        #182: len 21 (1 Kb/s)
        Latency: 158 msec (71-172 msec ~161 msec)
> ACL Data RX: Handle 3477 flags 0x02 dlen 21             #184 [hci1] 13.542273
      SMP: Pairing Confirm (0x03) len 16
        Confim value: 8a1d080909e23729eb5a4c98e890f43f
< HCI Command: Host Number of Com.. (0x03|0x0035) plen 5  #185 [hci1] 13.555348
        Num handles: 1
        Handle: 3477 Address: DF:A9:FF:F6:B1:1A (OUI DF-A9-FF)
        Count: 1
< ACL Data TX: Handle 3477 flags 0x00 dlen 21             #186 [hci1] 13.555520
      SMP: Pairing Confirm (0x03) len 16
        Confim value: 22816aa543d0d9ca58057b6d7a4c27af
> HCI Event: Number of Completed Packets (0x13) plen 5    #187 [hci1] 13.717071
        Num handles: 1
        Handle: 3477 Address: DF:A9:FF:F6:B1:1A (OUI DF-A9-FF)
        Count: 1
        #186: len 21 (1 Kb/s)
        Latency: 161 msec (71-172 msec ~161 msec)
> ACL Data RX: Handle 3477 flags 0x02 dlen 21             #188 [hci1] 13.717416
      SMP: Pairing Random (0x04) len 16
        Random value: f7a5a380fbad78170000000000000000
< HCI Command: Host Number of Com.. (0x03|0x0035) plen 5  #189 [hci1] 13.735673
        Num handles: 1
        Handle: 3477 Address: DF:A9:FF:F6:B1:1A (OUI DF-A9-FF)
        Count: 1
< ACL Data TX: Handle 3477 flags 0x00 dlen 21             #190 [hci1] 13.735851
      SMP: Pairing Random (0x04) len 16
        Random value: 58f6b41f855a6f6c3560debd84e2affc
> HCI Event: Number of Completed Packets (0x13) plen 5    #191 [hci1] 13.891856
        Num handles: 1
        Handle: 3477 Address: DF:A9:FF:F6:B1:1A (OUI DF-A9-FF)
        Count: 1
        #190: len 21 (1 Kb/s)
        Latency: 156 msec (71-172 msec ~158 msec)
> ACL Data RX: Handle 3477 flags 0x02 dlen 21             #192 [hci1] 13.979746
      SMP: Pairing Confirm (0x03) len 16
        Confim value: 7b286df688ecccc50351501553f8ad77
< HCI Command: Host Number of Com.. (0x03|0x0035) plen 5  #193 [hci1] 13.995459
        Num handles: 1
        Handle: 3477 Address: DF:A9:FF:F6:B1:1A (OUI DF-A9-FF)
        Count: 1
< ACL Data TX: Handle 3477 flags 0x00 dlen 21             #194 [hci1] 13.995566
      SMP: Pairing Confirm (0x03) len 16
        Confim value: 303d606dfd9798f30cb00b45977127e5
> HCI Event: Number of Completed Packets (0x13) plen 5    #195 [hci1] 14.154726
        Num handles: 1
        Handle: 3477 Address: DF:A9:FF:F6:B1:1A (OUI DF-A9-FF)
        Count: 1
        #194: len 21 (1 Kb/s)
        Latency: 159 msec (71-172 msec ~158 msec)
> ACL Data RX: Handle 3477 flags 0x02 dlen 21             #196 [hci1] 14.154972
      SMP: Pairing Random (0x04) len 16
        Random value: 550d15e80e8ddf7b0000000000000000
< HCI Command: Host Number of Com.. (0x03|0x0035) plen 5  #197 [hci1] 14.175563
        Num handles: 1
        Handle: 3477 Address: DF:A9:FF:F6:B1:1A (OUI DF-A9-FF)
        Count: 1
< ACL Data TX: Handle 3477 flags 0x00 dlen 21             #198 [hci1] 14.175671
      SMP: Pairing Random (0x04) len 16
        Random value: b67e7216d5bf664139eda2b542549666
> HCI Event: Number of Completed Packets (0x13) plen 5    #199 [hci1] 14.329376
        Num handles: 1
        Handle: 3477 Address: DF:A9:FF:F6:B1:1A (OUI DF-A9-FF)
        Count: 1
        #198: len 21 (1 Kb/s)
        Latency: 153 msec (71-172 msec ~156 msec)
> ACL Data RX: Handle 3477 flags 0x02 dlen 21             #200 [hci1] 14.417263
      SMP: Pairing Confirm (0x03) len 16
        Confim value: 46799e94765aa1b7535c8670e85ce31c
< HCI Command: Host Number of Com.. (0x03|0x0035) plen 5  #201 [hci1] 14.435252
        Num handles: 1
        Handle: 3477 Address: DF:A9:FF:F6:B1:1A (OUI DF-A9-FF)
        Count: 1
< ACL Data TX: Handle 3477 flags 0x00 dlen 21             #202 [hci1] 14.435329
      SMP: Pairing Confirm (0x03) len 16
        Confim value: a16c24cca55d92a7af404729ef10764b
> HCI Event: Number of Completed Packets (0x13) plen 5    #203 [hci1] 14.592069
        Num handles: 1
        Handle: 3477 Address: DF:A9:FF:F6:B1:1A (OUI DF-A9-FF)
        Count: 1
        #202: len 21 (1 Kb/s)
        Latency: 156 msec (71-172 msec ~156 msec)
> ACL Data RX: Handle 3477 flags 0x02 dlen 21             #204 [hci1] 14.592470
      SMP: Pairing Random (0x04) len 16
        Random value: 1022312214e88d240000000000000000
< HCI Command: Host Number of Com.. (0x03|0x0035) plen 5  #205 [hci1] 14.595639
        Num handles: 1
        Handle: 3477 Address: DF:A9:FF:F6:B1:1A (OUI DF-A9-FF)
        Count: 1
< ACL Data TX: Handle 3477 flags 0x00 dlen 21             #206 [hci1] 14.595739
      SMP: Pairing Random (0x04) len 16
        Random value: ed17f76500c95219dd01e09d1e63f87b
> HCI Event: Number of Completed Packets (0x13) plen 5    #207 [hci1] 14.766874
        Num handles: 1
        Handle: 3477 Address: DF:A9:FF:F6:B1:1A (OUI DF-A9-FF)
        Count: 1
        #206: len 21 (0 Kb/s)
        Latency: 171 msec (71-172 msec ~163 msec)
> ACL Data RX: Handle 3477 flags 0x02 dlen 21             #208 [hci1] 14.854717
      SMP: Pairing Confirm (0x03) len 16
        Confim value: 220092f499d16b29e2662010db04647f
< HCI Command: Host Number of Com.. (0x03|0x0035) plen 5  #209 [hci1] 14.875286
        Num handles: 1
        Handle: 3477 Address: DF:A9:FF:F6:B1:1A (OUI DF-A9-FF)
        Count: 1
< ACL Data TX: Handle 3477 flags 0x00 dlen 21             #210 [hci1] 14.875500
      SMP: Pairing Confirm (0x03) len 16
        Confim value: a79ce7fbc8826aad16d6794823e7370a
> HCI Event: Number of Completed Packets (0x13) plen 5    #211 [hci1] 15.029547
        Num handles: 1
        Handle: 3477 Address: DF:A9:FF:F6:B1:1A (OUI DF-A9-FF)
        Count: 1
        #210: len 21 (1 Kb/s)
        Latency: 154 msec (71-172 msec ~158 msec)
> ACL Data RX: Handle 3477 flags 0x02 dlen 21             #212 [hci1] 15.029905
      SMP: Pairing Random (0x04) len 16
        Random value: 84dc2f45a5a3b2af0000000000000000
< HCI Command: Host Number of Com.. (0x03|0x0035) plen 5  #213 [hci1] 15.035625
        Num handles: 1
        Handle: 3477 Address: DF:A9:FF:F6:B1:1A (OUI DF-A9-FF)
        Count: 1
< ACL Data TX: Handle 3477 flags 0x00 dlen 21             #214 [hci1] 15.035791
      SMP: Pairing Random (0x04) len 16
        Random value: 81d35d47e1f6006d79c974bd9d9e1ee3
> HCI Event: Number of Completed Packets (0x13) plen 5    #215 [hci1] 15.204441
        Num handles: 1
        Handle: 3477 Address: DF:A9:FF:F6:B1:1A (OUI DF-A9-FF)
        Count: 1
        #214: len 21 (1 Kb/s)
        Latency: 168 msec (71-172 msec ~163 msec)
> ACL Data RX: Handle 3477 flags 0x02 dlen 21             #216 [hci1] 15.292267
      SMP: Pairing Confirm (0x03) len 16
        Confim value: 0920237209065c41ad3e9a03d8c05e62
< HCI Command: Host Number of Com.. (0x03|0x0035) plen 5  #217 [hci1] 15.295361
        Num handles: 1
        Handle: 3477 Address: DF:A9:FF:F6:B1:1A (OUI DF-A9-FF)
        Count: 1
< ACL Data TX: Handle 3477 flags 0x00 dlen 21             #218 [hci1] 15.295494
      SMP: Pairing Confirm (0x03) len 16
        Confim value: 193e905c234a0af8d775e9710289f3cb
> HCI Event: Number of Completed Packets (0x13) plen 5    #219 [hci1] 15.467043
        Num handles: 1
        Handle: 3477 Address: DF:A9:FF:F6:B1:1A (OUI DF-A9-FF)
        Count: 1
        #218: len 21 (0 Kb/s)
        Latency: 171 msec (71-172 msec ~167 msec)
> ACL Data RX: Handle 3477 flags 0x02 dlen 21             #220 [hci1] 15.467423
      SMP: Pairing Random (0x04) len 16
        Random value: 32afcc7e5ae35a570000000000000000
< HCI Command: Host Number of Com.. (0x03|0x0035) plen 5  #221 [hci1] 15.475581
        Num handles: 1
        Handle: 3477 Address: DF:A9:FF:F6:B1:1A (OUI DF-A9-FF)
        Count: 1
< ACL Data TX: Handle 3477 flags 0x00 dlen 21             #222 [hci1] 15.475756
      SMP: Pairing Random (0x04) len 16
        Random value: e7f7e0c2476823e41736a7e381bafb7c
> HCI Event: Number of Completed Packets (0x13) plen 5    #223 [hci1] 15.641799
        Num handles: 1
        Handle: 3477 Address: DF:A9:FF:F6:B1:1A (OUI DF-A9-FF)
        Count: 1
        #222: len 21 (1 Kb/s)
        Latency: 166 msec (71-172 msec ~166 msec)
> ACL Data RX: Handle 3477 flags 0x02 dlen 21             #224 [hci1] 15.729711
      SMP: Pairing Confirm (0x03) len 16
        Confim value: b55e74eb4143a861c9fe6f7e5826ea69
< HCI Command: Host Number of Com.. (0x03|0x0035) plen 5  #225 [hci1] 15.735214
        Num handles: 1
        Handle: 3477 Address: DF:A9:FF:F6:B1:1A (OUI DF-A9-FF)
        Count: 1
< ACL Data TX: Handle 3477 flags 0x00 dlen 21             #226 [hci1] 15.735292
      SMP: Pairing Confirm (0x03) len 16
        Confim value: eb7b8a4f1cfb58b3592eac3f54d35c48
> HCI Event: Number of Completed Packets (0x13) plen 5    #227 [hci1] 15.904579
        Num handles: 1
        Handle: 3477 Address: DF:A9:FF:F6:B1:1A (OUI DF-A9-FF)
        Count: 1
        #226: len 21 (0 Kb/s)
        Latency: 169 msec (71-172 msec ~168 msec)
> ACL Data RX: Handle 3477 flags 0x02 dlen 21             #228 [hci1] 15.904837
      SMP: Pairing Random (0x04) len 16
        Random value: 940d79cf1cee3b040000000000000000
