Bluetooth monitor ver 5.72
= Note: Linux version 7.0.0-31-generic (x86_64)                        0.782612
= Note: Bluetooth subsystem version 2.22                               0.782614
= New Index: 00:00:00:00:00:00 (Primary,UART,hci1)              [hci1] 0.782615
= New Index: 48:5F:99:8E:E0:64 (Primary,USB,hci0)               [hci0] 0.782615
= Open Index: 00:00:00:00:00:00                                 [hci1] 0.855783
= Index Info: 00:00:00:00:00:00 (Nordic Semiconductor ASA)      [hci1] 0.855787
@ USER Open: main (privileged) version 2.22            {0x0001} [hci1] 0.855790
< HCI Command: Reset (0x03|0x0003) plen 0                    #1 [hci1] 0.856080
> HCI Event: Command Complete (0x0e) plen 4                  #2 [hci1] 0.856605
      Reset (0x03|0x0003) ncmd 1
        Status: Success (0x00)
< HCI Command: Read Local Supported... (0x04|0x0003) plen 0  #3 [hci1] 0.875807
> HCI Event: Command Complete (0x0e) plen 12                 #4 [hci1] 0.876328
      Read Local Supported Features (0x04|0x0003) ncmd 1
        Status: Success (0x00)
        Features: 0x00 0x00 0x00 0x00 0x60 0x00 0x00 0x00
          BR/EDR Not Supported
          LE Supported (Controller)
< HCI Command: Read Local Version In.. (0x04|0x0001) plen 0  #5 [hci1] 0.895803
> HCI Event: Command Complete (0x0e) plen 12                 #6 [hci1] 0.896316
      Read Local Version Information (0x04|0x0001) ncmd 1
        Status: Success (0x00)
        HCI version: Reserved (0x11) - Revision 12345 (0x3039)
        LMP version: Reserved (0x11) - Subversion 12345 (0x3039)
        Manufacturer: Nordic Semiconductor ASA (89)
< HCI Command: Read Local Supported... (0x04|0x0002) plen 0  #7 [hci1] 0.915767
> HCI Event: Command Complete (0x0e) plen 68                 #8 [hci1] 0.916818
      Read Local Supported Commands (0x04|0x0002) ncmd 1
        Status: Success (0x00)
        Commands: 115 entries
          Disconnect (Octet 0 - Bit 5)
          Read Remote Version Information (Octet 2 - Bit 7)
          Set Event Mask (Octet 5 - Bit 6)
          Reset (Octet 5 - Bit 7)
          Read Connection Accept Timeout (Octet 7 - Bit 2)
          Write Connection Accept Timeout (Octet 7 - Bit 3)
          Read Transmit Power Level (Octet 10 - Bit 2)
          Set Controller To Host Flow Control (Octet 10 - Bit 5)
          Host Buffer Size (Octet 10 - Bit 6)
          Host Number of Completed Packets (Octet 10 - Bit 7)
          Read Local Version Information (Octet 14 - Bit 3)
          Read Local Supported Features (Octet 14 - Bit 5)
          Read BD ADDR (Octet 15 - Bit 1)
          Read RSSI (Octet 15 - Bit 5)
          Set Event Mask Page 2 (Octet 22 - Bit 2)
          LE Set Event Mask (Octet 25 - Bit 0)
          LE Read Buffer Size (Octet 25 - Bit 1)
          LE Read Local Supported Features (Octet 25 - Bit 2)
          LE Set Random Address (Octet 25 - Bit 4)
          LE Set Advertising Parameters (Octet 25 - Bit 5)
          LE Read Advertising Channel TX Power (Octet 25 - Bit 6)
          LE Set Advertising Data (Octet 25 - Bit 7)
          LE Set Scan Response Data (Octet 26 - Bit 0)
          LE Set Advertise Enable (Octet 26 - Bit 1)
          LE Set Scan Parameters (Octet 26 - Bit 2)
          LE Set Scan Enable (Octet 26 - Bit 3)
          LE Create Connection (Octet 26 - Bit 4)
          LE Create Connection Cancel (Octet 26 - Bit 5)
          LE Read Accept List Size (Octet 26 - Bit 6)
          LE Clear Accept List (Octet 26 - Bit 7)
          LE Add Device To Accept List (Octet 27 - Bit 0)
          LE Remove Device From Accept List (Octet 27 - Bit 1)
          LE Connection Update (Octet 27 - Bit 2)
          LE Set Host Channel Classification (Octet 27 - Bit 3)
          LE Read Channel Map (Octet 27 - Bit 4)
          LE Read Remote Used Features (Octet 27 - Bit 5)
          LE Encrypt (Octet 27 - Bit 6)
          LE Rand (Octet 27 - Bit 7)
          LE Start Encryption (Octet 28 - Bit 0)
          LE Long Term Key Request Reply (Octet 28 - Bit 1)
          LE Long Term Key Request Neg Reply (Octet 28 - Bit 2)
          LE Read Supported States (Octet 28 - Bit 3)
          Read Authenticated Payload Timeout (Octet 32 - Bit 4)
          Write Authenticated Payload Timeout (Octet 32 - Bit 5)
          LE Set Data Length (Octet 33 - Bit 6)
          LE Read Suggested Default Data Length (Octet 33 - Bit 7)
          LE Write Suggested Default Data Length (Octet 34 - Bit 0)
          LE Add Device To Resolving List (Octet 34 - Bit 3)
          LE Remove Device From Resolving List (Octet 34 - Bit 4)
          LE Clear Resolving List (Octet 34 - Bit 5)
          LE Read Resolving List Size (Octet 34 - Bit 6)
          LE Set Address Resolution Enable (Octet 35 - Bit 1)
          LE Set Resolvable Private Address Timeout (Octet 35 - Bit 2)
          LE Read Maximum Data Length (Octet 35 - Bit 3)
          LE Read PHY (Octet 35 - Bit 4)
          LE Set Default PHY (Octet 35 - Bit 5)
          LE Set PHY (Octet 35 - Bit 6)
          LE Set Advertising Set Random Address (Octet 36 - Bit 1)
          LE Set Extended Advertising Parameters (Octet 36 - Bit 2)
          LE Set Extended Advertising Data (Octet 36 - Bit 3)
          LE Set Extended Scan Response Data (Octet 36 - Bit 4)
          LE Set Extended Advertising Enable (Octet 36 - Bit 5)
          LE Read Maximum Advertising Data Length (Octet 36 - Bit 6)
          LE Read Number of Supported Advertising Sets (Octet 36 - Bit 7)
          LE Remove Advertising Set (Octet 37 - Bit 0)
          LE Clear Advertising Sets (Octet 37 - Bit 1)
          LE Set Periodic Advertising Parameters (Octet 37 - Bit 2)
          LE Set Periodic Advertising Data (Octet 37 - Bit 3)
          LE Set Periodic Advertising Enable (Octet 37 - Bit 4)
          LE Set Extended Scan Parameters (Octet 37 - Bit 5)
          LE Set Extended Scan Enable (Octet 37 - Bit 6)
          LE Extended Create Connection (Octet 37 - Bit 7)
          LE Periodic Advertising Create Sync (Octet 38 - Bit 0)
          LE Periodic Advertising Create Sync Cancel (Octet 38 - Bit 1)
          LE Periodic Advertising Terminate Sync (Octet 38 - Bit 2)
          LE Add Device To Periodic Advertiser List (Octet 38 - Bit 3)
          LE Remove Device From Periodic Advertiser List (Octet 38 - Bit 4)
          LE Clear Periodic Advertiser List (Octet 38 - Bit 5)
          LE Read Periodic Advertiser List Size (Octet 38 - Bit 6)
          LE Read Transmit Power (Octet 38 - Bit 7)
          LE Read RF Path Compensation (Octet 39 - Bit 0)
          LE Write RF Path Compensation (Octet 39 - Bit 1)
          LE Set Privacy Mode (Octet 39 - Bit 2)
          LE Periodic Advertising Receive Enable (Octet 40 - Bit 5)
          LE Periodic Advertising Sync Transfer (Octet 40 - Bit 6)
          LE Periodic Advertising Set Info Transfer (Octet 40 - Bit 7)
          LE Periodic Advertising Sync Transfer Parameters (Octet 41 - Bit 0)
          LE Set Default Periodic Advertisng Sync Transfer Parameters (Octet 41 - Bit 1)
          LE Read Buffer v2 (Octet 41 - Bit 5)
          LE Read ISO TX Sync (Octet 41 - Bit 6)
          LE Set Connected Isochronous Group Parameters (Octet 41 - Bit 7)
          LE Set Connected Isochronous Group Parameters Test (Octet 42 - Bit 0)
          LE Create Connected Isochronous Stream (Octet 42 - Bit 1)
          LE Remove Connected Isochronous Group (Octet 42 - Bit 2)
          LE Accept Connected Isochronous Stream Request (Octet 42 - Bit 3)
          LE Reject Connected Isochronous Stream Request (Octet 42 - Bit 4)
          LE Create Broadcast Isochronous Group (Octet 42 - Bit 5)
          LE Create Broadcast Isochronous Group Test (Octet 42 - Bit 6)
          LE Terminate Broadcast Isochronous Group (Octet 42 - Bit 7)
          LE Broadcast Isochronous Group Create Sync (Octet 43 - Bit 0)
          LE Broadcast Isochronous Group Terminate Sync (Octet 43 - Bit 1)
          LE Request Peer SCA (Octet 43 - Bit 2)
          LE Setup Isochronous Data Path (Octet 43 - Bit 3)
          LE Remove Isochronous Data Path (Octet 43 - Bit 4)
          LE Isochronous Transmit Test (Octet 43 - Bit 5)
          LE Isochronous Receive Test (Octet 43 - Bit 6)
          LE Isochronous Read Test Counters (Octet 43 - Bit 7)
          LE Isochronous Read Test Counters (Octet 44 - Bit 0)
          LE Set Host Feature (Octet 44 - Bit 1)
          Octet 44 - Bit 2 
          Octet 45 - Bit 6 
          Octet 46 - Bit 0 
          Octet 46 - Bit 1 
          Octet 46 - Bit 2 
          Octet 47 - Bit 4 
< HCI Command: Host Buffer Size (0x03|0x0033) plen 7         #9 [hci1] 0.935792
        ACL MTU: 255  ACL max packet: 16
        SCO MTU: 0    SCO max packet: 0
> HCI Event: Command Complete (0x0e) plen 4                 #10 [hci1] 0.936283
      Host Buffer Size (0x03|0x0033) ncmd 1
        Status: Success (0x00)
< HCI Command: Set Controller To Ho.. (0x03|0x0031) plen 1  #11 [hci1] 0.955818
        Flow control: ACL Data Packets (0x01)
> HCI Event: Command Complete (0x0e) plen 4                 #12 [hci1] 0.956254
      Set Controller To Host Flow Control (0x03|0x0031) ncmd 1
        Status: Success (0x00)
< HCI Command: LE Read Local Suppor.. (0x08|0x0003) plen 0  #13 [hci1] 0.975790
> HCI Event: Command Complete (0x0e) plen 12                #14 [hci1] 0.976244
      LE Read Local Supported Features (0x08|0x0003) ncmd 1
        Status: Success (0x00)
        Features: 0xfd 0x79 0x00 0xf7 0x30 0x01 0x00 0x00
          LE Encryption
          Extended Reject Indication
          Peripheral-initiated Features Exchange
          LE Ping
          LE Data Packet Length Extension
          LL Privacy
          Extended Scanner Filter Policies
          LE 2M PHY
          LE Coded PHY
          LE Extended Advertising
          LE Periodic Advertising
          Channel Selection Algorithm #2
          Periodic Advertising Sync Transfer - Sender
          Periodic Advertising Sync Transfer - Recipient
          Sleep Clock Accuracy Updates
          Connected Isochronous Stream - Central
          Connected Isochronous Stream - Peripheral
          Isochronous Broadcaster
          Synchronized Receiver
          Periodic Advertising ADI support
          Connection Subrating
          Unknown features (0x0000010000000000)
< HCI Command: LE Set Host Feature (0x08|0x0074) plen 2     #15 [hci1] 0.995787
        Bit Number: 32
          Connected Isochronous Stream (Host Support)
        Bit Value: 1
> HCI Event: Command Complete (0x0e) plen 4                 #16 [hci1] 0.996238
      LE Set Host Feature (0x08|0x0074) ncmd 1
        Status: Success (0x00)
< HCI Command: LE Read Buffer v2 (0x08|0x0060) plen 0       #17 [hci1] 1.015786
> HCI Event: Command Complete (0x0e) plen 10                #18 [hci1] 1.016207
      LE Read Buffer v2 (0x08|0x0060) ncmd 1
        Status: Success (0x00)
        ACL MTU: 27
        ACL max packet: 3
        ISO MTU: 318
        ISO max packet: 3
< HCI Command: LE Read Maximum Adve.. (0x08|0x003a) plen 0  #19 [hci1] 1.035820
> HCI Event: Command Complete (0x0e) plen 6                 #20 [hci1] 1.036337
      LE Read Maximum Advertising Data Length (0x08|0x003a) ncmd 1
        Status: Success (0x00)
        Max length: 1650
< HCI Command: LE Read Supported St.. (0x08|0x001c) plen 0  #21 [hci1] 1.055734
> HCI Event: Command Complete (0x0e) plen 12                #22 [hci1] 1.056280
      LE Read Supported States (0x08|0x001c) ncmd 1
        Status: Success (0x00)
        States: 0x000003ff3e0306ff
          Non-connectable Advertising State
          Scannable Advertising State
          Connectable Advertising State
          High Duty Cycle Directed Advertising State
          Passive Scanning State
          Active Scanning State
          Initiating State
            and Connection State (Central Role)
          Connection State (Peripheral Role)
          Scannable Advertising State
            and Passive Scanning State
          Connectable Advertising State
            and Passive Scanning State
          Non-connectable Advertising State
            and Initiating State
          Scannable Advertising State
            and Initiating State
          Active Scanning State
            and Connection State (Central Role)
          Passive Scanning State
            and Connection State (Peripheral Role)
          Active Scanning State
            and Connection State (Peripheral Role)
          Initiating State
            and Connection State (Central Role)
            and Central Role & Central Role
          Low Duty Cycle Directed Advertising State
          Connectable Advertising State
            and Initiating State
            and Central Role & Peripheral Role
          High Duty Cycle Directed Advertising State
            and Initiating State
            and Central Role & Peripheral Role
          Low Duty Cycle Directed Advertising State
            and Initiating State
            and Central Role & Peripheral Role
          Connectable Advertising State
            and Connection State (Central Role)
            and Central Role & Peripheral Role
          High Duty Cycle Directed Advertising State
            and Connection State (Central Role)
            and Central Role & Peripheral Role
          Low Duty Cycle Directed Advertising State
            and Connection State (Central Role)
            and Central Role & Peripheral Role
          Connectable Advertising State
            and Connection State (Peripheral Role)
            and Central Role & Peripheral Role
          High Duty Cycle Directed Advertising State
            and Connection State (Peripheral Role)
            and Peripheral Role & Peripheral Role
          Low Duty Cycle Directed Advertising State
            and Connection State (Peripheral Role)
            and Peripheral Role & Peripheral Role
          Initiating State
            and Connection State (Peripheral Role)
            and Central Role & Peripheral Role
< HCI Command: LE Read Maximum Data.. (0x08|0x002f) plen 0  #23 [hci1] 1.075799
> HCI Event: Command Complete (0x0e) plen 12                #24 [hci1] 1.076314
      LE Read Maximum Data Length (0x08|0x002f) ncmd 1
        Status: Success (0x00)
        Max TX octets: 251
        Max TX time: 2704
        Max RX octets: 251
        Max RX time: 2704
< HCI Command: LE Write Suggested D.. (0x08|0x0024) plen 4  #25 [hci1] 1.095799
        TX octets: 251
        TX time: 2704
> HCI Event: Command Complete (0x0e) plen 4                 #26 [hci1] 1.096322
      LE Write Suggested Default Data Length (0x08|0x0024) ncmd 1
        Status: Success (0x00)
< HCI Command: LE Read Resolving Li.. (0x08|0x002a) plen 0  #27 [hci1] 1.115788
> HCI Event: Command Complete (0x0e) plen 5                 #28 [hci1] 1.116186
      LE Read Resolving List Size (0x08|0x002a) ncmd 1
        Status: Success (0x00)
        Size: 8
< HCI Command: LE Set Host Feature (0x08|0x0074) plen 2     #29 [hci1] 1.135791
        Bit Number: 38
          Connection Subrating (Host Support)
        Bit Value: 1
> HCI Event: Command Complete (0x0e) plen 4                 #30 [hci1] 1.136203
      LE Set Host Feature (0x08|0x0074) ncmd 1
        Status: Success (0x00)
< HCI Command: LE Set Event Mask (0x08|0x0001) plen 8       #31 [hci1] 1.155793
        Mask: 0x000002063f87fa5e
          LE Advertising Report
          LE Connection Update Complete
          LE Read Remote Used Features Complete
          LE Long Term Key Request
          LE Data Length Change
          LE Enhanced Connection Complete
          LE PHY Update Complete
          LE Extended Advertising Report
          LE Periodic Advertising Sync Established
          LE Periodic Advertising Report
          LE Periodic Advertising Sync Lost
          LE Extended Scan Timeout
          LE Extended Advertising Set Terminated
          LE Scan Request Received
          LE Periodic Advertising Sync Transfer Rvc
          LE CIS Established
          LE CIS Request
          LE Create BIG Complete
          LE Terminate BIG Complete
          LE BIG Sync Estabilished Complete
          LE BIG Sync Lost
          LE BIG Info Advertising Report
          LE Subrate Change
          Unknown mask (0x0000020000000000)
> HCI Event: Command Complete (0x0e) plen 4                 #32 [hci1] 1.156282
      LE Set Event Mask (0x08|0x0001) ncmd 1
        Status: Success (0x00)
< HCI Command: Set Event Mask (0x03|0x0001) plen 8          #33 [hci1] 1.175795
        Mask: 0x2000800002008890
          Disconnection Complete
          Encryption Change
          Read Remote Version Information Complete
          Hardware Error
          Data Buffer Overflow
          Encryption Key Refresh Complete
          LE Meta
> HCI Event: Command Complete (0x0e) plen 4                 #34 [hci1] 1.176314
      Set Event Mask (0x03|0x0001) ncmd 1
        Status: Success (0x00)
< HCI Command: Read BD ADDR (0x04|0x0009) plen 0            #35 [hci1] 1.195776
> HCI Event: Command Complete (0x0e) plen 10                #36 [hci1] 1.196328
      Read BD ADDR (0x04|0x0009) ncmd 1
        Status: Success (0x00)
        Address: 00:00:00:00:00:00 (OUI 00-00-00)
< HCI Command: LE Set Random Address (0x08|0x0005) plen 6   #37 [hci1] 1.215799
        Address: D5:B6:CC:31:DB:3B (Static)
> HCI Event: Command Complete (0x0e) plen 4                 #38 [hci1] 1.216275
      LE Set Random Address (0x08|0x0005) ncmd 1
        Status: Success (0x00)
< HCI Command: LE Set Extended Adv.. (0x08|0x0036) plen 25  #39 [hci1] 4.666314
        Handle: 0x00
        Properties: 0x0013
          Connectable
          Scannable
          Use legacy advertising PDUs: ADV_IND
        Min advertising interval: 100.000 msec (0x00a0)
        Max advertising interval: 150.000 msec (0x00f0)
        Channel map: 37, 38, 39 (0x07)
        Own address type: Random (0x01)
        Peer address type: Public (0x00)
        Peer address: 00:00:00:00:00:00 (OUI 00-00-00)
        Filter policy: Allow Scan Request from Any, Allow Connect Request from Any (0x00)
        TX power: Host has no preference (0x7f)
        Primary PHY: LE 1M (0x01)
        Secondary max skip: 0x00
        Secondary PHY: LE 1M (0x01)
        SID: 0x00
        Scan request notifications: Disabled (0x00)
> HCI Event: Command Complete (0x0e) plen 5                 #40 [hci1] 4.667156
      LE Set Extended Advertising Parameters (0x08|0x0036) ncmd 1
        Status: Success (0x00)
        TX power (selected): 0 dbm (0x00)
< HCI Command: LE Set Advertising S.. (0x08|0x0035) plen 7  #41 [hci1] 4.676161
        Advertising handle: 0x00
        Advertising random address: D5:B6:CC:31:DB:3B (Static)
> HCI Event: Command Complete (0x0e) plen 4                 #42 [hci1] 4.676699
      LE Set Advertising Set Random Address (0x08|0x0035) ncmd 1
        Status: Success (0x00)
< HCI Command: LE Set Extended Adv.. (0x08|0x0037) plen 22  #43 [hci1] 4.696045
        Handle: 0x00
        Operation: Complete extended advertising data (0x03)
        Fragment preference: Minimize fragmentation (0x01)
        Data length: 0x12
        Flags: 0x04
          BR/EDR Not Supported
        Name (complete): Tester_F6B11A
> HCI Event: Command Complete (0x0e) plen 4                 #44 [hci1] 4.696817
      LE Set Extended Advertising Data (0x08|0x0037) ncmd 1
        Status: Success (0x00)
< HCI Command: LE Set Extended Scan.. (0x08|0x0038) plen 4  #45 [hci1] 4.715943
        Handle: 0x00
        Operation: Complete scan response data (0x03)
        Fragment preference: Minimize fragmentation (0x01)
        Data length: 0x00
> HCI Event: Command Complete (0x0e) plen 4                 #46 [hci1] 4.716364
      LE Set Extended Scan Response Data (0x08|0x0038) ncmd 1
        Status: Success (0x00)
< HCI Command: LE Set Extended Adve.. (0x08|0x0039) plen 6  #47 [hci1] 4.735837
        Extended advertising: Enabled (0x01)
        Number of sets: 1 (0x01)
        Entry 0
          Handle: 0x00
          Duration: 0 ms (0x00)
          Max ext adv events: 0
> HCI Event: Command Complete (0x0e) plen 4                 #48 [hci1] 4.736444
      LE Set Extended Advertising Enable (0x08|0x0039) ncmd 1
        Status: Success (0x00)
> HCI Event: LE Meta Event (0x3e) plen 31                   #49 [hci1] 5.471822
      LE Enhanced Connection Complete (0x0a)
        Status: Success (0x00)
        Handle: 363
        Role: Peripheral (0x01)
        Peer address type: Public (0x00)
        Peer address: DF:A9:FF:F6:B1:1A (OUI DF-A9-FF)
        Local resolvable private address: 00:00:00:00:00:00 (Non-Resolvable)
        Peer resolvable private address: 00:00:00:00:00:00 (Non-Resolvable)
        Connection interval: 87.50 msec (0x0046)
        Connection latency: 0 (0x0000)
        Supervision timeout: 20000 msec (0x07d0)
        Central clock accuracy: 0x01
> HCI Event: LE Meta Event (0x3e) plen 6                    #50 [hci1] 5.471838
      LE Advertising Set Terminated (0x12)
        Status: Success (0x00)
        Handle: 0
        Connection handle: 363
        Number of completed extended advertising events: 0
< HCI Command: LE Read Remote Used... (0x08|0x0016) plen 2  #51 [hci1] 5.476203
        Handle: 363 Address: DF:A9:FF:F6:B1:1A (OUI DF-A9-FF)
> HCI Event: Command Status (0x0f) plen 4                   #52 [hci1] 5.476680
      LE Read Remote Used Features (0x08|0x0016) ncmd 1
        Status: Success (0x00)
> HCI Event: LE Meta Event (0x3e) plen 12                   #53 [hci1] 5.735713
      LE Read Remote Used Features (0x04)
        Status: Success (0x00)
        Handle: 363 Address: DF:A9:FF:F6:B1:1A (OUI DF-A9-FF)
        Features: 0x2d 0x49 0x00 0xf7 0x67 0xd9 0x00 0x80
          LE Encryption
          Extended Reject Indication
          Peripheral-initiated Features Exchange
          LE Data Packet Length Extension
          LE 2M PHY
          LE Coded PHY
          Channel Selection Algorithm #2
          Periodic Advertising Sync Transfer - Sender
          Periodic Advertising Sync Transfer - Recipient
          Sleep Clock Accuracy Updates
          Connected Isochronous Stream - Central
          Connected Isochronous Stream - Peripheral
          Isochronous Broadcaster
          Synchronized Receiver
          Connected Isochronous Stream (Host Support)
          LE Power Control Request
          LE Power Control Request
          Connection Subrating
          Connection Subrating (Host Support)
          Unknown features (0x8000d90000000000)
> ACL Data RX: Handle 363 flags 0x02 dlen 11                #54 [hci1] 8.185451
      SMP: Pairing Request (0x01) len 6
        IO capability: KeyboardDisplay (0x04)
        OOB data: Authentication data not present (0x00)
        Authentication requirement: Bonding, No MITM, SC, No Keypresses (0x09)
        Max encryption key size: 16
        Initiator key distribution: EncKey IdKey (0x03)
        Responder key distribution: EncKey IdKey Sign (0x07)
< HCI Command: Host Number of Compl.. (0x03|0x0035) plen 5  #55 [hci1] 8.196451
        Num handles: 1
        Handle: 363 Address: DF:A9:FF:F6:B1:1A (OUI DF-A9-FF)
        Count: 1
< ACL Data TX: Handle 363 flags 0x00 dlen 11                #56 [hci1] 8.196509
      SMP: Pairing Response (0x02) len 6
        IO capability: NoInputNoOutput (0x03)
        OOB data: Authentication data not present (0x00)
        Authentication requirement: Bonding, No MITM, SC, No Keypresses (0x09)
        Max encryption key size: 16
        Initiator key distribution: IdKey (0x02)
        Responder key distribution: <none> (0x00)
> HCI Event: Number of Completed Packets (0x13) plen 5      #57 [hci1] 8.360536
        Num handles: 1
        Handle: 363 Address: DF:A9:FF:F6:B1:1A (OUI DF-A9-FF)
        Count: 1
        #56: len 11 (0 Kb/s)
        Latency: 164 msec (164-164 msec ~164 msec)
> ACL Data RX: Handle 363 flags 0x02 dlen 27                #58 [hci1] 8.360803
> ACL Data RX: Handle 363 flags 0x01 dlen 27                #59 [hci1] 8.361388
> ACL Data RX: Handle 363 flags 0x01 dlen 15                #60 [hci1] 8.361846
      SMP: Pairing Public Key (0x0c) len 64
        X: c0b040ba6e36f384fe8309a84b9e15b811f0fd550d4bc515e0f93593b30d8d14
        Y: e529d61f1a4c324667c793fea34da45a04ee7403bd0fd4cbaa87a8f883467012
< HCI Command: Host Number of Compl.. (0x03|0x0035) plen 5  #61 [hci1] 8.376197
        Num handles: 1
        Handle: 363 Address: DF:A9:FF:F6:B1:1A (OUI DF-A9-FF)
        Count: 1
< HCI Command: Host Number of Compl.. (0x03|0x0035) plen 5  #62 [hci1] 8.376240
        Num handles: 1
        Handle: 363 Address: DF:A9:FF:F6:B1:1A (OUI DF-A9-FF)
        Count: 1
< HCI Command: Host Number of Compl.. (0x03|0x0035) plen 5  #63 [hci1] 8.376424
        Num handles: 1
        Handle: 363 Address: DF:A9:FF:F6:B1:1A (OUI DF-A9-FF)
        Count: 1
< ACL Data TX: Handle 363 flags 0x00 dlen 27                #64 [hci1] 8.376432
< ACL Data TX: Handle 363 flags 0x01 dlen 27                #65 [hci1] 8.376434
< ACL Data TX: Handle 363 flags 0x01 dlen 15                #66 [hci1] 8.376457
      SMP: Pairing Public Key (0x0c) len 64
        X: 98308440221e2d910f0e54b71e7ec652857aa9b5a0dc65028824cc19db1226e9
        Y: 67a4816bcb62efb21701e31fdb27561a6217575fb007a8bbdabe7e28b6f68482
> HCI Event: Number of Completed Packets (0x13) plen 5      #67 [hci1] 8.448400
        Num handles: 1
        Handle: 363 Address: DF:A9:FF:F6:B1:1A (OUI DF-A9-FF)
        Count: 1
        #64: len 27 (3 Kb/s)
        Latency: 71 msec (71-164 msec ~117 msec)
> HCI Event: Number of Completed Packets (0x13) plen 5      #68 [hci1] 8.449045
        Num handles: 1
        Handle: 363 Address: DF:A9:FF:F6:B1:1A (OUI DF-A9-FF)
        Count: 1
        #65: len 27 (3 Kb/s)
        Latency: 72 msec (71-164 msec ~95 msec)
< ACL Data TX: Handle 363 flags 0x00 dlen 21                #69 [hci1] 8.455909
      SMP: Pairing Confirm (0x03) len 16
        Confim value: b991d4b15af046354f5af39f3317e80b
> HCI Event: Number of Completed Packets (0x13) plen 5      #70 [hci1] 8.535365
        Num handles: 1
        Handle: 363 Address: DF:A9:FF:F6:B1:1A (OUI DF-A9-FF)
        Count: 1
        #66: len 15 (0 Kb/s)
        Latency: 158 msec (71-164 msec ~127 msec)
> HCI Event: Number of Completed Packets (0x13) plen 5      #71 [hci1] 8.622921
        Num handles: 1
        Handle: 363 Address: DF:A9:FF:F6:B1:1A (OUI DF-A9-FF)
        Count: 1
        #69: len 21 (1 Kb/s)
        Latency: 167 msec (71-167 msec ~147 msec)
> ACL Data RX: Handle 363 flags 0x02 dlen 21                #72 [hci1] 8.623264
      SMP: Pairing Random (0x04) len 16
        Random value: dbbf8af7987c6e990000000000000000
< HCI Command: Host Number of Compl.. (0x03|0x0035) plen 5  #73 [hci1] 8.636322
        Num handles: 1
        Handle: 363 Address: DF:A9:FF:F6:B1:1A (OUI DF-A9-FF)
        Count: 1
< ACL Data TX: Handle 363 flags 0x00 dlen 21                #74 [hci1] 8.636434
      SMP: Pairing Random (0x04) len 16
        Random value: 8e6108f966a694cbe26df70bb96773e6
> HCI Event: Number of Completed Packets (0x13) plen 5      #75 [hci1] 8.797774
        Num handles: 1
        Handle: 363 Address: DF:A9:FF:F6:B1:1A (OUI DF-A9-FF)
        Count: 1
        #74: len 21 (1 Kb/s)
        Latency: 161 msec (71-167 msec ~154 msec)
> ACL Data RX: Handle 363 flags 0x02 dlen 21                #76 [hci1] 8.973123
      SMP: Pairing DHKey Check (0x0d) len 16
        E: dc3cb6a35d4832349d0235b0235b0428
< HCI Command: Host Number of Compl.. (0x03|0x0035) plen 5  #77 [hci1] 8.976154
        Num handles: 1
        Handle: 363 Address: DF:A9:FF:F6:B1:1A (OUI DF-A9-FF)
        Count: 1
< ACL Data TX: Handle 363 flags 0x00 dlen 21                #78 [hci1] 8.976174
      SMP: Pairing DHKey Check (0x0d) len 16
        E: 99644a653cdeb01c9a2e798a57aa1866
> HCI Event: Number of Completed Packets (0x13) plen 5      #79 [hci1] 9.147702
        Num handles: 1
        Handle: 363 Address: DF:A9:FF:F6:B1:1A (OUI DF-A9-FF)
        Count: 1
        #78: len 21 (0 Kb/s)
        Latency: 171 msec (71-171 msec ~162 msec)
> HCI Event: LE Meta Event (0x3e) plen 13                   #80 [hci1] 9.235805
      LE Long Term Key Request (0x05)
        Handle: 363 Address: DF:A9:FF:F6:B1:1A (OUI DF-A9-FF)
        Random number: 0x0000000000000000
        Encrypted diversifier: 0x0000
< HCI Command: LE Long Term Key Re.. (0x08|0x001a) plen 18  #81 [hci1] 9.236111
        Handle: 363 Address: DF:A9:FF:F6:B1:1A (OUI DF-A9-FF)
        Long term key: 3d610271e925b314a3d5f7077ff4dc95
> HCI Event: Command Complete (0x0e) plen 6                 #82 [hci1] 9.236916
      LE Long Term Key Request Reply (0x08|0x001a) ncmd 1
        Status: Success (0x00)
        Handle: 363 Address: DF:A9:FF:F6:B1:1A (OUI DF-A9-FF)
> HCI Event: Encryption Change (0x08) plen 4                #83 [hci1] 9.672952
        Status: Success (0x00)
        Handle: 363 Address: DF:A9:FF:F6:B1:1A (OUI DF-A9-FF)
        Encryption: Enabled with AES-CCM (0x01)
> ACL Data RX: Handle 363 flags 0x02 dlen 21                #84 [hci1] 9.760671
      SMP: Identity Information (0x08) len 16
        Identity resolving key: a218e3aeb88e9c6ef599705269207b96
< ACL Data TX: Handle 363 flags 0x00 dlen 11                #85 [hci1] 9.786150
      ATT: Read By Type Request (0x08) len 6
        Handle range: 0x0001-0xffff
        Attribute type: Central Address Resolution (0x2aa6)
< HCI Command: Host Number of Compl.. (0x03|0x0035) plen 5  #86 [hci1] 9.786294
        Num handles: 1
        Handle: 363 Address: DF:A9:FF:F6:B1:1A (OUI DF-A9-FF)
        Count: 1
> ACL Data RX: Handle 363 flags 0x02 dlen 12                #87 [hci1] 9.847957
      SMP: Identity Address Information (0x09) len 7
        Address: DF:A9:FF:F6:B1:1A (OUI DF-A9-FF)
> HCI Event: Number of Completed Packets (0x13) plen 5      #88 [hci1] 9.848705
        Num handles: 1
        Handle: 363 Address: DF:A9:FF:F6:B1:1A (OUI DF-A9-FF)
        Count: 1
        #85: len 11 (1 Kb/s)
        Latency: 62 msec (62-171 msec ~112 msec)
> ACL Data RX: Handle 363 flags 0x02 dlen 13                #89 [hci1] 9.848770
      ATT: Find By Type Value Request (0x06) len 8
        Handle range: 0x0001-0xffff
        Attribute type: Primary Service (0x2800)
          UUID: Object Transfer (0x1825)
< HCI Command: LE Add Device To Re.. (0x08|0x0027) plen 39  #90 [hci1] 9.856052
        Address type: Public (0x00)
        Address: DF:A9:FF:F6:B1:1A (OUI DF-A9-FF)
        Peer identity resolving key: a218e3aeb88e9c6ef599705269207b96
        Local identity resolving key: 00000000000000000000000000000000
> HCI Event: Command Complete (0x0e) plen 4                 #91 [hci1] 9.856997
      LE Add Device To Resolving List (0x08|0x0027) ncmd 1
        Status: Success (0x00)
< HCI Command: LE Set Privacy Mode (0x08|0x004e) plen 8     #92 [hci1] 9.875897
        Peer Identity address type: Public (0x00)
        Peer Identity address: DF:A9:FF:F6:B1:1A (OUI DF-A9-FF)
        Privacy Mode: Use Device Privacy (0x01)
> HCI Event: Command Complete (0x0e) plen 4                 #93 [hci1] 9.876353
      LE Set Privacy Mode (0x08|0x004e) ncmd 1
        Status: Success (0x00)
< HCI Command: LE Set Address Resol.. (0x08|0x002d) plen 1  #94 [hci1] 9.895962
        Address resolution: Enabled (0x01)
> HCI Event: Command Complete (0x0e) plen 4                 #95 [hci1] 9.896455
      LE Set Address Resolution Enable (0x08|0x002d) ncmd 1
        Status: Success (0x00)
< HCI Command: Host Number of Compl.. (0x03|0x0035) plen 5  #96 [hci1] 9.915967
        Num handles: 1
        Handle: 363 Address: DF:A9:FF:F6:B1:1A (OUI DF-A9-FF)
        Count: 1
< HCI Command: Host Number of Compl.. (0x03|0x0035) plen 5  #97 [hci1] 9.916158
        Num handles: 1
        Handle: 363 Address: DF:A9:FF:F6:B1:1A (OUI DF-A9-FF)
        Count: 1
< ACL Data TX: Handle 363 flags 0x00 dlen 9                 #98 [hci1] 9.916173
      ATT: Find By Type Value Response (0x07) len 4
        Handle range: 0x0027-0x0039
> ACL Data RX: Handle 363 flags 0x02 dlen 9                 #99 [hci1] 9.935460
      ATT: Read By Type Response (0x09) len 4
        Attribute data length: 3
        Attribute data list: 1 entry
        Handle: 0x000f
        Value: 01
< HCI Command: Host Number of Comp.. (0x03|0x0035) plen 5  #100 [hci1] 9.936053
        Num handles: 1
        Handle: 363 Address: DF:A9:FF:F6:B1:1A (OUI DF-A9-FF)
        Count: 1
> HCI Event: Number of Completed Packets (0x13) plen 5    #101 [hci1] 10.022885
        Num handles: 1
        Handle: 363 Address: DF:A9:FF:F6:B1:1A (OUI DF-A9-FF)
        Count: 1
        #98: len 9 (0 Kb/s)
        Latency: 106 msec (62-171 msec ~109 msec)
> ACL Data RX: Handle 363 flags 0x02 dlen 13              #102 [hci1] 10.023212
      ATT: Find By Type Value Request (0x06) len 8
        Handle range: 0x003a-0xffff
        Attribute type: Primary Service (0x2800)
          UUID: Object Transfer (0x1825)
< HCI Command: Host Number of Com.. (0x03|0x0035) plen 5  #103 [hci1] 10.036974
        Num handles: 1
        Handle: 363 Address: DF:A9:FF:F6:B1:1A (OUI DF-A9-FF)
        Count: 1
< ACL Data TX: Handle 363 flags 0x00 dlen 9               #104 [hci1] 10.037009
      ATT: Error Response (0x01) len 4
        Find By Type Value Request (0x06)
        Handle: 0x003a
        Error: Attribute Not Found (0x0a)
> HCI Event: Number of Completed Packets (0x13) plen 5    #105 [hci1] 10.197869
        Num handles: 1
        Handle: 363 Address: DF:A9:FF:F6:B1:1A (OUI DF-A9-FF)
        Count: 1
        #104: len 9 (0 Kb/s)
        Latency: 160 msec (62-171 msec ~135 msec)
> ACL Data RX: Handle 363 flags 0x02 dlen 11              #106 [hci1] 10.198083
      ATT: Read By Type Request (0x08) len 6
        Handle range: 0x0027-0x0039
        Attribute type: Characteristic (0x2803)
< HCI Command: Host Number of Com.. (0x03|0x0035) plen 5  #107 [hci1] 10.216101
        Num handles: 1
        Handle: 363 Address: DF:A9:FF:F6:B1:1A (OUI DF-A9-FF)
        Count: 1
< ACL Data TX: Handle 363 flags 0x00 dlen 20              #108 [hci1] 10.216129
      ATT: Read By Type Response (0x09) len 15
        Attribute data length: 7
        Attribute data list: 2 entries
        Handle: 0x0028
        Value: 022900bd2a
            Properties: 0x02
              Read (0x02)
            Value Handle: 0x0029
            Value UUID: OTS Feature (0x2abd)
        Handle: 0x002a
        Value: 0a2b00be2a
            Properties: 0x0a
              Read (0x02)
              Write (0x08)
            Value Handle: 0x002b
            Value UUID: Object Name (0x2abe)
> HCI Event: Number of Completed Packets (0x13) plen 5    #109 [hci1] 10.372908
        Num handles: 1
        Handle: 363 Address: DF:A9:FF:F6:B1:1A (OUI DF-A9-FF)
        Count: 1
        #108: len 20 (1 Kb/s)
        Latency: 156 msec (62-171 msec ~146 msec)
> ACL Data RX: Handle 363 flags 0x02 dlen 11              #110 [hci1] 10.373092
      ATT: Read By Type Request (0x08) len 6
        Handle range: 0x002b-0x0039
        Attribute type: Characteristic (0x2803)
< HCI Command: Host Number of Com.. (0x03|0x0035) plen 5  #111 [hci1] 10.376000
        Num handles: 1
        Handle: 363 Address: DF:A9:FF:F6:B1:1A (OUI DF-A9-FF)
        Count: 1
< ACL Data TX: Handle 363 flags 0x00 dlen 20              #112 [hci1] 10.376045
      ATT: Read By Type Response (0x09) len 15
        Attribute data length: 7
        Attribute data list: 2 entries
        Handle: 0x002c
        Value: 022d00bf2a
            Properties: 0x02
              Read (0x02)
            Value Handle: 0x002d
            Value UUID: Object Type (0x2abf)
        Handle: 0x002e
        Value: 022f00c02a
            Properties: 0x02
              Read (0x02)
            Value Handle: 0x002f
            Value UUID: Object Size (0x2ac0)
< ACL Data TX: Handle 363 flags 0x00 dlen 16              #113 [hci1] 10.486198
      LE L2CAP: Connection Parameter Update Request (0x12) ident 1 len 8
        Min interval: 24
        Max interval: 40
        Peripheral latency: 0
        Timeout multiplier: 42
> HCI Event: Number of Completed Packets (0x13) plen 5    #114 [hci1] 10.547886
        Num handles: 1
        Handle: 363 Address: DF:A9:FF:F6:B1:1A (OUI DF-A9-FF)
        Count: 1
        #112: len 20 (0 Kb/s)
        Latency: 171 msec (62-171 msec ~158 msec)
> ACL Data RX: Handle 363 flags 0x02 dlen 11              #115 [hci1] 10.548061
      ATT: Read By Type Request (0x08) len 6
        Handle range: 0x002f-0x0039
        Attribute type: Characteristic (0x2803)
< HCI Command: Host Number of Com.. (0x03|0x0035) plen 5  #116 [hci1] 10.556069
        Num handles: 1
        Handle: 363 Address: DF:A9:FF:F6:B1:1A (OUI DF-A9-FF)
        Count: 1
< ACL Data TX: Handle 363 flags 0x00 dlen 20              #117 [hci1] 10.556086
      ATT: Read By Type Response (0x09) len 15
        Attribute data length: 7
        Attribute data list: 2 entries
        Handle: 0x0030
        Value: 023100c32a
            Properties: 0x02
              Read (0x02)
            Value Handle: 0x0031
            Value UUID: Object ID (0x2ac3)
        Handle: 0x0032
        Value: 023300c42a
            Properties: 0x02
              Read (0x02)
            Value Handle: 0x0033
            Value UUID: Object Properties (0x2ac4)
> HCI Event: Number of Completed Packets (0x13) plen 5    #118 [hci1] 10.635404
        Num handles: 1
        Handle: 363 Address: DF:A9:FF:F6:B1:1A (OUI DF-A9-FF)
        Count: 1
        #113: len 16 (0 Kb/s)
        Latency: 149 msec (62-171 msec ~154 msec)
> ACL Data RX: Handle 363 flags 0x02 dlen 10              #119 [hci1] 10.635528
      LE L2CAP: Connection Parameter Update Response (0x13) ident 1 len 2
        Result: Connection Parameters accepted (0x0000)
< HCI Command: Host Number of Com.. (0x03|0x0035) plen 5  #120 [hci1] 10.636059
        Num handles: 1
        Handle: 363 Address: DF:A9:FF:F6:B1:1A (OUI DF-A9-FF)
        Count: 1
> HCI Event: Number of Completed Packets (0x13) plen 5    #121 [hci1] 10.722889
        Num handles: 1
        Handle: 363 Address: DF:A9:FF:F6:B1:1A (OUI DF-A9-FF)
        Count: 1
        #117: len 20 (0 Kb/s)
        Latency: 166 msec (62-171 msec ~160 msec)
> ACL Data RX: Handle 363 flags 0x02 dlen 11              #122 [hci1] 10.723079
      ATT: Read By Type Request (0x08) len 6
        Handle range: 0x0033-0x0039
        Attribute type: Characteristic (0x2803)
< HCI Command: Host Number of Com.. (0x03|0x0035) plen 5  #123 [hci1] 10.736099
        Num handles: 1
        Handle: 363 Address: DF:A9:FF:F6:B1:1A (OUI DF-A9-FF)
        Count: 1
< ACL Data TX: Handle 363 flags 0x00 dlen 20              #124 [hci1] 10.736184
      ATT: Read By Type Response (0x09) len 15
        Attribute data length: 7
        Attribute data list: 2 entries
        Handle: 0x0034
        Value: 283500c52a
            Properties: 0x28
              Write (0x08)
              Indicate (0x20)
            Value Handle: 0x0035
            Value UUID: Object Action Control Point (0x2ac5)
        Handle: 0x0037
        Value: 283800c62a
            Properties: 0x28
              Write (0x08)
              Indicate (0x20)
            Value Handle: 0x0038
            Value UUID: Object List Control Point (0x2ac6)
> HCI Event: Number of Completed Packets (0x13) plen 5    #125 [hci1] 10.897887
        Num handles: 1
        Handle: 363 Address: DF:A9:FF:F6:B1:1A (OUI DF-A9-FF)
        Count: 1
        #124: len 20 (0 Kb/s)
        Latency: 161 msec (62-171 msec ~161 msec)
> ACL Data RX: Handle 363 flags 0x02 dlen 11              #126 [hci1] 10.898060
      ATT: Read By Type Request (0x08) len 6
        Handle range: 0x0038-0x0039
        Attribute type: Characteristic (0x2803)
< HCI Command: Host Number of Com.. (0x03|0x0035) plen 5  #127 [hci1] 10.916043
        Num handles: 1
        Handle: 363 Address: DF:A9:FF:F6:B1:1A (OUI DF-A9-FF)
        Count: 1
< ACL Data TX: Handle 363 flags 0x00 dlen 9               #128 [hci1] 10.916205
      ATT: Error Response (0x01) len 4
        Read By Type Request (0x08)
        Handle: 0x0038
        Error: Attribute Not Found (0x0a)
> HCI Event: Number of Completed Packets (0x13) plen 5    #129 [hci1] 11.072838
        Num handles: 1
        Handle: 363 Address: DF:A9:FF:F6:B1:1A (OUI DF-A9-FF)
        Count: 1
        #128: len 9 (0 Kb/s)
        Latency: 156 msec (62-171 msec ~158 msec)
> ACL Data RX: Handle 363 flags 0x02 dlen 9               #130 [hci1] 11.073047
      ATT: Find Information Request (0x04) len 4
        Handle range: 0x0036-0x0036
< HCI Command: Host Number of Com.. (0x03|0x0035) plen 5  #131 [hci1] 11.076170
        Num handles: 1
        Handle: 363 Address: DF:A9:FF:F6:B1:1A (OUI DF-A9-FF)
        Count: 1
< ACL Data TX: Handle 363 flags 0x00 dlen 10              #132 [hci1] 11.076199
      ATT: Find Information Response (0x05) len 5
        Format: UUID-16 (0x01)
        Handle: 0x0036
        UUID: Client Characteristic Configuration (0x2902)
> HCI Event: Number of Completed Packets (0x13) plen 5    #133 [hci1] 11.247862
        Num handles: 1
        Handle: 363 Address: DF:A9:FF:F6:B1:1A (OUI DF-A9-FF)
        Count: 1
        #132: len 10 (0 Kb/s)
        Latency: 171 msec (62-171 msec ~165 msec)
> ACL Data RX: Handle 363 flags 0x02 dlen 9               #134 [hci1] 11.248070
      ATT: Find Information Request (0x04) len 4
        Handle range: 0x0039-0x0039
< HCI Command: Host Number of Com.. (0x03|0x0035) plen 5  #135 [hci1] 11.256023
        Num handles: 1
        Handle: 363 Address: DF:A9:FF:F6:B1:1A (OUI DF-A9-FF)
        Count: 1
< ACL Data TX: Handle 363 flags 0x00 dlen 10              #136 [hci1] 11.256075
      ATT: Find Information Response (0x05) len 5
        Format: UUID-16 (0x01)
        Handle: 0x0039
        UUID: Client Characteristic Configuration (0x2902)
> HCI Event: Number of Completed Packets (0x13) plen 5    #137 [hci1] 11.422856
        Num handles: 1
        Handle: 363 Address: DF:A9:FF:F6:B1:1A (OUI DF-A9-FF)
        Count: 1
        #136: len 10 (0 Kb/s)
        Latency: 166 msec (62-171 msec ~166 msec)
> ACL Data RX: Handle 363 flags 0x02 dlen 7               #138 [hci1] 11.423040
      ATT: Read Request (0x0a) len 2
        Handle: 0x0029
< HCI Command: Host Number of Com.. (0x03|0x0035) plen 5  #139 [hci1] 11.436605
        Num handles: 1
        Handle: 363 Address: DF:A9:FF:F6:B1:1A (OUI DF-A9-FF)
        Count: 1
< ACL Data TX: Handle 363 flags 0x00 dlen 13              #140 [hci1] 11.436711
      ATT: Read Response (0x0b) len 8
> HCI Event: Number of Completed Packets (0x13) plen 5    #141 [hci1] 11.597865
        Num handles: 1
        Handle: 363 Address: DF:A9:FF:F6:B1:1A (OUI DF-A9-FF)
        Count: 1
        #140: len 13 (0 Kb/s)
        Latency: 161 msec (62-171 msec ~163 msec)
> ACL Data RX: Handle 363 flags 0x02 dlen 13              #142 [hci1] 11.598085
      ATT: Find By Type Value Request (0x06) len 8
        Handle range: 0x0001-0xffff
        Attribute type: Primary Service (0x2800)
          UUID: Object Transfer (0x1825)
< HCI Command: Host Number of Com.. (0x03|0x0035) plen 5  #143 [hci1] 11.616266
        Num handles: 1
        Handle: 363 Address: DF:A9:FF:F6:B1:1A (OUI DF-A9-FF)
        Count: 1
< ACL Data TX: Handle 363 flags 0x00 dlen 9               #144 [hci1] 11.616296
      ATT: Find By Type Value Response (0x07) len 4
        Handle range: 0x0027-0x0039
> HCI Event: Number of Completed Packets (0x13) plen 5    #145 [hci1] 11.772895
        Num handles: 1
        Handle: 363 Address: DF:A9:FF:F6:B1:1A (OUI DF-A9-FF)
        Count: 1
        #144: len 9 (0 Kb/s)
        Latency: 156 msec (62-171 msec ~160 msec)
> ACL Data RX: Handle 363 flags 0x02 dlen 13              #146 [hci1] 11.773108
      ATT: Find By Type Value Request (0x06) len 8
        Handle range: 0x003a-0xffff
        Attribute type: Primary Service (0x2800)
          UUID: Object Transfer (0x1825)
< HCI Command: Host Number of Com.. (0x03|0x0035) plen 5  #147 [hci1] 11.776158
        Num handles: 1
        Handle: 363 Address: DF:A9:FF:F6:B1:1A (OUI DF-A9-FF)
        Count: 1
< ACL Data TX: Handle 363 flags 0x00 dlen 9               #148 [hci1] 11.776185
      ATT: Error Response (0x01) len 4
        Find By Type Value Request (0x06)
        Handle: 0x003a
        Error: Attribute Not Found (0x0a)
> HCI Event: Number of Completed Packets (0x13) plen 5    #149 [hci1] 11.947841
        Num handles: 1
        Handle: 363 Address: DF:A9:FF:F6:B1:1A (OUI DF-A9-FF)
        Count: 1
        #148: len 9 (0 Kb/s)
        Latency: 171 msec (62-171 msec ~165 msec)
> ACL Data RX: Handle 363 flags 0x02 dlen 11              #150 [hci1] 11.948048
      ATT: Read By Type Request (0x08) len 6
        Handle range: 0x0027-0x0039
        Attribute type: Characteristic (0x2803)
< HCI Command: Host Number of Com.. (0x03|0x0035) plen 5  #151 [hci1] 11.956038
        Num handles: 1
        Handle: 363 Address: DF:A9:FF:F6:B1:1A (OUI DF-A9-FF)
        Count: 1
< ACL Data TX: Handle 363 flags 0x00 dlen 20              #152 [hci1] 11.956071
      ATT: Read By Type Response (0x09) len 15
        Attribute data length: 7
        Attribute data list: 2 entries
        Handle: 0x0028
        Value: 022900bd2a
            Properties: 0x02
              Read (0x02)
            Value Handle: 0x0029
            Value UUID: OTS Feature (0x2abd)
        Handle: 0x002a
        Value: 0a2b00be2a
            Properties: 0x0a
              Read (0x02)
              Write (0x08)
            Value Handle: 0x002b
            Value UUID: Object Name (0x2abe)
> HCI Event: Number of Completed Packets (0x13) plen 5    #153 [hci1] 12.122868
        Num handles: 1
        Handle: 363 Address: DF:A9:FF:F6:B1:1A (OUI DF-A9-FF)
        Count: 1
        #152: len 20 (0 Kb/s)
        Latency: 166 msec (62-171 msec ~166 msec)
> ACL Data RX: Handle 363 flags 0x02 dlen 11              #154 [hci1] 12.123046
      ATT: Read By Type Request (0x08) len 6
        Handle range: 0x002b-0x0039
        Attribute type: Characteristic (0x2803)
< HCI Command: Host Number of Com.. (0x03|0x0035) plen 5  #155 [hci1] 12.136616
        Num handles: 1
        Handle: 363 Address: DF:A9:FF:F6:B1:1A (OUI DF-A9-FF)
        Count: 1
< ACL Data TX: Handle 363 flags 0x00 dlen 20              #156 [hci1] 12.136736
      ATT: Read By Type Response (0x09) len 15
        Attribute data length: 7
        Attribute data list: 2 entries
        Handle: 0x002c
        Value: 022d00bf2a
            Properties: 0x02
              Read (0x02)
            Value Handle: 0x002d
            Value UUID: Object Type (0x2abf)
        Handle: 0x002e
        Value: 022f00c02a
            Properties: 0x02
              Read (0x02)
            Value Handle: 0x002f
            Value UUID: Object Size (0x2ac0)
> HCI Event: Number of Completed Packets (0x13) plen 5    #157 [hci1] 12.297844
        Num handles: 1
        Handle: 363 Address: DF:A9:FF:F6:B1:1A (OUI DF-A9-FF)
        Count: 1
        #156: len 20 (0 Kb/s)
        Latency: 161 msec (62-171 msec ~163 msec)
> ACL Data RX: Handle 363 flags 0x02 dlen 11              #158 [hci1] 12.298043
      ATT: Read By Type Request (0x08) len 6
        Handle range: 0x002f-0x0039
        Attribute type: Characteristic (0x2803)
< HCI Command: Host Number of Com.. (0x03|0x0035) plen 5  #159 [hci1] 12.316366
        Num handles: 1
        Handle: 363 Address: DF:A9:FF:F6:B1:1A (OUI DF-A9-FF)
        Count: 1
< ACL Data TX: Handle 363 flags 0x00 dlen 20              #160 [hci1] 12.316410
      ATT: Read By Type Response (0x09) len 15
        Attribute data length: 7
        Attribute data list: 2 entries
        Handle: 0x0030
        Value: 023100c32a
            Properties: 0x02
              Read (0x02)
            Value Handle: 0x0031
            Value UUID: Object ID (0x2ac3)
        Handle: 0x0032
        Value: 023300c42a
            Properties: 0x02
              Read (0x02)
            Value Handle: 0x0033
            Value UUID: Object Properties (0x2ac4)
> HCI Event: Number of Completed Packets (0x13) plen 5    #161 [hci1] 12.472900
        Num handles: 1
        Handle: 363 Address: DF:A9:FF:F6:B1:1A (OUI DF-A9-FF)
        Count: 1
        #160: len 20 (1 Kb/s)
        Latency: 156 msec (62-171 msec ~160 msec)
> ACL Data RX: Handle 363 flags 0x02 dlen 11              #162 [hci1] 12.473009
      ATT: Read By Type Request (0x08) len 6
        Handle range: 0x0033-0x0039
        Attribute type: Characteristic (0x2803)
< HCI Command: Host Number of Com.. (0x03|0x0035) plen 5  #163 [hci1] 12.476156
        Num handles: 1
        Handle: 363 Address: DF:A9:FF:F6:B1:1A (OUI DF-A9-FF)
        Count: 1
< ACL Data TX: Handle 363 flags 0x00 dlen 20              #164 [hci1] 12.476183
      ATT: Read By Type Response (0x09) len 15
        Attribute data length: 7
        Attribute data list: 2 entries
        Handle: 0x0034
        Value: 283500c52a
            Properties: 0x28
              Write (0x08)
              Indicate (0x20)
            Value Handle: 0x0035
            Value UUID: Object Action Control Point (0x2ac5)
        Handle: 0x0037
        Value: 283800c62a
            Properties: 0x28
              Write (0x08)
              Indicate (0x20)
            Value Handle: 0x0038
            Value UUID: Object List Control Point (0x2ac6)
> HCI Event: Number of Completed Packets (0x13) plen 5    #165 [hci1] 12.647844
        Num handles: 1
        Handle: 363 Address: DF:A9:FF:F6:B1:1A (OUI DF-A9-FF)
        Count: 1
        #164: len 20 (0 Kb/s)
        Latency: 171 msec (62-171 msec ~165 msec)
> ACL Data RX: Handle 363 flags 0x02 dlen 11              #166 [hci1] 12.648067
      ATT: Read By Type Request (0x08) len 6
        Handle range: 0x0038-0x0039
        Attribute type: Characteristic (0x2803)
< HCI Command: Host Number of Com.. (0x03|0x0035) plen 5  #167 [hci1] 12.656077
        Num handles: 1
        Handle: 363 Address: DF:A9:FF:F6:B1:1A (OUI DF-A9-FF)
        Count: 1
< ACL Data TX: Handle 363 flags 0x00 dlen 9               #168 [hci1] 12.656117
      ATT: Error Response (0x01) len 4
        Read By Type Request (0x08)
        Handle: 0x0038
        Error: Attribute Not Found (0x0a)
> HCI Event: Number of Completed Packets (0x13) plen 5    #169 [hci1] 12.822840
        Num handles: 1
        Handle: 363 Address: DF:A9:FF:F6:B1:1A (OUI DF-A9-FF)
        Count: 1
        #168: len 9 (0 Kb/s)
        Latency: 166 msec (62-171 msec ~166 msec)
> ACL Data RX: Handle 363 flags 0x02 dlen 9               #170 [hci1] 12.823007
      ATT: Find Information Request (0x04) len 4
        Handle range: 0x0036-0x0036
< HCI Command: Host Number of Com.. (0x03|0x0035) plen 5  #171 [hci1] 12.836543
        Num handles: 1
        Handle: 363 Address: DF:A9:FF:F6:B1:1A (OUI DF-A9-FF)
        Count: 1
< ACL Data TX: Handle 363 flags 0x00 dlen 10              #172 [hci1] 12.836647
      ATT: Find Information Response (0x05) len 5
        Format: UUID-16 (0x01)
        Handle: 0x0036
        UUID: Client Characteristic Configuration (0x2902)
> HCI Event: Number of Completed Packets (0x13) plen 5    #173 [hci1] 12.997852
        Num handles: 1
        Handle: 363 Address: DF:A9:FF:F6:B1:1A (OUI DF-A9-FF)
        Count: 1
        #172: len 10 (0 Kb/s)
        Latency: 161 msec (62-171 msec ~163 msec)
> ACL Data RX: Handle 363 flags 0x02 dlen 9               #174 [hci1] 12.998040
      ATT: Find Information Request (0x04) len 4
        Handle range: 0x0039-0x0039
< HCI Command: Host Number of Com.. (0x03|0x0035) plen 5  #175 [hci1] 13.016277
        Num handles: 1
        Handle: 363 Address: DF:A9:FF:F6:B1:1A (OUI DF-A9-FF)
        Count: 1
< ACL Data TX: Handle 363 flags 0x00 dlen 10              #176 [hci1] 13.016351
      ATT: Find Information Response (0x05) len 5
        Format: UUID-16 (0x01)
        Handle: 0x0039
        UUID: Client Characteristic Configuration (0x2902)
> HCI Event: Number of Completed Packets (0x13) plen 5    #177 [hci1] 13.172794
        Num handles: 1
        Handle: 363 Address: DF:A9:FF:F6:B1:1A (OUI DF-A9-FF)
        Count: 1
        #176: len 10 (0 Kb/s)
        Latency: 156 msec (62-171 msec ~160 msec)
> ACL Data RX: Handle 363 flags 0x02 dlen 7               #178 [hci1] 13.172951
      ATT: Read Request (0x0a) len 2
        Handle: 0x0029
< HCI Command: Host Number of Com.. (0x03|0x0035) plen 5  #179 [hci1] 13.176017
        Num handles: 1
        Handle: 363 Address: DF:A9:FF:F6:B1:1A (OUI DF-A9-FF)
        Count: 1
< ACL Data TX: Handle 363 flags 0x00 dlen 13              #180 [hci1] 13.176070
      ATT: Read Response (0x0b) len 8
> HCI Event: Number of Completed Packets (0x13) plen 5    #181 [hci1] 13.347776
        Num handles: 1
        Handle: 363 Address: DF:A9:FF:F6:B1:1A (OUI DF-A9-FF)
        Count: 1
        #180: len 13 (0 Kb/s)
        Latency: 171 msec (62-171 msec ~165 msec)
> ACL Data RX: Handle 363 flags 0x02 dlen 9               #182 [hci1] 13.348084
      ATT: Write Request (0x12) len 4
        Handle: 0x0036
          Data: 0000
< HCI Command: Host Number of Com.. (0x03|0x0035) plen 5  #183 [hci1] 13.356595
        Num handles: 1
        Handle: 363 Address: DF:A9:FF:F6:B1:1A (OUI DF-A9-FF)
        Count: 1
< ACL Data TX: Handle 363 flags 0x00 dlen 5               #184 [hci1] 13.356685
      ATT: Write Response (0x13) len 0
> HCI Event: Number of Completed Packets (0x13) plen 5    #185 [hci1] 13.522912
        Num handles: 1
        Handle: 363 Address: DF:A9:FF:F6:B1:1A (OUI DF-A9-FF)
        Count: 1
        #184: len 5 (0 Kb/s)
        Latency: 166 msec (62-171 msec ~166 msec)
> ACL Data RX: Handle 363 flags 0x02 dlen 9               #186 [hci1] 13.522977
      ATT: Write Request (0x12) len 4
        Handle: 0x0036
          Data: 0200
< HCI Command: Host Number of Com.. (0x03|0x0035) plen 5  #187 [hci1] 13.536075
        Num handles: 1
        Handle: 363 Address: DF:A9:FF:F6:B1:1A (OUI DF-A9-FF)
        Count: 1
< ACL Data TX: Handle 363 flags 0x00 dlen 5               #188 [hci1] 13.536105
      ATT: Write Response (0x13) len 0
> HCI Event: Number of Completed Packets (0x13) plen 5    #189 [hci1] 13.697843
        Num handles: 1
        Handle: 363 Address: DF:A9:FF:F6:B1:1A (OUI DF-A9-FF)
        Count: 1
        #188: len 5 (0 Kb/s)
        Latency: 161 msec (62-171 msec ~163 msec)
> ACL Data RX: Handle 363 flags 0x02 dlen 9               #190 [hci1] 13.697982
      ATT: Write Request (0x12) len 4
        Handle: 0x0039
          Data: 0000
< HCI Command: Host Number of Com.. (0x03|0x0035) plen 5  #191 [hci1] 13.716396
        Num handles: 1
        Handle: 363 Address: DF:A9:FF:F6:B1:1A (OUI DF-A9-FF)
        Count: 1
< ACL Data TX: Handle 363 flags 0x00 dlen 5               #192 [hci1] 13.716459
      ATT: Write Response (0x13) len 0
> HCI Event: Number of Completed Packets (0x13) plen 5    #193 [hci1] 13.872874
        Num handles: 1
        Handle: 363 Address: DF:A9:FF:F6:B1:1A (OUI DF-A9-FF)
        Count: 1
        #192: len 5 (0 Kb/s)
        Latency: 156 msec (62-171 msec ~160 msec)
> ACL Data RX: Handle 363 flags 0x02 dlen 9               #194 [hci1] 13.872989
      ATT: Write Request (0x12) len 4
        Handle: 0x0039
          Data: 0200
< HCI Command: Host Number of Com.. (0x03|0x0035) plen 5  #195 [hci1] 13.876272
        Num handles: 1
        Handle: 363 Address: DF:A9:FF:F6:B1:1A (OUI DF-A9-FF)
        Count: 1
< ACL Data TX: Handle 363 flags 0x00 dlen 5               #196 [hci1] 13.876326
      ATT: Write Response (0x13) len 0
> HCI Event: Number of Completed Packets (0x13) plen 5    #197 [hci1] 14.047798
        Num handles: 1
        Handle: 363 Address: DF:A9:FF:F6:B1:1A (OUI DF-A9-FF)
        Count: 1
        #196: len 5 (0 Kb/s)
        Latency: 171 msec (62-171 msec ~165 msec)
> ACL Data RX: Handle 363 flags 0x02 dlen 9               #198 [hci1] 14.048005
      ATT: Write Request (0x12) len 4
        Handle: 0x0039
          Data: 0000
< HCI Command: Host Number of Com.. (0x03|0x0035) plen 5  #199 [hci1] 14.056420
        Num handles: 1
        Handle: 363 Address: DF:A9:FF:F6:B1:1A (OUI DF-A9-FF)
        Count: 1
< ACL Data TX: Handle 363 flags 0x00 dlen 5               #200 [hci1] 14.056496
      ATT: Write Response (0x13) len 0
> HCI Event: Number of Completed Packets (0x13) plen 5    #201 [hci1] 14.222763
        Num handles: 1
        Handle: 363 Address: DF:A9:FF:F6:B1:1A (OUI DF-A9-FF)
        Count: 1
        #200: len 5 (0 Kb/s)
        Latency: 166 msec (62-171 msec ~166 msec)
> ACL Data RX: Handle 363 flags 0x02 dlen 9               #202 [hci1] 14.222951
      ATT: Write Request (0x12) len 4
        Handle: 0x0039
          Data: 0200
< HCI Command: Host Number of Com.. (0x03|0x0035) plen 5  #203 [hci1] 14.236041
        Num handles: 1
        Handle: 363 Address: DF:A9:FF:F6:B1:1A (OUI DF-A9-FF)
        Count: 1
< ACL Data TX: Handle 363 flags 0x00 dlen 5               #204 [hci1] 14.236051
      ATT: Write Response (0x13) len 0
> HCI Event: Number of Completed Packets (0x13) plen 5    #205 [hci1] 14.397917
        Num handles: 1
        Handle: 363 Address: DF:A9:FF:F6:B1:1A (OUI DF-A9-FF)
        Count: 1
        #204: len 5 (0 Kb/s)
        Latency: 161 msec (62-171 msec ~163 msec)
> ACL Data RX: Handle 363 flags 0x02 dlen 18              #206 [hci1] 14.398185
      LE L2CAP: LE Connection Request (0x14) ident 1 len 10
        PSM: 37 (0x0025)
        Source CID: 84
        MTU: 1024
        MPS: 32
        Credits: 3
< HCI Command: Host Number of Com.. (0x03|0x0035) plen 5  #207 [hci1] 14.416049
        Num handles: 1
        Handle: 363 Address: DF:A9:FF:F6:B1:1A (OUI DF-A9-FF)
        Count: 1
< ACL Data TX: Handle 363 flags 0x00 dlen 18              #208 [hci1] 14.416072
      LE L2CAP: LE Connection Response (0x15) ident 1 len 10
        Destination CID: 64
        MTU: 255
        MPS: 251
        Credits: 1
        Result: Connection successful (0x0000)
> HCI Event: Number of Completed Packets (0x13) plen 5    #209 [hci1] 14.572811
        Num handles: 1
        Handle: 363 Address: DF:A9:FF:F6:B1:1A (OUI DF-A9-FF)
        Count: 1
        #208: len 18 (0 Kb/s)
        Latency: 156 msec (62-171 msec ~160 msec)
> ACL Data RX: Handle 363 flags 0x02 dlen 8               #210 [hci1] 14.572991
      ATT: Write Request (0x12) len 3
        Handle: 0x0038
          Data: 01
< HCI Command: Host Number of Com.. (0x03|0x0035) plen 5  #211 [hci1] 14.576128
        Num handles: 1
        Handle: 363 Address: DF:A9:FF:F6:B1:1A (OUI DF-A9-FF)
        Count: 1
< ACL Data TX: Handle 363 flags 0x00 dlen 5               #212 [hci1] 14.576200
      ATT: Write Response (0x13) len 0
< ACL Data TX: Handle 363 flags 0x00 dlen 10              #213 [hci1] 14.576290
      ATT: Handle Value Indication (0x1d) len 5
        Handle: 0x0038
          Data: 700101
> HCI Event: Number of Completed Packets (0x13) plen 5    #214 [hci1] 14.660785
        Num handles: 1
        Handle: 363 Address: DF:A9:FF:F6:B1:1A (OUI DF-A9-FF)
        Count: 1
        #212: len 5 (0 Kb/s)
        Latency: 84 msec (62-171 msec ~122 msec)
> HCI Event: Number of Completed Packets (0x13) plen 5    #215 [hci1] 14.747792
        Num handles: 1
        Handle: 363 Address: DF:A9:FF:F6:B1:1A (OUI DF-A9-FF)
        Count: 1
        #213: len 10 (0 Kb/s)
        Latency: 171 msec (62-171 msec ~146 msec)
> ACL Data RX: Handle 363 flags 0x02 dlen 5               #216 [hci1] 14.747877
      ATT: Handle Value Confirmation (0x1e) len 0
> ACL Data RX: Handle 363 flags 0x02 dlen 7               #217 [hci1] 14.748259
      ATT: Read Request (0x0a) len 2
        Handle: 0x002b
< HCI Command: Host Number of Com.. (0x03|0x0035) plen 5  #218 [hci1] 14.756072
        Num handles: 1
        Handle: 363 Address: DF:A9:FF:F6:B1:1A (OUI DF-A9-FF)
        Count: 1
< HCI Command: Host Number of Com.. (0x03|0x0035) plen 5  #219 [hci1] 14.756217
        Num handles: 1
        Handle: 363 Address: DF:A9:FF:F6:B1:1A (OUI DF-A9-FF)
        Count: 1
< ACL Data TX: Handle 363 flags 0x00 dlen 14              #220 [hci1] 14.756274
      ATT: Read Response (0x0b) len 9
> HCI Event: Number of Completed Packets (0x13) plen 5    #221 [hci1] 14.922830
        Num handles: 1
        Handle: 363 Address: DF:A9:FF:F6:B1:1A (OUI DF-A9-FF)
        Count: 1
        #220: len 14 (0 Kb/s)
        Latency: 166 msec (62-171 msec ~156 msec)
> ACL Data RX: Handle 363 flags 0x02 dlen 7               #222 [hci1] 14.922937
      ATT: Read Request (0x0a) len 2
        Handle: 0x002d
< HCI Command: Host Number of Com.. (0x03|0x0035) plen 5  #223 [hci1] 14.936121
        Num handles: 1
        Handle: 363 Address: DF:A9:FF:F6:B1:1A (OUI DF-A9-FF)
        Count: 1
< ACL Data TX: Handle 363 flags 0x00 dlen 7               #224 [hci1] 14.936220
      ATT: Read Response (0x0b) len 2
> HCI Event: Number of Completed Packets (0x13) plen 5    #225 [hci1] 15.097799
        Num handles: 1
        Handle: 363 Address: DF:A9:FF:F6:B1:1A (OUI DF-A9-FF)
        Count: 1
        #224: len 7 (0 Kb/s)
        Latency: 161 msec (62-171 msec ~159 msec)
> ACL Data RX: Handle 363 flags 0x02 dlen 7               #226 [hci1] 15.097939
      ATT: Read Request (0x0a) len 2
        Handle: 0x002f
< HCI Command: Host Number of Com.. (0x03|0x0035) plen 5  #227 [hci1] 15.116326
        Num handles: 1
        Handle: 363 Address: DF:A9:FF:F6:B1:1A (OUI DF-A9-FF)
        Count: 1
< ACL Data TX: Handle 363 flags 0x00 dlen 13              #228 [hci1] 15.116378
      ATT: Read Response (0x0b) len 8
> HCI Event: Number of Completed Packets (0x13) plen 5    #229 [hci1] 15.272779
        Num handles: 1
        Handle: 363 Address: DF:A9:FF:F6:B1:1A (OUI DF-A9-FF)
        Count: 1
        #228: len 13 (0 Kb/s)
        Latency: 156 msec (62-171 msec ~157 msec)
> ACL Data RX: Handle 363 flags 0x02 dlen 7               #230 [hci1] 15.272964
      ATT: Read Request (0x0a) len 2
        Handle: 0x0033
< HCI Command: Host Number of Com.. (0x03|0x0035) plen 5  #231 [hci1] 15.276004
        Num handles: 1
        Handle: 363 Address: DF:A9:FF:F6:B1:1A (OUI DF-A9-FF)
        Count: 1
< ACL Data TX: Handle 363 flags 0x00 dlen 9               #232 [hci1] 15.276026
      ATT: Read Response (0x0b) len 4
> HCI Event: Number of Completed Packets (0x13) plen 5    #233 [hci1] 15.447727
        Num handles: 1
        Handle: 363 Address: DF:A9:FF:F6:B1:1A (OUI DF-A9-FF)
        Count: 1
        #232: len 9 (0 Kb/s)
        Latency: 171 msec (62-171 msec ~164 msec)
> ACL Data RX: Handle 363 flags 0x02 dlen 7               #234 [hci1] 15.447973
      ATT: Read Request (0x0a) len 2
        Handle: 0x0031
< HCI Command: Host Number of Com.. (0x03|0x0035) plen 5  #235 [hci1] 15.456320
        Num handles: 1
        Handle: 363 Address: DF:A9:FF:F6:B1:1A (OUI DF-A9-FF)
        Count: 1
< ACL Data TX: Handle 363 flags 0x00 dlen 11              #236 [hci1] 15.456361
      ATT: Read Response (0x0b) len 6
> HCI Event: Number of Completed Packets (0x13) plen 5    #237 [hci1] 15.622778
        Num handles: 1
        Handle: 363 Address: DF:A9:FF:F6:B1:1A (OUI DF-A9-FF)
        Count: 1
        #236: len 11 (0 Kb/s)
        Latency: 166 msec (62-171 msec ~165 msec)
> ACL Data RX: Handle 363 flags 0x02 dlen 8               #238 [hci1] 15.622994
      ATT: Write Request (0x12) len 3
        Handle: 0x0038
          Data: 04
< HCI Command: Host Number of Com.. (0x03|0x0035) plen 5  #239 [hci1] 15.636222
        Num handles: 1
        Handle: 363 Address: DF:A9:FF:F6:B1:1A (OUI DF-A9-FF)
        Count: 1
< ACL Data TX: Handle 363 flags 0x00 dlen 5               #240 [hci1] 15.636353
      ATT: Write Response (0x13) len 0
< ACL Data TX: Handle 363 flags 0x00 dlen 10              #241 [hci1] 15.636544
      ATT: Handle Value Indication (0x1d) len 5
        Handle: 0x0038
          Data: 700401
> HCI Event: Number of Completed Packets (0x13) plen 5    #242 [hci1] 15.710785
        Num handles: 1
        Handle: 363 Address: DF:A9:FF:F6:B1:1A (OUI DF-A9-FF)
        Count: 1
        #240: len 5 (0 Kb/s)
        Latency: 74 msec (62-171 msec ~120 msec)
> HCI Event: Number of Completed Packets (0x13) plen 5    #243 [hci1] 15.797887
        Num handles: 1
        Handle: 363 Address: DF:A9:FF:F6:B1:1A (OUI DF-A9-FF)
        Count: 1
        #241: len 10 (0 Kb/s)
        Latency: 161 msec (62-171 msec ~140 msec)
> ACL Data RX: Handle 363 flags 0x02 dlen 5               #244 [hci1] 15.797946
      ATT: Handle Value Confirmation (0x1e) len 0
> ACL Data RX: Handle 363 flags 0x02 dlen 7               #245 [hci1] 15.798257
      ATT: Read Request (0x0a) len 2
        Handle: 0x002b
< HCI Command: Host Number of Com.. (0x03|0x0035) plen 5  #246 [hci1] 15.816309
        Num handles: 1
        Handle: 363 Address: DF:A9:FF:F6:B1:1A (OUI DF-A9-FF)
        Count: 1
< HCI Command: Host Number of Com.. (0x03|0x0035) plen 5  #247 [hci1] 15.816489
        Num handles: 1
        Handle: 363 Address: DF:A9:FF:F6:B1:1A (OUI DF-A9-FF)
        Count: 1
< ACL Data TX: Handle 363 flags 0x00 dlen 27              #248 [hci1] 15.816571
      ATT: Read Response (0x0b) len 22
> HCI Event: Number of Completed Packets (0x13) plen 5    #249 [hci1] 15.972816
        Num handles: 1
        Handle: 363 Address: DF:A9:FF:F6:B1:1A (OUI DF-A9-FF)
        Count: 1
        #248: len 27 (1 Kb/s)
        Latency: 156 msec (62-171 msec ~148 msec)
> ACL Data RX: Handle 363 flags 0x02 dlen 9               #250 [hci1] 15.973009
      ATT: Read Blob Request (0x0c) len 4
        Handle: 0x002b
        Offset: 0x0016
< HCI Command: Host Number of Com.. (0x03|0x0035) plen 5  #251 [hci1] 15.976375
        Num handles: 1
        Handle: 363 Address: DF:A9:FF:F6:B1:1A (OUI DF-A9-FF)
        Count: 1
< ACL Data TX: Handle 363 flags 0x00 dlen 11              #252 [hci1] 15.976498
      ATT: Read Blob Response (0x0d) len 6
        67 20 6e 61 6d 65                                g name          
> HCI Event: Number of Completed Packets (0x13) plen 5    #253 [hci1] 16.147812
        Num handles: 1
        Handle: 363 Address: DF:A9:FF:F6:B1:1A (OUI DF-A9-FF)
        Count: 1
        #252: len 11 (0 Kb/s)
        Latency: 171 msec (62-171 msec ~159 msec)
> ACL Data RX: Handle 363 flags 0x02 dlen 7               #254 [hci1] 16.147901
      ATT: Read Request (0x0a) len 2
        Handle: 0x002d
< HCI Command: Host Number of Com.. (0x03|0x0035) plen 5  #255 [hci1] 16.156167
        Num handles: 1
        Handle: 363 Address: DF:A9:FF:F6:B1:1A (OUI DF-A9-FF)
        Count: 1
< ACL Data TX: Handle 363 flags 0x00 dlen 7               #256 [hci1] 16.156214
      ATT: Read Response (0x0b) len 2
> HCI Event: Number of Completed Packets (0x13) plen 5    #257 [hci1] 16.322860
        Num handles: 1
        Handle: 363 Address: DF:A9:FF:F6:B1:1A (OUI DF-A9-FF)
        Count: 1
        #256: len 7 (0 Kb/s)
        Latency: 166 msec (62-171 msec ~163 msec)
> ACL Data RX: Handle 363 flags 0x02 dlen 7               #258 [hci1] 16.322973
      ATT: Read Request (0x0a) len 2
        Handle: 0x002f
< HCI Command: Host Number of Com.. (0x03|0x0035) plen 5  #259 [hci1] 16.336068
        Num handles: 1
        Handle: 363 Address: DF:A9:FF:F6:B1:1A (OUI DF-A9-FF)
        Count: 1
< ACL Data TX: Handle 363 flags 0x00 dlen 13              #260 [hci1] 16.336086
      ATT: Read Response (0x0b) len 8
> HCI Event: Number of Completed Packets (0x13) plen 5    #261 [hci1] 16.497758
        Num handles: 1
        Handle: 363 Address: DF:A9:FF:F6:B1:1A (OUI DF-A9-FF)
        Count: 1
        #260: len 13 (0 Kb/s)
        Latency: 161 msec (62-171 msec ~162 msec)
> ACL Data RX: Handle 363 flags 0x02 dlen 7               #262 [hci1] 16.498021
      ATT: Read Request (0x0a) len 2
        Handle: 0x0033
< HCI Command: Host Number of Com.. (0x03|0x0035) plen 5  #263 [hci1] 16.516215
        Num handles: 1
        Handle: 363 Address: DF:A9:FF:F6:B1:1A (OUI DF-A9-FF)
        Count: 1
< ACL Data TX: Handle 363 flags 0x00 dlen 9               #264 [hci1] 16.516224
      ATT: Read Response (0x0b) len 4
> HCI Event: Number of Completed Packets (0x13) plen 5    #265 [hci1] 16.672823
        Num handles: 1
        Handle: 363 Address: DF:A9:FF:F6:B1:1A (OUI DF-A9-FF)
        Count: 1
        #264: len 9 (0 Kb/s)
        Latency: 156 msec (62-171 msec ~159 msec)
> ACL Data RX: Handle 363 flags 0x02 dlen 7               #266 [hci1] 16.672958
      ATT: Read Request (0x0a) len 2
        Handle: 0x0031
< HCI Command: Host Number of Com.. (0x03|0x0035) plen 5  #267 [hci1] 16.675987
        Num handles: 1
        Handle: 363 Address: DF:A9:FF:F6:B1:1A (OUI DF-A9-FF)
        Count: 1
< ACL Data TX: Handle 363 flags 0x00 dlen 11              #268 [hci1] 16.675998
      ATT: Read Response (0x0b) len 6
> HCI Event: Number of Completed Packets (0x13) plen 5    #269 [hci1] 16.847902
        Num handles: 1
        Handle: 363 Address: DF:A9:FF:F6:B1:1A (OUI DF-A9-FF)
        Count: 1
        #268: len 11 (0 Kb/s)
        Latency: 171 msec (62-171 msec ~165 msec)
> ACL Data RX: Handle 363 flags 0x02 dlen 17              #270 [hci1] 16.848077
      ATT: Write Request (0x12) len 12
        Handle: 0x0035
          Data: 06000000006400000000
< HCI Command: Host Number of Com.. (0x03|0x0035) plen 5  #271 [hci1] 16.856115
        Num handles: 1
        Handle: 363 Address: DF:A9:FF:F6:B1:1A (OUI DF-A9-FF)
        Count: 1
< ACL Data TX: Handle 363 flags 0x00 dlen 5               #272 [hci1] 16.856123
      ATT: Write Response (0x13) len 0
< ACL Data TX: Handle 363 flags 0x00 dlen 10              #273 [hci1] 16.856258
      ATT: Handle Value Indication (0x1d) len 5
        Handle: 0x0035
          Data: 600601
> HCI Event: Number of Completed Packets (0x13) plen 5    #274 [hci1] 16.935642
        Num handles: 1
        Handle: 363 Address: DF:A9:FF:F6:B1:1A (OUI DF-A9-FF)
        Count: 1
        #272: len 5 (0 Kb/s)
        Latency: 79 msec (62-171 msec ~122 msec)
> HCI Event: Number of Completed Packets (0x13) plen 5    #275 [hci1] 17.023301
        Num handles: 1
        Handle: 363 Address: DF:A9:FF:F6:B1:1A (OUI DF-A9-FF)
        Count: 1
        #273: len 10 (0 Kb/s)
        Latency: 167 msec (62-171 msec ~144 msec)
> ACL Data RX: Handle 363 flags 0x02 dlen 5               #276 [hci1] 17.023306
      ATT: Handle Value Confirmation (0x1e) len 0
> ACL Data RX: Handle 363 flags 0x02 dlen 27              #277 [hci1] 17.023602
> ACL Data RX: Handle 363 flags 0x01 dlen 27              #278 [hci1] 17.024316
> ACL Data RX: Handle 363 flags 0x01 dlen 27              #279 [hci1] 17.025021
> ACL Data RX: Handle 363 flags 0x01 dlen 25              #280 [hci1] 17.025737
      Channel: 64 len 102 sdu 100 [PSM 37 mode LE Flow Control (0x80)] {chan 0}
        64 00 00 ff fe fd fc fb fa f9 f8 f7 f6 f5 f4 f3  d...............
        f2 f1 f0 ef ee ed ec eb ea e9 e8 e7 e6 e5 e4 e3  ................
        e2 e1 e0 df de dd dc db da d9 d8 d7 d6 d5 d4 d3  ................
        d2 d1 d0 cf ce cd cc cb ca c9 c8 c7 c6 c5 c4 c3  ................
        c2 c1 c0 bf be bd bc bb ba b9 b8 b7 b6 b5 b4 b3  ................
        b2 b1 b0 af ae ad ac ab aa a9 a8 a7 a6 a5 a4 a3  ................
        a2 a1 a0 9f 9e 9d                                ......          
< HCI Command: Host Number of Com.. (0x03|0x0035) plen 5  #281 [hci1] 17.035990
        Num handles: 1
        Handle: 363 Address: DF:A9:FF:F6:B1:1A (OUI DF-A9-FF)
        Count: 1
< HCI Command: Host Number of Com.. (0x03|0x0035) plen 5  #282 [hci1] 17.036248
        Num handles: 1
        Handle: 363 Address: DF:A9:FF:F6:B1:1A (OUI DF-A9-FF)
        Count: 1
< HCI Command: Host Number of Com.. (0x03|0x0035) plen 5  #283 [hci1] 17.036273
        Num handles: 1
        Handle: 363 Address: DF:A9:FF:F6:B1:1A (OUI DF-A9-FF)
        Count: 1
< HCI Command: Host Number of Com.. (0x03|0x0035) plen 5  #284 [hci1] 17.036352
        Num handles: 1
        Handle: 363 Address: DF:A9:FF:F6:B1:1A (OUI DF-A9-FF)
        Count: 1
< HCI Command: Host Number of Com.. (0x03|0x0035) plen 5  #285 [hci1] 17.036355
        Num handles: 1
        Handle: 363 Address: DF:A9:FF:F6:B1:1A (OUI DF-A9-FF)
        Count: 1
< ACL Data TX: Handle 363 flags 0x00 dlen 12              #286 [hci1] 17.036406
      LE L2CAP: LE Flow Control Credit (0x16) ident 2 len 4
        Source CID: 64
        Credits: 1
> HCI Event: Number of Completed Packets (0x13) plen 5    #287 [hci1] 17.200154
        Num handles: 1
        Handle: 363 Address: DF:A9:FF:F6:B1:1A (OUI DF-A9-FF)
        Count: 1
        #286: len 12 (0 Kb/s)
        Latency: 163 msec (62-171 msec ~154 msec)
> ACL Data RX: Handle 363 flags 0x02 dlen 16              #288 [hci1] 22.272829
      ATT: Write Request (0x12) len 11
        Handle: 0x0035
          Data: 050000000064000000
< HCI Command: Host Number of Com.. (0x03|0x0035) plen 5  #289 [hci1] 22.276092
        Num handles: 1
        Handle: 363 Address: DF:A9:FF:F6:B1:1A (OUI DF-A9-FF)
        Count: 1
< ACL Data TX: Handle 363 flags 0x00 dlen 5               #290 [hci1] 22.276217
      ATT: Write Response (0x13) len 0
< ACL Data TX: Handle 363 flags 0x00 dlen 10              #291 [hci1] 22.276312
      ATT: Handle Value Indication (0x1d) len 5
        Handle: 0x0035
          Data: 600501
> HCI Event: Number of Completed Packets (0x13) plen 5    #292 [hci1] 22.360555
        Num handles: 1
        Handle: 363 Address: DF:A9:FF:F6:B1:1A (OUI DF-A9-FF)
        Count: 1
        #290: len 5 (0 Kb/s)
        Latency: 84 msec (62-171 msec ~119 msec)
> HCI Event: Number of Completed Packets (0x13) plen 5    #293 [hci1] 22.447625
        Num handles: 1
        Handle: 363 Address: DF:A9:FF:F6:B1:1A (OUI DF-A9-FF)
        Count: 1
        #291: len 10 (0 Kb/s)
        Latency: 171 msec (62-171 msec ~145 msec)
> ACL Data RX: Handle 363 flags 0x02 dlen 5               #294 [hci1] 22.447860
      ATT: Handle Value Confirmation (0x1e) len 0
< HCI Command: Host Number of Com.. (0x03|0x0035) plen 5  #295 [hci1] 22.456841
        Num handles: 1
        Handle: 363 Address: DF:A9:FF:F6:B1:1A (OUI DF-A9-FF)
        Count: 1
< ACL Data TX: Handle 363 flags 0x00 dlen 27              #296 [hci1] 22.456958
< ACL Data TX: Handle 363 flags 0x01 dlen 9               #297 [hci1] 22.457003
      Channel: 84 len 32 sdu 100 [PSM 37 mode LE Flow Control (0x80)] {chan 0}
        64 00 00 ff fe fd fc fb fa f9 f8 f7 f6 f5 f4 f3  d...............
        f2 f1 f0 ef ee ed ec eb ea e9 e8 e7 e6 e5 e4 e3  ................
< ACL Data TX: Handle 363 flags 0x00 dlen 27              #298 [hci1] 22.457008
> HCI Event: Number of Completed Packets (0x13) plen 5    #299 [hci1] 22.535710
        Num handles: 1
        Handle: 363 Address: DF:A9:FF:F6:B1:1A (OUI DF-A9-FF)
        Count: 1
        #296: len 27 (2 Kb/s)
        Latency: 78 msec (62-171 msec ~112 msec)
        Channel: 84 [PSM 37 mode LE Flow Control (0x80)] {chan 0}
        Channel Latency: 78 msec (78-78 msec ~78 msec)
< ACL Data TX: Handle 363 flags 0x01 dlen 9               #300 [hci1] 22.536060
      Channel: 84 len 32 sdu 70 [PSM 37 mode LE Flow Control (0x80)] {chan 0}
        e2 e1 e0 df de dd dc db da d9 d8 d7 d6 d5 d4 d3  ................
        d2 d1 d0 cf ce cd cc cb ca c9 c8 c7 c6 c5 c4 c3  ................
> HCI Event: Number of Completed Packets (0x13) plen 5    #301 [hci1] 22.536252
        Num handles: 1
        Handle: 363 Address: DF:A9:FF:F6:B1:1A (OUI DF-A9-FF)
        Count: 1
        #297: len 9 (0 Kb/s)
        Latency: 79 msec (62-171 msec ~95 msec)
        Channel: 84 [PSM 37 mode LE Flow Control (0x80)] {chan 0}
        Channel Latency: 79 msec (78-79 msec ~79 msec)
< ACL Data TX: Handle 363 flags 0x00 dlen 27              #302 [hci1] 22.556071
> HCI Event: Number of Completed Packets (0x13) plen 5    #303 [hci1] 22.622693
        Num handles: 1
        Handle: 363 Address: DF:A9:FF:F6:B1:1A (OUI DF-A9-FF)
        Count: 1
        #298: len 27 (1 Kb/s)
        Latency: 165 msec (62-171 msec ~130 msec)
> ACL Data RX: Handle 363 flags 0x02 dlen 12              #304 [hci1] 22.622855
      LE L2CAP: LE Flow Control Credit (0x16) ident 2 len 4
        Source CID: 84
        Credits: 1
> HCI Event: Number of Completed Packets (0x13) plen 5    #305 [hci1] 22.623201
        Num handles: 1
        Handle: 363 Address: DF:A9:FF:F6:B1:1A (OUI DF-A9-FF)
        Count: 1
        #300: len 9 (0 Kb/s)
        Latency: 87 msec (62-171 msec ~108 msec)
< ACL Data TX: Handle 363 flags 0x01 dlen 9               #306 [hci1] 22.636242
      Channel: 84 len 32 sdu 38 [PSM 37 mode LE Flow Control (0x80)] {chan 0}
        c2 c1 c0 bf be bd bc bb ba b9 b8 b7 b6 b5 b4 b3  ................
        b2 b1 b0 af ae ad ac ab aa a9 a8 a7 a6 a5 a4 a3  ................
< HCI Command: Host Number of Com.. (0x03|0x0035) plen 5  #307 [hci1] 22.636389
        Num handles: 1
        Handle: 363 Address: DF:A9:FF:F6:B1:1A (OUI DF-A9-FF)
        Count: 1
< ACL Data TX: Handle 363 flags 0x00 dlen 10              #308 [hci1] 22.636398
      Channel: 84 len 6 sdu 6 [PSM 37 mode LE Flow Control (0x80)] {chan 0}
        a2 a1 a0 9f 9e 9d                                ......          
> HCI Event: Number of Completed Packets (0x13) plen 5    #309 [hci1] 22.710304
        Num handles: 1
        Handle: 363 Address: DF:A9:FF:F6:B1:1A (OUI DF-A9-FF)
        Count: 1
        #302: len 27 (1 Kb/s)
        Latency: 154 msec (62-171 msec ~131 msec)
        Channel: 84 [PSM 37 mode LE Flow Control (0x80)] {chan 0}
        Channel Latency: 154 msec (78-154 msec ~116 msec)
> ACL Data RX: Handle 363 flags 0x02 dlen 12              #310 [hci1] 22.710355
      LE L2CAP: LE Flow Control Credit (0x16) ident 3 len 4
        Source CID: 84
        Credits: 1
> HCI Event: Number of Completed Packets (0x13) plen 5    #311 [hci1] 22.710689
        Num handles: 1
        Handle: 363 Address: DF:A9:FF:F6:B1:1A (OUI DF-A9-FF)
        Count: 1
        #306: len 9 (0 Kb/s)
        Latency: 74 msec (62-171 msec ~103 msec)
        Channel: 84 [PSM 37 mode LE Flow Control (0x80)] {chan 0}
        Channel Latency: 74 msec (74-154 msec ~95 msec)
< HCI Command: Host Number of Com.. (0x03|0x0035) plen 5  #312 [hci1] 22.716627
        Num handles: 1
        Handle: 363 Address: DF:A9:FF:F6:B1:1A (OUI DF-A9-FF)
        Count: 1
> HCI Event: Number of Completed Packets (0x13) plen 5    #313 [hci1] 22.797661
        Num handles: 1
        Handle: 363 Address: DF:A9:FF:F6:B1:1A (OUI DF-A9-FF)
        Count: 1
        #308: len 10 (0 Kb/s)
        Latency: 161 msec (62-171 msec ~132 msec)
> ACL Data RX: Handle 363 flags 0x02 dlen 12              #314 [hci1] 22.797929
      LE L2CAP: LE Flow Control Credit (0x16) ident 4 len 4
        Source CID: 84
        Credits: 1
> ACL Data RX: Handle 363 flags 0x02 dlen 16              #315 [hci1] 22.798362
      ATT: Write Request (0x12) len 11
        Handle: 0x0035
          Data: 030000000064000000
< HCI Command: Host Number of Com.. (0x03|0x0035) plen 5  #316 [hci1] 22.816172
        Num handles: 1
        Handle: 363 Address: DF:A9:FF:F6:B1:1A (OUI DF-A9-FF)
        Count: 1
< HCI Command: Host Number of Com.. (0x03|0x0035) plen 5  #317 [hci1] 22.816281
        Num handles: 1
        Handle: 363 Address: DF:A9:FF:F6:B1:1A (OUI DF-A9-FF)
        Count: 1
< ACL Data TX: Handle 363 flags 0x00 dlen 5               #318 [hci1] 22.816386
      ATT: Write Response (0x13) len 0
< ACL Data TX: Handle 363 flags 0x00 dlen 14              #319 [hci1] 22.816466
      ATT: Handle Value Indication (0x1d) len 9
        Handle: 0x0035
          Data: 600301e9af925c
> HCI Event: Number of Completed Packets (0x13) plen 5    #320 [hci1] 22.885486
        Num handles: 1
        Handle: 363 Address: DF:A9:FF:F6:B1:1A (OUI DF-A9-FF)
        Count: 1
        #318: len 5 (0 Kb/s)
        Latency: 69 msec (62-171 msec ~100 msec)
> HCI Event: Number of Completed Packets (0x13) plen 5    #321 [hci1] 22.972658
        Num handles: 1
        Handle: 363 Address: DF:A9:FF:F6:B1:1A (OUI DF-A9-FF)
        Count: 1
        #319: len 14 (0 Kb/s)
        Latency: 156 msec (62-171 msec ~128 msec)
> ACL Data RX: Handle 363 flags 0x02 dlen 5               #322 [hci1] 22.972827
      ATT: Handle Value Confirmation (0x1e) len 0
> ACL Data RX: Handle 363 flags 0x02 dlen 12              #323 [hci1] 22.973283
      LE L2CAP: Disconnection Request (0x06) ident 5 len 4
        Destination CID: 64
        Source CID: 84
< HCI Command: Host Number of Com.. (0x03|0x0035) plen 5  #324 [hci1] 22.976237
        Num handles: 1
        Handle: 363 Address: DF:A9:FF:F6:B1:1A (OUI DF-A9-FF)
        Count: 1
< HCI Command: Host Number of Com.. (0x03|0x0035) plen 5  #325 [hci1] 22.976343
        Num handles: 1
        Handle: 363 Address: DF:A9:FF:F6:B1:1A (OUI DF-A9-FF)
        Count: 1
< ACL Data TX: Handle 363 flags 0x00 dlen 12              #326 [hci1] 22.976363
      LE L2CAP: Disconnection Response (0x07) ident 5 len 4
        Destination CID: 64
        Source CID: 84
> HCI Event: Number of Completed Packets (0x13) plen 5    #327 [hci1] 23.147611
        Num handles: 1
        Handle: 363 Address: DF:A9:FF:F6:B1:1A (OUI DF-A9-FF)
        Count: 1
        #326: len 12 (0 Kb/s)
        Latency: 171 msec (62-171 msec ~149 msec)
> HCI Event: Disconnect Complete (0x05) plen 4            #328 [hci1] 24.547735
        Status: Success (0x00)
        Handle: 363 Address: DF:A9:FF:F6:B1:1A (OUI DF-A9-FF)
        Reason: Remote User Terminated Connection (0x13)
< HCI Command: Reset (0x03|0x0003) plen 0                 #329 [hci1] 31.326186
> HCI Event: Command Complete (0x0e) plen 4               #330 [hci1] 31.326589
      Reset (0x03|0x0003) ncmd 1
        Status: Success (0x00)
@ USER Close: main                                    {0x0001} [hci1] 31.336017
= Close Index: 00:00:00:00:00:00                               [hci1] 31.339174
