Bluetooth monitor ver 5.72
= Note: Linux version 6.14.0-36-generic (x86_64)                       0.171697
= Note: Bluetooth subsystem version 2.22                               0.171699
= New Index: 00:00:00:00:00:00 (Primary,UART,hci1)              [hci1] 0.171700
= New Index: 48:5F:99:8E:E0:64 (Primary,USB,hci0)               [hci0] 0.171701
= Open Index: 00:00:00:00:00:00                                 [hci1] 0.684901
= Index Info: 00:00:00:00:00:00 (Nordic Semiconductor ASA)      [hci1] 0.684906
@ USER Open: main (privileged) version 2.22            {0x0001} [hci1] 0.684910
< HCI Command: Reset (0x03|0x0003) plen 0                    #1 [hci1] 0.685256
> HCI Event: Command Complete (0x0e) plen 4                  #2 [hci1] 0.685860
      Reset (0x03|0x0003) ncmd 1
        Status: Success (0x00)
< HCI Command: Read Local Supported... (0x04|0x0003) plen 0  #3 [hci1] 0.704885
> HCI Event: Command Complete (0x0e) plen 12                 #4 [hci1] 0.705354
      Read Local Supported Features (0x04|0x0003) ncmd 1
        Status: Success (0x00)
        Features: 0x00 0x00 0x00 0x00 0x60 0x00 0x00 0x00
          BR/EDR Not Supported
          LE Supported (Controller)
< HCI Command: Read Local Version In.. (0x04|0x0001) plen 0  #5 [hci1] 0.724881
> HCI Event: Command Complete (0x0e) plen 12                 #6 [hci1] 0.725366
      Read Local Version Information (0x04|0x0001) ncmd 1
        Status: Success (0x00)
        HCI version: Reserved (0x0f) - Revision 12393 (0x3069)
        LMP version: Reserved (0x0f) - Subversion 12393 (0x3069)
        Manufacturer: Nordic Semiconductor ASA (89)
< HCI Command: Read Local Supported... (0x04|0x0002) plen 0  #7 [hci1] 0.744885
> HCI Event: Command Complete (0x0e) plen 68                 #8 [hci1] 0.745936
      Read Local Supported Commands (0x04|0x0002) ncmd 1
        Status: Success (0x00)
        Commands: 119 entries
          Disconnect (Octet 0 - Bit 5)
          Read Remote Version Information (Octet 2 - Bit 7)
          Set Event Mask (Octet 5 - Bit 6)
          Reset (Octet 5 - Bit 7)
          Read Connection Accept Timeout (Octet 7 - Bit 2)
          Write Connection Accept Timeout (Octet 7 - Bit 3)
          Read Transmit Power Level (Octet 10 - Bit 2)
          Set Controller To Host Flow Control (Octet 10 - Bit 5)
          Host Buffer Size (Octet 10 - Bit 6)
          Host Number of Completed Packets (Octet 10 - Bit 7)
          Read Local Version Information (Octet 14 - Bit 3)
          Read Local Supported Features (Octet 14 - Bit 5)
          Read BD ADDR (Octet 15 - Bit 1)
          Read RSSI (Octet 15 - Bit 5)
          Set Event Mask Page 2 (Octet 22 - Bit 2)
          LE Set Event Mask (Octet 25 - Bit 0)
          LE Read Buffer Size (Octet 25 - Bit 1)
          LE Read Local Supported Features (Octet 25 - Bit 2)
          LE Set Random Address (Octet 25 - Bit 4)
          LE Set Advertising Parameters (Octet 25 - Bit 5)
          LE Read Advertising Channel TX Power (Octet 25 - Bit 6)
          LE Set Advertising Data (Octet 25 - Bit 7)
          LE Set Scan Response Data (Octet 26 - Bit 0)
          LE Set Advertise Enable (Octet 26 - Bit 1)
          LE Set Scan Parameters (Octet 26 - Bit 2)
          LE Set Scan Enable (Octet 26 - Bit 3)
          LE Create Connection (Octet 26 - Bit 4)
          LE Create Connection Cancel (Octet 26 - Bit 5)
          LE Read Accept List Size (Octet 26 - Bit 6)
          LE Clear Accept List (Octet 26 - Bit 7)
          LE Add Device To Accept List (Octet 27 - Bit 0)
          LE Remove Device From Accept List (Octet 27 - Bit 1)
          LE Connection Update (Octet 27 - Bit 2)
          LE Set Host Channel Classification (Octet 27 - Bit 3)
          LE Read Channel Map (Octet 27 - Bit 4)
          LE Read Remote Used Features (Octet 27 - Bit 5)
          LE Encrypt (Octet 27 - Bit 6)
          LE Rand (Octet 27 - Bit 7)
          LE Start Encryption (Octet 28 - Bit 0)
          LE Long Term Key Request Reply (Octet 28 - Bit 1)
          LE Long Term Key Request Neg Reply (Octet 28 - Bit 2)
          LE Read Supported States (Octet 28 - Bit 3)
          LE Receiver Test (Octet 28 - Bit 4)
          LE Transmitter Test (Octet 28 - Bit 5)
          LE Test End (Octet 28 - Bit 6)
          Read Authenticated Payload Timeout (Octet 32 - Bit 4)
          Write Authenticated Payload Timeout (Octet 32 - Bit 5)
          LE Set Data Length (Octet 33 - Bit 6)
          LE Read Suggested Default Data Length (Octet 33 - Bit 7)
          LE Write Suggested Default Data Length (Octet 34 - Bit 0)
          LE Add Device To Resolving List (Octet 34 - Bit 3)
          LE Remove Device From Resolving List (Octet 34 - Bit 4)
          LE Clear Resolving List (Octet 34 - Bit 5)
          LE Read Resolving List Size (Octet 34 - Bit 6)
          LE Set Address Resolution Enable (Octet 35 - Bit 1)
          LE Set Resolvable Private Address Timeout (Octet 35 - Bit 2)
          LE Read Maximum Data Length (Octet 35 - Bit 3)
          LE Read PHY (Octet 35 - Bit 4)
          LE Set Default PHY (Octet 35 - Bit 5)
          LE Set PHY (Octet 35 - Bit 6)
          LE Enhanced Receiver Test (Octet 35 - Bit 7)
          LE Enhanced Transmitter Test (Octet 36 - Bit 0)
          LE Set Advertising Set Random Address (Octet 36 - Bit 1)
          LE Set Extended Advertising Parameters (Octet 36 - Bit 2)
          LE Set Extended Advertising Data (Octet 36 - Bit 3)
          LE Set Extended Scan Response Data (Octet 36 - Bit 4)
          LE Set Extended Advertising Enable (Octet 36 - Bit 5)
          LE Read Maximum Advertising Data Length (Octet 36 - Bit 6)
          LE Read Number of Supported Advertising Sets (Octet 36 - Bit 7)
          LE Remove Advertising Set (Octet 37 - Bit 0)
          LE Clear Advertising Sets (Octet 37 - Bit 1)
          LE Set Periodic Advertising Parameters (Octet 37 - Bit 2)
          LE Set Periodic Advertising Data (Octet 37 - Bit 3)
          LE Set Periodic Advertising Enable (Octet 37 - Bit 4)
          LE Set Extended Scan Parameters (Octet 37 - Bit 5)
          LE Set Extended Scan Enable (Octet 37 - Bit 6)
          LE Extended Create Connection (Octet 37 - Bit 7)
          LE Periodic Advertising Create Sync (Octet 38 - Bit 0)
          LE Periodic Advertising Create Sync Cancel (Octet 38 - Bit 1)
          LE Periodic Advertising Terminate Sync (Octet 38 - Bit 2)
          LE Add Device To Periodic Advertiser List (Octet 38 - Bit 3)
          LE Remove Device From Periodic Advertiser List (Octet 38 - Bit 4)
          LE Clear Periodic Advertiser List (Octet 38 - Bit 5)
          LE Read Periodic Advertiser List Size (Octet 38 - Bit 6)
          LE Read Transmit Power (Octet 38 - Bit 7)
          LE Read RF Path Compensation (Octet 39 - Bit 0)
          LE Write RF Path Compensation (Octet 39 - Bit 1)
          LE Set Privacy Mode (Octet 39 - Bit 2)
          LE Periodic Advertising Receive Enable (Octet 40 - Bit 5)
          LE Periodic Advertising Sync Transfer (Octet 40 - Bit 6)
          LE Periodic Advertising Set Info Transfer (Octet 40 - Bit 7)
          LE Periodic Advertising Sync Transfer Parameters (Octet 41 - Bit 0)
          LE Set Default Periodic Advertisng Sync Transfer Parameters (Octet 41 - Bit 1)
          LE Read Buffer v2 (Octet 41 - Bit 5)
          LE Read ISO TX Sync (Octet 41 - Bit 6)
          LE Set Connected Isochronous Group Parameters (Octet 41 - Bit 7)
          LE Set Connected Isochronous Group Parameters Test (Octet 42 - Bit 0)
          LE Create Connected Isochronous Stream (Octet 42 - Bit 1)
          LE Remove Connected Isochronous Group (Octet 42 - Bit 2)
          LE Accept Connected Isochronous Stream Request (Octet 42 - Bit 3)
          LE Reject Connected Isochronous Stream Request (Octet 42 - Bit 4)
          LE Create Broadcast Isochronous Group (Octet 42 - Bit 5)
          LE Create Broadcast Isochronous Group Test (Octet 42 - Bit 6)
          LE Terminate Broadcast Isochronous Group (Octet 42 - Bit 7)
          LE Broadcast Isochronous Group Create Sync (Octet 43 - Bit 0)
          LE Broadcast Isochronous Group Terminate Sync (Octet 43 - Bit 1)
          LE Request Peer SCA (Octet 43 - Bit 2)
          LE Setup Isochronous Data Path (Octet 43 - Bit 3)
          LE Remove Isochronous Data Path (Octet 43 - Bit 4)
          LE Isochronous Transmit Test (Octet 43 - Bit 5)
          LE Isochronous Receive Test (Octet 43 - Bit 6)
          LE Isochronous Read Test Counters (Octet 43 - Bit 7)
          LE Isochronous Read Test Counters (Octet 44 - Bit 0)
          LE Set Host Feature (Octet 44 - Bit 1)
          Octet 44 - Bit 2 
          Octet 45 - Bit 6 
          Octet 46 - Bit 0 
          Octet 46 - Bit 1 
          Octet 46 - Bit 2 
< HCI Command: Host Buffer Size (0x03|0x0033) plen 7         #9 [hci1] 0.764897
        ACL MTU: 255  ACL max packet: 16
        SCO MTU: 0    SCO max packet: 0
> HCI Event: Command Complete (0x0e) plen 4                 #10 [hci1] 0.765390
      Host Buffer Size (0x03|0x0033) ncmd 1
        Status: Success (0x00)
< HCI Command: Set Controller To Ho.. (0x03|0x0031) plen 1  #11 [hci1] 0.784888
        Flow control: ACL Data Packets (0x01)
> HCI Event: Command Complete (0x0e) plen 4                 #12 [hci1] 0.785299
      Set Controller To Host Flow Control (0x03|0x0031) ncmd 1
        Status: Success (0x00)
< HCI Command: LE Read Local Suppor.. (0x08|0x0003) plen 0  #13 [hci1] 0.804879
> HCI Event: Command Complete (0x0e) plen 12                #14 [hci1] 0.805416
      LE Read Local Supported Features (0x08|0x0003) ncmd 1
        Status: Success (0x00)
        Features: 0xfd 0x79 0x00 0xf7 0x30 0x01 0x00 0x00
          LE Encryption
          Extended Reject Indication
          Peripheral-initiated Features Exchange
          LE Ping
          LE Data Packet Length Extension
          LL Privacy
          Extended Scanner Filter Policies
          LE 2M PHY
          LE Coded PHY
          LE Extended Advertising
          LE Periodic Advertising
          Channel Selection Algorithm #2
          Periodic Advertising Sync Transfer - Sender
          Periodic Advertising Sync Transfer - Recipient
          Sleep Clock Accuracy Updates
          Connected Isochronous Stream - Central
          Connected Isochronous Stream - Peripheral
          Isochronous Broadcaster
          Synchronized Receiver
          Periodic Advertising ADI support
          Connection Subrating
          Unknown features (0x0000010000000000)
< HCI Command: LE Set Host Feature (0x08|0x0074) plen 2     #15 [hci1] 0.824901
        Bit Number: 32
          Connected Isochronous Stream (Host Support)
        Bit Value: 1
> HCI Event: Command Complete (0x0e) plen 4                 #16 [hci1] 0.825394
      LE Set Host Feature (0x08|0x0074) ncmd 1
        Status: Success (0x00)
< HCI Command: LE Read Buffer v2 (0x08|0x0060) plen 0       #17 [hci1] 0.844887
> HCI Event: Command Complete (0x0e) plen 10                #18 [hci1] 0.845356
      LE Read Buffer v2 (0x08|0x0060) ncmd 1
        Status: Success (0x00)
        ACL MTU: 27
        ACL max packet: 3
        ISO MTU: 318
        ISO max packet: 3
< HCI Command: LE Read Maximum Adve.. (0x08|0x003a) plen 0  #19 [hci1] 0.864918
> HCI Event: Command Complete (0x0e) plen 6                 #20 [hci1] 0.865373
      LE Read Maximum Advertising Data Length (0x08|0x003a) ncmd 1
        Status: Success (0x00)
        Max length: 1650
< HCI Command: LE Read Supported St.. (0x08|0x001c) plen 0  #21 [hci1] 0.884904
> HCI Event: Command Complete (0x0e) plen 12                #22 [hci1] 0.885348
      LE Read Supported States (0x08|0x001c) ncmd 1
        Status: Success (0x00)
        States: 0x000003ff3e0306ff
          Non-connectable Advertising State
          Scannable Advertising State
          Connectable Advertising State
          High Duty Cycle Directed Advertising State
          Passive Scanning State
          Active Scanning State
          Initiating State
            and Connection State (Central Role)
          Connection State (Peripheral Role)
          Scannable Advertising State
            and Passive Scanning State
          Connectable Advertising State
            and Passive Scanning State
          Non-connectable Advertising State
            and Initiating State
          Scannable Advertising State
            and Initiating State
          Active Scanning State
            and Connection State (Central Role)
          Passive Scanning State
            and Connection State (Peripheral Role)
          Active Scanning State
            and Connection State (Peripheral Role)
          Initiating State
            and Connection State (Central Role)
            and Central Role & Central Role
          Low Duty Cycle Directed Advertising State
          Connectable Advertising State
            and Initiating State
            and Central Role & Peripheral Role
          High Duty Cycle Directed Advertising State
            and Initiating State
            and Central Role & Peripheral Role
          Low Duty Cycle Directed Advertising State
            and Initiating State
            and Central Role & Peripheral Role
          Connectable Advertising State
            and Connection State (Central Role)
            and Central Role & Peripheral Role
          High Duty Cycle Directed Advertising State
            and Connection State (Central Role)
            and Central Role & Peripheral Role
          Low Duty Cycle Directed Advertising State
            and Connection State (Central Role)
            and Central Role & Peripheral Role
          Connectable Advertising State
            and Connection State (Peripheral Role)
            and Central Role & Peripheral Role
          High Duty Cycle Directed Advertising State
            and Connection State (Peripheral Role)
            and Peripheral Role & Peripheral Role
          Low Duty Cycle Directed Advertising State
            and Connection State (Peripheral Role)
            and Peripheral Role & Peripheral Role
          Initiating State
            and Connection State (Peripheral Role)
            and Central Role & Peripheral Role
< HCI Command: LE Read Maximum Data.. (0x08|0x002f) plen 0  #23 [hci1] 0.904884
> HCI Event: Command Complete (0x0e) plen 12                #24 [hci1] 0.905442
      LE Read Maximum Data Length (0x08|0x002f) ncmd 1
        Status: Success (0x00)
        Max TX octets: 251
        Max TX time: 2704
        Max RX octets: 251
        Max RX time: 2704
< HCI Command: LE Write Suggested D.. (0x08|0x0024) plen 4  #25 [hci1] 0.924883
        TX octets: 251
        TX time: 2704
> HCI Event: Command Complete (0x0e) plen 4                 #26 [hci1] 0.925421
      LE Write Suggested Default Data Length (0x08|0x0024) ncmd 1
        Status: Success (0x00)
< HCI Command: LE Read Resolving Li.. (0x08|0x002a) plen 0  #27 [hci1] 0.944897
> HCI Event: Command Complete (0x0e) plen 5                 #28 [hci1] 0.945427
      LE Read Resolving List Size (0x08|0x002a) ncmd 1
        Status: Success (0x00)
        Size: 8
< HCI Command: LE Set Event Mask (0x08|0x0001) plen 8       #29 [hci1] 0.964878
        Mask: 0x000002023f87fa5e
          LE Advertising Report
          LE Connection Update Complete
          LE Read Remote Used Features Complete
          LE Long Term Key Request
          LE Data Length Change
          LE Enhanced Connection Complete
          LE PHY Update Complete
          LE Extended Advertising Report
          LE Periodic Advertising Sync Established
          LE Periodic Advertising Report
          LE Periodic Advertising Sync Lost
          LE Extended Scan Timeout
          LE Extended Advertising Set Terminated
          LE Scan Request Received
          LE Periodic Advertising Sync Transfer Rvc
          LE CIS Established
          LE CIS Request
          LE Create BIG Complete
          LE Terminate BIG Complete
          LE BIG Sync Estabilished Complete
          LE BIG Sync Lost
          LE BIG Info Advertising Report
          Unknown mask (0x0000020000000000)
> HCI Event: Command Complete (0x0e) plen 4                 #30 [hci1] 0.965393
      LE Set Event Mask (0x08|0x0001) ncmd 1
        Status: Success (0x00)
< HCI Command: Set Event Mask (0x03|0x0001) plen 8          #31 [hci1] 0.984886
        Mask: 0x2000800002008890
          Disconnection Complete
          Encryption Change
          Read Remote Version Information Complete
          Hardware Error
          Data Buffer Overflow
          Encryption Key Refresh Complete
          LE Meta
> HCI Event: Command Complete (0x0e) plen 4                 #32 [hci1] 0.985360
      Set Event Mask (0x03|0x0001) ncmd 1
        Status: Success (0x00)
< HCI Command: Read BD ADDR (0x04|0x0009) plen 0            #33 [hci1] 1.004891
> HCI Event: Command Complete (0x0e) plen 10                #34 [hci1] 1.005346
      Read BD ADDR (0x04|0x0009) ncmd 1
        Status: Success (0x00)
        Address: 00:00:00:00:00:00 (OUI 00-00-00)
< HCI Command: LE Set Random Address (0x08|0x0005) plen 6   #35 [hci1] 1.024912
        Address: D5:B6:CC:31:DB:3B (Static)
> HCI Event: Command Complete (0x0e) plen 4                 #36 [hci1] 1.025484
      LE Set Random Address (0x08|0x0005) ncmd 1
        Status: Success (0x00)
< HCI Command: LE Extended Create... (0x08|0x0043) plen 26  #37 [hci1] 3.234996
        Filter policy: Accept list is not used (0x00)
        Own address type: Random (0x01)
        Peer address type: Public (0x00)
        Peer address: DF:A9:FF:F6:B1:1A (OUI DF-A9-FF)
        Initiating PHYs: 0x01
        Entry 0: LE 1M
          Scan interval: 60.000 msec (0x0060)
          Scan window: 60.000 msec (0x0060)
          Min connection interval: 30.00 msec (0x0018)
          Max connection interval: 50.00 msec (0x0028)
          Connection latency: 0 (0x0000)
          Supervision timeout: 4000 msec (0x0190)
          Min connection length: 0.000 msec (0x0000)
          Max connection length: 0.000 msec (0x0000)
> HCI Event: Command Status (0x0f) plen 4                   #38 [hci1] 3.235944
      LE Extended Create Connection (0x08|0x0043) ncmd 1
        Status: Success (0x00)
> HCI Event: LE Meta Event (0x3e) plen 31                   #39 [hci1] 3.264920
      LE Enhanced Connection Complete (0x0a)
        Status: Success (0x00)
        Handle: 486
        Role: Central (0x00)
        Peer address type: Public (0x00)
        Peer address: DF:A9:FF:F6:B1:1A (OUI DF-A9-FF)
        Local resolvable private address: 00:00:00:00:00:00 (Non-Resolvable)
        Peer resolvable private address: 00:00:00:00:00:00 (Non-Resolvable)
        Connection interval: 50.00 msec (0x0028)
        Connection latency: 0 (0x0000)
        Supervision timeout: 4000 msec (0x0190)
        Central clock accuracy: 0x00
< HCI Command: LE Read Remote Used... (0x08|0x0016) plen 2  #40 [hci1] 3.285085
        Handle: 486 Address: DF:A9:FF:F6:B1:1A (OUI DF-A9-FF)
> HCI Event: Command Status (0x0f) plen 4                   #41 [hci1] 3.285575
      LE Read Remote Used Features (0x08|0x0016) ncmd 1
        Status: Success (0x00)
< HCI Command: LE Set PHY (0x08|0x0032) plen 7              #42 [hci1] 3.304928
        Handle: 486 Address: DF:A9:FF:F6:B1:1A (OUI DF-A9-FF)
        All PHYs preference: 0x00
        TX PHYs preference: 0x02
          LE 2M
        RX PHYs preference: 0x02
          LE 2M
        PHY options preference: Reserved (0x0000)
> HCI Event: Command Status (0x0f) plen 4                   #43 [hci1] 3.305475
      LE Set PHY (0x08|0x0032) ncmd 1
        Status: Success (0x00)
> ACL Data RX: Handle 486 flags 0x02 dlen 6                 #44 [hci1] 3.316294
      SMP: Security Request (0x0b) len 1
        Authentication requirement: No bonding, MITM, SC, No Keypresses (0x0c)
< HCI Command: Host Number of Compl.. (0x03|0x0035) plen 5  #45 [hci1] 3.325105
        Num handles: 1
        Handle: 486 Address: DF:A9:FF:F6:B1:1A (OUI DF-A9-FF)
        Count: 1
< ACL Data TX: Handle 486 flags 0x00 dlen 11                #46 [hci1] 3.325241
      SMP: Pairing Request (0x01) len 6
        IO capability: DisplayOnly (0x00)
        OOB data: Authentication data not present (0x00)
        Authentication requirement: Bonding, No MITM, SC, No Keypresses (0x09)
        Max encryption key size: 16
        Initiator key distribution: EncKey (0x01)
        Responder key distribution: EncKey IdKey (0x03)
> HCI Event: Number of Completed Packets (0x13) plen 5      #47 [hci1] 3.416474
        Num handles: 1
        Handle: 486 Address: DF:A9:FF:F6:B1:1A (OUI DF-A9-FF)
        Count: 1
        #46: len 11 (0 Kb/s)
        Latency: 91 msec (91-91 msec ~91 msec)
> HCI Event: LE Meta Event (0x3e) plen 12                   #48 [hci1] 3.416551
      LE Read Remote Used Features (0x04)
        Status: Success (0x00)
        Handle: 486 Address: DF:A9:FF:F6:B1:1A (OUI DF-A9-FF)
        Features: 0x2d 0x49 0x00 0xf7 0x67 0xd8 0x00 0x00
          LE Encryption
          Extended Reject Indication
          Peripheral-initiated Features Exchange
          LE Data Packet Length Extension
          LE 2M PHY
          LE Coded PHY
          Channel Selection Algorithm #2
          Periodic Advertising Sync Transfer - Sender
          Periodic Advertising Sync Transfer - Recipient
          Sleep Clock Accuracy Updates
          Connected Isochronous Stream - Central
          Connected Isochronous Stream - Peripheral
          Isochronous Broadcaster
          Synchronized Receiver
          Connected Isochronous Stream (Host Support)
          LE Power Control Request
          LE Power Control Request
          Connection Subrating
          Connection Subrating (Host Support)
          Unknown features (0x0000d80000000000)
> ACL Data RX: Handle 486 flags 0x02 dlen 11                #49 [hci1] 3.466417
      SMP: Pairing Response (0x02) len 6
        IO capability: KeyboardDisplay (0x04)
        OOB data: Authentication data not present (0x00)
        Authentication requirement: No bonding, MITM, SC, No Keypresses (0x0c)
        Max encryption key size: 16
        Initiator key distribution: <none> (0x00)
        Responder key distribution: <none> (0x00)
< HCI Command: Host Number of Compl.. (0x03|0x0035) plen 5  #50 [hci1] 3.485290
        Num handles: 1
        Handle: 486 Address: DF:A9:FF:F6:B1:1A (OUI DF-A9-FF)
        Count: 1
< ACL Data TX: Handle 486 flags 0x00 dlen 27                #51 [hci1] 3.485479
< ACL Data TX: Handle 486 flags 0x01 dlen 27                #52 [hci1] 3.485490
< ACL Data TX: Handle 486 flags 0x01 dlen 15                #53 [hci1] 3.485514
      SMP: Pairing Public Key (0x0c) len 64
        X: 98308440221e2d910f0e54b71e7ec652857aa9b5a0dc65028824cc19db1226e9
        Y: 67a4816bcb62efb21701e31fdb27561a6217575fb007a8bbdabe7e28b6f68482
> HCI Event: Number of Completed Packets (0x13) plen 5      #54 [hci1] 3.516361
        Num handles: 1
        Handle: 486 Address: DF:A9:FF:F6:B1:1A (OUI DF-A9-FF)
        Count: 1
        #51: len 27 (7 Kb/s)
        Latency: 30 msec (30-91 msec ~61 msec)
> HCI Event: Number of Completed Packets (0x13) plen 5      #55 [hci1] 3.566522
        Num handles: 1
        Handle: 486 Address: DF:A9:FF:F6:B1:1A (OUI DF-A9-FF)
        Count: 1
        #52: len 27 (2 Kb/s)
        Latency: 81 msec (30-91 msec ~71 msec)
> HCI Event: Number of Completed Packets (0x13) plen 5      #56 [hci1] 3.666445
        Num handles: 1
        Handle: 486 Address: DF:A9:FF:F6:B1:1A (OUI DF-A9-FF)
        Count: 1
        #53: len 15 (0 Kb/s)
        Latency: 180 msec (30-180 msec ~125 msec)
> ACL Data RX: Handle 486 flags 0x02 dlen 27                #57 [hci1] 3.716634
> ACL Data RX: Handle 486 flags 0x01 dlen 27                #58 [hci1] 3.717347
> ACL Data RX: Handle 486 flags 0x01 dlen 15                #59 [hci1] 3.717777
      SMP: Pairing Public Key (0x0c) len 64
        X: 2b8708fadee631c89bc4ef8d064d3294f6643c305acb4cd4364bd98c647cd3d8
        Y: 9c344a1b0826247b168a11b21ba89c24e561c5e97e2ca40ec2425c5bf7135cc7
< HCI Command: Host Number of Compl.. (0x03|0x0035) plen 5  #60 [hci1] 3.725134
        Num handles: 1
        Handle: 486 Address: DF:A9:FF:F6:B1:1A (OUI DF-A9-FF)
        Count: 1
< HCI Command: Host Number of Compl.. (0x03|0x0035) plen 5  #61 [hci1] 3.725166
        Num handles: 1
        Handle: 486 Address: DF:A9:FF:F6:B1:1A (OUI DF-A9-FF)
        Count: 1
< HCI Command: Host Number of Compl.. (0x03|0x0035) plen 5  #62 [hci1] 3.725357
        Num handles: 1
        Handle: 486 Address: DF:A9:FF:F6:B1:1A (OUI DF-A9-FF)
        Count: 1
< ACL Data TX: Handle 486 flags 0x00 dlen 21                #63 [hci1] 3.725433
      SMP: Pairing Confirm (0x03) len 16
        Confim value: 9a1d6db4b817c174058af6c7bbafa582
> HCI Event: Number of Completed Packets (0x13) plen 5      #64 [hci1] 3.766449
        Num handles: 1
        Handle: 486 Address: DF:A9:FF:F6:B1:1A (OUI DF-A9-FF)
        Count: 1
        #63: len 21 (4 Kb/s)
        Latency: 41 msec (30-180 msec ~83 msec)
> HCI Event: LE Meta Event (0x3e) plen 6                    #65 [hci1] 3.915837
      LE PHY Update Complete (0x0c)
        Status: Success (0x00)
        Handle: 486 Address: DF:A9:FF:F6:B1:1A (OUI DF-A9-FF)
        TX PHY: LE 2M (0x02)
        RX PHY: LE 2M (0x02)
> ACL Data RX: Handle 486 flags 0x02 dlen 21                #66 [hci1] 4.416559
      SMP: Pairing Confirm (0x03) len 16
        Confim value: cb6a7a32153fad0a2ce34369f262e5c0
< HCI Command: Host Number of Compl.. (0x03|0x0035) plen 5  #67 [hci1] 4.425480
        Num handles: 1
        Handle: 486 Address: DF:A9:FF:F6:B1:1A (OUI DF-A9-FF)
        Count: 1
< ACL Data TX: Handle 486 flags 0x00 dlen 21                #68 [hci1] 4.425680
      SMP: Pairing Random (0x04) len 16
        Random value: 8e6108f966a694cbe26df70bb96773e6
> HCI Event: Number of Completed Packets (0x13) plen 5      #69 [hci1] 4.466222
        Num handles: 1
        Handle: 486 Address: DF:A9:FF:F6:B1:1A (OUI DF-A9-FF)
        Count: 1
        #68: len 21 (4 Kb/s)
        Latency: 40 msec (30-180 msec ~62 msec)
> ACL Data RX: Handle 486 flags 0x02 dlen 21                #70 [hci1] 4.716452
      SMP: Pairing Random (0x04) len 16
        Random value: 9f2a3e5c6bc365d4d6bc1d1a378966e8
< HCI Command: Host Number of Compl.. (0x03|0x0035) plen 5  #71 [hci1] 4.725640
        Num handles: 1
        Handle: 486 Address: DF:A9:FF:F6:B1:1A (OUI DF-A9-FF)
        Count: 1
< ACL Data TX: Handle 486 flags 0x00 dlen 21                #72 [hci1] 4.725833
      SMP: Pairing Confirm (0x03) len 16
        Confim value: 8c45c498189f5b1ff5ade8fc4c6e4f27
> HCI Event: Number of Completed Packets (0x13) plen 5      #73 [hci1] 4.766260
        Num handles: 1
        Handle: 486 Address: DF:A9:FF:F6:B1:1A (OUI DF-A9-FF)
        Count: 1
        #72: len 21 (4 Kb/s)
        Latency: 40 msec (30-180 msec ~51 msec)
> ACL Data RX: Handle 486 flags 0x02 dlen 21                #74 [hci1] 4.816498
      SMP: Pairing Confirm (0x03) len 16
        Confim value: 86dd1c95ce493ccd97a83847ac84d317
< HCI Command: Host Number of Compl.. (0x03|0x0035) plen 5  #75 [hci1] 4.825380
        Num handles: 1
        Handle: 486 Address: DF:A9:FF:F6:B1:1A (OUI DF-A9-FF)
        Count: 1
< ACL Data TX: Handle 486 flags 0x00 dlen 21                #76 [hci1] 4.825577
      SMP: Pairing Random (0x04) len 16
        Random value: 4d02679f89a05211af56d8b3da64d21e
> HCI Event: Number of Completed Packets (0x13) plen 5      #77 [hci1] 4.866194
        Num handles: 1
        Handle: 486 Address: DF:A9:FF:F6:B1:1A (OUI DF-A9-FF)
        Count: 1
        #76: len 21 (4 Kb/s)
        Latency: 40 msec (30-180 msec ~45 msec)
> ACL Data RX: Handle 486 flags 0x02 dlen 21                #78 [hci1] 5.116398
      SMP: Pairing Random (0x04) len 16
        Random value: 351e35f197ceaea27ea735b792ad45c2
< HCI Command: Host Number of Compl.. (0x03|0x0035) plen 5  #79 [hci1] 5.125145
        Num handles: 1
        Handle: 486 Address: DF:A9:FF:F6:B1:1A (OUI DF-A9-FF)
        Count: 1
< ACL Data TX: Handle 486 flags 0x00 dlen 21                #80 [hci1] 5.125155
      SMP: Pairing Confirm (0x03) len 16
        Confim value: ff2844a649566be57c788a2bb14cfa72
> HCI Event: Number of Completed Packets (0x13) plen 5      #81 [hci1] 5.166301
        Num handles: 1
        Handle: 486 Address: DF:A9:FF:F6:B1:1A (OUI DF-A9-FF)
        Count: 1
        #80: len 21 (4 Kb/s)
        Latency: 41 msec (30-180 msec ~43 msec)
> ACL Data RX: Handle 486 flags 0x02 dlen 21                #82 [hci1] 5.216465
      SMP: Pairing Confirm (0x03) len 16
        Confim value: ef332213428133c80b91a5f5ba4a0181
< HCI Command: Host Number of Compl.. (0x03|0x0035) plen 5  #83 [hci1] 5.225511
        Num handles: 1
        Handle: 486 Address: DF:A9:FF:F6:B1:1A (OUI DF-A9-FF)
        Count: 1
< ACL Data TX: Handle 486 flags 0x00 dlen 21                #84 [hci1] 5.225688
      SMP: Pairing Random (0x04) len 16
        Random value: 5e8286bc235a02440d0c3424a2acf8fd
> HCI Event: Number of Completed Packets (0x13) plen 5      #85 [hci1] 5.266160
        Num handles: 1
        Handle: 486 Address: DF:A9:FF:F6:B1:1A (OUI DF-A9-FF)
        Count: 1
        #84: len 21 (4 Kb/s)
        Latency: 40 msec (30-180 msec ~42 msec)
> ACL Data RX: Handle 486 flags 0x02 dlen 21                #86 [hci1] 5.516380
      SMP: Pairing Random (0x04) len 16
        Random value: 1d51dd267d4b41dd9b1be45234137dad
< HCI Command: Host Number of Compl.. (0x03|0x0035) plen 5  #87 [hci1] 5.525487
        Num handles: 1
        Handle: 486 Address: DF:A9:FF:F6:B1:1A (OUI DF-A9-FF)
        Count: 1
< ACL Data TX: Handle 486 flags 0x00 dlen 21                #88 [hci1] 5.525659
      SMP: Pairing Confirm (0x03) len 16
        Confim value: 70130b7b491f266337ad84e9b5e2180b
> HCI Event: Number of Completed Packets (0x13) plen 5      #89 [hci1] 5.566266
        Num handles: 1
        Handle: 486 Address: DF:A9:FF:F6:B1:1A (OUI DF-A9-FF)
        Count: 1
        #88: len 21 (4 Kb/s)
        Latency: 40 msec (30-180 msec ~41 msec)
> ACL Data RX: Handle 486 flags 0x02 dlen 21                #90 [hci1] 5.616458
      SMP: Pairing Confirm (0x03) len 16
        Confim value: c67887d7d120f89d9f197627b119ec4d
< HCI Command: Host Number of Compl.. (0x03|0x0035) plen 5  #91 [hci1] 5.625171
        Num handles: 1
        Handle: 486 Address: DF:A9:FF:F6:B1:1A (OUI DF-A9-FF)
        Count: 1
< ACL Data TX: Handle 486 flags 0x00 dlen 21                #92 [hci1] 5.625290
      SMP: Pairing Random (0x04) len 16
        Random value: 5c4a1bcadd27bd58e945097b00bad7ac
> HCI Event: Number of Completed Packets (0x13) plen 5      #93 [hci1] 5.666266
        Num handles: 1
        Handle: 486 Address: DF:A9:FF:F6:B1:1A (OUI DF-A9-FF)
        Count: 1
        #92: len 21 (4 Kb/s)
        Latency: 40 msec (30-180 msec ~41 msec)
> ACL Data RX: Handle 486 flags 0x02 dlen 21                #94 [hci1] 5.916389
      SMP: Pairing Random (0x04) len 16
        Random value: 02e0d670f7476f6a39152d3f55aabf70
< HCI Command: Host Number of Compl.. (0x03|0x0035) plen 5  #95 [hci1] 5.925600
        Num handles: 1
        Handle: 486 Address: DF:A9:FF:F6:B1:1A (OUI DF-A9-FF)
        Count: 1
< ACL Data TX: Handle 486 flags 0x00 dlen 21                #96 [hci1] 5.925808
      SMP: Pairing Confirm (0x03) len 16
        Confim value: 89c28bd48a0c7d8d8c21c0c07d203ccd
> HCI Event: Number of Completed Packets (0x13) plen 5      #97 [hci1] 5.966256
        Num handles: 1
        Handle: 486 Address: DF:A9:FF:F6:B1:1A (OUI DF-A9-FF)
        Count: 1
        #96: len 21 (4 Kb/s)
        Latency: 40 msec (30-180 msec ~40 msec)
> ACL Data RX: Handle 486 flags 0x02 dlen 21                #98 [hci1] 6.016326
      SMP: Pairing Confirm (0x03) len 16
        Confim value: 04317f24a7f939035bcccceb02ed35a8
< HCI Command: Host Number of Compl.. (0x03|0x0035) plen 5  #99 [hci1] 6.025140
        Num handles: 1
        Handle: 486 Address: DF:A9:FF:F6:B1:1A (OUI DF-A9-FF)
        Count: 1
< ACL Data TX: Handle 486 flags 0x00 dlen 21               #100 [hci1] 6.025254
      SMP: Pairing Random (0x04) len 16
        Random value: 32527e6e64e79f33b2e374394db8ab2d
> HCI Event: Number of Completed Packets (0x13) plen 5     #101 [hci1] 6.066265
        Num handles: 1
        Handle: 486 Address: DF:A9:FF:F6:B1:1A (OUI DF-A9-FF)
        Count: 1
        #100: len 21 (4 Kb/s)
        Latency: 41 msec (30-180 msec ~40 msec)
> ACL Data RX: Handle 486 flags 0x02 dlen 21               #102 [hci1] 6.316369
      SMP: Pairing Random (0x04) len 16
        Random value: cb2801841e0ec96d9fd04f136f9efd0f
< HCI Command: Host Number of Comp.. (0x03|0x0035) plen 5  #103 [hci1] 6.325575
        Num handles: 1
        Handle: 486 Address: DF:A9:FF:F6:B1:1A (OUI DF-A9-FF)
        Count: 1
< ACL Data TX: Handle 486 flags 0x00 dlen 21               #104 [hci1] 6.325813
      SMP: Pairing Confirm (0x03) len 16
        Confim value: e0162c7499f19d25fb65011b378af075
> HCI Event: Number of Completed Packets (0x13) plen 5     #105 [hci1] 6.366203
        Num handles: 1
        Handle: 486 Address: DF:A9:FF:F6:B1:1A (OUI DF-A9-FF)
        Count: 1
        #104: len 21 (4 Kb/s)
        Latency: 40 msec (30-180 msec ~40 msec)
> ACL Data RX: Handle 486 flags 0x02 dlen 21               #106 [hci1] 6.416453
      SMP: Pairing Confirm (0x03) len 16
        Confim value: 08cd5050f9c264679996ccd195a26e47
< HCI Command: Host Number of Comp.. (0x03|0x0035) plen 5  #107 [hci1] 6.425495
        Num handles: 1
        Handle: 486 Address: DF:A9:FF:F6:B1:1A (OUI DF-A9-FF)
        Count: 1
< ACL Data TX: Handle 486 flags 0x00 dlen 21               #108 [hci1] 6.425731
      SMP: Pairing Random (0x04) len 16
        Random value: dddbdfe2838e9a8cc6964353c850fef7
> HCI Event: Number of Completed Packets (0x13) plen 5     #109 [hci1] 6.466169
        Num handles: 1
        Handle: 486 Address: DF:A9:FF:F6:B1:1A (OUI DF-A9-FF)
        Count: 1
        #108: len 21 (4 Kb/s)
        Latency: 40 msec (30-180 msec ~40 msec)
> ACL Data RX: Handle 486 flags 0x02 dlen 21               #110 [hci1] 6.716394
      SMP: Pairing Random (0x04) len 16
        Random value: a2c680574a2f214b56cccca4395c68d0
< HCI Command: Host Number of Comp.. (0x03|0x0035) plen 5  #111 [hci1] 6.725736
        Num handles: 1
        Handle: 486 Address: DF:A9:FF:F6:B1:1A (OUI DF-A9-FF)
        Count: 1
< ACL Data TX: Handle 486 flags 0x00 dlen 21               #112 [hci1] 6.725944
      SMP: Pairing Confirm (0x03) len 16
        Confim value: a2f5b1d6dbee8fd27422f3f936870378
> HCI Event: Number of Completed Packets (0x13) plen 5     #113 [hci1] 6.766275
        Num handles: 1
        Handle: 486 Address: DF:A9:FF:F6:B1:1A (OUI DF-A9-FF)
        Count: 1
        #112: len 21 (4 Kb/s)
        Latency: 40 msec (30-180 msec ~40 msec)
> ACL Data RX: Handle 486 flags 0x02 dlen 21               #114 [hci1] 6.816430
      SMP: Pairing Confirm (0x03) len 16
        Confim value: b21f9886d1eabdf9d6f03616ae4d8d0f
< HCI Command: Host Number of Comp.. (0x03|0x0035) plen 5  #115 [hci1] 6.825436
        Num handles: 1
        Handle: 486 Address: DF:A9:FF:F6:B1:1A (OUI DF-A9-FF)
        Count: 1
< ACL Data TX: Handle 486 flags 0x00 dlen 21               #116 [hci1] 6.825651
      SMP: Pairing Random (0x04) len 16
        Random value: eb9f1915536596b6fc3db1c86b2b1970
> HCI Event: Number of Completed Packets (0x13) plen 5     #117 [hci1] 6.866150
        Num handles: 1
        Handle: 486 Address: DF:A9:FF:F6:B1:1A (OUI DF-A9-FF)
        Count: 1
        #116: len 21 (4 Kb/s)
        Latency: 40 msec (30-180 msec ~40 msec)
> ACL Data RX: Handle 486 flags 0x02 dlen 21               #118 [hci1] 7.116507
      SMP: Pairing Random (0x04) len 16
        Random value: f097b31e157586aa27c46506ae917036
< HCI Command: Host Number of Comp.. (0x03|0x0035) plen 5  #119 [hci1] 7.125527
        Num handles: 1
        Handle: 486 Address: DF:A9:FF:F6:B1:1A (OUI DF-A9-FF)
        Count: 1
< ACL Data TX: Handle 486 flags 0x00 dlen 21               #120 [hci1] 7.125739
      SMP: Pairing Confirm (0x03) len 16
        Confim value: 55303f716183a36d0c3b44bc206ae9ff
> HCI Event: Number of Completed Packets (0x13) plen 5     #121 [hci1] 7.166197
        Num handles: 1
        Handle: 486 Address: DF:A9:FF:F6:B1:1A (OUI DF-A9-FF)
        Count: 1
        #120: len 21 (4 Kb/s)
        Latency: 40 msec (30-180 msec ~40 msec)
> ACL Data RX: Handle 486 flags 0x02 dlen 21               #122 [hci1] 7.216338
      SMP: Pairing Confirm (0x03) len 16
        Confim value: 693aaa02bece17033ac306471f09c513
< HCI Command: Host Number of Comp.. (0x03|0x0035) plen 5  #123 [hci1] 7.225477
        Num handles: 1
        Handle: 486 Address: DF:A9:FF:F6:B1:1A (OUI DF-A9-FF)
        Count: 1
< ACL Data TX: Handle 486 flags 0x00 dlen 21               #124 [hci1] 7.225702
      SMP: Pairing Random (0x04) len 16
        Random value: 5c794dc9ad9f2c3f295ebd5ad5e1c3cf
> HCI Event: Number of Completed Packets (0x13) plen 5     #125 [hci1] 7.266170
        Num handles: 1
        Handle: 486 Address: DF:A9:FF:F6:B1:1A (OUI DF-A9-FF)
        Count: 1
        #124: len 21 (4 Kb/s)
        Latency: 40 msec (30-180 msec ~40 msec)
> ACL Data RX: Handle 486 flags 0x02 dlen 21               #126 [hci1] 7.516434
      SMP: Pairing Random (0x04) len 16
        Random value: 5fb83c4d58ed4b6f1cb51a8f062bc707
< HCI Command: Host Number of Comp.. (0x03|0x0035) plen 5  #127 [hci1] 7.525470
        Num handles: 1
        Handle: 486 Address: DF:A9:FF:F6:B1:1A (OUI DF-A9-FF)
        Count: 1
< ACL Data TX: Handle 486 flags 0x00 dlen 21               #128 [hci1] 7.525629
      SMP: Pairing Confirm (0x03) len 16
        Confim value: 046814bd0977f5e4dafb2514e645bcd7
> HCI Event: Number of Completed Packets (0x13) plen 5     #129 [hci1] 7.566133
        Num handles: 1
        Handle: 486 Address: DF:A9:FF:F6:B1:1A (OUI DF-A9-FF)
        Count: 1
        #128: len 21 (4 Kb/s)
        Latency: 40 msec (30-180 msec ~40 msec)
> ACL Data RX: Handle 486 flags 0x02 dlen 21               #130 [hci1] 7.616346
      SMP: Pairing Confirm (0x03) len 16
        Confim value: fe6bdec09a9780905b87b1e7e26928d1
< HCI Command: Host Number of Comp.. (0x03|0x0035) plen 5  #131 [hci1] 7.625039
        Num handles: 1
        Handle: 486 Address: DF:A9:FF:F6:B1:1A (OUI DF-A9-FF)
        Count: 1
< ACL Data TX: Handle 486 flags 0x00 dlen 21               #132 [hci1] 7.625127
      SMP: Pairing Random (0x04) len 16
        Random value: 5c2fff312cdf99c9491988e877355a9a
> HCI Event: Number of Completed Packets (0x13) plen 5     #133 [hci1] 7.666119
        Num handles: 1
        Handle: 486 Address: DF:A9:FF:F6:B1:1A (OUI DF-A9-FF)
        Count: 1
        #132: len 21 (4 Kb/s)
        Latency: 40 msec (30-180 msec ~40 msec)
> ACL Data RX: Handle 486 flags 0x02 dlen 21               #134 [hci1] 7.916415
      SMP: Pairing Random (0x04) len 16
        Random value: d686fa9b2ce6ffbf7edd2ed3ba565d49
< HCI Command: Host Number of Comp.. (0x03|0x0035) plen 5  #135 [hci1] 7.925715
        Num handles: 1
        Handle: 486 Address: DF:A9:FF:F6:B1:1A (OUI DF-A9-FF)
        Count: 1
< ACL Data TX: Handle 486 flags 0x00 dlen 21               #136 [hci1] 7.925929
      SMP: Pairing Confirm (0x03) len 16
        Confim value: dec03066d8a486cebc4e455ad09a2092
> HCI Event: Number of Completed Packets (0x13) plen 5     #137 [hci1] 7.966239
        Num handles: 1
        Handle: 486 Address: DF:A9:FF:F6:B1:1A (OUI DF-A9-FF)
        Count: 1
        #136: len 21 (4 Kb/s)
        Latency: 40 msec (30-180 msec ~40 msec)
> ACL Data RX: Handle 486 flags 0x02 dlen 21               #138 [hci1] 8.016444
      SMP: Pairing Confirm (0x03) len 16
        Confim value: 02f391b6375e93117672a7649374e5ba
< HCI Command: Host Number of Comp.. (0x03|0x0035) plen 5  #139 [hci1] 8.025390
        Num handles: 1
        Handle: 486 Address: DF:A9:FF:F6:B1:1A (OUI DF-A9-FF)
        Count: 1
< ACL Data TX: Handle 486 flags 0x00 dlen 21               #140 [hci1] 8.025588
      SMP: Pairing Random (0x04) len 16
        Random value: c629a3a987d808e808655d558dfc1155
> HCI Event: Number of Completed Packets (0x13) plen 5     #141 [hci1] 8.066119
        Num handles: 1
        Handle: 486 Address: DF:A9:FF:F6:B1:1A (OUI DF-A9-FF)
        Count: 1
        #140: len 21 (4 Kb/s)
        Latency: 40 msec (30-180 msec ~40 msec)
> ACL Data RX: Handle 486 flags 0x02 dlen 21               #142 [hci1] 8.316365
      SMP: Pairing Random (0x04) len 16
        Random value: 7f9e11fbe9eb75fed5b820a783806440
< HCI Command: Host Number of Comp.. (0x03|0x0035) plen 5  #143 [hci1] 8.325597
        Num handles: 1
        Handle: 486 Address: DF:A9:FF:F6:B1:1A (OUI DF-A9-FF)
        Count: 1
< ACL Data TX: Handle 486 flags 0x00 dlen 21               #144 [hci1] 8.325790
      SMP: Pairing Confirm (0x03) len 16
        Confim value: b76604d85edec560e349fa90581561a0
> HCI Event: Number of Completed Packets (0x13) plen 5     #145 [hci1] 8.366139
        Num handles: 1
        Handle: 486 Address: DF:A9:FF:F6:B1:1A (OUI DF-A9-FF)
        Count: 1
        #144: len 21 (4 Kb/s)
        Latency: 40 msec (30-180 msec ~40 msec)
> ACL Data RX: Handle 486 flags 0x02 dlen 21               #146 [hci1] 8.416432
      SMP: Pairing Confirm (0x03) len 16
        Confim value: 23e68a3ad95a72479706db5b3c229381
< HCI Command: Host Number of Comp.. (0x03|0x0035) plen 5  #147 [hci1] 8.425464
        Num handles: 1
        Handle: 486 Address: DF:A9:FF:F6:B1:1A (OUI DF-A9-FF)
        Count: 1
< ACL Data TX: Handle 486 flags 0x00 dlen 21               #148 [hci1] 8.425658
      SMP: Pairing Random (0x04) len 16
        Random value: 92f20f6ad8f13724432c7fd6001c45ff
> HCI Event: Number of Completed Packets (0x13) plen 5     #149 [hci1] 8.466079
        Num handles: 1
        Handle: 486 Address: DF:A9:FF:F6:B1:1A (OUI DF-A9-FF)
        Count: 1
        #148: len 21 (4 Kb/s)
        Latency: 40 msec (30-180 msec ~40 msec)
> ACL Data RX: Handle 486 flags 0x02 dlen 21               #150 [hci1] 8.716405
      SMP: Pairing Random (0x04) len 16
        Random value: c3dddfa429cabcd2eb04b2215b544d71
< HCI Command: Host Number of Comp.. (0x03|0x0035) plen 5  #151 [hci1] 8.725587
        Num handles: 1
        Handle: 486 Address: DF:A9:FF:F6:B1:1A (OUI DF-A9-FF)
        Count: 1
< ACL Data TX: Handle 486 flags 0x00 dlen 21               #152 [hci1] 8.725812
      SMP: Pairing Confirm (0x03) len 16
        Confim value: 0121ef733ee82d739bf05ac5619155cf
> HCI Event: Number of Completed Packets (0x13) plen 5     #153 [hci1] 8.766097
        Num handles: 1
        Handle: 486 Address: DF:A9:FF:F6:B1:1A (OUI DF-A9-FF)
        Count: 1
        #152: len 21 (4 Kb/s)
        Latency: 40 msec (30-180 msec ~40 msec)
> ACL Data RX: Handle 486 flags 0x02 dlen 21               #154 [hci1] 8.816392
      SMP: Pairing Confirm (0x03) len 16
        Confim value: fc2423628b4d496fac40e7f76af64cd0
< HCI Command: Host Number of Comp.. (0x03|0x0035) plen 5  #155 [hci1] 8.825511
        Num handles: 1
        Handle: 486 Address: DF:A9:FF:F6:B1:1A (OUI DF-A9-FF)
        Count: 1
< ACL Data TX: Handle 486 flags 0x00 dlen 21               #156 [hci1] 8.825732
      SMP: Pairing Random (0x04) len 16
        Random value: 23ac32ebbb5e14c8a6b9622f296d277f
> HCI Event: Number of Completed Packets (0x13) plen 5     #157 [hci1] 8.866138
        Num handles: 1
        Handle: 486 Address: DF:A9:FF:F6:B1:1A (OUI DF-A9-FF)
        Count: 1
        #156: len 21 (4 Kb/s)
        Latency: 40 msec (30-180 msec ~40 msec)
> ACL Data RX: Handle 486 flags 0x02 dlen 21               #158 [hci1] 9.116223
      SMP: Pairing Random (0x04) len 16
        Random value: 4b600709c590271fc7bee59579c1c8a1
< HCI Command: Host Number of Comp.. (0x03|0x0035) plen 5  #159 [hci1] 9.125481
        Num handles: 1
        Handle: 486 Address: DF:A9:FF:F6:B1:1A (OUI DF-A9-FF)
        Count: 1
< ACL Data TX: Handle 486 flags 0x00 dlen 21               #160 [hci1] 9.125654
      SMP: Pairing Confirm (0x03) len 16
        Confim value: d5e2c42d5e6370f2a7878e371fa50a13
> HCI Event: Number of Completed Packets (0x13) plen 5     #161 [hci1] 9.166090
        Num handles: 1
        Handle: 486 Address: DF:A9:FF:F6:B1:1A (OUI DF-A9-FF)
        Count: 1
        #160: len 21 (4 Kb/s)
        Latency: 40 msec (30-180 msec ~40 msec)
> ACL Data RX: Handle 486 flags 0x02 dlen 21               #162 [hci1] 9.216319
      SMP: Pairing Confirm (0x03) len 16
        Confim value: 35fbfde646abe6ce269b81d9bc31f790
< HCI Command: Host Number of Comp.. (0x03|0x0035) plen 5  #163 [hci1] 9.225198
        Num handles: 1
        Handle: 486 Address: DF:A9:FF:F6:B1:1A (OUI DF-A9-FF)
        Count: 1
< ACL Data TX: Handle 486 flags 0x00 dlen 21               #164 [hci1] 9.225332
      SMP: Pairing Random (0x04) len 16
        Random value: 297efe85e67448a15f56bd27e3a3cf1d
> HCI Event: Number of Completed Packets (0x13) plen 5     #165 [hci1] 9.266049
        Num handles: 1
        Handle: 486 Address: DF:A9:FF:F6:B1:1A (OUI DF-A9-FF)
        Count: 1
        #164: len 21 (4 Kb/s)
        Latency: 40 msec (30-180 msec ~40 msec)
> ACL Data RX: Handle 486 flags 0x02 dlen 21               #166 [hci1] 9.516286
      SMP: Pairing Random (0x04) len 16
        Random value: 008469e0d58a460cb522fa9858f3c7d5
< HCI Command: Host Number of Comp.. (0x03|0x0035) plen 5  #167 [hci1] 9.525638
        Num handles: 1
        Handle: 486 Address: DF:A9:FF:F6:B1:1A (OUI DF-A9-FF)
        Count: 1
< ACL Data TX: Handle 486 flags 0x00 dlen 21               #168 [hci1] 9.525885
      SMP: Pairing Confirm (0x03) len 16
        Confim value: fcff0cfa6903ffd55754dcc064227b89
> HCI Event: Number of Completed Packets (0x13) plen 5     #169 [hci1] 9.566087
        Num handles: 1
        Handle: 486 Address: DF:A9:FF:F6:B1:1A (OUI DF-A9-FF)
        Count: 1
        #168: len 21 (4 Kb/s)
        Latency: 40 msec (30-180 msec ~40 msec)
> ACL Data RX: Handle 486 flags 0x02 dlen 21               #170 [hci1] 9.616297
      SMP: Pairing Confirm (0x03) len 16
        Confim value: 292ca9746d12ab7a70e1af132ba6b316
< HCI Command: Host Number of Comp.. (0x03|0x0035) plen 5  #171 [hci1] 9.625143
        Num handles: 1
        Handle: 486 Address: DF:A9:FF:F6:B1:1A (OUI DF-A9-FF)
        Count: 1
< ACL Data TX: Handle 486 flags 0x00 dlen 21               #172 [hci1] 9.625166
      SMP: Pairing Random (0x04) len 16
        Random value: 25a9493fd3ce4faf02be7293595bb7c6
> HCI Event: Number of Completed Packets (0x13) plen 5     #173 [hci1] 9.666220
        Num handles: 1
        Handle: 486 Address: DF:A9:FF:F6:B1:1A (OUI DF-A9-FF)
        Count: 1
        #172: len 21 (4 Kb/s)
        Latency: 41 msec (30-180 msec ~40 msec)
> ACL Data RX: Handle 486 flags 0x02 dlen 21               #174 [hci1] 9.916361
      SMP: Pairing Random (0x04) len 16
        Random value: 0be6261eb344eafb3cad7100b1587a52
< HCI Command: Host Number of Comp.. (0x03|0x0035) plen 5  #175 [hci1] 9.925596
        Num handles: 1
        Handle: 486 Address: DF:A9:FF:F6:B1:1A (OUI DF-A9-FF)
        Count: 1
< ACL Data TX: Handle 486 flags 0x00 dlen 21               #176 [hci1] 9.925836
      SMP: Pairing Confirm (0x03) len 16
        Confim value: 9cd5274968912d8f89b700dc8a000ff5
> HCI Event: Number of Completed Packets (0x13) plen 5     #177 [hci1] 9.966174
        Num handles: 1
        Handle: 486 Address: DF:A9:FF:F6:B1:1A (OUI DF-A9-FF)
        Count: 1
        #176: len 21 (4 Kb/s)
        Latency: 40 msec (30-180 msec ~40 msec)
> ACL Data RX: Handle 486 flags 0x02 dlen 21              #178 [hci1] 10.016218
      SMP: Pairing Confirm (0x03) len 16
        Confim value: 68e095597355911c36446bec9171f927
< HCI Command: Host Number of Com.. (0x03|0x0035) plen 5  #179 [hci1] 10.025531
        Num handles: 1
        Handle: 486 Address: DF:A9:FF:F6:B1:1A (OUI DF-A9-FF)
        Count: 1
< ACL Data TX: Handle 486 flags 0x00 dlen 21              #180 [hci1] 10.025747
      SMP: Pairing Random (0x04) len 16
        Random value: 58f6b41f855a6f6c3560debd84e2affc
> HCI Event: Number of Completed Packets (0x13) plen 5    #181 [hci1] 10.066105
        Num handles: 1
        Handle: 486 Address: DF:A9:FF:F6:B1:1A (OUI DF-A9-FF)
        Count: 1
        #180: len 21 (4 Kb/s)
        Latency: 40 msec (30-180 msec ~40 msec)
> ACL Data RX: Handle 486 flags 0x02 dlen 21              #182 [hci1] 10.316307
      SMP: Pairing Random (0x04) len 16
        Random value: d563a0f8f88c2494251d0de17b9b539e
< HCI Command: Host Number of Com.. (0x03|0x0035) plen 5  #183 [hci1] 10.325668
        Num handles: 1
        Handle: 486 Address: DF:A9:FF:F6:B1:1A (OUI DF-A9-FF)
        Count: 1
< ACL Data TX: Handle 486 flags 0x00 dlen 21              #184 [hci1] 10.325914
      SMP: Pairing Confirm (0x03) len 16
        Confim value: 92e88502a9a3cd98fbe3ebde9381c96b
> HCI Event: Number of Completed Packets (0x13) plen 5    #185 [hci1] 10.366088
        Num handles: 1
        Handle: 486 Address: DF:A9:FF:F6:B1:1A (OUI DF-A9-FF)
        Count: 1
        #184: len 21 (4 Kb/s)
        Latency: 40 msec (30-180 msec ~40 msec)
> ACL Data RX: Handle 486 flags 0x02 dlen 21              #186 [hci1] 10.416273
      SMP: Pairing Confirm (0x03) len 16
        Confim value: 80b5b87adbcc677e99c85f4e8aa0c068
< HCI Command: Host Number of Com.. (0x03|0x0035) plen 5  #187 [hci1] 10.425396
        Num handles: 1
        Handle: 486 Address: DF:A9:FF:F6:B1:1A (OUI DF-A9-FF)
        Count: 1
< ACL Data TX: Handle 486 flags 0x00 dlen 21              #188 [hci1] 10.425542
      SMP: Pairing Random (0x04) len 16
        Random value: b67e7216d5bf664139eda2b542549666
> HCI Event: Number of Completed Packets (0x13) plen 5    #189 [hci1] 10.466108
        Num handles: 1
        Handle: 486 Address: DF:A9:FF:F6:B1:1A (OUI DF-A9-FF)
        Count: 1
        #188: len 21 (4 Kb/s)
        Latency: 40 msec (30-180 msec ~40 msec)
> ACL Data RX: Handle 486 flags 0x02 dlen 21              #190 [hci1] 10.716416
      SMP: Pairing Random (0x04) len 16
        Random value: 071877e27d6f45ba7a6fcd91f0ab027c
< HCI Command: Host Number of Com.. (0x03|0x0035) plen 5  #191 [hci1] 10.725457
        Num handles: 1
        Handle: 486 Address: DF:A9:FF:F6:B1:1A (OUI DF-A9-FF)
        Count: 1
< ACL Data TX: Handle 486 flags 0x00 dlen 21              #192 [hci1] 10.725613
      SMP: Pairing Confirm (0x03) len 16
        Confim value: a565b092f91828593a386f0cf803195b
> HCI Event: Number of Completed Packets (0x13) plen 5    #193 [hci1] 10.766111
        Num handles: 1
        Handle: 486 Address: DF:A9:FF:F6:B1:1A (OUI DF-A9-FF)
        Count: 1
        #192: len 21 (4 Kb/s)
        Latency: 40 msec (30-180 msec ~40 msec)
> ACL Data RX: Handle 486 flags 0x02 dlen 21              #194 [hci1] 10.816305
      SMP: Pairing Confirm (0x03) len 16
        Confim value: df12b1851534155ea68f645362714a01
< HCI Command: Host Number of Com.. (0x03|0x0035) plen 5  #195 [hci1] 10.825546
        Num handles: 1
        Handle: 486 Address: DF:A9:FF:F6:B1:1A (OUI DF-A9-FF)
        Count: 1
< ACL Data TX: Handle 486 flags 0x00 dlen 21              #196 [hci1] 10.825771
      SMP: Pairing Random (0x04) len 16
        Random value: ed17f76500c95219dd01e09d1e63f87b
> HCI Event: Number of Completed Packets (0x13) plen 5    #197 [hci1] 10.866147
        Num handles: 1
        Handle: 486 Address: DF:A9:FF:F6:B1:1A (OUI DF-A9-FF)
        Count: 1
        #196: len 21 (4 Kb/s)
        Latency: 40 msec (30-180 msec ~40 msec)
> ACL Data RX: Handle 486 flags 0x02 dlen 21              #198 [hci1] 11.116300
      SMP: Pairing Random (0x04) len 16
        Random value: 89638c935a3ade9383dff3a48ab479f3
< HCI Command: Host Number of Com.. (0x03|0x0035) plen 5  #199 [hci1] 11.125253
        Num handles: 1
        Handle: 486 Address: DF:A9:FF:F6:B1:1A (OUI DF-A9-FF)
        Count: 1
< ACL Data TX: Handle 486 flags 0x00 dlen 21              #200 [hci1] 11.125361
      SMP: Pairing Confirm (0x03) len 16
        Confim value: 1380defdf4127d2e4658112eda8978da
> HCI Event: Number of Completed Packets (0x13) plen 5    #201 [hci1] 11.166078
        Num handles: 1
        Handle: 486 Address: DF:A9:FF:F6:B1:1A (OUI DF-A9-FF)
        Count: 1
        #200: len 21 (4 Kb/s)
        Latency: 40 msec (30-180 msec ~40 msec)
> ACL Data RX: Handle 486 flags 0x02 dlen 21              #202 [hci1] 11.216429
      SMP: Pairing Confirm (0x03) len 16
        Confim value: 1f62406abf57ffaae35bd7a76b8e2ca4
< HCI Command: Host Number of Com.. (0x03|0x0035) plen 5  #203 [hci1] 11.225477
        Num handles: 1
        Handle: 486 Address: DF:A9:FF:F6:B1:1A (OUI DF-A9-FF)
        Count: 1
< ACL Data TX: Handle 486 flags 0x00 dlen 21              #204 [hci1] 11.225691
      SMP: Pairing Random (0x04) len 16
        Random value: 81d35d47e1f6006d79c974bd9d9e1ee3
> HCI Event: Number of Completed Packets (0x13) plen 5    #205 [hci1] 11.266114
        Num handles: 1
        Handle: 486 Address: DF:A9:FF:F6:B1:1A (OUI DF-A9-FF)
        Count: 1
        #204: len 21 (4 Kb/s)
        Latency: 40 msec (30-180 msec ~40 msec)
> ACL Data RX: Handle 486 flags 0x02 dlen 21              #206 [hci1] 11.516286
      SMP: Pairing Random (0x04) len 16
        Random value: 86df01ffe979c183c9ea00f00124e947
< HCI Command: Host Number of Com.. (0x03|0x0035) plen 5  #207 [hci1] 11.525538
        Num handles: 1
        Handle: 486 Address: DF:A9:FF:F6:B1:1A (OUI DF-A9-FF)
        Count: 1
< ACL Data TX: Handle 486 flags 0x00 dlen 21              #208 [hci1] 11.525674
      SMP: Pairing Confirm (0x03) len 16
        Confim value: 47ce6b6beb5be7bed271410c5824b2bc
> HCI Event: Number of Completed Packets (0x13) plen 5    #209 [hci1] 11.566135
        Num handles: 1
        Handle: 486 Address: DF:A9:FF:F6:B1:1A (OUI DF-A9-FF)
        Count: 1
        #208: len 21 (4 Kb/s)
        Latency: 40 msec (30-180 msec ~40 msec)
> ACL Data RX: Handle 486 flags 0x02 dlen 21              #210 [hci1] 11.616344
      SMP: Pairing Confirm (0x03) len 16
        Confim value: 67169c22ba4c0392416cf12585653a97
< HCI Command: Host Number of Com.. (0x03|0x0035) plen 5  #211 [hci1] 11.625547
        Num handles: 1
        Handle: 486 Address: DF:A9:FF:F6:B1:1A (OUI DF-A9-FF)
        Count: 1
< ACL Data TX: Handle 486 flags 0x00 dlen 21              #212 [hci1] 11.625762
      SMP: Pairing Random (0x04) len 16
        Random value: e7f7e0c2476823e41736a7e381bafb7c
> HCI Event: Number of Completed Packets (0x13) plen 5    #213 [hci1] 11.666069
        Num handles: 1
        Handle: 486 Address: DF:A9:FF:F6:B1:1A (OUI DF-A9-FF)
        Count: 1
        #212: len 21 (4 Kb/s)
        Latency: 40 msec (30-180 msec ~40 msec)
> ACL Data RX: Handle 486 flags 0x02 dlen 21              #214 [hci1] 11.916210
      SMP: Pairing Random (0x04) len 16
        Random value: 666a365ac2fbfd30174eb5884ea6c2fd
< HCI Command: Host Number of Com.. (0x03|0x0035) plen 5  #215 [hci1] 11.925567
        Num handles: 1
        Handle: 486 Address: DF:A9:FF:F6:B1:1A (OUI DF-A9-FF)
        Count: 1
< ACL Data TX: Handle 486 flags 0x00 dlen 21              #216 [hci1] 11.925774
      SMP: Pairing Confirm (0x03) len 16
        Confim value: 5b5e58c17392661671bdb04e164d9c23
> HCI Event: Number of Completed Packets (0x13) plen 5    #217 [hci1] 11.966056
        Num handles: 1
        Handle: 486 Address: DF:A9:FF:F6:B1:1A (OUI DF-A9-FF)
        Count: 1
        #216: len 21 (4 Kb/s)
        Latency: 40 msec (30-180 msec ~40 msec)
> ACL Data RX: Handle 486 flags 0x02 dlen 21              #218 [hci1] 12.016227
      SMP: Pairing Confirm (0x03) len 16
        Confim value: a667550b651875fb1a9cb863c91eec59
< HCI Command: Host Number of Com.. (0x03|0x0035) plen 5  #219 [hci1] 12.025551
        Num handles: 1
        Handle: 486 Address: DF:A9:FF:F6:B1:1A (OUI DF-A9-FF)
        Count: 1
< ACL Data TX: Handle 486 flags 0x00 dlen 21              #220 [hci1] 12.025760
      SMP: Pairing Random (0x04) len 16
        Random value: fc8b40d9b0b09bc4296bf8753a8f6e1f
> HCI Event: Number of Completed Packets (0x13) plen 5    #221 [hci1] 12.066041
        Num handles: 1
        Handle: 486 Address: DF:A9:FF:F6:B1:1A (OUI DF-A9-FF)
        Count: 1
        #220: len 21 (4 Kb/s)
        Latency: 40 msec (30-180 msec ~40 msec)
> ACL Data RX: Handle 486 flags 0x02 dlen 21              #222 [hci1] 12.316279
      SMP: Pairing Random (0x04) len 16
        Random value: d221cc1ac0cbe47e730812c4ab29b6da
< HCI Command: Host Number of Com.. (0x03|0x0035) plen 5  #223 [hci1] 12.325982
        Num handles: 1
        Handle: 486 Address: DF:A9:FF:F6:B1:1A (OUI DF-A9-FF)
        Count: 1
< ACL Data TX: Handle 486 flags 0x00 dlen 21              #224 [hci1] 12.326209
      SMP: Pairing DHKey Check (0x0d) len 16
        E: d03f3276777643ff4e4338e90d97c526
> HCI Event: Number of Completed Packets (0x13) plen 5    #225 [hci1] 12.366039
        Num handles: 1
        Handle: 486 Address: DF:A9:FF:F6:B1:1A (OUI DF-A9-FF)
        Count: 1
        #224: len 21 (4 Kb/s)
        Latency: 39 msec (30-180 msec ~40 msec)
> ACL Data RX: Handle 486 flags 0x02 dlen 21              #226 [hci1] 12.416342
      SMP: Pairing DHKey Check (0x0d) len 16
        E: abe2f4addb7078e9486d35ff83c558ab
< HCI Command: LE Start Encryption (0x08|0x0019) plen 28  #227 [hci1] 12.425405
        Handle: 486 Address: DF:A9:FF:F6:B1:1A (OUI DF-A9-FF)
        Random number: 0x0000000000000000
        Encrypted diversifier: 0x0000
        Long term key: a9e5383f9a53c6d7348a8f06f0880d10
> HCI Event: Command Status (0x0f) plen 4                 #228 [hci1] 12.426408
      LE Start Encryption (0x08|0x0019) ncmd 1
        Status: Success (0x00)
< HCI Command: Host Number of Com.. (0x03|0x0035) plen 5  #229 [hci1] 12.445352
        Num handles: 1
        Handle: 486 Address: DF:A9:FF:F6:B1:1A (OUI DF-A9-FF)
        Count: 1
> HCI Event: Encryption Change (0x08) plen 4              #230 [hci1] 12.766030
        Status: Success (0x00)
        Handle: 486 Address: DF:A9:FF:F6:B1:1A (OUI DF-A9-FF)
        Encryption: Enabled with AES-CCM (0x01)
