Bluetooth monitor ver 5.72
btmon[2417693]: = Note: Linux version 6.14.0-36-generic (x86_64)                                                         0.693339
btmon[2417693]: = Note: Bluetooth subsystem version 2.22                                                                 0.693340
= New Index: 00:00:00:00:00:00 (Primary,UART,hci1)                                                                       0.693341
= New Index: 48:5F:99:8E:E0:64 (Primary,USB,hci0)                                                                        0.693342
= Open Index: 00:00:00:00:00:00                                                                                          1.206888
= Index Info: 00:00:00:00:00:00 (Nordic Semiconductor ASA)                                                               1.206902
zephyr.exe[2417695]: @ USER Open: main (privileged) version 2.22                                                {0x0001} 1.206912
zephyr.exe[2417695]: < HCI Command: Reset (0x03|0x0003) plen 0                                                        #1 1.208108
> HCI Event: Command Complete (0x0e) plen 4                                                                           #2 1.208647
      Reset (0x03|0x0003) ncmd 1
        Status: Success (0x00)
zephyr.exe[2417695]: < HCI Command: Read Local Supported Features (0x04|0x0003) plen 0                                #3 1.226347
> HCI Event: Command Complete (0x0e) plen 12                                                                          #4 1.226882
      Read Local Supported Features (0x04|0x0003) ncmd 1
        Status: Success (0x00)
        Features: 0x00 0x00 0x00 0x00 0x60 0x00 0x00 0x00
          BR/EDR Not Supported
          LE Supported (Controller)
zephyr.exe[2417695]: < HCI Command: Read Local Version Information (0x04|0x0001) plen 0                               #5 1.246384
> HCI Event: Command Complete (0x0e) plen 12                                                                          #6 1.246951
      Read Local Version Information (0x04|0x0001) ncmd 1
        Status: Success (0x00)
        HCI version: Reserved (0x0f) - Revision 12393 (0x3069)
        LMP version: Reserved (0x0f) - Subversion 12393 (0x3069)
        Manufacturer: Nordic Semiconductor ASA (89)
zephyr.exe[2417695]: < HCI Command: Read Local Supported Commands (0x04|0x0002) plen 0                                #7 1.266381
> HCI Event: Command Complete (0x0e) plen 68                                                                          #8 1.267463
      Read Local Supported Commands (0x04|0x0002) ncmd 1
        Status: Success (0x00)
        Commands: 119 entries
          Disconnect (Octet 0 - Bit 5)
          Read Remote Version Information (Octet 2 - Bit 7)
          Set Event Mask (Octet 5 - Bit 6)
          Reset (Octet 5 - Bit 7)
          Read Connection Accept Timeout (Octet 7 - Bit 2)
          Write Connection Accept Timeout (Octet 7 - Bit 3)
          Read Transmit Power Level (Octet 10 - Bit 2)
          Set Controller To Host Flow Control (Octet 10 - Bit 5)
          Host Buffer Size (Octet 10 - Bit 6)
          Host Number of Completed Packets (Octet 10 - Bit 7)
          Read Local Version Information (Octet 14 - Bit 3)
          Read Local Supported Features (Octet 14 - Bit 5)
          Read BD ADDR (Octet 15 - Bit 1)
          Read RSSI (Octet 15 - Bit 5)
          Set Event Mask Page 2 (Octet 22 - Bit 2)
          LE Set Event Mask (Octet 25 - Bit 0)
          LE Read Buffer Size (Octet 25 - Bit 1)
          LE Read Local Supported Features (Octet 25 - Bit 2)
          LE Set Random Address (Octet 25 - Bit 4)
          LE Set Advertising Parameters (Octet 25 - Bit 5)
          LE Read Advertising Channel TX Power (Octet 25 - Bit 6)
          LE Set Advertising Data (Octet 25 - Bit 7)
          LE Set Scan Response Data (Octet 26 - Bit 0)
          LE Set Advertise Enable (Octet 26 - Bit 1)
          LE Set Scan Parameters (Octet 26 - Bit 2)
          LE Set Scan Enable (Octet 26 - Bit 3)
          LE Create Connection (Octet 26 - Bit 4)
          LE Create Connection Cancel (Octet 26 - Bit 5)
          LE Read Accept List Size (Octet 26 - Bit 6)
          LE Clear Accept List (Octet 26 - Bit 7)
          LE Add Device To Accept List (Octet 27 - Bit 0)
          LE Remove Device From Accept List (Octet 27 - Bit 1)
          LE Connection Update (Octet 27 - Bit 2)
          LE Set Host Channel Classification (Octet 27 - Bit 3)
          LE Read Channel Map (Octet 27 - Bit 4)
          LE Read Remote Used Features (Octet 27 - Bit 5)
          LE Encrypt (Octet 27 - Bit 6)
          LE Rand (Octet 27 - Bit 7)
          LE Start Encryption (Octet 28 - Bit 0)
          LE Long Term Key Request Reply (Octet 28 - Bit 1)
          LE Long Term Key Request Neg Reply (Octet 28 - Bit 2)
          LE Read Supported States (Octet 28 - Bit 3)
          LE Receiver Test (Octet 28 - Bit 4)
          LE Transmitter Test (Octet 28 - Bit 5)
          LE Test End (Octet 28 - Bit 6)
          Read Authenticated Payload Timeout (Octet 32 - Bit 4)
          Write Authenticated Payload Timeout (Octet 32 - Bit 5)
          LE Set Data Length (Octet 33 - Bit 6)
          LE Read Suggested Default Data Length (Octet 33 - Bit 7)
          LE Write Suggested Default Data Length (Octet 34 - Bit 0)
          LE Add Device To Resolving List (Octet 34 - Bit 3)
          LE Remove Device From Resolving List (Octet 34 - Bit 4)
          LE Clear Resolving List (Octet 34 - Bit 5)
          LE Read Resolving List Size (Octet 34 - Bit 6)
          LE Set Address Resolution Enable (Octet 35 - Bit 1)
          LE Set Resolvable Private Address Timeout (Octet 35 - Bit 2)
          LE Read Maximum Data Length (Octet 35 - Bit 3)
          LE Read PHY (Octet 35 - Bit 4)
          LE Set Default PHY (Octet 35 - Bit 5)
          LE Set PHY (Octet 35 - Bit 6)
          LE Enhanced Receiver Test (Octet 35 - Bit 7)
          LE Enhanced Transmitter Test (Octet 36 - Bit 0)
          LE Set Advertising Set Random Address (Octet 36 - Bit 1)
          LE Set Extended Advertising Parameters (Octet 36 - Bit 2)
          LE Set Extended Advertising Data (Octet 36 - Bit 3)
          LE Set Extended Scan Response Data (Octet 36 - Bit 4)
          LE Set Extended Advertising Enable (Octet 36 - Bit 5)
          LE Read Maximum Advertising Data Length (Octet 36 - Bit 6)
          LE Read Number of Supported Advertising Sets (Octet 36 - Bit 7)
          LE Remove Advertising Set (Octet 37 - Bit 0)
          LE Clear Advertising Sets (Octet 37 - Bit 1)
          LE Set Periodic Advertising Parameters (Octet 37 - Bit 2)
          LE Set Periodic Advertising Data (Octet 37 - Bit 3)
          LE Set Periodic Advertising Enable (Octet 37 - Bit 4)
          LE Set Extended Scan Parameters (Octet 37 - Bit 5)
          LE Set Extended Scan Enable (Octet 37 - Bit 6)
          LE Extended Create Connection (Octet 37 - Bit 7)
          LE Periodic Advertising Create Sync (Octet 38 - Bit 0)
          LE Periodic Advertising Create Sync Cancel (Octet 38 - Bit 1)
          LE Periodic Advertising Terminate Sync (Octet 38 - Bit 2)
          LE Add Device To Periodic Advertiser List (Octet 38 - Bit 3)
          LE Remove Device From Periodic Advertiser List (Octet 38 - Bit 4)
          LE Clear Periodic Advertiser List (Octet 38 - Bit 5)
          LE Read Periodic Advertiser List Size (Octet 38 - Bit 6)
          LE Read Transmit Power (Octet 38 - Bit 7)
          LE Read RF Path Compensation (Octet 39 - Bit 0)
          LE Write RF Path Compensation (Octet 39 - Bit 1)
          LE Set Privacy Mode (Octet 39 - Bit 2)
          LE Periodic Advertising Receive Enable (Octet 40 - Bit 5)
          LE Periodic Advertising Sync Transfer (Octet 40 - Bit 6)
          LE Periodic Advertising Set Info Transfer (Octet 40 - Bit 7)
          LE Periodic Advertising Sync Transfer Parameters (Octet 41 - Bit 0)
          LE Set Default Periodic Advertisng Sync Transfer Parameters (Octet 41 - Bit 1)
          LE Read Buffer v2 (Octet 41 - Bit 5)
          LE Read ISO TX Sync (Octet 41 - Bit 6)
          LE Set Connected Isochronous Group Parameters (Octet 41 - Bit 7)
          LE Set Connected Isochronous Group Parameters Test (Octet 42 - Bit 0)
          LE Create Connected Isochronous Stream (Octet 42 - Bit 1)
          LE Remove Connected Isochronous Group (Octet 42 - Bit 2)
          LE Accept Connected Isochronous Stream Request (Octet 42 - Bit 3)
          LE Reject Connected Isochronous Stream Request (Octet 42 - Bit 4)
          LE Create Broadcast Isochronous Group (Octet 42 - Bit 5)
          LE Create Broadcast Isochronous Group Test (Octet 42 - Bit 6)
          LE Terminate Broadcast Isochronous Group (Octet 42 - Bit 7)
          LE Broadcast Isochronous Group Create Sync (Octet 43 - Bit 0)
          LE Broadcast Isochronous Group Terminate Sync (Octet 43 - Bit 1)
          LE Request Peer SCA (Octet 43 - Bit 2)
          LE Setup Isochronous Data Path (Octet 43 - Bit 3)
          LE Remove Isochronous Data Path (Octet 43 - Bit 4)
          LE Isochronous Transmit Test (Octet 43 - Bit 5)
          LE Isochronous Receive Test (Octet 43 - Bit 6)
          LE Isochronous Read Test Counters (Octet 43 - Bit 7)
          LE Isochronous Read Test Counters (Octet 44 - Bit 0)
          LE Set Host Feature (Octet 44 - Bit 1)
          Octet 44 - Bit 2 
          Octet 45 - Bit 6 
          Octet 46 - Bit 0 
          Octet 46 - Bit 1 
          Octet 46 - Bit 2 
zephyr.exe[2417695]: < HCI Command: Host Buffer Size (0x03|0x0033) plen 7                                             #9 1.286364
        ACL MTU: 255  ACL max packet: 16
        SCO MTU: 0    SCO max packet: 0
> HCI Event: Command Complete (0x0e) plen 4                                                                          #10 1.286889
      Host Buffer Size (0x03|0x0033) ncmd 1
        Status: Success (0x00)
zephyr.exe[2417695]: < HCI Command: Set Controller To Host Flow Control (0x03|0x0031) plen 1                         #11 1.306374
        Flow control: ACL Data Packets (0x01)
> HCI Event: Command Complete (0x0e) plen 4                                                                          #12 1.306828
      Set Controller To Host Flow Control (0x03|0x0031) ncmd 1
        Status: Success (0x00)
zephyr.exe[2417695]: < HCI Command: LE Read Local Supported Features (0x08|0x0003) plen 0                            #13 1.326385
> HCI Event: Command Complete (0x0e) plen 12                                                                         #14 1.326880
      LE Read Local Supported Features (0x08|0x0003) ncmd 1
        Status: Success (0x00)
        Features: 0xfd 0x79 0x00 0xf7 0x30 0x01 0x00 0x00
          LE Encryption
          Extended Reject Indication
          Peripheral-initiated Features Exchange
          LE Ping
          LE Data Packet Length Extension
          LL Privacy
          Extended Scanner Filter Policies
          LE 2M PHY
          LE Coded PHY
          LE Extended Advertising
          LE Periodic Advertising
          Channel Selection Algorithm #2
          Periodic Advertising Sync Transfer - Sender
          Periodic Advertising Sync Transfer - Recipient
          Sleep Clock Accuracy Updates
          Connected Isochronous Stream - Central
          Connected Isochronous Stream - Peripheral
          Isochronous Broadcaster
          Synchronized Receiver
          Periodic Advertising ADI support
          Connection Subrating
          Unknown features (0x0000010000000000)
zephyr.exe[2417695]: < HCI Command: LE Set Host Feature (0x08|0x0074) plen 2                                         #15 1.346397
        Bit Number: 32
          Connected Isochronous Stream (Host Support)
        Bit Value: 1
> HCI Event: Command Complete (0x0e) plen 4                                                                          #16 1.346785
      LE Set Host Feature (0x08|0x0074) ncmd 1
        Status: Success (0x00)
zephyr.exe[2417695]: < HCI Command: LE Read Buffer v2 (0x08|0x0060) plen 0                                           #17 1.366394
> HCI Event: Command Complete (0x0e) plen 10                                                                         #18 1.366907
      LE Read Buffer v2 (0x08|0x0060) ncmd 1
        Status: Success (0x00)
        ACL MTU: 27
        ACL max packet: 3
        ISO MTU: 318
        ISO max packet: 3
zephyr.exe[2417695]: < HCI Command: LE Read Maximum Advertising Data Length (0x08|0x003a) plen 0                     #19 1.386373
> HCI Event: Command Complete (0x0e) plen 6                                                                          #20 1.386850
      LE Read Maximum Advertising Data Length (0x08|0x003a) ncmd 1
        Status: Success (0x00)
        Max length: 1650
zephyr.exe[2417695]: < HCI Command: LE Read Supported States (0x08|0x001c) plen 0                                    #21 1.406382
> HCI Event: Command Complete (0x0e) plen 12                                                                         #22 1.406896
      LE Read Supported States (0x08|0x001c) ncmd 1
        Status: Success (0x00)
        States: 0x000003ff3e0306ff
          Non-connectable Advertising State
          Scannable Advertising State
          Connectable Advertising State
          High Duty Cycle Directed Advertising State
          Passive Scanning State
          Active Scanning State
          Initiating State
            and Connection State (Central Role)
          Connection State (Peripheral Role)
          Scannable Advertising State
            and Passive Scanning State
          Connectable Advertising State
            and Passive Scanning State
          Non-connectable Advertising State
            and Initiating State
          Scannable Advertising State
            and Initiating State
          Active Scanning State
            and Connection State (Central Role)
          Passive Scanning State
            and Connection State (Peripheral Role)
          Active Scanning State
            and Connection State (Peripheral Role)
          Initiating State
            and Connection State (Central Role)
            and Central Role & Central Role
          Low Duty Cycle Directed Advertising State
          Connectable Advertising State
            and Initiating State
            and Central Role & Peripheral Role
          High Duty Cycle Directed Advertising State
            and Initiating State
            and Central Role & Peripheral Role
          Low Duty Cycle Directed Advertising State
            and Initiating State
            and Central Role & Peripheral Role
          Connectable Advertising State
            and Connection State (Central Role)
            and Central Role & Peripheral Role
          High Duty Cycle Directed Advertising State
            and Connection State (Central Role)
            and Central Role & Peripheral Role
          Low Duty Cycle Directed Advertising State
            and Connection State (Central Role)
            and Central Role & Peripheral Role
          Connectable Advertising State
            and Connection State (Peripheral Role)
            and Central Role & Peripheral Role
          High Duty Cycle Directed Advertising State
            and Connection State (Peripheral Role)
            and Peripheral Role & Peripheral Role
          Low Duty Cycle Directed Advertising State
            and Connection State (Peripheral Role)
            and Peripheral Role & Peripheral Role
          Initiating State
            and Connection State (Peripheral Role)
            and Central Role & Peripheral Role
zephyr.exe[2417695]: < HCI Command: LE Read Maximum Data Length (0x08|0x002f) plen 0                                 #23 1.426379
> HCI Event: Command Complete (0x0e) plen 12                                                                         #24 1.426933
      LE Read Maximum Data Length (0x08|0x002f) ncmd 1
        Status: Success (0x00)
        Max TX octets: 251
        Max TX time: 2704
        Max RX octets: 251
        Max RX time: 2704
zephyr.exe[2417695]: < HCI Command: LE Write Suggested Default Data Length (0x08|0x0024) plen 4                      #25 1.446350
        TX octets: 251
        TX time: 2704
> HCI Event: Command Complete (0x0e) plen 4                                                                          #26 1.446960
      LE Write Suggested Default Data Length (0x08|0x0024) ncmd 1
        Status: Success (0x00)
zephyr.exe[2417695]: < HCI Command: LE Set Resolvable Private Address Timeout (0x08|0x002e) plen 2                   #27 1.466394
        Timeout: 30 seconds
> HCI Event: Command Complete (0x0e) plen 4                                                                          #28 1.466835
      LE Set Resolvable Private Address Timeout (0x08|0x002e) ncmd 1
        Status: Success (0x00)
zephyr.exe[2417695]: < HCI Command: LE Read Resolving List Size (0x08|0x002a) plen 0                                 #29 1.486382
> HCI Event: Command Complete (0x0e) plen 5                                                                          #30 1.486974
      LE Read Resolving List Size (0x08|0x002a) ncmd 1
        Status: Success (0x00)
        Size: 8
zephyr.exe[2417695]: < HCI Command: LE Set Event Mask (0x08|0x0001) plen 8                                           #31 1.506418
        Mask: 0x000002023f87fa5e
          LE Advertising Report
          LE Connection Update Complete
          LE Read Remote Used Features Complete
          LE Long Term Key Request
          LE Data Length Change
          LE Enhanced Connection Complete
          LE PHY Update Complete
          LE Extended Advertising Report
          LE Periodic Advertising Sync Established
          LE Periodic Advertising Report
          LE Periodic Advertising Sync Lost
          LE Extended Scan Timeout
          LE Extended Advertising Set Terminated
          LE Scan Request Received
          LE Periodic Advertising Sync Transfer Rvc
          LE CIS Established
          LE CIS Request
          LE Create BIG Complete
          LE Terminate BIG Complete
          LE BIG Sync Estabilished Complete
          LE BIG Sync Lost
          LE BIG Info Advertising Report
          Unknown mask (0x0000020000000000)
> HCI Event: Command Complete (0x0e) plen 4                                                                          #32 1.506921
      LE Set Event Mask (0x08|0x0001) ncmd 1
        Status: Success (0x00)
zephyr.exe[2417695]: < HCI Command: Set Event Mask (0x03|0x0001) plen 8                                              #33 1.526375
        Mask: 0x2000800002008890
          Disconnection Complete
          Encryption Change
          Read Remote Version Information Complete
          Hardware Error
          Data Buffer Overflow
          Encryption Key Refresh Complete
          LE Meta
> HCI Event: Command Complete (0x0e) plen 4                                                                          #34 1.526861
      Set Event Mask (0x03|0x0001) ncmd 1
        Status: Success (0x00)
zephyr.exe[2417695]: < HCI Command: Read BD ADDR (0x04|0x0009) plen 0                                                #35 1.546384
> HCI Event: Command Complete (0x0e) plen 10                                                                         #36 1.546839
      Read BD ADDR (0x04|0x0009) ncmd 1
        Status: Success (0x00)
        Address: 00:00:00:00:00:00 (OUI 00-00-00)
zephyr.exe[2417695]: < HCI Command: LE Set Random Address (0x08|0x0005) plen 6                                       #37 1.566387
        Address: D5:B6:CC:31:DB:3B (Static)
> HCI Event: Command Complete (0x0e) plen 4                                                                          #38 1.566870
      LE Set Random Address (0x08|0x0005) ncmd 1
        Status: Success (0x00)
zephyr.exe[2417695]: < HCI Command: LE Set Random Address (0x08|0x0005) plen 6                                       #39 1.666463
        Address: 48:61:8E:DB:C6:F9 (Resolvable)
> HCI Event: Command Complete (0x0e) plen 4                                                                          #40 1.667023
      LE Set Random Address (0x08|0x0005) ncmd 1
        Status: Success (0x00)
zephyr.exe[2417695]: < HCI Command: LE Extended Create Connection (0x08|0x0043) plen 26                              #41 4.116803
        Filter policy: Accept list is not used (0x00)
        Own address type: Random (0x03)
        Peer address type: Public (0x00)
        Peer address: DF:A9:FF:F6:B1:1A (OUI DF-A9-FF)
        Initiating PHYs: 0x01
        Entry 0: LE 1M
          Scan interval: 60.000 msec (0x0060)
          Scan window: 60.000 msec (0x0060)
          Min connection interval: 50.00 msec (0x0028)
          Max connection interval: 70.00 msec (0x0038)
          Connection latency: 0 (0x0000)
          Supervision timeout: 4000 msec (0x0190)
          Min connection length: 0.000 msec (0x0000)
          Max connection length: 0.000 msec (0x0000)
> HCI Event: Command Status (0x0f) plen 4                                                                            #42 4.117743
      LE Extended Create Connection (0x08|0x0043) ncmd 1
        Status: Success (0x00)
> HCI Event: LE Meta Event (0x3e) plen 31                                                                            #43 4.157577
      LE Enhanced Connection Complete (0x0a)
        Status: Success (0x00)
        Handle: 108
        Role: Central (0x00)
        Peer address type: Public (0x00)
        Peer address: DF:A9:FF:F6:B1:1A (OUI DF-A9-FF)
        Local resolvable private address: 48:61:8E:DB:C6:F9 (Resolvable)
        Peer resolvable private address: 00:00:00:00:00:00 (Non-Resolvable)
        Connection interval: 70.00 msec (0x0038)
        Connection latency: 0 (0x0000)
        Supervision timeout: 4000 msec (0x0190)
        Central clock accuracy: 0x00
zephyr.exe[2417695]: < HCI Command: LE Read Remote Used Features (0x08|0x0016) plen 2                                #44 4.166646
        Handle: 108 Address: DF:A9:FF:F6:B1:1A (OUI DF-A9-FF)
zephyr.exe[2417695]: < ACL Data TX: Handle 108 flags 0x00 dlen 7                                                     #45 4.166653
      ATT: Exchange MTU Request (0x02) len 2
        Client RX MTU: 251
> HCI Event: Command Status (0x0f) plen 4                                                                            #46 4.167209
      LE Read Remote Used Features (0x08|0x0016) ncmd 1
        Status: Success (0x00)
zephyr.exe[2417695]: < HCI Command: LE Set PHY (0x08|0x0032) plen 7                                                  #47 4.186431
        Handle: 108 Address: DF:A9:FF:F6:B1:1A (OUI DF-A9-FF)
        All PHYs preference: 0x00
        TX PHYs preference: 0x02
          LE 2M
        RX PHYs preference: 0x02
          LE 2M
        PHY options preference: Reserved (0x0000)
> HCI Event: Command Status (0x0f) plen 4                                                                            #48 4.187005
      LE Set PHY (0x08|0x0032) ncmd 1
        Status: Success (0x00)
> HCI Event: Number of Completed Packets (0x13) plen 5                                                               #49 4.229701
        Num handles: 1
        Handle: 108 Address: DF:A9:FF:F6:B1:1A (OUI DF-A9-FF)
        Count: 1
        #45: len 7 (0 Kb/s)
        Latency: 63 msec (63-63 msec ~63 msec)
> HCI Event: LE Meta Event (0x3e) plen 12                                                                            #50 4.369729
      LE Read Remote Used Features (0x04)
        Status: Success (0x00)
        Handle: 108 Address: DF:A9:FF:F6:B1:1A (OUI DF-A9-FF)
        Features: 0x2d 0x49 0x00 0xf7 0x67 0xd8 0x00 0x00
          LE Encryption
          Extended Reject Indication
          Peripheral-initiated Features Exchange
          LE Data Packet Length Extension
          LE 2M PHY
          LE Coded PHY
          Channel Selection Algorithm #2
          Periodic Advertising Sync Transfer - Sender
          Periodic Advertising Sync Transfer - Recipient
          Sleep Clock Accuracy Updates
          Connected Isochronous Stream - Central
          Connected Isochronous Stream - Peripheral
          Isochronous Broadcaster
          Synchronized Receiver
          Connected Isochronous Stream (Host Support)
          LE Power Control Request
          LE Power Control Request
          Connection Subrating
          Connection Subrating (Host Support)
          Unknown features (0x0000d80000000000)
> HCI Event: LE Meta Event (0x3e) plen 6                                                                             #51 5.069061
      LE PHY Update Complete (0x0c)
        Status: Success (0x00)
        Handle: 108 Address: DF:A9:FF:F6:B1:1A (OUI DF-A9-FF)
        TX PHY: LE 2M (0x02)
        RX PHY: LE 2M (0x02)
> ACL Data RX: Handle 108 flags 0x02 dlen 6                                                                          #52 5.209557
      SMP: Security Request (0x0b) len 1
        Authentication requirement: Bonding, No MITM, SC, No Keypresses (0x09)
> ACL Data RX: Handle 108 flags 0x02 dlen 7                                                                          #53 5.209961
      ATT: Exchange MTU Response (0x03) len 2
        Server RX MTU: 23
zephyr.exe[2417695]: < HCI Command: Host Number of Completed Packets (0x03|0x0035) plen 5                            #54 5.226500
        Num handles: 1
        Handle: 108 Address: DF:A9:FF:F6:B1:1A (OUI DF-A9-FF)
        Count: 1
zephyr.exe[2417695]: < ACL Data TX: Handle 108 flags 0x00 dlen 11                                                    #55 5.226648
      SMP: Pairing Request (0x01) len 6
        IO capability: NoInputNoOutput (0x03)
        OOB data: Authentication data not present (0x00)
        Authentication requirement: Bonding, No MITM, SC, No Keypresses (0x09)
        Max encryption key size: 16
        Initiator key distribution: EncKey IdKey (0x03)
        Responder key distribution: EncKey IdKey (0x03)
zephyr.exe[2417695]: < HCI Command: Host Number of Completed Packets (0x03|0x0035) plen 5                            #56 5.226713
        Num handles: 1
        Handle: 108 Address: DF:A9:FF:F6:B1:1A (OUI DF-A9-FF)
        Count: 1
> HCI Event: Number of Completed Packets (0x13) plen 5                                                               #57 5.279520
        Num handles: 1
        Handle: 108 Address: DF:A9:FF:F6:B1:1A (OUI DF-A9-FF)
        Count: 1
        #55: len 11 (1 Kb/s)
        Latency: 52 msec (52-63 msec ~57 msec)
> ACL Data RX: Handle 108 flags 0x02 dlen 11                                                                         #58 5.349606
      SMP: Pairing Response (0x02) len 6
        IO capability: KeyboardDisplay (0x04)
        OOB data: Authentication data not present (0x00)
        Authentication requirement: Bonding, No MITM, SC, No Keypresses (0x09)
        Max encryption key size: 16
        Initiator key distribution: EncKey IdKey (0x03)
        Responder key distribution: EncKey IdKey (0x03)
zephyr.exe[2417695]: < HCI Command: Host Number of Completed Packets (0x03|0x0035) plen 5                            #59 5.366474
        Num handles: 1
        Handle: 108 Address: DF:A9:FF:F6:B1:1A (OUI DF-A9-FF)
        Count: 1
zephyr.exe[2417695]: < ACL Data TX: Handle 108 flags 0x00 dlen 27                                                    #60 5.366571
zephyr.exe[2417695]: < ACL Data TX: Handle 108 flags 0x01 dlen 27                                                    #61 5.366575
zephyr.exe[2417695]: < ACL Data TX: Handle 108 flags 0x01 dlen 15                                                    #62 5.366576
      SMP: Pairing Public Key (0x0c) len 64
        X: 68f6ada634ce84d11617383d57f070fe3445c38b33b569efa5eb771a0dc8aea5
        Y: 83c407aaa8337331fdc418e55085d75e6c1c6e5d42f8bf9c18fb5a2a7d4f31aa
> HCI Event: Number of Completed Packets (0x13) plen 5                                                               #63 5.419516
        Num handles: 1
        Handle: 108 Address: DF:A9:FF:F6:B1:1A (OUI DF-A9-FF)
        Count: 1
        #60: len 27 (4 Kb/s)
        Latency: 52 msec (52-63 msec ~55 msec)
> HCI Event: Number of Completed Packets (0x13) plen 5                                                               #64 5.420029
        Num handles: 1
        Handle: 108 Address: DF:A9:FF:F6:B1:1A (OUI DF-A9-FF)
        Count: 1
        #61: len 27 (4 Kb/s)
        Latency: 53 msec (52-63 msec ~54 msec)
> HCI Event: Number of Completed Packets (0x13) plen 5                                                               #65 5.420506
        Num handles: 1
        Handle: 108 Address: DF:A9:FF:F6:B1:1A (OUI DF-A9-FF)
        Count: 1
        #62: len 15 (2 Kb/s)
        Latency: 53 msec (52-63 msec ~54 msec)
> ACL Data RX: Handle 108 flags 0x02 dlen 27                                                                         #66 5.489800
> ACL Data RX: Handle 108 flags 0x01 dlen 27                                                                         #67 5.490246
> ACL Data RX: Handle 108 flags 0x01 dlen 15                                                                         #68 5.490544
      SMP: Pairing Public Key (0x0c) len 64
        X: a751e52119886a44b663d8afdea7faef3b1da378984b860f6d16c028bd234eb6
        Y: 3621dc8d1afa9c9323957178cbee98af29d3cda2973e38670cc1edd9180a1aac
> ACL Data RX: Handle 108 flags 0x02 dlen 21                                                                         #69 5.491173
      SMP: Pairing Confirm (0x03) len 16
        Confim value: 2cd8f87c6b88e8fb6bedc266930c9d22
zephyr.exe[2417695]: < HCI Command: Host Number of Completed Packets (0x03|0x0035) plen 5                            #70 5.506558
        Num handles: 1
        Handle: 108 Address: DF:A9:FF:F6:B1:1A (OUI DF-A9-FF)
        Count: 1
zephyr.exe[2417695]: < HCI Command: Host Number of Completed Packets (0x03|0x0035) plen 5                            #71 5.506566
        Num handles: 1
        Handle: 108 Address: DF:A9:FF:F6:B1:1A (OUI DF-A9-FF)
        Count: 1
zephyr.exe[2417695]: < HCI Command: Host Number of Completed Packets (0x03|0x0035) plen 5                            #72 5.506640
        Num handles: 1
        Handle: 108 Address: DF:A9:FF:F6:B1:1A (OUI DF-A9-FF)
        Count: 1
zephyr.exe[2417695]: < HCI Command: Host Number of Completed Packets (0x03|0x0035) plen 5                            #73 5.506770
        Num handles: 1
        Handle: 108 Address: DF:A9:FF:F6:B1:1A (OUI DF-A9-FF)
        Count: 1
zephyr.exe[2417695]: < ACL Data TX: Handle 108 flags 0x00 dlen 21                                                    #74 5.506864
      SMP: Pairing Random (0x04) len 16
        Random value: 555cc64d02679f89a05211af56d8b3da
> HCI Event: Number of Completed Packets (0x13) plen 5                                                               #75 5.559567
        Num handles: 1
        Handle: 108 Address: DF:A9:FF:F6:B1:1A (OUI DF-A9-FF)
        Count: 1
        #74: len 21 (3 Kb/s)
        Latency: 52 msec (52-63 msec ~53 msec)
> ACL Data RX: Handle 108 flags 0x02 dlen 21                                                                         #76 5.629967
      SMP: Pairing Random (0x04) len 16
        Random value: 6c9639e9a874c8a20000000000000000
zephyr.exe[2417695]: < HCI Command: Host Number of Completed Packets (0x03|0x0035) plen 5                            #77 5.646528
        Num handles: 1
        Handle: 108 Address: DF:A9:FF:F6:B1:1A (OUI DF-A9-FF)
        Count: 1
zephyr.exe[2417695]: < ACL Data TX: Handle 108 flags 0x00 dlen 21                                                    #78 5.646629
      SMP: Pairing DHKey Check (0x0d) len 16
        E: 0b6fbffd938214c0a498215f80d9d081
> HCI Event: Number of Completed Packets (0x13) plen 5                                                               #79 5.699596
        Num handles: 1
        Handle: 108 Address: DF:A9:FF:F6:B1:1A (OUI DF-A9-FF)
        Count: 1
        #78: len 21 (3 Kb/s)
        Latency: 52 msec (52-63 msec ~53 msec)
> ACL Data RX: Handle 108 flags 0x02 dlen 21                                                                         #80 5.909741
      SMP: Pairing DHKey Check (0x0d) len 16
        E: 8277b2d36a6f9a5dfddf7cfe46f5e812
zephyr.exe[2417695]: < HCI Command: LE Start Encryption (0x08|0x0019) plen 28                                        #81 5.926550
        Handle: 108 Address: DF:A9:FF:F6:B1:1A (OUI DF-A9-FF)
        Random number: 0x0000000000000000
        Encrypted diversifier: 0x0000
        Long term key: c6143c79e4857d9efb19f6a8203b3a8f
> HCI Event: Command Status (0x0f) plen 4                                                                            #82 5.927435
      LE Start Encryption (0x08|0x0019) ncmd 1
        Status: Success (0x00)
zephyr.exe[2417695]: < HCI Command: Host Number of Completed Packets (0x03|0x0035) plen 5                            #83 5.946376
        Num handles: 1
        Handle: 108 Address: DF:A9:FF:F6:B1:1A (OUI DF-A9-FF)
        Count: 1
> HCI Event: Encryption Change (0x08) plen 4                                                                         #84 6.399439
        Status: Success (0x00)
        Handle: 108 Address: DF:A9:FF:F6:B1:1A (OUI DF-A9-FF)
        Encryption: Enabled with AES-CCM (0x01)
> ACL Data RX: Handle 108 flags 0x02 dlen 21                                                                         #85 6.469773
      SMP: Identity Information (0x08) len 16
        Identity resolving key: dfd88272c49d1745dce5ceb40f0a6713
zephyr.exe[2417695]: < HCI Command: Host Number of Completed Packets (0x03|0x0035) plen 5                            #86 6.486509
        Num handles: 1
        Handle: 108 Address: DF:A9:FF:F6:B1:1A (OUI DF-A9-FF)
        Count: 1
> ACL Data RX: Handle 108 flags 0x02 dlen 12                                                                         #87 6.539685
      SMP: Identity Address Information (0x09) len 7
        Address: DF:A9:FF:F6:B1:1A (OUI DF-A9-FF)
zephyr.exe[2417695]: < HCI Command: LE Add Device To Resolving List (0x08|0x0027) plen 39                            #88 6.546567
        Address type: Public (0x00)
        Address: DF:A9:FF:F6:B1:1A (OUI DF-A9-FF)
        Peer identity resolving key: dfd88272c49d1745dce5ceb40f0a6713
        Local identity resolving key: 08aad2e1be87e47b88aeb19de6889efb
> HCI Event: Command Complete (0x0e) plen 4                                                                          #89 6.547505
      LE Add Device To Resolving List (0x08|0x0027) ncmd 1
        Status: Success (0x00)
zephyr.exe[2417695]: < HCI Command: LE Set Privacy Mode (0x08|0x004e) plen 8                                         #90 6.566469
        Peer Identity address type: Public (0x00)
        Peer Identity address: DF:A9:FF:F6:B1:1A (OUI DF-A9-FF)
        Privacy Mode: Use Device Privacy (0x01)
> HCI Event: Command Complete (0x0e) plen 4                                                                          #91 6.567021
      LE Set Privacy Mode (0x08|0x004e) ncmd 1
        Status: Success (0x00)
zephyr.exe[2417695]: < HCI Command: LE Set Address Resolution Enable (0x08|0x002d) plen 1                            #92 6.586439
        Address resolution: Enabled (0x01)
> HCI Event: Command Complete (0x0e) plen 4                                                                          #93 6.586874
      LE Set Address Resolution Enable (0x08|0x002d) ncmd 1
        Status: Success (0x00)
zephyr.exe[2417695]: < ACL Data TX: Handle 108 flags 0x00 dlen 13                                                    #94 6.596478
      ATT: Find By Type Value Request (0x06) len 8
        Handle range: 0x0001-0xffff
        Attribute type: Primary Service (0x2800)
          UUID: Coordinated Set Identification (0x1846)
zephyr.exe[2417695]: < HCI Command: Host Number of Completed Packets (0x03|0x0035) plen 5                            #95 6.606418
        Num handles: 1
        Handle: 108 Address: DF:A9:FF:F6:B1:1A (OUI DF-A9-FF)
        Count: 1
zephyr.exe[2417695]: < ACL Data TX: Handle 108 flags 0x00 dlen 21                                                    #96 6.606450
      SMP: Identity Information (0x08) len 16
        Identity resolving key: 08aad2e1be87e47b88aeb19de6889efb
zephyr.exe[2417695]: < ACL Data TX: Handle 108 flags 0x00 dlen 12                                                    #97 6.606459
      SMP: Identity Address Information (0x09) len 7
        Address: D5:B6:CC:31:DB:3B (Static)
> HCI Event: Number of Completed Packets (0x13) plen 5                                                               #98 6.609611
        Num handles: 1
        Handle: 108 Address: DF:A9:FF:F6:B1:1A (OUI DF-A9-FF)
        Count: 1
        #94: len 13 (8 Kb/s)
        Latency: 13 msec (13-63 msec ~33 msec)
> HCI Event: Number of Completed Packets (0x13) plen 5                                                               #99 6.609978
        Num handles: 1
        Handle: 108 Address: DF:A9:FF:F6:B1:1A (OUI DF-A9-FF)
        Count: 1
        #96: len 21 (56 Kb/s)
        Latency: 3 msec (3-63 msec ~18 msec)
> HCI Event: Number of Completed Packets (0x13) plen 5                                                              #100 6.610514
        Num handles: 1
        Handle: 108 Address: DF:A9:FF:F6:B1:1A (OUI DF-A9-FF)
        Count: 1
        #97: len 12 (24 Kb/s)
        Latency: 4 msec (3-63 msec ~11 msec)
> ACL Data RX: Handle 108 flags 0x02 dlen 9                                                                         #101 6.679723
      ATT: Find By Type Value Response (0x07) len 4
        Handle range: 0x0160-0x016e
zephyr.exe[2417695]: < HCI Command: Host Number of Completed Packets (0x03|0x0035) plen 5                           #102 6.686672
        Num handles: 1
        Handle: 108 Address: DF:A9:FF:F6:B1:1A (OUI DF-A9-FF)
        Count: 1
zephyr.exe[2417695]: < ACL Data TX: Handle 108 flags 0x00 dlen 11                                                   #103 6.686753
      ATT: Read By Type Request (0x08) len 6
        Handle range: 0x0001-0xffff
        Attribute type: Central Address Resolution (0x2aa6)
> HCI Event: Number of Completed Packets (0x13) plen 5                                                              #104 6.749474
        Num handles: 1
        Handle: 108 Address: DF:A9:FF:F6:B1:1A (OUI DF-A9-FF)
        Count: 1
        #103: len 11 (1 Kb/s)
        Latency: 62 msec (3-63 msec ~36 msec)
> ACL Data RX: Handle 108 flags 0x02 dlen 9                                                                         #105 6.819625
      ATT: Read By Type Response (0x09) len 4
        Attribute data length: 3
        Attribute data list: 1 entry
        Handle: 0x000f
        Value: 01
zephyr.exe[2417695]: < HCI Command: Host Number of Completed Packets (0x03|0x0035) plen 5                           #106 6.826900
        Num handles: 1
        Handle: 108 Address: DF:A9:FF:F6:B1:1A (OUI DF-A9-FF)
        Count: 1
zephyr.exe[2417695]: < ACL Data TX: Handle 108 flags 0x00 dlen 13                                                   #107 6.827091
      ATT: Find By Type Value Request (0x06) len 8
        Handle range: 0x016f-0xffff
        Attribute type: Primary Service (0x2800)
          UUID: Coordinated Set Identification (0x1846)
> HCI Event: Number of Completed Packets (0x13) plen 5                                                              #108 6.889604
        Num handles: 1
        Handle: 108 Address: DF:A9:FF:F6:B1:1A (OUI DF-A9-FF)
        Count: 1
        #107: len 13 (1 Kb/s)
        Latency: 62 msec (3-63 msec ~49 msec)
> ACL Data RX: Handle 108 flags 0x02 dlen 9                                                                         #109 6.959609
      ATT: Error Response (0x01) len 4
        Find By Type Value Request (0x06)
        Handle: 0x016f
        Error: Attribute Not Found (0x0a)
zephyr.exe[2417695]: < HCI Command: Host Number of Completed Packets (0x03|0x0035) plen 5                           #110 6.966871
        Num handles: 1
        Handle: 108 Address: DF:A9:FF:F6:B1:1A (OUI DF-A9-FF)
        Count: 1
zephyr.exe[2417695]: < ACL Data TX: Handle 108 flags 0x00 dlen 11                                                   #111 6.967059
      ATT: Read By Type Request (0x08) len 6
        Handle range: 0x0160-0x016e
        Attribute type: Characteristic (0x2803)
> HCI Event: Number of Completed Packets (0x13) plen 5                                                              #112 7.029484
        Num handles: 1
        Handle: 108 Address: DF:A9:FF:F6:B1:1A (OUI DF-A9-FF)
        Count: 1
        #111: len 11 (1 Kb/s)
        Latency: 62 msec (3-63 msec ~56 msec)
> ACL Data RX: Handle 108 flags 0x02 dlen 27                                                                        #113 7.099914
      ATT: Read By Type Response (0x09) len 22
        Attribute data length: 7
        Attribute data list: 3 entries
        Handle: 0x0161
        Value: 126201842b
            Properties: 0x12
              Read (0x02)
              Notify (0x10)
            Value Handle: 0x0162
            Value UUID: Set Identity Resolving Key (0x2b84)
        Handle: 0x0164
        Value: 1a6501862b
            Properties: 0x1a
              Read (0x02)
              Write (0x08)
              Notify (0x10)
            Value Handle: 0x0165
            Value UUID: Set Member Lock (0x2b86)
        Handle: 0x0167
        Value: 126801852b
            Properties: 0x12
              Read (0x02)
              Notify (0x10)
            Value Handle: 0x0168
            Value UUID: Coordinated Set Size (0x2b85)
zephyr.exe[2417695]: < HCI Command: Host Number of Completed Packets (0x03|0x0035) plen 5                           #114 7.106762
        Num handles: 1
        Handle: 108 Address: DF:A9:FF:F6:B1:1A (OUI DF-A9-FF)
        Count: 1
zephyr.exe[2417695]: < ACL Data TX: Handle 108 flags 0x00 dlen 9                                                    #115 7.107133
      ATT: Find Information Request (0x04) len 4
        Handle range: 0x0162-0x016e
> HCI Event: Number of Completed Packets (0x13) plen 5                                                              #116 7.169552
        Num handles: 1
        Handle: 108 Address: DF:A9:FF:F6:B1:1A (OUI DF-A9-FF)
        Count: 1
        #115: len 9 (1 Kb/s)
        Latency: 62 msec (3-63 msec ~59 msec)
> ACL Data RX: Handle 108 flags 0x02 dlen 26                                                                        #117 7.239864
      ATT: Find Information Response (0x05) len 21
        Format: UUID-16 (0x01)
        Handle: 0x0162
        UUID: Set Identity Resolving Key (0x2b84)
        Handle: 0x0163
        UUID: Client Characteristic Configuration (0x2902)
        Handle: 0x0164
        UUID: Characteristic (0x2803)
        Handle: 0x0165
        UUID: Set Member Lock (0x2b86)
        Handle: 0x0166
        UUID: Client Characteristic Configuration (0x2902)
zephyr.exe[2417695]: < HCI Command: Host Number of Completed Packets (0x03|0x0035) plen 5                           #118 7.246917
        Num handles: 1
        Handle: 108 Address: DF:A9:FF:F6:B1:1A (OUI DF-A9-FF)
        Count: 1
zephyr.exe[2417695]: < ACL Data TX: Handle 108 flags 0x00 dlen 9                                                    #119 7.247139
      ATT: Find Information Request (0x04) len 4
        Handle range: 0x0165-0x016e
> HCI Event: Number of Completed Packets (0x13) plen 5                                                              #120 7.309504
        Num handles: 1
        Handle: 108 Address: DF:A9:FF:F6:B1:1A (OUI DF-A9-FF)
        Count: 1
        #119: len 9 (1 Kb/s)
        Latency: 62 msec (3-63 msec ~60 msec)
> ACL Data RX: Handle 108 flags 0x02 dlen 26                                                                        #121 7.379820
      ATT: Find Information Response (0x05) len 21
        Format: UUID-16 (0x01)
        Handle: 0x0165
        UUID: Set Member Lock (0x2b86)
        Handle: 0x0166
        UUID: Client Characteristic Configuration (0x2902)
        Handle: 0x0167
        UUID: Characteristic (0x2803)
        Handle: 0x0168
        UUID: Coordinated Set Size (0x2b85)
        Handle: 0x0169
        UUID: Client Characteristic Configuration (0x2902)
zephyr.exe[2417695]: < HCI Command: Host Number of Completed Packets (0x03|0x0035) plen 5                           #122 7.386885
        Num handles: 1
        Handle: 108 Address: DF:A9:FF:F6:B1:1A (OUI DF-A9-FF)
        Count: 1
zephyr.exe[2417695]: < ACL Data TX: Handle 108 flags 0x00 dlen 9                                                    #123 7.387088
      ATT: Find Information Request (0x04) len 4
        Handle range: 0x0168-0x016e
> HCI Event: Number of Completed Packets (0x13) plen 5                                                              #124 7.449500
        Num handles: 1
        Handle: 108 Address: DF:A9:FF:F6:B1:1A (OUI DF-A9-FF)
        Count: 1
        #123: len 9 (1 Kb/s)
        Latency: 62 msec (3-63 msec ~61 msec)
> ACL Data RX: Handle 108 flags 0x02 dlen 26                                                                        #125 7.519838
      ATT: Find Information Response (0x05) len 21
        Format: UUID-16 (0x01)
        Handle: 0x0168
        UUID: Coordinated Set Size (0x2b85)
        Handle: 0x0169
        UUID: Client Characteristic Configuration (0x2902)
        Handle: 0x016a
        UUID: Characteristic (0x2803)
        Handle: 0x016b
        UUID: Set Member Rank (0x2b87)
        Handle: 0x016c
        UUID: Characteristic (0x2803)
zephyr.exe[2417695]: < HCI Command: Host Number of Completed Packets (0x03|0x0035) plen 5                           #126 7.526904
        Num handles: 1
        Handle: 108 Address: DF:A9:FF:F6:B1:1A (OUI DF-A9-FF)
        Count: 1
zephyr.exe[2417695]: < ACL Data TX: Handle 108 flags 0x00 dlen 11                                                   #127 7.527105
      ATT: Read By Type Request (0x08) len 6
        Handle range: 0x0168-0x016e
        Attribute type: Characteristic (0x2803)
> HCI Event: Number of Completed Packets (0x13) plen 5                                                              #128 7.589547
        Num handles: 1
        Handle: 108 Address: DF:A9:FF:F6:B1:1A (OUI DF-A9-FF)
        Count: 1
        #127: len 11 (1 Kb/s)
        Latency: 62 msec (3-63 msec ~62 msec)
> ACL Data RX: Handle 108 flags 0x02 dlen 20                                                                        #129 7.659718
      ATT: Read By Type Response (0x09) len 15
        Attribute data length: 7
        Attribute data list: 2 entries
        Handle: 0x016a
        Value: 026b01872b
            Properties: 0x02
              Read (0x02)
            Value Handle: 0x016b
            Value UUID: Set Member Rank (0x2b87)
        Handle: 0x016c
        Value: 1a6d011a2c
            Properties: 0x1a
              Read (0x02)
              Write (0x08)
              Notify (0x10)
            Value Handle: 0x016d
            Value UUID: Unknown (0x2c1a)
zephyr.exe[2417695]: < HCI Command: Host Number of Completed Packets (0x03|0x0035) plen 5                           #130 7.666934
        Num handles: 1
        Handle: 108 Address: DF:A9:FF:F6:B1:1A (OUI DF-A9-FF)
        Count: 1
zephyr.exe[2417695]: < ACL Data TX: Handle 108 flags 0x00 dlen 9                                                    #131 7.667134
      ATT: Write Request (0x12) len 4
        Handle: 0x0163
          Data: 0100
> HCI Event: Number of Completed Packets (0x13) plen 5                                                              #132 7.729507
        Num handles: 1
        Handle: 108 Address: DF:A9:FF:F6:B1:1A (OUI DF-A9-FF)
        Count: 1
        #131: len 9 (1 Kb/s)
        Latency: 62 msec (3-63 msec ~62 msec)
> ACL Data RX: Handle 108 flags 0x02 dlen 5                                                                         #133 7.799552
      ATT: Write Response (0x13) len 0
zephyr.exe[2417695]: < HCI Command: Host Number of Completed Packets (0x03|0x0035) plen 5                           #134 7.806864
        Num handles: 1
        Handle: 108 Address: DF:A9:FF:F6:B1:1A (OUI DF-A9-FF)
        Count: 1
zephyr.exe[2417695]: < ACL Data TX: Handle 108 flags 0x00 dlen 9                                                    #135 7.807095
      ATT: Write Request (0x12) len 4
        Handle: 0x0166
          Data: 0100
> HCI Event: Number of Completed Packets (0x13) plen 5                                                              #136 7.869481
        Num handles: 1
        Handle: 108 Address: DF:A9:FF:F6:B1:1A (OUI DF-A9-FF)
        Count: 1
        #135: len 9 (1 Kb/s)
        Latency: 62 msec (3-63 msec ~62 msec)
> ACL Data RX: Handle 108 flags 0x02 dlen 5                                                                         #137 7.939622
      ATT: Write Response (0x13) len 0
zephyr.exe[2417695]: < HCI Command: Host Number of Completed Packets (0x03|0x0035) plen 5                           #138 7.946803
        Num handles: 1
        Handle: 108 Address: DF:A9:FF:F6:B1:1A (OUI DF-A9-FF)
        Count: 1
zephyr.exe[2417695]: < ACL Data TX: Handle 108 flags 0x00 dlen 9                                                    #139 7.947029
      ATT: Write Request (0x12) len 4
        Handle: 0x0169
          Data: 0100
> HCI Event: Number of Completed Packets (0x13) plen 5                                                              #140 8.009684
        Num handles: 1
        Handle: 108 Address: DF:A9:FF:F6:B1:1A (OUI DF-A9-FF)
        Count: 1
        #139: len 9 (1 Kb/s)
        Latency: 62 msec (3-63 msec ~62 msec)
> ACL Data RX: Handle 108 flags 0x02 dlen 5                                                                         #141 8.079506
      ATT: Write Response (0x13) len 0
zephyr.exe[2417695]: < HCI Command: Host Number of Completed Packets (0x03|0x0035) plen 5                           #142 8.086888
        Num handles: 1
        Handle: 108 Address: DF:A9:FF:F6:B1:1A (OUI DF-A9-FF)
        Count: 1
zephyr.exe[2417695]: < ACL Data TX: Handle 108 flags 0x00 dlen 11                                                   #143 8.087092
      ATT: Read By Type Request (0x08) len 6
        Handle range: 0x016d-0x016e
        Attribute type: Characteristic (0x2803)
> HCI Event: Number of Completed Packets (0x13) plen 5                                                              #144 8.149556
        Num handles: 1
        Handle: 108 Address: DF:A9:FF:F6:B1:1A (OUI DF-A9-FF)
        Count: 1
        #143: len 11 (1 Kb/s)
        Latency: 62 msec (3-63 msec ~62 msec)
> ACL Data RX: Handle 108 flags 0x02 dlen 9                                                                         #145 8.219629
      ATT: Error Response (0x01) len 4
        Read By Type Request (0x08)
        Handle: 0x016d
        Error: Attribute Not Found (0x0a)
zephyr.exe[2417695]: < HCI Command: Host Number of Completed Packets (0x03|0x0035) plen 5                           #146 8.227042
        Num handles: 1
        Handle: 108 Address: DF:A9:FF:F6:B1:1A (OUI DF-A9-FF)
        Count: 1
zephyr.exe[2417695]: < ACL Data TX: Handle 108 flags 0x00 dlen 7                                                    #147 8.227251
      ATT: Read Request (0x0a) len 2
        Handle: 0x0162
> HCI Event: Number of Completed Packets (0x13) plen 5                                                              #148 8.289479
        Num handles: 1
        Handle: 108 Address: DF:A9:FF:F6:B1:1A (OUI DF-A9-FF)
        Count: 1
        #147: len 7 (0 Kb/s)
        Latency: 62 msec (3-63 msec ~62 msec)
> ACL Data RX: Handle 108 flags 0x02 dlen 22                                                                        #149 8.359708
      ATT: Read Response (0x0b) len 17
zephyr.exe[2417695]: < HCI Command: Host Number of Completed Packets (0x03|0x0035) plen 5                           #150 8.366828
        Num handles: 1
        Handle: 108 Address: DF:A9:FF:F6:B1:1A (OUI DF-A9-FF)
        Count: 1
zephyr.exe[2417695]: < ACL Data TX: Handle 108 flags 0x00 dlen 7                                                    #151 8.367057
      ATT: Read Request (0x0a) len 2
        Handle: 0x0168
> HCI Event: Number of Completed Packets (0x13) plen 5                                                              #152 8.429489
        Num handles: 1
        Handle: 108 Address: DF:A9:FF:F6:B1:1A (OUI DF-A9-FF)
        Count: 1
        #151: len 7 (0 Kb/s)
        Latency: 62 msec (3-63 msec ~62 msec)
> ACL Data RX: Handle 108 flags 0x02 dlen 6                                                                         #153 8.499632
      ATT: Read Response (0x0b) len 1
zephyr.exe[2417695]: < HCI Command: Host Number of Completed Packets (0x03|0x0035) plen 5                           #154 8.506940
        Num handles: 1
        Handle: 108 Address: DF:A9:FF:F6:B1:1A (OUI DF-A9-FF)
        Count: 1
zephyr.exe[2417695]: < ACL Data TX: Handle 108 flags 0x00 dlen 7                                                    #155 8.507100
      ATT: Read Request (0x0a) len 2
        Handle: 0x016b
> HCI Event: Number of Completed Packets (0x13) plen 5                                                              #156 8.569495
        Num handles: 1
        Handle: 108 Address: DF:A9:FF:F6:B1:1A (OUI DF-A9-FF)
        Count: 1
        #155: len 7 (0 Kb/s)
        Latency: 62 msec (3-63 msec ~62 msec)
> ACL Data RX: Handle 108 flags 0x02 dlen 6                                                                         #157 8.639565
      ATT: Read Response (0x0b) len 1
zephyr.exe[2417695]: < HCI Command: Host Number of Completed Packets (0x03|0x0035) plen 5                           #158 8.647643
        Num handles: 1
        Handle: 108 Address: DF:A9:FF:F6:B1:1A (OUI DF-A9-FF)
        Count: 1
zephyr.exe[2417695]: < ACL Data TX: Handle 108 flags 0x00 dlen 8                                                   #159 10.136998
      ATT: Write Request (0x12) len 3
        Handle: 0x0165
          Data: 01
> HCI Event: Number of Completed Packets (0x13) plen 5                                                             #160 10.179541
        Num handles: 1
        Handle: 108 Address: DF:A9:FF:F6:B1:1A (OUI DF-A9-FF)
        Count: 1
        #159: len 8 (1 Kb/s)
        Latency: 42 msec (3-63 msec ~52 msec)
> ACL Data RX: Handle 108 flags 0x02 dlen 9                                                                        #161 10.249563
      ATT: Error Response (0x01) len 4
        Write Request (0x12)
        Handle: 0x0165
        Error: Reserved (0x82)
zephyr.exe[2417695]: < HCI Command: Host Number of Completed Packets (0x03|0x0035) plen 5                          #162 10.267099
        Num handles: 1
        Handle: 108 Address: DF:A9:FF:F6:B1:1A (OUI DF-A9-FF)
        Count: 1
zephyr.exe[2417695]: < ACL Data TX: Handle 108 flags 0x00 dlen 13                                                  #163 11.667109
      ATT: Find By Type Value Request (0x06) len 8
        Handle range: 0x0001-0xffff
        Attribute type: Primary Service (0x2800)
          UUID: Coordinated Set Identification (0x1846)
> HCI Event: Number of Completed Packets (0x13) plen 5                                                             #164 11.719458
        Num handles: 1
        Handle: 108 Address: DF:A9:FF:F6:B1:1A (OUI DF-A9-FF)
        Count: 1
        #163: len 13 (2 Kb/s)
        Latency: 52 msec (3-63 msec ~52 msec)
> ACL Data RX: Handle 108 flags 0x02 dlen 9                                                                        #165 11.789533
      ATT: Find By Type Value Response (0x07) len 4
        Handle range: 0x0160-0x016e
zephyr.exe[2417695]: < HCI Command: Host Number of Completed Packets (0x03|0x0035) plen 5                          #166 11.806956
        Num handles: 1
        Handle: 108 Address: DF:A9:FF:F6:B1:1A (OUI DF-A9-FF)
        Count: 1
zephyr.exe[2417695]: < ACL Data TX: Handle 108 flags 0x00 dlen 13                                                  #167 11.807162
      ATT: Find By Type Value Request (0x06) len 8
        Handle range: 0x016f-0xffff
        Attribute type: Primary Service (0x2800)
          UUID: Coordinated Set Identification (0x1846)
> HCI Event: Number of Completed Packets (0x13) plen 5                                                             #168 11.859524
        Num handles: 1
        Handle: 108 Address: DF:A9:FF:F6:B1:1A (OUI DF-A9-FF)
        Count: 1
        #167: len 13 (2 Kb/s)
        Latency: 52 msec (3-63 msec ~52 msec)
> ACL Data RX: Handle 108 flags 0x02 dlen 9                                                                        #169 11.929519
      ATT: Error Response (0x01) len 4
        Find By Type Value Request (0x06)
        Handle: 0x016f
        Error: Attribute Not Found (0x0a)
zephyr.exe[2417695]: < HCI Command: Host Number of Completed Packets (0x03|0x0035) plen 5                          #170 11.946891
        Num handles: 1
        Handle: 108 Address: DF:A9:FF:F6:B1:1A (OUI DF-A9-FF)
        Count: 1
zephyr.exe[2417695]: < ACL Data TX: Handle 108 flags 0x00 dlen 11                                                  #171 11.947061
      ATT: Read By Type Request (0x08) len 6
        Handle range: 0x0160-0x016e
        Attribute type: Characteristic (0x2803)
> HCI Event: Number of Completed Packets (0x13) plen 5                                                             #172 11.999507
        Num handles: 1
        Handle: 108 Address: DF:A9:FF:F6:B1:1A (OUI DF-A9-FF)
        Count: 1
        #171: len 11 (1 Kb/s)
        Latency: 52 msec (3-63 msec ~52 msec)
> ACL Data RX: Handle 108 flags 0x02 dlen 27                                                                       #173 12.069867
      ATT: Read By Type Response (0x09) len 22
        Attribute data length: 7
        Attribute data list: 3 entries
        Handle: 0x0161
        Value: 126201842b
            Properties: 0x12
              Read (0x02)
              Notify (0x10)
            Value Handle: 0x0162
            Value UUID: Set Identity Resolving Key (0x2b84)
        Handle: 0x0164
        Value: 1a6501862b
            Properties: 0x1a
              Read (0x02)
              Write (0x08)
              Notify (0x10)
            Value Handle: 0x0165
            Value UUID: Set Member Lock (0x2b86)
        Handle: 0x0167
        Value: 126801852b
            Properties: 0x12
              Read (0x02)
              Notify (0x10)
            Value Handle: 0x0168
            Value UUID: Coordinated Set Size (0x2b85)
zephyr.exe[2417695]: < HCI Command: Host Number of Completed Packets (0x03|0x0035) plen 5                          #174 12.086955
        Num handles: 1
        Handle: 108 Address: DF:A9:FF:F6:B1:1A (OUI DF-A9-FF)
        Count: 1
zephyr.exe[2417695]: < ACL Data TX: Handle 108 flags 0x00 dlen 11                                                  #175 12.087134
      ATT: Read By Type Request (0x08) len 6
        Handle range: 0x0168-0x016e
        Attribute type: Characteristic (0x2803)
> HCI Event: Number of Completed Packets (0x13) plen 5                                                             #176 12.139400
        Num handles: 1
        Handle: 108 Address: DF:A9:FF:F6:B1:1A (OUI DF-A9-FF)
        Count: 1
        #175: len 11 (1 Kb/s)
        Latency: 52 msec (3-63 msec ~52 msec)
> ACL Data RX: Handle 108 flags 0x02 dlen 20                                                                       #177 12.209758
      ATT: Read By Type Response (0x09) len 15
        Attribute data length: 7
        Attribute data list: 2 entries
        Handle: 0x016a
        Value: 026b01872b
            Properties: 0x02
              Read (0x02)
            Value Handle: 0x016b
            Value UUID: Set Member Rank (0x2b87)
        Handle: 0x016c
        Value: 1a6d011a2c
            Properties: 0x1a
              Read (0x02)
              Write (0x08)
              Notify (0x10)
            Value Handle: 0x016d
            Value UUID: Unknown (0x2c1a)
zephyr.exe[2417695]: < HCI Command: Host Number of Completed Packets (0x03|0x0035) plen 5                          #178 12.227146
        Num handles: 1
        Handle: 108 Address: DF:A9:FF:F6:B1:1A (OUI DF-A9-FF)
        Count: 1
zephyr.exe[2417695]: < ACL Data TX: Handle 108 flags 0x00 dlen 11                                                  #179 12.227373
      ATT: Read By Type Request (0x08) len 6
        Handle range: 0x016d-0x016e
        Attribute type: Characteristic (0x2803)
> HCI Event: Number of Completed Packets (0x13) plen 5                                                             #180 12.279495
        Num handles: 1
        Handle: 108 Address: DF:A9:FF:F6:B1:1A (OUI DF-A9-FF)
        Count: 1
        #179: len 11 (1 Kb/s)
        Latency: 52 msec (3-63 msec ~52 msec)
> ACL Data RX: Handle 108 flags 0x02 dlen 9                                                                        #181 12.349555
      ATT: Error Response (0x01) len 4
        Read By Type Request (0x08)
        Handle: 0x016d
        Error: Attribute Not Found (0x0a)
zephyr.exe[2417695]: < HCI Command: Host Number of Completed Packets (0x03|0x0035) plen 5                          #182 12.367024
        Num handles: 1
        Handle: 108 Address: DF:A9:FF:F6:B1:1A (OUI DF-A9-FF)
        Count: 1
zephyr.exe[2417695]: < ACL Data TX: Handle 108 flags 0x00 dlen 7                                                   #183 12.367145
      ATT: Read Request (0x0a) len 2
        Handle: 0x0162
> HCI Event: Number of Completed Packets (0x13) plen 5                                                             #184 12.419476
        Num handles: 1
        Handle: 108 Address: DF:A9:FF:F6:B1:1A (OUI DF-A9-FF)
        Count: 1
        #183: len 7 (1 Kb/s)
        Latency: 52 msec (3-63 msec ~52 msec)
> ACL Data RX: Handle 108 flags 0x02 dlen 22                                                                       #185 12.489660
      ATT: Read Response (0x0b) len 17
zephyr.exe[2417695]: < HCI Command: Host Number of Completed Packets (0x03|0x0035) plen 5                          #186 12.506924
        Num handles: 1
        Handle: 108 Address: DF:A9:FF:F6:B1:1A (OUI DF-A9-FF)
        Count: 1
zephyr.exe[2417695]: < ACL Data TX: Handle 108 flags 0x00 dlen 7                                                   #187 12.507115
      ATT: Read Request (0x0a) len 2
        Handle: 0x0168
> HCI Event: Number of Completed Packets (0x13) plen 5                                                             #188 12.559461
        Num handles: 1
        Handle: 108 Address: DF:A9:FF:F6:B1:1A (OUI DF-A9-FF)
        Count: 1
        #187: len 7 (1 Kb/s)
        Latency: 52 msec (3-63 msec ~52 msec)
> ACL Data RX: Handle 108 flags 0x02 dlen 6                                                                        #189 12.629371
      ATT: Read Response (0x0b) len 1
zephyr.exe[2417695]: < HCI Command: Host Number of Completed Packets (0x03|0x0035) plen 5                          #190 12.646871
        Num handles: 1
        Handle: 108 Address: DF:A9:FF:F6:B1:1A (OUI DF-A9-FF)
        Count: 1
zephyr.exe[2417695]: < ACL Data TX: Handle 108 flags 0x00 dlen 7                                                   #191 12.647073
      ATT: Read Request (0x0a) len 2
        Handle: 0x016b
> HCI Event: Number of Completed Packets (0x13) plen 5                                                             #192 12.699352
        Num handles: 1
        Handle: 108 Address: DF:A9:FF:F6:B1:1A (OUI DF-A9-FF)
        Count: 1
        #191: len 7 (1 Kb/s)
        Latency: 52 msec (3-63 msec ~52 msec)
> ACL Data RX: Handle 108 flags 0x02 dlen 6                                                                        #193 12.769532
      ATT: Read Response (0x0b) len 1
zephyr.exe[2417695]: < HCI Command: Host Number of Completed Packets (0x03|0x0035) plen 5                          #194 12.787555
        Num handles: 1
        Handle: 108 Address: DF:A9:FF:F6:B1:1A (OUI DF-A9-FF)
        Count: 1
zephyr.exe[2417695]: < ACL Data TX: Handle 108 flags 0x00 dlen 8                                                   #195 14.197108
      ATT: Write Request (0x12) len 3
        Handle: 0x0165
          Data: 01
> HCI Event: Number of Completed Packets (0x13) plen 5                                                             #196 14.239443
        Num handles: 1
        Handle: 108 Address: DF:A9:FF:F6:B1:1A (OUI DF-A9-FF)
        Count: 1
        #195: len 8 (1 Kb/s)
        Latency: 42 msec (3-63 msec ~47 msec)
> ACL Data RX: Handle 108 flags 0x02 dlen 9                                                                        #197 14.309530
      ATT: Error Response (0x01) len 4
        Write Request (0x12)
        Handle: 0x0165
        Error: Reserved (0x84)
zephyr.exe[2417695]: < HCI Command: Host Number of Completed Packets (0x03|0x0035) plen 5                          #198 14.327172
        Num handles: 1
        Handle: 108 Address: DF:A9:FF:F6:B1:1A (OUI DF-A9-FF)
        Count: 1
zephyr.exe[2417695]: < ACL Data TX: Handle 108 flags 0x00 dlen 13                                                  #199 15.726664
      ATT: Find By Type Value Request (0x06) len 8
        Handle range: 0x0001-0xffff
        Attribute type: Primary Service (0x2800)
          UUID: Coordinated Set Identification (0x1846)
> HCI Event: Number of Completed Packets (0x13) plen 5                                                             #200 15.779313
        Num handles: 1
        Handle: 108 Address: DF:A9:FF:F6:B1:1A (OUI DF-A9-FF)
        Count: 1
        #199: len 13 (2 Kb/s)
        Latency: 52 msec (3-63 msec ~49 msec)
> ACL Data RX: Handle 108 flags 0x02 dlen 9                                                                        #201 15.849381
      ATT: Find By Type Value Response (0x07) len 4
        Handle range: 0x0160-0x016e
zephyr.exe[2417695]: < HCI Command: Host Number of Completed Packets (0x03|0x0035) plen 5                          #202 15.867124
        Num handles: 1
        Handle: 108 Address: DF:A9:FF:F6:B1:1A (OUI DF-A9-FF)
        Count: 1
zephyr.exe[2417695]: < ACL Data TX: Handle 108 flags 0x00 dlen 13                                                  #203 15.867411
      ATT: Find By Type Value Request (0x06) len 8
        Handle range: 0x016f-0xffff
        Attribute type: Primary Service (0x2800)
          UUID: Coordinated Set Identification (0x1846)
> HCI Event: Number of Completed Packets (0x13) plen 5                                                             #204 15.919293
        Num handles: 1
        Handle: 108 Address: DF:A9:FF:F6:B1:1A (OUI DF-A9-FF)
        Count: 1
        #203: len 13 (2 Kb/s)
        Latency: 51 msec (3-63 msec ~50 msec)
> ACL Data RX: Handle 108 flags 0x02 dlen 9                                                                        #205 15.989378
      ATT: Error Response (0x01) len 4
        Find By Type Value Request (0x06)
        Handle: 0x016f
        Error: Attribute Not Found (0x0a)
zephyr.exe[2417695]: < HCI Command: Host Number of Completed Packets (0x03|0x0035) plen 5                          #206 16.007005
        Num handles: 1
        Handle: 108 Address: DF:A9:FF:F6:B1:1A (OUI DF-A9-FF)
        Count: 1
zephyr.exe[2417695]: < ACL Data TX: Handle 108 flags 0x00 dlen 11                                                  #207 16.007306
      ATT: Read By Type Request (0x08) len 6
        Handle range: 0x0160-0x016e
        Attribute type: Characteristic (0x2803)
> HCI Event: Number of Completed Packets (0x13) plen 5                                                             #208 16.059349
        Num handles: 1
        Handle: 108 Address: DF:A9:FF:F6:B1:1A (OUI DF-A9-FF)
        Count: 1
        #207: len 11 (1 Kb/s)
        Latency: 52 msec (3-63 msec ~51 msec)
> ACL Data RX: Handle 108 flags 0x02 dlen 27                                                                       #209 16.129758
      ATT: Read By Type Response (0x09) len 22
        Attribute data length: 7
        Attribute data list: 3 entries
        Handle: 0x0161
        Value: 126201842b
            Properties: 0x12
              Read (0x02)
              Notify (0x10)
            Value Handle: 0x0162
            Value UUID: Set Identity Resolving Key (0x2b84)
        Handle: 0x0164
        Value: 1a6501862b
            Properties: 0x1a
              Read (0x02)
              Write (0x08)
              Notify (0x10)
            Value Handle: 0x0165
            Value UUID: Set Member Lock (0x2b86)
        Handle: 0x0167
        Value: 126801852b
            Properties: 0x12
              Read (0x02)
              Notify (0x10)
            Value Handle: 0x0168
            Value UUID: Coordinated Set Size (0x2b85)
zephyr.exe[2417695]: < HCI Command: Host Number of Completed Packets (0x03|0x0035) plen 5                          #210 16.147040
        Num handles: 1
        Handle: 108 Address: DF:A9:FF:F6:B1:1A (OUI DF-A9-FF)
        Count: 1
zephyr.exe[2417695]: < ACL Data TX: Handle 108 flags 0x00 dlen 11                                                  #211 16.147305
      ATT: Read By Type Request (0x08) len 6
        Handle range: 0x0168-0x016e
        Attribute type: Characteristic (0x2803)
> HCI Event: Number of Completed Packets (0x13) plen 5                                                             #212 16.199370
        Num handles: 1
        Handle: 108 Address: DF:A9:FF:F6:B1:1A (OUI DF-A9-FF)
        Count: 1
        #211: len 11 (1 Kb/s)
        Latency: 52 msec (3-63 msec ~51 msec)
> ACL Data RX: Handle 108 flags 0x02 dlen 20                                                                       #213 16.269651
  