Bluetooth monitor ver 5.72
= Note: Linux version 6.14.0-36-generic (x86_64)                       0.246812
= Note: Bluetooth subsystem version 2.22                               0.246814
= New Index: 00:00:00:00:00:00 (Primary,UART,hci1)              [hci1] 0.246815
= New Index: 48:5F:99:8E:E0:64 (Primary,USB,hci0)               [hci0] 0.246816
= Open Index: 00:00:00:00:00:00                                 [hci1] 0.760415
= Index Info: 00:00:00:00:00:00 (Nordic Semiconductor ASA)      [hci1] 0.760455
@ USER Open: main (privileged) version 2.22            {0x0001} [hci1] 0.760464
< HCI Command: Reset (0x03|0x0003) plen 0                    #1 [hci1] 0.761682
> HCI Event: Command Complete (0x0e) plen 4                  #2 [hci1] 0.762319
      Reset (0x03|0x0003) ncmd 1
        Status: Success (0x00)
< HCI Command: Read Local Supported... (0x04|0x0003) plen 0  #3 [hci1] 0.780293
> HCI Event: Command Complete (0x0e) plen 12                 #4 [hci1] 0.780879
      Read Local Supported Features (0x04|0x0003) ncmd 1
        Status: Success (0x00)
        Features: 0x00 0x00 0x00 0x00 0x60 0x00 0x00 0x00
          BR/EDR Not Supported
          LE Supported (Controller)
< HCI Command: Read Local Version In.. (0x04|0x0001) plen 0  #5 [hci1] 0.800017
> HCI Event: Command Complete (0x0e) plen 12                 #6 [hci1] 0.800519
      Read Local Version Information (0x04|0x0001) ncmd 1
        Status: Success (0x00)
        HCI version: Reserved (0x0f) - Revision 12393 (0x3069)
        LMP version: Reserved (0x0f) - Subversion 12393 (0x3069)
        Manufacturer: Nordic Semiconductor ASA (89)
< HCI Command: Read Local Supported... (0x04|0x0002) plen 0  #7 [hci1] 0.819958
> HCI Event: Command Complete (0x0e) plen 68                 #8 [hci1] 0.821011
      Read Local Supported Commands (0x04|0x0002) ncmd 1
        Status: Success (0x00)
        Commands: 119 entries
          Disconnect (Octet 0 - Bit 5)
          Read Remote Version Information (Octet 2 - Bit 7)
          Set Event Mask (Octet 5 - Bit 6)
          Reset (Octet 5 - Bit 7)
          Read Connection Accept Timeout (Octet 7 - Bit 2)
          Write Connection Accept Timeout (Octet 7 - Bit 3)
          Read Transmit Power Level (Octet 10 - Bit 2)
          Set Controller To Host Flow Control (Octet 10 - Bit 5)
          Host Buffer Size (Octet 10 - Bit 6)
          Host Number of Completed Packets (Octet 10 - Bit 7)
          Read Local Version Information (Octet 14 - Bit 3)
          Read Local Supported Features (Octet 14 - Bit 5)
          Read BD ADDR (Octet 15 - Bit 1)
          Read RSSI (Octet 15 - Bit 5)
          Set Event Mask Page 2 (Octet 22 - Bit 2)
          LE Set Event Mask (Octet 25 - Bit 0)
          LE Read Buffer Size (Octet 25 - Bit 1)
          LE Read Local Supported Features (Octet 25 - Bit 2)
          LE Set Random Address (Octet 25 - Bit 4)
          LE Set Advertising Parameters (Octet 25 - Bit 5)
          LE Read Advertising Channel TX Power (Octet 25 - Bit 6)
          LE Set Advertising Data (Octet 25 - Bit 7)
          LE Set Scan Response Data (Octet 26 - Bit 0)
          LE Set Advertise Enable (Octet 26 - Bit 1)
          LE Set Scan Parameters (Octet 26 - Bit 2)
          LE Set Scan Enable (Octet 26 - Bit 3)
          LE Create Connection (Octet 26 - Bit 4)
          LE Create Connection Cancel (Octet 26 - Bit 5)
          LE Read Accept List Size (Octet 26 - Bit 6)
          LE Clear Accept List (Octet 26 - Bit 7)
          LE Add Device To Accept List (Octet 27 - Bit 0)
          LE Remove Device From Accept List (Octet 27 - Bit 1)
          LE Connection Update (Octet 27 - Bit 2)
          LE Set Host Channel Classification (Octet 27 - Bit 3)
          LE Read Channel Map (Octet 27 - Bit 4)
          LE Read Remote Used Features (Octet 27 - Bit 5)
          LE Encrypt (Octet 27 - Bit 6)
          LE Rand (Octet 27 - Bit 7)
          LE Start Encryption (Octet 28 - Bit 0)
          LE Long Term Key Request Reply (Octet 28 - Bit 1)
          LE Long Term Key Request Neg Reply (Octet 28 - Bit 2)
          LE Read Supported States (Octet 28 - Bit 3)
          LE Receiver Test (Octet 28 - Bit 4)
          LE Transmitter Test (Octet 28 - Bit 5)
          LE Test End (Octet 28 - Bit 6)
          Read Authenticated Payload Timeout (Octet 32 - Bit 4)
          Write Authenticated Payload Timeout (Octet 32 - Bit 5)
          LE Set Data Length (Octet 33 - Bit 6)
          LE Read Suggested Default Data Length (Octet 33 - Bit 7)
          LE Write Suggested Default Data Length (Octet 34 - Bit 0)
          LE Add Device To Resolving List (Octet 34 - Bit 3)
          LE Remove Device From Resolving List (Octet 34 - Bit 4)
          LE Clear Resolving List (Octet 34 - Bit 5)
          LE Read Resolving List Size (Octet 34 - Bit 6)
          LE Set Address Resolution Enable (Octet 35 - Bit 1)
          LE Set Resolvable Private Address Timeout (Octet 35 - Bit 2)
          LE Read Maximum Data Length (Octet 35 - Bit 3)
          LE Read PHY (Octet 35 - Bit 4)
          LE Set Default PHY (Octet 35 - Bit 5)
          LE Set PHY (Octet 35 - Bit 6)
          LE Enhanced Receiver Test (Octet 35 - Bit 7)
          LE Enhanced Transmitter Test (Octet 36 - Bit 0)
          LE Set Advertising Set Random Address (Octet 36 - Bit 1)
          LE Set Extended Advertising Parameters (Octet 36 - Bit 2)
          LE Set Extended Advertising Data (Octet 36 - Bit 3)
          LE Set Extended Scan Response Data (Octet 36 - Bit 4)
          LE Set Extended Advertising Enable (Octet 36 - Bit 5)
          LE Read Maximum Advertising Data Length (Octet 36 - Bit 6)
          LE Read Number of Supported Advertising Sets (Octet 36 - Bit 7)
          LE Remove Advertising Set (Octet 37 - Bit 0)
          LE Clear Advertising Sets (Octet 37 - Bit 1)
          LE Set Periodic Advertising Parameters (Octet 37 - Bit 2)
          LE Set Periodic Advertising Data (Octet 37 - Bit 3)
          LE Set Periodic Advertising Enable (Octet 37 - Bit 4)
          LE Set Extended Scan Parameters (Octet 37 - Bit 5)
          LE Set Extended Scan Enable (Octet 37 - Bit 6)
          LE Extended Create Connection (Octet 37 - Bit 7)
          LE Periodic Advertising Create Sync (Octet 38 - Bit 0)
          LE Periodic Advertising Create Sync Cancel (Octet 38 - Bit 1)
          LE Periodic Advertising Terminate Sync (Octet 38 - Bit 2)
          LE Add Device To Periodic Advertiser List (Octet 38 - Bit 3)
          LE Remove Device From Periodic Advertiser List (Octet 38 - Bit 4)
          LE Clear Periodic Advertiser List (Octet 38 - Bit 5)
          LE Read Periodic Advertiser List Size (Octet 38 - Bit 6)
          LE Read Transmit Power (Octet 38 - Bit 7)
          LE Read RF Path Compensation (Octet 39 - Bit 0)
          LE Write RF Path Compensation (Octet 39 - Bit 1)
          LE Set Privacy Mode (Octet 39 - Bit 2)
          LE Periodic Advertising Receive Enable (Octet 40 - Bit 5)
          LE Periodic Advertising Sync Transfer (Octet 40 - Bit 6)
          LE Periodic Advertising Set Info Transfer (Octet 40 - Bit 7)
          LE Periodic Advertising Sync Transfer Parameters (Octet 41 - Bit 0)
          LE Set Default Periodic Advertisng Sync Transfer Parameters (Octet 41 - Bit 1)
          LE Read Buffer v2 (Octet 41 - Bit 5)
          LE Read ISO TX Sync (Octet 41 - Bit 6)
          LE Set Connected Isochronous Group Parameters (Octet 41 - Bit 7)
          LE Set Connected Isochronous Group Parameters Test (Octet 42 - Bit 0)
          LE Create Connected Isochronous Stream (Octet 42 - Bit 1)
          LE Remove Connected Isochronous Group (Octet 42 - Bit 2)
          LE Accept Connected Isochronous Stream Request (Octet 42 - Bit 3)
          LE Reject Connected Isochronous Stream Request (Octet 42 - Bit 4)
          LE Create Broadcast Isochronous Group (Octet 42 - Bit 5)
          LE Create Broadcast Isochronous Group Test (Octet 42 - Bit 6)
          LE Terminate Broadcast Isochronous Group (Octet 42 - Bit 7)
          LE Broadcast Isochronous Group Create Sync (Octet 43 - Bit 0)
          LE Broadcast Isochronous Group Terminate Sync (Octet 43 - Bit 1)
          LE Request Peer SCA (Octet 43 - Bit 2)
          LE Setup Isochronous Data Path (Octet 43 - Bit 3)
          LE Remove Isochronous Data Path (Octet 43 - Bit 4)
          LE Isochronous Transmit Test (Octet 43 - Bit 5)
          LE Isochronous Receive Test (Octet 43 - Bit 6)
          LE Isochronous Read Test Counters (Octet 43 - Bit 7)
          LE Isochronous Read Test Counters (Octet 44 - Bit 0)
          LE Set Host Feature (Octet 44 - Bit 1)
          Octet 44 - Bit 2 
          Octet 45 - Bit 6 
          Octet 46 - Bit 0 
          Octet 46 - Bit 1 
          Octet 46 - Bit 2 
< HCI Command: Host Buffer Size (0x03|0x0033) plen 7         #9 [hci1] 0.839970
        ACL MTU: 255  ACL max packet: 16
        SCO MTU: 0    SCO max packet: 0
> HCI Event: Command Complete (0x0e) plen 4                 #10 [hci1] 0.840518
      Host Buffer Size (0x03|0x0033) ncmd 1
        Status: Success (0x00)
< HCI Command: Set Controller To Ho.. (0x03|0x0031) plen 1  #11 [hci1] 0.859965
        Flow control: ACL Data Packets (0x01)
> HCI Event: Command Complete (0x0e) plen 4                 #12 [hci1] 0.860344
      Set Controller To Host Flow Control (0x03|0x0031) ncmd 1
        Status: Success (0x00)
< HCI Command: LE Read Local Suppor.. (0x08|0x0003) plen 0  #13 [hci1] 0.879966
> HCI Event: Command Complete (0x0e) plen 12                #14 [hci1] 0.880507
      LE Read Local Supported Features (0x08|0x0003) ncmd 1
        Status: Success (0x00)
        Features: 0xfd 0x79 0x00 0xf7 0x30 0x01 0x00 0x00
          LE Encryption
          Extended Reject Indication
          Peripheral-initiated Features Exchange
          LE Ping
          LE Data Packet Length Extension
          LL Privacy
          Extended Scanner Filter Policies
          LE 2M PHY
          LE Coded PHY
          LE Extended Advertising
          LE Periodic Advertising
          Channel Selection Algorithm #2
          Periodic Advertising Sync Transfer - Sender
          Periodic Advertising Sync Transfer - Recipient
          Sleep Clock Accuracy Updates
          Connected Isochronous Stream - Central
          Connected Isochronous Stream - Peripheral
          Isochronous Broadcaster
          Synchronized Receiver
          Periodic Advertising ADI support
          Connection Subrating
          Unknown features (0x0000010000000000)
< HCI Command: LE Set Host Feature (0x08|0x0074) plen 2     #15 [hci1] 0.899974
        Bit Number: 32
          Connected Isochronous Stream (Host Support)
        Bit Value: 1
> HCI Event: Command Complete (0x0e) plen 4                 #16 [hci1] 0.900510
      LE Set Host Feature (0x08|0x0074) ncmd 1
        Status: Success (0x00)
< HCI Command: LE Read Buffer v2 (0x08|0x0060) plen 0       #17 [hci1] 0.919969
> HCI Event: Command Complete (0x0e) plen 10                #18 [hci1] 0.920521
      LE Read Buffer v2 (0x08|0x0060) ncmd 1
        Status: Success (0x00)
        ACL MTU: 27
        ACL max packet: 3
        ISO MTU: 318
        ISO max packet: 3
< HCI Command: LE Read Maximum Adve.. (0x08|0x003a) plen 0  #19 [hci1] 0.939997
> HCI Event: Command Complete (0x0e) plen 6                 #20 [hci1] 0.940541
      LE Read Maximum Advertising Data Length (0x08|0x003a) ncmd 1
        Status: Success (0x00)
        Max length: 1650
< HCI Command: LE Read Supported St.. (0x08|0x001c) plen 0  #21 [hci1] 0.959972
> HCI Event: Command Complete (0x0e) plen 12                #22 [hci1] 0.960537
      LE Read Supported States (0x08|0x001c) ncmd 1
        Status: Success (0x00)
        States: 0x000003ff3e0306ff
          Non-connectable Advertising State
          Scannable Advertising State
          Connectable Advertising State
          High Duty Cycle Directed Advertising State
          Passive Scanning State
          Active Scanning State
          Initiating State
            and Connection State (Central Role)
          Connection State (Peripheral Role)
          Scannable Advertising State
            and Passive Scanning State
          Connectable Advertising State
            and Passive Scanning State
          Non-connectable Advertising State
            and Initiating State
          Scannable Advertising State
            and Initiating State
          Active Scanning State
            and Connection State (Central Role)
          Passive Scanning State
            and Connection State (Peripheral Role)
          Active Scanning State
            and Connection State (Peripheral Role)
          Initiating State
            and Connection State (Central Role)
            and Central Role & Central Role
          Low Duty Cycle Directed Advertising State
          Connectable Advertising State
            and Initiating State
            and Central Role & Peripheral Role
          High Duty Cycle Directed Advertising State
            and Initiating State
            and Central Role & Peripheral Role
          Low Duty Cycle Directed Advertising State
            and Initiating State
            and Central Role & Peripheral Role
          Connectable Advertising State
            and Connection State (Central Role)
            and Central Role & Peripheral Role
          High Duty Cycle Directed Advertising State
            and Connection State (Central Role)
            and Central Role & Peripheral Role
          Low Duty Cycle Directed Advertising State
            and Connection State (Central Role)
            and Central Role & Peripheral Role
          Connectable Advertising State
            and Connection State (Peripheral Role)
            and Central Role & Peripheral Role
          High Duty Cycle Directed Advertising State
            and Connection State (Peripheral Role)
            and Peripheral Role & Peripheral Role
          Low Duty Cycle Directed Advertising State
            and Connection State (Peripheral Role)
            and Peripheral Role & Peripheral Role
          Initiating State
            and Connection State (Peripheral Role)
            and Central Role & Peripheral Role
< HCI Command: LE Read Maximum Data.. (0x08|0x002f) plen 0  #23 [hci1] 0.979970
> HCI Event: Command Complete (0x0e) plen 12                #24 [hci1] 0.980519
      LE Read Maximum Data Length (0x08|0x002f) ncmd 1
        Status: Success (0x00)
        Max TX octets: 251
        Max TX time: 2704
        Max RX octets: 251
        Max RX time: 2704
< HCI Command: LE Write Suggested D.. (0x08|0x0024) plen 4  #25 [hci1] 0.999963
        TX octets: 251
        TX time: 2704
> HCI Event: Command Complete (0x0e) plen 4                 #26 [hci1] 1.000511
      LE Write Suggested Default Data Length (0x08|0x0024) ncmd 1
        Status: Success (0x00)
< HCI Command: LE Read Resolving Li.. (0x08|0x002a) plen 0  #27 [hci1] 1.019980
> HCI Event: Command Complete (0x0e) plen 5                 #28 [hci1] 1.020331
      LE Read Resolving List Size (0x08|0x002a) ncmd 1
        Status: Success (0x00)
        Size: 8
< HCI Command: LE Set Event Mask (0x08|0x0001) plen 8       #29 [hci1] 1.039968
        Mask: 0x000002023f87fa5e
          LE Advertising Report
          LE Connection Update Complete
          LE Read Remote Used Features Complete
          LE Long Term Key Request
          LE Data Length Change
          LE Enhanced Connection Complete
          LE PHY Update Complete
          LE Extended Advertising Report
          LE Periodic Advertising Sync Established
          LE Periodic Advertising Report
          LE Periodic Advertising Sync Lost
          LE Extended Scan Timeout
          LE Extended Advertising Set Terminated
          LE Scan Request Received
          LE Periodic Advertising Sync Transfer Rvc
          LE CIS Established
          LE CIS Request
          LE Create BIG Complete
          LE Terminate BIG Complete
          LE BIG Sync Estabilished Complete
          LE BIG Sync Lost
          LE BIG Info Advertising Report
          Unknown mask (0x0000020000000000)
> HCI Event: Command Complete (0x0e) plen 4                 #30 [hci1] 1.040475
      LE Set Event Mask (0x08|0x0001) ncmd 1
        Status: Success (0x00)
< HCI Command: Set Event Mask (0x03|0x0001) plen 8          #31 [hci1] 1.059976
        Mask: 0x2000800002008890
          Disconnection Complete
          Encryption Change
          Read Remote Version Information Complete
          Hardware Error
          Data Buffer Overflow
          Encryption Key Refresh Complete
          LE Meta
> HCI Event: Command Complete (0x0e) plen 4                 #32 [hci1] 1.060476
      Set Event Mask (0x03|0x0001) ncmd 1
        Status: Success (0x00)
< HCI Command: Read BD ADDR (0x04|0x0009) plen 0            #33 [hci1] 1.079969
> HCI Event: Command Complete (0x0e) plen 10                #34 [hci1] 1.080511
      Read BD ADDR (0x04|0x0009) ncmd 1
        Status: Success (0x00)
        Address: 00:00:00:00:00:00 (OUI 00-00-00)
< HCI Command: LE Set Random Address (0x08|0x0005) plen 6   #35 [hci1] 1.099965
        Address: D5:B6:CC:31:DB:3B (Static)
> HCI Event: Command Complete (0x0e) plen 4                 #36 [hci1] 1.100476
      LE Set Random Address (0x08|0x0005) ncmd 1
        Status: Success (0x00)
< HCI Command: LE Set Extended Adv.. (0x08|0x0036) plen 25  #37 [hci1] 3.600079
        Handle: 0x00
        Properties: 0x0013
          Connectable
          Scannable
          Use legacy advertising PDUs: ADV_IND
        Min advertising interval: 100.000 msec (0x00a0)
        Max advertising interval: 150.000 msec (0x00f0)
        Channel map: 37, 38, 39 (0x07)
        Own address type: Random (0x01)
        Peer address type: Public (0x00)
        Peer address: 00:00:00:00:00:00 (OUI 00-00-00)
        Filter policy: Allow Scan Request from Any, Allow Connect Request from Any (0x00)
        TX power: Host has no preference (0x7f)
        Primary PHY: LE 1M (0x01)
        Secondary max skip: 0x00
        Secondary PHY: LE 1M (0x01)
        SID: 0x00
        Scan request notifications: Disabled (0x00)
> HCI Event: Command Complete (0x0e) plen 5                 #38 [hci1] 3.600957
      LE Set Extended Advertising Parameters (0x08|0x0036) ncmd 1
        Status: Success (0x00)
        TX power (selected): 0 dbm (0x00)
< HCI Command: LE Set Advertising S.. (0x08|0x0035) plen 7  #39 [hci1] 3.620003
        Advertising handle: 0x00
        Advertising random address: D5:B6:CC:31:DB:3B (Static)
> HCI Event: Command Complete (0x0e) plen 4                 #40 [hci1] 3.620654
      LE Set Advertising Set Random Address (0x08|0x0035) ncmd 1
        Status: Success (0x00)
< HCI Command: LE Set Extended Adv.. (0x08|0x0037) plen 22  #41 [hci1] 3.640076
        Handle: 0x00
        Operation: Complete extended advertising data (0x03)
        Fragment preference: Minimize fragmentation (0x01)
        Data length: 0x12
        Flags: 0x06
          LE General Discoverable Mode
          BR/EDR Not Supported
        Name (complete): Tester_F6B11A
> HCI Event: Command Complete (0x0e) plen 4                 #42 [hci1] 3.640803
      LE Set Extended Advertising Data (0x08|0x0037) ncmd 1
        Status: Success (0x00)
< HCI Command: LE Set Extended Scan.. (0x08|0x0038) plen 4  #43 [hci1] 3.660013
        Handle: 0x00
        Operation: Complete scan response data (0x03)
        Fragment preference: Minimize fragmentation (0x01)
        Data length: 0x00
> HCI Event: Command Complete (0x0e) plen 4                 #44 [hci1] 3.660534
      LE Set Extended Scan Response Data (0x08|0x0038) ncmd 1
        Status: Success (0x00)
< HCI Command: LE Set Extended Adve.. (0x08|0x0039) plen 6  #45 [hci1] 3.679930
        Extended advertising: Enabled (0x01)
        Number of sets: 1 (0x01)
        Entry 0
          Handle: 0x00
          Duration: 0 ms (0x00)
          Max ext adv events: 0
> HCI Event: Command Complete (0x0e) plen 4                 #46 [hci1] 3.680603
      LE Set Extended Advertising Enable (0x08|0x0039) ncmd 1
        Status: Success (0x00)
> HCI Event: LE Meta Event (0x3e) plen 31                   #47 [hci1] 3.790874
      LE Enhanced Connection Complete (0x0a)
        Status: Success (0x00)
        Handle: 21
        Role: Peripheral (0x01)
        Peer address type: Public (0x00)
        Peer address: DF:A9:FF:F6:B1:1A (OUI DF-A9-FF)
        Local resolvable private address: 00:00:00:00:00:00 (Non-Resolvable)
        Peer resolvable private address: 00:00:00:00:00:00 (Non-Resolvable)
        Connection interval: 87.50 msec (0x0046)
        Connection latency: 0 (0x0000)
        Supervision timeout: 25120 msec (0x09d0)
        Central clock accuracy: 0x01
> HCI Event: LE Meta Event (0x3e) plen 6                    #48 [hci1] 3.791124
      LE Advertising Set Terminated (0x12)
        Status: Success (0x00)
        Handle: 0
        Connection handle: 21
        Number of completed extended advertising events: 0
< HCI Command: LE Read Remote Used... (0x08|0x0016) plen 2  #49 [hci1] 3.800952
        Handle: 21 Address: DF:A9:FF:F6:B1:1A (OUI DF-A9-FF)
< ACL Data TX: Handle 21 flags 0x00 dlen 7                  #50 [hci1] 3.800975
      ATT: Exchange MTU Request (0x02) len 2
        Client RX MTU: 251
> HCI Event: Command Status (0x0f) plen 4                   #51 [hci1] 3.801515
      LE Read Remote Used Features (0x08|0x0016) ncmd 1
        Status: Success (0x00)
> HCI Event: Number of Completed Packets (0x13) plen 5      #52 [hci1] 3.967102
        Num handles: 1
        Handle: 21 Address: DF:A9:FF:F6:B1:1A (OUI DF-A9-FF)
        Count: 1
        #50: len 7 (0 Kb/s)
        Latency: 166 msec (166-166 msec ~166 msec)
> HCI Event: LE Meta Event (0x3e) plen 12                   #53 [hci1] 4.054897
      LE Read Remote Used Features (0x04)
        Status: Success (0x00)
        Handle: 21 Address: DF:A9:FF:F6:B1:1A (OUI DF-A9-FF)
        Features: 0x2d 0x49 0x00 0xf7 0x67 0xd8 0x00 0x00
          LE Encryption
          Extended Reject Indication
          Peripheral-initiated Features Exchange
          LE Data Packet Length Extension
          LE 2M PHY
          LE Coded PHY
          Channel Selection Algorithm #2
          Periodic Advertising Sync Transfer - Sender
          Periodic Advertising Sync Transfer - Recipient
          Sleep Clock Accuracy Updates
          Connected Isochronous Stream - Central
          Connected Isochronous Stream - Peripheral
          Isochronous Broadcaster
          Synchronized Receiver
          Connected Isochronous Stream (Host Support)
          LE Power Control Request
          LE Power Control Request
          Connection Subrating
          Connection Subrating (Host Support)
          Unknown features (0x0000d80000000000)
> ACL Data RX: Handle 21 flags 0x02 dlen 11                 #54 [hci1] 6.504535
      SMP: Pairing Request (0x01) len 6
        IO capability: KeyboardDisplay (0x04)
        OOB data: Authentication data not present (0x00)
        Authentication requirement: Bonding, MITM, SC, No Keypresses (0x0d)
        Max encryption key size: 16
        Initiator key distribution: EncKey IdKey (0x03)
        Responder key distribution: EncKey IdKey Sign (0x07)
> ACL Data RX: Handle 21 flags 0x02 dlen 7                  #55 [hci1] 6.504869
      ATT: Exchange MTU Response (0x03) len 2
        Server RX MTU: 23
< HCI Command: Host Number of Compl.. (0x03|0x0035) plen 5  #56 [hci1] 6.520589
        Num handles: 1
        Handle: 21 Address: DF:A9:FF:F6:B1:1A (OUI DF-A9-FF)
        Count: 1
< ACL Data TX: Handle 21 flags 0x00 dlen 11                 #57 [hci1] 6.520818
      SMP: Pairing Response (0x02) len 6
        IO capability: DisplayOnly (0x00)
        OOB data: Authentication data not present (0x00)
        Authentication requirement: Bonding, No MITM, SC, No Keypresses (0x09)
        Max encryption key size: 16
        Initiator key distribution: IdKey (0x02)
        Responder key distribution: <none> (0x00)
< HCI Command: Host Number of Compl.. (0x03|0x0035) plen 5  #58 [hci1] 6.520967
        Num handles: 1
        Handle: 21 Address: DF:A9:FF:F6:B1:1A (OUI DF-A9-FF)
        Count: 1
> HCI Event: Number of Completed Packets (0x13) plen 5      #59 [hci1] 6.679635
        Num handles: 1
        Handle: 21 Address: DF:A9:FF:F6:B1:1A (OUI DF-A9-FF)
        Count: 1
        #57: len 11 (0 Kb/s)
        Latency: 158 msec (158-166 msec ~162 msec)
> ACL Data RX: Handle 21 flags 0x02 dlen 27                 #60 [hci1] 6.680020
> ACL Data RX: Handle 21 flags 0x01 dlen 27                 #61 [hci1] 6.680438
> ACL Data RX: Handle 21 flags 0x01 dlen 15                 #62 [hci1] 6.680810
      SMP: Pairing Public Key (0x0c) len 64
        X: 08ae7f7509a9c0e89063ed5fd872d42e7d052a42846efe02e4396f6d34ed32ac
        Y: 4b7c879a751d527f3cd970957e743e6aaa0645895c2989acca7b92ec1a34f508
< HCI Command: Host Number of Compl.. (0x03|0x0035) plen 5  #63 [hci1] 6.700456
        Num handles: 1
        Handle: 21 Address: DF:A9:FF:F6:B1:1A (OUI DF-A9-FF)
        Count: 1
< HCI Command: Host Number of Compl.. (0x03|0x0035) plen 5  #64 [hci1] 6.700730
        Num handles: 1
        Handle: 21 Address: DF:A9:FF:F6:B1:1A (OUI DF-A9-FF)
        Count: 1
< HCI Command: Host Number of Compl.. (0x03|0x0035) plen 5  #65 [hci1] 6.701190
        Num handles: 1
        Handle: 21 Address: DF:A9:FF:F6:B1:1A (OUI DF-A9-FF)
        Count: 1
< ACL Data TX: Handle 21 flags 0x00 dlen 27                 #66 [hci1] 6.701289
< ACL Data TX: Handle 21 flags 0x01 dlen 27                 #67 [hci1] 6.701299
< ACL Data TX: Handle 21 flags 0x01 dlen 15                 #68 [hci1] 6.701327
      SMP: Pairing Public Key (0x0c) len 64
        X: 98308440221e2d910f0e54b71e7ec652857aa9b5a0dc65028824cc19db1226e9
        Y: 67a4816bcb62efb21701e31fdb27561a6217575fb007a8bbdabe7e28b6f68482
> HCI Event: Number of Completed Packets (0x13) plen 5      #69 [hci1] 6.767531
        Num handles: 1
        Handle: 21 Address: DF:A9:FF:F6:B1:1A (OUI DF-A9-FF)
        Count: 1
        #66: len 27 (3 Kb/s)
        Latency: 66 msec (66-166 msec ~114 msec)
> HCI Event: Number of Completed Packets (0x13) plen 5      #70 [hci1] 6.768175
        Num handles: 1
        Handle: 21 Address: DF:A9:FF:F6:B1:1A (OUI DF-A9-FF)
        Count: 1
        #67: len 27 (3 Kb/s)
        Latency: 66 msec (66-166 msec ~90 msec)
> HCI Event: Number of Completed Packets (0x13) plen 5      #71 [hci1] 6.854320
        Num handles: 1
        Handle: 21 Address: DF:A9:FF:F6:B1:1A (OUI DF-A9-FF)
        Count: 1
        #68: len 15 (0 Kb/s)
        Latency: 152 msec (66-166 msec ~121 msec)
> ACL Data RX: Handle 21 flags 0x02 dlen 21                 #72 [hci1] 7.817203
      SMP: Pairing Confirm (0x03) len 16
        Confim value: 6515e011aa1a870e89410a7cd2664912
< HCI Command: Host Number of Compl.. (0x03|0x0035) plen 5  #73 [hci1] 7.820204
        Num handles: 1
        Handle: 21 Address: DF:A9:FF:F6:B1:1A (OUI DF-A9-FF)
        Count: 1
< ACL Data TX: Handle 21 flags 0x00 dlen 21                 #74 [hci1] 7.820319
      SMP: Pairing Confirm (0x03) len 16
        Confim value: 9df841e48a718cb64aa2f01cce43c92f
> HCI Event: Number of Completed Packets (0x13) plen 5      #75 [hci1] 7.992047
        Num handles: 1
        Handle: 21 Address: DF:A9:FF:F6:B1:1A (OUI DF-A9-FF)
        Count: 1
        #74: len 21 (0 Kb/s)
        Latency: 171 msec (66-171 msec ~146 msec)
> ACL Data RX: Handle 21 flags 0x02 dlen 21                 #76 [hci1] 7.992303
      SMP: Pairing Random (0x04) len 16
        Random value: 192936daf58e191b0000000000000000
< HCI Command: Host Number of Compl.. (0x03|0x0035) plen 5  #77 [hci1] 8.000509
        Num handles: 1
        Handle: 21 Address: DF:A9:FF:F6:B1:1A (OUI DF-A9-FF)
        Count: 1
< ACL Data TX: Handle 21 flags 0x00 dlen 21                 #78 [hci1] 8.000655
      SMP: Pairing Random (0x04) len 16
        Random value: 8e6108f966a694cbe26df70bb96773e6
> HCI Event: Number of Completed Packets (0x13) plen 5      #79 [hci1] 8.166764
        Num handles: 1
        Handle: 21 Address: DF:A9:FF:F6:B1:1A (OUI DF-A9-FF)
        Count: 1
        #78: len 21 (1 Kb/s)
        Latency: 166 msec (66-171 msec ~156 msec)
> ACL Data RX: Handle 21 flags 0x02 dlen 21                 #80 [hci1] 8.254597
      SMP: Pairing Confirm (0x03) len 16
        Confim value: ab3123d814506f10adb7a716e21cc57e
< HCI Command: Host Number of Compl.. (0x03|0x0035) plen 5  #81 [hci1] 8.260203
        Num handles: 1
        Handle: 21 Address: DF:A9:FF:F6:B1:1A (OUI DF-A9-FF)
        Count: 1
< ACL Data TX: Handle 21 flags 0x00 dlen 21                 #82 [hci1] 8.260339
      SMP: Pairing Confirm (0x03) len 16
        Confim value: 967a65f79c776cd68eb969e0f38c28ea
> HCI Event: Number of Completed Packets (0x13) plen 5      #83 [hci1] 8.429495
        Num handles: 1
        Handle: 21 Address: DF:A9:FF:F6:B1:1A (OUI DF-A9-FF)
        Count: 1
        #82: len 21 (0 Kb/s)
        Latency: 169 msec (66-171 msec ~162 msec)
> ACL Data RX: Handle 21 flags 0x02 dlen 21                 #84 [hci1] 8.429902
      SMP: Pairing Random (0x04) len 16
        Random value: 76756a16c31ca7220000000000000000
< HCI Command: Host Number of Compl.. (0x03|0x0035) plen 5  #85 [hci1] 8.440501
        Num handles: 1
        Handle: 21 Address: DF:A9:FF:F6:B1:1A (OUI DF-A9-FF)
        Count: 1
< ACL Data TX: Handle 21 flags 0x00 dlen 21                 #86 [hci1] 8.440660
      SMP: Pairing Random (0x04) len 16
        Random value: 4d02679f89a05211af56d8b3da64d21e
> HCI Event: Number of Completed Packets (0x13) plen 5      #87 [hci1] 8.604369
        Num handles: 1
        Handle: 21 Address: DF:A9:FF:F6:B1:1A (OUI DF-A9-FF)
        Count: 1
        #86: len 21 (1 Kb/s)
        Latency: 163 msec (66-171 msec ~163 msec)
> ACL Data RX: Handle 21 flags 0x02 dlen 21                 #88 [hci1] 8.692080
      SMP: Pairing Confirm (0x03) len 16
        Confim value: 6693d947cf2ff2ae1d97b90001363787
< HCI Command: Host Number of Compl.. (0x03|0x0035) plen 5  #89 [hci1] 8.700285
        Num handles: 1
        Handle: 21 Address: DF:A9:FF:F6:B1:1A (OUI DF-A9-FF)
        Count: 1
< ACL Data TX: Handle 21 flags 0x00 dlen 21                 #90 [hci1] 8.700356
      SMP: Pairing Confirm (0x03) len 16
        Confim value: c039d2a51a248c17b949761ddc205acc
> HCI Event: Number of Completed Packets (0x13) plen 5      #91 [hci1] 8.866973
        Num handles: 1
        Handle: 21 Address: DF:A9:FF:F6:B1:1A (OUI DF-A9-FF)
        Count: 1
        #90: len 21 (1 Kb/s)
        Latency: 166 msec (66-171 msec ~164 msec)
> ACL Data RX: Handle 21 flags 0x02 dlen 21                 #92 [hci1] 8.867252
      SMP: Pairing Random (0x04) len 16
        Random value: 7296088be5add8bd0000000000000000
< HCI Command: Host Number of Compl.. (0x03|0x0035) plen 5  #93 [hci1] 8.880514
        Num handles: 1
        Handle: 21 Address: DF:A9:FF:F6:B1:1A (OUI DF-A9-FF)
        Count: 1
< ACL Data TX: Handle 21 flags 0x00 dlen 21                 #94 [hci1] 8.880561
      SMP: Pairing Random (0x04) len 16
        Random value: 5e8286bc235a02440d0c3424a2acf8fd
> HCI Event: Number of Completed Packets (0x13) plen 5      #95 [hci1] 9.041796
        Num handles: 1
        Handle: 21 Address: DF:A9:FF:F6:B1:1A (OUI DF-A9-FF)
        Count: 1
        #94: len 21 (1 Kb/s)
        Latency: 161 msec (66-171 msec ~163 msec)
> ACL Data RX: Handle 21 flags 0x02 dlen 21                 #96 [hci1] 9.129629
      SMP: Pairing Confirm (0x03) len 16
        Confim value: 3656458108c25d46037bc3231f0841e9
< HCI Command: Host Number of Compl.. (0x03|0x0035) plen 5  #97 [hci1] 9.140640
        Num handles: 1
        Handle: 21 Address: DF:A9:FF:F6:B1:1A (OUI DF-A9-FF)
        Count: 1
< ACL Data TX: Handle 21 flags 0x00 dlen 21                 #98 [hci1] 9.140817
      SMP: Pairing Confirm (0x03) len 16
        Confim value: 32c2fcdd9611401871e7814222c8de97
> HCI Event: Number of Completed Packets (0x13) plen 5      #99 [hci1] 9.304525
        Num handles: 1
        Handle: 21 Address: DF:A9:FF:F6:B1:1A (OUI DF-A9-FF)
        Count: 1
        #98: len 21 (1 Kb/s)
        Latency: 163 msec (66-171 msec ~163 msec)
> ACL Data RX: Handle 21 flags 0x02 dlen 21                #100 [hci1] 9.304747
      SMP: Pairing Random (0x04) len 16
        Random value: 48e5d88e3ca7a8ee0000000000000000
< HCI Command: Host Number of Comp.. (0x03|0x0035) plen 5  #101 [hci1] 9.320272
        Num handles: 1
        Handle: 21 Address: DF:A9:FF:F6:B1:1A (OUI DF-A9-FF)
        Count: 1
< ACL Data TX: Handle 21 flags 0x00 dlen 21                #102 [hci1] 9.320310
      SMP: Pairing Random (0x04) len 16
        Random value: 5c4a1bcadd27bd58e945097b00bad7ac
> HCI Event: Number of Completed Packets (0x13) plen 5     #103 [hci1] 9.479205
        Num handles: 1
        Handle: 21 Address: DF:A9:FF:F6:B1:1A (OUI DF-A9-FF)
        Count: 1
        #102: len 21 (1 Kb/s)
        Latency: 158 msec (66-171 msec ~161 msec)
> ACL Data RX: Handle 21 flags 0x02 dlen 21                #104 [hci1] 9.567044
      SMP: Pairing Confirm (0x03) len 16
        Confim value: 25b9fcc990c48c7b2e6e15140501d4b8
< HCI Command: Host Number of Comp.. (0x03|0x0035) plen 5  #105 [hci1] 9.580403
        Num handles: 1
        Handle: 21 Address: DF:A9:FF:F6:B1:1A (OUI DF-A9-FF)
        Count: 1
< ACL Data TX: Handle 21 flags 0x00 dlen 21                #106 [hci1] 9.580539
      SMP: Pairing Confirm (0x03) len 16
        Confim value: c57bdf3506ce17bf0db64388c65995cd
> HCI Event: Number of Completed Packets (0x13) plen 5     #107 [hci1] 9.741855
        Num handles: 1
        Handle: 21 Address: DF:A9:FF:F6:B1:1A (OUI DF-A9-FF)
        Count: 1
        #106: len 21 (1 Kb/s)
        Latency: 161 msec (66-171 msec ~161 msec)
> ACL Data RX: Handle 21 flags 0x02 dlen 21                #108 [hci1] 9.742254
      SMP: Pairing Random (0x04) len 16
        Random value: 7c2c8aa5e7a82e7b0000000000000000
< HCI Command: Host Number of Comp.. (0x03|0x0035) plen 5  #109 [hci1] 9.760249
        Num handles: 1
        Handle: 21 Address: DF:A9:FF:F6:B1:1A (OUI DF-A9-FF)
        Count: 1
< ACL Data TX: Handle 21 flags 0x00 dlen 21                #110 [hci1] 9.760325
      SMP: Pairing Random (0x04) len 16
        Random value: 32527e6e64e79f33b2e374394db8ab2d
> HCI Event: Number of Completed Packets (0x13) plen 5     #111 [hci1] 9.916662
        Num handles: 1
        Handle: 21 Address: DF:A9:FF:F6:B1:1A (OUI DF-A9-FF)
        Count: 1
        #110: len 21 (1 Kb/s)
        Latency: 156 msec (66-171 msec ~158 msec)
> ACL Data RX: Handle 21 flags 0x02 dlen 21               #112 [hci1] 10.004528
      SMP: Pairing Confirm (0x03) len 16
        Confim value: 93462d706a9a68e9903fd4fe982772db
< HCI Command: Host Number of Com.. (0x03|0x0035) plen 5  #113 [hci1] 10.020563
        Num handles: 1
        Handle: 21 Address: DF:A9:FF:F6:B1:1A (OUI DF-A9-FF)
        Count: 1
< ACL Data TX: Handle 21 flags 0x00 dlen 21               #114 [hci1] 10.020715
      SMP: Pairing Confirm (0x03) len 16
        Confim value: cb0470859484c0b261da0975b2751686
> HCI Event: Number of Completed Packets (0x13) plen 5    #115 [hci1] 10.179408
        Num handles: 1
        Handle: 21 Address: DF:A9:FF:F6:B1:1A (OUI DF-A9-FF)
        Count: 1
        #114: len 21 (1 Kb/s)
        Latency: 158 msec (66-171 msec ~158 msec)
> ACL Data RX: Handle 21 flags 0x02 dlen 21               #116 [hci1] 10.179707
      SMP: Pairing Random (0x04) len 16
        Random value: 29f81de060658a3e0000000000000000
< HCI Command: Host Number of Com.. (0x03|0x0035) plen 5  #117 [hci1] 10.180204
        Num handles: 1
        Handle: 21 Address: DF:A9:FF:F6:B1:1A (OUI DF-A9-FF)
        Count: 1
< ACL Data TX: Handle 21 flags 0x00 dlen 21               #118 [hci1] 10.180266
      SMP: Pairing Random (0x04) len 16
        Random value: dddbdfe2838e9a8cc6964353c850fef7
> HCI Event: Number of Completed Packets (0x13) plen 5    #119 [hci1] 10.354173
        Num handles: 1
        Handle: 21 Address: DF:A9:FF:F6:B1:1A (OUI DF-A9-FF)
        Count: 1
        #118: len 21 (0 Kb/s)
        Latency: 173 msec (66-173 msec ~166 msec)
> ACL Data RX: Handle 21 flags 0x02 dlen 21               #120 [hci1] 10.442089
      SMP: Pairing Confirm (0x03) len 16
        Confim value: 74deb69ab4b65a338e7d0baf5e2a3604
< HCI Command: Host Number of Com.. (0x03|0x0035) plen 5  #121 [hci1] 10.460551
        Num handles: 1
        Handle: 21 Address: DF:A9:FF:F6:B1:1A (OUI DF-A9-FF)
        Count: 1
< ACL Data TX: Handle 21 flags 0x00 dlen 21               #122 [hci1] 10.460656
      SMP: Pairing Confirm (0x03) len 16
        Confim value: f180b876d55685e6d67dd883776bbbe6
> HCI Event: Number of Completed Packets (0x13) plen 5    #123 [hci1] 10.617043
        Num handles: 1
        Handle: 21 Address: DF:A9:FF:F6:B1:1A (OUI DF-A9-FF)
        Count: 1
        #122: len 21 (1 Kb/s)
        Latency: 156 msec (66-173 msec ~161 msec)
> ACL Data RX: Handle 21 flags 0x02 dlen 21               #124 [hci1] 10.617146
      SMP: Pairing Random (0x04) len 16
        Random value: c94e3f6a759b5a450000000000000000
< HCI Command: Host Number of Com.. (0x03|0x0035) plen 5  #125 [hci1] 10.620834
        Num handles: 1
        Handle: 21 Address: DF:A9:FF:F6:B1:1A (OUI DF-A9-FF)
        Count: 1
< ACL Data TX: Handle 21 flags 0x00 dlen 21               #126 [hci1] 10.620935
      SMP: Pairing Random (0x04) len 16
        Random value: eb9f1915536596b6fc3db1c86b2b1970
> HCI Event: Number of Completed Packets (0x13) plen 5    #127 [hci1] 10.791792
        Num handles: 1
        Handle: 21 Address: DF:A9:FF:F6:B1:1A (OUI DF-A9-FF)
        Count: 1
        #126: len 21 (0 Kb/s)
        Latency: 170 msec (66-173 msec ~166 msec)
> ACL Data RX: Handle 21 flags 0x02 dlen 21               #128 [hci1] 10.879602
      SMP: Pairing Confirm (0x03) len 16
        Confim value: 0036884ea2e23d3bdeadc826e852d1c7
< HCI Command: Host Number of Com.. (0x03|0x0035) plen 5  #129 [hci1] 10.880392
        Num handles: 1
        Handle: 21 Address: DF:A9:FF:F6:B1:1A (OUI DF-A9-FF)
        Count: 1
< ACL Data TX: Handle 21 flags 0x00 dlen 21               #130 [hci1] 10.880534
      SMP: Pairing Confirm (0x03) len 16
        Confim value: be44eb84b2d615b49eb56709d5e6dc38
> HCI Event: Number of Completed Packets (0x13) plen 5    #131 [hci1] 11.054552
        Num handles: 1
        Handle: 21 Address: DF:A9:FF:F6:B1:1A (OUI DF-A9-FF)
        Count: 1
        #130: len 21 (0 Kb/s)
        Latency: 174 msec (66-174 msec ~170 msec)
> ACL Data RX: Handle 21 flags 0x02 dlen 21               #132 [hci1] 11.054668
      SMP: Pairing Random (0x04) len 16
        Random value: f9a2ab5090c1c5610000000000000000
< HCI Command: Host Number of Com.. (0x03|0x0035) plen 5  #133 [hci1] 11.060817
        Num handles: 1
        Handle: 21 Address: DF:A9:FF:F6:B1:1A (OUI DF-A9-FF)
        Count: 1
< ACL Data TX: Handle 21 flags 0x00 dlen 21               #134 [hci1] 11.060939
      SMP: Pairing Random (0x04) len 16
        Random value: 5c794dc9ad9f2c3f295ebd5ad5e1c3cf
> HCI Event: Number of Completed Packets (0x13) plen 5    #135 [hci1] 11.229174
        Num handles: 1
        Handle: 21 Address: DF:A9:FF:F6:B1:1A (OUI DF-A9-FF)
        Count: 1
        #134: len 21 (1 Kb/s)
        Latency: 168 msec (66-174 msec ~169 msec)
> ACL Data RX: Handle 21 flags 0x02 dlen 21               #136 [hci1] 11.317032
      SMP: Pairing Confirm (0x03) len 16
        Confim value: 904da6c0d4cada7ce35cc2f1c2af5724
< HCI Command: Host Number of Com.. (0x03|0x0035) plen 5  #137 [hci1] 11.320134
        Num handles: 1
        Handle: 21 Address: DF:A9:FF:F6:B1:1A (OUI DF-A9-FF)
        Count: 1
< ACL Data TX: Handle 21 flags 0x00 dlen 21               #138 [hci1] 11.320198
      SMP: Pairing Confirm (0x03) len 16
        Confim value: d574e69ea9118e9432dc2e97223a4adf
> HCI Event: Number of Completed Packets (0x13) plen 5    #139 [hci1] 11.491876
        Num handles: 1
        Handle: 21 Address: DF:A9:FF:F6:B1:1A (OUI DF-A9-FF)
        Count: 1
        #138: len 21 (0 Kb/s)
        Latency: 171 msec (66-174 msec ~170 msec)
> ACL Data RX: Handle 21 flags 0x02 dlen 21               #140 [hci1] 11.492125
      SMP: Pairing Random (0x04) len 16
        Random value: 9479bceb0b8e42600000000000000000
< HCI Command: Host Number of Com.. (0x03|0x0035) plen 5  #141 [hci1] 11.500802
        Num handles: 1
        Handle: 21 Address: DF:A9:FF:F6:B1:1A (OUI DF-A9-FF)
        Count: 1
< ACL Data TX: Handle 21 flags 0x00 dlen 21               #142 [hci1] 11.500903
      SMP: Pairing Random (0x04) len 16
        Random value: 5c2fff312cdf99c9491988e877355a9a
> HCI Event: Number of Completed Packets (0x13) plen 5    #143 [hci1] 11.666649
        Num handles: 1
        Handle: 21 Address: DF:A9:FF:F6:B1:1A (OUI DF-A9-FF)
        Count: 1
        #142: len 21 (1 Kb/s)
        Latency: 165 msec (66-174 msec ~168 msec)
> ACL Data RX: Handle 21 flags 0x02 dlen 21               #144 [hci1] 11.754527
      SMP: Pairing Confirm (0x03) len 16
        Confim value: c0561f85290b2ab7b0d129721ae4768d
< HCI Command: Host Number of Com.. (0x03|0x0035) plen 5  #145 [hci1] 11.760349
        Num handles: 1
        Handle: 21 Address: DF:A9:FF:F6:B1:1A (OUI DF-A9-FF)
        Count: 1
< ACL Data TX: Handle 21 flags 0x00 dlen 21               #146 [hci1] 11.760491
      SMP: Pairing Confirm (0x03) len 16
        Confim value: 54bbef0dea473a24b9f7b7522bcbb8cc
> HCI Event: Number of Completed Packets (0x13) plen 5    #147 [hci1] 11.929558
        Num handles: 1
        Handle: 21 Address: DF:A9:FF:F6:B1:1A (OUI DF-A9-FF)
        Count: 1
        #146: len 21 (0 Kb/s)
        Latency: 169 msec (66-174 msec ~168 msec)
> ACL Data RX: Handle 21 flags 0x02 dlen 21               #148 [hci1] 11.929720
      SMP: Pairing Random (0x04) len 16
        Random value: 900f491e0866ab990000000000000000
< HCI Command: Host Number of Com.. (0x03|0x0035) plen 5  #149 [hci1] 11.940864
        Num handles: 1
        Handle: 21 Address: DF:A9:FF:F6:B1:1A (OUI DF-A9-FF)
        Count: 1
< ACL Data TX: Handle 21 flags 0x00 dlen 21               #150 [hci1] 11.940938
      SMP: Pairing Random (0x04) len 16
        Random value: c629a3a987d808e808655d558dfc1155
> HCI Event: Number of Completed Packets (0x13) plen 5    #151 [hci1] 12.104321
        Num handles: 1
        Handle: 21 Address: DF:A9:FF:F6:B1:1A (OUI DF-A9-FF)
        Count: 1
        #150: len 21 (1 Kb/s)
        Latency: 163 msec (66-174 msec ~165 msec)
> ACL Data RX: Handle 21 flags 0x02 dlen 21               #152 [hci1] 12.192056
      SMP: Pairing Confirm (0x03) len 16
        Confim value: 00ded3ba7ca77f0f46c8948f4113e1d9
< HCI Command: Host Number of Com.. (0x03|0x0035) plen 5  #153 [hci1] 12.200320
        Num handles: 1
        Handle: 21 Address: DF:A9:FF:F6:B1:1A (OUI DF-A9-FF)
        Count: 1
< ACL Data TX: Handle 21 flags 0x00 dlen 21               #154 [hci1] 12.200420
      SMP: Pairing Confirm (0x03) len 16
        Confim value: 7871d87cd9b69158fc49766c9cf75704
> HCI Event: Number of Completed Packets (0x13) plen 5    #155 [hci1] 12.366780
        Num handles: 1
        Handle: 21 Address: DF:A9:FF:F6:B1:1A (OUI DF-A9-FF)
        Count: 1
        #154: len 21 (1 Kb/s)
        Latency: 166 msec (66-174 msec ~166 msec)
> ACL Data RX: Handle 21 flags 0x02 dlen 21               #156 [hci1] 12.367113
      SMP: Pairing Random (0x04) len 16
        Random value: 33758a73bced38810000000000000000
< HCI Command: Host Number of Com.. (0x03|0x0035) plen 5  #157 [hci1] 12.380359
        Num handles: 1
        Handle: 21 Address: DF:A9:FF:F6:B1:1A (OUI DF-A9-FF)
        Count: 1
< ACL Data TX: Handle 21 flags 0x00 dlen 21               #158 [hci1] 12.380433
      SMP: Pairing Random (0x04) len 16
        Random value: 92f20f6ad8f13724432c7fd6001c45ff
> HCI Event: Number of Completed Packets (0x13) plen 5    #159 [hci1] 12.541597
        Num handles: 1
        Handle: 21 Address: DF:A9:FF:F6:B1:1A (OUI DF-A9-FF)
        Count: 1
        #158: len 21 (1 Kb/s)
        Latency: 161 msec (66-174 msec ~163 msec)
> ACL Data RX: Handle 21 flags 0x02 dlen 21               #160 [hci1] 12.629477
      SMP: Pairing Confirm (0x03) len 16
        Confim value: 714e8d36ada01cb14ba2642daddd2408
< HCI Command: Host Number of Com.. (0x03|0x0035) plen 5  #161 [hci1] 12.640613
        Num handles: 1
        Handle: 21 Address: DF:A9:FF:F6:B1:1A (OUI DF-A9-FF)
        Count: 1
< ACL Data TX: Handle 21 flags 0x00 dlen 21               #162 [hci1] 12.640779
      SMP: Pairing Confirm (0x03) len 16
        Confim value: 6267fd97e825d681ff62c30c45cc6fe7
> HCI Event: Number of Completed Packets (0x13) plen 5    #163 [hci1] 12.804371
        Num handles: 1
        Handle: 21 Address: DF:A9:FF:F6:B1:1A (OUI DF-A9-FF)
        Count: 1
        #162: len 21 (1 Kb/s)
        Latency: 163 msec (66-174 msec ~163 msec)
> ACL Data RX: Handle 21 flags 0x02 dlen 21               #164 [hci1] 12.804657
      SMP: Pairing Random (0x04) len 16
        Random value: a117c2de361542f20000000000000000
< HCI Command: Host Number of Com.. (0x03|0x0035) plen 5  #165 [hci1] 12.820568
        Num handles: 1
        Handle: 21 Address: DF:A9:FF:F6:B1:1A (OUI DF-A9-FF)
        Count: 1
< ACL Data TX: Handle 21 flags 0x00 dlen 21               #166 [hci1] 12.820602
      SMP: Pairing Random (0x04) len 16
        Random value: 23ac32ebbb5e14c8a6b9622f296d277f
> HCI Event: Number of Completed Packets (0x13) plen 5    #167 [hci1] 12.979125
        Num handles: 1
        Handle: 21 Address: DF:A9:FF:F6:B1:1A (OUI DF-A9-FF)
        Count: 1
        #166: len 21 (1 Kb/s)
        Latency: 158 msec (66-174 msec ~161 msec)
> ACL Data RX: Handle 21 flags 0x02 dlen 21               #168 [hci1] 13.067028
      SMP: Pairing Confirm (0x03) len 16
        Confim value: 77b4c9e2d15fa3dc156396fcb67502d9
< HCI Command: Host Number of Com.. (0x03|0x0035) plen 5  #169 [hci1] 13.080608
        Num handles: 1
        Handle: 21 Address: DF:A9:FF:F6:B1:1A (OUI DF-A9-FF)
        Count: 1
< ACL Data TX: Handle 21 flags 0x00 dlen 21               #170 [hci1] 13.080828
      SMP: Pairing Confirm (0x03) len 16
        Confim value: a40a2b4cf2a5d2afe4a6c91f723aabed
> HCI Event: Number of Completed Packets (0x13) plen 5    #171 [hci1] 13.241754
        Num handles: 1
        Handle: 21 Address: DF:A9:FF:F6:B1:1A (OUI DF-A9-FF)
        Count: 1
        #170: len 21 (1 Kb/s)
        Latency: 160 msec (66-174 msec ~161 msec)
> ACL Data RX: Handle 21 flags 0x02 dlen 21               #172 [hci1] 13.242057
      SMP: Pairing Random (0x04) len 16
        Random value: 386af2d37fd5c0470000000000000000
< HCI Command: Host Number of Com.. (0x03|0x0035) plen 5  #173 [hci1] 13.260697
        Num handles: 1
        Handle: 21 Address: DF:A9:FF:F6:B1:1A (OUI DF-A9-FF)
        Count: 1
< ACL Data TX: Handle 21 flags 0x00 dlen 21               #174 [hci1] 13.260824
      SMP: Pairing Random (0x04) len 16
        Random value: 297efe85e67448a15f56bd27e3a3cf1d
> HCI Event: Number of Completed Packets (0x13) plen 5    #175 [hci1] 13.416628
        Num handles: 1
        Handle: 21 Address: DF:A9:FF:F6:B1:1A (OUI DF-A9-FF)
        Count: 1
        #174: len 21 (1 Kb/s)
        Latency: 155 msec (66-174 msec ~158 msec)
> ACL Data RX: Handle 21 flags 0x02 dlen 21               #176 [hci1] 13.504528
      SMP: Pairing Confirm (0x03) len 16
        Confim value: 1cb8eaa2e358132d0953d53d03c7a0d0
< HCI Command: Host Number of Com.. (0x03|0x0035) plen 5  #177 [hci1] 13.520649
        Num handles: 1
        Handle: 21 Address: DF:A9:FF:F6:B1:1A (OUI DF-A9-FF)
        Count: 1
< ACL Data TX: Handle 21 flags 0x00 dlen 21               #178 [hci1] 13.520897
      SMP: Pairing Confirm (0x03) len 16
        Confim value: 66379c3b6605b507a48f5864d6365ba1
> HCI Event: Number of Completed Packets (0x13) plen 5    #179 [hci1] 13.679440
        Num handles: 1
        Handle: 21 Address: DF:A9:FF:F6:B1:1A (OUI DF-A9-FF)
        Count: 1
        #178: len 21 (1 Kb/s)
        Latency: 158 msec (66-174 msec ~158 msec)
> ACL Data RX: Handle 21 flags 0x02 dlen 21               #180 [hci1] 13.679614
      SMP: Pairing Random (0x04) len 16
        Random value: 887a72d5abd9d0fc0000000000000000
< HCI Command: Host Number of Com.. (0x03|0x0035) plen 5  #181 [hci1] 13.680622
        Num handles: 1
        Handle: 21 Address: DF:A9:FF:F6:B1:1A (OUI DF-A9-FF)
        Count: 1
< ACL Data TX: Handle 21 flags 0x00 dlen 21               #182 [hci1] 13.680690
      SMP: Pairing Random (0x04) len 16
        Random value: 25a9493fd3ce4faf02be7293595bb7c6
> HCI Event: Number of Completed Packets (0x13) plen 5    #183 [hci1] 13.854122
        Num handles: 1
        Handle: 21 Address: DF:A9:FF:F6:B1:1A (OUI DF-A9-FF)
        Count: 1
        #182: len 21 (0 Kb/s)
        Latency: 173 msec (66-174 msec ~165 msec)
> ACL Data RX: Handle 21 flags 0x02 dlen 21               #184 [hci1] 13.941905
      SMP: Pairing Confirm (0x03) len 16
        Confim value: da12019186238381be1286446ff6e5a3
< HCI Command: Host Number of Com.. (0x03|0x0035) plen 5  #185 [hci1] 13.960592
        Num handles: 1
        Handle: 21 Address: DF:A9:FF:F6:B1:1A (OUI DF-A9-FF)
        Count: 1
< ACL Data TX: Handle 21 flags 0x00 dlen 21               #186 [hci1] 13.960784
      SMP: Pairing Confirm (0x03) len 16
        Confim value: 948b78a8c8095a4a058cb0e4307fc848
> HCI Event: Number of Completed Packets (0x13) plen 5    #187 [hci1] 14.116747
        Num handles: 1
        Handle: 21 Address: DF:A9:FF:F6:B1:1A (OUI DF-A9-FF)
        Count: 1
        #186: len 21 (1 Kb/s)
        Latency: 155 msec (66-174 msec ~160 msec)
> ACL Data RX: Handle 21 flags 0x02 dlen 21               #188 [hci1] 14.117187
      SMP: Pairing Random (0x04) len 16
        Random value: fa9364537c80c7460000000000000000
< HCI Command: Host Number of Com.. (0x03|0x0035) plen 5  #189 [hci1] 14.120674
        Num handles: 1
        Handle: 21 Address: DF:A9:FF:F6:B1:1A (OUI DF-A9-FF)
        Count: 1
< ACL Data TX: Handle 21 flags 0x00 dlen 21               #190 [hci1] 14.120774
      SMP: Pairing Random (0x04) len 16
        Random value: 58f6b41f855a6f6c3560debd84e2affc
> HCI Event: Number of Completed Packets (0x13) plen 5    #191 [hci1] 14.291590
        Num handles: 1
        Handle: 21 Address: DF:A9:FF:F6:B1:1A (OUI DF-A9-FF)
        Count: 1
        #190: len 21 (0 Kb/s)
        Latency: 170 msec (66-174 msec ~165 msec)
> ACL Data RX: Handle 21 flags 0x02 dlen 21               #192 [hci1] 14.379427
      SMP: Pairing Confirm (0x03) len 16
        Confim value: 58c169631a7d45077c92c01716956f63
< HCI Command: Host Number of Com.. (0x03|0x0035) plen 5  #193 [hci1] 14.380289
        Num handles: 1
        Handle: 21 Address: DF:A9:FF:F6:B1:1A (OUI DF-A9-FF)
        Count: 1
< ACL Data TX: Handle 21 flags 0x00 dlen 21               #194 [hci1] 14.380361
      SMP: Pairing Confirm (0x03) len 16
        Confim value: 0cf6d8173bb30a5d10f138e3e671c085
> HCI Event: Number of Completed Packets (0x13) plen 5    #195 [hci1] 14.554322
        Num handles: 1
        Handle: 21 Address: DF:A9:FF:F6:B1:1A (OUI DF-A9-FF)
        Count: 1
        #194: len 21 (0 Kb/s)
        Latency: 173 msec (66-174 msec ~169 msec)
> ACL Data RX: Handle 21 flags 0x02 dlen 21               #196 [hci1] 14.554638
      SMP: Pairing Random (0x04) len 16
        Random value: b747d78d2f9536040000000000000000
< HCI Command: Host Number of Com.. (0x03|0x0035) plen 5  #197 [hci1] 14.560842
        Num handles: 1
        Handle: 21 Address: DF:A9:FF:F6:B1:1A (OUI DF-A9-FF)
        Count: 1
< ACL Data TX: Handle 21 flags 0x00 dlen 21               #198 [hci1] 14.560959
      SMP: Pairing Random (0x04) len 16
        Random value: b67e7216d5bf664139eda2b542549666
> HCI Event: Number of Completed Packets (0x13) plen 5    #199 [hci1] 14.729066
        Num handles: 1
        Handle: 21 Address: DF:A9:FF:F6:B1:1A (OUI DF-A9-FF)
        Count: 1
        #198: len 21 (1 Kb/s)
        Latency: 168 msec (66-174 msec ~169 msec)
> ACL Data RX: Handle 21 flags 0x02 dlen 21               #200 [hci1] 14.816928
      SMP: Pairing Confirm (0x03) len 16
        Confim value: d47827af59c6e430bfa38ea48c76ad36
< HCI Command: Host Number of Com.. (0x03|0x0035) plen 5  #201 [hci1] 14.820342
        Num handles: 1
        Handle: 21 Address: DF:A9:FF:F6:B1:1A (OUI DF-A9-FF)
        Count: 1
< ACL Data TX: Handle 21 flags 0x00 dlen 21               #202 [hci1] 14.820482
      SMP: Pairing Confirm (0x03) len 16
        Confim value: 13e063d66c4c99433d3a2adbbf757741
> HCI Event: Number of Completed Packets (0x13) plen 5    #203 [hci1] 14.991796
        Num handles: 1
        Handle: 21 Address: DF:A9:FF:F6:B1:1A (OUI DF-A9-FF)
        Count: 1
        #202: len 21 (0 Kb/s)
        Latency: 171 msec (66-174 msec ~170 msec)
> ACL Data RX: Handle 21 flags 0x02 dlen 21               #204 [hci1] 14.992060
      SMP: Pairing Random (0x04) len 16
        Random value: 32cb95a42f7f539e0000000000000000
< HCI Command: Host Number of Com.. (0x03|0x0035) plen 5  #205 [hci1] 15.000893
        Num handles: 1
        Handle: 21 Address: DF:A9:FF:F6:B1:1A (OUI DF-A9-FF)
        Count: 1
< ACL Data TX: Handle 21 flags 0x00 dlen 21               #206 [hci1] 15.001016
      SMP: Pairing Random (0x04) len 16
        Random value: ed17f76500c95219dd01e09d1e63f87b
> HCI Event: Number of Completed Packets (0x13) plen 5    #207 [hci1] 15.166527
        Num handles: 1
        Handle: 21 Address: DF:A9:FF:F6:B1:1A (OUI DF-A9-FF)
        Count: 1
        #206: len 21 (1 Kb/s)
        Latency: 165 msec (66-174 msec ~167 msec)
> ACL Data RX: Handle 21 flags 0x02 dlen 21               #208 [hci1] 15.254422
      SMP: Pairing Confirm (0x03) len 16
        Confim value: 94ab9cb3a149496153a0b5132bbd9abc
< HCI Command: Host Number of Com.. (0x03|0x0035) plen 5  #209 [hci1] 15.260275
        Num handles: 1
        Handle: 21 Address: DF:A9:FF:F6:B1:1A (OUI DF-A9-FF)
        Count: 1
< ACL Data TX: Handle 21 flags 0x00 dlen 21               #210 [hci1] 15.260323
      SMP: Pairing Confirm (0x03) len 16
        Confim value: 9083bbf47a6ce22493d29153892cce62
> HCI Event: Number of Completed Packets (0x13) plen 5    #211 [hci1] 15.429220
        Num handles: 1
        Handle: 21 Address: DF:A9:FF:F6:B1:1A (OUI DF-A9-FF)
        Count: 1
        #210: len 21 (1 Kb/s)
        Latency: 168 msec (66-174 msec ~168 msec)
> ACL Data RX: Handle 21 flags 0x02 dlen 21               #212 [hci1] 15.429559
      SMP: Pairing Random (0x04) len 16
        Random value: 165a7b709ca976b50000000000000000
< HCI Command: Host Number of Com.. (0x03|0x0035) plen 5  #213 [hci1] 15.440445
        Num handles: 1
        Handle: 21 Address: DF:A9:FF:F6:B1:1A (OUI DF-A9-FF)
        Count: 1
< ACL Data TX: Handle 21 flags 0x00 dlen 21               #214 [hci1] 15.440454
      SMP: Pairing Random (0x04) len 16
        Random value: 81d35d47e1f6006d79c974bd9d9e1ee3
> HCI Event: Number of Completed Packets (0x13) plen 5    #215 [hci1] 15.604065
        Num handles: 1
        Handle: 21 Address: DF:A9:FF:F6:B1:1A (OUI DF-A9-FF)
        Count: 1
        #214: len 21 (1 Kb/s)
        Latency: 163 msec (66-174 msec ~165 msec)
> ACL Data RX: Handle 21 flags 0x02 dlen 21               #216 [hci1] 15.691908
      SMP: Pairing Confirm (0x03) len 16
        Confim value: 34ead640ee41036e9be0a08bf853e93d
< HCI Command: Host Number of Com.. (0x03|0x0035) plen 5  #217 [hci1] 15.700653
        Num handles: 1
        Handle: 21 Address: DF:A9:FF:F6:B1:1A (OUI DF-A9-FF)
        Count: 1
< ACL Data TX: Handle 21 flags 0x00 dlen 21               #218 [hci1] 15.700817
      SMP: Pairing Confirm (0x03) len 16
        Confim value: 6052813a0787a9f1b4239625e71d9bfb
> HCI Event: Number of Completed Packets (0x13) plen 5    #219 [hci1] 15.866786
        Num handles: 1
        Handle: 21 Address: DF:A9:FF:F6:B1:1A (OUI DF-A9-FF)
        Count: 1
        #218: len 21 (1 Kb/s)
        Latency: 165 msec (66-174 msec ~165 msec)
> ACL Data RX: Handle 21 flags 0x02 dlen 21               #220 [hci1] 15.867081
      SMP: Pairing Random (0x04) len 16
        Random value: cc3dce810fece3c20000000000000000
< HCI Command: Host Number of Com.. (0x03|0x0035) plen 5  #221 [hci1] 15.880420
        Num handles: 1
        Handle: 21 Address: DF:A9:FF:F6:B1:1A (OUI DF-A9-FF)
        Count: 1
< ACL Data TX: Handle 21 flags 0x00 dlen 21               #222 [hci1] 15.880448
      SMP: Pairing Random (0x04) len 16
        Random value: e7f7e0c2476823e41736a7e381bafb7c
> HCI Event: Number of Completed Packets (0x13) plen 5    #223 [hci1] 16.041528
        Num handles: 1
        Handle: 21 Address: DF:A9:FF:F6:B1:1A (OUI DF-A9-FF)
        Count: 1
        #222: len 21 (1 Kb/s)
        Latency: 161 msec (66-174 msec ~163 msec)
> ACL Data RX: Handle 21 flags 0x02 dlen 21               #224 [hci1] 16.129352
      SMP: Pairing Confirm (0x03) len 16
        Confim value: 28479c0e64305b58ac8541f59bfedf34
< HCI Command: Host Number of Com.. (0x03|0x0035) plen 5  #225 [hci1] 16.140525
        Num handles: 1
        Handle: 21 Address: DF:A9:FF:F6:B1:1A (OUI DF-A9-FF)
        Count: 1
< ACL Data TX: Handle 21 flags 0x00 dlen 21               #226 [hci1] 16.140673
      SMP: Pairing Confirm (0x03) len 16
        Confim value: 7d8f9e90b254b536fe1e4ee689eeb917
> HCI Event: Number of Completed Packets (0x13) plen 5    #227 [hci1] 16.304290
        Num handles: 1
        Handle: 21 Address: DF:A9:FF:F6:B1:1A (OUI DF-A9-FF)
        Count: 1
        #226: len 21 (1 Kb/s)
        Latency: 163 msec (66-174 msec ~163 msec)
> ACL Data RX: Handle 21 flags 0x02 dlen 21               #228 [hci1] 16.304439
      SMP: Pairing Random (0x04) len 16
        Random value: 25a5925f88849be50000000000000000
< HCI Command: Host Number of Com.. (0x03|0x0035) plen 5  #229 [hci1] 16.320399
        Num handles: 1
        Handle: 21 Address: DF:A9:FF:F6:B1:1A (OUI DF-A9-FF)
        Count: 1
