Bluetooth monitor ver 5.72
= Note: Linux version 6.14.0-36-generic (x86_64)                       0.796990
= Note: Bluetooth subsystem version 2.22                               0.796991
= New Index: 00:00:00:00:00:00 (Primary,UART,hci1)              [hci1] 0.796992
= New Index: 48:5F:99:8E:E0:64 (Primary,USB,hci0)               [hci0] 0.796993
= Open Index: 00:00:00:00:00:00                                 [hci1] 1.310623
= Index Info: 00:00:00:00:00:00 (Nordic Semiconductor ASA)      [hci1] 1.310642
@ USER Open: main (privileged) version 2.22            {0x0001} [hci1] 1.310650
< HCI Command: Reset (0x03|0x0003) plen 0                    #1 [hci1] 1.311778
> HCI Event: Command Complete (0x0e) plen 4                  #2 [hci1] 1.312341
      Reset (0x03|0x0003) ncmd 1
        Status: Success (0x00)
< HCI Command: Read Local Supported... (0x04|0x0003) plen 0  #3 [hci1] 1.330459
> HCI Event: Command Complete (0x0e) plen 12                 #4 [hci1] 1.331045
      Read Local Supported Features (0x04|0x0003) ncmd 1
        Status: Success (0x00)
        Features: 0x00 0x00 0x00 0x00 0x60 0x00 0x00 0x00
          BR/EDR Not Supported
          LE Supported (Controller)
< HCI Command: Read Local Version In.. (0x04|0x0001) plen 0  #5 [hci1] 1.350171
> HCI Event: Command Complete (0x0e) plen 12                 #6 [hci1] 1.350732
      Read Local Version Information (0x04|0x0001) ncmd 1
        Status: Success (0x00)
        HCI version: Reserved (0x0f) - Revision 12393 (0x3069)
        LMP version: Reserved (0x0f) - Subversion 12393 (0x3069)
        Manufacturer: Nordic Semiconductor ASA (89)
< HCI Command: Read Local Supported... (0x04|0x0002) plen 0  #7 [hci1] 1.370152
> HCI Event: Command Complete (0x0e) plen 68                 #8 [hci1] 1.371169
      Read Local Supported Commands (0x04|0x0002) ncmd 1
        Status: Success (0x00)
        Commands: 119 entries
          Disconnect (Octet 0 - Bit 5)
          Read Remote Version Information (Octet 2 - Bit 7)
          Set Event Mask (Octet 5 - Bit 6)
          Reset (Octet 5 - Bit 7)
          Read Connection Accept Timeout (Octet 7 - Bit 2)
          Write Connection Accept Timeout (Octet 7 - Bit 3)
          Read Transmit Power Level (Octet 10 - Bit 2)
          Set Controller To Host Flow Control (Octet 10 - Bit 5)
          Host Buffer Size (Octet 10 - Bit 6)
          Host Number of Completed Packets (Octet 10 - Bit 7)
          Read Local Version Information (Octet 14 - Bit 3)
          Read Local Supported Features (Octet 14 - Bit 5)
          Read BD ADDR (Octet 15 - Bit 1)
          Read RSSI (Octet 15 - Bit 5)
          Set Event Mask Page 2 (Octet 22 - Bit 2)
          LE Set Event Mask (Octet 25 - Bit 0)
          LE Read Buffer Size (Octet 25 - Bit 1)
          LE Read Local Supported Features (Octet 25 - Bit 2)
          LE Set Random Address (Octet 25 - Bit 4)
          LE Set Advertising Parameters (Octet 25 - Bit 5)
          LE Read Advertising Channel TX Power (Octet 25 - Bit 6)
          LE Set Advertising Data (Octet 25 - Bit 7)
          LE Set Scan Response Data (Octet 26 - Bit 0)
          LE Set Advertise Enable (Octet 26 - Bit 1)
          LE Set Scan Parameters (Octet 26 - Bit 2)
          LE Set Scan Enable (Octet 26 - Bit 3)
          LE Create Connection (Octet 26 - Bit 4)
          LE Create Connection Cancel (Octet 26 - Bit 5)
          LE Read Accept List Size (Octet 26 - Bit 6)
          LE Clear Accept List (Octet 26 - Bit 7)
          LE Add Device To Accept List (Octet 27 - Bit 0)
          LE Remove Device From Accept List (Octet 27 - Bit 1)
          LE Connection Update (Octet 27 - Bit 2)
          LE Set Host Channel Classification (Octet 27 - Bit 3)
          LE Read Channel Map (Octet 27 - Bit 4)
          LE Read Remote Used Features (Octet 27 - Bit 5)
          LE Encrypt (Octet 27 - Bit 6)
          LE Rand (Octet 27 - Bit 7)
          LE Start Encryption (Octet 28 - Bit 0)
          LE Long Term Key Request Reply (Octet 28 - Bit 1)
          LE Long Term Key Request Neg Reply (Octet 28 - Bit 2)
          LE Read Supported States (Octet 28 - Bit 3)
          LE Receiver Test (Octet 28 - Bit 4)
          LE Transmitter Test (Octet 28 - Bit 5)
          LE Test End (Octet 28 - Bit 6)
          Read Authenticated Payload Timeout (Octet 32 - Bit 4)
          Write Authenticated Payload Timeout (Octet 32 - Bit 5)
          LE Set Data Length (Octet 33 - Bit 6)
          LE Read Suggested Default Data Length (Octet 33 - Bit 7)
          LE Write Suggested Default Data Length (Octet 34 - Bit 0)
          LE Add Device To Resolving List (Octet 34 - Bit 3)
          LE Remove Device From Resolving List (Octet 34 - Bit 4)
          LE Clear Resolving List (Octet 34 - Bit 5)
          LE Read Resolving List Size (Octet 34 - Bit 6)
          LE Set Address Resolution Enable (Octet 35 - Bit 1)
          LE Set Resolvable Private Address Timeout (Octet 35 - Bit 2)
          LE Read Maximum Data Length (Octet 35 - Bit 3)
          LE Read PHY (Octet 35 - Bit 4)
          LE Set Default PHY (Octet 35 - Bit 5)
          LE Set PHY (Octet 35 - Bit 6)
          LE Enhanced Receiver Test (Octet 35 - Bit 7)
          LE Enhanced Transmitter Test (Octet 36 - Bit 0)
          LE Set Advertising Set Random Address (Octet 36 - Bit 1)
          LE Set Extended Advertising Parameters (Octet 36 - Bit 2)
          LE Set Extended Advertising Data (Octet 36 - Bit 3)
          LE Set Extended Scan Response Data (Octet 36 - Bit 4)
          LE Set Extended Advertising Enable (Octet 36 - Bit 5)
          LE Read Maximum Advertising Data Length (Octet 36 - Bit 6)
          LE Read Number of Supported Advertising Sets (Octet 36 - Bit 7)
          LE Remove Advertising Set (Octet 37 - Bit 0)
          LE Clear Advertising Sets (Octet 37 - Bit 1)
          LE Set Periodic Advertising Parameters (Octet 37 - Bit 2)
          LE Set Periodic Advertising Data (Octet 37 - Bit 3)
          LE Set Periodic Advertising Enable (Octet 37 - Bit 4)
          LE Set Extended Scan Parameters (Octet 37 - Bit 5)
          LE Set Extended Scan Enable (Octet 37 - Bit 6)
          LE Extended Create Connection (Octet 37 - Bit 7)
          LE Periodic Advertising Create Sync (Octet 38 - Bit 0)
          LE Periodic Advertising Create Sync Cancel (Octet 38 - Bit 1)
          LE Periodic Advertising Terminate Sync (Octet 38 - Bit 2)
          LE Add Device To Periodic Advertiser List (Octet 38 - Bit 3)
          LE Remove Device From Periodic Advertiser List (Octet 38 - Bit 4)
          LE Clear Periodic Advertiser List (Octet 38 - Bit 5)
          LE Read Periodic Advertiser List Size (Octet 38 - Bit 6)
          LE Read Transmit Power (Octet 38 - Bit 7)
          LE Read RF Path Compensation (Octet 39 - Bit 0)
          LE Write RF Path Compensation (Octet 39 - Bit 1)
          LE Set Privacy Mode (Octet 39 - Bit 2)
          LE Periodic Advertising Receive Enable (Octet 40 - Bit 5)
          LE Periodic Advertising Sync Transfer (Octet 40 - Bit 6)
          LE Periodic Advertising Set Info Transfer (Octet 40 - Bit 7)
          LE Periodic Advertising Sync Transfer Parameters (Octet 41 - Bit 0)
          LE Set Default Periodic Advertisng Sync Transfer Parameters (Octet 41 - Bit 1)
          LE Read Buffer v2 (Octet 41 - Bit 5)
          LE Read ISO TX Sync (Octet 41 - Bit 6)
          LE Set Connected Isochronous Group Parameters (Octet 41 - Bit 7)
          LE Set Connected Isochronous Group Parameters Test (Octet 42 - Bit 0)
          LE Create Connected Isochronous Stream (Octet 42 - Bit 1)
          LE Remove Connected Isochronous Group (Octet 42 - Bit 2)
          LE Accept Connected Isochronous Stream Request (Octet 42 - Bit 3)
          LE Reject Connected Isochronous Stream Request (Octet 42 - Bit 4)
          LE Create Broadcast Isochronous Group (Octet 42 - Bit 5)
          LE Create Broadcast Isochronous Group Test (Octet 42 - Bit 6)
          LE Terminate Broadcast Isochronous Group (Octet 42 - Bit 7)
          LE Broadcast Isochronous Group Create Sync (Octet 43 - Bit 0)
          LE Broadcast Isochronous Group Terminate Sync (Octet 43 - Bit 1)
          LE Request Peer SCA (Octet 43 - Bit 2)
          LE Setup Isochronous Data Path (Octet 43 - Bit 3)
          LE Remove Isochronous Data Path (Octet 43 - Bit 4)
          LE Isochronous Transmit Test (Octet 43 - Bit 5)
          LE Isochronous Receive Test (Octet 43 - Bit 6)
          LE Isochronous Read Test Counters (Octet 43 - Bit 7)
          LE Isochronous Read Test Counters (Octet 44 - Bit 0)
          LE Set Host Feature (Octet 44 - Bit 1)
          Octet 44 - Bit 2 
          Octet 45 - Bit 6 
          Octet 46 - Bit 0 
          Octet 46 - Bit 1 
          Octet 46 - Bit 2 
< HCI Command: Host Buffer Size (0x03|0x0033) plen 7         #9 [hci1] 1.390164
        ACL MTU: 255  ACL max packet: 16
        SCO MTU: 0    SCO max packet: 0
> HCI Event: Command Complete (0x0e) plen 4                 #10 [hci1] 1.390721
      Host Buffer Size (0x03|0x0033) ncmd 1
        Status: Success (0x00)
< HCI Command: Set Controller To Ho.. (0x03|0x0031) plen 1  #11 [hci1] 1.410168
        Flow control: ACL Data Packets (0x01)
> HCI Event: Command Complete (0x0e) plen 4                 #12 [hci1] 1.410706
      Set Controller To Host Flow Control (0x03|0x0031) ncmd 1
        Status: Success (0x00)
< HCI Command: LE Read Local Suppor.. (0x08|0x0003) plen 0  #13 [hci1] 1.430154
> HCI Event: Command Complete (0x0e) plen 12                #14 [hci1] 1.430731
      LE Read Local Supported Features (0x08|0x0003) ncmd 1
        Status: Success (0x00)
        Features: 0xfd 0x79 0x00 0xf7 0x30 0x01 0x00 0x00
          LE Encryption
          Extended Reject Indication
          Peripheral-initiated Features Exchange
          LE Ping
          LE Data Packet Length Extension
          LL Privacy
          Extended Scanner Filter Policies
          LE 2M PHY
          LE Coded PHY
          LE Extended Advertising
          LE Periodic Advertising
          Channel Selection Algorithm #2
          Periodic Advertising Sync Transfer - Sender
          Periodic Advertising Sync Transfer - Recipient
          Sleep Clock Accuracy Updates
          Connected Isochronous Stream - Central
          Connected Isochronous Stream - Peripheral
          Isochronous Broadcaster
          Synchronized Receiver
          Periodic Advertising ADI support
          Connection Subrating
          Unknown features (0x0000010000000000)
< HCI Command: LE Set Host Feature (0x08|0x0074) plen 2     #15 [hci1] 1.450173
        Bit Number: 32
          Connected Isochronous Stream (Host Support)
        Bit Value: 1
> HCI Event: Command Complete (0x0e) plen 4                 #16 [hci1] 1.450706
      LE Set Host Feature (0x08|0x0074) ncmd 1
        Status: Success (0x00)
< HCI Command: LE Read Buffer v2 (0x08|0x0060) plen 0       #17 [hci1] 1.470161
> HCI Event: Command Complete (0x0e) plen 10                #18 [hci1] 1.470724
      LE Read Buffer v2 (0x08|0x0060) ncmd 1
        Status: Success (0x00)
        ACL MTU: 27
        ACL max packet: 3
        ISO MTU: 318
        ISO max packet: 3
< HCI Command: LE Read Maximum Adve.. (0x08|0x003a) plen 0  #19 [hci1] 1.490193
> HCI Event: Command Complete (0x0e) plen 6                 #20 [hci1] 1.490783
      LE Read Maximum Advertising Data Length (0x08|0x003a) ncmd 1
        Status: Success (0x00)
        Max length: 1650
< HCI Command: LE Read Supported St.. (0x08|0x001c) plen 0  #21 [hci1] 1.510162
> HCI Event: Command Complete (0x0e) plen 12                #22 [hci1] 1.510774
      LE Read Supported States (0x08|0x001c) ncmd 1
        Status: Success (0x00)
        States: 0x000003ff3e0306ff
          Non-connectable Advertising State
          Scannable Advertising State
          Connectable Advertising State
          High Duty Cycle Directed Advertising State
          Passive Scanning State
          Active Scanning State
          Initiating State
            and Connection State (Central Role)
          Connection State (Peripheral Role)
          Scannable Advertising State
            and Passive Scanning State
          Connectable Advertising State
            and Passive Scanning State
          Non-connectable Advertising State
            and Initiating State
          Scannable Advertising State
            and Initiating State
          Active Scanning State
            and Connection State (Central Role)
          Passive Scanning State
            and Connection State (Peripheral Role)
          Active Scanning State
            and Connection State (Peripheral Role)
          Initiating State
            and Connection State (Central Role)
            and Central Role & Central Role
          Low Duty Cycle Directed Advertising State
          Connectable Advertising State
            and Initiating State
            and Central Role & Peripheral Role
          High Duty Cycle Directed Advertising State
            and Initiating State
            and Central Role & Peripheral Role
          Low Duty Cycle Directed Advertising State
            and Initiating State
            and Central Role & Peripheral Role
          Connectable Advertising State
            and Connection State (Central Role)
            and Central Role & Peripheral Role
          High Duty Cycle Directed Advertising State
            and Connection State (Central Role)
            and Central Role & Peripheral Role
          Low Duty Cycle Directed Advertising State
            and Connection State (Central Role)
            and Central Role & Peripheral Role
          Connectable Advertising State
            and Connection State (Peripheral Role)
            and Central Role & Peripheral Role
          High Duty Cycle Directed Advertising State
            and Connection State (Peripheral Role)
            and Peripheral Role & Peripheral Role
          Low Duty Cycle Directed Advertising State
            and Connection State (Peripheral Role)
            and Peripheral Role & Peripheral Role
          Initiating State
            and Connection State (Peripheral Role)
            and Central Role & Peripheral Role
< HCI Command: LE Read Maximum Data.. (0x08|0x002f) plen 0  #23 [hci1] 1.530159
> HCI Event: Command Complete (0x0e) plen 12                #24 [hci1] 1.530620
      LE Read Maximum Data Length (0x08|0x002f) ncmd 1
        Status: Success (0x00)
        Max TX octets: 251
        Max TX time: 2704
        Max RX octets: 251
        Max RX time: 2704
< HCI Command: LE Write Suggested D.. (0x08|0x0024) plen 4  #25 [hci1] 1.550162
        TX octets: 251
        TX time: 2704
> HCI Event: Command Complete (0x0e) plen 4                 #26 [hci1] 1.550720
      LE Write Suggested Default Data Length (0x08|0x0024) ncmd 1
        Status: Success (0x00)
< HCI Command: LE Read Resolving Li.. (0x08|0x002a) plen 0  #27 [hci1] 1.570171
> HCI Event: Command Complete (0x0e) plen 5                 #28 [hci1] 1.570632
      LE Read Resolving List Size (0x08|0x002a) ncmd 1
        Status: Success (0x00)
        Size: 8
< HCI Command: LE Set Event Mask (0x08|0x0001) plen 8       #29 [hci1] 1.590176
        Mask: 0x000002023f87fa5e
          LE Advertising Report
          LE Connection Update Complete
          LE Read Remote Used Features Complete
          LE Long Term Key Request
          LE Data Length Change
          LE Enhanced Connection Complete
          LE PHY Update Complete
          LE Extended Advertising Report
          LE Periodic Advertising Sync Established
          LE Periodic Advertising Report
          LE Periodic Advertising Sync Lost
          LE Extended Scan Timeout
          LE Extended Advertising Set Terminated
          LE Scan Request Received
          LE Periodic Advertising Sync Transfer Rvc
          LE CIS Established
          LE CIS Request
          LE Create BIG Complete
          LE Terminate BIG Complete
          LE BIG Sync Estabilished Complete
          LE BIG Sync Lost
          LE BIG Info Advertising Report
          Unknown mask (0x0000020000000000)
> HCI Event: Command Complete (0x0e) plen 4                 #30 [hci1] 1.590766
      LE Set Event Mask (0x08|0x0001) ncmd 1
        Status: Success (0x00)
< HCI Command: Set Event Mask (0x03|0x0001) plen 8          #31 [hci1] 1.610179
        Mask: 0x2000800002008890
          Disconnection Complete
          Encryption Change
          Read Remote Version Information Complete
          Hardware Error
          Data Buffer Overflow
          Encryption Key Refresh Complete
          LE Meta
> HCI Event: Command Complete (0x0e) plen 4                 #32 [hci1] 1.610726
      Set Event Mask (0x03|0x0001) ncmd 1
        Status: Success (0x00)
< HCI Command: Read BD ADDR (0x04|0x0009) plen 0            #33 [hci1] 1.630168
> HCI Event: Command Complete (0x0e) plen 10                #34 [hci1] 1.630652
      Read BD ADDR (0x04|0x0009) ncmd 1
        Status: Success (0x00)
        Address: 00:00:00:00:00:00 (OUI 00-00-00)
< HCI Command: LE Set Random Address (0x08|0x0005) plen 6   #35 [hci1] 1.650176
        Address: D5:B6:CC:31:DB:3B (Static)
> HCI Event: Command Complete (0x0e) plen 4                 #36 [hci1] 1.650716
      LE Set Random Address (0x08|0x0005) ncmd 1
        Status: Success (0x00)
< HCI Command: LE Set Extended Adv.. (0x08|0x0036) plen 25  #37 [hci1] 4.180292
        Handle: 0x00
        Properties: 0x0013
          Connectable
          Scannable
          Use legacy advertising PDUs: ADV_IND
        Min advertising interval: 100.000 msec (0x00a0)
        Max advertising interval: 150.000 msec (0x00f0)
        Channel map: 37, 38, 39 (0x07)
        Own address type: Random (0x01)
        Peer address type: Public (0x00)
        Peer address: 00:00:00:00:00:00 (OUI 00-00-00)
        Filter policy: Allow Scan Request from Any, Allow Connect Request from Any (0x00)
        TX power: Host has no preference (0x7f)
        Primary PHY: LE 1M (0x01)
        Secondary max skip: 0x00
        Secondary PHY: LE 1M (0x01)
        SID: 0x00
        Scan request notifications: Disabled (0x00)
> HCI Event: Command Complete (0x0e) plen 5                 #38 [hci1] 4.181046
      LE Set Extended Advertising Parameters (0x08|0x0036) ncmd 1
        Status: Success (0x00)
        TX power (selected): 0 dbm (0x00)
< HCI Command: LE Set Advertising S.. (0x08|0x0035) plen 7  #39 [hci1] 4.190204
        Advertising handle: 0x00
        Advertising random address: D5:B6:CC:31:DB:3B (Static)
> HCI Event: Command Complete (0x0e) plen 4                 #40 [hci1] 4.190705
      LE Set Advertising Set Random Address (0x08|0x0035) ncmd 1
        Status: Success (0x00)
< HCI Command: LE Set Extended Adv.. (0x08|0x0037) plen 22  #41 [hci1] 4.210144
        Handle: 0x00
        Operation: Complete extended advertising data (0x03)
        Fragment preference: Minimize fragmentation (0x01)
        Data length: 0x12
        Flags: 0x06
          LE General Discoverable Mode
          BR/EDR Not Supported
        Name (complete): Tester_F6B11A
> HCI Event: Command Complete (0x0e) plen 4                 #42 [hci1] 4.210922
      LE Set Extended Advertising Data (0x08|0x0037) ncmd 1
        Status: Success (0x00)
< HCI Command: LE Set Extended Scan.. (0x08|0x0038) plen 4  #43 [hci1] 4.230134
        Handle: 0x00
        Operation: Complete scan response data (0x03)
        Fragment preference: Minimize fragmentation (0x01)
        Data length: 0x00
> HCI Event: Command Complete (0x0e) plen 4                 #44 [hci1] 4.230682
      LE Set Extended Scan Response Data (0x08|0x0038) ncmd 1
        Status: Success (0x00)
< HCI Command: LE Set Extended Adve.. (0x08|0x0039) plen 6  #45 [hci1] 4.250136
        Extended advertising: Enabled (0x01)
        Number of sets: 1 (0x01)
        Entry 0
          Handle: 0x00
          Duration: 0 ms (0x00)
          Max ext adv events: 0
> HCI Event: Command Complete (0x0e) plen 4                 #46 [hci1] 4.250807
      LE Set Extended Advertising Enable (0x08|0x0039) ncmd 1
        Status: Success (0x00)
> HCI Event: LE Meta Event (0x3e) plen 31                   #47 [hci1] 4.363136
      LE Enhanced Connection Complete (0x0a)
        Status: Success (0x00)
        Handle: 1011
        Role: Peripheral (0x01)
        Peer address type: Public (0x00)
        Peer address: DF:A9:FF:F6:B1:1A (OUI DF-A9-FF)
        Local resolvable private address: 00:00:00:00:00:00 (Non-Resolvable)
        Peer resolvable private address: 00:00:00:00:00:00 (Non-Resolvable)
        Connection interval: 87.50 msec (0x0046)
        Connection latency: 0 (0x0000)
        Supervision timeout: 25120 msec (0x09d0)
        Central clock accuracy: 0x01
> HCI Event: LE Meta Event (0x3e) plen 6                    #48 [hci1] 4.363267
      LE Advertising Set Terminated (0x12)
        Status: Success (0x00)
        Handle: 0
        Connection handle: 1011
        Number of completed extended advertising events: 0
< HCI Command: LE Read Remote Used... (0x08|0x0016) plen 2  #49 [hci1] 4.370448
        Handle: 1011 Address: DF:A9:FF:F6:B1:1A (OUI DF-A9-FF)
< ACL Data TX: Handle 1011 flags 0x00 dlen 7                #50 [hci1] 4.370457
      ATT: Exchange MTU Request (0x02) len 2
        Client RX MTU: 251
> HCI Event: Command Status (0x0f) plen 4                   #51 [hci1] 4.370957
      LE Read Remote Used Features (0x08|0x0016) ncmd 1
        Status: Success (0x00)
> HCI Event: Number of Completed Packets (0x13) plen 5      #52 [hci1] 4.539256
        Num handles: 1
        Handle: 1011 Address: DF:A9:FF:F6:B1:1A (OUI DF-A9-FF)
        Count: 1
        #50: len 7 (0 Kb/s)
        Latency: 168 msec (168-168 msec ~168 msec)
> HCI Event: LE Meta Event (0x3e) plen 12                   #53 [hci1] 4.627105
      LE Read Remote Used Features (0x04)
        Status: Success (0x00)
        Handle: 1011 Address: DF:A9:FF:F6:B1:1A (OUI DF-A9-FF)
        Features: 0x2d 0x49 0x00 0xf7 0x67 0xd8 0x00 0x00
          LE Encryption
          Extended Reject Indication
          Peripheral-initiated Features Exchange
          LE Data Packet Length Extension
          LE 2M PHY
          LE Coded PHY
          Channel Selection Algorithm #2
          Periodic Advertising Sync Transfer - Sender
          Periodic Advertising Sync Transfer - Recipient
          Sleep Clock Accuracy Updates
          Connected Isochronous Stream - Central
          Connected Isochronous Stream - Peripheral
          Isochronous Broadcaster
          Synchronized Receiver
          Connected Isochronous Stream (Host Support)
          LE Power Control Request
          LE Power Control Request
          Connection Subrating
          Connection Subrating (Host Support)
          Unknown features (0x0000d80000000000)
> ACL Data RX: Handle 1011 flags 0x02 dlen 11               #54 [hci1] 7.076795
      SMP: Pairing Request (0x01) len 6
        IO capability: KeyboardDisplay (0x04)
        OOB data: Authentication data not present (0x00)
        Authentication requirement: Bonding, MITM, SC, No Keypresses (0x0d)
        Max encryption key size: 16
        Initiator key distribution: EncKey IdKey (0x03)
        Responder key distribution: EncKey IdKey Sign (0x07)
> ACL Data RX: Handle 1011 flags 0x02 dlen 7                #55 [hci1] 7.077159
      ATT: Exchange MTU Response (0x03) len 2
        Server RX MTU: 23
< HCI Command: Host Number of Compl.. (0x03|0x0035) plen 5  #56 [hci1] 7.090612
        Num handles: 1
        Handle: 1011 Address: DF:A9:FF:F6:B1:1A (OUI DF-A9-FF)
        Count: 1
< ACL Data TX: Handle 1011 flags 0x00 dlen 11               #57 [hci1] 7.090796
      SMP: Pairing Response (0x02) len 6
        IO capability: DisplayOnly (0x00)
        OOB data: Authentication data not present (0x00)
        Authentication requirement: Bonding, No MITM, SC, No Keypresses (0x09)
        Max encryption key size: 16
        Initiator key distribution: IdKey (0x02)
        Responder key distribution: <none> (0x00)
< HCI Command: Host Number of Compl.. (0x03|0x0035) plen 5  #58 [hci1] 7.090978
        Num handles: 1
        Handle: 1011 Address: DF:A9:FF:F6:B1:1A (OUI DF-A9-FF)
        Count: 1
> HCI Event: Number of Completed Packets (0x13) plen 5      #59 [hci1] 7.251802
        Num handles: 1
        Handle: 1011 Address: DF:A9:FF:F6:B1:1A (OUI DF-A9-FF)
        Count: 1
        #57: len 11 (0 Kb/s)
        Latency: 161 msec (161-168 msec ~164 msec)
> ACL Data RX: Handle 1011 flags 0x02 dlen 27               #60 [hci1] 7.252117
> ACL Data RX: Handle 1011 flags 0x01 dlen 27               #61 [hci1] 7.252636
> ACL Data RX: Handle 1011 flags 0x01 dlen 15               #62 [hci1] 7.253171
      SMP: Pairing Public Key (0x0c) len 64
        X: 0d1f446c475bed7acbeca297c6b1bd8f778523d453680c86b31377dd4201475a
        Y: b235f39d54cd5a98f48992b8c6899d91f80bd8143b8b3331fc0f8fe8dfd2b29e
< HCI Command: Host Number of Compl.. (0x03|0x0035) plen 5  #63 [hci1] 7.270643
        Num handles: 1
        Handle: 1011 Address: DF:A9:FF:F6:B1:1A (OUI DF-A9-FF)
        Count: 1
< HCI Command: Host Number of Compl.. (0x03|0x0035) plen 5  #64 [hci1] 7.270653
        Num handles: 1
        Handle: 1011 Address: DF:A9:FF:F6:B1:1A (OUI DF-A9-FF)
        Count: 1
< HCI Command: Host Number of Compl.. (0x03|0x0035) plen 5  #65 [hci1] 7.270788
        Num handles: 1
        Handle: 1011 Address: DF:A9:FF:F6:B1:1A (OUI DF-A9-FF)
        Count: 1
< ACL Data TX: Handle 1011 flags 0x00 dlen 27               #66 [hci1] 7.270867
< ACL Data TX: Handle 1011 flags 0x01 dlen 27               #67 [hci1] 7.270873
< ACL Data TX: Handle 1011 flags 0x01 dlen 15               #68 [hci1] 7.270874
      SMP: Pairing Public Key (0x0c) len 64
        X: 98308440221e2d910f0e54b71e7ec652857aa9b5a0dc65028824cc19db1226e9
        Y: 67a4816bcb62efb21701e31fdb27561a6217575fb007a8bbdabe7e28b6f68482
> HCI Event: Number of Completed Packets (0x13) plen 5      #69 [hci1] 7.339800
        Num handles: 1
        Handle: 1011 Address: DF:A9:FF:F6:B1:1A (OUI DF-A9-FF)
        Count: 1
        #66: len 27 (3 Kb/s)
        Latency: 68 msec (68-168 msec ~116 msec)
> HCI Event: Number of Completed Packets (0x13) plen 5      #70 [hci1] 7.340403
        Num handles: 1
        Handle: 1011 Address: DF:A9:FF:F6:B1:1A (OUI DF-A9-FF)
        Count: 1
        #67: len 27 (3 Kb/s)
        Latency: 69 msec (68-168 msec ~93 msec)
> HCI Event: Number of Completed Packets (0x13) plen 5      #71 [hci1] 7.426648
        Num handles: 1
        Handle: 1011 Address: DF:A9:FF:F6:B1:1A (OUI DF-A9-FF)
        Count: 1
        #68: len 15 (0 Kb/s)
        Latency: 155 msec (68-168 msec ~124 msec)
> ACL Data RX: Handle 1011 flags 0x02 dlen 21               #72 [hci1] 8.389308
      SMP: Pairing Confirm (0x03) len 16
        Confim value: 539285ee8fc6bfd4836f8a046b741513
< HCI Command: Host Number of Compl.. (0x03|0x0035) plen 5  #73 [hci1] 8.390805
        Num handles: 1
        Handle: 1011 Address: DF:A9:FF:F6:B1:1A (OUI DF-A9-FF)
        Count: 1
< ACL Data TX: Handle 1011 flags 0x00 dlen 21               #74 [hci1] 8.390829
      SMP: Pairing Confirm (0x03) len 16
        Confim value: 4c844b4a64dd67715a378909cdcb18b1
> HCI Event: Number of Completed Packets (0x13) plen 5      #75 [hci1] 8.564153
        Num handles: 1
        Handle: 1011 Address: DF:A9:FF:F6:B1:1A (OUI DF-A9-FF)
        Count: 1
        #74: len 21 (0 Kb/s)
        Latency: 173 msec (68-173 msec ~148 msec)
> ACL Data RX: Handle 1011 flags 0x02 dlen 21               #76 [hci1] 8.564525
      SMP: Pairing Random (0x04) len 16
        Random value: f150f1c39b73e4910000000000000000
< HCI Command: Host Number of Compl.. (0x03|0x0035) plen 5  #77 [hci1] 8.570250
        Num handles: 1
        Handle: 1011 Address: DF:A9:FF:F6:B1:1A (OUI DF-A9-FF)
        Count: 1
< ACL Data TX: Handle 1011 flags 0x00 dlen 21               #78 [hci1] 8.570783
      SMP: Pairing Random (0x04) len 16
        Random value: 8e6108f966a694cbe26df70bb96773e6
> HCI Event: Number of Completed Packets (0x13) plen 5      #79 [hci1] 8.738963
        Num handles: 1
        Handle: 1011 Address: DF:A9:FF:F6:B1:1A (OUI DF-A9-FF)
        Count: 1
        #78: len 21 (1 Kb/s)
        Latency: 168 msec (68-173 msec ~158 msec)
> ACL Data RX: Handle 1011 flags 0x02 dlen 21               #80 [hci1] 8.826789
      SMP: Pairing Confirm (0x03) len 16
        Confim value: 98e447c6bbb42db20e1f1b5c4e68c13c
< HCI Command: Host Number of Compl.. (0x03|0x0035) plen 5  #81 [hci1] 8.830276
        Num handles: 1
        Handle: 1011 Address: DF:A9:FF:F6:B1:1A (OUI DF-A9-FF)
        Count: 1
< ACL Data TX: Handle 1011 flags 0x00 dlen 21               #82 [hci1] 8.830380
      SMP: Pairing Confirm (0x03) len 16
        Confim value: 2ae99ab4ece56c6d1c51d8932af6267d
> HCI Event: Number of Completed Packets (0x13) plen 5      #83 [hci1] 9.001838
        Num handles: 1
        Handle: 1011 Address: DF:A9:FF:F6:B1:1A (OUI DF-A9-FF)
        Count: 1
        #82: len 21 (0 Kb/s)
        Latency: 171 msec (68-173 msec ~165 msec)
> ACL Data RX: Handle 1011 flags 0x02 dlen 21               #84 [hci1] 9.001974
      SMP: Pairing Random (0x04) len 16
        Random value: 0454e224a9ee37a30000000000000000
< HCI Command: Host Number of Compl.. (0x03|0x0035) plen 5  #85 [hci1] 9.010898
        Num handles: 1
        Handle: 1011 Address: DF:A9:FF:F6:B1:1A (OUI DF-A9-FF)
        Count: 1
< ACL Data TX: Handle 1011 flags 0x00 dlen 21               #86 [hci1] 9.011000
      SMP: Pairing Random (0x04) len 16
        Random value: 4d02679f89a05211af56d8b3da64d21e
> HCI Event: Number of Completed Packets (0x13) plen 5      #87 [hci1] 9.176532
        Num handles: 1
        Handle: 1011 Address: DF:A9:FF:F6:B1:1A (OUI DF-A9-FF)
        Count: 1
        #86: len 21 (1 Kb/s)
        Latency: 165 msec (68-173 msec ~165 msec)
> ACL Data RX: Handle 1011 flags 0x02 dlen 21               #88 [hci1] 9.264396
      SMP: Pairing Confirm (0x03) len 16
        Confim value: 8776a9f4103125638f927000ec310e16
< HCI Command: Host Number of Compl.. (0x03|0x0035) plen 5  #89 [hci1] 9.270417
        Num handles: 1
        Handle: 1011 Address: DF:A9:FF:F6:B1:1A (OUI DF-A9-FF)
        Count: 1
< ACL Data TX: Handle 1011 flags 0x00 dlen 21               #90 [hci1] 9.270474
      SMP: Pairing Confirm (0x03) len 16
        Confim value: caa55c4ce67113c2c9d0a92f0302d3eb
> HCI Event: Number of Completed Packets (0x13) plen 5      #91 [hci1] 9.439214
        Num handles: 1
        Handle: 1011 Address: DF:A9:FF:F6:B1:1A (OUI DF-A9-FF)
        Count: 1
        #90: len 21 (1 Kb/s)
        Latency: 168 msec (68-173 msec ~167 msec)
> ACL Data RX: Handle 1011 flags 0x02 dlen 21               #92 [hci1] 9.439600
      SMP: Pairing Random (0x04) len 16
        Random value: bb95c5c28b93cc1e0000000000000000
< HCI Command: Host Number of Compl.. (0x03|0x0035) plen 5  #93 [hci1] 9.450602
        Num handles: 1
        Handle: 1011 Address: DF:A9:FF:F6:B1:1A (OUI DF-A9-FF)
        Count: 1
< ACL Data TX: Handle 1011 flags 0x00 dlen 21               #94 [hci1] 9.450694
      SMP: Pairing Random (0x04) len 16
        Random value: 5e8286bc235a02440d0c3424a2acf8fd
> HCI Event: Number of Completed Packets (0x13) plen 5      #95 [hci1] 9.614026
        Num handles: 1
        Handle: 1011 Address: DF:A9:FF:F6:B1:1A (OUI DF-A9-FF)
        Count: 1
        #94: len 21 (1 Kb/s)
        Latency: 163 msec (68-173 msec ~165 msec)
> ACL Data RX: Handle 1011 flags 0x02 dlen 21               #96 [hci1] 9.701837
      SMP: Pairing Confirm (0x03) len 16
        Confim value: 73f620068d9f34f201d81f89595f68e2
< HCI Command: Host Number of Compl.. (0x03|0x0035) plen 5  #97 [hci1] 9.710778
        Num handles: 1
        Handle: 1011 Address: DF:A9:FF:F6:B1:1A (OUI DF-A9-FF)
        Count: 1
< ACL Data TX: Handle 1011 flags 0x00 dlen 21               #98 [hci1] 9.710981
      SMP: Pairing Confirm (0x03) len 16
        Confim value: 22f6b717ed59d7818be5d4e35463489e
> HCI Event: Number of Completed Packets (0x13) plen 5      #99 [hci1] 9.876659
        Num handles: 1
        Handle: 1011 Address: DF:A9:FF:F6:B1:1A (OUI DF-A9-FF)
        Count: 1
        #98: len 21 (1 Kb/s)
        Latency: 165 msec (68-173 msec ~165 msec)
> ACL Data RX: Handle 1011 flags 0x02 dlen 21              #100 [hci1] 9.876957
      SMP: Pairing Random (0x04) len 16
        Random value: 2b071ba26b2809f50000000000000000
< HCI Command: Host Number of Comp.. (0x03|0x0035) plen 5  #101 [hci1] 9.890821
        Num handles: 1
        Handle: 1011 Address: DF:A9:FF:F6:B1:1A (OUI DF-A9-FF)
        Count: 1
< ACL Data TX: Handle 1011 flags 0x00 dlen 21              #102 [hci1] 9.890931
      SMP: Pairing Random (0x04) len 16
        Random value: 5c4a1bcadd27bd58e945097b00bad7ac
> HCI Event: Number of Completed Packets (0x13) plen 5    #103 [hci1] 10.051433
        Num handles: 1
        Handle: 1011 Address: DF:A9:FF:F6:B1:1A (OUI DF-A9-FF)
        Count: 1
        #102: len 21 (1 Kb/s)
        Latency: 160 msec (68-173 msec ~162 msec)
> ACL Data RX: Handle 1011 flags 0x02 dlen 21             #104 [hci1] 10.139371
      SMP: Pairing Confirm (0x03) len 16
        Confim value: e729758ad9a33cfa000a7b3ed1a02233
< HCI Command: Host Number of Com.. (0x03|0x0035) plen 5  #105 [hci1] 10.150393
        Num handles: 1
        Handle: 1011 Address: DF:A9:FF:F6:B1:1A (OUI DF-A9-FF)
        Count: 1
< ACL Data TX: Handle 1011 flags 0x00 dlen 21             #106 [hci1] 10.150400
      SMP: Pairing Confirm (0x03) len 16
        Confim value: 716060e6d38a4b50c3b1c8cea48f3adf
> HCI Event: Number of Completed Packets (0x13) plen 5    #107 [hci1] 10.314199
        Num handles: 1
        Handle: 1011 Address: DF:A9:FF:F6:B1:1A (OUI DF-A9-FF)
        Count: 1
        #106: len 21 (1 Kb/s)
        Latency: 163 msec (68-173 msec ~163 msec)
> ACL Data RX: Handle 1011 flags 0x02 dlen 21             #108 [hci1] 10.314558
      SMP: Pairing Random (0x04) len 16
        Random value: be22ded1b67655be0000000000000000
< HCI Command: Host Number of Com.. (0x03|0x0035) plen 5  #109 [hci1] 10.330540
        Num handles: 1
        Handle: 1011 Address: DF:A9:FF:F6:B1:1A (OUI DF-A9-FF)
        Count: 1
< ACL Data TX: Handle 1011 flags 0x00 dlen 21             #110 [hci1] 10.330615
      SMP: Pairing Random (0x04) len 16
        Random value: 32527e6e64e79f33b2e374394db8ab2d
> HCI Event: Number of Completed Packets (0x13) plen 5    #111 [hci1] 10.488926
        Num handles: 1
        Handle: 1011 Address: DF:A9:FF:F6:B1:1A (OUI DF-A9-FF)
        Count: 1
        #110: len 21 (1 Kb/s)
        Latency: 158 msec (68-173 msec ~160 msec)
> ACL Data RX: Handle 1011 flags 0x02 dlen 21             #112 [hci1] 10.576841
      SMP: Pairing Confirm (0x03) len 16
        Confim value: e6602f15a9c89feb068164ee1604dda8
< HCI Command: Host Number of Com.. (0x03|0x0035) plen 5  #113 [hci1] 10.590492
        Num handles: 1
        Handle: 1011 Address: DF:A9:FF:F6:B1:1A (OUI DF-A9-FF)
        Count: 1
< ACL Data TX: Handle 1011 flags 0x00 dlen 21             #114 [hci1] 10.590620
      SMP: Pairing Confirm (0x03) len 16
        Confim value: 9c915df4c7d82bf7685cf1a190a53ede
> HCI Event: Number of Completed Packets (0x13) plen 5    #115 [hci1] 10.751686
        Num handles: 1
        Handle: 1011 Address: DF:A9:FF:F6:B1:1A (OUI DF-A9-FF)
        Count: 1
        #114: len 21 (1 Kb/s)
        Latency: 161 msec (68-173 msec ~160 msec)
> ACL Data RX: Handle 1011 flags 0x02 dlen 21             #116 [hci1] 10.751963
      SMP: Pairing Random (0x04) len 16
        Random value: ed649845c57f66db0000000000000000
< HCI Command: Host Number of Com.. (0x03|0x0035) plen 5  #117 [hci1] 10.770644
        Num handles: 1
        Handle: 1011 Address: DF:A9:FF:F6:B1:1A (OUI DF-A9-FF)
        Count: 1
< ACL Data TX: Handle 1011 flags 0x00 dlen 21             #118 [hci1] 10.770687
      SMP: Pairing Random (0x04) len 16
        Random value: dddbdfe2838e9a8cc6964353c850fef7
> HCI Event: Number of Completed Packets (0x13) plen 5    #119 [hci1] 10.926439
        Num handles: 1
        Handle: 1011 Address: DF:A9:FF:F6:B1:1A (OUI DF-A9-FF)
        Count: 1
        #118: len 21 (1 Kb/s)
        Latency: 155 msec (68-173 msec ~158 msec)
> ACL Data RX: Handle 1011 flags 0x02 dlen 21             #120 [hci1] 11.014324
      SMP: Pairing Confirm (0x03) len 16
        Confim value: cae542388505aea58f983a9129dea222
< HCI Command: Host Number of Com.. (0x03|0x0035) plen 5  #121 [hci1] 11.030676
        Num handles: 1
        Handle: 1011 Address: DF:A9:FF:F6:B1:1A (OUI DF-A9-FF)
        Count: 1
< ACL Data TX: Handle 1011 flags 0x00 dlen 21             #122 [hci1] 11.030902
      SMP: Pairing Confirm (0x03) len 16
        Confim value: 4872e3fccc0a1477b17b57d70d44be38
> HCI Event: Number of Completed Packets (0x13) plen 5    #123 [hci1] 11.189146
        Num handles: 1
        Handle: 1011 Address: DF:A9:FF:F6:B1:1A (OUI DF-A9-FF)
        Count: 1
        #122: len 21 (1 Kb/s)
        Latency: 158 msec (68-173 msec ~158 msec)
> ACL Data RX: Handle 1011 flags 0x02 dlen 21             #124 [hci1] 11.189461
      SMP: Pairing Random (0x04) len 16
        Random value: 1606fbbe448d043d0000000000000000
< HCI Command: Host Number of Com.. (0x03|0x0035) plen 5  #125 [hci1] 11.190417
        Num handles: 1
        Handle: 1011 Address: DF:A9:FF:F6:B1:1A (OUI DF-A9-FF)
        Count: 1
< ACL Data TX: Handle 1011 flags 0x00 dlen 21             #126 [hci1] 11.190509
      SMP: Pairing Random (0x04) len 16
        Random value: eb9f1915536596b6fc3db1c86b2b1970
> HCI Event: Number of Completed Packets (0x13) plen 5    #127 [hci1] 11.363983
        Num handles: 1
        Handle: 1011 Address: DF:A9:FF:F6:B1:1A (OUI DF-A9-FF)
        Count: 1
        #126: len 21 (0 Kb/s)
        Latency: 173 msec (68-173 msec ~165 msec)
> ACL Data RX: Handle 1011 flags 0x02 dlen 21             #128 [hci1] 11.451890
      SMP: Pairing Confirm (0x03) len 16
        Confim value: dd7497aea7848dfa1c902e9e9b1f490f
< HCI Command: Host Number of Com.. (0x03|0x0035) plen 5  #129 [hci1] 11.470893
        Num handles: 1
        Handle: 1011 Address: DF:A9:FF:F6:B1:1A (OUI DF-A9-FF)
        Count: 1
< ACL Data TX: Handle 1011 flags 0x00 dlen 21             #130 [hci1] 11.471088
      SMP: Pairing Confirm (0x03) len 16
        Confim value: dc9c11de97e30b93018f921dea6f483d
> HCI Event: Number of Completed Packets (0x13) plen 5    #131 [hci1] 11.626602
        Num handles: 1
        Handle: 1011 Address: DF:A9:FF:F6:B1:1A (OUI DF-A9-FF)
        Count: 1
        #130: len 21 (1 Kb/s)
        Latency: 155 msec (68-173 msec ~160 msec)
> ACL Data RX: Handle 1011 flags 0x02 dlen 21             #132 [hci1] 11.626938
      SMP: Pairing Random (0x04) len 16
        Random value: b049616b153a33350000000000000000
< HCI Command: Host Number of Com.. (0x03|0x0035) plen 5  #133 [hci1] 11.630964
        Num handles: 1
        Handle: 1011 Address: DF:A9:FF:F6:B1:1A (OUI DF-A9-FF)
        Count: 1
< ACL Data TX: Handle 1011 flags 0x00 dlen 21             #134 [hci1] 11.631039
      SMP: Pairing Random (0x04) len 16
        Random value: 5c794dc9ad9f2c3f295ebd5ad5e1c3cf
> HCI Event: Number of Completed Packets (0x13) plen 5    #135 [hci1] 11.801391
        Num handles: 1
        Handle: 1011 Address: DF:A9:FF:F6:B1:1A (OUI DF-A9-FF)
        Count: 1
        #134: len 21 (0 Kb/s)
        Latency: 170 msec (68-173 msec ~165 msec)
> ACL Data RX: Handle 1011 flags 0x02 dlen 21             #136 [hci1] 11.889231
      SMP: Pairing Confirm (0x03) len 16
        Confim value: d6dd464c2790a0e364e84ef1c7ce5ffe
< HCI Command: Host Number of Com.. (0x03|0x0035) plen 5  #137 [hci1] 11.890733
        Num handles: 1
        Handle: 1011 Address: DF:A9:FF:F6:B1:1A (OUI DF-A9-FF)
        Count: 1
< ACL Data TX: Handle 1011 flags 0x00 dlen 21             #138 [hci1] 11.890901
      SMP: Pairing Confirm (0x03) len 16
        Confim value: c7725a21f1bffe2331c18e38fd890102
> HCI Event: Number of Completed Packets (0x13) plen 5    #139 [hci1] 12.064139
        Num handles: 1
        Handle: 1011 Address: DF:A9:FF:F6:B1:1A (OUI DF-A9-FF)
        Count: 1
        #138: len 21 (0 Kb/s)
        Latency: 173 msec (68-173 msec ~169 msec)
> ACL Data RX: Handle 1011 flags 0x02 dlen 21             #140 [hci1] 12.064411
      SMP: Pairing Random (0x04) len 16
        Random value: 228b67a40ac657670000000000000000
< HCI Command: Host Number of Com.. (0x03|0x0035) plen 5  #141 [hci1] 12.070960
        Num handles: 1
        Handle: 1011 Address: DF:A9:FF:F6:B1:1A (OUI DF-A9-FF)
        Count: 1
< ACL Data TX: Handle 1011 flags 0x00 dlen 21             #142 [hci1] 12.071058
      SMP: Pairing Random (0x04) len 16
        Random value: 5c2fff312cdf99c9491988e877355a9a
> HCI Event: Number of Completed Packets (0x13) plen 5    #143 [hci1] 12.238923
        Num handles: 1
        Handle: 1011 Address: DF:A9:FF:F6:B1:1A (OUI DF-A9-FF)
        Count: 1
        #142: len 21 (1 Kb/s)
        Latency: 167 msec (68-173 msec ~168 msec)
> ACL Data RX: Handle 1011 flags 0x02 dlen 21             #144 [hci1] 12.326742
      SMP: Pairing Confirm (0x03) len 16
        Confim value: 5725c93255efd2602a139d3440472804
< HCI Command: Host Number of Com.. (0x03|0x0035) plen 5  #145 [hci1] 12.330899
        Num handles: 1
        Handle: 1011 Address: DF:A9:FF:F6:B1:1A (OUI DF-A9-FF)
        Count: 1
< ACL Data TX: Handle 1011 flags 0x00 dlen 21             #146 [hci1] 12.331080
      SMP: Pairing Confirm (0x03) len 16
        Confim value: d260a694f0bad44070f82d15e4d20aa4
> HCI Event: Number of Completed Packets (0x13) plen 5    #147 [hci1] 12.501720
        Num handles: 1
        Handle: 1011 Address: DF:A9:FF:F6:B1:1A (OUI DF-A9-FF)
        Count: 1
        #146: len 21 (0 Kb/s)
        Latency: 170 msec (68-173 msec ~169 msec)
> ACL Data RX: Handle 1011 flags 0x02 dlen 21             #148 [hci1] 12.501949
      SMP: Pairing Random (0x04) len 16
        Random value: 93c66a427f02fc870000000000000000
< HCI Command: Host Number of Com.. (0x03|0x0035) plen 5  #149 [hci1] 12.510958
        Num handles: 1
        Handle: 1011 Address: DF:A9:FF:F6:B1:1A (OUI DF-A9-FF)
        Count: 1
< ACL Data TX: Handle 1011 flags 0x00 dlen 21             #150 [hci1] 12.511035
      SMP: Pairing Random (0x04) len 16
        Random value: c629a3a987d808e808655d558dfc1155
> HCI Event: Number of Completed Packets (0x13) plen 5    #151 [hci1] 12.676350
        Num handles: 1
        Handle: 1011 Address: DF:A9:FF:F6:B1:1A (OUI DF-A9-FF)
        Count: 1
        #150: len 21 (1 Kb/s)
        Latency: 165 msec (68-173 msec ~167 msec)
> ACL Data RX: Handle 1011 flags 0x02 dlen 21             #152 [hci1] 12.764256
      SMP: Pairing Confirm (0x03) len 16
        Confim value: 5931a3cc515a27cabfe13106e3196d45
< HCI Command: Host Number of Com.. (0x03|0x0035) plen 5  #153 [hci1] 12.770716
        Num handles: 1
        Handle: 1011 Address: DF:A9:FF:F6:B1:1A (OUI DF-A9-FF)
        Count: 1
< ACL Data TX: Handle 1011 flags 0x00 dlen 21             #154 [hci1] 12.770899
      SMP: Pairing Confirm (0x03) len 16
        Confim value: 8ae7ce3c1972c1f0a79a60d4f0c797fb
> HCI Event: Number of Completed Packets (0x13) plen 5    #155 [hci1] 12.939045
        Num handles: 1
        Handle: 1011 Address: DF:A9:FF:F6:B1:1A (OUI DF-A9-FF)
        Count: 1
        #154: len 21 (1 Kb/s)
        Latency: 168 msec (68-173 msec ~167 msec)
> ACL Data RX: Handle 1011 flags 0x02 dlen 21             #156 [hci1] 12.939417
      SMP: Pairing Random (0x04) len 16
        Random value: 91684b0aac4e52db0000000000000000
< HCI Command: Host Number of Com.. (0x03|0x0035) plen 5  #157 [hci1] 12.950885
        Num handles: 1
        Handle: 1011 Address: DF:A9:FF:F6:B1:1A (OUI DF-A9-FF)
        Count: 1
< ACL Data TX: Handle 1011 flags 0x00 dlen 21             #158 [hci1] 12.951024
      SMP: Pairing Random (0x04) len 16
        Random value: 92f20f6ad8f13724432c7fd6001c45ff
> HCI Event: Number of Completed Packets (0x13) plen 5    #159 [hci1] 13.113806
        Num handles: 1
        Handle: 1011 Address: DF:A9:FF:F6:B1:1A (OUI DF-A9-FF)
        Count: 1
        #158: len 21 (1 Kb/s)
        Latency: 162 msec (68-173 msec ~165 msec)
> ACL Data RX: Handle 1011 flags 0x02 dlen 21             #160 [hci1] 13.201774
      SMP: Pairing Confirm (0x03) len 16
        Confim value: 3c9e600d33f60326810a4019e9470f24
< HCI Command: Host Number of Com.. (0x03|0x0035) plen 5  #161 [hci1] 13.210860
        Num handles: 1
        Handle: 1011 Address: DF:A9:FF:F6:B1:1A (OUI DF-A9-FF)
        Count: 1
< ACL Data TX: Handle 1011 flags 0x00 dlen 21             #162 [hci1] 13.211079
      SMP: Pairing Confirm (0x03) len 16
        Confim value: c2595e450fe282a41bfdfdece47b0800
> HCI Event: Number of Completed Packets (0x13) plen 5    #163 [hci1] 13.376536
        Num handles: 1
        Handle: 1011 Address: DF:A9:FF:F6:B1:1A (OUI DF-A9-FF)
        Count: 1
        #162: len 21 (1 Kb/s)
        Latency: 165 msec (68-173 msec ~165 msec)
> ACL Data RX: Handle 1011 flags 0x02 dlen 21             #164 [hci1] 13.376887
      SMP: Pairing Random (0x04) len 16
        Random value: 1d5879b3dc44b48a0000000000000000
< HCI Command: Host Number of Com.. (0x03|0x0035) plen 5  #165 [hci1] 13.390676
        Num handles: 1
        Handle: 1011 Address: DF:A9:FF:F6:B1:1A (OUI DF-A9-FF)
        Count: 1
< ACL Data TX: Handle 1011 flags 0x00 dlen 21             #166 [hci1] 13.390723
      SMP: Pairing Random (0x04) len 16
        Random value: 23ac32ebbb5e14c8a6b9622f296d277f
> HCI Event: Number of Completed Packets (0x13) plen 5    #167 [hci1] 13.551343
        Num handles: 1
        Handle: 1011 Address: DF:A9:FF:F6:B1:1A (OUI DF-A9-FF)
        Count: 1
        #166: len 21 (1 Kb/s)
        Latency: 160 msec (68-173 msec ~162 msec)
> ACL Data RX: Handle 1011 flags 0x02 dlen 21             #168 [hci1] 13.639139
      SMP: Pairing Confirm (0x03) len 16
        Confim value: 9aa6675eb92674689949441899c2c8ef
< HCI Command: Host Number of Com.. (0x03|0x0035) plen 5  #169 [hci1] 13.650563
        Num handles: 1
        Handle: 1011 Address: DF:A9:FF:F6:B1:1A (OUI DF-A9-FF)
        Count: 1
< ACL Data TX: Handle 1011 flags 0x00 dlen 21             #170 [hci1] 13.650700
      SMP: Pairing Confirm (0x03) len 16
        Confim value: c62b0e4f117c2b8c91531a0a8b3cf89a
> HCI Event: Number of Completed Packets (0x13) plen 5    #171 [hci1] 13.814077
        Num handles: 1
        Handle: 1011 Address: DF:A9:FF:F6:B1:1A (OUI DF-A9-FF)
        Count: 1
        #170: len 21 (1 Kb/s)
        Latency: 163 msec (68-173 msec ~163 msec)
> ACL Data RX: Handle 1011 flags 0x02 dlen 21             #172 [hci1] 13.814341
      SMP: Pairing Random (0x04) len 16
        Random value: 53b2ae682c86517a0000000000000000
< HCI Command: Host Number of Com.. (0x03|0x0035) plen 5  #173 [hci1] 13.831012
        Num handles: 1
        Handle: 1011 Address: DF:A9:FF:F6:B1:1A (OUI DF-A9-FF)
        Count: 1
< ACL Data TX: Handle 1011 flags 0x00 dlen 21             #174 [hci1] 13.831089
      SMP: Pairing Random (0x04) len 16
        Random value: 297efe85e67448a15f56bd27e3a3cf1d
> HCI Event: Number of Completed Packets (0x13) plen 5    #175 [hci1] 13.988897
        Num handles: 1
        Handle: 1011 Address: DF:A9:FF:F6:B1:1A (OUI DF-A9-FF)
        Count: 1
        #174: len 21 (1 Kb/s)
        Latency: 157 msec (68-173 msec ~160 msec)
> ACL Data RX: Handle 1011 flags 0x02 dlen 21             #176 [hci1] 14.076752
      SMP: Pairing Confirm (0x03) len 16
        Confim value: 8d7da33c5e75add7cdf3525c31e1f456
< HCI Command: Host Number of Com.. (0x03|0x0035) plen 5  #177 [hci1] 14.090399
        Num handles: 1
        Handle: 1011 Address: DF:A9:FF:F6:B1:1A (OUI DF-A9-FF)
        Count: 1
< ACL Data TX: Handle 1011 flags 0x00 dlen 21             #178 [hci1] 14.090459
      SMP: Pairing Confirm (0x03) len 16
        Confim value: 228862b3376a53be1d19a0bdfc916555
> HCI Event: Number of Completed Packets (0x13) plen 5    #179 [hci1] 14.251544
        Num handles: 1
        Handle: 1011 Address: DF:A9:FF:F6:B1:1A (OUI DF-A9-FF)
        Count: 1
        #178: len 21 (1 Kb/s)
        Latency: 161 msec (68-173 msec ~160 msec)
> ACL Data RX: Handle 1011 flags 0x02 dlen 21             #180 [hci1] 14.251846
      SMP: Pairing Random (0x04) len 16
        Random value: 2bcf522a04222bb00000000000000000
< HCI Command: Host Number of Com.. (0x03|0x0035) plen 5  #181 [hci1] 14.270592
        Num handles: 1
        Handle: 1011 Address: DF:A9:FF:F6:B1:1A (OUI DF-A9-FF)
        Count: 1
< ACL Data TX: Handle 1011 flags 0x00 dlen 21             #182 [hci1] 14.270621
      SMP: Pairing Random (0x04) len 16
        Random value: 25a9493fd3ce4faf02be7293595bb7c6
> HCI Event: Number of Completed Packets (0x13) plen 5    #183 [hci1] 14.426403
        Num handles: 1
        Handle: 1011 Address: DF:A9:FF:F6:B1:1A (OUI DF-A9-FF)
        Count: 1
        #182: len 21 (1 Kb/s)
        Latency: 155 msec (68-173 msec ~158 msec)
> ACL Data RX: Handle 1011 flags 0x02 dlen 21             #184 [hci1] 14.514144
      SMP: Pairing Confirm (0x03) len 16
        Confim value: 6b989bae577a97d74f40c0060b607e8a
< HCI Command: Host Number of Com.. (0x03|0x0035) plen 5  #185 [hci1] 14.530838
        Num handles: 1
        Handle: 1011 Address: DF:A9:FF:F6:B1:1A (OUI DF-A9-FF)
        Count: 1
< ACL Data TX: Handle 1011 flags 0x00 dlen 21             #186 [hci1] 14.531108
      SMP: Pairing Confirm (0x03) len 16
        Confim value: c6847a5134f0c38f20993593e18041df
> HCI Event: Number of Completed Packets (0x13) plen 5    #187 [hci1] 14.689055
        Num handles: 1
        Handle: 1011 Address: DF:A9:FF:F6:B1:1A (OUI DF-A9-FF)
        Count: 1
        #186: len 21 (1 Kb/s)
        Latency: 157 msec (68-173 msec ~158 msec)
> ACL Data RX: Handle 1011 flags 0x02 dlen 21             #188 [hci1] 14.689313
      SMP: Pairing Random (0x04) len 16
        Random value: fa100d32d0ca4e260000000000000000
< HCI Command: Host Number of Com.. (0x03|0x0035) plen 5  #189 [hci1] 14.690916
        Num handles: 1
        Handle: 1011 Address: DF:A9:FF:F6:B1:1A (OUI DF-A9-FF)
        Count: 1
< ACL Data TX: Handle 1011 flags 0x00 dlen 21             #190 [hci1] 14.691038
      SMP: Pairing Random (0x04) len 16
        Random value: 58f6b41f855a6f6c3560debd84e2affc
> HCI Event: Number of Completed Packets (0x13) plen 5    #191 [hci1] 14.863819
        Num handles: 1
        Handle: 1011 Address: DF:A9:FF:F6:B1:1A (OUI DF-A9-FF)
        Count: 1
        #190: len 21 (0 Kb/s)
        Latency: 172 msec (68-173 msec ~165 msec)
> ACL Data RX: Handle 1011 flags 0x02 dlen 21             #192 [hci1] 14.951750
      SMP: Pairing Confirm (0x03) len 16
        Confim value: 351ad480558d28f38a115cc59320f53f
< HCI Command: Host Number of Com.. (0x03|0x0035) plen 5  #193 [hci1] 14.970775
        Num handles: 1
        Handle: 1011 Address: DF:A9:FF:F6:B1:1A (OUI DF-A9-FF)
        Count: 1
< ACL Data TX: Handle 1011 flags 0x00 dlen 21             #194 [hci1] 14.970977
      SMP: Pairing Confirm (0x03) len 16
        Confim value: ae49e289d801bc56de61c779ed1780c7
> HCI Event: Number of Completed Packets (0x13) plen 5    #195 [hci1] 15.126566
        Num handles: 1
        Handle: 1011 Address: DF:A9:FF:F6:B1:1A (OUI DF-A9-FF)
        Count: 1
        #194: len 21 (1 Kb/s)
        Latency: 155 msec (68-173 msec ~160 msec)
> ACL Data RX: Handle 1011 flags 0x02 dlen 21             #196 [hci1] 15.126797
      SMP: Pairing Random (0x04) len 16
        Random value: e5dcc9908400f3cb0000000000000000
< HCI Command: Host Number of Com.. (0x03|0x0035) plen 5  #197 [hci1] 15.130494
        Num handles: 1
        Handle: 1011 Address: DF:A9:FF:F6:B1:1A (OUI DF-A9-FF)
        Count: 1
< ACL Data TX: Handle 1011 flags 0x00 dlen 21             #198 [hci1] 15.130525
      SMP: Pairing Random (0x04) len 16
        Random value: b67e7216d5bf664139eda2b542549666
> HCI Event: Number of Completed Packets (0x13) plen 5    #199 [hci1] 15.301259
        Num handles: 1
        Handle: 1011 Address: DF:A9:FF:F6:B1:1A (OUI DF-A9-FF)
        Count: 1
        #198: len 21 (0 Kb/s)
        Latency: 170 msec (68-173 msec ~165 msec)
> ACL Data RX: Handle 1011 flags 0x02 dlen 21             #200 [hci1] 15.389091
      SMP: Pairing Confirm (0x03) len 16
        Confim value: bdeb7c0340d22fe24574c3801806758e
< HCI Command: Host Number of Com.. (0x03|0x0035) plen 5  #201 [hci1] 15.390445
        Num handles: 1
        Handle: 1011 Address: DF:A9:FF:F6:B1:1A (OUI DF-A9-FF)
        Count: 1
< ACL Data TX: Handle 1011 flags 0x00 dlen 21             #202 [hci1] 15.390541
      SMP: Pairing Confirm (0x03) len 16
        Confim value: 4dec97f3185c63f8af6ac124a08a3661
> HCI Event: Number of Completed Packets (0x13) plen 5    #203 [hci1] 15.564047
        Num handles: 1
        Handle: 1011 Address: DF:A9:FF:F6:B1:1A (OUI DF-A9-FF)
        Count: 1
        #202: len 21 (0 Kb/s)
        Latency: 173 msec (68-173 msec ~169 msec)
> ACL Data RX: Handle 1011 flags 0x02 dlen 21             #204 [hci1] 15.564320
      SMP: Pairing Random (0x04) len 16
        Random value: 3052c9e7663d51800000000000000000
< HCI Command: Host Number of Com.. (0x03|0x0035) plen 5  #205 [hci1] 15.571006
        Num handles: 1
        Handle: 1011 Address: DF:A9:FF:F6:B1:1A (OUI DF-A9-FF)
        Count: 1
< ACL Data TX: Handle 1011 flags 0x00 dlen 21             #206 [hci1] 15.571088
      SMP: Pairing Random (0x04) len 16
        Random value: ed17f76500c95219dd01e09d1e63f87b
> HCI Event: Number of Completed Packets (0x13) plen 5    #207 [hci1] 15.738816
        Num handles: 1
        Handle: 1011 Address: DF:A9:FF:F6:B1:1A (OUI DF-A9-FF)
        Count: 1
        #206: len 21 (1 Kb/s)
        Latency: 167 msec (68-173 msec ~168 msec)
> ACL Data RX: Handle 1011 flags 0x02 dlen 21             #208 [hci1] 15.826534
      SMP: Pairing Confirm (0x03) len 16
        Confim value: ef7bacf7998501d03b3cd3c7a9944fa9
< HCI Command: Host Number of Com.. (0x03|0x0035) plen 5  #209 [hci1] 15.830453
        Num handles: 1
        Handle: 1011 Address: DF:A9:FF:F6:B1:1A (OUI DF-A9-FF)
        Count: 1
< ACL Data TX: Handle 1011 flags 0x00 dlen 21             #210 [hci1] 15.830583
      SMP: Pairing Confirm (0x03) len 16
        Confim value: 3deaf7c3198f6b48d36b9bf2d00473cd
> HCI Event: Number of Completed Packets (0x13) plen 5    #211 [hci1] 16.001520
        Num handles: 1
        Handle: 1011 Address: DF:A9:FF:F6:B1:1A (OUI DF-A9-FF)
        Count: 1
        #210: len 21 (0 Kb/s)
        Latency: 170 msec (68-173 msec ~169 msec)
> ACL Data RX: Handle 1011 flags 0x02 dlen 21             #212 [hci1] 16.001841
      SMP: Pairing Random (0x04) len 16
        Random value: 56601ee417eda0cf0000000000000000
< HCI Command: Host Number of Com.. (0x03|0x0035) plen 5  #213 [hci1] 16.011132
        Num handles: 1
        Handle: 1011 Address: DF:A9:FF:F6:B1:1A (OUI DF-A9-FF)
        Count: 1
< ACL Data TX: Handle 1011 flags 0x00 dlen 21             #214 [hci1] 16.011240
      SMP: Pairing Random (0x04) len 16
        Random value: 81d35d47e1f6006d79c974bd9d9e1ee3
> HCI Event: Number of Completed Packets (0x13) plen 5    #215 [hci1] 16.176301
        Num handles: 1
        Handle: 1011 Address: DF:A9:FF:F6:B1:1A (OUI DF-A9-FF)
        Count: 1
        #214: len 21 (1 Kb/s)
        Latency: 165 msec (68-173 msec ~167 msec)
> ACL Data RX: Handle 1011 flags 0x02 dlen 21             #216 [hci1] 16.264077
      SMP: Pairing Confirm (0x03) len 16
        Confim value: 8b5baa7d6d6d3dc34813f818294a1e9a
< HCI Command: Host Number of Com.. (0x03|0x0035) plen 5  #217 [hci1] 16.270552
        Num handles: 1
        Handle: 1011 Address: DF:A9:FF:F6:B1:1A (OUI DF-A9-FF)
        Count: 1
< ACL Data TX: Handle 1011 flags 0x00 dlen 21             #218 [hci1] 16.270709
      SMP: Pairing Confirm (0x03) len 16
        Confim value: cc39fc9b358eca7de419ef09d3e17e86
> HCI Event: Number of Completed Packets (0x13) plen 5    #219 [hci1] 16.438963
        Num handles: 1
        Handle: 1011 Address: DF:A9:FF:F6:B1:1A (OUI DF-A9-FF)
        Count: 1
        #218: len 21 (1 Kb/s)
        Latency: 168 msec (68-173 msec ~167 msec)
> ACL Data RX: Handle 1011 flags 0x02 dlen 21             #220 [hci1] 16.439258
      SMP: Pairing Random (0x04) len 16
        Random value: 36128085fde94b5f0000000000000000
< HCI Command: Host Number of Com.. (0x03|0x0035) plen 5  #221 [hci1] 16.450915
        Num handles: 1
        Handle: 1011 Address: DF:A9:FF:F6:B1:1A (OUI DF-A9-FF)
        Count: 1
< ACL Data TX: Handle 1011 flags 0x00 dlen 21             #222 [hci1] 16.451023
      SMP: Pairing Random (0x04) len 16
        Random value: e7f7e0c2476823e41736a7e381bafb7c
> HCI Event: Number of Completed Packets (0x13) plen 5    #223 [hci1] 16.613934
        Num handles: 1
        Handle: 1011 Address: DF:A9:FF:F6:B1:1A (OUI DF-A9-FF)
        Count: 1
        #222: len 21 (1 Kb/s)
        Latency: 162 msec (68-173 msec ~165 msec)
> ACL Data RX: Handle 1011 flags 0x02 dlen 21             #224 [hci1] 16.701568
      SMP: Pairing Confirm (0x03) len 16
        Confim value: eb9c8641e7da60611c848345e0d3d719
< HCI Command: Host Number of Com.. (0x03|0x0035) plen 5  #225 [hci1] 16.710803
        Num handles: 1
        Handle: 1011 Address: DF:A9:FF:F6:B1:1A (OUI DF-A9-FF)
        Count: 1
< ACL Data TX: Handle 1011 flags 0x00 dlen 21             #226 [hci1] 16.711029
      SMP: Pairing Confirm (0x03) len 16
        Confim value: 37deba58e0a82663eec52ce07210ffa5
> HCI Event: Number of Completed Packets (0x13) plen 5    #227 [hci1] 16.876424
        Num handles: 1
        Handle: 1011 Address: DF:A9:FF:F6:B1:1A (OUI DF-A9-FF)
        Count: 1
        #226: len 21 (1 Kb/s)
        Latency: 165 msec (68-173 msec ~165 msec)
> ACL Data RX: Handle 1011 flags 0x02 dlen 21             #228 [hci1] 16.876860
      SMP: Pairing Random (0x04) len 16
        Random value: 49c185803c097cc80000000000000000
