Bluetooth monitor ver 5.72
= Note: Linux version 6.14.0-36-generic (x86_64)                       0.950006
= Note: Bluetooth subsystem version 2.22                               0.950008
= New Index: 00:00:00:00:00:00 (Primary,UART,hci2)              [hci2] 0.950009
= New Index: 00:00:00:00:00:00 (Primary,UART,hci1)              [hci1] 0.950010
= New Index: 48:5F:99:8E:E0:64 (Primary,USB,hci0)               [hci0] 0.950010
= Open Index: 00:00:00:00:00:00                                 [hci1] 1.063805
= Index Info: 00:00:00:00:00:00 (Nordic Semiconductor ASA)      [hci1] 1.063818
@ USER Open: main (privileged) version 2.22            {0x0001} [hci1] 1.063827
< HCI Command: Reset (0x03|0x0003) plen 0                    #1 [hci1] 1.065082
> HCI Event: Command Complete (0x0e) plen 4                  #2 [hci1] 1.065747
      Reset (0x03|0x0003) ncmd 1
        Status: Success (0x00)
< HCI Command: Read Local Supported... (0x04|0x0003) plen 0  #3 [hci1] 1.083625
> HCI Event: Command Complete (0x0e) plen 12                 #4 [hci1] 1.084229
      Read Local Supported Features (0x04|0x0003) ncmd 1
        Status: Success (0x00)
        Features: 0x00 0x00 0x00 0x00 0x60 0x00 0x00 0x00
          BR/EDR Not Supported
          LE Supported (Controller)
< HCI Command: Read Local Version In.. (0x04|0x0001) plen 0  #5 [hci1] 1.103319
> HCI Event: Command Complete (0x0e) plen 12                 #6 [hci1] 1.103971
      Read Local Version Information (0x04|0x0001) ncmd 1
        Status: Success (0x00)
        HCI version: Reserved (0x0f) - Revision 12393 (0x3069)
        LMP version: Reserved (0x0f) - Subversion 12393 (0x3069)
        Manufacturer: Nordic Semiconductor ASA (89)
< HCI Command: Read Local Supported... (0x04|0x0002) plen 0  #7 [hci1] 1.123214
> HCI Event: Command Complete (0x0e) plen 68                 #8 [hci1] 1.124350
      Read Local Supported Commands (0x04|0x0002) ncmd 1
        Status: Success (0x00)
        Commands: 119 entries
          Disconnect (Octet 0 - Bit 5)
          Read Remote Version Information (Octet 2 - Bit 7)
          Set Event Mask (Octet 5 - Bit 6)
          Reset (Octet 5 - Bit 7)
          Read Connection Accept Timeout (Octet 7 - Bit 2)
          Write Connection Accept Timeout (Octet 7 - Bit 3)
          Read Transmit Power Level (Octet 10 - Bit 2)
          Set Controller To Host Flow Control (Octet 10 - Bit 5)
          Host Buffer Size (Octet 10 - Bit 6)
          Host Number of Completed Packets (Octet 10 - Bit 7)
          Read Local Version Information (Octet 14 - Bit 3)
          Read Local Supported Features (Octet 14 - Bit 5)
          Read BD ADDR (Octet 15 - Bit 1)
          Read RSSI (Octet 15 - Bit 5)
          Set Event Mask Page 2 (Octet 22 - Bit 2)
          LE Set Event Mask (Octet 25 - Bit 0)
          LE Read Buffer Size (Octet 25 - Bit 1)
          LE Read Local Supported Features (Octet 25 - Bit 2)
          LE Set Random Address (Octet 25 - Bit 4)
          LE Set Advertising Parameters (Octet 25 - Bit 5)
          LE Read Advertising Channel TX Power (Octet 25 - Bit 6)
          LE Set Advertising Data (Octet 25 - Bit 7)
          LE Set Scan Response Data (Octet 26 - Bit 0)
          LE Set Advertise Enable (Octet 26 - Bit 1)
          LE Set Scan Parameters (Octet 26 - Bit 2)
          LE Set Scan Enable (Octet 26 - Bit 3)
          LE Create Connection (Octet 26 - Bit 4)
          LE Create Connection Cancel (Octet 26 - Bit 5)
          LE Read Accept List Size (Octet 26 - Bit 6)
          LE Clear Accept List (Octet 26 - Bit 7)
          LE Add Device To Accept List (Octet 27 - Bit 0)
          LE Remove Device From Accept List (Octet 27 - Bit 1)
          LE Connection Update (Octet 27 - Bit 2)
          LE Set Host Channel Classification (Octet 27 - Bit 3)
          LE Read Channel Map (Octet 27 - Bit 4)
          LE Read Remote Used Features (Octet 27 - Bit 5)
          LE Encrypt (Octet 27 - Bit 6)
          LE Rand (Octet 27 - Bit 7)
          LE Start Encryption (Octet 28 - Bit 0)
          LE Long Term Key Request Reply (Octet 28 - Bit 1)
          LE Long Term Key Request Neg Reply (Octet 28 - Bit 2)
          LE Read Supported States (Octet 28 - Bit 3)
          LE Receiver Test (Octet 28 - Bit 4)
          LE Transmitter Test (Octet 28 - Bit 5)
          LE Test End (Octet 28 - Bit 6)
          Read Authenticated Payload Timeout (Octet 32 - Bit 4)
          Write Authenticated Payload Timeout (Octet 32 - Bit 5)
          LE Set Data Length (Octet 33 - Bit 6)
          LE Read Suggested Default Data Length (Octet 33 - Bit 7)
          LE Write Suggested Default Data Length (Octet 34 - Bit 0)
          LE Add Device To Resolving List (Octet 34 - Bit 3)
          LE Remove Device From Resolving List (Octet 34 - Bit 4)
          LE Clear Resolving List (Octet 34 - Bit 5)
          LE Read Resolving List Size (Octet 34 - Bit 6)
          LE Set Address Resolution Enable (Octet 35 - Bit 1)
          LE Set Resolvable Private Address Timeout (Octet 35 - Bit 2)
          LE Read Maximum Data Length (Octet 35 - Bit 3)
          LE Read PHY (Octet 35 - Bit 4)
          LE Set Default PHY (Octet 35 - Bit 5)
          LE Set PHY (Octet 35 - Bit 6)
          LE Enhanced Receiver Test (Octet 35 - Bit 7)
          LE Enhanced Transmitter Test (Octet 36 - Bit 0)
          LE Set Advertising Set Random Address (Octet 36 - Bit 1)
          LE Set Extended Advertising Parameters (Octet 36 - Bit 2)
          LE Set Extended Advertising Data (Octet 36 - Bit 3)
          LE Set Extended Scan Response Data (Octet 36 - Bit 4)
          LE Set Extended Advertising Enable (Octet 36 - Bit 5)
          LE Read Maximum Advertising Data Length (Octet 36 - Bit 6)
          LE Read Number of Supported Advertising Sets (Octet 36 - Bit 7)
          LE Remove Advertising Set (Octet 37 - Bit 0)
          LE Clear Advertising Sets (Octet 37 - Bit 1)
          LE Set Periodic Advertising Parameters (Octet 37 - Bit 2)
          LE Set Periodic Advertising Data (Octet 37 - Bit 3)
          LE Set Periodic Advertising Enable (Octet 37 - Bit 4)
          LE Set Extended Scan Parameters (Octet 37 - Bit 5)
          LE Set Extended Scan Enable (Octet 37 - Bit 6)
          LE Extended Create Connection (Octet 37 - Bit 7)
          LE Periodic Advertising Create Sync (Octet 38 - Bit 0)
          LE Periodic Advertising Create Sync Cancel (Octet 38 - Bit 1)
          LE Periodic Advertising Terminate Sync (Octet 38 - Bit 2)
          LE Add Device To Periodic Advertiser List (Octet 38 - Bit 3)
          LE Remove Device From Periodic Advertiser List (Octet 38 - Bit 4)
          LE Clear Periodic Advertiser List (Octet 38 - Bit 5)
          LE Read Periodic Advertiser List Size (Octet 38 - Bit 6)
          LE Read Transmit Power (Octet 38 - Bit 7)
          LE Read RF Path Compensation (Octet 39 - Bit 0)
          LE Write RF Path Compensation (Octet 39 - Bit 1)
          LE Set Privacy Mode (Octet 39 - Bit 2)
          LE Periodic Advertising Receive Enable (Octet 40 - Bit 5)
          LE Periodic Advertising Sync Transfer (Octet 40 - Bit 6)
          LE Periodic Advertising Set Info Transfer (Octet 40 - Bit 7)
          LE Periodic Advertising Sync Transfer Parameters (Octet 41 - Bit 0)
          LE Set Default Periodic Advertisng Sync Transfer Parameters (Octet 41 - Bit 1)
          LE Read Buffer v2 (Octet 41 - Bit 5)
          LE Read ISO TX Sync (Octet 41 - Bit 6)
          LE Set Connected Isochronous Group Parameters (Octet 41 - Bit 7)
          LE Set Connected Isochronous Group Parameters Test (Octet 42 - Bit 0)
          LE Create Connected Isochronous Stream (Octet 42 - Bit 1)
          LE Remove Connected Isochronous Group (Octet 42 - Bit 2)
          LE Accept Connected Isochronous Stream Request (Octet 42 - Bit 3)
          LE Reject Connected Isochronous Stream Request (Octet 42 - Bit 4)
          LE Create Broadcast Isochronous Group (Octet 42 - Bit 5)
          LE Create Broadcast Isochronous Group Test (Octet 42 - Bit 6)
          LE Terminate Broadcast Isochronous Group (Octet 42 - Bit 7)
          LE Broadcast Isochronous Group Create Sync (Octet 43 - Bit 0)
          LE Broadcast Isochronous Group Terminate Sync (Octet 43 - Bit 1)
          LE Request Peer SCA (Octet 43 - Bit 2)
          LE Setup Isochronous Data Path (Octet 43 - Bit 3)
          LE Remove Isochronous Data Path (Octet 43 - Bit 4)
          LE Isochronous Transmit Test (Octet 43 - Bit 5)
          LE Isochronous Receive Test (Octet 43 - Bit 6)
          LE Isochronous Read Test Counters (Octet 43 - Bit 7)
          LE Isochronous Read Test Counters (Octet 44 - Bit 0)
          LE Set Host Feature (Octet 44 - Bit 1)
          Octet 44 - Bit 2 
          Octet 45 - Bit 6 
          Octet 46 - Bit 0 
          Octet 46 - Bit 1 
          Octet 46 - Bit 2 
< HCI Command: Host Buffer Size (0x03|0x0033) plen 7         #9 [hci1] 1.143216
        ACL MTU: 255  ACL max packet: 16
        SCO MTU: 0    SCO max packet: 0
> HCI Event: Command Complete (0x0e) plen 4                 #10 [hci1] 1.143793
      Host Buffer Size (0x03|0x0033) ncmd 1
        Status: Success (0x00)
< HCI Command: Set Controller To Ho.. (0x03|0x0031) plen 1  #11 [hci1] 1.163210
        Flow control: ACL Data Packets (0x01)
> HCI Event: Command Complete (0x0e) plen 4                 #12 [hci1] 1.163704
      Set Controller To Host Flow Control (0x03|0x0031) ncmd 1
        Status: Success (0x00)
< HCI Command: LE Read Local Suppor.. (0x08|0x0003) plen 0  #13 [hci1] 1.183206
> HCI Event: Command Complete (0x0e) plen 12                #14 [hci1] 1.183768
      LE Read Local Supported Features (0x08|0x0003) ncmd 1
        Status: Success (0x00)
        Features: 0xfd 0x79 0x00 0xf7 0x30 0x01 0x00 0x00
          LE Encryption
          Extended Reject Indication
          Peripheral-initiated Features Exchange
          LE Ping
          LE Data Packet Length Extension
          LL Privacy
          Extended Scanner Filter Policies
          LE 2M PHY
          LE Coded PHY
          LE Extended Advertising
          LE Periodic Advertising
          Channel Selection Algorithm #2
          Periodic Advertising Sync Transfer - Sender
          Periodic Advertising Sync Transfer - Recipient
          Sleep Clock Accuracy Updates
          Connected Isochronous Stream - Central
          Connected Isochronous Stream - Peripheral
          Isochronous Broadcaster
          Synchronized Receiver
          Periodic Advertising ADI support
          Connection Subrating
          Unknown features (0x0000010000000000)
< HCI Command: LE Set Host Feature (0x08|0x0074) plen 2     #15 [hci1] 1.203214
        Bit Number: 32
          Connected Isochronous Stream (Host Support)
        Bit Value: 1
> HCI Event: Command Complete (0x0e) plen 4                 #16 [hci1] 1.203637
      LE Set Host Feature (0x08|0x0074) ncmd 1
        Status: Success (0x00)
< HCI Command: LE Read Buffer v2 (0x08|0x0060) plen 0       #17 [hci1] 1.223205
> HCI Event: Command Complete (0x0e) plen 10                #18 [hci1] 1.223686
      LE Read Buffer v2 (0x08|0x0060) ncmd 1
        Status: Success (0x00)
        ACL MTU: 27
        ACL max packet: 3
        ISO MTU: 318
        ISO max packet: 3
< HCI Command: LE Read Maximum Adve.. (0x08|0x003a) plen 0  #19 [hci1] 1.243239
> HCI Event: Command Complete (0x0e) plen 6                 #20 [hci1] 1.243639
      LE Read Maximum Advertising Data Length (0x08|0x003a) ncmd 1
        Status: Success (0x00)
        Max length: 1650
< HCI Command: LE Read Supported St.. (0x08|0x001c) plen 0  #21 [hci1] 1.263213
> HCI Event: Command Complete (0x0e) plen 12                #22 [hci1] 1.263704
      LE Read Supported States (0x08|0x001c) ncmd 1
        Status: Success (0x00)
        States: 0x000003ff3e0306ff
          Non-connectable Advertising State
          Scannable Advertising State
          Connectable Advertising State
          High Duty Cycle Directed Advertising State
          Passive Scanning State
          Active Scanning State
          Initiating State
            and Connection State (Central Role)
          Connection State (Peripheral Role)
          Scannable Advertising State
            and Passive Scanning State
          Connectable Advertising State
            and Passive Scanning State
          Non-connectable Advertising State
            and Initiating State
          Scannable Advertising State
            and Initiating State
          Active Scanning State
            and Connection State (Central Role)
          Passive Scanning State
            and Connection State (Peripheral Role)
          Active Scanning State
            and Connection State (Peripheral Role)
          Initiating State
            and Connection State (Central Role)
            and Central Role & Central Role
          Low Duty Cycle Directed Advertising State
          Connectable Advertising State
            and Initiating State
            and Central Role & Peripheral Role
          High Duty Cycle Directed Advertising State
            and Initiating State
            and Central Role & Peripheral Role
          Low Duty Cycle Directed Advertising State
            and Initiating State
            and Central Role & Peripheral Role
          Connectable Advertising State
            and Connection State (Central Role)
            and Central Role & Peripheral Role
          High Duty Cycle Directed Advertising State
            and Connection State (Central Role)
            and Central Role & Peripheral Role
          Low Duty Cycle Directed Advertising State
            and Connection State (Central Role)
            and Central Role & Peripheral Role
          Connectable Advertising State
            and Connection State (Peripheral Role)
            and Central Role & Peripheral Role
          High Duty Cycle Directed Advertising State
            and Connection State (Peripheral Role)
            and Peripheral Role & Peripheral Role
          Low Duty Cycle Directed Advertising State
            and Connection State (Peripheral Role)
            and Peripheral Role & Peripheral Role
          Initiating State
            and Connection State (Peripheral Role)
            and Central Role & Peripheral Role
< HCI Command: LE Read Maximum Data.. (0x08|0x002f) plen 0  #23 [hci1] 1.283207
> HCI Event: Command Complete (0x0e) plen 12                #24 [hci1] 1.283922
      LE Read Maximum Data Length (0x08|0x002f) ncmd 1
        Status: Success (0x00)
        Max TX octets: 251
        Max TX time: 2704
        Max RX octets: 251
        Max RX time: 2704
< HCI Command: LE Write Suggested D.. (0x08|0x0024) plen 4  #25 [hci1] 1.303209
        TX octets: 251
        TX time: 2704
> HCI Event: Command Complete (0x0e) plen 4                 #26 [hci1] 1.303740
      LE Write Suggested Default Data Length (0x08|0x0024) ncmd 1
        Status: Success (0x00)
< HCI Command: LE Read Resolving Li.. (0x08|0x002a) plen 0  #27 [hci1] 1.323211
> HCI Event: Command Complete (0x0e) plen 5                 #28 [hci1] 1.323755
      LE Read Resolving List Size (0x08|0x002a) ncmd 1
        Status: Success (0x00)
        Size: 8
< HCI Command: LE Set Event Mask (0x08|0x0001) plen 8       #29 [hci1] 1.343200
        Mask: 0x000002023f87fa5e
          LE Advertising Report
          LE Connection Update Complete
          LE Read Remote Used Features Complete
          LE Long Term Key Request
          LE Data Length Change
          LE Enhanced Connection Complete
          LE PHY Update Complete
          LE Extended Advertising Report
          LE Periodic Advertising Sync Established
          LE Periodic Advertising Report
          LE Periodic Advertising Sync Lost
          LE Extended Scan Timeout
          LE Extended Advertising Set Terminated
          LE Scan Request Received
          LE Periodic Advertising Sync Transfer Rvc
          LE CIS Established
          LE CIS Request
          LE Create BIG Complete
          LE Terminate BIG Complete
          LE BIG Sync Estabilished Complete
          LE BIG Sync Lost
          LE BIG Info Advertising Report
          Unknown mask (0x0000020000000000)
> HCI Event: Command Complete (0x0e) plen 4                 #30 [hci1] 1.343748
      LE Set Event Mask (0x08|0x0001) ncmd 1
        Status: Success (0x00)
< HCI Command: Set Event Mask (0x03|0x0001) plen 8          #31 [hci1] 1.363216
        Mask: 0x2000800002008890
          Disconnection Complete
          Encryption Change
          Read Remote Version Information Complete
          Hardware Error
          Data Buffer Overflow
          Encryption Key Refresh Complete
          LE Meta
> HCI Event: Command Complete (0x0e) plen 4                 #32 [hci1] 1.363793
      Set Event Mask (0x03|0x0001) ncmd 1
        Status: Success (0x00)
< HCI Command: Read BD ADDR (0x04|0x0009) plen 0            #33 [hci1] 1.383214
> HCI Event: Command Complete (0x0e) plen 10                #34 [hci1] 1.383688
      Read BD ADDR (0x04|0x0009) ncmd 1
        Status: Success (0x00)
        Address: 00:00:00:00:00:00 (OUI 00-00-00)
< HCI Command: LE Set Random Address (0x08|0x0005) plen 6   #35 [hci1] 1.403215
        Address: D5:B6:CC:31:DB:3B (Static)
> HCI Event: Command Complete (0x0e) plen 4                 #36 [hci1] 1.403823
      LE Set Random Address (0x08|0x0005) ncmd 1
        Status: Success (0x00)
< HCI Command: LE Set Extended Adv.. (0x08|0x0036) plen 25  #37 [hci1] 5.683300
        Handle: 0x00
        Properties: 0x0013
          Connectable
          Scannable
          Use legacy advertising PDUs: ADV_IND
        Min advertising interval: 100.000 msec (0x00a0)
        Max advertising interval: 150.000 msec (0x00f0)
        Channel map: 37, 38, 39 (0x07)
        Own address type: Random (0x01)
        Peer address type: Public (0x00)
        Peer address: 00:00:00:00:00:00 (OUI 00-00-00)
        Filter policy: Allow Scan Request from Any, Allow Connect Request from Any (0x00)
        TX power: Host has no preference (0x7f)
        Primary PHY: LE 1M (0x01)
        Secondary max skip: 0x00
        Secondary PHY: LE 1M (0x01)
        SID: 0x00
        Scan request notifications: Disabled (0x00)
> HCI Event: Command Complete (0x0e) plen 5                 #38 [hci1] 5.684135
      LE Set Extended Advertising Parameters (0x08|0x0036) ncmd 1
        Status: Success (0x00)
        TX power (selected): 0 dbm (0x00)
< HCI Command: LE Set Advertising S.. (0x08|0x0035) plen 7  #39 [hci1] 5.703249
        Advertising handle: 0x00
        Advertising random address: D5:B6:CC:31:DB:3B (Static)
> HCI Event: Command Complete (0x0e) plen 4                 #40 [hci1] 5.703807
      LE Set Advertising Set Random Address (0x08|0x0035) ncmd 1
        Status: Success (0x00)
< HCI Command: LE Set Extended Adv.. (0x08|0x0037) plen 22  #41 [hci1] 5.723297
        Handle: 0x00
        Operation: Complete extended advertising data (0x03)
        Fragment preference: Minimize fragmentation (0x01)
        Data length: 0x12
        Flags: 0x06
          LE General Discoverable Mode
          BR/EDR Not Supported
        Name (complete): Tester_F6B11A
> HCI Event: Command Complete (0x0e) plen 4                 #42 [hci1] 5.723997
      LE Set Extended Advertising Data (0x08|0x0037) ncmd 1
        Status: Success (0x00)
< HCI Command: LE Set Extended Scan.. (0x08|0x0038) plen 4  #43 [hci1] 5.743275
        Handle: 0x00
        Operation: Complete scan response data (0x03)
        Fragment preference: Minimize fragmentation (0x01)
        Data length: 0x00
> HCI Event: Command Complete (0x0e) plen 4                 #44 [hci1] 5.743868
      LE Set Extended Scan Response Data (0x08|0x0038) ncmd 1
        Status: Success (0x00)
< HCI Command: LE Set Extended Adve.. (0x08|0x0039) plen 6  #45 [hci1] 5.763319
        Extended advertising: Enabled (0x01)
        Number of sets: 1 (0x01)
        Entry 0
          Handle: 0x00
          Duration: 0 ms (0x00)
          Max ext adv events: 0
> HCI Event: Command Complete (0x0e) plen 4                 #46 [hci1] 5.764027
      LE Set Extended Advertising Enable (0x08|0x0039) ncmd 1
        Status: Success (0x00)
> HCI Event: LE Meta Event (0x3e) plen 31                   #47 [hci1] 6.080950
      LE Enhanced Connection Complete (0x0a)
        Status: Success (0x00)
        Handle: 1929
        Role: Peripheral (0x01)
        Peer address type: Public (0x00)
        Peer address: DF:A9:FF:F6:B1:1A (OUI DF-A9-FF)
        Local resolvable private address: 00:00:00:00:00:00 (Non-Resolvable)
        Peer resolvable private address: 00:00:00:00:00:00 (Non-Resolvable)
        Connection interval: 87.50 msec (0x0046)
        Connection latency: 0 (0x0000)
        Supervision timeout: 20000 msec (0x07d0)
        Central clock accuracy: 0x01
> HCI Event: LE Meta Event (0x3e) plen 6                    #48 [hci1] 6.081138
      LE Advertising Set Terminated (0x12)
        Status: Success (0x00)
        Handle: 0
        Connection handle: 1929
        Number of completed extended advertising events: 0
< HCI Command: LE Read Remote Used... (0x08|0x0016) plen 2  #49 [hci1] 6.083892
        Handle: 1929 Address: DF:A9:FF:F6:B1:1A (OUI DF-A9-FF)
> HCI Event: Command Status (0x0f) plen 4                   #50 [hci1] 6.084334
      LE Read Remote Used Features (0x08|0x0016) ncmd 1
        Status: Success (0x00)
> HCI Event: LE Meta Event (0x3e) plen 12                   #51 [hci1] 6.344868
      LE Read Remote Used Features (0x04)
        Status: Success (0x00)
        Handle: 1929 Address: DF:A9:FF:F6:B1:1A (OUI DF-A9-FF)
        Features: 0x2d 0x49 0x00 0xf7 0x67 0xd9 0x00 0x80
          LE Encryption
          Extended Reject Indication
          Peripheral-initiated Features Exchange
          LE Data Packet Length Extension
          LE 2M PHY
          LE Coded PHY
          Channel Selection Algorithm #2
          Periodic Advertising Sync Transfer - Sender
          Periodic Advertising Sync Transfer - Recipient
          Sleep Clock Accuracy Updates
          Connected Isochronous Stream - Central
          Connected Isochronous Stream - Peripheral
          Isochronous Broadcaster
          Synchronized Receiver
          Connected Isochronous Stream (Host Support)
          LE Power Control Request
          LE Power Control Request
          Connection Subrating
          Connection Subrating (Host Support)
          Unknown features (0x8000d90000000000)
< ACL Data TX: Handle 1929 flags 0x00 dlen 16              #52 [hci1] 11.093516
      LE L2CAP: Connection Parameter Update Request (0x12) ident 1 len 8
        Min interval: 24
        Max interval: 40
        Peripheral latency: 0
        Timeout multiplier: 42
> HCI Event: Number of Completed Packets (0x13) plen 5     #53 [hci1] 11.244774
        Num handles: 1
        Handle: 1929 Address: DF:A9:FF:F6:B1:1A (OUI DF-A9-FF)
        Count: 1
        #52: len 16 (0 Kb/s)
        Latency: 151 msec (151-151 msec ~151 msec)
> ACL Data RX: Handle 1929 flags 0x02 dlen 10              #54 [hci1] 11.244783
      LE L2CAP: Connection Parameter Update Response (0x13) ident 1 len 2
        Result: Connection Parameters accepted (0x0000)
< HCI Command: Host Number of Comp.. (0x03|0x0035) plen 5  #55 [hci1] 11.264085
        Num handles: 1
        Handle: 1929 Address: DF:A9:FF:F6:B1:1A (OUI DF-A9-FF)
        Count: 1
> ACL Data RX: Handle 1929 flags 0x02 dlen 11              #56 [hci1] 13.869579
      SMP: Pairing Request (0x01) len 6
        IO capability: KeyboardDisplay (0x04)
        OOB data: Authentication data not present (0x00)
        Authentication requirement: Bonding, No MITM, SC, No Keypresses (0x09)
        Max encryption key size: 16
        Initiator key distribution: EncKey IdKey Sign (0x07)
        Responder key distribution: EncKey IdKey Sign (0x07)
< HCI Command: Host Number of Comp.. (0x03|0x0035) plen 5  #57 [hci1] 13.883919
        Num handles: 1
        Handle: 1929 Address: DF:A9:FF:F6:B1:1A (OUI DF-A9-FF)
        Count: 1
< ACL Data TX: Handle 1929 flags 0x00 dlen 11              #58 [hci1] 13.884023
      SMP: Pairing Response (0x02) len 6
        IO capability: NoInputNoOutput (0x03)
        OOB data: Authentication data not present (0x00)
        Authentication requirement: Bonding, No MITM, SC, No Keypresses (0x09)
        Max encryption key size: 16
        Initiator key distribution: IdKey (0x02)
        Responder key distribution: <none> (0x00)
> HCI Event: Number of Completed Packets (0x13) plen 5     #59 [hci1] 14.044700
        Num handles: 1
        Handle: 1929 Address: DF:A9:FF:F6:B1:1A (OUI DF-A9-FF)
        Count: 1
        #58: len 11 (0 Kb/s)
        Latency: 160 msec (151-160 msec ~155 msec)
> ACL Data RX: Handle 1929 flags 0x02 dlen 27              #60 [hci1] 14.044930
> ACL Data RX: Handle 1929 flags 0x01 dlen 27              #61 [hci1] 14.045542
> ACL Data RX: Handle 1929 flags 0x01 dlen 15              #62 [hci1] 14.045912
      SMP: Pairing Public Key (0x0c) len 64
        X: 4ae356459cf6289f9846aafcddb9208662b5c7588906a4828156550b3266f9d9
        Y: a543574ec1ecfd356d08e170c1f830db863cde78e7696ac4504aa0c3fe7b70a3
< HCI Command: Host Number of Comp.. (0x03|0x0035) plen 5  #63 [hci1] 14.063989
        Num handles: 1
        Handle: 1929 Address: DF:A9:FF:F6:B1:1A (OUI DF-A9-FF)
        Count: 1
< HCI Command: Host Number of Comp.. (0x03|0x0035) plen 5  #64 [hci1] 14.064120
        Num handles: 1
        Handle: 1929 Address: DF:A9:FF:F6:B1:1A (OUI DF-A9-FF)
        Count: 1
< HCI Command: Host Number of Comp.. (0x03|0x0035) plen 5  #65 [hci1] 14.064332
        Num handles: 1
        Handle: 1929 Address: DF:A9:FF:F6:B1:1A (OUI DF-A9-FF)
        Count: 1
< ACL Data TX: Handle 1929 flags 0x00 dlen 27              #66 [hci1] 14.064464
< ACL Data TX: Handle 1929 flags 0x01 dlen 27              #67 [hci1] 14.064471
< ACL Data TX: Handle 1929 flags 0x01 dlen 15              #68 [hci1] 14.064473
      SMP: Pairing Public Key (0x0c) len 64
        X: 98308440221e2d910f0e54b71e7ec652857aa9b5a0dc65028824cc19db1226e9
        Y: 67a4816bcb62efb21701e31fdb27561a6217575fb007a8bbdabe7e28b6f68482
> HCI Event: Number of Completed Packets (0x13) plen 5     #69 [hci1] 14.132483
        Num handles: 1
        Handle: 1929 Address: DF:A9:FF:F6:B1:1A (OUI DF-A9-FF)
        Count: 1
        #66: len 27 (3 Kb/s)
        Latency: 68 msec (68-160 msec ~111 msec)
> HCI Event: Number of Completed Packets (0x13) plen 5     #70 [hci1] 14.133119
        Num handles: 1
        Handle: 1929 Address: DF:A9:FF:F6:B1:1A (OUI DF-A9-FF)
        Count: 1
        #67: len 27 (3 Kb/s)
        Latency: 68 msec (68-160 msec ~90 msec)
< ACL Data TX: Handle 1929 flags 0x00 dlen 21              #71 [hci1] 14.143576
      SMP: Pairing Confirm (0x03) len 16
        Confim value: 2fd9f2c14f0bf161988aa58d358f5365
> HCI Event: Number of Completed Packets (0x13) plen 5     #72 [hci1] 14.219279
        Num handles: 1
        Handle: 1929 Address: DF:A9:FF:F6:B1:1A (OUI DF-A9-FF)
        Count: 1
        #68: len 15 (0 Kb/s)
        Latency: 154 msec (68-160 msec ~122 msec)
> HCI Event: Number of Completed Packets (0x13) plen 5     #73 [hci1] 14.307012
        Num handles: 1
        Handle: 1929 Address: DF:A9:FF:F6:B1:1A (OUI DF-A9-FF)
        Count: 1
        #71: len 21 (1 Kb/s)
        Latency: 163 msec (68-163 msec ~142 msec)
> ACL Data RX: Handle 1929 flags 0x02 dlen 21              #74 [hci1] 14.307293
      SMP: Pairing Random (0x04) len 16
        Random value: 8c5a64ceea5493cc0000000000000000
< HCI Command: Host Number of Comp.. (0x03|0x0035) plen 5  #75 [hci1] 14.324150
        Num handles: 1
        Handle: 1929 Address: DF:A9:FF:F6:B1:1A (OUI DF-A9-FF)
        Count: 1
< ACL Data TX: Handle 1929 flags 0x00 dlen 21              #76 [hci1] 14.324292
      SMP: Pairing Random (0x04) len 16
        Random value: 8e6108f966a694cbe26df70bb96773e6
> HCI Event: Number of Completed Packets (0x13) plen 5     #77 [hci1] 14.481806
        Num handles: 1
        Handle: 1929 Address: DF:A9:FF:F6:B1:1A (OUI DF-A9-FF)
        Count: 1
        #76: len 21 (1 Kb/s)
        Latency: 157 msec (68-163 msec ~150 msec)
> ACL Data RX: Handle 1929 flags 0x02 dlen 21              #78 [hci1] 14.657383
      SMP: Pairing DHKey Check (0x0d) len 16
        E: 8d5e6541f400836da984bb7c365f9a9f
< HCI Command: Host Number of Comp.. (0x03|0x0035) plen 5  #79 [hci1] 14.664429
        Num handles: 1
        Handle: 1929 Address: DF:A9:FF:F6:B1:1A (OUI DF-A9-FF)
        Count: 1
< ACL Data TX: Handle 1929 flags 0x00 dlen 21              #80 [hci1] 14.664487
      SMP: Pairing DHKey Check (0x0d) len 16
        E: 47a9695ba2ce90f34ffc6c2c60dfe14f
> HCI Event: Number of Completed Packets (0x13) plen 5     #81 [hci1] 14.831838
        Num handles: 1
        Handle: 1929 Address: DF:A9:FF:F6:B1:1A (OUI DF-A9-FF)
        Count: 1
        #80: len 21 (1 Kb/s)
        Latency: 167 msec (68-167 msec ~158 msec)
> HCI Event: LE Meta Event (0x3e) plen 13                  #82 [hci1] 14.920026
      LE Long Term Key Request (0x05)
        Handle: 1929 Address: DF:A9:FF:F6:B1:1A (OUI DF-A9-FF)
        Random number: 0x0000000000000000
        Encrypted diversifier: 0x0000
< HCI Command: LE Long Term Key R.. (0x08|0x001a) plen 18  #83 [hci1] 14.923780
        Handle: 1929 Address: DF:A9:FF:F6:B1:1A (OUI DF-A9-FF)
        Long term key: cd18feacddcd77a0208559697019ef56
> HCI Event: Command Complete (0x0e) plen 6                #84 [hci1] 14.924689
      LE Long Term Key Request Reply (0x08|0x001a) ncmd 1
        Status: Success (0x00)
        Handle: 1929 Address: DF:A9:FF:F6:B1:1A (OUI DF-A9-FF)
> HCI Event: Encryption Change (0x08) plen 4               #85 [hci1] 15.357112
        Status: Success (0x00)
        Handle: 1929 Address: DF:A9:FF:F6:B1:1A (OUI DF-A9-FF)
        Encryption: Enabled with AES-CCM (0x01)
> ACL Data RX: Handle 1929 flags 0x02 dlen 21              #86 [hci1] 15.444664
      SMP: Identity Information (0x08) len 16
        Identity resolving key: 71a261de283b996a2a8223f356e67e90
< HCI Command: Host Number of Comp.. (0x03|0x0035) plen 5  #87 [hci1] 15.473495
        Num handles: 1
        Handle: 1929 Address: DF:A9:FF:F6:B1:1A (OUI DF-A9-FF)
        Count: 1
> ACL Data RX: Handle 1929 flags 0x02 dlen 12              #88 [hci1] 15.532081
      SMP: Identity Address Information (0x09) len 7
        Address: DF:A9:FF:F6:B1:1A (OUI DF-A9-FF)
> ACL Data RX: Handle 1929 flags 0x02 dlen 26              #89 [hci1] 15.532795
      LE L2CAP: Enhanced Credit Connection Request (0x17) ident 1 len 18
        PSM: 39 (0x0027)
        MTU: 64
        MPS: 64
        Credits: 5
        Source CID: 84
        Source CID: 83
        Source CID: 82
        Source CID: 81
        Source CID: 80
< HCI Command: LE Add Device To R.. (0x08|0x0027) plen 39  #90 [hci1] 15.543883
        Address type: Public (0x00)
        Address: DF:A9:FF:F6:B1:1A (OUI DF-A9-FF)
        Peer identity resolving key: 71a261de283b996a2a8223f356e67e90
        Local identity resolving key: 00000000000000000000000000000000
> HCI Event: Command Complete (0x0e) plen 4                #91 [hci1] 15.544844
      LE Add Device To Resolving List (0x08|0x0027) ncmd 1
        Status: Success (0x00)
< HCI Command: LE Set Privacy Mode (0x08|0x004e) plen 8    #92 [hci1] 15.563365
        Peer Identity address type: Public (0x00)
        Peer Identity address: DF:A9:FF:F6:B1:1A (OUI DF-A9-FF)
        Privacy Mode: Use Device Privacy (0x01)
> HCI Event: Command Complete (0x0e) plen 4                #93 [hci1] 15.564002
      LE Set Privacy Mode (0x08|0x004e) ncmd 1
        Status: Success (0x00)
< HCI Command: LE Set Address Reso.. (0x08|0x002d) plen 1  #94 [hci1] 15.583433
        Address resolution: Enabled (0x01)
> HCI Event: Command Complete (0x0e) plen 4                #95 [hci1] 15.583925
      LE Set Address Resolution Enable (0x08|0x002d) ncmd 1
        Status: Success (0x00)
< HCI Command: Host Number of Comp.. (0x03|0x0035) plen 5  #96 [hci1] 15.603384
        Num handles: 1
        Handle: 1929 Address: DF:A9:FF:F6:B1:1A (OUI DF-A9-FF)
        Count: 1
< HCI Command: Host Number of Comp.. (0x03|0x0035) plen 5  #97 [hci1] 15.603615
        Num handles: 1
        Handle: 1929 Address: DF:A9:FF:F6:B1:1A (OUI DF-A9-FF)
        Count: 1
< ACL Data TX: Handle 1929 flags 0x00 dlen 26              #98 [hci1] 15.603706
      LE L2CAP: Enhanced Credit Connection Response (0x18) ident 1 len 18
        MTU: 249
        MPS: 251
        Credits: 1
        Result: Connection successful (0x0000)
        Destination CID: 64
        Destination CID: 65
        Destination CID: 66
        Destination CID: 67
        Destination CID: 68
> HCI Event: Number of Completed Packets (0x13) plen 5     #99 [hci1] 15.706776
        Num handles: 1
        Handle: 1929 Address: DF:A9:FF:F6:B1:1A (OUI DF-A9-FF)
        Count: 1
        #98: len 26 (2 Kb/s)
        Latency: 103 msec (68-167 msec ~130 msec)
< ACL Data TX: Handle 1929 flags 0x00 dlen 13             #100 [hci1] 18.153535
      Channel: 80 len 9 sdu 7 [PSM 39 mode Enhanced Credit (0x81)] {chan 4}
      ATT: Read By Group Type Request (0x10) len 6
        Handle range: 0x0001-0xffff
        Attribute group type: Primary Service (0x2800)
> HCI Event: Number of Completed Packets (0x13) plen 5    #101 [hci1] 18.244551
        Num handles: 1
        Handle: 1929 Address: DF:A9:FF:F6:B1:1A (OUI DF-A9-FF)
        Count: 1
        #100: len 13 (1 Kb/s)
        Latency: 91 msec (68-167 msec ~110 msec)
        Channel: 80 [PSM 39 mode Enhanced Credit (0x81)] {chan 4}
        Channel Latency: 91 msec (91-91 msec ~91 msec)
> ACL Data RX: Handle 1929 flags 0x02 dlen 20             #102 [hci1] 18.244944
      Channel: 68 len 16 sdu 14 [PSM 39 mode Enhanced Credit (0x81)] {chan 4}
      ATT: Read By Group Type Response (0x11) len 13
        Attribute data length: 6
        Attribute group list: 2 entries
        Handle range: 0x0001-0x0007
        UUID: Generic Access Profile (0x1800)
        Handle range: 0x0020-0x0029
        UUID: Generic Attribute Profile (0x1801)
< HCI Command: Host Number of Com.. (0x03|0x0035) plen 5  #103 [hci1] 18.263617
        Num handles: 1
        Handle: 1929 Address: DF:A9:FF:F6:B1:1A (OUI DF-A9-FF)
        Count: 1
< ACL Data TX: Handle 1929 flags 0x00 dlen 13             #104 [hci1] 18.263686
      Channel: 80 len 9 sdu 7 [PSM 39 mode Enhanced Credit (0x81)] {chan 4}
      ATT: Read By Group Type Request (0x10) len 6
        Handle range: 0x002a-0xffff
        Attribute group type: Primary Service (0x2800)
< ACL Data TX: Handle 1929 flags 0x00 dlen 12             #105 [hci1] 18.263784
      LE L2CAP: LE Flow Control Credit (0x16) ident 2 len 4
        Source CID: 68
        Credits: 1
> HCI Event: Number of Completed Packets (0x13) plen 5    #106 [hci1] 18.332307
        Num handles: 1
        Handle: 1929 Address: DF:A9:FF:F6:B1:1A (OUI DF-A9-FF)
        Count: 1
        #104: len 13 (1 Kb/s)
        Latency: 68 msec (68-167 msec ~89 msec)
        Channel: 80 [PSM 39 mode Enhanced Credit (0x81)] {chan 4}
        Channel Latency: 68 msec (68-91 msec ~79 msec)
> HCI Event: Number of Completed Packets (0x13) plen 5    #107 [hci1] 18.419366
        Num handles: 1
        Handle: 1929 Address: DF:A9:FF:F6:B1:1A (OUI DF-A9-FF)
        Count: 1
        #105: len 12 (0 Kb/s)
        Latency: 155 msec (68-167 msec ~122 msec)
        Channel: 80 [PSM 39 mode Enhanced Credit (0x81)] {chan 4}
        Channel Latency: 155 msec (68-155 msec ~117 msec)
> ACL Data RX: Handle 1929 flags 0x02 dlen 11             #108 [hci1] 18.419667
      Channel: 68 len 7 sdu 5 [PSM 39 mode Enhanced Credit (0x81)] {chan 4}
      ATT: Error Response (0x01) len 4
        Read By Group Type Request (0x10)
        Handle: 0x002a
        Error: Attribute Not Found (0x0a)
< HCI Command: Host Number of Com.. (0x03|0x0035) plen 5  #109 [hci1] 18.423506
        Num handles: 1
        Handle: 1929 Address: DF:A9:FF:F6:B1:1A (OUI DF-A9-FF)
        Count: 1
< ACL Data TX: Handle 1929 flags 0x00 dlen 12             #110 [hci1] 18.423512
      LE L2CAP: LE Flow Control Credit (0x16) ident 3 len 4
        Source CID: 68
        Credits: 1
> HCI Event: Number of Completed Packets (0x13) plen 5    #111 [hci1] 18.594255
        Num handles: 1
        Handle: 1929 Address: DF:A9:FF:F6:B1:1A (OUI DF-A9-FF)
        Count: 1
        #110: len 12 (0 Kb/s)
        Latency: 170 msec (68-170 msec ~146 msec)
        Channel: 80 [PSM 39 mode Enhanced Credit (0x81)] {chan 4}
        Channel Latency: 170 msec (68-170 msec ~144 msec)
> HCI Event: Disconnect Complete (0x05) plen 4            #112 [hci1] 20.957039
        Status: Success (0x00)
        Handle: 1929 Address: DF:A9:FF:F6:B1:1A (OUI DF-A9-FF)
        Reason: Remote User Terminated Connection (0x13)
< HCI Command: LE Set Extended A.. (0x08|0x0036) plen 25  #113 [hci1] 21.503472
        Handle: 0x00
        Properties: 0x0013
          Connectable
          Scannable
          Use legacy advertising PDUs: ADV_IND
        Min advertising interval: 100.000 msec (0x00a0)
        Max advertising interval: 150.000 msec (0x00f0)
        Channel map: 37, 38, 39 (0x07)
        Own address type: Random (0x01)
        Peer address type: Public (0x00)
        Peer address: 00:00:00:00:00:00 (OUI 00-00-00)
        Filter policy: Allow Scan Request from Any, Allow Connect Request from Any (0x00)
        TX power: Host has no preference (0x7f)
        Primary PHY: LE 1M (0x01)
        Secondary max skip: 0x00
        Secondary PHY: LE 1M (0x01)
        SID: 0x00
        Scan request notifications: Disabled (0x00)
> HCI Event: Command Complete (0x0e) plen 5               #114 [hci1] 21.504246
      LE Set Extended Advertising Parameters (0x08|0x0036) ncmd 1
        Status: Success (0x00)
        TX power (selected): 0 dbm (0x00)
< HCI Command: LE Set Advertising.. (0x08|0x0035) plen 7  #115 [hci1] 21.523397
        Advertising handle: 0x00
        Advertising random address: D5:B6:CC:31:DB:3B (Static)
> HCI Event: Command Complete (0x0e) plen 4               #116 [hci1] 21.523949
      LE Set Advertising Set Random Address (0x08|0x0035) ncmd 1
        Status: Success (0x00)
< HCI Command: LE Set Extended A.. (0x08|0x0037) plen 22  #117 [hci1] 21.543456
        Handle: 0x00
        Operation: Complete extended advertising data (0x03)
        Fragment preference: Minimize fragmentation (0x01)
        Data length: 0x12
        Flags: 0x06
          LE General Discoverable Mode
          BR/EDR Not Supported
        Name (complete): Tester_F6B11A
> HCI Event: Command Complete (0x0e) plen 4               #118 [hci1] 21.544256
      LE Set Extended Advertising Data (0x08|0x0037) ncmd 1
        Status: Success (0x00)
< HCI Command: LE Set Extended Sc.. (0x08|0x0038) plen 4  #119 [hci1] 21.563377
        Handle: 0x00
        Operation: Complete scan response data (0x03)
        Fragment preference: Minimize fragmentation (0x01)
        Data length: 0x00
> HCI Event: Command Complete (0x0e) plen 4               #120 [hci1] 21.563884
      LE Set Extended Scan Response Data (0x08|0x0038) ncmd 1
        Status: Success (0x00)
< HCI Command: LE Set Extended Ad.. (0x08|0x0039) plen 6  #121 [hci1] 21.583497
        Extended advertising: Enabled (0x01)
        Number of sets: 1 (0x01)
        Entry 0
          Handle: 0x00
          Duration: 0 ms (0x00)
          Max ext adv events: 0
> HCI Event: Command Complete (0x0e) plen 4               #122 [hci1] 21.584129
      LE Set Extended Advertising Enable (0x08|0x0039) ncmd 1
        Status: Success (0x00)
> HCI Event: LE Meta Event (0x3e) plen 31                 #123 [hci1] 22.213982
      LE Enhanced Connection Complete (0x0a)
        Status: Success (0x00)
        Handle: 1947
        Role: Peripheral (0x01)
        Peer address type: Public (0x00)
        Peer address: DF:A9:FF:F6:B1:1A (OUI DF-A9-FF)
        Local resolvable private address: 00:00:00:00:00:00 (Non-Resolvable)
        Peer resolvable private address: 00:00:00:00:00:00 (Non-Resolvable)
        Connection interval: 87.50 msec (0x0046)
        Connection latency: 0 (0x0000)
        Supervision timeout: 20000 msec (0x07d0)
        Central clock accuracy: 0x01
> HCI Event: LE Meta Event (0x3e) plen 6                  #124 [hci1] 22.214116
      LE Advertising Set Terminated (0x12)
        Status: Success (0x00)
        Handle: 0
        Connection handle: 1947
        Number of completed extended advertising events: 0
< HCI Command: LE Read Remote Use.. (0x08|0x0016) plen 2  #125 [hci1] 22.224420
        Handle: 1947 Address: DF:A9:FF:F6:B1:1A (OUI DF-A9-FF)
> HCI Event: Command Status (0x0f) plen 4                 #126 [hci1] 22.224904
      LE Read Remote Used Features (0x08|0x0016) ncmd 1
        Status: Success (0x00)
> HCI Event: LE Meta Event (0x3e) plen 12                 #127 [hci1] 22.477903
      LE Read Remote Used Features (0x04)
        Status: Success (0x00)
        Handle: 1947 Address: DF:A9:FF:F6:B1:1A (OUI DF-A9-FF)
        Features: 0x2d 0x49 0x00 0xf7 0x67 0xd9 0x00 0x80
          LE Encryption
          Extended Reject Indication
          Peripheral-initiated Features Exchange
          LE Data Packet Length Extension
          LE 2M PHY
          LE Coded PHY
          Channel Selection Algorithm #2
          Periodic Advertising Sync Transfer - Sender
          Periodic Advertising Sync Transfer - Recipient
          Sleep Clock Accuracy Updates
          Connected Isochronous Stream - Central
          Connected Isochronous Stream - Peripheral
          Isochronous Broadcaster
          Synchronized Receiver
          Connected Isochronous Stream (Host Support)
          LE Power Control Request
          LE Power Control Request
          Connection Subrating
          Connection Subrating (Host Support)
          Unknown features (0x8000d90000000000)
< ACL Data TX: Handle 1947 flags 0x00 dlen 16             #128 [hci1] 27.233839
      LE L2CAP: Connection Parameter Update Request (0x12) ident 4 len 8
        Min interval: 24
        Max interval: 40
        Peripheral latency: 0
        Timeout multiplier: 42
> HCI Event: Number of Completed Packets (0x13) plen 5    #129 [hci1] 27.377360
        Num handles: 1
        Handle: 1947 Address: DF:A9:FF:F6:B1:1A (OUI DF-A9-FF)
        Count: 1
        #128: len 16 (0 Kb/s)
        Latency: 143 msec (143-143 msec ~143 msec)
> ACL Data RX: Handle 1947 flags 0x02 dlen 10             #130 [hci1] 27.377751
      LE L2CAP: Connection Parameter Update Response (0x13) ident 4 len 2
        Result: Connection Parameters accepted (0x0000)
< HCI Command: Host Number of Com.. (0x03|0x0035) plen 5  #131 [hci1] 27.384276
        Num handles: 1
        Handle: 1947 Address: DF:A9:FF:F6:B1:1A (OUI DF-A9-FF)
        Count: 1
> HCI Event: LE Meta Event (0x3e) plen 13                 #132 [hci1] 30.265358
      LE Long Term Key Request (0x05)
        Handle: 1947 Address: DF:A9:FF:F6:B1:1A (OUI DF-A9-FF)
        Random number: 0x0000000000000000
        Encrypted diversifier: 0x0000
< HCI Command: LE Long Term Key... (0x08|0x001a) plen 18  #133 [hci1] 30.284005
        Handle: 1947 Address: DF:A9:FF:F6:B1:1A (OUI DF-A9-FF)
        Long term key: cd18feacddcd77a0208559697019ef56
> HCI Event: Command Complete (0x0e) plen 6               #134 [hci1] 30.284804
      LE Long Term Key Request Reply (0x08|0x001a) ncmd 1
        Status: Success (0x00)
        Handle: 1947 Address: DF:A9:FF:F6:B1:1A (OUI DF-A9-FF)
> HCI Event: Encryption Change (0x08) plen 4              #135 [hci1] 30.702640
        Status: Success (0x00)
        Handle: 1947 Address: DF:A9:FF:F6:B1:1A (OUI DF-A9-FF)
        Encryption: Enabled with AES-CCM (0x01)
> ACL Data RX: Handle 1947 flags 0x02 dlen 26             #136 [hci1] 30.790240
      LE L2CAP: Enhanced Credit Connection Request (0x17) ident 2 len 18
        PSM: 39 (0x0027)
        MTU: 64
        MPS: 64
        Credits: 5
        Source CID: 84
        Source CID: 83
        Source CID: 82
        Source CID: 81
        Source CID: 80
< HCI Command: Host Number of Com.. (0x03|0x0035) plen 5  #137 [hci1] 30.804160
        Num handles: 1
        Handle: 1947 Address: DF:A9:FF:F6:B1:1A (OUI DF-A9-FF)
        Count: 1
< ACL Data TX: Handle 1947 flags 0x00 dlen 26             #138 [hci1] 30.804268
      LE L2CAP: Enhanced Credit Connection Response (0x18) ident 2 len 18
        MTU: 249
        MPS: 251
        Credits: 1
        Result: Connection successful (0x0000)
        Destination CID: 64
        Destination CID: 65
        Destination CID: 66
        Destination CID: 67
        Destination CID: 68
> HCI Event: Number of Completed Packets (0x13) plen 5    #139 [hci1] 30.964760
        Num handles: 1
        Handle: 1947 Address: DF:A9:FF:F6:B1:1A (OUI DF-A9-FF)
        Count: 1
        #138: len 26 (1 Kb/s)
        Latency: 160 msec (143-160 msec ~152 msec)
< ACL Data TX: Handle 1947 flags 0x00 dlen 13             #140 [hci1] 33.284393
      Channel: 80 len 9 sdu 7 [PSM 39 mode Enhanced Credit (0x81)] {chan 9}
      ATT: Read By Group Type Request (0x10) len 6
        Handle range: 0x0001-0xffff
        Attribute group type: Primary Service (0x2800)
> HCI Event: Number of Completed Packets (0x13) plen 5    #141 [hci1] 33.415206
        Num handles: 1
        Handle: 1947 Address: DF:A9:FF:F6:B1:1A (OUI DF-A9-FF)
        Count: 1
        #140: len 13 (0 Kb/s)
        Latency: 130 msec (130-160 msec ~141 msec)
        Channel: 80 [PSM 39 mode Enhanced Credit (0x81)] {chan 9}
        Channel Latency: 130 msec (130-130 msec ~130 msec)
> ACL Data RX: Handle 1947 flags 0x02 dlen 27             #142 [hci1] 33.415449
> ACL Data RX: Handle 1947 flags 0x01 dlen 27             #143 [hci1] 33.415918
> ACL Data RX: Handle 1947 flags 0x01 dlen 2              #144 [hci1] 33.416178
      Channel: 68 len 52 sdu 50 [PSM 39 mode Enhanced Credit (0x81)] {chan 9}
      ATT: Read By Group Type Response (0x11) len 49
        Attribute data length: 6
        Attribute group list: 8 entries
        Handle range: 0x0020-0x0029
        UUID: Generic Attribute Profile (0x1801)
        Handle range: 0x0040-0x0049
        UUID: Unknown (0xa00a)
        Handle range: 0x0060-0x0062
        UUID: Unknown (0xa00b)
        Handle range: 0x0080-0x0086
        UUID: Generic Access Profile (0x1800)
        Handle range: 0x00a0-0x00a3
        UUID: Unknown (0xa00b)
        Handle range: 0x00c0-0x00cb
        UUID: Unknown (0xa00b)
        Handle range: 0x00e0-0x00e6
        UUID: Unknown (0xa00b)
        Handle range: 0x0100-0x0105
        UUID: Unknown (0xa00b)
< HCI Command: Host Number of Com.. (0x03|0x0035) plen 5  #145 [hci1] 33.423904
        Num handles: 1
        Handle: 1947 Address: DF:A9:FF:F6:B1:1A (OUI DF-A9-FF)
        Count: 1
< HCI Command: Host Number of Com.. (0x03|0x0035) plen 5  #146 [hci1] 33.423992
        Num handles: 1
        Handle: 1947 Address: DF:A9:FF:F6:B1:1A (OUI DF-A9-FF)
        Count: 1
< HCI Command: Host Number of Com.. (0x03|0x0035) plen 5  #147 [hci1] 33.424236
        Num handles: 1
        Handle: 1947 Address: DF:A9:FF:F6:B1:1A (OUI DF-A9-FF)
        Count: 1
< ACL Data TX: Handle 1947 flags 0x00 dlen 13             #148 [hci1] 33.424273
      Channel: 80 len 9 sdu 7 [PSM 39 mode Enhanced Credit (0x81)] {chan 9}
      ATT: Read By Group Type Request (0x10) len 6
        Handle range: 0x0106-0xffff
        Attribute group type: Primary Service (0x2800)
< ACL Data TX: Handle 1947 flags 0x00 dlen 12             #149 [hci1] 33.424337
      LE L2CAP: LE Flow Control Credit (0x16) ident 5 len 4
        Source CID: 68
        Credits: 1
> HCI Event: Number of Completed Packets (0x13) plen 5    #150 [hci1] 33.502746
        Num handles: 1
        Handle: 1947 Address: DF:A9:FF:F6:B1:1A (OUI DF-A9-FF)
        Count: 1
        #148: len 13 (1 Kb/s)
        Latency: 78 msec (78-160 msec ~109 msec)
        Channel: 80 [PSM 39 mode Enhanced Credit (0x81)] {chan 9}
        Channel Latency: 78 msec (78-130 msec ~104 msec)
> HCI Event: Number of Completed Packets (0x13) plen 5    #151 [hci1] 33.589982
        Num handles: 1
        Handle: 1947 Address: DF:A9:FF:F6:B1:1A (OUI DF-A9-FF)
        Count: 1
        #149: len 12 (0 Kb/s)
        Latency: 165 msec (78-165 msec ~137 msec)
        Channel: 80 [PSM 39 mode Enhanced Credit (0x81)] {chan 9}
        Channel Latency: 165 msec (78-165 msec ~135 msec)
> ACL Data RX: Handle 1947 flags 0x02 dlen 27             #152 [hci1] 33.590369
> ACL Data RX: Handle 1947 flags 0x01 dlen 1              #153 [hci1] 33.590439
      Channel: 68 len 24 sdu 22 [PSM 39 mode Enhanced Credit (0x81)] {chan 9}
      ATT: Read By Group Type Response (0x11) len 21
        Attribute data length: 20
        Attribute group list: 1 entry
        Handle range: 0x0120-0x0126
        UUID: Vendor specific (0000a00c-0000-0000-0123-456789abcdef)
< HCI Command: Host Number of Com.. (0x03|0x0035) plen 5  #154 [hci1] 33.603855
        Num handles: 1
        Handle: 1947 Address: DF:A9:FF:F6:B1:1A (OUI DF-A9-FF)
        Count: 1
< HCI Command: Host Number of Com.. (0x03|0x0035) plen 5  #155 [hci1] 33.603950
        Num handles: 1
        Handle: 1947 Address: DF:A9:FF:F6:B1:1A (OUI DF-A9-FF)
        Count: 1
< ACL Data TX: Handle 1947 flags 0x00 dlen 13             #156 [hci1] 33.603954
      Channel: 80 len 9 sdu 7 [PSM 39 mode Enhanced Credit (0x81)] {chan 9}
      ATT: Read By Group Type Request (0x10) len 6
        Handle range: 0x0127-0xffff
        Attribute group type: Primary Service (0x2800)
< ACL Data TX: Handle 1947 flags 0x00 dlen 12             #157 [hci1] 33.604149
      LE L2CAP: LE Flow Control Credit (0x16) ident 6 len 4
        Source CID: 68
        Credits: 1
> HCI Event: Number of Completed Packets (0x13) plen 5    #158 [hci1] 33.677910
        Num handles: 1
        Handle: 1947 Address: DF:A9:FF:F6:B1:1A (OUI DF-A9-FF)
        Count: 1
        #156: len 13 (1 Kb/s)
        Latency: 73 msec (73-165 msec ~105 msec)
        Channel: 80 [PSM 39 mode Enhanced Credit (0x81)] {chan 9}
        Channel Latency: 73 msec (73-165 msec ~104 msec)
> HCI Event: Number of Completed Packets (0x13) plen 5    #159 [hci1] 33.765080
        Num handles: 1
        Handle: 1947 Address: DF:A9:FF:F6:B1:1A (OUI DF-A9-FF)
        Count: 1
        #157: len 12 (0 Kb/s)
        Latency: 160 msec (73-165 msec ~133 msec)
> ACL Data RX: Handle 1947 flags 0x02 dlen 14             #160 [hci1] 33.765171
      Channel: 68 len 10 sdu 8 [PSM 39 mode Enhanced Credit (0x81)] {chan 9}
      ATT: Read By Group Type Response (0x11) len 7
        Attribute data length: 6
        Attribute group list: 1 entry
        Handle range: 0x0140-0x015d
        UUID: Unknown (0xa00f)
< HCI Command: Host Number of Com.. (0x03|0x0035) plen 5  #161 [hci1] 33.783810
        Num handles: 1
        Handle: 1947 Address: DF:A9:FF:F6:B1:1A (OUI DF-A9-FF)
        Count: 1
< ACL Data TX: Handle 1947 flags 0x00 dlen 13             #162 [hci1] 33.783875
      Channel: 80 len 9 sdu 7 [PSM 39 mode Enhanced Credit (0x81)] {chan 9}
      ATT: Read By Group Type Request (0x10) len 6
        Handle range: 0x015e-0xffff
        Attribute group type: Primary Service (0x2800)
< ACL Data TX: Handle 1947 flags 0x00 dlen 12             #163 [hci1] 33.784014
      LE L2CAP: LE Flow Control Credit (0x16) ident 7 len 4
        Source CID: 68
        Credits: 1
> HCI Event: Number of Completed Packets (0x13) plen 5    #164 [hci1] 33.852860
        Num handles: 1
        Handle: 1947 Address: DF:A9:FF:F6:B1:1A (OUI DF-A9-FF)
        Count: 1
        #162: len 13 (1 Kb/s)
        Latency: 68 msec (68-165 msec ~101 msec)
        Channel: 80 [PSM 39 mode Enhanced Credit (0x81)] {chan 9}
        Channel Latency: 68 msec (68-165 msec ~86 msec)
> HCI Event: Number of Completed Packets (0x13) plen 5    #165 [hci1] 33.939857
        Num handles: 1
        Handle: 1947 Address: DF:A9:FF:F6:B1:1A (OUI DF-A9-FF)
        Count: 1
        #163: len 12 (0 Kb/s)
        Latency: 155 msec (68-165 msec ~128 msec)
        Channel: 80 [PSM 39 mode Enhanced Credit (0x81)] {chan 9}
        Channel Latency: 155 msec (68-165 msec ~121 msec)
> ACL Data RX: Handle 1947 flags 0x02 dlen 12             #166 [hci1] 33.940036
      LE L2CAP: LE Flow Control Credit (0x16) ident 3 len 4
        Source CID: 80
        Credits: 10
> ACL Data RX: Handle 1947 flags 0x02 dlen 27             #167 [hci1] 33.940740
> ACL Data RX: Handle 1947 flags 0x01 dlen 1              #168 [hci1] 33.940936
      Channel: 68 len 24 sdu 22 [PSM 39 mode Enhanced Credit (0x81)] {chan 9}
      ATT: Read By Group Type Response (0x11) len 21
        Attribute data length: 20
        Attribute group list: 1 entry
        Handle range: 0x0170-0x01b1
        UUID: Vendor specific (0000a00c-0000-0000-0123-456789abcdef)
< HCI Command: Host Number of Com.. (0x03|0x0035) plen 5  #169 [hci1] 33.943697
        Num handles: 1
        Handle: 1947 Address: DF:A9:FF:F6:B1:1A (OUI DF-A9-FF)
        Count: 1
< HCI Command: Host Number of Com.. (0x03|0x0035) plen 5  #170 [hci1] 33.943917
        Num handles: 1
        Handle: 1947 Address: DF:A9:FF:F6:B1:1A (OUI DF-A9-FF)
        Count: 1
< HCI Command: Host Number of Com.. (0x03|0x0035) plen 5  #171 [hci1] 33.944056
        Num handles: 1
        Handle: 1947 Address: DF:A9:FF:F6:B1:1A (OUI DF-A9-FF)
        Count: 1
< ACL Data TX: Handle 1947 flags 0x00 dlen 13             #172 [hci1] 33.944103
      Channel: 80 len 9 sdu 7 [PSM 39 mode Enhanced Credit (0x81)] {chan 9}
      ATT: Read By Group Type Request (0x10) len 6
        Handle range: 0x01b2-0xffff
        Attribute group type: Primary Service (0x2800)
< ACL Data TX: Handle 1947 flags 0x00 dlen 12             #173 [hci1] 33.944132
      LE L2CAP: LE Flow Control Credit (0x16) ident 8 len 4
        Source CID: 68
        Credits: 1
> HCI Event: Number of Completed Packets (0x13) plen 5    #174 [hci1] 34.027828
        Num handles: 1
        Handle: 1947 Address: DF:A9:FF:F6:B1:1A (OUI DF-A9-FF)
        Count: 1
        #172: len 13 (1 Kb/s)
        Latency: 83 msec (68-165 msec ~106 msec)
> HCI Event: Number of Completed Packets (0x13) plen 5    #175 [hci1] 34.115059
        Num handles: 1
        Handle: 1947 Address: DF:A9:FF:F6:B1:1A (OUI DF-A9-FF)
        Count: 1
        #173: len 12 (0 Kb/s)
        Latency: 170 msec (68-170 msec ~138 msec)
        Channel: 80 [PSM 39 mode Enhanced Credit (0x81)] {chan 9}
        Channel Latency: 170 msec (68-170 msec ~146 msec)
> ACL Data RX: Handle 1947 flags 0x02 dlen 27             #176 [hci1] 34.115298
> ACL Data RX: Handle 1947 flags 0x01 dlen 27             #177 [hci1] 34.115910
> ACL Data RX: Handle 1947 flags 0x01 dlen 2              #178 [hci1] 34.116162
      Channel: 68 len 52 sdu 50 [PSM 39 mode Enhanced Credit (0x81)] {chan 9}
      ATT: Read By Group Type Response (0x11) len 49
        Attribute data length: 6
        Attribute group list: 8 entries
        Handle range: 0x01f0-0x0216
        UUID: Battery Service (0x180f)
        Handle range: 0x0250-0x0269
        UUID: Blood Pressure (0x1810)
        Handle range: 0x02a0-0x02b1
        UUID: Pulse Oximeter (0x1822)
        Handle range: 0x02d0-0x02d6
        UUID: Bond Management (0x181e)
        Handle range: 0x0310-0x0369
        UUID: User Data (0x181c)
        Handle range: 0x03a0-0x03a7
        UUID: Current Time Service (0x1805)
        Handle range: 0x03c0-0x03c2
        UUID: Next DST Change Service (0x1807)
        Handle range: 0x03e0-0x03e4
        UUID: Reference Time Update Service (0x1806)
< HCI Command: Host Number of Com.. (0x03|0x0035) plen 5  #179 [hci1] 34.123823
        Num handles: 1
        Handle: 1947 Address: DF:A9:FF:F6:B1:1A (OUI DF-A9-FF)
        Count: 1
< HCI Command: Host Number of Com.. (0x03|0x0035) plen 5  #180 [hci1] 34.123943
        Num handles: 1
        Handle: 1947 Address: DF:A9:FF:F6:B1:1A (OUI DF-A9-FF)
        Count: 1
< HCI Command: Host Number of Com.. (0x03|0x0035) plen 5  #181 [hci1] 34.124144
        Num handles: 1
        Handle: 1947 Address: DF:A9:FF:F6:B1:1A (OUI DF-A9-FF)
        Count: 1
< ACL Data TX: Handle 1947 flags 0x00 dlen 13             #182 [hci1] 34.124209
      Channel: 80 len 9 sdu 7 [PSM 39 mode Enhanced Credit (0x81)] {chan 9}
      ATT: Read By Group Type Request (0x10) len 6
        Handle range: 0x03e5-0xffff
        Attribute group type: Primary Service (0x2800)
< ACL Data TX: Handle 1947 flags 0x00 dlen 12             #183 [hci1] 34.124267
      LE L2CAP: LE Flow Control Credit (0x16) ident 9 len 4
        Source CID: 68
        Credits: 1
> HCI Event: Number of Completed Packets (0x13) plen 5    #184 [hci1] 34.202873
        Num handles: 1
        Handle: 1947 Address: DF:A9:FF:F6:B1:1A (OUI DF-A9-FF)
        Count: 1
        #182: len 13 (1 Kb/s)
        Latency: 78 msec (68-170 msec ~108 msec)
        Channel: 80 [PSM 39 mode Enhanced Credit (0x81)] {chan 9}
        Channel Latency: 78 msec (68-170 msec ~112 msec)
> HCI Event: Number of Completed Packets (0x13) plen 5    #185 [hci1] 34.289870
        Num handles: 1
        Handle: 1947 Address: DF:A9:FF:F6:B1:1A (OUI DF-A9-FF)
        Count: 1
        #183: len 12 (0 Kb/s)
        Latency: 165 msec (68-170 msec ~137 msec)
> ACL Data RX: Handle 1947 flags 0x02 dlen 11             #186 [hci1] 34.290121
      Channel: 68 len 7 sdu 5 [PSM 39 mode Enhanced Credit (0x81)] {chan 9}
      ATT: Error Response (0x01) len 4
        Read By Group Type Request (0x10)
        Handle: 0x03e5
        Error: Attribute Not Found (0x0a)
< HCI Command: Host Number of Com.. (0x03|0x0035) plen 5  #187 [hci1] 34.304022
        Num handles: 1
        Handle: 1947 Address: DF:A9:FF:F6:B1:1A (OUI DF-A9-FF)
        Count: 1
< ACL Data TX: Handle 1947 flags 0x00 dlen 12             #188 [hci1] 34.304043
      LE L2CAP: LE Flow Control Credit (0x16) ident 10 len 4
        Source CID: 68
        Credits: 1
> HCI Event: Number of Completed Packets (0x13) plen 5    #189 [hci1] 34.464782
        Num handles: 1
        Handle: 1947 Address: DF:A9:FF:F6:B1:1A (OUI DF-A9-FF)
        Count: 1
        #188: len 12 (0 Kb/s)
        Latency: 160 msec (68-170 msec ~148 msec)
        Channel: 80 [PSM 39 mode Enhanced Credit (0x81)] {chan 9}
        Channel Latency: 160 msec (68-170 msec ~136 msec)
> HCI Event: Disconnect Complete (0x05) plen 4            #190 [hci1] 36.827553
        Status: Success (0x00)
        Handle: 1947 Address: DF:A9:FF:F6:B1:1A (OUI DF-A9-FF)
        Reason: Remote User Terminated Connection (0x13)
< HCI Command: LE Set Extended A.. (0x08|0x0036) plen 25  #191 [hci1] 37.403711
        Handle: 0x00
        Properties: 0x0013
          Connectable
          Scannable
          Use legacy advertising PDUs: ADV_IND
        Min advertising interval: 100.000 msec (0x00a0)
        Max advertising interval: 150.000 msec (0x00f0)
        Channel map: 37, 38, 39 (0x07)
        Own address type: Random (0x01)
        Peer address type: Public (0x00)
        Peer address: 00:00:00:00:00:00 (OUI 00-00-00)
        Filter policy: Allow Scan Request from Any, Allow Connect Request from Any (0x00)
        TX power: Host has no preference (0x7f)
        Primary PHY: LE 1M (0x01)
        Secondary max skip: 0x00
        Secondary PHY: LE 1M (0x01)
        SID: 0x00
        Scan request notifications: Disabled (0x00)
> HCI Event: Command Complete (0x0e) plen 5               #192 [hci1] 37.404564
      LE Set Extended Advertising Parameters (0x08|0x0036) ncmd 1
        Status: Success (0x00)
        TX power (selected): 0 dbm (0x00)
< HCI Command: LE Set Advertising.. (0x08|0x0035) plen 7  #193 [hci1] 37.423569
        Advertising handle: 0x00
        Advertising random address: D5:B6:CC:31:DB:3B (Static)
