Bluetooth monitor ver 5.72
= Note: Linux version 6.14.0-36-generic (x86_64)                       0.455741
= Note: Bluetooth subsystem version 2.22                               0.455743
= New Index: 00:00:00:00:00:00 (Primary,UART,hci1)              [hci1] 0.455744
= New Index: 48:5F:99:8E:E0:64 (Primary,USB,hci0)               [hci0] 0.455745
= Open Index: 00:00:00:00:00:00                                 [hci1] 0.969346
= Index Info: 00:00:00:00:00:00 (Nordic Semiconductor ASA)      [hci1] 0.969350
@ USER Open: main (privileged) version 2.22            {0x0001} [hci1] 0.969352
< HCI Command: Reset (0x03|0x0003) plen 0                    #1 [hci1] 0.969728
> HCI Event: Command Complete (0x0e) plen 4                  #2 [hci1] 0.970207
      Reset (0x03|0x0003) ncmd 1
        Status: Success (0x00)
< HCI Command: Read Local Supported... (0x04|0x0003) plen 0  #3 [hci1] 0.989267
> HCI Event: Command Complete (0x0e) plen 12                 #4 [hci1] 0.989760
      Read Local Supported Features (0x04|0x0003) ncmd 1
        Status: Success (0x00)
        Features: 0x00 0x00 0x00 0x00 0x60 0x00 0x00 0x00
          BR/EDR Not Supported
          LE Supported (Controller)
< HCI Command: Read Local Version In.. (0x04|0x0001) plen 0  #5 [hci1] 1.009285
> HCI Event: Command Complete (0x0e) plen 12                 #6 [hci1] 1.009837
      Read Local Version Information (0x04|0x0001) ncmd 1
        Status: Success (0x00)
        HCI version: Reserved (0x0f) - Revision 12393 (0x3069)
        LMP version: Reserved (0x0f) - Subversion 12393 (0x3069)
        Manufacturer: Nordic Semiconductor ASA (89)
< HCI Command: Read Local Supported... (0x04|0x0002) plen 0  #7 [hci1] 1.029280
> HCI Event: Command Complete (0x0e) plen 68                 #8 [hci1] 1.030481
      Read Local Supported Commands (0x04|0x0002) ncmd 1
        Status: Success (0x00)
        Commands: 119 entries
          Disconnect (Octet 0 - Bit 5)
          Read Remote Version Information (Octet 2 - Bit 7)
          Set Event Mask (Octet 5 - Bit 6)
          Reset (Octet 5 - Bit 7)
          Read Connection Accept Timeout (Octet 7 - Bit 2)
          Write Connection Accept Timeout (Octet 7 - Bit 3)
          Read Transmit Power Level (Octet 10 - Bit 2)
          Set Controller To Host Flow Control (Octet 10 - Bit 5)
          Host Buffer Size (Octet 10 - Bit 6)
          Host Number of Completed Packets (Octet 10 - Bit 7)
          Read Local Version Information (Octet 14 - Bit 3)
          Read Local Supported Features (Octet 14 - Bit 5)
          Read BD ADDR (Octet 15 - Bit 1)
          Read RSSI (Octet 15 - Bit 5)
          Set Event Mask Page 2 (Octet 22 - Bit 2)
          LE Set Event Mask (Octet 25 - Bit 0)
          LE Read Buffer Size (Octet 25 - Bit 1)
          LE Read Local Supported Features (Octet 25 - Bit 2)
          LE Set Random Address (Octet 25 - Bit 4)
          LE Set Advertising Parameters (Octet 25 - Bit 5)
          LE Read Advertising Channel TX Power (Octet 25 - Bit 6)
          LE Set Advertising Data (Octet 25 - Bit 7)
          LE Set Scan Response Data (Octet 26 - Bit 0)
          LE Set Advertise Enable (Octet 26 - Bit 1)
          LE Set Scan Parameters (Octet 26 - Bit 2)
          LE Set Scan Enable (Octet 26 - Bit 3)
          LE Create Connection (Octet 26 - Bit 4)
          LE Create Connection Cancel (Octet 26 - Bit 5)
          LE Read Accept List Size (Octet 26 - Bit 6)
          LE Clear Accept List (Octet 26 - Bit 7)
          LE Add Device To Accept List (Octet 27 - Bit 0)
          LE Remove Device From Accept List (Octet 27 - Bit 1)
          LE Connection Update (Octet 27 - Bit 2)
          LE Set Host Channel Classification (Octet 27 - Bit 3)
          LE Read Channel Map (Octet 27 - Bit 4)
          LE Read Remote Used Features (Octet 27 - Bit 5)
          LE Encrypt (Octet 27 - Bit 6)
          LE Rand (Octet 27 - Bit 7)
          LE Start Encryption (Octet 28 - Bit 0)
          LE Long Term Key Request Reply (Octet 28 - Bit 1)
          LE Long Term Key Request Neg Reply (Octet 28 - Bit 2)
          LE Read Supported States (Octet 28 - Bit 3)
          LE Receiver Test (Octet 28 - Bit 4)
          LE Transmitter Test (Octet 28 - Bit 5)
          LE Test End (Octet 28 - Bit 6)
          Read Authenticated Payload Timeout (Octet 32 - Bit 4)
          Write Authenticated Payload Timeout (Octet 32 - Bit 5)
          LE Set Data Length (Octet 33 - Bit 6)
          LE Read Suggested Default Data Length (Octet 33 - Bit 7)
          LE Write Suggested Default Data Length (Octet 34 - Bit 0)
          LE Add Device To Resolving List (Octet 34 - Bit 3)
          LE Remove Device From Resolving List (Octet 34 - Bit 4)
          LE Clear Resolving List (Octet 34 - Bit 5)
          LE Read Resolving List Size (Octet 34 - Bit 6)
          LE Set Address Resolution Enable (Octet 35 - Bit 1)
          LE Set Resolvable Private Address Timeout (Octet 35 - Bit 2)
          LE Read Maximum Data Length (Octet 35 - Bit 3)
          LE Read PHY (Octet 35 - Bit 4)
          LE Set Default PHY (Octet 35 - Bit 5)
          LE Set PHY (Octet 35 - Bit 6)
          LE Enhanced Receiver Test (Octet 35 - Bit 7)
          LE Enhanced Transmitter Test (Octet 36 - Bit 0)
          LE Set Advertising Set Random Address (Octet 36 - Bit 1)
          LE Set Extended Advertising Parameters (Octet 36 - Bit 2)
          LE Set Extended Advertising Data (Octet 36 - Bit 3)
          LE Set Extended Scan Response Data (Octet 36 - Bit 4)
          LE Set Extended Advertising Enable (Octet 36 - Bit 5)
          LE Read Maximum Advertising Data Length (Octet 36 - Bit 6)
          LE Read Number of Supported Advertising Sets (Octet 36 - Bit 7)
          LE Remove Advertising Set (Octet 37 - Bit 0)
          LE Clear Advertising Sets (Octet 37 - Bit 1)
          LE Set Periodic Advertising Parameters (Octet 37 - Bit 2)
          LE Set Periodic Advertising Data (Octet 37 - Bit 3)
          LE Set Periodic Advertising Enable (Octet 37 - Bit 4)
          LE Set Extended Scan Parameters (Octet 37 - Bit 5)
          LE Set Extended Scan Enable (Octet 37 - Bit 6)
          LE Extended Create Connection (Octet 37 - Bit 7)
          LE Periodic Advertising Create Sync (Octet 38 - Bit 0)
          LE Periodic Advertising Create Sync Cancel (Octet 38 - Bit 1)
          LE Periodic Advertising Terminate Sync (Octet 38 - Bit 2)
          LE Add Device To Periodic Advertiser List (Octet 38 - Bit 3)
          LE Remove Device From Periodic Advertiser List (Octet 38 - Bit 4)
          LE Clear Periodic Advertiser List (Octet 38 - Bit 5)
          LE Read Periodic Advertiser List Size (Octet 38 - Bit 6)
          LE Read Transmit Power (Octet 38 - Bit 7)
          LE Read RF Path Compensation (Octet 39 - Bit 0)
          LE Write RF Path Compensation (Octet 39 - Bit 1)
          LE Set Privacy Mode (Octet 39 - Bit 2)
          LE Periodic Advertising Receive Enable (Octet 40 - Bit 5)
          LE Periodic Advertising Sync Transfer (Octet 40 - Bit 6)
          LE Periodic Advertising Set Info Transfer (Octet 40 - Bit 7)
          LE Periodic Advertising Sync Transfer Parameters (Octet 41 - Bit 0)
          LE Set Default Periodic Advertisng Sync Transfer Parameters (Octet 41 - Bit 1)
          LE Read Buffer v2 (Octet 41 - Bit 5)
          LE Read ISO TX Sync (Octet 41 - Bit 6)
          LE Set Connected Isochronous Group Parameters (Octet 41 - Bit 7)
          LE Set Connected Isochronous Group Parameters Test (Octet 42 - Bit 0)
          LE Create Connected Isochronous Stream (Octet 42 - Bit 1)
          LE Remove Connected Isochronous Group (Octet 42 - Bit 2)
          LE Accept Connected Isochronous Stream Request (Octet 42 - Bit 3)
          LE Reject Connected Isochronous Stream Request (Octet 42 - Bit 4)
          LE Create Broadcast Isochronous Group (Octet 42 - Bit 5)
          LE Create Broadcast Isochronous Group Test (Octet 42 - Bit 6)
          LE Terminate Broadcast Isochronous Group (Octet 42 - Bit 7)
          LE Broadcast Isochronous Group Create Sync (Octet 43 - Bit 0)
          LE Broadcast Isochronous Group Terminate Sync (Octet 43 - Bit 1)
          LE Request Peer SCA (Octet 43 - Bit 2)
          LE Setup Isochronous Data Path (Octet 43 - Bit 3)
          LE Remove Isochronous Data Path (Octet 43 - Bit 4)
          LE Isochronous Transmit Test (Octet 43 - Bit 5)
          LE Isochronous Receive Test (Octet 43 - Bit 6)
          LE Isochronous Read Test Counters (Octet 43 - Bit 7)
          LE Isochronous Read Test Counters (Octet 44 - Bit 0)
          LE Set Host Feature (Octet 44 - Bit 1)
          Octet 44 - Bit 2 
          Octet 45 - Bit 6 
          Octet 46 - Bit 0 
          Octet 46 - Bit 1 
          Octet 46 - Bit 2 
< HCI Command: Host Buffer Size (0x03|0x0033) plen 7         #9 [hci1] 1.049280
        ACL MTU: 255  ACL max packet: 16
        SCO MTU: 0    SCO max packet: 0
> HCI Event: Command Complete (0x0e) plen 4                 #10 [hci1] 1.049775
      Host Buffer Size (0x03|0x0033) ncmd 1
        Status: Success (0x00)
< HCI Command: Set Controller To Ho.. (0x03|0x0031) plen 1  #11 [hci1] 1.069283
        Flow control: ACL Data Packets (0x01)
> HCI Event: Command Complete (0x0e) plen 4                 #12 [hci1] 1.069793
      Set Controller To Host Flow Control (0x03|0x0031) ncmd 1
        Status: Success (0x00)
< HCI Command: LE Read Local Suppor.. (0x08|0x0003) plen 0  #13 [hci1] 1.089314
> HCI Event: Command Complete (0x0e) plen 12                #14 [hci1] 1.089869
      LE Read Local Supported Features (0x08|0x0003) ncmd 1
        Status: Success (0x00)
        Features: 0xfd 0x79 0x00 0xf7 0x30 0x01 0x00 0x00
          LE Encryption
          Extended Reject Indication
          Peripheral-initiated Features Exchange
          LE Ping
          LE Data Packet Length Extension
          LL Privacy
          Extended Scanner Filter Policies
          LE 2M PHY
          LE Coded PHY
          LE Extended Advertising
          LE Periodic Advertising
          Channel Selection Algorithm #2
          Periodic Advertising Sync Transfer - Sender
          Periodic Advertising Sync Transfer - Recipient
          Sleep Clock Accuracy Updates
          Connected Isochronous Stream - Central
          Connected Isochronous Stream - Peripheral
          Isochronous Broadcaster
          Synchronized Receiver
          Periodic Advertising ADI support
          Connection Subrating
          Unknown features (0x0000010000000000)
< HCI Command: LE Set Host Feature (0x08|0x0074) plen 2     #15 [hci1] 1.109296
        Bit Number: 32
          Connected Isochronous Stream (Host Support)
        Bit Value: 1
> HCI Event: Command Complete (0x0e) plen 4                 #16 [hci1] 1.109702
      LE Set Host Feature (0x08|0x0074) ncmd 1
        Status: Success (0x00)
< HCI Command: LE Read Buffer v2 (0x08|0x0060) plen 0       #17 [hci1] 1.129281
> HCI Event: Command Complete (0x0e) plen 10                #18 [hci1] 1.129771
      LE Read Buffer v2 (0x08|0x0060) ncmd 1
        Status: Success (0x00)
        ACL MTU: 27
        ACL max packet: 3
        ISO MTU: 318
        ISO max packet: 3
< HCI Command: LE Read Maximum Adve.. (0x08|0x003a) plen 0  #19 [hci1] 1.149315
> HCI Event: Command Complete (0x0e) plen 6                 #20 [hci1] 1.149775
      LE Read Maximum Advertising Data Length (0x08|0x003a) ncmd 1
        Status: Success (0x00)
        Max length: 1650
< HCI Command: LE Read Supported St.. (0x08|0x001c) plen 0  #21 [hci1] 1.169278
> HCI Event: Command Complete (0x0e) plen 12                #22 [hci1] 1.169708
      LE Read Supported States (0x08|0x001c) ncmd 1
        Status: Success (0x00)
        States: 0x000003ff3e0306ff
          Non-connectable Advertising State
          Scannable Advertising State
          Connectable Advertising State
          High Duty Cycle Directed Advertising State
          Passive Scanning State
          Active Scanning State
          Initiating State
            and Connection State (Central Role)
          Connection State (Peripheral Role)
          Scannable Advertising State
            and Passive Scanning State
          Connectable Advertising State
            and Passive Scanning State
          Non-connectable Advertising State
            and Initiating State
          Scannable Advertising State
            and Initiating State
          Active Scanning State
            and Connection State (Central Role)
          Passive Scanning State
            and Connection State (Peripheral Role)
          Active Scanning State
            and Connection State (Peripheral Role)
          Initiating State
            and Connection State (Central Role)
            and Central Role & Central Role
          Low Duty Cycle Directed Advertising State
          Connectable Advertising State
            and Initiating State
            and Central Role & Peripheral Role
          High Duty Cycle Directed Advertising State
            and Initiating State
            and Central Role & Peripheral Role
          Low Duty Cycle Directed Advertising State
            and Initiating State
            and Central Role & Peripheral Role
          Connectable Advertising State
            and Connection State (Central Role)
            and Central Role & Peripheral Role
          High Duty Cycle Directed Advertising State
            and Connection State (Central Role)
            and Central Role & Peripheral Role
          Low Duty Cycle Directed Advertising State
            and Connection State (Central Role)
            and Central Role & Peripheral Role
          Connectable Advertising State
            and Connection State (Peripheral Role)
            and Central Role & Peripheral Role
          High Duty Cycle Directed Advertising State
            and Connection State (Peripheral Role)
            and Peripheral Role & Peripheral Role
          Low Duty Cycle Directed Advertising State
            and Connection State (Peripheral Role)
            and Peripheral Role & Peripheral Role
          Initiating State
            and Connection State (Peripheral Role)
            and Central Role & Peripheral Role
< HCI Command: LE Read Maximum Data.. (0x08|0x002f) plen 0  #23 [hci1] 1.189282
> HCI Event: Command Complete (0x0e) plen 12                #24 [hci1] 1.189797
      LE Read Maximum Data Length (0x08|0x002f) ncmd 1
        Status: Success (0x00)
        Max TX octets: 251
        Max TX time: 2704
        Max RX octets: 251
        Max RX time: 2704
< HCI Command: LE Write Suggested D.. (0x08|0x0024) plen 4  #25 [hci1] 1.209280
        TX octets: 251
        TX time: 2704
> HCI Event: Command Complete (0x0e) plen 4                 #26 [hci1] 1.209789
      LE Write Suggested Default Data Length (0x08|0x0024) ncmd 1
        Status: Success (0x00)
< HCI Command: LE Read Resolving Li.. (0x08|0x002a) plen 0  #27 [hci1] 1.229295
> HCI Event: Command Complete (0x0e) plen 5                 #28 [hci1] 1.229675
      LE Read Resolving List Size (0x08|0x002a) ncmd 1
        Status: Success (0x00)
        Size: 8
< HCI Command: LE Set Event Mask (0x08|0x0001) plen 8       #29 [hci1] 1.249279
        Mask: 0x000002023f87fa5e
          LE Advertising Report
          LE Connection Update Complete
          LE Read Remote Used Features Complete
          LE Long Term Key Request
          LE Data Length Change
          LE Enhanced Connection Complete
          LE PHY Update Complete
          LE Extended Advertising Report
          LE Periodic Advertising Sync Established
          LE Periodic Advertising Report
          LE Periodic Advertising Sync Lost
          LE Extended Scan Timeout
          LE Extended Advertising Set Terminated
          LE Scan Request Received
          LE Periodic Advertising Sync Transfer Rvc
          LE CIS Established
          LE CIS Request
          LE Create BIG Complete
          LE Terminate BIG Complete
          LE BIG Sync Estabilished Complete
          LE BIG Sync Lost
          LE BIG Info Advertising Report
          Unknown mask (0x0000020000000000)
> HCI Event: Command Complete (0x0e) plen 4                 #30 [hci1] 1.249844
      LE Set Event Mask (0x08|0x0001) ncmd 1
        Status: Success (0x00)
< HCI Command: Set Event Mask (0x03|0x0001) plen 8          #31 [hci1] 1.269278
        Mask: 0x2000800002008890
          Disconnection Complete
          Encryption Change
          Read Remote Version Information Complete
          Hardware Error
          Data Buffer Overflow
          Encryption Key Refresh Complete
          LE Meta
> HCI Event: Command Complete (0x0e) plen 4                 #32 [hci1] 1.269756
      Set Event Mask (0x03|0x0001) ncmd 1
        Status: Success (0x00)
< HCI Command: Read BD ADDR (0x04|0x0009) plen 0            #33 [hci1] 1.289283
> HCI Event: Command Complete (0x0e) plen 10                #34 [hci1] 1.289773
      Read BD ADDR (0x04|0x0009) ncmd 1
        Status: Success (0x00)
        Address: 00:00:00:00:00:00 (OUI 00-00-00)
< HCI Command: LE Set Random Address (0x08|0x0005) plen 6   #35 [hci1] 1.309294
        Address: D5:B6:CC:31:DB:3B (Static)
> HCI Event: Command Complete (0x0e) plen 4                 #36 [hci1] 1.309718
      LE Set Random Address (0x08|0x0005) ncmd 1
        Status: Success (0x00)
< HCI Command: LE Set Extended Adv.. (0x08|0x0036) plen 25  #37 [hci1] 3.799543
        Handle: 0x00
        Properties: 0x0013
          Connectable
          Scannable
          Use legacy advertising PDUs: ADV_IND
        Min advertising interval: 100.000 msec (0x00a0)
        Max advertising interval: 150.000 msec (0x00f0)
        Channel map: 37, 38, 39 (0x07)
        Own address type: Random (0x01)
        Peer address type: Public (0x00)
        Peer address: 00:00:00:00:00:00 (OUI 00-00-00)
        Filter policy: Allow Scan Request from Any, Allow Connect Request from Any (0x00)
        TX power: Host has no preference (0x7f)
        Primary PHY: LE 1M (0x01)
        Secondary max skip: 0x00
        Secondary PHY: LE 1M (0x01)
        SID: 0x00
        Scan request notifications: Disabled (0x00)
> HCI Event: Command Complete (0x0e) plen 5                 #38 [hci1] 3.800393
      LE Set Extended Advertising Parameters (0x08|0x0036) ncmd 1
        Status: Success (0x00)
        TX power (selected): 0 dbm (0x00)
< HCI Command: LE Set Advertising S.. (0x08|0x0035) plen 7  #39 [hci1] 3.809315
        Advertising handle: 0x00
        Advertising random address: D5:B6:CC:31:DB:3B (Static)
> HCI Event: Command Complete (0x0e) plen 4                 #40 [hci1] 3.809819
      LE Set Advertising Set Random Address (0x08|0x0035) ncmd 1
        Status: Success (0x00)
< HCI Command: LE Set Extended Adv.. (0x08|0x0037) plen 22  #41 [hci1] 3.829314
        Handle: 0x00
        Operation: Complete extended advertising data (0x03)
        Fragment preference: Minimize fragmentation (0x01)
        Data length: 0x12
        Flags: 0x06
          LE General Discoverable Mode
          BR/EDR Not Supported
        Name (complete): Tester_F6B11A
> HCI Event: Command Complete (0x0e) plen 4                 #42 [hci1] 3.830133
      LE Set Extended Advertising Data (0x08|0x0037) ncmd 1
        Status: Success (0x00)
< HCI Command: LE Set Extended Scan.. (0x08|0x0038) plen 4  #43 [hci1] 3.849297
        Handle: 0x00
        Operation: Complete scan response data (0x03)
        Fragment preference: Minimize fragmentation (0x01)
        Data length: 0x00
> HCI Event: Command Complete (0x0e) plen 4                 #44 [hci1] 3.849796
      LE Set Extended Scan Response Data (0x08|0x0038) ncmd 1
        Status: Success (0x00)
< HCI Command: LE Set Extended Adve.. (0x08|0x0039) plen 6  #45 [hci1] 3.869390
        Extended advertising: Enabled (0x01)
        Number of sets: 1 (0x01)
        Entry 0
          Handle: 0x00
          Duration: 0 ms (0x00)
          Max ext adv events: 0
> HCI Event: Command Complete (0x0e) plen 4                 #46 [hci1] 3.870008
      LE Set Extended Advertising Enable (0x08|0x0039) ncmd 1
        Status: Success (0x00)
> HCI Event: LE Meta Event (0x3e) plen 31                   #47 [hci1] 4.191431
      LE Enhanced Connection Complete (0x0a)
        Status: Success (0x00)
        Handle: 2019
        Role: Peripheral (0x01)
        Peer address type: Public (0x00)
        Peer address: DF:A9:FF:F6:B1:1A (OUI DF-A9-FF)
        Local resolvable private address: 00:00:00:00:00:00 (Non-Resolvable)
        Peer resolvable private address: 00:00:00:00:00:00 (Non-Resolvable)
        Connection interval: 87.50 msec (0x0046)
        Connection latency: 0 (0x0000)
        Supervision timeout: 25120 msec (0x09d0)
        Central clock accuracy: 0x01
> HCI Event: LE Meta Event (0x3e) plen 6                    #48 [hci1] 4.191501
      LE Advertising Set Terminated (0x12)
        Status: Success (0x00)
        Handle: 0
        Connection handle: 2019
        Number of completed extended advertising events: 0
< HCI Command: LE Read Remote Used... (0x08|0x0016) plen 2  #49 [hci1] 4.209543
        Handle: 2019 Address: DF:A9:FF:F6:B1:1A (OUI DF-A9-FF)
< ACL Data TX: Handle 2019 flags 0x00 dlen 7                #50 [hci1] 4.209551
      ATT: Exchange MTU Request (0x02) len 2
        Client RX MTU: 251
> HCI Event: Command Status (0x0f) plen 4                   #51 [hci1] 4.210173
      LE Read Remote Used Features (0x08|0x0016) ncmd 1
        Status: Success (0x00)
> HCI Event: Number of Completed Packets (0x13) plen 5      #52 [hci1] 4.367418
        Num handles: 1
        Handle: 2019 Address: DF:A9:FF:F6:B1:1A (OUI DF-A9-FF)
        Count: 1
        #50: len 7 (0 Kb/s)
        Latency: 157 msec (157-157 msec ~157 msec)
> HCI Event: LE Meta Event (0x3e) plen 12                   #53 [hci1] 4.455309
      LE Read Remote Used Features (0x04)
        Status: Success (0x00)
        Handle: 2019 Address: DF:A9:FF:F6:B1:1A (OUI DF-A9-FF)
        Features: 0x2d 0x49 0x00 0xf7 0x67 0xd8 0x00 0x00
          LE Encryption
          Extended Reject Indication
          Peripheral-initiated Features Exchange
          LE Data Packet Length Extension
          LE 2M PHY
          LE Coded PHY
          Channel Selection Algorithm #2
          Periodic Advertising Sync Transfer - Sender
          Periodic Advertising Sync Transfer - Recipient
          Sleep Clock Accuracy Updates
          Connected Isochronous Stream - Central
          Connected Isochronous Stream - Peripheral
          Isochronous Broadcaster
          Synchronized Receiver
          Connected Isochronous Stream (Host Support)
          LE Power Control Request
          LE Power Control Request
          Connection Subrating
          Connection Subrating (Host Support)
          Unknown features (0x0000d80000000000)
> ACL Data RX: Handle 2019 flags 0x02 dlen 11               #54 [hci1] 6.904969
      SMP: Pairing Request (0x01) len 6
        IO capability: KeyboardDisplay (0x04)
        OOB data: Authentication data not present (0x00)
        Authentication requirement: Bonding, MITM, SC, No Keypresses (0x0d)
        Max encryption key size: 16
        Initiator key distribution: EncKey IdKey (0x03)
        Responder key distribution: EncKey IdKey Sign (0x07)
> ACL Data RX: Handle 2019 flags 0x02 dlen 7                #55 [hci1] 6.905461
      ATT: Exchange MTU Response (0x03) len 2
        Server RX MTU: 23
< HCI Command: Host Number of Compl.. (0x03|0x0035) plen 5  #56 [hci1] 6.909690
        Num handles: 1
        Handle: 2019 Address: DF:A9:FF:F6:B1:1A (OUI DF-A9-FF)
        Count: 1
< ACL Data TX: Handle 2019 flags 0x00 dlen 11               #57 [hci1] 6.909893
      SMP: Pairing Response (0x02) len 6
        IO capability: DisplayOnly (0x00)
        OOB data: Authentication data not present (0x00)
        Authentication requirement: Bonding, No MITM, SC, No Keypresses (0x09)
        Max encryption key size: 16
        Initiator key distribution: IdKey (0x02)
        Responder key distribution: <none> (0x00)
< HCI Command: Host Number of Compl.. (0x03|0x0035) plen 5  #58 [hci1] 6.910074
        Num handles: 1
        Handle: 2019 Address: DF:A9:FF:F6:B1:1A (OUI DF-A9-FF)
        Count: 1
> HCI Event: Number of Completed Packets (0x13) plen 5      #59 [hci1] 7.080104
        Num handles: 1
        Handle: 2019 Address: DF:A9:FF:F6:B1:1A (OUI DF-A9-FF)
        Count: 1
        #57: len 11 (0 Kb/s)
        Latency: 170 msec (157-170 msec ~164 msec)
> ACL Data RX: Handle 2019 flags 0x02 dlen 27               #60 [hci1] 7.080478
> ACL Data RX: Handle 2019 flags 0x01 dlen 27               #61 [hci1] 7.080938
> ACL Data RX: Handle 2019 flags 0x01 dlen 15               #62 [hci1] 7.081364
      SMP: Pairing Public Key (0x0c) len 64
        X: 677e6d4725fdffdebbcd35b2c44e1d958e227a598b484b3ce68265332b749dd3
        Y: 7f1eaaf3dcc4abdf3b4d25bb42509421e01bcc05d11d9ac4de8d641156ca055d
< HCI Command: Host Number of Compl.. (0x03|0x0035) plen 5  #63 [hci1] 7.089717
        Num handles: 1
        Handle: 2019 Address: DF:A9:FF:F6:B1:1A (OUI DF-A9-FF)
        Count: 1
< HCI Command: Host Number of Compl.. (0x03|0x0035) plen 5  #64 [hci1] 7.089879
        Num handles: 1
        Handle: 2019 Address: DF:A9:FF:F6:B1:1A (OUI DF-A9-FF)
        Count: 1
< HCI Command: Host Number of Compl.. (0x03|0x0035) plen 5  #65 [hci1] 7.090091
        Num handles: 1
        Handle: 2019 Address: DF:A9:FF:F6:B1:1A (OUI DF-A9-FF)
        Count: 1
< ACL Data TX: Handle 2019 flags 0x00 dlen 27               #66 [hci1] 7.090204
< ACL Data TX: Handle 2019 flags 0x01 dlen 27               #67 [hci1] 7.090210
< ACL Data TX: Handle 2019 flags 0x01 dlen 15               #68 [hci1] 7.090223
      SMP: Pairing Public Key (0x0c) len 64
        X: 98308440221e2d910f0e54b71e7ec652857aa9b5a0dc65028824cc19db1226e9
        Y: 67a4816bcb62efb21701e31fdb27561a6217575fb007a8bbdabe7e28b6f68482
> HCI Event: Number of Completed Packets (0x13) plen 5      #69 [hci1] 7.167941
        Num handles: 1
        Handle: 2019 Address: DF:A9:FF:F6:B1:1A (OUI DF-A9-FF)
        Count: 1
        #66: len 27 (2 Kb/s)
        Latency: 77 msec (77-170 msec ~120 msec)
> HCI Event: Number of Completed Packets (0x13) plen 5      #70 [hci1] 7.168610
        Num handles: 1
        Handle: 2019 Address: DF:A9:FF:F6:B1:1A (OUI DF-A9-FF)
        Count: 1
        #67: len 27 (2 Kb/s)
        Latency: 78 msec (77-170 msec ~99 msec)
> HCI Event: Number of Completed Packets (0x13) plen 5      #71 [hci1] 7.254792
        Num handles: 1
        Handle: 2019 Address: DF:A9:FF:F6:B1:1A (OUI DF-A9-FF)
        Count: 1
        #68: len 15 (0 Kb/s)
        Latency: 164 msec (77-170 msec ~132 msec)
> ACL Data RX: Handle 2019 flags 0x02 dlen 21               #72 [hci1] 7.955124
      SMP: Pairing Confirm (0x03) len 16
        Confim value: 54af270dcf3bfc26ca64098d03b3dcab
< HCI Command: Host Number of Compl.. (0x03|0x0035) plen 5  #73 [hci1] 7.969586
        Num handles: 1
        Handle: 2019 Address: DF:A9:FF:F6:B1:1A (OUI DF-A9-FF)
        Count: 1
< ACL Data TX: Handle 2019 flags 0x00 dlen 21               #74 [hci1] 7.969682
      SMP: Pairing Confirm (0x03) len 16
        Confim value: 58ef6fa6459664c9694e7383edc4ab11
> HCI Event: Number of Completed Packets (0x13) plen 5      #75 [hci1] 8.130081
        Num handles: 1
        Handle: 2019 Address: DF:A9:FF:F6:B1:1A (OUI DF-A9-FF)
        Count: 1
        #74: len 21 (1 Kb/s)
        Latency: 160 msec (77-170 msec ~146 msec)
> ACL Data RX: Handle 2019 flags 0x02 dlen 21               #76 [hci1] 8.130323
      SMP: Pairing Random (0x04) len 16
        Random value: 2afa6f3472ca2cf50000000000000000
< HCI Command: Host Number of Compl.. (0x03|0x0035) plen 5  #77 [hci1] 8.150229
        Num handles: 1
        Handle: 2019 Address: DF:A9:FF:F6:B1:1A (OUI DF-A9-FF)
        Count: 1
< ACL Data TX: Handle 2019 flags 0x00 dlen 21               #78 [hci1] 8.150301
      SMP: Pairing Random (0x04) len 16
        Random value: 8e6108f966a694cbe26df70bb96773e6
> HCI Event: Number of Completed Packets (0x13) plen 5      #79 [hci1] 8.304703
        Num handles: 1
        Handle: 2019 Address: DF:A9:FF:F6:B1:1A (OUI DF-A9-FF)
        Count: 1
        #78: len 21 (1 Kb/s)
        Latency: 154 msec (77-170 msec ~150 msec)
> ACL Data RX: Handle 2019 flags 0x02 dlen 21               #80 [hci1] 8.392624
      SMP: Pairing Confirm (0x03) len 16
        Confim value: 57b334fab7af581254d2212da2e75f55
< HCI Command: Host Number of Compl.. (0x03|0x0035) plen 5  #81 [hci1] 8.409674
        Num handles: 1
        Handle: 2019 Address: DF:A9:FF:F6:B1:1A (OUI DF-A9-FF)
        Count: 1
< ACL Data TX: Handle 2019 flags 0x00 dlen 21               #82 [hci1] 8.409790
      SMP: Pairing Confirm (0x03) len 16
        Confim value: 5cd7212df8550573a30a51c3c91e97d6
> HCI Event: Number of Completed Packets (0x13) plen 5      #83 [hci1] 8.567525
        Num handles: 1
        Handle: 2019 Address: DF:A9:FF:F6:B1:1A (OUI DF-A9-FF)
        Count: 1
        #82: len 21 (1 Kb/s)
        Latency: 157 msec (77-170 msec ~154 msec)
> ACL Data RX: Handle 2019 flags 0x02 dlen 21               #84 [hci1] 8.567832
      SMP: Pairing Random (0x04) len 16
        Random value: ab0ea29d6b8a9f230000000000000000
< HCI Command: Host Number of Compl.. (0x03|0x0035) plen 5  #85 [hci1] 8.569880
        Num handles: 1
        Handle: 2019 Address: DF:A9:FF:F6:B1:1A (OUI DF-A9-FF)
        Count: 1
< ACL Data TX: Handle 2019 flags 0x00 dlen 21               #86 [hci1] 8.570030
      SMP: Pairing Random (0x04) len 16
        Random value: 4d02679f89a05211af56d8b3da64d21e
> HCI Event: Number of Completed Packets (0x13) plen 5      #87 [hci1] 8.742297
        Num handles: 1
        Handle: 2019 Address: DF:A9:FF:F6:B1:1A (OUI DF-A9-FF)
        Count: 1
        #86: len 21 (0 Kb/s)
        Latency: 172 msec (77-172 msec ~163 msec)
> ACL Data RX: Handle 2019 flags 0x02 dlen 21               #88 [hci1] 8.830154
      SMP: Pairing Confirm (0x03) len 16
        Confim value: b73d70ee39ee5403540b52d0fbc42720
< HCI Command: Host Number of Compl.. (0x03|0x0035) plen 5  #89 [hci1] 8.849728
        Num handles: 1
        Handle: 2019 Address: DF:A9:FF:F6:B1:1A (OUI DF-A9-FF)
        Count: 1
< ACL Data TX: Handle 2019 flags 0x00 dlen 21               #90 [hci1] 8.849879
      SMP: Pairing Confirm (0x03) len 16
        Confim value: c4c2d616fe85c28bc5e6484eda3775d3
> HCI Event: Number of Completed Packets (0x13) plen 5      #91 [hci1] 9.005159
        Num handles: 1
        Handle: 2019 Address: DF:A9:FF:F6:B1:1A (OUI DF-A9-FF)
        Count: 1
        #90: len 21 (1 Kb/s)
        Latency: 155 msec (77-172 msec ~159 msec)
> ACL Data RX: Handle 2019 flags 0x02 dlen 21               #92 [hci1] 9.005357
      SMP: Pairing Random (0x04) len 16
        Random value: f9adaef0ca5809a60000000000000000
< HCI Command: Host Number of Compl.. (0x03|0x0035) plen 5  #93 [hci1] 9.010031
        Num handles: 1
        Handle: 2019 Address: DF:A9:FF:F6:B1:1A (OUI DF-A9-FF)
        Count: 1
< ACL Data TX: Handle 2019 flags 0x00 dlen 21               #94 [hci1] 9.010174
      SMP: Pairing Random (0x04) len 16
        Random value: 5e8286bc235a02440d0c3424a2acf8fd
> HCI Event: Number of Completed Packets (0x13) plen 5      #95 [hci1] 9.179693
        Num handles: 1
        Handle: 2019 Address: DF:A9:FF:F6:B1:1A (OUI DF-A9-FF)
        Count: 1
        #94: len 21 (0 Kb/s)
        Latency: 169 msec (77-172 msec ~164 msec)
> ACL Data RX: Handle 2019 flags 0x02 dlen 21               #96 [hci1] 9.267533
      SMP: Pairing Confirm (0x03) len 16
        Confim value: de3b0a4250ed2f6f905ae2610f20ee3c
< HCI Command: Host Number of Compl.. (0x03|0x0035) plen 5  #97 [hci1] 9.269912
        Num handles: 1
        Handle: 2019 Address: DF:A9:FF:F6:B1:1A (OUI DF-A9-FF)
        Count: 1
< ACL Data TX: Handle 2019 flags 0x00 dlen 21               #98 [hci1] 9.270142
      SMP: Pairing Confirm (0x03) len 16
        Confim value: 2ec8aab6d15da390122702194211e133
> HCI Event: Number of Completed Packets (0x13) plen 5      #99 [hci1] 9.442417
        Num handles: 1
        Handle: 2019 Address: DF:A9:FF:F6:B1:1A (OUI DF-A9-FF)
        Count: 1
        #98: len 21 (0 Kb/s)
        Latency: 172 msec (77-172 msec ~168 msec)
> ACL Data RX: Handle 2019 flags 0x02 dlen 21              #100 [hci1] 9.442773
      SMP: Pairing Random (0x04) len 16
        Random value: 21f3547be0c675400000000000000000
< HCI Command: Host Number of Comp.. (0x03|0x0035) plen 5  #101 [hci1] 9.449698
        Num handles: 1
        Handle: 2019 Address: DF:A9:FF:F6:B1:1A (OUI DF-A9-FF)
        Count: 1
< ACL Data TX: Handle 2019 flags 0x00 dlen 21              #102 [hci1] 9.449783
      SMP: Pairing Random (0x04) len 16
        Random value: 5c4a1bcadd27bd58e945097b00bad7ac
> HCI Event: Number of Completed Packets (0x13) plen 5     #103 [hci1] 9.617239
        Num handles: 1
        Handle: 2019 Address: DF:A9:FF:F6:B1:1A (OUI DF-A9-FF)
        Count: 1
        #102: len 21 (1 Kb/s)
        Latency: 167 msec (77-172 msec ~167 msec)
> ACL Data RX: Handle 2019 flags 0x02 dlen 21              #104 [hci1] 9.705120
      SMP: Pairing Confirm (0x03) len 16
        Confim value: 9231f199e54a142c4c80278c94625582
< HCI Command: Host Number of Comp.. (0x03|0x0035) plen 5  #105 [hci1] 9.709608
        Num handles: 1
        Handle: 2019 Address: DF:A9:FF:F6:B1:1A (OUI DF-A9-FF)
        Count: 1
< ACL Data TX: Handle 2019 flags 0x00 dlen 21              #106 [hci1] 9.709703
      SMP: Pairing Confirm (0x03) len 16
        Confim value: 02b0c07b1b6a9eabead861a40cea0d85
> HCI Event: Number of Completed Packets (0x13) plen 5     #107 [hci1] 9.879935
        Num handles: 1
        Handle: 2019 Address: DF:A9:FF:F6:B1:1A (OUI DF-A9-FF)
        Count: 1
        #106: len 21 (0 Kb/s)
        Latency: 170 msec (77-172 msec ~169 msec)
> ACL Data RX: Handle 2019 flags 0x02 dlen 21              #108 [hci1] 9.880222
      SMP: Pairing Random (0x04) len 16
        Random value: d554ffcd084446590000000000000000
< HCI Command: Host Number of Comp.. (0x03|0x0035) plen 5  #109 [hci1] 9.889779
        Num handles: 1
        Handle: 2019 Address: DF:A9:FF:F6:B1:1A (OUI DF-A9-FF)
        Count: 1
< ACL Data TX: Handle 2019 flags 0x00 dlen 21              #110 [hci1] 9.889830
      SMP: Pairing Random (0x04) len 16
        Random value: 32527e6e64e79f33b2e374394db8ab2d
> HCI Event: Number of Completed Packets (0x13) plen 5    #111 [hci1] 10.054799
        Num handles: 1
        Handle: 2019 Address: DF:A9:FF:F6:B1:1A (OUI DF-A9-FF)
        Count: 1
        #110: len 21 (1 Kb/s)
        Latency: 164 msec (77-172 msec ~167 msec)
> ACL Data RX: Handle 2019 flags 0x02 dlen 21             #112 [hci1] 10.142594
      SMP: Pairing Confirm (0x03) len 16
        Confim value: 37ec12dd97164e46bb6a5af28bdca5a2
< HCI Command: Host Number of Com.. (0x03|0x0035) plen 5  #113 [hci1] 10.149545
        Num handles: 1
        Handle: 2019 Address: DF:A9:FF:F6:B1:1A (OUI DF-A9-FF)
        Count: 1
< ACL Data TX: Handle 2019 flags 0x00 dlen 21             #114 [hci1] 10.149678
      SMP: Pairing Confirm (0x03) len 16
        Confim value: 5ad24e96c4561302a7438ad79267e591
> HCI Event: Number of Completed Packets (0x13) plen 5    #115 [hci1] 10.317413
        Num handles: 1
        Handle: 2019 Address: DF:A9:FF:F6:B1:1A (OUI DF-A9-FF)
        Count: 1
        #114: len 21 (1 Kb/s)
        Latency: 167 msec (77-172 msec ~167 msec)
> ACL Data RX: Handle 2019 flags 0x02 dlen 21             #116 [hci1] 10.317817
      SMP: Pairing Random (0x04) len 16
        Random value: 46c54cc93b2525290000000000000000
< HCI Command: Host Number of Com.. (0x03|0x0035) plen 5  #117 [hci1] 10.329876
        Num handles: 1
        Handle: 2019 Address: DF:A9:FF:F6:B1:1A (OUI DF-A9-FF)
        Count: 1
< ACL Data TX: Handle 2019 flags 0x00 dlen 21             #118 [hci1] 10.329970
      SMP: Pairing Random (0x04) len 16
        Random value: dddbdfe2838e9a8cc6964353c850fef7
> HCI Event: Number of Completed Packets (0x13) plen 5    #119 [hci1] 10.492187
        Num handles: 1
        Handle: 2019 Address: DF:A9:FF:F6:B1:1A (OUI DF-A9-FF)
        Count: 1
        #118: len 21 (1 Kb/s)
        Latency: 162 msec (77-172 msec ~164 msec)
> ACL Data RX: Handle 2019 flags 0x02 dlen 21             #120 [hci1] 10.580048
      SMP: Pairing Confirm (0x03) len 16
        Confim value: 7b15bac830e675c5b3d36c0d6a67b217
< HCI Command: Host Number of Com.. (0x03|0x0035) plen 5  #121 [hci1] 10.589568
        Num handles: 1
        Handle: 2019 Address: DF:A9:FF:F6:B1:1A (OUI DF-A9-FF)
        Count: 1
< ACL Data TX: Handle 2019 flags 0x00 dlen 21             #122 [hci1] 10.589669
      SMP: Pairing Confirm (0x03) len 16
        Confim value: 64df8af082b2c3b112a4bf0ad6ef6964
> HCI Event: Number of Completed Packets (0x13) plen 5    #123 [hci1] 10.754937
        Num handles: 1
        Handle: 2019 Address: DF:A9:FF:F6:B1:1A (OUI DF-A9-FF)
        Count: 1
        #122: len 21 (1 Kb/s)
        Latency: 165 msec (77-172 msec ~165 msec)
> ACL Data RX: Handle 2019 flags 0x02 dlen 21             #124 [hci1] 10.755260
      SMP: Pairing Random (0x04) len 16
        Random value: 1960a07cfeee580b0000000000000000
< HCI Command: Host Number of Com.. (0x03|0x0035) plen 5  #125 [hci1] 10.769837
        Num handles: 1
        Handle: 2019 Address: DF:A9:FF:F6:B1:1A (OUI DF-A9-FF)
        Count: 1
< ACL Data TX: Handle 2019 flags 0x00 dlen 21             #126 [hci1] 10.769908
      SMP: Pairing Random (0x04) len 16
        Random value: eb9f1915536596b6fc3db1c86b2b1970
> HCI Event: Number of Completed Packets (0x13) plen 5    #127 [hci1] 10.929711
        Num handles: 1
        Handle: 2019 Address: DF:A9:FF:F6:B1:1A (OUI DF-A9-FF)
        Count: 1
        #126: len 21 (1 Kb/s)
        Latency: 159 msec (77-172 msec ~162 msec)
> ACL Data RX: Handle 2019 flags 0x02 dlen 21             #128 [hci1] 11.017522
      SMP: Pairing Confirm (0x03) len 16
        Confim value: 0379e59ae84c1a5817e00d6005b7c4b7
< HCI Command: Host Number of Com.. (0x03|0x0035) plen 5  #129 [hci1] 11.029960
        Num handles: 1
        Handle: 2019 Address: DF:A9:FF:F6:B1:1A (OUI DF-A9-FF)
        Count: 1
< ACL Data TX: Handle 2019 flags 0x00 dlen 21             #130 [hci1] 11.030178
      SMP: Pairing Confirm (0x03) len 16
        Confim value: cbcfb47146baf81880072d90e785e55b
> HCI Event: Number of Completed Packets (0x13) plen 5    #131 [hci1] 11.192361
        Num handles: 1
        Handle: 2019 Address: DF:A9:FF:F6:B1:1A (OUI DF-A9-FF)
        Count: 1
        #130: len 21 (1 Kb/s)
        Latency: 162 msec (77-172 msec ~162 msec)
> ACL Data RX: Handle 2019 flags 0x02 dlen 21             #132 [hci1] 11.192671
      SMP: Pairing Random (0x04) len 16
        Random value: 868ec3056a6b3e7d0000000000000000
< HCI Command: Host Number of Com.. (0x03|0x0035) plen 5  #133 [hci1] 11.210076
        Num handles: 1
        Handle: 2019 Address: DF:A9:FF:F6:B1:1A (OUI DF-A9-FF)
        Count: 1
< ACL Data TX: Handle 2019 flags 0x00 dlen 21             #134 [hci1] 11.210243
      SMP: Pairing Random (0x04) len 16
        Random value: 5c794dc9ad9f2c3f295ebd5ad5e1c3cf
> HCI Event: Number of Completed Packets (0x13) plen 5    #135 [hci1] 11.367199
        Num handles: 1
        Handle: 2019 Address: DF:A9:FF:F6:B1:1A (OUI DF-A9-FF)
        Count: 1
        #134: len 21 (1 Kb/s)
        Latency: 156 msec (77-172 msec ~159 msec)
> ACL Data RX: Handle 2019 flags 0x02 dlen 21             #136 [hci1] 11.455127
      SMP: Pairing Confirm (0x03) len 16
        Confim value: 0bf616f73d13f00ee3c86291db3395ce
< HCI Command: Host Number of Com.. (0x03|0x0035) plen 5  #137 [hci1] 11.469755
        Num handles: 1
        Handle: 2019 Address: DF:A9:FF:F6:B1:1A (OUI DF-A9-FF)
        Count: 1
< ACL Data TX: Handle 2019 flags 0x00 dlen 21             #138 [hci1] 11.469888
      SMP: Pairing Confirm (0x03) len 16
        Confim value: 455bf4460949d26aec35e3be44081b8d
> HCI Event: Number of Completed Packets (0x13) plen 5    #139 [hci1] 11.629962
        Num handles: 1
        Handle: 2019 Address: DF:A9:FF:F6:B1:1A (OUI DF-A9-FF)
        Count: 1
        #138: len 21 (1 Kb/s)
        Latency: 160 msec (77-172 msec ~159 msec)
> ACL Data RX: Handle 2019 flags 0x02 dlen 21             #140 [hci1] 11.630207
      SMP: Pairing Random (0x04) len 16
        Random value: 8536c2ad1b5bd1e90000000000000000
< HCI Command: Host Number of Com.. (0x03|0x0035) plen 5  #141 [hci1] 11.650114
        Num handles: 1
        Handle: 2019 Address: DF:A9:FF:F6:B1:1A (OUI DF-A9-FF)
        Count: 1
< ACL Data TX: Handle 2019 flags 0x00 dlen 21             #142 [hci1] 11.650240
      SMP: Pairing Random (0x04) len 16
        Random value: 5c2fff312cdf99c9491988e877355a9a
> HCI Event: Number of Completed Packets (0x13) plen 5    #143 [hci1] 11.804723
        Num handles: 1
        Handle: 2019 Address: DF:A9:FF:F6:B1:1A (OUI DF-A9-FF)
        Count: 1
        #142: len 21 (1 Kb/s)
        Latency: 154 msec (77-172 msec ~157 msec)
> ACL Data RX: Handle 2019 flags 0x02 dlen 21             #144 [hci1] 11.892637
      SMP: Pairing Confirm (0x03) len 16
        Confim value: 9ab60c502f3c4d56ccbd4d7c6098339f
< HCI Command: Host Number of Com.. (0x03|0x0035) plen 5  #145 [hci1] 11.909622
        Num handles: 1
        Handle: 2019 Address: DF:A9:FF:F6:B1:1A (OUI DF-A9-FF)
        Count: 1
< ACL Data TX: Handle 2019 flags 0x00 dlen 21             #146 [hci1] 11.909756
      SMP: Pairing Confirm (0x03) len 16
        Confim value: 6ff80ec85fa00382dd7a0d7c1b4558a0
> HCI Event: Number of Completed Packets (0x13) plen 5    #147 [hci1] 12.067382
        Num handles: 1
        Handle: 2019 Address: DF:A9:FF:F6:B1:1A (OUI DF-A9-FF)
        Count: 1
        #146: len 21 (1 Kb/s)
        Latency: 157 msec (77-172 msec ~157 msec)
> ACL Data RX: Handle 2019 flags 0x02 dlen 21             #148 [hci1] 12.067707
      SMP: Pairing Random (0x04) len 16
        Random value: f030dc200236396b0000000000000000
< HCI Command: Host Number of Com.. (0x03|0x0035) plen 5  #149 [hci1] 12.070008
        Num handles: 1
        Handle: 2019 Address: DF:A9:FF:F6:B1:1A (OUI DF-A9-FF)
        Count: 1
< ACL Data TX: Handle 2019 flags 0x00 dlen 21             #150 [hci1] 12.070109
      SMP: Pairing Random (0x04) len 16
        Random value: c629a3a987d808e808655d558dfc1155
> HCI Event: Number of Completed Packets (0x13) plen 5    #151 [hci1] 12.242181
        Num handles: 1
        Handle: 2019 Address: DF:A9:FF:F6:B1:1A (OUI DF-A9-FF)
        Count: 1
        #150: len 21 (0 Kb/s)
        Latency: 172 msec (77-172 msec ~164 msec)
> ACL Data RX: Handle 2019 flags 0x02 dlen 21             #152 [hci1] 12.330128
      SMP: Pairing Confirm (0x03) len 16
        Confim value: 0c0f06089a0aa2f4efc800ae817e8031
< HCI Command: Host Number of Com.. (0x03|0x0035) plen 5  #153 [hci1] 12.349783
        Num handles: 1
        Handle: 2019 Address: DF:A9:FF:F6:B1:1A (OUI DF-A9-FF)
        Count: 1
< ACL Data TX: Handle 2019 flags 0x00 dlen 21             #154 [hci1] 12.349949
      SMP: Pairing Confirm (0x03) len 16
        Confim value: f2bd15e35bc812c7754ec063495647aa
> HCI Event: Number of Completed Packets (0x13) plen 5    #155 [hci1] 12.504816
        Num handles: 1
        Handle: 2019 Address: DF:A9:FF:F6:B1:1A (OUI DF-A9-FF)
        Count: 1
        #154: len 21 (1 Kb/s)
        Latency: 154 msec (77-172 msec ~159 msec)
> ACL Data RX: Handle 2019 flags 0x02 dlen 21             #156 [hci1] 12.505199
      SMP: Pairing Random (0x04) len 16
        Random value: 3d7550410b525d0a0000000000000000
< HCI Command: Host Number of Com.. (0x03|0x0035) plen 5  #157 [hci1] 12.510204
        Num handles: 1
        Handle: 2019 Address: DF:A9:FF:F6:B1:1A (OUI DF-A9-FF)
        Count: 1
< ACL Data TX: Handle 2019 flags 0x00 dlen 21             #158 [hci1] 12.510329
      SMP: Pairing Random (0x04) len 16
        Random value: 92f20f6ad8f13724432c7fd6001c45ff
> HCI Event: Number of Completed Packets (0x13) plen 5    #159 [hci1] 12.679579
        Num handles: 1
        Handle: 2019 Address: DF:A9:FF:F6:B1:1A (OUI DF-A9-FF)
        Count: 1
        #158: len 21 (0 Kb/s)
        Latency: 169 msec (77-172 msec ~164 msec)
> ACL Data RX: Handle 2019 flags 0x02 dlen 21             #160 [hci1] 12.767537
      SMP: Pairing Confirm (0x03) len 16
        Confim value: 5e8bb201388f5e1658be10077be78bf6
< HCI Command: Host Number of Com.. (0x03|0x0035) plen 5  #161 [hci1] 12.769755
        Num handles: 1
        Handle: 2019 Address: DF:A9:FF:F6:B1:1A (OUI DF-A9-FF)
        Count: 1
< ACL Data TX: Handle 2019 flags 0x00 dlen 21             #162 [hci1] 12.769980
      SMP: Pairing Confirm (0x03) len 16
        Confim value: 146c52bb6007c2d3a5e5e596318770df
> HCI Event: Number of Completed Packets (0x13) plen 5    #163 [hci1] 12.942349
        Num handles: 1
        Handle: 2019 Address: DF:A9:FF:F6:B1:1A (OUI DF-A9-FF)
        Count: 1
        #162: len 21 (0 Kb/s)
        Latency: 172 msec (77-172 msec ~168 msec)
> ACL Data RX: Handle 2019 flags 0x02 dlen 21             #164 [hci1] 12.942703
      SMP: Pairing Random (0x04) len 16
        Random value: b3f8be496bd9784d0000000000000000
< HCI Command: Host Number of Com.. (0x03|0x0035) plen 5  #165 [hci1] 12.950234
        Num handles: 1
        Handle: 2019 Address: DF:A9:FF:F6:B1:1A (OUI DF-A9-FF)
        Count: 1
< ACL Data TX: Handle 2019 flags 0x00 dlen 21             #166 [hci1] 12.950374
      SMP: Pairing Random (0x04) len 16
        Random value: 23ac32ebbb5e14c8a6b9622f296d277f
> HCI Event: Number of Completed Packets (0x13) plen 5    #167 [hci1] 13.117137
        Num handles: 1
        Handle: 2019 Address: DF:A9:FF:F6:B1:1A (OUI DF-A9-FF)
        Count: 1
        #166: len 21 (1 Kb/s)
        Latency: 166 msec (77-172 msec ~167 msec)
> ACL Data RX: Handle 2019 flags 0x02 dlen 21             #168 [hci1] 13.204991
      SMP: Pairing Confirm (0x03) len 16
        Confim value: c459010db86d3a1fdb03b2ec78955dbe
< HCI Command: Host Number of Com.. (0x03|0x0035) plen 5  #169 [hci1] 13.209568
        Num handles: 1
        Handle: 2019 Address: DF:A9:FF:F6:B1:1A (OUI DF-A9-FF)
        Count: 1
< ACL Data TX: Handle 2019 flags 0x00 dlen 21             #170 [hci1] 13.209703
      SMP: Pairing Confirm (0x03) len 16
        Confim value: 2c19706c39ba3149e77e5d156bffd535
> HCI Event: Number of Completed Packets (0x13) plen 5    #171 [hci1] 13.379958
        Num handles: 1
        Handle: 2019 Address: DF:A9:FF:F6:B1:1A (OUI DF-A9-FF)
        Count: 1
        #170: len 21 (0 Kb/s)
        Latency: 170 msec (77-172 msec ~168 msec)
> ACL Data RX: Handle 2019 flags 0x02 dlen 21             #172 [hci1] 13.380235
      SMP: Pairing Random (0x04) len 16
        Random value: 13e42e783ff8cf210000000000000000
< HCI Command: Host Number of Com.. (0x03|0x0035) plen 5  #173 [hci1] 13.389858
        Num handles: 1
        Handle: 2019 Address: DF:A9:FF:F6:B1:1A (OUI DF-A9-FF)
        Count: 1
< ACL Data TX: Handle 2019 flags 0x00 dlen 21             #174 [hci1] 13.389906
      SMP: Pairing Random (0x04) len 16
        Random value: 297efe85e67448a15f56bd27e3a3cf1d
> HCI Event: Number of Completed Packets (0x13) plen 5    #175 [hci1] 13.554600
        Num handles: 1
        Handle: 2019 Address: DF:A9:FF:F6:B1:1A (OUI DF-A9-FF)
        Count: 1
        #174: len 21 (1 Kb/s)
        Latency: 164 msec (77-172 msec ~166 msec)
> ACL Data RX: Handle 2019 flags 0x02 dlen 21             #176 [hci1] 13.642477
      SMP: Pairing Confirm (0x03) len 16
        Confim value: 56122a8ef81457213669e38563b1cd88
< HCI Command: Host Number of Com.. (0x03|0x0035) plen 5  #177 [hci1] 13.649654
        Num handles: 1
        Handle: 2019 Address: DF:A9:FF:F6:B1:1A (OUI DF-A9-FF)
        Count: 1
< ACL Data TX: Handle 2019 flags 0x00 dlen 21             #178 [hci1] 13.649789
      SMP: Pairing Confirm (0x03) len 16
        Confim value: 3fda626f75100c04d885d8d21b99f6db
> HCI Event: Number of Completed Packets (0x13) plen 5    #179 [hci1] 13.817304
        Num handles: 1
        Handle: 2019 Address: DF:A9:FF:F6:B1:1A (OUI DF-A9-FF)
        Count: 1
        #178: len 21 (1 Kb/s)
        Latency: 167 msec (77-172 msec ~167 msec)
> ACL Data RX: Handle 2019 flags 0x02 dlen 21             #180 [hci1] 13.817562
      SMP: Pairing Random (0x04) len 16
        Random value: 644de05e6f179f610000000000000000
< HCI Command: Host Number of Com.. (0x03|0x0035) plen 5  #181 [hci1] 13.829748
        Num handles: 1
        Handle: 2019 Address: DF:A9:FF:F6:B1:1A (OUI DF-A9-FF)
        Count: 1
< ACL Data TX: Handle 2019 flags 0x00 dlen 21             #182 [hci1] 13.829838
      SMP: Pairing Random (0x04) len 16
        Random value: 25a9493fd3ce4faf02be7293595bb7c6
> HCI Event: Number of Completed Packets (0x13) plen 5    #183 [hci1] 13.992075
        Num handles: 1
        Handle: 2019 Address: DF:A9:FF:F6:B1:1A (OUI DF-A9-FF)
        Count: 1
        #182: len 21 (1 Kb/s)
        Latency: 162 msec (77-172 msec ~164 msec)
> ACL Data RX: Handle 2019 flags 0x02 dlen 21             #184 [hci1] 14.079902
      SMP: Pairing Confirm (0x03) len 16
        Confim value: 884f4b6c53593a244ebf2080ba9fc46b
< HCI Command: Host Number of Com.. (0x03|0x0035) plen 5  #185 [hci1] 14.090053
        Num handles: 1
        Handle: 2019 Address: DF:A9:FF:F6:B1:1A (OUI DF-A9-FF)
        Count: 1
< ACL Data TX: Handle 2019 flags 0x00 dlen 21             #186 [hci1] 14.090225
      SMP: Pairing Confirm (0x03) len 16
        Confim value: c11b0b067bc7d426624ceefa74e0bbbb
> HCI Event: Number of Completed Packets (0x13) plen 5    #187 [hci1] 14.254857
        Num handles: 1
        Handle: 2019 Address: DF:A9:FF:F6:B1:1A (OUI DF-A9-FF)
        Count: 1
        #186: len 21 (1 Kb/s)
        Latency: 164 msec (77-172 msec ~164 msec)
> ACL Data RX: Handle 2019 flags 0x02 dlen 21             #188 [hci1] 14.255240
      SMP: Pairing Random (0x04) len 16
        Random value: 02257cd63babe3a00000000000000000
< HCI Command: Host Number of Com.. (0x03|0x0035) plen 5  #189 [hci1] 14.270281
        Num handles: 1
        Handle: 2019 Address: DF:A9:FF:F6:B1:1A (OUI DF-A9-FF)
        Count: 1
< ACL Data TX: Handle 2019 flags 0x00 dlen 21             #190 [hci1] 14.270408
      SMP: Pairing Random (0x04) len 16
        Random value: 58f6b41f855a6f6c3560debd84e2affc
> HCI Event: Number of Completed Packets (0x13) plen 5    #191 [hci1] 14.429601
        Num handles: 1
        Handle: 2019 Address: DF:A9:FF:F6:B1:1A (OUI DF-A9-FF)
        Count: 1
        #190: len 21 (1 Kb/s)
        Latency: 159 msec (77-172 msec ~161 msec)
> ACL Data RX: Handle 2019 flags 0x02 dlen 21             #192 [hci1] 14.517483
      SMP: Pairing Confirm (0x03) len 16
        Confim value: 730773c05dd5f73cdf293d487e5e2f60
< HCI Command: Host Number of Com.. (0x03|0x0035) plen 5  #193 [hci1] 14.529958
        Num handles: 1
        Handle: 2019 Address: DF:A9:FF:F6:B1:1A (OUI DF-A9-FF)
        Count: 1
< ACL Data TX: Handle 2019 flags 0x00 dlen 21             #194 [hci1] 14.530180
      SMP: Pairing Confirm (0x03) len 16
        Confim value: 04d4eb066e56120f71d6b1ed1c4cafc8
> HCI Event: Number of Completed Packets (0x13) plen 5    #195 [hci1] 14.692239
        Num handles: 1
        Handle: 2019 Address: DF:A9:FF:F6:B1:1A (OUI DF-A9-FF)
        Count: 1
        #194: len 21 (1 Kb/s)
        Latency: 162 msec (77-172 msec ~161 msec)
> ACL Data RX: Handle 2019 flags 0x02 dlen 21             #196 [hci1] 14.692697
      SMP: Pairing Random (0x04) len 16
        Random value: f4e08d251fd38cc80000000000000000
< HCI Command: Host Number of Com.. (0x03|0x0035) plen 5  #197 [hci1] 14.709559
        Num handles: 1
        Handle: 2019 Address: DF:A9:FF:F6:B1:1A (OUI DF-A9-FF)
        Count: 1
< ACL Data TX: Handle 2019 flags 0x00 dlen 21             #198 [hci1] 14.709585
      SMP: Pairing Random (0x04) len 16
        Random value: b67e7216d5bf664139eda2b542549666
> HCI Event: Number of Completed Packets (0x13) plen 5    #199 [hci1] 14.867215
        Num handles: 1
        Handle: 2019 Address: DF:A9:FF:F6:B1:1A (OUI DF-A9-FF)
        Count: 1
        #198: len 21 (1 Kb/s)
        Latency: 157 msec (77-172 msec ~159 msec)
> ACL Data RX: Handle 2019 flags 0x02 dlen 21             #200 [hci1] 14.954871
      SMP: Pairing Confirm (0x03) len 16
        Confim value: 5a9f53b94564e924556103685b2f4298
< HCI Command: Host Number of Com.. (0x03|0x0035) plen 5  #201 [hci1] 14.970127
        Num handles: 1
        Handle: 2019 Address: DF:A9:FF:F6:B1:1A (OUI DF-A9-FF)
        Count: 1
< ACL Data TX: Handle 2019 flags 0x00 dlen 21             #202 [hci1] 14.970262
      SMP: Pairing Confirm (0x03) len 16
        Confim value: c0075e4ae97c77429d8f5bfb1d9835fa
> HCI Event: Number of Completed Packets (0x13) plen 5    #203 [hci1] 15.129740
        Num handles: 1
        Handle: 2019 Address: DF:A9:FF:F6:B1:1A (OUI DF-A9-FF)
        Count: 1
        #202: len 21 (1 Kb/s)
        Latency: 159 msec (77-172 msec ~159 msec)
> ACL Data RX: Handle 2019 flags 0x02 dlen 21             #204 [hci1] 15.130196
      SMP: Pairing Random (0x04) len 16
        Random value: 706da12eecd97a710000000000000000
< HCI Command: Host Number of Com.. (0x03|0x0035) plen 5  #205 [hci1] 15.150287
        Num handles: 1
        Handle: 2019 Address: DF:A9:FF:F6:B1:1A (OUI DF-A9-FF)
        Count: 1
< ACL Data TX: Handle 2019 flags 0x00 dlen 21             #206 [hci1] 15.150385
      SMP: Pairing Random (0x04) len 16
        Random value: ed17f76500c95219dd01e09d1e63f87b
> HCI Event: Number of Completed Packets (0x13) plen 5    #207 [hci1] 15.304552
        Num handles: 1
        Handle: 2019 Address: DF:A9:FF:F6:B1:1A (OUI DF-A9-FF)
        Count: 1
        #206: len 21 (1 Kb/s)
        Latency: 154 msec (77-172 msec ~156 msec)
> ACL Data RX: Handle 2019 flags 0x02 dlen 21             #208 [hci1] 15.392343
      SMP: Pairing Confirm (0x03) len 16
        Confim value: b0109f8cfd9c1f38244e8acb6cba9633
< HCI Command: Host Number of Com.. (0x03|0x0035) plen 5  #209 [hci1] 15.409636
        Num handles: 1
        Handle: 2019 Address: DF:A9:FF:F6:B1:1A (OUI DF-A9-FF)
        Count: 1
< ACL Data TX: Handle 2019 flags 0x00 dlen 21             #210 [hci1] 15.409770
      SMP: Pairing Confirm (0x03) len 16
        Confim value: dde5eeb98fda03efc577b207affc3142
> HCI Event: Number of Completed Packets (0x13) plen 5    #211 [hci1] 15.567233
        Num handles: 1
        Handle: 2019 Address: DF:A9:FF:F6:B1:1A (OUI DF-A9-FF)
        Count: 1
        #210: len 21 (1 Kb/s)
        Latency: 157 msec (77-172 msec ~157 msec)
> ACL Data RX: Handle 2019 flags 0x02 dlen 21             #212 [hci1] 15.567550
      SMP: Pairing Random (0x04) len 16
        Random value: 6764bd81c616e79c0000000000000000
< HCI Command: Host Number of Com.. (0x03|0x0035) plen 5  #213 [hci1] 15.570229
        Num handles: 1
        Handle: 2019 Address: DF:A9:FF:F6:B1:1A (OUI DF-A9-FF)
        Count: 1
< ACL Data TX: Handle 2019 flags 0x00 dlen 21             #214 [hci1] 15.570362
      SMP: Pairing Random (0x04) len 16
        Random value: 81d35d47e1f6006d79c974bd9d9e1ee3
> HCI Event: Number of Completed Packets (0x13) plen 5    #215 [hci1] 15.742068
        Num handles: 1
        Handle: 2019 Address: DF:A9:FF:F6:B1:1A (OUI DF-A9-FF)
        Count: 1
        #214: len 21 (0 Kb/s)
        Latency: 171 msec (77-172 msec ~164 msec)
> ACL Data RX: Handle 2019 flags 0x02 dlen 21             #216 [hci1] 15.829927
      SMP: Pairing Confirm (0x03) len 16
        Confim value: 34a5b757a50f2785d54a56f11e26339f
< HCI Command: Host Number of Com.. (0x03|0x0035) plen 5  #217 [hci1] 15.849868
        Num handles: 1
        Handle: 2019 Address: DF:A9:FF:F6:B1:1A (OUI DF-A9-FF)
        Count: 1
< ACL Data TX: Handle 2019 flags 0x00 dlen 21             #218 [hci1] 15.850018
      SMP: Pairing Confirm (0x03) len 16
        Confim value: a52c1a2198d3f98c5f7532452f95e9a8
> HCI Event: Number of Completed Packets (0x13) plen 5    #219 [hci1] 16.004675
        Num handles: 1
        Handle: 2019 Address: DF:A9:FF:F6:B1:1A (OUI DF-A9-FF)
        Count: 1
        #218: len 21 (1 Kb/s)
        Latency: 154 msec (77-172 msec ~159 msec)
> ACL Data RX: Handle 2019 flags 0x02 dlen 21             #220 [hci1] 16.005137
      SMP: Pairing Random (0x04) len 16
        Random value: a5e1dda0ba65e7120000000000000000
< HCI Command: Host Number of Com.. (0x03|0x0035) plen 5  #221 [hci1] 16.009945
        Num handles: 1
        Handle: 2019 Address: DF:A9:FF:F6:B1:1A (OUI DF-A9-FF)
        Count: 1
< ACL Data TX: Handle 2019 flags 0x00 dlen 21             #222 [hci1] 16.010015
      SMP: Pairing Random (0x04) len 16
        Random value: e7f7e0c2476823e41736a7e381bafb7c
> HCI Event: Number of Completed Packets (0x13) plen 5    #223 [hci1] 16.179430
        Num handles: 1
        Handle: 2019 Address: DF:A9:FF:F6:B1:1A (OUI DF-A9-FF)
        Count: 1
        #222: len 21 (0 Kb/s)
        Latency: 169 msec (77-172 msec ~164 msec)
> ACL Data RX: Handle 2019 flags 0x02 dlen 21             #224 [hci1] 16.267357
      SMP: Pairing Confirm (0x03) len 16
        Confim value: 9cdec82bc0b6808d2878fe40e44321f9
< HCI Command: Host Number of Com.. (0x03|0x0035) plen 5  #225 [hci1] 16.269709
        Num handles: 1
        Handle: 2019 Address: DF:A9:FF:F6:B1:1A (OUI DF-A9-FF)
        Count: 1
< ACL Data TX: Handle 2019 flags 0x00 dlen 21             #226 [hci1] 16.269862
      SMP: Pairing Confirm (0x03) len 16
        Confim value: 0c55ddc82d99f892aa9bb82685ca9637
> HCI Event: Number of Completed Packets (0x13) plen 5    #227 [hci1] 16.442218
        Num handles: 1
        Handle: 2019 Address: DF:A9:FF:F6:B1:1A (OUI DF-A9-FF)
        Count: 1
        #226: len 21 (0 Kb/s)
        Latency: 172 msec (77-172 msec ~168 msec)
> ACL Data RX: Handle 2019 flags 0x02 dlen 21             #228 [hci1] 16.442535
      SMP: Pairing Random (0x04) len 16
        Random value: 63ffa98aaec0d4ab0000000000000000
