Bluetooth monitor ver 5.72
= Note: Linux version 6.14.0-36-generic (x86_64)                       0.887680
= Note: Bluetooth subsystem version 2.22                               0.887682
= New Index: 00:00:00:00:00:00 (Primary,UART,hci1)              [hci1] 0.887683
= New Index: 48:5F:99:8E:E0:64 (Primary,USB,hci0)               [hci0] 0.887683
= Open Index: 00:00:00:00:00:00                                 [hci1] 1.401526
= Index Info: 00:00:00:00:00:00 (Nordic Semiconductor ASA)      [hci1] 1.401540
@ USER Open: main (privileged) version 2.22            {0x0001} [hci1] 1.401554
< HCI Command: Reset (0x03|0x0003) plen 0                    #1 [hci1] 1.402494
> HCI Event: Command Complete (0x0e) plen 4                  #2 [hci1] 1.402944
      Reset (0x03|0x0003) ncmd 1
        Status: Success (0x00)
< HCI Command: Read Local Supported... (0x04|0x0003) plen 0  #3 [hci1] 1.420967
> HCI Event: Command Complete (0x0e) plen 12                 #4 [hci1] 1.421467
      Read Local Supported Features (0x04|0x0003) ncmd 1
        Status: Success (0x00)
        Features: 0x00 0x00 0x00 0x00 0x60 0x00 0x00 0x00
          BR/EDR Not Supported
          LE Supported (Controller)
< HCI Command: Read Local Version In.. (0x04|0x0001) plen 0  #5 [hci1] 1.440965
> HCI Event: Command Complete (0x0e) plen 12                 #6 [hci1] 1.441473
      Read Local Version Information (0x04|0x0001) ncmd 1
        Status: Success (0x00)
        HCI version: Reserved (0x0f) - Revision 12393 (0x3069)
        LMP version: Reserved (0x0f) - Subversion 12393 (0x3069)
        Manufacturer: Nordic Semiconductor ASA (89)
< HCI Command: Read Local Supported... (0x04|0x0002) plen 0  #7 [hci1] 1.460969
> HCI Event: Command Complete (0x0e) plen 68                 #8 [hci1] 1.462027
      Read Local Supported Commands (0x04|0x0002) ncmd 1
        Status: Success (0x00)
        Commands: 119 entries
          Disconnect (Octet 0 - Bit 5)
          Read Remote Version Information (Octet 2 - Bit 7)
          Set Event Mask (Octet 5 - Bit 6)
          Reset (Octet 5 - Bit 7)
          Read Connection Accept Timeout (Octet 7 - Bit 2)
          Write Connection Accept Timeout (Octet 7 - Bit 3)
          Read Transmit Power Level (Octet 10 - Bit 2)
          Set Controller To Host Flow Control (Octet 10 - Bit 5)
          Host Buffer Size (Octet 10 - Bit 6)
          Host Number of Completed Packets (Octet 10 - Bit 7)
          Read Local Version Information (Octet 14 - Bit 3)
          Read Local Supported Features (Octet 14 - Bit 5)
          Read BD ADDR (Octet 15 - Bit 1)
          Read RSSI (Octet 15 - Bit 5)
          Set Event Mask Page 2 (Octet 22 - Bit 2)
          LE Set Event Mask (Octet 25 - Bit 0)
          LE Read Buffer Size (Octet 25 - Bit 1)
          LE Read Local Supported Features (Octet 25 - Bit 2)
          LE Set Random Address (Octet 25 - Bit 4)
          LE Set Advertising Parameters (Octet 25 - Bit 5)
          LE Read Advertising Channel TX Power (Octet 25 - Bit 6)
          LE Set Advertising Data (Octet 25 - Bit 7)
          LE Set Scan Response Data (Octet 26 - Bit 0)
          LE Set Advertise Enable (Octet 26 - Bit 1)
          LE Set Scan Parameters (Octet 26 - Bit 2)
          LE Set Scan Enable (Octet 26 - Bit 3)
          LE Create Connection (Octet 26 - Bit 4)
          LE Create Connection Cancel (Octet 26 - Bit 5)
          LE Read Accept List Size (Octet 26 - Bit 6)
          LE Clear Accept List (Octet 26 - Bit 7)
          LE Add Device To Accept List (Octet 27 - Bit 0)
          LE Remove Device From Accept List (Octet 27 - Bit 1)
          LE Connection Update (Octet 27 - Bit 2)
          LE Set Host Channel Classification (Octet 27 - Bit 3)
          LE Read Channel Map (Octet 27 - Bit 4)
          LE Read Remote Used Features (Octet 27 - Bit 5)
          LE Encrypt (Octet 27 - Bit 6)
          LE Rand (Octet 27 - Bit 7)
          LE Start Encryption (Octet 28 - Bit 0)
          LE Long Term Key Request Reply (Octet 28 - Bit 1)
          LE Long Term Key Request Neg Reply (Octet 28 - Bit 2)
          LE Read Supported States (Octet 28 - Bit 3)
          LE Receiver Test (Octet 28 - Bit 4)
          LE Transmitter Test (Octet 28 - Bit 5)
          LE Test End (Octet 28 - Bit 6)
          Read Authenticated Payload Timeout (Octet 32 - Bit 4)
          Write Authenticated Payload Timeout (Octet 32 - Bit 5)
          LE Set Data Length (Octet 33 - Bit 6)
          LE Read Suggested Default Data Length (Octet 33 - Bit 7)
          LE Write Suggested Default Data Length (Octet 34 - Bit 0)
          LE Add Device To Resolving List (Octet 34 - Bit 3)
          LE Remove Device From Resolving List (Octet 34 - Bit 4)
          LE Clear Resolving List (Octet 34 - Bit 5)
          LE Read Resolving List Size (Octet 34 - Bit 6)
          LE Set Address Resolution Enable (Octet 35 - Bit 1)
          LE Set Resolvable Private Address Timeout (Octet 35 - Bit 2)
          LE Read Maximum Data Length (Octet 35 - Bit 3)
          LE Read PHY (Octet 35 - Bit 4)
          LE Set Default PHY (Octet 35 - Bit 5)
          LE Set PHY (Octet 35 - Bit 6)
          LE Enhanced Receiver Test (Octet 35 - Bit 7)
          LE Enhanced Transmitter Test (Octet 36 - Bit 0)
          LE Set Advertising Set Random Address (Octet 36 - Bit 1)
          LE Set Extended Advertising Parameters (Octet 36 - Bit 2)
          LE Set Extended Advertising Data (Octet 36 - Bit 3)
          LE Set Extended Scan Response Data (Octet 36 - Bit 4)
          LE Set Extended Advertising Enable (Octet 36 - Bit 5)
          LE Read Maximum Advertising Data Length (Octet 36 - Bit 6)
          LE Read Number of Supported Advertising Sets (Octet 36 - Bit 7)
          LE Remove Advertising Set (Octet 37 - Bit 0)
          LE Clear Advertising Sets (Octet 37 - Bit 1)
          LE Set Periodic Advertising Parameters (Octet 37 - Bit 2)
          LE Set Periodic Advertising Data (Octet 37 - Bit 3)
          LE Set Periodic Advertising Enable (Octet 37 - Bit 4)
          LE Set Extended Scan Parameters (Octet 37 - Bit 5)
          LE Set Extended Scan Enable (Octet 37 - Bit 6)
          LE Extended Create Connection (Octet 37 - Bit 7)
          LE Periodic Advertising Create Sync (Octet 38 - Bit 0)
          LE Periodic Advertising Create Sync Cancel (Octet 38 - Bit 1)
          LE Periodic Advertising Terminate Sync (Octet 38 - Bit 2)
          LE Add Device To Periodic Advertiser List (Octet 38 - Bit 3)
          LE Remove Device From Periodic Advertiser List (Octet 38 - Bit 4)
          LE Clear Periodic Advertiser List (Octet 38 - Bit 5)
          LE Read Periodic Advertiser List Size (Octet 38 - Bit 6)
          LE Read Transmit Power (Octet 38 - Bit 7)
          LE Read RF Path Compensation (Octet 39 - Bit 0)
          LE Write RF Path Compensation (Octet 39 - Bit 1)
          LE Set Privacy Mode (Octet 39 - Bit 2)
          LE Periodic Advertising Receive Enable (Octet 40 - Bit 5)
          LE Periodic Advertising Sync Transfer (Octet 40 - Bit 6)
          LE Periodic Advertising Set Info Transfer (Octet 40 - Bit 7)
          LE Periodic Advertising Sync Transfer Parameters (Octet 41 - Bit 0)
          LE Set Default Periodic Advertisng Sync Transfer Parameters (Octet 41 - Bit 1)
          LE Read Buffer v2 (Octet 41 - Bit 5)
          LE Read ISO TX Sync (Octet 41 - Bit 6)
          LE Set Connected Isochronous Group Parameters (Octet 41 - Bit 7)
          LE Set Connected Isochronous Group Parameters Test (Octet 42 - Bit 0)
          LE Create Connected Isochronous Stream (Octet 42 - Bit 1)
          LE Remove Connected Isochronous Group (Octet 42 - Bit 2)
          LE Accept Connected Isochronous Stream Request (Octet 42 - Bit 3)
          LE Reject Connected Isochronous Stream Request (Octet 42 - Bit 4)
          LE Create Broadcast Isochronous Group (Octet 42 - Bit 5)
          LE Create Broadcast Isochronous Group Test (Octet 42 - Bit 6)
          LE Terminate Broadcast Isochronous Group (Octet 42 - Bit 7)
          LE Broadcast Isochronous Group Create Sync (Octet 43 - Bit 0)
          LE Broadcast Isochronous Group Terminate Sync (Octet 43 - Bit 1)
          LE Request Peer SCA (Octet 43 - Bit 2)
          LE Setup Isochronous Data Path (Octet 43 - Bit 3)
          LE Remove Isochronous Data Path (Octet 43 - Bit 4)
          LE Isochronous Transmit Test (Octet 43 - Bit 5)
          LE Isochronous Receive Test (Octet 43 - Bit 6)
          LE Isochronous Read Test Counters (Octet 43 - Bit 7)
          LE Isochronous Read Test Counters (Octet 44 - Bit 0)
          LE Set Host Feature (Octet 44 - Bit 1)
          Octet 44 - Bit 2 
          Octet 45 - Bit 6 
          Octet 46 - Bit 0 
          Octet 46 - Bit 1 
          Octet 46 - Bit 2 
< HCI Command: Host Buffer Size (0x03|0x0033) plen 7         #9 [hci1] 1.480936
        ACL MTU: 255  ACL max packet: 16
        SCO MTU: 0    SCO max packet: 0
> HCI Event: Command Complete (0x0e) plen 4                 #10 [hci1] 1.481472
      Host Buffer Size (0x03|0x0033) ncmd 1
        Status: Success (0x00)
< HCI Command: Set Controller To Ho.. (0x03|0x0031) plen 1  #11 [hci1] 1.500972
        Flow control: ACL Data Packets (0x01)
> HCI Event: Command Complete (0x0e) plen 4                 #12 [hci1] 1.501357
      Set Controller To Host Flow Control (0x03|0x0031) ncmd 1
        Status: Success (0x00)
< HCI Command: LE Read Local Suppor.. (0x08|0x0003) plen 0  #13 [hci1] 1.520969
> HCI Event: Command Complete (0x0e) plen 12                #14 [hci1] 1.521522
      LE Read Local Supported Features (0x08|0x0003) ncmd 1
        Status: Success (0x00)
        Features: 0xfd 0x79 0x00 0xf7 0x30 0x01 0x00 0x00
          LE Encryption
          Extended Reject Indication
          Peripheral-initiated Features Exchange
          LE Ping
          LE Data Packet Length Extension
          LL Privacy
          Extended Scanner Filter Policies
          LE 2M PHY
          LE Coded PHY
          LE Extended Advertising
          LE Periodic Advertising
          Channel Selection Algorithm #2
          Periodic Advertising Sync Transfer - Sender
          Periodic Advertising Sync Transfer - Recipient
          Sleep Clock Accuracy Updates
          Connected Isochronous Stream - Central
          Connected Isochronous Stream - Peripheral
          Isochronous Broadcaster
          Synchronized Receiver
          Periodic Advertising ADI support
          Connection Subrating
          Unknown features (0x0000010000000000)
< HCI Command: LE Set Host Feature (0x08|0x0074) plen 2     #15 [hci1] 1.540985
        Bit Number: 32
          Connected Isochronous Stream (Host Support)
        Bit Value: 1
> HCI Event: Command Complete (0x0e) plen 4                 #16 [hci1] 1.541444
      LE Set Host Feature (0x08|0x0074) ncmd 1
        Status: Success (0x00)
< HCI Command: LE Read Buffer v2 (0x08|0x0060) plen 0       #17 [hci1] 1.561018
> HCI Event: Command Complete (0x0e) plen 10                #18 [hci1] 1.561447
      LE Read Buffer v2 (0x08|0x0060) ncmd 1
        Status: Success (0x00)
        ACL MTU: 27
        ACL max packet: 3
        ISO MTU: 318
        ISO max packet: 3
< HCI Command: LE Read Maximum Adve.. (0x08|0x003a) plen 0  #19 [hci1] 1.581002
> HCI Event: Command Complete (0x0e) plen 6                 #20 [hci1] 1.581549
      LE Read Maximum Advertising Data Length (0x08|0x003a) ncmd 1
        Status: Success (0x00)
        Max length: 1650
< HCI Command: LE Read Supported St.. (0x08|0x001c) plen 0  #21 [hci1] 1.600975
> HCI Event: Command Complete (0x0e) plen 12                #22 [hci1] 1.601464
      LE Read Supported States (0x08|0x001c) ncmd 1
        Status: Success (0x00)
        States: 0x000003ff3e0306ff
          Non-connectable Advertising State
          Scannable Advertising State
          Connectable Advertising State
          High Duty Cycle Directed Advertising State
          Passive Scanning State
          Active Scanning State
          Initiating State
            and Connection State (Central Role)
          Connection State (Peripheral Role)
          Scannable Advertising State
            and Passive Scanning State
          Connectable Advertising State
            and Passive Scanning State
          Non-connectable Advertising State
            and Initiating State
          Scannable Advertising State
            and Initiating State
          Active Scanning State
            and Connection State (Central Role)
          Passive Scanning State
            and Connection State (Peripheral Role)
          Active Scanning State
            and Connection State (Peripheral Role)
          Initiating State
            and Connection State (Central Role)
            and Central Role & Central Role
          Low Duty Cycle Directed Advertising State
          Connectable Advertising State
            and Initiating State
            and Central Role & Peripheral Role
          High Duty Cycle Directed Advertising State
            and Initiating State
            and Central Role & Peripheral Role
          Low Duty Cycle Directed Advertising State
            and Initiating State
            and Central Role & Peripheral Role
          Connectable Advertising State
            and Connection State (Central Role)
            and Central Role & Peripheral Role
          High Duty Cycle Directed Advertising State
            and Connection State (Central Role)
            and Central Role & Peripheral Role
          Low Duty Cycle Directed Advertising State
            and Connection State (Central Role)
            and Central Role & Peripheral Role
          Connectable Advertising State
            and Connection State (Peripheral Role)
            and Central Role & Peripheral Role
          High Duty Cycle Directed Advertising State
            and Connection State (Peripheral Role)
            and Peripheral Role & Peripheral Role
          Low Duty Cycle Directed Advertising State
            and Connection State (Peripheral Role)
            and Peripheral Role & Peripheral Role
          Initiating State
            and Connection State (Peripheral Role)
            and Central Role & Peripheral Role
< HCI Command: LE Read Maximum Data.. (0x08|0x002f) plen 0  #23 [hci1] 1.620970
> HCI Event: Command Complete (0x0e) plen 12                #24 [hci1] 1.621527
      LE Read Maximum Data Length (0x08|0x002f) ncmd 1
        Status: Success (0x00)
        Max TX octets: 251
        Max TX time: 2704
        Max RX octets: 251
        Max RX time: 2704
< HCI Command: LE Write Suggested D.. (0x08|0x0024) plen 4  #25 [hci1] 1.640966
        TX octets: 251
        TX time: 2704
> HCI Event: Command Complete (0x0e) plen 4                 #26 [hci1] 1.641424
      LE Write Suggested Default Data Length (0x08|0x0024) ncmd 1
        Status: Success (0x00)
< HCI Command: LE Read Resolving Li.. (0x08|0x002a) plen 0  #27 [hci1] 1.660985
> HCI Event: Command Complete (0x0e) plen 5                 #28 [hci1] 1.661397
      LE Read Resolving List Size (0x08|0x002a) ncmd 1
        Status: Success (0x00)
        Size: 8
< HCI Command: LE Set Event Mask (0x08|0x0001) plen 8       #29 [hci1] 1.680992
        Mask: 0x000002023f87fa5e
          LE Advertising Report
          LE Connection Update Complete
          LE Read Remote Used Features Complete
          LE Long Term Key Request
          LE Data Length Change
          LE Enhanced Connection Complete
          LE PHY Update Complete
          LE Extended Advertising Report
          LE Periodic Advertising Sync Established
          LE Periodic Advertising Report
          LE Periodic Advertising Sync Lost
          LE Extended Scan Timeout
          LE Extended Advertising Set Terminated
          LE Scan Request Received
          LE Periodic Advertising Sync Transfer Rvc
          LE CIS Established
          LE CIS Request
          LE Create BIG Complete
          LE Terminate BIG Complete
          LE BIG Sync Estabilished Complete
          LE BIG Sync Lost
          LE BIG Info Advertising Report
          Unknown mask (0x0000020000000000)
> HCI Event: Command Complete (0x0e) plen 4                 #30 [hci1] 1.681496
      LE Set Event Mask (0x08|0x0001) ncmd 1
        Status: Success (0x00)
< HCI Command: Set Event Mask (0x03|0x0001) plen 8          #31 [hci1] 1.700975
        Mask: 0x2000800002008890
          Disconnection Complete
          Encryption Change
          Read Remote Version Information Complete
          Hardware Error
          Data Buffer Overflow
          Encryption Key Refresh Complete
          LE Meta
> HCI Event: Command Complete (0x0e) plen 4                 #32 [hci1] 1.701612
      Set Event Mask (0x03|0x0001) ncmd 1
        Status: Success (0x00)
< HCI Command: Read BD ADDR (0x04|0x0009) plen 0            #33 [hci1] 1.720969
> HCI Event: Command Complete (0x0e) plen 10                #34 [hci1] 1.721454
      Read BD ADDR (0x04|0x0009) ncmd 1
        Status: Success (0x00)
        Address: 00:00:00:00:00:00 (OUI 00-00-00)
< HCI Command: LE Set Random Address (0x08|0x0005) plen 6   #35 [hci1] 1.740987
        Address: D5:B6:CC:31:DB:3B (Static)
> HCI Event: Command Complete (0x0e) plen 4                 #36 [hci1] 1.741537
      LE Set Random Address (0x08|0x0005) ncmd 1
        Status: Success (0x00)
< HCI Command: LE Set Extended Adv.. (0x08|0x0036) plen 25  #37 [hci1] 7.311050
        Handle: 0x00
        Properties: 0x0013
          Connectable
          Scannable
          Use legacy advertising PDUs: ADV_IND
        Min advertising interval: 100.000 msec (0x00a0)
        Max advertising interval: 150.000 msec (0x00f0)
        Channel map: 37, 38, 39 (0x07)
        Own address type: Random (0x01)
        Peer address type: Public (0x00)
        Peer address: 00:00:00:00:00:00 (OUI 00-00-00)
        Filter policy: Allow Scan Request from Any, Allow Connect Request from Any (0x00)
        TX power: Host has no preference (0x7f)
        Primary PHY: LE 1M (0x01)
        Secondary max skip: 0x00
        Secondary PHY: LE 1M (0x01)
        SID: 0x00
        Scan request notifications: Disabled (0x00)
> HCI Event: Command Complete (0x0e) plen 5                 #38 [hci1] 7.311892
      LE Set Extended Advertising Parameters (0x08|0x0036) ncmd 1
        Status: Success (0x00)
        TX power (selected): 0 dbm (0x00)
< HCI Command: LE Set Advertising S.. (0x08|0x0035) plen 7  #39 [hci1] 7.321053
        Advertising handle: 0x00
        Advertising random address: D5:B6:CC:31:DB:3B (Static)
> HCI Event: Command Complete (0x0e) plen 4                 #40 [hci1] 7.321565
      LE Set Advertising Set Random Address (0x08|0x0035) ncmd 1
        Status: Success (0x00)
< HCI Command: LE Set Extended Adv.. (0x08|0x0037) plen 22  #41 [hci1] 7.341032
        Handle: 0x00
        Operation: Complete extended advertising data (0x03)
        Fragment preference: Minimize fragmentation (0x01)
        Data length: 0x12
        Flags: 0x06
          LE General Discoverable Mode
          BR/EDR Not Supported
        Name (complete): Tester_F6B11A
> HCI Event: Command Complete (0x0e) plen 4                 #42 [hci1] 7.341785
      LE Set Extended Advertising Data (0x08|0x0037) ncmd 1
        Status: Success (0x00)
< HCI Command: LE Set Extended Scan.. (0x08|0x0038) plen 4  #43 [hci1] 7.361018
        Handle: 0x00
        Operation: Complete scan response data (0x03)
        Fragment preference: Minimize fragmentation (0x01)
        Data length: 0x00
> HCI Event: Command Complete (0x0e) plen 4                 #44 [hci1] 7.361517
      LE Set Extended Scan Response Data (0x08|0x0038) ncmd 1
        Status: Success (0x00)
< HCI Command: LE Set Extended Adve.. (0x08|0x0039) plen 6  #45 [hci1] 7.381099
        Extended advertising: Enabled (0x01)
        Number of sets: 1 (0x01)
        Entry 0
          Handle: 0x00
          Duration: 0 ms (0x00)
          Max ext adv events: 0
> HCI Event: Command Complete (0x0e) plen 4                 #46 [hci1] 7.381693
      LE Set Extended Advertising Enable (0x08|0x0039) ncmd 1
        Status: Success (0x00)
> HCI Event: LE Meta Event (0x3e) plen 31                   #47 [hci1] 7.500910
      LE Enhanced Connection Complete (0x0a)
        Status: Success (0x00)
        Handle: 3
        Role: Peripheral (0x01)
        Peer address type: Public (0x00)
        Peer address: DF:A9:FF:F6:B1:1A (OUI DF-A9-FF)
        Local resolvable private address: 00:00:00:00:00:00 (Non-Resolvable)
        Peer resolvable private address: 00:00:00:00:00:00 (Non-Resolvable)
        Connection interval: 87.50 msec (0x0046)
        Connection latency: 0 (0x0000)
        Supervision timeout: 25120 msec (0x09d0)
        Central clock accuracy: 0x01
> HCI Event: LE Meta Event (0x3e) plen 6                    #48 [hci1] 7.501044
      LE Advertising Set Terminated (0x12)
        Status: Success (0x00)
        Handle: 0
        Connection handle: 3
        Number of completed extended advertising events: 0
< HCI Command: LE Read Remote Used... (0x08|0x0016) plen 2  #49 [hci1] 7.521937
        Handle: 3 Address: DF:A9:FF:F6:B1:1A (OUI DF-A9-FF)
< ACL Data TX: Handle 3 flags 0x00 dlen 7                   #50 [hci1] 7.521965
      ATT: Exchange MTU Request (0x02) len 2
        Client RX MTU: 251
> HCI Event: Command Status (0x0f) plen 4                   #51 [hci1] 7.522523
      LE Read Remote Used Features (0x08|0x0016) ncmd 1
        Status: Success (0x00)
> HCI Event: Number of Completed Packets (0x13) plen 5      #52 [hci1] 7.676951
        Num handles: 1
        Handle: 3 Address: DF:A9:FF:F6:B1:1A (OUI DF-A9-FF)
        Count: 1
        #50: len 7 (0 Kb/s)
        Latency: 154 msec (154-154 msec ~154 msec)
> HCI Event: LE Meta Event (0x3e) plen 12                   #53 [hci1] 7.764891
      LE Read Remote Used Features (0x04)
        Status: Success (0x00)
        Handle: 3 Address: DF:A9:FF:F6:B1:1A (OUI DF-A9-FF)
        Features: 0x2d 0x49 0x00 0xf7 0x67 0xd8 0x00 0x00
          LE Encryption
          Extended Reject Indication
          Peripheral-initiated Features Exchange
          LE Data Packet Length Extension
          LE 2M PHY
          LE Coded PHY
          Channel Selection Algorithm #2
          Periodic Advertising Sync Transfer - Sender
          Periodic Advertising Sync Transfer - Recipient
          Sleep Clock Accuracy Updates
          Connected Isochronous Stream - Central
          Connected Isochronous Stream - Peripheral
          Isochronous Broadcaster
          Synchronized Receiver
          Connected Isochronous Stream (Host Support)
          LE Power Control Request
          LE Power Control Request
          Connection Subrating
          Connection Subrating (Host Support)
          Unknown features (0x0000d80000000000)
> ACL Data RX: Handle 3 flags 0x02 dlen 11                 #54 [hci1] 10.214528
      SMP: Pairing Request (0x01) len 6
        IO capability: KeyboardDisplay (0x04)
        OOB data: Authentication data not present (0x00)
        Authentication requirement: Bonding, MITM, SC, No Keypresses (0x0d)
        Max encryption key size: 16
        Initiator key distribution: EncKey IdKey (0x03)
        Responder key distribution: EncKey IdKey Sign (0x07)
> ACL Data RX: Handle 3 flags 0x02 dlen 7                  #55 [hci1] 10.215035
      ATT: Exchange MTU Response (0x03) len 2
        Server RX MTU: 23
< HCI Command: Host Number of Comp.. (0x03|0x0035) plen 5  #56 [hci1] 10.221485
        Num handles: 1
        Handle: 3 Address: DF:A9:FF:F6:B1:1A (OUI DF-A9-FF)
        Count: 1
< ACL Data TX: Handle 3 flags 0x00 dlen 11                 #57 [hci1] 10.221721
      SMP: Pairing Response (0x02) len 6
        IO capability: DisplayOnly (0x00)
        OOB data: Authentication data not present (0x00)
        Authentication requirement: Bonding, No MITM, SC, No Keypresses (0x09)
        Max encryption key size: 16
        Initiator key distribution: IdKey (0x02)
        Responder key distribution: <none> (0x00)
< HCI Command: Host Number of Comp.. (0x03|0x0035) plen 5  #58 [hci1] 10.221891
        Num handles: 1
        Handle: 3 Address: DF:A9:FF:F6:B1:1A (OUI DF-A9-FF)
        Count: 1
> HCI Event: Number of Completed Packets (0x13) plen 5     #59 [hci1] 10.389518
        Num handles: 1
        Handle: 3 Address: DF:A9:FF:F6:B1:1A (OUI DF-A9-FF)
        Count: 1
        #57: len 11 (0 Kb/s)
        Latency: 167 msec (154-167 msec ~161 msec)
> ACL Data RX: Handle 3 flags 0x02 dlen 27                 #60 [hci1] 10.389910
> ACL Data RX: Handle 3 flags 0x01 dlen 27                 #61 [hci1] 10.390372
> ACL Data RX: Handle 3 flags 0x01 dlen 15                 #62 [hci1] 10.390860
      SMP: Pairing Public Key (0x0c) len 64
        X: 31866cc3bc4f6d38ab7d5076a9d527aeb22ac089e7f4525ca40e7f2c75e86f78
        Y: bb2d628462586cc79cc0c0cbe26b1befbce17e4df025efc8b1ca351b3b694710
< HCI Command: Host Number of Comp.. (0x03|0x0035) plen 5  #63 [hci1] 10.401991
        Num handles: 1
        Handle: 3 Address: DF:A9:FF:F6:B1:1A (OUI DF-A9-FF)
        Count: 1
< HCI Command: Host Number of Comp.. (0x03|0x0035) plen 5  #64 [hci1] 10.402208
        Num handles: 1
        Handle: 3 Address: DF:A9:FF:F6:B1:1A (OUI DF-A9-FF)
        Count: 1
< HCI Command: Host Number of Comp.. (0x03|0x0035) plen 5  #65 [hci1] 10.402583
        Num handles: 1
        Handle: 3 Address: DF:A9:FF:F6:B1:1A (OUI DF-A9-FF)
        Count: 1
< ACL Data TX: Handle 3 flags 0x00 dlen 27                 #66 [hci1] 10.402866
< ACL Data TX: Handle 3 flags 0x01 dlen 27                 #67 [hci1] 10.402887
< ACL Data TX: Handle 3 flags 0x01 dlen 15                 #68 [hci1] 10.402919
      SMP: Pairing Public Key (0x0c) len 64
        X: 98308440221e2d910f0e54b71e7ec652857aa9b5a0dc65028824cc19db1226e9
        Y: 67a4816bcb62efb21701e31fdb27561a6217575fb007a8bbdabe7e28b6f68482
> HCI Event: Number of Completed Packets (0x13) plen 5     #69 [hci1] 10.477525
        Num handles: 1
        Handle: 3 Address: DF:A9:FF:F6:B1:1A (OUI DF-A9-FF)
        Count: 1
        #66: len 27 (2 Kb/s)
        Latency: 74 msec (74-167 msec ~118 msec)
> HCI Event: Number of Completed Packets (0x13) plen 5     #70 [hci1] 10.478134
        Num handles: 1
        Handle: 3 Address: DF:A9:FF:F6:B1:1A (OUI DF-A9-FF)
        Count: 1
        #67: len 27 (2 Kb/s)
        Latency: 75 msec (74-167 msec ~96 msec)
> HCI Event: Number of Completed Packets (0x13) plen 5     #71 [hci1] 10.564330
        Num handles: 1
        Handle: 3 Address: DF:A9:FF:F6:B1:1A (OUI DF-A9-FF)
        Count: 1
        #68: len 15 (0 Kb/s)
        Latency: 161 msec (74-167 msec ~129 msec)
> ACL Data RX: Handle 3 flags 0x02 dlen 21                 #72 [hci1] 11.527189
      SMP: Pairing Confirm (0x03) len 16
        Confim value: ecd57239ded0526da0cc82187a7858bb
< HCI Command: Host Number of Comp.. (0x03|0x0035) plen 5  #73 [hci1] 11.541297
        Num handles: 1
        Handle: 3 Address: DF:A9:FF:F6:B1:1A (OUI DF-A9-FF)
        Count: 1
< ACL Data TX: Handle 3 flags 0x00 dlen 21                 #74 [hci1] 11.541337
      SMP: Pairing Confirm (0x03) len 16
        Confim value: 6439c3e463790e0294252303036437ac
> HCI Event: Number of Completed Packets (0x13) plen 5     #75 [hci1] 11.701971
        Num handles: 1
        Handle: 3 Address: DF:A9:FF:F6:B1:1A (OUI DF-A9-FF)
        Count: 1
        #74: len 21 (1 Kb/s)
        Latency: 160 msec (74-167 msec ~144 msec)
> ACL Data RX: Handle 3 flags 0x02 dlen 21                 #76 [hci1] 11.702273
      SMP: Pairing Random (0x04) len 16
        Random value: 83d1fd71d4b5c55b0000000000000000
< HCI Command: Host Number of Comp.. (0x03|0x0035) plen 5  #77 [hci1] 11.721878
        Num handles: 1
        Handle: 3 Address: DF:A9:FF:F6:B1:1A (OUI DF-A9-FF)
        Count: 1
< ACL Data TX: Handle 3 flags 0x00 dlen 21                 #78 [hci1] 11.721979
      SMP: Pairing Random (0x04) len 16
        Random value: 8e6108f966a694cbe26df70bb96773e6
> HCI Event: Number of Completed Packets (0x13) plen 5     #79 [hci1] 11.876726
        Num handles: 1
        Handle: 3 Address: DF:A9:FF:F6:B1:1A (OUI DF-A9-FF)
        Count: 1
        #78: len 21 (1 Kb/s)
        Latency: 154 msec (74-167 msec ~149 msec)
> ACL Data RX: Handle 3 flags 0x02 dlen 21                 #80 [hci1] 11.964609
      SMP: Pairing Confirm (0x03) len 16
        Confim value: e568da11818512415cc302ad734dd143
< HCI Command: Host Number of Comp.. (0x03|0x0035) plen 5  #81 [hci1] 11.981676
        Num handles: 1
        Handle: 3 Address: DF:A9:FF:F6:B1:1A (OUI DF-A9-FF)
        Count: 1
< ACL Data TX: Handle 3 flags 0x00 dlen 21                 #82 [hci1] 11.981909
      SMP: Pairing Confirm (0x03) len 16
        Confim value: f55841d234667f8534322539b5e20ea9
> HCI Event: Number of Completed Packets (0x13) plen 5     #83 [hci1] 12.139446
        Num handles: 1
        Handle: 3 Address: DF:A9:FF:F6:B1:1A (OUI DF-A9-FF)
        Count: 1
        #82: len 21 (1 Kb/s)
        Latency: 157 msec (74-167 msec ~153 msec)
> ACL Data RX: Handle 3 flags 0x02 dlen 21                 #84 [hci1] 12.139770
      SMP: Pairing Random (0x04) len 16
        Random value: d9098df2f80017230000000000000000
< HCI Command: Host Number of Comp.. (0x03|0x0035) plen 5  #85 [hci1] 12.141796
        Num handles: 1
        Handle: 3 Address: DF:A9:FF:F6:B1:1A (OUI DF-A9-FF)
        Count: 1
< ACL Data TX: Handle 3 flags 0x00 dlen 21                 #86 [hci1] 12.141921
      SMP: Pairing Random (0x04) len 16
        Random value: 4d02679f89a05211af56d8b3da64d21e
> HCI Event: Number of Completed Packets (0x13) plen 5     #87 [hci1] 12.314218
        Num handles: 1
        Handle: 3 Address: DF:A9:FF:F6:B1:1A (OUI DF-A9-FF)
        Count: 1
        #86: len 21 (0 Kb/s)
        Latency: 172 msec (74-172 msec ~162 msec)
> ACL Data RX: Handle 3 flags 0x02 dlen 21                 #88 [hci1] 12.402077
      SMP: Pairing Confirm (0x03) len 16
        Confim value: e31a33b7332ed6dfd1cab07746bf9556
< HCI Command: Host Number of Comp.. (0x03|0x0035) plen 5  #89 [hci1] 12.421172
        Num handles: 1
        Handle: 3 Address: DF:A9:FF:F6:B1:1A (OUI DF-A9-FF)
        Count: 1
< ACL Data TX: Handle 3 flags 0x00 dlen 21                 #90 [hci1] 12.421289
      SMP: Pairing Confirm (0x03) len 16
        Confim value: 5ed6b2f536cbdc301ed45e437d98cbc5
> HCI Event: Number of Completed Packets (0x13) plen 5     #91 [hci1] 12.576918
        Num handles: 1
        Handle: 3 Address: DF:A9:FF:F6:B1:1A (OUI DF-A9-FF)
        Count: 1
        #90: len 21 (1 Kb/s)
        Latency: 155 msec (74-172 msec ~159 msec)
> ACL Data RX: Handle 3 flags 0x02 dlen 21                 #92 [hci1] 12.577211
      SMP: Pairing Random (0x04) len 16
        Random value: 9990591805bbe2f90000000000000000
< HCI Command: Host Number of Comp.. (0x03|0x0035) plen 5  #93 [hci1] 12.581558
        Num handles: 1
        Handle: 3 Address: DF:A9:FF:F6:B1:1A (OUI DF-A9-FF)
        Count: 1
< ACL Data TX: Handle 3 flags 0x00 dlen 21                 #94 [hci1] 12.581685
      SMP: Pairing Random (0x04) len 16
        Random value: 5e8286bc235a02440d0c3424a2acf8fd
> HCI Event: Number of Completed Packets (0x13) plen 5     #95 [hci1] 12.751724
        Num handles: 1
        Handle: 3 Address: DF:A9:FF:F6:B1:1A (OUI DF-A9-FF)
        Count: 1
        #94: len 21 (0 Kb/s)
        Latency: 170 msec (74-172 msec ~164 msec)
> ACL Data RX: Handle 3 flags 0x02 dlen 21                 #96 [hci1] 12.839598
      SMP: Pairing Confirm (0x03) len 16
        Confim value: a9b012b7f0751082c6ecf5f972ce2746
< HCI Command: Host Number of Comp.. (0x03|0x0035) plen 5  #97 [hci1] 12.841426
        Num handles: 1
        Handle: 3 Address: DF:A9:FF:F6:B1:1A (OUI DF-A9-FF)
        Count: 1
< ACL Data TX: Handle 3 flags 0x00 dlen 21                 #98 [hci1] 12.841586
      SMP: Pairing Confirm (0x03) len 16
        Confim value: 56a6ea158f316951b9d1b8ac10b7e407
> HCI Event: Number of Completed Packets (0x13) plen 5     #99 [hci1] 13.014530
        Num handles: 1
        Handle: 3 Address: DF:A9:FF:F6:B1:1A (OUI DF-A9-FF)
        Count: 1
        #98: len 21 (0 Kb/s)
        Latency: 172 msec (74-172 msec ~168 msec)
> ACL Data RX: Handle 3 flags 0x02 dlen 21                #100 [hci1] 13.014777
      SMP: Pairing Random (0x04) len 16
        Random value: d89e884473da6d190000000000000000
< HCI Command: Host Number of Com.. (0x03|0x0035) plen 5  #101 [hci1] 13.021823
        Num handles: 1
        Handle: 3 Address: DF:A9:FF:F6:B1:1A (OUI DF-A9-FF)
        Count: 1
< ACL Data TX: Handle 3 flags 0x00 dlen 21                #102 [hci1] 13.022026
      SMP: Pairing Random (0x04) len 16
        Random value: 5c4a1bcadd27bd58e945097b00bad7ac
> HCI Event: Number of Completed Packets (0x13) plen 5    #103 [hci1] 13.189188
        Num handles: 1
        Handle: 3 Address: DF:A9:FF:F6:B1:1A (OUI DF-A9-FF)
        Count: 1
        #102: len 21 (1 Kb/s)
        Latency: 167 msec (74-172 msec ~167 msec)
> ACL Data RX: Handle 3 flags 0x02 dlen 21                #104 [hci1] 13.276964
      SMP: Pairing Confirm (0x03) len 16
        Confim value: 5249919583e9e4b4bcbb25e99492f1c1
< HCI Command: Host Number of Com.. (0x03|0x0035) plen 5  #105 [hci1] 13.281405
        Num handles: 1
        Handle: 3 Address: DF:A9:FF:F6:B1:1A (OUI DF-A9-FF)
        Count: 1
< ACL Data TX: Handle 3 flags 0x00 dlen 21                #106 [hci1] 13.281603
      SMP: Pairing Confirm (0x03) len 16
        Confim value: 7b2c91afd05d022339d8172cb36633b6
> HCI Event: Number of Completed Packets (0x13) plen 5    #107 [hci1] 13.451935
        Num handles: 1
        Handle: 3 Address: DF:A9:FF:F6:B1:1A (OUI DF-A9-FF)
        Count: 1
        #106: len 21 (0 Kb/s)
        Latency: 170 msec (74-172 msec ~169 msec)
> ACL Data RX: Handle 3 flags 0x02 dlen 21                #108 [hci1] 13.452189
      SMP: Pairing Random (0x04) len 16
        Random value: bbe4e103c6cf9cb70000000000000000
< HCI Command: Host Number of Com.. (0x03|0x0035) plen 5  #109 [hci1] 13.461749
        Num handles: 1
        Handle: 3 Address: DF:A9:FF:F6:B1:1A (OUI DF-A9-FF)
        Count: 1
< ACL Data TX: Handle 3 flags 0x00 dlen 21                #110 [hci1] 13.461818
      SMP: Pairing Random (0x04) len 16
        Random value: 32527e6e64e79f33b2e374394db8ab2d
> HCI Event: Number of Completed Packets (0x13) plen 5    #111 [hci1] 13.626671
        Num handles: 1
        Handle: 3 Address: DF:A9:FF:F6:B1:1A (OUI DF-A9-FF)
        Count: 1
        #110: len 21 (1 Kb/s)
        Latency: 164 msec (74-172 msec ~167 msec)
> ACL Data RX: Handle 3 flags 0x02 dlen 21                #112 [hci1] 13.714628
      SMP: Pairing Confirm (0x03) len 16
        Confim value: 21f04e1faec9c478e65c84e9c0e69cfc
< HCI Command: Host Number of Com.. (0x03|0x0035) plen 5  #113 [hci1] 13.721552
        Num handles: 1
        Handle: 3 Address: DF:A9:FF:F6:B1:1A (OUI DF-A9-FF)
        Count: 1
< ACL Data TX: Handle 3 flags 0x00 dlen 21                #114 [hci1] 13.721744
      SMP: Pairing Confirm (0x03) len 16
        Confim value: 657d76b122360b5d95db69e22e2cb94e
> HCI Event: Number of Completed Packets (0x13) plen 5    #115 [hci1] 13.889548
        Num handles: 1
        Handle: 3 Address: DF:A9:FF:F6:B1:1A (OUI DF-A9-FF)
        Count: 1
        #114: len 21 (1 Kb/s)
        Latency: 167 msec (74-172 msec ~167 msec)
> ACL Data RX: Handle 3 flags 0x02 dlen 21                #116 [hci1] 13.889689
      SMP: Pairing Random (0x04) len 16
        Random value: 692d3c979333f0190000000000000000
< HCI Command: Host Number of Com.. (0x03|0x0035) plen 5  #117 [hci1] 13.901393
        Num handles: 1
        Handle: 3 Address: DF:A9:FF:F6:B1:1A (OUI DF-A9-FF)
        Count: 1
< ACL Data TX: Handle 3 flags 0x00 dlen 21                #118 [hci1] 13.901443
      SMP: Pairing Random (0x04) len 16
        Random value: dddbdfe2838e9a8cc6964353c850fef7
> HCI Event: Number of Completed Packets (0x13) plen 5    #119 [hci1] 14.064178
        Num handles: 1
        Handle: 3 Address: DF:A9:FF:F6:B1:1A (OUI DF-A9-FF)
        Count: 1
        #118: len 21 (1 Kb/s)
        Latency: 162 msec (74-172 msec ~165 msec)
> ACL Data RX: Handle 3 flags 0x02 dlen 21                #120 [hci1] 14.152058
      SMP: Pairing Confirm (0x03) len 16
        Confim value: 300a6b662af4a23264d38d93b5a23ab7
< HCI Command: Host Number of Com.. (0x03|0x0035) plen 5  #121 [hci1] 14.161485
        Num handles: 1
        Handle: 3 Address: DF:A9:FF:F6:B1:1A (OUI DF-A9-FF)
        Count: 1
< ACL Data TX: Handle 3 flags 0x00 dlen 21                #122 [hci1] 14.161677
      SMP: Pairing Confirm (0x03) len 16
        Confim value: 772031ecf95f41389a3724b8abc6f239
> HCI Event: Number of Completed Packets (0x13) plen 5    #123 [hci1] 14.326854
        Num handles: 1
        Handle: 3 Address: DF:A9:FF:F6:B1:1A (OUI DF-A9-FF)
        Count: 1
        #122: len 21 (1 Kb/s)
        Latency: 165 msec (74-172 msec ~165 msec)
> ACL Data RX: Handle 3 flags 0x02 dlen 21                #124 [hci1] 14.327205
      SMP: Pairing Random (0x04) len 16
        Random value: 58e23a01ba83271e0000000000000000
< HCI Command: Host Number of Com.. (0x03|0x0035) plen 5  #125 [hci1] 14.341750
        Num handles: 1
        Handle: 3 Address: DF:A9:FF:F6:B1:1A (OUI DF-A9-FF)
        Count: 1
< ACL Data TX: Handle 3 flags 0x00 dlen 21                #126 [hci1] 14.341862
      SMP: Pairing Random (0x04) len 16
        Random value: eb9f1915536596b6fc3db1c86b2b1970
> HCI Event: Number of Completed Packets (0x13) plen 5    #127 [hci1] 14.501690
        Num handles: 1
        Handle: 3 Address: DF:A9:FF:F6:B1:1A (OUI DF-A9-FF)
        Count: 1
        #126: len 21 (1 Kb/s)
        Latency: 159 msec (74-172 msec ~162 msec)
> ACL Data RX: Handle 3 flags 0x02 dlen 21                #128 [hci1] 14.589618
      SMP: Pairing Confirm (0x03) len 16
        Confim value: fcda793229b7c8093c3ca09832b751de
< HCI Command: Host Number of Com.. (0x03|0x0035) plen 5  #129 [hci1] 14.601767
        Num handles: 1
        Handle: 3 Address: DF:A9:FF:F6:B1:1A (OUI DF-A9-FF)
        Count: 1
< ACL Data TX: Handle 3 flags 0x00 dlen 21                #130 [hci1] 14.601977
      SMP: Pairing Confirm (0x03) len 16
        Confim value: 186978e53951a821d00e70aacfd6e2c0
> HCI Event: Number of Completed Packets (0x13) plen 5    #131 [hci1] 14.764371
        Num handles: 1
        Handle: 3 Address: DF:A9:FF:F6:B1:1A (OUI DF-A9-FF)
        Count: 1
        #130: len 21 (1 Kb/s)
        Latency: 162 msec (74-172 msec ~162 msec)
> ACL Data RX: Handle 3 flags 0x02 dlen 21                #132 [hci1] 14.764700
      SMP: Pairing Random (0x04) len 16
        Random value: 138a4affd5ff798d0000000000000000
< HCI Command: Host Number of Com.. (0x03|0x0035) plen 5  #133 [hci1] 14.781843
        Num handles: 1
        Handle: 3 Address: DF:A9:FF:F6:B1:1A (OUI DF-A9-FF)
        Count: 1
< ACL Data TX: Handle 3 flags 0x00 dlen 21                #134 [hci1] 14.781911
      SMP: Pairing Random (0x04) len 16
        Random value: 5c794dc9ad9f2c3f295ebd5ad5e1c3cf
> HCI Event: Number of Completed Packets (0x13) plen 5    #135 [hci1] 14.939130
        Num handles: 1
        Handle: 3 Address: DF:A9:FF:F6:B1:1A (OUI DF-A9-FF)
        Count: 1
        #134: len 21 (1 Kb/s)
        Latency: 157 msec (74-172 msec ~159 msec)
> ACL Data RX: Handle 3 flags 0x02 dlen 21                #136 [hci1] 15.027030
      SMP: Pairing Confirm (0x03) len 16
        Confim value: 1f53d5167c08b633d2388849af110dc6
< HCI Command: Host Number of Com.. (0x03|0x0035) plen 5  #137 [hci1] 15.041334
        Num handles: 1
        Handle: 3 Address: DF:A9:FF:F6:B1:1A (OUI DF-A9-FF)
        Count: 1
< ACL Data TX: Handle 3 flags 0x00 dlen 21                #138 [hci1] 15.041534
      SMP: Pairing Confirm (0x03) len 16
        Confim value: b838a922d76a025a1abb966f03be3339
> HCI Event: Number of Completed Packets (0x13) plen 5    #139 [hci1] 15.201861
        Num handles: 1
        Handle: 3 Address: DF:A9:FF:F6:B1:1A (OUI DF-A9-FF)
        Count: 1
        #138: len 21 (1 Kb/s)
        Latency: 160 msec (74-172 msec ~160 msec)
> ACL Data RX: Handle 3 flags 0x02 dlen 21                #140 [hci1] 15.202131
      SMP: Pairing Random (0x04) len 16
        Random value: aed0e9f85d6ecdeb0000000000000000
< HCI Command: Host Number of Com.. (0x03|0x0035) plen 5  #141 [hci1] 15.221964
        Num handles: 1
        Handle: 3 Address: DF:A9:FF:F6:B1:1A (OUI DF-A9-FF)
        Count: 1
< ACL Data TX: Handle 3 flags 0x00 dlen 21                #142 [hci1] 15.222205
      SMP: Pairing Random (0x04) len 16
        Random value: 5c2fff312cdf99c9491988e877355a9a
> HCI Event: Number of Completed Packets (0x13) plen 5    #143 [hci1] 15.376552
        Num handles: 1
        Handle: 3 Address: DF:A9:FF:F6:B1:1A (OUI DF-A9-FF)
        Count: 1
        #142: len 21 (1 Kb/s)
        Latency: 154 msec (74-172 msec ~157 msec)
> ACL Data RX: Handle 3 flags 0x02 dlen 21                #144 [hci1] 15.464590
      SMP: Pairing Confirm (0x03) len 16
        Confim value: 1c5227221564f0d5a081f58b07873da8
< HCI Command: Host Number of Com.. (0x03|0x0035) plen 5  #145 [hci1] 15.480985
        Num handles: 1
        Handle: 3 Address: DF:A9:FF:F6:B1:1A (OUI DF-A9-FF)
        Count: 1
< ACL Data TX: Handle 3 flags 0x00 dlen 21                #146 [hci1] 15.481011
      SMP: Pairing Confirm (0x03) len 16
        Confim value: 1554bd13c905d0cf775b7e8c00d726d3
> HCI Event: Number of Completed Packets (0x13) plen 5    #147 [hci1] 15.639265
        Num handles: 1
        Handle: 3 Address: DF:A9:FF:F6:B1:1A (OUI DF-A9-FF)
        Count: 1
        #146: len 21 (1 Kb/s)
        Latency: 158 msec (74-172 msec ~157 msec)
> ACL Data RX: Handle 3 flags 0x02 dlen 21                #148 [hci1] 15.639628
      SMP: Pairing Random (0x04) len 16
        Random value: 9fb1770d375d479f0000000000000000
< HCI Command: Host Number of Com.. (0x03|0x0035) plen 5  #149 [hci1] 15.641086
        Num handles: 1
        Handle: 3 Address: DF:A9:FF:F6:B1:1A (OUI DF-A9-FF)
        Count: 1
< ACL Data TX: Handle 3 flags 0x00 dlen 21                #150 [hci1] 15.641098
      SMP: Pairing Random (0x04) len 16
        Random value: c629a3a987d808e808655d558dfc1155
> HCI Event: Number of Completed Packets (0x13) plen 5    #151 [hci1] 15.814076
        Num handles: 1
        Handle: 3 Address: DF:A9:FF:F6:B1:1A (OUI DF-A9-FF)
        Count: 1
        #150: len 21 (0 Kb/s)
        Latency: 172 msec (74-172 msec ~165 msec)
> ACL Data RX: Handle 3 flags 0x02 dlen 21                #152 [hci1] 15.902034
      SMP: Pairing Confirm (0x03) len 16
        Confim value: df5782096da99e12d9579f0c6e8a7509
< HCI Command: Host Number of Com.. (0x03|0x0035) plen 5  #153 [hci1] 15.921206
        Num handles: 1
        Handle: 3 Address: DF:A9:FF:F6:B1:1A (OUI DF-A9-FF)
        Count: 1
< ACL Data TX: Handle 3 flags 0x00 dlen 21                #154 [hci1] 15.921279
      SMP: Pairing Confirm (0x03) len 16
        Confim value: d295de3b2b28ab2d32d0be19e83a3ac0
> HCI Event: Number of Completed Packets (0x13) plen 5    #155 [hci1] 16.076872
        Num handles: 1
        Handle: 3 Address: DF:A9:FF:F6:B1:1A (OUI DF-A9-FF)
        Count: 1
        #154: len 21 (1 Kb/s)
        Latency: 155 msec (74-172 msec ~160 msec)
> ACL Data RX: Handle 3 flags 0x02 dlen 21                #156 [hci1] 16.077199
      SMP: Pairing Random (0x04) len 16
        Random value: ec091f86df9e6e120000000000000000
< HCI Command: Host Number of Com.. (0x03|0x0035) plen 5  #157 [hci1] 16.081317
        Num handles: 1
        Handle: 3 Address: DF:A9:FF:F6:B1:1A (OUI DF-A9-FF)
        Count: 1
< ACL Data TX: Handle 3 flags 0x00 dlen 21                #158 [hci1] 16.081324
      SMP: Pairing Random (0x04) len 16
        Random value: 92f20f6ad8f13724432c7fd6001c45ff
> HCI Event: Number of Completed Packets (0x13) plen 5    #159 [hci1] 16.251631
        Num handles: 1
        Handle: 3 Address: DF:A9:FF:F6:B1:1A (OUI DF-A9-FF)
        Count: 1
        #158: len 21 (0 Kb/s)
        Latency: 170 msec (74-172 msec ~165 msec)
> ACL Data RX: Handle 3 flags 0x02 dlen 21                #160 [hci1] 16.339532
      SMP: Pairing Confirm (0x03) len 16
        Confim value: a86a79f3db891504ca59499ebb8d71ab
< HCI Command: Host Number of Com.. (0x03|0x0035) plen 5  #161 [hci1] 16.341523
        Num handles: 1
        Handle: 3 Address: DF:A9:FF:F6:B1:1A (OUI DF-A9-FF)
        Count: 1
< ACL Data TX: Handle 3 flags 0x00 dlen 21                #162 [hci1] 16.341685
      SMP: Pairing Confirm (0x03) len 16
        Confim value: 3962d3535713fcb81837aad034ef2598
> HCI Event: Number of Completed Packets (0x13) plen 5    #163 [hci1] 16.514334
        Num handles: 1
        Handle: 3 Address: DF:A9:FF:F6:B1:1A (OUI DF-A9-FF)
        Count: 1
        #162: len 21 (0 Kb/s)
        Latency: 172 msec (74-172 msec ~169 msec)
> ACL Data RX: Handle 3 flags 0x02 dlen 21                #164 [hci1] 16.514672
      SMP: Pairing Random (0x04) len 16
        Random value: 2c7871bd0e8cdd9c0000000000000000
< HCI Command: Host Number of Com.. (0x03|0x0035) plen 5  #165 [hci1] 16.521789
        Num handles: 1
        Handle: 3 Address: DF:A9:FF:F6:B1:1A (OUI DF-A9-FF)
        Count: 1
< ACL Data TX: Handle 3 flags 0x00 dlen 21                #166 [hci1] 16.521928
      SMP: Pairing Random (0x04) len 16
        Random value: 23ac32ebbb5e14c8a6b9622f296d277f
> HCI Event: Number of Completed Packets (0x13) plen 5    #167 [hci1] 16.689054
        Num handles: 1
        Handle: 3 Address: DF:A9:FF:F6:B1:1A (OUI DF-A9-FF)
        Count: 1
        #166: len 21 (1 Kb/s)
        Latency: 167 msec (74-172 msec ~168 msec)
> ACL Data RX: Handle 3 flags 0x02 dlen 21                #168 [hci1] 16.776944
      SMP: Pairing Confirm (0x03) len 16
        Confim value: a58770ce3dac1a676012945279056787
< HCI Command: Host Number of Com.. (0x03|0x0035) plen 5  #169 [hci1] 16.781354
        Num handles: 1
        Handle: 3 Address: DF:A9:FF:F6:B1:1A (OUI DF-A9-FF)
        Count: 1
< ACL Data TX: Handle 3 flags 0x00 dlen 21                #170 [hci1] 16.781384
      SMP: Pairing Confirm (0x03) len 16
        Confim value: 052137236dbd458a2667c4a3587b6e19
> HCI Event: Number of Completed Packets (0x13) plen 5    #171 [hci1] 16.951776
        Num handles: 1
        Handle: 3 Address: DF:A9:FF:F6:B1:1A (OUI DF-A9-FF)
        Count: 1
        #170: len 21 (0 Kb/s)
        Latency: 170 msec (74-172 msec ~169 msec)
> ACL Data RX: Handle 3 flags 0x02 dlen 21                #172 [hci1] 16.952117
      SMP: Pairing Random (0x04) len 16
        Random value: 881c56de2a47e3320000000000000000
< HCI Command: Host Number of Com.. (0x03|0x0035) plen 5  #173 [hci1] 16.961788
        Num handles: 1
        Handle: 3 Address: DF:A9:FF:F6:B1:1A (OUI DF-A9-FF)
        Count: 1
< ACL Data TX: Handle 3 flags 0x00 dlen 21                #174 [hci1] 16.961864
      SMP: Pairing Random (0x04) len 16
        Random value: 297efe85e67448a15f56bd27e3a3cf1d
> HCI Event: Number of Completed Packets (0x13) plen 5    #175 [hci1] 17.126619
        Num handles: 1
        Handle: 3 Address: DF:A9:FF:F6:B1:1A (OUI DF-A9-FF)
        Count: 1
        #174: len 21 (1 Kb/s)
        Latency: 164 msec (74-172 msec ~166 msec)
> ACL Data RX: Handle 3 flags 0x02 dlen 21                #176 [hci1] 17.214509
      SMP: Pairing Confirm (0x03) len 16
        Confim value: 78fc9fd3ca4bedb17e3cd28c351bc2c1
< HCI Command: Host Number of Com.. (0x03|0x0035) plen 5  #177 [hci1] 17.221742
        Num handles: 1
        Handle: 3 Address: DF:A9:FF:F6:B1:1A (OUI DF-A9-FF)
        Count: 1
< ACL Data TX: Handle 3 flags 0x00 dlen 21                #178 [hci1] 17.222010
      SMP: Pairing Confirm (0x03) len 16
        Confim value: cadaef764880e08d4c2a61de7e0dfeb5
> HCI Event: Number of Completed Packets (0x13) plen 5    #179 [hci1] 17.389260
        Num handles: 1
        Handle: 3 Address: DF:A9:FF:F6:B1:1A (OUI DF-A9-FF)
        Count: 1
        #178: len 21 (1 Kb/s)
        Latency: 167 msec (74-172 msec ~167 msec)
> ACL Data RX: Handle 3 flags 0x02 dlen 21                #180 [hci1] 17.389581
      SMP: Pairing Random (0x04) len 16
        Random value: f6f3fb87e3ee70ef0000000000000000
< HCI Command: Host Number of Com.. (0x03|0x0035) plen 5  #181 [hci1] 17.401852
        Num handles: 1
        Handle: 3 Address: DF:A9:FF:F6:B1:1A (OUI DF-A9-FF)
        Count: 1
< ACL Data TX: Handle 3 flags 0x00 dlen 21                #182 [hci1] 17.402001
      SMP: Pairing Random (0x04) len 16
        Random value: 25a9493fd3ce4faf02be7293595bb7c6
> HCI Event: Number of Completed Packets (0x13) plen 5    #183 [hci1] 17.564006
        Num handles: 1
        Handle: 3 Address: DF:A9:FF:F6:B1:1A (OUI DF-A9-FF)
        Count: 1
        #182: len 21 (1 Kb/s)
        Latency: 162 msec (74-172 msec ~164 msec)
> ACL Data RX: Handle 3 flags 0x02 dlen 21                #184 [hci1] 17.651952
      SMP: Pairing Confirm (0x03) len 16
        Confim value: 7cc102a75a4674f5a737220c23094a56
< HCI Command: Host Number of Com.. (0x03|0x0035) plen 5  #185 [hci1] 17.661560
        Num handles: 1
        Handle: 3 Address: DF:A9:FF:F6:B1:1A (OUI DF-A9-FF)
        Count: 1
< ACL Data TX: Handle 3 flags 0x00 dlen 21                #186 [hci1] 17.661782
      SMP: Pairing Confirm (0x03) len 16
        Confim value: 4d2c5548f4eec6657caed2f2c63707c4
> HCI Event: Number of Completed Packets (0x13) plen 5    #187 [hci1] 17.826783
        Num handles: 1
        Handle: 3 Address: DF:A9:FF:F6:B1:1A (OUI DF-A9-FF)
        Count: 1
        #186: len 21 (1 Kb/s)
        Latency: 165 msec (74-172 msec ~164 msec)
> ACL Data RX: Handle 3 flags 0x02 dlen 21                #188 [hci1] 17.827064
      SMP: Pairing Random (0x04) len 16
        Random value: f20c92edc4fc61550000000000000000
< HCI Command: Host Number of Com.. (0x03|0x0035) plen 5  #189 [hci1] 17.841933
        Num handles: 1
        Handle: 3 Address: DF:A9:FF:F6:B1:1A (OUI DF-A9-FF)
        Count: 1
< ACL Data TX: Handle 3 flags 0x00 dlen 21                #190 [hci1] 17.842017
      SMP: Pairing Random (0x04) len 16
        Random value: 58f6b41f855a6f6c3560debd84e2affc
> HCI Event: Number of Completed Packets (0x13) plen 5    #191 [hci1] 18.001653
        Num handles: 1
        Handle: 3 Address: DF:A9:FF:F6:B1:1A (OUI DF-A9-FF)
        Count: 1
        #190: len 21 (1 Kb/s)
        Latency: 159 msec (74-172 msec ~162 msec)
> ACL Data RX: Handle 3 flags 0x02 dlen 21                #192 [hci1] 18.089401
      SMP: Pairing Confirm (0x03) len 16
        Confim value: 759ec5179d0b563ddfca0571c9ec89ec
< HCI Command: Host Number of Com.. (0x03|0x0035) plen 5  #193 [hci1] 18.101694
        Num handles: 1
        Handle: 3 Address: DF:A9:FF:F6:B1:1A (OUI DF-A9-FF)
        Count: 1
< ACL Data TX: Handle 3 flags 0x00 dlen 21                #194 [hci1] 18.101897
      SMP: Pairing Confirm (0x03) len 16
        Confim value: 8b3d617fde7cb4995beff118f01681f6
> HCI Event: Number of Completed Packets (0x13) plen 5    #195 [hci1] 18.264234
        Num handles: 1
        Handle: 3 Address: DF:A9:FF:F6:B1:1A (OUI DF-A9-FF)
        Count: 1
        #194: len 21 (1 Kb/s)
        Latency: 162 msec (74-172 msec ~162 msec)
> ACL Data RX: Handle 3 flags 0x02 dlen 21                #196 [hci1] 18.264668
      SMP: Pairing Random (0x04) len 16
        Random value: 4d752caa623441c20000000000000000
< HCI Command: Host Number of Com.. (0x03|0x0035) plen 5  #197 [hci1] 18.281813
        Num handles: 1
        Handle: 3 Address: DF:A9:FF:F6:B1:1A (OUI DF-A9-FF)
        Count: 1
< ACL Data TX: Handle 3 flags 0x00 dlen 21                #198 [hci1] 18.281866
      SMP: Pairing Random (0x04) len 16
        Random value: b67e7216d5bf664139eda2b542549666
> HCI Event: Number of Completed Packets (0x13) plen 5    #199 [hci1] 18.439051
        Num handles: 1
        Handle: 3 Address: DF:A9:FF:F6:B1:1A (OUI DF-A9-FF)
        Count: 1
        #198: len 21 (1 Kb/s)
        Latency: 157 msec (74-172 msec ~159 msec)
> ACL Data RX: Handle 3 flags 0x02 dlen 21                #200 [hci1] 18.526988
      SMP: Pairing Confirm (0x03) len 16
        Confim value: b9efb3cb2d38d9ff0eb945c6f2edc9c6
< HCI Command: Host Number of Com.. (0x03|0x0035) plen 5  #201 [hci1] 18.541611
        Num handles: 1
        Handle: 3 Address: DF:A9:FF:F6:B1:1A (OUI DF-A9-FF)
        Count: 1
< ACL Data TX: Handle 3 flags 0x00 dlen 21                #202 [hci1] 18.541854
      SMP: Pairing Confirm (0x03) len 16
        Confim value: d7def69c16e1ea192d9028f04695ddc9
> HCI Event: Number of Completed Packets (0x13) plen 5    #203 [hci1] 18.701779
        Num handles: 1
        Handle: 3 Address: DF:A9:FF:F6:B1:1A (OUI DF-A9-FF)
        Count: 1
        #202: len 21 (1 Kb/s)
        Latency: 159 msec (74-172 msec ~159 msec)
> ACL Data RX: Handle 3 flags 0x02 dlen 21                #204 [hci1] 18.702033
      SMP: Pairing Random (0x04) len 16
        Random value: 9c7293849245e2960000000000000000
< HCI Command: Host Number of Com.. (0x03|0x0035) plen 5  #205 [hci1] 18.721740
        Num handles: 1
        Handle: 3 Address: DF:A9:FF:F6:B1:1A (OUI DF-A9-FF)
        Count: 1
< ACL Data TX: Handle 3 flags 0x00 dlen 21                #206 [hci1] 18.721826
      SMP: Pairing Random (0x04) len 16
        Random value: ed17f76500c95219dd01e09d1e63f87b
> HCI Event: Number of Completed Packets (0x13) plen 5    #207 [hci1] 18.876590
        Num handles: 1
        Handle: 3 Address: DF:A9:FF:F6:B1:1A (OUI DF-A9-FF)
        Count: 1
        #206: len 21 (1 Kb/s)
        Latency: 154 msec (74-172 msec ~157 msec)
> ACL Data RX: Handle 3 flags 0x02 dlen 21                #208 [hci1] 18.964403
      SMP: Pairing Confirm (0x03) len 16
        Confim value: 94852f28cf0de99913909b1f33e7eff0
< HCI Command: Host Number of Com.. (0x03|0x0035) plen 5  #209 [hci1] 18.981737
        Num handles: 1
        Handle: 3 Address: DF:A9:FF:F6:B1:1A (OUI DF-A9-FF)
        Count: 1
< ACL Data TX: Handle 3 flags 0x00 dlen 21                #210 [hci1] 18.981987
      SMP: Pairing Confirm (0x03) len 16
        Confim value: 625b2e249782ebc352828a19ed8a7564
> HCI Event: Number of Completed Packets (0x13) plen 5    #211 [hci1] 19.139228
        Num handles: 1
        Handle: 3 Address: DF:A9:FF:F6:B1:1A (OUI DF-A9-FF)
        Count: 1
        #210: len 21 (1 Kb/s)
        Latency: 157 msec (74-172 msec ~157 msec)
> ACL Data RX: Handle 3 flags 0x02 dlen 21                #212 [hci1] 19.139552
      SMP: Pairing Random (0x04) len 16
        Random value: 219de8b9f975ffd40000000000000000
< HCI Command: Host Number of Com.. (0x03|0x0035) plen 5  #213 [hci1] 19.141974
        Num handles: 1
        Handle: 3 Address: DF:A9:FF:F6:B1:1A (OUI DF-A9-FF)
        Count: 1
< ACL Data TX: Handle 3 flags 0x00 dlen 21                #214 [hci1] 19.142054
      SMP: Pairing Random (0x04) len 16
        Random value: 81d35d47e1f6006d79c974bd9d9e1ee3
> HCI Event: Number of Completed Packets (0x13) plen 5    #215 [hci1] 19.313988
        Num handles: 1
        Handle: 3 Address: DF:A9:FF:F6:B1:1A (OUI DF-A9-FF)
        Count: 1
        #214: len 21 (0 Kb/s)
        Latency: 171 msec (74-172 msec ~164 msec)
> ACL Data RX: Handle 3 flags 0x02 dlen 21                #216 [hci1] 19.401863
      SMP: Pairing Confirm (0x03) len 16
        Confim value: f286c2ae19dd62bb42e93c3390fb8049
< HCI Command: Host Number of Com.. (0x03|0x0035) plen 5  #217 [hci1] 19.421652
        Num handles: 1
        Handle: 3 Address: DF:A9:FF:F6:B1:1A (OUI DF-A9-FF)
        Count: 1
< ACL Data TX: Handle 3 flags 0x00 dlen 21                #218 [hci1] 19.421870
      SMP: Pairing Confirm (0x03) len 16
        Confim value: 12c886607a91b1671a58d5f74747ca65
> HCI Event: Number of Completed Packets (0x13) plen 5    #219 [hci1] 19.576664
        Num handles: 1
        Handle: 3 Address: DF:A9:FF:F6:B1:1A (OUI DF-A9-FF)
        Count: 1
        #218: len 21 (1 Kb/s)
        Latency: 154 msec (74-172 msec ~159 msec)
> ACL Data RX: Handle 3 flags 0x02 dlen 21                #220 [hci1] 19.577056
      SMP: Pairing Random (0x04) len 16
        Random value: 58935b3809ec29070000000000000000
< HCI Command: Host Number of Com.. (0x03|0x0035) plen 5  #221 [hci1] 19.581460
        Num handles: 1
        Handle: 3 Address: DF:A9:FF:F6:B1:1A (OUI DF-A9-FF)
        Count: 1
< ACL Data TX: Handle 3 flags 0x00 dlen 21                #222 [hci1] 19.581521
      SMP: Pairing Random (0x04) len 16
        Random value: e7f7e0c2476823e41736a7e381bafb7c
> HCI Event: Number of Completed Packets (0x13) plen 5    #223 [hci1] 19.751602
        Num handles: 1
        Handle: 3 Address: DF:A9:FF:F6:B1:1A (OUI DF-A9-FF)
        Count: 1
        #222: len 21 (0 Kb/s)
        Latency: 170 msec (74-172 msec ~164 msec)
> ACL Data RX: Handle 3 flags 0x02 dlen 21                #224 [hci1] 19.839418
      SMP: Pairing Confirm (0x03) len 16
        Confim value: 56f054fd94e844e5427d7cab7a6f1249
< HCI Command: Host Number of Com.. (0x03|0x0035) plen 5  #225 [hci1] 19.841354
        Num handles: 1
        Handle: 3 Address: DF:A9:FF:F6:B1:1A (OUI DF-A9-FF)
        Count: 1
< ACL Data TX: Handle 3 flags 0x00 dlen 21                #226 [hci1] 19.841462
      SMP: Pairing Confirm (0x03) len 16
        Confim value: 1f6b2e4c8d3817ede5ce18f2a6f25308
> HCI Event: Number of Completed Packets (0x13) plen 5    #227 [hci1] 20.014221
        Num handles: 1
        Handle: 3 Address: DF:A9:FF:F6:B1:1A (OUI DF-A9-FF)
        Count: 1
        #226: len 21 (0 Kb/s)
        Latency: 172 msec (74-172 msec ~168 msec)
> ACL Data RX: Handle 3 flags 0x02 dlen 21                #228 [hci1] 20.014568
      SMP: Pairing Random (0x04) len 16
        Random value: d0a799d0379b05e20000000000000000
< HCI Command: Host Number of Com.. (0x03|0x0035) plen 5  #229 [hci1] 20.021859
        Num handles: 1
        Handle: 3 Address: DF:A9:FF:F6:B1:1A (OUI DF-A9-FF)
        Count: 1
< ACL Data TX: Handle 3 flags 0x00 dlen 21                #230 [hci1] 20.022032
      SMP: Pairing Random (0x04) len 16
        Random value: fc8b40d9b0b09bc4296bf8753a8f6e1f
