Bluetooth monitor ver 5.72
btmon[2062738]: = Note: Linux version 6.14.0-36-generic (x86_64)                                                         0.832546
btmon[2062738]: = Note: Bluetooth subsystem version 2.22                                                                 0.832547
= New Index: 00:00:00:00:00:00 (Primary,UART,hci1)                                                                       0.832548
= New Index: 48:5F:99:8E:E0:64 (Primary,USB,hci0)                                                                        0.832549
= Open Index: 00:00:00:00:00:00                                                                                          1.346049
= Index Info: 00:00:00:00:00:00 (Nordic Semiconductor ASA)                                                               1.346064
zephyr.exe[2062740]: @ USER Open: main (privileged) version 2.22                                                {0x0001} 1.346074
zephyr.exe[2062740]: < HCI Command: Reset (0x03|0x0003) plen 0                                                        #1 1.347232
> HCI Event: Command Complete (0x0e) plen 4                                                                           #2 1.347774
      Reset (0x03|0x0003) ncmd 1
        Status: Success (0x00)
zephyr.exe[2062740]: < HCI Command: Read Local Supported Features (0x04|0x0003) plen 0                                #3 1.365873
> HCI Event: Command Complete (0x0e) plen 12                                                                          #4 1.366429
      Read Local Supported Features (0x04|0x0003) ncmd 1
        Status: Success (0x00)
        Features: 0x00 0x00 0x00 0x00 0x60 0x00 0x00 0x00
          BR/EDR Not Supported
          LE Supported (Controller)
zephyr.exe[2062740]: < HCI Command: Read Local Version Information (0x04|0x0001) plen 0                               #5 1.385554
> HCI Event: Command Complete (0x0e) plen 12                                                                          #6 1.386105
      Read Local Version Information (0x04|0x0001) ncmd 1
        Status: Success (0x00)
        HCI version: Reserved (0x0f) - Revision 12393 (0x3069)
        LMP version: Reserved (0x0f) - Subversion 12393 (0x3069)
        Manufacturer: Nordic Semiconductor ASA (89)
zephyr.exe[2062740]: < HCI Command: Read Local Supported Commands (0x04|0x0002) plen 0                                #7 1.405501
> HCI Event: Command Complete (0x0e) plen 68                                                                          #8 1.406604
      Read Local Supported Commands (0x04|0x0002) ncmd 1
        Status: Success (0x00)
        Commands: 119 entries
          Disconnect (Octet 0 - Bit 5)
          Read Remote Version Information (Octet 2 - Bit 7)
          Set Event Mask (Octet 5 - Bit 6)
          Reset (Octet 5 - Bit 7)
          Read Connection Accept Timeout (Octet 7 - Bit 2)
          Write Connection Accept Timeout (Octet 7 - Bit 3)
          Read Transmit Power Level (Octet 10 - Bit 2)
          Set Controller To Host Flow Control (Octet 10 - Bit 5)
          Host Buffer Size (Octet 10 - Bit 6)
          Host Number of Completed Packets (Octet 10 - Bit 7)
          Read Local Version Information (Octet 14 - Bit 3)
          Read Local Supported Features (Octet 14 - Bit 5)
          Read BD ADDR (Octet 15 - Bit 1)
          Read RSSI (Octet 15 - Bit 5)
          Set Event Mask Page 2 (Octet 22 - Bit 2)
          LE Set Event Mask (Octet 25 - Bit 0)
          LE Read Buffer Size (Octet 25 - Bit 1)
          LE Read Local Supported Features (Octet 25 - Bit 2)
          LE Set Random Address (Octet 25 - Bit 4)
          LE Set Advertising Parameters (Octet 25 - Bit 5)
          LE Read Advertising Channel TX Power (Octet 25 - Bit 6)
          LE Set Advertising Data (Octet 25 - Bit 7)
          LE Set Scan Response Data (Octet 26 - Bit 0)
          LE Set Advertise Enable (Octet 26 - Bit 1)
          LE Set Scan Parameters (Octet 26 - Bit 2)
          LE Set Scan Enable (Octet 26 - Bit 3)
          LE Create Connection (Octet 26 - Bit 4)
          LE Create Connection Cancel (Octet 26 - Bit 5)
          LE Read Accept List Size (Octet 26 - Bit 6)
          LE Clear Accept List (Octet 26 - Bit 7)
          LE Add Device To Accept List (Octet 27 - Bit 0)
          LE Remove Device From Accept List (Octet 27 - Bit 1)
          LE Connection Update (Octet 27 - Bit 2)
          LE Set Host Channel Classification (Octet 27 - Bit 3)
          LE Read Channel Map (Octet 27 - Bit 4)
          LE Read Remote Used Features (Octet 27 - Bit 5)
          LE Encrypt (Octet 27 - Bit 6)
          LE Rand (Octet 27 - Bit 7)
          LE Start Encryption (Octet 28 - Bit 0)
          LE Long Term Key Request Reply (Octet 28 - Bit 1)
          LE Long Term Key Request Neg Reply (Octet 28 - Bit 2)
          LE Read Supported States (Octet 28 - Bit 3)
          LE Receiver Test (Octet 28 - Bit 4)
          LE Transmitter Test (Octet 28 - Bit 5)
          LE Test End (Octet 28 - Bit 6)
          Read Authenticated Payload Timeout (Octet 32 - Bit 4)
          Write Authenticated Payload Timeout (Octet 32 - Bit 5)
          LE Set Data Length (Octet 33 - Bit 6)
          LE Read Suggested Default Data Length (Octet 33 - Bit 7)
          LE Write Suggested Default Data Length (Octet 34 - Bit 0)
          LE Add Device To Resolving List (Octet 34 - Bit 3)
          LE Remove Device From Resolving List (Octet 34 - Bit 4)
          LE Clear Resolving List (Octet 34 - Bit 5)
          LE Read Resolving List Size (Octet 34 - Bit 6)
          LE Set Address Resolution Enable (Octet 35 - Bit 1)
          LE Set Resolvable Private Address Timeout (Octet 35 - Bit 2)
          LE Read Maximum Data Length (Octet 35 - Bit 3)
          LE Read PHY (Octet 35 - Bit 4)
          LE Set Default PHY (Octet 35 - Bit 5)
          LE Set PHY (Octet 35 - Bit 6)
          LE Enhanced Receiver Test (Octet 35 - Bit 7)
          LE Enhanced Transmitter Test (Octet 36 - Bit 0)
          LE Set Advertising Set Random Address (Octet 36 - Bit 1)
          LE Set Extended Advertising Parameters (Octet 36 - Bit 2)
          LE Set Extended Advertising Data (Octet 36 - Bit 3)
          LE Set Extended Scan Response Data (Octet 36 - Bit 4)
          LE Set Extended Advertising Enable (Octet 36 - Bit 5)
          LE Read Maximum Advertising Data Length (Octet 36 - Bit 6)
          LE Read Number of Supported Advertising Sets (Octet 36 - Bit 7)
          LE Remove Advertising Set (Octet 37 - Bit 0)
          LE Clear Advertising Sets (Octet 37 - Bit 1)
          LE Set Periodic Advertising Parameters (Octet 37 - Bit 2)
          LE Set Periodic Advertising Data (Octet 37 - Bit 3)
          LE Set Periodic Advertising Enable (Octet 37 - Bit 4)
          LE Set Extended Scan Parameters (Octet 37 - Bit 5)
          LE Set Extended Scan Enable (Octet 37 - Bit 6)
          LE Extended Create Connection (Octet 37 - Bit 7)
          LE Periodic Advertising Create Sync (Octet 38 - Bit 0)
          LE Periodic Advertising Create Sync Cancel (Octet 38 - Bit 1)
          LE Periodic Advertising Terminate Sync (Octet 38 - Bit 2)
          LE Add Device To Periodic Advertiser List (Octet 38 - Bit 3)
          LE Remove Device From Periodic Advertiser List (Octet 38 - Bit 4)
          LE Clear Periodic Advertiser List (Octet 38 - Bit 5)
          LE Read Periodic Advertiser List Size (Octet 38 - Bit 6)
          LE Read Transmit Power (Octet 38 - Bit 7)
          LE Read RF Path Compensation (Octet 39 - Bit 0)
          LE Write RF Path Compensation (Octet 39 - Bit 1)
          LE Set Privacy Mode (Octet 39 - Bit 2)
          LE Periodic Advertising Receive Enable (Octet 40 - Bit 5)
          LE Periodic Advertising Sync Transfer (Octet 40 - Bit 6)
          LE Periodic Advertising Set Info Transfer (Octet 40 - Bit 7)
          LE Periodic Advertising Sync Transfer Parameters (Octet 41 - Bit 0)
          LE Set Default Periodic Advertisng Sync Transfer Parameters (Octet 41 - Bit 1)
          LE Read Buffer v2 (Octet 41 - Bit 5)
          LE Read ISO TX Sync (Octet 41 - Bit 6)
          LE Set Connected Isochronous Group Parameters (Octet 41 - Bit 7)
          LE Set Connected Isochronous Group Parameters Test (Octet 42 - Bit 0)
          LE Create Connected Isochronous Stream (Octet 42 - Bit 1)
          LE Remove Connected Isochronous Group (Octet 42 - Bit 2)
          LE Accept Connected Isochronous Stream Request (Octet 42 - Bit 3)
          LE Reject Connected Isochronous Stream Request (Octet 42 - Bit 4)
          LE Create Broadcast Isochronous Group (Octet 42 - Bit 5)
          LE Create Broadcast Isochronous Group Test (Octet 42 - Bit 6)
          LE Terminate Broadcast Isochronous Group (Octet 42 - Bit 7)
          LE Broadcast Isochronous Group Create Sync (Octet 43 - Bit 0)
          LE Broadcast Isochronous Group Terminate Sync (Octet 43 - Bit 1)
          LE Request Peer SCA (Octet 43 - Bit 2)
          LE Setup Isochronous Data Path (Octet 43 - Bit 3)
          LE Remove Isochronous Data Path (Octet 43 - Bit 4)
          LE Isochronous Transmit Test (Octet 43 - Bit 5)
          LE Isochronous Receive Test (Octet 43 - Bit 6)
          LE Isochronous Read Test Counters (Octet 43 - Bit 7)
          LE Isochronous Read Test Counters (Octet 44 - Bit 0)
          LE Set Host Feature (Octet 44 - Bit 1)
          Octet 44 - Bit 2 
          Octet 45 - Bit 6 
          Octet 46 - Bit 0 
          Octet 46 - Bit 1 
          Octet 46 - Bit 2 
zephyr.exe[2062740]: < HCI Command: Host Buffer Size (0x03|0x0033) plen 7                                             #9 1.425497
        ACL MTU: 255  ACL max packet: 16
        SCO MTU: 0    SCO max packet: 0
> HCI Event: Command Complete (0x0e) plen 4                                                                          #10 1.426061
      Host Buffer Size (0x03|0x0033) ncmd 1
        Status: Success (0x00)
zephyr.exe[2062740]: < HCI Command: Set Controller To Host Flow Control (0x03|0x0031) plen 1                         #11 1.445536
        Flow control: ACL Data Packets (0x01)
> HCI Event: Command Complete (0x0e) plen 4                                                                          #12 1.445943
      Set Controller To Host Flow Control (0x03|0x0031) ncmd 1
        Status: Success (0x00)
zephyr.exe[2062740]: < HCI Command: LE Read Local Supported Features (0x08|0x0003) plen 0                            #13 1.465532
> HCI Event: Command Complete (0x0e) plen 12                                                                         #14 1.466037
      LE Read Local Supported Features (0x08|0x0003) ncmd 1
        Status: Success (0x00)
        Features: 0xfd 0x79 0x00 0xf7 0x30 0x01 0x00 0x00
          LE Encryption
          Extended Reject Indication
          Peripheral-initiated Features Exchange
          LE Ping
          LE Data Packet Length Extension
          LL Privacy
          Extended Scanner Filter Policies
          LE 2M PHY
          LE Coded PHY
          LE Extended Advertising
          LE Periodic Advertising
          Channel Selection Algorithm #2
          Periodic Advertising Sync Transfer - Sender
          Periodic Advertising Sync Transfer - Recipient
          Sleep Clock Accuracy Updates
          Connected Isochronous Stream - Central
          Connected Isochronous Stream - Peripheral
          Isochronous Broadcaster
          Synchronized Receiver
          Periodic Advertising ADI support
          Connection Subrating
          Unknown features (0x0000010000000000)
zephyr.exe[2062740]: < HCI Command: LE Set Host Feature (0x08|0x0074) plen 2                                         #15 1.485554
        Bit Number: 32
          Connected Isochronous Stream (Host Support)
        Bit Value: 1
> HCI Event: Command Complete (0x0e) plen 4                                                                          #16 1.486012
      LE Set Host Feature (0x08|0x0074) ncmd 1
        Status: Success (0x00)
zephyr.exe[2062740]: < HCI Command: LE Read Buffer v2 (0x08|0x0060) plen 0                                           #17 1.505527
> HCI Event: Command Complete (0x0e) plen 10                                                                         #18 1.506052
      LE Read Buffer v2 (0x08|0x0060) ncmd 1
        Status: Success (0x00)
        ACL MTU: 27
        ACL max packet: 3
        ISO MTU: 318
        ISO max packet: 3
zephyr.exe[2062740]: < HCI Command: LE Read Maximum Advertising Data Length (0x08|0x003a) plen 0                     #19 1.525526
> HCI Event: Command Complete (0x0e) plen 6                                                                          #20 1.525948
      LE Read Maximum Advertising Data Length (0x08|0x003a) ncmd 1
        Status: Success (0x00)
        Max length: 1650
zephyr.exe[2062740]: < HCI Command: LE Read Supported States (0x08|0x001c) plen 0                                    #21 1.545569
> HCI Event: Command Complete (0x0e) plen 12                                                                         #22 1.546118
      LE Read Supported States (0x08|0x001c) ncmd 1
        Status: Success (0x00)
        States: 0x000003ff3e0306ff
          Non-connectable Advertising State
          Scannable Advertising State
          Connectable Advertising State
          High Duty Cycle Directed Advertising State
          Passive Scanning State
          Active Scanning State
          Initiating State
            and Connection State (Central Role)
          Connection State (Peripheral Role)
          Scannable Advertising State
            and Passive Scanning State
          Connectable Advertising State
            and Passive Scanning State
          Non-connectable Advertising State
            and Initiating State
          Scannable Advertising State
            and Initiating State
          Active Scanning State
            and Connection State (Central Role)
          Passive Scanning State
            and Connection State (Peripheral Role)
          Active Scanning State
            and Connection State (Peripheral Role)
          Initiating State
            and Connection State (Central Role)
            and Central Role & Central Role
          Low Duty Cycle Directed Advertising State
          Connectable Advertising State
            and Initiating State
            and Central Role & Peripheral Role
          High Duty Cycle Directed Advertising State
            and Initiating State
            and Central Role & Peripheral Role
          Low Duty Cycle Directed Advertising State
            and Initiating State
            and Central Role & Peripheral Role
          Connectable Advertising State
            and Connection State (Central Role)
            and Central Role & Peripheral Role
          High Duty Cycle Directed Advertising State
            and Connection State (Central Role)
            and Central Role & Peripheral Role
          Low Duty Cycle Directed Advertising State
            and Connection State (Central Role)
            and Central Role & Peripheral Role
          Connectable Advertising State
            and Connection State (Peripheral Role)
            and Central Role & Peripheral Role
          High Duty Cycle Directed Advertising State
            and Connection State (Peripheral Role)
            and Peripheral Role & Peripheral Role
          Low Duty Cycle Directed Advertising State
            and Connection State (Peripheral Role)
            and Peripheral Role & Peripheral Role
          Initiating State
            and Connection State (Peripheral Role)
            and Central Role & Peripheral Role
zephyr.exe[2062740]: < HCI Command: LE Read Maximum Data Length (0x08|0x002f) plen 0                                 #23 1.565466
> HCI Event: Command Complete (0x0e) plen 12                                                                         #24 1.565979
      LE Read Maximum Data Length (0x08|0x002f) ncmd 1
        Status: Success (0x00)
        Max TX octets: 251
        Max TX time: 2704
        Max RX octets: 251
        Max RX time: 2704
zephyr.exe[2062740]: < HCI Command: LE Write Suggested Default Data Length (0x08|0x0024) plen 4                      #25 1.585530
        TX octets: 251
        TX time: 2704
> HCI Event: Command Complete (0x0e) plen 4                                                                          #26 1.585972
      LE Write Suggested Default Data Length (0x08|0x0024) ncmd 1
        Status: Success (0x00)
zephyr.exe[2062740]: < HCI Command: LE Read Resolving List Size (0x08|0x002a) plen 0                                 #27 1.605541
> HCI Event: Command Complete (0x0e) plen 5                                                                          #28 1.605936
      LE Read Resolving List Size (0x08|0x002a) ncmd 1
        Status: Success (0x00)
        Size: 8
zephyr.exe[2062740]: < HCI Command: LE Set Event Mask (0x08|0x0001) plen 8                                           #29 1.625528
        Mask: 0x000002023f87fa5e
          LE Advertising Report
          LE Connection Update Complete
          LE Read Remote Used Features Complete
          LE Long Term Key Request
          LE Data Length Change
          LE Enhanced Connection Complete
          LE PHY Update Complete
          LE Extended Advertising Report
          LE Periodic Advertising Sync Established
          LE Periodic Advertising Report
          LE Periodic Advertising Sync Lost
          LE Extended Scan Timeout
          LE Extended Advertising Set Terminated
          LE Scan Request Received
          LE Periodic Advertising Sync Transfer Rvc
          LE CIS Established
          LE CIS Request
          LE Create BIG Complete
          LE Terminate BIG Complete
          LE BIG Sync Estabilished Complete
          LE BIG Sync Lost
          LE BIG Info Advertising Report
          Unknown mask (0x0000020000000000)
> HCI Event: Command Complete (0x0e) plen 4                                                                          #30 1.626059
      LE Set Event Mask (0x08|0x0001) ncmd 1
        Status: Success (0x00)
zephyr.exe[2062740]: < HCI Command: Set Event Mask (0x03|0x0001) plen 8                                              #31 1.645495
        Mask: 0x2000800002008890
          Disconnection Complete
          Encryption Change
          Read Remote Version Information Complete
          Hardware Error
          Data Buffer Overflow
          Encryption Key Refresh Complete
          LE Meta
> HCI Event: Command Complete (0x0e) plen 4                                                                          #32 1.646045
      Set Event Mask (0x03|0x0001) ncmd 1
        Status: Success (0x00)
zephyr.exe[2062740]: < HCI Command: Read BD ADDR (0x04|0x0009) plen 0                                                #33 1.665508
> HCI Event: Command Complete (0x0e) plen 10                                                                         #34 1.666043
      Read BD ADDR (0x04|0x0009) ncmd 1
        Status: Success (0x00)
        Address: 00:00:00:00:00:00 (OUI 00-00-00)
zephyr.exe[2062740]: < HCI Command: LE Set Random Address (0x08|0x0005) plen 6                                       #35 1.685509
        Address: D5:B6:CC:31:DB:3B (Static)
> HCI Event: Command Complete (0x0e) plen 4                                                                          #36 1.686055
      LE Set Random Address (0x08|0x0005) ncmd 1
        Status: Success (0x00)
zephyr.exe[2062740]: < HCI Command: LE Set Extended Advertising Parameters (0x08|0x0036) plen 25                     #37 4.365638
        Handle: 0x00
        Properties: 0x0001
          Connectable
        Min advertising interval: 100.000 msec (0x00a0)
        Max advertising interval: 150.000 msec (0x00f0)
        Channel map: 37, 38, 39 (0x07)
        Own address type: Random (0x01)
        Peer address type: Public (0x00)
        Peer address: 00:00:00:00:00:00 (OUI 00-00-00)
        Filter policy: Allow Scan Request from Any, Allow Connect Request from Any (0x00)
        TX power: Host has no preference (0x7f)
        Primary PHY: LE 1M (0x01)
        Secondary max skip: 0x00
        Secondary PHY: LE 2M (0x02)
        SID: 0x00
        Scan request notifications: Disabled (0x00)
> HCI Event: Command Complete (0x0e) plen 5                                                                          #38 4.366434
      LE Set Extended Advertising Parameters (0x08|0x0036) ncmd 1
        Status: Success (0x00)
        TX power (selected): 0 dbm (0x00)
zephyr.exe[2062740]: < HCI Command: LE Set Advertising Set Random Address (0x08|0x0035) plen 7                       #39 4.385558
        Advertising handle: 0x00
        Advertising random address: D5:B6:CC:31:DB:3B (Static)
> HCI Event: Command Complete (0x0e) plen 4                                                                          #40 4.386082
      LE Set Advertising Set Random Address (0x08|0x0035) ncmd 1
        Status: Success (0x00)
zephyr.exe[2062740]: < HCI Command: LE Set Extended Advertising Data (0x08|0x0037) plen 39                           #41 4.405602
        Handle: 0x00
        Operation: Complete extended advertising data (0x03)
        Fragment preference: Minimize fragmentation (0x01)
        Data length: 0x23
        Flags: 0x06
          LE General Discoverable Mode
          BR/EDR Not Supported
        Name (complete): Tester_F6B11A
        Flags: 0x06
          LE General Discoverable Mode
          BR/EDR Not Supported
        16-bit Service UUIDs (complete): 1 entry
          Audio Stream Control (0x184e)
        Service Data: Audio Stream Control (0x184e)
          Data: 01ff0fff0f00
> HCI Event: Command Complete (0x0e) plen 4                                                                          #42 4.406537
      LE Set Extended Advertising Data (0x08|0x0037) ncmd 1
        Status: Success (0x00)
zephyr.exe[2062740]: < HCI Command: LE Set Extended Advertising Enable (0x08|0x0039) plen 6                          #43 4.425546
        Extended advertising: Enabled (0x01)
        Number of sets: 1 (0x01)
        Entry 0
          Handle: 0x00
          Duration: 0 ms (0x00)
          Max ext adv events: 0
> HCI Event: Command Complete (0x0e) plen 4                                                                          #44 4.426082
      LE Set Extended Advertising Enable (0x08|0x0039) ncmd 1
        Status: Success (0x00)
> HCI Event: LE Meta Event (0x3e) plen 31                                                                            #45 4.539095
      LE Enhanced Connection Complete (0x0a)
        Status: Success (0x00)
        Handle: 165
        Role: Peripheral (0x01)
        Peer address type: Public (0x00)
        Peer address: DF:A9:FF:F6:B1:1A (OUI DF-A9-FF)
        Local resolvable private address: 00:00:00:00:00:00 (Non-Resolvable)
        Peer resolvable private address: 00:00:00:00:00:00 (Non-Resolvable)
        Connection interval: 60.00 msec (0x0030)
        Connection latency: 0 (0x0000)
        Supervision timeout: 25120 msec (0x09d0)
        Central clock accuracy: 0x01
> HCI Event: LE Meta Event (0x3e) plen 6                                                                             #46 4.539194
      LE Advertising Set Terminated (0x12)
        Status: Success (0x00)
        Handle: 0
        Connection handle: 165
        Number of completed extended advertising events: 0
zephyr.exe[2062740]: < HCI Command: LE Read Remote Used Features (0x08|0x0016) plen 2                                #47 4.546663
        Handle: 165 Address: DF:A9:FF:F6:B1:1A (OUI DF-A9-FF)
zephyr.exe[2062740]: < ACL Data TX: Handle 165 flags 0x00 dlen 7                                                     #48 4.546686
      ATT: Exchange MTU Request (0x02) len 2
        Client RX MTU: 251
> HCI Event: Command Status (0x0f) plen 4                                                                            #49 4.547257
      LE Read Remote Used Features (0x08|0x0016) ncmd 1
        Status: Success (0x00)
> HCI Event: Number of Completed Packets (0x13) plen 5                                                               #50 4.661017
        Num handles: 1
        Handle: 165 Address: DF:A9:FF:F6:B1:1A (OUI DF-A9-FF)
        Count: 1
        #48: len 7 (0 Kb/s)
        Latency: 114 msec (114-114 msec ~114 msec)
> HCI Event: LE Meta Event (0x3e) plen 12                                                                            #51 4.721352
      LE Read Remote Used Features (0x04)
        Status: Success (0x00)
        Handle: 165 Address: DF:A9:FF:F6:B1:1A (OUI DF-A9-FF)
        Features: 0x2d 0x49 0x00 0xf7 0x67 0xd8 0x00 0x00
          LE Encryption
          Extended Reject Indication
          Peripheral-initiated Features Exchange
          LE Data Packet Length Extension
          LE 2M PHY
          LE Coded PHY
          Channel Selection Algorithm #2
          Periodic Advertising Sync Transfer - Sender
          Periodic Advertising Sync Transfer - Recipient
          Sleep Clock Accuracy Updates
          Connected Isochronous Stream - Central
          Connected Isochronous Stream - Peripheral
          Isochronous Broadcaster
          Synchronized Receiver
          Connected Isochronous Stream (Host Support)
          LE Power Control Request
          LE Power Control Request
          Connection Subrating
          Connection Subrating (Host Support)
          Unknown features (0x0000d80000000000)
> ACL Data RX: Handle 165 flags 0x02 dlen 7                                                                          #52 5.021052
      ATT: Exchange MTU Request (0x02) len 2
        Client RX MTU: 64
> ACL Data RX: Handle 165 flags 0x02 dlen 7                                                                          #53 5.021461
      ATT: Exchange MTU Response (0x03) len 2
        Server RX MTU: 64
zephyr.exe[2062740]: < HCI Command: Host Number of Completed Packets (0x03|0x0035) plen 5                            #54 5.025871
        Num handles: 1
        Handle: 165 Address: DF:A9:FF:F6:B1:1A (OUI DF-A9-FF)
        Count: 1
zephyr.exe[2062740]: < ACL Data TX: Handle 165 flags 0x00 dlen 7                                                     #55 5.026048
      ATT: Exchange MTU Response (0x03) len 2
        Server RX MTU: 251
zephyr.exe[2062740]: < HCI Command: Host Number of Completed Packets (0x03|0x0035) plen 5                            #56 5.026198
        Num handles: 1
        Handle: 165 Address: DF:A9:FF:F6:B1:1A (OUI DF-A9-FF)
        Count: 1
> HCI Event: Number of Completed Packets (0x13) plen 5                                                               #57 5.141107
        Num handles: 1
        Handle: 165 Address: DF:A9:FF:F6:B1:1A (OUI DF-A9-FF)
        Count: 1
        #55: len 7 (0 Kb/s)
        Latency: 115 msec (114-115 msec ~114 msec)
> ACL Data RX: Handle 165 flags 0x02 dlen 11                                                                         #58 7.121129
      SMP: Pairing Request (0x01) len 6
        IO capability: KeyboardDisplay (0x04)
        OOB data: Authentication data not present (0x00)
        Authentication requirement: Bonding, No MITM, SC, No Keypresses (0x09)
        Max encryption key size: 16
        Initiator key distribution: EncKey IdKey (0x03)
        Responder key distribution: EncKey IdKey Sign (0x07)
zephyr.exe[2062740]: < HCI Command: Host Number of Completed Packets (0x03|0x0035) plen 5                            #59 7.126002
        Num handles: 1
        Handle: 165 Address: DF:A9:FF:F6:B1:1A (OUI DF-A9-FF)
        Count: 1
zephyr.exe[2062740]: < ACL Data TX: Handle 165 flags 0x00 dlen 11                                                    #60 7.126168
      SMP: Pairing Response (0x02) len 6
        IO capability: NoInputNoOutput (0x03)
        OOB data: Authentication data not present (0x00)
        Authentication requirement: Bonding, No MITM, SC, No Keypresses (0x09)
        Max encryption key size: 16
        Initiator key distribution: IdKey (0x02)
        Responder key distribution: <none> (0x00)
> HCI Event: Number of Completed Packets (0x13) plen 5                                                               #61 7.241071
        Num handles: 1
        Handle: 165 Address: DF:A9:FF:F6:B1:1A (OUI DF-A9-FF)
        Count: 1
        #60: len 11 (0 Kb/s)
        Latency: 114 msec (114-115 msec ~114 msec)
> ACL Data RX: Handle 165 flags 0x02 dlen 27                                                                         #62 7.241438
> ACL Data RX: Handle 165 flags 0x01 dlen 27                                                                         #63 7.241811
> ACL Data RX: Handle 165 flags 0x01 dlen 15                                                                         #64 7.242143
      SMP: Pairing Public Key (0x0c) len 64
        X: 269d91230267a7afd5de2d4c0bcb6f3b029aafe31e81561a1a844cc7e3aed370
        Y: 140ca391300f8432c9654f88844d3c779baf7daacf1450275e9e113e7610b930
zephyr.exe[2062740]: < HCI Command: Host Number of Completed Packets (0x03|0x0035) plen 5                            #65 7.246450
        Num handles: 1
        Handle: 165 Address: DF:A9:FF:F6:B1:1A (OUI DF-A9-FF)
        Count: 1
zephyr.exe[2062740]: < HCI Command: Host Number of Completed Packets (0x03|0x0035) plen 5                            #66 7.246662
        Num handles: 1
        Handle: 165 Address: DF:A9:FF:F6:B1:1A (OUI DF-A9-FF)
        Count: 1
zephyr.exe[2062740]: < HCI Command: Host Number of Completed Packets (0x03|0x0035) plen 5                            #67 7.246970
        Num handles: 1
        Handle: 165 Address: DF:A9:FF:F6:B1:1A (OUI DF-A9-FF)
        Count: 1
zephyr.exe[2062740]: < ACL Data TX: Handle 165 flags 0x00 dlen 27                                                    #68 7.247029
zephyr.exe[2062740]: < ACL Data TX: Handle 165 flags 0x01 dlen 27                                                    #69 7.247049
zephyr.exe[2062740]: < ACL Data TX: Handle 165 flags 0x01 dlen 15                                                    #70 7.247081
      SMP: Pairing Public Key (0x0c) len 64
        X: 98308440221e2d910f0e54b71e7ec652857aa9b5a0dc65028824cc19db1226e9
        Y: 67a4816bcb62efb21701e31fdb27561a6217575fb007a8bbdabe7e28b6f68482
> HCI Event: Number of Completed Packets (0x13) plen 5                                                               #71 7.301474
        Num handles: 1
        Handle: 165 Address: DF:A9:FF:F6:B1:1A (OUI DF-A9-FF)
        Count: 1
        #68: len 27 (4 Kb/s)
        Latency: 54 msec (54-115 msec ~84 msec)
> HCI Event: Number of Completed Packets (0x13) plen 5                                                               #72 7.301862
        Num handles: 1
        Handle: 165 Address: DF:A9:FF:F6:B1:1A (OUI DF-A9-FF)
        Count: 1
        #69: len 27 (4 Kb/s)
        Latency: 54 msec (54-115 msec ~69 msec)
zephyr.exe[2062740]: < ACL Data TX: Handle 165 flags 0x00 dlen 21                                                    #73 7.305899
      SMP: Pairing Confirm (0x03) len 16
        Confim value: 819dc42076ba5153a6efbdd5d5478980
> HCI Event: Number of Completed Packets (0x13) plen 5                                                               #74 7.361041
        Num handles: 1
        Handle: 165 Address: DF:A9:FF:F6:B1:1A (OUI DF-A9-FF)
        Count: 1
        #70: len 15 (1 Kb/s)
        Latency: 113 msec (54-115 msec ~91 msec)
> HCI Event: Number of Completed Packets (0x13) plen 5                                                               #75 7.421133
        Num handles: 1
        Handle: 165 Address: DF:A9:FF:F6:B1:1A (OUI DF-A9-FF)
        Count: 1
        #73: len 21 (1 Kb/s)
        Latency: 115 msec (54-115 msec ~103 msec)
> ACL Data RX: Handle 165 flags 0x02 dlen 21                                                                         #76 7.421401
      SMP: Pairing Random (0x04) len 16
        Random value: 26243f11ad6a50e70000000000000000
zephyr.exe[2062740]: < HCI Command: Host Number of Completed Packets (0x03|0x0035) plen 5                            #77 7.426120
        Num handles: 1
        Handle: 165 Address: DF:A9:FF:F6:B1:1A (OUI DF-A9-FF)
        Count: 1
zephyr.exe[2062740]: < ACL Data TX: Handle 165 flags 0x00 dlen 21                                                    #78 7.426339
      SMP: Pairing Random (0x04) len 16
        Random value: 8e6108f966a694cbe26df70bb96773e6
> HCI Event: Number of Completed Packets (0x13) plen 5                                                               #79 7.541005
        Num handles: 1
        Handle: 165 Address: DF:A9:FF:F6:B1:1A (OUI DF-A9-FF)
        Count: 1
        #78: len 21 (1 Kb/s)
        Latency: 114 msec (54-115 msec ~109 msec)
> ACL Data RX: Handle 165 flags 0x02 dlen 21                                                                         #80 7.781198
      SMP: Pairing DHKey Check (0x0d) len 16
        E: 38ec106e430c883c1407173294660e9c
zephyr.exe[2062740]: < HCI Command: Host Number of Completed Packets (0x03|0x0035) plen 5                            #81 7.786418
        Num handles: 1
        Handle: 165 Address: DF:A9:FF:F6:B1:1A (OUI DF-A9-FF)
        Count: 1
zephyr.exe[2062740]: < ACL Data TX: Handle 165 flags 0x00 dlen 21                                                    #82 7.786645
      SMP: Pairing DHKey Check (0x0d) len 16
        E: 0c29d78267324729b484574f83c06a4d
> HCI Event: Number of Completed Packets (0x13) plen 5                                                               #83 7.901022
        Num handles: 1
        Handle: 165 Address: DF:A9:FF:F6:B1:1A (OUI DF-A9-FF)
        Count: 1
        #82: len 21 (1 Kb/s)
        Latency: 114 msec (54-115 msec ~111 msec)
> HCI Event: LE Meta Event (0x3e) plen 13                                                                            #84 7.961559
      LE Long Term Key Request (0x05)
        Handle: 165 Address: DF:A9:FF:F6:B1:1A (OUI DF-A9-FF)
        Random number: 0x0000000000000000
        Encrypted diversifier: 0x0000
zephyr.exe[2062740]: < HCI Command: LE Long Term Key Request Reply (0x08|0x001a) plen 18                             #85 7.965891
        Handle: 165 Address: DF:A9:FF:F6:B1:1A (OUI DF-A9-FF)
        Long term key: be02bc29dc9dc963799c58e4b6b2c1a5
> HCI Event: Command Complete (0x0e) plen 6                                                                          #86 7.966712
      LE Long Term Key Request Reply (0x08|0x001a) ncmd 1
        Status: Success (0x00)
        Handle: 165 Address: DF:A9:FF:F6:B1:1A (OUI DF-A9-FF)
> HCI Event: Encryption Change (0x08) plen 4                                                                         #87 8.261220
        Status: Success (0x00)
        Handle: 165 Address: DF:A9:FF:F6:B1:1A (OUI DF-A9-FF)
        Encryption: Enabled with AES-CCM (0x01)
> ACL Data RX: Handle 165 flags 0x02 dlen 21                                                                         #88 8.321265
      SMP: Identity Information (0x08) len 16
        Identity resolving key: a20aa7473377430d54fc3ad243b2d50d
zephyr.exe[2062740]: < HCI Command: Host Number of Completed Packets (0x03|0x0035) plen 5                            #89 8.376424
        Num handles: 1
        Handle: 165 Address: DF:A9:FF:F6:B1:1A (OUI DF-A9-FF)
        Count: 1
> ACL Data RX: Handle 165 flags 0x02 dlen 12                                                                         #90 8.441147
      SMP: Identity Address Information (0x09) len 7
        Address: DF:A9:FF:F6:B1:1A (OUI DF-A9-FF)
zephyr.exe[2062740]: < HCI Command: LE Add Device To Resolving List (0x08|0x0027) plen 39                            #91 8.446253
        Address type: Public (0x00)
        Address: DF:A9:FF:F6:B1:1A (OUI DF-A9-FF)
        Peer identity resolving key: a20aa7473377430d54fc3ad243b2d50d
        Local identity resolving key: 00000000000000000000000000000000
> HCI Event: Command Complete (0x0e) plen 4                                                                          #92 8.447281
      LE Add Device To Resolving List (0x08|0x0027) ncmd 1
        Status: Success (0x00)
zephyr.exe[2062740]: < HCI Command: LE Set Privacy Mode (0x08|0x004e) plen 8                                         #93 8.465968
        Peer Identity address type: Public (0x00)
        Peer Identity address: DF:A9:FF:F6:B1:1A (OUI DF-A9-FF)
        Privacy Mode: Use Device Privacy (0x01)
> HCI Event: Command Complete (0x0e) plen 4                                                                          #94 8.466708
      LE Set Privacy Mode (0x08|0x004e) ncmd 1
        Status: Success (0x00)
zephyr.exe[2062740]: < HCI Command: LE Set Address Resolution Enable (0x08|0x002d) plen 1                            #95 8.485952
        Address resolution: Enabled (0x01)
> HCI Event: Command Complete (0x0e) plen 4                                                                          #96 8.486418
      LE Set Address Resolution Enable (0x08|0x002d) ncmd 1
        Status: Success (0x00)
> ACL Data RX: Handle 165 flags 0x02 dlen 13                                                                         #97 8.501154
      ATT: Find By Type Value Request (0x06) len 8
        Handle range: 0x0001-0xffff
        Attribute type: Primary Service (0x2800)
          UUID: Broadcast Audio Scan (0x184f)
zephyr.exe[2062740]: < HCI Command: Host Number of Completed Packets (0x03|0x0035) plen 5                            #98 8.505587
        Num handles: 1
        Handle: 165 Address: DF:A9:FF:F6:B1:1A (OUI DF-A9-FF)
        Count: 1
zephyr.exe[2062740]: < HCI Command: Host Number of Completed Packets (0x03|0x0035) plen 5                            #99 8.505854
        Num handles: 1
        Handle: 165 Address: DF:A9:FF:F6:B1:1A (OUI DF-A9-FF)
        Count: 1
zephyr.exe[2062740]: < ACL Data TX: Handle 165 flags 0x00 dlen 9                                                    #100 8.505945
      ATT: Find By Type Value Response (0x07) len 4
        Handle range: 0x0047-0x004c
> HCI Event: Number of Completed Packets (0x13) plen 5                                                              #101 8.621031
        Num handles: 1
        Handle: 165 Address: DF:A9:FF:F6:B1:1A (OUI DF-A9-FF)
        Count: 1
        #100: len 9 (0 Kb/s)
        Latency: 115 msec (54-115 msec ~113 msec)
> ACL Data RX: Handle 165 flags 0x02 dlen 13                                                                        #102 8.621306
      ATT: Find By Type Value Request (0x06) len 8
        Handle range: 0x004d-0xffff
        Attribute type: Primary Service (0x2800)
          UUID: Broadcast Audio Scan (0x184f)
zephyr.exe[2062740]: < HCI Command: Host Number of Completed Packets (0x03|0x0035) plen 5                           #103 8.626181
        Num handles: 1
        Handle: 165 Address: DF:A9:FF:F6:B1:1A (OUI DF-A9-FF)
        Count: 1
zephyr.exe[2062740]: < ACL Data TX: Handle 165 flags 0x00 dlen 9                                                    #104 8.626361
      ATT: Error Response (0x01) len 4
        Find By Type Value Request (0x06)
        Handle: 0x004d
        Error: Attribute Not Found (0x0a)
> HCI Event: Number of Completed Packets (0x13) plen 5                                                              #105 8.740996
        Num handles: 1
        Handle: 165 Address: DF:A9:FF:F6:B1:1A (OUI DF-A9-FF)
        Count: 1
        #104: len 9 (0 Kb/s)
        Latency: 114 msec (54-115 msec ~114 msec)
> ACL Data RX: Handle 165 flags 0x02 dlen 11                                                                        #106 8.741237
      ATT: Read By Type Request (0x08) len 6
        Handle range: 0x0047-0x004c
        Attribute type: Characteristic (0x2803)
zephyr.exe[2062740]: < HCI Command: Host Number of Completed Packets (0x03|0x0035) plen 5                           #107 8.746084
        Num handles: 1
        Handle: 165 Address: DF:A9:FF:F6:B1:1A (OUI DF-A9-FF)
        Count: 1
zephyr.exe[2062740]: < ACL Data TX: Handle 165 flags 0x00 dlen 20                                                   #108 8.746242
      ATT: Read By Type Response (0x09) len 15
        Attribute data length: 7
        Attribute data list: 2 entries
        Handle: 0x0048
        Value: 0c4900c72b
            Properties: 0x0c
              Write Without Response (0x04)
              Write (0x08)
            Value Handle: 0x0049
            Value UUID: Broadcast Audio Scan Control Point (0x2bc7)
        Handle: 0x004a
        Value: 124b00c82b
            Properties: 0x12
              Read (0x02)
              Notify (0x10)
            Value Handle: 0x004b
            Value UUID: Broadcast Receive State (0x2bc8)
> HCI Event: Number of Completed Packets (0x13) plen 5                                                              #109 8.861061
        Num handles: 1
        Handle: 165 Address: DF:A9:FF:F6:B1:1A (OUI DF-A9-FF)
        Count: 1
        #108: len 20 (1 Kb/s)
        Latency: 114 msec (54-115 msec ~114 msec)
> ACL Data RX: Handle 165 flags 0x02 dlen 11                                                                        #110 8.861214
      ATT: Read By Type Request (0x08) len 6
        Handle range: 0x004b-0x004c
        Attribute type: Characteristic (0x2803)
zephyr.exe[2062740]: < HCI Command: Host Number of Completed Packets (0x03|0x0035) plen 5                           #111 8.866218
        Num handles: 1
        Handle: 165 Address: DF:A9:FF:F6:B1:1A (OUI DF-A9-FF)
        Count: 1
zephyr.exe[2062740]: < ACL Data TX: Handle 165 flags 0x00 dlen 9                                                    #112 8.866329
      ATT: Error Response (0x01) len 4
        Read By Type Request (0x08)
        Handle: 0x004b
        Error: Attribute Not Found (0x0a)
> HCI Event: Number of Completed Packets (0x13) plen 5                                                              #113 8.980936
        Num handles: 1
        Handle: 165 Address: DF:A9:FF:F6:B1:1A (OUI DF-A9-FF)
        Count: 1
        #112: len 9 (0 Kb/s)
        Latency: 114 msec (54-115 msec ~114 msec)
> ACL Data RX: Handle 165 flags 0x02 dlen 9                                                                         #114 8.981250
      ATT: Find Information Request (0x04) len 4
        Handle range: 0x004c-0x004c
zephyr.exe[2062740]: < HCI Command: Host Number of Completed Packets (0x03|0x0035) plen 5                           #115 8.986081
        Num handles: 1
        Handle: 165 Address: DF:A9:FF:F6:B1:1A (OUI DF-A9-FF)
        Count: 1
zephyr.exe[2062740]: < ACL Data TX: Handle 165 flags 0x00 dlen 10                                                   #116 8.986169
      ATT: Find Information Response (0x05) len 5
        Format: UUID-16 (0x01)
        Handle: 0x004c
        UUID: Client Characteristic Configuration (0x2902)
> HCI Event: Number of Completed Packets (0x13) plen 5                                                              #117 9.101021
        Num handles: 1
        Handle: 165 Address: DF:A9:FF:F6:B1:1A (OUI DF-A9-FF)
        Count: 1
        #116: len 10 (0 Kb/s)
        Latency: 114 msec (54-115 msec ~114 msec)
> ACL Data RX: Handle 165 flags 0x02 dlen 9                                                                         #118 9.101247
      ATT: Write Request (0x12) len 4
        Handle: 0x004c
          Data: 0000
zephyr.exe[2062740]: < HCI Command: Host Number of Completed Packets (0x03|0x0035) plen 5                           #119 9.106154
        Num handles: 1
        Handle: 165 Address: DF:A9:FF:F6:B1:1A (OUI DF-A9-FF)
        Count: 1
zephyr.exe[2062740]: < ACL Data TX: Handle 165 flags 0x00 dlen 5                                                    #120 9.106235
      ATT: Write Response (0x13) len 0
> HCI Event: Number of Completed Packets (0x13) plen 5                                                              #121 9.221046
        Num handles: 1
        Handle: 165 Address: DF:A9:FF:F6:B1:1A (OUI DF-A9-FF)
        Count: 1
        #120: len 5 (0 Kb/s)
        Latency: 114 msec (54-115 msec ~114 msec)
> ACL Data RX: Handle 165 flags 0x02 dlen 9                                                                         #122 9.221177
      ATT: Write Request (0x12) len 4
        Handle: 0x004c
          Data: 0100
zephyr.exe[2062740]: < HCI Command: Host Number of Completed Packets (0x03|0x0035) plen 5                           #123 9.226244
        Num handles: 1
        Handle: 165 Address: DF:A9:FF:F6:B1:1A (OUI DF-A9-FF)
        Count: 1
zephyr.exe[2062740]: < ACL Data TX: Handle 165 flags 0x00 dlen 5                                                    #124 9.226392
      ATT: Write Response (0x13) len 0
> HCI Event: Number of Completed Packets (0x13) plen 5                                                              #125 9.340998
        Num handles: 1
        Handle: 165 Address: DF:A9:FF:F6:B1:1A (OUI DF-A9-FF)
        Count: 1
        #124: len 5 (0 Kb/s)
        Latency: 114 msec (54-115 msec ~114 msec)
> ACL Data RX: Handle 165 flags 0x02 dlen 7                                                                         #126 9.341201
      ATT: Read Request (0x0a) len 2
        Handle: 0x004b
zephyr.exe[2062740]: < HCI Command: Host Number of Completed Packets (0x03|0x0035) plen 5                           #127 9.346237
        Num handles: 1
        Handle: 165 Address: DF:A9:FF:F6:B1:1A (OUI DF-A9-FF)
        Count: 1
zephyr.exe[2062740]: < ACL Data TX: Handle 165 flags 0x00 dlen 5                                                    #128 9.346288
      ATT: Read Response (0x0b) len 0
> HCI Event: Number of Completed Packets (0x13) plen 5                                                              #129 9.460930
        Num handles: 1
        Handle: 165 Address: DF:A9:FF:F6:B1:1A (OUI DF-A9-FF)
        Count: 1
        #128: len 5 (0 Kb/s)
        Latency: 114 msec (54-115 msec ~114 msec)
> ACL Data RX: Handle 165 flags 0x02 dlen 27                                                                        #130 9.641304
> ACL Data RX: Handle 165 flags 0x01 dlen 1                                                                         #131 9.641374
      ATT: Write Command (0x52) len 23
        Handle: 0x0049
          Data: 02001ab1f6ffa9df002c046b02401f010000000000
zephyr.exe[2062740]: < HCI Command: Host Number of Completed Packets (0x03|0x0035) plen 5                           #132 9.645741
        Num handles: 1
        Handle: 165 Address: DF:A9:FF:F6:B1:1A (OUI DF-A9-FF)
        Count: 1
zephyr.exe[2062740]: < HCI Command: Host Number of Completed Packets (0x03|0x0035) plen 5                           #133 9.645893
        Num handles: 1
        Handle: 165 Address: DF:A9:FF:F6:B1:1A (OUI DF-A9-FF)
        Count: 1
zephyr.exe[2062740]: < ACL Data TX: Handle 165 flags 0x00 dlen 27                                                   #134 9.645987
      ATT: Handle Value Notification (0x1b) len 22
        Handle: 0x004b
          Data: 00001ab1f6ffa9df002c046b0000010000000000
> HCI Event: Number of Completed Packets (0x13) plen 5                                                              #135 9.760972
        Num handles: 1
        Handle: 165 Address: DF:A9:FF:F6:B1:1A (OUI DF-A9-FF)
        Count: 1
        #134: len 27 (1 Kb/s)
        Latency: 114 msec (54-115 msec ~114 msec)
zephyr.exe[2062740]: < HCI Command: LE Periodic Advertising Create Sync (0x08|0x0044) plen 14                      #136 10.506171
        Options: 0x0000
        Use advertising SID, Advertiser Address Type and address
        Reporting initially enabled
        SID: 0x00
        Adv address type: Public (0x00)
        Adv address: DF:A9:FF:F6:B1:1A (OUI DF-A9-FF)
        Skip: 0x0005
        Sync timeout: 10000 msec (0x03e8)
        Sync CTE type: 0x0000
> HCI Event: Command Status (0x0f) plen 4                                                                          #137 10.506897
      LE Periodic Advertising Create Sync (0x08|0x0044) ncmd 1
        Status: Success (0x00)
zephyr.exe[2062740]: < HCI Command: LE Set Random Address (0x08|0x0005) plen 6                                     #138 10.525604
        Address: 06:5C:55:95:A0:5D (Non-Resolvable)
> HCI Event: Command Complete (0x0e) plen 4                                                                        #139 10.526094
      LE Set Random Address (0x08|0x0005) ncmd 1
        Status: Success (0x00)
zephyr.exe[2062740]: < HCI Command: LE Set Extended Scan Parameters (0x08|0x0041) plen 13                          #140 10.545604
        Own address type: Random (0x01)
        Filter policy: Accept all advertisement (0x00)
        PHYs: 0x05
        Entry 0: LE 1M
          Type: Passive (0x00)
          Interval: 60.000 msec (0x0060)
          Window: 30.000 msec (0x0030)
        Entry 1: LE Coded
          Type: Passive (0x00)
          Interval: 60.000 msec (0x0060)
          Window: 30.000 msec (0x0030)
> HCI Event: Command Complete (0x0e) plen 4                                                                        #141 10.546290
      LE Set Extended Scan Parameters (0x08|0x0041) ncmd 1
        Status: Success (0x00)
zephyr.exe[2062740]: < HCI Command: LE Set Extended Scan Enable (0x08|0x0042) plen 6                               #142 10.565643
        Extended scan: Enabled (0x01)
        Filter duplicates: Enabled (0x01)
        Duration: 0 msec (0x0000)
        Period: 0.00 sec (0x0000)
> HCI Event: Command Complete (0x0e) plen 4                                                                        #143 10.566298
      LE Set Extended Scan Enable (0x08|0x0042) ncmd 1
        Status: Success (0x00)
> HCI Event: LE Meta Event (0x3e) plen 48                                                                          #144 10.582094
      LE Extended Advertising Report (0x0d)
        Num reports: 1
        Entry 0
          Event type: 0x0000
            Props: 0x0000
            Data status: [0;32mComplete[0m
          Address type: Public (0x00)
          Address: DF:A9:FF:F6:B1:1A (OUI DF-A9-FF)
          Primary PHY: LE 1M
          Secondary PHY: LE 1M
          SID: 0x00
          TX power: 127 dBm
          RSSI: -16 dBm (0xf0)
          Periodic advertising interval: 120.00 msec (0x0060)
          Direct address type: Reserved (0xff)
          Direct address: 00-00-00-00-00-00
          Data length: 0x16
        06 16 52 18 2c 04 6b 0e 09 50 54 53 2d 42 41 53  ..R.,.k..PTS-BAS
        53 2d 42 31 31 41                                S-B11A          
        Service Data: Broadcast Audio Announcement (0x1852)
        Broadcast ID: 7013420 (0x6b042c)
        Name (complete): PTS-BASS-B11A
> HCI Event: LE Meta Event (0x3e) plen 38                                                                          #145 10.597377
      LE Extended Advertising Report (0x0d)
        Num reports: 1
        Entry 0
          Event type: 0x0012
            Props: 0x0012
              Scannable
              Use legacy advertising PDUs
            Data status: [0;32mComplete[0m
          Legacy PDU Type: ADV_SCAN_IND (0x0012)
          Address type: Random (0x01)
          Address: 72:4F:C7:2E:BB:91 (Resolvable)
          Primary PHY: LE 1M
          Secondary PHY: No packets
          SID: no ADI field (0xff)
          TX power: 127 dBm
          RSSI: -87 dBm (0xa9)
          Periodic advertising interval: 0.00 msec (0x0000)
          Direct address type: Reserved (0xff)
          Direct address: 00-00-00-00-00-00
          Data length: 0x0c
        0b ff 4c 00 09 06 03 00 0a 03 07 11              ..L.........    
        Company: Apple, Inc. (76)
          Type: Apple TV (9)
          Data: 03000a030711
> HCI Event: LE Meta Event (0x3e) plen 16                                                                          #146 10.691833
      LE Periodic Advertising Sync Established (0x0e)
        Status: Success (0x00)
        Sync handle: 55
        Advertising SID: 0x00
        Advertiser address type: Resolved Public (0x02)
        Advertiser address: DF:A9:FF:F6:B1:1A (OUI DF-A9-FF)
        Advertiser PHY: LE 1M (0x01)
        Periodic advertising interval: 120.00 msec (0x0060)
        Advertiser clock accuracy: 0x01
> HCI Event: LE Meta Event (0x3e) plen 48                                                                          #147 10.692316
      LE Periodic Advertising Report (0x0f)
        Sync handle: 55
        TX power: 127 dbm (0x7f)
        RSSI: -16 dBm (0xf0)
        CTE Type: No Constant Tone Extension (0xff)
        Data status: [0;32mComplete[0m
        Data length: 0x28
        27 16 51 18 40 9c 00 01 01 06 00 00 00 00 0a 02  '.Q.@...........
        01 03 02 02 01 03 04 28 00 06 03 02 04 00 01 09  .......(........
        01 06 05 03 01 00 00 00                          ........        
> HCI Event: LE Meta Event (0x3e) plen 20                                                                          #148 10.692518
      LE Broadcast Isochronous Group Info Advertising Report (0x22)
        Sync Handle: 0x0037
        Number BIS: 1
        NSE: 3
        ISO Interval: 10.00 msec (0x0008)
        BN: 1
        PTO: 1
        IRC: 2
        Maximum PDU: 40
        SDU Interval: 10000 us (0x002710)
        Maximum SDU: 40
        PHY: LE 1M (0x01)
        Framing: Unframed (0x00)
        Encryption: 0x00
> HCI Event: LE Meta Event (0x3e) plen 51                                                                          #149 10.697857
      LE Extended Advertising Report (0x0d)
        Num reports: 1
        Entry 0
          Event type: 0x0013
            Props: 0x0013
              Connectable
              Scannable
              Use legacy advertising PDUs
            Data status: [0;32mComplete[0m
          Legacy PDU Type: ADV_IND (0x0013)
          Address type: Public (0x00)
          Address: F0:18:98:96:04:94 (Apple, Inc.)
          Primary PHY: LE 1M
          Secondary PHY: No packets
          SID: no ADI field (0xff)
          TX power: 127 dBm
          RSSI: -88 dBm (0xa8)
          Periodic advertising interval: 0.00 msec (0x0000)
          Direct address type: Reserved (0xff)
          Direct address: 00-00-00-00-00-00
          Data length: 0x19
        02 01 06 11 07 00 00 00 00 00 00 00 00 00 00 00  ................
        00 00 01 31 5a 03 09 7a 6d                       ...1Z..zm       
        Flags: 0x06
          LE General Discoverable Mode
          BR/EDR Not Supported
        128-bit Service UUIDs (complete): 1 entry
          Vendor specific
        Name (complete): zm
zephyr.exe[2062740]: < HCI Command: LE Set Extended Scan Enable (0x08|0x0042) plen 6                               #150 10.706027
        Extended scan: Disabled (0x00)
        Filter duplicates: Disabled (0x00)
        Duration: 0 msec (0x0000)
        Period: 0.00 sec (0x0000)
> HCI Event: Command Complete (0x0e) plen 4                                                                        #151 10.707079
      LE Set Extended Scan Enable (0x08|0x0042) ncmd 1
        Status: Success (0x00)
zephyr.exe[2062740]: < ACL Data TX: Handle 165 flags 0x00 dlen 27                                                  #152 10.728750
zephyr.exe[2062740]: < ACL Data TX: Handle 165 flags 0x01 dlen 6                                                   #153 10.729033
      ATT: Handle Value Notification (0x1b) len 28
        Handle: 0x004b
          Data: 00001ab1f6ffa9df002c046b0200010000000006030204000109
> HCI Event: Number of Completed Packets (0x13) plen 5                                                             #154 10.841371
        Num handles: 1
        Handle: 165 Address: DF:A9:FF:F6:B1:1A (OUI DF-A9-FF)
        Count: 1
        #152: len 27 (1 Kb/s)
        Latency: 112 msec (54-115 msec ~113 msec)
> HCI Event: Number of Completed Packets (0x13) plen 5                                                             #155 10.900934
        Num handles: 1
        Handle: 165 Address: DF:A9:FF:F6:B1:1A (OUI DF-A9-FF)
        Count: 1
        #153: len 6 (0 Kb/s)
        Latency: 171 msec (54-171 msec ~142 msec)
> ACL Data RX: Handle 165 flags 0x02 dlen 22                                                                       #156 10.961193
      ATT: Write Command (0x52) len 17
        Handle: 0x0049
          Data: 030002401f01010000000403020100
zephyr.exe[2062740]: < HCI Command: Host Number of Completed Packets (0x03|0x0035) plen 5                          #157 10.965981
        Num handles: 1
        Handle: 165 Address: DF:A9:FF:F6:B1:1A (OUI DF-A9-FF)
        Count: 1
zephyr.exe[2062740]: < ACL Data TX: Handle 165 flags 0x00 dlen 27                                                  #158 10.966073
zephyr.exe[2062740]: < ACL Data TX: Handle 165 flags 0x01 dlen 4                                                   #159 10.966091
      ATT: Handle Value Notification (0x1b) len 26
        Handle: 0x004b
          Data: 00001ab1f6ffa9df002c046b020001000000000403020100
> HCI Event: Number of Completed Packets (0x13) plen 5                                                             #160 11.021340
        Num handles: 1
        Handle: 165 Address: DF:A9:FF:F6:B1:1A (OUI DF-A9-FF)
        Count: 1
        #158: len 27 (3 Kb/s)
        Latency: 55 msec (54-171 msec ~99 msec)
> HCI Event: Number of Completed Packets (0x13) plen 5                                                             #161 11.080998
        Num handles: 1
        Handle: 165 Address: DF:A9:FF:F6:B1:1A (OUI DF-A9-FF)
        Count: 1
        #159: len 4 (0 Kb/s)
        Latency: 114 msec (54-171 msec ~106 msec)
> HCI Event: LE Meta Event (0x3e) plen 48                                                                          #162 11.412003
      LE Periodic Advertising Report (0x0f)
        Sync handle: 55
        TX power: 127 dbm (0x7f)
        RSSI: -16 dBm (0xf0)
        CTE Type: No Constant Tone Extension (0xff)
        Data status: [0;32mComplete[0m
        Data length: 0x28
        27 16 51 18 40 9c 00 01 01 06 00 00 00 00 0a 02  '.Q.@...........
        01 03 02 02 01 03 04 28 00 06 03 02 04 00 01 09  .......(........
        01 06 05 03 01 00 00 00                          ........        
> HCI Event: LE Meta Event (0x3e) plen 20                                                                          #163 11.412324
      LE Broadcast Isochronous Group Info Advertising Report (0x22)
        Sync Handle: 0x0037
        Number BIS: 1
        NSE: 3
        ISO Interval: 10.00 msec (0x0008)
        BN: 1
        PTO: 1
        IRC: 2
        Maximum PDU: 40
        SDU Interval: 10000 us (0x002710)
        Maximum SDU: 40
        PHY: LE 1M (0x01)
        Framing: Unframed (0x00)
        Encryption: 0x00
zephyr.exe[2062740]: < HCI Command: LE Broadcast Isochronous Group Create Sync (0x08|0x006b) plen 25               #164 11.427226
        BIG Handle: 0x00
        BIG Sync Handle: 0x0037
        Encryption: Unencrypted (0x00)
        Broadcast Code: 00000000000000000000000000000000
        Maximum Number Subevents: 0x00
        Timeout: 200 ms (0x0014)
        Number of BIS: 1
        BIS ID: 0x01
> HCI Event: Command Status (0x0f) plen 4                                                                          #165 11.428052
      LE Broadcast Isochronous Group Create Sync (0x08|0x006b) ncmd 1
        Status: Success (0x00)
> HCI Event: LE Meta Event (0x3e) plen 48                                                                          #166 12.132123
      LE Periodic Advertising Report (0x0f)
        Sync handle: 55
        TX power: 127 dbm (0x7f)
        RSSI: -16 dBm (0xf0)
        CTE Type: No Constant Tone Extension (0xff)
        Data status: [0;32mComplete[0m
        Data length: 0x28
        27 16 51 18 40 9c 00 01 01 06 00 00 00 00 0a 02  '.Q.@...........
        01 03 02 02 01 03 04 28 00 06 03 02 04 00 01 09  .......(........
        01 06 05 03 01 00 00 00                          ........        
> HCI Event: LE Meta Event (0x3e) plen 20                                                                          #167 12.132277
      LE Broadcast Isochronous Group Info Advertising Report (0x22)
        Sync Handle: 0x0037
        Number BIS: 1
        NSE: 3
        ISO Interval: 10.00 msec (0x0008)
        BN: 1
        PTO: 1
        IRC: 2
        Maximum PDU: 40
        SDU Interval: 10000 us (0x002710)
        Maximum SDU: 40
        PHY: LE 1M (0x01)
        Framing: Unframed (0x00)
        Encryption: 0x00
> HCI Event: LE Meta Event (0x3e) plen 17                                                                          #168 12.138392
      LE Broadcast Isochronous Group Sync Estabilished (0x1d)
        Status: Success (0x00)
        BIG Handle: 0x00
        Transport Latency: 11500 us (0x002cec)
        NSE: 3
        BN: 1
        PTO: 1
        IRC: 2
        Maximum PDU: 40
        ISO Interval: 10.00 msec (0x0008)
        Connection Handle #0: 14
zephyr.exe[2062740]: < HCI Command: LE Setup Isochronous Data Path (0x08|0x006e) plen 13                           #169 12.147101
        Handle: 14
        Data Path Direction: Output (Controller to Host) (0x01)
        Data Path: HCI (0x00)
        Coding Format: Transparent (0x03)
        Company Codec ID: Ericsson Technology Licensing (0)
        Vendor Codec ID: 0
        Controller Delay: 0 us (0x000000)
        Codec Configuration Length: 0
        Codec Configuration: 
> HCI Event: Command Complete (0x0e) plen 6                                                                        #170 12.147861
      LE Setup Isochronous Data Path (0x08|0x006e) ncmd 1
        Status: Success (0x00)
        Handle: 14
> ISO Data RX: Handle 14 flags 0x06 dlen 8                                                                         #171 12.148227
> ISO Data RX: Handle 14 flags 0x06 dlen 8                                                                         #172 12.149368
> ISO Data RX: Handle 14 flags 0x06 dlen 8                                                                         #173 12.159337
zephyr.exe[2062740]: < ACL Data TX: Handle 165 flags 0x00 dlen 27                                                  #174 12.167023
zephyr.exe[2062740]: < ACL Data TX: Handle 165 flags 0x01 dlen 4                                                   #175 12.167181
      ATT: Handle Value Notification (0x1b) len 26
        Handle: 0x004b
          Data: 00001ab1f6ffa9df002c046b020001010000000403020100
> ISO Data RX: Handle 14 flags 0x06 dlen 8                                                                         #176 12.169294
> ISO Data RX: Handle 14 flags 0x06 dlen 8                                                                         #177 12.179373
> ISO Data RX: Handle 14 flags 0x06 dlen 8                                                                         #178 12.189294
> ISO Data RX: Handle 14 flags 0x06 dlen 8                                                                         #179 12.199376
> ISO Data RX: Handle 14 flags 0x06 dlen 8                                                                         #180 12.209401
> ISO Data RX: Handle 14 flags 0x06 dlen 8                                                                         #181 12.219389
> HCI Event: Number of Completed Packets (0x13) plen 5                                                             #182 12.221277
        Num handles: 1
        Handle: 165 Address: DF:A9:FF:F6:B1:1A (OUI DF-A9-FF)
        Count: 1
        #174: len 27 (4 Kb/s)
        Latency: 54 msec (54-171 msec ~80 msec)
> ISO Data RX: Handle 14 flags 0x06 dlen 8                                                                         #183 12.229333
> ISO Data RX: Handle 14 flags 0x06 dlen 8                                                                         #184 12.239423
> ISO Data RX: Handle 14 flags 0x06 dlen 8                                                                         #185 12.249335
> ISO Data RX: Handle 14 flags 0x06 dlen 8                                                                         #186 12.259361
> ISO Data RX: Handle 14 flags 0x06 dlen 8                                                                         #187 12.269388
> ISO Data RX: Handle 14 flags 0x06 dlen 8                                                                         #188 12.279409
> HCI Event: Number of Completed Packets (0x13) plen 5                                                             #189 12.280914
        Num handles: 1
        Handle: 165 Address: DF:A9:FF:F6:B1:1A (OUI DF-A9-FF)
        Count: 1
        #175: len 4 (0 Kb/s)
        Latency: 113 msec (54-171 msec ~97 msec)
> ISO Data RX: Handle 14 flags 0x06 dlen 8                                                                         #190 12.289455
> ISO Data RX: Handle 14 flags 0x06 dlen 8                                                                         #191 12.299460
> ISO Data RX: Handle 14 flags 0x06 dlen 8                                                                         #192 12.309340
> ISO Data RX: Handle 14 flags 0x06 dlen 8                                                                         #193 12.319345
> ISO Data RX: Handle 14 flags 0x06 dlen 8                                                                         #194 12.329431
> ISO Data RX: Handle 14 flags 0x06 dlen 8                                                                         #195 12.339526
> ACL Data RX: Handle 165 flags 0x02 dlen 18                                                                       #196 12.341091
      ATT: Write Command (0x52) len 13
        Handle: 0x0049
          Data: 030002401f010000000000
zephyr.exe[2062740]: < HCI Command: LE Broadcast Isochronous Group Terminate Sync (0x08|0x006c) plen 1             #197 12.347143
        BIG Handle: 0x00
zephyr.exe[2062740]: < ACL Data TX: Handle 165 flags 0x00 dlen 27                                                  #198 12.347362
      ATT: Handle Value Notification (0x1b) len 22
        Handle: 0x004b
          Data: 00001ab1f6ffa9df002c046b0200010100000000
> HCI Event: Command Complete (0x0e) plen 5                                                                        #199 12.347754
      LE Broadcast Isochronous Group Terminate Sync (0x08|0x006c) ncmd 1
        Status: Success (0x00)
        00                                               .               
zephyr.exe[2062740]: < HCI Command: Host Number of Completed Packets (0x03|0x0035) plen 5                          #200 12.366365
        Num handles: 1
        Handle: 165 Address: DF:A9:FF:F6:B1:1A (OUI DF-A9-FF)
        Count: 1
zephyr.exe[2062740]: < ACL Data TX: Handle 165 flags 0x00 dlen 27                                                  #201 12.366690
      ATT: Handle Value Notification (0x1b) len 22
        Handle: 0x004b
          Data: 00001ab1f6ffa9df002c046b0200010000000000
> HCI Event: Number of Completed Packets (0x13) plen 5                                                             #202 12.401427
        Num handles: 1
        Handle: 165 Address: DF:A9:FF:F6:B1:1A (OUI DF-A9-FF)
        Count: 1
        #198: len 27 (4 Kb/s)
        Latency: 54 msec (54-171 msec ~75 msec)
> HCI Event: Number of Completed Packets (0x13) plen 5                                                             #203 12.460794
        Num handles: 1
        Handle: 165 Address: DF:A9:FF:F6:B1:1A (OUI DF-A9-FF)
        Count: 1
        #201: len 27 (2 Kb/s)
        Latency: 94 msec (54-171 msec ~84 msec)
> ACL Data RX: Handle 165 flags 0x02 dlen 22                                                                       #204 12.521126
      ATT: Write Command (0x52) len 17
        Handle: 0x0049
          Data: 030002401f01ffffffff0403020100
zephyr.exe[2062740]: < HCI Command: Host Number of Completed Packets (0x03|0x0035) plen 5                          #205 12.525975
        Num handles: 1
        Handle: 165 Address: DF:A9:FF:F6:B1:1A (OUI DF-A9-FF)
        Count: 1
zephyr.exe[2062740]: < ACL Data TX: Handle 165 flags 0x00 dlen 27                                                  #206 12.526064
zephyr.exe[2062740]: < ACL Data TX: Handle 165 flags 0x01 dlen 4                                                   #207 12.526069
      ATT: Handle Value Notification (0x1b) len 26
        Handle: 0x004b
          Data: 00001ab1f6ffa9df002c046b020001000000000403020100
> HCI Event: Number of Completed Packets (0x13) plen 5                                                             #208 12.581277
        Num handles: 1
        Handle: 165 Address: DF:A9:FF:F6:B1:1A (OUI DF-A9-FF)
        Count: 1
        #206: len 27 (3 Kb/s)
        Latency: 55 msec (54-171 msec ~70 msec)
> HCI Event: Number of Completed Packets (0x13) plen 5                                                             #209 12.640927
        Num handles: 1
        Handle: 165 Address: DF:A9:FF:F6:B1:1A (OUI DF-A9-FF)
        Count: 1
        #207: len 4 (0 Kb/s)
        Latency: 114 msec (54-171 msec ~92 msec)
> HCI Event: LE Meta Event (0x3e) plen 48                                                                          #210 12.851966
      LE Periodic Advertising Report (0x0f)
        Sync handle: 55
        TX power: 127 dbm (0x7f)
        RSSI: -16 dBm (0xf0)
        CTE Type: No Constant Tone Extension (0xff)
        Data status: [0;32mComplete[0m
        Data length: 0x28
        27 16 51 18 40 9c 00 01 01 06 00 00 00 00 0a 02  '.Q.@...........
        01 03 02 02 01 03 04 28 00 06 03 02 04 00 01 09  .......(........
        01 06 05 03 01 00 00 00                          ........        
> HCI Event: LE Meta Event (0x3e) plen 20                                                                          #211 12.852287
      LE Broadcast Isochronous Group Info Advertising Report (0x22)
        Sync Handle: 0x0037
        Number BIS: 1
        NSE: 3
        ISO Interval: 10.00 msec (0x0008)
        BN: 1
        PTO: 1
        IRC: 2
        Maximum PDU: 40
        SDU Interval: 10000 us (0x002710)
        Maximum SDU: 40
        PHY: LE 1M (0x01)
        Framing: Unframed (0x00)
        Encryption: 0x00
zephyr.exe[2062740]: < HCI Command: LE Broadcast Isochronous Group Create Sync (0x08|0x006b) plen 25               #212 12.867268
        BIG Handle: 0x00
        BIG Sync Handle: 0x0037
        Encryption: Unencrypted (0x00)
        Broadcast Code: 00000000000000000000000000000000
        Maximum Number Subevents: 0x00
        Timeout: 200 ms (0x0014)
        Number of BIS: 1
        BIS ID: 0x01
> HCI Event: Command Status (0x0f) plen 4                                                                          #213 12.868115
      LE Broadcast Isochronous Group Create Sync (0x08|0x006b) ncmd 1
        Status: Success (0x00)
> HCI Event: LE Meta Event (0x3e) plen 48                                                                          #214 13.571969
      LE Periodic Advertising Report (0x0f)
        Sync handle: 55
        TX power: 127 dbm (0x7f)
        RSSI: -16 dBm (0xf0)
        CTE Type: No Constant Tone Extension (0xff)
        Data status: [0;32mComplete[0m
        Data length: 0x28
        27 16 51 18 40 9c 00 01 01 06 00 00 00 00 0a 02  '.Q.@...........
        01 03 02 02 01 03 04 28 00 06 03 02 04 00 01 09  .......(........
        01 06 05 03 01 00 00 00                          ........        
> HCI Event: LE Meta Event (0x3e) plen 20                                                                          #215 13.572224
      LE Broadcast Isochronous Group Info Advertising Report (0x22)
        Sync Handle: 0x0037
        Number BIS: 1
        NSE: 3
        ISO Interval: 10.00 msec (0x0008)
        BN: 1
        PTO: 1
        IRC: 2
        Maximum PDU: 40
        SDU Interval: 10000 us (0x002710)
        Maximum SDU: 40
        PHY: LE 1M (0x01)
        Framing: Unframed (0x00)
        Encryption: 0x00
> HCI Event: LE Meta Event (0x3e) plen 17                                                                          #216 13.578208
      LE Broadcast Isochronous Group Sync Estabilished (0x1d)
        Status: Success (0x00)
        BIG Handle: 0x00
        Transport Latency: 11500 us (0x002cec)
        NSE: 3
        BN: 1
        PTO: 1
        IRC: 2
        Maximum PDU: 40
        ISO Interval: 10.00 msec (0x0008)
        Connection Handle #0: 34
zephyr.exe[2062740]: < HCI Command: LE Setup Isochronous Data Path (0x08|0x006e) plen 13                           #217 13.587257
        Handle: 34
        Data Path Direction: Output (Controller to Host) (0x01)
        Data Path: HCI (0x00)
        Coding Format: Transparent (0x03)
        Company Codec ID: Ericsson Technology Licensing (0)
        Vendor Codec ID: 0
        Controller Delay: 0 us (0x000000)
        Codec Configuration Length: 0
        Codec Configuration: 
> HCI Event: Command Complete (0x0e) plen 6                                                                        #218 13.587991
      LE Setup Isochronous Data Path (0x08|0x006e) ncmd 1
        Status: Success (0x00)
        Handle: 34
> ISO Data RX: Handle 34 flags 0x06 dlen 8                                                                         #219 13.588750
> ISO Data RX: Handle 34 flags 0x06 dlen 8                                                                         #220 13.589362
> ISO Data RX: Handle 34 flags 0x06 dlen 8                                                                         #221 13.599372
zephyr.exe[2062740]: < ACL Data TX: Handle 165 flags 0x00 dlen 27                                                  #222 13.607071
zephyr.exe[2062740]: < ACL Data TX: Handle 165 flags 0x01 dlen 4                                                   #223 13.607272
      ATT: Handle Value Notification (0x1b) len 26
        Handle: 0x004b
          Data: 00001ab1f6ffa9df002c046b020001010000000403020100
> ISO Data RX: Handle 34 flags 0x06 dlen 8                               