Bluetooth monitor ver 5.84
btmon[1470247]: = Note: Linux version 6.8.0-83-generic (x86_64)                                                          0.779020
btmon[1470247]: = Note: Bluetooth subsystem version 2.22                                                                 0.779022
= New Index: 00:00:00:00:00:00 (Primary,UART,hci0)                                                                       0.779023
= Open Index: 00:00:00:00:00:00                                                                                          1.287088
= Index Info: 00:00:00:00:00:00 (Nordic Semiconductor ASA)                                                               1.287092
zephyr.exe[1470249]: @ USER Open: main (privileged) version 2.22                                                {0x0001} 1.287095
zephyr.exe[1470249]: < HCI Command: Reset (0x03|0x0003) plen 0                                                        #1 1.287370
> HCI Event: Command Complete (0x0e) plen 4                                                                           #2 1.288141
      Reset (0x03|0x0003) ncmd 1
        Status: Success (0x00)
zephyr.exe[1470249]: < HCI Command: Read Local Supported Features (0x04|0x0003) plen 0                                #3 1.306955
> HCI Event: Command Complete (0x0e) plen 12                                                                          #4 1.308508
      Read Local Supported Features (0x04|0x0003) ncmd 1
        Status: Success (0x00)
        Features: 0x00 0x00 0x00 0x00 0x60 0x00 0x00 0x00
          BR/EDR Not Supported
          LE Supported (Controller)
zephyr.exe[1470249]: < HCI Command: Read Local Version Information (0x04|0x0001) plen 0                               #5 1.327025
> HCI Event: Command Complete (0x0e) plen 12                                                                          #6 1.327991
      Read Local Version Information (0x04|0x0001) ncmd 1
        Status: Success (0x00)
        HCI version: Reserved (0x0e) - Revision 12520 (0x30e8)
        LMP version: Reserved (0x0e) - Subversion 12520 (0x30e8)
        Manufacturer: Nordic Semiconductor ASA (89)
zephyr.exe[1470249]: < HCI Command: Read Local Supported Commands (0x04|0x0002) plen 0                                #7 1.347051
> HCI Event: Command Complete (0x0e) plen 68                                                                          #8 1.348185
      Read Local Supported Commands (0x04|0x0002) ncmd 1
        Status: Success (0x00)
        Commands: 119 entries
          Disconnect (Octet 0 - Bit 5)
          Read Remote Version Information (Octet 2 - Bit 7)
          Set Event Mask (Octet 5 - Bit 6)
          Reset (Octet 5 - Bit 7)
          Read Connection Accept Timeout (Octet 7 - Bit 2)
          Write Connection Accept Timeout (Octet 7 - Bit 3)
          Read Transmit Power Level (Octet 10 - Bit 2)
          Set Controller To Host Flow Control (Octet 10 - Bit 5)
          Host Buffer Size (Octet 10 - Bit 6)
          Host Number of Completed Packets (Octet 10 - Bit 7)
          Read Local Version Information (Octet 14 - Bit 3)
          Read Local Supported Features (Octet 14 - Bit 5)
          Read BD ADDR (Octet 15 - Bit 1)
          Read RSSI (Octet 15 - Bit 5)
          Set Event Mask Page 2 (Octet 22 - Bit 2)
          LE Set Event Mask (Octet 25 - Bit 0)
          LE Read Buffer Size (Octet 25 - Bit 1)
          LE Read Local Supported Features (Octet 25 - Bit 2)
          LE Set Random Address (Octet 25 - Bit 4)
          LE Set Advertising Parameters (Octet 25 - Bit 5)
          LE Read Advertising Channel TX Power (Octet 25 - Bit 6)
          LE Set Advertising Data (Octet 25 - Bit 7)
          LE Set Scan Response Data (Octet 26 - Bit 0)
          LE Set Advertise Enable (Octet 26 - Bit 1)
          LE Set Scan Parameters (Octet 26 - Bit 2)
          LE Set Scan Enable (Octet 26 - Bit 3)
          LE Create Connection (Octet 26 - Bit 4)
          LE Create Connection Cancel (Octet 26 - Bit 5)
          LE Read Accept List Size (Octet 26 - Bit 6)
          LE Clear Accept List (Octet 26 - Bit 7)
          LE Add Device To Accept List (Octet 27 - Bit 0)
          LE Remove Device From Accept List (Octet 27 - Bit 1)
          LE Connection Update (Octet 27 - Bit 2)
          LE Set Host Channel Classification (Octet 27 - Bit 3)
          LE Read Channel Map (Octet 27 - Bit 4)
          LE Read Remote Used Features (Octet 27 - Bit 5)
          LE Encrypt (Octet 27 - Bit 6)
          LE Rand (Octet 27 - Bit 7)
          LE Start Encryption (Octet 28 - Bit 0)
          LE Long Term Key Request Reply (Octet 28 - Bit 1)
          LE Long Term Key Request Neg Reply (Octet 28 - Bit 2)
          LE Read Supported States (Octet 28 - Bit 3)
          LE Receiver Test (Octet 28 - Bit 4)
          LE Transmitter Test (Octet 28 - Bit 5)
          LE Test End (Octet 28 - Bit 6)
          Read Authenticated Payload Timeout (Octet 32 - Bit 4)
          Write Authenticated Payload Timeout (Octet 32 - Bit 5)
          LE Set Data Length (Octet 33 - Bit 6)
          LE Read Suggested Default Data Length (Octet 33 - Bit 7)
          LE Write Suggested Default Data Length (Octet 34 - Bit 0)
          LE Add Device To Resolving List (Octet 34 - Bit 3)
          LE Remove Device From Resolving List (Octet 34 - Bit 4)
          LE Clear Resolving List (Octet 34 - Bit 5)
          LE Read Resolving List Size (Octet 34 - Bit 6)
          LE Set Address Resolution Enable (Octet 35 - Bit 1)
          LE Set Resolvable Private Address Timeout (Octet 35 - Bit 2)
          LE Read Maximum Data Length (Octet 35 - Bit 3)
          LE Read PHY (Octet 35 - Bit 4)
          LE Set Default PHY (Octet 35 - Bit 5)
          LE Set PHY (Octet 35 - Bit 6)
          LE Enhanced Receiver Test (Octet 35 - Bit 7)
          LE Enhanced Transmitter Test (Octet 36 - Bit 0)
          LE Set Advertising Set Random Address (Octet 36 - Bit 1)
          LE Set Extended Advertising Parameters (Octet 36 - Bit 2)
          LE Set Extended Advertising Data (Octet 36 - Bit 3)
          LE Set Extended Scan Response Data (Octet 36 - Bit 4)
          LE Set Extended Advertising Enable (Octet 36 - Bit 5)
          LE Read Maximum Advertising Data Length (Octet 36 - Bit 6)
          LE Read Number of Supported Advertising Sets (Octet 36 - Bit 7)
          LE Remove Advertising Set (Octet 37 - Bit 0)
          LE Clear Advertising Sets (Octet 37 - Bit 1)
          LE Set Periodic Advertising Parameters (Octet 37 - Bit 2)
          LE Set Periodic Advertising Data (Octet 37 - Bit 3)
          LE Set Periodic Advertising Enable (Octet 37 - Bit 4)
          LE Set Extended Scan Parameters (Octet 37 - Bit 5)
          LE Set Extended Scan Enable (Octet 37 - Bit 6)
          LE Extended Create Connection (Octet 37 - Bit 7)
          LE Periodic Advertising Create Sync (Octet 38 - Bit 0)
          LE Periodic Advertising Create Sync Cancel (Octet 38 - Bit 1)
          LE Periodic Advertising Terminate Sync (Octet 38 - Bit 2)
          LE Add Device To Periodic Advertiser List (Octet 38 - Bit 3)
          LE Remove Device From Periodic Advertiser List (Octet 38 - Bit 4)
          LE Clear Periodic Advertiser List (Octet 38 - Bit 5)
          LE Read Periodic Advertiser List Size (Octet 38 - Bit 6)
          LE Read Transmit Power (Octet 38 - Bit 7)
          LE Read RF Path Compensation (Octet 39 - Bit 0)
          LE Write RF Path Compensation (Octet 39 - Bit 1)
          LE Set Privacy Mode (Octet 39 - Bit 2)
          LE Periodic Advertising Receive Enable (Octet 40 - Bit 5)
          LE Periodic Advertising Sync Transfer (Octet 40 - Bit 6)
          LE Periodic Advertising Set Info Transfer (Octet 40 - Bit 7)
          LE Periodic Advertising Sync Transfer Parameters (Octet 41 - Bit 0)
          LE Set Default Periodic Advertisng Sync Transfer Parameters (Octet 41 - Bit 1)
          LE Read Buffer v2 (Octet 41 - Bit 5)
          LE Read ISO TX Sync (Octet 41 - Bit 6)
          LE Set Connected Isochronous Group Parameters (Octet 41 - Bit 7)
          LE Set Connected Isochronous Group Parameters Test (Octet 42 - Bit 0)
          LE Create Connected Isochronous Stream (Octet 42 - Bit 1)
          LE Remove Connected Isochronous Group (Octet 42 - Bit 2)
          LE Accept Connected Isochronous Stream Request (Octet 42 - Bit 3)
          LE Reject Connected Isochronous Stream Request (Octet 42 - Bit 4)
          LE Create Broadcast Isochronous Group (Octet 42 - Bit 5)
          LE Create Broadcast Isochronous Group Test (Octet 42 - Bit 6)
          LE Terminate Broadcast Isochronous Group (Octet 42 - Bit 7)
          LE Broadcast Isochronous Group Create Sync (Octet 43 - Bit 0)
          LE Broadcast Isochronous Group Terminate Sync (Octet 43 - Bit 1)
          LE Request Peer SCA (Octet 43 - Bit 2)
          LE Setup Isochronous Data Path (Octet 43 - Bit 3)
          LE Remove Isochronous Data Path (Octet 43 - Bit 4)
          LE Isochronous Transmit Test (Octet 43 - Bit 5)
          LE Isochronous Receive Test (Octet 43 - Bit 6)
          LE Isochronous Read Test Counters (Octet 43 - Bit 7)
          LE Isochronous Read Test Counters (Octet 44 - Bit 0)
          LE Set Host Feature (Octet 44 - Bit 1)
          LE Read ISO link quality (Octet 44 - Bit 2)
          Octet 45 - Bit 6 
          Octet 46 - Bit 0 
          Octet 46 - Bit 1 
          Octet 46 - Bit 2 
zephyr.exe[1470249]: < HCI Command: Host Buffer Size (0x03|0x0033) plen 7                                             #9 1.367047
        ACL MTU: 255  ACL max packet: 16
        SCO MTU: 0    SCO max packet: 0
> HCI Event: Command Complete (0x0e) plen 4                                                                          #10 1.367954
      Host Buffer Size (0x03|0x0033) ncmd 1
        Status: Success (0x00)
zephyr.exe[1470249]: < HCI Command: Set Controller To Host Flow Control (0x03|0x0031) plen 1                         #11 1.386984
        Flow control: ACL Data Packets (0x01)
> HCI Event: Command Complete (0x0e) plen 4                                                                          #12 1.388646
      Set Controller To Host Flow Control (0x03|0x0031) ncmd 1
        Status: Success (0x00)
zephyr.exe[1470249]: < HCI Command: LE Read Local Supported Features (0x08|0x0003) plen 0                            #13 1.406949
> HCI Event: Command Complete (0x0e) plen 12                                                                         #14 1.407732
      LE Read Local Supported Features (0x08|0x0003) ncmd 1
        Status: Success (0x00)
        Features: 0xfd 0x79 0x00 0xf7 0x30 0x01 0x00 0x00
          LE Encryption
          Extended Reject Indication
          Peripheral-initiated Features Exchange
          LE Ping
          LE Data Packet Length Extension
          LL Privacy
          Extended Scanner Filter Policies
          LE 2M PHY
          LE Coded PHY
          LE Extended Advertising
          LE Periodic Advertising
          Channel Selection Algorithm #2
          Periodic Advertising Sync Transfer - Sender
          Periodic Advertising Sync Transfer - Recipient
          Sleep Clock Accuracy Updates
          Connected Isochronous Stream - Central
          Connected Isochronous Stream - Peripheral
          Isochronous Broadcaster
          Synchronized Receiver
          Periodic Advertising ADI support
          Connection Subrating
          Unknown features (0x0000010000000000)
zephyr.exe[1470249]: < HCI Command: LE Set Host Feature (0x08|0x0074) plen 2                                         #15 1.426978
        Bit Number: 32
          Connected Isochronous Stream (Host Support)
        Bit Value: 1
> HCI Event: Command Complete (0x0e) plen 4                                                                          #16 1.427512
      LE Set Host Feature (0x08|0x0074) ncmd 1
        Status: Success (0x00)
zephyr.exe[1470249]: < HCI Command: LE Read Buffer v2 (0x08|0x0060) plen 0                                           #17 1.446997
> HCI Event: Command Complete (0x0e) plen 10                                                                         #18 1.447546
      LE Read Buffer v2 (0x08|0x0060) ncmd 1
        Status: Success (0x00)
        ACL MTU: 27
        ACL max packet: 3
        ISO MTU: 318
        ISO max packet: 3
zephyr.exe[1470249]: < HCI Command: LE Read Maximum Advertising Data Length (0x08|0x003a) plen 0                     #19 1.467033
> HCI Event: Command Complete (0x0e) plen 6                                                                          #20 1.467703
      LE Read Maximum Advertising Data Length (0x08|0x003a) ncmd 1
        Status: Success (0x00)
        Max length: 1650
zephyr.exe[1470249]: < HCI Command: LE Read Supported States (0x08|0x001c) plen 0                                    #21 1.486958
> HCI Event: Command Complete (0x0e) plen 12                                                                         #22 1.487544
      LE Read Supported States (0x08|0x001c) ncmd 1
        Status: Success (0x00)
        States: 0x000003ff3e0306ff
          Non-connectable Advertising State
          Scannable Advertising State
          Connectable Advertising State
          High Duty Cycle Directed Advertising State
          Passive Scanning State
          Active Scanning State
          Initiating State
            and Connection State (Central Role)
          Connection State (Peripheral Role)
          Scannable Advertising State
            and Passive Scanning State
          Connectable Advertising State
            and Passive Scanning State
          Non-connectable Advertising State
            and Initiating State
          Scannable Advertising State
            and Initiating State
          Active Scanning State
            and Connection State (Central Role)
          Passive Scanning State
            and Connection State (Peripheral Role)
          Active Scanning State
            and Connection State (Peripheral Role)
          Initiating State
            and Connection State (Central Role)
            and Central Role & Central Role
          Low Duty Cycle Directed Advertising State
          Connectable Advertising State
            and Initiating State
            and Central Role & Peripheral Role
          High Duty Cycle Directed Advertising State
            and Initiating State
            and Central Role & Peripheral Role
          Low Duty Cycle Directed Advertising State
            and Initiating State
            and Central Role & Peripheral Role
          Connectable Advertising State
            and Connection State (Central Role)
            and Central Role & Peripheral Role
          High Duty Cycle Directed Advertising State
            and Connection State (Central Role)
            and Central Role & Peripheral Role
          Low Duty Cycle Directed Advertising State
            and Connection State (Central Role)
            and Central Role & Peripheral Role
          Connectable Advertising State
            and Connection State (Peripheral Role)
            and Central Role & Peripheral Role
          High Duty Cycle Directed Advertising State
            and Connection State (Peripheral Role)
            and Peripheral Role & Peripheral Role
          Low Duty Cycle Directed Advertising State
            and Connection State (Peripheral Role)
            and Peripheral Role & Peripheral Role
          Initiating State
            and Connection State (Peripheral Role)
            and Central Role & Peripheral Role
zephyr.exe[1470249]: < HCI Command: LE Read Maximum Data Length (0x08|0x002f) plen 0                                 #23 1.507007
> HCI Event: Command Complete (0x0e) plen 12                                                                         #24 1.507983
      LE Read Maximum Data Length (0x08|0x002f) ncmd 1
        Status: Success (0x00)
        Max TX octets: 251
        Max TX time: 2704
        Max RX octets: 251
        Max RX time: 2704
zephyr.exe[1470249]: < HCI Command: LE Write Suggested Default Data Length (0x08|0x0024) plen 4                      #25 1.526986
        TX octets: 251
        TX time: 2704
> HCI Event: Command Complete (0x0e) plen 4                                                                          #26 1.527455
      LE Write Suggested Default Data Length (0x08|0x0024) ncmd 1
        Status: Success (0x00)
zephyr.exe[1470249]: < HCI Command: LE Read Resolving List Size (0x08|0x002a) plen 0                                 #27 1.546932
> HCI Event: Command Complete (0x0e) plen 5                                                                          #28 1.547828
      LE Read Resolving List Size (0x08|0x002a) ncmd 1
        Status: Success (0x00)
        Size: 8
zephyr.exe[1470249]: < HCI Command: LE Set Event Mask (0x08|0x0001) plen 8                                           #29 1.567003
        Mask: 0x000002023f87fa5e
          LE Advertising Report
          LE Connection Update Complete
          LE Read Remote Used Features Complete
          LE Long Term Key Request
          LE Data Length Change
          LE Enhanced Connection Complete
          LE PHY Update Complete
          LE Extended Advertising Report
          LE Periodic Advertising Sync Established
          LE Periodic Advertising Report
          LE Periodic Advertising Sync Lost
          LE Extended Scan Timeout
          LE Extended Advertising Set Terminated
          LE Scan Request Received
          LE Periodic Advertising Sync Transfer Rvc
          LE CIS Established
          LE CIS Request
          LE Create BIG Complete
          LE Terminate BIG Complete
          LE BIG Sync Established Complete
          LE BIG Sync Lost
          LE BIG Info Advertising Report
          Unknown mask (0x0000020000000000)
> HCI Event: Command Complete (0x0e) plen 4                                                                          #30 1.567797
      LE Set Event Mask (0x08|0x0001) ncmd 1
        Status: Success (0x00)
zephyr.exe[1470249]: < HCI Command: Set Event Mask (0x03|0x0001) plen 8                                              #31 1.586979
        Mask: 0x2000800002008890
          Disconnection Complete
          Encryption Change
          Read Remote Version Information Complete
          Hardware Error
          Data Buffer Overflow
          Encryption Key Refresh Complete
          LE Meta
> HCI Event: Command Complete (0x0e) plen 4                                                                          #32 1.587922
      Set Event Mask (0x03|0x0001) ncmd 1
        Status: Success (0x00)
zephyr.exe[1470249]: < HCI Command: Read BD ADDR (0x04|0x0009) plen 0                                                #33 1.606947
> HCI Event: Command Complete (0x0e) plen 10                                                                         #34 1.607645
      Read BD ADDR (0x04|0x0009) ncmd 1
        Status: Success (0x00)
        Address: 00:00:00:00:00:00 (OUI 00-00-00)
zephyr.exe[1470249]: < HCI Command: LE Set Random Address (0x08|0x0005) plen 6                                       #35 1.627028
        Address: D5:B6:CC:31:DB:3B (Static)
> HCI Event: Command Complete (0x0e) plen 4                                                                          #36 1.627807
      LE Set Random Address (0x08|0x0005) ncmd 1
        Status: Success (0x00)
zephyr.exe[1470249]: < HCI Command: LE Extended Create Connection (0x08|0x0043) plen 26                              #37 3.846986
        Filter policy: Accept list is not used (0x00)
        Own address type: Random (0x01)
        Peer address type: Public (0x00)
        Peer address: DF:A9:FF:F6:B1:1A (OUI DF-A9-FF)
        Initiating PHYs: 0x01
        Entry 0: LE 1M
          Scan interval: 60.000 msec (0x0060)
          Scan window: 60.000 msec (0x0060)
          Min connection interval: 30.00 msec (0x0018)
          Max connection interval: 50.00 msec (0x0028)
          Connection latency: 0 (0x0000)
          Supervision timeout: 4000 msec (0x0190)
          Min connection length: 0.000 msec (0x0000)
          Max connection length: 0.000 msec (0x0000)
> HCI Event: Command Status (0x0f) plen 4                                                                            #38 3.848032
      LE Extended Create Connection (0x08|0x0043) ncmd 1
        Status: Success (0x00)
> HCI Event: LE Meta Event (0x3e) plen 31                                                                            #39 3.929658
      LE Enhanced Connection Complete (0x0a)
        Status: Success (0x00)
        Handle: 90
        Role: Central (0x00)
        Peer address type: Public (0x00)
        Peer address: DF:A9:FF:F6:B1:1A (OUI DF-A9-FF)
        Local resolvable private address: 00:00:00:00:00:00 (Non-Resolvable)
        Peer resolvable private address: 00:00:00:00:00:00 (Non-Resolvable)
        Connection interval: 50.00 msec (0x0028)
        Connection latency: 0 (0x0000)
        Supervision timeout: 4000 msec (0x0190)
        Central clock accuracy: 0x00
zephyr.exe[1470249]: < HCI Command: LE Read Remote Used Features (0x08|0x0016) plen 2                                #40 3.947025
        Handle: 90 Address: DF:A9:FF:F6:B1:1A (OUI DF-A9-FF)
> HCI Event: Command Status (0x0f) plen 4                                                                            #41 3.947453
      LE Read Remote Used Features (0x08|0x0016) ncmd 1
        Status: Success (0x00)
zephyr.exe[1470249]: < HCI Command: LE Set PHY (0x08|0x0032) plen 7                                                  #42 3.966930
        Handle: 90 Address: DF:A9:FF:F6:B1:1A (OUI DF-A9-FF)
        All PHYs preference: 0x00
        TX PHYs preference: 0x02
          LE 2M
        RX PHYs preference: 0x02
          LE 2M
        PHY options preference: Reserved (0x0000)
> HCI Event: Command Status (0x0f) plen 4                                                                            #43 3.967629
      LE Set PHY (0x08|0x0032) ncmd 1
        Status: Success (0x00)
> HCI Event: LE Meta Event (0x3e) plen 12                                                                            #44 4.081296
      LE Read Remote Used Features (0x04)
        Status: Success (0x00)
        Handle: 90 Address: DF:A9:FF:F6:B1:1A (OUI DF-A9-FF)
        Features: 0x2d 0x49 0x00 0xf7 0x67 0xd8 0x00 0x00
          LE Encryption
          Extended Reject Indication
          Peripheral-initiated Features Exchange
          LE Data Packet Length Extension
          LE 2M PHY
          LE Coded PHY
          Channel Selection Algorithm #2
          Periodic Advertising Sync Transfer - Sender
          Periodic Advertising Sync Transfer - Recipient
          Sleep Clock Accuracy Updates
          Connected Isochronous Stream - Central
          Connected Isochronous Stream - Peripheral
          Isochronous Broadcaster
          Synchronized Receiver
          Connected Isochronous Stream (Host Support)
          LE Power Control Request
          LE Power Control Request
          Connection Subrating
          Connection Subrating (Host Support)
          Unknown features (0x0000d80000000000)
> HCI Event: LE Meta Event (0x3e) plen 6                                                                             #45 4.580285
      LE PHY Update Complete (0x0c)
        Status: Success (0x00)
        Handle: 90 Address: DF:A9:FF:F6:B1:1A (OUI DF-A9-FF)
        TX PHY: LE 2M (0x02)
        RX PHY: LE 2M (0x02)
zephyr.exe[1470249]: < ACL Data TX: Handle 90 [1/3] flags 0x00 dlen 11                                               #46 4.977022
      SMP: Pairing Request (0x01) len 6
        IO capability: KeyboardOnly (0x02)
        OOB data: Authentication data not present (0x00)
        Authentication requirement: No bonding, No MITM, SC, No Keypresses (0x08)
        Max encryption key size: 16
        Initiator key distribution: <none> (0x00)
        Responder key distribution: <none> (0x00)
> HCI Event: Number of Completed Packets (0x13) plen 5                                                               #47 4.980568
        Num handles: 1
        Handle: 90 Address: DF:A9:FF:F6:B1:1A (OUI DF-A9-FF)
        Count: 1
        Buffers: 0/3
        #46: len 11 (29 Kb/s)
        Latency: 3 msec (3-3 msec ~3 msec)
> ACL Data RX: Handle 90 flags 0x02 dlen 11                                                                          #48 5.030798
      SMP: Pairing Response (0x02) len 6
        IO capability: KeyboardOnly (0x02)
        OOB data: Authentication data not present (0x00)
        Authentication requirement: No bonding, MITM, SC, No Keypresses (0x0c)
        Max encryption key size: 16
        Initiator key distribution: <none> (0x00)
        Responder key distribution: <none> (0x00)
zephyr.exe[1470249]: < HCI Command: Host Number of Completed Packets (0x03|0x0035) plen 5                            #49 5.047221
        Num handles: 1
        Handle: 90 Address: DF:A9:FF:F6:B1:1A (OUI DF-A9-FF)
        Count: 1
zephyr.exe[1470249]: < ACL Data TX: Handle 90 [1/3] flags 0x00 dlen 27                                               #50 5.047285
zephyr.exe[1470249]: < ACL Data TX: Handle 90 flags 0x01 dlen 27                                                     #51 5.047288
zephyr.exe[1470249]: < ACL Data TX: Handle 90 flags 0x01 dlen 15                                                     #52 5.047289
      SMP: Pairing Public Key (0x0c) len 64
        X[32]: 98308440221e2d910f0e54b71e7ec652857aa9b5a0dc65028824cc19db1226e9
        Y[32]: 67a4816bcb62efb21701e31fdb27561a6217575fb007a8bbdabe7e28b6f68482
> HCI Event: Number of Completed Packets (0x13) plen 5                                                               #53 5.080649
        Num handles: 1
        Handle: 90 Address: DF:A9:FF:F6:B1:1A (OUI DF-A9-FF)
        Count: 1
        Buffers: 0/3
        #50: len 27 (6 Kb/s)
        Latency: 33 msec (3-33 msec ~18 msec)
> HCI Event: Number of Completed Packets (0x13) plen 5                                                               #54 5.081103
        Num handles: 1
        Handle: 90 Address: DF:A9:FF:F6:B1:1A (OUI DF-A9-FF)
        Count: 1
        Buffers: underflow/3
        #51: len 27 (6 Kb/s)
        Latency: 33 msec (3-33 msec ~26 msec)
> HCI Event: Number of Completed Packets (0x13) plen 5                                                               #55 5.081607
        Num handles: 1
        Handle: 90 Address: DF:A9:FF:F6:B1:1A (OUI DF-A9-FF)
        Count: 1
        Buffers: underflow/3
        #52: len 15 (3 Kb/s)
        Latency: 34 msec (3-34 msec ~30 msec)
> ACL Data RX: Handle 90 flags 0x02 dlen 27                                                                          #56 5.131088
> ACL Data RX: Handle 90 flags 0x01 dlen 27                                                                          #57 5.131480
> ACL Data RX: Handle 90 flags 0x01 dlen 15                                                                          #58 5.132155
      SMP: Pairing Public Key (0x0c) len 64
        X[32]: bd45b3e5f9ffba972aa2a13dc6d64794ab761782143113c1dcac7d0d0adc3e25
        Y[32]: 0f4c4a321640d7d603f5b516e098e9e21187712f3a806d661c392aa1fff8eb72
zephyr.exe[1470249]: < HCI Command: Host Number of Completed Packets (0x03|0x0035) plen 5                            #59 5.147012
        Num handles: 1
        Handle: 90 Address: DF:A9:FF:F6:B1:1A (OUI DF-A9-FF)
        Count: 1
zephyr.exe[1470249]: < HCI Command: Host Number of Completed Packets (0x03|0x0035) plen 5                            #60 5.147028
        Num handles: 1
        Handle: 90 Address: DF:A9:FF:F6:B1:1A (OUI DF-A9-FF)
        Count: 1
zephyr.exe[1470249]: < HCI Command: Host Number of Completed Packets (0x03|0x0035) plen 5                            #61 5.147130
        Num handles: 1
        Handle: 90 Address: DF:A9:FF:F6:B1:1A (OUI DF-A9-FF)
        Count: 1
zephyr.exe[1470249]: < ACL Data TX: Handle 90 [1/3] flags 0x00 dlen 21                                               #62 5.997216
      SMP: Pairing Confirm (0x03) len 16
        Confirm value[16]: 25b9b91284970ef17e022c5937c65ca9
> HCI Event: Number of Completed Packets (0x13) plen 5                                                               #63 6.030630
        Num handles: 1
        Handle: 90 Address: DF:A9:FF:F6:B1:1A (OUI DF-A9-FF)
        Count: 1
        Buffers: 0/3
        #62: len 21 (5 Kb/s)
        Latency: 33 msec (3-34 msec ~31 msec)
> ACL Data RX: Handle 90 flags 0x02 dlen 21                                                                          #64 6.081048
      SMP: Pairing Confirm (0x03) len 16
        Confirm value[16]: a97f4aa07a833e6eb5c8442075cf7fbd
zephyr.exe[1470249]: < HCI Command: Host Number of Completed Packets (0x03|0x0035) plen 5                            #65 6.087055
        Num handles: 1
        Handle: 90 Address: DF:A9:FF:F6:B1:1A (OUI DF-A9-FF)
        Count: 1
zephyr.exe[1470249]: < ACL Data TX: Handle 90 [1/3] flags 0x00 dlen 21                                               #66 6.087102
      SMP: Pairing Random (0x04) len 16
        Random value[16]: 8e6108f966a694cbe26df70bb96773e6
> HCI Event: Number of Completed Packets (0x13) plen 5                                                               #67 6.130506
        Num handles: 1
        Handle: 90 Address: DF:A9:FF:F6:B1:1A (OUI DF-A9-FF)
        Count: 1
        Buffers: 0/3
        #66: len 21 (3 Kb/s)
        Latency: 43 msec (3-43 msec ~37 msec)
> ACL Data RX: Handle 90 flags 0x02 dlen 21                                                                          #68 6.380756
      SMP: Pairing Random (0x04) len 16
        Random value[16]: 4de44d8d4aa3ff4fae2878e9a587c1fc
zephyr.exe[1470249]: < HCI Command: Host Number of Completed Packets (0x03|0x0035) plen 5                            #69 6.387171
        Num handles: 1
        Handle: 90 Address: DF:A9:FF:F6:B1:1A (OUI DF-A9-FF)
        Count: 1
zephyr.exe[1470249]: < ACL Data TX: Handle 90 [1/3] flags 0x00 dlen 21                                               #70 6.387235
      SMP: Pairing Confirm (0x03) len 16
        Confirm value[16]: 0c8aa553d80396efdd7f4bdff8164aa4
> HCI Event: Number of Completed Packets (0x13) plen 5                                                               #71 6.430498
        Num handles: 1
        Handle: 90 Address: DF:A9:FF:F6:B1:1A (OUI DF-A9-FF)
        Count: 1
        Buffers: 0/3
        #70: len 21 (3 Kb/s)
        Latency: 43 msec (3-43 msec ~40 msec)
> ACL Data RX: Handle 90 flags 0x02 dlen 21                                                                          #72 6.480646
      SMP: Pairing Confirm (0x03) len 16
        Confirm value[16]: aecf10aba7063d57a19f069f1ca04a67
zephyr.exe[1470249]: < HCI Command: Host Number of Completed Packets (0x03|0x0035) plen 5                            #73 6.487087
        Num handles: 1
        Handle: 90 Address: DF:A9:FF:F6:B1:1A (OUI DF-A9-FF)
        Count: 1
zephyr.exe[1470249]: < ACL Data TX: Handle 90 [1/3] flags 0x00 dlen 21                                               #74 6.487093
      SMP: Pairing Random (0x04) len 16
        Random value[16]: 5da095555cc64d02679f89a05211af56
> HCI Event: Number of Completed Packets (0x13) plen 5                                                               #75 6.530600
        Num handles: 1
        Handle: 90 Address: DF:A9:FF:F6:B1:1A (OUI DF-A9-FF)
        Count: 1
        Buffers: 0/3
        #74: len 21 (3 Kb/s)
        Latency: 43 msec (3-43 msec ~41 msec)
> ACL Data RX: Handle 90 flags 0x02 dlen 21                                                                          #76 6.730866
      SMP: Pairing Random (0x04) len 16
        Random value[16]: 021d84451eac70aed4ae5348bf16ed79
zephyr.exe[1470249]: < HCI Command: Host Number of Completed Packets (0x03|0x0035) plen 5                            #77 6.747134
        Num handles: 1
        Handle: 90 Address: DF:A9:FF:F6:B1:1A (OUI DF-A9-FF)
        Count: 1
zephyr.exe[1470249]: < ACL Data TX: Handle 90 [1/3] flags 0x00 dlen 21                                               #78 6.747180
      SMP: Pairing Confirm (0x03) len 16
        Confirm value[16]: fcc8c090d5fbc3cdc93db4cd636655e5
> HCI Event: Number of Completed Packets (0x13) plen 5                                                               #79 6.780589
        Num handles: 1
        Handle: 90 Address: DF:A9:FF:F6:B1:1A (OUI DF-A9-FF)
        Count: 1
        Buffers: 0/3
        #78: len 21 (5 Kb/s)
        Latency: 33 msec (3-43 msec ~37 msec)
> ACL Data RX: Handle 90 flags 0x02 dlen 21                                                                          #80 6.831257
      SMP: Pairing Confirm (0x03) len 16
        Confirm value[16]: bded05e272fe3f2d6b8273f179774d9c
zephyr.exe[1470249]: < HCI Command: Host Number of Completed Packets (0x03|0x0035) plen 5                            #81 6.847017
        Num handles: 1
        Handle: 90 Address: DF:A9:FF:F6:B1:1A (OUI DF-A9-FF)
        Count: 1
zephyr.exe[1470249]: < ACL Data TX: Handle 90 [1/3] flags 0x00 dlen 21                                               #82 6.847031
      SMP: Pairing Random (0x04) len 16
        Random value[16]: da64d21ec8845e8286bc235a02440d0c
> HCI Event: Number of Completed Packets (0x13) plen 5                                                               #83 6.880674
        Num handles: 1
        Handle: 90 Address: DF:A9:FF:F6:B1:1A (OUI DF-A9-FF)
        Count: 1
        Buffers: 0/3
        #82: len 21 (5 Kb/s)
        Latency: 33 msec (3-43 msec ~35 msec)
> ACL Data RX: Handle 90 flags 0x02 dlen 21                                                                          #84 7.130823
      SMP: Pairing Random (0x04) len 16
        Random value[16]: 7b86dce3017526e5b7bbdc0869e53433
zephyr.exe[1470249]: < HCI Command: Host Number of Completed Packets (0x03|0x0035) plen 5                            #85 7.147141
        Num handles: 1
        Handle: 90 Address: DF:A9:FF:F6:B1:1A (OUI DF-A9-FF)
        Count: 1
zephyr.exe[1470249]: < ACL Data TX: Handle 90 [1/3] flags 0x00 dlen 21                                               #86 7.147195
      SMP: Pairing Confirm (0x03) len 16
        Confirm value[16]: 17160fbc2a0e188d041c2eab17ac1dcb
> HCI Event: Number of Completed Packets (0x13) plen 5                                                               #87 7.180597
        Num handles: 1
        Handle: 90 Address: DF:A9:FF:F6:B1:1A (OUI DF-A9-FF)
        Count: 1
        Buffers: 0/3
        #86: len 21 (5 Kb/s)
        Latency: 33 msec (3-43 msec ~34 msec)
> ACL Data RX: Handle 90 flags 0x02 dlen 21                                                                          #88 7.231234
      SMP: Pairing Confirm (0x03) len 16
        Confirm value[16]: a41e777603949770bb829e5f2cf2cff1
zephyr.exe[1470249]: < HCI Command: Host Number of Completed Packets (0x03|0x0035) plen 5                            #89 7.247162
        Num handles: 1
        Handle: 90 Address: DF:A9:FF:F6:B1:1A (OUI DF-A9-FF)
        Count: 1
zephyr.exe[1470249]: < ACL Data TX: Handle 90 [1/3] flags 0x00 dlen 21                                               #90 7.247221
      SMP: Pairing Random (0x04) len 16
        Random value[16]: a2acf8fd71a45c4a1bcadd27bd58e945
> HCI Event: Number of Completed Packets (0x13) plen 5                                                               #91 7.280514
        Num handles: 1
        Handle: 90 Address: DF:A9:FF:F6:B1:1A (OUI DF-A9-FF)
        Count: 1
        Buffers: 0/3
        #90: len 21 (5 Kb/s)
        Latency: 33 msec (3-43 msec ~33 msec)
> ACL Data RX: Handle 90 flags 0x02 dlen 21                                                                          #92 7.530778
      SMP: Pairing Random (0x04) len 16
        Random value[16]: 74de695f9f70a61ef57008812fc5fab2
zephyr.exe[1470249]: < HCI Command: Host Number of Completed Packets (0x03|0x0035) plen 5                            #93 7.547210
        Num handles: 1
        Handle: 90 Address: DF:A9:FF:F6:B1:1A (OUI DF-A9-FF)
        Count: 1
zephyr.exe[1470249]: < ACL Data TX: Handle 90 [1/3] flags 0x00 dlen 21                                               #94 7.547262
      SMP: Pairing Confirm (0x03) len 16
        Confirm value[16]: a5bbb7bab553434c734b91f16d622656
> HCI Event: Number of Completed Packets (0x13) plen 5                                                               #95 7.580518
        Num handles: 1
        Handle: 90 Address: DF:A9:FF:F6:B1:1A (OUI DF-A9-FF)
        Count: 1
        Buffers: 0/3
        #94: len 21 (5 Kb/s)
        Latency: 33 msec (3-43 msec ~33 msec)
> ACL Data RX: Handle 90 flags 0x02 dlen 21                                                                          #96 7.631050
      SMP: Pairing Confirm (0x03) len 16
        Confirm value[16]: 89ea0efdedf03304e272887bc124840e
zephyr.exe[1470249]: < HCI Command: Host Number of Completed Packets (0x03|0x0035) plen 5                            #97 7.647047
        Num handles: 1
        Handle: 90 Address: DF:A9:FF:F6:B1:1A (OUI DF-A9-FF)
        Count: 1
zephyr.exe[1470249]: < ACL Data TX: Handle 90 [1/3] flags 0x00 dlen 21                                               #98 7.647060
      SMP: Pairing Random (0x04) len 16
        Random value[16]: 00bad7aca1ba32527e6e64e79f33b2e3
> HCI Event: Number of Completed Packets (0x13) plen 5                                                               #99 7.680645
        Num handles: 1
        Handle: 90 Address: DF:A9:FF:F6:B1:1A (OUI DF-A9-FF)
        Count: 1
        Buffers: 0/3
        #98: len 21 (5 Kb/s)
        Latency: 33 msec (3-43 msec ~33 msec)
> ACL Data RX: Handle 90 flags 0x02 dlen 21                                                                         #100 7.931366
      SMP: Pairing Random (0x04) len 16
        Random value[16]: ea2880f2e54db6c3692c0b4de0c7e5c0
zephyr.exe[1470249]: < HCI Command: Host Number of Completed Packets (0x03|0x0035) plen 5                           #101 7.947157
        Num handles: 1
        Handle: 90 Address: DF:A9:FF:F6:B1:1A (OUI DF-A9-FF)
        Count: 1
zephyr.exe[1470249]: < ACL Data TX: Handle 90 [1/3] flags 0x00 dlen 21                                              #102 7.947210
      SMP: Pairing Confirm (0x03) len 16
        Confirm value[16]: 9671d82c50926a74c3aab19b506bd566
> HCI Event: Number of Completed Packets (0x13) plen 5                                                              #103 7.980533
        Num handles: 1
        Handle: 90 Address: DF:A9:FF:F6:B1:1A (OUI DF-A9-FF)
        Count: 1
        Buffers: 0/3
        #102: len 21 (5 Kb/s)
        Latency: 33 msec (3-43 msec ~33 msec)
> ACL Data RX: Handle 90 flags 0x02 dlen 21                                                                         #104 8.030740
      SMP: Pairing Confirm (0x03) len 16
        Confirm value[16]: e869d73322c6460c779e1fe8d13beeaf
zephyr.exe[1470249]: < HCI Command: Host Number of Completed Packets (0x03|0x0035) plen 5                           #105 8.047068
        Num handles: 1
        Handle: 90 Address: DF:A9:FF:F6:B1:1A (OUI DF-A9-FF)
        Count: 1
zephyr.exe[1470249]: < ACL Data TX: Handle 90 [1/3] flags 0x00 dlen 21                                              #106 8.047090
      SMP: Pairing Random (0x04) len 16
        Random value[16]: 4db8ab2d95badddbdfe2838e9a8cc696
> HCI Event: Number of Completed Packets (0x13) plen 5                                                              #107 8.080490
        Num handles: 1
        Handle: 90 Address: DF:A9:FF:F6:B1:1A (OUI DF-A9-FF)
        Count: 1
        Buffers: 0/3
        #106: len 21 (5 Kb/s)
        Latency: 33 msec (3-43 msec ~33 msec)
> ACL Data RX: Handle 90 flags 0x02 dlen 21                                                                         #108 8.330831
      SMP: Pairing Random (0x04) len 16
        Random value[16]: 1ca3b71500fe597b31925c45873cda65
zephyr.exe[1470249]: < HCI Command: Host Number of Completed Packets (0x03|0x0035) plen 5                           #109 8.347143
        Num handles: 1
        Handle: 90 Address: DF:A9:FF:F6:B1:1A (OUI DF-A9-FF)
        Count: 1
zephyr.exe[1470249]: < ACL Data TX: Handle 90 [1/3] flags 0x00 dlen 21                                              #110 8.347195
      SMP: Pairing Confirm (0x03) len 16
        Confirm value[16]: b1127ea2d740a539c7426f9a0825b20e
> HCI Event: Number of Completed Packets (0x13) plen 5                                                              #111 8.380750
        Num handles: 1
        Handle: 90 Address: DF:A9:FF:F6:B1:1A (OUI DF-A9-FF)
        Count: 1
        Buffers: 0/3
        #110: len 21 (5 Kb/s)
        Latency: 33 msec (3-43 msec ~33 msec)
> ACL Data RX: Handle 90 flags 0x02 dlen 21                                                                         #112 8.431778
      SMP: Pairing Confirm (0x03) len 16
        Confirm value[16]: 28847ac725816effadc28a5bf7a70752
zephyr.exe[1470249]: < HCI Command: Host Number of Completed Packets (0x03|0x0035) plen 5                           #113 8.447143
        Num handles: 1
        Handle: 90 Address: DF:A9:FF:F6:B1:1A (OUI DF-A9-FF)
        Count: 1
zephyr.exe[1470249]: < ACL Data TX: Handle 90 [1/3] flags 0x00 dlen 21                                              #114 8.447151
      SMP: Pairing Random (0x04) len 16
        Random value[16]: c850fef72c5ceb9f1915536596b6fc3d
> HCI Event: Number of Completed Packets (0x13) plen 5                                                              #115 8.480447
        Num handles: 1
        Handle: 90 Address: DF:A9:FF:F6:B1:1A (OUI DF-A9-FF)
        Count: 1
        Buffers: 0/3
        #114: len 21 (5 Kb/s)
        Latency: 33 msec (3-43 msec ~33 msec)
> ACL Data RX: Handle 90 flags 0x02 dlen 21                                                                         #116 8.731162
      SMP: Pairing Random (0x04) len 16
        Random value[16]: 84d0e2815eb4d630ab83ae8272b5fdeb
zephyr.exe[1470249]: < HCI Command: Host Number of Completed Packets (0x03|0x0035) plen 5                           #117 8.747303
        Num handles: 1
        Handle: 90 Address: DF:A9:FF:F6:B1:1A (OUI DF-A9-FF)
        Count: 1
zephyr.exe[1470249]: < ACL Data TX: Handle 90 [1/3] flags 0x00 dlen 21                                              #118 8.747337
      SMP: Pairing Confirm (0x03) len 16
        Confirm value[16]: 8fb2e2710d8ec2a32be67028ac85ea41
> HCI Event: Number of Completed Packets (0x13) plen 5                                                              #119 8.780416
        Num handles: 1
        Handle: 90 Address: DF:A9:FF:F6:B1:1A (OUI DF-A9-FF)
        Count: 1
        Buffers: 0/3
        #118: len 21 (5 Kb/s)
        Latency: 33 msec (3-43 msec ~33 msec)
> ACL Data RX: Handle 90 flags 0x02 dlen 21                                                                         #120 8.830941
      SMP: Pairing Confirm (0x03) len 16
        Confirm value[16]: 6152d17f823b55a61895aa6633a8ebbf
zephyr.exe[1470249]: < HCI Command: Host Number of Completed Packets (0x03|0x0035) plen 5                           #121 8.847188
        Num handles: 1
        Handle: 90 Address: DF:A9:FF:F6:B1:1A (OUI DF-A9-FF)
        Count: 1
zephyr.exe[1470249]: < ACL Data TX: Handle 90 [1/3] flags 0x00 dlen 21                                              #122 8.847197
      SMP: Pairing Random (0x04) len 16
        Random value[16]: 6b2b19701bcf5c794dc9ad9f2c3f295e
> HCI Event: Number of Completed Packets (0x13) plen 5                                                              #123 8.880461
        Num handles: 1
        Handle: 90 Address: DF:A9:FF:F6:B1:1A (OUI DF-A9-FF)
        Count: 1
        Buffers: 0/3
        #122: len 21 (5 Kb/s)
        Latency: 33 msec (3-43 msec ~33 msec)
> ACL Data RX: Handle 90 flags 0x02 dlen 21                                                                         #124 9.130655
      SMP: Pairing Random (0x04) len 16
        Random value[16]: e2721630abdfb00b721ef75c2d03b4da
zephyr.exe[1470249]: < HCI Command: Host Number of Completed Packets (0x03|0x0035) plen 5                           #125 9.147196
        Num handles: 1
        Handle: 90 Address: DF:A9:FF:F6:B1:1A (OUI DF-A9-FF)
        Count: 1
zephyr.exe[1470249]: < ACL Data TX: Handle 90 [1/3] flags 0x00 dlen 21                                              #126 9.147219
      SMP: Pairing Confirm (0x03) len 16
        Confirm value[16]: 3431b9ac1999140df431d71ca6f1d073
> HCI Event: Number of Completed Packets (0x13) plen 5                                                              #127 9.180614
        Num handles: 1
        Handle: 90 Address: DF:A9:FF:F6:B1:1A (OUI DF-A9-FF)
        Count: 1
        Buffers: 0/3
        #126: len 21 (5 Kb/s)
        Latency: 33 msec (3-43 msec ~33 msec)
> ACL Data RX: Handle 90 flags 0x02 dlen 21                                                                         #128 9.231202
      SMP: Pairing Confirm (0x03) len 16
        Confirm value[16]: 73a03c3456e30a35f5689c04a9aca3ac
zephyr.exe[1470249]: < HCI Command: Host Number of Completed Packets (0x03|0x0035) plen 5                           #129 9.247197
        Num handles: 1
        Handle: 90 Address: DF:A9:FF:F6:B1:1A (OUI DF-A9-FF)
        Count: 1
zephyr.exe[1470249]: < ACL Data TX: Handle 90 [1/3] flags 0x00 dlen 21                                              #130 9.247222
      SMP: Pairing Random (0x04) len 16
        Random value[16]: d5e1c3cfeb215c2fff312cdf99c94919
> HCI Event: Number of Completed Packets (0x13) plen 5                                                              #131 9.280602
        Num handles: 1
        Handle: 90 Address: DF:A9:FF:F6:B1:1A (OUI DF-A9-FF)
        Count: 1
        Buffers: 0/3
        #130: len 21 (5 Kb/s)
        Latency: 33 msec (3-43 msec ~33 msec)
> ACL Data RX: Handle 90 flags 0x02 dlen 21                                                                         #132 9.480647
      SMP: Pairing Random (0x04) len 16
        Random value[16]: 3089a95ad431ae7664c66c6d8737a4fc
zephyr.exe[1470249]: < HCI Command: Host Number of Completed Packets (0x03|0x0035) plen 5                           #133 9.487309
        Num handles: 1
        Handle: 90 Address: DF:A9:FF:F6:B1:1A (OUI DF-A9-FF)
        Count: 1
zephyr.exe[1470249]: < ACL Data TX: Handle 90 [1/3] flags 0x00 dlen 21                                              #134 9.487369
      SMP: Pairing Confirm (0x03) len 16
        Confirm value[16]: 85c1e41afe285bf465e7ada7d6a7f3f2
> HCI Event: Number of Completed Packets (0x13) plen 5                                                              #135 9.530452
        Num handles: 1
        Handle: 90 Address: DF:A9:FF:F6:B1:1A (OUI DF-A9-FF)
        Count: 1
        Buffers: 0/3
        #134: len 21 (3 Kb/s)
        Latency: 43 msec (3-43 msec ~38 msec)
> ACL Data RX: Handle 90 flags 0x02 dlen 21                                                                         #136 9.580669
      SMP: Pairing Confirm (0x03) len 16
        Confirm value[16]: 097513a92d6e5d7605c64c89dc5bbb69
zephyr.exe[1470249]: < HCI Command: Host Number of Completed Packets (0x03|0x0035) plen 5                           #137 9.587224
        Num handles: 1
        Handle: 90 Address: DF:A9:FF:F6:B1:1A (OUI DF-A9-FF)
        Count: 1
zephyr.exe[1470249]: < ACL Data TX: Handle 90 [1/3] flags 0x00 dlen 21                                              #138 9.587289
      SMP: Pairing Random (0x04) len 16
        Random value[16]: 77355a9a8321c629a3a987d808e80865
> HCI Event: Number of Completed Packets (0x13) plen 5                                                              #139 9.630320
        Num handles: 1
        Handle: 90 Address: DF:A9:FF:F6:B1:1A (OUI DF-A9-FF)
        Count: 1
        Buffers: 0/3
        #138: len 21 (3 Kb/s)
        Latency: 43 msec (3-43 msec ~40 msec)
> ACL Data RX: Handle 90 flags 0x02 dlen 21                                                                         #140 9.880714
      SMP: Pairing Random (0x04) len 16
        Random value[16]: ae553078069ad4189f1b828e8ba3b159
zephyr.exe[1470249]: < HCI Command: Host Number of Completed Packets (0x03|0x0035) plen 5                           #141 9.887205
        Num handles: 1
        Handle: 90 Address: DF:A9:FF:F6:B1:1A (OUI DF-A9-FF)
        Count: 1
zephyr.exe[1470249]: < ACL Data TX: Handle 90 [1/3] flags 0x00 dlen 21                                              #142 9.887283
      SMP: Pairing Confirm (0x03) len 16
        Confirm value[16]: dca9f223302e19134d6e291468569e30
> HCI Event: Number of Completed Packets (0x13) plen 5                                                              #143 9.930523
        Num handles: 1
        Handle: 90 Address: DF:A9:FF:F6:B1:1A (OUI DF-A9-FF)
        Count: 1
        Buffers: 0/3
        #142: len 21 (3 Kb/s)
        Latency: 43 msec (3-43 msec ~41 msec)
> ACL Data RX: Handle 90 flags 0x02 dlen 21                                                                         #144 9.980885
      SMP: Pairing Confirm (0x03) len 16
        Confirm value[16]: 0e1e846aa9537de0c95b2614edf06700
zephyr.exe[1470249]: < HCI Command: Host Number of Completed Packets (0x03|0x0035) plen 5                           #145 9.987261
        Num handles: 1
        Handle: 90 Address: DF:A9:FF:F6:B1:1A (OUI DF-A9-FF)
        Count: 1
zephyr.exe[1470249]: < ACL Data TX: Handle 90 [1/3] flags 0x00 dlen 21                                              #146 9.987283
      SMP: Pairing Random (0x04) len 16
        Random value[16]: 8dfc1155a0b492f20f6ad8f13724432c
> HCI Event: Number of Completed Packets (0x13) plen 5                                                             #147 10.030374
        Num handles: 1
        Handle: 90 Address: DF:A9:FF:F6:B1:1A (OUI DF-A9-FF)
        Count: 1
        Buffers: 0/3
        #146: len 21 (3 Kb/s)
        Latency: 43 msec (3-43 msec ~42 msec)
> ACL Data RX: Handle 90 flags 0x02 dlen 21                                                                        #148 10.230964
      SMP: Pairing Random (0x04) len 16
        Random value[16]: d6587e43af4c67db7effeed887d6013a
zephyr.exe[1470249]: < HCI Command: Host Number of Completed Packets (0x03|0x0035) plen 5                          #149 10.247325
        Num handles: 1
        Handle: 90 Address: DF:A9:FF:F6:B1:1A (OUI DF-A9-FF)
        Count: 1
zephyr.exe[1470249]: < ACL Data TX: Handle 90 [1/3] flags 0x00 dlen 21                                             #150 10.247353
      SMP: Pairing Confirm (0x03) len 16
        Confirm value[16]: 2d7a3285dddaf153220233331eb53630
> HCI Event: Number of Completed Packets (0x13) plen 5                                                             #151 10.280352
        Num handles: 1
        Handle: 90 Address: DF:A9:FF:F6:B1:1A (OUI DF-A9-FF)
        Count: 1
        Buffers: 0/3
        #150: len 21 (5 Kb/s)
        Latency: 32 msec (3-43 msec ~37 msec)
> ACL Data RX: Handle 90 flags 0x02 dlen 21                                                                        #152 10.330835
      SMP: Pairing Confirm (0x03) len 16
        Confirm value[16]: c9f12b93f2b4680368252749db157e68
zephyr.exe[1470249]: < HCI Command: Host Number of Completed Packets (0x03|0x0035) plen 5                          #153 10.347118
        Num handles: 1
        Handle: 90 Address: DF:A9:FF:F6:B1:1A (OUI DF-A9-FF)
        Count: 1
zephyr.exe[1470249]: < ACL Data TX: Handle 90 [1/3] flags 0x00 dlen 21                                             #154 10.347188
      SMP: Pairing Random (0x04) len 16
        Random value[16]: 001c45ff744123ac32ebbb5e14c8a6b9
> HCI Event: Number of Completed Packets (0x13) plen 5                                                             #155 10.380481
        Num handles: 1
        Handle: 90 Address: DF:A9:FF:F6:B1:1A (OUI DF-A9-FF)
        Count: 1
        Buffers: 0/3
        #154: len 21 (5 Kb/s)
        Latency: 33 msec (3-43 msec ~35 msec)
> ACL Data RX: Handle 90 flags 0x02 dlen 21                                                                        #156 10.630753
      SMP: Pairing Random (0x04) len 16
        Random value[16]: 6853aab47bb7ede8a092a5a307a3f929
zephyr.exe[1470249]: < HCI Command: Host Number of Completed Packets (0x03|0x0035) plen 5                          #157 10.647297
        Num handles: 1
        Handle: 90 Address: DF:A9:FF:F6:B1:1A (OUI DF-A9-FF)
        Count: 1
zephyr.exe[1470249]: < ACL Data TX: Handle 90 [1/3] flags 0x00 dlen 21                                             #158 10.647366
      SMP: Pairing Confirm (0x03) len 16
        Confirm value[16]: 85fbced2f95bfe4bf8127079a7bc34bc
> HCI Event: Number of Completed Packets (0x13) plen 5                                                             #159 10.680366
        Num handles: 1
        Handle: 90 Address: DF:A9:FF:F6:B1:1A (OUI DF-A9-FF)
        Count: 1
        Buffers: 0/3
        #158: len 21 (5 Kb/s)
        Latency: 33 msec (3-43 msec ~34 msec)
> ACL Data RX: Handle 90 flags 0x02 dlen 21                                                                        #160 10.730726
      SMP: Pairing Confirm (0x03) len 16
        Confirm value[16]: 7bbf82645411cb56bcca4ea24a83e2c5
zephyr.exe[1470249]: < HCI Command: Host Number of Completed Packets (0x03|0x0035) plen 5                          #161 10.747261
        Num handles: 1
        Handle: 90 Address: DF:A9:FF:F6:B1:1A (OUI DF-A9-FF)
        Count: 1
zephyr.exe[1470249]: < ACL Data TX: Handle 90 [1/3] flags 0x00 dlen 21                                             #162 10.747267
      SMP: Pairing Random (0x04) len 16
        Random value[16]: 296d277ff3bf297efe85e67448a15f56
> HCI Event: Number of Completed Packets (0x13) plen 5                                                             #163 10.780450
        Num handles: 1
        Handle: 90 Address: DF:A9:FF:F6:B1:1A (OUI DF-A9-FF)
        Count: 1
        Buffers: 0/3
        #162: len 21 (5 Kb/s)
        Latency: 33 msec (3-43 msec ~33 msec)
> ACL Data RX: Handle 90 flags 0x02 dlen 21                                                                        #164 11.030594
      SMP: Pairing Random (0x04) len 16
        Random value[16]: 5f470905578d29a8e035dc89da193dee
zephyr.exe[1470249]: < HCI Command: Host Number of Completed Packets (0x03|0x0035) plen 5                          #165 11.047365
        Num handles: 1
        Handle: 90 Address: DF:A9:FF:F6:B1:1A (OUI DF-A9-FF)
        Count: 1
zephyr.exe[1470249]: < ACL Data TX: Handle 90 [1/3] flags 0x00 dlen 21                                             #166 11.047421
      SMP: Pairing Confirm (0x03) len 16
        Confirm value[16]: 02758cf391779672090416161a3c93d4
> HCI Event: Number of Completed Packets (0x13) plen 5                                                             #167 11.080398
        Num handles: 1
        Handle: 90 Address: DF:A9:FF:F6:B1:1A (OUI DF-A9-FF)
        Count: 1
        Buffers: 0/3
        #166: len 21 (5 Kb/s)
        Latency: 32 msec (3-43 msec ~33 msec)
> ACL Data RX: Handle 90 flags 0x02 dlen 21                                                                        #168 11.130607
      SMP: Pairing Confirm (0x03) len 16
        Confirm value[16]: 4f9be03ffcff00bbecd33d8143339fa9
zephyr.exe[1470249]: < HCI Command: Host Number of Completed Packets (0x03|0x0035) plen 5                          #169 11.147257
        Num handles: 1
        Handle: 90 Address: DF:A9:FF:F6:B1:1A (OUI DF-A9-FF)
        Count: 1
zephyr.exe[1470249]: < ACL Data TX: Handle 90 [1/3] flags 0x00 dlen 21                                             #170 11.147316
      SMP: Pairing Random (0x04) len 16
        Random value[16]: e3a3cf1d832325a9493fd3ce4faf02be
> HCI Event: Number of Completed Packets (0x13) plen 5                                                             #171 11.180307
        Num handles: 1
        Handle: 90 Address: DF:A9:FF:F6:B1:1A (OUI DF-A9-FF)
        Count: 1
        Buffers: 0/3
        #170: len 21 (5 Kb/s)
        Latency: 32 msec (3-43 msec ~33 msec)
> ACL Data RX: Handle 90 flags 0x02 dlen 21                                                                        #172 11.430656
      SMP: Pairing Random (0x04) len 16
        Random value[16]: f8742fae71bf22c35d8a07620b8bb393
zephyr.exe[1470249]: < HCI Command: Host Number of Completed Packets (0x03|0x0035) plen 5                          #173 11.447314
        Num handles: 1
        Handle: 90 Address: DF:A9:FF:F6:B1:1A (OUI DF-A9-FF)
        Count: 1
zephyr.exe[1470249]: < ACL Data TX: Handle 90 [1/3] flags 0x00 dlen 21                                             #174 11.447368
      SMP: Pairing Confirm (0x03) len 16
        Confirm value[16]: 007106e854978a4f902c748c01626589
> HCI Event: Number of Completed Packets (0x13) plen 5                                                             #175 11.480338
        Num handles: 1
        Handle: 90 Address: DF:A9:FF:F6:B1:1A (OUI DF-A9-FF)
        Count: 1
        Buffers: 0/3
        #174: len 21 (5 Kb/s)
        Latency: 32 msec (3-43 msec ~33 msec)
> ACL Data RX: Handle 90 flags 0x02 dlen 21                                                                        #176 11.531074
      SMP: Pairing Confirm (0x03) len 16
        Confirm value[16]: 91b8983c1bf53f783c0dfd1e1da99a98
zephyr.exe[1470249]: < HCI Command: Host Number of Completed Packets (0x03|0x0035) plen 5                          #177 11.547258
        Num handles: 1
        Handle: 90 Address: DF:A9:FF:F6:B1:1A (OUI DF-A9-FF)
        Count: 1
zephyr.exe[1470249]: < ACL Data TX: Handle 90 [1/3] flags 0x00 dlen 21                                             #178 11.547319
      SMP: Pairing Random (0x04) len 16
        Random value[16]: 595bb7c6e45c58f6b41f855a6f6c3560
> HCI Event: Number of Completed Packets (0x13) plen 5                                                             #179 11.580308
        Num handles: 1
        Handle: 90 Address: DF:A9:FF:F6:B1:1A (OUI DF-A9-FF)
        Count: 1
        Buffers: 0/3
        #178: len 21 (5 Kb/s)
        Latency: 32 msec (3-43 msec ~33 msec)
> ACL Data RX: Handle 90 flags 0x02 dlen 21                                                                        #180 11.830571
      SMP: Pairing Random (0x04) len 16
        Random value[16]: b15df168357d1b247271dd48e8897f60
zephyr.exe[1470249]: < HCI Command: Host Number of Completed Packets (0x03|0x0035) plen 5                          #181 11.847261
        Num handles: 1
        Handle: 90 Address: DF:A9:FF:F6:B1:1A (OUI DF-A9-FF)
        Count: 1
zephyr.exe[1470249]: < ACL Data TX: Handle 90 [1/3] flags 0x00 dlen 21                                             #182 11.847351
      SMP: Pairing Confirm (0x03) len 16
        Confirm value[16]: 2c5530f426f0b1db4f59c6620b850e7f
> HCI Event: Number of Completed Packets (0x13) plen 5                                                             #183 11.880393
        Num handles: 1
        Handle: 90 Address: DF:A9:FF:F6:B1:1A (OUI DF-A9-FF)
        Count: 1
        Buffers: 0/3
        #182: len 21 (5 Kb/s)
        Latency: 33 msec (3-43 msec ~33 msec)
> ACL Data RX: Handle 90 flags 0x02 dlen 21                                                                        #184 11.930433
      SMP: Pairing Confirm (0x03) len 16
        Confirm value[16]: 899844add6ab899a3ea26c745aeced31
zephyr.exe[1470249]: < HCI Command: Host Number of Completed Packets (0x03|0x0035) plen 5                          #185 11.947354
        Num handles: 1
        Handle: 90 Address: DF:A9:FF:F6:B1:1A (OUI DF-A9-FF)
        Count: 1
zephyr.exe[1470249]: < ACL Data TX: Handle 90 [1/3] flags 0x00 dlen 21                                             #186 11.947438
      SMP: Pairing Random (0x04) len 16
        Random value[16]: 84e2affc6847b67e7216d5bf664139ed
> HCI Event: Number of Completed Packets (0x13) plen 5                                                             #187 11.980401
        Num handles: 1
        Handle: 90 Address: DF:A9:FF:F6:B1:1A (OUI DF-A9-FF)
        Count: 1
        Buffers: 0/3
        #186: len 21 (5 Kb/s)
        Latency: 32 msec (3-43 msec ~32 msec)
> ACL Data RX: Handle 90 flags 0x02 dlen 21                                                                        #188 12.231128
      SMP: Pairing Random (0x04) len 16
        Random value[16]: 46c1652c50399bf3bd0b5194fee408df
zephyr.exe[1470249]: < HCI Command: Host Number of Completed Packets (0x03|0x0035) plen 5                          #189 12.247261
        Num handles: 1
        Handle: 90 Address: DF:A9:FF:F6:B1:1A (OUI DF-A9-FF)
        Count: 1
zephyr.exe[1470249]: < ACL Data TX: Handle 90 [1/3] flags 0x00 dlen 21                                             #190 12.247287
      SMP: Pairing Confirm (0x03) len 16
        Confirm value[16]: 76b2c20ab33941b516510a730f754d47
> HCI Event: Number of Completed Packets (0x13) plen 5                                                             #191 12.280543
        Num handles: 1
        Handle: 90 Address: DF:A9:FF:F6:B1:1A (OUI DF-A9-FF)
        Count: 1
        Buffers: 0/3
        #190: len 21 (5 Kb/s)
        Latency: 33 msec (3-43 msec ~33 msec)
> ACL Data RX: Handle 90 flags 0x02 dlen 21                                                                        #192 12.330620
      SMP: Pairing Confirm (0x03) len 16
        Confirm value[16]: 9f3ff4dad0c3ad680e75fcd34013d1db
zephyr.exe[1470249]: < HCI Command: Host Number of Completed Packets (0x03|0x0035) plen 5                          #193 12.347268
        Num handles: 1
        Handle: 90 Address: DF:A9:FF:F6:B1:1A (OUI DF-A9-FF)
        Count: 1
zephyr.exe[1470249]: < ACL Data TX: Handle 90 [1/3] flags 0x00 dlen 21                                             #194 12.347300
      SMP: Pairing Random (0x04) len 16
        Random value[16]: 425496665d7eed17f76500c95219dd01
> HCI Event: Number of Completed Packets (0x13) plen 5                                                             #195 12.380182
        Num handles: 1
        Handle: 90 Address: DF:A9:FF:F6:B1:1A (OUI DF-A9-FF)
        Count: 1
        Buffers: 0/3
        #194: len 21 (5 Kb/s)
        Latency: 32 msec (3-43 msec ~33 msec)
> ACL Data RX: Handle 90 flags 0x02 dlen 21                                                                        #196 12.630697
      SMP: Pairing Random (0x04) len 16
        Random value[16]: b5a2df33afa366991cba99df19acf0d8
zephyr.exe[1470249]: < HCI Command: Host Number of Completed Packets (0x03|0x0035) plen 5                          #197 12.647373
        Num handles: 1
        Handle: 90 Address: DF:A9:FF:F6:B1:1A (OUI DF-A9-FF)
        Count: 1
zephyr.exe[1470249]: < ACL Data TX: Handle 90 [1/3] flags 0x00 dlen 21                                             #198 12.647425
      SMP: Pairing Confirm (0x03) len 16
        Confirm value[16]: dfbfbdf7736d6ae2f85620a894601d6d
> HCI Event: Number of Completed Packets (0x13) plen 5                                                             #199 12.680304
        Num handles: 1
        Handle: 90 Address: DF:A9:FF:F6:B1:1A (OUI DF-A9-FF)
        Count: 1
        Buffers: 0/3
        #198: len 21 (5 Kb/s)
        Latency: 32 msec (3-43 msec ~32 msec)
> ACL Data RX: Handle 90 flags 0x02 dlen 21                                                                        #200 12.730829
      SMP: Pairing Confirm (0x03) len 16
        Confirm value[16]: 45a2d87af8da39748e0f41dcdb98343e
zephyr.exe[1470249]: < HCI Command: Host Number of Completed Packets (0x03|0x0035) plen 5                          #201 12.747317
        Num handles: 1
        Handle: 90 Address: DF:A9:FF:F6:B1:1A (OUI DF-A9-FF)
        Count: 1
zephyr.exe[1470249]: < ACL Data TX: Handle 90 [1/3] flags 0x00 dlen 21                                             #202 12.747345
      SMP: Pairing Random (0x04) len 16
        Random value[16]: 1e63f87b860481d35d47e1f6006d79c9
> HCI Event: Number of Completed Packets (0x13) plen 5                                                             #203 12.780319
        Num handles: 1
        Handle: 90 Address: DF:A9:FF:F6:B1:1A (OUI DF-A9-FF)
        Count: 1
        Buffers: 0/3
        #202: len 21 (5 Kb/s)
        Latency: 32 msec (3-43 msec ~32 msec)
> ACL Data RX: Handle 90 flags 0x02 dlen 21                                                                        #204 13.030931
      SMP: Pairing Random (0x04) len 16
        Random value[16]: 3a41f4f77fad81bfab1e2a0148341f55
zephyr.exe[1470249]: < HCI Command: Host Number of Completed Packets (0x03|0x0035) plen 5                          #205 13.047189
        Num handles: 1
        Handle: 90 Address: DF:A9:FF:F6:B1:1A (OUI DF-A9-FF)
        Count: 1
zephyr.exe[1470249]: < ACL Data TX: Handle 90 [1/3] flags 0x00 dlen 21                                             #206 13.047235
      SMP: Pairing Confirm (0x03) len 16
        Confirm value[16]: b2e4c97ce20f1d1cc8e1780753b92946
> HCI Event: Number of Completed Packets (0x13) plen 5                                                             #207 13.080257
        Num handles: 1
        Handle: 90 Address: DF:A9:FF:F6:B1:1A (OUI DF-A9-FF)
        Count: 1
        Buffers: 0/3
        #206: len 21 (5 Kb/s)
        Latency: 33 msec (3-43 msec ~32 msec)
> ACL Data RX: Handle 90 flags 0x02 dlen 21                                                                        #208 13.130514
      SMP: Pairing Confirm (0x03) len 16
        Confirm value[16]: 86db0dbb48dbe878c3c4ff74c9ab16f7
zephyr.exe[1470249]: < HCI Command: Host Number of Completed Packets (0x03|0x0035) plen 5                          #209 13.147338
        Num handles: 1
        Handle: 90 Address: DF:A9:FF:F6:B1:1A (OUI DF-A9