Bluetooth monitor ver 5.72
= Note: Linux version 6.14.0-36-generic (x86_64)                       0.737647
= Note: Bluetooth subsystem version 2.22                               0.737649
= New Index: 00:00:00:00:00:00 (Primary,UART,hci1)              [hci1] 0.737650
= New Index: 48:5F:99:8E:E0:64 (Primary,USB,hci0)               [hci0] 0.737650
= Open Index: 00:00:00:00:00:00                                 [hci1] 0.851486
= Index Info: 00:00:00:00:00:00 (Nordic Semiconductor ASA)      [hci1] 0.851504
@ USER Open: main (privileged) version 2.22            {0x0001} [hci1] 0.851514
< HCI Command: Reset (0x03|0x0003) plen 0                    #1 [hci1] 0.852886
> HCI Event: Command Complete (0x0e) plen 4                  #2 [hci1] 0.853432
      Reset (0x03|0x0003) ncmd 1
        Status: Success (0x00)
< HCI Command: Read Local Supported... (0x04|0x0003) plen 0  #3 [hci1] 0.871275
> HCI Event: Command Complete (0x0e) plen 12                 #4 [hci1] 0.871756
      Read Local Supported Features (0x04|0x0003) ncmd 1
        Status: Success (0x00)
        Features: 0x00 0x00 0x00 0x00 0x60 0x00 0x00 0x00
          BR/EDR Not Supported
          LE Supported (Controller)
< HCI Command: Read Local Version In.. (0x04|0x0001) plen 0  #5 [hci1] 0.890944
> HCI Event: Command Complete (0x0e) plen 12                 #6 [hci1] 0.891439
      Read Local Version Information (0x04|0x0001) ncmd 1
        Status: Success (0x00)
        HCI version: Reserved (0x0f) - Revision 12393 (0x3069)
        LMP version: Reserved (0x0f) - Subversion 12393 (0x3069)
        Manufacturer: Nordic Semiconductor ASA (89)
< HCI Command: Read Local Supported... (0x04|0x0002) plen 0  #7 [hci1] 0.910811
> HCI Event: Command Complete (0x0e) plen 68                 #8 [hci1] 0.911877
      Read Local Supported Commands (0x04|0x0002) ncmd 1
        Status: Success (0x00)
        Commands: 119 entries
          Disconnect (Octet 0 - Bit 5)
          Read Remote Version Information (Octet 2 - Bit 7)
          Set Event Mask (Octet 5 - Bit 6)
          Reset (Octet 5 - Bit 7)
          Read Connection Accept Timeout (Octet 7 - Bit 2)
          Write Connection Accept Timeout (Octet 7 - Bit 3)
          Read Transmit Power Level (Octet 10 - Bit 2)
          Set Controller To Host Flow Control (Octet 10 - Bit 5)
          Host Buffer Size (Octet 10 - Bit 6)
          Host Number of Completed Packets (Octet 10 - Bit 7)
          Read Local Version Information (Octet 14 - Bit 3)
          Read Local Supported Features (Octet 14 - Bit 5)
          Read BD ADDR (Octet 15 - Bit 1)
          Read RSSI (Octet 15 - Bit 5)
          Set Event Mask Page 2 (Octet 22 - Bit 2)
          LE Set Event Mask (Octet 25 - Bit 0)
          LE Read Buffer Size (Octet 25 - Bit 1)
          LE Read Local Supported Features (Octet 25 - Bit 2)
          LE Set Random Address (Octet 25 - Bit 4)
          LE Set Advertising Parameters (Octet 25 - Bit 5)
          LE Read Advertising Channel TX Power (Octet 25 - Bit 6)
          LE Set Advertising Data (Octet 25 - Bit 7)
          LE Set Scan Response Data (Octet 26 - Bit 0)
          LE Set Advertise Enable (Octet 26 - Bit 1)
          LE Set Scan Parameters (Octet 26 - Bit 2)
          LE Set Scan Enable (Octet 26 - Bit 3)
          LE Create Connection (Octet 26 - Bit 4)
          LE Create Connection Cancel (Octet 26 - Bit 5)
          LE Read Accept List Size (Octet 26 - Bit 6)
          LE Clear Accept List (Octet 26 - Bit 7)
          LE Add Device To Accept List (Octet 27 - Bit 0)
          LE Remove Device From Accept List (Octet 27 - Bit 1)
          LE Connection Update (Octet 27 - Bit 2)
          LE Set Host Channel Classification (Octet 27 - Bit 3)
          LE Read Channel Map (Octet 27 - Bit 4)
          LE Read Remote Used Features (Octet 27 - Bit 5)
          LE Encrypt (Octet 27 - Bit 6)
          LE Rand (Octet 27 - Bit 7)
          LE Start Encryption (Octet 28 - Bit 0)
          LE Long Term Key Request Reply (Octet 28 - Bit 1)
          LE Long Term Key Request Neg Reply (Octet 28 - Bit 2)
          LE Read Supported States (Octet 28 - Bit 3)
          LE Receiver Test (Octet 28 - Bit 4)
          LE Transmitter Test (Octet 28 - Bit 5)
          LE Test End (Octet 28 - Bit 6)
          Read Authenticated Payload Timeout (Octet 32 - Bit 4)
          Write Authenticated Payload Timeout (Octet 32 - Bit 5)
          LE Set Data Length (Octet 33 - Bit 6)
          LE Read Suggested Default Data Length (Octet 33 - Bit 7)
          LE Write Suggested Default Data Length (Octet 34 - Bit 0)
          LE Add Device To Resolving List (Octet 34 - Bit 3)
          LE Remove Device From Resolving List (Octet 34 - Bit 4)
          LE Clear Resolving List (Octet 34 - Bit 5)
          LE Read Resolving List Size (Octet 34 - Bit 6)
          LE Set Address Resolution Enable (Octet 35 - Bit 1)
          LE Set Resolvable Private Address Timeout (Octet 35 - Bit 2)
          LE Read Maximum Data Length (Octet 35 - Bit 3)
          LE Read PHY (Octet 35 - Bit 4)
          LE Set Default PHY (Octet 35 - Bit 5)
          LE Set PHY (Octet 35 - Bit 6)
          LE Enhanced Receiver Test (Octet 35 - Bit 7)
          LE Enhanced Transmitter Test (Octet 36 - Bit 0)
          LE Set Advertising Set Random Address (Octet 36 - Bit 1)
          LE Set Extended Advertising Parameters (Octet 36 - Bit 2)
          LE Set Extended Advertising Data (Octet 36 - Bit 3)
          LE Set Extended Scan Response Data (Octet 36 - Bit 4)
          LE Set Extended Advertising Enable (Octet 36 - Bit 5)
          LE Read Maximum Advertising Data Length (Octet 36 - Bit 6)
          LE Read Number of Supported Advertising Sets (Octet 36 - Bit 7)
          LE Remove Advertising Set (Octet 37 - Bit 0)
          LE Clear Advertising Sets (Octet 37 - Bit 1)
          LE Set Periodic Advertising Parameters (Octet 37 - Bit 2)
          LE Set Periodic Advertising Data (Octet 37 - Bit 3)
          LE Set Periodic Advertising Enable (Octet 37 - Bit 4)
          LE Set Extended Scan Parameters (Octet 37 - Bit 5)
          LE Set Extended Scan Enable (Octet 37 - Bit 6)
          LE Extended Create Connection (Octet 37 - Bit 7)
          LE Periodic Advertising Create Sync (Octet 38 - Bit 0)
          LE Periodic Advertising Create Sync Cancel (Octet 38 - Bit 1)
          LE Periodic Advertising Terminate Sync (Octet 38 - Bit 2)
          LE Add Device To Periodic Advertiser List (Octet 38 - Bit 3)
          LE Remove Device From Periodic Advertiser List (Octet 38 - Bit 4)
          LE Clear Periodic Advertiser List (Octet 38 - Bit 5)
          LE Read Periodic Advertiser List Size (Octet 38 - Bit 6)
          LE Read Transmit Power (Octet 38 - Bit 7)
          LE Read RF Path Compensation (Octet 39 - Bit 0)
          LE Write RF Path Compensation (Octet 39 - Bit 1)
          LE Set Privacy Mode (Octet 39 - Bit 2)
          LE Periodic Advertising Receive Enable (Octet 40 - Bit 5)
          LE Periodic Advertising Sync Transfer (Octet 40 - Bit 6)
          LE Periodic Advertising Set Info Transfer (Octet 40 - Bit 7)
          LE Periodic Advertising Sync Transfer Parameters (Octet 41 - Bit 0)
          LE Set Default Periodic Advertisng Sync Transfer Parameters (Octet 41 - Bit 1)
          LE Read Buffer v2 (Octet 41 - Bit 5)
          LE Read ISO TX Sync (Octet 41 - Bit 6)
          LE Set Connected Isochronous Group Parameters (Octet 41 - Bit 7)
          LE Set Connected Isochronous Group Parameters Test (Octet 42 - Bit 0)
          LE Create Connected Isochronous Stream (Octet 42 - Bit 1)
          LE Remove Connected Isochronous Group (Octet 42 - Bit 2)
          LE Accept Connected Isochronous Stream Request (Octet 42 - Bit 3)
          LE Reject Connected Isochronous Stream Request (Octet 42 - Bit 4)
          LE Create Broadcast Isochronous Group (Octet 42 - Bit 5)
          LE Create Broadcast Isochronous Group Test (Octet 42 - Bit 6)
          LE Terminate Broadcast Isochronous Group (Octet 42 - Bit 7)
          LE Broadcast Isochronous Group Create Sync (Octet 43 - Bit 0)
          LE Broadcast Isochronous Group Terminate Sync (Octet 43 - Bit 1)
          LE Request Peer SCA (Octet 43 - Bit 2)
          LE Setup Isochronous Data Path (Octet 43 - Bit 3)
          LE Remove Isochronous Data Path (Octet 43 - Bit 4)
          LE Isochronous Transmit Test (Octet 43 - Bit 5)
          LE Isochronous Receive Test (Octet 43 - Bit 6)
          LE Isochronous Read Test Counters (Octet 43 - Bit 7)
          LE Isochronous Read Test Counters (Octet 44 - Bit 0)
          LE Set Host Feature (Octet 44 - Bit 1)
          Octet 44 - Bit 2 
          Octet 45 - Bit 6 
          Octet 46 - Bit 0 
          Octet 46 - Bit 1 
          Octet 46 - Bit 2 
< HCI Command: Host Buffer Size (0x03|0x0033) plen 7         #9 [hci1] 0.930817
        ACL MTU: 255  ACL max packet: 16
        SCO MTU: 0    SCO max packet: 0
> HCI Event: Command Complete (0x0e) plen 4                 #10 [hci1] 0.931339
      Host Buffer Size (0x03|0x0033) ncmd 1
        Status: Success (0x00)
< HCI Command: Set Controller To Ho.. (0x03|0x0031) plen 1  #11 [hci1] 0.950835
        Flow control: ACL Data Packets (0x01)
> HCI Event: Command Complete (0x0e) plen 4                 #12 [hci1] 0.951298
      Set Controller To Host Flow Control (0x03|0x0031) ncmd 1
        Status: Success (0x00)
< HCI Command: LE Read Local Suppor.. (0x08|0x0003) plen 0  #13 [hci1] 0.970817
> HCI Event: Command Complete (0x0e) plen 12                #14 [hci1] 0.971288
      LE Read Local Supported Features (0x08|0x0003) ncmd 1
        Status: Success (0x00)
        Features: 0xfd 0x79 0x00 0xf7 0x30 0x01 0x00 0x00
          LE Encryption
          Extended Reject Indication
          Peripheral-initiated Features Exchange
          LE Ping
          LE Data Packet Length Extension
          LL Privacy
          Extended Scanner Filter Policies
          LE 2M PHY
          LE Coded PHY
          LE Extended Advertising
          LE Periodic Advertising
          Channel Selection Algorithm #2
          Periodic Advertising Sync Transfer - Sender
          Periodic Advertising Sync Transfer - Recipient
          Sleep Clock Accuracy Updates
          Connected Isochronous Stream - Central
          Connected Isochronous Stream - Peripheral
          Isochronous Broadcaster
          Synchronized Receiver
          Periodic Advertising ADI support
          Connection Subrating
          Unknown features (0x0000010000000000)
< HCI Command: LE Set Host Feature (0x08|0x0074) plen 2     #15 [hci1] 0.990829
        Bit Number: 32
          Connected Isochronous Stream (Host Support)
        Bit Value: 1
> HCI Event: Command Complete (0x0e) plen 4                 #16 [hci1] 0.991298
      LE Set Host Feature (0x08|0x0074) ncmd 1
        Status: Success (0x00)
< HCI Command: LE Read Buffer v2 (0x08|0x0060) plen 0       #17 [hci1] 1.010830
> HCI Event: Command Complete (0x0e) plen 10                #18 [hci1] 1.011370
      LE Read Buffer v2 (0x08|0x0060) ncmd 1
        Status: Success (0x00)
        ACL MTU: 27
        ACL max packet: 3
        ISO MTU: 318
        ISO max packet: 3
< HCI Command: LE Read Maximum Adve.. (0x08|0x003a) plen 0  #19 [hci1] 1.030857
> HCI Event: Command Complete (0x0e) plen 6                 #20 [hci1] 1.031272
      LE Read Maximum Advertising Data Length (0x08|0x003a) ncmd 1
        Status: Success (0x00)
        Max length: 1650
< HCI Command: LE Read Supported St.. (0x08|0x001c) plen 0  #21 [hci1] 1.050829
> HCI Event: Command Complete (0x0e) plen 12                #22 [hci1] 1.051263
      LE Read Supported States (0x08|0x001c) ncmd 1
        Status: Success (0x00)
        States: 0x000003ff3e0306ff
          Non-connectable Advertising State
          Scannable Advertising State
          Connectable Advertising State
          High Duty Cycle Directed Advertising State
          Passive Scanning State
          Active Scanning State
          Initiating State
            and Connection State (Central Role)
          Connection State (Peripheral Role)
          Scannable Advertising State
            and Passive Scanning State
          Connectable Advertising State
            and Passive Scanning State
          Non-connectable Advertising State
            and Initiating State
          Scannable Advertising State
            and Initiating State
          Active Scanning State
            and Connection State (Central Role)
          Passive Scanning State
            and Connection State (Peripheral Role)
          Active Scanning State
            and Connection State (Peripheral Role)
          Initiating State
            and Connection State (Central Role)
            and Central Role & Central Role
          Low Duty Cycle Directed Advertising State
          Connectable Advertising State
            and Initiating State
            and Central Role & Peripheral Role
          High Duty Cycle Directed Advertising State
            and Initiating State
            and Central Role & Peripheral Role
          Low Duty Cycle Directed Advertising State
            and Initiating State
            and Central Role & Peripheral Role
          Connectable Advertising State
            and Connection State (Central Role)
            and Central Role & Peripheral Role
          High Duty Cycle Directed Advertising State
            and Connection State (Central Role)
            and Central Role & Peripheral Role
          Low Duty Cycle Directed Advertising State
            and Connection State (Central Role)
            and Central Role & Peripheral Role
          Connectable Advertising State
            and Connection State (Peripheral Role)
            and Central Role & Peripheral Role
          High Duty Cycle Directed Advertising State
            and Connection State (Peripheral Role)
            and Peripheral Role & Peripheral Role
          Low Duty Cycle Directed Advertising State
            and Connection State (Peripheral Role)
            and Peripheral Role & Peripheral Role
          Initiating State
            and Connection State (Peripheral Role)
            and Central Role & Peripheral Role
< HCI Command: LE Read Maximum Data.. (0x08|0x002f) plen 0  #23 [hci1] 1.070847
> HCI Event: Command Complete (0x0e) plen 12                #24 [hci1] 1.071409
      LE Read Maximum Data Length (0x08|0x002f) ncmd 1
        Status: Success (0x00)
        Max TX octets: 251
        Max TX time: 2704
        Max RX octets: 251
        Max RX time: 2704
< HCI Command: LE Write Suggested D.. (0x08|0x0024) plen 4  #25 [hci1] 1.090818
        TX octets: 251
        TX time: 2704
> HCI Event: Command Complete (0x0e) plen 4                 #26 [hci1] 1.091272
      LE Write Suggested Default Data Length (0x08|0x0024) ncmd 1
        Status: Success (0x00)
< HCI Command: LE Read Resolving Li.. (0x08|0x002a) plen 0  #27 [hci1] 1.110827
> HCI Event: Command Complete (0x0e) plen 5                 #28 [hci1] 1.111280
      LE Read Resolving List Size (0x08|0x002a) ncmd 1
        Status: Success (0x00)
        Size: 8
< HCI Command: LE Set Event Mask (0x08|0x0001) plen 8       #29 [hci1] 1.130821
        Mask: 0x000002023f87fa5e
          LE Advertising Report
          LE Connection Update Complete
          LE Read Remote Used Features Complete
          LE Long Term Key Request
          LE Data Length Change
          LE Enhanced Connection Complete
          LE PHY Update Complete
          LE Extended Advertising Report
          LE Periodic Advertising Sync Established
          LE Periodic Advertising Report
          LE Periodic Advertising Sync Lost
          LE Extended Scan Timeout
          LE Extended Advertising Set Terminated
          LE Scan Request Received
          LE Periodic Advertising Sync Transfer Rvc
          LE CIS Established
          LE CIS Request
          LE Create BIG Complete
          LE Terminate BIG Complete
          LE BIG Sync Estabilished Complete
          LE BIG Sync Lost
          LE BIG Info Advertising Report
          Unknown mask (0x0000020000000000)
> HCI Event: Command Complete (0x0e) plen 4                 #30 [hci1] 1.131319
      LE Set Event Mask (0x08|0x0001) ncmd 1
        Status: Success (0x00)
< HCI Command: Set Event Mask (0x03|0x0001) plen 8          #31 [hci1] 1.150839
        Mask: 0x2000800002008890
          Disconnection Complete
          Encryption Change
          Read Remote Version Information Complete
          Hardware Error
          Data Buffer Overflow
          Encryption Key Refresh Complete
          LE Meta
> HCI Event: Command Complete (0x0e) plen 4                 #32 [hci1] 1.151364
      Set Event Mask (0x03|0x0001) ncmd 1
        Status: Success (0x00)
< HCI Command: Read BD ADDR (0x04|0x0009) plen 0            #33 [hci1] 1.170835
> HCI Event: Command Complete (0x0e) plen 10                #34 [hci1] 1.171259
      Read BD ADDR (0x04|0x0009) ncmd 1
        Status: Success (0x00)
        Address: 00:00:00:00:00:00 (OUI 00-00-00)
< HCI Command: LE Set Random Address (0x08|0x0005) plen 6   #35 [hci1] 1.190837
        Address: D5:B6:CC:31:DB:3B (Static)
> HCI Event: Command Complete (0x0e) plen 4                 #36 [hci1] 1.191325
      LE Set Random Address (0x08|0x0005) ncmd 1
        Status: Success (0x00)
< HCI Command: LE Set Extended Adv.. (0x08|0x0036) plen 25  #37 [hci1] 3.690975
        Handle: 0x00
        Properties: 0x0013
          Connectable
          Scannable
          Use legacy advertising PDUs: ADV_IND
        Min advertising interval: 100.000 msec (0x00a0)
        Max advertising interval: 150.000 msec (0x00f0)
        Channel map: 37, 38, 39 (0x07)
        Own address type: Random (0x01)
        Peer address type: Public (0x00)
        Peer address: 00:00:00:00:00:00 (OUI 00-00-00)
        Filter policy: Allow Scan Request from Any, Allow Connect Request from Any (0x00)
        TX power: Host has no preference (0x7f)
        Primary PHY: LE 1M (0x01)
        Secondary max skip: 0x00
        Secondary PHY: LE 1M (0x01)
        SID: 0x00
        Scan request notifications: Disabled (0x00)
> HCI Event: Command Complete (0x0e) plen 5                 #38 [hci1] 3.691762
      LE Set Extended Advertising Parameters (0x08|0x0036) ncmd 1
        Status: Success (0x00)
        TX power (selected): 0 dbm (0x00)
< HCI Command: LE Set Advertising S.. (0x08|0x0035) plen 7  #39 [hci1] 3.710868
        Advertising handle: 0x00
        Advertising random address: D5:B6:CC:31:DB:3B (Static)
> HCI Event: Command Complete (0x0e) plen 4                 #40 [hci1] 3.711410
      LE Set Advertising Set Random Address (0x08|0x0035) ncmd 1
        Status: Success (0x00)
< HCI Command: LE Set Extended Adv.. (0x08|0x0037) plen 22  #41 [hci1] 3.730851
        Handle: 0x00
        Operation: Complete extended advertising data (0x03)
        Fragment preference: Minimize fragmentation (0x01)
        Data length: 0x12
        Flags: 0x06
          LE General Discoverable Mode
          BR/EDR Not Supported
        Name (complete): Tester_F6B11A
> HCI Event: Command Complete (0x0e) plen 4                 #42 [hci1] 3.731524
      LE Set Extended Advertising Data (0x08|0x0037) ncmd 1
        Status: Success (0x00)
< HCI Command: LE Set Extended Scan.. (0x08|0x0038) plen 4  #43 [hci1] 3.750858
        Handle: 0x00
        Operation: Complete scan response data (0x03)
        Fragment preference: Minimize fragmentation (0x01)
        Data length: 0x00
> HCI Event: Command Complete (0x0e) plen 4                 #44 [hci1] 3.751305
      LE Set Extended Scan Response Data (0x08|0x0038) ncmd 1
        Status: Success (0x00)
< HCI Command: LE Set Extended Adve.. (0x08|0x0039) plen 6  #45 [hci1] 3.770862
        Extended advertising: Enabled (0x01)
        Number of sets: 1 (0x01)
        Entry 0
          Handle: 0x00
          Duration: 0 ms (0x00)
          Max ext adv events: 0
> HCI Event: Command Complete (0x0e) plen 4                 #46 [hci1] 3.771417
      LE Set Extended Advertising Enable (0x08|0x0039) ncmd 1
        Status: Success (0x00)
> HCI Event: LE Meta Event (0x3e) plen 31                   #47 [hci1] 3.881435
      LE Enhanced Connection Complete (0x0a)
        Status: Success (0x00)
        Handle: 2739
        Role: Peripheral (0x01)
        Peer address type: Public (0x00)
        Peer address: DF:A9:FF:F6:B1:1A (OUI DF-A9-FF)
        Local resolvable private address: 00:00:00:00:00:00 (Non-Resolvable)
        Peer resolvable private address: 00:00:00:00:00:00 (Non-Resolvable)
        Connection interval: 87.50 msec (0x0046)
        Connection latency: 0 (0x0000)
        Supervision timeout: 25120 msec (0x09d0)
        Central clock accuracy: 0x01
> HCI Event: LE Meta Event (0x3e) plen 6                    #48 [hci1] 3.881601
      LE Advertising Set Terminated (0x12)
        Status: Success (0x00)
        Handle: 0
        Connection handle: 2739
        Number of completed extended advertising events: 0
< HCI Command: LE Read Remote Used... (0x08|0x0016) plen 2  #49 [hci1] 3.892069
        Handle: 2739 Address: DF:A9:FF:F6:B1:1A (OUI DF-A9-FF)
< ACL Data TX: Handle 2739 flags 0x00 dlen 7                #50 [hci1] 3.892095
      ATT: Exchange MTU Request (0x02) len 2
        Client RX MTU: 251
> HCI Event: Command Status (0x0f) plen 4                   #51 [hci1] 3.892564
      LE Read Remote Used Features (0x08|0x0016) ncmd 1
        Status: Success (0x00)
> HCI Event: Number of Completed Packets (0x13) plen 5      #52 [hci1] 4.057508
        Num handles: 1
        Handle: 2739 Address: DF:A9:FF:F6:B1:1A (OUI DF-A9-FF)
        Count: 1
        #50: len 7 (0 Kb/s)
        Latency: 165 msec (165-165 msec ~165 msec)
> HCI Event: LE Meta Event (0x3e) plen 12                   #53 [hci1] 4.145386
      LE Read Remote Used Features (0x04)
        Status: Success (0x00)
        Handle: 2739 Address: DF:A9:FF:F6:B1:1A (OUI DF-A9-FF)
        Features: 0x2d 0x49 0x00 0xf7 0x67 0xd9 0x00 0x80
          LE Encryption
          Extended Reject Indication
          Peripheral-initiated Features Exchange
          LE Data Packet Length Extension
          LE 2M PHY
          LE Coded PHY
          Channel Selection Algorithm #2
          Periodic Advertising Sync Transfer - Sender
          Periodic Advertising Sync Transfer - Recipient
          Sleep Clock Accuracy Updates
          Connected Isochronous Stream - Central
          Connected Isochronous Stream - Peripheral
          Isochronous Broadcaster
          Synchronized Receiver
          Connected Isochronous Stream (Host Support)
          LE Power Control Request
          LE Power Control Request
          Connection Subrating
          Connection Subrating (Host Support)
          Unknown features (0x8000d90000000000)
> ACL Data RX: Handle 2739 flags 0x02 dlen 11               #54 [hci1] 6.595064
      SMP: Pairing Request (0x01) len 6
        IO capability: KeyboardDisplay (0x04)
        OOB data: Authentication data not present (0x00)
        Authentication requirement: Bonding, MITM, SC, No Keypresses (0x0d)
        Max encryption key size: 16
        Initiator key distribution: EncKey IdKey (0x03)
        Responder key distribution: EncKey IdKey Sign (0x07)
> ACL Data RX: Handle 2739 flags 0x02 dlen 7                #55 [hci1] 6.595509
      ATT: Exchange MTU Response (0x03) len 2
        Server RX MTU: 23
< HCI Command: Host Number of Compl.. (0x03|0x0035) plen 5  #56 [hci1] 6.611544
        Num handles: 1
        Handle: 2739 Address: DF:A9:FF:F6:B1:1A (OUI DF-A9-FF)
        Count: 1
< ACL Data TX: Handle 2739 flags 0x00 dlen 11               #57 [hci1] 6.611698
      SMP: Pairing Response (0x02) len 6
        IO capability: DisplayOnly (0x00)
        OOB data: Authentication data not present (0x00)
        Authentication requirement: Bonding, No MITM, SC, No Keypresses (0x09)
        Max encryption key size: 16
        Initiator key distribution: IdKey (0x02)
        Responder key distribution: <none> (0x00)
< HCI Command: Host Number of Compl.. (0x03|0x0035) plen 5  #58 [hci1] 6.612118
        Num handles: 1
        Handle: 2739 Address: DF:A9:FF:F6:B1:1A (OUI DF-A9-FF)
        Count: 1
> HCI Event: Number of Completed Packets (0x13) plen 5      #59 [hci1] 6.770160
        Num handles: 1
        Handle: 2739 Address: DF:A9:FF:F6:B1:1A (OUI DF-A9-FF)
        Count: 1
        #57: len 11 (0 Kb/s)
        Latency: 158 msec (158-165 msec ~161 msec)
> ACL Data RX: Handle 2739 flags 0x02 dlen 27               #60 [hci1] 6.770477
> ACL Data RX: Handle 2739 flags 0x01 dlen 27               #61 [hci1] 6.770999
> ACL Data RX: Handle 2739 flags 0x01 dlen 15               #62 [hci1] 6.771429
      SMP: Pairing Public Key (0x0c) len 64
        X: 009eabef8ce3bcb23d1db40e28c3c1dba061ff616564880645b62cedc93f3aff
        Y: 413b72aabc2e947754f16c2cb5c05c7d44c521570abab0e4b120e5670e391600
< HCI Command: Host Number of Compl.. (0x03|0x0035) plen 5  #63 [hci1] 6.791440
        Num handles: 1
        Handle: 2739 Address: DF:A9:FF:F6:B1:1A (OUI DF-A9-FF)
        Count: 1
< HCI Command: Host Number of Compl.. (0x03|0x0035) plen 5  #64 [hci1] 6.791725
        Num handles: 1
        Handle: 2739 Address: DF:A9:FF:F6:B1:1A (OUI DF-A9-FF)
        Count: 1
< HCI Command: Host Number of Compl.. (0x03|0x0035) plen 5  #65 [hci1] 6.792085
        Num handles: 1
        Handle: 2739 Address: DF:A9:FF:F6:B1:1A (OUI DF-A9-FF)
        Count: 1
< ACL Data TX: Handle 2739 flags 0x00 dlen 27               #66 [hci1] 6.792322
< ACL Data TX: Handle 2739 flags 0x01 dlen 27               #67 [hci1] 6.792341
< ACL Data TX: Handle 2739 flags 0x01 dlen 15               #68 [hci1] 6.792344
      SMP: Pairing Public Key (0x0c) len 64
        X: 98308440221e2d910f0e54b71e7ec652857aa9b5a0dc65028824cc19db1226e9
        Y: 67a4816bcb62efb21701e31fdb27561a6217575fb007a8bbdabe7e28b6f68482
> HCI Event: Number of Completed Packets (0x13) plen 5      #69 [hci1] 6.858046
        Num handles: 1
        Handle: 2739 Address: DF:A9:FF:F6:B1:1A (OUI DF-A9-FF)
        Count: 1
        #66: len 27 (3 Kb/s)
        Latency: 65 msec (65-165 msec ~113 msec)
> HCI Event: Number of Completed Packets (0x13) plen 5      #70 [hci1] 6.858756
        Num handles: 1
        Handle: 2739 Address: DF:A9:FF:F6:B1:1A (OUI DF-A9-FF)
        Count: 1
        #67: len 27 (3 Kb/s)
        Latency: 66 msec (65-165 msec ~90 msec)
> HCI Event: Number of Completed Packets (0x13) plen 5      #71 [hci1] 6.944994
        Num handles: 1
        Handle: 2739 Address: DF:A9:FF:F6:B1:1A (OUI DF-A9-FF)
        Count: 1
        #68: len 15 (0 Kb/s)
        Latency: 152 msec (65-165 msec ~121 msec)
> ACL Data RX: Handle 2739 flags 0x02 dlen 21               #72 [hci1] 7.907755
      SMP: Pairing Confirm (0x03) len 16
        Confim value: 73f85a705323b233a7186d44970f8068
< HCI Command: Host Number of Compl.. (0x03|0x0035) plen 5  #73 [hci1] 7.911182
        Num handles: 1
        Handle: 2739 Address: DF:A9:FF:F6:B1:1A (OUI DF-A9-FF)
        Count: 1
< ACL Data TX: Handle 2739 flags 0x00 dlen 21               #74 [hci1] 7.911325
      SMP: Pairing Confirm (0x03) len 16
        Confim value: 825254d3489652bdc4f327ca67e9bf18
> HCI Event: Number of Completed Packets (0x13) plen 5      #75 [hci1] 8.082490
        Num handles: 1
        Handle: 2739 Address: DF:A9:FF:F6:B1:1A (OUI DF-A9-FF)
        Count: 1
        #74: len 21 (0 Kb/s)
        Latency: 171 msec (65-171 msec ~146 msec)
> ACL Data RX: Handle 2739 flags 0x02 dlen 21               #76 [hci1] 8.082977
      SMP: Pairing Random (0x04) len 16
        Random value: 79f06a86141468020000000000000000
< HCI Command: Host Number of Compl.. (0x03|0x0035) plen 5  #77 [hci1] 8.091109
        Num handles: 1
        Handle: 2739 Address: DF:A9:FF:F6:B1:1A (OUI DF-A9-FF)
        Count: 1
< ACL Data TX: Handle 2739 flags 0x00 dlen 21               #78 [hci1] 8.091151
      SMP: Pairing Random (0x04) len 16
        Random value: 8e6108f966a694cbe26df70bb96773e6
> HCI Event: Number of Completed Packets (0x13) plen 5      #79 [hci1] 8.257313
        Num handles: 1
        Handle: 2739 Address: DF:A9:FF:F6:B1:1A (OUI DF-A9-FF)
        Count: 1
        #78: len 21 (1 Kb/s)
        Latency: 166 msec (65-171 msec ~156 msec)
> ACL Data RX: Handle 2739 flags 0x02 dlen 21               #80 [hci1] 8.345182
      SMP: Pairing Confirm (0x03) len 16
        Confim value: 3fe1d9006366cd04cc46d5afcd8997da
< HCI Command: Host Number of Compl.. (0x03|0x0035) plen 5  #81 [hci1] 8.351575
        Num handles: 1
        Handle: 2739 Address: DF:A9:FF:F6:B1:1A (OUI DF-A9-FF)
        Count: 1
< ACL Data TX: Handle 2739 flags 0x00 dlen 21               #82 [hci1] 8.351727
      SMP: Pairing Confirm (0x03) len 16
        Confim value: af2657a8e9ab6f0e276e213703cbb491
> HCI Event: Number of Completed Packets (0x13) plen 5      #83 [hci1] 8.520003
        Num handles: 1
        Handle: 2739 Address: DF:A9:FF:F6:B1:1A (OUI DF-A9-FF)
        Count: 1
        #82: len 21 (1 Kb/s)
        Latency: 168 msec (65-171 msec ~162 msec)
> ACL Data RX: Handle 2739 flags 0x02 dlen 21               #84 [hci1] 8.520344
      SMP: Pairing Random (0x04) len 16
        Random value: 6dc64ec840bee0a30000000000000000
< HCI Command: Host Number of Compl.. (0x03|0x0035) plen 5  #85 [hci1] 8.531105
        Num handles: 1
        Handle: 2739 Address: DF:A9:FF:F6:B1:1A (OUI DF-A9-FF)
        Count: 1
< ACL Data TX: Handle 2739 flags 0x00 dlen 21               #86 [hci1] 8.531113
      SMP: Pairing Random (0x04) len 16
        Random value: 4d02679f89a05211af56d8b3da64d21e
> HCI Event: Number of Completed Packets (0x13) plen 5      #87 [hci1] 8.694835
        Num handles: 1
        Handle: 2739 Address: DF:A9:FF:F6:B1:1A (OUI DF-A9-FF)
        Count: 1
        #86: len 21 (1 Kb/s)
        Latency: 163 msec (65-171 msec ~162 msec)
> ACL Data RX: Handle 2739 flags 0x02 dlen 21               #88 [hci1] 8.782717
      SMP: Pairing Confirm (0x03) len 16
        Confim value: 2c54291cd242359bc9036d9aed0bb5ba
< HCI Command: Host Number of Compl.. (0x03|0x0035) plen 5  #89 [hci1] 8.791230
        Num handles: 1
        Handle: 2739 Address: DF:A9:FF:F6:B1:1A (OUI DF-A9-FF)
        Count: 1
< ACL Data TX: Handle 2739 flags 0x00 dlen 21               #90 [hci1] 8.791352
      SMP: Pairing Confirm (0x03) len 16
        Confim value: 8f0c13da2dba0d81353ce6a79e9ce853
> HCI Event: Number of Completed Packets (0x13) plen 5      #91 [hci1] 8.957573
        Num handles: 1
        Handle: 2739 Address: DF:A9:FF:F6:B1:1A (OUI DF-A9-FF)
        Count: 1
        #90: len 21 (1 Kb/s)
        Latency: 166 msec (65-171 msec ~164 msec)
> ACL Data RX: Handle 2739 flags 0x02 dlen 21               #92 [hci1] 8.957963
      SMP: Pairing Random (0x04) len 16
        Random value: 6ad28d611f3854ee0000000000000000
< HCI Command: Host Number of Compl.. (0x03|0x0035) plen 5  #93 [hci1] 8.971768
        Num handles: 1
        Handle: 2739 Address: DF:A9:FF:F6:B1:1A (OUI DF-A9-FF)
        Count: 1
< ACL Data TX: Handle 2739 flags 0x00 dlen 21               #94 [hci1] 8.971909
      SMP: Pairing Random (0x04) len 16
        Random value: 5e8286bc235a02440d0c3424a2acf8fd
> HCI Event: Number of Completed Packets (0x13) plen 5      #95 [hci1] 9.132312
        Num handles: 1
        Handle: 2739 Address: DF:A9:FF:F6:B1:1A (OUI DF-A9-FF)
        Count: 1
        #94: len 21 (1 Kb/s)
        Latency: 160 msec (65-171 msec ~162 msec)
> ACL Data RX: Handle 2739 flags 0x02 dlen 21               #96 [hci1] 9.220356
      SMP: Pairing Confirm (0x03) len 16
        Confim value: a91d5fcf9bb8c7f81dbe1a822d94f60d
< HCI Command: Host Number of Compl.. (0x03|0x0035) plen 5  #97 [hci1] 9.231550
        Num handles: 1
        Handle: 2739 Address: DF:A9:FF:F6:B1:1A (OUI DF-A9-FF)
        Count: 1
< ACL Data TX: Handle 2739 flags 0x00 dlen 21               #98 [hci1] 9.231703
      SMP: Pairing Confirm (0x03) len 16
        Confim value: 32538519f0e7f9025a268f6049c6a429
> HCI Event: Number of Completed Packets (0x13) plen 5      #99 [hci1] 9.395035
        Num handles: 1
        Handle: 2739 Address: DF:A9:FF:F6:B1:1A (OUI DF-A9-FF)
        Count: 1
        #98: len 21 (1 Kb/s)
        Latency: 163 msec (65-171 msec ~162 msec)
> ACL Data RX: Handle 2739 flags 0x02 dlen 21              #100 [hci1] 9.395488
      SMP: Pairing Random (0x04) len 16
        Random value: 88c59c1aad9e9ed70000000000000000
< HCI Command: Host Number of Comp.. (0x03|0x0035) plen 5  #101 [hci1] 9.411793
        Num handles: 1
        Handle: 2739 Address: DF:A9:FF:F6:B1:1A (OUI DF-A9-FF)
        Count: 1
< ACL Data TX: Handle 2739 flags 0x00 dlen 21              #102 [hci1] 9.411981
      SMP: Pairing Random (0x04) len 16
        Random value: 5c4a1bcadd27bd58e945097b00bad7ac
> HCI Event: Number of Completed Packets (0x13) plen 5     #103 [hci1] 9.569822
        Num handles: 1
        Handle: 2739 Address: DF:A9:FF:F6:B1:1A (OUI DF-A9-FF)
        Count: 1
        #102: len 21 (1 Kb/s)
        Latency: 157 msec (65-171 msec ~160 msec)
> ACL Data RX: Handle 2739 flags 0x02 dlen 21              #104 [hci1] 9.657624
      SMP: Pairing Confirm (0x03) len 16
        Confim value: d7758c0a852ae3b5e710863a698627a2
< HCI Command: Host Number of Comp.. (0x03|0x0035) plen 5  #105 [hci1] 9.671308
        Num handles: 1
        Handle: 2739 Address: DF:A9:FF:F6:B1:1A (OUI DF-A9-FF)
        Count: 1
< ACL Data TX: Handle 2739 flags 0x00 dlen 21              #106 [hci1] 9.671380
      SMP: Pairing Confirm (0x03) len 16
        Confim value: 4c2e223c2ab5ac6277693d9ff2c2d36e
> HCI Event: Number of Completed Packets (0x13) plen 5     #107 [hci1] 9.832502
        Num handles: 1
        Handle: 2739 Address: DF:A9:FF:F6:B1:1A (OUI DF-A9-FF)
        Count: 1
        #106: len 21 (1 Kb/s)
        Latency: 161 msec (65-171 msec ~160 msec)
> ACL Data RX: Handle 2739 flags 0x02 dlen 21              #108 [hci1] 9.832904
      SMP: Pairing Random (0x04) len 16
        Random value: d444021cc051d0de0000000000000000
< HCI Command: Host Number of Comp.. (0x03|0x0035) plen 5  #109 [hci1] 9.851685
        Num handles: 1
        Handle: 2739 Address: DF:A9:FF:F6:B1:1A (OUI DF-A9-FF)
        Count: 1
< ACL Data TX: Handle 2739 flags 0x00 dlen 21              #110 [hci1] 9.851738
      SMP: Pairing Random (0x04) len 16
        Random value: 32527e6e64e79f33b2e374394db8ab2d
> HCI Event: Number of Completed Packets (0x13) plen 5    #111 [hci1] 10.007344
        Num handles: 1
        Handle: 2739 Address: DF:A9:FF:F6:B1:1A (OUI DF-A9-FF)
        Count: 1
        #110: len 21 (1 Kb/s)
        Latency: 155 msec (65-171 msec ~158 msec)
> ACL Data RX: Handle 2739 flags 0x02 dlen 21             #112 [hci1] 10.095151
      SMP: Pairing Confirm (0x03) len 16
        Confim value: 2f67e347ec0becaaf3267d49db3927fe
< HCI Command: Host Number of Com.. (0x03|0x0035) plen 5  #113 [hci1] 10.111576
        Num handles: 1
        Handle: 2739 Address: DF:A9:FF:F6:B1:1A (OUI DF-A9-FF)
        Count: 1
< ACL Data TX: Handle 2739 flags 0x00 dlen 21             #114 [hci1] 10.111768
      SMP: Pairing Confirm (0x03) len 16
        Confim value: 29d73b2b66216c6e2e8dc16583d2cebc
> HCI Event: Number of Completed Packets (0x13) plen 5    #115 [hci1] 10.269990
        Num handles: 1
        Handle: 2739 Address: DF:A9:FF:F6:B1:1A (OUI DF-A9-FF)
        Count: 1
        #114: len 21 (1 Kb/s)
        Latency: 158 msec (65-171 msec ~158 msec)
> ACL Data RX: Handle 2739 flags 0x02 dlen 21             #116 [hci1] 10.270346
      SMP: Pairing Random (0x04) len 16
        Random value: b05eacaf0bacd4020000000000000000
< HCI Command: Host Number of Com.. (0x03|0x0035) plen 5  #117 [hci1] 10.271795
        Num handles: 1
        Handle: 2739 Address: DF:A9:FF:F6:B1:1A (OUI DF-A9-FF)
        Count: 1
< ACL Data TX: Handle 2739 flags 0x00 dlen 21             #118 [hci1] 10.271883
      SMP: Pairing Random (0x04) len 16
        Random value: dddbdfe2838e9a8cc6964353c850fef7
> HCI Event: Number of Completed Packets (0x13) plen 5    #119 [hci1] 10.444811
        Num handles: 1
        Handle: 2739 Address: DF:A9:FF:F6:B1:1A (OUI DF-A9-FF)
        Count: 1
        #118: len 21 (0 Kb/s)
        Latency: 172 msec (65-172 msec ~165 msec)
> ACL Data RX: Handle 2739 flags 0x02 dlen 21             #120 [hci1] 10.532688
      SMP: Pairing Confirm (0x03) len 16
        Confim value: 3439049507e6953ae0ce2da31eb045cc
< HCI Command: Host Number of Com.. (0x03|0x0035) plen 5  #121 [hci1] 10.551559
        Num handles: 1
        Handle: 2739 Address: DF:A9:FF:F6:B1:1A (OUI DF-A9-FF)
        Count: 1
< ACL Data TX: Handle 2739 flags 0x00 dlen 21             #122 [hci1] 10.551609
      SMP: Pairing Confirm (0x03) len 16
        Confim value: 8374b011c506e0393c20081da27833a5
> HCI Event: Number of Completed Packets (0x13) plen 5    #123 [hci1] 10.707507
        Num handles: 1
        Handle: 2739 Address: DF:A9:FF:F6:B1:1A (OUI DF-A9-FF)
        Count: 1
        #122: len 21 (1 Kb/s)
        Latency: 155 msec (65-172 msec ~160 msec)
> ACL Data RX: Handle 2739 flags 0x02 dlen 21             #124 [hci1] 10.707790
      SMP: Pairing Random (0x04) len 16
        Random value: f448942e49c395200000000000000000
< HCI Command: Host Number of Com.. (0x03|0x0035) plen 5  #125 [hci1] 10.711692
        Num handles: 1
        Handle: 2739 Address: DF:A9:FF:F6:B1:1A (OUI DF-A9-FF)
        Count: 1
< ACL Data TX: Handle 2739 flags 0x00 dlen 21             #126 [hci1] 10.711884
      SMP: Pairing Random (0x04) len 16
        Random value: eb9f1915536596b6fc3db1c86b2b1970
> HCI Event: Number of Completed Packets (0x13) plen 5    #127 [hci1] 10.882324
        Num handles: 1
        Handle: 2739 Address: DF:A9:FF:F6:B1:1A (OUI DF-A9-FF)
        Count: 1
        #126: len 21 (0 Kb/s)
        Latency: 170 msec (65-172 msec ~165 msec)
> ACL Data RX: Handle 2739 flags 0x02 dlen 21             #128 [hci1] 10.970131
      SMP: Pairing Confirm (0x03) len 16
        Confim value: ce5c70da82dc1577a43ea39e836b4407
< HCI Command: Host Number of Com.. (0x03|0x0035) plen 5  #129 [hci1] 10.971115
        Num handles: 1
        Handle: 2739 Address: DF:A9:FF:F6:B1:1A (OUI DF-A9-FF)
        Count: 1
< ACL Data TX: Handle 2739 flags 0x00 dlen 21             #130 [hci1] 10.971126
      SMP: Pairing Confirm (0x03) len 16
        Confim value: ff9534649c393eae2e46edcfe0763d0c
> HCI Event: Number of Completed Packets (0x13) plen 5    #131 [hci1] 11.145097
        Num handles: 1
        Handle: 2739 Address: DF:A9:FF:F6:B1:1A (OUI DF-A9-FF)
        Count: 1
        #130: len 21 (0 Kb/s)
        Latency: 173 msec (65-173 msec ~169 msec)
> ACL Data RX: Handle 2739 flags 0x02 dlen 21             #132 [hci1] 11.145282
      SMP: Pairing Random (0x04) len 16
        Random value: eef099d7a9b564830000000000000000
< HCI Command: Host Number of Com.. (0x03|0x0035) plen 5  #133 [hci1] 11.151166
        Num handles: 1
        Handle: 2739 Address: DF:A9:FF:F6:B1:1A (OUI DF-A9-FF)
        Count: 1
< ACL Data TX: Handle 2739 flags 0x00 dlen 21             #134 [hci1] 11.151175
      SMP: Pairing Random (0x04) len 16
        Random value: 5c794dc9ad9f2c3f295ebd5ad5e1c3cf
> HCI Event: Number of Completed Packets (0x13) plen 5    #135 [hci1] 11.319865
        Num handles: 1
        Handle: 2739 Address: DF:A9:FF:F6:B1:1A (OUI DF-A9-FF)
        Count: 1
        #134: len 21 (1 Kb/s)
        Latency: 168 msec (65-173 msec ~169 msec)
> ACL Data RX: Handle 2739 flags 0x02 dlen 21             #136 [hci1] 11.407679
      SMP: Pairing Confirm (0x03) len 16
        Confim value: 5c4d59d51a8f1abdf24d1d80d1126233
< HCI Command: Host Number of Com.. (0x03|0x0035) plen 5  #137 [hci1] 11.411163
        Num handles: 1
        Handle: 2739 Address: DF:A9:FF:F6:B1:1A (OUI DF-A9-FF)
        Count: 1
< ACL Data TX: Handle 2739 flags 0x00 dlen 21             #138 [hci1] 11.411217
      SMP: Pairing Confirm (0x03) len 16
        Confim value: adfeb6d59f5745b8814ed853b9c60803
> HCI Event: Number of Completed Packets (0x13) plen 5    #139 [hci1] 11.582497
        Num handles: 1
        Handle: 2739 Address: DF:A9:FF:F6:B1:1A (OUI DF-A9-FF)
        Count: 1
        #138: len 21 (0 Kb/s)
        Latency: 171 msec (65-173 msec ~170 msec)
> ACL Data RX: Handle 2739 flags 0x02 dlen 21             #140 [hci1] 11.582834
      SMP: Pairing Random (0x04) len 16
        Random value: 435053fd5ab7129a0000000000000000
< HCI Command: Host Number of Com.. (0x03|0x0035) plen 5  #141 [hci1] 11.591824
        Num handles: 1
        Handle: 2739 Address: DF:A9:FF:F6:B1:1A (OUI DF-A9-FF)
        Count: 1
< ACL Data TX: Handle 2739 flags 0x00 dlen 21             #142 [hci1] 11.591978
      SMP: Pairing Random (0x04) len 16
        Random value: 5c2fff312cdf99c9491988e877355a9a
> HCI Event: Number of Completed Packets (0x13) plen 5    #143 [hci1] 11.757366
        Num handles: 1
        Handle: 2739 Address: DF:A9:FF:F6:B1:1A (OUI DF-A9-FF)
        Count: 1
        #142: len 21 (1 Kb/s)
        Latency: 165 msec (65-173 msec ~167 msec)
> ACL Data RX: Handle 2739 flags 0x02 dlen 21             #144 [hci1] 11.845185
      SMP: Pairing Confirm (0x03) len 16
        Confim value: 3f93e6138f3b146d4a9dc7a6e5fce567
< HCI Command: Host Number of Com.. (0x03|0x0035) plen 5  #145 [hci1] 11.851536
        Num handles: 1
        Handle: 2739 Address: DF:A9:FF:F6:B1:1A (OUI DF-A9-FF)
        Count: 1
< ACL Data TX: Handle 2739 flags 0x00 dlen 21             #146 [hci1] 11.851704
      SMP: Pairing Confirm (0x03) len 16
        Confim value: 3fd3cff622f02c97caa40ff7236ef2d9
> HCI Event: Number of Completed Packets (0x13) plen 5    #147 [hci1] 12.020033
        Num handles: 1
        Handle: 2739 Address: DF:A9:FF:F6:B1:1A (OUI DF-A9-FF)
        Count: 1
        #146: len 21 (1 Kb/s)
        Latency: 168 msec (65-173 msec ~168 msec)
> ACL Data RX: Handle 2739 flags 0x02 dlen 21             #148 [hci1] 12.020401
      SMP: Pairing Random (0x04) len 16
        Random value: 0c011879bedc8c340000000000000000
< HCI Command: Host Number of Com.. (0x03|0x0035) plen 5  #149 [hci1] 12.031781
        Num handles: 1
        Handle: 2739 Address: DF:A9:FF:F6:B1:1A (OUI DF-A9-FF)
        Count: 1
< ACL Data TX: Handle 2739 flags 0x00 dlen 21             #150 [hci1] 12.031932
      SMP: Pairing Random (0x04) len 16
        Random value: c629a3a987d808e808655d558dfc1155
> HCI Event: Number of Completed Packets (0x13) plen 5    #151 [hci1] 12.194811
        Num handles: 1
        Handle: 2739 Address: DF:A9:FF:F6:B1:1A (OUI DF-A9-FF)
        Count: 1
        #150: len 21 (1 Kb/s)
        Latency: 162 msec (65-173 msec ~165 msec)
> ACL Data RX: Handle 2739 flags 0x02 dlen 21             #152 [hci1] 12.282675
      SMP: Pairing Confirm (0x03) len 16
        Confim value: cd340ec0dc6912da42ed45bb7a35a6f6
< HCI Command: Host Number of Com.. (0x03|0x0035) plen 5  #153 [hci1] 12.291515
        Num handles: 1
        Handle: 2739 Address: DF:A9:FF:F6:B1:1A (OUI DF-A9-FF)
        Count: 1
< ACL Data TX: Handle 2739 flags 0x00 dlen 21             #154 [hci1] 12.291659
      SMP: Pairing Confirm (0x03) len 16
        Confim value: 8f704005aa42d83adcc2f4eef920f223
> HCI Event: Number of Completed Packets (0x13) plen 5    #155 [hci1] 12.457514
        Num handles: 1
        Handle: 2739 Address: DF:A9:FF:F6:B1:1A (OUI DF-A9-FF)
        Count: 1
        #154: len 21 (1 Kb/s)
        Latency: 165 msec (65-173 msec ~165 msec)
> ACL Data RX: Handle 2739 flags 0x02 dlen 21             #156 [hci1] 12.457860
      SMP: Pairing Random (0x04) len 16
        Random value: 2597c3b47dd775390000000000000000
< HCI Command: Host Number of Com.. (0x03|0x0035) plen 5  #157 [hci1] 12.471808
        Num handles: 1
        Handle: 2739 Address: DF:A9:FF:F6:B1:1A (OUI DF-A9-FF)
        Count: 1
< ACL Data TX: Handle 2739 flags 0x00 dlen 21             #158 [hci1] 12.471956
      SMP: Pairing Random (0x04) len 16
        Random value: 92f20f6ad8f13724432c7fd6001c45ff
> HCI Event: Number of Completed Packets (0x13) plen 5    #159 [hci1] 12.632230
        Num handles: 1
        Handle: 2739 Address: DF:A9:FF:F6:B1:1A (OUI DF-A9-FF)
        Count: 1
        #158: len 21 (1 Kb/s)
        Latency: 160 msec (65-173 msec ~162 msec)
> ACL Data RX: Handle 2739 flags 0x02 dlen 21             #160 [hci1] 12.720146
      SMP: Pairing Confirm (0x03) len 16
        Confim value: cb5d80d615a07e25923127b8d1a1c4fd
< HCI Command: Host Number of Com.. (0x03|0x0035) plen 5  #161 [hci1] 12.731352
        Num handles: 1
        Handle: 2739 Address: DF:A9:FF:F6:B1:1A (OUI DF-A9-FF)
        Count: 1
< ACL Data TX: Handle 2739 flags 0x00 dlen 21             #162 [hci1] 12.731441
      SMP: Pairing Confirm (0x03) len 16
        Confim value: 220dfbc26a6b75037da39a2fff5dd5a4
> HCI Event: Number of Completed Packets (0x13) plen 5    #163 [hci1] 12.894985
        Num handles: 1
        Handle: 2739 Address: DF:A9:FF:F6:B1:1A (OUI DF-A9-FF)
        Count: 1
        #162: len 21 (1 Kb/s)
        Latency: 163 msec (65-173 msec ~163 msec)
> ACL Data RX: Handle 2739 flags 0x02 dlen 21             #164 [hci1] 12.895355
      SMP: Pairing Random (0x04) len 16
        Random value: cbfbc7e5b114b2bf0000000000000000
< HCI Command: Host Number of Com.. (0x03|0x0035) plen 5  #165 [hci1] 12.911918
        Num handles: 1
        Handle: 2739 Address: DF:A9:FF:F6:B1:1A (OUI DF-A9-FF)
        Count: 1
< ACL Data TX: Handle 2739 flags 0x00 dlen 21             #166 [hci1] 12.912071
      SMP: Pairing Random (0x04) len 16
        Random value: 23ac32ebbb5e14c8a6b9622f296d277f
> HCI Event: Number of Completed Packets (0x13) plen 5    #167 [hci1] 13.069753
        Num handles: 1
        Handle: 2739 Address: DF:A9:FF:F6:B1:1A (OUI DF-A9-FF)
        Count: 1
        #166: len 21 (1 Kb/s)
        Latency: 157 msec (65-173 msec ~160 msec)
> ACL Data RX: Handle 2739 flags 0x02 dlen 21             #168 [hci1] 13.157592
      SMP: Pairing Confirm (0x03) len 16
        Confim value: 55e4f860bf6c8fedeb846fb83205da3b
< HCI Command: Host Number of Com.. (0x03|0x0035) plen 5  #169 [hci1] 13.171560
        Num handles: 1
        Handle: 2739 Address: DF:A9:FF:F6:B1:1A (OUI DF-A9-FF)
        Count: 1
< ACL Data TX: Handle 2739 flags 0x00 dlen 21             #170 [hci1] 13.171661
      SMP: Pairing Confirm (0x03) len 16
        Confim value: e2d573116fe4c0b7d5e85dda7eeab266
> HCI Event: Number of Completed Packets (0x13) plen 5    #171 [hci1] 13.332452
        Num handles: 1
        Handle: 2739 Address: DF:A9:FF:F6:B1:1A (OUI DF-A9-FF)
        Count: 1
        #170: len 21 (1 Kb/s)
        Latency: 160 msec (65-173 msec ~160 msec)
> ACL Data RX: Handle 2739 flags 0x02 dlen 21             #172 [hci1] 13.332817
      SMP: Pairing Random (0x04) len 16
        Random value: 4d2a90926fc0e5750000000000000000
< HCI Command: Host Number of Com.. (0x03|0x0035) plen 5  #173 [hci1] 13.351876
        Num handles: 1
        Handle: 2739 Address: DF:A9:FF:F6:B1:1A (OUI DF-A9-FF)
        Count: 1
< ACL Data TX: Handle 2739 flags 0x00 dlen 21             #174 [hci1] 13.352032
      SMP: Pairing Random (0x04) len 16
        Random value: 297efe85e67448a15f56bd27e3a3cf1d
> HCI Event: Number of Completed Packets (0x13) plen 5    #175 [hci1] 13.507238
        Num handles: 1
        Handle: 2739 Address: DF:A9:FF:F6:B1:1A (OUI DF-A9-FF)
        Count: 1
        #174: len 21 (1 Kb/s)
        Latency: 155 msec (65-173 msec ~157 msec)
> ACL Data RX: Handle 2739 flags 0x02 dlen 21             #176 [hci1] 13.595071
      SMP: Pairing Confirm (0x03) len 16
        Confim value: bd6aaf05d8ac0dc1964ad18da32e45cd
< HCI Command: Host Number of Com.. (0x03|0x0035) plen 5  #177 [hci1] 13.611422
        Num handles: 1
        Handle: 2739 Address: DF:A9:FF:F6:B1:1A (OUI DF-A9-FF)
        Count: 1
< ACL Data TX: Handle 2739 flags 0x00 dlen 21             #178 [hci1] 13.611584
      SMP: Pairing Confirm (0x03) len 16
        Confim value: 461f810ef6b7603e24742cb013714811
> HCI Event: Number of Completed Packets (0x13) plen 5    #179 [hci1] 13.770019
        Num handles: 1
        Handle: 2739 Address: DF:A9:FF:F6:B1:1A (OUI DF-A9-FF)
        Count: 1
        #178: len 21 (1 Kb/s)
        Latency: 158 msec (65-173 msec ~158 msec)
> ACL Data RX: Handle 2739 flags 0x02 dlen 21             #180 [hci1] 13.770373
      SMP: Pairing Random (0x04) len 16
        Random value: 076a0856a3982fca0000000000000000
< HCI Command: Host Number of Com.. (0x03|0x0035) plen 5  #181 [hci1] 13.771545
        Num handles: 1
        Handle: 2739 Address: DF:A9:FF:F6:B1:1A (OUI DF-A9-FF)
        Count: 1
< ACL Data TX: Handle 2739 flags 0x00 dlen 21             #182 [hci1] 13.771710
      SMP: Pairing Random (0x04) len 16
        Random value: 25a9493fd3ce4faf02be7293595bb7c6
> HCI Event: Number of Completed Packets (0x13) plen 5    #183 [hci1] 13.944732
        Num handles: 1
        Handle: 2739 Address: DF:A9:FF:F6:B1:1A (OUI DF-A9-FF)
        Count: 1
        #182: len 21 (0 Kb/s)
        Latency: 173 msec (65-173 msec ~165 msec)
> ACL Data RX: Handle 2739 flags 0x02 dlen 21             #184 [hci1] 14.032638
      SMP: Pairing Confirm (0x03) len 16
        Confim value: 504b1740afe96b81af139f1dedb057fe
< HCI Command: Host Number of Com.. (0x03|0x0035) plen 5  #185 [hci1] 14.051530
        Num handles: 1
        Handle: 2739 Address: DF:A9:FF:F6:B1:1A (OUI DF-A9-FF)
        Count: 1
< ACL Data TX: Handle 2739 flags 0x00 dlen 21             #186 [hci1] 14.051709
      SMP: Pairing Confirm (0x03) len 16
        Confim value: 0e3473077750ee656e38a0e9bd1cc325
> HCI Event: Number of Completed Packets (0x13) plen 5    #187 [hci1] 14.207513
        Num handles: 1
        Handle: 2739 Address: DF:A9:FF:F6:B1:1A (OUI DF-A9-FF)
        Count: 1
        #186: len 21 (1 Kb/s)
        Latency: 155 msec (65-173 msec ~160 msec)
> ACL Data RX: Handle 2739 flags 0x02 dlen 21             #188 [hci1] 14.207745
      SMP: Pairing Random (0x04) len 16
        Random value: d3d75da7137b72270000000000000000
< HCI Command: Host Number of Com.. (0x03|0x0035) plen 5  #189 [hci1] 14.211577
        Num handles: 1
        Handle: 2739 Address: DF:A9:FF:F6:B1:1A (OUI DF-A9-FF)
        Count: 1
< ACL Data TX: Handle 2739 flags 0x00 dlen 21             #190 [hci1] 14.211678
      SMP: Pairing Random (0x04) len 16
        Random value: 58f6b41f855a6f6c3560debd84e2affc
> HCI Event: Number of Completed Packets (0x13) plen 5    #191 [hci1] 14.382257
        Num handles: 1
        Handle: 2739 Address: DF:A9:FF:F6:B1:1A (OUI DF-A9-FF)
        Count: 1
        #190: len 21 (0 Kb/s)
        Latency: 170 msec (65-173 msec ~165 msec)
> ACL Data RX: Handle 2739 flags 0x02 dlen 21             #192 [hci1] 14.470060
      SMP: Pairing Confirm (0x03) len 16
        Confim value: ccbd2608a040363c4199cabb20e3b59e
< HCI Command: Host Number of Com.. (0x03|0x0035) plen 5  #193 [hci1] 14.471507
        Num handles: 1
        Handle: 2739 Address: DF:A9:FF:F6:B1:1A (OUI DF-A9-FF)
        Count: 1
< ACL Data TX: Handle 2739 flags 0x00 dlen 21             #194 [hci1] 14.471619
      SMP: Pairing Confirm (0x03) len 16
        Confim value: 172bfb91439fba1a7a38ffd8efa27943
> HCI Event: Number of Completed Packets (0x13) plen 5    #195 [hci1] 14.644947
        Num handles: 1
        Handle: 2739 Address: DF:A9:FF:F6:B1:1A (OUI DF-A9-FF)
        Count: 1
        #194: len 21 (0 Kb/s)
        Latency: 173 msec (65-173 msec ~169 msec)
> ACL Data RX: Handle 2739 flags 0x02 dlen 21             #196 [hci1] 14.645215
      SMP: Pairing Random (0x04) len 16
        Random value: ded252c5abaddc320000000000000000
< HCI Command: Host Number of Com.. (0x03|0x0035) plen 5  #197 [hci1] 14.651159
        Num handles: 1
        Handle: 2739 Address: DF:A9:FF:F6:B1:1A (OUI DF-A9-FF)
        Count: 1
< ACL Data TX: Handle 2739 flags 0x00 dlen 21             #198 [hci1] 14.651238
      SMP: Pairing Random (0x04) len 16
        Random value: b67e7216d5bf664139eda2b542549666
> HCI Event: Number of Completed Packets (0x13) plen 5    #199 [hci1] 14.819710
        Num handles: 1
        Handle: 2739 Address: DF:A9:FF:F6:B1:1A (OUI DF-A9-FF)
        Count: 1
        #198: len 21 (1 Kb/s)
        Latency: 168 msec (65-173 msec ~168 msec)
> ACL Data RX: Handle 2739 flags 0x02 dlen 21             #200 [hci1] 14.907618
      SMP: Pairing Confirm (0x03) len 16
        Confim value: 70e5f1bd0ec83d889108f4a0181dc4e5
< HCI Command: Host Number of Com.. (0x03|0x0035) plen 5  #201 [hci1] 14.910992
        Num handles: 1
        Handle: 2739 Address: DF:A9:FF:F6:B1:1A (OUI DF-A9-FF)
        Count: 1
< ACL Data TX: Handle 2739 flags 0x00 dlen 21             #202 [hci1] 14.911062
      SMP: Pairing Confirm (0x03) len 16
        Confim value: 62bfec58e371b95767101f27cec2f2d1
> HCI Event: Number of Completed Packets (0x13) plen 5    #203 [hci1] 15.082419
        Num handles: 1
        Handle: 2739 Address: DF:A9:FF:F6:B1:1A (OUI DF-A9-FF)
        Count: 1
        #202: len 21 (0 Kb/s)
        Latency: 171 msec (65-173 msec ~170 msec)
> ACL Data RX: Handle 2739 flags 0x02 dlen 21             #204 [hci1] 15.082746
      SMP: Pairing Random (0x04) len 16
        Random value: 285afe952542b8250000000000000000
< HCI Command: Host Number of Com.. (0x03|0x0035) plen 5  #205 [hci1] 15.091143
        Num handles: 1
        Handle: 2739 Address: DF:A9:FF:F6:B1:1A (OUI DF-A9-FF)
        Count: 1
< ACL Data TX: Handle 2739 flags 0x00 dlen 21             #206 [hci1] 15.091206
      SMP: Pairing Random (0x04) len 16
        Random value: ed17f76500c95219dd01e09d1e63f87b
> HCI Event: Number of Completed Packets (0x13) plen 5    #207 [hci1] 15.257169
        Num handles: 1
        Handle: 2739 Address: DF:A9:FF:F6:B1:1A (OUI DF-A9-FF)
        Count: 1
        #206: len 21 (1 Kb/s)
        Latency: 165 msec (65-173 msec ~168 msec)
> ACL Data RX: Handle 2739 flags 0x02 dlen 21             #208 [hci1] 15.345133
      SMP: Pairing Confirm (0x03) len 16
        Confim value: af578a60897ad74119b1dd77c8acaf8c
< HCI Command: Host Number of Com.. (0x03|0x0035) plen 5  #209 [hci1] 15.351464
        Num handles: 1
        Handle: 2739 Address: DF:A9:FF:F6:B1:1A (OUI DF-A9-FF)
        Count: 1
< ACL Data TX: Handle 2739 flags 0x00 dlen 21             #210 [hci1] 15.351629
      SMP: Pairing Confirm (0x03) len 16
        Confim value: db07cb2517d22b8c2646075c473e969d
> HCI Event: Number of Completed Packets (0x13) plen 5    #211 [hci1] 15.519932
        Num handles: 1
        Handle: 2739 Address: DF:A9:FF:F6:B1:1A (OUI DF-A9-FF)
        Count: 1
        #210: len 21 (1 Kb/s)
        Latency: 168 msec (65-173 msec ~168 msec)
> ACL Data RX: Handle 2739 flags 0x02 dlen 21             #212 [hci1] 15.520288
      SMP: Pairing Random (0x04) len 16
        Random value: 0ca7418dd685e6550000000000000000
< HCI Command: Host Number of Com.. (0x03|0x0035) plen 5  #213 [hci1] 15.531832
        Num handles: 1
        Handle: 2739 Address: DF:A9:FF:F6:B1:1A (OUI DF-A9-FF)
        Count: 1
< ACL Data TX: Handle 2739 flags 0x00 dlen 21             #214 [hci1] 15.532003
      SMP: Pairing Random (0x04) len 16
        Random value: 81d35d47e1f6006d79c974bd9d9e1ee3
> HCI Event: Number of Completed Packets (0x13) plen 5    #215 [hci1] 15.694740
        Num handles: 1
        Handle: 2739 Address: DF:A9:FF:F6:B1:1A (OUI DF-A9-FF)
        Count: 1
        #214: len 21 (1 Kb/s)
        Latency: 162 msec (65-173 msec ~165 msec)
> ACL Data RX: Handle 2739 flags 0x02 dlen 21             #216 [hci1] 15.782559
      SMP: Pairing Confirm (0x03) len 16
        Confim value: 733b73dc99b07389b087f701419e0a6d
< HCI Command: Host Number of Com.. (0x03|0x0035) plen 5  #217 [hci1] 15.791151
        Num handles: 1
        Handle: 2739 Address: DF:A9:FF:F6:B1:1A (OUI DF-A9-FF)
        Count: 1
< ACL Data TX: Handle 2739 flags 0x00 dlen 21             #218 [hci1] 15.791239
      SMP: Pairing Confirm (0x03) len 16
        Confim value: cb93c2a6ba5a98f430c7eac855104fd7
> HCI Event: Number of Completed Packets (0x13) plen 5    #219 [hci1] 15.957384
        Num handles: 1
        Handle: 2739 Address: DF:A9:FF:F6:B1:1A (OUI DF-A9-FF)
        Count: 1
        #218: len 21 (1 Kb/s)
        Latency: 166 msec (65-173 msec ~165 msec)
> ACL Data RX: Handle 2739 flags 0x02 dlen 21             #220 [hci1] 15.957708
      SMP: Pairing Random (0x04) len 16
        Random value: 5a395bda67518a490000000000000000
< HCI Command: Host Number of Com.. (0x03|0x0035) plen 5  #221 [hci1] 15.971821
        Num handles: 1
        Handle: 2739 Address: DF:A9:FF:F6:B1:1A (OUI DF-A9-FF)
        Count: 1
< ACL Data TX: Handle 2739 flags 0x00 dlen 21             #222 [hci1] 15.971983
      SMP: Pairing Random (0x04) len 16
        Random value: e7f7e0c2476823e41736a7e381bafb7c
> HCI Event: Number of Completed Packets (0x13) plen 5    #223 [hci1] 16.132166
        Num handles: 1
        Handle: 2739 Address: DF:A9:FF:F6:B1:1A (OUI DF-A9-FF)
        Count: 1
        #222: len 21 (1 Kb/s)
        Latency: 160 msec (65-173 msec ~162 msec)
> ACL Data RX: Handle 2739 flags 0x02 dlen 21             #224 [hci1] 16.220064
      SMP: Pairing Confirm (0x03) len 16
        Confim value: 6f42b9426d108f972ef2dd01fef0c0a7
< HCI Command: Host Number of Com.. (0x03|0x0035) plen 5  #225 [hci1] 16.231516
        Num handles: 1
        Handle: 2739 Address: DF:A9:FF:F6:B1:1A (OUI DF-A9-FF)
        Count: 1
< ACL Data TX: Handle 2739 flags 0x00 dlen 21             #226 [hci1] 16.231671
      SMP: Pairing Confirm (0x03) len 16
        Confim value: 95b85b3f6b79ae2b0b67eb5c1c459b86
> HCI Event: Number of Completed Packets (0x13) plen 5    #227 [hci1] 16.394879
        Num handles: 1
        Handle: 2739 Address: DF:A9:FF:F6:B1:1A (OUI DF-A9-FF)
        Count: 1
        #226: len 21 (1 Kb/s)
        Latency: 163 msec (65-173 msec ~163 msec)
> ACL Data RX: Handle 2739 flags 0x02 dlen 21             #228 [hci1] 16.395227
      SMP: Pairing Random (0x04) len 16
        Random value: 36a893165cfa09db0000000000000000
