Bluetooth monitor ver 5.84
btmon[1300812]: = Note: Linux version 6.8.0-83-generic (x86_64)                                                          0.728678
btmon[1300812]: = Note: Bluetooth subsystem version 2.22                                                                 0.728680
= New Index: 00:00:00:00:00:00 (Primary,UART,hci0)                                                                       0.728681
= Open Index: 00:00:00:00:00:00                                                                                          1.232982
= Index Info: 00:00:00:00:00:00 (Nordic Semiconductor ASA)                                                               1.232998
zephyr.exe[1300814]: @ USER Open: main (privileged) version 2.22                                                {0x0001} 1.233002
zephyr.exe[1300814]: < HCI Command: Reset (0x03|0x0003) plen 0                                                        #1 1.233150
> HCI Event: Command Complete (0x0e) plen 4                                                                           #2 1.233754
      Reset (0x03|0x0003) ncmd 1
        Status: Success (0x00)
zephyr.exe[1300814]: < HCI Command: Read Local Supported Features (0x04|0x0003) plen 0                                #3 1.252998
> HCI Event: Command Complete (0x0e) plen 12                                                                          #4 1.253473
      Read Local Supported Features (0x04|0x0003) ncmd 1
        Status: Success (0x00)
        Features: 0x00 0x00 0x00 0x00 0x60 0x00 0x00 0x00
          BR/EDR Not Supported
          LE Supported (Controller)
zephyr.exe[1300814]: < HCI Command: Read Local Version Information (0x04|0x0001) plen 0                               #5 1.273029
> HCI Event: Command Complete (0x0e) plen 12                                                                          #6 1.273612
      Read Local Version Information (0x04|0x0001) ncmd 1
        Status: Success (0x00)
        HCI version: Reserved (0x0e) - Revision 12520 (0x30e8)
        LMP version: Reserved (0x0e) - Subversion 12520 (0x30e8)
        Manufacturer: Nordic Semiconductor ASA (89)
zephyr.exe[1300814]: < HCI Command: Read Local Supported Commands (0x04|0x0002) plen 0                                #7 1.293036
> HCI Event: Command Complete (0x0e) plen 68                                                                          #8 1.294116
      Read Local Supported Commands (0x04|0x0002) ncmd 1
        Status: Success (0x00)
        Commands: 119 entries
          Disconnect (Octet 0 - Bit 5)
          Read Remote Version Information (Octet 2 - Bit 7)
          Set Event Mask (Octet 5 - Bit 6)
          Reset (Octet 5 - Bit 7)
          Read Connection Accept Timeout (Octet 7 - Bit 2)
          Write Connection Accept Timeout (Octet 7 - Bit 3)
          Read Transmit Power Level (Octet 10 - Bit 2)
          Set Controller To Host Flow Control (Octet 10 - Bit 5)
          Host Buffer Size (Octet 10 - Bit 6)
          Host Number of Completed Packets (Octet 10 - Bit 7)
          Read Local Version Information (Octet 14 - Bit 3)
          Read Local Supported Features (Octet 14 - Bit 5)
          Read BD ADDR (Octet 15 - Bit 1)
          Read RSSI (Octet 15 - Bit 5)
          Set Event Mask Page 2 (Octet 22 - Bit 2)
          LE Set Event Mask (Octet 25 - Bit 0)
          LE Read Buffer Size (Octet 25 - Bit 1)
          LE Read Local Supported Features (Octet 25 - Bit 2)
          LE Set Random Address (Octet 25 - Bit 4)
          LE Set Advertising Parameters (Octet 25 - Bit 5)
          LE Read Advertising Channel TX Power (Octet 25 - Bit 6)
          LE Set Advertising Data (Octet 25 - Bit 7)
          LE Set Scan Response Data (Octet 26 - Bit 0)
          LE Set Advertise Enable (Octet 26 - Bit 1)
          LE Set Scan Parameters (Octet 26 - Bit 2)
          LE Set Scan Enable (Octet 26 - Bit 3)
          LE Create Connection (Octet 26 - Bit 4)
          LE Create Connection Cancel (Octet 26 - Bit 5)
          LE Read Accept List Size (Octet 26 - Bit 6)
          LE Clear Accept List (Octet 26 - Bit 7)
          LE Add Device To Accept List (Octet 27 - Bit 0)
          LE Remove Device From Accept List (Octet 27 - Bit 1)
          LE Connection Update (Octet 27 - Bit 2)
          LE Set Host Channel Classification (Octet 27 - Bit 3)
          LE Read Channel Map (Octet 27 - Bit 4)
          LE Read Remote Used Features (Octet 27 - Bit 5)
          LE Encrypt (Octet 27 - Bit 6)
          LE Rand (Octet 27 - Bit 7)
          LE Start Encryption (Octet 28 - Bit 0)
          LE Long Term Key Request Reply (Octet 28 - Bit 1)
          LE Long Term Key Request Neg Reply (Octet 28 - Bit 2)
          LE Read Supported States (Octet 28 - Bit 3)
          LE Receiver Test (Octet 28 - Bit 4)
          LE Transmitter Test (Octet 28 - Bit 5)
          LE Test End (Octet 28 - Bit 6)
          Read Authenticated Payload Timeout (Octet 32 - Bit 4)
          Write Authenticated Payload Timeout (Octet 32 - Bit 5)
          LE Set Data Length (Octet 33 - Bit 6)
          LE Read Suggested Default Data Length (Octet 33 - Bit 7)
          LE Write Suggested Default Data Length (Octet 34 - Bit 0)
          LE Add Device To Resolving List (Octet 34 - Bit 3)
          LE Remove Device From Resolving List (Octet 34 - Bit 4)
          LE Clear Resolving List (Octet 34 - Bit 5)
          LE Read Resolving List Size (Octet 34 - Bit 6)
          LE Set Address Resolution Enable (Octet 35 - Bit 1)
          LE Set Resolvable Private Address Timeout (Octet 35 - Bit 2)
          LE Read Maximum Data Length (Octet 35 - Bit 3)
          LE Read PHY (Octet 35 - Bit 4)
          LE Set Default PHY (Octet 35 - Bit 5)
          LE Set PHY (Octet 35 - Bit 6)
          LE Enhanced Receiver Test (Octet 35 - Bit 7)
          LE Enhanced Transmitter Test (Octet 36 - Bit 0)
          LE Set Advertising Set Random Address (Octet 36 - Bit 1)
          LE Set Extended Advertising Parameters (Octet 36 - Bit 2)
          LE Set Extended Advertising Data (Octet 36 - Bit 3)
          LE Set Extended Scan Response Data (Octet 36 - Bit 4)
          LE Set Extended Advertising Enable (Octet 36 - Bit 5)
          LE Read Maximum Advertising Data Length (Octet 36 - Bit 6)
          LE Read Number of Supported Advertising Sets (Octet 36 - Bit 7)
          LE Remove Advertising Set (Octet 37 - Bit 0)
          LE Clear Advertising Sets (Octet 37 - Bit 1)
          LE Set Periodic Advertising Parameters (Octet 37 - Bit 2)
          LE Set Periodic Advertising Data (Octet 37 - Bit 3)
          LE Set Periodic Advertising Enable (Octet 37 - Bit 4)
          LE Set Extended Scan Parameters (Octet 37 - Bit 5)
          LE Set Extended Scan Enable (Octet 37 - Bit 6)
          LE Extended Create Connection (Octet 37 - Bit 7)
          LE Periodic Advertising Create Sync (Octet 38 - Bit 0)
          LE Periodic Advertising Create Sync Cancel (Octet 38 - Bit 1)
          LE Periodic Advertising Terminate Sync (Octet 38 - Bit 2)
          LE Add Device To Periodic Advertiser List (Octet 38 - Bit 3)
          LE Remove Device From Periodic Advertiser List (Octet 38 - Bit 4)
          LE Clear Periodic Advertiser List (Octet 38 - Bit 5)
          LE Read Periodic Advertiser List Size (Octet 38 - Bit 6)
          LE Read Transmit Power (Octet 38 - Bit 7)
          LE Read RF Path Compensation (Octet 39 - Bit 0)
          LE Write RF Path Compensation (Octet 39 - Bit 1)
          LE Set Privacy Mode (Octet 39 - Bit 2)
          LE Periodic Advertising Receive Enable (Octet 40 - Bit 5)
          LE Periodic Advertising Sync Transfer (Octet 40 - Bit 6)
          LE Periodic Advertising Set Info Transfer (Octet 40 - Bit 7)
          LE Periodic Advertising Sync Transfer Parameters (Octet 41 - Bit 0)
          LE Set Default Periodic Advertisng Sync Transfer Parameters (Octet 41 - Bit 1)
          LE Read Buffer v2 (Octet 41 - Bit 5)
          LE Read ISO TX Sync (Octet 41 - Bit 6)
          LE Set Connected Isochronous Group Parameters (Octet 41 - Bit 7)
          LE Set Connected Isochronous Group Parameters Test (Octet 42 - Bit 0)
          LE Create Connected Isochronous Stream (Octet 42 - Bit 1)
          LE Remove Connected Isochronous Group (Octet 42 - Bit 2)
          LE Accept Connected Isochronous Stream Request (Octet 42 - Bit 3)
          LE Reject Connected Isochronous Stream Request (Octet 42 - Bit 4)
          LE Create Broadcast Isochronous Group (Octet 42 - Bit 5)
          LE Create Broadcast Isochronous Group Test (Octet 42 - Bit 6)
          LE Terminate Broadcast Isochronous Group (Octet 42 - Bit 7)
          LE Broadcast Isochronous Group Create Sync (Octet 43 - Bit 0)
          LE Broadcast Isochronous Group Terminate Sync (Octet 43 - Bit 1)
          LE Request Peer SCA (Octet 43 - Bit 2)
          LE Setup Isochronous Data Path (Octet 43 - Bit 3)
          LE Remove Isochronous Data Path (Octet 43 - Bit 4)
          LE Isochronous Transmit Test (Octet 43 - Bit 5)
          LE Isochronous Receive Test (Octet 43 - Bit 6)
          LE Isochronous Read Test Counters (Octet 43 - Bit 7)
          LE Isochronous Read Test Counters (Octet 44 - Bit 0)
          LE Set Host Feature (Octet 44 - Bit 1)
          LE Read ISO link quality (Octet 44 - Bit 2)
          Octet 45 - Bit 6 
          Octet 46 - Bit 0 
          Octet 46 - Bit 1 
          Octet 46 - Bit 2 
zephyr.exe[1300814]: < HCI Command: Host Buffer Size (0x03|0x0033) plen 7                                             #9 1.313007
        ACL MTU: 255  ACL max packet: 16
        SCO MTU: 0    SCO max packet: 0
> HCI Event: Command Complete (0x0e) plen 4                                                                          #10 1.313534
      Host Buffer Size (0x03|0x0033) ncmd 1
        Status: Success (0x00)
zephyr.exe[1300814]: < HCI Command: Set Controller To Host Flow Control (0x03|0x0031) plen 1                         #11 1.333043
        Flow control: ACL Data Packets (0x01)
> HCI Event: Command Complete (0x0e) plen 4                                                                          #12 1.333568
      Set Controller To Host Flow Control (0x03|0x0031) ncmd 1
        Status: Success (0x00)
zephyr.exe[1300814]: < HCI Command: LE Read Local Supported Features (0x08|0x0003) plen 0                            #13 1.353040
> HCI Event: Command Complete (0x0e) plen 12                                                                         #14 1.353543
      LE Read Local Supported Features (0x08|0x0003) ncmd 1
        Status: Success (0x00)
        Features: 0xfd 0x79 0x00 0xf7 0x30 0x01 0x00 0x00
          LE Encryption
          Extended Reject Indication
          Peripheral-initiated Features Exchange
          LE Ping
          LE Data Packet Length Extension
          LL Privacy
          Extended Scanner Filter Policies
          LE 2M PHY
          LE Coded PHY
          LE Extended Advertising
          LE Periodic Advertising
          Channel Selection Algorithm #2
          Periodic Advertising Sync Transfer - Sender
          Periodic Advertising Sync Transfer - Recipient
          Sleep Clock Accuracy Updates
          Connected Isochronous Stream - Central
          Connected Isochronous Stream - Peripheral
          Isochronous Broadcaster
          Synchronized Receiver
          Periodic Advertising ADI support
          Connection Subrating
          Unknown features (0x0000010000000000)
zephyr.exe[1300814]: < HCI Command: LE Set Host Feature (0x08|0x0074) plen 2                                         #15 1.373040
        Bit Number: 32
          Connected Isochronous Stream (Host Support)
        Bit Value: 1
> HCI Event: Command Complete (0x0e) plen 4                                                                          #16 1.373513
      LE Set Host Feature (0x08|0x0074) ncmd 1
        Status: Success (0x00)
zephyr.exe[1300814]: < HCI Command: LE Read Buffer v2 (0x08|0x0060) plen 0                                           #17 1.393006
> HCI Event: Command Complete (0x0e) plen 10                                                                         #18 1.393535
      LE Read Buffer v2 (0x08|0x0060) ncmd 1
        Status: Success (0x00)
        ACL MTU: 27
        ACL max packet: 3
        ISO MTU: 318
        ISO max packet: 3
zephyr.exe[1300814]: < HCI Command: LE Read Maximum Advertising Data Length (0x08|0x003a) plen 0                     #19 1.413061
> HCI Event: Command Complete (0x0e) plen 6                                                                          #20 1.413622
      LE Read Maximum Advertising Data Length (0x08|0x003a) ncmd 1
        Status: Success (0x00)
        Max length: 1650
zephyr.exe[1300814]: < HCI Command: LE Read Supported States (0x08|0x001c) plen 0                                    #21 1.433003
> HCI Event: Command Complete (0x0e) plen 12                                                                         #22 1.433494
      LE Read Supported States (0x08|0x001c) ncmd 1
        Status: Success (0x00)
        States: 0x000003ff3e0306ff
          Non-connectable Advertising State
          Scannable Advertising State
          Connectable Advertising State
          High Duty Cycle Directed Advertising State
          Passive Scanning State
          Active Scanning State
          Initiating State
            and Connection State (Central Role)
          Connection State (Peripheral Role)
          Scannable Advertising State
            and Passive Scanning State
          Connectable Advertising State
            and Passive Scanning State
          Non-connectable Advertising State
            and Initiating State
          Scannable Advertising State
            and Initiating State
          Active Scanning State
            and Connection State (Central Role)
          Passive Scanning State
            and Connection State (Peripheral Role)
          Active Scanning State
            and Connection State (Peripheral Role)
          Initiating State
            and Connection State (Central Role)
            and Central Role & Central Role
          Low Duty Cycle Directed Advertising State
          Connectable Advertising State
            and Initiating State
            and Central Role & Peripheral Role
          High Duty Cycle Directed Advertising State
            and Initiating State
            and Central Role & Peripheral Role
          Low Duty Cycle Directed Advertising State
            and Initiating State
            and Central Role & Peripheral Role
          Connectable Advertising State
            and Connection State (Central Role)
            and Central Role & Peripheral Role
          High Duty Cycle Directed Advertising State
            and Connection State (Central Role)
            and Central Role & Peripheral Role
          Low Duty Cycle Directed Advertising State
            and Connection State (Central Role)
            and Central Role & Peripheral Role
          Connectable Advertising State
            and Connection State (Peripheral Role)
            and Central Role & Peripheral Role
          High Duty Cycle Directed Advertising State
            and Connection State (Peripheral Role)
            and Peripheral Role & Peripheral Role
          Low Duty Cycle Directed Advertising State
            and Connection State (Peripheral Role)
            and Peripheral Role & Peripheral Role
          Initiating State
            and Connection State (Peripheral Role)
            and Central Role & Peripheral Role
zephyr.exe[1300814]: < HCI Command: LE Read Maximum Data Length (0x08|0x002f) plen 0                                 #23 1.453005
> HCI Event: Command Complete (0x0e) plen 12                                                                         #24 1.453568
      LE Read Maximum Data Length (0x08|0x002f) ncmd 1
        Status: Success (0x00)
        Max TX octets: 251
        Max TX time: 2704
        Max RX octets: 251
        Max RX time: 2704
zephyr.exe[1300814]: < HCI Command: LE Write Suggested Default Data Length (0x08|0x0024) plen 4                      #25 1.473039
        TX octets: 251
        TX time: 2704
> HCI Event: Command Complete (0x0e) plen 4                                                                          #26 1.473570
      LE Write Suggested Default Data Length (0x08|0x0024) ncmd 1
        Status: Success (0x00)
zephyr.exe[1300814]: < HCI Command: LE Read Resolving List Size (0x08|0x002a) plen 0                                 #27 1.493011
> HCI Event: Command Complete (0x0e) plen 5                                                                          #28 1.493558
      LE Read Resolving List Size (0x08|0x002a) ncmd 1
        Status: Success (0x00)
        Size: 8
zephyr.exe[1300814]: < HCI Command: LE Set Event Mask (0x08|0x0001) plen 8                                           #29 1.513035
        Mask: 0x000002023f87fa5e
          LE Advertising Report
          LE Connection Update Complete
          LE Read Remote Used Features Complete
          LE Long Term Key Request
          LE Data Length Change
          LE Enhanced Connection Complete
          LE PHY Update Complete
          LE Extended Advertising Report
          LE Periodic Advertising Sync Established
          LE Periodic Advertising Report
          LE Periodic Advertising Sync Lost
          LE Extended Scan Timeout
          LE Extended Advertising Set Terminated
          LE Scan Request Received
          LE Periodic Advertising Sync Transfer Rvc
          LE CIS Established
          LE CIS Request
          LE Create BIG Complete
          LE Terminate BIG Complete
          LE BIG Sync Established Complete
          LE BIG Sync Lost
          LE BIG Info Advertising Report
          Unknown mask (0x0000020000000000)
> HCI Event: Command Complete (0x0e) plen 4                                                                          #30 1.513549
      LE Set Event Mask (0x08|0x0001) ncmd 1
        Status: Success (0x00)
zephyr.exe[1300814]: < HCI Command: Set Event Mask (0x03|0x0001) plen 8                                              #31 1.533005
        Mask: 0x2000800002008890
          Disconnection Complete
          Encryption Change
          Read Remote Version Information Complete
          Hardware Error
          Data Buffer Overflow
          Encryption Key Refresh Complete
          LE Meta
> HCI Event: Command Complete (0x0e) plen 4                                                                          #32 1.533637
      Set Event Mask (0x03|0x0001) ncmd 1
        Status: Success (0x00)
zephyr.exe[1300814]: < HCI Command: Read BD ADDR (0x04|0x0009) plen 0                                                #33 1.553037
> HCI Event: Command Complete (0x0e) plen 10                                                                         #34 1.553451
      Read BD ADDR (0x04|0x0009) ncmd 1
        Status: Success (0x00)
        Address: 00:00:00:00:00:00 (OUI 00-00-00)
zephyr.exe[1300814]: < HCI Command: LE Set Random Address (0x08|0x0005) plen 6                                       #35 1.573060
        Address: D5:B6:CC:31:DB:3B (Static)
> HCI Event: Command Complete (0x0e) plen 4                                                                          #36 1.573518
      LE Set Random Address (0x08|0x0005) ncmd 1
        Status: Success (0x00)
zephyr.exe[1300814]: < HCI Command: LE Set Extended Advertising Parameters (0x08|0x0036) plen 25                     #37 8.422997
        Handle: 0x00
        Properties: 0x0013
          Connectable
          Scannable
          Use legacy advertising PDUs: ADV_IND
        Min advertising interval: 100.000 msec (0x00a0)
        Max advertising interval: 150.000 msec (0x00f0)
        Channel map: 37, 38, 39 (0x07)
        Own address type: Random (0x01)
        Peer address type: Public (0x00)
        Peer address: 00:00:00:00:00:00 (OUI 00-00-00)
        Filter policy: Allow Scan Request from Any, Allow Connect Request from Any (0x00)
        TX power: Host has no preference (0x7f)
        Primary PHY: LE 1M (0x01)
        Secondary max skip: 0x00
        Secondary PHY: LE 1M (0x01)
        SID: 0x00
        Scan request notifications: Disabled (0x00)
> HCI Event: Command Complete (0x0e) plen 5                                                                          #38 8.423780
      LE Set Extended Advertising Parameters (0x08|0x0036) ncmd 1
        Status: Success (0x00)
        TX power (selected): 0 dbm (0x00)
zephyr.exe[1300814]: < HCI Command: LE Set Advertising Set Random Address (0x08|0x0035) plen 7                       #39 8.433000
        Advertising handle: 0x00
        Advertising random address: D5:B6:CC:31:DB:3B (Static)
> HCI Event: Command Complete (0x0e) plen 4                                                                          #40 8.433489
      LE Set Advertising Set Random Address (0x08|0x0035) ncmd 1
        Status: Success (0x00)
zephyr.exe[1300814]: < HCI Command: LE Set Extended Advertising Data (0x08|0x0037) plen 22                           #41 8.453011
        Handle: 0x00
        Operation: Complete extended advertising data (0x03)
        Fragment preference: Minimize fragmentation (0x01)
        Data length: 0x12
        Flags: 0x06
          LE General Discoverable Mode
          BR/EDR Not Supported
        Name (complete): Tester_2CB6EE
> HCI Event: Command Complete (0x0e) plen 4                                                                          #42 8.453826
      LE Set Extended Advertising Data (0x08|0x0037) ncmd 1
        Status: Success (0x00)
zephyr.exe[1300814]: < HCI Command: LE Set Extended Scan Response Data (0x08|0x0038) plen 4                          #43 8.473024
        Handle: 0x00
        Operation: Complete scan response data (0x03)
        Fragment preference: Minimize fragmentation (0x01)
        Data length: 0x00
> HCI Event: Command Complete (0x0e) plen 4                                                                          #44 8.473535
      LE Set Extended Scan Response Data (0x08|0x0038) ncmd 1
        Status: Success (0x00)
zephyr.exe[1300814]: < HCI Command: LE Set Extended Advertising Enable (0x08|0x0039) plen 6                          #45 8.493001
        Extended advertising: Enabled (0x01)
        Number of sets: 1 (0x01)
        Entry 0
          Handle: 0x00
          Duration: 0 ms (0x00)
          Max ext adv events: 0
> HCI Event: Command Complete (0x0e) plen 4                                                                          #46 8.493627
      LE Set Extended Advertising Enable (0x08|0x0039) ncmd 1
        Status: Success (0x00)
> HCI Event: LE Meta Event (0x3e) plen 31                                                                            #47 9.017511
      LE Enhanced Connection Complete (0x0a)
        Status: Success (0x00)
        Handle: 201
        Role: Peripheral (0x01)
        Peer address type: Public (0x00)
        Peer address: C0:07:E8:2C:B6:EE (OUI C0-07-E8)
        Local resolvable private address: 00:00:00:00:00:00 (Non-Resolvable)
        Peer resolvable private address: 00:00:00:00:00:00 (Non-Resolvable)
        Connection interval: 62.50 msec (0x0032)
        Connection latency: 0 (0x0000)
        Supervision timeout: 20000 msec (0x07d0)
        Central clock accuracy: 0x07
> HCI Event: LE Meta Event (0x3e) plen 6                                                                             #48 9.017632
      LE Advertising Set Terminated (0x12)
        Status: Success (0x00)
        Handle: 0
        Connection handle: 201
        Number of completed extended advertising events: 0
zephyr.exe[1300814]: < HCI Command: LE Read Remote Used Features (0x08|0x0016) plen 2                                #49 9.033109
        Handle: 201 Address: C0:07:E8:2C:B6:EE (OUI C0-07-E8)
> HCI Event: Command Status (0x0f) plen 4                                                                            #50 9.033610
      LE Read Remote Used Features (0x08|0x0016) ncmd 1
        Status: Success (0x00)
zephyr.exe[1300814]: < HCI Command: LE Set PHY (0x08|0x0032) plen 7                                                  #51 9.053015
        Handle: 201 Address: C0:07:E8:2C:B6:EE (OUI C0-07-E8)
        All PHYs preference: 0x00
        TX PHYs preference: 0x02
          LE 2M
        RX PHYs preference: 0x02
          LE 2M
        PHY options preference: Reserved (0x0000)
> HCI Event: Command Status (0x0f) plen 4                                                                            #52 9.053529
      LE Set PHY (0x08|0x0032) ncmd 1
        Status: Success (0x00)
> HCI Event: LE Meta Event (0x3e) plen 12                                                                            #53 9.206443
      LE Read Remote Used Features (0x04)
        Status: Success (0x00)
        Handle: 201 Address: C0:07:E8:2C:B6:EE (OUI C0-07-E8)
        Features: 0x2d 0x49 0x01 0xf7 0xef 0x39 0x00 0x80
          LE Encryption
          Extended Reject Indication
          Peripheral-initiated Features Exchange
          LE Data Packet Length Extension
          LE 2M PHY
          LE Coded PHY
          Channel Selection Algorithm #2
          Minimum Number of Used Channels Procedure
          Periodic Advertising Sync Transfer - Sender
          Periodic Advertising Sync Transfer - Recipient
          Sleep Clock Accuracy Updates
          Connected Isochronous Stream - Central
          Connected Isochronous Stream - Peripheral
          Isochronous Broadcaster
          Synchronized Receiver
          Connected Isochronous Stream (Host Support)
          LE Power Control Request
          LE Power Control Request
          LE Path Loss Monitoring
          Connection Subrating
          Connection Subrating (Host Support)
          Channel Classification
          Unknown features (0x8000390000000000)
> HCI Event: LE Meta Event (0x3e) plen 6                                                                             #54 9.705728
      LE PHY Update Complete (0x0c)
        Status: Success (0x00)
        Handle: 201 Address: C0:07:E8:2C:B6:EE (OUI C0-07-E8)
        TX PHY: LE 2M (0x02)
        RX PHY: LE 2M (0x02)
> ACL Data RX: Handle 201 flags 0x02 dlen 11                                                                        #55 10.018645
      ATT: Read By Type Request (0x08) len 6
        Handle range: 0x0001-0xffff
        Attribute type: Characteristic (0x2803)
zephyr.exe[1300814]: < HCI Command: Host Number of Completed Packets (0x03|0x0035) plen 5                           #56 10.033082
        Num handles: 1
        Handle: 201 Address: C0:07:E8:2C:B6:EE (OUI C0-07-E8)
        Count: 1
zephyr.exe[1300814]: < ACL Data TX: Handle 201 [1/3] flags 0x00 dlen 20                                             #57 10.033092
      ATT: Read By Type Response (0x09) len 15
        Attribute data length: 7
        Attribute data list: 2 entries
        Handle: 0x0002
        Value[5]: 200300052a
            Properties: 0x20
              Indicate (0x20)
            Value Handle: 0x0003
            Value UUID: Service Changed (0x2a05)
        Handle: 0x0005
        Value[5]: 0a0600292b
            Properties: 0x0a
              Read (0x02)
              Write (0x08)
            Value Handle: 0x0006
            Value UUID: Client Supported Features (0x2b29)
> HCI Event: Number of Completed Packets (0x13) plen 5                                                              #58 10.143621
        Num handles: 1
        Handle: 201 Address: C0:07:E8:2C:B6:EE (OUI C0-07-E8)
        Count: 1
        Buffers: 0/3
        #57: len 20 (1 Kb/s)
        Latency: 110 msec (110-110 msec ~110 msec)
> ACL Data RX: Handle 201 flags 0x02 dlen 11                                                                        #59 10.143766
      ATT: Read By Type Request (0x08) len 6
        Handle range: 0x0006-0xffff
        Attribute type: Characteristic (0x2803)
zephyr.exe[1300814]: < HCI Command: Host Number of Completed Packets (0x03|0x0035) plen 5                           #60 10.153063
        Num handles: 1
        Handle: 201 Address: C0:07:E8:2C:B6:EE (OUI C0-07-E8)
        Count: 1
zephyr.exe[1300814]: < ACL Data TX: Handle 201 [1/3] flags 0x00 dlen 20                                             #61 10.153090
      ATT: Read By Type Response (0x09) len 15
        Attribute data length: 7
        Attribute data list: 2 entries
        Handle: 0x0007
        Value[5]: 0208002a2b
            Properties: 0x02
              Read (0x02)
            Value Handle: 0x0008
            Value UUID: Database Hash (0x2b2a)
        Handle: 0x0009
        Value[5]: 020a003a2b
            Properties: 0x02
              Read (0x02)
            Value Handle: 0x000a
            Value UUID: Server Supported Features (0x2b3a)
> HCI Event: Number of Completed Packets (0x13) plen 5                                                              #62 10.268617
        Num handles: 1
        Handle: 201 Address: C0:07:E8:2C:B6:EE (OUI C0-07-E8)
        Count: 1
        Buffers: 0/3
        #61: len 20 (1 Kb/s)
        Latency: 115 msec (110-115 msec ~113 msec)
> ACL Data RX: Handle 201 flags 0x02 dlen 11                                                                        #63 10.268760
      ATT: Read By Type Request (0x08) len 6
        Handle range: 0x000a-0xffff
        Attribute type: Characteristic (0x2803)
zephyr.exe[1300814]: < HCI Command: Host Number of Completed Packets (0x03|0x0035) plen 5                           #64 10.273065
        Num handles: 1
        Handle: 201 Address: C0:07:E8:2C:B6:EE (OUI C0-07-E8)
        Count: 1
zephyr.exe[1300814]: < ACL Data TX: Handle 201 [1/3] flags 0x00 dlen 20                                             #65 10.273104
      ATT: Read By Type Response (0x09) len 15
        Attribute data length: 7
        Attribute data list: 2 entries
        Handle: 0x000c
        Value[5]: 0a0d00002a
            Properties: 0x0a
              Read (0x02)
              Write (0x08)
            Value Handle: 0x000d
            Value UUID: Device Name (0x2a00)
        Handle: 0x000e
        Value[5]: 0a0f00012a
            Properties: 0x0a
              Read (0x02)
              Write (0x08)
            Value Handle: 0x000f
            Value UUID: Appearance (0x2a01)
> HCI Event: Number of Completed Packets (0x13) plen 5                                                              #66 10.393571
        Num handles: 1
        Handle: 201 Address: C0:07:E8:2C:B6:EE (OUI C0-07-E8)
        Count: 1
        Buffers: 0/3
        #65: len 20 (1 Kb/s)
        Latency: 120 msec (110-120 msec ~116 msec)
> ACL Data RX: Handle 201 flags 0x02 dlen 11                                                                        #67 10.393817
      ATT: Read By Type Request (0x08) len 6
        Handle range: 0x000f-0xffff
        Attribute type: Characteristic (0x2803)
zephyr.exe[1300814]: < HCI Command: Host Number of Completed Packets (0x03|0x0035) plen 5                           #68 10.413057
        Num handles: 1
        Handle: 201 Address: C0:07:E8:2C:B6:EE (OUI C0-07-E8)
        Count: 1
zephyr.exe[1300814]: < ACL Data TX: Handle 201 [1/3] flags 0x00 dlen 20                                             #69 10.413091
      ATT: Read By Type Response (0x09) len 15
        Attribute data length: 7
        Attribute data list: 2 entries
        Handle: 0x0010
        Value[5]: 021100042a
            Properties: 0x02
              Read (0x02)
            Value Handle: 0x0011
            Value UUID: Peripheral Preferred Connection Parameters (0x2a04)
        Handle: 0x0013
        Value[5]: 021400242a
            Properties: 0x02
              Read (0x02)
            Value Handle: 0x0014
            Value UUID: Model Number String (0x2a24)
> HCI Event: Number of Completed Packets (0x13) plen 5                                                              #70 10.518591
        Num handles: 1
        Handle: 201 Address: C0:07:E8:2C:B6:EE (OUI C0-07-E8)
        Count: 1
        Buffers: 0/3
        #69: len 20 (1 Kb/s)
        Latency: 105 msec (105-120 msec ~111 msec)
> ACL Data RX: Handle 201 flags 0x02 dlen 11                                                                        #71 10.518721
      ATT: Read By Type Request (0x08) len 6
        Handle range: 0x0014-0xffff
        Attribute type: Characteristic (0x2803)
zephyr.exe[1300814]: < HCI Command: Host Number of Completed Packets (0x03|0x0035) plen 5                           #72 10.533180
        Num handles: 1
        Handle: 201 Address: C0:07:E8:2C:B6:EE (OUI C0-07-E8)
        Count: 1
zephyr.exe[1300814]: < ACL Data TX: Handle 201 [1/3] flags 0x00 dlen 20                                             #73 10.533340
      ATT: Read By Type Response (0x09) len 15
        Attribute data length: 7
        Attribute data list: 2 entries
        Handle: 0x0015
        Value[5]: 021600292a
            Properties: 0x02
              Read (0x02)
            Value Handle: 0x0016
            Value UUID: Manufacturer Name String (0x2a29)
        Handle: 0x0017
        Value[5]: 021800502a
            Properties: 0x02
              Read (0x02)
            Value Handle: 0x0018
            Value UUID: PnP ID (0x2a50)
> HCI Event: Number of Completed Packets (0x13) plen 5                                                              #74 10.643540
        Num handles: 1
        Handle: 201 Address: C0:07:E8:2C:B6:EE (OUI C0-07-E8)
        Count: 1
        Buffers: 0/3
        #73: len 20 (1 Kb/s)
        Latency: 110 msec (105-120 msec ~110 msec)
> ACL Data RX: Handle 201 flags 0x02 dlen 11                                                                        #75 10.643752
      ATT: Read By Type Request (0x08) len 6
        Handle range: 0x0018-0xffff
        Attribute type: Characteristic (0x2803)
zephyr.exe[1300814]: < HCI Command: Host Number of Completed Packets (0x03|0x0035) plen 5                           #76 10.653172
        Num handles: 1
        Handle: 201 Address: C0:07:E8:2C:B6:EE (OUI C0-07-E8)
        Count: 1
zephyr.exe[1300814]: < ACL Data TX: Handle 201 [1/3] flags 0x00 dlen 20                                             #77 10.653215
      ATT: Read By Type Response (0x09) len 15
        Attribute data length: 7
        Attribute data list: 2 entries
        Handle: 0x0019
        Value[5]: 021a00252a
            Properties: 0x02
              Read (0x02)
            Value Handle: 0x001a
            Value UUID: Serial Number String (0x2a25)
        Handle: 0x001b
        Value[5]: 021c00262a
            Properties: 0x02
              Read (0x02)
            Value Handle: 0x001c
            Value UUID: Firmware Revision String (0x2a26)
> HCI Event: Number of Completed Packets (0x13) plen 5                                                              #78 10.768510
        Num handles: 1
        Handle: 201 Address: C0:07:E8:2C:B6:EE (OUI C0-07-E8)
        Count: 1
        Buffers: 0/3
        #77: len 20 (1 Kb/s)
        Latency: 115 msec (105-120 msec ~112 msec)
> ACL Data RX: Handle 201 flags 0x02 dlen 11                                                                        #79 10.768751
      ATT: Read By Type Request (0x08) len 6
        Handle range: 0x001c-0xffff
        Attribute type: Characteristic (0x2803)
zephyr.exe[1300814]: < HCI Command: Host Number of Completed Packets (0x03|0x0035) plen 5                           #80 10.773193
        Num handles: 1
        Handle: 201 Address: C0:07:E8:2C:B6:EE (OUI C0-07-E8)
        Count: 1
zephyr.exe[1300814]: < ACL Data TX: Handle 201 [1/3] flags 0x00 dlen 20                                             #81 10.773217
      ATT: Read By Type Response (0x09) len 15
        Attribute data length: 7
        Attribute data list: 2 entries
        Handle: 0x001d
        Value[5]: 021e00272a
            Properties: 0x02
              Read (0x02)
            Value Handle: 0x001e
            Value UUID: Hardware Revision String (0x2a27)
        Handle: 0x001f
        Value[5]: 022000282a
            Properties: 0x02
              Read (0x02)
            Value Handle: 0x0020
            Value UUID: Software Revision String (0x2a28)
> HCI Event: Number of Completed Packets (0x13) plen 5                                                              #82 10.893521
        Num handles: 1
        Handle: 201 Address: C0:07:E8:2C:B6:EE (OUI C0-07-E8)
        Count: 1
        Buffers: 0/3
        #81: len 20 (1 Kb/s)
        Latency: 120 msec (105-120 msec ~116 msec)
> ACL Data RX: Handle 201 flags 0x02 dlen 11                                                                        #83 10.893820
      ATT: Read By Type Request (0x08) len 6
        Handle range: 0x0020-0xffff
        Attribute type: Characteristic (0x2803)
zephyr.exe[1300814]: < HCI Command: Host Number of Completed Packets (0x03|0x0035) plen 5                           #84 10.913027
        Num handles: 1
        Handle: 201 Address: C0:07:E8:2C:B6:EE (OUI C0-07-E8)
        Count: 1
zephyr.exe[1300814]: < ACL Data TX: Handle 201 [1/3] flags 0x00 dlen 20                                             #85 10.913208
      ATT: Read By Type Response (0x09) len 15
        Attribute data length: 7
        Attribute data list: 2 entries
        Handle: 0x0022
        Value[5]: 0a2300aa50
            Properties: 0x0a
              Read (0x02)
              Write (0x08)
            Value Handle: 0x0023
            Value UUID: Unknown (0x50aa)
        Handle: 0x0024
        Value[5]: 0a2500aa51
            Properties: 0x0a
              Read (0x02)
              Write (0x08)
            Value Handle: 0x0025
            Value UUID: Unknown (0x51aa)
> HCI Event: Number of Completed Packets (0x13) plen 5                                                              #86 11.018554
        Num handles: 1
        Handle: 201 Address: C0:07:E8:2C:B6:EE (OUI C0-07-E8)
        Count: 1
        Buffers: 0/3
        #85: len 20 (1 Kb/s)
        Latency: 105 msec (105-120 msec ~110 msec)
> ACL Data RX: Handle 201 flags 0x02 dlen 11                                                                        #87 11.018865
      ATT: Read By Type Request (0x08) len 6
        Handle range: 0x0025-0xffff
        Attribute type: Characteristic (0x2803)
zephyr.exe[1300814]: < HCI Command: Host Number of Completed Packets (0x03|0x0035) plen 5                           #88 11.033115
        Num handles: 1
        Handle: 201 Address: C0:07:E8:2C:B6:EE (OUI C0-07-E8)
        Count: 1
zephyr.exe[1300814]: < ACL Data TX: Handle 201 [1/3] flags 0x00 dlen 20                                             #89 11.033377
      ATT: Read By Type Response (0x09) len 15
        Attribute data length: 7
        Attribute data list: 2 entries
        Handle: 0x0026
        Value[5]: 0a2700aa52
            Properties: 0x0a
              Read (0x02)
              Write (0x08)
            Value Handle: 0x0027
            Value UUID: Unknown (0x52aa)
        Handle: 0x0028
        Value[5]: 0a2900aa53
            Properties: 0x0a
              Read (0x02)
              Write (0x08)
            Value Handle: 0x0029
            Value UUID: Unknown (0x53aa)
> HCI Event: Number of Completed Packets (0x13) plen 5                                                              #90 11.143560
        Num handles: 1
        Handle: 201 Address: C0:07:E8:2C:B6:EE (OUI C0-07-E8)
        Count: 1
        Buffers: 0/3
        #89: len 20 (1 Kb/s)
        Latency: 110 msec (105-120 msec ~110 msec)
> ACL Data RX: Handle 201 flags 0x02 dlen 11                                                                        #91 11.143808
      ATT: Read By Type Request (0x08) len 6
        Handle range: 0x0029-0xffff
        Attribute type: Characteristic (0x2803)
zephyr.exe[1300814]: < HCI Command: Host Number of Completed Packets (0x03|0x0035) plen 5                           #92 11.153053
        Num handles: 1
        Handle: 201 Address: C0:07:E8:2C:B6:EE (OUI C0-07-E8)
        Count: 1
zephyr.exe[1300814]: < ACL Data TX: Handle 201 [1/3] flags 0x00 dlen 20                                             #93 11.153063
      ATT: Read By Type Response (0x09) len 15
        Attribute data length: 7
        Attribute data list: 2 entries
        Handle: 0x002a
        Value[5]: 3a2b00aa54
            Properties: 0x3a
              Read (0x02)
              Write (0x08)
              Notify (0x10)
              Indicate (0x20)
            Value Handle: 0x002b
            Value UUID: Unknown (0x54aa)
        Handle: 0x002d
        Value[5]: 3a2e00aa55
            Properties: 0x3a
              Read (0x02)
              Write (0x08)
              Notify (0x10)
              Indicate (0x20)
            Value Handle: 0x002e
            Value UUID: Unknown (0x55aa)
> HCI Event: Number of Completed Packets (0x13) plen 5                                                              #94 11.268557
        Num handles: 1
        Handle: 201 Address: C0:07:E8:2C:B6:EE (OUI C0-07-E8)
        Count: 1
        Buffers: 0/3
        #93: len 20 (1 Kb/s)
        Latency: 115 msec (105-120 msec ~113 msec)
> ACL Data RX: Handle 201 flags 0x02 dlen 11                                                                        #95 11.268794
      ATT: Read By Type Request (0x08) len 6
        Handle range: 0x002e-0xffff
        Attribute type: Characteristic (0x2803)
zephyr.exe[1300814]: < HCI Command: Host Number of Completed Packets (0x03|0x0035) plen 5                           #96 11.273073
        Num handles: 1
        Handle: 201 Address: C0:07:E8:2C:B6:EE (OUI C0-07-E8)
        Count: 1
zephyr.exe[1300814]: < ACL Data TX: Handle 201 [1/3] flags 0x00 dlen 20                                             #97 11.273245
      ATT: Read By Type Response (0x09) len 15
        Attribute data length: 7
        Attribute data list: 2 entries
        Handle: 0x0030
        Value[5]: 463100aa56
            Properties: 0x46
              Read (0x02)
              Write Without Response (0x04)
              Authorize (0x40)
              Extended Properties (0x80)
            Value Handle: 0x0031
            Value UUID: Unknown (0x56aa)
        Handle: 0x0032
        Value[5]: 463300aa57
            Properties: 0x46
              Read (0x02)
              Write Without Response (0x04)
              Authorize (0x40)
              Extended Properties (0x80)
            Value Handle: 0x0033
            Value UUID: Unknown (0x57aa)
> HCI Event: Number of Completed Packets (0x13) plen 5                                                              #98 11.393621
        Num handles: 1
        Handle: 201 Address: C0:07:E8:2C:B6:EE (OUI C0-07-E8)
        Count: 1
        Buffers: 0/3
        #97: len 20 (1 Kb/s)
        Latency: 120 msec (105-120 msec ~116 msec)
> ACL Data RX: Handle 201 flags 0x02 dlen 11                                                                        #99 11.393736
      ATT: Read By Type Request (0x08) len 6
        Handle range: 0x0033-0xffff
        Attribute type: Characteristic (0x2803)
zephyr.exe[1300814]: < HCI Command: Host Number of Completed Packets (0x03|0x0035) plen 5                          #100 11.413005
        Num handles: 1
        Handle: 201 Address: C0:07:E8:2C:B6:EE (OUI C0-07-E8)
        Count: 1
zephyr.exe[1300814]: < ACL Data TX: Handle 201 [1/3] flags 0x00 dlen 20                                            #101 11.413019
      ATT: Read By Type Response (0x09) len 15
        Attribute data length: 7
        Attribute data list: 2 entries
        Handle: 0x0034
        Value[5]: 8a3500aa58
            Properties: 0x8a
              Read (0x02)
              Write (0x08)
            Unknown fields (0x80)
            Value Handle: 0x0035
            Value UUID: Unknown (0x58aa)
        Handle: 0x0037
        Value[5]: 0a3800aa59
            Properties: 0x0a
              Read (0x02)
              Write (0x08)
            Value Handle: 0x0038
            Value UUID: Unknown (0x59aa)
> HCI Event: Number of Completed Packets (0x13) plen 5                                                             #102 11.518550
        Num handles: 1
        Handle: 201 Address: C0:07:E8:2C:B6:EE (OUI C0-07-E8)
        Count: 1
        Buffers: 0/3
        #101: len 20 (1 Kb/s)
        Latency: 105 msec (105-120 msec ~111 msec)
> ACL Data RX: Handle 201 flags 0x02 dlen 11                                                                       #103 11.518810
      ATT: Read By Type Request (0x08) len 6
        Handle range: 0x0038-0xffff
        Attribute type: Characteristic (0x2803)
zephyr.exe[1300814]: < HCI Command: Host Number of Completed Packets (0x03|0x0035) plen 5                          #104 11.533103
        Num handles: 1
        Handle: 201 Address: C0:07:E8:2C:B6:EE (OUI C0-07-E8)
        Count: 1
zephyr.exe[1300814]: < ACL Data TX: Handle 201 [1/3] flags 0x00 dlen 13                                            #105 11.533193
      ATT: Read By Type Response (0x09) len 8
        Attribute data length: 7
        Attribute data list: 1 entry
        Handle: 0x0039
        Value[5]: 0a3a00aa5a
            Properties: 0x0a
              Read (0x02)
              Write (0x08)
            Value Handle: 0x003a
            Value UUID: Unknown (0x5aaa)
> HCI Event: Number of Completed Packets (0x13) plen 5                                                             #106 11.643605
        Num handles: 1
        Handle: 201 Address: C0:07:E8:2C:B6:EE (OUI C0-07-E8)
        Count: 1
        Buffers: 0/3
        #105: len 13 (0 Kb/s)
        Latency: 110 msec (105-120 msec ~110 msec)
> ACL Data RX: Handle 201 flags 0x02 dlen 11                                                                       #107 11.643772
      ATT: Read By Type Request (0x08) len 6
        Handle range: 0x003a-0xffff
        Attribute type: Characteristic (0x2803)
zephyr.exe[1300814]: < HCI Command: Host Number of Completed Packets (0x03|0x0035) plen 5                          #108 11.653053
        Num handles: 1
        Handle: 201 Address: C0:07:E8:2C:B6:EE (OUI C0-07-E8)
        Count: 1
zephyr.exe[1300814]: < ACL Data TX: Handle 201 [1/3] flags 0x00 dlen 27                                            #109 11.653201
      ATT: Read By Type Response (0x09) len 22
        Attribute data length: 21
        Attribute data list: 1 entry
        Handle: 0x003b
        Value[19]: 0a3c00f000bb5004514000b123456789abcdef
            Properties: 0x0a
              Read (0x02)
              Write (0x08)
            Value Handle: 0x003c
            Value UUID: Vendor specific (efcdab89-6745-23b1-0040-510450bb00f0)
> HCI Event: Number of Completed Packets (0x13) plen 5                                                             #110 11.768603
        Num handles: 1
        Handle: 201 Address: C0:07:E8:2C:B6:EE (OUI C0-07-E8)
        Count: 1
        Buffers: 0/3
        #109: len 27 (1 Kb/s)
        Latency: 115 msec (105-120 msec ~113 msec)
> ACL Data RX: Handle 201 flags 0x02 dlen 11                                                                       #111 11.768746
      ATT: Read By Type Request (0x08) len 6
        Handle range: 0x003c-0xffff
        Attribute type: Characteristic (0x2803)
zephyr.exe[1300814]: < HCI Command: Host Number of Completed Packets (0x03|0x0035) plen 5                          #112 11.773200
        Num handles: 1
        Handle: 201 Address: C0:07:E8:2C:B6:EE (OUI C0-07-E8)
        Count: 1
zephyr.exe[1300814]: < ACL Data TX: Handle 201 [1/3] flags 0x00 dlen 20                                            #113 11.773267
      ATT: Read By Type Response (0x09) len 15
        Attribute data length: 7
        Attribute data list: 2 entries
        Handle: 0x003f
        Value[5]: 0a4000aa50
            Properties: 0x0a
              Read (0x02)
              Write (0x08)
            Value Handle: 0x0040
            Value UUID: Unknown (0x50aa)
        Handle: 0x0041
        Value[5]: 0a4200aa51
            Properties: 0x0a
              Read (0x02)
              Write (0x08)
            Value Handle: 0x0042
            Value UUID: Unknown (0x51aa)
> HCI Event: Number of Completed Packets (0x13) plen 5                                                             #114 11.893526
        Num handles: 1
        Handle: 201 Address: C0:07:E8:2C:B6:EE (OUI C0-07-E8)
        Count: 1
        Buffers: 0/3
        #113: len 20 (1 Kb/s)
        Latency: 120 msec (105-120 msec ~116 msec)
> ACL Data RX: Handle 201 flags 0x02 dlen 11                                                                       #115 11.893794
      ATT: Read By Type Request (0x08) len 6
        Handle range: 0x0042-0xffff
        Attribute type: Characteristic (0x2803)
zephyr.exe[1300814]: < HCI Command: Host Number of Completed Packets (0x03|0x0035) plen 5                          #116 11.913052
        Num handles: 1
        Handle: 201 Address: C0:07:E8:2C:B6:EE (OUI C0-07-E8)
        Count: 1
zephyr.exe[1300814]: < ACL Data TX: Handle 201 [1/3] flags 0x00 dlen 20                                            #117 11.913067
      ATT: Read By Type Response (0x09) len 15
        Attribute data length: 7
        Attribute data list: 2 entries
        Handle: 0x0043
        Value[5]: 0a4400aa52
            Properties: 0x0a
              Read (0x02)
              Write (0x08)
            Value Handle: 0x0044
            Value UUID: Unknown (0x52aa)
        Handle: 0x0045
        Value[5]: 024600aa53
            Properties: 0x02
              Read (0x02)
            Value Handle: 0x0046
            Value UUID: Unknown (0x53aa)
> HCI Event: Number of Completed Packets (0x13) plen 5                                                             #118 12.018571
        Num handles: 1
        Handle: 201 Address: C0:07:E8:2C:B6:EE (OUI C0-07-E8)
        Count: 1
        Buffers: 0/3
        #117: len 20 (1 Kb/s)
        Latency: 105 msec (105-120 msec ~111 msec)
> ACL Data RX: Handle 201 flags 0x02 dlen 11                                                                       #119 12.018757
      ATT: Read By Type Request (0x08) len 6
        Handle range: 0x0046-0xffff
        Attribute type: Characteristic (0x2803)
zephyr.exe[1300814]: < HCI Command: Host Number of Completed Packets (0x03|0x0035) plen 5                          #120 12.033163
        Num handles: 1
        Handle: 201 Address: C0:07:E8:2C:B6:EE (OUI C0-07-E8)
        Count: 1
zephyr.exe[1300814]: < ACL Data TX: Handle 201 [1/3] flags 0x00 dlen 20                                            #121 12.033217
      ATT: Read By Type Response (0x09) len 15
        Attribute data length: 7
        Attribute data list: 2 entries
        Handle: 0x0048
        Value[5]: 0a4900aa55
            Properties: 0x0a
              Read (0x02)
              Write (0x08)
            Value Handle: 0x0049
            Value UUID: Unknown (0x55aa)
        Handle: 0x004a
        Value[5]: 0a4b00aa56
            Properties: 0x0a
              Read (0x02)
              Write (0x08)
            Value Handle: 0x004b
            Value UUID: Unknown (0x56aa)
> HCI Event: Number of Completed Packets (0x13) plen 5                                                             #122 12.143570
        Num handles: 1
        Handle: 201 Address: C0:07:E8:2C:B6:EE (OUI C0-07-E8)
        Count: 1
        Buffers: 0/3
        #121: len 20 (1 Kb/s)
        Latency: 110 msec (105-120 msec ~110 msec)
> ACL Data RX: Handle 201 flags 0x02 dlen 11                                                                       #123 12.143772
      ATT: Read By Type Request (0x08) len 6
        Handle range: 0x004b-0xffff
        Attribute type: Characteristic (0x2803)
zephyr.exe[1300814]: < HCI Command: Host Number of Completed Packets (0x03|0x0035) plen 5                          #124 12.153088
        Num handles: 1
        Handle: 201 Address: C0:07:E8:2C:B6:EE (OUI C0-07-E8)
        Count: 1
zephyr.exe[1300814]: < ACL Data TX: Handle 201 [1/3] flags 0x00 dlen 9                                             #125 12.153174
      ATT: Error Response (0x01) len 4
        Read By Type Request (0x08)
        Handle: 0x004b
        Error: Attribute Not Found (0x0a)
> HCI Event: Number of Completed Packets (0x13) plen 5                                                             #126 12.268637
        Num handles: 1
        Handle: 201 Address: C0:07:E8:2C:B6:EE (OUI C0-07-E8)
        Count: 1
        Buffers: 0/3
        #125: len 9 (0 Kb/s)
        Latency: 115 msec (105-120 msec ~113 msec)
> ACL Data RX: Handle 201 flags 0x02 dlen 7                                                                        #127 12.268756
      ATT: Read Request (0x0a) len 2
        Handle: 0x000a
zephyr.exe[1300814]: < HCI Command: Host Number of Completed Packets (0x03|0x0035) plen 5                          #128 12.273048
        Num handles: 1
        Handle: 201 Address: C0:07:E8:2C:B6:EE (OUI C0-07-E8)
        Count: 1
zephyr.exe[1300814]: < ACL Data TX: Handle 201 [1/3] flags 0x00 dlen 6                                             #129 12.273061
      ATT: Read Response (0x0b) len 1
        Value[1]: 01
> HCI Event: Number of Completed Packets (0x13) plen 5                                                             #130 12.393524
        Num handles: 1
        Handle: 201 Address: C0:07:E8:2C:B6:EE (OUI C0-07-E8)
        Count: 1
        Buffers: 0/3
        #129: len 6 (0 Kb/s)
        Latency: 120 msec (105-120 msec ~116 msec)
> ACL Data RX: Handle 201 flags 0x02 dlen 11                                                                       #131 12.393820
      ATT: Read By Type Request (0x08) len 6
        Handle range: 0x0001-0xffff
        Attribute type: Characteristic (0x2803)
zephyr.exe[1300814]: < HCI Command: Host Number of Completed Packets (0x03|0x0035) plen 5                          #132 12.413064
        Num handles: 1
        Handle: 201 Address: C0:07:E8:2C:B6:EE (OUI C0-07-E8)
        Count: 1
zephyr.exe[1300814]: < ACL Data TX: Handle 201 [1/3] flags 0x00 dlen 20                                            #133 12.413091
      ATT: Read By Type Response (0x09) len 15
        Attribute data length: 7
        Attribute data list: 2 entries
        Handle: 0x0002
        Value[5]: 200300052a
            Properties: 0x20
              Indicate (0x20)
            Value Handle: 0x0003
            Value UUID: Service Changed (0x2a05)
        Handle: 0x0005
        Value[5]: 0a0600292b
            Properties: 0x0a
              Read (0x02)
              Write (0x08)
            Value Handle: 0x0006
            Value UUID: Client Supported Features (0x2b29)
> HCI Event: Number of Completed Packets (0x13) plen 5                                                             #134 12.518553
        Num handles: 1
        Handle: 201 Address: C0:07:E8:2C:B6:EE (OUI C0-07-E8)
        Count: 1
        Buffers: 0/3
        #133: len 20 (1 Kb/s)
        Latency: 105 msec (105-120 msec ~111 msec)
> ACL Data RX: Handle 201 flags 0x02 dlen 11                                                                       #135 12.518741
      ATT: Read By Type Request (0x08) len 6
        Handle range: 0x0006-0xffff
        Attribute type: Characteristic (0x2803)
zephyr.exe[1300814]: < HCI Command: Host Number of Completed Packets (0x03|0x0035) plen 5                          #136 12.533088
        Num handles: 1
        Handle: 201 Address: C0:07:E8:2C:B6:EE (OUI C0-07-E8)
        Count: 1
zephyr.exe[1300814]: < ACL Data TX: Handle 201 [1/3] flags 0x00 dlen 20                                            #137 12.533146
      ATT: Read By Type Response (0x09) len 15
        Attribute data length: 7
        Attribute data list: 2 entries
        Handle: 0x0007
        Value[5]: 0208002a2b
            Properties: 0x02
              Read (0x02)
            Value Handle: 0x0008
            Value UUID: Database Hash (0x2b2a)
        Handle: 0x0009
        Value[5]: 020a003a2b
            Properties: 0x02
              Read (0x02)
            Value Handle: 0x000a
            Value UUID: Server Supported Features (0x2b3a)
> HCI Event: Number of Completed Packets (0x13) plen 5                                                             #138 12.643606
        Num handles: 1
        Handle: 201 Address: C0:07:E8:2C:B6:EE (OUI C0-07-E8)
        Count: 1
        Buffers: 0/3
        #137: len 20 (1 Kb/s)
        Latency: 110 msec (105-120 msec ~110 msec)
> ACL Data RX: Handle 201 flags 0x02 dlen 11                                                                       #139 12.643775
      ATT: Read By Type Request (0x08) len 6
        Handle range: 0x000a-0xffff
        Attribute type: Characteristic (0x2803)
zephyr.exe[1300814]: < HCI Command: Host Number of Completed Packets (0x03|0x0035) plen 5                          #140 12.653045
        Num handles: 1
        Handle: 201 Address: C0:07:E8:2C:B6:EE (OUI C0-07-E8)
        Count: 1
zephyr.exe[1300814]: < ACL Data TX: Handle 201 [1/3] flags 0x00 dlen 20                                            #141 12.653055
      ATT: Read By Type Response (0x09) len 15
        Attribute data length: 7
        Attribute data list: 2 entries
        Handle: 0x000c
        Value[5]: 0a0d00002a
            Properties: 0x0a
              Read (0x02)
              Write (0x08)
            Value Handle: 0x000d
            Value UUID: Device Name (0x2a00)
        Handle: 0x000e
        Value[5]: 0a0f00012a
            Properties: 0x0a
              Read (0x02)
              Write (0x08)
            Value Handle: 0x000f
            Value UUID: Appearance (0x2a01)
> HCI Event: Number of Completed Packets (0x13) plen 5                                                             #142 12.768633
        Num handles: 1
        Handle: 201 Address: C0:07:E8:2C:B6:EE (OUI C0-07-E8)
        Count: 1
        Buffers: 0/3
        #141: len 20 (1 Kb/s)
        Latency: 115 msec (105-120 msec ~113 msec)
> ACL Data RX: Handle 201 flags 0x02 dlen 11                                                                       #143 12.768783
      ATT: Read By Type Request (0x08) len 6
        Handle range: 0x000f-0xffff
        Attribute type: Characteristic (0x2803)
zephyr.exe[1300814]: < HCI Command: Host Number of Completed Packets (0x03|0x0035) plen 5                          #144 12.773064
        Num handles: 1
        Handle: 201 Address: C0:07:E8:2C:B6:EE (OUI C0-07-E8)
        Count: 1
zephyr.exe[1300814]: < ACL Data TX: Handle 201 [1/3] flags 0x00 dlen 20                                            #145 12.773081
      ATT: Read By Type Response (0x09) len 15
        Attribute data length: 7
        Attribute data list: 2 entries
        Handle: 0x0010
        Value[5]: 021100042a
            Properties: 0x02
              Read (0x02)
            Value Handle: 0x0011
            Value UUID: Peripheral Preferred Connection Parameters (0x2a04)
        Handle: 0x0013
        Value[5]: 021400242a
            Properties: 0x02
              Read (0x02)
            Value Handle: 0x0014
            Value UUID: Model Number String (0x2a24)
> HCI Event: Number of Completed Packets (0x13) plen 5                                                             #146 12.893603
        Num handles: 1
        Handle: 201 Address: C0:07:E8:2C:B6:EE (OUI C0-07-E8)
        Count: 1
        Buffers: 0/3
        #145: len 20 (1 Kb/s)
        Latency: 120 msec (105-120 msec ~116 msec)
> ACL Data RX: Handle 201 flags 0x02 dlen 11                                                                       #147 12.893762
      ATT: Read By Type Request (0x08) len 6
        Handle range: 0x0014-0xffff
        Attribute type: Characteristic (0x2803)
zephyr.exe[1300814]: < HCI Command: Host Number of Completed Packets (0x03|0x0035) plen 5                          #148 12.913158
        Num handles: 1
        Handle: 201 Address: C0:07:E8:2C:B6:EE (OUI C0-07-E8)
        Count: 1
zephyr.exe[1300814]: < ACL Data TX: Handle 201 [1/3] flags 0x00 dlen 20                                            #149 12.913221
      ATT: Read By Type Response (0x09) len 15
        Attribute data length: 7
        Attribute data list: 2 entries
        Handle: 0x0015
        Value[5]: 021600292a
            Properties: 0x02
              Read (0x02)
            Value Handle: 0x0016
            Value UUID: Manufacturer Name String (0x2a29)
        Handle: 0x0017
        Value[5]: 021800502a
            Properties: 0x02
              Read (0x02)
            Value Handle: 0x0018
            Value UUID: PnP ID (0x2a50)
> HCI Event: Number of Completed Packets (0x13) plen 5                                                             #150 13.018557
        Num handles: 1
        Handle: 201 Address: C0:07:E8:2C:B6:EE (OUI C0-07-E8)
        Count: 1
        Buffers: 0/3
        #149: len 20 (1 Kb/s)
        Latency: 105 msec (105-120 msec ~111 msec)
> ACL Data RX: Handle 201 flags 0x02 dlen 11                                                                       #151 13.018764
      ATT: Read By Type Request (0x08) len 6
        Handle range: 0x0018-0xffff
        Attribute type: Characteristic (0x2803)
zephyr.exe[1300814]: < HCI Command: Host Number of Completed Packets (0x03|0x0035) plen 5                          #152 13.033070
        Num handles: 1
        Handle: 201 Address: C0:07:E8:2C:B6:EE (OUI C0-07-E8)
        Count: 1
zephyr.exe[1300814]: < ACL Data TX: Handle 201 [1/3] flags 0x00 dlen 20                                            #153 13.033104
      ATT: Read By Type Response (0x09) len 15
        Attribute data length: 7
        Attribute data list: 2 entries
        Handle: 0x0019
        Value[5]: 021a00252a
            Properties: 0x02
              Read (0x02)
            Value Handle: 0x001a
            Value UUID: Serial Number String (0x2a25)
        Handle: 0x001b
        Value[5]: 021c00262a
            Properties: 0x02
              Read (0x02)
            Value Handle: 0x001c
            Value UUID: Firmware Revision String (0x2a26)
> HCI Event: Number of Completed Packets (0x13) plen 5                                                             #154 13.143567
        Num handles: 1
        Handle: 201 Address: C0:07:E8:2C:B6:EE (OUI C0-07-E8)
        Count: 1
        Buffers: 0/3
        #153: len 20 (1 Kb/s)
        Latency: 110 msec (105-120 msec ~110 msec)
> ACL Data RX: Handle 201 flags 0x02 dlen 11                                                                       #155 13.143780
      ATT: Read By Type Request (0x08) len 6
        Handle range: 0x001c-0xffff
        Attribute type: Characteristic (0x2803)
zephyr.exe[1300814]: < HCI Command: Host Number of Completed Packets (0x03|0x0035) plen 5                          #156 13.153213
        Num handles: 1
        Handle: 201 Address: C0:07:E8:2C:B6:EE (OUI C0-07-E8)
        Count: 1
zephyr.exe[1300814]: < ACL Data TX: Handle 201 [1/3] flags 0x00 dlen 20                                            #157 13.153262
      ATT: Read By Type Response (0x09) len 15
        Attribute data length: 7
        Attribute data list: 2 entries
        Handle: 0x001d
        Value[5]: 021e00272a
            Properties: 0x02
              Read (0x02)
            Value Handle: 0x001e
            Value UUID: Hardware Revision String (0x2a27)
        Handle: 0x001f
        Value[5]: 022000282a
            Properties: 0x02
              Read (0x02)
            Value Handle: 0x0020
            Value UUID: Software Revision String (0x2a28)
> HCI Event: Number of Completed Packets (0x13) plen 5                                                             #158 13.268604
        Num handles: 1
        Handle: 201 Address: C0:07:E8:2C:B6:EE (OUI C0-07-E8)
        Count: 1
        Buffers: 0/3
        #157: len 20 (1 Kb/s)
        Latency: 115 msec (105-120 msec ~113 msec)
> ACL Data RX: Handle 201 flags 0x02 dlen 11                                                                       #159 13.268773
      ATT: Read By Type Request (0x08) len 6
        Handle range: 0x0020-0xffff
        Attribute type: Characteristic (0x2803)
zephyr.exe[1300814]: < HCI Command: Host Number of Completed Packets (0x03|0x0035) plen 5                          #160 13.273039
        Num handles: 1
        Handle: 201 Address: C0:07:E8:2C:B6:EE (OUI C0-07-E8)
        Count: 1
zephyr.exe[1300814]: < ACL Data TX: Handle 201 [1/3] flags 0x00 dlen 20                                            #161 13.273186
      ATT: Read By Type Response (0x09) len 15
        Attribute data length: 7
        Attribute data list: 2 entries
        Handle: 0x0022
        Value[5]: 0a2300aa50
            Properties: 0x0a
              Read (0x02)
              Write (0x08)
            Value Handle: 0x0023
            Value UUID: Unknown (0x50aa)
        Handle: 0x0024
        Value[5]: 0a2500aa51
            Properties: 0x0a
              Read (0x02)
              Write (0x08)
            Value Handle: 0x0025
            Value UUID: Unknown (0x51aa)
> HCI Event: Number of Completed Packets (0x13) plen 5                                                             #162 13.393626
        Num handles: 1
        Handle: 201 Address: C0:07:E8:2C:B6:EE (OUI C0-07-E8)
        Count: 1
        Buffers: 0/3
        #161: len 20 (1 Kb/s)
        Latency: 120 msec (105-120 msec ~116 msec)
> ACL Data RX: Handle 201 flags 0x02 dlen 11                                                                       #163 13.393776
      ATT: Read By Type Request (0x08) len 6
        Handle range: 0x0025-0xffff
        Attribute type: Characteristic (0x2803)
zephyr.exe[1300814]: < HCI Command: Host Number of Completed Packets (0x03|0x0035) plen 5                          #164 13.413137
        Num handles: 1
        Handle: 201 Address: C0:07:E8:2C:B6:EE (OUI C0-07-E8)
        Count: 1
zephyr.exe[1300814]: < ACL Data TX: Handle 201 [1/3] flags 0x00 dlen 20                                            #165 13.413152
      ATT: Read By Type Response (0x09) len 15
        Attribute data length: 7
        Attribute data list: 2 entries
        Handle: 0x0026
        Value[5]: 0a2700aa52
            Properties: 0x0a
              Read (0x02)
              Write (0x08)
            Value Handle: 0x0027
            Value UUID: Unknown (0x52aa)
        Handle: 0x0028
        Value[5]: 0a2900aa53
            Properties: 0x0a
              Read (0x02)
              Write (0x08)
            Value Handle: 0x0029
            Value UUID: Unknown (0x53aa)
> HCI Event: Number of Completed Packets (0x13) plen 5                                                             #166 13.518584
        Num handles: 1
        Handle: 201 Address: C0:07:E8:2C:B6:EE (OUI C0-07-E8)
        Count: 1
        Buffers: 0/3
        #165: len 20 (1 Kb/s)
        Latency: 105 msec (105-120 msec ~111 msec)
> ACL Data RX: Handle 201 flags 0x02 dlen 11                                                                       #167 13.518774
      ATT: Read By Type Request (0x08) len 6
        Handle range: 0x0029-0xffff
        Attribute type: Characteristic (0x2803)
zephyr.exe[1300814]: < HCI Command: Host Number of Completed Packets (0x03|0x0035) plen 5                          #168 13.533090
        Num handles: 1
        Handle: 201 Address: C0:07:E8:2C:B6:EE (OUI C0-07-E8)
        Count: 1
zephyr.exe[1300814]: < ACL Data TX: Handle 201 [1/3] flags 0x00 dlen 20                                            #169 13.533117
      ATT: Read By Type Response (0x09) len 15
        Attribute data length: 7
        Attribute data list: 2 entries
        Handle: 0x002a
        Value[5]: 3a2b00aa54
            Properties: 0x3a
              Read (0x02)
              Write (0x08)
              Notify (0x10)
              Indicate (0x20)
            Value Handle: 0x002b
            Value UUID: Unknown (0x54aa)
        Handle: 0x002d
        Value[5]: 3a2e00aa55
            Properties: 0x3a
              Read (0x02)
              Write (0x08)
              Notify (0x10)
              Indicate (0x20)
            Value Handle: 0x002e
            Value UUID: Unknown (0x55aa)
> HCI Event: Number of Completed Packets (0x13) plen 5                                                             #170 13.643532
        Num handles: 1
        Handle: 201 Address: C0:07:E8:2C:B6:EE (OUI C0-07-E8)
        Count: 1
        Buffers: 0/3
        #169: len 20 (1 Kb/s)
        Latency: 110 msec (105-120 msec ~110 msec)
> ACL Data RX: Handle 201 flags 0x02 dlen 11                                                                       #171 13.643786
      ATT: Read By Type Request (0x08) len 6
        Handle range: 0x002e-0xffff
        Attribute type: Characteristic (0x2803)
zephyr.exe[1300814]: < HCI Command: Host Number of Completed Packets (0x03|0x0035) plen 5                          #172 13.653228
        Num handles: 1
        Handle: 201 Address: C0:07:E8:2C:B6:EE (OUI C0-07-E8)
        Count: 1
zephyr.exe[1300814]: < ACL Data TX: Handle 201 [1/3] flags 0x00 dlen 20                                            #173 13.653256
      ATT: Read By Type Response (0x09) len 15
        Attribute data length: 7
        Attribute data list: 2 entries
        Handle: 0x0030
        Value[5]: 463100aa56
            Properties: 0x46
              Read (0x02)
              Write Without Response (0x04)
              Authorize (0x40)
              Extended Properties (0x80)
            Value Handle: 0x0031
            Value UUID: Unknown (0x56aa)
        Handle: 0x0032
        Value[5]: 463300aa57
            Properties: 0x46
              Read (0x02)
              Write Without Response (0x04)
              Authorize (0x40)
              Extended Properties (0x80)
            Value Handle: 0x0033
            Value UUID: Unknown (0x57aa)
> HCI Event: Number of Completed Packets (0x13) plen 5                                                             #174 13.768616
        Num handles: 1
        Handle: 201 Address: C0:07:E8:2C:B6:EE (OUI C0-07-E8)
        Count: 1
        Buffers: 0/3
        #173: len 20 (1 Kb/s)
        Latency: 115 msec (105-120 msec ~113 msec)
> ACL Data RX: Handle 201 flags 0x02 dlen 11                                                                       #175 13.768841
      ATT: Read By Type Request (0x08) len 6
        Handle range: 0x0033-0xffff
        Attribute type: Characteristic (0x2803)
zephyr.exe[1300814]: < HCI Command: Host Number of Completed Packets (0x03|0x0035) plen 5                          #176 13.773176
        Num handles: 1
        Handle: 201 Address: C0:07:E8:2C:B6:EE (OUI C0-07-E8)
        Count: 1
zephyr.exe[1300814]: < ACL Data TX: Handle 201 [1/3] flags 0x00 dlen 20                                            #177 13.773340
      ATT: Read By Type Response (0x09) len 15
        Attribute data length: 7
        Attribute data list: 2 entries
        Handle: 0x0034
        Value[5]: 8a3500aa58
            Properties: 0x8a
              Read (0x02)
              Write (0x08)
            Unknown fields (0x80)
            Value Handle: 0x0035
            Value UUID: Unknown (0x58aa)
        Handle: 0x0037
        Value[5]: 0a3800aa59
            Properties: 0x0a
              Read (0x02)
              Write (0x08)
            Value Handle: 0x0038
            Value UUID: Unknown (0x59aa)
> HCI Event: Number of Completed Packets (0x13) plen 5                                                             #178 13.893567
        Num handles: 1
        Handle: 201 Address: C0:07:E8:2C:B6:EE (OUI C0-07-E8)
        Count: 1
        Buffers: 0/3
        #177: len 20 (1 Kb/s)
        Latency: 120 msec (105-120 msec ~116 msec)
> ACL Data RX: Handle 201 flags 0x02 dlen 11                                                                       #179 13.893776
      ATT: Read By Type Request (0x08) len 6
        Handle range: 0x0038-0xffff
        Attribute type: Characteristic (0x2803)
zephyr.exe[1300814]: < HCI Command: Host Number of Completed Packets (0x03|0x0035) plen 5                          #180 13.913086
        Num handles: 1
        Handle: 201 Address: C0:07:E8:2C:B6:EE (OUI C0-07-E8)
        Count: 1
zephyr.exe[1300814]: < ACL Data TX: Handle 201 [1/3] flags 0x00 dlen 13                                            #181 13.913114
      ATT: Read By Type Response (0x09) len 8
        Attribute data length: 7
        Attribute data list: 1 entry
        Handle: 0x0039
        Value[5]: 0a3a00aa5a
            Properties: 0x0a
              Read (0x02)
              Write (0x08)
            Value Handle: 0x003a
            Value UUID: Unknown (0x5aaa)
> HCI Event: Number of Completed Packets (0x13) plen 5                                                             #182 14.018594
        Num handles: 1
        Handle: 201 Address: C0:07:E8:2C:B6:EE (OUI C0-07-E8)
        Count: 1
        Buffers: 0/3
        #181: len 13 (0 Kb/s)
        Latency: 105 msec (105-120 msec ~111 msec)
> ACL Data RX: Handle 201 flags 0x02 dlen 11                                                                       #183 14.018783
      ATT: Read By Type Request (0x08) len 6
        Handle range: 0x003a-0xffff
        Attribute type: Characteristic (0x2803)
zephyr.exe[1300814]: < HCI Command: Host Number of Completed Packets (0x03|0x0035) plen 5                          #184 14.033112
        Num handles: 1
        Handle: 201 Address: C0:07:E8:2C:B6:EE (OUI C0-07-E8)
        Count: 1
zephyr.exe[1300814]: < ACL Data TX: Handle 201 [1/3] flags 0x00 dlen 27                                            #185 14.033302
      ATT: Read By Type Response (0x09) len 22
        Attribute data length: 21
        Attribute data list: 1 entry
        Handle: 0x003b
        Value[19]: 0a3c00f000bb5004514000b123456789abcdef
            Properties: 0x0a
              Read (0x02)
              Write (0x08)
            Value Handle: 0x003c
            Value UUID: Vendor specific (efcdab89-6745-23b1-0040-510450bb00f0)
zephyr.exe[1300814]: < ACL Data TX: Handle 201 [2/3] flags 0x00 dlen 16                                            #186 14.043055
      LE L2CAP: Connection Parameter Update Request (0x12) ident 1 len 8
        Min interval: 24
        Max interval: 40
        Peripheral latency: 0
        Timeout multiplier: 42
> HCI Event: Number of Completed Packets (0x13) plen 5                                                             #187 14.081425
        Num handles: 1
        Handle: 201 Address: C0:07:E8:2C:B6:EE (OUI C0-07-E8)
        Count: 1
        Buffers: 1/3
        #185: len 27 (4 Kb/s)
        Latency: 48 msec (48-120 msec ~79 msec)
> HCI Event: Number of Completed Packets (0x13) plen 5                                                             #188 14.143556
        Num handles: 1
        Handle: 201 Address: C0:07:E8:2C:B6:EE (OUI C0-07-E8)
        Count: 1
        Buffers: 0/3
        #186: len 16 (1 Kb/s)
        Latency: 100 msec (48-120 msec ~90 msec)
> ACL Data RX: Handle 201 flags 0x02 dlen 11                                                                       #189 14.143671
      ATT: Read By Type Request (0x08) len 6
        Handle range: 0x003c-0xffff
        Attribute type: Characteristic (0x2803)
> ACL Data RX: Handle 201 flags 0x02 dlen 10                                                                       #190 14.143926
      LE L2CAP: Connection Parameter Update Response (0x13) ident 1 len 2
        Result: Connection Parameters accepted (0x0000)
zephyr.exe[1300814]: < HCI Command: Host Number of Completed Packets (0x03|0x0035) plen 5                          #191 14.153264
        Num handles: 1
        Handle: 201 Address: C0:07:E8:2C:B6:EE (OUI C0-07-E8)
        Count: 1
zephyr.exe[1300814]: < ACL Data TX: Handle 201 [1/3] flags 0x00 dlen 20                                            #192 14.153292
      ATT: Read By Type Response (0x09) len 15
        Attribute data length: 7
        Attribute data list: 2 entries
        Handle: 0x003f
        Value[5]: 0a4000aa50
            Properties: 0x0a
              Read (0x02)
              Write (0x08)
            Value Handle: 0x0040
            Value UUID: Unknown (0x50aa)
        Handle: 0x0041
        Value[5]: 0a4200aa51
            Properties: 0x0a
              Read (0x02)
              Write (0x08)
            Value Handle: 0x0042
            Value UUID: Unknown (0x51aa)
zephyr.exe[1300814]: < HCI Command: Host Number of Completed Packets (0x03|0x0035) plen 5                          #193 14.154991
        Num handles: 1
        Handle: 201 Address: C0:07:E8:2C:B6:EE (OUI C0-07-E8)
        Count: 1
> HCI Event: Number of Completed Packets (0x13) plen 5                                                             #194 14.268646
        Num handles: 1
        Handle: 201 Address: C0:07:E8:2C:B6:EE (OUI C0-07-E8)
        Count: 1
        Buffers: 0/3
        #192: len 20 (1 Kb/s)
        Latency: 115 msec (48-120 msec ~102 msec)
> ACL Data RX: Handle 201 flags 0x02 dlen 11                                                                       #195 14.268776
      ATT: Read By Type Request (0x08) len 6
        Handle range: 0x0042-0xffff
        Attribute type: Characteristic (0x2803)
zephyr.exe[1300814]: < HCI Command: Host Number of Completed Packets (0x03|0x0035) plen 5                          #196 14.273140
        Num handles: 1
        Handle: 201 Address: C0:07:E8:2C:B6:EE (OUI C0-07-E8)
        Count: 1
zephyr.exe[1300814]: < ACL Data TX: Handle 201 [1/3] flags 0x00 dlen 20                                            #197 14.273149
      ATT: Read By Type Response (0x09) len 15
        Attribute data length: 7
        Attribute data list: 2 entries
        Handle: 0x0043
        Value[5]: 0a4400aa52
            Properties: 0x0a
              Read (0x02)
              Write (0x08)
            Value Handle: 0x0044
            Value UUID: Unknown (0x52aa)
        Handle: 0x0045
        Value[5]: 024600aa53
            Properties: 0x02
              Read (0x02)
            Value Handle: 0x0046
            Value UUID: Unknown (0x53aa)
> HCI Event: Number of Completed Packets (0x13) plen 5                                                             #198 14.393562
        Num handles: 1
        Handle: 201 Address: C0:07:E8:2C:B6:EE (OUI C0-07-E8)
        Count: 1
        Buffers: 0/3
        #197: len 20 (1 Kb/s)
        Latency: 120 msec (48-120 msec ~111 msec)
> ACL Data RX: Handle 201 flags 0x02 dlen 11                                                                       #199 14.393749
      ATT: Read By Type Request (0x08) len 6
        Handle range: 0x0046-0xffff
        Attribute type: Characteristic (0x2803)
zephyr.exe[1300814]: < HCI Command: Host Number of Completed Packets (0x03|0x0035) plen 5                          #200 14.413035
        Num handles: 1
        Handle: 201 Address: C0:07:E8:2C:B6:EE (OUI C0-07-E8)
        Count: 1
zephyr.exe[1300814]: < ACL Data TX: Handle 201 [1/3] flags 0x00 dlen 20                                            #201 14.413048
      ATT: Read By Type Response (0x09) len 15
        Attribute data length: 7
        Attribute data list: 2 entries
        Handle: 0x0048
        Value[5]: 0a4900aa55
            Properties: 0x0a
              Read (0x02)
              Write (0x08)
            Value Handle: 0x0049
            Value UUID: Unknown (0x55aa)
        Handle: 0x004a
        Value[5]: 0a4b00aa56
            Properties: 0x0a
              Read (0x02)
              Write (0x08)
            Value Handle: 0x004b
            Value UUID: Unknown (0x56aa)
> HCI Event: Number of Completed Packets (0x13) plen 5                                                             #202 14.518544
        Num handles: 1
        Handle: 201 Address: C0:07:E8:2C:B6:EE (OUI C0-07-E8)
        Count: 1
        Buffers: 0/3
        #201: len 20 (1 Kb/s)
        Latency: 105 msec (48-120 msec ~108 msec)
> ACL Data RX: Handle 201 flags 0x02 dlen 11                                                                       #203 14.518763
      ATT: Read By Type Request (0x08) len 6
        Handle range: 0x004b-0xffff
        Attribute type: Characteristic (0x2803)
zephyr.exe[1300814]: < HCI Command: Host Number of Completed Packets (0x03|0x0035) plen 5                          #204 14.533177
        Num handles: 1
        Handle: 201 Address: C0:07:E8:2C:B6:EE (OUI C0-07-E8)
        Count: 1
zephyr.exe[1300814]: < ACL Data TX: Handle 201 [1/3] flags 0x00 dlen 9                                             #205 14.533359
      ATT: Error Response (0x01) len 4
        Read By Type Request (0x08)
        Handle: 0x004b
        Error: Attribute Not Found (0x0a)
> HCI Event: Number of Completed Packets (0x13) plen 5                                                             #206 14.643587
        Num handles: 1
        Handle: 201 Address: C0:07:E8:2C:B6:EE (OUI C0-07-E8)
        Count: 1
        Buffers: 0/3
        #205: len 9 (0 Kb/s)
        Latency: 110 msec (48-120 msec ~109 msec)
> ACL Data RX: Handle 201 flags 0x02 dlen 7                                                                        #207 14.643693
      ATT: Read Request (0x0a) len 2
        Handle: 0x0006
zephyr.exe[1300814]: < HCI Command: Host Number of Completed Packets (0x03|0x0035) plen 5                          #208 14.653227
        Num handles: 1
        Handle: 201 Address: C0:07:E8:2C:B6:EE (OUI C0-07-E8)
        Count: 1
zephyr.exe[1300814]: < ACL Data TX: Handle 201 [1/3] flags 0x00 dlen 6                                             #209 14.653250
      ATT: Read Response (0x0b) len 1
        Value[1]: 00
> HCI Event: Number of Completed Packets (0x13) plen 5                                                             #210 14.768536
        Num handles: 1
        Handle: 201 Address: C0:07:E8:2C:B6:EE (OUI C0-07-E8)
        Count: 1
        Buffers: 0/3
        #209: len 6 (0 Kb/s)
        Latency: 115 msec (48-120 msec ~112 msec)
> ACL Data RX: Handle 201 flags 0x02 dlen 8                                                                        #211 14.768823
      ATT: Write Request (0x12) len 3
        Handle: 0x0006
          Data[1]: 02
zephyr.exe[1300814]: < HCI Command: Host Number of Completed Packets (0x03|0x0035) plen 5                          #212 14.773185
        Num handles: 1
        Handle: 201 Address: C0:07:E8:2C:B6:EE (OUI C0-07-E8)
        Count: 1
zephyr.exe[1300814]: < ACL Data TX: Handle 201 [1/3] flags 0x00 dlen 5                                             #213 14.773365
      ATT: Write Response (0x13) len 0
> HCI Event: Number of Completed Packets (0x13) plen 5                                                             #214 14.893440
        Num handles: 1
        Handle: 201 Address: C0:07:E8:2C:B6:EE (OUI C0-07-E8)
        Count: 1
        Buffers: 0/3
        #213: len 5 (0 Kb/s)
        Latency: 120 msec (48-120 msec ~116 msec)
> ACL Data RX: Handle 201 flags 0x02 dlen 11                                                                       #215 17.456174
      SMP: Pairing Request (0x01) len 6
        IO capability: KeyboardDisplay (0x04)
        OOB data: Authentication data not present (0x00)
        Authentication requirement: Bonding, No MITM, Legacy, No Keypresses (0x01)
        Max encryption key size: 16
        Initiator key distribution: EncKey IdKey Sign (0x07)
        Responder key distribution: EncKey IdKey Sign (0x07)
zephyr.exe[1300814]: < HCI Command: Host Number of Completed Packets (0x03|0x0035) plen 5                          #216 17.473210
        Num handles: 1
        Handle: 201 Address: C0:07:E8:2C:B6:EE (OUI C0-07-E8)
        Count: 1
zephyr.exe[1300814]: < ACL Data TX: Handle 201 [1/3] flags 0x00 dlen 11                                            #217 17.473263
      SMP: Pairing Response (0x02) len 6
        IO capability: DisplayOnly (0x00)
        OOB data: Authentication data not present (0x00)
        Authentication requirement: Bonding, No MITM, Legacy, No Keypresses (0x01)
        Max encryption key size: 16
        Initiator key distribution: EncKey IdKey Sign (0x07)
        Responder key distribution: EncKey Sign (0x05)
> HCI Event: Number of Completed Packets (0x13) plen 5                                                             #218 17.581144
        Num handles: 1
        Handle: 201 Address: C0:07:E8:2C:B6:EE (OUI C0-07-E8)
        Count: 1
        Buffers: 0/3
        #217: len 11 (0 Kb/s)
        Latency: 107 msec (48-120 msec ~112 msec)
> ACL Data RX: Handle 201 flags 0x02 dlen 21                                                                       #219 17.581409
      SMP: Pairing Confirm (0x03) len 16
        Confirm value[16]: 423366fc9b2c7f52d4e636dac6100cbe
zephyr.exe[1300814]: < HCI Command: Host Number of Completed Packets (0x03|0x0035) plen 5                          #220 17.593230
        Num handles: 1
        Handle: 201 Address: C0:07:E8:2C:B6:EE (OUI C0-07-E8)
        Count: 1
zephyr.exe[1300814]: < ACL Data TX: Handle 201 [1/3] flags 0x00 dlen 21                                            #221 17.593397
      SMP: Pairing Confirm (0x03) len 16
        Confirm value[16]: 264afd7f532d80f332e462ae8e0afcf4
> HCI Event: Number of Completed Packets (0x13) plen 5                                                             #222 17.706099
        Num handles: 1
        Handle: 201 Address: C0:07:E8:2C:B6:EE (OUI C0-07-E8)
        Count: 1
        Buffers: 0/3
        #221: len 21 (1 Kb/s)
        Latency: 112 msec (48-120 msec ~112 msec)
> ACL Data RX: Handle 201 flags 0x02 dlen 21                                                                       #223 17.706435
      SMP: Pairing Random (0x04) len 16
        Random value[16]: 0f2ed68d016aa8650000000000000000
zephyr.exe[1300814]: < HCI Command: Host Number of Completed Packets (0x03|0x0035) plen 5                          #224 17.713095
        Num handles: 1
        Handle: 201 Address: C0:07:E8:2C:B6:EE (OUI C0-07-E8)
        Count: 1
zephyr.exe[1300814]: < ACL Data TX: Handle 201 [1/3] flags 0x00 dlen 21                                            #225 17.713125
      SMP: Pairing Random (0x04) len 16
        Random value[16]: 8e6108f966a694cbe26df70bb96773e6
> HCI Event: Number of Completed Packets (0x13) plen 5                                                             #226 17.830982
        Num handles: 1
        Handle: 201 Address: C0:07:E8:2C:B6:EE (OUI C0-07-E8)
        Count: 1
        Buffers: 0/3
        #225: len 21 (1 Kb/s)
        Latency: 117 msec (48-120 msec ~115 msec)
> HCI Event: LE Meta Event (0x3e) plen 13                                                                          #227 17.893964
      LE Long Term Key Request (0x05)
        Handle: 201 Address: C0:07:E8:2C:B6:EE (OUI C0-07-E8)
        Random number: 0x0000000000000000
        Encrypted diversifier: 0x0000
zephyr.exe[1300814]: < HCI Command: LE Long Term Key Request Reply (0x08|0x001a) plen 18                           #228 17.913188
        Handle: 201 Address: C0:07:E8:2C:B6:EE (OUI C0-07-E8)
        Long term key[16]: d70b57e5f737c4c9475d68c96438857a
> HCI Event: Command Complete (0x0e) plen 6                                                                        #229 17.913889
      LE Long Term Key Request Reply (0x08|0x001a) ncmd 1
        Status: Success (0x00)
        Handle: 201 Address: C0:07:E8:2C:B6:EE (OUI C0-07-E8)
> HCI Event: Encryption Change (0x08) plen 4                                                                       #230 18.206243
        Status: Success (0x00)
        Handle: 201 Address: C0:07:E8:2C:B6:EE (OUI C0-07-E8)
        Encryption: Enabled with AES-CCM (0x01)
zephyr.exe[1300814]: < ACL Data TX: Handle 201 [1/3] flags 0x00 dlen 21                                            #231 18.323280
      SMP: Encryption Information (0x06) len 16
        Long term key[16]: 5da095555cc64d02679f89a05211af56
zephyr.exe[1300814]: < ACL Data TX: Handle 201 [2/3] flags 0x00 dlen 15                                            #232 18.323321
      SMP: Central Identification (0x07) len 10
        EDIV: 0x825e
        Rand: 0x84c81ed264dab3d8
zephyr.exe[1300814]: < ACL Data TX: Handle 201 [3/3] flags 0x00 dlen 21                                            #233 18.323324
      SMP: Signing Information (0x0a) len 16
        Signature key[16]: bc235a02440d0c3424a2acf8fd71a45c
> HCI Event: Number of Completed Packets (0x13) plen 5                                                             #234 18.331502
        Num handles: 1
        Handle: 201 Address: C0:07:E8:2C:B6:EE (OUI C0-07-E8)
        Count: 1
        Buffers: 2/3
        #231: len 21 (21 Kb/s)
        Latency: 8 msec (8-120 msec ~61 msec)
> HCI Event: Number of Completed Packets (0x13) plen 5                                                             #235 18.331899
        Num handles: 1
        Handle: 201 Address: C0:07:E8:2C:B6:EE (OUI C0-07-E8)
        Count: 1
        Buffers: 1/3
        #232: len 15 (15 Kb/s)
        Latency: 8 msec (8-120 msec ~35 msec)
> HCI Event: Number of Completed Packets (0x13) plen 5                                                             #236 18.393651
        Num handles: 1
        Handle: 201 Address: C0:07:E8:2C:B6:EE (OUI C0-07-E8)
        Count: 1
        Buffers: 0/3
        #233: len 21 (2 Kb/s)
        Latency: 70 msec (8-120 msec ~52 msec)
> ACL Data RX: Handle 201 flags 0x02 dlen 21                                                                       #237 18.393917
      SMP: Encryption Information (0x06) len 16
        Long term key[16]: 588a963ecfb3b068208811e50fd427f9
> ACL Data RX: Handle 201 flags 0x02 dlen 15                                                                       #238 18.394194
      SMP: Central Identification (0x07) len 10
        EDIV: 0x5289
        Rand: 0x4cb8784a64e13715
> ACL Data RX: Handle 201 flags 0x02 dlen 21                                                                       #239 18.394687
      SMP: Identity Information (0x08) len 16
        Identity resolving key[16]: 1cf077ce381bbde283e0bd3baffad01d
zephyr.exe[1300814]: < HCI Command: Host Number of Completed Packets (0x03|0x0035) plen 5                          #240 18.413228
        Num handles: 1
        Handle: 201 Address: C0:07:E8:2C:B6:EE (OUI C0-07-E8)
        Count: 1
zephyr.exe[1300814]: < HCI Command: Host Number of Completed Packets (0x03|0x0035) plen 5                          #241 18.413481
        Num handles: 1
        Handle: 201 Address: C0:07:E8:2C:B6:EE (OUI C0-07-E8)
        Count: 1
zephyr.exe[1300814]: < HCI Command: Host Number of Completed Packets (0x03|0x0035) plen 5                          #242 18.413781
        Num handles: 1
        Handle: 201 Address: C0:07:E8:2C:B6:EE (OUI C0-07-E8)
        Count: 1
> ACL Data RX: Handle 201 flags 0x02 dlen 12                                                                       #243 18.413776
      SMP: Identity Address Information (0x09) len 7
        Address: C0:07:E8:2C:B6:EE (OUI C0-07-E8)
zephyr.exe[1300814]: < HCI Command: LE Add Device To Resolving List (0x08|0x0027) plen 39                          #244 18.433219
        Address type: Public (0x00)
        Address: C0:07:E8:2C:B6:EE (OUI C0-07-E8)
        Peer identity resolving key[16]: 1cf077ce381bbde283e0bd3baffad01d
        Local identity resolving key[16]: 00000000000000000000000000000000
> HCI Event: Command Complete (0x0e) plen 4                                                                        #245 18.434215
      LE Add Device To Resolving List (0x08|0x0027) ncmd 1
        Status: Success (0x00)
zephyr.exe[1300814]: < HCI Command: LE Set Privacy Mode (0x08|0x004e) plen 8                                       #246 18.453099
        Peer Identity address type: Public (0x00)
        Peer Identity address: C0:07:E8:2C:B6:EE (OUI C0-07-E8)
        Privacy Mode: Use Device Privacy (0x01)
> HCI Event: Command Complete (0x0e) plen 4                                                                        #247 18.453622
      LE Set Privacy Mode (0x08|0x004e) ncmd 1
        Status: Success (0x00)
> ACL Data RX: Handle 201 flags 0x02 dlen 21                                                                       #248 18.456270
      SMP: Signing Information (0x0a) len 16
        Signature key[16]: fa833b060073a949d364d8f94d989208
> ACL Data RX: Handle 201 flags 0x02 dlen 26                                                                       #249 18.456739
      LE L2CAP: Enhanced Credit Connection Request (0x17) ident 1 len 18
        PSM: 39 (0x0027)
        MTU: 64
        MPS: 64
        Credits: 5
        Source CID: 84
        Source CID: 83
        Source CID: 82
        Source CID: 81
        Source CID: 80
zephyr.exe[1300814]: < HCI Command: LE Set Address Resolution Enable (0x08|0x002d) plen 1                          #250 18.473177
        Address resolution: Enabled (0x01)
> HCI Event: Command Complete (0x0e) plen 4                                                                        #251 18.473602
      LE Set Address Resolution Enable (0x08|0x002d) ncmd 1
        Status: Success (0x00)
zephyr.exe[1300814]: < HCI Command: Host Number of Completed Packets (0x03|0x0035) plen 5                          #252 18.493073
        Num handles: 1
        Handle: 201 Address: C0:07:E8:2C:B6:EE (OUI C0-07-E8)
        Count: 1
zephyr.exe[1300814]: < HCI Command: Host Number of Completed Packets (0x03|0x0035) plen 5                          #253 18.493174
        Num handles: 1
        Handle: 201 Address: C0:07:E8:2C:B6:EE (OUI C0-07-E8)
        Count: 1
zephyr.exe[1300814]: < HCI Command: Host Number of Completed Packets (0x03|0x0035) plen 5                          #254 18.493180
        Num handles: 1
        Handle: 201 Address: C0:07:E8:2C:B6:EE (OUI C0-07-E8)
        Count: 1
zephyr.exe[1300814]: < ACL Data TX: Handle 201 [1/3] flags 0x00 dlen 26                                            #255 18.493494
      LE L2CAP: Enhanced Credit Connection Response (0x18) ident 1 len 18
        MTU: 249
        MPS: 251
        Credits: 1
        Result: Connection successful (0x0000)
        Destination CID: 64
        Destination CID: 65
        Destination CID: 66
        Destination CID: 67
        Destination CID: 68
> HCI Event: Number of Completed Packets (0x13) plen 5                                                             #256 18.581001
        Num handles: 1
        Handle: 201 Address: C0:07:E8:2C:B6:EE (OUI C0