Bluetooth monitor ver 5.72
= Note: Linux version 6.14.0-36-generic (x86_64)                       0.264375
= Note: Bluetooth subsystem version 2.22                               0.264377
= New Index: 00:00:00:00:00:00 (Primary,UART,hci1)              [hci1] 0.264378
= New Index: 48:5F:99:8E:E0:64 (Primary,USB,hci0)               [hci0] 0.264379
= Open Index: 00:00:00:00:00:00                                 [hci1] 0.378212
= Index Info: 00:00:00:00:00:00 (Nordic Semiconductor ASA)      [hci1] 0.378236
@ USER Open: main (privileged) version 2.22            {0x0001} [hci1] 0.378246
< HCI Command: Reset (0x03|0x0003) plen 0                    #1 [hci1] 0.379533
> HCI Event: Command Complete (0x0e) plen 4                  #2 [hci1] 0.380040
      Reset (0x03|0x0003) ncmd 1
        Status: Success (0x00)
< HCI Command: Read Local Supported... (0x04|0x0003) plen 0  #3 [hci1] 0.397911
> HCI Event: Command Complete (0x0e) plen 12                 #4 [hci1] 0.398457
      Read Local Supported Features (0x04|0x0003) ncmd 1
        Status: Success (0x00)
        Features: 0x00 0x00 0x00 0x00 0x60 0x00 0x00 0x00
          BR/EDR Not Supported
          LE Supported (Controller)
< HCI Command: Read Local Version In.. (0x04|0x0001) plen 0  #5 [hci1] 0.417599
> HCI Event: Command Complete (0x0e) plen 12                 #6 [hci1] 0.418056
      Read Local Version Information (0x04|0x0001) ncmd 1
        Status: Success (0x00)
        HCI version: Reserved (0x0f) - Revision 12393 (0x3069)
        LMP version: Reserved (0x0f) - Subversion 12393 (0x3069)
        Manufacturer: Nordic Semiconductor ASA (89)
< HCI Command: Read Local Supported... (0x04|0x0002) plen 0  #7 [hci1] 0.437533
> HCI Event: Command Complete (0x0e) plen 68                 #8 [hci1] 0.438622
      Read Local Supported Commands (0x04|0x0002) ncmd 1
        Status: Success (0x00)
        Commands: 119 entries
          Disconnect (Octet 0 - Bit 5)
          Read Remote Version Information (Octet 2 - Bit 7)
          Set Event Mask (Octet 5 - Bit 6)
          Reset (Octet 5 - Bit 7)
          Read Connection Accept Timeout (Octet 7 - Bit 2)
          Write Connection Accept Timeout (Octet 7 - Bit 3)
          Read Transmit Power Level (Octet 10 - Bit 2)
          Set Controller To Host Flow Control (Octet 10 - Bit 5)
          Host Buffer Size (Octet 10 - Bit 6)
          Host Number of Completed Packets (Octet 10 - Bit 7)
          Read Local Version Information (Octet 14 - Bit 3)
          Read Local Supported Features (Octet 14 - Bit 5)
          Read BD ADDR (Octet 15 - Bit 1)
          Read RSSI (Octet 15 - Bit 5)
          Set Event Mask Page 2 (Octet 22 - Bit 2)
          LE Set Event Mask (Octet 25 - Bit 0)
          LE Read Buffer Size (Octet 25 - Bit 1)
          LE Read Local Supported Features (Octet 25 - Bit 2)
          LE Set Random Address (Octet 25 - Bit 4)
          LE Set Advertising Parameters (Octet 25 - Bit 5)
          LE Read Advertising Channel TX Power (Octet 25 - Bit 6)
          LE Set Advertising Data (Octet 25 - Bit 7)
          LE Set Scan Response Data (Octet 26 - Bit 0)
          LE Set Advertise Enable (Octet 26 - Bit 1)
          LE Set Scan Parameters (Octet 26 - Bit 2)
          LE Set Scan Enable (Octet 26 - Bit 3)
          LE Create Connection (Octet 26 - Bit 4)
          LE Create Connection Cancel (Octet 26 - Bit 5)
          LE Read Accept List Size (Octet 26 - Bit 6)
          LE Clear Accept List (Octet 26 - Bit 7)
          LE Add Device To Accept List (Octet 27 - Bit 0)
          LE Remove Device From Accept List (Octet 27 - Bit 1)
          LE Connection Update (Octet 27 - Bit 2)
          LE Set Host Channel Classification (Octet 27 - Bit 3)
          LE Read Channel Map (Octet 27 - Bit 4)
          LE Read Remote Used Features (Octet 27 - Bit 5)
          LE Encrypt (Octet 27 - Bit 6)
          LE Rand (Octet 27 - Bit 7)
          LE Start Encryption (Octet 28 - Bit 0)
          LE Long Term Key Request Reply (Octet 28 - Bit 1)
          LE Long Term Key Request Neg Reply (Octet 28 - Bit 2)
          LE Read Supported States (Octet 28 - Bit 3)
          LE Receiver Test (Octet 28 - Bit 4)
          LE Transmitter Test (Octet 28 - Bit 5)
          LE Test End (Octet 28 - Bit 6)
          Read Authenticated Payload Timeout (Octet 32 - Bit 4)
          Write Authenticated Payload Timeout (Octet 32 - Bit 5)
          LE Set Data Length (Octet 33 - Bit 6)
          LE Read Suggested Default Data Length (Octet 33 - Bit 7)
          LE Write Suggested Default Data Length (Octet 34 - Bit 0)
          LE Add Device To Resolving List (Octet 34 - Bit 3)
          LE Remove Device From Resolving List (Octet 34 - Bit 4)
          LE Clear Resolving List (Octet 34 - Bit 5)
          LE Read Resolving List Size (Octet 34 - Bit 6)
          LE Set Address Resolution Enable (Octet 35 - Bit 1)
          LE Set Resolvable Private Address Timeout (Octet 35 - Bit 2)
          LE Read Maximum Data Length (Octet 35 - Bit 3)
          LE Read PHY (Octet 35 - Bit 4)
          LE Set Default PHY (Octet 35 - Bit 5)
          LE Set PHY (Octet 35 - Bit 6)
          LE Enhanced Receiver Test (Octet 35 - Bit 7)
          LE Enhanced Transmitter Test (Octet 36 - Bit 0)
          LE Set Advertising Set Random Address (Octet 36 - Bit 1)
          LE Set Extended Advertising Parameters (Octet 36 - Bit 2)
          LE Set Extended Advertising Data (Octet 36 - Bit 3)
          LE Set Extended Scan Response Data (Octet 36 - Bit 4)
          LE Set Extended Advertising Enable (Octet 36 - Bit 5)
          LE Read Maximum Advertising Data Length (Octet 36 - Bit 6)
          LE Read Number of Supported Advertising Sets (Octet 36 - Bit 7)
          LE Remove Advertising Set (Octet 37 - Bit 0)
          LE Clear Advertising Sets (Octet 37 - Bit 1)
          LE Set Periodic Advertising Parameters (Octet 37 - Bit 2)
          LE Set Periodic Advertising Data (Octet 37 - Bit 3)
          LE Set Periodic Advertising Enable (Octet 37 - Bit 4)
          LE Set Extended Scan Parameters (Octet 37 - Bit 5)
          LE Set Extended Scan Enable (Octet 37 - Bit 6)
          LE Extended Create Connection (Octet 37 - Bit 7)
          LE Periodic Advertising Create Sync (Octet 38 - Bit 0)
          LE Periodic Advertising Create Sync Cancel (Octet 38 - Bit 1)
          LE Periodic Advertising Terminate Sync (Octet 38 - Bit 2)
          LE Add Device To Periodic Advertiser List (Octet 38 - Bit 3)
          LE Remove Device From Periodic Advertiser List (Octet 38 - Bit 4)
          LE Clear Periodic Advertiser List (Octet 38 - Bit 5)
          LE Read Periodic Advertiser List Size (Octet 38 - Bit 6)
          LE Read Transmit Power (Octet 38 - Bit 7)
          LE Read RF Path Compensation (Octet 39 - Bit 0)
          LE Write RF Path Compensation (Octet 39 - Bit 1)
          LE Set Privacy Mode (Octet 39 - Bit 2)
          LE Periodic Advertising Receive Enable (Octet 40 - Bit 5)
          LE Periodic Advertising Sync Transfer (Octet 40 - Bit 6)
          LE Periodic Advertising Set Info Transfer (Octet 40 - Bit 7)
          LE Periodic Advertising Sync Transfer Parameters (Octet 41 - Bit 0)
          LE Set Default Periodic Advertisng Sync Transfer Parameters (Octet 41 - Bit 1)
          LE Read Buffer v2 (Octet 41 - Bit 5)
          LE Read ISO TX Sync (Octet 41 - Bit 6)
          LE Set Connected Isochronous Group Parameters (Octet 41 - Bit 7)
          LE Set Connected Isochronous Group Parameters Test (Octet 42 - Bit 0)
          LE Create Connected Isochronous Stream (Octet 42 - Bit 1)
          LE Remove Connected Isochronous Group (Octet 42 - Bit 2)
          LE Accept Connected Isochronous Stream Request (Octet 42 - Bit 3)
          LE Reject Connected Isochronous Stream Request (Octet 42 - Bit 4)
          LE Create Broadcast Isochronous Group (Octet 42 - Bit 5)
          LE Create Broadcast Isochronous Group Test (Octet 42 - Bit 6)
          LE Terminate Broadcast Isochronous Group (Octet 42 - Bit 7)
          LE Broadcast Isochronous Group Create Sync (Octet 43 - Bit 0)
          LE Broadcast Isochronous Group Terminate Sync (Octet 43 - Bit 1)
          LE Request Peer SCA (Octet 43 - Bit 2)
          LE Setup Isochronous Data Path (Octet 43 - Bit 3)
          LE Remove Isochronous Data Path (Octet 43 - Bit 4)
          LE Isochronous Transmit Test (Octet 43 - Bit 5)
          LE Isochronous Receive Test (Octet 43 - Bit 6)
          LE Isochronous Read Test Counters (Octet 43 - Bit 7)
          LE Isochronous Read Test Counters (Octet 44 - Bit 0)
          LE Set Host Feature (Octet 44 - Bit 1)
          Octet 44 - Bit 2 
          Octet 45 - Bit 6 
          Octet 46 - Bit 0 
          Octet 46 - Bit 1 
          Octet 46 - Bit 2 
< HCI Command: Host Buffer Size (0x03|0x0033) plen 7         #9 [hci1] 0.457534
        ACL MTU: 255  ACL max packet: 16
        SCO MTU: 0    SCO max packet: 0
> HCI Event: Command Complete (0x0e) plen 4                 #10 [hci1] 0.458029
      Host Buffer Size (0x03|0x0033) ncmd 1
        Status: Success (0x00)
< HCI Command: Set Controller To Ho.. (0x03|0x0031) plen 1  #11 [hci1] 0.477531
        Flow control: ACL Data Packets (0x01)
> HCI Event: Command Complete (0x0e) plen 4                 #12 [hci1] 0.477962
      Set Controller To Host Flow Control (0x03|0x0031) ncmd 1
        Status: Success (0x00)
< HCI Command: LE Read Local Suppor.. (0x08|0x0003) plen 0  #13 [hci1] 0.497569
> HCI Event: Command Complete (0x0e) plen 12                #14 [hci1] 0.498031
      LE Read Local Supported Features (0x08|0x0003) ncmd 1
        Status: Success (0x00)
        Features: 0xfd 0x79 0x00 0xf7 0x30 0x01 0x00 0x00
          LE Encryption
          Extended Reject Indication
          Peripheral-initiated Features Exchange
          LE Ping
          LE Data Packet Length Extension
          LL Privacy
          Extended Scanner Filter Policies
          LE 2M PHY
          LE Coded PHY
          LE Extended Advertising
          LE Periodic Advertising
          Channel Selection Algorithm #2
          Periodic Advertising Sync Transfer - Sender
          Periodic Advertising Sync Transfer - Recipient
          Sleep Clock Accuracy Updates
          Connected Isochronous Stream - Central
          Connected Isochronous Stream - Peripheral
          Isochronous Broadcaster
          Synchronized Receiver
          Periodic Advertising ADI support
          Connection Subrating
          Unknown features (0x0000010000000000)
< HCI Command: LE Set Host Feature (0x08|0x0074) plen 2     #15 [hci1] 0.517529
        Bit Number: 32
          Connected Isochronous Stream (Host Support)
        Bit Value: 1
> HCI Event: Command Complete (0x0e) plen 4                 #16 [hci1] 0.518027
      LE Set Host Feature (0x08|0x0074) ncmd 1
        Status: Success (0x00)
< HCI Command: LE Read Buffer v2 (0x08|0x0060) plen 0       #17 [hci1] 0.537535
> HCI Event: Command Complete (0x0e) plen 10                #18 [hci1] 0.538015
      LE Read Buffer v2 (0x08|0x0060) ncmd 1
        Status: Success (0x00)
        ACL MTU: 27
        ACL max packet: 3
        ISO MTU: 318
        ISO max packet: 3
< HCI Command: LE Read Maximum Adve.. (0x08|0x003a) plen 0  #19 [hci1] 0.557602
> HCI Event: Command Complete (0x0e) plen 6                 #20 [hci1] 0.558083
      LE Read Maximum Advertising Data Length (0x08|0x003a) ncmd 1
        Status: Success (0x00)
        Max length: 1650
< HCI Command: LE Read Supported St.. (0x08|0x001c) plen 0  #21 [hci1] 0.577531
> HCI Event: Command Complete (0x0e) plen 12                #22 [hci1] 0.578010
      LE Read Supported States (0x08|0x001c) ncmd 1
        Status: Success (0x00)
        States: 0x000003ff3e0306ff
          Non-connectable Advertising State
          Scannable Advertising State
          Connectable Advertising State
          High Duty Cycle Directed Advertising State
          Passive Scanning State
          Active Scanning State
          Initiating State
            and Connection State (Central Role)
          Connection State (Peripheral Role)
          Scannable Advertising State
            and Passive Scanning State
          Connectable Advertising State
            and Passive Scanning State
          Non-connectable Advertising State
            and Initiating State
          Scannable Advertising State
            and Initiating State
          Active Scanning State
            and Connection State (Central Role)
          Passive Scanning State
            and Connection State (Peripheral Role)
          Active Scanning State
            and Connection State (Peripheral Role)
          Initiating State
            and Connection State (Central Role)
            and Central Role & Central Role
          Low Duty Cycle Directed Advertising State
          Connectable Advertising State
            and Initiating State
            and Central Role & Peripheral Role
          High Duty Cycle Directed Advertising State
            and Initiating State
            and Central Role & Peripheral Role
          Low Duty Cycle Directed Advertising State
            and Initiating State
            and Central Role & Peripheral Role
          Connectable Advertising State
            and Connection State (Central Role)
            and Central Role & Peripheral Role
          High Duty Cycle Directed Advertising State
            and Connection State (Central Role)
            and Central Role & Peripheral Role
          Low Duty Cycle Directed Advertising State
            and Connection State (Central Role)
            and Central Role & Peripheral Role
          Connectable Advertising State
            and Connection State (Peripheral Role)
            and Central Role & Peripheral Role
          High Duty Cycle Directed Advertising State
            and Connection State (Peripheral Role)
            and Peripheral Role & Peripheral Role
          Low Duty Cycle Directed Advertising State
            and Connection State (Peripheral Role)
            and Peripheral Role & Peripheral Role
          Initiating State
            and Connection State (Peripheral Role)
            and Central Role & Peripheral Role
< HCI Command: LE Read Maximum Data.. (0x08|0x002f) plen 0  #23 [hci1] 0.597550
> HCI Event: Command Complete (0x0e) plen 12                #24 [hci1] 0.598058
      LE Read Maximum Data Length (0x08|0x002f) ncmd 1
        Status: Success (0x00)
        Max TX octets: 251
        Max TX time: 2704
        Max RX octets: 251
        Max RX time: 2704
< HCI Command: LE Write Suggested D.. (0x08|0x0024) plen 4  #25 [hci1] 0.617536
        TX octets: 251
        TX time: 2704
> HCI Event: Command Complete (0x0e) plen 4                 #26 [hci1] 0.617986
      LE Write Suggested Default Data Length (0x08|0x0024) ncmd 1
        Status: Success (0x00)
< HCI Command: LE Read Resolving Li.. (0x08|0x002a) plen 0  #27 [hci1] 0.637525
> HCI Event: Command Complete (0x0e) plen 5                 #28 [hci1] 0.637981
      LE Read Resolving List Size (0x08|0x002a) ncmd 1
        Status: Success (0x00)
        Size: 8
< HCI Command: LE Set Event Mask (0x08|0x0001) plen 8       #29 [hci1] 0.657543
        Mask: 0x000002023f87fa5e
          LE Advertising Report
          LE Connection Update Complete
          LE Read Remote Used Features Complete
          LE Long Term Key Request
          LE Data Length Change
          LE Enhanced Connection Complete
          LE PHY Update Complete
          LE Extended Advertising Report
          LE Periodic Advertising Sync Established
          LE Periodic Advertising Report
          LE Periodic Advertising Sync Lost
          LE Extended Scan Timeout
          LE Extended Advertising Set Terminated
          LE Scan Request Received
          LE Periodic Advertising Sync Transfer Rvc
          LE CIS Established
          LE CIS Request
          LE Create BIG Complete
          LE Terminate BIG Complete
          LE BIG Sync Estabilished Complete
          LE BIG Sync Lost
          LE BIG Info Advertising Report
          Unknown mask (0x0000020000000000)
> HCI Event: Command Complete (0x0e) plen 4                 #30 [hci1] 0.658054
      LE Set Event Mask (0x08|0x0001) ncmd 1
        Status: Success (0x00)
< HCI Command: Set Event Mask (0x03|0x0001) plen 8          #31 [hci1] 0.677525
        Mask: 0x2000800002008890
          Disconnection Complete
          Encryption Change
          Read Remote Version Information Complete
          Hardware Error
          Data Buffer Overflow
          Encryption Key Refresh Complete
          LE Meta
> HCI Event: Command Complete (0x0e) plen 4                 #32 [hci1] 0.678062
      Set Event Mask (0x03|0x0001) ncmd 1
        Status: Success (0x00)
< HCI Command: Read BD ADDR (0x04|0x0009) plen 0            #33 [hci1] 0.697544
> HCI Event: Command Complete (0x0e) plen 10                #34 [hci1] 0.698060
      Read BD ADDR (0x04|0x0009) ncmd 1
        Status: Success (0x00)
        Address: 00:00:00:00:00:00 (OUI 00-00-00)
< HCI Command: LE Set Random Address (0x08|0x0005) plen 6   #35 [hci1] 0.717562
        Address: D5:B6:CC:31:DB:3B (Static)
> HCI Event: Command Complete (0x0e) plen 4                 #36 [hci1] 0.718074
      LE Set Random Address (0x08|0x0005) ncmd 1
        Status: Success (0x00)
< HCI Command: LE Set Extended Adv.. (0x08|0x0036) plen 25  #37 [hci1] 4.197696
        Handle: 0x00
        Properties: 0x0010
          Use legacy advertising PDUs: ADV_NONCONN_IND
        Min advertising interval: 20.000 msec (0x0020)
        Max advertising interval: 20.000 msec (0x0020)
        Channel map: 37, 38, 39 (0x07)
        Own address type: Random (0x01)
        Peer address type: Public (0x00)
        Peer address: 00:00:00:00:00:00 (OUI 00-00-00)
        Filter policy: Allow Scan Request from Any, Allow Connect Request from Any (0x00)
        TX power: Host has no preference (0x7f)
        Primary PHY: LE 1M (0x01)
        Secondary max skip: 0x00
        Secondary PHY: LE 1M (0x01)
        SID: 0x00
        Scan request notifications: Disabled (0x00)
> HCI Event: Command Complete (0x0e) plen 5                 #38 [hci1] 4.198474
      LE Set Extended Advertising Parameters (0x08|0x0036) ncmd 1
        Status: Success (0x00)
        TX power (selected): 0 dbm (0x00)
< HCI Command: LE Set Advertising S.. (0x08|0x0035) plen 7  #39 [hci1] 4.217541
        Advertising handle: 0x00
        Advertising random address: 24:34:0C:0D:44:02 (Non-Resolvable)
> HCI Event: Command Complete (0x0e) plen 4                 #40 [hci1] 4.218069
      LE Set Advertising Set Random Address (0x08|0x0035) ncmd 1
        Status: Success (0x00)
< HCI Command: LE Set Random Address (0x08|0x0005) plen 6   #41 [hci1] 4.237602
        Address: 24:71:FD:F8:AC:A2 (Non-Resolvable)
> HCI Event: Command Complete (0x0e) plen 4                 #42 [hci1] 4.238162
      LE Set Random Address (0x08|0x0005) ncmd 1
        Status: Success (0x00)
< HCI Command: LE Set Extended Scan.. (0x08|0x0041) plen 8  #43 [hci1] 4.257593
        Own address type: Random (0x01)
        Filter policy: Accept all advertisement (0x00)
        PHYs: 0x01
        Entry 0: LE 1M
          Type: Passive (0x00)
          Interval: 30.000 msec (0x0030)
          Window: 30.000 msec (0x0030)
> HCI Event: Command Complete (0x0e) plen 4                 #44 [hci1] 4.258091
      LE Set Extended Scan Parameters (0x08|0x0041) ncmd 1
        Status: Success (0x00)
< HCI Command: LE Set Extended Scan.. (0x08|0x0042) plen 6  #45 [hci1] 4.277611
        Extended scan: Enabled (0x01)
        Filter duplicates: Disabled (0x00)
        Duration: 0 msec (0x0000)
        Period: 0.00 sec (0x0000)
> HCI Event: Command Complete (0x0e) plen 4                 #46 [hci1] 4.278107
      LE Set Extended Scan Enable (0x08|0x0042) ncmd 1
        Status: Success (0x00)
< HCI Command: LE Set Advertising S.. (0x08|0x0035) plen 7  #47 [hci1] 4.297782
        Advertising handle: 0x00
        Advertising random address: D5:B6:CC:31:DB:3B (Static)
> HCI Event: Command Complete (0x0e) plen 4                 #48 [hci1] 4.298278
      LE Set Advertising Set Random Address (0x08|0x0035) ncmd 1
        Status: Success (0x00)
< HCI Command: LE Set Extended Adv.. (0x08|0x0036) plen 25  #49 [hci1] 4.317579
        Handle: 0x00
        Properties: 0x0013
          Connectable
          Scannable
          Use legacy advertising PDUs: ADV_IND
        Min advertising interval: 100.000 msec (0x00a0)
        Max advertising interval: 150.000 msec (0x00f0)
        Channel map: 37, 38, 39 (0x07)
        Own address type: Random (0x01)
        Peer address type: Public (0x00)
        Peer address: 00:00:00:00:00:00 (OUI 00-00-00)
        Filter policy: Allow Scan Request from Any, Allow Connect Request from Any (0x00)
        TX power: Host has no preference (0x7f)
        Primary PHY: LE 1M (0x01)
        Secondary max skip: 0x00
        Secondary PHY: LE 1M (0x01)
        SID: 0x00
        Scan request notifications: Disabled (0x00)
> HCI Event: Command Complete (0x0e) plen 5                 #50 [hci1] 4.318407
      LE Set Extended Advertising Parameters (0x08|0x0036) ncmd 1
        Status: Success (0x00)
        TX power (selected): 0 dbm (0x00)
< HCI Command: LE Set Extended Adv.. (0x08|0x0037) plen 33  #51 [hci1] 4.337595
        Handle: 0x00
        Operation: Complete extended advertising data (0x03)
        Fragment preference: Minimize fragmentation (0x01)
        Data length: 0x1d
        Flags: 0x06
          LE General Discoverable Mode
          BR/EDR Not Supported
        16-bit Service UUIDs (complete): 1 entry
          Mesh Provisioning (0x1827)
        Service Data: Mesh Provisioning (0x1827)
          Data: 9bc6bc68ab9b49a1b9d3602e69991a200000
> HCI Event: Command Complete (0x0e) plen 4                 #52 [hci1] 4.338395
      LE Set Extended Advertising Data (0x08|0x0037) ncmd 1
        Status: Success (0x00)
< HCI Command: LE Set Extended Sca.. (0x08|0x0038) plen 20  #53 [hci1] 4.357613
        Handle: 0x00
        Operation: Complete scan response data (0x03)
        Fragment preference: Minimize fragmentation (0x01)
        Data length: 0x10
        Unknown EIR field 0x24: 546573746572
        Name (complete): Tester
> HCI Event: Command Complete (0x0e) plen 4                 #54 [hci1] 4.358336
      LE Set Extended Scan Response Data (0x08|0x0038) ncmd 1
        Status: Success (0x00)
< HCI Command: LE Set Extended Adve.. (0x08|0x0039) plen 6  #55 [hci1] 4.377593
        Extended advertising: Enabled (0x01)
        Number of sets: 1 (0x01)
        Entry 0
          Handle: 0x00
          Duration: 60000 ms (0x1770)
          Max ext adv events: 0
> HCI Event: Command Complete (0x0e) plen 4                 #56 [hci1] 4.378091
      LE Set Extended Advertising Enable (0x08|0x0039) ncmd 1
        Status: Success (0x00)
< HCI Command: LE Set Extended Adve.. (0x08|0x0039) plen 6  #57 [hci1] 4.397614
        Extended advertising: Disabled (0x00)
        Number of sets: 1 (0x01)
        Entry 0
          Handle: 0x00
          Duration: 0 ms (0x00)
          Max ext adv events: 0
> HCI Event: Command Complete (0x0e) plen 4                 #58 [hci1] 4.398092
      LE Set Extended Advertising Enable (0x08|0x0039) ncmd 1
        Status: Success (0x00)
< HCI Command: LE Set Advertising S.. (0x08|0x0035) plen 7  #59 [hci1] 4.417562
        Advertising handle: 0x00
        Advertising random address: 27:DD:CA:1B:4A:5C (Non-Resolvable)
> HCI Event: Command Complete (0x0e) plen 4                 #60 [hci1] 4.418047
      LE Set Advertising Set Random Address (0x08|0x0035) ncmd 1
        Status: Success (0x00)
< HCI Command: LE Set Extended Adv.. (0x08|0x0036) plen 25  #61 [hci1] 4.437612
        Handle: 0x00
        Properties: 0x0010
          Use legacy advertising PDUs: ADV_NONCONN_IND
        Min advertising interval: 20.000 msec (0x0020)
        Max advertising interval: 20.000 msec (0x0020)
        Channel map: 37, 38, 39 (0x07)
        Own address type: Random (0x01)
        Peer address type: Public (0x00)
        Peer address: 00:00:00:00:00:00 (OUI 00-00-00)
        Filter policy: Allow Scan Request from Any, Allow Connect Request from Any (0x00)
        TX power: Host has no preference (0x7f)
        Primary PHY: LE 1M (0x01)
        Secondary max skip: 0x00
        Secondary PHY: LE 1M (0x01)
        SID: 0x00
        Scan request notifications: Disabled (0x00)
> HCI Event: Command Complete (0x0e) plen 5                 #62 [hci1] 4.438345
      LE Set Extended Advertising Parameters (0x08|0x0036) ncmd 1
        Status: Success (0x00)
        TX power (selected): 0 dbm (0x00)
< HCI Command: LE Set Extended Adv.. (0x08|0x0037) plen 29  #63 [hci1] 4.457589
        Handle: 0x00
        Operation: Complete extended advertising data (0x03)
        Fragment preference: Minimize fragmentation (0x01)
        Data length: 0x19
        Mesh Beacon: 009bc6bc68ab9b49a1b9d3602e69991a200002a30a8708
          Unprovisioned Device Beacon (0x00)
          Device UUID: 9bc6bc68ab9b49a1b9d3602e69991a20
          OOB Information: 0x0002
            Electronic / URI
          URI Hash: 0xa30a8708
> HCI Event: Command Complete (0x0e) plen 4                 #64 [hci1] 4.458451
      LE Set Extended Advertising Data (0x08|0x0037) ncmd 1
        Status: Success (0x00)
< HCI Command: LE Set Extended Adve.. (0x08|0x0039) plen 6  #65 [hci1] 4.477588
        Extended advertising: Enabled (0x01)
        Number of sets: 1 (0x01)
        Entry 0
          Handle: 0x00
          Duration: 0 ms (0x00)
          Max ext adv events: 3
> HCI Event: Command Complete (0x0e) plen 4                 #66 [hci1] 4.478046
      LE Set Extended Advertising Enable (0x08|0x0039) ncmd 1
        Status: Success (0x00)
> HCI Event: LE Meta Event (0x3e) plen 50                   #67 [hci1] 4.502525
      LE Extended Advertising Report (0x0d)
        Num reports: 1
        Entry 0
          Event type: 0x0010
            Props: 0x0010
              Use legacy advertising PDUs
            Data status: [0;32mComplete[0m
          Legacy PDU Type: ADV_NONCONN_IND (0x0010)
          Address type: Public (0x00)
          Address: DF:A9:FF:F6:B1:1A (OUI DF-A9-FF)
          Primary PHY: LE 1M
          Secondary PHY: No packets
          SID: no ADI field (0xff)
          TX power: 127 dBm
          RSSI: -26 dBm (0xe6)
          Periodic advertising interval: 0.00 msec (0x0000)
          Direct address type: Reserved (0xff)
          Direct address: 00-00-00-00-00-00
          Data length: 0x18
        17 29 70 8d 7a 59 00 03 9b c6 bc 68 ab 9b 49 a1  .)p.zY.....h..I.
        b9 d3 60 2e 69 99 1a 20                          ..`.i..         
        Mesh Provisioning: 708d7a5900039bc6bc68ab9b49a1b9d3602e69991a20
          Link ID: 0x708d7a59
          Transaction Number: 0
          Provisioning Bearer Control (0x03)
          Link Open (0x00)
          Device UUID: 039bc6bc68ab9b49a1b9d3602e69991a
> HCI Event: LE Meta Event (0x3e) plen 6                    #68 [hci1] 4.531789
      LE Advertising Set Terminated (0x12)
        Status: Limit Reached (0x43)
        Handle: 0
        Connection handle: 65535
        Number of completed extended advertising events: 3
< HCI Command: LE Set Extended Adv.. (0x08|0x0037) plen 12  #69 [hci1] 4.537740
        Handle: 0x00
        Operation: Complete extended advertising data (0x03)
        Fragment preference: Minimize fragmentation (0x01)
        Data length: 0x08
        Unknown EIR field 0x24: 546573746572
> HCI Event: Command Complete (0x0e) plen 4                 #70 [hci1] 4.538302
      LE Set Extended Advertising Data (0x08|0x0037) ncmd 1
        Status: Success (0x00)
> HCI Event: LE Meta Event (0x3e) plen 50                   #71 [hci1] 4.548096
      LE Extended Advertising Report (0x0d)
        Num reports: 1
        Entry 0
          Event type: 0x0010
            Props: 0x0010
              Use legacy advertising PDUs
            Data status: [0;32mComplete[0m
          Legacy PDU Type: ADV_NONCONN_IND (0x0010)
          Address type: Public (0x00)
          Address: DF:A9:FF:F6:B1:1A (OUI DF-A9-FF)
          Primary PHY: LE 1M
          Secondary PHY: No packets
          SID: no ADI field (0xff)
          TX power: 127 dBm
          RSSI: -35 dBm (0xdd)
          Periodic advertising interval: 0.00 msec (0x0000)
          Direct address type: Reserved (0xff)
          Direct address: 00-00-00-00-00-00
          Data length: 0x18
        17 29 70 8d 7a 59 00 03 9b c6 bc 68 ab 9b 49 a1  .)p.zY.....h..I.
        b9 d3 60 2e 69 99 1a 20                          ..`.i..         
        Mesh Provisioning: 708d7a5900039bc6bc68ab9b49a1b9d3602e69991a20
          Link ID: 0x708d7a59
          Transaction Number: 0
          Provisioning Bearer Control (0x03)
          Link Open (0x00)
          Device UUID: 039bc6bc68ab9b49a1b9d3602e69991a
< HCI Command: LE Set Advertising S.. (0x08|0x0035) plen 7  #72 [hci1] 4.557753
        Advertising handle: 0x00
        Advertising random address: 17:BA:00:7B:09:45 (Non-Resolvable)
> HCI Event: Command Complete (0x0e) plen 4                 #73 [hci1] 4.558236
      LE Set Advertising Set Random Address (0x08|0x0035) ncmd 1
        Status: Success (0x00)
< HCI Command: LE Set Extended Adve.. (0x08|0x0039) plen 6  #74 [hci1] 4.577695
        Extended advertising: Enabled (0x01)
        Number of sets: 1 (0x01)
        Entry 0
          Handle: 0x00
          Duration: 0 ms (0x00)
          Max ext adv events: 3
> HCI Event: Command Complete (0x0e) plen 4                 #75 [hci1] 4.578282
      LE Set Extended Advertising Enable (0x08|0x0039) ncmd 1
        Status: Success (0x00)
> HCI Event: LE Meta Event (0x3e) plen 50                   #76 [hci1] 4.587330
      LE Extended Advertising Report (0x0d)
        Num reports: 1
        Entry 0
          Event type: 0x0010
            Props: 0x0010
              Use legacy advertising PDUs
            Data status: [0;32mComplete[0m
          Legacy PDU Type: ADV_NONCONN_IND (0x0010)
          Address type: Public (0x00)
          Address: DF:A9:FF:F6:B1:1A (OUI DF-A9-FF)
          Primary PHY: LE 1M
          Secondary PHY: No packets
          SID: no ADI field (0xff)
          TX power: 127 dBm
          RSSI: -24 dBm (0xe8)
          Periodic advertising interval: 0.00 msec (0x0000)
          Direct address type: Reserved (0xff)
          Direct address: 00-00-00-00-00-00
          Data length: 0x18
        17 29 70 8d 7a 59 00 03 9b c6 bc 68 ab 9b 49 a1  .)p.zY.....h..I.
        b9 d3 60 2e 69 99 1a 20                          ..`.i..         
        Mesh Provisioning: 708d7a5900039bc6bc68ab9b49a1b9d3602e69991a20
          Link ID: 0x708d7a59
          Transaction Number: 0
          Provisioning Bearer Control (0x03)
          Link Open (0x00)
          Device UUID: 039bc6bc68ab9b49a1b9d3602e69991a
> HCI Event: LE Meta Event (0x3e) plen 6                    #77 [hci1] 4.633025
      LE Advertising Set Terminated (0x12)
        Status: Limit Reached (0x43)
        Handle: 0
        Connection handle: 65535
        Number of completed extended advertising events: 3
< HCI Command: LE Set Extended Adv.. (0x08|0x0037) plen 12  #78 [hci1] 4.637792
        Handle: 0x00
        Operation: Complete extended advertising data (0x03)
        Fragment preference: Minimize fragmentation (0x01)
        Data length: 0x08
        Mesh Provisioning: 708d7a590007
          Link ID: 0x708d7a59
          Transaction Number: 0
          Provisioning Bearer Control (0x03)
          Link Ack (0x01)
> HCI Event: Command Complete (0x0e) plen 4                 #79 [hci1] 4.638579
      LE Set Extended Advertising Data (0x08|0x0037) ncmd 1
        Status: Success (0x00)
< HCI Command: LE Set Advertising S.. (0x08|0x0035) plen 7  #80 [hci1] 4.657661
        Advertising handle: 0x00
        Advertising random address: 3E:52:32:BA:A1:AC (Non-Resolvable)
> HCI Event: Command Complete (0x0e) plen 4                 #81 [hci1] 4.658166
      LE Set Advertising Set Random Address (0x08|0x0035) ncmd 1
        Status: Success (0x00)
< HCI Command: LE Set Extended Adve.. (0x08|0x0039) plen 6  #82 [hci1] 4.677609
        Extended advertising: Enabled (0x01)
        Number of sets: 1 (0x01)
        Entry 0
          Handle: 0x00
          Duration: 0 ms (0x00)
          Max ext adv events: 3
> HCI Event: Command Complete (0x0e) plen 4                 #83 [hci1] 4.678093
      LE Set Extended Advertising Enable (0x08|0x0039) ncmd 1
        Status: Success (0x00)
> HCI Event: LE Meta Event (0x3e) plen 6                    #84 [hci1] 4.732317
      LE Advertising Set Terminated (0x12)
        Status: Limit Reached (0x43)
        Handle: 0
        Connection handle: 65535
        Number of completed extended advertising events: 3
> HCI Event: LE Meta Event (0x3e) plen 39                   #85 [hci1] 4.952479
      LE Extended Advertising Report (0x0d)
        Num reports: 1
        Entry 0
          Event type: 0x0010
            Props: 0x0010
              Use legacy advertising PDUs
            Data status: [0;32mComplete[0m
          Legacy PDU Type: ADV_NONCONN_IND (0x0010)
          Address type: Public (0x00)
          Address: DF:A9:FF:F6:B1:1A (OUI DF-A9-FF)
          Primary PHY: LE 1M
          Secondary PHY: No packets
          SID: no ADI field (0xff)
          TX power: 127 dBm
          RSSI: -24 dBm (0xe8)
          Periodic advertising interval: 0.00 msec (0x0000)
          Direct address type: Reserved (0xff)
          Direct address: 00-00-00-00-00-00
          Data length: 0x0d
        0c 29 70 8d 7a 59 00 00 00 02 f7 00 02           .)p.zY.......   
        Mesh Provisioning: 708d7a5900000002f70002
          Link ID: 0x708d7a59
          Transaction Number: 0
          Transaction Start (0x00)
          SeqN: 0
          TotalLength: 2
          FCS: 0xf7
          Data: 0002
        02                                               .               
< HCI Command: LE Set Extended Adv.. (0x08|0x0037) plen 12  #86 [hci1] 5.007658
        Handle: 0x00
        Operation: Complete extended advertising data (0x03)
        Fragment preference: Minimize fragmentation (0x01)
        Data length: 0x08
        Mesh Provisioning: 708d7a590001
          Link ID: 0x708d7a59
          Transaction Number: 0
          Transaction Acknowledgment (0x01)
> HCI Event: Command Complete (0x0e) plen 4                 #87 [hci1] 5.008309
      LE Set Extended Advertising Data (0x08|0x0037) ncmd 1
        Status: Success (0x00)
< HCI Command: LE Set Advertising S.. (0x08|0x0035) plen 7  #88 [hci1] 5.017659
        Advertising handle: 0x00
        Advertising random address: 3A:95:2D:AB:B8:4D (Non-Resolvable)
> HCI Event: Command Complete (0x0e) plen 4                 #89 [hci1] 5.018155
      LE Set Advertising Set Random Address (0x08|0x0035) ncmd 1
        Status: Success (0x00)
< HCI Command: LE Set Extended Adve.. (0x08|0x0039) plen 6  #90 [hci1] 5.037679
        Extended advertising: Enabled (0x01)
        Number of sets: 1 (0x01)
        Entry 0
          Handle: 0x00
          Duration: 0 ms (0x00)
          Max ext adv events: 3
> HCI Event: Command Complete (0x0e) plen 4                 #91 [hci1] 5.038149
      LE Set Extended Advertising Enable (0x08|0x0039) ncmd 1
        Status: Success (0x00)
> HCI Event: LE Meta Event (0x3e) plen 6                    #92 [hci1] 5.090175
      LE Advertising Set Terminated (0x12)
        Status: Limit Reached (0x43)
        Handle: 0
        Connection handle: 65535
        Number of completed extended advertising events: 3
< HCI Command: LE Set Extended Adv.. (0x08|0x0037) plen 27  #93 [hci1] 5.137636
        Handle: 0x00
        Operation: Complete extended advertising data (0x03)
        Fragment preference: Minimize fragmentation (0x01)
        Data length: 0x17
        Mesh Provisioning: 708d7a598000000c9501040003000100000002000c
          Link ID: 0x708d7a59
          Transaction Number: 128
          Transaction Start (0x00)
          SeqN: 0
          TotalLength: 12
          FCS: 0x95
          Data: 01040003000100000002000c
        04 00 03 00 01 00 00 00 02 00 0c                 ...........     
> HCI Event: Command Complete (0x0e) plen 4                 #94 [hci1] 5.138490
      LE Set Extended Advertising Data (0x08|0x0037) ncmd 1
        Status: Success (0x00)
< HCI Command: LE Set Advertising S.. (0x08|0x0035) plen 7  #95 [hci1] 5.157590
        Advertising handle: 0x00
        Advertising random address: 06:8C:9A:8E:83:E2 (Non-Resolvable)
> HCI Event: Command Complete (0x0e) plen 4                 #96 [hci1] 5.158054
      LE Set Advertising Set Random Address (0x08|0x0035) ncmd 1
        Status: Success (0x00)
< HCI Command: LE Set Extended Adve.. (0x08|0x0039) plen 6  #97 [hci1] 5.177619
        Extended advertising: Enabled (0x01)
        Number of sets: 1 (0x01)
        Entry 0
          Handle: 0x00
          Duration: 0 ms (0x00)
          Max ext adv events: 1
> HCI Event: Command Complete (0x0e) plen 4                 #98 [hci1] 5.178185
      LE Set Extended Advertising Enable (0x08|0x0039) ncmd 1
        Status: Success (0x00)
> HCI Event: LE Meta Event (0x3e) plen 6                    #99 [hci1] 5.189890
      LE Advertising Set Terminated (0x12)
        Status: Limit Reached (0x43)
        Handle: 0
        Connection handle: 65535
        Number of completed extended advertising events: 1
> HCI Event: LE Meta Event (0x3e) plen 34                  #100 [hci1] 5.281639
      LE Extended Advertising Report (0x0d)
        Num reports: 1
        Entry 0
          Event type: 0x0010
            Props: 0x0010
              Use legacy advertising PDUs
            Data status: [0;32mComplete[0m
          Legacy PDU Type: ADV_NONCONN_IND (0x0010)
          Address type: Public (0x00)
          Address: DF:A9:FF:F6:B1:1A (OUI DF-A9-FF)
          Primary PHY: LE 1M
          Secondary PHY: No packets
          SID: no ADI field (0xff)
          TX power: 127 dBm
          RSSI: -35 dBm (0xdd)
          Periodic advertising interval: 0.00 msec (0x0000)
          Direct address type: Reserved (0xff)
          Direct address: 00-00-00-00-00-00
          Data length: 0x08
        07 29 70 8d 7a 59 80 01                          .)p.zY..        
        Mesh Provisioning: 708d7a598001
          Link ID: 0x708d7a59
          Transaction Number: 128
          Transaction Acknowledgment (0x01)
> HCI Event: LE Meta Event (0x3e) plen 34                  #101 [hci1] 5.321629
      LE Extended Advertising Report (0x0d)
        Num reports: 1
        Entry 0
          Event type: 0x0010
            Props: 0x0010
              Use legacy advertising PDUs
            Data status: [0;32mComplete[0m
          Legacy PDU Type: ADV_NONCONN_IND (0x0010)
          Address type: Public (0x00)
          Address: DF:A9:FF:F6:B1:1A (OUI DF-A9-FF)
          Primary PHY: LE 1M
          Secondary PHY: No packets
          SID: no ADI field (0xff)
          TX power: 127 dBm
          RSSI: -26 dBm (0xe6)
          Periodic advertising interval: 0.00 msec (0x0000)
          Direct address type: Reserved (0xff)
          Direct address: 00-00-00-00-00-00
          Data length: 0x08
        07 29 70 8d 7a 59 80 01                          .)p.zY..        
        Mesh Provisioning: 708d7a598001
          Link ID: 0x708d7a59
          Transaction Number: 128
          Transaction Acknowledgment (0x01)
> HCI Event: LE Meta Event (0x3e) plen 43                  #102 [hci1] 5.364703
      LE Extended Advertising Report (0x0d)
        Num reports: 1
        Entry 0
          Event type: 0x0010
            Props: 0x0010
              Use legacy advertising PDUs
            Data status: [0;32mComplete[0m
          Legacy PDU Type: ADV_NONCONN_IND (0x0010)
          Address type: Public (0x00)
          Address: DF:A9:FF:F6:B1:1A (OUI DF-A9-FF)
          Primary PHY: LE 1M
          Secondary PHY: No packets
          SID: no ADI field (0xff)
          TX power: 127 dBm
          RSSI: -35 dBm (0xdd)
          Periodic advertising interval: 0.00 msec (0x0000)
          Direct address type: Reserved (0xff)
          Direct address: 00-00-00-00-00-00
          Data length: 0x11
        10 29 70 8d 7a 59 01 00 00 06 8d 02 01 00 00 00  .)p.zY..........
        00                                               .               
        Mesh Provisioning: 708d7a59010000068d020100000000
          Link ID: 0x708d7a59
          Transaction Number: 1
          Transaction Start (0x00)
          SeqN: 0
          TotalLength: 6
          FCS: 0x8d
          Data: 020100000000
        01 00 00 00 00                                   .....           
< HCI Command: LE Set Extended Ad.. (0x08|0x0037) plen 12  #103 [hci1] 5.417627
        Handle: 0x00
        Operation: Complete extended advertising data (0x03)
        Fragment preference: Minimize fragmentation (0x01)
        Data length: 0x08
        Mesh Provisioning: 708d7a590101
          Link ID: 0x708d7a59
          Transaction Number: 1
          Transaction Acknowledgment (0x01)
> HCI Event: Command Complete (0x0e) plen 4                #104 [hci1] 5.418182
      LE Set Extended Advertising Data (0x08|0x0037) ncmd 1
        Status: Success (0x00)
< HCI Command: LE Set Advertising... (0x08|0x0035) plen 7  #105 [hci1] 5.437608
        Advertising handle: 0x00
        Advertising random address: 19:9F:EB:5C:2C:F7 (Non-Resolvable)
> HCI Event: Command Complete (0x0e) plen 4                #106 [hci1] 5.438099
      LE Set Advertising Set Random Address (0x08|0x0035) ncmd 1
        Status: Success (0x00)
< HCI Command: LE Set Extended Adv.. (0x08|0x0039) plen 6  #107 [hci1] 5.457615
        Extended advertising: Enabled (0x01)
        Number of sets: 1 (0x01)
        Entry 0
          Handle: 0x00
          Duration: 0 ms (0x00)
          Max ext adv events: 3
> HCI Event: Command Complete (0x0e) plen 4                #108 [hci1] 5.458105
      LE Set Extended Advertising Enable (0x08|0x0039) ncmd 1
        Status: Success (0x00)
> HCI Event: LE Meta Event (0x3e) plen 57                  #109 [hci1] 5.489218
      LE Extended Advertising Report (0x0d)
        Num reports: 1
        Entry 0
          Event type: 0x0010
            Props: 0x0010
              Use legacy advertising PDUs
            Data status: [0;32mComplete[0m
          Legacy PDU Type: ADV_NONCONN_IND (0x0010)
          Address type: Public (0x00)
          Address: DF:A9:FF:F6:B1:1A (OUI DF-A9-FF)
          Primary PHY: LE 1M
          Secondary PHY: No packets
          SID: no ADI field (0xff)
          TX power: 127 dBm
          RSSI: -35 dBm (0xdd)
          Periodic advertising interval: 0.00 msec (0x0000)
          Direct address type: Reserved (0xff)
          Direct address: 00-00-00-00-00-00
          Data length: 0x1f
        1e 29 70 8d 7a 59 02 08 00 41 f6 03 90 e5 0c 0d  .)p.zY...A......
        07 88 63 c8 19 e2 db 4b de 26 a2 64 56 b7 2b     ..c....K.&.dV.+ 
        Mesh Provisioning: 708d7a5902080041f60390e50c0d078863c819e2db4bde26a26456b72b
          Link ID: 0x708d7a59
          Transaction Number: 2
          Transaction Start (0x00)
          SeqN: 8
          TotalLength: 65
          FCS: 0xf6
          Data: 0390e50c0d078863c819e2db4bde26a26456b72b
        90 e5 0c 0d 07 88 63 c8 19 e2 db 4b de 26 a2 64  ......c....K.&.d
        56 b7 2b                                         V.+             
> HCI Event: LE Meta Event (0x3e) plen 6                   #110 [hci1] 5.513381
      LE Advertising Set Terminated (0x12)
        Status: Limit Reached (0x43)
        Handle: 0
        Connection handle: 65535
        Number of completed extended advertising events: 3
> HCI Event: LE Meta Event (0x3e) plen 57                  #111 [hci1] 5.522660
      LE Extended Advertising Report (0x0d)
        Num reports: 1
        Entry 0
          Event type: 0x0010
            Props: 0x0010
              Use legacy advertising PDUs
            Data status: [0;32mComplete[0m
          Legacy PDU Type: ADV_NONCONN_IND (0x0010)
          Address type: Public (0x00)
          Address: DF:A9:FF:F6:B1:1A (OUI DF-A9-FF)
          Primary PHY: LE 1M
          Secondary PHY: No packets
          SID: no ADI field (0xff)
          TX power: 127 dBm
          RSSI: -24 dBm (0xe8)
          Periodic advertising interval: 0.00 msec (0x0000)
          Direct address type: Reserved (0xff)
          Direct address: 00-00-00-00-00-00
          Data length: 0x1f
        1e 29 70 8d 7a 59 02 06 ac 8d 16 34 9d 94 b8 f4  .)p.zY.....4....
        73 eb d6 f0 c3 10 04 ae 8c 17 9b 8e c4 64 06     s............d. 
        Mesh Provisioning: 708d7a590206ac8d16349d94b8f473ebd6f0c31004ae8c179b8ec46406
          Link ID: 0x708d7a59
          Transaction Number: 2
          Transaction Continuation (0x02)
          SegmentIndex: 1
          Data: ac8d16349d94b8f473ebd6f0c31004ae8c179b8ec46406
        8d 16 34 9d 94 b8 f4 73 eb d6 f0 c3 10 04 ae 8c  ..4....s........
        17 9b 8e c4 64 06                                ....d.          
> HCI Event: LE Meta Event (0x3e) plen 56                  #112 [hci1] 5.564005
      LE Extended Advertising Report (0x0d)
        Num reports: 1
        Entry 0
          Event type: 0x0010
            Props: 0x0010
              Use legacy advertising PDUs
            Data status: [0;32mComplete[0m
          Legacy PDU Type: ADV_NONCONN_IND (0x0010)
          Address type: Public (0x00)
          Address: DF:A9:FF:F6:B1:1A (OUI DF-A9-FF)
          Primary PHY: LE 1M
          Secondary PHY: No packets
          SID: no ADI field (0xff)
          TX power: 127 dBm
          RSSI: -35 dBm (0xdd)
          Periodic advertising interval: 0.00 msec (0x0000)
          Direct address type: Reserved (0xff)
          Direct address: 00-00-00-00-00-00
          Data length: 0x1e
        1d 29 70 8d 7a 59 02 0a 38 66 d0 cc 33 be 02 6e  .)p.zY..8f..3..n
        b3 c6 ca 0f 74 2c 97 69 a6 5a 17 b4 3b aa        ....t,.i.Z..;.  
        Mesh Provisioning: 708d7a59020a3866d0cc33be026eb3c6ca0f742c9769a65a17b43baa
          Link ID: 0x708d7a59
          Transaction Number: 2
          Transaction Continuation (0x02)
          SegmentIndex: 2
          Data: 3866d0cc33be026eb3c6ca0f742c9769a65a17b43baa
        66 d0 cc 33 be 02 6e b3 c6 ca 0f 74 2c 97 69 a6  f..3..n....t,.i.
        5a 17 b4 3b aa                                   Z..;.           
< HCI Command: LE Set Extended Ad.. (0x08|0x0037) plen 12  #113 [hci1] 5.615257
        Handle: 0x00
        Operation: Complete extended advertising data (0x03)
        Fragment preference: Minimize fragmentation (0x01)
        Data length: 0x08
        Mesh Provisioning: 708d7a590201
          Link ID: 0x708d7a59
          Transaction Number: 2
          Transaction Acknowledgment (0x01)
> HCI Event: Command Complete (0x0e) plen 4                #114 [hci1] 5.615893
      LE Set Extended Advertising Data (0x08|0x0037) ncmd 1
        Status: Success (0x00)
< HCI Command: LE Set Advertising... (0x08|0x0035) plen 7  #115 [hci1] 5.617575
        Advertising handle: 0x00
        Advertising random address: 19:2B:6B:C8:B1:3D (Non-Resolvable)
> HCI Event: Command Complete (0x0e) plen 4                #116 [hci1] 5.618069
      LE Set Advertising Set Random Address (0x08|0x0035) ncmd 1
        Status: Success (0x00)
< HCI Command: LE Set Extended Adv.. (0x08|0x0039) plen 6  #117 [hci1] 5.637585
        Extended advertising: Enabled (0x01)
        Number of sets: 1 (0x01)
        Entry 0
          Handle: 0x00
          Duration: 0 ms (0x00)
          Max ext adv events: 3
> HCI Event: Command Complete (0x0e) plen 4                #118 [hci1] 5.638060
      LE Set Extended Advertising Enable (0x08|0x0039) ncmd 1
        Status: Success (0x00)
> HCI Event: LE Meta Event (0x3e) plen 6                   #119 [hci1] 5.690266
      LE Advertising Set Terminated (0x12)
        Status: Limit Reached (0x43)
        Handle: 0
        Connection handle: 65535
        Number of completed extended advertising events: 3
< HCI Command: LE Set Extended Ad.. (0x08|0x0037) plen 35  #120 [hci1] 5.737645
        Handle: 0x00
        Operation: Complete extended advertising data (0x03)
        Fragment preference: Minimize fragmentation (0x01)
        Data length: 0x1f
        Mesh Provisioning: 708d7a5981080041ce034636b8a7a6622544b27e36949187ef97ec1595
          Link ID: 0x708d7a59
          Transaction Number: 129
          Transaction Start (0x00)
          SeqN: 8
          TotalLength: 65
          FCS: 0xce
          Data: 034636b8a7a6622544b27e36949187ef97ec1595
        46 36 b8 a7 a6 62 25 44 b2 7e 36 94 91 87 ef 97  F6...b%D.~6.....
        ec 15 95                                         ...             
> HCI Event: Command Complete (0x0e) plen 4                #121 [hci1] 5.738511
      LE Set Extended Advertising Data (0x08|0x0037) ncmd 1
        Status: Success (0x00)
< HCI Command: LE Set Advertising... (0x08|0x0035) plen 7  #122 [hci1] 5.757629
        Advertising handle: 0x00
        Advertising random address: 1F:AD:C9:4D:79:5C (Non-Resolvable)
> HCI Event: Command Complete (0x0e) plen 4                #123 [hci1] 5.758075
      LE Set Advertising Set Random Address (0x08|0x0035) ncmd 1
        Status: Success (0x00)
< HCI Command: LE Set Extended Adv.. (0x08|0x0039) plen 6  #124 [hci1] 5.777647
        Extended advertising: Enabled (0x01)
        Number of sets: 1 (0x01)
        Entry 0
          Handle: 0x00
          Duration: 0 ms (0x00)
          Max ext adv events: 1
> HCI Event: Command Complete (0x0e) plen 4                #125 [hci1] 5.778148
      LE Set Extended Advertising Enable (0x08|0x0039) ncmd 1
        Status: Success (0x00)
> HCI Event: LE Meta Event (0x3e) plen 6                   #126 [hci1] 5.788533
      LE Advertising Set Terminated (0x12)
        Status: Limit Reached (0x43)
        Handle: 0
        Connection handle: 65535
        Number of completed extended advertising events: 1
< HCI Command: LE Set Extended Ad.. (0x08|0x0037) plen 35  #127 [hci1] 5.837664
        Handle: 0x00
        Operation: Complete extended advertising data (0x03)
        Fragment preference: Minimize fragmentation (0x01)
        Data length: 0x1f
        Mesh Provisioning: 708d7a59810683450fa93ceca4db684db5b45b5153af0cb7bb33ee3ab0
          Link ID: 0x708d7a59
          Transaction Number: 129
          Transaction Continuation (0x02)
          SegmentIndex: 1
          Data: 83450fa93ceca4db684db5b45b5153af0cb7bb33ee3ab0
        45 0f a9 3c ec a4 db 68 4d b5 b4 5b 51 53 af 0c  E..<...hM..[QS..
        b7 bb 33 ee 3a b0                                ..3.:.          
> HCI Event: Command Complete (0x0e) plen 4                #128 [hci1] 5.838535
      LE Set Extended Advertising Data (0x08|0x0037) ncmd 1
        Status: Success (0x00)
< HCI Command: LE Set Advertising... (0x08|0x0035) plen 7  #129 [hci1] 5.857587
        Advertising handle: 0x00
        Advertising random address: 03:E1:D5:5A:BD:5E (Non-Resolvable)
> HCI Event: Command Complete (0x0e) plen 4                #130 [hci1] 5.858111
      LE Set Advertising Set Random Address (0x08|0x0035) ncmd 1
        Status: Success (0x00)
< HCI Command: LE Set Extended Adv.. (0x08|0x0039) plen 6  #131 [hci1] 5.877595
        Extended advertising: Enabled (0x01)
        Number of sets: 1 (0x01)
        Entry 0
          Handle: 0x00
          Duration: 0 ms (0x00)
          Max ext adv events: 1
> HCI Event: Command Complete (0x0e) plen 4                #132 [hci1] 5.878084
      LE Set Extended Advertising Enable (0x08|0x0039) ncmd 1
        Status: Success (0x00)
> HCI Event: LE Meta Event (0x3e) plen 6                   #133 [hci1] 5.884847
      LE Advertising Set Terminated (0x12)
        Status: Limit Reached (0x43)
        Handle: 0
        Connection handle: 65535
        Number of completed extended advertising events: 1
< HCI Command: LE Set Extended Ad.. (0x08|0x0037) plen 34  #134 [hci1] 5.937635
        Handle: 0x00
        Operation: Complete extended advertising data (0x03)
        Fragment preference: Minimize fragmentation (0x01)
        Data length: 0x1e
        Mesh Provisioning: 708d7a59810afd105027a980f361ffd0cca0c3a59e2b84b6be44c7ca
          Link ID: 0x708d7a59
          Transaction Number: 129
          Transaction Continuation (0x02)
          SegmentIndex: 2
          Data: fd105027a980f361ffd0cca0c3a59e2b84b6be44c7ca
        10 50 27 a9 80 f3 61 ff d0 cc a0 c3 a5 9e 2b 84  .P'...a.......+.
        b6 be 44 c7 ca                                   ..D..           
> HCI Event: Command Complete (0x0e) plen 4                #135 [hci1] 5.938507
      LE Set Extended Advertising Data (0x08|0x0037) ncmd 1
        Status: Success (0x00)
< HCI Command: LE Set Advertising... (0x08|0x0035) plen 7  #136 [hci1] 5.957626
        Advertising handle: 0x00
        Advertising random address: 1F:2C:31:FF:2F:5C (Non-Resolvable)
> HCI Event: Command Complete (0x0e) plen 4                #137 [hci1] 5.958110
      LE Set Advertising Set Random Address (0x08|0x0035) ncmd 1
        Status: Success (0x00)
< HCI Command: LE Set Extended Adv.. (0x08|0x0039) plen 6  #138 [hci1] 5.977602
        Extended advertising: Enabled (0x01)
        Number of sets: 1 (0x01)
        Entry 0
          Handle: 0x00
          Duration: 0 ms (0x00)
          Max ext adv events: 1
> HCI Event: Command Complete (0x0e) plen 4                #139 [hci1] 5.978201
      LE Set Extended Advertising Enable (0x08|0x0039) ncmd 1
        Status: Success (0x00)
> HCI Event: LE Meta Event (0x3e) plen 6                   #140 [hci1] 5.988085
      LE Advertising Set Terminated (0x12)
        Status: Limit Reached (0x43)
        Handle: 0
        Connection handle: 65535
        Number of completed extended advertising events: 1
> HCI Event: LE Meta Event (0x3e) plen 34                  #141 [hci1] 6.041002
      LE Extended Advertising Report (0x0d)
        Num reports: 1
        Entry 0
          Event type: 0x0010
            Props: 0x0010
              Use legacy advertising PDUs
            Data status: [0;32mComplete[0m
          Legacy PDU Type: ADV_NONCONN_IND (0x0010)
          Address type: Public (0x00)
          Address: DF:A9:FF:F6:B1:1A (OUI DF-A9-FF)
          Primary PHY: LE 1M
          Secondary PHY: No packets
          SID: no ADI field (0xff)
          TX power: 127 dBm
          RSSI: -26 dBm (0xe6)
          Periodic advertising interval: 0.00 msec (0x0000)
          Direct address type: Reserved (0xff)
          Direct address: 00-00-00-00-00-00
          Data length: 0x08
        07 29 70 8d 7a 59 81 01                          .)p.zY..        
        Mesh Provisioning: 708d7a598101
          Link ID: 0x708d7a59
          Transaction Number: 129
          Transaction Acknowledgment (0x01)
> HCI Event: LE Meta Event (0x3e) plen 34                  #142 [hci1] 6.082034
      LE Extended Advertising Report (0x0d)
        Num reports: 1
        Entry 0
          Event type: 0x0010
            Props: 0x0010
              Use legacy advertising PDUs
            Data status: [0;32mComplete[0m
          Legacy PDU Type: ADV_NONCONN_IND (0x0010)
          Address type: Public (0x00)
          Address: DF:A9:FF:F6:B1:1A (OUI DF-A9-FF)
          Primary PHY: LE 1M
          Secondary PHY: No packets
          SID: no ADI field (0xff)
          TX power: 127 dBm
          RSSI: -35 dBm (0xdd)
          Periodic advertising interval: 0.00 msec (0x0000)
          Direct address type: Reserved (0xff)
          Direct address: 00-00-00-00-00-00
          Data length: 0x08
        07 29 70 8d 7a 59 81 01                          .)p.zY..        
        Mesh Provisioning: 708d7a598101
          Link ID: 0x708d7a59
          Transaction Number: 129
          Transaction Acknowledgment (0x01)
> HCI Event: LE Meta Event (0x3e) plen 34                  #143 [hci1] 6.144684
      LE Extended Advertising Report (0x0d)
        Num reports: 1
        Entry 0
          Event type: 0x0010
            Props: 0x0010
              Use legacy advertising PDUs
            Data status: [0;32mComplete[0m
          Legacy PDU Type: ADV_NONCONN_IND (0x0010)
          Address type: Public (0x00)
          Address: DF:A9:FF:F6:B1:1A (OUI DF-A9-FF)
          Primary PHY: LE 1M
          Secondary PHY: No packets
          SID: no ADI field (0xff)
          TX power: 127 dBm
          RSSI: -24 dBm (0xe8)
          Periodic advertising interval: 0.00 msec (0x0000)
          Direct address type: Reserved (0xff)
          Direct address: 00-00-00-00-00-00
          Data length: 0x08
        07 29 70 8d 7a 59 81 01                          .)p.zY..        
        Mesh Provisioning: 708d7a598101
          Link ID: 0x708d7a59
          Transaction Number: 129
          Transaction Acknowledgment (0x01)
> HCI Event: LE Meta Event (0x3e) plen 57                  #144 [hci1] 6.228348
      LE Extended Advertising Report (0x0d)
        Num reports: 1
        Entry 0
          Event type: 0x0010
            Props: 0x0010
              Use legacy advertising PDUs
            Data status: [0;32mComplete[0m
          Legacy PDU Type: ADV_NONCONN_IND (0x0010)
          Address type: Public (0x00)
          Address: DF:A9:FF:F6:B1:1A (OUI DF-A9-FF)
          Primary PHY: LE 1M
          Secondary PHY: No packets
          SID: no ADI field (0xff)
          TX power: 127 dBm
          RSSI: -26 dBm (0xe6)
          Periodic advertising interval: 0.00 msec (0x0000)
          Direct address type: Reserved (0xff)
          Direct address: 00-00-00-00-00-00
          Data length: 0x1f
        1e 29 70 8d 7a 59 03 04 00 21 1d 05 99 51 67 d7  .)p.zY...!...Qg.
        b8 77 f0 1e 90 3f 2b fe fa be e0 e3 ec 26 39     .w...?+......&9 
        Mesh Provisioning: 708d7a59030400211d05995167d7b877f01e903f2bfefabee0e3ec2639
          Link ID: 0x708d7a59
          Transaction Number: 3
          Transaction Start (0x00)
          SeqN: 4
          TotalLength: 33
          FCS: 0x1d
          Data: 05995167d7b877f01e903f2bfefabee0e3ec2639
        99 51 67 d7 b8 77 f0 1e 90 3f 2b fe fa be e0 e3  .Qg..w...?+.....
        ec 26 39                                         .&9             
> HCI Event: LE Meta Event (0x3e) plen 47                  #145 [hci1] 6.272490
      LE Extended Advertising Report (0x0d)
        Num reports: 1
        Entry 0
          Event type: 0x0010
            Props: 0x0010
              Use legacy advertising PDUs
            Data status: [0;32mComplete[0m
          Legacy PDU Type: ADV_NONCONN_IND (0x0010)
          Address type: Public (0x00)
          Address: DF:A9:FF:F6:B1:1A (OUI DF-A9-FF)
          Primary PHY: LE 1M
          Secondary PHY: No packets
          SID: no ADI field (0xff)
          TX power: 127 dBm
          RSSI: -35 dBm (0xdd)
          Periodic advertising interval: 0.00 msec (0x0000)
          Direct address type: Reserved (0xff)
          Direct address: 00-00-00-00-00-00
          Data length: 0x15
        14 29 70 8d 7a 59 03 06 4d 1a e1 b3 06 5f 8c 69  .)p.zY..M...._.i
        91 0c ea 72 87                                   ...r.           
        Mesh Provisioning: 708d7a5903064d1ae1b3065f8c69910cea7287
          Link ID: 0x708d7a59
          Transaction Number: 3
          Transaction Continuation (0x02)
          SegmentIndex: 1
          Data: 4d1ae1b3065f8c69910cea7287
        1a e1 b3 06 5f 8c 69 91 0c ea 72 87              ...._.i...r.    
< HCI Command: LE Set Extended Ad.. (0x08|0x0037) plen 12  #146 [hci1] 6.327644
        Handle: 0x00
        Operation: Complete extended advertising data (0x03)
        Fragment preference: Minimize fragmentation (0x01)
        Data length: 0x08
        Mesh Provisioning: 708d7a590301
          Link ID: 0x708d7a59
          Transaction Number: 3
          Transaction Acknowledgment (0x01)
> HCI Event: Command Complete (0x0e) plen 4                #147 [hci1] 6.328162
      LE Set Extended Advertising Data (0x08|0x0037) ncmd 1
        Status: Success (0x00)
< HCI Command: LE Set Advertising... (0x08|0x0035) plen 7  #148 [hci1] 6.337592
        Advertising handle: 0x00
        Advertising random address: 01:74:FF:45:1C:00 (Non-Resolvable)
> HCI Event: Command Complete (0x0e) plen 4                #149 [hci1] 6.338060
      LE Set Advertising Set Random Address (0x08|0x0035) ncmd 1
        Status: Success (0x00)
< HCI Command: LE Set Extended Adv.. (0x08|0x0039) plen 6  #150 [hci1] 6.357650
        Extended advertising: Enabled (0x01)
        Number of sets: 1 (0x01)
        Entry 0
          Handle: 0x00
          Duration: 0 ms (0x00)
          Max ext adv events: 3
> HCI Event: Command Complete (0x0e) plen 4                #151 [hci1] 6.358180
      LE Set Extended Advertising Enable (0x08|0x0039) ncmd 1
        Status: Success (0x00)
> HCI Event: LE Meta Event (0x3e) plen 6                   #152 [hci1] 6.416008
      LE Advertising Set Terminated (0x12)
        Status: Limit Reached (0x43)
        Handle: 0
        Connection handle: 65535
        Number of completed extended advertising events: 3
< HCI Command: LE Set Extended Ad.. (0x08|0x0037) plen 35  #153 [hci1] 6.477653
        Handle: 0x00
        Operation: Complete extended advertising data (0x03)
        Fragment preference: Minimize fragmentation (0x01)
        Data length: 0x1f
        Mesh Provisioning: 708d7a5982040021e90534269c89648fad0a0311b02a273e5d5ebdb07a
          Link ID: 0x708d7a59
          Transaction Number: 130
          Transaction Start (0x00)
          SeqN: 4
          TotalLength: 33
          FCS: 0xe9
          Data: 0534269c89648fad0a0311b02a273e5d5ebdb07a
        34 26 9c 89 64 8f ad 0a 03 11 b0 2a 27 3e 5d 5e  4&..d......*'>]^
        bd b0 7a                                         ..z             
