Bluetooth monitor ver 5.72
= Note: Linux version 6.14.0-36-generic (x86_64)                       0.116899
= Note: Bluetooth subsystem version 2.22                               0.116901
= New Index: 00:00:00:00:00:00 (Primary,UART,hci1)              [hci1] 0.116902
= New Index: 48:5F:99:8E:E0:64 (Primary,USB,hci0)               [hci0] 0.116903
= Open Index: 00:00:00:00:00:00                                 [hci1] 0.230622
= Index Info: 00:00:00:00:00:00 (Nordic Semiconductor ASA)      [hci1] 0.230637
@ USER Open: main (privileged) version 2.22            {0x0001} [hci1] 0.230647
< HCI Command: Reset (0x03|0x0003) plen 0                    #1 [hci1] 0.231915
> HCI Event: Command Complete (0x0e) plen 4                  #2 [hci1] 0.232422
      Reset (0x03|0x0003) ncmd 1
        Status: Success (0x00)
< HCI Command: Read Local Supported... (0x04|0x0003) plen 0  #3 [hci1] 0.250449
> HCI Event: Command Complete (0x0e) plen 12                 #4 [hci1] 0.250969
      Read Local Supported Features (0x04|0x0003) ncmd 1
        Status: Success (0x00)
        Features: 0x00 0x00 0x00 0x00 0x60 0x00 0x00 0x00
          BR/EDR Not Supported
          LE Supported (Controller)
< HCI Command: Read Local Version In.. (0x04|0x0001) plen 0  #5 [hci1] 0.270129
> HCI Event: Command Complete (0x0e) plen 12                 #6 [hci1] 0.270646
      Read Local Version Information (0x04|0x0001) ncmd 1
        Status: Success (0x00)
        HCI version: Reserved (0x0f) - Revision 12393 (0x3069)
        LMP version: Reserved (0x0f) - Subversion 12393 (0x3069)
        Manufacturer: Nordic Semiconductor ASA (89)
< HCI Command: Read Local Supported... (0x04|0x0002) plen 0  #7 [hci1] 0.290038
> HCI Event: Command Complete (0x0e) plen 68                 #8 [hci1] 0.291113
      Read Local Supported Commands (0x04|0x0002) ncmd 1
        Status: Success (0x00)
        Commands: 119 entries
          Disconnect (Octet 0 - Bit 5)
          Read Remote Version Information (Octet 2 - Bit 7)
          Set Event Mask (Octet 5 - Bit 6)
          Reset (Octet 5 - Bit 7)
          Read Connection Accept Timeout (Octet 7 - Bit 2)
          Write Connection Accept Timeout (Octet 7 - Bit 3)
          Read Transmit Power Level (Octet 10 - Bit 2)
          Set Controller To Host Flow Control (Octet 10 - Bit 5)
          Host Buffer Size (Octet 10 - Bit 6)
          Host Number of Completed Packets (Octet 10 - Bit 7)
          Read Local Version Information (Octet 14 - Bit 3)
          Read Local Supported Features (Octet 14 - Bit 5)
          Read BD ADDR (Octet 15 - Bit 1)
          Read RSSI (Octet 15 - Bit 5)
          Set Event Mask Page 2 (Octet 22 - Bit 2)
          LE Set Event Mask (Octet 25 - Bit 0)
          LE Read Buffer Size (Octet 25 - Bit 1)
          LE Read Local Supported Features (Octet 25 - Bit 2)
          LE Set Random Address (Octet 25 - Bit 4)
          LE Set Advertising Parameters (Octet 25 - Bit 5)
          LE Read Advertising Channel TX Power (Octet 25 - Bit 6)
          LE Set Advertising Data (Octet 25 - Bit 7)
          LE Set Scan Response Data (Octet 26 - Bit 0)
          LE Set Advertise Enable (Octet 26 - Bit 1)
          LE Set Scan Parameters (Octet 26 - Bit 2)
          LE Set Scan Enable (Octet 26 - Bit 3)
          LE Create Connection (Octet 26 - Bit 4)
          LE Create Connection Cancel (Octet 26 - Bit 5)
          LE Read Accept List Size (Octet 26 - Bit 6)
          LE Clear Accept List (Octet 26 - Bit 7)
          LE Add Device To Accept List (Octet 27 - Bit 0)
          LE Remove Device From Accept List (Octet 27 - Bit 1)
          LE Connection Update (Octet 27 - Bit 2)
          LE Set Host Channel Classification (Octet 27 - Bit 3)
          LE Read Channel Map (Octet 27 - Bit 4)
          LE Read Remote Used Features (Octet 27 - Bit 5)
          LE Encrypt (Octet 27 - Bit 6)
          LE Rand (Octet 27 - Bit 7)
          LE Start Encryption (Octet 28 - Bit 0)
          LE Long Term Key Request Reply (Octet 28 - Bit 1)
          LE Long Term Key Request Neg Reply (Octet 28 - Bit 2)
          LE Read Supported States (Octet 28 - Bit 3)
          LE Receiver Test (Octet 28 - Bit 4)
          LE Transmitter Test (Octet 28 - Bit 5)
          LE Test End (Octet 28 - Bit 6)
          Read Authenticated Payload Timeout (Octet 32 - Bit 4)
          Write Authenticated Payload Timeout (Octet 32 - Bit 5)
          LE Set Data Length (Octet 33 - Bit 6)
          LE Read Suggested Default Data Length (Octet 33 - Bit 7)
          LE Write Suggested Default Data Length (Octet 34 - Bit 0)
          LE Add Device To Resolving List (Octet 34 - Bit 3)
          LE Remove Device From Resolving List (Octet 34 - Bit 4)
          LE Clear Resolving List (Octet 34 - Bit 5)
          LE Read Resolving List Size (Octet 34 - Bit 6)
          LE Set Address Resolution Enable (Octet 35 - Bit 1)
          LE Set Resolvable Private Address Timeout (Octet 35 - Bit 2)
          LE Read Maximum Data Length (Octet 35 - Bit 3)
          LE Read PHY (Octet 35 - Bit 4)
          LE Set Default PHY (Octet 35 - Bit 5)
          LE Set PHY (Octet 35 - Bit 6)
          LE Enhanced Receiver Test (Octet 35 - Bit 7)
          LE Enhanced Transmitter Test (Octet 36 - Bit 0)
          LE Set Advertising Set Random Address (Octet 36 - Bit 1)
          LE Set Extended Advertising Parameters (Octet 36 - Bit 2)
          LE Set Extended Advertising Data (Octet 36 - Bit 3)
          LE Set Extended Scan Response Data (Octet 36 - Bit 4)
          LE Set Extended Advertising Enable (Octet 36 - Bit 5)
          LE Read Maximum Advertising Data Length (Octet 36 - Bit 6)
          LE Read Number of Supported Advertising Sets (Octet 36 - Bit 7)
          LE Remove Advertising Set (Octet 37 - Bit 0)
          LE Clear Advertising Sets (Octet 37 - Bit 1)
          LE Set Periodic Advertising Parameters (Octet 37 - Bit 2)
          LE Set Periodic Advertising Data (Octet 37 - Bit 3)
          LE Set Periodic Advertising Enable (Octet 37 - Bit 4)
          LE Set Extended Scan Parameters (Octet 37 - Bit 5)
          LE Set Extended Scan Enable (Octet 37 - Bit 6)
          LE Extended Create Connection (Octet 37 - Bit 7)
          LE Periodic Advertising Create Sync (Octet 38 - Bit 0)
          LE Periodic Advertising Create Sync Cancel (Octet 38 - Bit 1)
          LE Periodic Advertising Terminate Sync (Octet 38 - Bit 2)
          LE Add Device To Periodic Advertiser List (Octet 38 - Bit 3)
          LE Remove Device From Periodic Advertiser List (Octet 38 - Bit 4)
          LE Clear Periodic Advertiser List (Octet 38 - Bit 5)
          LE Read Periodic Advertiser List Size (Octet 38 - Bit 6)
          LE Read Transmit Power (Octet 38 - Bit 7)
          LE Read RF Path Compensation (Octet 39 - Bit 0)
          LE Write RF Path Compensation (Octet 39 - Bit 1)
          LE Set Privacy Mode (Octet 39 - Bit 2)
          LE Periodic Advertising Receive Enable (Octet 40 - Bit 5)
          LE Periodic Advertising Sync Transfer (Octet 40 - Bit 6)
          LE Periodic Advertising Set Info Transfer (Octet 40 - Bit 7)
          LE Periodic Advertising Sync Transfer Parameters (Octet 41 - Bit 0)
          LE Set Default Periodic Advertisng Sync Transfer Parameters (Octet 41 - Bit 1)
          LE Read Buffer v2 (Octet 41 - Bit 5)
          LE Read ISO TX Sync (Octet 41 - Bit 6)
          LE Set Connected Isochronous Group Parameters (Octet 41 - Bit 7)
          LE Set Connected Isochronous Group Parameters Test (Octet 42 - Bit 0)
          LE Create Connected Isochronous Stream (Octet 42 - Bit 1)
          LE Remove Connected Isochronous Group (Octet 42 - Bit 2)
          LE Accept Connected Isochronous Stream Request (Octet 42 - Bit 3)
          LE Reject Connected Isochronous Stream Request (Octet 42 - Bit 4)
          LE Create Broadcast Isochronous Group (Octet 42 - Bit 5)
          LE Create Broadcast Isochronous Group Test (Octet 42 - Bit 6)
          LE Terminate Broadcast Isochronous Group (Octet 42 - Bit 7)
          LE Broadcast Isochronous Group Create Sync (Octet 43 - Bit 0)
          LE Broadcast Isochronous Group Terminate Sync (Octet 43 - Bit 1)
          LE Request Peer SCA (Octet 43 - Bit 2)
          LE Setup Isochronous Data Path (Octet 43 - Bit 3)
          LE Remove Isochronous Data Path (Octet 43 - Bit 4)
          LE Isochronous Transmit Test (Octet 43 - Bit 5)
          LE Isochronous Receive Test (Octet 43 - Bit 6)
          LE Isochronous Read Test Counters (Octet 43 - Bit 7)
          LE Isochronous Read Test Counters (Octet 44 - Bit 0)
          LE Set Host Feature (Octet 44 - Bit 1)
          Octet 44 - Bit 2 
          Octet 45 - Bit 6 
          Octet 46 - Bit 0 
          Octet 46 - Bit 1 
          Octet 46 - Bit 2 
< HCI Command: Host Buffer Size (0x03|0x0033) plen 7         #9 [hci1] 0.310030
        ACL MTU: 255  ACL max packet: 16
        SCO MTU: 0    SCO max packet: 0
> HCI Event: Command Complete (0x0e) plen 4                 #10 [hci1] 0.310635
      Host Buffer Size (0x03|0x0033) ncmd 1
        Status: Success (0x00)
< HCI Command: Set Controller To Ho.. (0x03|0x0031) plen 1  #11 [hci1] 0.330029
        Flow control: ACL Data Packets (0x01)
> HCI Event: Command Complete (0x0e) plen 4                 #12 [hci1] 0.330520
      Set Controller To Host Flow Control (0x03|0x0031) ncmd 1
        Status: Success (0x00)
< HCI Command: LE Read Local Suppor.. (0x08|0x0003) plen 0  #13 [hci1] 0.350034
> HCI Event: Command Complete (0x0e) plen 12                #14 [hci1] 0.350619
      LE Read Local Supported Features (0x08|0x0003) ncmd 1
        Status: Success (0x00)
        Features: 0xfd 0x79 0x00 0xf7 0x30 0x01 0x00 0x00
          LE Encryption
          Extended Reject Indication
          Peripheral-initiated Features Exchange
          LE Ping
          LE Data Packet Length Extension
          LL Privacy
          Extended Scanner Filter Policies
          LE 2M PHY
          LE Coded PHY
          LE Extended Advertising
          LE Periodic Advertising
          Channel Selection Algorithm #2
          Periodic Advertising Sync Transfer - Sender
          Periodic Advertising Sync Transfer - Recipient
          Sleep Clock Accuracy Updates
          Connected Isochronous Stream - Central
          Connected Isochronous Stream - Peripheral
          Isochronous Broadcaster
          Synchronized Receiver
          Periodic Advertising ADI support
          Connection Subrating
          Unknown features (0x0000010000000000)
< HCI Command: LE Set Host Feature (0x08|0x0074) plen 2     #15 [hci1] 0.370038
        Bit Number: 32
          Connected Isochronous Stream (Host Support)
        Bit Value: 1
> HCI Event: Command Complete (0x0e) plen 4                 #16 [hci1] 0.370531
      LE Set Host Feature (0x08|0x0074) ncmd 1
        Status: Success (0x00)
< HCI Command: LE Read Buffer v2 (0x08|0x0060) plen 0       #17 [hci1] 0.390033
> HCI Event: Command Complete (0x0e) plen 10                #18 [hci1] 0.390481
      LE Read Buffer v2 (0x08|0x0060) ncmd 1
        Status: Success (0x00)
        ACL MTU: 27
        ACL max packet: 3
        ISO MTU: 318
        ISO max packet: 3
< HCI Command: LE Read Maximum Adve.. (0x08|0x003a) plen 0  #19 [hci1] 0.410070
> HCI Event: Command Complete (0x0e) plen 6                 #20 [hci1] 0.410474
      LE Read Maximum Advertising Data Length (0x08|0x003a) ncmd 1
        Status: Success (0x00)
        Max length: 1650
< HCI Command: LE Read Supported St.. (0x08|0x001c) plen 0  #21 [hci1] 0.430040
> HCI Event: Command Complete (0x0e) plen 12                #22 [hci1] 0.430526
      LE Read Supported States (0x08|0x001c) ncmd 1
        Status: Success (0x00)
        States: 0x000003ff3e0306ff
          Non-connectable Advertising State
          Scannable Advertising State
          Connectable Advertising State
          High Duty Cycle Directed Advertising State
          Passive Scanning State
          Active Scanning State
          Initiating State
            and Connection State (Central Role)
          Connection State (Peripheral Role)
          Scannable Advertising State
            and Passive Scanning State
          Connectable Advertising State
            and Passive Scanning State
          Non-connectable Advertising State
            and Initiating State
          Scannable Advertising State
            and Initiating State
          Active Scanning State
            and Connection State (Central Role)
          Passive Scanning State
            and Connection State (Peripheral Role)
          Active Scanning State
            and Connection State (Peripheral Role)
          Initiating State
            and Connection State (Central Role)
            and Central Role & Central Role
          Low Duty Cycle Directed Advertising State
          Connectable Advertising State
            and Initiating State
            and Central Role & Peripheral Role
          High Duty Cycle Directed Advertising State
            and Initiating State
            and Central Role & Peripheral Role
          Low Duty Cycle Directed Advertising State
            and Initiating State
            and Central Role & Peripheral Role
          Connectable Advertising State
            and Connection State (Central Role)
            and Central Role & Peripheral Role
          High Duty Cycle Directed Advertising State
            and Connection State (Central Role)
            and Central Role & Peripheral Role
          Low Duty Cycle Directed Advertising State
            and Connection State (Central Role)
            and Central Role & Peripheral Role
          Connectable Advertising State
            and Connection State (Peripheral Role)
            and Central Role & Peripheral Role
          High Duty Cycle Directed Advertising State
            and Connection State (Peripheral Role)
            and Peripheral Role & Peripheral Role
          Low Duty Cycle Directed Advertising State
            and Connection State (Peripheral Role)
            and Peripheral Role & Peripheral Role
          Initiating State
            and Connection State (Peripheral Role)
            and Central Role & Peripheral Role
< HCI Command: LE Read Maximum Data.. (0x08|0x002f) plen 0  #23 [hci1] 0.450021
> HCI Event: Command Complete (0x0e) plen 12                #24 [hci1] 0.450621
      LE Read Maximum Data Length (0x08|0x002f) ncmd 1
        Status: Success (0x00)
        Max TX octets: 251
        Max TX time: 2704
        Max RX octets: 251
        Max RX time: 2704
< HCI Command: LE Write Suggested D.. (0x08|0x0024) plen 4  #25 [hci1] 0.470041
        TX octets: 251
        TX time: 2704
> HCI Event: Command Complete (0x0e) plen 4                 #26 [hci1] 0.470459
      LE Write Suggested Default Data Length (0x08|0x0024) ncmd 1
        Status: Success (0x00)
< HCI Command: LE Read Resolving Li.. (0x08|0x002a) plen 0  #27 [hci1] 0.490056
> HCI Event: Command Complete (0x0e) plen 5                 #28 [hci1] 0.490509
      LE Read Resolving List Size (0x08|0x002a) ncmd 1
        Status: Success (0x00)
        Size: 8
< HCI Command: LE Set Event Mask (0x08|0x0001) plen 8       #29 [hci1] 0.510038
        Mask: 0x000002023f87fa5e
          LE Advertising Report
          LE Connection Update Complete
          LE Read Remote Used Features Complete
          LE Long Term Key Request
          LE Data Length Change
          LE Enhanced Connection Complete
          LE PHY Update Complete
          LE Extended Advertising Report
          LE Periodic Advertising Sync Established
          LE Periodic Advertising Report
          LE Periodic Advertising Sync Lost
          LE Extended Scan Timeout
          LE Extended Advertising Set Terminated
          LE Scan Request Received
          LE Periodic Advertising Sync Transfer Rvc
          LE CIS Established
          LE CIS Request
          LE Create BIG Complete
          LE Terminate BIG Complete
          LE BIG Sync Estabilished Complete
          LE BIG Sync Lost
          LE BIG Info Advertising Report
          Unknown mask (0x0000020000000000)
> HCI Event: Command Complete (0x0e) plen 4                 #30 [hci1] 0.510618
      LE Set Event Mask (0x08|0x0001) ncmd 1
        Status: Success (0x00)
< HCI Command: Set Event Mask (0x03|0x0001) plen 8          #31 [hci1] 0.530036
        Mask: 0x2000800002008890
          Disconnection Complete
          Encryption Change
          Read Remote Version Information Complete
          Hardware Error
          Data Buffer Overflow
          Encryption Key Refresh Complete
          LE Meta
> HCI Event: Command Complete (0x0e) plen 4                 #32 [hci1] 0.530603
      Set Event Mask (0x03|0x0001) ncmd 1
        Status: Success (0x00)
< HCI Command: Read BD ADDR (0x04|0x0009) plen 0            #33 [hci1] 0.550037
> HCI Event: Command Complete (0x0e) plen 10                #34 [hci1] 0.550561
      Read BD ADDR (0x04|0x0009) ncmd 1
        Status: Success (0x00)
        Address: 00:00:00:00:00:00 (OUI 00-00-00)
< HCI Command: LE Set Random Address (0x08|0x0005) plen 6   #35 [hci1] 0.570042
        Address: D5:B6:CC:31:DB:3B (Static)
> HCI Event: Command Complete (0x0e) plen 4                 #36 [hci1] 0.570520
      LE Set Random Address (0x08|0x0005) ncmd 1
        Status: Success (0x00)
< HCI Command: LE Set Extended Adv.. (0x08|0x0036) plen 25  #37 [hci1] 3.140090
        Handle: 0x00
        Properties: 0x0013
          Connectable
          Scannable
          Use legacy advertising PDUs: ADV_IND
        Min advertising interval: 100.000 msec (0x00a0)
        Max advertising interval: 150.000 msec (0x00f0)
        Channel map: 37, 38, 39 (0x07)
        Own address type: Random (0x01)
        Peer address type: Public (0x00)
        Peer address: 00:00:00:00:00:00 (OUI 00-00-00)
        Filter policy: Allow Scan Request from Any, Allow Connect Request from Any (0x00)
        TX power: Host has no preference (0x7f)
        Primary PHY: LE 1M (0x01)
        Secondary max skip: 0x00
        Secondary PHY: LE 1M (0x01)
        SID: 0x00
        Scan request notifications: Disabled (0x00)
> HCI Event: Command Complete (0x0e) plen 5                 #38 [hci1] 3.140848
      LE Set Extended Advertising Parameters (0x08|0x0036) ncmd 1
        Status: Success (0x00)
        TX power (selected): 0 dbm (0x00)
< HCI Command: LE Set Advertising S.. (0x08|0x0035) plen 7  #39 [hci1] 3.150070
        Advertising handle: 0x00
        Advertising random address: D5:B6:CC:31:DB:3B (Static)
> HCI Event: Command Complete (0x0e) plen 4                 #40 [hci1] 3.150514
      LE Set Advertising Set Random Address (0x08|0x0035) ncmd 1
        Status: Success (0x00)
< HCI Command: LE Set Extended Adv.. (0x08|0x0037) plen 22  #41 [hci1] 3.170068
        Handle: 0x00
        Operation: Complete extended advertising data (0x03)
        Fragment preference: Minimize fragmentation (0x01)
        Data length: 0x12
        Flags: 0x06
          LE General Discoverable Mode
          BR/EDR Not Supported
        Name (complete): Tester_F6B11A
> HCI Event: Command Complete (0x0e) plen 4                 #42 [hci1] 3.170807
      LE Set Extended Advertising Data (0x08|0x0037) ncmd 1
        Status: Success (0x00)
< HCI Command: LE Set Extended Scan.. (0x08|0x0038) plen 4  #43 [hci1] 3.190054
        Handle: 0x00
        Operation: Complete scan response data (0x03)
        Fragment preference: Minimize fragmentation (0x01)
        Data length: 0x00
> HCI Event: Command Complete (0x0e) plen 4                 #44 [hci1] 3.190495
      LE Set Extended Scan Response Data (0x08|0x0038) ncmd 1
        Status: Success (0x00)
< HCI Command: LE Set Extended Adve.. (0x08|0x0039) plen 6  #45 [hci1] 3.210066
        Extended advertising: Enabled (0x01)
        Number of sets: 1 (0x01)
        Entry 0
          Handle: 0x00
          Duration: 0 ms (0x00)
          Max ext adv events: 0
> HCI Event: Command Complete (0x0e) plen 4                 #46 [hci1] 3.210662
      LE Set Extended Advertising Enable (0x08|0x0039) ncmd 1
        Status: Success (0x00)
> HCI Event: LE Meta Event (0x3e) plen 31                   #47 [hci1] 3.330161
      LE Enhanced Connection Complete (0x0a)
        Status: Success (0x00)
        Handle: 1227
        Role: Peripheral (0x01)
        Peer address type: Public (0x00)
        Peer address: DF:A9:FF:F6:B1:1A (OUI DF-A9-FF)
        Local resolvable private address: 00:00:00:00:00:00 (Non-Resolvable)
        Peer resolvable private address: 00:00:00:00:00:00 (Non-Resolvable)
        Connection interval: 87.50 msec (0x0046)
        Connection latency: 0 (0x0000)
        Supervision timeout: 25120 msec (0x09d0)
        Central clock accuracy: 0x01
> HCI Event: LE Meta Event (0x3e) plen 6                    #48 [hci1] 3.330235
      LE Advertising Set Terminated (0x12)
        Status: Success (0x00)
        Handle: 0
        Connection handle: 1227
        Number of completed extended advertising events: 0
< HCI Command: LE Read Remote Used... (0x08|0x0016) plen 2  #49 [hci1] 3.351027
        Handle: 1227 Address: DF:A9:FF:F6:B1:1A (OUI DF-A9-FF)
< ACL Data TX: Handle 1227 flags 0x00 dlen 7                #50 [hci1] 3.351048
      ATT: Exchange MTU Request (0x02) len 2
        Client RX MTU: 251
> HCI Event: Command Status (0x0f) plen 4                   #51 [hci1] 3.351643
      LE Read Remote Used Features (0x08|0x0016) ncmd 1
        Status: Success (0x00)
> HCI Event: Number of Completed Packets (0x13) plen 5      #52 [hci1] 3.506074
        Num handles: 1
        Handle: 1227 Address: DF:A9:FF:F6:B1:1A (OUI DF-A9-FF)
        Count: 1
        #50: len 7 (0 Kb/s)
        Latency: 155 msec (155-155 msec ~155 msec)
> HCI Event: LE Meta Event (0x3e) plen 12                   #53 [hci1] 3.593976
      LE Read Remote Used Features (0x04)
        Status: Success (0x00)
        Handle: 1227 Address: DF:A9:FF:F6:B1:1A (OUI DF-A9-FF)
        Features: 0x2d 0x49 0x00 0xf7 0x67 0xd9 0x00 0x80
          LE Encryption
          Extended Reject Indication
          Peripheral-initiated Features Exchange
          LE Data Packet Length Extension
          LE 2M PHY
          LE Coded PHY
          Channel Selection Algorithm #2
          Periodic Advertising Sync Transfer - Sender
          Periodic Advertising Sync Transfer - Recipient
          Sleep Clock Accuracy Updates
          Connected Isochronous Stream - Central
          Connected Isochronous Stream - Peripheral
          Isochronous Broadcaster
          Synchronized Receiver
          Connected Isochronous Stream (Host Support)
          LE Power Control Request
          LE Power Control Request
          Connection Subrating
          Connection Subrating (Host Support)
          Unknown features (0x8000d90000000000)
> ACL Data RX: Handle 1227 flags 0x02 dlen 11               #54 [hci1] 6.043818
      SMP: Pairing Request (0x01) len 6
        IO capability: KeyboardDisplay (0x04)
        OOB data: Authentication data not present (0x00)
        Authentication requirement: Bonding, MITM, SC, No Keypresses (0x0d)
        Max encryption key size: 16
        Initiator key distribution: EncKey IdKey (0x03)
        Responder key distribution: EncKey IdKey Sign (0x07)
> ACL Data RX: Handle 1227 flags 0x02 dlen 7                #55 [hci1] 6.044197
      ATT: Exchange MTU Response (0x03) len 2
        Server RX MTU: 23
< HCI Command: Host Number of Compl.. (0x03|0x0035) plen 5  #56 [hci1] 6.050671
        Num handles: 1
        Handle: 1227 Address: DF:A9:FF:F6:B1:1A (OUI DF-A9-FF)
        Count: 1
< ACL Data TX: Handle 1227 flags 0x00 dlen 11               #57 [hci1] 6.050791
      SMP: Pairing Response (0x02) len 6
        IO capability: DisplayOnly (0x00)
        OOB data: Authentication data not present (0x00)
        Authentication requirement: Bonding, No MITM, SC, No Keypresses (0x09)
        Max encryption key size: 16
        Initiator key distribution: IdKey (0x02)
        Responder key distribution: <none> (0x00)
< HCI Command: Host Number of Compl.. (0x03|0x0035) plen 5  #58 [hci1] 6.051215
        Num handles: 1
        Handle: 1227 Address: DF:A9:FF:F6:B1:1A (OUI DF-A9-FF)
        Count: 1
> HCI Event: Number of Completed Packets (0x13) plen 5      #59 [hci1] 6.218870
        Num handles: 1
        Handle: 1227 Address: DF:A9:FF:F6:B1:1A (OUI DF-A9-FF)
        Count: 1
        #57: len 11 (0 Kb/s)
        Latency: 168 msec (155-168 msec ~161 msec)
> ACL Data RX: Handle 1227 flags 0x02 dlen 27               #60 [hci1] 6.219167
> ACL Data RX: Handle 1227 flags 0x01 dlen 27               #61 [hci1] 6.219714
> ACL Data RX: Handle 1227 flags 0x01 dlen 15               #62 [hci1] 6.220152
      SMP: Pairing Public Key (0x0c) len 64
        X: 6e7460a679f01623b5f9f083d21f62962218a7e809faac813846502ef337ea7e
        Y: db600ee1742efa93e9258485d4953e672caef42e01dad623217f1942121662d1
< HCI Command: Host Number of Compl.. (0x03|0x0035) plen 5  #63 [hci1] 6.231064
        Num handles: 1
        Handle: 1227 Address: DF:A9:FF:F6:B1:1A (OUI DF-A9-FF)
        Count: 1
< HCI Command: Host Number of Compl.. (0x03|0x0035) plen 5  #64 [hci1] 6.231215
        Num handles: 1
        Handle: 1227 Address: DF:A9:FF:F6:B1:1A (OUI DF-A9-FF)
        Count: 1
< HCI Command: Host Number of Compl.. (0x03|0x0035) plen 5  #65 [hci1] 6.231657
        Num handles: 1
        Handle: 1227 Address: DF:A9:FF:F6:B1:1A (OUI DF-A9-FF)
        Count: 1
< ACL Data TX: Handle 1227 flags 0x00 dlen 27               #66 [hci1] 6.231731
< ACL Data TX: Handle 1227 flags 0x01 dlen 27               #67 [hci1] 6.231798
< ACL Data TX: Handle 1227 flags 0x01 dlen 15               #68 [hci1] 6.231811
      SMP: Pairing Public Key (0x0c) len 64
        X: 98308440221e2d910f0e54b71e7ec652857aa9b5a0dc65028824cc19db1226e9
        Y: 67a4816bcb62efb21701e31fdb27561a6217575fb007a8bbdabe7e28b6f68482
> HCI Event: Number of Completed Packets (0x13) plen 5      #69 [hci1] 6.306715
        Num handles: 1
        Handle: 1227 Address: DF:A9:FF:F6:B1:1A (OUI DF-A9-FF)
        Count: 1
        #66: len 27 (2 Kb/s)
        Latency: 74 msec (74-168 msec ~118 msec)
> HCI Event: Number of Completed Packets (0x13) plen 5      #70 [hci1] 6.307380
        Num handles: 1
        Handle: 1227 Address: DF:A9:FF:F6:B1:1A (OUI DF-A9-FF)
        Count: 1
        #67: len 27 (2 Kb/s)
        Latency: 75 msec (74-168 msec ~96 msec)
> HCI Event: Number of Completed Packets (0x13) plen 5      #71 [hci1] 6.393578
        Num handles: 1
        Handle: 1227 Address: DF:A9:FF:F6:B1:1A (OUI DF-A9-FF)
        Count: 1
        #68: len 15 (0 Kb/s)
        Latency: 161 msec (74-168 msec ~129 msec)
> ACL Data RX: Handle 1227 flags 0x02 dlen 21               #72 [hci1] 7.356502
      SMP: Pairing Confirm (0x03) len 16
        Confim value: d196cc0519f24522eadb9c191ab174de
< HCI Command: Host Number of Compl.. (0x03|0x0035) plen 5  #73 [hci1] 7.370412
        Num handles: 1
        Handle: 1227 Address: DF:A9:FF:F6:B1:1A (OUI DF-A9-FF)
        Count: 1
< ACL Data TX: Handle 1227 flags 0x00 dlen 21               #74 [hci1] 7.370491
      SMP: Pairing Confirm (0x03) len 16
        Confim value: c960b706b9b118b7e1835a01e242b48b
> HCI Event: Number of Completed Packets (0x13) plen 5      #75 [hci1] 7.531256
        Num handles: 1
        Handle: 1227 Address: DF:A9:FF:F6:B1:1A (OUI DF-A9-FF)
        Count: 1
        #74: len 21 (1 Kb/s)
        Latency: 160 msec (74-168 msec ~145 msec)
> ACL Data RX: Handle 1227 flags 0x02 dlen 21               #76 [hci1] 7.531694
      SMP: Pairing Random (0x04) len 16
        Random value: 3fbc339df147ab3b0000000000000000
< HCI Command: Host Number of Compl.. (0x03|0x0035) plen 5  #77 [hci1] 7.550975
        Num handles: 1
        Handle: 1227 Address: DF:A9:FF:F6:B1:1A (OUI DF-A9-FF)
        Count: 1
< ACL Data TX: Handle 1227 flags 0x00 dlen 21               #78 [hci1] 7.551146
      SMP: Pairing Random (0x04) len 16
        Random value: 8e6108f966a694cbe26df70bb96773e6
> HCI Event: Number of Completed Packets (0x13) plen 5      #79 [hci1] 7.705996
        Num handles: 1
        Handle: 1227 Address: DF:A9:FF:F6:B1:1A (OUI DF-A9-FF)
        Count: 1
        #78: len 21 (1 Kb/s)
        Latency: 154 msec (74-168 msec ~149 msec)
> ACL Data RX: Handle 1227 flags 0x02 dlen 21               #80 [hci1] 7.793858
      SMP: Pairing Confirm (0x03) len 16
        Confim value: 986ecf3af3666565eae3e7814e332aba
< HCI Command: Host Number of Compl.. (0x03|0x0035) plen 5  #81 [hci1] 7.810282
        Num handles: 1
        Handle: 1227 Address: DF:A9:FF:F6:B1:1A (OUI DF-A9-FF)
        Count: 1
< ACL Data TX: Handle 1227 flags 0x00 dlen 21               #82 [hci1] 7.810337
      SMP: Pairing Confirm (0x03) len 16
        Confim value: c6547420f03d342c3da216fdd99de41b
> HCI Event: Number of Completed Packets (0x13) plen 5      #83 [hci1] 7.968763
        Num handles: 1
        Handle: 1227 Address: DF:A9:FF:F6:B1:1A (OUI DF-A9-FF)
        Count: 1
        #82: len 21 (1 Kb/s)
        Latency: 158 msec (74-168 msec ~154 msec)
> ACL Data RX: Handle 1227 flags 0x02 dlen 21               #84 [hci1] 7.969022
      SMP: Pairing Random (0x04) len 16
        Random value: a802612a7668453f0000000000000000
< HCI Command: Host Number of Compl.. (0x03|0x0035) plen 5  #85 [hci1] 7.970315
        Num handles: 1
        Handle: 1227 Address: DF:A9:FF:F6:B1:1A (OUI DF-A9-FF)
        Count: 1
< ACL Data TX: Handle 1227 flags 0x00 dlen 21               #86 [hci1] 7.970333
      SMP: Pairing Random (0x04) len 16
        Random value: 4d02679f89a05211af56d8b3da64d21e
> HCI Event: Number of Completed Packets (0x13) plen 5      #87 [hci1] 8.143476
        Num handles: 1
        Handle: 1227 Address: DF:A9:FF:F6:B1:1A (OUI DF-A9-FF)
        Count: 1
        #86: len 21 (0 Kb/s)
        Latency: 173 msec (74-173 msec ~163 msec)
> ACL Data RX: Handle 1227 flags 0x02 dlen 21               #88 [hci1] 8.231302
      SMP: Pairing Confirm (0x03) len 16
        Confim value: 397bd753efd6bcd3ea32ebc6d9bacafe
< HCI Command: Host Number of Compl.. (0x03|0x0035) plen 5  #89 [hci1] 8.250279
        Num handles: 1
        Handle: 1227 Address: DF:A9:FF:F6:B1:1A (OUI DF-A9-FF)
        Count: 1
< ACL Data TX: Handle 1227 flags 0x00 dlen 21               #90 [hci1] 8.250315
      SMP: Pairing Confirm (0x03) len 16
        Confim value: 58cfbd8f89534f860c916bccf16f08e0
> HCI Event: Number of Completed Packets (0x13) plen 5      #91 [hci1] 8.406227
        Num handles: 1
        Handle: 1227 Address: DF:A9:FF:F6:B1:1A (OUI DF-A9-FF)
        Count: 1
        #90: len 21 (1 Kb/s)
        Latency: 155 msec (74-173 msec ~159 msec)
> ACL Data RX: Handle 1227 flags 0x02 dlen 21               #92 [hci1] 8.406564
      SMP: Pairing Random (0x04) len 16
        Random value: 4c7b9b75a482b0130000000000000000
< HCI Command: Host Number of Compl.. (0x03|0x0035) plen 5  #93 [hci1] 8.410341
        Num handles: 1
        Handle: 1227 Address: DF:A9:FF:F6:B1:1A (OUI DF-A9-FF)
        Count: 1
< ACL Data TX: Handle 1227 flags 0x00 dlen 21               #94 [hci1] 8.410349
      SMP: Pairing Random (0x04) len 16
        Random value: 5e8286bc235a02440d0c3424a2acf8fd
> HCI Event: Number of Completed Packets (0x13) plen 5      #95 [hci1] 8.581056
        Num handles: 1
        Handle: 1227 Address: DF:A9:FF:F6:B1:1A (OUI DF-A9-FF)
        Count: 1
        #94: len 21 (0 Kb/s)
        Latency: 170 msec (74-173 msec ~165 msec)
> ACL Data RX: Handle 1227 flags 0x02 dlen 21               #96 [hci1] 8.668900
      SMP: Pairing Confirm (0x03) len 16
        Confim value: cad72e95bde5fdce443220ad215b1e57
< HCI Command: Host Number of Compl.. (0x03|0x0035) plen 5  #97 [hci1] 8.670217
        Num handles: 1
        Handle: 1227 Address: DF:A9:FF:F6:B1:1A (OUI DF-A9-FF)
        Count: 1
< ACL Data TX: Handle 1227 flags 0x00 dlen 21               #98 [hci1] 8.670227
      SMP: Pairing Confirm (0x03) len 16
        Confim value: 1bd1790780850c142b71b46e6e8913d1
> HCI Event: Number of Completed Packets (0x13) plen 5      #99 [hci1] 8.843688
        Num handles: 1
        Handle: 1227 Address: DF:A9:FF:F6:B1:1A (OUI DF-A9-FF)
        Count: 1
        #98: len 21 (0 Kb/s)
        Latency: 173 msec (74-173 msec ~169 msec)
> ACL Data RX: Handle 1227 flags 0x02 dlen 21              #100 [hci1] 8.844112
      SMP: Pairing Random (0x04) len 16
        Random value: 74cb413838a0c5210000000000000000
< HCI Command: Host Number of Comp.. (0x03|0x0035) plen 5  #101 [hci1] 8.850342
        Num handles: 1
        Handle: 1227 Address: DF:A9:FF:F6:B1:1A (OUI DF-A9-FF)
        Count: 1
< ACL Data TX: Handle 1227 flags 0x00 dlen 21              #102 [hci1] 8.850416
      SMP: Pairing Random (0x04) len 16
        Random value: 5c4a1bcadd27bd58e945097b00bad7ac
> HCI Event: Number of Completed Packets (0x13) plen 5     #103 [hci1] 9.018520
        Num handles: 1
        Handle: 1227 Address: DF:A9:FF:F6:B1:1A (OUI DF-A9-FF)
        Count: 1
        #102: len 21 (1 Kb/s)
        Latency: 168 msec (74-173 msec ~168 msec)
> ACL Data RX: Handle 1227 flags 0x02 dlen 21              #104 [hci1] 9.106321
      SMP: Pairing Confirm (0x03) len 16
        Confim value: c1c7540eb9c25f9aa98ed4f776cb8155
< HCI Command: Host Number of Comp.. (0x03|0x0035) plen 5  #105 [hci1] 9.110252
        Num handles: 1
        Handle: 1227 Address: DF:A9:FF:F6:B1:1A (OUI DF-A9-FF)
        Count: 1
< ACL Data TX: Handle 1227 flags 0x00 dlen 21              #106 [hci1] 9.110294
      SMP: Pairing Confirm (0x03) len 16
        Confim value: 08205d274361e8f3ebbcffb40d19c664
> HCI Event: Number of Completed Packets (0x13) plen 5     #107 [hci1] 9.281257
        Num handles: 1
        Handle: 1227 Address: DF:A9:FF:F6:B1:1A (OUI DF-A9-FF)
        Count: 1
        #106: len 21 (0 Kb/s)
        Latency: 170 msec (74-173 msec ~169 msec)
> ACL Data RX: Handle 1227 flags 0x02 dlen 21              #108 [hci1] 9.281543
      SMP: Pairing Random (0x04) len 16
        Random value: 2de58d7a8b1034a90000000000000000
< HCI Command: Host Number of Comp.. (0x03|0x0035) plen 5  #109 [hci1] 9.290357
        Num handles: 1
        Handle: 1227 Address: DF:A9:FF:F6:B1:1A (OUI DF-A9-FF)
        Count: 1
< ACL Data TX: Handle 1227 flags 0x00 dlen 21              #110 [hci1] 9.290366
      SMP: Pairing Random (0x04) len 16
        Random value: 32527e6e64e79f33b2e374394db8ab2d
> HCI Event: Number of Completed Packets (0x13) plen 5     #111 [hci1] 9.456029
        Num handles: 1
        Handle: 1227 Address: DF:A9:FF:F6:B1:1A (OUI DF-A9-FF)
        Count: 1
        #110: len 21 (1 Kb/s)
        Latency: 165 msec (74-173 msec ~167 msec)
> ACL Data RX: Handle 1227 flags 0x02 dlen 21              #112 [hci1] 9.543860
      SMP: Pairing Confirm (0x03) len 16
        Confim value: e45437cb69740df5a718e1c56ffeeb16
< HCI Command: Host Number of Comp.. (0x03|0x0035) plen 5  #113 [hci1] 9.550396
        Num handles: 1
        Handle: 1227 Address: DF:A9:FF:F6:B1:1A (OUI DF-A9-FF)
        Count: 1
< ACL Data TX: Handle 1227 flags 0x00 dlen 21              #114 [hci1] 9.550435
      SMP: Pairing Confirm (0x03) len 16
        Confim value: a9467654f3bb88afc834f20644a8c7e8
> HCI Event: Number of Completed Packets (0x13) plen 5     #115 [hci1] 9.718735
        Num handles: 1
        Handle: 1227 Address: DF:A9:FF:F6:B1:1A (OUI DF-A9-FF)
        Count: 1
        #114: len 21 (1 Kb/s)
        Latency: 168 msec (74-173 msec ~168 msec)
> ACL Data RX: Handle 1227 flags 0x02 dlen 21              #116 [hci1] 9.719031
      SMP: Pairing Random (0x04) len 16
        Random value: 44b6c3739c00b83e0000000000000000
< HCI Command: Host Number of Comp.. (0x03|0x0035) plen 5  #117 [hci1] 9.730976
        Num handles: 1
        Handle: 1227 Address: DF:A9:FF:F6:B1:1A (OUI DF-A9-FF)
        Count: 1
< ACL Data TX: Handle 1227 flags 0x00 dlen 21              #118 [hci1] 9.731088
      SMP: Pairing Random (0x04) len 16
        Random value: dddbdfe2838e9a8cc6964353c850fef7
> HCI Event: Number of Completed Packets (0x13) plen 5     #119 [hci1] 9.893448
        Num handles: 1
        Handle: 1227 Address: DF:A9:FF:F6:B1:1A (OUI DF-A9-FF)
        Count: 1
        #118: len 21 (1 Kb/s)
        Latency: 162 msec (74-173 msec ~165 msec)
> ACL Data RX: Handle 1227 flags 0x02 dlen 21              #120 [hci1] 9.981368
      SMP: Pairing Confirm (0x03) len 16
        Confim value: 59d2cdac3391a24f48da45b99691e409
< HCI Command: Host Number of Comp.. (0x03|0x0035) plen 5  #121 [hci1] 9.990637
        Num handles: 1
        Handle: 1227 Address: DF:A9:FF:F6:B1:1A (OUI DF-A9-FF)
        Count: 1
< ACL Data TX: Handle 1227 flags 0x00 dlen 21              #122 [hci1] 9.990801
      SMP: Pairing Confirm (0x03) len 16
        Confim value: 44e8edf4009b999df603eab9b65449be
> HCI Event: Number of Completed Packets (0x13) plen 5    #123 [hci1] 10.156216
        Num handles: 1
        Handle: 1227 Address: DF:A9:FF:F6:B1:1A (OUI DF-A9-FF)
        Count: 1
        #122: len 21 (1 Kb/s)
        Latency: 165 msec (74-173 msec ~165 msec)
> ACL Data RX: Handle 1227 flags 0x02 dlen 21             #124 [hci1] 10.156558
      SMP: Pairing Random (0x04) len 16
        Random value: 5fa50cd7bbc6b3ee0000000000000000
< HCI Command: Host Number of Com.. (0x03|0x0035) plen 5  #125 [hci1] 10.171055
        Num handles: 1
        Handle: 1227 Address: DF:A9:FF:F6:B1:1A (OUI DF-A9-FF)
        Count: 1
< ACL Data TX: Handle 1227 flags 0x00 dlen 21             #126 [hci1] 10.171232
      SMP: Pairing Random (0x04) len 16
        Random value: eb9f1915536596b6fc3db1c86b2b1970
> HCI Event: Number of Completed Packets (0x13) plen 5    #127 [hci1] 10.330970
        Num handles: 1
        Handle: 1227 Address: DF:A9:FF:F6:B1:1A (OUI DF-A9-FF)
        Count: 1
        #126: len 21 (1 Kb/s)
        Latency: 159 msec (74-173 msec ~162 msec)
> ACL Data RX: Handle 1227 flags 0x02 dlen 21             #128 [hci1] 10.418938
      SMP: Pairing Confirm (0x03) len 16
        Confim value: 1d2629c6628a6441b9e5c0f7c5cd0fc1
< HCI Command: Host Number of Com.. (0x03|0x0035) plen 5  #129 [hci1] 10.430794
        Num handles: 1
        Handle: 1227 Address: DF:A9:FF:F6:B1:1A (OUI DF-A9-FF)
        Count: 1
< ACL Data TX: Handle 1227 flags 0x00 dlen 21             #130 [hci1] 10.430879
      SMP: Pairing Confirm (0x03) len 16
        Confim value: 0098dcb463bbeae60c671622b865d494
> HCI Event: Number of Completed Packets (0x13) plen 5    #131 [hci1] 10.593754
        Num handles: 1
        Handle: 1227 Address: DF:A9:FF:F6:B1:1A (OUI DF-A9-FF)
        Count: 1
        #130: len 21 (1 Kb/s)
        Latency: 162 msec (74-173 msec ~162 msec)
> ACL Data RX: Handle 1227 flags 0x02 dlen 21             #132 [hci1] 10.594122
      SMP: Pairing Random (0x04) len 16
        Random value: 0b547c500efff6840000000000000000
< HCI Command: Host Number of Com.. (0x03|0x0035) plen 5  #133 [hci1] 10.610962
        Num handles: 1
        Handle: 1227 Address: DF:A9:FF:F6:B1:1A (OUI DF-A9-FF)
        Count: 1
< ACL Data TX: Handle 1227 flags 0x00 dlen 21             #134 [hci1] 10.611116
      SMP: Pairing Random (0x04) len 16
        Random value: 5c794dc9ad9f2c3f295ebd5ad5e1c3cf
> HCI Event: Number of Completed Packets (0x13) plen 5    #135 [hci1] 10.768561
        Num handles: 1
        Handle: 1227 Address: DF:A9:FF:F6:B1:1A (OUI DF-A9-FF)
        Count: 1
        #134: len 21 (1 Kb/s)
        Latency: 157 msec (74-173 msec ~160 msec)
> ACL Data RX: Handle 1227 flags 0x02 dlen 21             #136 [hci1] 10.856365
      SMP: Pairing Confirm (0x03) len 16
        Confim value: 7ea25f2f30fe1e84a09ee51b9b42f48f
< HCI Command: Host Number of Com.. (0x03|0x0035) plen 5  #137 [hci1] 10.870702
        Num handles: 1
        Handle: 1227 Address: DF:A9:FF:F6:B1:1A (OUI DF-A9-FF)
        Count: 1
< ACL Data TX: Handle 1227 flags 0x00 dlen 21             #138 [hci1] 10.870838
      SMP: Pairing Confirm (0x03) len 16
        Confim value: 94e010949c0e6480b07ef23d546fb405
> HCI Event: Number of Completed Packets (0x13) plen 5    #139 [hci1] 11.031231
        Num handles: 1
        Handle: 1227 Address: DF:A9:FF:F6:B1:1A (OUI DF-A9-FF)
        Count: 1
        #138: len 21 (1 Kb/s)
        Latency: 160 msec (74-173 msec ~160 msec)
> ACL Data RX: Handle 1227 flags 0x02 dlen 21             #140 [hci1] 11.031509
      SMP: Pairing Random (0x04) len 16
        Random value: b1d8fa713fb2302a0000000000000000
< HCI Command: Host Number of Com.. (0x03|0x0035) plen 5  #141 [hci1] 11.051028
        Num handles: 1
        Handle: 1227 Address: DF:A9:FF:F6:B1:1A (OUI DF-A9-FF)
        Count: 1
< ACL Data TX: Handle 1227 flags 0x00 dlen 21             #142 [hci1] 11.051128
      SMP: Pairing Random (0x04) len 16
        Random value: 5c2fff312cdf99c9491988e877355a9a
> HCI Event: Number of Completed Packets (0x13) plen 5    #143 [hci1] 11.205954
        Num handles: 1
        Handle: 1227 Address: DF:A9:FF:F6:B1:1A (OUI DF-A9-FF)
        Count: 1
        #142: len 21 (1 Kb/s)
        Latency: 154 msec (74-173 msec ~157 msec)
> ACL Data RX: Handle 1227 flags 0x02 dlen 21             #144 [hci1] 11.293816
      SMP: Pairing Confirm (0x03) len 16
        Confim value: 1bff29159fb0967a28603a8c711ff8a7
< HCI Command: Host Number of Com.. (0x03|0x0035) plen 5  #145 [hci1] 11.310678
        Num handles: 1
        Handle: 1227 Address: DF:A9:FF:F6:B1:1A (OUI DF-A9-FF)
        Count: 1
< ACL Data TX: Handle 1227 flags 0x00 dlen 21             #146 [hci1] 11.310856
      SMP: Pairing Confirm (0x03) len 16
        Confim value: e0c1a58e48d97865144a195ca822598b
> HCI Event: Number of Completed Packets (0x13) plen 5    #147 [hci1] 11.468755
        Num handles: 1
        Handle: 1227 Address: DF:A9:FF:F6:B1:1A (OUI DF-A9-FF)
        Count: 1
        #146: len 21 (1 Kb/s)
        Latency: 157 msec (74-173 msec ~157 msec)
> ACL Data RX: Handle 1227 flags 0x02 dlen 21             #148 [hci1] 11.469060
      SMP: Pairing Random (0x04) len 16
        Random value: db6b5fab929a7a500000000000000000
< HCI Command: Host Number of Com.. (0x03|0x0035) plen 5  #149 [hci1] 11.470967
        Num handles: 1
        Handle: 1227 Address: DF:A9:FF:F6:B1:1A (OUI DF-A9-FF)
        Count: 1
< ACL Data TX: Handle 1227 flags 0x00 dlen 21             #150 [hci1] 11.471137
      SMP: Pairing Random (0x04) len 16
        Random value: c629a3a987d808e808655d558dfc1155
> HCI Event: Number of Completed Packets (0x13) plen 5    #151 [hci1] 11.643457
        Num handles: 1
        Handle: 1227 Address: DF:A9:FF:F6:B1:1A (OUI DF-A9-FF)
        Count: 1
        #150: len 21 (0 Kb/s)
        Latency: 172 msec (74-173 msec ~165 msec)
> ACL Data RX: Handle 1227 flags 0x02 dlen 21             #152 [hci1] 11.731319
      SMP: Pairing Confirm (0x03) len 16
        Confim value: 9c3bcac8ae9f4daf6578aee0a5247fdb
< HCI Command: Host Number of Com.. (0x03|0x0035) plen 5  #153 [hci1] 11.750833
        Num handles: 1
        Handle: 1227 Address: DF:A9:FF:F6:B1:1A (OUI DF-A9-FF)
        Count: 1
< ACL Data TX: Handle 1227 flags 0x00 dlen 21             #154 [hci1] 11.751000
      SMP: Pairing Confirm (0x03) len 16
        Confim value: c8ad09edbe252d8792af22367b3dacbc
> HCI Event: Number of Completed Packets (0x13) plen 5    #155 [hci1] 11.906177
        Num handles: 1
        Handle: 1227 Address: DF:A9:FF:F6:B1:1A (OUI DF-A9-FF)
        Count: 1
        #154: len 21 (1 Kb/s)
        Latency: 155 msec (74-173 msec ~160 msec)
> ACL Data RX: Handle 1227 flags 0x02 dlen 21             #156 [hci1] 11.906496
      SMP: Pairing Random (0x04) len 16
        Random value: 3a13ca5c6cf3e79b0000000000000000
< HCI Command: Host Number of Com.. (0x03|0x0035) plen 5  #157 [hci1] 11.910950
        Num handles: 1
        Handle: 1227 Address: DF:A9:FF:F6:B1:1A (OUI DF-A9-FF)
        Count: 1
< ACL Data TX: Handle 1227 flags 0x00 dlen 21             #158 [hci1] 11.911069
      SMP: Pairing Random (0x04) len 16
        Random value: 92f20f6ad8f13724432c7fd6001c45ff
> HCI Event: Number of Completed Packets (0x13) plen 5    #159 [hci1] 12.080931
        Num handles: 1
        Handle: 1227 Address: DF:A9:FF:F6:B1:1A (OUI DF-A9-FF)
        Count: 1
        #158: len 21 (0 Kb/s)
        Latency: 169 msec (74-173 msec ~164 msec)
> ACL Data RX: Handle 1227 flags 0x02 dlen 21             #160 [hci1] 12.168887
      SMP: Pairing Confirm (0x03) len 16
        Confim value: 9f2cf98a573a79eaf52c0fa923e3deb7
< HCI Command: Host Number of Com.. (0x03|0x0035) plen 5  #161 [hci1] 12.170559
        Num handles: 1
        Handle: 1227 Address: DF:A9:FF:F6:B1:1A (OUI DF-A9-FF)
        Count: 1
< ACL Data TX: Handle 1227 flags 0x00 dlen 21             #162 [hci1] 12.170640
      SMP: Pairing Confirm (0x03) len 16
        Confim value: 1bcc614eebc0445b71304b21f5ba9f27
> HCI Event: Number of Completed Packets (0x13) plen 5    #163 [hci1] 12.343636
        Num handles: 1
        Handle: 1227 Address: DF:A9:FF:F6:B1:1A (OUI DF-A9-FF)
        Count: 1
        #162: len 21 (0 Kb/s)
        Latency: 172 msec (74-173 msec ~168 msec)
> ACL Data RX: Handle 1227 flags 0x02 dlen 21             #164 [hci1] 12.343994
      SMP: Pairing Random (0x04) len 16
        Random value: 485da8156ed6ca350000000000000000
< HCI Command: Host Number of Com.. (0x03|0x0035) plen 5  #165 [hci1] 12.350990
        Num handles: 1
        Handle: 1227 Address: DF:A9:FF:F6:B1:1A (OUI DF-A9-FF)
        Count: 1
< ACL Data TX: Handle 1227 flags 0x00 dlen 21             #166 [hci1] 12.351077
      SMP: Pairing Random (0x04) len 16
        Random value: 23ac32ebbb5e14c8a6b9622f296d277f
> HCI Event: Number of Completed Packets (0x13) plen 5    #167 [hci1] 12.518409
        Num handles: 1
        Handle: 1227 Address: DF:A9:FF:F6:B1:1A (OUI DF-A9-FF)
        Count: 1
        #166: len 21 (1 Kb/s)
        Latency: 167 msec (74-173 msec ~168 msec)
> ACL Data RX: Handle 1227 flags 0x02 dlen 21             #168 [hci1] 12.606290
      SMP: Pairing Confirm (0x03) len 16
        Confim value: 197ed104ade808c25b06cb8bfc474590
< HCI Command: Host Number of Com.. (0x03|0x0035) plen 5  #169 [hci1] 12.610400
        Num handles: 1
        Handle: 1227 Address: DF:A9:FF:F6:B1:1A (OUI DF-A9-FF)
        Count: 1
< ACL Data TX: Handle 1227 flags 0x00 dlen 21             #170 [hci1] 12.610413
      SMP: Pairing Confirm (0x03) len 16
        Confim value: 8298793e12ee57924d22ad8784d5eeb1
> HCI Event: Number of Completed Packets (0x13) plen 5    #171 [hci1] 12.781162
        Num handles: 1
        Handle: 1227 Address: DF:A9:FF:F6:B1:1A (OUI DF-A9-FF)
        Count: 1
        #170: len 21 (0 Kb/s)
        Latency: 170 msec (74-173 msec ~169 msec)
> ACL Data RX: Handle 1227 flags 0x02 dlen 21             #172 [hci1] 12.781491
      SMP: Pairing Random (0x04) len 16
        Random value: b7b4fc8c500302530000000000000000
< HCI Command: Host Number of Com.. (0x03|0x0035) plen 5  #173 [hci1] 12.791033
        Num handles: 1
        Handle: 1227 Address: DF:A9:FF:F6:B1:1A (OUI DF-A9-FF)
        Count: 1
< ACL Data TX: Handle 1227 flags 0x00 dlen 21             #174 [hci1] 12.791217
      SMP: Pairing Random (0x04) len 16
        Random value: 297efe85e67448a15f56bd27e3a3cf1d
> HCI Event: Number of Completed Packets (0x13) plen 5    #175 [hci1] 12.955984
        Num handles: 1
        Handle: 1227 Address: DF:A9:FF:F6:B1:1A (OUI DF-A9-FF)
        Count: 1
        #174: len 21 (1 Kb/s)
        Latency: 164 msec (74-173 msec ~167 msec)
> ACL Data RX: Handle 1227 flags 0x02 dlen 21             #176 [hci1] 13.043859
      SMP: Pairing Confirm (0x03) len 16
        Confim value: 525fd97aa1a58475b984030414f9f572
< HCI Command: Host Number of Com.. (0x03|0x0035) plen 5  #177 [hci1] 13.050775
        Num handles: 1
        Handle: 1227 Address: DF:A9:FF:F6:B1:1A (OUI DF-A9-FF)
        Count: 1
< ACL Data TX: Handle 1227 flags 0x00 dlen 21             #178 [hci1] 13.050940
      SMP: Pairing Confirm (0x03) len 16
        Confim value: e440020e674cce56ec64e994b035e201
> HCI Event: Number of Completed Packets (0x13) plen 5    #179 [hci1] 13.218657
        Num handles: 1
        Handle: 1227 Address: DF:A9:FF:F6:B1:1A (OUI DF-A9-FF)
        Count: 1
        #178: len 21 (1 Kb/s)
        Latency: 167 msec (74-173 msec ~167 msec)
> ACL Data RX: Handle 1227 flags 0x02 dlen 21             #180 [hci1] 13.218997
      SMP: Pairing Random (0x04) len 16
        Random value: 2a996f335a42a8fd0000000000000000
< HCI Command: Host Number of Com.. (0x03|0x0035) plen 5  #181 [hci1] 13.230895
        Num handles: 1
        Handle: 1227 Address: DF:A9:FF:F6:B1:1A (OUI DF-A9-FF)
        Count: 1
< ACL Data TX: Handle 1227 flags 0x00 dlen 21             #182 [hci1] 13.231082
      SMP: Pairing Random (0x04) len 16
        Random value: 25a9493fd3ce4faf02be7293595bb7c6
> HCI Event: Number of Completed Packets (0x13) plen 5    #183 [hci1] 13.393452
        Num handles: 1
        Handle: 1227 Address: DF:A9:FF:F6:B1:1A (OUI DF-A9-FF)
        Count: 1
        #182: len 21 (1 Kb/s)
        Latency: 162 msec (74-173 msec ~164 msec)
> ACL Data RX: Handle 1227 flags 0x02 dlen 21             #184 [hci1] 13.481325
      SMP: Pairing Confirm (0x03) len 16
        Confim value: 646c10273b0c273a8411ef925e006eb6
< HCI Command: Host Number of Com.. (0x03|0x0035) plen 5  #185 [hci1] 13.490784
        Num handles: 1
        Handle: 1227 Address: DF:A9:FF:F6:B1:1A (OUI DF-A9-FF)
        Count: 1
< ACL Data TX: Handle 1227 flags 0x00 dlen 21             #186 [hci1] 13.490891
      SMP: Pairing Confirm (0x03) len 16
        Confim value: 2c3c73ac2b64147f6b55869cfde13491
> HCI Event: Number of Completed Packets (0x13) plen 5    #187 [hci1] 13.656242
        Num handles: 1
        Handle: 1227 Address: DF:A9:FF:F6:B1:1A (OUI DF-A9-FF)
        Count: 1
        #186: len 21 (1 Kb/s)
        Latency: 165 msec (74-173 msec ~165 msec)
> ACL Data RX: Handle 1227 flags 0x02 dlen 21             #188 [hci1] 13.656472
      SMP: Pairing Random (0x04) len 16
        Random value: f1b238dec0bb9f6a0000000000000000
< HCI Command: Host Number of Com.. (0x03|0x0035) plen 5  #189 [hci1] 13.670376
        Num handles: 1
        Handle: 1227 Address: DF:A9:FF:F6:B1:1A (OUI DF-A9-FF)
        Count: 1
< ACL Data TX: Handle 1227 flags 0x00 dlen 21             #190 [hci1] 13.670473
      SMP: Pairing Random (0x04) len 16
        Random value: 58f6b41f855a6f6c3560debd84e2affc
> HCI Event: Number of Completed Packets (0x13) plen 5    #191 [hci1] 13.830941
        Num handles: 1
        Handle: 1227 Address: DF:A9:FF:F6:B1:1A (OUI DF-A9-FF)
        Count: 1
        #190: len 21 (1 Kb/s)
        Latency: 160 msec (74-173 msec ~162 msec)
> ACL Data RX: Handle 1227 flags 0x02 dlen 21             #192 [hci1] 13.918735
      SMP: Pairing Confirm (0x03) len 16
        Confim value: 28c5d5102720270c38b8a80c345873e6
< HCI Command: Host Number of Com.. (0x03|0x0035) plen 5  #193 [hci1] 13.930580
        Num handles: 1
        Handle: 1227 Address: DF:A9:FF:F6:B1:1A (OUI DF-A9-FF)
        Count: 1
< ACL Data TX: Handle 1227 flags 0x00 dlen 21             #194 [hci1] 13.930794
      SMP: Pairing Confirm (0x03) len 16
        Confim value: 70e1e7b5b254b8ad03b5463dde6cdfe8
> HCI Event: Number of Completed Packets (0x13) plen 5    #195 [hci1] 14.093705
        Num handles: 1
        Handle: 1227 Address: DF:A9:FF:F6:B1:1A (OUI DF-A9-FF)
        Count: 1
        #194: len 21 (1 Kb/s)
        Latency: 162 msec (74-173 msec ~162 msec)
> ACL Data RX: Handle 1227 flags 0x02 dlen 21             #196 [hci1] 14.094072
      SMP: Pairing Random (0x04) len 16
        Random value: 60d7b9482414c3e40000000000000000
< HCI Command: Host Number of Com.. (0x03|0x0035) plen 5  #197 [hci1] 14.111035
        Num handles: 1
        Handle: 1227 Address: DF:A9:FF:F6:B1:1A (OUI DF-A9-FF)
        Count: 1
< ACL Data TX: Handle 1227 flags 0x00 dlen 21             #198 [hci1] 14.111181
      SMP: Pairing Random (0x04) len 16
        Random value: b67e7216d5bf664139eda2b542549666
> HCI Event: Number of Completed Packets (0x13) plen 5    #199 [hci1] 14.268412
        Num handles: 1
        Handle: 1227 Address: DF:A9:FF:F6:B1:1A (OUI DF-A9-FF)
        Count: 1
        #198: len 21 (1 Kb/s)
        Latency: 157 msec (74-173 msec ~160 msec)
> ACL Data RX: Handle 1227 flags 0x02 dlen 21             #200 [hci1] 14.356376
      SMP: Pairing Confirm (0x03) len 16
        Confim value: d1fde5d1bc3460b30e3709fc814c571e
< HCI Command: Host Number of Com.. (0x03|0x0035) plen 5  #201 [hci1] 14.370476
        Num handles: 1
        Handle: 1227 Address: DF:A9:FF:F6:B1:1A (OUI DF-A9-FF)
        Count: 1
< ACL Data TX: Handle 1227 flags 0x00 dlen 21             #202 [hci1] 14.370614
      SMP: Pairing Confirm (0x03) len 16
        Confim value: 0746e27df6b2396cd3a5bb28dc04cf08
> HCI Event: Number of Completed Packets (0x13) plen 5    #203 [hci1] 14.531223
        Num handles: 1
        Handle: 1227 Address: DF:A9:FF:F6:B1:1A (OUI DF-A9-FF)
        Count: 1
        #202: len 21 (1 Kb/s)
        Latency: 160 msec (74-173 msec ~160 msec)
> ACL Data RX: Handle 1227 flags 0x02 dlen 21             #204 [hci1] 14.531487
      SMP: Pairing Random (0x04) len 16
        Random value: b79aa89e6f232b5d0000000000000000
< HCI Command: Host Number of Com.. (0x03|0x0035) plen 5  #205 [hci1] 14.550835
        Num handles: 1
        Handle: 1227 Address: DF:A9:FF:F6:B1:1A (OUI DF-A9-FF)
        Count: 1
< ACL Data TX: Handle 1227 flags 0x00 dlen 21             #206 [hci1] 14.550978
      SMP: Pairing Random (0x04) len 16
        Random value: ed17f76500c95219dd01e09d1e63f87b
> HCI Event: Number of Completed Packets (0x13) plen 5    #207 [hci1] 14.705992
        Num handles: 1
        Handle: 1227 Address: DF:A9:FF:F6:B1:1A (OUI DF-A9-FF)
        Count: 1
        #206: len 21 (1 Kb/s)
        Latency: 155 msec (74-173 msec ~157 msec)
> ACL Data RX: Handle 1227 flags 0x02 dlen 21             #208 [hci1] 14.793768
      SMP: Pairing Confirm (0x03) len 16
        Confim value: cb66c5673ad275ed7a56f81d2c90eb77
< HCI Command: Host Number of Com.. (0x03|0x0035) plen 5  #209 [hci1] 14.810334
        Num handles: 1
        Handle: 1227 Address: DF:A9:FF:F6:B1:1A (OUI DF-A9-FF)
        Count: 1
< ACL Data TX: Handle 1227 flags 0x00 dlen 21             #210 [hci1] 14.810341
      SMP: Pairing Confirm (0x03) len 16
        Confim value: 412ad84b125a44030a868f9cf948752b
> HCI Event: Number of Completed Packets (0x13) plen 5    #211 [hci1] 14.968795
        Num handles: 1
        Handle: 1227 Address: DF:A9:FF:F6:B1:1A (OUI DF-A9-FF)
        Count: 1
        #210: len 21 (1 Kb/s)
        Latency: 158 msec (74-173 msec ~158 msec)
> ACL Data RX: Handle 1227 flags 0x02 dlen 21             #212 [hci1] 14.968953
      SMP: Pairing Random (0x04) len 16
        Random value: 8e1f31f57111abc30000000000000000
< HCI Command: Host Number of Com.. (0x03|0x0035) plen 5  #213 [hci1] 14.970827
        Num handles: 1
        Handle: 1227 Address: DF:A9:FF:F6:B1:1A (OUI DF-A9-FF)
        Count: 1
< ACL Data TX: Handle 1227 flags 0x00 dlen 21             #214 [hci1] 14.970996
      SMP: Pairing Random (0x04) len 16
        Random value: 81d35d47e1f6006d79c974bd9d9e1ee3
> HCI Event: Number of Completed Packets (0x13) plen 5    #215 [hci1] 15.143474
        Num handles: 1
        Handle: 1227 Address: DF:A9:FF:F6:B1:1A (OUI DF-A9-FF)
        Count: 1
        #214: len 21 (0 Kb/s)
        Latency: 172 msec (74-173 msec ~165 msec)
> ACL Data RX: Handle 1227 flags 0x02 dlen 21             #216 [hci1] 15.231344
      SMP: Pairing Confirm (0x03) len 16
        Confim value: 52f428c42d9d307f9c47dd422a82d100
< HCI Command: Host Number of Com.. (0x03|0x0035) plen 5  #217 [hci1] 15.250834
        Num handles: 1
        Handle: 1227 Address: DF:A9:FF:F6:B1:1A (OUI DF-A9-FF)
        Count: 1
< ACL Data TX: Handle 1227 flags 0x00 dlen 21             #218 [hci1] 15.251021
      SMP: Pairing Confirm (0x03) len 16
        Confim value: 0ebd9022b194e4fd815318d8ff3e48ff
> HCI Event: Number of Completed Packets (0x13) plen 5    #219 [hci1] 15.406187
        Num handles: 1
        Handle: 1227 Address: DF:A9:FF:F6:B1:1A (OUI DF-A9-FF)
        Count: 1
        #218: len 21 (1 Kb/s)
        Latency: 155 msec (74-173 msec ~160 msec)
> ACL Data RX: Handle 1227 flags 0x02 dlen 21             #220 [hci1] 15.406440
      SMP: Pairing Random (0x04) len 16
        Random value: 134da4f6b661ef720000000000000000
< HCI Command: Host Number of Com.. (0x03|0x0035) plen 5  #221 [hci1] 15.410500
        Num handles: 1
        Handle: 1227 Address: DF:A9:FF:F6:B1:1A (OUI DF-A9-FF)
        Count: 1
< ACL Data TX: Handle 1227 flags 0x00 dlen 21             #222 [hci1] 15.410556
      SMP: Pairing Random (0x04) len 16
        Random value: e7f7e0c2476823e41736a7e381bafb7c
> HCI Event: Number of Completed Packets (0x13) plen 5    #223 [hci1] 15.580883
        Num handles: 1
        Handle: 1227 Address: DF:A9:FF:F6:B1:1A (OUI DF-A9-FF)
        Count: 1
        #222: len 21 (0 Kb/s)
        Latency: 170 msec (74-173 msec ~165 msec)
> ACL Data RX: Handle 1227 flags 0x02 dlen 21             #224 [hci1] 15.668800
      SMP: Pairing Confirm (0x03) len 16
        Confim value: d3bab2f0af08a968ba5c3e13be08dd8e
< HCI Command: Host Number of Com.. (0x03|0x0035) plen 5  #225 [hci1] 15.670491
        Num handles: 1
        Handle: 1227 Address: DF:A9:FF:F6:B1:1A (OUI DF-A9-FF)
        Count: 1
< ACL Data TX: Handle 1227 flags 0x00 dlen 21             #226 [hci1] 15.670591
      SMP: Pairing Confirm (0x03) len 16
        Confim value: 3eed626e45d25cdd8ef7d32b398b8770
> HCI Event: Number of Completed Packets (0x13) plen 5    #227 [hci1] 15.843728
        Num handles: 1
        Handle: 1227 Address: DF:A9:FF:F6:B1:1A (OUI DF-A9-FF)
        Count: 1
        #226: len 21 (0 Kb/s)
        Latency: 173 msec (74-173 msec ~169 msec)
> ACL Data RX: Handle 1227 flags 0x02 dlen 21             #228 [hci1] 15.844036
      SMP: Pairing Random (0x04) len 16
        Random value: 27d7a8e4375b61570000000000000000
