Bluetooth monitor ver 5.72
= Note: Linux version 6.14.0-36-generic (x86_64)                       0.255895
= Note: Bluetooth subsystem version 2.22                               0.255896
= New Index: 00:00:00:00:00:00 (Primary,UART,hci2)              [hci2] 0.255897
= New Index: 00:00:00:00:00:00 (Primary,UART,hci1)              [hci1] 0.255897
= New Index: 48:5F:99:8E:E0:64 (Primary,USB,hci0)               [hci0] 0.255898
= Open Index: 00:00:00:00:00:00                                 [hci1] 0.369702
= Index Info: 00:00:00:00:00:00 (Nordic Semiconductor ASA)      [hci1] 0.369718
@ USER Open: main (privileged) version 2.22            {0x0001} [hci1] 0.369727
< HCI Command: Reset (0x03|0x0003) plen 0                    #1 [hci1] 0.371097
> HCI Event: Command Complete (0x0e) plen 4                  #2 [hci1] 0.371650
      Reset (0x03|0x0003) ncmd 1
        Status: Success (0x00)
< HCI Command: Read Local Supported... (0x04|0x0003) plen 0  #3 [hci1] 0.389362
> HCI Event: Command Complete (0x0e) plen 12                 #4 [hci1] 0.389988
      Read Local Supported Features (0x04|0x0003) ncmd 1
        Status: Success (0x00)
        Features: 0x00 0x00 0x00 0x00 0x60 0x00 0x00 0x00
          BR/EDR Not Supported
          LE Supported (Controller)
< HCI Command: Read Local Version In.. (0x04|0x0001) plen 0  #5 [hci1] 0.409127
> HCI Event: Command Complete (0x0e) plen 12                 #6 [hci1] 0.409671
      Read Local Version Information (0x04|0x0001) ncmd 1
        Status: Success (0x00)
        HCI version: Reserved (0x0f) - Revision 12393 (0x3069)
        LMP version: Reserved (0x0f) - Subversion 12393 (0x3069)
        Manufacturer: Nordic Semiconductor ASA (89)
< HCI Command: Read Local Supported... (0x04|0x0002) plen 0  #7 [hci1] 0.429036
> HCI Event: Command Complete (0x0e) plen 68                 #8 [hci1] 0.430109
      Read Local Supported Commands (0x04|0x0002) ncmd 1
        Status: Success (0x00)
        Commands: 119 entries
          Disconnect (Octet 0 - Bit 5)
          Read Remote Version Information (Octet 2 - Bit 7)
          Set Event Mask (Octet 5 - Bit 6)
          Reset (Octet 5 - Bit 7)
          Read Connection Accept Timeout (Octet 7 - Bit 2)
          Write Connection Accept Timeout (Octet 7 - Bit 3)
          Read Transmit Power Level (Octet 10 - Bit 2)
          Set Controller To Host Flow Control (Octet 10 - Bit 5)
          Host Buffer Size (Octet 10 - Bit 6)
          Host Number of Completed Packets (Octet 10 - Bit 7)
          Read Local Version Information (Octet 14 - Bit 3)
          Read Local Supported Features (Octet 14 - Bit 5)
          Read BD ADDR (Octet 15 - Bit 1)
          Read RSSI (Octet 15 - Bit 5)
          Set Event Mask Page 2 (Octet 22 - Bit 2)
          LE Set Event Mask (Octet 25 - Bit 0)
          LE Read Buffer Size (Octet 25 - Bit 1)
          LE Read Local Supported Features (Octet 25 - Bit 2)
          LE Set Random Address (Octet 25 - Bit 4)
          LE Set Advertising Parameters (Octet 25 - Bit 5)
          LE Read Advertising Channel TX Power (Octet 25 - Bit 6)
          LE Set Advertising Data (Octet 25 - Bit 7)
          LE Set Scan Response Data (Octet 26 - Bit 0)
          LE Set Advertise Enable (Octet 26 - Bit 1)
          LE Set Scan Parameters (Octet 26 - Bit 2)
          LE Set Scan Enable (Octet 26 - Bit 3)
          LE Create Connection (Octet 26 - Bit 4)
          LE Create Connection Cancel (Octet 26 - Bit 5)
          LE Read Accept List Size (Octet 26 - Bit 6)
          LE Clear Accept List (Octet 26 - Bit 7)
          LE Add Device To Accept List (Octet 27 - Bit 0)
          LE Remove Device From Accept List (Octet 27 - Bit 1)
          LE Connection Update (Octet 27 - Bit 2)
          LE Set Host Channel Classification (Octet 27 - Bit 3)
          LE Read Channel Map (Octet 27 - Bit 4)
          LE Read Remote Used Features (Octet 27 - Bit 5)
          LE Encrypt (Octet 27 - Bit 6)
          LE Rand (Octet 27 - Bit 7)
          LE Start Encryption (Octet 28 - Bit 0)
          LE Long Term Key Request Reply (Octet 28 - Bit 1)
          LE Long Term Key Request Neg Reply (Octet 28 - Bit 2)
          LE Read Supported States (Octet 28 - Bit 3)
          LE Receiver Test (Octet 28 - Bit 4)
          LE Transmitter Test (Octet 28 - Bit 5)
          LE Test End (Octet 28 - Bit 6)
          Read Authenticated Payload Timeout (Octet 32 - Bit 4)
          Write Authenticated Payload Timeout (Octet 32 - Bit 5)
          LE Set Data Length (Octet 33 - Bit 6)
          LE Read Suggested Default Data Length (Octet 33 - Bit 7)
          LE Write Suggested Default Data Length (Octet 34 - Bit 0)
          LE Add Device To Resolving List (Octet 34 - Bit 3)
          LE Remove Device From Resolving List (Octet 34 - Bit 4)
          LE Clear Resolving List (Octet 34 - Bit 5)
          LE Read Resolving List Size (Octet 34 - Bit 6)
          LE Set Address Resolution Enable (Octet 35 - Bit 1)
          LE Set Resolvable Private Address Timeout (Octet 35 - Bit 2)
          LE Read Maximum Data Length (Octet 35 - Bit 3)
          LE Read PHY (Octet 35 - Bit 4)
          LE Set Default PHY (Octet 35 - Bit 5)
          LE Set PHY (Octet 35 - Bit 6)
          LE Enhanced Receiver Test (Octet 35 - Bit 7)
          LE Enhanced Transmitter Test (Octet 36 - Bit 0)
          LE Set Advertising Set Random Address (Octet 36 - Bit 1)
          LE Set Extended Advertising Parameters (Octet 36 - Bit 2)
          LE Set Extended Advertising Data (Octet 36 - Bit 3)
          LE Set Extended Scan Response Data (Octet 36 - Bit 4)
          LE Set Extended Advertising Enable (Octet 36 - Bit 5)
          LE Read Maximum Advertising Data Length (Octet 36 - Bit 6)
          LE Read Number of Supported Advertising Sets (Octet 36 - Bit 7)
          LE Remove Advertising Set (Octet 37 - Bit 0)
          LE Clear Advertising Sets (Octet 37 - Bit 1)
          LE Set Periodic Advertising Parameters (Octet 37 - Bit 2)
          LE Set Periodic Advertising Data (Octet 37 - Bit 3)
          LE Set Periodic Advertising Enable (Octet 37 - Bit 4)
          LE Set Extended Scan Parameters (Octet 37 - Bit 5)
          LE Set Extended Scan Enable (Octet 37 - Bit 6)
          LE Extended Create Connection (Octet 37 - Bit 7)
          LE Periodic Advertising Create Sync (Octet 38 - Bit 0)
          LE Periodic Advertising Create Sync Cancel (Octet 38 - Bit 1)
          LE Periodic Advertising Terminate Sync (Octet 38 - Bit 2)
          LE Add Device To Periodic Advertiser List (Octet 38 - Bit 3)
          LE Remove Device From Periodic Advertiser List (Octet 38 - Bit 4)
          LE Clear Periodic Advertiser List (Octet 38 - Bit 5)
          LE Read Periodic Advertiser List Size (Octet 38 - Bit 6)
          LE Read Transmit Power (Octet 38 - Bit 7)
          LE Read RF Path Compensation (Octet 39 - Bit 0)
          LE Write RF Path Compensation (Octet 39 - Bit 1)
          LE Set Privacy Mode (Octet 39 - Bit 2)
          LE Periodic Advertising Receive Enable (Octet 40 - Bit 5)
          LE Periodic Advertising Sync Transfer (Octet 40 - Bit 6)
          LE Periodic Advertising Set Info Transfer (Octet 40 - Bit 7)
          LE Periodic Advertising Sync Transfer Parameters (Octet 41 - Bit 0)
          LE Set Default Periodic Advertisng Sync Transfer Parameters (Octet 41 - Bit 1)
          LE Read Buffer v2 (Octet 41 - Bit 5)
          LE Read ISO TX Sync (Octet 41 - Bit 6)
          LE Set Connected Isochronous Group Parameters (Octet 41 - Bit 7)
          LE Set Connected Isochronous Group Parameters Test (Octet 42 - Bit 0)
          LE Create Connected Isochronous Stream (Octet 42 - Bit 1)
          LE Remove Connected Isochronous Group (Octet 42 - Bit 2)
          LE Accept Connected Isochronous Stream Request (Octet 42 - Bit 3)
          LE Reject Connected Isochronous Stream Request (Octet 42 - Bit 4)
          LE Create Broadcast Isochronous Group (Octet 42 - Bit 5)
          LE Create Broadcast Isochronous Group Test (Octet 42 - Bit 6)
          LE Terminate Broadcast Isochronous Group (Octet 42 - Bit 7)
          LE Broadcast Isochronous Group Create Sync (Octet 43 - Bit 0)
          LE Broadcast Isochronous Group Terminate Sync (Octet 43 - Bit 1)
          LE Request Peer SCA (Octet 43 - Bit 2)
          LE Setup Isochronous Data Path (Octet 43 - Bit 3)
          LE Remove Isochronous Data Path (Octet 43 - Bit 4)
          LE Isochronous Transmit Test (Octet 43 - Bit 5)
          LE Isochronous Receive Test (Octet 43 - Bit 6)
          LE Isochronous Read Test Counters (Octet 43 - Bit 7)
          LE Isochronous Read Test Counters (Octet 44 - Bit 0)
          LE Set Host Feature (Octet 44 - Bit 1)
          Octet 44 - Bit 2 
          Octet 45 - Bit 6 
          Octet 46 - Bit 0 
          Octet 46 - Bit 1 
          Octet 46 - Bit 2 
< HCI Command: Host Buffer Size (0x03|0x0033) plen 7         #9 [hci1] 0.449029
        ACL MTU: 255  ACL max packet: 16
        SCO MTU: 0    SCO max packet: 0
> HCI Event: Command Complete (0x0e) plen 4                 #10 [hci1] 0.449595
      Host Buffer Size (0x03|0x0033) ncmd 1
        Status: Success (0x00)
< HCI Command: Set Controller To Ho.. (0x03|0x0031) plen 1  #11 [hci1] 0.469068
        Flow control: ACL Data Packets (0x01)
> HCI Event: Command Complete (0x0e) plen 4                 #12 [hci1] 0.469558
      Set Controller To Host Flow Control (0x03|0x0031) ncmd 1
        Status: Success (0x00)
< HCI Command: LE Read Local Suppor.. (0x08|0x0003) plen 0  #13 [hci1] 0.488989
> HCI Event: Command Complete (0x0e) plen 12                #14 [hci1] 0.489670
      LE Read Local Supported Features (0x08|0x0003) ncmd 1
        Status: Success (0x00)
        Features: 0xfd 0x79 0x00 0xf7 0x30 0x01 0x00 0x00
          LE Encryption
          Extended Reject Indication
          Peripheral-initiated Features Exchange
          LE Ping
          LE Data Packet Length Extension
          LL Privacy
          Extended Scanner Filter Policies
          LE 2M PHY
          LE Coded PHY
          LE Extended Advertising
          LE Periodic Advertising
          Channel Selection Algorithm #2
          Periodic Advertising Sync Transfer - Sender
          Periodic Advertising Sync Transfer - Recipient
          Sleep Clock Accuracy Updates
          Connected Isochronous Stream - Central
          Connected Isochronous Stream - Peripheral
          Isochronous Broadcaster
          Synchronized Receiver
          Periodic Advertising ADI support
          Connection Subrating
          Unknown features (0x0000010000000000)
< HCI Command: LE Set Host Feature (0x08|0x0074) plen 2     #15 [hci1] 0.509024
        Bit Number: 32
          Connected Isochronous Stream (Host Support)
        Bit Value: 1
> HCI Event: Command Complete (0x0e) plen 4                 #16 [hci1] 0.509572
      LE Set Host Feature (0x08|0x0074) ncmd 1
        Status: Success (0x00)
< HCI Command: LE Read Buffer v2 (0x08|0x0060) plen 0       #17 [hci1] 0.529027
> HCI Event: Command Complete (0x0e) plen 10                #18 [hci1] 0.529574
      LE Read Buffer v2 (0x08|0x0060) ncmd 1
        Status: Success (0x00)
        ACL MTU: 27
        ACL max packet: 3
        ISO MTU: 318
        ISO max packet: 3
< HCI Command: LE Read Maximum Adve.. (0x08|0x003a) plen 0  #19 [hci1] 0.549064
> HCI Event: Command Complete (0x0e) plen 6                 #20 [hci1] 0.549548
      LE Read Maximum Advertising Data Length (0x08|0x003a) ncmd 1
        Status: Success (0x00)
        Max length: 1650
< HCI Command: LE Read Supported St.. (0x08|0x001c) plen 0  #21 [hci1] 0.569000
> HCI Event: Command Complete (0x0e) plen 12                #22 [hci1] 0.569595
      LE Read Supported States (0x08|0x001c) ncmd 1
        Status: Success (0x00)
        States: 0x000003ff3e0306ff
          Non-connectable Advertising State
          Scannable Advertising State
          Connectable Advertising State
          High Duty Cycle Directed Advertising State
          Passive Scanning State
          Active Scanning State
          Initiating State
            and Connection State (Central Role)
          Connection State (Peripheral Role)
          Scannable Advertising State
            and Passive Scanning State
          Connectable Advertising State
            and Passive Scanning State
          Non-connectable Advertising State
            and Initiating State
          Scannable Advertising State
            and Initiating State
          Active Scanning State
            and Connection State (Central Role)
          Passive Scanning State
            and Connection State (Peripheral Role)
          Active Scanning State
            and Connection State (Peripheral Role)
          Initiating State
            and Connection State (Central Role)
            and Central Role & Central Role
          Low Duty Cycle Directed Advertising State
          Connectable Advertising State
            and Initiating State
            and Central Role & Peripheral Role
          High Duty Cycle Directed Advertising State
            and Initiating State
            and Central Role & Peripheral Role
          Low Duty Cycle Directed Advertising State
            and Initiating State
            and Central Role & Peripheral Role
          Connectable Advertising State
            and Connection State (Central Role)
            and Central Role & Peripheral Role
          High Duty Cycle Directed Advertising State
            and Connection State (Central Role)
            and Central Role & Peripheral Role
          Low Duty Cycle Directed Advertising State
            and Connection State (Central Role)
            and Central Role & Peripheral Role
          Connectable Advertising State
            and Connection State (Peripheral Role)
            and Central Role & Peripheral Role
          High Duty Cycle Directed Advertising State
            and Connection State (Peripheral Role)
            and Peripheral Role & Peripheral Role
          Low Duty Cycle Directed Advertising State
            and Connection State (Peripheral Role)
            and Peripheral Role & Peripheral Role
          Initiating State
            and Connection State (Peripheral Role)
            and Central Role & Peripheral Role
< HCI Command: LE Read Maximum Data.. (0x08|0x002f) plen 0  #23 [hci1] 0.589045
> HCI Event: Command Complete (0x0e) plen 12                #24 [hci1] 0.589619
      LE Read Maximum Data Length (0x08|0x002f) ncmd 1
        Status: Success (0x00)
        Max TX octets: 251
        Max TX time: 2704
        Max RX octets: 251
        Max RX time: 2704
< HCI Command: LE Write Suggested D.. (0x08|0x0024) plen 4  #25 [hci1] 0.609023
        TX octets: 251
        TX time: 2704
> HCI Event: Command Complete (0x0e) plen 4                 #26 [hci1] 0.609727
      LE Write Suggested Default Data Length (0x08|0x0024) ncmd 1
        Status: Success (0x00)
< HCI Command: LE Read Resolving Li.. (0x08|0x002a) plen 0  #27 [hci1] 0.629035
> HCI Event: Command Complete (0x0e) plen 5                 #28 [hci1] 0.629679
      LE Read Resolving List Size (0x08|0x002a) ncmd 1
        Status: Success (0x00)
        Size: 8
< HCI Command: LE Set Event Mask (0x08|0x0001) plen 8       #29 [hci1] 0.649019
        Mask: 0x000002023f87fa5e
          LE Advertising Report
          LE Connection Update Complete
          LE Read Remote Used Features Complete
          LE Long Term Key Request
          LE Data Length Change
          LE Enhanced Connection Complete
          LE PHY Update Complete
          LE Extended Advertising Report
          LE Periodic Advertising Sync Established
          LE Periodic Advertising Report
          LE Periodic Advertising Sync Lost
          LE Extended Scan Timeout
          LE Extended Advertising Set Terminated
          LE Scan Request Received
          LE Periodic Advertising Sync Transfer Rvc
          LE CIS Established
          LE CIS Request
          LE Create BIG Complete
          LE Terminate BIG Complete
          LE BIG Sync Estabilished Complete
          LE BIG Sync Lost
          LE BIG Info Advertising Report
          Unknown mask (0x0000020000000000)
> HCI Event: Command Complete (0x0e) plen 4                 #30 [hci1] 0.649622
      LE Set Event Mask (0x08|0x0001) ncmd 1
        Status: Success (0x00)
< HCI Command: Set Event Mask (0x03|0x0001) plen 8          #31 [hci1] 0.669041
        Mask: 0x2000800002008890
          Disconnection Complete
          Encryption Change
          Read Remote Version Information Complete
          Hardware Error
          Data Buffer Overflow
          Encryption Key Refresh Complete
          LE Meta
> HCI Event: Command Complete (0x0e) plen 4                 #32 [hci1] 0.669685
      Set Event Mask (0x03|0x0001) ncmd 1
        Status: Success (0x00)
< HCI Command: Read BD ADDR (0x04|0x0009) plen 0            #33 [hci1] 0.689038
> HCI Event: Command Complete (0x0e) plen 10                #34 [hci1] 0.689581
      Read BD ADDR (0x04|0x0009) ncmd 1
        Status: Success (0x00)
        Address: 00:00:00:00:00:00 (OUI 00-00-00)
< HCI Command: LE Set Random Address (0x08|0x0005) plen 6   #35 [hci1] 0.709034
        Address: D5:B6:CC:31:DB:3B (Static)
> HCI Event: Command Complete (0x0e) plen 4                 #36 [hci1] 0.709617
      LE Set Random Address (0x08|0x0005) ncmd 1
        Status: Success (0x00)
< HCI Command: LE Set Extended Adv.. (0x08|0x0036) plen 25  #37 [hci1] 5.029191
        Handle: 0x00
        Properties: 0x0013
          Connectable
          Scannable
          Use legacy advertising PDUs: ADV_IND
        Min advertising interval: 100.000 msec (0x00a0)
        Max advertising interval: 150.000 msec (0x00f0)
        Channel map: 37, 38, 39 (0x07)
        Own address type: Random (0x01)
        Peer address type: Public (0x00)
        Peer address: 00:00:00:00:00:00 (OUI 00-00-00)
        Filter policy: Allow Scan Request from Any, Allow Connect Request from Any (0x00)
        TX power: Host has no preference (0x7f)
        Primary PHY: LE 1M (0x01)
        Secondary max skip: 0x00
        Secondary PHY: LE 1M (0x01)
        SID: 0x00
        Scan request notifications: Disabled (0x00)
> HCI Event: Command Complete (0x0e) plen 5                 #38 [hci1] 5.029982
      LE Set Extended Advertising Parameters (0x08|0x0036) ncmd 1
        Status: Success (0x00)
        TX power (selected): 0 dbm (0x00)
< HCI Command: LE Set Advertising S.. (0x08|0x0035) plen 7  #39 [hci1] 5.049104
        Advertising handle: 0x00
        Advertising random address: D5:B6:CC:31:DB:3B (Static)
> HCI Event: Command Complete (0x0e) plen 4                 #40 [hci1] 5.049777
      LE Set Advertising Set Random Address (0x08|0x0035) ncmd 1
        Status: Success (0x00)
< HCI Command: LE Set Extended Adv.. (0x08|0x0037) plen 22  #41 [hci1] 5.069093
        Handle: 0x00
        Operation: Complete extended advertising data (0x03)
        Fragment preference: Minimize fragmentation (0x01)
        Data length: 0x12
        Flags: 0x06
          LE General Discoverable Mode
          BR/EDR Not Supported
        Name (complete): Tester_F6B11A
> HCI Event: Command Complete (0x0e) plen 4                 #42 [hci1] 5.069763
      LE Set Extended Advertising Data (0x08|0x0037) ncmd 1
        Status: Success (0x00)
< HCI Command: LE Set Extended Scan.. (0x08|0x0038) plen 4  #43 [hci1] 5.089053
        Handle: 0x00
        Operation: Complete scan response data (0x03)
        Fragment preference: Minimize fragmentation (0x01)
        Data length: 0x00
> HCI Event: Command Complete (0x0e) plen 4                 #44 [hci1] 5.089695
      LE Set Extended Scan Response Data (0x08|0x0038) ncmd 1
        Status: Success (0x00)
< HCI Command: LE Set Extended Adve.. (0x08|0x0039) plen 6  #45 [hci1] 5.109089
        Extended advertising: Enabled (0x01)
        Number of sets: 1 (0x01)
        Entry 0
          Handle: 0x00
          Duration: 0 ms (0x00)
          Max ext adv events: 0
> HCI Event: Command Complete (0x0e) plen 4                 #46 [hci1] 5.109767
      LE Set Extended Advertising Enable (0x08|0x0039) ncmd 1
        Status: Success (0x00)
> HCI Event: LE Meta Event (0x3e) plen 31                   #47 [hci1] 5.428738
      LE Enhanced Connection Complete (0x0a)
        Status: Success (0x00)
        Handle: 3333
        Role: Peripheral (0x01)
        Peer address type: Public (0x00)
        Peer address: DF:A9:FF:F6:B1:1A (OUI DF-A9-FF)
        Local resolvable private address: 00:00:00:00:00:00 (Non-Resolvable)
        Peer resolvable private address: 00:00:00:00:00:00 (Non-Resolvable)
        Connection interval: 87.50 msec (0x0046)
        Connection latency: 0 (0x0000)
        Supervision timeout: 20000 msec (0x07d0)
        Central clock accuracy: 0x01
> HCI Event: LE Meta Event (0x3e) plen 6                    #48 [hci1] 5.428896
      LE Advertising Set Terminated (0x12)
        Status: Success (0x00)
        Handle: 0
        Connection handle: 3333
        Number of completed extended advertising events: 0
< HCI Command: LE Read Remote Used... (0x08|0x0016) plen 2  #49 [hci1] 5.429289
        Handle: 3333 Address: DF:A9:FF:F6:B1:1A (OUI DF-A9-FF)
> HCI Event: Command Status (0x0f) plen 4                   #50 [hci1] 5.429806
      LE Read Remote Used Features (0x08|0x0016) ncmd 1
        Status: Success (0x00)
> HCI Event: LE Meta Event (0x3e) plen 12                   #51 [hci1] 5.605180
      LE Read Remote Used Features (0x04)
        Status: Success (0x00)
        Handle: 3333 Address: DF:A9:FF:F6:B1:1A (OUI DF-A9-FF)
        Features: 0x2d 0x49 0x00 0xf7 0x67 0xd9 0x00 0x80
          LE Encryption
          Extended Reject Indication
          Peripheral-initiated Features Exchange
          LE Data Packet Length Extension
          LE 2M PHY
          LE Coded PHY
          Channel Selection Algorithm #2
          Periodic Advertising Sync Transfer - Sender
          Periodic Advertising Sync Transfer - Recipient
          Sleep Clock Accuracy Updates
          Connected Isochronous Stream - Central
          Connected Isochronous Stream - Peripheral
          Isochronous Broadcaster
          Synchronized Receiver
          Connected Isochronous Stream (Host Support)
          LE Power Control Request
          LE Power Control Request
          Connection Subrating
          Connection Subrating (Host Support)
          Unknown features (0x8000d90000000000)
< ACL Data TX: Handle 3333 flags 0x00 dlen 16              #52 [hci1] 10.439444
      LE L2CAP: Connection Parameter Update Request (0x12) ident 1 len 8
        Min interval: 24
        Max interval: 40
        Peripheral latency: 0
        Timeout multiplier: 42
> HCI Event: Number of Completed Packets (0x13) plen 5     #53 [hci1] 10.592267
        Num handles: 1
        Handle: 3333 Address: DF:A9:FF:F6:B1:1A (OUI DF-A9-FF)
        Count: 1
        #52: len 16 (0 Kb/s)
        Latency: 152 msec (152-152 msec ~152 msec)
> ACL Data RX: Handle 3333 flags 0x02 dlen 10              #54 [hci1] 10.592577
      LE L2CAP: Connection Parameter Update Response (0x13) ident 1 len 2
        Result: Connection Parameters accepted (0x0000)
< HCI Command: Host Number of Comp.. (0x03|0x0035) plen 5  #55 [hci1] 10.609977
        Num handles: 1
        Handle: 3333 Address: DF:A9:FF:F6:B1:1A (OUI DF-A9-FF)
        Count: 1
> ACL Data RX: Handle 3333 flags 0x02 dlen 11              #56 [hci1] 13.217231
      SMP: Pairing Request (0x01) len 6
        IO capability: KeyboardDisplay (0x04)
        OOB data: Authentication data not present (0x00)
        Authentication requirement: Bonding, No MITM, SC, No Keypresses (0x09)
        Max encryption key size: 16
        Initiator key distribution: EncKey IdKey Sign (0x07)
        Responder key distribution: EncKey IdKey Sign (0x07)
< HCI Command: Host Number of Comp.. (0x03|0x0035) plen 5  #57 [hci1] 13.229807
        Num handles: 1
        Handle: 3333 Address: DF:A9:FF:F6:B1:1A (OUI DF-A9-FF)
        Count: 1
< ACL Data TX: Handle 3333 flags 0x00 dlen 11              #58 [hci1] 13.229909
      SMP: Pairing Response (0x02) len 6
        IO capability: NoInputNoOutput (0x03)
        OOB data: Authentication data not present (0x00)
        Authentication requirement: Bonding, No MITM, SC, No Keypresses (0x09)
        Max encryption key size: 16
        Initiator key distribution: IdKey (0x02)
        Responder key distribution: <none> (0x00)
> HCI Event: Number of Completed Packets (0x13) plen 5     #59 [hci1] 13.392426
        Num handles: 1
        Handle: 3333 Address: DF:A9:FF:F6:B1:1A (OUI DF-A9-FF)
        Count: 1
        #58: len 11 (0 Kb/s)
        Latency: 162 msec (152-162 msec ~157 msec)
> ACL Data RX: Handle 3333 flags 0x02 dlen 27              #60 [hci1] 13.392781
> ACL Data RX: Handle 3333 flags 0x01 dlen 27              #61 [hci1] 13.393264
> ACL Data RX: Handle 3333 flags 0x01 dlen 15              #62 [hci1] 13.393691
      SMP: Pairing Public Key (0x0c) len 64
        X: d081b84373272442ba8375a005be46a6b7e6d79ad524558156c90989994bb90a
        Y: 276db0e0446a1a6ab170bf61b203b113ee5bc06376d614f552c4a192a5c95991
< HCI Command: Host Number of Comp.. (0x03|0x0035) plen 5  #63 [hci1] 13.409963
        Num handles: 1
        Handle: 3333 Address: DF:A9:FF:F6:B1:1A (OUI DF-A9-FF)
        Count: 1
< HCI Command: Host Number of Comp.. (0x03|0x0035) plen 5  #64 [hci1] 13.410168
        Num handles: 1
        Handle: 3333 Address: DF:A9:FF:F6:B1:1A (OUI DF-A9-FF)
        Count: 1
< HCI Command: Host Number of Comp.. (0x03|0x0035) plen 5  #65 [hci1] 13.410477
        Num handles: 1
        Handle: 3333 Address: DF:A9:FF:F6:B1:1A (OUI DF-A9-FF)
        Count: 1
< ACL Data TX: Handle 3333 flags 0x00 dlen 27              #66 [hci1] 13.410560
< ACL Data TX: Handle 3333 flags 0x01 dlen 27              #67 [hci1] 13.410596
< ACL Data TX: Handle 3333 flags 0x01 dlen 15              #68 [hci1] 13.410659
      SMP: Pairing Public Key (0x0c) len 64
        X: 98308440221e2d910f0e54b71e7ec652857aa9b5a0dc65028824cc19db1226e9
        Y: 67a4816bcb62efb21701e31fdb27561a6217575fb007a8bbdabe7e28b6f68482
> HCI Event: Number of Completed Packets (0x13) plen 5     #69 [hci1] 13.480264
        Num handles: 1
        Handle: 3333 Address: DF:A9:FF:F6:B1:1A (OUI DF-A9-FF)
        Count: 1
        #66: len 27 (3 Kb/s)
        Latency: 69 msec (69-162 msec ~113 msec)
> HCI Event: Number of Completed Packets (0x13) plen 5     #70 [hci1] 13.480957
        Num handles: 1
        Handle: 3333 Address: DF:A9:FF:F6:B1:1A (OUI DF-A9-FF)
        Count: 1
        #67: len 27 (3 Kb/s)
        Latency: 70 msec (69-162 msec ~92 msec)
< ACL Data TX: Handle 3333 flags 0x00 dlen 21              #71 [hci1] 13.489220
      SMP: Pairing Confirm (0x03) len 16
        Confim value: efcdb7b8d396aafcab6b3fa02f891eed
> HCI Event: Number of Completed Packets (0x13) plen 5     #72 [hci1] 13.567140
        Num handles: 1
        Handle: 3333 Address: DF:A9:FF:F6:B1:1A (OUI DF-A9-FF)
        Count: 1
        #68: len 15 (0 Kb/s)
        Latency: 156 msec (69-162 msec ~124 msec)
> HCI Event: Number of Completed Packets (0x13) plen 5     #73 [hci1] 13.654846
        Num handles: 1
        Handle: 3333 Address: DF:A9:FF:F6:B1:1A (OUI DF-A9-FF)
        Count: 1
        #71: len 21 (1 Kb/s)
        Latency: 165 msec (69-165 msec ~144 msec)
> ACL Data RX: Handle 3333 flags 0x02 dlen 21              #74 [hci1] 13.655186
      SMP: Pairing Random (0x04) len 16
        Random value: 1f3eaadbf869e9b80000000000000000
< HCI Command: Host Number of Comp.. (0x03|0x0035) plen 5  #75 [hci1] 13.669724
        Num handles: 1
        Handle: 3333 Address: DF:A9:FF:F6:B1:1A (OUI DF-A9-FF)
        Count: 1
< ACL Data TX: Handle 3333 flags 0x00 dlen 21              #76 [hci1] 13.669786
      SMP: Pairing Random (0x04) len 16
        Random value: 8e6108f966a694cbe26df70bb96773e6
> HCI Event: Number of Completed Packets (0x13) plen 5     #77 [hci1] 13.829591
        Num handles: 1
        Handle: 3333 Address: DF:A9:FF:F6:B1:1A (OUI DF-A9-FF)
        Count: 1
        #76: len 21 (1 Kb/s)
        Latency: 159 msec (69-165 msec ~152 msec)
> ACL Data RX: Handle 3333 flags 0x02 dlen 21              #78 [hci1] 14.004917
      SMP: Pairing DHKey Check (0x0d) len 16
        E: 1936180b501360ba63a819effb6b02c9
< HCI Command: Host Number of Comp.. (0x03|0x0035) plen 5  #79 [hci1] 14.009497
        Num handles: 1
        Handle: 3333 Address: DF:A9:FF:F6:B1:1A (OUI DF-A9-FF)
        Count: 1
< ACL Data TX: Handle 3333 flags 0x00 dlen 21              #80 [hci1] 14.009543
      SMP: Pairing DHKey Check (0x0d) len 16
        E: 4449355fc961771bf5d564d726eaa5f2
> HCI Event: Number of Completed Packets (0x13) plen 5     #81 [hci1] 14.179618
        Num handles: 1
        Handle: 3333 Address: DF:A9:FF:F6:B1:1A (OUI DF-A9-FF)
        Count: 1
        #80: len 21 (0 Kb/s)
        Latency: 170 msec (69-170 msec ~161 msec)
> HCI Event: LE Meta Event (0x3e) plen 13                  #82 [hci1] 14.267750
      LE Long Term Key Request (0x05)
        Handle: 3333 Address: DF:A9:FF:F6:B1:1A (OUI DF-A9-FF)
        Random number: 0x0000000000000000
        Encrypted diversifier: 0x0000
< HCI Command: LE Long Term Key R.. (0x08|0x001a) plen 18  #83 [hci1] 14.269620
        Handle: 3333 Address: DF:A9:FF:F6:B1:1A (OUI DF-A9-FF)
        Long term key: acee450979f8d945981255e3438c10bc
> HCI Event: Command Complete (0x0e) plen 6                #84 [hci1] 14.270383
      LE Long Term Key Request Reply (0x08|0x001a) ncmd 1
        Status: Success (0x00)
        Handle: 3333 Address: DF:A9:FF:F6:B1:1A (OUI DF-A9-FF)
> HCI Event: Encryption Change (0x08) plen 4               #85 [hci1] 14.704931
        Status: Success (0x00)
        Handle: 3333 Address: DF:A9:FF:F6:B1:1A (OUI DF-A9-FF)
        Encryption: Enabled with AES-CCM (0x01)
> ACL Data RX: Handle 3333 flags 0x02 dlen 21              #86 [hci1] 14.792398
      SMP: Identity Information (0x08) len 16
        Identity resolving key: bb1ae7b1f3ba6a3a5db1302ef3da33ea
< HCI Command: Host Number of Comp.. (0x03|0x0035) plen 5  #87 [hci1] 14.820007
        Num handles: 1
        Handle: 3333 Address: DF:A9:FF:F6:B1:1A (OUI DF-A9-FF)
        Count: 1
> ACL Data RX: Handle 3333 flags 0x02 dlen 12              #88 [hci1] 14.880009
      SMP: Identity Address Information (0x09) len 7
        Address: DF:A9:FF:F6:B1:1A (OUI DF-A9-FF)
> ACL Data RX: Handle 3333 flags 0x02 dlen 26              #89 [hci1] 14.880593
      LE L2CAP: Enhanced Credit Connection Request (0x17) ident 1 len 18
        PSM: 39 (0x0027)
        MTU: 64
        MPS: 64
        Credits: 5
        Source CID: 84
        Source CID: 83
        Source CID: 82
        Source CID: 81
        Source CID: 80
< HCI Command: LE Add Device To R.. (0x08|0x0027) plen 39  #90 [hci1] 14.889866
        Address type: Public (0x00)
        Address: DF:A9:FF:F6:B1:1A (OUI DF-A9-FF)
        Peer identity resolving key: bb1ae7b1f3ba6a3a5db1302ef3da33ea
        Local identity resolving key: 00000000000000000000000000000000
> HCI Event: Command Complete (0x0e) plen 4                #91 [hci1] 14.890965
      LE Add Device To Resolving List (0x08|0x0027) ncmd 1
        Status: Success (0x00)
< HCI Command: LE Set Privacy Mode (0x08|0x004e) plen 8    #92 [hci1] 14.909662
        Peer Identity address type: Public (0x00)
        Peer Identity address: DF:A9:FF:F6:B1:1A (OUI DF-A9-FF)
        Privacy Mode: Use Device Privacy (0x01)
> HCI Event: Command Complete (0x0e) plen 4                #93 [hci1] 14.910181
      LE Set Privacy Mode (0x08|0x004e) ncmd 1
        Status: Success (0x00)
< HCI Command: LE Set Address Reso.. (0x08|0x002d) plen 1  #94 [hci1] 14.929572
        Address resolution: Enabled (0x01)
> HCI Event: Command Complete (0x0e) plen 4                #95 [hci1] 14.930067
      LE Set Address Resolution Enable (0x08|0x002d) ncmd 1
        Status: Success (0x00)
< HCI Command: Host Number of Comp.. (0x03|0x0035) plen 5  #96 [hci1] 14.949513
        Num handles: 1
        Handle: 3333 Address: DF:A9:FF:F6:B1:1A (OUI DF-A9-FF)
        Count: 1
< HCI Command: Host Number of Comp.. (0x03|0x0035) plen 5  #97 [hci1] 14.950044
        Num handles: 1
        Handle: 3333 Address: DF:A9:FF:F6:B1:1A (OUI DF-A9-FF)
        Count: 1
< ACL Data TX: Handle 3333 flags 0x00 dlen 26              #98 [hci1] 14.950196
      LE L2CAP: Enhanced Credit Connection Response (0x18) ident 1 len 18
        MTU: 249
        MPS: 251
        Credits: 1
        Result: Connection successful (0x0000)
        Destination CID: 64
        Destination CID: 65
        Destination CID: 66
        Destination CID: 67
        Destination CID: 68
> HCI Event: Number of Completed Packets (0x13) plen 5     #99 [hci1] 15.054556
        Num handles: 1
        Handle: 3333 Address: DF:A9:FF:F6:B1:1A (OUI DF-A9-FF)
        Count: 1
        #98: len 26 (2 Kb/s)
        Latency: 104 msec (69-170 msec ~132 msec)
< ACL Data TX: Handle 3333 flags 0x00 dlen 27             #100 [hci1] 17.499457
< ACL Data TX: Handle 3333 flags 0x01 dlen 27             #101 [hci1] 17.499466
< ACL Data TX: Handle 3333 flags 0x01 dlen 14             #102 [hci1] 17.499467
      Channel: 80 len 64 sdu 64 [PSM 39 mode Enhanced Credit (0x81)] {chan 4}
      ATT: Prepare Write Request (0x16) len 61
        Handle: 0x01ad
        Offset: 0x00bd
          Data: 121212121212121212121212121212121212121212121212121212121212121212121212121212121212121212121212121212121212121212
> HCI Event: Number of Completed Packets (0x13) plen 5    #103 [hci1] 17.505169
        Num handles: 1
        Handle: 3333 Address: DF:A9:FF:F6:B1:1A (OUI DF-A9-FF)
        Count: 1
        #100: len 27 (43 Kb/s)
        Latency: 5 msec (5-170 msec ~69 msec)
        Channel: 80 [PSM 39 mode Enhanced Credit (0x81)] {chan 4}
        Channel Latency: 5 msec (5-5 msec ~5 msec)
> HCI Event: Number of Completed Packets (0x13) plen 5    #104 [hci1] 17.505845
        Num handles: 1
        Handle: 3333 Address: DF:A9:FF:F6:B1:1A (OUI DF-A9-FF)
        Count: 1
        #101: len 27 (36 Kb/s)
        Latency: 6 msec (5-170 msec ~37 msec)
        Channel: 80 [PSM 39 mode Enhanced Credit (0x81)] {chan 4}
        Channel Latency: 6 msec (5-6 msec ~6 msec)
< ACL Data TX: Handle 3333 flags 0x00 dlen 6              #105 [hci1] 17.509247
      Channel: 80 len 2 sdu 2 [PSM 39 mode Enhanced Credit (0x81)] {chan 4}
        malformed attribute packet
> HCI Event: Number of Completed Packets (0x13) plen 5    #106 [hci1] 17.592131
        Num handles: 1
        Handle: 3333 Address: DF:A9:FF:F6:B1:1A (OUI DF-A9-FF)
        Count: 1
        #102: len 14 (1 Kb/s)
        Latency: 92 msec (5-170 msec ~65 msec)
        Channel: 80 [PSM 39 mode Enhanced Credit (0x81)] {chan 4}
        Channel Latency: 92 msec (5-92 msec ~49 msec)
> HCI Event: Number of Completed Packets (0x13) plen 5    #107 [hci1] 17.679827
        Num handles: 1
        Handle: 3333 Address: DF:A9:FF:F6:B1:1A (OUI DF-A9-FF)
        Count: 1
        #105: len 6 (0 Kb/s)
        Latency: 170 msec (5-170 msec ~117 msec)
> ACL Data RX: Handle 3333 flags 0x02 dlen 27             #108 [hci1] 17.680238
> ACL Data RX: Handle 3333 flags 0x01 dlen 27             #109 [hci1] 17.680689
> ACL Data RX: Handle 3333 flags 0x01 dlen 16             #110 [hci1] 17.681348
      Channel: 68 len 66 sdu 64 [PSM 39 mode Enhanced Credit (0x81)] {chan 4}
      ATT: Prepare Write Response (0x17) len 63
        Handle: 0x01ad
        Offset: 0x00bd
          Data: 1212121212121212121212121212121212121212121212121212121212121212121212121212121212121212121212121212121212121212121212
< HCI Command: Host Number of Com.. (0x03|0x0035) plen 5  #111 [hci1] 17.689327
        Num handles: 1
        Handle: 3333 Address: DF:A9:FF:F6:B1:1A (OUI DF-A9-FF)
        Count: 1
< HCI Command: Host Number of Com.. (0x03|0x0035) plen 5  #112 [hci1] 17.689333
        Num handles: 1
        Handle: 3333 Address: DF:A9:FF:F6:B1:1A (OUI DF-A9-FF)
        Count: 1
< HCI Command: Host Number of Com.. (0x03|0x0035) plen 5  #113 [hci1] 17.689362
        Num handles: 1
        Handle: 3333 Address: DF:A9:FF:F6:B1:1A (OUI DF-A9-FF)
        Count: 1
< ACL Data TX: Handle 3333 flags 0x00 dlen 27             #114 [hci1] 17.689389
< ACL Data TX: Handle 3333 flags 0x01 dlen 27             #115 [hci1] 17.689391
< ACL Data TX: Handle 3333 flags 0x01 dlen 14             #116 [hci1] 17.689401
      Channel: 80 len 64 sdu 64 [PSM 39 mode Enhanced Credit (0x81)] {chan 4}
      ATT: Prepare Write Request (0x16) len 61
        Handle: 0x01ad
        Offset: 0x00f8
          Data: 121212121212121212121212121212121212121212121212121212121212121212121212121212121212121212121212121212121212121212
> HCI Event: Number of Completed Packets (0x13) plen 5    #117 [hci1] 17.767774
        Num handles: 1
        Handle: 3333 Address: DF:A9:FF:F6:B1:1A (OUI DF-A9-FF)
        Count: 1
        #114: len 27 (2 Kb/s)
        Latency: 78 msec (5-170 msec ~98 msec)
        Channel: 80 [PSM 39 mode Enhanced Credit (0x81)] {chan 4}
        Channel Latency: 78 msec (5-92 msec ~63 msec)
> HCI Event: Number of Completed Packets (0x13) plen 5    #118 [hci1] 17.768424
        Num handles: 1
        Handle: 3333 Address: DF:A9:FF:F6:B1:1A (OUI DF-A9-FF)
        Count: 1
        #115: len 27 (2 Kb/s)
        Latency: 79 msec (5-170 msec ~88 msec)
        Channel: 80 [PSM 39 mode Enhanced Credit (0x81)] {chan 4}
        Channel Latency: 79 msec (5-92 msec ~71 msec)
< ACL Data TX: Handle 3333 flags 0x00 dlen 12             #119 [hci1] 17.769233
      LE L2CAP: LE Flow Control Credit (0x16) ident 2 len 4
        Source CID: 68
        Credits: 1
< ACL Data TX: Handle 3333 flags 0x00 dlen 6              #120 [hci1] 17.769238
      Channel: 80 len 2 sdu 2 [PSM 39 mode Enhanced Credit (0x81)] {chan 4}
        malformed attribute packet
> HCI Event: Number of Completed Packets (0x13) plen 5    #121 [hci1] 17.854539
        Num handles: 1
        Handle: 3333 Address: DF:A9:FF:F6:B1:1A (OUI DF-A9-FF)
        Count: 1
        #116: len 14 (0 Kb/s)
        Latency: 165 msec (5-170 msec ~126 msec)
> HCI Event: Number of Completed Packets (0x13) plen 5    #122 [hci1] 17.855073
        Num handles: 1
        Handle: 3333 Address: DF:A9:FF:F6:B1:1A (OUI DF-A9-FF)
        Count: 1
        #119: len 12 (1 Kb/s)
        Latency: 85 msec (5-170 msec ~106 msec)
        Channel: 80 [PSM 39 mode Enhanced Credit (0x81)] {chan 4}
        Channel Latency: 85 msec (5-92 msec ~78 msec)
> HCI Event: Number of Completed Packets (0x13) plen 5    #123 [hci1] 17.942227
        Num handles: 1
        Handle: 3333 Address: DF:A9:FF:F6:B1:1A (OUI DF-A9-FF)
        Count: 1
        #120: len 6 (0 Kb/s)
        Latency: 172 msec (5-172 msec ~139 msec)
> ACL Data RX: Handle 3333 flags 0x02 dlen 12             #124 [hci1] 17.942357
      LE L2CAP: LE Flow Control Credit (0x16) ident 2 len 4
        Source CID: 80
        Credits: 10
> ACL Data RX: Handle 3333 flags 0x02 dlen 27             #125 [hci1] 17.943103
> ACL Data RX: Handle 3333 flags 0x01 dlen 27             #126 [hci1] 17.943810
> ACL Data RX: Handle 3333 flags 0x01 dlen 16             #127 [hci1] 17.944306
      Channel: 68 len 66 sdu 64 [PSM 39 mode Enhanced Credit (0x81)] {chan 4}
      ATT: Prepare Write Response (0x17) len 63
        Handle: 0x01ad
        Offset: 0x00f8
          Data: 1212121212121212121212121212121212121212121212121212121212121212121212121212121212121212121212121212121212121212121212
< HCI Command: Host Number of Com.. (0x03|0x0035) plen 5  #128 [hci1] 17.949299
        Num handles: 1
        Handle: 3333 Address: DF:A9:FF:F6:B1:1A (OUI DF-A9-FF)
        Count: 1
< HCI Command: Host Number of Com.. (0x03|0x0035) plen 5  #129 [hci1] 17.949531
        Num handles: 1
        Handle: 3333 Address: DF:A9:FF:F6:B1:1A (OUI DF-A9-FF)
        Count: 1
< HCI Command: Host Number of Com.. (0x03|0x0035) plen 5  #130 [hci1] 17.949654
        Num handles: 1
        Handle: 3333 Address: DF:A9:FF:F6:B1:1A (OUI DF-A9-FF)
        Count: 1
< HCI Command: Host Number of Com.. (0x03|0x0035) plen 5  #131 [hci1] 17.949679
        Num handles: 1
        Handle: 3333 Address: DF:A9:FF:F6:B1:1A (OUI DF-A9-FF)
        Count: 1
< ACL Data TX: Handle 3333 flags 0x00 dlen 27             #132 [hci1] 17.949746
< ACL Data TX: Handle 3333 flags 0x01 dlen 27             #133 [hci1] 17.949748
< ACL Data TX: Handle 3333 flags 0x01 dlen 14             #134 [hci1] 17.949749
      Channel: 80 len 64 sdu 64 [PSM 39 mode Enhanced Credit (0x81)] {chan 4}
      ATT: Prepare Write Request (0x16) len 61
        Handle: 0x01ad
        Offset: 0x0133
          Data: 121212121212121212121212121212121212121212121212121212121212121212121212121212121212121212121212121212121212121212
> HCI Event: Number of Completed Packets (0x13) plen 5    #135 [hci1] 18.030290
        Num handles: 1
        Handle: 3333 Address: DF:A9:FF:F6:B1:1A (OUI DF-A9-FF)
        Count: 1
        #132: len 27 (2 Kb/s)
        Latency: 80 msec (5-172 msec ~110 msec)
        Channel: 80 [PSM 39 mode Enhanced Credit (0x81)] {chan 4}
        Channel Latency: 80 msec (5-92 msec ~79 msec)
> HCI Event: Number of Completed Packets (0x13) plen 5    #136 [hci1] 18.030945
        Num handles: 1
        Handle: 3333 Address: DF:A9:FF:F6:B1:1A (OUI DF-A9-FF)
        Count: 1
        #133: len 27 (2 Kb/s)
        Latency: 81 msec (5-172 msec ~95 msec)
        Channel: 80 [PSM 39 mode Enhanced Credit (0x81)] {chan 4}
        Channel Latency: 81 msec (5-92 msec ~80 msec)
< ACL Data TX: Handle 3333 flags 0x00 dlen 12             #137 [hci1] 18.049243
      LE L2CAP: LE Flow Control Credit (0x16) ident 3 len 4
        Source CID: 68
        Credits: 1
< ACL Data TX: Handle 3333 flags 0x00 dlen 6              #138 [hci1] 18.049248
      Channel: 80 len 2 sdu 2 [PSM 39 mode Enhanced Credit (0x81)] {chan 4}
        malformed attribute packet
> HCI Event: Number of Completed Packets (0x13) plen 5    #139 [hci1] 18.117111
        Num handles: 1
        Handle: 3333 Address: DF:A9:FF:F6:B1:1A (OUI DF-A9-FF)
        Count: 1
        #134: len 14 (0 Kb/s)
        Latency: 167 msec (5-172 msec ~131 msec)
> HCI Event: Number of Completed Packets (0x13) plen 5    #140 [hci1] 18.117645
        Num handles: 1
        Handle: 3333 Address: DF:A9:FF:F6:B1:1A (OUI DF-A9-FF)
        Count: 1
        #137: len 12 (1 Kb/s)
        Latency: 68 msec (5-172 msec ~99 msec)
        Channel: 80 [PSM 39 mode Enhanced Credit (0x81)] {chan 4}
        Channel Latency: 68 msec (5-92 msec ~74 msec)
> HCI Event: Number of Completed Packets (0x13) plen 5    #141 [hci1] 18.204774
        Num handles: 1
        Handle: 3333 Address: DF:A9:FF:F6:B1:1A (OUI DF-A9-FF)
        Count: 1
        #138: len 6 (0 Kb/s)
        Latency: 155 msec (5-172 msec ~127 msec)
> ACL Data RX: Handle 3333 flags 0x02 dlen 27             #142 [hci1] 18.205225
> ACL Data RX: Handle 3333 flags 0x01 dlen 27             #143 [hci1] 18.205716
> ACL Data RX: Handle 3333 flags 0x01 dlen 16             #144 [hci1] 18.206159
      Channel: 68 len 66 sdu 64 [PSM 39 mode Enhanced Credit (0x81)] {chan 4}
      ATT: Prepare Write Response (0x17) len 63
        Handle: 0x01ad
        Offset: 0x0133
          Data: 1212121212121212121212121212121212121212121212121212121212121212121212121212121212121212121212121212121212121212121212
< HCI Command: Host Number of Com.. (0x03|0x0035) plen 5  #145 [hci1] 18.209368
        Num handles: 1
        Handle: 3333 Address: DF:A9:FF:F6:B1:1A (OUI DF-A9-FF)
        Count: 1
< HCI Command: Host Number of Com.. (0x03|0x0035) plen 5  #146 [hci1] 18.209393
        Num handles: 1
        Handle: 3333 Address: DF:A9:FF:F6:B1:1A (OUI DF-A9-FF)
        Count: 1
< HCI Command: Host Number of Com.. (0x03|0x0035) plen 5  #147 [hci1] 18.209516
        Num handles: 1
        Handle: 3333 Address: DF:A9:FF:F6:B1:1A (OUI DF-A9-FF)
        Count: 1
< ACL Data TX: Handle 3333 flags 0x00 dlen 24             #148 [hci1] 18.209583
      Channel: 80 len 20 sdu 18 [PSM 39 mode Enhanced Credit (0x81)] {chan 4}
      ATT: Prepare Write Request (0x16) len 17
        Handle: 0x01ad
        Offset: 0x016e
          Data: 12121212121212121212121212
< ACL Data TX: Handle 3333 flags 0x00 dlen 12             #149 [hci1] 18.209665
      LE L2CAP: LE Flow Control Credit (0x16) ident 4 len 4
        Source CID: 68
        Credits: 1
> HCI Event: Number of Completed Packets (0x13) plen 5    #150 [hci1] 18.292770
        Num handles: 1
        Handle: 3333 Address: DF:A9:FF:F6:B1:1A (OUI DF-A9-FF)
        Count: 1
        #148: len 24 (2 Kb/s)
        Latency: 83 msec (5-172 msec ~105 msec)
        Channel: 80 [PSM 39 mode Enhanced Credit (0x81)] {chan 4}
        Channel Latency: 83 msec (5-92 msec ~78 msec)
> HCI Event: Number of Completed Packets (0x13) plen 5    #151 [hci1] 18.379827
        Num handles: 1
        Handle: 3333 Address: DF:A9:FF:F6:B1:1A (OUI DF-A9-FF)
        Count: 1
        #149: len 12 (0 Kb/s)
        Latency: 170 msec (5-172 msec ~137 msec)
        Channel: 80 [PSM 39 mode Enhanced Credit (0x81)] {chan 4}
        Channel Latency: 170 msec (5-170 msec ~124 msec)
> ACL Data RX: Handle 3333 flags 0x02 dlen 24             #152 [hci1] 18.380133
      Channel: 68 len 20 sdu 18 [PSM 39 mode Enhanced Credit (0x81)] {chan 4}
      ATT: Prepare Write Response (0x17) len 17
        Handle: 0x01ad
        Offset: 0x016e
          Data: 12121212121212121212121212
< HCI Command: Host Number of Com.. (0x03|0x0035) plen 5  #153 [hci1] 18.389369
        Num handles: 1
        Handle: 3333 Address: DF:A9:FF:F6:B1:1A (OUI DF-A9-FF)
        Count: 1
< ACL Data TX: Handle 3333 flags 0x00 dlen 8              #154 [hci1] 18.389423
      Channel: 80 len 4 sdu 2 [PSM 39 mode Enhanced Credit (0x81)] {chan 4}
      ATT: Execute Write Request (0x18) len 1
        Flags: Immediately write all pending values (0x01)
< ACL Data TX: Handle 3333 flags 0x00 dlen 12             #155 [hci1] 18.389587
      LE L2CAP: LE Flow Control Credit (0x16) ident 5 len 4
        Source CID: 68
        Credits: 1
> HCI Event: Number of Completed Packets (0x13) plen 5    #156 [hci1] 18.467498
        Num handles: 1
        Handle: 3333 Address: DF:A9:FF:F6:B1:1A (OUI DF-A9-FF)
        Count: 1
        #154: len 8 (0 Kb/s)
        Latency: 78 msec (5-172 msec ~107 msec)
> HCI Event: Number of Completed Packets (0x13) plen 5    #157 [hci1] 18.554754
        Num handles: 1
        Handle: 3333 Address: DF:A9:FF:F6:B1:1A (OUI DF-A9-FF)
        Count: 1
        #155: len 12 (0 Kb/s)
        Latency: 165 msec (5-172 msec ~136 msec)
        Channel: 80 [PSM 39 mode Enhanced Credit (0x81)] {chan 4}
        Channel Latency: 165 msec (5-170 msec ~144 msec)
> ACL Data RX: Handle 3333 flags 0x02 dlen 11             #158 [hci1] 18.554990
      Channel: 68 len 7 sdu 5 [PSM 39 mode Enhanced Credit (0x81)] {chan 4}
      ATT: Error Response (0x01) len 4
        Execute Write Request (0x18)
        Handle: 0x01ad
        Error: Invalid Offset (0x07)
< HCI Command: Host Number of Com.. (0x03|0x0035) plen 5  #159 [hci1] 18.569399
        Num handles: 1
        Handle: 3333 Address: DF:A9:FF:F6:B1:1A (OUI DF-A9-FF)
        Count: 1
< ACL Data TX: Handle 3333 flags 0x00 dlen 12             #160 [hci1] 18.569411
      LE L2CAP: LE Flow Control Credit (0x16) ident 6 len 4
        Source CID: 68
        Credits: 1
> HCI Event: Number of Completed Packets (0x13) plen 5    #161 [hci1] 18.729425
        Num handles: 1
        Handle: 3333 Address: DF:A9:FF:F6:B1:1A (OUI DF-A9-FF)
        Count: 1
        #160: len 12 (0 Kb/s)
        Latency: 160 msec (5-172 msec ~148 msec)
        Channel: 80 [PSM 39 mode Enhanced Credit (0x81)] {chan 4}
        Channel Latency: 160 msec (5-170 msec ~152 msec)
> HCI Event: Disconnect Complete (0x05) plen 4            #162 [hci1] 22.142268
        Status: Success (0x00)
        Handle: 3333 Address: DF:A9:FF:F6:B1:1A (OUI DF-A9-FF)
        Reason: Remote User Terminated Connection (0x13)
< HCI Command: Reset (0x03|0x0003) plen 0                 #163 [hci1] 27.359564
> HCI Event: Command Complete (0x0e) plen 4               #164 [hci1] 27.360100
      Reset (0x03|0x0003) ncmd 1
        Status: Success (0x00)
@ USER Close: main                                    {0x0001} [hci1] 27.369473
= Close Index: 00:00:00:00:00:00                               [hci1] 27.369497
