Bluetooth monitor ver 5.72
= Note: Linux version 6.14.0-36-generic (x86_64)                       0.525852
= Note: Bluetooth subsystem version 2.22                               0.525853
= New Index: 00:00:00:00:00:00 (Primary,UART,hci1)              [hci1] 0.525855
= New Index: 48:5F:99:8E:E0:64 (Primary,USB,hci0)               [hci0] 0.525856
= Open Index: 00:00:00:00:00:00                                 [hci1] 1.039060
= Index Info: 00:00:00:00:00:00 (Nordic Semiconductor ASA)      [hci1] 1.039067
@ USER Open: main (privileged) version 2.22            {0x0001} [hci1] 1.039070
< HCI Command: Reset (0x03|0x0003) plen 0                    #1 [hci1] 1.039313
> HCI Event: Command Complete (0x0e) plen 4                  #2 [hci1] 1.039825
      Reset (0x03|0x0003) ncmd 1
        Status: Success (0x00)
< HCI Command: Read Local Supported... (0x04|0x0003) plen 0  #3 [hci1] 1.058949
> HCI Event: Command Complete (0x0e) plen 12                 #4 [hci1] 1.059465
      Read Local Supported Features (0x04|0x0003) ncmd 1
        Status: Success (0x00)
        Features: 0x00 0x00 0x00 0x00 0x60 0x00 0x00 0x00
          BR/EDR Not Supported
          LE Supported (Controller)
< HCI Command: Read Local Version In.. (0x04|0x0001) plen 0  #5 [hci1] 1.079013
> HCI Event: Command Complete (0x0e) plen 12                 #6 [hci1] 1.079560
      Read Local Version Information (0x04|0x0001) ncmd 1
        Status: Success (0x00)
        HCI version: Reserved (0x0f) - Revision 12393 (0x3069)
        LMP version: Reserved (0x0f) - Subversion 12393 (0x3069)
        Manufacturer: Nordic Semiconductor ASA (89)
< HCI Command: Read Local Supported... (0x04|0x0002) plen 0  #7 [hci1] 1.099015
> HCI Event: Command Complete (0x0e) plen 68                 #8 [hci1] 1.100099
      Read Local Supported Commands (0x04|0x0002) ncmd 1
        Status: Success (0x00)
        Commands: 119 entries
          Disconnect (Octet 0 - Bit 5)
          Read Remote Version Information (Octet 2 - Bit 7)
          Set Event Mask (Octet 5 - Bit 6)
          Reset (Octet 5 - Bit 7)
          Read Connection Accept Timeout (Octet 7 - Bit 2)
          Write Connection Accept Timeout (Octet 7 - Bit 3)
          Read Transmit Power Level (Octet 10 - Bit 2)
          Set Controller To Host Flow Control (Octet 10 - Bit 5)
          Host Buffer Size (Octet 10 - Bit 6)
          Host Number of Completed Packets (Octet 10 - Bit 7)
          Read Local Version Information (Octet 14 - Bit 3)
          Read Local Supported Features (Octet 14 - Bit 5)
          Read BD ADDR (Octet 15 - Bit 1)
          Read RSSI (Octet 15 - Bit 5)
          Set Event Mask Page 2 (Octet 22 - Bit 2)
          LE Set Event Mask (Octet 25 - Bit 0)
          LE Read Buffer Size (Octet 25 - Bit 1)
          LE Read Local Supported Features (Octet 25 - Bit 2)
          LE Set Random Address (Octet 25 - Bit 4)
          LE Set Advertising Parameters (Octet 25 - Bit 5)
          LE Read Advertising Channel TX Power (Octet 25 - Bit 6)
          LE Set Advertising Data (Octet 25 - Bit 7)
          LE Set Scan Response Data (Octet 26 - Bit 0)
          LE Set Advertise Enable (Octet 26 - Bit 1)
          LE Set Scan Parameters (Octet 26 - Bit 2)
          LE Set Scan Enable (Octet 26 - Bit 3)
          LE Create Connection (Octet 26 - Bit 4)
          LE Create Connection Cancel (Octet 26 - Bit 5)
          LE Read Accept List Size (Octet 26 - Bit 6)
          LE Clear Accept List (Octet 26 - Bit 7)
          LE Add Device To Accept List (Octet 27 - Bit 0)
          LE Remove Device From Accept List (Octet 27 - Bit 1)
          LE Connection Update (Octet 27 - Bit 2)
          LE Set Host Channel Classification (Octet 27 - Bit 3)
          LE Read Channel Map (Octet 27 - Bit 4)
          LE Read Remote Used Features (Octet 27 - Bit 5)
          LE Encrypt (Octet 27 - Bit 6)
          LE Rand (Octet 27 - Bit 7)
          LE Start Encryption (Octet 28 - Bit 0)
          LE Long Term Key Request Reply (Octet 28 - Bit 1)
          LE Long Term Key Request Neg Reply (Octet 28 - Bit 2)
          LE Read Supported States (Octet 28 - Bit 3)
          LE Receiver Test (Octet 28 - Bit 4)
          LE Transmitter Test (Octet 28 - Bit 5)
          LE Test End (Octet 28 - Bit 6)
          Read Authenticated Payload Timeout (Octet 32 - Bit 4)
          Write Authenticated Payload Timeout (Octet 32 - Bit 5)
          LE Set Data Length (Octet 33 - Bit 6)
          LE Read Suggested Default Data Length (Octet 33 - Bit 7)
          LE Write Suggested Default Data Length (Octet 34 - Bit 0)
          LE Add Device To Resolving List (Octet 34 - Bit 3)
          LE Remove Device From Resolving List (Octet 34 - Bit 4)
          LE Clear Resolving List (Octet 34 - Bit 5)
          LE Read Resolving List Size (Octet 34 - Bit 6)
          LE Set Address Resolution Enable (Octet 35 - Bit 1)
          LE Set Resolvable Private Address Timeout (Octet 35 - Bit 2)
          LE Read Maximum Data Length (Octet 35 - Bit 3)
          LE Read PHY (Octet 35 - Bit 4)
          LE Set Default PHY (Octet 35 - Bit 5)
          LE Set PHY (Octet 35 - Bit 6)
          LE Enhanced Receiver Test (Octet 35 - Bit 7)
          LE Enhanced Transmitter Test (Octet 36 - Bit 0)
          LE Set Advertising Set Random Address (Octet 36 - Bit 1)
          LE Set Extended Advertising Parameters (Octet 36 - Bit 2)
          LE Set Extended Advertising Data (Octet 36 - Bit 3)
          LE Set Extended Scan Response Data (Octet 36 - Bit 4)
          LE Set Extended Advertising Enable (Octet 36 - Bit 5)
          LE Read Maximum Advertising Data Length (Octet 36 - Bit 6)
          LE Read Number of Supported Advertising Sets (Octet 36 - Bit 7)
          LE Remove Advertising Set (Octet 37 - Bit 0)
          LE Clear Advertising Sets (Octet 37 - Bit 1)
          LE Set Periodic Advertising Parameters (Octet 37 - Bit 2)
          LE Set Periodic Advertising Data (Octet 37 - Bit 3)
          LE Set Periodic Advertising Enable (Octet 37 - Bit 4)
          LE Set Extended Scan Parameters (Octet 37 - Bit 5)
          LE Set Extended Scan Enable (Octet 37 - Bit 6)
          LE Extended Create Connection (Octet 37 - Bit 7)
          LE Periodic Advertising Create Sync (Octet 38 - Bit 0)
          LE Periodic Advertising Create Sync Cancel (Octet 38 - Bit 1)
          LE Periodic Advertising Terminate Sync (Octet 38 - Bit 2)
          LE Add Device To Periodic Advertiser List (Octet 38 - Bit 3)
          LE Remove Device From Periodic Advertiser List (Octet 38 - Bit 4)
          LE Clear Periodic Advertiser List (Octet 38 - Bit 5)
          LE Read Periodic Advertiser List Size (Octet 38 - Bit 6)
          LE Read Transmit Power (Octet 38 - Bit 7)
          LE Read RF Path Compensation (Octet 39 - Bit 0)
          LE Write RF Path Compensation (Octet 39 - Bit 1)
          LE Set Privacy Mode (Octet 39 - Bit 2)
          LE Periodic Advertising Receive Enable (Octet 40 - Bit 5)
          LE Periodic Advertising Sync Transfer (Octet 40 - Bit 6)
          LE Periodic Advertising Set Info Transfer (Octet 40 - Bit 7)
          LE Periodic Advertising Sync Transfer Parameters (Octet 41 - Bit 0)
          LE Set Default Periodic Advertisng Sync Transfer Parameters (Octet 41 - Bit 1)
          LE Read Buffer v2 (Octet 41 - Bit 5)
          LE Read ISO TX Sync (Octet 41 - Bit 6)
          LE Set Connected Isochronous Group Parameters (Octet 41 - Bit 7)
          LE Set Connected Isochronous Group Parameters Test (Octet 42 - Bit 0)
          LE Create Connected Isochronous Stream (Octet 42 - Bit 1)
          LE Remove Connected Isochronous Group (Octet 42 - Bit 2)
          LE Accept Connected Isochronous Stream Request (Octet 42 - Bit 3)
          LE Reject Connected Isochronous Stream Request (Octet 42 - Bit 4)
          LE Create Broadcast Isochronous Group (Octet 42 - Bit 5)
          LE Create Broadcast Isochronous Group Test (Octet 42 - Bit 6)
          LE Terminate Broadcast Isochronous Group (Octet 42 - Bit 7)
          LE Broadcast Isochronous Group Create Sync (Octet 43 - Bit 0)
          LE Broadcast Isochronous Group Terminate Sync (Octet 43 - Bit 1)
          LE Request Peer SCA (Octet 43 - Bit 2)
          LE Setup Isochronous Data Path (Octet 43 - Bit 3)
          LE Remove Isochronous Data Path (Octet 43 - Bit 4)
          LE Isochronous Transmit Test (Octet 43 - Bit 5)
          LE Isochronous Receive Test (Octet 43 - Bit 6)
          LE Isochronous Read Test Counters (Octet 43 - Bit 7)
          LE Isochronous Read Test Counters (Octet 44 - Bit 0)
          LE Set Host Feature (Octet 44 - Bit 1)
          Octet 44 - Bit 2 
          Octet 45 - Bit 6 
          Octet 46 - Bit 0 
          Octet 46 - Bit 1 
          Octet 46 - Bit 2 
< HCI Command: Host Buffer Size (0x03|0x0033) plen 7         #9 [hci1] 1.118988
        ACL MTU: 255  ACL max packet: 16
        SCO MTU: 0    SCO max packet: 0
> HCI Event: Command Complete (0x0e) plen 4                 #10 [hci1] 1.119419
      Host Buffer Size (0x03|0x0033) ncmd 1
        Status: Success (0x00)
< HCI Command: Set Controller To Ho.. (0x03|0x0031) plen 1  #11 [hci1] 1.139017
        Flow control: ACL Data Packets (0x01)
> HCI Event: Command Complete (0x0e) plen 4                 #12 [hci1] 1.139458
      Set Controller To Host Flow Control (0x03|0x0031) ncmd 1
        Status: Success (0x00)
< HCI Command: LE Read Local Suppor.. (0x08|0x0003) plen 0  #13 [hci1] 1.158932
> HCI Event: Command Complete (0x0e) plen 12                #14 [hci1] 1.159414
      LE Read Local Supported Features (0x08|0x0003) ncmd 1
        Status: Success (0x00)
        Features: 0xfd 0x79 0x00 0xf7 0x30 0x01 0x00 0x00
          LE Encryption
          Extended Reject Indication
          Peripheral-initiated Features Exchange
          LE Ping
          LE Data Packet Length Extension
          LL Privacy
          Extended Scanner Filter Policies
          LE 2M PHY
          LE Coded PHY
          LE Extended Advertising
          LE Periodic Advertising
          Channel Selection Algorithm #2
          Periodic Advertising Sync Transfer - Sender
          Periodic Advertising Sync Transfer - Recipient
          Sleep Clock Accuracy Updates
          Connected Isochronous Stream - Central
          Connected Isochronous Stream - Peripheral
          Isochronous Broadcaster
          Synchronized Receiver
          Periodic Advertising ADI support
          Connection Subrating
          Unknown features (0x0000010000000000)
< HCI Command: LE Set Host Feature (0x08|0x0074) plen 2     #15 [hci1] 1.178987
        Bit Number: 32
          Connected Isochronous Stream (Host Support)
        Bit Value: 1
> HCI Event: Command Complete (0x0e) plen 4                 #16 [hci1] 1.179362
      LE Set Host Feature (0x08|0x0074) ncmd 1
        Status: Success (0x00)
< HCI Command: LE Read Buffer v2 (0x08|0x0060) plen 0       #17 [hci1] 1.198920
> HCI Event: Command Complete (0x0e) plen 10                #18 [hci1] 1.199385
      LE Read Buffer v2 (0x08|0x0060) ncmd 1
        Status: Success (0x00)
        ACL MTU: 27
        ACL max packet: 3
        ISO MTU: 318
        ISO max packet: 3
< HCI Command: LE Read Maximum Adve.. (0x08|0x003a) plen 0  #19 [hci1] 1.218982
> HCI Event: Command Complete (0x0e) plen 6                 #20 [hci1] 1.219396
      LE Read Maximum Advertising Data Length (0x08|0x003a) ncmd 1
        Status: Success (0x00)
        Max length: 1650
< HCI Command: LE Read Supported St.. (0x08|0x001c) plen 0  #21 [hci1] 1.238940
> HCI Event: Command Complete (0x0e) plen 12                #22 [hci1] 1.239375
      LE Read Supported States (0x08|0x001c) ncmd 1
        Status: Success (0x00)
        States: 0x000003ff3e0306ff
          Non-connectable Advertising State
          Scannable Advertising State
          Connectable Advertising State
          High Duty Cycle Directed Advertising State
          Passive Scanning State
          Active Scanning State
          Initiating State
            and Connection State (Central Role)
          Connection State (Peripheral Role)
          Scannable Advertising State
            and Passive Scanning State
          Connectable Advertising State
            and Passive Scanning State
          Non-connectable Advertising State
            and Initiating State
          Scannable Advertising State
            and Initiating State
          Active Scanning State
            and Connection State (Central Role)
          Passive Scanning State
            and Connection State (Peripheral Role)
          Active Scanning State
            and Connection State (Peripheral Role)
          Initiating State
            and Connection State (Central Role)
            and Central Role & Central Role
          Low Duty Cycle Directed Advertising State
          Connectable Advertising State
            and Initiating State
            and Central Role & Peripheral Role
          High Duty Cycle Directed Advertising State
            and Initiating State
            and Central Role & Peripheral Role
          Low Duty Cycle Directed Advertising State
            and Initiating State
            and Central Role & Peripheral Role
          Connectable Advertising State
            and Connection State (Central Role)
            and Central Role & Peripheral Role
          High Duty Cycle Directed Advertising State
            and Connection State (Central Role)
            and Central Role & Peripheral Role
          Low Duty Cycle Directed Advertising State
            and Connection State (Central Role)
            and Central Role & Peripheral Role
          Connectable Advertising State
            and Connection State (Peripheral Role)
            and Central Role & Peripheral Role
          High Duty Cycle Directed Advertising State
            and Connection State (Peripheral Role)
            and Peripheral Role & Peripheral Role
          Low Duty Cycle Directed Advertising State
            and Connection State (Peripheral Role)
            and Peripheral Role & Peripheral Role
          Initiating State
            and Connection State (Peripheral Role)
            and Central Role & Peripheral Role
< HCI Command: LE Read Maximum Data.. (0x08|0x002f) plen 0  #23 [hci1] 1.258921
> HCI Event: Command Complete (0x0e) plen 12                #24 [hci1] 1.259387
      LE Read Maximum Data Length (0x08|0x002f) ncmd 1
        Status: Success (0x00)
        Max TX octets: 251
        Max TX time: 2704
        Max RX octets: 251
        Max RX time: 2704
< HCI Command: LE Write Suggested D.. (0x08|0x0024) plen 4  #25 [hci1] 1.278972
        TX octets: 251
        TX time: 2704
> HCI Event: Command Complete (0x0e) plen 4                 #26 [hci1] 1.279474
      LE Write Suggested Default Data Length (0x08|0x0024) ncmd 1
        Status: Success (0x00)
< HCI Command: LE Set Resolvable Pr.. (0x08|0x002e) plen 2  #27 [hci1] 1.298955
        Timeout: 30 seconds
> HCI Event: Command Complete (0x0e) plen 4                 #28 [hci1] 1.299338
      LE Set Resolvable Private Address Timeout (0x08|0x002e) ncmd 1
        Status: Success (0x00)
< HCI Command: LE Read Resolving Li.. (0x08|0x002a) plen 0  #29 [hci1] 1.318936
> HCI Event: Command Complete (0x0e) plen 5                 #30 [hci1] 1.319355
      LE Read Resolving List Size (0x08|0x002a) ncmd 1
        Status: Success (0x00)
        Size: 8
< HCI Command: LE Set Event Mask (0x08|0x0001) plen 8       #31 [hci1] 1.338945
        Mask: 0x000002023f87fa5e
          LE Advertising Report
          LE Connection Update Complete
          LE Read Remote Used Features Complete
          LE Long Term Key Request
          LE Data Length Change
          LE Enhanced Connection Complete
          LE PHY Update Complete
          LE Extended Advertising Report
          LE Periodic Advertising Sync Established
          LE Periodic Advertising Report
          LE Periodic Advertising Sync Lost
          LE Extended Scan Timeout
          LE Extended Advertising Set Terminated
          LE Scan Request Received
          LE Periodic Advertising Sync Transfer Rvc
          LE CIS Established
          LE CIS Request
          LE Create BIG Complete
          LE Terminate BIG Complete
          LE BIG Sync Estabilished Complete
          LE BIG Sync Lost
          LE BIG Info Advertising Report
          Unknown mask (0x0000020000000000)
> HCI Event: Command Complete (0x0e) plen 4                 #32 [hci1] 1.339447
      LE Set Event Mask (0x08|0x0001) ncmd 1
        Status: Success (0x00)
< HCI Command: Set Event Mask (0x03|0x0001) plen 8          #33 [hci1] 1.358951
        Mask: 0x2000800002008890
          Disconnection Complete
          Encryption Change
          Read Remote Version Information Complete
          Hardware Error
          Data Buffer Overflow
          Encryption Key Refresh Complete
          LE Meta
> HCI Event: Command Complete (0x0e) plen 4                 #34 [hci1] 1.359458
      Set Event Mask (0x03|0x0001) ncmd 1
        Status: Success (0x00)
< HCI Command: Read BD ADDR (0x04|0x0009) plen 0            #35 [hci1] 1.378973
> HCI Event: Command Complete (0x0e) plen 10                #36 [hci1] 1.379390
      Read BD ADDR (0x04|0x0009) ncmd 1
        Status: Success (0x00)
        Address: 00:00:00:00:00:00 (OUI 00-00-00)
< HCI Command: LE Set Random Address (0x08|0x0005) plen 6   #37 [hci1] 1.399055
        Address: D5:B6:CC:31:DB:3B (Static)
> HCI Event: Command Complete (0x0e) plen 4                 #38 [hci1] 1.399534
      LE Set Random Address (0x08|0x0005) ncmd 1
        Status: Success (0x00)
< HCI Command: LE Set Random Address (0x08|0x0005) plen 6   #39 [hci1] 1.519072
        Address: 48:61:8E:DB:C6:F9 (Resolvable)
> HCI Event: Command Complete (0x0e) plen 4                 #40 [hci1] 1.519697
      LE Set Random Address (0x08|0x0005) ncmd 1
        Status: Success (0x00)
< HCI Command: LE Extended Create... (0x08|0x0043) plen 26  #41 [hci1] 5.539170
        Filter policy: Accept list is not used (0x00)
        Own address type: Random (0x03)
        Peer address type: Public (0x00)
        Peer address: DF:A9:FF:F6:B1:1A (OUI DF-A9-FF)
        Initiating PHYs: 0x01
        Entry 0: LE 1M
          Scan interval: 60.000 msec (0x0060)
          Scan window: 60.000 msec (0x0060)
          Min connection interval: 50.00 msec (0x0028)
          Max connection interval: 70.00 msec (0x0038)
          Connection latency: 0 (0x0000)
          Supervision timeout: 4000 msec (0x0190)
          Min connection length: 0.000 msec (0x0000)
          Max connection length: 0.000 msec (0x0000)
> HCI Event: Command Status (0x0f) plen 4                   #42 [hci1] 5.540030
      LE Extended Create Connection (0x08|0x0043) ncmd 1
        Status: Success (0x00)
> HCI Event: LE Meta Event (0x3e) plen 31                   #43 [hci1] 5.555415
      LE Enhanced Connection Complete (0x0a)
        Status: Success (0x00)
        Handle: 54
        Role: Central (0x00)
        Peer address type: Public (0x00)
        Peer address: DF:A9:FF:F6:B1:1A (OUI DF-A9-FF)
        Local resolvable private address: 48:61:8E:DB:C6:F9 (Resolvable)
        Peer resolvable private address: 00:00:00:00:00:00 (Non-Resolvable)
        Connection interval: 70.00 msec (0x0038)
        Connection latency: 0 (0x0000)
        Supervision timeout: 4000 msec (0x0190)
        Central clock accuracy: 0x00
< ACL Data TX: Handle 54 flags 0x00 dlen 7                  #44 [hci1] 5.559483
      ATT: Exchange MTU Request (0x02) len 2
        Client RX MTU: 251
< HCI Command: LE Read Remote Used... (0x08|0x0016) plen 2  #45 [hci1] 5.559491
        Handle: 54 Address: DF:A9:FF:F6:B1:1A (OUI DF-A9-FF)
> HCI Event: Command Status (0x0f) plen 4                   #46 [hci1] 5.560035
      LE Read Remote Used Features (0x08|0x0016) ncmd 1
        Status: Success (0x00)
< HCI Command: LE Set PHY (0x08|0x0032) plen 7              #47 [hci1] 5.579143
        Handle: 54 Address: DF:A9:FF:F6:B1:1A (OUI DF-A9-FF)
        All PHYs preference: 0x00
        TX PHYs preference: 0x02
          LE 2M
        RX PHYs preference: 0x02
          LE 2M
        PHY options preference: Reserved (0x0000)
> HCI Event: Command Status (0x0f) plen 4                   #48 [hci1] 5.579635
      LE Set PHY (0x08|0x0032) ncmd 1
        Status: Success (0x00)
> HCI Event: Number of Completed Packets (0x13) plen 5      #49 [hci1] 5.627633
        Num handles: 1
        Handle: 54 Address: DF:A9:FF:F6:B1:1A (OUI DF-A9-FF)
        Count: 1
        #44: len 7 (0 Kb/s)
        Latency: 68 msec (68-68 msec ~68 msec)
> HCI Event: LE Meta Event (0x3e) plen 12                   #50 [hci1] 5.767790
      LE Read Remote Used Features (0x04)
        Status: Success (0x00)
        Handle: 54 Address: DF:A9:FF:F6:B1:1A (OUI DF-A9-FF)
        Features: 0x2d 0x49 0x00 0xf7 0x67 0xd8 0x00 0x00
          LE Encryption
          Extended Reject Indication
          Peripheral-initiated Features Exchange
          LE Data Packet Length Extension
          LE 2M PHY
          LE Coded PHY
          Channel Selection Algorithm #2
          Periodic Advertising Sync Transfer - Sender
          Periodic Advertising Sync Transfer - Recipient
          Sleep Clock Accuracy Updates
          Connected Isochronous Stream - Central
          Connected Isochronous Stream - Peripheral
          Isochronous Broadcaster
          Synchronized Receiver
          Connected Isochronous Stream (Host Support)
          LE Power Control Request
          LE Power Control Request
          Connection Subrating
          Connection Subrating (Host Support)
          Unknown features (0x0000d80000000000)
> HCI Event: LE Meta Event (0x3e) plen 6                    #51 [hci1] 6.467110
      LE PHY Update Complete (0x0c)
        Status: Success (0x00)
        Handle: 54 Address: DF:A9:FF:F6:B1:1A (OUI DF-A9-FF)
        TX PHY: LE 2M (0x02)
        RX PHY: LE 2M (0x02)
> ACL Data RX: Handle 54 flags 0x02 dlen 6                  #52 [hci1] 6.608192
      SMP: Security Request (0x0b) len 1
        Authentication requirement: Bonding, No MITM, SC, No Keypresses (0x09)
> ACL Data RX: Handle 54 flags 0x02 dlen 7                  #53 [hci1] 6.608195
      ATT: Exchange MTU Response (0x03) len 2
        Server RX MTU: 23
< HCI Command: Host Number of Compl.. (0x03|0x0035) plen 5  #54 [hci1] 6.619056
        Num handles: 1
        Handle: 54 Address: DF:A9:FF:F6:B1:1A (OUI DF-A9-FF)
        Count: 1
< ACL Data TX: Handle 54 flags 0x00 dlen 11                 #55 [hci1] 6.619129
      SMP: Pairing Request (0x01) len 6
        IO capability: NoInputNoOutput (0x03)
        OOB data: Authentication data not present (0x00)
        Authentication requirement: Bonding, No MITM, SC, No Keypresses (0x09)
        Max encryption key size: 16
        Initiator key distribution: EncKey IdKey (0x03)
        Responder key distribution: EncKey IdKey (0x03)
< HCI Command: Host Number of Compl.. (0x03|0x0035) plen 5  #56 [hci1] 6.619153
        Num handles: 1
        Handle: 54 Address: DF:A9:FF:F6:B1:1A (OUI DF-A9-FF)
        Count: 1
> HCI Event: Number of Completed Packets (0x13) plen 5      #57 [hci1] 6.677544
        Num handles: 1
        Handle: 54 Address: DF:A9:FF:F6:B1:1A (OUI DF-A9-FF)
        Count: 1
        #55: len 11 (1 Kb/s)
        Latency: 58 msec (58-68 msec ~63 msec)
> ACL Data RX: Handle 54 flags 0x02 dlen 11                 #58 [hci1] 6.747665
      SMP: Pairing Response (0x02) len 6
        IO capability: KeyboardDisplay (0x04)
        OOB data: Authentication data not present (0x00)
        Authentication requirement: Bonding, No MITM, SC, No Keypresses (0x09)
        Max encryption key size: 16
        Initiator key distribution: EncKey IdKey (0x03)
        Responder key distribution: EncKey IdKey (0x03)
< HCI Command: Host Number of Compl.. (0x03|0x0035) plen 5  #59 [hci1] 6.759055
        Num handles: 1
        Handle: 54 Address: DF:A9:FF:F6:B1:1A (OUI DF-A9-FF)
        Count: 1
< ACL Data TX: Handle 54 flags 0x00 dlen 27                 #60 [hci1] 6.759072
< ACL Data TX: Handle 54 flags 0x01 dlen 27                 #61 [hci1] 6.759074
< ACL Data TX: Handle 54 flags 0x01 dlen 15                 #62 [hci1] 6.759080
      SMP: Pairing Public Key (0x0c) len 64
        X: 68f6ada634ce84d11617383d57f070fe3445c38b33b569efa5eb771a0dc8aea5
        Y: 83c407aaa8337331fdc418e55085d75e6c1c6e5d42f8bf9c18fb5a2a7d4f31aa
> HCI Event: Number of Completed Packets (0x13) plen 5      #63 [hci1] 6.817580
        Num handles: 1
        Handle: 54 Address: DF:A9:FF:F6:B1:1A (OUI DF-A9-FF)
        Count: 1
        #60: len 27 (3 Kb/s)
        Latency: 58 msec (58-68 msec ~60 msec)
> HCI Event: Number of Completed Packets (0x13) plen 5      #64 [hci1] 6.818011
        Num handles: 1
        Handle: 54 Address: DF:A9:FF:F6:B1:1A (OUI DF-A9-FF)
        Count: 1
        #61: len 27 (3 Kb/s)
        Latency: 58 msec (58-68 msec ~59 msec)
> HCI Event: Number of Completed Packets (0x13) plen 5      #65 [hci1] 6.818549
        Num handles: 1
        Handle: 54 Address: DF:A9:FF:F6:B1:1A (OUI DF-A9-FF)
        Count: 1
        #62: len 15 (2 Kb/s)
        Latency: 59 msec (58-68 msec ~59 msec)
> ACL Data RX: Handle 54 flags 0x02 dlen 27                 #66 [hci1] 6.887796
> ACL Data RX: Handle 54 flags 0x01 dlen 27                 #67 [hci1] 6.888311
> ACL Data RX: Handle 54 flags 0x01 dlen 15                 #68 [hci1] 6.888590
      SMP: Pairing Public Key (0x0c) len 64
        X: 6afe5b01295eb5b0cc6460afd1244a30280654e74cf862d2c533c08e0ed6ab1d
        Y: e5cd9b545d730a18da3c7bedfa11d1562d41d914bceffa97e7437df8a435f81a
> ACL Data RX: Handle 54 flags 0x02 dlen 21                 #69 [hci1] 6.889241
      SMP: Pairing Confirm (0x03) len 16
        Confim value: 1a142ae05c8f9a06a3d9161864a37640
< HCI Command: Host Number of Compl.. (0x03|0x0035) plen 5  #70 [hci1] 6.899152
        Num handles: 1
        Handle: 54 Address: DF:A9:FF:F6:B1:1A (OUI DF-A9-FF)
        Count: 1
< HCI Command: Host Number of Compl.. (0x03|0x0035) plen 5  #71 [hci1] 6.899887
        Num handles: 1
        Handle: 54 Address: DF:A9:FF:F6:B1:1A (OUI DF-A9-FF)
        Count: 1
< HCI Command: Host Number of Compl.. (0x03|0x0035) plen 5  #72 [hci1] 6.899891
        Num handles: 1
        Handle: 54 Address: DF:A9:FF:F6:B1:1A (OUI DF-A9-FF)
        Count: 1
< HCI Command: Host Number of Compl.. (0x03|0x0035) plen 5  #73 [hci1] 6.899892
        Num handles: 1
        Handle: 54 Address: DF:A9:FF:F6:B1:1A (OUI DF-A9-FF)
        Count: 1
< ACL Data TX: Handle 54 flags 0x00 dlen 21                 #74 [hci1] 6.899893
      SMP: Pairing Random (0x04) len 16
        Random value: 555cc64d02679f89a05211af56d8b3da
> HCI Event: Number of Completed Packets (0x13) plen 5      #75 [hci1] 6.957646
        Num handles: 1
        Handle: 54 Address: DF:A9:FF:F6:B1:1A (OUI DF-A9-FF)
        Count: 1
        #74: len 21 (2 Kb/s)
        Latency: 57 msec (57-68 msec ~58 msec)
> ACL Data RX: Handle 54 flags 0x02 dlen 21                 #76 [hci1] 7.027735
      SMP: Pairing Random (0x04) len 16
        Random value: ea1901b72a8defae0000000000000000
< HCI Command: Host Number of Compl.. (0x03|0x0035) plen 5  #77 [hci1] 7.039253
        Num handles: 1
        Handle: 54 Address: DF:A9:FF:F6:B1:1A (OUI DF-A9-FF)
        Count: 1
< ACL Data TX: Handle 54 flags 0x00 dlen 21                 #78 [hci1] 7.039332
      SMP: Pairing DHKey Check (0x0d) len 16
        E: 5d1db9bd00dbf7d11d1eda755df36726
> HCI Event: Number of Completed Packets (0x13) plen 5      #79 [hci1] 7.097630
        Num handles: 1
        Handle: 54 Address: DF:A9:FF:F6:B1:1A (OUI DF-A9-FF)
        Count: 1
        #78: len 21 (2 Kb/s)
        Latency: 58 msec (57-68 msec ~58 msec)
> ACL Data RX: Handle 54 flags 0x02 dlen 21                 #80 [hci1] 7.307732
      SMP: Pairing DHKey Check (0x0d) len 16
        E: 0953d41949fed92b80b8622292e2e71f
< HCI Command: LE Start Encryption (0x08|0x0019) plen 28    #81 [hci1] 7.319167
        Handle: 54 Address: DF:A9:FF:F6:B1:1A (OUI DF-A9-FF)
        Random number: 0x0000000000000000
        Encrypted diversifier: 0x0000
        Long term key: 446a7a8cce88ac22f151e4d7a75bbcfc
> HCI Event: Command Status (0x0f) plen 4                   #82 [hci1] 7.320002
      LE Start Encryption (0x08|0x0019) ncmd 1
        Status: Success (0x00)
< HCI Command: Host Number of Compl.. (0x03|0x0035) plen 5  #83 [hci1] 7.339135
        Num handles: 1
        Handle: 54 Address: DF:A9:FF:F6:B1:1A (OUI DF-A9-FF)
        Count: 1
> HCI Event: Encryption Change (0x08) plen 4                #84 [hci1] 7.797523
        Status: Success (0x00)
        Handle: 54 Address: DF:A9:FF:F6:B1:1A (OUI DF-A9-FF)
        Encryption: Enabled with AES-CCM (0x01)
> ACL Data RX: Handle 54 flags 0x02 dlen 21                 #85 [hci1] 7.867779
      SMP: Identity Information (0x08) len 16
        Identity resolving key: 96de1a1d215e7e8c48d2a8b60812a3d1
< HCI Command: Host Number of Compl.. (0x03|0x0035) plen 5  #86 [hci1] 7.879120
        Num handles: 1
        Handle: 54 Address: DF:A9:FF:F6:B1:1A (OUI DF-A9-FF)
        Count: 1
> ACL Data RX: Handle 54 flags 0x02 dlen 12                 #87 [hci1] 7.937641
      SMP: Identity Address Information (0x09) len 7
        Address: DF:A9:FF:F6:B1:1A (OUI DF-A9-FF)
< HCI Command: LE Add Device To Re.. (0x08|0x0027) plen 39  #88 [hci1] 7.939167
        Address type: Public (0x00)
        Address: DF:A9:FF:F6:B1:1A (OUI DF-A9-FF)
        Peer identity resolving key: 96de1a1d215e7e8c48d2a8b60812a3d1
        Local identity resolving key: 08aad2e1be87e47b88aeb19de6889efb
> HCI Event: Command Complete (0x0e) plen 4                 #89 [hci1] 7.940116
      LE Add Device To Resolving List (0x08|0x0027) ncmd 1
        Status: Success (0x00)
< HCI Command: LE Extended Create... (0x08|0x0043) plen 26  #90 [hci1] 7.959318
        Filter policy: Accept list is not used (0x00)
        Own address type: Random (0x03)
        Peer address type: Public (0x00)
        Peer address: 64:23:B5:94:C5:F1 (OUI 64-23-B5)
        Initiating PHYs: 0x01
        Entry 0: LE 1M
          Scan interval: 60.000 msec (0x0060)
          Scan window: 60.000 msec (0x0060)
          Min connection interval: 50.00 msec (0x0028)
          Max connection interval: 70.00 msec (0x0038)
          Connection latency: 0 (0x0000)
          Supervision timeout: 4000 msec (0x0190)
          Min connection length: 0.000 msec (0x0000)
          Max connection length: 0.000 msec (0x0000)
> HCI Event: Command Status (0x0f) plen 4                   #91 [hci1] 7.960328
      LE Extended Create Connection (0x08|0x0043) ncmd 1
        Status: Success (0x00)
< HCI Command: LE Set Privacy Mode (0x08|0x004e) plen 8     #92 [hci1] 7.979202
        Peer Identity address type: Public (0x00)
        Peer Identity address: DF:A9:FF:F6:B1:1A (OUI DF-A9-FF)
        Privacy Mode: Use Device Privacy (0x01)
> HCI Event: Command Complete (0x0e) plen 4                 #93 [hci1] 7.979761
      LE Set Privacy Mode (0x08|0x004e) ncmd 1
        Status: Success (0x00)
< HCI Command: LE Set Address Resol.. (0x08|0x002d) plen 1  #94 [hci1] 7.999105
        Address resolution: Enabled (0x01)
> HCI Event: Command Complete (0x0e) plen 4                 #95 [hci1] 7.999473
      LE Set Address Resolution Enable (0x08|0x002d) ncmd 1
        Status: Command Disallowed (0x0c)
< HCI Command: Host Number of Compl.. (0x03|0x0035) plen 5  #96 [hci1] 8.019054
        Num handles: 1
        Handle: 54 Address: DF:A9:FF:F6:B1:1A (OUI DF-A9-FF)
        Count: 1
< ACL Data TX: Handle 54 flags 0x00 dlen 21                 #97 [hci1] 8.019118
      SMP: Identity Information (0x08) len 16
        Identity resolving key: 08aad2e1be87e47b88aeb19de6889efb
< ACL Data TX: Handle 54 flags 0x00 dlen 12                 #98 [hci1] 8.019121
      SMP: Identity Address Information (0x09) len 7
        Address: D5:B6:CC:31:DB:3B (Static)
> HCI Event: LE Meta Event (0x3e) plen 31                   #99 [hci1] 8.047696
      LE Enhanced Connection Complete (0x0a)
        Status: Success (0x00)
        Handle: 37
        Role: Central (0x00)
        Peer address type: Public (0x00)
        Peer address: 64:23:B5:94:C5:F1 (OUI 64-23-B5)
        Local resolvable private address: 48:61:8E:DB:C6:F9 (Resolvable)
          Identity type: Random (0x01)
          Identity: D5:B6:CC:31:DB:3B (Static)
        Peer resolvable private address: 00:00:00:00:00:00 (Non-Resolvable)
        Connection interval: 70.00 msec (0x0038)
        Connection latency: 0 (0x0000)
        Supervision timeout: 4000 msec (0x0190)
        Central clock accuracy: 0x00
< HCI Command: LE Read Remote Used.. (0x08|0x0016) plen 2  #100 [hci1] 8.059256
        Handle: 37 Address: 64:23:B5:94:C5:F1 (OUI 64-23-B5)
< ACL Data TX: Handle 37 flags 0x00 dlen 7                 #101 [hci1] 8.059263
      ATT: Exchange MTU Request (0x02) len 2
        Client RX MTU: 251
> HCI Event: Command Status (0x0f) plen 4                  #102 [hci1] 8.059703
      LE Read Remote Used Features (0x08|0x0016) ncmd 1
        Status: Success (0x00)
> HCI Event: Number of Completed Packets (0x13) plen 5     #103 [hci1] 8.077598
        Num handles: 1
        Handle: 54 Address: DF:A9:FF:F6:B1:1A (OUI DF-A9-FF)
        Count: 1
        #97: len 21 (2 Kb/s)
        Latency: 58 msec (57-68 msec ~58 msec)
> HCI Event: Number of Completed Packets (0x13) plen 5     #104 [hci1] 8.078032
        Num handles: 1
        Handle: 54 Address: DF:A9:FF:F6:B1:1A (OUI DF-A9-FF)
        Count: 1
        #98: len 12 (1 Kb/s)
        Latency: 58 msec (57-68 msec ~58 msec)
< HCI Command: LE Set PHY (0x08|0x0032) plen 7             #105 [hci1] 8.079131
        Handle: 37 Address: 64:23:B5:94:C5:F1 (OUI 64-23-B5)
        All PHYs preference: 0x00
        TX PHYs preference: 0x02
          LE 2M
        RX PHYs preference: 0x02
          LE 2M
        PHY options preference: Reserved (0x0000)
> HCI Event: Command Status (0x0f) plen 4                  #106 [hci1] 8.079618
      LE Set PHY (0x08|0x0032) ncmd 1
        Status: Success (0x00)
< ACL Data TX: Handle 54 flags 0x00 dlen 11                #107 [hci1] 8.099179
      ATT: Read By Type Request (0x08) len 6
        Handle range: 0x0001-0xffff
        Attribute type: Central Address Resolution (0x2aa6)
> HCI Event: Number of Completed Packets (0x13) plen 5     #108 [hci1] 8.107609
        Num handles: 1
        Handle: 37 Address: 64:23:B5:94:C5:F1 (OUI 64-23-B5)
        Count: 1
        #101: len 7 (1 Kb/s)
        Latency: 48 msec (48-48 msec ~48 msec)
> HCI Event: Number of Completed Packets (0x13) plen 5     #109 [hci1] 8.147536
        Num handles: 1
        Handle: 54 Address: DF:A9:FF:F6:B1:1A (OUI DF-A9-FF)
        Count: 1
        #107: len 11 (1 Kb/s)
        Latency: 48 msec (48-68 msec ~53 msec)
> ACL Data RX: Handle 37 flags 0x02 dlen 7                 #110 [hci1] 8.177735
      ATT: Exchange MTU Response (0x03) len 2
        Server RX MTU: 23
< HCI Command: Host Number of Comp.. (0x03|0x0035) plen 5  #111 [hci1] 8.179167
        Num handles: 1
        Handle: 37 Address: 64:23:B5:94:C5:F1 (OUI 64-23-B5)
        Count: 1
> ACL Data RX: Handle 54 flags 0x02 dlen 9                 #112 [hci1] 8.217601
      ATT: Read By Type Response (0x09) len 4
        Attribute data length: 3
        Attribute data list: 1 entry
        Handle: 0x000f
        Value: 01
< HCI Command: Host Number of Comp.. (0x03|0x0035) plen 5  #113 [hci1] 8.219161
        Num handles: 1
        Handle: 54 Address: DF:A9:FF:F6:B1:1A (OUI DF-A9-FF)
        Count: 1
> HCI Event: LE Meta Event (0x3e) plen 12                  #114 [hci1] 8.247666
      LE Read Remote Used Features (0x04)
        Status: Success (0x00)
        Handle: 37 Address: 64:23:B5:94:C5:F1 (OUI 64-23-B5)
        Features: 0x2d 0x49 0x00 0xf7 0x67 0xd8 0x00 0x00
          LE Encryption
          Extended Reject Indication
          Peripheral-initiated Features Exchange
          LE Data Packet Length Extension
          LE 2M PHY
          LE Coded PHY
          Channel Selection Algorithm #2
          Periodic Advertising Sync Transfer - Sender
          Periodic Advertising Sync Transfer - Recipient
          Sleep Clock Accuracy Updates
          Connected Isochronous Stream - Central
          Connected Isochronous Stream - Peripheral
          Isochronous Broadcaster
          Synchronized Receiver
          Connected Isochronous Stream (Host Support)
          LE Power Control Request
          LE Power Control Request
          Connection Subrating
          Connection Subrating (Host Support)
          Unknown features (0x0000d80000000000)
> HCI Event: LE Meta Event (0x3e) plen 6                   #115 [hci1] 8.946991
      LE PHY Update Complete (0x0c)
        Status: Success (0x00)
        Handle: 37 Address: 64:23:B5:94:C5:F1 (OUI 64-23-B5)
        TX PHY: LE 2M (0x02)
        RX PHY: LE 2M (0x02)
< ACL Data TX: Handle 37 flags 0x00 dlen 11               #116 [hci1] 18.179384
      SMP: Pairing Request (0x01) len 6
        IO capability: NoInputNoOutput (0x03)
        OOB data: Authentication data not present (0x00)
        Authentication requirement: Bonding, No MITM, SC, No Keypresses (0x09)
        Max encryption key size: 16
        Initiator key distribution: EncKey IdKey (0x03)
        Responder key distribution: EncKey IdKey (0x03)
> HCI Event: Number of Completed Packets (0x13) plen 5    #117 [hci1] 18.187334
        Num handles: 1
        Handle: 37 Address: 64:23:B5:94:C5:F1 (OUI 64-23-B5)
        Count: 1
        #116: len 11 (12 Kb/s)
        Latency: 7 msec (7-48 msec ~28 msec)
> ACL Data RX: Handle 37 flags 0x02 dlen 11               #118 [hci1] 18.257540
      SMP: Pairing Response (0x02) len 6
        IO capability: KeyboardDisplay (0x04)
        OOB data: Authentication data not present (0x00)
        Authentication requirement: Bonding, No MITM, SC, No Keypresses (0x09)
        Max encryption key size: 16
        Initiator key distribution: EncKey IdKey (0x03)
        Responder key distribution: EncKey IdKey (0x03)
< HCI Command: Host Number of Com.. (0x03|0x0035) plen 5  #119 [hci1] 18.259294
        Num handles: 1
        Handle: 37 Address: 64:23:B5:94:C5:F1 (OUI 64-23-B5)
        Count: 1
< ACL Data TX: Handle 37 flags 0x00 dlen 27               #120 [hci1] 18.259396
< ACL Data TX: Handle 37 flags 0x01 dlen 27               #121 [hci1] 18.259399
< ACL Data TX: Handle 37 flags 0x01 dlen 15               #122 [hci1] 18.259399
      SMP: Pairing Public Key (0x0c) len 64
        X: 68f6ada634ce84d11617383d57f070fe3445c38b33b569efa5eb771a0dc8aea5
        Y: 83c407aaa8337331fdc418e55085d75e6c1c6e5d42f8bf9c18fb5a2a7d4f31aa
> HCI Event: Number of Completed Packets (0x13) plen 5    #123 [hci1] 18.327464
        Num handles: 1
        Handle: 37 Address: 64:23:B5:94:C5:F1 (OUI 64-23-B5)
        Count: 1
        #120: len 27 (3 Kb/s)
        Latency: 68 msec (7-68 msec ~48 msec)
> HCI Event: Number of Completed Packets (0x13) plen 5    #124 [hci1] 18.327836
        Num handles: 1
        Handle: 37 Address: 64:23:B5:94:C5:F1 (OUI 64-23-B5)
        Count: 1
        #121: len 27 (3 Kb/s)
        Latency: 68 msec (7-68 msec ~58 msec)
> HCI Event: Number of Completed Packets (0x13) plen 5    #125 [hci1] 18.328307
        Num handles: 1
        Handle: 37 Address: 64:23:B5:94:C5:F1 (OUI 64-23-B5)
        Count: 1
        #122: len 15 (1 Kb/s)
        Latency: 68 msec (7-68 msec ~63 msec)
> ACL Data RX: Handle 37 flags 0x02 dlen 27               #126 [hci1] 18.397607
> ACL Data RX: Handle 37 flags 0x01 dlen 27               #127 [hci1] 18.398041
> ACL Data RX: Handle 37 flags 0x01 dlen 15               #128 [hci1] 18.398470
      SMP: Pairing Public Key (0x0c) len 64
        X: aa50c51d496876d97553c2f14627ad6a9b3194e6ded0805c5191487ac3653152
        Y: 5f41b9056ee061f64df047bfd6315e1fe09adc8fe03ddc8b3327220bbbe84b91
> ACL Data RX: Handle 37 flags 0x02 dlen 21               #129 [hci1] 18.398968
      SMP: Pairing Confirm (0x03) len 16
        Confim value: d692d19b7ec56123170b6e7c509d7b29
< HCI Command: Host Number of Com.. (0x03|0x0035) plen 5  #130 [hci1] 18.399294
        Num handles: 1
        Handle: 37 Address: 64:23:B5:94:C5:F1 (OUI 64-23-B5)
        Count: 1
< HCI Command: Host Number of Com.. (0x03|0x0035) plen 5  #131 [hci1] 18.399357
        Num handles: 1
        Handle: 37 Address: 64:23:B5:94:C5:F1 (OUI 64-23-B5)
        Count: 1
< HCI Command: Host Number of Com.. (0x03|0x0035) plen 5  #132 [hci1] 18.399362
        Num handles: 1
        Handle: 37 Address: 64:23:B5:94:C5:F1 (OUI 64-23-B5)
        Count: 1
< HCI Command: Host Number of Com.. (0x03|0x0035) plen 5  #133 [hci1] 18.399447
        Num handles: 1
        Handle: 37 Address: 64:23:B5:94:C5:F1 (OUI 64-23-B5)
        Count: 1
< ACL Data TX: Handle 37 flags 0x00 dlen 21               #134 [hci1] 18.399465
      SMP: Pairing Random (0x04) len 16
        Random value: 1ec8845e8286bc235a02440d0c3424a2
> HCI Event: Number of Completed Packets (0x13) plen 5    #135 [hci1] 18.467429
        Num handles: 1
        Handle: 37 Address: 64:23:B5:94:C5:F1 (OUI 64-23-B5)
        Count: 1
        #134: len 21 (2 Kb/s)
        Latency: 67 msec (7-68 msec ~65 msec)
> ACL Data RX: Handle 37 flags 0x02 dlen 21               #136 [hci1] 18.537518
      SMP: Pairing Random (0x04) len 16
        Random value: dd7953f5bd9680490000000000000000
< HCI Command: Host Number of Com.. (0x03|0x0035) plen 5  #137 [hci1] 18.539434
        Num handles: 1
        Handle: 37 Address: 64:23:B5:94:C5:F1 (OUI 64-23-B5)
        Count: 1
< ACL Data TX: Handle 37 flags 0x00 dlen 21               #138 [hci1] 18.539533
      SMP: Pairing DHKey Check (0x0d) len 16
        E: ccfaa142c52af1256f5554230838ecf8
> HCI Event: Number of Completed Packets (0x13) plen 5    #139 [hci1] 18.607365
        Num handles: 1
        Handle: 37 Address: 64:23:B5:94:C5:F1 (OUI 64-23-B5)
        Count: 1
        #138: len 21 (2 Kb/s)
        Latency: 67 msec (7-68 msec ~66 msec)
> ACL Data RX: Handle 37 flags 0x02 dlen 21               #140 [hci1] 18.887519
      SMP: Pairing DHKey Check (0x0d) len 16
        E: 592af52f1b5f5bf5def2d685f04b90af
< HCI Command: LE Start Encryption (0x08|0x0019) plen 28  #141 [hci1] 18.899443
        Handle: 37 Address: 64:23:B5:94:C5:F1 (OUI 64-23-B5)
        Random number: 0x0000000000000000
        Encrypted diversifier: 0x0000
        Long term key: eb7f40ba08e6b33e1cd905b02a579d4d
> HCI Event: Command Status (0x0f) plen 4                 #142 [hci1] 18.900424
      LE Start Encryption (0x08|0x0019) ncmd 1
        Status: Success (0x00)
< HCI Command: Host Number of Com.. (0x03|0x0035) plen 5  #143 [hci1] 18.919319
        Num handles: 1
        Handle: 37 Address: 64:23:B5:94:C5:F1 (OUI 64-23-B5)
        Count: 1
> HCI Event: Encryption Change (0x08) plen 4              #144 [hci1] 19.377263
        Status: Success (0x00)
        Handle: 37 Address: 64:23:B5:94:C5:F1 (OUI 64-23-B5)
        Encryption: Enabled with AES-CCM (0x01)
> ACL Data RX: Handle 37 flags 0x02 dlen 21               #145 [hci1] 19.447610
      SMP: Identity Information (0x08) len 16
        Identity resolving key: df74992f4d80b26f2c47722d31b7dfee
< HCI Command: Host Number of Com.. (0x03|0x0035) plen 5  #146 [hci1] 19.459361
        Num handles: 1
        Handle: 37 Address: 64:23:B5:94:C5:F1 (OUI 64-23-B5)
        Count: 1
> ACL Data RX: Handle 37 flags 0x02 dlen 12               #147 [hci1] 19.517445
      SMP: Identity Address Information (0x09) len 7
        Address: 64:23:B5:94:C5:F1 (OUI 64-23-B5)
< HCI Command: LE Set Address Res.. (0x08|0x002d) plen 1  #148 [hci1] 19.519402
        Address resolution: Disabled (0x00)
> HCI Event: Command Complete (0x0e) plen 4               #149 [hci1] 19.519808
      LE Set Address Resolution Enable (0x08|0x002d) ncmd 1
        Status: Success (0x00)
< HCI Command: LE Add Device To... (0x08|0x0027) plen 39  #150 [hci1] 19.539362
        Address type: Public (0x00)
        Address: 64:23:B5:94:C5:F1 (OUI 64-23-B5)
        Peer identity resolving key: df74992f4d80b26f2c47722d31b7dfee
        Local identity resolving key: 08aad2e1be87e47b88aeb19de6889efb
> HCI Event: Command Complete (0x0e) plen 4               #151 [hci1] 19.540435
      LE Add Device To Resolving List (0x08|0x0027) ncmd 1
        Status: Success (0x00)
< HCI Command: LE Extended Creat.. (0x08|0x0043) plen 26  #152 [hci1] 19.559413
        Filter policy: Accept list is not used (0x00)
        Own address type: Random (0x03)
        Peer address type: Public (0x00)
        Peer address: B8:7C:99:F9:E0:AE (OUI B8-7C-99)
        Initiating PHYs: 0x01
        Entry 0: LE 1M
          Scan interval: 60.000 msec (0x0060)
          Scan window: 60.000 msec (0x0060)
          Min connection interval: 50.00 msec (0x0028)
          Max connection interval: 70.00 msec (0x0038)
          Connection latency: 0 (0x0000)
          Supervision timeout: 4000 msec (0x0190)
          Min connection length: 0.000 msec (0x0000)
          Max connection length: 0.000 msec (0x0000)
> HCI Event: Command Status (0x0f) plen 4                 #153 [hci1] 19.560457
      LE Extended Create Connection (0x08|0x0043) ncmd 1
        Status: Success (0x00)
< HCI Command: LE Set Privacy Mode (0x08|0x004e) plen 8   #154 [hci1] 19.579391
        Peer Identity address type: Public (0x00)
        Peer Identity address: 64:23:B5:94:C5:F1 (OUI 64-23-B5)
        Privacy Mode: Use Device Privacy (0x01)
> HCI Event: Command Complete (0x0e) plen 4               #155 [hci1] 19.579934
      LE Set Privacy Mode (0x08|0x004e) ncmd 1
        Status: Success (0x00)
< HCI Command: LE Set Address Res.. (0x08|0x002d) plen 1  #156 [hci1] 19.599311
        Address resolution: Enabled (0x01)
> HCI Event: Command Complete (0x0e) plen 4               #157 [hci1] 19.599840
      LE Set Address Resolution Enable (0x08|0x002d) ncmd 1
        Status: Command Disallowed (0x0c)
< HCI Command: Host Number of Com.. (0x03|0x0035) plen 5  #158 [hci1] 19.619368
        Num handles: 1
        Handle: 37 Address: 64:23:B5:94:C5:F1 (OUI 64-23-B5)
        Count: 1
< ACL Data TX: Handle 37 flags 0x00 dlen 21               #159 [hci1] 19.619446
      SMP: Identity Information (0x08) len 16
        Identity resolving key: 08aad2e1be87e47b88aeb19de6889efb
< ACL Data TX: Handle 37 flags 0x00 dlen 12               #160 [hci1] 19.619450
      SMP: Identity Address Information (0x09) len 7
        Address: D5:B6:CC:31:DB:3B (Static)
> HCI Event: LE Meta Event (0x3e) plen 31                 #161 [hci1] 19.643889
      LE Enhanced Connection Complete (0x0a)
        Status: Success (0x00)
        Handle: 38
        Role: Central (0x00)
        Peer address type: Public (0x00)
        Peer address: B8:7C:99:F9:E0:AE (OUI B8-7C-99)
        Local resolvable private address: 48:61:8E:DB:C6:F9 (Resolvable)
          Identity type: Random (0x01)
          Identity: D5:B6:CC:31:DB:3B (Static)
        Peer resolvable private address: 00:00:00:00:00:00 (Non-Resolvable)
        Connection interval: 70.00 msec (0x0038)
        Connection latency: 0 (0x0000)
        Supervision timeout: 4000 msec (0x0190)
        Central clock accuracy: 0x00
> HCI Event: Number of Completed Packets (0x13) plen 5    #162 [hci1] 19.657324
        Num handles: 1
        Handle: 37 Address: 64:23:B5:94:C5:F1 (OUI 64-23-B5)
        Count: 1
        #159: len 21 (4 Kb/s)
        Latency: 37 msec (7-68 msec ~52 msec)
> HCI Event: Number of Completed Packets (0x13) plen 5    #163 [hci1] 19.657836
        Num handles: 1
        Handle: 37 Address: 64:23:B5:94:C5:F1 (OUI 64-23-B5)
        Count: 1
        #160: len 12 (2 Kb/s)
        Latency: 38 msec (7-68 msec ~45 msec)
< ACL Data TX: Handle 38 flags 0x00 dlen 7                #164 [hci1] 19.659452
      ATT: Exchange MTU Request (0x02) len 2
        Client RX MTU: 251
< HCI Command: LE Read Remote Use.. (0x08|0x0016) plen 2  #165 [hci1] 19.659575
        Handle: 38 Address: B8:7C:99:F9:E0:AE (OUI B8-7C-99)
< ACL Data TX: Handle 37 flags 0x00 dlen 11               #166 [hci1] 19.659580
      ATT: Read By Type Request (0x08) len 6
        Handle range: 0x000f-0xffff
        Attribute type: Central Address Resolution (0x2aa6)
> HCI Event: Command Status (0x0f) plen 4                 #167 [hci1] 19.660100
      LE Read Remote Used Features (0x08|0x0016) ncmd 1
        Status: Success (0x00)
< HCI Command: LE Set PHY (0x08|0x0032) plen 7            #168 [hci1] 19.679361
        Handle: 38 Address: B8:7C:99:F9:E0:AE (OUI B8-7C-99)
        All PHYs preference: 0x00
        TX PHYs preference: 0x02
          LE 2M
        RX PHYs preference: 0x02
          LE 2M
        PHY options preference: Reserved (0x0000)
> HCI Event: Command Status (0x0f) plen 4                 #169 [hci1] 19.679883
      LE Set PHY (0x08|0x0032) ncmd 1
        Status: Success (0x00)
> HCI Event: Number of Completed Packets (0x13) plen 5    #170 [hci1] 19.687439
        Num handles: 1
        Handle: 38 Address: B8:7C:99:F9:E0:AE (OUI B8-7C-99)
        Count: 1
        #164: len 7 (2 Kb/s)
        Latency: 27 msec (27-27 msec ~27 msec)
> HCI Event: Number of Completed Packets (0x13) plen 5    #171 [hci1] 19.727305
        Num handles: 1
        Handle: 37 Address: 64:23:B5:94:C5:F1 (OUI 64-23-B5)
        Count: 1
        #166: len 11 (1 Kb/s)
        Latency: 67 msec (7-68 msec ~56 msec)
> ACL Data RX: Handle 38 flags 0x02 dlen 7                #172 [hci1] 19.757526
      ATT: Exchange MTU Response (0x03) len 2
        Server RX MTU: 23
< HCI Command: Host Number of Com.. (0x03|0x0035) plen 5  #173 [hci1] 19.759341
        Num handles: 1
        Handle: 38 Address: B8:7C:99:F9:E0:AE (OUI B8-7C-99)
        Count: 1
> ACL Data RX: Handle 37 flags 0x02 dlen 9                #174 [hci1] 19.797380
      ATT: Read By Type Response (0x09) len 4
        Attribute data length: 3
        Attribute data list: 1 entry
        Handle: 0x000f
        Value: 01
< HCI Command: Host Number of Com.. (0x03|0x0035) plen 5  #175 [hci1] 19.799433
        Num handles: 1
        Handle: 37 Address: 64:23:B5:94:C5:F1 (OUI 64-23-B5)
        Count: 1
> HCI Event: LE Meta Event (0x3e) plen 12                 #176 [hci1] 19.827492
      LE Read Remote Used Features (0x04)
        Status: Success (0x00)
        Handle: 38 Address: B8:7C:99:F9:E0:AE (OUI B8-7C-99)
        Features: 0x2d 0x49 0x00 0xf7 0x67 0xd8 0x00 0x00
          LE Encryption
          Extended Reject Indication
          Peripheral-initiated Features Exchange
          LE Data Packet Length Extension
          LE 2M PHY
          LE Coded PHY
          Channel Selection Algorithm #2
          Periodic Advertising Sync Transfer - Sender
          Periodic Advertising Sync Transfer - Recipient
          Sleep Clock Accuracy Updates
          Connected Isochronous Stream - Central
          Connected Isochronous Stream - Peripheral
          Isochronous Broadcaster
          Synchronized Receiver
          Connected Isochronous Stream (Host Support)
          LE Power Control Request
          LE Power Control Request
          Connection Subrating
          Connection Subrating (Host Support)
          Unknown features (0x0000d80000000000)
> HCI Event: LE Meta Event (0x3e) plen 6                  #177 [hci1] 20.526845
      LE PHY Update Complete (0x0c)
        Status: Success (0x00)
        Handle: 38 Address: B8:7C:99:F9:E0:AE (OUI B8-7C-99)
        TX PHY: LE 2M (0x02)
        RX PHY: LE 2M (0x02)
< ACL Data TX: Handle 38 flags 0x00 dlen 11               #178 [hci1] 29.809497
      SMP: Pairing Request (0x01) len 6
        IO capability: NoInputNoOutput (0x03)
        OOB data: Authentication data not present (0x00)
        Authentication requirement: Bonding, No MITM, SC, No Keypresses (0x09)
        Max encryption key size: 16
        Initiator key distribution: EncKey IdKey (0x03)
        Responder key distribution: EncKey IdKey (0x03)
> HCI Event: Number of Completed Packets (0x13) plen 5    #179 [hci1] 29.837134
        Num handles: 1
        Handle: 38 Address: B8:7C:99:F9:E0:AE (OUI B8-7C-99)
        Count: 1
        #178: len 11 (3 Kb/s)
        Latency: 27 msec (27-27 msec ~27 msec)
> ACL Data RX: Handle 38 flags 0x02 dlen 11               #180 [hci1] 29.907168
      SMP: Pairing Response (0x02) len 6
        IO capability: KeyboardDisplay (0x04)
        OOB data: Authentication data not present (0x00)
        Authentication requirement: Bonding, No MITM, SC, No Keypresses (0x09)
        Max encryption key size: 16
        Initiator key distribution: EncKey IdKey (0x03)
        Responder key distribution: EncKey IdKey (0x03)
< HCI Command: Host Number of Com.. (0x03|0x0035) plen 5  #181 [hci1] 29.919526
        Num handles: 1
        Handle: 38 Address: B8:7C:99:F9:E0:AE (OUI B8-7C-99)
        Count: 1
< ACL Data TX: Handle 38 flags 0x00 dlen 27               #182 [hci1] 29.919634
< ACL Data TX: Handle 38 flags 0x01 dlen 27               #183 [hci1] 29.919638
< ACL Data TX: Handle 38 flags 0x01 dlen 15               #184 [hci1] 29.919639
      SMP: Pairing Public Key (0x0c) len 64
        X: 68f6ada634ce84d11617383d57f070fe3445c38b33b569efa5eb771a0dc8aea5
        Y: 83c407aaa8337331fdc418e55085d75e6c1c6e5d42f8bf9c18fb5a2a7d4f31aa
> HCI Event: Number of Completed Packets (0x13) plen 5    #185 [hci1] 29.977054
        Num handles: 1
        Handle: 38 Address: B8:7C:99:F9:E0:AE (OUI B8-7C-99)
        Count: 1
        #182: len 27 (3 Kb/s)
        Latency: 57 msec (27-57 msec ~42 msec)
> HCI Event: Number of Completed Packets (0x13) plen 5    #186 [hci1] 29.977556
        Num handles: 1
        Handle: 38 Address: B8:7C:99:F9:E0:AE (OUI B8-7C-99)
        Count: 1
        #183: len 27 (3 Kb/s)
        Latency: 57 msec (27-57 msec ~50 msec)
> HCI Event: Number of Completed Packets (0x13) plen 5    #187 [hci1] 29.978090
        Num handles: 1
        Handle: 38 Address: B8:7C:99:F9:E0:AE (OUI B8-7C-99)
        Count: 1
        #184: len 15 (2 Kb/s)
        Latency: 58 msec (27-58 msec ~54 msec)
> ACL Data RX: Handle 38 flags 0x02 dlen 27               #188 [hci1] 30.047287
> ACL Data RX: Handle 38 flags 0x01 dlen 27               #189 [hci1] 30.047807
> ACL Data RX: Handle 38 flags 0x01 dlen 15               #190 [hci1] 30.048235
      SMP: Pairing Public Key (0x0c) len 64
        X: 9b4ec8ccfbacf45b678a4b17605f562ef582bdd1db38162935b74f4a6aa6ea72
        Y: 7b22b27797c262ebc46a9db552f75d062a83aa7b628c112f1c449e007840d148
< HCI Command: Host Number of Com.. (0x03|0x0035) plen 5  #191 [hci1] 30.059615
        Num handles: 1
        Handle: 38 Address: B8:7C:99:F9:E0:AE (OUI B8-7C-99)
        Count: 1
< HCI Command: Host Number of Com.. (0x03|0x0035) plen 5  #192 [hci1] 30.059722
        Num handles: 1
        Handle: 38 Address: B8:7C:99:F9:E0:AE (OUI B8-7C-99)
        Count: 1
< HCI Command: Host Number of Com.. (0x03|0x0035) plen 5  #193 [hci1] 30.059727
        Num handles: 1
        Handle: 38 Address: B8:7C:99:F9:E0:AE (OUI B8-7C-99)
        Count: 1
> ACL Data RX: Handle 38 flags 0x02 dlen 21               #194 [hci1] 30.117309
      SMP: Pairing Confirm (0x03) len 16
        Confim value: 06019a382a12fc8e1dab70e89c3e3b1d
< HCI Command: Host Number of Com.. (0x03|0x0035) plen 5  #195 [hci1] 30.119499
        Num handles: 1
        Handle: 38 Address: B8:7C:99:F9:E0:AE (OUI B8-7C-99)
        Count: 1
< ACL Data TX: Handle 38 flags 0x00 dlen 21               #196 [hci1] 30.119558
      SMP: Pairing Random (0x04) len 16
        Random value: fd71a45c4a1bcadd27bd58e945097b00
> HCI Event: Number of Completed Packets (0x13) plen 5    #197 [hci1] 30.187124
        Num handles: 1
        Handle: 38 Address: B8:7C:99:F9:E0:AE (OUI B8-7C-99)
        Count: 1
        #196: len 21 (2 Kb/s)
        Latency: 67 msec (27-67 msec ~60 msec)
> ACL Data RX: Handle 38 flags 0x02 dlen 21               #198 [hci1] 30.257311
      SMP: Pairing Random (0x04) len 16
        Random value: 85d9ba3a305c8fb00000000000000000
< HCI Command: Host Number of Com.. (0x03|0x0035) plen 5  #199 [hci1] 30.259581
        Num handles: 1
        Handle: 38 Address: B8:7C:99:F9:E0:AE (OUI B8-7C-99)
        Count: 1
< ACL Data TX: Handle 38 flags 0x00 dlen 21               #200 [hci1] 30.259661
      SMP: Pairing DHKey Check (0x0d) len 16
        E: f01a85b9065c642864efc06d52d29a6e
> HCI Event: Number of Completed Packets (0x13) plen 5    #201 [hci1] 30.327091
        Num handles: 1
        Handle: 38 Address: B8:7C:99:F9:E0:AE (OUI B8-7C-99)
        Count: 1
        #200: len 21 (2 Kb/s)
        Latency: 67 msec (27-67 msec ~64 msec)
> ACL Data RX: Handle 38 flags 0x02 dlen 21               #202 [hci1] 30.607296
      SMP: Pairing DHKey Check (0x0d) len 16
        E: 4fc6ffca97ca21d8bcef17540203f25e
< HCI Command: LE Start Encryption (0x08|0x0019) plen 28  #203 [hci1] 30.619646
        Handle: 38 Address: B8:7C:99:F9:E0:AE (OUI B8-7C-99)
        Random number: 0x0000000000000000
        Encrypted diversifier: 0x0000
        Long term key: 0fbca72830420e1a909be6dae3b93a06
> HCI Event: Command Status (0x0f) plen 4                 #204 [hci1] 30.620557
      LE Start Encryption (0x08|0x0019) ncmd 1
        Status: Success (0x00)
< HCI Command: Host Number of Com.. (0x03|0x0035) plen 5  #205 [hci1] 30.639437
        Num handles: 1
        Handle: 38 Address: B8:7C:99:F9:E0:AE (OUI B8-7C-99)
        Count: 1
> HCI Event: Encryption Change (0x08) plen 4              #206 [hci1] 31.097002
        Status: Success (0x00)
        Handle: 38 Address: B8:7C:99:F9:E0:AE (OUI B8-7C-99)
        Encryption: Enabled with AES-CCM (0x01)
> ACL Data RX: Handle 38 flags 0x02 dlen 21               #207 [hci1] 31.167265
      SMP: Identity Information (0x08) len 16
        Identity resolving key: da4b7d08f4b93afcda04abf838328960
< HCI Command: Host Number of Com.. (0x03|0x0035) plen 5  #208 [hci1] 31.179515
        Num handles: 1
        Handle: 38 Address: B8:7C:99:F9:E0:AE (OUI B8-7C-99)
        Count: 1
> ACL Data RX: Handle 38 flags 0x02 dlen 12               #209 [hci1] 31.237152
      SMP: Identity Address Information (0x09) len 7
        Address: B8:7C:99:F9:E0:AE (OUI B8-7C-99)
< HCI Command: LE Set Address Res.. (0x08|0x002d) plen 1  #210 [hci1] 31.239553
        Address resolution: Disabled (0x00)
> HCI Event: Command Complete (0x0e) plen 4               #211 [hci1] 31.239956
      LE Set Address Resolution Enable (0x08|0x002d) ncmd 1
        Status: Success (0x00)
< HCI Command: LE Add Device To... (0x08|0x0027) plen 39  #212 [hci1] 31.259479
        Address type: Public (0x00)
        Address: B8:7C:99:F9:E0:AE (OUI B8-7C-99)
        Peer identity resolving key: da4b7d08f4b93afcda04abf838328960
        Local identity resolving key: 08aad2e1be87e47b88aeb19de6889efb
