Bluetooth monitor ver 5.72
= Note: Linux version 7.0.0-31-generic (x86_64)                        0.215342
= Note: Bluetooth subsystem version 2.22                               0.215344
= New Index: 00:00:00:00:00:00 (Primary,UART,hci1)              [hci1] 0.215345
= New Index: 48:5F:99:8E:E0:64 (Primary,USB,hci0)               [hci0] 0.215345
= Open Index: 00:00:00:00:00:00                                 [hci1] 0.338655
= Index Info: 00:00:00:00:00:00 (Nordic Semiconductor ASA)      [hci1] 0.338659
@ USER Open: main (privileged) version 2.22            {0x0001} [hci1] 0.338661
< HCI Command: Reset (0x03|0x0003) plen 0                    #1 [hci1] 0.339032
> HCI Event: Command Complete (0x0e) plen 4                  #2 [hci1] 0.339518
      Reset (0x03|0x0003) ncmd 1
        Status: Success (0x00)
< HCI Command: Read Local Supported... (0x04|0x0003) plen 0  #3 [hci1] 0.358662
> HCI Event: Command Complete (0x0e) plen 12                 #4 [hci1] 0.359177
      Read Local Supported Features (0x04|0x0003) ncmd 1
        Status: Success (0x00)
        Features: 0x00 0x00 0x00 0x00 0x60 0x00 0x00 0x00
          BR/EDR Not Supported
          LE Supported (Controller)
< HCI Command: Read Local Version In.. (0x04|0x0001) plen 0  #5 [hci1] 0.378657
> HCI Event: Command Complete (0x0e) plen 12                 #6 [hci1] 0.379109
      Read Local Version Information (0x04|0x0001) ncmd 1
        Status: Success (0x00)
        HCI version: Reserved (0x11) - Revision 12345 (0x3039)
        LMP version: Reserved (0x11) - Subversion 12345 (0x3039)
        Manufacturer: Nordic Semiconductor ASA (89)
< HCI Command: Read Local Supported... (0x04|0x0002) plen 0  #7 [hci1] 0.398658
> HCI Event: Command Complete (0x0e) plen 68                 #8 [hci1] 0.399715
      Read Local Supported Commands (0x04|0x0002) ncmd 1
        Status: Success (0x00)
        Commands: 115 entries
          Disconnect (Octet 0 - Bit 5)
          Read Remote Version Information (Octet 2 - Bit 7)
          Set Event Mask (Octet 5 - Bit 6)
          Reset (Octet 5 - Bit 7)
          Read Connection Accept Timeout (Octet 7 - Bit 2)
          Write Connection Accept Timeout (Octet 7 - Bit 3)
          Read Transmit Power Level (Octet 10 - Bit 2)
          Set Controller To Host Flow Control (Octet 10 - Bit 5)
          Host Buffer Size (Octet 10 - Bit 6)
          Host Number of Completed Packets (Octet 10 - Bit 7)
          Read Local Version Information (Octet 14 - Bit 3)
          Read Local Supported Features (Octet 14 - Bit 5)
          Read BD ADDR (Octet 15 - Bit 1)
          Read RSSI (Octet 15 - Bit 5)
          Set Event Mask Page 2 (Octet 22 - Bit 2)
          LE Set Event Mask (Octet 25 - Bit 0)
          LE Read Buffer Size (Octet 25 - Bit 1)
          LE Read Local Supported Features (Octet 25 - Bit 2)
          LE Set Random Address (Octet 25 - Bit 4)
          LE Set Advertising Parameters (Octet 25 - Bit 5)
          LE Read Advertising Channel TX Power (Octet 25 - Bit 6)
          LE Set Advertising Data (Octet 25 - Bit 7)
          LE Set Scan Response Data (Octet 26 - Bit 0)
          LE Set Advertise Enable (Octet 26 - Bit 1)
          LE Set Scan Parameters (Octet 26 - Bit 2)
          LE Set Scan Enable (Octet 26 - Bit 3)
          LE Create Connection (Octet 26 - Bit 4)
          LE Create Connection Cancel (Octet 26 - Bit 5)
          LE Read Accept List Size (Octet 26 - Bit 6)
          LE Clear Accept List (Octet 26 - Bit 7)
          LE Add Device To Accept List (Octet 27 - Bit 0)
          LE Remove Device From Accept List (Octet 27 - Bit 1)
          LE Connection Update (Octet 27 - Bit 2)
          LE Set Host Channel Classification (Octet 27 - Bit 3)
          LE Read Channel Map (Octet 27 - Bit 4)
          LE Read Remote Used Features (Octet 27 - Bit 5)
          LE Encrypt (Octet 27 - Bit 6)
          LE Rand (Octet 27 - Bit 7)
          LE Start Encryption (Octet 28 - Bit 0)
          LE Long Term Key Request Reply (Octet 28 - Bit 1)
          LE Long Term Key Request Neg Reply (Octet 28 - Bit 2)
          LE Read Supported States (Octet 28 - Bit 3)
          Read Authenticated Payload Timeout (Octet 32 - Bit 4)
          Write Authenticated Payload Timeout (Octet 32 - Bit 5)
          LE Set Data Length (Octet 33 - Bit 6)
          LE Read Suggested Default Data Length (Octet 33 - Bit 7)
          LE Write Suggested Default Data Length (Octet 34 - Bit 0)
          LE Add Device To Resolving List (Octet 34 - Bit 3)
          LE Remove Device From Resolving List (Octet 34 - Bit 4)
          LE Clear Resolving List (Octet 34 - Bit 5)
          LE Read Resolving List Size (Octet 34 - Bit 6)
          LE Set Address Resolution Enable (Octet 35 - Bit 1)
          LE Set Resolvable Private Address Timeout (Octet 35 - Bit 2)
          LE Read Maximum Data Length (Octet 35 - Bit 3)
          LE Read PHY (Octet 35 - Bit 4)
          LE Set Default PHY (Octet 35 - Bit 5)
          LE Set PHY (Octet 35 - Bit 6)
          LE Set Advertising Set Random Address (Octet 36 - Bit 1)
          LE Set Extended Advertising Parameters (Octet 36 - Bit 2)
          LE Set Extended Advertising Data (Octet 36 - Bit 3)
          LE Set Extended Scan Response Data (Octet 36 - Bit 4)
          LE Set Extended Advertising Enable (Octet 36 - Bit 5)
          LE Read Maximum Advertising Data Length (Octet 36 - Bit 6)
          LE Read Number of Supported Advertising Sets (Octet 36 - Bit 7)
          LE Remove Advertising Set (Octet 37 - Bit 0)
          LE Clear Advertising Sets (Octet 37 - Bit 1)
          LE Set Periodic Advertising Parameters (Octet 37 - Bit 2)
          LE Set Periodic Advertising Data (Octet 37 - Bit 3)
          LE Set Periodic Advertising Enable (Octet 37 - Bit 4)
          LE Set Extended Scan Parameters (Octet 37 - Bit 5)
          LE Set Extended Scan Enable (Octet 37 - Bit 6)
          LE Extended Create Connection (Octet 37 - Bit 7)
          LE Periodic Advertising Create Sync (Octet 38 - Bit 0)
          LE Periodic Advertising Create Sync Cancel (Octet 38 - Bit 1)
          LE Periodic Advertising Terminate Sync (Octet 38 - Bit 2)
          LE Add Device To Periodic Advertiser List (Octet 38 - Bit 3)
          LE Remove Device From Periodic Advertiser List (Octet 38 - Bit 4)
          LE Clear Periodic Advertiser List (Octet 38 - Bit 5)
          LE Read Periodic Advertiser List Size (Octet 38 - Bit 6)
          LE Read Transmit Power (Octet 38 - Bit 7)
          LE Read RF Path Compensation (Octet 39 - Bit 0)
          LE Write RF Path Compensation (Octet 39 - Bit 1)
          LE Set Privacy Mode (Octet 39 - Bit 2)
          LE Periodic Advertising Receive Enable (Octet 40 - Bit 5)
          LE Periodic Advertising Sync Transfer (Octet 40 - Bit 6)
          LE Periodic Advertising Set Info Transfer (Octet 40 - Bit 7)
          LE Periodic Advertising Sync Transfer Parameters (Octet 41 - Bit 0)
          LE Set Default Periodic Advertisng Sync Transfer Parameters (Octet 41 - Bit 1)
          LE Read Buffer v2 (Octet 41 - Bit 5)
          LE Read ISO TX Sync (Octet 41 - Bit 6)
          LE Set Connected Isochronous Group Parameters (Octet 41 - Bit 7)
          LE Set Connected Isochronous Group Parameters Test (Octet 42 - Bit 0)
          LE Create Connected Isochronous Stream (Octet 42 - Bit 1)
          LE Remove Connected Isochronous Group (Octet 42 - Bit 2)
          LE Accept Connected Isochronous Stream Request (Octet 42 - Bit 3)
          LE Reject Connected Isochronous Stream Request (Octet 42 - Bit 4)
          LE Create Broadcast Isochronous Group (Octet 42 - Bit 5)
          LE Create Broadcast Isochronous Group Test (Octet 42 - Bit 6)
          LE Terminate Broadcast Isochronous Group (Octet 42 - Bit 7)
          LE Broadcast Isochronous Group Create Sync (Octet 43 - Bit 0)
          LE Broadcast Isochronous Group Terminate Sync (Octet 43 - Bit 1)
          LE Request Peer SCA (Octet 43 - Bit 2)
          LE Setup Isochronous Data Path (Octet 43 - Bit 3)
          LE Remove Isochronous Data Path (Octet 43 - Bit 4)
          LE Isochronous Transmit Test (Octet 43 - Bit 5)
          LE Isochronous Receive Test (Octet 43 - Bit 6)
          LE Isochronous Read Test Counters (Octet 43 - Bit 7)
          LE Isochronous Read Test Counters (Octet 44 - Bit 0)
          LE Set Host Feature (Octet 44 - Bit 1)
          Octet 44 - Bit 2 
          Octet 45 - Bit 6 
          Octet 46 - Bit 0 
          Octet 46 - Bit 1 
          Octet 46 - Bit 2 
          Octet 47 - Bit 4 
< HCI Command: Host Buffer Size (0x03|0x0033) plen 7         #9 [hci1] 0.418665
        ACL MTU: 255  ACL max packet: 16
        SCO MTU: 0    SCO max packet: 0
> HCI Event: Command Complete (0x0e) plen 4                 #10 [hci1] 0.419082
      Host Buffer Size (0x03|0x0033) ncmd 1
        Status: Success (0x00)
< HCI Command: Set Controller To Ho.. (0x03|0x0031) plen 1  #11 [hci1] 0.438660
        Flow control: ACL Data Packets (0x01)
> HCI Event: Command Complete (0x0e) plen 4                 #12 [hci1] 0.439076
      Set Controller To Host Flow Control (0x03|0x0031) ncmd 1
        Status: Success (0x00)
< HCI Command: LE Read Local Suppor.. (0x08|0x0003) plen 0  #13 [hci1] 0.458654
> HCI Event: Command Complete (0x0e) plen 12                #14 [hci1] 0.459106
      LE Read Local Supported Features (0x08|0x0003) ncmd 1
        Status: Success (0x00)
        Features: 0xfd 0x79 0x00 0xf7 0x30 0x01 0x00 0x00
          LE Encryption
          Extended Reject Indication
          Peripheral-initiated Features Exchange
          LE Ping
          LE Data Packet Length Extension
          LL Privacy
          Extended Scanner Filter Policies
          LE 2M PHY
          LE Coded PHY
          LE Extended Advertising
          LE Periodic Advertising
          Channel Selection Algorithm #2
          Periodic Advertising Sync Transfer - Sender
          Periodic Advertising Sync Transfer - Recipient
          Sleep Clock Accuracy Updates
          Connected Isochronous Stream - Central
          Connected Isochronous Stream - Peripheral
          Isochronous Broadcaster
          Synchronized Receiver
          Periodic Advertising ADI support
          Connection Subrating
          Unknown features (0x0000010000000000)
< HCI Command: LE Set Host Feature (0x08|0x0074) plen 2     #15 [hci1] 0.478654
        Bit Number: 32
          Connected Isochronous Stream (Host Support)
        Bit Value: 1
> HCI Event: Command Complete (0x0e) plen 4                 #16 [hci1] 0.479083
      LE Set Host Feature (0x08|0x0074) ncmd 1
        Status: Success (0x00)
< HCI Command: LE Read Buffer v2 (0x08|0x0060) plen 0       #17 [hci1] 0.498638
> HCI Event: Command Complete (0x0e) plen 10                #18 [hci1] 0.499178
      LE Read Buffer v2 (0x08|0x0060) ncmd 1
        Status: Success (0x00)
        ACL MTU: 27
        ACL max packet: 3
        ISO MTU: 318
        ISO max packet: 3
< HCI Command: LE Read Maximum Adve.. (0x08|0x003a) plen 0  #19 [hci1] 0.518703
> HCI Event: Command Complete (0x0e) plen 6                 #20 [hci1] 0.519172
      LE Read Maximum Advertising Data Length (0x08|0x003a) ncmd 1
        Status: Success (0x00)
        Max length: 1650
< HCI Command: LE Read Supported St.. (0x08|0x001c) plen 0  #21 [hci1] 0.538663
> HCI Event: Command Complete (0x0e) plen 12                #22 [hci1] 0.539116
      LE Read Supported States (0x08|0x001c) ncmd 1
        Status: Success (0x00)
        States: 0x000003ff3e0306ff
          Non-connectable Advertising State
          Scannable Advertising State
          Connectable Advertising State
          High Duty Cycle Directed Advertising State
          Passive Scanning State
          Active Scanning State
          Initiating State
            and Connection State (Central Role)
          Connection State (Peripheral Role)
          Scannable Advertising State
            and Passive Scanning State
          Connectable Advertising State
            and Passive Scanning State
          Non-connectable Advertising State
            and Initiating State
          Scannable Advertising State
            and Initiating State
          Active Scanning State
            and Connection State (Central Role)
          Passive Scanning State
            and Connection State (Peripheral Role)
          Active Scanning State
            and Connection State (Peripheral Role)
          Initiating State
            and Connection State (Central Role)
            and Central Role & Central Role
          Low Duty Cycle Directed Advertising State
          Connectable Advertising State
            and Initiating State
            and Central Role & Peripheral Role
          High Duty Cycle Directed Advertising State
            and Initiating State
            and Central Role & Peripheral Role
          Low Duty Cycle Directed Advertising State
            and Initiating State
            and Central Role & Peripheral Role
          Connectable Advertising State
            and Connection State (Central Role)
            and Central Role & Peripheral Role
          High Duty Cycle Directed Advertising State
            and Connection State (Central Role)
            and Central Role & Peripheral Role
          Low Duty Cycle Directed Advertising State
            and Connection State (Central Role)
            and Central Role & Peripheral Role
          Connectable Advertising State
            and Connection State (Peripheral Role)
            and Central Role & Peripheral Role
          High Duty Cycle Directed Advertising State
            and Connection State (Peripheral Role)
            and Peripheral Role & Peripheral Role
          Low Duty Cycle Directed Advertising State
            and Connection State (Peripheral Role)
            and Peripheral Role & Peripheral Role
          Initiating State
            and Connection State (Peripheral Role)
            and Central Role & Peripheral Role
< HCI Command: LE Read Maximum Data.. (0x08|0x002f) plen 0  #23 [hci1] 0.558665
> HCI Event: Command Complete (0x0e) plen 12                #24 [hci1] 0.559091
      LE Read Maximum Data Length (0x08|0x002f) ncmd 1
        Status: Success (0x00)
        Max TX octets: 251
        Max TX time: 2704
        Max RX octets: 251
        Max RX time: 2704
< HCI Command: LE Write Suggested D.. (0x08|0x0024) plen 4  #25 [hci1] 0.578652
        TX octets: 251
        TX time: 2704
> HCI Event: Command Complete (0x0e) plen 4                 #26 [hci1] 0.579166
      LE Write Suggested Default Data Length (0x08|0x0024) ncmd 1
        Status: Success (0x00)
< HCI Command: LE Read Resolving Li.. (0x08|0x002a) plen 0  #27 [hci1] 0.598667
> HCI Event: Command Complete (0x0e) plen 5                 #28 [hci1] 0.599171
      LE Read Resolving List Size (0x08|0x002a) ncmd 1
        Status: Success (0x00)
        Size: 8
< HCI Command: LE Set Host Feature (0x08|0x0074) plen 2     #29 [hci1] 0.618661
        Bit Number: 38
          Connection Subrating (Host Support)
        Bit Value: 1
> HCI Event: Command Complete (0x0e) plen 4                 #30 [hci1] 0.619161
      LE Set Host Feature (0x08|0x0074) ncmd 1
        Status: Success (0x00)
< HCI Command: LE Set Event Mask (0x08|0x0001) plen 8       #31 [hci1] 0.638682
        Mask: 0x000002063f87fa5e
          LE Advertising Report
          LE Connection Update Complete
          LE Read Remote Used Features Complete
          LE Long Term Key Request
          LE Data Length Change
          LE Enhanced Connection Complete
          LE PHY Update Complete
          LE Extended Advertising Report
          LE Periodic Advertising Sync Established
          LE Periodic Advertising Report
          LE Periodic Advertising Sync Lost
          LE Extended Scan Timeout
          LE Extended Advertising Set Terminated
          LE Scan Request Received
          LE Periodic Advertising Sync Transfer Rvc
          LE CIS Established
          LE CIS Request
          LE Create BIG Complete
          LE Terminate BIG Complete
          LE BIG Sync Estabilished Complete
          LE BIG Sync Lost
          LE BIG Info Advertising Report
          LE Subrate Change
          Unknown mask (0x0000020000000000)
> HCI Event: Command Complete (0x0e) plen 4                 #32 [hci1] 0.639167
      LE Set Event Mask (0x08|0x0001) ncmd 1
        Status: Success (0x00)
< HCI Command: Set Event Mask (0x03|0x0001) plen 8          #33 [hci1] 0.658667
        Mask: 0x2000800002008890
          Disconnection Complete
          Encryption Change
          Read Remote Version Information Complete
          Hardware Error
          Data Buffer Overflow
          Encryption Key Refresh Complete
          LE Meta
> HCI Event: Command Complete (0x0e) plen 4                 #34 [hci1] 0.659178
      Set Event Mask (0x03|0x0001) ncmd 1
        Status: Success (0x00)
< HCI Command: Read BD ADDR (0x04|0x0009) plen 0            #35 [hci1] 0.678668
> HCI Event: Command Complete (0x0e) plen 10                #36 [hci1] 0.679084
      Read BD ADDR (0x04|0x0009) ncmd 1
        Status: Success (0x00)
        Address: 00:00:00:00:00:00 (OUI 00-00-00)
< HCI Command: LE Set Random Address (0x08|0x0005) plen 6   #37 [hci1] 0.698677
        Address: D5:B6:CC:31:DB:3B (Static)
> HCI Event: Command Complete (0x0e) plen 4                 #38 [hci1] 0.699082
      LE Set Random Address (0x08|0x0005) ncmd 1
        Status: Success (0x00)
< HCI Command: LE Set Extended Adv.. (0x08|0x0036) plen 25  #39 [hci1] 3.228654
        Handle: 0x00
        Properties: 0x0013
          Connectable
          Scannable
          Use legacy advertising PDUs: ADV_IND
        Min advertising interval: 100.000 msec (0x00a0)
        Max advertising interval: 150.000 msec (0x00f0)
        Channel map: 37, 38, 39 (0x07)
        Own address type: Random (0x01)
        Peer address type: Public (0x00)
        Peer address: 00:00:00:00:00:00 (OUI 00-00-00)
        Filter policy: Allow Scan Request from Any, Allow Connect Request from Any (0x00)
        TX power: Host has no preference (0x7f)
        Primary PHY: LE 1M (0x01)
        Secondary max skip: 0x00
        Secondary PHY: LE 1M (0x01)
        SID: 0x00
        Scan request notifications: Disabled (0x00)
> HCI Event: Command Complete (0x0e) plen 5                 #40 [hci1] 3.229443
      LE Set Extended Advertising Parameters (0x08|0x0036) ncmd 1
        Status: Success (0x00)
        TX power (selected): 0 dbm (0x00)
< HCI Command: LE Set Advertising S.. (0x08|0x0035) plen 7  #41 [hci1] 3.238740
        Advertising handle: 0x00
        Advertising random address: D5:B6:CC:31:DB:3B (Static)
> HCI Event: Command Complete (0x0e) plen 4                 #42 [hci1] 3.239280
      LE Set Advertising Set Random Address (0x08|0x0035) ncmd 1
        Status: Success (0x00)
< HCI Command: LE Set Extended Adv.. (0x08|0x0037) plen 22  #43 [hci1] 3.258710
        Handle: 0x00
        Operation: Complete extended advertising data (0x03)
        Fragment preference: Minimize fragmentation (0x01)
        Data length: 0x12
        Flags: 0x06
          LE General Discoverable Mode
          BR/EDR Not Supported
        Name (complete): Tester_F6B11A
> HCI Event: Command Complete (0x0e) plen 4                 #44 [hci1] 3.259477
      LE Set Extended Advertising Data (0x08|0x0037) ncmd 1
        Status: Success (0x00)
< HCI Command: LE Set Extended Scan.. (0x08|0x0038) plen 4  #45 [hci1] 3.278853
        Handle: 0x00
        Operation: Complete scan response data (0x03)
        Fragment preference: Minimize fragmentation (0x01)
        Data length: 0x00
> HCI Event: Command Complete (0x0e) plen 4                 #46 [hci1] 3.279331
      LE Set Extended Scan Response Data (0x08|0x0038) ncmd 1
        Status: Success (0x00)
< HCI Command: LE Set Extended Adve.. (0x08|0x0039) plen 6  #47 [hci1] 3.298714
        Extended advertising: Enabled (0x01)
        Number of sets: 1 (0x01)
        Entry 0
          Handle: 0x00
          Duration: 0 ms (0x00)
          Max ext adv events: 0
> HCI Event: Command Complete (0x0e) plen 4                 #48 [hci1] 3.299309
      LE Set Extended Advertising Enable (0x08|0x0039) ncmd 1
        Status: Success (0x00)
> HCI Event: LE Meta Event (0x3e) plen 31                   #49 [hci1] 3.415321
      LE Enhanced Connection Complete (0x0a)
        Status: Success (0x00)
        Handle: 1425
        Role: Peripheral (0x01)
        Peer address type: Public (0x00)
        Peer address: DF:A9:FF:F6:B1:1A (OUI DF-A9-FF)
        Local resolvable private address: 00:00:00:00:00:00 (Non-Resolvable)
        Peer resolvable private address: 00:00:00:00:00:00 (Non-Resolvable)
        Connection interval: 60.00 msec (0x0030)
        Connection latency: 0 (0x0000)
        Supervision timeout: 25120 msec (0x09d0)
        Central clock accuracy: 0x01
> HCI Event: LE Meta Event (0x3e) plen 6                    #50 [hci1] 3.415432
      LE Advertising Set Terminated (0x12)
        Status: Success (0x00)
        Handle: 0
        Connection handle: 1425
        Number of completed extended advertising events: 0
< HCI Command: LE Read Remote Used... (0x08|0x0016) plen 2  #51 [hci1] 3.422869
        Handle: 1425 Address: DF:A9:FF:F6:B1:1A (OUI DF-A9-FF)
< ACL Data TX: Handle 1425 flags 0x00 dlen 7                #52 [hci1] 3.422896
      ATT: Exchange MTU Request (0x02) len 2
        Client RX MTU: 251
> HCI Event: Command Status (0x0f) plen 4                   #53 [hci1] 3.423366
      LE Read Remote Used Features (0x08|0x0016) ncmd 1
        Status: Success (0x00)
> HCI Event: Number of Completed Packets (0x13) plen 5      #54 [hci1] 3.536407
        Num handles: 1
        Handle: 1425 Address: DF:A9:FF:F6:B1:1A (OUI DF-A9-FF)
        Count: 1
        #52: len 7 (0 Kb/s)
        Latency: 113 msec (113-113 msec ~113 msec)
> HCI Event: LE Meta Event (0x3e) plen 12                   #55 [hci1] 3.596707
      LE Read Remote Used Features (0x04)
        Status: Success (0x00)
        Handle: 1425 Address: DF:A9:FF:F6:B1:1A (OUI DF-A9-FF)
        Features: 0x2d 0x49 0x00 0xf7 0x67 0xd9 0x00 0x80
          LE Encryption
          Extended Reject Indication
          Peripheral-initiated Features Exchange
          LE Data Packet Length Extension
          LE 2M PHY
          LE Coded PHY
          Channel Selection Algorithm #2
          Periodic Advertising Sync Transfer - Sender
          Periodic Advertising Sync Transfer - Recipient
          Sleep Clock Accuracy Updates
          Connected Isochronous Stream - Central
          Connected Isochronous Stream - Peripheral
          Isochronous Broadcaster
          Synchronized Receiver
          Connected Isochronous Stream (Host Support)
          LE Power Control Request
          LE Power Control Request
          Connection Subrating
          Connection Subrating (Host Support)
          Unknown features (0x8000d90000000000)
> ACL Data RX: Handle 1425 flags 0x02 dlen 7                #56 [hci1] 3.896428
      ATT: Exchange MTU Request (0x02) len 2
        Client RX MTU: 49
> ACL Data RX: Handle 1425 flags 0x02 dlen 7                #57 [hci1] 3.896841
      ATT: Exchange MTU Response (0x03) len 2
        Server RX MTU: 49
< HCI Command: Host Number of Compl.. (0x03|0x0035) plen 5  #58 [hci1] 3.898744
        Num handles: 1
        Handle: 1425 Address: DF:A9:FF:F6:B1:1A (OUI DF-A9-FF)
        Count: 1
< ACL Data TX: Handle 1425 flags 0x00 dlen 7                #59 [hci1] 3.898814
      ATT: Exchange MTU Response (0x03) len 2
        Server RX MTU: 251
< HCI Command: Host Number of Compl.. (0x03|0x0035) plen 5  #60 [hci1] 3.899004
        Num handles: 1
        Handle: 1425 Address: DF:A9:FF:F6:B1:1A (OUI DF-A9-FF)
        Count: 1
> HCI Event: Number of Completed Packets (0x13) plen 5      #61 [hci1] 4.016279
        Num handles: 1
        Handle: 1425 Address: DF:A9:FF:F6:B1:1A (OUI DF-A9-FF)
        Count: 1
        #59: len 7 (0 Kb/s)
        Latency: 117 msec (113-117 msec ~115 msec)
> ACL Data RX: Handle 1425 flags 0x02 dlen 11               #62 [hci1] 5.996447
      SMP: Pairing Request (0x01) len 6
        IO capability: KeyboardDisplay (0x04)
        OOB data: Authentication data not present (0x00)
        Authentication requirement: Bonding, No MITM, SC, No Keypresses (0x09)
        Max encryption key size: 16
        Initiator key distribution: EncKey IdKey (0x03)
        Responder key distribution: EncKey IdKey Sign (0x07)
< HCI Command: Host Number of Compl.. (0x03|0x0035) plen 5  #63 [hci1] 5.999173
        Num handles: 1
        Handle: 1425 Address: DF:A9:FF:F6:B1:1A (OUI DF-A9-FF)
        Count: 1
< ACL Data TX: Handle 1425 flags 0x00 dlen 11               #64 [hci1] 5.999326
      SMP: Pairing Response (0x02) len 6
        IO capability: NoInputNoOutput (0x03)
        OOB data: Authentication data not present (0x00)
        Authentication requirement: Bonding, No MITM, SC, No Keypresses (0x09)
        Max encryption key size: 16
        Initiator key distribution: IdKey (0x02)
        Responder key distribution: <none> (0x00)
> HCI Event: Number of Completed Packets (0x13) plen 5      #65 [hci1] 6.116493
        Num handles: 1
        Handle: 1425 Address: DF:A9:FF:F6:B1:1A (OUI DF-A9-FF)
        Count: 1
        #64: len 11 (0 Kb/s)
        Latency: 117 msec (113-117 msec ~116 msec)
> ACL Data RX: Handle 1425 flags 0x02 dlen 27               #66 [hci1] 6.116820
> ACL Data RX: Handle 1425 flags 0x01 dlen 27               #67 [hci1] 6.117468
> ACL Data RX: Handle 1425 flags 0x01 dlen 15               #68 [hci1] 6.117830
      SMP: Pairing Public Key (0x0c) len 64
        X: 62d909f4357e8afb4b6a0817484979a18224717f424b862f9aeb52f75286b82a
        Y: 2bb77824ef9979a6e21864d96afc1593d70ab099762965002fb002b329056bc8
< HCI Command: Host Number of Compl.. (0x03|0x0035) plen 5  #69 [hci1] 6.119267
        Num handles: 1
        Handle: 1425 Address: DF:A9:FF:F6:B1:1A (OUI DF-A9-FF)
        Count: 1
< HCI Command: Host Number of Compl.. (0x03|0x0035) plen 5  #70 [hci1] 6.119438
        Num handles: 1
        Handle: 1425 Address: DF:A9:FF:F6:B1:1A (OUI DF-A9-FF)
        Count: 1
< HCI Command: Host Number of Compl.. (0x03|0x0035) plen 5  #71 [hci1] 6.119750
        Num handles: 1
        Handle: 1425 Address: DF:A9:FF:F6:B1:1A (OUI DF-A9-FF)
        Count: 1
< ACL Data TX: Handle 1425 flags 0x00 dlen 27               #72 [hci1] 6.119807
< ACL Data TX: Handle 1425 flags 0x01 dlen 27               #73 [hci1] 6.119869
< ACL Data TX: Handle 1425 flags 0x01 dlen 15               #74 [hci1] 6.119879
      SMP: Pairing Public Key (0x0c) len 64
        X: 98308440221e2d910f0e54b71e7ec652857aa9b5a0dc65028824cc19db1226e9
        Y: 67a4816bcb62efb21701e31fdb27561a6217575fb007a8bbdabe7e28b6f68482
> HCI Event: Number of Completed Packets (0x13) plen 5      #75 [hci1] 6.176925
        Num handles: 1
        Handle: 1425 Address: DF:A9:FF:F6:B1:1A (OUI DF-A9-FF)
        Count: 1
        #72: len 27 (3 Kb/s)
        Latency: 57 msec (57-117 msec ~86 msec)
> HCI Event: Number of Completed Packets (0x13) plen 5      #76 [hci1] 6.177630
        Num handles: 1
        Handle: 1425 Address: DF:A9:FF:F6:B1:1A (OUI DF-A9-FF)
        Count: 1
        #73: len 27 (3 Kb/s)
        Latency: 57 msec (57-117 msec ~72 msec)
< ACL Data TX: Handle 1425 flags 0x00 dlen 21               #77 [hci1] 6.178983
      SMP: Pairing Confirm (0x03) len 16
        Confim value: b6d82619dd8caa59065390d3ed2aa773
> HCI Event: Number of Completed Packets (0x13) plen 5      #78 [hci1] 6.236242
        Num handles: 1
        Handle: 1425 Address: DF:A9:FF:F6:B1:1A (OUI DF-A9-FF)
        Count: 1
        #74: len 15 (1 Kb/s)
        Latency: 116 msec (57-117 msec ~94 msec)
> HCI Event: Number of Completed Packets (0x13) plen 5      #79 [hci1] 6.296474
        Num handles: 1
        Handle: 1425 Address: DF:A9:FF:F6:B1:1A (OUI DF-A9-FF)
        Count: 1
        #77: len 21 (1 Kb/s)
        Latency: 117 msec (57-117 msec ~105 msec)
> ACL Data RX: Handle 1425 flags 0x02 dlen 21               #80 [hci1] 6.296815
      SMP: Pairing Random (0x04) len 16
        Random value: ca2c5147404cdfec0000000000000000
< HCI Command: Host Number of Compl.. (0x03|0x0035) plen 5  #81 [hci1] 6.298867
        Num handles: 1
        Handle: 1425 Address: DF:A9:FF:F6:B1:1A (OUI DF-A9-FF)
        Count: 1
< ACL Data TX: Handle 1425 flags 0x00 dlen 21               #82 [hci1] 6.298873
      SMP: Pairing Random (0x04) len 16
        Random value: 8e6108f966a694cbe26df70bb96773e6
> HCI Event: Number of Completed Packets (0x13) plen 5      #83 [hci1] 6.416240
        Num handles: 1
        Handle: 1425 Address: DF:A9:FF:F6:B1:1A (OUI DF-A9-FF)
        Count: 1
        #82: len 21 (1 Kb/s)
        Latency: 117 msec (57-117 msec ~111 msec)
> ACL Data RX: Handle 1425 flags 0x02 dlen 21               #84 [hci1] 6.596605
      SMP: Pairing DHKey Check (0x0d) len 16
        E: 8c9c0810d6bea3ff10b2f1e8ac9d2586
< HCI Command: Host Number of Compl.. (0x03|0x0035) plen 5  #85 [hci1] 6.599521
        Num handles: 1
        Handle: 1425 Address: DF:A9:FF:F6:B1:1A (OUI DF-A9-FF)
        Count: 1
< ACL Data TX: Handle 1425 flags 0x00 dlen 21               #86 [hci1] 6.599639
      SMP: Pairing DHKey Check (0x0d) len 16
        E: 4686f0685ab05950b432adc560e1d383
> HCI Event: Number of Completed Packets (0x13) plen 5      #87 [hci1] 6.716267
        Num handles: 1
        Handle: 1425 Address: DF:A9:FF:F6:B1:1A (OUI DF-A9-FF)
        Count: 1
        #86: len 21 (1 Kb/s)
        Latency: 116 msec (57-117 msec ~114 msec)
> HCI Event: LE Meta Event (0x3e) plen 13                   #88 [hci1] 6.836761
      LE Long Term Key Request (0x05)
        Handle: 1425 Address: DF:A9:FF:F6:B1:1A (OUI DF-A9-FF)
        Random number: 0x0000000000000000
        Encrypted diversifier: 0x0000
< HCI Command: LE Long Term Key Re.. (0x08|0x001a) plen 18  #89 [hci1] 6.842668
        Handle: 1425 Address: DF:A9:FF:F6:B1:1A (OUI DF-A9-FF)
        Long term key: b44964a3d3d2d90d906d4b5d2bcb63e1
> HCI Event: Command Complete (0x0e) plen 6                 #90 [hci1] 6.843285
      LE Long Term Key Request Reply (0x08|0x001a) ncmd 1
        Status: Success (0x00)
        Handle: 1425 Address: DF:A9:FF:F6:B1:1A (OUI DF-A9-FF)
> HCI Event: Encryption Change (0x08) plen 4                #91 [hci1] 7.136464
        Status: Success (0x00)
        Handle: 1425 Address: DF:A9:FF:F6:B1:1A (OUI DF-A9-FF)
        Encryption: Enabled with AES-CCM (0x01)
> ACL Data RX: Handle 1425 flags 0x02 dlen 21               #92 [hci1] 7.196646
      SMP: Identity Information (0x08) len 16
        Identity resolving key: 74821b779b783378f97b15580f556ddc
< ACL Data TX: Handle 1425 flags 0x00 dlen 11               #93 [hci1] 7.249422
      ATT: Read By Type Request (0x08) len 6
        Handle range: 0x0001-0xffff
        Attribute type: Central Address Resolution (0x2aa6)
< HCI Command: Host Number of Compl.. (0x03|0x0035) plen 5  #94 [hci1] 7.249531
        Num handles: 1
        Handle: 1425 Address: DF:A9:FF:F6:B1:1A (OUI DF-A9-FF)
        Count: 1
> HCI Event: Number of Completed Packets (0x13) plen 5      #95 [hci1] 7.316425
        Num handles: 1
        Handle: 1425 Address: DF:A9:FF:F6:B1:1A (OUI DF-A9-FF)
        Count: 1
        #93: len 11 (1 Kb/s)
        Latency: 67 msec (57-117 msec ~90 msec)
> ACL Data RX: Handle 1425 flags 0x02 dlen 12               #96 [hci1] 7.316544
      SMP: Identity Address Information (0x09) len 7
        Address: DF:A9:FF:F6:B1:1A (OUI DF-A9-FF)
< HCI Command: LE Add Device To Re.. (0x08|0x0027) plen 39  #97 [hci1] 7.318833
        Address type: Public (0x00)
        Address: DF:A9:FF:F6:B1:1A (OUI DF-A9-FF)
        Peer identity resolving key: 74821b779b783378f97b15580f556ddc
        Local identity resolving key: 00000000000000000000000000000000
> HCI Event: Command Complete (0x0e) plen 4                 #98 [hci1] 7.319797
      LE Add Device To Resolving List (0x08|0x0027) ncmd 1
        Status: Success (0x00)
< HCI Command: LE Set Privacy Mode (0x08|0x004e) plen 8     #99 [hci1] 7.338749
        Peer Identity address type: Public (0x00)
        Peer Identity address: DF:A9:FF:F6:B1:1A (OUI DF-A9-FF)
        Privacy Mode: Use Device Privacy (0x01)
> HCI Event: Command Complete (0x0e) plen 4                #100 [hci1] 7.339268
      LE Set Privacy Mode (0x08|0x004e) ncmd 1
        Status: Success (0x00)
< HCI Command: LE Set Address Reso.. (0x08|0x002d) plen 1  #101 [hci1] 7.358749
        Address resolution: Enabled (0x01)
> HCI Event: Command Complete (0x0e) plen 4                #102 [hci1] 7.359137
      LE Set Address Resolution Enable (0x08|0x002d) ncmd 1
        Status: Success (0x00)
> ACL Data RX: Handle 1425 flags 0x02 dlen 11              #103 [hci1] 7.376389
      ATT: Read By Group Type Request (0x10) len 6
        Handle range: 0x0001-0xffff
        Attribute group type: Primary Service (0x2800)
< HCI Command: Host Number of Comp.. (0x03|0x0035) plen 5  #104 [hci1] 7.378689
        Num handles: 1
        Handle: 1425 Address: DF:A9:FF:F6:B1:1A (OUI DF-A9-FF)
        Count: 1
< HCI Command: Host Number of Comp.. (0x03|0x0035) plen 5  #105 [hci1] 7.378861
        Num handles: 1
        Handle: 1425 Address: DF:A9:FF:F6:B1:1A (OUI DF-A9-FF)
        Count: 1
< ACL Data TX: Handle 1425 flags 0x00 dlen 27              #106 [hci1] 7.378880
< ACL Data TX: Handle 1425 flags 0x01 dlen 9               #107 [hci1] 7.378882
      ATT: Read By Group Type Response (0x11) len 31
        Attribute data length: 6
        Attribute group list: 5 entries
        Handle range: 0x0001-0x000a
        UUID: Generic Attribute Profile (0x1801)
        Handle range: 0x000b-0x0011
        UUID: Generic Access Profile (0x1800)
        Handle range: 0x0012-0x0026
        UUID: Device Information (0x180a)
        Handle range: 0x0027-0x0029
        UUID: Immediate Alert (0x1802)
        Handle range: 0x002a-0x0032
        UUID: Hearing Aid (0x1854)
> ACL Data RX: Handle 1425 flags 0x02 dlen 9               #108 [hci1] 7.436362
      ATT: Read By Type Response (0x09) len 4
        Attribute data length: 3
        Attribute data list: 1 entry
        Handle: 0x000f
        Value: 01
> HCI Event: Number of Completed Packets (0x13) plen 5     #109 [hci1] 7.436989
        Num handles: 1
        Handle: 1425 Address: DF:A9:FF:F6:B1:1A (OUI DF-A9-FF)
        Count: 1
        #106: len 27 (3 Kb/s)
        Latency: 58 msec (57-117 msec ~74 msec)
< HCI Command: Host Number of Comp.. (0x03|0x0035) plen 5  #110 [hci1] 7.438834
        Num handles: 1
        Handle: 1425 Address: DF:A9:FF:F6:B1:1A (OUI DF-A9-FF)
        Count: 1
> HCI Event: Number of Completed Packets (0x13) plen 5     #111 [hci1] 7.496353
        Num handles: 1
        Handle: 1425 Address: DF:A9:FF:F6:B1:1A (OUI DF-A9-FF)
        Count: 1
        #107: len 9 (0 Kb/s)
        Latency: 117 msec (57-117 msec ~95 msec)
> ACL Data RX: Handle 1425 flags 0x02 dlen 11              #112 [hci1] 7.496553
      ATT: Read By Group Type Request (0x10) len 6
        Handle range: 0x0033-0xffff
        Attribute group type: Primary Service (0x2800)
< HCI Command: Host Number of Comp.. (0x03|0x0035) plen 5  #113 [hci1] 7.498900
        Num handles: 1
        Handle: 1425 Address: DF:A9:FF:F6:B1:1A (OUI DF-A9-FF)
        Count: 1
< ACL Data TX: Handle 1425 flags 0x00 dlen 9               #114 [hci1] 7.498910
      ATT: Error Response (0x01) len 4
        Read By Group Type Request (0x10)
        Handle: 0x0033
        Error: Attribute Not Found (0x0a)
> HCI Event: Number of Completed Packets (0x13) plen 5     #115 [hci1] 7.616471
        Num handles: 1
        Handle: 1425 Address: DF:A9:FF:F6:B1:1A (OUI DF-A9-FF)
        Count: 1
        #114: len 9 (0 Kb/s)
        Latency: 117 msec (57-117 msec ~106 msec)
> ACL Data RX: Handle 1425 flags 0x02 dlen 11              #116 [hci1] 7.616569
      ATT: Read By Type Request (0x08) len 6
        Handle range: 0x0001-0x000a
        Attribute type: Characteristic (0x2803)
< HCI Command: Host Number of Comp.. (0x03|0x0035) plen 5  #117 [hci1] 7.618872
        Num handles: 1
        Handle: 1425 Address: DF:A9:FF:F6:B1:1A (OUI DF-A9-FF)
        Count: 1
< ACL Data TX: Handle 1425 flags 0x00 dlen 27              #118 [hci1] 7.618965
< ACL Data TX: Handle 1425 flags 0x01 dlen 7               #119 [hci1] 7.618969
      ATT: Read By Type Response (0x09) len 29
        Attribute data length: 7
        Attribute data list: 4 entries
        Handle: 0x0002
        Value: 200300052a
            Properties: 0x20
              Indicate (0x20)
            Value Handle: 0x0003
            Value UUID: Service Changed (0x2a05)
        Handle: 0x0005
        Value: 0a0600292b
            Properties: 0x0a
              Read (0x02)
              Write (0x08)
            Value Handle: 0x0006
            Value UUID: Client Supported Features (0x2b29)
        Handle: 0x0007
        Value: 0208002a2b
            Properties: 0x02
              Read (0x02)
            Value Handle: 0x0008
            Value UUID: Database Hash (0x2b2a)
        Handle: 0x0009
        Value: 020a003a2b
            Properties: 0x02
              Read (0x02)
            Value Handle: 0x000a
            Value UUID: Server Supported Features (0x2b3a)
> HCI Event: Number of Completed Packets (0x13) plen 5     #120 [hci1] 7.676938
        Num handles: 1
        Handle: 1425 Address: DF:A9:FF:F6:B1:1A (OUI DF-A9-FF)
        Count: 1
        #118: len 27 (3 Kb/s)
        Latency: 57 msec (57-117 msec ~82 msec)
> HCI Event: Number of Completed Packets (0x13) plen 5     #121 [hci1] 7.736392
        Num handles: 1
        Handle: 1425 Address: DF:A9:FF:F6:B1:1A (OUI DF-A9-FF)
        Count: 1
        #119: len 7 (0 Kb/s)
        Latency: 117 msec (57-117 msec ~99 msec)
> ACL Data RX: Handle 1425 flags 0x02 dlen 11              #122 [hci1] 7.736559
      ATT: Read By Type Request (0x08) len 6
        Handle range: 0x000a-0x000a
        Attribute type: Characteristic (0x2803)
< HCI Command: Host Number of Comp.. (0x03|0x0035) plen 5  #123 [hci1] 7.738934
        Num handles: 1
        Handle: 1425 Address: DF:A9:FF:F6:B1:1A (OUI DF-A9-FF)
        Count: 1
< ACL Data TX: Handle 1425 flags 0x00 dlen 9               #124 [hci1] 7.739004
      ATT: Error Response (0x01) len 4
        Read By Type Request (0x08)
        Handle: 0x000a
        Error: Attribute Not Found (0x0a)
> HCI Event: Number of Completed Packets (0x13) plen 5     #125 [hci1] 7.856322
        Num handles: 1
        Handle: 1425 Address: DF:A9:FF:F6:B1:1A (OUI DF-A9-FF)
        Count: 1
        #124: len 9 (0 Kb/s)
        Latency: 117 msec (57-117 msec ~108 msec)
> ACL Data RX: Handle 1425 flags 0x02 dlen 9               #126 [hci1] 7.856558
      ATT: Find Information Request (0x04) len 4
        Handle range: 0x0004-0x0004
< HCI Command: Host Number of Comp.. (0x03|0x0035) plen 5  #127 [hci1] 7.858972
        Num handles: 1
        Handle: 1425 Address: DF:A9:FF:F6:B1:1A (OUI DF-A9-FF)
        Count: 1
< ACL Data TX: Handle 1425 flags 0x00 dlen 10              #128 [hci1] 7.859010
      ATT: Find Information Response (0x05) len 5
        Format: UUID-16 (0x01)
        Handle: 0x0004
        UUID: Client Characteristic Configuration (0x2902)
> HCI Event: Number of Completed Packets (0x13) plen 5     #129 [hci1] 7.976459
        Num handles: 1
        Handle: 1425 Address: DF:A9:FF:F6:B1:1A (OUI DF-A9-FF)
        Count: 1
        #128: len 10 (0 Kb/s)
        Latency: 117 msec (57-117 msec ~113 msec)
> ACL Data RX: Handle 1425 flags 0x02 dlen 11              #130 [hci1] 7.976579
      ATT: Read By Type Request (0x08) len 6
        Handle range: 0x000b-0x0011
        Attribute type: Characteristic (0x2803)
< HCI Command: Host Number of Comp.. (0x03|0x0035) plen 5  #131 [hci1] 7.979279
        Num handles: 1
        Handle: 1425 Address: DF:A9:FF:F6:B1:1A (OUI DF-A9-FF)
        Count: 1
< ACL Data TX: Handle 1425 flags 0x00 dlen 27              #132 [hci1] 7.979356
      ATT: Read By Type Response (0x09) len 22
        Attribute data length: 7
        Attribute data list: 3 entries
        Handle: 0x000c
        Value: 0a0d00002a
            Properties: 0x0a
              Read (0x02)
              Write (0x08)
            Value Handle: 0x000d
            Value UUID: Device Name (0x2a00)
        Handle: 0x000e
        Value: 0a0f00012a
            Properties: 0x0a
              Read (0x02)
              Write (0x08)
            Value Handle: 0x000f
            Value UUID: Appearance (0x2a01)
        Handle: 0x0010
        Value: 021100042a
            Properties: 0x02
              Read (0x02)
            Value Handle: 0x0011
            Value UUID: Peripheral Preferred Connection Parameters (0x2a04)
> HCI Event: Number of Completed Packets (0x13) plen 5     #133 [hci1] 8.096311
        Num handles: 1
        Handle: 1425 Address: DF:A9:FF:F6:B1:1A (OUI DF-A9-FF)
        Count: 1
        #132: len 27 (1 Kb/s)
        Latency: 116 msec (57-117 msec ~114 msec)
> ACL Data RX: Handle 1425 flags 0x02 dlen 11              #134 [hci1] 8.096683
      ATT: Read By Type Request (0x08) len 6
        Handle range: 0x0011-0x0011
        Attribute type: Characteristic (0x2803)
< HCI Command: Host Number of Comp.. (0x03|0x0035) plen 5  #135 [hci1] 8.099257
        Num handles: 1
        Handle: 1425 Address: DF:A9:FF:F6:B1:1A (OUI DF-A9-FF)
        Count: 1
< ACL Data TX: Handle 1425 flags 0x00 dlen 9               #136 [hci1] 8.099456
      ATT: Error Response (0x01) len 4
        Read By Type Request (0x08)
        Handle: 0x0011
        Error: Attribute Not Found (0x0a)
> HCI Event: Number of Completed Packets (0x13) plen 5     #137 [hci1] 8.216365
        Num handles: 1
        Handle: 1425 Address: DF:A9:FF:F6:B1:1A (OUI DF-A9-FF)
        Count: 1
        #136: len 9 (0 Kb/s)
        Latency: 116 msec (57-117 msec ~115 msec)
> ACL Data RX: Handle 1425 flags 0x02 dlen 11              #138 [hci1] 8.216684
      ATT: Read By Type Request (0x08) len 6
        Handle range: 0x0012-0x0026
        Attribute type: Characteristic (0x2803)
< HCI Command: Host Number of Comp.. (0x03|0x0035) plen 5  #139 [hci1] 8.219373
        Num handles: 1
        Handle: 1425 Address: DF:A9:FF:F6:B1:1A (OUI DF-A9-FF)
        Count: 1
< ACL Data TX: Handle 1425 flags 0x00 dlen 27              #140 [hci1] 8.219471
< ACL Data TX: Handle 1425 flags 0x01 dlen 21              #141 [hci1] 8.219482
      ATT: Read By Type Response (0x09) len 43
        Attribute data length: 7
        Attribute data list: 6 entries
        Handle: 0x0013
        Value: 021400242a
            Properties: 0x02
              Read (0x02)
            Value Handle: 0x0014
            Value UUID: Model Number String (0x2a24)
        Handle: 0x0015
        Value: 021600292a
            Properties: 0x02
              Read (0x02)
            Value Handle: 0x0016
            Value UUID: Manufacturer Name String (0x2a29)
        Handle: 0x0017
        Value: 021800502a
            Properties: 0x02
              Read (0x02)
            Value Handle: 0x0018
            Value UUID: PnP ID (0x2a50)
        Handle: 0x0019
        Value: 021a00252a
            Properties: 0x02
              Read (0x02)
            Value Handle: 0x001a
            Value UUID: Serial Number String (0x2a25)
        Handle: 0x001b
        Value: 021c00262a
            Properties: 0x02
              Read (0x02)
            Value Handle: 0x001c
            Value UUID: Firmware Revision String (0x2a26)
        Handle: 0x001d
        Value: 021e00272a
            Properties: 0x02
              Read (0x02)
            Value Handle: 0x001e
            Value UUID: Hardware Revision String (0x2a27)
> HCI Event: Number of Completed Packets (0x13) plen 5     #142 [hci1] 8.276860
        Num handles: 1
        Handle: 1425 Address: DF:A9:FF:F6:B1:1A (OUI DF-A9-FF)
        Count: 1
        #140: len 27 (3 Kb/s)
        Latency: 57 msec (57-117 msec ~86 msec)
> HCI Event: Number of Completed Packets (0x13) plen 5     #143 [hci1] 8.336355
        Num handles: 1
        Handle: 1425 Address: DF:A9:FF:F6:B1:1A (OUI DF-A9-FF)
        Count: 1
        #141: len 21 (1 Kb/s)
        Latency: 116 msec (57-117 msec ~101 msec)
> ACL Data RX: Handle 1425 flags 0x02 dlen 11              #144 [hci1] 8.336562
      ATT: Read By Type Request (0x08) len 6
        Handle range: 0x001e-0x0026
        Attribute type: Characteristic (0x2803)
< HCI Command: Host Number of Comp.. (0x03|0x0035) plen 5  #145 [hci1] 8.338815
        Num handles: 1
        Handle: 1425 Address: DF:A9:FF:F6:B1:1A (OUI DF-A9-FF)
        Count: 1
< ACL Data TX: Handle 1425 flags 0x00 dlen 27              #146 [hci1] 8.338909
< ACL Data TX: Handle 1425 flags 0x01 dlen 7               #147 [hci1] 8.338915
      ATT: Read By Type Response (0x09) len 29
        Attribute data length: 7
        Attribute data list: 4 entries
        Handle: 0x001f
        Value: 022000282a
            Properties: 0x02
              Read (0x02)
            Value Handle: 0x0020
            Value UUID: Software Revision String (0x2a28)
        Handle: 0x0021
        Value: 022200ff2b
            Properties: 0x02
              Read (0x02)
            Value Handle: 0x0022
            Value UUID: Unknown (0x2bff)
        Handle: 0x0023
        Value: 022400232a
            Properties: 0x02
              Read (0x02)
            Value Handle: 0x0024
            Value UUID: System ID (0x2a23)
        Handle: 0x0025
        Value: 0226002a2a
            Properties: 0x02
              Read (0x02)
            Value Handle: 0x0026
            Value UUID: IEEE 11073-20601 Regulatory Cert. Data List (0x2a2a)
> HCI Event: Number of Completed Packets (0x13) plen 5     #148 [hci1] 8.396862
        Num handles: 1
        Handle: 1425 Address: DF:A9:FF:F6:B1:1A (OUI DF-A9-FF)
        Count: 1
        #146: len 27 (3 Kb/s)
        Latency: 57 msec (57-117 msec ~79 msec)
> HCI Event: Number of Completed Packets (0x13) plen 5     #149 [hci1] 8.456377
        Num handles: 1
        Handle: 1425 Address: DF:A9:FF:F6:B1:1A (OUI DF-A9-FF)
        Count: 1
        #147: len 7 (0 Kb/s)
        Latency: 117 msec (57-117 msec ~98 msec)
> ACL Data RX: Handle 1425 flags 0x02 dlen 11              #150 [hci1] 8.456544
      ATT: Read By Type Request (0x08) len 6
        Handle range: 0x0026-0x0026
        Attribute type: Characteristic (0x2803)
< HCI Command: Host Number of Comp.. (0x03|0x0035) plen 5  #151 [hci1] 8.458958
        Num handles: 1
        Handle: 1425 Address: DF:A9:FF:F6:B1:1A (OUI DF-A9-FF)
        Count: 1
< ACL Data TX: Handle 1425 flags 0x00 dlen 9               #152 [hci1] 8.459034
      ATT: Error Response (0x01) len 4
        Read By Type Request (0x08)
        Handle: 0x0026
        Error: Attribute Not Found (0x0a)
> HCI Event: Number of Completed Packets (0x13) plen 5     #153 [hci1] 8.576441
        Num handles: 1
        Handle: 1425 Address: DF:A9:FF:F6:B1:1A (OUI DF-A9-FF)
        Count: 1
        #152: len 9 (0 Kb/s)
        Latency: 117 msec (57-117 msec ~108 msec)
> ACL Data RX: Handle 1425 flags 0x02 dlen 11              #154 [hci1] 8.576562
      ATT: Read By Type Request (0x08) len 6
        Handle range: 0x0027-0x0029
        Attribute type: Characteristic (0x2803)
< HCI Command: Host Number of Comp.. (0x03|0x0035) plen 5  #155 [hci1] 8.579052
        Num handles: 1
        Handle: 1425 Address: DF:A9:FF:F6:B1:1A (OUI DF-A9-FF)
        Count: 1
< ACL Data TX: Handle 1425 flags 0x00 dlen 13              #156 [hci1] 8.579093
      ATT: Read By Type Response (0x09) len 8
        Attribute data length: 7
        Attribute data list: 1 entry
        Handle: 0x0028
        Value: 042900062a
            Properties: 0x04
              Write Without Response (0x04)
            Value Handle: 0x0029
            Value UUID: Alert Level (0x2a06)
> HCI Event: Number of Completed Packets (0x13) plen 5     #157 [hci1] 8.696365
        Num handles: 1
        Handle: 1425 Address: DF:A9:FF:F6:B1:1A (OUI DF-A9-FF)
        Count: 1
        #156: len 13 (0 Kb/s)
        Latency: 117 msec (57-117 msec ~112 msec)
> ACL Data RX: Handle 1425 flags 0x02 dlen 11              #158 [hci1] 8.696596
      ATT: Read By Type Request (0x08) len 6
        Handle range: 0x0029-0x0029
        Attribute type: Characteristic (0x2803)
< HCI Command: Host Number of Comp.. (0x03|0x0035) plen 5  #159 [hci1] 8.698975
        Num handles: 1
        Handle: 1425 Address: DF:A9:FF:F6:B1:1A (OUI DF-A9-FF)
        Count: 1
< ACL Data TX: Handle 1425 flags 0x00 dlen 9               #160 [hci1] 8.699077
      ATT: Error Response (0x01) len 4
        Read By Type Request (0x08)
        Handle: 0x0029
        Error: Attribute Not Found (0x0a)
> HCI Event: Number of Completed Packets (0x13) plen 5     #161 [hci1] 8.816348
        Num handles: 1
        Handle: 1425 Address: DF:A9:FF:F6:B1:1A (OUI DF-A9-FF)
        Count: 1
        #160: len 9 (0 Kb/s)
        Latency: 117 msec (57-117 msec ~114 msec)
> ACL Data RX: Handle 1425 flags 0x02 dlen 11              #162 [hci1] 8.816610
      ATT: Read By Type Request (0x08) len 6
        Handle range: 0x002a-0x0032
        Attribute type: Characteristic (0x2803)
< HCI Command: Host Number of Comp.. (0x03|0x0035) plen 5  #163 [hci1] 8.818850
        Num handles: 1
        Handle: 1425 Address: DF:A9:FF:F6:B1:1A (OUI DF-A9-FF)
        Count: 1
< ACL Data TX: Handle 1425 flags 0x00 dlen 27              #164 [hci1] 8.818856
      ATT: Read By Type Response (0x09) len 22
        Attribute data length: 7
        Attribute data list: 3 entries
        Handle: 0x002b
        Value: 022c00da2b
            Properties: 0x02
              Read (0x02)
            Value Handle: 0x002c
            Value UUID: Hearing Aid Features (0x2bda)
        Handle: 0x002d
        Value: 282e00db2b
            Properties: 0x28
              Write (0x08)
              Indicate (0x20)
            Value Handle: 0x002e
            Value UUID: Hearing Aid Preset Control Point (0x2bdb)
        Handle: 0x0030
        Value: 123100dc2b
            Properties: 0x12
              Read (0x02)
              Notify (0x10)
            Value Handle: 0x0031
            Value UUID: Active Preset Index (0x2bdc)
> HCI Event: Number of Completed Packets (0x13) plen 5     #165 [hci1] 8.936326
        Num handles: 1
        Handle: 1425 Address: DF:A9:FF:F6:B1:1A (OUI DF-A9-FF)
        Count: 1
        #164: len 27 (1 Kb/s)
        Latency: 117 msec (57-117 msec ~116 msec)
> ACL Data RX: Handle 1425 flags 0x02 dlen 11              #166 [hci1] 8.936564
      ATT: Read By Type Request (0x08) len 6
        Handle range: 0x0031-0x0032
        Attribute type: Characteristic (0x2803)
< HCI Command: Host Number of Comp.. (0x03|0x0035) plen 5  #167 [hci1] 8.939348
        Num handles: 1
        Handle: 1425 Address: DF:A9:FF:F6:B1:1A (OUI DF-A9-FF)
        Count: 1
< ACL Data TX: Handle 1425 flags 0x00 dlen 9               #168 [hci1] 8.939540
      ATT: Error Response (0x01) len 4
        Read By Type Request (0x08)
        Handle: 0x0031
        Error: Attribute Not Found (0x0a)
> HCI Event: Number of Completed Packets (0x13) plen 5     #169 [hci1] 9.056312
        Num handles: 1
        Handle: 1425 Address: DF:A9:FF:F6:B1:1A (OUI DF-A9-FF)
        Count: 1
        #168: len 9 (0 Kb/s)
        Latency: 116 msec (57-117 msec ~116 msec)
> ACL Data RX: Handle 1425 flags 0x02 dlen 9               #170 [hci1] 9.056547
      ATT: Find Information Request (0x04) len 4
        Handle range: 0x002f-0x002f
< HCI Command: Host Number of Comp.. (0x03|0x0035) plen 5  #171 [hci1] 9.059349
        Num handles: 1
        Handle: 1425 Address: DF:A9:FF:F6:B1:1A (OUI DF-A9-FF)
        Count: 1
< ACL Data TX: Handle 1425 flags 0x00 dlen 10              #172 [hci1] 9.059453
      ATT: Find Information Response (0x05) len 5
        Format: UUID-16 (0x01)
        Handle: 0x002f
        UUID: Client Characteristic Configuration (0x2902)
> HCI Event: Number of Completed Packets (0x13) plen 5     #173 [hci1] 9.176428
        Num handles: 1
        Handle: 1425 Address: DF:A9:FF:F6:B1:1A (OUI DF-A9-FF)
        Count: 1
        #172: len 10 (0 Kb/s)
        Latency: 116 msec (57-117 msec ~116 msec)
> ACL Data RX: Handle 1425 flags 0x02 dlen 9               #174 [hci1] 9.176579
      ATT: Find Information Request (0x04) len 4
        Handle range: 0x0032-0x0032
< HCI Command: Host Number of Comp.. (0x03|0x0035) plen 5  #175 [hci1] 9.179148
        Num handles: 1
        Handle: 1425 Address: DF:A9:FF:F6:B1:1A (OUI DF-A9-FF)
        Count: 1
< ACL Data TX: Handle 1425 flags 0x00 dlen 10              #176 [hci1] 9.179218
      ATT: Find Information Response (0x05) len 5
        Format: UUID-16 (0x01)
        Handle: 0x0032
        UUID: Client Characteristic Configuration (0x2902)
> HCI Event: Number of Completed Packets (0x13) plen 5     #177 [hci1] 9.296358
        Num handles: 1
        Handle: 1425 Address: DF:A9:FF:F6:B1:1A (OUI DF-A9-FF)
        Count: 1
        #176: len 10 (0 Kb/s)
        Latency: 117 msec (57-117 msec ~116 msec)
> ACL Data RX: Handle 1425 flags 0x02 dlen 11              #178 [hci1] 9.296561
      ATT: Read By Type Request (0x08) len 6
        Handle range: 0x0001-0xffff
        Attribute type: Include (0x2802)
< HCI Command: Host Number of Comp.. (0x03|0x0035) plen 5  #179 [hci1] 9.298889
        Num handles: 1
        Handle: 1425 Address: DF:A9:FF:F6:B1:1A (OUI DF-A9-FF)
        Count: 1
< ACL Data TX: Handle 1425 flags 0x00 dlen 9               #180 [hci1] 9.298991
      ATT: Error Response (0x01) len 4
        Read By Type Request (0x08)
        Handle: 0x0001
        Error: Attribute Not Found (0x0a)
> HCI Event: Number of Completed Packets (0x13) plen 5     #181 [hci1] 9.416346
        Num handles: 1
        Handle: 1425 Address: DF:A9:FF:F6:B1:1A (OUI DF-A9-FF)
        Count: 1
        #180: len 9 (0 Kb/s)
        Latency: 117 msec (57-117 msec ~117 msec)
> ACL Data RX: Handle 1425 flags 0x02 dlen 9               #182 [hci1] 9.416515
      ATT: Write Request (0x12) len 4
        Handle: 0x002f Type: Client Characteristic Configuration (0x2902)
        Value Handle: 0x0031 Type: Active Preset Index (0x2bdc)
          Data: 0000
< HCI Command: Host Number of Comp.. (0x03|0x0035) plen 5  #183 [hci1] 9.418887
        Num handles: 1
        Handle: 1425 Address: DF:A9:FF:F6:B1:1A (OUI DF-A9-FF)
        Count: 1
< ACL Data TX: Handle 1425 flags 0x00 dlen 5               #184 [hci1] 9.418955
      ATT: Write Response (0x13) len 0
> HCI Event: Number of Completed Packets (0x13) plen 5     #185 [hci1] 9.536320
        Num handles: 1
        Handle: 1425 Address: DF:A9:FF:F6:B1:1A (OUI DF-A9-FF)
        Count: 1
        #184: len 5 (0 Kb/s)
        Latency: 117 msec (57-117 msec ~117 msec)
> ACL Data RX: Handle 1425 flags 0x02 dlen 9               #186 [hci1] 9.536540
      ATT: Write Request (0x12) len 4
        Handle: 0x002f Type: Client Characteristic Configuration (0x2902)
        Value Handle: 0x0031 Type: Active Preset Index (0x2bdc)
          Data: 0200
            Indication (0x02)
< HCI Command: Host Number of Comp.. (0x03|0x0035) plen 5  #187 [hci1] 9.539089
        Num handles: 1
        Handle: 1425 Address: DF:A9:FF:F6:B1:1A (OUI DF-A9-FF)
        Count: 1
< ACL Data TX: Handle 1425 flags 0x00 dlen 5               #188 [hci1] 9.539212
      ATT: Write Response (0x13) len 0
> HCI Event: Number of Completed Packets (0x13) plen 5     #189 [hci1] 9.656299
        Num handles: 1
        Handle: 1425 Address: DF:A9:FF:F6:B1:1A (OUI DF-A9-FF)
        Count: 1
        #188: len 5 (0 Kb/s)
        Latency: 117 msec (57-117 msec ~117 msec)
> ACL Data RX: Handle 1425 flags 0x02 dlen 9               #190 [hci1] 9.656492
      ATT: Write Request (0x12) len 4
        Handle: 0x0032 Type: Client Characteristic Configuration (0x2902)
        Value Handle: 0x0031 Type: Active Preset Index (0x2bdc)
          Data: 0000
< HCI Command: Host Number of Comp.. (0x03|0x0035) plen 5  #191 [hci1] 9.659012
        Num handles: 1
        Handle: 1425 Address: DF:A9:FF:F6:B1:1A (OUI DF-A9-FF)
        Count: 1
< ACL Data TX: Handle 1425 flags 0x00 dlen 5               #192 [hci1] 9.659040
      ATT: Write Response (0x13) len 0
> HCI Event: Number of Completed Packets (0x13) plen 5     #193 [hci1] 9.776347
        Num handles: 1
        Handle: 1425 Address: DF:A9:FF:F6:B1:1A (OUI DF-A9-FF)
        Count: 1
        #192: len 5 (0 Kb/s)
        Latency: 117 msec (57-117 msec ~117 msec)
> ACL Data RX: Handle 1425 flags 0x02 dlen 9               #194 [hci1] 9.776520
      ATT: Write Request (0x12) len 4
        Handle: 0x0032 Type: Client Characteristic Configuration (0x2902)
        Value Handle: 0x0031 Type: Active Preset Index (0x2bdc)
          Data: 0100
            Notification (0x01)
< HCI Command: Host Number of Comp.. (0x03|0x0035) plen 5  #195 [hci1] 9.778971
        Num handles: 1
        Handle: 1425 Address: DF:A9:FF:F6:B1:1A (OUI DF-A9-FF)
        Count: 1
< ACL Data TX: Handle 1425 flags 0x00 dlen 5               #196 [hci1] 9.779000
      ATT: Write Response (0x13) len 0
> HCI Event: Number of Completed Packets (0x13) plen 5     #197 [hci1] 9.896316
        Num handles: 1
        Handle: 1425 Address: DF:A9:FF:F6:B1:1A (OUI DF-A9-FF)
        Count: 1
        #196: len 5 (0 Kb/s)
        Latency: 117 msec (57-117 msec ~117 msec)
> ACL Data RX: Handle 1425 flags 0x02 dlen 7               #198 [hci1] 9.896382
      ATT: Read Request (0x0a) len 2
        Handle: 0x002c Type: Hearing Aid Features (0x2bda)
< HCI Command: Host Number of Comp.. (0x03|0x0035) plen 5  #199 [hci1] 9.899018
        Num handles: 1
        Handle: 1425 Address: DF:A9:FF:F6:B1:1A (OUI DF-A9-FF)
        Count: 1
< ACL Data TX: Handle 1425 flags 0x00 dlen 6               #200 [hci1] 9.899050
      ATT: Read Response (0x0b) len 1
> HCI Event: Number of Completed Packets (0x13) plen 5    #201 [hci1] 10.016244
        Num handles: 1
        Handle: 1425 Address: DF:A9:FF:F6:B1:1A (OUI DF-A9-FF)
        Count: 1
        #200: len 6 (0 Kb/s)
        Latency: 117 msec (57-117 msec ~117 msec)
> HCI Event: Disconnect Complete (0x05) plen 4            #202 [hci1] 11.396471
        Status: Success (0x00)
        Handle: 1425 Address: DF:A9:FF:F6:B1:1A (OUI DF-A9-FF)
        Reason: Remote User Terminated Connection (0x13)
< HCI Command: Reset (0x03|0x0003) plen 0                 #203 [hci1] 15.778853
> HCI Event: Command Complete (0x0e) plen 4               #204 [hci1] 15.779318
      Reset (0x03|0x0003) ncmd 1
        Status: Success (0x00)
@ USER Close: main                                    {0x0001} [hci1] 15.798742
= Close Index: 00:00:00:00:00:00                               [hci1] 15.802185
