Bluetooth monitor ver 5.72
= Note: Linux version 6.14.0-36-generic (x86_64)                       0.940381
= Note: Bluetooth subsystem version 2.22                               0.940383
= New Index: 00:00:00:00:00:00 (Primary,UART,hci1)              [hci1] 0.940384
= New Index: 48:5F:99:8E:E0:64 (Primary,USB,hci0)               [hci0] 0.940385
= Open Index: 00:00:00:00:00:00                                 [hci1] 1.083816
= Index Info: 00:00:00:00:00:00 (Nordic Semiconductor ASA)      [hci1] 1.083828
@ USER Open: main (privileged) version 2.22            {0x0001} [hci1] 1.083835
< HCI Command: Reset (0x03|0x0003) plen 0                    #1 [hci1] 1.084699
> HCI Event: Command Complete (0x0e) plen 4                  #2 [hci1] 1.085180
      Reset (0x03|0x0003) ncmd 1
        Status: Success (0x00)
< HCI Command: Read Local Supported... (0x04|0x0003) plen 0  #3 [hci1] 1.103560
> HCI Event: Command Complete (0x0e) plen 12                 #4 [hci1] 1.104035
      Read Local Supported Features (0x04|0x0003) ncmd 1
        Status: Success (0x00)
        Features: 0x00 0x00 0x00 0x00 0x60 0x00 0x00 0x00
          BR/EDR Not Supported
          LE Supported (Controller)
< HCI Command: Read Local Version In.. (0x04|0x0001) plen 0  #5 [hci1] 1.123566
> HCI Event: Command Complete (0x0e) plen 12                 #6 [hci1] 1.124047
      Read Local Version Information (0x04|0x0001) ncmd 1
        Status: Success (0x00)
        HCI version: Reserved (0x0f) - Revision 12393 (0x3069)
        LMP version: Reserved (0x0f) - Subversion 12393 (0x3069)
        Manufacturer: Nordic Semiconductor ASA (89)
< HCI Command: Read Local Supported... (0x04|0x0002) plen 0  #7 [hci1] 1.143529
> HCI Event: Command Complete (0x0e) plen 68                 #8 [hci1] 1.144612
      Read Local Supported Commands (0x04|0x0002) ncmd 1
        Status: Success (0x00)
        Commands: 119 entries
          Disconnect (Octet 0 - Bit 5)
          Read Remote Version Information (Octet 2 - Bit 7)
          Set Event Mask (Octet 5 - Bit 6)
          Reset (Octet 5 - Bit 7)
          Read Connection Accept Timeout (Octet 7 - Bit 2)
          Write Connection Accept Timeout (Octet 7 - Bit 3)
          Read Transmit Power Level (Octet 10 - Bit 2)
          Set Controller To Host Flow Control (Octet 10 - Bit 5)
          Host Buffer Size (Octet 10 - Bit 6)
          Host Number of Completed Packets (Octet 10 - Bit 7)
          Read Local Version Information (Octet 14 - Bit 3)
          Read Local Supported Features (Octet 14 - Bit 5)
          Read BD ADDR (Octet 15 - Bit 1)
          Read RSSI (Octet 15 - Bit 5)
          Set Event Mask Page 2 (Octet 22 - Bit 2)
          LE Set Event Mask (Octet 25 - Bit 0)
          LE Read Buffer Size (Octet 25 - Bit 1)
          LE Read Local Supported Features (Octet 25 - Bit 2)
          LE Set Random Address (Octet 25 - Bit 4)
          LE Set Advertising Parameters (Octet 25 - Bit 5)
          LE Read Advertising Channel TX Power (Octet 25 - Bit 6)
          LE Set Advertising Data (Octet 25 - Bit 7)
          LE Set Scan Response Data (Octet 26 - Bit 0)
          LE Set Advertise Enable (Octet 26 - Bit 1)
          LE Set Scan Parameters (Octet 26 - Bit 2)
          LE Set Scan Enable (Octet 26 - Bit 3)
          LE Create Connection (Octet 26 - Bit 4)
          LE Create Connection Cancel (Octet 26 - Bit 5)
          LE Read Accept List Size (Octet 26 - Bit 6)
          LE Clear Accept List (Octet 26 - Bit 7)
          LE Add Device To Accept List (Octet 27 - Bit 0)
          LE Remove Device From Accept List (Octet 27 - Bit 1)
          LE Connection Update (Octet 27 - Bit 2)
          LE Set Host Channel Classification (Octet 27 - Bit 3)
          LE Read Channel Map (Octet 27 - Bit 4)
          LE Read Remote Used Features (Octet 27 - Bit 5)
          LE Encrypt (Octet 27 - Bit 6)
          LE Rand (Octet 27 - Bit 7)
          LE Start Encryption (Octet 28 - Bit 0)
          LE Long Term Key Request Reply (Octet 28 - Bit 1)
          LE Long Term Key Request Neg Reply (Octet 28 - Bit 2)
          LE Read Supported States (Octet 28 - Bit 3)
          LE Receiver Test (Octet 28 - Bit 4)
          LE Transmitter Test (Octet 28 - Bit 5)
          LE Test End (Octet 28 - Bit 6)
          Read Authenticated Payload Timeout (Octet 32 - Bit 4)
          Write Authenticated Payload Timeout (Octet 32 - Bit 5)
          LE Set Data Length (Octet 33 - Bit 6)
          LE Read Suggested Default Data Length (Octet 33 - Bit 7)
          LE Write Suggested Default Data Length (Octet 34 - Bit 0)
          LE Add Device To Resolving List (Octet 34 - Bit 3)
          LE Remove Device From Resolving List (Octet 34 - Bit 4)
          LE Clear Resolving List (Octet 34 - Bit 5)
          LE Read Resolving List Size (Octet 34 - Bit 6)
          LE Set Address Resolution Enable (Octet 35 - Bit 1)
          LE Set Resolvable Private Address Timeout (Octet 35 - Bit 2)
          LE Read Maximum Data Length (Octet 35 - Bit 3)
          LE Read PHY (Octet 35 - Bit 4)
          LE Set Default PHY (Octet 35 - Bit 5)
          LE Set PHY (Octet 35 - Bit 6)
          LE Enhanced Receiver Test (Octet 35 - Bit 7)
          LE Enhanced Transmitter Test (Octet 36 - Bit 0)
          LE Set Advertising Set Random Address (Octet 36 - Bit 1)
          LE Set Extended Advertising Parameters (Octet 36 - Bit 2)
          LE Set Extended Advertising Data (Octet 36 - Bit 3)
          LE Set Extended Scan Response Data (Octet 36 - Bit 4)
          LE Set Extended Advertising Enable (Octet 36 - Bit 5)
          LE Read Maximum Advertising Data Length (Octet 36 - Bit 6)
          LE Read Number of Supported Advertising Sets (Octet 36 - Bit 7)
          LE Remove Advertising Set (Octet 37 - Bit 0)
          LE Clear Advertising Sets (Octet 37 - Bit 1)
          LE Set Periodic Advertising Parameters (Octet 37 - Bit 2)
          LE Set Periodic Advertising Data (Octet 37 - Bit 3)
          LE Set Periodic Advertising Enable (Octet 37 - Bit 4)
          LE Set Extended Scan Parameters (Octet 37 - Bit 5)
          LE Set Extended Scan Enable (Octet 37 - Bit 6)
          LE Extended Create Connection (Octet 37 - Bit 7)
          LE Periodic Advertising Create Sync (Octet 38 - Bit 0)
          LE Periodic Advertising Create Sync Cancel (Octet 38 - Bit 1)
          LE Periodic Advertising Terminate Sync (Octet 38 - Bit 2)
          LE Add Device To Periodic Advertiser List (Octet 38 - Bit 3)
          LE Remove Device From Periodic Advertiser List (Octet 38 - Bit 4)
          LE Clear Periodic Advertiser List (Octet 38 - Bit 5)
          LE Read Periodic Advertiser List Size (Octet 38 - Bit 6)
          LE Read Transmit Power (Octet 38 - Bit 7)
          LE Read RF Path Compensation (Octet 39 - Bit 0)
          LE Write RF Path Compensation (Octet 39 - Bit 1)
          LE Set Privacy Mode (Octet 39 - Bit 2)
          LE Periodic Advertising Receive Enable (Octet 40 - Bit 5)
          LE Periodic Advertising Sync Transfer (Octet 40 - Bit 6)
          LE Periodic Advertising Set Info Transfer (Octet 40 - Bit 7)
          LE Periodic Advertising Sync Transfer Parameters (Octet 41 - Bit 0)
          LE Set Default Periodic Advertisng Sync Transfer Parameters (Octet 41 - Bit 1)
          LE Read Buffer v2 (Octet 41 - Bit 5)
          LE Read ISO TX Sync (Octet 41 - Bit 6)
          LE Set Connected Isochronous Group Parameters (Octet 41 - Bit 7)
          LE Set Connected Isochronous Group Parameters Test (Octet 42 - Bit 0)
          LE Create Connected Isochronous Stream (Octet 42 - Bit 1)
          LE Remove Connected Isochronous Group (Octet 42 - Bit 2)
          LE Accept Connected Isochronous Stream Request (Octet 42 - Bit 3)
          LE Reject Connected Isochronous Stream Request (Octet 42 - Bit 4)
          LE Create Broadcast Isochronous Group (Octet 42 - Bit 5)
          LE Create Broadcast Isochronous Group Test (Octet 42 - Bit 6)
          LE Terminate Broadcast Isochronous Group (Octet 42 - Bit 7)
          LE Broadcast Isochronous Group Create Sync (Octet 43 - Bit 0)
          LE Broadcast Isochronous Group Terminate Sync (Octet 43 - Bit 1)
          LE Request Peer SCA (Octet 43 - Bit 2)
          LE Setup Isochronous Data Path (Octet 43 - Bit 3)
          LE Remove Isochronous Data Path (Octet 43 - Bit 4)
          LE Isochronous Transmit Test (Octet 43 - Bit 5)
          LE Isochronous Receive Test (Octet 43 - Bit 6)
          LE Isochronous Read Test Counters (Octet 43 - Bit 7)
          LE Isochronous Read Test Counters (Octet 44 - Bit 0)
          LE Set Host Feature (Octet 44 - Bit 1)
          Octet 44 - Bit 2 
          Octet 45 - Bit 6 
          Octet 46 - Bit 0 
          Octet 46 - Bit 1 
          Octet 46 - Bit 2 
< HCI Command: Host Buffer Size (0x03|0x0033) plen 7         #9 [hci1] 1.163508
        ACL MTU: 255  ACL max packet: 16
        SCO MTU: 0    SCO max packet: 0
> HCI Event: Command Complete (0x0e) plen 4                 #10 [hci1] 1.164090
      Host Buffer Size (0x03|0x0033) ncmd 1
        Status: Success (0x00)
< HCI Command: Set Controller To Ho.. (0x03|0x0031) plen 1  #11 [hci1] 1.183528
        Flow control: ACL Data Packets (0x01)
> HCI Event: Command Complete (0x0e) plen 4                 #12 [hci1] 1.183934
      Set Controller To Host Flow Control (0x03|0x0031) ncmd 1
        Status: Success (0x00)
< HCI Command: LE Read Local Suppor.. (0x08|0x0003) plen 0  #13 [hci1] 1.203518
> HCI Event: Command Complete (0x0e) plen 12                #14 [hci1] 1.203993
      LE Read Local Supported Features (0x08|0x0003) ncmd 1
        Status: Success (0x00)
        Features: 0xfd 0x79 0x00 0xf7 0x30 0x01 0x00 0x00
          LE Encryption
          Extended Reject Indication
          Peripheral-initiated Features Exchange
          LE Ping
          LE Data Packet Length Extension
          LL Privacy
          Extended Scanner Filter Policies
          LE 2M PHY
          LE Coded PHY
          LE Extended Advertising
          LE Periodic Advertising
          Channel Selection Algorithm #2
          Periodic Advertising Sync Transfer - Sender
          Periodic Advertising Sync Transfer - Recipient
          Sleep Clock Accuracy Updates
          Connected Isochronous Stream - Central
          Connected Isochronous Stream - Peripheral
          Isochronous Broadcaster
          Synchronized Receiver
          Periodic Advertising ADI support
          Connection Subrating
          Unknown features (0x0000010000000000)
< HCI Command: LE Set Host Feature (0x08|0x0074) plen 2     #15 [hci1] 1.223513
        Bit Number: 32
          Connected Isochronous Stream (Host Support)
        Bit Value: 1
> HCI Event: Command Complete (0x0e) plen 4                 #16 [hci1] 1.223989
      LE Set Host Feature (0x08|0x0074) ncmd 1
        Status: Success (0x00)
< HCI Command: LE Read Buffer v2 (0x08|0x0060) plen 0       #17 [hci1] 1.243452
> HCI Event: Command Complete (0x0e) plen 10                #18 [hci1] 1.243977
      LE Read Buffer v2 (0x08|0x0060) ncmd 1
        Status: Success (0x00)
        ACL MTU: 27
        ACL max packet: 3
        ISO MTU: 318
        ISO max packet: 3
< HCI Command: LE Read Maximum Adve.. (0x08|0x003a) plen 0  #19 [hci1] 1.263521
> HCI Event: Command Complete (0x0e) plen 6                 #20 [hci1] 1.263950
      LE Read Maximum Advertising Data Length (0x08|0x003a) ncmd 1
        Status: Success (0x00)
        Max length: 1650
< HCI Command: LE Read Supported St.. (0x08|0x001c) plen 0  #21 [hci1] 1.283521
> HCI Event: Command Complete (0x0e) plen 12                #22 [hci1] 1.283986
      LE Read Supported States (0x08|0x001c) ncmd 1
        Status: Success (0x00)
        States: 0x000003ff3e0306ff
          Non-connectable Advertising State
          Scannable Advertising State
          Connectable Advertising State
          High Duty Cycle Directed Advertising State
          Passive Scanning State
          Active Scanning State
          Initiating State
            and Connection State (Central Role)
          Connection State (Peripheral Role)
          Scannable Advertising State
            and Passive Scanning State
          Connectable Advertising State
            and Passive Scanning State
          Non-connectable Advertising State
            and Initiating State
          Scannable Advertising State
            and Initiating State
          Active Scanning State
            and Connection State (Central Role)
          Passive Scanning State
            and Connection State (Peripheral Role)
          Active Scanning State
            and Connection State (Peripheral Role)
          Initiating State
            and Connection State (Central Role)
            and Central Role & Central Role
          Low Duty Cycle Directed Advertising State
          Connectable Advertising State
            and Initiating State
            and Central Role & Peripheral Role
          High Duty Cycle Directed Advertising State
            and Initiating State
            and Central Role & Peripheral Role
          Low Duty Cycle Directed Advertising State
            and Initiating State
            and Central Role & Peripheral Role
          Connectable Advertising State
            and Connection State (Central Role)
            and Central Role & Peripheral Role
          High Duty Cycle Directed Advertising State
            and Connection State (Central Role)
            and Central Role & Peripheral Role
          Low Duty Cycle Directed Advertising State
            and Connection State (Central Role)
            and Central Role & Peripheral Role
          Connectable Advertising State
            and Connection State (Peripheral Role)
            and Central Role & Peripheral Role
          High Duty Cycle Directed Advertising State
            and Connection State (Peripheral Role)
            and Peripheral Role & Peripheral Role
          Low Duty Cycle Directed Advertising State
            and Connection State (Peripheral Role)
            and Peripheral Role & Peripheral Role
          Initiating State
            and Connection State (Peripheral Role)
            and Central Role & Peripheral Role
< HCI Command: LE Read Maximum Data.. (0x08|0x002f) plen 0  #23 [hci1] 1.303509
> HCI Event: Command Complete (0x0e) plen 12                #24 [hci1] 1.304036
      LE Read Maximum Data Length (0x08|0x002f) ncmd 1
        Status: Success (0x00)
        Max TX octets: 251
        Max TX time: 2704
        Max RX octets: 251
        Max RX time: 2704
< HCI Command: LE Write Suggested D.. (0x08|0x0024) plen 4  #25 [hci1] 1.323464
        TX octets: 251
        TX time: 2704
> HCI Event: Command Complete (0x0e) plen 4                 #26 [hci1] 1.323934
      LE Write Suggested Default Data Length (0x08|0x0024) ncmd 1
        Status: Success (0x00)
< HCI Command: LE Read Resolving Li.. (0x08|0x002a) plen 0  #27 [hci1] 1.343555
> HCI Event: Command Complete (0x0e) plen 5                 #28 [hci1] 1.343987
      LE Read Resolving List Size (0x08|0x002a) ncmd 1
        Status: Success (0x00)
        Size: 8
< HCI Command: LE Set Host Feature (0x08|0x0074) plen 2     #29 [hci1] 1.363531
        Bit Number: 38
          Connection Subrating (Host Support)
        Bit Value: 1
> HCI Event: Command Complete (0x0e) plen 4                 #30 [hci1] 1.364007
      LE Set Host Feature (0x08|0x0074) ncmd 1
        Status: Success (0x00)
< HCI Command: LE Set Event Mask (0x08|0x0001) plen 8       #31 [hci1] 1.383505
        Mask: 0x000002063f87fa5e
          LE Advertising Report
          LE Connection Update Complete
          LE Read Remote Used Features Complete
          LE Long Term Key Request
          LE Data Length Change
          LE Enhanced Connection Complete
          LE PHY Update Complete
          LE Extended Advertising Report
          LE Periodic Advertising Sync Established
          LE Periodic Advertising Report
          LE Periodic Advertising Sync Lost
          LE Extended Scan Timeout
          LE Extended Advertising Set Terminated
          LE Scan Request Received
          LE Periodic Advertising Sync Transfer Rvc
          LE CIS Established
          LE CIS Request
          LE Create BIG Complete
          LE Terminate BIG Complete
          LE BIG Sync Estabilished Complete
          LE BIG Sync Lost
          LE BIG Info Advertising Report
          LE Subrate Change
          Unknown mask (0x0000020000000000)
> HCI Event: Command Complete (0x0e) plen 4                 #32 [hci1] 1.384060
      LE Set Event Mask (0x08|0x0001) ncmd 1
        Status: Success (0x00)
< HCI Command: Set Event Mask (0x03|0x0001) plen 8          #33 [hci1] 1.403517
        Mask: 0x2000800002008890
          Disconnection Complete
          Encryption Change
          Read Remote Version Information Complete
          Hardware Error
          Data Buffer Overflow
          Encryption Key Refresh Complete
          LE Meta
> HCI Event: Command Complete (0x0e) plen 4                 #34 [hci1] 1.404097
      Set Event Mask (0x03|0x0001) ncmd 1
        Status: Success (0x00)
< HCI Command: Read BD ADDR (0x04|0x0009) plen 0            #35 [hci1] 1.423479
> HCI Event: Command Complete (0x0e) plen 10                #36 [hci1] 1.423950
      Read BD ADDR (0x04|0x0009) ncmd 1
        Status: Success (0x00)
        Address: 00:00:00:00:00:00 (OUI 00-00-00)
< HCI Command: LE Set Random Address (0x08|0x0005) plen 6   #37 [hci1] 1.443505
        Address: D5:B6:CC:31:DB:3B (Static)
> HCI Event: Command Complete (0x0e) plen 4                 #38 [hci1] 1.444017
      LE Set Random Address (0x08|0x0005) ncmd 1
        Status: Success (0x00)
< HCI Command: LE Set Extended Adv.. (0x08|0x0036) plen 25  #39 [hci1] 5.893578
        Handle: 0x00
        Properties: 0x0013
          Connectable
          Scannable
          Use legacy advertising PDUs: ADV_IND
        Min advertising interval: 100.000 msec (0x00a0)
        Max advertising interval: 150.000 msec (0x00f0)
        Channel map: 37, 38, 39 (0x07)
        Own address type: Random (0x01)
        Peer address type: Public (0x00)
        Peer address: 00:00:00:00:00:00 (OUI 00-00-00)
        Filter policy: Allow Scan Request from Any, Allow Connect Request from Any (0x00)
        TX power: Host has no preference (0x7f)
        Primary PHY: LE 1M (0x01)
        Secondary max skip: 0x00
        Secondary PHY: LE 1M (0x01)
        SID: 0x00
        Scan request notifications: Disabled (0x00)
> HCI Event: Command Complete (0x0e) plen 5                 #40 [hci1] 5.894352
      LE Set Extended Advertising Parameters (0x08|0x0036) ncmd 1
        Status: Success (0x00)
        TX power (selected): 0 dbm (0x00)
< HCI Command: LE Set Advertising S.. (0x08|0x0035) plen 7  #41 [hci1] 5.903481
        Advertising handle: 0x00
        Advertising random address: D5:B6:CC:31:DB:3B (Static)
> HCI Event: Command Complete (0x0e) plen 4                 #42 [hci1] 5.903952
      LE Set Advertising Set Random Address (0x08|0x0035) ncmd 1
        Status: Success (0x00)
< HCI Command: LE Set Extended Adv.. (0x08|0x0037) plen 22  #43 [hci1] 5.923551
        Handle: 0x00
        Operation: Complete extended advertising data (0x03)
        Fragment preference: Minimize fragmentation (0x01)
        Data length: 0x12
        Flags: 0x04
          BR/EDR Not Supported
        Name (complete): Tester_F6B11A
> HCI Event: Command Complete (0x0e) plen 4                 #44 [hci1] 5.924287
      LE Set Extended Advertising Data (0x08|0x0037) ncmd 1
        Status: Success (0x00)
< HCI Command: LE Set Extended Scan.. (0x08|0x0038) plen 4  #45 [hci1] 5.943566
        Handle: 0x00
        Operation: Complete scan response data (0x03)
        Fragment preference: Minimize fragmentation (0x01)
        Data length: 0x00
> HCI Event: Command Complete (0x0e) plen 4                 #46 [hci1] 5.944057
      LE Set Extended Scan Response Data (0x08|0x0038) ncmd 1
        Status: Success (0x00)
< HCI Command: LE Set Extended Adve.. (0x08|0x0039) plen 6  #47 [hci1] 5.963595
        Extended advertising: Enabled (0x01)
        Number of sets: 1 (0x01)
        Entry 0
          Handle: 0x00
          Duration: 0 ms (0x00)
          Max ext adv events: 0
> HCI Event: Command Complete (0x0e) plen 4                 #48 [hci1] 5.964230
      LE Set Extended Advertising Enable (0x08|0x0039) ncmd 1
        Status: Success (0x00)
> HCI Event: LE Meta Event (0x3e) plen 31                   #49 [hci1] 6.697701
      LE Enhanced Connection Complete (0x0a)
        Status: Success (0x00)
        Handle: 1083
        Role: Peripheral (0x01)
        Peer address type: Public (0x00)
        Peer address: DF:A9:FF:F6:B1:1A (OUI DF-A9-FF)
        Local resolvable private address: 00:00:00:00:00:00 (Non-Resolvable)
        Peer resolvable private address: 00:00:00:00:00:00 (Non-Resolvable)
        Connection interval: 87.50 msec (0x0046)
        Connection latency: 0 (0x0000)
        Supervision timeout: 20000 msec (0x07d0)
        Central clock accuracy: 0x01
> HCI Event: LE Meta Event (0x3e) plen 6                    #50 [hci1] 6.697880
      LE Advertising Set Terminated (0x12)
        Status: Success (0x00)
        Handle: 0
        Connection handle: 1083
        Number of completed extended advertising events: 0
< HCI Command: LE Read Remote Used... (0x08|0x0016) plen 2  #51 [hci1] 6.703792
        Handle: 1083 Address: DF:A9:FF:F6:B1:1A (OUI DF-A9-FF)
> HCI Event: Command Status (0x0f) plen 4                   #52 [hci1] 6.704214
      LE Read Remote Used Features (0x08|0x0016) ncmd 1
        Status: Success (0x00)
> HCI Event: LE Meta Event (0x3e) plen 12                   #53 [hci1] 6.961721
      LE Read Remote Used Features (0x04)
        Status: Success (0x00)
        Handle: 1083 Address: DF:A9:FF:F6:B1:1A (OUI DF-A9-FF)
        Features: 0x2d 0x49 0x00 0xf7 0x67 0xd9 0x00 0x80
          LE Encryption
          Extended Reject Indication
          Peripheral-initiated Features Exchange
          LE Data Packet Length Extension
          LE 2M PHY
          LE Coded PHY
          Channel Selection Algorithm #2
          Periodic Advertising Sync Transfer - Sender
          Periodic Advertising Sync Transfer - Recipient
          Sleep Clock Accuracy Updates
          Connected Isochronous Stream - Central
          Connected Isochronous Stream - Peripheral
          Isochronous Broadcaster
          Synchronized Receiver
          Connected Isochronous Stream (Host Support)
          LE Power Control Request
          LE Power Control Request
          Connection Subrating
          Connection Subrating (Host Support)
          Unknown features (0x8000d90000000000)
> ACL Data RX: Handle 1083 flags 0x02 dlen 11               #54 [hci1] 9.411318
      SMP: Pairing Request (0x01) len 6
        IO capability: KeyboardDisplay (0x04)
        OOB data: Authentication data not present (0x00)
        Authentication requirement: Bonding, No MITM, SC, No Keypresses (0x09)
        Max encryption key size: 16
        Initiator key distribution: EncKey IdKey (0x03)
        Responder key distribution: EncKey IdKey Sign (0x07)
< HCI Command: Host Number of Compl.. (0x03|0x0035) plen 5  #55 [hci1] 9.423715
        Num handles: 1
        Handle: 1083 Address: DF:A9:FF:F6:B1:1A (OUI DF-A9-FF)
        Count: 1
< ACL Data TX: Handle 1083 flags 0x00 dlen 11               #56 [hci1] 9.423759
      SMP: Pairing Response (0x02) len 6
        IO capability: NoInputNoOutput (0x03)
        OOB data: Authentication data not present (0x00)
        Authentication requirement: Bonding, No MITM, SC, No Keypresses (0x09)
        Max encryption key size: 16
        Initiator key distribution: IdKey (0x02)
        Responder key distribution: <none> (0x00)
> HCI Event: Number of Completed Packets (0x13) plen 5      #57 [hci1] 9.586411
        Num handles: 1
        Handle: 1083 Address: DF:A9:FF:F6:B1:1A (OUI DF-A9-FF)
        Count: 1
        #56: len 11 (0 Kb/s)
        Latency: 162 msec (162-162 msec ~162 msec)
> ACL Data RX: Handle 1083 flags 0x02 dlen 27               #58 [hci1] 9.586711
> ACL Data RX: Handle 1083 flags 0x01 dlen 27               #59 [hci1] 9.587266
> ACL Data RX: Handle 1083 flags 0x01 dlen 15               #60 [hci1] 9.587726
      SMP: Pairing Public Key (0x0c) len 64
        X: 80aa28ccc63bf008fc000fa48d2ce0c4fe1ef0891b98683ca18ea02f400c6e0d
        Y: 977299e3d2c0e225a193358998aa4b187207f38c034da3bde20cb340a5e8de10
< HCI Command: Host Number of Compl.. (0x03|0x0035) plen 5  #61 [hci1] 9.603842
        Num handles: 1
        Handle: 1083 Address: DF:A9:FF:F6:B1:1A (OUI DF-A9-FF)
        Count: 1
< HCI Command: Host Number of Compl.. (0x03|0x0035) plen 5  #62 [hci1] 9.603952
        Num handles: 1
        Handle: 1083 Address: DF:A9:FF:F6:B1:1A (OUI DF-A9-FF)
        Count: 1
< HCI Command: Host Number of Compl.. (0x03|0x0035) plen 5  #63 [hci1] 9.604074
        Num handles: 1
        Handle: 1083 Address: DF:A9:FF:F6:B1:1A (OUI DF-A9-FF)
        Count: 1
< ACL Data TX: Handle 1083 flags 0x00 dlen 27               #64 [hci1] 9.604101
< ACL Data TX: Handle 1083 flags 0x01 dlen 27               #65 [hci1] 9.604110
< ACL Data TX: Handle 1083 flags 0x01 dlen 15               #66 [hci1] 9.604119
      SMP: Pairing Public Key (0x0c) len 64
        X: 98308440221e2d910f0e54b71e7ec652857aa9b5a0dc65028824cc19db1226e9
        Y: 67a4816bcb62efb21701e31fdb27561a6217575fb007a8bbdabe7e28b6f68482
> HCI Event: Number of Completed Packets (0x13) plen 5      #67 [hci1] 9.674263
        Num handles: 1
        Handle: 1083 Address: DF:A9:FF:F6:B1:1A (OUI DF-A9-FF)
        Count: 1
        #64: len 27 (3 Kb/s)
        Latency: 70 msec (70-162 msec ~116 msec)
> HCI Event: Number of Completed Packets (0x13) plen 5      #68 [hci1] 9.675006
        Num handles: 1
        Handle: 1083 Address: DF:A9:FF:F6:B1:1A (OUI DF-A9-FF)
        Count: 1
        #65: len 27 (3 Kb/s)
        Latency: 70 msec (70-162 msec ~93 msec)
< ACL Data TX: Handle 1083 flags 0x00 dlen 21               #69 [hci1] 9.683636
      SMP: Pairing Confirm (0x03) len 16
        Confim value: 6d12a94cd2a7651d5a3b09704877ad7e
> HCI Event: Number of Completed Packets (0x13) plen 5      #70 [hci1] 9.761119
        Num handles: 1
        Handle: 1083 Address: DF:A9:FF:F6:B1:1A (OUI DF-A9-FF)
        Count: 1
        #66: len 15 (0 Kb/s)
        Latency: 157 msec (70-162 msec ~125 msec)
> HCI Event: Number of Completed Packets (0x13) plen 5      #71 [hci1] 9.848855
        Num handles: 1
        Handle: 1083 Address: DF:A9:FF:F6:B1:1A (OUI DF-A9-FF)
        Count: 1
        #69: len 21 (1 Kb/s)
        Latency: 165 msec (70-165 msec ~145 msec)
> ACL Data RX: Handle 1083 flags 0x02 dlen 21               #72 [hci1] 9.849176
      SMP: Pairing Random (0x04) len 16
        Random value: ad780325aaa27aa30000000000000000
< HCI Command: Host Number of Compl.. (0x03|0x0035) plen 5  #73 [hci1] 9.863942
        Num handles: 1
        Handle: 1083 Address: DF:A9:FF:F6:B1:1A (OUI DF-A9-FF)
        Count: 1
< ACL Data TX: Handle 1083 flags 0x00 dlen 21               #74 [hci1] 9.864027
      SMP: Pairing Random (0x04) len 16
        Random value: 8e6108f966a694cbe26df70bb96773e6
> HCI Event: Number of Completed Packets (0x13) plen 5     #75 [hci1] 10.023798
        Num handles: 1
        Handle: 1083 Address: DF:A9:FF:F6:B1:1A (OUI DF-A9-FF)
        Count: 1
        #74: len 21 (1 Kb/s)
        Latency: 159 msec (70-165 msec ~152 msec)
> ACL Data RX: Handle 1083 flags 0x02 dlen 21              #76 [hci1] 10.198998
      SMP: Pairing DHKey Check (0x0d) len 16
        E: 52847b66a398f3de3fb5f2f56fa17433
< HCI Command: Host Number of Comp.. (0x03|0x0035) plen 5  #77 [hci1] 10.203828
        Num handles: 1
        Handle: 1083 Address: DF:A9:FF:F6:B1:1A (OUI DF-A9-FF)
        Count: 1
< ACL Data TX: Handle 1083 flags 0x00 dlen 21              #78 [hci1] 10.203859
      SMP: Pairing DHKey Check (0x0d) len 16
        E: 713cb42fd05a908852fc1c2f519ca994
> HCI Event: Number of Completed Packets (0x13) plen 5     #79 [hci1] 10.373725
        Num handles: 1
        Handle: 1083 Address: DF:A9:FF:F6:B1:1A (OUI DF-A9-FF)
        Count: 1
        #78: len 21 (0 Kb/s)
        Latency: 169 msec (70-169 msec ~161 msec)
> HCI Event: LE Meta Event (0x3e) plen 13                  #80 [hci1] 10.461839
      LE Long Term Key Request (0x05)
        Handle: 1083 Address: DF:A9:FF:F6:B1:1A (OUI DF-A9-FF)
        Random number: 0x0000000000000000
        Encrypted diversifier: 0x0000
< HCI Command: LE Long Term Key R.. (0x08|0x001a) plen 18  #81 [hci1] 10.464064
        Handle: 1083 Address: DF:A9:FF:F6:B1:1A (OUI DF-A9-FF)
        Long term key: ef2deaca3761627d0af86cf35655c5fd
> HCI Event: Command Complete (0x0e) plen 6                #82 [hci1] 10.464852
      LE Long Term Key Request Reply (0x08|0x001a) ncmd 1
        Status: Success (0x00)
        Handle: 1083 Address: DF:A9:FF:F6:B1:1A (OUI DF-A9-FF)
> HCI Event: Encryption Change (0x08) plen 4               #83 [hci1] 10.898997
        Status: Success (0x00)
        Handle: 1083 Address: DF:A9:FF:F6:B1:1A (OUI DF-A9-FF)
        Encryption: Enabled with AES-CCM (0x01)
> ACL Data RX: Handle 1083 flags 0x02 dlen 21              #84 [hci1] 10.986558
      SMP: Identity Information (0x08) len 16
        Identity resolving key: a8e60cea933c0644eb430550ea1d2cf5
< HCI Command: Host Number of Comp.. (0x03|0x0035) plen 5  #85 [hci1] 11.013966
        Num handles: 1
        Handle: 1083 Address: DF:A9:FF:F6:B1:1A (OUI DF-A9-FF)
        Count: 1
> ACL Data RX: Handle 1083 flags 0x02 dlen 12              #86 [hci1] 11.073913
      SMP: Identity Address Information (0x09) len 7
        Address: DF:A9:FF:F6:B1:1A (OUI DF-A9-FF)
> ACL Data RX: Handle 1083 flags 0x02 dlen 13              #87 [hci1] 11.074455
      ATT: Find By Type Value Request (0x06) len 8
        Handle range: 0x0001-0xffff
        Attribute type: Primary Service (0x2800)
          UUID: Object Transfer (0x1825)
< HCI Command: LE Add Device To R.. (0x08|0x0027) plen 39  #88 [hci1] 11.083870
        Address type: Public (0x00)
        Address: DF:A9:FF:F6:B1:1A (OUI DF-A9-FF)
        Peer identity resolving key: a8e60cea933c0644eb430550ea1d2cf5
        Local identity resolving key: 00000000000000000000000000000000
> HCI Event: Command Complete (0x0e) plen 4                #89 [hci1] 11.084819
      LE Add Device To Resolving List (0x08|0x0027) ncmd 1
        Status: Success (0x00)
< HCI Command: LE Set Privacy Mode (0x08|0x004e) plen 8    #90 [hci1] 11.103682
        Peer Identity address type: Public (0x00)
        Peer Identity address: DF:A9:FF:F6:B1:1A (OUI DF-A9-FF)
        Privacy Mode: Use Device Privacy (0x01)
> HCI Event: Command Complete (0x0e) plen 4                #91 [hci1] 11.104199
      LE Set Privacy Mode (0x08|0x004e) ncmd 1
        Status: Success (0x00)
< HCI Command: LE Set Address Reso.. (0x08|0x002d) plen 1  #92 [hci1] 11.123719
        Address resolution: Enabled (0x01)
> HCI Event: Command Complete (0x0e) plen 4                #93 [hci1] 11.124131
      LE Set Address Resolution Enable (0x08|0x002d) ncmd 1
        Status: Success (0x00)
< HCI Command: Host Number of Comp.. (0x03|0x0035) plen 5  #94 [hci1] 11.143674
        Num handles: 1
        Handle: 1083 Address: DF:A9:FF:F6:B1:1A (OUI DF-A9-FF)
        Count: 1
< HCI Command: Host Number of Comp.. (0x03|0x0035) plen 5  #95 [hci1] 11.143931
        Num handles: 1
        Handle: 1083 Address: DF:A9:FF:F6:B1:1A (OUI DF-A9-FF)
        Count: 1
< ACL Data TX: Handle 1083 flags 0x00 dlen 9               #96 [hci1] 11.144021
      ATT: Find By Type Value Response (0x07) len 4
        Handle range: 0x0027-0x0039
> HCI Event: Number of Completed Packets (0x13) plen 5     #97 [hci1] 11.248820
        Num handles: 1
        Handle: 1083 Address: DF:A9:FF:F6:B1:1A (OUI DF-A9-FF)
        Count: 1
        #96: len 9 (0 Kb/s)
        Latency: 104 msec (70-169 msec ~132 msec)
> ACL Data RX: Handle 1083 flags 0x02 dlen 13              #98 [hci1] 11.249041
      ATT: Find By Type Value Request (0x06) len 8
        Handle range: 0x003a-0xffff
        Attribute type: Primary Service (0x2800)
          UUID: Object Transfer (0x1825)
< HCI Command: Host Number of Comp.. (0x03|0x0035) plen 5  #99 [hci1] 11.263795
        Num handles: 1
        Handle: 1083 Address: DF:A9:FF:F6:B1:1A (OUI DF-A9-FF)
        Count: 1
< ACL Data TX: Handle 1083 flags 0x00 dlen 9              #100 [hci1] 11.263867
      ATT: Error Response (0x01) len 4
        Find By Type Value Request (0x06)
        Handle: 0x003a
        Error: Attribute Not Found (0x0a)
> HCI Event: Number of Completed Packets (0x13) plen 5    #101 [hci1] 11.423759
        Num handles: 1
        Handle: 1083 Address: DF:A9:FF:F6:B1:1A (OUI DF-A9-FF)
        Count: 1
        #100: len 9 (0 Kb/s)
        Latency: 159 msec (70-169 msec ~146 msec)
> ACL Data RX: Handle 1083 flags 0x02 dlen 11             #102 [hci1] 11.424009
      ATT: Read By Type Request (0x08) len 6
        Handle range: 0x0027-0x0039
        Attribute type: Characteristic (0x2803)
< HCI Command: Host Number of Com.. (0x03|0x0035) plen 5  #103 [hci1] 11.443772
        Num handles: 1
        Handle: 1083 Address: DF:A9:FF:F6:B1:1A (OUI DF-A9-FF)
        Count: 1
< ACL Data TX: Handle 1083 flags 0x00 dlen 20             #104 [hci1] 11.443801
      ATT: Read By Type Response (0x09) len 15
        Attribute data length: 7
        Attribute data list: 2 entries
        Handle: 0x0028
        Value: 022900bd2a
            Properties: 0x02
              Read (0x02)
            Value Handle: 0x0029
            Value UUID: OTS Feature (0x2abd)
        Handle: 0x002a
        Value: 0a2b00be2a
            Properties: 0x0a
              Read (0x02)
              Write (0x08)
            Value Handle: 0x002b
            Value UUID: Object Name (0x2abe)
> HCI Event: Number of Completed Packets (0x13) plen 5    #105 [hci1] 11.598769
        Num handles: 1
        Handle: 1083 Address: DF:A9:FF:F6:B1:1A (OUI DF-A9-FF)
        Count: 1
        #104: len 20 (1 Kb/s)
        Latency: 154 msec (70-169 msec ~150 msec)
> ACL Data RX: Handle 1083 flags 0x02 dlen 11             #106 [hci1] 11.599037
      ATT: Read By Type Request (0x08) len 6
        Handle range: 0x002b-0x0039
        Attribute type: Characteristic (0x2803)
< HCI Command: Host Number of Com.. (0x03|0x0035) plen 5  #107 [hci1] 11.603801
        Num handles: 1
        Handle: 1083 Address: DF:A9:FF:F6:B1:1A (OUI DF-A9-FF)
        Count: 1
< ACL Data TX: Handle 1083 flags 0x00 dlen 20             #108 [hci1] 11.603883
      ATT: Read By Type Response (0x09) len 15
        Attribute data length: 7
        Attribute data list: 2 entries
        Handle: 0x002c
        Value: 022d00bf2a
            Properties: 0x02
              Read (0x02)
            Value Handle: 0x002d
            Value UUID: Object Type (0x2abf)
        Handle: 0x002e
        Value: 022f00c02a
            Properties: 0x02
              Read (0x02)
            Value Handle: 0x002f
            Value UUID: Object Size (0x2ac0)
< ACL Data TX: Handle 1083 flags 0x00 dlen 16             #109 [hci1] 11.713601
      LE L2CAP: Connection Parameter Update Request (0x12) ident 1 len 8
        Min interval: 24
        Max interval: 40
        Peripheral latency: 0
        Timeout multiplier: 42
> HCI Event: Number of Completed Packets (0x13) plen 5    #110 [hci1] 11.773772
        Num handles: 1
        Handle: 1083 Address: DF:A9:FF:F6:B1:1A (OUI DF-A9-FF)
        Count: 1
        #108: len 20 (0 Kb/s)
        Latency: 169 msec (70-169 msec ~160 msec)
> ACL Data RX: Handle 1083 flags 0x02 dlen 11             #111 [hci1] 11.773933
      ATT: Read By Type Request (0x08) len 6
        Handle range: 0x002f-0x0039
        Attribute type: Characteristic (0x2803)
< HCI Command: Host Number of Com.. (0x03|0x0035) plen 5  #112 [hci1] 11.783800
        Num handles: 1
        Handle: 1083 Address: DF:A9:FF:F6:B1:1A (OUI DF-A9-FF)
        Count: 1
< ACL Data TX: Handle 1083 flags 0x00 dlen 20             #113 [hci1] 11.783865
      ATT: Read By Type Response (0x09) len 15
        Attribute data length: 7
        Attribute data list: 2 entries
        Handle: 0x0030
        Value: 023100c32a
            Properties: 0x02
              Read (0x02)
            Value Handle: 0x0031
            Value UUID: Object ID (0x2ac3)
        Handle: 0x0032
        Value: 023300c42a
            Properties: 0x02
              Read (0x02)
            Value Handle: 0x0033
            Value UUID: Object Properties (0x2ac4)
> HCI Event: Number of Completed Packets (0x13) plen 5    #114 [hci1] 11.861296
        Num handles: 1
        Handle: 1083 Address: DF:A9:FF:F6:B1:1A (OUI DF-A9-FF)
        Count: 1
        #109: len 16 (0 Kb/s)
        Latency: 147 msec (70-169 msec ~153 msec)
> ACL Data RX: Handle 1083 flags 0x02 dlen 10             #115 [hci1] 11.861390
      LE L2CAP: Connection Parameter Update Response (0x13) ident 1 len 2
        Result: Connection Parameters accepted (0x0000)
< HCI Command: Host Number of Com.. (0x03|0x0035) plen 5  #116 [hci1] 11.864125
        Num handles: 1
        Handle: 1083 Address: DF:A9:FF:F6:B1:1A (OUI DF-A9-FF)
        Count: 1
> HCI Event: Number of Completed Packets (0x13) plen 5    #117 [hci1] 11.948785
        Num handles: 1
        Handle: 1083 Address: DF:A9:FF:F6:B1:1A (OUI DF-A9-FF)
        Count: 1
        #113: len 20 (0 Kb/s)
        Latency: 164 msec (70-169 msec ~159 msec)
> ACL Data RX: Handle 1083 flags 0x02 dlen 11             #118 [hci1] 11.949052
      ATT: Read By Type Request (0x08) len 6
        Handle range: 0x0033-0x0039
        Attribute type: Characteristic (0x2803)
< HCI Command: Host Number of Com.. (0x03|0x0035) plen 5  #119 [hci1] 11.963757
        Num handles: 1
        Handle: 1083 Address: DF:A9:FF:F6:B1:1A (OUI DF-A9-FF)
        Count: 1
< ACL Data TX: Handle 1083 flags 0x00 dlen 20             #120 [hci1] 11.963785
      ATT: Read By Type Response (0x09) len 15
        Attribute data length: 7
        Attribute data list: 2 entries
        Handle: 0x0034
        Value: 283500c52a
            Properties: 0x28
              Write (0x08)
              Indicate (0x20)
            Value Handle: 0x0035
            Value UUID: Object Action Control Point (0x2ac5)
        Handle: 0x0037
        Value: 283800c62a
            Properties: 0x28
              Write (0x08)
              Indicate (0x20)
            Value Handle: 0x0038
            Value UUID: Object List Control Point (0x2ac6)
> HCI Event: Number of Completed Packets (0x13) plen 5    #121 [hci1] 12.123795
        Num handles: 1
        Handle: 1083 Address: DF:A9:FF:F6:B1:1A (OUI DF-A9-FF)
        Count: 1
        #120: len 20 (1 Kb/s)
        Latency: 160 msec (70-169 msec ~159 msec)
> ACL Data RX: Handle 1083 flags 0x02 dlen 11             #122 [hci1] 12.124048
      ATT: Read By Type Request (0x08) len 6
        Handle range: 0x0038-0x0039
        Attribute type: Characteristic (0x2803)
< HCI Command: Host Number of Com.. (0x03|0x0035) plen 5  #123 [hci1] 12.144351
        Num handles: 1
        Handle: 1083 Address: DF:A9:FF:F6:B1:1A (OUI DF-A9-FF)
        Count: 1
< ACL Data TX: Handle 1083 flags 0x00 dlen 9              #124 [hci1] 12.144575
      ATT: Error Response (0x01) len 4
        Read By Type Request (0x08)
        Handle: 0x0038
        Error: Attribute Not Found (0x0a)
> HCI Event: Number of Completed Packets (0x13) plen 5    #125 [hci1] 12.298845
        Num handles: 1
        Handle: 1083 Address: DF:A9:FF:F6:B1:1A (OUI DF-A9-FF)
        Count: 1
        #124: len 9 (0 Kb/s)
        Latency: 154 msec (70-169 msec ~157 msec)
> ACL Data RX: Handle 1083 flags 0x02 dlen 9              #126 [hci1] 12.299099
      ATT: Find Information Request (0x04) len 4
        Handle range: 0x0036-0x0036
< HCI Command: Host Number of Com.. (0x03|0x0035) plen 5  #127 [hci1] 12.303805
        Num handles: 1
        Handle: 1083 Address: DF:A9:FF:F6:B1:1A (OUI DF-A9-FF)
        Count: 1
< ACL Data TX: Handle 1083 flags 0x00 dlen 10             #128 [hci1] 12.303859
      ATT: Find Information Response (0x05) len 5
        Format: UUID-16 (0x01)
        Handle: 0x0036
        UUID: Client Characteristic Configuration (0x2902)
> HCI Event: Number of Completed Packets (0x13) plen 5    #129 [hci1] 12.473796
        Num handles: 1
        Handle: 1083 Address: DF:A9:FF:F6:B1:1A (OUI DF-A9-FF)
        Count: 1
        #128: len 10 (0 Kb/s)
        Latency: 169 msec (70-169 msec ~163 msec)
> ACL Data RX: Handle 1083 flags 0x02 dlen 9              #130 [hci1] 12.474021
      ATT: Find Information Request (0x04) len 4
        Handle range: 0x0039-0x0039
< HCI Command: Host Number of Com.. (0x03|0x0035) plen 5  #131 [hci1] 12.483803
        Num handles: 1
        Handle: 1083 Address: DF:A9:FF:F6:B1:1A (OUI DF-A9-FF)
        Count: 1
< ACL Data TX: Handle 1083 flags 0x00 dlen 10             #132 [hci1] 12.483861
      ATT: Find Information Response (0x05) len 5
        Format: UUID-16 (0x01)
        Handle: 0x0039
        UUID: Client Characteristic Configuration (0x2902)
> HCI Event: Number of Completed Packets (0x13) plen 5    #133 [hci1] 12.648742
        Num handles: 1
        Handle: 1083 Address: DF:A9:FF:F6:B1:1A (OUI DF-A9-FF)
        Count: 1
        #132: len 10 (0 Kb/s)
        Latency: 164 msec (70-169 msec ~164 msec)
> ACL Data RX: Handle 1083 flags 0x02 dlen 7              #134 [hci1] 12.648952
      ATT: Read Request (0x0a) len 2
        Handle: 0x0029
< HCI Command: Host Number of Com.. (0x03|0x0035) plen 5  #135 [hci1] 12.664343
        Num handles: 1
        Handle: 1083 Address: DF:A9:FF:F6:B1:1A (OUI DF-A9-FF)
        Count: 1
< ACL Data TX: Handle 1083 flags 0x00 dlen 13             #136 [hci1] 12.664449
      ATT: Read Response (0x0b) len 8
> HCI Event: Number of Completed Packets (0x13) plen 5    #137 [hci1] 12.823873
        Num handles: 1
        Handle: 1083 Address: DF:A9:FF:F6:B1:1A (OUI DF-A9-FF)
        Count: 1
        #136: len 13 (0 Kb/s)
        Latency: 159 msec (70-169 msec ~161 msec)
> ACL Data RX: Handle 1083 flags 0x02 dlen 13             #138 [hci1] 12.824076
      ATT: Find By Type Value Request (0x06) len 8
        Handle range: 0x0001-0xffff
        Attribute type: Primary Service (0x2800)
          UUID: Object Transfer (0x1825)
< HCI Command: Host Number of Com.. (0x03|0x0035) plen 5  #139 [hci1] 12.843877
        Num handles: 1
        Handle: 1083 Address: DF:A9:FF:F6:B1:1A (OUI DF-A9-FF)
        Count: 1
< ACL Data TX: Handle 1083 flags 0x00 dlen 9              #140 [hci1] 12.843932
      ATT: Find By Type Value Response (0x07) len 4
        Handle range: 0x0027-0x0039
> HCI Event: Number of Completed Packets (0x13) plen 5    #141 [hci1] 12.998817
        Num handles: 1
        Handle: 1083 Address: DF:A9:FF:F6:B1:1A (OUI DF-A9-FF)
        Count: 1
        #140: len 9 (0 Kb/s)
        Latency: 154 msec (70-169 msec ~158 msec)
> ACL Data RX: Handle 1083 flags 0x02 dlen 13             #142 [hci1] 12.999122
      ATT: Find By Type Value Request (0x06) len 8
        Handle range: 0x003a-0xffff
        Attribute type: Primary Service (0x2800)
          UUID: Object Transfer (0x1825)
< HCI Command: Host Number of Com.. (0x03|0x0035) plen 5  #143 [hci1] 13.004220
        Num handles: 1
        Handle: 1083 Address: DF:A9:FF:F6:B1:1A (OUI DF-A9-FF)
        Count: 1
< ACL Data TX: Handle 1083 flags 0x00 dlen 9              #144 [hci1] 13.004460
      ATT: Error Response (0x01) len 4
        Find By Type Value Request (0x06)
        Handle: 0x003a
        Error: Attribute Not Found (0x0a)
> HCI Event: Number of Completed Packets (0x13) plen 5    #145 [hci1] 13.173785
        Num handles: 1
        Handle: 1083 Address: DF:A9:FF:F6:B1:1A (OUI DF-A9-FF)
        Count: 1
        #144: len 9 (0 Kb/s)
        Latency: 169 msec (70-169 msec ~163 msec)
> ACL Data RX: Handle 1083 flags 0x02 dlen 11             #146 [hci1] 13.174068
      ATT: Read By Type Request (0x08) len 6
        Handle range: 0x0027-0x0039
        Attribute type: Characteristic (0x2803)
< HCI Command: Host Number of Com.. (0x03|0x0035) plen 5  #147 [hci1] 13.184357
        Num handles: 1
        Handle: 1083 Address: DF:A9:FF:F6:B1:1A (OUI DF-A9-FF)
        Count: 1
< ACL Data TX: Handle 1083 flags 0x00 dlen 20             #148 [hci1] 13.184435
      ATT: Read By Type Response (0x09) len 15
        Attribute data length: 7
        Attribute data list: 2 entries
        Handle: 0x0028
        Value: 022900bd2a
            Properties: 0x02
              Read (0x02)
            Value Handle: 0x0029
            Value UUID: OTS Feature (0x2abd)
        Handle: 0x002a
        Value: 0a2b00be2a
            Properties: 0x0a
              Read (0x02)
              Write (0x08)
            Value Handle: 0x002b
            Value UUID: Object Name (0x2abe)
> HCI Event: Number of Completed Packets (0x13) plen 5    #149 [hci1] 13.348806
        Num handles: 1
        Handle: 1083 Address: DF:A9:FF:F6:B1:1A (OUI DF-A9-FF)
        Count: 1
        #148: len 20 (0 Kb/s)
        Latency: 164 msec (70-169 msec ~164 msec)
> ACL Data RX: Handle 1083 flags 0x02 dlen 11             #150 [hci1] 13.349007
      ATT: Read By Type Request (0x08) len 6
        Handle range: 0x002b-0x0039
        Attribute type: Characteristic (0x2803)
< HCI Command: Host Number of Com.. (0x03|0x0035) plen 5  #151 [hci1] 13.363835
        Num handles: 1
        Handle: 1083 Address: DF:A9:FF:F6:B1:1A (OUI DF-A9-FF)
        Count: 1
< ACL Data TX: Handle 1083 flags 0x00 dlen 20             #152 [hci1] 13.363855
      ATT: Read By Type Response (0x09) len 15
        Attribute data length: 7
        Attribute data list: 2 entries
        Handle: 0x002c
        Value: 022d00bf2a
            Properties: 0x02
              Read (0x02)
            Value Handle: 0x002d
            Value UUID: Object Type (0x2abf)
        Handle: 0x002e
        Value: 022f00c02a
            Properties: 0x02
              Read (0x02)
            Value Handle: 0x002f
            Value UUID: Object Size (0x2ac0)
> HCI Event: Number of Completed Packets (0x13) plen 5    #153 [hci1] 13.523838
        Num handles: 1
        Handle: 1083 Address: DF:A9:FF:F6:B1:1A (OUI DF-A9-FF)
        Count: 1
        #152: len 20 (1 Kb/s)
        Latency: 159 msec (70-169 msec ~162 msec)
> ACL Data RX: Handle 1083 flags 0x02 dlen 11             #154 [hci1] 13.524024
      ATT: Read By Type Request (0x08) len 6
        Handle range: 0x002f-0x0039
        Attribute type: Characteristic (0x2803)
< HCI Command: Host Number of Com.. (0x03|0x0035) plen 5  #155 [hci1] 13.543818
        Num handles: 1
        Handle: 1083 Address: DF:A9:FF:F6:B1:1A (OUI DF-A9-FF)
        Count: 1
< ACL Data TX: Handle 1083 flags 0x00 dlen 20             #156 [hci1] 13.543852
      ATT: Read By Type Response (0x09) len 15
        Attribute data length: 7
        Attribute data list: 2 entries
        Handle: 0x0030
        Value: 023100c32a
            Properties: 0x02
              Read (0x02)
            Value Handle: 0x0031
            Value UUID: Object ID (0x2ac3)
        Handle: 0x0032
        Value: 023300c42a
            Properties: 0x02
              Read (0x02)
            Value Handle: 0x0033
            Value UUID: Object Properties (0x2ac4)
> HCI Event: Number of Completed Packets (0x13) plen 5    #157 [hci1] 13.698846
        Num handles: 1
        Handle: 1083 Address: DF:A9:FF:F6:B1:1A (OUI DF-A9-FF)
        Count: 1
        #156: len 20 (1 Kb/s)
        Latency: 154 msec (70-169 msec ~158 msec)
> ACL Data RX: Handle 1083 flags 0x02 dlen 11             #158 [hci1] 13.698996
      ATT: Read By Type Request (0x08) len 6
        Handle range: 0x0033-0x0039
        Attribute type: Characteristic (0x2803)
< HCI Command: Host Number of Com.. (0x03|0x0035) plen 5  #159 [hci1] 13.704402
        Num handles: 1
        Handle: 1083 Address: DF:A9:FF:F6:B1:1A (OUI DF-A9-FF)
        Count: 1
< ACL Data TX: Handle 1083 flags 0x00 dlen 20             #160 [hci1] 13.704557
      ATT: Read By Type Response (0x09) len 15
        Attribute data length: 7
        Attribute data list: 2 entries
        Handle: 0x0034
        Value: 283500c52a
            Properties: 0x28
              Write (0x08)
              Indicate (0x20)
            Value Handle: 0x0035
            Value UUID: Object Action Control Point (0x2ac5)
        Handle: 0x0037
        Value: 283800c62a
            Properties: 0x28
              Write (0x08)
              Indicate (0x20)
            Value Handle: 0x0038
            Value UUID: Object List Control Point (0x2ac6)
> HCI Event: Number of Completed Packets (0x13) plen 5    #161 [hci1] 13.873747
        Num handles: 1
        Handle: 1083 Address: DF:A9:FF:F6:B1:1A (OUI DF-A9-FF)
        Count: 1
        #160: len 20 (0 Kb/s)
        Latency: 169 msec (70-169 msec ~163 msec)
> ACL Data RX: Handle 1083 flags 0x02 dlen 11             #162 [hci1] 13.873982
      ATT: Read By Type Request (0x08) len 6
        Handle range: 0x0038-0x0039
        Attribute type: Characteristic (0x2803)
< HCI Command: Host Number of Com.. (0x03|0x0035) plen 5  #163 [hci1] 13.883884
        Num handles: 1
        Handle: 1083 Address: DF:A9:FF:F6:B1:1A (OUI DF-A9-FF)
        Count: 1
< ACL Data TX: Handle 1083 flags 0x00 dlen 9              #164 [hci1] 13.883998
      ATT: Error Response (0x01) len 4
        Read By Type Request (0x08)
        Handle: 0x0038
        Error: Attribute Not Found (0x0a)
> HCI Event: Number of Completed Packets (0x13) plen 5    #165 [hci1] 14.048754
        Num handles: 1
        Handle: 1083 Address: DF:A9:FF:F6:B1:1A (OUI DF-A9-FF)
        Count: 1
        #164: len 9 (0 Kb/s)
        Latency: 164 msec (70-169 msec ~164 msec)
> ACL Data RX: Handle 1083 flags 0x02 dlen 9              #166 [hci1] 14.049052
      ATT: Find Information Request (0x04) len 4
        Handle range: 0x0036-0x0036
< HCI Command: Host Number of Com.. (0x03|0x0035) plen 5  #167 [hci1] 14.063964
        Num handles: 1
        Handle: 1083 Address: DF:A9:FF:F6:B1:1A (OUI DF-A9-FF)
        Count: 1
< ACL Data TX: Handle 1083 flags 0x00 dlen 10             #168 [hci1] 14.064013
      ATT: Find Information Response (0x05) len 5
        Format: UUID-16 (0x01)
        Handle: 0x0036
        UUID: Client Characteristic Configuration (0x2902)
> HCI Event: Number of Completed Packets (0x13) plen 5    #169 [hci1] 14.223718
        Num handles: 1
        Handle: 1083 Address: DF:A9:FF:F6:B1:1A (OUI DF-A9-FF)
        Count: 1
        #168: len 10 (0 Kb/s)
        Latency: 159 msec (70-169 msec ~162 msec)
> ACL Data RX: Handle 1083 flags 0x02 dlen 9              #170 [hci1] 14.223967
      ATT: Find Information Request (0x04) len 4
        Handle range: 0x0039-0x0039
< HCI Command: Host Number of Com.. (0x03|0x0035) plen 5  #171 [hci1] 14.244104
        Num handles: 1
        Handle: 1083 Address: DF:A9:FF:F6:B1:1A (OUI DF-A9-FF)
        Count: 1
< ACL Data TX: Handle 1083 flags 0x00 dlen 10             #172 [hci1] 14.244163
      ATT: Find Information Response (0x05) len 5
        Format: UUID-16 (0x01)
        Handle: 0x0039
        UUID: Client Characteristic Configuration (0x2902)
> HCI Event: Number of Completed Packets (0x13) plen 5    #173 [hci1] 14.398797
        Num handles: 1
        Handle: 1083 Address: DF:A9:FF:F6:B1:1A (OUI DF-A9-FF)
        Count: 1
        #172: len 10 (0 Kb/s)
        Latency: 154 msec (70-169 msec ~158 msec)
> ACL Data RX: Handle 1083 flags 0x02 dlen 7              #174 [hci1] 14.398957
      ATT: Read Request (0x0a) len 2
        Handle: 0x0029
< HCI Command: Host Number of Com.. (0x03|0x0035) plen 5  #175 [hci1] 14.403992
        Num handles: 1
        Handle: 1083 Address: DF:A9:FF:F6:B1:1A (OUI DF-A9-FF)
        Count: 1
< ACL Data TX: Handle 1083 flags 0x00 dlen 13             #176 [hci1] 14.404087
      ATT: Read Response (0x0b) len 8
> HCI Event: Number of Completed Packets (0x13) plen 5    #177 [hci1] 14.573802
        Num handles: 1
        Handle: 1083 Address: DF:A9:FF:F6:B1:1A (OUI DF-A9-FF)
        Count: 1
        #176: len 13 (0 Kb/s)
        Latency: 169 msec (70-169 msec ~164 msec)
> ACL Data RX: Handle 1083 flags 0x02 dlen 9              #178 [hci1] 14.573922
      ATT: Write Request (0x12) len 4
        Handle: 0x0036
          Data: 0000
< HCI Command: Host Number of Com.. (0x03|0x0035) plen 5  #179 [hci1] 14.584343
        Num handles: 1
        Handle: 1083 Address: DF:A9:FF:F6:B1:1A (OUI DF-A9-FF)
        Count: 1
< ACL Data TX: Handle 1083 flags 0x00 dlen 5              #180 [hci1] 14.584434
      ATT: Write Response (0x13) len 0
> HCI Event: Number of Completed Packets (0x13) plen 5    #181 [hci1] 14.748846
        Num handles: 1
        Handle: 1083 Address: DF:A9:FF:F6:B1:1A (OUI DF-A9-FF)
        Count: 1
        #180: len 5 (0 Kb/s)
        Latency: 164 msec (70-169 msec ~164 msec)
> ACL Data RX: Handle 1083 flags 0x02 dlen 9              #182 [hci1] 14.748922
      ATT: Write Request (0x12) len 4
        Handle: 0x0036
          Data: 0200
< HCI Command: Host Number of Com.. (0x03|0x0035) plen 5  #183 [hci1] 14.763994
        Num handles: 1
        Handle: 1083 Address: DF:A9:FF:F6:B1:1A (OUI DF-A9-FF)
        Count: 1
< ACL Data TX: Handle 1083 flags 0x00 dlen 5              #184 [hci1] 14.764034
      ATT: Write Response (0x13) len 0
> HCI Event: Number of Completed Packets (0x13) plen 5    #185 [hci1] 14.923698
        Num handles: 1
        Handle: 1083 Address: DF:A9:FF:F6:B1:1A (OUI DF-A9-FF)
        Count: 1
        #184: len 5 (0 Kb/s)
        Latency: 159 msec (70-169 msec ~161 msec)
> ACL Data RX: Handle 1083 flags 0x02 dlen 9              #186 [hci1] 14.923966
      ATT: Write Request (0x12) len 4
        Handle: 0x0039
          Data: 0000
< HCI Command: Host Number of Com.. (0x03|0x0035) plen 5  #187 [hci1] 14.944119
        Num handles: 1
        Handle: 1083 Address: DF:A9:FF:F6:B1:1A (OUI DF-A9-FF)
        Count: 1
< ACL Data TX: Handle 1083 flags 0x00 dlen 5              #188 [hci1] 14.944178
      ATT: Write Response (0x13) len 0
> HCI Event: Number of Completed Packets (0x13) plen 5    #189 [hci1] 15.098724
        Num handles: 1
        Handle: 1083 Address: DF:A9:FF:F6:B1:1A (OUI DF-A9-FF)
        Count: 1
        #188: len 5 (0 Kb/s)
        Latency: 154 msec (70-169 msec ~158 msec)
> ACL Data RX: Handle 1083 flags 0x02 dlen 9              #190 [hci1] 15.098957
      ATT: Write Request (0x12) len 4
        Handle: 0x0039
          Data: 0200
< HCI Command: Host Number of Com.. (0x03|0x0035) plen 5  #191 [hci1] 15.104078
        Num handles: 1
        Handle: 1083 Address: DF:A9:FF:F6:B1:1A (OUI DF-A9-FF)
        Count: 1
< ACL Data TX: Handle 1083 flags 0x00 dlen 5              #192 [hci1] 15.104132
      ATT: Write Response (0x13) len 0
> HCI Event: Number of Completed Packets (0x13) plen 5    #193 [hci1] 15.273796
        Num handles: 1
        Handle: 1083 Address: DF:A9:FF:F6:B1:1A (OUI DF-A9-FF)
        Count: 1
        #192: len 5 (0 Kb/s)
        Latency: 169 msec (70-169 msec ~163 msec)
> ACL Data RX: Handle 1083 flags 0x02 dlen 14             #194 [hci1] 15.274081
      ATT: Write Request (0x12) len 9
        Handle: 0x0035
          Data: 0164000000b17f
< HCI Command: Host Number of Com.. (0x03|0x0035) plen 5  #195 [hci1] 15.284097
        Num handles: 1
        Handle: 1083 Address: DF:A9:FF:F6:B1:1A (OUI DF-A9-FF)
        Count: 1
< ACL Data TX: Handle 1083 flags 0x00 dlen 5              #196 [hci1] 15.284195
      ATT: Write Response (0x13) len 0
< ACL Data TX: Handle 1083 flags 0x00 dlen 10             #197 [hci1] 15.284240
      ATT: Handle Value Indication (0x1d) len 5
        Handle: 0x0035
          Data: 600101
> HCI Event: Number of Completed Packets (0x13) plen 5    #198 [hci1] 15.361606
        Num handles: 1
        Handle: 1083 Address: DF:A9:FF:F6:B1:1A (OUI DF-A9-FF)
        Count: 1
        #196: len 5 (0 Kb/s)
        Latency: 77 msec (70-169 msec ~120 msec)
> HCI Event: Number of Completed Packets (0x13) plen 5    #199 [hci1] 15.448792
        Num handles: 1
        Handle: 1083 Address: DF:A9:FF:F6:B1:1A (OUI DF-A9-FF)
        Count: 1
        #197: len 10 (0 Kb/s)
        Latency: 164 msec (70-169 msec ~142 msec)
> ACL Data RX: Handle 1083 flags 0x02 dlen 5              #200 [hci1] 15.448880
      ATT: Handle Value Confirmation (0x1e) len 0
> ACL Data RX: Handle 1083 flags 0x02 dlen 7              #201 [hci1] 15.449208
      ATT: Read Request (0x0a) len 2
        Handle: 0x002b
< HCI Command: Host Number of Com.. (0x03|0x0035) plen 5  #202 [hci1] 15.463986
        Num handles: 1
        Handle: 1083 Address: DF:A9:FF:F6:B1:1A (OUI DF-A9-FF)
        Count: 1
< HCI Command: Host Number of Com.. (0x03|0x0035) plen 5  #203 [hci1] 15.464170
        Num handles: 1
        Handle: 1083 Address: DF:A9:FF:F6:B1:1A (OUI DF-A9-FF)
        Count: 1
< ACL Data TX: Handle 1083 flags 0x00 dlen 5              #204 [hci1] 15.464265
      ATT: Read Response (0x0b) len 0
> HCI Event: Number of Completed Packets (0x13) plen 5    #205 [hci1] 15.623818
        Num handles: 1
        Handle: 1083 Address: DF:A9:FF:F6:B1:1A (OUI DF-A9-FF)
        Count: 1
        #204: len 5 (0 Kb/s)
        Latency: 159 msec (70-169 msec ~151 msec)
> ACL Data RX: Handle 1083 flags 0x02 dlen 7              #206 [hci1] 15.623997
      ATT: Read Request (0x0a) len 2
        Handle: 0x002d
< HCI Command: Host Number of Com.. (0x03|0x0035) plen 5  #207 [hci1] 15.644355
        Num handles: 1
        Handle: 1083 Address: DF:A9:FF:F6:B1:1A (OUI DF-A9-FF)
        Count: 1
< ACL Data TX: Handle 1083 flags 0x00 dlen 7              #208 [hci1] 15.644538
      ATT: Read Response (0x0b) len 2
> HCI Event: Number of Completed Packets (0x13) plen 5    #209 [hci1] 15.798778
        Num handles: 1
        Handle: 1083 Address: DF:A9:FF:F6:B1:1A (OUI DF-A9-FF)
        Count: 1
        #208: len 7 (0 Kb/s)
        Latency: 154 msec (70-169 msec ~152 msec)
> ACL Data RX: Handle 1083 flags 0x02 dlen 7              #210 [hci1] 15.798956
      ATT: Read Request (0x0a) len 2
        Handle: 0x002f
< HCI Command: Host Number of Com.. (0x03|0x0035) plen 5  #211 [hci1] 15.803819
        Num handles: 1
        Handle: 1083 Address: DF:A9:FF:F6:B1:1A (OUI DF-A9-FF)
        Count: 1
< ACL Data TX: Handle 1083 flags 0x00 dlen 13             #212 [hci1] 15.803829
      ATT: Read Response (0x0b) len 8
> HCI Event: Number of Completed Packets (0x13) plen 5    #213 [hci1] 15.973691
        Num handles: 1
        Handle: 1083 Address: DF:A9:FF:F6:B1:1A (OUI DF-A9-FF)
        Count: 1
        #212: len 13 (0 Kb/s)
        Latency: 169 msec (70-169 msec ~161 msec)
> ACL Data RX: Handle 1083 flags 0x02 dlen 7              #214 [hci1] 15.974089
      ATT: Read Request (0x0a) len 2
        Handle: 0x0033
< HCI Command: Host Number of Com.. (0x03|0x0035) plen 5  #215 [hci1] 15.984032
        Num handles: 1
        Handle: 1083 Address: DF:A9:FF:F6:B1:1A (OUI DF-A9-FF)
        Count: 1
< ACL Data TX: Handle 1083 flags 0x00 dlen 9              #216 [hci1] 15.984118
      ATT: Read Response (0x0b) len 4
> HCI Event: Number of Completed Packets (0x13) plen 5    #217 [hci1] 16.148741
        Num handles: 1
        Handle: 1083 Address: DF:A9:FF:F6:B1:1A (OUI DF-A9-FF)
        Count: 1
        #216: len 9 (0 Kb/s)
        Latency: 164 msec (70-169 msec ~162 msec)
> ACL Data RX: Handle 1083 flags 0x02 dlen 7              #218 [hci1] 16.148870
      ATT: Read Request (0x0a) len 2
        Handle: 0x0031
< HCI Command: Host Number of Com.. (0x03|0x0035) plen 5  #219 [hci1] 16.164326
        Num handles: 1
        Handle: 1083 Address: DF:A9:FF:F6:B1:1A (OUI DF-A9-FF)
        Count: 1
< ACL Data TX: Handle 1083 flags 0x00 dlen 11             #220 [hci1] 16.164466
      ATT: Read Response (0x0b) len 6
> HCI Event: Number of Completed Packets (0x13) plen 5    #221 [hci1] 16.323559
        Num handles: 1
        Handle: 1083 Address: DF:A9:FF:F6:B1:1A (OUI DF-A9-FF)
        Count: 1
        #220: len 11 (0 Kb/s)
        Latency: 159 msec (70-169 msec ~161 msec)
> HCI Event: Disconnect Complete (0x05) plen 4            #222 [hci1] 16.411485
        Status: Success (0x00)
        Handle: 1083 Address: DF:A9:FF:F6:B1:1A (OUI DF-A9-FF)
        Reason: Remote User Terminated Connection (0x13)
< HCI Command: LE Set Extended A.. (0x08|0x0036) plen 25  #223 [hci1] 17.004347
        Handle: 0x00
        Properties: 0x0013
          Connectable
          Scannable
          Use legacy advertising PDUs: ADV_IND
        Min advertising interval: 100.000 msec (0x00a0)
        Max advertising interval: 150.000 msec (0x00f0)
        Channel map: 37, 38, 39 (0x07)
        Own address type: Random (0x01)
        Peer address type: Public (0x00)
        Peer address: 00:00:00:00:00:00 (OUI 00-00-00)
        Filter policy: Allow Scan Request from Any, Allow Connect Request from Any (0x00)
        TX power: Host has no preference (0x7f)
        Primary PHY: LE 1M (0x01)
        Secondary max skip: 0x00
        Secondary PHY: LE 1M (0x01)
        SID: 0x00
        Scan request notifications: Disabled (0x00)
> HCI Event: Command Complete (0x0e) plen 5               #224 [hci1] 17.005152
      LE Set Extended Advertising Parameters (0x08|0x0036) ncmd 1
        Status: Success (0x00)
        TX power (selected): 0 dbm (0x00)
< HCI Command: LE Set Advertising.. (0x08|0x0035) plen 7  #225 [hci1] 17.023779
        Advertising handle: 0x00
        Advertising random address: D5:B6:CC:31:DB:3B (Static)
> HCI Event: Command Complete (0x0e) plen 4               #226 [hci1] 17.024321
      LE Set Advertising Set Random Address (0x08|0x0035) ncmd 1
        Status: Success (0x00)
< HCI Command: LE Set Extended A.. (0x08|0x0037) plen 22  #227 [hci1] 17.043646
        Handle: 0x00
        Operation: Complete extended advertising data (0x03)
        Fragment preference: Minimize fragmentation (0x01)
        Data length: 0x12
        Flags: 0x04
          BR/EDR Not Supported
        Name (complete): Tester_F6B11A
> HCI Event: Command Complete (0x0e) plen 4               #228 [hci1] 17.044386
      LE Set Extended Advertising Data (0x08|0x0037) ncmd 1
        Status: Success (0x00)
< HCI Command: LE Set Extended Sc.. (0x08|0x0038) plen 4  #229 [hci1] 17.063719
        Handle: 0x00
        Operation: Complete scan response data (0x03)
        Fragment preference: Minimize fragmentation (0x01)
        Data length: 0x00
> HCI Event: Command Complete (0x0e) plen 4               #230 [hci1] 17.064162
      LE Set Extended Scan Response Data (0x08|0x0038) ncmd 1
        Status: Success (0x00)
< HCI Command: LE Set Extended Ad.. (0x08|0x0039) plen 6  #231 [hci1] 17.083722
        Extended advertising: Enabled (0x01)
        Number of sets: 1 (0x01)
        Entry 0
          Handle: 0x00
          Duration: 0 ms (0x00)
          Max ext adv events: 0
> HCI Event: Command Complete (0x0e) plen 4               #232 [hci1] 17.084324
      LE Set Extended Advertising Enable (0x08|0x0039) ncmd 1
        Status: Success (0x00)
> HCI Event: LE Meta Event (0x3e) plen 31                 #233 [hci1] 17.604126
      LE Enhanced Connection Complete (0x0a)
        Status: Success (0x00)
        Handle: 1101
        Role: Peripheral (0x01)
        Peer address type: Public (0x00)
        Peer address: DF:A9:FF:F6:B1:1A (OUI DF-A9-FF)
        Local resolvable private address: 00:00:00:00:00:00 (Non-Resolvable)
        Peer resolvable private address: 00:00:00:00:00:00 (Non-Resolvable)
        Connection interval: 87.50 msec (0x0046)
        Connection latency: 0 (0x0000)
        Supervision timeout: 20000 msec (0x07d0)
        Central clock accuracy: 0x01
> HCI Event: LE Meta Event (0x3e) plen 6                  #234 [hci1] 17.604221
      LE Advertising Set Terminated (0x12)
        Status: Success (0x00)
        Handle: 0
        Connection handle: 1101
        Number of completed extended advertising events: 0
< HCI Command: LE Read Remote Use.. (0x08|0x0016) plen 2  #235 [hci1] 17.624637
        Handle: 1101 Address: DF:A9:FF:F6:B1:1A (OUI DF-A9-FF)
> HCI Event: Command Status (0x0f) plen 4                 #236 [hci1] 17.625125
      LE Read Remote Used Features (0x08|0x0016) ncmd 1
        Status: Success (0x00)
> HCI Event: LE Meta Event (0x3e) plen 12                 #237 [hci1] 17.867889
      LE Read Remote Used Features (0x04)
        Status: Success (0x00)
        Handle: 1101 Address: DF:A9:FF:F6:B1:1A (OUI DF-A9-FF)
        Features: 0x2d 0x49 0x00 0xf7 0x67 0xd9 0x00 0x80
          LE Encryption
          Extended Reject Indication
          Peripheral-initiated Features Exchange
          LE Data Packet Length Extension
          LE 2M PHY
          LE Coded PHY
          Channel Selection Algorithm #2
          Periodic Advertising Sync Transfer - Sender
          Periodic Advertising Sync Transfer - Recipient
          Sleep Clock Accuracy Updates
          Connected Isochronous Stream - Central
          Connected Isochronous Stream - Peripheral
          Isochronous Broadcaster
          Synchronized Receiver
          Connected Isochronous Stream (Host Support)
          LE Power Control Request
          LE Power Control Request
          Connection Subrating
          Connection Subrating (Host Support)
          Unknown features (0x8000d90000000000)
> HCI Event: LE Meta Event (0x3e) plen 13                 #238 [hci1] 20.405626
      LE Long Term Key Request (0x05)
        Handle: 1101 Address: DF:A9:FF:F6:B1:1A (OUI DF-A9-FF)
        Random number: 0x0000000000000000
        Encrypted diversifier: 0x0000
< HCI Command: LE Long Term Key... (0x08|0x001a) plen 18  #239 [hci1] 20.424086
        Handle: 1101 Address: DF:A9:FF:F6:B1:1A (OUI DF-A9-FF)
        Long term key: ef2deaca3761627d0af86cf35655c5fd
> HCI Event: Command Complete (0x0e) plen 6               #240 [hci1] 20.424866
      LE Long Term Key Request Reply (0x08|0x001a) ncmd 1
        Status: Success (0x00)
        Handle: 1101 Address: DF:A9:FF:F6:B1:1A (OUI DF-A9-FF)
> HCI Event: Encryption Change (0x08) plen 4              #241 [hci1] 20.842738
        Status: Success (0x00)
        Handle: 1101 Address: DF:A9:FF:F6:B1:1A (OUI DF-A9-FF)
        Encryption: Enabled with AES-CCM (0x01)
> ACL Data RX: Handle 1101 flags 0x02 dlen 9              #242 [hci1] 20.930136
      ATT: Write Request (0x12) len 4
        Handle: 0x0039
          Data: 0000
< HCI Command: Host Number of Com.. (0x03|0x0035) plen 5  #243 [hci1] 20.944326
        Num handles: 1
        Handle: 1101 Address: DF:A9:FF:F6:B1:1A (OUI DF-A9-FF)
        Count: 1
< ACL Data TX: Handle 1101 flags 0x00 dlen 5              #244 [hci1] 20.944506
      ATT: Write Response (0x13) len 0
> HCI Event: Number of Completed Packets (0x13) plen 5    #245 [hci1] 21.105064
        Num handles: 1
        Handle: 1101 Address: DF:A9:FF:F6:B1:1A (OUI DF-A9-FF)
        Count: 1
        #244: len 5 (0 Kb/s)
        Latency: 160 msec (160-160 msec ~160 msec)
> ACL Data RX: Handle 1101 flags 0x02 dlen 9              #246 [hci1] 21.105237
      ATT: Write Request (0x12) len 4
        Handle: 0x0039
          Data: 0200
< HCI Command: Host Number of Com.. (0x03|0x0035) plen 5  #247 [hci1] 21.124070
        Num handles: 1
        Handle: 1101 Address: DF:A9:FF:F6:B1:1A (OUI DF-A9-FF)
        Count: 1
< ACL Data TX: Handle 1101 flags 0x00 dlen 5              #248 [hci1] 21.124107
      ATT: Write Response (0x13) len 0
> HCI Event: Number of Completed Packets (0x13) plen 5    #249 [hci1] 21.280117
        Num handles: 1
        Handle: 1101 Address: DF:A9:FF:F6:B1:1A (OUI DF-A9-FF)
        Count: 1
        #248: len 5 (0 Kb/s)
        Latency: 156 msec (156-160 msec ~158 msec)
> ACL Data RX: Handle 1101 flags 0x02 dlen 8              #250 [hci1] 21.280287
      ATT: Write Request (0x12) len 3
        Handle: 0x0038
          Data: 01
< HCI Command: Host Number of Com.. (0x03|0x0035) plen 5  #251 [hci1] 21.284561
        Num handles: 1
        Handle: 1101 Address: DF:A9:FF:F6:B1:1A (OUI DF-A9-FF)
        Count: 1
< ACL Data TX: Handle 1101 flags 0x00 dlen 5              #252 [hci1] 21.284843
      ATT: Write Response (0x13) len 0
< ACL Data TX: Handle 1101 flags 0x00 dlen 10             #253 [hci1] 21.285081
      ATT: Handle Value Indication (0x1d) len 5
        Handle: 0x0038
          Data: 700101
> HCI Event: Number of Completed Packets (0x13) plen 5    #254 [hci1] 21.367991
        Num handles: 1
        Handle: 1101 Address: DF:A9:FF:F6:B1:1A (OUI DF-A9-FF)
        Count: 1
        #252: len 5 (0 Kb/s)
        Latency: 83 msec (83-160 msec ~120 msec)
> HCI Event: Number of Completed Packets (0x13) plen 5    #255 [hci1] 21.455077
        Num handles: 1
        Handle: 1101 Address: DF:A9:FF:F6:B1:1A (OUI DF-A9-FF)
        Count: 1
        #253: len 10 (0 Kb/s)
        Latency: 169 msec (83-169 msec ~145 msec)
> ACL Data RX: Handle 1101 flags 0x02 dlen 5              #256 [hci1] 21.455167
      ATT: Handle Value Confirmation (0x1e) len 0
> ACL Data RX: Handle 1101 flags 0x02 dlen 7              #257 [hci1] 21.455607
      ATT: Read Request (0x0a) len 2
        Handle: 0x002b
< HCI Command: Host Number of Com.. (0x03|0x0035) plen 5  #258 [hci1] 21.464081
        Num handles: 1
        Handle: 1101 Address: DF:A9:FF:F6:B1:1A (OUI DF-A9-FF)
        Count: 1
< HCI Command: Host Number of Com.. (0x03|0x0035) plen 5  #259 [hci1] 21.464205
        Num handles: 1
        Handle: 1101 Address: DF:A9:FF:F6:B1:1A (OUI DF-A9-FF)
        Count: 1
< ACL Data TX: Handle 1101 flags 0x00 dlen 14             #260 [hci1] 21.464308
      ATT: Read Response (0x0b) len 9
> HCI Event: Number of Completed Packets (0x13) plen 5    #261 [hci1] 21.630162
        Num handles: 1
        Handle: 1101 Address: DF:A9:FF:F6:B1:1A (OUI DF-A9-FF)
        Count: 1
        #260: len 14 (0 Kb/s)
        Latency: 165 msec (83-169 msec ~155 msec)
> ACL Data RX: Handle 1101 flags 0x02 dlen 7              #262 [hci1] 21.630305
      ATT: Read Request (0x0a) len 2
        Handle: 0x002d
< HCI Command: Host Number of Com.. (0x03|0x0035) plen 5  #263 [hci1] 21.644085
        Num handles: 1
        Handle: 1101 Address: DF:A9:FF:F6:B1:1A (OUI DF-A9-FF)
        Count: 1
< ACL Data TX: Handle 1101 flags 0x00 dlen 7              #264 [hci1] 21.644128
      ATT: Read Response (0x0b) len 2
> HCI Event: Number of Completed Packets (0x13) plen 5    #265 [hci1] 21.805007
        Num handles: 1
        Handle: 1101 Address: DF:A9:FF:F6:B1:1A (OUI DF-A9-FF)
        Count: 1
        #264: len 7 (0 Kb/s)
        Latency: 160 msec (83-169 msec ~158 msec)
> ACL Data RX: Handle 1101 flags 0x02 dlen 7              #266 [hci1] 21.805360
      ATT: Read Request (0x0a) len 2
        Handle: 0x002f
< HCI Command: Host Number of Com.. (0x03|0x0035) plen 5  #267 [hci1] 21.824480
        Num handles: 1
        Handle: 1101 Address: DF:A9:FF:F6:B1:1A (OUI DF-A9-FF)
        Count: 1
< ACL Data TX: Handle 1101 flags 0x00 dlen 13             #268 [hci1] 21.824603
      ATT: Read Response (0x0b) len 8
> HCI Event: Number of Completed Packets (0x13) plen 5    #269 [hci1] 21.980048
        Num handles: 1
        Handle: 1101 Address: DF:A9:FF:F6:B1:1A (OUI DF-A9-FF)
        Count: 1
        #268: len 13 (0 Kb/s)
        Latency: 155 msec (83-169 msec ~156 msec)
> ACL Data RX: Handle 1101 flags 0x02 dlen 7              #270 [hci1] 21.980293
      ATT: Read Request (0x0a) len 2
        Handle: 0x0033
< HCI Command: Host Number of Com.. (0x03|0x0035) plen 5  #271 [hci1] 21.983970
        Num handles: 1
        Handle: 1101 Address: DF:A9:FF:F6:B1:1A (OUI DF-A9-FF)
        Count: 1
< ACL Data TX: Handle 1101 flags 0x00 dlen 9              #272 [hci1] 21.984029
      ATT: Read Response (0x0b) len 4
> HCI Event: Number of Completed Packets (0x13) plen 5    #273 [hci1] 22.155111
        Num handles: 1
        Handle: 1101 Address: DF:A9:FF:F6:B1:1A (OUI DF-A9-FF)
        Count: 1
        #272: len 9 (0 Kb/s)
        Latency: 171 msec (83-171 msec ~163 msec)
> ACL Data RX: Handle 1101 flags 0x02 dlen 7              #274 [hci1] 22.155274
      ATT: Read Request (0x0a) len 2
        Handle: 0x0031
< HCI Command: Host Number of Com.. (0x03|0x0035) plen 5  #275 [hci1] 22.164367
        Num handles: 1
        Handle: 1101 Address: DF:A9:FF:F6:B1:1A (OUI DF-A9-FF)
        Count: 1
< ACL Data TX: Handle 1101 flags 0x00 dlen 11             #276 [hci1] 22.164394
      ATT: Read Response (0x0b) len 6
> HCI Event: Number of Completed Packets (0x13) plen 5    #277 [hci1] 22.330098
        Num handles: 1
        Handle: 1101 Address: DF:A9:FF:F6:B1:1A (OUI DF-A9-FF)
        Count: 1
        #276: len 11 (0 Kb/s)
        Latency: 165 msec (83-171 msec ~164 msec)
> ACL Data RX: Handle 1101 flags 0x02 dlen 8              #278 [hci1] 22.330328
      ATT: Write Request (0x12) len 3
        Handle: 0x0038
          Data: 04
< HCI Command: Host Number of Com.. (0x03|0x0035) plen 5  #279 [hci1] 22.344191
        Num handles: 1
        Handle: 1101 Address: DF:A9:FF:F6:B1:1A (OUI DF-A9-FF)
        Count: 1
< ACL Data TX: Handle 1101 flags 0x00 dlen 5              #280 [hci1] 22.344349
      ATT: Write Response (0x13) len 0
< ACL Data TX: Handle 1101 flags 0x00 dlen 10             #281 [hci1] 22.344496
      ATT: Handle Value Indication (0x1d) len 5
        Handle: 0x0038
          Data: 700401
> HCI Event: Number of Completed Packets (0x13) plen 5    #282 [hci1] 22.417952
        Num handles: 1
        Handle: 1101 Address: DF:A9:FF:F6:B1:1A (OUI DF-A9-FF)
        Count: 1
        #280: len 5 (0 Kb/s)
        Latency: 73 msec (73-171 msec ~119 msec)
> HCI Event: Number of Completed Packets (0x13) plen 5    #283 [hci1] 22.505035
        Num handles: 1
        Handle: 1101 Address: DF:A9:FF:F6:B1:1A (OUI DF-A9-FF)
        Count: 1
        #281: len 10 (0 Kb/s)
        Latency: 160 msec (73-171 msec ~139 msec)
> ACL Data RX: Handle 1101 flags 0x02 dlen 5              #284 [hci1] 22.505126
      ATT: Handle Value Confirmation (0x1e) len 0
> ACL Data RX: Handle 1101 flags 0x02 dlen 7              #285 [hci1] 22.505580
      ATT: Read Request (0x0a) len 2
        Handle: 0x002b
< HCI Command: Host Number of Com.. (0x03|0x0035) plen 5  #286 [hci1] 22.523875
        Num handles: 1
        Handle: 1101 Address: DF:A9:FF:F6:B1:1A (OUI DF-A9-FF)
        Count: 1
< HCI Command: Host Number of Com.. (0x03|0x0035) plen 5  #287 [hci1] 22.523890
        Num handles: 1
        Handle: 1101 Address: DF:A9:FF:F6:B1:1A (OUI DF-A9-FF)
        Count: 1
< ACL Data TX: Handle 1101 flags 0x00 dlen 27             #288 [hci1] 22.523908
      ATT: Read Response (0x0b) len 22
< ACL Data TX: Handle 1101 flags 0x00 dlen 16             #289 [hci1] 22.633799
      LE L2CAP: Connection Parameter Update Request (0x12) ident 2 len 8
        Min interval: 24
        Max interval: 40
        Peripheral latency: 0
        Timeout multiplier: 42
> HCI Event: Number of Completed Packets (0x13) plen 5    #290 [hci1] 22.680063
        Num handles: 1
        Handle: 1101 Address: DF:A9:FF:F6:B1:1A (OUI DF-A9-FF)
        Count: 1
        #288: len 27 (1 Kb/s)
        Latency: 156 msec (73-171 msec ~148 msec)
> ACL Data RX: Handle 1101 flags 0x02 dlen 9              #291 [hci1] 22.680200
      ATT: Read Blob Request (0x0c) len 4
        Handle: 0x002b
        Offset: 0x0016
< HCI Command: Host Number of Com.. (0x03|0x0035) plen 5  #292 [hci1] 22.683978
        Num handles: 1
        Handle: 1101 Address: DF:A9:FF:F6:B1:1A (OUI DF-A9-FF)
        Count: 1
< ACL Data TX: Handle 1101 flags 0x00 dlen 11             #293 [hci1] 22.684062
      ATT: Read Blob Response (0x0d) len 6
        67 20 6e 61 6d 65                                g name          
> HCI Event: Number of Completed Packets (0x13) plen 5    #294 [hci1] 22.767544
        Num handles: 1
        Handle: 1101 Address: DF:A9:FF:F6:B1:1A (OUI DF-A9-FF)
        Count: 1
        #289: len 16 (0 Kb/s)
        Latency: 133 msec (73-171 msec ~140 msec)
> ACL Data RX: Handle 1101 flags 0x02 dlen 10             #295 [hci1] 22.767731
      LE L2CAP: Connection Parameter Update Response (0x13) ident 2 len 2
        Result: Connection Parameters accepted (0x0000)
< HCI Command: Host Number of Com.. (0x03|0x0035) plen 5  #296 [hci1] 22.784406
        Num handles: 1
        Handle: 1101 Address: DF:A9:FF:F6:B1:1A (OUI DF-A9-FF)
        Count: 1
> HCI Event: Number of Completed Packets (0x13) plen 5    #297 [hci1] 22.855018
        Num handles: 1
        Handle: 1101 Address: DF:A9:FF:F6:B1:1A (OUI DF-A9-FF)
        Count: 1
        #293: len 11 (0 Kb/s)
        Latency: 170 msec (73-171 msec ~155 msec)
> ACL Data RX: Handle 1101 flags 0x02 dlen 7              #298 [hci1] 22.855252
      ATT: Read Request (0x0a) len 2
        Handle: 0x002d
< HCI Command: Host Number of Com.. (0x03|0x0035) plen 5  #299 [hci1] 22.864174
        Num handles: 1
        Handle: 1101 Address: DF:A9:FF:F6:B1:1A (OUI DF-A9-FF)
        Count: 1
< ACL Data TX: Handle 1101 flags 0x00 dlen 7              #300 [hci1] 22.864243
      ATT: Read Response (0x0b) len 2
> HCI Event: Number of Completed Packets (0x13) plen 5    #301 [hci1] 23.029989
        Num handles: 1
        Handle: 1101 Address: DF:A9:FF:F6:B1:1A (OUI DF-A9-FF)
        Count: 1
        #300: len 7 (0 Kb/s)
        Latency: 165 msec (73-171 msec ~160 msec)
> ACL Data RX: Handle 1101 flags 0x02 dlen 7              #302 [hci1] 23.030178
      ATT: Read Request (0x0a) len 2
        Handle: 0x002f
< HCI Command: Host Number of Com.. (0x03|0x0035) plen 5  #303 [hci1] 23.043963
        Num handles: 1
        Handle: 1101 Address: DF:A9:FF:F6:B1:1A (OUI DF-A9-FF)
        Count: 1
< ACL Data TX: Handle 1101 flags 0x00 dlen 13             #304 [hci1] 23.044066
      ATT: Read Response (0x0b) len 8
> HCI Event: Number of Completed Packets (0x13) plen 5    #305 [hci1] 23.205056
        Num handles: 1
        Handle: 1101 Address: DF:A9:FF:F6:B1:1A (OUI DF-A9-FF)
        Count: 1
        #304: len 13 (0 Kb/s)
        Latency: 160 msec (73-171 msec ~160 msec)
> ACL Data RX: Handle 1101 flags 0x02 dlen 7              #306 [hci1] 23.205228
      ATT: Read Request (0x0a) len 2
        Handle: 0x0033
< HCI Command: Host Number of Com.. (0x03|0x0035) plen 5  #307 [hci1] 23.224127
        Num handles: 1
        Handle: 1101 Address: DF:A9:FF:F6:B1:1A (OUI DF-A9-FF)
        Count: 1
< ACL Data TX: Handle 1101 flags 0x00 dlen 9              #308 [hci1] 23.224172
      ATT: Read Response (0x0b) len 4
> HCI Event: Number of Completed Packets (0x13) plen 5    #309 [hci1] 23.380040
        Num handles: 1
        Handle: 1101 Address: DF:A9:FF:F6:B1:1A (OUI DF-A9-FF)
        Count: 1
        #308: len 9 (0 Kb/s)
        Latency: 155 msec (73-171 msec ~158 msec)
> ACL Data RX: Handle 1101 flags 0x02 dlen 7              #310 [hci1] 23.380253
      ATT: Read Request (0x0a) len 2
        Handle: 0x0031
< HCI Command: Host Number of Com.. (0x03|0x0035) plen 5  #311 [hci1] 23.384195
        Num handles: 1
        Handle: 1101 Address: DF:A9:FF:F6:B1:1A (OUI DF-A9-FF)
        Count: 1
< ACL Data TX: Handle 1101 flags 0x00 dlen 11             #312 [hci1] 23.384254
      ATT: Read Response (0x0b) len 6
> HCI Event: Number of Completed Packets (0x13) plen 5    #313 [hci1] 23.555069
        Num handles: 1
        Handle: 1101 Address: DF:A9:FF:F6:B1:1A (OUI DF-A9-FF)
        Count: 1
        #312: len 11 (0 Kb/s)
        Latency: 170 msec (73-171 msec ~164 msec)
> ACL Data RX: Handle 1101 flags 0x02 dlen 8              #314 [hci1] 23.555323
      ATT: Write Request (0x12) len 3
        Handle: 0x0038
          Data: 04
< HCI Command: Host Number of Com.. (0x03|0x0035) plen 5  #315 [hci1] 23.564663
        Num handles: 1
        Handle: 1101 Address: DF:A9:FF:F6:B1:1A (OUI DF-A9-FF)
        Count: 1
< ACL Data TX: Handle 1101 flags 0x00 dlen 5              #316 [hci1] 23.564980
      ATT: Write Response (0x13) len 0
< ACL Data TX: Handle 1101 flags 0x00 dlen 10             #317 [hci1] 23.565219
      ATT: Handle Value Indication (0x1d) len 5
        Handle: 0x0038
          Data: 700405
> HCI Event: Number of Completed Packets (0x13) plen 5    #318 [hci1] 23.642944
        Num handles: 1
        Handle: 1101 Address: DF:A9:FF:F6:B1:1A (OUI DF-A9-FF)
        Count: 1
        #316: len 5 (0 Kb/s)
        Latency: 77 msec (73-171 msec ~121 msec)
> HCI Event: Number of Completed Packets (0x13) plen 5    #319 [hci1] 23.730061
        Num handles: 1
        Handle: 1101 Address: DF:A9:FF:F6:B1:1A (OUI DF-A9-FF)
        Count: 1
        #317: len 10 (0 Kb/s)
        Latency: 164 msec (73-171 msec ~143 msec)
> ACL Data RX: Handle 1101 flags 0x02 dlen 5              #320 [hci1] 23.730208
      ATT: Handle Value Confirmation (0x1e) len 0
< HCI Command: Host Number of Com.. (0x03|0x0035) plen 5  #321 [hci1] 23.744483
        Num handles: 1
        Handle: 1101 Address: DF:A9:FF:F6:B1:1A (OUI DF-A9-FF)
        Count: 1
> HCI Event: Disconnect Complete (0x05) plen 4            #322 [hci1] 25.130158
        Status: Success (0x00)
        Handle: 1101 Address: DF:A9:FF:F6:B1:1A (OUI DF-A9-FF)
        Reason: Remote User Terminated Connection (0x13)
< HCI Command: Reset (0x03|0x0003) plen 0                 #323 [hci1] 31.704006
> HCI Event: Command Complete (0x0e) plen 4               #324 [hci1] 31.704506
      Reset (0x03|0x0003) ncmd 1
        Status: Success (0x00)
@ USER Close: main                                    {0x0001} [hci1] 31.723843
= Close Index: 00:00:00:00:00:00                               [hci1] 31.723851
