Bluetooth monitor ver 5.84
btmon[1471484]: = Note: Linux version 6.8.0-83-generic (x86_64)                                                          0.143028
btmon[1471484]: = Note: Bluetooth subsystem version 2.22                                                                 0.143029
= New Index: 00:00:00:00:00:00 (Primary,UART,hci0)                                                                       0.143030
= Open Index: 00:00:00:00:00:00                                                                                          0.150698
= Index Info: 00:00:00:00:00:00 (Nordic Semiconductor ASA)                                                               0.150702
zephyr.exe[1471486]: @ USER Open: main (privileged) version 2.22                                                {0x0001} 0.150705
zephyr.exe[1471486]: < HCI Command: Reset (0x03|0x0003) plen 0                                                        #1 0.150958
> HCI Event: Command Complete (0x0e) plen 4                                                                           #2 0.151827
      Reset (0x03|0x0003) ncmd 1
        Status: Success (0x00)
zephyr.exe[1471486]: < HCI Command: Read Local Supported Features (0x04|0x0003) plen 0                                #3 0.170665
> HCI Event: Command Complete (0x0e) plen 12                                                                          #4 0.171192
      Read Local Supported Features (0x04|0x0003) ncmd 1
        Status: Success (0x00)
        Features: 0x00 0x00 0x00 0x00 0x60 0x00 0x00 0x00
          BR/EDR Not Supported
          LE Supported (Controller)
zephyr.exe[1471486]: < HCI Command: Read Local Version Information (0x04|0x0001) plen 0                               #5 0.190637
> HCI Event: Command Complete (0x0e) plen 12                                                                          #6 0.191665
      Read Local Version Information (0x04|0x0001) ncmd 1
        Status: Success (0x00)
        HCI version: Reserved (0x0e) - Revision 12520 (0x30e8)
        LMP version: Reserved (0x0e) - Subversion 12520 (0x30e8)
        Manufacturer: Nordic Semiconductor ASA (89)
zephyr.exe[1471486]: < HCI Command: Read Local Supported Commands (0x04|0x0002) plen 0                                #7 0.210623
> HCI Event: Command Complete (0x0e) plen 68                                                                          #8 0.211891
      Read Local Supported Commands (0x04|0x0002) ncmd 1
        Status: Success (0x00)
        Commands: 119 entries
          Disconnect (Octet 0 - Bit 5)
          Read Remote Version Information (Octet 2 - Bit 7)
          Set Event Mask (Octet 5 - Bit 6)
          Reset (Octet 5 - Bit 7)
          Read Connection Accept Timeout (Octet 7 - Bit 2)
          Write Connection Accept Timeout (Octet 7 - Bit 3)
          Read Transmit Power Level (Octet 10 - Bit 2)
          Set Controller To Host Flow Control (Octet 10 - Bit 5)
          Host Buffer Size (Octet 10 - Bit 6)
          Host Number of Completed Packets (Octet 10 - Bit 7)
          Read Local Version Information (Octet 14 - Bit 3)
          Read Local Supported Features (Octet 14 - Bit 5)
          Read BD ADDR (Octet 15 - Bit 1)
          Read RSSI (Octet 15 - Bit 5)
          Set Event Mask Page 2 (Octet 22 - Bit 2)
          LE Set Event Mask (Octet 25 - Bit 0)
          LE Read Buffer Size (Octet 25 - Bit 1)
          LE Read Local Supported Features (Octet 25 - Bit 2)
          LE Set Random Address (Octet 25 - Bit 4)
          LE Set Advertising Parameters (Octet 25 - Bit 5)
          LE Read Advertising Channel TX Power (Octet 25 - Bit 6)
          LE Set Advertising Data (Octet 25 - Bit 7)
          LE Set Scan Response Data (Octet 26 - Bit 0)
          LE Set Advertise Enable (Octet 26 - Bit 1)
          LE Set Scan Parameters (Octet 26 - Bit 2)
          LE Set Scan Enable (Octet 26 - Bit 3)
          LE Create Connection (Octet 26 - Bit 4)
          LE Create Connection Cancel (Octet 26 - Bit 5)
          LE Read Accept List Size (Octet 26 - Bit 6)
          LE Clear Accept List (Octet 26 - Bit 7)
          LE Add Device To Accept List (Octet 27 - Bit 0)
          LE Remove Device From Accept List (Octet 27 - Bit 1)
          LE Connection Update (Octet 27 - Bit 2)
          LE Set Host Channel Classification (Octet 27 - Bit 3)
          LE Read Channel Map (Octet 27 - Bit 4)
          LE Read Remote Used Features (Octet 27 - Bit 5)
          LE Encrypt (Octet 27 - Bit 6)
          LE Rand (Octet 27 - Bit 7)
          LE Start Encryption (Octet 28 - Bit 0)
          LE Long Term Key Request Reply (Octet 28 - Bit 1)
          LE Long Term Key Request Neg Reply (Octet 28 - Bit 2)
          LE Read Supported States (Octet 28 - Bit 3)
          LE Receiver Test (Octet 28 - Bit 4)
          LE Transmitter Test (Octet 28 - Bit 5)
          LE Test End (Octet 28 - Bit 6)
          Read Authenticated Payload Timeout (Octet 32 - Bit 4)
          Write Authenticated Payload Timeout (Octet 32 - Bit 5)
          LE Set Data Length (Octet 33 - Bit 6)
          LE Read Suggested Default Data Length (Octet 33 - Bit 7)
          LE Write Suggested Default Data Length (Octet 34 - Bit 0)
          LE Add Device To Resolving List (Octet 34 - Bit 3)
          LE Remove Device From Resolving List (Octet 34 - Bit 4)
          LE Clear Resolving List (Octet 34 - Bit 5)
          LE Read Resolving List Size (Octet 34 - Bit 6)
          LE Set Address Resolution Enable (Octet 35 - Bit 1)
          LE Set Resolvable Private Address Timeout (Octet 35 - Bit 2)
          LE Read Maximum Data Length (Octet 35 - Bit 3)
          LE Read PHY (Octet 35 - Bit 4)
          LE Set Default PHY (Octet 35 - Bit 5)
          LE Set PHY (Octet 35 - Bit 6)
          LE Enhanced Receiver Test (Octet 35 - Bit 7)
          LE Enhanced Transmitter Test (Octet 36 - Bit 0)
          LE Set Advertising Set Random Address (Octet 36 - Bit 1)
          LE Set Extended Advertising Parameters (Octet 36 - Bit 2)
          LE Set Extended Advertising Data (Octet 36 - Bit 3)
          LE Set Extended Scan Response Data (Octet 36 - Bit 4)
          LE Set Extended Advertising Enable (Octet 36 - Bit 5)
          LE Read Maximum Advertising Data Length (Octet 36 - Bit 6)
          LE Read Number of Supported Advertising Sets (Octet 36 - Bit 7)
          LE Remove Advertising Set (Octet 37 - Bit 0)
          LE Clear Advertising Sets (Octet 37 - Bit 1)
          LE Set Periodic Advertising Parameters (Octet 37 - Bit 2)
          LE Set Periodic Advertising Data (Octet 37 - Bit 3)
          LE Set Periodic Advertising Enable (Octet 37 - Bit 4)
          LE Set Extended Scan Parameters (Octet 37 - Bit 5)
          LE Set Extended Scan Enable (Octet 37 - Bit 6)
          LE Extended Create Connection (Octet 37 - Bit 7)
          LE Periodic Advertising Create Sync (Octet 38 - Bit 0)
          LE Periodic Advertising Create Sync Cancel (Octet 38 - Bit 1)
          LE Periodic Advertising Terminate Sync (Octet 38 - Bit 2)
          LE Add Device To Periodic Advertiser List (Octet 38 - Bit 3)
          LE Remove Device From Periodic Advertiser List (Octet 38 - Bit 4)
          LE Clear Periodic Advertiser List (Octet 38 - Bit 5)
          LE Read Periodic Advertiser List Size (Octet 38 - Bit 6)
          LE Read Transmit Power (Octet 38 - Bit 7)
          LE Read RF Path Compensation (Octet 39 - Bit 0)
          LE Write RF Path Compensation (Octet 39 - Bit 1)
          LE Set Privacy Mode (Octet 39 - Bit 2)
          LE Periodic Advertising Receive Enable (Octet 40 - Bit 5)
          LE Periodic Advertising Sync Transfer (Octet 40 - Bit 6)
          LE Periodic Advertising Set Info Transfer (Octet 40 - Bit 7)
          LE Periodic Advertising Sync Transfer Parameters (Octet 41 - Bit 0)
          LE Set Default Periodic Advertisng Sync Transfer Parameters (Octet 41 - Bit 1)
          LE Read Buffer v2 (Octet 41 - Bit 5)
          LE Read ISO TX Sync (Octet 41 - Bit 6)
          LE Set Connected Isochronous Group Parameters (Octet 41 - Bit 7)
          LE Set Connected Isochronous Group Parameters Test (Octet 42 - Bit 0)
          LE Create Connected Isochronous Stream (Octet 42 - Bit 1)
          LE Remove Connected Isochronous Group (Octet 42 - Bit 2)
          LE Accept Connected Isochronous Stream Request (Octet 42 - Bit 3)
          LE Reject Connected Isochronous Stream Request (Octet 42 - Bit 4)
          LE Create Broadcast Isochronous Group (Octet 42 - Bit 5)
          LE Create Broadcast Isochronous Group Test (Octet 42 - Bit 6)
          LE Terminate Broadcast Isochronous Group (Octet 42 - Bit 7)
          LE Broadcast Isochronous Group Create Sync (Octet 43 - Bit 0)
          LE Broadcast Isochronous Group Terminate Sync (Octet 43 - Bit 1)
          LE Request Peer SCA (Octet 43 - Bit 2)
          LE Setup Isochronous Data Path (Octet 43 - Bit 3)
          LE Remove Isochronous Data Path (Octet 43 - Bit 4)
          LE Isochronous Transmit Test (Octet 43 - Bit 5)
          LE Isochronous Receive Test (Octet 43 - Bit 6)
          LE Isochronous Read Test Counters (Octet 43 - Bit 7)
          LE Isochronous Read Test Counters (Octet 44 - Bit 0)
          LE Set Host Feature (Octet 44 - Bit 1)
          LE Read ISO link quality (Octet 44 - Bit 2)
          Octet 45 - Bit 6 
          Octet 46 - Bit 0 
          Octet 46 - Bit 1 
          Octet 46 - Bit 2 
zephyr.exe[1471486]: < HCI Command: Host Buffer Size (0x03|0x0033) plen 7                                             #9 0.230645
        ACL MTU: 255  ACL max packet: 16
        SCO MTU: 0    SCO max packet: 0
> HCI Event: Command Complete (0x0e) plen 4                                                                          #10 0.231643
      Host Buffer Size (0x03|0x0033) ncmd 1
        Status: Success (0x00)
zephyr.exe[1471486]: < HCI Command: Set Controller To Host Flow Control (0x03|0x0031) plen 1                         #11 0.250629
        Flow control: ACL Data Packets (0x01)
> HCI Event: Command Complete (0x0e) plen 4                                                                          #12 0.251426
      Set Controller To Host Flow Control (0x03|0x0031) ncmd 1
        Status: Success (0x00)
zephyr.exe[1471486]: < HCI Command: LE Read Local Supported Features (0x08|0x0003) plen 0                            #13 0.270626
> HCI Event: Command Complete (0x0e) plen 12                                                                         #14 0.271351
      LE Read Local Supported Features (0x08|0x0003) ncmd 1
        Status: Success (0x00)
        Features: 0xfd 0x79 0x00 0xf7 0x30 0x01 0x00 0x00
          LE Encryption
          Extended Reject Indication
          Peripheral-initiated Features Exchange
          LE Ping
          LE Data Packet Length Extension
          LL Privacy
          Extended Scanner Filter Policies
          LE 2M PHY
          LE Coded PHY
          LE Extended Advertising
          LE Periodic Advertising
          Channel Selection Algorithm #2
          Periodic Advertising Sync Transfer - Sender
          Periodic Advertising Sync Transfer - Recipient
          Sleep Clock Accuracy Updates
          Connected Isochronous Stream - Central
          Connected Isochronous Stream - Peripheral
          Isochronous Broadcaster
          Synchronized Receiver
          Periodic Advertising ADI support
          Connection Subrating
          Unknown features (0x0000010000000000)
zephyr.exe[1471486]: < HCI Command: LE Set Host Feature (0x08|0x0074) plen 2                                         #15 0.290633
        Bit Number: 32
          Connected Isochronous Stream (Host Support)
        Bit Value: 1
> HCI Event: Command Complete (0x0e) plen 4                                                                          #16 0.291190
      LE Set Host Feature (0x08|0x0074) ncmd 1
        Status: Success (0x00)
zephyr.exe[1471486]: < HCI Command: LE Read Buffer v2 (0x08|0x0060) plen 0                                           #17 0.310627
> HCI Event: Command Complete (0x0e) plen 10                                                                         #18 0.311401
      LE Read Buffer v2 (0x08|0x0060) ncmd 1
        Status: Success (0x00)
        ACL MTU: 27
        ACL max packet: 3
        ISO MTU: 318
        ISO max packet: 3
zephyr.exe[1471486]: < HCI Command: LE Read Maximum Advertising Data Length (0x08|0x003a) plen 0                     #19 0.330651
> HCI Event: Command Complete (0x0e) plen 6                                                                          #20 0.331566
      LE Read Maximum Advertising Data Length (0x08|0x003a) ncmd 1
        Status: Success (0x00)
        Max length: 1650
zephyr.exe[1471486]: < HCI Command: LE Read Supported States (0x08|0x001c) plen 0                                    #21 0.350622
> HCI Event: Command Complete (0x0e) plen 12                                                                         #22 0.351428
      LE Read Supported States (0x08|0x001c) ncmd 1
        Status: Success (0x00)
        States: 0x000003ff3e0306ff
          Non-connectable Advertising State
          Scannable Advertising State
          Connectable Advertising State
          High Duty Cycle Directed Advertising State
          Passive Scanning State
          Active Scanning State
          Initiating State
            and Connection State (Central Role)
          Connection State (Peripheral Role)
          Scannable Advertising State
            and Passive Scanning State
          Connectable Advertising State
            and Passive Scanning State
          Non-connectable Advertising State
            and Initiating State
          Scannable Advertising State
            and Initiating State
          Active Scanning State
            and Connection State (Central Role)
          Passive Scanning State
            and Connection State (Peripheral Role)
          Active Scanning State
            and Connection State (Peripheral Role)
          Initiating State
            and Connection State (Central Role)
            and Central Role & Central Role
          Low Duty Cycle Directed Advertising State
          Connectable Advertising State
            and Initiating State
            and Central Role & Peripheral Role
          High Duty Cycle Directed Advertising State
            and Initiating State
            and Central Role & Peripheral Role
          Low Duty Cycle Directed Advertising State
            and Initiating State
            and Central Role & Peripheral Role
          Connectable Advertising State
            and Connection State (Central Role)
            and Central Role & Peripheral Role
          High Duty Cycle Directed Advertising State
            and Connection State (Central Role)
            and Central Role & Peripheral Role
          Low Duty Cycle Directed Advertising State
            and Connection State (Central Role)
            and Central Role & Peripheral Role
          Connectable Advertising State
            and Connection State (Peripheral Role)
            and Central Role & Peripheral Role
          High Duty Cycle Directed Advertising State
            and Connection State (Peripheral Role)
            and Peripheral Role & Peripheral Role
          Low Duty Cycle Directed Advertising State
            and Connection State (Peripheral Role)
            and Peripheral Role & Peripheral Role
          Initiating State
            and Connection State (Peripheral Role)
            and Central Role & Peripheral Role
zephyr.exe[1471486]: < HCI Command: LE Read Maximum Data Length (0x08|0x002f) plen 0                                 #23 0.370624
> HCI Event: Command Complete (0x0e) plen 12                                                                         #24 0.371357
      LE Read Maximum Data Length (0x08|0x002f) ncmd 1
        Status: Success (0x00)
        Max TX octets: 251
        Max TX time: 2704
        Max RX octets: 251
        Max RX time: 2704
zephyr.exe[1471486]: < HCI Command: LE Write Suggested Default Data Length (0x08|0x0024) plen 4                      #25 0.390598
        TX octets: 251
        TX time: 2704
> HCI Event: Command Complete (0x0e) plen 4                                                                          #26 0.391536
      LE Write Suggested Default Data Length (0x08|0x0024) ncmd 1
        Status: Success (0x00)
zephyr.exe[1471486]: < HCI Command: LE Read Resolving List Size (0x08|0x002a) plen 0                                 #27 0.410632
> HCI Event: Command Complete (0x0e) plen 5                                                                          #28 0.411287
      LE Read Resolving List Size (0x08|0x002a) ncmd 1
        Status: Success (0x00)
        Size: 8
zephyr.exe[1471486]: < HCI Command: LE Set Event Mask (0x08|0x0001) plen 8                                           #29 0.430639
        Mask: 0x000002023f87fa5e
          LE Advertising Report
          LE Connection Update Complete
          LE Read Remote Used Features Complete
          LE Long Term Key Request
          LE Data Length Change
          LE Enhanced Connection Complete
          LE PHY Update Complete
          LE Extended Advertising Report
          LE Periodic Advertising Sync Established
          LE Periodic Advertising Report
          LE Periodic Advertising Sync Lost
          LE Extended Scan Timeout
          LE Extended Advertising Set Terminated
          LE Scan Request Received
          LE Periodic Advertising Sync Transfer Rvc
          LE CIS Established
          LE CIS Request
          LE Create BIG Complete
          LE Terminate BIG Complete
          LE BIG Sync Established Complete
          LE BIG Sync Lost
          LE BIG Info Advertising Report
          Unknown mask (0x0000020000000000)
> HCI Event: Command Complete (0x0e) plen 4                                                                          #30 0.431205
      LE Set Event Mask (0x08|0x0001) ncmd 1
        Status: Success (0x00)
zephyr.exe[1471486]: < HCI Command: Set Event Mask (0x03|0x0001) plen 8                                              #31 0.450629
        Mask: 0x2000800002008890
          Disconnection Complete
          Encryption Change
          Read Remote Version Information Complete
          Hardware Error
          Data Buffer Overflow
          Encryption Key Refresh Complete
          LE Meta
> HCI Event: Command Complete (0x0e) plen 4                                                                          #32 0.451337
      Set Event Mask (0x03|0x0001) ncmd 1
        Status: Success (0x00)
zephyr.exe[1471486]: < HCI Command: Read BD ADDR (0x04|0x0009) plen 0                                                #33 0.470631
> HCI Event: Command Complete (0x0e) plen 10                                                                         #34 0.471365
      Read BD ADDR (0x04|0x0009) ncmd 1
        Status: Success (0x00)
        Address: 00:00:00:00:00:00 (OUI 00-00-00)
zephyr.exe[1471486]: < HCI Command: LE Set Random Address (0x08|0x0005) plen 6                                       #35 0.490639
        Address: D5:B6:CC:31:DB:3B (Static)
> HCI Event: Command Complete (0x0e) plen 4                                                                          #36 0.491701
      LE Set Random Address (0x08|0x0005) ncmd 1
        Status: Success (0x00)
zephyr.exe[1471486]: < HCI Command: LE Set Extended Advertising Parameters (0x08|0x0036) plen 25                     #37 2.740676
        Handle: 0x00
        Properties: 0x0013
          Connectable
          Scannable
          Use legacy advertising PDUs: ADV_IND
        Min advertising interval: 100.000 msec (0x00a0)
        Max advertising interval: 150.000 msec (0x00f0)
        Channel map: 37, 38, 39 (0x07)
        Own address type: Random (0x01)
        Peer address type: Public (0x00)
        Peer address: 00:00:00:00:00:00 (OUI 00-00-00)
        Filter policy: Allow Scan Request from Any, Allow Connect Request from Any (0x00)
        TX power: Host has no preference (0x7f)
        Primary PHY: LE 1M (0x01)
        Secondary max skip: 0x00
        Secondary PHY: LE 1M (0x01)
        SID: 0x00
        Scan request notifications: Disabled (0x00)
> HCI Event: Command Complete (0x0e) plen 5                                                                          #38 2.741672
      LE Set Extended Advertising Parameters (0x08|0x0036) ncmd 1
        Status: Success (0x00)
        TX power (selected): 0 dbm (0x00)
zephyr.exe[1471486]: < HCI Command: LE Set Advertising Set Random Address (0x08|0x0035) plen 7                       #39 2.750671
        Advertising handle: 0x00
        Advertising random address: D5:B6:CC:31:DB:3B (Static)
> HCI Event: Command Complete (0x0e) plen 4                                                                          #40 2.751184
      LE Set Advertising Set Random Address (0x08|0x0035) ncmd 1
        Status: Success (0x00)
zephyr.exe[1471486]: < HCI Command: LE Set Extended Advertising Data (0x08|0x0037) plen 22                           #41 2.770637
        Handle: 0x00
        Operation: Complete extended advertising data (0x03)
        Fragment preference: Minimize fragmentation (0x01)
        Data length: 0x12
        Flags: 0x06
          LE General Discoverable Mode
          BR/EDR Not Supported
        Name (complete): Tester_F6B11A
> HCI Event: Command Complete (0x0e) plen 4                                                                          #42 2.771303
      LE Set Extended Advertising Data (0x08|0x0037) ncmd 1
        Status: Success (0x00)
zephyr.exe[1471486]: < HCI Command: LE Set Extended Scan Response Data (0x08|0x0038) plen 4                          #43 2.790655
        Handle: 0x00
        Operation: Complete scan response data (0x03)
        Fragment preference: Minimize fragmentation (0x01)
        Data length: 0x00
> HCI Event: Command Complete (0x0e) plen 4                                                                          #44 2.791654
      LE Set Extended Scan Response Data (0x08|0x0038) ncmd 1
        Status: Success (0x00)
zephyr.exe[1471486]: < HCI Command: LE Set Extended Advertising Enable (0x08|0x0039) plen 6                          #45 2.810682
        Extended advertising: Enabled (0x01)
        Number of sets: 1 (0x01)
        Entry 0
          Handle: 0x00
          Duration: 0 ms (0x00)
          Max ext adv events: 0
> HCI Event: Command Complete (0x0e) plen 4                                                                          #46 2.811251
      LE Set Extended Advertising Enable (0x08|0x0039) ncmd 1
        Status: Success (0x00)
> HCI Event: LE Meta Event (0x3e) plen 31                                                                            #47 2.924388
      LE Enhanced Connection Complete (0x0a)
        Status: Success (0x00)
        Handle: 507
        Role: Peripheral (0x01)
        Peer address type: Public (0x00)
        Peer address: DF:A9:FF:F6:B1:1A (OUI DF-A9-FF)
        Local resolvable private address: 00:00:00:00:00:00 (Non-Resolvable)
        Peer resolvable private address: 00:00:00:00:00:00 (Non-Resolvable)
        Connection interval: 87.50 msec (0x0046)
        Connection latency: 0 (0x0000)
        Supervision timeout: 20000 msec (0x07d0)
        Central clock accuracy: 0x01
> HCI Event: LE Meta Event (0x3e) plen 6                                                                             #48 2.924390
      LE Advertising Set Terminated (0x12)
        Status: Success (0x00)
        Handle: 0
        Connection handle: 507
        Number of completed extended advertising events: 0
zephyr.exe[1471486]: < HCI Command: LE Read Remote Used Features (0x08|0x0016) plen 2                                #49 2.930857
        Handle: 507 Address: DF:A9:FF:F6:B1:1A (OUI DF-A9-FF)
> HCI Event: Command Status (0x0f) plen 4                                                                            #50 2.931830
      LE Read Remote Used Features (0x08|0x0016) ncmd 1
        Status: Success (0x00)
> HCI Event: LE Meta Event (0x3e) plen 12                                                                            #51 3.188240
      LE Read Remote Used Features (0x04)
        Status: Success (0x00)
        Handle: 507 Address: DF:A9:FF:F6:B1:1A (OUI DF-A9-FF)
        Features: 0x2d 0x49 0x00 0xf7 0x67 0xd8 0x00 0x00
          LE Encryption
          Extended Reject Indication
          Peripheral-initiated Features Exchange
          LE Data Packet Length Extension
          LE 2M PHY
          LE Coded PHY
          Channel Selection Algorithm #2
          Periodic Advertising Sync Transfer - Sender
          Periodic Advertising Sync Transfer - Recipient
          Sleep Clock Accuracy Updates
          Connected Isochronous Stream - Central
          Connected Isochronous Stream - Peripheral
          Isochronous Broadcaster
          Synchronized Receiver
          Connected Isochronous Stream (Host Support)
          LE Power Control Request
          LE Power Control Request
          Connection Subrating
          Connection Subrating (Host Support)
          Unknown features (0x0000d80000000000)
> ACL Data RX: Handle 507 flags 0x02 dlen 11                                                                         #52 3.625470
      SMP: Pairing Request (0x01) len 6
        IO capability: KeyboardOnly (0x02)
        OOB data: Authentication data not present (0x00)
        Authentication requirement: No bonding, MITM, SC, No Keypresses (0xcc)
        Max encryption key size: 16
        Initiator key distribution: <none> (0x00)
        Responder key distribution: <none> (0x00)
zephyr.exe[1471486]: < HCI Command: Host Number of Completed Packets (0x03|0x0035) plen 5                            #53 3.630828
        Num handles: 1
        Handle: 507 Address: DF:A9:FF:F6:B1:1A (OUI DF-A9-FF)
        Count: 1
zephyr.exe[1471486]: < ACL Data TX: Handle 507 [1/3] flags 0x00 dlen 11                                              #54 3.630855
      SMP: Pairing Response (0x02) len 6
        IO capability: DisplayOnly (0x00)
        OOB data: Authentication data not present (0x00)
        Authentication requirement: Bonding, No MITM, SC, No Keypresses (0x09)
        Max encryption key size: 16
        Initiator key distribution: <none> (0x00)
        Responder key distribution: <none> (0x00)
> HCI Event: Number of Completed Packets (0x13) plen 5                                                               #55 3.800327
        Num handles: 1
        Handle: 507 Address: DF:A9:FF:F6:B1:1A (OUI DF-A9-FF)
        Count: 1
        Buffers: 0/3
        #54: len 11 (0 Kb/s)
        Latency: 169 msec (169-169 msec ~169 msec)
> ACL Data RX: Handle 507 flags 0x02 dlen 27                                                                         #56 3.801350
> ACL Data RX: Handle 507 flags 0x01 dlen 27                                                                         #57 3.801438
> ACL Data RX: Handle 507 flags 0x01 dlen 15                                                                         #58 3.802066
      SMP: Pairing Public Key (0x0c) len 64
        X[32]: 7dc1288f23dab678f82ef110a928212f34049ad54155fd5d0dcd2124a41e2eca
        Y[32]: b79857d08f5f930a79c49b4ff30cb9d94b6b53bf99bb2b51a6e326c936afdd73
zephyr.exe[1471486]: < HCI Command: Host Number of Completed Packets (0x03|0x0035) plen 5                            #59 3.810899
        Num handles: 1
        Handle: 507 Address: DF:A9:FF:F6:B1:1A (OUI DF-A9-FF)
        Count: 1
zephyr.exe[1471486]: < HCI Command: Host Number of Completed Packets (0x03|0x0035) plen 5                            #60 3.810966
        Num handles: 1
        Handle: 507 Address: DF:A9:FF:F6:B1:1A (OUI DF-A9-FF)
        Count: 1
zephyr.exe[1471486]: < HCI Command: Host Number of Completed Packets (0x03|0x0035) plen 5                            #61 3.811032
        Num handles: 1
        Handle: 507 Address: DF:A9:FF:F6:B1:1A (OUI DF-A9-FF)
        Count: 1
zephyr.exe[1471486]: < ACL Data TX: Handle 507 [1/3] flags 0x00 dlen 27                                              #62 3.811047
zephyr.exe[1471486]: < ACL Data TX: Handle 507 flags 0x01 dlen 27                                                    #63 3.811063
zephyr.exe[1471486]: < ACL Data TX: Handle 507 flags 0x01 dlen 15                                                    #64 3.811066
      SMP: Pairing Public Key (0x0c) len 64
        X[32]: 98308440221e2d910f0e54b71e7ec652857aa9b5a0dc65028824cc19db1226e9
        Y[32]: 67a4816bcb62efb21701e31fdb27561a6217575fb007a8bbdabe7e28b6f68482
> HCI Event: Number of Completed Packets (0x13) plen 5                                                               #65 3.888147
        Num handles: 1
        Handle: 507 Address: DF:A9:FF:F6:B1:1A (OUI DF-A9-FF)
        Count: 1
        Buffers: 0/3
        #62: len 27 (2 Kb/s)
        Latency: 77 msec (77-169 msec ~123 msec)
> HCI Event: Number of Completed Packets (0x13) plen 5                                                               #66 3.888905
        Num handles: 1
        Handle: 507 Address: DF:A9:FF:F6:B1:1A (OUI DF-A9-FF)
        Count: 1
        Buffers: underflow/3
        #63: len 27 (2 Kb/s)
        Latency: 77 msec (77-169 msec ~100 msec)
> HCI Event: Number of Completed Packets (0x13) plen 5                                                               #67 3.975007
        Num handles: 1
        Handle: 507 Address: DF:A9:FF:F6:B1:1A (OUI DF-A9-FF)
        Count: 1
        Buffers: underflow/3
        #64: len 15 (0 Kb/s)
        Latency: 163 msec (77-169 msec ~132 msec)
> ACL Data RX: Handle 507 flags 0x02 dlen 21                                                                         #68 4.937989
      SMP: Pairing Confirm (0x03) len 16
        Confirm value[16]: d0e8f309fd8cff00c158e539793d0d29
zephyr.exe[1471486]: < HCI Command: Host Number of Completed Packets (0x03|0x0035) plen 5                            #69 4.950781
        Num handles: 1
        Handle: 507 Address: DF:A9:FF:F6:B1:1A (OUI DF-A9-FF)
        Count: 1
zephyr.exe[1471486]: < ACL Data TX: Handle 507 [1/3] flags 0x00 dlen 21                                              #70 4.950804
      SMP: Pairing Confirm (0x03) len 16
        Confirm value[16]: 62b0c7cded02099e52fe7496b75e7b8f
> HCI Event: Number of Completed Packets (0x13) plen 5                                                               #71 5.112797
        Num handles: 1
        Handle: 507 Address: DF:A9:FF:F6:B1:1A (OUI DF-A9-FF)
        Count: 1
        Buffers: 0/3
        #70: len 21 (1 Kb/s)
        Latency: 161 msec (77-169 msec ~147 msec)
> ACL Data RX: Handle 507 flags 0x02 dlen 21                                                                         #72 5.113087
      SMP: Pairing Random (0x04) len 16
        Random value[16]: a004c735822fc30f95aef4d9e52208d4
zephyr.exe[1471486]: < HCI Command: Host Number of Completed Packets (0x03|0x0035) plen 5                            #73 5.130872
        Num handles: 1
        Handle: 507 Address: DF:A9:FF:F6:B1:1A (OUI DF-A9-FF)
        Count: 1
zephyr.exe[1471486]: < ACL Data TX: Handle 507 [1/3] flags 0x00 dlen 21                                              #74 5.130920
      SMP: Pairing Random (0x04) len 16
        Random value[16]: 8e6108f966a694cbe26df70bb96773e6
> HCI Event: Number of Completed Packets (0x13) plen 5                                                               #75 5.287863
        Num handles: 1
        Handle: 507 Address: DF:A9:FF:F6:B1:1A (OUI DF-A9-FF)
        Count: 1
        Buffers: 0/3
        #74: len 21 (1 Kb/s)
        Latency: 156 msec (77-169 msec ~152 msec)
> ACL Data RX: Handle 507 flags 0x02 dlen 21                                                                         #76 5.288459
      SMP: Pairing Confirm (0x03) len 16
        Confirm value[16]: b31baa11347d486bf02a9dfe1609c257
zephyr.exe[1471486]: < HCI Command: Host Number of Completed Packets (0x03|0x0035) plen 5                            #77 5.290775
        Num handles: 1
        Handle: 507 Address: DF:A9:FF:F6:B1:1A (OUI DF-A9-FF)
        Count: 1
zephyr.exe[1471486]: < ACL Data TX: Handle 507 [1/3] flags 0x00 dlen 21                                              #78 5.290801
      SMP: Pairing Confirm (0x03) len 16
        Confirm value[16]: acdab444c043b411bb7e425960bfa585
> HCI Event: Number of Completed Packets (0x13) plen 5                                                               #79 5.462989
        Num handles: 1
        Handle: 507 Address: DF:A9:FF:F6:B1:1A (OUI DF-A9-FF)
        Count: 1
        Buffers: 0/3
        #78: len 21 (0 Kb/s)
        Latency: 172 msec (77-172 msec ~162 msec)
> ACL Data RX: Handle 507 flags 0x02 dlen 21                                                                         #80 5.463415
      SMP: Pairing Random (0x04) len 16
        Random value[16]: 2afe830d6bedf1dbeb41a4a90e7eaa42
zephyr.exe[1471486]: < HCI Command: Host Number of Completed Packets (0x03|0x0035) plen 5                            #81 5.470792
        Num handles: 1
        Handle: 507 Address: DF:A9:FF:F6:B1:1A (OUI DF-A9-FF)
        Count: 1
zephyr.exe[1471486]: < ACL Data TX: Handle 507 [1/3] flags 0x00 dlen 21                                              #82 5.470841
      SMP: Pairing Random (0x04) len 16
        Random value[16]: 4d02679f89a05211af56d8b3da64d21e
> HCI Event: Number of Completed Packets (0x13) plen 5                                                               #83 5.637770
        Num handles: 1
        Handle: 507 Address: DF:A9:FF:F6:B1:1A (OUI DF-A9-FF)
        Count: 1
        Buffers: 0/3
        #82: len 21 (1 Kb/s)
        Latency: 166 msec (77-172 msec ~164 msec)
> ACL Data RX: Handle 507 flags 0x02 dlen 21                                                                         #84 5.638048
      SMP: Pairing Confirm (0x03) len 16
        Confirm value[16]: 6724b9e5389e7a45ebdce14ad5e6b1a8
zephyr.exe[1471486]: < HCI Command: Host Number of Completed Packets (0x03|0x0035) plen 5                            #85 5.650867
        Num handles: 1
        Handle: 507 Address: DF:A9:FF:F6:B1:1A (OUI DF-A9-FF)
        Count: 1
zephyr.exe[1471486]: < ACL Data TX: Handle 507 [1/3] flags 0x00 dlen 21                                              #86 5.650895
      SMP: Pairing Confirm (0x03) len 16
        Confirm value[16]: 1221762f0f2a1550c08808bd215dfdd3
> HCI Event: Number of Completed Packets (0x13) plen 5                                                               #87 5.812911
        Num handles: 1
        Handle: 507 Address: DF:A9:FF:F6:B1:1A (OUI DF-A9-FF)
        Count: 1
        Buffers: 0/3
        #86: len 21 (1 Kb/s)
        Latency: 162 msec (77-172 msec ~163 msec)
> ACL Data RX: Handle 507 flags 0x02 dlen 21                                                                         #88 5.813089
      SMP: Pairing Random (0x04) len 16
        Random value[16]: 6901968ef710ae3d95a9be6fc0f1f43c
zephyr.exe[1471486]: < HCI Command: Host Number of Completed Packets (0x03|0x0035) plen 5                            #89 5.830865
        Num handles: 1
        Handle: 507 Address: DF:A9:FF:F6:B1:1A (OUI DF-A9-FF)
        Count: 1
zephyr.exe[1471486]: < ACL Data TX: Handle 507 [1/3] flags 0x00 dlen 21                                              #90 5.830889
      SMP: Pairing Random (0x04) len 16
        Random value[16]: 5e8286bc235a02440d0c3424a2acf8fd
> HCI Event: Number of Completed Packets (0x13) plen 5                                                               #91 5.987850
        Num handles: 1
        Handle: 507 Address: DF:A9:FF:F6:B1:1A (OUI DF-A9-FF)
        Count: 1
        Buffers: 0/3
        #90: len 21 (1 Kb/s)
        Latency: 156 msec (77-172 msec ~160 msec)
> ACL Data RX: Handle 507 flags 0x02 dlen 21                                                                         #92 5.988053
      SMP: Pairing Confirm (0x03) len 16
        Confirm value[16]: 4c63d4eede1d65f32f31b6bec9a53a70
zephyr.exe[1471486]: < HCI Command: Host Number of Completed Packets (0x03|0x0035) plen 5                            #93 5.990819
        Num handles: 1
        Handle: 507 Address: DF:A9:FF:F6:B1:1A (OUI DF-A9-FF)
        Count: 1
zephyr.exe[1471486]: < ACL Data TX: Handle 507 [1/3] flags 0x00 dlen 21                                              #94 5.990888
      SMP: Pairing Confirm (0x03) len 16
        Confirm value[16]: f258e286430530cb690fe75a48976bb2
> HCI Event: Number of Completed Packets (0x13) plen 5                                                               #95 6.162710
        Num handles: 1
        Handle: 507 Address: DF:A9:FF:F6:B1:1A (OUI DF-A9-FF)
        Count: 1
        Buffers: 0/3
        #94: len 21 (0 Kb/s)
        Latency: 171 msec (77-172 msec ~165 msec)
> ACL Data RX: Handle 507 flags 0x02 dlen 21                                                                         #96 6.163644
      SMP: Pairing Random (0x04) len 16
        Random value[16]: 54668e888a2176b5679dae5f3e6643a6
zephyr.exe[1471486]: < HCI Command: Host Number of Completed Packets (0x03|0x0035) plen 5                            #97 6.170803
        Num handles: 1
        Handle: 507 Address: DF:A9:FF:F6:B1:1A (OUI DF-A9-FF)
        Count: 1
zephyr.exe[1471486]: < ACL Data TX: Handle 507 [1/3] flags 0x00 dlen 21                                              #98 6.170834
      SMP: Pairing Random (0x04) len 16
        Random value[16]: 5c4a1bcadd27bd58e945097b00bad7ac
> HCI Event: Number of Completed Packets (0x13) plen 5                                                               #99 6.337908
        Num handles: 1
        Handle: 507 Address: DF:A9:FF:F6:B1:1A (OUI DF-A9-FF)
        Count: 1
        Buffers: 0/3
        #98: len 21 (1 Kb/s)
        Latency: 167 msec (77-172 msec ~166 msec)
> ACL Data RX: Handle 507 flags 0x02 dlen 21                                                                        #100 6.338212
      SMP: Pairing Confirm (0x03) len 16
        Confirm value[16]: f391a2fe2fd4c38c764399d99f356fff
zephyr.exe[1471486]: < HCI Command: Host Number of Completed Packets (0x03|0x0035) plen 5                           #101 6.350808
        Num handles: 1
        Handle: 507 Address: DF:A9:FF:F6:B1:1A (OUI DF-A9-FF)
        Count: 1
zephyr.exe[1471486]: < ACL Data TX: Handle 507 [1/3] flags 0x00 dlen 21                                             #102 6.350830
      SMP: Pairing Confirm (0x03) len 16
        Confirm value[16]: 1c71d5a1cbcae4182e7e0703ee0db2f1
> HCI Event: Number of Completed Packets (0x13) plen 5                                                              #103 6.512960
        Num handles: 1
        Handle: 507 Address: DF:A9:FF:F6:B1:1A (OUI DF-A9-FF)
        Count: 1
        Buffers: 0/3
        #102: len 21 (1 Kb/s)
        Latency: 162 msec (77-172 msec ~164 msec)
> ACL Data RX: Handle 507 flags 0x02 dlen 21                                                                        #104 6.513402
      SMP: Pairing Random (0x04) len 16
        Random value[16]: 1ec5380cc9e70706771822e80f04339e
zephyr.exe[1471486]: < HCI Command: Host Number of Completed Packets (0x03|0x0035) plen 5                           #105 6.530885
        Num handles: 1
        Handle: 507 Address: DF:A9:FF:F6:B1:1A (OUI DF-A9-FF)
        Count: 1
zephyr.exe[1471486]: < ACL Data TX: Handle 507 [1/3] flags 0x00 dlen 21                                             #106 6.530956
      SMP: Pairing Random (0x04) len 16
        Random value[16]: 32527e6e64e79f33b2e374394db8ab2d
> HCI Event: Number of Completed Packets (0x13) plen 5                                                              #107 6.687897
        Num handles: 1
        Handle: 507 Address: DF:A9:FF:F6:B1:1A (OUI DF-A9-FF)
        Count: 1
        Buffers: 0/3
        #106: len 21 (1 Kb/s)
        Latency: 156 msec (77-172 msec ~160 msec)
> ACL Data RX: Handle 507 flags 0x02 dlen 21                                                                        #108 6.688383
      SMP: Pairing Confirm (0x03) len 16
        Confirm value[16]: a0a303e289013f955189e86e87a745c0
zephyr.exe[1471486]: < HCI Command: Host Number of Completed Packets (0x03|0x0035) plen 5                           #109 6.690865
        Num handles: 1
        Handle: 507 Address: DF:A9:FF:F6:B1:1A (OUI DF-A9-FF)
        Count: 1
zephyr.exe[1471486]: < ACL Data TX: Handle 507 [1/3] flags 0x00 dlen 21                                             #110 6.690926
      SMP: Pairing Confirm (0x03) len 16
        Confirm value[16]: 72bed319315870a6771adcb9a4b31f0b
> HCI Event: Number of Completed Packets (0x13) plen 5                                                              #111 6.862824
        Num handles: 1
        Handle: 507 Address: DF:A9:FF:F6:B1:1A (OUI DF-A9-FF)
        Count: 1
        Buffers: 0/3
        #110: len 21 (0 Kb/s)
        Latency: 171 msec (77-172 msec ~166 msec)
> ACL Data RX: Handle 507 flags 0x02 dlen 21                                                                        #112 6.862999
      SMP: Pairing Random (0x04) len 16
        Random value[16]: 3df8a16c9b6e5e2f195206bbf736a387
zephyr.exe[1471486]: < HCI Command: Host Number of Completed Packets (0x03|0x0035) plen 5                           #113 6.870874
        Num handles: 1
        Handle: 507 Address: DF:A9:FF:F6:B1:1A (OUI DF-A9-FF)
        Count: 1
zephyr.exe[1471486]: < ACL Data TX: Handle 507 [1/3] flags 0x00 dlen 21                                             #114 6.870948
      SMP: Pairing Random (0x04) len 16
        Random value[16]: dddbdfe2838e9a8cc6964353c850fef7
> HCI Event: Number of Completed Packets (0x13) plen 5                                                              #115 7.037837
        Num handles: 1
        Handle: 507 Address: DF:A9:FF:F6:B1:1A (OUI DF-A9-FF)
        Count: 1
        Buffers: 0/3
        #114: len 21 (1 Kb/s)
        Latency: 166 msec (77-172 msec ~166 msec)
> ACL Data RX: Handle 507 flags 0x02 dlen 21                                                                        #116 7.038124
      SMP: Pairing Confirm (0x03) len 16
        Confirm value[16]: 2f7e732f0ed18bac1e9d10ff4ddf008c
zephyr.exe[1471486]: < HCI Command: Host Number of Completed Packets (0x03|0x0035) plen 5                           #117 7.050900
        Num handles: 1
        Handle: 507 Address: DF:A9:FF:F6:B1:1A (OUI DF-A9-FF)
        Count: 1
zephyr.exe[1471486]: < ACL Data TX: Handle 507 [1/3] flags 0x00 dlen 21                                             #118 7.050954
      SMP: Pairing Confirm (0x03) len 16
        Confirm value[16]: 0cf1a8eea3eb3559ca7fd6afd5eca28d
> HCI Event: Number of Completed Packets (0x13) plen 5                                                              #119 7.212898
        Num handles: 1
        Handle: 507 Address: DF:A9:FF:F6:B1:1A (OUI DF-A9-FF)
        Count: 1
        Buffers: 0/3
        #118: len 21 (1 Kb/s)
        Latency: 161 msec (77-172 msec ~164 msec)
> ACL Data RX: Handle 507 flags 0x02 dlen 21                                                                        #120 7.213002
      SMP: Pairing Random (0x04) len 16
        Random value[16]: 6618163723fcb672e2c486cafba3af01
zephyr.exe[1471486]: < HCI Command: Host Number of Completed Packets (0x03|0x0035) plen 5                           #121 7.230893
        Num handles: 1
        Handle: 507 Address: DF:A9:FF:F6:B1:1A (OUI DF-A9-FF)
        Count: 1
zephyr.exe[1471486]: < ACL Data TX: Handle 507 [1/3] flags 0x00 dlen 21                                             #122 7.230917
      SMP: Pairing Random (0x04) len 16
        Random value[16]: eb9f1915536596b6fc3db1c86b2b1970
> HCI Event: Number of Completed Packets (0x13) plen 5                                                              #123 7.387887
        Num handles: 1
        Handle: 507 Address: DF:A9:FF:F6:B1:1A (OUI DF-A9-FF)
        Count: 1
        Buffers: 0/3
        #122: len 21 (1 Kb/s)
        Latency: 156 msec (77-172 msec ~160 msec)
> ACL Data RX: Handle 507 flags 0x02 dlen 21                                                                        #124 7.388051
      SMP: Pairing Confirm (0x03) len 16
        Confirm value[16]: 0e3ca199d25c700d9d8ccb2c5777ba20
zephyr.exe[1471486]: < HCI Command: Host Number of Completed Packets (0x03|0x0035) plen 5                           #125 7.390808
        Num handles: 1
        Handle: 507 Address: DF:A9:FF:F6:B1:1A (OUI DF-A9-FF)
        Count: 1
zephyr.exe[1471486]: < ACL Data TX: Handle 507 [1/3] flags 0x00 dlen 21                                             #126 7.390837
      SMP: Pairing Confirm (0x03) len 16
        Confirm value[16]: bba714064a01cd837e5f9309d12f22df
> HCI Event: Number of Completed Packets (0x13) plen 5                                                              #127 7.562776
        Num handles: 1
        Handle: 507 Address: DF:A9:FF:F6:B1:1A (OUI DF-A9-FF)
        Count: 1
        Buffers: 0/3
        #126: len 21 (0 Kb/s)
        Latency: 171 msec (77-172 msec ~166 msec)
> ACL Data RX: Handle 507 flags 0x02 dlen 21                                                                        #128 7.563374
      SMP: Pairing Random (0x04) len 16
        Random value[16]: 8d7d233fc61d8f50a82812466035b4ed
zephyr.exe[1471486]: < HCI Command: Host Number of Completed Packets (0x03|0x0035) plen 5                           #129 7.570895
        Num handles: 1
        Handle: 507 Address: DF:A9:FF:F6:B1:1A (OUI DF-A9-FF)
        Count: 1
zephyr.exe[1471486]: < ACL Data TX: Handle 507 [1/3] flags 0x00 dlen 21                                             #130 7.570900
      SMP: Pairing Random (0x04) len 16
        Random value[16]: 5c794dc9ad9f2c3f295ebd5ad5e1c3cf
> HCI Event: Number of Completed Packets (0x13) plen 5                                                              #131 7.737741
        Num handles: 1
        Handle: 507 Address: DF:A9:FF:F6:B1:1A (OUI DF-A9-FF)
        Count: 1
        Buffers: 0/3
        #130: len 21 (1 Kb/s)
        Latency: 166 msec (77-172 msec ~166 msec)
> ACL Data RX: Handle 507 flags 0x02 dlen 21                                                                        #132 7.737934
      SMP: Pairing Confirm (0x03) len 16
        Confirm value[16]: fedc2fe012b0534a6321a4ffa7e0be0c
zephyr.exe[1471486]: < HCI Command: Host Number of Completed Packets (0x03|0x0035) plen 5                           #133 7.750916
        Num handles: 1
        Handle: 507 Address: DF:A9:FF:F6:B1:1A (OUI DF-A9-FF)
        Count: 1
zephyr.exe[1471486]: < ACL Data TX: Handle 507 [1/3] flags 0x00 dlen 21                                             #134 7.750975
      SMP: Pairing Confirm (0x03) len 16
        Confirm value[16]: 9e0de790f3eda6a7e353f8036bb36861
> HCI Event: Number of Completed Packets (0x13) plen 5                                                              #135 7.912779
        Num handles: 1
        Handle: 507 Address: DF:A9:FF:F6:B1:1A (OUI DF-A9-FF)
        Count: 1
        Buffers: 0/3
        #134: len 21 (1 Kb/s)
        Latency: 161 msec (77-172 msec ~164 msec)
> ACL Data RX: Handle 507 flags 0x02 dlen 21                                                                        #136 7.913450
      SMP: Pairing Random (0x04) len 16
        Random value[16]: e9c296962b97a48a7f76549fac164f6d
zephyr.exe[1471486]: < HCI Command: Host Number of Completed Packets (0x03|0x0035) plen 5                           #137 7.930816
        Num handles: 1
        Handle: 507 Address: DF:A9:FF:F6:B1:1A (OUI DF-A9-FF)
        Count: 1
zephyr.exe[1471486]: < ACL Data TX: Handle 507 [1/3] flags 0x00 dlen 21                                             #138 7.930843
      SMP: Pairing Random (0x04) len 16
        Random value[16]: 5c2fff312cdf99c9491988e877355a9a
zephyr.exe[1471486]: < ACL Data TX: Handle 507 [2/3] flags 0x00 dlen 16                                             #139 7.940726
      LE L2CAP: Connection Parameter Update Request (0x12) ident 1 len 8
        Min interval: 24
        Max interval: 40
        Peripheral latency: 0
        Timeout multiplier: 42
> HCI Event: Number of Completed Packets (0x13) plen 5                                                              #140 8.000511
        Num handles: 1
        Handle: 507 Address: DF:A9:FF:F6:B1:1A (OUI DF-A9-FF)
        Count: 1
        Buffers: 1/3
        #138: len 21 (2 Kb/s)
        Latency: 69 msec (69-172 msec ~116 msec)
> HCI Event: Number of Completed Packets (0x13) plen 5                                                              #141 8.087761
        Num handles: 1
        Handle: 507 Address: DF:A9:FF:F6:B1:1A (OUI DF-A9-FF)
        Count: 1
        Buffers: 0/3
        #139: len 16 (0 Kb/s)
        Latency: 147 msec (69-172 msec ~131 msec)
> ACL Data RX: Handle 507 flags 0x02 dlen 21                                                                        #142 8.087973
      SMP: Pairing Confirm (0x03) len 16
        Confirm value[16]: 299b4070946b1fd7bea5cb94b9e8f5cc
zephyr.exe[1471486]: < HCI Command: Host Number of Completed Packets (0x03|0x0035) plen 5                           #143 8.090786
        Num handles: 1
        Handle: 507 Address: DF:A9:FF:F6:B1:1A (OUI DF-A9-FF)
        Count: 1
zephyr.exe[1471486]: < ACL Data TX: Handle 507 [1/3] flags 0x00 dlen 21                                             #144 8.090808
      SMP: Pairing Confirm (0x03) len 16
        Confirm value[16]: fec56d13f641d61328970e16a175a156
> ACL Data RX: Handle 507 flags 0x02 dlen 10                                                                        #145 8.175500
      LE L2CAP: Connection Parameter Update Response (0x13) ident 1 len 2
        Result: Connection Parameters accepted (0x0000)
zephyr.exe[1471486]: < HCI Command: Host Number of Completed Packets (0x03|0x0035) plen 5                           #146 8.190849
        Num handles: 1
        Handle: 507 Address: DF:A9:FF:F6:B1:1A (OUI DF-A9-FF)
        Count: 1
> HCI Event: Number of Completed Packets (0x13) plen 5                                                              #147 8.262926
        Num handles: 1
        Handle: 507 Address: DF:A9:FF:F6:B1:1A (OUI DF-A9-FF)
        Count: 1
        Buffers: 0/3
        #144: len 21 (0 Kb/s)
        Latency: 172 msec (69-172 msec ~152 msec)
> ACL Data RX: Handle 507 flags 0x02 dlen 21                                                                        #148 8.263262
      SMP: Pairing Random (0x04) len 16
        Random value[16]: eebe7c8b3575f221bde73b87a2ad5de1
zephyr.exe[1471486]: < HCI Command: Host Number of Completed Packets (0x03|0x0035) plen 5                           #149 8.270906
        Num handles: 1
        Handle: 507 Address: DF:A9:FF:F6:B1:1A (OUI DF-A9-FF)
        Count: 1
zephyr.exe[1471486]: < ACL Data TX: Handle 507 [1/3] flags 0x00 dlen 21                                             #150 8.270929
      SMP: Pairing Random (0x04) len 16
        Random value[16]: c629a3a987d808e808655d558dfc1155
> HCI Event: Number of Completed Packets (0x13) plen 5                                                              #151 8.437742
        Num handles: 1
        Handle: 507 Address: DF:A9:FF:F6:B1:1A (OUI DF-A9-FF)
        Count: 1
        Buffers: 0/3
        #150: len 21 (1 Kb/s)
        Latency: 166 msec (69-172 msec ~159 msec)
> ACL Data RX: Handle 507 flags 0x02 dlen 21                                                                        #152 8.438112
      SMP: Pairing Confirm (0x03) len 16
        Confirm value[16]: d66e3a8e578e325a0242267fc6de7523
zephyr.exe[1471486]: < HCI Command: Host Number of Completed Packets (0x03|0x0035) plen 5                           #153 8.450813
        Num handles: 1
        Handle: 507 Address: DF:A9:FF:F6:B1:1A (OUI DF-A9-FF)
        Count: 1
zephyr.exe[1471486]: < ACL Data TX: Handle 507 [1/3] flags 0x00 dlen 21                                             #154 8.450840
      SMP: Pairing Confirm (0x03) len 16
        Confirm value[16]: 4c8337e8364477c9a073c52d9b2a192c
> HCI Event: Number of Completed Packets (0x13) plen 5                                                              #155 8.612676
        Num handles: 1
        Handle: 507 Address: DF:A9:FF:F6:B1:1A (OUI DF-A9-FF)
        Count: 1
        Buffers: 0/3
        #154: len 21 (1 Kb/s)
        Latency: 161 msec (69-172 msec ~160 msec)
> ACL Data RX: Handle 507 flags 0x02 dlen 21                                                                        #156 8.613163
      SMP: Pairing Random (0x04) len 16
        Random value[16]: 508a21b10900b755f6f4f3ee49a4fbeb
zephyr.exe[1471486]: < HCI Command: Host Number of Completed Packets (0x03|0x0035) plen 5                           #157 8.630837
        Num handles: 1
        Handle: 507 Address: DF:A9:FF:F6:B1:1A (OUI DF-A9-FF)
        Count: 1
zephyr.exe[1471486]: < ACL Data TX: Handle 507 [1/3] flags 0x00 dlen 21                                             #158 8.630860
      SMP: Pairing Random (0x04) len 16
        Random value[16]: 92f20f6ad8f13724432c7fd6001c45ff
> HCI Event: Number of Completed Packets (0x13) plen 5                                                              #159 8.787787
        Num handles: 1
        Handle: 507 Address: DF:A9:FF:F6:B1:1A (OUI DF-A9-FF)
        Count: 1
        Buffers: 0/3
        #158: len 21 (1 Kb/s)
        Latency: 156 msec (69-172 msec ~158 msec)
> ACL Data RX: Handle 507 flags 0x02 dlen 21                                                                        #160 8.787902
      SMP: Pairing Confirm (0x03) len 16
        Confirm value[16]: f746b2af273209549c83ec2ad4dfa9cf
zephyr.exe[1471486]: < HCI Command: Host Number of Completed Packets (0x03|0x0035) plen 5                           #161 8.790846
        Num handles: 1
        Handle: 507 Address: DF:A9:FF:F6:B1:1A (OUI DF-A9-FF)
        Count: 1
zephyr.exe[1471486]: < ACL Data TX: Handle 507 [1/3] flags 0x00 dlen 21                                             #162 8.790917
      SMP: Pairing Confirm (0x03) len 16
        Confirm value[16]: dd8ad3d9752fa7825dc648fe25aae109
> HCI Event: Number of Completed Packets (0x13) plen 5                                                              #163 8.962698
        Num handles: 1
        Handle: 507 Address: DF:A9:FF:F6:B1:1A (OUI DF-A9-FF)
        Count: 1
        Buffers: 0/3
        #162: len 21 (0 Kb/s)
        Latency: 171 msec (69-172 msec ~165 msec)
> ACL Data RX: Handle 507 flags 0x02 dlen 21                                                                        #164 8.963026
      SMP: Pairing Random (0x04) len 16
        Random value[16]: 068013d70dc06fa8ff56e906e4e4866a
zephyr.exe[1471486]: < HCI Command: Host Number of Completed Packets (0x03|0x0035) plen 5                           #165 8.970905
        Num handles: 1
        Handle: 507 Address: DF:A9:FF:F6:B1:1A (OUI DF-A9-FF)
        Count: 1
zephyr.exe[1471486]: < ACL Data TX: Handle 507 [1/3] flags 0x00 dlen 21                                             #166 8.970928
      SMP: Pairing Random (0x04) len 16
        Random value[16]: 23ac32ebbb5e14c8a6b9622f296d277f
> HCI Event: Number of Completed Packets (0x13) plen 5                                                              #167 9.137730
        Num handles: 1
        Handle: 507 Address: DF:A9:FF:F6:B1:1A (OUI DF-A9-FF)
        Count: 1
        Buffers: 0/3
        #166: len 21 (1 Kb/s)
        Latency: 166 msec (69-172 msec ~166 msec)
> ACL Data RX: Handle 507 flags 0x02 dlen 21                                                                        #168 9.138630
      SMP: Pairing Confirm (0x03) len 16
        Confirm value[16]: e7342a0354a819a94d59b05f154a7540
zephyr.exe[1471486]: < HCI Command: Host Number of Completed Packets (0x03|0x0035) plen 5                           #169 9.150851
        Num handles: 1
        Handle: 507 Address: DF:A9:FF:F6:B1:1A (OUI DF-A9-FF)
        Count: 1
zephyr.exe[1471486]: < ACL Data TX: Handle 507 [1/3] flags 0x00 dlen 21                                             #170 9.150878
      SMP: Pairing Confirm (0x03) len 16
        Confirm value[16]: 4f94b7de0d398fae04dc142b0320663f
> HCI Event: Number of Completed Packets (0x13) plen 5                                                              #171 9.312731
        Num handles: 1
        Handle: 507 Address: DF:A9:FF:F6:B1:1A (OUI DF-A9-FF)
        Count: 1
        Buffers: 0/3
        #170: len 21 (1 Kb/s)
        Latency: 161 msec (69-172 msec ~163 msec)
> ACL Data RX: Handle 507 flags 0x02 dlen 21                                                                        #172 9.313378
      SMP: Pairing Random (0x04) len 16
        Random value[16]: 43392010e67ed8dbee06cb40fa969b81
zephyr.exe[1471486]: < HCI Command: Host Number of Completed Packets (0x03|0x0035) plen 5                           #173 9.330912
        Num handles: 1
        Handle: 507 Address: DF:A9:FF:F6:B1:1A (OUI DF-A9-FF)
        Count: 1
zephyr.exe[1471486]: < ACL Data TX: Handle 507 [1/3] flags 0x00 dlen 21                                             #174 9.330981
      SMP: Pairing Random (0x04) len 16
        Random value[16]: 297efe85e67448a15f56bd27e3a3cf1d
> HCI Event: Number of Completed Packets (0x13) plen 5                                                              #175 9.487785
        Num handles: 1
        Handle: 507 Address: DF:A9:FF:F6:B1:1A (OUI DF-A9-FF)
        Count: 1
        Buffers: 0/3
        #174: len 21 (1 Kb/s)
        Latency: 156 msec (69-172 msec ~160 msec)
> ACL Data RX: Handle 507 flags 0x02 dlen 21                                                                        #176 9.488197
      SMP: Pairing Confirm (0x03) len 16
        Confirm value[16]: fcb982e53e692a63dd93820c45af2273
zephyr.exe[1471486]: < HCI Command: Host Number of Completed Packets (0x03|0x0035) plen 5                           #177 9.490837
        Num handles: 1
        Handle: 507 Address: DF:A9:FF:F6:B1:1A (OUI DF-A9-FF)
        Count: 1
zephyr.exe[1471486]: < ACL Data TX: Handle 507 [1/3] flags 0x00 dlen 21                                             #178 9.490864
      SMP: Pairing Confirm (0x03) len 16
        Confirm value[16]: f085ee973a4e13cfedc89c7a0f935680
> HCI Event: Number of Completed Packets (0x13) plen 5                                                              #179 9.662662
        Num handles: 1
        Handle: 507 Address: DF:A9:FF:F6:B1:1A (OUI DF-A9-FF)
        Count: 1
        Buffers: 0/3
        #178: len 21 (0 Kb/s)
        Latency: 171 msec (69-172 msec ~166 msec)
> ACL Data RX: Handle 507 flags 0x02 dlen 21                                                                        #180 9.662954
      SMP: Pairing Random (0x04) len 16
        Random value[16]: 7d8e52ac7944efef173e854c4f231791
zephyr.exe[1471486]: < HCI Command: Host Number of Completed Packets (0x03|0x0035) plen 5                           #181 9.670802
        Num handles: 1
        Handle: 507 Address: DF:A9:FF:F6:B1:1A (OUI DF-A9-FF)
        Count: 1
zephyr.exe[1471486]: < ACL Data TX: Handle 507 [1/3] flags 0x00 dlen 21                                             #182 9.670845
      SMP: Pairing Random (0x04) len 16
        Random value[16]: 25a9493fd3ce4faf02be7293595bb7c6
> HCI Event: Number of Completed Packets (0x13) plen 5                                                              #183 9.837718
        Num handles: 1
        Handle: 507 Address: DF:A9:FF:F6:B1:1A (OUI DF-A9-FF)
        Count: 1
        Buffers: 0/3
        #182: len 21 (1 Kb/s)
        Latency: 166 msec (69-172 msec ~166 msec)
> ACL Data RX: Handle 507 flags 0x02 dlen 21                                                                        #184 9.837989
      SMP: Pairing Confirm (0x03) len 16
        Confirm value[16]: 3af6d94fa2a04a64df7ffd9ce836490c
zephyr.exe[1471486]: < HCI Command: Host Number of Completed Packets (0x03|0x0035) plen 5                           #185 9.850810
        Num handles: 1
        Handle: 507 Address: DF:A9:FF:F6:B1:1A (OUI DF-A9-FF)
        Count: 1
zephyr.exe[1471486]: < ACL Data TX: Handle 507 [1/3] flags 0x00 dlen 21                                             #186 9.850834
      SMP: Pairing Confirm (0x03) len 16
        Confirm value[16]: dc198f24e38bc7b62c7a8e806564ed92
> HCI Event: Number of Completed Packets (0x13) plen 5                                                             #187 10.012702
        Num handles: 1
        Handle: 507 Address: DF:A9:FF:F6:B1:1A (OUI DF-A9-FF)
        Count: 1
        Buffers: 0/3
        #186: len 21 (1 Kb/s)
        Latency: 161 msec (69-172 msec ~164 msec)
> ACL Data RX: Handle 507 flags 0x02 dlen 21                                                                       #188 10.012864
      SMP: Pairing Random (0x04) len 16
        Random value[16]: 6997f93cea5bf0250f76441ce934183a
zephyr.exe[1471486]: < HCI Command: Host Number of Completed Packets (0x03|0x0035) plen 5                          #189 10.030932
        Num handles: 1
        Handle: 507 Address: DF:A9:FF:F6:B1:1A (OUI DF-A9-FF)
        Count: 1
zephyr.exe[1471486]: < ACL Data TX: Handle 507 [1/3] flags 0x00 dlen 21                                            #190 10.030958
      SMP: Pairing Random (0x04) len 16
        Random value[16]: 58f6b41f855a6f6c3560debd84e2affc
> HCI Event: Number of Completed Packets (0x13) plen 5                                                             #191 10.187637
        Num handles: 1
        Handle: 507 Address: DF:A9:FF:F6:B1:1A (OUI DF-A9-FF)
        Count: 1
        Buffers: 0/3
        #190: len 21 (1 Kb/s)
        Latency: 156 msec (69-172 msec ~160 msec)
> ACL Data RX: Handle 507 flags 0x02 dlen 21                                                                       #192 10.188218
      SMP: Pairing Confirm (0x03) len 16
        Confirm value[16]: c41b8dd6850e82f9c7785e287670da20
zephyr.exe[1471486]: < HCI Command: Host Number of Completed Packets (0x03|0x0035) plen 5                          #193 10.190863
        Num handles: 1
        Handle: 507 Address: DF:A9:FF:F6:B1:1A (OUI DF-A9-FF)
        Count: 1
zephyr.exe[1471486]: < ACL Data TX: Handle 507 [1/3] flags 0x00 dlen 21                                            #194 10.190933
      SMP: Pairing Confirm (0x03) len 16
        Confirm value[16]: c541f4c8d015a7493013f9f88d220f43
> HCI Event: Number of Completed Packets (0x13) plen 5                                                             #195 10.362513
        Num handles: 1
        Handle: 507 Address: DF:A9:FF:F6:B1:1A (OUI DF-A9-FF)
        Count: 1
        Buffers: 0/3
        #194: len 21 (0 Kb/s)
        Latency: 171 msec (69-172 msec ~166 msec)
> ACL Data RX: Handle 507 flags 0x02 dlen 21                                                                       #196 10.363071
      SMP: Pairing Random (0x04) len 16
        Random value[16]: fcafa0919f4b58feac6775e00bb2f95d
zephyr.exe[1471486]: < HCI Command: Host Number of Completed Packets (0x03|0x0035) plen 5                          #197 10.370792
        Num handles: 1
        Handle: 507 Address: DF:A9:FF:F6:B1:1A (OUI DF-A9-FF)
        Count: 1
zephyr.exe[1471486]: < ACL Data TX: Handle 507 [1/3] flags 0x00 dlen 21                                            #198 10.370863
      SMP: Pairing Random (0x04) len 16
        Random value[16]: b67e7216d5bf664139eda2b542549666
> HCI Event: Number of Completed Packets (0x13) plen 5                                                             #199 10.537675
        Num handles: 1
        Handle: 507 Address: DF:A9:FF:F6:B1:1A (OUI DF-A9-FF)
        Count: 1
        Buffers: 0/3
        #198: len 21 (1 Kb/s)
        Latency: 166 msec (69-172 msec ~166 msec)
> ACL Data RX: Handle 507 flags 0x02 dlen 21                                                                       #200 10.538177
      SMP: Pairing Confirm (0x03) len 16
        Confirm value[16]: f3115228afc4dc1395032cfad31d9bd9
zephyr.exe[1471486]: < HCI Command: Host Number of Completed Packets (0x03|0x0035) plen 5                          #201 10.550854
        Num handles: 1
        Handle: 507 Address: DF:A9:FF:F6:B1:1A (OUI DF-A9-FF)
        Count: 1
zephyr.exe[1471486]: < ACL Data TX: Handle 507 [1/3] flags 0x00 dlen 21                                            #202 10.550885
      SMP: Pairing Confirm (0x03) len 16
        Confirm value[16]: bf460e8db5889a2f1ad6a0d4b088d244
> HCI Event: Number of Completed Packets (0x13) plen 5                                                             #203 10.712778
        Num handles: 1
        Handle: 507 Address: DF:A9:FF:F6:B1:1A (OUI DF-A9-FF)
        Count: 1
        Buffers: 0/3
        #202: len 21 (1 Kb/s)
        Latency: 161 msec (69-172 msec ~164 msec)
> ACL Data RX: Handle 507 flags 0x02 dlen 21                                                                       #204 10.713060
      SMP: Pairing Random (0x04) len 16
        Random value[16]: 6b6c16bc3cdde53a020bc60a3bc6581b
zephyr.exe[1471486]: < HCI Command: Host Number of Completed Packets (0x03|0x0035) plen 5                          #205 10.730862
        Num handles: 1
        Handle: 507 Address: DF:A9:FF:F6:B1:1A (OUI DF-A9-FF)
        Count: 1
zephyr.exe[1471486]: < ACL Data TX: Handle 507 [1/3] flags 0x00 dlen 21                                            #206 10.730913
      SMP: Pairing Random (0x04) len 16
        Random value[16]: ed17f76500c95219dd01e09d1e63f87b
> HCI Event: Number of Completed Packets (0x13) plen 5                                                             #207 10.887839
        Num handles: 1
        Handle: 507 Address: DF:A9:FF:F6:B1:1A (OUI DF-A9-FF)
        Count: 1
        Buffers: 0/3
        #206: len 21 (1 Kb/s)
        Latency: 156 msec (69-172 msec ~160 msec)
> ACL Data RX: Handle 507 flags 0x02 dlen 21                                                                       #208 10.887998
      SMP: Pairing Confirm (0x03) len 16
        Confirm value[16]: adb5d8659b2d36555d6f40f11a47133f
zephyr.exe[1471486]: < HCI Command: Host Number of Completed Packets (0x03|0x0035) plen 5                          #209 10.890869
        Num handles: 1
        Handle: 507 Address: DF:A9:FF:F6:B1:1A (OUI DF-A9-FF)
        Count: 1
zephyr.exe[1471486]: < ACL Data TX: Handle 507 [1/3] flags 0x00 dlen 21                                            #210 10.890892
      SMP: Pairing Confirm (0x03) len 16
        Confirm value[16]: 706801bf1519e3d8cbc3acbbae1b239b
> HCI Event: Number of Completed Packets (0x13) plen 5                                                             #211 11.062762
        Num handles: 1
        Handle: 507 Address: DF:A9:FF:F6:B1:1A (OUI DF-A9-FF)
        Count: 1
        Buffers: 0/3
        #210: len 21 (0 Kb/s)
        Latency: 171 msec (69-172 msec ~166 msec)
> ACL Data RX: Handle 507 flags 0x02 dlen 21                                                                       #212 11.063401
      SMP: Pairing Random (0x04) len 16
        Random value[16]: 2baa650ea71b94db6799234a3fd912d6
zephyr.exe[1471486]: < HCI Command: Host Number of Completed Packets (0x03|0x0035) plen 5                          #213 11.070863
        Num handles: 1
        Handle: 507 Address: DF:A9:FF:F6:B1:1A (OUI DF-A9-FF)
        Count: 1
zephyr.exe[1471486]: < ACL Data TX: Handle 507 [1/3] flags 0x00 dlen 21                                            #214 11.070890
      SMP: Pairing Random (0x04) len 16
        Random value[16]: 81d35d47e1f6006d79c974bd9d9e1ee3
> HCI Event: Number of Completed Packets (0x13) plen 5                                                             #215 11.237866
        Num handles: 1
        Handle: 507 Address: DF:A9:FF:F6:B1:1A (OUI DF-A9-FF)
        Count: 1
        Buffers: 0/3
        #214: len 21 (1 Kb/s)
        Latency: 166 msec (69-172 msec ~166 msec)
> ACL Data RX: Handle 507 flags 0x02 dlen 21                                                                       #216 11.238211
      SMP: Pairing Confirm (0x03) len 16
        Confirm value[16]: d62de6b7bdc867ea11edf8aa0bd72e61
zephyr.exe[1471486]: < HCI Command: Host Number of Completed Packets (0x03|0x0035) plen 5                          #217 11.250940
        Num handles: 1
        Handle: 507 Address: DF:A9:FF:F6:B1:1A (OUI DF-A9-FF)
        Count: 1
zephyr.exe[1471486]: < ACL Data TX: Handle 507 [1/3] flags 0x00 dlen 21                                            #218 11.250970
      SMP: Pairing Confirm (0x03) len 16
        Confirm value[16]: 3f027096b6024f3475d30334e5c11be2
> HCI Event: Number of Completed Packets (0x13) plen 5                                                             #219 11.412740
        Num handles: 1
        Handle: 507 Address: DF:A9:FF:F6:B1:1A (OUI DF-A9-FF)
        Count: 1
        Buffers: 0/3
        #218: len 21 (1 Kb/s)
        Latency: 161 msec (69-172 msec ~164 msec)
> ACL Data RX: Handle 507 flags 0x02 dlen 21                                                                       #220 11.413016
      SMP: Pairing Random (0x04) len 16
        Random value[16]: f080dd18054da1236f8cb9921b94442e
zephyr.exe[1471486]: < HCI Command: Host Number of Completed Packets (0x03|0x0035) plen 5                          #221 11.430955
        Num handles: 1
        Handle: 507 Address: DF:A9:FF:F6:B1:1A (OUI DF-A9-FF)
        Count: 1
zephyr.exe[1471486]: < ACL Data TX: Handle 507 [1/3] flags 0x00 dlen 21                                            #222 11.430981
      SMP: Pairing Random (0x04) len 16
        Random value[16]: e7f7e0c2476823e41736a7e381bafb7c
> HCI Event: Number of Completed Packets (0x13) plen 5                                                             #223 11.587708
        Num handles: 1
        Handle: 507 Address: DF:A9:FF:F6:B1:1A (OUI DF-A9-FF)
        Count: 1
        Buffers: 0/3
        #222: len 21 (1 K