Bluetooth monitor ver 5.72
= Note: Linux version 6.14.0-36-generic (x86_64)                       0.783628
= Note: Bluetooth subsystem version 2.22                               0.783630
= New Index: 00:00:00:00:00:00 (Primary,UART,hci2)              [hci2] 0.783631
= New Index: 00:00:00:00:00:00 (Primary,UART,hci1)              [hci1] 0.783631
= New Index: 48:5F:99:8E:E0:64 (Primary,USB,hci0)               [hci0] 0.783632
= Open Index: 00:00:00:00:00:00                                 [hci1] 0.927114
= Index Info: 00:00:00:00:00:00 (Nordic Semiconductor ASA)      [hci1] 0.927128
@ USER Open: main (privileged) version 2.22            {0x0001} [hci1] 0.927135
< HCI Command: Reset (0x03|0x0003) plen 0                    #1 [hci1] 0.927993
> HCI Event: Command Complete (0x0e) plen 4                  #2 [hci1] 0.928486
      Reset (0x03|0x0003) ncmd 1
        Status: Success (0x00)
< HCI Command: Read Local Supported... (0x04|0x0003) plen 0  #3 [hci1] 0.946778
> HCI Event: Command Complete (0x0e) plen 12                 #4 [hci1] 0.947341
      Read Local Supported Features (0x04|0x0003) ncmd 1
        Status: Success (0x00)
        Features: 0x00 0x00 0x00 0x00 0x60 0x00 0x00 0x00
          BR/EDR Not Supported
          LE Supported (Controller)
< HCI Command: Read Local Version In.. (0x04|0x0001) plen 0  #5 [hci1] 0.966748
> HCI Event: Command Complete (0x0e) plen 12                 #6 [hci1] 0.967335
      Read Local Version Information (0x04|0x0001) ncmd 1
        Status: Success (0x00)
        HCI version: Reserved (0x11) - Revision 12345 (0x3039)
        LMP version: Reserved (0x11) - Subversion 12345 (0x3039)
        Manufacturer: Nordic Semiconductor ASA (89)
< HCI Command: Read Local Supported... (0x04|0x0002) plen 0  #7 [hci1] 0.986761
> HCI Event: Command Complete (0x0e) plen 68                 #8 [hci1] 0.987947
      Read Local Supported Commands (0x04|0x0002) ncmd 1
        Status: Success (0x00)
        Commands: 115 entries
          Disconnect (Octet 0 - Bit 5)
          Read Remote Version Information (Octet 2 - Bit 7)
          Set Event Mask (Octet 5 - Bit 6)
          Reset (Octet 5 - Bit 7)
          Read Connection Accept Timeout (Octet 7 - Bit 2)
          Write Connection Accept Timeout (Octet 7 - Bit 3)
          Read Transmit Power Level (Octet 10 - Bit 2)
          Set Controller To Host Flow Control (Octet 10 - Bit 5)
          Host Buffer Size (Octet 10 - Bit 6)
          Host Number of Completed Packets (Octet 10 - Bit 7)
          Read Local Version Information (Octet 14 - Bit 3)
          Read Local Supported Features (Octet 14 - Bit 5)
          Read BD ADDR (Octet 15 - Bit 1)
          Read RSSI (Octet 15 - Bit 5)
          Set Event Mask Page 2 (Octet 22 - Bit 2)
          LE Set Event Mask (Octet 25 - Bit 0)
          LE Read Buffer Size (Octet 25 - Bit 1)
          LE Read Local Supported Features (Octet 25 - Bit 2)
          LE Set Random Address (Octet 25 - Bit 4)
          LE Set Advertising Parameters (Octet 25 - Bit 5)
          LE Read Advertising Channel TX Power (Octet 25 - Bit 6)
          LE Set Advertising Data (Octet 25 - Bit 7)
          LE Set Scan Response Data (Octet 26 - Bit 0)
          LE Set Advertise Enable (Octet 26 - Bit 1)
          LE Set Scan Parameters (Octet 26 - Bit 2)
          LE Set Scan Enable (Octet 26 - Bit 3)
          LE Create Connection (Octet 26 - Bit 4)
          LE Create Connection Cancel (Octet 26 - Bit 5)
          LE Read Accept List Size (Octet 26 - Bit 6)
          LE Clear Accept List (Octet 26 - Bit 7)
          LE Add Device To Accept List (Octet 27 - Bit 0)
          LE Remove Device From Accept List (Octet 27 - Bit 1)
          LE Connection Update (Octet 27 - Bit 2)
          LE Set Host Channel Classification (Octet 27 - Bit 3)
          LE Read Channel Map (Octet 27 - Bit 4)
          LE Read Remote Used Features (Octet 27 - Bit 5)
          LE Encrypt (Octet 27 - Bit 6)
          LE Rand (Octet 27 - Bit 7)
          LE Start Encryption (Octet 28 - Bit 0)
          LE Long Term Key Request Reply (Octet 28 - Bit 1)
          LE Long Term Key Request Neg Reply (Octet 28 - Bit 2)
          LE Read Supported States (Octet 28 - Bit 3)
          Read Authenticated Payload Timeout (Octet 32 - Bit 4)
          Write Authenticated Payload Timeout (Octet 32 - Bit 5)
          LE Set Data Length (Octet 33 - Bit 6)
          LE Read Suggested Default Data Length (Octet 33 - Bit 7)
          LE Write Suggested Default Data Length (Octet 34 - Bit 0)
          LE Add Device To Resolving List (Octet 34 - Bit 3)
          LE Remove Device From Resolving List (Octet 34 - Bit 4)
          LE Clear Resolving List (Octet 34 - Bit 5)
          LE Read Resolving List Size (Octet 34 - Bit 6)
          LE Set Address Resolution Enable (Octet 35 - Bit 1)
          LE Set Resolvable Private Address Timeout (Octet 35 - Bit 2)
          LE Read Maximum Data Length (Octet 35 - Bit 3)
          LE Read PHY (Octet 35 - Bit 4)
          LE Set Default PHY (Octet 35 - Bit 5)
          LE Set PHY (Octet 35 - Bit 6)
          LE Set Advertising Set Random Address (Octet 36 - Bit 1)
          LE Set Extended Advertising Parameters (Octet 36 - Bit 2)
          LE Set Extended Advertising Data (Octet 36 - Bit 3)
          LE Set Extended Scan Response Data (Octet 36 - Bit 4)
          LE Set Extended Advertising Enable (Octet 36 - Bit 5)
          LE Read Maximum Advertising Data Length (Octet 36 - Bit 6)
          LE Read Number of Supported Advertising Sets (Octet 36 - Bit 7)
          LE Remove Advertising Set (Octet 37 - Bit 0)
          LE Clear Advertising Sets (Octet 37 - Bit 1)
          LE Set Periodic Advertising Parameters (Octet 37 - Bit 2)
          LE Set Periodic Advertising Data (Octet 37 - Bit 3)
          LE Set Periodic Advertising Enable (Octet 37 - Bit 4)
          LE Set Extended Scan Parameters (Octet 37 - Bit 5)
          LE Set Extended Scan Enable (Octet 37 - Bit 6)
          LE Extended Create Connection (Octet 37 - Bit 7)
          LE Periodic Advertising Create Sync (Octet 38 - Bit 0)
          LE Periodic Advertising Create Sync Cancel (Octet 38 - Bit 1)
          LE Periodic Advertising Terminate Sync (Octet 38 - Bit 2)
          LE Add Device To Periodic Advertiser List (Octet 38 - Bit 3)
          LE Remove Device From Periodic Advertiser List (Octet 38 - Bit 4)
          LE Clear Periodic Advertiser List (Octet 38 - Bit 5)
          LE Read Periodic Advertiser List Size (Octet 38 - Bit 6)
          LE Read Transmit Power (Octet 38 - Bit 7)
          LE Read RF Path Compensation (Octet 39 - Bit 0)
          LE Write RF Path Compensation (Octet 39 - Bit 1)
          LE Set Privacy Mode (Octet 39 - Bit 2)
          LE Periodic Advertising Receive Enable (Octet 40 - Bit 5)
          LE Periodic Advertising Sync Transfer (Octet 40 - Bit 6)
          LE Periodic Advertising Set Info Transfer (Octet 40 - Bit 7)
          LE Periodic Advertising Sync Transfer Parameters (Octet 41 - Bit 0)
          LE Set Default Periodic Advertisng Sync Transfer Parameters (Octet 41 - Bit 1)
          LE Read Buffer v2 (Octet 41 - Bit 5)
          LE Read ISO TX Sync (Octet 41 - Bit 6)
          LE Set Connected Isochronous Group Parameters (Octet 41 - Bit 7)
          LE Set Connected Isochronous Group Parameters Test (Octet 42 - Bit 0)
          LE Create Connected Isochronous Stream (Octet 42 - Bit 1)
          LE Remove Connected Isochronous Group (Octet 42 - Bit 2)
          LE Accept Connected Isochronous Stream Request (Octet 42 - Bit 3)
          LE Reject Connected Isochronous Stream Request (Octet 42 - Bit 4)
          LE Create Broadcast Isochronous Group (Octet 42 - Bit 5)
          LE Create Broadcast Isochronous Group Test (Octet 42 - Bit 6)
          LE Terminate Broadcast Isochronous Group (Octet 42 - Bit 7)
          LE Broadcast Isochronous Group Create Sync (Octet 43 - Bit 0)
          LE Broadcast Isochronous Group Terminate Sync (Octet 43 - Bit 1)
          LE Request Peer SCA (Octet 43 - Bit 2)
          LE Setup Isochronous Data Path (Octet 43 - Bit 3)
          LE Remove Isochronous Data Path (Octet 43 - Bit 4)
          LE Isochronous Transmit Test (Octet 43 - Bit 5)
          LE Isochronous Receive Test (Octet 43 - Bit 6)
          LE Isochronous Read Test Counters (Octet 43 - Bit 7)
          LE Isochronous Read Test Counters (Octet 44 - Bit 0)
          LE Set Host Feature (Octet 44 - Bit 1)
          Octet 44 - Bit 2 
          Octet 45 - Bit 6 
          Octet 46 - Bit 0 
          Octet 46 - Bit 1 
          Octet 46 - Bit 2 
          Octet 47 - Bit 4 
< HCI Command: Host Buffer Size (0x03|0x0033) plen 7         #9 [hci1] 1.006762
        ACL MTU: 255  ACL max packet: 16
        SCO MTU: 0    SCO max packet: 0
> HCI Event: Command Complete (0x0e) plen 4                 #10 [hci1] 1.007375
      Host Buffer Size (0x03|0x0033) ncmd 1
        Status: Success (0x00)
< HCI Command: Set Controller To Ho.. (0x03|0x0031) plen 1  #11 [hci1] 1.026763
        Flow control: ACL Data Packets (0x01)
> HCI Event: Command Complete (0x0e) plen 4                 #12 [hci1] 1.027143
      Set Controller To Host Flow Control (0x03|0x0031) ncmd 1
        Status: Success (0x00)
< HCI Command: LE Read Local Suppor.. (0x08|0x0003) plen 0  #13 [hci1] 1.046731
> HCI Event: Command Complete (0x0e) plen 12                #14 [hci1] 1.047258
      LE Read Local Supported Features (0x08|0x0003) ncmd 1
        Status: Success (0x00)
        Features: 0xfd 0x79 0x00 0xf7 0x30 0x01 0x00 0x00
          LE Encryption
          Extended Reject Indication
          Peripheral-initiated Features Exchange
          LE Ping
          LE Data Packet Length Extension
          LL Privacy
          Extended Scanner Filter Policies
          LE 2M PHY
          LE Coded PHY
          LE Extended Advertising
          LE Periodic Advertising
          Channel Selection Algorithm #2
          Periodic Advertising Sync Transfer - Sender
          Periodic Advertising Sync Transfer - Recipient
          Sleep Clock Accuracy Updates
          Connected Isochronous Stream - Central
          Connected Isochronous Stream - Peripheral
          Isochronous Broadcaster
          Synchronized Receiver
          Periodic Advertising ADI support
          Connection Subrating
          Unknown features (0x0000010000000000)
< HCI Command: LE Set Host Feature (0x08|0x0074) plen 2     #15 [hci1] 1.066763
        Bit Number: 32
          Connected Isochronous Stream (Host Support)
        Bit Value: 1
> HCI Event: Command Complete (0x0e) plen 4                 #16 [hci1] 1.067179
      LE Set Host Feature (0x08|0x0074) ncmd 1
        Status: Success (0x00)
< HCI Command: LE Read Buffer v2 (0x08|0x0060) plen 0       #17 [hci1] 1.086759
> HCI Event: Command Complete (0x0e) plen 10                #18 [hci1] 1.087301
      LE Read Buffer v2 (0x08|0x0060) ncmd 1
        Status: Success (0x00)
        ACL MTU: 27
        ACL max packet: 3
        ISO MTU: 318
        ISO max packet: 3
< HCI Command: LE Read Maximum Adve.. (0x08|0x003a) plen 0  #19 [hci1] 1.106817
> HCI Event: Command Complete (0x0e) plen 6                 #20 [hci1] 1.107267
      LE Read Maximum Advertising Data Length (0x08|0x003a) ncmd 1
        Status: Success (0x00)
        Max length: 1650
< HCI Command: LE Read Supported St.. (0x08|0x001c) plen 0  #21 [hci1] 1.126775
> HCI Event: Command Complete (0x0e) plen 12                #22 [hci1] 1.127194
      LE Read Supported States (0x08|0x001c) ncmd 1
        Status: Success (0x00)
        States: 0x000003ff3e0306ff
          Non-connectable Advertising State
          Scannable Advertising State
          Connectable Advertising State
          High Duty Cycle Directed Advertising State
          Passive Scanning State
          Active Scanning State
          Initiating State
            and Connection State (Central Role)
          Connection State (Peripheral Role)
          Scannable Advertising State
            and Passive Scanning State
          Connectable Advertising State
            and Passive Scanning State
          Non-connectable Advertising State
            and Initiating State
          Scannable Advertising State
            and Initiating State
          Active Scanning State
            and Connection State (Central Role)
          Passive Scanning State
            and Connection State (Peripheral Role)
          Active Scanning State
            and Connection State (Peripheral Role)
          Initiating State
            and Connection State (Central Role)
            and Central Role & Central Role
          Low Duty Cycle Directed Advertising State
          Connectable Advertising State
            and Initiating State
            and Central Role & Peripheral Role
          High Duty Cycle Directed Advertising State
            and Initiating State
            and Central Role & Peripheral Role
          Low Duty Cycle Directed Advertising State
            and Initiating State
            and Central Role & Peripheral Role
          Connectable Advertising State
            and Connection State (Central Role)
            and Central Role & Peripheral Role
          High Duty Cycle Directed Advertising State
            and Connection State (Central Role)
            and Central Role & Peripheral Role
          Low Duty Cycle Directed Advertising State
            and Connection State (Central Role)
            and Central Role & Peripheral Role
          Connectable Advertising State
            and Connection State (Peripheral Role)
            and Central Role & Peripheral Role
          High Duty Cycle Directed Advertising State
            and Connection State (Peripheral Role)
            and Peripheral Role & Peripheral Role
          Low Duty Cycle Directed Advertising State
            and Connection State (Peripheral Role)
            and Peripheral Role & Peripheral Role
          Initiating State
            and Connection State (Peripheral Role)
            and Central Role & Peripheral Role
< HCI Command: LE Read Maximum Data.. (0x08|0x002f) plen 0  #23 [hci1] 1.146784
> HCI Event: Command Complete (0x0e) plen 12                #24 [hci1] 1.147390
      LE Read Maximum Data Length (0x08|0x002f) ncmd 1
        Status: Success (0x00)
        Max TX octets: 251
        Max TX time: 2704
        Max RX octets: 251
        Max RX time: 2704
< HCI Command: LE Write Suggested D.. (0x08|0x0024) plen 4  #25 [hci1] 1.166762
        TX octets: 251
        TX time: 2704
> HCI Event: Command Complete (0x0e) plen 4                 #26 [hci1] 1.167205
      LE Write Suggested Default Data Length (0x08|0x0024) ncmd 1
        Status: Success (0x00)
< HCI Command: LE Read Resolving Li.. (0x08|0x002a) plen 0  #27 [hci1] 1.186776
> HCI Event: Command Complete (0x0e) plen 5                 #28 [hci1] 1.187296
      LE Read Resolving List Size (0x08|0x002a) ncmd 1
        Status: Success (0x00)
        Size: 8
< HCI Command: LE Set Host Feature (0x08|0x0074) plen 2     #29 [hci1] 1.206773
        Bit Number: 38
          Connection Subrating (Host Support)
        Bit Value: 1
> HCI Event: Command Complete (0x0e) plen 4                 #30 [hci1] 1.207175
      LE Set Host Feature (0x08|0x0074) ncmd 1
        Status: Success (0x00)
< HCI Command: LE Set Event Mask (0x08|0x0001) plen 8       #31 [hci1] 1.226763
        Mask: 0x000002063f87fa5e
          LE Advertising Report
          LE Connection Update Complete
          LE Read Remote Used Features Complete
          LE Long Term Key Request
          LE Data Length Change
          LE Enhanced Connection Complete
          LE PHY Update Complete
          LE Extended Advertising Report
          LE Periodic Advertising Sync Established
          LE Periodic Advertising Report
          LE Periodic Advertising Sync Lost
          LE Extended Scan Timeout
          LE Extended Advertising Set Terminated
          LE Scan Request Received
          LE Periodic Advertising Sync Transfer Rvc
          LE CIS Established
          LE CIS Request
          LE Create BIG Complete
          LE Terminate BIG Complete
          LE BIG Sync Estabilished Complete
          LE BIG Sync Lost
          LE BIG Info Advertising Report
          LE Subrate Change
          Unknown mask (0x0000020000000000)
> HCI Event: Command Complete (0x0e) plen 4                 #32 [hci1] 1.227317
      LE Set Event Mask (0x08|0x0001) ncmd 1
        Status: Success (0x00)
< HCI Command: Set Event Mask (0x03|0x0001) plen 8          #33 [hci1] 1.246737
        Mask: 0x2000800002008890
          Disconnection Complete
          Encryption Change
          Read Remote Version Information Complete
          Hardware Error
          Data Buffer Overflow
          Encryption Key Refresh Complete
          LE Meta
> HCI Event: Command Complete (0x0e) plen 4                 #34 [hci1] 1.247312
      Set Event Mask (0x03|0x0001) ncmd 1
        Status: Success (0x00)
< HCI Command: Read BD ADDR (0x04|0x0009) plen 0            #35 [hci1] 1.266754
> HCI Event: Command Complete (0x0e) plen 10                #36 [hci1] 1.267215
      Read BD ADDR (0x04|0x0009) ncmd 1
        Status: Success (0x00)
        Address: 00:00:00:00:00:00 (OUI 00-00-00)
< HCI Command: LE Set Random Address (0x08|0x0005) plen 6   #37 [hci1] 1.286764
        Address: D5:B6:CC:31:DB:3B (Static)
> HCI Event: Command Complete (0x0e) plen 4                 #38 [hci1] 1.287246
      LE Set Random Address (0x08|0x0005) ncmd 1
        Status: Success (0x00)
< HCI Command: LE Set Extended Adv.. (0x08|0x0036) plen 25  #39 [hci1] 3.516958
        Handle: 0x00
        Properties: 0x0013
          Connectable
          Scannable
          Use legacy advertising PDUs: ADV_IND
        Min advertising interval: 100.000 msec (0x00a0)
        Max advertising interval: 150.000 msec (0x00f0)
        Channel map: 37, 38, 39 (0x07)
        Own address type: Random (0x01)
        Peer address type: Public (0x00)
        Peer address: 00:00:00:00:00:00 (OUI 00-00-00)
        Filter policy: Allow Scan Request from Any, Allow Connect Request from Any (0x00)
        TX power: Host has no preference (0x7f)
        Primary PHY: LE 1M (0x01)
        Secondary max skip: 0x00
        Secondary PHY: LE 1M (0x01)
        SID: 0x00
        Scan request notifications: Disabled (0x00)
> HCI Event: Command Complete (0x0e) plen 5                 #40 [hci1] 3.517757
      LE Set Extended Advertising Parameters (0x08|0x0036) ncmd 1
        Status: Success (0x00)
        TX power (selected): 0 dbm (0x00)
< HCI Command: LE Set Advertising S.. (0x08|0x0035) plen 7  #41 [hci1] 3.526755
        Advertising handle: 0x00
        Advertising random address: D5:B6:CC:31:DB:3B (Static)
> HCI Event: Command Complete (0x0e) plen 4                 #42 [hci1] 3.527220
      LE Set Advertising Set Random Address (0x08|0x0035) ncmd 1
        Status: Success (0x00)
< HCI Command: LE Set Extended Adv.. (0x08|0x0037) plen 22  #43 [hci1] 3.546804
        Handle: 0x00
        Operation: Complete extended advertising data (0x03)
        Fragment preference: Minimize fragmentation (0x01)
        Data length: 0x12
        Flags: 0x06
          LE General Discoverable Mode
          BR/EDR Not Supported
        Name (complete): Tester_F6B11A
> HCI Event: Command Complete (0x0e) plen 4                 #44 [hci1] 3.547584
      LE Set Extended Advertising Data (0x08|0x0037) ncmd 1
        Status: Success (0x00)
< HCI Command: LE Set Extended Scan.. (0x08|0x0038) plen 4  #45 [hci1] 3.566803
        Handle: 0x00
        Operation: Complete scan response data (0x03)
        Fragment preference: Minimize fragmentation (0x01)
        Data length: 0x00
> HCI Event: Command Complete (0x0e) plen 4                 #46 [hci1] 3.567414
      LE Set Extended Scan Response Data (0x08|0x0038) ncmd 1
        Status: Success (0x00)
< HCI Command: LE Set Extended Adve.. (0x08|0x0039) plen 6  #47 [hci1] 3.586804
        Extended advertising: Enabled (0x01)
        Number of sets: 1 (0x01)
        Entry 0
          Handle: 0x00
          Duration: 0 ms (0x00)
          Max ext adv events: 0
> HCI Event: Command Complete (0x0e) plen 4                 #48 [hci1] 3.587431
      LE Set Extended Advertising Enable (0x08|0x0039) ncmd 1
        Status: Success (0x00)
> HCI Event: LE Meta Event (0x3e) plen 31                   #49 [hci1] 4.117080
      LE Enhanced Connection Complete (0x0a)
        Status: Success (0x00)
        Handle: 327
        Role: Peripheral (0x01)
        Peer address type: Public (0x00)
        Peer address: DF:A9:FF:F6:B1:1A (OUI DF-A9-FF)
        Local resolvable private address: 00:00:00:00:00:00 (Non-Resolvable)
        Peer resolvable private address: 00:00:00:00:00:00 (Non-Resolvable)
        Connection interval: 87.50 msec (0x0046)
        Connection latency: 0 (0x0000)
        Supervision timeout: 20000 msec (0x07d0)
        Central clock accuracy: 0x01
> HCI Event: LE Meta Event (0x3e) plen 6                    #50 [hci1] 4.117194
      LE Advertising Set Terminated (0x12)
        Status: Success (0x00)
        Handle: 0
        Connection handle: 327
        Number of completed extended advertising events: 0
< HCI Command: LE Read Remote Used... (0x08|0x0016) plen 2  #51 [hci1] 4.127709
        Handle: 327 Address: DF:A9:FF:F6:B1:1A (OUI DF-A9-FF)
> HCI Event: Command Status (0x0f) plen 4                   #52 [hci1] 4.128189
      LE Read Remote Used Features (0x08|0x0016) ncmd 1
        Status: Success (0x00)
> HCI Event: LE Meta Event (0x3e) plen 12                   #53 [hci1] 4.380899
      LE Read Remote Used Features (0x04)
        Status: Success (0x00)
        Handle: 327 Address: DF:A9:FF:F6:B1:1A (OUI DF-A9-FF)
        Features: 0x2d 0x49 0x00 0xf7 0x67 0xd9 0x00 0x80
          LE Encryption
          Extended Reject Indication
          Peripheral-initiated Features Exchange
          LE Data Packet Length Extension
          LE 2M PHY
          LE Coded PHY
          Channel Selection Algorithm #2
          Periodic Advertising Sync Transfer - Sender
          Periodic Advertising Sync Transfer - Recipient
          Sleep Clock Accuracy Updates
          Connected Isochronous Stream - Central
          Connected Isochronous Stream - Peripheral
          Isochronous Broadcaster
          Synchronized Receiver
          Connected Isochronous Stream (Host Support)
          LE Power Control Request
          LE Power Control Request
          Connection Subrating
          Connection Subrating (Host Support)
          Unknown features (0x8000d90000000000)
> ACL Data RX: Handle 327 flags 0x02 dlen 11                #54 [hci1] 4.818233
      SMP: Pairing Request (0x01) len 6
        IO capability: KeyboardOnly (0x02)
        OOB data: Authentication data not present (0x00)
        Authentication requirement: No bonding, MITM, SC, No Keypresses (0xcc)
        Max encryption key size: 16
        Initiator key distribution: <none> (0x00)
        Responder key distribution: <none> (0x00)
< HCI Command: Host Number of Compl.. (0x03|0x0035) plen 5  #55 [hci1] 4.827278
        Num handles: 1
        Handle: 327 Address: DF:A9:FF:F6:B1:1A (OUI DF-A9-FF)
        Count: 1
< ACL Data TX: Handle 327 flags 0x00 dlen 11                #56 [hci1] 4.827328
      SMP: Pairing Response (0x02) len 6
        IO capability: DisplayOnly (0x00)
        OOB data: Authentication data not present (0x00)
        Authentication requirement: Bonding, No MITM, SC, No Keypresses (0x09)
        Max encryption key size: 16
        Initiator key distribution: <none> (0x00)
        Responder key distribution: <none> (0x00)
> HCI Event: Number of Completed Packets (0x13) plen 5      #57 [hci1] 4.993469
        Num handles: 1
        Handle: 327 Address: DF:A9:FF:F6:B1:1A (OUI DF-A9-FF)
        Count: 1
        #56: len 11 (0 Kb/s)
        Latency: 166 msec (166-166 msec ~166 msec)
> ACL Data RX: Handle 327 flags 0x02 dlen 27                #58 [hci1] 4.993634
> ACL Data RX: Handle 327 flags 0x01 dlen 27                #59 [hci1] 4.994135
> ACL Data RX: Handle 327 flags 0x01 dlen 15                #60 [hci1] 4.994750
      SMP: Pairing Public Key (0x0c) len 64
        X: 297b926ac4a699d57aeeecaf9e3f4e76598dea707b6634fed7ad8a4163516521
        Y: e9c7cb2649fb3f9a1b6d3fd8311d59355f710b7c530681d2e422a92cce60a751
< HCI Command: Host Number of Compl.. (0x03|0x0035) plen 5  #61 [hci1] 5.007137
        Num handles: 1
        Handle: 327 Address: DF:A9:FF:F6:B1:1A (OUI DF-A9-FF)
        Count: 1
< HCI Command: Host Number of Compl.. (0x03|0x0035) plen 5  #62 [hci1] 5.007166
        Num handles: 1
        Handle: 327 Address: DF:A9:FF:F6:B1:1A (OUI DF-A9-FF)
        Count: 1
< HCI Command: Host Number of Compl.. (0x03|0x0035) plen 5  #63 [hci1] 5.007313
        Num handles: 1
        Handle: 327 Address: DF:A9:FF:F6:B1:1A (OUI DF-A9-FF)
        Count: 1
< ACL Data TX: Handle 327 flags 0x00 dlen 27                #64 [hci1] 5.007318
< ACL Data TX: Handle 327 flags 0x01 dlen 27                #65 [hci1] 5.007326
< ACL Data TX: Handle 327 flags 0x01 dlen 15                #66 [hci1] 5.007332
      SMP: Pairing Public Key (0x0c) len 64
        X: 98308440221e2d910f0e54b71e7ec652857aa9b5a0dc65028824cc19db1226e9
        Y: 67a4816bcb62efb21701e31fdb27561a6217575fb007a8bbdabe7e28b6f68482
> HCI Event: Number of Completed Packets (0x13) plen 5      #67 [hci1] 5.081231
        Num handles: 1
        Handle: 327 Address: DF:A9:FF:F6:B1:1A (OUI DF-A9-FF)
        Count: 1
        #64: len 27 (2 Kb/s)
        Latency: 73 msec (73-166 msec ~120 msec)
> HCI Event: Number of Completed Packets (0x13) plen 5      #68 [hci1] 5.081889
        Num handles: 1
        Handle: 327 Address: DF:A9:FF:F6:B1:1A (OUI DF-A9-FF)
        Count: 1
        #65: len 27 (2 Kb/s)
        Latency: 74 msec (73-166 msec ~97 msec)
> HCI Event: Number of Completed Packets (0x13) plen 5      #69 [hci1] 5.168109
        Num handles: 1
        Handle: 327 Address: DF:A9:FF:F6:B1:1A (OUI DF-A9-FF)
        Count: 1
        #66: len 15 (0 Kb/s)
        Latency: 160 msec (73-166 msec ~129 msec)
> ACL Data RX: Handle 327 flags 0x02 dlen 21                #70 [hci1] 5.693410
      SMP: Pairing Confirm (0x03) len 16
        Confim value: 74364cab485622a9f23bcfdd6bbb0645
< HCI Command: Host Number of Compl.. (0x03|0x0035) plen 5  #71 [hci1] 5.707272
        Num handles: 1
        Handle: 327 Address: DF:A9:FF:F6:B1:1A (OUI DF-A9-FF)
        Count: 1
< ACL Data TX: Handle 327 flags 0x00 dlen 21                #72 [hci1] 5.707384
      SMP: Pairing Confirm (0x03) len 16
        Confim value: a066b233308a50abcf76deda62b01d4f
> HCI Event: Number of Completed Packets (0x13) plen 5      #73 [hci1] 5.868247
        Num handles: 1
        Handle: 327 Address: DF:A9:FF:F6:B1:1A (OUI DF-A9-FF)
        Count: 1
        #72: len 21 (1 Kb/s)
        Latency: 160 msec (73-166 msec ~144 msec)
> ACL Data RX: Handle 327 flags 0x02 dlen 21                #74 [hci1] 5.868609
      SMP: Pairing Random (0x04) len 16
        Random value: b1a023da79047f18f35c52ff261ab587
< HCI Command: Host Number of Compl.. (0x03|0x0035) plen 5  #75 [hci1] 5.887277
        Num handles: 1
        Handle: 327 Address: DF:A9:FF:F6:B1:1A (OUI DF-A9-FF)
        Count: 1
< ACL Data TX: Handle 327 flags 0x00 dlen 21                #76 [hci1] 5.887346
      SMP: Pairing Random (0x04) len 16
        Random value: 8e6108f966a694cbe26df70bb96773e6
> HCI Event: Number of Completed Packets (0x13) plen 5      #77 [hci1] 6.043239
        Num handles: 1
        Handle: 327 Address: DF:A9:FF:F6:B1:1A (OUI DF-A9-FF)
        Count: 1
        #76: len 21 (1 Kb/s)
        Latency: 155 msec (73-166 msec ~150 msec)
> ACL Data RX: Handle 327 flags 0x02 dlen 21                #78 [hci1] 6.043750
      SMP: Pairing Confirm (0x03) len 16
        Confim value: da5b1fc31829006aa6e09ee6abe7f728
< HCI Command: Host Number of Compl.. (0x03|0x0035) plen 5  #79 [hci1] 6.047377
        Num handles: 1
        Handle: 327 Address: DF:A9:FF:F6:B1:1A (OUI DF-A9-FF)
        Count: 1
< ACL Data TX: Handle 327 flags 0x00 dlen 21                #80 [hci1] 6.047418
      SMP: Pairing Confirm (0x03) len 16
        Confim value: a85e1443f28ff783b3c9984ede8e8cc4
> HCI Event: Number of Completed Packets (0x13) plen 5      #81 [hci1] 6.218319
        Num handles: 1
        Handle: 327 Address: DF:A9:FF:F6:B1:1A (OUI DF-A9-FF)
        Count: 1
        #80: len 21 (0 Kb/s)
        Latency: 170 msec (73-170 msec ~160 msec)
> ACL Data RX: Handle 327 flags 0x02 dlen 21                #82 [hci1] 6.218669
      SMP: Pairing Random (0x04) len 16
        Random value: 11b2c4994ccc67cbe9f5b63cef33717e
< HCI Command: Host Number of Compl.. (0x03|0x0035) plen 5  #83 [hci1] 6.227513
        Num handles: 1
        Handle: 327 Address: DF:A9:FF:F6:B1:1A (OUI DF-A9-FF)
        Count: 1
< ACL Data TX: Handle 327 flags 0x00 dlen 21                #84 [hci1] 6.227625
      SMP: Pairing Random (0x04) len 16
        Random value: 4d02679f89a05211af56d8b3da64d21e
> HCI Event: Number of Completed Packets (0x13) plen 5      #85 [hci1] 6.393292
        Num handles: 1
        Handle: 327 Address: DF:A9:FF:F6:B1:1A (OUI DF-A9-FF)
        Count: 1
        #84: len 21 (1 Kb/s)
        Latency: 165 msec (73-170 msec ~163 msec)
> ACL Data RX: Handle 327 flags 0x02 dlen 21                #86 [hci1] 6.393547
      SMP: Pairing Confirm (0x03) len 16
        Confim value: 8fcdd4df80f8c139982a123049744a84
< HCI Command: Host Number of Compl.. (0x03|0x0035) plen 5  #87 [hci1] 6.407627
        Num handles: 1
        Handle: 327 Address: DF:A9:FF:F6:B1:1A (OUI DF-A9-FF)
        Count: 1
< ACL Data TX: Handle 327 flags 0x00 dlen 21                #88 [hci1] 6.407787
      SMP: Pairing Confirm (0x03) len 16
        Confim value: 2e69db9357562f961986355267de7c52
> HCI Event: Number of Completed Packets (0x13) plen 5      #89 [hci1] 6.568304
        Num handles: 1
        Handle: 327 Address: DF:A9:FF:F6:B1:1A (OUI DF-A9-FF)
        Count: 1
        #88: len 21 (1 Kb/s)
        Latency: 160 msec (73-170 msec ~161 msec)
> ACL Data RX: Handle 327 flags 0x02 dlen 21                #90 [hci1] 6.568633
      SMP: Pairing Random (0x04) len 16
        Random value: 0a9cedca9f4b2951b0278d9bab494152
< HCI Command: Host Number of Compl.. (0x03|0x0035) plen 5  #91 [hci1] 6.587482
        Num handles: 1
        Handle: 327 Address: DF:A9:FF:F6:B1:1A (OUI DF-A9-FF)
        Count: 1
< ACL Data TX: Handle 327 flags 0x00 dlen 21                #92 [hci1] 6.587576
      SMP: Pairing Random (0x04) len 16
        Random value: 5e8286bc235a02440d0c3424a2acf8fd
> HCI Event: Number of Completed Packets (0x13) plen 5      #93 [hci1] 6.743190
        Num handles: 1
        Handle: 327 Address: DF:A9:FF:F6:B1:1A (OUI DF-A9-FF)
        Count: 1
        #92: len 21 (1 Kb/s)
        Latency: 155 msec (73-170 msec ~158 msec)
> ACL Data RX: Handle 327 flags 0x02 dlen 21                #94 [hci1] 6.743569
      SMP: Pairing Confirm (0x03) len 16
        Confim value: 8c938b02fad9d4d9aa4c2573839aec4e
< HCI Command: Host Number of Compl.. (0x03|0x0035) plen 5  #95 [hci1] 6.747507
        Num handles: 1
        Handle: 327 Address: DF:A9:FF:F6:B1:1A (OUI DF-A9-FF)
        Count: 1
< ACL Data TX: Handle 327 flags 0x00 dlen 21                #96 [hci1] 6.747592
      SMP: Pairing Confirm (0x03) len 16
        Confim value: feefaf2821f484797f138536e901e56f
> HCI Event: Number of Completed Packets (0x13) plen 5      #97 [hci1] 6.918250
        Num handles: 1
        Handle: 327 Address: DF:A9:FF:F6:B1:1A (OUI DF-A9-FF)
        Count: 1
        #96: len 21 (0 Kb/s)
        Latency: 170 msec (73-170 msec ~164 msec)
> ACL Data RX: Handle 327 flags 0x02 dlen 21                #98 [hci1] 6.918591
      SMP: Pairing Random (0x04) len 16
        Random value: d147f20405cd4e2742111e52f7aaab52
< HCI Command: Host Number of Compl.. (0x03|0x0035) plen 5  #99 [hci1] 6.927574
        Num handles: 1
        Handle: 327 Address: DF:A9:FF:F6:B1:1A (OUI DF-A9-FF)
        Count: 1
< ACL Data TX: Handle 327 flags 0x00 dlen 21               #100 [hci1] 6.927713
      SMP: Pairing Random (0x04) len 16
        Random value: 5c4a1bcadd27bd58e945097b00bad7ac
> HCI Event: Number of Completed Packets (0x13) plen 5     #101 [hci1] 7.093248
        Num handles: 1
        Handle: 327 Address: DF:A9:FF:F6:B1:1A (OUI DF-A9-FF)
        Count: 1
        #100: len 21 (1 Kb/s)
        Latency: 165 msec (73-170 msec ~165 msec)
> ACL Data RX: Handle 327 flags 0x02 dlen 21               #102 [hci1] 7.093533
      SMP: Pairing Confirm (0x03) len 16
        Confim value: 12558754e6a597f7b51220b39b9bf7f4
< HCI Command: Host Number of Comp.. (0x03|0x0035) plen 5  #103 [hci1] 7.107449
        Num handles: 1
        Handle: 327 Address: DF:A9:FF:F6:B1:1A (OUI DF-A9-FF)
        Count: 1
< ACL Data TX: Handle 327 flags 0x00 dlen 21               #104 [hci1] 7.107473
      SMP: Pairing Confirm (0x03) len 16
        Confim value: 5e3163dbbf337e357f05fa1886bf15c0
> HCI Event: Number of Completed Packets (0x13) plen 5     #105 [hci1] 7.268197
        Num handles: 1
        Handle: 327 Address: DF:A9:FF:F6:B1:1A (OUI DF-A9-FF)
        Count: 1
        #104: len 21 (1 Kb/s)
        Latency: 160 msec (73-170 msec ~162 msec)
> ACL Data RX: Handle 327 flags 0x02 dlen 21               #106 [hci1] 7.268581
      SMP: Pairing Random (0x04) len 16
        Random value: 5d38128f18130b32ef8183bce41dc7fc
< HCI Command: Host Number of Comp.. (0x03|0x0035) plen 5  #107 [hci1] 7.287559
        Num handles: 1
        Handle: 327 Address: DF:A9:FF:F6:B1:1A (OUI DF-A9-FF)
        Count: 1
< ACL Data TX: Handle 327 flags 0x00 dlen 21               #108 [hci1] 7.287694
      SMP: Pairing Random (0x04) len 16
        Random value: 32527e6e64e79f33b2e374394db8ab2d
> HCI Event: Number of Completed Packets (0x13) plen 5     #109 [hci1] 7.443229
        Num handles: 1
        Handle: 327 Address: DF:A9:FF:F6:B1:1A (OUI DF-A9-FF)
        Count: 1
        #108: len 21 (1 Kb/s)
        Latency: 155 msec (73-170 msec ~159 msec)
> ACL Data RX: Handle 327 flags 0x02 dlen 21               #110 [hci1] 7.443716
      SMP: Pairing Confirm (0x03) len 16
        Confim value: e9391741bc77e23c3aa0b59e29b0675d
< HCI Command: Host Number of Comp.. (0x03|0x0035) plen 5  #111 [hci1] 7.447173
        Num handles: 1
        Handle: 327 Address: DF:A9:FF:F6:B1:1A (OUI DF-A9-FF)
        Count: 1
< ACL Data TX: Handle 327 flags 0x00 dlen 21               #112 [hci1] 7.447202
      SMP: Pairing Confirm (0x03) len 16
        Confim value: 9c9fd77ccdc6ae01092b959602682a55
> HCI Event: Number of Completed Packets (0x13) plen 5     #113 [hci1] 7.618211
        Num handles: 1
        Handle: 327 Address: DF:A9:FF:F6:B1:1A (OUI DF-A9-FF)
        Count: 1
        #112: len 21 (0 Kb/s)
        Latency: 171 msec (73-171 msec ~165 msec)
> ACL Data RX: Handle 327 flags 0x02 dlen 21               #114 [hci1] 7.618582
      SMP: Pairing Random (0x04) len 16
        Random value: 7b859fe021eb740ad01a3724dc13bd4d
< HCI Command: Host Number of Comp.. (0x03|0x0035) plen 5  #115 [hci1] 7.627292
        Num handles: 1
        Handle: 327 Address: DF:A9:FF:F6:B1:1A (OUI DF-A9-FF)
        Count: 1
< ACL Data TX: Handle 327 flags 0x00 dlen 21               #116 [hci1] 7.627354
      SMP: Pairing Random (0x04) len 16
        Random value: dddbdfe2838e9a8cc6964353c850fef7
> HCI Event: Number of Completed Packets (0x13) plen 5     #117 [hci1] 7.793284
        Num handles: 1
        Handle: 327 Address: DF:A9:FF:F6:B1:1A (OUI DF-A9-FF)
        Count: 1
        #116: len 21 (1 Kb/s)
        Latency: 165 msec (73-171 msec ~165 msec)
> ACL Data RX: Handle 327 flags 0x02 dlen 21               #118 [hci1] 7.793717
      SMP: Pairing Confirm (0x03) len 16
        Confim value: edb3420be2606d9fb45179d463a19075
< HCI Command: Host Number of Comp.. (0x03|0x0035) plen 5  #119 [hci1] 7.807525
        Num handles: 1
        Handle: 327 Address: DF:A9:FF:F6:B1:1A (OUI DF-A9-FF)
        Count: 1
< ACL Data TX: Handle 327 flags 0x00 dlen 21               #120 [hci1] 7.807651
      SMP: Pairing Confirm (0x03) len 16
        Confim value: 97b9129c2d6f16b74780a9f22155b0c3
> HCI Event: Number of Completed Packets (0x13) plen 5     #121 [hci1] 7.968366
        Num handles: 1
        Handle: 327 Address: DF:A9:FF:F6:B1:1A (OUI DF-A9-FF)
        Count: 1
        #120: len 21 (1 Kb/s)
        Latency: 160 msec (73-171 msec ~163 msec)
> ACL Data RX: Handle 327 flags 0x02 dlen 21               #122 [hci1] 7.968619
      SMP: Pairing Random (0x04) len 16
        Random value: 7dbfcfd8ad734a449ce2c85fb48e67d8
< HCI Command: Host Number of Comp.. (0x03|0x0035) plen 5  #123 [hci1] 7.987529
        Num handles: 1
        Handle: 327 Address: DF:A9:FF:F6:B1:1A (OUI DF-A9-FF)
        Count: 1
< ACL Data TX: Handle 327 flags 0x00 dlen 21               #124 [hci1] 7.987589
      SMP: Pairing Random (0x04) len 16
        Random value: eb9f1915536596b6fc3db1c86b2b1970
> HCI Event: Number of Completed Packets (0x13) plen 5     #125 [hci1] 8.143211
        Num handles: 1
        Handle: 327 Address: DF:A9:FF:F6:B1:1A (OUI DF-A9-FF)
        Count: 1
        #124: len 21 (1 Kb/s)
        Latency: 155 msec (73-171 msec ~159 msec)
> ACL Data RX: Handle 327 flags 0x02 dlen 21               #126 [hci1] 8.143530
      SMP: Pairing Confirm (0x03) len 16
        Confim value: ea5a138f9686abb1b2cc94dce2507213
< HCI Command: Host Number of Comp.. (0x03|0x0035) plen 5  #127 [hci1] 8.147175
        Num handles: 1
        Handle: 327 Address: DF:A9:FF:F6:B1:1A (OUI DF-A9-FF)
        Count: 1
< ACL Data TX: Handle 327 flags 0x00 dlen 21               #128 [hci1] 8.147228
      SMP: Pairing Confirm (0x03) len 16
        Confim value: b92e8498588e41254bfd65cc01684b61
> HCI Event: Number of Completed Packets (0x13) plen 5     #129 [hci1] 8.318298
        Num handles: 1
        Handle: 327 Address: DF:A9:FF:F6:B1:1A (OUI DF-A9-FF)
        Count: 1
        #128: len 21 (0 Kb/s)
        Latency: 171 msec (73-171 msec ~165 msec)
> ACL Data RX: Handle 327 flags 0x02 dlen 21               #130 [hci1] 8.318550
      SMP: Pairing Random (0x04) len 16
        Random value: 0103d22150340df3c0bbdcffea7013e2
< HCI Command: Host Number of Comp.. (0x03|0x0035) plen 5  #131 [hci1] 8.327604
        Num handles: 1
        Handle: 327 Address: DF:A9:FF:F6:B1:1A (OUI DF-A9-FF)
        Count: 1
< ACL Data TX: Handle 327 flags 0x00 dlen 21               #132 [hci1] 8.327765
      SMP: Pairing Random (0x04) len 16
        Random value: 5c794dc9ad9f2c3f295ebd5ad5e1c3cf
> HCI Event: Number of Completed Packets (0x13) plen 5     #133 [hci1] 8.493187
        Num handles: 1
        Handle: 327 Address: DF:A9:FF:F6:B1:1A (OUI DF-A9-FF)
        Count: 1
        #132: len 21 (1 Kb/s)
        Latency: 165 msec (73-171 msec ~165 msec)
> ACL Data RX: Handle 327 flags 0x02 dlen 21               #134 [hci1] 8.493481
      SMP: Pairing Confirm (0x03) len 16
        Confim value: be747fc04c221657a37a50e1530297f7
< HCI Command: Host Number of Comp.. (0x03|0x0035) plen 5  #135 [hci1] 8.507513
        Num handles: 1
        Handle: 327 Address: DF:A9:FF:F6:B1:1A (OUI DF-A9-FF)
        Count: 1
< ACL Data TX: Handle 327 flags 0x00 dlen 21               #136 [hci1] 8.507537
      SMP: Pairing Confirm (0x03) len 16
        Confim value: 196ab85f1438c26f78ed90f7362b0b17
> HCI Event: Number of Completed Packets (0x13) plen 5     #137 [hci1] 8.668246
        Num handles: 1
        Handle: 327 Address: DF:A9:FF:F6:B1:1A (OUI DF-A9-FF)
        Count: 1
        #136: len 21 (1 Kb/s)
        Latency: 160 msec (73-171 msec ~163 msec)
> ACL Data RX: Handle 327 flags 0x02 dlen 21               #138 [hci1] 8.668543
      SMP: Pairing Random (0x04) len 16
        Random value: 73c8b8bc8ae8e4d7f3a7eb0d06a1b546
< HCI Command: Host Number of Comp.. (0x03|0x0035) plen 5  #139 [hci1] 8.687026
        Num handles: 1
        Handle: 327 Address: DF:A9:FF:F6:B1:1A (OUI DF-A9-FF)
        Count: 1
< ACL Data TX: Handle 327 flags 0x00 dlen 21               #140 [hci1] 8.687068
      SMP: Pairing Random (0x04) len 16
        Random value: 5c2fff312cdf99c9491988e877355a9a
> HCI Event: Number of Completed Packets (0x13) plen 5     #141 [hci1] 8.843316
        Num handles: 1
        Handle: 327 Address: DF:A9:FF:F6:B1:1A (OUI DF-A9-FF)
        Count: 1
        #140: len 21 (1 Kb/s)
        Latency: 156 msec (73-171 msec ~159 msec)
> ACL Data RX: Handle 327 flags 0x02 dlen 21               #142 [hci1] 8.843564
      SMP: Pairing Confirm (0x03) len 16
        Confim value: 7e3130fc3d994444d0902bab54ec5768
< HCI Command: Host Number of Comp.. (0x03|0x0035) plen 5  #143 [hci1] 8.847573
        Num handles: 1
        Handle: 327 Address: DF:A9:FF:F6:B1:1A (OUI DF-A9-FF)
        Count: 1
< ACL Data TX: Handle 327 flags 0x00 dlen 21               #144 [hci1] 8.847746
      SMP: Pairing Confirm (0x03) len 16
        Confim value: b23bd9517fcd37c300aff25d70eab231
> HCI Event: Number of Completed Packets (0x13) plen 5     #145 [hci1] 9.018337
        Num handles: 1
        Handle: 327 Address: DF:A9:FF:F6:B1:1A (OUI DF-A9-FF)
        Count: 1
        #144: len 21 (0 Kb/s)
        Latency: 170 msec (73-171 msec ~165 msec)
> ACL Data RX: Handle 327 flags 0x02 dlen 21               #146 [hci1] 9.018498
      SMP: Pairing Random (0x04) len 16
        Random value: f4e97b5ea8c97e96b133df8a49e18ee2
< HCI Command: Host Number of Comp.. (0x03|0x0035) plen 5  #147 [hci1] 9.027163
        Num handles: 1
        Handle: 327 Address: DF:A9:FF:F6:B1:1A (OUI DF-A9-FF)
        Count: 1
< ACL Data TX: Handle 327 flags 0x00 dlen 21               #148 [hci1] 9.027199
      SMP: Pairing Random (0x04) len 16
        Random value: c629a3a987d808e808655d558dfc1155
< ACL Data TX: Handle 327 flags 0x00 dlen 16               #149 [hci1] 9.136936
      LE L2CAP: Connection Parameter Update Request (0x12) ident 1 len 8
        Min interval: 24
        Max interval: 40
        Peripheral latency: 0
        Timeout multiplier: 42
> HCI Event: Number of Completed Packets (0x13) plen 5     #150 [hci1] 9.193247
        Num handles: 1
        Handle: 327 Address: DF:A9:FF:F6:B1:1A (OUI DF-A9-FF)
        Count: 1
        #148: len 21 (1 Kb/s)
        Latency: 166 msec (73-171 msec ~165 msec)
> ACL Data RX: Handle 327 flags 0x02 dlen 21               #151 [hci1] 9.193589
      SMP: Pairing Confirm (0x03) len 16
        Confim value: 51d097f7345f9e2a39d3be1722847fbb
< HCI Command: Host Number of Comp.. (0x03|0x0035) plen 5  #152 [hci1] 9.207682
        Num handles: 1
        Handle: 327 Address: DF:A9:FF:F6:B1:1A (OUI DF-A9-FF)
        Count: 1
< ACL Data TX: Handle 327 flags 0x00 dlen 21               #153 [hci1] 9.207817
      SMP: Pairing Confirm (0x03) len 16
        Confim value: b5d89b31ab76f330b5867be312941054
> HCI Event: Number of Completed Packets (0x13) plen 5     #154 [hci1] 9.280666
        Num handles: 1
        Handle: 327 Address: DF:A9:FF:F6:B1:1A (OUI DF-A9-FF)
        Count: 1
        #149: len 16 (0 Kb/s)
        Latency: 143 msec (73-171 msec ~154 msec)
> ACL Data RX: Handle 327 flags 0x02 dlen 10               #155 [hci1] 9.280839
      LE L2CAP: Connection Parameter Update Response (0x13) ident 1 len 2
        Result: Connection Parameters accepted (0x0000)
< HCI Command: Host Number of Comp.. (0x03|0x0035) plen 5  #156 [hci1] 9.287491
        Num handles: 1
        Handle: 327 Address: DF:A9:FF:F6:B1:1A (OUI DF-A9-FF)
        Count: 1
> HCI Event: Number of Completed Packets (0x13) plen 5     #157 [hci1] 9.368146
        Num handles: 1
        Handle: 327 Address: DF:A9:FF:F6:B1:1A (OUI DF-A9-FF)
        Count: 1
        #153: len 21 (1 Kb/s)
        Latency: 160 msec (73-171 msec ~157 msec)
> ACL Data RX: Handle 327 flags 0x02 dlen 21               #158 [hci1] 9.368652
      SMP: Pairing Random (0x04) len 16
        Random value: b3d73c6f92e0ed0115ff795a25a34b30
< HCI Command: Host Number of Comp.. (0x03|0x0035) plen 5  #159 [hci1] 9.387385
        Num handles: 1
        Handle: 327 Address: DF:A9:FF:F6:B1:1A (OUI DF-A9-FF)
        Count: 1
< ACL Data TX: Handle 327 flags 0x00 dlen 21               #160 [hci1] 9.387503
      SMP: Pairing Random (0x04) len 16
        Random value: 92f20f6ad8f13724432c7fd6001c45ff
> HCI Event: Number of Completed Packets (0x13) plen 5     #161 [hci1] 9.543253
        Num handles: 1
        Handle: 327 Address: DF:A9:FF:F6:B1:1A (OUI DF-A9-FF)
        Count: 1
        #160: len 21 (1 Kb/s)
        Latency: 155 msec (73-171 msec ~156 msec)
> ACL Data RX: Handle 327 flags 0x02 dlen 21               #162 [hci1] 9.543606
      SMP: Pairing Confirm (0x03) len 16
        Confim value: 12fcbb466e99ee8d3a65c6e144a5c802
< HCI Command: Host Number of Comp.. (0x03|0x0035) plen 5  #163 [hci1] 9.547585
        Num handles: 1
        Handle: 327 Address: DF:A9:FF:F6:B1:1A (OUI DF-A9-FF)
        Count: 1
< ACL Data TX: Handle 327 flags 0x00 dlen 21               #164 [hci1] 9.547671
      SMP: Pairing Confirm (0x03) len 16
        Confim value: cfe3b7a804f2faf64cb39bac53d26ba3
> HCI Event: Number of Completed Packets (0x13) plen 5     #165 [hci1] 9.718191
        Num handles: 1
        Handle: 327 Address: DF:A9:FF:F6:B1:1A (OUI DF-A9-FF)
        Count: 1
        #164: len 21 (0 Kb/s)
        Latency: 170 msec (73-171 msec ~163 msec)
> ACL Data RX: Handle 327 flags 0x02 dlen 21               #166 [hci1] 9.718517
      SMP: Pairing Random (0x04) len 16
        Random value: b38adb3b4a4cb17b4bdd440ccc7f9287
< HCI Command: Host Number of Comp.. (0x03|0x0035) plen 5  #167 [hci1] 9.727692
        Num handles: 1
        Handle: 327 Address: DF:A9:FF:F6:B1:1A (OUI DF-A9-FF)
        Count: 1
< ACL Data TX: Handle 327 flags 0x00 dlen 21               #168 [hci1] 9.727801
      SMP: Pairing Random (0x04) len 16
        Random value: 23ac32ebbb5e14c8a6b9622f296d277f
> HCI Event: Number of Completed Packets (0x13) plen 5     #169 [hci1] 9.893171
        Num handles: 1
        Handle: 327 Address: DF:A9:FF:F6:B1:1A (OUI DF-A9-FF)
        Count: 1
        #168: len 21 (1 Kb/s)
        Latency: 165 msec (73-171 msec ~164 msec)
> ACL Data RX: Handle 327 flags 0x02 dlen 21               #170 [hci1] 9.893642
      SMP: Pairing Confirm (0x03) len 16
        Confim value: fdd5955fb8f312765e321f0f33d7ebdf
< HCI Command: Host Number of Comp.. (0x03|0x0035) plen 5  #171 [hci1] 9.907803
        Num handles: 1
        Handle: 327 Address: DF:A9:FF:F6:B1:1A (OUI DF-A9-FF)
        Count: 1
< ACL Data TX: Handle 327 flags 0x00 dlen 21               #172 [hci1] 9.907881
      SMP: Pairing Confirm (0x03) len 16
        Confim value: d29ed1a7076c192f9e19b109819567a0
> HCI Event: Number of Completed Packets (0x13) plen 5    #173 [hci1] 10.068146
        Num handles: 1
        Handle: 327 Address: DF:A9:FF:F6:B1:1A (OUI DF-A9-FF)
        Count: 1
        #172: len 21 (1 Kb/s)
        Latency: 160 msec (73-171 msec ~162 msec)
> ACL Data RX: Handle 327 flags 0x02 dlen 21              #174 [hci1] 10.068592
      SMP: Pairing Random (0x04) len 16
        Random value: 7f50ef16957690bfaaa60106b84db0f3
< HCI Command: Host Number of Com.. (0x03|0x0035) plen 5  #175 [hci1] 10.087135
        Num handles: 1
        Handle: 327 Address: DF:A9:FF:F6:B1:1A (OUI DF-A9-FF)
        Count: 1
< ACL Data TX: Handle 327 flags 0x00 dlen 21              #176 [hci1] 10.087170
      SMP: Pairing Random (0x04) len 16
        Random value: 297efe85e67448a15f56bd27e3a3cf1d
> HCI Event: Number of Completed Packets (0x13) plen 5    #177 [hci1] 10.243266
        Num handles: 1
        Handle: 327 Address: DF:A9:FF:F6:B1:1A (OUI DF-A9-FF)
        Count: 1
        #176: len 21 (1 Kb/s)
        Latency: 156 msec (73-171 msec ~159 msec)
> ACL Data RX: Handle 327 flags 0x02 dlen 21              #178 [hci1] 10.243628
      SMP: Pairing Confirm (0x03) len 16
        Confim value: c7f373bb61e8e8d69d61a49678ad29c2
< HCI Command: Host Number of Com.. (0x03|0x0035) plen 5  #179 [hci1] 10.247714
        Num handles: 1
        Handle: 327 Address: DF:A9:FF:F6:B1:1A (OUI DF-A9-FF)
        Count: 1
< ACL Data TX: Handle 327 flags 0x00 dlen 21              #180 [hci1] 10.247871
      SMP: Pairing Confirm (0x03) len 16
        Confim value: 8028e4210ee619799182d1a9af1064c4
> HCI Event: Number of Completed Packets (0x13) plen 5    #181 [hci1] 10.418249
        Num handles: 1
        Handle: 327 Address: DF:A9:FF:F6:B1:1A (OUI DF-A9-FF)
        Count: 1
        #180: len 21 (0 Kb/s)
        Latency: 170 msec (73-171 msec ~164 msec)
> ACL Data RX: Handle 327 flags 0x02 dlen 21              #182 [hci1] 10.418590
      SMP: Pairing Random (0x04) len 16
        Random value: 15909eef8e21f0099b5faa5e382a73a1
< HCI Command: Host Number of Com.. (0x03|0x0035) plen 5  #183 [hci1] 10.427572
        Num handles: 1
        Handle: 327 Address: DF:A9:FF:F6:B1:1A (OUI DF-A9-FF)
        Count: 1
< ACL Data TX: Handle 327 flags 0x00 dlen 21              #184 [hci1] 10.427681
      SMP: Pairing Random (0x04) len 16
        Random value: 25a9493fd3ce4faf02be7293595bb7c6
> HCI Event: Number of Completed Packets (0x13) plen 5    #185 [hci1] 10.593281
        Num handles: 1
        Handle: 327 Address: DF:A9:FF:F6:B1:1A (OUI DF-A9-FF)
        Count: 1
        #184: len 21 (1 Kb/s)
        Latency: 165 msec (73-171 msec ~165 msec)
> ACL Data RX: Handle 327 flags 0x02 dlen 21              #186 [hci1] 10.593565
      SMP: Pairing Confirm (0x03) len 16
        Confim value: 0c1499a1e8a13b7f6b30c13b3f806b10
< HCI Command: Host Number of Com.. (0x03|0x0035) plen 5  #187 [hci1] 10.607660
        Num handles: 1
        Handle: 327 Address: DF:A9:FF:F6:B1:1A (OUI DF-A9-FF)
        Count: 1
< ACL Data TX: Handle 327 flags 0x00 dlen 21              #188 [hci1] 10.607743
      SMP: Pairing Confirm (0x03) len 16
        Confim value: 855812f8a37a90a1eb7b26a83947c732
> HCI Event: Number of Completed Packets (0x13) plen 5    #189 [hci1] 10.768152
        Num handles: 1
        Handle: 327 Address: DF:A9:FF:F6:B1:1A (OUI DF-A9-FF)
        Count: 1
        #188: len 21 (1 Kb/s)
        Latency: 160 msec (73-171 msec ~162 msec)
> ACL Data RX: Handle 327 flags 0x02 dlen 21              #190 [hci1] 10.768744
      SMP: Pairing Random (0x04) len 16
        Random value: c021f1ec5d46490f10eab0ae3adbdd18
< HCI Command: Host Number of Com.. (0x03|0x0035) plen 5  #191 [hci1] 10.787345
        Num handles: 1
        Handle: 327 Address: DF:A9:FF:F6:B1:1A (OUI DF-A9-FF)
        Count: 1
< ACL Data TX: Handle 327 flags 0x00 dlen 21              #192 [hci1] 10.787408
      SMP: Pairing Random (0x04) len 16
        Random value: 58f6b41f855a6f6c3560debd84e2affc
> HCI Event: Number of Completed Packets (0x13) plen 5    #193 [hci1] 10.943180
        Num handles: 1
        Handle: 327 Address: DF:A9:FF:F6:B1:1A (OUI DF-A9-FF)
        Count: 1
        #192: len 21 (1 Kb/s)
        Latency: 155 msec (73-171 msec ~159 msec)
> ACL Data RX: Handle 327 flags 0x02 dlen 21              #194 [hci1] 10.943589
      SMP: Pairing Confirm (0x03) len 16
        Confim value: 69ae19a1121a165f3c815d77b752c3f5
< HCI Command: Host Number of Com.. (0x03|0x0035) plen 5  #195 [hci1] 10.947181
        Num handles: 1
        Handle: 327 Address: DF:A9:FF:F6:B1:1A (OUI DF-A9-FF)
        Count: 1
< ACL Data TX: Handle 327 flags 0x00 dlen 21              #196 [hci1] 10.947190
      SMP: Pairing Confirm (0x03) len 16
        Confim value: 8123f73471721dbdb10d9582cfca5495
> HCI Event: Number of Completed Packets (0x13) plen 5    #197 [hci1] 11.118228
        Num handles: 1
        Handle: 327 Address: DF:A9:FF:F6:B1:1A (OUI DF-A9-FF)
        Count: 1
        #196: len 21 (0 Kb/s)
        Latency: 171 msec (73-171 msec ~165 msec)
> ACL Data RX: Handle 327 flags 0x02 dlen 21              #198 [hci1] 11.118620
      SMP: Pairing Random (0x04) len 16
        Random value: 68240fe25b6c912ea73ad0521a6ae09e
< HCI Command: Host Number of Com.. (0x03|0x0035) plen 5  #199 [hci1] 11.127670
        Num handles: 1
        Handle: 327 Address: DF:A9:FF:F6:B1:1A (OUI DF-A9-FF)
        Count: 1
< ACL Data TX: Handle 327 flags 0x00 dlen 21              #200 [hci1] 11.127761
      SMP: Pairing Random (0x04) len 16
        Random value: b67e7216d5bf664139eda2b542549666
> HCI Event: Number of Completed Packets (0x13) plen 5    #201 [hci1] 11.293170
        Num handles: 1
        Handle: 327 Address: DF:A9:FF:F6:B1:1A (OUI DF-A9-FF)
        Count: 1
        #200: len 21 (1 Kb/s)
        Latency: 165 msec (73-171 msec ~165 msec)
> ACL Data RX: Handle 327 flags 0x02 dlen 21              #202 [hci1] 11.293556
      SMP: Pairing Confirm (0x03) len 16
        Confim value: 3478d0b8ff23d571d0a9307cf7011e69
< HCI Command: Host Number of Com.. (0x03|0x0035) plen 5  #203 [hci1] 11.307599
        Num handles: 1
        Handle: 327 Address: DF:A9:FF:F6:B1:1A (OUI DF-A9-FF)
        Count: 1
< ACL Data TX: Handle 327 flags 0x00 dlen 21              #204 [hci1] 11.307695
      SMP: Pairing Confirm (0x03) len 16
        Confim value: 748bbe57471b23770ad422d55fd8b74c
> HCI Event: Number of Completed Packets (0x13) plen 5    #205 [hci1] 11.468210
        Num handles: 1
        Handle: 327 Address: DF:A9:FF:F6:B1:1A (OUI DF-A9-FF)
        Count: 1
        #204: len 21 (1 Kb/s)
        Latency: 160 msec (73-171 msec ~162 msec)
> ACL Data RX: Handle 327 flags 0x02 dlen 21              #206 [hci1] 11.468660
      SMP: Pairing Random (0x04) len 16
        Random value: 0c6dfd675c811e32e0d32cb41cb7a617
< HCI Command: Host Number of Com.. (0x03|0x0035) plen 5  #207 [hci1] 11.487649
        Num handles: 1
        Handle: 327 Address: DF:A9:FF:F6:B1:1A (OUI DF-A9-FF)
        Count: 1
< ACL Data TX: Handle 327 flags 0x00 dlen 21              #208 [hci1] 11.487733
      SMP: Pairing Random (0x04) len 16
        Random value: ed17f76500c95219dd01e09d1e63f87b
> HCI Event: Number of Completed Packets (0x13) plen 5    #209 [hci1] 11.643190
        Num handles: 1
        Handle: 327 Address: DF:A9:FF:F6:B1:1A (OUI DF-A9-FF)
        Count: 1
        #208: len 21 (1 Kb/s)
        Latency: 155 msec (73-171 msec ~159 msec)
> ACL Data RX: Handle 327 flags 0x02 dlen 21              #210 [hci1] 11.643551
      SMP: Pairing Confirm (0x03) len 16
        Confim value: bd52d9a8f006fc18240883fe3c799342
< HCI Command: Host Number of Com.. (0x03|0x0035) plen 5  #211 [hci1] 11.647834
        Num handles: 1
        Handle: 327 Address: DF:A9:FF:F6:B1:1A (OUI DF-A9-FF)
        Count: 1
< ACL Data TX: Handle 327 flags 0x00 dlen 21              #212 [hci1] 11.647914
      SMP: Pairing Confirm (0x03) len 16
        Confim value: 73d23c649903514c876948ec3c7e3905
> HCI Event: Number of Completed Packets (0x13) plen 5    #213 [hci1] 11.818157
        Num handles: 1
        Handle: 327 Address: DF:A9:FF:F6:B1:1A (OUI DF-A9-FF)
        Count: 1
        #212: len 21 (0 Kb/s)
        Latency: 170 msec (73-171 msec ~164 msec)
> ACL Data RX: Handle 327 flags 0x02 dlen 21              #214 [hci1] 11.818644
      SMP: Pairing Random (0x04) len 16
        Random value: 1bfe4656aaf1a2c5467ebd6867a752b0
< HCI Command: Host Number of Com.. (0x03|0x0035) plen 5  #215 [hci1] 11.827197
        Num handles: 1
        Handle: 327 Address: DF:A9:FF:F6:B1:1A (OUI DF-A9-FF)
        Count: 1
< ACL Data TX: Handle 327 flags 0x00 dlen 21              #216 [hci1] 11.827334
      SMP: Pairing Random (0x04) len 16
        Random value: 81d35d47e1f6006d79c974bd9d9e1ee3
> HCI Event: Number of Completed Packets (0x13) plen 5    #217 [hci1] 11.993145
        Num handles: 1
        Handle: 327 Address: DF:A9:FF:F6:B1:1A (OUI DF-A9-FF)
        Count: 1
        #216: len 21 (1 Kb/s)
        Latency: 165 msec (73-171 msec ~165 msec)
> ACL Data RX: Handle 327 flags 0x02 dlen 21              #218 [hci1] 11.993531
      SMP: Pairing Confirm (0x03) len 16
        Confim value: baf8d4defe21756f7dd4bd2c37f1228f
< HCI Command: Host Number of Com.. (0x03|0x0035) plen 5  #219 [hci1] 12.007663
        Num handles: 1
        Handle: 327 Address: DF:A9:FF:F6:B1:1A (OUI DF-A9-FF)
        Count: 1
< ACL Data TX: Handle 327 flags 0x00 dlen 21              #220 [hci1] 12.007774
      SMP: Pairing Confirm (0x03) len 16
        Confim value: 28702f816e3672514ab16d9576a5cee2
> HCI Event: Number of Completed Packets (0x13) plen 5    #221 [hci1] 12.168198
        Num handles: 1
        Handle: 327 Address: DF:A9:FF:F6:B1:1A (OUI DF-A9-FF)
        Count: 1
        #220: len 21 (1 Kb/s)
        Latency: 160 msec (73-171 msec ~162 msec)
> ACL Data RX: Handle 327 flags 0x02 dlen 21              #222 [hci1] 12.168512
      SMP: Pairing Random (0x04) len 16
        Random value: c6c7370359837f695fb29202d47ac8f3
< HCI Command: Host Number of Com.. (0x03|0x0035) plen 5  #223 [hci1] 12.187689
        Num handles: 1
        Handle: 327 Address: DF:A9:FF:F6:B1:1A (OUI DF-A9-FF)
        Count: 1
< ACL Data TX: Handle 327 flags 0x00 dlen 21              #224 [hci1] 12.187795
      SMP: Pairing Random (0x04) len 16
        Random value: e7f7e0c2476823e41736a7e381bafb7c
> HCI Event: Number of Completed Packets (0x13) plen 5    #225 [hci1] 12.343287
        Num handles: 1
        Handle: 327 Address: DF:A9:FF:F6:B1:1A (OUI DF-A9-FF)
        Count: 1
        #224: len 21 (1 Kb/s)
        Latency: 155 msec (73-171 msec ~159 msec)
> ACL Data RX: Handle 327 flags 0x02 dlen 21              #226 [hci1] 12.343540
      SMP: Pairing Confirm (0x03) len 16
        Confim value: d81e144e79c274cd434a30901ffe00dd
< HCI Command: Host Number of Com.. (0x03|0x0035) plen 5  #227 [hci1] 12.347413
        Num handles: 1
        Handle: 327 Address: DF:A9:FF:F6:B1:1A (OUI DF-A9-FF)
        Count: 1
< ACL Data TX: Handle 327 flags 0x00 dlen 21              #228 [hci1] 12.347475
      SMP: Pairing Confirm (0x03) len 16
        Confim value: 8f06d7a664f227edda047d4384a27583
> HCI Event: Number of Completed Packets (0x13) plen 5    #229 [hci1] 12.518250
        Num handles: 1
        Handle: 327 Address: DF:A9:FF:F6:B1:1A (OUI DF-A9-FF)
        Count: 1
        #228: len 21 (0 Kb/s)
        Latency: 170 msec (73-171 msec ~164 msec)
> ACL Data RX: Handle 327 flags 0x02 dlen 21              #230 [hci1] 12.518557
      SMP: Pairing Random (0x04) len 16
        Random value: 41794fe168be5b92f7d1a466331bf081
< HCI Command: Host Number of Com.. (0x03|0x0035) plen 5  #231 [hci1] 12.527689
        Num handles: 1
        Handle: 327 Address: DF:A9:FF:F6:B1:1A (OUI DF-A9-FF)
        Count: 1
< ACL Data TX: Handle 327 flags 0x00 dlen 21              #232 [hci1] 12.527773
      SMP: Pairing Random (0x04) len 16
        Random value: fc8b40d9b0b09bc4296bf8753a8f6e1f
> HCI Event: Number of Completed Packets (0x13) plen 5    #233 [hci1] 12.693135
        Num handles: 1
        Handle: 327 Address: DF:A9:FF:F6:B1:1A (OUI DF-A9-FF)
        Count: 1
        #232: len 21 (1 Kb/s)
        Latency: 165 msec (73-171 msec ~165 msec)
> ACL Data RX: Handle 327 flags 0x02 dlen 21              #234 [hci1] 12.693583
      SMP: Pairing DHKey Check (0x0d) len 16
        E: e204ee222d64a10d5c37bd42bac2ecff
< HCI Command: Host Number of Com.. (0x03|0x0035) plen 5  #235 [hci1] 12.708065
        Num handles: 1
        Handle: 327 Address: DF:A9:FF:F6:B1:1A (OUI DF-A9-FF)
        Count: 1
< ACL Data TX: Handle 327 flags 0x00 dlen 21              #236 [hci1] 12.708156
      SMP: Pairing DHKey Check (0x0d) len 16
        E: 2ac1e55b60b75396ccf27bfda0463341
> HCI Event: Number of Completed Packets (0x13) plen 5    #237 [hci1] 12.868104
        Num handles: 1
        Handle: 327 Address: DF:A9:FF:F6:B1:1A (OUI DF-A9-FF)
        Count: 1
        #236: len 21 (1 Kb/s)
        Latency: 159 msec (73-171 msec ~162 msec)
> HCI Event: LE Meta Event (0x3e) plen 13                 #238 [hci1] 12.956063
      LE Long Term Key Request (0x05)
        Handle: 327 Address: DF:A9:FF:F6:B1:1A (OUI DF-A9-FF)
        Random number: 0x0000000000000000
        Encrypted diversifier: 0x0000
< HCI Command: LE Long Term Key... (0x08|0x001a) plen 18  #239 [hci1] 12.967245
        Handle: 327 Address: DF:A9:FF:F6:B1:1A (OUI DF-A9-FF)
        Long term key: 10dcb6d4e38cd4d59ccf73ee055cb8bc
> HCI Event: Command Complete (0x0e) plen 6               #240 [hci1] 12.968045
      LE Long Term Key Request Reply (0x08|0x001a) ncmd 1
        Status: Success (0x00)
        Handle: 327 Address: DF:A9:FF:F6:B1:1A (OUI DF-A9-FF)
> HCI Event: Encryption Change (0x08) plen 4              #241 [hci1] 13.393274
        Status: Success (0x00)
        Handle: 327 Address: DF:A9:FF:F6:B1:1A (OUI DF-A9-FF)
        Encryption: Enabled with AES-CCM (0x01)
> HCI Event: Disconnect Complete (0x05) plen 4            #242 [hci1] 16.543218
        Status: Success (0x00)
        Handle: 327 Address: DF:A9:FF:F6:B1:1A (OUI DF-A9-FF)
        Reason: Remote User Terminated Connection (0x13)
< HCI Command: Reset (0x03|0x0003) plen 0                 #243 [hci1] 23.607098
> HCI Event: Command Complete (0x0e) plen 4               #244 [hci1] 23.607677
      Reset (0x03|0x0003) ncmd 1
        Status: Success (0x00)
@ USER Close: main                                    {0x0001} [hci1] 23.626957
= Close Index: 00:00:00:00:00:00                               [hci1] 23.626966
