Bluetooth monitor ver 5.72
= Note: Linux version 7.0.0-31-generic (x86_64)                        0.788046
= Note: Bluetooth subsystem version 2.22                               0.788048
= New Index: 00:00:00:00:00:00 (Primary,UART,hci2)              [hci2] 0.788048
= New Index: 00:00:00:00:00:00 (Primary,UART,hci1)              [hci1] 0.788049
= New Index: 48:5F:99:8E:E0:64 (Primary,USB,hci0)               [hci0] 0.788049
= Open Index: 00:00:00:00:00:00                                 [hci1] 0.931197
= Index Info: 00:00:00:00:00:00 (Nordic Semiconductor ASA)      [hci1] 0.931203
@ USER Open: main (privileged) version 2.22            {0x0001} [hci1] 0.931221
< HCI Command: Reset (0x03|0x0003) plen 0                    #1 [hci1] 0.931612
> HCI Event: Command Complete (0x0e) plen 4                  #2 [hci1] 0.932135
      Reset (0x03|0x0003) ncmd 1
        Status: Success (0x00)
< HCI Command: Read Local Supported... (0x04|0x0003) plen 0  #3 [hci1] 0.951176
> HCI Event: Command Complete (0x0e) plen 12                 #4 [hci1] 0.951760
      Read Local Supported Features (0x04|0x0003) ncmd 1
        Status: Success (0x00)
        Features: 0x00 0x00 0x00 0x00 0x60 0x00 0x00 0x00
          BR/EDR Not Supported
          LE Supported (Controller)
< HCI Command: Read Local Version In.. (0x04|0x0001) plen 0  #5 [hci1] 0.971175
> HCI Event: Command Complete (0x0e) plen 12                 #6 [hci1] 0.971654
      Read Local Version Information (0x04|0x0001) ncmd 1
        Status: Success (0x00)
        HCI version: Reserved (0x11) - Revision 12345 (0x3039)
        LMP version: Reserved (0x11) - Subversion 12345 (0x3039)
        Manufacturer: Nordic Semiconductor ASA (89)
< HCI Command: Read Local Supported... (0x04|0x0002) plen 0  #7 [hci1] 0.991178
> HCI Event: Command Complete (0x0e) plen 68                 #8 [hci1] 0.992266
      Read Local Supported Commands (0x04|0x0002) ncmd 1
        Status: Success (0x00)
        Commands: 115 entries
          Disconnect (Octet 0 - Bit 5)
          Read Remote Version Information (Octet 2 - Bit 7)
          Set Event Mask (Octet 5 - Bit 6)
          Reset (Octet 5 - Bit 7)
          Read Connection Accept Timeout (Octet 7 - Bit 2)
          Write Connection Accept Timeout (Octet 7 - Bit 3)
          Read Transmit Power Level (Octet 10 - Bit 2)
          Set Controller To Host Flow Control (Octet 10 - Bit 5)
          Host Buffer Size (Octet 10 - Bit 6)
          Host Number of Completed Packets (Octet 10 - Bit 7)
          Read Local Version Information (Octet 14 - Bit 3)
          Read Local Supported Features (Octet 14 - Bit 5)
          Read BD ADDR (Octet 15 - Bit 1)
          Read RSSI (Octet 15 - Bit 5)
          Set Event Mask Page 2 (Octet 22 - Bit 2)
          LE Set Event Mask (Octet 25 - Bit 0)
          LE Read Buffer Size (Octet 25 - Bit 1)
          LE Read Local Supported Features (Octet 25 - Bit 2)
          LE Set Random Address (Octet 25 - Bit 4)
          LE Set Advertising Parameters (Octet 25 - Bit 5)
          LE Read Advertising Channel TX Power (Octet 25 - Bit 6)
          LE Set Advertising Data (Octet 25 - Bit 7)
          LE Set Scan Response Data (Octet 26 - Bit 0)
          LE Set Advertise Enable (Octet 26 - Bit 1)
          LE Set Scan Parameters (Octet 26 - Bit 2)
          LE Set Scan Enable (Octet 26 - Bit 3)
          LE Create Connection (Octet 26 - Bit 4)
          LE Create Connection Cancel (Octet 26 - Bit 5)
          LE Read Accept List Size (Octet 26 - Bit 6)
          LE Clear Accept List (Octet 26 - Bit 7)
          LE Add Device To Accept List (Octet 27 - Bit 0)
          LE Remove Device From Accept List (Octet 27 - Bit 1)
          LE Connection Update (Octet 27 - Bit 2)
          LE Set Host Channel Classification (Octet 27 - Bit 3)
          LE Read Channel Map (Octet 27 - Bit 4)
          LE Read Remote Used Features (Octet 27 - Bit 5)
          LE Encrypt (Octet 27 - Bit 6)
          LE Rand (Octet 27 - Bit 7)
          LE Start Encryption (Octet 28 - Bit 0)
          LE Long Term Key Request Reply (Octet 28 - Bit 1)
          LE Long Term Key Request Neg Reply (Octet 28 - Bit 2)
          LE Read Supported States (Octet 28 - Bit 3)
          Read Authenticated Payload Timeout (Octet 32 - Bit 4)
          Write Authenticated Payload Timeout (Octet 32 - Bit 5)
          LE Set Data Length (Octet 33 - Bit 6)
          LE Read Suggested Default Data Length (Octet 33 - Bit 7)
          LE Write Suggested Default Data Length (Octet 34 - Bit 0)
          LE Add Device To Resolving List (Octet 34 - Bit 3)
          LE Remove Device From Resolving List (Octet 34 - Bit 4)
          LE Clear Resolving List (Octet 34 - Bit 5)
          LE Read Resolving List Size (Octet 34 - Bit 6)
          LE Set Address Resolution Enable (Octet 35 - Bit 1)
          LE Set Resolvable Private Address Timeout (Octet 35 - Bit 2)
          LE Read Maximum Data Length (Octet 35 - Bit 3)
          LE Read PHY (Octet 35 - Bit 4)
          LE Set Default PHY (Octet 35 - Bit 5)
          LE Set PHY (Octet 35 - Bit 6)
          LE Set Advertising Set Random Address (Octet 36 - Bit 1)
          LE Set Extended Advertising Parameters (Octet 36 - Bit 2)
          LE Set Extended Advertising Data (Octet 36 - Bit 3)
          LE Set Extended Scan Response Data (Octet 36 - Bit 4)
          LE Set Extended Advertising Enable (Octet 36 - Bit 5)
          LE Read Maximum Advertising Data Length (Octet 36 - Bit 6)
          LE Read Number of Supported Advertising Sets (Octet 36 - Bit 7)
          LE Remove Advertising Set (Octet 37 - Bit 0)
          LE Clear Advertising Sets (Octet 37 - Bit 1)
          LE Set Periodic Advertising Parameters (Octet 37 - Bit 2)
          LE Set Periodic Advertising Data (Octet 37 - Bit 3)
          LE Set Periodic Advertising Enable (Octet 37 - Bit 4)
          LE Set Extended Scan Parameters (Octet 37 - Bit 5)
          LE Set Extended Scan Enable (Octet 37 - Bit 6)
          LE Extended Create Connection (Octet 37 - Bit 7)
          LE Periodic Advertising Create Sync (Octet 38 - Bit 0)
          LE Periodic Advertising Create Sync Cancel (Octet 38 - Bit 1)
          LE Periodic Advertising Terminate Sync (Octet 38 - Bit 2)
          LE Add Device To Periodic Advertiser List (Octet 38 - Bit 3)
          LE Remove Device From Periodic Advertiser List (Octet 38 - Bit 4)
          LE Clear Periodic Advertiser List (Octet 38 - Bit 5)
          LE Read Periodic Advertiser List Size (Octet 38 - Bit 6)
          LE Read Transmit Power (Octet 38 - Bit 7)
          LE Read RF Path Compensation (Octet 39 - Bit 0)
          LE Write RF Path Compensation (Octet 39 - Bit 1)
          LE Set Privacy Mode (Octet 39 - Bit 2)
          LE Periodic Advertising Receive Enable (Octet 40 - Bit 5)
          LE Periodic Advertising Sync Transfer (Octet 40 - Bit 6)
          LE Periodic Advertising Set Info Transfer (Octet 40 - Bit 7)
          LE Periodic Advertising Sync Transfer Parameters (Octet 41 - Bit 0)
          LE Set Default Periodic Advertisng Sync Transfer Parameters (Octet 41 - Bit 1)
          LE Read Buffer v2 (Octet 41 - Bit 5)
          LE Read ISO TX Sync (Octet 41 - Bit 6)
          LE Set Connected Isochronous Group Parameters (Octet 41 - Bit 7)
          LE Set Connected Isochronous Group Parameters Test (Octet 42 - Bit 0)
          LE Create Connected Isochronous Stream (Octet 42 - Bit 1)
          LE Remove Connected Isochronous Group (Octet 42 - Bit 2)
          LE Accept Connected Isochronous Stream Request (Octet 42 - Bit 3)
          LE Reject Connected Isochronous Stream Request (Octet 42 - Bit 4)
          LE Create Broadcast Isochronous Group (Octet 42 - Bit 5)
          LE Create Broadcast Isochronous Group Test (Octet 42 - Bit 6)
          LE Terminate Broadcast Isochronous Group (Octet 42 - Bit 7)
          LE Broadcast Isochronous Group Create Sync (Octet 43 - Bit 0)
          LE Broadcast Isochronous Group Terminate Sync (Octet 43 - Bit 1)
          LE Request Peer SCA (Octet 43 - Bit 2)
          LE Setup Isochronous Data Path (Octet 43 - Bit 3)
          LE Remove Isochronous Data Path (Octet 43 - Bit 4)
          LE Isochronous Transmit Test (Octet 43 - Bit 5)
          LE Isochronous Receive Test (Octet 43 - Bit 6)
          LE Isochronous Read Test Counters (Octet 43 - Bit 7)
          LE Isochronous Read Test Counters (Octet 44 - Bit 0)
          LE Set Host Feature (Octet 44 - Bit 1)
          Octet 44 - Bit 2 
          Octet 45 - Bit 6 
          Octet 46 - Bit 0 
          Octet 46 - Bit 1 
          Octet 46 - Bit 2 
          Octet 47 - Bit 4 
< HCI Command: Host Buffer Size (0x03|0x0033) plen 7         #9 [hci1] 1.011179
        ACL MTU: 255  ACL max packet: 16
        SCO MTU: 0    SCO max packet: 0
> HCI Event: Command Complete (0x0e) plen 4                 #10 [hci1] 1.011778
      Host Buffer Size (0x03|0x0033) ncmd 1
        Status: Success (0x00)
< HCI Command: Set Controller To Ho.. (0x03|0x0031) plen 1  #11 [hci1] 1.031187
        Flow control: ACL Data Packets (0x01)
> HCI Event: Command Complete (0x0e) plen 4                 #12 [hci1] 1.031708
      Set Controller To Host Flow Control (0x03|0x0031) ncmd 1
        Status: Success (0x00)
< HCI Command: LE Read Local Suppor.. (0x08|0x0003) plen 0  #13 [hci1] 1.051187
> HCI Event: Command Complete (0x0e) plen 12                #14 [hci1] 1.051731
      LE Read Local Supported Features (0x08|0x0003) ncmd 1
        Status: Success (0x00)
        Features: 0xfd 0x79 0x00 0xf7 0x30 0x01 0x00 0x00
          LE Encryption
          Extended Reject Indication
          Peripheral-initiated Features Exchange
          LE Ping
          LE Data Packet Length Extension
          LL Privacy
          Extended Scanner Filter Policies
          LE 2M PHY
          LE Coded PHY
          LE Extended Advertising
          LE Periodic Advertising
          Channel Selection Algorithm #2
          Periodic Advertising Sync Transfer - Sender
          Periodic Advertising Sync Transfer - Recipient
          Sleep Clock Accuracy Updates
          Connected Isochronous Stream - Central
          Connected Isochronous Stream - Peripheral
          Isochronous Broadcaster
          Synchronized Receiver
          Periodic Advertising ADI support
          Connection Subrating
          Unknown features (0x0000010000000000)
< HCI Command: LE Set Host Feature (0x08|0x0074) plen 2     #15 [hci1] 1.071148
        Bit Number: 32
          Connected Isochronous Stream (Host Support)
        Bit Value: 1
> HCI Event: Command Complete (0x0e) plen 4                 #16 [hci1] 1.071630
      LE Set Host Feature (0x08|0x0074) ncmd 1
        Status: Success (0x00)
< HCI Command: LE Read Buffer v2 (0x08|0x0060) plen 0       #17 [hci1] 1.091179
> HCI Event: Command Complete (0x0e) plen 10                #18 [hci1] 1.091766
      LE Read Buffer v2 (0x08|0x0060) ncmd 1
        Status: Success (0x00)
        ACL MTU: 27
        ACL max packet: 3
        ISO MTU: 318
        ISO max packet: 3
< HCI Command: LE Read Maximum Adve.. (0x08|0x003a) plen 0  #19 [hci1] 1.111187
> HCI Event: Command Complete (0x0e) plen 6                 #20 [hci1] 1.111764
      LE Read Maximum Advertising Data Length (0x08|0x003a) ncmd 1
        Status: Success (0x00)
        Max length: 1650
< HCI Command: LE Read Supported St.. (0x08|0x001c) plen 0  #21 [hci1] 1.131190
> HCI Event: Command Complete (0x0e) plen 12                #22 [hci1] 1.131774
      LE Read Supported States (0x08|0x001c) ncmd 1
        Status: Success (0x00)
        States: 0x000003ff3e0306ff
          Non-connectable Advertising State
          Scannable Advertising State
          Connectable Advertising State
          High Duty Cycle Directed Advertising State
          Passive Scanning State
          Active Scanning State
          Initiating State
            and Connection State (Central Role)
          Connection State (Peripheral Role)
          Scannable Advertising State
            and Passive Scanning State
          Connectable Advertising State
            and Passive Scanning State
          Non-connectable Advertising State
            and Initiating State
          Scannable Advertising State
            and Initiating State
          Active Scanning State
            and Connection State (Central Role)
          Passive Scanning State
            and Connection State (Peripheral Role)
          Active Scanning State
            and Connection State (Peripheral Role)
          Initiating State
            and Connection State (Central Role)
            and Central Role & Central Role
          Low Duty Cycle Directed Advertising State
          Connectable Advertising State
            and Initiating State
            and Central Role & Peripheral Role
          High Duty Cycle Directed Advertising State
            and Initiating State
            and Central Role & Peripheral Role
          Low Duty Cycle Directed Advertising State
            and Initiating State
            and Central Role & Peripheral Role
          Connectable Advertising State
            and Connection State (Central Role)
            and Central Role & Peripheral Role
          High Duty Cycle Directed Advertising State
            and Connection State (Central Role)
            and Central Role & Peripheral Role
          Low Duty Cycle Directed Advertising State
            and Connection State (Central Role)
            and Central Role & Peripheral Role
          Connectable Advertising State
            and Connection State (Peripheral Role)
            and Central Role & Peripheral Role
          High Duty Cycle Directed Advertising State
            and Connection State (Peripheral Role)
            and Peripheral Role & Peripheral Role
          Low Duty Cycle Directed Advertising State
            and Connection State (Peripheral Role)
            and Peripheral Role & Peripheral Role
          Initiating State
            and Connection State (Peripheral Role)
            and Central Role & Peripheral Role
< HCI Command: LE Read Maximum Data.. (0x08|0x002f) plen 0  #23 [hci1] 1.151185
> HCI Event: Command Complete (0x0e) plen 12                #24 [hci1] 1.151796
      LE Read Maximum Data Length (0x08|0x002f) ncmd 1
        Status: Success (0x00)
        Max TX octets: 251
        Max TX time: 2704
        Max RX octets: 251
        Max RX time: 2704
< HCI Command: LE Write Suggested D.. (0x08|0x0024) plen 4  #25 [hci1] 1.171178
        TX octets: 251
        TX time: 2704
> HCI Event: Command Complete (0x0e) plen 4                 #26 [hci1] 1.171664
      LE Write Suggested Default Data Length (0x08|0x0024) ncmd 1
        Status: Success (0x00)
< HCI Command: LE Read Resolving Li.. (0x08|0x002a) plen 0  #27 [hci1] 1.191163
> HCI Event: Command Complete (0x0e) plen 5                 #28 [hci1] 1.191582
      LE Read Resolving List Size (0x08|0x002a) ncmd 1
        Status: Success (0x00)
        Size: 8
< HCI Command: LE Set Host Feature (0x08|0x0074) plen 2     #29 [hci1] 1.211183
        Bit Number: 38
          Connection Subrating (Host Support)
        Bit Value: 1
> HCI Event: Command Complete (0x0e) plen 4                 #30 [hci1] 1.211633
      LE Set Host Feature (0x08|0x0074) ncmd 1
        Status: Success (0x00)
< HCI Command: LE Set Event Mask (0x08|0x0001) plen 8       #31 [hci1] 1.231177
        Mask: 0x000002063f87fa5e
          LE Advertising Report
          LE Connection Update Complete
          LE Read Remote Used Features Complete
          LE Long Term Key Request
          LE Data Length Change
          LE Enhanced Connection Complete
          LE PHY Update Complete
          LE Extended Advertising Report
          LE Periodic Advertising Sync Established
          LE Periodic Advertising Report
          LE Periodic Advertising Sync Lost
          LE Extended Scan Timeout
          LE Extended Advertising Set Terminated
          LE Scan Request Received
          LE Periodic Advertising Sync Transfer Rvc
          LE CIS Established
          LE CIS Request
          LE Create BIG Complete
          LE Terminate BIG Complete
          LE BIG Sync Estabilished Complete
          LE BIG Sync Lost
          LE BIG Info Advertising Report
          LE Subrate Change
          Unknown mask (0x0000020000000000)
> HCI Event: Command Complete (0x0e) plen 4                 #32 [hci1] 1.231638
      LE Set Event Mask (0x08|0x0001) ncmd 1
        Status: Success (0x00)
< HCI Command: Set Event Mask (0x03|0x0001) plen 8          #33 [hci1] 1.251148
        Mask: 0x2000800002008890
          Disconnection Complete
          Encryption Change
          Read Remote Version Information Complete
          Hardware Error
          Data Buffer Overflow
          Encryption Key Refresh Complete
          LE Meta
> HCI Event: Command Complete (0x0e) plen 4                 #34 [hci1] 1.251742
      Set Event Mask (0x03|0x0001) ncmd 1
        Status: Success (0x00)
< HCI Command: Read BD ADDR (0x04|0x0009) plen 0            #35 [hci1] 1.271186
> HCI Event: Command Complete (0x0e) plen 10                #36 [hci1] 1.271730
      Read BD ADDR (0x04|0x0009) ncmd 1
        Status: Success (0x00)
        Address: 00:00:00:00:00:00 (OUI 00-00-00)
< HCI Command: LE Set Random Address (0x08|0x0005) plen 6   #37 [hci1] 1.291184
        Address: D5:B6:CC:31:DB:3B (Static)
> HCI Event: Command Complete (0x0e) plen 4                 #38 [hci1] 1.291755
      LE Set Random Address (0x08|0x0005) ncmd 1
        Status: Success (0x00)
< HCI Command: LE Set Extended Adv.. (0x08|0x0036) plen 25  #39 [hci1] 5.531287
        Handle: 0x00
        Properties: 0x0013
          Connectable
          Scannable
          Use legacy advertising PDUs: ADV_IND
        Min advertising interval: 100.000 msec (0x00a0)
        Max advertising interval: 150.000 msec (0x00f0)
        Channel map: 37, 38, 39 (0x07)
        Own address type: Random (0x01)
        Peer address type: Public (0x00)
        Peer address: 00:00:00:00:00:00 (OUI 00-00-00)
        Filter policy: Allow Scan Request from Any, Allow Connect Request from Any (0x00)
        TX power: Host has no preference (0x7f)
        Primary PHY: LE 1M (0x01)
        Secondary max skip: 0x00
        Secondary PHY: LE 1M (0x01)
        SID: 0x00
        Scan request notifications: Disabled (0x00)
> HCI Event: Command Complete (0x0e) plen 5                 #40 [hci1] 5.532222
      LE Set Extended Advertising Parameters (0x08|0x0036) ncmd 1
        Status: Success (0x00)
        TX power (selected): 0 dbm (0x00)
< HCI Command: LE Set Advertising S.. (0x08|0x0035) plen 7  #41 [hci1] 5.551247
        Advertising handle: 0x00
        Advertising random address: D5:B6:CC:31:DB:3B (Static)
> HCI Event: Command Complete (0x0e) plen 4                 #42 [hci1] 5.551833
      LE Set Advertising Set Random Address (0x08|0x0035) ncmd 1
        Status: Success (0x00)
< HCI Command: LE Set Extended Adv.. (0x08|0x0037) plen 22  #43 [hci1] 5.571236
        Handle: 0x00
        Operation: Complete extended advertising data (0x03)
        Fragment preference: Minimize fragmentation (0x01)
        Data length: 0x12
        Flags: 0x06
          LE General Discoverable Mode
          BR/EDR Not Supported
        Name (complete): Tester_F6B11A
> HCI Event: Command Complete (0x0e) plen 4                 #44 [hci1] 5.571959
      LE Set Extended Advertising Data (0x08|0x0037) ncmd 1
        Status: Success (0x00)
< HCI Command: LE Set Extended Scan.. (0x08|0x0038) plen 4  #45 [hci1] 5.591241
        Handle: 0x00
        Operation: Complete scan response data (0x03)
        Fragment preference: Minimize fragmentation (0x01)
        Data length: 0x00
> HCI Event: Command Complete (0x0e) plen 4                 #46 [hci1] 5.591733
      LE Set Extended Scan Response Data (0x08|0x0038) ncmd 1
        Status: Success (0x00)
< HCI Command: LE Set Extended Adve.. (0x08|0x0039) plen 6  #47 [hci1] 5.611240
        Extended advertising: Enabled (0x01)
        Number of sets: 1 (0x01)
        Entry 0
          Handle: 0x00
          Duration: 0 ms (0x00)
          Max ext adv events: 0
> HCI Event: Command Complete (0x0e) plen 4                 #48 [hci1] 5.611938
      LE Set Extended Advertising Enable (0x08|0x0039) ncmd 1
        Status: Success (0x00)
> HCI Event: LE Meta Event (0x3e) plen 31                   #49 [hci1] 6.250665
      LE Enhanced Connection Complete (0x0a)
        Status: Success (0x00)
        Handle: 3009
        Role: Peripheral (0x01)
        Peer address type: Public (0x00)
        Peer address: DF:A9:FF:F6:B1:1A (OUI DF-A9-FF)
        Local resolvable private address: 00:00:00:00:00:00 (Non-Resolvable)
        Peer resolvable private address: 00:00:00:00:00:00 (Non-Resolvable)
        Connection interval: 87.50 msec (0x0046)
        Connection latency: 0 (0x0000)
        Supervision timeout: 20000 msec (0x07d0)
        Central clock accuracy: 0x01
> HCI Event: LE Meta Event (0x3e) plen 6                    #50 [hci1] 6.250755
      LE Advertising Set Terminated (0x12)
        Status: Success (0x00)
        Handle: 0
        Connection handle: 3009
        Number of completed extended advertising events: 0
< HCI Command: LE Read Remote Used... (0x08|0x0016) plen 2  #51 [hci1] 6.251542
        Handle: 3009 Address: DF:A9:FF:F6:B1:1A (OUI DF-A9-FF)
> HCI Event: Command Status (0x0f) plen 4                   #52 [hci1] 6.252040
      LE Read Remote Used Features (0x08|0x0016) ncmd 1
        Status: Success (0x00)
> HCI Event: LE Meta Event (0x3e) plen 12                   #53 [hci1] 6.514517
      LE Read Remote Used Features (0x04)
        Status: Success (0x00)
        Handle: 3009 Address: DF:A9:FF:F6:B1:1A (OUI DF-A9-FF)
        Features: 0x2d 0x49 0x00 0xf7 0x67 0xd9 0x00 0x80
          LE Encryption
          Extended Reject Indication
          Peripheral-initiated Features Exchange
          LE Data Packet Length Extension
          LE 2M PHY
          LE Coded PHY
          Channel Selection Algorithm #2
          Periodic Advertising Sync Transfer - Sender
          Periodic Advertising Sync Transfer - Recipient
          Sleep Clock Accuracy Updates
          Connected Isochronous Stream - Central
          Connected Isochronous Stream - Peripheral
          Isochronous Broadcaster
          Synchronized Receiver
          Connected Isochronous Stream (Host Support)
          LE Power Control Request
          LE Power Control Request
          Connection Subrating
          Connection Subrating (Host Support)
          Unknown features (0x8000d90000000000)
> ACL Data RX: Handle 3009 flags 0x02 dlen 11               #54 [hci1] 7.476838
      ATT: Read By Type Request (0x08) len 6
        Handle range: 0x0001-0xffff
        Attribute type: Characteristic (0x2803)
< HCI Command: Host Number of Compl.. (0x03|0x0035) plen 5  #55 [hci1] 7.491689
        Num handles: 1
        Handle: 3009 Address: DF:A9:FF:F6:B1:1A (OUI DF-A9-FF)
        Count: 1
< ACL Data TX: Handle 3009 flags 0x00 dlen 20               #56 [hci1] 7.491766
      ATT: Read By Type Response (0x09) len 15
        Attribute data length: 7
        Attribute data list: 2 entries
        Handle: 0x0002
        Value: 200300052a
            Properties: 0x20
              Indicate (0x20)
            Value Handle: 0x0003
            Value UUID: Service Changed (0x2a05)
        Handle: 0x0005
        Value: 0a0600292b
            Properties: 0x0a
              Read (0x02)
              Write (0x08)
            Value Handle: 0x0006
            Value UUID: Client Supported Features (0x2b29)
> HCI Event: Number of Completed Packets (0x13) plen 5      #57 [hci1] 7.651824
        Num handles: 1
        Handle: 3009 Address: DF:A9:FF:F6:B1:1A (OUI DF-A9-FF)
        Count: 1
        #56: len 20 (1 Kb/s)
        Latency: 160 msec (160-160 msec ~160 msec)
> ACL Data RX: Handle 3009 flags 0x02 dlen 11               #58 [hci1] 7.651995
      ATT: Read By Type Request (0x08) len 6
        Handle range: 0x0006-0xffff
        Attribute type: Characteristic (0x2803)
< HCI Command: Host Number of Compl.. (0x03|0x0035) plen 5  #59 [hci1] 7.671925
        Num handles: 1
        Handle: 3009 Address: DF:A9:FF:F6:B1:1A (OUI DF-A9-FF)
        Count: 1
< ACL Data TX: Handle 3009 flags 0x00 dlen 20               #60 [hci1] 7.672019
      ATT: Read By Type Response (0x09) len 15
        Attribute data length: 7
        Attribute data list: 2 entries
        Handle: 0x0007
        Value: 0208002a2b
            Properties: 0x02
              Read (0x02)
            Value Handle: 0x0008
            Value UUID: Database Hash (0x2b2a)
        Handle: 0x0009
        Value: 020a003a2b
            Properties: 0x02
              Read (0x02)
            Value Handle: 0x000a
            Value UUID: Server Supported Features (0x2b3a)
> HCI Event: Number of Completed Packets (0x13) plen 5      #61 [hci1] 7.826908
        Num handles: 1
        Handle: 3009 Address: DF:A9:FF:F6:B1:1A (OUI DF-A9-FF)
        Count: 1
        #60: len 20 (1 Kb/s)
        Latency: 154 msec (154-160 msec ~157 msec)
> ACL Data RX: Handle 3009 flags 0x02 dlen 11               #62 [hci1] 7.827006
      ATT: Read By Type Request (0x08) len 6
        Handle range: 0x000a-0xffff
        Attribute type: Characteristic (0x2803)
< HCI Command: Host Number of Compl.. (0x03|0x0035) plen 5  #63 [hci1] 7.831418
        Num handles: 1
        Handle: 3009 Address: DF:A9:FF:F6:B1:1A (OUI DF-A9-FF)
        Count: 1
< ACL Data TX: Handle 3009 flags 0x00 dlen 20               #64 [hci1] 7.831437
      ATT: Read By Type Response (0x09) len 15
        Attribute data length: 7
        Attribute data list: 2 entries
        Handle: 0x000c
        Value: 0a0d00002a
            Properties: 0x0a
              Read (0x02)
              Write (0x08)
            Value Handle: 0x000d
            Value UUID: Device Name (0x2a00)
        Handle: 0x000e
        Value: 0a0f00012a
            Properties: 0x0a
              Read (0x02)
              Write (0x08)
            Value Handle: 0x000f
            Value UUID: Appearance (0x2a01)
> HCI Event: Number of Completed Packets (0x13) plen 5      #65 [hci1] 8.001650
        Num handles: 1
        Handle: 3009 Address: DF:A9:FF:F6:B1:1A (OUI DF-A9-FF)
        Count: 1
        #64: len 20 (0 Kb/s)
        Latency: 170 msec (154-170 msec ~163 msec)
> ACL Data RX: Handle 3009 flags 0x02 dlen 11               #66 [hci1] 8.002104
      ATT: Read By Type Request (0x08) len 6
        Handle range: 0x000f-0xffff
        Attribute type: Characteristic (0x2803)
< HCI Command: Host Number of Compl.. (0x03|0x0035) plen 5  #67 [hci1] 8.011335
        Num handles: 1
        Handle: 3009 Address: DF:A9:FF:F6:B1:1A (OUI DF-A9-FF)
        Count: 1
< ACL Data TX: Handle 3009 flags 0x00 dlen 20               #68 [hci1] 8.011359
      ATT: Read By Type Response (0x09) len 15
        Attribute data length: 7
        Attribute data list: 2 entries
        Handle: 0x0010
        Value: 021100042a
            Properties: 0x02
              Read (0x02)
            Value Handle: 0x0011
            Value UUID: Peripheral Preferred Connection Parameters (0x2a04)
        Handle: 0x0013
        Value: 021400242a
            Properties: 0x02
              Read (0x02)
            Value Handle: 0x0014
            Value UUID: Model Number String (0x2a24)
> HCI Event: Number of Completed Packets (0x13) plen 5      #69 [hci1] 8.176807
        Num handles: 1
        Handle: 3009 Address: DF:A9:FF:F6:B1:1A (OUI DF-A9-FF)
        Count: 1
        #68: len 20 (0 Kb/s)
        Latency: 165 msec (154-170 msec ~164 msec)
> ACL Data RX: Handle 3009 flags 0x02 dlen 11               #70 [hci1] 8.176884
      ATT: Read By Type Request (0x08) len 6
        Handle range: 0x0014-0xffff
        Attribute type: Characteristic (0x2803)
< HCI Command: Host Number of Compl.. (0x03|0x0035) plen 5  #71 [hci1] 8.191824
        Num handles: 1
        Handle: 3009 Address: DF:A9:FF:F6:B1:1A (OUI DF-A9-FF)
        Count: 1
< ACL Data TX: Handle 3009 flags 0x00 dlen 20               #72 [hci1] 8.191916
      ATT: Read By Type Response (0x09) len 15
        Attribute data length: 7
        Attribute data list: 2 entries
        Handle: 0x0015
        Value: 021600292a
            Properties: 0x02
              Read (0x02)
            Value Handle: 0x0016
            Value UUID: Manufacturer Name String (0x2a29)
        Handle: 0x0017
        Value: 021800502a
            Properties: 0x02
              Read (0x02)
            Value Handle: 0x0018
            Value UUID: PnP ID (0x2a50)
> HCI Event: Number of Completed Packets (0x13) plen 5      #73 [hci1] 8.351818
        Num handles: 1
        Handle: 3009 Address: DF:A9:FF:F6:B1:1A (OUI DF-A9-FF)
        Count: 1
        #72: len 20 (1 Kb/s)
        Latency: 159 msec (154-170 msec ~162 msec)
> ACL Data RX: Handle 3009 flags 0x02 dlen 11               #74 [hci1] 8.351961
      ATT: Read By Type Request (0x08) len 6
        Handle range: 0x0018-0xffff
        Attribute type: Characteristic (0x2803)
< HCI Command: Host Number of Compl.. (0x03|0x0035) plen 5  #75 [hci1] 8.371486
        Num handles: 1
        Handle: 3009 Address: DF:A9:FF:F6:B1:1A (OUI DF-A9-FF)
        Count: 1
< ACL Data TX: Handle 3009 flags 0x00 dlen 20               #76 [hci1] 8.371574
      ATT: Read By Type Response (0x09) len 15
        Attribute data length: 7
        Attribute data list: 2 entries
        Handle: 0x0019
        Value: 021a00252a
            Properties: 0x02
              Read (0x02)
            Value Handle: 0x001a
            Value UUID: Serial Number String (0x2a25)
        Handle: 0x001b
        Value: 021c00262a
            Properties: 0x02
              Read (0x02)
            Value Handle: 0x001c
            Value UUID: Firmware Revision String (0x2a26)
> HCI Event: Number of Completed Packets (0x13) plen 5      #77 [hci1] 8.526811
        Num handles: 1
        Handle: 3009 Address: DF:A9:FF:F6:B1:1A (OUI DF-A9-FF)
        Count: 1
        #76: len 20 (1 Kb/s)
        Latency: 155 msec (154-170 msec ~158 msec)
> ACL Data RX: Handle 3009 flags 0x02 dlen 11               #78 [hci1] 8.526997
      ATT: Read By Type Request (0x08) len 6
        Handle range: 0x001c-0xffff
        Attribute type: Characteristic (0x2803)
< HCI Command: Host Number of Compl.. (0x03|0x0035) plen 5  #79 [hci1] 8.531839
        Num handles: 1
        Handle: 3009 Address: DF:A9:FF:F6:B1:1A (OUI DF-A9-FF)
        Count: 1
< ACL Data TX: Handle 3009 flags 0x00 dlen 20               #80 [hci1] 8.531937
      ATT: Read By Type Response (0x09) len 15
        Attribute data length: 7
        Attribute data list: 2 entries
        Handle: 0x001d
        Value: 021e00272a
            Properties: 0x02
              Read (0x02)
            Value Handle: 0x001e
            Value UUID: Hardware Revision String (0x2a27)
        Handle: 0x001f
        Value: 022000282a
            Properties: 0x02
              Read (0x02)
            Value Handle: 0x0020
            Value UUID: Software Revision String (0x2a28)
> HCI Event: Number of Completed Packets (0x13) plen 5      #81 [hci1] 8.701676
        Num handles: 1
        Handle: 3009 Address: DF:A9:FF:F6:B1:1A (OUI DF-A9-FF)
        Count: 1
        #80: len 20 (0 Kb/s)
        Latency: 169 msec (154-170 msec ~164 msec)
> ACL Data RX: Handle 3009 flags 0x02 dlen 11               #82 [hci1] 8.701870
      ATT: Read By Type Request (0x08) len 6
        Handle range: 0x0020-0xffff
        Attribute type: Characteristic (0x2803)
< HCI Command: Host Number of Compl.. (0x03|0x0035) plen 5  #83 [hci1] 8.711831
        Num handles: 1
        Handle: 3009 Address: DF:A9:FF:F6:B1:1A (OUI DF-A9-FF)
        Count: 1
< ACL Data TX: Handle 3009 flags 0x00 dlen 20               #84 [hci1] 8.711908
      ATT: Read By Type Response (0x09) len 15
        Attribute data length: 7
        Attribute data list: 2 entries
        Handle: 0x0021
        Value: 022200ff2b
            Properties: 0x02
              Read (0x02)
            Value Handle: 0x0022
            Value UUID: Unknown (0x2bff)
        Handle: 0x0023
        Value: 022400232a
            Properties: 0x02
              Read (0x02)
            Value Handle: 0x0024
            Value UUID: System ID (0x2a23)
> HCI Event: Number of Completed Packets (0x13) plen 5      #85 [hci1] 8.876803
        Num handles: 1
        Handle: 3009 Address: DF:A9:FF:F6:B1:1A (OUI DF-A9-FF)
        Count: 1
        #84: len 20 (0 Kb/s)
        Latency: 164 msec (154-170 msec ~164 msec)
> ACL Data RX: Handle 3009 flags 0x02 dlen 11               #86 [hci1] 8.876920
      ATT: Read By Type Request (0x08) len 6
        Handle range: 0x0024-0xffff
        Attribute type: Characteristic (0x2803)
< HCI Command: Host Number of Compl.. (0x03|0x0035) plen 5  #87 [hci1] 8.891569
        Num handles: 1
        Handle: 3009 Address: DF:A9:FF:F6:B1:1A (OUI DF-A9-FF)
        Count: 1
< ACL Data TX: Handle 3009 flags 0x00 dlen 13               #88 [hci1] 8.891625
      ATT: Read By Type Response (0x09) len 8
        Attribute data length: 7
        Attribute data list: 1 entry
        Handle: 0x0025
        Value: 0226002a2a
            Properties: 0x02
              Read (0x02)
            Value Handle: 0x0026
            Value UUID: IEEE 11073-20601 Regulatory Cert. Data List (0x2a2a)
> HCI Event: Number of Completed Packets (0x13) plen 5      #89 [hci1] 9.051756
        Num handles: 1
        Handle: 3009 Address: DF:A9:FF:F6:B1:1A (OUI DF-A9-FF)
        Count: 1
        #88: len 13 (0 Kb/s)
        Latency: 160 msec (154-170 msec ~162 msec)
> ACL Data RX: Handle 3009 flags 0x02 dlen 11               #90 [hci1] 9.051901
      ATT: Read By Type Request (0x08) len 6
        Handle range: 0x0026-0xffff
        Attribute type: Characteristic (0x2803)
< HCI Command: Host Number of Compl.. (0x03|0x0035) plen 5  #91 [hci1] 9.071462
        Num handles: 1
        Handle: 3009 Address: DF:A9:FF:F6:B1:1A (OUI DF-A9-FF)
        Count: 1
< ACL Data TX: Handle 3009 flags 0x00 dlen 9                #92 [hci1] 9.071562
      ATT: Error Response (0x01) len 4
        Read By Type Request (0x08)
        Handle: 0x0026
        Error: Attribute Not Found (0x0a)
> HCI Event: Number of Completed Packets (0x13) plen 5      #93 [hci1] 9.226644
        Num handles: 1
        Handle: 3009 Address: DF:A9:FF:F6:B1:1A (OUI DF-A9-FF)
        Count: 1
        #92: len 9 (0 Kb/s)
        Latency: 155 msec (154-170 msec ~158 msec)
> ACL Data RX: Handle 3009 flags 0x02 dlen 7                #94 [hci1] 9.226864
      ATT: Read Request (0x0a) len 2
        Handle: 0x000a
< HCI Command: Host Number of Compl.. (0x03|0x0035) plen 5  #95 [hci1] 9.231971
        Num handles: 1
        Handle: 3009 Address: DF:A9:FF:F6:B1:1A (OUI DF-A9-FF)
        Count: 1
< ACL Data TX: Handle 3009 flags 0x00 dlen 6                #96 [hci1] 9.232056
      ATT: Read Response (0x0b) len 1
> HCI Event: Number of Completed Packets (0x13) plen 5      #97 [hci1] 9.401818
        Num handles: 1
        Handle: 3009 Address: DF:A9:FF:F6:B1:1A (OUI DF-A9-FF)
        Count: 1
        #96: len 6 (0 Kb/s)
        Latency: 169 msec (154-170 msec ~164 msec)
> ACL Data RX: Handle 3009 flags 0x02 dlen 11               #98 [hci1] 9.401932
      ATT: Read By Type Request (0x08) len 6
        Handle range: 0x0001-0xffff
        Attribute type: Characteristic (0x2803)
< HCI Command: Host Number of Compl.. (0x03|0x0035) plen 5  #99 [hci1] 9.411491
        Num handles: 1
        Handle: 3009 Address: DF:A9:FF:F6:B1:1A (OUI DF-A9-FF)
        Count: 1
< ACL Data TX: Handle 3009 flags 0x00 dlen 20              #100 [hci1] 9.411558
      ATT: Read By Type Response (0x09) len 15
        Attribute data length: 7
        Attribute data list: 2 entries
        Handle: 0x0002
        Value: 200300052a
            Properties: 0x20
              Indicate (0x20)
            Value Handle: 0x0003
            Value UUID: Service Changed (0x2a05)
        Handle: 0x0005
        Value: 0a0600292b
            Properties: 0x0a
              Read (0x02)
              Write (0x08)
            Value Handle: 0x0006
            Value UUID: Client Supported Features (0x2b29)
> HCI Event: Number of Completed Packets (0x13) plen 5     #101 [hci1] 9.576697
        Num handles: 1
        Handle: 3009 Address: DF:A9:FF:F6:B1:1A (OUI DF-A9-FF)
        Count: 1
        #100: len 20 (0 Kb/s)
        Latency: 165 msec (154-170 msec ~164 msec)
> ACL Data RX: Handle 3009 flags 0x02 dlen 11              #102 [hci1] 9.577017
      ATT: Read By Type Request (0x08) len 6
        Handle range: 0x0006-0xffff
        Attribute type: Characteristic (0x2803)
< HCI Command: Host Number of Comp.. (0x03|0x0035) plen 5  #103 [hci1] 9.591392
        Num handles: 1
        Handle: 3009 Address: DF:A9:FF:F6:B1:1A (OUI DF-A9-FF)
        Count: 1
< ACL Data TX: Handle 3009 flags 0x00 dlen 20              #104 [hci1] 9.591442
      ATT: Read By Type Response (0x09) len 15
        Attribute data length: 7
        Attribute data list: 2 entries
        Handle: 0x0007
        Value: 0208002a2b
            Properties: 0x02
              Read (0x02)
            Value Handle: 0x0008
            Value UUID: Database Hash (0x2b2a)
        Handle: 0x0009
        Value: 020a003a2b
            Properties: 0x02
              Read (0x02)
            Value Handle: 0x000a
            Value UUID: Server Supported Features (0x2b3a)
> HCI Event: Number of Completed Packets (0x13) plen 5     #105 [hci1] 9.751694
        Num handles: 1
        Handle: 3009 Address: DF:A9:FF:F6:B1:1A (OUI DF-A9-FF)
        Count: 1
        #104: len 20 (1 Kb/s)
        Latency: 160 msec (154-170 msec ~162 msec)
> ACL Data RX: Handle 3009 flags 0x02 dlen 11              #106 [hci1] 9.751789
      ATT: Read By Type Request (0x08) len 6
        Handle range: 0x000a-0xffff
        Attribute type: Characteristic (0x2803)
< HCI Command: Host Number of Comp.. (0x03|0x0035) plen 5  #107 [hci1] 9.771353
        Num handles: 1
        Handle: 3009 Address: DF:A9:FF:F6:B1:1A (OUI DF-A9-FF)
        Count: 1
< ACL Data TX: Handle 3009 flags 0x00 dlen 20              #108 [hci1] 9.771362
      ATT: Read By Type Response (0x09) len 15
        Attribute data length: 7
        Attribute data list: 2 entries
        Handle: 0x000c
        Value: 0a0d00002a
            Properties: 0x0a
              Read (0x02)
              Write (0x08)
            Value Handle: 0x000d
            Value UUID: Device Name (0x2a00)
        Handle: 0x000e
        Value: 0a0f00012a
            Properties: 0x0a
              Read (0x02)
              Write (0x08)
            Value Handle: 0x000f
            Value UUID: Appearance (0x2a01)
> HCI Event: Number of Completed Packets (0x13) plen 5     #109 [hci1] 9.926573
        Num handles: 1
        Handle: 3009 Address: DF:A9:FF:F6:B1:1A (OUI DF-A9-FF)
        Count: 1
        #108: len 20 (1 Kb/s)
        Latency: 155 msec (154-170 msec ~158 msec)
> ACL Data RX: Handle 3009 flags 0x02 dlen 11              #110 [hci1] 9.926827
      ATT: Read By Type Request (0x08) len 6
        Handle range: 0x000f-0xffff
        Attribute type: Characteristic (0x2803)
< HCI Command: Host Number of Comp.. (0x03|0x0035) plen 5  #111 [hci1] 9.931408
        Num handles: 1
        Handle: 3009 Address: DF:A9:FF:F6:B1:1A (OUI DF-A9-FF)
        Count: 1
< ACL Data TX: Handle 3009 flags 0x00 dlen 20              #112 [hci1] 9.931418
      ATT: Read By Type Response (0x09) len 15
        Attribute data length: 7
        Attribute data list: 2 entries
        Handle: 0x0010
        Value: 021100042a
            Properties: 0x02
              Read (0x02)
            Value Handle: 0x0011
            Value UUID: Peripheral Preferred Connection Parameters (0x2a04)
        Handle: 0x0013
        Value: 021400242a
            Properties: 0x02
              Read (0x02)
            Value Handle: 0x0014
            Value UUID: Model Number String (0x2a24)
> HCI Event: Number of Completed Packets (0x13) plen 5    #113 [hci1] 10.101651
        Num handles: 1
        Handle: 3009 Address: DF:A9:FF:F6:B1:1A (OUI DF-A9-FF)
        Count: 1
        #112: len 20 (0 Kb/s)
        Latency: 170 msec (154-170 msec ~164 msec)
> ACL Data RX: Handle 3009 flags 0x02 dlen 11             #114 [hci1] 10.101842
      ATT: Read By Type Request (0x08) len 6
        Handle range: 0x0014-0xffff
        Attribute type: Characteristic (0x2803)
< HCI Command: Host Number of Com.. (0x03|0x0035) plen 5  #115 [hci1] 10.112466
        Num handles: 1
        Handle: 3009 Address: DF:A9:FF:F6:B1:1A (OUI DF-A9-FF)
        Count: 1
< ACL Data TX: Handle 3009 flags 0x00 dlen 20             #116 [hci1] 10.112492
      ATT: Read By Type Response (0x09) len 15
        Attribute data length: 7
        Attribute data list: 2 entries
        Handle: 0x0015
        Value: 021600292a
            Properties: 0x02
              Read (0x02)
            Value Handle: 0x0016
            Value UUID: Manufacturer Name String (0x2a29)
        Handle: 0x0017
        Value: 021800502a
            Properties: 0x02
              Read (0x02)
            Value Handle: 0x0018
            Value UUID: PnP ID (0x2a50)
> HCI Event: Number of Completed Packets (0x13) plen 5    #117 [hci1] 10.276889
        Num handles: 1
        Handle: 3009 Address: DF:A9:FF:F6:B1:1A (OUI DF-A9-FF)
        Count: 1
        #116: len 20 (0 Kb/s)
        Latency: 164 msec (154-170 msec ~164 msec)
> ACL Data RX: Handle 3009 flags 0x02 dlen 11             #118 [hci1] 10.277012
      ATT: Read By Type Request (0x08) len 6
        Handle range: 0x0018-0xffff
        Attribute type: Characteristic (0x2803)
< HCI Command: Host Number of Com.. (0x03|0x0035) plen 5  #119 [hci1] 10.291958
        Num handles: 1
        Handle: 3009 Address: DF:A9:FF:F6:B1:1A (OUI DF-A9-FF)
        Count: 1
< ACL Data TX: Handle 3009 flags 0x00 dlen 20             #120 [hci1] 10.292050
      ATT: Read By Type Response (0x09) len 15
        Attribute data length: 7
        Attribute data list: 2 entries
        Handle: 0x0019
        Value: 021a00252a
            Properties: 0x02
              Read (0x02)
            Value Handle: 0x001a
            Value UUID: Serial Number String (0x2a25)
        Handle: 0x001b
        Value: 021c00262a
            Properties: 0x02
              Read (0x02)
            Value Handle: 0x001c
            Value UUID: Firmware Revision String (0x2a26)
> HCI Event: Number of Completed Packets (0x13) plen 5    #121 [hci1] 10.451601
        Num handles: 1
        Handle: 3009 Address: DF:A9:FF:F6:B1:1A (OUI DF-A9-FF)
        Count: 1
        #120: len 20 (1 Kb/s)
        Latency: 159 msec (154-170 msec ~162 msec)
> ACL Data RX: Handle 3009 flags 0x02 dlen 11             #122 [hci1] 10.451985
      ATT: Read By Type Request (0x08) len 6
        Handle range: 0x001c-0xffff
        Attribute type: Characteristic (0x2803)
< HCI Command: Host Number of Com.. (0x03|0x0035) plen 5  #123 [hci1] 10.471364
        Num handles: 1
        Handle: 3009 Address: DF:A9:FF:F6:B1:1A (OUI DF-A9-FF)
        Count: 1
< ACL Data TX: Handle 3009 flags 0x00 dlen 20             #124 [hci1] 10.471375
      ATT: Read By Type Response (0x09) len 15
        Attribute data length: 7
        Attribute data list: 2 entries
        Handle: 0x001d
        Value: 021e00272a
            Properties: 0x02
              Read (0x02)
            Value Handle: 0x001e
            Value UUID: Hardware Revision String (0x2a27)
        Handle: 0x001f
        Value: 022000282a
            Properties: 0x02
              Read (0x02)
            Value Handle: 0x0020
            Value UUID: Software Revision String (0x2a28)
> HCI Event: Number of Completed Packets (0x13) plen 5    #125 [hci1] 10.626637
        Num handles: 1
        Handle: 3009 Address: DF:A9:FF:F6:B1:1A (OUI DF-A9-FF)
        Count: 1
        #124: len 20 (1 Kb/s)
        Latency: 155 msec (154-170 msec ~158 msec)
> ACL Data RX: Handle 3009 flags 0x02 dlen 11             #126 [hci1] 10.626819
      ATT: Read By Type Request (0x08) len 6
        Handle range: 0x0020-0xffff
        Attribute type: Characteristic (0x2803)
< HCI Command: Host Number of Com.. (0x03|0x0035) plen 5  #127 [hci1] 10.631519
        Num handles: 1
        Handle: 3009 Address: DF:A9:FF:F6:B1:1A (OUI DF-A9-FF)
        Count: 1
< ACL Data TX: Handle 3009 flags 0x00 dlen 20             #128 [hci1] 10.631556
      ATT: Read By Type Response (0x09) len 15
        Attribute data length: 7
        Attribute data list: 2 entries
        Handle: 0x0021
        Value: 022200ff2b
            Properties: 0x02
              Read (0x02)
            Value Handle: 0x0022
            Value UUID: Unknown (0x2bff)
        Handle: 0x0023
        Value: 022400232a
            Properties: 0x02
              Read (0x02)
            Value Handle: 0x0024
            Value UUID: System ID (0x2a23)
> HCI Event: Number of Completed Packets (0x13) plen 5    #129 [hci1] 10.801667
        Num handles: 1
        Handle: 3009 Address: DF:A9:FF:F6:B1:1A (OUI DF-A9-FF)
        Count: 1
        #128: len 20 (0 Kb/s)
        Latency: 170 msec (154-170 msec ~164 msec)
> ACL Data RX: Handle 3009 flags 0x02 dlen 11             #130 [hci1] 10.801987
      ATT: Read By Type Request (0x08) len 6
        Handle range: 0x0024-0xffff
        Attribute type: Characteristic (0x2803)
< HCI Command: Host Number of Com.. (0x03|0x0035) plen 5  #131 [hci1] 10.811948
        Num handles: 1
        Handle: 3009 Address: DF:A9:FF:F6:B1:1A (OUI DF-A9-FF)
        Count: 1
< ACL Data TX: Handle 3009 flags 0x00 dlen 13             #132 [hci1] 10.812042
      ATT: Read By Type Response (0x09) len 8
        Attribute data length: 7
        Attribute data list: 1 entry
        Handle: 0x0025
        Value: 0226002a2a
            Properties: 0x02
              Read (0x02)
            Value Handle: 0x0026
            Value UUID: IEEE 11073-20601 Regulatory Cert. Data List (0x2a2a)
> HCI Event: Number of Completed Packets (0x13) plen 5    #133 [hci1] 10.976619
        Num handles: 1
        Handle: 3009 Address: DF:A9:FF:F6:B1:1A (OUI DF-A9-FF)
        Count: 1
        #132: len 13 (0 Kb/s)
        Latency: 164 msec (154-170 msec ~164 msec)
> ACL Data RX: Handle 3009 flags 0x02 dlen 11             #134 [hci1] 10.976895
      ATT: Read By Type Request (0x08) len 6
        Handle range: 0x0026-0xffff
        Attribute type: Characteristic (0x2803)
< HCI Command: Host Number of Com.. (0x03|0x0035) plen 5  #135 [hci1] 10.991517
        Num handles: 1
        Handle: 3009 Address: DF:A9:FF:F6:B1:1A (OUI DF-A9-FF)
        Count: 1
< ACL Data TX: Handle 3009 flags 0x00 dlen 9              #136 [hci1] 10.991631
      ATT: Error Response (0x01) len 4
        Read By Type Request (0x08)
        Handle: 0x0026
        Error: Attribute Not Found (0x0a)
> HCI Event: Number of Completed Packets (0x13) plen 5    #137 [hci1] 11.151663
        Num handles: 1
        Handle: 3009 Address: DF:A9:FF:F6:B1:1A (OUI DF-A9-FF)
        Count: 1
        #136: len 9 (0 Kb/s)
        Latency: 160 msec (154-170 msec ~162 msec)
> ACL Data RX: Handle 3009 flags 0x02 dlen 7              #138 [hci1] 11.151850
      ATT: Read Request (0x0a) len 2
        Handle: 0x0006
< HCI Command: Host Number of Com.. (0x03|0x0035) plen 5  #139 [hci1] 11.171424
        Num handles: 1
        Handle: 3009 Address: DF:A9:FF:F6:B1:1A (OUI DF-A9-FF)
        Count: 1
< ACL Data TX: Handle 3009 flags 0x00 dlen 6              #140 [hci1] 11.171458
      ATT: Read Response (0x0b) len 1
< ACL Data TX: Handle 3009 flags 0x00 dlen 16             #141 [hci1] 11.261541
      LE L2CAP: Connection Parameter Update Request (0x12) ident 1 len 8
        Min interval: 24
        Max interval: 40
        Peripheral latency: 0
        Timeout multiplier: 42
> HCI Event: Number of Completed Packets (0x13) plen 5    #142 [hci1] 11.326735
        Num handles: 1
        Handle: 3009 Address: DF:A9:FF:F6:B1:1A (OUI DF-A9-FF)
        Count: 1
        #140: len 6 (0 Kb/s)
        Latency: 155 msec (154-170 msec ~158 msec)
> ACL Data RX: Handle 3009 flags 0x02 dlen 8              #143 [hci1] 11.326743
      ATT: Write Request (0x12) len 3
        Handle: 0x0006
          Data: 02
< HCI Command: Host Number of Com.. (0x03|0x0035) plen 5  #144 [hci1] 11.331902
        Num handles: 1
        Handle: 3009 Address: DF:A9:FF:F6:B1:1A (OUI DF-A9-FF)
        Count: 1
< ACL Data TX: Handle 3009 flags 0x00 dlen 5              #145 [hci1] 11.331972
      ATT: Write Response (0x13) len 0
> HCI Event: Number of Completed Packets (0x13) plen 5    #146 [hci1] 11.414170
        Num handles: 1
        Handle: 3009 Address: DF:A9:FF:F6:B1:1A (OUI DF-A9-FF)
        Count: 1
        #141: len 16 (0 Kb/s)
        Latency: 152 msec (152-170 msec ~155 msec)
> ACL Data RX: Handle 3009 flags 0x02 dlen 10             #147 [hci1] 11.414291
      LE L2CAP: Connection Parameter Update Response (0x13) ident 1 len 2
        Result: Connection Parameters accepted (0x0000)
< HCI Command: Host Number of Com.. (0x03|0x0035) plen 5  #148 [hci1] 11.431557
        Num handles: 1
        Handle: 3009 Address: DF:A9:FF:F6:B1:1A (OUI DF-A9-FF)
        Count: 1
> HCI Event: Number of Completed Packets (0x13) plen 5    #149 [hci1] 11.501604
        Num handles: 1
        Handle: 3009 Address: DF:A9:FF:F6:B1:1A (OUI DF-A9-FF)
        Count: 1
        #145: len 5 (0 Kb/s)
        Latency: 169 msec (152-170 msec ~162 msec)
> ACL Data RX: Handle 3009 flags 0x02 dlen 11             #150 [hci1] 14.039193
      SMP: Pairing Request (0x01) len 6
        IO capability: KeyboardDisplay (0x04)
        OOB data: Authentication data not present (0x00)
        Authentication requirement: Bonding, No MITM, SC, No Keypresses (0x09)
        Max encryption key size: 16
        Initiator key distribution: EncKey IdKey Sign (0x07)
        Responder key distribution: EncKey IdKey Sign (0x07)
< HCI Command: Host Number of Com.. (0x03|0x0035) plen 5  #151 [hci1] 14.051481
        Num handles: 1
        Handle: 3009 Address: DF:A9:FF:F6:B1:1A (OUI DF-A9-FF)
        Count: 1
< ACL Data TX: Handle 3009 flags 0x00 dlen 11             #152 [hci1] 14.051541
      SMP: Pairing Response (0x02) len 6
        IO capability: DisplayOnly (0x00)
        OOB data: Authentication data not present (0x00)
        Authentication requirement: Bonding, No MITM, SC, No Keypresses (0x09)
        Max encryption key size: 16
        Initiator key distribution: IdKey (0x02)
        Responder key distribution: <none> (0x00)
> HCI Event: Number of Completed Packets (0x13) plen 5    #153 [hci1] 14.214314
        Num handles: 1
        Handle: 3009 Address: DF:A9:FF:F6:B1:1A (OUI DF-A9-FF)
        Count: 1
        #152: len 11 (0 Kb/s)
        Latency: 162 msec (152-170 msec ~162 msec)
> ACL Data RX: Handle 3009 flags 0x02 dlen 27             #154 [hci1] 14.214583
> ACL Data RX: Handle 3009 flags 0x01 dlen 27             #155 [hci1] 14.215076
> ACL Data RX: Handle 3009 flags 0x01 dlen 15             #156 [hci1] 14.215498
      SMP: Pairing Public Key (0x0c) len 64
        X: 1a09125ea733e9ea177e86b353b1bfd28e7219f313c7117e53ba8a8535637929
        Y: b315c62f0b05aab8ad1c1d3748901871d0295a261516be0b65b0aed803b4310c
< HCI Command: Host Number of Com.. (0x03|0x0035) plen 5  #157 [hci1] 14.232184
        Num handles: 1
        Handle: 3009 Address: DF:A9:FF:F6:B1:1A (OUI DF-A9-FF)
        Count: 1
< HCI Command: Host Number of Com.. (0x03|0x0035) plen 5  #158 [hci1] 14.232351
        Num handles: 1
        Handle: 3009 Address: DF:A9:FF:F6:B1:1A (OUI DF-A9-FF)
        Count: 1
< HCI Command: Host Number of Com.. (0x03|0x0035) plen 5  #159 [hci1] 14.232664
        Num handles: 1
        Handle: 3009 Address: DF:A9:FF:F6:B1:1A (OUI DF-A9-FF)
        Count: 1
< ACL Data TX: Handle 3009 flags 0x00 dlen 27             #160 [hci1] 14.232718
< ACL Data TX: Handle 3009 flags 0x01 dlen 27             #161 [hci1] 14.232833
< ACL Data TX: Handle 3009 flags 0x01 dlen 15             #162 [hci1] 14.232844
      SMP: Pairing Public Key (0x0c) len 64
        X: 98308440221e2d910f0e54b71e7ec652857aa9b5a0dc65028824cc19db1226e9
        Y: 67a4816bcb62efb21701e31fdb27561a6217575fb007a8bbdabe7e28b6f68482
> HCI Event: Number of Completed Packets (0x13) plen 5    #163 [hci1] 14.302085
        Num handles: 1
        Handle: 3009 Address: DF:A9:FF:F6:B1:1A (OUI DF-A9-FF)
        Count: 1
        #160: len 27 (3 Kb/s)
        Latency: 69 msec (69-170 msec ~116 msec)
> HCI Event: Number of Completed Packets (0x13) plen 5    #164 [hci1] 14.302721
        Num handles: 1
        Handle: 3009 Address: DF:A9:FF:F6:B1:1A (OUI DF-A9-FF)
        Count: 1
        #161: len 27 (3 Kb/s)
        Latency: 69 msec (69-170 msec ~92 msec)
< ACL Data TX: Handle 3009 flags 0x00 dlen 21             #165 [hci1] 14.311647
      SMP: Pairing Confirm (0x03) len 16
        Confim value: 388b918457cd3141e77cbc0ecba0244c
> HCI Event: Number of Completed Packets (0x13) plen 5    #166 [hci1] 14.389019
        Num handles: 1
        Handle: 3009 Address: DF:A9:FF:F6:B1:1A (OUI DF-A9-FF)
        Count: 1
        #162: len 15 (0 Kb/s)
        Latency: 156 msec (69-170 msec ~124 msec)
> HCI Event: Number of Completed Packets (0x13) plen 5    #167 [hci1] 14.476664
        Num handles: 1
        Handle: 3009 Address: DF:A9:FF:F6:B1:1A (OUI DF-A9-FF)
        Count: 1
        #165: len 21 (1 Kb/s)
        Latency: 165 msec (69-170 msec ~144 msec)
> ACL Data RX: Handle 3009 flags 0x02 dlen 21             #168 [hci1] 14.477009
      SMP: Pairing Random (0x04) len 16
        Random value: 90810f97631bb3d10000000000000000
< HCI Command: Host Number of Com.. (0x03|0x0035) plen 5  #169 [hci1] 14.491392
        Num handles: 1
        Handle: 3009 Address: DF:A9:FF:F6:B1:1A (OUI DF-A9-FF)
        Count: 1
< ACL Data TX: Handle 3009 flags 0x00 dlen 21             #170 [hci1] 14.491439
      SMP: Pairing Random (0x04) len 16
        Random value: 8e6108f966a694cbe26df70bb96773e6
> HCI Event: Number of Completed Packets (0x13) plen 5    #171 [hci1] 14.651674
        Num handles: 1
        Handle: 3009 Address: DF:A9:FF:F6:B1:1A (OUI DF-A9-FF)
        Count: 1
        #170: len 21 (1 Kb/s)
        Latency: 160 msec (69-170 msec ~152 msec)
> ACL Data RX: Handle 3009 flags 0x02 dlen 21             #172 [hci1] 14.826861
      SMP: Pairing DHKey Check (0x0d) len 16
        E: 28c8119339f4e03589e3f897c84777e1
< HCI Command: Host Number of Com.. (0x03|0x0035) plen 5  #173 [hci1] 14.832109
        Num handles: 1
        Handle: 3009 Address: DF:A9:FF:F6:B1:1A (OUI DF-A9-FF)
        Count: 1
< ACL Data TX: Handle 3009 flags 0x00 dlen 21             #174 [hci1] 14.832205
      SMP: Pairing DHKey Check (0x0d) len 16
        E: 1a414824418301bcb768878015ce4ea2
> HCI Event: Number of Completed Packets (0x13) plen 5    #175 [hci1] 15.001524
        Num handles: 1
        Handle: 3009 Address: DF:A9:FF:F6:B1:1A (OUI DF-A9-FF)
        Count: 1
        #174: len 21 (0 Kb/s)
        Latency: 169 msec (69-170 msec ~160 msec)
> HCI Event: LE Meta Event (0x3e) plen 13                 #176 [hci1] 15.089566
      LE Long Term Key Request (0x05)
        Handle: 3009 Address: DF:A9:FF:F6:B1:1A (OUI DF-A9-FF)
        Random number: 0x0000000000000000
        Encrypted diversifier: 0x0000
< HCI Command: LE Long Term Key... (0x08|0x001a) plen 18  #177 [hci1] 15.091673
        Handle: 3009 Address: DF:A9:FF:F6:B1:1A (OUI DF-A9-FF)
        Long term key: a4d3ba08ed3695d773e6a1409ab066fb
> HCI Event: Command Complete (0x0e) plen 6               #178 [hci1] 15.092486
      LE Long Term Key Request Reply (0x08|0x001a) ncmd 1
        Status: Success (0x00)
        Handle: 3009 Address: DF:A9:FF:F6:B1:1A (OUI DF-A9-FF)
> HCI Event: Encryption Change (0x08) plen 4              #179 [hci1] 15.526710
        Status: Success (0x00)
        Handle: 3009 Address: DF:A9:FF:F6:B1:1A (OUI DF-A9-FF)
        Encryption: Enabled with AES-CCM (0x01)
> ACL Data RX: Handle 3009 flags 0x02 dlen 21             #180 [hci1] 15.614441
      SMP: Identity Information (0x08) len 16
        Identity resolving key: e318880071fc75b1385d6facce4cd22b
< ACL Data TX: Handle 3009 flags 0x00 dlen 11             #181 [hci1] 15.641518
      ATT: Read By Type Request (0x08) len 6
        Handle range: 0x0001-0xffff
        Attribute type: Central Address Resolution (0x2aa6)
< HCI Command: Host Number of Com.. (0x03|0x0035) plen 5  #182 [hci1] 15.641627
        Num handles: 1
        Handle: 3009 Address: DF:A9:FF:F6:B1:1A (OUI DF-A9-FF)
        Count: 1
> ACL Data RX: Handle 3009 flags 0x02 dlen 12             #183 [hci1] 15.701786
      SMP: Identity Address Information (0x09) len 7
        Address: DF:A9:FF:F6:B1:1A (OUI DF-A9-FF)
> HCI Event: Number of Completed Packets (0x13) plen 5    #184 [hci1] 15.702630
        Num handles: 1
        Handle: 3009 Address: DF:A9:FF:F6:B1:1A (OUI DF-A9-FF)
        Count: 1
        #181: len 11 (1 Kb/s)
        Latency: 61 msec (61-170 msec ~111 msec)
> ACL Data RX: Handle 3009 flags 0x02 dlen 26             #185 [hci1] 15.702714
      LE L2CAP: Enhanced Credit Connection Request (0x17) ident 1 len 18
        PSM: 39 (0x0027)
        MTU: 64
        MPS: 64
        Credits: 5
        Source CID: 84
        Source CID: 83
        Source CID: 82
        Source CID: 81
        Source CID: 80
< HCI Command: LE Add Device To... (0x08|0x0027) plen 39  #186 [hci1] 15.711370
        Address type: Public (0x00)
        Address: DF:A9:FF:F6:B1:1A (OUI DF-A9-FF)
        Peer identity resolving key: e318880071fc75b1385d6facce4cd22b
        Local identity resolving key: 00000000000000000000000000000000
> HCI Event: Command Complete (0x0e) plen 4               #187 [hci1] 15.712355
      LE Add Device To Resolving List (0x08|0x0027) ncmd 1
        Status: Success (0x00)
< HCI Command: LE Set Privacy Mode (0x08|0x004e) plen 8   #188 [hci1] 15.731353
        Peer Identity address type: Public (0x00)
        Peer Identity address: DF:A9:FF:F6:B1:1A (OUI DF-A9-FF)
        Privacy Mode: Use Device Privacy (0x01)
> HCI Event: Command Complete (0x0e) plen 4               #189 [hci1] 15.732009
      LE Set Privacy Mode (0x08|0x004e) ncmd 1
        Status: Success (0x00)
< HCI Command: LE Set Address Res.. (0x08|0x002d) plen 1  #190 [hci1] 15.751473
        Address resolution: Enabled (0x01)
> HCI Event: Command Complete (0x0e) plen 4               #191 [hci1] 15.751923
      LE Set Address Resolution Enable (0x08|0x002d) ncmd 1
        Status: Success (0x00)
< HCI Command: Host Number of Com.. (0x03|0x0035) plen 5  #192 [hci1] 15.771387
        Num handles: 1
        Handle: 3009 Address: DF:A9:FF:F6:B1:1A (OUI DF-A9-FF)
        Count: 1
< HCI Command: Host Number of Com.. (0x03|0x0035) plen 5  #193 [hci1] 15.771542
        Num handles: 1
        Handle: 3009 Address: DF:A9:FF:F6:B1:1A (OUI DF-A9-FF)
        Count: 1
< ACL Data TX: Handle 3009 flags 0x00 dlen 26             #194 [hci1] 15.771611
      LE L2CAP: Enhanced Credit Connection Response (0x18) ident 1 len 18
        MTU: 249
        MPS: 251
        Credits: 1
        Result: Connection successful (0x0000)
        Destination CID: 64
        Destination CID: 65
        Destination CID: 66
        Destination CID: 67
        Destination CID: 68
> ACL Data RX: Handle 3009 flags 0x02 dlen 9              #195 [hci1] 15.789118
      ATT: Error Response (0x01) len 4
        Read By Type Request (0x08)
        Handle: 0x0001
        Error: Attribute Not Found (0x0a)
< HCI Command: Host Number of Com.. (0x03|0x0035) plen 5  #196 [hci1] 15.791507
        Num handles: 1
        Handle: 3009 Address: DF:A9:FF:F6:B1:1A (OUI DF-A9-FF)
        Count: 1
> HCI Event: Number of Completed Packets (0x13) plen 5    #197 [hci1] 15.876562
        Num handles: 1
        Handle: 3009 Address: DF:A9:FF:F6:B1:1A (OUI DF-A9-FF)
        Count: 1
        #194: len 26 (2 Kb/s)
        Latency: 104 msec (61-170 msec ~107 msec)
> ACL Data RX: Handle 3009 flags 0x02 dlen 15             #198 [hci1] 17.801758
      Channel: 68 len 11 sdu 9 [PSM 39 mode Enhanced Credit (0x81)] {chan 4}
      ATT: Find By Type Value Request (0x06) len 8
        Handle range: 0x0001-0xffff
        Attribute type: Primary Service (0x2800)
          UUID: Generic Attribute Profile (0x1801)
< HCI Command: Host Number of Com.. (0x03|0x0035) plen 5  #199 [hci1] 17.811676
        Num handles: 1
        Handle: 3009 Address: DF:A9:FF:F6:B1:1A (OUI DF-A9-FF)
        Count: 1
< ACL Data TX: Handle 3009 flags 0x00 dlen 11             #200 [hci1] 17.811796
      Channel: 80 len 7 sdu 5 [PSM 39 mode Enhanced Credit (0x81)] {chan 4}
      ATT: Find By Type Value Response (0x07) len 4
        Handle range: 0x0001-0x000a
< ACL Data TX: Handle 3009 flags 0x00 dlen 12             #201 [hci1] 17.811963
      LE L2CAP: LE Flow Control Credit (0x16) ident 2 len 4
        Source CID: 68
        Credits: 1
> HCI Event: Number of Completed Packets (0x13) plen 5    #202 [hci1] 17.889441
        Num handles: 1
        Handle: 3009 Address: DF:A9:FF:F6:B1:1A (OUI DF-A9-FF)
        Count: 1
        #200: len 11 (1 Kb/s)
        Latency: 77 msec (61-170 msec ~92 msec)
        Channel: 80 [PSM 39 mode Enhanced Credit (0x81)] {chan 4}
        Channel Latency: 77 msec (77-77 msec ~77 msec)
> HCI Event: Number of Completed Packets (0x13) plen 5    #203 [hci1] 17.976623
        Num handles: 1
        Handle: 3009 Address: DF:A9:FF:F6:B1:1A (OUI DF-A9-FF)
        Count: 1
        #201: len 12 (0 Kb/s)
        Latency: 164 msec (61-170 msec ~128 msec)
        Channel: 80 [PSM 39 mode Enhanced Credit (0x81)] {chan 4}
        Channel Latency: 164 msec (77-164 msec ~121 msec)
> ACL Data RX: Handle 3009 flags 0x02 dlen 15             #204 [hci1] 17.976972
      Channel: 68 len 11 sdu 9 [PSM 39 mode Enhanced Credit (0x81)] {chan 4}
      ATT: Find By Type Value Request (0x06) len 8
        Handle range: 0x000b-0xffff
        Attribute type: Primary Service (0x2800)
          UUID: Generic Attribute Profile (0x1801)
< HCI Command: Host Number of Com.. (0x03|0x0035) plen 5  #205 [hci1] 17.991929
        Num handles: 1
        Handle: 3009 Address: DF:A9:FF:F6:B1:1A (OUI DF-A9-FF)
        Count: 1
< ACL Data TX: Handle 3009 flags 0x00 dlen 11             #206 [hci1] 17.992089
      Channel: 80 len 7 sdu 5 [PSM 39 mode Enhanced Credit (0x81)] {chan 4}
      ATT: Error Response (0x01) len 4
        Find By Type Value Request (0x06)
        Handle: 0x000b
        Error: Attribute Not Found (0x0a)
< ACL Data TX: Handle 3009 flags 0x00 dlen 12             #207 [hci1] 17.992238
      LE L2CAP: LE Flow Control Credit (0x16) ident 3 len 4
        Source CID: 68
        Credits: 1
> HCI Event: Number of Completed Packets (0x13) plen 5    #208 [hci1] 18.064468
        Num handles: 1
        Handle: 3009 Address: DF:A9:FF:F6:B1:1A (OUI DF-A9-FF)
        Count: 1
        #206: len 11 (1 Kb/s)
        Latency: 72 msec (61-170 msec ~100 msec)
> HCI Event: Number of Completed Packets (0x13) plen 5    #209 [hci1] 18.151637
        Num handles: 1
        Handle: 3009 Address: DF:A9:FF:F6:B1:1A (OUI DF-A9-FF)
        Count: 1
        #207: len 12 (0 Kb/s)
        Latency: 159 msec (61-170 msec ~129 msec)
        Channel: 80 [PSM 39 mode Enhanced Credit (0x81)] {chan 4}
        Channel Latency: 159 msec (77-164 msec ~140 msec)
> ACL Data RX: Handle 3009 flags 0x02 dlen 13             #210 [hci1] 18.151862
      Channel: 68 len 9 sdu 7 [PSM 39 mode Enhanced Credit (0x81)] {chan 4}
      ATT: Read By Type Request (0x08) len 6
        Handle range: 0x0001-0x000a
        Attribute type: Characteristic (0x2803)
< HCI Command: Host Number of Com.. (0x03|0x0035) plen 5  #211 [hci1] 18.171718
        Num handles: 1
        Handle: 3009 Address: DF:A9:FF:F6:B1:1A (OUI DF-A9-FF)
        Count: 1
< ACL Data TX: Handle 3009 flags 0x00 dlen 27             #212 [hci1] 18.171767
< ACL Data TX: Handle 3009 flags 0x01 dlen 9              #213 [hci1] 18.171782
      Channel: 80 len 32 sdu 30 [PSM 39 mode Enhanced Credit (0x81)] {chan 4}
      ATT: Read By Type Response (0x09) len 29
        Attribute data length: 7
        Attribute data list: 4 entries
        Handle: 0x0002
        Value: 200300052a
            Properties: 0x20
              Indicate (0x20)
            Value Handle: 0x0003
            Value UUID: Service Changed (0x2a05)
        Handle: 0x0005
        Value: 0a0600292b
            Properties: 0x0a
              Read (0x02)
              Write (0x08)
            Value Handle: 0x0006
            Value UUID: Client Supported Features (0x2b29)
        Handle: 0x0007
        Value: 0208002a2b
            Properties: 0x02
              Read (0x02)
            Value Handle: 0x0008
            Value UUID: Database Hash (0x2b2a)
        Handle: 0x0009
        Value: 020a003a2b
            Properties: 0x02
              Read (0x02)
            Value Handle: 0x000a
            Value UUID: Server Supported Features (0x2b3a)
< ACL Data TX: Handle 3009 flags 0x00 dlen 12             #214 [hci1] 18.171937
      LE L2CAP: LE Flow Control Credit (0x16) ident 4 len 4
        Source CID: 68
        Credits: 1
> HCI Event: Number of Completed Packets (0x13) plen 5    #215 [hci1] 18.239693
        Num handles: 1
        Handle: 3009 Address: DF:A9:FF:F6:B1:1A (OUI DF-A9-FF)
        Count: 1
        #212: len 27 (3 Kb/s)
        Latency: 67 msec (61-170 msec ~98 msec)
        Channel: 80 [PSM 39 mode Enhanced Credit (0x81)] {chan 4}
        Channel Latency: 67 msec (67-164 msec ~104 msec)
> HCI Event: Number of Completed Packets (0x13) plen 5    #216 [hci1] 18.240276
        Num handles: 1
        Handle: 3009 Address: DF:A9:FF:F6:B1:1A (OUI DF-A9-FF)
        Count: 1
        #213: len 9 (1 Kb/s)
        Latency: 68 msec (61-170 msec ~83 msec)
> HCI Event: Number of Completed Packets (0x13) plen 5    #217 [hci1] 18.326608
        Num handles: 1
        Handle: 3009 Address: DF:A9:FF:F6:B1:1A (OUI DF-A9-FF)
        Count: 1
        #214: len 12 (0 Kb/s)
        Latency: 154 msec (61-170 msec ~119 msec)
        Channel: 80 [PSM 39 mode Enhanced Credit (0x81)] {chan 4}
        Channel Latency: 154 msec (67-164 msec ~129 msec)
> ACL Data RX: Handle 3009 flags 0x02 dlen 13             #218 [hci1] 18.326815
      Channel: 68 len 9 sdu 7 [PSM 39 mode Enhanced Credit (0x81)] {chan 4}
      ATT: Read By Type Request (0x08) len 6
        Handle range: 0x000a-0x000a
        Attribute type: Characteristic (0x2803)
< HCI Command: Host Number of Com.. (0x03|0x0035) plen 5  #219 [hci1] 18.331619
        Num handles: 1
        Handle: 3009 Address: DF:A9:FF:F6:B1:1A (OUI DF-A9-FF)
        Count: 1
< ACL Data TX: Handle 3009 flags 0x00 dlen 11             #220 [hci1] 18.331734
      Channel: 80 len 7 sdu 5 [PSM 39 mode Enhanced Credit (0x81)] {chan 4}
      ATT: Error Response (0x01) len 4
        Read By Type Request (0x08)
        Handle: 0x000a
        Error: Attribute Not Found (0x0a)
< ACL Data TX: Handle 3009 flags 0x00 dlen 12             #221 [hci1] 18.331860
      LE L2CAP: LE Flow Control Credit (0x16) ident 5 len 4
        Source CID: 68
        Credits: 1
> HCI Event: Number of Completed Packets (0x13) plen 5    #222 [hci1] 18.414563
        Num handles: 1
        Handle: 3009 Address: DF:A9:FF:F6:B1:1A (OUI DF-A9-FF)
        Count: 1
        #220: len 11 (1 Kb/s)
        Latency: 82 msec (61-170 msec ~101 msec)
        Channel: 80 [PSM 39 mode Enhanced Credit (0x81)] {chan 4}
        Channel Latency: 82 msec (67-164 msec ~106 msec)
> HCI Event: Number of Completed Packets (0x13) plen 5    #223 [hci1] 18.501576
        Num handles: 1
        Handle: 3009 Address: DF:A9:FF:F6:B1:1A (OUI DF-A9-FF)
        Count: 1
        #221: len 12 (0 Kb/s)
        Latency: 169 msec (61-170 msec ~135 msec)
> ACL Data RX: Handle 3009 flags 0x02 dlen 12             #224 [hci1] 18.501819
      LE L2CAP: LE Flow Control Credit (0x16) ident 2 len 4
        Source CID: 80
        Credits: 10
> ACL Data RX: Handle 3009 flags 0x02 dlen 15             #225 [hci1] 18.502237
      Channel: 68 len 11 sdu 9 [PSM 39 mode Enhanced Credit (0x81)] {chan 4}
      ATT: Find By Type Value Request (0x06) len 8
        Handle range: 0x0001-0xffff
        Attribute type: Primary Service (0x2800)
          UUID: Generic Attribute Profile (0x1801)
< HCI Command: Host Number of Com.. (0x03|0x0035) plen 5  #226 [hci1] 18.512006
        Num handles: 1
        Handle: 3009 Address: DF:A9:FF:F6:B1:1A (OUI DF-A9-FF)
        Count: 1
< HCI Command: Host Number of Com.. (0x03|0x0035) plen 5  #227 [hci1] 18.512310
        Num handles: 1
        Handle: 3009 Address: DF:A9:FF:F6:B1:1A (OUI DF-A9-FF)
        Count: 1
< ACL Data TX: Handle 3009 flags 0x00 dlen 11             #228 [hci1] 18.512360
      Channel: 80 len 7 sdu 5 [PSM 39 mode Enhanced Credit (0x81)] {chan 4}
      ATT: Find By Type Value Response (0x07) len 4
        Handle range: 0x0001-0x000a
< ACL Data TX: Handle 3009 flags 0x00 dlen 12             #229 [hci1] 18.512632
      LE L2CAP: LE Flow Control Credit (0x16) ident 6 len 4
        Source CID: 68
        Credits: 1
> HCI Event: Number of Completed Packets (0x13) plen 5    #230 [hci1] 18.589529
        Num handles: 1
        Handle: 3009 Address: DF:A9:FF:F6:B1:1A (OUI DF-A9-FF)
        Count: 1
        #228: len 11 (1 Kb/s)
        Latency: 77 msec (61-170 msec ~106 msec)
        Channel: 80 [PSM 39 mode Enhanced Credit (0x81)] {chan 4}
        Channel Latency: 77 msec (67-164 msec ~91 msec)
> HCI Event: Number of Completed Packets (0x13) plen 5    #231 [hci1] 18.676622
        Num handles: 1
        Handle: 3009 Address: DF:A9:FF:F6:B1:1A (OUI DF-A9-FF)
        Count: 1
        #229: len 12 (0 Kb/s)
        Latency: 163 msec (61-170 msec ~135 msec)
        Channel: 80 [PSM 39 mode Enhanced Credit (0x81)] {chan 4}
        Channel Latency: 163 msec (67-164 msec ~127 msec)
> ACL Data RX: Handle 3009 flags 0x02 dlen 15             #232 [hci1] 18.676811
      Channel: 68 len 11 sdu 9 [PSM 39 mode Enhanced Credit (0x81)] {chan 4}
      ATT: Find By Type Value Request (0x06) len 8
        Handle range: 0x000b-0xffff
        Attribute type: Primary Service (0x2800)
          UUID: Generic Attribute Profile (0x1801)
< HCI Command: Host Number of Com.. (0x03|0x0035) plen 5  #233 [hci1] 18.691806
        Num handles: 1
        Handle: 3009 Address: DF:A9:FF:F6:B1:1A (OUI DF-A9-FF)
        Count: 1
< ACL Data TX: Handle 3009 flags 0x00 dlen 11             #234 [hci1] 18.691930
      Channel: 80 len 7 sdu 5 [PSM 39 mode Enhanced Credit (0x81)] {chan 4}
      ATT: Error Response (0x01) len 4
        Find By Type Value Request (0x06)
        Handle: 0x000b
        Error: Attribute Not Found (0x0a)
< ACL Data TX: Handle 3009 flags 0x00 dlen 12             #235 [hci1] 18.692063
      LE L2CAP: LE Flow Control Credit (0x16) ident 7 len 4
        Source CID: 68
        Credits: 1
> HCI Event: Number of Completed Packets (0x13) plen 5    #236 [hci1] 18.764448
        Num handles: 1
        Handle: 3009 Address: DF:A9:FF:F6:B1:1A (OUI DF-A9-FF)
        Count: 1
        #234: len 11 (1 Kb/s)
        Latency: 72 msec (61-170 msec ~103 msec)
> HCI Event: Number of Completed Packets (0x13) plen 5    #237 [hci1] 18.851655
        Num handles: 1
        Handle: 3009 Address: DF:A9:FF:F6:B1:1A (OUI DF-A9-FF)
        Count: 1
        #235: len 12 (0 Kb/s)
        Latency: 159 msec (61-170 msec ~131 msec)
        Channel: 80 [PSM 39 mode Enhanced Credit (0x81)] {chan 4}
        Channel Latency: 159 msec (67-164 msec ~143 msec)
> ACL Data RX: Handle 3009 flags 0x02 dlen 13             #238 [hci1] 18.851856
      Channel: 68 len 9 sdu 7 [PSM 39 mode Enhanced Credit (0x81)] {chan 4}
      ATT: Read By Type Request (0x08) len 6
        Handle range: 0x0001-0x000a
        Attribute type: Characteristic (0x2803)
< HCI Command: Host Number of Com.. (0x03|0x0035) plen 5  #239 [hci1] 18.872031
        Num handles: 1
        Handle: 3009 Address: DF:A9:FF:F6:B1:1A (OUI DF-A9-FF)
        Count: 1
< ACL Data TX: Handle 3009 flags 0x00 dlen 27             #240 [hci1] 18.872128
< ACL Data TX: Handle 3009 flags 0x01 dlen 9              #241 [hci1] 18.872139
      Channel: 80 len 32 sdu 30 [PSM 39 mode Enhanced Credit (0x81)] {chan 4}
      ATT: Read By Type Response (0x09) len 29
        Attribute data length: 7
        Attribute data list: 4 entries
        Handle: 0x0002
        Value: 200300052a
            Properties: 0x20
              Indicate (0x20)
            Value Handle: 0x0003
            Value UUID: Service Changed (0x2a05)
        Handle: 0x0005
        Value: 0a0600292b
            Properties: 0x0a
              Read (0x02)
              Write (0x08)
            Value Handle: 0x0006
            Value UUID: Client Supported Features (0x2b29)
        Handle: 0x0007
        Value: 0208002a2b
            Properties: 0x02
              Read (0x02)
            Value Handle: 0x0008
            Value UUID: Database Hash (0x2b2a)
        Handle: 0x0009
        Value: 020a003a2b
            Properties: 0x02
              Read (0x02)
            Value Handle: 0x000a
            Value UUID: Server Supported Features (0x2b3a)
< ACL Data TX: Handle 3009 flags 0x00 dlen 12             #242 [hci1] 18.872390
      LE L2CAP: LE Flow Control Credit (0x16) ident 8 len 4
        Source CID: 68
        Credits: 1
> HCI Event: Number of Completed Packets (0x13) plen 5    #243 [hci1] 18.939550
        Num handles: 1
        Handle: 3009 Address: DF:A9:FF:F6:B1:1A (OUI DF-A9-FF)
        Count: 1
        #240: len 27 (3 Kb/s)
        Latency: 67 msec (61-170 msec ~99 msec)
        Channel: 80 [PSM 39 mode Enhanced Credit (0x81)] {chan 4}
        Channel Latency: 67 msec (67-164 msec ~105 msec)
> HCI Event: Number of Completed Packets (0x13) plen 5    #244 [hci1] 18.940231
        Num handles: 1
        Handle: 3009 Address: DF:A9:FF:F6:B1:1A (OUI DF-A9-FF)
        Count: 1
        #241: len 9 (1 Kb/s)
        Latency: 68 msec (61-170 msec ~83 msec)
> HCI Event: Number of Completed Packets (0x13) plen 5    #245 [hci1] 19.026626
        Num handles: 1
        Handle: 3009 Address: DF:A9:FF:F6:B1:1A (OUI DF-A9-FF)
        Count: 1
        #242: len 12 (0 Kb/s)
        Latency: 154 msec (61-170 msec ~119 msec)
        Channel: 80 [PSM 39 mode Enhanced Credit (0x81)] {chan 4}
        Channel Latency: 154 msec (67-164 msec ~129 msec)
> ACL Data RX: Handle 3009 flags 0x02 dlen 13             #246 [hci1] 19.026914
      Channel: 68 len 9 sdu 7 [PSM 39 mode Enhanced Credit (0x81)] {chan 4}
      ATT: Read By Type Request (0x08) len 6
        Handle range: 0x000a-0x000a
        Attribute type: Characteristic (0x2803)
< HCI Command: Host Number of Com.. (0x03|0x0035) plen 5  #247 [hci1] 19.032074
        Num handles: 1
        Handle: 3009 Address: DF:A9:FF:F6:B1:1A (OUI DF-A9-FF)
        Count: 1
< ACL Data TX: Handle 3009 flags 0x00 dlen 11             #248 [hci1] 19.032245
      Channel: 80 len 7 sdu 5 [PSM 39 mode Enhanced Credit (0x81)] {chan 4}
      ATT: Error Response (0x01) len 4
        Read By Type Request (0x08)
        Handle: 0x000a
        Error: Attribute Not Found (0x0a)
< ACL Data TX: Handle 3009 flags 0x00 dlen 12             #249 [hci1] 19.032360
      LE L2CAP: LE Flow Control Credit (0x16) ident 9 len 4
        Source CID: 68
        Credits: 1
> HCI Event: Number of Completed Packets (0x13) plen 5    #250 [hci1] 19.114613
        Num handles: 1
        Handle: 3009 Address: DF:A9:FF:F6:B1:1A (OUI DF-A9-FF)
        Count: 1
        #248: len 11 (1 Kb/s)
        Latency: 82 msec (61-170 msec ~100 msec)
        Channel: 80 [PSM 39 mode Enhanced Credit (0x81)] {chan 4}
        Channel Latency: 82 msec (67-164 msec ~106 msec)
> HCI Event: Number of Completed Packets (0x13) plen 5    #251 [hci1] 19.201702
        Num handles: 1
        Handle: 3009 Address: DF:A9:FF:F6:B1:1A (OUI DF-A9-FF)
        Count: 1
        #249: len 12 (0 Kb/s)
        Latency: 169 msec (61-170 msec ~135 msec)
> ACL Data RX: Handle 3009 flags 0x02 dlen 11             #252 [hci1] 19.201775
      Channel: 68 len 7 sdu 5 [PSM 39 mode Enhanced Credit (0x81)] {chan 4}
      ATT: Find Information Request (0x04) len 4
        Handle range: 0x0002-0x000a
< HCI Command: Host Number of Com.. (0x03|0x0035) plen 5  #253 [hci1] 19.211633
        Num handles: 1
        Handle: 3009 Address: DF:A9:FF:F6:B1:1A (OUI DF-A9-FF)
        Count: 1
< ACL Data TX: Handle 3009 flags 0x00 dlen 27             #254 [hci1] 19.211683
< ACL Data TX: Handle 3009 flags 0x01 dlen 17             #255 [hci1] 19.211699
      Channel: 80 len 40 sdu 38 [PSM 39 mode Enhanced Credit (0x81)] {chan 4}
      ATT: Find Information Response (0x05) len 37
        Format: UUID-16 (0x01)
        Handle: 0x0002
        UUID: Characteristic (0x2803)
        Handle: 0x0003
        UUID: Service Changed (0x2a05)
        Handle: 0x0004
        UUID: Client Characteristic Configuration (0x2902)
        Handle: 0x0005
        UUID: Characteristic (0x2803)
        Handle: 0x0006
        UUID: Client Supported Features (0x2b29)
        Handle: 0x0007
        UUID: Characteristic (0x2803)
        Handle: 0x0008
        UUID: Database Hash (0x2b2a)
        Handle: 0x0009
        UUID: Characteristic (0x2803)
        Handle: 0x000a
        UUID: Server Supported Features (0x2b3a)
< ACL Data TX: Handle 3009 flags 0x00 dlen 12             #256 [hci1] 19.211763
      LE L2CAP: LE Flow Control Credit (0x16) ident 10 len 4
        Source CID: 68
        Credits: 1
> HCI Event: Number of Completed Packets (0x13) plen 5    #257 [hci1] 19.289610
        Num handles: 1
        Handle: 3009 Address: DF:A9:FF:F6:B1:1A (OUI DF-A9-FF)
        Count: 1
        #254: len 27 (2 Kb/s)
        Latency: 77 msec (61-170 msec ~106 msec)
        Channel: 80 [PSM 39 mode Enhanced Credit (0x81)] {chan 4}
        Channel Latency: 77 msec (67-164 msec ~92 msec)
> HCI Event: Number of Completed Packets (0x13) plen 5    #258 [hci1] 19.290256
        Num handles: 1
        Handle: 3009 Address: DF:A9:FF:F6:B1:1A (OUI DF-A9-FF)
        Count: 1
        #255: len 17 (1 Kb/s)
        Latency: 78 msec (61-170 msec ~92 msec)
        Channel: 80 [PSM 39 mode Enhanced Credit (0x81)] {chan 4}
        Channel Latency: 78 msec (67-164 msec ~85 msec)
> HCI Event: Number of Completed Packets (0x13) plen 5    #259 [hci1] 19.376567
        Num handles: 1
        Handle: 3009 Address: DF:A9:FF:F6:B1:1A (OUI DF-A9-FF)
        Count: 1
        #256: len 12 (0 Kb/s)
        Latency: 164 msec (61-170 msec ~128 msec)
> ACL Data RX: Handle 3009 flags 0x02 dlen 11             #260 [hci1] 19.376794
      Channel: 68 len 7 sdu 5 [PSM 39 mode Enhanced Credit (0x81)] {chan 4}
      ATT: Write Request (0x12) len 4
        Handle: 0x0004
          Data: 0000
< HCI Command: Host Number of Com.. (0x03|0x0035) plen 5  #261 [hci1] 19.392055
        Num handles: 1
        Handle: 3009 Address: DF:A9:FF:F6:B1:1A (OUI DF-A9-FF)
        Count: 1
< ACL Data TX: Handle 3009 flags 0x00 dlen 7              #262 [hci1] 19.392133
      Channel: 80 len 3 sdu 1 [PSM 39 mode Enhanced Credit (0x81)] {chan 4}
      ATT: Write Response (0x13) len 0
< ACL Data TX: Handle 3009 flags 0x00 dlen 12             #263 [hci1] 19.392361
      LE L2CAP: LE Flow Control Credit (0x16) ident 11 len 4
        Source CID: 68
        Credits: 1
> HCI Event: Number of Completed Packets (0x13) plen 5    #264 [hci1] 19.464510
        Num handles: 1
        Handle: 3009 Address: DF:A9:FF:F6:B1:1A (OUI DF-A9-FF)
        Count: 1
        #262: len 7 (0 Kb/s)
        Latency: 72 msec (61-170 msec ~100 msec)
        Channel: 80 [PSM 39 mode Enhanced Credit (0x81)] {chan 4}
        Channel Latency: 72 msec (67-164 msec ~78 msec)
> HCI Event: Number of Completed Packets (0x13) plen 5    #265 [hci1] 19.551478
        Num handles: 1
        Handle: 3009 Address: DF:A9:FF:F6:B1:1A (OUI DF-A9-FF)
        Count: 1
        #263: len 12 (0 Kb/s)
        Latency: 159 msec (61-170 msec ~129 msec)
        Channel: 80 [PSM 39 mode Enhanced Credit (0x81)] {chan 4}
        Channel Latency: 159 msec (67-164 msec ~118 msec)
> ACL Data RX: Handle 3009 flags 0x02 dlen 15             #266 [hci1] 29.351535
      Channel: 68 len 11 sdu 9 [PSM 39 mode Enhanced Credit (0x81)] {chan 4}
      ATT: Find By Type Value Request (0x06) len 8
        Handle range: 0x0001-0xffff
        Attribute type: Primary Service (0x2800)
          UUID: Generic Attribute Profile (0x1801)
< HCI Command: Host Number of Com.. (0x03|0x0035) plen 5  #267 [hci1] 29.352131
        Num handles: 1
        Handle: 3009 Address: DF:A9:FF:F6:B1:1A (OUI DF-A9-FF)
        Count: 1
< ACL Data TX: Handle 3009 flags 0x00 dlen 11             #268 [hci1] 29.352244
      Channel: 80 len 7 sdu 5 [PSM 39 mode Enhanced Credit (0x81)] {chan 4}
      ATT: Find By Type Value Response (0x07) len 4
        Handle range: 0x0001-0x000a
< ACL Data TX: Handle 3009 flags 0x00 dlen 12             #269 [hci1] 29.352314
      LE L2CAP: LE Flow Control Credit (0x16) ident 12 len 4
        Source CID: 68
        Credits: 1
> HCI Event: Number of Completed Packets (0x13) plen 5    #270 [hci1] 29.439273
        Num handles: 1
        Handle: 3009 Address: DF:A9:FF:F6:B1:1A (OUI DF-A9-FF)
        Count: 1
        #268: len 11 (1 Kb/s)
        Latency: 87 msec (61-170 msec ~108 msec)
> HCI Event: Number of Completed Packets (0x13) plen 5    #271 [hci1] 29.526470
        Num handles: 1
        Handle: 3009 Address: DF:A9:FF:F6:B1:1A (OUI DF-A9-FF)
        Count: 1
        #269: len 12 (0 Kb/s)
        Latency: 174 msec (61-174 msec ~141 msec)
        Channel: 80 [PSM 39 mode Enhanced Credit (0x81)] {chan 4}
        Channel Latency: 174 msec (67-174 msec ~146 msec)
> ACL Data RX: Handle 3009 flags 0x02 dlen 15             #272 [hci1] 29.526781
      Channel: 68 len 11 sdu 9 [PSM 39 mode Enhanced Credit (0x81)] {chan 4}
      ATT: Find By Type Value Request (0x06) len 8
        Handle range: 0x000b-0xffff
        Attribute type: Primary Service (0x2800)
          UUID: Generic Attribute Profile (0x1801)
< HCI Command: Host Number of Com.. (0x03|0x0035) plen 5  #273 [hci1] 29.532224
        Num handles: 1
        Handle: 3009 Address: DF:A9:FF:F6:B1:1A (OUI DF-A9-FF)
        Count: 1
< ACL Data TX: Handle 3009 flags 0x00 dlen 11             #274 [hci1] 29.532348
      Channel: 80 len 7 sdu 5 [PSM 39 mode Enhanced Credit (0x81)] {chan 4}
      ATT: Error Response (0x01) len 4
        Find By Type Value Request (0x06)
        Handle: 0x000b
        Error: Attribute Not Found (0x0a)
< ACL Data TX: Handle 3009 flags 0x00 dlen 12             #275 [hci1] 29.532617
      LE L2CAP: LE Flow Control Credit (0x16) ident 13 len 4
        Source CID: 68
        Credits: 1
> HCI Event: Number of Completed Packets (0x13) plen 5    #276 [hci1] 29.614283
        Num handles: 1
        Handle: 3009 Address: DF:A9:FF:F6:B1:1A (OUI DF-A9-FF)
        Count: 1
        #274: len 11 (1 Kb/s)
        Latency: 81 msec (61-174 msec ~111 msec)
        Channel: 80 [PSM 39 mode Enhanced Credit (0x81)] {chan 4}
        Channel Latency: 81 msec (67-174 msec ~114 msec)
> HCI Event: Number of Completed Packets (0x13) plen 5    #277 [hci1] 29.701556
        Num handles: 1
        Handle: 3009 Address: DF:A9:FF:F6:B1:1A (OUI DF-A9-FF)
        Count: 1
        #275: len 12 (0 Kb/s)
        Latency: 168 msec (61-174 msec ~140 msec)
> ACL Data RX: Handle 3009 flags 0x02 dlen 13             #278 [hci1] 29.701696
      Channel: 68 len 9 sdu 7 [PSM 39 mode Enhanced Credit (0x81)] {chan 4}
      ATT: Read By Type Request (0x08) len 6
        Handle range: 0x0001-0x000a
        Attribute type: Characteristic (0x2803)
< HCI Command: Host Number of Com.. (0x03|0x0035) plen 5  #279 [hci1] 29.712019
        Num handles: 1
        Handle: 3009 Address: DF:A9:FF:F6:B1:1A (OUI DF-A9-FF)
        Count: 1
< ACL Data TX: Handle 3009 flags 0x00 dlen 27             #280 [hci1] 29.712083
< ACL Data TX: Handle 3009 flags 0x01 dlen 9              #281 [hci1] 29.712090
      Channel: 80 len 32 sdu 30 [PSM 39 mode Enhanced Credit (0x81)] {chan 4}
      ATT: Read By Type Response (0x09) len 29
        Attribute data length: 7
        Attribute data list: 4 entries
        Handle: 0x0002
        Value: 200300052a
            Properties: 0x20
              Indicate (0x20)
            Value Handle: 0x0003
            Value UUID: Service Changed (0x2a05)
        Handle: 0x0005
        Value: 0a0600292b
            Properties: 0x0a
              Read (0x02)
              Write (0x08)
            Value Handle: 0x0006
            Value UUID: Client Supported Features (0x2b29)
        Handle: 0x0007
        Value: 0208002a2b
            Properties: 0x02
              Read (0x02)
            Value Handle: 0x0008
            Value UUID: Database Hash (0x2b2a)
        Handle: 0x0009
        Value: 020a003a2b
            Properties: 0x02
              Read (0x02)
            Value Handle: 0x000a
            Value UUID: Server Supported Features (0x2b3a)
< ACL Data TX: Handle 3009 flags 0x00 dlen 12             #282 [hci1] 29.712288
      LE L2CAP: LE Flow Control Credit (0x16) ident 14 len 4
        Source CID: 68
        Credits: 1
> HCI Event: Number of Completed Packets (0x13) plen 5    #283 [hci1] 29.789654
        Num handles: 1
        Handle: 3009 Address: DF:A9:FF:F6:B1:1A (OUI DF-A9-FF)
        Count: 1
        #280: len 27 (2 Kb/s)
        Latency: 77 msec (61-174 msec ~108 msec)
        Channel: 80 [PSM 39 mode Enhanced Credit (0x81)] {chan 4}
        Channel Latency: 77 msec (67-174 msec ~95 msec)
> HCI Event: Number of Completed Packets (0x13) plen 5    #284 [hci1] 29.789960
        Num handles: 1
        Handle: 3009 Address: DF:A9:FF:F6:B1:1A (OUI DF-A9-FF)
        Count: 1
        #281: len 9 (0 Kb/s)
        Latency: 77 msec (61-174 msec ~93 msec)
        Channel: 80 [PSM 39 mode Enhanced Credit (0x81)] {chan 4}
        Channel Latency: 77 msec (67-174 msec ~86 msec)
> HCI Event: Number of Completed Packets (0x13) plen 5    #285 [hci1] 29.876413
        Num handles: 1
        Handle: 3009 Address: DF:A9:FF:F6:B1:1A (OUI DF-A9-FF)
        Count: 1
        #282: len 12 (0 Kb/s)
        Latency: 164 msec (61-174 msec ~128 msec)
> ACL Data RX: Handle 3009 flags 0x02 dlen 13             #286 [hci1] 29.876675
      Channel: 68 len 9 sdu 7 [PSM 39 mode Enhanced Credit (0x81)] {chan 4}
      ATT: Read By Type Request (0x08) len 6
        Handle range: 0x000a-0x000a
        Attribute type: Characteristic (0x2803)
< HCI Command: Host Number of Com.. (0x03|0x0035) plen 5  #287 [hci1] 29.891823
        Num handles: 1
        Handle: 3009 Address: DF:A9:FF:F6:B1:1A (OUI DF-A9-FF)
        Count: 1
< ACL Data TX: Handle 3009 flags 0x00 dlen 11             #288 [hci1] 29.891954
      Channel: 80 len 7 sdu 5 [PSM 39 mode Enhanced Credit (0x81)] {chan 4}
      ATT: Error Response (0x01) len 4
        Read By Type Request (0x08)
        Handle: 0x000a
        Error: Attribute Not Found (0x0a)
< ACL Data TX: Handle 3009 flags 0x00 dlen 12             #289 [hci1] 29.892064
      LE L2CAP: LE Flow Control Credit (0x16) ident 15 len 4
        Source CID: 68
        Credits: 1
> HCI Event: Number of Completed Packets (0x13) plen 5    #290 [hci1] 29.964374
        Num handles: 1
        Handle: 3009 Address: DF:A9:FF:F6:B1:1A (OUI DF-A9-FF)
        Count: 1
        #288: len 11 (1 Kb/s)
        Latency: 72 msec (61-174 msec ~100 msec)
        Channel: 80 [PSM 39 mode Enhanced Credit (0x81)] {chan 4}
        Channel Latency: 72 msec (67-174 msec ~79 msec)
> HCI Event: Number of Completed Packets (0x13) plen 5    #291 [hci1] 30.051397
        Num handles: 1
        Handle: 3009 Address: DF:A9:FF:F6:B1:1A (OUI DF-A9-FF)
        Count: 1
        #289: len 12 (0 Kb/s)
        Latency: 159 msec (61-174 msec ~129 msec)
        Channel: 80 [PSM 39 mode Enhanced Credit (0x81)] {chan 4}
        Channel Latency: 159 msec (67-174 msec ~119 msec)
> ACL Data RX: Handle 3009 flags 0x02 dlen 12             #292 [hci1] 30.051705
      LE L2CAP: LE Flow Control Credit (0x16) ident 3 len 4
        Source CID: 80
        Credits: 10
> ACL Data RX: Handle 3009 flags 0x02 dlen 11             #293 [hci1] 30.052037
      Channel: 68 len 7 sdu 5 [PSM 39 mode Enhanced Credit (0x81)] {chan 4}
      ATT: Find Information Request (0x04) len 4
        Handle range: 0x0002-0x000a
< HCI Command: Host Number of Com.. (0x03|0x0035) plen 5  #294 [hci1] 30.071660
        Num handles: 1
        Handle: 3009 Address: DF:A9:FF:F6:B1:1A (OUI DF-A9-FF)
        Count: 1
< HCI Command: Host Number of Com.. (0x03|0x0035) plen 5  #295 [hci1] 30.071787
        Num handles: 1
        Handle: 3009 Address: DF:A9:FF:F6:B1:1A (OUI DF-A9-FF)
        Count: 1
< ACL Data TX: Handle 3009 flags 0x00 dlen 27             #296 [hci1] 30.071817
< ACL Data TX: Handle 3009 flags 0x01 dlen 17             #297 [hci1] 30.071818
      Channel: 80 len 40 sdu 38 [PSM 39 mode Enhanced Credit (0x81)] {chan 4}
      ATT: Find Information Response (0x05) len 37
        Format: UUID-16 (0x01)
        Handle: 0x0002
        UUID: Characteristic (0x2803)
        Handle: 0x0003
        UUID: Service Changed (0x2a05)
        Handle: 0x0004
        UUID: Client Characteristic Configuration (0x2902)
        Handle: 0x0005
        UUID: Characteristic (0x2803)
        Handle: 0x0006
        UUID: Client Supported Features (0x2b29)
        Handle: 0x0007
        UUID: Characteristic (0x2803)
        Handle: 0x0008
        UUID: Database Hash (0x2b2a)
        Handle: 0x0009
        UUID: Characteristic (0x2803)
        Handle: 0x000a
        UUID: Server Supported Features (0x2b3a)
< ACL Data TX: Handle 3009 flags 0x00 dlen 12             #298 [hci1] 30.071940
      LE L2CAP: LE Flow Control Credit (0x16) ident 16 len 4
        Source CID: 68
        Credits: 1
> HCI Event: Number of Completed Packets (0x13) plen 5    #299 [hci1] 30.139510
        Num handles: 1
        Handle: 3009 Address: DF:A9:FF:F6:B1:1A (OUI DF-A9-FF)
        Count: 1
        #296: len 27 (3 Kb/s)
        Latency: 67 msec (61-174 msec ~98 msec)
> HCI Event: Number of Completed Packets (0x13) plen 5    #300 [hci1] 30.140186
        Num handles: 1
        Handle: 3009 Address: DF:A9:FF:F6:B1:1A (OUI DF-A9-FF)
        Count: 1
        #297: len 17 (2 Kb/s)
        Latency: 68 msec (61-174 msec ~83 msec)
        Channel: 80 [PSM 39 mode Enhanced Credit (0x81)] {chan 4}
        Channel Latency: 68 msec (67-174 msec ~93 msec)
> HCI Event: Number of Completed Packets (0x13) plen 5    #301 [hci1] 30.226375
        Num handles: 1
        Handle: 3009 Address: DF:A9:FF:F6:B1:1A (OUI DF-A9-FF)
        Count: 1
        #298: len 12 (0 Kb/s)
        Latency: 154 msec (61-174 msec ~119 msec)
        Channel: 80 [PSM 39 mode Enhanced Credit (0x81)] {chan 4}
        Channel Latency: 154 msec (67-174 msec ~124 msec)
> ACL Data RX: Handle 3009 flags 0x02 dlen 11             #302 [hci1] 30.226587
      Channel: 68 len 7 sdu 5 [PSM 39 mode Enhanced Credit (0x81)] {chan 4}
      ATT: Write Request (0x12) len 4
        Handle: 0x0004
          Data: 0000
< HCI Command: Host Number of Com.. (0x03|0x0035) plen 5  #303 [hci1] 30.231807
        Num handles: 1
        Handle: 3009 Address: DF:A9:FF:F6:B1:1A (OUI DF-A9-FF)
        Count: 1
< ACL Data TX: Handle 3009 flags 0x00 dlen 7              #304 [hci1] 30.231843
      Channel: 80 len 3 sdu 1 [PSM 39 mode Enhanced Credit (0x81)] {chan 4}
      ATT: Write Response (0x13) len 0
< ACL Data TX: Handle 3009 flags 0x00 dlen 12             #305 [hci1] 30.231965
      LE L2CAP: LE Flow Control Credit (0x16) ident 17 len 4
        Source CID: 68
        Credits: 1
> HCI Event: Number of Completed Packets (0x13) plen 5    #306 [hci1] 30.314277
        Num handles: 1
        Handle: 3009 Address: DF:A9:FF:F6:B1:1A (OUI DF-A9-FF)
        Count: 1
        #304: len 7 (0 Kb/s)
        Latency: 82 msec (61-174 msec ~100 msec)
> HCI Event: Number of Completed Packets (0x13) plen 5    #307 [hci1] 30.401460
        Num handles: 1
        Handle: 3009 Address: DF:A9:FF:F6:B1:1A (OUI DF-A9-FF)
        Count: 1
        #305: len 12 (0 Kb/s)
        Latency: 169 msec (61-174 msec ~135 msec)
        Channel: 80 [PSM 39 mode Enhanced Credit (0x81)] {chan 4}
        Channel Latency: 169 msec (67-174 msec ~146 msec)
> ACL Data RX: Handle 3009 flags 0x02 dlen 11             #308 [hci1] 30.401577
      Channel: 68 len 7 sdu 5 [PSM 39 mode Enhanced Credit (0x81)] {chan 4}
      ATT: Write Request (0x12) len 4
        Handle: 0x0004
          Data: 0200
< HCI Command: Host Number of Com.. (0x03|0x0035) plen 5  #309 [hci1] 30.411715
        Num handles: 1
        Handle: 3009 Address: DF:A9:FF:F6:B1:1A (OUI DF-A9-FF)
        Count: 1
< ACL Data TX: Handle 3009 flags 0x00 dlen 7              #310 [hci1] 30.411784
      Channel: 80 len 3 sdu 1 [PSM 39 mode Enhanced Credit (0x81)] {chan 4}
      ATT: Write Response (0x13) len 0
< ACL Data TX: Handle 3009 flags 0x00 dlen 12             #311 [hci1] 30.411887
      LE L2CAP: LE Flow Control Credit (0x16) ident 18 len 4
        Source CID: 68
        Credits: 1
> HCI Event: Number of Completed Packets (0x13) plen 5    #312 [hci1] 30.489309
        Num handles: 1
        Handle: 3009 Address: DF:A9:FF:F6:B1:1A (OUI DF-A9-FF)
        Count: 1
        #310: len 7 (0 Kb/s)
        Latency: 77 msec (61-174 msec ~106 msec)
        Channel: 80 [PSM 39 mode Enhanced Credit (0x81)] {chan 4}
        Channel Latency: 77 msec (67-174 msec ~112 msec)
> HCI Event: Number of Completed Packets (0x13) plen 5    #313 [hci1] 30.576314
        Num handles: 1
        Handle: 3009 Address: DF:A9:FF:F6:B1:1A (OUI DF-A9-FF)
        Count: 1
        #311: len 12 (0 Kb/s)
        Latency: 164 msec (61-174 msec ~135 msec)
< ACL Data TX: Handle 3009 flags 0x00 dlen 13             #314 [hci1] 51.341679
      Channel: 80 len 9 sdu 7 [PSM 39 mode Enhanced Credit (0x81)] {chan 4}
      ATT: Handle Value Indication (0x1d) len 6
        Handle: 0x0003
          Data: 27002700
> HCI Event: Number of Completed Packets (0x13) plen 5    #315 [hci1] 51.488544
        Num handles: 1
        Handle: 3009 Address: DF:A9:FF:F6:B1:1A (OUI DF-A9-FF)
        Count: 1
        #314: len 13 (0 Kb/s)
        Latency: 146 msec (61-174 msec ~141 msec)
        Channel: 80 [PSM 39 mode Enhanced Credit (0x81)] {chan 4}
        Channel Latency: 146 msec (67-174 msec ~129 msec)
> ACL Data RX: Handle 3009 flags 0x02 dlen 7              #316 [hci1] 51.488832
      Channel: 68 len 3 sdu 1 [PSM 39 mode Enhanced Credit (0x81)] {chan 4}
      ATT: Handle Value Confirmation (0x1e) len 0
< HCI Command: Host Number of Com.. (0x03|0x0035) plen 5  #317 [hci1] 51.492441
        Num handles: 1
        Handle: 3009 Address: DF:A9:FF:F6:B1:1A (OUI DF-A9-FF)
        Count: 1
< ACL Data TX: Handle 3009 flags 0x00 dlen 12             #318 [hci1] 51.492511
      LE L2CAP: LE Flow Control Credit (0x16) ident 19 len 4
        Source CID: 68
        Credits: 1
> HCI Event: Number of Completed Packets (0x13) plen 5    #319 [hci1] 51.663472
        Num handles: 1
        Handle: 3009 Address: DF:A9:FF:F6:B1:1A (OUI DF-A9-FF)
        Count: 1
        #318: len 12 (0 Kb/s)
        Latency: 170 msec (61-174 msec ~156 msec)
        Channel: 80 [PSM 39 mode Enhanced Credit (0x81)] {chan 4}
        Channel Latency: 170 msec (67-174 msec ~150 msec)
> HCI Event: Disconnect Complete (0x05) plen 4            #320 [hci1] 52.888852
        Status: Success (0x00)
        Handle: 3009 Address: DF:A9:FF:F6:B1:1A (OUI DF-A9-FF)
        Reason: Remote User Terminated Connection (0x13)
< HCI Command: Reset (0x03|0x0003) plen 0                 #321 [hci1] 58.741896
> HCI Event: Command Complete (0x0e) plen 4               #322 [hci1] 58.742505
      Reset (0x03|0x0003) ncmd 1
        Status: Success (0x00)
@ USER Close: main                                    {0x0001} [hci1] 58.751837
= Close Index: 00:00:00:00:00:00                               [hci1] 58.755486
