Bluetooth monitor ver 5.72
= Note: Linux version 6.14.0-36-generic (x86_64)                       0.497700
= Note: Bluetooth subsystem version 2.22                               0.497701
= New Index: 00:00:00:00:00:00 (Primary,UART,hci1)              [hci1] 0.497702
= New Index: 48:5F:99:8E:E0:64 (Primary,USB,hci0)               [hci0] 0.497703
= Open Index: 00:00:00:00:00:00                                 [hci1] 1.011467
= Index Info: 00:00:00:00:00:00 (Nordic Semiconductor ASA)      [hci1] 1.011485
@ USER Open: main (privileged) version 2.22            {0x0001} [hci1] 1.011493
< HCI Command: Reset (0x03|0x0003) plen 0                    #1 [hci1] 1.012826
> HCI Event: Command Complete (0x0e) plen 4                  #2 [hci1] 1.013452
      Reset (0x03|0x0003) ncmd 1
        Status: Success (0x00)
< HCI Command: Read Local Supported... (0x04|0x0003) plen 0  #3 [hci1] 1.031111
> HCI Event: Command Complete (0x0e) plen 12                 #4 [hci1] 1.031651
      Read Local Supported Features (0x04|0x0003) ncmd 1
        Status: Success (0x00)
        Features: 0x00 0x00 0x00 0x00 0x60 0x00 0x00 0x00
          BR/EDR Not Supported
          LE Supported (Controller)
< HCI Command: Read Local Version In.. (0x04|0x0001) plen 0  #5 [hci1] 1.050853
> HCI Event: Command Complete (0x0e) plen 12                 #6 [hci1] 1.051309
      Read Local Version Information (0x04|0x0001) ncmd 1
        Status: Success (0x00)
        HCI version: Reserved (0x0f) - Revision 12393 (0x3069)
        LMP version: Reserved (0x0f) - Subversion 12393 (0x3069)
        Manufacturer: Nordic Semiconductor ASA (89)
< HCI Command: Read Local Supported... (0x04|0x0002) plen 0  #7 [hci1] 1.070845
> HCI Event: Command Complete (0x0e) plen 68                 #8 [hci1] 1.071908
      Read Local Supported Commands (0x04|0x0002) ncmd 1
        Status: Success (0x00)
        Commands: 119 entries
          Disconnect (Octet 0 - Bit 5)
          Read Remote Version Information (Octet 2 - Bit 7)
          Set Event Mask (Octet 5 - Bit 6)
          Reset (Octet 5 - Bit 7)
          Read Connection Accept Timeout (Octet 7 - Bit 2)
          Write Connection Accept Timeout (Octet 7 - Bit 3)
          Read Transmit Power Level (Octet 10 - Bit 2)
          Set Controller To Host Flow Control (Octet 10 - Bit 5)
          Host Buffer Size (Octet 10 - Bit 6)
          Host Number of Completed Packets (Octet 10 - Bit 7)
          Read Local Version Information (Octet 14 - Bit 3)
          Read Local Supported Features (Octet 14 - Bit 5)
          Read BD ADDR (Octet 15 - Bit 1)
          Read RSSI (Octet 15 - Bit 5)
          Set Event Mask Page 2 (Octet 22 - Bit 2)
          LE Set Event Mask (Octet 25 - Bit 0)
          LE Read Buffer Size (Octet 25 - Bit 1)
          LE Read Local Supported Features (Octet 25 - Bit 2)
          LE Set Random Address (Octet 25 - Bit 4)
          LE Set Advertising Parameters (Octet 25 - Bit 5)
          LE Read Advertising Channel TX Power (Octet 25 - Bit 6)
          LE Set Advertising Data (Octet 25 - Bit 7)
          LE Set Scan Response Data (Octet 26 - Bit 0)
          LE Set Advertise Enable (Octet 26 - Bit 1)
          LE Set Scan Parameters (Octet 26 - Bit 2)
          LE Set Scan Enable (Octet 26 - Bit 3)
          LE Create Connection (Octet 26 - Bit 4)
          LE Create Connection Cancel (Octet 26 - Bit 5)
          LE Read Accept List Size (Octet 26 - Bit 6)
          LE Clear Accept List (Octet 26 - Bit 7)
          LE Add Device To Accept List (Octet 27 - Bit 0)
          LE Remove Device From Accept List (Octet 27 - Bit 1)
          LE Connection Update (Octet 27 - Bit 2)
          LE Set Host Channel Classification (Octet 27 - Bit 3)
          LE Read Channel Map (Octet 27 - Bit 4)
          LE Read Remote Used Features (Octet 27 - Bit 5)
          LE Encrypt (Octet 27 - Bit 6)
          LE Rand (Octet 27 - Bit 7)
          LE Start Encryption (Octet 28 - Bit 0)
          LE Long Term Key Request Reply (Octet 28 - Bit 1)
          LE Long Term Key Request Neg Reply (Octet 28 - Bit 2)
          LE Read Supported States (Octet 28 - Bit 3)
          LE Receiver Test (Octet 28 - Bit 4)
          LE Transmitter Test (Octet 28 - Bit 5)
          LE Test End (Octet 28 - Bit 6)
          Read Authenticated Payload Timeout (Octet 32 - Bit 4)
          Write Authenticated Payload Timeout (Octet 32 - Bit 5)
          LE Set Data Length (Octet 33 - Bit 6)
          LE Read Suggested Default Data Length (Octet 33 - Bit 7)
          LE Write Suggested Default Data Length (Octet 34 - Bit 0)
          LE Add Device To Resolving List (Octet 34 - Bit 3)
          LE Remove Device From Resolving List (Octet 34 - Bit 4)
          LE Clear Resolving List (Octet 34 - Bit 5)
          LE Read Resolving List Size (Octet 34 - Bit 6)
          LE Set Address Resolution Enable (Octet 35 - Bit 1)
          LE Set Resolvable Private Address Timeout (Octet 35 - Bit 2)
          LE Read Maximum Data Length (Octet 35 - Bit 3)
          LE Read PHY (Octet 35 - Bit 4)
          LE Set Default PHY (Octet 35 - Bit 5)
          LE Set PHY (Octet 35 - Bit 6)
          LE Enhanced Receiver Test (Octet 35 - Bit 7)
          LE Enhanced Transmitter Test (Octet 36 - Bit 0)
          LE Set Advertising Set Random Address (Octet 36 - Bit 1)
          LE Set Extended Advertising Parameters (Octet 36 - Bit 2)
          LE Set Extended Advertising Data (Octet 36 - Bit 3)
          LE Set Extended Scan Response Data (Octet 36 - Bit 4)
          LE Set Extended Advertising Enable (Octet 36 - Bit 5)
          LE Read Maximum Advertising Data Length (Octet 36 - Bit 6)
          LE Read Number of Supported Advertising Sets (Octet 36 - Bit 7)
          LE Remove Advertising Set (Octet 37 - Bit 0)
          LE Clear Advertising Sets (Octet 37 - Bit 1)
          LE Set Periodic Advertising Parameters (Octet 37 - Bit 2)
          LE Set Periodic Advertising Data (Octet 37 - Bit 3)
          LE Set Periodic Advertising Enable (Octet 37 - Bit 4)
          LE Set Extended Scan Parameters (Octet 37 - Bit 5)
          LE Set Extended Scan Enable (Octet 37 - Bit 6)
          LE Extended Create Connection (Octet 37 - Bit 7)
          LE Periodic Advertising Create Sync (Octet 38 - Bit 0)
          LE Periodic Advertising Create Sync Cancel (Octet 38 - Bit 1)
          LE Periodic Advertising Terminate Sync (Octet 38 - Bit 2)
          LE Add Device To Periodic Advertiser List (Octet 38 - Bit 3)
          LE Remove Device From Periodic Advertiser List (Octet 38 - Bit 4)
          LE Clear Periodic Advertiser List (Octet 38 - Bit 5)
          LE Read Periodic Advertiser List Size (Octet 38 - Bit 6)
          LE Read Transmit Power (Octet 38 - Bit 7)
          LE Read RF Path Compensation (Octet 39 - Bit 0)
          LE Write RF Path Compensation (Octet 39 - Bit 1)
          LE Set Privacy Mode (Octet 39 - Bit 2)
          LE Periodic Advertising Receive Enable (Octet 40 - Bit 5)
          LE Periodic Advertising Sync Transfer (Octet 40 - Bit 6)
          LE Periodic Advertising Set Info Transfer (Octet 40 - Bit 7)
          LE Periodic Advertising Sync Transfer Parameters (Octet 41 - Bit 0)
          LE Set Default Periodic Advertisng Sync Transfer Parameters (Octet 41 - Bit 1)
          LE Read Buffer v2 (Octet 41 - Bit 5)
          LE Read ISO TX Sync (Octet 41 - Bit 6)
          LE Set Connected Isochronous Group Parameters (Octet 41 - Bit 7)
          LE Set Connected Isochronous Group Parameters Test (Octet 42 - Bit 0)
          LE Create Connected Isochronous Stream (Octet 42 - Bit 1)
          LE Remove Connected Isochronous Group (Octet 42 - Bit 2)
          LE Accept Connected Isochronous Stream Request (Octet 42 - Bit 3)
          LE Reject Connected Isochronous Stream Request (Octet 42 - Bit 4)
          LE Create Broadcast Isochronous Group (Octet 42 - Bit 5)
          LE Create Broadcast Isochronous Group Test (Octet 42 - Bit 6)
          LE Terminate Broadcast Isochronous Group (Octet 42 - Bit 7)
          LE Broadcast Isochronous Group Create Sync (Octet 43 - Bit 0)
          LE Broadcast Isochronous Group Terminate Sync (Octet 43 - Bit 1)
          LE Request Peer SCA (Octet 43 - Bit 2)
          LE Setup Isochronous Data Path (Octet 43 - Bit 3)
          LE Remove Isochronous Data Path (Octet 43 - Bit 4)
          LE Isochronous Transmit Test (Octet 43 - Bit 5)
          LE Isochronous Receive Test (Octet 43 - Bit 6)
          LE Isochronous Read Test Counters (Octet 43 - Bit 7)
          LE Isochronous Read Test Counters (Octet 44 - Bit 0)
          LE Set Host Feature (Octet 44 - Bit 1)
          Octet 44 - Bit 2 
          Octet 45 - Bit 6 
          Octet 46 - Bit 0 
          Octet 46 - Bit 1 
          Octet 46 - Bit 2 
< HCI Command: Host Buffer Size (0x03|0x0033) plen 7         #9 [hci1] 1.090826
        ACL MTU: 255  ACL max packet: 16
        SCO MTU: 0    SCO max packet: 0
> HCI Event: Command Complete (0x0e) plen 4                 #10 [hci1] 1.091312
      Host Buffer Size (0x03|0x0033) ncmd 1
        Status: Success (0x00)
< HCI Command: Set Controller To Ho.. (0x03|0x0031) plen 1  #11 [hci1] 1.110850
        Flow control: ACL Data Packets (0x01)
> HCI Event: Command Complete (0x0e) plen 4                 #12 [hci1] 1.111223
      Set Controller To Host Flow Control (0x03|0x0031) ncmd 1
        Status: Success (0x00)
< HCI Command: LE Read Local Suppor.. (0x08|0x0003) plen 0  #13 [hci1] 1.130879
> HCI Event: Command Complete (0x0e) plen 12                #14 [hci1] 1.131414
      LE Read Local Supported Features (0x08|0x0003) ncmd 1
        Status: Success (0x00)
        Features: 0xfd 0x79 0x00 0xf7 0x30 0x01 0x00 0x00
          LE Encryption
          Extended Reject Indication
          Peripheral-initiated Features Exchange
          LE Ping
          LE Data Packet Length Extension
          LL Privacy
          Extended Scanner Filter Policies
          LE 2M PHY
          LE Coded PHY
          LE Extended Advertising
          LE Periodic Advertising
          Channel Selection Algorithm #2
          Periodic Advertising Sync Transfer - Sender
          Periodic Advertising Sync Transfer - Recipient
          Sleep Clock Accuracy Updates
          Connected Isochronous Stream - Central
          Connected Isochronous Stream - Peripheral
          Isochronous Broadcaster
          Synchronized Receiver
          Periodic Advertising ADI support
          Connection Subrating
          Unknown features (0x0000010000000000)
< HCI Command: LE Set Host Feature (0x08|0x0074) plen 2     #15 [hci1] 1.150846
        Bit Number: 32
          Connected Isochronous Stream (Host Support)
        Bit Value: 1
> HCI Event: Command Complete (0x0e) plen 4                 #16 [hci1] 1.151264
      LE Set Host Feature (0x08|0x0074) ncmd 1
        Status: Success (0x00)
< HCI Command: LE Read Buffer v2 (0x08|0x0060) plen 0       #17 [hci1] 1.170846
> HCI Event: Command Complete (0x0e) plen 10                #18 [hci1] 1.171312
      LE Read Buffer v2 (0x08|0x0060) ncmd 1
        Status: Success (0x00)
        ACL MTU: 27
        ACL max packet: 3
        ISO MTU: 318
        ISO max packet: 3
< HCI Command: LE Read Maximum Adve.. (0x08|0x003a) plen 0  #19 [hci1] 1.190872
> HCI Event: Command Complete (0x0e) plen 6                 #20 [hci1] 1.191298
      LE Read Maximum Advertising Data Length (0x08|0x003a) ncmd 1
        Status: Success (0x00)
        Max length: 1650
< HCI Command: LE Read Supported St.. (0x08|0x001c) plen 0  #21 [hci1] 1.210845
> HCI Event: Command Complete (0x0e) plen 12                #22 [hci1] 1.211294
      LE Read Supported States (0x08|0x001c) ncmd 1
        Status: Success (0x00)
        States: 0x000003ff3e0306ff
          Non-connectable Advertising State
          Scannable Advertising State
          Connectable Advertising State
          High Duty Cycle Directed Advertising State
          Passive Scanning State
          Active Scanning State
          Initiating State
            and Connection State (Central Role)
          Connection State (Peripheral Role)
          Scannable Advertising State
            and Passive Scanning State
          Connectable Advertising State
            and Passive Scanning State
          Non-connectable Advertising State
            and Initiating State
          Scannable Advertising State
            and Initiating State
          Active Scanning State
            and Connection State (Central Role)
          Passive Scanning State
            and Connection State (Peripheral Role)
          Active Scanning State
            and Connection State (Peripheral Role)
          Initiating State
            and Connection State (Central Role)
            and Central Role & Central Role
          Low Duty Cycle Directed Advertising State
          Connectable Advertising State
            and Initiating State
            and Central Role & Peripheral Role
          High Duty Cycle Directed Advertising State
            and Initiating State
            and Central Role & Peripheral Role
          Low Duty Cycle Directed Advertising State
            and Initiating State
            and Central Role & Peripheral Role
          Connectable Advertising State
            and Connection State (Central Role)
            and Central Role & Peripheral Role
          High Duty Cycle Directed Advertising State
            and Connection State (Central Role)
            and Central Role & Peripheral Role
          Low Duty Cycle Directed Advertising State
            and Connection State (Central Role)
            and Central Role & Peripheral Role
          Connectable Advertising State
            and Connection State (Peripheral Role)
            and Central Role & Peripheral Role
          High Duty Cycle Directed Advertising State
            and Connection State (Peripheral Role)
            and Peripheral Role & Peripheral Role
          Low Duty Cycle Directed Advertising State
            and Connection State (Peripheral Role)
            and Peripheral Role & Peripheral Role
          Initiating State
            and Connection State (Peripheral Role)
            and Central Role & Peripheral Role
< HCI Command: LE Read Maximum Data.. (0x08|0x002f) plen 0  #23 [hci1] 1.230840
> HCI Event: Command Complete (0x0e) plen 12                #24 [hci1] 1.231245
      LE Read Maximum Data Length (0x08|0x002f) ncmd 1
        Status: Success (0x00)
        Max TX octets: 251
        Max TX time: 2704
        Max RX octets: 251
        Max RX time: 2704
< HCI Command: LE Write Suggested D.. (0x08|0x0024) plen 4  #25 [hci1] 1.250855
        TX octets: 251
        TX time: 2704
> HCI Event: Command Complete (0x0e) plen 4                 #26 [hci1] 1.251287
      LE Write Suggested Default Data Length (0x08|0x0024) ncmd 1
        Status: Success (0x00)
< HCI Command: LE Read Resolving Li.. (0x08|0x002a) plen 0  #27 [hci1] 1.270847
> HCI Event: Command Complete (0x0e) plen 5                 #28 [hci1] 1.271326
      LE Read Resolving List Size (0x08|0x002a) ncmd 1
        Status: Success (0x00)
        Size: 8
< HCI Command: LE Set Event Mask (0x08|0x0001) plen 8       #29 [hci1] 1.290834
        Mask: 0x000002023f87fa5e
          LE Advertising Report
          LE Connection Update Complete
          LE Read Remote Used Features Complete
          LE Long Term Key Request
          LE Data Length Change
          LE Enhanced Connection Complete
          LE PHY Update Complete
          LE Extended Advertising Report
          LE Periodic Advertising Sync Established
          LE Periodic Advertising Report
          LE Periodic Advertising Sync Lost
          LE Extended Scan Timeout
          LE Extended Advertising Set Terminated
          LE Scan Request Received
          LE Periodic Advertising Sync Transfer Rvc
          LE CIS Established
          LE CIS Request
          LE Create BIG Complete
          LE Terminate BIG Complete
          LE BIG Sync Estabilished Complete
          LE BIG Sync Lost
          LE BIG Info Advertising Report
          Unknown mask (0x0000020000000000)
> HCI Event: Command Complete (0x0e) plen 4                 #30 [hci1] 1.291441
      LE Set Event Mask (0x08|0x0001) ncmd 1
        Status: Success (0x00)
< HCI Command: Set Event Mask (0x03|0x0001) plen 8          #31 [hci1] 1.310820
        Mask: 0x2000800002008890
          Disconnection Complete
          Encryption Change
          Read Remote Version Information Complete
          Hardware Error
          Data Buffer Overflow
          Encryption Key Refresh Complete
          LE Meta
> HCI Event: Command Complete (0x0e) plen 4                 #32 [hci1] 1.311322
      Set Event Mask (0x03|0x0001) ncmd 1
        Status: Success (0x00)
< HCI Command: Read BD ADDR (0x04|0x0009) plen 0            #33 [hci1] 1.330841
> HCI Event: Command Complete (0x0e) plen 10                #34 [hci1] 1.331281
      Read BD ADDR (0x04|0x0009) ncmd 1
        Status: Success (0x00)
        Address: 00:00:00:00:00:00 (OUI 00-00-00)
< HCI Command: LE Set Random Address (0x08|0x0005) plen 6   #35 [hci1] 1.350857
        Address: D5:B6:CC:31:DB:3B (Static)
> HCI Event: Command Complete (0x0e) plen 4                 #36 [hci1] 1.351331
      LE Set Random Address (0x08|0x0005) ncmd 1
        Status: Success (0x00)
< HCI Command: LE Set Extended Adv.. (0x08|0x0036) plen 25  #37 [hci1] 3.891502
        Handle: 0x00
        Properties: 0x0013
          Connectable
          Scannable
          Use legacy advertising PDUs: ADV_IND
        Min advertising interval: 100.000 msec (0x00a0)
        Max advertising interval: 150.000 msec (0x00f0)
        Channel map: 37, 38, 39 (0x07)
        Own address type: Random (0x01)
        Peer address type: Public (0x00)
        Peer address: 00:00:00:00:00:00 (OUI 00-00-00)
        Filter policy: Allow Scan Request from Any, Allow Connect Request from Any (0x00)
        TX power: Host has no preference (0x7f)
        Primary PHY: LE 1M (0x01)
        Secondary max skip: 0x00
        Secondary PHY: LE 1M (0x01)
        SID: 0x00
        Scan request notifications: Disabled (0x00)
> HCI Event: Command Complete (0x0e) plen 5                 #38 [hci1] 3.892314
      LE Set Extended Advertising Parameters (0x08|0x0036) ncmd 1
        Status: Success (0x00)
        TX power (selected): 0 dbm (0x00)
< HCI Command: LE Set Advertising S.. (0x08|0x0035) plen 7  #39 [hci1] 3.911272
        Advertising handle: 0x00
        Advertising random address: D5:B6:CC:31:DB:3B (Static)
> HCI Event: Command Complete (0x0e) plen 4                 #40 [hci1] 3.911971
      LE Set Advertising Set Random Address (0x08|0x0035) ncmd 1
        Status: Success (0x00)
< HCI Command: LE Set Extended Adv.. (0x08|0x0037) plen 22  #41 [hci1] 3.930958
        Handle: 0x00
        Operation: Complete extended advertising data (0x03)
        Fragment preference: Minimize fragmentation (0x01)
        Data length: 0x12
        Flags: 0x06
          LE General Discoverable Mode
          BR/EDR Not Supported
        Name (complete): Tester_F6B11A
> HCI Event: Command Complete (0x0e) plen 4                 #42 [hci1] 3.931697
      LE Set Extended Advertising Data (0x08|0x0037) ncmd 1
        Status: Success (0x00)
< HCI Command: LE Set Extended Scan.. (0x08|0x0038) plen 4  #43 [hci1] 3.950898
        Handle: 0x00
        Operation: Complete scan response data (0x03)
        Fragment preference: Minimize fragmentation (0x01)
        Data length: 0x00
> HCI Event: Command Complete (0x0e) plen 4                 #44 [hci1] 3.951586
      LE Set Extended Scan Response Data (0x08|0x0038) ncmd 1
        Status: Success (0x00)
< HCI Command: LE Set Extended Adve.. (0x08|0x0039) plen 6  #45 [hci1] 3.970877
        Extended advertising: Enabled (0x01)
        Number of sets: 1 (0x01)
        Entry 0
          Handle: 0x00
          Duration: 0 ms (0x00)
          Max ext adv events: 0
> HCI Event: Command Complete (0x0e) plen 4                 #46 [hci1] 3.971463
      LE Set Extended Advertising Enable (0x08|0x0039) ncmd 1
        Status: Success (0x00)
> HCI Event: LE Meta Event (0x3e) plen 31                   #47 [hci1] 4.083366
      LE Enhanced Connection Complete (0x0a)
        Status: Success (0x00)
        Handle: 129
        Role: Peripheral (0x01)
        Peer address type: Public (0x00)
        Peer address: DF:A9:FF:F6:B1:1A (OUI DF-A9-FF)
        Local resolvable private address: 00:00:00:00:00:00 (Non-Resolvable)
        Peer resolvable private address: 00:00:00:00:00:00 (Non-Resolvable)
        Connection interval: 87.50 msec (0x0046)
        Connection latency: 0 (0x0000)
        Supervision timeout: 25120 msec (0x09d0)
        Central clock accuracy: 0x01
> HCI Event: LE Meta Event (0x3e) plen 6                    #48 [hci1] 4.083566
      LE Advertising Set Terminated (0x12)
        Status: Success (0x00)
        Handle: 0
        Connection handle: 129
        Number of completed extended advertising events: 0
< HCI Command: LE Read Remote Used... (0x08|0x0016) plen 2  #49 [hci1] 4.091281
        Handle: 129 Address: DF:A9:FF:F6:B1:1A (OUI DF-A9-FF)
< ACL Data TX: Handle 129 flags 0x00 dlen 7                 #50 [hci1] 4.091304
      ATT: Exchange MTU Request (0x02) len 2
        Client RX MTU: 251
> HCI Event: Command Status (0x0f) plen 4                   #51 [hci1] 4.091823
      LE Read Remote Used Features (0x08|0x0016) ncmd 1
        Status: Success (0x00)
> HCI Event: Number of Completed Packets (0x13) plen 5      #52 [hci1] 4.259266
        Num handles: 1
        Handle: 129 Address: DF:A9:FF:F6:B1:1A (OUI DF-A9-FF)
        Count: 1
        #50: len 7 (0 Kb/s)
        Latency: 167 msec (167-167 msec ~167 msec)
> HCI Event: LE Meta Event (0x3e) plen 12                   #53 [hci1] 4.347245
      LE Read Remote Used Features (0x04)
        Status: Success (0x00)
        Handle: 129 Address: DF:A9:FF:F6:B1:1A (OUI DF-A9-FF)
        Features: 0x2d 0x49 0x00 0xf7 0x67 0xd8 0x00 0x00
          LE Encryption
          Extended Reject Indication
          Peripheral-initiated Features Exchange
          LE Data Packet Length Extension
          LE 2M PHY
          LE Coded PHY
          Channel Selection Algorithm #2
          Periodic Advertising Sync Transfer - Sender
          Periodic Advertising Sync Transfer - Recipient
          Sleep Clock Accuracy Updates
          Connected Isochronous Stream - Central
          Connected Isochronous Stream - Peripheral
          Isochronous Broadcaster
          Synchronized Receiver
          Connected Isochronous Stream (Host Support)
          LE Power Control Request
          LE Power Control Request
          Connection Subrating
          Connection Subrating (Host Support)
          Unknown features (0x0000d80000000000)
> ACL Data RX: Handle 129 flags 0x02 dlen 11                #54 [hci1] 6.796885
      SMP: Pairing Request (0x01) len 6
        IO capability: KeyboardDisplay (0x04)
        OOB data: Authentication data not present (0x00)
        Authentication requirement: Bonding, MITM, SC, No Keypresses (0x0d)
        Max encryption key size: 16
        Initiator key distribution: EncKey IdKey (0x03)
        Responder key distribution: EncKey IdKey Sign (0x07)
> ACL Data RX: Handle 129 flags 0x02 dlen 7                 #55 [hci1] 6.797356
      ATT: Exchange MTU Response (0x03) len 2
        Server RX MTU: 23
< HCI Command: Host Number of Compl.. (0x03|0x0035) plen 5  #56 [hci1] 6.811459
        Num handles: 1
        Handle: 129 Address: DF:A9:FF:F6:B1:1A (OUI DF-A9-FF)
        Count: 1
< ACL Data TX: Handle 129 flags 0x00 dlen 11                #57 [hci1] 6.811672
      SMP: Pairing Response (0x02) len 6
        IO capability: DisplayOnly (0x00)
        OOB data: Authentication data not present (0x00)
        Authentication requirement: Bonding, No MITM, SC, No Keypresses (0x09)
        Max encryption key size: 16
        Initiator key distribution: IdKey (0x02)
        Responder key distribution: <none> (0x00)
< HCI Command: Host Number of Compl.. (0x03|0x0035) plen 5  #58 [hci1] 6.811893
        Num handles: 1
        Handle: 129 Address: DF:A9:FF:F6:B1:1A (OUI DF-A9-FF)
        Count: 1
> HCI Event: Number of Completed Packets (0x13) plen 5      #59 [hci1] 6.971982
        Num handles: 1
        Handle: 129 Address: DF:A9:FF:F6:B1:1A (OUI DF-A9-FF)
        Count: 1
        #57: len 11 (0 Kb/s)
        Latency: 160 msec (160-167 msec ~164 msec)
> ACL Data RX: Handle 129 flags 0x02 dlen 27                #60 [hci1] 6.972346
> ACL Data RX: Handle 129 flags 0x01 dlen 27                #61 [hci1] 6.972776
> ACL Data RX: Handle 129 flags 0x01 dlen 15                #62 [hci1] 6.973234
      SMP: Pairing Public Key (0x0c) len 64
        X: da362ad1c6a08a067c73973fc0b56dc7e1ba8c71f48d93ffd6be995a10a124ec
        Y: d93e2c802a26cbc9d1e0b899569c14b98e3d73f710c7f01fe58b32de9a4c766d
< HCI Command: Host Number of Compl.. (0x03|0x0035) plen 5  #63 [hci1] 6.991268
        Num handles: 1
        Handle: 129 Address: DF:A9:FF:F6:B1:1A (OUI DF-A9-FF)
        Count: 1
< HCI Command: Host Number of Compl.. (0x03|0x0035) plen 5  #64 [hci1] 6.991333
        Num handles: 1
        Handle: 129 Address: DF:A9:FF:F6:B1:1A (OUI DF-A9-FF)
        Count: 1
< HCI Command: Host Number of Compl.. (0x03|0x0035) plen 5  #65 [hci1] 6.991463
        Num handles: 1
        Handle: 129 Address: DF:A9:FF:F6:B1:1A (OUI DF-A9-FF)
        Count: 1
< ACL Data TX: Handle 129 flags 0x00 dlen 27                #66 [hci1] 6.991600
< ACL Data TX: Handle 129 flags 0x01 dlen 27                #67 [hci1] 6.991612
< ACL Data TX: Handle 129 flags 0x01 dlen 15                #68 [hci1] 6.991627
      SMP: Pairing Public Key (0x0c) len 64
        X: 98308440221e2d910f0e54b71e7ec652857aa9b5a0dc65028824cc19db1226e9
        Y: 67a4816bcb62efb21701e31fdb27561a6217575fb007a8bbdabe7e28b6f68482
> HCI Event: Number of Completed Packets (0x13) plen 5      #69 [hci1] 7.059875
        Num handles: 1
        Handle: 129 Address: DF:A9:FF:F6:B1:1A (OUI DF-A9-FF)
        Count: 1
        #66: len 27 (3 Kb/s)
        Latency: 68 msec (68-167 msec ~116 msec)
> HCI Event: Number of Completed Packets (0x13) plen 5      #70 [hci1] 7.060633
        Num handles: 1
        Handle: 129 Address: DF:A9:FF:F6:B1:1A (OUI DF-A9-FF)
        Count: 1
        #67: len 27 (3 Kb/s)
        Latency: 69 msec (68-167 msec ~92 msec)
> HCI Event: Number of Completed Packets (0x13) plen 5      #71 [hci1] 7.146754
        Num handles: 1
        Handle: 129 Address: DF:A9:FF:F6:B1:1A (OUI DF-A9-FF)
        Count: 1
        #68: len 15 (0 Kb/s)
        Latency: 155 msec (68-167 msec ~123 msec)
> ACL Data RX: Handle 129 flags 0x02 dlen 21                #72 [hci1] 8.109568
      SMP: Pairing Confirm (0x03) len 16
        Confim value: f2abee2733f584519f9638f63ee2e52d
< HCI Command: Host Number of Compl.. (0x03|0x0035) plen 5  #73 [hci1] 8.111046
        Num handles: 1
        Handle: 129 Address: DF:A9:FF:F6:B1:1A (OUI DF-A9-FF)
        Count: 1
< ACL Data TX: Handle 129 flags 0x00 dlen 21                #74 [hci1] 8.111185
      SMP: Pairing Confirm (0x03) len 16
        Confim value: 4ee025abf3d235ca8961ebd70fa7f400
> HCI Event: Number of Completed Packets (0x13) plen 5      #75 [hci1] 8.284521
        Num handles: 1
        Handle: 129 Address: DF:A9:FF:F6:B1:1A (OUI DF-A9-FF)
        Count: 1
        #74: len 21 (0 Kb/s)
        Latency: 173 msec (68-173 msec ~148 msec)
> ACL Data RX: Handle 129 flags 0x02 dlen 21                #76 [hci1] 8.284702
      SMP: Pairing Random (0x04) len 16
        Random value: 84e445438712b3b90000000000000000
< HCI Command: Host Number of Compl.. (0x03|0x0035) plen 5  #77 [hci1] 8.291702
        Num handles: 1
        Handle: 129 Address: DF:A9:FF:F6:B1:1A (OUI DF-A9-FF)
        Count: 1
< ACL Data TX: Handle 129 flags 0x00 dlen 21                #78 [hci1] 8.291873
      SMP: Pairing Random (0x04) len 16
        Random value: 8e6108f966a694cbe26df70bb96773e6
> HCI Event: Number of Completed Packets (0x13) plen 5      #79 [hci1] 8.459198
        Num handles: 1
        Handle: 129 Address: DF:A9:FF:F6:B1:1A (OUI DF-A9-FF)
        Count: 1
        #78: len 21 (1 Kb/s)
        Latency: 167 msec (68-173 msec ~157 msec)
> ACL Data RX: Handle 129 flags 0x02 dlen 21                #80 [hci1] 8.547030
      SMP: Pairing Confirm (0x03) len 16
        Confim value: f2766e78a091609d2b87037a6bb14411
< HCI Command: Host Number of Compl.. (0x03|0x0035) plen 5  #81 [hci1] 8.551546
        Num handles: 1
        Handle: 129 Address: DF:A9:FF:F6:B1:1A (OUI DF-A9-FF)
        Count: 1
< ACL Data TX: Handle 129 flags 0x00 dlen 21                #82 [hci1] 8.551731
      SMP: Pairing Confirm (0x03) len 16
        Confim value: 0d7b30dabb6887b290858ef6c9086531
> HCI Event: Number of Completed Packets (0x13) plen 5      #83 [hci1] 8.721891
        Num handles: 1
        Handle: 129 Address: DF:A9:FF:F6:B1:1A (OUI DF-A9-FF)
        Count: 1
        #82: len 21 (0 Kb/s)
        Latency: 170 msec (68-173 msec ~164 msec)
> ACL Data RX: Handle 129 flags 0x02 dlen 21                #84 [hci1] 8.722197
      SMP: Pairing Random (0x04) len 16
        Random value: 896ac1acb1a3f26f0000000000000000
< HCI Command: Host Number of Compl.. (0x03|0x0035) plen 5  #85 [hci1] 8.731167
        Num handles: 1
        Handle: 129 Address: DF:A9:FF:F6:B1:1A (OUI DF-A9-FF)
        Count: 1
< ACL Data TX: Handle 129 flags 0x00 dlen 21                #86 [hci1] 8.731262
      SMP: Pairing Random (0x04) len 16
        Random value: 4d02679f89a05211af56d8b3da64d21e
> HCI Event: Number of Completed Packets (0x13) plen 5      #87 [hci1] 8.896682
        Num handles: 1
        Handle: 129 Address: DF:A9:FF:F6:B1:1A (OUI DF-A9-FF)
        Count: 1
        #86: len 21 (1 Kb/s)
        Latency: 165 msec (68-173 msec ~164 msec)
> ACL Data RX: Handle 129 flags 0x02 dlen 21                #88 [hci1] 8.984601
      SMP: Pairing Confirm (0x03) len 16
        Confim value: b68c18e13959b70c89593eeb883b036b
< HCI Command: Host Number of Compl.. (0x03|0x0035) plen 5  #89 [hci1] 8.991288
        Num handles: 1
        Handle: 129 Address: DF:A9:FF:F6:B1:1A (OUI DF-A9-FF)
        Count: 1
< ACL Data TX: Handle 129 flags 0x00 dlen 21                #90 [hci1] 8.991419
      SMP: Pairing Confirm (0x03) len 16
        Confim value: 5e7146bda2e70ed75ad6714109c75c8c
> HCI Event: Number of Completed Packets (0x13) plen 5      #91 [hci1] 9.159376
        Num handles: 1
        Handle: 129 Address: DF:A9:FF:F6:B1:1A (OUI DF-A9-FF)
        Count: 1
        #90: len 21 (1 Kb/s)
        Latency: 167 msec (68-173 msec ~166 msec)
> ACL Data RX: Handle 129 flags 0x02 dlen 21                #92 [hci1] 9.159732
      SMP: Pairing Random (0x04) len 16
        Random value: a75cada7eaf69bd10000000000000000
< HCI Command: Host Number of Compl.. (0x03|0x0035) plen 5  #93 [hci1] 9.171829
        Num handles: 1
        Handle: 129 Address: DF:A9:FF:F6:B1:1A (OUI DF-A9-FF)
        Count: 1
< ACL Data TX: Handle 129 flags 0x00 dlen 21                #94 [hci1] 9.171930
      SMP: Pairing Random (0x04) len 16
        Random value: 5e8286bc235a02440d0c3424a2acf8fd
> HCI Event: Number of Completed Packets (0x13) plen 5      #95 [hci1] 9.334155
        Num handles: 1
        Handle: 129 Address: DF:A9:FF:F6:B1:1A (OUI DF-A9-FF)
        Count: 1
        #94: len 21 (1 Kb/s)
        Latency: 162 msec (68-173 msec ~164 msec)
> ACL Data RX: Handle 129 flags 0x02 dlen 21                #96 [hci1] 9.422012
      SMP: Pairing Confirm (0x03) len 16
        Confim value: a2220f73e90334ad681c64623f240412
< HCI Command: Host Number of Compl.. (0x03|0x0035) plen 5  #97 [hci1] 9.431515
        Num handles: 1
        Handle: 129 Address: DF:A9:FF:F6:B1:1A (OUI DF-A9-FF)
        Count: 1
< ACL Data TX: Handle 129 flags 0x00 dlen 21                #98 [hci1] 9.431735
      SMP: Pairing Confirm (0x03) len 16
        Confim value: 545ed034d782f837d71c0e2ade7e6280
> HCI Event: Number of Completed Packets (0x13) plen 5      #99 [hci1] 9.596806
        Num handles: 1
        Handle: 129 Address: DF:A9:FF:F6:B1:1A (OUI DF-A9-FF)
        Count: 1
        #98: len 21 (1 Kb/s)
        Latency: 165 msec (68-173 msec ~164 msec)
> ACL Data RX: Handle 129 flags 0x02 dlen 21               #100 [hci1] 9.597201
      SMP: Pairing Random (0x04) len 16
        Random value: 6c98f783c1a9acbf0000000000000000
< HCI Command: Host Number of Comp.. (0x03|0x0035) plen 5  #101 [hci1] 9.611792
        Num handles: 1
        Handle: 129 Address: DF:A9:FF:F6:B1:1A (OUI DF-A9-FF)
        Count: 1
< ACL Data TX: Handle 129 flags 0x00 dlen 21               #102 [hci1] 9.611846
      SMP: Pairing Random (0x04) len 16
        Random value: 5c4a1bcadd27bd58e945097b00bad7ac
> HCI Event: Number of Completed Packets (0x13) plen 5     #103 [hci1] 9.771591
        Num handles: 1
        Handle: 129 Address: DF:A9:FF:F6:B1:1A (OUI DF-A9-FF)
        Count: 1
        #102: len 21 (1 Kb/s)
        Latency: 159 msec (68-173 msec ~162 msec)
> ACL Data RX: Handle 129 flags 0x02 dlen 21               #104 [hci1] 9.859558
      SMP: Pairing Confirm (0x03) len 16
        Confim value: 3c01199f0bb1460d09e3c740bf6286c2
< HCI Command: Host Number of Comp.. (0x03|0x0035) plen 5  #105 [hci1] 9.870860
        Num handles: 1
        Handle: 129 Address: DF:A9:FF:F6:B1:1A (OUI DF-A9-FF)
        Count: 1
< ACL Data TX: Handle 129 flags 0x00 dlen 21               #106 [hci1] 9.871077
      SMP: Pairing Confirm (0x03) len 16
        Confim value: 74d0780c8b631db6165f096349de505f
> HCI Event: Number of Completed Packets (0x13) plen 5    #107 [hci1] 10.034266
        Num handles: 1
        Handle: 129 Address: DF:A9:FF:F6:B1:1A (OUI DF-A9-FF)
        Count: 1
        #106: len 21 (1 Kb/s)
        Latency: 163 msec (68-173 msec ~162 msec)
> ACL Data RX: Handle 129 flags 0x02 dlen 21              #108 [hci1] 10.034655
      SMP: Pairing Random (0x04) len 16
        Random value: 8532e606ce31ee7c0000000000000000
< HCI Command: Host Number of Com.. (0x03|0x0035) plen 5  #109 [hci1] 10.051058
        Num handles: 1
        Handle: 129 Address: DF:A9:FF:F6:B1:1A (OUI DF-A9-FF)
        Count: 1
< ACL Data TX: Handle 129 flags 0x00 dlen 21              #110 [hci1] 10.051130
      SMP: Pairing Random (0x04) len 16
        Random value: 32527e6e64e79f33b2e374394db8ab2d
> HCI Event: Number of Completed Packets (0x13) plen 5    #111 [hci1] 10.209046
        Num handles: 1
        Handle: 129 Address: DF:A9:FF:F6:B1:1A (OUI DF-A9-FF)
        Count: 1
        #110: len 21 (1 Kb/s)
        Latency: 157 msec (68-173 msec ~160 msec)
> ACL Data RX: Handle 129 flags 0x02 dlen 21              #112 [hci1] 10.296961
      SMP: Pairing Confirm (0x03) len 16
        Confim value: b0b463743f1fdcba94a39855434f0eb2
< HCI Command: Host Number of Com.. (0x03|0x0035) plen 5  #113 [hci1] 10.311428
        Num handles: 1
        Handle: 129 Address: DF:A9:FF:F6:B1:1A (OUI DF-A9-FF)
        Count: 1
< ACL Data TX: Handle 129 flags 0x00 dlen 21              #114 [hci1] 10.311672
      SMP: Pairing Confirm (0x03) len 16
        Confim value: d2876213434b2e7d02688efafcca7f26
> HCI Event: Number of Completed Packets (0x13) plen 5    #115 [hci1] 10.471800
        Num handles: 1
        Handle: 129 Address: DF:A9:FF:F6:B1:1A (OUI DF-A9-FF)
        Count: 1
        #114: len 21 (1 Kb/s)
        Latency: 160 msec (68-173 msec ~160 msec)
> ACL Data RX: Handle 129 flags 0x02 dlen 21              #116 [hci1] 10.472083
      SMP: Pairing Random (0x04) len 16
        Random value: e51ff607228883f70000000000000000
< HCI Command: Host Number of Com.. (0x03|0x0035) plen 5  #117 [hci1] 10.491821
        Num handles: 1
        Handle: 129 Address: DF:A9:FF:F6:B1:1A (OUI DF-A9-FF)
        Count: 1
< ACL Data TX: Handle 129 flags 0x00 dlen 21              #118 [hci1] 10.491931
      SMP: Pairing Random (0x04) len 16
        Random value: dddbdfe2838e9a8cc6964353c850fef7
> HCI Event: Number of Completed Packets (0x13) plen 5    #119 [hci1] 10.646618
        Num handles: 1
        Handle: 129 Address: DF:A9:FF:F6:B1:1A (OUI DF-A9-FF)
        Count: 1
        #118: len 21 (1 Kb/s)
        Latency: 154 msec (68-173 msec ~157 msec)
> ACL Data RX: Handle 129 flags 0x02 dlen 21              #120 [hci1] 10.734563
      SMP: Pairing Confirm (0x03) len 16
        Confim value: 11a7f6765e8d05ae2d3793a78182a803
< HCI Command: Host Number of Com.. (0x03|0x0035) plen 5  #121 [hci1] 10.751351
        Num handles: 1
        Handle: 129 Address: DF:A9:FF:F6:B1:1A (OUI DF-A9-FF)
        Count: 1
< ACL Data TX: Handle 129 flags 0x00 dlen 21              #122 [hci1] 10.751495
      SMP: Pairing Confirm (0x03) len 16
        Confim value: b38aba75cea142e15ed896c58343f7ab
> HCI Event: Number of Completed Packets (0x13) plen 5    #123 [hci1] 10.909279
        Num handles: 1
        Handle: 129 Address: DF:A9:FF:F6:B1:1A (OUI DF-A9-FF)
        Count: 1
        #122: len 21 (1 Kb/s)
        Latency: 157 msec (68-173 msec ~157 msec)
> ACL Data RX: Handle 129 flags 0x02 dlen 21              #124 [hci1] 10.909579
      SMP: Pairing Random (0x04) len 16
        Random value: 54d28c3d35c16b290000000000000000
< HCI Command: Host Number of Com.. (0x03|0x0035) plen 5  #125 [hci1] 10.911761
        Num handles: 1
        Handle: 129 Address: DF:A9:FF:F6:B1:1A (OUI DF-A9-FF)
        Count: 1
< ACL Data TX: Handle 129 flags 0x00 dlen 21              #126 [hci1] 10.911876
      SMP: Pairing Random (0x04) len 16
        Random value: eb9f1915536596b6fc3db1c86b2b1970
> HCI Event: Number of Completed Packets (0x13) plen 5    #127 [hci1] 11.084197
        Num handles: 1
        Handle: 129 Address: DF:A9:FF:F6:B1:1A (OUI DF-A9-FF)
        Count: 1
        #126: len 21 (0 Kb/s)
        Latency: 172 msec (68-173 msec ~164 msec)
> ACL Data RX: Handle 129 flags 0x02 dlen 21              #128 [hci1] 11.171894
      SMP: Pairing Confirm (0x03) len 16
        Confim value: 8507f930fc397629452fb09f1a9fd2ba
< HCI Command: Host Number of Com.. (0x03|0x0035) plen 5  #129 [hci1] 11.191582
        Num handles: 1
        Handle: 129 Address: DF:A9:FF:F6:B1:1A (OUI DF-A9-FF)
        Count: 1
< ACL Data TX: Handle 129 flags 0x00 dlen 21              #130 [hci1] 11.191821
      SMP: Pairing Confirm (0x03) len 16
        Confim value: 5622392964d0d6affd407696c7f59df0
> HCI Event: Number of Completed Packets (0x13) plen 5    #131 [hci1] 11.346899
        Num handles: 1
        Handle: 129 Address: DF:A9:FF:F6:B1:1A (OUI DF-A9-FF)
        Count: 1
        #130: len 21 (1 Kb/s)
        Latency: 155 msec (68-173 msec ~160 msec)
> ACL Data RX: Handle 129 flags 0x02 dlen 21              #132 [hci1] 11.347198
      SMP: Pairing Random (0x04) len 16
        Random value: 1a627174b08b646c0000000000000000
< HCI Command: Host Number of Com.. (0x03|0x0035) plen 5  #133 [hci1] 11.351644
        Num handles: 1
        Handle: 129 Address: DF:A9:FF:F6:B1:1A (OUI DF-A9-FF)
        Count: 1
< ACL Data TX: Handle 129 flags 0x00 dlen 21              #134 [hci1] 11.351795
      SMP: Pairing Random (0x04) len 16
        Random value: 5c794dc9ad9f2c3f295ebd5ad5e1c3cf
> HCI Event: Number of Completed Packets (0x13) plen 5    #135 [hci1] 11.521557
        Num handles: 1
        Handle: 129 Address: DF:A9:FF:F6:B1:1A (OUI DF-A9-FF)
        Count: 1
        #134: len 21 (0 Kb/s)
        Latency: 169 msec (68-173 msec ~164 msec)
> ACL Data RX: Handle 129 flags 0x02 dlen 21              #136 [hci1] 11.609477
      SMP: Pairing Confirm (0x03) len 16
        Confim value: cde38d1e9507664f9530a8ea2dab81c3
< HCI Command: Host Number of Com.. (0x03|0x0035) plen 5  #137 [hci1] 11.611500
        Num handles: 1
        Handle: 129 Address: DF:A9:FF:F6:B1:1A (OUI DF-A9-FF)
        Count: 1
< ACL Data TX: Handle 129 flags 0x00 dlen 21              #138 [hci1] 11.611749
      SMP: Pairing Confirm (0x03) len 16
        Confim value: 5069dd2387e8185ef86ec86a718488dc
> HCI Event: Number of Completed Packets (0x13) plen 5    #139 [hci1] 11.784275
        Num handles: 1
        Handle: 129 Address: DF:A9:FF:F6:B1:1A (OUI DF-A9-FF)
        Count: 1
        #138: len 21 (0 Kb/s)
        Latency: 172 msec (68-173 msec ~168 msec)
> ACL Data RX: Handle 129 flags 0x02 dlen 21              #140 [hci1] 11.784650
      SMP: Pairing Random (0x04) len 16
        Random value: 3bdf39673b39efe40000000000000000
< HCI Command: Host Number of Com.. (0x03|0x0035) plen 5  #141 [hci1] 11.791675
        Num handles: 1
        Handle: 129 Address: DF:A9:FF:F6:B1:1A (OUI DF-A9-FF)
        Count: 1
< ACL Data TX: Handle 129 flags 0x00 dlen 21              #142 [hci1] 11.791833
      SMP: Pairing Random (0x04) len 16
        Random value: 5c2fff312cdf99c9491988e877355a9a
> HCI Event: Number of Completed Packets (0x13) plen 5    #143 [hci1] 11.959085
        Num handles: 1
        Handle: 129 Address: DF:A9:FF:F6:B1:1A (OUI DF-A9-FF)
        Count: 1
        #142: len 21 (1 Kb/s)
        Latency: 167 msec (68-173 msec ~167 msec)
> ACL Data RX: Handle 129 flags 0x02 dlen 21              #144 [hci1] 12.046873
      SMP: Pairing Confirm (0x03) len 16
        Confim value: f43ae8bc8956301d841ce38c753845f1
< HCI Command: Host Number of Com.. (0x03|0x0035) plen 5  #145 [hci1] 12.051554
        Num handles: 1
        Handle: 129 Address: DF:A9:FF:F6:B1:1A (OUI DF-A9-FF)
        Count: 1
< ACL Data TX: Handle 129 flags 0x00 dlen 21              #146 [hci1] 12.051821
      SMP: Pairing Confirm (0x03) len 16
        Confim value: 79adeb39a7c56948d6f1997a11d22a28
> HCI Event: Number of Completed Packets (0x13) plen 5    #147 [hci1] 12.221782
        Num handles: 1
        Handle: 129 Address: DF:A9:FF:F6:B1:1A (OUI DF-A9-FF)
        Count: 1
        #146: len 21 (0 Kb/s)
        Latency: 169 msec (68-173 msec ~168 msec)
> ACL Data RX: Handle 129 flags 0x02 dlen 21              #148 [hci1] 12.222101
      SMP: Pairing Random (0x04) len 16
        Random value: 7b5d6fb8ccb100990000000000000000
< HCI Command: Host Number of Com.. (0x03|0x0035) plen 5  #149 [hci1] 12.231847
        Num handles: 1
        Handle: 129 Address: DF:A9:FF:F6:B1:1A (OUI DF-A9-FF)
        Count: 1
< ACL Data TX: Handle 129 flags 0x00 dlen 21              #150 [hci1] 12.232002
      SMP: Pairing Random (0x04) len 16
        Random value: c629a3a987d808e808655d558dfc1155
> HCI Event: Number of Completed Packets (0x13) plen 5    #151 [hci1] 12.396533
        Num handles: 1
        Handle: 129 Address: DF:A9:FF:F6:B1:1A (OUI DF-A9-FF)
        Count: 1
        #150: len 21 (1 Kb/s)
        Latency: 164 msec (68-173 msec ~166 msec)
> ACL Data RX: Handle 129 flags 0x02 dlen 21              #152 [hci1] 12.484370
      SMP: Pairing Confirm (0x03) len 16
        Confim value: 5f07388041d222d844a318e7af6694da
< HCI Command: Host Number of Com.. (0x03|0x0035) plen 5  #153 [hci1] 12.491563
        Num handles: 1
        Handle: 129 Address: DF:A9:FF:F6:B1:1A (OUI DF-A9-FF)
        Count: 1
< ACL Data TX: Handle 129 flags 0x00 dlen 21              #154 [hci1] 12.491847
      SMP: Pairing Confirm (0x03) len 16
        Confim value: a1ec4cfe5f2c7ea86883cc810c8914c2
> HCI Event: Number of Completed Packets (0x13) plen 5    #155 [hci1] 12.659234
        Num handles: 1
        Handle: 129 Address: DF:A9:FF:F6:B1:1A (OUI DF-A9-FF)
        Count: 1
        #154: len 21 (1 Kb/s)
        Latency: 167 msec (68-173 msec ~167 msec)
> ACL Data RX: Handle 129 flags 0x02 dlen 21              #156 [hci1] 12.659599
      SMP: Pairing Random (0x04) len 16
        Random value: 211da7c58b41203a0000000000000000
< HCI Command: Host Number of Com.. (0x03|0x0035) plen 5  #157 [hci1] 12.671905
        Num handles: 1
        Handle: 129 Address: DF:A9:FF:F6:B1:1A (OUI DF-A9-FF)
        Count: 1
< ACL Data TX: Handle 129 flags 0x00 dlen 21              #158 [hci1] 12.672076
      SMP: Pairing Random (0x04) len 16
        Random value: 92f20f6ad8f13724432c7fd6001c45ff
> HCI Event: Number of Completed Packets (0x13) plen 5    #159 [hci1] 12.834051
        Num handles: 1
        Handle: 129 Address: DF:A9:FF:F6:B1:1A (OUI DF-A9-FF)
        Count: 1
        #158: len 21 (1 Kb/s)
        Latency: 161 msec (68-173 msec ~164 msec)
> ACL Data RX: Handle 129 flags 0x02 dlen 21              #160 [hci1] 12.921982
      SMP: Pairing Confirm (0x03) len 16
        Confim value: 7d148541cdb7a23f71db36cb44f57f63
< HCI Command: Host Number of Com.. (0x03|0x0035) plen 5  #161 [hci1] 12.931331
        Num handles: 1
        Handle: 129 Address: DF:A9:FF:F6:B1:1A (OUI DF-A9-FF)
        Count: 1
< ACL Data TX: Handle 129 flags 0x00 dlen 21              #162 [hci1] 12.931501
      SMP: Pairing Confirm (0x03) len 16
        Confim value: 675b95d931682d59fa627e808ea93cf0
> HCI Event: Number of Completed Packets (0x13) plen 5    #163 [hci1] 13.096771
        Num handles: 1
        Handle: 129 Address: DF:A9:FF:F6:B1:1A (OUI DF-A9-FF)
        Count: 1
        #162: len 21 (1 Kb/s)
        Latency: 165 msec (68-173 msec ~164 msec)
> ACL Data RX: Handle 129 flags 0x02 dlen 21              #164 [hci1] 13.097045
      SMP: Pairing Random (0x04) len 16
        Random value: 808c9af7201776420000000000000000
< HCI Command: Host Number of Com.. (0x03|0x0035) plen 5  #165 [hci1] 13.111389
        Num handles: 1
        Handle: 129 Address: DF:A9:FF:F6:B1:1A (OUI DF-A9-FF)
        Count: 1
< ACL Data TX: Handle 129 flags 0x00 dlen 21              #166 [hci1] 13.111422
      SMP: Pairing Random (0x04) len 16
        Random value: 23ac32ebbb5e14c8a6b9622f296d277f
> HCI Event: Number of Completed Packets (0x13) plen 5    #167 [hci1] 13.271553
        Num handles: 1
        Handle: 129 Address: DF:A9:FF:F6:B1:1A (OUI DF-A9-FF)
        Count: 1
        #166: len 21 (1 Kb/s)
        Latency: 160 msec (68-173 msec ~162 msec)
> ACL Data RX: Handle 129 flags 0x02 dlen 21              #168 [hci1] 13.359323
      SMP: Pairing Confirm (0x03) len 16
        Confim value: 24af4b058aeae61dc11e107e823c044d
< HCI Command: Host Number of Com.. (0x03|0x0035) plen 5  #169 [hci1] 13.371234
        Num handles: 1
        Handle: 129 Address: DF:A9:FF:F6:B1:1A (OUI DF-A9-FF)
        Count: 1
< ACL Data TX: Handle 129 flags 0x00 dlen 21              #170 [hci1] 13.371414
      SMP: Pairing Confirm (0x03) len 16
        Confim value: 2586b16798a33d698ee2545b6e030776
> HCI Event: Number of Completed Packets (0x13) plen 5    #171 [hci1] 13.534245
        Num handles: 1
        Handle: 129 Address: DF:A9:FF:F6:B1:1A (OUI DF-A9-FF)
        Count: 1
        #170: len 21 (1 Kb/s)
        Latency: 162 msec (68-173 msec ~162 msec)
> ACL Data RX: Handle 129 flags 0x02 dlen 21              #172 [hci1] 13.534557
      SMP: Pairing Random (0x04) len 16
        Random value: ef2f7909aded7add0000000000000000
< HCI Command: Host Number of Com.. (0x03|0x0035) plen 5  #173 [hci1] 13.551802
        Num handles: 1
        Handle: 129 Address: DF:A9:FF:F6:B1:1A (OUI DF-A9-FF)
        Count: 1
< ACL Data TX: Handle 129 flags 0x00 dlen 21              #174 [hci1] 13.551959
      SMP: Pairing Random (0x04) len 16
        Random value: 297efe85e67448a15f56bd27e3a3cf1d
> HCI Event: Number of Completed Packets (0x13) plen 5    #175 [hci1] 13.709056
        Num handles: 1
        Handle: 129 Address: DF:A9:FF:F6:B1:1A (OUI DF-A9-FF)
        Count: 1
        #174: len 21 (1 Kb/s)
        Latency: 157 msec (68-173 msec ~159 msec)
> ACL Data RX: Handle 129 flags 0x02 dlen 21              #176 [hci1] 13.796882
      SMP: Pairing Confirm (0x03) len 16
        Confim value: fdb3f5cdff7e7a94a84285e774935485
< HCI Command: Host Number of Com.. (0x03|0x0035) plen 5  #177 [hci1] 13.811677
        Num handles: 1
        Handle: 129 Address: DF:A9:FF:F6:B1:1A (OUI DF-A9-FF)
        Count: 1
< ACL Data TX: Handle 129 flags 0x00 dlen 21              #178 [hci1] 13.811947
      SMP: Pairing Confirm (0x03) len 16
        Confim value: ad4017e02a5ce9ac7920ef9dcfef276c
> HCI Event: Number of Completed Packets (0x13) plen 5    #179 [hci1] 13.971713
        Num handles: 1
        Handle: 129 Address: DF:A9:FF:F6:B1:1A (OUI DF-A9-FF)
        Count: 1
        #178: len 21 (1 Kb/s)
        Latency: 159 msec (68-173 msec ~159 msec)
> ACL Data RX: Handle 129 flags 0x02 dlen 21              #180 [hci1] 13.972095
      SMP: Pairing Random (0x04) len 16
        Random value: e78d5268e4d04e010000000000000000
< HCI Command: Host Number of Com.. (0x03|0x0035) plen 5  #181 [hci1] 13.991681
        Num handles: 1
        Handle: 129 Address: DF:A9:FF:F6:B1:1A (OUI DF-A9-FF)
        Count: 1
< ACL Data TX: Handle 129 flags 0x00 dlen 21              #182 [hci1] 13.991859
      SMP: Pairing Random (0x04) len 16
        Random value: 25a9493fd3ce4faf02be7293595bb7c6
> HCI Event: Number of Completed Packets (0x13) plen 5    #183 [hci1] 14.146540
        Num handles: 1
        Handle: 129 Address: DF:A9:FF:F6:B1:1A (OUI DF-A9-FF)
        Count: 1
        #182: len 21 (1 Kb/s)
        Latency: 154 msec (68-173 msec ~157 msec)
> ACL Data RX: Handle 129 flags 0x02 dlen 21              #184 [hci1] 14.234314
      SMP: Pairing Confirm (0x03) len 16
        Confim value: d38ac25d48ca97de52bb17d19914223a
< HCI Command: Host Number of Com.. (0x03|0x0035) plen 5  #185 [hci1] 14.251563
        Num handles: 1
        Handle: 129 Address: DF:A9:FF:F6:B1:1A (OUI DF-A9-FF)
        Count: 1
< ACL Data TX: Handle 129 flags 0x00 dlen 21              #186 [hci1] 14.251775
      SMP: Pairing Confirm (0x03) len 16
        Confim value: c4dbb4aee7600fb02a6c2fae7480f099
> HCI Event: Number of Completed Packets (0x13) plen 5    #187 [hci1] 14.409198
        Num handles: 1
        Handle: 129 Address: DF:A9:FF:F6:B1:1A (OUI DF-A9-FF)
        Count: 1
        #186: len 21 (1 Kb/s)
        Latency: 157 msec (68-173 msec ~157 msec)
> ACL Data RX: Handle 129 flags 0x02 dlen 21              #188 [hci1] 14.409564
      SMP: Pairing Random (0x04) len 16
        Random value: a8f4f532ba460f180000000000000000
< HCI Command: Host Number of Com.. (0x03|0x0035) plen 5  #189 [hci1] 14.411659
        Num handles: 1
        Handle: 129 Address: DF:A9:FF:F6:B1:1A (OUI DF-A9-FF)
        Count: 1
< ACL Data TX: Handle 129 flags 0x00 dlen 21              #190 [hci1] 14.411757
      SMP: Pairing Random (0x04) len 16
        Random value: 58f6b41f855a6f6c3560debd84e2affc
> HCI Event: Number of Completed Packets (0x13) plen 5    #191 [hci1] 14.583924
        Num handles: 1
        Handle: 129 Address: DF:A9:FF:F6:B1:1A (OUI DF-A9-FF)
        Count: 1
        #190: len 21 (0 Kb/s)
        Latency: 172 msec (68-173 msec ~164 msec)
> ACL Data RX: Handle 129 flags 0x02 dlen 21              #192 [hci1] 14.671796
      SMP: Pairing Confirm (0x03) len 16
        Confim value: 65aa3e5fabc7f12020e207a306519b5f
< HCI Command: Host Number of Com.. (0x03|0x0035) plen 5  #193 [hci1] 14.691410
        Num handles: 1
        Handle: 129 Address: DF:A9:FF:F6:B1:1A (OUI DF-A9-FF)
        Count: 1
< ACL Data TX: Handle 129 flags 0x00 dlen 21              #194 [hci1] 14.691584
      SMP: Pairing Confirm (0x03) len 16
        Confim value: 3cee80dd96f74993d621a77dc06dbb14
> HCI Event: Number of Completed Packets (0x13) plen 5    #195 [hci1] 14.846721
        Num handles: 1
        Handle: 129 Address: DF:A9:FF:F6:B1:1A (OUI DF-A9-FF)
        Count: 1
        #194: len 21 (1 Kb/s)
        Latency: 155 msec (68-173 msec ~159 msec)
> ACL Data RX: Handle 129 flags 0x02 dlen 21              #196 [hci1] 14.846967
      SMP: Pairing Random (0x04) len 16
        Random value: 9a8ac6ebca9752f60000000000000000
< HCI Command: Host Number of Com.. (0x03|0x0035) plen 5  #197 [hci1] 14.851472
        Num handles: 1
        Handle: 129 Address: DF:A9:FF:F6:B1:1A (OUI DF-A9-FF)
        Count: 1
< ACL Data TX: Handle 129 flags 0x00 dlen 21              #198 [hci1] 14.851593
      SMP: Pairing Random (0x04) len 16
        Random value: b67e7216d5bf664139eda2b542549666
> HCI Event: Number of Completed Packets (0x13) plen 5    #199 [hci1] 15.021446
        Num handles: 1
        Handle: 129 Address: DF:A9:FF:F6:B1:1A (OUI DF-A9-FF)
        Count: 1
        #198: len 21 (0 Kb/s)
        Latency: 169 msec (68-173 msec ~164 msec)
> ACL Data RX: Handle 129 flags 0x02 dlen 21              #200 [hci1] 15.109283
      SMP: Pairing Confirm (0x03) len 16
        Confim value: c90b3ddfb886de54dda0dcb493ddabec
< HCI Command: Host Number of Com.. (0x03|0x0035) plen 5  #201 [hci1] 15.111611
        Num handles: 1
        Handle: 129 Address: DF:A9:FF:F6:B1:1A (OUI DF-A9-FF)
        Count: 1
< ACL Data TX: Handle 129 flags 0x00 dlen 21              #202 [hci1] 15.111874
      SMP: Pairing Confirm (0x03) len 16
        Confim value: 9b2edaf74f8464d44b0475dc52cadd17
> HCI Event: Number of Completed Packets (0x13) plen 5    #203 [hci1] 15.284145
        Num handles: 1
        Handle: 129 Address: DF:A9:FF:F6:B1:1A (OUI DF-A9-FF)
        Count: 1
        #202: len 21 (0 Kb/s)
        Latency: 172 msec (68-173 msec ~168 msec)
> ACL Data RX: Handle 129 flags 0x02 dlen 21              #204 [hci1] 15.284530
      SMP: Pairing Random (0x04) len 16
        Random value: aa6b88fffc77f2b90000000000000000
< HCI Command: Host Number of Com.. (0x03|0x0035) plen 5  #205 [hci1] 15.291877
        Num handles: 1
        Handle: 129 Address: DF:A9:FF:F6:B1:1A (OUI DF-A9-FF)
        Count: 1
< ACL Data TX: Handle 129 flags 0x00 dlen 21              #206 [hci1] 15.291981
      SMP: Pairing Random (0x04) len 16
        Random value: ed17f76500c95219dd01e09d1e63f87b
> HCI Event: Number of Completed Packets (0x13) plen 5    #207 [hci1] 15.458953
        Num handles: 1
        Handle: 129 Address: DF:A9:FF:F6:B1:1A (OUI DF-A9-FF)
        Count: 1
        #206: len 21 (1 Kb/s)
        Latency: 166 msec (68-173 msec ~167 msec)
> ACL Data RX: Handle 129 flags 0x02 dlen 21              #208 [hci1] 15.546828
      SMP: Pairing Confirm (0x03) len 16
        Confim value: fa9f010f28f61361f102fb5f372ca0d9
< HCI Command: Host Number of Com.. (0x03|0x0035) plen 5  #209 [hci1] 15.551483
        Num handles: 1
        Handle: 129 Address: DF:A9:FF:F6:B1:1A (OUI DF-A9-FF)
        Count: 1
< ACL Data TX: Handle 129 flags 0x00 dlen 21              #210 [hci1] 15.551696
      SMP: Pairing Confirm (0x03) len 16
        Confim value: 189d8dc165522fb6b2d16269b80815c7
> HCI Event: Number of Completed Packets (0x13) plen 5    #211 [hci1] 15.721702
        Num handles: 1
        Handle: 129 Address: DF:A9:FF:F6:B1:1A (OUI DF-A9-FF)
        Count: 1
        #210: len 21 (0 Kb/s)
        Latency: 170 msec (68-173 msec ~168 msec)
> ACL Data RX: Handle 129 flags 0x02 dlen 21              #212 [hci1] 15.722000
      SMP: Pairing Random (0x04) len 16
        Random value: 7deedb7d01d2e7d00000000000000000
< HCI Command: Host Number of Com.. (0x03|0x0035) plen 5  #213 [hci1] 15.731289
        Num handles: 1
        Handle: 129 Address: DF:A9:FF:F6:B1:1A (OUI DF-A9-FF)
        Count: 1
< ACL Data TX: Handle 129 flags 0x00 dlen 21              #214 [hci1] 15.731353
      SMP: Pairing Random (0x04) len 16
        Random value: 81d35d47e1f6006d79c974bd9d9e1ee3
> HCI Event: Number of Completed Packets (0x13) plen 5    #215 [hci1] 15.896434
        Num handles: 1
        Handle: 129 Address: DF:A9:FF:F6:B1:1A (OUI DF-A9-FF)
        Count: 1
        #214: len 21 (1 Kb/s)
        Latency: 165 msec (68-173 msec ~166 msec)
> ACL Data RX: Handle 129 flags 0x02 dlen 21              #216 [hci1] 15.984251
      SMP: Pairing Confirm (0x03) len 16
        Confim value: dfc83eb025c409c73db398cbaca821e3
< HCI Command: Host Number of Com.. (0x03|0x0035) plen 5  #217 [hci1] 15.991713
        Num handles: 1
        Handle: 129 Address: DF:A9:FF:F6:B1:1A (OUI DF-A9-FF)
        Count: 1
< ACL Data TX: Handle 129 flags 0x00 dlen 21              #218 [hci1] 15.991913
      SMP: Pairing Confirm (0x03) len 16
        Confim value: 113b9a2ca3dadd6fe2236459a5e98608
> HCI Event: Number of Completed Packets (0x13) plen 5    #219 [hci1] 16.159118
        Num handles: 1
        Handle: 129 Address: DF:A9:FF:F6:B1:1A (OUI DF-A9-FF)
        Count: 1
        #218: len 21 (1 Kb/s)
        Latency: 167 msec (68-173 msec ~167 msec)
> ACL Data RX: Handle 129 flags 0x02 dlen 21              #220 [hci1] 16.159515
      SMP: Pairing Random (0x04) len 16
        Random value: 9a9db1c81f493ad70000000000000000
< HCI Command: Host Number of Com.. (0x03|0x0035) plen 5  #221 [hci1] 16.171931
        Num handles: 1
        Handle: 129 Address: DF:A9:FF:F6:B1:1A (OUI DF-A9-FF)
        Count: 1
< ACL Data TX: Handle 129 flags 0x00 dlen 21              #222 [hci1] 16.172018
      SMP: Pairing Random (0x04) len 16
        Random value: e7f7e0c2476823e41736a7e381bafb7c
> HCI Event: Number of Completed Packets (0x13) plen 5    #223 [hci1] 16.333918
        Num handles: 1
        Handle: 129 Address: DF:A9:FF:F6:B1:1A (OUI DF-A9-FF)
        Count: 1
        #222: len 21 (1 Kb/s)
        Latency: 161 msec (68-173 msec ~164 msec)
> ACL Data RX: Handle 129 flags 0x02 dlen 21              #224 [hci1] 16.421779
      SMP: Pairing Confirm (0x03) len 16
        Confim value: 735a55bf4f7600a09ba90b43872060a1
< HCI Command: Host Number of Com.. (0x03|0x0035) plen 5  #225 [hci1] 16.431535
        Num handles: 1
        Handle: 129 Address: DF:A9:FF:F6:B1:1A (OUI DF-A9-FF)
        Count: 1
< ACL Data TX: Handle 129 flags 0x00 dlen 21              #226 [hci1] 16.431721
      SMP: Pairing Confirm (0x03) len 16
        Confim value: cc3413eb3f32cc79f081edc03de96776
> HCI Event: Number of Completed Packets (0x13) plen 5    #227 [hci1] 16.596631
        Num handles: 1
        Handle: 129 Address: DF:A9:FF:F6:B1:1A (OUI DF-A9-FF)
        Count: 1
        #226: len 21 (1 Kb/s)
        Latency: 164 msec (68-173 msec ~164 msec)
> ACL Data RX: Handle 129 flags 0x02 dlen 21              #228 [hci1] 16.596908
      SMP: Pairing Random (0x04) len 16
        Random value: 41a803fb436c03760000000000000000
< HCI Command: Host Number of Com.. (0x03|0x0035) plen 5  #229 [hci1] 16.611653
        Num handles: 1
        Handle: 129 Address: DF:A9:FF:F6:B1:1A (OUI DF-A9-FF)
        Count: 1
