Bluetooth monitor ver 5.72
= Note: Linux version 6.14.0-36-generic (x86_64)                       0.160521
= Note: Bluetooth subsystem version 2.22                               0.160523
= New Index: 00:00:00:00:00:00 (Primary,UART,hci1)              [hci1] 0.160524
= New Index: 48:5F:99:8E:E0:64 (Primary,USB,hci0)               [hci0] 0.160525
= Open Index: 00:00:00:00:00:00                                 [hci1] 0.674310
= Index Info: 00:00:00:00:00:00 (Nordic Semiconductor ASA)      [hci1] 0.674327
@ USER Open: main (privileged) version 2.22            {0x0001} [hci1] 0.674338
< HCI Command: Reset (0x03|0x0003) plen 0                    #1 [hci1] 0.675586
> HCI Event: Command Complete (0x0e) plen 4                  #2 [hci1] 0.676150
      Reset (0x03|0x0003) ncmd 1
        Status: Success (0x00)
< HCI Command: Read Local Supported... (0x04|0x0003) plen 0  #3 [hci1] 0.693956
> HCI Event: Command Complete (0x0e) plen 12                 #4 [hci1] 0.694488
      Read Local Supported Features (0x04|0x0003) ncmd 1
        Status: Success (0x00)
        Features: 0x00 0x00 0x00 0x00 0x60 0x00 0x00 0x00
          BR/EDR Not Supported
          LE Supported (Controller)
< HCI Command: Read Local Version In.. (0x04|0x0001) plen 0  #5 [hci1] 0.713799
> HCI Event: Command Complete (0x0e) plen 12                 #6 [hci1] 0.714274
      Read Local Version Information (0x04|0x0001) ncmd 1
        Status: Success (0x00)
        HCI version: Reserved (0x0f) - Revision 12393 (0x3069)
        LMP version: Reserved (0x0f) - Subversion 12393 (0x3069)
        Manufacturer: Nordic Semiconductor ASA (89)
< HCI Command: Read Local Supported... (0x04|0x0002) plen 0  #7 [hci1] 0.733761
> HCI Event: Command Complete (0x0e) plen 68                 #8 [hci1] 0.734927
      Read Local Supported Commands (0x04|0x0002) ncmd 1
        Status: Success (0x00)
        Commands: 119 entries
          Disconnect (Octet 0 - Bit 5)
          Read Remote Version Information (Octet 2 - Bit 7)
          Set Event Mask (Octet 5 - Bit 6)
          Reset (Octet 5 - Bit 7)
          Read Connection Accept Timeout (Octet 7 - Bit 2)
          Write Connection Accept Timeout (Octet 7 - Bit 3)
          Read Transmit Power Level (Octet 10 - Bit 2)
          Set Controller To Host Flow Control (Octet 10 - Bit 5)
          Host Buffer Size (Octet 10 - Bit 6)
          Host Number of Completed Packets (Octet 10 - Bit 7)
          Read Local Version Information (Octet 14 - Bit 3)
          Read Local Supported Features (Octet 14 - Bit 5)
          Read BD ADDR (Octet 15 - Bit 1)
          Read RSSI (Octet 15 - Bit 5)
          Set Event Mask Page 2 (Octet 22 - Bit 2)
          LE Set Event Mask (Octet 25 - Bit 0)
          LE Read Buffer Size (Octet 25 - Bit 1)
          LE Read Local Supported Features (Octet 25 - Bit 2)
          LE Set Random Address (Octet 25 - Bit 4)
          LE Set Advertising Parameters (Octet 25 - Bit 5)
          LE Read Advertising Channel TX Power (Octet 25 - Bit 6)
          LE Set Advertising Data (Octet 25 - Bit 7)
          LE Set Scan Response Data (Octet 26 - Bit 0)
          LE Set Advertise Enable (Octet 26 - Bit 1)
          LE Set Scan Parameters (Octet 26 - Bit 2)
          LE Set Scan Enable (Octet 26 - Bit 3)
          LE Create Connection (Octet 26 - Bit 4)
          LE Create Connection Cancel (Octet 26 - Bit 5)
          LE Read Accept List Size (Octet 26 - Bit 6)
          LE Clear Accept List (Octet 26 - Bit 7)
          LE Add Device To Accept List (Octet 27 - Bit 0)
          LE Remove Device From Accept List (Octet 27 - Bit 1)
          LE Connection Update (Octet 27 - Bit 2)
          LE Set Host Channel Classification (Octet 27 - Bit 3)
          LE Read Channel Map (Octet 27 - Bit 4)
          LE Read Remote Used Features (Octet 27 - Bit 5)
          LE Encrypt (Octet 27 - Bit 6)
          LE Rand (Octet 27 - Bit 7)
          LE Start Encryption (Octet 28 - Bit 0)
          LE Long Term Key Request Reply (Octet 28 - Bit 1)
          LE Long Term Key Request Neg Reply (Octet 28 - Bit 2)
          LE Read Supported States (Octet 28 - Bit 3)
          LE Receiver Test (Octet 28 - Bit 4)
          LE Transmitter Test (Octet 28 - Bit 5)
          LE Test End (Octet 28 - Bit 6)
          Read Authenticated Payload Timeout (Octet 32 - Bit 4)
          Write Authenticated Payload Timeout (Octet 32 - Bit 5)
          LE Set Data Length (Octet 33 - Bit 6)
          LE Read Suggested Default Data Length (Octet 33 - Bit 7)
          LE Write Suggested Default Data Length (Octet 34 - Bit 0)
          LE Add Device To Resolving List (Octet 34 - Bit 3)
          LE Remove Device From Resolving List (Octet 34 - Bit 4)
          LE Clear Resolving List (Octet 34 - Bit 5)
          LE Read Resolving List Size (Octet 34 - Bit 6)
          LE Set Address Resolution Enable (Octet 35 - Bit 1)
          LE Set Resolvable Private Address Timeout (Octet 35 - Bit 2)
          LE Read Maximum Data Length (Octet 35 - Bit 3)
          LE Read PHY (Octet 35 - Bit 4)
          LE Set Default PHY (Octet 35 - Bit 5)
          LE Set PHY (Octet 35 - Bit 6)
          LE Enhanced Receiver Test (Octet 35 - Bit 7)
          LE Enhanced Transmitter Test (Octet 36 - Bit 0)
          LE Set Advertising Set Random Address (Octet 36 - Bit 1)
          LE Set Extended Advertising Parameters (Octet 36 - Bit 2)
          LE Set Extended Advertising Data (Octet 36 - Bit 3)
          LE Set Extended Scan Response Data (Octet 36 - Bit 4)
          LE Set Extended Advertising Enable (Octet 36 - Bit 5)
          LE Read Maximum Advertising Data Length (Octet 36 - Bit 6)
          LE Read Number of Supported Advertising Sets (Octet 36 - Bit 7)
          LE Remove Advertising Set (Octet 37 - Bit 0)
          LE Clear Advertising Sets (Octet 37 - Bit 1)
          LE Set Periodic Advertising Parameters (Octet 37 - Bit 2)
          LE Set Periodic Advertising Data (Octet 37 - Bit 3)
          LE Set Periodic Advertising Enable (Octet 37 - Bit 4)
          LE Set Extended Scan Parameters (Octet 37 - Bit 5)
          LE Set Extended Scan Enable (Octet 37 - Bit 6)
          LE Extended Create Connection (Octet 37 - Bit 7)
          LE Periodic Advertising Create Sync (Octet 38 - Bit 0)
          LE Periodic Advertising Create Sync Cancel (Octet 38 - Bit 1)
          LE Periodic Advertising Terminate Sync (Octet 38 - Bit 2)
          LE Add Device To Periodic Advertiser List (Octet 38 - Bit 3)
          LE Remove Device From Periodic Advertiser List (Octet 38 - Bit 4)
          LE Clear Periodic Advertiser List (Octet 38 - Bit 5)
          LE Read Periodic Advertiser List Size (Octet 38 - Bit 6)
          LE Read Transmit Power (Octet 38 - Bit 7)
          LE Read RF Path Compensation (Octet 39 - Bit 0)
          LE Write RF Path Compensation (Octet 39 - Bit 1)
          LE Set Privacy Mode (Octet 39 - Bit 2)
          LE Periodic Advertising Receive Enable (Octet 40 - Bit 5)
          LE Periodic Advertising Sync Transfer (Octet 40 - Bit 6)
          LE Periodic Advertising Set Info Transfer (Octet 40 - Bit 7)
          LE Periodic Advertising Sync Transfer Parameters (Octet 41 - Bit 0)
          LE Set Default Periodic Advertisng Sync Transfer Parameters (Octet 41 - Bit 1)
          LE Read Buffer v2 (Octet 41 - Bit 5)
          LE Read ISO TX Sync (Octet 41 - Bit 6)
          LE Set Connected Isochronous Group Parameters (Octet 41 - Bit 7)
          LE Set Connected Isochronous Group Parameters Test (Octet 42 - Bit 0)
          LE Create Connected Isochronous Stream (Octet 42 - Bit 1)
          LE Remove Connected Isochronous Group (Octet 42 - Bit 2)
          LE Accept Connected Isochronous Stream Request (Octet 42 - Bit 3)
          LE Reject Connected Isochronous Stream Request (Octet 42 - Bit 4)
          LE Create Broadcast Isochronous Group (Octet 42 - Bit 5)
          LE Create Broadcast Isochronous Group Test (Octet 42 - Bit 6)
          LE Terminate Broadcast Isochronous Group (Octet 42 - Bit 7)
          LE Broadcast Isochronous Group Create Sync (Octet 43 - Bit 0)
          LE Broadcast Isochronous Group Terminate Sync (Octet 43 - Bit 1)
          LE Request Peer SCA (Octet 43 - Bit 2)
          LE Setup Isochronous Data Path (Octet 43 - Bit 3)
          LE Remove Isochronous Data Path (Octet 43 - Bit 4)
          LE Isochronous Transmit Test (Octet 43 - Bit 5)
          LE Isochronous Receive Test (Octet 43 - Bit 6)
          LE Isochronous Read Test Counters (Octet 43 - Bit 7)
          LE Isochronous Read Test Counters (Octet 44 - Bit 0)
          LE Set Host Feature (Octet 44 - Bit 1)
          Octet 44 - Bit 2 
          Octet 45 - Bit 6 
          Octet 46 - Bit 0 
          Octet 46 - Bit 1 
          Octet 46 - Bit 2 
< HCI Command: Host Buffer Size (0x03|0x0033) plen 7         #9 [hci1] 0.753762
        ACL MTU: 255  ACL max packet: 16
        SCO MTU: 0    SCO max packet: 0
> HCI Event: Command Complete (0x0e) plen 4                 #10 [hci1] 0.754227
      Host Buffer Size (0x03|0x0033) ncmd 1
        Status: Success (0x00)
< HCI Command: Set Controller To Ho.. (0x03|0x0031) plen 1  #11 [hci1] 0.773798
        Flow control: ACL Data Packets (0x01)
> HCI Event: Command Complete (0x0e) plen 4                 #12 [hci1] 0.774239
      Set Controller To Host Flow Control (0x03|0x0031) ncmd 1
        Status: Success (0x00)
< HCI Command: LE Read Local Suppor.. (0x08|0x0003) plen 0  #13 [hci1] 0.793763
> HCI Event: Command Complete (0x0e) plen 12                #14 [hci1] 0.794248
      LE Read Local Supported Features (0x08|0x0003) ncmd 1
        Status: Success (0x00)
        Features: 0xfd 0x79 0x00 0xf7 0x30 0x01 0x00 0x00
          LE Encryption
          Extended Reject Indication
          Peripheral-initiated Features Exchange
          LE Ping
          LE Data Packet Length Extension
          LL Privacy
          Extended Scanner Filter Policies
          LE 2M PHY
          LE Coded PHY
          LE Extended Advertising
          LE Periodic Advertising
          Channel Selection Algorithm #2
          Periodic Advertising Sync Transfer - Sender
          Periodic Advertising Sync Transfer - Recipient
          Sleep Clock Accuracy Updates
          Connected Isochronous Stream - Central
          Connected Isochronous Stream - Peripheral
          Isochronous Broadcaster
          Synchronized Receiver
          Periodic Advertising ADI support
          Connection Subrating
          Unknown features (0x0000010000000000)
< HCI Command: LE Set Host Feature (0x08|0x0074) plen 2     #15 [hci1] 0.813778
        Bit Number: 32
          Connected Isochronous Stream (Host Support)
        Bit Value: 1
> HCI Event: Command Complete (0x0e) plen 4                 #16 [hci1] 0.814205
      LE Set Host Feature (0x08|0x0074) ncmd 1
        Status: Success (0x00)
< HCI Command: LE Read Buffer v2 (0x08|0x0060) plen 0       #17 [hci1] 0.833760
> HCI Event: Command Complete (0x0e) plen 10                #18 [hci1] 0.834207
      LE Read Buffer v2 (0x08|0x0060) ncmd 1
        Status: Success (0x00)
        ACL MTU: 27
        ACL max packet: 3
        ISO MTU: 318
        ISO max packet: 3
< HCI Command: LE Read Maximum Adve.. (0x08|0x003a) plen 0  #19 [hci1] 0.853790
> HCI Event: Command Complete (0x0e) plen 6                 #20 [hci1] 0.854232
      LE Read Maximum Advertising Data Length (0x08|0x003a) ncmd 1
        Status: Success (0x00)
        Max length: 1650
< HCI Command: LE Read Supported St.. (0x08|0x001c) plen 0  #21 [hci1] 0.873773
> HCI Event: Command Complete (0x0e) plen 12                #22 [hci1] 0.874249
      LE Read Supported States (0x08|0x001c) ncmd 1
        Status: Success (0x00)
        States: 0x000003ff3e0306ff
          Non-connectable Advertising State
          Scannable Advertising State
          Connectable Advertising State
          High Duty Cycle Directed Advertising State
          Passive Scanning State
          Active Scanning State
          Initiating State
            and Connection State (Central Role)
          Connection State (Peripheral Role)
          Scannable Advertising State
            and Passive Scanning State
          Connectable Advertising State
            and Passive Scanning State
          Non-connectable Advertising State
            and Initiating State
          Scannable Advertising State
            and Initiating State
          Active Scanning State
            and Connection State (Central Role)
          Passive Scanning State
            and Connection State (Peripheral Role)
          Active Scanning State
            and Connection State (Peripheral Role)
          Initiating State
            and Connection State (Central Role)
            and Central Role & Central Role
          Low Duty Cycle Directed Advertising State
          Connectable Advertising State
            and Initiating State
            and Central Role & Peripheral Role
          High Duty Cycle Directed Advertising State
            and Initiating State
            and Central Role & Peripheral Role
          Low Duty Cycle Directed Advertising State
            and Initiating State
            and Central Role & Peripheral Role
          Connectable Advertising State
            and Connection State (Central Role)
            and Central Role & Peripheral Role
          High Duty Cycle Directed Advertising State
            and Connection State (Central Role)
            and Central Role & Peripheral Role
          Low Duty Cycle Directed Advertising State
            and Connection State (Central Role)
            and Central Role & Peripheral Role
          Connectable Advertising State
            and Connection State (Peripheral Role)
            and Central Role & Peripheral Role
          High Duty Cycle Directed Advertising State
            and Connection State (Peripheral Role)
            and Peripheral Role & Peripheral Role
          Low Duty Cycle Directed Advertising State
            and Connection State (Peripheral Role)
            and Peripheral Role & Peripheral Role
          Initiating State
            and Connection State (Peripheral Role)
            and Central Role & Peripheral Role
< HCI Command: LE Read Maximum Data.. (0x08|0x002f) plen 0  #23 [hci1] 0.893766
> HCI Event: Command Complete (0x0e) plen 12                #24 [hci1] 0.894228
      LE Read Maximum Data Length (0x08|0x002f) ncmd 1
        Status: Success (0x00)
        Max TX octets: 251
        Max TX time: 2704
        Max RX octets: 251
        Max RX time: 2704
< HCI Command: LE Write Suggested D.. (0x08|0x0024) plen 4  #25 [hci1] 0.913762
        TX octets: 251
        TX time: 2704
> HCI Event: Command Complete (0x0e) plen 4                 #26 [hci1] 0.914214
      LE Write Suggested Default Data Length (0x08|0x0024) ncmd 1
        Status: Success (0x00)
< HCI Command: LE Read Resolving Li.. (0x08|0x002a) plen 0  #27 [hci1] 0.933775
> HCI Event: Command Complete (0x0e) plen 5                 #28 [hci1] 0.934143
      LE Read Resolving List Size (0x08|0x002a) ncmd 1
        Status: Success (0x00)
        Size: 8
< HCI Command: LE Set Event Mask (0x08|0x0001) plen 8       #29 [hci1] 0.953763
        Mask: 0x000002023f87fa5e
          LE Advertising Report
          LE Connection Update Complete
          LE Read Remote Used Features Complete
          LE Long Term Key Request
          LE Data Length Change
          LE Enhanced Connection Complete
          LE PHY Update Complete
          LE Extended Advertising Report
          LE Periodic Advertising Sync Established
          LE Periodic Advertising Report
          LE Periodic Advertising Sync Lost
          LE Extended Scan Timeout
          LE Extended Advertising Set Terminated
          LE Scan Request Received
          LE Periodic Advertising Sync Transfer Rvc
          LE CIS Established
          LE CIS Request
          LE Create BIG Complete
          LE Terminate BIG Complete
          LE BIG Sync Estabilished Complete
          LE BIG Sync Lost
          LE BIG Info Advertising Report
          Unknown mask (0x0000020000000000)
> HCI Event: Command Complete (0x0e) plen 4                 #30 [hci1] 0.954291
      LE Set Event Mask (0x08|0x0001) ncmd 1
        Status: Success (0x00)
< HCI Command: Set Event Mask (0x03|0x0001) plen 8          #31 [hci1] 0.973773
        Mask: 0x2000800002008890
          Disconnection Complete
          Encryption Change
          Read Remote Version Information Complete
          Hardware Error
          Data Buffer Overflow
          Encryption Key Refresh Complete
          LE Meta
> HCI Event: Command Complete (0x0e) plen 4                 #32 [hci1] 0.974308
      Set Event Mask (0x03|0x0001) ncmd 1
        Status: Success (0x00)
< HCI Command: Read BD ADDR (0x04|0x0009) plen 0            #33 [hci1] 0.993765
> HCI Event: Command Complete (0x0e) plen 10                #34 [hci1] 0.994306
      Read BD ADDR (0x04|0x0009) ncmd 1
        Status: Success (0x00)
        Address: 00:00:00:00:00:00 (OUI 00-00-00)
< HCI Command: LE Set Random Address (0x08|0x0005) plen 6   #35 [hci1] 1.013774
        Address: D5:B6:CC:31:DB:3B (Static)
> HCI Event: Command Complete (0x0e) plen 4                 #36 [hci1] 1.014277
      LE Set Random Address (0x08|0x0005) ncmd 1
        Status: Success (0x00)
< HCI Command: LE Set Extended Adv.. (0x08|0x0036) plen 25  #37 [hci1] 3.614154
        Handle: 0x00
        Properties: 0x0013
          Connectable
          Scannable
          Use legacy advertising PDUs: ADV_IND
        Min advertising interval: 100.000 msec (0x00a0)
        Max advertising interval: 150.000 msec (0x00f0)
        Channel map: 37, 38, 39 (0x07)
        Own address type: Random (0x01)
        Peer address type: Public (0x00)
        Peer address: 00:00:00:00:00:00 (OUI 00-00-00)
        Filter policy: Allow Scan Request from Any, Allow Connect Request from Any (0x00)
        TX power: Host has no preference (0x7f)
        Primary PHY: LE 1M (0x01)
        Secondary max skip: 0x00
        Secondary PHY: LE 1M (0x01)
        SID: 0x00
        Scan request notifications: Disabled (0x00)
> HCI Event: Command Complete (0x0e) plen 5                 #38 [hci1] 3.615007
      LE Set Extended Advertising Parameters (0x08|0x0036) ncmd 1
        Status: Success (0x00)
        TX power (selected): 0 dbm (0x00)
< HCI Command: LE Set Advertising S.. (0x08|0x0035) plen 7  #39 [hci1] 3.633887
        Advertising handle: 0x00
        Advertising random address: D5:B6:CC:31:DB:3B (Static)
> HCI Event: Command Complete (0x0e) plen 4                 #40 [hci1] 3.634338
      LE Set Advertising Set Random Address (0x08|0x0035) ncmd 1
        Status: Success (0x00)
< HCI Command: LE Set Extended Adv.. (0x08|0x0037) plen 22  #41 [hci1] 3.653829
        Handle: 0x00
        Operation: Complete extended advertising data (0x03)
        Fragment preference: Minimize fragmentation (0x01)
        Data length: 0x12
        Flags: 0x06
          LE General Discoverable Mode
          BR/EDR Not Supported
        Name (complete): Tester_F6B11A
> HCI Event: Command Complete (0x0e) plen 4                 #42 [hci1] 3.654564
      LE Set Extended Advertising Data (0x08|0x0037) ncmd 1
        Status: Success (0x00)
< HCI Command: LE Set Extended Scan.. (0x08|0x0038) plen 4  #43 [hci1] 3.673838
        Handle: 0x00
        Operation: Complete scan response data (0x03)
        Fragment preference: Minimize fragmentation (0x01)
        Data length: 0x00
> HCI Event: Command Complete (0x0e) plen 4                 #44 [hci1] 3.674329
      LE Set Extended Scan Response Data (0x08|0x0038) ncmd 1
        Status: Success (0x00)
< HCI Command: LE Set Extended Adve.. (0x08|0x0039) plen 6  #45 [hci1] 3.693895
        Extended advertising: Enabled (0x01)
        Number of sets: 1 (0x01)
        Entry 0
          Handle: 0x00
          Duration: 0 ms (0x00)
          Max ext adv events: 0
> HCI Event: Command Complete (0x0e) plen 4                 #46 [hci1] 3.694517
      LE Set Extended Advertising Enable (0x08|0x0039) ncmd 1
        Status: Success (0x00)
> HCI Event: LE Meta Event (0x3e) plen 31                   #47 [hci1] 4.119331
      LE Enhanced Connection Complete (0x0a)
        Status: Success (0x00)
        Handle: 327
        Role: Peripheral (0x01)
        Peer address type: Public (0x00)
        Peer address: DF:A9:FF:F6:B1:1A (OUI DF-A9-FF)
        Local resolvable private address: 00:00:00:00:00:00 (Non-Resolvable)
        Peer resolvable private address: 00:00:00:00:00:00 (Non-Resolvable)
        Connection interval: 87.50 msec (0x0046)
        Connection latency: 0 (0x0000)
        Supervision timeout: 25120 msec (0x09d0)
        Central clock accuracy: 0x01
> HCI Event: LE Meta Event (0x3e) plen 6                    #48 [hci1] 4.119334
      LE Advertising Set Terminated (0x12)
        Status: Success (0x00)
        Handle: 0
        Connection handle: 327
        Number of completed extended advertising events: 0
< HCI Command: LE Read Remote Used... (0x08|0x0016) plen 2  #49 [hci1] 4.135596
        Handle: 327 Address: DF:A9:FF:F6:B1:1A (OUI DF-A9-FF)
< ACL Data TX: Handle 327 flags 0x00 dlen 7                 #50 [hci1] 4.135604
      ATT: Exchange MTU Request (0x02) len 2
        Client RX MTU: 251
> HCI Event: Command Status (0x0f) plen 4                   #51 [hci1] 4.136196
      LE Read Remote Used Features (0x08|0x0016) ncmd 1
        Status: Success (0x00)
> HCI Event: Number of Completed Packets (0x13) plen 5      #52 [hci1] 4.295177
        Num handles: 1
        Handle: 327 Address: DF:A9:FF:F6:B1:1A (OUI DF-A9-FF)
        Count: 1
        #50: len 7 (0 Kb/s)
        Latency: 159 msec (159-159 msec ~159 msec)
> HCI Event: LE Meta Event (0x3e) plen 12                   #53 [hci1] 4.383215
      LE Read Remote Used Features (0x04)
        Status: Success (0x00)
        Handle: 327 Address: DF:A9:FF:F6:B1:1A (OUI DF-A9-FF)
        Features: 0x2d 0x49 0x00 0xf7 0x67 0xd8 0x00 0x00
          LE Encryption
          Extended Reject Indication
          Peripheral-initiated Features Exchange
          LE Data Packet Length Extension
          LE 2M PHY
          LE Coded PHY
          Channel Selection Algorithm #2
          Periodic Advertising Sync Transfer - Sender
          Periodic Advertising Sync Transfer - Recipient
          Sleep Clock Accuracy Updates
          Connected Isochronous Stream - Central
          Connected Isochronous Stream - Peripheral
          Isochronous Broadcaster
          Synchronized Receiver
          Connected Isochronous Stream (Host Support)
          LE Power Control Request
          LE Power Control Request
          Connection Subrating
          Connection Subrating (Host Support)
          Unknown features (0x0000d80000000000)
> ACL Data RX: Handle 327 flags 0x02 dlen 11                #54 [hci1] 6.832834
      SMP: Pairing Request (0x01) len 6
        IO capability: KeyboardDisplay (0x04)
        OOB data: Authentication data not present (0x00)
        Authentication requirement: Bonding, MITM, SC, No Keypresses (0x0d)
        Max encryption key size: 16
        Initiator key distribution: EncKey IdKey (0x03)
        Responder key distribution: EncKey IdKey Sign (0x07)
> ACL Data RX: Handle 327 flags 0x02 dlen 7                 #55 [hci1] 6.833314
      ATT: Exchange MTU Response (0x03) len 2
        Server RX MTU: 23
< HCI Command: Host Number of Compl.. (0x03|0x0035) plen 5  #56 [hci1] 6.834324
        Num handles: 1
        Handle: 327 Address: DF:A9:FF:F6:B1:1A (OUI DF-A9-FF)
        Count: 1
< ACL Data TX: Handle 327 flags 0x00 dlen 11                #57 [hci1] 6.834556
      SMP: Pairing Response (0x02) len 6
        IO capability: DisplayOnly (0x00)
        OOB data: Authentication data not present (0x00)
        Authentication requirement: Bonding, No MITM, SC, No Keypresses (0x09)
        Max encryption key size: 16
        Initiator key distribution: IdKey (0x02)
        Responder key distribution: <none> (0x00)
< HCI Command: Host Number of Compl.. (0x03|0x0035) plen 5  #58 [hci1] 6.834805
        Num handles: 1
        Handle: 327 Address: DF:A9:FF:F6:B1:1A (OUI DF-A9-FF)
        Count: 1
> HCI Event: Number of Completed Packets (0x13) plen 5      #59 [hci1] 7.007879
        Num handles: 1
        Handle: 327 Address: DF:A9:FF:F6:B1:1A (OUI DF-A9-FF)
        Count: 1
        #57: len 11 (0 Kb/s)
        Latency: 173 msec (159-173 msec ~166 msec)
> ACL Data RX: Handle 327 flags 0x02 dlen 27                #60 [hci1] 7.008169
> ACL Data RX: Handle 327 flags 0x01 dlen 27                #61 [hci1] 7.008689
> ACL Data RX: Handle 327 flags 0x01 dlen 15                #62 [hci1] 7.009254
      SMP: Pairing Public Key (0x0c) len 64
        X: 65afe4af959d908538c80afd5b0b406e4446f37067990febdbd715c0941f2c9f
        Y: 4e28a0975064969db9bb2d0a974cd8bf55dc783c3ecfe36c7ba343cd6ba5c52d
< HCI Command: Host Number of Compl.. (0x03|0x0035) plen 5  #63 [hci1] 7.014729
        Num handles: 1
        Handle: 327 Address: DF:A9:FF:F6:B1:1A (OUI DF-A9-FF)
        Count: 1
< HCI Command: Host Number of Compl.. (0x03|0x0035) plen 5  #64 [hci1] 7.014927
        Num handles: 1
        Handle: 327 Address: DF:A9:FF:F6:B1:1A (OUI DF-A9-FF)
        Count: 1
< HCI Command: Host Number of Compl.. (0x03|0x0035) plen 5  #65 [hci1] 7.015324
        Num handles: 1
        Handle: 327 Address: DF:A9:FF:F6:B1:1A (OUI DF-A9-FF)
        Count: 1
< ACL Data TX: Handle 327 flags 0x00 dlen 27                #66 [hci1] 7.015405
< ACL Data TX: Handle 327 flags 0x01 dlen 27                #67 [hci1] 7.015417
< ACL Data TX: Handle 327 flags 0x01 dlen 15                #68 [hci1] 7.015420
      SMP: Pairing Public Key (0x0c) len 64
        X: 98308440221e2d910f0e54b71e7ec652857aa9b5a0dc65028824cc19db1226e9
        Y: 67a4816bcb62efb21701e31fdb27561a6217575fb007a8bbdabe7e28b6f68482
> HCI Event: Number of Completed Packets (0x13) plen 5      #69 [hci1] 7.095797
        Num handles: 1
        Handle: 327 Address: DF:A9:FF:F6:B1:1A (OUI DF-A9-FF)
        Count: 1
        #66: len 27 (2 Kb/s)
        Latency: 80 msec (80-173 msec ~123 msec)
> HCI Event: Number of Completed Packets (0x13) plen 5      #70 [hci1] 7.096424
        Num handles: 1
        Handle: 327 Address: DF:A9:FF:F6:B1:1A (OUI DF-A9-FF)
        Count: 1
        #67: len 27 (2 Kb/s)
        Latency: 81 msec (80-173 msec ~102 msec)
> HCI Event: Number of Completed Packets (0x13) plen 5      #71 [hci1] 7.182697
        Num handles: 1
        Handle: 327 Address: DF:A9:FF:F6:B1:1A (OUI DF-A9-FF)
        Count: 1
        #68: len 15 (0 Kb/s)
        Latency: 167 msec (80-173 msec ~134 msec)
> ACL Data RX: Handle 327 flags 0x02 dlen 21                #72 [hci1] 7.882966
      SMP: Pairing Confirm (0x03) len 16
        Confim value: d8fe6e338f2985953f155cffae6f331e
< HCI Command: Host Number of Compl.. (0x03|0x0035) plen 5  #73 [hci1] 7.894501
        Num handles: 1
        Handle: 327 Address: DF:A9:FF:F6:B1:1A (OUI DF-A9-FF)
        Count: 1
< ACL Data TX: Handle 327 flags 0x00 dlen 21                #74 [hci1] 7.894712
      SMP: Pairing Confirm (0x03) len 16
        Confim value: dae57ffe04b236597c7520bf05cac7d4
> HCI Event: Number of Completed Packets (0x13) plen 5      #75 [hci1] 8.057780
        Num handles: 1
        Handle: 327 Address: DF:A9:FF:F6:B1:1A (OUI DF-A9-FF)
        Count: 1
        #74: len 21 (1 Kb/s)
        Latency: 163 msec (80-173 msec ~148 msec)
> ACL Data RX: Handle 327 flags 0x02 dlen 21                #76 [hci1] 8.058100
      SMP: Pairing Random (0x04) len 16
        Random value: f9cd095a2a290aed0000000000000000
< HCI Command: Host Number of Compl.. (0x03|0x0035) plen 5  #77 [hci1] 8.074592
        Num handles: 1
        Handle: 327 Address: DF:A9:FF:F6:B1:1A (OUI DF-A9-FF)
        Count: 1
< ACL Data TX: Handle 327 flags 0x00 dlen 21                #78 [hci1] 8.074642
      SMP: Pairing Random (0x04) len 16
        Random value: 8e6108f966a694cbe26df70bb96773e6
> HCI Event: Number of Completed Packets (0x13) plen 5      #79 [hci1] 8.232597
        Num handles: 1
        Handle: 327 Address: DF:A9:FF:F6:B1:1A (OUI DF-A9-FF)
        Count: 1
        #78: len 21 (1 Kb/s)
        Latency: 157 msec (80-173 msec ~153 msec)
> ACL Data RX: Handle 327 flags 0x02 dlen 21                #80 [hci1] 8.320397
      SMP: Pairing Confirm (0x03) len 16
        Confim value: 80a01d5d66036bab2a55c5e572ab0d28
< HCI Command: Host Number of Compl.. (0x03|0x0035) plen 5  #81 [hci1] 8.334106
        Num handles: 1
        Handle: 327 Address: DF:A9:FF:F6:B1:1A (OUI DF-A9-FF)
        Count: 1
< ACL Data TX: Handle 327 flags 0x00 dlen 21                #82 [hci1] 8.334200
      SMP: Pairing Confirm (0x03) len 16
        Confim value: 915b290dbdf09d41016723858a28f8cb
> HCI Event: Number of Completed Packets (0x13) plen 5      #83 [hci1] 8.495427
        Num handles: 1
        Handle: 327 Address: DF:A9:FF:F6:B1:1A (OUI DF-A9-FF)
        Count: 1
        #82: len 21 (1 Kb/s)
        Latency: 161 msec (80-173 msec ~157 msec)
> ACL Data RX: Handle 327 flags 0x02 dlen 21                #84 [hci1] 8.495616
      SMP: Pairing Random (0x04) len 16
        Random value: 04638c97be0035060000000000000000
< HCI Command: Host Number of Compl.. (0x03|0x0035) plen 5  #85 [hci1] 8.514512
        Num handles: 1
        Handle: 327 Address: DF:A9:FF:F6:B1:1A (OUI DF-A9-FF)
        Count: 1
< ACL Data TX: Handle 327 flags 0x00 dlen 21                #86 [hci1] 8.514590
      SMP: Pairing Random (0x04) len 16
        Random value: 4d02679f89a05211af56d8b3da64d21e
> HCI Event: Number of Completed Packets (0x13) plen 5      #87 [hci1] 8.670120
        Num handles: 1
        Handle: 327 Address: DF:A9:FF:F6:B1:1A (OUI DF-A9-FF)
        Count: 1
        #86: len 21 (1 Kb/s)
        Latency: 155 msec (80-173 msec ~156 msec)
> ACL Data RX: Handle 327 flags 0x02 dlen 21                #88 [hci1] 8.758024
      SMP: Pairing Confirm (0x03) len 16
        Confim value: e98966dbe75c02c71b5b908fbc9a61b5
< HCI Command: Host Number of Compl.. (0x03|0x0035) plen 5  #89 [hci1] 8.774500
        Num handles: 1
        Handle: 327 Address: DF:A9:FF:F6:B1:1A (OUI DF-A9-FF)
        Count: 1
< ACL Data TX: Handle 327 flags 0x00 dlen 21                #90 [hci1] 8.774742
      SMP: Pairing Confirm (0x03) len 16
        Confim value: 27b00ec5f0d9f2331fff0bf465059b57
> HCI Event: Number of Completed Packets (0x13) plen 5      #91 [hci1] 8.932805
        Num handles: 1
        Handle: 327 Address: DF:A9:FF:F6:B1:1A (OUI DF-A9-FF)
        Count: 1
        #90: len 21 (1 Kb/s)
        Latency: 158 msec (80-173 msec ~157 msec)
> ACL Data RX: Handle 327 flags 0x02 dlen 21                #92 [hci1] 8.933134
      SMP: Pairing Random (0x04) len 16
        Random value: 9adfa1260d63a77e0000000000000000
< HCI Command: Host Number of Compl.. (0x03|0x0035) plen 5  #93 [hci1] 8.934562
        Num handles: 1
        Handle: 327 Address: DF:A9:FF:F6:B1:1A (OUI DF-A9-FF)
        Count: 1
< ACL Data TX: Handle 327 flags 0x00 dlen 21                #94 [hci1] 8.934661
      SMP: Pairing Random (0x04) len 16
        Random value: 5e8286bc235a02440d0c3424a2acf8fd
> HCI Event: Number of Completed Packets (0x13) plen 5      #95 [hci1] 9.107540
        Num handles: 1
        Handle: 327 Address: DF:A9:FF:F6:B1:1A (OUI DF-A9-FF)
        Count: 1
        #94: len 21 (0 Kb/s)
        Latency: 172 msec (80-173 msec ~165 msec)
> ACL Data RX: Handle 327 flags 0x02 dlen 21                #96 [hci1] 9.195383
      SMP: Pairing Confirm (0x03) len 16
        Confim value: 94f13cc9ee88b04852273caf6881418b
< HCI Command: Host Number of Compl.. (0x03|0x0035) plen 5  #97 [hci1] 9.214124
        Num handles: 1
        Handle: 327 Address: DF:A9:FF:F6:B1:1A (OUI DF-A9-FF)
        Count: 1
< ACL Data TX: Handle 327 flags 0x00 dlen 21                #98 [hci1] 9.214273
      SMP: Pairing Confirm (0x03) len 16
        Confim value: 9bcb83c4148adca33c45f61481435e97
> HCI Event: Number of Completed Packets (0x13) plen 5      #99 [hci1] 9.370316
        Num handles: 1
        Handle: 327 Address: DF:A9:FF:F6:B1:1A (OUI DF-A9-FF)
        Count: 1
        #98: len 21 (1 Kb/s)
        Latency: 156 msec (80-173 msec ~160 msec)
> ACL Data RX: Handle 327 flags 0x02 dlen 21               #100 [hci1] 9.370582
      SMP: Pairing Random (0x04) len 16
        Random value: e53ef31051e73e6e0000000000000000
< HCI Command: Host Number of Comp.. (0x03|0x0035) plen 5  #101 [hci1] 9.374151
        Num handles: 1
        Handle: 327 Address: DF:A9:FF:F6:B1:1A (OUI DF-A9-FF)
        Count: 1
< ACL Data TX: Handle 327 flags 0x00 dlen 21               #102 [hci1] 9.374177
      SMP: Pairing Random (0x04) len 16
        Random value: 5c4a1bcadd27bd58e945097b00bad7ac
> HCI Event: Number of Completed Packets (0x13) plen 5     #103 [hci1] 9.545075
        Num handles: 1
        Handle: 327 Address: DF:A9:FF:F6:B1:1A (OUI DF-A9-FF)
        Count: 1
        #102: len 21 (0 Kb/s)
        Latency: 170 msec (80-173 msec ~165 msec)
> ACL Data RX: Handle 327 flags 0x02 dlen 21               #104 [hci1] 9.632879
      SMP: Pairing Confirm (0x03) len 16
        Confim value: ad1e8972ca66eac9da7dbd7a29108be7
< HCI Command: Host Number of Comp.. (0x03|0x0035) plen 5  #105 [hci1] 9.634147
        Num handles: 1
        Handle: 327 Address: DF:A9:FF:F6:B1:1A (OUI DF-A9-FF)
        Count: 1
< ACL Data TX: Handle 327 flags 0x00 dlen 21               #106 [hci1] 9.634251
      SMP: Pairing Confirm (0x03) len 16
        Confim value: 12204d6f40571103a149be03b63a7db4
> HCI Event: Number of Completed Packets (0x13) plen 5     #107 [hci1] 9.807725
        Num handles: 1
        Handle: 327 Address: DF:A9:FF:F6:B1:1A (OUI DF-A9-FF)
        Count: 1
        #106: len 21 (0 Kb/s)
        Latency: 173 msec (80-173 msec ~169 msec)
> ACL Data RX: Handle 327 flags 0x02 dlen 21               #108 [hci1] 9.808078
      SMP: Pairing Random (0x04) len 16
        Random value: f9692ca1ac0b6e6d0000000000000000
< HCI Command: Host Number of Comp.. (0x03|0x0035) plen 5  #109 [hci1] 9.814420
        Num handles: 1
        Handle: 327 Address: DF:A9:FF:F6:B1:1A (OUI DF-A9-FF)
        Count: 1
< ACL Data TX: Handle 327 flags 0x00 dlen 21               #110 [hci1] 9.814564
      SMP: Pairing Random (0x04) len 16
        Random value: 32527e6e64e79f33b2e374394db8ab2d
> HCI Event: Number of Completed Packets (0x13) plen 5     #111 [hci1] 9.982684
        Num handles: 1
        Handle: 327 Address: DF:A9:FF:F6:B1:1A (OUI DF-A9-FF)
        Count: 1
        #110: len 21 (1 Kb/s)
        Latency: 168 msec (80-173 msec ~168 msec)
> ACL Data RX: Handle 327 flags 0x02 dlen 21              #112 [hci1] 10.070448
      SMP: Pairing Confirm (0x03) len 16
        Confim value: 64adea8bea77cbc0d02d43bb4dd24cee
< HCI Command: Host Number of Com.. (0x03|0x0035) plen 5  #113 [hci1] 10.074428
        Num handles: 1
        Handle: 327 Address: DF:A9:FF:F6:B1:1A (OUI DF-A9-FF)
        Count: 1
< ACL Data TX: Handle 327 flags 0x00 dlen 21              #114 [hci1] 10.074532
      SMP: Pairing Confirm (0x03) len 16
        Confim value: 90a43c92586e60eef838395157d2daa1
> HCI Event: Number of Completed Packets (0x13) plen 5    #115 [hci1] 10.245249
        Num handles: 1
        Handle: 327 Address: DF:A9:FF:F6:B1:1A (OUI DF-A9-FF)
        Count: 1
        #114: len 21 (0 Kb/s)
        Latency: 170 msec (80-173 msec ~169 msec)
> ACL Data RX: Handle 327 flags 0x02 dlen 21              #116 [hci1] 10.245564
      SMP: Pairing Random (0x04) len 16
        Random value: bae8e4a18a7306580000000000000000
< HCI Command: Host Number of Com.. (0x03|0x0035) plen 5  #117 [hci1] 10.254559
        Num handles: 1
        Handle: 327 Address: DF:A9:FF:F6:B1:1A (OUI DF-A9-FF)
        Count: 1
< ACL Data TX: Handle 327 flags 0x00 dlen 21              #118 [hci1] 10.254675
      SMP: Pairing Random (0x04) len 16
        Random value: dddbdfe2838e9a8cc6964353c850fef7
> HCI Event: Number of Completed Packets (0x13) plen 5    #119 [hci1] 10.420062
        Num handles: 1
        Handle: 327 Address: DF:A9:FF:F6:B1:1A (OUI DF-A9-FF)
        Count: 1
        #118: len 21 (1 Kb/s)
        Latency: 165 msec (80-173 msec ~167 msec)
> ACL Data RX: Handle 327 flags 0x02 dlen 21              #120 [hci1] 10.507790
      SMP: Pairing Confirm (0x03) len 16
        Confim value: 57f2b209573b8394b06906b4d081bacc
< HCI Command: Host Number of Com.. (0x03|0x0035) plen 5  #121 [hci1] 10.514353
        Num handles: 1
        Handle: 327 Address: DF:A9:FF:F6:B1:1A (OUI DF-A9-FF)
        Count: 1
< ACL Data TX: Handle 327 flags 0x00 dlen 21              #122 [hci1] 10.514511
      SMP: Pairing Confirm (0x03) len 16
        Confim value: 3b9f186609307df003ff70909d858e25
> HCI Event: Number of Completed Packets (0x13) plen 5    #123 [hci1] 10.682757
        Num handles: 1
        Handle: 327 Address: DF:A9:FF:F6:B1:1A (OUI DF-A9-FF)
        Count: 1
        #122: len 21 (1 Kb/s)
        Latency: 168 msec (80-173 msec ~167 msec)
> ACL Data RX: Handle 327 flags 0x02 dlen 21              #124 [hci1] 10.683132
      SMP: Pairing Random (0x04) len 16
        Random value: 6085622c3c24e8a00000000000000000
< HCI Command: Host Number of Com.. (0x03|0x0035) plen 5  #125 [hci1] 10.694528
        Num handles: 1
        Handle: 327 Address: DF:A9:FF:F6:B1:1A (OUI DF-A9-FF)
        Count: 1
< ACL Data TX: Handle 327 flags 0x00 dlen 21              #126 [hci1] 10.694675
      SMP: Pairing Random (0x04) len 16
        Random value: eb9f1915536596b6fc3db1c86b2b1970
> HCI Event: Number of Completed Packets (0x13) plen 5    #127 [hci1] 10.857483
        Num handles: 1
        Handle: 327 Address: DF:A9:FF:F6:B1:1A (OUI DF-A9-FF)
        Count: 1
        #126: len 21 (1 Kb/s)
        Latency: 162 msec (80-173 msec ~165 msec)
> ACL Data RX: Handle 327 flags 0x02 dlen 21              #128 [hci1] 10.945377
      SMP: Pairing Confirm (0x03) len 16
        Confim value: 9823d920adda4afa428af4652a2f5b40
< HCI Command: Host Number of Com.. (0x03|0x0035) plen 5  #129 [hci1] 10.954319
        Num handles: 1
        Handle: 327 Address: DF:A9:FF:F6:B1:1A (OUI DF-A9-FF)
        Count: 1
< ACL Data TX: Handle 327 flags 0x00 dlen 21              #130 [hci1] 10.954485
      SMP: Pairing Confirm (0x03) len 16
        Confim value: ce9f57c28c6687263d21febb42049198
> HCI Event: Number of Completed Packets (0x13) plen 5    #131 [hci1] 11.120221
        Num handles: 1
        Handle: 327 Address: DF:A9:FF:F6:B1:1A (OUI DF-A9-FF)
        Count: 1
        #130: len 21 (1 Kb/s)
        Latency: 165 msec (80-173 msec ~165 msec)
> ACL Data RX: Handle 327 flags 0x02 dlen 21              #132 [hci1] 11.120532
      SMP: Pairing Random (0x04) len 16
        Random value: fd9aaa484641077a0000000000000000
< HCI Command: Host Number of Com.. (0x03|0x0035) plen 5  #133 [hci1] 11.134644
        Num handles: 1
        Handle: 327 Address: DF:A9:FF:F6:B1:1A (OUI DF-A9-FF)
        Count: 1
< ACL Data TX: Handle 327 flags 0x00 dlen 21              #134 [hci1] 11.134744
      SMP: Pairing Random (0x04) len 16
        Random value: 5c794dc9ad9f2c3f295ebd5ad5e1c3cf
> HCI Event: Number of Completed Packets (0x13) plen 5    #135 [hci1] 11.294975
        Num handles: 1
        Handle: 327 Address: DF:A9:FF:F6:B1:1A (OUI DF-A9-FF)
        Count: 1
        #134: len 21 (1 Kb/s)
        Latency: 160 msec (80-173 msec ~162 msec)
> ACL Data RX: Handle 327 flags 0x02 dlen 21              #136 [hci1] 11.382852
      SMP: Pairing Confirm (0x03) len 16
        Confim value: 25e552ac241fd3ac3dfa2ad5574c5b1a
< HCI Command: Host Number of Com.. (0x03|0x0035) plen 5  #137 [hci1] 11.394087
        Num handles: 1
        Handle: 327 Address: DF:A9:FF:F6:B1:1A (OUI DF-A9-FF)
        Count: 1
< ACL Data TX: Handle 327 flags 0x00 dlen 21              #138 [hci1] 11.394195
      SMP: Pairing Confirm (0x03) len 16
        Confim value: 215406079d9237b7b467fc55348e2f34
> HCI Event: Number of Completed Packets (0x13) plen 5    #139 [hci1] 11.557826
        Num handles: 1
        Handle: 327 Address: DF:A9:FF:F6:B1:1A (OUI DF-A9-FF)
        Count: 1
        #138: len 21 (1 Kb/s)
        Latency: 163 msec (80-173 msec ~163 msec)
> ACL Data RX: Handle 327 flags 0x02 dlen 21              #140 [hci1] 11.558065
      SMP: Pairing Random (0x04) len 16
        Random value: 0d832588391f4aef0000000000000000
< HCI Command: Host Number of Com.. (0x03|0x0035) plen 5  #141 [hci1] 11.574651
        Num handles: 1
        Handle: 327 Address: DF:A9:FF:F6:B1:1A (OUI DF-A9-FF)
        Count: 1
< ACL Data TX: Handle 327 flags 0x00 dlen 21              #142 [hci1] 11.574793
      SMP: Pairing Random (0x04) len 16
        Random value: 5c2fff312cdf99c9491988e877355a9a
> HCI Event: Number of Completed Packets (0x13) plen 5    #143 [hci1] 11.732408
        Num handles: 1
        Handle: 327 Address: DF:A9:FF:F6:B1:1A (OUI DF-A9-FF)
        Count: 1
        #142: len 21 (1 Kb/s)
        Latency: 157 msec (80-173 msec ~160 msec)
> ACL Data RX: Handle 327 flags 0x02 dlen 21              #144 [hci1] 11.820360
      SMP: Pairing Confirm (0x03) len 16
        Confim value: ceb7273af44a1e303aa038bd641a4ad3
< HCI Command: Host Number of Com.. (0x03|0x0035) plen 5  #145 [hci1] 11.834433
        Num handles: 1
        Handle: 327 Address: DF:A9:FF:F6:B1:1A (OUI DF-A9-FF)
        Count: 1
< ACL Data TX: Handle 327 flags 0x00 dlen 21              #146 [hci1] 11.834621
      SMP: Pairing Confirm (0x03) len 16
        Confim value: 49df43a53bd3f756f1230c21e5a24a97
> HCI Event: Number of Completed Packets (0x13) plen 5    #147 [hci1] 11.995199
        Num handles: 1
        Handle: 327 Address: DF:A9:FF:F6:B1:1A (OUI DF-A9-FF)
        Count: 1
        #146: len 21 (1 Kb/s)
        Latency: 160 msec (80-173 msec ~160 msec)
> ACL Data RX: Handle 327 flags 0x02 dlen 21              #148 [hci1] 11.995488
      SMP: Pairing Random (0x04) len 16
        Random value: 7c6275467d7408b90000000000000000
< HCI Command: Host Number of Com.. (0x03|0x0035) plen 5  #149 [hci1] 12.014650
        Num handles: 1
        Handle: 327 Address: DF:A9:FF:F6:B1:1A (OUI DF-A9-FF)
        Count: 1
< ACL Data TX: Handle 327 flags 0x00 dlen 21              #150 [hci1] 12.014745
      SMP: Pairing Random (0x04) len 16
        Random value: c629a3a987d808e808655d558dfc1155
> HCI Event: Number of Completed Packets (0x13) plen 5    #151 [hci1] 12.170097
        Num handles: 1
        Handle: 327 Address: DF:A9:FF:F6:B1:1A (OUI DF-A9-FF)
        Count: 1
        #150: len 21 (1 Kb/s)
        Latency: 155 msec (80-173 msec ~157 msec)
> ACL Data RX: Handle 327 flags 0x02 dlen 21              #152 [hci1] 12.257892
      SMP: Pairing Confirm (0x03) len 16
        Confim value: 651a8a830bad1f38460921e5b57b9f02
< HCI Command: Host Number of Com.. (0x03|0x0035) plen 5  #153 [hci1] 12.274443
        Num handles: 1
        Handle: 327 Address: DF:A9:FF:F6:B1:1A (OUI DF-A9-FF)
        Count: 1
< ACL Data TX: Handle 327 flags 0x00 dlen 21              #154 [hci1] 12.274638
      SMP: Pairing Confirm (0x03) len 16
        Confim value: ec24c9395e4bf327208f7500e6390a53
> HCI Event: Number of Completed Packets (0x13) plen 5    #155 [hci1] 12.432633
        Num handles: 1
        Handle: 327 Address: DF:A9:FF:F6:B1:1A (OUI DF-A9-FF)
        Count: 1
        #154: len 21 (1 Kb/s)
        Latency: 157 msec (80-173 msec ~157 msec)
> ACL Data RX: Handle 327 flags 0x02 dlen 21              #156 [hci1] 12.432999
      SMP: Pairing Random (0x04) len 16
        Random value: 7327fa734fcc959a0000000000000000
< HCI Command: Host Number of Com.. (0x03|0x0035) plen 5  #157 [hci1] 12.434499
        Num handles: 1
        Handle: 327 Address: DF:A9:FF:F6:B1:1A (OUI DF-A9-FF)
        Count: 1
< ACL Data TX: Handle 327 flags 0x00 dlen 21              #158 [hci1] 12.434598
      SMP: Pairing Random (0x04) len 16
        Random value: 92f20f6ad8f13724432c7fd6001c45ff
> HCI Event: Number of Completed Packets (0x13) plen 5    #159 [hci1] 12.607434
        Num handles: 1
        Handle: 327 Address: DF:A9:FF:F6:B1:1A (OUI DF-A9-FF)
        Count: 1
        #158: len 21 (0 Kb/s)
        Latency: 172 msec (80-173 msec ~165 msec)
> ACL Data RX: Handle 327 flags 0x02 dlen 21              #160 [hci1] 12.695311
      SMP: Pairing Confirm (0x03) len 16
        Confim value: 0bc7974aca4570ea61312ddc52f07bef
< HCI Command: Host Number of Com.. (0x03|0x0035) plen 5  #161 [hci1] 12.714209
        Num handles: 1
        Handle: 327 Address: DF:A9:FF:F6:B1:1A (OUI DF-A9-FF)
        Count: 1
< ACL Data TX: Handle 327 flags 0x00 dlen 21              #162 [hci1] 12.714351
      SMP: Pairing Confirm (0x03) len 16
        Confim value: 9f1677a8f294bd001758de15cabcfba3
> HCI Event: Number of Completed Packets (0x13) plen 5    #163 [hci1] 12.870214
        Num handles: 1
        Handle: 327 Address: DF:A9:FF:F6:B1:1A (OUI DF-A9-FF)
        Count: 1
        #162: len 21 (1 Kb/s)
        Latency: 155 msec (80-173 msec ~160 msec)
> ACL Data RX: Handle 327 flags 0x02 dlen 21              #164 [hci1] 12.870470
      SMP: Pairing Random (0x04) len 16
        Random value: a7dd9c22836160360000000000000000
< HCI Command: Host Number of Com.. (0x03|0x0035) plen 5  #165 [hci1] 12.874546
        Num handles: 1
        Handle: 327 Address: DF:A9:FF:F6:B1:1A (OUI DF-A9-FF)
        Count: 1
< ACL Data TX: Handle 327 flags 0x00 dlen 21              #166 [hci1] 12.874664
      SMP: Pairing Random (0x04) len 16
        Random value: 23ac32ebbb5e14c8a6b9622f296d277f
> HCI Event: Number of Completed Packets (0x13) plen 5    #167 [hci1] 13.045050
        Num handles: 1
        Handle: 327 Address: DF:A9:FF:F6:B1:1A (OUI DF-A9-FF)
        Count: 1
        #166: len 21 (0 Kb/s)
        Latency: 170 msec (80-173 msec ~165 msec)
> ACL Data RX: Handle 327 flags 0x02 dlen 21              #168 [hci1] 13.132822
      SMP: Pairing Confirm (0x03) len 16
        Confim value: af81f3b8d9af7c45a89097a3c381ba0d
< HCI Command: Host Number of Com.. (0x03|0x0035) plen 5  #169 [hci1] 13.134392
        Num handles: 1
        Handle: 327 Address: DF:A9:FF:F6:B1:1A (OUI DF-A9-FF)
        Count: 1
< ACL Data TX: Handle 327 flags 0x00 dlen 21              #170 [hci1] 13.134554
      SMP: Pairing Confirm (0x03) len 16
        Confim value: 479a186bb18a11b6ed0503a12e6d07ff
> HCI Event: Number of Completed Packets (0x13) plen 5    #171 [hci1] 13.307730
        Num handles: 1
        Handle: 327 Address: DF:A9:FF:F6:B1:1A (OUI DF-A9-FF)
        Count: 1
        #170: len 21 (0 Kb/s)
        Latency: 173 msec (80-173 msec ~169 msec)
> ACL Data RX: Handle 327 flags 0x02 dlen 21              #172 [hci1] 13.307959
      SMP: Pairing Random (0x04) len 16
        Random value: 3076a5b97cdacc390000000000000000
< HCI Command: Host Number of Com.. (0x03|0x0035) plen 5  #173 [hci1] 13.314631
        Num handles: 1
        Handle: 327 Address: DF:A9:FF:F6:B1:1A (OUI DF-A9-FF)
        Count: 1
< ACL Data TX: Handle 327 flags 0x00 dlen 21              #174 [hci1] 13.314785
      SMP: Pairing Random (0x04) len 16
        Random value: 297efe85e67448a15f56bd27e3a3cf1d
> HCI Event: Number of Completed Packets (0x13) plen 5    #175 [hci1] 13.482451
        Num handles: 1
        Handle: 327 Address: DF:A9:FF:F6:B1:1A (OUI DF-A9-FF)
        Count: 1
        #174: len 21 (1 Kb/s)
        Latency: 167 msec (80-173 msec ~168 msec)
> ACL Data RX: Handle 327 flags 0x02 dlen 21              #176 [hci1] 13.570221
      SMP: Pairing Confirm (0x03) len 16
        Confim value: c5a2dc1d68aeb0ae2462f32ca6f0d33d
< HCI Command: Host Number of Com.. (0x03|0x0035) plen 5  #177 [hci1] 13.574470
        Num handles: 1
        Handle: 327 Address: DF:A9:FF:F6:B1:1A (OUI DF-A9-FF)
        Count: 1
< ACL Data TX: Handle 327 flags 0x00 dlen 21              #178 [hci1] 13.574608
      SMP: Pairing Confirm (0x03) len 16
        Confim value: 741d8e498b37f77e72003d7c1f84d044
> HCI Event: Number of Completed Packets (0x13) plen 5    #179 [hci1] 13.745164
        Num handles: 1
        Handle: 327 Address: DF:A9:FF:F6:B1:1A (OUI DF-A9-FF)
        Count: 1
        #178: len 21 (0 Kb/s)
        Latency: 170 msec (80-173 msec ~169 msec)
> ACL Data RX: Handle 327 flags 0x02 dlen 21              #180 [hci1] 13.745508
      SMP: Pairing Random (0x04) len 16
        Random value: 41ad805831f60d700000000000000000
< HCI Command: Host Number of Com.. (0x03|0x0035) plen 5  #181 [hci1] 13.754758
        Num handles: 1
        Handle: 327 Address: DF:A9:FF:F6:B1:1A (OUI DF-A9-FF)
        Count: 1
< ACL Data TX: Handle 327 flags 0x00 dlen 21              #182 [hci1] 13.754825
      SMP: Pairing Random (0x04) len 16
        Random value: 25a9493fd3ce4faf02be7293595bb7c6
> HCI Event: Number of Completed Packets (0x13) plen 5    #183 [hci1] 13.920060
        Num handles: 1
        Handle: 327 Address: DF:A9:FF:F6:B1:1A (OUI DF-A9-FF)
        Count: 1
        #182: len 21 (1 Kb/s)
        Latency: 165 msec (80-173 msec ~167 msec)
> ACL Data RX: Handle 327 flags 0x02 dlen 21              #184 [hci1] 14.007826
      SMP: Pairing Confirm (0x03) len 16
        Confim value: 6d215b443e65e363828a987be9ee031b
< HCI Command: Host Number of Com.. (0x03|0x0035) plen 5  #185 [hci1] 14.014422
        Num handles: 1
        Handle: 327 Address: DF:A9:FF:F6:B1:1A (OUI DF-A9-FF)
        Count: 1
< ACL Data TX: Handle 327 flags 0x00 dlen 21              #186 [hci1] 14.014639
      SMP: Pairing Confirm (0x03) len 16
        Confim value: f3b9f08f15642dad813533c4548dcb62
> HCI Event: Number of Completed Packets (0x13) plen 5    #187 [hci1] 14.182557
        Num handles: 1
        Handle: 327 Address: DF:A9:FF:F6:B1:1A (OUI DF-A9-FF)
        Count: 1
        #186: len 21 (1 Kb/s)
        Latency: 167 msec (80-173 msec ~167 msec)
> ACL Data RX: Handle 327 flags 0x02 dlen 21              #188 [hci1] 14.182940
      SMP: Pairing Random (0x04) len 16
        Random value: 02e24ccf1f8110890000000000000000
< HCI Command: Host Number of Com.. (0x03|0x0035) plen 5  #189 [hci1] 14.194733
        Num handles: 1
        Handle: 327 Address: DF:A9:FF:F6:B1:1A (OUI DF-A9-FF)
        Count: 1
< ACL Data TX: Handle 327 flags 0x00 dlen 21              #190 [hci1] 14.194837
      SMP: Pairing Random (0x04) len 16
        Random value: 58f6b41f855a6f6c3560debd84e2affc
> HCI Event: Number of Completed Packets (0x13) plen 5    #191 [hci1] 14.357349
        Num handles: 1
        Handle: 327 Address: DF:A9:FF:F6:B1:1A (OUI DF-A9-FF)
        Count: 1
        #190: len 21 (1 Kb/s)
        Latency: 162 msec (80-173 msec ~165 msec)
> ACL Data RX: Handle 327 flags 0x02 dlen 21              #192 [hci1] 14.445288
      SMP: Pairing Confirm (0x03) len 16
        Confim value: a6913d24d83c6d1a311152f6c9d70653
< HCI Command: Host Number of Com.. (0x03|0x0035) plen 5  #193 [hci1] 14.454116
        Num handles: 1
        Handle: 327 Address: DF:A9:FF:F6:B1:1A (OUI DF-A9-FF)
        Count: 1
< ACL Data TX: Handle 327 flags 0x00 dlen 21              #194 [hci1] 14.454206
      SMP: Pairing Confirm (0x03) len 16
        Confim value: 0bcb8d1c21b8548f3e7b4867ac30df95
> HCI Event: Number of Completed Packets (0x13) plen 5    #195 [hci1] 14.620076
        Num handles: 1
        Handle: 327 Address: DF:A9:FF:F6:B1:1A (OUI DF-A9-FF)
        Count: 1
        #194: len 21 (1 Kb/s)
        Latency: 165 msec (80-173 msec ~165 msec)
> ACL Data RX: Handle 327 flags 0x02 dlen 21              #196 [hci1] 14.620460
      SMP: Pairing Random (0x04) len 16
        Random value: 4373f5ca74ecaaf10000000000000000
< HCI Command: Host Number of Com.. (0x03|0x0035) plen 5  #197 [hci1] 14.634677
        Num handles: 1
        Handle: 327 Address: DF:A9:FF:F6:B1:1A (OUI DF-A9-FF)
        Count: 1
< ACL Data TX: Handle 327 flags 0x00 dlen 21              #198 [hci1] 14.634758
      SMP: Pairing Random (0x04) len 16
        Random value: b67e7216d5bf664139eda2b542549666
> HCI Event: Number of Completed Packets (0x13) plen 5    #199 [hci1] 14.794891
        Num handles: 1
        Handle: 327 Address: DF:A9:FF:F6:B1:1A (OUI DF-A9-FF)
        Count: 1
        #198: len 21 (1 Kb/s)
        Latency: 160 msec (80-173 msec ~162 msec)
> ACL Data RX: Handle 327 flags 0x02 dlen 21              #200 [hci1] 14.882863
      SMP: Pairing Confirm (0x03) len 16
        Confim value: 94cacf46b3f84f8979e292f88a987b4f
< HCI Command: Host Number of Com.. (0x03|0x0035) plen 5  #201 [hci1] 14.894398
        Num handles: 1
        Handle: 327 Address: DF:A9:FF:F6:B1:1A (OUI DF-A9-FF)
        Count: 1
< ACL Data TX: Handle 327 flags 0x00 dlen 21              #202 [hci1] 14.894581
      SMP: Pairing Confirm (0x03) len 16
        Confim value: f95541ed469082f7b5dc9f9eedbdcfff
> HCI Event: Number of Completed Packets (0x13) plen 5    #203 [hci1] 15.057537
        Num handles: 1
        Handle: 327 Address: DF:A9:FF:F6:B1:1A (OUI DF-A9-FF)
        Count: 1
        #202: len 21 (1 Kb/s)
        Latency: 162 msec (80-173 msec ~162 msec)
> ACL Data RX: Handle 327 flags 0x02 dlen 21              #204 [hci1] 15.057963
      SMP: Pairing Random (0x04) len 16
        Random value: fe12beea945bf5200000000000000000
< HCI Command: Host Number of Com.. (0x03|0x0035) plen 5  #205 [hci1] 15.074656
        Num handles: 1
        Handle: 327 Address: DF:A9:FF:F6:B1:1A (OUI DF-A9-FF)
        Count: 1
< ACL Data TX: Handle 327 flags 0x00 dlen 21              #206 [hci1] 15.074734
      SMP: Pairing Random (0x04) len 16
        Random value: ed17f76500c95219dd01e09d1e63f87b
> HCI Event: Number of Completed Packets (0x13) plen 5    #207 [hci1] 15.232372
        Num handles: 1
        Handle: 327 Address: DF:A9:FF:F6:B1:1A (OUI DF-A9-FF)
        Count: 1
        #206: len 21 (1 Kb/s)
        Latency: 157 msec (80-173 msec ~160 msec)
> ACL Data RX: Handle 327 flags 0x02 dlen 21              #208 [hci1] 15.320200
      SMP: Pairing Confirm (0x03) len 16
        Confim value: 6093b3da143860fc27dc8cc338faae72
< HCI Command: Host Number of Com.. (0x03|0x0035) plen 5  #209 [hci1] 15.334262
        Num handles: 1
        Handle: 327 Address: DF:A9:FF:F6:B1:1A (OUI DF-A9-FF)
        Count: 1
< ACL Data TX: Handle 327 flags 0x00 dlen 21              #210 [hci1] 15.334400
      SMP: Pairing Confirm (0x03) len 16
        Confim value: 28766bdd90902c08a0b44854e6d19627
> HCI Event: Number of Completed Packets (0x13) plen 5    #211 [hci1] 15.495056
        Num handles: 1
        Handle: 327 Address: DF:A9:FF:F6:B1:1A (OUI DF-A9-FF)
        Count: 1
        #210: len 21 (1 Kb/s)
        Latency: 160 msec (80-173 msec ~160 msec)
> ACL Data RX: Handle 327 flags 0x02 dlen 21              #212 [hci1] 15.495433
      SMP: Pairing Random (0x04) len 16
        Random value: 144610e2ffb243db0000000000000000
< HCI Command: Host Number of Com.. (0x03|0x0035) plen 5  #213 [hci1] 15.514621
        Num handles: 1
        Handle: 327 Address: DF:A9:FF:F6:B1:1A (OUI DF-A9-FF)
        Count: 1
< ACL Data TX: Handle 327 flags 0x00 dlen 21              #214 [hci1] 15.514737
      SMP: Pairing Random (0x04) len 16
        Random value: 81d35d47e1f6006d79c974bd9d9e1ee3
> HCI Event: Number of Completed Packets (0x13) plen 5    #215 [hci1] 15.669877
        Num handles: 1
        Handle: 327 Address: DF:A9:FF:F6:B1:1A (OUI DF-A9-FF)
        Count: 1
        #214: len 21 (1 Kb/s)
        Latency: 155 msec (80-173 msec ~157 msec)
> ACL Data RX: Handle 327 flags 0x02 dlen 21              #216 [hci1] 15.757670
      SMP: Pairing Confirm (0x03) len 16
        Confim value: a15464b150c9f49d381961a630fa826e
< HCI Command: Host Number of Com.. (0x03|0x0035) plen 5  #217 [hci1] 15.774496
        Num handles: 1
        Handle: 327 Address: DF:A9:FF:F6:B1:1A (OUI DF-A9-FF)
        Count: 1
< ACL Data TX: Handle 327 flags 0x00 dlen 21              #218 [hci1] 15.774616
      SMP: Pairing Confirm (0x03) len 16
        Confim value: 10dbcfc5091df0fd3d68933b8f363c08
> HCI Event: Number of Completed Packets (0x13) plen 5    #219 [hci1] 15.932674
        Num handles: 1
        Handle: 327 Address: DF:A9:FF:F6:B1:1A (OUI DF-A9-FF)
        Count: 1
        #218: len 21 (1 Kb/s)
        Latency: 158 msec (80-173 msec ~157 msec)
> ACL Data RX: Handle 327 flags 0x02 dlen 21              #220 [hci1] 15.932899
      SMP: Pairing Random (0x04) len 16
        Random value: f2882f2e9c3da64c0000000000000000
< HCI Command: Host Number of Com.. (0x03|0x0035) plen 5  #221 [hci1] 15.934526
        Num handles: 1
        Handle: 327 Address: DF:A9:FF:F6:B1:1A (OUI DF-A9-FF)
        Count: 1
< ACL Data TX: Handle 327 flags 0x00 dlen 21              #222 [hci1] 15.934669
      SMP: Pairing Random (0x04) len 16
        Random value: e7f7e0c2476823e41736a7e381bafb7c
> HCI Event: Number of Completed Packets (0x13) plen 5    #223 [hci1] 16.107307
        Num handles: 1
        Handle: 327 Address: DF:A9:FF:F6:B1:1A (OUI DF-A9-FF)
        Count: 1
        #222: len 21 (0 Kb/s)
        Latency: 172 msec (80-173 msec ~165 msec)
> ACL Data RX: Handle 327 flags 0x02 dlen 21              #224 [hci1] 16.195179
      SMP: Pairing Confirm (0x03) len 16
        Confim value: 1582f742485a56aa7a977c18106e1849
< HCI Command: Host Number of Com.. (0x03|0x0035) plen 5  #225 [hci1] 16.214278
        Num handles: 1
        Handle: 327 Address: DF:A9:FF:F6:B1:1A (OUI DF-A9-FF)
        Count: 1
< ACL Data TX: Handle 327 flags 0x00 dlen 21              #226 [hci1] 16.214431
      SMP: Pairing Confirm (0x03) len 16
        Confim value: be2a27218efd32082cad31114cf98705
> HCI Event: Number of Completed Packets (0x13) plen 5    #227 [hci1] 16.370184
        Num handles: 1
        Handle: 327 Address: DF:A9:FF:F6:B1:1A (OUI DF-A9-FF)
        Count: 1
        #226: len 21 (1 Kb/s)
        Latency: 155 msec (80-173 msec ~160 msec)
> ACL Data RX: Handle 327 flags 0x02 dlen 21              #228 [hci1] 16.370372
      SMP: Pairing Random (0x04) len 16
        Random value: 54e0e0bf2e3509980000000000000000
< HCI Command: Host Number of Com.. (0x03|0x0035) plen 5  #229 [hci1] 16.374669
        Num handles: 1
        Handle: 327 Address: DF:A9:FF:F6:B1:1A (OUI DF-A9-FF)
        Count: 1
