Bluetooth monitor ver 5.72
= Note: Linux version 6.14.0-36-generic (x86_64)                       0.031063
= Note: Bluetooth subsystem version 2.22                               0.031066
= New Index: 00:00:00:00:00:00 (Primary,UART,hci1)              [hci1] 0.031067
= New Index: 48:5F:99:8E:E0:64 (Primary,USB,hci0)               [hci0] 0.031068
= Open Index: 00:00:00:00:00:00                                 [hci1] 0.545184
= Index Info: 00:00:00:00:00:00 (Nordic Semiconductor ASA)      [hci1] 0.545205
@ USER Open: main (privileged) version 2.22            {0x0001} [hci1] 0.545213
< HCI Command: Reset (0x03|0x0003) plen 0                    #1 [hci1] 0.546493
> HCI Event: Command Complete (0x0e) plen 4                  #2 [hci1] 0.546979
      Reset (0x03|0x0003) ncmd 1
        Status: Success (0x00)
< HCI Command: Read Local Supported... (0x04|0x0003) plen 0  #3 [hci1] 0.564606
> HCI Event: Command Complete (0x0e) plen 12                 #4 [hci1] 0.565054
      Read Local Supported Features (0x04|0x0003) ncmd 1
        Status: Success (0x00)
        Features: 0x00 0x00 0x00 0x00 0x60 0x00 0x00 0x00
          BR/EDR Not Supported
          LE Supported (Controller)
< HCI Command: Read Local Version In.. (0x04|0x0001) plen 0  #5 [hci1] 0.584608
> HCI Event: Command Complete (0x0e) plen 12                 #6 [hci1] 0.585077
      Read Local Version Information (0x04|0x0001) ncmd 1
        Status: Success (0x00)
        HCI version: Reserved (0x0f) - Revision 12393 (0x3069)
        LMP version: Reserved (0x0f) - Subversion 12393 (0x3069)
        Manufacturer: Nordic Semiconductor ASA (89)
< HCI Command: Read Local Supported... (0x04|0x0002) plen 0  #7 [hci1] 0.604533
> HCI Event: Command Complete (0x0e) plen 68                 #8 [hci1] 0.605671
      Read Local Supported Commands (0x04|0x0002) ncmd 1
        Status: Success (0x00)
        Commands: 119 entries
          Disconnect (Octet 0 - Bit 5)
          Read Remote Version Information (Octet 2 - Bit 7)
          Set Event Mask (Octet 5 - Bit 6)
          Reset (Octet 5 - Bit 7)
          Read Connection Accept Timeout (Octet 7 - Bit 2)
          Write Connection Accept Timeout (Octet 7 - Bit 3)
          Read Transmit Power Level (Octet 10 - Bit 2)
          Set Controller To Host Flow Control (Octet 10 - Bit 5)
          Host Buffer Size (Octet 10 - Bit 6)
          Host Number of Completed Packets (Octet 10 - Bit 7)
          Read Local Version Information (Octet 14 - Bit 3)
          Read Local Supported Features (Octet 14 - Bit 5)
          Read BD ADDR (Octet 15 - Bit 1)
          Read RSSI (Octet 15 - Bit 5)
          Set Event Mask Page 2 (Octet 22 - Bit 2)
          LE Set Event Mask (Octet 25 - Bit 0)
          LE Read Buffer Size (Octet 25 - Bit 1)
          LE Read Local Supported Features (Octet 25 - Bit 2)
          LE Set Random Address (Octet 25 - Bit 4)
          LE Set Advertising Parameters (Octet 25 - Bit 5)
          LE Read Advertising Channel TX Power (Octet 25 - Bit 6)
          LE Set Advertising Data (Octet 25 - Bit 7)
          LE Set Scan Response Data (Octet 26 - Bit 0)
          LE Set Advertise Enable (Octet 26 - Bit 1)
          LE Set Scan Parameters (Octet 26 - Bit 2)
          LE Set Scan Enable (Octet 26 - Bit 3)
          LE Create Connection (Octet 26 - Bit 4)
          LE Create Connection Cancel (Octet 26 - Bit 5)
          LE Read Accept List Size (Octet 26 - Bit 6)
          LE Clear Accept List (Octet 26 - Bit 7)
          LE Add Device To Accept List (Octet 27 - Bit 0)
          LE Remove Device From Accept List (Octet 27 - Bit 1)
          LE Connection Update (Octet 27 - Bit 2)
          LE Set Host Channel Classification (Octet 27 - Bit 3)
          LE Read Channel Map (Octet 27 - Bit 4)
          LE Read Remote Used Features (Octet 27 - Bit 5)
          LE Encrypt (Octet 27 - Bit 6)
          LE Rand (Octet 27 - Bit 7)
          LE Start Encryption (Octet 28 - Bit 0)
          LE Long Term Key Request Reply (Octet 28 - Bit 1)
          LE Long Term Key Request Neg Reply (Octet 28 - Bit 2)
          LE Read Supported States (Octet 28 - Bit 3)
          LE Receiver Test (Octet 28 - Bit 4)
          LE Transmitter Test (Octet 28 - Bit 5)
          LE Test End (Octet 28 - Bit 6)
          Read Authenticated Payload Timeout (Octet 32 - Bit 4)
          Write Authenticated Payload Timeout (Octet 32 - Bit 5)
          LE Set Data Length (Octet 33 - Bit 6)
          LE Read Suggested Default Data Length (Octet 33 - Bit 7)
          LE Write Suggested Default Data Length (Octet 34 - Bit 0)
          LE Add Device To Resolving List (Octet 34 - Bit 3)
          LE Remove Device From Resolving List (Octet 34 - Bit 4)
          LE Clear Resolving List (Octet 34 - Bit 5)
          LE Read Resolving List Size (Octet 34 - Bit 6)
          LE Set Address Resolution Enable (Octet 35 - Bit 1)
          LE Set Resolvable Private Address Timeout (Octet 35 - Bit 2)
          LE Read Maximum Data Length (Octet 35 - Bit 3)
          LE Read PHY (Octet 35 - Bit 4)
          LE Set Default PHY (Octet 35 - Bit 5)
          LE Set PHY (Octet 35 - Bit 6)
          LE Enhanced Receiver Test (Octet 35 - Bit 7)
          LE Enhanced Transmitter Test (Octet 36 - Bit 0)
          LE Set Advertising Set Random Address (Octet 36 - Bit 1)
          LE Set Extended Advertising Parameters (Octet 36 - Bit 2)
          LE Set Extended Advertising Data (Octet 36 - Bit 3)
          LE Set Extended Scan Response Data (Octet 36 - Bit 4)
          LE Set Extended Advertising Enable (Octet 36 - Bit 5)
          LE Read Maximum Advertising Data Length (Octet 36 - Bit 6)
          LE Read Number of Supported Advertising Sets (Octet 36 - Bit 7)
          LE Remove Advertising Set (Octet 37 - Bit 0)
          LE Clear Advertising Sets (Octet 37 - Bit 1)
          LE Set Periodic Advertising Parameters (Octet 37 - Bit 2)
          LE Set Periodic Advertising Data (Octet 37 - Bit 3)
          LE Set Periodic Advertising Enable (Octet 37 - Bit 4)
          LE Set Extended Scan Parameters (Octet 37 - Bit 5)
          LE Set Extended Scan Enable (Octet 37 - Bit 6)
          LE Extended Create Connection (Octet 37 - Bit 7)
          LE Periodic Advertising Create Sync (Octet 38 - Bit 0)
          LE Periodic Advertising Create Sync Cancel (Octet 38 - Bit 1)
          LE Periodic Advertising Terminate Sync (Octet 38 - Bit 2)
          LE Add Device To Periodic Advertiser List (Octet 38 - Bit 3)
          LE Remove Device From Periodic Advertiser List (Octet 38 - Bit 4)
          LE Clear Periodic Advertiser List (Octet 38 - Bit 5)
          LE Read Periodic Advertiser List Size (Octet 38 - Bit 6)
          LE Read Transmit Power (Octet 38 - Bit 7)
          LE Read RF Path Compensation (Octet 39 - Bit 0)
          LE Write RF Path Compensation (Octet 39 - Bit 1)
          LE Set Privacy Mode (Octet 39 - Bit 2)
          LE Periodic Advertising Receive Enable (Octet 40 - Bit 5)
          LE Periodic Advertising Sync Transfer (Octet 40 - Bit 6)
          LE Periodic Advertising Set Info Transfer (Octet 40 - Bit 7)
          LE Periodic Advertising Sync Transfer Parameters (Octet 41 - Bit 0)
          LE Set Default Periodic Advertisng Sync Transfer Parameters (Octet 41 - Bit 1)
          LE Read Buffer v2 (Octet 41 - Bit 5)
          LE Read ISO TX Sync (Octet 41 - Bit 6)
          LE Set Connected Isochronous Group Parameters (Octet 41 - Bit 7)
          LE Set Connected Isochronous Group Parameters Test (Octet 42 - Bit 0)
          LE Create Connected Isochronous Stream (Octet 42 - Bit 1)
          LE Remove Connected Isochronous Group (Octet 42 - Bit 2)
          LE Accept Connected Isochronous Stream Request (Octet 42 - Bit 3)
          LE Reject Connected Isochronous Stream Request (Octet 42 - Bit 4)
          LE Create Broadcast Isochronous Group (Octet 42 - Bit 5)
          LE Create Broadcast Isochronous Group Test (Octet 42 - Bit 6)
          LE Terminate Broadcast Isochronous Group (Octet 42 - Bit 7)
          LE Broadcast Isochronous Group Create Sync (Octet 43 - Bit 0)
          LE Broadcast Isochronous Group Terminate Sync (Octet 43 - Bit 1)
          LE Request Peer SCA (Octet 43 - Bit 2)
          LE Setup Isochronous Data Path (Octet 43 - Bit 3)
          LE Remove Isochronous Data Path (Octet 43 - Bit 4)
          LE Isochronous Transmit Test (Octet 43 - Bit 5)
          LE Isochronous Receive Test (Octet 43 - Bit 6)
          LE Isochronous Read Test Counters (Octet 43 - Bit 7)
          LE Isochronous Read Test Counters (Octet 44 - Bit 0)
          LE Set Host Feature (Octet 44 - Bit 1)
          Octet 44 - Bit 2 
          Octet 45 - Bit 6 
          Octet 46 - Bit 0 
          Octet 46 - Bit 1 
          Octet 46 - Bit 2 
< HCI Command: Host Buffer Size (0x03|0x0033) plen 7         #9 [hci1] 0.624582
        ACL MTU: 255  ACL max packet: 16
        SCO MTU: 0    SCO max packet: 0
> HCI Event: Command Complete (0x0e) plen 4                 #10 [hci1] 0.625107
      Host Buffer Size (0x03|0x0033) ncmd 1
        Status: Success (0x00)
< HCI Command: Set Controller To Ho.. (0x03|0x0031) plen 1  #11 [hci1] 0.644593
        Flow control: ACL Data Packets (0x01)
> HCI Event: Command Complete (0x0e) plen 4                 #12 [hci1] 0.645094
      Set Controller To Host Flow Control (0x03|0x0031) ncmd 1
        Status: Success (0x00)
< HCI Command: LE Read Local Suppor.. (0x08|0x0003) plen 0  #13 [hci1] 0.664567
> HCI Event: Command Complete (0x0e) plen 12                #14 [hci1] 0.665157
      LE Read Local Supported Features (0x08|0x0003) ncmd 1
        Status: Success (0x00)
        Features: 0xfd 0x79 0x00 0xf7 0x30 0x01 0x00 0x00
          LE Encryption
          Extended Reject Indication
          Peripheral-initiated Features Exchange
          LE Ping
          LE Data Packet Length Extension
          LL Privacy
          Extended Scanner Filter Policies
          LE 2M PHY
          LE Coded PHY
          LE Extended Advertising
          LE Periodic Advertising
          Channel Selection Algorithm #2
          Periodic Advertising Sync Transfer - Sender
          Periodic Advertising Sync Transfer - Recipient
          Sleep Clock Accuracy Updates
          Connected Isochronous Stream - Central
          Connected Isochronous Stream - Peripheral
          Isochronous Broadcaster
          Synchronized Receiver
          Periodic Advertising ADI support
          Connection Subrating
          Unknown features (0x0000010000000000)
< HCI Command: LE Set Host Feature (0x08|0x0074) plen 2     #15 [hci1] 0.684570
        Bit Number: 32
          Connected Isochronous Stream (Host Support)
        Bit Value: 1
> HCI Event: Command Complete (0x0e) plen 4                 #16 [hci1] 0.685031
      LE Set Host Feature (0x08|0x0074) ncmd 1
        Status: Success (0x00)
< HCI Command: LE Read Buffer v2 (0x08|0x0060) plen 0       #17 [hci1] 0.704737
> HCI Event: Command Complete (0x0e) plen 10                #18 [hci1] 0.705133
      LE Read Buffer v2 (0x08|0x0060) ncmd 1
        Status: Success (0x00)
        ACL MTU: 27
        ACL max packet: 3
        ISO MTU: 318
        ISO max packet: 3
< HCI Command: LE Read Maximum Adve.. (0x08|0x003a) plen 0  #19 [hci1] 0.724664
> HCI Event: Command Complete (0x0e) plen 6                 #20 [hci1] 0.725170
      LE Read Maximum Advertising Data Length (0x08|0x003a) ncmd 1
        Status: Success (0x00)
        Max length: 1650
< HCI Command: LE Read Supported St.. (0x08|0x001c) plen 0  #21 [hci1] 0.744591
> HCI Event: Command Complete (0x0e) plen 12                #22 [hci1] 0.745173
      LE Read Supported States (0x08|0x001c) ncmd 1
        Status: Success (0x00)
        States: 0x000003ff3e0306ff
          Non-connectable Advertising State
          Scannable Advertising State
          Connectable Advertising State
          High Duty Cycle Directed Advertising State
          Passive Scanning State
          Active Scanning State
          Initiating State
            and Connection State (Central Role)
          Connection State (Peripheral Role)
          Scannable Advertising State
            and Passive Scanning State
          Connectable Advertising State
            and Passive Scanning State
          Non-connectable Advertising State
            and Initiating State
          Scannable Advertising State
            and Initiating State
          Active Scanning State
            and Connection State (Central Role)
          Passive Scanning State
            and Connection State (Peripheral Role)
          Active Scanning State
            and Connection State (Peripheral Role)
          Initiating State
            and Connection State (Central Role)
            and Central Role & Central Role
          Low Duty Cycle Directed Advertising State
          Connectable Advertising State
            and Initiating State
            and Central Role & Peripheral Role
          High Duty Cycle Directed Advertising State
            and Initiating State
            and Central Role & Peripheral Role
          Low Duty Cycle Directed Advertising State
            and Initiating State
            and Central Role & Peripheral Role
          Connectable Advertising State
            and Connection State (Central Role)
            and Central Role & Peripheral Role
          High Duty Cycle Directed Advertising State
            and Connection State (Central Role)
            and Central Role & Peripheral Role
          Low Duty Cycle Directed Advertising State
            and Connection State (Central Role)
            and Central Role & Peripheral Role
          Connectable Advertising State
            and Connection State (Peripheral Role)
            and Central Role & Peripheral Role
          High Duty Cycle Directed Advertising State
            and Connection State (Peripheral Role)
            and Peripheral Role & Peripheral Role
          Low Duty Cycle Directed Advertising State
            and Connection State (Peripheral Role)
            and Peripheral Role & Peripheral Role
          Initiating State
            and Connection State (Peripheral Role)
            and Central Role & Peripheral Role
< HCI Command: LE Read Maximum Data.. (0x08|0x002f) plen 0  #23 [hci1] 0.764594
> HCI Event: Command Complete (0x0e) plen 12                #24 [hci1] 0.765056
      LE Read Maximum Data Length (0x08|0x002f) ncmd 1
        Status: Success (0x00)
        Max TX octets: 251
        Max TX time: 2704
        Max RX octets: 251
        Max RX time: 2704
< HCI Command: LE Write Suggested D.. (0x08|0x0024) plen 4  #25 [hci1] 0.784570
        TX octets: 251
        TX time: 2704
> HCI Event: Command Complete (0x0e) plen 4                 #26 [hci1] 0.785037
      LE Write Suggested Default Data Length (0x08|0x0024) ncmd 1
        Status: Success (0x00)
< HCI Command: LE Read Resolving Li.. (0x08|0x002a) plen 0  #27 [hci1] 0.804588
> HCI Event: Command Complete (0x0e) plen 5                 #28 [hci1] 0.804960
      LE Read Resolving List Size (0x08|0x002a) ncmd 1
        Status: Success (0x00)
        Size: 8
< HCI Command: LE Set Event Mask (0x08|0x0001) plen 8       #29 [hci1] 0.824585
        Mask: 0x000002023f87fa5e
          LE Advertising Report
          LE Connection Update Complete
          LE Read Remote Used Features Complete
          LE Long Term Key Request
          LE Data Length Change
          LE Enhanced Connection Complete
          LE PHY Update Complete
          LE Extended Advertising Report
          LE Periodic Advertising Sync Established
          LE Periodic Advertising Report
          LE Periodic Advertising Sync Lost
          LE Extended Scan Timeout
          LE Extended Advertising Set Terminated
          LE Scan Request Received
          LE Periodic Advertising Sync Transfer Rvc
          LE CIS Established
          LE CIS Request
          LE Create BIG Complete
          LE Terminate BIG Complete
          LE BIG Sync Estabilished Complete
          LE BIG Sync Lost
          LE BIG Info Advertising Report
          Unknown mask (0x0000020000000000)
> HCI Event: Command Complete (0x0e) plen 4                 #30 [hci1] 0.825018
      LE Set Event Mask (0x08|0x0001) ncmd 1
        Status: Success (0x00)
< HCI Command: Set Event Mask (0x03|0x0001) plen 8          #31 [hci1] 0.844575
        Mask: 0x2000800002008890
          Disconnection Complete
          Encryption Change
          Read Remote Version Information Complete
          Hardware Error
          Data Buffer Overflow
          Encryption Key Refresh Complete
          LE Meta
> HCI Event: Command Complete (0x0e) plen 4                 #32 [hci1] 0.845059
      Set Event Mask (0x03|0x0001) ncmd 1
        Status: Success (0x00)
< HCI Command: Read BD ADDR (0x04|0x0009) plen 0            #33 [hci1] 0.864606
> HCI Event: Command Complete (0x0e) plen 10                #34 [hci1] 0.865115
      Read BD ADDR (0x04|0x0009) ncmd 1
        Status: Success (0x00)
        Address: 00:00:00:00:00:00 (OUI 00-00-00)
< HCI Command: LE Set Random Address (0x08|0x0005) plen 6   #35 [hci1] 0.884579
        Address: D5:B6:CC:31:DB:3B (Static)
> HCI Event: Command Complete (0x0e) plen 4                 #36 [hci1] 0.885050
      LE Set Random Address (0x08|0x0005) ncmd 1
        Status: Success (0x00)
< HCI Command: LE Set Extended Adv.. (0x08|0x0036) plen 25  #37 [hci1] 5.214602
        Handle: 0x00
        Properties: 0x0013
          Connectable
          Scannable
          Use legacy advertising PDUs: ADV_IND
        Min advertising interval: 100.000 msec (0x00a0)
        Max advertising interval: 150.000 msec (0x00f0)
        Channel map: 37, 38, 39 (0x07)
        Own address type: Random (0x01)
        Peer address type: Public (0x00)
        Peer address: 00:00:00:00:00:00 (OUI 00-00-00)
        Filter policy: Allow Scan Request from Any, Allow Connect Request from Any (0x00)
        TX power: Host has no preference (0x7f)
        Primary PHY: LE 1M (0x01)
        Secondary max skip: 0x00
        Secondary PHY: LE 1M (0x01)
        SID: 0x00
        Scan request notifications: Disabled (0x00)
> HCI Event: Command Complete (0x0e) plen 5                 #38 [hci1] 5.215434
      LE Set Extended Advertising Parameters (0x08|0x0036) ncmd 1
        Status: Success (0x00)
        TX power (selected): 0 dbm (0x00)
< HCI Command: LE Set Advertising S.. (0x08|0x0035) plen 7  #39 [hci1] 5.224652
        Advertising handle: 0x00
        Advertising random address: D5:B6:CC:31:DB:3B (Static)
> HCI Event: Command Complete (0x0e) plen 4                 #40 [hci1] 5.225161
      LE Set Advertising Set Random Address (0x08|0x0035) ncmd 1
        Status: Success (0x00)
< HCI Command: LE Set Extended Adv.. (0x08|0x0037) plen 22  #41 [hci1] 5.244611
        Handle: 0x00
        Operation: Complete extended advertising data (0x03)
        Fragment preference: Minimize fragmentation (0x01)
        Data length: 0x12
        Flags: 0x06
          LE General Discoverable Mode
          BR/EDR Not Supported
        Name (complete): Tester_F6B11A
> HCI Event: Command Complete (0x0e) plen 4                 #42 [hci1] 5.245411
      LE Set Extended Advertising Data (0x08|0x0037) ncmd 1
        Status: Success (0x00)
< HCI Command: LE Set Extended Scan.. (0x08|0x0038) plen 4  #43 [hci1] 5.264631
        Handle: 0x00
        Operation: Complete scan response data (0x03)
        Fragment preference: Minimize fragmentation (0x01)
        Data length: 0x00
> HCI Event: Command Complete (0x0e) plen 4                 #44 [hci1] 5.265230
      LE Set Extended Scan Response Data (0x08|0x0038) ncmd 1
        Status: Success (0x00)
< HCI Command: LE Set Extended Adve.. (0x08|0x0039) plen 6  #45 [hci1] 5.284613
        Extended advertising: Enabled (0x01)
        Number of sets: 1 (0x01)
        Entry 0
          Handle: 0x00
          Duration: 0 ms (0x00)
          Max ext adv events: 0
> HCI Event: Command Complete (0x0e) plen 4                 #46 [hci1] 5.285181
      LE Set Extended Advertising Enable (0x08|0x0039) ncmd 1
        Status: Success (0x00)
> HCI Event: LE Meta Event (0x3e) plen 31                   #47 [hci1] 5.600297
      LE Enhanced Connection Complete (0x0a)
        Status: Success (0x00)
        Handle: 1767
        Role: Peripheral (0x01)
        Peer address type: Public (0x00)
        Peer address: DF:A9:FF:F6:B1:1A (OUI DF-A9-FF)
        Local resolvable private address: 00:00:00:00:00:00 (Non-Resolvable)
        Peer resolvable private address: 00:00:00:00:00:00 (Non-Resolvable)
        Connection interval: 87.50 msec (0x0046)
        Connection latency: 0 (0x0000)
        Supervision timeout: 20000 msec (0x07d0)
        Central clock accuracy: 0x01
> HCI Event: LE Meta Event (0x3e) plen 6                    #48 [hci1] 5.600353
      LE Advertising Set Terminated (0x12)
        Status: Success (0x00)
        Handle: 0
        Connection handle: 1767
        Number of completed extended advertising events: 0
< HCI Command: LE Read Remote Used... (0x08|0x0016) plen 2  #49 [hci1] 5.604868
        Handle: 1767 Address: DF:A9:FF:F6:B1:1A (OUI DF-A9-FF)
> HCI Event: Command Status (0x0f) plen 4                   #50 [hci1] 5.605271
      LE Read Remote Used Features (0x08|0x0016) ncmd 1
        Status: Success (0x00)
> HCI Event: LE Meta Event (0x3e) plen 12                   #51 [hci1] 5.864093
      LE Read Remote Used Features (0x04)
        Status: Success (0x00)
        Handle: 1767 Address: DF:A9:FF:F6:B1:1A (OUI DF-A9-FF)
        Features: 0x2d 0x49 0x00 0xf7 0x67 0xd8 0x00 0x00
          LE Encryption
          Extended Reject Indication
          Peripheral-initiated Features Exchange
          LE Data Packet Length Extension
          LE 2M PHY
          LE Coded PHY
          Channel Selection Algorithm #2
          Periodic Advertising Sync Transfer - Sender
          Periodic Advertising Sync Transfer - Recipient
          Sleep Clock Accuracy Updates
          Connected Isochronous Stream - Central
          Connected Isochronous Stream - Peripheral
          Isochronous Broadcaster
          Synchronized Receiver
          Connected Isochronous Stream (Host Support)
          LE Power Control Request
          LE Power Control Request
          Connection Subrating
          Connection Subrating (Host Support)
          Unknown features (0x0000d80000000000)
< ACL Data TX: Handle 1767 flags 0x00 dlen 16              #52 [hci1] 10.614706
      LE L2CAP: Connection Parameter Update Request (0x12) ident 1 len 8
        Min interval: 24
        Max interval: 40
        Peripheral latency: 0
        Timeout multiplier: 42
> HCI Event: Number of Completed Packets (0x13) plen 5     #53 [hci1] 10.763703
        Num handles: 1
        Handle: 1767 Address: DF:A9:FF:F6:B1:1A (OUI DF-A9-FF)
        Count: 1
        #52: len 16 (0 Kb/s)
        Latency: 148 msec (148-148 msec ~148 msec)
> ACL Data RX: Handle 1767 flags 0x02 dlen 10              #54 [hci1] 10.764120
      LE L2CAP: Connection Parameter Update Response (0x13) ident 1 len 2
        Result: Connection Parameters accepted (0x0000)
< HCI Command: Host Number of Comp.. (0x03|0x0035) plen 5  #55 [hci1] 10.765140
        Num handles: 1
        Handle: 1767 Address: DF:A9:FF:F6:B1:1A (OUI DF-A9-FF)
        Count: 1
> ACL Data RX: Handle 1767 flags 0x02 dlen 11              #56 [hci1] 13.476287
      SMP: Pairing Request (0x01) len 6
        IO capability: KeyboardDisplay (0x04)
        OOB data: Authentication data not present (0x00)
        Authentication requirement: Bonding, No MITM, SC, No Keypresses (0x09)
        Max encryption key size: 16
        Initiator key distribution: EncKey IdKey Sign (0x07)
        Responder key distribution: EncKey IdKey Sign (0x07)
< HCI Command: Host Number of Comp.. (0x03|0x0035) plen 5  #57 [hci1] 13.485287
        Num handles: 1
        Handle: 1767 Address: DF:A9:FF:F6:B1:1A (OUI DF-A9-FF)
        Count: 1
< ACL Data TX: Handle 1767 flags 0x00 dlen 11              #58 [hci1] 13.485408
      SMP: Pairing Response (0x02) len 6
        IO capability: NoInputNoOutput (0x03)
        OOB data: Authentication data not present (0x00)
        Authentication requirement: Bonding, No MITM, SC, No Keypresses (0x09)
        Max encryption key size: 16
        Initiator key distribution: IdKey (0x02)
        Responder key distribution: <none> (0x00)
> HCI Event: Number of Completed Packets (0x13) plen 5     #59 [hci1] 13.651323
        Num handles: 1
        Handle: 1767 Address: DF:A9:FF:F6:B1:1A (OUI DF-A9-FF)
        Count: 1
        #58: len 11 (0 Kb/s)
        Latency: 165 msec (148-165 msec ~157 msec)
> ACL Data RX: Handle 1767 flags 0x02 dlen 27              #60 [hci1] 13.651600
> ACL Data RX: Handle 1767 flags 0x01 dlen 27              #61 [hci1] 13.652161
> ACL Data RX: Handle 1767 flags 0x01 dlen 15              #62 [hci1] 13.652608
      SMP: Pairing Public Key (0x0c) len 64
        X: 6fc0211df19cfaa524a4fd84991450036d65323bda27543590f94be8d47afea1
        Y: 27d391db33998ace1fda27691bce672011952a53879e65d9d0a386f60445257d
< HCI Command: Host Number of Comp.. (0x03|0x0035) plen 5  #63 [hci1] 13.665603
        Num handles: 1
        Handle: 1767 Address: DF:A9:FF:F6:B1:1A (OUI DF-A9-FF)
        Count: 1
< HCI Command: Host Number of Comp.. (0x03|0x0035) plen 5  #64 [hci1] 13.665810
        Num handles: 1
        Handle: 1767 Address: DF:A9:FF:F6:B1:1A (OUI DF-A9-FF)
        Count: 1
< HCI Command: Host Number of Comp.. (0x03|0x0035) plen 5  #65 [hci1] 13.666082
        Num handles: 1
        Handle: 1767 Address: DF:A9:FF:F6:B1:1A (OUI DF-A9-FF)
        Count: 1
< ACL Data TX: Handle 1767 flags 0x00 dlen 27              #66 [hci1] 13.666139
< ACL Data TX: Handle 1767 flags 0x01 dlen 27              #67 [hci1] 13.666146
< ACL Data TX: Handle 1767 flags 0x01 dlen 15              #68 [hci1] 13.666167
      SMP: Pairing Public Key (0x0c) len 64
        X: 98308440221e2d910f0e54b71e7ec652857aa9b5a0dc65028824cc19db1226e9
        Y: 67a4816bcb62efb21701e31fdb27561a6217575fb007a8bbdabe7e28b6f68482
> HCI Event: Number of Completed Packets (0x13) plen 5     #69 [hci1] 13.739236
        Num handles: 1
        Handle: 1767 Address: DF:A9:FF:F6:B1:1A (OUI DF-A9-FF)
        Count: 1
        #66: len 27 (2 Kb/s)
        Latency: 73 msec (73-165 msec ~115 msec)
> HCI Event: Number of Completed Packets (0x13) plen 5     #70 [hci1] 13.740012
        Num handles: 1
        Handle: 1767 Address: DF:A9:FF:F6:B1:1A (OUI DF-A9-FF)
        Count: 1
        #67: len 27 (2 Kb/s)
        Latency: 73 msec (73-165 msec ~94 msec)
< ACL Data TX: Handle 1767 flags 0x00 dlen 21              #71 [hci1] 13.745017
      SMP: Pairing Confirm (0x03) len 16
        Confim value: 0b5904fb98e767b47a60097f1c1cf60e
> HCI Event: Number of Completed Packets (0x13) plen 5     #72 [hci1] 13.826099
        Num handles: 1
        Handle: 1767 Address: DF:A9:FF:F6:B1:1A (OUI DF-A9-FF)
        Count: 1
        #68: len 15 (0 Kb/s)
        Latency: 159 msec (73-165 msec ~127 msec)
> HCI Event: Number of Completed Packets (0x13) plen 5     #73 [hci1] 13.913702
        Num handles: 1
        Handle: 1767 Address: DF:A9:FF:F6:B1:1A (OUI DF-A9-FF)
        Count: 1
        #71: len 21 (1 Kb/s)
        Latency: 168 msec (73-168 msec ~147 msec)
> ACL Data RX: Handle 1767 flags 0x02 dlen 21              #74 [hci1] 13.914019
      SMP: Pairing Random (0x04) len 16
        Random value: fdd29fb4c01579b90000000000000000
< HCI Command: Host Number of Comp.. (0x03|0x0035) plen 5  #75 [hci1] 13.925093
        Num handles: 1
        Handle: 1767 Address: DF:A9:FF:F6:B1:1A (OUI DF-A9-FF)
        Count: 1
< ACL Data TX: Handle 1767 flags 0x00 dlen 21              #76 [hci1] 13.925123
      SMP: Pairing Random (0x04) len 16
        Random value: 8e6108f966a694cbe26df70bb96773e6
> HCI Event: Number of Completed Packets (0x13) plen 5     #77 [hci1] 14.088624
        Num handles: 1
        Handle: 1767 Address: DF:A9:FF:F6:B1:1A (OUI DF-A9-FF)
        Count: 1
        #76: len 21 (1 Kb/s)
        Latency: 163 msec (73-168 msec ~155 msec)
> ACL Data RX: Handle 1767 flags 0x02 dlen 21              #78 [hci1] 14.263909
      SMP: Pairing DHKey Check (0x0d) len 16
        E: 7ebaef21f82028f8f0e5e57a07725bf0
< HCI Command: Host Number of Comp.. (0x03|0x0035) plen 5  #79 [hci1] 14.264963
        Num handles: 1
        Handle: 1767 Address: DF:A9:FF:F6:B1:1A (OUI DF-A9-FF)
        Count: 1
< ACL Data TX: Handle 1767 flags 0x00 dlen 21              #80 [hci1] 14.265080
      SMP: Pairing DHKey Check (0x0d) len 16
        E: 83e1e1211460ed32b03c4ecd8e0239b4
> HCI Event: Number of Completed Packets (0x13) plen 5     #81 [hci1] 14.438522
        Num handles: 1
        Handle: 1767 Address: DF:A9:FF:F6:B1:1A (OUI DF-A9-FF)
        Count: 1
        #80: len 21 (0 Kb/s)
        Latency: 173 msec (73-173 msec ~164 msec)
> HCI Event: LE Meta Event (0x3e) plen 13                  #82 [hci1] 14.526558
      LE Long Term Key Request (0x05)
        Handle: 1767 Address: DF:A9:FF:F6:B1:1A (OUI DF-A9-FF)
        Random number: 0x0000000000000000
        Encrypted diversifier: 0x0000
< HCI Command: LE Long Term Key R.. (0x08|0x001a) plen 18  #83 [hci1] 14.545127
        Handle: 1767 Address: DF:A9:FF:F6:B1:1A (OUI DF-A9-FF)
        Long term key: de3145279f24cb144c9ff2ccde88f625
> HCI Event: Command Complete (0x0e) plen 6                #84 [hci1] 14.545836
      LE Long Term Key Request Reply (0x08|0x001a) ncmd 1
        Status: Success (0x00)
        Handle: 1767 Address: DF:A9:FF:F6:B1:1A (OUI DF-A9-FF)
> HCI Event: Encryption Change (0x08) plen 4               #85 [hci1] 14.963948
        Status: Success (0x00)
        Handle: 1767 Address: DF:A9:FF:F6:B1:1A (OUI DF-A9-FF)
        Encryption: Enabled with AES-CCM (0x01)
> ACL Data RX: Handle 1767 flags 0x02 dlen 21              #86 [hci1] 15.051417
      SMP: Identity Information (0x08) len 16
        Identity resolving key: 58b4ccef6fa39dddc67bbad52d9e8cf2
< HCI Command: Host Number of Comp.. (0x03|0x0035) plen 5  #87 [hci1] 15.075487
        Num handles: 1
        Handle: 1767 Address: DF:A9:FF:F6:B1:1A (OUI DF-A9-FF)
        Count: 1
> ACL Data RX: Handle 1767 flags 0x02 dlen 12              #88 [hci1] 15.138751
      SMP: Identity Address Information (0x09) len 7
        Address: DF:A9:FF:F6:B1:1A (OUI DF-A9-FF)
> ACL Data RX: Handle 1767 flags 0x02 dlen 26              #89 [hci1] 15.139603
      LE L2CAP: Enhanced Credit Connection Request (0x17) ident 1 len 18
        PSM: 39 (0x0027)
        MTU: 64
        MPS: 64
        Credits: 5
        Source CID: 84
        Source CID: 83
        Source CID: 82
        Source CID: 81
        Source CID: 80
< HCI Command: LE Add Device To R.. (0x08|0x0027) plen 39  #90 [hci1] 15.145416
        Address type: Public (0x00)
        Address: DF:A9:FF:F6:B1:1A (OUI DF-A9-FF)
        Peer identity resolving key: 58b4ccef6fa39dddc67bbad52d9e8cf2
        Local identity resolving key: 00000000000000000000000000000000
> HCI Event: Command Complete (0x0e) plen 4                #91 [hci1] 15.146444
      LE Add Device To Resolving List (0x08|0x0027) ncmd 1
        Status: Success (0x00)
< HCI Command: LE Set Privacy Mode (0x08|0x004e) plen 8    #92 [hci1] 15.165217
        Peer Identity address type: Public (0x00)
        Peer Identity address: DF:A9:FF:F6:B1:1A (OUI DF-A9-FF)
        Privacy Mode: Use Device Privacy (0x01)
> HCI Event: Command Complete (0x0e) plen 4                #93 [hci1] 15.165910
      LE Set Privacy Mode (0x08|0x004e) ncmd 1
        Status: Success (0x00)
< HCI Command: LE Set Address Reso.. (0x08|0x002d) plen 1  #94 [hci1] 15.185199
        Address resolution: Enabled (0x01)
> HCI Event: Command Complete (0x0e) plen 4                #95 [hci1] 15.185732
      LE Set Address Resolution Enable (0x08|0x002d) ncmd 1
        Status: Success (0x00)
< HCI Command: Host Number of Comp.. (0x03|0x0035) plen 5  #96 [hci1] 15.205019
        Num handles: 1
        Handle: 1767 Address: DF:A9:FF:F6:B1:1A (OUI DF-A9-FF)
        Count: 1
< HCI Command: Host Number of Comp.. (0x03|0x0035) plen 5  #97 [hci1] 15.205566
        Num handles: 1
        Handle: 1767 Address: DF:A9:FF:F6:B1:1A (OUI DF-A9-FF)
        Count: 1
< ACL Data TX: Handle 1767 flags 0x00 dlen 26              #98 [hci1] 15.205711
      LE L2CAP: Enhanced Credit Connection Response (0x18) ident 1 len 18
        MTU: 249
        MPS: 251
        Credits: 1
        Result: Connection successful (0x0000)
        Destination CID: 64
        Destination CID: 65
        Destination CID: 66
        Destination CID: 67
        Destination CID: 68
> HCI Event: Number of Completed Packets (0x13) plen 5     #99 [hci1] 15.313550
        Num handles: 1
        Handle: 1767 Address: DF:A9:FF:F6:B1:1A (OUI DF-A9-FF)
        Count: 1
        #98: len 26 (1 Kb/s)
        Latency: 107 msec (73-173 msec ~136 msec)
< ACL Data TX: Handle 1767 flags 0x00 dlen 9              #100 [hci1] 18.704997
      Channel: 80 len 5 sdu 3 [PSM 39 mode Enhanced Credit (0x81)] {chan 4}
      ATT: Read Request (0x0a) len 2
        Handle: 0x0045
> HCI Event: Number of Completed Packets (0x13) plen 5    #101 [hci1] 18.813678
        Num handles: 1
        Handle: 1767 Address: DF:A9:FF:F6:B1:1A (OUI DF-A9-FF)
        Count: 1
        #100: len 9 (0 Kb/s)
        Latency: 108 msec (73-173 msec ~122 msec)
        Channel: 80 [PSM 39 mode Enhanced Credit (0x81)] {chan 4}
        Channel Latency: 108 msec (108-108 msec ~108 msec)
> ACL Data RX: Handle 1767 flags 0x02 dlen 27             #102 [hci1] 18.813980
> ACL Data RX: Handle 1767 flags 0x01 dlen 27             #103 [hci1] 18.814609
> ACL Data RX: Handle 1767 flags 0x01 dlen 16             #104 [hci1] 18.815095
      Channel: 68 len 66 sdu 64 [PSM 39 mode Enhanced Credit (0x81)] {chan 4}
      ATT: Read Response (0x0b) len 63
< HCI Command: Host Number of Com.. (0x03|0x0035) plen 5  #105 [hci1] 18.825166
        Num handles: 1
        Handle: 1767 Address: DF:A9:FF:F6:B1:1A (OUI DF-A9-FF)
        Count: 1
< HCI Command: Host Number of Com.. (0x03|0x0035) plen 5  #106 [hci1] 18.825172
        Num handles: 1
        Handle: 1767 Address: DF:A9:FF:F6:B1:1A (OUI DF-A9-FF)
        Count: 1
< HCI Command: Host Number of Com.. (0x03|0x0035) plen 5  #107 [hci1] 18.825199
        Num handles: 1
        Handle: 1767 Address: DF:A9:FF:F6:B1:1A (OUI DF-A9-FF)
        Count: 1
< ACL Data TX: Handle 1767 flags 0x00 dlen 11             #108 [hci1] 18.825285
      Channel: 80 len 7 sdu 5 [PSM 39 mode Enhanced Credit (0x81)] {chan 4}
      ATT: Read Blob Request (0x0c) len 4
        Handle: 0x0045
        Offset: 0x003f
< ACL Data TX: Handle 1767 flags 0x00 dlen 12             #109 [hci1] 18.825303
      LE L2CAP: LE Flow Control Credit (0x16) ident 2 len 4
        Source CID: 68
        Credits: 1
> HCI Event: Number of Completed Packets (0x13) plen 5    #110 [hci1] 18.901511
        Num handles: 1
        Handle: 1767 Address: DF:A9:FF:F6:B1:1A (OUI DF-A9-FF)
        Count: 1
        #108: len 11 (1 Kb/s)
        Latency: 76 msec (73-173 msec ~99 msec)
        Channel: 80 [PSM 39 mode Enhanced Credit (0x81)] {chan 4}
        Channel Latency: 76 msec (76-108 msec ~92 msec)
> HCI Event: Number of Completed Packets (0x13) plen 5    #111 [hci1] 18.988731
        Num handles: 1
        Handle: 1767 Address: DF:A9:FF:F6:B1:1A (OUI DF-A9-FF)
        Count: 1
        #109: len 12 (0 Kb/s)
        Latency: 163 msec (73-173 msec ~131 msec)
        Channel: 80 [PSM 39 mode Enhanced Credit (0x81)] {chan 4}
        Channel Latency: 163 msec (76-163 msec ~127 msec)
> ACL Data RX: Handle 1767 flags 0x02 dlen 27             #112 [hci1] 18.989078
> ACL Data RX: Handle 1767 flags 0x01 dlen 27             #113 [hci1] 18.989602
> ACL Data RX: Handle 1767 flags 0x01 dlen 16             #114 [hci1] 18.990085
      Channel: 68 len 66 sdu 64 [PSM 39 mode Enhanced Credit (0x81)] {chan 4}
      ATT: Read Blob Response (0x0d) len 63
        33 33 34 34 34 34 34 35 35 35 35 35 36 36 36 36  3344444555556666
        36 37 37 37 37 37 38 38 38 38 38 39 39 39 39 39  6777778888899999
        30 30 30 30 30 31 31 31 31 31 32 32 32 32 32 33  0000011111222223
        33 33 33 33 34 34 34 34 34 35 35 35 35 35 36     333344444555556 
< HCI Command: Host Number of Com.. (0x03|0x0035) plen 5  #115 [hci1] 19.005180
        Num handles: 1
        Handle: 1767 Address: DF:A9:FF:F6:B1:1A (OUI DF-A9-FF)
        Count: 1
< HCI Command: Host Number of Com.. (0x03|0x0035) plen 5  #116 [hci1] 19.005255
        Num handles: 1
        Handle: 1767 Address: DF:A9:FF:F6:B1:1A (OUI DF-A9-FF)
        Count: 1
< HCI Command: Host Number of Com.. (0x03|0x0035) plen 5  #117 [hci1] 19.005302
        Num handles: 1
        Handle: 1767 Address: DF:A9:FF:F6:B1:1A (OUI DF-A9-FF)
        Count: 1
< ACL Data TX: Handle 1767 flags 0x00 dlen 11             #118 [hci1] 19.005446
      Channel: 80 len 7 sdu 5 [PSM 39 mode Enhanced Credit (0x81)] {chan 4}
      ATT: Read Blob Request (0x0c) len 4
        Handle: 0x0045
        Offset: 0x007e
< ACL Data TX: Handle 1767 flags 0x00 dlen 12             #119 [hci1] 19.005450
      LE L2CAP: LE Flow Control Credit (0x16) ident 3 len 4
        Source CID: 68
        Credits: 1
> HCI Event: Number of Completed Packets (0x13) plen 5    #120 [hci1] 19.076421
        Num handles: 1
        Handle: 1767 Address: DF:A9:FF:F6:B1:1A (OUI DF-A9-FF)
        Count: 1
        #118: len 11 (1 Kb/s)
        Latency: 70 msec (70-173 msec ~101 msec)
        Channel: 80 [PSM 39 mode Enhanced Credit (0x81)] {chan 4}
        Channel Latency: 70 msec (70-163 msec ~99 msec)
> HCI Event: Number of Completed Packets (0x13) plen 5    #121 [hci1] 19.163688
        Num handles: 1
        Handle: 1767 Address: DF:A9:FF:F6:B1:1A (OUI DF-A9-FF)
        Count: 1
        #119: len 12 (0 Kb/s)
        Latency: 158 msec (70-173 msec ~129 msec)
> ACL Data RX: Handle 1767 flags 0x02 dlen 27             #122 [hci1] 19.164035
> ACL Data RX: Handle 1767 flags 0x01 dlen 27             #123 [hci1] 19.164573
< HCI Command: Host Number of Com.. (0x03|0x0035) plen 5  #124 [hci1] 19.165029
        Num handles: 1
        Handle: 1767 Address: DF:A9:FF:F6:B1:1A (OUI DF-A9-FF)
        Count: 1
> ACL Data RX: Handle 1767 flags 0x01 dlen 16             #125 [hci1] 19.165055
      Channel: 68 len 66 sdu 64 [PSM 39 mode Enhanced Credit (0x81)] {chan 4}
      ATT: Read Blob Response (0x0d) len 63
        36 36 36 36 37 37 37 37 37 38 38 38 38 38 39 39  6666777778888899
        39 39 39 30 30 30 30 30 31 31 31 31 31 32 32 32  9990000011111222
        32 32 33 33 33 33 33 34 34 34 34 34 35 35 35 35  2233333444445555
        35 36 36 36 36 36 37 37 37 37 37 38 38 38 38     566666777778888 
< HCI Command: Host Number of Com.. (0x03|0x0035) plen 5  #126 [hci1] 19.184943
        Num handles: 1
        Handle: 1767 Address: DF:A9:FF:F6:B1:1A (OUI DF-A9-FF)
        Count: 1
< HCI Command: Host Number of Com.. (0x03|0x0035) plen 5  #127 [hci1] 19.184958
        Num handles: 1
        Handle: 1767 Address: DF:A9:FF:F6:B1:1A (OUI DF-A9-FF)
        Count: 1
< ACL Data TX: Handle 1767 flags 0x00 dlen 11             #128 [hci1] 19.185099
      Channel: 80 len 7 sdu 5 [PSM 39 mode Enhanced Credit (0x81)] {chan 4}
      ATT: Read Blob Request (0x0c) len 4
        Handle: 0x0045
        Offset: 0x00bd
< ACL Data TX: Handle 1767 flags 0x00 dlen 12             #129 [hci1] 19.185205
      LE L2CAP: LE Flow Control Credit (0x16) ident 4 len 4
        Source CID: 68
        Credits: 1
> HCI Event: Number of Completed Packets (0x13) plen 5    #130 [hci1] 19.251623
        Num handles: 1
        Handle: 1767 Address: DF:A9:FF:F6:B1:1A (OUI DF-A9-FF)
        Count: 1
        #128: len 11 (1 Kb/s)
        Latency: 66 msec (66-173 msec ~98 msec)
        Channel: 80 [PSM 39 mode Enhanced Credit (0x81)] {chan 4}
        Channel Latency: 66 msec (66-163 msec ~82 msec)
> HCI Event: Number of Completed Packets (0x13) plen 5    #131 [hci1] 19.338555
        Num handles: 1
        Handle: 1767 Address: DF:A9:FF:F6:B1:1A (OUI DF-A9-FF)
        Count: 1
        #129: len 12 (0 Kb/s)
        Latency: 153 msec (66-173 msec ~125 msec)
        Channel: 80 [PSM 39 mode Enhanced Credit (0x81)] {chan 4}
        Channel Latency: 153 msec (66-163 msec ~118 msec)
> ACL Data RX: Handle 1767 flags 0x02 dlen 12             #132 [hci1] 19.338759
      LE L2CAP: LE Flow Control Credit (0x16) ident 2 len 4
        Source CID: 80
        Credits: 10
> ACL Data RX: Handle 1767 flags 0x02 dlen 27             #133 [hci1] 19.339427
> ACL Data RX: Handle 1767 flags 0x01 dlen 27             #134 [hci1] 19.340215
> ACL Data RX: Handle 1767 flags 0x01 dlen 16             #135 [hci1] 19.340648
      Channel: 68 len 66 sdu 64 [PSM 39 mode Enhanced Credit (0x81)] {chan 4}
      ATT: Read Blob Response (0x0d) len 63
        38 39 39 39 39 39 30 30 30 30 30 31 31 31 31 31  8999990000011111
        32 32 32 32 32 33 33 33 33 33 34 34 34 34 34 35  2222233333444445
        35 35 35 35 36 36 36 36 36 37 37 37 37 37 38 38  5555666667777788
        38 38 38 39 39 39 39 39 30 30 30 30 30 31 31     888999990000011 
< HCI Command: Host Number of Com.. (0x03|0x0035) plen 5  #136 [hci1] 19.345079
        Num handles: 1
        Handle: 1767 Address: DF:A9:FF:F6:B1:1A (OUI DF-A9-FF)
        Count: 1
< HCI Command: Host Number of Com.. (0x03|0x0035) plen 5  #137 [hci1] 19.345282
        Num handles: 1
        Handle: 1767 Address: DF:A9:FF:F6:B1:1A (OUI DF-A9-FF)
        Count: 1
< HCI Command: Host Number of Com.. (0x03|0x0035) plen 5  #138 [hci1] 19.345288
        Num handles: 1
        Handle: 1767 Address: DF:A9:FF:F6:B1:1A (OUI DF-A9-FF)
        Count: 1
< HCI Command: Host Number of Com.. (0x03|0x0035) plen 5  #139 [hci1] 19.345313
        Num handles: 1
        Handle: 1767 Address: DF:A9:FF:F6:B1:1A (OUI DF-A9-FF)
        Count: 1
< ACL Data TX: Handle 1767 flags 0x00 dlen 11             #140 [hci1] 19.345333
      Channel: 80 len 7 sdu 5 [PSM 39 mode Enhanced Credit (0x81)] {chan 4}
      ATT: Read Blob Request (0x0c) len 4
        Handle: 0x0045
        Offset: 0x00fc
< ACL Data TX: Handle 1767 flags 0x00 dlen 12             #141 [hci1] 19.345426
      LE L2CAP: LE Flow Control Credit (0x16) ident 5 len 4
        Source CID: 68
        Credits: 1
> HCI Event: Number of Completed Packets (0x13) plen 5    #142 [hci1] 19.426439
        Num handles: 1
        Handle: 1767 Address: DF:A9:FF:F6:B1:1A (OUI DF-A9-FF)
        Count: 1
        #140: len 11 (1 Kb/s)
        Latency: 81 msec (66-173 msec ~103 msec)
> HCI Event: Number of Completed Packets (0x13) plen 5    #143 [hci1] 19.513684
        Num handles: 1
        Handle: 1767 Address: DF:A9:FF:F6:B1:1A (OUI DF-A9-FF)
        Count: 1
        #141: len 12 (0 Kb/s)
        Latency: 168 msec (66-173 msec ~135 msec)
        Channel: 80 [PSM 39 mode Enhanced Credit (0x81)] {chan 4}
        Channel Latency: 168 msec (66-168 msec ~143 msec)
> ACL Data RX: Handle 1767 flags 0x02 dlen 27             #144 [hci1] 19.513998
> ACL Data RX: Handle 1767 flags 0x01 dlen 27             #145 [hci1] 19.514478
> ACL Data RX: Handle 1767 flags 0x01 dlen 16             #146 [hci1] 19.515077
      Channel: 68 len 66 sdu 64 [PSM 39 mode Enhanced Credit (0x81)] {chan 4}
      ATT: Read Blob Response (0x0d) len 63
        31 31 31 32 32 32 32 32 33 33 33 33 33 34 34 34  1112222233333444
        34 34 35 35 35 35 35 36 36 36 36 36 37 37 37 37  4455555666667777
        37 38 38 38 38 38 39 39 39 39 39 30 30 30 30 30  7888889999900000
        31 31 31 31 31 32 32 32 32 32 33 33 33 33 33     111112222233333 
< HCI Command: Host Number of Com.. (0x03|0x0035) plen 5  #147 [hci1] 19.525190
        Num handles: 1
        Handle: 1767 Address: DF:A9:FF:F6:B1:1A (OUI DF-A9-FF)
        Count: 1
< HCI Command: Host Number of Com.. (0x03|0x0035) plen 5  #148 [hci1] 19.525275
        Num handles: 1
        Handle: 1767 Address: DF:A9:FF:F6:B1:1A (OUI DF-A9-FF)
        Count: 1
< HCI Command: Host Number of Com.. (0x03|0x0035) plen 5  #149 [hci1] 19.525320
        Num handles: 1
        Handle: 1767 Address: DF:A9:FF:F6:B1:1A (OUI DF-A9-FF)
        Count: 1
< ACL Data TX: Handle 1767 flags 0x00 dlen 11             #150 [hci1] 19.525382
      Channel: 80 len 7 sdu 5 [PSM 39 mode Enhanced Credit (0x81)] {chan 4}
      ATT: Read Blob Request (0x0c) len 4
        Handle: 0x0045
        Offset: 0x013b
< ACL Data TX: Handle 1767 flags 0x00 dlen 12             #151 [hci1] 19.525401
      LE L2CAP: LE Flow Control Credit (0x16) ident 6 len 4
        Source CID: 68
        Credits: 1
> HCI Event: Number of Completed Packets (0x13) plen 5    #152 [hci1] 19.601511
        Num handles: 1
        Handle: 1767 Address: DF:A9:FF:F6:B1:1A (OUI DF-A9-FF)
        Count: 1
        #150: len 11 (1 Kb/s)
        Latency: 76 msec (66-173 msec ~105 msec)
        Channel: 80 [PSM 39 mode Enhanced Credit (0x81)] {chan 4}
        Channel Latency: 76 msec (66-168 msec ~109 msec)
> HCI Event: Number of Completed Packets (0x13) plen 5    #153 [hci1] 19.688585
        Num handles: 1
        Handle: 1767 Address: DF:A9:FF:F6:B1:1A (OUI DF-A9-FF)
        Count: 1
        #151: len 12 (0 Kb/s)
        Latency: 163 msec (66-173 msec ~134 msec)
> ACL Data RX: Handle 1767 flags 0x02 dlen 27             #154 [hci1] 19.688993
> ACL Data RX: Handle 1767 flags 0x01 dlen 27             #155 [hci1] 19.689562
> ACL Data RX: Handle 1767 flags 0x01 dlen 16             #156 [hci1] 19.690066
      Channel: 68 len 66 sdu 64 [PSM 39 mode Enhanced Credit (0x81)] {chan 4}
      ATT: Read Blob Response (0x0d) len 63
        34 34 34 34 34 35 35 35 35 35 36 36 36 36 36 37  4444455555666667
        37 37 37 37 38 38 38 38 38 39 39 39 39 39 30 30  7777888889999900
        30 30 30 31 31 31 31 31 32 32 32 32 32 33 33 33  0001111122222333
        33 33 34 34 34 34 34 35 35 35 35 35 36 36 36     334444455555666 
< HCI Command: Host Number of Com.. (0x03|0x0035) plen 5  #157 [hci1] 19.705202
        Num handles: 1
        Handle: 1767 Address: DF:A9:FF:F6:B1:1A (OUI DF-A9-FF)
        Count: 1
< HCI Command: Host Number of Com.. (0x03|0x0035) plen 5  #158 [hci1] 19.705248
        Num handles: 1
        Handle: 1767 Address: DF:A9:FF:F6:B1:1A (OUI DF-A9-FF)
        Count: 1
< HCI Command: Host Number of Com.. (0x03|0x0035) plen 5  #159 [hci1] 19.705305
        Num handles: 1
        Handle: 1767 Address: DF:A9:FF:F6:B1:1A (OUI DF-A9-FF)
        Count: 1
< ACL Data TX: Handle 1767 flags 0x00 dlen 11             #160 [hci1] 19.705392
      Channel: 80 len 7 sdu 5 [PSM 39 mode Enhanced Credit (0x81)] {chan 4}
      ATT: Read Blob Request (0x0c) len 4
        Handle: 0x0045
        Offset: 0x017a
< ACL Data TX: Handle 1767 flags 0x00 dlen 12             #161 [hci1] 19.705593
      LE L2CAP: LE Flow Control Credit (0x16) ident 7 len 4
        Source CID: 68
        Credits: 1
> HCI Event: Number of Completed Packets (0x13) plen 5    #162 [hci1] 19.776371
        Num handles: 1
        Handle: 1767 Address: DF:A9:FF:F6:B1:1A (OUI DF-A9-FF)
        Count: 1
        #160: len 11 (1 Kb/s)
        Latency: 70 msec (66-173 msec ~102 msec)
        Channel: 80 [PSM 39 mode Enhanced Credit (0x81)] {chan 4}
        Channel Latency: 70 msec (66-168 msec ~90 msec)
> HCI Event: Number of Completed Packets (0x13) plen 5    #163 [hci1] 19.863618
        Num handles: 1
        Handle: 1767 Address: DF:A9:FF:F6:B1:1A (OUI DF-A9-FF)
        Count: 1
        #161: len 12 (0 Kb/s)
        Latency: 158 msec (66-173 msec ~130 msec)
        Channel: 80 [PSM 39 mode Enhanced Credit (0x81)] {chan 4}
        Channel Latency: 158 msec (66-168 msec ~124 msec)
> ACL Data RX: Handle 1767 flags 0x02 dlen 27             #164 [hci1] 19.863970
> ACL Data RX: Handle 1767 flags 0x01 dlen 27             #165 [hci1] 19.864550
< HCI Command: Host Number of Com.. (0x03|0x0035) plen 5  #166 [hci1] 19.864918
        Num handles: 1
        Handle: 1767 Address: DF:A9:FF:F6:B1:1A (OUI DF-A9-FF)
        Count: 1
> ACL Data RX: Handle 1767 flags 0x01 dlen 16             #167 [hci1] 19.865094
      Channel: 68 len 66 sdu 64 [PSM 39 mode Enhanced Credit (0x81)] {chan 4}
      ATT: Read Blob Response (0x0d) len 63
        36 36 37 37 37 37 37 38 38 38 38 38 39 39 39 39  6677777888889999
        39 30 30 30 30 30 31 31 31 31 31 32 32 32 32 32  9000001111122222
        33 33 33 33 33 34 34 34 34 34 35 35 35 35 35 36  3333344444555556
        36 36 36 36 37 37 37 37 37 38 38 38 38 38 39     666677777888889 
< HCI Command: Host Number of Com.. (0x03|0x0035) plen 5  #168 [hci1] 19.884991
        Num handles: 1
        Handle: 1767 Address: DF:A9:FF:F6:B1:1A (OUI DF-A9-FF)
        Count: 1
< HCI Command: Host Number of Com.. (0x03|0x0035) plen 5  #169 [hci1] 19.885007
        Num handles: 1
        Handle: 1767 Address: DF:A9:FF:F6:B1:1A (OUI DF-A9-FF)
        Count: 1
< ACL Data TX: Handle 1767 flags 0x00 dlen 11             #170 [hci1] 19.885168
      Channel: 80 len 7 sdu 5 [PSM 39 mode Enhanced Credit (0x81)] {chan 4}
      ATT: Read Blob Request (0x0c) len 4
        Handle: 0x0045
        Offset: 0x01b9
< ACL Data TX: Handle 1767 flags 0x00 dlen 12             #171 [hci1] 19.885224
      LE L2CAP: LE Flow Control Credit (0x16) ident 8 len 4
        Source CID: 68
        Credits: 1
> HCI Event: Number of Completed Packets (0x13) plen 5    #172 [hci1] 19.951497
        Num handles: 1
        Handle: 1767 Address: DF:A9:FF:F6:B1:1A (OUI DF-A9-FF)
        Count: 1
        #170: len 11 (1 Kb/s)
        Latency: 66 msec (66-173 msec ~98 msec)
> HCI Event: Number of Completed Packets (0x13) plen 5    #173 [hci1] 20.038788
        Num handles: 1
        Handle: 1767 Address: DF:A9:FF:F6:B1:1A (OUI DF-A9-FF)
        Count: 1
        #171: len 12 (0 Kb/s)
        Latency: 153 msec (66-173 msec ~125 msec)
        Channel: 80 [PSM 39 mode Enhanced Credit (0x81)] {chan 4}
        Channel Latency: 153 msec (66-168 msec ~138 msec)
> ACL Data RX: Handle 1767 flags 0x02 dlen 27             #174 [hci1] 20.038980
> ACL Data RX: Handle 1767 flags 0x01 dlen 27             #175 [hci1] 20.039496
> ACL Data RX: Handle 1767 flags 0x01 dlen 16             #176 [hci1] 20.040092
      Channel: 68 len 66 sdu 64 [PSM 39 mode Enhanced Credit (0x81)] {chan 4}
      ATT: Read Blob Response (0x0d) len 63
        39 39 39 39 30 30 30 30 30 31 31 31 31 31 32 32  9999000001111122
        32 32 32 33 33 33 33 33 34 34 34 34 34 35 35 35  2223333344444555
        35 35 36 36 36 36 36 37 37 37 37 37 38 38 38 38  5566666777778888
        38 39 39 39 39 39 30 30 30 30 30 31 32 33 34     899999000001234 
< HCI Command: Host Number of Com.. (0x03|0x0035) plen 5  #177 [hci1] 20.045172
        Num handles: 1
        Handle: 1767 Address: DF:A9:FF:F6:B1:1A (OUI DF-A9-FF)
        Count: 1
< HCI Command: Host Number of Com.. (0x03|0x0035) plen 5  #178 [hci1] 20.045260
        Num handles: 1
        Handle: 1767 Address: DF:A9:FF:F6:B1:1A (OUI DF-A9-FF)
        Count: 1
< HCI Command: Host Number of Com.. (0x03|0x0035) plen 5  #179 [hci1] 20.045288
        Num handles: 1
        Handle: 1767 Address: DF:A9:FF:F6:B1:1A (OUI DF-A9-FF)
        Count: 1
< ACL Data TX: Handle 1767 flags 0x00 dlen 11             #180 [hci1] 20.045369
      Channel: 80 len 7 sdu 5 [PSM 39 mode Enhanced Credit (0x81)] {chan 4}
      ATT: Read Blob Request (0x0c) len 4
        Handle: 0x0045
        Offset: 0x01f8
< ACL Data TX: Handle 1767 flags 0x00 dlen 12             #181 [hci1] 20.045379
      LE L2CAP: LE Flow Control Credit (0x16) ident 9 len 4
        Source CID: 68
        Credits: 1
> HCI Event: Number of Completed Packets (0x13) plen 5    #182 [hci1] 20.126447
        Num handles: 1
        Handle: 1767 Address: DF:A9:FF:F6:B1:1A (OUI DF-A9-FF)
        Count: 1
        #180: len 11 (1 Kb/s)
        Latency: 81 msec (66-173 msec ~103 msec)
        Channel: 80 [PSM 39 mode Enhanced Credit (0x81)] {chan 4}
        Channel Latency: 81 msec (66-168 msec ~109 msec)
> HCI Event: Number of Completed Packets (0x13) plen 5    #183 [hci1] 20.213535
        Num handles: 1
        Handle: 1767 Address: DF:A9:FF:F6:B1:1A (OUI DF-A9-FF)
        Count: 1
        #181: len 12 (0 Kb/s)
        Latency: 168 msec (66-173 msec ~135 msec)
> ACL Data RX: Handle 1767 flags 0x02 dlen 15             #184 [hci1] 20.213904
      Channel: 68 len 11 sdu 9 [PSM 39 mode Enhanced Credit (0x81)] {chan 4}
      ATT: Read Blob Response (0x0d) len 8
        35 36 37 38 39 30 31 32                          56789012        
< HCI Command: Host Number of Com.. (0x03|0x0035) plen 5  #185 [hci1] 20.225941
        Num handles: 1
        Handle: 1767 Address: DF:A9:FF:F6:B1:1A (OUI DF-A9-FF)
        Count: 1
< ACL Data TX: Handle 1767 flags 0x00 dlen 12             #186 [hci1] 20.225947
      LE L2CAP: LE Flow Control Credit (0x16) ident 10 len 4
        Source CID: 68
        Credits: 1
> HCI Event: Number of Completed Packets (0x13) plen 5    #187 [hci1] 20.388426
        Num handles: 1
        Handle: 1767 Address: DF:A9:FF:F6:B1:1A (OUI DF-A9-FF)
        Count: 1
        #186: len 12 (0 Kb/s)
        Latency: 162 msec (66-173 msec ~149 msec)
        Channel: 80 [PSM 39 mode Enhanced Credit (0x81)] {chan 4}
        Channel Latency: 162 msec (66-168 msec ~136 msec)
< ACL Data TX: Handle 1767 flags 0x00 dlen 9              #188 [hci1] 22.315475
      Channel: 80 len 5 sdu 3 [PSM 39 mode Enhanced Credit (0x81)] {chan 4}
      ATT: Read Request (0x0a) len 2
        Handle: 0x01b0
> HCI Event: Number of Completed Packets (0x13) plen 5    #189 [hci1] 22.488546
        Num handles: 1
        Handle: 1767 Address: DF:A9:FF:F6:B1:1A (OUI DF-A9-FF)
        Count: 1
        #188: len 9 (0 Kb/s)
        Latency: 173 msec (66-173 msec ~161 msec)
        Channel: 80 [PSM 39 mode Enhanced Credit (0x81)] {chan 4}
        Channel Latency: 173 msec (66-173 msec ~154 msec)
> ACL Data RX: Handle 1767 flags 0x02 dlen 27             #190 [hci1] 22.489011
> ACL Data RX: Handle 1767 flags 0x01 dlen 27             #191 [hci1] 22.489454
> ACL Data RX: Handle 1767 flags 0x01 dlen 16             #192 [hci1] 22.489980
      Channel: 68 len 66 sdu 64 [PSM 39 mode Enhanced Credit (0x81)] {chan 4}
      ATT: Read Response (0x0b) len 63
< HCI Command: Host Number of Com.. (0x03|0x0035) plen 5  #193 [hci1] 22.505226
        Num handles: 1
        Handle: 1767 Address: DF:A9:FF:F6:B1:1A (OUI DF-A9-FF)
        Count: 1
< HCI Command: Host Number of Com.. (0x03|0x0035) plen 5  #194 [hci1] 22.505309
        Num handles: 1
        Handle: 1767 Address: DF:A9:FF:F6:B1:1A (OUI DF-A9-FF)
        Count: 1
< HCI Command: Host Number of Com.. (0x03|0x0035) plen 5  #195 [hci1] 22.505360
        Num handles: 1
        Handle: 1767 Address: DF:A9:FF:F6:B1:1A (OUI DF-A9-FF)
        Count: 1
< ACL Data TX: Handle 1767 flags 0x00 dlen 11             #196 [hci1] 22.505412
      Channel: 80 len 7 sdu 5 [PSM 39 mode Enhanced Credit (0x81)] {chan 4}
      ATT: Read Blob Request (0x0c) len 4
        Handle: 0x01b0
        Offset: 0x003f
< ACL Data TX: Handle 1767 flags 0x00 dlen 12             #197 [hci1] 22.505484
      LE L2CAP: LE Flow Control Credit (0x16) ident 11 len 4
        Source CID: 68
        Credits: 1
> HCI Event: Number of Completed Packets (0x13) plen 5    #198 [hci1] 22.576324
        Num handles: 1
        Handle: 1767 Address: DF:A9:FF:F6:B1:1A (OUI DF-A9-FF)
        Count: 1
        #196: len 11 (1 Kb/s)
        Latency: 70 msec (66-173 msec ~116 msec)
> HCI Event: Number of Completed Packets (0x13) plen 5    #199 [hci1] 22.663660
        Num handles: 1
        Handle: 1767 Address: DF:A9:FF:F6:B1:1A (OUI DF-A9-FF)
        Count: 1
        #197: len 12 (0 Kb/s)
        Latency: 158 msec (66-173 msec ~137 msec)
        Channel: 80 [PSM 39 mode Enhanced Credit (0x81)] {chan 4}
        Channel Latency: 158 msec (66-173 msec ~156 msec)
> ACL Data RX: Handle 1767 flags 0x02 dlen 27             #200 [hci1] 22.663894
> ACL Data RX: Handle 1767 flags 0x01 dlen 27             #201 [hci1] 22.664549
> ACL Data RX: Handle 1767 flags 0x01 dlen 16             #202 [hci1] 22.664881
      Channel: 68 len 66 sdu 64 [PSM 39 mode Enhanced Credit (0x81)] {chan 4}
      ATT: Read Blob Response (0x0d) len 63
        99 ff ee dd cc bb aa 00 11 22 33 44 55 66 77 88  ........."3DUfw.
        99 ff ee dd cc bb aa 00 11 22 33 44 55 66 77 88  ........."3DUfw.
        99 ff ee dd cc bb aa 00 11 22 33 44 55 66 77 88  ........."3DUfw.
        99 ff ee dd cc bb aa 00 11 22 33 44 55 66 77     ........."3DUfw 
< HCI Command: Host Number of Com.. (0x03|0x0035) plen 5  #203 [hci1] 22.665231
        Num handles: 1
        Handle: 1767 Address: DF:A9:FF:F6:B1:1A (OUI DF-A9-FF)
        Count: 1
< HCI Command: Host Number of Com.. (0x03|0x0035) plen 5  #204 [hci1] 22.665240
        Num handles: 1
        Handle: 1767 Address: DF:A9:FF:F6:B1:1A (OUI DF-A9-FF)
        Count: 1
< HCI Command: Host Number of Com.. (0x03|0x0035) plen 5  #205 [hci1] 22.665285
        Num handles: 1
        Handle: 1767 Address: DF:A9:FF:F6:B1:1A (OUI DF-A9-FF)
        Count: 1
< ACL Data TX: Handle 1767 flags 0x00 dlen 11             #206 [hci1] 22.665346
      Channel: 80 len 7 sdu 5 [PSM 39 mode Enhanced Credit (0x81)] {chan 4}
      ATT: Read Blob Request (0x0c) len 4
        Handle: 0x01b0
        Offset: 0x007e
< ACL Data TX: Handle 1767 flags 0x00 dlen 12             #207 [hci1] 22.665378
      LE L2CAP: LE Flow Control Credit (0x16) ident 12 len 4
        Source CID: 68
        Credits: 1
> HCI Event: Number of Completed Packets (0x13) plen 5    #208 [hci1] 22.751303
        Num handles: 1
        Handle: 1767 Address: DF:A9:FF:F6:B1:1A (OUI DF-A9-FF)
        Count: 1
        #206: len 11 (1 Kb/s)
        Latency: 85 msec (66-173 msec ~111 msec)
        Channel: 80 [PSM 39 mode Enhanced Credit (0x81)] {chan 4}
        Channel Latency: 85 msec (66-173 msec ~121 msec)
> HCI Event: Number of Completed Packets (0x13) plen 5    #209 [hci1] 22.838450
        Num handles: 1
        Handle: 1767 Address: DF:A9:FF:F6:B1:1A (OUI DF-A9-FF)
        Count: 1
        #207: len 12 (0 Kb/s)
        Latency: 173 msec (66-173 msec ~142 msec)
> ACL Data RX: Handle 1767 flags 0x02 dlen 8              #210 [hci1] 22.838754
      Channel: 68 len 4 sdu 2 [PSM 39 mode Enhanced Credit (0x81)] {chan 4}
      ATT: Read Blob Response (0x0d) len 1
        88                                               .               
< HCI Command: Host Number of Com.. (0x03|0x0035) plen 5  #211 [hci1] 22.845409
        Num handles: 1
        Handle: 1767 Address: DF:A9:FF:F6:B1:1A (OUI DF-A9-FF)
        Count: 1
< ACL Data TX: Handle 1767 flags 0x00 dlen 12             #212 [hci1] 22.845416
      LE L2CAP: LE Flow Control Credit (0x16) ident 13 len 4
        Source CID: 68
        Credits: 1
