Bluetooth monitor ver 5.72
= Note: Linux version 6.14.0-36-generic (x86_64)                       0.915169
= Note: Bluetooth subsystem version 2.22                               0.915171
= New Index: 00:00:00:00:00:00 (Primary,UART,hci1)              [hci1] 0.915172
= New Index: 48:5F:99:8E:E0:64 (Primary,USB,hci0)               [hci0] 0.915173
= Open Index: 00:00:00:00:00:00                                 [hci1] 1.428950
= Index Info: 00:00:00:00:00:00 (Nordic Semiconductor ASA)      [hci1] 1.428965
@ USER Open: main (privileged) version 2.22            {0x0001} [hci1] 1.428975
< HCI Command: Reset (0x03|0x0003) plen 0                    #1 [hci1] 1.430256
> HCI Event: Command Complete (0x0e) plen 4                  #2 [hci1] 1.430780
      Reset (0x03|0x0003) ncmd 1
        Status: Success (0x00)
< HCI Command: Read Local Supported... (0x04|0x0003) plen 0  #3 [hci1] 1.448383
> HCI Event: Command Complete (0x0e) plen 12                 #4 [hci1] 1.448860
      Read Local Supported Features (0x04|0x0003) ncmd 1
        Status: Success (0x00)
        Features: 0x00 0x00 0x00 0x00 0x60 0x00 0x00 0x00
          BR/EDR Not Supported
          LE Supported (Controller)
< HCI Command: Read Local Version In.. (0x04|0x0001) plen 0  #5 [hci1] 1.468372
> HCI Event: Command Complete (0x0e) plen 12                 #6 [hci1] 1.468851
      Read Local Version Information (0x04|0x0001) ncmd 1
        Status: Success (0x00)
        HCI version: Reserved (0x0f) - Revision 12393 (0x3069)
        LMP version: Reserved (0x0f) - Subversion 12393 (0x3069)
        Manufacturer: Nordic Semiconductor ASA (89)
< HCI Command: Read Local Supported... (0x04|0x0002) plen 0  #7 [hci1] 1.488374
> HCI Event: Command Complete (0x0e) plen 68                 #8 [hci1] 1.489517
      Read Local Supported Commands (0x04|0x0002) ncmd 1
        Status: Success (0x00)
        Commands: 119 entries
          Disconnect (Octet 0 - Bit 5)
          Read Remote Version Information (Octet 2 - Bit 7)
          Set Event Mask (Octet 5 - Bit 6)
          Reset (Octet 5 - Bit 7)
          Read Connection Accept Timeout (Octet 7 - Bit 2)
          Write Connection Accept Timeout (Octet 7 - Bit 3)
          Read Transmit Power Level (Octet 10 - Bit 2)
          Set Controller To Host Flow Control (Octet 10 - Bit 5)
          Host Buffer Size (Octet 10 - Bit 6)
          Host Number of Completed Packets (Octet 10 - Bit 7)
          Read Local Version Information (Octet 14 - Bit 3)
          Read Local Supported Features (Octet 14 - Bit 5)
          Read BD ADDR (Octet 15 - Bit 1)
          Read RSSI (Octet 15 - Bit 5)
          Set Event Mask Page 2 (Octet 22 - Bit 2)
          LE Set Event Mask (Octet 25 - Bit 0)
          LE Read Buffer Size (Octet 25 - Bit 1)
          LE Read Local Supported Features (Octet 25 - Bit 2)
          LE Set Random Address (Octet 25 - Bit 4)
          LE Set Advertising Parameters (Octet 25 - Bit 5)
          LE Read Advertising Channel TX Power (Octet 25 - Bit 6)
          LE Set Advertising Data (Octet 25 - Bit 7)
          LE Set Scan Response Data (Octet 26 - Bit 0)
          LE Set Advertise Enable (Octet 26 - Bit 1)
          LE Set Scan Parameters (Octet 26 - Bit 2)
          LE Set Scan Enable (Octet 26 - Bit 3)
          LE Create Connection (Octet 26 - Bit 4)
          LE Create Connection Cancel (Octet 26 - Bit 5)
          LE Read Accept List Size (Octet 26 - Bit 6)
          LE Clear Accept List (Octet 26 - Bit 7)
          LE Add Device To Accept List (Octet 27 - Bit 0)
          LE Remove Device From Accept List (Octet 27 - Bit 1)
          LE Connection Update (Octet 27 - Bit 2)
          LE Set Host Channel Classification (Octet 27 - Bit 3)
          LE Read Channel Map (Octet 27 - Bit 4)
          LE Read Remote Used Features (Octet 27 - Bit 5)
          LE Encrypt (Octet 27 - Bit 6)
          LE Rand (Octet 27 - Bit 7)
          LE Start Encryption (Octet 28 - Bit 0)
          LE Long Term Key Request Reply (Octet 28 - Bit 1)
          LE Long Term Key Request Neg Reply (Octet 28 - Bit 2)
          LE Read Supported States (Octet 28 - Bit 3)
          LE Receiver Test (Octet 28 - Bit 4)
          LE Transmitter Test (Octet 28 - Bit 5)
          LE Test End (Octet 28 - Bit 6)
          Read Authenticated Payload Timeout (Octet 32 - Bit 4)
          Write Authenticated Payload Timeout (Octet 32 - Bit 5)
          LE Set Data Length (Octet 33 - Bit 6)
          LE Read Suggested Default Data Length (Octet 33 - Bit 7)
          LE Write Suggested Default Data Length (Octet 34 - Bit 0)
          LE Add Device To Resolving List (Octet 34 - Bit 3)
          LE Remove Device From Resolving List (Octet 34 - Bit 4)
          LE Clear Resolving List (Octet 34 - Bit 5)
          LE Read Resolving List Size (Octet 34 - Bit 6)
          LE Set Address Resolution Enable (Octet 35 - Bit 1)
          LE Set Resolvable Private Address Timeout (Octet 35 - Bit 2)
          LE Read Maximum Data Length (Octet 35 - Bit 3)
          LE Read PHY (Octet 35 - Bit 4)
          LE Set Default PHY (Octet 35 - Bit 5)
          LE Set PHY (Octet 35 - Bit 6)
          LE Enhanced Receiver Test (Octet 35 - Bit 7)
          LE Enhanced Transmitter Test (Octet 36 - Bit 0)
          LE Set Advertising Set Random Address (Octet 36 - Bit 1)
          LE Set Extended Advertising Parameters (Octet 36 - Bit 2)
          LE Set Extended Advertising Data (Octet 36 - Bit 3)
          LE Set Extended Scan Response Data (Octet 36 - Bit 4)
          LE Set Extended Advertising Enable (Octet 36 - Bit 5)
          LE Read Maximum Advertising Data Length (Octet 36 - Bit 6)
          LE Read Number of Supported Advertising Sets (Octet 36 - Bit 7)
          LE Remove Advertising Set (Octet 37 - Bit 0)
          LE Clear Advertising Sets (Octet 37 - Bit 1)
          LE Set Periodic Advertising Parameters (Octet 37 - Bit 2)
          LE Set Periodic Advertising Data (Octet 37 - Bit 3)
          LE Set Periodic Advertising Enable (Octet 37 - Bit 4)
          LE Set Extended Scan Parameters (Octet 37 - Bit 5)
          LE Set Extended Scan Enable (Octet 37 - Bit 6)
          LE Extended Create Connection (Octet 37 - Bit 7)
          LE Periodic Advertising Create Sync (Octet 38 - Bit 0)
          LE Periodic Advertising Create Sync Cancel (Octet 38 - Bit 1)
          LE Periodic Advertising Terminate Sync (Octet 38 - Bit 2)
          LE Add Device To Periodic Advertiser List (Octet 38 - Bit 3)
          LE Remove Device From Periodic Advertiser List (Octet 38 - Bit 4)
          LE Clear Periodic Advertiser List (Octet 38 - Bit 5)
          LE Read Periodic Advertiser List Size (Octet 38 - Bit 6)
          LE Read Transmit Power (Octet 38 - Bit 7)
          LE Read RF Path Compensation (Octet 39 - Bit 0)
          LE Write RF Path Compensation (Octet 39 - Bit 1)
          LE Set Privacy Mode (Octet 39 - Bit 2)
          LE Periodic Advertising Receive Enable (Octet 40 - Bit 5)
          LE Periodic Advertising Sync Transfer (Octet 40 - Bit 6)
          LE Periodic Advertising Set Info Transfer (Octet 40 - Bit 7)
          LE Periodic Advertising Sync Transfer Parameters (Octet 41 - Bit 0)
          LE Set Default Periodic Advertisng Sync Transfer Parameters (Octet 41 - Bit 1)
          LE Read Buffer v2 (Octet 41 - Bit 5)
          LE Read ISO TX Sync (Octet 41 - Bit 6)
          LE Set Connected Isochronous Group Parameters (Octet 41 - Bit 7)
          LE Set Connected Isochronous Group Parameters Test (Octet 42 - Bit 0)
          LE Create Connected Isochronous Stream (Octet 42 - Bit 1)
          LE Remove Connected Isochronous Group (Octet 42 - Bit 2)
          LE Accept Connected Isochronous Stream Request (Octet 42 - Bit 3)
          LE Reject Connected Isochronous Stream Request (Octet 42 - Bit 4)
          LE Create Broadcast Isochronous Group (Octet 42 - Bit 5)
          LE Create Broadcast Isochronous Group Test (Octet 42 - Bit 6)
          LE Terminate Broadcast Isochronous Group (Octet 42 - Bit 7)
          LE Broadcast Isochronous Group Create Sync (Octet 43 - Bit 0)
          LE Broadcast Isochronous Group Terminate Sync (Octet 43 - Bit 1)
          LE Request Peer SCA (Octet 43 - Bit 2)
          LE Setup Isochronous Data Path (Octet 43 - Bit 3)
          LE Remove Isochronous Data Path (Octet 43 - Bit 4)
          LE Isochronous Transmit Test (Octet 43 - Bit 5)
          LE Isochronous Receive Test (Octet 43 - Bit 6)
          LE Isochronous Read Test Counters (Octet 43 - Bit 7)
          LE Isochronous Read Test Counters (Octet 44 - Bit 0)
          LE Set Host Feature (Octet 44 - Bit 1)
          Octet 44 - Bit 2 
          Octet 45 - Bit 6 
          Octet 46 - Bit 0 
          Octet 46 - Bit 1 
          Octet 46 - Bit 2 
< HCI Command: Host Buffer Size (0x03|0x0033) plen 7         #9 [hci1] 1.508374
        ACL MTU: 255  ACL max packet: 16
        SCO MTU: 0    SCO max packet: 0
> HCI Event: Command Complete (0x0e) plen 4                 #10 [hci1] 1.508904
      Host Buffer Size (0x03|0x0033) ncmd 1
        Status: Success (0x00)
< HCI Command: Set Controller To Ho.. (0x03|0x0031) plen 1  #11 [hci1] 1.528376
        Flow control: ACL Data Packets (0x01)
> HCI Event: Command Complete (0x0e) plen 4                 #12 [hci1] 1.528836
      Set Controller To Host Flow Control (0x03|0x0031) ncmd 1
        Status: Success (0x00)
< HCI Command: LE Read Local Suppor.. (0x08|0x0003) plen 0  #13 [hci1] 1.548363
> HCI Event: Command Complete (0x0e) plen 12                #14 [hci1] 1.548896
      LE Read Local Supported Features (0x08|0x0003) ncmd 1
        Status: Success (0x00)
        Features: 0xfd 0x79 0x00 0xf7 0x30 0x01 0x00 0x00
          LE Encryption
          Extended Reject Indication
          Peripheral-initiated Features Exchange
          LE Ping
          LE Data Packet Length Extension
          LL Privacy
          Extended Scanner Filter Policies
          LE 2M PHY
          LE Coded PHY
          LE Extended Advertising
          LE Periodic Advertising
          Channel Selection Algorithm #2
          Periodic Advertising Sync Transfer - Sender
          Periodic Advertising Sync Transfer - Recipient
          Sleep Clock Accuracy Updates
          Connected Isochronous Stream - Central
          Connected Isochronous Stream - Peripheral
          Isochronous Broadcaster
          Synchronized Receiver
          Periodic Advertising ADI support
          Connection Subrating
          Unknown features (0x0000010000000000)
< HCI Command: LE Set Host Feature (0x08|0x0074) plen 2     #15 [hci1] 1.568381
        Bit Number: 32
          Connected Isochronous Stream (Host Support)
        Bit Value: 1
> HCI Event: Command Complete (0x0e) plen 4                 #16 [hci1] 1.568736
      LE Set Host Feature (0x08|0x0074) ncmd 1
        Status: Success (0x00)
< HCI Command: LE Read Buffer v2 (0x08|0x0060) plen 0       #17 [hci1] 1.588384
> HCI Event: Command Complete (0x0e) plen 10                #18 [hci1] 1.588842
      LE Read Buffer v2 (0x08|0x0060) ncmd 1
        Status: Success (0x00)
        ACL MTU: 27
        ACL max packet: 3
        ISO MTU: 318
        ISO max packet: 3
< HCI Command: LE Read Maximum Adve.. (0x08|0x003a) plen 0  #19 [hci1] 1.608336
> HCI Event: Command Complete (0x0e) plen 6                 #20 [hci1] 1.608718
      LE Read Maximum Advertising Data Length (0x08|0x003a) ncmd 1
        Status: Success (0x00)
        Max length: 1650
< HCI Command: LE Read Supported St.. (0x08|0x001c) plen 0  #21 [hci1] 1.628442
> HCI Event: Command Complete (0x0e) plen 12                #22 [hci1] 1.628948
      LE Read Supported States (0x08|0x001c) ncmd 1
        Status: Success (0x00)
        States: 0x000003ff3e0306ff
          Non-connectable Advertising State
          Scannable Advertising State
          Connectable Advertising State
          High Duty Cycle Directed Advertising State
          Passive Scanning State
          Active Scanning State
          Initiating State
            and Connection State (Central Role)
          Connection State (Peripheral Role)
          Scannable Advertising State
            and Passive Scanning State
          Connectable Advertising State
            and Passive Scanning State
          Non-connectable Advertising State
            and Initiating State
          Scannable Advertising State
            and Initiating State
          Active Scanning State
            and Connection State (Central Role)
          Passive Scanning State
            and Connection State (Peripheral Role)
          Active Scanning State
            and Connection State (Peripheral Role)
          Initiating State
            and Connection State (Central Role)
            and Central Role & Central Role
          Low Duty Cycle Directed Advertising State
          Connectable Advertising State
            and Initiating State
            and Central Role & Peripheral Role
          High Duty Cycle Directed Advertising State
            and Initiating State
            and Central Role & Peripheral Role
          Low Duty Cycle Directed Advertising State
            and Initiating State
            and Central Role & Peripheral Role
          Connectable Advertising State
            and Connection State (Central Role)
            and Central Role & Peripheral Role
          High Duty Cycle Directed Advertising State
            and Connection State (Central Role)
            and Central Role & Peripheral Role
          Low Duty Cycle Directed Advertising State
            and Connection State (Central Role)
            and Central Role & Peripheral Role
          Connectable Advertising State
            and Connection State (Peripheral Role)
            and Central Role & Peripheral Role
          High Duty Cycle Directed Advertising State
            and Connection State (Peripheral Role)
            and Peripheral Role & Peripheral Role
          Low Duty Cycle Directed Advertising State
            and Connection State (Peripheral Role)
            and Peripheral Role & Peripheral Role
          Initiating State
            and Connection State (Peripheral Role)
            and Central Role & Peripheral Role
< HCI Command: LE Read Maximum Data.. (0x08|0x002f) plen 0  #23 [hci1] 1.648400
> HCI Event: Command Complete (0x0e) plen 12                #24 [hci1] 1.648902
      LE Read Maximum Data Length (0x08|0x002f) ncmd 1
        Status: Success (0x00)
        Max TX octets: 251
        Max TX time: 2704
        Max RX octets: 251
        Max RX time: 2704
< HCI Command: LE Write Suggested D.. (0x08|0x0024) plen 4  #25 [hci1] 1.668394
        TX octets: 251
        TX time: 2704
> HCI Event: Command Complete (0x0e) plen 4                 #26 [hci1] 1.668877
      LE Write Suggested Default Data Length (0x08|0x0024) ncmd 1
        Status: Success (0x00)
< HCI Command: LE Read Resolving Li.. (0x08|0x002a) plen 0  #27 [hci1] 1.688397
> HCI Event: Command Complete (0x0e) plen 5                 #28 [hci1] 1.688813
      LE Read Resolving List Size (0x08|0x002a) ncmd 1
        Status: Success (0x00)
        Size: 8
< HCI Command: LE Set Event Mask (0x08|0x0001) plen 8       #29 [hci1] 1.708352
        Mask: 0x000002023f87fa5e
          LE Advertising Report
          LE Connection Update Complete
          LE Read Remote Used Features Complete
          LE Long Term Key Request
          LE Data Length Change
          LE Enhanced Connection Complete
          LE PHY Update Complete
          LE Extended Advertising Report
          LE Periodic Advertising Sync Established
          LE Periodic Advertising Report
          LE Periodic Advertising Sync Lost
          LE Extended Scan Timeout
          LE Extended Advertising Set Terminated
          LE Scan Request Received
          LE Periodic Advertising Sync Transfer Rvc
          LE CIS Established
          LE CIS Request
          LE Create BIG Complete
          LE Terminate BIG Complete
          LE BIG Sync Estabilished Complete
          LE BIG Sync Lost
          LE BIG Info Advertising Report
          Unknown mask (0x0000020000000000)
> HCI Event: Command Complete (0x0e) plen 4                 #30 [hci1] 1.708833
      LE Set Event Mask (0x08|0x0001) ncmd 1
        Status: Success (0x00)
< HCI Command: Set Event Mask (0x03|0x0001) plen 8          #31 [hci1] 1.728380
        Mask: 0x2000800002008890
          Disconnection Complete
          Encryption Change
          Read Remote Version Information Complete
          Hardware Error
          Data Buffer Overflow
          Encryption Key Refresh Complete
          LE Meta
> HCI Event: Command Complete (0x0e) plen 4                 #32 [hci1] 1.729026
      Set Event Mask (0x03|0x0001) ncmd 1
        Status: Success (0x00)
< HCI Command: Read BD ADDR (0x04|0x0009) plen 0            #33 [hci1] 1.748384
> HCI Event: Command Complete (0x0e) plen 10                #34 [hci1] 1.748986
      Read BD ADDR (0x04|0x0009) ncmd 1
        Status: Success (0x00)
        Address: 00:00:00:00:00:00 (OUI 00-00-00)
< HCI Command: LE Set Random Address (0x08|0x0005) plen 6   #35 [hci1] 1.768323
        Address: D5:B6:CC:31:DB:3B (Static)
> HCI Event: Command Complete (0x0e) plen 4                 #36 [hci1] 1.768929
      LE Set Random Address (0x08|0x0005) ncmd 1
        Status: Success (0x00)
< HCI Command: LE Set Extended Adv.. (0x08|0x0036) plen 25  #37 [hci1] 4.198399
        Handle: 0x00
        Properties: 0x0013
          Connectable
          Scannable
          Use legacy advertising PDUs: ADV_IND
        Min advertising interval: 100.000 msec (0x00a0)
        Max advertising interval: 150.000 msec (0x00f0)
        Channel map: 37, 38, 39 (0x07)
        Own address type: Random (0x01)
        Peer address type: Public (0x00)
        Peer address: 00:00:00:00:00:00 (OUI 00-00-00)
        Filter policy: Allow Scan Request from Any, Allow Connect Request from Any (0x00)
        TX power: Host has no preference (0x7f)
        Primary PHY: LE 1M (0x01)
        Secondary max skip: 0x00
        Secondary PHY: LE 1M (0x01)
        SID: 0x00
        Scan request notifications: Disabled (0x00)
> HCI Event: Command Complete (0x0e) plen 5                 #38 [hci1] 4.199157
      LE Set Extended Advertising Parameters (0x08|0x0036) ncmd 1
        Status: Success (0x00)
        TX power (selected): 0 dbm (0x00)
< HCI Command: LE Set Advertising S.. (0x08|0x0035) plen 7  #39 [hci1] 4.208390
        Advertising handle: 0x00
        Advertising random address: D5:B6:CC:31:DB:3B (Static)
> HCI Event: Command Complete (0x0e) plen 4                 #40 [hci1] 4.209003
      LE Set Advertising Set Random Address (0x08|0x0035) ncmd 1
        Status: Success (0x00)
< HCI Command: LE Set Extended Adv.. (0x08|0x0037) plen 22  #41 [hci1] 4.228701
        Handle: 0x00
        Operation: Complete extended advertising data (0x03)
        Fragment preference: Minimize fragmentation (0x01)
        Data length: 0x12
        Flags: 0x06
          LE General Discoverable Mode
          BR/EDR Not Supported
        Name (complete): Tester_F6B11A
> HCI Event: Command Complete (0x0e) plen 4                 #42 [hci1] 4.229361
      LE Set Extended Advertising Data (0x08|0x0037) ncmd 1
        Status: Success (0x00)
< HCI Command: LE Set Extended Scan.. (0x08|0x0038) plen 4  #43 [hci1] 4.248443
        Handle: 0x00
        Operation: Complete scan response data (0x03)
        Fragment preference: Minimize fragmentation (0x01)
        Data length: 0x00
> HCI Event: Command Complete (0x0e) plen 4                 #44 [hci1] 4.248869
      LE Set Extended Scan Response Data (0x08|0x0038) ncmd 1
        Status: Success (0x00)
< HCI Command: LE Set Extended Adve.. (0x08|0x0039) plen 6  #45 [hci1] 4.268304
        Extended advertising: Enabled (0x01)
        Number of sets: 1 (0x01)
        Entry 0
          Handle: 0x00
          Duration: 0 ms (0x00)
          Max ext adv events: 0
> HCI Event: Command Complete (0x0e) plen 4                 #46 [hci1] 4.268867
      LE Set Extended Advertising Enable (0x08|0x0039) ncmd 1
        Status: Success (0x00)
> HCI Event: LE Meta Event (0x3e) plen 31                   #47 [hci1] 4.383729
      LE Enhanced Connection Complete (0x0a)
        Status: Success (0x00)
        Handle: 165
        Role: Peripheral (0x01)
        Peer address type: Public (0x00)
        Peer address: DF:A9:FF:F6:B1:1A (OUI DF-A9-FF)
        Local resolvable private address: 00:00:00:00:00:00 (Non-Resolvable)
        Peer resolvable private address: 00:00:00:00:00:00 (Non-Resolvable)
        Connection interval: 87.50 msec (0x0046)
        Connection latency: 0 (0x0000)
        Supervision timeout: 25120 msec (0x09d0)
        Central clock accuracy: 0x01
> HCI Event: LE Meta Event (0x3e) plen 6                    #48 [hci1] 4.383839
      LE Advertising Set Terminated (0x12)
        Status: Success (0x00)
        Handle: 0
        Connection handle: 165
        Number of completed extended advertising events: 0
< HCI Command: LE Read Remote Used... (0x08|0x0016) plen 2  #49 [hci1] 4.389856
        Handle: 165 Address: DF:A9:FF:F6:B1:1A (OUI DF-A9-FF)
< ACL Data TX: Handle 165 flags 0x00 dlen 7                 #50 [hci1] 4.389865
      ATT: Exchange MTU Request (0x02) len 2
        Client RX MTU: 251
> HCI Event: Command Status (0x0f) plen 4                   #51 [hci1] 4.390453
      LE Read Remote Used Features (0x08|0x0016) ncmd 1
        Status: Success (0x00)
> HCI Event: Number of Completed Packets (0x13) plen 5      #52 [hci1] 4.559665
        Num handles: 1
        Handle: 165 Address: DF:A9:FF:F6:B1:1A (OUI DF-A9-FF)
        Count: 1
        #50: len 7 (0 Kb/s)
        Latency: 169 msec (169-169 msec ~169 msec)
> HCI Event: LE Meta Event (0x3e) plen 12                   #53 [hci1] 4.647523
      LE Read Remote Used Features (0x04)
        Status: Success (0x00)
        Handle: 165 Address: DF:A9:FF:F6:B1:1A (OUI DF-A9-FF)
        Features: 0x2d 0x49 0x00 0xf7 0x67 0xd8 0x00 0x00
          LE Encryption
          Extended Reject Indication
          Peripheral-initiated Features Exchange
          LE Data Packet Length Extension
          LE 2M PHY
          LE Coded PHY
          Channel Selection Algorithm #2
          Periodic Advertising Sync Transfer - Sender
          Periodic Advertising Sync Transfer - Recipient
          Sleep Clock Accuracy Updates
          Connected Isochronous Stream - Central
          Connected Isochronous Stream - Peripheral
          Isochronous Broadcaster
          Synchronized Receiver
          Connected Isochronous Stream (Host Support)
          LE Power Control Request
          LE Power Control Request
          Connection Subrating
          Connection Subrating (Host Support)
          Unknown features (0x0000d80000000000)
> ACL Data RX: Handle 165 flags 0x02 dlen 11                #54 [hci1] 7.097368
      SMP: Pairing Request (0x01) len 6
        IO capability: KeyboardDisplay (0x04)
        OOB data: Authentication data not present (0x00)
        Authentication requirement: Bonding, MITM, SC, No Keypresses (0x0d)
        Max encryption key size: 16
        Initiator key distribution: EncKey IdKey (0x03)
        Responder key distribution: EncKey IdKey Sign (0x07)
> ACL Data RX: Handle 165 flags 0x02 dlen 7                 #55 [hci1] 7.097698
      ATT: Exchange MTU Response (0x03) len 2
        Server RX MTU: 23
< HCI Command: Host Number of Compl.. (0x03|0x0035) plen 5  #56 [hci1] 7.108974
        Num handles: 1
        Handle: 165 Address: DF:A9:FF:F6:B1:1A (OUI DF-A9-FF)
        Count: 1
< ACL Data TX: Handle 165 flags 0x00 dlen 11                #57 [hci1] 7.109196
      SMP: Pairing Response (0x02) len 6
        IO capability: DisplayOnly (0x00)
        OOB data: Authentication data not present (0x00)
        Authentication requirement: Bonding, No MITM, SC, No Keypresses (0x09)
        Max encryption key size: 16
        Initiator key distribution: IdKey (0x02)
        Responder key distribution: <none> (0x00)
< HCI Command: Host Number of Compl.. (0x03|0x0035) plen 5  #58 [hci1] 7.109238
        Num handles: 1
        Handle: 165 Address: DF:A9:FF:F6:B1:1A (OUI DF-A9-FF)
        Count: 1
> HCI Event: Number of Completed Packets (0x13) plen 5      #59 [hci1] 7.272272
        Num handles: 1
        Handle: 165 Address: DF:A9:FF:F6:B1:1A (OUI DF-A9-FF)
        Count: 1
        #57: len 11 (0 Kb/s)
        Latency: 163 msec (163-169 msec ~166 msec)
> ACL Data RX: Handle 165 flags 0x02 dlen 27                #60 [hci1] 7.272702
> ACL Data RX: Handle 165 flags 0x01 dlen 27                #61 [hci1] 7.273094
> ACL Data RX: Handle 165 flags 0x01 dlen 15                #62 [hci1] 7.273679
      SMP: Pairing Public Key (0x0c) len 64
        X: c3b19001863733019a1937577db6d786fa566074b2afd46a657914765a3b48bf
        Y: 6932c4bf171eeec20cf211fedf46811b5c85cfa458324ccf1b7369a8a082e867
< HCI Command: Host Number of Compl.. (0x03|0x0035) plen 5  #63 [hci1] 7.289300
        Num handles: 1
        Handle: 165 Address: DF:A9:FF:F6:B1:1A (OUI DF-A9-FF)
        Count: 1
< HCI Command: Host Number of Compl.. (0x03|0x0035) plen 5  #64 [hci1] 7.289483
        Num handles: 1
        Handle: 165 Address: DF:A9:FF:F6:B1:1A (OUI DF-A9-FF)
        Count: 1
< HCI Command: Host Number of Compl.. (0x03|0x0035) plen 5  #65 [hci1] 7.289848
        Num handles: 1
        Handle: 165 Address: DF:A9:FF:F6:B1:1A (OUI DF-A9-FF)
        Count: 1
< ACL Data TX: Handle 165 flags 0x00 dlen 27                #66 [hci1] 7.290030
< ACL Data TX: Handle 165 flags 0x01 dlen 27                #67 [hci1] 7.290047
< ACL Data TX: Handle 165 flags 0x01 dlen 15                #68 [hci1] 7.290080
      SMP: Pairing Public Key (0x0c) len 64
        X: 98308440221e2d910f0e54b71e7ec652857aa9b5a0dc65028824cc19db1226e9
        Y: 67a4816bcb62efb21701e31fdb27561a6217575fb007a8bbdabe7e28b6f68482
> HCI Event: Number of Completed Packets (0x13) plen 5      #69 [hci1] 7.360223
        Num handles: 1
        Handle: 165 Address: DF:A9:FF:F6:B1:1A (OUI DF-A9-FF)
        Count: 1
        #66: len 27 (3 Kb/s)
        Latency: 70 msec (70-169 msec ~118 msec)
> HCI Event: Number of Completed Packets (0x13) plen 5      #70 [hci1] 7.360917
        Num handles: 1
        Handle: 165 Address: DF:A9:FF:F6:B1:1A (OUI DF-A9-FF)
        Count: 1
        #67: len 27 (3 Kb/s)
        Latency: 70 msec (70-169 msec ~94 msec)
> HCI Event: Number of Completed Packets (0x13) plen 5      #71 [hci1] 7.447002
        Num handles: 1
        Handle: 165 Address: DF:A9:FF:F6:B1:1A (OUI DF-A9-FF)
        Count: 1
        #68: len 15 (0 Kb/s)
        Latency: 156 msec (70-169 msec ~125 msec)
> ACL Data RX: Handle 165 flags 0x02 dlen 21                #72 [hci1] 8.409895
      SMP: Pairing Confirm (0x03) len 16
        Confim value: 197baf0c4bbbe9d2c043bdc08202fdde
< HCI Command: Host Number of Compl.. (0x03|0x0035) plen 5  #73 [hci1] 8.429094
        Num handles: 1
        Handle: 165 Address: DF:A9:FF:F6:B1:1A (OUI DF-A9-FF)
        Count: 1
< ACL Data TX: Handle 165 flags 0x00 dlen 21                #74 [hci1] 8.429270
      SMP: Pairing Confirm (0x03) len 16
        Confim value: 9ab16c4d04e39b4d6d0cfe29ed2a7b4a
> HCI Event: Number of Completed Packets (0x13) plen 5      #75 [hci1] 8.584749
        Num handles: 1
        Handle: 165 Address: DF:A9:FF:F6:B1:1A (OUI DF-A9-FF)
        Count: 1
        #74: len 21 (1 Kb/s)
        Latency: 155 msec (70-169 msec ~140 msec)
> ACL Data RX: Handle 165 flags 0x02 dlen 21                #76 [hci1] 8.585079
      SMP: Pairing Random (0x04) len 16
        Random value: 61e3b6e6a98bb6df0000000000000000
< HCI Command: Host Number of Compl.. (0x03|0x0035) plen 5  #77 [hci1] 8.589161
        Num handles: 1
        Handle: 165 Address: DF:A9:FF:F6:B1:1A (OUI DF-A9-FF)
        Count: 1
< ACL Data TX: Handle 165 flags 0x00 dlen 21                #78 [hci1] 8.589261
      SMP: Pairing Random (0x04) len 16
        Random value: 8e6108f966a694cbe26df70bb96773e6
> HCI Event: Number of Completed Packets (0x13) plen 5      #79 [hci1] 8.759454
        Num handles: 1
        Handle: 165 Address: DF:A9:FF:F6:B1:1A (OUI DF-A9-FF)
        Count: 1
        #78: len 21 (0 Kb/s)
        Latency: 170 msec (70-170 msec ~155 msec)
> ACL Data RX: Handle 165 flags 0x02 dlen 21                #80 [hci1] 8.847357
      SMP: Pairing Confirm (0x03) len 16
        Confim value: f59dcd37b57faba6d19be96c79074b6a
< HCI Command: Host Number of Compl.. (0x03|0x0035) plen 5  #81 [hci1] 8.848613
        Num handles: 1
        Handle: 165 Address: DF:A9:FF:F6:B1:1A (OUI DF-A9-FF)
        Count: 1
< ACL Data TX: Handle 165 flags 0x00 dlen 21                #82 [hci1] 8.848739
      SMP: Pairing Confirm (0x03) len 16
        Confim value: 825569015947a818da0fba214f00d985
> HCI Event: Number of Completed Packets (0x13) plen 5      #83 [hci1] 9.022192
        Num handles: 1
        Handle: 165 Address: DF:A9:FF:F6:B1:1A (OUI DF-A9-FF)
        Count: 1
        #82: len 21 (0 Kb/s)
        Latency: 173 msec (70-173 msec ~164 msec)
> ACL Data RX: Handle 165 flags 0x02 dlen 21                #84 [hci1] 9.022673
      SMP: Pairing Random (0x04) len 16
        Random value: 0568a1441f3ab6a70000000000000000
< HCI Command: Host Number of Compl.. (0x03|0x0035) plen 5  #85 [hci1] 9.029075
        Num handles: 1
        Handle: 165 Address: DF:A9:FF:F6:B1:1A (OUI DF-A9-FF)
        Count: 1
< ACL Data TX: Handle 165 flags 0x00 dlen 21                #86 [hci1] 9.029193
      SMP: Pairing Random (0x04) len 16
        Random value: 4d02679f89a05211af56d8b3da64d21e
> HCI Event: Number of Completed Packets (0x13) plen 5      #87 [hci1] 9.197003
        Num handles: 1
        Handle: 165 Address: DF:A9:FF:F6:B1:1A (OUI DF-A9-FF)
        Count: 1
        #86: len 21 (1 Kb/s)
        Latency: 167 msec (70-173 msec ~166 msec)
> ACL Data RX: Handle 165 flags 0x02 dlen 21                #88 [hci1] 9.284875
      SMP: Pairing Confirm (0x03) len 16
        Confim value: fd7324d60007e435c049452843afe9d4
< HCI Command: Host Number of Compl.. (0x03|0x0035) plen 5  #89 [hci1] 9.288815
        Num handles: 1
        Handle: 165 Address: DF:A9:FF:F6:B1:1A (OUI DF-A9-FF)
        Count: 1
< ACL Data TX: Handle 165 flags 0x00 dlen 21                #90 [hci1] 9.288866
      SMP: Pairing Confirm (0x03) len 16
        Confim value: 2c7fc4db87e512f5c8e1c7dbc462f9c6
> HCI Event: Number of Completed Packets (0x13) plen 5      #91 [hci1] 9.459705
        Num handles: 1
        Handle: 165 Address: DF:A9:FF:F6:B1:1A (OUI DF-A9-FF)
        Count: 1
        #90: len 21 (0 Kb/s)
        Latency: 170 msec (70-173 msec ~168 msec)
> ACL Data RX: Handle 165 flags 0x02 dlen 21                #92 [hci1] 9.460056
      SMP: Pairing Random (0x04) len 16
        Random value: aa9b79f41711a9b90000000000000000
< HCI Command: Host Number of Compl.. (0x03|0x0035) plen 5  #93 [hci1] 9.469141
        Num handles: 1
        Handle: 165 Address: DF:A9:FF:F6:B1:1A (OUI DF-A9-FF)
        Count: 1
< ACL Data TX: Handle 165 flags 0x00 dlen 21                #94 [hci1] 9.469343
      SMP: Pairing Random (0x04) len 16
        Random value: 5e8286bc235a02440d0c3424a2acf8fd
> HCI Event: Number of Completed Packets (0x13) plen 5      #95 [hci1] 9.634643
        Num handles: 1
        Handle: 165 Address: DF:A9:FF:F6:B1:1A (OUI DF-A9-FF)
        Count: 1
        #94: len 21 (1 Kb/s)
        Latency: 165 msec (70-173 msec ~166 msec)
> ACL Data RX: Handle 165 flags 0x02 dlen 21                #96 [hci1] 9.722275
      SMP: Pairing Confirm (0x03) len 16
        Confim value: 7d91f253b1dc0dab09220edf31059963
< HCI Command: Host Number of Compl.. (0x03|0x0035) plen 5  #97 [hci1] 9.728874
        Num handles: 1
        Handle: 165 Address: DF:A9:FF:F6:B1:1A (OUI DF-A9-FF)
        Count: 1
< ACL Data TX: Handle 165 flags 0x00 dlen 21                #98 [hci1] 9.729014
      SMP: Pairing Confirm (0x03) len 16
        Confim value: 433c67831fbe8947c71cedb211e3f474
> HCI Event: Number of Completed Packets (0x13) plen 5      #99 [hci1] 9.897174
        Num handles: 1
        Handle: 165 Address: DF:A9:FF:F6:B1:1A (OUI DF-A9-FF)
        Count: 1
        #98: len 21 (1 Kb/s)
        Latency: 168 msec (70-173 msec ~167 msec)
> ACL Data RX: Handle 165 flags 0x02 dlen 21               #100 [hci1] 9.897597
      SMP: Pairing Random (0x04) len 16
        Random value: a97da117b67f55d60000000000000000
< HCI Command: Host Number of Comp.. (0x03|0x0035) plen 5  #101 [hci1] 9.909150
        Num handles: 1
        Handle: 165 Address: DF:A9:FF:F6:B1:1A (OUI DF-A9-FF)
        Count: 1
< ACL Data TX: Handle 165 flags 0x00 dlen 21               #102 [hci1] 9.909270
      SMP: Pairing Random (0x04) len 16
        Random value: 5c4a1bcadd27bd58e945097b00bad7ac
> HCI Event: Number of Completed Packets (0x13) plen 5    #103 [hci1] 10.071915
        Num handles: 1
        Handle: 165 Address: DF:A9:FF:F6:B1:1A (OUI DF-A9-FF)
        Count: 1
        #102: len 21 (1 Kb/s)
        Latency: 162 msec (70-173 msec ~165 msec)
> ACL Data RX: Handle 165 flags 0x02 dlen 21              #104 [hci1] 10.159821
      SMP: Pairing Confirm (0x03) len 16
        Confim value: ee54b89ad63be1e23710c8abeaee8cea
< HCI Command: Host Number of Com.. (0x03|0x0035) plen 5  #105 [hci1] 10.168721
        Num handles: 1
        Handle: 165 Address: DF:A9:FF:F6:B1:1A (OUI DF-A9-FF)
        Count: 1
< ACL Data TX: Handle 165 flags 0x00 dlen 21              #106 [hci1] 10.168874
      SMP: Pairing Confirm (0x03) len 16
        Confim value: 9f231b61170b4f3cdbe60df1d73a6225
> HCI Event: Number of Completed Packets (0x13) plen 5    #107 [hci1] 10.334831
        Num handles: 1
        Handle: 165 Address: DF:A9:FF:F6:B1:1A (OUI DF-A9-FF)
        Count: 1
        #106: len 21 (1 Kb/s)
        Latency: 165 msec (70-173 msec ~165 msec)
> ACL Data RX: Handle 165 flags 0x02 dlen 21              #108 [hci1] 10.335067
      SMP: Pairing Random (0x04) len 16
        Random value: b6378550c1eca7890000000000000000
< HCI Command: Host Number of Com.. (0x03|0x0035) plen 5  #109 [hci1] 10.349130
        Num handles: 1
        Handle: 165 Address: DF:A9:FF:F6:B1:1A (OUI DF-A9-FF)
        Count: 1
< ACL Data TX: Handle 165 flags 0x00 dlen 21              #110 [hci1] 10.349252
      SMP: Pairing Random (0x04) len 16
        Random value: 32527e6e64e79f33b2e374394db8ab2d
> HCI Event: Number of Completed Packets (0x13) plen 5    #111 [hci1] 10.509568
        Num handles: 1
        Handle: 165 Address: DF:A9:FF:F6:B1:1A (OUI DF-A9-FF)
        Count: 1
        #110: len 21 (1 Kb/s)
        Latency: 160 msec (70-173 msec ~162 msec)
> ACL Data RX: Handle 165 flags 0x02 dlen 21              #112 [hci1] 10.597392
      SMP: Pairing Confirm (0x03) len 16
        Confim value: cea1865113fe1e746a28a9cc47d76cb8
< HCI Command: Host Number of Com.. (0x03|0x0035) plen 5  #113 [hci1] 10.608530
        Num handles: 1
        Handle: 165 Address: DF:A9:FF:F6:B1:1A (OUI DF-A9-FF)
        Count: 1
< ACL Data TX: Handle 165 flags 0x00 dlen 21              #114 [hci1] 10.608649
      SMP: Pairing Confirm (0x03) len 16
        Confim value: d822915131cd22d3376224ca78bbe26a
> HCI Event: Number of Completed Packets (0x13) plen 5    #115 [hci1] 10.772150
        Num handles: 1
        Handle: 165 Address: DF:A9:FF:F6:B1:1A (OUI DF-A9-FF)
        Count: 1
        #114: len 21 (1 Kb/s)
        Latency: 163 msec (70-173 msec ~163 msec)
> ACL Data RX: Handle 165 flags 0x02 dlen 21              #116 [hci1] 10.772516
      SMP: Pairing Random (0x04) len 16
        Random value: 396d447e61ab223d0000000000000000
< HCI Command: Host Number of Com.. (0x03|0x0035) plen 5  #117 [hci1] 10.789156
        Num handles: 1
        Handle: 165 Address: DF:A9:FF:F6:B1:1A (OUI DF-A9-FF)
        Count: 1
< ACL Data TX: Handle 165 flags 0x00 dlen 21              #118 [hci1] 10.789243
      SMP: Pairing Random (0x04) len 16
        Random value: dddbdfe2838e9a8cc6964353c850fef7
> HCI Event: Number of Completed Packets (0x13) plen 5    #119 [hci1] 10.947025
        Num handles: 1
        Handle: 165 Address: DF:A9:FF:F6:B1:1A (OUI DF-A9-FF)
        Count: 1
        #118: len 21 (1 Kb/s)
        Latency: 157 msec (70-173 msec ~160 msec)
> ACL Data RX: Handle 165 flags 0x02 dlen 21              #120 [hci1] 11.034724
      SMP: Pairing Confirm (0x03) len 16
        Confim value: 09daaf5ea177bc484dac3db8b5a842c4
< HCI Command: Host Number of Com.. (0x03|0x0035) plen 5  #121 [hci1] 11.048727
        Num handles: 1
        Handle: 165 Address: DF:A9:FF:F6:B1:1A (OUI DF-A9-FF)
        Count: 1
< ACL Data TX: Handle 165 flags 0x00 dlen 21              #122 [hci1] 11.048870
      SMP: Pairing Confirm (0x03) len 16
        Confim value: a0ba64f7e92a64d1c349599aab897975
> HCI Event: Number of Completed Packets (0x13) plen 5    #123 [hci1] 11.209732
        Num handles: 1
        Handle: 165 Address: DF:A9:FF:F6:B1:1A (OUI DF-A9-FF)
        Count: 1
        #122: len 21 (1 Kb/s)
        Latency: 160 msec (70-173 msec ~160 msec)
> ACL Data RX: Handle 165 flags 0x02 dlen 21              #124 [hci1] 11.210026
      SMP: Pairing Random (0x04) len 16
        Random value: a41741f8af6d3a6a0000000000000000
< HCI Command: Host Number of Com.. (0x03|0x0035) plen 5  #125 [hci1] 11.229202
        Num handles: 1
        Handle: 165 Address: DF:A9:FF:F6:B1:1A (OUI DF-A9-FF)
        Count: 1
< ACL Data TX: Handle 165 flags 0x00 dlen 21              #126 [hci1] 11.229302
      SMP: Pairing Random (0x04) len 16
        Random value: eb9f1915536596b6fc3db1c86b2b1970
> HCI Event: Number of Completed Packets (0x13) plen 5    #127 [hci1] 11.384405
        Num handles: 1
        Handle: 165 Address: DF:A9:FF:F6:B1:1A (OUI DF-A9-FF)
        Count: 1
        #126: len 21 (1 Kb/s)
        Latency: 155 msec (70-173 msec ~157 msec)
> ACL Data RX: Handle 165 flags 0x02 dlen 21              #128 [hci1] 11.472301
      SMP: Pairing Confirm (0x03) len 16
        Confim value: 51e06db52fe3b2b84022d0d5957701b9
< HCI Command: Host Number of Com.. (0x03|0x0035) plen 5  #129 [hci1] 11.489015
        Num handles: 1
        Handle: 165 Address: DF:A9:FF:F6:B1:1A (OUI DF-A9-FF)
        Count: 1
< ACL Data TX: Handle 165 flags 0x00 dlen 21              #130 [hci1] 11.489222
      SMP: Pairing Confirm (0x03) len 16
        Confim value: 1fc4a2c004b4a3fcba55fd3b1311df82
> HCI Event: Number of Completed Packets (0x13) plen 5    #131 [hci1] 11.647144
        Num handles: 1
        Handle: 165 Address: DF:A9:FF:F6:B1:1A (OUI DF-A9-FF)
        Count: 1
        #130: len 21 (1 Kb/s)
        Latency: 157 msec (70-173 msec ~157 msec)
> ACL Data RX: Handle 165 flags 0x02 dlen 21              #132 [hci1] 11.647519
      SMP: Pairing Random (0x04) len 16
        Random value: 398b7c0be348244d0000000000000000
< HCI Command: Host Number of Com.. (0x03|0x0035) plen 5  #133 [hci1] 11.649114
        Num handles: 1
        Handle: 165 Address: DF:A9:FF:F6:B1:1A (OUI DF-A9-FF)
        Count: 1
< ACL Data TX: Handle 165 flags 0x00 dlen 21              #134 [hci1] 11.649215
      SMP: Pairing Random (0x04) len 16
        Random value: 5c794dc9ad9f2c3f295ebd5ad5e1c3cf
> HCI Event: Number of Completed Packets (0x13) plen 5    #135 [hci1] 11.821945
        Num handles: 1
        Handle: 165 Address: DF:A9:FF:F6:B1:1A (OUI DF-A9-FF)
        Count: 1
        #134: len 21 (0 Kb/s)
        Latency: 172 msec (70-173 msec ~165 msec)
> ACL Data RX: Handle 165 flags 0x02 dlen 21              #136 [hci1] 11.909722
      SMP: Pairing Confirm (0x03) len 16
        Confim value: a2107b945c01c50817174c6425a8d8ba
< HCI Command: Host Number of Com.. (0x03|0x0035) plen 5  #137 [hci1] 11.928535
        Num handles: 1
        Handle: 165 Address: DF:A9:FF:F6:B1:1A (OUI DF-A9-FF)
        Count: 1
< ACL Data TX: Handle 165 flags 0x00 dlen 21              #138 [hci1] 11.928630
      SMP: Pairing Confirm (0x03) len 16
        Confim value: d2f9af3cb3631952a54b1ed23b17d21a
> HCI Event: Number of Completed Packets (0x13) plen 5    #139 [hci1] 12.084705
        Num handles: 1
        Handle: 165 Address: DF:A9:FF:F6:B1:1A (OUI DF-A9-FF)
        Count: 1
        #138: len 21 (1 Kb/s)
        Latency: 156 msec (70-173 msec ~160 msec)
> ACL Data RX: Handle 165 flags 0x02 dlen 21              #140 [hci1] 12.084949
      SMP: Pairing Random (0x04) len 16
        Random value: da48bd51af9e00700000000000000000
< HCI Command: Host Number of Com.. (0x03|0x0035) plen 5  #141 [hci1] 12.089167
        Num handles: 1
        Handle: 165 Address: DF:A9:FF:F6:B1:1A (OUI DF-A9-FF)
        Count: 1
< ACL Data TX: Handle 165 flags 0x00 dlen 21              #142 [hci1] 12.089290
      SMP: Pairing Random (0x04) len 16
        Random value: 5c2fff312cdf99c9491988e877355a9a
> HCI Event: Number of Completed Packets (0x13) plen 5    #143 [hci1] 12.259367
        Num handles: 1
        Handle: 165 Address: DF:A9:FF:F6:B1:1A (OUI DF-A9-FF)
        Count: 1
        #142: len 21 (0 Kb/s)
        Latency: 170 msec (70-173 msec ~165 msec)
> ACL Data RX: Handle 165 flags 0x02 dlen 21              #144 [hci1] 12.347300
      SMP: Pairing Confirm (0x03) len 16
        Confim value: 802fae9a68e7189a8ada0d9849afcebd
< HCI Command: Host Number of Com.. (0x03|0x0035) plen 5  #145 [hci1] 12.348851
        Num handles: 1
        Handle: 165 Address: DF:A9:FF:F6:B1:1A (OUI DF-A9-FF)
        Count: 1
< ACL Data TX: Handle 165 flags 0x00 dlen 21              #146 [hci1] 12.349018
      SMP: Pairing Confirm (0x03) len 16
        Confim value: af74e077e1db84fa64a79f2e2cb58703
> HCI Event: Number of Completed Packets (0x13) plen 5    #147 [hci1] 12.522058
        Num handles: 1
        Handle: 165 Address: DF:A9:FF:F6:B1:1A (OUI DF-A9-FF)
        Count: 1
        #146: len 21 (0 Kb/s)
        Latency: 173 msec (70-173 msec ~169 msec)
> ACL Data RX: Handle 165 flags 0x02 dlen 21              #148 [hci1] 12.522421
      SMP: Pairing Random (0x04) len 16
        Random value: 26a44e45e66e456d0000000000000000
< HCI Command: Host Number of Com.. (0x03|0x0035) plen 5  #149 [hci1] 12.528702
        Num handles: 1
        Handle: 165 Address: DF:A9:FF:F6:B1:1A (OUI DF-A9-FF)
        Count: 1
< ACL Data TX: Handle 165 flags 0x00 dlen 21              #150 [hci1] 12.528733
      SMP: Pairing Random (0x04) len 16
        Random value: c629a3a987d808e808655d558dfc1155
> HCI Event: Number of Completed Packets (0x13) plen 5    #151 [hci1] 12.696903
        Num handles: 1
        Handle: 165 Address: DF:A9:FF:F6:B1:1A (OUI DF-A9-FF)
        Count: 1
        #150: len 21 (1 Kb/s)
        Latency: 168 msec (70-173 msec ~168 msec)
> ACL Data RX: Handle 165 flags 0x02 dlen 21              #152 [hci1] 12.784819
      SMP: Pairing Confirm (0x03) len 16
        Confim value: e80452d27ffbc7c6e7b98f04d14292d4
< HCI Command: Host Number of Com.. (0x03|0x0035) plen 5  #153 [hci1] 12.788764
        Num handles: 1
        Handle: 165 Address: DF:A9:FF:F6:B1:1A (OUI DF-A9-FF)
        Count: 1
< ACL Data TX: Handle 165 flags 0x00 dlen 21              #154 [hci1] 12.788911
      SMP: Pairing Confirm (0x03) len 16
        Confim value: 220fd59d0368e197e257b85cf2e6b967
> HCI Event: Number of Completed Packets (0x13) plen 5    #155 [hci1] 12.959567
        Num handles: 1
        Handle: 165 Address: DF:A9:FF:F6:B1:1A (OUI DF-A9-FF)
        Count: 1
        #154: len 21 (0 Kb/s)
        Latency: 170 msec (70-173 msec ~169 msec)
> ACL Data RX: Handle 165 flags 0x02 dlen 21              #156 [hci1] 12.959990
      SMP: Pairing Random (0x04) len 16
        Random value: 498556d6ed26b45e0000000000000000
< HCI Command: Host Number of Com.. (0x03|0x0035) plen 5  #157 [hci1] 12.969145
        Num handles: 1
        Handle: 165 Address: DF:A9:FF:F6:B1:1A (OUI DF-A9-FF)
        Count: 1
< ACL Data TX: Handle 165 flags 0x00 dlen 21              #158 [hci1] 12.969308
      SMP: Pairing Random (0x04) len 16
        Random value: 92f20f6ad8f13724432c7fd6001c45ff
> HCI Event: Number of Completed Packets (0x13) plen 5    #159 [hci1] 13.134394
        Num handles: 1
        Handle: 165 Address: DF:A9:FF:F6:B1:1A (OUI DF-A9-FF)
        Count: 1
        #158: len 21 (1 Kb/s)
        Latency: 165 msec (70-173 msec ~167 msec)
> ACL Data RX: Handle 165 flags 0x02 dlen 21              #160 [hci1] 13.222280
      SMP: Pairing Confirm (0x03) len 16
        Confim value: 4df4fc4dcd3e9af7c3294f4c1e76fe89
< HCI Command: Host Number of Com.. (0x03|0x0035) plen 5  #161 [hci1] 13.229009
        Num handles: 1
        Handle: 165 Address: DF:A9:FF:F6:B1:1A (OUI DF-A9-FF)
        Count: 1
< ACL Data TX: Handle 165 flags 0x00 dlen 21              #162 [hci1] 13.229166
      SMP: Pairing Confirm (0x03) len 16
        Confim value: ec36d99b7fc39c50ae5814b3aeef0357
> HCI Event: Number of Completed Packets (0x13) plen 5    #163 [hci1] 13.397096
        Num handles: 1
        Handle: 165 Address: DF:A9:FF:F6:B1:1A (OUI DF-A9-FF)
        Count: 1
        #162: len 21 (1 Kb/s)
        Latency: 167 msec (70-173 msec ~167 msec)
> ACL Data RX: Handle 165 flags 0x02 dlen 21              #164 [hci1] 13.397366
      SMP: Pairing Random (0x04) len 16
        Random value: 1489530a547c446a0000000000000000
< HCI Command: Host Number of Com.. (0x03|0x0035) plen 5  #165 [hci1] 13.409218
        Num handles: 1
        Handle: 165 Address: DF:A9:FF:F6:B1:1A (OUI DF-A9-FF)
        Count: 1
< ACL Data TX: Handle 165 flags 0x00 dlen 21              #166 [hci1] 13.409384
      SMP: Pairing Random (0x04) len 16
        Random value: 23ac32ebbb5e14c8a6b9622f296d277f
> HCI Event: Number of Completed Packets (0x13) plen 5    #167 [hci1] 13.571847
        Num handles: 1
        Handle: 165 Address: DF:A9:FF:F6:B1:1A (OUI DF-A9-FF)
        Count: 1
        #166: len 21 (1 Kb/s)
        Latency: 162 msec (70-173 msec ~165 msec)
> ACL Data RX: Handle 165 flags 0x02 dlen 21              #168 [hci1] 13.659787
      SMP: Pairing Confirm (0x03) len 16
        Confim value: 3acac00b8f616f4996b0c565742afa9d
< HCI Command: Host Number of Com.. (0x03|0x0035) plen 5  #169 [hci1] 13.668605
        Num handles: 1
        Handle: 165 Address: DF:A9:FF:F6:B1:1A (OUI DF-A9-FF)
        Count: 1
< ACL Data TX: Handle 165 flags 0x00 dlen 21              #170 [hci1] 13.668699
      SMP: Pairing Confirm (0x03) len 16
        Confim value: f5e3d556f4b3338a7e8cde347e2f0967
> HCI Event: Number of Completed Packets (0x13) plen 5    #171 [hci1] 13.834577
        Num handles: 1
        Handle: 165 Address: DF:A9:FF:F6:B1:1A (OUI DF-A9-FF)
        Count: 1
        #170: len 21 (1 Kb/s)
        Latency: 165 msec (70-173 msec ~165 msec)
> ACL Data RX: Handle 165 flags 0x02 dlen 21              #172 [hci1] 13.834954
      SMP: Pairing Random (0x04) len 16
        Random value: ccd70551675a3d600000000000000000
< HCI Command: Host Number of Com.. (0x03|0x0035) plen 5  #173 [hci1] 13.849244
        Num handles: 1
        Handle: 165 Address: DF:A9:FF:F6:B1:1A (OUI DF-A9-FF)
        Count: 1
< ACL Data TX: Handle 165 flags 0x00 dlen 21              #174 [hci1] 13.849355
      SMP: Pairing Random (0x04) len 16
        Random value: 297efe85e67448a15f56bd27e3a3cf1d
> HCI Event: Number of Completed Packets (0x13) plen 5    #175 [hci1] 14.009418
        Num handles: 1
        Handle: 165 Address: DF:A9:FF:F6:B1:1A (OUI DF-A9-FF)
        Count: 1
        #174: len 21 (1 Kb/s)
        Latency: 160 msec (70-173 msec ~162 msec)
> ACL Data RX: Handle 165 flags 0x02 dlen 21              #176 [hci1] 14.097122
      SMP: Pairing Confirm (0x03) len 16
        Confim value: 7bb1ca96656d87ede7d29a972d16d6f9
< HCI Command: Host Number of Com.. (0x03|0x0035) plen 5  #177 [hci1] 14.108647
        Num handles: 1
        Handle: 165 Address: DF:A9:FF:F6:B1:1A (OUI DF-A9-FF)
        Count: 1
< ACL Data TX: Handle 165 flags 0x00 dlen 21              #178 [hci1] 14.108771
      SMP: Pairing Confirm (0x03) len 16
        Confim value: 575b581afafe0995cc4b0054d2389406
> HCI Event: Number of Completed Packets (0x13) plen 5    #179 [hci1] 14.272064
        Num handles: 1
        Handle: 165 Address: DF:A9:FF:F6:B1:1A (OUI DF-A9-FF)
        Count: 1
        #178: len 21 (1 Kb/s)
        Latency: 163 msec (70-173 msec ~163 msec)
> ACL Data RX: Handle 165 flags 0x02 dlen 21              #180 [hci1] 14.272452
      SMP: Pairing Random (0x04) len 16
        Random value: ee4fe8827438b18e0000000000000000
< HCI Command: Host Number of Com.. (0x03|0x0035) plen 5  #181 [hci1] 14.289259
        Num handles: 1
        Handle: 165 Address: DF:A9:FF:F6:B1:1A (OUI DF-A9-FF)
        Count: 1
< ACL Data TX: Handle 165 flags 0x00 dlen 21              #182 [hci1] 14.289337
      SMP: Pairing Random (0x04) len 16
        Random value: 25a9493fd3ce4faf02be7293595bb7c6
> HCI Event: Number of Completed Packets (0x13) plen 5    #183 [hci1] 14.446794
        Num handles: 1
        Handle: 165 Address: DF:A9:FF:F6:B1:1A (OUI DF-A9-FF)
        Count: 1
        #182: len 21 (1 Kb/s)
        Latency: 157 msec (70-173 msec ~160 msec)
> ACL Data RX: Handle 165 flags 0x02 dlen 21              #184 [hci1] 14.534719
      SMP: Pairing Confirm (0x03) len 16
        Confim value: 6496b74da65a9b32cb998ecc923253f8
< HCI Command: Host Number of Com.. (0x03|0x0035) plen 5  #185 [hci1] 14.548752
        Num handles: 1
        Handle: 165 Address: DF:A9:FF:F6:B1:1A (OUI DF-A9-FF)
        Count: 1
< ACL Data TX: Handle 165 flags 0x00 dlen 21              #186 [hci1] 14.548881
      SMP: Pairing Confirm (0x03) len 16
        Confim value: 57e46955bb37d9f240d5c247f8c41dd5
> HCI Event: Number of Completed Packets (0x13) plen 5    #187 [hci1] 14.709490
        Num handles: 1
        Handle: 165 Address: DF:A9:FF:F6:B1:1A (OUI DF-A9-FF)
        Count: 1
        #186: len 21 (1 Kb/s)
        Latency: 160 msec (70-173 msec ~160 msec)
> ACL Data RX: Handle 165 flags 0x02 dlen 21              #188 [hci1] 14.709903
      SMP: Pairing Random (0x04) len 16
        Random value: ec02a0f648be68ea0000000000000000
< HCI Command: Host Number of Com.. (0x03|0x0035) plen 5  #189 [hci1] 14.729255
        Num handles: 1
        Handle: 165 Address: DF:A9:FF:F6:B1:1A (OUI DF-A9-FF)
        Count: 1
< ACL Data TX: Handle 165 flags 0x00 dlen 21              #190 [hci1] 14.729409
      SMP: Pairing Random (0x04) len 16
        Random value: 58f6b41f855a6f6c3560debd84e2affc
> HCI Event: Number of Completed Packets (0x13) plen 5    #191 [hci1] 14.884313
        Num handles: 1
        Handle: 165 Address: DF:A9:FF:F6:B1:1A (OUI DF-A9-FF)
        Count: 1
        #190: len 21 (1 Kb/s)
        Latency: 154 msec (70-173 msec ~157 msec)
> ACL Data RX: Handle 165 flags 0x02 dlen 21              #192 [hci1] 14.972159
      SMP: Pairing Confirm (0x03) len 16
        Confim value: b7481d5b5bfe6ef4b84f2ab3d96697f4
< HCI Command: Host Number of Com.. (0x03|0x0035) plen 5  #193 [hci1] 14.988649
        Num handles: 1
        Handle: 165 Address: DF:A9:FF:F6:B1:1A (OUI DF-A9-FF)
        Count: 1
< ACL Data TX: Handle 165 flags 0x00 dlen 21              #194 [hci1] 14.988796
      SMP: Pairing Confirm (0x03) len 16
        Confim value: 398f787098a4d0e343978700977e4053
> HCI Event: Number of Completed Packets (0x13) plen 5    #195 [hci1] 15.146997
        Num handles: 1
        Handle: 165 Address: DF:A9:FF:F6:B1:1A (OUI DF-A9-FF)
        Count: 1
        #194: len 21 (1 Kb/s)
        Latency: 158 msec (70-173 msec ~157 msec)
> ACL Data RX: Handle 165 flags 0x02 dlen 21              #196 [hci1] 15.147338
      SMP: Pairing Random (0x04) len 16
        Random value: cc3a1e713e8c83a00000000000000000
< HCI Command: Host Number of Com.. (0x03|0x0035) plen 5  #197 [hci1] 15.149025
        Num handles: 1
        Handle: 165 Address: DF:A9:FF:F6:B1:1A (OUI DF-A9-FF)
        Count: 1
< ACL Data TX: Handle 165 flags 0x00 dlen 21              #198 [hci1] 15.149143
      SMP: Pairing Random (0x04) len 16
        Random value: b67e7216d5bf664139eda2b542549666
> HCI Event: Number of Completed Packets (0x13) plen 5    #199 [hci1] 15.321826
        Num handles: 1
        Handle: 165 Address: DF:A9:FF:F6:B1:1A (OUI DF-A9-FF)
        Count: 1
        #198: len 21 (0 Kb/s)
        Latency: 172 msec (70-173 msec ~165 msec)
> ACL Data RX: Handle 165 flags 0x02 dlen 21              #200 [hci1] 15.409631
      SMP: Pairing Confirm (0x03) len 16
        Confim value: b96d3fe480158521cf26bfd144838c01
< HCI Command: Host Number of Com.. (0x03|0x0035) plen 5  #201 [hci1] 15.428946
        Num handles: 1
        Handle: 165 Address: DF:A9:FF:F6:B1:1A (OUI DF-A9-FF)
        Count: 1
< ACL Data TX: Handle 165 flags 0x00 dlen 21              #202 [hci1] 15.429122
      SMP: Pairing Confirm (0x03) len 16
        Confim value: f21a3637e3740639164152fe9c111613
> HCI Event: Number of Completed Packets (0x13) plen 5    #203 [hci1] 15.584537
        Num handles: 1
        Handle: 165 Address: DF:A9:FF:F6:B1:1A (OUI DF-A9-FF)
        Count: 1
        #202: len 21 (1 Kb/s)
        Latency: 155 msec (70-173 msec ~160 msec)
> ACL Data RX: Handle 165 flags 0x02 dlen 21              #204 [hci1] 15.584851
      SMP: Pairing Random (0x04) len 16
        Random value: f1dbcc056d1b508f0000000000000000
< HCI Command: Host Number of Com.. (0x03|0x0035) plen 5  #205 [hci1] 15.589207
        Num handles: 1
        Handle: 165 Address: DF:A9:FF:F6:B1:1A (OUI DF-A9-FF)
        Count: 1
< ACL Data TX: Handle 165 flags 0x00 dlen 21              #206 [hci1] 15.589288
      SMP: Pairing Random (0x04) len 16
        Random value: ed17f76500c95219dd01e09d1e63f87b
> HCI Event: Number of Completed Packets (0x13) plen 5    #207 [hci1] 15.759257
        Num handles: 1
        Handle: 165 Address: DF:A9:FF:F6:B1:1A (OUI DF-A9-FF)
        Count: 1
        #206: len 21 (0 Kb/s)
        Latency: 169 msec (70-173 msec ~165 msec)
> ACL Data RX: Handle 165 flags 0x02 dlen 21              #208 [hci1] 15.847089
      SMP: Pairing Confirm (0x03) len 16
        Confim value: fb5f5ae44dd50f7594096959c3d5263f
< HCI Command: Host Number of Com.. (0x03|0x0035) plen 5  #209 [hci1] 15.849097
        Num handles: 1
        Handle: 165 Address: DF:A9:FF:F6:B1:1A (OUI DF-A9-FF)
        Count: 1
< ACL Data TX: Handle 165 flags 0x00 dlen 21              #210 [hci1] 15.849297
      SMP: Pairing Confirm (0x03) len 16
        Confim value: 225546f4a2ab4dc23457f5190a9fab68
> HCI Event: Number of Completed Packets (0x13) plen 5    #211 [hci1] 16.022009
        Num handles: 1
        Handle: 165 Address: DF:A9:FF:F6:B1:1A (OUI DF-A9-FF)
        Count: 1
        #210: len 21 (0 Kb/s)
        Latency: 172 msec (70-173 msec ~168 msec)
> ACL Data RX: Handle 165 flags 0x02 dlen 21              #212 [hci1] 16.022352
      SMP: Pairing Random (0x04) len 16
        Random value: 755e147c8ae271d40000000000000000
< HCI Command: Host Number of Com.. (0x03|0x0035) plen 5  #213 [hci1] 16.029069
        Num handles: 1
        Handle: 165 Address: DF:A9:FF:F6:B1:1A (OUI DF-A9-FF)
        Count: 1
< ACL Data TX: Handle 165 flags 0x00 dlen 21              #214 [hci1] 16.029153
      SMP: Pairing Random (0x04) len 16
        Random value: 81d35d47e1f6006d79c974bd9d9e1ee3
> HCI Event: Number of Completed Packets (0x13) plen 5    #215 [hci1] 16.196812
        Num handles: 1
        Handle: 165 Address: DF:A9:FF:F6:B1:1A (OUI DF-A9-FF)
        Count: 1
        #214: len 21 (1 Kb/s)
        Latency: 167 msec (70-173 msec ~168 msec)
> ACL Data RX: Handle 165 flags 0x02 dlen 21              #216 [hci1] 16.284645
      SMP: Pairing Confirm (0x03) len 16
        Confim value: de2127d79e570e01e51287d189b74481
< HCI Command: Host Number of Com.. (0x03|0x0035) plen 5  #217 [hci1] 16.289108
        Num handles: 1
        Handle: 165 Address: DF:A9:FF:F6:B1:1A (OUI DF-A9-FF)
        Count: 1
< ACL Data TX: Handle 165 flags 0x00 dlen 21              #218 [hci1] 16.289322
      SMP: Pairing Confirm (0x03) len 16
        Confim value: 04fb825d2f2f18a087342c9eb2c259a6
> HCI Event: Number of Completed Packets (0x13) plen 5    #219 [hci1] 16.459469
        Num handles: 1
        Handle: 165 Address: DF:A9:FF:F6:B1:1A (OUI DF-A9-FF)
        Count: 1
        #218: len 21 (0 Kb/s)
        Latency: 170 msec (70-173 msec ~169 msec)
> ACL Data RX: Handle 165 flags 0x02 dlen 21              #220 [hci1] 16.459781
      SMP: Pairing Random (0x04) len 16
        Random value: 086cf5c301a83fe50000000000000000
< HCI Command: Host Number of Com.. (0x03|0x0035) plen 5  #221 [hci1] 16.469264
        Num handles: 1
        Handle: 165 Address: DF:A9:FF:F6:B1:1A (OUI DF-A9-FF)
        Count: 1
< ACL Data TX: Handle 165 flags 0x00 dlen 21              #222 [hci1] 16.469415
      SMP: Pairing Random (0x04) len 16
        Random value: e7f7e0c2476823e41736a7e381bafb7c
> HCI Event: Number of Completed Packets (0x13) plen 5    #223 [hci1] 16.634276
        Num handles: 1
        Handle: 165 Address: DF:A9:FF:F6:B1:1A (OUI DF-A9-FF)
        Count: 1
        #222: len 21 (1 Kb/s)
        Latency: 164 msec (70-173 msec ~167 msec)
> ACL Data RX: Handle 165 flags 0x02 dlen 21              #224 [hci1] 16.722111
      SMP: Pairing Confirm (0x03) len 16
        Confim value: 1249a14b97f866bced48fe7da535fe5d
< HCI Command: Host Number of Com.. (0x03|0x0035) plen 5  #225 [hci1] 16.729026
        Num handles: 1
        Handle: 165 Address: DF:A9:FF:F6:B1:1A (OUI DF-A9-FF)
        Count: 1
< ACL Data TX: Handle 165 flags 0x00 dlen 21              #226 [hci1] 16.729224
      SMP: Pairing Confirm (0x03) len 16
        Confim value: f6ab3438076d90086fe1f87da27d66b4
> HCI Event: Number of Completed Packets (0x13) plen 5    #227 [hci1] 16.897063
        Num handles: 1
        Handle: 165 Address: DF:A9:FF:F6:B1:1A (OUI DF-A9-FF)
        Count: 1
        #226: len 21 (1 Kb/s)
        Latency: 167 msec (70-173 msec ~167 msec)
> ACL Data RX: Handle 165 flags 0x02 dlen 21              #228 [hci1] 16.897284
      SMP: Pairing Random (0x04) len 16
        Random value: 2b68835f43fb94ec0000000000000000
< HCI Command: Host Number of Com.. (0x03|0x0035) plen 5  #229 [hci1] 16.909212
        Num handles: 1
        Handle: 165 Address: DF:A9:FF:F6:B1:1A (OUI DF-A9-FF)
        Count: 1
