Bluetooth monitor ver 5.72
= Note: Linux version 6.14.0-36-generic (x86_64)                       0.839741
= Note: Bluetooth subsystem version 2.22                               0.839743
= New Index: 00:00:00:00:00:00 (Primary,UART,hci1)              [hci1] 0.839744
= New Index: 48:5F:99:8E:E0:64 (Primary,USB,hci0)               [hci0] 0.839745
= Open Index: 00:00:00:00:00:00                                 [hci1] 1.353411
= Index Info: 00:00:00:00:00:00 (Nordic Semiconductor ASA)      [hci1] 1.353449
@ USER Open: main (privileged) version 2.22            {0x0001} [hci1] 1.353457
< HCI Command: Reset (0x03|0x0003) plen 0                    #1 [hci1] 1.354566
> HCI Event: Command Complete (0x0e) plen 4                  #2 [hci1] 1.355032
      Reset (0x03|0x0003) ncmd 1
        Status: Success (0x00)
< HCI Command: Read Local Supported... (0x04|0x0003) plen 0  #3 [hci1] 1.373267
> HCI Event: Command Complete (0x0e) plen 12                 #4 [hci1] 1.373844
      Read Local Supported Features (0x04|0x0003) ncmd 1
        Status: Success (0x00)
        Features: 0x00 0x00 0x00 0x00 0x60 0x00 0x00 0x00
          BR/EDR Not Supported
          LE Supported (Controller)
< HCI Command: Read Local Version In.. (0x04|0x0001) plen 0  #5 [hci1] 1.393012
> HCI Event: Command Complete (0x0e) plen 12                 #6 [hci1] 1.393498
      Read Local Version Information (0x04|0x0001) ncmd 1
        Status: Success (0x00)
        HCI version: Reserved (0x0f) - Revision 12393 (0x3069)
        LMP version: Reserved (0x0f) - Subversion 12393 (0x3069)
        Manufacturer: Nordic Semiconductor ASA (89)
< HCI Command: Read Local Supported... (0x04|0x0002) plen 0  #7 [hci1] 1.412923
> HCI Event: Command Complete (0x0e) plen 68                 #8 [hci1] 1.413985
      Read Local Supported Commands (0x04|0x0002) ncmd 1
        Status: Success (0x00)
        Commands: 119 entries
          Disconnect (Octet 0 - Bit 5)
          Read Remote Version Information (Octet 2 - Bit 7)
          Set Event Mask (Octet 5 - Bit 6)
          Reset (Octet 5 - Bit 7)
          Read Connection Accept Timeout (Octet 7 - Bit 2)
          Write Connection Accept Timeout (Octet 7 - Bit 3)
          Read Transmit Power Level (Octet 10 - Bit 2)
          Set Controller To Host Flow Control (Octet 10 - Bit 5)
          Host Buffer Size (Octet 10 - Bit 6)
          Host Number of Completed Packets (Octet 10 - Bit 7)
          Read Local Version Information (Octet 14 - Bit 3)
          Read Local Supported Features (Octet 14 - Bit 5)
          Read BD ADDR (Octet 15 - Bit 1)
          Read RSSI (Octet 15 - Bit 5)
          Set Event Mask Page 2 (Octet 22 - Bit 2)
          LE Set Event Mask (Octet 25 - Bit 0)
          LE Read Buffer Size (Octet 25 - Bit 1)
          LE Read Local Supported Features (Octet 25 - Bit 2)
          LE Set Random Address (Octet 25 - Bit 4)
          LE Set Advertising Parameters (Octet 25 - Bit 5)
          LE Read Advertising Channel TX Power (Octet 25 - Bit 6)
          LE Set Advertising Data (Octet 25 - Bit 7)
          LE Set Scan Response Data (Octet 26 - Bit 0)
          LE Set Advertise Enable (Octet 26 - Bit 1)
          LE Set Scan Parameters (Octet 26 - Bit 2)
          LE Set Scan Enable (Octet 26 - Bit 3)
          LE Create Connection (Octet 26 - Bit 4)
          LE Create Connection Cancel (Octet 26 - Bit 5)
          LE Read Accept List Size (Octet 26 - Bit 6)
          LE Clear Accept List (Octet 26 - Bit 7)
          LE Add Device To Accept List (Octet 27 - Bit 0)
          LE Remove Device From Accept List (Octet 27 - Bit 1)
          LE Connection Update (Octet 27 - Bit 2)
          LE Set Host Channel Classification (Octet 27 - Bit 3)
          LE Read Channel Map (Octet 27 - Bit 4)
          LE Read Remote Used Features (Octet 27 - Bit 5)
          LE Encrypt (Octet 27 - Bit 6)
          LE Rand (Octet 27 - Bit 7)
          LE Start Encryption (Octet 28 - Bit 0)
          LE Long Term Key Request Reply (Octet 28 - Bit 1)
          LE Long Term Key Request Neg Reply (Octet 28 - Bit 2)
          LE Read Supported States (Octet 28 - Bit 3)
          LE Receiver Test (Octet 28 - Bit 4)
          LE Transmitter Test (Octet 28 - Bit 5)
          LE Test End (Octet 28 - Bit 6)
          Read Authenticated Payload Timeout (Octet 32 - Bit 4)
          Write Authenticated Payload Timeout (Octet 32 - Bit 5)
          LE Set Data Length (Octet 33 - Bit 6)
          LE Read Suggested Default Data Length (Octet 33 - Bit 7)
          LE Write Suggested Default Data Length (Octet 34 - Bit 0)
          LE Add Device To Resolving List (Octet 34 - Bit 3)
          LE Remove Device From Resolving List (Octet 34 - Bit 4)
          LE Clear Resolving List (Octet 34 - Bit 5)
          LE Read Resolving List Size (Octet 34 - Bit 6)
          LE Set Address Resolution Enable (Octet 35 - Bit 1)
          LE Set Resolvable Private Address Timeout (Octet 35 - Bit 2)
          LE Read Maximum Data Length (Octet 35 - Bit 3)
          LE Read PHY (Octet 35 - Bit 4)
          LE Set Default PHY (Octet 35 - Bit 5)
          LE Set PHY (Octet 35 - Bit 6)
          LE Enhanced Receiver Test (Octet 35 - Bit 7)
          LE Enhanced Transmitter Test (Octet 36 - Bit 0)
          LE Set Advertising Set Random Address (Octet 36 - Bit 1)
          LE Set Extended Advertising Parameters (Octet 36 - Bit 2)
          LE Set Extended Advertising Data (Octet 36 - Bit 3)
          LE Set Extended Scan Response Data (Octet 36 - Bit 4)
          LE Set Extended Advertising Enable (Octet 36 - Bit 5)
          LE Read Maximum Advertising Data Length (Octet 36 - Bit 6)
          LE Read Number of Supported Advertising Sets (Octet 36 - Bit 7)
          LE Remove Advertising Set (Octet 37 - Bit 0)
          LE Clear Advertising Sets (Octet 37 - Bit 1)
          LE Set Periodic Advertising Parameters (Octet 37 - Bit 2)
          LE Set Periodic Advertising Data (Octet 37 - Bit 3)
          LE Set Periodic Advertising Enable (Octet 37 - Bit 4)
          LE Set Extended Scan Parameters (Octet 37 - Bit 5)
          LE Set Extended Scan Enable (Octet 37 - Bit 6)
          LE Extended Create Connection (Octet 37 - Bit 7)
          LE Periodic Advertising Create Sync (Octet 38 - Bit 0)
          LE Periodic Advertising Create Sync Cancel (Octet 38 - Bit 1)
          LE Periodic Advertising Terminate Sync (Octet 38 - Bit 2)
          LE Add Device To Periodic Advertiser List (Octet 38 - Bit 3)
          LE Remove Device From Periodic Advertiser List (Octet 38 - Bit 4)
          LE Clear Periodic Advertiser List (Octet 38 - Bit 5)
          LE Read Periodic Advertiser List Size (Octet 38 - Bit 6)
          LE Read Transmit Power (Octet 38 - Bit 7)
          LE Read RF Path Compensation (Octet 39 - Bit 0)
          LE Write RF Path Compensation (Octet 39 - Bit 1)
          LE Set Privacy Mode (Octet 39 - Bit 2)
          LE Periodic Advertising Receive Enable (Octet 40 - Bit 5)
          LE Periodic Advertising Sync Transfer (Octet 40 - Bit 6)
          LE Periodic Advertising Set Info Transfer (Octet 40 - Bit 7)
          LE Periodic Advertising Sync Transfer Parameters (Octet 41 - Bit 0)
          LE Set Default Periodic Advertisng Sync Transfer Parameters (Octet 41 - Bit 1)
          LE Read Buffer v2 (Octet 41 - Bit 5)
          LE Read ISO TX Sync (Octet 41 - Bit 6)
          LE Set Connected Isochronous Group Parameters (Octet 41 - Bit 7)
          LE Set Connected Isochronous Group Parameters Test (Octet 42 - Bit 0)
          LE Create Connected Isochronous Stream (Octet 42 - Bit 1)
          LE Remove Connected Isochronous Group (Octet 42 - Bit 2)
          LE Accept Connected Isochronous Stream Request (Octet 42 - Bit 3)
          LE Reject Connected Isochronous Stream Request (Octet 42 - Bit 4)
          LE Create Broadcast Isochronous Group (Octet 42 - Bit 5)
          LE Create Broadcast Isochronous Group Test (Octet 42 - Bit 6)
          LE Terminate Broadcast Isochronous Group (Octet 42 - Bit 7)
          LE Broadcast Isochronous Group Create Sync (Octet 43 - Bit 0)
          LE Broadcast Isochronous Group Terminate Sync (Octet 43 - Bit 1)
          LE Request Peer SCA (Octet 43 - Bit 2)
          LE Setup Isochronous Data Path (Octet 43 - Bit 3)
          LE Remove Isochronous Data Path (Octet 43 - Bit 4)
          LE Isochronous Transmit Test (Octet 43 - Bit 5)
          LE Isochronous Receive Test (Octet 43 - Bit 6)
          LE Isochronous Read Test Counters (Octet 43 - Bit 7)
          LE Isochronous Read Test Counters (Octet 44 - Bit 0)
          LE Set Host Feature (Octet 44 - Bit 1)
          Octet 44 - Bit 2 
          Octet 45 - Bit 6 
          Octet 46 - Bit 0 
          Octet 46 - Bit 1 
          Octet 46 - Bit 2 
< HCI Command: Host Buffer Size (0x03|0x0033) plen 7         #9 [hci1] 1.432934
        ACL MTU: 255  ACL max packet: 16
        SCO MTU: 0    SCO max packet: 0
> HCI Event: Command Complete (0x0e) plen 4                 #10 [hci1] 1.433408
      Host Buffer Size (0x03|0x0033) ncmd 1
        Status: Success (0x00)
< HCI Command: Set Controller To Ho.. (0x03|0x0031) plen 1  #11 [hci1] 1.452926
        Flow control: ACL Data Packets (0x01)
> HCI Event: Command Complete (0x0e) plen 4                 #12 [hci1] 1.453375
      Set Controller To Host Flow Control (0x03|0x0031) ncmd 1
        Status: Success (0x00)
< HCI Command: LE Read Local Suppor.. (0x08|0x0003) plen 0  #13 [hci1] 1.472922
> HCI Event: Command Complete (0x0e) plen 12                #14 [hci1] 1.473527
      LE Read Local Supported Features (0x08|0x0003) ncmd 1
        Status: Success (0x00)
        Features: 0xfd 0x79 0x00 0xf7 0x30 0x01 0x00 0x00
          LE Encryption
          Extended Reject Indication
          Peripheral-initiated Features Exchange
          LE Ping
          LE Data Packet Length Extension
          LL Privacy
          Extended Scanner Filter Policies
          LE 2M PHY
          LE Coded PHY
          LE Extended Advertising
          LE Periodic Advertising
          Channel Selection Algorithm #2
          Periodic Advertising Sync Transfer - Sender
          Periodic Advertising Sync Transfer - Recipient
          Sleep Clock Accuracy Updates
          Connected Isochronous Stream - Central
          Connected Isochronous Stream - Peripheral
          Isochronous Broadcaster
          Synchronized Receiver
          Periodic Advertising ADI support
          Connection Subrating
          Unknown features (0x0000010000000000)
< HCI Command: LE Set Host Feature (0x08|0x0074) plen 2     #15 [hci1] 1.492879
        Bit Number: 32
          Connected Isochronous Stream (Host Support)
        Bit Value: 1
> HCI Event: Command Complete (0x0e) plen 4                 #16 [hci1] 1.493297
      LE Set Host Feature (0x08|0x0074) ncmd 1
        Status: Success (0x00)
< HCI Command: LE Read Buffer v2 (0x08|0x0060) plen 0       #17 [hci1] 1.512942
> HCI Event: Command Complete (0x0e) plen 10                #18 [hci1] 1.513385
      LE Read Buffer v2 (0x08|0x0060) ncmd 1
        Status: Success (0x00)
        ACL MTU: 27
        ACL max packet: 3
        ISO MTU: 318
        ISO max packet: 3
< HCI Command: LE Read Maximum Adve.. (0x08|0x003a) plen 0  #19 [hci1] 1.532961
> HCI Event: Command Complete (0x0e) plen 6                 #20 [hci1] 1.533380
      LE Read Maximum Advertising Data Length (0x08|0x003a) ncmd 1
        Status: Success (0x00)
        Max length: 1650
< HCI Command: LE Read Supported St.. (0x08|0x001c) plen 0  #21 [hci1] 1.552926
> HCI Event: Command Complete (0x0e) plen 12                #22 [hci1] 1.553491
      LE Read Supported States (0x08|0x001c) ncmd 1
        Status: Success (0x00)
        States: 0x000003ff3e0306ff
          Non-connectable Advertising State
          Scannable Advertising State
          Connectable Advertising State
          High Duty Cycle Directed Advertising State
          Passive Scanning State
          Active Scanning State
          Initiating State
            and Connection State (Central Role)
          Connection State (Peripheral Role)
          Scannable Advertising State
            and Passive Scanning State
          Connectable Advertising State
            and Passive Scanning State
          Non-connectable Advertising State
            and Initiating State
          Scannable Advertising State
            and Initiating State
          Active Scanning State
            and Connection State (Central Role)
          Passive Scanning State
            and Connection State (Peripheral Role)
          Active Scanning State
            and Connection State (Peripheral Role)
          Initiating State
            and Connection State (Central Role)
            and Central Role & Central Role
          Low Duty Cycle Directed Advertising State
          Connectable Advertising State
            and Initiating State
            and Central Role & Peripheral Role
          High Duty Cycle Directed Advertising State
            and Initiating State
            and Central Role & Peripheral Role
          Low Duty Cycle Directed Advertising State
            and Initiating State
            and Central Role & Peripheral Role
          Connectable Advertising State
            and Connection State (Central Role)
            and Central Role & Peripheral Role
          High Duty Cycle Directed Advertising State
            and Connection State (Central Role)
            and Central Role & Peripheral Role
          Low Duty Cycle Directed Advertising State
            and Connection State (Central Role)
            and Central Role & Peripheral Role
          Connectable Advertising State
            and Connection State (Peripheral Role)
            and Central Role & Peripheral Role
          High Duty Cycle Directed Advertising State
            and Connection State (Peripheral Role)
            and Peripheral Role & Peripheral Role
          Low Duty Cycle Directed Advertising State
            and Connection State (Peripheral Role)
            and Peripheral Role & Peripheral Role
          Initiating State
            and Connection State (Peripheral Role)
            and Central Role & Peripheral Role
< HCI Command: LE Read Maximum Data.. (0x08|0x002f) plen 0  #23 [hci1] 1.572939
> HCI Event: Command Complete (0x0e) plen 12                #24 [hci1] 1.573383
      LE Read Maximum Data Length (0x08|0x002f) ncmd 1
        Status: Success (0x00)
        Max TX octets: 251
        Max TX time: 2704
        Max RX octets: 251
        Max RX time: 2704
< HCI Command: LE Write Suggested D.. (0x08|0x0024) plen 4  #25 [hci1] 1.592935
        TX octets: 251
        TX time: 2704
> HCI Event: Command Complete (0x0e) plen 4                 #26 [hci1] 1.593377
      LE Write Suggested Default Data Length (0x08|0x0024) ncmd 1
        Status: Success (0x00)
< HCI Command: LE Read Resolving Li.. (0x08|0x002a) plen 0  #27 [hci1] 1.612943
> HCI Event: Command Complete (0x0e) plen 5                 #28 [hci1] 1.613342
      LE Read Resolving List Size (0x08|0x002a) ncmd 1
        Status: Success (0x00)
        Size: 8
< HCI Command: LE Set Event Mask (0x08|0x0001) plen 8       #29 [hci1] 1.632926
        Mask: 0x000002023f87fa5e
          LE Advertising Report
          LE Connection Update Complete
          LE Read Remote Used Features Complete
          LE Long Term Key Request
          LE Data Length Change
          LE Enhanced Connection Complete
          LE PHY Update Complete
          LE Extended Advertising Report
          LE Periodic Advertising Sync Established
          LE Periodic Advertising Report
          LE Periodic Advertising Sync Lost
          LE Extended Scan Timeout
          LE Extended Advertising Set Terminated
          LE Scan Request Received
          LE Periodic Advertising Sync Transfer Rvc
          LE CIS Established
          LE CIS Request
          LE Create BIG Complete
          LE Terminate BIG Complete
          LE BIG Sync Estabilished Complete
          LE BIG Sync Lost
          LE BIG Info Advertising Report
          Unknown mask (0x0000020000000000)
> HCI Event: Command Complete (0x0e) plen 4                 #30 [hci1] 1.633526
      LE Set Event Mask (0x08|0x0001) ncmd 1
        Status: Success (0x00)
< HCI Command: Set Event Mask (0x03|0x0001) plen 8          #31 [hci1] 1.652938
        Mask: 0x2000800002008890
          Disconnection Complete
          Encryption Change
          Read Remote Version Information Complete
          Hardware Error
          Data Buffer Overflow
          Encryption Key Refresh Complete
          LE Meta
> HCI Event: Command Complete (0x0e) plen 4                 #32 [hci1] 1.653429
      Set Event Mask (0x03|0x0001) ncmd 1
        Status: Success (0x00)
< HCI Command: Read BD ADDR (0x04|0x0009) plen 0            #33 [hci1] 1.672933
> HCI Event: Command Complete (0x0e) plen 10                #34 [hci1] 1.673471
      Read BD ADDR (0x04|0x0009) ncmd 1
        Status: Success (0x00)
        Address: 00:00:00:00:00:00 (OUI 00-00-00)
< HCI Command: LE Set Random Address (0x08|0x0005) plen 6   #35 [hci1] 1.692946
        Address: D5:B6:CC:31:DB:3B (Static)
> HCI Event: Command Complete (0x0e) plen 4                 #36 [hci1] 1.693526
      LE Set Random Address (0x08|0x0005) ncmd 1
        Status: Success (0x00)
< HCI Command: LE Set Extended Adv.. (0x08|0x0036) plen 25  #37 [hci1] 3.942965
        Handle: 0x00
        Properties: 0x0013
          Connectable
          Scannable
          Use legacy advertising PDUs: ADV_IND
        Min advertising interval: 100.000 msec (0x00a0)
        Max advertising interval: 150.000 msec (0x00f0)
        Channel map: 37, 38, 39 (0x07)
        Own address type: Random (0x01)
        Peer address type: Public (0x00)
        Peer address: 00:00:00:00:00:00 (OUI 00-00-00)
        Filter policy: Allow Scan Request from Any, Allow Connect Request from Any (0x00)
        TX power: Host has no preference (0x7f)
        Primary PHY: LE 1M (0x01)
        Secondary max skip: 0x00
        Secondary PHY: LE 1M (0x01)
        SID: 0x00
        Scan request notifications: Disabled (0x00)
> HCI Event: Command Complete (0x0e) plen 5                 #38 [hci1] 3.943734
      LE Set Extended Advertising Parameters (0x08|0x0036) ncmd 1
        Status: Success (0x00)
        TX power (selected): 0 dbm (0x00)
< HCI Command: LE Set Advertising S.. (0x08|0x0035) plen 7  #39 [hci1] 3.952978
        Advertising handle: 0x00
        Advertising random address: D5:B6:CC:31:DB:3B (Static)
> HCI Event: Command Complete (0x0e) plen 4                 #40 [hci1] 3.953457
      LE Set Advertising Set Random Address (0x08|0x0035) ncmd 1
        Status: Success (0x00)
< HCI Command: LE Set Extended Adv.. (0x08|0x0037) plen 22  #41 [hci1] 3.972992
        Handle: 0x00
        Operation: Complete extended advertising data (0x03)
        Fragment preference: Minimize fragmentation (0x01)
        Data length: 0x12
        Flags: 0x06
          LE General Discoverable Mode
          BR/EDR Not Supported
        Name (complete): Tester_F6B11A
> HCI Event: Command Complete (0x0e) plen 4                 #42 [hci1] 3.973759
      LE Set Extended Advertising Data (0x08|0x0037) ncmd 1
        Status: Success (0x00)
< HCI Command: LE Set Extended Scan.. (0x08|0x0038) plen 4  #43 [hci1] 3.993005
        Handle: 0x00
        Operation: Complete scan response data (0x03)
        Fragment preference: Minimize fragmentation (0x01)
        Data length: 0x00
> HCI Event: Command Complete (0x0e) plen 4                 #44 [hci1] 3.993527
      LE Set Extended Scan Response Data (0x08|0x0038) ncmd 1
        Status: Success (0x00)
< HCI Command: LE Set Extended Adve.. (0x08|0x0039) plen 6  #45 [hci1] 4.013029
        Extended advertising: Enabled (0x01)
        Number of sets: 1 (0x01)
        Entry 0
          Handle: 0x00
          Duration: 0 ms (0x00)
          Max ext adv events: 0
> HCI Event: Command Complete (0x0e) plen 4                 #46 [hci1] 4.013675
      LE Set Extended Advertising Enable (0x08|0x0039) ncmd 1
        Status: Success (0x00)
> HCI Event: LE Meta Event (0x3e) plen 31                   #47 [hci1] 4.231374
      LE Enhanced Connection Complete (0x0a)
        Status: Success (0x00)
        Handle: 489
        Role: Peripheral (0x01)
        Peer address type: Public (0x00)
        Peer address: DF:A9:FF:F6:B1:1A (OUI DF-A9-FF)
        Local resolvable private address: 00:00:00:00:00:00 (Non-Resolvable)
        Peer resolvable private address: 00:00:00:00:00:00 (Non-Resolvable)
        Connection interval: 87.50 msec (0x0046)
        Connection latency: 0 (0x0000)
        Supervision timeout: 20000 msec (0x07d0)
        Central clock accuracy: 0x01
> HCI Event: LE Meta Event (0x3e) plen 6                    #48 [hci1] 4.231382
      LE Advertising Set Terminated (0x12)
        Status: Success (0x00)
        Handle: 0
        Connection handle: 489
        Number of completed extended advertising events: 0
< HCI Command: LE Read Remote Used... (0x08|0x0016) plen 2  #49 [hci1] 4.233963
        Handle: 489 Address: DF:A9:FF:F6:B1:1A (OUI DF-A9-FF)
> HCI Event: Command Status (0x0f) plen 4                   #50 [hci1] 4.234502
      LE Read Remote Used Features (0x08|0x0016) ncmd 1
        Status: Success (0x00)
> HCI Event: LE Meta Event (0x3e) plen 12                   #51 [hci1] 4.495243
      LE Read Remote Used Features (0x04)
        Status: Success (0x00)
        Handle: 489 Address: DF:A9:FF:F6:B1:1A (OUI DF-A9-FF)
        Features: 0x2d 0x49 0x00 0xf7 0x67 0xd8 0x00 0x00
          LE Encryption
          Extended Reject Indication
          Peripheral-initiated Features Exchange
          LE Data Packet Length Extension
          LE 2M PHY
          LE Coded PHY
          Channel Selection Algorithm #2
          Periodic Advertising Sync Transfer - Sender
          Periodic Advertising Sync Transfer - Recipient
          Sleep Clock Accuracy Updates
          Connected Isochronous Stream - Central
          Connected Isochronous Stream - Peripheral
          Isochronous Broadcaster
          Synchronized Receiver
          Connected Isochronous Stream (Host Support)
          LE Power Control Request
          LE Power Control Request
          Connection Subrating
          Connection Subrating (Host Support)
          Unknown features (0x0000d80000000000)
> ACL Data RX: Handle 489 flags 0x02 dlen 11                #52 [hci1] 4.932559
      SMP: Pairing Request (0x01) len 6
        IO capability: KeyboardOnly (0x02)
        OOB data: Authentication data not present (0x00)
        Authentication requirement: No bonding, MITM, SC, No Keypresses (0xcc)
        Max encryption key size: 16
        Initiator key distribution: <none> (0x00)
        Responder key distribution: <none> (0x00)
< HCI Command: Host Number of Compl.. (0x03|0x0035) plen 5  #53 [hci1] 4.933488
        Num handles: 1
        Handle: 489 Address: DF:A9:FF:F6:B1:1A (OUI DF-A9-FF)
        Count: 1
< ACL Data TX: Handle 489 flags 0x00 dlen 11                #54 [hci1] 4.933705
      SMP: Pairing Response (0x02) len 6
        IO capability: DisplayOnly (0x00)
        OOB data: Authentication data not present (0x00)
        Authentication requirement: Bonding, No MITM, SC, No Keypresses (0x09)
        Max encryption key size: 16
        Initiator key distribution: <none> (0x00)
        Responder key distribution: <none> (0x00)
> HCI Event: Number of Completed Packets (0x13) plen 5      #55 [hci1] 5.107586
        Num handles: 1
        Handle: 489 Address: DF:A9:FF:F6:B1:1A (OUI DF-A9-FF)
        Count: 1
        #54: len 11 (0 Kb/s)
        Latency: 173 msec (173-173 msec ~173 msec)
> ACL Data RX: Handle 489 flags 0x02 dlen 27                #56 [hci1] 5.107818
> ACL Data RX: Handle 489 flags 0x01 dlen 27                #57 [hci1] 5.108330
> ACL Data RX: Handle 489 flags 0x01 dlen 15                #58 [hci1] 5.108777
      SMP: Pairing Public Key (0x0c) len 64
        X: 2e79c2d3bc83fe89ee3381ac946839142e994b4f5044b8702100b9474268ef82
        Y: 6e5ea8bca432c0c7f90f376fc219bae7c50546258133eecbbae3aec34dad494d
< HCI Command: Host Number of Compl.. (0x03|0x0035) plen 5  #59 [hci1] 5.113381
        Num handles: 1
        Handle: 489 Address: DF:A9:FF:F6:B1:1A (OUI DF-A9-FF)
        Count: 1
< HCI Command: Host Number of Compl.. (0x03|0x0035) plen 5  #60 [hci1] 5.113392
        Num handles: 1
        Handle: 489 Address: DF:A9:FF:F6:B1:1A (OUI DF-A9-FF)
        Count: 1
< HCI Command: Host Number of Compl.. (0x03|0x0035) plen 5  #61 [hci1] 5.113593
        Num handles: 1
        Handle: 489 Address: DF:A9:FF:F6:B1:1A (OUI DF-A9-FF)
        Count: 1
< ACL Data TX: Handle 489 flags 0x00 dlen 27                #62 [hci1] 5.113649
< ACL Data TX: Handle 489 flags 0x01 dlen 27                #63 [hci1] 5.113674
< ACL Data TX: Handle 489 flags 0x01 dlen 15                #64 [hci1] 5.113676
      SMP: Pairing Public Key (0x0c) len 64
        X: 98308440221e2d910f0e54b71e7ec652857aa9b5a0dc65028824cc19db1226e9
        Y: 67a4816bcb62efb21701e31fdb27561a6217575fb007a8bbdabe7e28b6f68482
> HCI Event: Number of Completed Packets (0x13) plen 5      #65 [hci1] 5.195404
        Num handles: 1
        Handle: 489 Address: DF:A9:FF:F6:B1:1A (OUI DF-A9-FF)
        Count: 1
        #62: len 27 (2 Kb/s)
        Latency: 81 msec (81-173 msec ~127 msec)
> HCI Event: Number of Completed Packets (0x13) plen 5      #66 [hci1] 5.196114
        Num handles: 1
        Handle: 489 Address: DF:A9:FF:F6:B1:1A (OUI DF-A9-FF)
        Count: 1
        #63: len 27 (2 Kb/s)
        Latency: 82 msec (81-173 msec ~105 msec)
> HCI Event: Number of Completed Packets (0x13) plen 5      #67 [hci1] 5.282367
        Num handles: 1
        Handle: 489 Address: DF:A9:FF:F6:B1:1A (OUI DF-A9-FF)
        Count: 1
        #64: len 15 (0 Kb/s)
        Latency: 168 msec (81-173 msec ~136 msec)
> ACL Data RX: Handle 489 flags 0x02 dlen 21                #68 [hci1] 6.070134
      SMP: Pairing Confirm (0x03) len 16
        Confim value: af9bbcd134bc97860d5fc1a8b0591636
< HCI Command: Host Number of Compl.. (0x03|0x0035) plen 5  #69 [hci1] 6.073658
        Num handles: 1
        Handle: 489 Address: DF:A9:FF:F6:B1:1A (OUI DF-A9-FF)
        Count: 1
< ACL Data TX: Handle 489 flags 0x00 dlen 21                #70 [hci1] 6.073875
      SMP: Pairing Confirm (0x03) len 16
        Confim value: 2152d7f029579e2d8148a9187c479cac
> HCI Event: Number of Completed Packets (0x13) plen 5      #71 [hci1] 6.244892
        Num handles: 1
        Handle: 489 Address: DF:A9:FF:F6:B1:1A (OUI DF-A9-FF)
        Count: 1
        #70: len 21 (0 Kb/s)
        Latency: 171 msec (81-173 msec ~153 msec)
> ACL Data RX: Handle 489 flags 0x02 dlen 21                #72 [hci1] 6.245219
      SMP: Pairing Random (0x04) len 16
        Random value: 69b7ddef6fcb01cdb37ed044b74a5d74
< HCI Command: Host Number of Compl.. (0x03|0x0035) plen 5  #73 [hci1] 6.253686
        Num handles: 1
        Handle: 489 Address: DF:A9:FF:F6:B1:1A (OUI DF-A9-FF)
        Count: 1
< ACL Data TX: Handle 489 flags 0x00 dlen 21                #74 [hci1] 6.253763
      SMP: Pairing Random (0x04) len 16
        Random value: 8e6108f966a694cbe26df70bb96773e6
> HCI Event: Number of Completed Packets (0x13) plen 5      #75 [hci1] 6.419868
        Num handles: 1
        Handle: 489 Address: DF:A9:FF:F6:B1:1A (OUI DF-A9-FF)
        Count: 1
        #74: len 21 (1 Kb/s)
        Latency: 166 msec (81-173 msec ~160 msec)
> ACL Data RX: Handle 489 flags 0x02 dlen 21                #76 [hci1] 6.420411
      SMP: Pairing Confirm (0x03) len 16
        Confim value: 22c535b08fd04b90ef681b7b9c6c73ce
< HCI Command: Host Number of Compl.. (0x03|0x0035) plen 5  #77 [hci1] 6.433640
        Num handles: 1
        Handle: 489 Address: DF:A9:FF:F6:B1:1A (OUI DF-A9-FF)
        Count: 1
< ACL Data TX: Handle 489 flags 0x00 dlen 21                #78 [hci1] 6.433668
      SMP: Pairing Confirm (0x03) len 16
        Confim value: d7c9a4576439d60304d38d8ff6cd9b0a
> HCI Event: Number of Completed Packets (0x13) plen 5      #79 [hci1] 6.594980
        Num handles: 1
        Handle: 489 Address: DF:A9:FF:F6:B1:1A (OUI DF-A9-FF)
        Count: 1
        #78: len 21 (1 Kb/s)
        Latency: 161 msec (81-173 msec ~160 msec)
> ACL Data RX: Handle 489 flags 0x02 dlen 21                #80 [hci1] 6.595228
      SMP: Pairing Random (0x04) len 16
        Random value: 249b14cd295276c6e3ec81c2fad6f8fd
< HCI Command: Host Number of Compl.. (0x03|0x0035) plen 5  #81 [hci1] 6.613766
        Num handles: 1
        Handle: 489 Address: DF:A9:FF:F6:B1:1A (OUI DF-A9-FF)
        Count: 1
< ACL Data TX: Handle 489 flags 0x00 dlen 21                #82 [hci1] 6.613850
      SMP: Pairing Random (0x04) len 16
        Random value: 4d02679f89a05211af56d8b3da64d21e
> HCI Event: Number of Completed Packets (0x13) plen 5      #83 [hci1] 6.769986
        Num handles: 1
        Handle: 489 Address: DF:A9:FF:F6:B1:1A (OUI DF-A9-FF)
        Count: 1
        #82: len 21 (1 Kb/s)
        Latency: 156 msec (81-173 msec ~158 msec)
> ACL Data RX: Handle 489 flags 0x02 dlen 21                #84 [hci1] 6.770241
      SMP: Pairing Confirm (0x03) len 16
        Confim value: 647e5f178e2236207c1afa735bd8e0dd
< HCI Command: Host Number of Compl.. (0x03|0x0035) plen 5  #85 [hci1] 6.773688
        Num handles: 1
        Handle: 489 Address: DF:A9:FF:F6:B1:1A (OUI DF-A9-FF)
        Count: 1
< ACL Data TX: Handle 489 flags 0x00 dlen 21                #86 [hci1] 6.773827
      SMP: Pairing Confirm (0x03) len 16
        Confim value: a444df9ef1cd46206559b2f5fe66fab5
> HCI Event: Number of Completed Packets (0x13) plen 5      #87 [hci1] 6.944954
        Num handles: 1
        Handle: 489 Address: DF:A9:FF:F6:B1:1A (OUI DF-A9-FF)
        Count: 1
        #86: len 21 (0 Kb/s)
        Latency: 171 msec (81-173 msec ~164 msec)
> ACL Data RX: Handle 489 flags 0x02 dlen 21                #88 [hci1] 6.945196
      SMP: Pairing Random (0x04) len 16
        Random value: d5c68e054c51c83a71d60e11d27692a1
< HCI Command: Host Number of Compl.. (0x03|0x0035) plen 5  #89 [hci1] 6.953781
        Num handles: 1
        Handle: 489 Address: DF:A9:FF:F6:B1:1A (OUI DF-A9-FF)
        Count: 1
< ACL Data TX: Handle 489 flags 0x00 dlen 21                #90 [hci1] 6.953937
      SMP: Pairing Random (0x04) len 16
        Random value: 5e8286bc235a02440d0c3424a2acf8fd
> HCI Event: Number of Completed Packets (0x13) plen 5      #91 [hci1] 7.119909
        Num handles: 1
        Handle: 489 Address: DF:A9:FF:F6:B1:1A (OUI DF-A9-FF)
        Count: 1
        #90: len 21 (1 Kb/s)
        Latency: 165 msec (81-173 msec ~165 msec)
> ACL Data RX: Handle 489 flags 0x02 dlen 21                #92 [hci1] 7.120182
      SMP: Pairing Confirm (0x03) len 16
        Confim value: c455b9514f2eeed9c80d0d3ea7d24149
< HCI Command: Host Number of Compl.. (0x03|0x0035) plen 5  #93 [hci1] 7.133742
        Num handles: 1
        Handle: 489 Address: DF:A9:FF:F6:B1:1A (OUI DF-A9-FF)
        Count: 1
< ACL Data TX: Handle 489 flags 0x00 dlen 21                #94 [hci1] 7.133841
      SMP: Pairing Confirm (0x03) len 16
        Confim value: 0ce0fc961baaa95c4ff7403dc72c016a
> HCI Event: Number of Completed Packets (0x13) plen 5      #95 [hci1] 7.294880
        Num handles: 1
        Handle: 489 Address: DF:A9:FF:F6:B1:1A (OUI DF-A9-FF)
        Count: 1
        #94: len 21 (1 Kb/s)
        Latency: 161 msec (81-173 msec ~163 msec)
> ACL Data RX: Handle 489 flags 0x02 dlen 21                #96 [hci1] 7.295223
      SMP: Pairing Random (0x04) len 16
        Random value: e1c4c718ab82645b9f26d413f44377f1
< HCI Command: Host Number of Compl.. (0x03|0x0035) plen 5  #97 [hci1] 7.313690
        Num handles: 1
        Handle: 489 Address: DF:A9:FF:F6:B1:1A (OUI DF-A9-FF)
        Count: 1
< ACL Data TX: Handle 489 flags 0x00 dlen 21                #98 [hci1] 7.313815
      SMP: Pairing Random (0x04) len 16
        Random value: 5c4a1bcadd27bd58e945097b00bad7ac
> HCI Event: Number of Completed Packets (0x13) plen 5      #99 [hci1] 7.469880
        Num handles: 1
        Handle: 489 Address: DF:A9:FF:F6:B1:1A (OUI DF-A9-FF)
        Count: 1
        #98: len 21 (1 Kb/s)
        Latency: 156 msec (81-173 msec ~159 msec)
> ACL Data RX: Handle 489 flags 0x02 dlen 21               #100 [hci1] 7.470231
      SMP: Pairing Confirm (0x03) len 16
        Confim value: 0ecf160d97d76ca417daa11bb6f2cb8f
< HCI Command: Host Number of Comp.. (0x03|0x0035) plen 5  #101 [hci1] 7.473641
        Num handles: 1
        Handle: 489 Address: DF:A9:FF:F6:B1:1A (OUI DF-A9-FF)
        Count: 1
< ACL Data TX: Handle 489 flags 0x00 dlen 21               #102 [hci1] 7.473764
      SMP: Pairing Confirm (0x03) len 16
        Confim value: a712a3375b1076bdcbb283a5c7bfec7d
> HCI Event: Number of Completed Packets (0x13) plen 5     #103 [hci1] 7.644991
        Num handles: 1
        Handle: 489 Address: DF:A9:FF:F6:B1:1A (OUI DF-A9-FF)
        Count: 1
        #102: len 21 (0 Kb/s)
        Latency: 171 msec (81-173 msec ~165 msec)
> ACL Data RX: Handle 489 flags 0x02 dlen 21               #104 [hci1] 7.645176
      SMP: Pairing Random (0x04) len 16
        Random value: ef5b7dc75bdcf799f30370e7559635be
< HCI Command: Host Number of Comp.. (0x03|0x0035) plen 5  #105 [hci1] 7.653311
        Num handles: 1
        Handle: 489 Address: DF:A9:FF:F6:B1:1A (OUI DF-A9-FF)
        Count: 1
< ACL Data TX: Handle 489 flags 0x00 dlen 21               #106 [hci1] 7.653320
      SMP: Pairing Random (0x04) len 16
        Random value: 32527e6e64e79f33b2e374394db8ab2d
> HCI Event: Number of Completed Packets (0x13) plen 5     #107 [hci1] 7.819958
        Num handles: 1
        Handle: 489 Address: DF:A9:FF:F6:B1:1A (OUI DF-A9-FF)
        Count: 1
        #106: len 21 (1 Kb/s)
        Latency: 166 msec (81-173 msec ~166 msec)
> ACL Data RX: Handle 489 flags 0x02 dlen 21               #108 [hci1] 7.820191
      SMP: Pairing Confirm (0x03) len 16
        Confim value: 3b126bf2a13fe37af9fa2c81ee8f3778
< HCI Command: Host Number of Comp.. (0x03|0x0035) plen 5  #109 [hci1] 7.833638
        Num handles: 1
        Handle: 489 Address: DF:A9:FF:F6:B1:1A (OUI DF-A9-FF)
        Count: 1
< ACL Data TX: Handle 489 flags 0x00 dlen 21               #110 [hci1] 7.833753
      SMP: Pairing Confirm (0x03) len 16
        Confim value: 9b7e924d9f3fc5199d1d62b44d846365
> HCI Event: Number of Completed Packets (0x13) plen 5     #111 [hci1] 7.994834
        Num handles: 1
        Handle: 489 Address: DF:A9:FF:F6:B1:1A (OUI DF-A9-FF)
        Count: 1
        #110: len 21 (1 Kb/s)
        Latency: 161 msec (81-173 msec ~163 msec)
> ACL Data RX: Handle 489 flags 0x02 dlen 21               #112 [hci1] 7.995196
      SMP: Pairing Random (0x04) len 16
        Random value: e196ac13b19a6fa633d7bff12907991a
< HCI Command: Host Number of Comp.. (0x03|0x0035) plen 5  #113 [hci1] 8.013727
        Num handles: 1
        Handle: 489 Address: DF:A9:FF:F6:B1:1A (OUI DF-A9-FF)
        Count: 1
< ACL Data TX: Handle 489 flags 0x00 dlen 21               #114 [hci1] 8.013932
      SMP: Pairing Random (0x04) len 16
        Random value: dddbdfe2838e9a8cc6964353c850fef7
> HCI Event: Number of Completed Packets (0x13) plen 5     #115 [hci1] 8.169860
        Num handles: 1
        Handle: 489 Address: DF:A9:FF:F6:B1:1A (OUI DF-A9-FF)
        Count: 1
        #114: len 21 (1 Kb/s)
        Latency: 155 msec (81-173 msec ~159 msec)
> ACL Data RX: Handle 489 flags 0x02 dlen 21               #116 [hci1] 8.170283
      SMP: Pairing Confirm (0x03) len 16
        Confim value: 82db35a4a570cadbeb44f17ad8edab14
< HCI Command: Host Number of Comp.. (0x03|0x0035) plen 5  #117 [hci1] 8.173796
        Num handles: 1
        Handle: 489 Address: DF:A9:FF:F6:B1:1A (OUI DF-A9-FF)
        Count: 1
< ACL Data TX: Handle 489 flags 0x00 dlen 21               #118 [hci1] 8.173879
      SMP: Pairing Confirm (0x03) len 16
        Confim value: 70a1c884f472a03c09f229bc75e281db
> HCI Event: Number of Completed Packets (0x13) plen 5     #119 [hci1] 8.344907
        Num handles: 1
        Handle: 489 Address: DF:A9:FF:F6:B1:1A (OUI DF-A9-FF)
        Count: 1
        #118: len 21 (0 Kb/s)
        Latency: 171 msec (81-173 msec ~165 msec)
> ACL Data RX: Handle 489 flags 0x02 dlen 21               #120 [hci1] 8.345129
      SMP: Pairing Random (0x04) len 16
        Random value: dfbe923c4334f872624cdecfe770b054
< HCI Command: Host Number of Comp.. (0x03|0x0035) plen 5  #121 [hci1] 8.353843
        Num handles: 1
        Handle: 489 Address: DF:A9:FF:F6:B1:1A (OUI DF-A9-FF)
        Count: 1
< ACL Data TX: Handle 489 flags 0x00 dlen 21               #122 [hci1] 8.353928
      SMP: Pairing Random (0x04) len 16
        Random value: eb9f1915536596b6fc3db1c86b2b1970
> HCI Event: Number of Completed Packets (0x13) plen 5     #123 [hci1] 8.519975
        Num handles: 1
        Handle: 489 Address: DF:A9:FF:F6:B1:1A (OUI DF-A9-FF)
        Count: 1
        #122: len 21 (1 Kb/s)
        Latency: 166 msec (81-173 msec ~165 msec)
> ACL Data RX: Handle 489 flags 0x02 dlen 21               #124 [hci1] 8.520135
      SMP: Pairing Confirm (0x03) len 16
        Confim value: 167c4f0d699ef35b92c9c334e594957c
< HCI Command: Host Number of Comp.. (0x03|0x0035) plen 5  #125 [hci1] 8.533434
        Num handles: 1
        Handle: 489 Address: DF:A9:FF:F6:B1:1A (OUI DF-A9-FF)
        Count: 1
< ACL Data TX: Handle 489 flags 0x00 dlen 21               #126 [hci1] 8.533557
      SMP: Pairing Confirm (0x03) len 16
        Confim value: 413c2f25af34728a3743bf83dfbd6988
> HCI Event: Number of Completed Packets (0x13) plen 5     #127 [hci1] 8.694901
        Num handles: 1
        Handle: 489 Address: DF:A9:FF:F6:B1:1A (OUI DF-A9-FF)
        Count: 1
        #126: len 21 (1 Kb/s)
        Latency: 161 msec (81-173 msec ~163 msec)
> ACL Data RX: Handle 489 flags 0x02 dlen 21               #128 [hci1] 8.695292
      SMP: Pairing Random (0x04) len 16
        Random value: 4c5bacc4e664ff2fc7492a6443e9c7ff
< HCI Command: Host Number of Comp.. (0x03|0x0035) plen 5  #129 [hci1] 8.713531
        Num handles: 1
        Handle: 489 Address: DF:A9:FF:F6:B1:1A (OUI DF-A9-FF)
        Count: 1
< ACL Data TX: Handle 489 flags 0x00 dlen 21               #130 [hci1] 8.713624
      SMP: Pairing Random (0x04) len 16
        Random value: 5c794dc9ad9f2c3f295ebd5ad5e1c3cf
> HCI Event: Number of Completed Packets (0x13) plen 5     #131 [hci1] 8.869838
        Num handles: 1
        Handle: 489 Address: DF:A9:FF:F6:B1:1A (OUI DF-A9-FF)
        Count: 1
        #130: len 21 (1 Kb/s)
        Latency: 156 msec (81-173 msec ~159 msec)
> ACL Data RX: Handle 489 flags 0x02 dlen 21               #132 [hci1] 8.870202
      SMP: Pairing Confirm (0x03) len 16
        Confim value: b5016f3b4dda10ae684f6193b99020bf
< HCI Command: Host Number of Comp.. (0x03|0x0035) plen 5  #133 [hci1] 8.873595
        Num handles: 1
        Handle: 489 Address: DF:A9:FF:F6:B1:1A (OUI DF-A9-FF)
        Count: 1
< ACL Data TX: Handle 489 flags 0x00 dlen 21               #134 [hci1] 8.873776
      SMP: Pairing Confirm (0x03) len 16
        Confim value: 796c7b5420122f24d459ea75aa15aad8
> HCI Event: Number of Completed Packets (0x13) plen 5     #135 [hci1] 9.044931
        Num handles: 1
        Handle: 489 Address: DF:A9:FF:F6:B1:1A (OUI DF-A9-FF)
        Count: 1
        #134: len 21 (0 Kb/s)
        Latency: 171 msec (81-173 msec ~165 msec)
> ACL Data RX: Handle 489 flags 0x02 dlen 21               #136 [hci1] 9.045118
      SMP: Pairing Random (0x04) len 16
        Random value: ce36b66cad21324ee6f840d031cd6aea
< HCI Command: Host Number of Comp.. (0x03|0x0035) plen 5  #137 [hci1] 9.053302
        Num handles: 1
        Handle: 489 Address: DF:A9:FF:F6:B1:1A (OUI DF-A9-FF)
        Count: 1
< ACL Data TX: Handle 489 flags 0x00 dlen 21               #138 [hci1] 9.053334
      SMP: Pairing Random (0x04) len 16
        Random value: 5c2fff312cdf99c9491988e877355a9a
> HCI Event: Number of Completed Packets (0x13) plen 5     #139 [hci1] 9.219823
        Num handles: 1
        Handle: 489 Address: DF:A9:FF:F6:B1:1A (OUI DF-A9-FF)
        Count: 1
        #138: len 21 (1 Kb/s)
        Latency: 166 msec (81-173 msec ~166 msec)
> ACL Data RX: Handle 489 flags 0x02 dlen 21               #140 [hci1] 9.220158
      SMP: Pairing Confirm (0x03) len 16
        Confim value: 47e5d11eb69139e90051c484b20ea3e8
< HCI Command: Host Number of Comp.. (0x03|0x0035) plen 5  #141 [hci1] 9.233797
        Num handles: 1
        Handle: 489 Address: DF:A9:FF:F6:B1:1A (OUI DF-A9-FF)
        Count: 1
< ACL Data TX: Handle 489 flags 0x00 dlen 21               #142 [hci1] 9.233899
      SMP: Pairing Confirm (0x03) len 16
        Confim value: ab870546bdda4d22f9891036ed75c66f
< ACL Data TX: Handle 489 flags 0x00 dlen 16               #143 [hci1] 9.243309
      LE L2CAP: Connection Parameter Update Request (0x12) ident 1 len 8
        Min interval: 24
        Max interval: 40
        Peripheral latency: 0
        Timeout multiplier: 42
> HCI Event: Number of Completed Packets (0x13) plen 5     #144 [hci1] 9.307774
        Num handles: 1
        Handle: 489 Address: DF:A9:FF:F6:B1:1A (OUI DF-A9-FF)
        Count: 1
        #142: len 21 (2 Kb/s)
        Latency: 73 msec (73-173 msec ~119 msec)
> HCI Event: Number of Completed Packets (0x13) plen 5     #145 [hci1] 9.394897
        Num handles: 1
        Handle: 489 Address: DF:A9:FF:F6:B1:1A (OUI DF-A9-FF)
        Count: 1
        #143: len 16 (0 Kb/s)
        Latency: 151 msec (73-173 msec ~135 msec)
> ACL Data RX: Handle 489 flags 0x02 dlen 21               #146 [hci1] 9.395090
      SMP: Pairing Random (0x04) len 16
        Random value: 4a59ad35efa67d7f84c2fd74e7b36728
< HCI Command: Host Number of Comp.. (0x03|0x0035) plen 5  #147 [hci1] 9.413308
        Num handles: 1
        Handle: 489 Address: DF:A9:FF:F6:B1:1A (OUI DF-A9-FF)
        Count: 1
< ACL Data TX: Handle 489 flags 0x00 dlen 21               #148 [hci1] 9.413334
      SMP: Pairing Random (0x04) len 16
        Random value: c629a3a987d808e808655d558dfc1155
> ACL Data RX: Handle 489 flags 0x02 dlen 10               #149 [hci1] 9.482447
      LE L2CAP: Connection Parameter Update Response (0x13) ident 1 len 2
        Result: Connection Parameters accepted (0x0000)
< HCI Command: Host Number of Comp.. (0x03|0x0035) plen 5  #150 [hci1] 9.493500
        Num handles: 1
        Handle: 489 Address: DF:A9:FF:F6:B1:1A (OUI DF-A9-FF)
        Count: 1
> HCI Event: Number of Completed Packets (0x13) plen 5     #151 [hci1] 9.569875
        Num handles: 1
        Handle: 489 Address: DF:A9:FF:F6:B1:1A (OUI DF-A9-FF)
        Count: 1
        #148: len 21 (1 Kb/s)
        Latency: 156 msec (73-173 msec ~146 msec)
> ACL Data RX: Handle 489 flags 0x02 dlen 21               #152 [hci1] 9.570243
      SMP: Pairing Confirm (0x03) len 16
        Confim value: 1bf1fe49f910aa60dceda71217c52929
< HCI Command: Host Number of Comp.. (0x03|0x0035) plen 5  #153 [hci1] 9.573632
        Num handles: 1
        Handle: 489 Address: DF:A9:FF:F6:B1:1A (OUI DF-A9-FF)
        Count: 1
< ACL Data TX: Handle 489 flags 0x00 dlen 21               #154 [hci1] 9.573785
      SMP: Pairing Confirm (0x03) len 16
        Confim value: ffbd5fad2590f770c2035922f09d123e
> HCI Event: Number of Completed Packets (0x13) plen 5     #155 [hci1] 9.744859
        Num handles: 1
        Handle: 489 Address: DF:A9:FF:F6:B1:1A (OUI DF-A9-FF)
        Count: 1
        #154: len 21 (0 Kb/s)
        Latency: 171 msec (73-173 msec ~158 msec)
> ACL Data RX: Handle 489 flags 0x02 dlen 21               #156 [hci1] 9.745120
      SMP: Pairing Random (0x04) len 16
        Random value: e40dcf60416b0db3a6507ef2da74cb09
< HCI Command: Host Number of Comp.. (0x03|0x0035) plen 5  #157 [hci1] 9.753902
        Num handles: 1
        Handle: 489 Address: DF:A9:FF:F6:B1:1A (OUI DF-A9-FF)
        Count: 1
< ACL Data TX: Handle 489 flags 0x00 dlen 21               #158 [hci1] 9.754028
      SMP: Pairing Random (0x04) len 16
        Random value: 92f20f6ad8f13724432c7fd6001c45ff
> HCI Event: Number of Completed Packets (0x13) plen 5     #159 [hci1] 9.919772
        Num handles: 1
        Handle: 489 Address: DF:A9:FF:F6:B1:1A (OUI DF-A9-FF)
        Count: 1
        #158: len 21 (1 Kb/s)
        Latency: 165 msec (73-173 msec ~162 msec)
> ACL Data RX: Handle 489 flags 0x02 dlen 21               #160 [hci1] 9.920022
      SMP: Pairing Confirm (0x03) len 16
        Confim value: 5c8de9ac8e75dedf4425f2ea63701c54
< HCI Command: Host Number of Comp.. (0x03|0x0035) plen 5  #161 [hci1] 9.933256
        Num handles: 1
        Handle: 489 Address: DF:A9:FF:F6:B1:1A (OUI DF-A9-FF)
        Count: 1
< ACL Data TX: Handle 489 flags 0x00 dlen 21               #162 [hci1] 9.933287
      SMP: Pairing Confirm (0x03) len 16
        Confim value: 19a7a50acbd03041e893ff4a406da4ac
> HCI Event: Number of Completed Packets (0x13) plen 5    #163 [hci1] 10.094756
        Num handles: 1
        Handle: 489 Address: DF:A9:FF:F6:B1:1A (OUI DF-A9-FF)
        Count: 1
        #162: len 21 (1 Kb/s)
        Latency: 161 msec (73-173 msec ~161 msec)
> ACL Data RX: Handle 489 flags 0x02 dlen 21              #164 [hci1] 10.095109
      SMP: Pairing Random (0x04) len 16
        Random value: 01da986e77294f1d918b202abf2be31e
< HCI Command: Host Number of Com.. (0x03|0x0035) plen 5  #165 [hci1] 10.113567
        Num handles: 1
        Handle: 489 Address: DF:A9:FF:F6:B1:1A (OUI DF-A9-FF)
        Count: 1
< ACL Data TX: Handle 489 flags 0x00 dlen 21              #166 [hci1] 10.113619
      SMP: Pairing Random (0x04) len 16
        Random value: 23ac32ebbb5e14c8a6b9622f296d277f
> HCI Event: Number of Completed Packets (0x13) plen 5    #167 [hci1] 10.269814
        Num handles: 1
        Handle: 489 Address: DF:A9:FF:F6:B1:1A (OUI DF-A9-FF)
        Count: 1
        #166: len 21 (1 Kb/s)
        Latency: 156 msec (73-173 msec ~159 msec)
> ACL Data RX: Handle 489 flags 0x02 dlen 21              #168 [hci1] 10.270123
      SMP: Pairing Confirm (0x03) len 16
        Confim value: 03f147a1c9905b895c9c398522890d70
< HCI Command: Host Number of Com.. (0x03|0x0035) plen 5  #169 [hci1] 10.273755
        Num handles: 1
        Handle: 489 Address: DF:A9:FF:F6:B1:1A (OUI DF-A9-FF)
        Count: 1
< ACL Data TX: Handle 489 flags 0x00 dlen 21              #170 [hci1] 10.273871
      SMP: Pairing Confirm (0x03) len 16
        Confim value: d7b7e2f62966cf1751fcf0b791cea8fb
> HCI Event: Number of Completed Packets (0x13) plen 5    #171 [hci1] 10.444799
        Num handles: 1
        Handle: 489 Address: DF:A9:FF:F6:B1:1A (OUI DF-A9-FF)
        Count: 1
        #170: len 21 (0 Kb/s)
        Latency: 170 msec (73-173 msec ~164 msec)
> ACL Data RX: Handle 489 flags 0x02 dlen 21              #172 [hci1] 10.445068
      SMP: Pairing Random (0x04) len 16
        Random value: 4889c61fa6d9f12ccb9c813d8b2f3b38
< HCI Command: Host Number of Com.. (0x03|0x0035) plen 5  #173 [hci1] 10.453842
        Num handles: 1
        Handle: 489 Address: DF:A9:FF:F6:B1:1A (OUI DF-A9-FF)
        Count: 1
< ACL Data TX: Handle 489 flags 0x00 dlen 21              #174 [hci1] 10.453928
      SMP: Pairing Random (0x04) len 16
        Random value: 297efe85e67448a15f56bd27e3a3cf1d
> HCI Event: Number of Completed Packets (0x13) plen 5    #175 [hci1] 10.619865
        Num handles: 1
        Handle: 489 Address: DF:A9:FF:F6:B1:1A (OUI DF-A9-FF)
        Count: 1
        #174: len 21 (1 Kb/s)
        Latency: 165 msec (73-173 msec ~165 msec)
> ACL Data RX: Handle 489 flags 0x02 dlen 21              #176 [hci1] 10.620122
      SMP: Pairing Confirm (0x03) len 16
        Confim value: b2c5214e627a13d6f1949b96df7a74fd
< HCI Command: Host Number of Com.. (0x03|0x0035) plen 5  #177 [hci1] 10.633318
        Num handles: 1
        Handle: 489 Address: DF:A9:FF:F6:B1:1A (OUI DF-A9-FF)
        Count: 1
< ACL Data TX: Handle 489 flags 0x00 dlen 21              #178 [hci1] 10.633331
      SMP: Pairing Confirm (0x03) len 16
        Confim value: dce1fdba2e7091d331a3fa6176bce037
> HCI Event: Number of Completed Packets (0x13) plen 5    #179 [hci1] 10.794770
        Num handles: 1
        Handle: 489 Address: DF:A9:FF:F6:B1:1A (OUI DF-A9-FF)
        Count: 1
        #178: len 21 (1 Kb/s)
        Latency: 161 msec (73-173 msec ~163 msec)
> ACL Data RX: Handle 489 flags 0x02 dlen 21              #180 [hci1] 10.795123
      SMP: Pairing Random (0x04) len 16
        Random value: 9c24567524b5df9117ec7c8d731aa168
< HCI Command: Host Number of Com.. (0x03|0x0035) plen 5  #181 [hci1] 10.813476
        Num handles: 1
        Handle: 489 Address: DF:A9:FF:F6:B1:1A (OUI DF-A9-FF)
        Count: 1
< ACL Data TX: Handle 489 flags 0x00 dlen 21              #182 [hci1] 10.813562
      SMP: Pairing Random (0x04) len 16
        Random value: 25a9493fd3ce4faf02be7293595bb7c6
> HCI Event: Number of Completed Packets (0x13) plen 5    #183 [hci1] 10.969731
        Num handles: 1
        Handle: 489 Address: DF:A9:FF:F6:B1:1A (OUI DF-A9-FF)
        Count: 1
        #182: len 21 (1 Kb/s)
        Latency: 156 msec (73-173 msec ~159 msec)
> ACL Data RX: Handle 489 flags 0x02 dlen 21              #184 [hci1] 10.970119
      SMP: Pairing Confirm (0x03) len 16
        Confim value: fdc99fdbd0de3dddbda93cdf775718fb
< HCI Command: Host Number of Com.. (0x03|0x0035) plen 5  #185 [hci1] 10.973804
        Num handles: 1
        Handle: 489 Address: DF:A9:FF:F6:B1:1A (OUI DF-A9-FF)
        Count: 1
< ACL Data TX: Handle 489 flags 0x00 dlen 21              #186 [hci1] 10.973885
      SMP: Pairing Confirm (0x03) len 16
        Confim value: 8812a1f1b119b720c1f84863d58409ba
> HCI Event: Number of Completed Packets (0x13) plen 5    #187 [hci1] 11.144727
        Num handles: 1
        Handle: 489 Address: DF:A9:FF:F6:B1:1A (OUI DF-A9-FF)
        Count: 1
        #186: len 21 (0 Kb/s)
        Latency: 170 msec (73-173 msec ~165 msec)
> ACL Data RX: Handle 489 flags 0x02 dlen 21              #188 [hci1] 11.145137
      SMP: Pairing Random (0x04) len 16
        Random value: 23f384b18535463e7c242fbaecc422ff
< HCI Command: Host Number of Com.. (0x03|0x0035) plen 5  #189 [hci1] 11.153516
        Num handles: 1
        Handle: 489 Address: DF:A9:FF:F6:B1:1A (OUI DF-A9-FF)
        Count: 1
< ACL Data TX: Handle 489 flags 0x00 dlen 21              #190 [hci1] 11.153640
      SMP: Pairing Random (0x04) len 16
        Random value: 58f6b41f855a6f6c3560debd84e2affc
> HCI Event: Number of Completed Packets (0x13) plen 5    #191 [hci1] 11.319756
        Num handles: 1
        Handle: 489 Address: DF:A9:FF:F6:B1:1A (OUI DF-A9-FF)
        Count: 1
        #190: len 21 (1 Kb/s)
        Latency: 166 msec (73-173 msec ~165 msec)
> ACL Data RX: Handle 489 flags 0x02 dlen 21              #192 [hci1] 11.320058
      SMP: Pairing Confirm (0x03) len 16
        Confim value: 7f686e584312cd601e5ed095082562f2
< HCI Command: Host Number of Com.. (0x03|0x0035) plen 5  #193 [hci1] 11.333865
        Num handles: 1
        Handle: 489 Address: DF:A9:FF:F6:B1:1A (OUI DF-A9-FF)
        Count: 1
< ACL Data TX: Handle 489 flags 0x00 dlen 21              #194 [hci1] 11.333990
      SMP: Pairing Confirm (0x03) len 16
        Confim value: 1ffa4666f0279b1fbdd23835616913cc
> HCI Event: Number of Completed Packets (0x13) plen 5    #195 [hci1] 11.494887
        Num handles: 1
        Handle: 489 Address: DF:A9:FF:F6:B1:1A (OUI DF-A9-FF)
        Count: 1
        #194: len 21 (1 Kb/s)
        Latency: 160 msec (73-173 msec ~163 msec)
> ACL Data RX: Handle 489 flags 0x02 dlen 21              #196 [hci1] 11.495139
      SMP: Pairing Random (0x04) len 16
        Random value: 417fce549e1294643e2cf7a5ab470b8e
< HCI Command: Host Number of Com.. (0x03|0x0035) plen 5  #197 [hci1] 11.513885
        Num handles: 1
        Handle: 489 Address: DF:A9:FF:F6:B1:1A (OUI DF-A9-FF)
        Count: 1
< ACL Data TX: Handle 489 flags 0x00 dlen 21              #198 [hci1] 11.514018
      SMP: Pairing Random (0x04) len 16
        Random value: b67e7216d5bf664139eda2b542549666
> HCI Event: Number of Completed Packets (0x13) plen 5    #199 [hci1] 11.669691
        Num handles: 1
        Handle: 489 Address: DF:A9:FF:F6:B1:1A (OUI DF-A9-FF)
        Count: 1
        #198: len 21 (1 Kb/s)
        Latency: 155 msec (73-173 msec ~159 msec)
> ACL Data RX: Handle 489 flags 0x02 dlen 21              #200 [hci1] 11.670083
      SMP: Pairing Confirm (0x03) len 16
        Confim value: 787bb8edfcc10baf1134b8af5beb9bbf
< HCI Command: Host Number of Com.. (0x03|0x0035) plen 5  #201 [hci1] 11.673253
        Num handles: 1
        Handle: 489 Address: DF:A9:FF:F6:B1:1A (OUI DF-A9-FF)
        Count: 1
< ACL Data TX: Handle 489 flags 0x00 dlen 21              #202 [hci1] 11.673334
      SMP: Pairing Confirm (0x03) len 16
        Confim value: c08fb9048a499ca733cd41e163ae2d3e
> HCI Event: Number of Completed Packets (0x13) plen 5    #203 [hci1] 11.844707
        Num handles: 1
        Handle: 489 Address: DF:A9:FF:F6:B1:1A (OUI DF-A9-FF)
        Count: 1
        #202: len 21 (0 Kb/s)
        Latency: 171 msec (73-173 msec ~165 msec)
> ACL Data RX: Handle 489 flags 0x02 dlen 21              #204 [hci1] 11.845010
      SMP: Pairing Random (0x04) len 16
        Random value: 9c93f01f85457473e22f7170a4fce8e6
< HCI Command: Host Number of Com.. (0x03|0x0035) plen 5  #205 [hci1] 11.852984
        Num handles: 1
        Handle: 489 Address: DF:A9:FF:F6:B1:1A (OUI DF-A9-FF)
        Count: 1
< ACL Data TX: Handle 489 flags 0x00 dlen 21              #206 [hci1] 11.853024
      SMP: Pairing Random (0x04) len 16
        Random value: ed17f76500c95219dd01e09d1e63f87b
> HCI Event: Number of Completed Packets (0x13) plen 5    #207 [hci1] 12.019676
        Num handles: 1
        Handle: 489 Address: DF:A9:FF:F6:B1:1A (OUI DF-A9-FF)
        Count: 1
        #206: len 21 (1 Kb/s)
        Latency: 166 msec (73-173 msec ~166 msec)
> ACL Data RX: Handle 489 flags 0x02 dlen 21              #208 [hci1] 12.020036
      SMP: Pairing Confirm (0x03) len 16
        Confim value: cd3381491649937d7dba36efef25dd54
< HCI Command: Host Number of Com.. (0x03|0x0035) plen 5  #209 [hci1] 12.033248
        Num handles: 1
        Handle: 489 Address: DF:A9:FF:F6:B1:1A (OUI DF-A9-FF)
        Count: 1
< ACL Data TX: Handle 489 flags 0x00 dlen 21              #210 [hci1] 12.033273
      SMP: Pairing Confirm (0x03) len 16
        Confim value: 6b1e440d5204206e2f5e8a7a303b6c2d
> HCI Event: Number of Completed Packets (0x13) plen 5    #211 [hci1] 12.194733
        Num handles: 1
        Handle: 489 Address: DF:A9:FF:F6:B1:1A (OUI DF-A9-FF)
        Count: 1
        #210: len 21 (1 Kb/s)
        Latency: 161 msec (73-173 msec ~163 msec)
> ACL Data RX: Handle 489 flags 0x02 dlen 21              #212 [hci1] 12.195078
      SMP: Pairing Random (0x04) len 16
        Random value: 1935e7138e07d51d2d957a7b0e7c8719
< HCI Command: Host Number of Com.. (0x03|0x0035) plen 5  #213 [hci1] 12.213798
        Num handles: 1
        Handle: 489 Address: DF:A9:FF:F6:B1:1A (OUI DF-A9-FF)
        Count: 1
< ACL Data TX: Handle 489 flags 0x00 dlen 21              #214 [hci1] 12.213909
      SMP: Pairing Random (0x04) len 16
        Random value: 81d35d47e1f6006d79c974bd9d9e1ee3
> HCI Event: Number of Completed Packets (0x13) plen 5    #215 [hci1] 12.369767
        Num handles: 1
        Handle: 489 Address: DF:A9:FF:F6:B1:1A (OUI DF-A9-FF)
        Count: 1
        #214: len 21 (1 Kb/s)
        Latency: 155 msec (73-173 msec ~159 msec)
> ACL Data RX: Handle 489 flags 0x02 dlen 21              #216 [hci1] 12.370012
      SMP: Pairing Confirm (0x03) len 16
        Confim value: f8203bd932c1ae7b57341042377adc9e
< HCI Command: Host Number of Com.. (0x03|0x0035) plen 5  #217 [hci1] 12.373857
        Num handles: 1
        Handle: 489 Address: DF:A9:FF:F6:B1:1A (OUI DF-A9-FF)
        Count: 1
< ACL Data TX: Handle 489 flags 0x00 dlen 21              #218 [hci1] 12.374628
      SMP: Pairing Confirm (0x03) len 16
        Confim value: bb307c7b6454f9ce7cdd2a5b485b8ff2
> HCI Event: Number of Completed Packets (0x13) plen 5    #219 [hci1] 12.544872
        Num handles: 1
        Handle: 489 Address: DF:A9:FF:F6:B1:1A (OUI DF-A9-FF)
        Count: 1
        #218: len 21 (0 Kb/s)
        Latency: 170 msec (73-173 msec ~165 msec)
> ACL Data RX: Handle 489 flags 0x02 dlen 21              #220 [hci1] 12.545025
      SMP: Pairing Random (0x04) len 16
        Random value: dcb0f1704fd2e352240630685c9ff576
< HCI Command: Host Number of Com.. (0x03|0x0035) plen 5  #221 [hci1] 12.553892
        Num handles: 1
        Handle: 489 Address: DF:A9:FF:F6:B1:1A (OUI DF-A9-FF)
        Count: 1
< ACL Data TX: Handle 489 flags 0x00 dlen 21              #222 [hci1] 12.553974
      SMP: Pairing Random (0x04) len 16
        Random value: e7f7e0c2476823e41736a7e381bafb7c
> HCI Event: Number of Completed Packets (0x13) plen 5    #223 [hci1] 12.719728
        Num handles: 1
        Handle: 489 Address: DF:A9:FF:F6:B1:1A (OUI DF-A9-FF)
        Count: 1
        #222: len 21 (1 Kb/s)
        Latency: 165 msec (73-173 msec ~165 msec)
> ACL Data RX: Handle 489 flags 0x02 dlen 21              #224 [hci1] 12.720088
      SMP: Pairing Confirm (0x03) len 16
        Confim value: 5f35523f220a95c40340ec7304ec76a0
< HCI Command: Host Number of Com.. (0x03|0x0035) plen 5  #225 [hci1] 12.733372
        Num handles: 1
        Handle: 489 Address: DF:A9:FF:F6:B1:1A (OUI DF-A9-FF)
        Count: 1
< ACL Data TX: Handle 489 flags 0x00 dlen 21              #226 [hci1] 12.733380
      SMP: Pairing Confirm (0x03) len 16
        Confim value: fc26d8b70d09bb5a3ff1553c8f845665
> HCI Event: Number of Completed Packets (0x13) plen 5    #227 [hci1] 12.894768
        Num handles: 1
        Handle: 489 Address: DF:A9:FF:F6:B1:1A (OUI DF-A9-FF)
        Count: 1
        #226: len 21 (1 Kb/s)
        Latency: 161 msec (73-173 msec ~163 msec)
> ACL Data RX: Handle 489 flags 0x02 dlen 21              #228 [hci1] 12.895156
      SMP: Pairing Random (0x04) len 16
        Random value: 4b8d8bb89c5d0c440d6dee16447f7f90
