Bluetooth monitor ver 5.72
= Note: Linux version 6.14.0-36-generic (x86_64)                       0.635631
= Note: Bluetooth subsystem version 2.22                               0.635633
= New Index: 00:00:00:00:00:00 (Primary,UART,hci1)              [hci1] 0.635634
= New Index: 48:5F:99:8E:E0:64 (Primary,USB,hci0)               [hci0] 0.635635
= Open Index: 00:00:00:00:00:00                                 [hci1] 1.149505
= Index Info: 00:00:00:00:00:00 (Nordic Semiconductor ASA)      [hci1] 1.149509
@ USER Open: main (privileged) version 2.22            {0x0001} [hci1] 1.149511
< HCI Command: Reset (0x03|0x0003) plen 0                    #1 [hci1] 1.149894
> HCI Event: Command Complete (0x0e) plen 4                  #2 [hci1] 1.150458
      Reset (0x03|0x0003) ncmd 1
        Status: Success (0x00)
< HCI Command: Read Local Supported... (0x04|0x0003) plen 0  #3 [hci1] 1.169475
> HCI Event: Command Complete (0x0e) plen 12                 #4 [hci1] 1.169991
      Read Local Supported Features (0x04|0x0003) ncmd 1
        Status: Success (0x00)
        Features: 0x00 0x00 0x00 0x00 0x60 0x00 0x00 0x00
          BR/EDR Not Supported
          LE Supported (Controller)
< HCI Command: Read Local Version In.. (0x04|0x0001) plen 0  #5 [hci1] 1.189555
> HCI Event: Command Complete (0x0e) plen 12                 #6 [hci1] 1.190082
      Read Local Version Information (0x04|0x0001) ncmd 1
        Status: Success (0x00)
        HCI version: Reserved (0x0f) - Revision 12393 (0x3069)
        LMP version: Reserved (0x0f) - Subversion 12393 (0x3069)
        Manufacturer: Nordic Semiconductor ASA (89)
< HCI Command: Read Local Supported... (0x04|0x0002) plen 0  #7 [hci1] 1.209346
> HCI Event: Command Complete (0x0e) plen 68                 #8 [hci1] 1.210475
      Read Local Supported Commands (0x04|0x0002) ncmd 1
        Status: Success (0x00)
        Commands: 119 entries
          Disconnect (Octet 0 - Bit 5)
          Read Remote Version Information (Octet 2 - Bit 7)
          Set Event Mask (Octet 5 - Bit 6)
          Reset (Octet 5 - Bit 7)
          Read Connection Accept Timeout (Octet 7 - Bit 2)
          Write Connection Accept Timeout (Octet 7 - Bit 3)
          Read Transmit Power Level (Octet 10 - Bit 2)
          Set Controller To Host Flow Control (Octet 10 - Bit 5)
          Host Buffer Size (Octet 10 - Bit 6)
          Host Number of Completed Packets (Octet 10 - Bit 7)
          Read Local Version Information (Octet 14 - Bit 3)
          Read Local Supported Features (Octet 14 - Bit 5)
          Read BD ADDR (Octet 15 - Bit 1)
          Read RSSI (Octet 15 - Bit 5)
          Set Event Mask Page 2 (Octet 22 - Bit 2)
          LE Set Event Mask (Octet 25 - Bit 0)
          LE Read Buffer Size (Octet 25 - Bit 1)
          LE Read Local Supported Features (Octet 25 - Bit 2)
          LE Set Random Address (Octet 25 - Bit 4)
          LE Set Advertising Parameters (Octet 25 - Bit 5)
          LE Read Advertising Channel TX Power (Octet 25 - Bit 6)
          LE Set Advertising Data (Octet 25 - Bit 7)
          LE Set Scan Response Data (Octet 26 - Bit 0)
          LE Set Advertise Enable (Octet 26 - Bit 1)
          LE Set Scan Parameters (Octet 26 - Bit 2)
          LE Set Scan Enable (Octet 26 - Bit 3)
          LE Create Connection (Octet 26 - Bit 4)
          LE Create Connection Cancel (Octet 26 - Bit 5)
          LE Read Accept List Size (Octet 26 - Bit 6)
          LE Clear Accept List (Octet 26 - Bit 7)
          LE Add Device To Accept List (Octet 27 - Bit 0)
          LE Remove Device From Accept List (Octet 27 - Bit 1)
          LE Connection Update (Octet 27 - Bit 2)
          LE Set Host Channel Classification (Octet 27 - Bit 3)
          LE Read Channel Map (Octet 27 - Bit 4)
          LE Read Remote Used Features (Octet 27 - Bit 5)
          LE Encrypt (Octet 27 - Bit 6)
          LE Rand (Octet 27 - Bit 7)
          LE Start Encryption (Octet 28 - Bit 0)
          LE Long Term Key Request Reply (Octet 28 - Bit 1)
          LE Long Term Key Request Neg Reply (Octet 28 - Bit 2)
          LE Read Supported States (Octet 28 - Bit 3)
          LE Receiver Test (Octet 28 - Bit 4)
          LE Transmitter Test (Octet 28 - Bit 5)
          LE Test End (Octet 28 - Bit 6)
          Read Authenticated Payload Timeout (Octet 32 - Bit 4)
          Write Authenticated Payload Timeout (Octet 32 - Bit 5)
          LE Set Data Length (Octet 33 - Bit 6)
          LE Read Suggested Default Data Length (Octet 33 - Bit 7)
          LE Write Suggested Default Data Length (Octet 34 - Bit 0)
          LE Add Device To Resolving List (Octet 34 - Bit 3)
          LE Remove Device From Resolving List (Octet 34 - Bit 4)
          LE Clear Resolving List (Octet 34 - Bit 5)
          LE Read Resolving List Size (Octet 34 - Bit 6)
          LE Set Address Resolution Enable (Octet 35 - Bit 1)
          LE Set Resolvable Private Address Timeout (Octet 35 - Bit 2)
          LE Read Maximum Data Length (Octet 35 - Bit 3)
          LE Read PHY (Octet 35 - Bit 4)
          LE Set Default PHY (Octet 35 - Bit 5)
          LE Set PHY (Octet 35 - Bit 6)
          LE Enhanced Receiver Test (Octet 35 - Bit 7)
          LE Enhanced Transmitter Test (Octet 36 - Bit 0)
          LE Set Advertising Set Random Address (Octet 36 - Bit 1)
          LE Set Extended Advertising Parameters (Octet 36 - Bit 2)
          LE Set Extended Advertising Data (Octet 36 - Bit 3)
          LE Set Extended Scan Response Data (Octet 36 - Bit 4)
          LE Set Extended Advertising Enable (Octet 36 - Bit 5)
          LE Read Maximum Advertising Data Length (Octet 36 - Bit 6)
          LE Read Number of Supported Advertising Sets (Octet 36 - Bit 7)
          LE Remove Advertising Set (Octet 37 - Bit 0)
          LE Clear Advertising Sets (Octet 37 - Bit 1)
          LE Set Periodic Advertising Parameters (Octet 37 - Bit 2)
          LE Set Periodic Advertising Data (Octet 37 - Bit 3)
          LE Set Periodic Advertising Enable (Octet 37 - Bit 4)
          LE Set Extended Scan Parameters (Octet 37 - Bit 5)
          LE Set Extended Scan Enable (Octet 37 - Bit 6)
          LE Extended Create Connection (Octet 37 - Bit 7)
          LE Periodic Advertising Create Sync (Octet 38 - Bit 0)
          LE Periodic Advertising Create Sync Cancel (Octet 38 - Bit 1)
          LE Periodic Advertising Terminate Sync (Octet 38 - Bit 2)
          LE Add Device To Periodic Advertiser List (Octet 38 - Bit 3)
          LE Remove Device From Periodic Advertiser List (Octet 38 - Bit 4)
          LE Clear Periodic Advertiser List (Octet 38 - Bit 5)
          LE Read Periodic Advertiser List Size (Octet 38 - Bit 6)
          LE Read Transmit Power (Octet 38 - Bit 7)
          LE Read RF Path Compensation (Octet 39 - Bit 0)
          LE Write RF Path Compensation (Octet 39 - Bit 1)
          LE Set Privacy Mode (Octet 39 - Bit 2)
          LE Periodic Advertising Receive Enable (Octet 40 - Bit 5)
          LE Periodic Advertising Sync Transfer (Octet 40 - Bit 6)
          LE Periodic Advertising Set Info Transfer (Octet 40 - Bit 7)
          LE Periodic Advertising Sync Transfer Parameters (Octet 41 - Bit 0)
          LE Set Default Periodic Advertisng Sync Transfer Parameters (Octet 41 - Bit 1)
          LE Read Buffer v2 (Octet 41 - Bit 5)
          LE Read ISO TX Sync (Octet 41 - Bit 6)
          LE Set Connected Isochronous Group Parameters (Octet 41 - Bit 7)
          LE Set Connected Isochronous Group Parameters Test (Octet 42 - Bit 0)
          LE Create Connected Isochronous Stream (Octet 42 - Bit 1)
          LE Remove Connected Isochronous Group (Octet 42 - Bit 2)
          LE Accept Connected Isochronous Stream Request (Octet 42 - Bit 3)
          LE Reject Connected Isochronous Stream Request (Octet 42 - Bit 4)
          LE Create Broadcast Isochronous Group (Octet 42 - Bit 5)
          LE Create Broadcast Isochronous Group Test (Octet 42 - Bit 6)
          LE Terminate Broadcast Isochronous Group (Octet 42 - Bit 7)
          LE Broadcast Isochronous Group Create Sync (Octet 43 - Bit 0)
          LE Broadcast Isochronous Group Terminate Sync (Octet 43 - Bit 1)
          LE Request Peer SCA (Octet 43 - Bit 2)
          LE Setup Isochronous Data Path (Octet 43 - Bit 3)
          LE Remove Isochronous Data Path (Octet 43 - Bit 4)
          LE Isochronous Transmit Test (Octet 43 - Bit 5)
          LE Isochronous Receive Test (Octet 43 - Bit 6)
          LE Isochronous Read Test Counters (Octet 43 - Bit 7)
          LE Isochronous Read Test Counters (Octet 44 - Bit 0)
          LE Set Host Feature (Octet 44 - Bit 1)
          Octet 44 - Bit 2 
          Octet 45 - Bit 6 
          Octet 46 - Bit 0 
          Octet 46 - Bit 1 
          Octet 46 - Bit 2 
< HCI Command: Host Buffer Size (0x03|0x0033) plen 7         #9 [hci1] 1.229534
        ACL MTU: 255  ACL max packet: 16
        SCO MTU: 0    SCO max packet: 0
> HCI Event: Command Complete (0x0e) plen 4                 #10 [hci1] 1.230077
      Host Buffer Size (0x03|0x0033) ncmd 1
        Status: Success (0x00)
< HCI Command: Set Controller To Ho.. (0x03|0x0031) plen 1  #11 [hci1] 1.249489
        Flow control: ACL Data Packets (0x01)
> HCI Event: Command Complete (0x0e) plen 4                 #12 [hci1] 1.249885
      Set Controller To Host Flow Control (0x03|0x0031) ncmd 1
        Status: Success (0x00)
< HCI Command: LE Read Local Suppor.. (0x08|0x0003) plen 0  #13 [hci1] 1.269450
> HCI Event: Command Complete (0x0e) plen 12                #14 [hci1] 1.269895
      LE Read Local Supported Features (0x08|0x0003) ncmd 1
        Status: Success (0x00)
        Features: 0xfd 0x79 0x00 0xf7 0x30 0x01 0x00 0x00
          LE Encryption
          Extended Reject Indication
          Peripheral-initiated Features Exchange
          LE Ping
          LE Data Packet Length Extension
          LL Privacy
          Extended Scanner Filter Policies
          LE 2M PHY
          LE Coded PHY
          LE Extended Advertising
          LE Periodic Advertising
          Channel Selection Algorithm #2
          Periodic Advertising Sync Transfer - Sender
          Periodic Advertising Sync Transfer - Recipient
          Sleep Clock Accuracy Updates
          Connected Isochronous Stream - Central
          Connected Isochronous Stream - Peripheral
          Isochronous Broadcaster
          Synchronized Receiver
          Periodic Advertising ADI support
          Connection Subrating
          Unknown features (0x0000010000000000)
< HCI Command: LE Set Host Feature (0x08|0x0074) plen 2     #15 [hci1] 1.289485
        Bit Number: 32
          Connected Isochronous Stream (Host Support)
        Bit Value: 1
> HCI Event: Command Complete (0x0e) plen 4                 #16 [hci1] 1.289935
      LE Set Host Feature (0x08|0x0074) ncmd 1
        Status: Success (0x00)
< HCI Command: LE Read Buffer v2 (0x08|0x0060) plen 0       #17 [hci1] 1.309484
> HCI Event: Command Complete (0x0e) plen 10                #18 [hci1] 1.309949
      LE Read Buffer v2 (0x08|0x0060) ncmd 1
        Status: Success (0x00)
        ACL MTU: 27
        ACL max packet: 3
        ISO MTU: 318
        ISO max packet: 3
< HCI Command: LE Read Maximum Adve.. (0x08|0x003a) plen 0  #19 [hci1] 1.329532
> HCI Event: Command Complete (0x0e) plen 6                 #20 [hci1] 1.329976
      LE Read Maximum Advertising Data Length (0x08|0x003a) ncmd 1
        Status: Success (0x00)
        Max length: 1650
< HCI Command: LE Read Supported St.. (0x08|0x001c) plen 0  #21 [hci1] 1.349500
> HCI Event: Command Complete (0x0e) plen 12                #22 [hci1] 1.350038
      LE Read Supported States (0x08|0x001c) ncmd 1
        Status: Success (0x00)
        States: 0x000003ff3e0306ff
          Non-connectable Advertising State
          Scannable Advertising State
          Connectable Advertising State
          High Duty Cycle Directed Advertising State
          Passive Scanning State
          Active Scanning State
          Initiating State
            and Connection State (Central Role)
          Connection State (Peripheral Role)
          Scannable Advertising State
            and Passive Scanning State
          Connectable Advertising State
            and Passive Scanning State
          Non-connectable Advertising State
            and Initiating State
          Scannable Advertising State
            and Initiating State
          Active Scanning State
            and Connection State (Central Role)
          Passive Scanning State
            and Connection State (Peripheral Role)
          Active Scanning State
            and Connection State (Peripheral Role)
          Initiating State
            and Connection State (Central Role)
            and Central Role & Central Role
          Low Duty Cycle Directed Advertising State
          Connectable Advertising State
            and Initiating State
            and Central Role & Peripheral Role
          High Duty Cycle Directed Advertising State
            and Initiating State
            and Central Role & Peripheral Role
          Low Duty Cycle Directed Advertising State
            and Initiating State
            and Central Role & Peripheral Role
          Connectable Advertising State
            and Connection State (Central Role)
            and Central Role & Peripheral Role
          High Duty Cycle Directed Advertising State
            and Connection State (Central Role)
            and Central Role & Peripheral Role
          Low Duty Cycle Directed Advertising State
            and Connection State (Central Role)
            and Central Role & Peripheral Role
          Connectable Advertising State
            and Connection State (Peripheral Role)
            and Central Role & Peripheral Role
          High Duty Cycle Directed Advertising State
            and Connection State (Peripheral Role)
            and Peripheral Role & Peripheral Role
          Low Duty Cycle Directed Advertising State
            and Connection State (Peripheral Role)
            and Peripheral Role & Peripheral Role
          Initiating State
            and Connection State (Peripheral Role)
            and Central Role & Peripheral Role
< HCI Command: LE Read Maximum Data.. (0x08|0x002f) plen 0  #23 [hci1] 1.369494
> HCI Event: Command Complete (0x0e) plen 12                #24 [hci1] 1.369939
      LE Read Maximum Data Length (0x08|0x002f) ncmd 1
        Status: Success (0x00)
        Max TX octets: 251
        Max TX time: 2704
        Max RX octets: 251
        Max RX time: 2704
< HCI Command: LE Write Suggested D.. (0x08|0x0024) plen 4  #25 [hci1] 1.389480
        TX octets: 251
        TX time: 2704
> HCI Event: Command Complete (0x0e) plen 4                 #26 [hci1] 1.390018
      LE Write Suggested Default Data Length (0x08|0x0024) ncmd 1
        Status: Success (0x00)
< HCI Command: LE Read Resolving Li.. (0x08|0x002a) plen 0  #27 [hci1] 1.409474
> HCI Event: Command Complete (0x0e) plen 5                 #28 [hci1] 1.409944
      LE Read Resolving List Size (0x08|0x002a) ncmd 1
        Status: Success (0x00)
        Size: 8
< HCI Command: LE Set Event Mask (0x08|0x0001) plen 8       #29 [hci1] 1.429490
        Mask: 0x000002023f87fa5e
          LE Advertising Report
          LE Connection Update Complete
          LE Read Remote Used Features Complete
          LE Long Term Key Request
          LE Data Length Change
          LE Enhanced Connection Complete
          LE PHY Update Complete
          LE Extended Advertising Report
          LE Periodic Advertising Sync Established
          LE Periodic Advertising Report
          LE Periodic Advertising Sync Lost
          LE Extended Scan Timeout
          LE Extended Advertising Set Terminated
          LE Scan Request Received
          LE Periodic Advertising Sync Transfer Rvc
          LE CIS Established
          LE CIS Request
          LE Create BIG Complete
          LE Terminate BIG Complete
          LE BIG Sync Estabilished Complete
          LE BIG Sync Lost
          LE BIG Info Advertising Report
          Unknown mask (0x0000020000000000)
> HCI Event: Command Complete (0x0e) plen 4                 #30 [hci1] 1.429967
      LE Set Event Mask (0x08|0x0001) ncmd 1
        Status: Success (0x00)
< HCI Command: Set Event Mask (0x03|0x0001) plen 8          #31 [hci1] 1.449491
        Mask: 0x2000800002008890
          Disconnection Complete
          Encryption Change
          Read Remote Version Information Complete
          Hardware Error
          Data Buffer Overflow
          Encryption Key Refresh Complete
          LE Meta
> HCI Event: Command Complete (0x0e) plen 4                 #32 [hci1] 1.450035
      Set Event Mask (0x03|0x0001) ncmd 1
        Status: Success (0x00)
< HCI Command: Read BD ADDR (0x04|0x0009) plen 0            #33 [hci1] 1.469494
> HCI Event: Command Complete (0x0e) plen 10                #34 [hci1] 1.469942
      Read BD ADDR (0x04|0x0009) ncmd 1
        Status: Success (0x00)
        Address: 00:00:00:00:00:00 (OUI 00-00-00)
< HCI Command: LE Set Random Address (0x08|0x0005) plen 6   #35 [hci1] 1.489510
        Address: D5:B6:CC:31:DB:3B (Static)
> HCI Event: Command Complete (0x0e) plen 4                 #36 [hci1] 1.490020
      LE Set Random Address (0x08|0x0005) ncmd 1
        Status: Success (0x00)
< HCI Command: LE Set Extended Adv.. (0x08|0x0036) plen 25  #37 [hci1] 4.039546
        Handle: 0x00
        Properties: 0x0013
          Connectable
          Scannable
          Use legacy advertising PDUs: ADV_IND
        Min advertising interval: 100.000 msec (0x00a0)
        Max advertising interval: 150.000 msec (0x00f0)
        Channel map: 37, 38, 39 (0x07)
        Own address type: Random (0x01)
        Peer address type: Public (0x00)
        Peer address: 00:00:00:00:00:00 (OUI 00-00-00)
        Filter policy: Allow Scan Request from Any, Allow Connect Request from Any (0x00)
        TX power: Host has no preference (0x7f)
        Primary PHY: LE 1M (0x01)
        Secondary max skip: 0x00
        Secondary PHY: LE 1M (0x01)
        SID: 0x00
        Scan request notifications: Disabled (0x00)
> HCI Event: Command Complete (0x0e) plen 5                 #38 [hci1] 4.040408
      LE Set Extended Advertising Parameters (0x08|0x0036) ncmd 1
        Status: Success (0x00)
        TX power (selected): 0 dbm (0x00)
< HCI Command: LE Set Advertising S.. (0x08|0x0035) plen 7  #39 [hci1] 4.049551
        Advertising handle: 0x00
        Advertising random address: D5:B6:CC:31:DB:3B (Static)
> HCI Event: Command Complete (0x0e) plen 4                 #40 [hci1] 4.050032
      LE Set Advertising Set Random Address (0x08|0x0035) ncmd 1
        Status: Success (0x00)
< HCI Command: LE Set Extended Adv.. (0x08|0x0037) plen 22  #41 [hci1] 4.069532
        Handle: 0x00
        Operation: Complete extended advertising data (0x03)
        Fragment preference: Minimize fragmentation (0x01)
        Data length: 0x12
        Flags: 0x06
          LE General Discoverable Mode
          BR/EDR Not Supported
        Name (complete): Tester_F6B11A
> HCI Event: Command Complete (0x0e) plen 4                 #42 [hci1] 4.070279
      LE Set Extended Advertising Data (0x08|0x0037) ncmd 1
        Status: Success (0x00)
< HCI Command: LE Set Extended Scan.. (0x08|0x0038) plen 4  #43 [hci1] 4.089416
        Handle: 0x00
        Operation: Complete scan response data (0x03)
        Fragment preference: Minimize fragmentation (0x01)
        Data length: 0x00
> HCI Event: Command Complete (0x0e) plen 4                 #44 [hci1] 4.089940
      LE Set Extended Scan Response Data (0x08|0x0038) ncmd 1
        Status: Success (0x00)
< HCI Command: LE Set Extended Adve.. (0x08|0x0039) plen 6  #45 [hci1] 4.109590
        Extended advertising: Enabled (0x01)
        Number of sets: 1 (0x01)
        Entry 0
          Handle: 0x00
          Duration: 0 ms (0x00)
          Max ext adv events: 0
> HCI Event: Command Complete (0x0e) plen 4                 #46 [hci1] 4.110180
      LE Set Extended Advertising Enable (0x08|0x0039) ncmd 1
        Status: Success (0x00)
> HCI Event: LE Meta Event (0x3e) plen 31                   #47 [hci1] 4.221339
      LE Enhanced Connection Complete (0x0a)
        Status: Success (0x00)
        Handle: 2685
        Role: Peripheral (0x01)
        Peer address type: Public (0x00)
        Peer address: DF:A9:FF:F6:B1:1A (OUI DF-A9-FF)
        Local resolvable private address: 00:00:00:00:00:00 (Non-Resolvable)
        Peer resolvable private address: 00:00:00:00:00:00 (Non-Resolvable)
        Connection interval: 87.50 msec (0x0046)
        Connection latency: 0 (0x0000)
        Supervision timeout: 25120 msec (0x09d0)
        Central clock accuracy: 0x01
> HCI Event: LE Meta Event (0x3e) plen 6                    #48 [hci1] 4.221565
      LE Advertising Set Terminated (0x12)
        Status: Success (0x00)
        Handle: 0
        Connection handle: 2685
        Number of completed extended advertising events: 0
< HCI Command: LE Read Remote Used... (0x08|0x0016) plen 2  #49 [hci1] 4.229881
        Handle: 2685 Address: DF:A9:FF:F6:B1:1A (OUI DF-A9-FF)
< ACL Data TX: Handle 2685 flags 0x00 dlen 7                #50 [hci1] 4.229892
      ATT: Exchange MTU Request (0x02) len 2
        Client RX MTU: 251
> HCI Event: Command Status (0x0f) plen 4                   #51 [hci1] 4.230410
      LE Read Remote Used Features (0x08|0x0016) ncmd 1
        Status: Success (0x00)
> HCI Event: Number of Completed Packets (0x13) plen 5      #52 [hci1] 4.397335
        Num handles: 1
        Handle: 2685 Address: DF:A9:FF:F6:B1:1A (OUI DF-A9-FF)
        Count: 1
        #50: len 7 (0 Kb/s)
        Latency: 167 msec (167-167 msec ~167 msec)
> HCI Event: LE Meta Event (0x3e) plen 12                   #53 [hci1] 4.485357
      LE Read Remote Used Features (0x04)
        Status: Success (0x00)
        Handle: 2685 Address: DF:A9:FF:F6:B1:1A (OUI DF-A9-FF)
        Features: 0x2d 0x49 0x00 0xf7 0x67 0xd8 0x00 0x00
          LE Encryption
          Extended Reject Indication
          Peripheral-initiated Features Exchange
          LE Data Packet Length Extension
          LE 2M PHY
          LE Coded PHY
          Channel Selection Algorithm #2
          Periodic Advertising Sync Transfer - Sender
          Periodic Advertising Sync Transfer - Recipient
          Sleep Clock Accuracy Updates
          Connected Isochronous Stream - Central
          Connected Isochronous Stream - Peripheral
          Isochronous Broadcaster
          Synchronized Receiver
          Connected Isochronous Stream (Host Support)
          LE Power Control Request
          LE Power Control Request
          Connection Subrating
          Connection Subrating (Host Support)
          Unknown features (0x0000d80000000000)
> ACL Data RX: Handle 2685 flags 0x02 dlen 11               #54 [hci1] 6.934932
      SMP: Pairing Request (0x01) len 6
        IO capability: KeyboardDisplay (0x04)
        OOB data: Authentication data not present (0x00)
        Authentication requirement: Bonding, MITM, SC, No Keypresses (0x0d)
        Max encryption key size: 16
        Initiator key distribution: EncKey IdKey (0x03)
        Responder key distribution: EncKey IdKey Sign (0x07)
> ACL Data RX: Handle 2685 flags 0x02 dlen 7                #55 [hci1] 6.935415
      ATT: Exchange MTU Response (0x03) len 2
        Server RX MTU: 23
< HCI Command: Host Number of Compl.. (0x03|0x0035) plen 5  #56 [hci1] 6.949757
        Num handles: 1
        Handle: 2685 Address: DF:A9:FF:F6:B1:1A (OUI DF-A9-FF)
        Count: 1
< ACL Data TX: Handle 2685 flags 0x00 dlen 11               #57 [hci1] 6.949873
      SMP: Pairing Response (0x02) len 6
        IO capability: DisplayOnly (0x00)
        OOB data: Authentication data not present (0x00)
        Authentication requirement: Bonding, No MITM, SC, No Keypresses (0x09)
        Max encryption key size: 16
        Initiator key distribution: IdKey (0x02)
        Responder key distribution: <none> (0x00)
< HCI Command: Host Number of Compl.. (0x03|0x0035) plen 5  #58 [hci1] 6.949997
        Num handles: 1
        Handle: 2685 Address: DF:A9:FF:F6:B1:1A (OUI DF-A9-FF)
        Count: 1
> HCI Event: Number of Completed Packets (0x13) plen 5      #59 [hci1] 7.110021
        Num handles: 1
        Handle: 2685 Address: DF:A9:FF:F6:B1:1A (OUI DF-A9-FF)
        Count: 1
        #57: len 11 (0 Kb/s)
        Latency: 160 msec (160-167 msec ~163 msec)
> ACL Data RX: Handle 2685 flags 0x02 dlen 27               #60 [hci1] 7.110299
> ACL Data RX: Handle 2685 flags 0x01 dlen 27               #61 [hci1] 7.110944
> ACL Data RX: Handle 2685 flags 0x01 dlen 15               #62 [hci1] 7.111333
      SMP: Pairing Public Key (0x0c) len 64
        X: d854988b1040f541351256962e499014cb86224e4c5b6f828968a7af2306e5f2
        Y: 1c7b271670d655be3550705d62687e3e7bc4ac0f2221929b4691f054464c38c3
< HCI Command: Host Number of Compl.. (0x03|0x0035) plen 5  #63 [hci1] 7.129741
        Num handles: 1
        Handle: 2685 Address: DF:A9:FF:F6:B1:1A (OUI DF-A9-FF)
        Count: 1
< HCI Command: Host Number of Compl.. (0x03|0x0035) plen 5  #64 [hci1] 7.129831
        Num handles: 1
        Handle: 2685 Address: DF:A9:FF:F6:B1:1A (OUI DF-A9-FF)
        Count: 1
< HCI Command: Host Number of Compl.. (0x03|0x0035) plen 5  #65 [hci1] 7.129957
        Num handles: 1
        Handle: 2685 Address: DF:A9:FF:F6:B1:1A (OUI DF-A9-FF)
        Count: 1
< ACL Data TX: Handle 2685 flags 0x00 dlen 27               #66 [hci1] 7.130023
< ACL Data TX: Handle 2685 flags 0x01 dlen 27               #67 [hci1] 7.130025
< ACL Data TX: Handle 2685 flags 0x01 dlen 15               #68 [hci1] 7.130026
      SMP: Pairing Public Key (0x0c) len 64
        X: 98308440221e2d910f0e54b71e7ec652857aa9b5a0dc65028824cc19db1226e9
        Y: 67a4816bcb62efb21701e31fdb27561a6217575fb007a8bbdabe7e28b6f68482
> HCI Event: Number of Completed Packets (0x13) plen 5      #69 [hci1] 7.197929
        Num handles: 1
        Handle: 2685 Address: DF:A9:FF:F6:B1:1A (OUI DF-A9-FF)
        Count: 1
        #66: len 27 (3 Kb/s)
        Latency: 67 msec (67-167 msec ~115 msec)
> HCI Event: Number of Completed Packets (0x13) plen 5      #70 [hci1] 7.198635
        Num handles: 1
        Handle: 2685 Address: DF:A9:FF:F6:B1:1A (OUI DF-A9-FF)
        Count: 1
        #67: len 27 (3 Kb/s)
        Latency: 68 msec (67-167 msec ~92 msec)
> HCI Event: Number of Completed Packets (0x13) plen 5      #71 [hci1] 7.284730
        Num handles: 1
        Handle: 2685 Address: DF:A9:FF:F6:B1:1A (OUI DF-A9-FF)
        Count: 1
        #68: len 15 (0 Kb/s)
        Latency: 154 msec (67-167 msec ~123 msec)
> ACL Data RX: Handle 2685 flags 0x02 dlen 21               #72 [hci1] 8.247668
      SMP: Pairing Confirm (0x03) len 16
        Confim value: 883dfd7343f3cb09189a128793a11515
< HCI Command: Host Number of Compl.. (0x03|0x0035) plen 5  #73 [hci1] 8.250172
        Num handles: 1
        Handle: 2685 Address: DF:A9:FF:F6:B1:1A (OUI DF-A9-FF)
        Count: 1
< ACL Data TX: Handle 2685 flags 0x00 dlen 21               #74 [hci1] 8.250284
      SMP: Pairing Confirm (0x03) len 16
        Confim value: c44de8dbc08c72b3dc6851d10509e885
> HCI Event: Number of Completed Packets (0x13) plen 5      #75 [hci1] 8.422383
        Num handles: 1
        Handle: 2685 Address: DF:A9:FF:F6:B1:1A (OUI DF-A9-FF)
        Count: 1
        #74: len 21 (0 Kb/s)
        Latency: 172 msec (67-172 msec ~147 msec)
> ACL Data RX: Handle 2685 flags 0x02 dlen 21               #76 [hci1] 8.422738
      SMP: Pairing Random (0x04) len 16
        Random value: a2eedb077e8865700000000000000000
< HCI Command: Host Number of Compl.. (0x03|0x0035) plen 5  #77 [hci1] 8.430118
        Num handles: 1
        Handle: 2685 Address: DF:A9:FF:F6:B1:1A (OUI DF-A9-FF)
        Count: 1
< ACL Data TX: Handle 2685 flags 0x00 dlen 21               #78 [hci1] 8.430656
      SMP: Pairing Random (0x04) len 16
        Random value: 8e6108f966a694cbe26df70bb96773e6
> HCI Event: Number of Completed Packets (0x13) plen 5      #79 [hci1] 8.597254
        Num handles: 1
        Handle: 2685 Address: DF:A9:FF:F6:B1:1A (OUI DF-A9-FF)
        Count: 1
        #78: len 21 (1 Kb/s)
        Latency: 166 msec (67-172 msec ~157 msec)
> ACL Data RX: Handle 2685 flags 0x02 dlen 21               #80 [hci1] 8.684989
      SMP: Pairing Confirm (0x03) len 16
        Confim value: a20b130ff9d0aa461f4b8507e780ffb8
< HCI Command: Host Number of Compl.. (0x03|0x0035) plen 5  #81 [hci1] 8.689682
        Num handles: 1
        Handle: 2685 Address: DF:A9:FF:F6:B1:1A (OUI DF-A9-FF)
        Count: 1
< ACL Data TX: Handle 2685 flags 0x00 dlen 21               #82 [hci1] 8.689784
      SMP: Pairing Confirm (0x03) len 16
        Confim value: 1fdd40edfbe4fbb35ab601435a142f54
> HCI Event: Number of Completed Packets (0x13) plen 5      #83 [hci1] 8.859810
        Num handles: 1
        Handle: 2685 Address: DF:A9:FF:F6:B1:1A (OUI DF-A9-FF)
        Count: 1
        #82: len 21 (0 Kb/s)
        Latency: 170 msec (67-172 msec ~163 msec)
> ACL Data RX: Handle 2685 flags 0x02 dlen 21               #84 [hci1] 8.860284
      SMP: Pairing Random (0x04) len 16
        Random value: edcd3c7f6fd005210000000000000000
< HCI Command: Host Number of Compl.. (0x03|0x0035) plen 5  #85 [hci1] 8.869833
        Num handles: 1
        Handle: 2685 Address: DF:A9:FF:F6:B1:1A (OUI DF-A9-FF)
        Count: 1
< ACL Data TX: Handle 2685 flags 0x00 dlen 21               #86 [hci1] 8.869881
      SMP: Pairing Random (0x04) len 16
        Random value: 4d02679f89a05211af56d8b3da64d21e
> HCI Event: Number of Completed Packets (0x13) plen 5      #87 [hci1] 9.034699
        Num handles: 1
        Handle: 2685 Address: DF:A9:FF:F6:B1:1A (OUI DF-A9-FF)
        Count: 1
        #86: len 21 (1 Kb/s)
        Latency: 164 msec (67-172 msec ~164 msec)
> ACL Data RX: Handle 2685 flags 0x02 dlen 21               #88 [hci1] 9.122532
      SMP: Pairing Confirm (0x03) len 16
        Confim value: eabc1a1720f93b43dc269f5e9b1e93ca
< HCI Command: Host Number of Compl.. (0x03|0x0035) plen 5  #89 [hci1] 9.129720
        Num handles: 1
        Handle: 2685 Address: DF:A9:FF:F6:B1:1A (OUI DF-A9-FF)
        Count: 1
< ACL Data TX: Handle 2685 flags 0x00 dlen 21               #90 [hci1] 9.129801
      SMP: Pairing Confirm (0x03) len 16
        Confim value: 685cdd1e10c9a29150a1bb4f5cbfebb3
> HCI Event: Number of Completed Packets (0x13) plen 5      #91 [hci1] 9.297452
        Num handles: 1
        Handle: 2685 Address: DF:A9:FF:F6:B1:1A (OUI DF-A9-FF)
        Count: 1
        #90: len 21 (1 Kb/s)
        Latency: 167 msec (67-172 msec ~165 msec)
> ACL Data RX: Handle 2685 flags 0x02 dlen 21               #92 [hci1] 9.297681
      SMP: Pairing Random (0x04) len 16
        Random value: 766433d7634176d20000000000000000
< HCI Command: Host Number of Compl.. (0x03|0x0035) plen 5  #93 [hci1] 9.309835
        Num handles: 1
        Handle: 2685 Address: DF:A9:FF:F6:B1:1A (OUI DF-A9-FF)
        Count: 1
< ACL Data TX: Handle 2685 flags 0x00 dlen 21               #94 [hci1] 9.309924
      SMP: Pairing Random (0x04) len 16
        Random value: 5e8286bc235a02440d0c3424a2acf8fd
> HCI Event: Number of Completed Packets (0x13) plen 5      #95 [hci1] 9.472100
        Num handles: 1
        Handle: 2685 Address: DF:A9:FF:F6:B1:1A (OUI DF-A9-FF)
        Count: 1
        #94: len 21 (1 Kb/s)
        Latency: 162 msec (67-172 msec ~164 msec)
> ACL Data RX: Handle 2685 flags 0x02 dlen 21               #96 [hci1] 9.559954
      SMP: Pairing Confirm (0x03) len 16
        Confim value: da61a9f9e249ba86f0b0786eff983ba9
< HCI Command: Host Number of Compl.. (0x03|0x0035) plen 5  #97 [hci1] 9.569752
        Num handles: 1
        Handle: 2685 Address: DF:A9:FF:F6:B1:1A (OUI DF-A9-FF)
        Count: 1
< ACL Data TX: Handle 2685 flags 0x00 dlen 21               #98 [hci1] 9.569884
      SMP: Pairing Confirm (0x03) len 16
        Confim value: 141d7dab015c8c00b07f284c18918d24
> HCI Event: Number of Completed Packets (0x13) plen 5      #99 [hci1] 9.734956
        Num handles: 1
        Handle: 2685 Address: DF:A9:FF:F6:B1:1A (OUI DF-A9-FF)
        Count: 1
        #98: len 21 (1 Kb/s)
        Latency: 165 msec (67-172 msec ~164 msec)
> ACL Data RX: Handle 2685 flags 0x02 dlen 21              #100 [hci1] 9.735208
      SMP: Pairing Random (0x04) len 16
        Random value: e7002a74f3c3c9e80000000000000000
< HCI Command: Host Number of Comp.. (0x03|0x0035) plen 5  #101 [hci1] 9.750135
        Num handles: 1
        Handle: 2685 Address: DF:A9:FF:F6:B1:1A (OUI DF-A9-FF)
        Count: 1
< ACL Data TX: Handle 2685 flags 0x00 dlen 21              #102 [hci1] 9.750208
      SMP: Pairing Random (0x04) len 16
        Random value: 5c4a1bcadd27bd58e945097b00bad7ac
> HCI Event: Number of Completed Packets (0x13) plen 5     #103 [hci1] 9.909645
        Num handles: 1
        Handle: 2685 Address: DF:A9:FF:F6:B1:1A (OUI DF-A9-FF)
        Count: 1
        #102: len 21 (1 Kb/s)
        Latency: 159 msec (67-172 msec ~162 msec)
> ACL Data RX: Handle 2685 flags 0x02 dlen 21              #104 [hci1] 9.997543
      SMP: Pairing Confirm (0x03) len 16
        Confim value: de1479b5b1eb94b9accb0b8c370653b8
< HCI Command: Host Number of Com.. (0x03|0x0035) plen 5  #105 [hci1] 10.009671
        Num handles: 1
        Handle: 2685 Address: DF:A9:FF:F6:B1:1A (OUI DF-A9-FF)
        Count: 1
< ACL Data TX: Handle 2685 flags 0x00 dlen 21             #106 [hci1] 10.009806
      SMP: Pairing Confirm (0x03) len 16
        Confim value: f3d95f6dd2dc6421f6ed16e8368e817e
> HCI Event: Number of Completed Packets (0x13) plen 5    #107 [hci1] 10.172368
        Num handles: 1
        Handle: 2685 Address: DF:A9:FF:F6:B1:1A (OUI DF-A9-FF)
        Count: 1
        #106: len 21 (1 Kb/s)
        Latency: 162 msec (67-172 msec ~162 msec)
> ACL Data RX: Handle 2685 flags 0x02 dlen 21             #108 [hci1] 10.172624
      SMP: Pairing Random (0x04) len 16
        Random value: 44003d77388e2e1b0000000000000000
< HCI Command: Host Number of Com.. (0x03|0x0035) plen 5  #109 [hci1] 10.190231
        Num handles: 1
        Handle: 2685 Address: DF:A9:FF:F6:B1:1A (OUI DF-A9-FF)
        Count: 1
< ACL Data TX: Handle 2685 flags 0x00 dlen 21             #110 [hci1] 10.190307
      SMP: Pairing Random (0x04) len 16
        Random value: 32527e6e64e79f33b2e374394db8ab2d
> HCI Event: Number of Completed Packets (0x13) plen 5    #111 [hci1] 10.347165
        Num handles: 1
        Handle: 2685 Address: DF:A9:FF:F6:B1:1A (OUI DF-A9-FF)
        Count: 1
        #110: len 21 (1 Kb/s)
        Latency: 156 msec (67-172 msec ~159 msec)
> ACL Data RX: Handle 2685 flags 0x02 dlen 21             #112 [hci1] 10.434942
      SMP: Pairing Confirm (0x03) len 16
        Confim value: 1d8ad6e21328ab9c994096e76eaf50a2
< HCI Command: Host Number of Com.. (0x03|0x0035) plen 5  #113 [hci1] 10.450020
        Num handles: 1
        Handle: 2685 Address: DF:A9:FF:F6:B1:1A (OUI DF-A9-FF)
        Count: 1
< ACL Data TX: Handle 2685 flags 0x00 dlen 21             #114 [hci1] 10.450240
      SMP: Pairing Confirm (0x03) len 16
        Confim value: be4c9662ce49d7944ac548bfc49d2031
> HCI Event: Number of Completed Packets (0x13) plen 5    #115 [hci1] 10.609825
        Num handles: 1
        Handle: 2685 Address: DF:A9:FF:F6:B1:1A (OUI DF-A9-FF)
        Count: 1
        #114: len 21 (1 Kb/s)
        Latency: 159 msec (67-172 msec ~159 msec)
> ACL Data RX: Handle 2685 flags 0x02 dlen 21             #116 [hci1] 10.610105
      SMP: Pairing Random (0x04) len 16
        Random value: 6795292e7e3a17d10000000000000000
< HCI Command: Host Number of Com.. (0x03|0x0035) plen 5  #117 [hci1] 10.629716
        Num handles: 1
        Handle: 2685 Address: DF:A9:FF:F6:B1:1A (OUI DF-A9-FF)
        Count: 1
< ACL Data TX: Handle 2685 flags 0x00 dlen 21             #118 [hci1] 10.629791
      SMP: Pairing Random (0x04) len 16
        Random value: dddbdfe2838e9a8cc6964353c850fef7
> HCI Event: Number of Completed Packets (0x13) plen 5    #119 [hci1] 10.784656
        Num handles: 1
        Handle: 2685 Address: DF:A9:FF:F6:B1:1A (OUI DF-A9-FF)
        Count: 1
        #118: len 21 (1 Kb/s)
        Latency: 154 msec (67-172 msec ~157 msec)
> ACL Data RX: Handle 2685 flags 0x02 dlen 21             #120 [hci1] 10.872475
      SMP: Pairing Confirm (0x03) len 16
        Confim value: c5e142f6e5dcbb811e26bfd66e5a400d
< HCI Command: Host Number of Com.. (0x03|0x0035) plen 5  #121 [hci1] 10.890012
        Num handles: 1
        Handle: 2685 Address: DF:A9:FF:F6:B1:1A (OUI DF-A9-FF)
        Count: 1
< ACL Data TX: Handle 2685 flags 0x00 dlen 21             #122 [hci1] 10.890214
      SMP: Pairing Confirm (0x03) len 16
        Confim value: bec9ab9435176f29a4d3f77535cbe1c9
> HCI Event: Number of Completed Packets (0x13) plen 5    #123 [hci1] 11.047338
        Num handles: 1
        Handle: 2685 Address: DF:A9:FF:F6:B1:1A (OUI DF-A9-FF)
        Count: 1
        #122: len 21 (1 Kb/s)
        Latency: 157 msec (67-172 msec ~157 msec)
> ACL Data RX: Handle 2685 flags 0x02 dlen 21             #124 [hci1] 11.047625
      SMP: Pairing Random (0x04) len 16
        Random value: 19a3d8c6dcdcced90000000000000000
< HCI Command: Host Number of Com.. (0x03|0x0035) plen 5  #125 [hci1] 11.049808
        Num handles: 1
        Handle: 2685 Address: DF:A9:FF:F6:B1:1A (OUI DF-A9-FF)
        Count: 1
< ACL Data TX: Handle 2685 flags 0x00 dlen 21             #126 [hci1] 11.049815
      SMP: Pairing Random (0x04) len 16
        Random value: eb9f1915536596b6fc3db1c86b2b1970
> HCI Event: Number of Completed Packets (0x13) plen 5    #127 [hci1] 11.222108
        Num handles: 1
        Handle: 2685 Address: DF:A9:FF:F6:B1:1A (OUI DF-A9-FF)
        Count: 1
        #126: len 21 (0 Kb/s)
        Latency: 172 msec (67-172 msec ~164 msec)
> ACL Data RX: Handle 2685 flags 0x02 dlen 21             #128 [hci1] 11.309901
      SMP: Pairing Confirm (0x03) len 16
        Confim value: 9a52df6faec988689cca52ad1072cb13
< HCI Command: Host Number of Com.. (0x03|0x0035) plen 5  #129 [hci1] 11.330120
        Num handles: 1
        Handle: 2685 Address: DF:A9:FF:F6:B1:1A (OUI DF-A9-FF)
        Count: 1
< ACL Data TX: Handle 2685 flags 0x00 dlen 21             #130 [hci1] 11.330319
      SMP: Pairing Confirm (0x03) len 16
        Confim value: 6ab63c892f88b35572f078e593f3bc0c
> HCI Event: Number of Completed Packets (0x13) plen 5    #131 [hci1] 11.484849
        Num handles: 1
        Handle: 2685 Address: DF:A9:FF:F6:B1:1A (OUI DF-A9-FF)
        Count: 1
        #130: len 21 (1 Kb/s)
        Latency: 154 msec (67-172 msec ~159 msec)
> ACL Data RX: Handle 2685 flags 0x02 dlen 21             #132 [hci1] 11.485147
      SMP: Pairing Random (0x04) len 16
        Random value: 031cba00ea12b83a0000000000000000
< HCI Command: Host Number of Com.. (0x03|0x0035) plen 5  #133 [hci1] 11.490284
        Num handles: 1
        Handle: 2685 Address: DF:A9:FF:F6:B1:1A (OUI DF-A9-FF)
        Count: 1
< ACL Data TX: Handle 2685 flags 0x00 dlen 21             #134 [hci1] 11.490371
      SMP: Pairing Random (0x04) len 16
        Random value: 5c794dc9ad9f2c3f295ebd5ad5e1c3cf
> HCI Event: Number of Completed Packets (0x13) plen 5    #135 [hci1] 11.659569
        Num handles: 1
        Handle: 2685 Address: DF:A9:FF:F6:B1:1A (OUI DF-A9-FF)
        Count: 1
        #134: len 21 (0 Kb/s)
        Latency: 169 msec (67-172 msec ~164 msec)
> ACL Data RX: Handle 2685 flags 0x02 dlen 21             #136 [hci1] 11.747476
      SMP: Pairing Confirm (0x03) len 16
        Confim value: 6d7127f8925d7dfd77a08acc43105b30
< HCI Command: Host Number of Com.. (0x03|0x0035) plen 5  #137 [hci1] 11.749745
        Num handles: 1
        Handle: 2685 Address: DF:A9:FF:F6:B1:1A (OUI DF-A9-FF)
        Count: 1
< ACL Data TX: Handle 2685 flags 0x00 dlen 21             #138 [hci1] 11.749855
      SMP: Pairing Confirm (0x03) len 16
        Confim value: 6f53f189dd7ba6660b13e4a5a35dc356
> HCI Event: Number of Completed Packets (0x13) plen 5    #139 [hci1] 11.922314
        Num handles: 1
        Handle: 2685 Address: DF:A9:FF:F6:B1:1A (OUI DF-A9-FF)
        Count: 1
        #138: len 21 (0 Kb/s)
        Latency: 172 msec (67-172 msec ~168 msec)
> ACL Data RX: Handle 2685 flags 0x02 dlen 21             #140 [hci1] 11.922617
      SMP: Pairing Random (0x04) len 16
        Random value: 2d00295313edd6bd0000000000000000
< HCI Command: Host Number of Com.. (0x03|0x0035) plen 5  #141 [hci1] 11.930323
        Num handles: 1
        Handle: 2685 Address: DF:A9:FF:F6:B1:1A (OUI DF-A9-FF)
        Count: 1
< ACL Data TX: Handle 2685 flags 0x00 dlen 21             #142 [hci1] 11.930496
      SMP: Pairing Random (0x04) len 16
        Random value: 5c2fff312cdf99c9491988e877355a9a
> HCI Event: Number of Completed Packets (0x13) plen 5    #143 [hci1] 12.097130
        Num handles: 1
        Handle: 2685 Address: DF:A9:FF:F6:B1:1A (OUI DF-A9-FF)
        Count: 1
        #142: len 21 (1 Kb/s)
        Latency: 166 msec (67-172 msec ~167 msec)
> ACL Data RX: Handle 2685 flags 0x02 dlen 21             #144 [hci1] 12.184944
      SMP: Pairing Confirm (0x03) len 16
        Confim value: 60df6a37bb7fe2dfa33202d983961750
< HCI Command: Host Number of Com.. (0x03|0x0035) plen 5  #145 [hci1] 12.189730
        Num handles: 1
        Handle: 2685 Address: DF:A9:FF:F6:B1:1A (OUI DF-A9-FF)
        Count: 1
< ACL Data TX: Handle 2685 flags 0x00 dlen 21             #146 [hci1] 12.189826
      SMP: Pairing Confirm (0x03) len 16
        Confim value: d2af4e4ecc6e3621611d077fe09af689
> HCI Event: Number of Completed Packets (0x13) plen 5    #147 [hci1] 12.359844
        Num handles: 1
        Handle: 2685 Address: DF:A9:FF:F6:B1:1A (OUI DF-A9-FF)
        Count: 1
        #146: len 21 (0 Kb/s)
        Latency: 170 msec (67-172 msec ~168 msec)
> ACL Data RX: Handle 2685 flags 0x02 dlen 21             #148 [hci1] 12.360061
      SMP: Pairing Random (0x04) len 16
        Random value: 086a6135349e683d0000000000000000
< HCI Command: Host Number of Com.. (0x03|0x0035) plen 5  #149 [hci1] 12.370291
        Num handles: 1
        Handle: 2685 Address: DF:A9:FF:F6:B1:1A (OUI DF-A9-FF)
        Count: 1
< ACL Data TX: Handle 2685 flags 0x00 dlen 21             #150 [hci1] 12.370447
      SMP: Pairing Random (0x04) len 16
        Random value: c629a3a987d808e808655d558dfc1155
> HCI Event: Number of Completed Packets (0x13) plen 5    #151 [hci1] 12.534530
        Num handles: 1
        Handle: 2685 Address: DF:A9:FF:F6:B1:1A (OUI DF-A9-FF)
        Count: 1
        #150: len 21 (1 Kb/s)
        Latency: 164 msec (67-172 msec ~166 msec)
> ACL Data RX: Handle 2685 flags 0x02 dlen 21             #152 [hci1] 12.622453
      SMP: Pairing Confirm (0x03) len 16
        Confim value: ccce003d7bb0a9ca9cebd6eab869faba
< HCI Command: Host Number of Com.. (0x03|0x0035) plen 5  #153 [hci1] 12.629686
        Num handles: 1
        Handle: 2685 Address: DF:A9:FF:F6:B1:1A (OUI DF-A9-FF)
        Count: 1
< ACL Data TX: Handle 2685 flags 0x00 dlen 21             #154 [hci1] 12.629794
      SMP: Pairing Confirm (0x03) len 16
        Confim value: fa9cb0602d41182b51c6d9de837a03fe
> HCI Event: Number of Completed Packets (0x13) plen 5    #155 [hci1] 12.797226
        Num handles: 1
        Handle: 2685 Address: DF:A9:FF:F6:B1:1A (OUI DF-A9-FF)
        Count: 1
        #154: len 21 (1 Kb/s)
        Latency: 167 msec (67-172 msec ~166 msec)
> ACL Data RX: Handle 2685 flags 0x02 dlen 21             #156 [hci1] 12.797651
      SMP: Pairing Random (0x04) len 16
        Random value: c7eaaf92855ba56c0000000000000000
< HCI Command: Host Number of Com.. (0x03|0x0035) plen 5  #157 [hci1] 12.810322
        Num handles: 1
        Handle: 2685 Address: DF:A9:FF:F6:B1:1A (OUI DF-A9-FF)
        Count: 1
< ACL Data TX: Handle 2685 flags 0x00 dlen 21             #158 [hci1] 12.810479
      SMP: Pairing Random (0x04) len 16
        Random value: 92f20f6ad8f13724432c7fd6001c45ff
> HCI Event: Number of Completed Packets (0x13) plen 5    #159 [hci1] 12.971987
        Num handles: 1
        Handle: 2685 Address: DF:A9:FF:F6:B1:1A (OUI DF-A9-FF)
        Count: 1
        #158: len 21 (1 Kb/s)
        Latency: 161 msec (67-172 msec ~164 msec)
> ACL Data RX: Handle 2685 flags 0x02 dlen 21             #160 [hci1] 13.059869
      SMP: Pairing Confirm (0x03) len 16
        Confim value: 0bdfa473f22dc59fb349bd57d6aefe3e
< HCI Command: Host Number of Com.. (0x03|0x0035) plen 5  #161 [hci1] 13.069859
        Num handles: 1
        Handle: 2685 Address: DF:A9:FF:F6:B1:1A (OUI DF-A9-FF)
        Count: 1
< ACL Data TX: Handle 2685 flags 0x00 dlen 21             #162 [hci1] 13.070128
      SMP: Pairing Confirm (0x03) len 16
        Confim value: 81acc8fe62e0b689744857eb7a3d7f68
> HCI Event: Number of Completed Packets (0x13) plen 5    #163 [hci1] 13.234646
        Num handles: 1
        Handle: 2685 Address: DF:A9:FF:F6:B1:1A (OUI DF-A9-FF)
        Count: 1
        #162: len 21 (1 Kb/s)
        Latency: 164 msec (67-172 msec ~164 msec)
> ACL Data RX: Handle 2685 flags 0x02 dlen 21             #164 [hci1] 13.235128
      SMP: Pairing Random (0x04) len 16
        Random value: 9fe256f45d05aea10000000000000000
< HCI Command: Host Number of Com.. (0x03|0x0035) plen 5  #165 [hci1] 13.249888
        Num handles: 1
        Handle: 2685 Address: DF:A9:FF:F6:B1:1A (OUI DF-A9-FF)
        Count: 1
< ACL Data TX: Handle 2685 flags 0x00 dlen 21             #166 [hci1] 13.249915
      SMP: Pairing Random (0x04) len 16
        Random value: 23ac32ebbb5e14c8a6b9622f296d277f
> HCI Event: Number of Completed Packets (0x13) plen 5    #167 [hci1] 13.409496
        Num handles: 1
        Handle: 2685 Address: DF:A9:FF:F6:B1:1A (OUI DF-A9-FF)
        Count: 1
        #166: len 21 (1 Kb/s)
        Latency: 159 msec (67-172 msec ~161 msec)
> ACL Data RX: Handle 2685 flags 0x02 dlen 21             #168 [hci1] 13.497484
      SMP: Pairing Confirm (0x03) len 16
        Confim value: b7c2b433975aa852f55e756200a087f9
< HCI Command: Host Number of Com.. (0x03|0x0035) plen 5  #169 [hci1] 13.510172
        Num handles: 1
        Handle: 2685 Address: DF:A9:FF:F6:B1:1A (OUI DF-A9-FF)
        Count: 1
< ACL Data TX: Handle 2685 flags 0x00 dlen 21             #170 [hci1] 13.510450
      SMP: Pairing Confirm (0x03) len 16
        Confim value: 219bf58e72327d8234b9e5bdfad3fe28
> HCI Event: Number of Completed Packets (0x13) plen 5    #171 [hci1] 13.672198
        Num handles: 1
        Handle: 2685 Address: DF:A9:FF:F6:B1:1A (OUI DF-A9-FF)
        Count: 1
        #170: len 21 (1 Kb/s)
        Latency: 161 msec (67-172 msec ~161 msec)
> ACL Data RX: Handle 2685 flags 0x02 dlen 21             #172 [hci1] 13.672512
      SMP: Pairing Random (0x04) len 16
        Random value: 9b1e704afcf144f70000000000000000
< HCI Command: Host Number of Com.. (0x03|0x0035) plen 5  #173 [hci1] 13.689813
        Num handles: 1
        Handle: 2685 Address: DF:A9:FF:F6:B1:1A (OUI DF-A9-FF)
        Count: 1
< ACL Data TX: Handle 2685 flags 0x00 dlen 21             #174 [hci1] 13.689848
      SMP: Pairing Random (0x04) len 16
        Random value: 297efe85e67448a15f56bd27e3a3cf1d
> HCI Event: Number of Completed Packets (0x13) plen 5    #175 [hci1] 13.847016
        Num handles: 1
        Handle: 2685 Address: DF:A9:FF:F6:B1:1A (OUI DF-A9-FF)
        Count: 1
        #174: len 21 (1 Kb/s)
        Latency: 157 msec (67-172 msec ~159 msec)
> ACL Data RX: Handle 2685 flags 0x02 dlen 21             #176 [hci1] 13.934851
      SMP: Pairing Confirm (0x03) len 16
        Confim value: cae5b444586ada07fcbe565610390940
< HCI Command: Host Number of Com.. (0x03|0x0035) plen 5  #177 [hci1] 13.950095
        Num handles: 1
        Handle: 2685 Address: DF:A9:FF:F6:B1:1A (OUI DF-A9-FF)
        Count: 1
< ACL Data TX: Handle 2685 flags 0x00 dlen 21             #178 [hci1] 13.950254
      SMP: Pairing Confirm (0x03) len 16
        Confim value: 9a72e6666b89deb214550c6ac51524a6
> HCI Event: Number of Completed Packets (0x13) plen 5    #179 [hci1] 14.109720
        Num handles: 1
        Handle: 2685 Address: DF:A9:FF:F6:B1:1A (OUI DF-A9-FF)
        Count: 1
        #178: len 21 (1 Kb/s)
        Latency: 159 msec (67-172 msec ~159 msec)
> ACL Data RX: Handle 2685 flags 0x02 dlen 21             #180 [hci1] 14.110018
      SMP: Pairing Random (0x04) len 16
        Random value: 9511e403f6c9151e0000000000000000
< HCI Command: Host Number of Com.. (0x03|0x0035) plen 5  #181 [hci1] 14.129901
        Num handles: 1
        Handle: 2685 Address: DF:A9:FF:F6:B1:1A (OUI DF-A9-FF)
        Count: 1
< ACL Data TX: Handle 2685 flags 0x00 dlen 21             #182 [hci1] 14.129966
      SMP: Pairing Random (0x04) len 16
        Random value: 25a9493fd3ce4faf02be7293595bb7c6
> HCI Event: Number of Completed Packets (0x13) plen 5    #183 [hci1] 14.284486
        Num handles: 1
        Handle: 2685 Address: DF:A9:FF:F6:B1:1A (OUI DF-A9-FF)
        Count: 1
        #182: len 21 (1 Kb/s)
        Latency: 154 msec (67-172 msec ~157 msec)
> ACL Data RX: Handle 2685 flags 0x02 dlen 21             #184 [hci1] 14.372283
      SMP: Pairing Confirm (0x03) len 16
        Confim value: 62363cff1dc5787aa11d1aa6bf7c06c2
< HCI Command: Host Number of Com.. (0x03|0x0035) plen 5  #185 [hci1] 14.389617
        Num handles: 1
        Handle: 2685 Address: DF:A9:FF:F6:B1:1A (OUI DF-A9-FF)
        Count: 1
< ACL Data TX: Handle 2685 flags 0x00 dlen 21             #186 [hci1] 14.389780
      SMP: Pairing Confirm (0x03) len 16
        Confim value: 2d783a1f3ea59f69b885dae419e05545
> HCI Event: Number of Completed Packets (0x13) plen 5    #187 [hci1] 14.547231
        Num handles: 1
        Handle: 2685 Address: DF:A9:FF:F6:B1:1A (OUI DF-A9-FF)
        Count: 1
        #186: len 21 (1 Kb/s)
        Latency: 157 msec (67-172 msec ~157 msec)
> ACL Data RX: Handle 2685 flags 0x02 dlen 21             #188 [hci1] 14.547515
      SMP: Pairing Random (0x04) len 16
        Random value: d43c34e3778dab550000000000000000
< HCI Command: Host Number of Com.. (0x03|0x0035) plen 5  #189 [hci1] 14.549633
        Num handles: 1
        Handle: 2685 Address: DF:A9:FF:F6:B1:1A (OUI DF-A9-FF)
        Count: 1
< ACL Data TX: Handle 2685 flags 0x00 dlen 21             #190 [hci1] 14.549725
      SMP: Pairing Random (0x04) len 16
        Random value: 58f6b41f855a6f6c3560debd84e2affc
> HCI Event: Number of Completed Packets (0x13) plen 5    #191 [hci1] 14.722049
        Num handles: 1
        Handle: 2685 Address: DF:A9:FF:F6:B1:1A (OUI DF-A9-FF)
        Count: 1
        #190: len 21 (0 Kb/s)
        Latency: 172 msec (67-172 msec ~164 msec)
> ACL Data RX: Handle 2685 flags 0x02 dlen 21             #192 [hci1] 14.809760
      SMP: Pairing Confirm (0x03) len 16
        Confim value: c561edaa477151930585907a9ddbf212
< HCI Command: Host Number of Com.. (0x03|0x0035) plen 5  #193 [hci1] 14.829538
        Num handles: 1
        Handle: 2685 Address: DF:A9:FF:F6:B1:1A (OUI DF-A9-FF)
        Count: 1
< ACL Data TX: Handle 2685 flags 0x00 dlen 21             #194 [hci1] 14.829564
      SMP: Pairing Confirm (0x03) len 16
        Confim value: adfc978fbbb9fce1aae71158fc4a0223
> HCI Event: Number of Completed Packets (0x13) plen 5    #195 [hci1] 14.984731
        Num handles: 1
        Handle: 2685 Address: DF:A9:FF:F6:B1:1A (OUI DF-A9-FF)
        Count: 1
        #194: len 21 (1 Kb/s)
        Latency: 155 msec (67-172 msec ~159 msec)
> ACL Data RX: Handle 2685 flags 0x02 dlen 21             #196 [hci1] 14.984976
      SMP: Pairing Random (0x04) len 16
        Random value: d287ccf4739555f30000000000000000
< HCI Command: Host Number of Com.. (0x03|0x0035) plen 5  #197 [hci1] 14.990267
        Num handles: 1
        Handle: 2685 Address: DF:A9:FF:F6:B1:1A (OUI DF-A9-FF)
        Count: 1
< ACL Data TX: Handle 2685 flags 0x00 dlen 21             #198 [hci1] 14.990360
      SMP: Pairing Random (0x04) len 16
        Random value: b67e7216d5bf664139eda2b542549666
> HCI Event: Number of Completed Packets (0x13) plen 5    #199 [hci1] 15.159439
        Num handles: 1
        Handle: 2685 Address: DF:A9:FF:F6:B1:1A (OUI DF-A9-FF)
        Count: 1
        #198: len 21 (0 Kb/s)
        Latency: 169 msec (67-172 msec ~164 msec)
> ACL Data RX: Handle 2685 flags 0x02 dlen 21             #200 [hci1] 15.247432
      SMP: Pairing Confirm (0x03) len 16
        Confim value: ba475daf004179be792b574570e3a77f
< HCI Command: Host Number of Com.. (0x03|0x0035) plen 5  #201 [hci1] 15.249919
        Num handles: 1
        Handle: 2685 Address: DF:A9:FF:F6:B1:1A (OUI DF-A9-FF)
        Count: 1
< ACL Data TX: Handle 2685 flags 0x00 dlen 21             #202 [hci1] 15.250067
      SMP: Pairing Confirm (0x03) len 16
        Confim value: 8a11d2bae1051bf2d35f9f897277493b
> HCI Event: Number of Completed Packets (0x13) plen 5    #203 [hci1] 15.422085
        Num handles: 1
        Handle: 2685 Address: DF:A9:FF:F6:B1:1A (OUI DF-A9-FF)
        Count: 1
        #202: len 21 (0 Kb/s)
        Latency: 172 msec (67-172 msec ~168 msec)
> ACL Data RX: Handle 2685 flags 0x02 dlen 21             #204 [hci1] 15.422493
      SMP: Pairing Random (0x04) len 16
        Random value: abc0ea388fde8a540000000000000000
< HCI Command: Host Number of Com.. (0x03|0x0035) plen 5  #205 [hci1] 15.429828
        Num handles: 1
        Handle: 2685 Address: DF:A9:FF:F6:B1:1A (OUI DF-A9-FF)
        Count: 1
< ACL Data TX: Handle 2685 flags 0x00 dlen 21             #206 [hci1] 15.429836
      SMP: Pairing Random (0x04) len 16
        Random value: ed17f76500c95219dd01e09d1e63f87b
> HCI Event: Number of Completed Packets (0x13) plen 5    #207 [hci1] 15.596935
        Num handles: 1
        Handle: 2685 Address: DF:A9:FF:F6:B1:1A (OUI DF-A9-FF)
        Count: 1
        #206: len 21 (1 Kb/s)
        Latency: 167 msec (67-172 msec ~167 msec)
> ACL Data RX: Handle 2685 flags 0x02 dlen 21             #208 [hci1] 15.684795
      SMP: Pairing Confirm (0x03) len 16
        Confim value: cce80ad951fc152f8d068b4b1304c68c
< HCI Command: Host Number of Com.. (0x03|0x0035) plen 5  #209 [hci1] 15.689789
        Num handles: 1
        Handle: 2685 Address: DF:A9:FF:F6:B1:1A (OUI DF-A9-FF)
        Count: 1
< ACL Data TX: Handle 2685 flags 0x00 dlen 21             #210 [hci1] 15.689913
      SMP: Pairing Confirm (0x03) len 16
        Confim value: f1e67223344dec81cee7865a789e1b36
> HCI Event: Number of Completed Packets (0x13) plen 5    #211 [hci1] 15.859680
        Num handles: 1
        Handle: 2685 Address: DF:A9:FF:F6:B1:1A (OUI DF-A9-FF)
        Count: 1
        #210: len 21 (0 Kb/s)
        Latency: 169 msec (67-172 msec ~168 msec)
> ACL Data RX: Handle 2685 flags 0x02 dlen 21             #212 [hci1] 15.860039
      SMP: Pairing Random (0x04) len 16
        Random value: 975f77629f79cce40000000000000000
< HCI Command: Host Number of Com.. (0x03|0x0035) plen 5  #213 [hci1] 15.870273
        Num handles: 1
        Handle: 2685 Address: DF:A9:FF:F6:B1:1A (OUI DF-A9-FF)
        Count: 1
< ACL Data TX: Handle 2685 flags 0x00 dlen 21             #214 [hci1] 15.870481
      SMP: Pairing Random (0x04) len 16
        Random value: 81d35d47e1f6006d79c974bd9d9e1ee3
> HCI Event: Number of Completed Packets (0x13) plen 5    #215 [hci1] 16.034432
        Num handles: 1
        Handle: 2685 Address: DF:A9:FF:F6:B1:1A (OUI DF-A9-FF)
        Count: 1
        #214: len 21 (1 Kb/s)
        Latency: 163 msec (67-172 msec ~166 msec)
> ACL Data RX: Handle 2685 flags 0x02 dlen 21             #216 [hci1] 16.122246
      SMP: Pairing Confirm (0x03) len 16
        Confim value: dccb4b4689141fd2b91bccf530773b2f
< HCI Command: Host Number of Com.. (0x03|0x0035) plen 5  #217 [hci1] 16.129866
        Num handles: 1
        Handle: 2685 Address: DF:A9:FF:F6:B1:1A (OUI DF-A9-FF)
        Count: 1
< ACL Data TX: Handle 2685 flags 0x00 dlen 21             #218 [hci1] 16.130011
      SMP: Pairing Confirm (0x03) len 16
        Confim value: da352c09251b38327871d9f3be552b84
> HCI Event: Number of Completed Packets (0x13) plen 5    #219 [hci1] 16.297110
        Num handles: 1
        Handle: 2685 Address: DF:A9:FF:F6:B1:1A (OUI DF-A9-FF)
        Count: 1
        #218: len 21 (1 Kb/s)
        Latency: 167 msec (67-172 msec ~166 msec)
> ACL Data RX: Handle 2685 flags 0x02 dlen 21             #220 [hci1] 16.297533
      SMP: Pairing Random (0x04) len 16
        Random value: 151c8375eaa9a8f30000000000000000
< HCI Command: Host Number of Com.. (0x03|0x0035) plen 5  #221 [hci1] 16.309882
        Num handles: 1
        Handle: 2685 Address: DF:A9:FF:F6:B1:1A (OUI DF-A9-FF)
        Count: 1
< ACL Data TX: Handle 2685 flags 0x00 dlen 21             #222 [hci1] 16.309956
      SMP: Pairing Random (0x04) len 16
        Random value: e7f7e0c2476823e41736a7e381bafb7c
> HCI Event: Number of Completed Packets (0x13) plen 5    #223 [hci1] 16.471943
        Num handles: 1
        Handle: 2685 Address: DF:A9:FF:F6:B1:1A (OUI DF-A9-FF)
        Count: 1
        #222: len 21 (1 Kb/s)
        Latency: 161 msec (67-172 msec ~164 msec)
> ACL Data RX: Handle 2685 flags 0x02 dlen 21             #224 [hci1] 16.559774
      SMP: Pairing Confirm (0x03) len 16
        Confim value: 7682063726a18d4fd2af1a88df29ca83
< HCI Command: Host Number of Com.. (0x03|0x0035) plen 5  #225 [hci1] 16.570055
        Num handles: 1
        Handle: 2685 Address: DF:A9:FF:F6:B1:1A (OUI DF-A9-FF)
        Count: 1
< ACL Data TX: Handle 2685 flags 0x00 dlen 21             #226 [hci1] 16.570231
      SMP: Pairing Confirm (0x03) len 16
        Confim value: 2dc9a7895626fa4aea1d9fa435356a99
> HCI Event: Number of Completed Packets (0x13) plen 5    #227 [hci1] 16.734659
        Num handles: 1
        Handle: 2685 Address: DF:A9:FF:F6:B1:1A (OUI DF-A9-FF)
        Count: 1
        #226: len 21 (1 Kb/s)
        Latency: 164 msec (67-172 msec ~164 msec)
> ACL Data RX: Handle 2685 flags 0x02 dlen 21             #228 [hci1] 16.734922
      SMP: Pairing Random (0x04) len 16
        Random value: 1f06f5b846733bd30000000000000000
