Bluetooth monitor ver 5.84
btmon[401785]: = Note: Linux version 6.8.0-83-generic (x86_64)                                                           0.410918
btmon[401785]: = Note: Bluetooth subsystem version 2.22                                                                  0.410920
= New Index: 00:00:00:00:00:00 (Primary,UART,hci0)                                                                       0.410921
= Open Index: 00:00:00:00:00:00                                                                                          0.917845
= Index Info: 00:00:00:00:00:00 (Nordic Semiconductor ASA)                                                               0.917849
zephyr.exe[401787]: @ USER Open: main (privileged) version 2.22                                                 {0x0001} 0.917851
zephyr.exe[401787]: < HCI Command: Reset (0x03|0x0003) plen 0                                                         #1 0.918043
> HCI Event: Command Complete (0x0e) plen 4                                                                           #2 0.918916
      Reset (0x03|0x0003) ncmd 1
        Status: Success (0x00)
zephyr.exe[401787]: < HCI Command: Read Local Supported Features (0x04|0x0003) plen 0                                 #3 0.937771
> HCI Event: Command Complete (0x0e) plen 12                                                                          #4 0.938279
      Read Local Supported Features (0x04|0x0003) ncmd 1
        Status: Success (0x00)
        Features: 0x00 0x00 0x00 0x00 0x60 0x00 0x00 0x00
          BR/EDR Not Supported
          LE Supported (Controller)
zephyr.exe[401787]: < HCI Command: Read Local Version Information (0x04|0x0001) plen 0                                #5 0.957785
> HCI Event: Command Complete (0x0e) plen 12                                                                          #6 0.958756
      Read Local Version Information (0x04|0x0001) ncmd 1
        Status: Success (0x00)
        HCI version: Reserved (0x0e) - Revision 12520 (0x30e8)
        LMP version: Reserved (0x0e) - Subversion 12520 (0x30e8)
        Manufacturer: Nordic Semiconductor ASA (89)
zephyr.exe[401787]: < HCI Command: Read Local Supported Commands (0x04|0x0002) plen 0                                 #7 0.977778
> HCI Event: Command Complete (0x0e) plen 68                                                                          #8 0.978970
      Read Local Supported Commands (0x04|0x0002) ncmd 1
        Status: Success (0x00)
        Commands: 119 entries
          Disconnect (Octet 0 - Bit 5)
          Read Remote Version Information (Octet 2 - Bit 7)
          Set Event Mask (Octet 5 - Bit 6)
          Reset (Octet 5 - Bit 7)
          Read Connection Accept Timeout (Octet 7 - Bit 2)
          Write Connection Accept Timeout (Octet 7 - Bit 3)
          Read Transmit Power Level (Octet 10 - Bit 2)
          Set Controller To Host Flow Control (Octet 10 - Bit 5)
          Host Buffer Size (Octet 10 - Bit 6)
          Host Number of Completed Packets (Octet 10 - Bit 7)
          Read Local Version Information (Octet 14 - Bit 3)
          Read Local Supported Features (Octet 14 - Bit 5)
          Read BD ADDR (Octet 15 - Bit 1)
          Read RSSI (Octet 15 - Bit 5)
          Set Event Mask Page 2 (Octet 22 - Bit 2)
          LE Set Event Mask (Octet 25 - Bit 0)
          LE Read Buffer Size (Octet 25 - Bit 1)
          LE Read Local Supported Features (Octet 25 - Bit 2)
          LE Set Random Address (Octet 25 - Bit 4)
          LE Set Advertising Parameters (Octet 25 - Bit 5)
          LE Read Advertising Channel TX Power (Octet 25 - Bit 6)
          LE Set Advertising Data (Octet 25 - Bit 7)
          LE Set Scan Response Data (Octet 26 - Bit 0)
          LE Set Advertise Enable (Octet 26 - Bit 1)
          LE Set Scan Parameters (Octet 26 - Bit 2)
          LE Set Scan Enable (Octet 26 - Bit 3)
          LE Create Connection (Octet 26 - Bit 4)
          LE Create Connection Cancel (Octet 26 - Bit 5)
          LE Read Accept List Size (Octet 26 - Bit 6)
          LE Clear Accept List (Octet 26 - Bit 7)
          LE Add Device To Accept List (Octet 27 - Bit 0)
          LE Remove Device From Accept List (Octet 27 - Bit 1)
          LE Connection Update (Octet 27 - Bit 2)
          LE Set Host Channel Classification (Octet 27 - Bit 3)
          LE Read Channel Map (Octet 27 - Bit 4)
          LE Read Remote Used Features (Octet 27 - Bit 5)
          LE Encrypt (Octet 27 - Bit 6)
          LE Rand (Octet 27 - Bit 7)
          LE Start Encryption (Octet 28 - Bit 0)
          LE Long Term Key Request Reply (Octet 28 - Bit 1)
          LE Long Term Key Request Neg Reply (Octet 28 - Bit 2)
          LE Read Supported States (Octet 28 - Bit 3)
          LE Receiver Test (Octet 28 - Bit 4)
          LE Transmitter Test (Octet 28 - Bit 5)
          LE Test End (Octet 28 - Bit 6)
          Read Authenticated Payload Timeout (Octet 32 - Bit 4)
          Write Authenticated Payload Timeout (Octet 32 - Bit 5)
          LE Set Data Length (Octet 33 - Bit 6)
          LE Read Suggested Default Data Length (Octet 33 - Bit 7)
          LE Write Suggested Default Data Length (Octet 34 - Bit 0)
          LE Add Device To Resolving List (Octet 34 - Bit 3)
          LE Remove Device From Resolving List (Octet 34 - Bit 4)
          LE Clear Resolving List (Octet 34 - Bit 5)
          LE Read Resolving List Size (Octet 34 - Bit 6)
          LE Set Address Resolution Enable (Octet 35 - Bit 1)
          LE Set Resolvable Private Address Timeout (Octet 35 - Bit 2)
          LE Read Maximum Data Length (Octet 35 - Bit 3)
          LE Read PHY (Octet 35 - Bit 4)
          LE Set Default PHY (Octet 35 - Bit 5)
          LE Set PHY (Octet 35 - Bit 6)
          LE Enhanced Receiver Test (Octet 35 - Bit 7)
          LE Enhanced Transmitter Test (Octet 36 - Bit 0)
          LE Set Advertising Set Random Address (Octet 36 - Bit 1)
          LE Set Extended Advertising Parameters (Octet 36 - Bit 2)
          LE Set Extended Advertising Data (Octet 36 - Bit 3)
          LE Set Extended Scan Response Data (Octet 36 - Bit 4)
          LE Set Extended Advertising Enable (Octet 36 - Bit 5)
          LE Read Maximum Advertising Data Length (Octet 36 - Bit 6)
          LE Read Number of Supported Advertising Sets (Octet 36 - Bit 7)
          LE Remove Advertising Set (Octet 37 - Bit 0)
          LE Clear Advertising Sets (Octet 37 - Bit 1)
          LE Set Periodic Advertising Parameters (Octet 37 - Bit 2)
          LE Set Periodic Advertising Data (Octet 37 - Bit 3)
          LE Set Periodic Advertising Enable (Octet 37 - Bit 4)
          LE Set Extended Scan Parameters (Octet 37 - Bit 5)
          LE Set Extended Scan Enable (Octet 37 - Bit 6)
          LE Extended Create Connection (Octet 37 - Bit 7)
          LE Periodic Advertising Create Sync (Octet 38 - Bit 0)
          LE Periodic Advertising Create Sync Cancel (Octet 38 - Bit 1)
          LE Periodic Advertising Terminate Sync (Octet 38 - Bit 2)
          LE Add Device To Periodic Advertiser List (Octet 38 - Bit 3)
          LE Remove Device From Periodic Advertiser List (Octet 38 - Bit 4)
          LE Clear Periodic Advertiser List (Octet 38 - Bit 5)
          LE Read Periodic Advertiser List Size (Octet 38 - Bit 6)
          LE Read Transmit Power (Octet 38 - Bit 7)
          LE Read RF Path Compensation (Octet 39 - Bit 0)
          LE Write RF Path Compensation (Octet 39 - Bit 1)
          LE Set Privacy Mode (Octet 39 - Bit 2)
          LE Periodic Advertising Receive Enable (Octet 40 - Bit 5)
          LE Periodic Advertising Sync Transfer (Octet 40 - Bit 6)
          LE Periodic Advertising Set Info Transfer (Octet 40 - Bit 7)
          LE Periodic Advertising Sync Transfer Parameters (Octet 41 - Bit 0)
          LE Set Default Periodic Advertisng Sync Transfer Parameters (Octet 41 - Bit 1)
          LE Read Buffer v2 (Octet 41 - Bit 5)
          LE Read ISO TX Sync (Octet 41 - Bit 6)
          LE Set Connected Isochronous Group Parameters (Octet 41 - Bit 7)
          LE Set Connected Isochronous Group Parameters Test (Octet 42 - Bit 0)
          LE Create Connected Isochronous Stream (Octet 42 - Bit 1)
          LE Remove Connected Isochronous Group (Octet 42 - Bit 2)
          LE Accept Connected Isochronous Stream Request (Octet 42 - Bit 3)
          LE Reject Connected Isochronous Stream Request (Octet 42 - Bit 4)
          LE Create Broadcast Isochronous Group (Octet 42 - Bit 5)
          LE Create Broadcast Isochronous Group Test (Octet 42 - Bit 6)
          LE Terminate Broadcast Isochronous Group (Octet 42 - Bit 7)
          LE Broadcast Isochronous Group Create Sync (Octet 43 - Bit 0)
          LE Broadcast Isochronous Group Terminate Sync (Octet 43 - Bit 1)
          LE Request Peer SCA (Octet 43 - Bit 2)
          LE Setup Isochronous Data Path (Octet 43 - Bit 3)
          LE Remove Isochronous Data Path (Octet 43 - Bit 4)
          LE Isochronous Transmit Test (Octet 43 - Bit 5)
          LE Isochronous Receive Test (Octet 43 - Bit 6)
          LE Isochronous Read Test Counters (Octet 43 - Bit 7)
          LE Isochronous Read Test Counters (Octet 44 - Bit 0)
          LE Set Host Feature (Octet 44 - Bit 1)
          LE Read ISO link quality (Octet 44 - Bit 2)
          Octet 45 - Bit 6 
          Octet 46 - Bit 0 
          Octet 46 - Bit 1 
          Octet 46 - Bit 2 
zephyr.exe[401787]: < HCI Command: Host Buffer Size (0x03|0x0033) plen 7                                              #9 0.997778
        ACL MTU: 255  ACL max packet: 16
        SCO MTU: 0    SCO max packet: 0
> HCI Event: Command Complete (0x0e) plen 4                                                                          #10 0.998248
      Host Buffer Size (0x03|0x0033) ncmd 1
        Status: Success (0x00)
zephyr.exe[401787]: < HCI Command: Set Controller To Host Flow Control (0x03|0x0031) plen 1                          #11 1.017771
        Flow control: ACL Data Packets (0x01)
> HCI Event: Command Complete (0x0e) plen 4                                                                          #12 1.018719
      Set Controller To Host Flow Control (0x03|0x0031) ncmd 1
        Status: Success (0x00)
zephyr.exe[401787]: < HCI Command: LE Read Local Supported Features (0x08|0x0003) plen 0                             #13 1.037765
> HCI Event: Command Complete (0x0e) plen 12                                                                         #14 1.038510
      LE Read Local Supported Features (0x08|0x0003) ncmd 1
        Status: Success (0x00)
        Features: 0xfd 0x79 0x00 0xf7 0x30 0x01 0x00 0x00
          LE Encryption
          Extended Reject Indication
          Peripheral-initiated Features Exchange
          LE Ping
          LE Data Packet Length Extension
          LL Privacy
          Extended Scanner Filter Policies
          LE 2M PHY
          LE Coded PHY
          LE Extended Advertising
          LE Periodic Advertising
          Channel Selection Algorithm #2
          Periodic Advertising Sync Transfer - Sender
          Periodic Advertising Sync Transfer - Recipient
          Sleep Clock Accuracy Updates
          Connected Isochronous Stream - Central
          Connected Isochronous Stream - Peripheral
          Isochronous Broadcaster
          Synchronized Receiver
          Periodic Advertising ADI support
          Connection Subrating
          Unknown features (0x0000010000000000)
zephyr.exe[401787]: < HCI Command: LE Set Host Feature (0x08|0x0074) plen 2                                          #15 1.057778
        Bit Number: 32
          Connected Isochronous Stream (Host Support)
        Bit Value: 1
> HCI Event: Command Complete (0x0e) plen 4                                                                          #16 1.058285
      LE Set Host Feature (0x08|0x0074) ncmd 1
        Status: Success (0x00)
zephyr.exe[401787]: < HCI Command: LE Read Buffer v2 (0x08|0x0060) plen 0                                            #17 1.077751
> HCI Event: Command Complete (0x0e) plen 10                                                                         #18 1.078479
      LE Read Buffer v2 (0x08|0x0060) ncmd 1
        Status: Success (0x00)
        ACL MTU: 27
        ACL max packet: 3
        ISO MTU: 318
        ISO max packet: 3
zephyr.exe[401787]: < HCI Command: LE Read Maximum Advertising Data Length (0x08|0x003a) plen 0                      #19 1.097794
> HCI Event: Command Complete (0x0e) plen 6                                                                          #20 1.098288
      LE Read Maximum Advertising Data Length (0x08|0x003a) ncmd 1
        Status: Success (0x00)
        Max length: 1650
zephyr.exe[401787]: < HCI Command: LE Read Supported States (0x08|0x001c) plen 0                                     #21 1.117770
> HCI Event: Command Complete (0x0e) plen 12                                                                         #22 1.118284
      LE Read Supported States (0x08|0x001c) ncmd 1
        Status: Success (0x00)
        States: 0x000003ff3e0306ff
          Non-connectable Advertising State
          Scannable Advertising State
          Connectable Advertising State
          High Duty Cycle Directed Advertising State
          Passive Scanning State
          Active Scanning State
          Initiating State
            and Connection State (Central Role)
          Connection State (Peripheral Role)
          Scannable Advertising State
            and Passive Scanning State
          Connectable Advertising State
            and Passive Scanning State
          Non-connectable Advertising State
            and Initiating State
          Scannable Advertising State
            and Initiating State
          Active Scanning State
            and Connection State (Central Role)
          Passive Scanning State
            and Connection State (Peripheral Role)
          Active Scanning State
            and Connection State (Peripheral Role)
          Initiating State
            and Connection State (Central Role)
            and Central Role & Central Role
          Low Duty Cycle Directed Advertising State
          Connectable Advertising State
            and Initiating State
            and Central Role & Peripheral Role
          High Duty Cycle Directed Advertising State
            and Initiating State
            and Central Role & Peripheral Role
          Low Duty Cycle Directed Advertising State
            and Initiating State
            and Central Role & Peripheral Role
          Connectable Advertising State
            and Connection State (Central Role)
            and Central Role & Peripheral Role
          High Duty Cycle Directed Advertising State
            and Connection State (Central Role)
            and Central Role & Peripheral Role
          Low Duty Cycle Directed Advertising State
            and Connection State (Central Role)
            and Central Role & Peripheral Role
          Connectable Advertising State
            and Connection State (Peripheral Role)
            and Central Role & Peripheral Role
          High Duty Cycle Directed Advertising State
            and Connection State (Peripheral Role)
            and Peripheral Role & Peripheral Role
          Low Duty Cycle Directed Advertising State
            and Connection State (Peripheral Role)
            and Peripheral Role & Peripheral Role
          Initiating State
            and Connection State (Peripheral Role)
            and Central Role & Peripheral Role
zephyr.exe[401787]: < HCI Command: LE Read Maximum Data Length (0x08|0x002f) plen 0                                  #23 1.137768
> HCI Event: Command Complete (0x0e) plen 12                                                                         #24 1.139034
      LE Read Maximum Data Length (0x08|0x002f) ncmd 1
        Status: Success (0x00)
        Max TX octets: 251
        Max TX time: 2704
        Max RX octets: 251
        Max RX time: 2704
zephyr.exe[401787]: < HCI Command: LE Write Suggested Default Data Length (0x08|0x0024) plen 4                       #25 1.157748
        TX octets: 251
        TX time: 2704
> HCI Event: Command Complete (0x0e) plen 4                                                                          #26 1.158730
      LE Write Suggested Default Data Length (0x08|0x0024) ncmd 1
        Status: Success (0x00)
zephyr.exe[401787]: < HCI Command: LE Read Resolving List Size (0x08|0x002a) plen 0                                  #27 1.177726
> HCI Event: Command Complete (0x0e) plen 5                                                                          #28 1.178488
      LE Read Resolving List Size (0x08|0x002a) ncmd 1
        Status: Success (0x00)
        Size: 8
zephyr.exe[401787]: < HCI Command: LE Set Event Mask (0x08|0x0001) plen 8                                            #29 1.197785
        Mask: 0x000002023f87fa5e
          LE Advertising Report
          LE Connection Update Complete
          LE Read Remote Used Features Complete
          LE Long Term Key Request
          LE Data Length Change
          LE Enhanced Connection Complete
          LE PHY Update Complete
          LE Extended Advertising Report
          LE Periodic Advertising Sync Established
          LE Periodic Advertising Report
          LE Periodic Advertising Sync Lost
          LE Extended Scan Timeout
          LE Extended Advertising Set Terminated
          LE Scan Request Received
          LE Periodic Advertising Sync Transfer Rvc
          LE CIS Established
          LE CIS Request
          LE Create BIG Complete
          LE Terminate BIG Complete
          LE BIG Sync Established Complete
          LE BIG Sync Lost
          LE BIG Info Advertising Report
          Unknown mask (0x0000020000000000)
> HCI Event: Command Complete (0x0e) plen 4                                                                          #30 1.199221
      LE Set Event Mask (0x08|0x0001) ncmd 1
        Status: Success (0x00)
zephyr.exe[401787]: < HCI Command: Set Event Mask (0x03|0x0001) plen 8                                               #31 1.217744
        Mask: 0x2000800002008890
          Disconnection Complete
          Encryption Change
          Read Remote Version Information Complete
          Hardware Error
          Data Buffer Overflow
          Encryption Key Refresh Complete
          LE Meta
> HCI Event: Command Complete (0x0e) plen 4                                                                          #32 1.218301
      Set Event Mask (0x03|0x0001) ncmd 1
        Status: Success (0x00)
zephyr.exe[401787]: < HCI Command: Read BD ADDR (0x04|0x0009) plen 0                                                 #33 1.237766
> HCI Event: Command Complete (0x0e) plen 10                                                                         #34 1.238672
      Read BD ADDR (0x04|0x0009) ncmd 1
        Status: Success (0x00)
        Address: 00:00:00:00:00:00 (OUI 00-00-00)
zephyr.exe[401787]: < HCI Command: LE Set Random Address (0x08|0x0005) plen 6                                        #35 1.257773
        Address: D5:B6:CC:31:DB:3B (Static)
> HCI Event: Command Complete (0x0e) plen 4                                                                          #36 1.258524
      LE Set Random Address (0x08|0x0005) ncmd 1
        Status: Success (0x00)
zephyr.exe[401787]: < HCI Command: LE Set Extended Advertising Parameters (0x08|0x0036) plen 25                      #37 1.807803
        Handle: 0x00
        Properties: 0x0001
          Connectable
        Min advertising interval: 100.000 msec (0x00a0)
        Max advertising interval: 150.000 msec (0x00f0)
        Channel map: 37, 38, 39 (0x07)
        Own address type: Random (0x01)
        Peer address type: Public (0x00)
        Peer address: 00:00:00:00:00:00 (OUI 00-00-00)
        Filter policy: Allow Scan Request from Any, Allow Connect Request from Any (0x00)
        TX power: Host has no preference (0x7f)
        Primary PHY: LE 1M (0x01)
        Secondary max skip: 0x00
        Secondary PHY: LE 2M (0x02)
        SID: 0x00
        Scan request notifications: Disabled (0x00)
> HCI Event: Command Complete (0x0e) plen 5                                                                          #38 1.808695
      LE Set Extended Advertising Parameters (0x08|0x0036) ncmd 1
        Status: Success (0x00)
        TX power (selected): 0 dbm (0x00)
zephyr.exe[401787]: < HCI Command: LE Set Advertising Set Random Address (0x08|0x0035) plen 7                        #39 1.817788
        Advertising handle: 0x00
        Advertising random address: D5:B6:CC:31:DB:3B (Static)
> HCI Event: Command Complete (0x0e) plen 4                                                                          #40 1.818561
      LE Set Advertising Set Random Address (0x08|0x0035) ncmd 1
        Status: Success (0x00)
zephyr.exe[401787]: < HCI Command: LE Set Extended Advertising Data (0x08|0x0037) plen 39                            #41 1.837800
        Handle: 0x00
        Operation: Complete extended advertising data (0x03)
        Fragment preference: Minimize fragmentation (0x01)
        Data length: 0x23
        Flags: 0x06
          LE General Discoverable Mode
          BR/EDR Not Supported
        Name (complete): Tester_F6B11A
        Flags: 0x06
          LE General Discoverable Mode
          BR/EDR Not Supported
        16-bit Service UUIDs (complete): 1 entry
          Audio Stream Control (0x184e)
        Service Data: Audio Stream Control (0x184e)
          Data[6]: 01ff0fff0f00
> HCI Event: Command Complete (0x0e) plen 4                                                                          #42 1.839162
      LE Set Extended Advertising Data (0x08|0x0037) ncmd 1
        Status: Success (0x00)
zephyr.exe[401787]: < HCI Command: LE Set Extended Advertising Enable (0x08|0x0039) plen 6                           #43 1.857784
        Extended advertising: Enabled (0x01)
        Number of sets: 1 (0x01)
        Entry 0
          Handle: 0x00
          Duration: 0 ms (0x00)
          Max ext adv events: 0
> HCI Event: Command Complete (0x0e) plen 4                                                                          #44 1.858791
      LE Set Extended Advertising Enable (0x08|0x0039) ncmd 1
        Status: Success (0x00)
> HCI Event: LE Meta Event (0x3e) plen 31                                                                            #45 6.082356
      LE Enhanced Connection Complete (0x0a)
        Status: Success (0x00)
        Handle: 3
        Role: Peripheral (0x01)
        Peer address type: Random (0x01)
        Peer address: C7:1B:DC:08:AA:BB (Static)
        Local resolvable private address: 00:00:00:00:00:00 (Non-Resolvable)
        Peer resolvable private address: 00:00:00:00:00:00 (Non-Resolvable)
        Connection interval: 60.00 msec (0x0030)
        Connection latency: 0 (0x0000)
        Supervision timeout: 25120 msec (0x09d0)
        Central clock accuracy: 0x01
> HCI Event: LE Meta Event (0x3e) plen 6                                                                             #46 6.082358
      LE Advertising Set Terminated (0x12)
        Status: Success (0x00)
        Handle: 0
        Connection handle: 3
        Number of completed extended advertising events: 0
zephyr.exe[401787]: < HCI Command: LE Read Remote Used Features (0x08|0x0016) plen 2                                 #47 6.098025
        Handle: 3 Address: C7:1B:DC:08:AA:BB (Static)
> HCI Event: Command Status (0x0f) plen 4                                                                            #48 6.098535
      LE Read Remote Used Features (0x08|0x0016) ncmd 1
        Status: Success (0x00)
zephyr.exe[401787]: < ACL Data TX: Handle 3 [1/3] flags 0x00 dlen 7                                                  #49 6.117847
      ATT: Exchange MTU Request (0x02) len 2
        Client RX MTU: 251
> HCI Event: Number of Completed Packets (0x13) plen 5                                                               #50 6.204305
        Num handles: 1
        Handle: 3 Address: C7:1B:DC:08:AA:BB (Static)
        Count: 1
        Buffers: 0/3
        #49: len 7 (0 Kb/s)
        Latency: 86 msec (86-86 msec ~86 msec)
> HCI Event: LE Meta Event (0x3e) plen 12                                                                            #51 6.264704
      LE Read Remote Used Features (0x04)
        Status: Success (0x00)
        Handle: 3 Address: C7:1B:DC:08:AA:BB (Static)
        Features: 0x2d 0x49 0x00 0xf7 0x67 0xd8 0x00 0x00
          LE Encryption
          Extended Reject Indication
          Peripheral-initiated Features Exchange
          LE Data Packet Length Extension
          LE 2M PHY
          LE Coded PHY
          Channel Selection Algorithm #2
          Periodic Advertising Sync Transfer - Sender
          Periodic Advertising Sync Transfer - Recipient
          Sleep Clock Accuracy Updates
          Connected Isochronous Stream - Central
          Connected Isochronous Stream - Peripheral
          Isochronous Broadcaster
          Synchronized Receiver
          Connected Isochronous Stream (Host Support)
          LE Power Control Request
          LE Power Control Request
          Connection Subrating
          Connection Subrating (Host Support)
          Unknown features (0x0000d80000000000)
> ACL Data RX: Handle 3 flags 0x02 dlen 7                                                                            #52 6.564411
      ATT: Exchange MTU Request (0x02) len 2
        Client RX MTU: 64
> ACL Data RX: Handle 3 flags 0x02 dlen 7                                                                            #53 6.564636
      ATT: Exchange MTU Response (0x03) len 2
        Server RX MTU: 64
zephyr.exe[401787]: < HCI Command: Host Number of Completed Packets (0x03|0x0035) plen 5                             #54 6.577916
        Num handles: 1
        Handle: 3 Address: C7:1B:DC:08:AA:BB (Static)
        Count: 1
zephyr.exe[401787]: < ACL Data TX: Handle 3 [1/3] flags 0x00 dlen 7                                                  #55 6.577981
      ATT: Exchange MTU Response (0x03) len 2
        Server RX MTU: 251
zephyr.exe[401787]: < HCI Command: Host Number of Completed Packets (0x03|0x0035) plen 5                             #56 6.577985
        Num handles: 1
        Handle: 3 Address: C7:1B:DC:08:AA:BB (Static)
        Count: 1
> HCI Event: Number of Completed Packets (0x13) plen 5                                                               #57 6.685049
        Num handles: 1
        Handle: 3 Address: C7:1B:DC:08:AA:BB (Static)
        Count: 1
        Buffers: 0/3
        #55: len 7 (0 Kb/s)
        Latency: 107 msec (86-107 msec ~96 msec)
zephyr.exe[401787]: < HCI Command: LE Remove Advertising Set (0x08|0x003c) plen 1                                    #58 6.947892
        Handle: 0
> HCI Event: Command Complete (0x0e) plen 4                                                                          #59 6.948495
      LE Remove Advertising Set (0x08|0x003c) ncmd 1
        Status: Success (0x00)
zephyr.exe[401787]: < HCI Command: LE Set Extended Advertising Parameters (0x08|0x0036) plen 25                      #60 6.957873
        Handle: 0x00
        Properties: 0x0001
          Connectable
        Min advertising interval: 100.000 msec (0x00a0)
        Max advertising interval: 150.000 msec (0x00f0)
        Channel map: 37, 38, 39 (0x07)
        Own address type: Random (0x01)
        Peer address type: Public (0x00)
        Peer address: 00:00:00:00:00:00 (OUI 00-00-00)
        Filter policy: Allow Scan Request from Any, Allow Connect Request from Any (0x00)
        TX power: Host has no preference (0x7f)
        Primary PHY: LE 1M (0x01)
        Secondary max skip: 0x00
        Secondary PHY: LE 2M (0x02)
        SID: 0x01
        Scan request notifications: Disabled (0x00)
> HCI Event: Command Complete (0x0e) plen 5                                                                          #61 6.958843
      LE Set Extended Advertising Parameters (0x08|0x0036) ncmd 1
        Status: Success (0x00)
        TX power (selected): 0 dbm (0x00)
zephyr.exe[401787]: < HCI Command: LE Set Advertising Set Random Address (0x08|0x0035) plen 7                        #62 6.977877
        Advertising handle: 0x00
        Advertising random address: D5:B6:CC:31:DB:3B (Static)
> HCI Event: Command Complete (0x0e) plen 4                                                                          #63 6.978471
      LE Set Advertising Set Random Address (0x08|0x0035) ncmd 1
        Status: Success (0x00)
zephyr.exe[401787]: < HCI Command: LE Set Extended Advertising Data (0x08|0x0037) plen 39                            #64 6.997877
        Handle: 0x00
        Operation: Complete extended advertising data (0x03)
        Fragment preference: Minimize fragmentation (0x01)
        Data length: 0x23
        Flags: 0x06
          LE General Discoverable Mode
          BR/EDR Not Supported
        Name (complete): Tester_F6B11A
        Flags: 0x06
          LE General Discoverable Mode
          BR/EDR Not Supported
        16-bit Service UUIDs (complete): 1 entry
          Audio Stream Control (0x184e)
        Service Data: Audio Stream Control (0x184e)
          Data[6]: 01ff0fff0f00
> HCI Event: Command Complete (0x0e) plen 4                                                                          #65 6.999043
      LE Set Extended Advertising Data (0x08|0x0037) ncmd 1
        Status: Success (0x00)
zephyr.exe[401787]: < HCI Command: LE Set Extended Advertising Enable (0x08|0x0039) plen 6                           #66 7.017874
        Extended advertising: Enabled (0x01)
        Number of sets: 1 (0x01)
        Entry 0
          Handle: 0x00
          Duration: 0 ms (0x00)
          Max ext adv events: 0
> HCI Event: Command Complete (0x0e) plen 4                                                                          #67 7.018540
      LE Set Extended Advertising Enable (0x08|0x0039) ncmd 1
        Status: Success (0x00)
> ACL Data RX: Handle 3 flags 0x02 dlen 11                                                                           #68 8.664391
      SMP: Pairing Request (0x01) len 6
        IO capability: KeyboardDisplay (0x04)
        OOB data: Authentication data not present (0x00)
        Authentication requirement: Bonding, No MITM, SC, No Keypresses (0x09)
        Max encryption key size: 16
        Initiator key distribution: EncKey IdKey (0x03)
        Responder key distribution: EncKey IdKey Sign (0x07)
zephyr.exe[401787]: < HCI Command: Host Number of Completed Packets (0x03|0x0035) plen 5                             #69 8.678039
        Num handles: 1
        Handle: 3 Address: C7:1B:DC:08:AA:BB (Static)
        Count: 1
zephyr.exe[401787]: < ACL Data TX: Handle 3 [1/3] flags 0x00 dlen 11                                                 #70 8.678044
      SMP: Pairing Response (0x02) len 6
        IO capability: NoInputNoOutput (0x03)
        OOB data: Authentication data not present (0x00)
        Authentication requirement: Bonding, No MITM, SC, No Keypresses (0x09)
        Max encryption key size: 16
        Initiator key distribution: IdKey (0x02)
        Responder key distribution: Sign (0x04)
> HCI Event: Number of Completed Packets (0x13) plen 5                                                               #71 8.784654
        Num handles: 1
        Handle: 3 Address: C7:1B:DC:08:AA:BB (Static)
        Count: 1
        Buffers: 0/3
        #70: len 11 (0 Kb/s)
        Latency: 106 msec (86-107 msec ~101 msec)
> ACL Data RX: Handle 3 flags 0x02 dlen 27                                                                           #72 8.785019
> ACL Data RX: Handle 3 flags 0x01 dlen 27                                                                           #73 8.785322
> ACL Data RX: Handle 3 flags 0x01 dlen 15                                                                           #74 8.785468
      SMP: Pairing Public Key (0x0c) len 64
        X[32]: 548f9d41c96dab3478a6c879d084668a31effe4322cf94ef066fecd9318f2115
        Y[32]: 985ef958aeba558ca11a4ea6527fecb84e680d47f76489504b3dcff9b23211d4
zephyr.exe[401787]: < HCI Command: Host Number of Completed Packets (0x03|0x0035) plen 5                             #75 8.798027
        Num handles: 1
        Handle: 3 Address: C7:1B:DC:08:AA:BB (Static)
        Count: 1
zephyr.exe[401787]: < HCI Command: Host Number of Completed Packets (0x03|0x0035) plen 5                             #76 8.798032
        Num handles: 1
        Handle: 3 Address: C7:1B:DC:08:AA:BB (Static)
        Count: 1
zephyr.exe[401787]: < HCI Command: Host Number of Completed Packets (0x03|0x0035) plen 5                             #77 8.798065
        Num handles: 1
        Handle: 3 Address: C7:1B:DC:08:AA:BB (Static)
        Count: 1
zephyr.exe[401787]: < ACL Data TX: Handle 3 [1/3] flags 0x00 dlen 27                                                 #78 8.798082
zephyr.exe[401787]: < ACL Data TX: Handle 3 flags 0x01 dlen 27                                                       #79 8.798146
zephyr.exe[401787]: < ACL Data TX: Handle 3 flags 0x01 dlen 15                                                       #80 8.798150
      SMP: Pairing Public Key (0x0c) len 64
        X[32]: 98308440221e2d910f0e54b71e7ec652857aa9b5a0dc65028824cc19db1226e9
        Y[32]: 67a4816bcb62efb21701e31fdb27561a6217575fb007a8bbdabe7e28b6f68482
> HCI Event: Number of Completed Packets (0x13) plen 5                                                               #81 8.844634
        Num handles: 1
        Handle: 3 Address: C7:1B:DC:08:AA:BB (Static)
        Count: 1
        Buffers: 0/3
        #78: len 27 (4 Kb/s)
        Latency: 46 msec (46-107 msec ~74 msec)
> HCI Event: Number of Completed Packets (0x13) plen 5                                                               #82 8.845347
        Num handles: 1
        Handle: 3 Address: C7:1B:DC:08:AA:BB (Static)
        Count: 1
        Buffers: underflow/3
        #79: len 27 (4 Kb/s)
        Latency: 47 msec (46-107 msec ~60 msec)
zephyr.exe[401787]: < ACL Data TX: Handle 3 [1/3] flags 0x00 dlen 21                                                 #83 8.857972
      SMP: Pairing Confirm (0x03) len 16
        Confirm value[16]: c379a79f09ca85f086e9716b27888d4c
> HCI Event: Number of Completed Packets (0x13) plen 5                                                               #84 8.904269
        Num handles: 1
        Handle: 3 Address: C7:1B:DC:08:AA:BB (Static)
        Count: 1
        Buffers: 0/3
        #80: len 15 (1 Kb/s)
        Latency: 106 msec (46-107 msec ~83 msec)
> HCI Event: Number of Completed Packets (0x13) plen 5                                                               #85 8.964303
        Num handles: 1
        Handle: 3 Address: C7:1B:DC:08:AA:BB (Static)
        Count: 1
        Buffers: underflow/3
        #83: len 21 (1 Kb/s)
        Latency: 106 msec (46-107 msec ~94 msec)
> ACL Data RX: Handle 3 flags 0x02 dlen 21                                                                           #86 8.964684
      SMP: Pairing Random (0x04) len 16
        Random value[16]: 0d87cc45c78923d30000000000000000
zephyr.exe[401787]: < HCI Command: Host Number of Completed Packets (0x03|0x0035) plen 5                             #87 8.978046
        Num handles: 1
        Handle: 3 Address: C7:1B:DC:08:AA:BB (Static)
        Count: 1
zephyr.exe[401787]: < ACL Data TX: Handle 3 [1/3] flags 0x00 dlen 21                                                 #88 8.978051
      SMP: Pairing Random (0x04) len 16
        Random value[16]: 8e6108f966a694cbe26df70bb96773e6
> HCI Event: Number of Completed Packets (0x13) plen 5                                                               #89 9.084470
        Num handles: 1
        Handle: 3 Address: C7:1B:DC:08:AA:BB (Static)
        Count: 1
        Buffers: 0/3
        #88: len 21 (1 Kb/s)
        Latency: 106 msec (46-107 msec ~100 msec)
> ACL Data RX: Handle 3 flags 0x02 dlen 21                                                                           #90 9.264380
      SMP: Pairing DHKey Check (0x0d) len 16
        E[16]: 302c560e8c6d213e3b0c8b2fe1cefbcb
zephyr.exe[401787]: < HCI Command: Host Number of Completed Packets (0x03|0x0035) plen 5                             #91 9.278083
        Num handles: 1
        Handle: 3 Address: C7:1B:DC:08:AA:BB (Static)
        Count: 1
zephyr.exe[401787]: < ACL Data TX: Handle 3 [1/3] flags 0x00 dlen 21                                                 #92 9.278148
      SMP: Pairing DHKey Check (0x0d) len 16
        E[16]: 61542e54f58aa70e3089cd3fb2d093bf
> HCI Event: Number of Completed Packets (0x13) plen 5                                                               #93 9.444646
        Num handles: 1
        Handle: 3 Address: C7:1B:DC:08:AA:BB (Static)
        Count: 1
        Buffers: 0/3
        #92: len 21 (1 Kb/s)
        Latency: 166 msec (46-166 msec ~133 msec)
> HCI Event: LE Meta Event (0x3e) plen 13                                                                            #94 9.504798
      LE Long Term Key Request (0x05)
        Handle: 3 Address: C7:1B:DC:08:AA:BB (Static)
        Random number: 0x0000000000000000
        Encrypted diversifier: 0x0000
zephyr.exe[401787]: < HCI Command: LE Long Term Key Request Reply (0x08|0x001a) plen 18                              #95 9.517990
        Handle: 3 Address: C7:1B:DC:08:AA:BB (Static)
        Long term key[16]: 93ca012dff5bc6934c802a6652ae6734
> HCI Event: Command Complete (0x0e) plen 6                                                                          #96 9.519185
      LE Long Term Key Request Reply (0x08|0x001a) ncmd 1
        Status: Success (0x00)
        Handle: 3 Address: C7:1B:DC:08:AA:BB (Static)
> HCI Event: Encryption Change (0x08) plen 4                                                                         #97 9.864411
        Status: Success (0x00)
        Handle: 3 Address: C7:1B:DC:08:AA:BB (Static)
        Encryption: Enabled with AES-CCM (0x01)
zephyr.exe[401787]: < ACL Data TX: Handle 3 [1/3] flags 0x00 dlen 21                                                 #98 9.988056
      SMP: Signing Information (0x0a) len 16
        Signature key[16]: 5da095555cc64d02679f89a05211af56
> HCI Event: Number of Completed Packets (0x13) plen 5                                                              #99 10.104481
        Num handles: 1
        Handle: 3 Address: C7:1B:DC:08:AA:BB (Static)
        Count: 1
        Buffers: 0/3
        #98: len 21 (1 Kb/s)
        Latency: 116 msec (46-166 msec ~124 msec)
> ACL Data RX: Handle 3 flags 0x02 dlen 21                                                                         #100 10.104594
      SMP: Identity Information (0x08) len 16
        Identity resolving key[16]: c5680e1cde07ae06071626ebb3473421
> ACL Data RX: Handle 3 flags 0x02 dlen 12                                                                         #101 10.104872
      SMP: Identity Address Information (0x09) len 7
        Address: C7:1B:DC:08:AA:BB (Static)
zephyr.exe[401787]: < HCI Command: Host Number of Completed Packets (0x03|0x0035) plen 5                           #102 10.118027
        Num handles: 1
        Handle: 3 Address: C7:1B:DC:08:AA:BB (Static)
        Count: 1
zephyr.exe[401787]: < HCI Command: LE Set Extended Advertising Enable (0x08|0x0039) plen 6                         #103 10.118103
        Extended advertising: Disabled (0x00)
        Number of sets: 1 (0x01)
        Entry 0
          Handle: 0x00
          Duration: 0 ms (0x00)
          Max ext adv events: 0
> HCI Event: Command Complete (0x0e) plen 4                                                                        #104 10.118689
      LE Set Extended Advertising Enable (0x08|0x0039) ncmd 1
        Status: Success (0x00)
zephyr.exe[401787]: < HCI Command: LE Add Device To Resolving List (0x08|0x0027) plen 39                           #105 10.137939
        Address type: Random (0x01)
        Address: C7:1B:DC:08:AA:BB (Static)
        Peer identity resolving key[16]: c5680e1cde07ae06071626ebb3473421
        Local identity resolving key[16]: 00000000000000000000000000000000
> HCI Event: Command Complete (0x0e) plen 4                                                                        #106 10.139308
      LE Add Device To Resolving List (0x08|0x0027) ncmd 1
        Status: Success (0x00)
zephyr.exe[401787]: < HCI Command: LE Set Privacy Mode (0x08|0x004e) plen 8                                        #107 10.158039
        Peer Identity address type: Random (0x01)
        Peer Identity address: C7:1B:DC:08:AA:BB (Static)
        Privacy Mode: Use Device Privacy (0x01)
> HCI Event: Command Complete (0x0e) plen 4                                                                        #108 10.158891
      LE Set Privacy Mode (0x08|0x004e) ncmd 1
        Status: Success (0x00)
zephyr.exe[401787]: < HCI Command: LE Set Address Resolution Enable (0x08|0x002d) plen 1                           #109 10.177954
        Address resolution: Enabled (0x01)
> HCI Event: Command Complete (0x0e) plen 4                                                                        #110 10.178557
      LE Set Address Resolution Enable (0x08|0x002d) ncmd 1
        Status: Success (0x00)
zephyr.exe[401787]: < HCI Command: LE Set Extended Advertising Enable (0x08|0x0039) plen 6                         #111 10.198005
        Extended advertising: Enabled (0x01)
        Number of sets: 1 (0x01)
        Entry 0
          Handle: 0x00
          Duration: 0 ms (0x00)
          Max ext adv events: 0
> HCI Event: Command Complete (0x0e) plen 4                                                                        #112 10.198888
      LE Set Extended Advertising Enable (0x08|0x0039) ncmd 1
        Status: Success (0x00)
zephyr.exe[401787]: < HCI Command: Host Number of Completed Packets (0x03|0x0035) plen 5                           #113 10.217916
        Num handles: 1
        Handle: 3 Address: C7:1B:DC:08:AA:BB (Static)
        Count: 1
> ACL Data RX: Handle 3 flags 0x02 dlen 13                                                                         #114 10.284428
      ATT: Find By Type Value Request (0x06) len 8
        Handle range: 0x0001-0xffff
        Attribute type: Primary Service (0x2800)
          UUID: Broadcast Audio Scan (0x184f)
zephyr.exe[401787]: < HCI Command: Host Number of Completed Packets (0x03|0x0035) plen 5                           #115 10.298032
        Num handles: 1
        Handle: 3 Address: C7:1B:DC:08:AA:BB (Static)
        Count: 1
zephyr.exe[401787]: < ACL Data TX: Handle 3 [1/3] flags 0x00 dlen 9                                                #116 10.298069
      ATT: Find By Type Value Response (0x07) len 4
        Handle range: 0x0047-0x004c
> HCI Event: Number of Completed Packets (0x13) plen 5                                                             #117 10.405102
        Num handles: 1
        Handle: 3 Address: C7:1B:DC:08:AA:BB (Static)
        Count: 1
        Buffers: 0/3
        #116: len 9 (0 Kb/s)
        Latency: 107 msec (46-166 msec ~116 msec)
> ACL Data RX: Handle 3 flags 0x02 dlen 13                                                                         #118 10.405104
      ATT: Find By Type Value Request (0x06) len 8
        Handle range: 0x004d-0xffff
        Attribute type: Primary Service (0x2800)
          UUID: Broadcast Audio Scan (0x184f)
zephyr.exe[401787]: < HCI Command: Host Number of Completed Packets (0x03|0x0035) plen 5                           #119 10.418002
        Num handles: 1
        Handle: 3 Address: C7:1B:DC:08:AA:BB (Static)
        Count: 1
zephyr.exe[401787]: < ACL Data TX: Handle 3 [1/3] flags 0x00 dlen 9                                                #120 10.418008
      ATT: Error Response (0x01) len 4
        Find By Type Value Request (0x06)
        Handle: 0x004d
        Error: Attribute Not Found (0x0a)
> HCI Event: Number of Completed Packets (0x13) plen 5                                                             #121 10.524347
        Num handles: 1
        Handle: 3 Address: C7:1B:DC:08:AA:BB (Static)
        Count: 1
        Buffers: 0/3
        #120: len 9 (0 Kb/s)
        Latency: 106 msec (46-166 msec ~111 msec)
> ACL Data RX: Handle 3 flags 0x02 dlen 11                                                                         #122 10.525159
      ATT: Read By Type Request (0x08) len 6
        Handle range: 0x0047-0x004c
        Attribute type: Characteristic (0x2803)
zephyr.exe[401787]: < HCI Command: Host Number of Completed Packets (0x03|0x0035) plen 5                           #123 10.538034
        Num handles: 1
        Handle: 3 Address: C7:1B:DC:08:AA:BB (Static)
        Count: 1
zephyr.exe[401787]: < ACL Data TX: Handle 3 [1/3] flags 0x00 dlen 20                                               #124 10.538050
      ATT: Read By Type Response (0x09) len 15
        Attribute data length: 7
        Attribute data list: 2 entries
        Handle: 0x0048
        Value[5]: 0c4900c72b
            Properties: 0x0c
              Write Without Response (0x04)
              Write (0x08)
            Value Handle: 0x0049
            Value UUID: Broadcast Audio Scan Control Point (0x2bc7)
        Handle: 0x004a
        Value[5]: 124b00c82b
            Properties: 0x12
              Read (0x02)
              Notify (0x10)
            Value Handle: 0x004b
            Value UUID: Broadcast Receive State (0x2bc8)
> HCI Event: Number of Completed Packets (0x13) plen 5                                                             #125 10.644172
        Num handles: 1
        Handle: 3 Address: C7:1B:DC:08:AA:BB (Static)
        Count: 1
        Buffers: 0/3
        #124: len 20 (1 Kb/s)
        Latency: 106 msec (46-166 msec ~108 msec)
> ACL Data RX: Handle 3 flags 0x02 dlen 11                                                                         #126 10.644466
      ATT: Read By Type Request (0x08) len 6
        Handle range: 0x004b-0x004c
        Attribute type: Characteristic (0x2803)
zephyr.exe[401787]: < HCI Command: Host Number of Completed Packets (0x03|0x0035) plen 5                           #127 10.657997
        Num handles: 1
        Handle: 3 Address: C7:1B:DC:08:AA:BB (Static)
        Count: 1
zephyr.exe[401787]: < ACL Data TX: Handle 3 [1/3] flags 0x00 dlen 9                                                #128 10.658002
      ATT: Error Response (0x01) len 4
        Read By Type Request (0x08)
        Handle: 0x004b
        Error: Attribute Not Found (0x0a)
> HCI Event: Number of Completed Packets (0x13) plen 5                                                             #129 10.764135
        Num handles: 1
        Handle: 3 Address: C7:1B:DC:08:AA:BB (Static)
        Count: 1
        Buffers: 0/3
        #128: len 9 (0 Kb/s)
        Latency: 106 msec (46-166 msec ~107 msec)
> ACL Data RX: Handle 3 flags 0x02 dlen 9                                                                          #130 10.764316
      ATT: Find Information Request (0x04) len 4
        Handle range: 0x004c-0x004c
zephyr.exe[401787]: < HCI Command: Host Number of Completed Packets (0x03|0x0035) plen 5                           #131 10.777945
        Num handles: 1
        Handle: 3 Address: C7:1B:DC:08:AA:BB (Static)
        Count: 1
zephyr.exe[401787]: < ACL Data TX: Handle 3 [1/3] flags 0x00 dlen 10                                               #132 10.777966
      ATT: Find Information Response (0x05) len 5
        Format: UUID-16 (0x01)
        Handle: 0x004c
        UUID: Client Characteristic Configuration (0x2902)
> HCI Event: Number of Completed Packets (0x13) plen 5                                                             #133 10.884067
        Num handles: 1
        Handle: 3 Address: C7:1B:DC:08:AA:BB (Static)
        Count: 1
        Buffers: 0/3
        #132: len 10 (0 Kb/s)
        Latency: 106 msec (46-166 msec ~106 msec)
> ACL Data RX: Handle 3 flags 0x02 dlen 9                                                                          #134 10.884401
      ATT: Write Request (0x12) len 4
        Handle: 0x004c
          Data[2]: 0000
zephyr.exe[401787]: < HCI Command: Host Number of Completed Packets (0x03|0x0035) plen 5                           #135 10.898026
        Num handles: 1
        Handle: 3 Address: C7:1B:DC:08:AA:BB (Static)
        Count: 1
zephyr.exe[401787]: < ACL Data TX: Handle 3 [1/3] flags 0x00 dlen 5                                                #136 10.898032
      ATT: Write Response (0x13) len 0
> HCI Event: Number of Completed Packets (0x13) plen 5                                                             #137 11.004368
        Num handles: 1
        Handle: 3 Address: C7:1B:DC:08:AA:BB (Static)
        Count: 1
        Buffers: 0/3
        #136: len 5 (0 Kb/s)
        Latency: 106 msec (46-166 msec ~106 msec)
> ACL Data RX: Handle 3 flags 0x02 dlen 9                                                                          #138 11.005046
      ATT: Write Request (0x12) len 4
        Handle: 0x004c
          Data[2]: 0100
zephyr.exe[401787]: < HCI Command: Host Number of Completed Packets (0x03|0x0035) plen 5                           #139 11.018067
        Num handles: 1
        Handle: 3 Address: C7:1B:DC:08:AA:BB (Static)
        Count: 1
zephyr.exe[401787]: < ACL Data TX: Handle 3 [1/3] flags 0x00 dlen 5                                                #140 11.018073
      ATT: Write Response (0x13) len 0
> HCI Event: Number of Completed Packets (0x13) plen 5                                                             #141 11.124264
        Num handles: 1
        Handle: 3 Address: C7:1B:DC:08:AA:BB (Static)
        Count: 1
        Buffers: 0/3
        #140: len 5 (0 Kb/s)
        Latency: 106 msec (46-166 msec ~106 msec)
> ACL Data RX: Handle 3 flags 0x02 dlen 7                                                                          #142 11.124267
      ATT: Read Request (0x0a) len 2
        Handle: 0x004b
zephyr.exe[401787]: < HCI Command: Host Number of Completed Packets (0x03|0x0035) plen 5                           #143 11.138021
        Num handles: 1
        Handle: 3 Address: C7:1B:DC:08:AA:BB (Static)
        Count: 1
zephyr.exe[401787]: < ACL Data TX: Handle 3 [1/3] flags 0x00 dlen 5                                                #144 11.138026
      ATT: Read Response (0x0b) len 0
        Value[0]: 
> HCI Event: Number of Completed Packets (0x13) plen 5                                                             #145 11.304001
        Num handles: 1
        Handle: 3 Address: C7:1B:DC:08:AA:BB (Static)
        Count: 1
        Buffers: 0/3
        #144: len 5 (0 Kb/s)
        Latency: 165 msec (46-166 msec ~136 msec)
> ACL Data RX: Handle 3 flags 0x02 dlen 27                                                                         #146 11.904607
> ACL Data RX: Handle 3 flags 0x01 dlen 1                                                                          #147 11.904677
      ATT: Write Command (0x52) len 23
        Handle: 0x0049
          Data[21]: 0201bbaa08dc1bc700320a5601401f010100000000
zephyr.exe[401787]: < HCI Command: Host Number of Completed Packets (0x03|0x0035) plen 5                           #148 11.918080
        Num handles: 1
        Handle: 3 Address: C7:1B:DC:08:AA:BB (Static)
        Count: 1
zephyr.exe[401787]: < HCI Command: Host Number of Completed Packets (0x03|0x0035) plen 5                           #149 11.918207
        Num handles: 1
        Handle: 3 Address: C7:1B:DC:08:AA:BB (Static)
        Count: 1
zephyr.exe[401787]: < ACL Data TX: Handle 3 [1/3] flags 0x00 dlen 27                                               #150 11.918271
      ATT: Handle Value Notification (0x1b) len 22
        Handle: 0x004b
          Data[20]: 0001bbaa08dc1bc700320a560000010000000000
> HCI Event: Number of Completed Packets (0x13) plen 5                                                             #151 12.024352
        Num handles: 1
        Handle: 3 Address: C7:1B:DC:08:AA:BB (Static)
        Count: 1
        Buffers: 0/3
        #150: len 27 (2 Kb/s)
        Latency: 106 msec (46-166 msec ~121 msec)
zephyr.exe[401787]: < HCI Command: LE Periodic Advertising Sync Transfer Parameters (0x08|0x005c) plen 8           #152 13.058078
        Connection handle: 3
        Mode: Enabled with report events enabled (0x02)
        Skip: 0x05
        Sync timeout: 10000 msec (0x03e8)
        Sync CTE type: 0x0000
zephyr.exe[401787]: < ACL Data TX: Handle 3 [1/3] flags 0x00 dlen 27                                               #153 13.058087
      ATT: Handle Value Notification (0x1b) len 22
        Handle: 0x004b
          Data[20]: 0001bbaa08dc1bc700320a560100010000000000
> HCI Event: Command Complete (0x0e) plen 6                                                                        #154 13.058833
      LE Periodic Advertising Sync Transfer Parameters (0x08|0x005c) ncmd 1
        Status: Success (0x00)
        Connection handle: 3
> HCI Event: Number of Completed Packets (0x13) plen 5                                                             #155 13.164231
        Num handles: 1
        Handle: 3 Address: C7:1B:DC:08:AA:BB (Static)
        Count: 1
        Buffers: 0/3
        #153: len 27 (2 Kb/s)
        Latency: 106 msec (46-166 msec ~113 msec)
> HCI Event: LE Meta Event (0x3e) plen 20                                                                          #156 13.318031
      LE Periodic Advertising Sync Transfer Received (0x18)
        Status: Success (0x00)
        Handle: 3
        Connection handle: 3
        Service data: 0x0000
        Sync handle: 0
        SID: 0x00
        Address type:: Random (0x01)
        Address:: C7:1B:DC:08:AA:BB (Static)
        PHY:: LE 1M (0x01)
        Periodic advertising Interval: 150.000
        Accuracy: 0.3125 msec (0x0001)
> HCI Event: LE Meta Event (0x3e) plen 48                                                                          #157 13.318439
      LE Periodic Advertising Report (0x0f)
        Sync handle: 0
        TX power: 127 dbm (0x7f)
        RSSI: -17 dBm (0xef)
        CTE Type: No Constant Tone Extension (0xff)
        Data status: [0;32mComplete[0m
        Data length: 0x28
        Service Data: Basic Audio Announcement (0x1851)
          Presentation Delay: 40000
          Number of Subgroups: 1
            Subgroup #0:
            Number of BIS(s): 1
            Codec: LC3 (0x06)
            Codec Specific Configuration: #0: len 0x02 type 0x01
            Codec Specific Configuration: Sampling Frequency: 16 Khz (0x03)
            Codec Specific Configuration: #1: len 0x02 type 0x02
            Codec Specific Configuration: Frame Duration: 10 ms (0x01)
            Codec Specific Configuration: #2: len 0x03 type 0x04
            Codec Specific Configuration: Frame Length: 40 (0x0028)
            Metadata: #0: len 0x03 type 0x02
            Metadata: Context: 0x0004
            Metadata: Context	Media (0x0004)
            Metadata: #1: len 0x01 type 0x09
              BIS #0:
              Index: 1
              Codec Specific Configuration: #0: len 0x05 type 0x03
              Codec Specific Configuration: Location: 0x00000001
              Codec Specific Configuration: Location: Front Left (0x00000001)
> HCI Event: LE Meta Event (0x3e) plen 20                                                                          #158 13.318758
      LE Broadcast Isochronous Group Info Advertising Report (0x22)
        Sync Handle: 0x0000
        Number BIS: 1
        NSE: 3
        ISO Interval: 10.00 msec (0x0008)
        BN: 1
        PTO: 1
        IRC: 2
        Maximum PDU: 40
        SDU Interval: 10000 us (0x002710)
        Maximum SDU: 40
        PHY: LE 1M (0x01)
        Framing: Unframed (0x00)
        Encryption: 0x00
zephyr.exe[401787]: < HCI Command: LE Broadcast Isochronous Group Create Sync (0x08|0x006b) plen 25                #159 13.338460
        BIG Handle: 0x00
        BIG Sync Handle: 0x0000
        Encryption: Unencrypted (0x00)
        Broadcast Code[16]: 00000000000000000000000000000000
        Maximum Number Subevents: 0x00
        Timeout: 200 ms (0x0014)
        Number of BIS: 1
        BIS ID: 0x01
zephyr.exe[401787]: < ACL Data TX: Handle 3 [1/3] flags 0x00 dlen 27                                               #160 13.338466
zephyr.exe[401787]: < ACL Data TX: Handle 3 flags 0x01 dlen 6                                                      #161 13.338466
      ATT: Handle Value Notification (0x1b) len 28
        Handle: 0x004b
          Data[26]: 0001bbaa08dc1bc700320a560200010000000006030204000109
> HCI Event: Command Status (0x0f) plen 4                                                                          #162 13.339582
      LE Broadcast Isochronous Group Create Sync (0x08|0x006b) ncmd 1
        Status: Success (0x00)
> HCI Event: Number of Completed Packets (0x13) plen 5                                                             #163 13.404853
        Num handles: 1
        Handle: 3 Address: C7:1B:DC:08:AA:BB (Static)
        Count: 1
        Buffers: 0/3
        #160: len 27 (3 Kb/s)
        Latency: 66 msec (46-166 msec ~90 msec)
> HCI Event: Number of Completed Packets (0x13) plen 5                                                             #164 13.464044
        Num handles: 1
        Handle: 3 Address: C7:1B:DC:08:AA:BB (Static)
        Count: 1
        Buffers: underflow/3
        #161: len 6 (0 Kb/s)
        Latency: 125 msec (46-166 msec ~107 msec)
> HCI Event: LE Meta Event (0x3e) plen 48                                                                          #165 14.218598
      LE Periodic Advertising Report (0x0f)
        Sync handle: 0
        TX power: 127 dbm (0x7f)
        RSSI: -17 dBm (0xef)
        CTE Type: No Constant Tone Extension (0xff)
        Data status: [0;32mComplete[0m
        Data length: 0x28
        Service Data: Basic Audio Announcement (0x1851)
          Presentation Delay: 40000
          Number of Subgroups: 1
            Subgroup #0:
            Number of BIS(s): 1
            Codec: LC3 (0x06)
            Codec Specific Configuration: #0: len 0x02 type 0x01
            Codec Specific Configuration: Sampling Frequency: 16 Khz (0x03)
            Codec Specific Configuration: #1: len 0x02 type 0x02
            Codec Specific Configuration: Frame Duration: 10 ms (0x01)
            Codec Specific Configuration: #2: len 0x03 type 0x04
            Codec Specific Configuration: Frame Length: 40 (0x0028)
            Metadata: #0: len 0x03 type 0x02
            Metadata: Context: 0x0004
            Metadata: Context	Media (0x0004)
            Metadata: #1: len 0x01 type 0x09
              BIS #0:
              Index: 1
              Codec Specific Configuration: #0: len 0x05 type 0x03
              Codec Specific Configuration: Location: 0x00000001
              Codec Specific Configuration: Location: Front Left (0x00000001)
> HCI Event: LE Meta Event (0x3e) plen 20                                                                          #166 14.218871
      LE Broadcast Isochronous Group Info Advertising Report (0x22)
        Sync Handle: 0x0000
        Number BIS: 1
        NSE: 3
        ISO Interval: 10.00 msec (0x0008)
        BN: 1
        PTO: 1
        IRC: 2
        Maximum PDU: 40
        SDU Interval: 10000 us (0x002710)
        Maximum SDU: 40
        PHY: LE 1M (0x01)
        Framing: Unframed (0x00)
        Encryption: 0x00
> HCI Event: LE Meta Event (0x3e) plen 17                                                                          #167 14.224430
      LE Broadcast Isochronous Group Sync Established (0x1d)
        Status: Success (0x00)
        BIG Handle: 0x00
        Transport Latency: 11500 us (0x002cec)
        NSE: 3
        BN: 1
        PTO: 1
        IRC: 2
        Maximum PDU: 40
        ISO Interval: 10.00 msec (0x0008)
        Connection Handle #0: 14
zephyr.exe[401787]: < HCI Command: LE Setup Isochronous Data Path (0x08|0x006e) plen 13                            #168 14.238470
        Handle: 14
        Data Path Direction: Output (Controller to Host) (0x01)
        Data Path: HCI (0x00)
        Coding Format: Transparent (0x03)
        Company Codec ID: Ericsson Technology Licensing (0)
        Vendor Codec ID: 0
        Controller Delay: 0 us (0x000000)
        Codec Configuration Length: 0
        Codec Configuration[0]: 
> HCI Event: Command Complete (0x0e) plen 6                                                                        #169 14.239257
      LE Setup Isochronous Data Path (0x08|0x006e) ncmd 1
        Status: Success (0x00)
        Handle: 14
> ISO Data RX: Handle 14 SN 871 flags 0x06 dlen 8 slen 32768                                                       #170 14.244652
        invalid packet size (4 != 8)
        67 03 00 80                                      g...            
> ISO Data RX: Handle 14 SN 872 flags 0x06 dlen 8 slen 32768                                                       #171 14.245585
        invalid packet size (4 != 8)
        68 03 00 80                                      h...            
> ISO Data RX: Handle 14 SN 873 flags 0x06 dlen 8 slen 32768                                                       #172 14.255770
        invalid packet size (4 != 8)
        69 03 00 80                                      i...            
zephyr.exe[401787]: < ACL Data TX: Handle 3 [1/3] flags 0x00 dlen 27                                               #173 14.258273
zephyr.exe[401787]: < ACL Data TX: Handle 3 flags 0x01 dlen 6                                                      #174 14.258430
      ATT: Handle Value Notification (0x1b) len 28
        Handle: 0x004b
          Data[26]: 0001bbaa08dc1bc700320a560200010100000006030204000109
> ISO Data RX: Handle 14 SN 874 flags 0x06 dlen 8 slen 32768                                                       #175 14.266127
        invalid packet size (4 != 8)
        6a 03 00 80                                      j...            
> ISO Data RX: Handle 14 SN 875 flags 0x06 dlen 8 slen 32768                                                       #176 14.275644
        invalid packet size (4 != 8)
        6b 03 00 80                                      k...            
> ISO Data RX: Handle 14 SN 876 flags 0x06 dlen 8 slen 32768                                                       #177 14.285648
        invalid packet size (4 != 8)
        6c 03 00 80                                      l...            
> ISO Data RX: Handle 14 SN 877 flags 0x06 dlen 8 slen 32768                                                       #178 14.295634
        invalid packet size (4 != 8)
        6d 03 00 80                                      m...            
> ISO Data RX: Handle 14 SN 878 flags 0x06 dlen 8 slen 32768                                                       #179 14.305635
        invalid packet size (4 != 8)
        6e 03 00 80                                      n...            
> ISO Data RX: Handle 14 SN 879 flags 0x06 dlen 8 slen 32768                                                       #180 14.315888
        invalid packet size (4 != 8)
        6f 03 00 80                                      o...            
> ISO Data RX: Handle 14 SN 880 flags 0x06 dlen 8 slen 32768                                                       #181 14.325915
        invalid packet size (4 != 8)
        70 03 00 80                                      p...            
> ISO Data RX: Handle 14 SN 881 flags 0x06 dlen 8 slen 32768                                                       #182 14.336388
        invalid packet size (4 != 8)
        71 03 00 80                                      q...            
> ISO Data RX: Handle 14 SN 882 flags 0x06 dlen 8 slen 32768                                                       #183 14.345630
        invalid packet size (4 != 8)
        72 03 00 80                                      r...            
> ISO Data RX: Handle 14 SN 883 flags 0x06 dlen 8 slen 32768                                                       #184 14.355548
        invalid packet size (4 != 8)
        73 03 00 80                                      s...            
> ISO Data RX: Handle 14 SN 884 flags 0x06 dlen 8 slen 32768                                                       #185 14.365932
        invalid packet size (4 != 8)
        74 03 00 80                                      t...            
> ISO Data RX: Handle 14 SN 885 flags 0x06 dlen 8 slen 32768                                                       #186 14.375740
        invalid packet size (4 != 8)
        75 03 00 80                                      u...            
> ISO Data RX: Handle 14 SN 886 flags 0x06 dlen 8 slen 32768                                                       #187 14.386128
        invalid packet size (4 != 8)
        76 03 00 80                                      v...            
> ISO Data RX: Handle 14 SN 887 flags 0x06 dlen 8 slen 32768                                                       #188 14.395919
        invalid packet size (4 != 8)
        77 03 00 80                                      w...            
> ISO Data RX: Handle 14 SN 888 flags 0x06 dlen 8 slen 32768                                                       #189 14.414633
        invalid packet size (4 != 8)
        78 03 00 80                                      x...            
> ISO Data RX: Handle 14 SN 889 flags 0x06 dlen 8 slen 32768                                                       #190 14.415634
        invalid packet size (4 != 8)
        79 03 00 80                                      y...            
> ISO Data RX: Handle 14 SN 890 flags 0x06 dlen 8 slen 32768                                                       #191 14.425590
        invalid packet size (4 != 8)
        7a 03 00 80                                      z...            
> ISO Data RX: Handle 14 SN 891 flags 0x06 dlen 8 slen 32768                                                       #192 14.435967
        invalid packet size (4 != 8)
        7b 03 00 80                                      {...            
> ISO Data RX: Handle 14 SN 892 flags 0x06 dlen 8 slen 32768                                                       #193 14.445970
        invalid packet size (4 != 8)
        7c 03 00 80                                      |...            
> ISO Data RX: Handle 14 SN 893 flags 0x06 dlen 8 slen 32768                                                       #194 14.456138
        invalid packet size (4 != 8)
        7d 03 00 80                                      }...            
> ISO Data RX: Handle 14 SN 894 flags 0x06 dlen 8 slen 32768                                                       #195 14.466038
        invalid packet size (4 != 8)
        7e 03 00 80                                      ~...            
> ISO Data RX: Handle 14 SN 895 flags 0x06 dlen 8 slen 32768                                                       #196 14.475809
        invalid packet size (4 != 8)
        7f 03 00 80                                      ....            
> ISO Data RX: Handle 14 SN 896 flags 0x06 dlen 8 slen 32768                                                       #197 14.486138
        invalid packet size (4 != 8)
        80 03 00 80                                      ....            
> ISO Data RX: Handle 14 SN 897 flags 0x06 dlen 8 slen 32768                                                       #198 14.495612
        invalid packet size (4 != 8)
        81 03 00 80                                      ....            
> ISO Data RX: Handle 14 SN 898 flags 0x06 dlen 8 slen 32768                                                       #199 14.514580
        invalid packet size (4 != 8)
        82 03 00 80                                      ....            
> ISO Data RX: Handle 14 SN 899 flags 0x06 dlen 8 slen 32768                                                       #200 14.515541
        invalid packet size (4 != 8)
        83 03 00 80                                      ....            
> ISO Data RX: Handle 14 SN 900 flags 0x06 dlen 8 slen 32768                                                       #201 14.525902
        invalid packet size (4 != 8)
        84 03 00 80                                      ....            
> ISO Data RX: Handle 14 SN 901 flags 0x06 dlen 8 slen 32768                                                       #202 14.535889
        invalid packet size (4 != 8)
        85 03 00 80                                      ....            
> ISO Data RX: Handle 14 SN 902 flags 0x06 dlen 8 slen 32768                                                       #203 14.546053
        invalid packet size (4 != 8)
        86 03 00 80                                      ....            
> ISO Data RX: Handle 14 SN 903 flags 0x06 dlen 8 slen 32768                                                       #204 14.555943
        invalid packet size (4 != 8)
        87 03 00 80                                      ....            
> ISO Data RX: Handle 14 SN 904 flags 0x06 dlen 8 slen 32768                                                       #205 14.566029
        invalid packet size (4 != 8)
        88 03 00 80                                      ....            
> ISO Data RX: Handle 14 SN 905 flags 0x06 dlen 8 slen 32768                                                       #206 14.575580
        invalid packet size (4 != 8)
        89 03 00 80                                      ....            
> ISO Data RX: Handle 14 SN 906 flags 0x06 dlen 8 slen 32768                                                       #207 14.585643
        invalid packet size (4 != 8)
        8a 03 00 80                                      ....            
> ISO Data RX: Handle 14 SN 907 flags 0x06 dlen 8 slen 32768                                                       #208 14.595974
        invalid packet size (4 != 8)
        8b 03 00 80                                      ....            
> ISO Data RX: Handle 14 SN 908 flags 0x06 dlen 8 slen 32768                                                       #209 14.605971
        invalid packet size (4 != 8)
        8c 03 00 80                                      ....            
> ISO Data RX: Handle 14 SN 909 flags 0x06 dlen 8 slen 32768                                                       #210 14.615941
        invalid packet size (4 != 8)
        8d 03 00 80                                      ....            
> ISO Data RX: Handle 14 SN 910 flags 0x06 dlen 8 slen 32768                                                       #211 14.625646
        invalid packet size (4 != 8)
        8e 03 00 80                                      ....            
> ISO Data RX: Handle 14 SN 911 flags 0x06 dlen 8 slen 32768                                                       #212 14.635548
        invalid packet size (4 != 8)
        8f 03 00 80                                      ....            
> ISO Data RX: Handle 14 SN 912 flags 0x06 dlen 8 slen 32768                                                       #213 14.645938
        invalid packet size (4 != 8)
        90 03 00 80                                      ....            
> ISO Data RX: Handle 14 SN 913 flags 0x06 dlen 8 slen 32768                                                       #214 14.655652
        invalid packet size (4 != 8)
        91 03 00 80                                      ....            
> ISO Data RX: Handle 14 SN 914 flags 0x06 dlen 8 slen 32768                                                       #215 14.666057
        invalid packet size (4 != 8)
        92 03 00 80                                      ....            
> ISO Data RX: Handle 14 SN 915 flags 0x06 dlen 8 slen 32768                                                       #216 14.675898
        invalid packet size (4 != 8)
        93 03 00 80                                      ....            
> ISO Data RX: Handle 14 SN 916 flags 0x06 dlen 8 slen 32768                                                       #217 14.685559
        invalid packet size (4 != 8)
        94 03 00 80                                      ....            
> ISO Data RX: Handle 14 SN 917 flags 0x06 dlen 8 slen 32768                                                       #218 14.695683
        invalid packet size (4 != 8)
        95 03 00 80                                      ....            
> ISO Data RX: Handle 14 SN 918 flags 0x06 dlen 8 slen 32768                                                       #219 14.705684
        invalid packet size (4 != 8)
        96 03 00 80                                      ....            
> ISO Data RX: Handle 14 SN 919 flags 0x06 dlen 8 slen 32768                                                       #220 14.724564
        invalid packet size (4 != 8)
        97 03 00 80                                      ....            
> ISO Data RX: Handle 14 SN 920 flags 0x06 dlen 8 slen 32768                                                       #221 14.725857
        invalid packet size (4 != 8)
        98 03 00 80                                      ....            
> ISO Data RX: Handle 14 SN 921 flags 0x06 dlen 8 slen 32768                                                       #222 14.735585
        invalid packet size (4 != 8)
        99 03 00 80                                      ....            
> ISO Data RX: Handle 14 SN 922 flags 0x06 dlen 8 slen 32768                                                       #223 14.745865
        invalid packet size (4 != 8)
        9a 03 00 80                                      ....            
> ISO Data RX: Handle 14 SN 923 flags 0x06 dlen 8 slen 32768                                                       #224 14.755804
        invalid packet size (4 != 8)
        9b 03 00 80                                      ....            
> ISO Data RX: Handle 14 SN 924 flags 0x06 dlen 8 slen 32768                                                       #225 14.765904
        invalid packet size (4 != 8)
        9c 03 00 80                                      ....            
> ISO Data RX: Handle 14 SN 925 flags 0x06 dlen 8 slen 32768                                                       #226 14.775953
        invalid packet size (4 != 8)
        9d 03 00 80                                      ....            
> ISO Data RX: Handle 14 SN 926 flags 0x06 dlen 8 slen 32768                                                       #227 14.785588
        invalid packet size (4 != 8)
        9e 03 00 80                                      ....            
> ISO Data RX: Handle 14 SN 927 flags 0x06 dlen 8 slen 32768                                                       #228 14.795556
        invalid packet size (4 != 8)
        9f 03 00 80                                      ....            
> ISO Data RX: Handle 14 SN 928 flags 0x06 dlen 8 slen 32768                                                       #229 14.805645
        invalid packet size (4 != 8)
        a0 03 00 80                                      ....            
> ISO Data RX: Handle 14 SN 929 flags 0x06 dlen 8 slen 32768                                                       #230 14.815646
        invalid packet size (4 != 8)
        a1 03 00 80                                      ....            
> ISO Data RX: Handle 14 SN 930 flags 0x06 dlen 8 slen 32768                                                       #231 14.825746
        invalid packet size (4 != 8)
        a2 03 00 80                                      ....            
> ISO Data RX: Handle 14 SN 931 flags 0x06 dlen 8 slen 32768                                                       #232 14.835622
        invalid packet size (4 != 8)
        a3 03 00 80                                      ....            
> ISO Data RX: Handle 14 SN 932 flags 0x06 dlen 8 slen 32768                                                       #233 14.845616
        invalid packet size (4 != 8)
        a4 03 00 80                                      ....            
> ISO Data RX: Handle 14 SN 933 flags 0x06 dlen 8 slen 32768                                                       #234 14.855619
        invalid packet size (4 != 8)
        a5 03 00 80                                      ....            
> ISO Data RX: Handle 14 SN 934 flags 0x06 dlen 8 slen 32768                                                       #235 14.865951
        invalid packet size (4 != 8)
        a6 03 00 80                                      ....            
> ISO Data RX: Handle 14 SN 935 flags 0x06 dlen 8 slen 32768                                                       #236 14.875585
        invalid packet size (4 != 8)
        a7 03 00 80                                      ....            
> ISO Data RX: Handle 14 SN 936 flags 0x06 dlen 8 slen 32768                                                       #237 14.886208
        invalid packet size (4 != 8)
        a8 03 00 80                                      ....            
> ISO Data RX: Handle 14 SN 937 flags 0x06 dlen 8 slen 32768                                                       #238 14.895744
        invalid packet size (4 != 8)
        a9 03 00 80                                      ....            
> ISO Data RX: Handle 14 SN 938 flags 0x06 dlen 8 slen 32768                                                       #239 14.905610
        invalid packet size (4 != 8)
        aa 03 00 80                                      ....            
> ISO Data RX: Handle 14 SN 939 flags 0x06 dlen 8 slen 32768                                                       #240 14.915840
        invalid packet size (4 != 8)
        ab 03 00 80                                      ....            
> ISO Data RX: Handle 14 SN 940 flags 0x06 dlen 8 slen 32768                                                       #241 14.934660
        invalid packet size (4 != 8)
        ac 03 00 80                                      ....            
> ISO Data RX: Handle 14 SN 941 flags 0x06 dlen 8 slen 32768                                                       #242 14.935496
        invalid packet size (4 != 8)
        ad 03 00 80                                      ....            
> ISO Data RX: Handle 14 SN 942 flags 0x06 dlen 8 slen 32768                                                       #243 14.945587
        invalid packet size (4 != 8)
        ae 03 00 80                                      ....            
> ISO Data RX: Handle 14 SN 943 flags 0x06 dlen 8 slen 32768                                                       #244 14.955936
        invalid packet size (4 != 8)
        af 03 00 80                                      ....            
> ISO Data RX: Handle 14 SN 944 flags 0x06 dlen 8 slen 32768                                                       #245 14.967536
        invalid packet size (4 != 8)
        b0 03 00 80                                      ....            
> ISO Data RX: Handle 14 SN 945 flags 0x06 dlen 8 slen 32768                                                       #246 14.975693
        invalid packet size (4 != 8)
        b1 03 00 80                                      ....            
> ISO Data RX: Handle 14 SN 946 flags 0x06 dlen 8 slen 32768                                                       #247 14.985624
        invalid packet size (4 != 8)
        b2 03 00 80                                      ....            
> ISO Data RX: Handle 14 SN 947 flags 0x06 dlen 8 slen 32768                                                       #248 14.995580
        invalid packet size (4 != 8)
        b3 03 00 80                                      ....            
> ISO Data RX: Handle 14 SN 948 flags 0x06 dlen 8 slen 32768                                                       #249 15.005546
        invalid packet size (4 != 8)
        b4 03 00 80                                      ....            
> ISO Data RX: Handle 14 SN 949 flags 0x06 dlen 8 slen 32768                                                       #250 15.015999
        invalid packet size (4 != 8)
        b5 03 00 80                                      ....            
> ISO Data RX: Handle 14 SN 950 flags 0x06 dlen 8 slen 32768                                                       #251 15.034876
        invalid packet size (4 != 8)
        b6 03 00 80                                      ....            
> ISO Data RX: Handle 14 SN 951 flags 0x06 dlen 8 slen 32768                                                       #252 15.035892
        invalid packet size (4 != 8)
        b7 03 00 80                                      ....            
> ISO Data RX: Handle 14 SN 952 flags 0x06 dlen 8 slen 32768                                                       #253 15.045613
        invalid packet size (4 != 8)
        b8 03 00 80                                      ....            
> ISO Data RX: Handle 14 SN 953 flags 0x06 dlen 8 slen 32768                                                       #254 15.055610
        invalid packet size (4 != 8)
        b9 03 00 80                                      ....            
> ISO Data RX: Handle 14 SN 954 flags 0x06 dlen 8 slen 32768                                                       #255 15.066374
        invalid packet size (4 != 8)
        ba 03 00 80                                      ....            
> ISO Data RX: Handle 14 SN 955 flags 0x06 dlen 8 slen 32768                                                       #256 15.075646
        invalid packet size (4 != 8)
        bb 03 00 80                                      ....            
> ISO Data RX: Handle 14 SN 956 flags 0x06 dlen 8 slen 32768                                                       #257 15.085464
        invalid packet size (4 != 8)
        bc 03 00 80                                      ....            
> ISO Data RX: Handle 14 SN 957 flags 0x06 dlen 8 slen 32768                                                       #258 15.095769
        invalid packet size (4 != 8)
        bd 03 00 80                                      ....            
> ISO Data RX: Handle 14 SN 958 flags 0x06 dlen 8 slen 32768                                                       #259 15.105830
        invalid packet size (4 != 8)
        be 03 00 80                                      ....            
> ISO Data RX: Handle 14 SN 959 flags 0x06 dlen 8 slen 32768                                                       #260 15.115920
        invalid packet size (4 != 8)
        bf 03 00 80                                      ....            
> HCI Event: LE Meta Event (0x3e) plen 48                                                                          #261 15.118244
      LE Periodic Advertising Report (0x0f)
        Sync handle: 0
        TX power: 127 dbm (0x7f)
        RSSI: -16 dBm (0xf0)
        CTE Type: No Constant Tone Extension (0xff)
        Data status: [0;32mComplete[0m
        Data length: 0x28
        Service Data: Basic Audio Announcement (0x1851)
          Presentation Delay: 40000
          Number of Subgroups: 1
            Subgroup #0:
            Number of BIS(s): 1
            Codec: LC3 (0x06)
            Codec Specific Configuration: #0: len 0x02 type 0x01
            Codec Specific Configuration: Sampling Frequency: 16 Khz (0x03)
            Codec Specific Configuration: #1: len 0x02 type 0x02
            Codec Specific Configuration: Frame Duration: 10 ms (0x01)
            Codec Specific Configuration: #2: len 0x03 type 0x04
            Codec Specific Configuration: Frame Length: 40 (0x0028)
            Metadata: #0: len 0x03 type 0x02
            Metadata: Context: 0x0004
            Metadata: Context	Media (0x0004)
            Metadata: #1: len 0x01 type 0x09
              BIS #0:
              Index: 1
              Codec Specific Configuration: #0: len 0x05 type 0x03
              Codec Specific Configuration: Location: 0x00000001
              Codec Specific Configuration: Location: Front Left (0x00000001)
> HCI Event: LE Meta Event (0x3e) plen 20                                                                          #262 15.118500
      LE Broadcast Isochronous Group Info Advertising Report (0x22)
        Sync Handle: 0x0000
        Number BIS: 1
        NSE: 3
        ISO Interval: 10.00 msec (0x0008)
        BN: 1
        PTO: 1
        IRC: 2
        Maximum PDU: 40
        SDU Interval: 10000 us (0x002710)
        Maximum SDU: 40
        PHY: LE 1M (0x01)
        Framing: Unframed (0x00)
        Encryption: 0x00
> ISO Data RX: Handle 14 SN 960 flags 0x06 dlen 8 slen 32768                                                       #263 15.125538
        invalid packet size (4 != 8)
        c0 03 00 80                                      ....            
> ISO Data RX: Handle 14 SN 961 flags 0x06 dlen 8 slen 32768                                                       #264 15.135894
        invalid packet size (4 != 8)
        c1 03 00 80                                      ....            
> ISO Data RX: Handle 14 SN 962 flags 0x06 dlen 8 slen 32768                                                       #265 15.145556
        invalid packet size (4 != 8)
        c2 03 00 80                                      ....            
> ISO Data RX: Handle 14 SN 963 flags 0x06 dlen 8 slen 32768                                                       #266 15.155824
        invalid packet size (4 != 8)
        c3 03 00 80                                      ....            
> ISO Data RX: Handle 14 SN 964 flags 0x06 dlen 8 slen 32768                                                       #267 15.165646
        invalid packet size (4 != 8)
        c4 03 00 80                                      ....            
> ISO Data RX: Handle 14 SN 965 flags 0x06 dlen 8 slen 32768                                                       #268 15.175985
        invalid packet size (4 != 8)
        c5 03 00 80                                      ....            
> ISO Data RX: Handle 14 SN 966 flags 0x06 dlen 8 slen 32768                                                       #269 15.185634
        invalid packet size (4 != 8)
        c6 03 00 80                                      ....            
> ISO Data RX: Handle 14 SN 967 flags 0x06 dlen 8 slen 32768                                                       #270 15.195845
        invalid packet size (4 != 8)
        c7 03 00 80                                      ....            
> ISO Data RX: Handle 14 SN 968 flags 0x06 dlen 8 slen 32768                                                       #271 15.205966
        invalid packet size (4 != 8)
        c8 03 00 80                                      ....            
> ISO Data RX: Handle 14 SN 969 flags 0x06 dlen 8 slen 32768                                                       #272 15.215651
        invalid packet size (4 != 8)
        c9 03 00 80                                      ....            
> ISO Data RX: Handle 14 SN 970 flags 0x06 dlen 8 slen 32768                                                       #273 15.225661
        invalid packet size (4 != 8)
        ca 03 00 80                                      ....            
> ISO Data RX: Handle 14 SN 971 flags 0x06 dlen 8 slen 32768                                                       #274 15.235540
        invalid packet size (4 != 8)
        cb 03 00 80                                      ....            
> ISO Data RX: Handle 14 SN 972 flags 0x06 dlen 8 slen 32768                                                       #275 15.245537
        invalid packet size (4 != 8)
        cc 03 00 80                                      ....            
> ISO Data RX: Handle 14 SN 973 flags 0x06 dlen 8 slen 32768                                                       #276 15.255752
        invalid packet size (4 != 8)
        cd 03 00 80                                      ....            
> ISO Data RX: Handle 14 SN 974 flags 0x06 dlen 8 slen 32768                                                       #277 15.265600
        invalid packet size (4 != 8)
        ce 03 00 80                                      ....            
> ISO Data RX: Handle 14 SN 975 flags 0x06 dlen 8 slen 32768                                                       #278 15.275843
        invalid packet size (4 != 8)
        cf 03 00 80                                      ....            
> ISO Data RX: Handle 14 SN 976 flags 0x06 dlen 8 slen 32768                                                       #279 15.286178
        invalid packet size (4 != 8)
        d0 03 00 80                                      ....            
> ISO Data RX: Handle 14 SN 977 flags 0x06 dlen 8 slen 32768                                                       #280 15.295696
        invalid packet size (4 != 8)
        d1 03 00 80                                      ....            
> ISO Data RX: Handle 14 SN 978 flags 0x06 dlen 8 slen 32768                                                       #281 15.306158
        invalid packet size (4 != 8)
        d2 03 00 80                                      ....            
> ISO Data RX: Handle 14 SN 979 flags 0x06 dlen 8 slen 32768                                                       #282 15.315994
        invalid packet size (4 != 8)
        d3 03 00 80                                      ....            
> ISO Data RX: Handle 14 SN 980 flags 0x06 dlen 8 slen 32768                                                       #283 15.325815
        invalid packet size (4 != 8)
        d4 03 00 80                                      ....            
> ISO Data RX: Handle 14 SN 981 flags 0x06 dlen 8 slen 32768                                                       #284 15.335887
        invalid packet size (4 != 8)
        d5 03 00 80                                      ....            
> ISO Data RX: Handle 14 SN 982 flags 0x06 dlen 8 slen 32768                                                       #285 15.354734
        invalid packet size (4 != 8)
        d6 03 00 80                                      ....            
> ISO Data RX: Handle 14 SN 983 flags 0x06 dlen 8 slen 32768                                                       #286 15.355600
        invalid packet size (4 != 8)
        d7 03 00 80                                      ....            
> ISO Data RX: Handle 14 SN 984 flags 0x06 dlen 8 slen 32768                                                       #287 15.365591
        invalid packet size (4 != 8)
        d8 03 00 80                                      ....            
> ISO Data RX: Handle 14 SN 985 flags 0x06 dlen 8 slen 32768                                                       #288 15.376780
        invalid packet size (4 != 8)
        d9 03 00 80                                      ....            
> ISO Data RX: Handle 14 SN 986 flags 0x06 dlen 8 slen 32768                                                       #289 15.386017
        invalid packet size (4 != 8)
        da 03 00 80                                      ....            
> ISO Data RX: Handle 14 SN 987 flags 0x06 dlen 8 slen 32768                                                       #290 15.396252
        invalid packet size (4 != 8)
        db 03 00 80                                      ....            
> ISO Data RX: Handle 14 SN 988 flags 0x06 dlen 8 slen 32768                                                       #291 15.405583
        invalid packet size (4 != 8)
        dc 03 00 80                                      ....            
> ISO Data RX: Handle 14 SN 989 flags 0x06 dlen 8 slen 32768                                                       #292 15.416594
        invalid packet size (4 != 8)
        dd 03 00 80                                      ....            
> ISO Data RX: Handle 14 SN 990 flags 0x06 dlen 8 slen 32768                                                       #293 15.426000
        invalid packet size (4 != 8)
        de 03 00 80                                      ....            
> ISO Data RX: Handle 14 SN 991 flags 0x06 dlen 8 slen 32768                                                       #294 15.435824
        invalid packet size (4 != 8)
        df 03 00 80                                      ....            
> ISO Data RX: Handle 14 SN 992 flags 0x06 dlen 8 slen 32768                                                       #295 15.446002
        invalid packet size (4 != 8)
        e0 03 00 80                                      ....            
> ISO Data RX: Handle 14 SN 993 flags 0x06 dlen 8 slen 32768                                                       #296 15.455474
        invalid packet size (4 != 8)
        e1 03 00 80                                      ....            
> ISO Data RX: Handle 14 SN 994 flags 0x06 dlen 8 slen 32768                                                       #297 15.465671
        invalid packet size (4 != 8)
        e2 03 00 80                                      ....            
> ISO Data RX: Handle 14 SN 995 flags 0x06 dlen 8 slen 32768                                                       #298 15.475612
        invalid packet size (4 != 8)
        e3 03 00 80                                      ....            
> ISO Data RX: Handle 14 SN 996 flags 0x06 dlen 8 slen 32768                                                       #299 15.485877
        invalid packet size (4 != 8)
        e4 03 00 80                                      ....            
> ISO Data RX: Handle 14 SN 997 flags 0x06 dlen 8 slen 32768                                                       #300 15.495693
        invalid packet size (4 != 8)
        e5 03 00 80                                      ....            
> ISO Data RX: Handle 14 SN 998 flags 0x06 dlen 8 slen 32768                                                       #301 15.505795
        invalid packet size (4 != 8)
        e6 03 00 80                                      ....            
> ISO Data RX: Handle 14 SN 999 flags 0x06 dlen 8 slen 32768                                                       #302 15.515646
        invalid packet size (4 != 8)
        e7 03 00 80                                      ....            
> ISO Data RX: Handle 14 SN 1000 flags 0x06 dlen 8 slen 32768                                                      #303 15.525599
        invalid packet size (4 != 8)
        e8 03 00 80                                      ....            
> ISO Data RX: Handle 14 SN 1001 flags 0x06 dlen 8 slen 32768                                                      #304 15.535764
        invalid packet size (4 != 8)
        e9 03 00 80                                      ....            
> ISO Data RX: Handle 14 SN 1002 flags 0x06 dlen 8 slen 32768                                                      #305 15.546187
        invalid packet size (4 != 8)
        ea 03 00 80                                      ....            
> ISO Data RX: Handle 14 SN 1003 flags 0x06 dlen 8 slen 32768                                                      #306 15.564805
        invalid packet size (4 != 8)
        eb 03 00 80                                      ....            
> ISO Data RX: Handle 14 SN 1004 flags 0x06 dlen 8 slen 32768                                                      #307 15.565993
        invalid packet size (4 != 8)
        ec 03 00 80                                      ....            
> ISO Data RX: Handle 14 SN 1005 flags 0x06 dlen 8 slen 32768                                                      #308 15.575738
        invalid packet size (4 != 8)
        ed 03 00 80                                      ....            
> ISO Data RX: Handle 14 SN 1006 flags 0x06 dlen 8 slen 32768                                                      #309 15.585820
        invalid packet size (4 != 8)
        ee 03 00 80                                      ....            
> ISO Data RX: Handle 14 SN 1007 flags 0x06 dlen 8 slen 32768                                                      #310 15.595878
        invalid packet size (4 != 8)
        ef 03 00 80                                      ....            
> ISO Data RX: Handle 14 SN 1008 flags 0x06 dlen 8 slen 32768                                                      #311 15.606017
        invalid packet size (4 != 8)
        f0 03 00 80                                      ....            
> ISO Data RX: Handle 14 SN 1009 flags 0x06 dlen 8 slen 32768                                                      #312 15.615648
        invalid packet size (4 != 8)
        f1 03 00 80                                      ....            
> ISO Data RX: Handle 14 SN 1010 flags 0x06 dlen 8 slen 32768                                                      #313 15.625769
        invalid packet size (4 != 8)
        f2 03 00 80                                      ....            
> ISO Data RX: Handle 14 SN 1011 flags 0x06 dlen 8 slen 32768                                                      #314 15.635792
        invalid packet size (4 != 8)
        f3 03 00 80                                      ....            
> ISO Data RX: Handle 14 SN 1012 flags 0x06 dlen 8 slen 32768                                                      #315 15.645847
        invalid packet size (4 != 8)
        f4 03 00 80                                      ....            
> ISO Data RX: Handle 14 SN 1013 flags 0x06 dlen 8 slen 32768                                                      #316 15.664858
        invalid packet size (4 != 8)
        f5 03 00 80                                      ....            
> ISO Data RX: Handle 14 SN 1014 flags 0x06 dlen 8 slen 32768                                                      #317 15.665642
        invalid packet size (4 != 8)
        f6 03 00 80                                      ....            
> ISO Data RX: Handle 14 SN 1015 flags 0x06 dlen 8 slen 32768                                                      #318 15.675608
        invalid packet size (4 != 8)
        f7 03 00 80                                      ....            
> ISO Data RX: Handle 14 SN 1016 flags 0x06 dlen 8 slen 32768                                                      #319 15.685869
        invalid packet size (4 != 8)
        f8 03 00 80                                      ....            
> ISO Data RX: Handle 14 SN 1017 flags 0x06 dlen 8 slen 32768                                           