Bluetooth monitor ver 5.72
= Note: Linux version 6.14.0-36-generic (x86_64)                       0.367356
= Note: Bluetooth subsystem version 2.22                               0.367358
= New Index: 00:00:00:00:00:00 (Primary,UART,hci1)              [hci1] 0.367358
= New Index: 48:5F:99:8E:E0:64 (Primary,USB,hci0)               [hci0] 0.367359
= Open Index: 00:00:00:00:00:00                                 [hci1] 0.510837
= Index Info: 00:00:00:00:00:00 (Nordic Semiconductor ASA)      [hci1] 0.510848
@ USER Open: main (privileged) version 2.22            {0x0001} [hci1] 0.510855
< HCI Command: Reset (0x03|0x0003) plen 0                    #1 [hci1] 0.511517
> HCI Event: Command Complete (0x0e) plen 4                  #2 [hci1] 0.512111
      Reset (0x03|0x0003) ncmd 1
        Status: Success (0x00)
< HCI Command: Read Local Supported... (0x04|0x0003) plen 0  #3 [hci1] 0.530550
> HCI Event: Command Complete (0x0e) plen 12                 #4 [hci1] 0.531039
      Read Local Supported Features (0x04|0x0003) ncmd 1
        Status: Success (0x00)
        Features: 0x00 0x00 0x00 0x00 0x60 0x00 0x00 0x00
          BR/EDR Not Supported
          LE Supported (Controller)
< HCI Command: Read Local Version In.. (0x04|0x0001) plen 0  #5 [hci1] 0.550557
> HCI Event: Command Complete (0x0e) plen 12                 #6 [hci1] 0.551025
      Read Local Version Information (0x04|0x0001) ncmd 1
        Status: Success (0x00)
        HCI version: Reserved (0x0f) - Revision 12393 (0x3069)
        LMP version: Reserved (0x0f) - Subversion 12393 (0x3069)
        Manufacturer: Nordic Semiconductor ASA (89)
< HCI Command: Read Local Supported... (0x04|0x0002) plen 0  #7 [hci1] 0.570547
> HCI Event: Command Complete (0x0e) plen 68                 #8 [hci1] 0.571582
      Read Local Supported Commands (0x04|0x0002) ncmd 1
        Status: Success (0x00)
        Commands: 119 entries
          Disconnect (Octet 0 - Bit 5)
          Read Remote Version Information (Octet 2 - Bit 7)
          Set Event Mask (Octet 5 - Bit 6)
          Reset (Octet 5 - Bit 7)
          Read Connection Accept Timeout (Octet 7 - Bit 2)
          Write Connection Accept Timeout (Octet 7 - Bit 3)
          Read Transmit Power Level (Octet 10 - Bit 2)
          Set Controller To Host Flow Control (Octet 10 - Bit 5)
          Host Buffer Size (Octet 10 - Bit 6)
          Host Number of Completed Packets (Octet 10 - Bit 7)
          Read Local Version Information (Octet 14 - Bit 3)
          Read Local Supported Features (Octet 14 - Bit 5)
          Read BD ADDR (Octet 15 - Bit 1)
          Read RSSI (Octet 15 - Bit 5)
          Set Event Mask Page 2 (Octet 22 - Bit 2)
          LE Set Event Mask (Octet 25 - Bit 0)
          LE Read Buffer Size (Octet 25 - Bit 1)
          LE Read Local Supported Features (Octet 25 - Bit 2)
          LE Set Random Address (Octet 25 - Bit 4)
          LE Set Advertising Parameters (Octet 25 - Bit 5)
          LE Read Advertising Channel TX Power (Octet 25 - Bit 6)
          LE Set Advertising Data (Octet 25 - Bit 7)
          LE Set Scan Response Data (Octet 26 - Bit 0)
          LE Set Advertise Enable (Octet 26 - Bit 1)
          LE Set Scan Parameters (Octet 26 - Bit 2)
          LE Set Scan Enable (Octet 26 - Bit 3)
          LE Create Connection (Octet 26 - Bit 4)
          LE Create Connection Cancel (Octet 26 - Bit 5)
          LE Read Accept List Size (Octet 26 - Bit 6)
          LE Clear Accept List (Octet 26 - Bit 7)
          LE Add Device To Accept List (Octet 27 - Bit 0)
          LE Remove Device From Accept List (Octet 27 - Bit 1)
          LE Connection Update (Octet 27 - Bit 2)
          LE Set Host Channel Classification (Octet 27 - Bit 3)
          LE Read Channel Map (Octet 27 - Bit 4)
          LE Read Remote Used Features (Octet 27 - Bit 5)
          LE Encrypt (Octet 27 - Bit 6)
          LE Rand (Octet 27 - Bit 7)
          LE Start Encryption (Octet 28 - Bit 0)
          LE Long Term Key Request Reply (Octet 28 - Bit 1)
          LE Long Term Key Request Neg Reply (Octet 28 - Bit 2)
          LE Read Supported States (Octet 28 - Bit 3)
          LE Receiver Test (Octet 28 - Bit 4)
          LE Transmitter Test (Octet 28 - Bit 5)
          LE Test End (Octet 28 - Bit 6)
          Read Authenticated Payload Timeout (Octet 32 - Bit 4)
          Write Authenticated Payload Timeout (Octet 32 - Bit 5)
          LE Set Data Length (Octet 33 - Bit 6)
          LE Read Suggested Default Data Length (Octet 33 - Bit 7)
          LE Write Suggested Default Data Length (Octet 34 - Bit 0)
          LE Add Device To Resolving List (Octet 34 - Bit 3)
          LE Remove Device From Resolving List (Octet 34 - Bit 4)
          LE Clear Resolving List (Octet 34 - Bit 5)
          LE Read Resolving List Size (Octet 34 - Bit 6)
          LE Set Address Resolution Enable (Octet 35 - Bit 1)
          LE Set Resolvable Private Address Timeout (Octet 35 - Bit 2)
          LE Read Maximum Data Length (Octet 35 - Bit 3)
          LE Read PHY (Octet 35 - Bit 4)
          LE Set Default PHY (Octet 35 - Bit 5)
          LE Set PHY (Octet 35 - Bit 6)
          LE Enhanced Receiver Test (Octet 35 - Bit 7)
          LE Enhanced Transmitter Test (Octet 36 - Bit 0)
          LE Set Advertising Set Random Address (Octet 36 - Bit 1)
          LE Set Extended Advertising Parameters (Octet 36 - Bit 2)
          LE Set Extended Advertising Data (Octet 36 - Bit 3)
          LE Set Extended Scan Response Data (Octet 36 - Bit 4)
          LE Set Extended Advertising Enable (Octet 36 - Bit 5)
          LE Read Maximum Advertising Data Length (Octet 36 - Bit 6)
          LE Read Number of Supported Advertising Sets (Octet 36 - Bit 7)
          LE Remove Advertising Set (Octet 37 - Bit 0)
          LE Clear Advertising Sets (Octet 37 - Bit 1)
          LE Set Periodic Advertising Parameters (Octet 37 - Bit 2)
          LE Set Periodic Advertising Data (Octet 37 - Bit 3)
          LE Set Periodic Advertising Enable (Octet 37 - Bit 4)
          LE Set Extended Scan Parameters (Octet 37 - Bit 5)
          LE Set Extended Scan Enable (Octet 37 - Bit 6)
          LE Extended Create Connection (Octet 37 - Bit 7)
          LE Periodic Advertising Create Sync (Octet 38 - Bit 0)
          LE Periodic Advertising Create Sync Cancel (Octet 38 - Bit 1)
          LE Periodic Advertising Terminate Sync (Octet 38 - Bit 2)
          LE Add Device To Periodic Advertiser List (Octet 38 - Bit 3)
          LE Remove Device From Periodic Advertiser List (Octet 38 - Bit 4)
          LE Clear Periodic Advertiser List (Octet 38 - Bit 5)
          LE Read Periodic Advertiser List Size (Octet 38 - Bit 6)
          LE Read Transmit Power (Octet 38 - Bit 7)
          LE Read RF Path Compensation (Octet 39 - Bit 0)
          LE Write RF Path Compensation (Octet 39 - Bit 1)
          LE Set Privacy Mode (Octet 39 - Bit 2)
          LE Periodic Advertising Receive Enable (Octet 40 - Bit 5)
          LE Periodic Advertising Sync Transfer (Octet 40 - Bit 6)
          LE Periodic Advertising Set Info Transfer (Octet 40 - Bit 7)
          LE Periodic Advertising Sync Transfer Parameters (Octet 41 - Bit 0)
          LE Set Default Periodic Advertisng Sync Transfer Parameters (Octet 41 - Bit 1)
          LE Read Buffer v2 (Octet 41 - Bit 5)
          LE Read ISO TX Sync (Octet 41 - Bit 6)
          LE Set Connected Isochronous Group Parameters (Octet 41 - Bit 7)
          LE Set Connected Isochronous Group Parameters Test (Octet 42 - Bit 0)
          LE Create Connected Isochronous Stream (Octet 42 - Bit 1)
          LE Remove Connected Isochronous Group (Octet 42 - Bit 2)
          LE Accept Connected Isochronous Stream Request (Octet 42 - Bit 3)
          LE Reject Connected Isochronous Stream Request (Octet 42 - Bit 4)
          LE Create Broadcast Isochronous Group (Octet 42 - Bit 5)
          LE Create Broadcast Isochronous Group Test (Octet 42 - Bit 6)
          LE Terminate Broadcast Isochronous Group (Octet 42 - Bit 7)
          LE Broadcast Isochronous Group Create Sync (Octet 43 - Bit 0)
          LE Broadcast Isochronous Group Terminate Sync (Octet 43 - Bit 1)
          LE Request Peer SCA (Octet 43 - Bit 2)
          LE Setup Isochronous Data Path (Octet 43 - Bit 3)
          LE Remove Isochronous Data Path (Octet 43 - Bit 4)
          LE Isochronous Transmit Test (Octet 43 - Bit 5)
          LE Isochronous Receive Test (Octet 43 - Bit 6)
          LE Isochronous Read Test Counters (Octet 43 - Bit 7)
          LE Isochronous Read Test Counters (Octet 44 - Bit 0)
          LE Set Host Feature (Octet 44 - Bit 1)
          Octet 44 - Bit 2 
          Octet 45 - Bit 6 
          Octet 46 - Bit 0 
          Octet 46 - Bit 1 
          Octet 46 - Bit 2 
< HCI Command: Host Buffer Size (0x03|0x0033) plen 7         #9 [hci1] 0.590555
        ACL MTU: 255  ACL max packet: 16
        SCO MTU: 0    SCO max packet: 0
> HCI Event: Command Complete (0x0e) plen 4                 #10 [hci1] 0.591033
      Host Buffer Size (0x03|0x0033) ncmd 1
        Status: Success (0x00)
< HCI Command: Set Controller To Ho.. (0x03|0x0031) plen 1  #11 [hci1] 0.610511
        Flow control: ACL Data Packets (0x01)
> HCI Event: Command Complete (0x0e) plen 4                 #12 [hci1] 0.610930
      Set Controller To Host Flow Control (0x03|0x0031) ncmd 1
        Status: Success (0x00)
< HCI Command: LE Read Local Suppor.. (0x08|0x0003) plen 0  #13 [hci1] 0.630546
> HCI Event: Command Complete (0x0e) plen 12                #14 [hci1] 0.631033
      LE Read Local Supported Features (0x08|0x0003) ncmd 1
        Status: Success (0x00)
        Features: 0xfd 0x79 0x00 0xf7 0x30 0x01 0x00 0x00
          LE Encryption
          Extended Reject Indication
          Peripheral-initiated Features Exchange
          LE Ping
          LE Data Packet Length Extension
          LL Privacy
          Extended Scanner Filter Policies
          LE 2M PHY
          LE Coded PHY
          LE Extended Advertising
          LE Periodic Advertising
          Channel Selection Algorithm #2
          Periodic Advertising Sync Transfer - Sender
          Periodic Advertising Sync Transfer - Recipient
          Sleep Clock Accuracy Updates
          Connected Isochronous Stream - Central
          Connected Isochronous Stream - Peripheral
          Isochronous Broadcaster
          Synchronized Receiver
          Periodic Advertising ADI support
          Connection Subrating
          Unknown features (0x0000010000000000)
< HCI Command: LE Set Host Feature (0x08|0x0074) plen 2     #15 [hci1] 0.650534
        Bit Number: 32
          Connected Isochronous Stream (Host Support)
        Bit Value: 1
> HCI Event: Command Complete (0x0e) plen 4                 #16 [hci1] 0.651022
      LE Set Host Feature (0x08|0x0074) ncmd 1
        Status: Success (0x00)
< HCI Command: LE Read Buffer v2 (0x08|0x0060) plen 0       #17 [hci1] 0.670499
> HCI Event: Command Complete (0x0e) plen 10                #18 [hci1] 0.671064
      LE Read Buffer v2 (0x08|0x0060) ncmd 1
        Status: Success (0x00)
        ACL MTU: 27
        ACL max packet: 3
        ISO MTU: 318
        ISO max packet: 3
< HCI Command: LE Read Maximum Adve.. (0x08|0x003a) plen 0  #19 [hci1] 0.690634
> HCI Event: Command Complete (0x0e) plen 6                 #20 [hci1] 0.691104
      LE Read Maximum Advertising Data Length (0x08|0x003a) ncmd 1
        Status: Success (0x00)
        Max length: 1650
< HCI Command: LE Read Supported St.. (0x08|0x001c) plen 0  #21 [hci1] 0.710529
> HCI Event: Command Complete (0x0e) plen 12                #22 [hci1] 0.711120
      LE Read Supported States (0x08|0x001c) ncmd 1
        Status: Success (0x00)
        States: 0x000003ff3e0306ff
          Non-connectable Advertising State
          Scannable Advertising State
          Connectable Advertising State
          High Duty Cycle Directed Advertising State
          Passive Scanning State
          Active Scanning State
          Initiating State
            and Connection State (Central Role)
          Connection State (Peripheral Role)
          Scannable Advertising State
            and Passive Scanning State
          Connectable Advertising State
            and Passive Scanning State
          Non-connectable Advertising State
            and Initiating State
          Scannable Advertising State
            and Initiating State
          Active Scanning State
            and Connection State (Central Role)
          Passive Scanning State
            and Connection State (Peripheral Role)
          Active Scanning State
            and Connection State (Peripheral Role)
          Initiating State
            and Connection State (Central Role)
            and Central Role & Central Role
          Low Duty Cycle Directed Advertising State
          Connectable Advertising State
            and Initiating State
            and Central Role & Peripheral Role
          High Duty Cycle Directed Advertising State
            and Initiating State
            and Central Role & Peripheral Role
          Low Duty Cycle Directed Advertising State
            and Initiating State
            and Central Role & Peripheral Role
          Connectable Advertising State
            and Connection State (Central Role)
            and Central Role & Peripheral Role
          High Duty Cycle Directed Advertising State
            and Connection State (Central Role)
            and Central Role & Peripheral Role
          Low Duty Cycle Directed Advertising State
            and Connection State (Central Role)
            and Central Role & Peripheral Role
          Connectable Advertising State
            and Connection State (Peripheral Role)
            and Central Role & Peripheral Role
          High Duty Cycle Directed Advertising State
            and Connection State (Peripheral Role)
            and Peripheral Role & Peripheral Role
          Low Duty Cycle Directed Advertising State
            and Connection State (Peripheral Role)
            and Peripheral Role & Peripheral Role
          Initiating State
            and Connection State (Peripheral Role)
            and Central Role & Peripheral Role
< HCI Command: LE Read Maximum Data.. (0x08|0x002f) plen 0  #23 [hci1] 0.730500
> HCI Event: Command Complete (0x0e) plen 12                #24 [hci1] 0.731113
      LE Read Maximum Data Length (0x08|0x002f) ncmd 1
        Status: Success (0x00)
        Max TX octets: 251
        Max TX time: 2704
        Max RX octets: 251
        Max RX time: 2704
< HCI Command: LE Write Suggested D.. (0x08|0x0024) plen 4  #25 [hci1] 0.750511
        TX octets: 251
        TX time: 2704
> HCI Event: Command Complete (0x0e) plen 4                 #26 [hci1] 0.750993
      LE Write Suggested Default Data Length (0x08|0x0024) ncmd 1
        Status: Success (0x00)
< HCI Command: LE Read Resolving Li.. (0x08|0x002a) plen 0  #27 [hci1] 0.770509
> HCI Event: Command Complete (0x0e) plen 5                 #28 [hci1] 0.770897
      LE Read Resolving List Size (0x08|0x002a) ncmd 1
        Status: Success (0x00)
        Size: 8
< HCI Command: LE Set Host Feature (0x08|0x0074) plen 2     #29 [hci1] 0.790536
        Bit Number: 38
          Connection Subrating (Host Support)
        Bit Value: 1
> HCI Event: Command Complete (0x0e) plen 4                 #30 [hci1] 0.791037
      LE Set Host Feature (0x08|0x0074) ncmd 1
        Status: Success (0x00)
< HCI Command: LE Set Event Mask (0x08|0x0001) plen 8       #31 [hci1] 0.810538
        Mask: 0x000002063f87fa5e
          LE Advertising Report
          LE Connection Update Complete
          LE Read Remote Used Features Complete
          LE Long Term Key Request
          LE Data Length Change
          LE Enhanced Connection Complete
          LE PHY Update Complete
          LE Extended Advertising Report
          LE Periodic Advertising Sync Established
          LE Periodic Advertising Report
          LE Periodic Advertising Sync Lost
          LE Extended Scan Timeout
          LE Extended Advertising Set Terminated
          LE Scan Request Received
          LE Periodic Advertising Sync Transfer Rvc
          LE CIS Established
          LE CIS Request
          LE Create BIG Complete
          LE Terminate BIG Complete
          LE BIG Sync Estabilished Complete
          LE BIG Sync Lost
          LE BIG Info Advertising Report
          LE Subrate Change
          Unknown mask (0x0000020000000000)
> HCI Event: Command Complete (0x0e) plen 4                 #32 [hci1] 0.811007
      LE Set Event Mask (0x08|0x0001) ncmd 1
        Status: Success (0x00)
< HCI Command: Set Event Mask (0x03|0x0001) plen 8          #33 [hci1] 0.830527
        Mask: 0x2000800002008890
          Disconnection Complete
          Encryption Change
          Read Remote Version Information Complete
          Hardware Error
          Data Buffer Overflow
          Encryption Key Refresh Complete
          LE Meta
> HCI Event: Command Complete (0x0e) plen 4                 #34 [hci1] 0.831044
      Set Event Mask (0x03|0x0001) ncmd 1
        Status: Success (0x00)
< HCI Command: Read BD ADDR (0x04|0x0009) plen 0            #35 [hci1] 0.850511
> HCI Event: Command Complete (0x0e) plen 10                #36 [hci1] 0.851040
      Read BD ADDR (0x04|0x0009) ncmd 1
        Status: Success (0x00)
        Address: 00:00:00:00:00:00 (OUI 00-00-00)
< HCI Command: LE Set Random Address (0x08|0x0005) plen 6   #37 [hci1] 0.870531
        Address: D5:B6:CC:31:DB:3B (Static)
> HCI Event: Command Complete (0x0e) plen 4                 #38 [hci1] 0.871009
      LE Set Random Address (0x08|0x0005) ncmd 1
        Status: Success (0x00)
< HCI Command: LE Set Extended Adv.. (0x08|0x0036) plen 25  #39 [hci1] 3.330581
        Handle: 0x00
        Properties: 0x0013
          Connectable
          Scannable
          Use legacy advertising PDUs: ADV_IND
        Min advertising interval: 100.000 msec (0x00a0)
        Max advertising interval: 150.000 msec (0x00f0)
        Channel map: 37, 38, 39 (0x07)
        Own address type: Random (0x01)
        Peer address type: Public (0x00)
        Peer address: 00:00:00:00:00:00 (OUI 00-00-00)
        Filter policy: Allow Scan Request from Any, Allow Connect Request from Any (0x00)
        TX power: Host has no preference (0x7f)
        Primary PHY: LE 1M (0x01)
        Secondary max skip: 0x00
        Secondary PHY: LE 1M (0x01)
        SID: 0x00
        Scan request notifications: Disabled (0x00)
> HCI Event: Command Complete (0x0e) plen 5                 #40 [hci1] 3.331393
      LE Set Extended Advertising Parameters (0x08|0x0036) ncmd 1
        Status: Success (0x00)
        TX power (selected): 0 dbm (0x00)
< HCI Command: LE Set Advertising S.. (0x08|0x0035) plen 7  #41 [hci1] 3.350521
        Advertising handle: 0x00
        Advertising random address: D5:B6:CC:31:DB:3B (Static)
> HCI Event: Command Complete (0x0e) plen 4                 #42 [hci1] 3.351024
      LE Set Advertising Set Random Address (0x08|0x0035) ncmd 1
        Status: Success (0x00)
< HCI Command: LE Set Extended Adv.. (0x08|0x0037) plen 22  #43 [hci1] 3.370589
        Handle: 0x00
        Operation: Complete extended advertising data (0x03)
        Fragment preference: Minimize fragmentation (0x01)
        Data length: 0x12
        Flags: 0x06
          LE General Discoverable Mode
          BR/EDR Not Supported
        Name (complete): Tester_F6B11A
> HCI Event: Command Complete (0x0e) plen 4                 #44 [hci1] 3.371349
      LE Set Extended Advertising Data (0x08|0x0037) ncmd 1
        Status: Success (0x00)
< HCI Command: LE Set Extended Scan.. (0x08|0x0038) plen 4  #45 [hci1] 3.390469
        Handle: 0x00
        Operation: Complete scan response data (0x03)
        Fragment preference: Minimize fragmentation (0x01)
        Data length: 0x00
> HCI Event: Command Complete (0x0e) plen 4                 #46 [hci1] 3.390921
      LE Set Extended Scan Response Data (0x08|0x0038) ncmd 1
        Status: Success (0x00)
< HCI Command: LE Set Extended Adve.. (0x08|0x0039) plen 6  #47 [hci1] 3.410592
        Extended advertising: Enabled (0x01)
        Number of sets: 1 (0x01)
        Entry 0
          Handle: 0x00
          Duration: 0 ms (0x00)
          Max ext adv events: 0
> HCI Event: Command Complete (0x0e) plen 4                 #48 [hci1] 3.411154
      LE Set Extended Advertising Enable (0x08|0x0039) ncmd 1
        Status: Success (0x00)
> HCI Event: LE Meta Event (0x3e) plen 31                   #49 [hci1] 3.523150
      LE Enhanced Connection Complete (0x0a)
        Status: Success (0x00)
        Handle: 165
        Role: Peripheral (0x01)
        Peer address type: Public (0x00)
        Peer address: DF:A9:FF:F6:B1:1A (OUI DF-A9-FF)
        Local resolvable private address: 00:00:00:00:00:00 (Non-Resolvable)
        Peer resolvable private address: 00:00:00:00:00:00 (Non-Resolvable)
        Connection interval: 87.50 msec (0x0046)
        Connection latency: 0 (0x0000)
        Supervision timeout: 25120 msec (0x09d0)
        Central clock accuracy: 0x01
> HCI Event: LE Meta Event (0x3e) plen 6                    #50 [hci1] 3.523232
      LE Advertising Set Terminated (0x12)
        Status: Success (0x00)
        Handle: 0
        Connection handle: 165
        Number of completed extended advertising events: 0
< HCI Command: LE Read Remote Used... (0x08|0x0016) plen 2  #51 [hci1] 3.530763
        Handle: 165 Address: DF:A9:FF:F6:B1:1A (OUI DF-A9-FF)
< ACL Data TX: Handle 165 flags 0x00 dlen 7                 #52 [hci1] 3.530769
      ATT: Exchange MTU Request (0x02) len 2
        Client RX MTU: 251
> HCI Event: Command Status (0x0f) plen 4                   #53 [hci1] 3.531318
      LE Read Remote Used Features (0x08|0x0016) ncmd 1
        Status: Success (0x00)
> HCI Event: Number of Completed Packets (0x13) plen 5      #54 [hci1] 3.699190
        Num handles: 1
        Handle: 165 Address: DF:A9:FF:F6:B1:1A (OUI DF-A9-FF)
        Count: 1
        #52: len 7 (0 Kb/s)
        Latency: 168 msec (168-168 msec ~168 msec)
> HCI Event: LE Meta Event (0x3e) plen 12                   #55 [hci1] 3.787132
      LE Read Remote Used Features (0x04)
        Status: Success (0x00)
        Handle: 165 Address: DF:A9:FF:F6:B1:1A (OUI DF-A9-FF)
        Features: 0x2d 0x49 0x00 0xf7 0x67 0xd9 0x00 0x80
          LE Encryption
          Extended Reject Indication
          Peripheral-initiated Features Exchange
          LE Data Packet Length Extension
          LE 2M PHY
          LE Coded PHY
          Channel Selection Algorithm #2
          Periodic Advertising Sync Transfer - Sender
          Periodic Advertising Sync Transfer - Recipient
          Sleep Clock Accuracy Updates
          Connected Isochronous Stream - Central
          Connected Isochronous Stream - Peripheral
          Isochronous Broadcaster
          Synchronized Receiver
          Connected Isochronous Stream (Host Support)
          LE Power Control Request
          LE Power Control Request
          Connection Subrating
          Connection Subrating (Host Support)
          Unknown features (0x8000d90000000000)
> ACL Data RX: Handle 165 flags 0x02 dlen 11                #56 [hci1] 6.236813
      SMP: Pairing Request (0x01) len 6
        IO capability: KeyboardDisplay (0x04)
        OOB data: Authentication data not present (0x00)
        Authentication requirement: Bonding, No MITM, SC, No Keypresses (0x09)
        Max encryption key size: 16
        Initiator key distribution: EncKey IdKey (0x03)
        Responder key distribution: EncKey IdKey Sign (0x07)
> ACL Data RX: Handle 165 flags 0x02 dlen 7                 #57 [hci1] 6.237205
      ATT: Exchange MTU Response (0x03) len 2
        Server RX MTU: 23
< HCI Command: Host Number of Compl.. (0x03|0x0035) plen 5  #58 [hci1] 6.251004
        Num handles: 1
        Handle: 165 Address: DF:A9:FF:F6:B1:1A (OUI DF-A9-FF)
        Count: 1
< ACL Data TX: Handle 165 flags 0x00 dlen 11                #59 [hci1] 6.251163
      SMP: Pairing Response (0x02) len 6
        IO capability: DisplayOnly (0x00)
        OOB data: Authentication data not present (0x00)
        Authentication requirement: Bonding, No MITM, SC, No Keypresses (0x09)
        Max encryption key size: 16
        Initiator key distribution: IdKey (0x02)
        Responder key distribution: <none> (0x00)
< HCI Command: Host Number of Compl.. (0x03|0x0035) plen 5  #60 [hci1] 6.251523
        Num handles: 1
        Handle: 165 Address: DF:A9:FF:F6:B1:1A (OUI DF-A9-FF)
        Count: 1
> HCI Event: Number of Completed Packets (0x13) plen 5      #61 [hci1] 6.411842
        Num handles: 1
        Handle: 165 Address: DF:A9:FF:F6:B1:1A (OUI DF-A9-FF)
        Count: 1
        #59: len 11 (0 Kb/s)
        Latency: 160 msec (160-168 msec ~164 msec)
> ACL Data RX: Handle 165 flags 0x02 dlen 27                #62 [hci1] 6.412194
> ACL Data RX: Handle 165 flags 0x01 dlen 27                #63 [hci1] 6.412665
> ACL Data RX: Handle 165 flags 0x01 dlen 15                #64 [hci1] 6.413079
      SMP: Pairing Public Key (0x0c) len 64
        X: eec88d49d76234f9e9756b1bf32bdeff9023dd7af9bcb5eee8ab8e3f1959f425
        Y: 6c474b334c69bde33935ee5cdde9e86613aba8caf7fcef4a4e3d41987e75224e
< HCI Command: Host Number of Compl.. (0x03|0x0035) plen 5  #65 [hci1] 6.431234
        Num handles: 1
        Handle: 165 Address: DF:A9:FF:F6:B1:1A (OUI DF-A9-FF)
        Count: 1
< HCI Command: Host Number of Compl.. (0x03|0x0035) plen 5  #66 [hci1] 6.431523
        Num handles: 1
        Handle: 165 Address: DF:A9:FF:F6:B1:1A (OUI DF-A9-FF)
        Count: 1
< HCI Command: Host Number of Compl.. (0x03|0x0035) plen 5  #67 [hci1] 6.431787
        Num handles: 1
        Handle: 165 Address: DF:A9:FF:F6:B1:1A (OUI DF-A9-FF)
        Count: 1
< ACL Data TX: Handle 165 flags 0x00 dlen 27                #68 [hci1] 6.431856
< ACL Data TX: Handle 165 flags 0x01 dlen 27                #69 [hci1] 6.431914
< ACL Data TX: Handle 165 flags 0x01 dlen 15                #70 [hci1] 6.431923
      SMP: Pairing Public Key (0x0c) len 64
        X: 98308440221e2d910f0e54b71e7ec652857aa9b5a0dc65028824cc19db1226e9
        Y: 67a4816bcb62efb21701e31fdb27561a6217575fb007a8bbdabe7e28b6f68482
> HCI Event: Number of Completed Packets (0x13) plen 5      #71 [hci1] 6.499717
        Num handles: 1
        Handle: 165 Address: DF:A9:FF:F6:B1:1A (OUI DF-A9-FF)
        Count: 1
        #68: len 27 (3 Kb/s)
        Latency: 67 msec (67-168 msec ~116 msec)
> HCI Event: Number of Completed Packets (0x13) plen 5      #72 [hci1] 6.500478
        Num handles: 1
        Handle: 165 Address: DF:A9:FF:F6:B1:1A (OUI DF-A9-FF)
        Count: 1
        #69: len 27 (3 Kb/s)
        Latency: 68 msec (67-168 msec ~92 msec)
< ACL Data TX: Handle 165 flags 0x00 dlen 21                #73 [hci1] 6.510953
      SMP: Pairing Confirm (0x03) len 16
        Confim value: c4af755072277328269f36ff2029afda
> HCI Event: Number of Completed Packets (0x13) plen 5      #74 [hci1] 6.586703
        Num handles: 1
        Handle: 165 Address: DF:A9:FF:F6:B1:1A (OUI DF-A9-FF)
        Count: 1
        #70: len 15 (0 Kb/s)
        Latency: 154 msec (67-168 msec ~123 msec)
> HCI Event: Number of Completed Packets (0x13) plen 5      #75 [hci1] 6.674286
        Num handles: 1
        Handle: 165 Address: DF:A9:FF:F6:B1:1A (OUI DF-A9-FF)
        Count: 1
        #73: len 21 (1 Kb/s)
        Latency: 163 msec (67-168 msec ~143 msec)
> ACL Data RX: Handle 165 flags 0x02 dlen 21                #76 [hci1] 6.674639
      SMP: Pairing Random (0x04) len 16
        Random value: a6f6964bc73225180000000000000000
< HCI Command: Host Number of Compl.. (0x03|0x0035) plen 5  #77 [hci1] 6.690851
        Num handles: 1
        Handle: 165 Address: DF:A9:FF:F6:B1:1A (OUI DF-A9-FF)
        Count: 1
< ACL Data TX: Handle 165 flags 0x00 dlen 21                #78 [hci1] 6.690935
      SMP: Pairing Random (0x04) len 16
        Random value: 8e6108f966a694cbe26df70bb96773e6
> HCI Event: Number of Completed Packets (0x13) plen 5      #79 [hci1] 6.849111
        Num handles: 1
        Handle: 165 Address: DF:A9:FF:F6:B1:1A (OUI DF-A9-FF)
        Count: 1
        #78: len 21 (1 Kb/s)
        Latency: 158 msec (67-168 msec ~150 msec)
> ACL Data RX: Handle 165 flags 0x02 dlen 21                #80 [hci1] 7.024424
      SMP: Pairing DHKey Check (0x0d) len 16
        E: 860b0748a908097b31ff7b2536b1d90f
< HCI Command: Host Number of Compl.. (0x03|0x0035) plen 5  #81 [hci1] 7.031487
        Num handles: 1
        Handle: 165 Address: DF:A9:FF:F6:B1:1A (OUI DF-A9-FF)
        Count: 1
< ACL Data TX: Handle 165 flags 0x00 dlen 21                #82 [hci1] 7.031608
      SMP: Pairing DHKey Check (0x0d) len 16
        E: 98402515be9e2ef590eb735f1a4a399b
> HCI Event: Number of Completed Packets (0x13) plen 5      #83 [hci1] 7.199130
        Num handles: 1
        Handle: 165 Address: DF:A9:FF:F6:B1:1A (OUI DF-A9-FF)
        Count: 1
        #82: len 21 (1 Kb/s)
        Latency: 167 msec (67-168 msec ~159 msec)
> HCI Event: LE Meta Event (0x3e) plen 13                   #84 [hci1] 7.287191
      LE Long Term Key Request (0x05)
        Handle: 165 Address: DF:A9:FF:F6:B1:1A (OUI DF-A9-FF)
        Random number: 0x0000000000000000
        Encrypted diversifier: 0x0000
< HCI Command: LE Long Term Key Re.. (0x08|0x001a) plen 18  #85 [hci1] 7.290695
        Handle: 165 Address: DF:A9:FF:F6:B1:1A (OUI DF-A9-FF)
        Long term key: 1011d15d35c09bd63a6501790d333f89
> HCI Event: Command Complete (0x0e) plen 6                 #86 [hci1] 7.291376
      LE Long Term Key Request Reply (0x08|0x001a) ncmd 1
        Status: Success (0x00)
        Handle: 165 Address: DF:A9:FF:F6:B1:1A (OUI DF-A9-FF)
> HCI Event: Encryption Change (0x08) plen 4                #87 [hci1] 7.724395
        Status: Success (0x00)
        Handle: 165 Address: DF:A9:FF:F6:B1:1A (OUI DF-A9-FF)
        Encryption: Enabled with AES-CCM (0x01)
> ACL Data RX: Handle 165 flags 0x02 dlen 21                #88 [hci1] 7.811912
      SMP: Identity Information (0x08) len 16
        Identity resolving key: 1da25521ffd284a29cdef3d3ca57c9d8
< HCI Command: Host Number of Compl.. (0x03|0x0035) plen 5  #89 [hci1] 7.840968
        Num handles: 1
        Handle: 165 Address: DF:A9:FF:F6:B1:1A (OUI DF-A9-FF)
        Count: 1
> ACL Data RX: Handle 165 flags 0x02 dlen 12                #90 [hci1] 7.986860
      SMP: Identity Address Information (0x09) len 7
        Address: DF:A9:FF:F6:B1:1A (OUI DF-A9-FF)
< HCI Command: LE Add Device To Re.. (0x08|0x0027) plen 39  #91 [hci1] 7.991089
        Address type: Public (0x00)
        Address: DF:A9:FF:F6:B1:1A (OUI DF-A9-FF)
        Peer identity resolving key: 1da25521ffd284a29cdef3d3ca57c9d8
        Local identity resolving key: 00000000000000000000000000000000
> HCI Event: Command Complete (0x0e) plen 4                 #92 [hci1] 7.992142
      LE Add Device To Resolving List (0x08|0x0027) ncmd 1
        Status: Success (0x00)
< HCI Command: LE Set Privacy Mode (0x08|0x004e) plen 8     #93 [hci1] 8.010708
        Peer Identity address type: Public (0x00)
        Peer Identity address: DF:A9:FF:F6:B1:1A (OUI DF-A9-FF)
        Privacy Mode: Use Device Privacy (0x01)
> HCI Event: Command Complete (0x0e) plen 4                 #94 [hci1] 8.011250
      LE Set Privacy Mode (0x08|0x004e) ncmd 1
        Status: Success (0x00)
< HCI Command: LE Set Address Resol.. (0x08|0x002d) plen 1  #95 [hci1] 8.030689
        Address resolution: Enabled (0x01)
> HCI Event: Command Complete (0x0e) plen 4                 #96 [hci1] 8.031242
      LE Set Address Resolution Enable (0x08|0x002d) ncmd 1
        Status: Success (0x00)
< HCI Command: Host Number of Compl.. (0x03|0x0035) plen 5  #97 [hci1] 8.050589
        Num handles: 1
        Handle: 165 Address: DF:A9:FF:F6:B1:1A (OUI DF-A9-FF)
        Count: 1
> ACL Data RX: Handle 165 flags 0x02 dlen 11                #98 [hci1] 8.074362
      ATT: Read By Group Type Request (0x10) len 6
        Handle range: 0x0001-0xffff
        Attribute group type: Primary Service (0x2800)
< HCI Command: Host Number of Compl.. (0x03|0x0035) plen 5  #99 [hci1] 8.090893
        Num handles: 1
        Handle: 165 Address: DF:A9:FF:F6:B1:1A (OUI DF-A9-FF)
        Count: 1
< ACL Data TX: Handle 165 flags 0x00 dlen 24               #100 [hci1] 8.090937
      ATT: Read By Group Type Response (0x11) len 19
        Attribute data length: 6
        Attribute group list: 3 entries
        Handle range: 0x0001-0x000a
        UUID: Generic Attribute Profile (0x1801)
        Handle range: 0x000b-0x0011
        UUID: Generic Access Profile (0x1800)
        Handle range: 0x0012-0x0026
        UUID: Device Information (0x180a)
> HCI Event: Number of Completed Packets (0x13) plen 5     #101 [hci1] 8.249279
        Num handles: 1
        Handle: 165 Address: DF:A9:FF:F6:B1:1A (OUI DF-A9-FF)
        Count: 1
        #100: len 24 (1 Kb/s)
        Latency: 158 msec (67-168 msec ~158 msec)
> ACL Data RX: Handle 165 flags 0x02 dlen 11               #102 [hci1] 8.249498
      ATT: Read By Group Type Request (0x10) len 6
        Handle range: 0x0027-0xffff
        Attribute group type: Primary Service (0x2800)
< HCI Command: Host Number of Comp.. (0x03|0x0035) plen 5  #103 [hci1] 8.250752
        Num handles: 1
        Handle: 165 Address: DF:A9:FF:F6:B1:1A (OUI DF-A9-FF)
        Count: 1
< ACL Data TX: Handle 165 flags 0x00 dlen 18               #104 [hci1] 8.250825
      ATT: Read By Group Type Response (0x11) len 13
        Attribute data length: 6
        Attribute group list: 2 entries
        Handle range: 0x0027-0x0029
        UUID: Immediate Alert (0x1802)
        Handle range: 0x003d-0x007b
        UUID: Generic Media Control (0x1849)
> HCI Event: Number of Completed Packets (0x13) plen 5     #105 [hci1] 8.424238
        Num handles: 1
        Handle: 165 Address: DF:A9:FF:F6:B1:1A (OUI DF-A9-FF)
        Count: 1
        #104: len 18 (0 Kb/s)
        Latency: 173 msec (67-173 msec ~166 msec)
> ACL Data RX: Handle 165 flags 0x02 dlen 11               #106 [hci1] 8.424444
      ATT: Read By Group Type Request (0x10) len 6
        Handle range: 0x007c-0xffff
        Attribute group type: Primary Service (0x2800)
< HCI Command: Host Number of Comp.. (0x03|0x0035) plen 5  #107 [hci1] 8.431232
        Num handles: 1
        Handle: 165 Address: DF:A9:FF:F6:B1:1A (OUI DF-A9-FF)
        Count: 1
< ACL Data TX: Handle 165 flags 0x00 dlen 9                #108 [hci1] 8.431448
      ATT: Error Response (0x01) len 4
        Read By Group Type Request (0x10)
        Handle: 0x007c
        Error: Attribute Not Found (0x0a)
> HCI Event: Number of Completed Packets (0x13) plen 5     #109 [hci1] 8.599146
        Num handles: 1
        Handle: 165 Address: DF:A9:FF:F6:B1:1A (OUI DF-A9-FF)
        Count: 1
        #108: len 9 (0 Kb/s)
        Latency: 167 msec (67-173 msec ~166 msec)
> ACL Data RX: Handle 165 flags 0x02 dlen 11               #110 [hci1] 8.599454
      ATT: Read By Type Request (0x08) len 6
        Handle range: 0x0001-0x000a
        Attribute type: Characteristic (0x2803)
< HCI Command: Host Number of Comp.. (0x03|0x0035) plen 5  #111 [hci1] 8.611242
        Num handles: 1
        Handle: 165 Address: DF:A9:FF:F6:B1:1A (OUI DF-A9-FF)
        Count: 1
< ACL Data TX: Handle 165 flags 0x00 dlen 20               #112 [hci1] 8.611395
      ATT: Read By Type Response (0x09) len 15
        Attribute data length: 7
        Attribute data list: 2 entries
        Handle: 0x0002
        Value: 200300052a
            Properties: 0x20
              Indicate (0x20)
            Value Handle: 0x0003
            Value UUID: Service Changed (0x2a05)
        Handle: 0x0005
        Value: 0a0600292b
            Properties: 0x0a
              Read (0x02)
              Write (0x08)
            Value Handle: 0x0006
            Value UUID: Client Supported Features (0x2b29)
> HCI Event: Number of Completed Packets (0x13) plen 5     #113 [hci1] 8.774230
        Num handles: 1
        Handle: 165 Address: DF:A9:FF:F6:B1:1A (OUI DF-A9-FF)
        Count: 1
        #112: len 20 (0 Kb/s)
        Latency: 162 msec (67-173 msec ~164 msec)
> ACL Data RX: Handle 165 flags 0x02 dlen 11               #114 [hci1] 8.774423
      ATT: Read By Type Request (0x08) len 6
        Handle range: 0x0006-0x000a
        Attribute type: Characteristic (0x2803)
< HCI Command: Host Number of Comp.. (0x03|0x0035) plen 5  #115 [hci1] 8.791324
        Num handles: 1
        Handle: 165 Address: DF:A9:FF:F6:B1:1A (OUI DF-A9-FF)
        Count: 1
< ACL Data TX: Handle 165 flags 0x00 dlen 20               #116 [hci1] 8.791383
      ATT: Read By Type Response (0x09) len 15
        Attribute data length: 7
        Attribute data list: 2 entries
        Handle: 0x0007
        Value: 0208002a2b
            Properties: 0x02
              Read (0x02)
            Value Handle: 0x0008
            Value UUID: Database Hash (0x2b2a)
        Handle: 0x0009
        Value: 020a003a2b
            Properties: 0x02
              Read (0x02)
            Value Handle: 0x000a
            Value UUID: Server Supported Features (0x2b3a)
> HCI Event: Number of Completed Packets (0x13) plen 5     #117 [hci1] 8.949221
        Num handles: 1
        Handle: 165 Address: DF:A9:FF:F6:B1:1A (OUI DF-A9-FF)
        Count: 1
        #116: len 20 (1 Kb/s)
        Latency: 157 msec (67-173 msec ~161 msec)
> ACL Data RX: Handle 165 flags 0x02 dlen 11               #118 [hci1] 8.949526
      ATT: Read By Type Request (0x08) len 6
        Handle range: 0x000a-0x000a
        Attribute type: Characteristic (0x2803)
< HCI Command: Host Number of Comp.. (0x03|0x0035) plen 5  #119 [hci1] 8.951385
        Num handles: 1
        Handle: 165 Address: DF:A9:FF:F6:B1:1A (OUI DF-A9-FF)
        Count: 1
< ACL Data TX: Handle 165 flags 0x00 dlen 9                #120 [hci1] 8.951611
      ATT: Error Response (0x01) len 4
        Read By Type Request (0x08)
        Handle: 0x000a
        Error: Attribute Not Found (0x0a)
> HCI Event: Number of Completed Packets (0x13) plen 5     #121 [hci1] 9.124211
        Num handles: 1
        Handle: 165 Address: DF:A9:FF:F6:B1:1A (OUI DF-A9-FF)
        Count: 1
        #120: len 9 (0 Kb/s)
        Latency: 172 msec (67-173 msec ~166 msec)
> ACL Data RX: Handle 165 flags 0x02 dlen 9                #122 [hci1] 9.124487
      ATT: Find Information Request (0x04) len 4
        Handle range: 0x0004-0x0004
< HCI Command: Host Number of Comp.. (0x03|0x0035) plen 5  #123 [hci1] 9.131168
        Num handles: 1
        Handle: 165 Address: DF:A9:FF:F6:B1:1A (OUI DF-A9-FF)
        Count: 1
< ACL Data TX: Handle 165 flags 0x00 dlen 10               #124 [hci1] 9.131275
      ATT: Find Information Response (0x05) len 5
        Format: UUID-16 (0x01)
        Handle: 0x0004
        UUID: Client Characteristic Configuration (0x2902)
> HCI Event: Number of Completed Packets (0x13) plen 5     #125 [hci1] 9.299180
        Num handles: 1
        Handle: 165 Address: DF:A9:FF:F6:B1:1A (OUI DF-A9-FF)
        Count: 1
        #124: len 10 (0 Kb/s)
        Latency: 167 msec (67-173 msec ~167 msec)
> ACL Data RX: Handle 165 flags 0x02 dlen 11               #126 [hci1] 9.299427
      ATT: Read By Type Request (0x08) len 6
        Handle range: 0x000b-0x0011
        Attribute type: Characteristic (0x2803)
< HCI Command: Host Number of Comp.. (0x03|0x0035) plen 5  #127 [hci1] 9.311175
        Num handles: 1
        Handle: 165 Address: DF:A9:FF:F6:B1:1A (OUI DF-A9-FF)
        Count: 1
< ACL Data TX: Handle 165 flags 0x00 dlen 20               #128 [hci1] 9.311276
      ATT: Read By Type Response (0x09) len 15
        Attribute data length: 7
        Attribute data list: 2 entries
        Handle: 0x000c
        Value: 0a0d00002a
            Properties: 0x0a
              Read (0x02)
              Write (0x08)
            Value Handle: 0x000d
            Value UUID: Device Name (0x2a00)
        Handle: 0x000e
        Value: 0a0f00012a
            Properties: 0x0a
              Read (0x02)
              Write (0x08)
            Value Handle: 0x000f
            Value UUID: Appearance (0x2a01)
> HCI Event: Number of Completed Packets (0x13) plen 5     #129 [hci1] 9.474212
        Num handles: 1
        Handle: 165 Address: DF:A9:FF:F6:B1:1A (OUI DF-A9-FF)
        Count: 1
        #128: len 20 (0 Kb/s)
        Latency: 162 msec (67-173 msec ~165 msec)
> ACL Data RX: Handle 165 flags 0x02 dlen 11               #130 [hci1] 9.474416
      ATT: Read By Type Request (0x08) len 6
        Handle range: 0x000f-0x0011
        Attribute type: Characteristic (0x2803)
< HCI Command: Host Number of Comp.. (0x03|0x0035) plen 5  #131 [hci1] 9.490757
        Num handles: 1
        Handle: 165 Address: DF:A9:FF:F6:B1:1A (OUI DF-A9-FF)
        Count: 1
< ACL Data TX: Handle 165 flags 0x00 dlen 13               #132 [hci1] 9.490785
      ATT: Read By Type Response (0x09) len 8
        Attribute data length: 7
        Attribute data list: 1 entry
        Handle: 0x0010
        Value: 021100042a
            Properties: 0x02
              Read (0x02)
            Value Handle: 0x0011
            Value UUID: Peripheral Preferred Connection Parameters (0x2a04)
> HCI Event: Number of Completed Packets (0x13) plen 5     #133 [hci1] 9.649197
        Num handles: 1
        Handle: 165 Address: DF:A9:FF:F6:B1:1A (OUI DF-A9-FF)
        Count: 1
        #132: len 13 (0 Kb/s)
        Latency: 158 msec (67-173 msec ~161 msec)
> ACL Data RX: Handle 165 flags 0x02 dlen 11               #134 [hci1] 9.649420
      ATT: Read By Type Request (0x08) len 6
        Handle range: 0x0011-0x0011
        Attribute type: Characteristic (0x2803)
< HCI Command: Host Number of Comp.. (0x03|0x0035) plen 5  #135 [hci1] 9.651173
        Num handles: 1
        Handle: 165 Address: DF:A9:FF:F6:B1:1A (OUI DF-A9-FF)
        Count: 1
< ACL Data TX: Handle 165 flags 0x00 dlen 9                #136 [hci1] 9.651402
      ATT: Error Response (0x01) len 4
        Read By Type Request (0x08)
        Handle: 0x0011
        Error: Attribute Not Found (0x0a)
> HCI Event: Number of Completed Packets (0x13) plen 5     #137 [hci1] 9.824149
        Num handles: 1
        Handle: 165 Address: DF:A9:FF:F6:B1:1A (OUI DF-A9-FF)
        Count: 1
        #136: len 9 (0 Kb/s)
        Latency: 172 msec (67-173 msec ~167 msec)
> ACL Data RX: Handle 165 flags 0x02 dlen 11               #138 [hci1] 9.824440
      ATT: Read By Type Request (0x08) len 6
        Handle range: 0x0012-0x0026
        Attribute type: Characteristic (0x2803)
< HCI Command: Host Number of Comp.. (0x03|0x0035) plen 5  #139 [hci1] 9.830990
        Num handles: 1
        Handle: 165 Address: DF:A9:FF:F6:B1:1A (OUI DF-A9-FF)
        Count: 1
< ACL Data TX: Handle 165 flags 0x00 dlen 20               #140 [hci1] 9.831039
      ATT: Read By Type Response (0x09) len 15
        Attribute data length: 7
        Attribute data list: 2 entries
        Handle: 0x0013
        Value: 021400242a
            Properties: 0x02
              Read (0x02)
            Value Handle: 0x0014
            Value UUID: Model Number String (0x2a24)
        Handle: 0x0015
        Value: 021600292a
            Properties: 0x02
              Read (0x02)
            Value Handle: 0x0016
            Value UUID: Manufacturer Name String (0x2a29)
> HCI Event: Number of Completed Packets (0x13) plen 5     #141 [hci1] 9.999185
        Num handles: 1
        Handle: 165 Address: DF:A9:FF:F6:B1:1A (OUI DF-A9-FF)
        Count: 1
        #140: len 20 (0 Kb/s)
        Latency: 168 msec (67-173 msec ~167 msec)
> ACL Data RX: Handle 165 flags 0x02 dlen 11               #142 [hci1] 9.999408
      ATT: Read By Type Request (0x08) len 6
        Handle range: 0x0016-0x0026
        Attribute type: Characteristic (0x2803)
< HCI Command: Host Number of Com.. (0x03|0x0035) plen 5  #143 [hci1] 10.011018
        Num handles: 1
        Handle: 165 Address: DF:A9:FF:F6:B1:1A (OUI DF-A9-FF)
        Count: 1
< ACL Data TX: Handle 165 flags 0x00 dlen 20              #144 [hci1] 10.011110
      ATT: Read By Type Response (0x09) len 15
        Attribute data length: 7
        Attribute data list: 2 entries
        Handle: 0x0017
        Value: 021800502a
            Properties: 0x02
              Read (0x02)
            Value Handle: 0x0018
            Value UUID: PnP ID (0x2a50)
        Handle: 0x0019
        Value: 021a00252a
            Properties: 0x02
              Read (0x02)
            Value Handle: 0x001a
            Value UUID: Serial Number String (0x2a25)
> HCI Event: Number of Completed Packets (0x13) plen 5    #145 [hci1] 10.174220
        Num handles: 1
        Handle: 165 Address: DF:A9:FF:F6:B1:1A (OUI DF-A9-FF)
        Count: 1
        #144: len 20 (0 Kb/s)
        Latency: 163 msec (67-173 msec ~165 msec)
> ACL Data RX: Handle 165 flags 0x02 dlen 11              #146 [hci1] 10.174388
      ATT: Read By Type Request (0x08) len 6
        Handle range: 0x001a-0x0026
        Attribute type: Characteristic (0x2803)
< HCI Command: Host Number of Com.. (0x03|0x0035) plen 5  #147 [hci1] 10.191146
        Num handles: 1
        Handle: 165 Address: DF:A9:FF:F6:B1:1A (OUI DF-A9-FF)
        Count: 1
< ACL Data TX: Handle 165 flags 0x00 dlen 20              #148 [hci1] 10.191218
      ATT: Read By Type Response (0x09) len 15
        Attribute data length: 7
        Attribute data list: 2 entries
        Handle: 0x001b
        Value: 021c00262a
            Properties: 0x02
              Read (0x02)
            Value Handle: 0x001c
            Value UUID: Firmware Revision String (0x2a26)
        Handle: 0x001d
        Value: 021e00272a
            Properties: 0x02
              Read (0x02)
            Value Handle: 0x001e
            Value UUID: Hardware Revision String (0x2a27)
> HCI Event: Number of Completed Packets (0x13) plen 5    #149 [hci1] 10.349253
        Num handles: 1
        Handle: 165 Address: DF:A9:FF:F6:B1:1A (OUI DF-A9-FF)
        Count: 1
        #148: len 20 (1 Kb/s)
        Latency: 158 msec (67-173 msec ~161 msec)
> ACL Data RX: Handle 165 flags 0x02 dlen 11              #150 [hci1] 10.349535
      ATT: Read By Type Request (0x08) len 6
        Handle range: 0x001e-0x0026
        Attribute type: Characteristic (0x2803)
< HCI Command: Host Number of Com.. (0x03|0x0035) plen 5  #151 [hci1] 10.350815
        Num handles: 1
        Handle: 165 Address: DF:A9:FF:F6:B1:1A (OUI DF-A9-FF)
        Count: 1
< ACL Data TX: Handle 165 flags 0x00 dlen 20              #152 [hci1] 10.350858
      ATT: Read By Type Response (0x09) len 15
        Attribute data length: 7
        Attribute data list: 2 entries
        Handle: 0x001f
        Value: 022000282a
            Properties: 0x02
              Read (0x02)
            Value Handle: 0x0020
            Value UUID: Software Revision String (0x2a28)
        Handle: 0x0021
        Value: 022200ff2b
            Properties: 0x02
              Read (0x02)
            Value Handle: 0x0022
            Value UUID: Unknown (0x2bff)
> HCI Event: Number of Completed Packets (0x13) plen 5    #153 [hci1] 10.524157
        Num handles: 1
        Handle: 165 Address: DF:A9:FF:F6:B1:1A (OUI DF-A9-FF)
        Count: 1
        #152: len 20 (0 Kb/s)
        Latency: 173 msec (67-173 msec ~167 msec)
> ACL Data RX: Handle 165 flags 0x02 dlen 11              #154 [hci1] 10.524458
      ATT: Read By Type Request (0x08) len 6
        Handle range: 0x0022-0x0026
        Attribute type: Characteristic (0x2803)
< HCI Command: Host Number of Com.. (0x03|0x0035) plen 5  #155 [hci1] 10.531169
        Num handles: 1
        Handle: 165 Address: DF:A9:FF:F6:B1:1A (OUI DF-A9-FF)
        Count: 1
< ACL Data TX: Handle 165 flags 0x00 dlen 20              #156 [hci1] 10.531238
      ATT: Read By Type Response (0x09) len 15
        Attribute data length: 7
        Attribute data list: 2 entries
        Handle: 0x0023
        Value: 022400232a
            Properties: 0x02
              Read (0x02)
            Value Handle: 0x0024
            Value UUID: System ID (0x2a23)
        Handle: 0x0025
        Value: 0226002a2a
            Properties: 0x02
              Read (0x02)
            Value Handle: 0x0026
            Value UUID: IEEE 11073-20601 Regulatory Cert. Data List (0x2a2a)
> HCI Event: Number of Completed Packets (0x13) plen 5    #157 [hci1] 10.699168
        Num handles: 1
        Handle: 165 Address: DF:A9:FF:F6:B1:1A (OUI DF-A9-FF)
        Count: 1
        #156: len 20 (0 Kb/s)
        Latency: 167 msec (67-173 msec ~167 msec)
> ACL Data RX: Handle 165 flags 0x02 dlen 11              #158 [hci1] 10.699438
      ATT: Read By Type Request (0x08) len 6
        Handle range: 0x0026-0x0026
        Attribute type: Characteristic (0x2803)
< HCI Command: Host Number of Com.. (0x03|0x0035) plen 5  #159 [hci1] 10.710859
        Num handles: 1
        Handle: 165 Address: DF:A9:FF:F6:B1:1A (OUI DF-A9-FF)
        Count: 1
< ACL Data TX: Handle 165 flags 0x00 dlen 9               #160 [hci1] 10.710968
      ATT: Error Response (0x01) len 4
        Read By Type Request (0x08)
        Handle: 0x0026
        Error: Attribute Not Found (0x0a)
> HCI Event: Number of Completed Packets (0x13) plen 5    #161 [hci1] 10.874215
        Num handles: 1
        Handle: 165 Address: DF:A9:FF:F6:B1:1A (OUI DF-A9-FF)
        Count: 1
        #160: len 9 (0 Kb/s)
        Latency: 163 msec (67-173 msec ~165 msec)
> ACL Data RX: Handle 165 flags 0x02 dlen 11              #162 [hci1] 10.874354
      ATT: Read By Type Request (0x08) len 6
        Handle range: 0x0027-0x0029
        Attribute type: Characteristic (0x2803)
< HCI Command: Host Number of Com.. (0x03|0x0035) plen 5  #163 [hci1] 10.890901
        Num handles: 1
        Handle: 165 Address: DF:A9:FF:F6:B1:1A (OUI DF-A9-FF)
        Count: 1
< ACL Data TX: Handle 165 flags 0x00 dlen 13              #164 [hci1] 10.890978
      ATT: Read By Type Response (0x09) len 8
        Attribute data length: 7
        Attribute data list: 1 entry
        Handle: 0x0028
        Value: 042900062a
            Properties: 0x04
              Write Without Response (0x04)
            Value Handle: 0x0029
            Value UUID: Alert Level (0x2a06)
> HCI Event: Number of Completed Packets (0x13) plen 5    #165 [hci1] 11.049268
        Num handles: 1
        Handle: 165 Address: DF:A9:FF:F6:B1:1A (OUI DF-A9-FF)
        Count: 1
        #164: len 13 (0 Kb/s)
        Latency: 158 msec (67-173 msec ~161 msec)
> ACL Data RX: Handle 165 flags 0x02 dlen 11              #166 [hci1] 11.049381
      ATT: Read By Type Request (0x08) len 6
        Handle range: 0x0029-0x0029
        Attribute type: Characteristic (0x2803)
< HCI Command: Host Number of Com.. (0x03|0x0035) plen 5  #167 [hci1] 11.051133
        Num handles: 1
        Handle: 165 Address: DF:A9:FF:F6:B1:1A (OUI DF-A9-FF)
        Count: 1
< ACL Data TX: Handle 165 flags 0x00 dlen 9               #168 [hci1] 11.051332
      ATT: Error Response (0x01) len 4
        Read By Type Request (0x08)
        Handle: 0x0029
        Error: Attribute Not Found (0x0a)
> HCI Event: Number of Completed Packets (0x13) plen 5    #169 [hci1] 11.224134
        Num handles: 1
        Handle: 165 Address: DF:A9:FF:F6:B1:1A (OUI DF-A9-FF)
        Count: 1
        #168: len 9 (0 Kb/s)
        Latency: 172 msec (67-173 msec ~167 msec)
> ACL Data RX: Handle 165 flags 0x02 dlen 11              #170 [hci1] 11.224367
      ATT: Read By Type Request (0x08) len 6
        Handle range: 0x003d-0x007b
        Attribute type: Characteristic (0x2803)
< HCI Command: Host Number of Com.. (0x03|0x0035) plen 5  #171 [hci1] 11.230800
        Num handles: 1
        Handle: 165 Address: DF:A9:FF:F6:B1:1A (OUI DF-A9-FF)
        Count: 1
< ACL Data TX: Handle 165 flags 0x00 dlen 20              #172 [hci1] 11.230870
      ATT: Read By Type Response (0x09) len 15
        Attribute data length: 7
        Attribute data list: 2 entries
        Handle: 0x003f
        Value: 124000932b
            Properties: 0x12
              Read (0x02)
              Notify (0x10)
            Value Handle: 0x0040
            Value UUID: Media Player Name (0x2b93)
        Handle: 0x0042
        Value: 024300942b
            Properties: 0x02
              Read (0x02)
            Value Handle: 0x0043
            Value UUID: Media Player Icon Object ID (0x2b94)
> HCI Event: Number of Completed Packets (0x13) plen 5    #173 [hci1] 11.399156
        Num handles: 1
        Handle: 165 Address: DF:A9:FF:F6:B1:1A (OUI DF-A9-FF)
        Count: 1
        #172: len 20 (0 Kb/s)
        Latency: 168 msec (67-173 msec ~167 msec)
> ACL Data RX: Handle 165 flags 0x02 dlen 11              #174 [hci1] 11.399495
      ATT: Read By Type Request (0x08) len 6
        Handle range: 0x0043-0x007b
        Attribute type: Characteristic (0x2803)
< HCI Command: Host Number of Com.. (0x03|0x0035) plen 5  #175 [hci1] 11.410832
        Num handles: 1
        Handle: 165 Address: DF:A9:FF:F6:B1:1A (OUI DF-A9-FF)
        Count: 1
< ACL Data TX: Handle 165 flags 0x00 dlen 20              #176 [hci1] 11.410864
      ATT: Read By Type Response (0x09) len 15
        Attribute data length: 7
        Attribute data list: 2 entries
        Handle: 0x0044
        Value: 024500952b
            Properties: 0x02
              Read (0x02)
            Value Handle: 0x0045
            Value UUID: Media Player Icon URL (0x2b95)
        Handle: 0x0046
        Value: 104700962b
            Properties: 0x10
              Notify (0x10)
            Value Handle: 0x0047
            Value UUID: Track Changed (0x2b96)
> HCI Event: Number of Completed Packets (0x13) plen 5    #177 [hci1] 11.574282
        Num handles: 1
        Handle: 165 Address: DF:A9:FF:F6:B1:1A (OUI DF-A9-FF)
        Count: 1
        #176: len 20 (0 Kb/s)
        Latency: 163 msec (67-173 msec ~165 msec)
> ACL Data RX: Handle 165 flags 0x02 dlen 11              #178 [hci1] 11.574410
      ATT: Read By Type Request (0x08) len 6
        Handle range: 0x0047-0x007b
        Attribute type: Characteristic (0x2803)
< HCI Command: Host Number of Com.. (0x03|0x0035) plen 5  #179 [hci1] 11.591419
        Num handles: 1
        Handle: 165 Address: DF:A9:FF:F6:B1:1A (OUI DF-A9-FF)
        Count: 1
< ACL Data TX: Handle 165 flags 0x00 dlen 20              #180 [hci1] 11.591526
      ATT: Read By Type Response (0x09) len 15
        Attribute data length: 7
        Attribute data list: 2 entries
        Handle: 0x0049
        Value: 124a00972b
            Properties: 0x12
              Read (0x02)
              Notify (0x10)
            Value Handle: 0x004a
            Value UUID: Track Title (0x2b97)
        Handle: 0x004c
        Value: 124d00982b
            Properties: 0x12
              Read (0x02)
              Notify (0x10)
            Value Handle: 0x004d
            Value UUID: Track Duration (0x2b98)
> HCI Event: Number of Completed Packets (0x13) plen 5    #181 [hci1] 11.749264
        Num handles: 1
        Handle: 165 Address: DF:A9:FF:F6:B1:1A (OUI DF-A9-FF)
        Count: 1
        #180: len 20 (1 Kb/s)
        Latency: 157 msec (67-173 msec ~161 msec)
> ACL Data RX: Handle 165 flags 0x02 dlen 11              #182 [hci1] 11.749504
      ATT: Read By Type Request (0x08) len 6
        Handle range: 0x004d-0x007b
        Attribute type: Characteristic (0x2803)
< HCI Command: Host Number of Com.. (0x03|0x0035) plen 5  #183 [hci1] 11.750786
        Num handles: 1
        Handle: 165 Address: DF:A9:FF:F6:B1:1A (OUI DF-A9-FF)
        Count: 1
< ACL Data TX: Handle 165 flags 0x00 dlen 20              #184 [hci1] 11.750889
      ATT: Read By Type Response (0x09) len 15
        Attribute data length: 7
        Attribute data list: 2 entries
        Handle: 0x004f
        Value: 1e5000992b
            Properties: 0x1e
              Read (0x02)
              Write Without Response (0x04)
              Write (0x08)
              Notify (0x10)
            Value Handle: 0x0050
            Value UUID: Track Position (0x2b99)
        Handle: 0x0052
        Value: 1e53009a2b
            Properties: 0x1e
              Read (0x02)
              Write Without Response (0x04)
              Write (0x08)
              Notify (0x10)
            Value Handle: 0x0053
            Value UUID: Playback Speed (0x2b9a)
> HCI Event: Number of Completed Packets (0x13) plen 5    #185 [hci1] 11.924182
        Num handles: 1
        Handle: 165 Address: DF:A9:FF:F6:B1:1A (OUI DF-A9-FF)
        Count: 1
        #184: len 20 (0 Kb/s)
        Latency: 173 msec (67-173 msec ~167 msec)
> ACL Data RX: Handle 165 flags 0x02 dlen 11              #186 [hci1] 11.924391
      ATT: Read By Type Request (0x08) len 6
        Handle range: 0x0053-0x007b
        Attribute type: Characteristic (0x2803)
< HCI Command: Host Number of Com.. (0x03|0x0035) plen 5  #187 [hci1] 11.931004
        Num handles: 1
        Handle: 165 Address: DF:A9:FF:F6:B1:1A (OUI DF-A9-FF)
        Count: 1
< ACL Data TX: Handle 165 flags 0x00 dlen 20              #188 [hci1] 11.931098
      ATT: Read By Type Response (0x09) len 15
        Attribute data length: 7
        Attribute data list: 2 entries
        Handle: 0x0055
        Value: 1256009b2b
            Properties: 0x12
              Read (0x02)
              Notify (0x10)
            Value Handle: 0x0056
            Value UUID: Seeking Speed (0x2b9b)
        Handle: 0x0058
        Value: 0259009c2b
            Properties: 0x02
              Read (0x02)
            Value Handle: 0x0059
            Value UUID: Current Track Segments Object ID (0x2b9c)
> HCI Event: Number of Completed Packets (0x13) plen 5    #189 [hci1] 12.099146
        Num handles: 1
        Handle: 165 Address: DF:A9:FF:F6:B1:1A (OUI DF-A9-FF)
        Count: 1
        #188: len 20 (0 Kb/s)
        Latency: 168 msec (67-173 msec ~167 msec)
> ACL Data RX: Handle 165 flags 0x02 dlen 11              #190 [hci1] 12.099403
      ATT: Read By Type Request (0x08) len 6
        Handle range: 0x0059-0x007b
        Attribute type: Characteristic (0x2803)
< HCI Command: Host Number of Com.. (0x03|0x0035) plen 5  #191 [hci1] 12.111208
        Num handles: 1
        Handle: 165 Address: DF:A9:FF:F6:B1:1A (OUI DF-A9-FF)
        Count: 1
< ACL Data TX: Handle 165 flags 0x00 dlen 20              #192 [hci1] 12.111375
      ATT: Read By Type Response (0x09) len 15
        Attribute data length: 7
        Attribute data list: 2 entries
        Handle: 0x005a
        Value: 1e5b009d2b
            Properties: 0x1e
              Read (0x02)
              Write Without Response (0x04)
              Write (0x08)
              Notify (0x10)
            Value Handle: 0x005b
            Value UUID: Current Track Object ID (0x2b9d)
        Handle: 0x005d
        Value: 1e5e009e2b
            Properties: 0x1e
              Read (0x02)
              Write Without Response (0x04)
              Write (0x08)
              Notify (0x10)
            Value Handle: 0x005e
            Value UUID: Next Track Object ID (0x2b9e)
> HCI Event: Number of Completed Packets (0x13) plen 5    #193 [hci1] 12.274152
        Num handles: 1
        Handle: 165 Address: DF:A9:FF:F6:B1:1A (OUI DF-A9-FF)
        Count: 1
        #192: len 20 (0 Kb/s)
        Latency: 162 msec (67-173 msec ~165 msec)
> ACL Data RX: Handle 165 flags 0x02 dlen 11              #194 [hci1] 12.274361
      ATT: Read By Type Request (0x08) len 6
        Handle range: 0x005e-0x007b
        Attribute type: Characteristic (0x2803)
< HCI Command: Host Number of Com.. (0x03|0x0035) plen 5  #195 [hci1] 12.290779
        Num handles: 1
        Handle: 165 Address: DF:A9:FF:F6:B1:1A (OUI DF-A9-FF)
        Count: 1
< ACL Data TX: Handle 165 flags 0x00 dlen 20              #196 [hci1] 12.290802
      ATT: Read By Type Response (0x09) len 15
        Attribute data length: 7
        Attribute data list: 2 entries
        Handle: 0x0060
        Value: 1261009f2b
            Properties: 0x12
              Read (0x02)
              Notify (0x10)
            Value Handle: 0x0061
            Value UUID: Parent Group Object ID (0x2b9f)
        Handle: 0x0063
        Value: 1e6400a02b
            Properties: 0x1e
              Read (0x02)
              Write Without Response (0x04)
              Write (0x08)
              Notify (0x10)
            Value Handle: 0x0064
            Value UUID: Current Group Object ID (0x2ba0)
> HCI Event: Number of Completed Packets (0x13) plen 5    #197 [hci1] 12.449163
        Num handles: 1
        Handle: 165 Address: DF:A9:FF:F6:B1:1A (OUI DF-A9-FF)
        Count: 1
        #196: len 20 (1 Kb/s)
        Latency: 158 msec (67-173 msec ~161 msec)
> ACL Data RX: Handle 165 flags 0x02 dlen 11              #198 [hci1] 12.449372
      ATT: Read By Type Request (0x08) len 6
        Handle range: 0x0064-0x007b
        Attribute type: Characteristic (0x2803)
< HCI Command: Host Number of Com.. (0x03|0x0035) plen 5  #199 [hci1] 12.450908
        Num handles: 1
        Handle: 165 Address: DF:A9:FF:F6:B1:1A (OUI DF-A9-FF)
        Count: 1
< ACL Data TX: Handle 165 flags 0x00 dlen 20              #200 [hci1] 12.451021
      ATT: Read By Type Response (0x09) len 15
        Attribute data length: 7
        Attribute data list: 2 entries
        Handle: 0x0066
        Value: 1e6700a12b
            Properties: 0x1e
              Read (0x02)
              Write Without Response (0x04)
              Write (0x08)
              Notify (0x10)
            Value Handle: 0x0067
            Value UUID: Playing Order (0x2ba1)
        Handle: 0x0069
        Value: 026a00a22b
            Properties: 0x02
              Read (0x02)
            Value Handle: 0x006a
            Value UUID: Playing Orders Supported (0x2ba2)
> HCI Event: Number of Completed Packets (0x13) plen 5    #201 [hci1] 12.624148
        Num handles: 1
        Handle: 165 Address: DF:A9:FF:F6:B1:1A (OUI DF-A9-FF)
        Count: 1
        #200: len 20 (0 Kb/s)
        Latency: 173 msec (67-173 msec ~167 msec)
> ACL Data RX: Handle 165 flags 0x02 dlen 11              #202 [hci1] 12.624377
      ATT: Read By Type Request (0x08) len 6
        Handle range: 0x006a-0x007b
        Attribute type: Characteristic (0x2803)
< HCI Command: Host Number of Com.. (0x03|0x0035) plen 5  #203 [hci1] 12.631189
        Num handles: 1
        Handle: 165 Address: DF:A9:FF:F6:B1:1A (OUI DF-A9-FF)
        Count: 1
< ACL Data TX: Handle 165 flags 0x00 dlen 20              #204 [hci1] 12.631331
      ATT: Read By Type Response (0x09) len 15
        Attribute data length: 7
        Attribute data list: 2 entries
        Handle: 0x006b
        Value: 126c00a32b
            Properties: 0x12
              Read (0x02)
              Notify (0x10)
            Value Handle: 0x006c
            Value UUID: Media State (0x2ba3)
        Handle: 0x006e
        Value: 1c6f00a42b
            Properties: 0x1c
              Write Without Response (0x04)
              Write (0x08)
              Notify (0x10)
            Value Handle: 0x006f
            Value UUID: Media Control Point (0x2ba4)
> HCI Event: Number of Completed Packets (0x13) plen 5    #205 [hci1] 12.799182
        Num handles: 1
        Handle: 165 Address: DF:A9:FF:F6:B1:1A (OUI DF-A9-FF)
        Count: 1
        #204: len 20 (0 Kb/s)
        Latency: 167 msec (67-173 msec ~167 msec)
> ACL Data RX: Handle 165 flags 0x02 dlen 11              #206 [hci1] 12.799411
      ATT: Read By Type Request (0x08) len 6
        Handle range: 0x006f-0x007b
        Attribute type: Characteristic (0x2803)
< HCI Command: Host Number of Com.. (0x03|0x0035) plen 5  #207 [hci1] 12.811142
        Num handles: 1
        Handle: 165 Address: DF:A9:FF:F6:B1:1A (OUI DF-A9-FF)
        Count: 1
< ACL Data TX: Handle 165 flags 0x00 dlen 20              #208 [hci1] 12.811233
      ATT: Read By Type Response (0x09) len 15
        Attribute data length: 7
        Attribute data list: 2 entries
        Handle: 0x0071
        Value: 127200a52b
            Properties: 0x12
              Read (0x02)
              Notify (0x10)
            Value Handle: 0x0072
            Value UUID: Media Control Point Opcodes Supported (0x2ba5)
        Handle: 0x0074
        Value: 1c7500a72b
            Properties: 0x1c
              Write Without Response (0x04)
              Write (0x08)
              Notify (0x10)
            Value Handle: 0x0075
            Value UUID: Search Control Point (0x2ba7)
> HCI Event: Number of Completed Packets (0x13) plen 5    #209 [hci1] 12.974297
        Num handles: 1
        Handle: 165 Address: DF:A9:FF:F6:B1:1A (OUI DF-A9-FF)
        Count: 1
        #208: len 20 (0 Kb/s)
        Latency: 163 msec (67-173 msec ~165 msec)
> ACL Data RX: Handle 165 flags 0x02 dlen 11              #210 [hci1] 12.974442
      ATT: Read By Type Request (0x08) len 6
        Handle range: 0x0075-0x007b
        Attribute type: Characteristic (0x2803)
< HCI Command: Host Number of Com.. (0x03|0x0035) plen 5  #211 [hci1] 12.991284
        Num handles: 1
        Handle: 165 Address: DF:A9:FF:F6:B1:1A (OUI DF-A9-FF)
        Count: 1
< ACL Data TX: Handle 165 flags 0x00 dlen 20              #212 [hci1] 12.991400
      ATT: Read By Type Response (0x09) len 15
        Attribute data length: 7
        Attribute data list: 2 entries
        Handle: 0x0077
        Value: 127800a62b
            Properties: 0x12
              Read (0x02)
              Notify (0x10)
            Value Handle: 0x0078
            Value UUID: Search Results Object ID (0x2ba6)
        Handle: 0x007a
        Value: 027b00ba2b
            Properties: 0x02
              Read (0x02)
            Value Handle: 0x007b
            Value UUID: Content Control ID (0x2bba)
> HCI Event: Number of Completed Packets (0x13) plen 5    #213 [hci1] 13.149198
        Num handles: 1
        Handle: 165 Address: DF:A9:FF:F6:B1:1A (OUI DF-A9-FF)
        Count: 1
        #212: len 20 (1 Kb/s)
        Latency: 157 msec (67-173 msec ~161 msec)
> ACL Data RX: Handle 165 flags 0x02 dlen 11              #214 [hci1] 13.149413
      ATT: Read By Type Request (0x08) len 6
        Handle range: 0x007b-0x007b
        Attribute type: Characteristic (0x2803)
< HCI Command: Host Number of Com.. (0x03|0x0035) plen 5  #215 [hci1] 13.151293
        Num handles: 1
        Handle: 165 Address: DF:A9:FF:F6:B1:1A (OUI DF-A9-FF)
        Count: 1
< ACL Data TX: Handle 165 flags 0x00 dlen 9               #216 [hci1] 13.151478
      ATT: Error Response (0x01) len 4
        Read By Type Request (0x08)
        Handle: 0x007b
        Error: Attribute Not Found (0x0a)
> HCI Event: Number of Completed Packets (0x13) plen 5    #217 [hci1] 13.324160
        Num handles: 1
        Handle: 165 Address: DF:A9:FF:F6:B1:1A (OUI DF-A9-FF)
        Count: 1
        #216: len 9 (0 Kb/s)
        Latency: 172 msec (67-173 msec ~167 msec)
> ACL Data RX: Handle 165 flags 0x02 dlen 9               #218 [hci1] 13.324348
      ATT: Find Information Request (0x04) len 4
        Handle range: 0x0041-0x0041
< HCI Command: Host Number of Com.. (0x03|0x0035) plen 5  #219 [hci1] 13.330862
        Num handles: 1
        Handle: 165 Address: DF:A9:FF:F6:B1:1A (OUI DF-A9-FF)
        Count: 1
< ACL Data TX: Handle 165 flags 0x00 dlen 10              #220 [hci1] 13.330882
      ATT: Find Information Response (0x05) len 5
        Format: UUID-16 (0x01)
        Handle: 0x0041
        UUID: Client Characteristic Configuration (0x2902)
> HCI Event: Number of Completed Packets (0x13) plen 5    #221 [hci1] 13.499187
        Num handles: 1
        Handle: 165 Address: DF:A9:FF:F6:B1:1A (OUI DF-A9-FF)
        Count: 1
        #220: len 10 (0 Kb/s)
        Latency: 168 msec (67-173 msec ~167 msec)
> ACL Data RX: Handle 165 flags 0x02 dlen 9               #222 [hci1] 13.499332
      ATT: Find Information Request (0x04) len 4
        Handle range: 0x0048-0x0048
< HCI Command: Host Number of Com.. (0x03|0x0035) plen 5  #223 [hci1] 13.511110
        Num handles: 1
        Handle: 165 Address: DF:A9:FF:F6:B1:1A (OUI DF-A9-FF)
        Count: 1
< ACL Data TX: Handle 165 flags 0x00 dlen 10              #224 [hci1] 13.511177
      ATT: Find Information Response (0x05) len 5
        Format: UUID-16 (0x01)
        Handle: 0x0048
        UUID: Client Characteristic Configuration (0x2902)
> HCI Event: Number of Completed Packets (0x13) plen 5    #225 [hci1] 13.674150
        Num handles: 1
        Handle: 165 Address: DF:A9:FF:F6:B1:1A (OUI DF-A9-FF)
        Count: 1
        #224: len 10 (0 Kb/s)
        Latency: 162 msec (67-173 msec ~165 msec)
> ACL Data RX: Handle 165 flags 0x02 dlen 9               #226 [hci1] 13.674306
      ATT: Find Information Request (0x04) len 4
        Handle range: 0x004b-0x004b
< HCI Command: Host Number of Com.. (0x03|0x0035) plen 5  #227 [hci1] 13.691283
        Num handles: 1
        Handle: 165 Address: DF:A9:FF:F6:B1:1A (OUI DF-A9-FF)
        Count: 1
< ACL Data TX: Handle 165 flags 0x00 dlen 10              #228 [hci1] 13.691439
      ATT: Find Information Response (0x05) len 5
        Format: UUID-16 (0x01)
        Handle: 0x004b
        UUID: Client Characteristic Configuration (0x2902)
> HCI Event: Number of Completed Packets (0x13) plen 5    #229 [hci1] 13.849165
        Num handles: 1
        Handle: 165 Address: DF:A9:FF:F6:B1:1A (OUI DF-A9-FF)
        Count: 1
        #228: len 10 (0 Kb/s)
        Latency: 157 msec (67-173 msec ~161 msec)
> ACL Data RX: Handle 165 flags 0x02 dlen 9               #230 [hci1] 13.849343
      ATT: Find Information Request (0x04) len 4
        Handle range: 0x004e-0x004e
< HCI Command: Host Number of Com.. (0x03|0x0035) plen 5  #231 [hci1] 13.850994
        Num handles: 1
        Handle: 165 Address: DF:A9:FF:F6:B1:1A (OUI DF-A9-FF)
        Count: 1
< ACL Data TX: Handle 165 flags 0x00 dlen 10              #232 [hci1] 13.851060
      ATT: Find Information Response (0x05) len 5
        Format: UUID-16 (0x01)
        Handle: 0x004e
        UUID: Client Characteristic Configuration (0x2902)
> HCI Event: Number of Completed Packets (0x13) plen 5    #233 [hci1] 14.024187
        Num handles: 1
        Handle: 165 Address: DF:A9:FF:F6:B1:1A (OUI DF-A9-FF)
        Count: 1
        #232: len 10 (0 Kb/s)
        Latency: 173 msec (67-173 msec ~167 msec)
> ACL Data RX: Handle 165 flags 0x02 dlen 9               #234 [hci1] 14.024337
      ATT: Find Information Request (0x04) len 4
        Handle range: 0x0051-0x0051
< HCI Command: Host Number of Com.. (0x03|0x0035) plen 5  #235 [hci1] 14.030941
        Num handles: 1
        Handle: 165 Address: DF:A9:FF:F6:B1:1A (OUI DF-A9-FF)
        Count: 1
< ACL Data TX: Handle 165 flags 0x00 dlen 10              #236 [hci1] 14.030991
      ATT: Find Information Response (0x05) len 5
        Format: UUID-16 (0x01)
        Handle: 0x0051
        UUID: Client Characteristic Configuration (0x2902)
> HCI Event: Number of Completed Packets (0x13) plen 5    #237 [hci1] 14.199091
        Num handles: 1
        Handle: 165 Address: DF:A9:FF:F6:B1:1A (OUI DF-A9-FF)
        Count: 1
        #236: len 10 (0 Kb/s)
        Latency: 168 msec (67-173 msec ~167 msec)
> ACL Data RX: Handle 165 flags 0x02 dlen 9               #238 [hci1] 14.199368
      ATT: Find Information Request (0x04) len 4
        Handle range: 0x0054-0x0054
< HCI Command: Host Number of Com.. (0x03|0x0035) plen 5  #239 [hci1] 14.211312
        Num handles: 1
        Handle: 165 Address: DF:A9:FF:F6:B1:1A (OUI DF-A9-FF)
        Count: 1
< ACL Data TX: Handle 165 flags 0x00 dlen 10              #240 [hci1] 14.211363
      ATT: Find Information Response (0x05) len 5
        Format: UUID-16 (0x01)
        Handle: 0x0054
        UUID: Client Characteristic Configuration (0x2902)
> HCI Event: Number of Completed Packets (0x13) plen 5    #241 [hci1] 14.374113
        Num handles: 1
        Handle: 165 Address: DF:A9:FF:F6:B1:1A (OUI DF-A9-FF)
        Count: 1
        #240: len 10 (0 Kb/s)
        Latency: 162 msec (67-173 msec ~165 msec)
> ACL Data RX: Handle 165 flags 0x02 dlen 9               #242 [hci1] 14.374354
      ATT: Find Information Request (0x04) len 4
        Handle range: 0x0057-0x0057
< HCI Command: Host Number of Com.. (0x03|0x0035) plen 5  #243 [hci1] 14.391402
        Num handles: 1
        Handle: 165 Address: DF:A9:FF:F6:B1:1A (OUI DF-A9-FF)
        Count: 1
< ACL Data TX: Handle 165 flags 0x00 dlen 10              #244 [hci1] 14.391526
      ATT: Find Information Response (0x05) len 5
        Format: UUID-16 (0x01)
        Handle: 0x0057
        UUID: Client Characteristic Configuration (0x2902)
> HCI Event: Number of Completed Packets (0x13) plen 5    #245 [hci1] 14.549170
        Num handles: 1
        Handle: 165 Address: DF:A9:FF:F6:B1:1A (OUI DF-A9-FF)
        Count: 1
        #244: len 10 (0 Kb/s)
        Latency: 157 msec (67-173 msec ~161 msec)
> ACL Data RX: Handle 165 flags 0x02 dlen 9               #246 [hci1] 14.549345
      ATT: Find Information Request (0x04) len 4
        Handle range: 0x005c-0x005c
< HCI Command: Host Number of Com.. (0x03|0x0035) plen 5  #247 [hci1] 14.551274
        Num handles: 1
        Handle: 165 Address: DF:A9:FF:F6:B1:1A (OUI DF-A9-FF)
        Count: 1
< ACL Data TX: Handle 165 flags 0x00 dlen 10              #248 [hci1] 14.551354
      ATT: Find Information Response (0x05) len 5
        Format: UUID-16 (0x01)
        Handle: 0x005c
        UUID: Client Characteristic Configuration (0x2902)
> HCI Event: Number of Completed Packets (0x13) plen 5    #249 [hci1] 14.724153
        Num handles: 1
        Handle: 165 Address: DF:A9:FF:F6:B1:1A (OUI DF-A9-FF)
        Count: 1
        #248: len 10 (0 Kb/s)
        Latency: 172 msec (67-173 msec ~167 msec)
> ACL Data RX: Handle 165 flags 0x02 dlen 9               #250 [hci1] 14.724350
      ATT: Find Information Request (0x04) len 4
        Handle range: 0x005f-0x005f
< HCI Command: Host Number of Com.. (0x03|0x0035) plen 5  #251 [hci1] 14.731113
        Num handles: 1
        Handle: 165 Address: DF:A9:FF:F6:B1:1A (OUI DF-A9-FF)
        Count: 1
< ACL Data TX: Handle 165 flags 0x00 dlen 10              #252 [hci1] 14.731271
      ATT: Find Information Response (0x05) len 5
        Format: UUID-16 (0x01)
        Handle: 0x005f
        UUID: Client Characteristic Configuration (0x2902)
> HCI Event: Number of Completed Packets (0x13) plen 5    #253 [hci1] 14.899149
        Num handles: 1
        Handle: 165 Address: DF:A9:FF:F6:B1:1A (OUI DF-A9-FF)
        Count: 1
        #252: len 10 (0 Kb/s)
        Latency: 167 msec (67-173 msec ~167 msec)
> ACL Data RX: Handle 165 flags 0x02 dlen 9               #254 [hci1] 14.899305
      ATT: Find Information Request (0x04) len 4
        Handle range: 0x0062-0x0062
< HCI Command: Host Number of Com.. (0x03|0x0035) plen 5  #255 [hci1] 14.910658
        Num handles: 1
        Handle: 165 Address: DF:A9:FF:F6:B1:1A (OUI DF-A9-FF)
        Count: 1
< ACL Data TX: Handle 165 flags 0x00 dlen 10              #256 [hci1] 14.910681
      ATT: Find Information Response (0x05) len 5
        Format: UUID-16 (0x01)
        Handle: 0x0062
        UUID: Client Characteristic Configuration (0x2902)
> HCI Event: Number of Completed Packets (0x13) plen 5    #257 [hci1] 15.074073
        Num handles: 1
        Handle: 165 Address: DF:A9:FF:F6:B1:1A (OUI DF-A9-FF)
        Count: 1
        #256: len 10 (0 Kb/s)
        Latency: 163 msec (67-173 msec ~165 msec)
> ACL Data RX: Handle 165 flags 0x02 dlen 9               #258 [hci1] 15.074375
      ATT: Find Information Request (0x04) len 4
        Handle range: 0x0065-0x0065
< HCI Command: Host Number of Com.. (0x03|0x0035) plen 5  #259 [hci1] 15.091342
        Num handles: 1
        Handle: 165 Address: DF:A9:FF:F6:B1:1A (OUI DF-A9-FF)
        Count: 1
< ACL Data TX: Handle 165 flags 0x00 dlen 10              #260 [hci1] 15.091487
      ATT: Find Information Response (0x05) len 5
        Format: UUID-16 (0x01)
        Handle: 0x0065
        UUID: Client Characteristic Configuration (0x2902)
> HCI Event: Number of Completed Packets (0x13) plen 5    #261 [hci1] 15.249288
        Num handles: 1
        Handle: 165 Address: DF:A9:FF:F6:B1:1A (OUI DF-A9-FF)
        Count: 1
        #260: len 10 (0 Kb/s)
        Latency: 157 msec (67-173 msec ~161 msec)
> ACL Data RX: Handle 165 flags 0x02 dlen 9               #262 [hci1] 15.249415
      ATT: Find Information Request (0x04) len 4
        Handle range: 0x0068-0x0068
< HCI Command: Host Number of Com.. (0x03|0x0035) plen 5  #263 [hci1] 15.251374
        Num handles: 1
        Handle: 165 Address: DF:A9:FF:F6:B1:1A (OUI DF-A9-FF)
        Count: 1
< ACL Data TX: Handle 165 flags 0x00 dlen 10              #264 [hci1] 15.251402
      ATT: Find Information Response (0x05) len 5
        Format: UUID-16 (0x01)
        Handle: 0x0068
        UUID: Client Characteristic Configuration (0x2902)
> HCI Event: Number of Completed Packets (0x13) plen 5    #265 [hci1] 15.424075
        Num handles: 1
        Handle: 165 Address: DF:A9:FF:F6:B1:1A (OUI DF-A9-FF)
        Count: 1
        #264: len 10 (0 Kb/s)
        Latency: 172 msec (67-173 msec ~167 msec)
> ACL Data RX: Handle 165 flags 0x02 dlen 9               #266 [hci1] 15.424390
      ATT: Find Information Request (0x04) len 4
        Handle range: 0x006d-0x006d
< HCI Command: Host Number of Com.. (0x03|0x0035) plen 5  #267 [hci1] 15.431052
        Num handles: 1
        Handle: 165 Address: DF:A9:FF:F6:B1:1A (OUI DF-A9-FF)
        Count: 1
< ACL Data TX: Handle 165 flags 0x00 dlen 10              #268 [hci1] 15.431100
      ATT: Find Information Response (0x05) len 5
        Format: UUID-16 (0x01)
        Handle: 0x006d
        UUID: Client Characteristic Configuration (0x2902)
> HCI Event: Number of Completed Packets (0x13) plen 5    #269 [hci1] 15.599038
        Num handles: 1
        Handle: 165 Address: DF:A9:FF:F6:B1:1A (OUI DF-A9-FF)
        Count: 1
        #268: len 10 (0 Kb/s)
        Latency: 167 msec (67-173 msec ~167 msec)
> ACL Data RX: Handle 165 flags 0x02 dlen 9               #270 [hci1] 15.599267
      ATT: Find Information Request (0x04) len 4
        Handle range: 0x0070-0x0070
< HCI Command: Host Number of Com.. (0x03|0x0035) plen 5  #271 [hci1] 15.610829
        Num handles: 1
        Handle: 165 Address: DF:A9:FF:F6:B1:1A (OUI DF-A9-FF)
        Count: 1
< ACL Data TX: Handle 165 flags 0x00 dlen 10              #272 [hci1] 15.610839
      ATT: Find Information Response (0x05) len 5
        Format: UUID-16 (0x01)
        Handle: 0x0070
        UUID: Client Characteristic Configuration (0x2902)
> HCI Event: Number of Completed Packets (0x13) plen 5    #273 [hci1] 15.774107
        Num handles: 1
        Handle: 165 Address: DF:A9:FF:F6:B1:1A (OUI DF-A9-FF)
        Count: 1
        #272: len 10 (0 Kb/s)
        Latency: 163 msec (67-173 msec ~165 msec)
> ACL Data RX: Handle 165 flags 0x02 dlen 9               #274 [hci1] 15.774388
      ATT: Find Information Request (0x04) len 4
        Handle range: 0x0073-0x0073
< HCI Command: Host Number of Com.. (0x03|0x0035) plen 5  #275 [hci1] 15.791103
        Num handles: 1
        Handle: 165 Address: DF:A9:FF:F6:B1:1A (OUI DF-A9-FF)
        Count: 1
< ACL Data TX: Handle 165 flags 0x00 dlen 10              #276 [hci1] 15.791156
      ATT: Find Information Response (0x05) len 5
        Format: UUID-16 (0x01)
        Handle: 0x0073
        UUID: Client Characteristic Configuration (0x2902)
> HCI Event: Number of Completed Packets (0x13) plen 5    #277 [hci1] 15.949132
        Num handles: 1
        Handle: 165 Address: DF:A9:FF:F6:B1:1A (OUI DF-A9-FF)
        Count: 1
        #276: len 10 (0 Kb/s)
        Latency: 157 msec (67-173 msec ~161 msec)
> ACL Data RX: Handle 165 flags 0x02 dlen 9               #278 [hci1] 15.949377
      ATT: Find Information Request (0x04) len 4
        Handle range: 0x0076-0x0076
< HCI Command: Host Number of Com.. (0x03|0x0035) plen 5  #279 [hci1] 15.951079
        Num handles: 1
        Handle: 165 Address: DF:A9:FF:F6:B1:1A (OUI DF-A9-FF)
        Count: 1
< ACL Data TX: Handle 165 flags 0x00 dlen 10              #280 [hci1] 15.951125
      ATT: Find Information Response (0x05) len 5
        Format: UUID-16 (0x01)
        Handle: 0x0076
        UUID: Client Characteristic Configuration (0x2902)
> HCI Event: Number of Completed Packets (0x13) plen 5    #281 [hci1] 16.124196
        Num handles: 1
        Handle: 165 Address: DF:A9:FF:F6:B1:1A (OUI DF-A9-FF)
        Count: 1
        #280: len 10 (0 Kb/s)
        Latency: 173 msec (67-173 msec ~167 msec)
> ACL Data RX: Handle 165 flags 0x02 dlen 9               #282 [hci1] 16.124369
      ATT: Find Information Request (0x04) len 4
        Handle range: 0x0079-0x0079
< HCI Command: Host Number of Com.. (0x03|0x0035) plen 5  #283 [hci1] 16.131211
        Num handles: 1
        Handle: 165 Address: DF:A9:FF:F6:B1:1A (OUI DF-A9-FF)
        Count: 1
< ACL Data TX: Handle 165 flags 0x00 dlen 10              #284 [hci1] 16.131230
      ATT: Find Information Response (0x05) len 5
        Format: UUID-16 (0x01)
        Handle: 0x0079
        UUID: Client Characteristic Configuration (0x2902)
> HCI Event: Number of Completed Packets (0x13) plen 5    #285 [hci1] 16.299118
        Num handles: 1
        Handle: 165 Address: DF:A9:FF:F6:B1:1A (OUI DF-A9-FF)
        Count: 1
        #284: len 10 (0 Kb/s)
        Latency: 167 msec (67-173 msec ~167 msec)
> ACL Data RX: Handle 165 flags 0x02 dlen 11              #286 [hci1] 16.299307
      ATT: Read By Type Request (0x08) len 6
        Handle range: 0x0001-0xffff
        Attribute type: Include (0x2802)
< HCI Command: Host Number of Com.. (0x03|0x0035) plen 5  #287 [hci1] 16.310987
        Num handles: 1
        Handle: 165 Address: DF:A9:FF:F6:B1:1A (OUI DF-A9-FF)
        Count: 1
< ACL Data TX: Handle 165 flags 0x00 dlen 14              #288 [hci1] 16.311021
      ATT: Read By Type Response (0x09) len 9
        Attribute data length: 8
        Attribute data list: 1 entry
        Handle: 0x003e
        Value: 2a003c002518
> HCI Event: Number of Completed Packets (0x13) plen 5    #289 [hci1] 16.474145
        Num handles: 1
        Handle: 165 Address: DF:A9:FF:F6:B1:1A (OUI DF-A9-FF)
        Count: 1
        #288: len 14 (0 Kb/s)
        Latency: 163 msec (67-173 msec ~165 msec)
> ACL Data RX: Handle 165 flags 0x02 dlen 11              #290 [hci1] 16.474298
      ATT: Read By Type Request (0x08) len 6
        Handle range: 0x003f-0xffff
        Attribute type: Include (0x2802)
< HCI Command: Host Number of Com.. (0x03|0x0035) plen 5  #291 [hci1] 16.491039
        Num handles: 1
        Handle: 165 Address: DF:A9:FF:F6:B1:1A (OUI DF-A9-FF)
        Count: 1
< ACL Data TX: Handle 165 flags 0x00 dlen 9               #292 [hci1] 16.491069
      ATT: Error Response (0x01) len 4
        Read By Type Request (0x08)
        Handle: 0x003f
        Error: Attribute Not Found (0x0a)
> HCI Event: Number of Completed Packets (0x13) plen 5    #293 [hci1] 16.649142
        Num handles: 1
        Handle: 165 Address: DF:A9:FF:F6:B1:1A (OUI DF-A9-FF)
        Count: 1
        #292: len 9 (0 Kb/s)
        Latency: 158 msec (67-173 msec ~161 msec)
> ACL Data RX: Handle 165 flags 0x02 dlen 11              #294 [hci1] 16.649328
      ATT: Read By Type Request (0x08) len 6
        Handle range: 0x002a-0x003c
        Attribute type: Characteristic (0x2803)
< HCI Command: Host Number of Com.. (0x03|0x0035) plen 5  #295 [hci1] 16.650808
        Num handles: 1
        Handle: 165 Address: DF:A9:FF:F6:B1:1A (OUI DF-A9-FF)
        Count: 1
< ACL Data TX: Handle 165 flags 0x00 dlen 20              #296 [hci1] 16.650885
      ATT: Read By Type Response (0x09) len 15
        Attribute data length: 7
        Attribute data list: 2 entries
        Handle: 0x002b
        Value: 022c00bd2a
            Properties: 0x02
              Read (0x02)
            Value Handle: 0x002c
            Value UUID: OTS Feature (0x2abd)
        Handle: 0x002d
        Value: 0a2e00be2a
            Properties: 0x0a
              Read (0x02)
              Write (0x08)
            Value Handle: 0x002e
            Value UUID: Object Name (0x2abe)
> HCI Event: Number of Completed Packets (0x13) plen 5    #297 [hci1] 16.824119
        Num handles: 1
        Handle: 165 Address: DF:A9:FF:F6:B1:1A (OUI DF-A9-FF)
        Count: 1
        #296: len 20 (0 Kb/s)
        Latency: 173 msec (67-173 msec ~167 msec)
> ACL Data RX: Handle 165 flags 0x02 dlen 11              #298 [hci1] 16.824286
      ATT: Read By Type Request (0x08) len 6
        Handle range: 0x002e-0x003c
        Attribute type: Characteristic (0x2803)
< HCI Command: Host Number of Com.. (0x03|0x0035) plen 5  #299 [hci1] 16.830970
        Num handles: 1
        Handle: 165 Address: DF:A9:FF:F6:B1:1A (OUI DF-A9-FF)
        Count: 1
< ACL Data TX: Handle 165 flags 0x00 dlen 20              #300 [hci1] 16.831048
      ATT: Read By Type Response (0x09) len 15
        Attribute data length: 7
        Attribute data list: 2 entries
        Handle: 0x002f
        Value: 023000bf2a
            Properties: 0x02
              Read (0x02)
            Value Handle: 0x0030
            Value UUID: Object Type (0x2abf)
        Handle: 0x0031
        Value: 023200c02a
            Properties: 0x02
              Read (0x02)
            Value Handle: 0x0032
            Value UUID: Object Size (0x2ac0)
> HCI Event: Number of Completed Packets (0x13) plen 5    #301 [hci1] 16.999120
        Num handles: 1
        Handle: 165 Address: DF:A9:FF:F6:B1:1A (OUI DF-A9-FF)
        Count: 1
        #300: len 20 (0 Kb/s)
        Latency: 168 msec (67-173 msec ~167 msec)
> ACL Data RX: Handle 165 flags 0x02 dlen 11              #302 [hci1] 16.999271
      ATT: Read By Type Request (0x08) len 6
        Handle range: 0x0032-0x003c
        Attribute type: Characteristic (0x2803)
< HCI Command: Host Number of Com.. (0x03|0x0035) plen 5  #303 [hci1] 17.010985
        Num handles: 1
        Handle: 165 Address: DF:A9:FF:F6:B1:1A (OUI DF-A9-FF)
        Count: 1
< ACL Data TX: Handle 165 flags 0x00 dlen 20              #304 [hci1] 17.011017
      ATT: Read By Type Response (0x09) len 15
        Attribute data length: 7
        Attribute data list: 2 entries
        Handle: 0x0033
        Value: 023400c32a
            Properties: 0x02
              Read (0x02)
            Value Handle: 0x0034
            Value UUID: Object ID (0x2ac3)
        Handle: 0x0035
        Value: 023600c42a
            Properties: 0x02
              Read (0x02)
            Value Handle: 0x0036
            Value UUID: Object Properties (0x2ac4)
> HCI Event: Number of Completed Packets (0x13) plen 5    #305 [hci1] 17.174115
        Num handles: 1
        Handle: 165 Address: DF:A9:FF:F6:B1:1A (OUI DF-A9-FF)
        Count: 1
        #304: len 20 (0 Kb/s)
        Latency: 163 msec (67-173 msec ~165 msec)
> ACL Data RX: Handle 165 flags 0x02 dlen 11              #306 [hci1] 17.174321
      ATT: Read By Type Request (0x08) len 6
        Handle range: 0x0036-0x003c
        Attribute type: Characteristic (0x2803)
< HCI Command: Host Number of Com.. (0x03|0x0035) plen 5  #307 [hci1] 17.191468
        Num handles: 1
        Handle: 165 Address: DF:A9:FF:F6:B1:1A (OUI DF-A9-FF)
        Count: 1
< ACL Data TX: Handle 165 flags 0x00 dlen 20              #308 [hci1] 17.191628
      ATT: Read By Type Response (0x09) len 15
        Attribute data length: 7
        Attribute data list: 2 entries
        Handle: 0x0037
        Value: 283800c52a
            Properties: 0x28
              Write (0x08)
              Indicate (0x20)
            Value Handle: 0x0038
            Value UUID: Object Action Control Point (0x2ac5)
        Handle: 0x003a
        Value: 283b00c62a
            Properties: 0x28
              Write (0x08)
              Indicate (0x20)
            Value Handle: 0x003b
            Value UUID: Object List Control Point (0x2ac6)
> HCI Event: Number of Completed Packets (0x13) plen 5    #309 [hci1] 17.349051
        Num handles: 1
        Handle: 165 Address: DF:A9:FF:F6:B1:1A (OUI DF-A9-FF)
        Count: 1
        #308: len 20 (1 Kb/s)
        Latency: 157 msec (67-173 msec ~161 msec)
> ACL Data RX: Handle 165 flags 0x02 dlen 11              #310 [hci1] 17.349334
      ATT: Read By Type Request (0x08) len 6
        Handle range: 0x003b-0x003c
        Attribute type: Characteristic (0x2803)
< HCI Command: Host Number of Com.. (0x03|0x0035) plen 5  #311 [hci1] 17.350946
        Num handles: 1
        Handle: 165 Address: DF:A9:FF:F6:B1:1A (OUI DF-A9-FF)
        Count: 1
< ACL Data TX: Handle 165 flags 0x00 dlen 9               #312 [hci1] 17.351008
      ATT: Error Response (0x01) len 4
        Read By Type Request (0x08)
        Handle: 0x003b
        Error: Attribute Not Found (0x0a)
> HCI Event: Number of Completed Packets (0x13) plen 5    #313 [hci1] 17.524105
        Num handles: 1
        Handle: 165 Address: DF:A9:FF:F6:B1:1A (OUI DF-A9-FF)
        Count: 1
        #312: len 9 (0 Kb/s)
        Latency: 173 msec (67-173 msec ~167 msec)
> ACL Data RX: Handle 165 flags 0x02 dlen 9               #314 [hci1] 17.524266
      ATT: Find Information Request (0x04) len 4
        Handle range: 0x0039-0x0039
< HCI Command: Host Number of Com.. (0x03|0x0035) plen 5  #315 [hci1] 17.530993
        Num handles: 1
        Handle: 165 Address: DF:A9:FF:F6:B1:1A (OUI DF-A9-FF)
        Count: 1
< ACL Data TX: Handle 165 flags 0x00 dlen 10              #316 [hci1] 17.530999
      ATT: Find Information Response (0x05) len 5
        Format: UUID-16 (0x01)
        Handle: 0x0039
        UUID: Client Characteristic Configuration (0x2902)
> HCI Event: Number of Completed Packets (0x13) plen 5    #317 [hci1] 17.699069
        Num handles: 1
        Handle: 165 Address: DF:A9:FF:F6:B1:1A (OUI DF-A9-FF)
        Count: 1
        #316: len 10 (0 Kb/s)
        Latency: 168 msec (67-173 msec ~167 msec)
> ACL Data RX: Handle 165 flags 0x02 dlen 9               #318 [hci1] 17.699328
      ATT: Find Information Request (0x04) len 4
        Handle range: 0x003c-0x003c
< HCI Command: Host Number of Com.. (0x03|0x0035) plen 5  #319 [hci1] 17.711398
        Num handles: 1
        Handle: 165 Address: DF:A9:FF:F6:B1:1A (OUI DF-A9-FF)
        Count: 1
< ACL Data TX: Handle 165 flags 0x00 dlen 10              #320 [hci1] 17.711509
      ATT: Find Information Response (0x05) len 5
        Format: UUID-16 (0x01)
        Handle: 0x003c
        UUID: Client Characteristic Configuration (0x2902)
> HCI Event: Number of Completed Packets (0x13) plen 5    #321 [hci1] 17.873919
        Num handles: 1
        Handle: 165 Address: DF:A9:FF:F6:B1:1A (OUI DF-A9-FF)
        Count: 1
        #320: len 10 (0 Kb/s)
        Latency: 162 msec (67-173 msec ~165 msec)
> ACL Data RX: Handle 165 flags 0x02 dlen 9               #322 [hci1] 18.486608
      ATT: Write Request (0x12) len 4
        Handle: 0x0041 Type: Client Characteristic Configuration (0x2902)
        Value Handle: 0x007b Type: Content Control ID (0x2bba)
          Data: 0000
< HCI Command: Host Number of Com.. (0x03|0x0035) plen 5  #323 [hci1] 18.491186
        Num handles: 1
        Handle: 165 Address: DF:A9:FF:F6:B1:1A (OUI DF-A9-FF)
        Count: 1
< ACL Data TX: Handle 165 flags 0x00 dlen 5               #324 [hci1] 18.491354
      ATT: Write Response (0x13) len 0
> HCI Event: Number of Completed Packets (0x13) plen 5    #325 [hci1] 18.661569
        Num handles: 1
        Handle: 165 Address: DF:A9:FF:F6:B1:1A (OUI DF-A9-FF)
        Count: 1
        #324: len 5 (0 Kb/s)
        Latency: 170 msec (67-173 msec ~167 msec)
> ACL Data RX: Handle 165 flags 0x02 dlen 9               #326 [hci1] 18.661730
      ATT: Write Request (0x12) len 4
        Handle: 0x0041 Type: Client Characteristic Configuration (0x2902)
        Value Handle: 0x007b Type: Content Control ID (0x2bba)
          Data: 0100
            Notification (0x01)
< HCI Command: Host Number of Com.. (0x03|0x0035) plen 5  #327 [hci1] 18.671064
        Num handles: 1
        Handle: 165 Address: DF:A9:FF:F6:B1:1A (OUI DF-A9-FF)
        Count: 1
< ACL Data TX: Handle 165 flags 0x00 dlen 5               #328 [hci1] 18.671101
      ATT: Write Response (0x13) len 0
> HCI Event: Number of Completed Packets (0x13) plen 5    #329 [hci1] 18.836584
        Num handles: 1
        Handle: 165 Address: DF:A9:FF:F6:B1:1A (OUI DF-A9-FF)
        Count: 1
        #328: len 5 (0 Kb/s)
        Latency: 165 msec (67-173 msec ~166 msec)
> ACL Data RX: Handle 165 flags 0x02 dlen 9               #330 [hci1] 18.836815
      ATT: Read Blob Request (0x0c) len 4
        Handle: 0x0040 Type: Media Player Name (0x2b93)
        Offset: 0x0000
< HCI Command: Host Number of Com.. (0x03|0x0035) plen 5  #331 [hci1] 18.850970
        Num handles: 1
        Handle: 165 Address: DF:A9:FF:F6:B1:1A (OUI DF-A9-FF)
        Count: 1
< ACL Data TX: Handle 165 flags 0x00 dlen 12              #332 [hci1] 18.851059
      ATT: Read Blob Response (0x0d) len 7
        50 6c 61 79 65 72 30                             Player0         
> HCI Event: Number of Completed Packets (0x13) plen 5    #333 [hci1] 19.011475
        Num handles: 1
        Handle: 165 Address: DF:A9:FF:F6:B1:1A (OUI DF-A9-FF)
        Count: 1
        #332: len 12 (0 Kb/s)
        Latency: 160 msec (67-173 msec ~163 msec)
> HCI Event: Disconnect Complete (0x05) plen 4            #334 [hci1] 20.936683
        Status: Success (0x00)
        Handle: 165 Address: DF:A9:FF:F6:B1:1A (OUI DF-A9-FF)
        Reason: Remote User Terminated Connection (0x13)
< HCI Command: Reset (0x03|0x0003) plen 0                 #335 [hci1] 26.660849
> HCI Event: Command Complete (0x0e) plen 4               #336 [hci1] 26.661300
      Reset (0x03|0x0003) ncmd 1
        Status: Success (0x00)
@ USER Close: main                                    {0x0001} [hci1] 26.670771
= Close Index: 00:00:00:00:00:00                               [hci1] 26.670778
