Bluetooth monitor ver 5.72
btmon[1596043]: = Note: Linux version 6.14.0-36-generic (x86_64)                                                         0.969877
btmon[1596043]: = Note: Bluetooth subsystem version 2.22                                                                 0.969878
= New Index: 00:00:00:00:00:00 (Primary,UART,hci1)                                                                       0.969879
= New Index: 48:5F:99:8E:E0:64 (Primary,USB,hci0)                                                                        0.969880
= Open Index: 00:00:00:00:00:00                                                                                          1.483439
= Index Info: 00:00:00:00:00:00 (Nordic Semiconductor ASA)                                                               1.483453
zephyr.exe[1596045]: @ USER Open: main (privileged) version 2.22                                                {0x0001} 1.483461
zephyr.exe[1596045]: < HCI Command: Reset (0x03|0x0003) plen 0                                                        #1 1.484597
> HCI Event: Command Complete (0x0e) plen 4                                                                           #2 1.485089
      Reset (0x03|0x0003) ncmd 1
        Status: Success (0x00)
zephyr.exe[1596045]: < HCI Command: Read Local Supported Features (0x04|0x0003) plen 0                                #3 1.503207
> HCI Event: Command Complete (0x0e) plen 12                                                                          #4 1.503745
      Read Local Supported Features (0x04|0x0003) ncmd 1
        Status: Success (0x00)
        Features: 0x00 0x00 0x00 0x00 0x60 0x00 0x00 0x00
          BR/EDR Not Supported
          LE Supported (Controller)
zephyr.exe[1596045]: < HCI Command: Read Local Version Information (0x04|0x0001) plen 0                               #5 1.522965
> HCI Event: Command Complete (0x0e) plen 12                                                                          #6 1.523520
      Read Local Version Information (0x04|0x0001) ncmd 1
        Status: Success (0x00)
        HCI version: Reserved (0x0f) - Revision 12393 (0x3069)
        LMP version: Reserved (0x0f) - Subversion 12393 (0x3069)
        Manufacturer: Nordic Semiconductor ASA (89)
zephyr.exe[1596045]: < HCI Command: Read Local Supported Commands (0x04|0x0002) plen 0                                #7 1.542889
> HCI Event: Command Complete (0x0e) plen 68                                                                          #8 1.543902
      Read Local Supported Commands (0x04|0x0002) ncmd 1
        Status: Success (0x00)
        Commands: 119 entries
          Disconnect (Octet 0 - Bit 5)
          Read Remote Version Information (Octet 2 - Bit 7)
          Set Event Mask (Octet 5 - Bit 6)
          Reset (Octet 5 - Bit 7)
          Read Connection Accept Timeout (Octet 7 - Bit 2)
          Write Connection Accept Timeout (Octet 7 - Bit 3)
          Read Transmit Power Level (Octet 10 - Bit 2)
          Set Controller To Host Flow Control (Octet 10 - Bit 5)
          Host Buffer Size (Octet 10 - Bit 6)
          Host Number of Completed Packets (Octet 10 - Bit 7)
          Read Local Version Information (Octet 14 - Bit 3)
          Read Local Supported Features (Octet 14 - Bit 5)
          Read BD ADDR (Octet 15 - Bit 1)
          Read RSSI (Octet 15 - Bit 5)
          Set Event Mask Page 2 (Octet 22 - Bit 2)
          LE Set Event Mask (Octet 25 - Bit 0)
          LE Read Buffer Size (Octet 25 - Bit 1)
          LE Read Local Supported Features (Octet 25 - Bit 2)
          LE Set Random Address (Octet 25 - Bit 4)
          LE Set Advertising Parameters (Octet 25 - Bit 5)
          LE Read Advertising Channel TX Power (Octet 25 - Bit 6)
          LE Set Advertising Data (Octet 25 - Bit 7)
          LE Set Scan Response Data (Octet 26 - Bit 0)
          LE Set Advertise Enable (Octet 26 - Bit 1)
          LE Set Scan Parameters (Octet 26 - Bit 2)
          LE Set Scan Enable (Octet 26 - Bit 3)
          LE Create Connection (Octet 26 - Bit 4)
          LE Create Connection Cancel (Octet 26 - Bit 5)
          LE Read Accept List Size (Octet 26 - Bit 6)
          LE Clear Accept List (Octet 26 - Bit 7)
          LE Add Device To Accept List (Octet 27 - Bit 0)
          LE Remove Device From Accept List (Octet 27 - Bit 1)
          LE Connection Update (Octet 27 - Bit 2)
          LE Set Host Channel Classification (Octet 27 - Bit 3)
          LE Read Channel Map (Octet 27 - Bit 4)
          LE Read Remote Used Features (Octet 27 - Bit 5)
          LE Encrypt (Octet 27 - Bit 6)
          LE Rand (Octet 27 - Bit 7)
          LE Start Encryption (Octet 28 - Bit 0)
          LE Long Term Key Request Reply (Octet 28 - Bit 1)
          LE Long Term Key Request Neg Reply (Octet 28 - Bit 2)
          LE Read Supported States (Octet 28 - Bit 3)
          LE Receiver Test (Octet 28 - Bit 4)
          LE Transmitter Test (Octet 28 - Bit 5)
          LE Test End (Octet 28 - Bit 6)
          Read Authenticated Payload Timeout (Octet 32 - Bit 4)
          Write Authenticated Payload Timeout (Octet 32 - Bit 5)
          LE Set Data Length (Octet 33 - Bit 6)
          LE Read Suggested Default Data Length (Octet 33 - Bit 7)
          LE Write Suggested Default Data Length (Octet 34 - Bit 0)
          LE Add Device To Resolving List (Octet 34 - Bit 3)
          LE Remove Device From Resolving List (Octet 34 - Bit 4)
          LE Clear Resolving List (Octet 34 - Bit 5)
          LE Read Resolving List Size (Octet 34 - Bit 6)
          LE Set Address Resolution Enable (Octet 35 - Bit 1)
          LE Set Resolvable Private Address Timeout (Octet 35 - Bit 2)
          LE Read Maximum Data Length (Octet 35 - Bit 3)
          LE Read PHY (Octet 35 - Bit 4)
          LE Set Default PHY (Octet 35 - Bit 5)
          LE Set PHY (Octet 35 - Bit 6)
          LE Enhanced Receiver Test (Octet 35 - Bit 7)
          LE Enhanced Transmitter Test (Octet 36 - Bit 0)
          LE Set Advertising Set Random Address (Octet 36 - Bit 1)
          LE Set Extended Advertising Parameters (Octet 36 - Bit 2)
          LE Set Extended Advertising Data (Octet 36 - Bit 3)
          LE Set Extended Scan Response Data (Octet 36 - Bit 4)
          LE Set Extended Advertising Enable (Octet 36 - Bit 5)
          LE Read Maximum Advertising Data Length (Octet 36 - Bit 6)
          LE Read Number of Supported Advertising Sets (Octet 36 - Bit 7)
          LE Remove Advertising Set (Octet 37 - Bit 0)
          LE Clear Advertising Sets (Octet 37 - Bit 1)
          LE Set Periodic Advertising Parameters (Octet 37 - Bit 2)
          LE Set Periodic Advertising Data (Octet 37 - Bit 3)
          LE Set Periodic Advertising Enable (Octet 37 - Bit 4)
          LE Set Extended Scan Parameters (Octet 37 - Bit 5)
          LE Set Extended Scan Enable (Octet 37 - Bit 6)
          LE Extended Create Connection (Octet 37 - Bit 7)
          LE Periodic Advertising Create Sync (Octet 38 - Bit 0)
          LE Periodic Advertising Create Sync Cancel (Octet 38 - Bit 1)
          LE Periodic Advertising Terminate Sync (Octet 38 - Bit 2)
          LE Add Device To Periodic Advertiser List (Octet 38 - Bit 3)
          LE Remove Device From Periodic Advertiser List (Octet 38 - Bit 4)
          LE Clear Periodic Advertiser List (Octet 38 - Bit 5)
          LE Read Periodic Advertiser List Size (Octet 38 - Bit 6)
          LE Read Transmit Power (Octet 38 - Bit 7)
          LE Read RF Path Compensation (Octet 39 - Bit 0)
          LE Write RF Path Compensation (Octet 39 - Bit 1)
          LE Set Privacy Mode (Octet 39 - Bit 2)
          LE Periodic Advertising Receive Enable (Octet 40 - Bit 5)
          LE Periodic Advertising Sync Transfer (Octet 40 - Bit 6)
          LE Periodic Advertising Set Info Transfer (Octet 40 - Bit 7)
          LE Periodic Advertising Sync Transfer Parameters (Octet 41 - Bit 0)
          LE Set Default Periodic Advertisng Sync Transfer Parameters (Octet 41 - Bit 1)
          LE Read Buffer v2 (Octet 41 - Bit 5)
          LE Read ISO TX Sync (Octet 41 - Bit 6)
          LE Set Connected Isochronous Group Parameters (Octet 41 - Bit 7)
          LE Set Connected Isochronous Group Parameters Test (Octet 42 - Bit 0)
          LE Create Connected Isochronous Stream (Octet 42 - Bit 1)
          LE Remove Connected Isochronous Group (Octet 42 - Bit 2)
          LE Accept Connected Isochronous Stream Request (Octet 42 - Bit 3)
          LE Reject Connected Isochronous Stream Request (Octet 42 - Bit 4)
          LE Create Broadcast Isochronous Group (Octet 42 - Bit 5)
          LE Create Broadcast Isochronous Group Test (Octet 42 - Bit 6)
          LE Terminate Broadcast Isochronous Group (Octet 42 - Bit 7)
          LE Broadcast Isochronous Group Create Sync (Octet 43 - Bit 0)
          LE Broadcast Isochronous Group Terminate Sync (Octet 43 - Bit 1)
          LE Request Peer SCA (Octet 43 - Bit 2)
          LE Setup Isochronous Data Path (Octet 43 - Bit 3)
          LE Remove Isochronous Data Path (Octet 43 - Bit 4)
          LE Isochronous Transmit Test (Octet 43 - Bit 5)
          LE Isochronous Receive Test (Octet 43 - Bit 6)
          LE Isochronous Read Test Counters (Octet 43 - Bit 7)
          LE Isochronous Read Test Counters (Octet 44 - Bit 0)
          LE Set Host Feature (Octet 44 - Bit 1)
          Octet 44 - Bit 2 
          Octet 45 - Bit 6 
          Octet 46 - Bit 0 
          Octet 46 - Bit 1 
          Octet 46 - Bit 2 
zephyr.exe[1596045]: < HCI Command: Host Buffer Size (0x03|0x0033) plen 7                                             #9 1.562893
        ACL MTU: 255  ACL max packet: 16
        SCO MTU: 0    SCO max packet: 0
> HCI Event: Command Complete (0x0e) plen 4                                                                          #10 1.563378
      Host Buffer Size (0x03|0x0033) ncmd 1
        Status: Success (0x00)
zephyr.exe[1596045]: < HCI Command: Set Controller To Host Flow Control (0x03|0x0031) plen 1                         #11 1.582910
        Flow control: ACL Data Packets (0x01)
> HCI Event: Command Complete (0x0e) plen 4                                                                          #12 1.583417
      Set Controller To Host Flow Control (0x03|0x0031) ncmd 1
        Status: Success (0x00)
zephyr.exe[1596045]: < HCI Command: LE Read Local Supported Features (0x08|0x0003) plen 0                            #13 1.602883
> HCI Event: Command Complete (0x0e) plen 12                                                                         #14 1.603327
      LE Read Local Supported Features (0x08|0x0003) ncmd 1
        Status: Success (0x00)
        Features: 0xfd 0x79 0x00 0xf7 0x30 0x01 0x00 0x00
          LE Encryption
          Extended Reject Indication
          Peripheral-initiated Features Exchange
          LE Ping
          LE Data Packet Length Extension
          LL Privacy
          Extended Scanner Filter Policies
          LE 2M PHY
          LE Coded PHY
          LE Extended Advertising
          LE Periodic Advertising
          Channel Selection Algorithm #2
          Periodic Advertising Sync Transfer - Sender
          Periodic Advertising Sync Transfer - Recipient
          Sleep Clock Accuracy Updates
          Connected Isochronous Stream - Central
          Connected Isochronous Stream - Peripheral
          Isochronous Broadcaster
          Synchronized Receiver
          Periodic Advertising ADI support
          Connection Subrating
          Unknown features (0x0000010000000000)
zephyr.exe[1596045]: < HCI Command: LE Set Host Feature (0x08|0x0074) plen 2                                         #15 1.622895
        Bit Number: 32
          Connected Isochronous Stream (Host Support)
        Bit Value: 1
> HCI Event: Command Complete (0x0e) plen 4                                                                          #16 1.623285
      LE Set Host Feature (0x08|0x0074) ncmd 1
        Status: Success (0x00)
zephyr.exe[1596045]: < HCI Command: LE Read Buffer v2 (0x08|0x0060) plen 0                                           #17 1.642926
> HCI Event: Command Complete (0x0e) plen 10                                                                         #18 1.643471
      LE Read Buffer v2 (0x08|0x0060) ncmd 1
        Status: Success (0x00)
        ACL MTU: 27
        ACL max packet: 3
        ISO MTU: 318
        ISO max packet: 3
zephyr.exe[1596045]: < HCI Command: LE Read Maximum Advertising Data Length (0x08|0x003a) plen 0                     #19 1.662940
> HCI Event: Command Complete (0x0e) plen 6                                                                          #20 1.663367
      LE Read Maximum Advertising Data Length (0x08|0x003a) ncmd 1
        Status: Success (0x00)
        Max length: 1650
zephyr.exe[1596045]: < HCI Command: LE Read Supported States (0x08|0x001c) plen 0                                    #21 1.682879
> HCI Event: Command Complete (0x0e) plen 12                                                                         #22 1.683362
      LE Read Supported States (0x08|0x001c) ncmd 1
        Status: Success (0x00)
        States: 0x000003ff3e0306ff
          Non-connectable Advertising State
          Scannable Advertising State
          Connectable Advertising State
          High Duty Cycle Directed Advertising State
          Passive Scanning State
          Active Scanning State
          Initiating State
            and Connection State (Central Role)
          Connection State (Peripheral Role)
          Scannable Advertising State
            and Passive Scanning State
          Connectable Advertising State
            and Passive Scanning State
          Non-connectable Advertising State
            and Initiating State
          Scannable Advertising State
            and Initiating State
          Active Scanning State
            and Connection State (Central Role)
          Passive Scanning State
            and Connection State (Peripheral Role)
          Active Scanning State
            and Connection State (Peripheral Role)
          Initiating State
            and Connection State (Central Role)
            and Central Role & Central Role
          Low Duty Cycle Directed Advertising State
          Connectable Advertising State
            and Initiating State
            and Central Role & Peripheral Role
          High Duty Cycle Directed Advertising State
            and Initiating State
            and Central Role & Peripheral Role
          Low Duty Cycle Directed Advertising State
            and Initiating State
            and Central Role & Peripheral Role
          Connectable Advertising State
            and Connection State (Central Role)
            and Central Role & Peripheral Role
          High Duty Cycle Directed Advertising State
            and Connection State (Central Role)
            and Central Role & Peripheral Role
          Low Duty Cycle Directed Advertising State
            and Connection State (Central Role)
            and Central Role & Peripheral Role
          Connectable Advertising State
            and Connection State (Peripheral Role)
            and Central Role & Peripheral Role
          High Duty Cycle Directed Advertising State
            and Connection State (Peripheral Role)
            and Peripheral Role & Peripheral Role
          Low Duty Cycle Directed Advertising State
            and Connection State (Peripheral Role)
            and Peripheral Role & Peripheral Role
          Initiating State
            and Connection State (Peripheral Role)
            and Central Role & Peripheral Role
zephyr.exe[1596045]: < HCI Command: LE Read Maximum Data Length (0x08|0x002f) plen 0                                 #23 1.702886
> HCI Event: Command Complete (0x0e) plen 12                                                                         #24 1.703365
      LE Read Maximum Data Length (0x08|0x002f) ncmd 1
        Status: Success (0x00)
        Max TX octets: 251
        Max TX time: 2704
        Max RX octets: 251
        Max RX time: 2704
zephyr.exe[1596045]: < HCI Command: LE Write Suggested Default Data Length (0x08|0x0024) plen 4                      #25 1.722894
        TX octets: 251
        TX time: 2704
> HCI Event: Command Complete (0x0e) plen 4                                                                          #26 1.723320
      LE Write Suggested Default Data Length (0x08|0x0024) ncmd 1
        Status: Success (0x00)
zephyr.exe[1596045]: < HCI Command: LE Read Resolving List Size (0x08|0x002a) plen 0                                 #27 1.742861
> HCI Event: Command Complete (0x0e) plen 5                                                                          #28 1.743296
      LE Read Resolving List Size (0x08|0x002a) ncmd 1
        Status: Success (0x00)
        Size: 8
zephyr.exe[1596045]: < HCI Command: LE Set Event Mask (0x08|0x0001) plen 8                                           #29 1.762921
        Mask: 0x000002023f87fa5e
          LE Advertising Report
          LE Connection Update Complete
          LE Read Remote Used Features Complete
          LE Long Term Key Request
          LE Data Length Change
          LE Enhanced Connection Complete
          LE PHY Update Complete
          LE Extended Advertising Report
          LE Periodic Advertising Sync Established
          LE Periodic Advertising Report
          LE Periodic Advertising Sync Lost
          LE Extended Scan Timeout
          LE Extended Advertising Set Terminated
          LE Scan Request Received
          LE Periodic Advertising Sync Transfer Rvc
          LE CIS Established
          LE CIS Request
          LE Create BIG Complete
          LE Terminate BIG Complete
          LE BIG Sync Estabilished Complete
          LE BIG Sync Lost
          LE BIG Info Advertising Report
          Unknown mask (0x0000020000000000)
> HCI Event: Command Complete (0x0e) plen 4                                                                          #30 1.763538
      LE Set Event Mask (0x08|0x0001) ncmd 1
        Status: Success (0x00)
zephyr.exe[1596045]: < HCI Command: Set Event Mask (0x03|0x0001) plen 8                                              #31 1.782895
        Mask: 0x2000800002008890
          Disconnection Complete
          Encryption Change
          Read Remote Version Information Complete
          Hardware Error
          Data Buffer Overflow
          Encryption Key Refresh Complete
          LE Meta
> HCI Event: Command Complete (0x0e) plen 4                                                                          #32 1.783448
      Set Event Mask (0x03|0x0001) ncmd 1
        Status: Success (0x00)
zephyr.exe[1596045]: < HCI Command: Read BD ADDR (0x04|0x0009) plen 0                                                #33 1.802892
> HCI Event: Command Complete (0x0e) plen 10                                                                         #34 1.803366
      Read BD ADDR (0x04|0x0009) ncmd 1
        Status: Success (0x00)
        Address: 00:00:00:00:00:00 (OUI 00-00-00)
zephyr.exe[1596045]: < HCI Command: LE Set Random Address (0x08|0x0005) plen 6                                       #35 1.822906
        Address: D5:B6:CC:31:DB:3B (Static)
> HCI Event: Command Complete (0x0e) plen 4                                                                          #36 1.823386
      LE Set Random Address (0x08|0x0005) ncmd 1
        Status: Success (0x00)
zephyr.exe[1596045]: < HCI Command: LE Set Extended Advertising Parameters (0x08|0x0036) plen 25                     #37 4.432973
        Handle: 0x00
        Properties: 0x0001
          Connectable
        Min advertising interval: 100.000 msec (0x00a0)
        Max advertising interval: 150.000 msec (0x00f0)
        Channel map: 37, 38, 39 (0x07)
        Own address type: Random (0x01)
        Peer address type: Public (0x00)
        Peer address: 00:00:00:00:00:00 (OUI 00-00-00)
        Filter policy: Allow Scan Request from Any, Allow Connect Request from Any (0x00)
        TX power: Host has no preference (0x7f)
        Primary PHY: LE 1M (0x01)
        Secondary max skip: 0x00
        Secondary PHY: LE 2M (0x02)
        SID: 0x00
        Scan request notifications: Disabled (0x00)
> HCI Event: Command Complete (0x0e) plen 5                                                                          #38 4.433786
      LE Set Extended Advertising Parameters (0x08|0x0036) ncmd 1
        Status: Success (0x00)
        TX power (selected): 0 dbm (0x00)
zephyr.exe[1596045]: < HCI Command: LE Set Advertising Set Random Address (0x08|0x0035) plen 7                       #39 4.442881
        Advertising handle: 0x00
        Advertising random address: D5:B6:CC:31:DB:3B (Static)
> HCI Event: Command Complete (0x0e) plen 4                                                                          #40 4.443392
      LE Set Advertising Set Random Address (0x08|0x0035) ncmd 1
        Status: Success (0x00)
zephyr.exe[1596045]: < HCI Command: LE Set Extended Advertising Data (0x08|0x0037) plen 39                           #41 4.462945
        Handle: 0x00
        Operation: Complete extended advertising data (0x03)
        Fragment preference: Minimize fragmentation (0x01)
        Data length: 0x23
        Flags: 0x06
          LE General Discoverable Mode
          BR/EDR Not Supported
        Name (complete): Tester_F6B11A
        Flags: 0x06
          LE General Discoverable Mode
          BR/EDR Not Supported
        16-bit Service UUIDs (complete): 1 entry
          Audio Stream Control (0x184e)
        Service Data: Audio Stream Control (0x184e)
          Data: 01ff0fff0f00
> HCI Event: Command Complete (0x0e) plen 4                                                                          #42 4.463910
      LE Set Extended Advertising Data (0x08|0x0037) ncmd 1
        Status: Success (0x00)
zephyr.exe[1596045]: < HCI Command: LE Set Extended Advertising Enable (0x08|0x0039) plen 6                          #43 4.482936
        Extended advertising: Enabled (0x01)
        Number of sets: 1 (0x01)
        Entry 0
          Handle: 0x00
          Duration: 0 ms (0x00)
          Max ext adv events: 0
> HCI Event: Command Complete (0x0e) plen 4                                                                          #44 4.483545
      LE Set Extended Advertising Enable (0x08|0x0039) ncmd 1
        Status: Success (0x00)
> HCI Event: LE Meta Event (0x3e) plen 31                                                                            #45 4.598010
      LE Enhanced Connection Complete (0x0a)
        Status: Success (0x00)
        Handle: 183
        Role: Peripheral (0x01)
        Peer address type: Public (0x00)
        Peer address: DF:A9:FF:F6:B1:1A (OUI DF-A9-FF)
        Local resolvable private address: 00:00:00:00:00:00 (Non-Resolvable)
        Peer resolvable private address: 00:00:00:00:00:00 (Non-Resolvable)
        Connection interval: 60.00 msec (0x0030)
        Connection latency: 0 (0x0000)
        Supervision timeout: 25120 msec (0x09d0)
        Central clock accuracy: 0x01
> HCI Event: LE Meta Event (0x3e) plen 6                                                                             #46 4.598058
      LE Advertising Set Terminated (0x12)
        Status: Success (0x00)
        Handle: 0
        Connection handle: 183
        Number of completed extended advertising events: 0
zephyr.exe[1596045]: < HCI Command: LE Read Remote Used Features (0x08|0x0016) plen 2                                #47 4.603191
        Handle: 183 Address: DF:A9:FF:F6:B1:1A (OUI DF-A9-FF)
zephyr.exe[1596045]: < ACL Data TX: Handle 183 flags 0x00 dlen 7                                                     #48 4.603199
      ATT: Exchange MTU Request (0x02) len 2
        Client RX MTU: 251
> HCI Event: Command Status (0x0f) plen 4                                                                            #49 4.603693
      LE Read Remote Used Features (0x08|0x0016) ncmd 1
        Status: Success (0x00)
> HCI Event: Number of Completed Packets (0x13) plen 5                                                               #50 4.720022
        Num handles: 1
        Handle: 183 Address: DF:A9:FF:F6:B1:1A (OUI DF-A9-FF)
        Count: 1
        #48: len 7 (0 Kb/s)
        Latency: 116 msec (116-116 msec ~116 msec)
> HCI Event: LE Meta Event (0x3e) plen 12                                                                            #51 4.780262
      LE Read Remote Used Features (0x04)
        Status: Success (0x00)
        Handle: 183 Address: DF:A9:FF:F6:B1:1A (OUI DF-A9-FF)
        Features: 0x2d 0x49 0x00 0xf7 0x67 0xd8 0x00 0x00
          LE Encryption
          Extended Reject Indication
          Peripheral-initiated Features Exchange
          LE Data Packet Length Extension
          LE 2M PHY
          LE Coded PHY
          Channel Selection Algorithm #2
          Periodic Advertising Sync Transfer - Sender
          Periodic Advertising Sync Transfer - Recipient
          Sleep Clock Accuracy Updates
          Connected Isochronous Stream - Central
          Connected Isochronous Stream - Peripheral
          Isochronous Broadcaster
          Synchronized Receiver
          Connected Isochronous Stream (Host Support)
          LE Power Control Request
          LE Power Control Request
          Connection Subrating
          Connection Subrating (Host Support)
          Unknown features (0x0000d80000000000)
> ACL Data RX: Handle 183 flags 0x02 dlen 7                                                                          #52 5.079957
      ATT: Exchange MTU Request (0x02) len 2
        Client RX MTU: 64
> ACL Data RX: Handle 183 flags 0x02 dlen 7                                                                          #53 5.080396
      ATT: Exchange MTU Response (0x03) len 2
        Server RX MTU: 64
zephyr.exe[1596045]: < HCI Command: Host Number of Completed Packets (0x03|0x0035) plen 5                            #54 5.083427
        Num handles: 1
        Handle: 183 Address: DF:A9:FF:F6:B1:1A (OUI DF-A9-FF)
        Count: 1
zephyr.exe[1596045]: < ACL Data TX: Handle 183 flags 0x00 dlen 7                                                     #55 5.083774
      ATT: Exchange MTU Response (0x03) len 2
        Server RX MTU: 251
zephyr.exe[1596045]: < HCI Command: Host Number of Completed Packets (0x03|0x0035) plen 5                            #56 5.083990
        Num handles: 1
        Handle: 183 Address: DF:A9:FF:F6:B1:1A (OUI DF-A9-FF)
        Count: 1
> HCI Event: Number of Completed Packets (0x13) plen 5                                                               #57 5.199893
        Num handles: 1
        Handle: 183 Address: DF:A9:FF:F6:B1:1A (OUI DF-A9-FF)
        Count: 1
        #55: len 7 (0 Kb/s)
        Latency: 116 msec (116-116 msec ~116 msec)
> ACL Data RX: Handle 183 flags 0x02 dlen 11                                                                         #58 7.180009
      SMP: Pairing Request (0x01) len 6
        IO capability: KeyboardDisplay (0x04)
        OOB data: Authentication data not present (0x00)
        Authentication requirement: Bonding, No MITM, SC, No Keypresses (0x09)
        Max encryption key size: 16
        Initiator key distribution: EncKey IdKey (0x03)
        Responder key distribution: EncKey IdKey Sign (0x07)
zephyr.exe[1596045]: < HCI Command: Host Number of Completed Packets (0x03|0x0035) plen 5                            #59 7.183337
        Num handles: 1
        Handle: 183 Address: DF:A9:FF:F6:B1:1A (OUI DF-A9-FF)
        Count: 1
zephyr.exe[1596045]: < ACL Data TX: Handle 183 flags 0x00 dlen 11                                                    #60 7.183545
      SMP: Pairing Response (0x02) len 6
        IO capability: NoInputNoOutput (0x03)
        OOB data: Authentication data not present (0x00)
        Authentication requirement: Bonding, No MITM, SC, No Keypresses (0x09)
        Max encryption key size: 16
        Initiator key distribution: IdKey (0x02)
        Responder key distribution: <none> (0x00)
> HCI Event: Number of Completed Packets (0x13) plen 5                                                               #61 7.299991
        Num handles: 1
        Handle: 183 Address: DF:A9:FF:F6:B1:1A (OUI DF-A9-FF)
        Count: 1
        #60: len 11 (0 Kb/s)
        Latency: 116 msec (116-116 msec ~116 msec)
> ACL Data RX: Handle 183 flags 0x02 dlen 27                                                                         #62 7.300309
> ACL Data RX: Handle 183 flags 0x01 dlen 27                                                                         #63 7.300679
> ACL Data RX: Handle 183 flags 0x01 dlen 15                                                                         #64 7.301076
      SMP: Pairing Public Key (0x0c) len 64
        X: 63a78a8a2d6df25c68c3142101aff351194b84f6106517b2456a7c04db37a7ee
        Y: 490fabd81bfc3cdc6c510e7b63ba4e3a98eab45f61f032c85520c436462613ce
zephyr.exe[1596045]: < HCI Command: Host Number of Completed Packets (0x03|0x0035) plen 5                            #65 7.303189
        Num handles: 1
        Handle: 183 Address: DF:A9:FF:F6:B1:1A (OUI DF-A9-FF)
        Count: 1
zephyr.exe[1596045]: < HCI Command: Host Number of Completed Packets (0x03|0x0035) plen 5                            #66 7.303295
        Num handles: 1
        Handle: 183 Address: DF:A9:FF:F6:B1:1A (OUI DF-A9-FF)
        Count: 1
zephyr.exe[1596045]: < HCI Command: Host Number of Completed Packets (0x03|0x0035) plen 5                            #67 7.303466
        Num handles: 1
        Handle: 183 Address: DF:A9:FF:F6:B1:1A (OUI DF-A9-FF)
        Count: 1
zephyr.exe[1596045]: < ACL Data TX: Handle 183 flags 0x00 dlen 27                                                    #68 7.303523
zephyr.exe[1596045]: < ACL Data TX: Handle 183 flags 0x01 dlen 27                                                    #69 7.303536
zephyr.exe[1596045]: < ACL Data TX: Handle 183 flags 0x01 dlen 15                                                    #70 7.303568
      SMP: Pairing Public Key (0x0c) len 64
        X: 98308440221e2d910f0e54b71e7ec652857aa9b5a0dc65028824cc19db1226e9
        Y: 67a4816bcb62efb21701e31fdb27561a6217575fb007a8bbdabe7e28b6f68482
> HCI Event: Number of Completed Packets (0x13) plen 5                                                               #71 7.360279
        Num handles: 1
        Handle: 183 Address: DF:A9:FF:F6:B1:1A (OUI DF-A9-FF)
        Count: 1
        #68: len 27 (3 Kb/s)
        Latency: 56 msec (56-116 msec ~86 msec)
> HCI Event: Number of Completed Packets (0x13) plen 5                                                               #72 7.360851
        Num handles: 1
        Handle: 183 Address: DF:A9:FF:F6:B1:1A (OUI DF-A9-FF)
        Count: 1
        #69: len 27 (3 Kb/s)
        Latency: 57 msec (56-116 msec ~71 msec)
zephyr.exe[1596045]: < ACL Data TX: Handle 183 flags 0x00 dlen 21                                                    #73 7.363016
      SMP: Pairing Confirm (0x03) len 16
        Confim value: 966a01fb9c4b3fc6a8d5c91f550b97a4
> HCI Event: Number of Completed Packets (0x13) plen 5                                                               #74 7.420004
        Num handles: 1
        Handle: 183 Address: DF:A9:FF:F6:B1:1A (OUI DF-A9-FF)
        Count: 1
        #70: len 15 (1 Kb/s)
        Latency: 116 msec (56-116 msec ~94 msec)
> HCI Event: Number of Completed Packets (0x13) plen 5                                                               #75 7.480048
        Num handles: 1
        Handle: 183 Address: DF:A9:FF:F6:B1:1A (OUI DF-A9-FF)
        Count: 1
        #73: len 21 (1 Kb/s)
        Latency: 117 msec (56-117 msec ~105 msec)
> ACL Data RX: Handle 183 flags 0x02 dlen 21                                                                         #76 7.480280
      SMP: Pairing Random (0x04) len 16
        Random value: d1a14c1287586b4c0000000000000000
zephyr.exe[1596045]: < HCI Command: Host Number of Completed Packets (0x03|0x0035) plen 5                            #77 7.483566
        Num handles: 1
        Handle: 183 Address: DF:A9:FF:F6:B1:1A (OUI DF-A9-FF)
        Count: 1
zephyr.exe[1596045]: < ACL Data TX: Handle 183 flags 0x00 dlen 21                                                    #78 7.483673
      SMP: Pairing Random (0x04) len 16
        Random value: 8e6108f966a694cbe26df70bb96773e6
> HCI Event: Number of Completed Packets (0x13) plen 5                                                               #79 7.600016
        Num handles: 1
        Handle: 183 Address: DF:A9:FF:F6:B1:1A (OUI DF-A9-FF)
        Count: 1
        #78: len 21 (1 Kb/s)
        Latency: 116 msec (56-117 msec ~110 msec)
> ACL Data RX: Handle 183 flags 0x02 dlen 21                                                                         #80 7.780149
      SMP: Pairing DHKey Check (0x0d) len 16
        E: 3352968383deac97ad1252a7815e078b
zephyr.exe[1596045]: < HCI Command: Host Number of Completed Packets (0x03|0x0035) plen 5                            #81 7.783141
        Num handles: 1
        Handle: 183 Address: DF:A9:FF:F6:B1:1A (OUI DF-A9-FF)
        Count: 1
zephyr.exe[1596045]: < ACL Data TX: Handle 183 flags 0x00 dlen 21                                                    #82 7.783261
      SMP: Pairing DHKey Check (0x0d) len 16
        E: 52f751eb87124164c283a08fbd683078
> HCI Event: Number of Completed Packets (0x13) plen 5                                                               #83 7.899826
        Num handles: 1
        Handle: 183 Address: DF:A9:FF:F6:B1:1A (OUI DF-A9-FF)
        Count: 1
        #82: len 21 (1 Kb/s)
        Latency: 116 msec (56-117 msec ~113 msec)
> HCI Event: LE Meta Event (0x3e) plen 13                                                                            #84 8.020327
      LE Long Term Key Request (0x05)
        Handle: 183 Address: DF:A9:FF:F6:B1:1A (OUI DF-A9-FF)
        Random number: 0x0000000000000000
        Encrypted diversifier: 0x0000
zephyr.exe[1596045]: < HCI Command: LE Long Term Key Request Reply (0x08|0x001a) plen 18                             #85 8.023304
        Handle: 183 Address: DF:A9:FF:F6:B1:1A (OUI DF-A9-FF)
        Long term key: 135285838d528264c558e66e2d544e1f
> HCI Event: Command Complete (0x0e) plen 6                                                                          #86 8.024092
      LE Long Term Key Request Reply (0x08|0x001a) ncmd 1
        Status: Success (0x00)
        Handle: 183 Address: DF:A9:FF:F6:B1:1A (OUI DF-A9-FF)
> HCI Event: Encryption Change (0x08) plen 4                                                                         #87 8.320089
        Status: Success (0x00)
        Handle: 183 Address: DF:A9:FF:F6:B1:1A (OUI DF-A9-FF)
        Encryption: Enabled with AES-CCM (0x01)
> ACL Data RX: Handle 183 flags 0x02 dlen 21                                                                         #88 8.380206
      SMP: Identity Information (0x08) len 16
        Identity resolving key: e4e19b0ccf6d4f280d3f79098e9337e5
zephyr.exe[1596045]: < HCI Command: Host Number of Completed Packets (0x03|0x0035) plen 5                            #89 8.433763
        Num handles: 1
        Handle: 183 Address: DF:A9:FF:F6:B1:1A (OUI DF-A9-FF)
        Count: 1
> ACL Data RX: Handle 183 flags 0x02 dlen 12                                                                         #90 8.499953
      SMP: Identity Address Information (0x09) len 7
        Address: DF:A9:FF:F6:B1:1A (OUI DF-A9-FF)
zephyr.exe[1596045]: < HCI Command: LE Add Device To Resolving List (0x08|0x0027) plen 39                            #91 8.503618
        Address type: Public (0x00)
        Address: DF:A9:FF:F6:B1:1A (OUI DF-A9-FF)
        Peer identity resolving key: e4e19b0ccf6d4f280d3f79098e9337e5
        Local identity resolving key: 00000000000000000000000000000000
> HCI Event: Command Complete (0x0e) plen 4                                                                          #92 8.504707
      LE Add Device To Resolving List (0x08|0x0027) ncmd 1
        Status: Success (0x00)
zephyr.exe[1596045]: < HCI Command: LE Set Privacy Mode (0x08|0x004e) plen 8                                         #93 8.523327
        Peer Identity address type: Public (0x00)
        Peer Identity address: DF:A9:FF:F6:B1:1A (OUI DF-A9-FF)
        Privacy Mode: Use Device Privacy (0x01)
> HCI Event: Command Complete (0x0e) plen 4                                                                          #94 8.523885
      LE Set Privacy Mode (0x08|0x004e) ncmd 1
        Status: Success (0x00)
zephyr.exe[1596045]: < HCI Command: LE Set Address Resolution Enable (0x08|0x002d) plen 1                            #95 8.543045
        Address resolution: Enabled (0x01)
> HCI Event: Command Complete (0x0e) plen 4                                                                          #96 8.543418
      LE Set Address Resolution Enable (0x08|0x002d) ncmd 1
        Status: Success (0x00)
> ACL Data RX: Handle 183 flags 0x02 dlen 13                                                                         #97 8.560015
      ATT: Find By Type Value Request (0x06) len 8
        Handle range: 0x0001-0xffff
        Attribute type: Primary Service (0x2800)
          UUID: Broadcast Audio Scan (0x184f)
zephyr.exe[1596045]: < HCI Command: Host Number of Completed Packets (0x03|0x0035) plen 5                            #98 8.562951
        Num handles: 1
        Handle: 183 Address: DF:A9:FF:F6:B1:1A (OUI DF-A9-FF)
        Count: 1
zephyr.exe[1596045]: < HCI Command: Host Number of Completed Packets (0x03|0x0035) plen 5                            #99 8.563197
        Num handles: 1
        Handle: 183 Address: DF:A9:FF:F6:B1:1A (OUI DF-A9-FF)
        Count: 1
zephyr.exe[1596045]: < ACL Data TX: Handle 183 flags 0x00 dlen 9                                                    #100 8.563200
      ATT: Find By Type Value Response (0x07) len 4
        Handle range: 0x0047-0x004c
> HCI Event: Number of Completed Packets (0x13) plen 5                                                              #101 8.680089
        Num handles: 1
        Handle: 183 Address: DF:A9:FF:F6:B1:1A (OUI DF-A9-FF)
        Count: 1
        #100: len 9 (0 Kb/s)
        Latency: 116 msec (56-117 msec ~115 msec)
> ACL Data RX: Handle 183 flags 0x02 dlen 13                                                                        #102 8.680094
      ATT: Find By Type Value Request (0x06) len 8
        Handle range: 0x004d-0xffff
        Attribute type: Primary Service (0x2800)
          UUID: Broadcast Audio Scan (0x184f)
zephyr.exe[1596045]: < HCI Command: Host Number of Completed Packets (0x03|0x0035) plen 5                           #103 8.683291
        Num handles: 1
        Handle: 183 Address: DF:A9:FF:F6:B1:1A (OUI DF-A9-FF)
        Count: 1
zephyr.exe[1596045]: < ACL Data TX: Handle 183 flags 0x00 dlen 9                                                    #104 8.683434
      ATT: Error Response (0x01) len 4
        Find By Type Value Request (0x06)
        Handle: 0x004d
        Error: Attribute Not Found (0x0a)
> HCI Event: Number of Completed Packets (0x13) plen 5                                                              #105 8.799963
        Num handles: 1
        Handle: 183 Address: DF:A9:FF:F6:B1:1A (OUI DF-A9-FF)
        Count: 1
        #104: len 9 (0 Kb/s)
        Latency: 116 msec (56-117 msec ~115 msec)
> ACL Data RX: Handle 183 flags 0x02 dlen 11                                                                        #106 8.800083
      ATT: Read By Type Request (0x08) len 6
        Handle range: 0x0047-0x004c
        Attribute type: Characteristic (0x2803)
zephyr.exe[1596045]: < HCI Command: Host Number of Completed Packets (0x03|0x0035) plen 5                           #107 8.803134
        Num handles: 1
        Handle: 183 Address: DF:A9:FF:F6:B1:1A (OUI DF-A9-FF)
        Count: 1
zephyr.exe[1596045]: < ACL Data TX: Handle 183 flags 0x00 dlen 20                                                   #108 8.803141
      ATT: Read By Type Response (0x09) len 15
        Attribute data length: 7
        Attribute data list: 2 entries
        Handle: 0x0048
        Value: 0c4900c72b
            Properties: 0x0c
              Write Without Response (0x04)
              Write (0x08)
            Value Handle: 0x0049
            Value UUID: Broadcast Audio Scan Control Point (0x2bc7)
        Handle: 0x004a
        Value: 124b00c82b
            Properties: 0x12
              Read (0x02)
              Notify (0x10)
            Value Handle: 0x004b
            Value UUID: Broadcast Receive State (0x2bc8)
> HCI Event: Number of Completed Packets (0x13) plen 5                                                              #109 8.919964
        Num handles: 1
        Handle: 183 Address: DF:A9:FF:F6:B1:1A (OUI DF-A9-FF)
        Count: 1
        #108: len 20 (1 Kb/s)
        Latency: 116 msec (56-117 msec ~116 msec)
> ACL Data RX: Handle 183 flags 0x02 dlen 11                                                                        #110 8.920081
      ATT: Read By Type Request (0x08) len 6
        Handle range: 0x004b-0x004c
        Attribute type: Characteristic (0x2803)
zephyr.exe[1596045]: < HCI Command: Host Number of Completed Packets (0x03|0x0035) plen 5                           #111 8.923198
        Num handles: 1
        Handle: 183 Address: DF:A9:FF:F6:B1:1A (OUI DF-A9-FF)
        Count: 1
zephyr.exe[1596045]: < ACL Data TX: Handle 183 flags 0x00 dlen 9                                                    #112 8.923213
      ATT: Error Response (0x01) len 4
        Read By Type Request (0x08)
        Handle: 0x004b
        Error: Attribute Not Found (0x0a)
> HCI Event: Number of Completed Packets (0x13) plen 5                                                              #113 9.040004
        Num handles: 1
        Handle: 183 Address: DF:A9:FF:F6:B1:1A (OUI DF-A9-FF)
        Count: 1
        #112: len 9 (0 Kb/s)
        Latency: 116 msec (56-117 msec ~116 msec)
> ACL Data RX: Handle 183 flags 0x02 dlen 9                                                                         #114 9.040078
      ATT: Find Information Request (0x04) len 4
        Handle range: 0x004c-0x004c
zephyr.exe[1596045]: < HCI Command: Host Number of Completed Packets (0x03|0x0035) plen 5                           #115 9.043275
        Num handles: 1
        Handle: 183 Address: DF:A9:FF:F6:B1:1A (OUI DF-A9-FF)
        Count: 1
zephyr.exe[1596045]: < ACL Data TX: Handle 183 flags 0x00 dlen 10                                                   #116 9.043421
      ATT: Find Information Response (0x05) len 5
        Format: UUID-16 (0x01)
        Handle: 0x004c
        UUID: Client Characteristic Configuration (0x2902)
> HCI Event: Number of Completed Packets (0x13) plen 5                                                              #117 9.159979
        Num handles: 1
        Handle: 183 Address: DF:A9:FF:F6:B1:1A (OUI DF-A9-FF)
        Count: 1
        #116: len 10 (0 Kb/s)
        Latency: 116 msec (56-117 msec ~116 msec)
> ACL Data RX: Handle 183 flags 0x02 dlen 9                                                                         #118 9.160039
      ATT: Write Request (0x12) len 4
        Handle: 0x004c
          Data: 0000
zephyr.exe[1596045]: < HCI Command: Host Number of Completed Packets (0x03|0x0035) plen 5                           #119 9.163560
        Num handles: 1
        Handle: 183 Address: DF:A9:FF:F6:B1:1A (OUI DF-A9-FF)
        Count: 1
zephyr.exe[1596045]: < ACL Data TX: Handle 183 flags 0x00 dlen 5                                                    #120 9.163611
      ATT: Write Response (0x13) len 0
> HCI Event: Number of Completed Packets (0x13) plen 5                                                              #121 9.279898
        Num handles: 1
        Handle: 183 Address: DF:A9:FF:F6:B1:1A (OUI DF-A9-FF)
        Count: 1
        #120: len 5 (0 Kb/s)
        Latency: 116 msec (56-117 msec ~116 msec)
> ACL Data RX: Handle 183 flags 0x02 dlen 9                                                                         #122 9.280028
      ATT: Write Request (0x12) len 4
        Handle: 0x004c
          Data: 0100
zephyr.exe[1596045]: < HCI Command: Host Number of Completed Packets (0x03|0x0035) plen 5                           #123 9.283055
        Num handles: 1
        Handle: 183 Address: DF:A9:FF:F6:B1:1A (OUI DF-A9-FF)
        Count: 1
zephyr.exe[1596045]: < ACL Data TX: Handle 183 flags 0x00 dlen 5                                                    #124 9.283078
      ATT: Write Response (0x13) len 0
> HCI Event: Number of Completed Packets (0x13) plen 5                                                              #125 9.399924
        Num handles: 1
        Handle: 183 Address: DF:A9:FF:F6:B1:1A (OUI DF-A9-FF)
        Count: 1
        #124: len 5 (0 Kb/s)
        Latency: 116 msec (56-117 msec ~116 msec)
> ACL Data RX: Handle 183 flags 0x02 dlen 7                                                                         #126 9.399993
      ATT: Read Request (0x0a) len 2
        Handle: 0x004b
zephyr.exe[1596045]: < HCI Command: Host Number of Completed Packets (0x03|0x0035) plen 5                           #127 9.403312
        Num handles: 1
        Handle: 183 Address: DF:A9:FF:F6:B1:1A (OUI DF-A9-FF)
        Count: 1
zephyr.exe[1596045]: < ACL Data TX: Handle 183 flags 0x00 dlen 5                                                    #128 9.403398
      ATT: Read Response (0x0b) len 0
> HCI Event: Number of Completed Packets (0x13) plen 5                                                              #129 9.519767
        Num handles: 1
        Handle: 183 Address: DF:A9:FF:F6:B1:1A (OUI DF-A9-FF)
        Count: 1
        #128: len 5 (0 Kb/s)
        Latency: 116 msec (56-117 msec ~116 msec)
> ACL Data RX: Handle 183 flags 0x02 dlen 27                                                                        #130 9.700100
> ACL Data RX: Handle 183 flags 0x01 dlen 1                                                                         #131 9.700289
      ATT: Write Command (0x52) len 23
        Handle: 0x0049
          Data: 02001ab1f6ffa9df00d1a10c02401f010000000000
zephyr.exe[1596045]: < HCI Command: Host Number of Completed Packets (0x03|0x0035) plen 5                           #132 9.703116
        Num handles: 1
        Handle: 183 Address: DF:A9:FF:F6:B1:1A (OUI DF-A9-FF)
        Count: 1
zephyr.exe[1596045]: < HCI Command: Host Number of Completed Packets (0x03|0x0035) plen 5                           #133 9.703309
        Num handles: 1
        Handle: 183 Address: DF:A9:FF:F6:B1:1A (OUI DF-A9-FF)
        Count: 1
zephyr.exe[1596045]: < ACL Data TX: Handle 183 flags 0x00 dlen 27                                                   #134 9.703469
      ATT: Handle Value Notification (0x1b) len 22
        Handle: 0x004b
          Data: 00001ab1f6ffa9df00d1a10c0000010000000000
> HCI Event: Number of Completed Packets (0x13) plen 5                                                              #135 9.819849
        Num handles: 1
        Handle: 183 Address: DF:A9:FF:F6:B1:1A (OUI DF-A9-FF)
        Count: 1
        #134: len 27 (1 Kb/s)
        Latency: 116 msec (56-117 msec ~116 msec)
zephyr.exe[1596045]: < HCI Command: LE Periodic Advertising Create Sync (0x08|0x0044) plen 14                      #136 10.563244
        Options: 0x0000
        Use advertising SID, Advertiser Address Type and address
        Reporting initially enabled
        SID: 0x00
        Adv address type: Public (0x00)
        Adv address: DF:A9:FF:F6:B1:1A (OUI DF-A9-FF)
        Skip: 0x0005
        Sync timeout: 10000 msec (0x03e8)
        Sync CTE type: 0x0000
> HCI Event: Command Status (0x0f) plen 4                                                                          #137 10.563904
      LE Periodic Advertising Create Sync (0x08|0x0044) ncmd 1
        Status: Success (0x00)
zephyr.exe[1596045]: < HCI Command: LE Set Random Address (0x08|0x0005) plen 6                                     #138 10.583021
        Address: 06:5C:55:95:A0:5D (Non-Resolvable)
> HCI Event: Command Complete (0x0e) plen 4                                                                        #139 10.583541
      LE Set Random Address (0x08|0x0005) ncmd 1
        Status: Success (0x00)
zephyr.exe[1596045]: < HCI Command: LE Set Extended Scan Parameters (0x08|0x0041) plen 13                          #140 10.602990
        Own address type: Random (0x01)
        Filter policy: Accept all advertisement (0x00)
        PHYs: 0x05
        Entry 0: LE 1M
          Type: Passive (0x00)
          Interval: 60.000 msec (0x0060)
          Window: 30.000 msec (0x0030)
        Entry 1: LE Coded
          Type: Passive (0x00)
          Interval: 60.000 msec (0x0060)
          Window: 30.000 msec (0x0030)
> HCI Event: Command Complete (0x0e) plen 4                                                                        #141 10.603584
      LE Set Extended Scan Parameters (0x08|0x0041) ncmd 1
        Status: Success (0x00)
zephyr.exe[1596045]: < HCI Command: LE Set Extended Scan Enable (0x08|0x0042) plen 6                               #142 10.623000
        Extended scan: Enabled (0x01)
        Filter duplicates: Enabled (0x01)
        Duration: 0 msec (0x0000)
        Period: 0.00 sec (0x0000)
> HCI Event: Command Complete (0x0e) plen 4                                                                        #143 10.623560
      LE Set Extended Scan Enable (0x08|0x0042) ncmd 1
        Status: Success (0x00)
> HCI Event: LE Meta Event (0x3e) plen 57                                                                          #144 10.635002
      LE Extended Advertising Report (0x0d)
        Num reports: 1
        Entry 0
          Event type: 0x0013
            Props: 0x0013
              Connectable
              Scannable
              Use legacy advertising PDUs
            Data status: [0;32mComplete[0m
          Legacy PDU Type: ADV_IND (0x0013)
          Address type: Random (0x01)
          Address: C4:B6:3F:DD:A5:47 (Static)
          Primary PHY: LE 1M
          Secondary PHY: No packets
          SID: no ADI field (0xff)
          TX power: 127 dBm
          RSSI: -96 dBm (0xa0)
          Periodic advertising interval: 0.00 msec (0x0000)
          Direct address type: Reserved (0xff)
          Direct address: 00-00-00-00-00-00
          Data length: 0x1f
        02 01 06 1b ff 99 04 05 0f 83 3b d0 c7 52 03 e0  ..........;..R..
        00 dc ff e8 c0 f6 24 92 59 c4 b6 3f dd a5 47     ......$.Y..?..G 
        Flags: 0x06
          LE General Discoverable Mode
          BR/EDR Not Supported
        Company: Ruuvi Innovations Ltd. (1177)
          Data: 050f833bd0c75203e000dcffe8c0f6249259c4b63fdda547
> HCI Event: LE Meta Event (0x3e) plen 54                                                                          #145 10.650987
      LE Extended Advertising Report (0x0d)
        Num reports: 1
        Entry 0
          Event type: 0x0010
            Props: 0x0010
              Use legacy advertising PDUs
            Data status: [0;32mComplete[0m
          Legacy PDU Type: ADV_NONCONN_IND (0x0010)
          Address type: Public (0x00)
          Address: A4:30:7A:95:74:FB (Samsung Electronics Co.,Ltd)
          Primary PHY: LE 1M
          Secondary PHY: No packets
          SID: no ADI field (0xff)
          TX power: 127 dBm
          RSSI: -82 dBm (0xae)
          Periodic advertising interval: 0.00 msec (0x0000)
          Direct address type: Reserved (0xff)
          Direct address: 00-00-00-00-00-00
          Data length: 0x1c
        1b ff 75 00 42 04 01 80 6e a4 30 7a 95 74 fb a6  ..u.B...n.0z.t..
        30 7a 95 74 fa 01 d8 41 c5 d9 00 00              0z.t...A....    
        Company: Samsung Electronics Co. Ltd. (117)
          Data: 420401806ea4307a9574fba6307a9574fa01d841c5d90000
> HCI Event: LE Meta Event (0x3e) plen 55                                                                          #146 10.651550
      LE Extended Advertising Report (0x0d)
        Num reports: 1
        Entry 0
          Event type: 0x0010
            Props: 0x0010
              Use legacy advertising PDUs
            Data status: [0;32mComplete[0m
          Legacy PDU Type: ADV_NONCONN_IND (0x0010)
          Address type: Random (0x01)
          Address: 3F:BB:4F:CE:3B:1D (Non-Resolvable)
          Primary PHY: LE 1M
          Secondary PHY: No packets
          SID: no ADI field (0xff)
          TX power: 127 dBm
          RSSI: -85 dBm (0xab)
          Periodic advertising interval: 0.00 msec (0x0000)
          Direct address type: Reserved (0xff)
          Direct address: 00-00-00-00-00-00
          Data length: 0x1d
        1c ff 06 00 01 09 21 0a 4d e0 8a 52 d2 d4 4c 41  ......!.M..R..LA
        50 54 4f 50 2d 45 35 32 45 4f 44 32 49           PTOP-E52EOD2I   
        Company: Microsoft (6)
          Data: 0109210a4de08a52d2d44c4150544f502d453532454f443249
> HCI Event: LE Meta Event (0x3e) plen 38                                                                          #147 10.751019
      LE Extended Advertising Report (0x0d)
        Num reports: 1
        Entry 0
          Event type: 0x0012
            Props: 0x0012
              Scannable
              Use legacy advertising PDUs
            Data status: [0;32mComplete[0m
          Legacy PDU Type: ADV_SCAN_IND (0x0012)
          Address type: Random (0x01)
          Address: 57:4D:E1:D7:FA:7E (Resolvable)
          Primary PHY: LE 1M
          Secondary PHY: No packets
          SID: no ADI field (0xff)
          TX power: 127 dBm
          RSSI: -90 dBm (0xa6)
          Periodic advertising interval: 0.00 msec (0x0000)
          Direct address type: Reserved (0xff)
          Direct address: 00-00-00-00-00-00
          Data length: 0x0c
        0b ff 4c 00 09 06 03 00 0a 03 07 11              ..L.........    
        Company: Apple, Inc. (76)
          Type: Apple TV (9)
          Data: 03000a030711
> HCI Event: LE Meta Event (0x3e) plen 55                                                                          #148 10.754083
      LE Extended Advertising Report (0x0d)
        Num reports: 1
        Entry 0
          Event type: 0x0010
            Props: 0x0010
              Use legacy advertising PDUs
            Data status: [0;32mComplete[0m
          Legacy PDU Type: ADV_NONCONN_IND (0x0010)
          Address type: Random (0x01)
          Address: 3F:BB:4F:CE:3B:1D (Non-Resolvable)
          Primary PHY: LE 1M
          Secondary PHY: No packets
          SID: no ADI field (0xff)
          TX power: 127 dBm
          RSSI: -87 dBm (0xa9)
          Periodic advertising interval: 0.00 msec (0x0000)
          Direct address type: Reserved (0xff)
          Direct address: 00-00-00-00-00-00
          Data length: 0x1d
        1c ff 06 00 01 09 21 0a 4d e0 8a 52 d2 d4 4c 41  ......!.M..R..LA
        50 54 4f 50 2d 45 35 32 45 4f 44 32 49           PTOP-E52EOD2I   
        Company: Microsoft (6)
          Data: 0109210a4de08a52d2d44c4150544f502d453532454f443249
> HCI Event: LE Meta Event (0x3e) plen 26                                                                          #149 10.765640
      LE Extended Advertising Report (0x0d)
        Num reports: 1
        Entry 0
          Event type: 0x0010
            Props: 0x0010
              Use legacy advertising PDUs
            Data status: [0;32mComplete[0m
          Legacy PDU Type: ADV_NONCONN_IND (0x0010)
          Address type: Public (0x00)
          Address: 90:CD:B6:41:AD:52 (Hon Hai Precision Ind. Co.,Ltd.)
          Primary PHY: LE 1M
          Secondary PHY: No packets
          SID: no ADI field (0xff)
          TX power: 127 dBm
          RSSI: -85 dBm (0xab)
          Periodic advertising interval: 0.00 msec (0x0000)
          Direct address type: Reserved (0xff)
          Direct address: 00-00-00-00-00-00
          Data length: 0x00
> HCI Event: LE Meta Event (0x3e) plen 57                                                                          #150 10.771110
      LE Extended Advertising Report (0x0d)
        Num reports: 1
        Entry 0
          Event type: 0x0010
            Props: 0x0010
              Use legacy advertising PDUs
            Data status: [0;32mComplete[0m
          Legacy PDU Type: ADV_NONCONN_IND (0x0010)
          Address type: Random (0x01)
          Address: 33:95:4D:FF:A6:A2 (Non-Resolvable)
          Primary PHY: LE 1M
          Secondary PHY: No packets
          SID: no ADI field (0xff)
          TX power: 127 dBm
          RSSI: -89 dBm (0xa7)
          Periodic advertising interval: 0.00 msec (0x0000)
          Direct address type: Reserved (0xff)
          Direct address: 00-00-00-00-00-00
          Data length: 0x1f
        1e ff 06 00 01 09 20 22 63 29 52 e3 42 f5 6f 63  ...... "c)R.B.oc
        c5 bb 6e ea c5 c2 3e 12 9c 66 0e e2 26 9c 45     ..n...>..f..&.E 
        Company: Microsoft (6)
          Data: 01092022632952e342f56f63c5bb6eeac5c23e129c660ee2269c45
> HCI Event: LE Meta Event (0x3e) plen 57                                                                          #151 10.815162
      LE Extended Advertising Report (0x0d)
        Num reports: 1
        Entry 0
          Event type: 0x0010
            Props: 0x0010
              Use legacy advertising PDUs
            Data status: [0;32mComplete[0m
          Legacy PDU Type: ADV_NONCONN_IND (0x0010)
          Address type: Random (0x01)
          Address: 36:23:B6:F5:66:B4 (Non-Resolvable)
          Primary PHY: LE 1M
          Secondary PHY: No packets
          SID: no ADI field (0xff)
          TX power: 127 dBm
          RSSI: -93 dBm (0xa3)
          Periodic advertising interval: 0.00 msec (0x0000)
          Direct address type: Reserved (0xff)
          Direct address: 00-00-00-00-00-00
          Data length: 0x1f
        1e ff 06 00 01 0f 20 22 4a b7 4c fc 95 1a 56 c8  ...... "J.L...V.
        3e 03 84 9b 67 34 ae d9 a6 05 31 58 2d de f9     >...g4....1X-.. 
        Company: Microsoft (6)
          Data: 010f20224ab74cfc951a56c83e03849b6734aed9a60531582ddef9
> HCI Event: LE Meta Event (0x3e) plen 29                                                                          #152 10.817801
      LE Extended Advertising Report (0x0d)
        Num reports: 1
        Entry 0
          Event type: 0x0013
            Props: 0x0013
              Connectable
              Scannable
              Use legacy advertising PDUs
            Data status: [0;32mComplete[0m
          Legacy PDU Type: ADV_IND (0x0013)
          Address type: Random (0x01)
          Address: 69:09:23:61:92:E6 (Resolvable)
          Primary PHY: LE 1M
          Secondary PHY: No packets
          SID: no ADI field (0xff)
          TX power: 127 dBm
          RSSI: -96 dBm (0xa0)
          Periodic advertising interval: 0.00 msec (0x0000)
          Direct address type: Reserved (0xff)
          Direct address: 00-00-00-00-00-00
          Data length: 0x03
        02 01 06                                         ...             
        Flags: 0x06
          LE General Discoverable Mode
          BR/EDR Not Supported
> HCI Event: LE Meta Event (0x3e) plen 57                                                                          #153 10.880889
      LE Extended Advertising Report (0x0d)
        Num reports: 1
        Entry 0
          Event type: 0x0010
            Props: 0x0010
              Use legacy advertising PDUs
            Data status: [0;32mComplete[0m
          Legacy PDU Type: ADV_NONCONN_IND (0x0010)
          Address type: Random (0x01)
          Address: 33:95:4D:FF:A6:A2 (Non-Resolvable)
          Primary PHY: LE 1M
          Secondary PHY: No packets
          SID: no ADI field (0xff)
          TX power: 127 dBm
          RSSI: -93 dBm (0xa3)
          Periodic advertising interval: 0.00 msec (0x0000)
          Direct address type: Reserved (0xff)
          Direct address: 00-00-00-00-00-00
          Data length: 0x1f
        1e ff 06 00 01 09 20 22 63 29 52 e3 42 f5 6f 63  ...... "c)R.B.oc
        c5 bb 6e ea c5 c2 3e 12 9c 66 0e e2 26 9c 45     ..n...>..f..&.E 
        Company: Microsoft (6)
          Data: 01092022632952e342f56f63c5bb6eeac5c23e129c660ee2269c45
> HCI Event: LE Meta Event (0x3e) plen 47                                                                          #154 10.932652
      LE Extended Advertising Report (0x0d)
        Num reports: 1
        Entry 0
          Event type: 0x0013
            Props: 0x0013
              Connectable
              Scannable
              Use legacy advertising PDUs
            Data status: [0;32mComplete[0m
          Legacy PDU Type: ADV_IND (0x0013)
          Address type: Public (0x00)
          Address: A4:C1:38:8F:2F:B5 (Telink Semiconductor (Taipei) Co. Ltd.)
          Primary PHY: LE 1M
          Secondary PHY: No packets
          SID: no ADI field (0xff)
          TX power: 127 dBm
          RSSI: -83 dBm (0xad)
          Periodic advertising interval: 0.00 msec (0x0000)
          Direct address type: Reserved (0xff)
          Direct address: 00-00-00-00-00-00
          Data length: 0x15
        02 01 06 11 16 95 fe 30 58 5b 05 01 b5 2f 8f 38  .......0X[.../.8
        c1 a4 28 01 00                                   ..(..           
        Flags: 0x06
          LE General Discoverable Mode
          BR/EDR Not Supported
        Service Data: Xiaomi Inc. (0xfe95)
          Data: 30585b0501b52f8f38c1a4280100
> HCI Event: LE Meta Event (0x3e) plen 57                                                                          #155 10.945202
      LE Extended Advertising Report (0x0d)
        Num reports: 1
        Entry 0
          Event type: 0x0013
            Props: 0x0013
              Connectable
              Scannable
              Use legacy advertising PDUs
            Data status: [0;32mComplete[0m
          Legacy PDU Type: ADV_IND (0x0013)
          Address type: Random (0x01)
          Address: C4:8E:10:2A:32:DB (Static)
          Primary PHY: LE 1M
          Secondary PHY: No packets
          SID: no ADI field (0xff)
          TX power: 127 dBm
          RSSI: -95 dBm (0xa1)
          Periodic advertising interval: 0.00 msec (0x0000)
          Direct address type: Reserved (0xff)
          Direct address: 00-00-00-00-00-00
          Data length: 0x1f
        1e ff 4c 00 12 19 50 8e 39 ca c0 06 3c ab a3 3e  ..L...P.9...<..>
        95 87 3b 84 8d e8 39 0d e9 7d 58 7f c9 02 fd     ..;...9..}X.... 
        Company: Apple, Inc. (76)
          Type: Unknown (18)
          Data: 508e39cac0063caba33e95873b848de8390de97d587fc902fd
> HCI Event: LE Meta Event (0x3e) plen 54                                                                          #156 11.243816
      LE Extended Advertising Report (0x0d)
        Num reports: 1
        Entry 0
          Event type: 0x0010
            Props: 0x0010
              Use legacy advertising PDUs
            Data status: [0;32mComplete[0m
          Legacy PDU Type: ADV_NONCONN_IND (0x0010)
          Address type: Public (0x00)
          Address: A4:30:7A:95:74:FB (Samsung Electronics Co.,Ltd)
          Primary PHY: LE 1M
          Secondary PHY: No packets
          SID: no ADI field (0xff)
          TX power: 127 dBm
          RSSI: -82 dBm (0xae)
          Periodic advertising interval: 0.00 msec (0x0000)
          Direct address type: Reserved (0xff)
          Direct address: 00-00-00-00-00-00
          Data length: 0x1c
        1b ff 75 00 42 04 01 80 6e a4 30 7a 95 74 fb a6  ..u.B...n.0z.t..
        30 7a 95 74 fa 01 d8 41 c5 d9 00 00              0z.t...A....    
        Company: Samsung Electronics Co. Ltd. (117)
          Data: 420401806ea4307a9574fba6307a9574fa01d841c5d90000
> HCI Event: LE Meta Event (0x3e) plen 57                                                                          #157 11.301492
      LE Extended Advertising Report (0x0d)
        Num reports: 1
        Entry 0
          Event type: 0x0010
            Props: 0x0010
              Use legacy advertising PDUs
            Data status: [0;32mComplete[0m
          Legacy PDU Type: ADV_NONCONN_IND (0x0010)
          Address type: Random (0x01)
          Address: 33:95:4D:FF:A6:A2 (Non-Resolvable)
          Primary PHY: LE 1M
          Secondary PHY: No packets
          SID: no ADI field (0xff)
          TX power: 127 dBm
          RSSI: -93 dBm (0xa3)
          Periodic advertising interval: 0.00 msec (0x0000)
          Direct address type: Reserved (0xff)
          Direct address: 00-00-00-00-00-00
          Data length: 0x1f
        1e ff 06 00 01 09 20 22 63 29 52 e3 42 f5 6f 63  ...... "c)R.B.oc
        c5 bb 6e ea c5 c2 3e 12 9c 66 0e e2 26 9c 45     ..n...>..f..&.E 
        Company: Microsoft (6)
          Data: 01092022632952e342f56f63c5bb6eeac5c23e129c660ee2269c45
> HCI Event: LE Meta Event (0x3e) plen 55                                                                          #158 11.370396
      LE Extended Advertising Report (0x0d)
        Num reports: 1
        Entry 0
          Event type: 0x0010
            Props: 0x0010
              Use legacy advertising PDUs
            Data status: [0;32mComplete[0m
          Legacy PDU Type: ADV_NONCONN_IND (0x0010)
          Address type: Random (0x01)
          Address: 3F:BB:4F:CE:3B:1D (Non-Resolvable)
          Primary PHY: LE 1M
          Secondary PHY: No packets
          SID: no ADI field (0xff)
          TX power: 127 dBm
          RSSI: -87 dBm (0xa9)
          Periodic advertising interval: 0.00 msec (0x0000)
          Direct address type: Reserved (0xff)
          Direct address: 00-00-00-00-00-00
          Data length: 0x1d
        1c ff 06 00 01 09 21 0a 4d e0 8a 52 d2 d4 4c 41  ......!.M..R..LA
        50 54 4f 50 2d 45 35 32 45 4f 44 32 49           PTOP-E52EOD2I   
        Company: Microsoft (6)
          Data: 0109210a4de08a52d2d44c4150544f502d453532454f443249
> HCI Event: LE Meta Event (0x3e) plen 55                                                                          #159 11.475178
      LE Extended Advertising Report (0x0d)
        Num reports: 1
        Entry 0
          Event type: 0x0010
            Props: 0x0010
              Use legacy advertising PDUs
            Data status: [0;32mComplete[0m
          Legacy PDU Type: ADV_NONCONN_IND (0x0010)
          Address type: Random (0x01)
          Address: 3F:BB:4F:CE:3B:1D (Non-Resolvable)
          Primary PHY: LE 1M
          Secondary PHY: No packets
          SID: no ADI field (0xff)
          TX power: 127 dBm
          RSSI: -81 dBm (0xaf)
          Periodic advertising interval: 0.00 msec (0x0000)
          Direct address type: Reserved (0xff)
          Direct address: 00-00-00-00-00-00
          Data length: 0x1d
        1c ff 06 00 01 09 21 0a 4d e0 8a 52 d2 d4 4c 41  ......!.M..R..LA
        50 54 4f 50 2d 45 35 32 45 4f 44 32 49           PTOP-E52EOD2I   
        Company: Microsoft (6)
          Data: 0109210a4de08a52d2d44c4150544f502d453532454f443249
> HCI Event: LE Meta Event (0x3e) plen 51                                                                          #160 11.484875
      LE Extended Advertising Report (0x0d)
        Num reports: 1
        Entry 0
          Event type: 0x0013
            Props: 0x0013
              Connectable
              Scannable
              Use legacy advertising PDUs
            Data status: [0;32mComplete[0m
          Legacy PDU Type: ADV_IND (0x0013)
          Address type: Public (0x00)
          Address: F0:18:98:96:04:94 (Apple, Inc.)
          Primary PHY: LE 1M
          Secondary PHY: No packets
          SID: no ADI field (0xff)
          TX power: 127 dBm
          RSSI: -96 dBm (0xa0)
          Periodic advertising interval: 0.00 msec (0x0000)
          Direct address type: Reserved (0xff)
          Direct address: 00-00-00-00-00-00
          Data length: 0x19
        02 01 06 11 07 00 00 00 00 00 00 00 00 00 00 00  ................
        00 00 01 31 5a 03 09 7a 6d                       ...1Z..zm       
        Flags: 0x06
          LE General Discoverable Mode
          BR/EDR Not Supported
        128-bit Service UUIDs (complete): 1 entry
          Vendor specific
        Name (complete): zm
> HCI Event: LE Meta Event (0x3e) plen 48                                                                          #161 11.492792
      LE Extended Advertising Report (0x0d)
        Num reports: 1
        Entry 0
          Event type: 0x0000
            Props: 0x0000
            Data status: [0;32mComplete[0m
          Address type: Public (0x00)
          Address: DF:A9:FF:F6:B1:1A (OUI DF-A9-FF)
          Primary PHY: LE 1M
          Secondary PHY: LE 1M
          SID: 0x00
          TX power: 127 dBm
          RSSI: -16 dBm (0xf0)
          Periodic advertising interval: 120.00 msec (0x0060)
          Direct address type: Reserved (0xff)
          Direct address: 00-00-00-00-00-00
          Data length: 0x16
        06 16 52 18 d1 a1 0c 0e 09 50 54 53 2d 42 41 53  ..R......PTS-BAS
        53 2d 42 31 31 41                                S-B11A          
        Service Data: Broadcast Audio Announcement (0x1852)
        Broadcast ID: 827857 (0x0ca1d1)
        Name (complete): PTS-BASS-B11A
> HCI Event: LE Meta Event (0x3e) plen 16                                                                          #162 11.590604
      LE Periodic Advertising Sync Established (0x0e)
        Status: Success (0x00)
        Sync handle: 75
        Advertising SID: 0x00
        Advertiser address type: Resolved Public (0x02)
        Advertiser address: DF:A9:FF:F6:B1:1A (OUI DF-A9-FF)
        Advertiser PHY: LE 1M (0x01)
        Periodic advertising interval: 120.00 msec (0x0060)
        Advertiser clock accuracy: 0x01
> HCI Event: LE Meta Event (0x3e) plen 48                                                                          #163 11.591096
      LE Periodic Advertising Report (0x0f)
        Sync handle: 75
        TX power: 127 dbm (0x7f)
        RSSI: -16 dBm (0xf0)
        CTE Type: No Constant Tone Extension (0xff)
        Data status: [0;32mComplete[0m
        Data length: 0x28
        27 16 51 18 40 9c 00 01 01 06 00 00 00 00 0a 02  '.Q.@...........
        01 03 02 02 01 03 04 28 00 06 03 02 04 00 01 09  .......(........
        01 06 05 03 01 00 00 00                          ........        
> HCI Event: LE Meta Event (0x3e) plen 20                                                                          #164 11.591365
      LE Broadcast Isochronous Group Info Advertising Report (0x22)
        Sync Handle: 0x004b
        Number BIS: 1
        NSE: 3
        ISO Interval: 10.00 msec (0x0008)
        BN: 1
        PTO: 1
        IRC: 2
        Maximum PDU: 40
        SDU Interval: 10000 us (0x002710)
        Maximum SDU: 40
        PHY: LE 1M (0x01)
        Framing: Unframed (0x00)
        Encryption: 0x00
zephyr.exe[1596045]: < HCI Command: LE Set Extended Scan Enable (0x08|0x0042) plen 6                               #165 11.602984
        Extended scan: Disabled (0x00)
        Filter duplicates: Disabled (0x00)
        Duration: 0 msec (0x0000)
        Period: 0.00 sec (0x0000)
> HCI Event: Command Complete (0x0e) plen 4                                                                        #166 11.605885
      LE Set Extended Scan Enable (0x08|0x0042) ncmd 1
        Status: Success (0x00)
zephyr.exe[1596045]: < ACL Data TX: Handle 183 flags 0x00 dlen 27                                                  #167 11.623611
zephyr.exe[1596045]: < ACL Data TX: Handle 183 flags 0x01 dlen 6                                                   #168 11.623758
      ATT: Handle Value Notification (0x1b) len 28
        Handle: 0x004b
          Data: 00001ab1f6ffa9df00d1a10c0200010000000006030204000109
> HCI Event: Number of Completed Packets (0x13) plen 5                                                             #169 11.680180
        Num handles: 1
        Handle: 183 Address: DF:A9:FF:F6:B1:1A (OUI DF-A9-FF)
        Count: 1
        #167: len 27 (3 Kb/s)
        Latency: 56 msec (56-117 msec ~86 msec)
> HCI Event: Number of Completed Packets (0x13) plen 5                                                             #170 11.739756
        Num handles: 1
        Handle: 183 Address: DF:A9:FF:F6:B1:1A (OUI DF-A9-FF)
        Count: 1
        #168: len 6 (0 Kb/s)
        Latency: 115 msec (56-117 msec ~101 msec)
> ACL Data RX: Handle 183 flags 0x02 dlen 7                                                                        #171 11.740063
      ATT: Read Request (0x0a) len 2
        Handle: 0x004b
zephyr.exe[1596045]: < HCI Command: Host Number of Completed Packets (0x03|0x0035) plen 5                          #172 11.743139
        Num handles: 1
        Handle: 183 Address: DF:A9:FF:F6:B1:1A (OUI DF-A9-FF)
        Count: 1
zephyr.exe[1596045]: < ACL Data TX: Handle 183 flags 0x00 dlen 27                                                  #173 11.743273
zephyr.exe[1596045]: < ACL Data TX: Handle 183 flags 0x01 dlen 4                                                   #174 11.743277
      ATT: Read Response (0x0b) len 26
> HCI Event: Number of Completed Packets (0x13) plen 5                                                             #175 11.800293
        Num handles: 1
        Handle: 183 Address: DF:A9:FF:F6:B1:1A (OUI DF-A9-FF)
        Count: 1
        #173: len 27 (3 Kb/s)
        Latency: 57 msec (56-117 msec ~79 msec)
> HCI Event: Number of Completed Packets (0x13) plen 5                                                             #176 11.859810
        Num handles: 1
        Handle: 183 Address: DF:A9:FF:F6:B1:1A (OUI DF-A9-FF)
        Count: 1
        #174: len 4 (0 Kb/s)
        Latency: 116 msec (56-117 msec ~97 msec)
> ACL Data RX: Handle 183 flags 0x02 dlen 9                                                                        #177 11.860029
      ATT: Write Request (0x12) len 4
        Handle: 0x0049
          Data: 0500
zephyr.exe[1596045]: < HCI Command: Host Number of Completed Packets (0x03|0x0035) plen 5                          #178 11.862892
        Num handles: 1
        Handle: 183 Address: DF:A9:FF:F6:B1:1A (OUI DF-A9-FF)
        Count: 1
zephyr.exe[1596045]: < ACL Data TX: Handle 183 flags 0x00 dlen 5                                                   #179 11.862913
      ATT: Write Response (0x13) len 0
> HCI Event: Number of Completed Packets (0x13) plen 5                                                             #180 11.979722
        Num handles: 1
        Handle: 183 Address: DF:A9:FF:F6:B1:1A (OUI DF-A9-FF)
        Count: 1
        #179: len 5 (0 Kb/s)
        Latency: 116 msec (56-117 msec ~107 msec)
> HCI Event: LE Meta Event (0x3e) plen 48                                                                          #181 13.030879
      LE Periodic Advertising Report (0x0f)
        Sync handle: 75
        TX power: 127 dbm (0x7f)
        RSSI: -17 dBm (0xef)
        CTE Type: No Constant Tone Extension (0xff)
        Data status: [0;32mComplete[0m
        Data length: 0x28
        27 16 51 18 40 9c 00 01 01 06 00 00 00 00 0a 02  '.Q.@...........
        01 03 02 02 01 03 04 28 00 06 03 02 04 00 01 09  .......(........
        01 06 05 03 01 00 00 00                          ........        
> HCI Event: LE Meta Event (0x3e) plen 20                                                                          #182 13.031164
      LE Broadcast Isochronous Group Info Advertising Report (0x22)
        Sync Handle: 0x004b
        Number BIS: 1
        NSE: 3
        ISO Interval: 10.00 msec (0x0008)
        BN: 1
        PTO: 1
        IRC: 2
        Maximum PDU: 40
        SDU Interval: 10000 us (0x002710)
        Maximum SDU: 40
        PHY: LE 1M (0x01)
        Framing: Unframed (0x00)
        Encryption: 0x00
> HCI Event: LE Meta Event (0x3e) plen 48                                                                          #183 13.750816
      LE Periodic Advertising Report (0x0f)
        Sync handle: 75
        TX power: 127 dbm (0x7f)
        RSSI: -16 dBm (0xf0)
        CTE Type: No Constant Tone Extension (0xff)
        Data status: [0;32mComplete[0m
        Data length: 0x28
        27 16 51 18 40 9c 00 01 01 06 00 00 00 00 0a 02  '.Q.@...........
        01 03 02 02 01 03 04 28 00 06 03 02 04 00 01 09  .......(........
        01 06 05 03 01 00 00 00                          ........        
> HCI Event: LE Meta Event (0x3e) plen 20                                                                          #184 13.751098
      LE Broadcast Isochronous Group Info Advertising Report (0x22)
        Sync Handle: 0x004b
        Number BIS: 1
        NSE: 3
        ISO Interval: 10.00 msec (0x0008)
        BN: 1
        PTO: 1
        IRC: 2
        Maximum PDU: 40
        SDU Interval: 10000 us (0x002710)
        Maximum SDU: 40
        PHY: LE 1M (0x01)
        Framing: Unframed (0x00)
        Encryption: 0x00
> HCI Event: LE Meta Event (0x3e) plen 48                                                                          #185 14.470823
      LE Periodic Advertising Report (0x0f)
        Sync handle: 75
        TX power: 127 dbm (0x7f)
        RSSI: -16 dBm (0xf0)
        CTE Type: No Constant Tone Extension (0xff)
        Data status: [0;32mComplete[0m
        Data length: 0x28
        27 16 51 18 40 9c 00 01 01 06 00 00 00 00 0a 02  '.Q.@...........
        01 03 02 02 01 03 04 28 00 06 03 02 04 00 01 09  .......(........
        01 06 05 03 01 00 00 00                          ........        
> HCI Event: LE Meta Event (0x3e) plen 20                                                                          #186 14.471078
      LE Broadcast Isochronous Group Info Advertising Report (0x22)
        Sync Handle: 0x004b
        Number BIS: 1
        NSE: 3
        ISO Interval: 10.00 msec (0x0008)
        BN: 1
        PTO: 1
        IRC: 2
