Bluetooth monitor ver 5.72
= Note: Linux version 6.14.0-36-generic (x86_64)                       0.785091
= Note: Bluetooth subsystem version 2.22                               0.785095
= New Index: 00:00:00:00:00:00 (Primary,UART,hci2)              [hci2] 0.785097
= New Index: 00:00:00:00:00:00 (Primary,UART,hci1)              [hci1] 0.785098
= New Index: 48:5F:99:8E:E0:64 (Primary,USB,hci0)               [hci0] 0.785099
= Open Index: 00:00:00:00:00:00                                 [hci1] 0.914234
= Index Info: 00:00:00:00:00:00 (Nordic Semiconductor ASA)      [hci1] 0.914251
@ USER Open: main (privileged) version 2.22            {0x0001} [hci1] 0.914261
< HCI Command: Reset (0x03|0x0003) plen 0                    #1 [hci1] 0.915540
> HCI Event: Command Complete (0x0e) plen 4                  #2 [hci1] 0.916065
      Reset (0x03|0x0003) ncmd 1
        Status: Success (0x00)
< HCI Command: Read Local Supported... (0x04|0x0003) plen 0  #3 [hci1] 0.933837
> HCI Event: Command Complete (0x0e) plen 12                 #4 [hci1] 0.934352
      Read Local Supported Features (0x04|0x0003) ncmd 1
        Status: Success (0x00)
        Features: 0x00 0x00 0x00 0x00 0x60 0x00 0x00 0x00
          BR/EDR Not Supported
          LE Supported (Controller)
< HCI Command: Read Local Version In.. (0x04|0x0001) plen 0  #5 [hci1] 0.953657
> HCI Event: Command Complete (0x0e) plen 12                 #6 [hci1] 0.954179
      Read Local Version Information (0x04|0x0001) ncmd 1
        Status: Success (0x00)
        HCI version: Reserved (0x0f) - Revision 12393 (0x3069)
        LMP version: Reserved (0x0f) - Subversion 12393 (0x3069)
        Manufacturer: Nordic Semiconductor ASA (89)
< HCI Command: Read Local Supported... (0x04|0x0002) plen 0  #7 [hci1] 0.973621
> HCI Event: Command Complete (0x0e) plen 68                 #8 [hci1] 0.974712
      Read Local Supported Commands (0x04|0x0002) ncmd 1
        Status: Success (0x00)
        Commands: 119 entries
          Disconnect (Octet 0 - Bit 5)
          Read Remote Version Information (Octet 2 - Bit 7)
          Set Event Mask (Octet 5 - Bit 6)
          Reset (Octet 5 - Bit 7)
          Read Connection Accept Timeout (Octet 7 - Bit 2)
          Write Connection Accept Timeout (Octet 7 - Bit 3)
          Read Transmit Power Level (Octet 10 - Bit 2)
          Set Controller To Host Flow Control (Octet 10 - Bit 5)
          Host Buffer Size (Octet 10 - Bit 6)
          Host Number of Completed Packets (Octet 10 - Bit 7)
          Read Local Version Information (Octet 14 - Bit 3)
          Read Local Supported Features (Octet 14 - Bit 5)
          Read BD ADDR (Octet 15 - Bit 1)
          Read RSSI (Octet 15 - Bit 5)
          Set Event Mask Page 2 (Octet 22 - Bit 2)
          LE Set Event Mask (Octet 25 - Bit 0)
          LE Read Buffer Size (Octet 25 - Bit 1)
          LE Read Local Supported Features (Octet 25 - Bit 2)
          LE Set Random Address (Octet 25 - Bit 4)
          LE Set Advertising Parameters (Octet 25 - Bit 5)
          LE Read Advertising Channel TX Power (Octet 25 - Bit 6)
          LE Set Advertising Data (Octet 25 - Bit 7)
          LE Set Scan Response Data (Octet 26 - Bit 0)
          LE Set Advertise Enable (Octet 26 - Bit 1)
          LE Set Scan Parameters (Octet 26 - Bit 2)
          LE Set Scan Enable (Octet 26 - Bit 3)
          LE Create Connection (Octet 26 - Bit 4)
          LE Create Connection Cancel (Octet 26 - Bit 5)
          LE Read Accept List Size (Octet 26 - Bit 6)
          LE Clear Accept List (Octet 26 - Bit 7)
          LE Add Device To Accept List (Octet 27 - Bit 0)
          LE Remove Device From Accept List (Octet 27 - Bit 1)
          LE Connection Update (Octet 27 - Bit 2)
          LE Set Host Channel Classification (Octet 27 - Bit 3)
          LE Read Channel Map (Octet 27 - Bit 4)
          LE Read Remote Used Features (Octet 27 - Bit 5)
          LE Encrypt (Octet 27 - Bit 6)
          LE Rand (Octet 27 - Bit 7)
          LE Start Encryption (Octet 28 - Bit 0)
          LE Long Term Key Request Reply (Octet 28 - Bit 1)
          LE Long Term Key Request Neg Reply (Octet 28 - Bit 2)
          LE Read Supported States (Octet 28 - Bit 3)
          LE Receiver Test (Octet 28 - Bit 4)
          LE Transmitter Test (Octet 28 - Bit 5)
          LE Test End (Octet 28 - Bit 6)
          Read Authenticated Payload Timeout (Octet 32 - Bit 4)
          Write Authenticated Payload Timeout (Octet 32 - Bit 5)
          LE Set Data Length (Octet 33 - Bit 6)
          LE Read Suggested Default Data Length (Octet 33 - Bit 7)
          LE Write Suggested Default Data Length (Octet 34 - Bit 0)
          LE Add Device To Resolving List (Octet 34 - Bit 3)
          LE Remove Device From Resolving List (Octet 34 - Bit 4)
          LE Clear Resolving List (Octet 34 - Bit 5)
          LE Read Resolving List Size (Octet 34 - Bit 6)
          LE Set Address Resolution Enable (Octet 35 - Bit 1)
          LE Set Resolvable Private Address Timeout (Octet 35 - Bit 2)
          LE Read Maximum Data Length (Octet 35 - Bit 3)
          LE Read PHY (Octet 35 - Bit 4)
          LE Set Default PHY (Octet 35 - Bit 5)
          LE Set PHY (Octet 35 - Bit 6)
          LE Enhanced Receiver Test (Octet 35 - Bit 7)
          LE Enhanced Transmitter Test (Octet 36 - Bit 0)
          LE Set Advertising Set Random Address (Octet 36 - Bit 1)
          LE Set Extended Advertising Parameters (Octet 36 - Bit 2)
          LE Set Extended Advertising Data (Octet 36 - Bit 3)
          LE Set Extended Scan Response Data (Octet 36 - Bit 4)
          LE Set Extended Advertising Enable (Octet 36 - Bit 5)
          LE Read Maximum Advertising Data Length (Octet 36 - Bit 6)
          LE Read Number of Supported Advertising Sets (Octet 36 - Bit 7)
          LE Remove Advertising Set (Octet 37 - Bit 0)
          LE Clear Advertising Sets (Octet 37 - Bit 1)
          LE Set Periodic Advertising Parameters (Octet 37 - Bit 2)
          LE Set Periodic Advertising Data (Octet 37 - Bit 3)
          LE Set Periodic Advertising Enable (Octet 37 - Bit 4)
          LE Set Extended Scan Parameters (Octet 37 - Bit 5)
          LE Set Extended Scan Enable (Octet 37 - Bit 6)
          LE Extended Create Connection (Octet 37 - Bit 7)
          LE Periodic Advertising Create Sync (Octet 38 - Bit 0)
          LE Periodic Advertising Create Sync Cancel (Octet 38 - Bit 1)
          LE Periodic Advertising Terminate Sync (Octet 38 - Bit 2)
          LE Add Device To Periodic Advertiser List (Octet 38 - Bit 3)
          LE Remove Device From Periodic Advertiser List (Octet 38 - Bit 4)
          LE Clear Periodic Advertiser List (Octet 38 - Bit 5)
          LE Read Periodic Advertiser List Size (Octet 38 - Bit 6)
          LE Read Transmit Power (Octet 38 - Bit 7)
          LE Read RF Path Compensation (Octet 39 - Bit 0)
          LE Write RF Path Compensation (Octet 39 - Bit 1)
          LE Set Privacy Mode (Octet 39 - Bit 2)
          LE Periodic Advertising Receive Enable (Octet 40 - Bit 5)
          LE Periodic Advertising Sync Transfer (Octet 40 - Bit 6)
          LE Periodic Advertising Set Info Transfer (Octet 40 - Bit 7)
          LE Periodic Advertising Sync Transfer Parameters (Octet 41 - Bit 0)
          LE Set Default Periodic Advertisng Sync Transfer Parameters (Octet 41 - Bit 1)
          LE Read Buffer v2 (Octet 41 - Bit 5)
          LE Read ISO TX Sync (Octet 41 - Bit 6)
          LE Set Connected Isochronous Group Parameters (Octet 41 - Bit 7)
          LE Set Connected Isochronous Group Parameters Test (Octet 42 - Bit 0)
          LE Create Connected Isochronous Stream (Octet 42 - Bit 1)
          LE Remove Connected Isochronous Group (Octet 42 - Bit 2)
          LE Accept Connected Isochronous Stream Request (Octet 42 - Bit 3)
          LE Reject Connected Isochronous Stream Request (Octet 42 - Bit 4)
          LE Create Broadcast Isochronous Group (Octet 42 - Bit 5)
          LE Create Broadcast Isochronous Group Test (Octet 42 - Bit 6)
          LE Terminate Broadcast Isochronous Group (Octet 42 - Bit 7)
          LE Broadcast Isochronous Group Create Sync (Octet 43 - Bit 0)
          LE Broadcast Isochronous Group Terminate Sync (Octet 43 - Bit 1)
          LE Request Peer SCA (Octet 43 - Bit 2)
          LE Setup Isochronous Data Path (Octet 43 - Bit 3)
          LE Remove Isochronous Data Path (Octet 43 - Bit 4)
          LE Isochronous Transmit Test (Octet 43 - Bit 5)
          LE Isochronous Receive Test (Octet 43 - Bit 6)
          LE Isochronous Read Test Counters (Octet 43 - Bit 7)
          LE Isochronous Read Test Counters (Octet 44 - Bit 0)
          LE Set Host Feature (Octet 44 - Bit 1)
          Octet 44 - Bit 2 
          Octet 45 - Bit 6 
          Octet 46 - Bit 0 
          Octet 46 - Bit 1 
          Octet 46 - Bit 2 
< HCI Command: Host Buffer Size (0x03|0x0033) plen 7         #9 [hci1] 0.993616
        ACL MTU: 255  ACL max packet: 16
        SCO MTU: 0    SCO max packet: 0
> HCI Event: Command Complete (0x0e) plen 4                 #10 [hci1] 0.994179
      Host Buffer Size (0x03|0x0033) ncmd 1
        Status: Success (0x00)
< HCI Command: Set Controller To Ho.. (0x03|0x0031) plen 1  #11 [hci1] 1.013624
        Flow control: ACL Data Packets (0x01)
> HCI Event: Command Complete (0x0e) plen 4                 #12 [hci1] 1.014086
      Set Controller To Host Flow Control (0x03|0x0031) ncmd 1
        Status: Success (0x00)
< HCI Command: LE Read Local Suppor.. (0x08|0x0003) plen 0  #13 [hci1] 1.033645
> HCI Event: Command Complete (0x0e) plen 12                #14 [hci1] 1.034195
      LE Read Local Supported Features (0x08|0x0003) ncmd 1
        Status: Success (0x00)
        Features: 0xfd 0x79 0x00 0xf7 0x30 0x01 0x00 0x00
          LE Encryption
          Extended Reject Indication
          Peripheral-initiated Features Exchange
          LE Ping
          LE Data Packet Length Extension
          LL Privacy
          Extended Scanner Filter Policies
          LE 2M PHY
          LE Coded PHY
          LE Extended Advertising
          LE Periodic Advertising
          Channel Selection Algorithm #2
          Periodic Advertising Sync Transfer - Sender
          Periodic Advertising Sync Transfer - Recipient
          Sleep Clock Accuracy Updates
          Connected Isochronous Stream - Central
          Connected Isochronous Stream - Peripheral
          Isochronous Broadcaster
          Synchronized Receiver
          Periodic Advertising ADI support
          Connection Subrating
          Unknown features (0x0000010000000000)
< HCI Command: LE Set Host Feature (0x08|0x0074) plen 2     #15 [hci1] 1.053668
        Bit Number: 32
          Connected Isochronous Stream (Host Support)
        Bit Value: 1
> HCI Event: Command Complete (0x0e) plen 4                 #16 [hci1] 1.054132
      LE Set Host Feature (0x08|0x0074) ncmd 1
        Status: Success (0x00)
< HCI Command: LE Read Buffer v2 (0x08|0x0060) plen 0       #17 [hci1] 1.073609
> HCI Event: Command Complete (0x0e) plen 10                #18 [hci1] 1.074098
      LE Read Buffer v2 (0x08|0x0060) ncmd 1
        Status: Success (0x00)
        ACL MTU: 27
        ACL max packet: 3
        ISO MTU: 318
        ISO max packet: 3
< HCI Command: LE Read Maximum Adve.. (0x08|0x003a) plen 0  #19 [hci1] 1.093600
> HCI Event: Command Complete (0x0e) plen 6                 #20 [hci1] 1.094066
      LE Read Maximum Advertising Data Length (0x08|0x003a) ncmd 1
        Status: Success (0x00)
        Max length: 1650
< HCI Command: LE Read Supported St.. (0x08|0x001c) plen 0  #21 [hci1] 1.113626
> HCI Event: Command Complete (0x0e) plen 12                #22 [hci1] 1.114137
      LE Read Supported States (0x08|0x001c) ncmd 1
        Status: Success (0x00)
        States: 0x000003ff3e0306ff
          Non-connectable Advertising State
          Scannable Advertising State
          Connectable Advertising State
          High Duty Cycle Directed Advertising State
          Passive Scanning State
          Active Scanning State
          Initiating State
            and Connection State (Central Role)
          Connection State (Peripheral Role)
          Scannable Advertising State
            and Passive Scanning State
          Connectable Advertising State
            and Passive Scanning State
          Non-connectable Advertising State
            and Initiating State
          Scannable Advertising State
            and Initiating State
          Active Scanning State
            and Connection State (Central Role)
          Passive Scanning State
            and Connection State (Peripheral Role)
          Active Scanning State
            and Connection State (Peripheral Role)
          Initiating State
            and Connection State (Central Role)
            and Central Role & Central Role
          Low Duty Cycle Directed Advertising State
          Connectable Advertising State
            and Initiating State
            and Central Role & Peripheral Role
          High Duty Cycle Directed Advertising State
            and Initiating State
            and Central Role & Peripheral Role
          Low Duty Cycle Directed Advertising State
            and Initiating State
            and Central Role & Peripheral Role
          Connectable Advertising State
            and Connection State (Central Role)
            and Central Role & Peripheral Role
          High Duty Cycle Directed Advertising State
            and Connection State (Central Role)
            and Central Role & Peripheral Role
          Low Duty Cycle Directed Advertising State
            and Connection State (Central Role)
            and Central Role & Peripheral Role
          Connectable Advertising State
            and Connection State (Peripheral Role)
            and Central Role & Peripheral Role
          High Duty Cycle Directed Advertising State
            and Connection State (Peripheral Role)
            and Peripheral Role & Peripheral Role
          Low Duty Cycle Directed Advertising State
            and Connection State (Peripheral Role)
            and Peripheral Role & Peripheral Role
          Initiating State
            and Connection State (Peripheral Role)
            and Central Role & Peripheral Role
< HCI Command: LE Read Maximum Data.. (0x08|0x002f) plen 0  #23 [hci1] 1.133590
> HCI Event: Command Complete (0x0e) plen 12                #24 [hci1] 1.134166
      LE Read Maximum Data Length (0x08|0x002f) ncmd 1
        Status: Success (0x00)
        Max TX octets: 251
        Max TX time: 2704
        Max RX octets: 251
        Max RX time: 2704
< HCI Command: LE Write Suggested D.. (0x08|0x0024) plen 4  #25 [hci1] 1.153593
        TX octets: 251
        TX time: 2704
> HCI Event: Command Complete (0x0e) plen 4                 #26 [hci1] 1.154154
      LE Write Suggested Default Data Length (0x08|0x0024) ncmd 1
        Status: Success (0x00)
< HCI Command: LE Read Resolving Li.. (0x08|0x002a) plen 0  #27 [hci1] 1.173641
> HCI Event: Command Complete (0x0e) plen 5                 #28 [hci1] 1.174125
      LE Read Resolving List Size (0x08|0x002a) ncmd 1
        Status: Success (0x00)
        Size: 8
< HCI Command: LE Set Event Mask (0x08|0x0001) plen 8       #29 [hci1] 1.193631
        Mask: 0x000002023f87fa5e
          LE Advertising Report
          LE Connection Update Complete
          LE Read Remote Used Features Complete
          LE Long Term Key Request
          LE Data Length Change
          LE Enhanced Connection Complete
          LE PHY Update Complete
          LE Extended Advertising Report
          LE Periodic Advertising Sync Established
          LE Periodic Advertising Report
          LE Periodic Advertising Sync Lost
          LE Extended Scan Timeout
          LE Extended Advertising Set Terminated
          LE Scan Request Received
          LE Periodic Advertising Sync Transfer Rvc
          LE CIS Established
          LE CIS Request
          LE Create BIG Complete
          LE Terminate BIG Complete
          LE BIG Sync Estabilished Complete
          LE BIG Sync Lost
          LE BIG Info Advertising Report
          Unknown mask (0x0000020000000000)
> HCI Event: Command Complete (0x0e) plen 4                 #30 [hci1] 1.194184
      LE Set Event Mask (0x08|0x0001) ncmd 1
        Status: Success (0x00)
< HCI Command: Set Event Mask (0x03|0x0001) plen 8          #31 [hci1] 1.213624
        Mask: 0x2000800002008890
          Disconnection Complete
          Encryption Change
          Read Remote Version Information Complete
          Hardware Error
          Data Buffer Overflow
          Encryption Key Refresh Complete
          LE Meta
> HCI Event: Command Complete (0x0e) plen 4                 #32 [hci1] 1.214257
      Set Event Mask (0x03|0x0001) ncmd 1
        Status: Success (0x00)
< HCI Command: Read BD ADDR (0x04|0x0009) plen 0            #33 [hci1] 1.233627
> HCI Event: Command Complete (0x0e) plen 10                #34 [hci1] 1.234153
      Read BD ADDR (0x04|0x0009) ncmd 1
        Status: Success (0x00)
        Address: 00:00:00:00:00:00 (OUI 00-00-00)
< HCI Command: LE Set Random Address (0x08|0x0005) plen 6   #35 [hci1] 1.253638
        Address: D5:B6:CC:31:DB:3B (Static)
> HCI Event: Command Complete (0x0e) plen 4                 #36 [hci1] 1.254136
      LE Set Random Address (0x08|0x0005) ncmd 1
        Status: Success (0x00)
< HCI Command: LE Extended Create... (0x08|0x0043) plen 26  #37 [hci1] 4.464079
        Filter policy: Accept list is not used (0x00)
        Own address type: Random (0x01)
        Peer address type: Public (0x00)
        Peer address: DF:A9:FF:F6:B1:1A (OUI DF-A9-FF)
        Initiating PHYs: 0x01
        Entry 0: LE 1M
          Scan interval: 60.000 msec (0x0060)
          Scan window: 60.000 msec (0x0060)
          Min connection interval: 30.00 msec (0x0018)
          Max connection interval: 50.00 msec (0x0028)
          Connection latency: 0 (0x0000)
          Supervision timeout: 4000 msec (0x0190)
          Min connection length: 0.000 msec (0x0000)
          Max connection length: 0.000 msec (0x0000)
> HCI Event: Command Status (0x0f) plen 4                   #38 [hci1] 4.465133
      LE Extended Create Connection (0x08|0x0043) ncmd 1
        Status: Success (0x00)
> HCI Event: LE Meta Event (0x3e) plen 31                   #39 [hci1] 4.508737
      LE Enhanced Connection Complete (0x0a)
        Status: Success (0x00)
        Handle: 1062
        Role: Central (0x00)
        Peer address type: Public (0x00)
        Peer address: DF:A9:FF:F6:B1:1A (OUI DF-A9-FF)
        Local resolvable private address: 00:00:00:00:00:00 (Non-Resolvable)
        Peer resolvable private address: 00:00:00:00:00:00 (Non-Resolvable)
        Connection interval: 50.00 msec (0x0028)
        Connection latency: 0 (0x0000)
        Supervision timeout: 4000 msec (0x0190)
        Central clock accuracy: 0x00
< HCI Command: LE Read Remote Used... (0x08|0x0016) plen 2  #40 [hci1] 4.513932
        Handle: 1062 Address: DF:A9:FF:F6:B1:1A (OUI DF-A9-FF)
> HCI Event: Command Status (0x0f) plen 4                   #41 [hci1] 4.514343
      LE Read Remote Used Features (0x08|0x0016) ncmd 1
        Status: Success (0x00)
< HCI Command: LE Set PHY (0x08|0x0032) plen 7              #42 [hci1] 4.533656
        Handle: 1062 Address: DF:A9:FF:F6:B1:1A (OUI DF-A9-FF)
        All PHYs preference: 0x00
        TX PHYs preference: 0x02
          LE 2M
        RX PHYs preference: 0x02
          LE 2M
        PHY options preference: Reserved (0x0000)
> HCI Event: Command Status (0x0f) plen 4                   #43 [hci1] 4.534289
      LE Set PHY (0x08|0x0032) ncmd 1
        Status: Success (0x00)
> HCI Event: LE Meta Event (0x3e) plen 12                   #44 [hci1] 4.660084
      LE Read Remote Used Features (0x04)
        Status: Success (0x00)
        Handle: 1062 Address: DF:A9:FF:F6:B1:1A (OUI DF-A9-FF)
        Features: 0x2d 0x49 0x00 0xf7 0x67 0xd9 0x00 0x80
          LE Encryption
          Extended Reject Indication
          Peripheral-initiated Features Exchange
          LE Data Packet Length Extension
          LE 2M PHY
          LE Coded PHY
          Channel Selection Algorithm #2
          Periodic Advertising Sync Transfer - Sender
          Periodic Advertising Sync Transfer - Recipient
          Sleep Clock Accuracy Updates
          Connected Isochronous Stream - Central
          Connected Isochronous Stream - Peripheral
          Isochronous Broadcaster
          Synchronized Receiver
          Connected Isochronous Stream (Host Support)
          LE Power Control Request
          LE Power Control Request
          Connection Subrating
          Connection Subrating (Host Support)
          Unknown features (0x8000d90000000000)
> HCI Event: LE Meta Event (0x3e) plen 6                    #45 [hci1] 5.159485
      LE PHY Update Complete (0x0c)
        Status: Success (0x00)
        Handle: 1062 Address: DF:A9:FF:F6:B1:1A (OUI DF-A9-FF)
        TX PHY: LE 2M (0x02)
        RX PHY: LE 2M (0x02)
< ACL Data TX: Handle 1062 flags 0x00 dlen 11               #46 [hci1] 5.613817
      SMP: Pairing Request (0x01) len 6
        IO capability: NoInputNoOutput (0x03)
        OOB data: Authentication data from remote device present (0x01)
        Authentication requirement: Bonding, No MITM, SC, No Keypresses (0x09)
        Max encryption key size: 16
        Initiator key distribution: EncKey (0x01)
        Responder key distribution: EncKey IdKey (0x03)
> HCI Event: Number of Completed Packets (0x13) plen 5      #47 [hci1] 5.659942
        Num handles: 1
        Handle: 1062 Address: DF:A9:FF:F6:B1:1A (OUI DF-A9-FF)
        Count: 1
        #46: len 11 (1 Kb/s)
        Latency: 46 msec (46-46 msec ~46 msec)
> ACL Data RX: Handle 1062 flags 0x02 dlen 11               #48 [hci1] 5.709957
      SMP: Pairing Response (0x02) len 6
        IO capability: KeyboardOnly (0x02)
        OOB data: Authentication data from remote device present (0x01)
        Authentication requirement: No bonding, MITM, Legacy, No Keypresses (0x04)
        Max encryption key size: 16
        Initiator key distribution: <none> (0x00)
        Responder key distribution: <none> (0x00)
< HCI Command: Host Number of Compl.. (0x03|0x0035) plen 5  #49 [hci1] 5.713977
        Num handles: 1
        Handle: 1062 Address: DF:A9:FF:F6:B1:1A (OUI DF-A9-FF)
        Count: 1
< ACL Data TX: Handle 1062 flags 0x00 dlen 21               #50 [hci1] 5.714024
      SMP: Pairing Confirm (0x03) len 16
        Confim value: fb0807eddcc0289c3b72d8e4c6241084
> HCI Event: Number of Completed Packets (0x13) plen 5      #51 [hci1] 5.760001
        Num handles: 1
        Handle: 1062 Address: DF:A9:FF:F6:B1:1A (OUI DF-A9-FF)
        Count: 1
        #50: len 21 (3 Kb/s)
        Latency: 45 msec (45-46 msec ~46 msec)
> ACL Data RX: Handle 1062 flags 0x02 dlen 21               #52 [hci1] 5.810072
      SMP: Pairing Confirm (0x03) len 16
        Confim value: cbe7a60d16be086079d8e2b94e86c9bf
< HCI Command: Host Number of Compl.. (0x03|0x0035) plen 5  #53 [hci1] 5.813914
        Num handles: 1
        Handle: 1062 Address: DF:A9:FF:F6:B1:1A (OUI DF-A9-FF)
        Count: 1
< ACL Data TX: Handle 1062 flags 0x00 dlen 21               #54 [hci1] 5.813962
      SMP: Pairing Random (0x04) len 16
        Random value: 8e6108f966a694cbe26df70bb96773e6
> HCI Event: Number of Completed Packets (0x13) plen 5      #55 [hci1] 5.859968
        Num handles: 1
        Handle: 1062 Address: DF:A9:FF:F6:B1:1A (OUI DF-A9-FF)
        Count: 1
        #54: len 21 (3 Kb/s)
        Latency: 46 msec (45-46 msec ~46 msec)
> ACL Data RX: Handle 1062 flags 0x02 dlen 21               #56 [hci1] 6.110067
      SMP: Pairing Random (0x04) len 16
        Random value: a2f0fb4979f666a562d8765ec299396a
< HCI Command: LE Start Encryption (0x08|0x0019) plen 28    #57 [hci1] 6.114549
        Handle: 1062 Address: DF:A9:FF:F6:B1:1A (OUI DF-A9-FF)
        Random number: 0x0000000000000000
        Encrypted diversifier: 0x0000
        Long term key: 8b8fcf1b6159dd6acbd44cc0570f110b
> HCI Event: Command Status (0x0f) plen 4                   #58 [hci1] 6.115485
      LE Start Encryption (0x08|0x0019) ncmd 1
        Status: Success (0x00)
< HCI Command: Host Number of Compl.. (0x03|0x0035) plen 5  #59 [hci1] 6.133681
        Num handles: 1
        Handle: 1062 Address: DF:A9:FF:F6:B1:1A (OUI DF-A9-FF)
        Count: 1
> HCI Event: Encryption Change (0x08) plen 4                #60 [hci1] 6.459891
        Status: Success (0x00)
        Handle: 1062 Address: DF:A9:FF:F6:B1:1A (OUI DF-A9-FF)
        Encryption: Enabled with AES-CCM (0x01)
< HCI Command: Disconnect (0x01|0x0006) plen 3              #61 [hci1] 6.664101
        Handle: 1062 Address: DF:A9:FF:F6:B1:1A (OUI DF-A9-FF)
        Reason: Remote User Terminated Connection (0x13)
> HCI Event: Command Status (0x0f) plen 4                   #62 [hci1] 6.664638
      Disconnect (0x01|0x0006) ncmd 1
        Status: Success (0x00)
> HCI Event: Disconnect Complete (0x05) plen 4              #63 [hci1] 6.759845
        Status: Success (0x00)
        Handle: 1062 Address: DF:A9:FF:F6:B1:1A (OUI DF-A9-FF)
        Reason: Connection Terminated By Local Host (0x16)
< HCI Command: LE Extended Create... (0x08|0x0043) plen 26  #64 [hci1] 9.824166
        Filter policy: Accept list is not used (0x00)
        Own address type: Random (0x01)
        Peer address type: Public (0x00)
        Peer address: DF:A9:FF:F6:B1:1A (OUI DF-A9-FF)
        Initiating PHYs: 0x01
        Entry 0: LE 1M
          Scan interval: 60.000 msec (0x0060)
          Scan window: 60.000 msec (0x0060)
          Min connection interval: 30.00 msec (0x0018)
          Max connection interval: 50.00 msec (0x0028)
          Connection latency: 0 (0x0000)
          Supervision timeout: 4000 msec (0x0190)
          Min connection length: 0.000 msec (0x0000)
          Max connection length: 0.000 msec (0x0000)
> HCI Event: Command Status (0x0f) plen 4                   #65 [hci1] 9.825168
      LE Extended Create Connection (0x08|0x0043) ncmd 1
        Status: Success (0x00)
> HCI Event: LE Meta Event (0x3e) plen 31                   #66 [hci1] 9.876047
      LE Enhanced Connection Complete (0x0a)
        Status: Success (0x00)
        Handle: 1080
        Role: Central (0x00)
        Peer address type: Public (0x00)
        Peer address: DF:A9:FF:F6:B1:1A (OUI DF-A9-FF)
        Local resolvable private address: 00:00:00:00:00:00 (Non-Resolvable)
        Peer resolvable private address: 00:00:00:00:00:00 (Non-Resolvable)
        Connection interval: 50.00 msec (0x0028)
        Connection latency: 0 (0x0000)
        Supervision timeout: 4000 msec (0x0190)
        Central clock accuracy: 0x00
< HCI Command: LE Read Remote Used... (0x08|0x0016) plen 2  #67 [hci1] 9.894046
        Handle: 1080 Address: DF:A9:FF:F6:B1:1A (OUI DF-A9-FF)
> HCI Event: Command Status (0x0f) plen 4                   #68 [hci1] 9.894653
      LE Read Remote Used Features (0x08|0x0016) ncmd 1
        Status: Success (0x00)
< HCI Command: LE Set PHY (0x08|0x0032) plen 7              #69 [hci1] 9.914161
        Handle: 1080 Address: DF:A9:FF:F6:B1:1A (OUI DF-A9-FF)
        All PHYs preference: 0x00
        TX PHYs preference: 0x02
          LE 2M
        RX PHYs preference: 0x02
          LE 2M
        PHY options preference: Reserved (0x0000)
> HCI Event: Command Status (0x0f) plen 4                   #70 [hci1] 9.914779
      LE Set PHY (0x08|0x0032) ncmd 1
        Status: Success (0x00)
> HCI Event: LE Meta Event (0x3e) plen 12                  #71 [hci1] 10.027584
      LE Read Remote Used Features (0x04)
        Status: Success (0x00)
        Handle: 1080 Address: DF:A9:FF:F6:B1:1A (OUI DF-A9-FF)
        Features: 0x2d 0x49 0x00 0xf7 0x67 0xd9 0x00 0x80
          LE Encryption
          Extended Reject Indication
          Peripheral-initiated Features Exchange
          LE Data Packet Length Extension
          LE 2M PHY
          LE Coded PHY
          Channel Selection Algorithm #2
          Periodic Advertising Sync Transfer - Sender
          Periodic Advertising Sync Transfer - Recipient
          Sleep Clock Accuracy Updates
          Connected Isochronous Stream - Central
          Connected Isochronous Stream - Peripheral
          Isochronous Broadcaster
          Synchronized Receiver
          Connected Isochronous Stream (Host Support)
          LE Power Control Request
          LE Power Control Request
          Connection Subrating
          Connection Subrating (Host Support)
          Unknown features (0x8000d90000000000)
> HCI Event: LE Meta Event (0x3e) plen 6                   #72 [hci1] 10.526859
      LE PHY Update Complete (0x0c)
        Status: Success (0x00)
        Handle: 1080 Address: DF:A9:FF:F6:B1:1A (OUI DF-A9-FF)
        TX PHY: LE 2M (0x02)
        RX PHY: LE 2M (0x02)
< ACL Data TX: Handle 1080 flags 0x00 dlen 11              #73 [hci1] 10.954414
      SMP: Pairing Request (0x01) len 6
        IO capability: NoInputNoOutput (0x03)
        OOB data: Authentication data from remote device present (0x01)
        Authentication requirement: Bonding, No MITM, SC, No Keypresses (0x09)
        Max encryption key size: 16
        Initiator key distribution: EncKey (0x01)
        Responder key distribution: EncKey IdKey (0x03)
> HCI Event: Number of Completed Packets (0x13) plen 5     #74 [hci1] 10.977210
        Num handles: 1
        Handle: 1080 Address: DF:A9:FF:F6:B1:1A (OUI DF-A9-FF)
        Count: 1
        #73: len 11 (4 Kb/s)
        Latency: 22 msec (22-22 msec ~22 msec)
> ACL Data RX: Handle 1080 flags 0x02 dlen 11              #75 [hci1] 11.027461
      SMP: Pairing Response (0x02) len 6
        IO capability: KeyboardOnly (0x02)
        OOB data: Authentication data from remote device present (0x01)
        Authentication requirement: No bonding, MITM, Legacy, No Keypresses (0x04)
        Max encryption key size: 16
        Initiator key distribution: <none> (0x00)
        Responder key distribution: <none> (0x00)
< HCI Command: Host Number of Comp.. (0x03|0x0035) plen 5  #76 [hci1] 11.033792
        Num handles: 1
        Handle: 1080 Address: DF:A9:FF:F6:B1:1A (OUI DF-A9-FF)
        Count: 1
< ACL Data TX: Handle 1080 flags 0x00 dlen 21              #77 [hci1] 11.033829
      SMP: Pairing Confirm (0x03) len 16
        Confim value: 87242c598efded2a52e36b6b3dbe834f
> HCI Event: Number of Completed Packets (0x13) plen 5     #78 [hci1] 11.077400
        Num handles: 1
        Handle: 1080 Address: DF:A9:FF:F6:B1:1A (OUI DF-A9-FF)
        Count: 1
        #77: len 21 (3 Kb/s)
        Latency: 43 msec (22-43 msec ~33 msec)
> ACL Data RX: Handle 1080 flags 0x02 dlen 21              #79 [hci1] 11.127653
      SMP: Pairing Confirm (0x03) len 16
        Confim value: c092a0fc30f0c71858cf3153d4574241
< HCI Command: Host Number of Comp.. (0x03|0x0035) plen 5  #80 [hci1] 11.134071
        Num handles: 1
        Handle: 1080 Address: DF:A9:FF:F6:B1:1A (OUI DF-A9-FF)
        Count: 1
< ACL Data TX: Handle 1080 flags 0x00 dlen 21              #81 [hci1] 11.134247
      SMP: Pairing Random (0x04) len 16
        Random value: 5da095555cc64d02679f89a05211af56
> HCI Event: Number of Completed Packets (0x13) plen 5     #82 [hci1] 11.177327
        Num handles: 1
        Handle: 1080 Address: DF:A9:FF:F6:B1:1A (OUI DF-A9-FF)
        Count: 1
        #81: len 21 (3 Kb/s)
        Latency: 43 msec (22-43 msec ~38 msec)
> ACL Data RX: Handle 1080 flags 0x02 dlen 21              #83 [hci1] 11.427677
      SMP: Pairing Random (0x04) len 16
        Random value: 58a3b052bc42de8c898f1bc671ca0cc3
< HCI Command: LE Start Encryption (0x08|0x0019) plen 28   #84 [hci1] 11.434452
        Handle: 1080 Address: DF:A9:FF:F6:B1:1A (OUI DF-A9-FF)
        Random number: 0x0000000000000000
        Encrypted diversifier: 0x0000
        Long term key: 3b92df6d3cd4134e643775719228ddb1
> HCI Event: Command Status (0x0f) plen 4                  #85 [hci1] 11.435433
      LE Start Encryption (0x08|0x0019) ncmd 1
        Status: Success (0x00)
< HCI Command: Host Number of Comp.. (0x03|0x0035) plen 5  #86 [hci1] 11.454013
        Num handles: 1
        Handle: 1080 Address: DF:A9:FF:F6:B1:1A (OUI DF-A9-FF)
        Count: 1
> HCI Event: Encryption Change (0x08) plen 4               #87 [hci1] 11.777242
        Status: Success (0x00)
        Handle: 1080 Address: DF:A9:FF:F6:B1:1A (OUI DF-A9-FF)
        Encryption: Enabled with AES-CCM (0x01)
< HCI Command: Disconnect (0x01|0x0006) plen 3             #88 [hci1] 11.963721
        Handle: 1080 Address: DF:A9:FF:F6:B1:1A (OUI DF-A9-FF)
        Reason: Remote User Terminated Connection (0x13)
> HCI Event: Command Status (0x0f) plen 4                  #89 [hci1] 11.964258
      Disconnect (0x01|0x0006) ncmd 1
        Status: Success (0x00)
> HCI Event: Disconnect Complete (0x05) plen 4             #90 [hci1] 12.027276
        Status: Success (0x00)
        Handle: 1080 Address: DF:A9:FF:F6:B1:1A (OUI DF-A9-FF)
        Reason: Connection Terminated By Local Host (0x16)
< HCI Command: LE Extended Create.. (0x08|0x0043) plen 26  #91 [hci1] 15.134187
        Filter policy: Accept list is not used (0x00)
        Own address type: Random (0x01)
        Peer address type: Public (0x00)
        Peer address: DF:A9:FF:F6:B1:1A (OUI DF-A9-FF)
        Initiating PHYs: 0x01
        Entry 0: LE 1M
          Scan interval: 60.000 msec (0x0060)
          Scan window: 60.000 msec (0x0060)
          Min connection interval: 30.00 msec (0x0018)
          Max connection interval: 50.00 msec (0x0028)
          Connection latency: 0 (0x0000)
          Supervision timeout: 4000 msec (0x0190)
          Min connection length: 0.000 msec (0x0000)
          Max connection length: 0.000 msec (0x0000)
> HCI Event: Command Status (0x0f) plen 4                  #92 [hci1] 15.135151
      LE Extended Create Connection (0x08|0x0043) ncmd 1
        Status: Success (0x00)
> HCI Event: LE Meta Event (0x3e) plen 31                  #93 [hci1] 15.150291
      LE Enhanced Connection Complete (0x0a)
        Status: Success (0x00)
        Handle: 1098
        Role: Central (0x00)
        Peer address type: Public (0x00)
        Peer address: DF:A9:FF:F6:B1:1A (OUI DF-A9-FF)
        Local resolvable private address: 00:00:00:00:00:00 (Non-Resolvable)
        Peer resolvable private address: 00:00:00:00:00:00 (Non-Resolvable)
        Connection interval: 50.00 msec (0x0028)
        Connection latency: 0 (0x0000)
        Supervision timeout: 4000 msec (0x0190)
        Central clock accuracy: 0x00
< HCI Command: LE Read Remote Used.. (0x08|0x0016) plen 2  #94 [hci1] 15.154384
        Handle: 1098 Address: DF:A9:FF:F6:B1:1A (OUI DF-A9-FF)
> HCI Event: Command Status (0x0f) plen 4                  #95 [hci1] 15.154913
      LE Read Remote Used Features (0x08|0x0016) ncmd 1
        Status: Success (0x00)
< HCI Command: LE Set PHY (0x08|0x0032) plen 7             #96 [hci1] 15.173761
        Handle: 1098 Address: DF:A9:FF:F6:B1:1A (OUI DF-A9-FF)
        All PHYs preference: 0x00
        TX PHYs preference: 0x02
          LE 2M
        RX PHYs preference: 0x02
          LE 2M
        PHY options preference: Reserved (0x0000)
> HCI Event: Command Status (0x0f) plen 4                  #97 [hci1] 15.174297
      LE Set PHY (0x08|0x0032) ncmd 1
        Status: Success (0x00)
> HCI Event: LE Meta Event (0x3e) plen 12                  #98 [hci1] 15.301776
      LE Read Remote Used Features (0x04)
        Status: Success (0x00)
        Handle: 1098 Address: DF:A9:FF:F6:B1:1A (OUI DF-A9-FF)
        Features: 0x2d 0x49 0x00 0xf7 0x67 0xd9 0x00 0x80
          LE Encryption
          Extended Reject Indication
          Peripheral-initiated Features Exchange
          LE Data Packet Length Extension
          LE 2M PHY
          LE Coded PHY
          Channel Selection Algorithm #2
          Periodic Advertising Sync Transfer - Sender
          Periodic Advertising Sync Transfer - Recipient
          Sleep Clock Accuracy Updates
          Connected Isochronous Stream - Central
          Connected Isochronous Stream - Peripheral
          Isochronous Broadcaster
          Synchronized Receiver
          Connected Isochronous Stream (Host Support)
          LE Power Control Request
          LE Power Control Request
          Connection Subrating
          Connection Subrating (Host Support)
          Unknown features (0x8000d90000000000)
> HCI Event: LE Meta Event (0x3e) plen 6                   #99 [hci1] 15.801185
      LE PHY Update Complete (0x0c)
        Status: Success (0x00)
        Handle: 1098 Address: DF:A9:FF:F6:B1:1A (OUI DF-A9-FF)
        TX PHY: LE 2M (0x02)
        RX PHY: LE 2M (0x02)
< ACL Data TX: Handle 1098 flags 0x00 dlen 11             #100 [hci1] 16.183809
      SMP: Pairing Request (0x01) len 6
        IO capability: NoInputNoOutput (0x03)
        OOB data: Authentication data from remote device present (0x01)
        Authentication requirement: Bonding, No MITM, SC, No Keypresses (0x09)
        Max encryption key size: 16
        Initiator key distribution: EncKey (0x01)
        Responder key distribution: EncKey IdKey (0x03)
> HCI Event: Number of Completed Packets (0x13) plen 5    #101 [hci1] 16.201567
        Num handles: 1
        Handle: 1098 Address: DF:A9:FF:F6:B1:1A (OUI DF-A9-FF)
        Count: 1
        #100: len 11 (5 Kb/s)
        Latency: 17 msec (17-17 msec ~17 msec)
> ACL Data RX: Handle 1098 flags 0x02 dlen 11             #102 [hci1] 16.251630
      SMP: Pairing Response (0x02) len 6
        IO capability: KeyboardOnly (0x02)
        OOB data: Authentication data from remote device present (0x01)
        Authentication requirement: No bonding, MITM, Legacy, No Keypresses (0x04)
        Max encryption key size: 16
        Initiator key distribution: <none> (0x00)
        Responder key distribution: <none> (0x00)
< HCI Command: Host Number of Com.. (0x03|0x0035) plen 5  #103 [hci1] 16.253889
        Num handles: 1
        Handle: 1098 Address: DF:A9:FF:F6:B1:1A (OUI DF-A9-FF)
        Count: 1
< ACL Data TX: Handle 1098 flags 0x00 dlen 21             #104 [hci1] 16.253971
      SMP: Pairing Confirm (0x03) len 16
        Confim value: 6c928c7564364eeed0244da8e62b60f6
> HCI Event: Number of Completed Packets (0x13) plen 5    #105 [hci1] 16.301678
        Num handles: 1
        Handle: 1098 Address: DF:A9:FF:F6:B1:1A (OUI DF-A9-FF)
        Count: 1
        #104: len 21 (3 Kb/s)
        Latency: 47 msec (17-47 msec ~32 msec)
> ACL Data RX: Handle 1098 flags 0x02 dlen 21             #106 [hci1] 16.351813
      SMP: Pairing Confirm (0x03) len 16
        Confim value: b226b8715b50246cb21dc61a7f1be02b
< HCI Command: Host Number of Com.. (0x03|0x0035) plen 5  #107 [hci1] 16.354184
        Num handles: 1
        Handle: 1098 Address: DF:A9:FF:F6:B1:1A (OUI DF-A9-FF)
        Count: 1
< ACL Data TX: Handle 1098 flags 0x00 dlen 21             #108 [hci1] 16.354300
      SMP: Pairing Random (0x04) len 16
        Random value: da64d21ec8845e8286bc235a02440d0c
> HCI Event: Number of Completed Packets (0x13) plen 5    #109 [hci1] 16.401688
        Num handles: 1
        Handle: 1098 Address: DF:A9:FF:F6:B1:1A (OUI DF-A9-FF)
        Count: 1
        #108: len 21 (3 Kb/s)
        Latency: 47 msec (17-47 msec ~40 msec)
> ACL Data RX: Handle 1098 flags 0x02 dlen 21             #110 [hci1] 16.651859
      SMP: Pairing Random (0x04) len 16
        Random value: 117e82997ddd4c39667ef90237b8d082
< HCI Command: LE Start Encryption (0x08|0x0019) plen 28  #111 [hci1] 16.653869
        Handle: 1098 Address: DF:A9:FF:F6:B1:1A (OUI DF-A9-FF)
        Random number: 0x0000000000000000
        Encrypted diversifier: 0x0000
        Long term key: c4555771509890fa3e253a39e9e9349f
> HCI Event: Command Status (0x0f) plen 4                 #112 [hci1] 16.654801
      LE Start Encryption (0x08|0x0019) ncmd 1
        Status: Success (0x00)
< HCI Command: Host Number of Com.. (0x03|0x0035) plen 5  #113 [hci1] 16.673832
        Num handles: 1
        Handle: 1098 Address: DF:A9:FF:F6:B1:1A (OUI DF-A9-FF)
        Count: 1
> HCI Event: Encryption Change (0x08) plen 4              #114 [hci1] 17.001526
        Status: Success (0x00)
        Handle: 1098 Address: DF:A9:FF:F6:B1:1A (OUI DF-A9-FF)
        Encryption: Enabled with AES-CCM (0x01)
< HCI Command: Disconnect (0x01|0x0006) plen 3            #115 [hci1] 17.214105
        Handle: 1098 Address: DF:A9:FF:F6:B1:1A (OUI DF-A9-FF)
        Reason: Remote User Terminated Connection (0x13)
> HCI Event: Command Status (0x0f) plen 4                 #116 [hci1] 17.214859
      Disconnect (0x01|0x0006) ncmd 1
        Status: Success (0x00)
> HCI Event: Disconnect Complete (0x05) plen 4            #117 [hci1] 17.301510
        Status: Success (0x00)
        Handle: 1098 Address: DF:A9:FF:F6:B1:1A (OUI DF-A9-FF)
        Reason: Connection Terminated By Local Host (0x16)
< HCI Command: LE Extended Creat.. (0x08|0x0043) plen 26  #118 [hci1] 20.374307
        Filter policy: Accept list is not used (0x00)
        Own address type: Random (0x01)
        Peer address type: Public (0x00)
        Peer address: DF:A9:FF:F6:B1:1A (OUI DF-A9-FF)
        Initiating PHYs: 0x01
        Entry 0: LE 1M
          Scan interval: 60.000 msec (0x0060)
          Scan window: 60.000 msec (0x0060)
          Min connection interval: 30.00 msec (0x0018)
          Max connection interval: 50.00 msec (0x0028)
          Connection latency: 0 (0x0000)
          Supervision timeout: 4000 msec (0x0190)
          Min connection length: 0.000 msec (0x0000)
          Max connection length: 0.000 msec (0x0000)
> HCI Event: Command Status (0x0f) plen 4                 #119 [hci1] 20.375316
      LE Extended Create Connection (0x08|0x0043) ncmd 1
        Status: Success (0x00)
> HCI Event: LE Meta Event (0x3e) plen 31                 #120 [hci1] 20.385843
      LE Enhanced Connection Complete (0x0a)
        Status: Success (0x00)
        Handle: 1116
        Role: Central (0x00)
        Peer address type: Public (0x00)
        Peer address: DF:A9:FF:F6:B1:1A (OUI DF-A9-FF)
        Local resolvable private address: 00:00:00:00:00:00 (Non-Resolvable)
        Peer resolvable private address: 00:00:00:00:00:00 (Non-Resolvable)
        Connection interval: 50.00 msec (0x0028)
        Connection latency: 0 (0x0000)
        Supervision timeout: 4000 msec (0x0190)
        Central clock accuracy: 0x00
< HCI Command: LE Read Remote Use.. (0x08|0x0016) plen 2  #121 [hci1] 20.394136
        Handle: 1116 Address: DF:A9:FF:F6:B1:1A (OUI DF-A9-FF)
> HCI Event: Command Status (0x0f) plen 4                 #122 [hci1] 20.394639
      LE Read Remote Used Features (0x08|0x0016) ncmd 1
        Status: Success (0x00)
< HCI Command: LE Set PHY (0x08|0x0032) plen 7            #123 [hci1] 20.413753
        Handle: 1116 Address: DF:A9:FF:F6:B1:1A (OUI DF-A9-FF)
        All PHYs preference: 0x00
        TX PHYs preference: 0x02
          LE 2M
        RX PHYs preference: 0x02
          LE 2M
        PHY options preference: Reserved (0x0000)
> HCI Event: Command Status (0x0f) plen 4                 #124 [hci1] 20.414357
      LE Set PHY (0x08|0x0032) ncmd 1
        Status: Success (0x00)
> HCI Event: LE Meta Event (0x3e) plen 12                 #125 [hci1] 20.537415
      LE Read Remote Used Features (0x04)
        Status: Success (0x00)
        Handle: 1116 Address: DF:A9:FF:F6:B1:1A (OUI DF-A9-FF)
        Features: 0x2d 0x49 0x00 0xf7 0x67 0xd9 0x00 0x80
          LE Encryption
          Extended Reject Indication
          Peripheral-initiated Features Exchange
          LE Data Packet Length Extension
          LE 2M PHY
          LE Coded PHY
          Channel Selection Algorithm #2
          Periodic Advertising Sync Transfer - Sender
          Periodic Advertising Sync Transfer - Recipient
          Sleep Clock Accuracy Updates
          Connected Isochronous Stream - Central
          Connected Isochronous Stream - Peripheral
          Isochronous Broadcaster
          Synchronized Receiver
          Connected Isochronous Stream (Host Support)
          LE Power Control Request
          LE Power Control Request
          Connection Subrating
          Connection Subrating (Host Support)
          Unknown features (0x8000d90000000000)
> HCI Event: LE Meta Event (0x3e) plen 6                  #126 [hci1] 21.036817
      LE PHY Update Complete (0x0c)
        Status: Success (0x00)
        Handle: 1116 Address: DF:A9:FF:F6:B1:1A (OUI DF-A9-FF)
        TX PHY: LE 2M (0x02)
        RX PHY: LE 2M (0x02)
< ACL Data TX: Handle 1116 flags 0x00 dlen 11             #127 [hci1] 21.544366
      SMP: Pairing Request (0x01) len 6
        IO capability: NoInputNoOutput (0x03)
        OOB data: Authentication data from remote device present (0x01)
        Authentication requirement: Bonding, No MITM, SC, No Keypresses (0x09)
        Max encryption key size: 16
        Initiator key distribution: EncKey (0x01)
        Responder key distribution: EncKey IdKey (0x03)
> HCI Event: Number of Completed Packets (0x13) plen 5    #128 [hci1] 21.587130
        Num handles: 1
        Handle: 1116 Address: DF:A9:FF:F6:B1:1A (OUI DF-A9-FF)
        Count: 1
        #127: len 11 (2 Kb/s)
        Latency: 42 msec (42-42 msec ~42 msec)
> ACL Data RX: Handle 1116 flags 0x02 dlen 11             #129 [hci1] 21.637316
      SMP: Pairing Response (0x02) len 6
        IO capability: KeyboardOnly (0x02)
        OOB data: Authentication data from remote device present (0x01)
        Authentication requirement: No bonding, MITM, Legacy, No Keypresses (0x04)
        Max encryption key size: 16
        Initiator key distribution: <none> (0x00)
        Responder key distribution: <none> (0x00)
< HCI Command: Host Number of Com.. (0x03|0x0035) plen 5  #130 [hci1] 21.654369
        Num handles: 1
        Handle: 1116 Address: DF:A9:FF:F6:B1:1A (OUI DF-A9-FF)
        Count: 1
< ACL Data TX: Handle 1116 flags 0x00 dlen 21             #131 [hci1] 21.654493
      SMP: Pairing Confirm (0x03) len 16
        Confim value: 4b04db53c7100ec33bd86f896c70331e
> HCI Event: Number of Completed Packets (0x13) plen 5    #132 [hci1] 21.687326
        Num handles: 1
        Handle: 1116 Address: DF:A9:FF:F6:B1:1A (OUI DF-A9-FF)
        Count: 1
        #131: len 21 (5 Kb/s)
        Latency: 32 msec (32-42 msec ~37 msec)
> ACL Data RX: Handle 1116 flags 0x02 dlen 21             #133 [hci1] 21.737335
      SMP: Pairing Confirm (0x03) len 16
        Confim value: ce4c7699937c0bf8dca6e4fcd6166ea3
< HCI Command: Host Number of Com.. (0x03|0x0035) plen 5  #134 [hci1] 21.753898
        Num handles: 1
        Handle: 1116 Address: DF:A9:FF:F6:B1:1A (OUI DF-A9-FF)
        Count: 1
< ACL Data TX: Handle 1116 flags 0x00 dlen 21             #135 [hci1] 21.753930
      SMP: Pairing Random (0x04) len 16
        Random value: a2acf8fd71a45c4a1bcadd27bd58e945
> HCI Event: Number of Completed Packets (0x13) plen 5    #136 [hci1] 21.787140
        Num handles: 1
        Handle: 1116 Address: DF:A9:FF:F6:B1:1A (OUI DF-A9-FF)
        Count: 1
        #135: len 21 (5 Kb/s)
        Latency: 33 msec (32-42 msec ~35 msec)
> ACL Data RX: Handle 1116 flags 0x02 dlen 21             #137 [hci1] 22.037302
      SMP: Pairing Random (0x04) len 16
        Random value: 25804d6efc226c5cc4d030f8cd954f54
< HCI Command: LE Start Encryption (0x08|0x0019) plen 28  #138 [hci1] 22.054384
        Handle: 1116 Address: DF:A9:FF:F6:B1:1A (OUI DF-A9-FF)
        Random number: 0x0000000000000000
        Encrypted diversifier: 0x0000
        Long term key: 206c971235b1099ce6ad542a013190e3
> HCI Event: Command Status (0x0f) plen 4                 #139 [hci1] 22.055333
      LE Start Encryption (0x08|0x0019) ncmd 1
        Status: Success (0x00)
< HCI Command: Host Number of Com.. (0x03|0x0035) plen 5  #140 [hci1] 22.074031
        Num handles: 1
        Handle: 1116 Address: DF:A9:FF:F6:B1:1A (OUI DF-A9-FF)
        Count: 1
> HCI Event: Encryption Change (0x08) plen 4              #141 [hci1] 22.387038
        Status: Success (0x00)
        Handle: 1116 Address: DF:A9:FF:F6:B1:1A (OUI DF-A9-FF)
        Encryption: Enabled with AES-CCM (0x01)
< HCI Command: Disconnect (0x01|0x0006) plen 3            #142 [hci1] 22.574313
        Handle: 1116 Address: DF:A9:FF:F6:B1:1A (OUI DF-A9-FF)
        Reason: Remote User Terminated Connection (0x13)
> HCI Event: Command Status (0x0f) plen 4                 #143 [hci1] 22.574916
      Disconnect (0x01|0x0006) ncmd 1
        Status: Success (0x00)
> HCI Event: Disconnect Complete (0x05) plen 4            #144 [hci1] 22.637134
        Status: Success (0x00)
        Handle: 1116 Address: DF:A9:FF:F6:B1:1A (OUI DF-A9-FF)
        Reason: Connection Terminated By Local Host (0x16)
< HCI Command: LE Extended Creat.. (0x08|0x0043) plen 26  #145 [hci1] 25.734322
        Filter policy: Accept list is not used (0x00)
        Own address type: Random (0x01)
        Peer address type: Public (0x00)
        Peer address: DF:A9:FF:F6:B1:1A (OUI DF-A9-FF)
        Initiating PHYs: 0x01
        Entry 0: LE 1M
          Scan interval: 60.000 msec (0x0060)
          Scan window: 60.000 msec (0x0060)
          Min connection interval: 30.00 msec (0x0018)
          Max connection interval: 50.00 msec (0x0028)
          Connection latency: 0 (0x0000)
          Supervision timeout: 4000 msec (0x0190)
          Min connection length: 0.000 msec (0x0000)
          Max connection length: 0.000 msec (0x0000)
> HCI Event: Command Status (0x0f) plen 4                 #146 [hci1] 25.735294
      LE Extended Create Connection (0x08|0x0043) ncmd 1
        Status: Success (0x00)
> HCI Event: LE Meta Event (0x3e) plen 31                 #147 [hci1] 25.789303
      LE Enhanced Connection Complete (0x0a)
        Status: Success (0x00)
        Handle: 1134
        Role: Central (0x00)
        Peer address type: Public (0x00)
        Peer address: DF:A9:FF:F6:B1:1A (OUI DF-A9-FF)
        Local resolvable private address: 00:00:00:00:00:00 (Non-Resolvable)
        Peer resolvable private address: 00:00:00:00:00:00 (Non-Resolvable)
        Connection interval: 50.00 msec (0x0028)
        Connection latency: 0 (0x0000)
        Supervision timeout: 4000 msec (0x0190)
        Central clock accuracy: 0x00
< HCI Command: LE Read Remote Use.. (0x08|0x0016) plen 2  #148 [hci1] 25.794000
        Handle: 1134 Address: DF:A9:FF:F6:B1:1A (OUI DF-A9-FF)
> HCI Event: Command Status (0x0f) plen 4                 #149 [hci1] 25.794463
      LE Read Remote Used Features (0x08|0x0016) ncmd 1
        Status: Success (0x00)
< HCI Command: LE Set PHY (0x08|0x0032) plen 7            #150 [hci1] 25.813906
        Handle: 1134 Address: DF:A9:FF:F6:B1:1A (OUI DF-A9-FF)
        All PHYs preference: 0x00
        TX PHYs preference: 0x02
          LE 2M
        RX PHYs preference: 0x02
          LE 2M
        PHY options preference: Reserved (0x0000)
> HCI Event: Command Status (0x0f) plen 4                 #151 [hci1] 25.814460
      LE Set PHY (0x08|0x0032) ncmd 1
        Status: Success (0x00)
> HCI Event: LE Meta Event (0x3e) plen 12                 #152 [hci1] 25.940662
      LE Read Remote Used Features (0x04)
        Status: Success (0x00)
        Handle: 1134 Address: DF:A9:FF:F6:B1:1A (OUI DF-A9-FF)
        Features: 0x2d 0x49 0x00 0xf7 0x67 0xd9 0x00 0x80
          LE Encryption
          Extended Reject Indication
          Peripheral-initiated Features Exchange
          LE Data Packet Length Extension
          LE 2M PHY
          LE Coded PHY
          Channel Selection Algorithm #2
          Periodic Advertising Sync Transfer - Sender
          Periodic Advertising Sync Transfer - Recipient
          Sleep Clock Accuracy Updates
          Connected Isochronous Stream - Central
          Connected Isochronous Stream - Peripheral
          Isochronous Broadcaster
          Synchronized Receiver
          Connected Isochronous Stream (Host Support)
          LE Power Control Request
          LE Power Control Request
          Connection Subrating
          Connection Subrating (Host Support)
          Unknown features (0x8000d90000000000)
> HCI Event: LE Meta Event (0x3e) plen 6                  #153 [hci1] 26.440065
      LE PHY Update Complete (0x0c)
        Status: Success (0x00)
        Handle: 1134 Address: DF:A9:FF:F6:B1:1A (OUI DF-A9-FF)
        TX PHY: LE 2M (0x02)
        RX PHY: LE 2M (0x02)
< ACL Data TX: Handle 1134 flags 0x00 dlen 11             #154 [hci1] 26.874075
      SMP: Pairing Request (0x01) len 6
        IO capability: NoInputNoOutput (0x03)
        OOB data: Authentication data from remote device present (0x01)
        Authentication requirement: Bonding, No MITM, SC, No Keypresses (0x09)
        Max encryption key size: 16
        Initiator key distribution: EncKey (0x01)
        Responder key distribution: EncKey IdKey (0x03)
> HCI Event: Number of Completed Packets (0x13) plen 5    #155 [hci1] 26.890486
        Num handles: 1
        Handle: 1134 Address: DF:A9:FF:F6:B1:1A (OUI DF-A9-FF)
        Count: 1
        #154: len 11 (5 Kb/s)
        Latency: 16 msec (16-16 msec ~16 msec)
> ACL Data RX: Handle 1134 flags 0x02 dlen 11             #156 [hci1] 26.940634
      SMP: Pairing Response (0x02) len 6
        IO capability: KeyboardOnly (0x02)
        OOB data: Authentication data from remote device present (0x01)
        Authentication requirement: No bonding, MITM, Legacy, No Keypresses (0x04)
        Max encryption key size: 16
        Initiator key distribution: <none> (0x00)
        Responder key distribution: <none> (0x00)
< HCI Command: Host Number of Com.. (0x03|0x0035) plen 5  #157 [hci1] 26.953915
        Num handles: 1
        Handle: 1134 Address: DF:A9:FF:F6:B1:1A (OUI DF-A9-FF)
        Count: 1
< ACL Data TX: Handle 1134 flags 0x00 dlen 21             #158 [hci1] 26.953941
      SMP: Pairing Confirm (0x03) len 16
        Confim value: 34c390c972921c15d2fd9c3288758214
> HCI Event: Number of Completed Packets (0x13) plen 5    #159 [hci1] 26.990523
        Num handles: 1
        Handle: 1134 Address: DF:A9:FF:F6:B1:1A (OUI DF-A9-FF)
        Count: 1
        #158: len 21 (4 Kb/s)
        Latency: 36 msec (16-36 msec ~26 msec)
> ACL Data RX: Handle 1134 flags 0x02 dlen 21             #160 [hci1] 27.040706
      SMP: Pairing Confirm (0x03) len 16
        Confim value: 92bde80be5bc5a94f2afc5c0d177df6a
< HCI Command: Host Number of Com.. (0x03|0x0035) plen 5  #161 [hci1] 27.054233
        Num handles: 1
        Handle: 1134 Address: DF:A9:FF:F6:B1:1A (OUI DF-A9-FF)
        Count: 1
< ACL Data TX: Handle 1134 flags 0x00 dlen 21             #162 [hci1] 27.054326
      SMP: Pairing Random (0x04) len 16
        Random value: 00bad7aca1ba32527e6e64e79f33b2e3
> HCI Event: Number of Completed Packets (0x13) plen 5    #163 [hci1] 27.090554
        Num handles: 1
        Handle: 1134 Address: DF:A9:FF:F6:B1:1A (OUI DF-A9-FF)
        Count: 1
        #162: len 21 (4 Kb/s)
        Latency: 36 msec (16-36 msec ~31 msec)
> ACL Data RX: Handle 1134 flags 0x02 dlen 21             #164 [hci1] 27.340644
      SMP: Pairing Random (0x04) len 16
        Random value: c85b05705f20bf109fa39251abff3048
< HCI Command: LE Start Encryption (0x08|0x0019) plen 28  #165 [hci1] 27.354091
        Handle: 1134 Address: DF:A9:FF:F6:B1:1A (OUI DF-A9-FF)
        Random number: 0x0000000000000000
        Encrypted diversifier: 0x0000
        Long term key: 82fa4bb20eb39f00d86dc3b03dcd78c5
> HCI Event: Command Status (0x0f) plen 4                 #166 [hci1] 27.355005
      LE Start Encryption (0x08|0x0019) ncmd 1
        Status: Success (0x00)
< HCI Command: Host Number of Com.. (0x03|0x0035) plen 5  #167 [hci1] 27.374121
        Num handles: 1
        Handle: 1134 Address: DF:A9:FF:F6:B1:1A (OUI DF-A9-FF)
        Count: 1
> HCI Event: Encryption Change (0x08) plen 4              #168 [hci1] 27.690411
        Status: Success (0x00)
        Handle: 1134 Address: DF:A9:FF:F6:B1:1A (OUI DF-A9-FF)
        Encryption: Enabled with AES-CCM (0x01)
< HCI Command: Disconnect (0x01|0x0006) plen 3            #169 [hci1] 27.924173
        Handle: 1134 Address: DF:A9:FF:F6:B1:1A (OUI DF-A9-FF)
        Reason: Remote User Terminated Connection (0x13)
> HCI Event: Command Status (0x0f) plen 4                 #170 [hci1] 27.924730
      Disconnect (0x01|0x0006) ncmd 1
        Status: Success (0x00)
> HCI Event: Disconnect Complete (0x05) plen 4            #171 [hci1] 27.990352
        Status: Success (0x00)
        Handle: 1134 Address: DF:A9:FF:F6:B1:1A (OUI DF-A9-FF)
        Reason: Connection Terminated By Local Host (0x16)
< HCI Command: Reset (0x03|0x0003) plen 0                 #172 [hci1] 35.303893
> HCI Event: Command Complete (0x0e) plen 4               #173 [hci1] 35.304484
      Reset (0x03|0x0003) ncmd 1
        Status: Success (0x00)
@ USER Close: main                                    {0x0001} [hci1] 35.313812
= Close Index: 00:00:00:00:00:00                               [hci1] 35.313820
