Bluetooth monitor ver 5.84
btmon[3885204]: = Note: Linux version 6.8.0-83-generic (x86_64)                                                          0.671307
btmon[3885204]: = Note: Bluetooth subsystem version 2.22                                                                 0.671309
= New Index: 00:00:00:00:00:00 (Primary,UART,hci0)                                                                       0.671310
= Open Index: 00:00:00:00:00:00                                                                                          1.178860
= Index Info: 00:00:00:00:00:00 (Nordic Semiconductor ASA)                                                               1.178864
zephyr.exe[3885206]: @ USER Open: main (privileged) version 2.22                                                {0x0001} 1.178866
zephyr.exe[3885206]: < HCI Command: Reset (0x03|0x0003) plen 0                                                        #1 1.179057
> HCI Event: Command Complete (0x0e) plen 4                                                                           #2 1.179866
      Reset (0x03|0x0003) ncmd 1
        Status: Success (0x00)
zephyr.exe[3885206]: < HCI Command: Read Local Supported Features (0x04|0x0003) plen 0                                #3 1.198784
> HCI Event: Command Complete (0x0e) plen 12                                                                          #4 1.199364
      Read Local Supported Features (0x04|0x0003) ncmd 1
        Status: Success (0x00)
        Features: 0x00 0x00 0x00 0x00 0x60 0x00 0x00 0x00
          BR/EDR Not Supported
          LE Supported (Controller)
zephyr.exe[3885206]: < HCI Command: Read Local Version Information (0x04|0x0001) plen 0                               #5 1.218784
> HCI Event: Command Complete (0x0e) plen 12                                                                          #6 1.219413
      Read Local Version Information (0x04|0x0001) ncmd 1
        Status: Success (0x00)
        HCI version: Reserved (0x0e) - Revision 12520 (0x30e8)
        LMP version: Reserved (0x0e) - Subversion 12520 (0x30e8)
        Manufacturer: Nordic Semiconductor ASA (89)
zephyr.exe[3885206]: < HCI Command: Read Local Supported Commands (0x04|0x0002) plen 0                                #7 1.238765
> HCI Event: Command Complete (0x0e) plen 68                                                                          #8 1.240653
      Read Local Supported Commands (0x04|0x0002) ncmd 1
        Status: Success (0x00)
        Commands: 119 entries
          Disconnect (Octet 0 - Bit 5)
          Read Remote Version Information (Octet 2 - Bit 7)
          Set Event Mask (Octet 5 - Bit 6)
          Reset (Octet 5 - Bit 7)
          Read Connection Accept Timeout (Octet 7 - Bit 2)
          Write Connection Accept Timeout (Octet 7 - Bit 3)
          Read Transmit Power Level (Octet 10 - Bit 2)
          Set Controller To Host Flow Control (Octet 10 - Bit 5)
          Host Buffer Size (Octet 10 - Bit 6)
          Host Number of Completed Packets (Octet 10 - Bit 7)
          Read Local Version Information (Octet 14 - Bit 3)
          Read Local Supported Features (Octet 14 - Bit 5)
          Read BD ADDR (Octet 15 - Bit 1)
          Read RSSI (Octet 15 - Bit 5)
          Set Event Mask Page 2 (Octet 22 - Bit 2)
          LE Set Event Mask (Octet 25 - Bit 0)
          LE Read Buffer Size (Octet 25 - Bit 1)
          LE Read Local Supported Features (Octet 25 - Bit 2)
          LE Set Random Address (Octet 25 - Bit 4)
          LE Set Advertising Parameters (Octet 25 - Bit 5)
          LE Read Advertising Channel TX Power (Octet 25 - Bit 6)
          LE Set Advertising Data (Octet 25 - Bit 7)
          LE Set Scan Response Data (Octet 26 - Bit 0)
          LE Set Advertise Enable (Octet 26 - Bit 1)
          LE Set Scan Parameters (Octet 26 - Bit 2)
          LE Set Scan Enable (Octet 26 - Bit 3)
          LE Create Connection (Octet 26 - Bit 4)
          LE Create Connection Cancel (Octet 26 - Bit 5)
          LE Read Accept List Size (Octet 26 - Bit 6)
          LE Clear Accept List (Octet 26 - Bit 7)
          LE Add Device To Accept List (Octet 27 - Bit 0)
          LE Remove Device From Accept List (Octet 27 - Bit 1)
          LE Connection Update (Octet 27 - Bit 2)
          LE Set Host Channel Classification (Octet 27 - Bit 3)
          LE Read Channel Map (Octet 27 - Bit 4)
          LE Read Remote Used Features (Octet 27 - Bit 5)
          LE Encrypt (Octet 27 - Bit 6)
          LE Rand (Octet 27 - Bit 7)
          LE Start Encryption (Octet 28 - Bit 0)
          LE Long Term Key Request Reply (Octet 28 - Bit 1)
          LE Long Term Key Request Neg Reply (Octet 28 - Bit 2)
          LE Read Supported States (Octet 28 - Bit 3)
          LE Receiver Test (Octet 28 - Bit 4)
          LE Transmitter Test (Octet 28 - Bit 5)
          LE Test End (Octet 28 - Bit 6)
          Read Authenticated Payload Timeout (Octet 32 - Bit 4)
          Write Authenticated Payload Timeout (Octet 32 - Bit 5)
          LE Set Data Length (Octet 33 - Bit 6)
          LE Read Suggested Default Data Length (Octet 33 - Bit 7)
          LE Write Suggested Default Data Length (Octet 34 - Bit 0)
          LE Add Device To Resolving List (Octet 34 - Bit 3)
          LE Remove Device From Resolving List (Octet 34 - Bit 4)
          LE Clear Resolving List (Octet 34 - Bit 5)
          LE Read Resolving List Size (Octet 34 - Bit 6)
          LE Set Address Resolution Enable (Octet 35 - Bit 1)
          LE Set Resolvable Private Address Timeout (Octet 35 - Bit 2)
          LE Read Maximum Data Length (Octet 35 - Bit 3)
          LE Read PHY (Octet 35 - Bit 4)
          LE Set Default PHY (Octet 35 - Bit 5)
          LE Set PHY (Octet 35 - Bit 6)
          LE Enhanced Receiver Test (Octet 35 - Bit 7)
          LE Enhanced Transmitter Test (Octet 36 - Bit 0)
          LE Set Advertising Set Random Address (Octet 36 - Bit 1)
          LE Set Extended Advertising Parameters (Octet 36 - Bit 2)
          LE Set Extended Advertising Data (Octet 36 - Bit 3)
          LE Set Extended Scan Response Data (Octet 36 - Bit 4)
          LE Set Extended Advertising Enable (Octet 36 - Bit 5)
          LE Read Maximum Advertising Data Length (Octet 36 - Bit 6)
          LE Read Number of Supported Advertising Sets (Octet 36 - Bit 7)
          LE Remove Advertising Set (Octet 37 - Bit 0)
          LE Clear Advertising Sets (Octet 37 - Bit 1)
          LE Set Periodic Advertising Parameters (Octet 37 - Bit 2)
          LE Set Periodic Advertising Data (Octet 37 - Bit 3)
          LE Set Periodic Advertising Enable (Octet 37 - Bit 4)
          LE Set Extended Scan Parameters (Octet 37 - Bit 5)
          LE Set Extended Scan Enable (Octet 37 - Bit 6)
          LE Extended Create Connection (Octet 37 - Bit 7)
          LE Periodic Advertising Create Sync (Octet 38 - Bit 0)
          LE Periodic Advertising Create Sync Cancel (Octet 38 - Bit 1)
          LE Periodic Advertising Terminate Sync (Octet 38 - Bit 2)
          LE Add Device To Periodic Advertiser List (Octet 38 - Bit 3)
          LE Remove Device From Periodic Advertiser List (Octet 38 - Bit 4)
          LE Clear Periodic Advertiser List (Octet 38 - Bit 5)
          LE Read Periodic Advertiser List Size (Octet 38 - Bit 6)
          LE Read Transmit Power (Octet 38 - Bit 7)
          LE Read RF Path Compensation (Octet 39 - Bit 0)
          LE Write RF Path Compensation (Octet 39 - Bit 1)
          LE Set Privacy Mode (Octet 39 - Bit 2)
          LE Periodic Advertising Receive Enable (Octet 40 - Bit 5)
          LE Periodic Advertising Sync Transfer (Octet 40 - Bit 6)
          LE Periodic Advertising Set Info Transfer (Octet 40 - Bit 7)
          LE Periodic Advertising Sync Transfer Parameters (Octet 41 - Bit 0)
          LE Set Default Periodic Advertisng Sync Transfer Parameters (Octet 41 - Bit 1)
          LE Read Buffer v2 (Octet 41 - Bit 5)
          LE Read ISO TX Sync (Octet 41 - Bit 6)
          LE Set Connected Isochronous Group Parameters (Octet 41 - Bit 7)
          LE Set Connected Isochronous Group Parameters Test (Octet 42 - Bit 0)
          LE Create Connected Isochronous Stream (Octet 42 - Bit 1)
          LE Remove Connected Isochronous Group (Octet 42 - Bit 2)
          LE Accept Connected Isochronous Stream Request (Octet 42 - Bit 3)
          LE Reject Connected Isochronous Stream Request (Octet 42 - Bit 4)
          LE Create Broadcast Isochronous Group (Octet 42 - Bit 5)
          LE Create Broadcast Isochronous Group Test (Octet 42 - Bit 6)
          LE Terminate Broadcast Isochronous Group (Octet 42 - Bit 7)
          LE Broadcast Isochronous Group Create Sync (Octet 43 - Bit 0)
          LE Broadcast Isochronous Group Terminate Sync (Octet 43 - Bit 1)
          LE Request Peer SCA (Octet 43 - Bit 2)
          LE Setup Isochronous Data Path (Octet 43 - Bit 3)
          LE Remove Isochronous Data Path (Octet 43 - Bit 4)
          LE Isochronous Transmit Test (Octet 43 - Bit 5)
          LE Isochronous Receive Test (Octet 43 - Bit 6)
          LE Isochronous Read Test Counters (Octet 43 - Bit 7)
          LE Isochronous Read Test Counters (Octet 44 - Bit 0)
          LE Set Host Feature (Octet 44 - Bit 1)
          LE Read ISO link quality (Octet 44 - Bit 2)
          Octet 45 - Bit 6 
          Octet 46 - Bit 0 
          Octet 46 - Bit 1 
          Octet 46 - Bit 2 
zephyr.exe[3885206]: < HCI Command: Host Buffer Size (0x03|0x0033) plen 7                                             #9 1.258764
        ACL MTU: 255  ACL max packet: 16
        SCO MTU: 0    SCO max packet: 0
> HCI Event: Command Complete (0x0e) plen 4                                                                          #10 1.259460
      Host Buffer Size (0x03|0x0033) ncmd 1
        Status: Success (0x00)
zephyr.exe[3885206]: < HCI Command: Set Controller To Host Flow Control (0x03|0x0031) plen 1                         #11 1.278775
        Flow control: ACL Data Packets (0x01)
> HCI Event: Command Complete (0x0e) plen 4                                                                          #12 1.279239
      Set Controller To Host Flow Control (0x03|0x0031) ncmd 1
        Status: Success (0x00)
zephyr.exe[3885206]: < HCI Command: LE Read Local Supported Features (0x08|0x0003) plen 0                            #13 1.298697
> HCI Event: Command Complete (0x0e) plen 12                                                                         #14 1.299431
      LE Read Local Supported Features (0x08|0x0003) ncmd 1
        Status: Success (0x00)
        Features: 0xfd 0x79 0x00 0xf7 0x30 0x01 0x00 0x00
          LE Encryption
          Extended Reject Indication
          Peripheral-initiated Features Exchange
          LE Ping
          LE Data Packet Length Extension
          LL Privacy
          Extended Scanner Filter Policies
          LE 2M PHY
          LE Coded PHY
          LE Extended Advertising
          LE Periodic Advertising
          Channel Selection Algorithm #2
          Periodic Advertising Sync Transfer - Sender
          Periodic Advertising Sync Transfer - Recipient
          Sleep Clock Accuracy Updates
          Connected Isochronous Stream - Central
          Connected Isochronous Stream - Peripheral
          Isochronous Broadcaster
          Synchronized Receiver
          Periodic Advertising ADI support
          Connection Subrating
          Unknown features (0x0000010000000000)
zephyr.exe[3885206]: < HCI Command: LE Set Host Feature (0x08|0x0074) plen 2                                         #15 1.318772
        Bit Number: 32
          Connected Isochronous Stream (Host Support)
        Bit Value: 1
> HCI Event: Command Complete (0x0e) plen 4                                                                          #16 1.319316
      LE Set Host Feature (0x08|0x0074) ncmd 1
        Status: Success (0x00)
zephyr.exe[3885206]: < HCI Command: LE Read Buffer v2 (0x08|0x0060) plen 0                                           #17 1.338756
> HCI Event: Command Complete (0x0e) plen 10                                                                         #18 1.339382
      LE Read Buffer v2 (0x08|0x0060) ncmd 1
        Status: Success (0x00)
        ACL MTU: 27
        ACL max packet: 3
        ISO MTU: 318
        ISO max packet: 3
zephyr.exe[3885206]: < HCI Command: LE Read Maximum Advertising Data Length (0x08|0x003a) plen 0                     #19 1.358812
> HCI Event: Command Complete (0x0e) plen 6                                                                          #20 1.359503
      LE Read Maximum Advertising Data Length (0x08|0x003a) ncmd 1
        Status: Success (0x00)
        Max length: 1650
zephyr.exe[3885206]: < HCI Command: LE Read Supported States (0x08|0x001c) plen 0                                    #21 1.378677
> HCI Event: Command Complete (0x0e) plen 12                                                                         #22 1.379426
      LE Read Supported States (0x08|0x001c) ncmd 1
        Status: Success (0x00)
        States: 0x000003ff3e0306ff
          Non-connectable Advertising State
          Scannable Advertising State
          Connectable Advertising State
          High Duty Cycle Directed Advertising State
          Passive Scanning State
          Active Scanning State
          Initiating State
            and Connection State (Central Role)
          Connection State (Peripheral Role)
          Scannable Advertising State
            and Passive Scanning State
          Connectable Advertising State
            and Passive Scanning State
          Non-connectable Advertising State
            and Initiating State
          Scannable Advertising State
            and Initiating State
          Active Scanning State
            and Connection State (Central Role)
          Passive Scanning State
            and Connection State (Peripheral Role)
          Active Scanning State
            and Connection State (Peripheral Role)
          Initiating State
            and Connection State (Central Role)
            and Central Role & Central Role
          Low Duty Cycle Directed Advertising State
          Connectable Advertising State
            and Initiating State
            and Central Role & Peripheral Role
          High Duty Cycle Directed Advertising State
            and Initiating State
            and Central Role & Peripheral Role
          Low Duty Cycle Directed Advertising State
            and Initiating State
            and Central Role & Peripheral Role
          Connectable Advertising State
            and Connection State (Central Role)
            and Central Role & Peripheral Role
          High Duty Cycle Directed Advertising State
            and Connection State (Central Role)
            and Central Role & Peripheral Role
          Low Duty Cycle Directed Advertising State
            and Connection State (Central Role)
            and Central Role & Peripheral Role
          Connectable Advertising State
            and Connection State (Peripheral Role)
            and Central Role & Peripheral Role
          High Duty Cycle Directed Advertising State
            and Connection State (Peripheral Role)
            and Peripheral Role & Peripheral Role
          Low Duty Cycle Directed Advertising State
            and Connection State (Peripheral Role)
            and Peripheral Role & Peripheral Role
          Initiating State
            and Connection State (Peripheral Role)
            and Central Role & Peripheral Role
zephyr.exe[3885206]: < HCI Command: LE Read Maximum Data Length (0x08|0x002f) plen 0                                 #23 1.398777
> HCI Event: Command Complete (0x0e) plen 12                                                                         #24 1.399577
      LE Read Maximum Data Length (0x08|0x002f) ncmd 1
        Status: Success (0x00)
        Max TX octets: 251
        Max TX time: 2704
        Max RX octets: 251
        Max RX time: 2704
zephyr.exe[3885206]: < HCI Command: LE Write Suggested Default Data Length (0x08|0x0024) plen 4                      #25 1.418781
        TX octets: 251
        TX time: 2704
> HCI Event: Command Complete (0x0e) plen 4                                                                          #26 1.419880
      LE Write Suggested Default Data Length (0x08|0x0024) ncmd 1
        Status: Success (0x00)
zephyr.exe[3885206]: < HCI Command: LE Read Resolving List Size (0x08|0x002a) plen 0                                 #27 1.438790
> HCI Event: Command Complete (0x0e) plen 5                                                                          #28 1.439743
      LE Read Resolving List Size (0x08|0x002a) ncmd 1
        Status: Success (0x00)
        Size: 8
zephyr.exe[3885206]: < HCI Command: LE Set Event Mask (0x08|0x0001) plen 8                                           #29 1.458799
        Mask: 0x000002023f87fa5e
          LE Advertising Report
          LE Connection Update Complete
          LE Read Remote Used Features Complete
          LE Long Term Key Request
          LE Data Length Change
          LE Enhanced Connection Complete
          LE PHY Update Complete
          LE Extended Advertising Report
          LE Periodic Advertising Sync Established
          LE Periodic Advertising Report
          LE Periodic Advertising Sync Lost
          LE Extended Scan Timeout
          LE Extended Advertising Set Terminated
          LE Scan Request Received
          LE Periodic Advertising Sync Transfer Rvc
          LE CIS Established
          LE CIS Request
          LE Create BIG Complete
          LE Terminate BIG Complete
          LE BIG Sync Established Complete
          LE BIG Sync Lost
          LE BIG Info Advertising Report
          Unknown mask (0x0000020000000000)
> HCI Event: Command Complete (0x0e) plen 4                                                                          #30 1.459809
      LE Set Event Mask (0x08|0x0001) ncmd 1
        Status: Success (0x00)
zephyr.exe[3885206]: < HCI Command: Set Event Mask (0x03|0x0001) plen 8                                              #31 1.478792
        Mask: 0x2000800002008890
          Disconnection Complete
          Encryption Change
          Read Remote Version Information Complete
          Hardware Error
          Data Buffer Overflow
          Encryption Key Refresh Complete
          LE Meta
> HCI Event: Command Complete (0x0e) plen 4                                                                          #32 1.479749
      Set Event Mask (0x03|0x0001) ncmd 1
        Status: Success (0x00)
zephyr.exe[3885206]: < HCI Command: Read BD ADDR (0x04|0x0009) plen 0                                                #33 1.498783
> HCI Event: Command Complete (0x0e) plen 10                                                                         #34 1.499939
      Read BD ADDR (0x04|0x0009) ncmd 1
        Status: Success (0x00)
        Address: 00:00:00:00:00:00 (OUI 00-00-00)
zephyr.exe[3885206]: < HCI Command: LE Set Random Address (0x08|0x0005) plen 6                                       #35 1.518792
        Address: D5:B6:CC:31:DB:3B (Static)
> HCI Event: Command Complete (0x0e) plen 4                                                                          #36 1.519835
      LE Set Random Address (0x08|0x0005) ncmd 1
        Status: Success (0x00)
zephyr.exe[3885206]: < HCI Command: LE Set Extended Advertising Parameters (0x08|0x0036) plen 25                     #37 5.778909
        Handle: 0x00
        Properties: 0x0013
          Connectable
          Scannable
          Use legacy advertising PDUs: ADV_IND
        Min advertising interval: 100.000 msec (0x00a0)
        Max advertising interval: 150.000 msec (0x00f0)
        Channel map: 37, 38, 39 (0x07)
        Own address type: Random (0x01)
        Peer address type: Public (0x00)
        Peer address: 00:00:00:00:00:00 (OUI 00-00-00)
        Filter policy: Allow Scan Request from Any, Allow Connect Request from Any (0x00)
        TX power: Host has no preference (0x7f)
        Primary PHY: LE 1M (0x01)
        Secondary max skip: 0x00
        Secondary PHY: LE 1M (0x01)
        SID: 0x00
        Scan request notifications: Disabled (0x00)
> HCI Event: Command Complete (0x0e) plen 5                                                                          #38 5.780049
      LE Set Extended Advertising Parameters (0x08|0x0036) ncmd 1
        Status: Success (0x00)
        TX power (selected): 0 dbm (0x00)
zephyr.exe[3885206]: < HCI Command: LE Set Advertising Set Random Address (0x08|0x0035) plen 7                       #39 5.798843
        Advertising handle: 0x00
        Advertising random address: D5:B6:CC:31:DB:3B (Static)
> HCI Event: Command Complete (0x0e) plen 4                                                                          #40 5.799712
      LE Set Advertising Set Random Address (0x08|0x0035) ncmd 1
        Status: Success (0x00)
zephyr.exe[3885206]: < HCI Command: LE Set Extended Advertising Data (0x08|0x0037) plen 22                           #41 5.818849
        Handle: 0x00
        Operation: Complete extended advertising data (0x03)
        Fragment preference: Minimize fragmentation (0x01)
        Data length: 0x12
        Flags: 0x04
          BR/EDR Not Supported
        Name (complete): Tester_F6B11A
> HCI Event: Command Complete (0x0e) plen 4                                                                          #42 5.819776
      LE Set Extended Advertising Data (0x08|0x0037) ncmd 1
        Status: Success (0x00)
zephyr.exe[3885206]: < HCI Command: LE Set Extended Scan Response Data (0x08|0x0038) plen 4                          #43 5.838834
        Handle: 0x00
        Operation: Complete scan response data (0x03)
        Fragment preference: Minimize fragmentation (0x01)
        Data length: 0x00
> HCI Event: Command Complete (0x0e) plen 4                                                                          #44 5.839415
      LE Set Extended Scan Response Data (0x08|0x0038) ncmd 1
        Status: Success (0x00)
zephyr.exe[3885206]: < HCI Command: LE Set Extended Advertising Enable (0x08|0x0039) plen 6                          #45 5.858841
        Extended advertising: Enabled (0x01)
        Number of sets: 1 (0x01)
        Entry 0
          Handle: 0x00
          Duration: 0 ms (0x00)
          Max ext adv events: 0
> HCI Event: Command Complete (0x0e) plen 4                                                                          #46 5.859530
      LE Set Extended Advertising Enable (0x08|0x0039) ncmd 1
        Status: Success (0x00)
> HCI Event: LE Meta Event (0x3e) plen 31                                                                            #47 6.277443
      LE Enhanced Connection Complete (0x0a)
        Status: Success (0x00)
        Handle: 3
        Role: Peripheral (0x01)
        Peer address type: Public (0x00)
        Peer address: DF:A9:FF:F6:B1:1A (OUI DF-A9-FF)
        Local resolvable private address: 00:00:00:00:00:00 (Non-Resolvable)
        Peer resolvable private address: 00:00:00:00:00:00 (Non-Resolvable)
        Connection interval: 87.50 msec (0x0046)
        Connection latency: 0 (0x0000)
        Supervision timeout: 20000 msec (0x07d0)
        Central clock accuracy: 0x01
> HCI Event: LE Meta Event (0x3e) plen 6                                                                             #48 6.277544
      LE Advertising Set Terminated (0x12)
        Status: Success (0x00)
        Handle: 0
        Connection handle: 3
        Number of completed extended advertising events: 0
zephyr.exe[3885206]: < HCI Command: LE Read Remote Used Features (0x08|0x0016) plen 2                                #49 6.279028
        Handle: 3 Address: DF:A9:FF:F6:B1:1A (OUI DF-A9-FF)
> HCI Event: Command Status (0x0f) plen 4                                                                            #50 6.279589
      LE Read Remote Used Features (0x08|0x0016) ncmd 1
        Status: Success (0x00)
> HCI Event: LE Meta Event (0x3e) plen 12                                                                            #51 6.541476
      LE Read Remote Used Features (0x04)
        Status: Success (0x00)
        Handle: 3 Address: DF:A9:FF:F6:B1:1A (OUI DF-A9-FF)
        Features: 0x2d 0x49 0x00 0xf7 0x67 0xd8 0x00 0x00
          LE Encryption
          Extended Reject Indication
          Peripheral-initiated Features Exchange
          LE Data Packet Length Extension
          LE 2M PHY
          LE Coded PHY
          Channel Selection Algorithm #2
          Periodic Advertising Sync Transfer - Sender
          Periodic Advertising Sync Transfer - Recipient
          Sleep Clock Accuracy Updates
          Connected Isochronous Stream - Central
          Connected Isochronous Stream - Peripheral
          Isochronous Broadcaster
          Synchronized Receiver
          Connected Isochronous Stream (Host Support)
          LE Power Control Request
          LE Power Control Request
          Connection Subrating
          Connection Subrating (Host Support)
          Unknown features (0x0000d80000000000)
> ACL Data RX: Handle 3 flags 0x02 dlen 11                                                                           #52 8.990989
      SMP: Pairing Request (0x01) len 6
        IO capability: KeyboardDisplay (0x04)
        OOB data: Authentication data not present (0x00)
        Authentication requirement: Bonding, No MITM, Legacy, No Keypresses (0x01)
        Max encryption key size: 16
        Initiator key distribution: EncKey IdKey (0x03)
        Responder key distribution: EncKey IdKey Sign (0x07)
zephyr.exe[3885206]: < HCI Command: Host Number of Completed Packets (0x03|0x0035) plen 5                            #53 8.998902
        Num handles: 1
        Handle: 3 Address: DF:A9:FF:F6:B1:1A (OUI DF-A9-FF)
        Count: 1
zephyr.exe[3885206]: < ACL Data TX: Handle 3 [1/3] flags 0x00 dlen 11                                                #54 8.998925
      SMP: Pairing Response (0x02) len 6
        IO capability: NoInputNoOutput (0x03)
        OOB data: Authentication data not present (0x00)
        Authentication requirement: Bonding, No MITM, Legacy, No Keypresses (0x01)
        Max encryption key size: 16
        Initiator key distribution: EncKey IdKey (0x03)
        Responder key distribution: EncKey Sign (0x05)
> HCI Event: Number of Completed Packets (0x13) plen 5                                                               #55 9.166369
        Num handles: 1
        Handle: 3 Address: DF:A9:FF:F6:B1:1A (OUI DF-A9-FF)
        Count: 1
        Buffers: 0/3
        #54: len 11 (0 Kb/s)
        Latency: 167 msec (167-167 msec ~167 msec)
> ACL Data RX: Handle 3 flags 0x02 dlen 21                                                                           #56 9.166371
      SMP: Pairing Confirm (0x03) len 16
        Confirm value[16]: 8ed25f4b54db60d7fb65f9e7d57e40b1
zephyr.exe[3885206]: < HCI Command: Host Number of Completed Packets (0x03|0x0035) plen 5                            #57 9.179052
        Num handles: 1
        Handle: 3 Address: DF:A9:FF:F6:B1:1A (OUI DF-A9-FF)
        Count: 1
zephyr.exe[3885206]: < ACL Data TX: Handle 3 [1/3] flags 0x00 dlen 21                                                #58 9.179058
      SMP: Pairing Confirm (0x03) len 16
        Confirm value[16]: 40e510d12a17d365b8b95fd12316d475
> HCI Event: Number of Completed Packets (0x13) plen 5                                                               #59 9.340843
        Num handles: 1
        Handle: 3 Address: DF:A9:FF:F6:B1:1A (OUI DF-A9-FF)
        Count: 1
        Buffers: 0/3
        #58: len 21 (1 Kb/s)
        Latency: 161 msec (161-167 msec ~164 msec)
> ACL Data RX: Handle 3 flags 0x02 dlen 21                                                                           #60 9.341446
      SMP: Pairing Random (0x04) len 16
        Random value[16]: e5a55da6b774b1320000000000000000
zephyr.exe[3885206]: < HCI Command: Host Number of Completed Packets (0x03|0x0035) plen 5                            #61 9.359063
        Num handles: 1
        Handle: 3 Address: DF:A9:FF:F6:B1:1A (OUI DF-A9-FF)
        Count: 1
zephyr.exe[3885206]: < ACL Data TX: Handle 3 [1/3] flags 0x00 dlen 21                                                #62 9.359068
      SMP: Pairing Random (0x04) len 16
        Random value[16]: 8e6108f966a694cbe26df70bb96773e6
> HCI Event: Number of Completed Packets (0x13) plen 5                                                               #63 9.515793
        Num handles: 1
        Handle: 3 Address: DF:A9:FF:F6:B1:1A (OUI DF-A9-FF)
        Count: 1
        Buffers: 0/3
        #62: len 21 (1 Kb/s)
        Latency: 156 msec (156-167 msec ~160 msec)
> HCI Event: LE Meta Event (0x3e) plen 13                                                                            #64 9.603987
      LE Long Term Key Request (0x05)
        Handle: 3 Address: DF:A9:FF:F6:B1:1A (OUI DF-A9-FF)
        Random number: 0x0000000000000000
        Encrypted diversifier: 0x0000
zephyr.exe[3885206]: < HCI Command: LE Long Term Key Request Reply (0x08|0x001a) plen 18                             #65 9.618925
        Handle: 3 Address: DF:A9:FF:F6:B1:1A (OUI DF-A9-FF)
        Long term key[16]: f83b2d68472d56b2efb79a9534b7b39e
> HCI Event: Command Complete (0x0e) plen 6                                                                          #66 9.620305
      LE Long Term Key Request Reply (0x08|0x001a) ncmd 1
        Status: Success (0x00)
        Handle: 3 Address: DF:A9:FF:F6:B1:1A (OUI DF-A9-FF)
> HCI Event: Encryption Change (0x08) plen 4                                                                        #67 10.041017
        Status: Success (0x00)
        Handle: 3 Address: DF:A9:FF:F6:B1:1A (OUI DF-A9-FF)
        Encryption: Enabled with AES-CCM (0x01)
zephyr.exe[3885206]: < ACL Data TX: Handle 3 [1/3] flags 0x00 dlen 21                                               #68 10.168968
      SMP: Encryption Information (0x06) len 16
        Long term key[16]: 5da095555cc64d02679f89a05211af56
zephyr.exe[3885206]: < ACL Data TX: Handle 3 [2/3] flags 0x00 dlen 15                                               #69 10.168978
      SMP: Central Identification (0x07) len 10
        EDIV: 0x825e
        Rand: 0x84c81ed264dab3d8
zephyr.exe[3885206]: < ACL Data TX: Handle 3 [3/3] flags 0x00 dlen 21                                               #70 10.168978
      SMP: Signing Information (0x0a) len 16
        Signature key[16]: bc235a02440d0c3424a2acf8fd71a45c
> HCI Event: Number of Completed Packets (0x13) plen 5                                                              #71 10.216407
        Num handles: 1
        Handle: 3 Address: DF:A9:FF:F6:B1:1A (OUI DF-A9-FF)
        Count: 1
        Buffers: 2/3
        #68: len 21 (3 Kb/s)
        Latency: 47 msec (47-167 msec ~104 msec)
> HCI Event: Number of Completed Packets (0x13) plen 5                                                              #72 10.216963
        Num handles: 1
        Handle: 3 Address: DF:A9:FF:F6:B1:1A (OUI DF-A9-FF)
        Count: 1
        Buffers: 1/3
        #69: len 15 (2 Kb/s)
        Latency: 47 msec (47-167 msec ~76 msec)
> HCI Event: Number of Completed Packets (0x13) plen 5                                                              #73 10.303595
        Num handles: 1
        Handle: 3 Address: DF:A9:FF:F6:B1:1A (OUI DF-A9-FF)
        Count: 1
        Buffers: 0/3
        #70: len 21 (1 Kb/s)
        Latency: 134 msec (47-167 msec ~105 msec)
> ACL Data RX: Handle 3 flags 0x02 dlen 21                                                                          #74 10.303852
      SMP: Encryption Information (0x06) len 16
        Long term key[16]: ac39a556d74cf02b7842c2d55753c766
> ACL Data RX: Handle 3 flags 0x02 dlen 15                                                                          #75 10.304003
      SMP: Central Identification (0x07) len 10
        EDIV: 0x4f7c
        Rand: 0x76682d6d83cb5308
> ACL Data RX: Handle 3 flags 0x02 dlen 21                                                                          #76 10.304901
      SMP: Identity Information (0x08) len 16
        Identity resolving key[16]: 8ce27e42db4f692870fb6576040a1415
zephyr.exe[3885206]: < HCI Command: Host Number of Completed Packets (0x03|0x0035) plen 5                           #77 10.318935
        Num handles: 1
        Handle: 3 Address: DF:A9:FF:F6:B1:1A (OUI DF-A9-FF)
        Count: 1
zephyr.exe[3885206]: < HCI Command: Host Number of Completed Packets (0x03|0x0035) plen 5                           #78 10.318968
        Num handles: 1
        Handle: 3 Address: DF:A9:FF:F6:B1:1A (OUI DF-A9-FF)
        Count: 1
zephyr.exe[3885206]: < HCI Command: Host Number of Completed Packets (0x03|0x0035) plen 5                           #79 10.318984
        Num handles: 1
        Handle: 3 Address: DF:A9:FF:F6:B1:1A (OUI DF-A9-FF)
        Count: 1
> ACL Data RX: Handle 3 flags 0x02 dlen 12                                                                          #80 10.391067
      SMP: Identity Address Information (0x09) len 7
        Address: DF:A9:FF:F6:B1:1A (OUI DF-A9-FF)
> ACL Data RX: Handle 3 flags 0x02 dlen 13                                                                          #81 10.391552
      ATT: Find By Type Value Request (0x06) len 8
        Handle range: 0x0001-0xffff
        Attribute type: Primary Service (0x2800)
          UUID: Object Transfer (0x1825)
zephyr.exe[3885206]: < HCI Command: LE Add Device To Resolving List (0x08|0x0027) plen 39                           #82 10.398996
        Address type: Public (0x00)
        Address: DF:A9:FF:F6:B1:1A (OUI DF-A9-FF)
        Peer identity resolving key[16]: 8ce27e42db4f692870fb6576040a1415
        Local identity resolving key[16]: 00000000000000000000000000000000
> HCI Event: Command Complete (0x0e) plen 4                                                                         #83 10.400194
      LE Add Device To Resolving List (0x08|0x0027) ncmd 1
        Status: Success (0x00)
zephyr.exe[3885206]: < HCI Command: LE Set Privacy Mode (0x08|0x004e) plen 8                                        #84 10.418978
        Peer Identity address type: Public (0x00)
        Peer Identity address: DF:A9:FF:F6:B1:1A (OUI DF-A9-FF)
        Privacy Mode: Use Device Privacy (0x01)
> HCI Event: Command Complete (0x0e) plen 4                                                                         #85 10.420015
      LE Set Privacy Mode (0x08|0x004e) ncmd 1
        Status: Success (0x00)
zephyr.exe[3885206]: < HCI Command: LE Set Address Resolution Enable (0x08|0x002d) plen 1                           #86 10.438916
        Address resolution: Enabled (0x01)
> HCI Event: Command Complete (0x0e) plen 4                                                                         #87 10.440043
      LE Set Address Resolution Enable (0x08|0x002d) ncmd 1
        Status: Success (0x00)
zephyr.exe[3885206]: < HCI Command: Host Number of Completed Packets (0x03|0x0035) plen 5                           #88 10.458859
        Num handles: 1
        Handle: 3 Address: DF:A9:FF:F6:B1:1A (OUI DF-A9-FF)
        Count: 1
zephyr.exe[3885206]: < HCI Command: Host Number of Completed Packets (0x03|0x0035) plen 5                           #89 10.458958
        Num handles: 1
        Handle: 3 Address: DF:A9:FF:F6:B1:1A (OUI DF-A9-FF)
        Count: 1
zephyr.exe[3885206]: < ACL Data TX: Handle 3 [1/3] flags 0x00 dlen 9                                                #90 10.458987
      ATT: Find By Type Value Response (0x07) len 4
        Handle range: 0x0021-0x0033
> HCI Event: Number of Completed Packets (0x13) plen 5                                                              #91 10.565979
        Num handles: 1
        Handle: 3 Address: DF:A9:FF:F6:B1:1A (OUI DF-A9-FF)
        Count: 1
        Buffers: 0/3
        #90: len 9 (0 Kb/s)
        Latency: 106 msec (47-167 msec ~106 msec)
> ACL Data RX: Handle 3 flags 0x02 dlen 13                                                                          #92 10.566114
      ATT: Find By Type Value Request (0x06) len 8
        Handle range: 0x0034-0xffff
        Attribute type: Primary Service (0x2800)
          UUID: Object Transfer (0x1825)
zephyr.exe[3885206]: < HCI Command: Host Number of Completed Packets (0x03|0x0035) plen 5                           #93 10.578895
        Num handles: 1
        Handle: 3 Address: DF:A9:FF:F6:B1:1A (OUI DF-A9-FF)
        Count: 1
zephyr.exe[3885206]: < ACL Data TX: Handle 3 [1/3] flags 0x00 dlen 9                                                #94 10.578938
      ATT: Error Response (0x01) len 4
        Find By Type Value Request (0x06)
        Handle: 0x0034
        Error: Attribute Not Found (0x0a)
> HCI Event: Number of Completed Packets (0x13) plen 5                                                              #95 10.740941
        Num handles: 1
        Handle: 3 Address: DF:A9:FF:F6:B1:1A (OUI DF-A9-FF)
        Count: 1
        Buffers: 0/3
        #94: len 9 (0 Kb/s)
        Latency: 162 msec (47-167 msec ~134 msec)
> ACL Data RX: Handle 3 flags 0x02 dlen 11                                                                          #96 10.741142
      ATT: Read By Type Request (0x08) len 6
        Handle range: 0x0021-0x0033
        Attribute type: Characteristic (0x2803)
zephyr.exe[3885206]: < HCI Command: Host Number of Completed Packets (0x03|0x0035) plen 5                           #97 10.758931
        Num handles: 1
        Handle: 3 Address: DF:A9:FF:F6:B1:1A (OUI DF-A9-FF)
        Count: 1
zephyr.exe[3885206]: < ACL Data TX: Handle 3 [1/3] flags 0x00 dlen 20                                               #98 10.758978
      ATT: Read By Type Response (0x09) len 15
        Attribute data length: 7
        Attribute data list: 2 entries
        Handle: 0x0022
        Value[5]: 022300bd2a
            Properties: 0x02
              Read (0x02)
            Value Handle: 0x0023
            Value UUID: OTS Feature (0x2abd)
        Handle: 0x0024
        Value[5]: 0a2500be2a
            Properties: 0x0a
              Read (0x02)
              Write (0x08)
            Value Handle: 0x0025
            Value UUID: Object Name (0x2abe)
> HCI Event: Number of Completed Packets (0x13) plen 5                                                              #99 10.916052
        Num handles: 1
        Handle: 3 Address: DF:A9:FF:F6:B1:1A (OUI DF-A9-FF)
        Count: 1
        Buffers: 0/3
        #98: len 20 (1 Kb/s)
        Latency: 157 msec (47-167 msec ~145 msec)
> ACL Data RX: Handle 3 flags 0x02 dlen 11                                                                         #100 10.916184
      ATT: Read By Type Request (0x08) len 6
        Handle range: 0x0025-0x0033
        Attribute type: Characteristic (0x2803)
zephyr.exe[3885206]: < HCI Command: Host Number of Completed Packets (0x03|0x0035) plen 5                          #101 10.918898
        Num handles: 1
        Handle: 3 Address: DF:A9:FF:F6:B1:1A (OUI DF-A9-FF)
        Count: 1
zephyr.exe[3885206]: < ACL Data TX: Handle 3 [1/3] flags 0x00 dlen 20                                              #102 10.918921
      ATT: Read By Type Response (0x09) len 15
        Attribute data length: 7
        Attribute data list: 2 entries
        Handle: 0x0026
        Value[5]: 022700bf2a
            Properties: 0x02
              Read (0x02)
            Value Handle: 0x0027
            Value UUID: Object Type (0x2abf)
        Handle: 0x0028
        Value[5]: 022900c02a
            Properties: 0x02
              Read (0x02)
            Value Handle: 0x0029
            Value UUID: Object Size (0x2ac0)
> HCI Event: Number of Completed Packets (0x13) plen 5                                                             #103 11.091007
        Num handles: 1
        Handle: 3 Address: DF:A9:FF:F6:B1:1A (OUI DF-A9-FF)
        Count: 1
        Buffers: 0/3
        #102: len 20 (0 Kb/s)
        Latency: 172 msec (47-172 msec ~158 msec)
> ACL Data RX: Handle 3 flags 0x02 dlen 11                                                                         #104 11.091010
      ATT: Read By Type Request (0x08) len 6
        Handle range: 0x0029-0x0033
        Attribute type: Characteristic (0x2803)
zephyr.exe[3885206]: < HCI Command: Host Number of Completed Packets (0x03|0x0035) plen 5                          #105 11.099041
        Num handles: 1
        Handle: 3 Address: DF:A9:FF:F6:B1:1A (OUI DF-A9-FF)
        Count: 1
zephyr.exe[3885206]: < ACL Data TX: Handle 3 [1/3] flags 0x00 dlen 20                                              #106 11.099046
      ATT: Read By Type Response (0x09) len 15
        Attribute data length: 7
        Attribute data list: 2 entries
        Handle: 0x002a
        Value[5]: 022b00c32a
            Properties: 0x02
              Read (0x02)
            Value Handle: 0x002b
            Value UUID: Object ID (0x2ac3)
        Handle: 0x002c
        Value[5]: 022d00c42a
            Properties: 0x02
              Read (0x02)
            Value Handle: 0x002d
            Value UUID: Object Properties (0x2ac4)
> HCI Event: Number of Completed Packets (0x13) plen 5                                                             #107 11.265899
        Num handles: 1
        Handle: 3 Address: DF:A9:FF:F6:B1:1A (OUI DF-A9-FF)
        Count: 1
        Buffers: 0/3
        #106: len 20 (0 Kb/s)
        Latency: 166 msec (47-172 msec ~162 msec)
> ACL Data RX: Handle 3 flags 0x02 dlen 11                                                                         #108 11.266162
      ATT: Read By Type Request (0x08) len 6
        Handle range: 0x002d-0x0033
        Attribute type: Characteristic (0x2803)
zephyr.exe[3885206]: < HCI Command: Host Number of Completed Packets (0x03|0x0035) plen 5                          #109 11.279011
        Num handles: 1
        Handle: 3 Address: DF:A9:FF:F6:B1:1A (OUI DF-A9-FF)
        Count: 1
zephyr.exe[3885206]: < ACL Data TX: Handle 3 [1/3] flags 0x00 dlen 20                                              #110 11.279039
      ATT: Read By Type Response (0x09) len 15
        Attribute data length: 7
        Attribute data list: 2 entries
        Handle: 0x002e
        Value[5]: 282f00c52a
            Properties: 0x28
              Write (0x08)
              Indicate (0x20)
            Value Handle: 0x002f
            Value UUID: Object Action Control Point (0x2ac5)
        Handle: 0x0031
        Value[5]: 283200c62a
            Properties: 0x28
              Write (0x08)
              Indicate (0x20)
            Value Handle: 0x0032
            Value UUID: Object List Control Point (0x2ac6)
zephyr.exe[3885206]: < ACL Data TX: Handle 3 [2/3] flags 0x00 dlen 16                                              #111 11.288889
      LE L2CAP: Connection Parameter Update Request (0x12) ident 1 len 8
        Min interval: 24
        Max interval: 40
        Peripheral latency: 0
        Timeout multiplier: 42
> HCI Event: Number of Completed Packets (0x13) plen 5                                                             #112 11.353941
        Num handles: 1
        Handle: 3 Address: DF:A9:FF:F6:B1:1A (OUI DF-A9-FF)
        Count: 1
        Buffers: 1/3
        #110: len 20 (2 Kb/s)
        Latency: 74 msec (47-172 msec ~118 msec)
> HCI Event: Number of Completed Packets (0x13) plen 5                                                             #113 11.440780
        Num handles: 1
        Handle: 3 Address: DF:A9:FF:F6:B1:1A (OUI DF-A9-FF)
        Count: 1
        Buffers: 0/3
        #111: len 16 (0 Kb/s)
        Latency: 151 msec (47-172 msec ~135 msec)
> ACL Data RX: Handle 3 flags 0x02 dlen 11                                                                         #114 11.441018
      ATT: Read By Type Request (0x08) len 6
        Handle range: 0x0032-0x0033
        Attribute type: Characteristic (0x2803)
> ACL Data RX: Handle 3 flags 0x02 dlen 10                                                                         #115 11.441489
      LE L2CAP: Connection Parameter Update Response (0x13) ident 1 len 2
        Result: Connection Parameters accepted (0x0000)
zephyr.exe[3885206]: < HCI Command: Host Number of Completed Packets (0x03|0x0035) plen 5                          #116 11.458984
        Num handles: 1
        Handle: 3 Address: DF:A9:FF:F6:B1:1A (OUI DF-A9-FF)
        Count: 1
zephyr.exe[3885206]: < ACL Data TX: Handle 3 [1/3] flags 0x00 dlen 9                                               #117 11.458991
      ATT: Error Response (0x01) len 4
        Read By Type Request (0x08)
        Handle: 0x0032
        Error: Attribute Not Found (0x0a)
zephyr.exe[3885206]: < HCI Command: Host Number of Completed Packets (0x03|0x0035) plen 5                          #118 11.458992
        Num handles: 1
        Handle: 3 Address: DF:A9:FF:F6:B1:1A (OUI DF-A9-FF)
        Count: 1
> HCI Event: Number of Completed Packets (0x13) plen 5                                                             #119 11.615993
        Num handles: 1
        Handle: 3 Address: DF:A9:FF:F6:B1:1A (OUI DF-A9-FF)
        Count: 1
        Buffers: 0/3
        #117: len 9 (0 Kb/s)
        Latency: 157 msec (47-172 msec ~146 msec)
> ACL Data RX: Handle 3 flags 0x02 dlen 9                                                                          #120 11.616288
      ATT: Find Information Request (0x04) len 4
        Handle range: 0x0030-0x0030
zephyr.exe[3885206]: < HCI Command: Host Number of Completed Packets (0x03|0x0035) plen 5                          #121 11.618913
        Num handles: 1
        Handle: 3 Address: DF:A9:FF:F6:B1:1A (OUI DF-A9-FF)
        Count: 1
zephyr.exe[3885206]: < ACL Data TX: Handle 3 [1/3] flags 0x00 dlen 10                                              #122 11.618935
      ATT: Find Information Response (0x05) len 5
        Format: UUID-16 (0x01)
        Handle: 0x0030
        UUID: Client Characteristic Configuration (0x2902)
> HCI Event: Number of Completed Packets (0x13) plen 5                                                             #123 11.790920
        Num handles: 1
        Handle: 3 Address: DF:A9:FF:F6:B1:1A (OUI DF-A9-FF)
        Count: 1
        Buffers: 0/3
        #122: len 10 (0 Kb/s)
        Latency: 171 msec (47-172 msec ~159 msec)
> ACL Data RX: Handle 3 flags 0x02 dlen 9                                                                          #124 11.791216
      ATT: Find Information Request (0x04) len 4
        Handle range: 0x0033-0x0033
zephyr.exe[3885206]: < HCI Command: Host Number of Completed Packets (0x03|0x0035) plen 5                          #125 11.799019
        Num handles: 1
        Handle: 3 Address: DF:A9:FF:F6:B1:1A (OUI DF-A9-FF)
        Count: 1
zephyr.exe[3885206]: < ACL Data TX: Handle 3 [1/3] flags 0x00 dlen 10                                              #126 11.799050
      ATT: Find Information Response (0x05) len 5
        Format: UUID-16 (0x01)
        Handle: 0x0033
        UUID: Client Characteristic Configuration (0x2902)
> HCI Event: Number of Completed Packets (0x13) plen 5                                                             #127 11.965895
        Num handles: 1
        Handle: 3 Address: DF:A9:FF:F6:B1:1A (OUI DF-A9-FF)
        Count: 1
        Buffers: 0/3
        #126: len 10 (0 Kb/s)
        Latency: 166 msec (47-172 msec ~162 msec)
> ACL Data RX: Handle 3 flags 0x02 dlen 7                                                                          #128 11.966036
      ATT: Read Request (0x0a) len 2
        Handle: 0x0023
zephyr.exe[3885206]: < HCI Command: Host Number of Completed Packets (0x03|0x0035) plen 5                          #129 11.978995
        Num handles: 1
        Handle: 3 Address: DF:A9:FF:F6:B1:1A (OUI DF-A9-FF)
        Count: 1
zephyr.exe[3885206]: < ACL Data TX: Handle 3 [1/3] flags 0x00 dlen 13                                              #130 11.979001
      ATT: Read Response (0x0b) len 8
        Value[8]: 3701000001000000
> HCI Event: Number of Completed Packets (0x13) plen 5                                                             #131 12.140779
        Num handles: 1
        Handle: 3 Address: DF:A9:FF:F6:B1:1A (OUI DF-A9-FF)
        Count: 1
        Buffers: 0/3
        #130: len 13 (0 Kb/s)
        Latency: 161 msec (47-172 msec ~162 msec)
> ACL Data RX: Handle 3 flags 0x02 dlen 13                                                                         #132 12.141202
      ATT: Find By Type Value Request (0x06) len 8
        Handle range: 0x0001-0xffff
        Attribute type: Primary Service (0x2800)
          UUID: Object Transfer (0x1825)
zephyr.exe[3885206]: < HCI Command: Host Number of Completed Packets (0x03|0x0035) plen 5                          #133 12.159019
        Num handles: 1
        Handle: 3 Address: DF:A9:FF:F6:B1:1A (OUI DF-A9-FF)
        Count: 1
zephyr.exe[3885206]: < ACL Data TX: Handle 3 [1/3] flags 0x00 dlen 9                                               #134 12.159025
      ATT: Find By Type Value Response (0x07) len 4
        Handle range: 0x0021-0x0033
> HCI Event: Number of Completed Packets (0x13) plen 5                                                             #135 12.315919
        Num handles: 1
        Handle: 3 Address: DF:A9:FF:F6:B1:1A (OUI DF-A9-FF)
        Count: 1
        Buffers: 0/3
        #134: len 9 (0 Kb/s)
        Latency: 156 msec (47-172 msec ~159 msec)
> ACL Data RX: Handle 3 flags 0x02 dlen 13                                                                         #136 12.316060
      ATT: Find By Type Value Request (0x06) len 8
        Handle range: 0x0034-0xffff
        Attribute type: Primary Service (0x2800)
          UUID: Object Transfer (0x1825)
zephyr.exe[3885206]: < HCI Command: Host Number of Completed Packets (0x03|0x0035) plen 5                          #137 12.318947
        Num handles: 1
        Handle: 3 Address: DF:A9:FF:F6:B1:1A (OUI DF-A9-FF)
        Count: 1
zephyr.exe[3885206]: < ACL Data TX: Handle 3 [1/3] flags 0x00 dlen 9                                               #138 12.319002
      ATT: Error Response (0x01) len 4
        Find By Type Value Request (0x06)
        Handle: 0x0034
        Error: Attribute Not Found (0x0a)
> HCI Event: Number of Completed Packets (0x13) plen 5                                                             #139 12.490688
        Num handles: 1
        Handle: 3 Address: DF:A9:FF:F6:B1:1A (OUI DF-A9-FF)
        Count: 1
        Buffers: 0/3
        #138: len 9 (0 Kb/s)
        Latency: 171 msec (47-172 msec ~165 msec)
> ACL Data RX: Handle 3 flags 0x02 dlen 11                                                                         #140 12.491045
      ATT: Read By Type Request (0x08) len 6
        Handle range: 0x0021-0x0033
        Attribute type: Characteristic (0x2803)
zephyr.exe[3885206]: < HCI Command: Host Number of Completed Packets (0x03|0x0035) plen 5                          #141 12.498971
        Num handles: 1
        Handle: 3 Address: DF:A9:FF:F6:B1:1A (OUI DF-A9-FF)
        Count: 1
zephyr.exe[3885206]: < ACL Data TX: Handle 3 [1/3] flags 0x00 dlen 20                                              #142 12.498995
      ATT: Read By Type Response (0x09) len 15
        Attribute data length: 7
        Attribute data list: 2 entries
        Handle: 0x0022
        Value[5]: 022300bd2a
            Properties: 0x02
              Read (0x02)
            Value Handle: 0x0023
            Value UUID: OTS Feature (0x2abd)
        Handle: 0x0024
        Value[5]: 0a2500be2a
            Properties: 0x0a
              Read (0x02)
              Write (0x08)
            Value Handle: 0x0025
            Value UUID: Object Name (0x2abe)
> HCI Event: Number of Completed Packets (0x13) plen 5                                                             #143 12.665836
        Num handles: 1
        Handle: 3 Address: DF:A9:FF:F6:B1:1A (OUI DF-A9-FF)
        Count: 1
        Buffers: 0/3
        #142: len 20 (0 Kb/s)
        Latency: 166 msec (47-172 msec ~166 msec)
> ACL Data RX: Handle 3 flags 0x02 dlen 11                                                                         #144 12.666803
      ATT: Read By Type Request (0x08) len 6
        Handle range: 0x0025-0x0033
        Attribute type: Characteristic (0x2803)
zephyr.exe[3885206]: < HCI Command: Host Number of Completed Packets (0x03|0x0035) plen 5                          #145 12.679026
        Num handles: 1
        Handle: 3 Address: DF:A9:FF:F6:B1:1A (OUI DF-A9-FF)
        Count: 1
zephyr.exe[3885206]: < ACL Data TX: Handle 3 [1/3] flags 0x00 dlen 20                                              #146 12.679032
      ATT: Read By Type Response (0x09) len 15
        Attribute data length: 7
        Attribute data list: 2 entries
        Handle: 0x0026
        Value[5]: 022700bf2a
            Properties: 0x02
              Read (0x02)
            Value Handle: 0x0027
            Value UUID: Object Type (0x2abf)
        Handle: 0x0028
        Value[5]: 022900c02a
            Properties: 0x02
              Read (0x02)
            Value Handle: 0x0029
            Value UUID: Object Size (0x2ac0)
> HCI Event: Number of Completed Packets (0x13) plen 5                                                             #147 12.840962
        Num handles: 1
        Handle: 3 Address: DF:A9:FF:F6:B1:1A (OUI DF-A9-FF)
        Count: 1
        Buffers: 0/3
        #146: len 20 (0 Kb/s)
        Latency: 161 msec (47-172 msec ~164 msec)
> ACL Data RX: Handle 3 flags 0x02 dlen 11                                                                         #148 12.841066
      ATT: Read By Type Request (0x08) len 6
        Handle range: 0x0029-0x0033
        Attribute type: Characteristic (0x2803)
zephyr.exe[3885206]: < HCI Command: Host Number of Completed Packets (0x03|0x0035) plen 5                          #149 12.858993
        Num handles: 1
        Handle: 3 Address: DF:A9:FF:F6:B1:1A (OUI DF-A9-FF)
        Count: 1
zephyr.exe[3885206]: < ACL Data TX: Handle 3 [1/3] flags 0x00 dlen 20                                              #150 12.858999
      ATT: Read By Type Response (0x09) len 15
        Attribute data length: 7
        Attribute data list: 2 entries
        Handle: 0x002a
        Value[5]: 022b00c32a
            Properties: 0x02
              Read (0x02)
            Value Handle: 0x002b
            Value UUID: Object ID (0x2ac3)
        Handle: 0x002c
        Value[5]: 022d00c42a
            Properties: 0x02
              Read (0x02)
            Value Handle: 0x002d
            Value UUID: Object Properties (0x2ac4)
> HCI Event: Number of Completed Packets (0x13) plen 5                                                             #151 13.015979
        Num handles: 1
        Handle: 3 Address: DF:A9:FF:F6:B1:1A (OUI DF-A9-FF)
        Count: 1
        Buffers: 0/3
        #150: len 20 (1 Kb/s)
        Latency: 156 msec (47-172 msec ~160 msec)
> ACL Data RX: Handle 3 flags 0x02 dlen 11                                                                         #152 13.015982
      ATT: Read By Type Request (0x08) len 6
        Handle range: 0x002d-0x0033
        Attribute type: Characteristic (0x2803)
zephyr.exe[3885206]: < HCI Command: Host Number of Completed Packets (0x03|0x0035) plen 5                          #153 13.018951
        Num handles: 1
        Handle: 3 Address: DF:A9:FF:F6:B1:1A (OUI DF-A9-FF)
        Count: 1
zephyr.exe[3885206]: < ACL Data TX: Handle 3 [1/3] flags 0x00 dlen 20                                              #154 13.019018
      ATT: Read By Type Response (0x09) len 15
        Attribute data length: 7
        Attribute data list: 2 entries
        Handle: 0x002e
        Value[5]: 282f00c52a
            Properties: 0x28
              Write (0x08)
              Indicate (0x20)
            Value Handle: 0x002f
            Value UUID: Object Action Control Point (0x2ac5)
        Handle: 0x0031
        Value[5]: 283200c62a
            Properties: 0x28
              Write (0x08)
              Indicate (0x20)
            Value Handle: 0x0032
            Value UUID: Object List Control Point (0x2ac6)
> HCI Event: Number of Completed Packets (0x13) plen 5                                                             #155 13.190670
        Num handles: 1
        Handle: 3 Address: DF:A9:FF:F6:B1:1A (OUI DF-A9-FF)
        Count: 1
        Buffers: 0/3
        #154: len 20 (0 Kb/s)
        Latency: 171 msec (47-172 msec ~166 msec)
> ACL Data RX: Handle 3 flags 0x02 dlen 11                                                                         #156 13.191059
      ATT: Read By Type Request (0x08) len 6
        Handle range: 0x0032-0x0033
        Attribute type: Characteristic (0x2803)
zephyr.exe[3885206]: < HCI Command: Host Number of Completed Packets (0x03|0x0035) plen 5                          #157 13.199029
        Num handles: 1
        Handle: 3 Address: DF:A9:FF:F6:B1:1A (OUI DF-A9-FF)
        Count: 1
zephyr.exe[3885206]: < ACL Data TX: Handle 3 [1/3] flags 0x00 dlen 9                                               #158 13.199034
      ATT: Error Response (0x01) len 4
        Read By Type Request (0x08)
        Handle: 0x0032
        Error: Attribute Not Found (0x0a)
> HCI Event: Number of Completed Packets (0x13) plen 5                                                             #159 13.366045
        Num handles: 1
        Handle: 3 Address: DF:A9:FF:F6:B1:1A (OUI DF-A9-FF)
        Count: 1
        Buffers: 0/3
        #158: len 9 (0 Kb/s)
        Latency: 167 msec (47-172 msec ~166 msec)
> ACL Data RX: Handle 3 flags 0x02 dlen 9                                                                          #160 13.366048
      ATT: Find Information Request (0x04) len 4
        Handle range: 0x0030-0x0030
zephyr.exe[3885206]: < HCI Command: Host Number of Completed Packets (0x03|0x0035) plen 5                          #161 13.378954
        Num handles: 1
        Handle: 3 Address: DF:A9:FF:F6:B1:1A (OUI DF-A9-FF)
        Count: 1
zephyr.exe[3885206]: < ACL Data TX: Handle 3 [1/3] flags 0x00 dlen 10                                              #162 13.378970
      ATT: Find Information Response (0x05) len 5
        Format: UUID-16 (0x01)
        Handle: 0x0030
        UUID: Client Characteristic Configuration (0x2902)
> HCI Event: Number of Completed Packets (0x13) plen 5                                                             #163 13.540831
        Num handles: 1
        Handle: 3 Address: DF:A9:FF:F6:B1:1A (OUI DF-A9-FF)
        Count: 1
        Buffers: 0/3
        #162: len 10 (0 Kb/s)
        Latency: 161 msec (47-172 msec ~164 msec)
> ACL Data RX: Handle 3 flags 0x02 dlen 9                                                                          #164 13.541179
      ATT: Find Information Request (0x04) len 4
        Handle range: 0x0033-0x0033
zephyr.exe[3885206]: < HCI Command: Host Number of Completed Packets (0x03|0x0035) plen 5                          #165 13.558989
        Num handles: 1
        Handle: 3 Address: DF:A9:FF:F6:B1:1A (OUI DF-A9-FF)
        Count: 1
zephyr.exe[3885206]: < ACL Data TX: Handle 3 [1/3] flags 0x00 dlen 10                                              #166 13.558996
      ATT: Find Information Response (0x05) len 5
        Format: UUID-16 (0x01)
        Handle: 0x0033
        UUID: Client Characteristic Configuration (0x2902)
> HCI Event: Number of Completed Packets (0x13) plen 5                                                             #167 13.715944
        Num handles: 1
        Handle: 3 Address: DF:A9:FF:F6:B1:1A (OUI DF-A9-FF)
        Count: 1
        Buffers: 0/3
        #166: len 10 (0 Kb/s)
        Latency: 156 msec (47-172 msec ~160 msec)
> ACL Data RX: Handle 3 flags 0x02 dlen 7                                                                          #168 13.715947
      ATT: Read Request (0x0a) len 2
        Handle: 0x0023
zephyr.exe[3885206]: < HCI Command: Host Number of Completed Packets (0x03|0x0035) plen 5                          #169 13.719005
        Num handles: 1
        Handle: 3 Address: DF:A9:FF:F6:B1:1A (OUI DF-A9-FF)
        Count: 1
zephyr.exe[3885206]: < ACL Data TX: Handle 3 [1/3] flags 0x00 dlen 13                                              #170 13.719012
      ATT: Read Response (0x0b) len 8
        Value[8]: 3701000001000000
> HCI Event: Number of Completed Packets (0x13) plen 5                                                             #171 13.890829
        Num handles: 1
        Handle: 3 Address: DF:A9:FF:F6:B1:1A (OUI DF-A9-FF)
        Count: 1
        Buffers: 0/3
        #170: len 13 (0 Kb/s)
        Latency: 171 msec (47-172 msec ~166 msec)
> ACL Data RX: Handle 3 flags 0x02 dlen 9                                                                          #172 13.890871
      ATT: Write Request (0x12) len 4
        Handle: 0x0030
          Data[2]: 0000
zephyr.exe[3885206]: < HCI Command: Host Number of Completed Packets (0x03|0x0035) plen 5                          #173 13.899083
        Num handles: 1
        Handle: 3 Address: DF:A9:FF:F6:B1:1A (OUI DF-A9-FF)
        Count: 1
zephyr.exe[3885206]: < ACL Data TX: Handle 3 [1/3] flags 0x00 dlen 5                                               #174 13.899088
      ATT: Write Response (0x13) len 0
> HCI Event: Number of Completed Packets (0x13) plen 5                                                             #175 14.065794
        Num handles: 1
        Handle: 3 Address: DF:A9:FF:F6:B1:1A (OUI DF-A9-FF)
        Count: 1
        Buffers: 0/3
        #174: len 5 (0 Kb/s)
        Latency: 166 msec (47-172 msec ~166 msec)
> ACL Data RX: Handle 3 flags 0x02 dlen 9                                                                          #176 14.065978
      ATT: Write Request (0x12) len 4
        Handle: 0x0030
          Data[2]: 0200
zephyr.exe[3885206]: < HCI Command: Host Number of Completed Packets (0x03|0x0035) plen 5                          #177 14.079009
        Num handles: 1
        Handle: 3 Address: DF:A9:FF:F6:B1:1A (OUI DF-A9-FF)
        Count: 1
zephyr.exe[3885206]: < ACL Data TX: Handle 3 [1/3] flags 0x00 dlen 5                                               #178 14.079024
      ATT: Write Response (0x13) len 0
> HCI Event: Number of Completed Packets (0x13) plen 5                                                             #179 14.240790
        Num handles: 1
        Handle: 3 Address: DF:A9:FF:F6:B1:1A (OUI DF-A9-FF)
        Count: 1
        Buffers: 0/3
        #178: len 5 (0 Kb/s)
        Latency: 161 msec (47-172 msec ~164 msec)
> ACL Data RX: Handle 3 flags 0x02 dlen 9                                                                          #180 14.241066
      ATT: Write Request (0x12) len 4
        Handle: 0x0033
          Data[2]: 0000
zephyr.exe[3885206]: < HCI Command: Host Number of Completed Packets (0x03|0x0035) plen 5                          #181 14.258979
        Num handles: 1
        Handle: 3 Address: DF:A9:FF:F6:B1:1A (OUI DF-A9-FF)
        Count: 1
zephyr.exe[3885206]: < ACL Data TX: Handle 3 [1/3] flags 0x00 dlen 5                                               #182 14.259001
      ATT: Write Response (0x13) len 0
> HCI Event: Number of Completed Packets (0x13) plen 5                                                             #183 14.416069
        Num handles: 1
        Handle: 3 Address: DF:A9:FF:F6:B1:1A (OUI DF-A9-FF)
        Count: 1
        Buffers: 0/3
        #182: len 5 (0 Kb/s)
        Latency: 157 msec (47-172 msec ~160 msec)
> ACL Data RX: Handle 3 flags 0x02 dlen 9                                                                          #184 14.416072
      ATT: Write Request (0x12) len 4
        Handle: 0x0033
          Data[2]: 0200
zephyr.exe[3885206]: < HCI Command: Host Number of Completed Packets (0x03|0x0035) plen 5                          #185 14.419004
        Num handles: 1
        Handle: 3 Address: DF:A9:FF:F6:B1:1A (OUI DF-A9-FF)
        Count: 1
zephyr.exe[3885206]: < ACL Data TX: Handle 3 [1/3] flags 0x00 dlen 5                                               #186 14.419011
      ATT: Write Response (0x13) len 0
> HCI Event: Number of Completed Packets (0x13) plen 5                                                             #187 14.590896
        Num handles: 1
        Handle: 3 Address: DF:A9:FF:F6:B1:1A (OUI DF-A9-FF)
        Count: 1
        Buffers: 0/3
        #186: len 5 (0 Kb/s)
        Latency: 171 msec (47-172 msec ~166 msec)
> ACL Data RX: Handle 3 flags 0x02 dlen 14                                                                         #188 14.591092
      ATT: Write Request (0x12) len 9
        Handle: 0x002f
          Data[7]: 0164000000b17f
zephyr.exe[3885206]: < HCI Command: Host Number of Completed Packets (0x03|0x0035) plen 5                          #189 14.599021
        Num handles: 1
        Handle: 3 Address: DF:A9:FF:F6:B1:1A (OUI DF-A9-FF)
        Count: 1
zephyr.exe[3885206]: < ACL Data TX: Handle 3 [1/3] flags 0x00 dlen 5                                               #190 14.599032
      ATT: Write Response (0x13) len 0
zephyr.exe[3885206]: < ACL Data TX: Handle 3 [2/3] flags 0x00 dlen 10                                              #191 14.599047
      ATT: Handle Value Indication (0x1d) len 5
        Handle: 0x002f
          Data[3]: 600101
> HCI Event: Number of Completed Packets (0x13) plen 5                                                             #192 14.678944
        Num handles: 1
        Handle: 3 Address: DF:A9:FF:F6:B1:1A (OUI DF-A9-FF)
        Count: 1
        Buffers: 1/3
        #190: len 5 (0 Kb/s)
        Latency: 79 msec (47-172 msec ~123 msec)
> HCI Event: Number of Completed Packets (0x13) plen 5                                                             #193 14.765930
        Num handles: 1
        Handle: 3 Address: DF:A9:FF:F6:B1:1A (OUI DF-A9-FF)
        Count: 1
        Buffers: 0/3
        #191: len 10 (0 Kb/s)
        Latency: 166 msec (47-172 msec ~144 msec)
> ACL Data RX: Handle 3 flags 0x02 dlen 5                                                                          #194 14.765932
      ATT: Handle Value Confirmation (0x1e) len 0
> ACL Data RX: Handle 3 flags 0x02 dlen 7                                                                          #195 14.766633
      ATT: Read Request (0x0a) len 2
        Handle: 0x0025
zephyr.exe[3885206]: < HCI Command: Host Number of Completed Packets (0x03|0x0035) plen 5                          #196 14.778983
        Num handles: 1
        Handle: 3 Address: DF:A9:FF:F6:B1:1A (OUI DF-A9-FF)
        Count: 1
zephyr.exe[3885206]: < HCI Command: Host Number of Completed Packets (0x03|0x0035) plen 5                          #197 14.779013
        Num handles: 1
        Handle: 3 Address: DF:A9:FF:F6:B1:1A (OUI DF-A9-FF)
        Count: 1
zephyr.exe[3885206]: < ACL Data TX: Handle 3 [1/3] flags 0x00 dlen 5                                               #198 14.779026
      ATT: Read Response (0x0b) len 0
        Value[0]: 
> HCI Event: Number of Completed Packets (0x13) plen 5                                                             #199 14.940942
        Num handles: 1
        Handle: 3 Address: DF:A9:FF:F6:B1:1A (OUI DF-A9-FF)
        Count: 1
        Buffers: 0/3
        #198: len 5 (0 Kb/s)
        Latency: 161 msec (47-172 msec ~153 msec)
> ACL Data RX: Handle 3 flags 0x02 dlen 7                                                                          #200 14.941148
      ATT: Read Request (0x0a) len 2
        Handle: 0x0027
zephyr.exe[3885206]: < HCI Command: Host Number of Completed Packets (0x03|0x0035) plen 5                          #201 14.959017
        Num handles: 1
        Handle: 3 Address: DF:A9:FF:F6:B1:1A (OUI DF-A9-FF)
        Count: 1
zephyr.exe[3885206]: < ACL Data TX: Handle 3 [1/3] flags 0x00 dlen 7                                               #202 14.959024
      ATT: Read Response (0x0b) len 2
        Value[2]: b17f
> HCI Event: Number of Completed Packets (0x13) plen 5                                                             #203 15.115894
        Num handles: 1
        Handle: 3 Address: DF:A9:FF:F6:B1:1A (OUI DF-A9-FF)
        Count: 1
        Buffers: 0/3
        #202: len 7 (0 Kb/s)
        Latency: 156 msec (47-172 msec ~155 msec)
> ACL Data RX: Handle 3 flags 0x02 dlen 7                                                                          #204 15.115963
      ATT: Read Request (0x0a) len 2
        Handle: 0x0029
zephyr.exe[3885206]: < HCI Command: Host Number of Completed Packets (0x03|0x0035) plen 5                          #205 15.118959
        Num handles: 1
        Handle: 3 Address: DF:A9:FF:F6:B1:1A (OUI DF-A9-FF)
        Count: 1
zephyr.exe[3885206]: < ACL Data TX: Handle 3 [1/3] flags 0x00 dlen 13                                              #206 15.119007
      ATT: Read Response (0x0b) len 8
        Value[8]: 0000000064000000
> HCI Event: Number of Completed Packets (0x13) plen 5                                                             #207 15.291243
        Num handles: 1
        Handle: 3 Address: DF:A9:FF:F6:B1:1A (OUI DF-A9-FF)
        Count: 1
        Buffers: 0/3
        #206: len 13 (0 Kb/s)
        Latency: 172 msec (47-172 msec ~163 msec)
> ACL Data RX: Handle 3 flags 0x02 dlen 7                                                                          #208 15.291246
      ATT: Read Request (0x0a) len 2
        Handle: 0x002d
zephyr.exe[3885206]: < HCI Command: Host Number of Completed Packets (0x03|0x0035) plen 5                          #209 15.299063
        Num handles: 1
        Handle: 3 Address: DF:A9:FF:F6:B1:1A (OUI DF-A9-FF)
        Count: 1
zephyr.exe[3885206]: < ACL Data TX: Handle 3 [1/3] flags 0x00 dlen 9                                               #210 15.299069
      ATT: Read Response (0x0b) len 4
        Value[4]: 4d000000
> HCI Event: Number of Completed Packets (0x13) plen 5                                                             #211 15.465739
        Num handles: 1
        Handle: 3 Address: DF:A9:FF:F6:B1:1A (OUI DF-A9-FF)
        Count: 1
        Buffers: 0/3
        #210: len 9 (0 Kb/s)
        Latency: 166 msec (47-172 msec ~165 msec)
> ACL Data RX: Handle 3 flags 0x02 dlen 7                                                                          #212 15.465813
      ATT: Read Request (0x0a) len 2
        Handle: 0x002b
zephyr.exe[3885206]: < HCI Command: Host Number of Completed Packets (0x03|0x0035) plen 5                          #213 15.479000
        Num handles: 1
        Handle: 3 Address: DF:A9:FF:F6:B1:1A (OUI DF-A9-FF)
        Count: 1
zephyr.exe[3885206]: < ACL Data TX: Handle 3 [1/3] flags 0x00 dlen 11                                              #214 15.479006
      ATT: Read Response (0x0b) len 6
        Value[6]: 010100000000
> HCI Event: Number of Completed Packets (0x13) plen 5                                                             #215 15.640697
        Num handles: 1
        Handle: 3 Address: DF:A9:FF:F6:B1:1A (OUI DF-A9-FF)
        Count: 1
        Buffers: 0/3
        #214: len 11 (0 Kb/s)
        Latency: 161 msec (47-172 msec ~163 msec)
> HCI Event: Disconnect Complete (0x05) plen 4                                                                     #216 15.728639
        Status: Success (0x00)
        Handle: 3 Address: DF:A9:FF:F6:B1:1A (OUI DF-A9-FF)
        Reason: Remote User Terminated Connection (0x13)
zephyr.exe[3885206]: < HCI Command: LE Set Extended Advertising Parameters (0x08|0x0036) plen 25                   #217 16.901083
        Handle: 0x00
        Properties: 0x0013
          Connectable
          Scannable
          Use legacy advertising PDUs: ADV_IND
        Min advertising interval: 100.000 msec (0x00a0)
        Max advertising interval: 150.000 msec (0x00f0)
        Channel map: 37, 38, 39 (0x07)
        Own address type: Random (0x01)
        Peer address type: Public (0x00)
        Peer address: 00:00:00:00:00:00 (OUI 00-00-00)
        Filter policy: Allow Scan Request from Any, Allow Connect Request from Any (0x00)
        TX power: Host has no preference (0x7f)
        Primary PHY: LE 1M (0x01)
        Secondary max skip: 0x00
        Secondary PHY: LE 1M (0x01)
        SID: 0x00
        Scan request notifications: Disabled (0x00)
> HCI Event: Command Complete (0x0e) plen 5                                                                        #218 16.902133
      LE Set Extended Advertising Parameters (0x08|0x0036) ncmd 1
        Status: Success (0x00)
        TX power (selected): 0 dbm (0x00)
zephyr.exe[3885206]: < HCI Command: LE Set Advertising Set Random Address (0x08|0x0035) plen 7                     #219 16.919613
        Advertising handle: 0x00
        Advertising random address: D5:B6:CC:31:DB:3B (Static)
> HCI Event: Command Complete (0x0e) plen 4                                                                        #220 16.920524
      LE Set Advertising Set Random Address (0x08|0x0035) ncmd 1
        Status: Success (0x00)
zephyr.exe[3885206]: < HCI Command: LE Set Extended Advertising Data (0x08|0x0037) plen 22                         #221 16.938817
        Handle: 0x00
        Operation: Complete extended advertising data (0x03)
        Fragment preference: Minimize fragmentation (0x01)
        Data length: 0x12
        Flags: 0x04
          BR/EDR Not Supported
        Name (complete): Tester_F6B11A
> HCI Event: Command Complete (0x0e) plen 4                                                                        #222 16.939790
      LE Set Extended Advertising Data (0x08|0x0037) ncmd 1
        Status: Success (0x00)
zephyr.exe[3885206]: < HCI Command: LE Set Extended Scan Response Data (0x08|0x0038) plen 4                        #223 16.958818
        Handle: 0x00
        Operation: Complete scan response data (0x03)
        Fragment preference: Minimize fragmentation (0x01)
        Data length: 0x00
> HCI Event: Command Complete (0x0e) plen 4                                                                        #224 16.959734
      LE Set Extended Scan Response Data (0x08|0x0038) ncmd 1
        Status: Success (0x00)
zephyr.exe[3885206]: < HCI Command: LE Set Extended Advertising Enable (0x08|0x0039) plen 6                        #225 16.978820
        Extended advertising: Enabled (0x01)
        Number of sets: 1 (0x01)
        Entry 0
          Handle: 0x00
          Duration: 0 ms (0x00)
          Max ext adv events: 0
> HCI Event: Command Complete (0x0e) plen 4                                                                        #226 16.979819
      LE Set Extended Advertising Enable (0x08|0x0039) ncmd 1
        Status: Success (0x00)
> HCI Event: LE Meta Event (0x3e) plen 31                                                                          #227 17.296772
      LE Enhanced Connection Complete (0x0a)
        Status: Success (0x00)
        Handle: 21
        Role: Peripheral (0x01)
        Peer address type: Public (0x00)
        Peer address: DF:A9:FF:F6:B1:1A (OUI DF-A9-FF)
        Local resolvable private address: 00:00:00:00:00:00 (Non-Resolvable)
        Peer resolvable private address: 00:00:00:00:00:00 (Non-Resolvable)
        Connection interval: 87.50 msec (0x0046)
        Connection latency: 0 (0x0000)
        Supervision timeout: 20000 msec (0x07d0)
        Central clock accuracy: 0x01
> HCI Event: LE Meta Event (0x3e) plen 6                                                                           #228 17.296877
      LE Advertising Set Terminated (0x12)
        Status: Success (0x00)
        Handle: 0
        Connection handle: 21
        Number of completed extended advertising events: 0
zephyr.exe[3885206]: < HCI Command: LE Read Remote Used Features (0x08|0x0016) plen 2                              #229 17.299036
        Handle: 21 Address: DF:A9:FF:F6:B1:1A (OUI DF-A9-FF)
> HCI Event: Command Status (0x0f) plen 4                                                                          #230 17.299829
      LE Read Remote Used Features (0x08|0x0016) ncmd 1
        Status: Success (0x00)
> HCI Event: LE Meta Event (0x3e) plen 12                                                                          #231 17.560922
      LE Read Remote Used Features (0x04)
        Status: Success (0x00)
        Handle: 21 Address: DF:A9:FF:F6:B1:1A (OUI DF-A9-FF)
        Features: 0x2d 0x49 0x00 0xf7 0x67 0xd8 0x00 0x00
          LE Encryption
          Extended Reject Indication
          Peripheral-initiated Features Exchange
          LE Data Packet Length Extension
          LE 2M PHY
          LE Coded PHY
          Channel Selection Algorithm #2
          Periodic Advertising Sync Transfer - Sender
          Periodic Advertising Sync Transfer - Recipient
          Sleep Clock Accuracy Updates
          Connected Isochronous Stream - Central
          Connected Isochronous Stream - Peripheral
          Isochronous Broadcaster
          Synchronized Receiver
          Connected Isochronous Stream (Host Support)
          LE Power Control Request
          LE Power Control Request
          Connection Subrating
          Connection Subrating (Host Support)
          Unknown features (0x0000d80000000000)
> HCI Event: LE Meta Event (0x3e) plen 13                                                                          #232 20.098820
      LE Long Term Key Request (0x05)
        Handle: 21 Address: DF:A9:FF:F6:B1:1A (OUI DF-A9-FF)
        Random number: 0x84c81ed264dab3d8
        Encrypted diversifier: 0x825e
zephyr.exe[3885206]: < HCI Command: LE Long Term Key Request Reply (0x08|0x001a) plen 18                           #233 20.098994
        Handle: 21 Address: DF:A9:FF:F6:B1:1A (OUI DF-A9-FF)
        Long term key[16]: 5da095555cc64d02679f89a05211af56
> HCI Event: Command Complete (0x0e) plen 6                                                                        #234 20.099816
      LE Long Term Key Request Reply (0x08|0x001a) ncmd 1
        Status: Success (0x00)
        Handle: 21 Address: DF:A9:FF:F6:B1:1A (OUI DF-A9-FF)
> HCI Event: Encryption Change (0x08) plen 4                                                                       #235 20.535432
        Status: Success (0x00)
        Handle: 21 Address: DF:A9:FF:F6:B1:1A (OUI DF-A9-FF)
        Encryption: Enabled with AES-CCM (0x01)
> ACL Data RX: Handle 21 flags 0x02 dlen 9                                                                         #236 20.623218
      ATT: Write Request (0x12) len 4
        Handle: 0x0033
          Data[2]: 0000
zephyr.exe[3885206]: < HCI Command: Host Number of Completed Packets (0x03|0x0035) plen 5                          #237 20.639069
        Num handles: 1
        Handle: 21 Address: DF:A9:FF:F6:B1:1A (OUI DF-A9-FF)
        Count: 1
zephyr.exe[3885206]: < ACL Data TX: Handle 21 [1/3] flags 0x00 dlen 5                                              #238 20.639075
      ATT: Write Response (0x13) len 0
> HCI Event: Number of Completed Packets (0x13) plen 5                                                             #239 20.798300
        Num handles: 1
        Handle: 21 Address: DF:A9:FF:F6:B1:1A (OUI DF-A9-FF)
        Count: 1
        Buffers: 0/3
        #238: len 5 (0 Kb/s)
        Latency: 159 msec (159-159 msec ~159 msec)
> ACL Data RX: Handle 21 flags 0x02 dlen 9                                                                         #240 20.798546
      ATT: Write Request (0x12) len 4
        Handle: 0x0033
          Data[2]: 0200
zephyr.exe[3885206]: < HCI Command: Host Number of Completed Packets (0x03|0x0035) plen 5                          #241 20.799038
        Num handles: 1
        Handle: 21 Address: DF:A9:FF:F6:B1:1A (OUI DF-A9-FF)
        Count: 1
zephyr.exe[3885206]: < ACL Data TX: Handle 21 [1/3] flags 0x00 dlen 5                                              #242 20.799043
      ATT: Write Response (0x13) len 0
> HCI Event: Number of Completed Packets (0x13) plen 5                                                             #243 20.972901
        Num handles: 1
        Handle: 21 Address: DF:A9:FF:F6:B1:1A (OUI DF-A9-FF)
        Count: 1
        Buffers: 0/3
        #242: len 5 (0 Kb/s)
        Latency: 173 msec (159-173 msec ~166 msec)
> ACL Data RX: Handle 21 flags 0x02 dlen 8                                                                         #244 20.973201
      ATT: Write Request (0x12) len 3
        Handle: 0x0032
          Data[1]: 01
zephyr.exe[3885206]: < HCI Command: Host Number of Completed Packets (0x03|0x0035) plen 5                          #245 20.979057
        Num handles: 1
        Handle: 21 Address: DF:A9:FF:F6:B1:1A (OUI DF-A9-FF)
        Count: 1
zephyr.exe[3885206]: < ACL Data TX: Handle 21 [1/3] flags 0x00 dlen 5                                              #246 20.979063
      ATT: Write Response (0x13) len 0
zephyr.exe[3885206]: < ACL Data TX: Handle 21 [2/3] flags 0x00 dlen 10                                             #247 20.979064
      ATT: Handle Value Indication (0x1d) len 5
        Handle: 0x0032
          Data[3]: 700101
> HCI Event: Number of Completed Packets (0x13) plen 5                                                             #248 21.060850
        Num handles: 1
        Handle: 21 Address: DF:A9:FF:F6:B1:1A (OUI DF-A9-FF)
        Count: 1
        Buffers: 1/3
        #246: len 5 (0 Kb/s)
        Latency: 81 msec (81-173 msec ~124 msec)
> HCI Event: Number of Completed Packets (0x13) plen 5                                                             #249 21.147958
        Num handles: 1
        Handle: 21 Address: DF:A9:FF:F6:B1:1A (OUI DF-A9-FF)
        Count: 1
        Buffers: 0/3
        #247: len 10 (0 Kb/s)
        Latency: 168 msec (81-173 msec ~146 msec)
> ACL Data RX: Handle 21 flags 0x02 dlen 5                                                                         #250 21.147960
      ATT: Handle Value Confirmation (0x1e) len 0
> ACL Data RX: Handle 21 flags 0x02 dlen 7                                                                         #251 21.148410
      ATT: Read Request (0x0a) len 2
        Handle: 0x0025
zephyr.exe[3885206]: < HCI Command: Host Number of Completed Packets (0x03|0x0035) plen 5                          #252 21.159088
        Num handles: 1
        Handle: 21 Address: DF:A9:FF:F6:B1:1A (OUI DF-A9-FF)
        Count: 1
zephyr.exe[3885206]: < HCI Command: Host Number of Completed Packets (0x03|0x0035) plen 5                          #253 21.159094
        Num handles: 1
        Handle: 21 Address: DF:A9:FF:F6:B1:1A (OUI DF-A9-FF)
        Count: 1
zephyr.exe[3885206]: < ACL Data TX: Handle 21 [1/3] flags 0x00 dlen 14                                             #254 21.159413
      ATT: Read Response (0x0b) len 9
        Value[9]: 4469726563746f7279
> HCI Event: Number of Completed Packets (0x13) plen 5                                                             #255 21.322953
        Num handles: 1
        Handle: 21 Address: DF:A9:FF:F6:B1:1A (OUI DF-A9-FF)
        Count: 1
        Buffers: 0/3
        #254: len 14 (0 Kb/s)
        Latency: 163 msec (81-173 msec ~155 msec)
> ACL Data RX: Handle 21 flags 0x02 dlen 7                                                                         #256 21.323371
      ATT: Read Request (0x0a) len 2
        Handle: 0x0027
zephyr.exe[3885206]: < HCI Command: Host Number of Completed Packets (0x03|0x0035) plen 5                          #257 21.339023
        Num handles: 1
        Handle: 21 Address: DF:A9:FF:F6:B1:1A (OUI DF-A9-FF)
        Count: 1
zephyr.exe[3885206]: < ACL Data TX: Handle 21 [1/3] flags 0x00 dlen 7                                              #258 21.339029
      ATT: Read Response (0x0b) len 2
        Value[2]: cb2a
> HCI Event: Number of Completed Packets (0x13) plen 5                                                             #259 21.497880
        Num handles: 1
        Handle: 21 Address: DF:A9:FF:F6:B1:1A (OUI DF-A9-FF)
        Count: 1
        Buffers: 0/3
        #258: len 7 (0 Kb/s)
        Latency: 158 msec (81-173 msec ~156 msec)
> ACL Data RX: Handle 21 flags 0x02 dlen 7                                                                         #260 21.497964
      ATT: Read Request (0x0a) len 2
        Handle: 0x0029
zephyr.exe[3885206]: < HCI Command: Host Number of Completed Packets (0x03|0x0035) plen 5                          #261 21.499038
        Num handles: 1
        Handle: 21 Address: DF:A9:FF:F6:B1:1A (OUI DF-A9-FF)
        Count: 1
zephyr.exe[3885206]: < ACL Data TX: Handle 21 [1/3] flags 0x00 dlen 13                                             #262 21.499054
      ATT: Read Response (0x0b) len 8
        Value[8]: 4d0000005c030000
> HCI Event: Number of Completed Packets (0x13) plen 5                                                             #263 21.672902
        Num handles: 1
        Handle: 21 Address: DF:A9:FF:F6:B1:1A (OUI DF-A9-FF)
        Count: 1
        Buffers: 0/3
        #262: len 13 (0 Kb/s)
        Latency: 173 msec (81-173 msec ~165 msec)
> ACL Data RX: Handle 21 flags 0x02 dlen 7                                                                         #264 21.672965
      ATT: Read Request (0x0a) len 2
        Handle: 0x002d
zephyr.exe[3885206]: < HCI Command: Host Number of Completed Packets (0x03|0x0035) plen 5                          #265 21.679071
        Num handles: 1
        Handle: 21 Address: DF:A9:FF:F6:B1:1A (OUI DF-A9-FF)
        Count: 1
zephyr.exe[3885206]: < ACL Data TX: Handle 21 [1/3] flags 0x00 dlen 9                                              #266 21.679139
      ATT: Read Response (0x0b) len 4
        Value[4]: 04000000
> HCI Event: Number of Completed Packets (0x13) plen 5                                                             #267 21.847784
        Num handles: 1
        Handle: 21 Address: DF:A9:FF:F6:B1:1A (OUI DF-A9-FF)
        Count: 1
        Buffers: 0/3
        #266: len 9 (0 Kb/s)
        Latency: 168 msec (81-173 msec ~167 msec)
> ACL Data RX: Handle 21 flags 0x02 dlen 7                                                                         #268 21.847859
      ATT: Read Request (0x0a) len 2
        Handle: 0x002b
zephyr.exe[3885206]: < HCI Command: Host Number of Completed Packets (0x03|0x0035) plen 5                          #269 21.859009
        Num handles: 1
        Handle: 21 Address: DF:A9:FF:F6:B1:1A (OUI DF-A9-FF)
        Count: 1
zephyr.exe[3885206]: < ACL Data TX: Handle 21 [1/3] flags 0x00 dlen 11                                             #270 21.859023
      ATT: Read Response (0x0b) len 6
        Value[6]: 000000000000
> HCI Event: Number of Completed Packets (0x13) plen 5                                                             #271 22.022849
        Num handles: 1
        Handle: 21 Address: DF:A9:FF:F6:B1:1A (OUI DF-A9-FF)
        Count: 1
        Buffers: 0/3
        #270: len 11 (0 Kb/s)
        Latency: 163 msec (81-173 msec ~165 msec)
> ACL Data RX: Handle 21 flags 0x02 dlen 8                                                                         #272 22.023192
      ATT: Write Request (0x12) len 3
        Handle: 0x0032
          Data[1]: 04
zephyr.exe[3885206]: < HCI Command: Host Number of Completed Packets (0x03|0x0035) plen 5                          #273 22.039152
        Num handles: 1
        Handle: 21 Address: DF:A9:FF:F6:B1:1A (OUI DF-A9-FF)
        Count: 1
zephyr.exe[3885206]: < ACL Data TX: Handle 21 [1/3] flags 0x00 dlen 5                                              #274 22.039206
      ATT: Write Response (0x13) len 0
zephyr.exe[3885206]: < ACL Data TX: Handle 21 [2/3] flags 0x00 dlen 10                                             #275 22.039210
      ATT: Handle Value Indication (0x1d) len 5
        Handle: 0x0032
          Data[3]: 700401
> HCI Event: Number of Completed Packets (0x13) plen 5                                                             #276 22.110528
        Num handles: 1
        Handle: 21 Address: DF:A9:FF:F6:B1:1A (OUI DF-A9-FF)
        Count: 1
        Buffers: 1/3
        #274: len 5 (0 Kb/s)
        Latency: 71 msec (71-173 msec ~118 msec)
> HCI Event: Number of Completed Packets (0x13) plen 5                                                             #277 22.197653
        Num handles: 1
        Handle: 21 Address: DF:A9:FF:F6:B1:1A (OUI DF-A9-FF)
        Count: 1
        Buffers: 0/3
        #275: len 10 (0 Kb/s)
        Latency: 158 msec (71-173 msec ~138 msec)
> ACL Data RX: Handle 21 flags 0x02 dlen 5                                                                         #278 22.197938
      ATT: Handle Value Confirmation (0x1e) len 0
> ACL Data RX: Handle 21 flags 0x02 dlen 7                                                                         #279 22.198486
      ATT: Read Request (0x0a) len 2
        Handle: 0x0025
zephyr.exe[3885206]: < HCI Command: Host Number of Completed Packets (0x03|0x0035) plen 5                          #280 22.199016
        Num handles: 1
        Handle: 21 Address: DF:A9:FF:F6:B1:1A (OUI DF-A9-FF)
        Count: 1
zephyr.exe[3885206]: < HCI Command: Host Number of Completed Packets (0x03|0x0035) plen 5                          #281 22.199045
        Num handles: 1
        Handle: 21 Address: DF:A9:FF:F6:B1:1A (OUI DF-A9-FF)
        Count: 1
zephyr.exe[3885206]: < ACL Data TX: Handle 21 [1/3] flags 0x00 dlen 27                                             #282 22.199061
      ATT: Read Response (0x0b) len 22
        Value[22]: 4f626a656374203120776974682076657279206c6f6e
zephyr.exe[3885206]: < ACL Data TX: Handle 21 [2/3] flags 0x00 dlen 16                                             #283 22.309008
      LE L2CAP: Connection Parameter Update Request (0x12) ident 2 len 8
        Min interval: 24
        Max interval: 40
        Peripheral latency: 0
        Timeout multiplier: 42
> HCI Event: Number of Completed Packets (0x13) plen 5                                                             #284 22.373094
        Num handles: 1
        Handle: 21 Address: DF:A9:FF:F6:B1:1A (OUI DF-A9-FF)
        Count: 1
        Buffers: 1/3
        #282: len 27 (1 Kb/s)
        Latency: 174 msec (71-174 msec ~156 msec)
> ACL Data RX: Handle 21 flags 0x02 dlen 9                                                                         #285 22.373175
      ATT: Read Blob Request (0x0c) len 4
        Handle: 0x0025
        Offset: 0x0016
zephyr.exe[3885206]: < HCI Command: Host Number of Completed Packets (0x03|0x0035) plen 5                          #286 22.379017
        Num handles: 1
        Handle: 21 Address: DF:A9:FF:F6:B1:1A (OUI DF-A9-FF)
        Count: 1
zephyr.exe[3885206]: < ACL Data TX: Handle 21 [2/3] flags 0x00 dlen 11                                             #287 22.379063
      ATT: Read Blob Response (0x0d) len 6
        Value[6]: 67206e616d65
> HCI Event: Number of Completed Packets (0x13) plen 5                                                             #288 22.460338
        Num handles: 1
        Handle: 21 Address: DF:A9:FF:F6:B1:1A (OUI DF-A9-FF)
        Count: 1
        Buffers: 1/3
        #283: len 16 (0 Kb/s)
        Latency: 151 msec (71-174 msec ~153 msec)
> ACL Data RX: Handle 21 flags 0x02 dlen 10                                                                        #289 22.460572
      LE L2CAP: Connection Parameter Update Response (0x13) ident 2 len 2
        Result: Connection Parameters accepted (0x0000)
zephyr.exe[3885206]: < HCI Command: Host Number of Completed Packets (0x03|0x0035) plen 5                          #290 22.479120
        Num handles: 1
        Handle: 21 Address: DF:A9:FF:F6:B1:1A (OUI DF-A9-FF)
        Count: 1
> HCI Event: Number of Completed Packets (0x13) plen 5                                                             #291 22.547847
        Num handles: 1
        Handle: 21 Address: DF:A9:FF:F6:B1:1A (OUI DF-A9-FF)
        Count: 1
        Buffers: 0/3
        #287: len 11 (0 Kb/s)
        Latency: 168 msec (71-174 msec ~161 msec)
> ACL Data RX: Handle 21 flags 0x02 dlen 7                                                                         #292 22.547849
      ATT: Read Request (0x0a) len 2
        Handle: 0x0027
zephyr.exe[3885206]: < HCI Command: Host Number of Completed Packets (0x03|0x0035) plen 5                          #293 22.559142
        Num handles: 1
        Handle: 21 Address: DF:A9:FF:F6:B1:1A (OUI DF-A9-FF)
        Count: 1
zephyr.exe[3885206]: < ACL Data TX: Handle 21 [1/3] flags 0x00 dlen 7                                              #294 22.559149
      ATT: Read Response (0x0b) len 2
        Value[2]: ca2a
> HCI Event: Number of Completed Packets (0x13) plen 5                                                             #295 22.722831
        Num handles: 1
        Handle: 21 Address: DF:A9:FF:F6:B1:1A (OUI DF-A9-FF)
        Count: 1
        Buffers: 0/3
        #294: len 7 (0 Kb/s)
        Latency: 163 msec (71-174 msec ~162 msec)
> ACL Data RX: Handle 21 flags 0x02 dlen 7                                                                         #296 22.723237
      ATT: Read Request (0x0a) len 2
        Handle: 0x0029
zephyr.exe[3885206]: < HCI Command: Host Number of Completed Packets (0x03|0x0035) plen 5                          #297 22.739043
        Num handles: 1
        Handle: 21 Address: DF:A9:FF:F6:B1:1A (OUI DF-A9-FF)
        Count: 1
zephyr.exe[3885206]: < ACL Data TX: Handle 21 [1/3] flags 0x00 dlen 13                                             #298 22.739049
      ATT: Read Response (0x0b) len 8
        Value[8]: 3200000064000000
> HCI Event: Number of Completed Packets (0x13) plen 5                                                             #299 22.897778
        Num handles: 1
        Handle: 21 Address: DF:A9:FF:F6:B1:1A (OUI DF-A9-FF)
        Count: 1
        Buffers: 0/3
        #298: len 13 (0 Kb/s)
        Latency: 158 msec (71-174 msec ~160 msec)
> ACL Data RX: Handle 21 flags 0x02 dlen 7                                                                         #300 22.897950
      ATT: Read Request (0x0a) len 2
        Handle: 0x002d
zephyr.exe[3885206]: < HCI Command: Host Number of Completed Packets (0x03|0x0035) plen 5                          #301 22.898990
        Num handles: 1
        Handle: 21 Address: DF:A9:FF:F6:B1:1A (OUI DF-A9-FF)
        Count: 1
zephyr.exe[3885206]: < ACL Data TX: Handle 21 [1/3] flags 0x00 dlen 9                                              #302 22.899040