Bluetooth monitor ver 5.72
= Note: Linux version 6.14.0-36-generic (x86_64)                       0.029916
= Note: Bluetooth subsystem version 2.22                               0.029918
= New Index: 00:00:00:00:00:00 (Primary,UART,hci1)              [hci1] 0.029919
= New Index: 48:5F:99:8E:E0:64 (Primary,USB,hci0)               [hci0] 0.029920
= Open Index: 00:00:00:00:00:00                                 [hci1] 0.143762
= Index Info: 00:00:00:00:00:00 (Nordic Semiconductor ASA)      [hci1] 0.143788
@ USER Open: main (privileged) version 2.22            {0x0001} [hci1] 0.143798
< HCI Command: Reset (0x03|0x0003) plen 0                    #1 [hci1] 0.145081
> HCI Event: Command Complete (0x0e) plen 4                  #2 [hci1] 0.145614
      Reset (0x03|0x0003) ncmd 1
        Status: Success (0x00)
< HCI Command: Read Local Supported... (0x04|0x0003) plen 0  #3 [hci1] 0.163458
> HCI Event: Command Complete (0x0e) plen 12                 #4 [hci1] 0.164077
      Read Local Supported Features (0x04|0x0003) ncmd 1
        Status: Success (0x00)
        Features: 0x00 0x00 0x00 0x00 0x60 0x00 0x00 0x00
          BR/EDR Not Supported
          LE Supported (Controller)
< HCI Command: Read Local Version In.. (0x04|0x0001) plen 0  #5 [hci1] 0.183136
> HCI Event: Command Complete (0x0e) plen 12                 #6 [hci1] 0.183615
      Read Local Version Information (0x04|0x0001) ncmd 1
        Status: Success (0x00)
        HCI version: Reserved (0x0f) - Revision 12393 (0x3069)
        LMP version: Reserved (0x0f) - Subversion 12393 (0x3069)
        Manufacturer: Nordic Semiconductor ASA (89)
< HCI Command: Read Local Supported... (0x04|0x0002) plen 0  #7 [hci1] 0.203087
> HCI Event: Command Complete (0x0e) plen 68                 #8 [hci1] 0.204139
      Read Local Supported Commands (0x04|0x0002) ncmd 1
        Status: Success (0x00)
        Commands: 119 entries
          Disconnect (Octet 0 - Bit 5)
          Read Remote Version Information (Octet 2 - Bit 7)
          Set Event Mask (Octet 5 - Bit 6)
          Reset (Octet 5 - Bit 7)
          Read Connection Accept Timeout (Octet 7 - Bit 2)
          Write Connection Accept Timeout (Octet 7 - Bit 3)
          Read Transmit Power Level (Octet 10 - Bit 2)
          Set Controller To Host Flow Control (Octet 10 - Bit 5)
          Host Buffer Size (Octet 10 - Bit 6)
          Host Number of Completed Packets (Octet 10 - Bit 7)
          Read Local Version Information (Octet 14 - Bit 3)
          Read Local Supported Features (Octet 14 - Bit 5)
          Read BD ADDR (Octet 15 - Bit 1)
          Read RSSI (Octet 15 - Bit 5)
          Set Event Mask Page 2 (Octet 22 - Bit 2)
          LE Set Event Mask (Octet 25 - Bit 0)
          LE Read Buffer Size (Octet 25 - Bit 1)
          LE Read Local Supported Features (Octet 25 - Bit 2)
          LE Set Random Address (Octet 25 - Bit 4)
          LE Set Advertising Parameters (Octet 25 - Bit 5)
          LE Read Advertising Channel TX Power (Octet 25 - Bit 6)
          LE Set Advertising Data (Octet 25 - Bit 7)
          LE Set Scan Response Data (Octet 26 - Bit 0)
          LE Set Advertise Enable (Octet 26 - Bit 1)
          LE Set Scan Parameters (Octet 26 - Bit 2)
          LE Set Scan Enable (Octet 26 - Bit 3)
          LE Create Connection (Octet 26 - Bit 4)
          LE Create Connection Cancel (Octet 26 - Bit 5)
          LE Read Accept List Size (Octet 26 - Bit 6)
          LE Clear Accept List (Octet 26 - Bit 7)
          LE Add Device To Accept List (Octet 27 - Bit 0)
          LE Remove Device From Accept List (Octet 27 - Bit 1)
          LE Connection Update (Octet 27 - Bit 2)
          LE Set Host Channel Classification (Octet 27 - Bit 3)
          LE Read Channel Map (Octet 27 - Bit 4)
          LE Read Remote Used Features (Octet 27 - Bit 5)
          LE Encrypt (Octet 27 - Bit 6)
          LE Rand (Octet 27 - Bit 7)
          LE Start Encryption (Octet 28 - Bit 0)
          LE Long Term Key Request Reply (Octet 28 - Bit 1)
          LE Long Term Key Request Neg Reply (Octet 28 - Bit 2)
          LE Read Supported States (Octet 28 - Bit 3)
          LE Receiver Test (Octet 28 - Bit 4)
          LE Transmitter Test (Octet 28 - Bit 5)
          LE Test End (Octet 28 - Bit 6)
          Read Authenticated Payload Timeout (Octet 32 - Bit 4)
          Write Authenticated Payload Timeout (Octet 32 - Bit 5)
          LE Set Data Length (Octet 33 - Bit 6)
          LE Read Suggested Default Data Length (Octet 33 - Bit 7)
          LE Write Suggested Default Data Length (Octet 34 - Bit 0)
          LE Add Device To Resolving List (Octet 34 - Bit 3)
          LE Remove Device From Resolving List (Octet 34 - Bit 4)
          LE Clear Resolving List (Octet 34 - Bit 5)
          LE Read Resolving List Size (Octet 34 - Bit 6)
          LE Set Address Resolution Enable (Octet 35 - Bit 1)
          LE Set Resolvable Private Address Timeout (Octet 35 - Bit 2)
          LE Read Maximum Data Length (Octet 35 - Bit 3)
          LE Read PHY (Octet 35 - Bit 4)
          LE Set Default PHY (Octet 35 - Bit 5)
          LE Set PHY (Octet 35 - Bit 6)
          LE Enhanced Receiver Test (Octet 35 - Bit 7)
          LE Enhanced Transmitter Test (Octet 36 - Bit 0)
          LE Set Advertising Set Random Address (Octet 36 - Bit 1)
          LE Set Extended Advertising Parameters (Octet 36 - Bit 2)
          LE Set Extended Advertising Data (Octet 36 - Bit 3)
          LE Set Extended Scan Response Data (Octet 36 - Bit 4)
          LE Set Extended Advertising Enable (Octet 36 - Bit 5)
          LE Read Maximum Advertising Data Length (Octet 36 - Bit 6)
          LE Read Number of Supported Advertising Sets (Octet 36 - Bit 7)
          LE Remove Advertising Set (Octet 37 - Bit 0)
          LE Clear Advertising Sets (Octet 37 - Bit 1)
          LE Set Periodic Advertising Parameters (Octet 37 - Bit 2)
          LE Set Periodic Advertising Data (Octet 37 - Bit 3)
          LE Set Periodic Advertising Enable (Octet 37 - Bit 4)
          LE Set Extended Scan Parameters (Octet 37 - Bit 5)
          LE Set Extended Scan Enable (Octet 37 - Bit 6)
          LE Extended Create Connection (Octet 37 - Bit 7)
          LE Periodic Advertising Create Sync (Octet 38 - Bit 0)
          LE Periodic Advertising Create Sync Cancel (Octet 38 - Bit 1)
          LE Periodic Advertising Terminate Sync (Octet 38 - Bit 2)
          LE Add Device To Periodic Advertiser List (Octet 38 - Bit 3)
          LE Remove Device From Periodic Advertiser List (Octet 38 - Bit 4)
          LE Clear Periodic Advertiser List (Octet 38 - Bit 5)
          LE Read Periodic Advertiser List Size (Octet 38 - Bit 6)
          LE Read Transmit Power (Octet 38 - Bit 7)
          LE Read RF Path Compensation (Octet 39 - Bit 0)
          LE Write RF Path Compensation (Octet 39 - Bit 1)
          LE Set Privacy Mode (Octet 39 - Bit 2)
          LE Periodic Advertising Receive Enable (Octet 40 - Bit 5)
          LE Periodic Advertising Sync Transfer (Octet 40 - Bit 6)
          LE Periodic Advertising Set Info Transfer (Octet 40 - Bit 7)
          LE Periodic Advertising Sync Transfer Parameters (Octet 41 - Bit 0)
          LE Set Default Periodic Advertisng Sync Transfer Parameters (Octet 41 - Bit 1)
          LE Read Buffer v2 (Octet 41 - Bit 5)
          LE Read ISO TX Sync (Octet 41 - Bit 6)
          LE Set Connected Isochronous Group Parameters (Octet 41 - Bit 7)
          LE Set Connected Isochronous Group Parameters Test (Octet 42 - Bit 0)
          LE Create Connected Isochronous Stream (Octet 42 - Bit 1)
          LE Remove Connected Isochronous Group (Octet 42 - Bit 2)
          LE Accept Connected Isochronous Stream Request (Octet 42 - Bit 3)
          LE Reject Connected Isochronous Stream Request (Octet 42 - Bit 4)
          LE Create Broadcast Isochronous Group (Octet 42 - Bit 5)
          LE Create Broadcast Isochronous Group Test (Octet 42 - Bit 6)
          LE Terminate Broadcast Isochronous Group (Octet 42 - Bit 7)
          LE Broadcast Isochronous Group Create Sync (Octet 43 - Bit 0)
          LE Broadcast Isochronous Group Terminate Sync (Octet 43 - Bit 1)
          LE Request Peer SCA (Octet 43 - Bit 2)
          LE Setup Isochronous Data Path (Octet 43 - Bit 3)
          LE Remove Isochronous Data Path (Octet 43 - Bit 4)
          LE Isochronous Transmit Test (Octet 43 - Bit 5)
          LE Isochronous Receive Test (Octet 43 - Bit 6)
          LE Isochronous Read Test Counters (Octet 43 - Bit 7)
          LE Isochronous Read Test Counters (Octet 44 - Bit 0)
          LE Set Host Feature (Octet 44 - Bit 1)
          Octet 44 - Bit 2 
          Octet 45 - Bit 6 
          Octet 46 - Bit 0 
          Octet 46 - Bit 1 
          Octet 46 - Bit 2 
< HCI Command: Host Buffer Size (0x03|0x0033) plen 7         #9 [hci1] 0.223095
        ACL MTU: 255  ACL max packet: 16
        SCO MTU: 0    SCO max packet: 0
> HCI Event: Command Complete (0x0e) plen 4                 #10 [hci1] 0.223609
      Host Buffer Size (0x03|0x0033) ncmd 1
        Status: Success (0x00)
< HCI Command: Set Controller To Ho.. (0x03|0x0031) plen 1  #11 [hci1] 0.243092
        Flow control: ACL Data Packets (0x01)
> HCI Event: Command Complete (0x0e) plen 4                 #12 [hci1] 0.243524
      Set Controller To Host Flow Control (0x03|0x0031) ncmd 1
        Status: Success (0x00)
< HCI Command: LE Read Local Suppor.. (0x08|0x0003) plen 0  #13 [hci1] 0.263090
> HCI Event: Command Complete (0x0e) plen 12                #14 [hci1] 0.263589
      LE Read Local Supported Features (0x08|0x0003) ncmd 1
        Status: Success (0x00)
        Features: 0xfd 0x79 0x00 0xf7 0x30 0x01 0x00 0x00
          LE Encryption
          Extended Reject Indication
          Peripheral-initiated Features Exchange
          LE Ping
          LE Data Packet Length Extension
          LL Privacy
          Extended Scanner Filter Policies
          LE 2M PHY
          LE Coded PHY
          LE Extended Advertising
          LE Periodic Advertising
          Channel Selection Algorithm #2
          Periodic Advertising Sync Transfer - Sender
          Periodic Advertising Sync Transfer - Recipient
          Sleep Clock Accuracy Updates
          Connected Isochronous Stream - Central
          Connected Isochronous Stream - Peripheral
          Isochronous Broadcaster
          Synchronized Receiver
          Periodic Advertising ADI support
          Connection Subrating
          Unknown features (0x0000010000000000)
< HCI Command: LE Set Host Feature (0x08|0x0074) plen 2     #15 [hci1] 0.283379
        Bit Number: 32
          Connected Isochronous Stream (Host Support)
        Bit Value: 1
> HCI Event: Command Complete (0x0e) plen 4                 #16 [hci1] 0.285380
      LE Set Host Feature (0x08|0x0074) ncmd 1
        Status: Success (0x00)
< HCI Command: LE Read Buffer v2 (0x08|0x0060) plen 0       #17 [hci1] 0.303101
> HCI Event: Command Complete (0x0e) plen 10                #18 [hci1] 0.303556
      LE Read Buffer v2 (0x08|0x0060) ncmd 1
        Status: Success (0x00)
        ACL MTU: 27
        ACL max packet: 3
        ISO MTU: 318
        ISO max packet: 3
< HCI Command: LE Read Maximum Adve.. (0x08|0x003a) plen 0  #19 [hci1] 0.323178
> HCI Event: Command Complete (0x0e) plen 6                 #20 [hci1] 0.323568
      LE Read Maximum Advertising Data Length (0x08|0x003a) ncmd 1
        Status: Success (0x00)
        Max length: 1650
< HCI Command: LE Read Supported St.. (0x08|0x001c) plen 0  #21 [hci1] 0.343098
> HCI Event: Command Complete (0x0e) plen 12                #22 [hci1] 0.343573
      LE Read Supported States (0x08|0x001c) ncmd 1
        Status: Success (0x00)
        States: 0x000003ff3e0306ff
          Non-connectable Advertising State
          Scannable Advertising State
          Connectable Advertising State
          High Duty Cycle Directed Advertising State
          Passive Scanning State
          Active Scanning State
          Initiating State
            and Connection State (Central Role)
          Connection State (Peripheral Role)
          Scannable Advertising State
            and Passive Scanning State
          Connectable Advertising State
            and Passive Scanning State
          Non-connectable Advertising State
            and Initiating State
          Scannable Advertising State
            and Initiating State
          Active Scanning State
            and Connection State (Central Role)
          Passive Scanning State
            and Connection State (Peripheral Role)
          Active Scanning State
            and Connection State (Peripheral Role)
          Initiating State
            and Connection State (Central Role)
            and Central Role & Central Role
          Low Duty Cycle Directed Advertising State
          Connectable Advertising State
            and Initiating State
            and Central Role & Peripheral Role
          High Duty Cycle Directed Advertising State
            and Initiating State
            and Central Role & Peripheral Role
          Low Duty Cycle Directed Advertising State
            and Initiating State
            and Central Role & Peripheral Role
          Connectable Advertising State
            and Connection State (Central Role)
            and Central Role & Peripheral Role
          High Duty Cycle Directed Advertising State
            and Connection State (Central Role)
            and Central Role & Peripheral Role
          Low Duty Cycle Directed Advertising State
            and Connection State (Central Role)
            and Central Role & Peripheral Role
          Connectable Advertising State
            and Connection State (Peripheral Role)
            and Central Role & Peripheral Role
          High Duty Cycle Directed Advertising State
            and Connection State (Peripheral Role)
            and Peripheral Role & Peripheral Role
          Low Duty Cycle Directed Advertising State
            and Connection State (Peripheral Role)
            and Peripheral Role & Peripheral Role
          Initiating State
            and Connection State (Peripheral Role)
            and Central Role & Peripheral Role
< HCI Command: LE Read Maximum Data.. (0x08|0x002f) plen 0  #23 [hci1] 0.363073
> HCI Event: Command Complete (0x0e) plen 12                #24 [hci1] 0.365384
      LE Read Maximum Data Length (0x08|0x002f) ncmd 1
        Status: Success (0x00)
        Max TX octets: 251
        Max TX time: 2704
        Max RX octets: 251
        Max RX time: 2704
< HCI Command: LE Write Suggested D.. (0x08|0x0024) plen 4  #25 [hci1] 0.383123
        TX octets: 251
        TX time: 2704
> HCI Event: Command Complete (0x0e) plen 4                 #26 [hci1] 0.383559
      LE Write Suggested Default Data Length (0x08|0x0024) ncmd 1
        Status: Success (0x00)
< HCI Command: LE Read Resolving Li.. (0x08|0x002a) plen 0  #27 [hci1] 0.403133
> HCI Event: Command Complete (0x0e) plen 5                 #28 [hci1] 0.403593
      LE Read Resolving List Size (0x08|0x002a) ncmd 1
        Status: Success (0x00)
        Size: 8
< HCI Command: LE Set Event Mask (0x08|0x0001) plen 8       #29 [hci1] 0.423094
        Mask: 0x000002023f87fa5e
          LE Advertising Report
          LE Connection Update Complete
          LE Read Remote Used Features Complete
          LE Long Term Key Request
          LE Data Length Change
          LE Enhanced Connection Complete
          LE PHY Update Complete
          LE Extended Advertising Report
          LE Periodic Advertising Sync Established
          LE Periodic Advertising Report
          LE Periodic Advertising Sync Lost
          LE Extended Scan Timeout
          LE Extended Advertising Set Terminated
          LE Scan Request Received
          LE Periodic Advertising Sync Transfer Rvc
          LE CIS Established
          LE CIS Request
          LE Create BIG Complete
          LE Terminate BIG Complete
          LE BIG Sync Estabilished Complete
          LE BIG Sync Lost
          LE BIG Info Advertising Report
          Unknown mask (0x0000020000000000)
> HCI Event: Command Complete (0x0e) plen 4                 #30 [hci1] 0.423628
      LE Set Event Mask (0x08|0x0001) ncmd 1
        Status: Success (0x00)
< HCI Command: Set Event Mask (0x03|0x0001) plen 8          #31 [hci1] 0.443094
        Mask: 0x2000800002008890
          Disconnection Complete
          Encryption Change
          Read Remote Version Information Complete
          Hardware Error
          Data Buffer Overflow
          Encryption Key Refresh Complete
          LE Meta
> HCI Event: Command Complete (0x0e) plen 4                 #32 [hci1] 0.443638
      Set Event Mask (0x03|0x0001) ncmd 1
        Status: Success (0x00)
< HCI Command: Read BD ADDR (0x04|0x0009) plen 0            #33 [hci1] 0.463097
> HCI Event: Command Complete (0x0e) plen 10                #34 [hci1] 0.463650
      Read BD ADDR (0x04|0x0009) ncmd 1
        Status: Success (0x00)
        Address: 00:00:00:00:00:00 (OUI 00-00-00)
< HCI Command: LE Set Random Address (0x08|0x0005) plen 6   #35 [hci1] 0.483125
        Address: D5:B6:CC:31:DB:3B (Static)
> HCI Event: Command Complete (0x0e) plen 4                 #36 [hci1] 0.483659
      LE Set Random Address (0x08|0x0005) ncmd 1
        Status: Success (0x00)
< HCI Command: LE Set Extended Adv.. (0x08|0x0036) plen 25  #37 [hci1] 2.973158
        Handle: 0x00
        Properties: 0x0013
          Connectable
          Scannable
          Use legacy advertising PDUs: ADV_IND
        Min advertising interval: 100.000 msec (0x00a0)
        Max advertising interval: 150.000 msec (0x00f0)
        Channel map: 37, 38, 39 (0x07)
        Own address type: Random (0x01)
        Peer address type: Public (0x00)
        Peer address: 00:00:00:00:00:00 (OUI 00-00-00)
        Filter policy: Allow Scan Request from Any, Allow Connect Request from Any (0x00)
        TX power: Host has no preference (0x7f)
        Primary PHY: LE 1M (0x01)
        Secondary max skip: 0x00
        Secondary PHY: LE 1M (0x01)
        SID: 0x00
        Scan request notifications: Disabled (0x00)
> HCI Event: Command Complete (0x0e) plen 5                 #38 [hci1] 2.973900
      LE Set Extended Advertising Parameters (0x08|0x0036) ncmd 1
        Status: Success (0x00)
        TX power (selected): 0 dbm (0x00)
< HCI Command: LE Set Advertising S.. (0x08|0x0035) plen 7  #39 [hci1] 2.983134
        Advertising handle: 0x00
        Advertising random address: D5:B6:CC:31:DB:3B (Static)
> HCI Event: Command Complete (0x0e) plen 4                 #40 [hci1] 2.983591
      LE Set Advertising Set Random Address (0x08|0x0035) ncmd 1
        Status: Success (0x00)
< HCI Command: LE Set Extended Adv.. (0x08|0x0037) plen 22  #41 [hci1] 3.003078
        Handle: 0x00
        Operation: Complete extended advertising data (0x03)
        Fragment preference: Minimize fragmentation (0x01)
        Data length: 0x12
        Flags: 0x06
          LE General Discoverable Mode
          BR/EDR Not Supported
        Name (complete): Tester_F6B11A
> HCI Event: Command Complete (0x0e) plen 4                 #42 [hci1] 3.003759
      LE Set Extended Advertising Data (0x08|0x0037) ncmd 1
        Status: Success (0x00)
< HCI Command: LE Set Extended Scan.. (0x08|0x0038) plen 4  #43 [hci1] 3.023115
        Handle: 0x00
        Operation: Complete scan response data (0x03)
        Fragment preference: Minimize fragmentation (0x01)
        Data length: 0x00
> HCI Event: Command Complete (0x0e) plen 4                 #44 [hci1] 3.023604
      LE Set Extended Scan Response Data (0x08|0x0038) ncmd 1
        Status: Success (0x00)
< HCI Command: LE Set Extended Adve.. (0x08|0x0039) plen 6  #45 [hci1] 3.043141
        Extended advertising: Enabled (0x01)
        Number of sets: 1 (0x01)
        Entry 0
          Handle: 0x00
          Duration: 0 ms (0x00)
          Max ext adv events: 0
> HCI Event: Command Complete (0x0e) plen 4                 #46 [hci1] 3.043688
      LE Set Extended Advertising Enable (0x08|0x0039) ncmd 1
        Status: Success (0x00)
> HCI Event: LE Meta Event (0x3e) plen 31                   #47 [hci1] 3.159495
      LE Enhanced Connection Complete (0x0a)
        Status: Success (0x00)
        Handle: 3207
        Role: Peripheral (0x01)
        Peer address type: Public (0x00)
        Peer address: DF:A9:FF:F6:B1:1A (OUI DF-A9-FF)
        Local resolvable private address: 00:00:00:00:00:00 (Non-Resolvable)
        Peer resolvable private address: 00:00:00:00:00:00 (Non-Resolvable)
        Connection interval: 87.50 msec (0x0046)
        Connection latency: 0 (0x0000)
        Supervision timeout: 25120 msec (0x09d0)
        Central clock accuracy: 0x01
> HCI Event: LE Meta Event (0x3e) plen 6                    #48 [hci1] 3.159503
      LE Advertising Set Terminated (0x12)
        Status: Success (0x00)
        Handle: 0
        Connection handle: 3207
        Number of completed extended advertising events: 0
< HCI Command: LE Read Remote Used... (0x08|0x0016) plen 2  #49 [hci1] 3.164095
        Handle: 3207 Address: DF:A9:FF:F6:B1:1A (OUI DF-A9-FF)
< ACL Data TX: Handle 3207 flags 0x00 dlen 7                #50 [hci1] 3.164121
      ATT: Exchange MTU Request (0x02) len 2
        Client RX MTU: 251
> HCI Event: Command Status (0x0f) plen 4                   #51 [hci1] 3.164649
      LE Read Remote Used Features (0x08|0x0016) ncmd 1
        Status: Success (0x00)
> HCI Event: Number of Completed Packets (0x13) plen 5      #52 [hci1] 3.335338
        Num handles: 1
        Handle: 3207 Address: DF:A9:FF:F6:B1:1A (OUI DF-A9-FF)
        Count: 1
        #50: len 7 (0 Kb/s)
        Latency: 171 msec (171-171 msec ~171 msec)
> HCI Event: LE Meta Event (0x3e) plen 12                   #53 [hci1] 3.423289
      LE Read Remote Used Features (0x04)
        Status: Success (0x00)
        Handle: 3207 Address: DF:A9:FF:F6:B1:1A (OUI DF-A9-FF)
        Features: 0x2d 0x49 0x00 0xf7 0x67 0xd9 0x00 0x80
          LE Encryption
          Extended Reject Indication
          Peripheral-initiated Features Exchange
          LE Data Packet Length Extension
          LE 2M PHY
          LE Coded PHY
          Channel Selection Algorithm #2
          Periodic Advertising Sync Transfer - Sender
          Periodic Advertising Sync Transfer - Recipient
          Sleep Clock Accuracy Updates
          Connected Isochronous Stream - Central
          Connected Isochronous Stream - Peripheral
          Isochronous Broadcaster
          Synchronized Receiver
          Connected Isochronous Stream (Host Support)
          LE Power Control Request
          LE Power Control Request
          Connection Subrating
          Connection Subrating (Host Support)
          Unknown features (0x8000d90000000000)
> ACL Data RX: Handle 3207 flags 0x02 dlen 11               #54 [hci1] 5.873027
      SMP: Pairing Request (0x01) len 6
        IO capability: KeyboardDisplay (0x04)
        OOB data: Authentication data not present (0x00)
        Authentication requirement: Bonding, No MITM, SC, No Keypresses (0x09)
        Max encryption key size: 16
        Initiator key distribution: EncKey IdKey (0x03)
        Responder key distribution: EncKey IdKey Sign (0x07)
< HCI Command: Host Number of Compl.. (0x03|0x0035) plen 5  #55 [hci1] 5.883707
        Num handles: 1
        Handle: 3207 Address: DF:A9:FF:F6:B1:1A (OUI DF-A9-FF)
        Count: 1
< ACL Data TX: Handle 3207 flags 0x00 dlen 11               #56 [hci1] 5.883941
      SMP: Pairing Response (0x02) len 6
        IO capability: DisplayOnly (0x00)
        OOB data: Authentication data not present (0x00)
        Authentication requirement: Bonding, No MITM, SC, No Keypresses (0x09)
        Max encryption key size: 16
        Initiator key distribution: IdKey (0x02)
        Responder key distribution: <none> (0x00)
> ACL Data RX: Handle 3207 flags 0x02 dlen 7                #57 [hci1] 5.960413
      ATT: Exchange MTU Response (0x03) len 2
        Server RX MTU: 23
< HCI Command: Host Number of Compl.. (0x03|0x0035) plen 5  #58 [hci1] 5.963538
        Num handles: 1
        Handle: 3207 Address: DF:A9:FF:F6:B1:1A (OUI DF-A9-FF)
        Count: 1
> HCI Event: Number of Completed Packets (0x13) plen 5      #59 [hci1] 6.048194
        Num handles: 1
        Handle: 3207 Address: DF:A9:FF:F6:B1:1A (OUI DF-A9-FF)
        Count: 1
        #56: len 11 (0 Kb/s)
        Latency: 164 msec (164-171 msec ~167 msec)
> ACL Data RX: Handle 3207 flags 0x02 dlen 27               #60 [hci1] 6.048392
> ACL Data RX: Handle 3207 flags 0x01 dlen 27               #61 [hci1] 6.048974
> ACL Data RX: Handle 3207 flags 0x01 dlen 15               #62 [hci1] 6.049353
      SMP: Pairing Public Key (0x0c) len 64
        X: bf29cb8a8736692727a28e8195a9d4e9472bf8018956edc9e9c5d20abfab6396
        Y: c96254a9c31fa84176d3f3c3ea48a435d681e6fe5ed8bc05c6b817ec7ed9c539
< HCI Command: Host Number of Compl.. (0x03|0x0035) plen 5  #63 [hci1] 6.063907
        Num handles: 1
        Handle: 3207 Address: DF:A9:FF:F6:B1:1A (OUI DF-A9-FF)
        Count: 1
< HCI Command: Host Number of Compl.. (0x03|0x0035) plen 5  #64 [hci1] 6.064114
        Num handles: 1
        Handle: 3207 Address: DF:A9:FF:F6:B1:1A (OUI DF-A9-FF)
        Count: 1
< HCI Command: Host Number of Compl.. (0x03|0x0035) plen 5  #65 [hci1] 6.064364
        Num handles: 1
        Handle: 3207 Address: DF:A9:FF:F6:B1:1A (OUI DF-A9-FF)
        Count: 1
< ACL Data TX: Handle 3207 flags 0x00 dlen 27               #66 [hci1] 6.064462
< ACL Data TX: Handle 3207 flags 0x01 dlen 27               #67 [hci1] 6.064516
< ACL Data TX: Handle 3207 flags 0x01 dlen 15               #68 [hci1] 6.064534
      SMP: Pairing Public Key (0x0c) len 64
        X: 98308440221e2d910f0e54b71e7ec652857aa9b5a0dc65028824cc19db1226e9
        Y: 67a4816bcb62efb21701e31fdb27561a6217575fb007a8bbdabe7e28b6f68482
> HCI Event: Number of Completed Packets (0x13) plen 5      #69 [hci1] 6.135985
        Num handles: 1
        Handle: 3207 Address: DF:A9:FF:F6:B1:1A (OUI DF-A9-FF)
        Count: 1
        #66: len 27 (3 Kb/s)
        Latency: 71 msec (71-171 msec ~119 msec)
> HCI Event: Number of Completed Packets (0x13) plen 5      #70 [hci1] 6.136678
        Num handles: 1
        Handle: 3207 Address: DF:A9:FF:F6:B1:1A (OUI DF-A9-FF)
        Count: 1
        #67: len 27 (3 Kb/s)
        Latency: 72 msec (71-171 msec ~95 msec)
< ACL Data TX: Handle 3207 flags 0x00 dlen 21               #71 [hci1] 6.143622
      SMP: Pairing Confirm (0x03) len 16
        Confim value: 17f5f3ae90984bb4326d942d8c411344
> HCI Event: Number of Completed Packets (0x13) plen 5      #72 [hci1] 6.222839
        Num handles: 1
        Handle: 3207 Address: DF:A9:FF:F6:B1:1A (OUI DF-A9-FF)
        Count: 1
        #68: len 15 (0 Kb/s)
        Latency: 158 msec (71-171 msec ~127 msec)
> HCI Event: Number of Completed Packets (0x13) plen 5      #73 [hci1] 6.310583
        Num handles: 1
        Handle: 3207 Address: DF:A9:FF:F6:B1:1A (OUI DF-A9-FF)
        Count: 1
        #71: len 21 (1 Kb/s)
        Latency: 166 msec (71-171 msec ~147 msec)
> ACL Data RX: Handle 3207 flags 0x02 dlen 21               #74 [hci1] 6.310995
      SMP: Pairing Random (0x04) len 16
        Random value: df62c65349e2723b0000000000000000
< HCI Command: Host Number of Compl.. (0x03|0x0035) plen 5  #75 [hci1] 6.323799
        Num handles: 1
        Handle: 3207 Address: DF:A9:FF:F6:B1:1A (OUI DF-A9-FF)
        Count: 1
< ACL Data TX: Handle 3207 flags 0x00 dlen 21               #76 [hci1] 6.323948
      SMP: Pairing Random (0x04) len 16
        Random value: 8e6108f966a694cbe26df70bb96773e6
> HCI Event: Number of Completed Packets (0x13) plen 5      #77 [hci1] 6.485347
        Num handles: 1
        Handle: 3207 Address: DF:A9:FF:F6:B1:1A (OUI DF-A9-FF)
        Count: 1
        #76: len 21 (1 Kb/s)
        Latency: 161 msec (71-171 msec ~154 msec)
> ACL Data RX: Handle 3207 flags 0x02 dlen 21               #78 [hci1] 6.660730
      SMP: Pairing DHKey Check (0x0d) len 16
        E: aad6f895ad08eb97ba07e285763c345d
< HCI Command: Host Number of Compl.. (0x03|0x0035) plen 5  #79 [hci1] 6.663598
        Num handles: 1
        Handle: 3207 Address: DF:A9:FF:F6:B1:1A (OUI DF-A9-FF)
        Count: 1
< ACL Data TX: Handle 3207 flags 0x00 dlen 21               #80 [hci1] 6.663644
      SMP: Pairing DHKey Check (0x0d) len 16
        E: c50d14b927ca8d47246289bf658eea4e
> HCI Event: Number of Completed Packets (0x13) plen 5      #81 [hci1] 6.835292
        Num handles: 1
        Handle: 3207 Address: DF:A9:FF:F6:B1:1A (OUI DF-A9-FF)
        Count: 1
        #80: len 21 (0 Kb/s)
        Latency: 171 msec (71-171 msec ~162 msec)
> HCI Event: LE Meta Event (0x3e) plen 13                   #82 [hci1] 6.923508
      LE Long Term Key Request (0x05)
        Handle: 3207 Address: DF:A9:FF:F6:B1:1A (OUI DF-A9-FF)
        Random number: 0x0000000000000000
        Encrypted diversifier: 0x0000
< HCI Command: LE Long Term Key Re.. (0x08|0x001a) plen 18  #83 [hci1] 6.943443
        Handle: 3207 Address: DF:A9:FF:F6:B1:1A (OUI DF-A9-FF)
        Long term key: 125ebebf9d8502632cc406c815bc7e3d
> HCI Event: Command Complete (0x0e) plen 6                 #84 [hci1] 6.944232
      LE Long Term Key Request Reply (0x08|0x001a) ncmd 1
        Status: Success (0x00)
        Handle: 3207 Address: DF:A9:FF:F6:B1:1A (OUI DF-A9-FF)
> HCI Event: Encryption Change (0x08) plen 4                #85 [hci1] 7.360598
        Status: Success (0x00)
        Handle: 3207 Address: DF:A9:FF:F6:B1:1A (OUI DF-A9-FF)
        Encryption: Enabled with AES-CCM (0x01)
> ACL Data RX: Handle 3207 flags 0x02 dlen 21               #86 [hci1] 7.448198
      SMP: Identity Information (0x08) len 16
        Identity resolving key: ff03be6559742d0fb4966ea33b7c8f01
< HCI Command: Host Number of Compl.. (0x03|0x0035) plen 5  #87 [hci1] 7.473917
        Num handles: 1
        Handle: 3207 Address: DF:A9:FF:F6:B1:1A (OUI DF-A9-FF)
        Count: 1
> ACL Data RX: Handle 3207 flags 0x02 dlen 12               #88 [hci1] 7.623131
      SMP: Identity Address Information (0x09) len 7
        Address: DF:A9:FF:F6:B1:1A (OUI DF-A9-FF)
< HCI Command: LE Add Device To Re.. (0x08|0x0027) plen 39  #89 [hci1] 7.623890
        Address type: Public (0x00)
        Address: DF:A9:FF:F6:B1:1A (OUI DF-A9-FF)
        Peer identity resolving key: ff03be6559742d0fb4966ea33b7c8f01
        Local identity resolving key: 00000000000000000000000000000000
> HCI Event: Command Complete (0x0e) plen 4                 #90 [hci1] 7.624845
      LE Add Device To Resolving List (0x08|0x0027) ncmd 1
        Status: Success (0x00)
< HCI Command: LE Set Privacy Mode (0x08|0x004e) plen 8     #91 [hci1] 7.643553
        Peer Identity address type: Public (0x00)
        Peer Identity address: DF:A9:FF:F6:B1:1A (OUI DF-A9-FF)
        Privacy Mode: Use Device Privacy (0x01)
> HCI Event: Command Complete (0x0e) plen 4                 #92 [hci1] 7.644156
      LE Set Privacy Mode (0x08|0x004e) ncmd 1
        Status: Success (0x00)
< HCI Command: LE Set Address Resol.. (0x08|0x002d) plen 1  #93 [hci1] 7.663581
        Address resolution: Enabled (0x01)
> HCI Event: Command Complete (0x0e) plen 4                 #94 [hci1] 7.664026
      LE Set Address Resolution Enable (0x08|0x002d) ncmd 1
        Status: Success (0x00)
< HCI Command: Host Number of Compl.. (0x03|0x0035) plen 5  #95 [hci1] 7.683595
        Num handles: 1
        Handle: 3207 Address: DF:A9:FF:F6:B1:1A (OUI DF-A9-FF)
        Count: 1
> ACL Data RX: Handle 3207 flags 0x02 dlen 11               #96 [hci1] 7.798007
      ATT: Read By Group Type Request (0x10) len 6
        Handle range: 0x0001-0xffff
        Attribute group type: Primary Service (0x2800)
< HCI Command: Host Number of Compl.. (0x03|0x0035) plen 5  #97 [hci1] 7.803718
        Num handles: 1
        Handle: 3207 Address: DF:A9:FF:F6:B1:1A (OUI DF-A9-FF)
        Count: 1
< ACL Data TX: Handle 3207 flags 0x00 dlen 24               #98 [hci1] 7.803796
      ATT: Read By Group Type Response (0x11) len 19
        Attribute data length: 6
        Attribute group list: 3 entries
        Handle range: 0x0001-0x000a
        UUID: Generic Attribute Profile (0x1801)
        Handle range: 0x000b-0x0011
        UUID: Generic Access Profile (0x1800)
        Handle range: 0x0012-0x0026
        UUID: Device Information (0x180a)
> HCI Event: Number of Completed Packets (0x13) plen 5      #99 [hci1] 7.972935
        Num handles: 1
        Handle: 3207 Address: DF:A9:FF:F6:B1:1A (OUI DF-A9-FF)
        Count: 1
        #98: len 24 (1 Kb/s)
        Latency: 169 msec (71-171 msec ~166 msec)
> ACL Data RX: Handle 3207 flags 0x02 dlen 11              #100 [hci1] 7.973240
      ATT: Read By Group Type Request (0x10) len 6
        Handle range: 0x0027-0xffff
        Attribute group type: Primary Service (0x2800)
< HCI Command: Host Number of Comp.. (0x03|0x0035) plen 5  #101 [hci1] 7.983952
        Num handles: 1
        Handle: 3207 Address: DF:A9:FF:F6:B1:1A (OUI DF-A9-FF)
        Count: 1
< ACL Data TX: Handle 3207 flags 0x00 dlen 24              #102 [hci1] 7.984027
      ATT: Read By Group Type Response (0x11) len 19
        Attribute data length: 6
        Attribute group list: 3 entries
        Handle range: 0x0027-0x0029
        UUID: Immediate Alert (0x1802)
        Handle range: 0x002a-0x0056
        UUID: Generic Telephony Bearer (0x184c)
        Handle range: 0x0057-0x0083
        UUID: Telephony Bearer (0x184b)
> HCI Event: Number of Completed Packets (0x13) plen 5     #103 [hci1] 8.147944
        Num handles: 1
        Handle: 3207 Address: DF:A9:FF:F6:B1:1A (OUI DF-A9-FF)
        Count: 1
        #102: len 24 (1 Kb/s)
        Latency: 163 msec (71-171 msec ~164 msec)
> ACL Data RX: Handle 3207 flags 0x02 dlen 11              #104 [hci1] 8.148224
      ATT: Read By Group Type Request (0x10) len 6
        Handle range: 0x0084-0xffff
        Attribute group type: Primary Service (0x2800)
< HCI Command: Host Number of Comp.. (0x03|0x0035) plen 5  #105 [hci1] 8.163954
        Num handles: 1
        Handle: 3207 Address: DF:A9:FF:F6:B1:1A (OUI DF-A9-FF)
        Count: 1
< ACL Data TX: Handle 3207 flags 0x00 dlen 9               #106 [hci1] 8.164182
      ATT: Error Response (0x01) len 4
        Read By Group Type Request (0x10)
        Handle: 0x0084
        Error: Attribute Not Found (0x0a)
> HCI Event: Number of Completed Packets (0x13) plen 5     #107 [hci1] 8.323046
        Num handles: 1
        Handle: 3207 Address: DF:A9:FF:F6:B1:1A (OUI DF-A9-FF)
        Count: 1
        #106: len 9 (0 Kb/s)
        Latency: 158 msec (71-171 msec ~161 msec)
> ACL Data RX: Handle 3207 flags 0x02 dlen 13              #108 [hci1] 8.323200
      ATT: Find By Type Value Request (0x06) len 8
        Handle range: 0x0001-0xffff
        Attribute type: Primary Service (0x2800)
          UUID: Generic Telephony Bearer (0x184c)
< HCI Command: Host Number of Comp.. (0x03|0x0035) plen 5  #109 [hci1] 8.324115
        Num handles: 1
        Handle: 3207 Address: DF:A9:FF:F6:B1:1A (OUI DF-A9-FF)
        Count: 1
< ACL Data TX: Handle 3207 flags 0x00 dlen 9               #110 [hci1] 8.324191
      ATT: Find By Type Value Response (0x07) len 4
        Handle range: 0x002a-0x0056
> HCI Event: Number of Completed Packets (0x13) plen 5     #111 [hci1] 8.497901
        Num handles: 1
        Handle: 3207 Address: DF:A9:FF:F6:B1:1A (OUI DF-A9-FF)
        Count: 1
        #110: len 9 (0 Kb/s)
        Latency: 173 msec (71-173 msec ~167 msec)
> ACL Data RX: Handle 3207 flags 0x02 dlen 13              #112 [hci1] 8.498228
      ATT: Find By Type Value Request (0x06) len 8
        Handle range: 0x0057-0xffff
        Attribute type: Primary Service (0x2800)
          UUID: Generic Telephony Bearer (0x184c)
< HCI Command: Host Number of Comp.. (0x03|0x0035) plen 5  #113 [hci1] 8.503502
        Num handles: 1
        Handle: 3207 Address: DF:A9:FF:F6:B1:1A (OUI DF-A9-FF)
        Count: 1
< ACL Data TX: Handle 3207 flags 0x00 dlen 9               #114 [hci1] 8.503656
      ATT: Error Response (0x01) len 4
        Find By Type Value Request (0x06)
        Handle: 0x0057
        Error: Attribute Not Found (0x0a)
> HCI Event: Number of Completed Packets (0x13) plen 5     #115 [hci1] 8.672987
        Num handles: 1
        Handle: 3207 Address: DF:A9:FF:F6:B1:1A (OUI DF-A9-FF)
        Count: 1
        #114: len 9 (0 Kb/s)
        Latency: 169 msec (71-173 msec ~168 msec)
> ACL Data RX: Handle 3207 flags 0x02 dlen 11              #116 [hci1] 8.673242
      ATT: Read By Type Request (0x08) len 6
        Handle range: 0x002a-0x0056
        Attribute type: Characteristic (0x2803)
< HCI Command: Host Number of Comp.. (0x03|0x0035) plen 5  #117 [hci1] 8.683925
        Num handles: 1
        Handle: 3207 Address: DF:A9:FF:F6:B1:1A (OUI DF-A9-FF)
        Count: 1
< ACL Data TX: Handle 3207 flags 0x00 dlen 20              #118 [hci1] 8.684018
      ATT: Read By Type Response (0x09) len 15
        Attribute data length: 7
        Attribute data list: 2 entries
        Handle: 0x002b
        Value: 122c00b32b
            Properties: 0x12
              Read (0x02)
              Notify (0x10)
            Value Handle: 0x002c
            Value UUID: Bearer Provider Name (0x2bb3)
        Handle: 0x002e
        Value: 022f00b42b
            Properties: 0x02
              Read (0x02)
            Value Handle: 0x002f
            Value UUID: Bearer UCI (0x2bb4)
> HCI Event: Number of Completed Packets (0x13) plen 5     #119 [hci1] 8.847991
        Num handles: 1
        Handle: 3207 Address: DF:A9:FF:F6:B1:1A (OUI DF-A9-FF)
        Count: 1
        #118: len 20 (0 Kb/s)
        Latency: 163 msec (71-173 msec ~166 msec)
> ACL Data RX: Handle 3207 flags 0x02 dlen 11              #120 [hci1] 8.848295
      ATT: Read By Type Request (0x08) len 6
        Handle range: 0x002f-0x0056
        Attribute type: Characteristic (0x2803)
< HCI Command: Host Number of Comp.. (0x03|0x0035) plen 5  #121 [hci1] 8.863743
        Num handles: 1
        Handle: 3207 Address: DF:A9:FF:F6:B1:1A (OUI DF-A9-FF)
        Count: 1
< ACL Data TX: Handle 3207 flags 0x00 dlen 20              #122 [hci1] 8.863863
      ATT: Read By Type Response (0x09) len 15
        Attribute data length: 7
        Attribute data list: 2 entries
        Handle: 0x0030
        Value: 123100b52b
            Properties: 0x12
              Read (0x02)
              Notify (0x10)
            Value Handle: 0x0031
            Value UUID: Bearer Technology (0x2bb5)
        Handle: 0x0033
        Value: 123400b62b
            Properties: 0x12
              Read (0x02)
              Notify (0x10)
            Value Handle: 0x0034
            Value UUID: Bearer URI Schemes Supported List (0x2bb6)
> HCI Event: Number of Completed Packets (0x13) plen 5     #123 [hci1] 9.022881
        Num handles: 1
        Handle: 3207 Address: DF:A9:FF:F6:B1:1A (OUI DF-A9-FF)
        Count: 1
        #122: len 20 (1 Kb/s)
        Latency: 159 msec (71-173 msec ~162 msec)
> ACL Data RX: Handle 3207 flags 0x02 dlen 11              #124 [hci1] 9.023272
      ATT: Read By Type Request (0x08) len 6
        Handle range: 0x0034-0x0056
        Attribute type: Characteristic (0x2803)
< HCI Command: Host Number of Comp.. (0x03|0x0035) plen 5  #125 [hci1] 9.043691
        Num handles: 1
        Handle: 3207 Address: DF:A9:FF:F6:B1:1A (OUI DF-A9-FF)
        Count: 1
< ACL Data TX: Handle 3207 flags 0x00 dlen 20              #126 [hci1] 9.043765
      ATT: Read By Type Response (0x09) len 15
        Attribute data length: 7
        Attribute data list: 2 entries
        Handle: 0x0036
        Value: 123700b72b
            Properties: 0x12
              Read (0x02)
              Notify (0x10)
            Value Handle: 0x0037
            Value UUID: Bearer Signal Strength (0x2bb7)
        Handle: 0x0039
        Value: 0e3a00b82b
            Properties: 0x0e
              Read (0x02)
              Write Without Response (0x04)
              Write (0x08)
            Value Handle: 0x003a
            Value UUID: Bearer Signal Strength Reporting Interval (0x2bb8)
> HCI Event: Number of Completed Packets (0x13) plen 5     #127 [hci1] 9.198013
        Num handles: 1
        Handle: 3207 Address: DF:A9:FF:F6:B1:1A (OUI DF-A9-FF)
        Count: 1
        #126: len 20 (1 Kb/s)
        Latency: 154 msec (71-173 msec ~158 msec)
> ACL Data RX: Handle 3207 flags 0x02 dlen 11              #128 [hci1] 9.198208
      ATT: Read By Type Request (0x08) len 6
        Handle range: 0x003a-0x0056
        Attribute type: Characteristic (0x2803)
< HCI Command: Host Number of Comp.. (0x03|0x0035) plen 5  #129 [hci1] 9.203924
        Num handles: 1
        Handle: 3207 Address: DF:A9:FF:F6:B1:1A (OUI DF-A9-FF)
        Count: 1
< ACL Data TX: Handle 3207 flags 0x00 dlen 20              #130 [hci1] 9.204049
      ATT: Read By Type Response (0x09) len 15
        Attribute data length: 7
        Attribute data list: 2 entries
        Handle: 0x003b
        Value: 123c00b92b
            Properties: 0x12
              Read (0x02)
              Notify (0x10)
            Value Handle: 0x003c
            Value UUID: Bearer List Current Calls (0x2bb9)
        Handle: 0x003e
        Value: 023f00ba2b
            Properties: 0x02
              Read (0x02)
            Value Handle: 0x003f
            Value UUID: Content Control ID (0x2bba)
> HCI Event: Number of Completed Packets (0x13) plen 5     #131 [hci1] 9.372890
        Num handles: 1
        Handle: 3207 Address: DF:A9:FF:F6:B1:1A (OUI DF-A9-FF)
        Count: 1
        #130: len 20 (0 Kb/s)
        Latency: 168 msec (71-173 msec ~163 msec)
> ACL Data RX: Handle 3207 flags 0x02 dlen 11              #132 [hci1] 9.373141
      ATT: Read By Type Request (0x08) len 6
        Handle range: 0x003f-0x0056
        Attribute type: Characteristic (0x2803)
< HCI Command: Host Number of Comp.. (0x03|0x0035) plen 5  #133 [hci1] 9.383936
        Num handles: 1
        Handle: 3207 Address: DF:A9:FF:F6:B1:1A (OUI DF-A9-FF)
        Count: 1
< ACL Data TX: Handle 3207 flags 0x00 dlen 20              #134 [hci1] 9.383958
      ATT: Read By Type Response (0x09) len 15
        Attribute data length: 7
        Attribute data list: 2 entries
        Handle: 0x0040
        Value: 124100bb2b
            Properties: 0x12
              Read (0x02)
              Notify (0x10)
            Value Handle: 0x0041
            Value UUID: Status Flags (0x2bbb)
        Handle: 0x0043
        Value: 124400bc2b
            Properties: 0x12
              Read (0x02)
              Notify (0x10)
            Value Handle: 0x0044
            Value UUID: Incoming Call Target Bearer URI (0x2bbc)
> HCI Event: Number of Completed Packets (0x13) plen 5     #135 [hci1] 9.547910
        Num handles: 1
        Handle: 3207 Address: DF:A9:FF:F6:B1:1A (OUI DF-A9-FF)
        Count: 1
        #134: len 20 (0 Kb/s)
        Latency: 163 msec (71-173 msec ~163 msec)
> ACL Data RX: Handle 3207 flags 0x02 dlen 11              #136 [hci1] 9.548322
      ATT: Read By Type Request (0x08) len 6
        Handle range: 0x0044-0x0056
        Attribute type: Characteristic (0x2803)
< HCI Command: Host Number of Comp.. (0x03|0x0035) plen 5  #137 [hci1] 9.563827
        Num handles: 1
        Handle: 3207 Address: DF:A9:FF:F6:B1:1A (OUI DF-A9-FF)
        Count: 1
< ACL Data TX: Handle 3207 flags 0x00 dlen 20              #138 [hci1] 9.563976
      ATT: Read By Type Response (0x09) len 15
        Attribute data length: 7
        Attribute data list: 2 entries
        Handle: 0x0046
        Value: 124700bd2b
            Properties: 0x12
              Read (0x02)
              Notify (0x10)
            Value Handle: 0x0047
            Value UUID: Call State (0x2bbd)
        Handle: 0x0049
        Value: 1c4a00be2b
            Properties: 0x1c
              Write Without Response (0x04)
              Write (0x08)
              Notify (0x10)
            Value Handle: 0x004a
            Value UUID: Call Control Point (0x2bbe)
> HCI Event: Number of Completed Packets (0x13) plen 5     #139 [hci1] 9.722883
        Num handles: 1
        Handle: 3207 Address: DF:A9:FF:F6:B1:1A (OUI DF-A9-FF)
        Count: 1
        #138: len 20 (1 Kb/s)
        Latency: 158 msec (71-173 msec ~161 msec)
> ACL Data RX: Handle 3207 flags 0x02 dlen 11              #140 [hci1] 9.723189
      ATT: Read By Type Request (0x08) len 6
        Handle range: 0x004a-0x0056
        Attribute type: Characteristic (0x2803)
< HCI Command: Host Number of Comp.. (0x03|0x0035) plen 5  #141 [hci1] 9.743665
        Num handles: 1
        Handle: 3207 Address: DF:A9:FF:F6:B1:1A (OUI DF-A9-FF)
        Count: 1
< ACL Data TX: Handle 3207 flags 0x00 dlen 20              #142 [hci1] 9.743748
      ATT: Read By Type Response (0x09) len 15
        Attribute data length: 7
        Attribute data list: 2 entries
        Handle: 0x004c
        Value: 024d00bf2b
            Properties: 0x02
              Read (0x02)
            Value Handle: 0x004d
            Value UUID: Call Control Point Optional Opcodes (0x2bbf)
        Handle: 0x004e
        Value: 104f00c02b
            Properties: 0x10
              Notify (0x10)
            Value Handle: 0x004f
            Value UUID: Termination Reason (0x2bc0)
> HCI Event: Number of Completed Packets (0x13) plen 5     #143 [hci1] 9.897952
        Num handles: 1
        Handle: 3207 Address: DF:A9:FF:F6:B1:1A (OUI DF-A9-FF)
        Count: 1
        #142: len 20 (1 Kb/s)
        Latency: 154 msec (71-173 msec ~157 msec)
> ACL Data RX: Handle 3207 flags 0x02 dlen 11              #144 [hci1] 9.898247
      ATT: Read By Type Request (0x08) len 6
        Handle range: 0x004f-0x0056
        Attribute type: Characteristic (0x2803)
< HCI Command: Host Number of Comp.. (0x03|0x0035) plen 5  #145 [hci1] 9.903805
        Num handles: 1
        Handle: 3207 Address: DF:A9:FF:F6:B1:1A (OUI DF-A9-FF)
        Count: 1
< ACL Data TX: Handle 3207 flags 0x00 dlen 20              #146 [hci1] 9.903881
      ATT: Read By Type Response (0x09) len 15
        Attribute data length: 7
        Attribute data list: 2 entries
        Handle: 0x0051
        Value: 125200c12b
            Properties: 0x12
              Read (0x02)
              Notify (0x10)
            Value Handle: 0x0052
            Value UUID: Incoming Call (0x2bc1)
        Handle: 0x0054
        Value: 125500c22b
            Properties: 0x12
              Read (0x02)
              Notify (0x10)
            Value Handle: 0x0055
            Value UUID: Call Friendly Name (0x2bc2)
> HCI Event: Number of Completed Packets (0x13) plen 5    #147 [hci1] 10.073004
        Num handles: 1
        Handle: 3207 Address: DF:A9:FF:F6:B1:1A (OUI DF-A9-FF)
        Count: 1
        #146: len 20 (0 Kb/s)
        Latency: 169 msec (71-173 msec ~163 msec)
> ACL Data RX: Handle 3207 flags 0x02 dlen 11             #148 [hci1] 10.073182
      ATT: Read By Type Request (0x08) len 6
        Handle range: 0x0055-0x0056
        Attribute type: Characteristic (0x2803)
< HCI Command: Host Number of Com.. (0x03|0x0035) plen 5  #149 [hci1] 10.083955
        Num handles: 1
        Handle: 3207 Address: DF:A9:FF:F6:B1:1A (OUI DF-A9-FF)
        Count: 1
< ACL Data TX: Handle 3207 flags 0x00 dlen 9              #150 [hci1] 10.084167
      ATT: Error Response (0x01) len 4
        Read By Type Request (0x08)
        Handle: 0x0055
        Error: Attribute Not Found (0x0a)
> HCI Event: Number of Completed Packets (0x13) plen 5    #151 [hci1] 10.247945
        Num handles: 1
        Handle: 3207 Address: DF:A9:FF:F6:B1:1A (OUI DF-A9-FF)
        Count: 1
        #150: len 9 (0 Kb/s)
        Latency: 163 msec (71-173 msec ~163 msec)
> ACL Data RX: Handle 3207 flags 0x02 dlen 13             #152 [hci1] 10.248237
      ATT: Find By Type Value Request (0x06) len 8
        Handle range: 0x0001-0xffff
        Attribute type: Primary Service (0x2800)
          UUID: Generic Telephony Bearer (0x184c)
< HCI Command: Host Number of Com.. (0x03|0x0035) plen 5  #153 [hci1] 10.263899
        Num handles: 1
        Handle: 3207 Address: DF:A9:FF:F6:B1:1A (OUI DF-A9-FF)
        Count: 1
< ACL Data TX: Handle 3207 flags 0x00 dlen 9              #154 [hci1] 10.263980
      ATT: Find By Type Value Response (0x07) len 4
        Handle range: 0x002a-0x0056
> HCI Event: Number of Completed Packets (0x13) plen 5    #155 [hci1] 10.422986
        Num handles: 1
        Handle: 3207 Address: DF:A9:FF:F6:B1:1A (OUI DF-A9-FF)
        Count: 1
        #154: len 9 (0 Kb/s)
        Latency: 159 msec (71-173 msec ~161 msec)
> ACL Data RX: Handle 3207 flags 0x02 dlen 13             #156 [hci1] 10.423229
      ATT: Find By Type Value Request (0x06) len 8
        Handle range: 0x0057-0xffff
        Attribute type: Primary Service (0x2800)
          UUID: Generic Telephony Bearer (0x184c)
< HCI Command: Host Number of Com.. (0x03|0x0035) plen 5  #157 [hci1] 10.443773
        Num handles: 1
        Handle: 3207 Address: DF:A9:FF:F6:B1:1A (OUI DF-A9-FF)
        Count: 1
< ACL Data TX: Handle 3207 flags 0x00 dlen 9              #158 [hci1] 10.443963
      ATT: Error Response (0x01) len 4
        Find By Type Value Request (0x06)
        Handle: 0x0057
        Error: Attribute Not Found (0x0a)
> HCI Event: Number of Completed Packets (0x13) plen 5    #159 [hci1] 10.597940
        Num handles: 1
        Handle: 3207 Address: DF:A9:FF:F6:B1:1A (OUI DF-A9-FF)
        Count: 1
        #158: len 9 (0 Kb/s)
        Latency: 153 msec (71-173 msec ~157 msec)
> ACL Data RX: Handle 3207 flags 0x02 dlen 11             #160 [hci1] 10.598236
      ATT: Read By Type Request (0x08) len 6
        Handle range: 0x002a-0x0056
        Attribute type: Characteristic (0x2803)
< HCI Command: Host Number of Com.. (0x03|0x0035) plen 5  #161 [hci1] 10.603562
        Num handles: 1
        Handle: 3207 Address: DF:A9:FF:F6:B1:1A (OUI DF-A9-FF)
        Count: 1
< ACL Data TX: Handle 3207 flags 0x00 dlen 20             #162 [hci1] 10.603651
      ATT: Read By Type Response (0x09) len 15
        Attribute data length: 7
        Attribute data list: 2 entries
        Handle: 0x002b
        Value: 122c00b32b
            Properties: 0x12
              Read (0x02)
              Notify (0x10)
            Value Handle: 0x002c
            Value UUID: Bearer Provider Name (0x2bb3)
        Handle: 0x002e
        Value: 022f00b42b
            Properties: 0x02
              Read (0x02)
            Value Handle: 0x002f
            Value UUID: Bearer UCI (0x2bb4)
> HCI Event: Number of Completed Packets (0x13) plen 5    #163 [hci1] 10.772881
        Num handles: 1
        Handle: 3207 Address: DF:A9:FF:F6:B1:1A (OUI DF-A9-FF)
        Count: 1
        #162: len 20 (0 Kb/s)
        Latency: 169 msec (71-173 msec ~163 msec)
> ACL Data RX: Handle 3207 flags 0x02 dlen 11             #164 [hci1] 10.773183
      ATT: Read By Type Request (0x08) len 6
        Handle range: 0x002f-0x0056
        Attribute type: Characteristic (0x2803)
< HCI Command: Host Number of Com.. (0x03|0x0035) plen 5  #165 [hci1] 10.783866
        Num handles: 1
        Handle: 3207 Address: DF:A9:FF:F6:B1:1A (OUI DF-A9-FF)
        Count: 1
< ACL Data TX: Handle 3207 flags 0x00 dlen 20             #166 [hci1] 10.783975
      ATT: Read By Type Response (0x09) len 15
        Attribute data length: 7
        Attribute data list: 2 entries
        Handle: 0x0030
        Value: 123100b52b
            Properties: 0x12
              Read (0x02)
              Notify (0x10)
            Value Handle: 0x0031
            Value UUID: Bearer Technology (0x2bb5)
        Handle: 0x0033
        Value: 123400b62b
            Properties: 0x12
              Read (0x02)
              Notify (0x10)
            Value Handle: 0x0034
            Value UUID: Bearer URI Schemes Supported List (0x2bb6)
> HCI Event: Number of Completed Packets (0x13) plen 5    #167 [hci1] 10.947879
        Num handles: 1
        Handle: 3207 Address: DF:A9:FF:F6:B1:1A (OUI DF-A9-FF)
        Count: 1
        #166: len 20 (0 Kb/s)
        Latency: 163 msec (71-173 msec ~163 msec)
> ACL Data RX: Handle 3207 flags 0x02 dlen 11             #168 [hci1] 10.948218
      ATT: Read By Type Request (0x08) len 6
        Handle range: 0x0034-0x0056
        Attribute type: Characteristic (0x2803)
< HCI Command: Host Number of Com.. (0x03|0x0035) plen 5  #169 [hci1] 10.963901
        Num handles: 1
        Handle: 3207 Address: DF:A9:FF:F6:B1:1A (OUI DF-A9-FF)
        Count: 1
< ACL Data TX: Handle 3207 flags 0x00 dlen 20             #170 [hci1] 10.963984
      ATT: Read By Type Response (0x09) len 15
        Attribute data length: 7
        Attribute data list: 2 entries
        Handle: 0x0036
        Value: 123700b72b
            Properties: 0x12
              Read (0x02)
              Notify (0x10)
            Value Handle: 0x0037
            Value UUID: Bearer Signal Strength (0x2bb7)
        Handle: 0x0039
        Value: 0e3a00b82b
            Properties: 0x0e
              Read (0x02)
              Write Without Response (0x04)
              Write (0x08)
            Value Handle: 0x003a
            Value UUID: Bearer Signal Strength Reporting Interval (0x2bb8)
> HCI Event: Number of Completed Packets (0x13) plen 5    #171 [hci1] 11.122896
        Num handles: 1
        Handle: 3207 Address: DF:A9:FF:F6:B1:1A (OUI DF-A9-FF)
        Count: 1
        #170: len 20 (1 Kb/s)
        Latency: 158 msec (71-173 msec ~161 msec)
> ACL Data RX: Handle 3207 flags 0x02 dlen 11             #172 [hci1] 11.123162
      ATT: Read By Type Request (0x08) len 6
        Handle range: 0x003a-0x0056
        Attribute type: Characteristic (0x2803)
< HCI Command: Host Number of Com.. (0x03|0x0035) plen 5  #173 [hci1] 11.123803
        Num handles: 1
        Handle: 3207 Address: DF:A9:FF:F6:B1:1A (OUI DF-A9-FF)
        Count: 1
< ACL Data TX: Handle 3207 flags 0x00 dlen 20             #174 [hci1] 11.123927
      ATT: Read By Type Response (0x09) len 15
        Attribute data length: 7
        Attribute data list: 2 entries
        Handle: 0x003b
        Value: 123c00b92b
            Properties: 0x12
              Read (0x02)
              Notify (0x10)
            Value Handle: 0x003c
            Value UUID: Bearer List Current Calls (0x2bb9)
        Handle: 0x003e
        Value: 023f00ba2b
            Properties: 0x02
              Read (0x02)
            Value Handle: 0x003f
            Value UUID: Content Control ID (0x2bba)
> HCI Event: Number of Completed Packets (0x13) plen 5    #175 [hci1] 11.297939
        Num handles: 1
        Handle: 3207 Address: DF:A9:FF:F6:B1:1A (OUI DF-A9-FF)
        Count: 1
        #174: len 20 (0 Kb/s)
        Latency: 174 msec (71-174 msec ~167 msec)
> ACL Data RX: Handle 3207 flags 0x02 dlen 11             #176 [hci1] 11.298093
      ATT: Read By Type Request (0x08) len 6
        Handle range: 0x003f-0x0056
        Attribute type: Characteristic (0x2803)
< HCI Command: Host Number of Com.. (0x03|0x0035) plen 5  #177 [hci1] 11.303687
        Num handles: 1
        Handle: 3207 Address: DF:A9:FF:F6:B1:1A (OUI DF-A9-FF)
        Count: 1
< ACL Data TX: Handle 3207 flags 0x00 dlen 20             #178 [hci1] 11.303773
      ATT: Read By Type Response (0x09) len 15
        Attribute data length: 7
        Attribute data list: 2 entries
        Handle: 0x0040
        Value: 124100bb2b
            Properties: 0x12
              Read (0x02)
              Notify (0x10)
            Value Handle: 0x0041
            Value UUID: Status Flags (0x2bbb)
        Handle: 0x0043
        Value: 124400bc2b
            Properties: 0x12
              Read (0x02)
              Notify (0x10)
            Value Handle: 0x0044
            Value UUID: Incoming Call Target Bearer URI (0x2bbc)
> HCI Event: Number of Completed Packets (0x13) plen 5    #179 [hci1] 11.472872
        Num handles: 1
        Handle: 3207 Address: DF:A9:FF:F6:B1:1A (OUI DF-A9-FF)
        Count: 1
        #178: len 20 (0 Kb/s)
        Latency: 169 msec (71-174 msec ~168 msec)
> ACL Data RX: Handle 3207 flags 0x02 dlen 11             #180 [hci1] 11.473108
      ATT: Read By Type Request (0x08) len 6
        Handle range: 0x0044-0x0056
        Attribute type: Characteristic (0x2803)
< HCI Command: Host Number of Com.. (0x03|0x0035) plen 5  #181 [hci1] 11.483791
        Num handles: 1
        Handle: 3207 Address: DF:A9:FF:F6:B1:1A (OUI DF-A9-FF)
        Count: 1
< ACL Data TX: Handle 3207 flags 0x00 dlen 20             #182 [hci1] 11.483906
      ATT: Read By Type Response (0x09) len 15
        Attribute data length: 7
        Attribute data list: 2 entries
        Handle: 0x0046
        Value: 124700bd2b
            Properties: 0x12
              Read (0x02)
              Notify (0x10)
            Value Handle: 0x0047
            Value UUID: Call State (0x2bbd)
        Handle: 0x0049
        Value: 1c4a00be2b
            Properties: 0x1c
              Write Without Response (0x04)
              Write (0x08)
              Notify (0x10)
            Value Handle: 0x004a
            Value UUID: Call Control Point (0x2bbe)
> HCI Event: Number of Completed Packets (0x13) plen 5    #183 [hci1] 11.647859
        Num handles: 1
        Handle: 3207 Address: DF:A9:FF:F6:B1:1A (OUI DF-A9-FF)
        Count: 1
        #182: len 20 (0 Kb/s)
        Latency: 163 msec (71-174 msec ~166 msec)
> ACL Data RX: Handle 3207 flags 0x02 dlen 11             #184 [hci1] 11.648159
      ATT: Read By Type Request (0x08) len 6
        Handle range: 0x004a-0x0056
        Attribute type: Characteristic (0x2803)
< HCI Command: Host Number of Com.. (0x03|0x0035) plen 5  #185 [hci1] 11.663923
        Num handles: 1
        Handle: 3207 Address: DF:A9:FF:F6:B1:1A (OUI DF-A9-FF)
        Count: 1
< ACL Data TX: Handle 3207 flags 0x00 dlen 20             #186 [hci1] 11.664009
      ATT: Read By Type Response (0x09) len 15
        Attribute data length: 7
        Attribute data list: 2 entries
        Handle: 0x004c
        Value: 024d00bf2b
            Properties: 0x02
              Read (0x02)
            Value Handle: 0x004d
            Value UUID: Call Control Point Optional Opcodes (0x2bbf)
        Handle: 0x004e
        Value: 104f00c02b
            Properties: 0x10
              Notify (0x10)
            Value Handle: 0x004f
            Value UUID: Termination Reason (0x2bc0)
> HCI Event: Number of Completed Packets (0x13) plen 5    #187 [hci1] 11.822983
        Num handles: 1
        Handle: 3207 Address: DF:A9:FF:F6:B1:1A (OUI DF-A9-FF)
        Count: 1
        #186: len 20 (1 Kb/s)
        Latency: 158 msec (71-174 msec ~162 msec)
> ACL Data RX: Handle 3207 flags 0x02 dlen 11             #188 [hci1] 11.823128
      ATT: Read By Type Request (0x08) len 6
        Handle range: 0x004f-0x0056
        Attribute type: Characteristic (0x2803)
< HCI Command: Host Number of Com.. (0x03|0x0035) plen 5  #189 [hci1] 11.823678
        Num handles: 1
        Handle: 3207 Address: DF:A9:FF:F6:B1:1A (OUI DF-A9-FF)
        Count: 1
< ACL Data TX: Handle 3207 flags 0x00 dlen 20             #190 [hci1] 11.823762
      ATT: Read By Type Response (0x09) len 15
        Attribute data length: 7
        Attribute data list: 2 entries
        Handle: 0x0051
        Value: 125200c12b
            Properties: 0x12
              Read (0x02)
              Notify (0x10)
            Value Handle: 0x0052
            Value UUID: Incoming Call (0x2bc1)
        Handle: 0x0054
        Value: 125500c22b
            Properties: 0x12
              Read (0x02)
              Notify (0x10)
            Value Handle: 0x0055
            Value UUID: Call Friendly Name (0x2bc2)
> HCI Event: Number of Completed Packets (0x13) plen 5    #191 [hci1] 11.997902
        Num handles: 1
        Handle: 3207 Address: DF:A9:FF:F6:B1:1A (OUI DF-A9-FF)
        Count: 1
        #190: len 20 (0 Kb/s)
        Latency: 174 msec (71-174 msec ~168 msec)
> ACL Data RX: Handle 3207 flags 0x02 dlen 11             #192 [hci1] 11.998242
      ATT: Read By Type Request (0x08) len 6
        Handle range: 0x0055-0x0056
        Attribute type: Characteristic (0x2803)
< HCI Command: Host Number of Com.. (0x03|0x0035) plen 5  #193 [hci1] 12.003896
        Num handles: 1
        Handle: 3207 Address: DF:A9:FF:F6:B1:1A (OUI DF-A9-FF)
        Count: 1
< ACL Data TX: Handle 3207 flags 0x00 dlen 9              #194 [hci1] 12.004104
      ATT: Error Response (0x01) len 4
        Read By Type Request (0x08)
        Handle: 0x0055
        Error: Attribute Not Found (0x0a)
> HCI Event: Number of Completed Packets (0x13) plen 5    #195 [hci1] 12.173029
        Num handles: 1
        Handle: 3207 Address: DF:A9:FF:F6:B1:1A (OUI DF-A9-FF)
        Count: 1
        #194: len 9 (0 Kb/s)
        Latency: 168 msec (71-174 msec ~168 msec)
> ACL Data RX: Handle 3207 flags 0x02 dlen 9              #196 [hci1] 12.173131
      ATT: Find Information Request (0x04) len 4
        Handle range: 0x002d-0x002d
< HCI Command: Host Number of Com.. (0x03|0x0035) plen 5  #197 [hci1] 12.183508
        Num handles: 1
        Handle: 3207 Address: DF:A9:FF:F6:B1:1A (OUI DF-A9-FF)
        Count: 1
< ACL Data TX: Handle 3207 flags 0x00 dlen 10             #198 [hci1] 12.183535
      ATT: Find Information Response (0x05) len 5
        Format: UUID-16 (0x01)
        Handle: 0x002d
        UUID: Client Characteristic Configuration (0x2902)
> HCI Event: Number of Completed Packets (0x13) plen 5    #199 [hci1] 12.347860
        Num handles: 1
        Handle: 3207 Address: DF:A9:FF:F6:B1:1A (OUI DF-A9-FF)
        Count: 1
        #198: len 10 (0 Kb/s)
        Latency: 164 msec (71-174 msec ~166 msec)
> ACL Data RX: Handle 3207 flags 0x02 dlen 9              #200 [hci1] 12.348086
      ATT: Find Information Request (0x04) len 4
        Handle range: 0x0032-0x0032
< HCI Command: Host Number of Com.. (0x03|0x0035) plen 5  #201 [hci1] 12.363914
        Num handles: 1
        Handle: 3207 Address: DF:A9:FF:F6:B1:1A (OUI DF-A9-FF)
        Count: 1
< ACL Data TX: Handle 3207 flags 0x00 dlen 10             #202 [hci1] 12.364009
      ATT: Find Information Response (0x05) len 5
        Format: UUID-16 (0x01)
        Handle: 0x0032
        UUID: Client Characteristic Configuration (0x2902)
> HCI Event: Number of Completed Packets (0x13) plen 5    #203 [hci1] 12.522941
        Num handles: 1
        Handle: 3207 Address: DF:A9:FF:F6:B1:1A (OUI DF-A9-FF)
        Count: 1
        #202: len 10 (0 Kb/s)
        Latency: 158 msec (71-174 msec ~162 msec)
> ACL Data RX: Handle 3207 flags 0x02 dlen 9              #204 [hci1] 12.523116
      ATT: Find Information Request (0x04) len 4
        Handle range: 0x0035-0x0035
< HCI Command: Host Number of Com.. (0x03|0x0035) plen 5  #205 [hci1] 12.523781
        Num handles: 1
        Handle: 3207 Address: DF:A9:FF:F6:B1:1A (OUI DF-A9-FF)
        Count: 1
< ACL Data TX: Handle 3207 flags 0x00 dlen 10             #206 [hci1] 12.523803
      ATT: Find Information Response (0x05) len 5
        Format: UUID-16 (0x01)
        Handle: 0x0035
        UUID: Client Characteristic Configuration (0x2902)
> HCI Event: Number of Completed Packets (0x13) plen 5    #207 [hci1] 12.697885
        Num handles: 1
        Handle: 3207 Address: DF:A9:FF:F6:B1:1A (OUI DF-A9-FF)
        Count: 1
        #206: len 10 (0 Kb/s)
        Latency: 174 msec (71-174 msec ~168 msec)
> ACL Data RX: Handle 3207 flags 0x02 dlen 9              #208 [hci1] 12.698150
      ATT: Find Information Request (0x04) len 4
        Handle range: 0x0038-0x0038
< HCI Command: Host Number of Com.. (0x03|0x0035) plen 5  #209 [hci1] 12.703863
        Num handles: 1
        Handle: 3207 Address: DF:A9:FF:F6:B1:1A (OUI DF-A9-FF)
        Count: 1
< ACL Data TX: Handle 3207 flags 0x00 dlen 10             #210 [hci1] 12.703979
      ATT: Find Information Response (0x05) len 5
        Format: UUID-16 (0x01)
        Handle: 0x0038
        UUID: Client Characteristic Configuration (0x2902)
> HCI Event: Number of Completed Packets (0x13) plen 5    #211 [hci1] 12.872841
        Num handles: 1
        Handle: 3207 Address: DF:A9:FF:F6:B1:1A (OUI DF-A9-FF)
        Count: 1
        #210: len 10 (0 Kb/s)
        Latency: 168 msec (71-174 msec ~168 msec)
> ACL Data RX: Handle 3207 flags 0x02 dlen 9              #212 [hci1] 12.873139
      ATT: Find Information Request (0x04) len 4
        Handle range: 0x003d-0x003d
< HCI Command: Host Number of Com.. (0x03|0x0035) plen 5  #213 [hci1] 12.883871
        Num handles: 1
        Handle: 3207 Address: DF:A9:FF:F6:B1:1A (OUI DF-A9-FF)
        Count: 1
< ACL Data TX: Handle 3207 flags 0x00 dlen 10             #214 [hci1] 12.883962
      ATT: Find Information Response (0x05) len 5
        Format: UUID-16 (0x01)
        Handle: 0x003d
        UUID: Client Characteristic Configuration (0x2902)
> HCI Event: Number of Completed Packets (0x13) plen 5    #215 [hci1] 13.047873
        Num handles: 1
        Handle: 3207 Address: DF:A9:FF:F6:B1:1A (OUI DF-A9-FF)
        Count: 1
        #214: len 10 (0 Kb/s)
        Latency: 163 msec (71-174 msec ~166 msec)
> ACL Data RX: Handle 3207 flags 0x02 dlen 9              #216 [hci1] 13.048162
      ATT: Find Information Request (0x04) len 4
        Handle range: 0x0042-0x0042
< HCI Command: Host Number of Com.. (0x03|0x0035) plen 5  #217 [hci1] 13.063931
        Num handles: 1
        Handle: 3207 Address: DF:A9:FF:F6:B1:1A (OUI DF-A9-FF)
        Count: 1
< ACL Data TX: Handle 3207 flags 0x00 dlen 10             #218 [hci1] 13.064027
      ATT: Find Information Response (0x05) len 5
        Format: UUID-16 (0x01)
        Handle: 0x0042
        UUID: Client Characteristic Configuration (0x2902)
> HCI Event: Number of Completed Packets (0x13) plen 5    #219 [hci1] 13.222805
        Num handles: 1
        Handle: 3207 Address: DF:A9:FF:F6:B1:1A (OUI DF-A9-FF)
        Count: 1
        #218: len 10 (0 Kb/s)
        Latency: 158 msec (71-174 msec ~162 msec)
> ACL Data RX: Handle 3207 flags 0x02 dlen 9              #220 [hci1] 13.223082
      ATT: Find Information Request (0x04) len 4
        Handle range: 0x0045-0x0045
< HCI Command: Host Number of Com.. (0x03|0x0035) plen 5  #221 [hci1] 13.223625
        Num handles: 1
        Handle: 3207 Address: DF:A9:FF:F6:B1:1A (OUI DF-A9-FF)
        Count: 1
< ACL Data TX: Handle 3207 flags 0x00 dlen 10             #222 [hci1] 13.223684
      ATT: Find Information Response (0x05) len 5
        Format: UUID-16 (0x01)
        Handle: 0x0045
        UUID: Client Characteristic Configuration (0x2902)
> HCI Event: Number of Completed Packets (0x13) plen 5    #223 [hci1] 13.397811
        Num handles: 1
        Handle: 3207 Address: DF:A9:FF:F6:B1:1A (OUI DF-A9-FF)
        Count: 1
        #222: len 10 (0 Kb/s)
        Latency: 174 msec (71-174 msec ~168 msec)
> ACL Data RX: Handle 3207 flags 0x02 dlen 9              #224 [hci1] 13.398039
      ATT: Find Information Request (0x04) len 4
        Handle range: 0x0048-0x0048
< HCI Command: Host Number of Com.. (0x03|0x0035) plen 5  #225 [hci1] 13.403781
        Num handles: 1
        Handle: 3207 Address: DF:A9:FF:F6:B1:1A (OUI DF-A9-FF)
        Count: 1
< ACL Data TX: Handle 3207 flags 0x00 dlen 10             #226 [hci1] 13.403877
      ATT: Find Information Response (0x05) len 5
        Format: UUID-16 (0x01)
        Handle: 0x0048
        UUID: Client Characteristic Configuration (0x2902)
> HCI Event: Number of Completed Packets (0x13) plen 5    #227 [hci1] 13.572863
        Num handles: 1
        Handle: 3207 Address: DF:A9:FF:F6:B1:1A (OUI DF-A9-FF)
        Count: 1
        #226: len 10 (0 Kb/s)
        Latency: 168 msec (71-174 msec ~168 msec)
> ACL Data RX: Handle 3207 flags 0x02 dlen 9              #228 [hci1] 13.573118
      ATT: Find Information Request (0x04) len 4
        Handle range: 0x004b-0x004b
< HCI Command: Host Number of Com.. (0x03|0x0035) plen 5  #229 [hci1] 13.583818
        Num handles: 1
        Handle: 3207 Address: DF:A9:FF:F6:B1:1A (OUI DF-A9-FF)
        Count: 1
< ACL Data TX: Handle 3207 flags 0x00 dlen 10             #230 [hci1] 13.583943
      ATT: Find Information Response (0x05) len 5
        Format: UUID-16 (0x01)
        Handle: 0x004b
        UUID: Client Characteristic Configuration (0x2902)
> HCI Event: Number of Completed Packets (0x13) plen 5    #231 [hci1] 13.747838
        Num handles: 1
        Handle: 3207 Address: DF:A9:FF:F6:B1:1A (OUI DF-A9-FF)
        Count: 1
        #230: len 10 (0 Kb/s)
        Latency: 163 msec (71-174 msec ~166 msec)
> ACL Data RX: Handle 3207 flags 0x02 dlen 9              #232 [hci1] 13.748187
      ATT: Find Information Request (0x04) len 4
        Handle range: 0x0050-0x0050
< HCI Command: Host Number of Com.. (0x03|0x0035) plen 5  #233 [hci1] 13.763892
        Num handles: 1
        Handle: 3207 Address: DF:A9:FF:F6:B1:1A (OUI DF-A9-FF)
        Count: 1
< ACL Data TX: Handle 3207 flags 0x00 dlen 10             #234 [hci1] 13.764002
      ATT: Find Information Response (0x05) len 5
        Format: UUID-16 (0x01)
        Handle: 0x0050
        UUID: Client Characteristic Configuration (0x2902)
> HCI Event: Number of Completed Packets (0x13) plen 5    #235 [hci1] 13.922865
        Num handles: 1
        Handle: 3207 Address: DF:A9:FF:F6:B1:1A (OUI DF-A9-FF)
        Count: 1
        #234: len 10 (0 Kb/s)
        Latency: 158 msec (71-174 msec ~162 msec)
> ACL Data RX: Handle 3207 flags 0x02 dlen 9              #236 [hci1] 13.923103
      ATT: Find Information Request (0x04) len 4
        Handle range: 0x0053-0x0053
< HCI Command: Host Number of Com.. (0x03|0x0035) plen 5  #237 [hci1] 13.923876
        Num handles: 1
        Handle: 3207 Address: DF:A9:FF:F6:B1:1A (OUI DF-A9-FF)
        Count: 1
< ACL Data TX: Handle 3207 flags 0x00 dlen 10             #238 [hci1] 13.924007
      ATT: Find Information Response (0x05) len 5
        Format: UUID-16 (0x01)
        Handle: 0x0053
        UUID: Client Characteristic Configuration (0x2902)
> HCI Event: Number of Completed Packets (0x13) plen 5    #239 [hci1] 14.097793
        Num handles: 1
        Handle: 3207 Address: DF:A9:FF:F6:B1:1A (OUI DF-A9-FF)
        Count: 1
        #238: len 10 (0 Kb/s)
        Latency: 173 msec (71-174 msec ~168 msec)
> ACL Data RX: Handle 3207 flags 0x02 dlen 9              #240 [hci1] 14.098118
      ATT: Find Information Request (0x04) len 4
        Handle range: 0x0056-0x0056
< HCI Command: Host Number of Com.. (0x03|0x0035) plen 5  #241 [hci1] 14.103362
        Num handles: 1
        Handle: 3207 Address: DF:A9:FF:F6:B1:1A (OUI DF-A9-FF)
        Count: 1
< ACL Data TX: Handle 3207 flags 0x00 dlen 10             #242 [hci1] 14.103388
      ATT: Find Information Response (0x05) len 5
        Format: UUID-16 (0x01)
        Handle: 0x0056
        UUID: Client Characteristic Configuration (0x2902)
> HCI Event: Number of Completed Packets (0x13) plen 5    #243 [hci1] 14.272884
        Num handles: 1
        Handle: 3207 Address: DF:A9:FF:F6:B1:1A (OUI DF-A9-FF)
        Count: 1
        #242: len 10 (0 Kb/s)
        Latency: 169 msec (71-174 msec ~168 msec)
> ACL Data RX: Handle 3207 flags 0x02 dlen 7              #244 [hci1] 14.273012
      ATT: Read Request (0x0a) len 2
        Handle: 0x002d
< HCI Command: Host Number of Com.. (0x03|0x0035) plen 5  #245 [hci1] 14.283552
        Num handles: 1
        Handle: 3207 Address: DF:A9:FF:F6:B1:1A (OUI DF-A9-FF)
        Count: 1
< ACL Data TX: Handle 3207 flags 0x00 dlen 7              #246 [hci1] 14.283587
      ATT: Read Response (0x0b) len 2
> HCI Event: Number of Completed Packets (0x13) plen 5    #247 [hci1] 14.447885
        Num handles: 1
        Handle: 3207 Address: DF:A9:FF:F6:B1:1A (OUI DF-A9-FF)
        Count: 1
        #246: len 7 (0 Kb/s)
        Latency: 164 msec (71-174 msec ~166 msec)
> ACL Data RX: Handle 3207 flags 0x02 dlen 7              #248 [hci1] 14.448008
      ATT: Read Request (0x0a) len 2
        Handle: 0x0032
< HCI Command: Host Number of Com.. (0x03|0x0035) plen 5  #249 [hci1] 14.463913
        Num handles: 1
        Handle: 3207 Address: DF:A9:FF:F6:B1:1A (OUI DF-A9-FF)
        Count: 1
< ACL Data TX: Handle 3207 flags 0x00 dlen 7              #250 [hci1] 14.464029
      ATT: Read Response (0x0b) len 2
> HCI Event: Number of Completed Packets (0x13) plen 5    #251 [hci1] 14.622911
        Num handles: 1
        Handle: 3207 Address: DF:A9:FF:F6:B1:1A (OUI DF-A9-FF)
        Count: 1
        #250: len 7 (0 Kb/s)
        Latency: 158 msec (71-174 msec ~162 msec)
> ACL Data RX: Handle 3207 flags 0x02 dlen 7              #252 [hci1] 14.623055
      ATT: Read Request (0x0a) len 2
        Handle: 0x0035
< HCI Command: Host Number of Com.. (0x03|0x0035) plen 5  #253 [hci1] 14.623847
        Num handles: 1
        Handle: 3207 Address: DF:A9:FF:F6:B1:1A (OUI DF-A9-FF)
        Count: 1
< ACL Data TX: Handle 3207 flags 0x00 dlen 7              #254 [hci1] 14.623937
      ATT: Read Response (0x0b) len 2
> HCI Event: Number of Completed Packets (0x13) plen 5    #255 [hci1] 14.797791
        Num handles: 1
        Handle: 3207 Address: DF:A9:FF:F6:B1:1A (OUI DF-A9-FF)
        Count: 1
        #254: len 7 (0 Kb/s)
        Latency: 173 msec (71-174 msec ~168 msec)
> ACL Data RX: Handle 3207 flags 0x02 dlen 7              #256 [hci1] 14.798041
      ATT: Read Request (0x0a) len 2
        Handle: 0x0038
< HCI Command: Host Number of Com.. (0x03|0x0035) plen 5  #257 [hci1] 14.803949
        Num handles: 1
        Handle: 3207 Address: DF:A9:FF:F6:B1:1A (OUI DF-A9-FF)
        Count: 1
< ACL Data TX: Handle 3207 flags 0x00 dlen 7              #258 [hci1] 14.804046
      ATT: Read Response (0x0b) len 2
> HCI Event: Number of Completed Packets (0x13) plen 5    #259 [hci1] 14.972881
        Num handles: 1
        Handle: 3207 Address: DF:A9:FF:F6:B1:1A (OUI DF-A9-FF)
        Count: 1
        #258: len 7 (0 Kb/s)
        Latency: 168 msec (71-174 msec ~168 msec)
> ACL Data RX: Handle 3207 flags 0x02 dlen 7              #260 [hci1] 14.972982
      ATT: Read Request (0x0a) len 2
        Handle: 0x0037 Type: Bearer Signal Strength (0x2bb7)
< HCI Command: Host Number of Com.. (0x03|0x0035) plen 5  #261 [hci1] 14.983953
        Num handles: 1
        Handle: 3207 Address: DF:A9:FF:F6:B1:1A (OUI DF-A9-FF)
        Count: 1
< ACL Data TX: Handle 3207 flags 0x00 dlen 6              #262 [hci1] 14.984074
      ATT: Read Response (0x0b) len 1
> HCI Event: Number of Completed Packets (0x13) plen 5    #263 [hci1] 15.147799
        Num handles: 1
        Handle: 3207 Address: DF:A9:FF:F6:B1:1A (OUI DF-A9-FF)
        Count: 1
        #262: len 6 (0 Kb/s)
        Latency: 163 msec (71-174 msec ~166 msec)
> ACL Data RX: Handle 3207 flags 0x02 dlen 7              #264 [hci1] 15.148025
      ATT: Read Request (0x0a) len 2
        Handle: 0x003a Type: Bearer Signal Strength Reporting Interval (0x2bb8)
< HCI Command: Host Number of Com.. (0x03|0x0035) plen 5  #265 [hci1] 15.163844
        Num handles: 1
        Handle: 3207 Address: DF:A9:FF:F6:B1:1A (OUI DF-A9-FF)
        Count: 1
< ACL Data TX: Handle 3207 flags 0x00 dlen 6              #266 [hci1] 15.163978
      ATT: Read Response (0x0b) len 1
> HCI Event: Number of Completed Packets (0x13) plen 5    #267 [hci1] 15.323048
        Num handles: 1
        Handle: 3207 Address: DF:A9:FF:F6:B1:1A (OUI DF-A9-FF)
        Count: 1
        #266: len 6 (0 Kb/s)
        Latency: 159 msec (71-174 msec ~162 msec)
> ACL Data RX: Handle 3207 flags 0x02 dlen 8              #268 [hci1] 15.323052
      ATT: Write Command (0x52) len 3
        Handle: 0x003a Type: Bearer Signal Strength Reporting Interval (0x2bb8)
          Data: 00
> ACL Data RX: Handle 3207 flags 0x02 dlen 8              #269 [hci1] 15.323396
      ATT: Write Request (0x12) len 3
        Handle: 0x003a Type: Bearer Signal Strength Reporting Interval (0x2bb8)
          Data: 00
< HCI Command: Host Number of Com.. (0x03|0x0035) plen 5  #270 [hci1] 15.323433
        Num handles: 1
        Handle: 3207 Address: DF:A9:FF:F6:B1:1A (OUI DF-A9-FF)
        Count: 1
< HCI Command: Host Number of Com.. (0x03|0x0035) plen 5  #271 [hci1] 15.343308
        Num handles: 1
        Handle: 3207 Address: DF:A9:FF:F6:B1:1A (OUI DF-A9-FF)
        Count: 1
< ACL Data TX: Handle 3207 flags 0x00 dlen 5              #272 [hci1] 15.343355
      ATT: Write Response (0x13) len 0
> HCI Event: Number of Completed Packets (0x13) plen 5    #273 [hci1] 15.497796
        Num handles: 1
        Handle: 3207 Address: DF:A9:FF:F6:B1:1A (OUI DF-A9-FF)
        Count: 1
        #272: len 5 (0 Kb/s)
        Latency: 154 msec (71-174 msec ~158 msec)
> ACL Data RX: Handle 3207 flags 0x02 dlen 7              #274 [hci1] 15.498013
      ATT: Read Request (0x0a) len 2
        Handle: 0x003d
< HCI Command: Host Number of Com.. (0x03|0x0035) plen 5  #275 [hci1] 15.503934
        Num handles: 1
        Handle: 3207 Address: DF:A9:FF:F6:B1:1A (OUI DF-A9-FF)
        Count: 1
< ACL Data TX: Handle 3207 flags 0x00 dlen 7              #276 [hci1] 15.504041
      ATT: Read Response (0x0b) len 2
> HCI Event: Number of Completed Packets (0x13) plen 5    #277 [hci1] 15.672822
        Num handles: 1
        Handle: 3207 Address: DF:A9:FF:F6:B1:1A (OUI DF-A9-FF)
        Count: 1
        #276: len 7 (0 Kb/s)
        Latency: 168 msec (71-174 msec ~163 msec)
> ACL Data RX: Handle 3207 flags 0x02 dlen 7              #278 [hci1] 15.672969
      ATT: Read Request (0x0a) len 2
        Handle: 0x003f Type: Content Control ID (0x2bba)
< HCI Command: Host Number of Com.. (0x03|0x0035) plen 5  #279 [hci1] 15.683268
        Num handles: 1
        Handle: 3207 Address: DF:A9:FF:F6:B1:1A (OUI DF-A9-FF)
        Count: 1
< ACL Data TX: Handle 3207 flags 0x00 dlen 6              #280 [hci1] 15.683297
      ATT: Read Response (0x0b) len 1
        Handle: 0x003f Type: Content Control ID (0x2bba)
        Value: 00
          Content Control ID: 0x00
> HCI Event: Number of Completed Packets (0x13) plen 5    #281 [hci1] 15.847764
        Num handles: 1
        Handle: 3207 Address: DF:A9:FF:F6:B1:1A (OUI DF-A9-FF)
        Count: 1
        #280: len 6 (0 Kb/s)
        Latency: 164 msec (71-174 msec ~164 msec)
> ACL Data RX: Handle 3207 flags 0x02 dlen 7              #282 [hci1] 15.847993
      ATT: Read Request (0x0a) len 2
        Handle: 0x0042
< HCI Command: Host Number of Com.. (0x03|0x0035) plen 5  #283 [hci1] 15.863921
        Num handles: 1
        Handle: 3207 Address: DF:A9:FF:F6:B1:1A (OUI DF-A9-FF)
        Count: 1
< ACL Data TX: Handle 3207 flags 0x00 dlen 7              #284 [hci1] 15.863946
      ATT: Read Response (0x0b) len 2
> HCI Event: Number of Completed Packets (0x13) plen 5    #285 [hci1] 16.022906
        Num handles: 1
        Handle: 3207 Address: DF:A9:FF:F6:B1:1A (OUI DF-A9-FF)
        Count: 1
        #284: len 7 (0 Kb/s)
        Latency: 158 msec (71-174 msec ~161 msec)
> ACL Data RX: Handle 3207 flags 0x02 dlen 7              #286 [hci1] 16.023045
      ATT: Read Request (0x0a) len 2
        Handle: 0x0041 Type: Status Flags (0x2bbb)
< HCI Command: Host Number of Com.. (0x03|0x0035) plen 5  #287 [hci1] 16.023645
        Num handles: 1
        Handle: 3207 Address: DF:A9:FF:F6:B1:1A (OUI DF-A9-FF)
        Count: 1
< ACL Data TX: Handle 3207 flags 0x00 dlen 7              #288 [hci1] 16.023699
      ATT: Read Response (0x0b) len 2
> HCI Event: Number of Completed Packets (0x13) plen 5    #289 [hci1] 16.197752
        Num handles: 1
        Handle: 3207 Address: DF:A9:FF:F6:B1:1A (OUI DF-A9-FF)
        Count: 1
        #288: len 7 (0 Kb/s)
        Latency: 174 msec (71-174 msec ~167 msec)
> ACL Data RX: Handle 3207 flags 0x02 dlen 7              #290 [hci1] 16.198020
      ATT: Read Request (0x0a) len 2
        Handle: 0x0045
< HCI Command: Host Number of Com.. (0x03|0x0035) plen 5  #291 [hci1] 16.203936
        Num handles: 1
        Handle: 3207 Address: DF:A9:FF:F6:B1:1A (OUI DF-A9-FF)
        Count: 1
< ACL Data TX: Handle 3207 flags 0x00 dlen 7              #292 [hci1] 16.204012
      ATT: Read Response (0x0b) len 2
> HCI Event: Number of Completed Packets (0x13) plen 5    #293 [hci1] 16.372771
        Num handles: 1
        Handle: 3207 Address: DF:A9:FF:F6:B1:1A (OUI DF-A9-FF)
        Count: 1
        #292: len 7 (0 Kb/s)
        Latency: 168 msec (71-174 msec ~168 msec)
> ACL Data RX: Handle 3207 flags 0x02 dlen 7              #294 [hci1] 16.373058
      ATT: Read Request (0x0a) len 2
        Handle: 0x0048
< HCI Command: Host Number of Com.. (0x03|0x0035) plen 5  #295 [hci1] 16.384033
        Num handles: 1
        Handle: 3207 Address: DF:A9:FF:F6:B1:1A (OUI DF-A9-FF)
        Count: 1
< ACL Data TX: Handle 3207 flags 0x00 dlen 7              #296 [hci1] 16.384306
      ATT: Read Response (0x0b) len 2
> HCI Event: Number of Completed Packets (0x13) plen 5    #297 [hci1] 16.547792
        Num handles: 1
        Handle: 3207 Address: DF:A9:FF:F6:B1:1A (OUI DF-A9-FF)
        Count: 1
        #296: len 7 (0 Kb/s)
        Latency: 163 msec (71-174 msec ~165 msec)
> ACL Data RX: Handle 3207 flags 0x02 dlen 7              #298 [hci1] 16.548027
      ATT: Read Request (0x0a) len 2
        Handle: 0x004b
< HCI Command: Host Number of Com.. (0x03|0x0035) plen 5  #299 [hci1] 16.563967
        Num handles: 1
        Handle: 3207 Address: DF:A9:FF:F6:B1:1A (OUI DF-A9-FF)
        Count: 1
< ACL Data TX: Handle 3207 flags 0x00 dlen 7              #300 [hci1] 16.564069
      ATT: Read Response (0x0b) len 2
> HCI Event: Number of Completed Packets (0x13) plen 5    #301 [hci1] 16.722753
        Num handles: 1
        Handle: 3207 Address: DF:A9:FF:F6:B1:1A (OUI DF-A9-FF)
        Count: 1
        #300: len 7 (0 Kb/s)
        Latency: 158 msec (71-174 msec ~162 msec)
> ACL Data RX: Handle 3207 flags 0x02 dlen 7              #302 [hci1] 16.723024
      ATT: Read Request (0x0a) len 2
        Handle: 0x004d Type: Call Control Point Optional Opcodes (0x2bbf)
< HCI Command: Host Number of Com.. (0x03|0x0035) plen 5  #303 [hci1] 16.723924
        Num handles: 1
        Handle: 3207 Address: DF:A9:FF:F6:B1:1A (OUI DF-A9-FF)
        Count: 1
< ACL Data TX: Handle 3207 flags 0x00 dlen 7              #304 [hci1] 16.724047
      ATT: Read Response (0x0b) len 2
> HCI Event: Number of Completed Packets (0x13) plen 5    #305 [hci1] 16.897855
        Num handles: 1
        Handle: 3207 Address: DF:A9:FF:F6:B1:1A (OUI DF-A9-FF)
        Count: 1
        #304: len 7 (0 Kb/s)
        Latency: 173 msec (71-174 msec ~168 msec)
> ACL Data RX: Handle 3207 flags 0x02 dlen 7              #306 [hci1] 16.898003
      ATT: Read Request (0x0a) len 2
        Handle: 0x0050
< HCI Command: Host Number of Com.. (0x03|0x0035) plen 5  #307 [hci1] 16.904001
        Num handles: 1
        Handle: 3207 Address: DF:A9:FF:F6:B1:1A (OUI DF-A9-FF)
        Count: 1
< ACL Data TX: Handle 3207 flags 0x00 dlen 7              #308 [hci1] 16.904080
      ATT: Read Response (0x0b) len 2
> HCI Event: Number of Completed Packets (0x13) plen 5    #309 [hci1] 17.072837
        Num handles: 1
        Handle: 3207 Address: DF:A9:FF:F6:B1:1A (OUI DF-A9-FF)
        Count: 1
        #308: len 7 (0 Kb/s)
        Latency: 168 msec (71-174 msec ~168 msec)
> ACL Data RX: Handle 3207 flags 0x02 dlen 7              #310 [hci1] 17.072980
      ATT: Read Request (0x0a) len 2
        Handle: 0x0053
< HCI Command: Host Number of Com.. (0x03|0x0035) plen 5  #311 [hci1] 17.084144
        Num handles: 1
        Handle: 3207 Address: DF:A9:FF:F6:B1:1A (OUI DF-A9-FF)
        Count: 1
< ACL Data TX: Handle 3207 flags 0x00 dlen 7              #312 [hci1] 17.084233
      ATT: Read Response (0x0b) len 2
> HCI Event: Number of Completed Packets (0x13) plen 5    #313 [hci1] 17.247817
        Num handles: 1
        Handle: 3207 Address: DF:A9:FF:F6:B1:1A (OUI DF-A9-FF)
        Count: 1
        #312: len 7 (0 Kb/s)
        Latency: 163 msec (71-174 msec ~165 msec)
> ACL Data RX: Handle 3207 flags 0x02 dlen 7              #314 [hci1] 17.247980
      ATT: Read Request (0x0a) len 2
        Handle: 0x0056
< HCI Command: Host Number of Com.. (0x03|0x0035) plen 5  #315 [hci1] 17.263966
        Num handles: 1
        Handle: 3207 Address: DF:A9:FF:F6:B1:1A (OUI DF-A9-FF)
        Count: 1
< ACL Data TX: Handle 3207 flags 0x00 dlen 7              #316 [hci1] 17.264042
      ATT: Read Response (0x0b) len 2
> HCI Event: Number of Completed Packets (0x13) plen 5    #317 [hci1] 17.422646
        Num handles: 1
        Handle: 3207 Address: DF:A9:FF:F6:B1:1A (OUI DF-A9-FF)
        Count: 1
        #316: len 7 (0 Kb/s)
        Latency: 158 msec (71-174 msec ~162 msec)
> HCI Event: Disconnect Complete (0x05) plen 4            #318 [hci1] 18.822993
        Status: Success (0x00)
        Handle: 3207 Address: DF:A9:FF:F6:B1:1A (OUI DF-A9-FF)
        Reason: Remote User Terminated Connection (0x13)
< HCI Command: Reset (0x03|0x0003) plen 0                 #319 [hci1] 23.593380
> HCI Event: Command Complete (0x0e) plen 4               #320 [hci1] 23.593925
      Reset (0x03|0x0003) ncmd 1
        Status: Success (0x00)
@ USER Close: main                                    {0x0001} [hci1] 23.603321
= Close Index: 00:00:00:00:00:00                               [hci1] 23.603328
