Bluetooth monitor ver 5.84
btmon[1289565]: = Note: Linux version 6.8.0-83-generic (x86_64)                                                          0.956858
btmon[1289565]: = Note: Bluetooth subsystem version 2.22                                                                 0.956859
= New Index: 00:00:00:00:00:00 (Primary,UART,hci0)                                                                       0.956861
= Open Index: 00:00:00:00:00:00                                                                                          1.461420
= Index Info: 00:00:00:00:00:00 (Nordic Semiconductor ASA)                                                               1.461428
zephyr.exe[1289567]: @ USER Open: main (privileged) version 2.22                                                {0x0001} 1.461430
zephyr.exe[1289567]: < HCI Command: Reset (0x03|0x0003) plen 0                                                        #1 1.461620
> HCI Event: Command Complete (0x0e) plen 4                                                                           #2 1.462160
      Reset (0x03|0x0003) ncmd 1
        Status: Success (0x00)
zephyr.exe[1289567]: < HCI Command: Read Local Supported Features (0x04|0x0003) plen 0                                #3 1.481426
> HCI Event: Command Complete (0x0e) plen 12                                                                          #4 1.481923
      Read Local Supported Features (0x04|0x0003) ncmd 1
        Status: Success (0x00)
        Features: 0x00 0x00 0x00 0x00 0x60 0x00 0x00 0x00
          BR/EDR Not Supported
          LE Supported (Controller)
zephyr.exe[1289567]: < HCI Command: Read Local Version Information (0x04|0x0001) plen 0                               #5 1.501421
> HCI Event: Command Complete (0x0e) plen 12                                                                          #6 1.501902
      Read Local Version Information (0x04|0x0001) ncmd 1
        Status: Success (0x00)
        HCI version: Reserved (0x0e) - Revision 12520 (0x30e8)
        LMP version: Reserved (0x0e) - Subversion 12520 (0x30e8)
        Manufacturer: Nordic Semiconductor ASA (89)
zephyr.exe[1289567]: < HCI Command: Read Local Supported Commands (0x04|0x0002) plen 0                                #7 1.521428
> HCI Event: Command Complete (0x0e) plen 68                                                                          #8 1.522448
      Read Local Supported Commands (0x04|0x0002) ncmd 1
        Status: Success (0x00)
        Commands: 119 entries
          Disconnect (Octet 0 - Bit 5)
          Read Remote Version Information (Octet 2 - Bit 7)
          Set Event Mask (Octet 5 - Bit 6)
          Reset (Octet 5 - Bit 7)
          Read Connection Accept Timeout (Octet 7 - Bit 2)
          Write Connection Accept Timeout (Octet 7 - Bit 3)
          Read Transmit Power Level (Octet 10 - Bit 2)
          Set Controller To Host Flow Control (Octet 10 - Bit 5)
          Host Buffer Size (Octet 10 - Bit 6)
          Host Number of Completed Packets (Octet 10 - Bit 7)
          Read Local Version Information (Octet 14 - Bit 3)
          Read Local Supported Features (Octet 14 - Bit 5)
          Read BD ADDR (Octet 15 - Bit 1)
          Read RSSI (Octet 15 - Bit 5)
          Set Event Mask Page 2 (Octet 22 - Bit 2)
          LE Set Event Mask (Octet 25 - Bit 0)
          LE Read Buffer Size (Octet 25 - Bit 1)
          LE Read Local Supported Features (Octet 25 - Bit 2)
          LE Set Random Address (Octet 25 - Bit 4)
          LE Set Advertising Parameters (Octet 25 - Bit 5)
          LE Read Advertising Channel TX Power (Octet 25 - Bit 6)
          LE Set Advertising Data (Octet 25 - Bit 7)
          LE Set Scan Response Data (Octet 26 - Bit 0)
          LE Set Advertise Enable (Octet 26 - Bit 1)
          LE Set Scan Parameters (Octet 26 - Bit 2)
          LE Set Scan Enable (Octet 26 - Bit 3)
          LE Create Connection (Octet 26 - Bit 4)
          LE Create Connection Cancel (Octet 26 - Bit 5)
          LE Read Accept List Size (Octet 26 - Bit 6)
          LE Clear Accept List (Octet 26 - Bit 7)
          LE Add Device To Accept List (Octet 27 - Bit 0)
          LE Remove Device From Accept List (Octet 27 - Bit 1)
          LE Connection Update (Octet 27 - Bit 2)
          LE Set Host Channel Classification (Octet 27 - Bit 3)
          LE Read Channel Map (Octet 27 - Bit 4)
          LE Read Remote Used Features (Octet 27 - Bit 5)
          LE Encrypt (Octet 27 - Bit 6)
          LE Rand (Octet 27 - Bit 7)
          LE Start Encryption (Octet 28 - Bit 0)
          LE Long Term Key Request Reply (Octet 28 - Bit 1)
          LE Long Term Key Request Neg Reply (Octet 28 - Bit 2)
          LE Read Supported States (Octet 28 - Bit 3)
          LE Receiver Test (Octet 28 - Bit 4)
          LE Transmitter Test (Octet 28 - Bit 5)
          LE Test End (Octet 28 - Bit 6)
          Read Authenticated Payload Timeout (Octet 32 - Bit 4)
          Write Authenticated Payload Timeout (Octet 32 - Bit 5)
          LE Set Data Length (Octet 33 - Bit 6)
          LE Read Suggested Default Data Length (Octet 33 - Bit 7)
          LE Write Suggested Default Data Length (Octet 34 - Bit 0)
          LE Add Device To Resolving List (Octet 34 - Bit 3)
          LE Remove Device From Resolving List (Octet 34 - Bit 4)
          LE Clear Resolving List (Octet 34 - Bit 5)
          LE Read Resolving List Size (Octet 34 - Bit 6)
          LE Set Address Resolution Enable (Octet 35 - Bit 1)
          LE Set Resolvable Private Address Timeout (Octet 35 - Bit 2)
          LE Read Maximum Data Length (Octet 35 - Bit 3)
          LE Read PHY (Octet 35 - Bit 4)
          LE Set Default PHY (Octet 35 - Bit 5)
          LE Set PHY (Octet 35 - Bit 6)
          LE Enhanced Receiver Test (Octet 35 - Bit 7)
          LE Enhanced Transmitter Test (Octet 36 - Bit 0)
          LE Set Advertising Set Random Address (Octet 36 - Bit 1)
          LE Set Extended Advertising Parameters (Octet 36 - Bit 2)
          LE Set Extended Advertising Data (Octet 36 - Bit 3)
          LE Set Extended Scan Response Data (Octet 36 - Bit 4)
          LE Set Extended Advertising Enable (Octet 36 - Bit 5)
          LE Read Maximum Advertising Data Length (Octet 36 - Bit 6)
          LE Read Number of Supported Advertising Sets (Octet 36 - Bit 7)
          LE Remove Advertising Set (Octet 37 - Bit 0)
          LE Clear Advertising Sets (Octet 37 - Bit 1)
          LE Set Periodic Advertising Parameters (Octet 37 - Bit 2)
          LE Set Periodic Advertising Data (Octet 37 - Bit 3)
          LE Set Periodic Advertising Enable (Octet 37 - Bit 4)
          LE Set Extended Scan Parameters (Octet 37 - Bit 5)
          LE Set Extended Scan Enable (Octet 37 - Bit 6)
          LE Extended Create Connection (Octet 37 - Bit 7)
          LE Periodic Advertising Create Sync (Octet 38 - Bit 0)
          LE Periodic Advertising Create Sync Cancel (Octet 38 - Bit 1)
          LE Periodic Advertising Terminate Sync (Octet 38 - Bit 2)
          LE Add Device To Periodic Advertiser List (Octet 38 - Bit 3)
          LE Remove Device From Periodic Advertiser List (Octet 38 - Bit 4)
          LE Clear Periodic Advertiser List (Octet 38 - Bit 5)
          LE Read Periodic Advertiser List Size (Octet 38 - Bit 6)
          LE Read Transmit Power (Octet 38 - Bit 7)
          LE Read RF Path Compensation (Octet 39 - Bit 0)
          LE Write RF Path Compensation (Octet 39 - Bit 1)
          LE Set Privacy Mode (Octet 39 - Bit 2)
          LE Periodic Advertising Receive Enable (Octet 40 - Bit 5)
          LE Periodic Advertising Sync Transfer (Octet 40 - Bit 6)
          LE Periodic Advertising Set Info Transfer (Octet 40 - Bit 7)
          LE Periodic Advertising Sync Transfer Parameters (Octet 41 - Bit 0)
          LE Set Default Periodic Advertisng Sync Transfer Parameters (Octet 41 - Bit 1)
          LE Read Buffer v2 (Octet 41 - Bit 5)
          LE Read ISO TX Sync (Octet 41 - Bit 6)
          LE Set Connected Isochronous Group Parameters (Octet 41 - Bit 7)
          LE Set Connected Isochronous Group Parameters Test (Octet 42 - Bit 0)
          LE Create Connected Isochronous Stream (Octet 42 - Bit 1)
          LE Remove Connected Isochronous Group (Octet 42 - Bit 2)
          LE Accept Connected Isochronous Stream Request (Octet 42 - Bit 3)
          LE Reject Connected Isochronous Stream Request (Octet 42 - Bit 4)
          LE Create Broadcast Isochronous Group (Octet 42 - Bit 5)
          LE Create Broadcast Isochronous Group Test (Octet 42 - Bit 6)
          LE Terminate Broadcast Isochronous Group (Octet 42 - Bit 7)
          LE Broadcast Isochronous Group Create Sync (Octet 43 - Bit 0)
          LE Broadcast Isochronous Group Terminate Sync (Octet 43 - Bit 1)
          LE Request Peer SCA (Octet 43 - Bit 2)
          LE Setup Isochronous Data Path (Octet 43 - Bit 3)
          LE Remove Isochronous Data Path (Octet 43 - Bit 4)
          LE Isochronous Transmit Test (Octet 43 - Bit 5)
          LE Isochronous Receive Test (Octet 43 - Bit 6)
          LE Isochronous Read Test Counters (Octet 43 - Bit 7)
          LE Isochronous Read Test Counters (Octet 44 - Bit 0)
          LE Set Host Feature (Octet 44 - Bit 1)
          LE Read ISO link quality (Octet 44 - Bit 2)
          Octet 45 - Bit 6 
          Octet 46 - Bit 0 
          Octet 46 - Bit 1 
          Octet 46 - Bit 2 
zephyr.exe[1289567]: < HCI Command: Host Buffer Size (0x03|0x0033) plen 7                                             #9 1.541423
        ACL MTU: 255  ACL max packet: 16
        SCO MTU: 0    SCO max packet: 0
> HCI Event: Command Complete (0x0e) plen 4                                                                          #10 1.541899
      Host Buffer Size (0x03|0x0033) ncmd 1
        Status: Success (0x00)
zephyr.exe[1289567]: < HCI Command: Set Controller To Host Flow Control (0x03|0x0031) plen 1                         #11 1.561459
        Flow control: ACL Data Packets (0x01)
> HCI Event: Command Complete (0x0e) plen 4                                                                          #12 1.561855
      Set Controller To Host Flow Control (0x03|0x0031) ncmd 1
        Status: Success (0x00)
zephyr.exe[1289567]: < HCI Command: LE Read Local Supported Features (0x08|0x0003) plen 0                            #13 1.581426
> HCI Event: Command Complete (0x0e) plen 12                                                                         #14 1.581898
      LE Read Local Supported Features (0x08|0x0003) ncmd 1
        Status: Success (0x00)
        Features: 0xfd 0x79 0x00 0xf7 0x30 0x01 0x00 0x00
          LE Encryption
          Extended Reject Indication
          Peripheral-initiated Features Exchange
          LE Ping
          LE Data Packet Length Extension
          LL Privacy
          Extended Scanner Filter Policies
          LE 2M PHY
          LE Coded PHY
          LE Extended Advertising
          LE Periodic Advertising
          Channel Selection Algorithm #2
          Periodic Advertising Sync Transfer - Sender
          Periodic Advertising Sync Transfer - Recipient
          Sleep Clock Accuracy Updates
          Connected Isochronous Stream - Central
          Connected Isochronous Stream - Peripheral
          Isochronous Broadcaster
          Synchronized Receiver
          Periodic Advertising ADI support
          Connection Subrating
          Unknown features (0x0000010000000000)
zephyr.exe[1289567]: < HCI Command: LE Set Host Feature (0x08|0x0074) plen 2                                         #15 1.601423
        Bit Number: 32
          Connected Isochronous Stream (Host Support)
        Bit Value: 1
> HCI Event: Command Complete (0x0e) plen 4                                                                          #16 1.601825
      LE Set Host Feature (0x08|0x0074) ncmd 1
        Status: Success (0x00)
zephyr.exe[1289567]: < HCI Command: LE Read Buffer v2 (0x08|0x0060) plen 0                                           #17 1.621425
> HCI Event: Command Complete (0x0e) plen 10                                                                         #18 1.621867
      LE Read Buffer v2 (0x08|0x0060) ncmd 1
        Status: Success (0x00)
        ACL MTU: 27
        ACL max packet: 3
        ISO MTU: 318
        ISO max packet: 3
zephyr.exe[1289567]: < HCI Command: LE Read Maximum Advertising Data Length (0x08|0x003a) plen 0                     #19 1.641445
> HCI Event: Command Complete (0x0e) plen 6                                                                          #20 1.641874
      LE Read Maximum Advertising Data Length (0x08|0x003a) ncmd 1
        Status: Success (0x00)
        Max length: 1650
zephyr.exe[1289567]: < HCI Command: LE Read Supported States (0x08|0x001c) plen 0                                    #21 1.661426
> HCI Event: Command Complete (0x0e) plen 12                                                                         #22 1.661936
      LE Read Supported States (0x08|0x001c) ncmd 1
        Status: Success (0x00)
        States: 0x000003ff3e0306ff
          Non-connectable Advertising State
          Scannable Advertising State
          Connectable Advertising State
          High Duty Cycle Directed Advertising State
          Passive Scanning State
          Active Scanning State
          Initiating State
            and Connection State (Central Role)
          Connection State (Peripheral Role)
          Scannable Advertising State
            and Passive Scanning State
          Connectable Advertising State
            and Passive Scanning State
          Non-connectable Advertising State
            and Initiating State
          Scannable Advertising State
            and Initiating State
          Active Scanning State
            and Connection State (Central Role)
          Passive Scanning State
            and Connection State (Peripheral Role)
          Active Scanning State
            and Connection State (Peripheral Role)
          Initiating State
            and Connection State (Central Role)
            and Central Role & Central Role
          Low Duty Cycle Directed Advertising State
          Connectable Advertising State
            and Initiating State
            and Central Role & Peripheral Role
          High Duty Cycle Directed Advertising State
            and Initiating State
            and Central Role & Peripheral Role
          Low Duty Cycle Directed Advertising State
            and Initiating State
            and Central Role & Peripheral Role
          Connectable Advertising State
            and Connection State (Central Role)
            and Central Role & Peripheral Role
          High Duty Cycle Directed Advertising State
            and Connection State (Central Role)
            and Central Role & Peripheral Role
          Low Duty Cycle Directed Advertising State
            and Connection State (Central Role)
            and Central Role & Peripheral Role
          Connectable Advertising State
            and Connection State (Peripheral Role)
            and Central Role & Peripheral Role
          High Duty Cycle Directed Advertising State
            and Connection State (Peripheral Role)
            and Peripheral Role & Peripheral Role
          Low Duty Cycle Directed Advertising State
            and Connection State (Peripheral Role)
            and Peripheral Role & Peripheral Role
          Initiating State
            and Connection State (Peripheral Role)
            and Central Role & Peripheral Role
zephyr.exe[1289567]: < HCI Command: LE Read Maximum Data Length (0x08|0x002f) plen 0                                 #23 1.681422
> HCI Event: Command Complete (0x0e) plen 12                                                                         #24 1.681904
      LE Read Maximum Data Length (0x08|0x002f) ncmd 1
        Status: Success (0x00)
        Max TX octets: 251
        Max TX time: 2704
        Max RX octets: 251
        Max RX time: 2704
zephyr.exe[1289567]: < HCI Command: LE Write Suggested Default Data Length (0x08|0x0024) plen 4                      #25 1.701430
        TX octets: 251
        TX time: 2704
> HCI Event: Command Complete (0x0e) plen 4                                                                          #26 1.701929
      LE Write Suggested Default Data Length (0x08|0x0024) ncmd 1
        Status: Success (0x00)
zephyr.exe[1289567]: < HCI Command: LE Read Resolving List Size (0x08|0x002a) plen 0                                 #27 1.721430
> HCI Event: Command Complete (0x0e) plen 5                                                                          #28 1.721866
      LE Read Resolving List Size (0x08|0x002a) ncmd 1
        Status: Success (0x00)
        Size: 8
zephyr.exe[1289567]: < HCI Command: LE Set Event Mask (0x08|0x0001) plen 8                                           #29 1.741458
        Mask: 0x000002023f87fa5e
          LE Advertising Report
          LE Connection Update Complete
          LE Read Remote Used Features Complete
          LE Long Term Key Request
          LE Data Length Change
          LE Enhanced Connection Complete
          LE PHY Update Complete
          LE Extended Advertising Report
          LE Periodic Advertising Sync Established
          LE Periodic Advertising Report
          LE Periodic Advertising Sync Lost
          LE Extended Scan Timeout
          LE Extended Advertising Set Terminated
          LE Scan Request Received
          LE Periodic Advertising Sync Transfer Rvc
          LE CIS Established
          LE CIS Request
          LE Create BIG Complete
          LE Terminate BIG Complete
          LE BIG Sync Established Complete
          LE BIG Sync Lost
          LE BIG Info Advertising Report
          Unknown mask (0x0000020000000000)
> HCI Event: Command Complete (0x0e) plen 4                                                                          #30 1.741939
      LE Set Event Mask (0x08|0x0001) ncmd 1
        Status: Success (0x00)
zephyr.exe[1289567]: < HCI Command: Set Event Mask (0x03|0x0001) plen 8                                              #31 1.761444
        Mask: 0x2000800002008890
          Disconnection Complete
          Encryption Change
          Read Remote Version Information Complete
          Hardware Error
          Data Buffer Overflow
          Encryption Key Refresh Complete
          LE Meta
> HCI Event: Command Complete (0x0e) plen 4                                                                          #32 1.761972
      Set Event Mask (0x03|0x0001) ncmd 1
        Status: Success (0x00)
zephyr.exe[1289567]: < HCI Command: Read BD ADDR (0x04|0x0009) plen 0                                                #33 1.781460
> HCI Event: Command Complete (0x0e) plen 10                                                                         #34 1.781940
      Read BD ADDR (0x04|0x0009) ncmd 1
        Status: Success (0x00)
        Address: 00:00:00:00:00:00 (OUI 00-00-00)
zephyr.exe[1289567]: < HCI Command: LE Set Random Address (0x08|0x0005) plen 6                                       #35 1.801464
        Address: D5:B6:CC:31:DB:3B (Static)
> HCI Event: Command Complete (0x0e) plen 4                                                                          #36 1.801905
      LE Set Random Address (0x08|0x0005) ncmd 1
        Status: Success (0x00)
zephyr.exe[1289567]: < HCI Command: LE Set Extended Advertising Parameters (0x08|0x0036) plen 25                     #37 5.801580
        Handle: 0x00
        Properties: 0x0013
          Connectable
          Scannable
          Use legacy advertising PDUs: ADV_IND
        Min advertising interval: 100.000 msec (0x00a0)
        Max advertising interval: 150.000 msec (0x00f0)
        Channel map: 37, 38, 39 (0x07)
        Own address type: Random (0x01)
        Peer address type: Public (0x00)
        Peer address: 00:00:00:00:00:00 (OUI 00-00-00)
        Filter policy: Allow Scan Request from Any, Allow Connect Request from Any (0x00)
        TX power: Host has no preference (0x7f)
        Primary PHY: LE 1M (0x01)
        Secondary max skip: 0x00
        Secondary PHY: LE 1M (0x01)
        SID: 0x00
        Scan request notifications: Disabled (0x00)
> HCI Event: Command Complete (0x0e) plen 5                                                                          #38 5.802364
      LE Set Extended Advertising Parameters (0x08|0x0036) ncmd 1
        Status: Success (0x00)
        TX power (selected): 0 dbm (0x00)
zephyr.exe[1289567]: < HCI Command: LE Set Advertising Set Random Address (0x08|0x0035) plen 7                       #39 5.821543
        Advertising handle: 0x00
        Advertising random address: D5:B6:CC:31:DB:3B (Static)
> HCI Event: Command Complete (0x0e) plen 4                                                                          #40 5.822097
      LE Set Advertising Set Random Address (0x08|0x0035) ncmd 1
        Status: Success (0x00)
zephyr.exe[1289567]: < HCI Command: LE Set Extended Advertising Data (0x08|0x0037) plen 22                           #41 5.841529
        Handle: 0x00
        Operation: Complete extended advertising data (0x03)
        Fragment preference: Minimize fragmentation (0x01)
        Data length: 0x12
        Flags: 0x04
          BR/EDR Not Supported
        Name (complete): Tester_2CB6EE
> HCI Event: Command Complete (0x0e) plen 4                                                                          #42 5.842258
      LE Set Extended Advertising Data (0x08|0x0037) ncmd 1
        Status: Success (0x00)
zephyr.exe[1289567]: < HCI Command: LE Set Extended Scan Response Data (0x08|0x0038) plen 4                          #43 5.861529
        Handle: 0x00
        Operation: Complete scan response data (0x03)
        Fragment preference: Minimize fragmentation (0x01)
        Data length: 0x00
> HCI Event: Command Complete (0x0e) plen 4                                                                          #44 5.861969
      LE Set Extended Scan Response Data (0x08|0x0038) ncmd 1
        Status: Success (0x00)
zephyr.exe[1289567]: < HCI Command: LE Set Extended Advertising Enable (0x08|0x0039) plen 6                          #45 5.881554
        Extended advertising: Enabled (0x01)
        Number of sets: 1 (0x01)
        Entry 0
          Handle: 0x00
          Duration: 0 ms (0x00)
          Max ext adv events: 0
> HCI Event: Command Complete (0x0e) plen 4                                                                          #46 5.882081
      LE Set Extended Advertising Enable (0x08|0x0039) ncmd 1
        Status: Success (0x00)
> HCI Event: LE Meta Event (0x3e) plen 31                                                                            #47 6.095907
      LE Enhanced Connection Complete (0x0a)
        Status: Success (0x00)
        Handle: 471
        Role: Peripheral (0x01)
        Peer address type: Public (0x00)
        Peer address: C0:07:E8:2C:B6:EE (OUI C0-07-E8)
        Local resolvable private address: 00:00:00:00:00:00 (Non-Resolvable)
        Peer resolvable private address: 00:00:00:00:00:00 (Non-Resolvable)
        Connection interval: 62.50 msec (0x0032)
        Connection latency: 0 (0x0000)
        Supervision timeout: 20000 msec (0x07d0)
        Central clock accuracy: 0x07
> HCI Event: LE Meta Event (0x3e) plen 6                                                                             #48 6.096016
      LE Advertising Set Terminated (0x12)
        Status: Success (0x00)
        Handle: 0
        Connection handle: 471
        Number of completed extended advertising events: 0
zephyr.exe[1289567]: < HCI Command: LE Read Remote Used Features (0x08|0x0016) plen 2                                #49 6.102786
        Handle: 471 Address: C0:07:E8:2C:B6:EE (OUI C0-07-E8)
> HCI Event: Command Status (0x0f) plen 4                                                                            #50 6.103238
      LE Read Remote Used Features (0x08|0x0016) ncmd 1
        Status: Success (0x00)
zephyr.exe[1289567]: < HCI Command: LE Set PHY (0x08|0x0032) plen 7                                                  #51 6.121593
        Handle: 471 Address: C0:07:E8:2C:B6:EE (OUI C0-07-E8)
        All PHYs preference: 0x00
        TX PHYs preference: 0x02
          LE 2M
        RX PHYs preference: 0x02
          LE 2M
        PHY options preference: Reserved (0x0000)
> HCI Event: Command Status (0x0f) plen 4                                                                            #52 6.122127
      LE Set PHY (0x08|0x0032) ncmd 1
        Status: Success (0x00)
> HCI Event: LE Meta Event (0x3e) plen 12                                                                            #53 6.284857
      LE Read Remote Used Features (0x04)
        Status: Success (0x00)
        Handle: 471 Address: C0:07:E8:2C:B6:EE (OUI C0-07-E8)
        Features: 0x2d 0x49 0x01 0xf7 0xef 0x39 0x00 0x80
          LE Encryption
          Extended Reject Indication
          Peripheral-initiated Features Exchange
          LE Data Packet Length Extension
          LE 2M PHY
          LE Coded PHY
          Channel Selection Algorithm #2
          Minimum Number of Used Channels Procedure
          Periodic Advertising Sync Transfer - Sender
          Periodic Advertising Sync Transfer - Recipient
          Sleep Clock Accuracy Updates
          Connected Isochronous Stream - Central
          Connected Isochronous Stream - Peripheral
          Isochronous Broadcaster
          Synchronized Receiver
          Connected Isochronous Stream (Host Support)
          LE Power Control Request
          LE Power Control Request
          LE Path Loss Monitoring
          Connection Subrating
          Connection Subrating (Host Support)
          Channel Classification
          Unknown features (0x8000390000000000)
> HCI Event: LE Meta Event (0x3e) plen 6                                                                             #54 6.784127
      LE PHY Update Complete (0x0c)
        Status: Success (0x00)
        Handle: 471 Address: C0:07:E8:2C:B6:EE (OUI C0-07-E8)
        TX PHY: LE 2M (0x02)
        RX PHY: LE 2M (0x02)
zephyr.exe[1289567]: < ACL Data TX: Handle 471 [1/3] flags 0x00 dlen 16                                             #55 11.111859
      LE L2CAP: Connection Parameter Update Request (0x12) ident 1 len 8
        Min interval: 24
        Max interval: 40
        Peripheral latency: 0
        Timeout multiplier: 42
> HCI Event: Number of Completed Packets (0x13) plen 5                                                              #56 11.222002
        Num handles: 1
        Handle: 471 Address: C0:07:E8:2C:B6:EE (OUI C0-07-E8)
        Count: 1
        Buffers: 0/3
        #55: len 16 (1 Kb/s)
        Latency: 110 msec (110-110 msec ~110 msec)
> ACL Data RX: Handle 471 flags 0x02 dlen 10                                                                        #57 11.222204
      LE L2CAP: Connection Parameter Update Response (0x13) ident 1 len 2
        Result: Connection Parameters accepted (0x0000)
zephyr.exe[1289567]: < HCI Command: Host Number of Completed Packets (0x03|0x0035) plen 5                           #58 11.241786
        Num handles: 1
        Handle: 471 Address: C0:07:E8:2C:B6:EE (OUI C0-07-E8)
        Count: 1
> ACL Data RX: Handle 471 flags 0x02 dlen 11                                                                        #59 67.285280
      SMP: Pairing Request (0x01) len 6
        IO capability: KeyboardDisplay (0x04)
        OOB data: Authentication data not present (0x00)
        Authentication requirement: Bonding, MITM, SC, No Keypresses (0x0d)
        Max encryption key size: 16
        Initiator key distribution: EncKey IdKey Sign LinkKey (0x0f)
        Responder key distribution: EncKey IdKey Sign LinkKey (0x0f)
zephyr.exe[1289567]: < HCI Command: Host Number of Completed Packets (0x03|0x0035) plen 5                           #60 67.302786
        Num handles: 1
        Handle: 471 Address: C0:07:E8:2C:B6:EE (OUI C0-07-E8)
        Count: 1
zephyr.exe[1289567]: < ACL Data TX: Handle 471 [1/3] flags 0x00 dlen 11                                             #61 67.302870
      SMP: Pairing Response (0x02) len 6
        IO capability: KeyboardDisplay (0x04)
        OOB data: Authentication data not present (0x00)
        Authentication requirement: Bonding, No MITM, SC, No Keypresses (0x09)
        Max encryption key size: 16
        Initiator key distribution: IdKey Sign (0x06)
        Responder key distribution: Sign (0x04)
> HCI Event: Number of Completed Packets (0x13) plen 5                                                              #62 67.410223
        Num handles: 1
        Handle: 471 Address: C0:07:E8:2C:B6:EE (OUI C0-07-E8)
        Count: 1
        Buffers: 0/3
        #61: len 11 (0 Kb/s)
        Latency: 107 msec (107-110 msec ~108 msec)
> ACL Data RX: Handle 471 flags 0x02 dlen 27                                                                        #63 67.410649
> ACL Data RX: Handle 471 flags 0x01 dlen 27                                                                        #64 67.410960
> ACL Data RX: Handle 471 flags 0x01 dlen 15                                                                        #65 67.411308
      SMP: Pairing Public Key (0x0c) len 64
        X[32]: 5b7f8acf59e5015ed0e29aa53ca6cf6e044414deb2116a66a2dc13e1fee03caf
        Y[32]: b3e3c5b195ad4d8ce8d93e334e09830077af98de4047288b25fa333713886ce2
zephyr.exe[1289567]: < HCI Command: Host Number of Completed Packets (0x03|0x0035) plen 5                           #66 67.422825
        Num handles: 1
        Handle: 471 Address: C0:07:E8:2C:B6:EE (OUI C0-07-E8)
        Count: 1
zephyr.exe[1289567]: < HCI Command: Host Number of Completed Packets (0x03|0x0035) plen 5                           #67 67.422928
        Num handles: 1
        Handle: 471 Address: C0:07:E8:2C:B6:EE (OUI C0-07-E8)
        Count: 1
zephyr.exe[1289567]: < HCI Command: Host Number of Completed Packets (0x03|0x0035) plen 5                           #68 67.422970
        Num handles: 1
        Handle: 471 Address: C0:07:E8:2C:B6:EE (OUI C0-07-E8)
        Count: 1
zephyr.exe[1289567]: < ACL Data TX: Handle 471 [1/3] flags 0x00 dlen 27                                             #69 67.423021
zephyr.exe[1289567]: < ACL Data TX: Handle 471 flags 0x01 dlen 27                                                   #70 67.423024
zephyr.exe[1289567]: < ACL Data TX: Handle 471 flags 0x01 dlen 15                                                   #71 67.423029
      SMP: Pairing Public Key (0x0c) len 64
        X[32]: 98308440221e2d910f0e54b71e7ec652857aa9b5a0dc65028824cc19db1226e9
        Y[32]: 67a4816bcb62efb21701e31fdb27561a6217575fb007a8bbdabe7e28b6f68482
> HCI Event: Number of Completed Packets (0x13) plen 5                                                              #72 67.473111
        Num handles: 1
        Handle: 471 Address: C0:07:E8:2C:B6:EE (OUI C0-07-E8)
        Count: 1
        Buffers: 0/3
        #69: len 27 (4 Kb/s)
        Latency: 50 msec (50-110 msec ~79 msec)
> HCI Event: Number of Completed Packets (0x13) plen 5                                                              #73 67.473639
        Num handles: 1
        Handle: 471 Address: C0:07:E8:2C:B6:EE (OUI C0-07-E8)
        Count: 1
        Buffers: underflow/3
        #70: len 27 (4 Kb/s)
        Latency: 50 msec (50-110 msec ~65 msec)
zephyr.exe[1289567]: < ACL Data TX: Handle 471 [1/3] flags 0x00 dlen 21                                             #74 67.482657
      SMP: Pairing Confirm (0x03) len 16
        Confirm value[16]: c72507c6b06db452b7cccbd534a074eb
> HCI Event: Number of Completed Packets (0x13) plen 5                                                              #75 67.535147
        Num handles: 1
        Handle: 471 Address: C0:07:E8:2C:B6:EE (OUI C0-07-E8)
        Count: 1
        Buffers: 0/3
        #71: len 15 (1 Kb/s)
        Latency: 112 msec (50-112 msec ~88 msec)
> HCI Event: Number of Completed Packets (0x13) plen 5                                                              #76 67.597858
        Num handles: 1
        Handle: 471 Address: C0:07:E8:2C:B6:EE (OUI C0-07-E8)
        Count: 1
        Buffers: underflow/3
        #74: len 21 (1 Kb/s)
        Latency: 115 msec (50-115 msec ~101 msec)
> ACL Data RX: Handle 471 flags 0x02 dlen 21                                                                        #77 67.598142
      SMP: Pairing Random (0x04) len 16
        Random value[16]: 151a9fb9a24df557d31480c0af52c584
zephyr.exe[1289567]: < HCI Command: Host Number of Completed Packets (0x03|0x0035) plen 5                           #78 67.602791
        Num handles: 1
        Handle: 471 Address: C0:07:E8:2C:B6:EE (OUI C0-07-E8)
        Count: 1
zephyr.exe[1289567]: < ACL Data TX: Handle 471 [1/3] flags 0x00 dlen 21                                             #79 67.602816
      SMP: Pairing Random (0x04) len 16
        Random value[16]: 8e6108f966a694cbe26df70bb96773e6
> HCI Event: Number of Completed Packets (0x13) plen 5                                                              #80 67.722669
        Num handles: 1
        Handle: 471 Address: C0:07:E8:2C:B6:EE (OUI C0-07-E8)
        Count: 1
        Buffers: 0/3
        #79: len 21 (1 Kb/s)
        Latency: 119 msec (50-119 msec ~110 msec)
> ACL Data RX: Handle 471 flags 0x02 dlen 21                                                                        #81 67.972940
      SMP: Pairing DHKey Check (0x0d) len 16
        E[16]: 408b9af10a32ac4561a56b480df193d8
zephyr.exe[1289567]: < HCI Command: Host Number of Completed Packets (0x03|0x0035) plen 5                           #82 67.982758
        Num handles: 1
        Handle: 471 Address: C0:07:E8:2C:B6:EE (OUI C0-07-E8)
        Count: 1
zephyr.exe[1289567]: < ACL Data TX: Handle 471 [1/3] flags 0x00 dlen 21                                             #83 67.982853
      SMP: Pairing DHKey Check (0x0d) len 16
        E[16]: b56b12696367b0958d4c7d2457e45562
> HCI Event: Number of Completed Packets (0x13) plen 5                                                              #84 68.097689
        Num handles: 1
        Handle: 471 Address: C0:07:E8:2C:B6:EE (OUI C0-07-E8)
        Count: 1
        Buffers: 0/3
        #83: len 21 (1 Kb/s)
        Latency: 114 msec (50-119 msec ~112 msec)
> HCI Event: LE Meta Event (0x3e) plen 13                                                                           #85 68.160685
      LE Long Term Key Request (0x05)
        Handle: 471 Address: C0:07:E8:2C:B6:EE (OUI C0-07-E8)
        Random number: 0x0000000000000000
        Encrypted diversifier: 0x0000
zephyr.exe[1289567]: < HCI Command: LE Long Term Key Request Reply (0x08|0x001a) plen 18                            #86 68.162742
        Handle: 471 Address: C0:07:E8:2C:B6:EE (OUI C0-07-E8)
        Long term key[16]: fb4ca532237d6cdec4c43ac4497faba8
> HCI Event: Command Complete (0x0e) plen 6                                                                         #87 68.163594
      LE Long Term Key Request Reply (0x08|0x001a) ncmd 1
        Status: Success (0x00)
        Handle: 471 Address: C0:07:E8:2C:B6:EE (OUI C0-07-E8)
> HCI Event: Encryption Change (0x08) plen 4                                                                        #88 68.472893
        Status: Success (0x00)
        Handle: 471 Address: C0:07:E8:2C:B6:EE (OUI C0-07-E8)
        Encryption: Enabled with AES-CCM (0x01)
zephyr.exe[1289567]: < ACL Data TX: Handle 471 [1/3] flags 0x00 dlen 21                                             #89 68.592657
      SMP: Signing Information (0x0a) len 16
        Signature key[16]: 5da095555cc64d02679f89a05211af56
> HCI Event: Number of Completed Packets (0x13) plen 5                                                              #90 68.660322
        Num handles: 1
        Handle: 471 Address: C0:07:E8:2C:B6:EE (OUI C0-07-E8)
        Count: 1
        Buffers: 0/3
        #89: len 21 (2 Kb/s)
        Latency: 67 msec (50-119 msec ~90 msec)
> ACL Data RX: Handle 471 flags 0x02 dlen 21                                                                        #91 68.660588
      SMP: Identity Information (0x08) len 16
        Identity resolving key[16]: 6cf0d45ffcfbbc186cdd142739e03843
> ACL Data RX: Handle 471 flags 0x02 dlen 12                                                                        #92 68.660820
      SMP: Identity Address Information (0x09) len 7
        Address: C0:07:E8:2C:B6:EE (OUI C0-07-E8)
zephyr.exe[1289567]: < HCI Command: Host Number of Completed Packets (0x03|0x0035) plen 5                           #93 68.662643
        Num handles: 1
        Handle: 471 Address: C0:07:E8:2C:B6:EE (OUI C0-07-E8)
        Count: 1
zephyr.exe[1289567]: < HCI Command: LE Add Device To Resolving List (0x08|0x0027) plen 39                           #94 68.662910
        Address type: Public (0x00)
        Address: C0:07:E8:2C:B6:EE (OUI C0-07-E8)
        Peer identity resolving key[16]: 6cf0d45ffcfbbc186cdd142739e03843
        Local identity resolving key[16]: 00000000000000000000000000000000
> HCI Event: Command Complete (0x0e) plen 4                                                                         #95 68.663772
      LE Add Device To Resolving List (0x08|0x0027) ncmd 1
        Status: Success (0x00)
zephyr.exe[1289567]: < HCI Command: LE Set Privacy Mode (0x08|0x004e) plen 8                                        #96 68.682669
        Peer Identity address type: Public (0x00)
        Peer Identity address: C0:07:E8:2C:B6:EE (OUI C0-07-E8)
        Privacy Mode: Use Device Privacy (0x01)
> HCI Event: Command Complete (0x0e) plen 4                                                                         #97 68.683182
      LE Set Privacy Mode (0x08|0x004e) ncmd 1
        Status: Success (0x00)
zephyr.exe[1289567]: < HCI Command: LE Set Address Resolution Enable (0x08|0x002d) plen 1                           #98 68.702724
        Address resolution: Enabled (0x01)
> HCI Event: Command Complete (0x0e) plen 4                                                                         #99 68.703129
      LE Set Address Resolution Enable (0x08|0x002d) ncmd 1
        Status: Success (0x00)
zephyr.exe[1289567]: < HCI Command: Host Number of Completed Packets (0x03|0x0035) plen 5                          #100 68.722705
        Num handles: 1
        Handle: 471 Address: C0:07:E8:2C:B6:EE (OUI C0-07-E8)
        Count: 1
> ACL Data RX: Handle 471 flags 0x02 dlen 21                                                                       #101 68.722951
      SMP: Signing Information (0x0a) len 16
        Signature key[16]: 416961f5b0d5a2a1862e0a419eef1bec
zephyr.exe[1289567]: < HCI Command: Host Number of Completed Packets (0x03|0x0035) plen 5                          #102 68.742755
        Num handles: 1
        Handle: 471 Address: C0:07:E8:2C:B6:EE (OUI C0-07-E8)
        Count: 1
> HCI Event: Disconnect Complete (0x05) plen 4                                                                     #103 69.160479
        Status: Success (0x00)
        Handle: 471 Address: C0:07:E8:2C:B6:EE (OUI C0-07-E8)
        Reason: Remote User Terminated Connection (0x13)
zephyr.exe[1289567]: < HCI Command: LE Set Extended Advertising Parameters (0x08|0x0036) plen 25                   #104 69.962690
        Handle: 0x00
        Properties: 0x0013
          Connectable
          Scannable
          Use legacy advertising PDUs: ADV_IND
        Min advertising interval: 100.000 msec (0x00a0)
        Max advertising interval: 150.000 msec (0x00f0)
        Channel map: 37, 38, 39 (0x07)
        Own address type: Random (0x01)
        Peer address type: Public (0x00)
        Peer address: 00:00:00:00:00:00 (OUI 00-00-00)
        Filter policy: Allow Scan Request from Any, Allow Connect Request from Any (0x00)
        TX power: Host has no preference (0x7f)
        Primary PHY: LE 1M (0x01)
        Secondary max skip: 0x00
        Secondary PHY: LE 1M (0x01)
        SID: 0x00
        Scan request notifications: Disabled (0x00)
> HCI Event: Command Complete (0x0e) plen 5                                                                        #105 69.963447
      LE Set Extended Advertising Parameters (0x08|0x0036) ncmd 1
        Status: Success (0x00)
        TX power (selected): 0 dbm (0x00)
zephyr.exe[1289567]: < HCI Command: LE Set Advertising Set Random Address (0x08|0x0035) plen 7                     #106 69.982651
        Advertising handle: 0x00
        Advertising random address: D5:B6:CC:31:DB:3B (Static)
> HCI Event: Command Complete (0x0e) plen 4                                                                        #107 69.983251
      LE Set Advertising Set Random Address (0x08|0x0035) ncmd 1
        Status: Success (0x00)
zephyr.exe[1289567]: < HCI Command: LE Set Extended Advertising Data (0x08|0x0037) plen 22                         #108 70.002653
        Handle: 0x00
        Operation: Complete extended advertising data (0x03)
        Fragment preference: Minimize fragmentation (0x01)
        Data length: 0x12
        Flags: 0x04
          BR/EDR Not Supported
        Name (complete): Tester_2CB6EE
> HCI Event: Command Complete (0x0e) plen 4                                                                        #109 70.003422
      LE Set Extended Advertising Data (0x08|0x0037) ncmd 1
        Status: Success (0x00)
zephyr.exe[1289567]: < HCI Command: LE Set Extended Scan Response Data (0x08|0x0038) plen 4                        #110 70.022644
        Handle: 0x00
        Operation: Complete scan response data (0x03)
        Fragment preference: Minimize fragmentation (0x01)
        Data length: 0x00
> HCI Event: Command Complete (0x0e) plen 4                                                                        #111 70.023050
      LE Set Extended Scan Response Data (0x08|0x0038) ncmd 1
        Status: Success (0x00)
zephyr.exe[1289567]: < HCI Command: LE Set Extended Advertising Enable (0x08|0x0039) plen 6                        #112 70.042644
        Extended advertising: Enabled (0x01)
        Number of sets: 1 (0x01)
        Entry 0
          Handle: 0x00
          Duration: 0 ms (0x00)
          Max ext adv events: 0
> HCI Event: Command Complete (0x0e) plen 4                                                                        #113 70.043232
      LE Set Extended Advertising Enable (0x08|0x0039) ncmd 1
        Status: Success (0x00)
> HCI Event: LE Meta Event (0x3e) plen 31                                                                          #114 70.370815
      LE Enhanced Connection Complete (0x0a)
        Status: Success (0x00)
        Handle: 489
        Role: Peripheral (0x01)
        Peer address type: Public (0x00)
        Peer address: C0:07:E8:2C:B6:EE (OUI C0-07-E8)
        Local resolvable private address: 00:00:00:00:00:00 (Non-Resolvable)
        Peer resolvable private address: 00:00:00:00:00:00 (Non-Resolvable)
        Connection interval: 62.50 msec (0x0032)
        Connection latency: 0 (0x0000)
        Supervision timeout: 20000 msec (0x07d0)
        Central clock accuracy: 0x07
> HCI Event: LE Meta Event (0x3e) plen 6                                                                           #115 70.370968
      LE Advertising Set Terminated (0x12)
        Status: Success (0x00)
        Handle: 0
        Connection handle: 489
        Number of completed extended advertising events: 0
zephyr.exe[1289567]: < HCI Command: LE Read Remote Used Features (0x08|0x0016) plen 2                              #116 70.382791
        Handle: 489 Address: C0:07:E8:2C:B6:EE (OUI C0-07-E8)
> HCI Event: Command Status (0x0f) plen 4                                                                          #117 70.383221
      LE Read Remote Used Features (0x08|0x0016) ncmd 1
        Status: Success (0x00)
zephyr.exe[1289567]: < HCI Command: LE Set PHY (0x08|0x0032) plen 7                                                #118 70.402710
        Handle: 489 Address: C0:07:E8:2C:B6:EE (OUI C0-07-E8)
        All PHYs preference: 0x00
        TX PHYs preference: 0x02
          LE 2M
        RX PHYs preference: 0x02
          LE 2M
        PHY options preference: Reserved (0x0000)
> HCI Event: Command Status (0x0f) plen 4                                                                          #119 70.403273
      LE Set PHY (0x08|0x0032) ncmd 1
        Status: Success (0x00)
> HCI Event: LE Meta Event (0x3e) plen 12                                                                          #120 70.559696
      LE Read Remote Used Features (0x04)
        Status: Success (0x00)
        Handle: 489 Address: C0:07:E8:2C:B6:EE (OUI C0-07-E8)
        Features: 0x2d 0x49 0x01 0xf7 0xef 0x39 0x00 0x80
          LE Encryption
          Extended Reject Indication
          Peripheral-initiated Features Exchange
          LE Data Packet Length Extension
          LE 2M PHY
          LE Coded PHY
          Channel Selection Algorithm #2
          Minimum Number of Used Channels Procedure
          Periodic Advertising Sync Transfer - Sender
          Periodic Advertising Sync Transfer - Recipient
          Sleep Clock Accuracy Updates
          Connected Isochronous Stream - Central
          Connected Isochronous Stream - Peripheral
          Isochronous Broadcaster
          Synchronized Receiver
          Connected Isochronous Stream (Host Support)
          LE Power Control Request
          LE Power Control Request
          LE Path Loss Monitoring
          Connection Subrating
          Connection Subrating (Host Support)
          Channel Classification
          Unknown features (0x8000390000000000)
> HCI Event: LE Meta Event (0x3e) plen 6                                                                           #121 71.059061
      LE PHY Update Complete (0x0c)
        Status: Success (0x00)
        Handle: 489 Address: C0:07:E8:2C:B6:EE (OUI C0-07-E8)
        TX PHY: LE 2M (0x02)
        RX PHY: LE 2M (0x02)
zephyr.exe[1289567]: < ACL Data TX: Handle 489 [1/3] flags 0x00 dlen 7                                             #122 71.082698
      ATT: Read Request (0x0a) len 2
        Handle: 0x0007
> HCI Event: Number of Completed Packets (0x13) plen 5                                                             #123 71.184338
        Num handles: 1
        Handle: 489 Address: C0:07:E8:2C:B6:EE (OUI C0-07-E8)
        Count: 1
        Buffers: 0/3
        #122: len 7 (0 Kb/s)
        Latency: 101 msec (101-101 msec ~101 msec)
> ACL Data RX: Handle 489 flags 0x02 dlen 9                                                                        #124 71.184416
      ATT: Error Response (0x01) len 4
        Read Request (0x0a)
        Handle: 0x0007
        Error: Insufficient Encryption (0x0f)
> ACL Data RX: Handle 489 flags 0x02 dlen 11                                                                       #125 71.184832
      SMP: Pairing Request (0x01) len 6
        IO capability: KeyboardDisplay (0x04)
        OOB data: Authentication data not present (0x00)
        Authentication requirement: Bonding, MITM, SC, No Keypresses (0x0d)
        Max encryption key size: 16
        Initiator key distribution: EncKey IdKey Sign LinkKey (0x0f)
        Responder key distribution: EncKey IdKey Sign LinkKey (0x0f)
zephyr.exe[1289567]: < HCI Command: Host Number of Completed Packets (0x03|0x0035) plen 5                          #126 71.202759
        Num handles: 1
        Handle: 489 Address: C0:07:E8:2C:B6:EE (OUI C0-07-E8)
        Count: 1
zephyr.exe[1289567]: < HCI Command: Host Number of Completed Packets (0x03|0x0035) plen 5                          #127 71.202923
        Num handles: 1
        Handle: 489 Address: C0:07:E8:2C:B6:EE (OUI C0-07-E8)
        Count: 1
zephyr.exe[1289567]: < ACL Data TX: Handle 489 [1/3] flags 0x00 dlen 11                                            #128 71.202928
      SMP: Pairing Response (0x02) len 6
        IO capability: KeyboardDisplay (0x04)
        OOB data: Authentication data not present (0x00)
        Authentication requirement: Bonding, No MITM, SC, No Keypresses (0x09)
        Max encryption key size: 16
        Initiator key distribution: IdKey Sign (0x06)
        Responder key distribution: Sign (0x04)
> HCI Event: Number of Completed Packets (0x13) plen 5                                                             #129 71.309415
        Num handles: 1
        Handle: 489 Address: C0:07:E8:2C:B6:EE (OUI C0-07-E8)
        Count: 1
        Buffers: 0/3
        #128: len 11 (0 Kb/s)
        Latency: 106 msec (101-106 msec ~104 msec)
> ACL Data RX: Handle 489 flags 0x02 dlen 27                                                                       #130 71.309738
> ACL Data RX: Handle 489 flags 0x01 dlen 27                                                                       #131 71.310073
> ACL Data RX: Handle 489 flags 0x01 dlen 15                                                                       #132 71.310408
      SMP: Pairing Public Key (0x0c) len 64
        X[32]: 478084eae00f97f7e1084b03425dc7e987bfb816257f8b240d4eeb41a54e8999
        Y[32]: f5e830334479a2d4c62a01f6a001902b7ffc5d07d51c3d05c84ab4d937cc6702
zephyr.exe[1289567]: < HCI Command: Host Number of Completed Packets (0x03|0x0035) plen 5                          #133 71.322797
        Num handles: 1
        Handle: 489 Address: C0:07:E8:2C:B6:EE (OUI C0-07-E8)
        Count: 1
zephyr.exe[1289567]: < HCI Command: Host Number of Completed Packets (0x03|0x0035) plen 5                          #134 71.323036
        Num handles: 1
        Handle: 489 Address: C0:07:E8:2C:B6:EE (OUI C0-07-E8)
        Count: 1
zephyr.exe[1289567]: < HCI Command: Host Number of Completed Packets (0x03|0x0035) plen 5                          #135 71.323043
        Num handles: 1
        Handle: 489 Address: C0:07:E8:2C:B6:EE (OUI C0-07-E8)
        Count: 1
zephyr.exe[1289567]: < ACL Data TX: Handle 489 [1/3] flags 0x00 dlen 27                                            #136 71.323044
zephyr.exe[1289567]: < ACL Data TX: Handle 489 flags 0x01 dlen 27                                                  #137 71.323046
zephyr.exe[1289567]: < ACL Data TX: Handle 489 flags 0x01 dlen 15                                                  #138 71.323047
      SMP: Pairing Public Key (0x0c) len 64
        X[32]: 98308440221e2d910f0e54b71e7ec652857aa9b5a0dc65028824cc19db1226e9
        Y[32]: 67a4816bcb62efb21701e31fdb27561a6217575fb007a8bbdabe7e28b6f68482
> HCI Event: Number of Completed Packets (0x13) plen 5                                                             #139 71.372241
        Num handles: 1
        Handle: 489 Address: C0:07:E8:2C:B6:EE (OUI C0-07-E8)
        Count: 1
        Buffers: 0/3
        #136: len 27 (4 Kb/s)
        Latency: 49 msec (49-106 msec ~76 msec)
> HCI Event: Number of Completed Packets (0x13) plen 5                                                             #140 71.372661
        Num handles: 1
        Handle: 489 Address: C0:07:E8:2C:B6:EE (OUI C0-07-E8)
        Count: 1
        Buffers: underflow/3
        #137: len 27 (4 Kb/s)
        Latency: 49 msec (49-106 msec ~63 msec)
zephyr.exe[1289567]: < ACL Data TX: Handle 489 [1/3] flags 0x00 dlen 21                                            #141 71.382643
      SMP: Pairing Confirm (0x03) len 16
        Confirm value[16]: 927bcf355b30ad74dc2ccfe993568a4b
> HCI Event: Number of Completed Packets (0x13) plen 5                                                             #142 71.434236
        Num handles: 1
        Handle: 489 Address: C0:07:E8:2C:B6:EE (OUI C0-07-E8)
        Count: 1
        Buffers: 0/3
        #138: len 15 (1 Kb/s)
        Latency: 111 msec (49-111 msec ~87 msec)
> HCI Event: Number of Completed Packets (0x13) plen 5                                                             #143 71.496926
        Num handles: 1
        Handle: 489 Address: C0:07:E8:2C:B6:EE (OUI C0-07-E8)
        Count: 1
        Buffers: underflow/3
        #141: len 21 (1 Kb/s)
        Latency: 114 msec (49-114 msec ~100 msec)
> ACL Data RX: Handle 489 flags 0x02 dlen 21                                                                       #144 71.497182
      SMP: Pairing Random (0x04) len 16
        Random value[16]: 52654854515a9dc015fe69e688fbac96
zephyr.exe[1289567]: < HCI Command: Host Number of Completed Packets (0x03|0x0035) plen 5                          #145 71.502859
        Num handles: 1
        Handle: 489 Address: C0:07:E8:2C:B6:EE (OUI C0-07-E8)
        Count: 1
zephyr.exe[1289567]: < ACL Data TX: Handle 489 [1/3] flags 0x00 dlen 21                                            #146 71.502869
      SMP: Pairing Random (0x04) len 16
        Random value[16]: da64d21ec8845e8286bc235a02440d0c
> HCI Event: Number of Completed Packets (0x13) plen 5                                                             #147 71.621804
        Num handles: 1
        Handle: 489 Address: C0:07:E8:2C:B6:EE (OUI C0-07-E8)
        Count: 1
        Buffers: 0/3
        #146: len 21 (1 Kb/s)
        Latency: 118 msec (49-118 msec ~109 msec)
> ACL Data RX: Handle 489 flags 0x02 dlen 21                                                                       #148 72.309562
      SMP: Pairing DHKey Check (0x0d) len 16
        E[16]: 7dbeef1eb007b85904735611b18e04d3
zephyr.exe[1289567]: < HCI Command: Host Number of Completed Packets (0x03|0x0035) plen 5                          #149 72.322773
        Num handles: 1
        Handle: 489 Address: C0:07:E8:2C:B6:EE (OUI C0-07-E8)
        Count: 1
zephyr.exe[1289567]: < ACL Data TX: Handle 489 [1/3] flags 0x00 dlen 21                                            #150 72.322888
      SMP: Pairing DHKey Check (0x0d) len 16
        E[16]: d5e32b5bbdd9253f9f5d6fa11b32a158
> HCI Event: Number of Completed Packets (0x13) plen 5                                                             #151 72.434235
        Num handles: 1
        Handle: 489 Address: C0:07:E8:2C:B6:EE (OUI C0-07-E8)
        Count: 1
        Buffers: 0/3
        #150: len 21 (1 Kb/s)
        Latency: 111 msec (49-118 msec ~110 msec)
> HCI Event: LE Meta Event (0x3e) plen 13                                                                          #152 72.497248
      LE Long Term Key Request (0x05)
        Handle: 489 Address: C0:07:E8:2C:B6:EE (OUI C0-07-E8)
        Random number: 0x0000000000000000
        Encrypted diversifier: 0x0000
zephyr.exe[1289567]: < HCI Command: LE Long Term Key Request Reply (0x08|0x001a) plen 18                           #153 72.502684
        Handle: 489 Address: C0:07:E8:2C:B6:EE (OUI C0-07-E8)
        Long term key[16]: f700dbd46de4adb4833cb67839f2a6b6
> HCI Event: Command Complete (0x0e) plen 6                                                                        #154 72.503423
      LE Long Term Key Request Reply (0x08|0x001a) ncmd 1
        Status: Success (0x00)
        Handle: 489 Address: C0:07:E8:2C:B6:EE (OUI C0-07-E8)
> HCI Event: Encryption Change (0x08) plen 4                                                                       #155 72.809560
        Status: Success (0x00)
        Handle: 489 Address: C0:07:E8:2C:B6:EE (OUI C0-07-E8)
        Encryption: Enabled with AES-CCM (0x01)
zephyr.exe[1289567]: < HCI Command: LE Set Address Resolution Enable (0x08|0x002d) plen 1                          #156 72.822706
        Address resolution: Disabled (0x00)
> HCI Event: Command Complete (0x0e) plen 4                                                                        #157 72.823074
      LE Set Address Resolution Enable (0x08|0x002d) ncmd 1
        Status: Success (0x00)
zephyr.exe[1289567]: < HCI Command: LE Remove Device From Resolving List (0x08|0x0028) plen 7                      #158 72.842703
        Address type: Public (0x00)
        Address: C0:07:E8:2C:B6:EE (OUI C0-07-E8)
> HCI Event: Command Complete (0x0e) plen 4                                                                        #159 72.843288
      LE Remove Device From Resolving List (0x08|0x0028) ncmd 1
        Status: Success (0x00)
zephyr.exe[1289567]: < ACL Data TX: Handle 489 [1/3] flags 0x00 dlen 21                                            #160 72.972692
      SMP: Signing Information (0x0a) len 16
        Signature key[16]: a2acf8fd71a45c4a1bcadd27bd58e945
> HCI Event: Number of Completed Packets (0x13) plen 5                                                             #161 73.059538
        Num handles: 1
        Handle: 489 Address: C0:07:E8:2C:B6:EE (OUI C0-07-E8)
        Count: 1
        Buffers: 0/3
        #160: len 21 (1 Kb/s)
        Latency: 86 msec (49-118 msec ~98 msec)
> ACL Data RX: Handle 489 flags 0x02 dlen 21                                                                       #162 73.059675
      SMP: Identity Information (0x08) len 16
        Identity resolving key[16]: 6cf0d45ffcfbbc186cdd142739e03843
> ACL Data RX: Handle 489 flags 0x02 dlen 12                                                                       #163 73.059929
      SMP: Identity Address Information (0x09) len 7
        Address: C0:07:E8:2C:B6:EE (OUI C0-07-E8)
zephyr.exe[1289567]: < HCI Command: Host Number of Completed Packets (0x03|0x0035) plen 5                          #164 73.062762
        Num handles: 1
        Handle: 489 Address: C0:07:E8:2C:B6:EE (OUI C0-07-E8)
        Count: 1
zephyr.exe[1289567]: < HCI Command: LE Add Device