Bluetooth monitor ver 5.72
= Note: Linux version 6.14.0-36-generic (x86_64)                       0.495205
= Note: Bluetooth subsystem version 2.22                               0.495206
= New Index: 00:00:00:00:00:00 (Primary,UART,hci1)              [hci1] 0.495208
= New Index: 48:5F:99:8E:E0:64 (Primary,USB,hci0)               [hci0] 0.495208
= Open Index: 00:00:00:00:00:00                                 [hci1] 1.009036
= Index Info: 00:00:00:00:00:00 (Nordic Semiconductor ASA)      [hci1] 1.009057
@ USER Open: main (privileged) version 2.22            {0x0001} [hci1] 1.009065
< HCI Command: Reset (0x03|0x0003) plen 0                    #1 [hci1] 1.010252
> HCI Event: Command Complete (0x0e) plen 4                  #2 [hci1] 1.010775
      Reset (0x03|0x0003) ncmd 1
        Status: Success (0x00)
< HCI Command: Read Local Supported... (0x04|0x0003) plen 0  #3 [hci1] 1.028762
> HCI Event: Command Complete (0x0e) plen 12                 #4 [hci1] 1.029376
      Read Local Supported Features (0x04|0x0003) ncmd 1
        Status: Success (0x00)
        Features: 0x00 0x00 0x00 0x00 0x60 0x00 0x00 0x00
          BR/EDR Not Supported
          LE Supported (Controller)
< HCI Command: Read Local Version In.. (0x04|0x0001) plen 0  #5 [hci1] 1.048484
> HCI Event: Command Complete (0x0e) plen 12                 #6 [hci1] 1.048979
      Read Local Version Information (0x04|0x0001) ncmd 1
        Status: Success (0x00)
        HCI version: Reserved (0x0f) - Revision 12393 (0x3069)
        LMP version: Reserved (0x0f) - Subversion 12393 (0x3069)
        Manufacturer: Nordic Semiconductor ASA (89)
< HCI Command: Read Local Supported... (0x04|0x0002) plen 0  #7 [hci1] 1.068338
> HCI Event: Command Complete (0x0e) plen 68                 #8 [hci1] 1.069405
      Read Local Supported Commands (0x04|0x0002) ncmd 1
        Status: Success (0x00)
        Commands: 119 entries
          Disconnect (Octet 0 - Bit 5)
          Read Remote Version Information (Octet 2 - Bit 7)
          Set Event Mask (Octet 5 - Bit 6)
          Reset (Octet 5 - Bit 7)
          Read Connection Accept Timeout (Octet 7 - Bit 2)
          Write Connection Accept Timeout (Octet 7 - Bit 3)
          Read Transmit Power Level (Octet 10 - Bit 2)
          Set Controller To Host Flow Control (Octet 10 - Bit 5)
          Host Buffer Size (Octet 10 - Bit 6)
          Host Number of Completed Packets (Octet 10 - Bit 7)
          Read Local Version Information (Octet 14 - Bit 3)
          Read Local Supported Features (Octet 14 - Bit 5)
          Read BD ADDR (Octet 15 - Bit 1)
          Read RSSI (Octet 15 - Bit 5)
          Set Event Mask Page 2 (Octet 22 - Bit 2)
          LE Set Event Mask (Octet 25 - Bit 0)
          LE Read Buffer Size (Octet 25 - Bit 1)
          LE Read Local Supported Features (Octet 25 - Bit 2)
          LE Set Random Address (Octet 25 - Bit 4)
          LE Set Advertising Parameters (Octet 25 - Bit 5)
          LE Read Advertising Channel TX Power (Octet 25 - Bit 6)
          LE Set Advertising Data (Octet 25 - Bit 7)
          LE Set Scan Response Data (Octet 26 - Bit 0)
          LE Set Advertise Enable (Octet 26 - Bit 1)
          LE Set Scan Parameters (Octet 26 - Bit 2)
          LE Set Scan Enable (Octet 26 - Bit 3)
          LE Create Connection (Octet 26 - Bit 4)
          LE Create Connection Cancel (Octet 26 - Bit 5)
          LE Read Accept List Size (Octet 26 - Bit 6)
          LE Clear Accept List (Octet 26 - Bit 7)
          LE Add Device To Accept List (Octet 27 - Bit 0)
          LE Remove Device From Accept List (Octet 27 - Bit 1)
          LE Connection Update (Octet 27 - Bit 2)
          LE Set Host Channel Classification (Octet 27 - Bit 3)
          LE Read Channel Map (Octet 27 - Bit 4)
          LE Read Remote Used Features (Octet 27 - Bit 5)
          LE Encrypt (Octet 27 - Bit 6)
          LE Rand (Octet 27 - Bit 7)
          LE Start Encryption (Octet 28 - Bit 0)
          LE Long Term Key Request Reply (Octet 28 - Bit 1)
          LE Long Term Key Request Neg Reply (Octet 28 - Bit 2)
          LE Read Supported States (Octet 28 - Bit 3)
          LE Receiver Test (Octet 28 - Bit 4)
          LE Transmitter Test (Octet 28 - Bit 5)
          LE Test End (Octet 28 - Bit 6)
          Read Authenticated Payload Timeout (Octet 32 - Bit 4)
          Write Authenticated Payload Timeout (Octet 32 - Bit 5)
          LE Set Data Length (Octet 33 - Bit 6)
          LE Read Suggested Default Data Length (Octet 33 - Bit 7)
          LE Write Suggested Default Data Length (Octet 34 - Bit 0)
          LE Add Device To Resolving List (Octet 34 - Bit 3)
          LE Remove Device From Resolving List (Octet 34 - Bit 4)
          LE Clear Resolving List (Octet 34 - Bit 5)
          LE Read Resolving List Size (Octet 34 - Bit 6)
          LE Set Address Resolution Enable (Octet 35 - Bit 1)
          LE Set Resolvable Private Address Timeout (Octet 35 - Bit 2)
          LE Read Maximum Data Length (Octet 35 - Bit 3)
          LE Read PHY (Octet 35 - Bit 4)
          LE Set Default PHY (Octet 35 - Bit 5)
          LE Set PHY (Octet 35 - Bit 6)
          LE Enhanced Receiver Test (Octet 35 - Bit 7)
          LE Enhanced Transmitter Test (Octet 36 - Bit 0)
          LE Set Advertising Set Random Address (Octet 36 - Bit 1)
          LE Set Extended Advertising Parameters (Octet 36 - Bit 2)
          LE Set Extended Advertising Data (Octet 36 - Bit 3)
          LE Set Extended Scan Response Data (Octet 36 - Bit 4)
          LE Set Extended Advertising Enable (Octet 36 - Bit 5)
          LE Read Maximum Advertising Data Length (Octet 36 - Bit 6)
          LE Read Number of Supported Advertising Sets (Octet 36 - Bit 7)
          LE Remove Advertising Set (Octet 37 - Bit 0)
          LE Clear Advertising Sets (Octet 37 - Bit 1)
          LE Set Periodic Advertising Parameters (Octet 37 - Bit 2)
          LE Set Periodic Advertising Data (Octet 37 - Bit 3)
          LE Set Periodic Advertising Enable (Octet 37 - Bit 4)
          LE Set Extended Scan Parameters (Octet 37 - Bit 5)
          LE Set Extended Scan Enable (Octet 37 - Bit 6)
          LE Extended Create Connection (Octet 37 - Bit 7)
          LE Periodic Advertising Create Sync (Octet 38 - Bit 0)
          LE Periodic Advertising Create Sync Cancel (Octet 38 - Bit 1)
          LE Periodic Advertising Terminate Sync (Octet 38 - Bit 2)
          LE Add Device To Periodic Advertiser List (Octet 38 - Bit 3)
          LE Remove Device From Periodic Advertiser List (Octet 38 - Bit 4)
          LE Clear Periodic Advertiser List (Octet 38 - Bit 5)
          LE Read Periodic Advertiser List Size (Octet 38 - Bit 6)
          LE Read Transmit Power (Octet 38 - Bit 7)
          LE Read RF Path Compensation (Octet 39 - Bit 0)
          LE Write RF Path Compensation (Octet 39 - Bit 1)
          LE Set Privacy Mode (Octet 39 - Bit 2)
          LE Periodic Advertising Receive Enable (Octet 40 - Bit 5)
          LE Periodic Advertising Sync Transfer (Octet 40 - Bit 6)
          LE Periodic Advertising Set Info Transfer (Octet 40 - Bit 7)
          LE Periodic Advertising Sync Transfer Parameters (Octet 41 - Bit 0)
          LE Set Default Periodic Advertisng Sync Transfer Parameters (Octet 41 - Bit 1)
          LE Read Buffer v2 (Octet 41 - Bit 5)
          LE Read ISO TX Sync (Octet 41 - Bit 6)
          LE Set Connected Isochronous Group Parameters (Octet 41 - Bit 7)
          LE Set Connected Isochronous Group Parameters Test (Octet 42 - Bit 0)
          LE Create Connected Isochronous Stream (Octet 42 - Bit 1)
          LE Remove Connected Isochronous Group (Octet 42 - Bit 2)
          LE Accept Connected Isochronous Stream Request (Octet 42 - Bit 3)
          LE Reject Connected Isochronous Stream Request (Octet 42 - Bit 4)
          LE Create Broadcast Isochronous Group (Octet 42 - Bit 5)
          LE Create Broadcast Isochronous Group Test (Octet 42 - Bit 6)
          LE Terminate Broadcast Isochronous Group (Octet 42 - Bit 7)
          LE Broadcast Isochronous Group Create Sync (Octet 43 - Bit 0)
          LE Broadcast Isochronous Group Terminate Sync (Octet 43 - Bit 1)
          LE Request Peer SCA (Octet 43 - Bit 2)
          LE Setup Isochronous Data Path (Octet 43 - Bit 3)
          LE Remove Isochronous Data Path (Octet 43 - Bit 4)
          LE Isochronous Transmit Test (Octet 43 - Bit 5)
          LE Isochronous Receive Test (Octet 43 - Bit 6)
          LE Isochronous Read Test Counters (Octet 43 - Bit 7)
          LE Isochronous Read Test Counters (Octet 44 - Bit 0)
          LE Set Host Feature (Octet 44 - Bit 1)
          Octet 44 - Bit 2 
          Octet 45 - Bit 6 
          Octet 46 - Bit 0 
          Octet 46 - Bit 1 
          Octet 46 - Bit 2 
< HCI Command: Host Buffer Size (0x03|0x0033) plen 7         #9 [hci1] 1.088446
        ACL MTU: 255  ACL max packet: 16
        SCO MTU: 0    SCO max packet: 0
> HCI Event: Command Complete (0x0e) plen 4                 #10 [hci1] 1.088895
      Host Buffer Size (0x03|0x0033) ncmd 1
        Status: Success (0x00)
< HCI Command: Set Controller To Ho.. (0x03|0x0031) plen 1  #11 [hci1] 1.108367
        Flow control: ACL Data Packets (0x01)
> HCI Event: Command Complete (0x0e) plen 4                 #12 [hci1] 1.108911
      Set Controller To Host Flow Control (0x03|0x0031) ncmd 1
        Status: Success (0x00)
< HCI Command: LE Read Local Suppor.. (0x08|0x0003) plen 0  #13 [hci1] 1.128369
> HCI Event: Command Complete (0x0e) plen 12                #14 [hci1] 1.128876
      LE Read Local Supported Features (0x08|0x0003) ncmd 1
        Status: Success (0x00)
        Features: 0xfd 0x79 0x00 0xf7 0x30 0x01 0x00 0x00
          LE Encryption
          Extended Reject Indication
          Peripheral-initiated Features Exchange
          LE Ping
          LE Data Packet Length Extension
          LL Privacy
          Extended Scanner Filter Policies
          LE 2M PHY
          LE Coded PHY
          LE Extended Advertising
          LE Periodic Advertising
          Channel Selection Algorithm #2
          Periodic Advertising Sync Transfer - Sender
          Periodic Advertising Sync Transfer - Recipient
          Sleep Clock Accuracy Updates
          Connected Isochronous Stream - Central
          Connected Isochronous Stream - Peripheral
          Isochronous Broadcaster
          Synchronized Receiver
          Periodic Advertising ADI support
          Connection Subrating
          Unknown features (0x0000010000000000)
< HCI Command: LE Set Host Feature (0x08|0x0074) plen 2     #15 [hci1] 1.148375
        Bit Number: 32
          Connected Isochronous Stream (Host Support)
        Bit Value: 1
> HCI Event: Command Complete (0x0e) plen 4                 #16 [hci1] 1.148745
      LE Set Host Feature (0x08|0x0074) ncmd 1
        Status: Success (0x00)
< HCI Command: LE Read Buffer v2 (0x08|0x0060) plen 0       #17 [hci1] 1.168435
> HCI Event: Command Complete (0x0e) plen 10                #18 [hci1] 1.168882
      LE Read Buffer v2 (0x08|0x0060) ncmd 1
        Status: Success (0x00)
        ACL MTU: 27
        ACL max packet: 3
        ISO MTU: 318
        ISO max packet: 3
< HCI Command: LE Read Maximum Adve.. (0x08|0x003a) plen 0  #19 [hci1] 1.188482
> HCI Event: Command Complete (0x0e) plen 6                 #20 [hci1] 1.188957
      LE Read Maximum Advertising Data Length (0x08|0x003a) ncmd 1
        Status: Success (0x00)
        Max length: 1650
< HCI Command: LE Read Supported St.. (0x08|0x001c) plen 0  #21 [hci1] 1.208453
> HCI Event: Command Complete (0x0e) plen 12                #22 [hci1] 1.208955
      LE Read Supported States (0x08|0x001c) ncmd 1
        Status: Success (0x00)
        States: 0x000003ff3e0306ff
          Non-connectable Advertising State
          Scannable Advertising State
          Connectable Advertising State
          High Duty Cycle Directed Advertising State
          Passive Scanning State
          Active Scanning State
          Initiating State
            and Connection State (Central Role)
          Connection State (Peripheral Role)
          Scannable Advertising State
            and Passive Scanning State
          Connectable Advertising State
            and Passive Scanning State
          Non-connectable Advertising State
            and Initiating State
          Scannable Advertising State
            and Initiating State
          Active Scanning State
            and Connection State (Central Role)
          Passive Scanning State
            and Connection State (Peripheral Role)
          Active Scanning State
            and Connection State (Peripheral Role)
          Initiating State
            and Connection State (Central Role)
            and Central Role & Central Role
          Low Duty Cycle Directed Advertising State
          Connectable Advertising State
            and Initiating State
            and Central Role & Peripheral Role
          High Duty Cycle Directed Advertising State
            and Initiating State
            and Central Role & Peripheral Role
          Low Duty Cycle Directed Advertising State
            and Initiating State
            and Central Role & Peripheral Role
          Connectable Advertising State
            and Connection State (Central Role)
            and Central Role & Peripheral Role
          High Duty Cycle Directed Advertising State
            and Connection State (Central Role)
            and Central Role & Peripheral Role
          Low Duty Cycle Directed Advertising State
            and Connection State (Central Role)
            and Central Role & Peripheral Role
          Connectable Advertising State
            and Connection State (Peripheral Role)
            and Central Role & Peripheral Role
          High Duty Cycle Directed Advertising State
            and Connection State (Peripheral Role)
            and Peripheral Role & Peripheral Role
          Low Duty Cycle Directed Advertising State
            and Connection State (Peripheral Role)
            and Peripheral Role & Peripheral Role
          Initiating State
            and Connection State (Peripheral Role)
            and Central Role & Peripheral Role
< HCI Command: LE Read Maximum Data.. (0x08|0x002f) plen 0  #23 [hci1] 1.228424
> HCI Event: Command Complete (0x0e) plen 12                #24 [hci1] 1.229051
      LE Read Maximum Data Length (0x08|0x002f) ncmd 1
        Status: Success (0x00)
        Max TX octets: 251
        Max TX time: 2704
        Max RX octets: 251
        Max RX time: 2704
< HCI Command: LE Write Suggested D.. (0x08|0x0024) plen 4  #25 [hci1] 1.248444
        TX octets: 251
        TX time: 2704
> HCI Event: Command Complete (0x0e) plen 4                 #26 [hci1] 1.248926
      LE Write Suggested Default Data Length (0x08|0x0024) ncmd 1
        Status: Success (0x00)
< HCI Command: LE Read Resolving Li.. (0x08|0x002a) plen 0  #27 [hci1] 1.268453
> HCI Event: Command Complete (0x0e) plen 5                 #28 [hci1] 1.269050
      LE Read Resolving List Size (0x08|0x002a) ncmd 1
        Status: Success (0x00)
        Size: 8
< HCI Command: LE Set Event Mask (0x08|0x0001) plen 8       #29 [hci1] 1.288306
        Mask: 0x000002023f87fa5e
          LE Advertising Report
          LE Connection Update Complete
          LE Read Remote Used Features Complete
          LE Long Term Key Request
          LE Data Length Change
          LE Enhanced Connection Complete
          LE PHY Update Complete
          LE Extended Advertising Report
          LE Periodic Advertising Sync Established
          LE Periodic Advertising Report
          LE Periodic Advertising Sync Lost
          LE Extended Scan Timeout
          LE Extended Advertising Set Terminated
          LE Scan Request Received
          LE Periodic Advertising Sync Transfer Rvc
          LE CIS Established
          LE CIS Request
          LE Create BIG Complete
          LE Terminate BIG Complete
          LE BIG Sync Estabilished Complete
          LE BIG Sync Lost
          LE BIG Info Advertising Report
          Unknown mask (0x0000020000000000)
> HCI Event: Command Complete (0x0e) plen 4                 #30 [hci1] 1.288884
      LE Set Event Mask (0x08|0x0001) ncmd 1
        Status: Success (0x00)
< HCI Command: Set Event Mask (0x03|0x0001) plen 8          #31 [hci1] 1.308485
        Mask: 0x2000800002008890
          Disconnection Complete
          Encryption Change
          Read Remote Version Information Complete
          Hardware Error
          Data Buffer Overflow
          Encryption Key Refresh Complete
          LE Meta
> HCI Event: Command Complete (0x0e) plen 4                 #32 [hci1] 1.308963
      Set Event Mask (0x03|0x0001) ncmd 1
        Status: Success (0x00)
< HCI Command: Read BD ADDR (0x04|0x0009) plen 0            #33 [hci1] 1.328451
> HCI Event: Command Complete (0x0e) plen 10                #34 [hci1] 1.328886
      Read BD ADDR (0x04|0x0009) ncmd 1
        Status: Success (0x00)
        Address: 00:00:00:00:00:00 (OUI 00-00-00)
< HCI Command: LE Set Random Address (0x08|0x0005) plen 6   #35 [hci1] 1.348404
        Address: D5:B6:CC:31:DB:3B (Static)
> HCI Event: Command Complete (0x0e) plen 4                 #36 [hci1] 1.348927
      LE Set Random Address (0x08|0x0005) ncmd 1
        Status: Success (0x00)
< HCI Command: LE Set Extended Adv.. (0x08|0x0036) plen 25  #37 [hci1] 3.838922
        Handle: 0x00
        Properties: 0x0013
          Connectable
          Scannable
          Use legacy advertising PDUs: ADV_IND
        Min advertising interval: 100.000 msec (0x00a0)
        Max advertising interval: 150.000 msec (0x00f0)
        Channel map: 37, 38, 39 (0x07)
        Own address type: Random (0x01)
        Peer address type: Public (0x00)
        Peer address: 00:00:00:00:00:00 (OUI 00-00-00)
        Filter policy: Allow Scan Request from Any, Allow Connect Request from Any (0x00)
        TX power: Host has no preference (0x7f)
        Primary PHY: LE 1M (0x01)
        Secondary max skip: 0x00
        Secondary PHY: LE 1M (0x01)
        SID: 0x00
        Scan request notifications: Disabled (0x00)
> HCI Event: Command Complete (0x0e) plen 5                 #38 [hci1] 3.839684
      LE Set Extended Advertising Parameters (0x08|0x0036) ncmd 1
        Status: Success (0x00)
        TX power (selected): 0 dbm (0x00)
< HCI Command: LE Set Advertising S.. (0x08|0x0035) plen 7  #39 [hci1] 3.848436
        Advertising handle: 0x00
        Advertising random address: D5:B6:CC:31:DB:3B (Static)
> HCI Event: Command Complete (0x0e) plen 4                 #40 [hci1] 3.848888
      LE Set Advertising Set Random Address (0x08|0x0035) ncmd 1
        Status: Success (0x00)
< HCI Command: LE Set Extended Adv.. (0x08|0x0037) plen 22  #41 [hci1] 3.868494
        Handle: 0x00
        Operation: Complete extended advertising data (0x03)
        Fragment preference: Minimize fragmentation (0x01)
        Data length: 0x12
        Flags: 0x06
          LE General Discoverable Mode
          BR/EDR Not Supported
        Name (complete): Tester_F6B11A
> HCI Event: Command Complete (0x0e) plen 4                 #42 [hci1] 3.869242
      LE Set Extended Advertising Data (0x08|0x0037) ncmd 1
        Status: Success (0x00)
< HCI Command: LE Set Extended Scan.. (0x08|0x0038) plen 4  #43 [hci1] 3.888494
        Handle: 0x00
        Operation: Complete scan response data (0x03)
        Fragment preference: Minimize fragmentation (0x01)
        Data length: 0x00
> HCI Event: Command Complete (0x0e) plen 4                 #44 [hci1] 3.889008
      LE Set Extended Scan Response Data (0x08|0x0038) ncmd 1
        Status: Success (0x00)
< HCI Command: LE Set Extended Adve.. (0x08|0x0039) plen 6  #45 [hci1] 3.908495
        Extended advertising: Enabled (0x01)
        Number of sets: 1 (0x01)
        Entry 0
          Handle: 0x00
          Duration: 0 ms (0x00)
          Max ext adv events: 0
> HCI Event: Command Complete (0x0e) plen 4                 #46 [hci1] 3.909135
      LE Set Extended Advertising Enable (0x08|0x0039) ncmd 1
        Status: Success (0x00)
> HCI Event: LE Meta Event (0x3e) plen 31                   #47 [hci1] 4.226948
      LE Enhanced Connection Complete (0x0a)
        Status: Success (0x00)
        Handle: 93
        Role: Peripheral (0x01)
        Peer address type: Public (0x00)
        Peer address: DF:A9:FF:F6:B1:1A (OUI DF-A9-FF)
        Local resolvable private address: 00:00:00:00:00:00 (Non-Resolvable)
        Peer resolvable private address: 00:00:00:00:00:00 (Non-Resolvable)
        Connection interval: 87.50 msec (0x0046)
        Connection latency: 0 (0x0000)
        Supervision timeout: 25120 msec (0x09d0)
        Central clock accuracy: 0x01
> HCI Event: LE Meta Event (0x3e) plen 6                    #48 [hci1] 4.226976
      LE Advertising Set Terminated (0x12)
        Status: Success (0x00)
        Handle: 0
        Connection handle: 93
        Number of completed extended advertising events: 0
< HCI Command: LE Read Remote Used... (0x08|0x0016) plen 2  #49 [hci1] 4.229367
        Handle: 93 Address: DF:A9:FF:F6:B1:1A (OUI DF-A9-FF)
< ACL Data TX: Handle 93 flags 0x00 dlen 7                  #50 [hci1] 4.229423
      ATT: Exchange MTU Request (0x02) len 2
        Client RX MTU: 251
> HCI Event: Command Status (0x0f) plen 4                   #51 [hci1] 4.229965
      LE Read Remote Used Features (0x08|0x0016) ncmd 1
        Status: Success (0x00)
> HCI Event: Number of Completed Packets (0x13) plen 5      #52 [hci1] 4.403014
        Num handles: 1
        Handle: 93 Address: DF:A9:FF:F6:B1:1A (OUI DF-A9-FF)
        Count: 1
        #50: len 7 (0 Kb/s)
        Latency: 173 msec (173-173 msec ~173 msec)
> HCI Event: LE Meta Event (0x3e) plen 12                   #53 [hci1] 4.490758
      LE Read Remote Used Features (0x04)
        Status: Success (0x00)
        Handle: 93 Address: DF:A9:FF:F6:B1:1A (OUI DF-A9-FF)
        Features: 0x2d 0x49 0x00 0xf7 0x67 0xd8 0x00 0x00
          LE Encryption
          Extended Reject Indication
          Peripheral-initiated Features Exchange
          LE Data Packet Length Extension
          LE 2M PHY
          LE Coded PHY
          Channel Selection Algorithm #2
          Periodic Advertising Sync Transfer - Sender
          Periodic Advertising Sync Transfer - Recipient
          Sleep Clock Accuracy Updates
          Connected Isochronous Stream - Central
          Connected Isochronous Stream - Peripheral
          Isochronous Broadcaster
          Synchronized Receiver
          Connected Isochronous Stream (Host Support)
          LE Power Control Request
          LE Power Control Request
          Connection Subrating
          Connection Subrating (Host Support)
          Unknown features (0x0000d80000000000)
> ACL Data RX: Handle 93 flags 0x02 dlen 11                 #54 [hci1] 6.940575
      SMP: Pairing Request (0x01) len 6
        IO capability: KeyboardDisplay (0x04)
        OOB data: Authentication data not present (0x00)
        Authentication requirement: Bonding, MITM, SC, No Keypresses (0x0d)
        Max encryption key size: 16
        Initiator key distribution: EncKey IdKey (0x03)
        Responder key distribution: EncKey IdKey Sign (0x07)
> ACL Data RX: Handle 93 flags 0x02 dlen 7                  #55 [hci1] 6.940833
      ATT: Exchange MTU Response (0x03) len 2
        Server RX MTU: 23
< HCI Command: Host Number of Compl.. (0x03|0x0035) plen 5  #56 [hci1] 6.948948
        Num handles: 1
        Handle: 93 Address: DF:A9:FF:F6:B1:1A (OUI DF-A9-FF)
        Count: 1
< ACL Data TX: Handle 93 flags 0x00 dlen 11                 #57 [hci1] 6.949191
      SMP: Pairing Response (0x02) len 6
        IO capability: DisplayOnly (0x00)
        OOB data: Authentication data not present (0x00)
        Authentication requirement: Bonding, No MITM, SC, No Keypresses (0x09)
        Max encryption key size: 16
        Initiator key distribution: IdKey (0x02)
        Responder key distribution: <none> (0x00)
< HCI Command: Host Number of Compl.. (0x03|0x0035) plen 5  #58 [hci1] 6.949263
        Num handles: 1
        Handle: 93 Address: DF:A9:FF:F6:B1:1A (OUI DF-A9-FF)
        Count: 1
> HCI Event: Number of Completed Packets (0x13) plen 5      #59 [hci1] 7.115443
        Num handles: 1
        Handle: 93 Address: DF:A9:FF:F6:B1:1A (OUI DF-A9-FF)
        Count: 1
        #57: len 11 (0 Kb/s)
        Latency: 166 msec (166-173 msec ~169 msec)
> ACL Data RX: Handle 93 flags 0x02 dlen 27                 #60 [hci1] 7.115871
> ACL Data RX: Handle 93 flags 0x01 dlen 27                 #61 [hci1] 7.116283
> ACL Data RX: Handle 93 flags 0x01 dlen 15                 #62 [hci1] 7.116775
      SMP: Pairing Public Key (0x0c) len 64
        X: aac350b97de1dda62222a08fd23fce6774814b9a1b750bf430db48245faabcb2
        Y: f66b32fd4cc6b7bbe383285a9c7c232e3807dcabb2daaee4621c9f7f57d29508
< HCI Command: Host Number of Compl.. (0x03|0x0035) plen 5  #63 [hci1] 7.129409
        Num handles: 1
        Handle: 93 Address: DF:A9:FF:F6:B1:1A (OUI DF-A9-FF)
        Count: 1
< HCI Command: Host Number of Compl.. (0x03|0x0035) plen 5  #64 [hci1] 7.129630
        Num handles: 1
        Handle: 93 Address: DF:A9:FF:F6:B1:1A (OUI DF-A9-FF)
        Count: 1
< HCI Command: Host Number of Compl.. (0x03|0x0035) plen 5  #65 [hci1] 7.129947
        Num handles: 1
        Handle: 93 Address: DF:A9:FF:F6:B1:1A (OUI DF-A9-FF)
        Count: 1
< ACL Data TX: Handle 93 flags 0x00 dlen 27                 #66 [hci1] 7.130122
< ACL Data TX: Handle 93 flags 0x01 dlen 27                 #67 [hci1] 7.130151
< ACL Data TX: Handle 93 flags 0x01 dlen 15                 #68 [hci1] 7.130200
      SMP: Pairing Public Key (0x0c) len 64
        X: 98308440221e2d910f0e54b71e7ec652857aa9b5a0dc65028824cc19db1226e9
        Y: 67a4816bcb62efb21701e31fdb27561a6217575fb007a8bbdabe7e28b6f68482
> HCI Event: Number of Completed Packets (0x13) plen 5      #69 [hci1] 7.203355
        Num handles: 1
        Handle: 93 Address: DF:A9:FF:F6:B1:1A (OUI DF-A9-FF)
        Count: 1
        #66: len 27 (2 Kb/s)
        Latency: 73 msec (73-173 msec ~121 msec)
> HCI Event: Number of Completed Packets (0x13) plen 5      #70 [hci1] 7.204001
        Num handles: 1
        Handle: 93 Address: DF:A9:FF:F6:B1:1A (OUI DF-A9-FF)
        Count: 1
        #67: len 27 (2 Kb/s)
        Latency: 73 msec (73-173 msec ~97 msec)
> HCI Event: Number of Completed Packets (0x13) plen 5      #71 [hci1] 7.290136
        Num handles: 1
        Handle: 93 Address: DF:A9:FF:F6:B1:1A (OUI DF-A9-FF)
        Count: 1
        #68: len 15 (0 Kb/s)
        Latency: 159 msec (73-173 msec ~128 msec)
> ACL Data RX: Handle 93 flags 0x02 dlen 21                 #72 [hci1] 8.078009
      SMP: Pairing Confirm (0x03) len 16
        Confim value: 1733b2716a164ca5d5d2e3dac9441b38
< HCI Command: Host Number of Compl.. (0x03|0x0035) plen 5  #73 [hci1] 8.089095
        Num handles: 1
        Handle: 93 Address: DF:A9:FF:F6:B1:1A (OUI DF-A9-FF)
        Count: 1
< ACL Data TX: Handle 93 flags 0x00 dlen 21                 #74 [hci1] 8.089264
      SMP: Pairing Confirm (0x03) len 16
        Confim value: e5c7ed5161df67b300fe8cb2d7838525
> HCI Event: Number of Completed Packets (0x13) plen 5      #75 [hci1] 8.252845
        Num handles: 1
        Handle: 93 Address: DF:A9:FF:F6:B1:1A (OUI DF-A9-FF)
        Count: 1
        #74: len 21 (1 Kb/s)
        Latency: 163 msec (73-173 msec ~146 msec)
> ACL Data RX: Handle 93 flags 0x02 dlen 21                 #76 [hci1] 8.253159
      SMP: Pairing Random (0x04) len 16
        Random value: d54b2800140b8ecf0000000000000000
< HCI Command: Host Number of Compl.. (0x03|0x0035) plen 5  #77 [hci1] 8.269378
        Num handles: 1
        Handle: 93 Address: DF:A9:FF:F6:B1:1A (OUI DF-A9-FF)
        Count: 1
< ACL Data TX: Handle 93 flags 0x00 dlen 21                 #78 [hci1] 8.269487
      SMP: Pairing Random (0x04) len 16
        Random value: 8e6108f966a694cbe26df70bb96773e6
> HCI Event: Number of Completed Packets (0x13) plen 5      #79 [hci1] 8.427615
        Num handles: 1
        Handle: 93 Address: DF:A9:FF:F6:B1:1A (OUI DF-A9-FF)
        Count: 1
        #78: len 21 (1 Kb/s)
        Latency: 158 msec (73-173 msec ~152 msec)
> ACL Data RX: Handle 93 flags 0x02 dlen 21                 #80 [hci1] 8.515532
      SMP: Pairing Confirm (0x03) len 16
        Confim value: 229e237b98951df4f026b9a69ae83ac7
< HCI Command: Host Number of Compl.. (0x03|0x0035) plen 5  #81 [hci1] 8.529069
        Num handles: 1
        Handle: 93 Address: DF:A9:FF:F6:B1:1A (OUI DF-A9-FF)
        Count: 1
< ACL Data TX: Handle 93 flags 0x00 dlen 21                 #82 [hci1] 8.529253
      SMP: Pairing Confirm (0x03) len 16
        Confim value: abfcb9ee18b03e84c9cafe8e4445799e
> HCI Event: Number of Completed Packets (0x13) plen 5      #83 [hci1] 8.690442
        Num handles: 1
        Handle: 93 Address: DF:A9:FF:F6:B1:1A (OUI DF-A9-FF)
        Count: 1
        #82: len 21 (1 Kb/s)
        Latency: 161 msec (73-173 msec ~156 msec)
> ACL Data RX: Handle 93 flags 0x02 dlen 21                 #84 [hci1] 8.690782
      SMP: Pairing Random (0x04) len 16
        Random value: 210fde6cf88569720000000000000000
< HCI Command: Host Number of Compl.. (0x03|0x0035) plen 5  #85 [hci1] 8.709150
        Num handles: 1
        Handle: 93 Address: DF:A9:FF:F6:B1:1A (OUI DF-A9-FF)
        Count: 1
< ACL Data TX: Handle 93 flags 0x00 dlen 21                 #86 [hci1] 8.709239
      SMP: Pairing Random (0x04) len 16
        Random value: 4d02679f89a05211af56d8b3da64d21e
> HCI Event: Number of Completed Packets (0x13) plen 5      #87 [hci1] 8.865200
        Num handles: 1
        Handle: 93 Address: DF:A9:FF:F6:B1:1A (OUI DF-A9-FF)
        Count: 1
        #86: len 21 (1 Kb/s)
        Latency: 155 msec (73-173 msec ~156 msec)
> ACL Data RX: Handle 93 flags 0x02 dlen 21                 #88 [hci1] 8.953013
      SMP: Pairing Confirm (0x03) len 16
        Confim value: b9ce4034e049e16802d39b69b047b83c
< HCI Command: Host Number of Compl.. (0x03|0x0035) plen 5  #89 [hci1] 8.968866
        Num handles: 1
        Handle: 93 Address: DF:A9:FF:F6:B1:1A (OUI DF-A9-FF)
        Count: 1
< ACL Data TX: Handle 93 flags 0x00 dlen 21                 #90 [hci1] 8.968980
      SMP: Pairing Confirm (0x03) len 16
        Confim value: 09c8e9c9f1edcb86959ebb7999ae931f
> HCI Event: Number of Completed Packets (0x13) plen 5      #91 [hci1] 9.127883
        Num handles: 1
        Handle: 93 Address: DF:A9:FF:F6:B1:1A (OUI DF-A9-FF)
        Count: 1
        #90: len 21 (1 Kb/s)
        Latency: 158 msec (73-173 msec ~157 msec)
> ACL Data RX: Handle 93 flags 0x02 dlen 21                 #92 [hci1] 9.128188
      SMP: Pairing Random (0x04) len 16
        Random value: 3f0bc38202f1ad8a0000000000000000
< HCI Command: Host Number of Compl.. (0x03|0x0035) plen 5  #93 [hci1] 9.128981
        Num handles: 1
        Handle: 93 Address: DF:A9:FF:F6:B1:1A (OUI DF-A9-FF)
        Count: 1
< ACL Data TX: Handle 93 flags 0x00 dlen 21                 #94 [hci1] 9.129127
      SMP: Pairing Random (0x04) len 16
        Random value: 5e8286bc235a02440d0c3424a2acf8fd
> HCI Event: Number of Completed Packets (0x13) plen 5      #95 [hci1] 9.302759
        Num handles: 1
        Handle: 93 Address: DF:A9:FF:F6:B1:1A (OUI DF-A9-FF)
        Count: 1
        #94: len 21 (0 Kb/s)
        Latency: 173 msec (73-173 msec ~165 msec)
> ACL Data RX: Handle 93 flags 0x02 dlen 21                 #96 [hci1] 9.390540
      SMP: Pairing Confirm (0x03) len 16
        Confim value: 8059eb160e1e2ec7ae7cb0e9e9dbf4b5
< HCI Command: Host Number of Compl.. (0x03|0x0035) plen 5  #97 [hci1] 9.409028
        Num handles: 1
        Handle: 93 Address: DF:A9:FF:F6:B1:1A (OUI DF-A9-FF)
        Count: 1
< ACL Data TX: Handle 93 flags 0x00 dlen 21                 #98 [hci1] 9.409208
      SMP: Pairing Confirm (0x03) len 16
        Confim value: d832da752f4aa829c495e10153a2a355
> HCI Event: Number of Completed Packets (0x13) plen 5      #99 [hci1] 9.565310
        Num handles: 1
        Handle: 93 Address: DF:A9:FF:F6:B1:1A (OUI DF-A9-FF)
        Count: 1
        #98: len 21 (1 Kb/s)
        Latency: 156 msec (73-173 msec ~160 msec)
> ACL Data RX: Handle 93 flags 0x02 dlen 21                #100 [hci1] 9.565594
      SMP: Pairing Random (0x04) len 16
        Random value: 337e029ced5b36c10000000000000000
< HCI Command: Host Number of Comp.. (0x03|0x0035) plen 5  #101 [hci1] 9.569224
        Num handles: 1
        Handle: 93 Address: DF:A9:FF:F6:B1:1A (OUI DF-A9-FF)
        Count: 1
< ACL Data TX: Handle 93 flags 0x00 dlen 21                #102 [hci1] 9.569336
      SMP: Pairing Random (0x04) len 16
        Random value: 5c4a1bcadd27bd58e945097b00bad7ac
> HCI Event: Number of Completed Packets (0x13) plen 5     #103 [hci1] 9.740098
        Num handles: 1
        Handle: 93 Address: DF:A9:FF:F6:B1:1A (OUI DF-A9-FF)
        Count: 1
        #102: len 21 (0 Kb/s)
        Latency: 170 msec (73-173 msec ~165 msec)
> ACL Data RX: Handle 93 flags 0x02 dlen 21                #104 [hci1] 9.828025
      SMP: Pairing Confirm (0x03) len 16
        Confim value: ff3dffaa7f9310d2fc52e411a21445e9
< HCI Command: Host Number of Comp.. (0x03|0x0035) plen 5  #105 [hci1] 9.828823
        Num handles: 1
        Handle: 93 Address: DF:A9:FF:F6:B1:1A (OUI DF-A9-FF)
        Count: 1
< ACL Data TX: Handle 93 flags 0x00 dlen 21                #106 [hci1] 9.828964
      SMP: Pairing Confirm (0x03) len 16
        Confim value: b99277c4a59265f5cf9818f5d96037b3
> HCI Event: Number of Completed Packets (0x13) plen 5    #107 [hci1] 10.002787
        Num handles: 1
        Handle: 93 Address: DF:A9:FF:F6:B1:1A (OUI DF-A9-FF)
        Count: 1
        #106: len 21 (0 Kb/s)
        Latency: 173 msec (73-173 msec ~169 msec)
> ACL Data RX: Handle 93 flags 0x02 dlen 21               #108 [hci1] 10.003214
      SMP: Pairing Random (0x04) len 16
        Random value: f8e8ca9c7db92ff10000000000000000
< HCI Command: Host Number of Com.. (0x03|0x0035) plen 5  #109 [hci1] 10.009301
        Num handles: 1
        Handle: 93 Address: DF:A9:FF:F6:B1:1A (OUI DF-A9-FF)
        Count: 1
< ACL Data TX: Handle 93 flags 0x00 dlen 21               #110 [hci1] 10.009402
      SMP: Pairing Random (0x04) len 16
        Random value: 32527e6e64e79f33b2e374394db8ab2d
> HCI Event: Number of Completed Packets (0x13) plen 5    #111 [hci1] 10.177614
        Num handles: 1
        Handle: 93 Address: DF:A9:FF:F6:B1:1A (OUI DF-A9-FF)
        Count: 1
        #110: len 21 (1 Kb/s)
        Latency: 168 msec (73-173 msec ~169 msec)
> ACL Data RX: Handle 93 flags 0x02 dlen 21               #112 [hci1] 10.265479
      SMP: Pairing Confirm (0x03) len 16
        Confim value: 9b6d67559619967d2074886ed8bf1973
< HCI Command: Host Number of Com.. (0x03|0x0035) plen 5  #113 [hci1] 10.268848
        Num handles: 1
        Handle: 93 Address: DF:A9:FF:F6:B1:1A (OUI DF-A9-FF)
        Count: 1
< ACL Data TX: Handle 93 flags 0x00 dlen 21               #114 [hci1] 10.268990
      SMP: Pairing Confirm (0x03) len 16
        Confim value: 5ce3e56ebd87352a34627a9dc0a829c8
> HCI Event: Number of Completed Packets (0x13) plen 5    #115 [hci1] 10.440447
        Num handles: 1
        Handle: 93 Address: DF:A9:FF:F6:B1:1A (OUI DF-A9-FF)
        Count: 1
        #114: len 21 (0 Kb/s)
        Latency: 171 msec (73-173 msec ~170 msec)
> ACL Data RX: Handle 93 flags 0x02 dlen 21               #116 [hci1] 10.440593
      SMP: Pairing Random (0x04) len 16
        Random value: e5bfeb466c3f259a0000000000000000
< HCI Command: Host Number of Com.. (0x03|0x0035) plen 5  #117 [hci1] 10.449241
        Num handles: 1
        Handle: 93 Address: DF:A9:FF:F6:B1:1A (OUI DF-A9-FF)
        Count: 1
< ACL Data TX: Handle 93 flags 0x00 dlen 21               #118 [hci1] 10.449370
      SMP: Pairing Random (0x04) len 16
        Random value: dddbdfe2838e9a8cc6964353c850fef7
> HCI Event: Number of Completed Packets (0x13) plen 5    #119 [hci1] 10.615170
        Num handles: 1
        Handle: 93 Address: DF:A9:FF:F6:B1:1A (OUI DF-A9-FF)
        Count: 1
        #118: len 21 (1 Kb/s)
        Latency: 165 msec (73-173 msec ~168 msec)
> ACL Data RX: Handle 93 flags 0x02 dlen 21               #120 [hci1] 10.702959
      SMP: Pairing Confirm (0x03) len 16
        Confim value: 82a35340fa621bdb9030488e1c6740be
< HCI Command: Host Number of Com.. (0x03|0x0035) plen 5  #121 [hci1] 10.708725
        Num handles: 1
        Handle: 93 Address: DF:A9:FF:F6:B1:1A (OUI DF-A9-FF)
        Count: 1
< ACL Data TX: Handle 93 flags 0x00 dlen 21               #122 [hci1] 10.708874
      SMP: Pairing Confirm (0x03) len 16
        Confim value: ed1d932e1772e03a58c942084609b1f1
> HCI Event: Number of Completed Packets (0x13) plen 5    #123 [hci1] 10.877809
        Num handles: 1
        Handle: 93 Address: DF:A9:FF:F6:B1:1A (OUI DF-A9-FF)
        Count: 1
        #122: len 21 (1 Kb/s)
        Latency: 168 msec (73-173 msec ~168 msec)
> ACL Data RX: Handle 93 flags 0x02 dlen 21               #124 [hci1] 10.878081
      SMP: Pairing Random (0x04) len 16
        Random value: d6b23b12c8cbb5780000000000000000
< HCI Command: Host Number of Com.. (0x03|0x0035) plen 5  #125 [hci1] 10.889151
        Num handles: 1
        Handle: 93 Address: DF:A9:FF:F6:B1:1A (OUI DF-A9-FF)
        Count: 1
< ACL Data TX: Handle 93 flags 0x00 dlen 21               #126 [hci1] 10.889262
      SMP: Pairing Random (0x04) len 16
        Random value: eb9f1915536596b6fc3db1c86b2b1970
> HCI Event: Number of Completed Packets (0x13) plen 5    #127 [hci1] 11.052601
        Num handles: 1
        Handle: 93 Address: DF:A9:FF:F6:B1:1A (OUI DF-A9-FF)
        Count: 1
        #126: len 21 (1 Kb/s)
        Latency: 163 msec (73-173 msec ~165 msec)
> ACL Data RX: Handle 93 flags 0x02 dlen 21               #128 [hci1] 11.140499
      SMP: Pairing Confirm (0x03) len 16
        Confim value: 3f39fab9467fa619d3db40437b179516
< HCI Command: Host Number of Com.. (0x03|0x0035) plen 5  #129 [hci1] 11.149003
        Num handles: 1
        Handle: 93 Address: DF:A9:FF:F6:B1:1A (OUI DF-A9-FF)
        Count: 1
< ACL Data TX: Handle 93 flags 0x00 dlen 21               #130 [hci1] 11.149102
      SMP: Pairing Confirm (0x03) len 16
        Confim value: 8fe994980faff8446ab5624452484095
> HCI Event: Number of Completed Packets (0x13) plen 5    #131 [hci1] 11.315299
        Num handles: 1
        Handle: 93 Address: DF:A9:FF:F6:B1:1A (OUI DF-A9-FF)
        Count: 1
        #130: len 21 (1 Kb/s)
        Latency: 166 msec (73-173 msec ~166 msec)
> ACL Data RX: Handle 93 flags 0x02 dlen 21               #132 [hci1] 11.315685
      SMP: Pairing Random (0x04) len 16
        Random value: 3ba54d8e9e7bba710000000000000000
< HCI Command: Host Number of Com.. (0x03|0x0035) plen 5  #133 [hci1] 11.329222
        Num handles: 1
        Handle: 93 Address: DF:A9:FF:F6:B1:1A (OUI DF-A9-FF)
        Count: 1
< ACL Data TX: Handle 93 flags 0x00 dlen 21               #134 [hci1] 11.329314
      SMP: Pairing Random (0x04) len 16
        Random value: 5c794dc9ad9f2c3f295ebd5ad5e1c3cf
> HCI Event: Number of Completed Packets (0x13) plen 5    #135 [hci1] 11.490066
        Num handles: 1
        Handle: 93 Address: DF:A9:FF:F6:B1:1A (OUI DF-A9-FF)
        Count: 1
        #134: len 21 (1 Kb/s)
        Latency: 160 msec (73-173 msec ~163 msec)
> ACL Data RX: Handle 93 flags 0x02 dlen 21               #136 [hci1] 11.577879
      SMP: Pairing Confirm (0x03) len 16
        Confim value: ee7f8f77c64dd267ce727ae71cd4878c
< HCI Command: Host Number of Com.. (0x03|0x0035) plen 5  #137 [hci1] 11.588959
        Num handles: 1
        Handle: 93 Address: DF:A9:FF:F6:B1:1A (OUI DF-A9-FF)
        Count: 1
< ACL Data TX: Handle 93 flags 0x00 dlen 21               #138 [hci1] 11.589154
      SMP: Pairing Confirm (0x03) len 16
        Confim value: 9ef722dd9723a033ebd8f31f5f7172e1
> HCI Event: Number of Completed Packets (0x13) plen 5    #139 [hci1] 11.752728
        Num handles: 1
        Handle: 93 Address: DF:A9:FF:F6:B1:1A (OUI DF-A9-FF)
        Count: 1
        #138: len 21 (1 Kb/s)
        Latency: 163 msec (73-173 msec ~163 msec)
> ACL Data RX: Handle 93 flags 0x02 dlen 21               #140 [hci1] 11.753151
      SMP: Pairing Random (0x04) len 16
        Random value: 4d236f96f3c1e3e90000000000000000
< HCI Command: Host Number of Com.. (0x03|0x0035) plen 5  #141 [hci1] 11.769212
        Num handles: 1
        Handle: 93 Address: DF:A9:FF:F6:B1:1A (OUI DF-A9-FF)
        Count: 1
< ACL Data TX: Handle 93 flags 0x00 dlen 21               #142 [hci1] 11.769325
      SMP: Pairing Random (0x04) len 16
        Random value: 5c2fff312cdf99c9491988e877355a9a
> HCI Event: Number of Completed Packets (0x13) plen 5    #143 [hci1] 11.927533
        Num handles: 1
        Handle: 93 Address: DF:A9:FF:F6:B1:1A (OUI DF-A9-FF)
        Count: 1
        #142: len 21 (1 Kb/s)
        Latency: 158 msec (73-173 msec ~160 msec)
> ACL Data RX: Handle 93 flags 0x02 dlen 21               #144 [hci1] 12.015429
      SMP: Pairing Confirm (0x03) len 16
        Confim value: 040365f2d169f3463d1e41322655393e
< HCI Command: Host Number of Com.. (0x03|0x0035) plen 5  #145 [hci1] 12.028874
        Num handles: 1
        Handle: 93 Address: DF:A9:FF:F6:B1:1A (OUI DF-A9-FF)
        Count: 1
< ACL Data TX: Handle 93 flags 0x00 dlen 21               #146 [hci1] 12.029051
      SMP: Pairing Confirm (0x03) len 16
        Confim value: a3d6f85d86d26fae50a086a53d7bd038
> HCI Event: Number of Completed Packets (0x13) plen 5    #147 [hci1] 12.190243
        Num handles: 1
        Handle: 93 Address: DF:A9:FF:F6:B1:1A (OUI DF-A9-FF)
        Count: 1
        #146: len 21 (1 Kb/s)
        Latency: 161 msec (73-173 msec ~161 msec)
> ACL Data RX: Handle 93 flags 0x02 dlen 21               #148 [hci1] 12.190743
      SMP: Pairing Random (0x04) len 16
        Random value: 6cd06be8f4bbf12a0000000000000000
< HCI Command: Host Number of Com.. (0x03|0x0035) plen 5  #149 [hci1] 12.209267
        Num handles: 1
        Handle: 93 Address: DF:A9:FF:F6:B1:1A (OUI DF-A9-FF)
        Count: 1
< ACL Data TX: Handle 93 flags 0x00 dlen 21               #150 [hci1] 12.209357
      SMP: Pairing Random (0x04) len 16
        Random value: c629a3a987d808e808655d558dfc1155
> HCI Event: Number of Completed Packets (0x13) plen 5    #151 [hci1] 12.364996
        Num handles: 1
        Handle: 93 Address: DF:A9:FF:F6:B1:1A (OUI DF-A9-FF)
        Count: 1
        #150: len 21 (1 Kb/s)
        Latency: 155 msec (73-173 msec ~158 msec)
> ACL Data RX: Handle 93 flags 0x02 dlen 21               #152 [hci1] 12.452897
      SMP: Pairing Confirm (0x03) len 16
        Confim value: b69234fca8565ce7524483c4ac6bdb64
< HCI Command: Host Number of Com.. (0x03|0x0035) plen 5  #153 [hci1] 12.469106
        Num handles: 1
        Handle: 93 Address: DF:A9:FF:F6:B1:1A (OUI DF-A9-FF)
        Count: 1
< ACL Data TX: Handle 93 flags 0x00 dlen 21               #154 [hci1] 12.469317
      SMP: Pairing Confirm (0x03) len 16
        Confim value: c6672a3102c89cf16531c890a6792c63
> HCI Event: Number of Completed Packets (0x13) plen 5    #155 [hci1] 12.627882
        Num handles: 1
        Handle: 93 Address: DF:A9:FF:F6:B1:1A (OUI DF-A9-FF)
        Count: 1
        #154: len 21 (1 Kb/s)
        Latency: 158 msec (73-173 msec ~158 msec)
> ACL Data RX: Handle 93 flags 0x02 dlen 21               #156 [hci1] 12.628080
      SMP: Pairing Random (0x04) len 16
        Random value: 890aea8ddeee59620000000000000000
< HCI Command: Host Number of Com.. (0x03|0x0035) plen 5  #157 [hci1] 12.629163
        Num handles: 1
        Handle: 93 Address: DF:A9:FF:F6:B1:1A (OUI DF-A9-FF)
        Count: 1
< ACL Data TX: Handle 93 flags 0x00 dlen 21               #158 [hci1] 12.629256
      SMP: Pairing Random (0x04) len 16
        Random value: 92f20f6ad8f13724432c7fd6001c45ff
> HCI Event: Number of Completed Packets (0x13) plen 5    #159 [hci1] 12.802501
        Num handles: 1
        Handle: 93 Address: DF:A9:FF:F6:B1:1A (OUI DF-A9-FF)
        Count: 1
        #158: len 21 (0 Kb/s)
        Latency: 173 msec (73-173 msec ~165 msec)
> ACL Data RX: Handle 93 flags 0x02 dlen 21               #160 [hci1] 12.890316
      SMP: Pairing Confirm (0x03) len 16
        Confim value: 13e98cf9be5a4716b306ff18e0375cd7
< HCI Command: Host Number of Com.. (0x03|0x0035) plen 5  #161 [hci1] 12.909047
        Num handles: 1
        Handle: 93 Address: DF:A9:FF:F6:B1:1A (OUI DF-A9-FF)
        Count: 1
< ACL Data TX: Handle 93 flags 0x00 dlen 21               #162 [hci1] 12.909239
      SMP: Pairing Confirm (0x03) len 16
        Confim value: 0f1c209c8585e3c9ecab946cc8349008
> HCI Event: Number of Completed Packets (0x13) plen 5    #163 [hci1] 13.065264
        Num handles: 1
        Handle: 93 Address: DF:A9:FF:F6:B1:1A (OUI DF-A9-FF)
        Count: 1
        #162: len 21 (1 Kb/s)
        Latency: 156 msec (73-173 msec ~160 msec)
> ACL Data RX: Handle 93 flags 0x02 dlen 21               #164 [hci1] 13.065513
      SMP: Pairing Random (0x04) len 16
        Random value: 83f8a1ab25a39bc60000000000000000
< HCI Command: Host Number of Com.. (0x03|0x0035) plen 5  #165 [hci1] 13.069292
        Num handles: 1
        Handle: 93 Address: DF:A9:FF:F6:B1:1A (OUI DF-A9-FF)
        Count: 1
< ACL Data TX: Handle 93 flags 0x00 dlen 21               #166 [hci1] 13.069424
      SMP: Pairing Random (0x04) len 16
        Random value: 23ac32ebbb5e14c8a6b9622f296d277f
> HCI Event: Number of Completed Packets (0x13) plen 5    #167 [hci1] 13.240025
        Num handles: 1
        Handle: 93 Address: DF:A9:FF:F6:B1:1A (OUI DF-A9-FF)
        Count: 1
        #166: len 21 (0 Kb/s)
        Latency: 170 msec (73-173 msec ~165 msec)
> ACL Data RX: Handle 93 flags 0x02 dlen 21               #168 [hci1] 13.327779
      SMP: Pairing Confirm (0x03) len 16
        Confim value: d80dbc9ac6c79070ce802865ed137c75
< HCI Command: Host Number of Com.. (0x03|0x0035) plen 5  #169 [hci1] 13.328454
        Num handles: 1
        Handle: 93 Address: DF:A9:FF:F6:B1:1A (OUI DF-A9-FF)
        Count: 1
< ACL Data TX: Handle 93 flags 0x00 dlen 21               #170 [hci1] 13.328498
      SMP: Pairing Confirm (0x03) len 16
        Confim value: ac34fa44867592f0608e56267257e564
> HCI Event: Number of Completed Packets (0x13) plen 5    #171 [hci1] 13.502651
        Num handles: 1
        Handle: 93 Address: DF:A9:FF:F6:B1:1A (OUI DF-A9-FF)
        Count: 1
        #170: len 21 (0 Kb/s)
        Latency: 174 msec (73-174 msec ~169 msec)
> ACL Data RX: Handle 93 flags 0x02 dlen 21               #172 [hci1] 13.503055
      SMP: Pairing Random (0x04) len 16
        Random value: 638bbf5274047ec80000000000000000
< HCI Command: Host Number of Com.. (0x03|0x0035) plen 5  #173 [hci1] 13.508709
        Num handles: 1
        Handle: 93 Address: DF:A9:FF:F6:B1:1A (OUI DF-A9-FF)
        Count: 1
< ACL Data TX: Handle 93 flags 0x00 dlen 21               #174 [hci1] 13.508729
      SMP: Pairing Random (0x04) len 16
        Random value: 297efe85e67448a15f56bd27e3a3cf1d
> HCI Event: Number of Completed Packets (0x13) plen 5    #175 [hci1] 13.677569
        Num handles: 1
        Handle: 93 Address: DF:A9:FF:F6:B1:1A (OUI DF-A9-FF)
        Count: 1
        #174: len 21 (1 Kb/s)
        Latency: 168 msec (73-174 msec ~169 msec)
> ACL Data RX: Handle 93 flags 0x02 dlen 21               #176 [hci1] 13.765330
      SMP: Pairing Confirm (0x03) len 16
        Confim value: 84c4a6274935cbdff8a06a99427b8eb6
< HCI Command: Host Number of Com.. (0x03|0x0035) plen 5  #177 [hci1] 13.768604
        Num handles: 1
        Handle: 93 Address: DF:A9:FF:F6:B1:1A (OUI DF-A9-FF)
        Count: 1
< ACL Data TX: Handle 93 flags 0x00 dlen 21               #178 [hci1] 13.768611
      SMP: Pairing Confirm (0x03) len 16
        Confim value: f39720f32e7fec9cf47fc435ea1388b0
> HCI Event: Number of Completed Packets (0x13) plen 5    #179 [hci1] 13.940184
        Num handles: 1
        Handle: 93 Address: DF:A9:FF:F6:B1:1A (OUI DF-A9-FF)
        Count: 1
        #178: len 21 (0 Kb/s)
        Latency: 171 msec (73-174 msec ~170 msec)
> ACL Data RX: Handle 93 flags 0x02 dlen 21               #180 [hci1] 13.940513
      SMP: Pairing Random (0x04) len 16
        Random value: ce7ef65e8d1e74f80000000000000000
< HCI Command: Host Number of Com.. (0x03|0x0035) plen 5  #181 [hci1] 13.948694
        Num handles: 1
        Handle: 93 Address: DF:A9:FF:F6:B1:1A (OUI DF-A9-FF)
        Count: 1
< ACL Data TX: Handle 93 flags 0x00 dlen 21               #182 [hci1] 13.948717
      SMP: Pairing Random (0x04) len 16
        Random value: 25a9493fd3ce4faf02be7293595bb7c6
> HCI Event: Number of Completed Packets (0x13) plen 5    #183 [hci1] 14.115038
        Num handles: 1
        Handle: 93 Address: DF:A9:FF:F6:B1:1A (OUI DF-A9-FF)
        Count: 1
        #182: len 21 (1 Kb/s)
        Latency: 166 msec (73-174 msec ~168 msec)
> ACL Data RX: Handle 93 flags 0x02 dlen 21               #184 [hci1] 14.202779
      SMP: Pairing Confirm (0x03) len 16
        Confim value: 57bed7602475d15e49034e596d331b09
< HCI Command: Host Number of Com.. (0x03|0x0035) plen 5  #185 [hci1] 14.208528
        Num handles: 1
        Handle: 93 Address: DF:A9:FF:F6:B1:1A (OUI DF-A9-FF)
        Count: 1
< ACL Data TX: Handle 93 flags 0x00 dlen 21               #186 [hci1] 14.208608
      SMP: Pairing Confirm (0x03) len 16
        Confim value: c54da7b51acd45628a5e88b7fc500b43
> HCI Event: Number of Completed Packets (0x13) plen 5    #187 [hci1] 14.377570
        Num handles: 1
        Handle: 93 Address: DF:A9:FF:F6:B1:1A (OUI DF-A9-FF)
        Count: 1
        #186: len 21 (1 Kb/s)
        Latency: 168 msec (73-174 msec ~168 msec)
> ACL Data RX: Handle 93 flags 0x02 dlen 21               #188 [hci1] 14.378082
      SMP: Pairing Random (0x04) len 16
        Random value: 51f1dc971af290920000000000000000
< HCI Command: Host Number of Com.. (0x03|0x0035) plen 5  #189 [hci1] 14.388664
        Num handles: 1
        Handle: 93 Address: DF:A9:FF:F6:B1:1A (OUI DF-A9-FF)
        Count: 1
< ACL Data TX: Handle 93 flags 0x00 dlen 21               #190 [hci1] 14.388682
      SMP: Pairing Random (0x04) len 16
        Random value: 58f6b41f855a6f6c3560debd84e2affc
> HCI Event: Number of Completed Packets (0x13) plen 5    #191 [hci1] 14.552492
        Num handles: 1
        Handle: 93 Address: DF:A9:FF:F6:B1:1A (OUI DF-A9-FF)
        Count: 1
        #190: len 21 (1 Kb/s)
        Latency: 163 msec (73-174 msec ~166 msec)
> ACL Data RX: Handle 93 flags 0x02 dlen 21               #192 [hci1] 14.640294
      SMP: Pairing Confirm (0x03) len 16
        Confim value: 14e31db7e8a93748574627e887f81a42
< HCI Command: Host Number of Com.. (0x03|0x0035) plen 5  #193 [hci1] 14.649037
        Num handles: 1
        Handle: 93 Address: DF:A9:FF:F6:B1:1A (OUI DF-A9-FF)
        Count: 1
< ACL Data TX: Handle 93 flags 0x00 dlen 21               #194 [hci1] 14.649201
      SMP: Pairing Confirm (0x03) len 16
        Confim value: c8f8ca98676e4491b8e0abbd23df9361
> HCI Event: Number of Completed Packets (0x13) plen 5    #195 [hci1] 14.815233
        Num handles: 1
        Handle: 93 Address: DF:A9:FF:F6:B1:1A (OUI DF-A9-FF)
        Count: 1
        #194: len 21 (1 Kb/s)
        Latency: 166 msec (73-174 msec ~166 msec)
> ACL Data RX: Handle 93 flags 0x02 dlen 21               #196 [hci1] 14.815500
      SMP: Pairing Random (0x04) len 16
        Random value: 559634f4f7b101b20000000000000000
< HCI Command: Host Number of Com.. (0x03|0x0035) plen 5  #197 [hci1] 14.829308
        Num handles: 1
        Handle: 93 Address: DF:A9:FF:F6:B1:1A (OUI DF-A9-FF)
        Count: 1
< ACL Data TX: Handle 93 flags 0x00 dlen 21               #198 [hci1] 14.829430
      SMP: Pairing Random (0x04) len 16
        Random value: b67e7216d5bf664139eda2b542549666
> HCI Event: Number of Completed Packets (0x13) plen 5    #199 [hci1] 14.989918
        Num handles: 1
        Handle: 93 Address: DF:A9:FF:F6:B1:1A (OUI DF-A9-FF)
        Count: 1
        #198: len 21 (1 Kb/s)
        Latency: 160 msec (73-174 msec ~163 msec)
> ACL Data RX: Handle 93 flags 0x02 dlen 21               #200 [hci1] 15.077834
      SMP: Pairing Confirm (0x03) len 16
        Confim value: ab52c029dcb7d0c0b3790f87b3df12ee
< HCI Command: Host Number of Com.. (0x03|0x0035) plen 5  #201 [hci1] 15.088809
        Num handles: 1
        Handle: 93 Address: DF:A9:FF:F6:B1:1A (OUI DF-A9-FF)
        Count: 1
< ACL Data TX: Handle 93 flags 0x00 dlen 21               #202 [hci1] 15.088941
      SMP: Pairing Confirm (0x03) len 16
        Confim value: 5ba5e24f0c358f8564411c116ae09101
> HCI Event: Number of Completed Packets (0x13) plen 5    #203 [hci1] 15.252713
        Num handles: 1
        Handle: 93 Address: DF:A9:FF:F6:B1:1A (OUI DF-A9-FF)
        Count: 1
        #202: len 21 (1 Kb/s)
        Latency: 163 msec (73-174 msec ~163 msec)
> ACL Data RX: Handle 93 flags 0x02 dlen 21               #204 [hci1] 15.252984
      SMP: Pairing Random (0x04) len 16
        Random value: e8384b1088bd49910000000000000000
< HCI Command: Host Number of Com.. (0x03|0x0035) plen 5  #205 [hci1] 15.269225
        Num handles: 1
        Handle: 93 Address: DF:A9:FF:F6:B1:1A (OUI DF-A9-FF)
        Count: 1
< ACL Data TX: Handle 93 flags 0x00 dlen 21               #206 [hci1] 15.269309
      SMP: Pairing Random (0x04) len 16
        Random value: ed17f76500c95219dd01e09d1e63f87b
> HCI Event: Number of Completed Packets (0x13) plen 5    #207 [hci1] 15.427491
        Num handles: 1
        Handle: 93 Address: DF:A9:FF:F6:B1:1A (OUI DF-A9-FF)
        Count: 1
        #206: len 21 (1 Kb/s)
        Latency: 158 msec (73-174 msec ~160 msec)
> ACL Data RX: Handle 93 flags 0x02 dlen 21               #208 [hci1] 15.515237
      SMP: Pairing Confirm (0x03) len 16
        Confim value: bbab1eb630cbd52a1b2724278a35c7dc
< HCI Command: Host Number of Com.. (0x03|0x0035) plen 5  #209 [hci1] 15.528990
        Num handles: 1
        Handle: 93 Address: DF:A9:FF:F6:B1:1A (OUI DF-A9-FF)
        Count: 1
< ACL Data TX: Handle 93 flags 0x00 dlen 21               #210 [hci1] 15.529206
      SMP: Pairing Confirm (0x03) len 16
        Confim value: c07a60cf1253feded2fcc604dfd635ab
> HCI Event: Number of Completed Packets (0x13) plen 5    #211 [hci1] 15.690096
        Num handles: 1
        Handle: 93 Address: DF:A9:FF:F6:B1:1A (OUI DF-A9-FF)
        Count: 1
        #210: len 21 (1 Kb/s)
        Latency: 160 msec (73-174 msec ~160 msec)
> ACL Data RX: Handle 93 flags 0x02 dlen 21               #212 [hci1] 15.690464
      SMP: Pairing Random (0x04) len 16
        Random value: 6847687fc176b88f0000000000000000
< HCI Command: Host Number of Com.. (0x03|0x0035) plen 5  #213 [hci1] 15.709277
        Num handles: 1
        Handle: 93 Address: DF:A9:FF:F6:B1:1A (OUI DF-A9-FF)
        Count: 1
< ACL Data TX: Handle 93 flags 0x00 dlen 21               #214 [hci1] 15.709388
      SMP: Pairing Random (0x04) len 16
        Random value: 81d35d47e1f6006d79c974bd9d9e1ee3
> HCI Event: Number of Completed Packets (0x13) plen 5    #215 [hci1] 15.864876
        Num handles: 1
        Handle: 93 Address: DF:A9:FF:F6:B1:1A (OUI DF-A9-FF)
        Count: 1
        #214: len 21 (1 Kb/s)
        Latency: 155 msec (73-174 msec ~158 msec)
> ACL Data RX: Handle 93 flags 0x02 dlen 21               #216 [hci1] 15.952838
      SMP: Pairing Confirm (0x03) len 16
        Confim value: e6b3ee310be1b36d729323b0df9d04ee
< HCI Command: Host Number of Com.. (0x03|0x0035) plen 5  #217 [hci1] 15.968966
        Num handles: 1
        Handle: 93 Address: DF:A9:FF:F6:B1:1A (OUI DF-A9-FF)
        Count: 1
< ACL Data TX: Handle 93 flags 0x00 dlen 21               #218 [hci1] 15.969075
      SMP: Pairing Confirm (0x03) len 16
        Confim value: 6dc95fadb4ae953134afe302e738c03f
> HCI Event: Number of Completed Packets (0x13) plen 5    #219 [hci1] 16.127654
        Num handles: 1
        Handle: 93 Address: DF:A9:FF:F6:B1:1A (OUI DF-A9-FF)
        Count: 1
        #218: len 21 (1 Kb/s)
        Latency: 158 msec (73-174 msec ~158 msec)
> ACL Data RX: Handle 93 flags 0x02 dlen 21               #220 [hci1] 16.127939
      SMP: Pairing Random (0x04) len 16
        Random value: 3c466939049b72bc0000000000000000
< HCI Command: Host Number of Com.. (0x03|0x0035) plen 5  #221 [hci1] 16.129173
        Num handles: 1
        Handle: 93 Address: DF:A9:FF:F6:B1:1A (OUI DF-A9-FF)
        Count: 1
< ACL Data TX: Handle 93 flags 0x00 dlen 21               #222 [hci1] 16.129223
      SMP: Pairing Random (0x04) len 16
        Random value: e7f7e0c2476823e41736a7e381bafb7c
> HCI Event: Number of Completed Packets (0x13) plen 5    #223 [hci1] 16.302472
        Num handles: 1
        Handle: 93 Address: DF:A9:FF:F6:B1:1A (OUI DF-A9-FF)
        Count: 1
        #222: len 21 (0 Kb/s)
        Latency: 173 msec (73-174 msec ~165 msec)
> ACL Data RX: Handle 93 flags 0x02 dlen 21               #224 [hci1] 16.390304
      SMP: Pairing Confirm (0x03) len 16
        Confim value: 46f3684d5d7dde9701de9240af8a8438
< HCI Command: Host Number of Com.. (0x03|0x0035) plen 5  #225 [hci1] 16.408652
        Num handles: 1
        Handle: 93 Address: DF:A9:FF:F6:B1:1A (OUI DF-A9-FF)
        Count: 1
< ACL Data TX: Handle 93 flags 0x00 dlen 21               #226 [hci1] 16.408771
      SMP: Pairing Confirm (0x03) len 16
        Confim value: ccb7363516ed9ce52807a2695bfec7f1
> HCI Event: Number of Completed Packets (0x13) plen 5    #227 [hci1] 16.565176
        Num handles: 1
        Handle: 93 Address: DF:A9:FF:F6:B1:1A (OUI DF-A9-FF)
        Count: 1
        #226: len 21 (1 Kb/s)
        Latency: 156 msec (73-174 msec ~161 msec)
> ACL Data RX: Handle 93 flags 0x02 dlen 21               #228 [hci1] 16.565518
      SMP: Pairing Random (0x04) len 16
        Random value: b0386cff62b99dcc0000000000000000
< HCI Command: Host Number of Com.. (0x03|0x0035) plen 5  #229 [hci1] 16.569253
        Num handles: 1
        Handle: 93 Address: DF:A9:FF:F6:B1:1A (OUI DF-A9-FF)
        Count: 1
