Bluetooth monitor ver 5.72
= Note: Linux version 6.14.0-36-generic (x86_64)                       0.840563
= Note: Bluetooth subsystem version 2.22                               0.840566
= New Index: 00:00:00:00:00:00 (Primary,UART,hci1)              [hci1] 0.840567
= New Index: 48:5F:99:8E:E0:64 (Primary,USB,hci0)               [hci0] 0.840568
= Open Index: 00:00:00:00:00:00                                 [hci1] 1.357177
= Index Info: 00:00:00:00:00:00 (Nordic Semiconductor ASA)      [hci1] 1.357187
@ USER Open: main (privileged) version 2.22            {0x0001} [hci1] 1.357189
< HCI Command: Reset (0x03|0x0003) plen 0                    #1 [hci1] 1.357603
> HCI Event: Command Complete (0x0e) plen 4                  #2 [hci1] 1.358104
      Reset (0x03|0x0003) ncmd 1
        Status: Success (0x00)
< HCI Command: Read Local Supported... (0x04|0x0003) plen 0  #3 [hci1] 1.375135
> HCI Event: Command Complete (0x0e) plen 12                 #4 [hci1] 1.375559
      Read Local Supported Features (0x04|0x0003) ncmd 1
        Status: Success (0x00)
        Features: 0x00 0x00 0x00 0x00 0x60 0x00 0x00 0x00
          BR/EDR Not Supported
          LE Supported (Controller)
< HCI Command: Read Local Version In.. (0x04|0x0001) plen 0  #5 [hci1] 1.394794
> HCI Event: Command Complete (0x0e) plen 12                 #6 [hci1] 1.395392
      Read Local Version Information (0x04|0x0001) ncmd 1
        Status: Success (0x00)
        HCI version: Reserved (0x0f) - Revision 12393 (0x3069)
        LMP version: Reserved (0x0f) - Subversion 12393 (0x3069)
        Manufacturer: Nordic Semiconductor ASA (89)
< HCI Command: Read Local Supported... (0x04|0x0002) plen 0  #7 [hci1] 1.414828
> HCI Event: Command Complete (0x0e) plen 68                 #8 [hci1] 1.415890
      Read Local Supported Commands (0x04|0x0002) ncmd 1
        Status: Success (0x00)
        Commands: 119 entries
          Disconnect (Octet 0 - Bit 5)
          Read Remote Version Information (Octet 2 - Bit 7)
          Set Event Mask (Octet 5 - Bit 6)
          Reset (Octet 5 - Bit 7)
          Read Connection Accept Timeout (Octet 7 - Bit 2)
          Write Connection Accept Timeout (Octet 7 - Bit 3)
          Read Transmit Power Level (Octet 10 - Bit 2)
          Set Controller To Host Flow Control (Octet 10 - Bit 5)
          Host Buffer Size (Octet 10 - Bit 6)
          Host Number of Completed Packets (Octet 10 - Bit 7)
          Read Local Version Information (Octet 14 - Bit 3)
          Read Local Supported Features (Octet 14 - Bit 5)
          Read BD ADDR (Octet 15 - Bit 1)
          Read RSSI (Octet 15 - Bit 5)
          Set Event Mask Page 2 (Octet 22 - Bit 2)
          LE Set Event Mask (Octet 25 - Bit 0)
          LE Read Buffer Size (Octet 25 - Bit 1)
          LE Read Local Supported Features (Octet 25 - Bit 2)
          LE Set Random Address (Octet 25 - Bit 4)
          LE Set Advertising Parameters (Octet 25 - Bit 5)
          LE Read Advertising Channel TX Power (Octet 25 - Bit 6)
          LE Set Advertising Data (Octet 25 - Bit 7)
          LE Set Scan Response Data (Octet 26 - Bit 0)
          LE Set Advertise Enable (Octet 26 - Bit 1)
          LE Set Scan Parameters (Octet 26 - Bit 2)
          LE Set Scan Enable (Octet 26 - Bit 3)
          LE Create Connection (Octet 26 - Bit 4)
          LE Create Connection Cancel (Octet 26 - Bit 5)
          LE Read Accept List Size (Octet 26 - Bit 6)
          LE Clear Accept List (Octet 26 - Bit 7)
          LE Add Device To Accept List (Octet 27 - Bit 0)
          LE Remove Device From Accept List (Octet 27 - Bit 1)
          LE Connection Update (Octet 27 - Bit 2)
          LE Set Host Channel Classification (Octet 27 - Bit 3)
          LE Read Channel Map (Octet 27 - Bit 4)
          LE Read Remote Used Features (Octet 27 - Bit 5)
          LE Encrypt (Octet 27 - Bit 6)
          LE Rand (Octet 27 - Bit 7)
          LE Start Encryption (Octet 28 - Bit 0)
          LE Long Term Key Request Reply (Octet 28 - Bit 1)
          LE Long Term Key Request Neg Reply (Octet 28 - Bit 2)
          LE Read Supported States (Octet 28 - Bit 3)
          LE Receiver Test (Octet 28 - Bit 4)
          LE Transmitter Test (Octet 28 - Bit 5)
          LE Test End (Octet 28 - Bit 6)
          Read Authenticated Payload Timeout (Octet 32 - Bit 4)
          Write Authenticated Payload Timeout (Octet 32 - Bit 5)
          LE Set Data Length (Octet 33 - Bit 6)
          LE Read Suggested Default Data Length (Octet 33 - Bit 7)
          LE Write Suggested Default Data Length (Octet 34 - Bit 0)
          LE Add Device To Resolving List (Octet 34 - Bit 3)
          LE Remove Device From Resolving List (Octet 34 - Bit 4)
          LE Clear Resolving List (Octet 34 - Bit 5)
          LE Read Resolving List Size (Octet 34 - Bit 6)
          LE Set Address Resolution Enable (Octet 35 - Bit 1)
          LE Set Resolvable Private Address Timeout (Octet 35 - Bit 2)
          LE Read Maximum Data Length (Octet 35 - Bit 3)
          LE Read PHY (Octet 35 - Bit 4)
          LE Set Default PHY (Octet 35 - Bit 5)
          LE Set PHY (Octet 35 - Bit 6)
          LE Enhanced Receiver Test (Octet 35 - Bit 7)
          LE Enhanced Transmitter Test (Octet 36 - Bit 0)
          LE Set Advertising Set Random Address (Octet 36 - Bit 1)
          LE Set Extended Advertising Parameters (Octet 36 - Bit 2)
          LE Set Extended Advertising Data (Octet 36 - Bit 3)
          LE Set Extended Scan Response Data (Octet 36 - Bit 4)
          LE Set Extended Advertising Enable (Octet 36 - Bit 5)
          LE Read Maximum Advertising Data Length (Octet 36 - Bit 6)
          LE Read Number of Supported Advertising Sets (Octet 36 - Bit 7)
          LE Remove Advertising Set (Octet 37 - Bit 0)
          LE Clear Advertising Sets (Octet 37 - Bit 1)
          LE Set Periodic Advertising Parameters (Octet 37 - Bit 2)
          LE Set Periodic Advertising Data (Octet 37 - Bit 3)
          LE Set Periodic Advertising Enable (Octet 37 - Bit 4)
          LE Set Extended Scan Parameters (Octet 37 - Bit 5)
          LE Set Extended Scan Enable (Octet 37 - Bit 6)
          LE Extended Create Connection (Octet 37 - Bit 7)
          LE Periodic Advertising Create Sync (Octet 38 - Bit 0)
          LE Periodic Advertising Create Sync Cancel (Octet 38 - Bit 1)
          LE Periodic Advertising Terminate Sync (Octet 38 - Bit 2)
          LE Add Device To Periodic Advertiser List (Octet 38 - Bit 3)
          LE Remove Device From Periodic Advertiser List (Octet 38 - Bit 4)
          LE Clear Periodic Advertiser List (Octet 38 - Bit 5)
          LE Read Periodic Advertiser List Size (Octet 38 - Bit 6)
          LE Read Transmit Power (Octet 38 - Bit 7)
          LE Read RF Path Compensation (Octet 39 - Bit 0)
          LE Write RF Path Compensation (Octet 39 - Bit 1)
          LE Set Privacy Mode (Octet 39 - Bit 2)
          LE Periodic Advertising Receive Enable (Octet 40 - Bit 5)
          LE Periodic Advertising Sync Transfer (Octet 40 - Bit 6)
          LE Periodic Advertising Set Info Transfer (Octet 40 - Bit 7)
          LE Periodic Advertising Sync Transfer Parameters (Octet 41 - Bit 0)
          LE Set Default Periodic Advertisng Sync Transfer Parameters (Octet 41 - Bit 1)
          LE Read Buffer v2 (Octet 41 - Bit 5)
          LE Read ISO TX Sync (Octet 41 - Bit 6)
          LE Set Connected Isochronous Group Parameters (Octet 41 - Bit 7)
          LE Set Connected Isochronous Group Parameters Test (Octet 42 - Bit 0)
          LE Create Connected Isochronous Stream (Octet 42 - Bit 1)
          LE Remove Connected Isochronous Group (Octet 42 - Bit 2)
          LE Accept Connected Isochronous Stream Request (Octet 42 - Bit 3)
          LE Reject Connected Isochronous Stream Request (Octet 42 - Bit 4)
          LE Create Broadcast Isochronous Group (Octet 42 - Bit 5)
          LE Create Broadcast Isochronous Group Test (Octet 42 - Bit 6)
          LE Terminate Broadcast Isochronous Group (Octet 42 - Bit 7)
          LE Broadcast Isochronous Group Create Sync (Octet 43 - Bit 0)
          LE Broadcast Isochronous Group Terminate Sync (Octet 43 - Bit 1)
          LE Request Peer SCA (Octet 43 - Bit 2)
          LE Setup Isochronous Data Path (Octet 43 - Bit 3)
          LE Remove Isochronous Data Path (Octet 43 - Bit 4)
          LE Isochronous Transmit Test (Octet 43 - Bit 5)
          LE Isochronous Receive Test (Octet 43 - Bit 6)
          LE Isochronous Read Test Counters (Octet 43 - Bit 7)
          LE Isochronous Read Test Counters (Octet 44 - Bit 0)
          LE Set Host Feature (Octet 44 - Bit 1)
          Octet 44 - Bit 2 
          Octet 45 - Bit 6 
          Octet 46 - Bit 0 
          Octet 46 - Bit 1 
          Octet 46 - Bit 2 
< HCI Command: Host Buffer Size (0x03|0x0033) plen 7         #9 [hci1] 1.434761
        ACL MTU: 255  ACL max packet: 16
        SCO MTU: 0    SCO max packet: 0
> HCI Event: Command Complete (0x0e) plen 4                 #10 [hci1] 1.435225
      Host Buffer Size (0x03|0x0033) ncmd 1
        Status: Success (0x00)
< HCI Command: Set Controller To Ho.. (0x03|0x0031) plen 1  #11 [hci1] 1.454801
        Flow control: ACL Data Packets (0x01)
> HCI Event: Command Complete (0x0e) plen 4                 #12 [hci1] 1.455453
      Set Controller To Host Flow Control (0x03|0x0031) ncmd 1
        Status: Success (0x00)
< HCI Command: LE Read Local Suppor.. (0x08|0x0003) plen 0  #13 [hci1] 1.474820
> HCI Event: Command Complete (0x0e) plen 12                #14 [hci1] 1.475434
      LE Read Local Supported Features (0x08|0x0003) ncmd 1
        Status: Success (0x00)
        Features: 0xfd 0x79 0x00 0xf7 0x30 0x01 0x00 0x00
          LE Encryption
          Extended Reject Indication
          Peripheral-initiated Features Exchange
          LE Ping
          LE Data Packet Length Extension
          LL Privacy
          Extended Scanner Filter Policies
          LE 2M PHY
          LE Coded PHY
          LE Extended Advertising
          LE Periodic Advertising
          Channel Selection Algorithm #2
          Periodic Advertising Sync Transfer - Sender
          Periodic Advertising Sync Transfer - Recipient
          Sleep Clock Accuracy Updates
          Connected Isochronous Stream - Central
          Connected Isochronous Stream - Peripheral
          Isochronous Broadcaster
          Synchronized Receiver
          Periodic Advertising ADI support
          Connection Subrating
          Unknown features (0x0000010000000000)
< HCI Command: LE Set Host Feature (0x08|0x0074) plen 2     #15 [hci1] 1.494838
        Bit Number: 32
          Connected Isochronous Stream (Host Support)
        Bit Value: 1
> HCI Event: Command Complete (0x0e) plen 4                 #16 [hci1] 1.495224
      LE Set Host Feature (0x08|0x0074) ncmd 1
        Status: Success (0x00)
< HCI Command: LE Read Buffer v2 (0x08|0x0060) plen 0       #17 [hci1] 1.514810
> HCI Event: Command Complete (0x0e) plen 10                #18 [hci1] 1.515225
      LE Read Buffer v2 (0x08|0x0060) ncmd 1
        Status: Success (0x00)
        ACL MTU: 27
        ACL max packet: 3
        ISO MTU: 318
        ISO max packet: 3
< HCI Command: LE Read Maximum Adve.. (0x08|0x003a) plen 0  #19 [hci1] 1.534852
> HCI Event: Command Complete (0x0e) plen 6                 #20 [hci1] 1.535323
      LE Read Maximum Advertising Data Length (0x08|0x003a) ncmd 1
        Status: Success (0x00)
        Max length: 1650
< HCI Command: LE Read Supported St.. (0x08|0x001c) plen 0  #21 [hci1] 1.554664
> HCI Event: Command Complete (0x0e) plen 12                #22 [hci1] 1.555119
      LE Read Supported States (0x08|0x001c) ncmd 1
        Status: Success (0x00)
        States: 0x000003ff3e0306ff
          Non-connectable Advertising State
          Scannable Advertising State
          Connectable Advertising State
          High Duty Cycle Directed Advertising State
          Passive Scanning State
          Active Scanning State
          Initiating State
            and Connection State (Central Role)
          Connection State (Peripheral Role)
          Scannable Advertising State
            and Passive Scanning State
          Connectable Advertising State
            and Passive Scanning State
          Non-connectable Advertising State
            and Initiating State
          Scannable Advertising State
            and Initiating State
          Active Scanning State
            and Connection State (Central Role)
          Passive Scanning State
            and Connection State (Peripheral Role)
          Active Scanning State
            and Connection State (Peripheral Role)
          Initiating State
            and Connection State (Central Role)
            and Central Role & Central Role
          Low Duty Cycle Directed Advertising State
          Connectable Advertising State
            and Initiating State
            and Central Role & Peripheral Role
          High Duty Cycle Directed Advertising State
            and Initiating State
            and Central Role & Peripheral Role
          Low Duty Cycle Directed Advertising State
            and Initiating State
            and Central Role & Peripheral Role
          Connectable Advertising State
            and Connection State (Central Role)
            and Central Role & Peripheral Role
          High Duty Cycle Directed Advertising State
            and Connection State (Central Role)
            and Central Role & Peripheral Role
          Low Duty Cycle Directed Advertising State
            and Connection State (Central Role)
            and Central Role & Peripheral Role
          Connectable Advertising State
            and Connection State (Peripheral Role)
            and Central Role & Peripheral Role
          High Duty Cycle Directed Advertising State
            and Connection State (Peripheral Role)
            and Peripheral Role & Peripheral Role
          Low Duty Cycle Directed Advertising State
            and Connection State (Peripheral Role)
            and Peripheral Role & Peripheral Role
          Initiating State
            and Connection State (Peripheral Role)
            and Central Role & Peripheral Role
< HCI Command: LE Read Maximum Data.. (0x08|0x002f) plen 0  #23 [hci1] 1.574798
> HCI Event: Command Complete (0x0e) plen 12                #24 [hci1] 1.575337
      LE Read Maximum Data Length (0x08|0x002f) ncmd 1
        Status: Success (0x00)
        Max TX octets: 251
        Max TX time: 2704
        Max RX octets: 251
        Max RX time: 2704
< HCI Command: LE Write Suggested D.. (0x08|0x0024) plen 4  #25 [hci1] 1.594796
        TX octets: 251
        TX time: 2704
> HCI Event: Command Complete (0x0e) plen 4                 #26 [hci1] 1.595336
      LE Write Suggested Default Data Length (0x08|0x0024) ncmd 1
        Status: Success (0x00)
< HCI Command: LE Read Resolving Li.. (0x08|0x002a) plen 0  #27 [hci1] 1.614767
> HCI Event: Command Complete (0x0e) plen 5                 #28 [hci1] 1.615161
      LE Read Resolving List Size (0x08|0x002a) ncmd 1
        Status: Success (0x00)
        Size: 8
< HCI Command: LE Set Event Mask (0x08|0x0001) plen 8       #29 [hci1] 1.634827
        Mask: 0x000002023f87fa5e
          LE Advertising Report
          LE Connection Update Complete
          LE Read Remote Used Features Complete
          LE Long Term Key Request
          LE Data Length Change
          LE Enhanced Connection Complete
          LE PHY Update Complete
          LE Extended Advertising Report
          LE Periodic Advertising Sync Established
          LE Periodic Advertising Report
          LE Periodic Advertising Sync Lost
          LE Extended Scan Timeout
          LE Extended Advertising Set Terminated
          LE Scan Request Received
          LE Periodic Advertising Sync Transfer Rvc
          LE CIS Established
          LE CIS Request
          LE Create BIG Complete
          LE Terminate BIG Complete
          LE BIG Sync Estabilished Complete
          LE BIG Sync Lost
          LE BIG Info Advertising Report
          Unknown mask (0x0000020000000000)
> HCI Event: Command Complete (0x0e) plen 4                 #30 [hci1] 1.635451
      LE Set Event Mask (0x08|0x0001) ncmd 1
        Status: Success (0x00)
< HCI Command: Set Event Mask (0x03|0x0001) plen 8          #31 [hci1] 1.654818
        Mask: 0x2000800002008890
          Disconnection Complete
          Encryption Change
          Read Remote Version Information Complete
          Hardware Error
          Data Buffer Overflow
          Encryption Key Refresh Complete
          LE Meta
> HCI Event: Command Complete (0x0e) plen 4                 #32 [hci1] 1.655315
      Set Event Mask (0x03|0x0001) ncmd 1
        Status: Success (0x00)
< HCI Command: Read BD ADDR (0x04|0x0009) plen 0            #33 [hci1] 1.674818
> HCI Event: Command Complete (0x0e) plen 10                #34 [hci1] 1.675334
      Read BD ADDR (0x04|0x0009) ncmd 1
        Status: Success (0x00)
        Address: 00:00:00:00:00:00 (OUI 00-00-00)
< HCI Command: LE Set Random Address (0x08|0x0005) plen 6   #35 [hci1] 1.694853
        Address: D5:B6:CC:31:DB:3B (Static)
> HCI Event: Command Complete (0x0e) plen 4                 #36 [hci1] 1.695351
      LE Set Random Address (0x08|0x0005) ncmd 1
        Status: Success (0x00)
< HCI Command: LE Extended Create... (0x08|0x0043) plen 26  #37 [hci1] 3.984789
        Filter policy: Accept list is not used (0x00)
        Own address type: Random (0x01)
        Peer address type: Public (0x00)
        Peer address: DF:A9:FF:F6:B1:1A (OUI DF-A9-FF)
        Initiating PHYs: 0x01
        Entry 0: LE 1M
          Scan interval: 60.000 msec (0x0060)
          Scan window: 60.000 msec (0x0060)
          Min connection interval: 30.00 msec (0x0018)
          Max connection interval: 50.00 msec (0x0028)
          Connection latency: 0 (0x0000)
          Supervision timeout: 4000 msec (0x0190)
          Min connection length: 0.000 msec (0x0000)
          Max connection length: 0.000 msec (0x0000)
> HCI Event: Command Status (0x0f) plen 4                   #38 [hci1] 3.985651
      LE Extended Create Connection (0x08|0x0043) ncmd 1
        Status: Success (0x00)
> HCI Event: LE Meta Event (0x3e) plen 31                   #39 [hci1] 4.010715
      LE Enhanced Connection Complete (0x0a)
        Status: Success (0x00)
        Handle: 684
        Role: Central (0x00)
        Peer address type: Public (0x00)
        Peer address: DF:A9:FF:F6:B1:1A (OUI DF-A9-FF)
        Local resolvable private address: 00:00:00:00:00:00 (Non-Resolvable)
        Peer resolvable private address: 00:00:00:00:00:00 (Non-Resolvable)
        Connection interval: 50.00 msec (0x0028)
        Connection latency: 0 (0x0000)
        Supervision timeout: 4000 msec (0x0190)
        Central clock accuracy: 0x00
< HCI Command: LE Read Remote Used... (0x08|0x0016) plen 2  #40 [hci1] 4.015051
        Handle: 684 Address: DF:A9:FF:F6:B1:1A (OUI DF-A9-FF)
> HCI Event: Command Status (0x0f) plen 4                   #41 [hci1] 4.015521
      LE Read Remote Used Features (0x08|0x0016) ncmd 1
        Status: Success (0x00)
< HCI Command: LE Set PHY (0x08|0x0032) plen 7              #42 [hci1] 4.034882
        Handle: 684 Address: DF:A9:FF:F6:B1:1A (OUI DF-A9-FF)
        All PHYs preference: 0x00
        TX PHYs preference: 0x02
          LE 2M
        RX PHYs preference: 0x02
          LE 2M
        PHY options preference: Reserved (0x0000)
> HCI Event: Command Status (0x0f) plen 4                   #43 [hci1] 4.035415
      LE Set PHY (0x08|0x0032) ncmd 1
        Status: Success (0x00)
> HCI Event: LE Meta Event (0x3e) plen 12                   #44 [hci1] 4.162144
      LE Read Remote Used Features (0x04)
        Status: Success (0x00)
        Handle: 684 Address: DF:A9:FF:F6:B1:1A (OUI DF-A9-FF)
        Features: 0x2d 0x49 0x00 0xf7 0x67 0xd8 0x00 0x00
          LE Encryption
          Extended Reject Indication
          Peripheral-initiated Features Exchange
          LE Data Packet Length Extension
          LE 2M PHY
          LE Coded PHY
          Channel Selection Algorithm #2
          Periodic Advertising Sync Transfer - Sender
          Periodic Advertising Sync Transfer - Recipient
          Sleep Clock Accuracy Updates
          Connected Isochronous Stream - Central
          Connected Isochronous Stream - Peripheral
          Isochronous Broadcaster
          Synchronized Receiver
          Connected Isochronous Stream (Host Support)
          LE Power Control Request
          LE Power Control Request
          Connection Subrating
          Connection Subrating (Host Support)
          Unknown features (0x0000d80000000000)
> HCI Event: LE Meta Event (0x3e) plen 6                    #45 [hci1] 4.661465
      LE PHY Update Complete (0x0c)
        Status: Success (0x00)
        Handle: 684 Address: DF:A9:FF:F6:B1:1A (OUI DF-A9-FF)
        TX PHY: LE 2M (0x02)
        RX PHY: LE 2M (0x02)
< ACL Data TX: Handle 684 flags 0x00 dlen 11                #46 [hci1] 5.074991
      SMP: Pairing Request (0x01) len 6
        IO capability: KeyboardOnly (0x02)
        OOB data: Authentication data not present (0x00)
        Authentication requirement: No bonding, No MITM, SC, No Keypresses (0x08)
        Max encryption key size: 16
        Initiator key distribution: <none> (0x00)
        Responder key distribution: <none> (0x00)
> HCI Event: Number of Completed Packets (0x13) plen 5      #47 [hci1] 5.111929
        Num handles: 1
        Handle: 684 Address: DF:A9:FF:F6:B1:1A (OUI DF-A9-FF)
        Count: 1
        #46: len 11 (2 Kb/s)
        Latency: 36 msec (36-36 msec ~36 msec)
> ACL Data RX: Handle 684 flags 0x02 dlen 11                #48 [hci1] 5.162024
      SMP: Pairing Response (0x02) len 6
        IO capability: KeyboardOnly (0x02)
        OOB data: Authentication data not present (0x00)
        Authentication requirement: No bonding, MITM, SC, No Keypresses (0x0c)
        Max encryption key size: 16
        Initiator key distribution: <none> (0x00)
        Responder key distribution: <none> (0x00)
< HCI Command: Host Number of Compl.. (0x03|0x0035) plen 5  #49 [hci1] 5.175375
        Num handles: 1
        Handle: 684 Address: DF:A9:FF:F6:B1:1A (OUI DF-A9-FF)
        Count: 1
< ACL Data TX: Handle 684 flags 0x00 dlen 27                #50 [hci1] 5.175432
< ACL Data TX: Handle 684 flags 0x01 dlen 27                #51 [hci1] 5.175439
< ACL Data TX: Handle 684 flags 0x01 dlen 15                #52 [hci1] 5.175488
      SMP: Pairing Public Key (0x0c) len 64
        X: 98308440221e2d910f0e54b71e7ec652857aa9b5a0dc65028824cc19db1226e9
        Y: 67a4816bcb62efb21701e31fdb27561a6217575fb007a8bbdabe7e28b6f68482
> HCI Event: Number of Completed Packets (0x13) plen 5      #53 [hci1] 5.212032
        Num handles: 1
        Handle: 684 Address: DF:A9:FF:F6:B1:1A (OUI DF-A9-FF)
        Count: 1
        #50: len 27 (6 Kb/s)
        Latency: 36 msec (36-36 msec ~36 msec)
> HCI Event: Number of Completed Packets (0x13) plen 5      #54 [hci1] 5.212513
        Num handles: 1
        Handle: 684 Address: DF:A9:FF:F6:B1:1A (OUI DF-A9-FF)
        Count: 1
        #51: len 27 (5 Kb/s)
        Latency: 37 msec (36-37 msec ~36 msec)
> HCI Event: Number of Completed Packets (0x13) plen 5      #55 [hci1] 5.212971
        Num handles: 1
        Handle: 684 Address: DF:A9:FF:F6:B1:1A (OUI DF-A9-FF)
        Count: 1
        #52: len 15 (3 Kb/s)
        Latency: 37 msec (36-37 msec ~37 msec)
> ACL Data RX: Handle 684 flags 0x02 dlen 27                #56 [hci1] 5.262114
> ACL Data RX: Handle 684 flags 0x01 dlen 27                #57 [hci1] 5.262621
> ACL Data RX: Handle 684 flags 0x01 dlen 15                #58 [hci1] 5.263014
      SMP: Pairing Public Key (0x0c) len 64
        X: 607961b562aaaea6f5c3b59bdbe27b8e67bf4c33b0a6bf6da548e243b2d47547
        Y: c81cd928e46cae42c4fbd1e076c0457c47f6fbfe1e3b72de5e8fa4c6c4e70d6d
< HCI Command: Host Number of Compl.. (0x03|0x0035) plen 5  #59 [hci1] 5.274991
        Num handles: 1
        Handle: 684 Address: DF:A9:FF:F6:B1:1A (OUI DF-A9-FF)
        Count: 1
< HCI Command: Host Number of Compl.. (0x03|0x0035) plen 5  #60 [hci1] 5.275123
        Num handles: 1
        Handle: 684 Address: DF:A9:FF:F6:B1:1A (OUI DF-A9-FF)
        Count: 1
< HCI Command: Host Number of Compl.. (0x03|0x0035) plen 5  #61 [hci1] 5.275229
        Num handles: 1
        Handle: 684 Address: DF:A9:FF:F6:B1:1A (OUI DF-A9-FF)
        Count: 1
< ACL Data TX: Handle 684 flags 0x00 dlen 21                #62 [hci1] 6.085568
      SMP: Pairing Confirm (0x03) len 16
        Confim value: b4388ea863bb9dc8c5745bcd81563fe2
> HCI Event: Number of Completed Packets (0x13) plen 5      #63 [hci1] 6.111892
        Num handles: 1
        Handle: 684 Address: DF:A9:FF:F6:B1:1A (OUI DF-A9-FF)
        Count: 1
        #62: len 21 (6 Kb/s)
        Latency: 26 msec (26-37 msec ~31 msec)
> ACL Data RX: Handle 684 flags 0x02 dlen 21                #64 [hci1] 6.162110
      SMP: Pairing Confirm (0x03) len 16
        Confim value: be45934ecd96f9a213e6b0b84fbe8914
< HCI Command: Host Number of Compl.. (0x03|0x0035) plen 5  #65 [hci1] 6.175331
        Num handles: 1
        Handle: 684 Address: DF:A9:FF:F6:B1:1A (OUI DF-A9-FF)
        Count: 1
< ACL Data TX: Handle 684 flags 0x00 dlen 21                #66 [hci1] 6.175541
      SMP: Pairing Random (0x04) len 16
        Random value: 8e6108f966a694cbe26df70bb96773e6
> HCI Event: Number of Completed Packets (0x13) plen 5      #67 [hci1] 6.212104
        Num handles: 1
        Handle: 684 Address: DF:A9:FF:F6:B1:1A (OUI DF-A9-FF)
        Count: 1
        #66: len 21 (4 Kb/s)
        Latency: 36 msec (26-37 msec ~34 msec)
> ACL Data RX: Handle 684 flags 0x02 dlen 21                #68 [hci1] 6.462131
      SMP: Pairing Random (0x04) len 16
        Random value: d467d1d8f4bffde36f655ea5f8974256
< HCI Command: Host Number of Compl.. (0x03|0x0035) plen 5  #69 [hci1] 6.475705
        Num handles: 1
        Handle: 684 Address: DF:A9:FF:F6:B1:1A (OUI DF-A9-FF)
        Count: 1
< ACL Data TX: Handle 684 flags 0x00 dlen 21                #70 [hci1] 6.475936
      SMP: Pairing Confirm (0x03) len 16
        Confim value: 345f47487dc0a55224bea8569a223833
> HCI Event: Number of Completed Packets (0x13) plen 5      #71 [hci1] 6.512011
        Num handles: 1
        Handle: 684 Address: DF:A9:FF:F6:B1:1A (OUI DF-A9-FF)
        Count: 1
        #70: len 21 (4 Kb/s)
        Latency: 36 msec (26-37 msec ~35 msec)
> ACL Data RX: Handle 684 flags 0x02 dlen 21                #72 [hci1] 6.562056
      SMP: Pairing Confirm (0x03) len 16
        Confim value: 531a876018017e76fdbabbaf4108378e
< HCI Command: Host Number of Compl.. (0x03|0x0035) plen 5  #73 [hci1] 6.574937
        Num handles: 1
        Handle: 684 Address: DF:A9:FF:F6:B1:1A (OUI DF-A9-FF)
        Count: 1
< ACL Data TX: Handle 684 flags 0x00 dlen 21                #74 [hci1] 6.575039
      SMP: Pairing Random (0x04) len 16
        Random value: 5da095555cc64d02679f89a05211af56
> HCI Event: Number of Completed Packets (0x13) plen 5      #75 [hci1] 6.611991
        Num handles: 1
        Handle: 684 Address: DF:A9:FF:F6:B1:1A (OUI DF-A9-FF)
        Count: 1
        #74: len 21 (4 Kb/s)
        Latency: 36 msec (26-37 msec ~36 msec)
> ACL Data RX: Handle 684 flags 0x02 dlen 21                #76 [hci1] 6.862132
      SMP: Pairing Random (0x04) len 16
        Random value: 73fa41ef4a837147208e2e4fc6a6b0ef
< HCI Command: Host Number of Compl.. (0x03|0x0035) plen 5  #77 [hci1] 6.875194
        Num handles: 1
        Handle: 684 Address: DF:A9:FF:F6:B1:1A (OUI DF-A9-FF)
        Count: 1
< ACL Data TX: Handle 684 flags 0x00 dlen 21                #78 [hci1] 6.875301
      SMP: Pairing Confirm (0x03) len 16
        Confim value: c1bf56afe38d2904d29d62e0b156d4df
> HCI Event: Number of Completed Packets (0x13) plen 5      #79 [hci1] 6.911939
        Num handles: 1
        Handle: 684 Address: DF:A9:FF:F6:B1:1A (OUI DF-A9-FF)
        Count: 1
        #78: len 21 (4 Kb/s)
        Latency: 36 msec (26-37 msec ~36 msec)
> ACL Data RX: Handle 684 flags 0x02 dlen 21                #80 [hci1] 6.962138
      SMP: Pairing Confirm (0x03) len 16
        Confim value: 678c9348c8912ce54f67c5dd019070bd
< HCI Command: Host Number of Compl.. (0x03|0x0035) plen 5  #81 [hci1] 6.975116
        Num handles: 1
        Handle: 684 Address: DF:A9:FF:F6:B1:1A (OUI DF-A9-FF)
        Count: 1
< ACL Data TX: Handle 684 flags 0x00 dlen 21                #82 [hci1] 6.975243
      SMP: Pairing Random (0x04) len 16
        Random value: da64d21ec8845e8286bc235a02440d0c
> HCI Event: Number of Completed Packets (0x13) plen 5      #83 [hci1] 7.011907
        Num handles: 1
        Handle: 684 Address: DF:A9:FF:F6:B1:1A (OUI DF-A9-FF)
        Count: 1
        #82: len 21 (4 Kb/s)
        Latency: 36 msec (26-37 msec ~36 msec)
> ACL Data RX: Handle 684 flags 0x02 dlen 21                #84 [hci1] 7.262217
      SMP: Pairing Random (0x04) len 16
        Random value: 24a185af183a193452fd1835847f5f0c
< HCI Command: Host Number of Compl.. (0x03|0x0035) plen 5  #85 [hci1] 7.275561
        Num handles: 1
        Handle: 684 Address: DF:A9:FF:F6:B1:1A (OUI DF-A9-FF)
        Count: 1
< ACL Data TX: Handle 684 flags 0x00 dlen 21                #86 [hci1] 7.275735
      SMP: Pairing Confirm (0x03) len 16
        Confim value: dd6ef2b541757902d8487a6187d52225
> HCI Event: Number of Completed Packets (0x13) plen 5      #87 [hci1] 7.311921
        Num handles: 1
        Handle: 684 Address: DF:A9:FF:F6:B1:1A (OUI DF-A9-FF)
        Count: 1
        #86: len 21 (4 Kb/s)
        Latency: 36 msec (26-37 msec ~36 msec)
> ACL Data RX: Handle 684 flags 0x02 dlen 21                #88 [hci1] 7.362027
      SMP: Pairing Confirm (0x03) len 16
        Confim value: 754fc3bd5b3f974572f2c1cf2fc26c06
< HCI Command: Host Number of Compl.. (0x03|0x0035) plen 5  #89 [hci1] 7.375125
        Num handles: 1
        Handle: 684 Address: DF:A9:FF:F6:B1:1A (OUI DF-A9-FF)
        Count: 1
< ACL Data TX: Handle 684 flags 0x00 dlen 21                #90 [hci1] 7.375280
      SMP: Pairing Random (0x04) len 16
        Random value: a2acf8fd71a45c4a1bcadd27bd58e945
> HCI Event: Number of Completed Packets (0x13) plen 5      #91 [hci1] 7.411915
        Num handles: 1
        Handle: 684 Address: DF:A9:FF:F6:B1:1A (OUI DF-A9-FF)
        Count: 1
        #90: len 21 (4 Kb/s)
        Latency: 36 msec (26-37 msec ~36 msec)
> ACL Data RX: Handle 684 flags 0x02 dlen 21                #92 [hci1] 7.662084
      SMP: Pairing Random (0x04) len 16
        Random value: b26e42e21aa40ba4b421a081d0444508
< HCI Command: Host Number of Compl.. (0x03|0x0035) plen 5  #93 [hci1] 7.675551
        Num handles: 1
        Handle: 684 Address: DF:A9:FF:F6:B1:1A (OUI DF-A9-FF)
        Count: 1
< ACL Data TX: Handle 684 flags 0x00 dlen 21                #94 [hci1] 7.675787
      SMP: Pairing Confirm (0x03) len 16
        Confim value: 4f76a711f9143e240d53f8fa91bc24da
> HCI Event: Number of Completed Packets (0x13) plen 5      #95 [hci1] 7.711883
        Num handles: 1
        Handle: 684 Address: DF:A9:FF:F6:B1:1A (OUI DF-A9-FF)
        Count: 1
        #94: len 21 (4 Kb/s)
        Latency: 36 msec (26-37 msec ~36 msec)
> ACL Data RX: Handle 684 flags 0x02 dlen 21                #96 [hci1] 7.762203
      SMP: Pairing Confirm (0x03) len 16
        Confim value: b2470f8717d1116569f0584d4c4a9268
< HCI Command: Host Number of Compl.. (0x03|0x0035) plen 5  #97 [hci1] 7.775316
        Num handles: 1
        Handle: 684 Address: DF:A9:FF:F6:B1:1A (OUI DF-A9-FF)
        Count: 1
< ACL Data TX: Handle 684 flags 0x00 dlen 21                #98 [hci1] 7.775497
      SMP: Pairing Random (0x04) len 16
        Random value: 00bad7aca1ba32527e6e64e79f33b2e3
> HCI Event: Number of Completed Packets (0x13) plen 5      #99 [hci1] 7.811942
        Num handles: 1
        Handle: 684 Address: DF:A9:FF:F6:B1:1A (OUI DF-A9-FF)
        Count: 1
        #98: len 21 (4 Kb/s)
        Latency: 36 msec (26-37 msec ~36 msec)
> ACL Data RX: Handle 684 flags 0x02 dlen 21               #100 [hci1] 8.062094
      SMP: Pairing Random (0x04) len 16
        Random value: 2cb25c904ec49bce32ac8a9c8855977a
< HCI Command: Host Number of Comp.. (0x03|0x0035) plen 5  #101 [hci1] 8.075404
        Num handles: 1
        Handle: 684 Address: DF:A9:FF:F6:B1:1A (OUI DF-A9-FF)
        Count: 1
< ACL Data TX: Handle 684 flags 0x00 dlen 21               #102 [hci1] 8.075646
      SMP: Pairing Confirm (0x03) len 16
        Confim value: 254d500d42ad8ca99f4fb0dd7146bf60
> HCI Event: Number of Completed Packets (0x13) plen 5     #103 [hci1] 8.111886
        Num handles: 1
        Handle: 684 Address: DF:A9:FF:F6:B1:1A (OUI DF-A9-FF)
        Count: 1
        #102: len 21 (4 Kb/s)
        Latency: 36 msec (26-37 msec ~36 msec)
> ACL Data RX: Handle 684 flags 0x02 dlen 21               #104 [hci1] 8.162147
      SMP: Pairing Confirm (0x03) len 16
        Confim value: d76da52153b21c10b47f2b63638ddaff
< HCI Command: Host Number of Comp.. (0x03|0x0035) plen 5  #105 [hci1] 8.175433
        Num handles: 1
        Handle: 684 Address: DF:A9:FF:F6:B1:1A (OUI DF-A9-FF)
        Count: 1
< ACL Data TX: Handle 684 flags 0x00 dlen 21               #106 [hci1] 8.175641
      SMP: Pairing Random (0x04) len 16
        Random value: 4db8ab2d95badddbdfe2838e9a8cc696
> HCI Event: Number of Completed Packets (0x13) plen 5     #107 [hci1] 8.211882
        Num handles: 1
        Handle: 684 Address: DF:A9:FF:F6:B1:1A (OUI DF-A9-FF)
        Count: 1
        #106: len 21 (4 Kb/s)
        Latency: 36 msec (26-37 msec ~36 msec)
> ACL Data RX: Handle 684 flags 0x02 dlen 21               #108 [hci1] 8.462077
      SMP: Pairing Random (0x04) len 16
        Random value: ddfff902f0d95e2dfa8edd2fc753ca3b
< HCI Command: Host Number of Comp.. (0x03|0x0035) plen 5  #109 [hci1] 8.475586
        Num handles: 1
        Handle: 684 Address: DF:A9:FF:F6:B1:1A (OUI DF-A9-FF)
        Count: 1
< ACL Data TX: Handle 684 flags 0x00 dlen 21               #110 [hci1] 8.475797
      SMP: Pairing Confirm (0x03) len 16
        Confim value: f293a0355e55f35045bdb37b661dec6d
> HCI Event: Number of Completed Packets (0x13) plen 5     #111 [hci1] 8.511961
        Num handles: 1
        Handle: 684 Address: DF:A9:FF:F6:B1:1A (OUI DF-A9-FF)
        Count: 1
        #110: len 21 (4 Kb/s)
        Latency: 36 msec (26-37 msec ~36 msec)
> ACL Data RX: Handle 684 flags 0x02 dlen 21               #112 [hci1] 8.562178
      SMP: Pairing Confirm (0x03) len 16
        Confim value: 85a9e9891e2e9fdc2bf17f247beb0cbf
< HCI Command: Host Number of Comp.. (0x03|0x0035) plen 5  #113 [hci1] 8.575267
        Num handles: 1
        Handle: 684 Address: DF:A9:FF:F6:B1:1A (OUI DF-A9-FF)
        Count: 1
< ACL Data TX: Handle 684 flags 0x00 dlen 21               #114 [hci1] 8.575531
      SMP: Pairing Random (0x04) len 16
        Random value: c850fef72c5ceb9f1915536596b6fc3d
> HCI Event: Number of Completed Packets (0x13) plen 5     #115 [hci1] 8.611979
        Num handles: 1
        Handle: 684 Address: DF:A9:FF:F6:B1:1A (OUI DF-A9-FF)
        Count: 1
        #114: len 21 (4 Kb/s)
        Latency: 36 msec (26-37 msec ~36 msec)
> ACL Data RX: Handle 684 flags 0x02 dlen 21               #116 [hci1] 8.862122
      SMP: Pairing Random (0x04) len 16
        Random value: 52247ec27e652a7a78f9de23eb209366
< HCI Command: Host Number of Comp.. (0x03|0x0035) plen 5  #117 [hci1] 8.875531
        Num handles: 1
        Handle: 684 Address: DF:A9:FF:F6:B1:1A (OUI DF-A9-FF)
        Count: 1
< ACL Data TX: Handle 684 flags 0x00 dlen 21               #118 [hci1] 8.875758
      SMP: Pairing Confirm (0x03) len 16
        Confim value: 8c90a543610ba16b9d50952ce7248be4
> HCI Event: Number of Completed Packets (0x13) plen 5     #119 [hci1] 8.911985
        Num handles: 1
        Handle: 684 Address: DF:A9:FF:F6:B1:1A (OUI DF-A9-FF)
        Count: 1
        #118: len 21 (4 Kb/s)
        Latency: 36 msec (26-37 msec ~36 msec)
> ACL Data RX: Handle 684 flags 0x02 dlen 21               #120 [hci1] 8.962066
      SMP: Pairing Confirm (0x03) len 16
        Confim value: 23b20299dee93bd02ab43a5522783783
< HCI Command: Host Number of Comp.. (0x03|0x0035) plen 5  #121 [hci1] 8.975126
        Num handles: 1
        Handle: 684 Address: DF:A9:FF:F6:B1:1A (OUI DF-A9-FF)
        Count: 1
< ACL Data TX: Handle 684 flags 0x00 dlen 21               #122 [hci1] 8.975237
      SMP: Pairing Random (0x04) len 16
        Random value: 6b2b19701bcf5c794dc9ad9f2c3f295e
> HCI Event: Number of Completed Packets (0x13) plen 5     #123 [hci1] 9.012024
        Num handles: 1
        Handle: 684 Address: DF:A9:FF:F6:B1:1A (OUI DF-A9-FF)
        Count: 1
        #122: len 21 (4 Kb/s)
        Latency: 36 msec (26-37 msec ~36 msec)
> ACL Data RX: Handle 684 flags 0x02 dlen 21               #124 [hci1] 9.262068
      SMP: Pairing Random (0x04) len 16
        Random value: 5a348f98b42913ac585d10a192dce752
< HCI Command: Host Number of Comp.. (0x03|0x0035) plen 5  #125 [hci1] 9.275527
        Num handles: 1
        Handle: 684 Address: DF:A9:FF:F6:B1:1A (OUI DF-A9-FF)
        Count: 1
< ACL Data TX: Handle 684 flags 0x00 dlen 21               #126 [hci1] 9.275745
      SMP: Pairing Confirm (0x03) len 16
        Confim value: 78b963063f16a0e79fe0fd446ce18f1c
> HCI Event: Number of Completed Packets (0x13) plen 5     #127 [hci1] 9.311895
        Num handles: 1
        Handle: 684 Address: DF:A9:FF:F6:B1:1A (OUI DF-A9-FF)
        Count: 1
        #126: len 21 (4 Kb/s)
        Latency: 36 msec (26-37 msec ~36 msec)
> ACL Data RX: Handle 684 flags 0x02 dlen 21               #128 [hci1] 9.362089
      SMP: Pairing Confirm (0x03) len 16
        Confim value: 4e8f66bf50339451c0068ae8982259b0
< HCI Command: Host Number of Comp.. (0x03|0x0035) plen 5  #129 [hci1] 9.375429
        Num handles: 1
        Handle: 684 Address: DF:A9:FF:F6:B1:1A (OUI DF-A9-FF)
        Count: 1
< ACL Data TX: Handle 684 flags 0x00 dlen 21               #130 [hci1] 9.375635
      SMP: Pairing Random (0x04) len 16
        Random value: d5e1c3cfeb215c2fff312cdf99c94919
> HCI Event: Number of Completed Packets (0x13) plen 5     #131 [hci1] 9.411873
        Num handles: 1
        Handle: 684 Address: DF:A9:FF:F6:B1:1A (OUI DF-A9-FF)
        Count: 1
        #130: len 21 (4 Kb/s)
        Latency: 36 msec (26-37 msec ~36 msec)
> ACL Data RX: Handle 684 flags 0x02 dlen 21               #132 [hci1] 9.662082
      SMP: Pairing Random (0x04) len 16
        Random value: 007f128e90266efe8a6c391297e8fb99
< HCI Command: Host Number of Comp.. (0x03|0x0035) plen 5  #133 [hci1] 9.675560
        Num handles: 1
        Handle: 684 Address: DF:A9:FF:F6:B1:1A (OUI DF-A9-FF)
        Count: 1
< ACL Data TX: Handle 684 flags 0x00 dlen 21               #134 [hci1] 9.675779
      SMP: Pairing Confirm (0x03) len 16
        Confim value: 3332b3966732e0d4b0e67c75f56b5c8a
> HCI Event: Number of Completed Packets (0x13) plen 5     #135 [hci1] 9.711830
        Num handles: 1
        Handle: 684 Address: DF:A9:FF:F6:B1:1A (OUI DF-A9-FF)
        Count: 1
        #134: len 21 (4 Kb/s)
        Latency: 36 msec (26-37 msec ~36 msec)
> ACL Data RX: Handle 684 flags 0x02 dlen 21               #136 [hci1] 9.762018
      SMP: Pairing Confirm (0x03) len 16
        Confim value: 7b1efa69856c995bda3a00c1530c73c3
< HCI Command: Host Number of Comp.. (0x03|0x0035) plen 5  #137 [hci1] 9.775416
        Num handles: 1
        Handle: 684 Address: DF:A9:FF:F6:B1:1A (OUI DF-A9-FF)
        Count: 1
< ACL Data TX: Handle 684 flags 0x00 dlen 21               #138 [hci1] 9.775624
      SMP: Pairing Random (0x04) len 16
        Random value: 77355a9a8321c629a3a987d808e80865
> HCI Event: Number of Completed Packets (0x13) plen 5     #139 [hci1] 9.811796
        Num handles: 1
        Handle: 684 Address: DF:A9:FF:F6:B1:1A (OUI DF-A9-FF)
        Count: 1
        #138: len 21 (4 Kb/s)
        Latency: 36 msec (26-37 msec ~36 msec)
> ACL Data RX: Handle 684 flags 0x02 dlen 21              #140 [hci1] 10.062127
      SMP: Pairing Random (0x04) len 16
        Random value: 92952bec4e9dd1e738175f1f19e64313
< HCI Command: Host Number of Com.. (0x03|0x0035) plen 5  #141 [hci1] 10.075233
        Num handles: 1
        Handle: 684 Address: DF:A9:FF:F6:B1:1A (OUI DF-A9-FF)
        Count: 1
< ACL Data TX: Handle 684 flags 0x00 dlen 21              #142 [hci1] 10.075351
      SMP: Pairing Confirm (0x03) len 16
        Confim value: 13ede749a62df584f38ffd089f42704d
> HCI Event: Number of Completed Packets (0x13) plen 5    #143 [hci1] 10.111909
        Num handles: 1
        Handle: 684 Address: DF:A9:FF:F6:B1:1A (OUI DF-A9-FF)
        Count: 1
        #142: len 21 (4 Kb/s)
        Latency: 36 msec (26-37 msec ~36 msec)
> ACL Data RX: Handle 684 flags 0x02 dlen 21              #144 [hci1] 10.162155
      SMP: Pairing Confirm (0x03) len 16
        Confim value: 66a155e3fe2f9c9771e1f73e92e9d840
< HCI Command: Host Number of Com.. (0x03|0x0035) plen 5  #145 [hci1] 10.175363
        Num handles: 1
        Handle: 684 Address: DF:A9:FF:F6:B1:1A (OUI DF-A9-FF)
        Count: 1
< ACL Data TX: Handle 684 flags 0x00 dlen 21              #146 [hci1] 10.175526
      SMP: Pairing Random (0x04) len 16
        Random value: 8dfc1155a0b492f20f6ad8f13724432c
> HCI Event: Number of Completed Packets (0x13) plen 5    #147 [hci1] 10.211859
        Num handles: 1
        Handle: 684 Address: DF:A9:FF:F6:B1:1A (OUI DF-A9-FF)
        Count: 1
        #146: len 21 (4 Kb/s)
        Latency: 36 msec (26-37 msec ~36 msec)
> ACL Data RX: Handle 684 flags 0x02 dlen 21              #148 [hci1] 10.461988
      SMP: Pairing Random (0x04) len 16
        Random value: 9d49403c6c0e1122d18ec5b173b676db
< HCI Command: Host Number of Com.. (0x03|0x0035) plen 5  #149 [hci1] 10.475102
        Num handles: 1
        Handle: 684 Address: DF:A9:FF:F6:B1:1A (OUI DF-A9-FF)
        Count: 1
< ACL Data TX: Handle 684 flags 0x00 dlen 21              #150 [hci1] 10.475227
      SMP: Pairing Confirm (0x03) len 16
        Confim value: 5208c7a864083657dd17810ab2f06325
> HCI Event: Number of Completed Packets (0x13) plen 5    #151 [hci1] 10.511857
        Num handles: 1
        Handle: 684 Address: DF:A9:FF:F6:B1:1A (OUI DF-A9-FF)
        Count: 1
        #150: len 21 (4 Kb/s)
        Latency: 36 msec (26-37 msec ~36 msec)
> ACL Data RX: Handle 684 flags 0x02 dlen 21              #152 [hci1] 10.562051
      SMP: Pairing Confirm (0x03) len 16
        Confim value: 09cb4ed8f5d4c4902619219693f539af
< HCI Command: Host Number of Com.. (0x03|0x0035) plen 5  #153 [hci1] 10.575258
        Num handles: 1
        Handle: 684 Address: DF:A9:FF:F6:B1:1A (OUI DF-A9-FF)
        Count: 1
< ACL Data TX: Handle 684 flags 0x00 dlen 21              #154 [hci1] 10.575562
      SMP: Pairing Random (0x04) len 16
        Random value: 001c45ff744123ac32ebbb5e14c8a6b9
> HCI Event: Number of Completed Packets (0x13) plen 5    #155 [hci1] 10.611808
        Num handles: 1
        Handle: 684 Address: DF:A9:FF:F6:B1:1A (OUI DF-A9-FF)
        Count: 1
        #154: len 21 (4 Kb/s)
        Latency: 36 msec (26-37 msec ~36 msec)
> ACL Data RX: Handle 684 flags 0x02 dlen 21              #156 [hci1] 10.862016
      SMP: Pairing Random (0x04) len 16
        Random value: edabf646a73c41a80143f2f144798748
< HCI Command: Host Number of Com.. (0x03|0x0035) plen 5  #157 [hci1] 10.875524
        Num handles: 1
        Handle: 684 Address: DF:A9:FF:F6:B1:1A (OUI DF-A9-FF)
        Count: 1
< ACL Data TX: Handle 684 flags 0x00 dlen 21              #158 [hci1] 10.875749
      SMP: Pairing Confirm (0x03) len 16
        Confim value: 4678f0df11460b6eb043d9c43bbf7043
> HCI Event: Number of Completed Packets (0x13) plen 5    #159 [hci1] 10.911799
        Num handles: 1
        Handle: 684 Address: DF:A9:FF:F6:B1:1A (OUI DF-A9-FF)
        Count: 1
        #158: len 21 (4 Kb/s)
        Latency: 36 msec (26-37 msec ~36 msec)
> ACL Data RX: Handle 684 flags 0x02 dlen 21              #160 [hci1] 10.962123
      SMP: Pairing Confirm (0x03) len 16
        Confim value: 0f1e9a8928e5bd3f851d5977dce044ca
< HCI Command: Host Number of Com.. (0x03|0x0035) plen 5  #161 [hci1] 10.975248
        Num handles: 1
        Handle: 684 Address: DF:A9:FF:F6:B1:1A (OUI DF-A9-FF)
        Count: 1
< ACL Data TX: Handle 684 flags 0x00 dlen 21              #162 [hci1] 10.975395
      SMP: Pairing Random (0x04) len 16
        Random value: 296d277ff3bf297efe85e67448a15f56
> HCI Event: Number of Completed Packets (0x13) plen 5    #163 [hci1] 11.011952
        Num handles: 1
        Handle: 684 Address: DF:A9:FF:F6:B1:1A (OUI DF-A9-FF)
        Count: 1
        #162: len 21 (4 Kb/s)
        Latency: 36 msec (26-37 msec ~36 msec)
> ACL Data RX: Handle 684 flags 0x02 dlen 21              #164 [hci1] 11.262232
      SMP: Pairing Random (0x04) len 16
        Random value: 910c3214fb26b8b0b5e6aa476791acf3
< HCI Command: Host Number of Com.. (0x03|0x0035) plen 5  #165 [hci1] 11.275572
        Num handles: 1
        Handle: 684 Address: DF:A9:FF:F6:B1:1A (OUI DF-A9-FF)
        Count: 1
< ACL Data TX: Handle 684 flags 0x00 dlen 21              #166 [hci1] 11.275775
      SMP: Pairing Confirm (0x03) len 16
        Confim value: d4401b5d6b4c41144e48d7e9e281c415
> HCI Event: Number of Completed Packets (0x13) plen 5    #167 [hci1] 11.311942
        Num handles: 1
        Handle: 684 Address: DF:A9:FF:F6:B1:1A (OUI DF-A9-FF)
        Count: 1
        #166: len 21 (4 Kb/s)
        Latency: 36 msec (26-37 msec ~36 msec)
> ACL Data RX: Handle 684 flags 0x02 dlen 21              #168 [hci1] 11.362094
      SMP: Pairing Confirm (0x03) len 16
        Confim value: be87fbc29e65e2107065feacbe981959
< HCI Command: Host Number of Com.. (0x03|0x0035) plen 5  #169 [hci1] 11.375308
        Num handles: 1
        Handle: 684 Address: DF:A9:FF:F6:B1:1A (OUI DF-A9-FF)
        Count: 1
< ACL Data TX: Handle 684 flags 0x00 dlen 21              #170 [hci1] 11.375399
      SMP: Pairing Random (0x04) len 16
        Random value: e3a3cf1d832325a9493fd3ce4faf02be
> HCI Event: Number of Completed Packets (0x13) plen 5    #171 [hci1] 11.411857
        Num handles: 1
        Handle: 684 Address: DF:A9:FF:F6:B1:1A (OUI DF-A9-FF)
        Count: 1
        #170: len 21 (4 Kb/s)
        Latency: 36 msec (26-37 msec ~36 msec)
> ACL Data RX: Handle 684 flags 0x02 dlen 21              #172 [hci1] 11.662042
      SMP: Pairing Random (0x04) len 16
        Random value: d4fd18eea50e0bb51b69f25efb9d5ab7
< HCI Command: Host Number of Com.. (0x03|0x0035) plen 5  #173 [hci1] 11.675507
        Num handles: 1
        Handle: 684 Address: DF:A9:FF:F6:B1:1A (OUI DF-A9-FF)
        Count: 1
< ACL Data TX: Handle 684 flags 0x00 dlen 21              #174 [hci1] 11.675765
      SMP: Pairing Confirm (0x03) len 16
        Confim value: efa25c848a3edd6c44082b32ed914543
> HCI Event: Number of Completed Packets (0x13) plen 5    #175 [hci1] 11.711786
        Num handles: 1
        Handle: 684 Address: DF:A9:FF:F6:B1:1A (OUI DF-A9-FF)
        Count: 1
        #174: len 21 (4 Kb/s)
        Latency: 36 msec (26-37 msec ~36 msec)
> ACL Data RX: Handle 684 flags 0x02 dlen 21              #176 [hci1] 11.762059
      SMP: Pairing Confirm (0x03) len 16
        Confim value: e83d913cdf96b93eb080ec65c7ff7367
< HCI Command: Host Number of Com.. (0x03|0x0035) plen 5  #177 [hci1] 11.775423
        Num handles: 1
        Handle: 684 Address: DF:A9:FF:F6:B1:1A (OUI DF-A9-FF)
        Count: 1
< ACL Data TX: Handle 684 flags 0x00 dlen 21              #178 [hci1] 11.775598
      SMP: Pairing Random (0x04) len 16
        Random value: 595bb7c6e45c58f6b41f855a6f6c3560
> HCI Event: Number of Completed Packets (0x13) plen 5    #179 [hci1] 11.811835
        Num handles: 1
        Handle: 684 Address: DF:A9:FF:F6:B1:1A (OUI DF-A9-FF)
        Count: 1
        #178: len 21 (4 Kb/s)
        Latency: 36 msec (26-37 msec ~36 msec)
> ACL Data RX: Handle 684 flags 0x02 dlen 21              #180 [hci1] 12.062115
      SMP: Pairing Random (0x04) len 16
        Random value: 434f0d5d23750d6e9ffd101e5b8146ab
< HCI Command: Host Number of Com.. (0x03|0x0035) plen 5  #181 [hci1] 12.075219
        Num handles: 1
        Handle: 684 Address: DF:A9:FF:F6:B1:1A (OUI DF-A9-FF)
        Count: 1
< ACL Data TX: Handle 684 flags 0x00 dlen 21              #182 [hci1] 12.075318
      SMP: Pairing Confirm (0x03) len 16
        Confim value: ac15e9f4b60a046e1ebbf8e046679e99
> HCI Event: Number of Completed Packets (0x13) plen 5    #183 [hci1] 12.111796
        Num handles: 1
        Handle: 684 Address: DF:A9:FF:F6:B1:1A (OUI DF-A9-FF)
        Count: 1
        #182: len 21 (4 Kb/s)
        Latency: 36 msec (26-37 msec ~36 msec)
> ACL Data RX: Handle 684 flags 0x02 dlen 21              #184 [hci1] 12.162065
      SMP: Pairing Confirm (0x03) len 16
        Confim value: 87603f251579e30e0e2c9015a7301244
< HCI Command: Host Number of Com.. (0x03|0x0035) plen 5  #185 [hci1] 12.175447
        Num handles: 1
        Handle: 684 Address: DF:A9:FF:F6:B1:1A (OUI DF-A9-FF)
        Count: 1
< ACL Data TX: Handle 684 flags 0x00 dlen 21              #186 [hci1] 12.175666
      SMP: Pairing Random (0x04) len 16
        Random value: 84e2affc6847b67e7216d5bf664139ed
> HCI Event: Number of Completed Packets (0x13) plen 5    #187 [hci1] 12.211815
        Num handles: 1
        Handle: 684 Address: DF:A9:FF:F6:B1:1A (OUI DF-A9-FF)
        Count: 1
        #186: len 21 (4 Kb/s)
        Latency: 36 msec (26-37 msec ~36 msec)
> ACL Data RX: Handle 684 flags 0x02 dlen 21              #188 [hci1] 12.461918
      SMP: Pairing Random (0x04) len 16
        Random value: ad14b82b311bd6d6ee1287af265b6529
< HCI Command: Host Number of Com.. (0x03|0x0035) plen 5  #189 [hci1] 12.475541
        Num handles: 1
        Handle: 684 Address: DF:A9:FF:F6:B1:1A (OUI DF-A9-FF)
        Count: 1
< ACL Data TX: Handle 684 flags 0x00 dlen 21              #190 [hci1] 12.475738
      SMP: Pairing Confirm (0x03) len 16
        Confim value: 99cd06d886e07215d89894edcb5d09f3
> HCI Event: Number of Completed Packets (0x13) plen 5    #191 [hci1] 12.511920
        Num handles: 1
        Handle: 684 Address: DF:A9:FF:F6:B1:1A (OUI DF-A9-FF)
        Count: 1
        #190: len 21 (4 Kb/s)
        Latency: 36 msec (26-37 msec ~36 msec)
> ACL Data RX: Handle 684 flags 0x02 dlen 21              #192 [hci1] 12.561976
      SMP: Pairing Confirm (0x03) len 16
        Confim value: 11a1eefb8adb6695000d0e0905c3b63e
< HCI Command: Host Number of Com.. (0x03|0x0035) plen 5  #193 [hci1] 12.575281
        Num handles: 1
        Handle: 684 Address: DF:A9:FF:F6:B1:1A (OUI DF-A9-FF)
        Count: 1
< ACL Data TX: Handle 684 flags 0x00 dlen 21              #194 [hci1] 12.575507
      SMP: Pairing Random (0x04) len 16
        Random value: 425496665d7eed17f76500c95219dd01
> HCI Event: Number of Completed Packets (0x13) plen 5    #195 [hci1] 12.611783
        Num handles: 1
        Handle: 684 Address: DF:A9:FF:F6:B1:1A (OUI DF-A9-FF)
        Count: 1
        #194: len 21 (4 Kb/s)
        Latency: 36 msec (26-37 msec ~36 msec)
> ACL Data RX: Handle 684 flags 0x02 dlen 21              #196 [hci1] 12.862070
      SMP: Pairing Random (0x04) len 16
        Random value: 1d9bfc61cd03b826f5591e7c378eecc9
< HCI Command: Host Number of Com.. (0x03|0x0035) plen 5  #197 [hci1] 12.875590
        Num handles: 1
        Handle: 684 Address: DF:A9:FF:F6:B1:1A (OUI DF-A9-FF)
        Count: 1
< ACL Data TX: Handle 684 flags 0x00 dlen 21              #198 [hci1] 12.875828
      SMP: Pairing Confirm (0x03) len 16
        Confim value: 2509c20d9e133108914186c48a8cb82e
> HCI Event: Number of Completed Packets (0x13) plen 5    #199 [hci1] 12.911764
        Num handles: 1
        Handle: 684 Address: DF:A9:FF:F6:B1:1A (OUI DF-A9-FF)
        Count: 1
        #198: len 21 (4 Kb/s)
        Latency: 35 msec (26-37 msec ~36 msec)
> ACL Data RX: Handle 684 flags 0x02 dlen 21              #200 [hci1] 12.961953
      SMP: Pairing Confirm (0x03) len 16
        Confim value: b9664cfa75f4810884fc20f37618916e
< HCI Command: Host Number of Com.. (0x03|0x0035) plen 5  #201 [hci1] 12.975422
        Num handles: 1
        Handle: 684 Address: DF:A9:FF:F6:B1:1A (OUI DF-A9-FF)
        Count: 1
< ACL Data TX: Handle 684 flags 0x00 dlen 21              #202 [hci1] 12.975703
      SMP: Pairing Random (0x04) len 16
        Random value: 1e63f87b860481d35d47e1f6006d79c9
> HCI Event: Number of Completed Packets (0x13) plen 5    #203 [hci1] 13.011775
        Num handles: 1
        Handle: 684 Address: DF:A9:FF:F6:B1:1A (OUI DF-A9-FF)
        Count: 1
        #202: len 21 (4 Kb/s)
        Latency: 36 msec (26-37 msec ~36 msec)
> ACL Data RX: Handle 684 flags 0x02 dlen 21              #204 [hci1] 13.262067
      SMP: Pairing Random (0x04) len 16
        Random value: e176fe47346c4ad5e2c5d82dadba5065
< HCI Command: Host Number of Com.. (0x03|0x0035) plen 5  #205 [hci1] 13.275551
        Num handles: 1
        Handle: 684 Address: DF:A9:FF:F6:B1:1A (OUI DF-A9-FF)
        Count: 1
< ACL Data TX: Handle 684 flags 0x00 dlen 21              #206 [hci1] 13.275799
      SMP: Pairing Confirm (0x03) len 16
        Confim value: 70ea04893ab6bbd70e70ba01b8750c86
> HCI Event: Number of Completed Packets (0x13) plen 5    #207 [hci1] 13.311760
        Num handles: 1
        Handle: 684 Address: DF:A9:FF:F6:B1:1A (OUI DF-A9-FF)
        Count: 1
        #206: len 21 (4 Kb/s)
        Latency: 35 msec (26-37 msec ~36 msec)
> ACL Data RX: Handle 684 flags 0x02 dlen 21              #208 [hci1] 13.361996
      SMP: Pairing Confirm (0x03) len 16
        Confim value: 5a2db056fd63a23e506ef6763e01c39b
< HCI Command: Host Number of Com.. (0x03|0x0035) plen 5  #209 [hci1] 13.375365
        Num handles: 1
        Handle: 684 Address: DF:A9:FF:F6:B1:1A (OUI DF-A9-FF)
        Count: 1
< ACL Data TX: Handle 684 flags 0x00 dlen 21              #210 [hci1] 13.375607
      SMP: Pairing Random (0x04) len 16
        Random value: 9d9e1ee31049e7f7e0c2476823e41736
> HCI Event: Number of Completed Packets (0x13) plen 5    #211 [hci1] 13.411808
        Num handles: 1
        Handle: 684 Address: DF:A9:FF:F6:B1:1A (OUI DF-A9-FF)
        Count: 1
        #210: len 21 (4 Kb/s)
        Latency: 36 msec (26-37 msec ~36 msec)
> ACL Data RX: Handle 684 flags 0x02 dlen 21              #212 [hci1] 13.661972
      SMP: Pairing Random (0x04) len 16
        Random value: 86772566e2d8619e2084fcaae3c14516
< HCI Command: Host Number of Com.. (0x03|0x0035) plen 5  #213 [hci1] 13.675268
        Num handles: 1
        Handle: 684 Address: DF:A9:FF:F6:B1:1A (OUI DF-A9-FF)
        Count: 1
< ACL Data TX: Handle 684 flags 0x00 dlen 21              #214 [hci1] 13.675409
      SMP: Pairing Confirm (0x03) len 16
        Confim value: 5b51d1a912b7c8b6ad7bb1d6e0116a98
> HCI Event: Number of Completed Packets (0x13) plen 5    #215 [hci1] 13.711775
        Num handles: 1
        Handle: 684 Address: DF:A9:FF:F6:B1:1A (OUI DF-A9-FF)
        Count: 1
        #214: len 21 (4 Kb/s)
        Latency: 36 msec (26-37 msec ~36 msec)
> ACL Data RX: Handle 684 flags 0x02 dlen 21              #216 [hci1] 13.762010
      SMP: Pairing Confirm (0x03) len 16
        Confim value: 8635bb384db30e2ae05f94f1f339a827
< HCI Command: Host Number of Com.. (0x03|0x0035) plen 5  #217 [hci1] 13.775453
        Num handles: 1
        Handle: 684 Address: DF:A9:FF:F6:B1:1A (OUI DF-A9-FF)
        Count: 1
< ACL Data TX: Handle 684 flags 0x00 dlen 21              #218 [hci1] 13.775722
      SMP: Pairing Random (0x04) len 16
        Random value: 81bafb7c3fcffc8b40d9b0b09bc4296b
> HCI Event: Number of Completed Packets (0x13) plen 5    #219 [hci1] 13.811854
        Num handles: 1
        Handle: 684 Address: DF:A9:FF:F6:B1:1A (OUI DF-A9-FF)
        Count: 1
        #218: len 21 (4 Kb/s)
        Latency: 36 msec (26-37 msec ~36 msec)
> ACL Data RX: Handle 684 flags 0x02 dlen 21              #220 [hci1] 14.061963
      SMP: Pairing Random (0x04) len 16
        Random value: d9ad1388940810795f0a0e1d78c3c235
< HCI Command: Host Number of Com.. (0x03|0x0035) plen 5  #221 [hci1] 14.075460
        Num handles: 1
        Handle: 684 Address: DF:A9:FF:F6:B1:1A (OUI DF-A9-FF)
        Count: 1
< ACL Data TX: Handle 684 flags 0x00 dlen 21              #222 [hci1] 14.075614
      SMP: Pairing DHKey Check (0x0d) len 16
        E: 6b33d81e2c8f7452d3690ab49a05ef68
> HCI Event: Number of Completed Packets (0x13) plen 5    #223 [hci1] 14.111829
        Num handles: 1
        Handle: 684 Address: DF:A9:FF:F6:B1:1A (OUI DF-A9-FF)
        Count: 1
        #222: len 21 (4 Kb/s)
        Latency: 36 msec (26-37 msec ~36 msec)
> ACL Data RX: Handle 684 flags 0x02 dlen 21              #224 [hci1] 14.161967
      SMP: Pairing DHKey Check (0x0d) len 16
        E: 72aaa715b8455c1eb220b434fc789490
< HCI Command: LE Start Encryption (0x08|0x0019) plen 28  #225 [hci1] 14.175261
        Handle: 684 Address: DF:A9:FF:F6:B1:1A (OUI DF-A9-FF)
        Random number: 0x0000000000000000
        Encrypted diversifier: 0x0000
        Long term key: fbf5a11b98b92ebef68b25e10038941c
> HCI Event: Command Status (0x0f) plen 4                 #226 [hci1] 14.176141
      LE Start Encryption (0x08|0x0019) ncmd 1
        Status: Success (0x00)
< HCI Command: Host Number of Com.. (0x03|0x0035) plen 5  #227 [hci1] 14.195019
        Num handles: 1
        Handle: 684 Address: DF:A9:FF:F6:B1:1A (OUI DF-A9-FF)
        Count: 1
> HCI Event: Encryption Change (0x08) plen 4              #228 [hci1] 14.511738
        Status: Success (0x00)
        Handle: 684 Address: DF:A9:FF:F6:B1:1A (OUI DF-A9-FF)
        Encryption: Enabled with AES-CCM (0x01)
< HCI Command: Disconnect (0x01|0x0006) plen 3            #229 [hci1] 15.114985
        Handle: 684 Address: DF:A9:FF:F6:B1:1A (OUI DF-A9-FF)
        Reason: Remote User Terminated Connection (0x13)
> HCI Event: Command Status (0x0f) plen 4                 #230 [hci1] 15.115563
      Disconnect (0x01|0x0006) ncmd 1
        Status: Success (0x00)
