Bluetooth monitor ver 5.84
btmon[1666350]: = Note: Linux version 6.8.0-83-generic (x86_64)                                                          0.937495
btmon[1666350]: = Note: Bluetooth subsystem version 2.22                                                                 0.937497
= New Index: 00:00:00:00:00:00 (Primary,UART,hci0)                                                                       0.937498
= Open Index: 00:00:00:00:00:00                                                                                          0.941723
= Index Info: 00:00:00:00:00:00 (Nordic Semiconductor ASA)                                                               0.941852
zephyr.exe[1666352]: @ USER Open: main (privileged) version 2.22                                                {0x0001} 0.941890
zephyr.exe[1666352]: < HCI Command: Reset (0x03|0x0003) plen 0                                                        #1 0.942526
> HCI Event: Command Complete (0x0e) plen 4                                                                           #2 0.943343
      Reset (0x03|0x0003) ncmd 1
        Status: Success (0x00)
zephyr.exe[1666352]: < HCI Command: Read Local Supported Features (0x04|0x0003) plen 0                                #3 0.961773
> HCI Event: Command Complete (0x0e) plen 12                                                                          #4 0.962753
      Read Local Supported Features (0x04|0x0003) ncmd 1
        Status: Success (0x00)
        Features: 0x00 0x00 0x00 0x00 0x60 0x00 0x00 0x00
          BR/EDR Not Supported
          LE Supported (Controller)
zephyr.exe[1666352]: < HCI Command: Read Local Version Information (0x04|0x0001) plen 0                               #5 0.981766
> HCI Event: Command Complete (0x0e) plen 12                                                                          #6 0.982926
      Read Local Version Information (0x04|0x0001) ncmd 1
        Status: Success (0x00)
        HCI version: Reserved (0x0e) - Revision 12520 (0x30e8)
        LMP version: Reserved (0x0e) - Subversion 12520 (0x30e8)
        Manufacturer: Nordic Semiconductor ASA (89)
zephyr.exe[1666352]: < HCI Command: Read Local Supported Commands (0x04|0x0002) plen 0                                #7 1.001716
> HCI Event: Command Complete (0x0e) plen 68                                                                          #8 1.003334
      Read Local Supported Commands (0x04|0x0002) ncmd 1
        Status: Success (0x00)
        Commands: 119 entries
          Disconnect (Octet 0 - Bit 5)
          Read Remote Version Information (Octet 2 - Bit 7)
          Set Event Mask (Octet 5 - Bit 6)
          Reset (Octet 5 - Bit 7)
          Read Connection Accept Timeout (Octet 7 - Bit 2)
          Write Connection Accept Timeout (Octet 7 - Bit 3)
          Read Transmit Power Level (Octet 10 - Bit 2)
          Set Controller To Host Flow Control (Octet 10 - Bit 5)
          Host Buffer Size (Octet 10 - Bit 6)
          Host Number of Completed Packets (Octet 10 - Bit 7)
          Read Local Version Information (Octet 14 - Bit 3)
          Read Local Supported Features (Octet 14 - Bit 5)
          Read BD ADDR (Octet 15 - Bit 1)
          Read RSSI (Octet 15 - Bit 5)
          Set Event Mask Page 2 (Octet 22 - Bit 2)
          LE Set Event Mask (Octet 25 - Bit 0)
          LE Read Buffer Size (Octet 25 - Bit 1)
          LE Read Local Supported Features (Octet 25 - Bit 2)
          LE Set Random Address (Octet 25 - Bit 4)
          LE Set Advertising Parameters (Octet 25 - Bit 5)
          LE Read Advertising Channel TX Power (Octet 25 - Bit 6)
          LE Set Advertising Data (Octet 25 - Bit 7)
          LE Set Scan Response Data (Octet 26 - Bit 0)
          LE Set Advertise Enable (Octet 26 - Bit 1)
          LE Set Scan Parameters (Octet 26 - Bit 2)
          LE Set Scan Enable (Octet 26 - Bit 3)
          LE Create Connection (Octet 26 - Bit 4)
          LE Create Connection Cancel (Octet 26 - Bit 5)
          LE Read Accept List Size (Octet 26 - Bit 6)
          LE Clear Accept List (Octet 26 - Bit 7)
          LE Add Device To Accept List (Octet 27 - Bit 0)
          LE Remove Device From Accept List (Octet 27 - Bit 1)
          LE Connection Update (Octet 27 - Bit 2)
          LE Set Host Channel Classification (Octet 27 - Bit 3)
          LE Read Channel Map (Octet 27 - Bit 4)
          LE Read Remote Used Features (Octet 27 - Bit 5)
          LE Encrypt (Octet 27 - Bit 6)
          LE Rand (Octet 27 - Bit 7)
          LE Start Encryption (Octet 28 - Bit 0)
          LE Long Term Key Request Reply (Octet 28 - Bit 1)
          LE Long Term Key Request Neg Reply (Octet 28 - Bit 2)
          LE Read Supported States (Octet 28 - Bit 3)
          LE Receiver Test (Octet 28 - Bit 4)
          LE Transmitter Test (Octet 28 - Bit 5)
          LE Test End (Octet 28 - Bit 6)
          Read Authenticated Payload Timeout (Octet 32 - Bit 4)
          Write Authenticated Payload Timeout (Octet 32 - Bit 5)
          LE Set Data Length (Octet 33 - Bit 6)
          LE Read Suggested Default Data Length (Octet 33 - Bit 7)
          LE Write Suggested Default Data Length (Octet 34 - Bit 0)
          LE Add Device To Resolving List (Octet 34 - Bit 3)
          LE Remove Device From Resolving List (Octet 34 - Bit 4)
          LE Clear Resolving List (Octet 34 - Bit 5)
          LE Read Resolving List Size (Octet 34 - Bit 6)
          LE Set Address Resolution Enable (Octet 35 - Bit 1)
          LE Set Resolvable Private Address Timeout (Octet 35 - Bit 2)
          LE Read Maximum Data Length (Octet 35 - Bit 3)
          LE Read PHY (Octet 35 - Bit 4)
          LE Set Default PHY (Octet 35 - Bit 5)
          LE Set PHY (Octet 35 - Bit 6)
          LE Enhanced Receiver Test (Octet 35 - Bit 7)
          LE Enhanced Transmitter Test (Octet 36 - Bit 0)
          LE Set Advertising Set Random Address (Octet 36 - Bit 1)
          LE Set Extended Advertising Parameters (Octet 36 - Bit 2)
          LE Set Extended Advertising Data (Octet 36 - Bit 3)
          LE Set Extended Scan Response Data (Octet 36 - Bit 4)
          LE Set Extended Advertising Enable (Octet 36 - Bit 5)
          LE Read Maximum Advertising Data Length (Octet 36 - Bit 6)
          LE Read Number of Supported Advertising Sets (Octet 36 - Bit 7)
          LE Remove Advertising Set (Octet 37 - Bit 0)
          LE Clear Advertising Sets (Octet 37 - Bit 1)
          LE Set Periodic Advertising Parameters (Octet 37 - Bit 2)
          LE Set Periodic Advertising Data (Octet 37 - Bit 3)
          LE Set Periodic Advertising Enable (Octet 37 - Bit 4)
          LE Set Extended Scan Parameters (Octet 37 - Bit 5)
          LE Set Extended Scan Enable (Octet 37 - Bit 6)
          LE Extended Create Connection (Octet 37 - Bit 7)
          LE Periodic Advertising Create Sync (Octet 38 - Bit 0)
          LE Periodic Advertising Create Sync Cancel (Octet 38 - Bit 1)
          LE Periodic Advertising Terminate Sync (Octet 38 - Bit 2)
          LE Add Device To Periodic Advertiser List (Octet 38 - Bit 3)
          LE Remove Device From Periodic Advertiser List (Octet 38 - Bit 4)
          LE Clear Periodic Advertiser List (Octet 38 - Bit 5)
          LE Read Periodic Advertiser List Size (Octet 38 - Bit 6)
          LE Read Transmit Power (Octet 38 - Bit 7)
          LE Read RF Path Compensation (Octet 39 - Bit 0)
          LE Write RF Path Compensation (Octet 39 - Bit 1)
          LE Set Privacy Mode (Octet 39 - Bit 2)
          LE Periodic Advertising Receive Enable (Octet 40 - Bit 5)
          LE Periodic Advertising Sync Transfer (Octet 40 - Bit 6)
          LE Periodic Advertising Set Info Transfer (Octet 40 - Bit 7)
          LE Periodic Advertising Sync Transfer Parameters (Octet 41 - Bit 0)
          LE Set Default Periodic Advertisng Sync Transfer Parameters (Octet 41 - Bit 1)
          LE Read Buffer v2 (Octet 41 - Bit 5)
          LE Read ISO TX Sync (Octet 41 - Bit 6)
          LE Set Connected Isochronous Group Parameters (Octet 41 - Bit 7)
          LE Set Connected Isochronous Group Parameters Test (Octet 42 - Bit 0)
          LE Create Connected Isochronous Stream (Octet 42 - Bit 1)
          LE Remove Connected Isochronous Group (Octet 42 - Bit 2)
          LE Accept Connected Isochronous Stream Request (Octet 42 - Bit 3)
          LE Reject Connected Isochronous Stream Request (Octet 42 - Bit 4)
          LE Create Broadcast Isochronous Group (Octet 42 - Bit 5)
          LE Create Broadcast Isochronous Group Test (Octet 42 - Bit 6)
          LE Terminate Broadcast Isochronous Group (Octet 42 - Bit 7)
          LE Broadcast Isochronous Group Create Sync (Octet 43 - Bit 0)
          LE Broadcast Isochronous Group Terminate Sync (Octet 43 - Bit 1)
          LE Request Peer SCA (Octet 43 - Bit 2)
          LE Setup Isochronous Data Path (Octet 43 - Bit 3)
          LE Remove Isochronous Data Path (Octet 43 - Bit 4)
          LE Isochronous Transmit Test (Octet 43 - Bit 5)
          LE Isochronous Receive Test (Octet 43 - Bit 6)
          LE Isochronous Read Test Counters (Octet 43 - Bit 7)
          LE Isochronous Read Test Counters (Octet 44 - Bit 0)
          LE Set Host Feature (Octet 44 - Bit 1)
          LE Read ISO link quality (Octet 44 - Bit 2)
          Octet 45 - Bit 6 
          Octet 46 - Bit 0 
          Octet 46 - Bit 1 
          Octet 46 - Bit 2 
zephyr.exe[1666352]: < HCI Command: Host Buffer Size (0x03|0x0033) plen 7                                             #9 1.021774
        ACL MTU: 255  ACL max packet: 16
        SCO MTU: 0    SCO max packet: 0
> HCI Event: Command Complete (0x0e) plen 4                                                                          #10 1.022505
      Host Buffer Size (0x03|0x0033) ncmd 1
        Status: Success (0x00)
zephyr.exe[1666352]: < HCI Command: Set Controller To Host Flow Control (0x03|0x0031) plen 1                         #11 1.041770
        Flow control: ACL Data Packets (0x01)
> HCI Event: Command Complete (0x0e) plen 4                                                                          #12 1.042538
      Set Controller To Host Flow Control (0x03|0x0031) ncmd 1
        Status: Success (0x00)
zephyr.exe[1666352]: < HCI Command: LE Read Local Supported Features (0x08|0x0003) plen 0                            #13 1.061772
> HCI Event: Command Complete (0x0e) plen 12                                                                         #14 1.062535
      LE Read Local Supported Features (0x08|0x0003) ncmd 1
        Status: Success (0x00)
        Features: 0xfd 0x79 0x00 0xf7 0x30 0x01 0x00 0x00
          LE Encryption
          Extended Reject Indication
          Peripheral-initiated Features Exchange
          LE Ping
          LE Data Packet Length Extension
          LL Privacy
          Extended Scanner Filter Policies
          LE 2M PHY
          LE Coded PHY
          LE Extended Advertising
          LE Periodic Advertising
          Channel Selection Algorithm #2
          Periodic Advertising Sync Transfer - Sender
          Periodic Advertising Sync Transfer - Recipient
          Sleep Clock Accuracy Updates
          Connected Isochronous Stream - Central
          Connected Isochronous Stream - Peripheral
          Isochronous Broadcaster
          Synchronized Receiver
          Periodic Advertising ADI support
          Connection Subrating
          Unknown features (0x0000010000000000)
zephyr.exe[1666352]: < HCI Command: LE Set Host Feature (0x08|0x0074) plen 2                                         #15 1.081770
        Bit Number: 32
          Connected Isochronous Stream (Host Support)
        Bit Value: 1
> HCI Event: Command Complete (0x0e) plen 4                                                                          #16 1.082519
      LE Set Host Feature (0x08|0x0074) ncmd 1
        Status: Success (0x00)
zephyr.exe[1666352]: < HCI Command: LE Read Buffer v2 (0x08|0x0060) plen 0                                           #17 1.101683
> HCI Event: Command Complete (0x0e) plen 10                                                                         #18 1.102478
      LE Read Buffer v2 (0x08|0x0060) ncmd 1
        Status: Success (0x00)
        ACL MTU: 27
        ACL max packet: 3
        ISO MTU: 318
        ISO max packet: 3
zephyr.exe[1666352]: < HCI Command: LE Read Maximum Advertising Data Length (0x08|0x003a) plen 0                     #19 1.121761
> HCI Event: Command Complete (0x0e) plen 6                                                                          #20 1.122531
      LE Read Maximum Advertising Data Length (0x08|0x003a) ncmd 1
        Status: Success (0x00)
        Max length: 1650
zephyr.exe[1666352]: < HCI Command: LE Read Supported States (0x08|0x001c) plen 0                                    #21 1.141784
> HCI Event: Command Complete (0x0e) plen 12                                                                         #22 1.143467
      LE Read Supported States (0x08|0x001c) ncmd 1
        Status: Success (0x00)
        States: 0x000003ff3e0306ff
          Non-connectable Advertising State
          Scannable Advertising State
          Connectable Advertising State
          High Duty Cycle Directed Advertising State
          Passive Scanning State
          Active Scanning State
          Initiating State
            and Connection State (Central Role)
          Connection State (Peripheral Role)
          Scannable Advertising State
            and Passive Scanning State
          Connectable Advertising State
            and Passive Scanning State
          Non-connectable Advertising State
            and Initiating State
          Scannable Advertising State
            and Initiating State
          Active Scanning State
            and Connection State (Central Role)
          Passive Scanning State
            and Connection State (Peripheral Role)
          Active Scanning State
            and Connection State (Peripheral Role)
          Initiating State
            and Connection State (Central Role)
            and Central Role & Central Role
          Low Duty Cycle Directed Advertising State
          Connectable Advertising State
            and Initiating State
            and Central Role & Peripheral Role
          High Duty Cycle Directed Advertising State
            and Initiating State
            and Central Role & Peripheral Role
          Low Duty Cycle Directed Advertising State
            and Initiating State
            and Central Role & Peripheral Role
          Connectable Advertising State
            and Connection State (Central Role)
            and Central Role & Peripheral Role
          High Duty Cycle Directed Advertising State
            and Connection State (Central Role)
            and Central Role & Peripheral Role
          Low Duty Cycle Directed Advertising State
            and Connection State (Central Role)
            and Central Role & Peripheral Role
          Connectable Advertising State
            and Connection State (Peripheral Role)
            and Central Role & Peripheral Role
          High Duty Cycle Directed Advertising State
            and Connection State (Peripheral Role)
            and Peripheral Role & Peripheral Role
          Low Duty Cycle Directed Advertising State
            and Connection State (Peripheral Role)
            and Peripheral Role & Peripheral Role
          Initiating State
            and Connection State (Peripheral Role)
            and Central Role & Peripheral Role
zephyr.exe[1666352]: < HCI Command: LE Read Maximum Data Length (0x08|0x002f) plen 0                                 #23 1.161764
> HCI Event: Command Complete (0x0e) plen 12                                                                         #24 1.163215
      LE Read Maximum Data Length (0x08|0x002f) ncmd 1
        Status: Success (0x00)
        Max TX octets: 251
        Max TX time: 2704
        Max RX octets: 251
        Max RX time: 2704
zephyr.exe[1666352]: < HCI Command: LE Write Suggested Default Data Length (0x08|0x0024) plen 4                      #25 1.181768
        TX octets: 251
        TX time: 2704
> HCI Event: Command Complete (0x0e) plen 4                                                                          #26 1.182888
      LE Write Suggested Default Data Length (0x08|0x0024) ncmd 1
        Status: Success (0x00)
zephyr.exe[1666352]: < HCI Command: LE Read Resolving List Size (0x08|0x002a) plen 0                                 #27 1.201722
> HCI Event: Command Complete (0x0e) plen 5                                                                          #28 1.202471
      LE Read Resolving List Size (0x08|0x002a) ncmd 1
        Status: Success (0x00)
        Size: 8
zephyr.exe[1666352]: < HCI Command: LE Set Event Mask (0x08|0x0001) plen 8                                           #29 1.221767
        Mask: 0x000002023f87fa5e
          LE Advertising Report
          LE Connection Update Complete
          LE Read Remote Used Features Complete
          LE Long Term Key Request
          LE Data Length Change
          LE Enhanced Connection Complete
          LE PHY Update Complete
          LE Extended Advertising Report
          LE Periodic Advertising Sync Established
          LE Periodic Advertising Report
          LE Periodic Advertising Sync Lost
          LE Extended Scan Timeout
          LE Extended Advertising Set Terminated
          LE Scan Request Received
          LE Periodic Advertising Sync Transfer Rvc
          LE CIS Established
          LE CIS Request
          LE Create BIG Complete
          LE Terminate BIG Complete
          LE BIG Sync Established Complete
          LE BIG Sync Lost
          LE BIG Info Advertising Report
          Unknown mask (0x0000020000000000)
> HCI Event: Command Complete (0x0e) plen 4                                                                          #30 1.222722
      LE Set Event Mask (0x08|0x0001) ncmd 1
        Status: Success (0x00)
zephyr.exe[1666352]: < HCI Command: Set Event Mask (0x03|0x0001) plen 8                                              #31 1.241763
        Mask: 0x2000800002008890
          Disconnection Complete
          Encryption Change
          Read Remote Version Information Complete
          Hardware Error
          Data Buffer Overflow
          Encryption Key Refresh Complete
          LE Meta
> HCI Event: Command Complete (0x0e) plen 4                                                                          #32 1.242544
      Set Event Mask (0x03|0x0001) ncmd 1
        Status: Success (0x00)
zephyr.exe[1666352]: < HCI Command: Read BD ADDR (0x04|0x0009) plen 0                                                #33 1.261768
> HCI Event: Command Complete (0x0e) plen 10                                                                         #34 1.262400
      Read BD ADDR (0x04|0x0009) ncmd 1
        Status: Success (0x00)
        Address: 00:00:00:00:00:00 (OUI 00-00-00)
zephyr.exe[1666352]: < HCI Command: LE Set Random Address (0x08|0x0005) plen 6                                       #35 1.281788
        Address: D5:B6:CC:31:DB:3B (Static)
> HCI Event: Command Complete (0x0e) plen 4                                                                          #36 1.282993
      LE Set Random Address (0x08|0x0005) ncmd 1
        Status: Success (0x00)
zephyr.exe[1666352]: < HCI Command: LE Set Extended Advertising Parameters (0x08|0x0036) plen 25                     #37 1.841795
        Handle: 0x00
        Properties: 0x0001
          Connectable
        Min advertising interval: 100.000 msec (0x00a0)
        Max advertising interval: 150.000 msec (0x00f0)
        Channel map: 37, 38, 39 (0x07)
        Own address type: Random (0x01)
        Peer address type: Public (0x00)
        Peer address: 00:00:00:00:00:00 (OUI 00-00-00)
        Filter policy: Allow Scan Request from Any, Allow Connect Request from Any (0x00)
        TX power: Host has no preference (0x7f)
        Primary PHY: LE 1M (0x01)
        Secondary max skip: 0x00
        Secondary PHY: LE 2M (0x02)
        SID: 0x00
        Scan request notifications: Disabled (0x00)
> HCI Event: Command Complete (0x0e) plen 5                                                                          #38 1.843559
      LE Set Extended Advertising Parameters (0x08|0x0036) ncmd 1
        Status: Success (0x00)
        TX power (selected): 0 dbm (0x00)
zephyr.exe[1666352]: < HCI Command: LE Set Advertising Set Random Address (0x08|0x0035) plen 7                       #39 1.861773
        Advertising handle: 0x00
        Advertising random address: D5:B6:CC:31:DB:3B (Static)
> HCI Event: Command Complete (0x0e) plen 4                                                                          #40 1.862653
      LE Set Advertising Set Random Address (0x08|0x0035) ncmd 1
        Status: Success (0x00)
zephyr.exe[1666352]: < HCI Command: LE Set Extended Advertising Data (0x08|0x0037) plen 39                           #41 1.881739
        Handle: 0x00
        Operation: Complete extended advertising data (0x03)
        Fragment preference: Minimize fragmentation (0x01)
        Data length: 0x23
        Flags: 0x06
          LE General Discoverable Mode
          BR/EDR Not Supported
        Name (complete): Tester_2CB6EE
        Flags: 0x06
          LE General Discoverable Mode
          BR/EDR Not Supported
        16-bit Service UUIDs (complete): 1 entry
          Audio Stream Control (0x184e)
        Service Data: Audio Stream Control (0x184e)
          Data[6]: 01ff0fff0f00
> HCI Event: Command Complete (0x0e) plen 4                                                                          #42 1.882995
      LE Set Extended Advertising Data (0x08|0x0037) ncmd 1
        Status: Success (0x00)
zephyr.exe[1666352]: < HCI Command: LE Set Extended Advertising Enable (0x08|0x0039) plen 6                          #43 1.901754
        Extended advertising: Enabled (0x01)
        Number of sets: 1 (0x01)
        Entry 0
          Handle: 0x00
          Duration: 0 ms (0x00)
          Max ext adv events: 0
> HCI Event: Command Complete (0x0e) plen 4                                                                          #44 1.902820
      LE Set Extended Advertising Enable (0x08|0x0039) ncmd 1
        Status: Success (0x00)
> HCI Event: LE Meta Event (0x3e) plen 31                                                                            #45 3.908046
      LE Enhanced Connection Complete (0x0a)
        Status: Success (0x00)
        Handle: 93
        Role: Peripheral (0x01)
        Peer address type: Public (0x00)
        Peer address: C0:07:E8:2C:B6:EE (OUI C0-07-E8)
        Local resolvable private address: 00:00:00:00:00:00 (Non-Resolvable)
        Peer resolvable private address: 00:00:00:00:00:00 (Non-Resolvable)
        Connection interval: 62.50 msec (0x0032)
        Connection latency: 0 (0x0000)
        Supervision timeout: 25120 msec (0x09d0)
        Central clock accuracy: 0x07
> HCI Event: LE Meta Event (0x3e) plen 6                                                                             #46 3.908334
      LE Advertising Set Terminated (0x12)
        Status: Success (0x00)
        Handle: 0
        Connection handle: 93
        Number of completed extended advertising events: 0
zephyr.exe[1666352]: < HCI Command: LE Read Remote Used Features (0x08|0x0016) plen 2                                #47 3.921920
        Handle: 93 Address: C0:07:E8:2C:B6:EE (OUI C0-07-E8)
> HCI Event: Command Status (0x0f) plen 4                                                                            #48 3.922763
      LE Read Remote Used Features (0x08|0x0016) ncmd 1
        Status: Success (0x00)
zephyr.exe[1666352]: < HCI Command: LE Set PHY (0x08|0x0032) plen 7                                                  #49 3.941832
        Handle: 93 Address: C0:07:E8:2C:B6:EE (OUI C0-07-E8)
        All PHYs preference: 0x00
        TX PHYs preference: 0x02
          LE 2M
        RX PHYs preference: 0x02
          LE 2M
        PHY options preference: Reserved (0x0000)
> HCI Event: Command Status (0x0f) plen 4                                                                            #50 3.943041
      LE Set PHY (0x08|0x0032) ncmd 1
        Status: Success (0x00)
zephyr.exe[1666352]: < ACL Data TX: Handle 93 [1/3] flags 0x00 dlen 7                                                #51 3.961833
      ATT: Exchange MTU Request (0x02) len 2
        Client RX MTU: 251
zephyr.exe[1666352]: < HCI Command: LE Remove Advertising Set (0x08|0x003c) plen 1                                   #52 4.021833
        Handle: 0
> HCI Event: Command Complete (0x0e) plen 4                                                                          #53 4.022605
      LE Remove Advertising Set (0x08|0x003c) ncmd 1
        Status: Success (0x00)
> HCI Event: Number of Completed Packets (0x13) plen 5                                                               #54 4.035066
        Num handles: 1
        Handle: 93 Address: C0:07:E8:2C:B6:EE (OUI C0-07-E8)
        Count: 1
        Buffers: 0/3
        #51: len 7 (0 Kb/s)
        Latency: 73 msec (73-73 msec ~73 msec)
zephyr.exe[1666352]: < HCI Command: LE Set Extended Advertising Parameters (0x08|0x0036) plen 25                     #55 4.041800
        Handle: 0x00
        Properties: 0x0001
          Connectable
        Min advertising interval: 100.000 msec (0x00a0)
        Max advertising interval: 150.000 msec (0x00f0)
        Channel map: 37, 38, 39 (0x07)
        Own address type: Random (0x01)
        Peer address type: Public (0x00)
        Peer address: 00:00:00:00:00:00 (OUI 00-00-00)
        Filter policy: Allow Scan Request from Any, Allow Connect Request from Any (0x00)
        TX power: Host has no preference (0x7f)
        Primary PHY: LE 1M (0x01)
        Secondary max skip: 0x00
        Secondary PHY: LE 2M (0x02)
        SID: 0x01
        Scan request notifications: Disabled (0x00)
> HCI Event: Command Complete (0x0e) plen 5                                                                          #56 4.042607
      LE Set Extended Advertising Parameters (0x08|0x0036) ncmd 1
        Status: Success (0x00)
        TX power (selected): 0 dbm (0x00)
zephyr.exe[1666352]: < HCI Command: LE Set Advertising Set Random Address (0x08|0x0035) plen 7                       #57 4.061798
        Advertising handle: 0x00
        Advertising random address: D5:B6:CC:31:DB:3B (Static)
> HCI Event: Command Complete (0x0e) plen 4                                                                          #58 4.062674
      LE Set Advertising Set Random Address (0x08|0x0035) ncmd 1
        Status: Success (0x00)
zephyr.exe[1666352]: < HCI Command: LE Set Extended Advertising Data (0x08|0x0037) plen 39                           #59 4.081807
        Handle: 0x00
        Operation: Complete extended advertising data (0x03)
        Fragment preference: Minimize fragmentation (0x01)
        Data length: 0x23
        Flags: 0x06
          LE General Discoverable Mode
          BR/EDR Not Supported
        Name (complete): Tester_2CB6EE
        Flags: 0x06
          LE General Discoverable Mode
          BR/EDR Not Supported
        16-bit Service UUIDs (complete): 1 entry
          Audio Stream Control (0x184e)
        Service Data: Audio Stream Control (0x184e)
          Data[6]: 01ff0fff0f00
> HCI Event: Command Complete (0x0e) plen 4                                                                          #60 4.082838
      LE Set Extended Advertising Data (0x08|0x0037) ncmd 1
        Status: Success (0x00)
> HCI Event: LE Meta Event (0x3e) plen 12                                                                            #61 4.097958
      LE Read Remote Used Features (0x04)
        Status: Success (0x00)
        Handle: 93 Address: C0:07:E8:2C:B6:EE (OUI C0-07-E8)
        Features: 0x2d 0x49 0x01 0xf7 0xef 0x39 0x00 0x80
          LE Encryption
          Extended Reject Indication
          Peripheral-initiated Features Exchange
          LE Data Packet Length Extension
          LE 2M PHY
          LE Coded PHY
          Channel Selection Algorithm #2
          Minimum Number of Used Channels Procedure
          Periodic Advertising Sync Transfer - Sender
          Periodic Advertising Sync Transfer - Recipient
          Sleep Clock Accuracy Updates
          Connected Isochronous Stream - Central
          Connected Isochronous Stream - Peripheral
          Isochronous Broadcaster
          Synchronized Receiver
          Connected Isochronous Stream (Host Support)
          LE Power Control Request
          LE Power Control Request
          LE Path Loss Monitoring
          Connection Subrating
          Connection Subrating (Host Support)
          Channel Classification
          Unknown features (0x8000390000000000)
> HCI Event: LE Meta Event (0x3e) plen 6                                                                             #62 4.097972
      LE PHY Update Complete (0x0c)
        Status: Success (0x00)
        Handle: 93 Address: C0:07:E8:2C:B6:EE (OUI C0-07-E8)
        TX PHY: LE 2M (0x02)
        RX PHY: LE 2M (0x02)
zephyr.exe[1666352]: < HCI Command: LE Set Extended Advertising Enable (0x08|0x0039) plen 6                          #63 4.101845
        Extended advertising: Enabled (0x01)
        Number of sets: 1 (0x01)
        Entry 0
          Handle: 0x00
          Duration: 0 ms (0x00)
          Max ext adv events: 0
> HCI Event: Command Complete (0x0e) plen 4                                                                          #64 4.102653
      LE Set Extended Advertising Enable (0x08|0x0039) ncmd 1
        Status: Success (0x00)
> ACL Data RX: Handle 93 flags 0x02 dlen 7                                                                           #65 4.410106
      ATT: Exchange MTU Request (0x02) len 2
        Client RX MTU: 64
> ACL Data RX: Handle 93 flags 0x02 dlen 7                                                                           #66 4.410474
      ATT: Exchange MTU Response (0x03) len 2
        Server RX MTU: 64
zephyr.exe[1666352]: < HCI Command: Host Number of Completed Packets (0x03|0x0035) plen 5                            #67 4.421916
        Num handles: 1
        Handle: 93 Address: C0:07:E8:2C:B6:EE (OUI C0-07-E8)
        Count: 1
zephyr.exe[1666352]: < ACL Data TX: Handle 93 [1/3] flags 0x00 dlen 7                                                #68 4.422027
      ATT: Exchange MTU Response (0x03) len 2
        Server RX MTU: 251
zephyr.exe[1666352]: < HCI Command: Host Number of Completed Packets (0x03|0x0035) plen 5                            #69 4.422093
        Num handles: 1
        Handle: 93 Address: C0:07:E8:2C:B6:EE (OUI C0-07-E8)
        Count: 1
> HCI Event: Number of Completed Packets (0x13) plen 5                                                               #70 4.535197
        Num handles: 1
        Handle: 93 Address: C0:07:E8:2C:B6:EE (OUI C0-07-E8)
        Count: 1
        Buffers: 0/3
        #68: len 7 (0 Kb/s)
        Latency: 113 msec (73-113 msec ~93 msec)
> ACL Data RX: Handle 93 flags 0x02 dlen 11                                                                          #71 6.535246
      SMP: Pairing Request (0x01) len 6
        IO capability: KeyboardDisplay (0x04)
        OOB data: Authentication data not present (0x00)
        Authentication requirement: Bonding, No MITM, SC, No Keypresses (0x09)
        Max encryption key size: 16
        Initiator key distribution: EncKey IdKey (0x03)
        Responder key distribution: EncKey IdKey Sign (0x07)
zephyr.exe[1666352]: < HCI Command: Host Number of Completed Packets (0x03|0x0035) plen 5                            #72 6.541959
        Num handles: 1
        Handle: 93 Address: C0:07:E8:2C:B6:EE (OUI C0-07-E8)
        Count: 1
zephyr.exe[1666352]: < ACL Data TX: Handle 93 [1/3] flags 0x00 dlen 11                                               #73 6.542080
      SMP: Pairing Response (0x02) len 6
        IO capability: NoInputNoOutput (0x03)
        OOB data: Authentication data not present (0x00)
        Authentication requirement: Bonding, No MITM, SC, No Keypresses (0x09)
        Max encryption key size: 16
        Initiator key distribution: IdKey (0x02)
        Responder key distribution: Sign (0x04)
> HCI Event: Number of Completed Packets (0x13) plen 5                                                               #74 6.660252
        Num handles: 1
        Handle: 93 Address: C0:07:E8:2C:B6:EE (OUI C0-07-E8)
        Count: 1
        Buffers: 0/3
        #73: len 11 (0 Kb/s)
        Latency: 118 msec (73-118 msec ~105 msec)
> ACL Data RX: Handle 93 flags 0x02 dlen 27                                                                          #75 6.660506
> ACL Data RX: Handle 93 flags 0x01 dlen 27                                                                          #76 6.660913
> ACL Data RX: Handle 93 flags 0x01 dlen 15                                                                          #77 6.661199
      SMP: Pairing Public Key (0x0c) len 64
        X[32]: 4e12c758cd5390dba59561ff1fdef9931b26c6e38f903f68408a14702a1bb096
        Y[32]: 18aa9d9d5898a74a566fca2379596f1d162f0f4f83ef4cd8ead017ec0754429f
zephyr.exe[1666352]: < HCI Command: Host Number of Completed Packets (0x03|0x0035) plen 5                            #78 6.661891
        Num handles: 1
        Handle: 93 Address: C0:07:E8:2C:B6:EE (OUI C0-07-E8)
        Count: 1
zephyr.exe[1666352]: < HCI Command: Host Number of Completed Packets (0x03|0x0035) plen 5                            #79 6.661991
        Num handles: 1
        Handle: 93 Address: C0:07:E8:2C:B6:EE (OUI C0-07-E8)
        Count: 1
zephyr.exe[1666352]: < HCI Command: Host Number of Completed Packets (0x03|0x0035) plen 5                            #80 6.662007
        Num handles: 1
        Handle: 93 Address: C0:07:E8:2C:B6:EE (OUI C0-07-E8)
        Count: 1
zephyr.exe[1666352]: < ACL Data TX: Handle 93 [1/3] flags 0x00 dlen 27                                               #81 6.662021
zephyr.exe[1666352]: < ACL Data TX: Handle 93 flags 0x01 dlen 27                                                     #82 6.662035
zephyr.exe[1666352]: < ACL Data TX: Handle 93 flags 0x01 dlen 15                                                     #83 6.662048
      SMP: Pairing Public Key (0x0c) len 64
        X[32]: 98308440221e2d910f0e54b71e7ec652857aa9b5a0dc65028824cc19db1226e9
        Y[32]: 67a4816bcb62efb21701e31fdb27561a6217575fb007a8bbdabe7e28b6f68482
> HCI Event: Number of Completed Packets (0x13) plen 5                                                               #84 6.723048
        Num handles: 1
        Handle: 93 Address: C0:07:E8:2C:B6:EE (OUI C0-07-E8)
        Count: 1
        Buffers: 0/3
        #81: len 27 (3 Kb/s)
        Latency: 61 msec (61-118 msec ~83 msec)
> HCI Event: Number of Completed Packets (0x13) plen 5                                                               #85 6.723511
        Num handles: 1
        Handle: 93 Address: C0:07:E8:2C:B6:EE (OUI C0-07-E8)
        Count: 1
        Buffers: underflow/3
        #82: len 27 (3 Kb/s)
        Latency: 61 msec (61-118 msec ~72 msec)
zephyr.exe[1666352]: < ACL Data TX: Handle 93 [1/3] flags 0x00 dlen 21                                               #86 6.741875
      SMP: Pairing Confirm (0x03) len 16
        Confirm value[16]: 1d2b6943db7afa4aed8605bb6eb86855
> HCI Event: Number of Completed Packets (0x13) plen 5                                                               #87 6.785061
        Num handles: 1
        Handle: 93 Address: C0:07:E8:2C:B6:EE (OUI C0-07-E8)
        Count: 1
        Buffers: 0/3
        #83: len 15 (0 Kb/s)
        Latency: 123 msec (61-123 msec ~97 msec)
> HCI Event: Number of Completed Packets (0x13) plen 5                                                               #88 6.847619
        Num handles: 1
        Handle: 93 Address: C0:07:E8:2C:B6:EE (OUI C0-07-E8)
        Count: 1
        Buffers: underflow/3
        #86: len 21 (1 Kb/s)
        Latency: 105 msec (61-123 msec ~101 msec)
> ACL Data RX: Handle 93 flags 0x02 dlen 21                                                                          #89 6.847946
      SMP: Pairing Random (0x04) len 16
        Random value[16]: bd471fcd59f479520000000000000000
zephyr.exe[1666352]: < HCI Command: Host Number of Completed Packets (0x03|0x0035) plen 5                            #90 6.861925
        Num handles: 1
        Handle: 93 Address: C0:07:E8:2C:B6:EE (OUI C0-07-E8)
        Count: 1
zephyr.exe[1666352]: < ACL Data TX: Handle 93 [1/3] flags 0x00 dlen 21                                               #91 6.862035
      SMP: Pairing Random (0x04) len 16
        Random value[16]: 8e6108f966a694cbe26df70bb96773e6
> HCI Event: Number of Completed Packets (0x13) plen 5                                                               #92 6.972562
        Num handles: 1
        Handle: 93 Address: C0:07:E8:2C:B6:EE (OUI C0-07-E8)
        Count: 1
        Buffers: 0/3
        #91: len 21 (1 Kb/s)
        Latency: 110 msec (61-123 msec ~106 msec)
> ACL Data RX: Handle 93 flags 0x02 dlen 21                                                                          #93 7.035291
      SMP: Pairing DHKey Check (0x0d) len 16
        E[16]: afd3d5173b423da8ff8211039771474d
zephyr.exe[1666352]: < HCI Command: Host Number of Completed Packets (0x03|0x0035) plen 5                            #94 7.041966
        Num handles: 1
        Handle: 93 Address: C0:07:E8:2C:B6:EE (OUI C0-07-E8)
        Count: 1
zephyr.exe[1666352]: < ACL Data TX: Handle 93 [1/3] flags 0x00 dlen 21                                               #95 7.042099
      SMP: Pairing DHKey Check (0x0d) len 16
        E[16]: b3697ea5e3df32abf378158f1dfedcbb
> HCI Event: Number of Completed Packets (0x13) plen 5                                                               #96 7.160087
        Num handles: 1
        Handle: 93 Address: C0:07:E8:2C:B6:EE (OUI C0-07-E8)
        Count: 1
        Buffers: 0/3
        #95: len 21 (1 Kb/s)
        Latency: 117 msec (61-123 msec ~112 msec)
> HCI Event: LE Meta Event (0x3e) plen 13                                                                            #97 7.223141
      LE Long Term Key Request (0x05)
        Handle: 93 Address: C0:07:E8:2C:B6:EE (OUI C0-07-E8)
        Random number: 0x0000000000000000
        Encrypted diversifier: 0x0000
zephyr.exe[1666352]: < HCI Command: LE Long Term Key Request Reply (0x08|0x001a) plen 18                             #98 7.241903
        Handle: 93 Address: C0:07:E8:2C:B6:EE (OUI C0-07-E8)
        Long term key[16]: b1b8175a81f9cbda19bcd78070838e32
> HCI Event: Command Complete (0x0e) plen 6                                                                          #99 7.242826
      LE Long Term Key Request Reply (0x08|0x001a) ncmd 1
        Status: Success (0x00)
        Handle: 93 Address: C0:07:E8:2C:B6:EE (OUI C0-07-E8)
> HCI Event: Encryption Change (0x08) plen 4                                                                        #100 7.535349
        Status: Success (0x00)
        Handle: 93 Address: C0:07:E8:2C:B6:EE (OUI C0-07-E8)
        Encryption: Enabled with AES-CCM (0x01)
zephyr.exe[1666352]: < ACL Data TX: Handle 93 [1/3] flags 0x00 dlen 21                                              #101 7.651933
      SMP: Signing Information (0x0a) len 16
        Signature key[16]: 5da095555cc64d02679f89a05211af56
> HCI Event: Number of Completed Packets (0x13) plen 5                                                              #102 7.722731
        Num handles: 1
        Handle: 93 Address: C0:07:E8:2C:B6:EE (OUI C0-07-E8)
        Count: 1
        Buffers: 0/3
        #101: len 21 (2 Kb/s)
        Latency: 70 msec (61-123 msec ~91 msec)
> ACL Data RX: Handle 93 flags 0x02 dlen 21                                                                         #103 7.722989
      SMP: Identity Information (0x08) len 16
        Identity resolving key[16]: e8c276421621d8dc4cb8acd24b4f6c4c
> ACL Data RX: Handle 93 flags 0x02 dlen 12                                                                         #104 7.723286
      SMP: Identity Address Information (0x09) len 7
        Address: C0:07:E8:2C:B6:EE (OUI C0-07-E8)
zephyr.exe[1666352]: < HCI Command: Host Number of Completed Packets (0x03|0x0035) plen 5                           #105 7.741970
        Num handles: 1
        Handle: 93 Address: C0:07:E8:2C:B6:EE (OUI C0-07-E8)
        Count: 1
zephyr.exe[1666352]: < HCI Command: LE Set Extended Advertising Enable (0x08|0x0039) plen 6                         #106 7.742473
        Extended advertising: Disabled (0x00)
        Number of sets: 1 (0x01)
        Entry 0
          Handle: 0x00
          Duration: 0 ms (0x00)
          Max ext adv events: 0
> HCI Event: Command Complete (0x0e) plen 4                                                                         #107 7.743072
      LE Set Extended Advertising Enable (0x08|0x0039) ncmd 1
        Status: Success (0x00)
zephyr.exe[1666352]: < HCI Command: LE Add Device To Resolving List (0x08|0x0027) plen 39                           #108 7.761946
        Address type: Public (0x00)
        Address: C0:07:E8:2C:B6:EE (OUI C0-07-E8)
        Peer identity resolving key[16]: e8c276421621d8dc4cb8acd24b4f6c4c
        Local identity resolving key[16]: 00000000000000000000000000000000
> HCI Event: Command Complete (0x0e) plen 4                                                                         #109 7.763323
      LE Add Device To Resolving List (0x08|0x0027) ncmd 1
        Status: Success (0x00)
zephyr.exe[1666352]: < HCI Command: LE Set Privacy Mode (0x08|0x004e) plen 8                                        #110 7.781938
        Peer Identity address type: Public (0x00)
        Peer Identity address: C0:07:E8:2C:B6:EE (OUI C0-07-E8)
        Privacy Mode: Use Device Privacy (0x01)
> HCI Event: Command Complete (0x0e) plen 4                                                                         #111 7.783401
      LE Set Privacy Mode (0x08|0x004e) ncmd 1
        Status: Success (0x00)
zephyr.exe[1666352]: < HCI Command: LE Set Address Resolution Enable (0x08|0x002d) plen 1                           #112 7.801922
        Address resolution: Enabled (0x01)
> HCI Event: Command Complete (0x0e) plen 4                                                                         #113 7.802626
      LE Set Address Resolution Enable (0x08|0x002d) ncmd 1
        Status: Success (0x00)
zephyr.exe[1666352]: < HCI Command: LE Set Extended Advertising Enable (0x08|0x0039) plen 6                         #114 7.821922
        Extended advertising: Enabled (0x01)
        Number of sets: 1 (0x01)
        Entry 0
          Handle: 0x00
          Duration: 0 ms (0x00)
          Max ext adv events: 0
> HCI Event: Command Complete (0x0e) plen 4                                                                         #115 7.822622
      LE Set Extended Advertising Enable (0x08|0x0039) ncmd 1
        Status: Success (0x00)
zephyr.exe[1666352]: < HCI Command: Host Number of Completed Packets (0x03|0x0035) plen 5                           #116 7.841892
        Num handles: 1
        Handle: 93 Address: C0:07:E8:2C:B6:EE (OUI C0-07-E8)
        Count: 1
> ACL Data RX: Handle 93 flags 0x02 dlen 13                                                                         #117 7.847759
      ATT: Find By Type Value Request (0x06) len 8
        Handle range: 0x0001-0xffff
        Attribute type: Primary Service (0x2800)
          UUID: Broadcast Audio Scan (0x184f)
zephyr.exe[1666352]: < HCI Command: Host Number of Completed Packets (0x03|0x0035) plen 5                           #118 7.861985
        Num handles: 1
        Handle: 93 Address: C0:07:E8:2C:B6:EE (OUI C0-07-E8)
        Count: 1
zephyr.exe[1666352]: < ACL Data TX: Handle 93 [1/3] flags 0x00 dlen 9                                               #119 7.862097
      ATT: Find By Type Value Response (0x07) len 4
        Handle range: 0x0047-0x004c
> HCI Event: Number of Completed Packets (0x13) plen 5                                                              #120 7.972688
        Num handles: 1
        Handle: 93 Address: C0:07:E8:2C:B6:EE (OUI C0-07-E8)
        Count: 1
        Buffers: 0/3
        #119: len 9 (0 Kb/s)
        Latency: 110 msec (61-123 msec ~101 msec)
> ACL Data RX: Handle 93 flags 0x02 dlen 13                                                                         #121 7.972930
      ATT: Find By Type Value Request (0x06) len 8
        Handle range: 0x004d-0xffff
        Attribute type: Primary Service (0x2800)
          UUID: Broadcast Audio Scan (0x184f)
zephyr.exe[1666352]: < HCI Command: Host Number of Completed Packets (0x03|0x0035) plen 5                           #122 7.981968
        Num handles: 1
        Handle: 93 Address: C0:07:E8:2C:B6:EE (OUI C0-07-E8)
        Count: 1
zephyr.exe[1666352]: < ACL Data TX: Handle 93 [1/3] flags 0x00 dlen 9                                               #123 7.982096
      ATT: Error Response (0x01) len 4
        Find By Type Value Request (0x06)
        Handle: 0x004d
        Error: Attribute Not Found (0x0a)
> HCI Event: Number of Completed Packets (0x13) plen 5                                                              #124 8.097711
        Num handles: 1
        Handle: 93 Address: C0:07:E8:2C:B6:EE (OUI C0-07-E8)
        Count: 1
        Buffers: 0/3
        #123: len 9 (0 Kb/s)
        Latency: 115 msec (61-123 msec ~108 msec)
> ACL Data RX: Handle 93 flags 0x02 dlen 11                                                                         #125 8.097950
      ATT: Read By Type Request (0x08) len 6
        Handle range: 0x0047-0x004c
        Attribute type: Characteristic (0x2803)
zephyr.exe[1666352]: < HCI Command: Host Number of Completed Packets (0x03|0x0035) plen 5                           #126 8.101958
        Num handles: 1
        Handle: 93 Address: C0:07:E8:2C:B6:EE (OUI C0-07-E8)
        Count: 1
zephyr.exe[1666352]: < ACL Data TX: Handle 93 [1/3] flags 0x00 dlen 20                                              #127 8.102207
      ATT: Read By Type Response (0x09) len 15
        Attribute data length: 7
        Attribute data list: 2 entries
        Handle: 0x0048
        Value[5]: 0c4900c72b
            Properties: 0x0c
              Write Without Response (0x04)
              Write (0x08)
            Value Handle: 0x0049
            Value UUID: Broadcast Audio Scan Control Point (0x2bc7)
        Handle: 0x004a
        Value[5]: 124b00c82b
            Properties: 0x12
              Read (0x02)
              Notify (0x10)
            Value Handle: 0x004b
            Value UUID: Broadcast Receive State (0x2bc8)
> HCI Event: Number of Completed Packets (0x13) plen 5                                                              #128 8.222727
        Num handles: 1
        Handle: 93 Address: C0:07:E8:2C:B6:EE (OUI C0-07-E8)
        Count: 1
        Buffers: 0/3
        #127: len 20 (1 Kb/s)
        Latency: 120 msec (61-123 msec ~114 msec)
> ACL Data RX: Handle 93 flags 0x02 dlen 11                                                                         #129 8.223208
      ATT: Read By Type Request (0x08) len 6
        Handle range: 0x004b-0x004c
        Attribute type: Characteristic (0x2803)
zephyr.exe[1666352]: < HCI Command: Host Number of Completed Packets (0x03|0x0035) plen 5                           #130 8.241977
        Num handles: 1
        Handle: 93 Address: C0:07:E8:2C:B6:EE (OUI C0-07-E8)
        Count: 1
zephyr.exe[1666352]: < ACL Data TX: Handle 93 [1/3] flags 0x00 dlen 9                                               #131 8.242411
      ATT: Error Response (0x01) len 4
        Read By Type Request (0x08)
        Handle: 0x004b
        Error: Attribute Not Found (0x0a)
> HCI Event: Number of Completed Packets (0x13) plen 5                                                              #132 8.347667
        Num handles: 1
        Handle: 93 Address: C0:07:E8:2C:B6:EE (OUI C0-07-E8)
        Count: 1
        Buffers: 0/3
        #131: len 9 (0 Kb/s)
        Latency: 105 msec (61-123 msec ~109 msec)
> ACL Data RX: Handle 93 flags 0x02 dlen 9                                                                          #133 8.348111
      ATT: Find Information Request (0x04) len 4
        Handle range: 0x004c-0x004c
zephyr.exe[1666352]: < HCI Command: Host Number of Completed Packets (0x03|0x0035) plen 5                           #134 8.361974
        Num handles: 1
        Handle: 93 Address: C0:07:E8:2C:B6:EE (OUI C0-07-E8)
        Count: 1
zephyr.exe[1666352]: < ACL Data TX: Handle 93 [1/3] flags 0x00 dlen 10                                              #135 8.362146
      ATT: Find Information Response (0x05) len 5
        Format: UUID-16 (0x01)
        Handle: 0x004c
        UUID: Client Characteristic Configuration (0x2902)
> HCI Event: Number of Completed Packets (0x13) plen 5                                                              #136 8.472664
        Num handles: 1
        Handle: 93 Address: C0:07:E8:2C:B6:EE (OUI C0-07-E8)
        Count: 1
        Buffers: 0/3
        #135: len 10 (0 Kb/s)
        Latency: 110 msec (61-123 msec ~110 msec)
> ACL Data RX: Handle 93 flags 0x02 dlen 9                                                                          #137 8.473184
      ATT: Write Request (0x12) len 4
        Handle: 0x004c
          Data[2]: 0000
zephyr.exe[1666352]: < HCI Command: Host Number of Completed Packets (0x03|0x0035) plen 5                           #138 8.487417
        Num handles: 1
        Handle: 93 Address: C0:07:E8:2C:B6:EE (OUI C0-07-E8)
        Count: 1
zephyr.exe[1666352]: < ACL Data TX: Handle 93 [1/3] flags 0x00 dlen 5                                               #139 8.487802
      ATT: Write Response (0x13) len 0
> HCI Event: Number of Completed Packets (0x13) plen 5                                                              #140 8.597678
        Num handles: 1
        Handle: 93 Address: C0:07:E8:2C:B6:EE (OUI C0-07-E8)
        Count: 1
        Buffers: 0/3
        #139: len 5 (0 Kb/s)
        Latency: 109 msec (61-123 msec ~110 msec)
> ACL Data RX: Handle 93 flags 0x02 dlen 9                                                                          #141 8.598198
      ATT: Write Request (0x12) len 4
        Handle: 0x004c
          Data[2]: 0100
zephyr.exe[1666352]: < HCI Command: Host Number of Completed Packets (0x03|0x0035) plen 5                           #142 8.604594
        Num handles: 1
        Handle: 93 Address: C0:07:E8:2C:B6:EE (OUI C0-07-E8)
        Count: 1
zephyr.exe[1666352]: < ACL Data TX: Handle 93 [1/3] flags 0x00 dlen 5                                               #143 8.604694
      ATT: Write Response (0x13) len 0
> HCI Event: Number of Completed Packets (0x13) plen 5                                                              #144 8.722774
        Num handles: 1
        Handle: 93 Address: C0:07:E8:2C:B6:EE (OUI C0-07-E8)
        Count: 1
        Buffers: 0/3
        #143: len 5 (0 Kb/s)
        Latency: 118 msec (61-123 msec ~114 msec)
> ACL Data RX: Handle 93 flags 0x02 dlen 7                                                                          #145 8.722776
      ATT: Read Request (0x0a) len 2
        Handle: 0x004b
zephyr.exe[1666352]: < HCI Command: Host Number of Completed Packets (0x03|0x0035) plen 5                           #146 8.741772
        Num handles: 1
        Handle: 93 Address: C0:07:E8:2C:B6:EE (OUI C0-07-E8)
        Count: 1
zephyr.exe[1666352]: < ACL Data TX: Handle 93 [1/3] flags 0x00 dlen 5                                               #147 8.742965
      ATT: Read Response (0x0b) len 0
        Value[0]: 
> HCI Event: Number of Completed Packets (0x13) plen 5                                                              #148 8.847743
        Num handles: 1
        Handle: 93 Address: C0:07:E8:2C:B6:EE (OUI C0-07-E8)
        Count: 1
        Buffers: 0/3
        #147: len 5 (0 Kb/s)
        Latency: 104 msec (61-123 msec ~109 msec)
> ACL Data RX: Handle 93 flags 0x02 dlen 27                                                                         #149 8.848260
> ACL Data RX: Handle 93 flags 0x01 dlen 1                                                                          #150 8.848261
      ATT: Write Request (0x12) len 23
        Handle: 0x0049
          Data[21]: 0200eeb62ce807c00e34120000401f010000000000
zephyr.exe[1666352]: < HCI Command: Host Number of Completed Packets (0x03|0x0035) plen 5                           #151 8.862126
        Num handles: 1
        Handle: 93 Address: C0:07:E8:2C:B6:EE (OUI C0-07-E8)
        Count: 1
zephyr.exe[1666352]: < HCI Command: Host Number of Completed Packets (0x03|0x0035) plen 5                           #152 8.862429
        Num handles: 1
        Handle: 93 Address: C0:07:E8:2C:B6:EE (OUI C0-07-E8)
        Count: 1
zephyr.exe[1666352]: < ACL Data TX: Handle 93 [1/3] flags 0x00 dlen 5                                               #153 8.862615
      ATT: Write Response (0x13) len 0
zephyr.exe[1666352]: < ACL Data TX: Handle 93 [2/3] flags 0x00 dlen 27                                              #154 8.862790
      ATT: H