Bluetooth monitor ver 5.72
= Note: Linux version 6.14.0-36-generic (x86_64)                       0.029917
= Note: Bluetooth subsystem version 2.22                               0.029919
= New Index: 00:00:00:00:00:00 (Primary,UART,hci1)              [hci1] 0.029920
= New Index: 48:5F:99:8E:E0:64 (Primary,USB,hci0)               [hci0] 0.029921
= Open Index: 00:00:00:00:00:00                                 [hci1] 0.144012
= Index Info: 00:00:00:00:00:00 (Nordic Semiconductor ASA)      [hci1] 0.144033
@ USER Open: main (privileged) version 2.22            {0x0001} [hci1] 0.144042
< HCI Command: Reset (0x03|0x0003) plen 0                    #1 [hci1] 0.145391
> HCI Event: Command Complete (0x0e) plen 4                  #2 [hci1] 0.145871
      Reset (0x03|0x0003) ncmd 1
        Status: Success (0x00)
< HCI Command: Read Local Supported... (0x04|0x0003) plen 0  #3 [hci1] 0.163758
> HCI Event: Command Complete (0x0e) plen 12                 #4 [hci1] 0.164402
      Read Local Supported Features (0x04|0x0003) ncmd 1
        Status: Success (0x00)
        Features: 0x00 0x00 0x00 0x00 0x60 0x00 0x00 0x00
          BR/EDR Not Supported
          LE Supported (Controller)
< HCI Command: Read Local Version In.. (0x04|0x0001) plen 0  #5 [hci1] 0.183459
> HCI Event: Command Complete (0x0e) plen 12                 #6 [hci1] 0.183954
      Read Local Version Information (0x04|0x0001) ncmd 1
        Status: Success (0x00)
        HCI version: Reserved (0x0f) - Revision 12393 (0x3069)
        LMP version: Reserved (0x0f) - Subversion 12393 (0x3069)
        Manufacturer: Nordic Semiconductor ASA (89)
< HCI Command: Read Local Supported... (0x04|0x0002) plen 0  #7 [hci1] 0.203379
> HCI Event: Command Complete (0x0e) plen 68                 #8 [hci1] 0.204432
      Read Local Supported Commands (0x04|0x0002) ncmd 1
        Status: Success (0x00)
        Commands: 119 entries
          Disconnect (Octet 0 - Bit 5)
          Read Remote Version Information (Octet 2 - Bit 7)
          Set Event Mask (Octet 5 - Bit 6)
          Reset (Octet 5 - Bit 7)
          Read Connection Accept Timeout (Octet 7 - Bit 2)
          Write Connection Accept Timeout (Octet 7 - Bit 3)
          Read Transmit Power Level (Octet 10 - Bit 2)
          Set Controller To Host Flow Control (Octet 10 - Bit 5)
          Host Buffer Size (Octet 10 - Bit 6)
          Host Number of Completed Packets (Octet 10 - Bit 7)
          Read Local Version Information (Octet 14 - Bit 3)
          Read Local Supported Features (Octet 14 - Bit 5)
          Read BD ADDR (Octet 15 - Bit 1)
          Read RSSI (Octet 15 - Bit 5)
          Set Event Mask Page 2 (Octet 22 - Bit 2)
          LE Set Event Mask (Octet 25 - Bit 0)
          LE Read Buffer Size (Octet 25 - Bit 1)
          LE Read Local Supported Features (Octet 25 - Bit 2)
          LE Set Random Address (Octet 25 - Bit 4)
          LE Set Advertising Parameters (Octet 25 - Bit 5)
          LE Read Advertising Channel TX Power (Octet 25 - Bit 6)
          LE Set Advertising Data (Octet 25 - Bit 7)
          LE Set Scan Response Data (Octet 26 - Bit 0)
          LE Set Advertise Enable (Octet 26 - Bit 1)
          LE Set Scan Parameters (Octet 26 - Bit 2)
          LE Set Scan Enable (Octet 26 - Bit 3)
          LE Create Connection (Octet 26 - Bit 4)
          LE Create Connection Cancel (Octet 26 - Bit 5)
          LE Read Accept List Size (Octet 26 - Bit 6)
          LE Clear Accept List (Octet 26 - Bit 7)
          LE Add Device To Accept List (Octet 27 - Bit 0)
          LE Remove Device From Accept List (Octet 27 - Bit 1)
          LE Connection Update (Octet 27 - Bit 2)
          LE Set Host Channel Classification (Octet 27 - Bit 3)
          LE Read Channel Map (Octet 27 - Bit 4)
          LE Read Remote Used Features (Octet 27 - Bit 5)
          LE Encrypt (Octet 27 - Bit 6)
          LE Rand (Octet 27 - Bit 7)
          LE Start Encryption (Octet 28 - Bit 0)
          LE Long Term Key Request Reply (Octet 28 - Bit 1)
          LE Long Term Key Request Neg Reply (Octet 28 - Bit 2)
          LE Read Supported States (Octet 28 - Bit 3)
          LE Receiver Test (Octet 28 - Bit 4)
          LE Transmitter Test (Octet 28 - Bit 5)
          LE Test End (Octet 28 - Bit 6)
          Read Authenticated Payload Timeout (Octet 32 - Bit 4)
          Write Authenticated Payload Timeout (Octet 32 - Bit 5)
          LE Set Data Length (Octet 33 - Bit 6)
          LE Read Suggested Default Data Length (Octet 33 - Bit 7)
          LE Write Suggested Default Data Length (Octet 34 - Bit 0)
          LE Add Device To Resolving List (Octet 34 - Bit 3)
          LE Remove Device From Resolving List (Octet 34 - Bit 4)
          LE Clear Resolving List (Octet 34 - Bit 5)
          LE Read Resolving List Size (Octet 34 - Bit 6)
          LE Set Address Resolution Enable (Octet 35 - Bit 1)
          LE Set Resolvable Private Address Timeout (Octet 35 - Bit 2)
          LE Read Maximum Data Length (Octet 35 - Bit 3)
          LE Read PHY (Octet 35 - Bit 4)
          LE Set Default PHY (Octet 35 - Bit 5)
          LE Set PHY (Octet 35 - Bit 6)
          LE Enhanced Receiver Test (Octet 35 - Bit 7)
          LE Enhanced Transmitter Test (Octet 36 - Bit 0)
          LE Set Advertising Set Random Address (Octet 36 - Bit 1)
          LE Set Extended Advertising Parameters (Octet 36 - Bit 2)
          LE Set Extended Advertising Data (Octet 36 - Bit 3)
          LE Set Extended Scan Response Data (Octet 36 - Bit 4)
          LE Set Extended Advertising Enable (Octet 36 - Bit 5)
          LE Read Maximum Advertising Data Length (Octet 36 - Bit 6)
          LE Read Number of Supported Advertising Sets (Octet 36 - Bit 7)
          LE Remove Advertising Set (Octet 37 - Bit 0)
          LE Clear Advertising Sets (Octet 37 - Bit 1)
          LE Set Periodic Advertising Parameters (Octet 37 - Bit 2)
          LE Set Periodic Advertising Data (Octet 37 - Bit 3)
          LE Set Periodic Advertising Enable (Octet 37 - Bit 4)
          LE Set Extended Scan Parameters (Octet 37 - Bit 5)
          LE Set Extended Scan Enable (Octet 37 - Bit 6)
          LE Extended Create Connection (Octet 37 - Bit 7)
          LE Periodic Advertising Create Sync (Octet 38 - Bit 0)
          LE Periodic Advertising Create Sync Cancel (Octet 38 - Bit 1)
          LE Periodic Advertising Terminate Sync (Octet 38 - Bit 2)
          LE Add Device To Periodic Advertiser List (Octet 38 - Bit 3)
          LE Remove Device From Periodic Advertiser List (Octet 38 - Bit 4)
          LE Clear Periodic Advertiser List (Octet 38 - Bit 5)
          LE Read Periodic Advertiser List Size (Octet 38 - Bit 6)
          LE Read Transmit Power (Octet 38 - Bit 7)
          LE Read RF Path Compensation (Octet 39 - Bit 0)
          LE Write RF Path Compensation (Octet 39 - Bit 1)
          LE Set Privacy Mode (Octet 39 - Bit 2)
          LE Periodic Advertising Receive Enable (Octet 40 - Bit 5)
          LE Periodic Advertising Sync Transfer (Octet 40 - Bit 6)
          LE Periodic Advertising Set Info Transfer (Octet 40 - Bit 7)
          LE Periodic Advertising Sync Transfer Parameters (Octet 41 - Bit 0)
          LE Set Default Periodic Advertisng Sync Transfer Parameters (Octet 41 - Bit 1)
          LE Read Buffer v2 (Octet 41 - Bit 5)
          LE Read ISO TX Sync (Octet 41 - Bit 6)
          LE Set Connected Isochronous Group Parameters (Octet 41 - Bit 7)
          LE Set Connected Isochronous Group Parameters Test (Octet 42 - Bit 0)
          LE Create Connected Isochronous Stream (Octet 42 - Bit 1)
          LE Remove Connected Isochronous Group (Octet 42 - Bit 2)
          LE Accept Connected Isochronous Stream Request (Octet 42 - Bit 3)
          LE Reject Connected Isochronous Stream Request (Octet 42 - Bit 4)
          LE Create Broadcast Isochronous Group (Octet 42 - Bit 5)
          LE Create Broadcast Isochronous Group Test (Octet 42 - Bit 6)
          LE Terminate Broadcast Isochronous Group (Octet 42 - Bit 7)
          LE Broadcast Isochronous Group Create Sync (Octet 43 - Bit 0)
          LE Broadcast Isochronous Group Terminate Sync (Octet 43 - Bit 1)
          LE Request Peer SCA (Octet 43 - Bit 2)
          LE Setup Isochronous Data Path (Octet 43 - Bit 3)
          LE Remove Isochronous Data Path (Octet 43 - Bit 4)
          LE Isochronous Transmit Test (Octet 43 - Bit 5)
          LE Isochronous Receive Test (Octet 43 - Bit 6)
          LE Isochronous Read Test Counters (Octet 43 - Bit 7)
          LE Isochronous Read Test Counters (Octet 44 - Bit 0)
          LE Set Host Feature (Octet 44 - Bit 1)
          Octet 44 - Bit 2 
          Octet 45 - Bit 6 
          Octet 46 - Bit 0 
          Octet 46 - Bit 1 
          Octet 46 - Bit 2 
< HCI Command: Host Buffer Size (0x03|0x0033) plen 7         #9 [hci1] 0.223411
        ACL MTU: 255  ACL max packet: 16
        SCO MTU: 0    SCO max packet: 0
> HCI Event: Command Complete (0x0e) plen 4                 #10 [hci1] 0.223981
      Host Buffer Size (0x03|0x0033) ncmd 1
        Status: Success (0x00)
< HCI Command: Set Controller To Ho.. (0x03|0x0031) plen 1  #11 [hci1] 0.243394
        Flow control: ACL Data Packets (0x01)
> HCI Event: Command Complete (0x0e) plen 4                 #12 [hci1] 0.243825
      Set Controller To Host Flow Control (0x03|0x0031) ncmd 1
        Status: Success (0x00)
< HCI Command: LE Read Local Suppor.. (0x08|0x0003) plen 0  #13 [hci1] 0.263390
> HCI Event: Command Complete (0x0e) plen 12                #14 [hci1] 0.263888
      LE Read Local Supported Features (0x08|0x0003) ncmd 1
        Status: Success (0x00)
        Features: 0xfd 0x79 0x00 0xf7 0x30 0x01 0x00 0x00
          LE Encryption
          Extended Reject Indication
          Peripheral-initiated Features Exchange
          LE Ping
          LE Data Packet Length Extension
          LL Privacy
          Extended Scanner Filter Policies
          LE 2M PHY
          LE Coded PHY
          LE Extended Advertising
          LE Periodic Advertising
          Channel Selection Algorithm #2
          Periodic Advertising Sync Transfer - Sender
          Periodic Advertising Sync Transfer - Recipient
          Sleep Clock Accuracy Updates
          Connected Isochronous Stream - Central
          Connected Isochronous Stream - Peripheral
          Isochronous Broadcaster
          Synchronized Receiver
          Periodic Advertising ADI support
          Connection Subrating
          Unknown features (0x0000010000000000)
< HCI Command: LE Set Host Feature (0x08|0x0074) plen 2     #15 [hci1] 0.283383
        Bit Number: 32
          Connected Isochronous Stream (Host Support)
        Bit Value: 1
> HCI Event: Command Complete (0x0e) plen 4                 #16 [hci1] 0.283841
      LE Set Host Feature (0x08|0x0074) ncmd 1
        Status: Success (0x00)
< HCI Command: LE Read Buffer v2 (0x08|0x0060) plen 0       #17 [hci1] 0.303374
> HCI Event: Command Complete (0x0e) plen 10                #18 [hci1] 0.303844
      LE Read Buffer v2 (0x08|0x0060) ncmd 1
        Status: Success (0x00)
        ACL MTU: 27
        ACL max packet: 3
        ISO MTU: 318
        ISO max packet: 3
< HCI Command: LE Read Maximum Adve.. (0x08|0x003a) plen 0  #19 [hci1] 0.323396
> HCI Event: Command Complete (0x0e) plen 6                 #20 [hci1] 0.323855
      LE Read Maximum Advertising Data Length (0x08|0x003a) ncmd 1
        Status: Success (0x00)
        Max length: 1650
< HCI Command: LE Read Supported St.. (0x08|0x001c) plen 0  #21 [hci1] 0.343371
> HCI Event: Command Complete (0x0e) plen 12                #22 [hci1] 0.343846
      LE Read Supported States (0x08|0x001c) ncmd 1
        Status: Success (0x00)
        States: 0x000003ff3e0306ff
          Non-connectable Advertising State
          Scannable Advertising State
          Connectable Advertising State
          High Duty Cycle Directed Advertising State
          Passive Scanning State
          Active Scanning State
          Initiating State
            and Connection State (Central Role)
          Connection State (Peripheral Role)
          Scannable Advertising State
            and Passive Scanning State
          Connectable Advertising State
            and Passive Scanning State
          Non-connectable Advertising State
            and Initiating State
          Scannable Advertising State
            and Initiating State
          Active Scanning State
            and Connection State (Central Role)
          Passive Scanning State
            and Connection State (Peripheral Role)
          Active Scanning State
            and Connection State (Peripheral Role)
          Initiating State
            and Connection State (Central Role)
            and Central Role & Central Role
          Low Duty Cycle Directed Advertising State
          Connectable Advertising State
            and Initiating State
            and Central Role & Peripheral Role
          High Duty Cycle Directed Advertising State
            and Initiating State
            and Central Role & Peripheral Role
          Low Duty Cycle Directed Advertising State
            and Initiating State
            and Central Role & Peripheral Role
          Connectable Advertising State
            and Connection State (Central Role)
            and Central Role & Peripheral Role
          High Duty Cycle Directed Advertising State
            and Connection State (Central Role)
            and Central Role & Peripheral Role
          Low Duty Cycle Directed Advertising State
            and Connection State (Central Role)
            and Central Role & Peripheral Role
          Connectable Advertising State
            and Connection State (Peripheral Role)
            and Central Role & Peripheral Role
          High Duty Cycle Directed Advertising State
            and Connection State (Peripheral Role)
            and Peripheral Role & Peripheral Role
          Low Duty Cycle Directed Advertising State
            and Connection State (Peripheral Role)
            and Peripheral Role & Peripheral Role
          Initiating State
            and Connection State (Peripheral Role)
            and Central Role & Peripheral Role
< HCI Command: LE Read Maximum Data.. (0x08|0x002f) plen 0  #23 [hci1] 0.363364
> HCI Event: Command Complete (0x0e) plen 12                #24 [hci1] 0.363886
      LE Read Maximum Data Length (0x08|0x002f) ncmd 1
        Status: Success (0x00)
        Max TX octets: 251
        Max TX time: 2704
        Max RX octets: 251
        Max RX time: 2704
< HCI Command: LE Write Suggested D.. (0x08|0x0024) plen 4  #25 [hci1] 0.383388
        TX octets: 251
        TX time: 2704
> HCI Event: Command Complete (0x0e) plen 4                 #26 [hci1] 0.383877
      LE Write Suggested Default Data Length (0x08|0x0024) ncmd 1
        Status: Success (0x00)
< HCI Command: LE Read Resolving Li.. (0x08|0x002a) plen 0  #27 [hci1] 0.403370
> HCI Event: Command Complete (0x0e) plen 5                 #28 [hci1] 0.403779
      LE Read Resolving List Size (0x08|0x002a) ncmd 1
        Status: Success (0x00)
        Size: 8
< HCI Command: LE Set Event Mask (0x08|0x0001) plen 8       #29 [hci1] 0.423372
        Mask: 0x000002023f87fa5e
          LE Advertising Report
          LE Connection Update Complete
          LE Read Remote Used Features Complete
          LE Long Term Key Request
          LE Data Length Change
          LE Enhanced Connection Complete
          LE PHY Update Complete
          LE Extended Advertising Report
          LE Periodic Advertising Sync Established
          LE Periodic Advertising Report
          LE Periodic Advertising Sync Lost
          LE Extended Scan Timeout
          LE Extended Advertising Set Terminated
          LE Scan Request Received
          LE Periodic Advertising Sync Transfer Rvc
          LE CIS Established
          LE CIS Request
          LE Create BIG Complete
          LE Terminate BIG Complete
          LE BIG Sync Estabilished Complete
          LE BIG Sync Lost
          LE BIG Info Advertising Report
          Unknown mask (0x0000020000000000)
> HCI Event: Command Complete (0x0e) plen 4                 #30 [hci1] 0.423892
      LE Set Event Mask (0x08|0x0001) ncmd 1
        Status: Success (0x00)
< HCI Command: Set Event Mask (0x03|0x0001) plen 8          #31 [hci1] 0.443384
        Mask: 0x2000800002008890
          Disconnection Complete
          Encryption Change
          Read Remote Version Information Complete
          Hardware Error
          Data Buffer Overflow
          Encryption Key Refresh Complete
          LE Meta
> HCI Event: Command Complete (0x0e) plen 4                 #32 [hci1] 0.443977
      Set Event Mask (0x03|0x0001) ncmd 1
        Status: Success (0x00)
< HCI Command: Read BD ADDR (0x04|0x0009) plen 0            #33 [hci1] 0.463382
> HCI Event: Command Complete (0x0e) plen 10                #34 [hci1] 0.463848
      Read BD ADDR (0x04|0x0009) ncmd 1
        Status: Success (0x00)
        Address: 00:00:00:00:00:00 (OUI 00-00-00)
< HCI Command: LE Set Random Address (0x08|0x0005) plen 6   #35 [hci1] 0.483386
        Address: D5:B6:CC:31:DB:3B (Static)
> HCI Event: Command Complete (0x0e) plen 4                 #36 [hci1] 0.483919
      LE Set Random Address (0x08|0x0005) ncmd 1
        Status: Success (0x00)
< HCI Command: LE Set Extended Adv.. (0x08|0x0036) plen 25  #37 [hci1] 3.033948
        Handle: 0x00
        Properties: 0x0013
          Connectable
          Scannable
          Use legacy advertising PDUs: ADV_IND
        Min advertising interval: 100.000 msec (0x00a0)
        Max advertising interval: 150.000 msec (0x00f0)
        Channel map: 37, 38, 39 (0x07)
        Own address type: Random (0x01)
        Peer address type: Public (0x00)
        Peer address: 00:00:00:00:00:00 (OUI 00-00-00)
        Filter policy: Allow Scan Request from Any, Allow Connect Request from Any (0x00)
        TX power: Host has no preference (0x7f)
        Primary PHY: LE 1M (0x01)
        Secondary max skip: 0x00
        Secondary PHY: LE 1M (0x01)
        SID: 0x00
        Scan request notifications: Disabled (0x00)
> HCI Event: Command Complete (0x0e) plen 5                 #38 [hci1] 3.034829
      LE Set Extended Advertising Parameters (0x08|0x0036) ncmd 1
        Status: Success (0x00)
        TX power (selected): 0 dbm (0x00)
< HCI Command: LE Set Advertising S.. (0x08|0x0035) plen 7  #39 [hci1] 3.043774
        Advertising handle: 0x00
        Advertising random address: D5:B6:CC:31:DB:3B (Static)
> HCI Event: Command Complete (0x0e) plen 4                 #40 [hci1] 3.044405
      LE Set Advertising Set Random Address (0x08|0x0035) ncmd 1
        Status: Success (0x00)
< HCI Command: LE Set Extended Adv.. (0x08|0x0037) plen 22  #41 [hci1] 3.063497
        Handle: 0x00
        Operation: Complete extended advertising data (0x03)
        Fragment preference: Minimize fragmentation (0x01)
        Data length: 0x12
        Flags: 0x06
          LE General Discoverable Mode
          BR/EDR Not Supported
        Name (complete): Tester_F6B11A
> HCI Event: Command Complete (0x0e) plen 4                 #42 [hci1] 3.064290
      LE Set Extended Advertising Data (0x08|0x0037) ncmd 1
        Status: Success (0x00)
< HCI Command: LE Set Extended Scan.. (0x08|0x0038) plen 4  #43 [hci1] 3.083403
        Handle: 0x00
        Operation: Complete scan response data (0x03)
        Fragment preference: Minimize fragmentation (0x01)
        Data length: 0x00
> HCI Event: Command Complete (0x0e) plen 4                 #44 [hci1] 3.083893
      LE Set Extended Scan Response Data (0x08|0x0038) ncmd 1
        Status: Success (0x00)
< HCI Command: LE Set Extended Adve.. (0x08|0x0039) plen 6  #45 [hci1] 3.103404
        Extended advertising: Enabled (0x01)
        Number of sets: 1 (0x01)
        Entry 0
          Handle: 0x00
          Duration: 0 ms (0x00)
          Max ext adv events: 0
> HCI Event: Command Complete (0x0e) plen 4                 #46 [hci1] 3.104026
      LE Set Extended Advertising Enable (0x08|0x0039) ncmd 1
        Status: Success (0x00)
> HCI Event: LE Meta Event (0x3e) plen 31                   #47 [hci1] 3.214563
      LE Enhanced Connection Complete (0x0a)
        Status: Success (0x00)
        Handle: 1659
        Role: Peripheral (0x01)
        Peer address type: Public (0x00)
        Peer address: DF:A9:FF:F6:B1:1A (OUI DF-A9-FF)
        Local resolvable private address: 00:00:00:00:00:00 (Non-Resolvable)
        Peer resolvable private address: 00:00:00:00:00:00 (Non-Resolvable)
        Connection interval: 87.50 msec (0x0046)
        Connection latency: 0 (0x0000)
        Supervision timeout: 25120 msec (0x09d0)
        Central clock accuracy: 0x01
> HCI Event: LE Meta Event (0x3e) plen 6                    #48 [hci1] 3.214665
      LE Advertising Set Terminated (0x12)
        Status: Success (0x00)
        Handle: 0
        Connection handle: 1659
        Number of completed extended advertising events: 0
< HCI Command: LE Read Remote Used... (0x08|0x0016) plen 2  #49 [hci1] 3.224604
        Handle: 1659 Address: DF:A9:FF:F6:B1:1A (OUI DF-A9-FF)
< ACL Data TX: Handle 1659 flags 0x00 dlen 7                #50 [hci1] 3.224630
      ATT: Exchange MTU Request (0x02) len 2
        Client RX MTU: 251
> HCI Event: Command Status (0x0f) plen 4                   #51 [hci1] 3.225136
      LE Read Remote Used Features (0x08|0x0016) ncmd 1
        Status: Success (0x00)
> HCI Event: Number of Completed Packets (0x13) plen 5      #52 [hci1] 3.390399
        Num handles: 1
        Handle: 1659 Address: DF:A9:FF:F6:B1:1A (OUI DF-A9-FF)
        Count: 1
        #50: len 7 (0 Kb/s)
        Latency: 165 msec (165-165 msec ~165 msec)
> HCI Event: LE Meta Event (0x3e) plen 12                   #53 [hci1] 3.478342
      LE Read Remote Used Features (0x04)
        Status: Success (0x00)
        Handle: 1659 Address: DF:A9:FF:F6:B1:1A (OUI DF-A9-FF)
        Features: 0x2d 0x49 0x00 0xf7 0x67 0xd8 0x00 0x00
          LE Encryption
          Extended Reject Indication
          Peripheral-initiated Features Exchange
          LE Data Packet Length Extension
          LE 2M PHY
          LE Coded PHY
          Channel Selection Algorithm #2
          Periodic Advertising Sync Transfer - Sender
          Periodic Advertising Sync Transfer - Recipient
          Sleep Clock Accuracy Updates
          Connected Isochronous Stream - Central
          Connected Isochronous Stream - Peripheral
          Isochronous Broadcaster
          Synchronized Receiver
          Connected Isochronous Stream (Host Support)
          LE Power Control Request
          LE Power Control Request
          Connection Subrating
          Connection Subrating (Host Support)
          Unknown features (0x0000d80000000000)
> ACL Data RX: Handle 1659 flags 0x02 dlen 11               #54 [hci1] 5.928040
      SMP: Pairing Request (0x01) len 6
        IO capability: KeyboardDisplay (0x04)
        OOB data: Authentication data not present (0x00)
        Authentication requirement: Bonding, MITM, SC, No Keypresses (0x0d)
        Max encryption key size: 16
        Initiator key distribution: EncKey IdKey (0x03)
        Responder key distribution: EncKey IdKey Sign (0x07)
> ACL Data RX: Handle 1659 flags 0x02 dlen 7                #55 [hci1] 5.928403
      ATT: Exchange MTU Response (0x03) len 2
        Server RX MTU: 23
< HCI Command: Host Number of Compl.. (0x03|0x0035) plen 5  #56 [hci1] 5.943965
        Num handles: 1
        Handle: 1659 Address: DF:A9:FF:F6:B1:1A (OUI DF-A9-FF)
        Count: 1
< ACL Data TX: Handle 1659 flags 0x00 dlen 11               #57 [hci1] 5.944089
      SMP: Pairing Response (0x02) len 6
        IO capability: DisplayOnly (0x00)
        OOB data: Authentication data not present (0x00)
        Authentication requirement: Bonding, No MITM, SC, No Keypresses (0x09)
        Max encryption key size: 16
        Initiator key distribution: IdKey (0x02)
        Responder key distribution: <none> (0x00)
< HCI Command: Host Number of Compl.. (0x03|0x0035) plen 5  #58 [hci1] 5.944513
        Num handles: 1
        Handle: 1659 Address: DF:A9:FF:F6:B1:1A (OUI DF-A9-FF)
        Count: 1
> HCI Event: Number of Completed Packets (0x13) plen 5      #59 [hci1] 6.103037
        Num handles: 1
        Handle: 1659 Address: DF:A9:FF:F6:B1:1A (OUI DF-A9-FF)
        Count: 1
        #57: len 11 (0 Kb/s)
        Latency: 158 msec (158-165 msec ~162 msec)
> ACL Data RX: Handle 1659 flags 0x02 dlen 27               #60 [hci1] 6.103358
> ACL Data RX: Handle 1659 flags 0x01 dlen 27               #61 [hci1] 6.103870
> ACL Data RX: Handle 1659 flags 0x01 dlen 15               #62 [hci1] 6.104354
      SMP: Pairing Public Key (0x0c) len 64
        X: 436d713345b203379fb43a1fa1b7e2bdc437f4f9cb29e970057dd56bdd2f6190
        Y: ebdd3190510f0816b31c5c95b1551b0602dca59ce3d94d67988d599780618860
< HCI Command: Host Number of Compl.. (0x03|0x0035) plen 5  #63 [hci1] 6.124029
        Num handles: 1
        Handle: 1659 Address: DF:A9:FF:F6:B1:1A (OUI DF-A9-FF)
        Count: 1
< HCI Command: Host Number of Compl.. (0x03|0x0035) plen 5  #64 [hci1] 6.124373
        Num handles: 1
        Handle: 1659 Address: DF:A9:FF:F6:B1:1A (OUI DF-A9-FF)
        Count: 1
< HCI Command: Host Number of Compl.. (0x03|0x0035) plen 5  #65 [hci1] 6.124743
        Num handles: 1
        Handle: 1659 Address: DF:A9:FF:F6:B1:1A (OUI DF-A9-FF)
        Count: 1
< ACL Data TX: Handle 1659 flags 0x00 dlen 27               #66 [hci1] 6.124926
< ACL Data TX: Handle 1659 flags 0x01 dlen 27               #67 [hci1] 6.124944
< ACL Data TX: Handle 1659 flags 0x01 dlen 15               #68 [hci1] 6.124974
      SMP: Pairing Public Key (0x0c) len 64
        X: 98308440221e2d910f0e54b71e7ec652857aa9b5a0dc65028824cc19db1226e9
        Y: 67a4816bcb62efb21701e31fdb27561a6217575fb007a8bbdabe7e28b6f68482
> HCI Event: Number of Completed Packets (0x13) plen 5      #69 [hci1] 6.190967
        Num handles: 1
        Handle: 1659 Address: DF:A9:FF:F6:B1:1A (OUI DF-A9-FF)
        Count: 1
        #66: len 27 (3 Kb/s)
        Latency: 66 msec (66-165 msec ~114 msec)
> HCI Event: Number of Completed Packets (0x13) plen 5      #70 [hci1] 6.191554
        Num handles: 1
        Handle: 1659 Address: DF:A9:FF:F6:B1:1A (OUI DF-A9-FF)
        Count: 1
        #67: len 27 (3 Kb/s)
        Latency: 66 msec (66-165 msec ~90 msec)
> HCI Event: Number of Completed Packets (0x13) plen 5      #71 [hci1] 6.277744
        Num handles: 1
        Handle: 1659 Address: DF:A9:FF:F6:B1:1A (OUI DF-A9-FF)
        Count: 1
        #68: len 15 (0 Kb/s)
        Latency: 152 msec (66-165 msec ~121 msec)
> ACL Data RX: Handle 1659 flags 0x02 dlen 21               #72 [hci1] 7.240644
      SMP: Pairing Confirm (0x03) len 16
        Confim value: 8c593fd28f236e11aa357754e9d68504
< HCI Command: Host Number of Compl.. (0x03|0x0035) plen 5  #73 [hci1] 7.243837
        Num handles: 1
        Handle: 1659 Address: DF:A9:FF:F6:B1:1A (OUI DF-A9-FF)
        Count: 1
< ACL Data TX: Handle 1659 flags 0x00 dlen 21               #74 [hci1] 7.243958
      SMP: Pairing Confirm (0x03) len 16
        Confim value: cf4273f4c6e003b52e0f8b691779bd47
> HCI Event: Number of Completed Packets (0x13) plen 5      #75 [hci1] 7.415542
        Num handles: 1
        Handle: 1659 Address: DF:A9:FF:F6:B1:1A (OUI DF-A9-FF)
        Count: 1
        #74: len 21 (0 Kb/s)
        Latency: 171 msec (66-171 msec ~146 msec)
> ACL Data RX: Handle 1659 flags 0x02 dlen 21               #76 [hci1] 7.415800
      SMP: Pairing Random (0x04) len 16
        Random value: 2824d7f864f9dd9e0000000000000000
< HCI Command: Host Number of Compl.. (0x03|0x0035) plen 5  #77 [hci1] 7.424159
        Num handles: 1
        Handle: 1659 Address: DF:A9:FF:F6:B1:1A (OUI DF-A9-FF)
        Count: 1
< ACL Data TX: Handle 1659 flags 0x00 dlen 21               #78 [hci1] 7.424265
      SMP: Pairing Random (0x04) len 16
        Random value: 8e6108f966a694cbe26df70bb96773e6
> HCI Event: Number of Completed Packets (0x13) plen 5      #79 [hci1] 7.590168
        Num handles: 1
        Handle: 1659 Address: DF:A9:FF:F6:B1:1A (OUI DF-A9-FF)
        Count: 1
        #78: len 21 (1 Kb/s)
        Latency: 165 msec (66-171 msec ~156 msec)
> ACL Data RX: Handle 1659 flags 0x02 dlen 21               #80 [hci1] 7.678075
      SMP: Pairing Confirm (0x03) len 16
        Confim value: fcf6e9cd9b7e0d54819325d2cd921c77
< HCI Command: Host Number of Compl.. (0x03|0x0035) plen 5  #81 [hci1] 7.683771
        Num handles: 1
        Handle: 1659 Address: DF:A9:FF:F6:B1:1A (OUI DF-A9-FF)
        Count: 1
< ACL Data TX: Handle 1659 flags 0x00 dlen 21               #82 [hci1] 7.683845
      SMP: Pairing Confirm (0x03) len 16
        Confim value: 7a449ce72ac8ad2af4214e67ab6dc2df
> HCI Event: Number of Completed Packets (0x13) plen 5      #83 [hci1] 7.852916
        Num handles: 1
        Handle: 1659 Address: DF:A9:FF:F6:B1:1A (OUI DF-A9-FF)
        Count: 1
        #82: len 21 (0 Kb/s)
        Latency: 169 msec (66-171 msec ~162 msec)
> ACL Data RX: Handle 1659 flags 0x02 dlen 21               #84 [hci1] 7.853305
      SMP: Pairing Random (0x04) len 16
        Random value: b85474113805a9450000000000000000
< HCI Command: Host Number of Compl.. (0x03|0x0035) plen 5  #85 [hci1] 7.864233
        Num handles: 1
        Handle: 1659 Address: DF:A9:FF:F6:B1:1A (OUI DF-A9-FF)
        Count: 1
< ACL Data TX: Handle 1659 flags 0x00 dlen 21               #86 [hci1] 7.864386
      SMP: Pairing Random (0x04) len 16
        Random value: 4d02679f89a05211af56d8b3da64d21e
> HCI Event: Number of Completed Packets (0x13) plen 5      #87 [hci1] 8.027685
        Num handles: 1
        Handle: 1659 Address: DF:A9:FF:F6:B1:1A (OUI DF-A9-FF)
        Count: 1
        #86: len 21 (1 Kb/s)
        Latency: 163 msec (66-171 msec ~162 msec)
> ACL Data RX: Handle 1659 flags 0x02 dlen 21               #88 [hci1] 8.115589
      SMP: Pairing Confirm (0x03) len 16
        Confim value: 7628f6ed981f4fe08e2ae40bb5128a28
< HCI Command: Host Number of Compl.. (0x03|0x0035) plen 5  #89 [hci1] 8.124087
        Num handles: 1
        Handle: 1659 Address: DF:A9:FF:F6:B1:1A (OUI DF-A9-FF)
        Count: 1
< ACL Data TX: Handle 1659 flags 0x00 dlen 21               #90 [hci1] 8.124168
      SMP: Pairing Confirm (0x03) len 16
        Confim value: 6d777f8b420a8f82979f5a320dcf3f57
> HCI Event: Number of Completed Packets (0x13) plen 5      #91 [hci1] 8.290409
        Num handles: 1
        Handle: 1659 Address: DF:A9:FF:F6:B1:1A (OUI DF-A9-FF)
        Count: 1
        #90: len 21 (1 Kb/s)
        Latency: 166 msec (66-171 msec ~164 msec)
> ACL Data RX: Handle 1659 flags 0x02 dlen 21               #92 [hci1] 8.290679
      SMP: Pairing Random (0x04) len 16
        Random value: 1b990b7c80a00e450000000000000000
< HCI Command: Host Number of Compl.. (0x03|0x0035) plen 5  #93 [hci1] 8.304340
        Num handles: 1
        Handle: 1659 Address: DF:A9:FF:F6:B1:1A (OUI DF-A9-FF)
        Count: 1
< ACL Data TX: Handle 1659 flags 0x00 dlen 21               #94 [hci1] 8.304500
      SMP: Pairing Random (0x04) len 16
        Random value: 5e8286bc235a02440d0c3424a2acf8fd
> HCI Event: Number of Completed Packets (0x13) plen 5      #95 [hci1] 8.465143
        Num handles: 1
        Handle: 1659 Address: DF:A9:FF:F6:B1:1A (OUI DF-A9-FF)
        Count: 1
        #94: len 21 (1 Kb/s)
        Latency: 160 msec (66-171 msec ~162 msec)
> ACL Data RX: Handle 1659 flags 0x02 dlen 21               #96 [hci1] 8.553038
      SMP: Pairing Confirm (0x03) len 16
        Confim value: 468c29a53d982158de76199ada3c24b4
< HCI Command: Host Number of Compl.. (0x03|0x0035) plen 5  #97 [hci1] 8.563688
        Num handles: 1
        Handle: 1659 Address: DF:A9:FF:F6:B1:1A (OUI DF-A9-FF)
        Count: 1
< ACL Data TX: Handle 1659 flags 0x00 dlen 21               #98 [hci1] 8.563784
      SMP: Pairing Confirm (0x03) len 16
        Confim value: 63be0ca4ec7d24356377c8d49558c4ac
> HCI Event: Number of Completed Packets (0x13) plen 5      #99 [hci1] 8.727943
        Num handles: 1
        Handle: 1659 Address: DF:A9:FF:F6:B1:1A (OUI DF-A9-FF)
        Count: 1
        #98: len 21 (1 Kb/s)
        Latency: 164 msec (66-171 msec ~163 msec)
> ACL Data RX: Handle 1659 flags 0x02 dlen 21              #100 [hci1] 8.728278
      SMP: Pairing Random (0x04) len 16
        Random value: ac6e8c93f426ba830000000000000000
< HCI Command: Host Number of Comp.. (0x03|0x0035) plen 5  #101 [hci1] 8.744293
        Num handles: 1
        Handle: 1659 Address: DF:A9:FF:F6:B1:1A (OUI DF-A9-FF)
        Count: 1
< ACL Data TX: Handle 1659 flags 0x00 dlen 21              #102 [hci1] 8.744481
      SMP: Pairing Random (0x04) len 16
        Random value: 5c4a1bcadd27bd58e945097b00bad7ac
> HCI Event: Number of Completed Packets (0x13) plen 5     #103 [hci1] 8.902753
        Num handles: 1
        Handle: 1659 Address: DF:A9:FF:F6:B1:1A (OUI DF-A9-FF)
        Count: 1
        #102: len 21 (1 Kb/s)
        Latency: 158 msec (66-171 msec ~160 msec)
> ACL Data RX: Handle 1659 flags 0x02 dlen 21              #104 [hci1] 8.990625
      SMP: Pairing Confirm (0x03) len 16
        Confim value: c8a37adfb8e387c28a04c5d889c99dca
< HCI Command: Host Number of Comp.. (0x03|0x0035) plen 5  #105 [hci1] 9.004146
        Num handles: 1
        Handle: 1659 Address: DF:A9:FF:F6:B1:1A (OUI DF-A9-FF)
        Count: 1
< ACL Data TX: Handle 1659 flags 0x00 dlen 21              #106 [hci1] 9.004309
      SMP: Pairing Confirm (0x03) len 16
        Confim value: d0fdc08577331f8851de93fcdd5512ef
> HCI Event: Number of Completed Packets (0x13) plen 5     #107 [hci1] 9.165382
        Num handles: 1
        Handle: 1659 Address: DF:A9:FF:F6:B1:1A (OUI DF-A9-FF)
        Count: 1
        #106: len 21 (1 Kb/s)
        Latency: 161 msec (66-171 msec ~160 msec)
> ACL Data RX: Handle 1659 flags 0x02 dlen 21              #108 [hci1] 9.165689
      SMP: Pairing Random (0x04) len 16
        Random value: 2c91676a55f47f7a0000000000000000
< HCI Command: Host Number of Comp.. (0x03|0x0035) plen 5  #109 [hci1] 9.184320
        Num handles: 1
        Handle: 1659 Address: DF:A9:FF:F6:B1:1A (OUI DF-A9-FF)
        Count: 1
< ACL Data TX: Handle 1659 flags 0x00 dlen 21              #110 [hci1] 9.184526
      SMP: Pairing Random (0x04) len 16
        Random value: 32527e6e64e79f33b2e374394db8ab2d
> HCI Event: Number of Completed Packets (0x13) plen 5     #111 [hci1] 9.340102
        Num handles: 1
        Handle: 1659 Address: DF:A9:FF:F6:B1:1A (OUI DF-A9-FF)
        Count: 1
        #110: len 21 (1 Kb/s)
        Latency: 155 msec (66-171 msec ~158 msec)
> ACL Data RX: Handle 1659 flags 0x02 dlen 21              #112 [hci1] 9.428016
      SMP: Pairing Confirm (0x03) len 16
        Confim value: f33ab6ef964f887f4c9db047533c12f2
< HCI Command: Host Number of Comp.. (0x03|0x0035) plen 5  #113 [hci1] 9.443777
        Num handles: 1
        Handle: 1659 Address: DF:A9:FF:F6:B1:1A (OUI DF-A9-FF)
        Count: 1
< ACL Data TX: Handle 1659 flags 0x00 dlen 21              #114 [hci1] 9.443878
      SMP: Pairing Confirm (0x03) len 16
        Confim value: 4398d711229229ecfd6af2930a35d6a6
> HCI Event: Number of Completed Packets (0x13) plen 5     #115 [hci1] 9.602910
        Num handles: 1
        Handle: 1659 Address: DF:A9:FF:F6:B1:1A (OUI DF-A9-FF)
        Count: 1
        #114: len 21 (1 Kb/s)
        Latency: 159 msec (66-171 msec ~158 msec)
> ACL Data RX: Handle 1659 flags 0x02 dlen 21              #116 [hci1] 9.603251
      SMP: Pairing Random (0x04) len 16
        Random value: 25c8b165f2a3502c0000000000000000
< HCI Command: Host Number of Comp.. (0x03|0x0035) plen 5  #117 [hci1] 9.604109
        Num handles: 1
        Handle: 1659 Address: DF:A9:FF:F6:B1:1A (OUI DF-A9-FF)
        Count: 1
< ACL Data TX: Handle 1659 flags 0x00 dlen 21              #118 [hci1] 9.604309
      SMP: Pairing Random (0x04) len 16
        Random value: dddbdfe2838e9a8cc6964353c850fef7
> HCI Event: Number of Completed Packets (0x13) plen 5     #119 [hci1] 9.777607
        Num handles: 1
        Handle: 1659 Address: DF:A9:FF:F6:B1:1A (OUI DF-A9-FF)
        Count: 1
        #118: len 21 (0 Kb/s)
        Latency: 173 msec (66-173 msec ~165 msec)
> ACL Data RX: Handle 1659 flags 0x02 dlen 21              #120 [hci1] 9.865577
      SMP: Pairing Confirm (0x03) len 16
        Confim value: 998315f4c887a226f7c05289f9d6f954
< HCI Command: Host Number of Comp.. (0x03|0x0035) plen 5  #121 [hci1] 9.884015
        Num handles: 1
        Handle: 1659 Address: DF:A9:FF:F6:B1:1A (OUI DF-A9-FF)
        Count: 1
< ACL Data TX: Handle 1659 flags 0x00 dlen 21              #122 [hci1] 9.884097
      SMP: Pairing Confirm (0x03) len 16
        Confim value: d879b0304c9ff456642e632912104ad0
> HCI Event: Number of Completed Packets (0x13) plen 5    #123 [hci1] 10.040331
        Num handles: 1
        Handle: 1659 Address: DF:A9:FF:F6:B1:1A (OUI DF-A9-FF)
        Count: 1
        #122: len 21 (1 Kb/s)
        Latency: 156 msec (66-173 msec ~161 msec)
> ACL Data RX: Handle 1659 flags 0x02 dlen 21             #124 [hci1] 10.040722
      SMP: Pairing Random (0x04) len 16
        Random value: 5239eae80d9eab870000000000000000
< HCI Command: Host Number of Com.. (0x03|0x0035) plen 5  #125 [hci1] 10.043653
        Num handles: 1
        Handle: 1659 Address: DF:A9:FF:F6:B1:1A (OUI DF-A9-FF)
        Count: 1
< ACL Data TX: Handle 1659 flags 0x00 dlen 21             #126 [hci1] 10.043708
      SMP: Pairing Random (0x04) len 16
        Random value: eb9f1915536596b6fc3db1c86b2b1970
> HCI Event: Number of Completed Packets (0x13) plen 5    #127 [hci1] 10.215162
        Num handles: 1
        Handle: 1659 Address: DF:A9:FF:F6:B1:1A (OUI DF-A9-FF)
        Count: 1
        #126: len 21 (0 Kb/s)
        Latency: 171 msec (66-173 msec ~166 msec)
> ACL Data RX: Handle 1659 flags 0x02 dlen 21             #128 [hci1] 10.302954
      SMP: Pairing Confirm (0x03) len 16
        Confim value: 678627c3c4ecc4bff59d9fdce4dabb2c
< HCI Command: Host Number of Com.. (0x03|0x0035) plen 5  #129 [hci1] 10.303926
        Num handles: 1
        Handle: 1659 Address: DF:A9:FF:F6:B1:1A (OUI DF-A9-FF)
        Count: 1
< ACL Data TX: Handle 1659 flags 0x00 dlen 21             #130 [hci1] 10.304033
      SMP: Pairing Confirm (0x03) len 16
        Confim value: c0a6f5c8758ca011ed71574792c4955d
> HCI Event: Number of Completed Packets (0x13) plen 5    #131 [hci1] 10.477818
        Num handles: 1
        Handle: 1659 Address: DF:A9:FF:F6:B1:1A (OUI DF-A9-FF)
        Count: 1
        #130: len 21 (0 Kb/s)
        Latency: 173 msec (66-173 msec ~170 msec)
> ACL Data RX: Handle 1659 flags 0x02 dlen 21             #132 [hci1] 10.478191
      SMP: Pairing Random (0x04) len 16
        Random value: 1a5b9933ece110050000000000000000
< HCI Command: Host Number of Com.. (0x03|0x0035) plen 5  #133 [hci1] 10.484254
        Num handles: 1
        Handle: 1659 Address: DF:A9:FF:F6:B1:1A (OUI DF-A9-FF)
        Count: 1
< ACL Data TX: Handle 1659 flags 0x00 dlen 21             #134 [hci1] 10.484332
      SMP: Pairing Random (0x04) len 16
        Random value: 5c794dc9ad9f2c3f295ebd5ad5e1c3cf
> HCI Event: Number of Completed Packets (0x13) plen 5    #135 [hci1] 10.652651
        Num handles: 1
        Handle: 1659 Address: DF:A9:FF:F6:B1:1A (OUI DF-A9-FF)
        Count: 1
        #134: len 21 (1 Kb/s)
        Latency: 168 msec (66-173 msec ~169 msec)
> ACL Data RX: Handle 1659 flags 0x02 dlen 21             #136 [hci1] 10.740498
      SMP: Pairing Confirm (0x03) len 16
        Confim value: c265fb177b48602091ce4179ec9e6646
< HCI Command: Host Number of Com.. (0x03|0x0035) plen 5  #137 [hci1] 10.744106
        Num handles: 1
        Handle: 1659 Address: DF:A9:FF:F6:B1:1A (OUI DF-A9-FF)
        Count: 1
< ACL Data TX: Handle 1659 flags 0x00 dlen 21             #138 [hci1] 10.744273
      SMP: Pairing Confirm (0x03) len 16
        Confim value: 7c766a934908a8db4874b6053a21005c
> HCI Event: Number of Completed Packets (0x13) plen 5    #139 [hci1] 10.915391
        Num handles: 1
        Handle: 1659 Address: DF:A9:FF:F6:B1:1A (OUI DF-A9-FF)
        Count: 1
        #138: len 21 (0 Kb/s)
        Latency: 171 msec (66-173 msec ~170 msec)
> ACL Data RX: Handle 1659 flags 0x02 dlen 21             #140 [hci1] 10.915642
      SMP: Pairing Random (0x04) len 16
        Random value: ca373a519c4bf1990000000000000000
< HCI Command: Host Number of Com.. (0x03|0x0035) plen 5  #141 [hci1] 10.924360
        Num handles: 1
        Handle: 1659 Address: DF:A9:FF:F6:B1:1A (OUI DF-A9-FF)
        Count: 1
< ACL Data TX: Handle 1659 flags 0x00 dlen 21             #142 [hci1] 10.924444
      SMP: Pairing Random (0x04) len 16
        Random value: 5c2fff312cdf99c9491988e877355a9a
> HCI Event: Number of Completed Packets (0x13) plen 5    #143 [hci1] 11.090052
        Num handles: 1
        Handle: 1659 Address: DF:A9:FF:F6:B1:1A (OUI DF-A9-FF)
        Count: 1
        #142: len 21 (1 Kb/s)
        Latency: 165 msec (66-173 msec ~167 msec)
> ACL Data RX: Handle 1659 flags 0x02 dlen 21             #144 [hci1] 11.177947
      SMP: Pairing Confirm (0x03) len 16
        Confim value: 3c946f9761afd07b8e8b1d10ffc6bf53
< HCI Command: Host Number of Com.. (0x03|0x0035) plen 5  #145 [hci1] 11.183709
        Num handles: 1
        Handle: 1659 Address: DF:A9:FF:F6:B1:1A (OUI DF-A9-FF)
        Count: 1
< ACL Data TX: Handle 1659 flags 0x00 dlen 21             #146 [hci1] 11.183805
      SMP: Pairing Confirm (0x03) len 16
        Confim value: cfce5c02edb09a1178ca87a48199e9a0
> HCI Event: Number of Completed Packets (0x13) plen 5    #147 [hci1] 11.352816
        Num handles: 1
        Handle: 1659 Address: DF:A9:FF:F6:B1:1A (OUI DF-A9-FF)
        Count: 1
        #146: len 21 (0 Kb/s)
        Latency: 169 msec (66-173 msec ~168 msec)
> ACL Data RX: Handle 1659 flags 0x02 dlen 21             #148 [hci1] 11.353233
      SMP: Pairing Random (0x04) len 16
        Random value: 4a42f119a999667f0000000000000000
< HCI Command: Host Number of Com.. (0x03|0x0035) plen 5  #149 [hci1] 11.363670
        Num handles: 1
        Handle: 1659 Address: DF:A9:FF:F6:B1:1A (OUI DF-A9-FF)
        Count: 1
< ACL Data TX: Handle 1659 flags 0x00 dlen 21             #150 [hci1] 11.363777
      SMP: Pairing Random (0x04) len 16
        Random value: c629a3a987d808e808655d558dfc1155
> HCI Event: Number of Completed Packets (0x13) plen 5    #151 [hci1] 11.527562
        Num handles: 1
        Handle: 1659 Address: DF:A9:FF:F6:B1:1A (OUI DF-A9-FF)
        Count: 1
        #150: len 21 (1 Kb/s)
        Latency: 163 msec (66-173 msec ~166 msec)
> ACL Data RX: Handle 1659 flags 0x02 dlen 21             #152 [hci1] 11.615571
      SMP: Pairing Confirm (0x03) len 16
        Confim value: c5cc84f8798f654edf25089a16e4aedf
< HCI Command: Host Number of Com.. (0x03|0x0035) plen 5  #153 [hci1] 11.624057
        Num handles: 1
        Handle: 1659 Address: DF:A9:FF:F6:B1:1A (OUI DF-A9-FF)
        Count: 1
< ACL Data TX: Handle 1659 flags 0x00 dlen 21             #154 [hci1] 11.624161
      SMP: Pairing Confirm (0x03) len 16
        Confim value: a51c36d8e0ab2cd5738e8dd003f42128
> HCI Event: Number of Completed Packets (0x13) plen 5    #155 [hci1] 11.790257
        Num handles: 1
        Handle: 1659 Address: DF:A9:FF:F6:B1:1A (OUI DF-A9-FF)
        Count: 1
        #154: len 21 (1 Kb/s)
        Latency: 166 msec (66-173 msec ~166 msec)
> ACL Data RX: Handle 1659 flags 0x02 dlen 21             #156 [hci1] 11.790653
      SMP: Pairing Random (0x04) len 16
        Random value: 4d33c4d78987606d0000000000000000
< HCI Command: Host Number of Com.. (0x03|0x0035) plen 5  #157 [hci1] 11.804367
        Num handles: 1
        Handle: 1659 Address: DF:A9:FF:F6:B1:1A (OUI DF-A9-FF)
        Count: 1
< ACL Data TX: Handle 1659 flags 0x00 dlen 21             #158 [hci1] 11.804533
      SMP: Pairing Random (0x04) len 16
        Random value: 92f20f6ad8f13724432c7fd6001c45ff
> HCI Event: Number of Completed Packets (0x13) plen 5    #159 [hci1] 11.965053
        Num handles: 1
        Handle: 1659 Address: DF:A9:FF:F6:B1:1A (OUI DF-A9-FF)
        Count: 1
        #158: len 21 (1 Kb/s)
        Latency: 160 msec (66-173 msec ~163 msec)
> ACL Data RX: Handle 1659 flags 0x02 dlen 21             #160 [hci1] 12.052938
      SMP: Pairing Confirm (0x03) len 16
        Confim value: 79f0153b838f5ed2352e922ffa544dfc
< HCI Command: Host Number of Com.. (0x03|0x0035) plen 5  #161 [hci1] 12.063782
        Num handles: 1
        Handle: 1659 Address: DF:A9:FF:F6:B1:1A (OUI DF-A9-FF)
        Count: 1
< ACL Data TX: Handle 1659 flags 0x00 dlen 21             #162 [hci1] 12.063864
      SMP: Pairing Confirm (0x03) len 16
        Confim value: 3c643a7355477c6879acd368092e39fb
> HCI Event: Number of Completed Packets (0x13) plen 5    #163 [hci1] 12.227795
        Num handles: 1
        Handle: 1659 Address: DF:A9:FF:F6:B1:1A (OUI DF-A9-FF)
        Count: 1
        #162: len 21 (1 Kb/s)
        Latency: 163 msec (66-173 msec ~163 msec)
> ACL Data RX: Handle 1659 flags 0x02 dlen 21             #164 [hci1] 12.228079
      SMP: Pairing Random (0x04) len 16
        Random value: 032bcbaede8f62800000000000000000
< HCI Command: Host Number of Com.. (0x03|0x0035) plen 5  #165 [hci1] 12.243964
        Num handles: 1
        Handle: 1659 Address: DF:A9:FF:F6:B1:1A (OUI DF-A9-FF)
        Count: 1
< ACL Data TX: Handle 1659 flags 0x00 dlen 21             #166 [hci1] 12.244053
      SMP: Pairing Random (0x04) len 16
        Random value: 23ac32ebbb5e14c8a6b9622f296d277f
> HCI Event: Number of Completed Packets (0x13) plen 5    #167 [hci1] 12.402588
        Num handles: 1
        Handle: 1659 Address: DF:A9:FF:F6:B1:1A (OUI DF-A9-FF)
        Count: 1
        #166: len 21 (1 Kb/s)
        Latency: 158 msec (66-173 msec ~161 msec)
> ACL Data RX: Handle 1659 flags 0x02 dlen 21             #168 [hci1] 12.490382
      SMP: Pairing Confirm (0x03) len 16
        Confim value: 21006cbd8e55436f595348a09a126b46
< HCI Command: Host Number of Com.. (0x03|0x0035) plen 5  #169 [hci1] 12.503996
        Num handles: 1
        Handle: 1659 Address: DF:A9:FF:F6:B1:1A (OUI DF-A9-FF)
        Count: 1
< ACL Data TX: Handle 1659 flags 0x00 dlen 21             #170 [hci1] 12.504216
      SMP: Pairing Confirm (0x03) len 16
        Confim value: bf86392a32817f36e74a90e4edc73a77
> HCI Event: Number of Completed Packets (0x13) plen 5    #171 [hci1] 12.665351
        Num handles: 1
        Handle: 1659 Address: DF:A9:FF:F6:B1:1A (OUI DF-A9-FF)
        Count: 1
        #170: len 21 (1 Kb/s)
        Latency: 161 msec (66-173 msec ~161 msec)
> ACL Data RX: Handle 1659 flags 0x02 dlen 21             #172 [hci1] 12.665585
      SMP: Pairing Random (0x04) len 16
        Random value: da194525949f16190000000000000000
< HCI Command: Host Number of Com.. (0x03|0x0035) plen 5  #173 [hci1] 12.684465
        Num handles: 1
        Handle: 1659 Address: DF:A9:FF:F6:B1:1A (OUI DF-A9-FF)
        Count: 1
< ACL Data TX: Handle 1659 flags 0x00 dlen 21             #174 [hci1] 12.684574
      SMP: Pairing Random (0x04) len 16
        Random value: 297efe85e67448a15f56bd27e3a3cf1d
> HCI Event: Number of Completed Packets (0x13) plen 5    #175 [hci1] 12.839997
        Num handles: 1
        Handle: 1659 Address: DF:A9:FF:F6:B1:1A (OUI DF-A9-FF)
        Count: 1
        #174: len 21 (1 Kb/s)
        Latency: 155 msec (66-173 msec ~158 msec)
> ACL Data RX: Handle 1659 flags 0x02 dlen 21             #176 [hci1] 12.927917
      SMP: Pairing Confirm (0x03) len 16
        Confim value: 7c22a306f4a95155f0d4568f004dab51
< HCI Command: Host Number of Com.. (0x03|0x0035) plen 5  #177 [hci1] 12.944038
        Num handles: 1
        Handle: 1659 Address: DF:A9:FF:F6:B1:1A (OUI DF-A9-FF)
        Count: 1
< ACL Data TX: Handle 1659 flags 0x00 dlen 21             #178 [hci1] 12.944165
      SMP: Pairing Confirm (0x03) len 16
        Confim value: d2e96bcc960a5f3625f8e40a5a4fd69e
> HCI Event: Number of Completed Packets (0x13) plen 5    #179 [hci1] 13.102755
        Num handles: 1
        Handle: 1659 Address: DF:A9:FF:F6:B1:1A (OUI DF-A9-FF)
        Count: 1
        #178: len 21 (1 Kb/s)
        Latency: 158 msec (66-173 msec ~158 msec)
> ACL Data RX: Handle 1659 flags 0x02 dlen 21             #180 [hci1] 13.103069
      SMP: Pairing Random (0x04) len 16
        Random value: 0356d909c09fcfbc0000000000000000
< HCI Command: Host Number of Com.. (0x03|0x0035) plen 5  #181 [hci1] 13.103578
        Num handles: 1
        Handle: 1659 Address: DF:A9:FF:F6:B1:1A (OUI DF-A9-FF)
        Count: 1
< ACL Data TX: Handle 1659 flags 0x00 dlen 21             #182 [hci1] 13.103650
      SMP: Pairing Random (0x04) len 16
        Random value: 25a9493fd3ce4faf02be7293595bb7c6
> HCI Event: Number of Completed Packets (0x13) plen 5    #183 [hci1] 13.277517
        Num handles: 1
        Handle: 1659 Address: DF:A9:FF:F6:B1:1A (OUI DF-A9-FF)
        Count: 1
        #182: len 21 (0 Kb/s)
        Latency: 173 msec (66-173 msec ~166 msec)
> ACL Data RX: Handle 1659 flags 0x02 dlen 21             #184 [hci1] 13.365369
      SMP: Pairing Confirm (0x03) len 16
        Confim value: 0ddab27dcccc053713ea8dd609769ed1
< HCI Command: Host Number of Com.. (0x03|0x0035) plen 5  #185 [hci1] 13.384002
        Num handles: 1
        Handle: 1659 Address: DF:A9:FF:F6:B1:1A (OUI DF-A9-FF)
        Count: 1
< ACL Data TX: Handle 1659 flags 0x00 dlen 21             #186 [hci1] 13.384083
      SMP: Pairing Confirm (0x03) len 16
        Confim value: 3bd1bb8996879b3dd601f615308aee95
> HCI Event: Number of Completed Packets (0x13) plen 5    #187 [hci1] 13.540395
        Num handles: 1
        Handle: 1659 Address: DF:A9:FF:F6:B1:1A (OUI DF-A9-FF)
        Count: 1
        #186: len 21 (1 Kb/s)
        Latency: 156 msec (66-173 msec ~161 msec)
> ACL Data RX: Handle 1659 flags 0x02 dlen 21             #188 [hci1] 13.540513
      SMP: Pairing Random (0x04) len 16
        Random value: ad4728b8d25dcac90000000000000000
< HCI Command: Host Number of Com.. (0x03|0x0035) plen 5  #189 [hci1] 13.544191
        Num handles: 1
        Handle: 1659 Address: DF:A9:FF:F6:B1:1A (OUI DF-A9-FF)
        Count: 1
< ACL Data TX: Handle 1659 flags 0x00 dlen 21             #190 [hci1] 13.544348
      SMP: Pairing Random (0x04) len 16
        Random value: 58f6b41f855a6f6c3560debd84e2affc
> HCI Event: Number of Completed Packets (0x13) plen 5    #191 [hci1] 13.715007
        Num handles: 1
        Handle: 1659 Address: DF:A9:FF:F6:B1:1A (OUI DF-A9-FF)
        Count: 1
        #190: len 21 (0 Kb/s)
        Latency: 170 msec (66-173 msec ~165 msec)
> ACL Data RX: Handle 1659 flags 0x02 dlen 21             #192 [hci1] 13.802810
      SMP: Pairing Confirm (0x03) len 16
        Confim value: f3093f7b7bd4ab3de813a03e942f89b7
< HCI Command: Host Number of Com.. (0x03|0x0035) plen 5  #193 [hci1] 13.803765
        Num handles: 1
        Handle: 1659 Address: DF:A9:FF:F6:B1:1A (OUI DF-A9-FF)
        Count: 1
< ACL Data TX: Handle 1659 flags 0x00 dlen 21             #194 [hci1] 13.803865
      SMP: Pairing Confirm (0x03) len 16
        Confim value: a97bbbbb3cb786d673342657ab8f02db
> HCI Event: Number of Completed Packets (0x13) plen 5    #195 [hci1] 13.977674
        Num handles: 1
        Handle: 1659 Address: DF:A9:FF:F6:B1:1A (OUI DF-A9-FF)
        Count: 1
        #194: len 21 (0 Kb/s)
        Latency: 173 msec (66-173 msec ~169 msec)
> ACL Data RX: Handle 1659 flags 0x02 dlen 21             #196 [hci1] 13.978041
      SMP: Pairing Random (0x04) len 16
        Random value: 6717c63d22abf2100000000000000000
< HCI Command: Host Number of Com.. (0x03|0x0035) plen 5  #197 [hci1] 13.984426
        Num handles: 1
        Handle: 1659 Address: DF:A9:FF:F6:B1:1A (OUI DF-A9-FF)
        Count: 1
< ACL Data TX: Handle 1659 flags 0x00 dlen 21             #198 [hci1] 13.984568
      SMP: Pairing Random (0x04) len 16
        Random value: b67e7216d5bf664139eda2b542549666
> HCI Event: Number of Completed Packets (0x13) plen 5    #199 [hci1] 14.152467
        Num handles: 1
        Handle: 1659 Address: DF:A9:FF:F6:B1:1A (OUI DF-A9-FF)
        Count: 1
        #198: len 21 (1 Kb/s)
        Latency: 167 msec (66-173 msec ~168 msec)
> ACL Data RX: Handle 1659 flags 0x02 dlen 21             #200 [hci1] 14.240436
      SMP: Pairing Confirm (0x03) len 16
        Confim value: 97e7f11321b154087f7fec48de6ed70a
< HCI Command: Host Number of Com.. (0x03|0x0035) plen 5  #201 [hci1] 14.244034
        Num handles: 1
        Handle: 1659 Address: DF:A9:FF:F6:B1:1A (OUI DF-A9-FF)
        Count: 1
< ACL Data TX: Handle 1659 flags 0x00 dlen 21             #202 [hci1] 14.244124
      SMP: Pairing Confirm (0x03) len 16
        Confim value: 8e87d39258264069164ba2c06025bcc4
> HCI Event: Number of Completed Packets (0x13) plen 5    #203 [hci1] 14.415201
        Num handles: 1
        Handle: 1659 Address: DF:A9:FF:F6:B1:1A (OUI DF-A9-FF)
        Count: 1
        #202: len 21 (0 Kb/s)
        Latency: 171 msec (66-173 msec ~169 msec)
> ACL Data RX: Handle 1659 flags 0x02 dlen 21             #204 [hci1] 14.415483
      SMP: Pairing Random (0x04) len 16
        Random value: ca946bd101e4527b0000000000000000
< HCI Command: Host Number of Com.. (0x03|0x0035) plen 5  #205 [hci1] 14.424467
        Num handles: 1
        Handle: 1659 Address: DF:A9:FF:F6:B1:1A (OUI DF-A9-FF)
        Count: 1
< ACL Data TX: Handle 1659 flags 0x00 dlen 21             #206 [hci1] 14.424644
      SMP: Pairing Random (0x04) len 16
        Random value: ed17f76500c95219dd01e09d1e63f87b
> HCI Event: Number of Completed Packets (0x13) plen 5    #207 [hci1] 14.590004
        Num handles: 1
        Handle: 1659 Address: DF:A9:FF:F6:B1:1A (OUI DF-A9-FF)
        Count: 1
        #206: len 21 (1 Kb/s)
        Latency: 165 msec (66-173 msec ~167 msec)
> ACL Data RX: Handle 1659 flags 0x02 dlen 21             #208 [hci1] 14.677843
      SMP: Pairing Confirm (0x03) len 16
        Confim value: ff25ab164c7fed706397bdee4484be8e
< HCI Command: Host Number of Com.. (0x03|0x0035) plen 5  #209 [hci1] 14.683957
        Num handles: 1
        Handle: 1659 Address: DF:A9:FF:F6:B1:1A (OUI DF-A9-FF)
        Count: 1
< ACL Data TX: Handle 1659 flags 0x00 dlen 21             #210 [hci1] 14.684098
      SMP: Pairing Confirm (0x03) len 16
        Confim value: 50831e66af4a7a0cfeb97104cacfdcee
> HCI Event: Number of Completed Packets (0x13) plen 5    #211 [hci1] 14.852763
        Num handles: 1
        Handle: 1659 Address: DF:A9:FF:F6:B1:1A (OUI DF-A9-FF)
        Count: 1
        #210: len 21 (1 Kb/s)
        Latency: 168 msec (66-173 msec ~168 msec)
> ACL Data RX: Handle 1659 flags 0x02 dlen 21             #212 [hci1] 14.853087
      SMP: Pairing Random (0x04) len 16
        Random value: d455320f2622c8760000000000000000
< HCI Command: Host Number of Com.. (0x03|0x0035) plen 5  #213 [hci1] 14.864374
        Num handles: 1
        Handle: 1659 Address: DF:A9:FF:F6:B1:1A (OUI DF-A9-FF)
        Count: 1
< ACL Data TX: Handle 1659 flags 0x00 dlen 21             #214 [hci1] 14.864526
      SMP: Pairing Random (0x04) len 16
        Random value: 81d35d47e1f6006d79c974bd9d9e1ee3
> HCI Event: Number of Completed Packets (0x13) plen 5    #215 [hci1] 15.027496
        Num handles: 1
        Handle: 1659 Address: DF:A9:FF:F6:B1:1A (OUI DF-A9-FF)
        Count: 1
        #214: len 21 (1 Kb/s)
        Latency: 162 msec (66-173 msec ~165 msec)
> ACL Data RX: Handle 1659 flags 0x02 dlen 21             #216 [hci1] 15.115349
      SMP: Pairing Confirm (0x03) len 16
        Confim value: 27f061e81a76215e71c50d7407c2a8a2
< HCI Command: Host Number of Com.. (0x03|0x0035) plen 5  #217 [hci1] 15.124061
        Num handles: 1
        Handle: 1659 Address: DF:A9:FF:F6:B1:1A (OUI DF-A9-FF)
        Count: 1
< ACL Data TX: Handle 1659 flags 0x00 dlen 21             #218 [hci1] 15.124159
      SMP: Pairing Confirm (0x03) len 16
        Confim value: 99f0cb36c03cee43af55b5ca10974223
> HCI Event: Number of Completed Packets (0x13) plen 5    #219 [hci1] 15.290227
        Num handles: 1
        Handle: 1659 Address: DF:A9:FF:F6:B1:1A (OUI DF-A9-FF)
        Count: 1
        #218: len 21 (1 Kb/s)
        Latency: 166 msec (66-173 msec ~165 msec)
> ACL Data RX: Handle 1659 flags 0x02 dlen 21             #220 [hci1] 15.290536
      SMP: Pairing Random (0x04) len 16
        Random value: 2206119ca7055ca10000000000000000
< HCI Command: Host Number of Com.. (0x03|0x0035) plen 5  #221 [hci1] 15.304278
        Num handles: 1
        Handle: 1659 Address: DF:A9:FF:F6:B1:1A (OUI DF-A9-FF)
        Count: 1
< ACL Data TX: Handle 1659 flags 0x00 dlen 21             #222 [hci1] 15.304472
      SMP: Pairing Random (0x04) len 16
        Random value: e7f7e0c2476823e41736a7e381bafb7c
> HCI Event: Number of Completed Packets (0x13) plen 5    #223 [hci1] 15.464967
        Num handles: 1
        Handle: 1659 Address: DF:A9:FF:F6:B1:1A (OUI DF-A9-FF)
        Count: 1
        #222: len 21 (1 Kb/s)
        Latency: 160 msec (66-173 msec ~163 msec)
> ACL Data RX: Handle 1659 flags 0x02 dlen 21             #224 [hci1] 15.552891
      SMP: Pairing Confirm (0x03) len 16
        Confim value: 0fec9955311c1811051498d097ffced2
< HCI Command: Host Number of Com.. (0x03|0x0035) plen 5  #225 [hci1] 15.564117
        Num handles: 1
        Handle: 1659 Address: DF:A9:FF:F6:B1:1A (OUI DF-A9-FF)
        Count: 1
< ACL Data TX: Handle 1659 flags 0x00 dlen 21             #226 [hci1] 15.564273
      SMP: Pairing Confirm (0x03) len 16
        Confim value: d20dc65a5fb112dc8938b07d83f6f318
> HCI Event: Number of Completed Packets (0x13) plen 5    #227 [hci1] 15.727695
        Num handles: 1
        Handle: 1659 Address: DF:A9:FF:F6:B1:1A (OUI DF-A9-FF)
        Count: 1
        #226: len 21 (1 Kb/s)
        Latency: 163 msec (66-173 msec ~163 msec)
> ACL Data RX: Handle 1659 flags 0x02 dlen 21             #228 [hci1] 15.727979
      SMP: Pairing Random (0x04) len 16
        Random value: 9728383f57b2ad0e0000000000000000
