Bluetooth monitor ver 5.72
btmon[2316999]: = Note: Linux version 6.14.0-36-generic (x86_64)                                                         0.857643
btmon[2316999]: = Note: Bluetooth subsystem version 2.22                                                                 0.857645
= New Index: 00:00:00:00:00:00 (Primary,UART,hci1)                                                                       0.857645
= New Index: 48:5F:99:8E:E0:64 (Primary,USB,hci0)                                                                        0.857646
= Open Index: 00:00:00:00:00:00                                                                                          1.371596
= Index Info: 00:00:00:00:00:00 (Nordic Semiconductor ASA)                                                               1.371611
zephyr.exe[2317001]: @ USER Open: main (privileged) version 2.22                                                {0x0001} 1.371620
zephyr.exe[2317001]: < HCI Command: Reset (0x03|0x0003) plen 0                                                        #1 1.372891
> HCI Event: Command Complete (0x0e) plen 4                                                                           #2 1.373395
      Reset (0x03|0x0003) ncmd 1
        Status: Success (0x00)
zephyr.exe[2317001]: < HCI Command: Read Local Supported Features (0x04|0x0003) plen 0                                #3 1.391156
> HCI Event: Command Complete (0x0e) plen 12                                                                          #4 1.391758
      Read Local Supported Features (0x04|0x0003) ncmd 1
        Status: Success (0x00)
        Features: 0x00 0x00 0x00 0x00 0x60 0x00 0x00 0x00
          BR/EDR Not Supported
          LE Supported (Controller)
zephyr.exe[2317001]: < HCI Command: Read Local Version Information (0x04|0x0001) plen 0                               #5 1.411062
> HCI Event: Command Complete (0x0e) plen 12                                                                          #6 1.411554
      Read Local Version Information (0x04|0x0001) ncmd 1
        Status: Success (0x00)
        HCI version: Reserved (0x0f) - Revision 12393 (0x3069)
        LMP version: Reserved (0x0f) - Subversion 12393 (0x3069)
        Manufacturer: Nordic Semiconductor ASA (89)
zephyr.exe[2317001]: < HCI Command: Read Local Supported Commands (0x04|0x0002) plen 0                                #7 1.431020
> HCI Event: Command Complete (0x0e) plen 68                                                                          #8 1.432156
      Read Local Supported Commands (0x04|0x0002) ncmd 1
        Status: Success (0x00)
        Commands: 119 entries
          Disconnect (Octet 0 - Bit 5)
          Read Remote Version Information (Octet 2 - Bit 7)
          Set Event Mask (Octet 5 - Bit 6)
          Reset (Octet 5 - Bit 7)
          Read Connection Accept Timeout (Octet 7 - Bit 2)
          Write Connection Accept Timeout (Octet 7 - Bit 3)
          Read Transmit Power Level (Octet 10 - Bit 2)
          Set Controller To Host Flow Control (Octet 10 - Bit 5)
          Host Buffer Size (Octet 10 - Bit 6)
          Host Number of Completed Packets (Octet 10 - Bit 7)
          Read Local Version Information (Octet 14 - Bit 3)
          Read Local Supported Features (Octet 14 - Bit 5)
          Read BD ADDR (Octet 15 - Bit 1)
          Read RSSI (Octet 15 - Bit 5)
          Set Event Mask Page 2 (Octet 22 - Bit 2)
          LE Set Event Mask (Octet 25 - Bit 0)
          LE Read Buffer Size (Octet 25 - Bit 1)
          LE Read Local Supported Features (Octet 25 - Bit 2)
          LE Set Random Address (Octet 25 - Bit 4)
          LE Set Advertising Parameters (Octet 25 - Bit 5)
          LE Read Advertising Channel TX Power (Octet 25 - Bit 6)
          LE Set Advertising Data (Octet 25 - Bit 7)
          LE Set Scan Response Data (Octet 26 - Bit 0)
          LE Set Advertise Enable (Octet 26 - Bit 1)
          LE Set Scan Parameters (Octet 26 - Bit 2)
          LE Set Scan Enable (Octet 26 - Bit 3)
          LE Create Connection (Octet 26 - Bit 4)
          LE Create Connection Cancel (Octet 26 - Bit 5)
          LE Read Accept List Size (Octet 26 - Bit 6)
          LE Clear Accept List (Octet 26 - Bit 7)
          LE Add Device To Accept List (Octet 27 - Bit 0)
          LE Remove Device From Accept List (Octet 27 - Bit 1)
          LE Connection Update (Octet 27 - Bit 2)
          LE Set Host Channel Classification (Octet 27 - Bit 3)
          LE Read Channel Map (Octet 27 - Bit 4)
          LE Read Remote Used Features (Octet 27 - Bit 5)
          LE Encrypt (Octet 27 - Bit 6)
          LE Rand (Octet 27 - Bit 7)
          LE Start Encryption (Octet 28 - Bit 0)
          LE Long Term Key Request Reply (Octet 28 - Bit 1)
          LE Long Term Key Request Neg Reply (Octet 28 - Bit 2)
          LE Read Supported States (Octet 28 - Bit 3)
          LE Receiver Test (Octet 28 - Bit 4)
          LE Transmitter Test (Octet 28 - Bit 5)
          LE Test End (Octet 28 - Bit 6)
          Read Authenticated Payload Timeout (Octet 32 - Bit 4)
          Write Authenticated Payload Timeout (Octet 32 - Bit 5)
          LE Set Data Length (Octet 33 - Bit 6)
          LE Read Suggested Default Data Length (Octet 33 - Bit 7)
          LE Write Suggested Default Data Length (Octet 34 - Bit 0)
          LE Add Device To Resolving List (Octet 34 - Bit 3)
          LE Remove Device From Resolving List (Octet 34 - Bit 4)
          LE Clear Resolving List (Octet 34 - Bit 5)
          LE Read Resolving List Size (Octet 34 - Bit 6)
          LE Set Address Resolution Enable (Octet 35 - Bit 1)
          LE Set Resolvable Private Address Timeout (Octet 35 - Bit 2)
          LE Read Maximum Data Length (Octet 35 - Bit 3)
          LE Read PHY (Octet 35 - Bit 4)
          LE Set Default PHY (Octet 35 - Bit 5)
          LE Set PHY (Octet 35 - Bit 6)
          LE Enhanced Receiver Test (Octet 35 - Bit 7)
          LE Enhanced Transmitter Test (Octet 36 - Bit 0)
          LE Set Advertising Set Random Address (Octet 36 - Bit 1)
          LE Set Extended Advertising Parameters (Octet 36 - Bit 2)
          LE Set Extended Advertising Data (Octet 36 - Bit 3)
          LE Set Extended Scan Response Data (Octet 36 - Bit 4)
          LE Set Extended Advertising Enable (Octet 36 - Bit 5)
          LE Read Maximum Advertising Data Length (Octet 36 - Bit 6)
          LE Read Number of Supported Advertising Sets (Octet 36 - Bit 7)
          LE Remove Advertising Set (Octet 37 - Bit 0)
          LE Clear Advertising Sets (Octet 37 - Bit 1)
          LE Set Periodic Advertising Parameters (Octet 37 - Bit 2)
          LE Set Periodic Advertising Data (Octet 37 - Bit 3)
          LE Set Periodic Advertising Enable (Octet 37 - Bit 4)
          LE Set Extended Scan Parameters (Octet 37 - Bit 5)
          LE Set Extended Scan Enable (Octet 37 - Bit 6)
          LE Extended Create Connection (Octet 37 - Bit 7)
          LE Periodic Advertising Create Sync (Octet 38 - Bit 0)
          LE Periodic Advertising Create Sync Cancel (Octet 38 - Bit 1)
          LE Periodic Advertising Terminate Sync (Octet 38 - Bit 2)
          LE Add Device To Periodic Advertiser List (Octet 38 - Bit 3)
          LE Remove Device From Periodic Advertiser List (Octet 38 - Bit 4)
          LE Clear Periodic Advertiser List (Octet 38 - Bit 5)
          LE Read Periodic Advertiser List Size (Octet 38 - Bit 6)
          LE Read Transmit Power (Octet 38 - Bit 7)
          LE Read RF Path Compensation (Octet 39 - Bit 0)
          LE Write RF Path Compensation (Octet 39 - Bit 1)
          LE Set Privacy Mode (Octet 39 - Bit 2)
          LE Periodic Advertising Receive Enable (Octet 40 - Bit 5)
          LE Periodic Advertising Sync Transfer (Octet 40 - Bit 6)
          LE Periodic Advertising Set Info Transfer (Octet 40 - Bit 7)
          LE Periodic Advertising Sync Transfer Parameters (Octet 41 - Bit 0)
          LE Set Default Periodic Advertisng Sync Transfer Parameters (Octet 41 - Bit 1)
          LE Read Buffer v2 (Octet 41 - Bit 5)
          LE Read ISO TX Sync (Octet 41 - Bit 6)
          LE Set Connected Isochronous Group Parameters (Octet 41 - Bit 7)
          LE Set Connected Isochronous Group Parameters Test (Octet 42 - Bit 0)
          LE Create Connected Isochronous Stream (Octet 42 - Bit 1)
          LE Remove Connected Isochronous Group (Octet 42 - Bit 2)
          LE Accept Connected Isochronous Stream Request (Octet 42 - Bit 3)
          LE Reject Connected Isochronous Stream Request (Octet 42 - Bit 4)
          LE Create Broadcast Isochronous Group (Octet 42 - Bit 5)
          LE Create Broadcast Isochronous Group Test (Octet 42 - Bit 6)
          LE Terminate Broadcast Isochronous Group (Octet 42 - Bit 7)
          LE Broadcast Isochronous Group Create Sync (Octet 43 - Bit 0)
          LE Broadcast Isochronous Group Terminate Sync (Octet 43 - Bit 1)
          LE Request Peer SCA (Octet 43 - Bit 2)
          LE Setup Isochronous Data Path (Octet 43 - Bit 3)
          LE Remove Isochronous Data Path (Octet 43 - Bit 4)
          LE Isochronous Transmit Test (Octet 43 - Bit 5)
          LE Isochronous Receive Test (Octet 43 - Bit 6)
          LE Isochronous Read Test Counters (Octet 43 - Bit 7)
          LE Isochronous Read Test Counters (Octet 44 - Bit 0)
          LE Set Host Feature (Octet 44 - Bit 1)
          Octet 44 - Bit 2 
          Octet 45 - Bit 6 
          Octet 46 - Bit 0 
          Octet 46 - Bit 1 
          Octet 46 - Bit 2 
zephyr.exe[2317001]: < HCI Command: Host Buffer Size (0x03|0x0033) plen 7                                             #9 1.451031
        ACL MTU: 255  ACL max packet: 16
        SCO MTU: 0    SCO max packet: 0
> HCI Event: Command Complete (0x0e) plen 4                                                                          #10 1.451574
      Host Buffer Size (0x03|0x0033) ncmd 1
        Status: Success (0x00)
zephyr.exe[2317001]: < HCI Command: Set Controller To Host Flow Control (0x03|0x0031) plen 1                         #11 1.471027
        Flow control: ACL Data Packets (0x01)
> HCI Event: Command Complete (0x0e) plen 4                                                                          #12 1.471522
      Set Controller To Host Flow Control (0x03|0x0031) ncmd 1
        Status: Success (0x00)
zephyr.exe[2317001]: < HCI Command: LE Read Local Supported Features (0x08|0x0003) plen 0                            #13 1.491065
> HCI Event: Command Complete (0x0e) plen 12                                                                         #14 1.491558
      LE Read Local Supported Features (0x08|0x0003) ncmd 1
        Status: Success (0x00)
        Features: 0xfd 0x79 0x00 0xf7 0x30 0x01 0x00 0x00
          LE Encryption
          Extended Reject Indication
          Peripheral-initiated Features Exchange
          LE Ping
          LE Data Packet Length Extension
          LL Privacy
          Extended Scanner Filter Policies
          LE 2M PHY
          LE Coded PHY
          LE Extended Advertising
          LE Periodic Advertising
          Channel Selection Algorithm #2
          Periodic Advertising Sync Transfer - Sender
          Periodic Advertising Sync Transfer - Recipient
          Sleep Clock Accuracy Updates
          Connected Isochronous Stream - Central
          Connected Isochronous Stream - Peripheral
          Isochronous Broadcaster
          Synchronized Receiver
          Periodic Advertising ADI support
          Connection Subrating
          Unknown features (0x0000010000000000)
zephyr.exe[2317001]: < HCI Command: LE Set Host Feature (0x08|0x0074) plen 2                                         #15 1.511040
        Bit Number: 32
          Connected Isochronous Stream (Host Support)
        Bit Value: 1
> HCI Event: Command Complete (0x0e) plen 4                                                                          #16 1.511449
      LE Set Host Feature (0x08|0x0074) ncmd 1
        Status: Success (0x00)
zephyr.exe[2317001]: < HCI Command: LE Read Buffer v2 (0x08|0x0060) plen 0                                           #17 1.530996
> HCI Event: Command Complete (0x0e) plen 10                                                                         #18 1.531461
      LE Read Buffer v2 (0x08|0x0060) ncmd 1
        Status: Success (0x00)
        ACL MTU: 27
        ACL max packet: 3
        ISO MTU: 318
        ISO max packet: 3
zephyr.exe[2317001]: < HCI Command: LE Read Maximum Advertising Data Length (0x08|0x003a) plen 0                     #19 1.551020
> HCI Event: Command Complete (0x0e) plen 6                                                                          #20 1.551442
      LE Read Maximum Advertising Data Length (0x08|0x003a) ncmd 1
        Status: Success (0x00)
        Max length: 1650
zephyr.exe[2317001]: < HCI Command: LE Read Supported States (0x08|0x001c) plen 0                                    #21 1.571029
> HCI Event: Command Complete (0x0e) plen 12                                                                         #22 1.571627
      LE Read Supported States (0x08|0x001c) ncmd 1
        Status: Success (0x00)
        States: 0x000003ff3e0306ff
          Non-connectable Advertising State
          Scannable Advertising State
          Connectable Advertising State
          High Duty Cycle Directed Advertising State
          Passive Scanning State
          Active Scanning State
          Initiating State
            and Connection State (Central Role)
          Connection State (Peripheral Role)
          Scannable Advertising State
            and Passive Scanning State
          Connectable Advertising State
            and Passive Scanning State
          Non-connectable Advertising State
            and Initiating State
          Scannable Advertising State
            and Initiating State
          Active Scanning State
            and Connection State (Central Role)
          Passive Scanning State
            and Connection State (Peripheral Role)
          Active Scanning State
            and Connection State (Peripheral Role)
          Initiating State
            and Connection State (Central Role)
            and Central Role & Central Role
          Low Duty Cycle Directed Advertising State
          Connectable Advertising State
            and Initiating State
            and Central Role & Peripheral Role
          High Duty Cycle Directed Advertising State
            and Initiating State
            and Central Role & Peripheral Role
          Low Duty Cycle Directed Advertising State
            and Initiating State
            and Central Role & Peripheral Role
          Connectable Advertising State
            and Connection State (Central Role)
            and Central Role & Peripheral Role
          High Duty Cycle Directed Advertising State
            and Connection State (Central Role)
            and Central Role & Peripheral Role
          Low Duty Cycle Directed Advertising State
            and Connection State (Central Role)
            and Central Role & Peripheral Role
          Connectable Advertising State
            and Connection State (Peripheral Role)
            and Central Role & Peripheral Role
          High Duty Cycle Directed Advertising State
            and Connection State (Peripheral Role)
            and Peripheral Role & Peripheral Role
          Low Duty Cycle Directed Advertising State
            and Connection State (Peripheral Role)
            and Peripheral Role & Peripheral Role
          Initiating State
            and Connection State (Peripheral Role)
            and Central Role & Peripheral Role
zephyr.exe[2317001]: < HCI Command: LE Read Maximum Data Length (0x08|0x002f) plen 0                                 #23 1.591025
> HCI Event: Command Complete (0x0e) plen 12                                                                         #24 1.591469
      LE Read Maximum Data Length (0x08|0x002f) ncmd 1
        Status: Success (0x00)
        Max TX octets: 251
        Max TX time: 2704
        Max RX octets: 251
        Max RX time: 2704
zephyr.exe[2317001]: < HCI Command: LE Write Suggested Default Data Length (0x08|0x0024) plen 4                      #25 1.611026
        TX octets: 251
        TX time: 2704
> HCI Event: Command Complete (0x0e) plen 4                                                                          #26 1.611492
      LE Write Suggested Default Data Length (0x08|0x0024) ncmd 1
        Status: Success (0x00)
zephyr.exe[2317001]: < HCI Command: LE Read Resolving List Size (0x08|0x002a) plen 0                                 #27 1.631010
> HCI Event: Command Complete (0x0e) plen 5                                                                          #28 1.631470
      LE Read Resolving List Size (0x08|0x002a) ncmd 1
        Status: Success (0x00)
        Size: 8
zephyr.exe[2317001]: < HCI Command: LE Set Event Mask (0x08|0x0001) plen 8                                           #29 1.651028
        Mask: 0x000002023f87fa5e
          LE Advertising Report
          LE Connection Update Complete
          LE Read Remote Used Features Complete
          LE Long Term Key Request
          LE Data Length Change
          LE Enhanced Connection Complete
          LE PHY Update Complete
          LE Extended Advertising Report
          LE Periodic Advertising Sync Established
          LE Periodic Advertising Report
          LE Periodic Advertising Sync Lost
          LE Extended Scan Timeout
          LE Extended Advertising Set Terminated
          LE Scan Request Received
          LE Periodic Advertising Sync Transfer Rvc
          LE CIS Established
          LE CIS Request
          LE Create BIG Complete
          LE Terminate BIG Complete
          LE BIG Sync Estabilished Complete
          LE BIG Sync Lost
          LE BIG Info Advertising Report
          Unknown mask (0x0000020000000000)
> HCI Event: Command Complete (0x0e) plen 4                                                                          #30 1.651511
      LE Set Event Mask (0x08|0x0001) ncmd 1
        Status: Success (0x00)
zephyr.exe[2317001]: < HCI Command: Set Event Mask (0x03|0x0001) plen 8                                              #31 1.671031
        Mask: 0x2000800002008890
          Disconnection Complete
          Encryption Change
          Read Remote Version Information Complete
          Hardware Error
          Data Buffer Overflow
          Encryption Key Refresh Complete
          LE Meta
> HCI Event: Command Complete (0x0e) plen 4                                                                          #32 1.671543
      Set Event Mask (0x03|0x0001) ncmd 1
        Status: Success (0x00)
zephyr.exe[2317001]: < HCI Command: Read BD ADDR (0x04|0x0009) plen 0                                                #33 1.691039
> HCI Event: Command Complete (0x0e) plen 10                                                                         #34 1.691566
      Read BD ADDR (0x04|0x0009) ncmd 1
        Status: Success (0x00)
        Address: 00:00:00:00:00:00 (OUI 00-00-00)
zephyr.exe[2317001]: < HCI Command: LE Set Random Address (0x08|0x0005) plen 6                                       #35 1.711044
        Address: D5:B6:CC:31:DB:3B (Static)
> HCI Event: Command Complete (0x0e) plen 4                                                                          #36 1.711551
      LE Set Random Address (0x08|0x0005) ncmd 1
        Status: Success (0x00)
zephyr.exe[2317001]: < HCI Command: LE Extended Create Connection (0x08|0x0043) plen 26                              #37 5.691135
        Filter policy: Accept list is not used (0x00)
        Own address type: Random (0x01)
        Peer address type: Public (0x00)
        Peer address: DF:A9:FF:F6:B1:1A (OUI DF-A9-FF)
        Initiating PHYs: 0x01
        Entry 0: LE 1M
          Scan interval: 60.000 msec (0x0060)
          Scan window: 60.000 msec (0x0060)
          Min connection interval: 30.00 msec (0x0018)
          Max connection interval: 50.00 msec (0x0028)
          Connection latency: 0 (0x0000)
          Supervision timeout: 4000 msec (0x0190)
          Min connection length: 0.000 msec (0x0000)
          Max connection length: 0.000 msec (0x0000)
> HCI Event: Command Status (0x0f) plen 4                                                                            #38 5.692115
      LE Extended Create Connection (0x08|0x0043) ncmd 1
        Status: Success (0x00)
> HCI Event: LE Meta Event (0x3e) plen 31                                                                            #39 5.704188
      LE Enhanced Connection Complete (0x0a)
        Status: Success (0x00)
        Handle: 360
        Role: Central (0x00)
        Peer address type: Public (0x00)
        Peer address: DF:A9:FF:F6:B1:1A (OUI DF-A9-FF)
        Local resolvable private address: 00:00:00:00:00:00 (Non-Resolvable)
        Peer resolvable private address: 00:00:00:00:00:00 (Non-Resolvable)
        Connection interval: 50.00 msec (0x0028)
        Connection latency: 0 (0x0000)
        Supervision timeout: 4000 msec (0x0190)
        Central clock accuracy: 0x00
zephyr.exe[2317001]: < HCI Command: LE Read Remote Used Features (0x08|0x0016) plen 2                                #40 5.711401
        Handle: 360 Address: DF:A9:FF:F6:B1:1A (OUI DF-A9-FF)
> HCI Event: Command Status (0x0f) plen 4                                                                            #41 5.711847
      LE Read Remote Used Features (0x08|0x0016) ncmd 1
        Status: Success (0x00)
zephyr.exe[2317001]: < HCI Command: LE Set PHY (0x08|0x0032) plen 7                                                  #42 5.731129
        Handle: 360 Address: DF:A9:FF:F6:B1:1A (OUI DF-A9-FF)
        All PHYs preference: 0x00
        TX PHYs preference: 0x02
          LE 2M
        RX PHYs preference: 0x02
          LE 2M
        PHY options preference: Reserved (0x0000)
> HCI Event: Command Status (0x0f) plen 4                                                                            #43 5.731718
      LE Set PHY (0x08|0x0032) ncmd 1
        Status: Success (0x00)
> HCI Event: LE Meta Event (0x3e) plen 12                                                                            #44 5.855744
      LE Read Remote Used Features (0x04)
        Status: Success (0x00)
        Handle: 360 Address: DF:A9:FF:F6:B1:1A (OUI DF-A9-FF)
        Features: 0x2d 0x49 0x00 0xf7 0x67 0xd8 0x00 0x00
          LE Encryption
          Extended Reject Indication
          Peripheral-initiated Features Exchange
          LE Data Packet Length Extension
          LE 2M PHY
          LE Coded PHY
          Channel Selection Algorithm #2
          Periodic Advertising Sync Transfer - Sender
          Periodic Advertising Sync Transfer - Recipient
          Sleep Clock Accuracy Updates
          Connected Isochronous Stream - Central
          Connected Isochronous Stream - Peripheral
          Isochronous Broadcaster
          Synchronized Receiver
          Connected Isochronous Stream (Host Support)
          LE Power Control Request
          LE Power Control Request
          Connection Subrating
          Connection Subrating (Host Support)
          Unknown features (0x0000d80000000000)
> HCI Event: LE Meta Event (0x3e) plen 6                                                                             #45 6.354968
      LE PHY Update Complete (0x0c)
        Status: Success (0x00)
        Handle: 360 Address: DF:A9:FF:F6:B1:1A (OUI DF-A9-FF)
        TX PHY: LE 2M (0x02)
        RX PHY: LE 2M (0x02)
zephyr.exe[2317001]: < ACL Data TX: Handle 360 flags 0x00 dlen 11                                                    #46 6.731170
      SMP: Pairing Request (0x01) len 6
        IO capability: KeyboardDisplay (0x04)
        OOB data: Authentication data not present (0x00)
        Authentication requirement: Bonding, No MITM, SC, No Keypresses (0x09)
        Max encryption key size: 16
        Initiator key distribution: EncKey (0x01)
        Responder key distribution: EncKey IdKey (0x03)
> HCI Event: Number of Completed Packets (0x13) plen 5                                                               #47 6.755447
        Num handles: 1
        Handle: 360 Address: DF:A9:FF:F6:B1:1A (OUI DF-A9-FF)
        Count: 1
        #46: len 11 (3 Kb/s)
        Latency: 24 msec (24-24 msec ~24 msec)
> ACL Data RX: Handle 360 flags 0x02 dlen 11                                                                         #48 6.805571
      SMP: Pairing Response (0x02) len 6
        IO capability: KeyboardDisplay (0x04)
        OOB data: Authentication data not present (0x00)
        Authentication requirement: Bonding, MITM, SC, No Keypresses (0x0d)
        Max encryption key size: 16
        Initiator key distribution: <none> (0x00)
        Responder key distribution: IdKey (0x02)
zephyr.exe[2317001]: < HCI Command: Host Number of Completed Packets (0x03|0x0035) plen 5                            #49 6.811447
        Num handles: 1
        Handle: 360 Address: DF:A9:FF:F6:B1:1A (OUI DF-A9-FF)
        Count: 1
zephyr.exe[2317001]: < ACL Data TX: Handle 360 flags 0x00 dlen 27                                                    #50 6.811629
zephyr.exe[2317001]: < ACL Data TX: Handle 360 flags 0x01 dlen 27                                                    #51 6.811639
zephyr.exe[2317001]: < ACL Data TX: Handle 360 flags 0x01 dlen 15                                                    #52 6.811661
      SMP: Pairing Public Key (0x0c) len 64
        X: 98308440221e2d910f0e54b71e7ec652857aa9b5a0dc65028824cc19db1226e9
        Y: 67a4816bcb62efb21701e31fdb27561a6217575fb007a8bbdabe7e28b6f68482
> HCI Event: Number of Completed Packets (0x13) plen 5                                                               #53 6.855481
        Num handles: 1
        Handle: 360 Address: DF:A9:FF:F6:B1:1A (OUI DF-A9-FF)
        Count: 1
        #50: len 27 (5 Kb/s)
        Latency: 43 msec (24-43 msec ~34 msec)
> HCI Event: Number of Completed Packets (0x13) plen 5                                                               #54 6.855946
        Num handles: 1
        Handle: 360 Address: DF:A9:FF:F6:B1:1A (OUI DF-A9-FF)
        Count: 1
        #51: len 27 (4 Kb/s)
        Latency: 44 msec (24-44 msec ~39 msec)
> HCI Event: Number of Completed Packets (0x13) plen 5                                                               #55 6.856506
        Num handles: 1
        Handle: 360 Address: DF:A9:FF:F6:B1:1A (OUI DF-A9-FF)
        Count: 1
        #52: len 15 (2 Kb/s)
        Latency: 44 msec (24-44 msec ~42 msec)
> ACL Data RX: Handle 360 flags 0x02 dlen 27                                                                         #56 6.905683
> ACL Data RX: Handle 360 flags 0x01 dlen 27                                                                         #57 6.906175
> ACL Data RX: Handle 360 flags 0x01 dlen 15                                                                         #58 6.906617
      SMP: Pairing Public Key (0x0c) len 64
        X: 5e2e797101dbdd634aea47be45044766e8d335d6e91d5f7c872c716c06e18a46
        Y: 9e6414223576576dd788be2299561cc10deadefd2672d3e6c418ef15bb495297
zephyr.exe[2317001]: < HCI Command: Host Number of Completed Packets (0x03|0x0035) plen 5                            #59 6.911130
        Num handles: 1
        Handle: 360 Address: DF:A9:FF:F6:B1:1A (OUI DF-A9-FF)
        Count: 1
zephyr.exe[2317001]: < HCI Command: Host Number of Completed Packets (0x03|0x0035) plen 5                            #60 6.911285
        Num handles: 1
        Handle: 360 Address: DF:A9:FF:F6:B1:1A (OUI DF-A9-FF)
        Count: 1
zephyr.exe[2317001]: < HCI Command: Host Number of Completed Packets (0x03|0x0035) plen 5                            #61 6.911364
        Num handles: 1
        Handle: 360 Address: DF:A9:FF:F6:B1:1A (OUI DF-A9-FF)
        Count: 1
> ACL Data RX: Handle 360 flags 0x02 dlen 21                                                                         #62 7.005695
      SMP: Pairing Confirm (0x03) len 16
        Confim value: 25c78b1cccc57410910e1984c4191cec
zephyr.exe[2317001]: < HCI Command: Host Number of Completed Packets (0x03|0x0035) plen 5                            #63 7.011376
        Num handles: 1
        Handle: 360 Address: DF:A9:FF:F6:B1:1A (OUI DF-A9-FF)
        Count: 1
zephyr.exe[2317001]: < ACL Data TX: Handle 360 flags 0x00 dlen 21                                                    #64 7.011527
      SMP: Pairing Random (0x04) len 16
        Random value: 8e6108f966a694cbe26df70bb96773e6
> HCI Event: Number of Completed Packets (0x13) plen 5                                                               #65 7.055425
        Num handles: 1
        Handle: 360 Address: DF:A9:FF:F6:B1:1A (OUI DF-A9-FF)
        Count: 1
        #64: len 21 (3 Kb/s)
        Latency: 43 msec (24-44 msec ~42 msec)
> ACL Data RX: Handle 360 flags 0x02 dlen 21                                                                         #66 7.305589
      SMP: Pairing Random (0x04) len 16
        Random value: 351b84e6629b94c6e00bdf64bd5fa47b
zephyr.exe[2317001]: < HCI Command: Host Number of Completed Packets (0x03|0x0035) plen 5                            #67 7.311964
        Num handles: 1
        Handle: 360 Address: DF:A9:FF:F6:B1:1A (OUI DF-A9-FF)
        Count: 1
zephyr.exe[2317001]: < ACL Data TX: Handle 360 flags 0x00 dlen 21                                                    #68 7.742040
      SMP: Pairing DHKey Check (0x0d) len 16
        E: cdb2c5175e90030da1318039105d28ea
> HCI Event: Number of Completed Packets (0x13) plen 5                                                               #69 7.755471
        Num handles: 1
        Handle: 360 Address: DF:A9:FF:F6:B1:1A (OUI DF-A9-FF)
        Count: 1
        #68: len 21 (12 Kb/s)
        Latency: 13 msec (13-44 msec ~28 msec)
> ACL Data RX: Handle 360 flags 0x02 dlen 21                                                                         #70 7.805646
      SMP: Pairing DHKey Check (0x0d) len 16
        E: b9368f046f2b25ba8781845e44124a45
zephyr.exe[2317001]: < HCI Command: LE Start Encryption (0x08|0x0019) plen 28                                        #71 7.811534
        Handle: 360 Address: DF:A9:FF:F6:B1:1A (OUI DF-A9-FF)
        Random number: 0x0000000000000000
        Encrypted diversifier: 0x0000
        Long term key: 5c31c82da72d858d4201148814e70837
> HCI Event: Command Status (0x0f) plen 4                                                                            #72 7.812475
      LE Start Encryption (0x08|0x0019) ncmd 1
        Status: Success (0x00)
zephyr.exe[2317001]: < HCI Command: Host Number of Completed Packets (0x03|0x0035) plen 5                            #73 7.831377
        Num handles: 1
        Handle: 360 Address: DF:A9:FF:F6:B1:1A (OUI DF-A9-FF)
        Count: 1
> HCI Event: Encryption Change (0x08) plen 4                                                                         #74 8.155372
        Status: Success (0x00)
        Handle: 360 Address: DF:A9:FF:F6:B1:1A (OUI DF-A9-FF)
        Encryption: Enabled with AES-CCM (0x01)
> ACL Data RX: Handle 360 flags 0x02 dlen 21                                                                         #75 8.205736
      SMP: Identity Information (0x08) len 16
        Identity resolving key: 6cf0d45ffcfbbc186cdd142739e03843
zephyr.exe[2317001]: < HCI Command: Host Number of Completed Packets (0x03|0x0035) plen 5                            #76 8.211216
        Num handles: 1
        Handle: 360 Address: DF:A9:FF:F6:B1:1A (OUI DF-A9-FF)
        Count: 1
> ACL Data RX: Handle 360 flags 0x02 dlen 12                                                                         #77 8.305483
      SMP: Identity Address Information (0x09) len 7
        Address: DF:A9:FF:F6:B1:1A (OUI DF-A9-FF)
zephyr.exe[2317001]: < HCI Command: LE Add Device To Resolving List (0x08|0x0027) plen 39                            #78 8.311769
        Address type: Public (0x00)
        Address: DF:A9:FF:F6:B1:1A (OUI DF-A9-FF)
        Peer identity resolving key: 6cf0d45ffcfbbc186cdd142739e03843
        Local identity resolving key: 00000000000000000000000000000000
> HCI Event: Command Complete (0x0e) plen 4                                                                          #79 8.312860
      LE Add Device To Resolving List (0x08|0x0027) ncmd 1
        Status: Success (0x00)
zephyr.exe[2317001]: < HCI Command: LE Set Privacy Mode (0x08|0x004e) plen 8                                         #80 8.331452
        Peer Identity address type: Public (0x00)
        Peer Identity address: DF:A9:FF:F6:B1:1A (OUI DF-A9-FF)
        Privacy Mode: Use Device Privacy (0x01)
> HCI Event: Command Complete (0x0e) plen 4                                                                          #81 8.332166
      LE Set Privacy Mode (0x08|0x004e) ncmd 1
        Status: Success (0x00)
zephyr.exe[2317001]: < HCI Command: LE Set Address Resolution Enable (0x08|0x002d) plen 1                            #82 8.351452
        Address resolution: Enabled (0x01)
> HCI Event: Command Complete (0x0e) plen 4                                                                          #83 8.352022
      LE Set Address Resolution Enable (0x08|0x002d) ncmd 1
        Status: Success (0x00)
zephyr.exe[2317001]: < HCI Command: Host Number of Completed Packets (0x03|0x0035) plen 5                            #84 8.371199
        Num handles: 1
        Handle: 360 Address: DF:A9:FF:F6:B1:1A (OUI DF-A9-FF)
        Count: 1
> HCI Event: Disconnect Complete (0x05) plen 4                                                                       #85 9.055160
        Status: Success (0x00)
        Handle: 360 Address: DF:A9:FF:F6:B1:1A (OUI DF-A9-FF)
        Reason: Remote User Terminated Connection (0x13)
zephyr.exe[2317001]: < HCI Command: LE Extended Create Connection (0x08|0x0043) plen 26                              #86 9.771616
        Filter policy: Accept list is not used (0x00)
        Own address type: Random (0x01)
        Peer address type: Public (0x00)
        Peer address: DF:A9:FF:F6:B1:1A (OUI DF-A9-FF)
        Initiating PHYs: 0x01
        Entry 0: LE 1M
          Scan interval: 60.000 msec (0x0060)
          Scan window: 60.000 msec (0x0060)
          Min connection interval: 30.00 msec (0x0018)
          Max connection interval: 50.00 msec (0x0028)
          Connection latency: 0 (0x0000)
          Supervision timeout: 4000 msec (0x0190)
          Min connection length: 0.000 msec (0x0000)
          Max connection length: 0.000 msec (0x0000)
> HCI Event: Command Status (0x0f) plen 4                                                                            #87 9.772615
      LE Extended Create Connection (0x08|0x0043) ncmd 1
        Status: Success (0x00)
> HCI Event: LE Meta Event (0x3e) plen 31                                                                            #88 9.791144
      LE Enhanced Connection Complete (0x0a)
        Status: Success (0x00)
        Handle: 378
        Role: Central (0x00)
        Peer address type: Public (0x00)
        Peer address: DF:A9:FF:F6:B1:1A (OUI DF-A9-FF)
        Local resolvable private address: 00:00:00:00:00:00 (Non-Resolvable)
        Peer resolvable private address: 00:00:00:00:00:00 (Non-Resolvable)
        Connection interval: 50.00 msec (0x0028)
        Connection latency: 0 (0x0000)
        Supervision timeout: 4000 msec (0x0190)
        Central clock accuracy: 0x00
zephyr.exe[2317001]: < HCI Command: LE Read Remote Used Features (0x08|0x0016) plen 2                                #89 9.811284
        Handle: 378 Address: DF:A9:FF:F6:B1:1A (OUI DF-A9-FF)
> HCI Event: Command Status (0x0f) plen 4                                                                            #90 9.811765
      LE Read Remote Used Features (0x08|0x0016) ncmd 1
        Status: Success (0x00)
zephyr.exe[2317001]: < HCI Command: LE Set PHY (0x08|0x0032) plen 7                                                  #91 9.831078
        Handle: 378 Address: DF:A9:FF:F6:B1:1A (OUI DF-A9-FF)
        All PHYs preference: 0x00
        TX PHYs preference: 0x02
          LE 2M
        RX PHYs preference: 0x02
          LE 2M
        PHY options preference: Reserved (0x0000)
> HCI Event: Command Status (0x0f) plen 4                                                                            #92 9.831592
      LE Set PHY (0x08|0x0032) ncmd 1
        Status: Success (0x00)
> HCI Event: LE Meta Event (0x3e) plen 12                                                                            #93 9.942592
      LE Read Remote Used Features (0x04)
        Status: Success (0x00)
        Handle: 378 Address: DF:A9:FF:F6:B1:1A (OUI DF-A9-FF)
        Features: 0x2d 0x49 0x00 0xf7 0x67 0xd8 0x00 0x00
          LE Encryption
          Extended Reject Indication
          Peripheral-initiated Features Exchange
          LE Data Packet Length Extension
          LE 2M PHY
          LE Coded PHY
          Channel Selection Algorithm #2
          Periodic Advertising Sync Transfer - Sender
          Periodic Advertising Sync Transfer - Recipient
          Sleep Clock Accuracy Updates
          Connected Isochronous Stream - Central
          Connected Isochronous Stream - Peripheral
          Isochronous Broadcaster
          Synchronized Receiver
          Connected Isochronous Stream (Host Support)
          LE Power Control Request
          LE Power Control Request
          Connection Subrating
          Connection Subrating (Host Support)
          Unknown features (0x0000d80000000000)
> HCI Event: LE Meta Event (0x3e) plen 6                                                                            #94 10.441867
      LE PHY Update Complete (0x0c)
        Status: Success (0x00)
        Handle: 378 Address: DF:A9:FF:F6:B1:1A (OUI DF-A9-FF)
        TX PHY: LE 2M (0x02)
        RX PHY: LE 2M (0x02)
zephyr.exe[2317001]: < HCI Command: LE Start Encryption (0x08|0x0019) plen 28                                       #95 10.841544
        Handle: 378 Address: DF:A9:FF:F6:B1:1A (OUI DF-A9-FF)
        Random number: 0x0000000000000000
        Encrypted diversifier: 0x0000
        Long term key: 5c31c82da72d858d4201148814e70837
> HCI Event: Command Status (0x0f) plen 4                                                                           #96 10.842521
      LE Start Encryption (0x08|0x0019) ncmd 1
        Status: Success (0x00)
> HCI Event: Encryption Change (0x08) plen 4                                                                        #97 11.092310
        Status: PIN or Key Missing (0x06)
        Handle: 378 Address: DF:A9:FF:F6:B1:1A (OUI DF-A9-FF)
        Encryption: Disabled (0x00)
zephyr.exe[2317001]: < ACL Data TX: Handle 378 flags 0x00 dlen 11                                                   #98 11.111553
      SMP: Pairing Request (0x01) len 6
        IO capability: KeyboardDisplay (0x04)
        OOB data: Authentication data not present (0x00)
        Authentication requirement: Bonding, No MITM, SC, No Keypresses (0x09)
        Max encryption key size: 16
        Initiator key distribution: EncKey (0x01)
        Responder key distribution: EncKey IdKey (0x03)
> HCI Event: Number of Completed Packets (0x13) plen 5                                                              #99 11.192307
        Num handles: 1
        Handle: 378 Address: DF:A9:FF:F6:B1:1A (OUI DF-A9-FF)
        Count: 1
        #98: len 11 (1 Kb/s)
        Latency: 80 msec (80-80 msec ~80 msec)
> ACL Data RX: Handle 378 flags 0x02 dlen 11                                                                       #100 11.892405
      SMP: Pairing Response (0x02) len 6
        IO capability: KeyboardDisplay (0x04)
        OOB data: Authentication data not present (0x00)
        Authentication requirement: Bonding, MITM, SC, No Keypresses (0x0d)
        Max encryption key size: 16
        Initiator key distribution: <none> (0x00)
        Responder key distribution: IdKey (0x02)
zephyr.exe[2317001]: < HCI Command: Host Number of Completed Packets (0x03|0x0035) plen 5                          #101 11.911970
        Num handles: 1
        Handle: 378 Address: DF:A9:FF:F6:B1:1A (OUI DF-A9-FF)
        Count: 1
zephyr.exe[2317001]: < ACL Data TX: Handle 378 flags 0x00 dlen 27                                                  #102 11.912077
zephyr.exe[2317001]: < ACL Data TX: Handle 378 flags 0x01 dlen 27                                                  #103 11.912088
zephyr.exe[2317001]: < ACL Data TX: Handle 378 flags 0x01 dlen 15                                                  #104 11.912137
      SMP: Pairing Public Key (0x0c) len 64
        X: 98308440221e2d910f0e54b71e7ec652857aa9b5a0dc65028824cc19db1226e9
        Y: 67a4816bcb62efb21701e31fdb27561a6217575fb007a8bbdabe7e28b6f68482
> HCI Event: Number of Completed Packets (0x13) plen 5                                                             #105 11.942343
        Num handles: 1
        Handle: 378 Address: DF:A9:FF:F6:B1:1A (OUI DF-A9-FF)
        Count: 1
        #102: len 27 (7 Kb/s)
        Latency: 30 msec (30-80 msec ~55 msec)
> HCI Event: Number of Completed Packets (0x13) plen 5                                                             #106 11.942808
        Num handles: 1
        Handle: 378 Address: DF:A9:FF:F6:B1:1A (OUI DF-A9-FF)
        Count: 1
        #103: len 27 (7 Kb/s)
        Latency: 30 msec (30-80 msec ~43 msec)
> HCI Event: Number of Completed Packets (0x13) plen 5                                                             #107 11.943279
        Num handles: 1
        Handle: 378 Address: DF:A9:FF:F6:B1:1A (OUI DF-A9-FF)
        Count: 1
        #104: len 15 (3 Kb/s)
        Latency: 31 msec (30-80 msec ~37 msec)
> ACL Data RX: Handle 378 flags 0x02 dlen 27                                                                       #108 11.992562
> ACL Data RX: Handle 378 flags 0x01 dlen 27                                                                       #109 11.993117
> ACL Data RX: Handle 378 flags 0x01 dlen 15                                                                       #110 11.993376
      SMP: Pairing Public Key (0x0c) len 64
        X: 097db1447d9cf4a59748c0f266616dd69f7b05329e8eef529251271053f00216
        Y: 0665d59c563d489c24de84db5654b360ffffc6d49c805bdd710a9a3a7f9a5bb5
zephyr.exe[2317001]: < HCI Command: Host Number of Completed Packets (0x03|0x0035) plen 5                          #111 12.011494
        Num handles: 1
        Handle: 378 Address: DF:A9:FF:F6:B1:1A (OUI DF-A9-FF)
        Count: 1
zephyr.exe[2317001]: < HCI Command: Host Number of Completed Packets (0x03|0x0035) plen 5                          #112 12.011640
        Num handles: 1
        Handle: 378 Address: DF:A9:FF:F6:B1:1A (OUI DF-A9-FF)
        Count: 1
zephyr.exe[2317001]: < HCI Command: Host Number of Completed Packets (0x03|0x0035) plen 5                          #113 12.011651
        Num handles: 1
        Handle: 378 Address: DF:A9:FF:F6:B1:1A (OUI DF-A9-FF)
        Count: 1
> ACL Data RX: Handle 378 flags 0x02 dlen 21                                                                       #114 12.092525
      SMP: Pairing Confirm (0x03) len 16
        Confim value: e6519c0e109c43a9aa403c28400553fd
zephyr.exe[2317001]: < HCI Command: Host Number of Completed Packets (0x03|0x0035) plen 5                          #115 12.111461
        Num handles: 1
        Handle: 378 Address: DF:A9:FF:F6:B1:1A (OUI DF-A9-FF)
        Count: 1
zephyr.exe[2317001]: < ACL Data TX: Handle 378 flags 0x00 dlen 21                                                  #116 12.111645
      SMP: Pairing Random (0x04) len 16
        Random value: 5da095555cc64d02679f89a05211af56
> HCI Event: Number of Completed Packets (0x13) plen 5                                                             #117 12.142270
        Num handles: 1
        Handle: 378 Address: DF:A9:FF:F6:B1:1A (OUI DF-A9-FF)
        Count: 1
        #116: len 21 (5 Kb/s)
        Latency: 30 msec (30-80 msec ~33 msec)
> ACL Data RX: Handle 378 flags 0x02 dlen 21                                                                       #118 12.392475
      SMP: Pairing Random (0x04) len 16
        Random value: 1190969bd244028e8f32d58aac8ae56e
zephyr.exe[2317001]: < HCI Command: Host Number of Completed Packets (0x03|0x0035) plen 5                          #119 12.411904
        Num handles: 1
        Handle: 378 Address: DF:A9:FF:F6:B1:1A (OUI DF-A9-FF)
        Count: 1
zephyr.exe[2317001]: < ACL Data TX: Handle 378 flags 0x00 dlen 21                                                  #120 13.912042
      SMP: Pairing DHKey Check (0x0d) len 16
        E: 00f5a3a846c2b2fdbf3edf610310eeeb
> HCI Event: Number of Completed Packets (0x13) plen 5                                                             #121 13.942311
        Num handles: 1
        Handle: 378 Address: DF:A9:FF:F6:B1:1A (OUI DF-A9-FF)
        Count: 1
        #120: len 21 (5 Kb/s)
        Latency: 30 msec (30-80 msec ~32 msec)
> ACL Data RX: Handle 378 flags 0x02 dlen 21                           