Bluetooth monitor ver 5.84
btmon[1603883]: = Note: Linux version 6.8.0-83-generic (x86_64)                                                          0.777666
btmon[1603883]: = Note: Bluetooth subsystem version 2.22                                                                 0.777668
= New Index: 00:00:00:00:00:00 (Primary,UART,hci0)                                                                       0.777669
= Open Index: 00:00:00:00:00:00                                                                                          0.785281
= Index Info: 00:00:00:00:00:00 (Nordic Semiconductor ASA)                                                               0.785285
zephyr.exe[1603885]: @ USER Open: main (privileged) version 2.22                                                {0x0001} 0.785287
zephyr.exe[1603885]: < HCI Command: Reset (0x03|0x0003) plen 0                                                        #1 0.785548
> HCI Event: Command Complete (0x0e) plen 4                                                                           #2 0.785977
      Reset (0x03|0x0003) ncmd 1
        Status: Success (0x00)
zephyr.exe[1603885]: < HCI Command: Read Local Supported Features (0x04|0x0003) plen 0                                #3 0.805253
> HCI Event: Command Complete (0x0e) plen 12                                                                          #4 0.805921
      Read Local Supported Features (0x04|0x0003) ncmd 1
        Status: Success (0x00)
        Features: 0x00 0x00 0x00 0x00 0x60 0x00 0x00 0x00
          BR/EDR Not Supported
          LE Supported (Controller)
zephyr.exe[1603885]: < HCI Command: Read Local Version Information (0x04|0x0001) plen 0                               #5 0.825246
> HCI Event: Command Complete (0x0e) plen 12                                                                          #6 0.826061
      Read Local Version Information (0x04|0x0001) ncmd 1
        Status: Success (0x00)
        HCI version: Reserved (0x0e) - Revision 12520 (0x30e8)
        LMP version: Reserved (0x0e) - Subversion 12520 (0x30e8)
        Manufacturer: Nordic Semiconductor ASA (89)
zephyr.exe[1603885]: < HCI Command: Read Local Supported Commands (0x04|0x0002) plen 0                                #7 0.845257
> HCI Event: Command Complete (0x0e) plen 68                                                                          #8 0.846348
      Read Local Supported Commands (0x04|0x0002) ncmd 1
        Status: Success (0x00)
        Commands: 119 entries
          Disconnect (Octet 0 - Bit 5)
          Read Remote Version Information (Octet 2 - Bit 7)
          Set Event Mask (Octet 5 - Bit 6)
          Reset (Octet 5 - Bit 7)
          Read Connection Accept Timeout (Octet 7 - Bit 2)
          Write Connection Accept Timeout (Octet 7 - Bit 3)
          Read Transmit Power Level (Octet 10 - Bit 2)
          Set Controller To Host Flow Control (Octet 10 - Bit 5)
          Host Buffer Size (Octet 10 - Bit 6)
          Host Number of Completed Packets (Octet 10 - Bit 7)
          Read Local Version Information (Octet 14 - Bit 3)
          Read Local Supported Features (Octet 14 - Bit 5)
          Read BD ADDR (Octet 15 - Bit 1)
          Read RSSI (Octet 15 - Bit 5)
          Set Event Mask Page 2 (Octet 22 - Bit 2)
          LE Set Event Mask (Octet 25 - Bit 0)
          LE Read Buffer Size (Octet 25 - Bit 1)
          LE Read Local Supported Features (Octet 25 - Bit 2)
          LE Set Random Address (Octet 25 - Bit 4)
          LE Set Advertising Parameters (Octet 25 - Bit 5)
          LE Read Advertising Channel TX Power (Octet 25 - Bit 6)
          LE Set Advertising Data (Octet 25 - Bit 7)
          LE Set Scan Response Data (Octet 26 - Bit 0)
          LE Set Advertise Enable (Octet 26 - Bit 1)
          LE Set Scan Parameters (Octet 26 - Bit 2)
          LE Set Scan Enable (Octet 26 - Bit 3)
          LE Create Connection (Octet 26 - Bit 4)
          LE Create Connection Cancel (Octet 26 - Bit 5)
          LE Read Accept List Size (Octet 26 - Bit 6)
          LE Clear Accept List (Octet 26 - Bit 7)
          LE Add Device To Accept List (Octet 27 - Bit 0)
          LE Remove Device From Accept List (Octet 27 - Bit 1)
          LE Connection Update (Octet 27 - Bit 2)
          LE Set Host Channel Classification (Octet 27 - Bit 3)
          LE Read Channel Map (Octet 27 - Bit 4)
          LE Read Remote Used Features (Octet 27 - Bit 5)
          LE Encrypt (Octet 27 - Bit 6)
          LE Rand (Octet 27 - Bit 7)
          LE Start Encryption (Octet 28 - Bit 0)
          LE Long Term Key Request Reply (Octet 28 - Bit 1)
          LE Long Term Key Request Neg Reply (Octet 28 - Bit 2)
          LE Read Supported States (Octet 28 - Bit 3)
          LE Receiver Test (Octet 28 - Bit 4)
          LE Transmitter Test (Octet 28 - Bit 5)
          LE Test End (Octet 28 - Bit 6)
          Read Authenticated Payload Timeout (Octet 32 - Bit 4)
          Write Authenticated Payload Timeout (Octet 32 - Bit 5)
          LE Set Data Length (Octet 33 - Bit 6)
          LE Read Suggested Default Data Length (Octet 33 - Bit 7)
          LE Write Suggested Default Data Length (Octet 34 - Bit 0)
          LE Add Device To Resolving List (Octet 34 - Bit 3)
          LE Remove Device From Resolving List (Octet 34 - Bit 4)
          LE Clear Resolving List (Octet 34 - Bit 5)
          LE Read Resolving List Size (Octet 34 - Bit 6)
          LE Set Address Resolution Enable (Octet 35 - Bit 1)
          LE Set Resolvable Private Address Timeout (Octet 35 - Bit 2)
          LE Read Maximum Data Length (Octet 35 - Bit 3)
          LE Read PHY (Octet 35 - Bit 4)
          LE Set Default PHY (Octet 35 - Bit 5)
          LE Set PHY (Octet 35 - Bit 6)
          LE Enhanced Receiver Test (Octet 35 - Bit 7)
          LE Enhanced Transmitter Test (Octet 36 - Bit 0)
          LE Set Advertising Set Random Address (Octet 36 - Bit 1)
          LE Set Extended Advertising Parameters (Octet 36 - Bit 2)
          LE Set Extended Advertising Data (Octet 36 - Bit 3)
          LE Set Extended Scan Response Data (Octet 36 - Bit 4)
          LE Set Extended Advertising Enable (Octet 36 - Bit 5)
          LE Read Maximum Advertising Data Length (Octet 36 - Bit 6)
          LE Read Number of Supported Advertising Sets (Octet 36 - Bit 7)
          LE Remove Advertising Set (Octet 37 - Bit 0)
          LE Clear Advertising Sets (Octet 37 - Bit 1)
          LE Set Periodic Advertising Parameters (Octet 37 - Bit 2)
          LE Set Periodic Advertising Data (Octet 37 - Bit 3)
          LE Set Periodic Advertising Enable (Octet 37 - Bit 4)
          LE Set Extended Scan Parameters (Octet 37 - Bit 5)
          LE Set Extended Scan Enable (Octet 37 - Bit 6)
          LE Extended Create Connection (Octet 37 - Bit 7)
          LE Periodic Advertising Create Sync (Octet 38 - Bit 0)
          LE Periodic Advertising Create Sync Cancel (Octet 38 - Bit 1)
          LE Periodic Advertising Terminate Sync (Octet 38 - Bit 2)
          LE Add Device To Periodic Advertiser List (Octet 38 - Bit 3)
          LE Remove Device From Periodic Advertiser List (Octet 38 - Bit 4)
          LE Clear Periodic Advertiser List (Octet 38 - Bit 5)
          LE Read Periodic Advertiser List Size (Octet 38 - Bit 6)
          LE Read Transmit Power (Octet 38 - Bit 7)
          LE Read RF Path Compensation (Octet 39 - Bit 0)
          LE Write RF Path Compensation (Octet 39 - Bit 1)
          LE Set Privacy Mode (Octet 39 - Bit 2)
          LE Periodic Advertising Receive Enable (Octet 40 - Bit 5)
          LE Periodic Advertising Sync Transfer (Octet 40 - Bit 6)
          LE Periodic Advertising Set Info Transfer (Octet 40 - Bit 7)
          LE Periodic Advertising Sync Transfer Parameters (Octet 41 - Bit 0)
          LE Set Default Periodic Advertisng Sync Transfer Parameters (Octet 41 - Bit 1)
          LE Read Buffer v2 (Octet 41 - Bit 5)
          LE Read ISO TX Sync (Octet 41 - Bit 6)
          LE Set Connected Isochronous Group Parameters (Octet 41 - Bit 7)
          LE Set Connected Isochronous Group Parameters Test (Octet 42 - Bit 0)
          LE Create Connected Isochronous Stream (Octet 42 - Bit 1)
          LE Remove Connected Isochronous Group (Octet 42 - Bit 2)
          LE Accept Connected Isochronous Stream Request (Octet 42 - Bit 3)
          LE Reject Connected Isochronous Stream Request (Octet 42 - Bit 4)
          LE Create Broadcast Isochronous Group (Octet 42 - Bit 5)
          LE Create Broadcast Isochronous Group Test (Octet 42 - Bit 6)
          LE Terminate Broadcast Isochronous Group (Octet 42 - Bit 7)
          LE Broadcast Isochronous Group Create Sync (Octet 43 - Bit 0)
          LE Broadcast Isochronous Group Terminate Sync (Octet 43 - Bit 1)
          LE Request Peer SCA (Octet 43 - Bit 2)
          LE Setup Isochronous Data Path (Octet 43 - Bit 3)
          LE Remove Isochronous Data Path (Octet 43 - Bit 4)
          LE Isochronous Transmit Test (Octet 43 - Bit 5)
          LE Isochronous Receive Test (Octet 43 - Bit 6)
          LE Isochronous Read Test Counters (Octet 43 - Bit 7)
          LE Isochronous Read Test Counters (Octet 44 - Bit 0)
          LE Set Host Feature (Octet 44 - Bit 1)
          LE Read ISO link quality (Octet 44 - Bit 2)
          Octet 45 - Bit 6 
          Octet 46 - Bit 0 
          Octet 46 - Bit 1 
          Octet 46 - Bit 2 
zephyr.exe[1603885]: < HCI Command: Host Buffer Size (0x03|0x0033) plen 7                                             #9 0.865249
        ACL MTU: 255  ACL max packet: 16
        SCO MTU: 0    SCO max packet: 0
> HCI Event: Command Complete (0x0e) plen 4                                                                          #10 0.865827
      Host Buffer Size (0x03|0x0033) ncmd 1
        Status: Success (0x00)
zephyr.exe[1603885]: < HCI Command: Set Controller To Host Flow Control (0x03|0x0031) plen 1                         #11 0.885158
        Flow control: ACL Data Packets (0x01)
> HCI Event: Command Complete (0x0e) plen 4                                                                          #12 0.885924
      Set Controller To Host Flow Control (0x03|0x0031) ncmd 1
        Status: Success (0x00)
zephyr.exe[1603885]: < HCI Command: LE Read Local Supported Features (0x08|0x0003) plen 0                            #13 0.905244
> HCI Event: Command Complete (0x0e) plen 12                                                                         #14 0.906237
      LE Read Local Supported Features (0x08|0x0003) ncmd 1
        Status: Success (0x00)
        Features: 0xfd 0x79 0x00 0xf7 0x30 0x01 0x00 0x00
          LE Encryption
          Extended Reject Indication
          Peripheral-initiated Features Exchange
          LE Ping
          LE Data Packet Length Extension
          LL Privacy
          Extended Scanner Filter Policies
          LE 2M PHY
          LE Coded PHY
          LE Extended Advertising
          LE Periodic Advertising
          Channel Selection Algorithm #2
          Periodic Advertising Sync Transfer - Sender
          Periodic Advertising Sync Transfer - Recipient
          Sleep Clock Accuracy Updates
          Connected Isochronous Stream - Central
          Connected Isochronous Stream - Peripheral
          Isochronous Broadcaster
          Synchronized Receiver
          Periodic Advertising ADI support
          Connection Subrating
          Unknown features (0x0000010000000000)
zephyr.exe[1603885]: < HCI Command: LE Set Host Feature (0x08|0x0074) plen 2                                         #15 0.925242
        Bit Number: 32
          Connected Isochronous Stream (Host Support)
        Bit Value: 1
> HCI Event: Command Complete (0x0e) plen 4                                                                          #16 0.925767
      LE Set Host Feature (0x08|0x0074) ncmd 1
        Status: Success (0x00)
zephyr.exe[1603885]: < HCI Command: LE Read Buffer v2 (0x08|0x0060) plen 0                                           #17 0.945256
> HCI Event: Command Complete (0x0e) plen 10                                                                         #18 0.945783
      LE Read Buffer v2 (0x08|0x0060) ncmd 1
        Status: Success (0x00)
        ACL MTU: 27
        ACL max packet: 3
        ISO MTU: 318
        ISO max packet: 3
zephyr.exe[1603885]: < HCI Command: LE Read Maximum Advertising Data Length (0x08|0x003a) plen 0                     #19 0.965270
> HCI Event: Command Complete (0x0e) plen 6                                                                          #20 0.966013
      LE Read Maximum Advertising Data Length (0x08|0x003a) ncmd 1
        Status: Success (0x00)
        Max length: 1650
zephyr.exe[1603885]: < HCI Command: LE Read Supported States (0x08|0x001c) plen 0                                    #21 0.985249
> HCI Event: Command Complete (0x0e) plen 12                                                                         #22 0.986009
      LE Read Supported States (0x08|0x001c) ncmd 1
        Status: Success (0x00)
        States: 0x000003ff3e0306ff
          Non-connectable Advertising State
          Scannable Advertising State
          Connectable Advertising State
          High Duty Cycle Directed Advertising State
          Passive Scanning State
          Active Scanning State
          Initiating State
            and Connection State (Central Role)
          Connection State (Peripheral Role)
          Scannable Advertising State
            and Passive Scanning State
          Connectable Advertising State
            and Passive Scanning State
          Non-connectable Advertising State
            and Initiating State
          Scannable Advertising State
            and Initiating State
          Active Scanning State
            and Connection State (Central Role)
          Passive Scanning State
            and Connection State (Peripheral Role)
          Active Scanning State
            and Connection State (Peripheral Role)
          Initiating State
            and Connection State (Central Role)
            and Central Role & Central Role
          Low Duty Cycle Directed Advertising State
          Connectable Advertising State
            and Initiating State
            and Central Role & Peripheral Role
          High Duty Cycle Directed Advertising State
            and Initiating State
            and Central Role & Peripheral Role
          Low Duty Cycle Directed Advertising State
            and Initiating State
            and Central Role & Peripheral Role
          Connectable Advertising State
            and Connection State (Central Role)
            and Central Role & Peripheral Role
          High Duty Cycle Directed Advertising State
            and Connection State (Central Role)
            and Central Role & Peripheral Role
          Low Duty Cycle Directed Advertising State
            and Connection State (Central Role)
            and Central Role & Peripheral Role
          Connectable Advertising State
            and Connection State (Peripheral Role)
            and Central Role & Peripheral Role
          High Duty Cycle Directed Advertising State
            and Connection State (Peripheral Role)
            and Peripheral Role & Peripheral Role
          Low Duty Cycle Directed Advertising State
            and Connection State (Peripheral Role)
            and Peripheral Role & Peripheral Role
          Initiating State
            and Connection State (Peripheral Role)
            and Central Role & Peripheral Role
zephyr.exe[1603885]: < HCI Command: LE Read Maximum Data Length (0x08|0x002f) plen 0                                 #23 1.005260
> HCI Event: Command Complete (0x0e) plen 12                                                                         #24 1.006190
      LE Read Maximum Data Length (0x08|0x002f) ncmd 1
        Status: Success (0x00)
        Max TX octets: 251
        Max TX time: 2704
        Max RX octets: 251
        Max RX time: 2704
zephyr.exe[1603885]: < HCI Command: LE Write Suggested Default Data Length (0x08|0x0024) plen 4                      #25 1.025291
        TX octets: 251
        TX time: 2704
> HCI Event: Command Complete (0x0e) plen 4                                                                          #26 1.026223
      LE Write Suggested Default Data Length (0x08|0x0024) ncmd 1
        Status: Success (0x00)
zephyr.exe[1603885]: < HCI Command: LE Read Resolving List Size (0x08|0x002a) plen 0                                 #27 1.045251
> HCI Event: Command Complete (0x0e) plen 5                                                                          #28 1.045907
      LE Read Resolving List Size (0x08|0x002a) ncmd 1
        Status: Success (0x00)
        Size: 8
zephyr.exe[1603885]: < HCI Command: LE Set Event Mask (0x08|0x0001) plen 8                                           #29 1.065259
        Mask: 0x000002023f87fa5e
          LE Advertising Report
          LE Connection Update Complete
          LE Read Remote Used Features Complete
          LE Long Term Key Request
          LE Data Length Change
          LE Enhanced Connection Complete
          LE PHY Update Complete
          LE Extended Advertising Report
          LE Periodic Advertising Sync Established
          LE Periodic Advertising Report
          LE Periodic Advertising Sync Lost
          LE Extended Scan Timeout
          LE Extended Advertising Set Terminated
          LE Scan Request Received
          LE Periodic Advertising Sync Transfer Rvc
          LE CIS Established
          LE CIS Request
          LE Create BIG Complete
          LE Terminate BIG Complete
          LE BIG Sync Established Complete
          LE BIG Sync Lost
          LE BIG Info Advertising Report
          Unknown mask (0x0000020000000000)
> HCI Event: Command Complete (0x0e) plen 4                                                                          #30 1.065998
      LE Set Event Mask (0x08|0x0001) ncmd 1
        Status: Success (0x00)
zephyr.exe[1603885]: < HCI Command: Set Event Mask (0x03|0x0001) plen 8                                              #31 1.085258
        Mask: 0x2000800002008890
          Disconnection Complete
          Encryption Change
          Read Remote Version Information Complete
          Hardware Error
          Data Buffer Overflow
          Encryption Key Refresh Complete
          LE Meta
> HCI Event: Command Complete (0x0e) plen 4                                                                          #32 1.085993
      Set Event Mask (0x03|0x0001) ncmd 1
        Status: Success (0x00)
zephyr.exe[1603885]: < HCI Command: Read BD ADDR (0x04|0x0009) plen 0                                                #33 1.105270
> HCI Event: Command Complete (0x0e) plen 10                                                                         #34 1.105857
      Read BD ADDR (0x04|0x0009) ncmd 1
        Status: Success (0x00)
        Address: 00:00:00:00:00:00 (OUI 00-00-00)
zephyr.exe[1603885]: < HCI Command: LE Set Random Address (0x08|0x0005) plen 6                                       #35 1.125254
        Address: D5:B6:CC:31:DB:3B (Static)
> HCI Event: Command Complete (0x0e) plen 4                                                                          #36 1.126262
      LE Set Random Address (0x08|0x0005) ncmd 1
        Status: Success (0x00)
zephyr.exe[1603885]: < HCI Command: LE Set Extended Advertising Parameters (0x08|0x0036) plen 25                     #37 1.745265
        Handle: 0x00
        Properties: 0x0001
          Connectable
        Min advertising interval: 100.000 msec (0x00a0)
        Max advertising interval: 150.000 msec (0x00f0)
        Channel map: 37, 38, 39 (0x07)
        Own address type: Random (0x01)
        Peer address type: Public (0x00)
        Peer address: 00:00:00:00:00:00 (OUI 00-00-00)
        Filter policy: Allow Scan Request from Any, Allow Connect Request from Any (0x00)
        TX power: Host has no preference (0x7f)
        Primary PHY: LE 1M (0x01)
        Secondary max skip: 0x00
        Secondary PHY: LE 2M (0x02)
        SID: 0x00
        Scan request notifications: Disabled (0x00)
> HCI Event: Command Complete (0x0e) plen 5                                                                          #38 1.746211
      LE Set Extended Advertising Parameters (0x08|0x0036) ncmd 1
        Status: Success (0x00)
        TX power (selected): 0 dbm (0x00)
zephyr.exe[1603885]: < HCI Command: LE Set Advertising Set Random Address (0x08|0x0035) plen 7                       #39 1.765274
        Advertising handle: 0x00
        Advertising random address: D5:B6:CC:31:DB:3B (Static)
> HCI Event: Command Complete (0x0e) plen 4                                                                          #40 1.765996
      LE Set Advertising Set Random Address (0x08|0x0035) ncmd 1
        Status: Success (0x00)
zephyr.exe[1603885]: < HCI Command: LE Set Extended Advertising Data (0x08|0x0037) plen 39                           #41 1.785255
        Handle: 0x00
        Operation: Complete extended advertising data (0x03)
        Fragment preference: Minimize fragmentation (0x01)
        Data length: 0x23
        Flags: 0x06
          LE General Discoverable Mode
          BR/EDR Not Supported
        Name (complete): Tester_F6B11A
        Flags: 0x06
          LE General Discoverable Mode
          BR/EDR Not Supported
        16-bit Service UUIDs (complete): 1 entry
          Audio Stream Control (0x184e)
        Service Data: Audio Stream Control (0x184e)
          Data[6]: 01ff0fff0f00
> HCI Event: Command Complete (0x0e) plen 4                                                                          #42 1.787220
      LE Set Extended Advertising Data (0x08|0x0037) ncmd 1
        Status: Success (0x00)
zephyr.exe[1603885]: < HCI Command: LE Set Extended Advertising Enable (0x08|0x0039) plen 6                          #43 1.805261
        Extended advertising: Enabled (0x01)
        Number of sets: 1 (0x01)
        Entry 0
          Handle: 0x00
          Duration: 0 ms (0x00)
          Max ext adv events: 0
> HCI Event: Command Complete (0x0e) plen 4                                                                          #44 1.806008
      LE Set Extended Advertising Enable (0x08|0x0039) ncmd 1
        Status: Success (0x00)
> HCI Event: LE Meta Event (0x3e) plen 31                                                                            #45 3.396252
      LE Enhanced Connection Complete (0x0a)
        Status: Success (0x00)
        Handle: 111
        Role: Peripheral (0x01)
        Peer address type: Public (0x00)
        Peer address: DF:A9:FF:F6:B1:1A (OUI DF-A9-FF)
        Local resolvable private address: 00:00:00:00:00:00 (Non-Resolvable)
        Peer resolvable private address: 00:00:00:00:00:00 (Non-Resolvable)
        Connection interval: 87.50 msec (0x0046)
        Connection latency: 0 (0x0000)
        Supervision timeout: 25120 msec (0x09d0)
        Central clock accuracy: 0x01
> HCI Event: LE Meta Event (0x3e) plen 6                                                                             #46 3.396254
      LE Advertising Set Terminated (0x12)
        Status: Success (0x00)
        Handle: 0
        Connection handle: 111
        Number of completed extended advertising events: 0
zephyr.exe[1603885]: < HCI Command: LE Read Remote Used Features (0x08|0x0016) plen 2                                #47 3.405443
        Handle: 111 Address: DF:A9:FF:F6:B1:1A (OUI DF-A9-FF)
> HCI Event: Command Status (0x0f) plen 4                                                                            #48 3.406082
      LE Read Remote Used Features (0x08|0x0016) ncmd 1
        Status: Success (0x00)
zephyr.exe[1603885]: < ACL Data TX: Handle 111 [1/3] flags 0x00 dlen 7                                               #49 3.425241
      ATT: Exchange MTU Request (0x02) len 2
        Client RX MTU: 251
> HCI Event: Number of Completed Packets (0x13) plen 5                                                               #50 3.572997
        Num handles: 1
        Handle: 111 Address: DF:A9:FF:F6:B1:1A (OUI DF-A9-FF)
        Count: 1
        Buffers: 0/3
        #49: len 7 (0 Kb/s)
        Latency: 147 msec (147-147 msec ~147 msec)
> HCI Event: LE Meta Event (0x3e) plen 12                                                                            #51 3.661427
      LE Read Remote Used Features (0x04)
        Status: Success (0x00)
        Handle: 111 Address: DF:A9:FF:F6:B1:1A (OUI DF-A9-FF)
        Features: 0x2d 0x49 0x00 0xf7 0x67 0xd8 0x00 0x00
          LE Encryption
          Extended Reject Indication
          Peripheral-initiated Features Exchange
          LE Data Packet Length Extension
          LE 2M PHY
          LE Coded PHY
          Channel Selection Algorithm #2
          Periodic Advertising Sync Transfer - Sender
          Periodic Advertising Sync Transfer - Recipient
          Sleep Clock Accuracy Updates
          Connected Isochronous Stream - Central
          Connected Isochronous Stream - Peripheral
          Isochronous Broadcaster
          Synchronized Receiver
          Connected Isochronous Stream (Host Support)
          LE Power Control Request
          LE Power Control Request
          Connection Subrating
          Connection Subrating (Host Support)
          Unknown features (0x0000d80000000000)
zephyr.exe[1603885]: < HCI Command: LE Remove Advertising Set (0x08|0x003c) plen 1                                   #52 3.915334
        Handle: 0
> HCI Event: Command Complete (0x0e) plen 4                                                                          #53 3.915953
      LE Remove Advertising Set (0x08|0x003c) ncmd 1
        Status: Success (0x00)
zephyr.exe[1603885]: < HCI Command: LE Set Extended Advertising Parameters (0x08|0x0036) plen 25                     #54 3.925291
        Handle: 0x00
        Properties: 0x0001
          Connectable
        Min advertising interval: 100.000 msec (0x00a0)
        Max advertising interval: 150.000 msec (0x00f0)
        Channel map: 37, 38, 39 (0x07)
        Own address type: Random (0x01)
        Peer address type: Public (0x00)
        Peer address: 00:00:00:00:00:00 (OUI 00-00-00)
        Filter policy: Allow Scan Request from Any, Allow Connect Request from Any (0x00)
        TX power: Host has no preference (0x7f)
        Primary PHY: LE 1M (0x01)
        Secondary max skip: 0x00
        Secondary PHY: LE 2M (0x02)
        SID: 0x01
        Scan request notifications: Disabled (0x00)
> HCI Event: Command Complete (0x0e) plen 5                                                                          #55 3.926371
      LE Set Extended Advertising Parameters (0x08|0x0036) ncmd 1
        Status: Success (0x00)
        TX power (selected): 0 dbm (0x00)
zephyr.exe[1603885]: < HCI Command: LE Set Advertising Set Random Address (0x08|0x0035) plen 7                       #56 3.945257
        Advertising handle: 0x00
        Advertising random address: D5:B6:CC:31:DB:3B (Static)
> HCI Event: Command Complete (0x0e) plen 4                                                                          #57 3.945850
      LE Set Advertising Set Random Address (0x08|0x0035) ncmd 1
        Status: Success (0x00)
zephyr.exe[1603885]: < HCI Command: LE Set Extended Advertising Data (0x08|0x0037) plen 39                           #58 3.965338
        Handle: 0x00
        Operation: Complete extended advertising data (0x03)
        Fragment preference: Minimize fragmentation (0x01)
        Data length: 0x23
        Flags: 0x06
          LE General Discoverable Mode
          BR/EDR Not Supported
        Name (complete): Tester_F6B11A
        Flags: 0x06
          LE General Discoverable Mode
          BR/EDR Not Supported
        16-bit Service UUIDs (complete): 1 entry
          Audio Stream Control (0x184e)
        Service Data: Audio Stream Control (0x184e)
          Data[6]: 01ff0fff0f00
> HCI Event: Command Complete (0x0e) plen 4                                                                          #59 3.966609
      LE Set Extended Advertising Data (0x08|0x0037) ncmd 1
        Status: Success (0x00)
zephyr.exe[1603885]: < HCI Command: LE Set Extended Advertising Enable (0x08|0x0039) plen 6                          #60 3.985295
        Extended advertising: Enabled (0x01)
        Number of sets: 1 (0x01)
        Entry 0
          Handle: 0x00
          Duration: 0 ms (0x00)
          Max ext adv events: 0
> HCI Event: Command Complete (0x0e) plen 4                                                                          #61 3.986057
      LE Set Extended Advertising Enable (0x08|0x0039) ncmd 1
        Status: Success (0x00)
> ACL Data RX: Handle 111 flags 0x02 dlen 7                                                                          #62 4.097974
      ATT: Exchange MTU Request (0x02) len 2
        Client RX MTU: 64
> ACL Data RX: Handle 111 flags 0x02 dlen 7                                                                          #63 4.098355
      ATT: Exchange MTU Response (0x03) len 2
        Server RX MTU: 64
zephyr.exe[1603885]: < HCI Command: Host Number of Completed Packets (0x03|0x0035) plen 5                            #64 4.105409
        Num handles: 1
        Handle: 111 Address: DF:A9:FF:F6:B1:1A (OUI DF-A9-FF)
        Count: 1
zephyr.exe[1603885]: < ACL Data TX: Handle 111 [1/3] flags 0x00 dlen 7                                               #65 4.105476
      ATT: Exchange MTU Response (0x03) len 2
        Server RX MTU: 251
zephyr.exe[1603885]: < HCI Command: Host Number of Completed Packets (0x03|0x0035) plen 5                            #66 4.105526
        Num handles: 1
        Handle: 111 Address: DF:A9:FF:F6:B1:1A (OUI DF-A9-FF)
        Count: 1
> HCI Event: Number of Completed Packets (0x13) plen 5                                                               #67 4.272754
        Num handles: 1
        Handle: 111 Address: DF:A9:FF:F6:B1:1A (OUI DF-A9-FF)
        Count: 1
        Buffers: 0/3
        #65: len 7 (0 Kb/s)
        Latency: 167 msec (147-167 msec ~157 msec)
> ACL Data RX: Handle 111 flags 0x02 dlen 11                                                                         #68 6.199090
      SMP: Pairing Request (0x01) len 6
        IO capability: KeyboardDisplay (0x04)
        OOB data: Authentication data not present (0x00)
        Authentication requirement: Bonding, No MITM, SC, No Keypresses (0x09)
        Max encryption key size: 16
        Initiator key distribution: EncKey IdKey (0x03)
        Responder key distribution: EncKey IdKey Sign (0x07)
zephyr.exe[1603885]: < HCI Command: Host Number of Completed Packets (0x03|0x0035) plen 5                            #69 6.205458
        Num handles: 1
        Handle: 111 Address: DF:A9:FF:F6:B1:1A (OUI DF-A9-FF)
        Count: 1
zephyr.exe[1603885]: < ACL Data TX: Handle 111 [1/3] flags 0x00 dlen 11                                              #70 6.205484
      SMP: Pairing Response (0x02) len 6
        IO capability: NoInputNoOutput (0x03)
        OOB data: Authentication data not present (0x00)
        Authentication requirement: Bonding, No MITM, SC, No Keypresses (0x09)
        Max encryption key size: 16
        Initiator key distribution: IdKey (0x02)
        Responder key distribution: Sign (0x04)
> HCI Event: Number of Completed Packets (0x13) plen 5                                                               #71 6.372864
        Num handles: 1
        Handle: 111 Address: DF:A9:FF:F6:B1:1A (OUI DF-A9-FF)
        Count: 1
        Buffers: 0/3
        #70: len 11 (0 Kb/s)
        Latency: 167 msec (147-167 msec ~162 msec)
> ACL Data RX: Handle 111 flags 0x02 dlen 27                                                                         #72 6.373475
> ACL Data RX: Handle 111 flags 0x01 dlen 27                                                                         #73 6.373751
> ACL Data RX: Handle 111 flags 0x01 dlen 15                                                                         #74 6.373843
      SMP: Pairing Public Key (0x0c) len 64
        X[32]: 189a6bd791d7fa3bfd0de2eb0fae299ab561bfad5b54ede836f2ba5454109ae5
        Y[32]: 90ffe6c911921d0f58357ab3152aa7bd0e7ae5d87f383d8171fc1e400731352a
zephyr.exe[1603885]: < HCI Command: Host Number of Completed Packets (0x03|0x0035) plen 5                            #75 6.385501
        Num handles: 1
        Handle: 111 Address: DF:A9:FF:F6:B1:1A (OUI DF-A9-FF)
        Count: 1
zephyr.exe[1603885]: < HCI Command: Host Number of Completed Packets (0x03|0x0035) plen 5                            #76 6.385505
        Num handles: 1
        Handle: 111 Address: DF:A9:FF:F6:B1:1A (OUI DF-A9-FF)
        Count: 1
zephyr.exe[1603885]: < HCI Command: Host Number of Completed Packets (0x03|0x0035) plen 5                            #77 6.385570
        Num handles: 1
        Handle: 111 Address: DF:A9:FF:F6:B1:1A (OUI DF-A9-FF)
        Count: 1
zephyr.exe[1603885]: < ACL Data TX: Handle 111 [1/3] flags 0x00 dlen 27                                              #78 6.385573
zephyr.exe[1603885]: < ACL Data TX: Handle 111 flags 0x01 dlen 27                                                    #79 6.385574
zephyr.exe[1603885]: < ACL Data TX: Handle 111 flags 0x01 dlen 15                                                    #80 6.385575
      SMP: Pairing Public Key (0x0c) len 64
        X[32]: 98308440221e2d910f0e54b71e7ec652857aa9b5a0dc65028824cc19db1226e9
        Y[32]: 67a4816bcb62efb21701e31fdb27561a6217575fb007a8bbdabe7e28b6f68482
> HCI Event: Number of Completed Packets (0x13) plen 5                                                               #81 6.460673
        Num handles: 1
        Handle: 111 Address: DF:A9:FF:F6:B1:1A (OUI DF-A9-FF)
        Count: 1
        Buffers: 0/3
        #78: len 27 (2 Kb/s)
        Latency: 75 msec (75-167 msec ~118 msec)
> HCI Event: Number of Completed Packets (0x13) plen 5                                                               #82 6.461155
        Num handles: 1
        Handle: 111 Address: DF:A9:FF:F6:B1:1A (OUI DF-A9-FF)
        Count: 1
        Buffers: underflow/3
        #79: len 27 (2 Kb/s)
        Latency: 75 msec (75-167 msec ~97 msec)
zephyr.exe[1603885]: < ACL Data TX: Handle 111 [1/3] flags 0x00 dlen 21                                              #83 6.465273
      SMP: Pairing Confirm (0x03) len 16
        Confirm value[16]: bf71067614ec39711e5da954957053d0
> HCI Event: Number of Completed Packets (0x13) plen 5                                                               #84 6.547987
        Num handles: 1
        Handle: 111 Address: DF:A9:FF:F6:B1:1A (OUI DF-A9-FF)
        Count: 1
        Buffers: 0/3
        #80: len 15 (0 Kb/s)
        Latency: 162 msec (75-167 msec ~129 msec)
> HCI Event: Number of Completed Packets (0x13) plen 5                                                               #85 6.635469
        Num handles: 1
        Handle: 111 Address: DF:A9:FF:F6:B1:1A (OUI DF-A9-FF)
        Count: 1
        Buffers: underflow/3
        #83: len 21 (0 Kb/s)
        Latency: 170 msec (75-170 msec ~149 msec)
> ACL Data RX: Handle 111 flags 0x02 dlen 21                                                                         #86 6.635552
      SMP: Pairing Random (0x04) len 16
        Random value[16]: 4b218b828d66928b0000000000000000
zephyr.exe[1603885]: < HCI Command: Host Number of Completed Packets (0x03|0x0035) plen 5                            #87 6.645366
        Num handles: 1
        Handle: 111 Address: DF:A9:FF:F6:B1:1A (OUI DF-A9-FF)
        Count: 1
zephyr.exe[1603885]: < ACL Data TX: Handle 111 [1/3] flags 0x00 dlen 21                                              #88 6.645415
      SMP: Pairing Random (0x04) len 16
        Random value[16]: 8e6108f966a694cbe26df70bb96773e6
> HCI Event: Number of Completed Packets (0x13) plen 5                                                               #89 6.810316
        Num handles: 1
        Handle: 111 Address: DF:A9:FF:F6:B1:1A (OUI DF-A9-FF)
        Count: 1
        Buffers: 0/3
        #88: len 21 (1 Kb/s)
        Latency: 164 msec (75-170 msec ~157 msec)
> ACL Data RX: Handle 111 flags 0x02 dlen 21                                                                         #90 6.985379
      SMP: Pairing DHKey Check (0x0d) len 16
        E[16]: 12a67985f3fff05840cbf0999a7946d4
zephyr.exe[1603885]: < HCI Command: Host Number of Completed Packets (0x03|0x0035) plen 5                            #91 7.005494
        Num handles: 1
        Handle: 111 Address: DF:A9:FF:F6:B1:1A (OUI DF-A9-FF)
        Count: 1
zephyr.exe[1603885]: < ACL Data TX: Handle 111 [1/3] flags 0x00 dlen 21                                              #92 7.005518
      SMP: Pairing DHKey Check (0x0d) len 16
        E[16]: 51e639b3bcb274819ef7837a56e010c4
> HCI Event: Number of Completed Packets (0x13) plen 5                                                               #93 7.160398
        Num handles: 1
        Handle: 111 Address: DF:A9:FF:F6:B1:1A (OUI DF-A9-FF)
        Count: 1
        Buffers: 0/3
        #92: len 21 (1 Kb/s)
        Latency: 154 msec (75-170 msec ~156 msec)
> HCI Event: LE Meta Event (0x3e) plen 13                                                                            #94 7.248337
      LE Long Term Key Request (0x05)
        Handle: 111 Address: DF:A9:FF:F6:B1:1A (OUI DF-A9-FF)
        Random number: 0x0000000000000000
        Encrypted diversifier: 0x0000
zephyr.exe[1603885]: < HCI Command: LE Long Term Key Request Reply (0x08|0x001a) plen 18                             #95 7.265419
        Handle: 111 Address: DF:A9:FF:F6:B1:1A (OUI DF-A9-FF)
        Long term key[16]: 52736d9adcec7c4fcab63daf8467d002
> HCI Event: Command Complete (0x0e) plen 6                                                                          #96 7.267339
      LE Long Term Key Request Reply (0x08|0x001a) ncmd 1
        Status: Success (0x00)
        Handle: 111 Address: DF:A9:FF:F6:B1:1A (OUI DF-A9-FF)
> HCI Event: Encryption Change (0x08) plen 4                                                                         #97 7.685365
        Status: Success (0x00)
        Handle: 111 Address: DF:A9:FF:F6:B1:1A (OUI DF-A9-FF)
        Encryption: Enabled with AES-CCM (0x01)
zephyr.exe[1603885]: < ACL Data TX: Handle 111 [1/3] flags 0x00 dlen 21                                              #98 7.815465
      SMP: Signing Information (0x0a) len 16
        Signature key[16]: 5da095555cc64d02679f89a05211af56
> HCI Event: Number of Completed Packets (0x13) plen 5                                                               #99 7.947839
        Num handles: 1
        Handle: 111 Address: DF:A9:FF:F6:B1:1A (OUI DF-A9-FF)
        Count: 1
        Buffers: 0/3
        #98: len 21 (1 Kb/s)
        Latency: 132 msec (75-170 msec ~144 msec)
> ACL Data RX: Handle 111 flags 0x02 dlen 21                                                                        #100 7.947967
      SMP: Identity Information (0x08) len 16
        Identity resolving key[16]: ac3d5e72ff69ab5051f1dca5dafa0f66
> ACL Data RX: Handle 111 flags 0x02 dlen 12                                                                        #101 7.948359
      SMP: Identity Address Information (0x09) len 7
        Address: DF:A9:FF:F6:B1:1A (OUI DF-A9-FF)
zephyr.exe[1603885]: < HCI Command: Host Number of Completed Packets (0x03|0x0035) plen 5                           #102 7.965356
        Num handles: 1
        Handle: 111 Address: DF:A9:FF:F6:B1:1A (OUI DF-A9-FF)
        Count: 1
zephyr.exe[1603885]: < HCI Command: LE Set Extended Advertising Enable (0x08|0x0039) plen 6                         #103 7.965363
        Extended advertising: Disabled (0x00)
        Number of sets: 1 (0x01)
        Entry 0
          Handle: 0x00
          Duration: 0 ms (0x00)
          Max ext adv events: 0
> HCI Event: Command Complete (0x0e) plen 4                                                                         #104 7.966155
      LE Set Extended Advertising Enable (0x08|0x0039) ncmd 1
        Status: Success (0x00)
zephyr.exe[1603885]: < HCI Command: LE Add Device To Resolving List (0x08|0x0027) plen 39                           #105 7.985344
        Address type: Public (0x00)
        Address: DF:A9:FF:F6:B1:1A (OUI DF-A9-FF)
        Peer identity resolving key[16]: ac3d5e72ff69ab5051f1dca5dafa0f66
        Local identity resolving key[16]: 00000000000000000000000000000000
> HCI Event: Command Complete (0x0e) plen 4                                                                         #106 7.986566
      LE Add Device To Resolving List (0x08|0x0027) ncmd 1
        Status: Success (0x00)
zephyr.exe[1603885]: < HCI Command: LE Set Privacy Mode (0x08|0x004e) plen 8                                        #107 8.005404
        Peer Identity address type: Public (0x00)
        Peer Identity address: DF:A9:FF:F6:B1:1A (OUI DF-A9-FF)
        Privacy Mode: Use Device Privacy (0x01)
> HCI Event: Command Complete (0x0e) plen 4                                                                         #108 8.006029
      LE Set Privacy Mode (0x08|0x004e) ncmd 1
        Status: Success (0x00)
zephyr.exe[1603885]: < HCI Command: LE Set Address Resolution Enable (0x08|0x002d) plen 1                           #109 8.025314
        Address resolution: Enabled (0x01)
> HCI Event: Command Complete (0x0e) plen 4                                                                         #110 8.025939
      LE Set Address Resolution Enable (0x08|0x002d) ncmd 1
        Status: Success (0x00)
zephyr.exe[1603885]: < HCI Command: LE Set Extended Advertising Enable (0x08|0x0039) plen 6                         #111 8.045430
        Extended advertising: Enabled (0x01)
        Number of sets: 1 (0x01)
        Entry 0
          Handle: 0x00
          Duration: 0 ms (0x00)
          Max ext adv events: 0
> HCI Event: Command Complete (0x0e) plen 4                                                                         #112 8.046295
      LE Set Extended Advertising Enable (0x08|0x0039) ncmd 1
        Status: Success (0x00)
zephyr.exe[1603885]: < HCI Command: Host Number of Completed Packets (0x03|0x0035) plen 5                           #113 8.065315
        Num handles: 1
        Handle: 111 Address: DF:A9:FF:F6:B1:1A (OUI DF-A9-FF)
        Count: 1
> ACL Data RX: Handle 111 flags 0x02 dlen 13                                                                        #114 8.210421
      ATT: Find By Type Value Request (0x06) len 8
        Handle range: 0x0001-0xffff
        Attribute type: Primary Service (0x2800)
          UUID: Broadcast Audio Scan (0x184f)
zephyr.exe[1603885]: < HCI Command: Host Number of Completed Packets (0x03|0x0035) plen 5                           #115 8.225431
        Num handles: 1
        Handle: 111 Address: DF:A9:FF:F6:B1:1A (OUI DF-A9-FF)
        Count: 1
zephyr.exe[1603885]: < ACL Data TX: Handle 111 [1/3] flags 0x00 dlen 9                                              #116 8.225459
      ATT: Find By Type Value Response (0x07) len 4
        Handle range: 0x0047-0x004c
> HCI Event: Number of Completed Packets (0x13) plen 5                                                              #117 8.385484
        Num handles: 1
        Handle: 111 Address: DF:A9:FF:F6:B1:1A (OUI DF-A9-FF)
        Count: 1
        Buffers: 0/3
        #116: len 9 (0 Kb/s)
        Latency: 160 msec (75-170 msec ~152 msec)
> ACL Data RX: Handle 111 flags 0x02 dlen 13                                                                        #118 8.385487
      ATT: Find By Type Value Request (0x06) len 8
        Handle range: 0x004d-0xffff
        Attribute type: Primary Service (0x2800)
          UUID: Broadcast Audio Scan (0x184f)
zephyr.exe[1603885]: < HCI Command: Host Number of Completed Packets (0x03|0x0035) plen 5                           #119 8.405416
        Num handles: 1
        Handle: 111 Address: DF:A9:FF:F6:B1:1A (OUI DF-A9-FF)
        Count: 1
zephyr.exe[1603885]: < ACL Data TX: Handle 111 [1/3] flags 0x00 dlen 9                                              #120 8.405443
      ATT: Error Response (0x01) len 4
        Find By Type Value Request (0x06)
        Handle: 0x004d
        Error: Attribute Not Found (0x0a)
> HCI Event: Number of Completed Packets (0x13) plen 5                                                              #121 8.560366
        Num handles: 1
        Handle: 111 Address: DF:A9:FF:F6:B1:1A (OUI DF-A9-FF)
        Count: 1
        Buffers: 0/3
        #120: len 9 (0 Kb/s)
        Latency: 154 msec (75-170 msec ~153 msec)
> ACL Data RX: Handle 111 flags 0x02 dlen 11                                                                        #122 8.560436
      ATT: Read By Type Request (0x08) len 6
        Handle range: 0x0047-0x004c
        Attribute type: Characteristic (0x2803)
zephyr.exe[1603885]: < HCI Command: Host Number of Completed Packets (0x03|0x0035) plen 5                           #123 8.565363
        Num handles: 1
        Handle: 111 Address: DF:A9:FF:F6:B1:1A (OUI DF-A9-FF)
        Count: 1
zephyr.exe[1603885]: < ACL Data TX: Handle 111 [1/3] flags 0x00 dlen 20                                             #124 8.565368
      ATT: Read By Type Response (0x09) len 15
        Attribute data length: 7
        Attribute data list: 2 entries
        Handle: 0x0048
        Value[5]: 0c4900c72b
            Properties: 0x0c
              Write Without Response (0x04)
              Write (0x08)
            Value Handle: 0x0049
            Value UUID: Broadcast Audio Scan Control Point (0x2bc7)
        Handle: 0x004a
        Value[5]: 124b00c82b
            Properties: 0x12
              Read (0x02)
              Notify (0x10)
            Value Handle: 0x004b
            Value UUID: Broadcast Receive State (0x2bc8)
> HCI Event: Number of Completed Packets (0x13) plen 5                                                              #125 8.735357
        Num handles: 1
        Handle: 111 Address: DF:A9:FF:F6:B1:1A (OUI DF-A9-FF)
        Count: 1
        Buffers: 0/3
        #124: len 20 (0 Kb/s)
        Latency: 169 msec (75-170 msec ~161 msec)
> ACL Data RX: Handle 111 flags 0x02 dlen 11                                                                        #126 8.735563
      ATT: Read By Type Request (0x08) len 6
        Handle range: 0x004b-0x004c
        Attribute type: Characteristic (0x2803)
zephyr.exe[1603885]: < HCI Command: Host Number of Completed Packets (0x03|0x0035) plen 5                           #127 8.745374
        Num handles: 1
        Handle: 111 Address: DF:A9:FF:F6:B1:1A (OUI DF-A9-FF)
        Count: 1
zephyr.exe[1603885]: < ACL Data TX: Handle 111 [1/3] flags 0x00 dlen 9                                              #128 8.745400
      ATT: Error Response (0x01) len 4
        Read By Type Request (0x08)
        Handle: 0x004b
        Error: Attribute Not Found (0x0a)
> HCI Event: Number of Completed Packets (0x13) plen 5                                                              #129 8.910166
        Num handles: 1
        Handle: 111 Address: DF:A9:FF:F6:B1:1A (OUI DF-A9-FF)
        Count: 1
        Buffers: 0/3
        #128: len 9 (0 Kb/s)
        Latency: 164 msec (75-170 msec ~163 msec)
> ACL Data RX: Handle 111 flags 0x02 dlen 9                                                                         #130 8.910389
      ATT: Find Information Request (0x04) len 4
        Handle range: 0x004c-0x004c
zephyr.exe[1603885]: < HCI Command: Host Number of Completed Packets (0x03|0x0035) plen 5                           #131 8.925405
        Num handles: 1
        Handle: 111 Address: DF:A9:FF:F6:B1:1A (OUI DF-A9-FF)
        Count: 1
zephyr.exe[1603885]: < ACL Data TX: Handle 111 [1/3] flags 0x00 dlen 10                                             #132 8.925470
      ATT: Find Information Response (0x05) len 5
        Format: UUID-16 (0x01)
        Handle: 0x004c
        UUID: Client Characteristic Configuration (0x2902)
> HCI Event: Number of Completed Packets (0x13) plen 5                                                              #133 9.085199
        Num handles: 1
        Handle: 111 Address: DF:A9:FF:F6:B1:1A (OUI DF-A9-FF)
        Count: 1
        Buffers: 0/3
        #132: len 10 (0 Kb/s)
        Latency: 159 msec (75-170 msec ~161 msec)
> ACL Data RX: Handle 111 flags 0x02 dlen 9                                                                         #134 9.085590
      ATT: Write Request (0x12) len 4
        Handle: 0x004c
          Data[2]: 0000
zephyr.exe[1603885]: < HCI Command: Host Number of Completed Packets (0x03|0x0035) plen 5                           #135 9.105444
        Num handles: 1
        Handle: 111 Address: DF:A9:FF:F6:B1:1A (OUI DF-A9-FF)
        Count: 1
zephyr.exe[1603885]: < ACL Data TX: Handle 111 [1/3] flags 0x00 dlen 5                                              #136 9.105466
      ATT: Write Response (0x13) len 0
> HCI Event: Number of Completed Packets (0x13) plen 5                                                              #137 9.260272
        Num handles: 1
        Handle: 111 Address: DF:A9:FF:F6:B1:1A (OUI DF-A9-FF)
        Count: 1
        Buffers: 0/3
        #136: len 5 (0 Kb/s)
        Latency: 154 msec (75-170 msec ~158 msec)
> ACL Data RX: Handle 111 flags 0x02 dlen 9                                                                         #138 9.260356
      ATT: Write Request (0x12) len 4
        Handle: 0x004c
          Data[2]: 0100
zephyr.exe[1603885]: < HCI Command: Host Number of Completed Packets (0x03|0x0035) plen 5                           #139 9.265388
        Num handles: 1
        Handle: 111 Address: DF:A9:FF:F6:B1:1A (OUI DF-A9-FF)
        Count: 1
zephyr.exe[1603885]: < ACL Data TX: Handle 111 [1/3] flags 0x00 dlen 5                                              #140 9.265415
      ATT: Write Response (0x13) len 0
> HCI Event: Number of Completed Packets (0x13) plen 5                                                              #141 9.435395
        Num handles: 1
        Handle: 111 Address: DF:A9:FF:F6:B1:1A (OUI DF-A9-FF)
        Count: 1
        Buffers: 0/3
        #140: len 5 (0 Kb/s)
        Latency: 169 msec (75-170 msec ~164 msec)
> ACL Data RX: Handle 111 flags 0x02 dlen 7                                                                         #142 9.435398
      ATT: Read Request (0x0a) len 2
        Handle: 0x004b
zephyr.exe[1603885]: < HCI Command: Host Number of Completed Packets (0x03|0x0035) plen 5                           #143 9.445460
        Num handles: 1
        Handle: 111 Address: DF:A9:FF:F6:B1:1A (OUI DF-A9-FF)
        Count: 1
zephyr.exe[1603885]: < ACL Data TX: Handle 111 [1/3] flags 0x00 dlen 5                                              #144 9.445528
      ATT: Read Response (0x0b) len 0
        Value[0]: 
> HCI Event: Number of Completed Packets (0x13) plen 5                                                              #145 9.697845
        Num handles: 1
        Handle: 111 Address: DF:A9:FF:F6:B1:1A (OUI DF-A9-FF)
        Count: 1
        Buffers: 0/3
        #144: len 5 (0 Kb/s)
        Latency: 252 msec (75-252 msec ~208 msec)
> ACL Data RX: Handle 111 flags 0x02 dlen 27                                                                        #146 9.697994
> ACL Data RX: Handle 111 flags 0x01 dlen 27                                                                        #147 9.698517
> ACL Data RX: Handle 111 flags 0x01 dlen 14                                                                        #148 9.698815
      ATT: Prepare Write Request (0x16) len 63
        Handle: 0x0049
        Offset: 0x0000
          Data[59]: 02001ab1f6ffa9df0534120000401f01000000004e0302020003010200030aff0041050102030405060708090a0b0c0d0e0f101112131415161718
zephyr.exe[1603885]: < HCI Command: Host Number of Completed Packets (0x03|0x0035) plen 5                           #149 9.705573
        Num handles: 1
        Handle: 111 Address: DF:A9:FF:F6:B1:1A (OUI DF-A9-FF)
        Count: 1
zephyr.exe[1603885]: < HCI Command: Host Number of Completed Packets (0x03|0x0035) plen 5                           #150 9.705674
        Num handles: 1
        Handle: 111 Address: DF:A9:FF:F6:B1:1A (OUI DF-A9-FF)
        Count: 1
zephyr.exe[1603885]: < HCI Command: Host Number of Completed Packets (0x03|0x0035) plen 5                           #151 9.705678
        Num handles: 1
        Handle: 111 Address: DF:A9:FF:F6:B1:1A (OUI DF-A9-FF)
        Count: 1
zephyr.exe[1603885]: < ACL Data TX: Handle 111 [1/3] flags 0x00 dlen 27                                             #152 9.705740
zephyr.exe[1603885]: < ACL Data TX: Handle 111 flags 0x01 dlen 27                                                   #153 9.705744
zephyr.exe[1603885]: < ACL Data TX: Handle 111 flags 0x01 dlen 14                                                   #154 9.705744
      ATT: Prepare Write Response (0x17) len 63
        Handle: 0x0049
        Offset: 0x0000
          Data[59]: 02001ab1f6ffa9df0534120000401f01000000004e0302020003010200030aff0041050102030405060708090a0b0c0d0e0f101112131415161718
> HCI Event: Number of Completed Packets (0x13) plen 5                                                              #155 9.785643
        Num handles: 1
        Handle: 111 Address: DF:A9:FF:F6:B1:1A (OUI DF-A9-FF)
        Count: 1
        Buffers: 0/3
        #152: len 27 (2 Kb/s)
        Latency: 79 msec (75-252 msec ~144 msec)
> HCI Event: Number of Completed Packets (0x13) plen 5                                                              #156 9.786098
        Num handles: 1
        Handle: 111 Address: DF:A9:FF:F6:B1:1A (OUI DF-A9-FF)
        Count: 1
        Buffers: underflow/3
        #153: len 27 (2 Kb/s)
        Latency: 80 msec (75-252 msec ~112 msec)
> HCI Event: Number of Completed Packets (0x13) plen 5                                                              #157 9.873204
        Num handles: 1
        Handle: 111 Address: DF:A9:FF:F6:B1:1A (OUI DF-A9-FF)
        Count: 1
        Buffers: underflow/3
        #154: len 14 (0 Kb/s)
        Latency: 167 msec (75-252 msec ~139 msec)
> ACL Data RX: Handle 111 flags 0x02 dlen 27                                                                        #158 9.873288
> ACL Data RX: Handle 111 flags 0x01 dlen 22                                                                        #159 9.873440
      ATT: Prepare Write Request (0x16) len 44
        Handle: 0x0049
        Offset: 0x003b
          Data[40]: 191a1b1c1d1e1f202122232425262728292a2b2c2d2e2f303132333435363738393a3b3c3d3e3f40
zephyr.exe[1603885]: < HCI Command: Host Number of Completed Packets (0x03|0x0035) plen 5                           #160 9.885512
        Num handles: 1
        Handle: 111 Address: DF:A9:FF:F6:B1:1A (OUI DF-A9-FF)
        Count: 1
zephyr.exe[1603885]: < HCI Command: Host Number of Completed Packets (0x03|0x0035) plen 5                           #161 9.885517
        Num handles: 1
        Handle: 111 Address: DF:A9:FF:F6:B1:1A (OUI DF-A9-FF)
        Count: 1
zephyr.exe[1603885]: < ACL Data TX: Handle 111 [1/3] flags 0x00 dlen 27                                             #162 9.885535
zephyr.exe[1603885]: < ACL Data TX: Handle 111 flags 0x01 dlen 22                                                   #163 9.885572
      ATT: Prepare Write Response (0x17) len 44
        Handle: 0x0049
        Offset: 0x003b
          Data[40]: 191a1b1c1d1e1f202122232425262728292a2b2c2d2e2f303132333435363738393a3b3c3d3e3f40
> HCI Event: Number of Completed Packets (0x13) plen 5                                                              #164 9.960768
        Num handles: 1
        Handle: 111 Address: DF:A9:FF:F6:B1:1A (OUI DF-A9-FF)
        Count: 1
        Buffers: 0/3
        #162: len 27 (2 Kb/s)
        Latency: 75 msec (75-252 msec ~107 msec)
> HCI Event: Number of Completed Packets (0x13) plen 5                                                             #165 10.047757
        Num handles: 1
        Handle: 111 Address: DF:A9:FF:F6:B1:1A (OUI DF-A9-FF)
        Count: 1
        Buffers: underflow/3
        #163: len 22 (1 Kb/s)
        Latency: 162 msec (75-252 msec ~134 msec)
> ACL Data RX: Handle 111 flags 0x02 dlen 6                                                                        #166 10.047759
      ATT: Execute Write Request (0x18) len 1
        Flags: Immediately write all pending values (0x01)
zephyr.exe[1603885]: < HCI Command: Host Number of Completed Packets (0x03|0x0035) plen 5                          #167 10.065695
        Num handles: 1
        Handle: 111 Address: DF:A9:FF:F6:B1:1A (OUI DF-A9-FF)
        Count: 1
zephyr.exe[1603885]: < ACL Data TX: Handle 111 [1/3] flags 0x00 dlen 5                                             #168 10.065701
      ATT: Execute Write Response (0x19) len 0
zephyr.exe[1603885]: < ACL Data TX: Handle 111 [2/3] flags 0x00 dlen 27                                            #169 10.065702
zephyr.exe[1603885]: < ACL Data TX: Handle 111 flags 0x01 dlen 27                                                  #170 10.065707
> HCI Event: Number of Completed Packets (0x13) plen 5                                                             #171 10.135785
        Num handles: 1
        Handle: 111 Address: DF:A9:FF:F6:B1:1A (OUI DF-A9-FF)
        Count: 1
        Buffers: 1/3
        #168: len 5 (0 Kb/s)
        Latency: 70 msec (70-252 msec ~102 msec)
> HCI Event: Number of Completed Packets (0x13) plen 5                                                             #172 10.135897
        Num handles: 1
        Handle: 111 Address: DF:A9:FF:F6:B1:1A (OUI DF-A9-FF)
        Count: 1
        Buffers: 0/3
        #169: len 27 (3 Kb/s)
        Latency: 70 msec (70-252 msec ~86 msec)
zephyr.exe[1603885]: < ACL Data TX: Handle 111 flags 0x01 dlen 14                                                  #173 10.145313
      ATT: Handle Value Notification (0x1b) len 63
        Handle: 0x004b
          Data[61]: 00001ab1f6ffa9df05341200000001000000004e0302020003010200030aff0041050102030405060708090a0b0c0d0e0f101112131415161718191a1b
> HCI Event: Number of Completed Packets (0x13) plen 5                                                             #174 10.222937
        Num handles: 1
        Handle: 111 Address: DF:A9:FF:F6:B1:1A (OUI DF-A9-FF)
        Count: 1
        Buffers: underflow/3
        #170: len 27 (1 Kb/s)
        Latency: 157 msec (70-252 msec ~121 msec)
> HCI Event: Number of Completed Packets (0x13) plen 5                                                             #175 10.310137
        Num handles: 1
        Handle: 111 Address: DF:A9:FF:F6:B1:1A (OUI DF-A9-FF)
        Count: 1
        Buffers: underflow/3
        #173: len 14 (0 Kb/s)
        Latency: 164 msec (70-252 msec ~143 msec)
> ACL Data RX: Handle 111 flags 0x02 dlen 9                                                                        #176 12.060135
      ATT: Write Request (0x12) len 4
        Handle: 0x0049
          Data[2]: 0500
zephyr.exe[1603885]: < HCI Command: Host Number of Completed Packets (0x03|0x0035) plen 5                          #177 12.065520
        Num handles: 1
        Handle: 111 Address: DF:A9:FF:F6:B1:1A (OUI DF-A9-FF)
        Count: 1
zephyr.exe[1603885]: < ACL Data TX: Handle 111 [1/3] flags 0x00 dlen 5                                             #178 12.065617
      ATT: Write Response (0x13) len 0
zephyr.exe[1603885]: < ACL Data TX: Handle 111 [2/3] flags 0x00 dlen 7                                             #179 12.065621
      ATT: Handle Value Notification (0x1b) len 2
        Handle: 0x004b
          Data[0]: 
> HCI Event: Number of Completed Packets (0x13) plen 5                                                             #180 12.148047
        Num handles: 1
        Handle: 111 Address: DF:A9:FF:F6:B1:1A (OUI DF-A9-FF)
        Count: 1
        Buffers: 1/3
        #178: len 5 (0 Kb/s)
        Latency: 82 msec (70-252 msec ~112 msec)
> HCI Event: Number of Completed Packets (0x13) plen 5                                                             #181 12.235644
        Num handles: 1
        Handle: 111 Address: DF:A9:FF:F6:B1:1A (OUI DF-A9-FF)
        Count: 1
        Buffers: 0/3
        #179: len 7 (0 Kb/s)
        Latency: 170 msec (70-252 msec ~141 msec)
> ACL Data RX: Handle 111 flags 0x02 dlen 27                                                                       #182 12.235880
> ACL Data RX: Handle 111 flags 0x01 dlen 27                                                                       #183 12.236002
zephyr.exe[1603885]: < HCI Command: Host Number of Completed Packets (0x03|0x0035) plen 5                          #184 12.245474
        Num handles: 1
        Handle: 111 Address: DF:A9:FF:F6:B1:1A (OUI DF-A9-FF)
        Count: 1
> ACL Data RX: Handle 111 flags 0x01 dlen 14                                                                       #185 12.322807
      ATT: Prepare Write Request (0x16) len 63
        Handle: 0x0049
        Offset: 0x0000
          Data[59]: 0201c8402f1ab5c40034120000401f01000000004e0302020003010200030aff0041050102030405060708090a0b0c0d0e0f101112131415161718
zephyr.exe[1603885]: < HCI Command: Host Number of Completed Packets (0x03|0x0035) plen 5                          #186 12.325397
        Num handles: 1
        Handle: 111 Address: DF:A9:FF:F6:B1:1A (OUI DF-A9-FF)
        Count: 1
zephyr.exe[1603885]: < HCI Command: Host Number of Completed Packets (0x03|0x0035) plen 5                          #187 12.325402
        Num handles: 1
        Handle: 111 Address: DF:A9:FF:F6:B1:1A (OUI DF-A9-FF)
        Count: 1
zephyr.exe[1603885]: < ACL Data TX: Handle 111 [1/3] flags 0x00 dlen 27                                            #188 12.325428
zephyr.exe[1603885]: < ACL Data TX: Handle 111 flags 0x01 dlen 27                                                  #189 12.325430
zephyr.exe[1603885]: < ACL Data TX: Handle 111 flags 0x01 dlen 14                                                  #190 12.325466
      ATT: Prepare Write Response (0x17) len 63
        Handle: 0x0049
        Offset: 0x0000
          Data[59]: 0201c8402f1ab5c40034120000401f01000000004e0302020003010200030aff0041050102030405060708090a0b0c0d0e0f101112131415161718
> HCI Event: Number of Completed Packets (0x13) plen 5                                                             #191 12.410596
        Num handles: 1
        Handle: 111 Address: DF:A9:FF:F6:B1:1A (OUI DF-A9-FF)
        Count: 1
        Buffers: 0/3
        #188: len 27 (2 Kb/s)
        Latency: 85 msec (70-252 msec ~113 msec)
> HCI Event: Number of Completed Packets (0x13) plen 5                                                             #192 12.410951
        Num handles: 1
        Handle: 111 Address: DF:A9:FF:F6:B1:1A (OUI DF-A9-FF)
        Count: 1
        Buffers: underflow/3
        #189: len 27 (2 Kb/s)
        Latency: 85 msec (70-252 msec ~99 msec)
> HCI Event: Number of Completed Packets (0x13) plen 5                                                             #193 12.498212
        Num handles: 1
        Handle: 111 Address: DF:A9:FF:F6:B1:1A (OUI DF-A9-FF)
        Count: 1
        Buffers: underflow/3
        #190: len 14 (0 Kb/s)
        Latency: 172 msec (70-252 msec ~136 msec)
> ACL Data RX: Handle 111 flags 0x02 dlen 27                                                                       #194 12.498214
> ACL Data RX: Handle 111 flags 0x01 dlen 22                                                                       #195 12.498360
      ATT: Prepare Write Request (0x16) len 44
        Handle: 0x0049
        Offset: 0x003b
          Data[40]: 191a1b1c1d1e1f202122232425262728292a2b2c2d2e2f303132333435363738393a3b3c3d3e3f40
zephyr.exe[1603885]: < HCI Command: Host Number of Completed Packets (0x03|0x0035) plen 5                          #196 12.505537
        Num handles: 1
        Handle: 111 Address: DF:A9:FF:F6:B1:1A (OUI DF-A9-FF)
        Count: 1
zephyr.exe[1603885]: < HCI Command: Host Number of Completed Packets (0x03|0x0035) plen 5                          #197 12.505543
        Num handles: 1
        Handle: 111 Address: DF:A9:FF:F6:B1:1A (OUI DF-A9-FF)
        Count: 1
zephyr.exe[1603885]: < ACL Data TX: Handle 111 [1/3] flags 0x00 dlen 27                                            #198 12.505570
zephyr.exe[1603885]: < ACL Data TX: Handle 111 flags 0x01 dlen 22                                                  #199 12.505572
      ATT: Prepare Write Response (0x17) len 44
        Handle: 0x0049
        Offset: 0x003b
          Data[40]: 191a1b1c1d1e1f202122232425262728292a2b2c2d2e2f303132333435363738393a3b3c3d3e3f40
> HCI Event: Number of Completed Packets (0x13) plen 5                                                             #200 12.585530
        Num handles: 1
        Handle: 111 Address: DF:A9:FF:F6:B1:1A (OUI DF-A9-FF)
        Count: 1
        Buffers: 0/3
        #198: len 27 (2 Kb/s)
        Latency: 79 msec (70-252 msec ~108 msec)
> HCI Event: Number of Completed Packets (0x13) plen 5                                                             #201 12.672627
        Num handles: 1
        Handle: 111 Address: DF:A9:FF:F6:B1:1A (OUI DF-A9-FF)
        Count: 1
        Buffers: underflow/3
        #199: len 22 (1 Kb/s)
        Latency: 167 msec (70-252 msec ~137 msec)
> ACL Data RX: Handle 111 flags 0x02 dlen 6                                                                        #202 12.672640
      ATT: Execute Write Request (0x18) len 1
        Flags: Immediately write all pending values (0x01)
zephyr.exe[1603885]: < HCI Command: Host Number of Completed Packets