Bluetooth monitor ver 5.72
= Note: Linux version 6.14.0-36-generic (x86_64)                       0.033115
= Note: Bluetooth subsystem version 2.22                               0.033117
= New Index: 00:00:00:00:00:00 (Primary,UART,hci1)              [hci1] 0.033118
= New Index: 48:5F:99:8E:E0:64 (Primary,USB,hci0)               [hci0] 0.033118
= Open Index: 00:00:00:00:00:00                                 [hci1] 0.546849
= Index Info: 00:00:00:00:00:00 (Nordic Semiconductor ASA)      [hci1] 0.546864
@ USER Open: main (privileged) version 2.22            {0x0001} [hci1] 0.546872
< HCI Command: Reset (0x03|0x0003) plen 0                    #1 [hci1] 0.548039
> HCI Event: Command Complete (0x0e) plen 4                  #2 [hci1] 0.548677
      Reset (0x03|0x0003) ncmd 1
        Status: Success (0x00)
< HCI Command: Read Local Supported... (0x04|0x0003) plen 0  #3 [hci1] 0.566235
> HCI Event: Command Complete (0x0e) plen 12                 #4 [hci1] 0.566761
      Read Local Supported Features (0x04|0x0003) ncmd 1
        Status: Success (0x00)
        Features: 0x00 0x00 0x00 0x00 0x60 0x00 0x00 0x00
          BR/EDR Not Supported
          LE Supported (Controller)
< HCI Command: Read Local Version In.. (0x04|0x0001) plen 0  #5 [hci1] 0.586215
> HCI Event: Command Complete (0x0e) plen 12                 #6 [hci1] 0.586785
      Read Local Version Information (0x04|0x0001) ncmd 1
        Status: Success (0x00)
        HCI version: Reserved (0x0f) - Revision 12393 (0x3069)
        LMP version: Reserved (0x0f) - Subversion 12393 (0x3069)
        Manufacturer: Nordic Semiconductor ASA (89)
< HCI Command: Read Local Supported... (0x04|0x0002) plen 0  #7 [hci1] 0.606225
> HCI Event: Command Complete (0x0e) plen 68                 #8 [hci1] 0.607263
      Read Local Supported Commands (0x04|0x0002) ncmd 1
        Status: Success (0x00)
        Commands: 119 entries
          Disconnect (Octet 0 - Bit 5)
          Read Remote Version Information (Octet 2 - Bit 7)
          Set Event Mask (Octet 5 - Bit 6)
          Reset (Octet 5 - Bit 7)
          Read Connection Accept Timeout (Octet 7 - Bit 2)
          Write Connection Accept Timeout (Octet 7 - Bit 3)
          Read Transmit Power Level (Octet 10 - Bit 2)
          Set Controller To Host Flow Control (Octet 10 - Bit 5)
          Host Buffer Size (Octet 10 - Bit 6)
          Host Number of Completed Packets (Octet 10 - Bit 7)
          Read Local Version Information (Octet 14 - Bit 3)
          Read Local Supported Features (Octet 14 - Bit 5)
          Read BD ADDR (Octet 15 - Bit 1)
          Read RSSI (Octet 15 - Bit 5)
          Set Event Mask Page 2 (Octet 22 - Bit 2)
          LE Set Event Mask (Octet 25 - Bit 0)
          LE Read Buffer Size (Octet 25 - Bit 1)
          LE Read Local Supported Features (Octet 25 - Bit 2)
          LE Set Random Address (Octet 25 - Bit 4)
          LE Set Advertising Parameters (Octet 25 - Bit 5)
          LE Read Advertising Channel TX Power (Octet 25 - Bit 6)
          LE Set Advertising Data (Octet 25 - Bit 7)
          LE Set Scan Response Data (Octet 26 - Bit 0)
          LE Set Advertise Enable (Octet 26 - Bit 1)
          LE Set Scan Parameters (Octet 26 - Bit 2)
          LE Set Scan Enable (Octet 26 - Bit 3)
          LE Create Connection (Octet 26 - Bit 4)
          LE Create Connection Cancel (Octet 26 - Bit 5)
          LE Read Accept List Size (Octet 26 - Bit 6)
          LE Clear Accept List (Octet 26 - Bit 7)
          LE Add Device To Accept List (Octet 27 - Bit 0)
          LE Remove Device From Accept List (Octet 27 - Bit 1)
          LE Connection Update (Octet 27 - Bit 2)
          LE Set Host Channel Classification (Octet 27 - Bit 3)
          LE Read Channel Map (Octet 27 - Bit 4)
          LE Read Remote Used Features (Octet 27 - Bit 5)
          LE Encrypt (Octet 27 - Bit 6)
          LE Rand (Octet 27 - Bit 7)
          LE Start Encryption (Octet 28 - Bit 0)
          LE Long Term Key Request Reply (Octet 28 - Bit 1)
          LE Long Term Key Request Neg Reply (Octet 28 - Bit 2)
          LE Read Supported States (Octet 28 - Bit 3)
          LE Receiver Test (Octet 28 - Bit 4)
          LE Transmitter Test (Octet 28 - Bit 5)
          LE Test End (Octet 28 - Bit 6)
          Read Authenticated Payload Timeout (Octet 32 - Bit 4)
          Write Authenticated Payload Timeout (Octet 32 - Bit 5)
          LE Set Data Length (Octet 33 - Bit 6)
          LE Read Suggested Default Data Length (Octet 33 - Bit 7)
          LE Write Suggested Default Data Length (Octet 34 - Bit 0)
          LE Add Device To Resolving List (Octet 34 - Bit 3)
          LE Remove Device From Resolving List (Octet 34 - Bit 4)
          LE Clear Resolving List (Octet 34 - Bit 5)
          LE Read Resolving List Size (Octet 34 - Bit 6)
          LE Set Address Resolution Enable (Octet 35 - Bit 1)
          LE Set Resolvable Private Address Timeout (Octet 35 - Bit 2)
          LE Read Maximum Data Length (Octet 35 - Bit 3)
          LE Read PHY (Octet 35 - Bit 4)
          LE Set Default PHY (Octet 35 - Bit 5)
          LE Set PHY (Octet 35 - Bit 6)
          LE Enhanced Receiver Test (Octet 35 - Bit 7)
          LE Enhanced Transmitter Test (Octet 36 - Bit 0)
          LE Set Advertising Set Random Address (Octet 36 - Bit 1)
          LE Set Extended Advertising Parameters (Octet 36 - Bit 2)
          LE Set Extended Advertising Data (Octet 36 - Bit 3)
          LE Set Extended Scan Response Data (Octet 36 - Bit 4)
          LE Set Extended Advertising Enable (Octet 36 - Bit 5)
          LE Read Maximum Advertising Data Length (Octet 36 - Bit 6)
          LE Read Number of Supported Advertising Sets (Octet 36 - Bit 7)
          LE Remove Advertising Set (Octet 37 - Bit 0)
          LE Clear Advertising Sets (Octet 37 - Bit 1)
          LE Set Periodic Advertising Parameters (Octet 37 - Bit 2)
          LE Set Periodic Advertising Data (Octet 37 - Bit 3)
          LE Set Periodic Advertising Enable (Octet 37 - Bit 4)
          LE Set Extended Scan Parameters (Octet 37 - Bit 5)
          LE Set Extended Scan Enable (Octet 37 - Bit 6)
          LE Extended Create Connection (Octet 37 - Bit 7)
          LE Periodic Advertising Create Sync (Octet 38 - Bit 0)
          LE Periodic Advertising Create Sync Cancel (Octet 38 - Bit 1)
          LE Periodic Advertising Terminate Sync (Octet 38 - Bit 2)
          LE Add Device To Periodic Advertiser List (Octet 38 - Bit 3)
          LE Remove Device From Periodic Advertiser List (Octet 38 - Bit 4)
          LE Clear Periodic Advertiser List (Octet 38 - Bit 5)
          LE Read Periodic Advertiser List Size (Octet 38 - Bit 6)
          LE Read Transmit Power (Octet 38 - Bit 7)
          LE Read RF Path Compensation (Octet 39 - Bit 0)
          LE Write RF Path Compensation (Octet 39 - Bit 1)
          LE Set Privacy Mode (Octet 39 - Bit 2)
          LE Periodic Advertising Receive Enable (Octet 40 - Bit 5)
          LE Periodic Advertising Sync Transfer (Octet 40 - Bit 6)
          LE Periodic Advertising Set Info Transfer (Octet 40 - Bit 7)
          LE Periodic Advertising Sync Transfer Parameters (Octet 41 - Bit 0)
          LE Set Default Periodic Advertisng Sync Transfer Parameters (Octet 41 - Bit 1)
          LE Read Buffer v2 (Octet 41 - Bit 5)
          LE Read ISO TX Sync (Octet 41 - Bit 6)
          LE Set Connected Isochronous Group Parameters (Octet 41 - Bit 7)
          LE Set Connected Isochronous Group Parameters Test (Octet 42 - Bit 0)
          LE Create Connected Isochronous Stream (Octet 42 - Bit 1)
          LE Remove Connected Isochronous Group (Octet 42 - Bit 2)
          LE Accept Connected Isochronous Stream Request (Octet 42 - Bit 3)
          LE Reject Connected Isochronous Stream Request (Octet 42 - Bit 4)
          LE Create Broadcast Isochronous Group (Octet 42 - Bit 5)
          LE Create Broadcast Isochronous Group Test (Octet 42 - Bit 6)
          LE Terminate Broadcast Isochronous Group (Octet 42 - Bit 7)
          LE Broadcast Isochronous Group Create Sync (Octet 43 - Bit 0)
          LE Broadcast Isochronous Group Terminate Sync (Octet 43 - Bit 1)
          LE Request Peer SCA (Octet 43 - Bit 2)
          LE Setup Isochronous Data Path (Octet 43 - Bit 3)
          LE Remove Isochronous Data Path (Octet 43 - Bit 4)
          LE Isochronous Transmit Test (Octet 43 - Bit 5)
          LE Isochronous Receive Test (Octet 43 - Bit 6)
          LE Isochronous Read Test Counters (Octet 43 - Bit 7)
          LE Isochronous Read Test Counters (Octet 44 - Bit 0)
          LE Set Host Feature (Octet 44 - Bit 1)
          Octet 44 - Bit 2 
          Octet 45 - Bit 6 
          Octet 46 - Bit 0 
          Octet 46 - Bit 1 
          Octet 46 - Bit 2 
< HCI Command: Host Buffer Size (0x03|0x0033) plen 7         #9 [hci1] 0.626217
        ACL MTU: 255  ACL max packet: 16
        SCO MTU: 0    SCO max packet: 0
> HCI Event: Command Complete (0x0e) plen 4                 #10 [hci1] 0.626716
      Host Buffer Size (0x03|0x0033) ncmd 1
        Status: Success (0x00)
< HCI Command: Set Controller To Ho.. (0x03|0x0031) plen 1  #11 [hci1] 0.646228
        Flow control: ACL Data Packets (0x01)
> HCI Event: Command Complete (0x0e) plen 4                 #12 [hci1] 0.646617
      Set Controller To Host Flow Control (0x03|0x0031) ncmd 1
        Status: Success (0x00)
< HCI Command: LE Read Local Suppor.. (0x08|0x0003) plen 0  #13 [hci1] 0.666233
> HCI Event: Command Complete (0x0e) plen 12                #14 [hci1] 0.666753
      LE Read Local Supported Features (0x08|0x0003) ncmd 1
        Status: Success (0x00)
        Features: 0xfd 0x79 0x00 0xf7 0x30 0x01 0x00 0x00
          LE Encryption
          Extended Reject Indication
          Peripheral-initiated Features Exchange
          LE Ping
          LE Data Packet Length Extension
          LL Privacy
          Extended Scanner Filter Policies
          LE 2M PHY
          LE Coded PHY
          LE Extended Advertising
          LE Periodic Advertising
          Channel Selection Algorithm #2
          Periodic Advertising Sync Transfer - Sender
          Periodic Advertising Sync Transfer - Recipient
          Sleep Clock Accuracy Updates
          Connected Isochronous Stream - Central
          Connected Isochronous Stream - Peripheral
          Isochronous Broadcaster
          Synchronized Receiver
          Periodic Advertising ADI support
          Connection Subrating
          Unknown features (0x0000010000000000)
< HCI Command: LE Set Host Feature (0x08|0x0074) plen 2     #15 [hci1] 0.686229
        Bit Number: 32
          Connected Isochronous Stream (Host Support)
        Bit Value: 1
> HCI Event: Command Complete (0x0e) plen 4                 #16 [hci1] 0.686653
      LE Set Host Feature (0x08|0x0074) ncmd 1
        Status: Success (0x00)
< HCI Command: LE Read Buffer v2 (0x08|0x0060) plen 0       #17 [hci1] 0.706239
> HCI Event: Command Complete (0x0e) plen 10                #18 [hci1] 0.706664
      LE Read Buffer v2 (0x08|0x0060) ncmd 1
        Status: Success (0x00)
        ACL MTU: 27
        ACL max packet: 3
        ISO MTU: 318
        ISO max packet: 3
< HCI Command: LE Read Maximum Adve.. (0x08|0x003a) plen 0  #19 [hci1] 0.726258
> HCI Event: Command Complete (0x0e) plen 6                 #20 [hci1] 0.726662
      LE Read Maximum Advertising Data Length (0x08|0x003a) ncmd 1
        Status: Success (0x00)
        Max length: 1650
< HCI Command: LE Read Supported St.. (0x08|0x001c) plen 0  #21 [hci1] 0.746223
> HCI Event: Command Complete (0x0e) plen 12                #22 [hci1] 0.746697
      LE Read Supported States (0x08|0x001c) ncmd 1
        Status: Success (0x00)
        States: 0x000003ff3e0306ff
          Non-connectable Advertising State
          Scannable Advertising State
          Connectable Advertising State
          High Duty Cycle Directed Advertising State
          Passive Scanning State
          Active Scanning State
          Initiating State
            and Connection State (Central Role)
          Connection State (Peripheral Role)
          Scannable Advertising State
            and Passive Scanning State
          Connectable Advertising State
            and Passive Scanning State
          Non-connectable Advertising State
            and Initiating State
          Scannable Advertising State
            and Initiating State
          Active Scanning State
            and Connection State (Central Role)
          Passive Scanning State
            and Connection State (Peripheral Role)
          Active Scanning State
            and Connection State (Peripheral Role)
          Initiating State
            and Connection State (Central Role)
            and Central Role & Central Role
          Low Duty Cycle Directed Advertising State
          Connectable Advertising State
            and Initiating State
            and Central Role & Peripheral Role
          High Duty Cycle Directed Advertising State
            and Initiating State
            and Central Role & Peripheral Role
          Low Duty Cycle Directed Advertising State
            and Initiating State
            and Central Role & Peripheral Role
          Connectable Advertising State
            and Connection State (Central Role)
            and Central Role & Peripheral Role
          High Duty Cycle Directed Advertising State
            and Connection State (Central Role)
            and Central Role & Peripheral Role
          Low Duty Cycle Directed Advertising State
            and Connection State (Central Role)
            and Central Role & Peripheral Role
          Connectable Advertising State
            and Connection State (Peripheral Role)
            and Central Role & Peripheral Role
          High Duty Cycle Directed Advertising State
            and Connection State (Peripheral Role)
            and Peripheral Role & Peripheral Role
          Low Duty Cycle Directed Advertising State
            and Connection State (Peripheral Role)
            and Peripheral Role & Peripheral Role
          Initiating State
            and Connection State (Peripheral Role)
            and Central Role & Peripheral Role
< HCI Command: LE Read Maximum Data.. (0x08|0x002f) plen 0  #23 [hci1] 0.766216
> HCI Event: Command Complete (0x0e) plen 12                #24 [hci1] 0.766711
      LE Read Maximum Data Length (0x08|0x002f) ncmd 1
        Status: Success (0x00)
        Max TX octets: 251
        Max TX time: 2704
        Max RX octets: 251
        Max RX time: 2704
< HCI Command: LE Write Suggested D.. (0x08|0x0024) plen 4  #25 [hci1] 0.786217
        TX octets: 251
        TX time: 2704
> HCI Event: Command Complete (0x0e) plen 4                 #26 [hci1] 0.786724
      LE Write Suggested Default Data Length (0x08|0x0024) ncmd 1
        Status: Success (0x00)
< HCI Command: LE Read Resolving Li.. (0x08|0x002a) plen 0  #27 [hci1] 0.806256
> HCI Event: Command Complete (0x0e) plen 5                 #28 [hci1] 0.806683
      LE Read Resolving List Size (0x08|0x002a) ncmd 1
        Status: Success (0x00)
        Size: 8
< HCI Command: LE Set Event Mask (0x08|0x0001) plen 8       #29 [hci1] 0.826216
        Mask: 0x000002023f87fa5e
          LE Advertising Report
          LE Connection Update Complete
          LE Read Remote Used Features Complete
          LE Long Term Key Request
          LE Data Length Change
          LE Enhanced Connection Complete
          LE PHY Update Complete
          LE Extended Advertising Report
          LE Periodic Advertising Sync Established
          LE Periodic Advertising Report
          LE Periodic Advertising Sync Lost
          LE Extended Scan Timeout
          LE Extended Advertising Set Terminated
          LE Scan Request Received
          LE Periodic Advertising Sync Transfer Rvc
          LE CIS Established
          LE CIS Request
          LE Create BIG Complete
          LE Terminate BIG Complete
          LE BIG Sync Estabilished Complete
          LE BIG Sync Lost
          LE BIG Info Advertising Report
          Unknown mask (0x0000020000000000)
> HCI Event: Command Complete (0x0e) plen 4                 #30 [hci1] 0.826813
      LE Set Event Mask (0x08|0x0001) ncmd 1
        Status: Success (0x00)
< HCI Command: Set Event Mask (0x03|0x0001) plen 8          #31 [hci1] 0.846221
        Mask: 0x2000800002008890
          Disconnection Complete
          Encryption Change
          Read Remote Version Information Complete
          Hardware Error
          Data Buffer Overflow
          Encryption Key Refresh Complete
          LE Meta
> HCI Event: Command Complete (0x0e) plen 4                 #32 [hci1] 0.846758
      Set Event Mask (0x03|0x0001) ncmd 1
        Status: Success (0x00)
< HCI Command: Read BD ADDR (0x04|0x0009) plen 0            #33 [hci1] 0.866223
> HCI Event: Command Complete (0x0e) plen 10                #34 [hci1] 0.866667
      Read BD ADDR (0x04|0x0009) ncmd 1
        Status: Success (0x00)
        Address: 00:00:00:00:00:00 (OUI 00-00-00)
< HCI Command: LE Set Random Address (0x08|0x0005) plen 6   #35 [hci1] 0.886225
        Address: D5:B6:CC:31:DB:3B (Static)
> HCI Event: Command Complete (0x0e) plen 4                 #36 [hci1] 0.886687
      LE Set Random Address (0x08|0x0005) ncmd 1
        Status: Success (0x00)
< HCI Command: LE Set Extended Adv.. (0x08|0x0036) plen 25  #37 [hci1] 3.296486
        Handle: 0x00
        Properties: 0x0013
          Connectable
          Scannable
          Use legacy advertising PDUs: ADV_IND
        Min advertising interval: 100.000 msec (0x00a0)
        Max advertising interval: 150.000 msec (0x00f0)
        Channel map: 37, 38, 39 (0x07)
        Own address type: Random (0x01)
        Peer address type: Public (0x00)
        Peer address: 00:00:00:00:00:00 (OUI 00-00-00)
        Filter policy: Allow Scan Request from Any, Allow Connect Request from Any (0x00)
        TX power: Host has no preference (0x7f)
        Primary PHY: LE 1M (0x01)
        Secondary max skip: 0x00
        Secondary PHY: LE 1M (0x01)
        SID: 0x00
        Scan request notifications: Disabled (0x00)
> HCI Event: Command Complete (0x0e) plen 5                 #38 [hci1] 3.297303
      LE Set Extended Advertising Parameters (0x08|0x0036) ncmd 1
        Status: Success (0x00)
        TX power (selected): 0 dbm (0x00)
< HCI Command: LE Set Advertising S.. (0x08|0x0035) plen 7  #39 [hci1] 3.306444
        Advertising handle: 0x00
        Advertising random address: D5:B6:CC:31:DB:3B (Static)
> HCI Event: Command Complete (0x0e) plen 4                 #40 [hci1] 3.306898
      LE Set Advertising Set Random Address (0x08|0x0035) ncmd 1
        Status: Success (0x00)
< HCI Command: LE Set Extended Adv.. (0x08|0x0037) plen 22  #41 [hci1] 3.326298
        Handle: 0x00
        Operation: Complete extended advertising data (0x03)
        Fragment preference: Minimize fragmentation (0x01)
        Data length: 0x12
        Flags: 0x06
          LE General Discoverable Mode
          BR/EDR Not Supported
        Name (complete): Tester_F6B11A
> HCI Event: Command Complete (0x0e) plen 4                 #42 [hci1] 3.326941
      LE Set Extended Advertising Data (0x08|0x0037) ncmd 1
        Status: Success (0x00)
< HCI Command: LE Set Extended Scan.. (0x08|0x0038) plen 4  #43 [hci1] 3.346235
        Handle: 0x00
        Operation: Complete scan response data (0x03)
        Fragment preference: Minimize fragmentation (0x01)
        Data length: 0x00
> HCI Event: Command Complete (0x0e) plen 4                 #44 [hci1] 3.346659
      LE Set Extended Scan Response Data (0x08|0x0038) ncmd 1
        Status: Success (0x00)
< HCI Command: LE Set Extended Adve.. (0x08|0x0039) plen 6  #45 [hci1] 3.366262
        Extended advertising: Enabled (0x01)
        Number of sets: 1 (0x01)
        Entry 0
          Handle: 0x00
          Duration: 0 ms (0x00)
          Max ext adv events: 0
> HCI Event: Command Complete (0x0e) plen 4                 #46 [hci1] 3.366845
      LE Set Extended Advertising Enable (0x08|0x0039) ncmd 1
        Status: Success (0x00)
> HCI Event: LE Meta Event (0x3e) plen 31                   #47 [hci1] 3.475739
      LE Enhanced Connection Complete (0x0a)
        Status: Success (0x00)
        Handle: 93
        Role: Peripheral (0x01)
        Peer address type: Public (0x00)
        Peer address: DF:A9:FF:F6:B1:1A (OUI DF-A9-FF)
        Local resolvable private address: 00:00:00:00:00:00 (Non-Resolvable)
        Peer resolvable private address: 00:00:00:00:00:00 (Non-Resolvable)
        Connection interval: 87.50 msec (0x0046)
        Connection latency: 0 (0x0000)
        Supervision timeout: 25120 msec (0x09d0)
        Central clock accuracy: 0x01
> HCI Event: LE Meta Event (0x3e) plen 6                    #48 [hci1] 3.475757
      LE Advertising Set Terminated (0x12)
        Status: Success (0x00)
        Handle: 0
        Connection handle: 93
        Number of completed extended advertising events: 0
< HCI Command: LE Read Remote Used... (0x08|0x0016) plen 2  #49 [hci1] 3.487351
        Handle: 93 Address: DF:A9:FF:F6:B1:1A (OUI DF-A9-FF)
< ACL Data TX: Handle 93 flags 0x00 dlen 7                  #50 [hci1] 3.487377
      ATT: Exchange MTU Request (0x02) len 2
        Client RX MTU: 251
> HCI Event: Command Status (0x0f) plen 4                   #51 [hci1] 3.487918
      LE Read Remote Used Features (0x08|0x0016) ncmd 1
        Status: Success (0x00)
> HCI Event: Number of Completed Packets (0x13) plen 5      #52 [hci1] 3.651674
        Num handles: 1
        Handle: 93 Address: DF:A9:FF:F6:B1:1A (OUI DF-A9-FF)
        Count: 1
        #50: len 7 (0 Kb/s)
        Latency: 164 msec (164-164 msec ~164 msec)
> HCI Event: LE Meta Event (0x3e) plen 12                   #53 [hci1] 3.739688
      LE Read Remote Used Features (0x04)
        Status: Success (0x00)
        Handle: 93 Address: DF:A9:FF:F6:B1:1A (OUI DF-A9-FF)
        Features: 0x2d 0x49 0x00 0xf7 0x67 0xd8 0x00 0x00
          LE Encryption
          Extended Reject Indication
          Peripheral-initiated Features Exchange
          LE Data Packet Length Extension
          LE 2M PHY
          LE Coded PHY
          Channel Selection Algorithm #2
          Periodic Advertising Sync Transfer - Sender
          Periodic Advertising Sync Transfer - Recipient
          Sleep Clock Accuracy Updates
          Connected Isochronous Stream - Central
          Connected Isochronous Stream - Peripheral
          Isochronous Broadcaster
          Synchronized Receiver
          Connected Isochronous Stream (Host Support)
          LE Power Control Request
          LE Power Control Request
          Connection Subrating
          Connection Subrating (Host Support)
          Unknown features (0x0000d80000000000)
> ACL Data RX: Handle 93 flags 0x02 dlen 11                 #54 [hci1] 6.189230
      SMP: Pairing Request (0x01) len 6
        IO capability: KeyboardDisplay (0x04)
        OOB data: Authentication data not present (0x00)
        Authentication requirement: Bonding, MITM, SC, No Keypresses (0x0d)
        Max encryption key size: 16
        Initiator key distribution: EncKey IdKey (0x03)
        Responder key distribution: EncKey IdKey Sign (0x07)
> ACL Data RX: Handle 93 flags 0x02 dlen 7                  #55 [hci1] 6.189701
      ATT: Exchange MTU Response (0x03) len 2
        Server RX MTU: 23
< HCI Command: Host Number of Compl.. (0x03|0x0035) plen 5  #56 [hci1] 6.206476
        Num handles: 1
        Handle: 93 Address: DF:A9:FF:F6:B1:1A (OUI DF-A9-FF)
        Count: 1
< ACL Data TX: Handle 93 flags 0x00 dlen 11                 #57 [hci1] 6.206528
      SMP: Pairing Response (0x02) len 6
        IO capability: DisplayOnly (0x00)
        OOB data: Authentication data not present (0x00)
        Authentication requirement: Bonding, No MITM, SC, No Keypresses (0x09)
        Max encryption key size: 16
        Initiator key distribution: IdKey (0x02)
        Responder key distribution: <none> (0x00)
< HCI Command: Host Number of Compl.. (0x03|0x0035) plen 5  #58 [hci1] 6.206618
        Num handles: 1
        Handle: 93 Address: DF:A9:FF:F6:B1:1A (OUI DF-A9-FF)
        Count: 1
> HCI Event: Number of Completed Packets (0x13) plen 5      #59 [hci1] 6.364404
        Num handles: 1
        Handle: 93 Address: DF:A9:FF:F6:B1:1A (OUI DF-A9-FF)
        Count: 1
        #57: len 11 (0 Kb/s)
        Latency: 157 msec (157-164 msec ~161 msec)
> ACL Data RX: Handle 93 flags 0x02 dlen 27                 #60 [hci1] 6.364639
> ACL Data RX: Handle 93 flags 0x01 dlen 27                 #61 [hci1] 6.365134
> ACL Data RX: Handle 93 flags 0x01 dlen 15                 #62 [hci1] 6.365627
      SMP: Pairing Public Key (0x0c) len 64
        X: dbed4bc8144b98939cb807dd9f60a2faa9dcbe0b021d7ed46ca1522569d70f4e
        Y: eb9e75fdf38ace9cc30b52c968024b67f11b4c6a02b65e4e1f15aa42d0094bb7
< HCI Command: Host Number of Compl.. (0x03|0x0035) plen 5  #63 [hci1] 6.367161
        Num handles: 1
        Handle: 93 Address: DF:A9:FF:F6:B1:1A (OUI DF-A9-FF)
        Count: 1
< HCI Command: Host Number of Compl.. (0x03|0x0035) plen 5  #64 [hci1] 6.367345
        Num handles: 1
        Handle: 93 Address: DF:A9:FF:F6:B1:1A (OUI DF-A9-FF)
        Count: 1
< HCI Command: Host Number of Compl.. (0x03|0x0035) plen 5  #65 [hci1] 6.367767
        Num handles: 1
        Handle: 93 Address: DF:A9:FF:F6:B1:1A (OUI DF-A9-FF)
        Count: 1
< ACL Data TX: Handle 93 flags 0x00 dlen 27                 #66 [hci1] 6.367995
< ACL Data TX: Handle 93 flags 0x01 dlen 27                 #67 [hci1] 6.368006
< ACL Data TX: Handle 93 flags 0x01 dlen 15                 #68 [hci1] 6.368031
      SMP: Pairing Public Key (0x0c) len 64
        X: 98308440221e2d910f0e54b71e7ec652857aa9b5a0dc65028824cc19db1226e9
        Y: 67a4816bcb62efb21701e31fdb27561a6217575fb007a8bbdabe7e28b6f68482
> HCI Event: Number of Completed Packets (0x13) plen 5      #69 [hci1] 6.452240
        Num handles: 1
        Handle: 93 Address: DF:A9:FF:F6:B1:1A (OUI DF-A9-FF)
        Count: 1
        #66: len 27 (2 Kb/s)
        Latency: 84 msec (84-164 msec ~122 msec)
> HCI Event: Number of Completed Packets (0x13) plen 5      #70 [hci1] 6.452946
        Num handles: 1
        Handle: 93 Address: DF:A9:FF:F6:B1:1A (OUI DF-A9-FF)
        Count: 1
        #67: len 27 (2 Kb/s)
        Latency: 84 msec (84-164 msec ~103 msec)
> HCI Event: Number of Completed Packets (0x13) plen 5      #71 [hci1] 6.539052
        Num handles: 1
        Handle: 93 Address: DF:A9:FF:F6:B1:1A (OUI DF-A9-FF)
        Count: 1
        #68: len 15 (0 Kb/s)
        Latency: 171 msec (84-171 msec ~137 msec)
> ACL Data RX: Handle 93 flags 0x02 dlen 21                 #72 [hci1] 7.501974
      SMP: Pairing Confirm (0x03) len 16
        Confim value: 6717fa88bb01704af5d7275bc27fc519
< HCI Command: Host Number of Compl.. (0x03|0x0035) plen 5  #73 [hci1] 7.506399
        Num handles: 1
        Handle: 93 Address: DF:A9:FF:F6:B1:1A (OUI DF-A9-FF)
        Count: 1
< ACL Data TX: Handle 93 flags 0x00 dlen 21                 #74 [hci1] 7.506464
      SMP: Pairing Confirm (0x03) len 16
        Confim value: ab8e10ef09e88fb2592197719ebf2614
> HCI Event: Number of Completed Packets (0x13) plen 5      #75 [hci1] 7.676819
        Num handles: 1
        Handle: 93 Address: DF:A9:FF:F6:B1:1A (OUI DF-A9-FF)
        Count: 1
        #74: len 21 (0 Kb/s)
        Latency: 170 msec (84-171 msec ~153 msec)
> ACL Data RX: Handle 93 flags 0x02 dlen 21                 #76 [hci1] 7.677111
      SMP: Pairing Random (0x04) len 16
        Random value: 778e8532760496a00000000000000000
< HCI Command: Host Number of Compl.. (0x03|0x0035) plen 5  #77 [hci1] 7.686448
        Num handles: 1
        Handle: 93 Address: DF:A9:FF:F6:B1:1A (OUI DF-A9-FF)
        Count: 1
< ACL Data TX: Handle 93 flags 0x00 dlen 21                 #78 [hci1] 7.686484
      SMP: Pairing Random (0x04) len 16
        Random value: 8e6108f966a694cbe26df70bb96773e6
> HCI Event: Number of Completed Packets (0x13) plen 5      #79 [hci1] 7.851526
        Num handles: 1
        Handle: 93 Address: DF:A9:FF:F6:B1:1A (OUI DF-A9-FF)
        Count: 1
        #78: len 21 (1 Kb/s)
        Latency: 165 msec (84-171 msec ~159 msec)
> ACL Data RX: Handle 93 flags 0x02 dlen 21                 #80 [hci1] 7.939337
      SMP: Pairing Confirm (0x03) len 16
        Confim value: 3109aaa66e567251db0a6c8a65dfc0c3
< HCI Command: Host Number of Compl.. (0x03|0x0035) plen 5  #81 [hci1] 7.946536
        Num handles: 1
        Handle: 93 Address: DF:A9:FF:F6:B1:1A (OUI DF-A9-FF)
        Count: 1
< ACL Data TX: Handle 93 flags 0x00 dlen 21                 #82 [hci1] 7.946691
      SMP: Pairing Confirm (0x03) len 16
        Confim value: 4a0ca275477054fede429d0ddd7a4209
> HCI Event: Number of Completed Packets (0x13) plen 5      #83 [hci1] 8.114292
        Num handles: 1
        Handle: 93 Address: DF:A9:FF:F6:B1:1A (OUI DF-A9-FF)
        Count: 1
        #82: len 21 (1 Kb/s)
        Latency: 167 msec (84-171 msec ~163 msec)
> ACL Data RX: Handle 93 flags 0x02 dlen 21                 #84 [hci1] 8.114594
      SMP: Pairing Random (0x04) len 16
        Random value: d2b662ffeb46b5340000000000000000
< HCI Command: Host Number of Compl.. (0x03|0x0035) plen 5  #85 [hci1] 8.127015
        Num handles: 1
        Handle: 93 Address: DF:A9:FF:F6:B1:1A (OUI DF-A9-FF)
        Count: 1
< ACL Data TX: Handle 93 flags 0x00 dlen 21                 #86 [hci1] 8.127188
      SMP: Pairing Random (0x04) len 16
        Random value: 4d02679f89a05211af56d8b3da64d21e
> HCI Event: Number of Completed Packets (0x13) plen 5      #87 [hci1] 8.289037
        Num handles: 1
        Handle: 93 Address: DF:A9:FF:F6:B1:1A (OUI DF-A9-FF)
        Count: 1
        #86: len 21 (1 Kb/s)
        Latency: 161 msec (84-171 msec ~162 msec)
> ACL Data RX: Handle 93 flags 0x02 dlen 21                 #88 [hci1] 8.376816
      SMP: Pairing Confirm (0x03) len 16
        Confim value: 1e836e1c001606ac56c08c658ce78a47
< HCI Command: Host Number of Compl.. (0x03|0x0035) plen 5  #89 [hci1] 8.386910
        Num handles: 1
        Handle: 93 Address: DF:A9:FF:F6:B1:1A (OUI DF-A9-FF)
        Count: 1
< ACL Data TX: Handle 93 flags 0x00 dlen 21                 #90 [hci1] 8.387128
      SMP: Pairing Confirm (0x03) len 16
        Confim value: 9f494b2762994ab46d4df0975d73a306
> HCI Event: Number of Completed Packets (0x13) plen 5      #91 [hci1] 8.551710
        Num handles: 1
        Handle: 93 Address: DF:A9:FF:F6:B1:1A (OUI DF-A9-FF)
        Count: 1
        #90: len 21 (1 Kb/s)
        Latency: 164 msec (84-171 msec ~163 msec)
> ACL Data RX: Handle 93 flags 0x02 dlen 21                 #92 [hci1] 8.552013
      SMP: Pairing Random (0x04) len 16
        Random value: 80ea37fa9016e45c0000000000000000
< HCI Command: Host Number of Compl.. (0x03|0x0035) plen 5  #93 [hci1] 8.567010
        Num handles: 1
        Handle: 93 Address: DF:A9:FF:F6:B1:1A (OUI DF-A9-FF)
        Count: 1
< ACL Data TX: Handle 93 flags 0x00 dlen 21                 #94 [hci1] 8.567148
      SMP: Pairing Random (0x04) len 16
        Random value: 5e8286bc235a02440d0c3424a2acf8fd
> HCI Event: Number of Completed Packets (0x13) plen 5      #95 [hci1] 8.726581
        Num handles: 1
        Handle: 93 Address: DF:A9:FF:F6:B1:1A (OUI DF-A9-FF)
        Count: 1
        #94: len 21 (1 Kb/s)
        Latency: 159 msec (84-171 msec ~161 msec)
> ACL Data RX: Handle 93 flags 0x02 dlen 21                 #96 [hci1] 8.814314
      SMP: Pairing Confirm (0x03) len 16
        Confim value: 9234b25f5d40b0baefc201ff6b97fc4f
< HCI Command: Host Number of Compl.. (0x03|0x0035) plen 5  #97 [hci1] 8.826508
        Num handles: 1
        Handle: 93 Address: DF:A9:FF:F6:B1:1A (OUI DF-A9-FF)
        Count: 1
< ACL Data TX: Handle 93 flags 0x00 dlen 21                 #98 [hci1] 8.826521
      SMP: Pairing Confirm (0x03) len 16
        Confim value: 1d1ba36e6e8f9fb75c1f77f48c09fe3b
> HCI Event: Number of Completed Packets (0x13) plen 5      #99 [hci1] 8.989259
        Num handles: 1
        Handle: 93 Address: DF:A9:FF:F6:B1:1A (OUI DF-A9-FF)
        Count: 1
        #98: len 21 (1 Kb/s)
        Latency: 162 msec (84-171 msec ~162 msec)
> ACL Data RX: Handle 93 flags 0x02 dlen 21                #100 [hci1] 8.989551
      SMP: Pairing Random (0x04) len 16
        Random value: 555098079fc65b0a0000000000000000
< HCI Command: Host Number of Comp.. (0x03|0x0035) plen 5  #101 [hci1] 9.007000
        Num handles: 1
        Handle: 93 Address: DF:A9:FF:F6:B1:1A (OUI DF-A9-FF)
        Count: 1
< ACL Data TX: Handle 93 flags 0x00 dlen 21                #102 [hci1] 9.007092
      SMP: Pairing Random (0x04) len 16
        Random value: 5c4a1bcadd27bd58e945097b00bad7ac
> HCI Event: Number of Completed Packets (0x13) plen 5     #103 [hci1] 9.163956
        Num handles: 1
        Handle: 93 Address: DF:A9:FF:F6:B1:1A (OUI DF-A9-FF)
        Count: 1
        #102: len 21 (1 Kb/s)
        Latency: 156 msec (84-171 msec ~159 msec)
> ACL Data RX: Handle 93 flags 0x02 dlen 21                #104 [hci1] 9.251840
      SMP: Pairing Confirm (0x03) len 16
        Confim value: bd9959b02440c7b484ec76e7d96bd324
< HCI Command: Host Number of Comp.. (0x03|0x0035) plen 5  #105 [hci1] 9.266476
        Num handles: 1
        Handle: 93 Address: DF:A9:FF:F6:B1:1A (OUI DF-A9-FF)
        Count: 1
< ACL Data TX: Handle 93 flags 0x00 dlen 21                #106 [hci1] 9.266607
      SMP: Pairing Confirm (0x03) len 16
        Confim value: e7fa866a45a5a512a3a60380a13ce407
> HCI Event: Number of Completed Packets (0x13) plen 5     #107 [hci1] 9.426615
        Num handles: 1
        Handle: 93 Address: DF:A9:FF:F6:B1:1A (OUI DF-A9-FF)
        Count: 1
        #106: len 21 (1 Kb/s)
        Latency: 160 msec (84-171 msec ~159 msec)
> ACL Data RX: Handle 93 flags 0x02 dlen 21                #108 [hci1] 9.426988
      SMP: Pairing Random (0x04) len 16
        Random value: 48b14654993abd150000000000000000
< HCI Command: Host Number of Comp.. (0x03|0x0035) plen 5  #109 [hci1] 9.447098
        Num handles: 1
        Handle: 93 Address: DF:A9:FF:F6:B1:1A (OUI DF-A9-FF)
        Count: 1
< ACL Data TX: Handle 93 flags 0x00 dlen 21                #110 [hci1] 9.447227
      SMP: Pairing Random (0x04) len 16
        Random value: 32527e6e64e79f33b2e374394db8ab2d
> HCI Event: Number of Completed Packets (0x13) plen 5     #111 [hci1] 9.601477
        Num handles: 1
        Handle: 93 Address: DF:A9:FF:F6:B1:1A (OUI DF-A9-FF)
        Count: 1
        #110: len 21 (1 Kb/s)
        Latency: 154 msec (84-171 msec ~157 msec)
> ACL Data RX: Handle 93 flags 0x02 dlen 21                #112 [hci1] 9.689305
      SMP: Pairing Confirm (0x03) len 16
        Confim value: 9b08ec0ec2d4154af23128e9082b1452
< HCI Command: Host Number of Comp.. (0x03|0x0035) plen 5  #113 [hci1] 9.706972
        Num handles: 1
        Handle: 93 Address: DF:A9:FF:F6:B1:1A (OUI DF-A9-FF)
        Count: 1
< ACL Data TX: Handle 93 flags 0x00 dlen 21                #114 [hci1] 9.707183
      SMP: Pairing Confirm (0x03) len 16
        Confim value: edf9ce140d9df0dda253d974c2f8ca86
> HCI Event: Number of Completed Packets (0x13) plen 5     #115 [hci1] 9.864167
        Num handles: 1
        Handle: 93 Address: DF:A9:FF:F6:B1:1A (OUI DF-A9-FF)
        Count: 1
        #114: len 21 (1 Kb/s)
        Latency: 156 msec (84-171 msec ~156 msec)
> ACL Data RX: Handle 93 flags 0x02 dlen 21                #116 [hci1] 9.864449
      SMP: Pairing Random (0x04) len 16
        Random value: 661fd4e640a4cf980000000000000000
< HCI Command: Host Number of Comp.. (0x03|0x0035) plen 5  #117 [hci1] 9.867048
        Num handles: 1
        Handle: 93 Address: DF:A9:FF:F6:B1:1A (OUI DF-A9-FF)
        Count: 1
< ACL Data TX: Handle 93 flags 0x00 dlen 21                #118 [hci1] 9.867142
      SMP: Pairing Random (0x04) len 16
        Random value: dddbdfe2838e9a8cc6964353c850fef7
> HCI Event: Number of Completed Packets (0x13) plen 5    #119 [hci1] 10.038912
        Num handles: 1
        Handle: 93 Address: DF:A9:FF:F6:B1:1A (OUI DF-A9-FF)
        Count: 1
        #118: len 21 (0 Kb/s)
        Latency: 171 msec (84-171 msec ~164 msec)
> ACL Data RX: Handle 93 flags 0x02 dlen 21               #120 [hci1] 10.126785
      SMP: Pairing Confirm (0x03) len 16
        Confim value: 1aa39ebc542f457ab1185a0a9527aed3
< HCI Command: Host Number of Com.. (0x03|0x0035) plen 5  #121 [hci1] 10.146778
        Num handles: 1
        Handle: 93 Address: DF:A9:FF:F6:B1:1A (OUI DF-A9-FF)
        Count: 1
< ACL Data TX: Handle 93 flags 0x00 dlen 21               #122 [hci1] 10.146986
      SMP: Pairing Confirm (0x03) len 16
        Confim value: e5d8cf9e14b1c631de4fbec9ea041eab
> HCI Event: Number of Completed Packets (0x13) plen 5    #123 [hci1] 10.301598
        Num handles: 1
        Handle: 93 Address: DF:A9:FF:F6:B1:1A (OUI DF-A9-FF)
        Count: 1
        #122: len 21 (1 Kb/s)
        Latency: 154 msec (84-171 msec ~159 msec)
> ACL Data RX: Handle 93 flags 0x02 dlen 21               #124 [hci1] 10.301978
      SMP: Pairing Random (0x04) len 16
        Random value: 70fbe96c705f08f10000000000000000
< HCI Command: Host Number of Com.. (0x03|0x0035) plen 5  #125 [hci1] 10.307027
        Num handles: 1
        Handle: 93 Address: DF:A9:FF:F6:B1:1A (OUI DF-A9-FF)
        Count: 1
< ACL Data TX: Handle 93 flags 0x00 dlen 21               #126 [hci1] 10.307123
      SMP: Pairing Random (0x04) len 16
        Random value: eb9f1915536596b6fc3db1c86b2b1970
> HCI Event: Number of Completed Packets (0x13) plen 5    #127 [hci1] 10.476352
        Num handles: 1
        Handle: 93 Address: DF:A9:FF:F6:B1:1A (OUI DF-A9-FF)
        Count: 1
        #126: len 21 (0 Kb/s)
        Latency: 169 msec (84-171 msec ~164 msec)
> ACL Data RX: Handle 93 flags 0x02 dlen 21               #128 [hci1] 10.564309
      SMP: Pairing Confirm (0x03) len 16
        Confim value: 61a99eaca0f2125cfea08092928d1153
< HCI Command: Host Number of Com.. (0x03|0x0035) plen 5  #129 [hci1] 10.566530
        Num handles: 1
        Handle: 93 Address: DF:A9:FF:F6:B1:1A (OUI DF-A9-FF)
        Count: 1
< ACL Data TX: Handle 93 flags 0x00 dlen 21               #130 [hci1] 10.566649
      SMP: Pairing Confirm (0x03) len 16
        Confim value: 55f44d98c929be7fab090d73b29d1aa2
> HCI Event: Number of Completed Packets (0x13) plen 5    #131 [hci1] 10.739165
        Num handles: 1
        Handle: 93 Address: DF:A9:FF:F6:B1:1A (OUI DF-A9-FF)
        Count: 1
        #130: len 21 (0 Kb/s)
        Latency: 172 msec (84-172 msec ~168 msec)
> ACL Data RX: Handle 93 flags 0x02 dlen 21               #132 [hci1] 10.739463
      SMP: Pairing Random (0x04) len 16
        Random value: 17dc7f9076d3d2600000000000000000
< HCI Command: Host Number of Com.. (0x03|0x0035) plen 5  #133 [hci1] 10.747004
        Num handles: 1
        Handle: 93 Address: DF:A9:FF:F6:B1:1A (OUI DF-A9-FF)
        Count: 1
< ACL Data TX: Handle 93 flags 0x00 dlen 21               #134 [hci1] 10.747112
      SMP: Pairing Random (0x04) len 16
        Random value: 5c794dc9ad9f2c3f295ebd5ad5e1c3cf
> HCI Event: Number of Completed Packets (0x13) plen 5    #135 [hci1] 10.913924
        Num handles: 1
        Handle: 93 Address: DF:A9:FF:F6:B1:1A (OUI DF-A9-FF)
        Count: 1
        #134: len 21 (1 Kb/s)
        Latency: 166 msec (84-172 msec ~167 msec)
> ACL Data RX: Handle 93 flags 0x02 dlen 21               #136 [hci1] 11.001789
      SMP: Pairing Confirm (0x03) len 16
        Confim value: 1bd09037106cb371e33ab70ecb5a7073
< HCI Command: Host Number of Com.. (0x03|0x0035) plen 5  #137 [hci1] 11.006535
        Num handles: 1
        Handle: 93 Address: DF:A9:FF:F6:B1:1A (OUI DF-A9-FF)
        Count: 1
< ACL Data TX: Handle 93 flags 0x00 dlen 21               #138 [hci1] 11.006672
      SMP: Pairing Confirm (0x03) len 16
        Confim value: b57dfae5416b7820b463348b60d6fc2e
> HCI Event: Number of Completed Packets (0x13) plen 5    #139 [hci1] 11.176634
        Num handles: 1
        Handle: 93 Address: DF:A9:FF:F6:B1:1A (OUI DF-A9-FF)
        Count: 1
        #138: len 21 (0 Kb/s)
        Latency: 169 msec (84-172 msec ~168 msec)
> ACL Data RX: Handle 93 flags 0x02 dlen 21               #140 [hci1] 11.176932
      SMP: Pairing Random (0x04) len 16
        Random value: 0bdd0a8638298e540000000000000000
< HCI Command: Host Number of Com.. (0x03|0x0035) plen 5  #141 [hci1] 11.187034
        Num handles: 1
        Handle: 93 Address: DF:A9:FF:F6:B1:1A (OUI DF-A9-FF)
        Count: 1
< ACL Data TX: Handle 93 flags 0x00 dlen 21               #142 [hci1] 11.187219
      SMP: Pairing Random (0x04) len 16
        Random value: 5c2fff312cdf99c9491988e877355a9a
> HCI Event: Number of Completed Packets (0x13) plen 5    #143 [hci1] 11.351364
        Num handles: 1
        Handle: 93 Address: DF:A9:FF:F6:B1:1A (OUI DF-A9-FF)
        Count: 1
        #142: len 21 (1 Kb/s)
        Latency: 164 msec (84-172 msec ~166 msec)
> ACL Data RX: Handle 93 flags 0x02 dlen 21               #144 [hci1] 11.439279
      SMP: Pairing Confirm (0x03) len 16
        Confim value: 5f51d73827a009a970ef04dc667f07e0
< HCI Command: Host Number of Com.. (0x03|0x0035) plen 5  #145 [hci1] 11.446911
        Num handles: 1
        Handle: 93 Address: DF:A9:FF:F6:B1:1A (OUI DF-A9-FF)
        Count: 1
< ACL Data TX: Handle 93 flags 0x00 dlen 21               #146 [hci1] 11.447153
      SMP: Pairing Confirm (0x03) len 16
        Confim value: 04d63375b9df05782ae4ac40ff34fab6
> HCI Event: Number of Completed Packets (0x13) plen 5    #147 [hci1] 11.614111
        Num handles: 1
        Handle: 93 Address: DF:A9:FF:F6:B1:1A (OUI DF-A9-FF)
        Count: 1
        #146: len 21 (1 Kb/s)
        Latency: 166 msec (84-172 msec ~166 msec)
> ACL Data RX: Handle 93 flags 0x02 dlen 21               #148 [hci1] 11.614490
      SMP: Pairing Random (0x04) len 16
        Random value: e04c22c513bbffab0000000000000000
< HCI Command: Host Number of Com.. (0x03|0x0035) plen 5  #149 [hci1] 11.627086
        Num handles: 1
        Handle: 93 Address: DF:A9:FF:F6:B1:1A (OUI DF-A9-FF)
        Count: 1
< ACL Data TX: Handle 93 flags 0x00 dlen 21               #150 [hci1] 11.627191
      SMP: Pairing Random (0x04) len 16
        Random value: c629a3a987d808e808655d558dfc1155
> HCI Event: Number of Completed Packets (0x13) plen 5    #151 [hci1] 11.788932
        Num handles: 1
        Handle: 93 Address: DF:A9:FF:F6:B1:1A (OUI DF-A9-FF)
        Count: 1
        #150: len 21 (1 Kb/s)
        Latency: 161 msec (84-172 msec ~164 msec)
> ACL Data RX: Handle 93 flags 0x02 dlen 21               #152 [hci1] 11.876723
      SMP: Pairing Confirm (0x03) len 16
        Confim value: ef368a8ee766e73cf3f8cf8003d678f0
< HCI Command: Host Number of Com.. (0x03|0x0035) plen 5  #153 [hci1] 11.886856
        Num handles: 1
        Handle: 93 Address: DF:A9:FF:F6:B1:1A (OUI DF-A9-FF)
        Count: 1
< ACL Data TX: Handle 93 flags 0x00 dlen 21               #154 [hci1] 11.887034
      SMP: Pairing Confirm (0x03) len 16
        Confim value: d2129a8df64bc31cd3f2990a9aecbb87
> HCI Event: Number of Completed Packets (0x13) plen 5    #155 [hci1] 12.051608
        Num handles: 1
        Handle: 93 Address: DF:A9:FF:F6:B1:1A (OUI DF-A9-FF)
        Count: 1
        #154: len 21 (1 Kb/s)
        Latency: 164 msec (84-172 msec ~164 msec)
> ACL Data RX: Handle 93 flags 0x02 dlen 21               #156 [hci1] 12.051889
      SMP: Pairing Random (0x04) len 16
        Random value: fb0cac9887bab7280000000000000000
< HCI Command: Host Number of Com.. (0x03|0x0035) plen 5  #157 [hci1] 12.067024
        Num handles: 1
        Handle: 93 Address: DF:A9:FF:F6:B1:1A (OUI DF-A9-FF)
        Count: 1
< ACL Data TX: Handle 93 flags 0x00 dlen 21               #158 [hci1] 12.067045
      SMP: Pairing Random (0x04) len 16
        Random value: 92f20f6ad8f13724432c7fd6001c45ff
> HCI Event: Number of Completed Packets (0x13) plen 5    #159 [hci1] 12.226375
        Num handles: 1
        Handle: 93 Address: DF:A9:FF:F6:B1:1A (OUI DF-A9-FF)
        Count: 1
        #158: len 21 (1 Kb/s)
        Latency: 159 msec (84-172 msec ~161 msec)
> ACL Data RX: Handle 93 flags 0x02 dlen 21               #160 [hci1] 12.314262
      SMP: Pairing Confirm (0x03) len 16
        Confim value: dd54def41a0c04d74fdb0a81de38fbfd
< HCI Command: Host Number of Com.. (0x03|0x0035) plen 5  #161 [hci1] 12.326673
        Num handles: 1
        Handle: 93 Address: DF:A9:FF:F6:B1:1A (OUI DF-A9-FF)
        Count: 1
< ACL Data TX: Handle 93 flags 0x00 dlen 21               #162 [hci1] 12.326844
      SMP: Pairing Confirm (0x03) len 16
        Confim value: de504920ffc2fa5c7a4431b9aa0d6bf8
> HCI Event: Number of Completed Packets (0x13) plen 5    #163 [hci1] 12.489011
        Num handles: 1
        Handle: 93 Address: DF:A9:FF:F6:B1:1A (OUI DF-A9-FF)
        Count: 1
        #162: len 21 (1 Kb/s)
        Latency: 162 msec (84-172 msec ~162 msec)
> ACL Data RX: Handle 93 flags 0x02 dlen 21               #164 [hci1] 12.489414
      SMP: Pairing Random (0x04) len 16
        Random value: 6f31c60c1272d5210000000000000000
< HCI Command: Host Number of Com.. (0x03|0x0035) plen 5  #165 [hci1] 12.507075
        Num handles: 1
        Handle: 93 Address: DF:A9:FF:F6:B1:1A (OUI DF-A9-FF)
        Count: 1
< ACL Data TX: Handle 93 flags 0x00 dlen 21               #166 [hci1] 12.507151
      SMP: Pairing Random (0x04) len 16
        Random value: 23ac32ebbb5e14c8a6b9622f296d277f
> HCI Event: Number of Completed Packets (0x13) plen 5    #167 [hci1] 12.663848
        Num handles: 1
        Handle: 93 Address: DF:A9:FF:F6:B1:1A (OUI DF-A9-FF)
        Count: 1
        #166: len 21 (1 Kb/s)
        Latency: 156 msec (84-172 msec ~159 msec)
> ACL Data RX: Handle 93 flags 0x02 dlen 21               #168 [hci1] 12.751750
      SMP: Pairing Confirm (0x03) len 16
        Confim value: a64bf50340e533c6a67d716defcbf536
< HCI Command: Host Number of Com.. (0x03|0x0035) plen 5  #169 [hci1] 12.766861
        Num handles: 1
        Handle: 93 Address: DF:A9:FF:F6:B1:1A (OUI DF-A9-FF)
        Count: 1
< ACL Data TX: Handle 93 flags 0x00 dlen 21               #170 [hci1] 12.767102
      SMP: Pairing Confirm (0x03) len 16
        Confim value: 2619e285caf2e2acad0b27f1d4a40257
> HCI Event: Number of Completed Packets (0x13) plen 5    #171 [hci1] 12.926567
        Num handles: 1
        Handle: 93 Address: DF:A9:FF:F6:B1:1A (OUI DF-A9-FF)
        Count: 1
        #170: len 21 (1 Kb/s)
        Latency: 159 msec (84-172 msec ~159 msec)
> ACL Data RX: Handle 93 flags 0x02 dlen 21               #172 [hci1] 12.926887
      SMP: Pairing Random (0x04) len 16
        Random value: dc52c694fb43a9610000000000000000
< HCI Command: Host Number of Com.. (0x03|0x0035) plen 5  #173 [hci1] 12.947138
        Num handles: 1
        Handle: 93 Address: DF:A9:FF:F6:B1:1A (OUI DF-A9-FF)
        Count: 1
< ACL Data TX: Handle 93 flags 0x00 dlen 21               #174 [hci1] 12.947220
      SMP: Pairing Random (0x04) len 16
        Random value: 297efe85e67448a15f56bd27e3a3cf1d
> HCI Event: Number of Completed Packets (0x13) plen 5    #175 [hci1] 13.101420
        Num handles: 1
        Handle: 93 Address: DF:A9:FF:F6:B1:1A (OUI DF-A9-FF)
        Count: 1
        #174: len 21 (1 Kb/s)
        Latency: 154 msec (84-172 msec ~156 msec)
> ACL Data RX: Handle 93 flags 0x02 dlen 21               #176 [hci1] 13.189182
      SMP: Pairing Confirm (0x03) len 16
        Confim value: bf345f194e5b86d38a52ff45b4eb070e
< HCI Command: Host Number of Com.. (0x03|0x0035) plen 5  #177 [hci1] 13.206719
        Num handles: 1
        Handle: 93 Address: DF:A9:FF:F6:B1:1A (OUI DF-A9-FF)
        Count: 1
< ACL Data TX: Handle 93 flags 0x00 dlen 21               #178 [hci1] 13.206834
      SMP: Pairing Confirm (0x03) len 16
        Confim value: 80bc976efacb178f931ca97ca19263a2
> HCI Event: Number of Completed Packets (0x13) plen 5    #179 [hci1] 13.364067
        Num handles: 1
        Handle: 93 Address: DF:A9:FF:F6:B1:1A (OUI DF-A9-FF)
        Count: 1
        #178: len 21 (1 Kb/s)
        Latency: 157 msec (84-172 msec ~157 msec)
> ACL Data RX: Handle 93 flags 0x02 dlen 21               #180 [hci1] 13.364419
      SMP: Pairing Random (0x04) len 16
        Random value: af7741c7bec60f100000000000000000
< HCI Command: Host Number of Com.. (0x03|0x0035) plen 5  #181 [hci1] 13.366881
        Num handles: 1
        Handle: 93 Address: DF:A9:FF:F6:B1:1A (OUI DF-A9-FF)
        Count: 1
< ACL Data TX: Handle 93 flags 0x00 dlen 21               #182 [hci1] 13.366896
      SMP: Pairing Random (0x04) len 16
        Random value: 25a9493fd3ce4faf02be7293595bb7c6
> HCI Event: Number of Completed Packets (0x13) plen 5    #183 [hci1] 13.538923
        Num handles: 1
        Handle: 93 Address: DF:A9:FF:F6:B1:1A (OUI DF-A9-FF)
        Count: 1
        #182: len 21 (0 Kb/s)
        Latency: 172 msec (84-172 msec ~164 msec)
> ACL Data RX: Handle 93 flags 0x02 dlen 21               #184 [hci1] 13.626732
      SMP: Pairing Confirm (0x03) len 16
        Confim value: 6a09c8bf36493c96c9e6d845379f742c
< HCI Command: Host Number of Com.. (0x03|0x0035) plen 5  #185 [hci1] 13.646858
        Num handles: 1
        Handle: 93 Address: DF:A9:FF:F6:B1:1A (OUI DF-A9-FF)
        Count: 1
< ACL Data TX: Handle 93 flags 0x00 dlen 21               #186 [hci1] 13.647113
      SMP: Pairing Confirm (0x03) len 16
        Confim value: 920f17f42e3ae8e270915b7800c09885
> HCI Event: Number of Completed Packets (0x13) plen 5    #187 [hci1] 13.801534
        Num handles: 1
        Handle: 93 Address: DF:A9:FF:F6:B1:1A (OUI DF-A9-FF)
        Count: 1
        #186: len 21 (1 Kb/s)
        Latency: 154 msec (84-172 msec ~159 msec)
> ACL Data RX: Handle 93 flags 0x02 dlen 21               #188 [hci1] 13.801828
      SMP: Pairing Random (0x04) len 16
        Random value: 53f4dd3ce80819830000000000000000
< HCI Command: Host Number of Com.. (0x03|0x0035) plen 5  #189 [hci1] 13.807231
        Num handles: 1
        Handle: 93 Address: DF:A9:FF:F6:B1:1A (OUI DF-A9-FF)
        Count: 1
< ACL Data TX: Handle 93 flags 0x00 dlen 21               #190 [hci1] 13.807396
      SMP: Pairing Random (0x04) len 16
        Random value: 58f6b41f855a6f6c3560debd84e2affc
> HCI Event: Number of Completed Packets (0x13) plen 5    #191 [hci1] 13.976343
        Num handles: 1
        Handle: 93 Address: DF:A9:FF:F6:B1:1A (OUI DF-A9-FF)
        Count: 1
        #190: len 21 (1 Kb/s)
        Latency: 168 msec (84-172 msec ~164 msec)
> ACL Data RX: Handle 93 flags 0x02 dlen 21               #192 [hci1] 14.064285
      SMP: Pairing Confirm (0x03) len 16
        Confim value: 86728f40f84f1044f79d0da9821cc763
< HCI Command: Host Number of Com.. (0x03|0x0035) plen 5  #193 [hci1] 14.066846
        Num handles: 1
        Handle: 93 Address: DF:A9:FF:F6:B1:1A (OUI DF-A9-FF)
        Count: 1
< ACL Data TX: Handle 93 flags 0x00 dlen 21               #194 [hci1] 14.067047
      SMP: Pairing Confirm (0x03) len 16
        Confim value: 12d85a0321966bfc2bd2560d8a925f4a
> HCI Event: Number of Completed Packets (0x13) plen 5    #195 [hci1] 14.239054
        Num handles: 1
        Handle: 93 Address: DF:A9:FF:F6:B1:1A (OUI DF-A9-FF)
        Count: 1
        #194: len 21 (0 Kb/s)
        Latency: 172 msec (84-172 msec ~168 msec)
> ACL Data RX: Handle 93 flags 0x02 dlen 21               #196 [hci1] 14.239345
      SMP: Pairing Random (0x04) len 16
        Random value: 06626880ef946d270000000000000000
< HCI Command: Host Number of Com.. (0x03|0x0035) plen 5  #197 [hci1] 14.247002
        Num handles: 1
        Handle: 93 Address: DF:A9:FF:F6:B1:1A (OUI DF-A9-FF)
        Count: 1
< ACL Data TX: Handle 93 flags 0x00 dlen 21               #198 [hci1] 14.247114
      SMP: Pairing Random (0x04) len 16
        Random value: b67e7216d5bf664139eda2b542549666
> HCI Event: Number of Completed Packets (0x13) plen 5    #199 [hci1] 14.413800
        Num handles: 1
        Handle: 93 Address: DF:A9:FF:F6:B1:1A (OUI DF-A9-FF)
        Count: 1
        #198: len 21 (1 Kb/s)
        Latency: 166 msec (84-172 msec ~167 msec)
> ACL Data RX: Handle 93 flags 0x02 dlen 21               #200 [hci1] 14.501724
      SMP: Pairing Confirm (0x03) len 16
        Confim value: d885b2c20520218642b7072531ec97c8
< HCI Command: Host Number of Com.. (0x03|0x0035) plen 5  #201 [hci1] 14.506859
        Num handles: 1
        Handle: 93 Address: DF:A9:FF:F6:B1:1A (OUI DF-A9-FF)
        Count: 1
< ACL Data TX: Handle 93 flags 0x00 dlen 21               #202 [hci1] 14.507044
      SMP: Pairing Confirm (0x03) len 16
        Confim value: b5d048e98e85508594bb586ad1d3e750
> HCI Event: Number of Completed Packets (0x13) plen 5    #203 [hci1] 14.676463
        Num handles: 1
        Handle: 93 Address: DF:A9:FF:F6:B1:1A (OUI DF-A9-FF)
        Count: 1
        #202: len 21 (0 Kb/s)
        Latency: 169 msec (84-172 msec ~168 msec)
> ACL Data RX: Handle 93 flags 0x02 dlen 21               #204 [hci1] 14.676866
      SMP: Pairing Random (0x04) len 16
        Random value: 1ebc2bdc73bf14f80000000000000000
< HCI Command: Host Number of Com.. (0x03|0x0035) plen 5  #205 [hci1] 14.687067
        Num handles: 1
        Handle: 93 Address: DF:A9:FF:F6:B1:1A (OUI DF-A9-FF)
        Count: 1
< ACL Data TX: Handle 93 flags 0x00 dlen 21               #206 [hci1] 14.687158
      SMP: Pairing Random (0x04) len 16
        Random value: ed17f76500c95219dd01e09d1e63f87b
> HCI Event: Number of Completed Packets (0x13) plen 5    #207 [hci1] 14.851367
        Num handles: 1
        Handle: 93 Address: DF:A9:FF:F6:B1:1A (OUI DF-A9-FF)
        Count: 1
        #206: len 21 (1 Kb/s)
        Latency: 164 msec (84-172 msec ~166 msec)
> ACL Data RX: Handle 93 flags 0x02 dlen 21               #208 [hci1] 14.939235
      SMP: Pairing Confirm (0x03) len 16
        Confim value: 4939a633dab2a4e8a0fa35220373cff6
< HCI Command: Host Number of Com.. (0x03|0x0035) plen 5  #209 [hci1] 14.946707
        Num handles: 1
        Handle: 93 Address: DF:A9:FF:F6:B1:1A (OUI DF-A9-FF)
        Count: 1
< ACL Data TX: Handle 93 flags 0x00 dlen 21               #210 [hci1] 14.946902
      SMP: Pairing Confirm (0x03) len 16
        Confim value: 7d4ad3fe77d378943aeede5a14a03ec0
> HCI Event: Number of Completed Packets (0x13) plen 5    #211 [hci1] 15.114015
        Num handles: 1
        Handle: 93 Address: DF:A9:FF:F6:B1:1A (OUI DF-A9-FF)
        Count: 1
        #210: len 21 (1 Kb/s)
        Latency: 167 msec (84-172 msec ~166 msec)
> ACL Data RX: Handle 93 flags 0x02 dlen 21               #212 [hci1] 15.114326
      SMP: Pairing Random (0x04) len 16
        Random value: c3b09c993713751d0000000000000000
< HCI Command: Host Number of Com.. (0x03|0x0035) plen 5  #213 [hci1] 15.127063
        Num handles: 1
        Handle: 93 Address: DF:A9:FF:F6:B1:1A (OUI DF-A9-FF)
        Count: 1
< ACL Data TX: Handle 93 flags 0x00 dlen 21               #214 [hci1] 15.127175
      SMP: Pairing Random (0x04) len 16
        Random value: 81d35d47e1f6006d79c974bd9d9e1ee3
> HCI Event: Number of Completed Packets (0x13) plen 5    #215 [hci1] 15.288727
        Num handles: 1
        Handle: 93 Address: DF:A9:FF:F6:B1:1A (OUI DF-A9-FF)
        Count: 1
        #214: len 21 (1 Kb/s)
        Latency: 161 msec (84-172 msec ~164 msec)
> ACL Data RX: Handle 93 flags 0x02 dlen 21               #216 [hci1] 15.376630
      SMP: Pairing Confirm (0x03) len 16
        Confim value: 10c10fa78950053c82fb9d6869b5b010
< HCI Command: Host Number of Com.. (0x03|0x0035) plen 5  #217 [hci1] 15.386518
        Num handles: 1
        Handle: 93 Address: DF:A9:FF:F6:B1:1A (OUI DF-A9-FF)
        Count: 1
< ACL Data TX: Handle 93 flags 0x00 dlen 21               #218 [hci1] 15.386619
      SMP: Pairing Confirm (0x03) len 16
        Confim value: 121a7b1a5a9612b71be691b0b105da0e
> HCI Event: Number of Completed Packets (0x13) plen 5    #219 [hci1] 15.551508
        Num handles: 1
        Handle: 93 Address: DF:A9:FF:F6:B1:1A (OUI DF-A9-FF)
        Count: 1
        #218: len 21 (1 Kb/s)
        Latency: 164 msec (84-172 msec ~164 msec)
> ACL Data RX: Handle 93 flags 0x02 dlen 21               #220 [hci1] 15.551881
      SMP: Pairing Random (0x04) len 16
        Random value: 00000629c1c0d6d00000000000000000
< HCI Command: Host Number of Com.. (0x03|0x0035) plen 5  #221 [hci1] 15.567077
        Num handles: 1
        Handle: 93 Address: DF:A9:FF:F6:B1:1A (OUI DF-A9-FF)
        Count: 1
< ACL Data TX: Handle 93 flags 0x00 dlen 21               #222 [hci1] 15.567208
      SMP: Pairing Random (0x04) len 16
        Random value: e7f7e0c2476823e41736a7e381bafb7c
> HCI Event: Number of Completed Packets (0x13) plen 5    #223 [hci1] 15.726292
        Num handles: 1
        Handle: 93 Address: DF:A9:FF:F6:B1:1A (OUI DF-A9-FF)
        Count: 1
        #222: len 21 (1 Kb/s)
        Latency: 159 msec (84-172 msec ~161 msec)
> ACL Data RX: Handle 93 flags 0x02 dlen 21               #224 [hci1] 15.814168
      SMP: Pairing Confirm (0x03) len 16
        Confim value: 875e562e90c690f25f376c2bfe3bb5a6
< HCI Command: Host Number of Com.. (0x03|0x0035) plen 5  #225 [hci1] 15.826909
        Num handles: 1
        Handle: 93 Address: DF:A9:FF:F6:B1:1A (OUI DF-A9-FF)
        Count: 1
< ACL Data TX: Handle 93 flags 0x00 dlen 21               #226 [hci1] 15.827240
      SMP: Pairing Confirm (0x03) len 16
        Confim value: b515d52e5422243edba5af43da722033
> HCI Event: Number of Completed Packets (0x13) plen 5    #227 [hci1] 15.989002
        Num handles: 1
        Handle: 93 Address: DF:A9:FF:F6:B1:1A (OUI DF-A9-FF)
        Count: 1
        #226: len 21 (1 Kb/s)
        Latency: 161 msec (84-172 msec ~161 msec)
> ACL Data RX: Handle 93 flags 0x02 dlen 21               #228 [hci1] 15.989314
      SMP: Pairing Random (0x04) len 16
        Random value: 8ae2dcf592e404750000000000000000
< HCI Command: Host Number of Com.. (0x03|0x0035) plen 5  #229 [hci1] 16.007081
        Num handles: 1
        Handle: 93 Address: DF:A9:FF:F6:B1:1A (OUI DF-A9-FF)
        Count: 1
