Bluetooth monitor ver 5.72
btmon[327130]: = Note: Linux version 6.14.0-36-generic (x86_64)                                                          0.363214
btmon[327130]: = Note: Bluetooth subsystem version 2.22                                                                  0.363216
= New Index: 00:00:00:00:00:00 (Primary,UART,hci1)                                                                       0.363217
= New Index: 48:5F:99:8E:E0:64 (Primary,USB,hci0)                                                                        0.363218
= Open Index: 00:00:00:00:00:00                                                                                          0.878148
= Index Info: 00:00:00:00:00:00 (Nordic Semiconductor ASA)                                                               0.878162
zephyr.exe[327132]: @ USER Open: main (privileged) version 2.22                                                 {0x0001} 0.878171
zephyr.exe[327132]: < HCI Command: Reset (0x03|0x0003) plen 0                                                         #1 0.879403
> HCI Event: Command Complete (0x0e) plen 4                                                                           #2 0.879904
      Reset (0x03|0x0003) ncmd 1
        Status: Success (0x00)
zephyr.exe[327132]: < HCI Command: Read Local Supported Features (0x04|0x0003) plen 0                                 #3 0.897962
> HCI Event: Command Complete (0x0e) plen 12                                                                          #4 0.898459
      Read Local Supported Features (0x04|0x0003) ncmd 1
        Status: Success (0x00)
        Features: 0x00 0x00 0x00 0x00 0x60 0x00 0x00 0x00
          BR/EDR Not Supported
          LE Supported (Controller)
zephyr.exe[327132]: < HCI Command: Read Local Version Information (0x04|0x0001) plen 0                                #5 0.917752
> HCI Event: Command Complete (0x0e) plen 12                                                                          #6 0.918187
      Read Local Version Information (0x04|0x0001) ncmd 1
        Status: Success (0x00)
        HCI version: Reserved (0x0e) - Revision 12520 (0x30e8)
        LMP version: Reserved (0x0e) - Subversion 12520 (0x30e8)
        Manufacturer: Nordic Semiconductor ASA (89)
zephyr.exe[327132]: < HCI Command: Read Local Supported Commands (0x04|0x0002) plen 0                                 #7 0.937662
> HCI Event: Command Complete (0x0e) plen 68                                                                          #8 0.938774
      Read Local Supported Commands (0x04|0x0002) ncmd 1
        Status: Success (0x00)
        Commands: 119 entries
          Disconnect (Octet 0 - Bit 5)
          Read Remote Version Information (Octet 2 - Bit 7)
          Set Event Mask (Octet 5 - Bit 6)
          Reset (Octet 5 - Bit 7)
          Read Connection Accept Timeout (Octet 7 - Bit 2)
          Write Connection Accept Timeout (Octet 7 - Bit 3)
          Read Transmit Power Level (Octet 10 - Bit 2)
          Set Controller To Host Flow Control (Octet 10 - Bit 5)
          Host Buffer Size (Octet 10 - Bit 6)
          Host Number of Completed Packets (Octet 10 - Bit 7)
          Read Local Version Information (Octet 14 - Bit 3)
          Read Local Supported Features (Octet 14 - Bit 5)
          Read BD ADDR (Octet 15 - Bit 1)
          Read RSSI (Octet 15 - Bit 5)
          Set Event Mask Page 2 (Octet 22 - Bit 2)
          LE Set Event Mask (Octet 25 - Bit 0)
          LE Read Buffer Size (Octet 25 - Bit 1)
          LE Read Local Supported Features (Octet 25 - Bit 2)
          LE Set Random Address (Octet 25 - Bit 4)
          LE Set Advertising Parameters (Octet 25 - Bit 5)
          LE Read Advertising Channel TX Power (Octet 25 - Bit 6)
          LE Set Advertising Data (Octet 25 - Bit 7)
          LE Set Scan Response Data (Octet 26 - Bit 0)
          LE Set Advertise Enable (Octet 26 - Bit 1)
          LE Set Scan Parameters (Octet 26 - Bit 2)
          LE Set Scan Enable (Octet 26 - Bit 3)
          LE Create Connection (Octet 26 - Bit 4)
          LE Create Connection Cancel (Octet 26 - Bit 5)
          LE Read Accept List Size (Octet 26 - Bit 6)
          LE Clear Accept List (Octet 26 - Bit 7)
          LE Add Device To Accept List (Octet 27 - Bit 0)
          LE Remove Device From Accept List (Octet 27 - Bit 1)
          LE Connection Update (Octet 27 - Bit 2)
          LE Set Host Channel Classification (Octet 27 - Bit 3)
          LE Read Channel Map (Octet 27 - Bit 4)
          LE Read Remote Used Features (Octet 27 - Bit 5)
          LE Encrypt (Octet 27 - Bit 6)
          LE Rand (Octet 27 - Bit 7)
          LE Start Encryption (Octet 28 - Bit 0)
          LE Long Term Key Request Reply (Octet 28 - Bit 1)
          LE Long Term Key Request Neg Reply (Octet 28 - Bit 2)
          LE Read Supported States (Octet 28 - Bit 3)
          LE Receiver Test (Octet 28 - Bit 4)
          LE Transmitter Test (Octet 28 - Bit 5)
          LE Test End (Octet 28 - Bit 6)
          Read Authenticated Payload Timeout (Octet 32 - Bit 4)
          Write Authenticated Payload Timeout (Octet 32 - Bit 5)
          LE Set Data Length (Octet 33 - Bit 6)
          LE Read Suggested Default Data Length (Octet 33 - Bit 7)
          LE Write Suggested Default Data Length (Octet 34 - Bit 0)
          LE Add Device To Resolving List (Octet 34 - Bit 3)
          LE Remove Device From Resolving List (Octet 34 - Bit 4)
          LE Clear Resolving List (Octet 34 - Bit 5)
          LE Read Resolving List Size (Octet 34 - Bit 6)
          LE Set Address Resolution Enable (Octet 35 - Bit 1)
          LE Set Resolvable Private Address Timeout (Octet 35 - Bit 2)
          LE Read Maximum Data Length (Octet 35 - Bit 3)
          LE Read PHY (Octet 35 - Bit 4)
          LE Set Default PHY (Octet 35 - Bit 5)
          LE Set PHY (Octet 35 - Bit 6)
          LE Enhanced Receiver Test (Octet 35 - Bit 7)
          LE Enhanced Transmitter Test (Octet 36 - Bit 0)
          LE Set Advertising Set Random Address (Octet 36 - Bit 1)
          LE Set Extended Advertising Parameters (Octet 36 - Bit 2)
          LE Set Extended Advertising Data (Octet 36 - Bit 3)
          LE Set Extended Scan Response Data (Octet 36 - Bit 4)
          LE Set Extended Advertising Enable (Octet 36 - Bit 5)
          LE Read Maximum Advertising Data Length (Octet 36 - Bit 6)
          LE Read Number of Supported Advertising Sets (Octet 36 - Bit 7)
          LE Remove Advertising Set (Octet 37 - Bit 0)
          LE Clear Advertising Sets (Octet 37 - Bit 1)
          LE Set Periodic Advertising Parameters (Octet 37 - Bit 2)
          LE Set Periodic Advertising Data (Octet 37 - Bit 3)
          LE Set Periodic Advertising Enable (Octet 37 - Bit 4)
          LE Set Extended Scan Parameters (Octet 37 - Bit 5)
          LE Set Extended Scan Enable (Octet 37 - Bit 6)
          LE Extended Create Connection (Octet 37 - Bit 7)
          LE Periodic Advertising Create Sync (Octet 38 - Bit 0)
          LE Periodic Advertising Create Sync Cancel (Octet 38 - Bit 1)
          LE Periodic Advertising Terminate Sync (Octet 38 - Bit 2)
          LE Add Device To Periodic Advertiser List (Octet 38 - Bit 3)
          LE Remove Device From Periodic Advertiser List (Octet 38 - Bit 4)
          LE Clear Periodic Advertiser List (Octet 38 - Bit 5)
          LE Read Periodic Advertiser List Size (Octet 38 - Bit 6)
          LE Read Transmit Power (Octet 38 - Bit 7)
          LE Read RF Path Compensation (Octet 39 - Bit 0)
          LE Write RF Path Compensation (Octet 39 - Bit 1)
          LE Set Privacy Mode (Octet 39 - Bit 2)
          LE Periodic Advertising Receive Enable (Octet 40 - Bit 5)
          LE Periodic Advertising Sync Transfer (Octet 40 - Bit 6)
          LE Periodic Advertising Set Info Transfer (Octet 40 - Bit 7)
          LE Periodic Advertising Sync Transfer Parameters (Octet 41 - Bit 0)
          LE Set Default Periodic Advertisng Sync Transfer Parameters (Octet 41 - Bit 1)
          LE Read Buffer v2 (Octet 41 - Bit 5)
          LE Read ISO TX Sync (Octet 41 - Bit 6)
          LE Set Connected Isochronous Group Parameters (Octet 41 - Bit 7)
          LE Set Connected Isochronous Group Parameters Test (Octet 42 - Bit 0)
          LE Create Connected Isochronous Stream (Octet 42 - Bit 1)
          LE Remove Connected Isochronous Group (Octet 42 - Bit 2)
          LE Accept Connected Isochronous Stream Request (Octet 42 - Bit 3)
          LE Reject Connected Isochronous Stream Request (Octet 42 - Bit 4)
          LE Create Broadcast Isochronous Group (Octet 42 - Bit 5)
          LE Create Broadcast Isochronous Group Test (Octet 42 - Bit 6)
          LE Terminate Broadcast Isochronous Group (Octet 42 - Bit 7)
          LE Broadcast Isochronous Group Create Sync (Octet 43 - Bit 0)
          LE Broadcast Isochronous Group Terminate Sync (Octet 43 - Bit 1)
          LE Request Peer SCA (Octet 43 - Bit 2)
          LE Setup Isochronous Data Path (Octet 43 - Bit 3)
          LE Remove Isochronous Data Path (Octet 43 - Bit 4)
          LE Isochronous Transmit Test (Octet 43 - Bit 5)
          LE Isochronous Receive Test (Octet 43 - Bit 6)
          LE Isochronous Read Test Counters (Octet 43 - Bit 7)
          LE Isochronous Read Test Counters (Octet 44 - Bit 0)
          LE Set Host Feature (Octet 44 - Bit 1)
          Octet 44 - Bit 2 
          Octet 45 - Bit 6 
          Octet 46 - Bit 0 
          Octet 46 - Bit 1 
          Octet 46 - Bit 2 
zephyr.exe[327132]: < HCI Command: Host Buffer Size (0x03|0x0033) plen 7                                              #9 0.957668
        ACL MTU: 255  ACL max packet: 16
        SCO MTU: 0    SCO max packet: 0
> HCI Event: Command Complete (0x0e) plen 4                                                                          #10 0.958120
      Host Buffer Size (0x03|0x0033) ncmd 1
        Status: Success (0x00)
zephyr.exe[327132]: < HCI Command: Set Controller To Host Flow Control (0x03|0x0031) plen 1                          #11 0.977671
        Flow control: ACL Data Packets (0x01)
> HCI Event: Command Complete (0x0e) plen 4                                                                          #12 0.978116
      Set Controller To Host Flow Control (0x03|0x0031) ncmd 1
        Status: Success (0x00)
zephyr.exe[327132]: < HCI Command: LE Read Local Supported Features (0x08|0x0003) plen 0                             #13 0.997666
> HCI Event: Command Complete (0x0e) plen 12                                                                         #14 0.998135
      LE Read Local Supported Features (0x08|0x0003) ncmd 1
        Status: Success (0x00)
        Features: 0xfd 0x79 0x00 0xf7 0x30 0x01 0x00 0x00
          LE Encryption
          Extended Reject Indication
          Peripheral-initiated Features Exchange
          LE Ping
          LE Data Packet Length Extension
          LL Privacy
          Extended Scanner Filter Policies
          LE 2M PHY
          LE Coded PHY
          LE Extended Advertising
          LE Periodic Advertising
          Channel Selection Algorithm #2
          Periodic Advertising Sync Transfer - Sender
          Periodic Advertising Sync Transfer - Recipient
          Sleep Clock Accuracy Updates
          Connected Isochronous Stream - Central
          Connected Isochronous Stream - Peripheral
          Isochronous Broadcaster
          Synchronized Receiver
          Periodic Advertising ADI support
          Connection Subrating
          Unknown features (0x0000010000000000)
zephyr.exe[327132]: < HCI Command: LE Set Host Feature (0x08|0x0074) plen 2                                          #15 1.017623
        Bit Number: 32
          Connected Isochronous Stream (Host Support)
        Bit Value: 1
> HCI Event: Command Complete (0x0e) plen 4                                                                          #16 1.017964
      LE Set Host Feature (0x08|0x0074) ncmd 1
        Status: Success (0x00)
zephyr.exe[327132]: < HCI Command: LE Read Buffer v2 (0x08|0x0060) plen 0                                            #17 1.037671
> HCI Event: Command Complete (0x0e) plen 10                                                                         #18 1.038249
      LE Read Buffer v2 (0x08|0x0060) ncmd 1
        Status: Success (0x00)
        ACL MTU: 27
        ACL max packet: 3
        ISO MTU: 318
        ISO max packet: 3
zephyr.exe[327132]: < HCI Command: LE Read Maximum Advertising Data Length (0x08|0x003a) plen 0                      #19 1.057696
> HCI Event: Command Complete (0x0e) plen 6                                                                          #20 1.058192
      LE Read Maximum Advertising Data Length (0x08|0x003a) ncmd 1
        Status: Success (0x00)
        Max length: 1650
zephyr.exe[327132]: < HCI Command: LE Read Supported States (0x08|0x001c) plen 0                                     #21 1.077667
> HCI Event: Command Complete (0x0e) plen 12                                                                         #22 1.078140
      LE Read Supported States (0x08|0x001c) ncmd 1
        Status: Success (0x00)
        States: 0x000003ff3e0306ff
          Non-connectable Advertising State
          Scannable Advertising State
          Connectable Advertising State
          High Duty Cycle Directed Advertising State
          Passive Scanning State
          Active Scanning State
          Initiating State
            and Connection State (Central Role)
          Connection State (Peripheral Role)
          Scannable Advertising State
            and Passive Scanning State
          Connectable Advertising State
            and Passive Scanning State
          Non-connectable Advertising State
            and Initiating State
          Scannable Advertising State
            and Initiating State
          Active Scanning State
            and Connection State (Central Role)
          Passive Scanning State
            and Connection State (Peripheral Role)
          Active Scanning State
            and Connection State (Peripheral Role)
          Initiating State
            and Connection State (Central Role)
            and Central Role & Central Role
          Low Duty Cycle Directed Advertising State
          Connectable Advertising State
            and Initiating State
            and Central Role & Peripheral Role
          High Duty Cycle Directed Advertising State
            and Initiating State
            and Central Role & Peripheral Role
          Low Duty Cycle Directed Advertising State
            and Initiating State
            and Central Role & Peripheral Role
          Connectable Advertising State
            and Connection State (Central Role)
            and Central Role & Peripheral Role
          High Duty Cycle Directed Advertising State
            and Connection State (Central Role)
            and Central Role & Peripheral Role
          Low Duty Cycle Directed Advertising State
            and Connection State (Central Role)
            and Central Role & Peripheral Role
          Connectable Advertising State
            and Connection State (Peripheral Role)
            and Central Role & Peripheral Role
          High Duty Cycle Directed Advertising State
            and Connection State (Peripheral Role)
            and Peripheral Role & Peripheral Role
          Low Duty Cycle Directed Advertising State
            and Connection State (Peripheral Role)
            and Peripheral Role & Peripheral Role
          Initiating State
            and Connection State (Peripheral Role)
            and Central Role & Peripheral Role
zephyr.exe[327132]: < HCI Command: LE Read Maximum Data Length (0x08|0x002f) plen 0                                  #23 1.097664
> HCI Event: Command Complete (0x0e) plen 12                                                                         #24 1.098112
      LE Read Maximum Data Length (0x08|0x002f) ncmd 1
        Status: Success (0x00)
        Max TX octets: 251
        Max TX time: 2704
        Max RX octets: 251
        Max RX time: 2704
zephyr.exe[327132]: < HCI Command: LE Write Suggested Default Data Length (0x08|0x0024) plen 4                       #25 1.117669
        TX octets: 251
        TX time: 2704
> HCI Event: Command Complete (0x0e) plen 4                                                                          #26 1.118089
      LE Write Suggested Default Data Length (0x08|0x0024) ncmd 1
        Status: Success (0x00)
zephyr.exe[327132]: < HCI Command: LE Read Resolving List Size (0x08|0x002a) plen 0                                  #27 1.137682
> HCI Event: Command Complete (0x0e) plen 5                                                                          #28 1.138061
      LE Read Resolving List Size (0x08|0x002a) ncmd 1
        Status: Success (0x00)
        Size: 8
zephyr.exe[327132]: < HCI Command: LE Set Event Mask (0x08|0x0001) plen 8                                            #29 1.157665
        Mask: 0x000002023f87fa5e
          LE Advertising Report
          LE Connection Update Complete
          LE Read Remote Used Features Complete
          LE Long Term Key Request
          LE Data Length Change
          LE Enhanced Connection Complete
          LE PHY Update Complete
          LE Extended Advertising Report
          LE Periodic Advertising Sync Established
          LE Periodic Advertising Report
          LE Periodic Advertising Sync Lost
          LE Extended Scan Timeout
          LE Extended Advertising Set Terminated
          LE Scan Request Received
          LE Periodic Advertising Sync Transfer Rvc
          LE CIS Established
          LE CIS Request
          LE Create BIG Complete
          LE Terminate BIG Complete
          LE BIG Sync Estabilished Complete
          LE BIG Sync Lost
          LE BIG Info Advertising Report
          Unknown mask (0x0000020000000000)
> HCI Event: Command Complete (0x0e) plen 4                                                                          #30 1.158148
      LE Set Event Mask (0x08|0x0001) ncmd 1
        Status: Success (0x00)
zephyr.exe[327132]: < HCI Command: Set Event Mask (0x03|0x0001) plen 8                                               #31 1.177651
        Mask: 0x2000800002008890
          Disconnection Complete
          Encryption Change
          Read Remote Version Information Complete
          Hardware Error
          Data Buffer Overflow
          Encryption Key Refresh Complete
          LE Meta
> HCI Event: Command Complete (0x0e) plen 4                                                                          #32 1.178277
      Set Event Mask (0x03|0x0001) ncmd 1
        Status: Success (0x00)
zephyr.exe[327132]: < HCI Command: Read BD ADDR (0x04|0x0009) plen 0                                                 #33 1.197690
> HCI Event: Command Complete (0x0e) plen 10                                                                         #34 1.198147
      Read BD ADDR (0x04|0x0009) ncmd 1
        Status: Success (0x00)
        Address: 00:00:00:00:00:00 (OUI 00-00-00)
zephyr.exe[327132]: < HCI Command: LE Set Random Address (0x08|0x0005) plen 6                                        #35 1.217687
        Address: D5:B6:CC:31:DB:3B (Static)
> HCI Event: Command Complete (0x0e) plen 4                                                                          #36 1.218164
      LE Set Random Address (0x08|0x0005) ncmd 1
        Status: Success (0x00)
zephyr.exe[327132]: < HCI Command: LE Set Extended Advertising Parameters (0x08|0x0036) plen 25                      #37 6.497772
        Handle: 0x00
        Properties: 0x0013
          Connectable
          Scannable
          Use legacy advertising PDUs: ADV_IND
        Min advertising interval: 100.000 msec (0x00a0)
        Max advertising interval: 150.000 msec (0x00f0)
        Channel map: 37, 38, 39 (0x07)
        Own address type: Random (0x01)
        Peer address type: Public (0x00)
        Peer address: 00:00:00:00:00:00 (OUI 00-00-00)
        Filter policy: Allow Scan Request from Any, Allow Connect Request from Any (0x00)
        TX power: Host has no preference (0x7f)
        Primary PHY: LE 1M (0x01)
        Secondary max skip: 0x00
        Secondary PHY: LE 1M (0x01)
        SID: 0x00
        Scan request notifications: Disabled (0x00)
> HCI Event: Command Complete (0x0e) plen 5                                                                          #38 6.498582
      LE Set Extended Advertising Parameters (0x08|0x0036) ncmd 1
        Status: Success (0x00)
        TX power (selected): 0 dbm (0x00)
zephyr.exe[327132]: < HCI Command: LE Set Advertising Set Random Address (0x08|0x0035) plen 7                        #39 6.517718
        Advertising handle: 0x00
        Advertising random address: D5:B6:CC:31:DB:3B (Static)
> HCI Event: Command Complete (0x0e) plen 4                                                                          #40 6.518259
      LE Set Advertising Set Random Address (0x08|0x0035) ncmd 1
        Status: Success (0x00)
zephyr.exe[327132]: < HCI Command: LE Set Extended Advertising Data (0x08|0x0037) plen 22                            #41 6.537743
        Handle: 0x00
        Operation: Complete extended advertising data (0x03)
        Fragment preference: Minimize fragmentation (0x01)
        Data length: 0x12
        Flags: 0x06
          LE General Discoverable Mode
          BR/EDR Not Supported
        Name (complete): Tester_F6B11A
> HCI Event: Command Complete (0x0e) plen 4                                                                          #42 6.538441
      LE Set Extended Advertising Data (0x08|0x0037) ncmd 1
        Status: Success (0x00)
zephyr.exe[327132]: < HCI Command: LE Set Extended Scan Response Data (0x08|0x0038) plen 4                           #43 6.557794
        Handle: 0x00
        Operation: Complete scan response data (0x03)
        Fragment preference: Minimize fragmentation (0x01)
        Data length: 0x00
> HCI Event: Command Complete (0x0e) plen 4                                                                          #44 6.558275
      LE Set Extended Scan Response Data (0x08|0x0038) ncmd 1
        Status: Success (0x00)
zephyr.exe[327132]: < HCI Command: LE Set Extended Advertising Enable (0x08|0x0039) plen 6                           #45 6.577744
        Extended advertising: Enabled (0x01)
        Number of sets: 1 (0x01)
        Entry 0
          Handle: 0x00
          Duration: 0 ms (0x00)
          Max ext adv events: 0
> HCI Event: Command Complete (0x0e) plen 4                                                                          #46 6.578303
      LE Set Extended Advertising Enable (0x08|0x0039) ncmd 1
        Status: Success (0x00)
> HCI Event: LE Meta Event (0x3e) plen 31                                                                            #47 6.903951
      LE Enhanced Connection Complete (0x0a)
        Status: Success (0x00)
        Handle: 507
        Role: Peripheral (0x01)
        Peer address type: Public (0x00)
        Peer address: DF:A9:FF:F6:B1:1A (OUI DF-A9-FF)
        Local resolvable private address: 00:00:00:00:00:00 (Non-Resolvable)
        Peer resolvable private address: 00:00:00:00:00:00 (Non-Resolvable)
        Connection interval: 87.50 msec (0x0046)
        Connection latency: 0 (0x0000)
        Supervision timeout: 20000 msec (0x07d0)
        Central clock accuracy: 0x01
> HCI Event: LE Meta Event (0x3e) plen 6                                                                             #48 6.904076
      LE Advertising Set Terminated (0x12)
        Status: Success (0x00)
        Handle: 0
        Connection handle: 507
        Number of completed extended advertising events: 0
zephyr.exe[327132]: < HCI Command: LE Read Remote Used Features (0x08|0x0016) plen 2                                 #49 6.918084
        Handle: 507 Address: DF:A9:FF:F6:B1:1A (OUI DF-A9-FF)
> HCI Event: Command Status (0x0f) plen 4                                                                            #50 6.918637
      LE Read Remote Used Features (0x08|0x0016) ncmd 1
        Status: Success (0x00)
> HCI Event: LE Meta Event (0x3e) plen 12                                                                            #51 7.167925
      LE Read Remote Used Features (0x04)
        Status: Success (0x00)
        Handle: 507 Address: DF:A9:FF:F6:B1:1A (OUI DF-A9-FF)
        Features: 0x2d 0x49 0x00 0xf7 0x67 0xd8 0x00 0x00
          LE Encryption
          Extended Reject Indication
          Peripheral-initiated Features Exchange
          LE Data Packet Length Extension
          LE 2M PHY
          LE Coded PHY
          Channel Selection Algorithm #2
          Periodic Advertising Sync Transfer - Sender
          Periodic Advertising Sync Transfer - Recipient
          Sleep Clock Accuracy Updates
          Connected Isochronous Stream - Central
          Connected Isochronous Stream - Peripheral
          Isochronous Broadcaster
          Synchronized Receiver
          Connected Isochronous Stream (Host Support)
          LE Power Control Request
          LE Power Control Request
          Connection Subrating
          Connection Subrating (Host Support)
          Unknown features (0x0000d80000000000)
> ACL Data RX: Handle 507 flags 0x02 dlen 11                                                                         #52 7.605087
      SMP: Pairing Request (0x01) len 6
        IO capability: KeyboardDisplay (0x04)
        OOB data: Authentication data from remote device present (0x01)
        Authentication requirement: No bonding, MITM, SC, No Keypresses (0x0c)
        Max encryption key size: 16
        Initiator key distribution: <none> (0x00)
        Responder key distribution: <none> (0x00)
zephyr.exe[327132]: < HCI Command: Host Number of Completed Packets (0x03|0x0035) plen 5                             #53 7.617766
        Num handles: 1
        Handle: 507 Address: DF:A9:FF:F6:B1:1A (OUI DF-A9-FF)
        Count: 1
zephyr.exe[327132]: < ACL Data TX: Handle 507 flags 0x00 dlen 11                                                     #54 7.617854
      SMP: Pairing Response (0x02) len 6
        IO capability: DisplayOnly (0x00)
        OOB data: Authentication data not present (0x00)
        Authentication requirement: Bonding, No MITM, SC, No Keypresses (0x09)
        Max encryption key size: 16
        Initiator key distribution: <none> (0x00)
        Responder key distribution: <none> (0x00)
> HCI Event: Number of Completed Packets (0x13) plen 5                                                               #55 7.780163
        Num handles: 1
        Handle: 507 Address: DF:A9:FF:F6:B1:1A (OUI DF-A9-FF)
        Count: 1
        #54: len 11 (0 Kb/s)
        Latency: 162 msec (162-162 msec ~162 msec)
> ACL Data RX: Handle 507 flags 0x02 dlen 27                                                                         #56 7.780489
> ACL Data RX: Handle 507 flags 0x01 dlen 27                                                                         #57 7.780999
> ACL Data RX: Handle 507 flags 0x01 dlen 15                                                                         #58 7.781545
      SMP: Pairing Public Key (0x0c) len 64
        X: 7c7b07bb3b60c60d7435402b93b6bf1526488b259dc18e446540089b4dd9b1a5
        Y: a8cb1ca42cf03934f78df91f0a395d4b3d6c7bfba0e22bb4498177c6687ef5c8
zephyr.exe[327132]: < HCI Command: Host Number of Completed Packets (0x03|0x0035) plen 5                             #59 7.798580
        Num handles: 1
        Handle: 507 Address: DF:A9:FF:F6:B1:1A (OUI DF-A9-FF)
        Count: 1
zephyr.exe[327132]: < HCI Command: Host Number of Completed Packets (0x03|0x0035) plen 5                             #60 7.798771
        Num handles: 1
        Handle: 507 Address: DF:A9:FF:F6:B1:1A (OUI DF-A9-FF)
        Count: 1
zephyr.exe[327132]: < HCI Command: Host Number of Completed Packets (0x03|0x0035) plen 5                             #61 7.798964
        Num handles: 1
        Handle: 507 Address: DF:A9:FF:F6:B1:1A (OUI DF-A9-FF)
        Count: 1
zephyr.exe[327132]: < ACL Data TX: Handle 507 flags 0x00 dlen 27                                                     #62 7.799125
zephyr.exe[327132]: < ACL Data TX: Handle 507 flags 0x01 dlen 27                                                     #63 7.799169
zephyr.exe[327132]: < ACL Data TX: Handle 507 flags 0x01 dlen 15                                                     #64 7.799202
      SMP: Pairing Public Key (0x0c) len 64
        X: 98308440221e2d910f0e54b71e7ec652857aa9b5a0dc65028824cc19db1226e9
        Y: 67a4816bcb62efb21701e31fdb27561a6217575fb007a8bbdabe7e28b6f68482
> HCI Event: Number of Completed Packets (0x13) plen 5                                                               #65 7.868199
        Num handles: 1
        Handle: 507 Address: DF:A9:FF:F6:B1:1A (OUI DF-A9-FF)
        Count: 1
        #62: len 27 (3 Kb/s)
        Latency: 69 msec (69-162 msec ~115 msec)
> HCI Event: Number of Completed Packets (0x13) plen 5                                                               #66 7.868664
        Num handles: 1
        Handle: 507 Address: DF:A9:FF:F6:B1:1A (OUI DF-A9-FF)
        Count: 1
        #63: len 27 (3 Kb/s)
        Latency: 69 msec (69-162 msec ~92 msec)
> HCI Event: Number of Completed Packets (0x13) plen 5                                                               #67 7.955033
        Num handles: 1
        Handle: 507 Address: DF:A9:FF:F6:B1:1A (OUI DF-A9-FF)
        Count: 1
        #64: len 15 (0 Kb/s)
        Latency: 155 msec (69-162 msec ~124 msec)
> ACL Data RX: Handle 507 flags 0x02 dlen 21                                                                         #68 7.955430
      SMP: Pairing Random (0x04) len 16
        Random value: 13e7117576101db75f8393a9e10aea20
zephyr.exe[327132]: < HCI Command: Host Number of Completed Packets (0x03|0x0035) plen 5                             #69 7.959525
        Num handles: 1
        Handle: 507 Address: DF:A9:FF:F6:B1:1A (OUI DF-A9-FF)
        Count: 1
zephyr.exe[327132]: < ACL Data TX: Handle 507 flags 0x00 dlen 21                                                     #70 7.959537
      SMP: Pairing Random (0x04) len 16
        Random value: 5da095555cc64d02679f89a05211af56
> HCI Event: Number of Completed Packets (0x13) plen 5                                                               #71 8.130055
        Num handles: 1
        Handle: 507 Address: DF:A9:FF:F6:B1:1A (OUI DF-A9-FF)
        Count: 1
        #70: len 21 (0 Kb/s)
        Latency: 170 msec (69-170 msec ~147 msec)
> ACL Data RX: Handle 507 flags 0x02 dlen 21                                                                         #72 8.130437
      SMP: Pairing DHKey Check (0x0d) len 16
        E: fe99d57ed68b61d94dc74d382dc4efd8
zephyr.exe[327132]: < HCI Command: Host Number of Completed Packets (0x03|0x0035) plen 5                             #73 8.138079
        Num handles: 1
        Handle: 507 Address: DF:A9:FF:F6:B1:1A (OUI DF-A9-FF)
        Count: 1
zephyr.exe[327132]: < ACL Data TX: Handle 507 flags 0x00 dlen 21                                                     #74 8.138112
      SMP: Pairing DHKey Check (0x0d) len 16
        E: b7354d4415f0ad458719df71ece45d33
> HCI Event: Number of Completed Packets (0x13) plen 5                                                               #75 8.304841
        Num handles: 1
        Handle: 507 Address: DF:A9:FF:F6:B1:1A (OUI DF-A9-FF)
        Count: 1
        #74: len 21 (1 Kb/s)
        Latency: 166 msec (69-170 msec ~157 msec)
> HCI Event: LE Meta Event (0x3e) plen 13                                                                            #76 8.393115
      LE Long Term Key Request (0x05)
        Handle: 507 Address: DF:A9:FF:F6:B1:1A (OUI DF-A9-FF)
        Random number: 0x0000000000000000
        Encrypted diversifier: 0x0000
zephyr.exe[327132]: < HCI Command: LE Long Term Key Request Reply (0x08|0x001a) plen 18                              #77 8.397889
        Handle: 507 Address: DF:A9:FF:F6:B1:1A (OUI DF-A9-FF)
        Long term key: 5665b443e1da9333d08d635515892184
> HCI Event: Command Complete (0x0e) plen 6                                                                          #78 8.398565
      LE Long Term Key Request Reply (0x08|0x001a) ncmd 1
        Status: Success (0x00)
        Handle: 507 Address: DF:A9:FF:F6:B1:1A (OUI DF-A9-FF)
> HCI Event: Encryption Change (0x08) plen 4                                                                         #79 8.830206
        Status: Success (0x00)
        Handle: 507 Address: DF:A9:FF:F6:B1:1A (OUI DF-A9-FF)
        Encryption: Enabled with AES-CCM (0x01)
zephyr.exe[327132]: < ACL Data TX: Handle 507 flags 0x00 dlen 16                                                    #80 11.928053
      LE L2CAP: Connection Parameter Update Request (0x12) ident 1 len 8
        Min interval: 24
        Max interval: 40
        Peripheral latency: 0
        Timeout multiplier: 42
> HCI Event: Number of Completed Packets (0x13) plen 5                                                              #81 11.980285
        Num handles: 1
        Handle: 507 Address: DF:A9:FF:F6:B1:1A (OUI DF-A9-FF)
        Count: 1
        #80: len 16 (2 Kb/s)
        Latency: 52 msec (52-170 msec ~104 msec)
> HCI Event: Disconnect Complete (0x05) plen 4                                                                      #82 11.980387
        Status: Success (0x00)
        Handle: 507 Address: DF:A9:FF:F6:B1:1A (OUI DF-A9-FF)
        Reason: Remote User Terminated Connection (0x13)
zephyr.exe[327132]: < HCI Command: LE Set Extended Advertising Parameters (0x08|0x0036) plen 25                     #83 14.697868
        Handle: 0x00
        Properties: 0x0013
          Connectable
          Scannable
          Use legacy advertising PDUs: ADV_IND
        Min advertising interval: 100.000 msec (0x00a0)
        Max advertising interval: 150.000 msec (0x00f0)
        Channel map: 37, 38, 39 (0x07)
        Own address type: Random (0x01)
        Peer address type: Public (0x00)
        Peer address: 00:00:00:00:00:00 (OUI 00-00-00)
        Filter policy: Allow Scan Request from Any, Allow Connect Request from Any (0x00)
        TX power: Host has no preference (0x7f)
        Primary PHY: LE 1M (0x01)
        Secondary max skip: 0x00
        Secondary PHY: LE 1M (0x01)
        SID: 0x00
        Scan request notifications: Disabled (0x00)
> HCI Event: Command Complete (0x0e) plen 5                                                                         #84 14.698615
      LE Set Extended Advertising Parameters (0x08|0x0036) ncmd 1
        Status: Success (0x00)
        TX power (selected): 0 dbm (0x00)
zephyr.exe[327132]: < HCI Command: LE Set Advertising Set Random Address (0x08|0x0035) plen 7                       #85 14.717762
        Advertising handle: 0x00
        Advertising random address: D5:B6:CC:31:DB:3B (Static)
> HCI Event: Command Complete (0x0e) plen 4                                                                         #86 14.718348
      LE Set Advertising Set Random Address (0x08|0x0035) ncmd 1
        Status: Success (0x00)
zephyr.exe[327132]: < HCI Command: LE Set Extended Advertising Data (0x08|0x0037) plen 22                           #87 14.737823
        Handle: 0x00
        Operation: Complete extended advertising data (0x03)
        Fragment preference: Minimize fragmentation (0x01)
        Data length: 0x12
        Flags: 0x06
          LE General Discoverable Mode
          BR/EDR Not Supported
        Name (complete): Tester_F6B11A
> HCI Event: Command Complete (0x0e) plen 4                                                                         #88 14.738542
      LE Set Extended Advertising Data (0x08|0x0037) ncmd 1
        Status: Success (0x00)
zephyr.exe[327132]: < HCI Command: LE Set Extended Scan Response Data (0x08|0x0038) plen 4                          #89 14.757760
        Handle: 0x00
        Operation: Complete scan response data (0x03)
        Fragment preference: Minimize fragmentation (0x01)
        Data length: 0x00
> HCI Event: Command Complete (0x0e) plen 4                                                                         #90 14.758258
      LE Set Extended Scan Response Data (0x08|0x0038) ncmd 1
        Status: Success (0x00)
zephyr.exe[327132]: < HCI Command: LE Set Extended Advertising Enable (0x08|0x0039) plen 6                          #91 14.777821
        Extended advertising: Enabled (0x01)
        Number of sets: 1 (0x01)
        Entry 0
          Handle: 0x00
          Duration: 0 ms (0x00)
          Max ext adv events: 0
> HCI Event: Command Complete (0x0e) plen 4                                                                         #92 14.778372
      LE Set Extended Advertising Enable (0x08|0x0039) ncmd 1
        Status: Success (0x00)
> HCI Event: LE Meta Event (0x3e) plen 31                                                                           #93 15.314157
      LE Enhanced Connection Complete (0x0a)
        Status: Success (0x00)
        Handle: 525
        Role: Peripheral (0x01)
        Peer address type: Public (0x00)
        Peer address: DF:A9:FF:F6:B1:1A (OUI DF-A9-FF)
        Local resolvable private address: 00:00:00:00:00:00 (Non-Resolvable)
        Peer resolvable private address: 00:00:00:00:00:00 (Non-Resolvable)
        Connection interval: 87.50 msec (0x0046)
        Connection latency: 0 (0x0000)
        Supervision timeout: 20000 msec (0x07d0)
        Central clock accuracy: 0x01
> HCI Event: LE Meta Event (0x3e) plen 6                                                                            #94 15.314201
      LE Advertising Set Terminated (0x12)
        Status: Success (0x00)
        Handle: 0
        Connection handle: 525
        Number of completed extended advertising events: 0
zephyr.exe[327132]: < HCI Command: LE Read Remote Used Features (0x08|0x0016) plen 2                                #95 15.318846
        Handle: 525 Address: DF:A9:FF:F6:B1:1A (OUI DF-A9-FF)
> HCI Event: Command Status (0x0f) plen 4                                                                           #96 15.319463
      LE Read Remote Used Features (0x08|0x0016) ncmd 1
        Status: Success (0x00)
> HCI Event: LE Meta Event (0x3e) plen 12                                                                           #97 15.578020
      LE Read Remote Used Features (0x04)
        Status: Success (0x00)
        Handle: 525 Address: DF:A9:FF:F6:B1:1A (OUI DF-A9-FF)
        Features: 0x2d 0x49 0x00 0xf7 0x67 0xd8 0x00 0x00
          LE Encryption
          Extended Reject Indication
          Peripheral-initiated Features Exchange
          LE Data Packet Length Extension
          LE 2M PHY
          LE Coded PHY
          Channel Selection Algorithm #2
          Periodic Advertising Sync Transfer - Sender
          Periodic Advertising Sync Transfer - Recipient
          Sleep Clock Accuracy Updates
          Connected Isochronous Stream - Central
          Connected Isochronous Stream - Peripheral
          Isochronous Broadcaster
          Synchronized Receiver
          Connected Isochronous Stream (Host Support)
          LE Power Control Request
          LE Power Control Request
          Connection Subrating
          Connection Subrating (Host Support)
          Unknown features (0x0000d80000000000)
> ACL Data RX: Handle 525 flags 0x02 dlen 11                                                                        #98 16.015436
      SMP: Pairing Request (0x01) len 6
        IO capability: KeyboardDisplay (0x04)
        OOB data: Authentication data not present (0x00)
        Authentication requirement: No bonding, MITM, SC, No Keypresses (0x0c)
        Max encryption key size: 16
        Initiator key distribution: <none> (0x00)
        Responder key distribution: <none> (0x00)
zephyr.exe[327132]: < HCI Command: Host Number of Completed Packets (0x03|0x0035) plen 5                            #99 16.018179
        Num handles: 1
        Handle: 525 Address: DF:A9:FF:F6:B1:1A (OUI DF-A9-FF)
        Count: 1
zephyr.exe[327132]: < ACL Data TX: Handle 525 flags 0x00 dlen 11                                                   #100 16.018373
      SMP: Pairing Response (0x02) len 6
        IO capability: DisplayOnly (0x00)
        OOB data: Authentication data from remote device present (0x01)
        Authentication requirement: Bonding, No MITM, SC, No Keypresses (0x09)
        Max encryption key size: 16
        Initiator key distribution: <none> (0x00)
        Responder key distribution: <none> (0x00)
> HCI Event: Number of Completed Packets (0x13) plen 5                                                             #101 16.190292
        Num handles: 1
        Handle: 525 Address: DF:A9:FF:F6:B1:1A (OUI DF-A9-FF)
        Count: 1
        #100: len 11 (0 Kb/s)
        Latency: 171 msec (171-171 msec ~171 msec)
> ACL Data RX: Handle 525 flags 0x02 dlen 27                                                                       #102 16.190755
> ACL Data RX: Handle 525 flags 0x01 dlen 27                                                                       #103 16.191231
> ACL Data RX: Handle 525 flags 0x01 dlen 15                                                                       #104 16.191564
      SMP: Pairing Public Key (0x0c) len 64
        X: 25a2c13205b2fea27f41a561cb9c9585cd7aa4c1752a63874ea2c38081a3be87
        Y: 6fdf6163c6db05acea34c02beca00b8425b4d20bf10cc2893d41496188d91d01
zephyr.exe[327132]: < HCI Command: Host Number of Completed Packets (0x03|0x0035) plen 5                           #105 16.198548
        Num handles: 1
        Handle: 525 Address: DF:A9:FF:F6:B1:1A (OUI DF-A9-FF)
        Count: 1
zephyr.exe[327132]: < HCI Command: Host Number of Completed Packets (0x03|0x0035) plen 5                           #106 16.198694
        Num handles: 1
        Handle: 525 Address: DF:A9:FF:F6:B1:1A (OUI DF-A9-FF)
        Count: 1
zephyr.exe[327132]: < HCI Command: Host Number of Completed Packets (0x03|0x0035) plen 5                           #107 16.198795
        Num handles: 1
        Handle: 525 Address: DF:A9:FF:F6:B1:1A (OUI DF-A9-FF)
        Count: 1
zephyr.exe[327132]: < ACL Data TX: Handle 525 flags 0x00 dlen 27                                                   #108 16.198918
zephyr.exe[327132]: < ACL Data TX: Handle 525 flags 0x01 dlen 27                                                   #109 16.199013
zephyr.exe[327132]: < ACL Data TX: Handle 525 flags 0x01 dlen 15                                                   #110 16.199029
      SMP: Pairing Public Key (0x0c) len 64
        X: 98308440221e2d910f0e54b71e7ec652857aa9b5a0dc65028824cc19db1226e9
        Y: 67a4816bcb62efb21701e31fdb27561a6217575fb007a8bbdabe7e28b6f68482
> HCI Event: Number of Completed Packets (0x13) plen 5                                                             #111 16.278320
        Num handles: 1
        Handle: 525 Address: DF:A9:FF:F6:B1:1A (OUI DF-A9-FF)
        Count: 1
        #108: len 27 (2 Kb/s)
        Latency: 79 msec (79-171 msec ~125 msec)
> HCI Event: Number of Completed Packets (0x13) plen 5                                                             #112 16.278965
        Num handles: 1
        Handle: 525 Address: DF:A9:FF:F6:B1:1A (OUI DF-A9-FF)
        Count: 1
        #109: len 27 (2 Kb/s)
        Latency: 79 msec (79-171 msec ~102 msec)
> HCI Event: Number of Completed Packets (0x13) plen 5                                                             #113 16.365297
        Num handles: 1
        Handle: 525 Address: DF:A9:FF:F6:B1:1A (OUI DF-A9-FF)
        Count: 1
        #110: len 15 (0 Kb/s)
        Latency: 166 msec (79-171 msec ~134 msec)
> ACL Data RX: Handle 525 flags 0x02 dlen 21                                                                       #114 16.365759
      SMP: Pairing Random (0x04) len 16
        Random value: 7cb3a1939201807dba1b0edcd62fa1e2
zephyr.exe[327132]: < HCI Command: Host Number of Completed Packets (0x03|0x0035) plen 5                           #115 16.378796
        Num handles: 1
        Handle: 525 Address: DF:A9:FF:F6:B1:1A (OUI DF-A9-FF)
        Count: 1
zephyr.exe[327132]: < ACL Data TX: Handle 525 flags 0x00 dlen 21                                                   #116 16.378927
      SMP: Pairing Random (0x04) len 16
        Random value: a2acf8fd71a45c4a1bcadd27bd58e945
> HCI Event: Number of Completed Packets (0x13) plen 5                                                             #117 16.540325
        Num handles: 1
        Handle: 525 Address: DF:A9:FF:F6:B1:1A (OUI DF-A9-FF)
        Count: 1
        #116: len 21 (1 Kb/s)
        Latency: 161 msec (79-171 msec ~147 msec)
> ACL Data RX: Handle 525 flags 0x02 dlen 21                                                                       #118 16.540681
      SMP: Pairing DHKey Check (0x0d) len 16
        E: 962a920e33e1e662563b54ed66834a53
zephyr.exe[327132]: < HCI Command: Host Number of Completed Packets (0x03|0x0035) plen 5                           #119 16.558909
        Num handles: 1
        Handle: 525 Address: DF:A9:FF:F6:B1:1A (OUI DF-A9-FF)
        Count: 1
zephyr.exe[327132]: < ACL Data TX: Handle 525 flags 0x00 dlen 21                                                   #120 16.559081
      SMP: Pairing DHKey Check (0x0d) len 16
        E: f3c5889f7db74cd47fa077a5fb5c1414
> HCI Event: Number of Completed Packets (0x13) plen 5                                                             #121 16.715058
        Num handles: 1
        Handle: 525 Address: DF:A9:FF:F6:B1:1A (OUI DF-A9-FF)
        Count: 1
        #120: len 21 (1 Kb/s)
        Latency: 155 msec (79-171 msec ~151 msec)
> HCI Event: LE Meta Event (0x3e) plen 13                                                                          #122 16.803215
      LE Long Term Key Request (0x05)
        Handle: 525 Address: DF:A9:FF:F6:B1:1A (OUI DF-A9-FF)
        Random number: 0x0000000000000000
        Encrypted diversifier: 0x0000
zephyr.exe[327132]: < HCI Command: LE Long Term Key Request Reply (0x08|0x001a) plen 18                            #123 16.818202
        Handle: 525 Address: DF:A9:FF:F6:B1:1A (OUI DF-A9-FF)
        Long term key: 298731c6800f0e5937c82dd2f14ba349
> HCI Event: Command Complete (0x0e) plen 6                                                                        #124 16.818908
      LE Long Term Key Request Reply (0x08|0x001a) ncmd 1
        Status: Success (0x00)
        Handle: 525 Address: DF:A9:FF:F6:B1:1A (OUI DF-A9-FF)
> HCI Event: Encryption Change (0x08) plen 4                                                                       #125 17.240384
        Status: Success (0x00)
        Handle: 525 Address: DF:A9:FF:F6:B1:1A (OUI DF-A9-FF)
        Encryption: Enabled with AES-CCM (0x01)
zephyr.exe[327132]: < ACL Data TX: Handle 525 flags 0x00 dlen 16                                                   #126 20.327907
      LE L2CAP: Connection Parameter Update Request (0x12) ident 2 len 8
        Min interval: 24
        Max interval: 40
        Peripheral latency: 0
        Timeout multiplier: 42
> HCI Event: Number of Completed Packets (0x13) plen 5                                                             #127 20.390423
        Num handles: 1
        Handle: 525 Address: DF:A9:FF:F6:B1:1A (OUI DF-A9-FF)
        Count: 1
        #126: len 16 (2 Kb/s)
        Latency: 62 msec (62-171 msec ~107 msec)
> HCI Event: Disconnect Complete (0x05) plen 4                                                                     #128 20.390486
        Status: Success (0x00)
        Handle: 525 Address: DF:A9:FF:F6:B1:1A (OUI DF-A9-FF)
        Reason: Remote User Terminated Connection (0x13)
zephyr.exe[327132]: < HCI Command: LE Set Extended Advertising Parameters (0x08|0x0036) plen 25                    #129 25.007909
        Handle: 0x00
        Properties: 0x0013
          Connectable
          Scannable
          Use legacy advertising PDUs: ADV_IND
        Min advertising interval: 100.000 msec (0x00a0)
        Max advertising interval: 150.000 msec (0x00f0)
        Channel map: 37, 38, 39 (0x07)
        Own address type: Random (0x01)
        Peer address type: Public (0x00)
        Peer address: 00:00:00:00:00:00 (OUI 00-00-00)
        Filter policy: Allow Scan Request from Any, Allow Connect Request from Any (0x00)
        TX power: Host has no preference (0x7f)
        Primary PHY: LE 1M (0x01)
        Secondary max skip: 0x00
        Secondary PHY: LE 1M (0x01)
        SID: 0x00
        Scan request notifications: Disabled (0x00)
> HCI Event: Command Complete (0x0e) plen 5                                                                        #130 25.008941
      LE Set Extended Advertising Parameters (0x08|0x0036) ncmd 1
        Status: Success (0x00)
        TX power (selected): 0 dbm (0x00)
zephyr.exe[327132]: < HCI Command: LE Set Advertising Set Random Address (0x08|0x0035) plen 7                      #131 25.017917
        Advertising handle: 0x00
        Advertising random address: D5:B6:CC:31:DB:3B (Static)
> HCI Event: Command Complete (0x0e) plen 4                                                                        #132 25.018468
      LE Set Advertising Set Random Address (0x08|0x0035) ncmd 1
        Status: Success (0x00)
zephyr.exe[327132]: < HCI Command: LE Set Extended Advertising Data (0x08|0x0037) plen 22                          #133 25.037911
        Handle: 0x00
        Operation: Complete extended advertising data (0x03)
        Fragment preference: Minimize fragmentation (0x01)
        Data length: 0x12
        Flags: 0x06
          LE General Discoverable Mode
          BR/EDR Not Supported
        Name (complete): Tester_F6B11A
> HCI Event: Command Complete (0x0e) plen 4                                                                        #134 25.038691
      LE Set Extended Advertising Data (0x08|0x0037) ncmd 1
        Status: Success (0x00)
zephyr.exe[327132]: < HCI Command: LE Set Extended Scan Response Data (0x08|0x0038) plen 4                         #135 25.057894
        Handle: 0x00
        Operation: Complete scan response data (0x03)
        Fragment preference: Minimize fragmentation (0x01)
        Data length: 0x00
> HCI Event: Command Complete (0x0e) plen 4                                                                        #136 25.058322
      LE Set Extended Scan Response Data (0x08|0x0038) ncmd 1
        Status: Success (0x00)
zephyr.exe[327132]: < HCI Command: LE Set Extended Advertising Enable (0x08|0x0039) plen 6                         #137 25.077891
        Extended advertising: Enabled (0x01)
        Number of sets: 1 (0x01)
        Entry 0
          Handle: 0x00
          Duration: 0 ms (0x00)
          Max ext adv events: 0
> HCI Event: Command Complete (0x0e) plen 4                                                                        #138 25.078529
      LE Set Extended Advertising Enable (0x08|0x0039) ncmd 1
        Status: Success (0x00)
> HCI Event: LE Meta Event (0x3e) plen 31                                                                          #139 25.193010
      LE Enhanced Connection Complete (0x0a)
        Status: Success (0x00)
        Handle: 543
        Role: Peripheral (0x01)
        Peer address type: Public (0x00)
        Peer address: DF:A9:FF:F6:B1:1A (OUI DF-A9-FF)
        Local resolvable private address: 00:00:00:00:00:00 (Non-Resolvable)
        Peer resolvable private address: 00:00:00:00:00:00 (Non-Resolvable)
        Connection interval: 87.50 msec (0x0046)
        Connection latency: 0 (0x0000)
        Supervision timeout: 20000 msec (0x07d0)
        Central clock accuracy: 0x01
> HCI Event: LE Meta Event (0x3e) plen 6                                                                           #140 25.193032
      LE Advertising Set Terminated (0x12)
        Status: Success (0x00)
        Handle: 0
        Connection handle: 543
        Number of completed extended advertising events: 0
zephyr.exe[327132]: < HCI Command: LE Read Remote Used Features (0x08|0x0016) plen 2                               #141 25.198095
        Handle: 543 Address: DF:A9:FF:F6:B1:1A (OUI DF-A9-FF)
> HCI Event: Command Status (0x0f) plen 4                                                                          #142 25.198570
      LE Read Remote Used Features (0x08|0x0016) ncmd 1
        Status: Success (0x00)
> HCI Event: LE Meta Event (0x3e) plen 12                                                                          #143 25.456833
      LE Read Remote Used Features (0x04)
        Status: Success (0x00)
        Handle: 543 Address: DF:A9:FF:F6:B1:1A (OUI DF-A9-FF)
        Features: 0x2d 0x49 0x00 0xf7 0x67 0xd8 0x00 0x00
          LE Encryption
          Extended Reject Indication
          Peripheral-initiated Features Exchange
          LE Data Packet Length Extension
          LE 2M PHY
          LE Coded PHY
          Channel Selection Algorithm #2
          Periodic Advertising Sync Transfer - Sender
          Periodic Advertising Sync Transfer - Recipient
          Sleep Clock Accuracy Updates
          Connected Isochronous Stream - Central
          Connected Isochronous Stream - Peripheral
          Isochronous Broadcaster
          Synchronized Receiver
          Connected Isochronous Stream (Host Support)
          LE Power Control Request
          LE Power Control Request
          Connection Subrating
          Connection Subrating (Host Support)
          Unknown features (0x0000d80000000000)
> ACL Data RX: Handle 543 flags 0x02 dlen 11                                                                       #144 25.894101
      SMP: Pairing Request (0x01) len 6
        IO capability: KeyboardDisplay (0x04)
        OOB data: Authentication data from remote device present (0x01)
        Authentication requirement: No bonding, MITM, SC, No Keypresses (0x0c)
        Max encryption key size: 16
        Initiator key distribution: <none> (0x00)
        Responder key distribution: <none> (0x00)
zephyr.exe[327132]: < HCI Command: Host Number of Completed Packets (0x03|0x0035) plen 5                           #145 25.898360
        Num handles: 1
        Handle: 543 Address: DF:A9:FF:F6:B1:1A (OUI DF-A9-FF)
        Count: 1
zephyr.exe[327132]: < ACL Data TX: Handle 543 flags 0x00 dlen 11                                                   #146 25.898544
      SMP: Pairing Response (0x02) len 6
        IO capability: DisplayOnly (0x00)
        OOB data: Authentication data from remote device present (0x01)
        Authentication requirement: Bonding, No MITM, SC, No Keypresses (0x09)
        Max encryption key size: 16
        Initiator key distribution: <none> (0x00)
        Responder key distribution: <none> (0x00)
> HCI Event: Number of Completed Packets (0x13) plen 5                                                             #147 26.069103
        Num handles: 1
        Handle: 543 Address: DF:A9:FF:F6:B1:1A (OUI DF-A9-FF)
        Count: 1
        #146: len 11 (0 Kb/s)
        Latency: 170 msec (170-170 msec ~170 msec)
> ACL Data RX: Handle 543 flags 0x02 dlen 27                                                                       #148 26.069373
> ACL Data RX: Handle 543 flags 0x01 dlen 27                                                                       #149 26.069983
> ACL Data RX: Handle 543 flags 0x01 dlen 15                                                                       #150 26.070403
      SMP: Pairing Public Key (0x0c) len 64
        X: eae47e4519d3e52c75366ae41de0201ec51830706049b4652805495570de3b1b
        Y: fc27fdf122ebbde65797410074aedd17a0d7f6d5bcb8303f74eef97fc55e448a
zephyr.exe[327132]: < HCI Command: Host Number of Completed Packets (0x03|0x0035) plen 5                           #151 26.078700
        Num handles: 1
        Handle: 543 Address: DF:A9:FF:F6:B1:1A (OUI DF-A9-FF)
        Count: 1
zephyr.exe[327132]: < HCI Command: Host Number of Completed Packets (0x03|0x0035) plen 5                           #152 26.078967
        Num handles: 1
        Handle: 543 Address: DF:A9:FF:F6:B1:1A (OUI DF-A9-FF)
        Count: 1
zephyr.exe[327132]: < HCI Command: Host Number of Completed Packets (0x03|0x0035) plen 5                           #153 26.079071
        Num handles: 1
        Handle: 543 Address: DF:A9:FF:F6:B1:1A (OUI DF-A9-FF)
        Count: 1
zephyr.exe[327132]: < ACL Data TX: Handle 543 flags 0x00 dlen 27                                                   #154 26.079179
zephyr.exe[327132]: < ACL Data TX: Handle 543 flags 0x01 dlen 27                                                   #155 26.079262
zephyr.exe[327132]: < ACL Data TX: Handle 543 flags 0x01 dlen 15                                                   #156 26.079272
      SMP: Pairing Public Key (0x0c) len 64
        X: 98308440221e2d910f0e54b71e7ec652857aa9b5a0dc65028824cc19db1226e9
        Y: 67a4816bcb62efb21701e31fdb27561a6217575fb007a8bbdabe7e28b6f68482
> HCI Event: Number of Completed Packets (0x13) plen 5                                                             #157 26.156991
        Num handles: 1
        Handle: 543 Address: DF:A9:FF:F6:B1:1A (OUI DF-A9-FF)
        Count: 1
        #154: len 27 (2 Kb/s)
        Latency: 77 msec (77-170 msec ~124 msec)
> HCI Event: Number of Completed Packets (0x13) plen 5                      