Bluetooth monitor ver 5.72
= Note: Linux version 6.14.0-36-generic (x86_64)                       0.776945
= Note: Bluetooth subsystem version 2.22                               0.776948
= New Index: 00:00:00:00:00:00 (Primary,UART,hci1)              [hci1] 0.776949
= New Index: 48:5F:99:8E:E0:64 (Primary,USB,hci0)               [hci0] 0.776949
= Open Index: 00:00:00:00:00:00                                 [hci1] 0.890759
= Index Info: 00:00:00:00:00:00 (Nordic Semiconductor ASA)      [hci1] 0.890776
@ USER Open: main (privileged) version 2.22            {0x0001} [hci1] 0.890785
< HCI Command: Reset (0x03|0x0003) plen 0                    #1 [hci1] 0.892116
> HCI Event: Command Complete (0x0e) plen 4                  #2 [hci1] 0.892610
      Reset (0x03|0x0003) ncmd 1
        Status: Success (0x00)
< HCI Command: Read Local Supported... (0x04|0x0003) plen 0  #3 [hci1] 0.911588
> HCI Event: Command Complete (0x0e) plen 12                 #4 [hci1] 0.912103
      Read Local Supported Features (0x04|0x0003) ncmd 1
        Status: Success (0x00)
        Features: 0x00 0x00 0x00 0x00 0x60 0x00 0x00 0x00
          BR/EDR Not Supported
          LE Supported (Controller)
< HCI Command: Read Local Version In.. (0x04|0x0001) plen 0  #5 [hci1] 0.930354
> HCI Event: Command Complete (0x0e) plen 12                 #6 [hci1] 0.930819
      Read Local Version Information (0x04|0x0001) ncmd 1
        Status: Success (0x00)
        HCI version: Reserved (0x0f) - Revision 12393 (0x3069)
        LMP version: Reserved (0x0f) - Subversion 12393 (0x3069)
        Manufacturer: Nordic Semiconductor ASA (89)
< HCI Command: Read Local Supported... (0x04|0x0002) plen 0  #7 [hci1] 0.950196
> HCI Event: Command Complete (0x0e) plen 68                 #8 [hci1] 0.951275
      Read Local Supported Commands (0x04|0x0002) ncmd 1
        Status: Success (0x00)
        Commands: 119 entries
          Disconnect (Octet 0 - Bit 5)
          Read Remote Version Information (Octet 2 - Bit 7)
          Set Event Mask (Octet 5 - Bit 6)
          Reset (Octet 5 - Bit 7)
          Read Connection Accept Timeout (Octet 7 - Bit 2)
          Write Connection Accept Timeout (Octet 7 - Bit 3)
          Read Transmit Power Level (Octet 10 - Bit 2)
          Set Controller To Host Flow Control (Octet 10 - Bit 5)
          Host Buffer Size (Octet 10 - Bit 6)
          Host Number of Completed Packets (Octet 10 - Bit 7)
          Read Local Version Information (Octet 14 - Bit 3)
          Read Local Supported Features (Octet 14 - Bit 5)
          Read BD ADDR (Octet 15 - Bit 1)
          Read RSSI (Octet 15 - Bit 5)
          Set Event Mask Page 2 (Octet 22 - Bit 2)
          LE Set Event Mask (Octet 25 - Bit 0)
          LE Read Buffer Size (Octet 25 - Bit 1)
          LE Read Local Supported Features (Octet 25 - Bit 2)
          LE Set Random Address (Octet 25 - Bit 4)
          LE Set Advertising Parameters (Octet 25 - Bit 5)
          LE Read Advertising Channel TX Power (Octet 25 - Bit 6)
          LE Set Advertising Data (Octet 25 - Bit 7)
          LE Set Scan Response Data (Octet 26 - Bit 0)
          LE Set Advertise Enable (Octet 26 - Bit 1)
          LE Set Scan Parameters (Octet 26 - Bit 2)
          LE Set Scan Enable (Octet 26 - Bit 3)
          LE Create Connection (Octet 26 - Bit 4)
          LE Create Connection Cancel (Octet 26 - Bit 5)
          LE Read Accept List Size (Octet 26 - Bit 6)
          LE Clear Accept List (Octet 26 - Bit 7)
          LE Add Device To Accept List (Octet 27 - Bit 0)
          LE Remove Device From Accept List (Octet 27 - Bit 1)
          LE Connection Update (Octet 27 - Bit 2)
          LE Set Host Channel Classification (Octet 27 - Bit 3)
          LE Read Channel Map (Octet 27 - Bit 4)
          LE Read Remote Used Features (Octet 27 - Bit 5)
          LE Encrypt (Octet 27 - Bit 6)
          LE Rand (Octet 27 - Bit 7)
          LE Start Encryption (Octet 28 - Bit 0)
          LE Long Term Key Request Reply (Octet 28 - Bit 1)
          LE Long Term Key Request Neg Reply (Octet 28 - Bit 2)
          LE Read Supported States (Octet 28 - Bit 3)
          LE Receiver Test (Octet 28 - Bit 4)
          LE Transmitter Test (Octet 28 - Bit 5)
          LE Test End (Octet 28 - Bit 6)
          Read Authenticated Payload Timeout (Octet 32 - Bit 4)
          Write Authenticated Payload Timeout (Octet 32 - Bit 5)
          LE Set Data Length (Octet 33 - Bit 6)
          LE Read Suggested Default Data Length (Octet 33 - Bit 7)
          LE Write Suggested Default Data Length (Octet 34 - Bit 0)
          LE Add Device To Resolving List (Octet 34 - Bit 3)
          LE Remove Device From Resolving List (Octet 34 - Bit 4)
          LE Clear Resolving List (Octet 34 - Bit 5)
          LE Read Resolving List Size (Octet 34 - Bit 6)
          LE Set Address Resolution Enable (Octet 35 - Bit 1)
          LE Set Resolvable Private Address Timeout (Octet 35 - Bit 2)
          LE Read Maximum Data Length (Octet 35 - Bit 3)
          LE Read PHY (Octet 35 - Bit 4)
          LE Set Default PHY (Octet 35 - Bit 5)
          LE Set PHY (Octet 35 - Bit 6)
          LE Enhanced Receiver Test (Octet 35 - Bit 7)
          LE Enhanced Transmitter Test (Octet 36 - Bit 0)
          LE Set Advertising Set Random Address (Octet 36 - Bit 1)
          LE Set Extended Advertising Parameters (Octet 36 - Bit 2)
          LE Set Extended Advertising Data (Octet 36 - Bit 3)
          LE Set Extended Scan Response Data (Octet 36 - Bit 4)
          LE Set Extended Advertising Enable (Octet 36 - Bit 5)
          LE Read Maximum Advertising Data Length (Octet 36 - Bit 6)
          LE Read Number of Supported Advertising Sets (Octet 36 - Bit 7)
          LE Remove Advertising Set (Octet 37 - Bit 0)
          LE Clear Advertising Sets (Octet 37 - Bit 1)
          LE Set Periodic Advertising Parameters (Octet 37 - Bit 2)
          LE Set Periodic Advertising Data (Octet 37 - Bit 3)
          LE Set Periodic Advertising Enable (Octet 37 - Bit 4)
          LE Set Extended Scan Parameters (Octet 37 - Bit 5)
          LE Set Extended Scan Enable (Octet 37 - Bit 6)
          LE Extended Create Connection (Octet 37 - Bit 7)
          LE Periodic Advertising Create Sync (Octet 38 - Bit 0)
          LE Periodic Advertising Create Sync Cancel (Octet 38 - Bit 1)
          LE Periodic Advertising Terminate Sync (Octet 38 - Bit 2)
          LE Add Device To Periodic Advertiser List (Octet 38 - Bit 3)
          LE Remove Device From Periodic Advertiser List (Octet 38 - Bit 4)
          LE Clear Periodic Advertiser List (Octet 38 - Bit 5)
          LE Read Periodic Advertiser List Size (Octet 38 - Bit 6)
          LE Read Transmit Power (Octet 38 - Bit 7)
          LE Read RF Path Compensation (Octet 39 - Bit 0)
          LE Write RF Path Compensation (Octet 39 - Bit 1)
          LE Set Privacy Mode (Octet 39 - Bit 2)
          LE Periodic Advertising Receive Enable (Octet 40 - Bit 5)
          LE Periodic Advertising Sync Transfer (Octet 40 - Bit 6)
          LE Periodic Advertising Set Info Transfer (Octet 40 - Bit 7)
          LE Periodic Advertising Sync Transfer Parameters (Octet 41 - Bit 0)
          LE Set Default Periodic Advertisng Sync Transfer Parameters (Octet 41 - Bit 1)
          LE Read Buffer v2 (Octet 41 - Bit 5)
          LE Read ISO TX Sync (Octet 41 - Bit 6)
          LE Set Connected Isochronous Group Parameters (Octet 41 - Bit 7)
          LE Set Connected Isochronous Group Parameters Test (Octet 42 - Bit 0)
          LE Create Connected Isochronous Stream (Octet 42 - Bit 1)
          LE Remove Connected Isochronous Group (Octet 42 - Bit 2)
          LE Accept Connected Isochronous Stream Request (Octet 42 - Bit 3)
          LE Reject Connected Isochronous Stream Request (Octet 42 - Bit 4)
          LE Create Broadcast Isochronous Group (Octet 42 - Bit 5)
          LE Create Broadcast Isochronous Group Test (Octet 42 - Bit 6)
          LE Terminate Broadcast Isochronous Group (Octet 42 - Bit 7)
          LE Broadcast Isochronous Group Create Sync (Octet 43 - Bit 0)
          LE Broadcast Isochronous Group Terminate Sync (Octet 43 - Bit 1)
          LE Request Peer SCA (Octet 43 - Bit 2)
          LE Setup Isochronous Data Path (Octet 43 - Bit 3)
          LE Remove Isochronous Data Path (Octet 43 - Bit 4)
          LE Isochronous Transmit Test (Octet 43 - Bit 5)
          LE Isochronous Receive Test (Octet 43 - Bit 6)
          LE Isochronous Read Test Counters (Octet 43 - Bit 7)
          LE Isochronous Read Test Counters (Octet 44 - Bit 0)
          LE Set Host Feature (Octet 44 - Bit 1)
          Octet 44 - Bit 2 
          Octet 45 - Bit 6 
          Octet 46 - Bit 0 
          Octet 46 - Bit 1 
          Octet 46 - Bit 2 
< HCI Command: Host Buffer Size (0x03|0x0033) plen 7         #9 [hci1] 0.970213
        ACL MTU: 255  ACL max packet: 16
        SCO MTU: 0    SCO max packet: 0
> HCI Event: Command Complete (0x0e) plen 4                 #10 [hci1] 0.970694
      Host Buffer Size (0x03|0x0033) ncmd 1
        Status: Success (0x00)
< HCI Command: Set Controller To Ho.. (0x03|0x0031) plen 1  #11 [hci1] 0.990184
        Flow control: ACL Data Packets (0x01)
> HCI Event: Command Complete (0x0e) plen 4                 #12 [hci1] 0.990648
      Set Controller To Host Flow Control (0x03|0x0031) ncmd 1
        Status: Success (0x00)
< HCI Command: LE Read Local Suppor.. (0x08|0x0003) plen 0  #13 [hci1] 1.010209
> HCI Event: Command Complete (0x0e) plen 12                #14 [hci1] 1.010753
      LE Read Local Supported Features (0x08|0x0003) ncmd 1
        Status: Success (0x00)
        Features: 0xfd 0x79 0x00 0xf7 0x30 0x01 0x00 0x00
          LE Encryption
          Extended Reject Indication
          Peripheral-initiated Features Exchange
          LE Ping
          LE Data Packet Length Extension
          LL Privacy
          Extended Scanner Filter Policies
          LE 2M PHY
          LE Coded PHY
          LE Extended Advertising
          LE Periodic Advertising
          Channel Selection Algorithm #2
          Periodic Advertising Sync Transfer - Sender
          Periodic Advertising Sync Transfer - Recipient
          Sleep Clock Accuracy Updates
          Connected Isochronous Stream - Central
          Connected Isochronous Stream - Peripheral
          Isochronous Broadcaster
          Synchronized Receiver
          Periodic Advertising ADI support
          Connection Subrating
          Unknown features (0x0000010000000000)
< HCI Command: LE Set Host Feature (0x08|0x0074) plen 2     #15 [hci1] 1.030201
        Bit Number: 32
          Connected Isochronous Stream (Host Support)
        Bit Value: 1
> HCI Event: Command Complete (0x0e) plen 4                 #16 [hci1] 1.030586
      LE Set Host Feature (0x08|0x0074) ncmd 1
        Status: Success (0x00)
< HCI Command: LE Read Buffer v2 (0x08|0x0060) plen 0       #17 [hci1] 1.050207
> HCI Event: Command Complete (0x0e) plen 10                #18 [hci1] 1.050723
      LE Read Buffer v2 (0x08|0x0060) ncmd 1
        Status: Success (0x00)
        ACL MTU: 27
        ACL max packet: 3
        ISO MTU: 318
        ISO max packet: 3
< HCI Command: LE Read Maximum Adve.. (0x08|0x003a) plen 0  #19 [hci1] 1.070245
> HCI Event: Command Complete (0x0e) plen 6                 #20 [hci1] 1.070755
      LE Read Maximum Advertising Data Length (0x08|0x003a) ncmd 1
        Status: Success (0x00)
        Max length: 1650
< HCI Command: LE Read Supported St.. (0x08|0x001c) plen 0  #21 [hci1] 1.090212
> HCI Event: Command Complete (0x0e) plen 12                #22 [hci1] 1.090720
      LE Read Supported States (0x08|0x001c) ncmd 1
        Status: Success (0x00)
        States: 0x000003ff3e0306ff
          Non-connectable Advertising State
          Scannable Advertising State
          Connectable Advertising State
          High Duty Cycle Directed Advertising State
          Passive Scanning State
          Active Scanning State
          Initiating State
            and Connection State (Central Role)
          Connection State (Peripheral Role)
          Scannable Advertising State
            and Passive Scanning State
          Connectable Advertising State
            and Passive Scanning State
          Non-connectable Advertising State
            and Initiating State
          Scannable Advertising State
            and Initiating State
          Active Scanning State
            and Connection State (Central Role)
          Passive Scanning State
            and Connection State (Peripheral Role)
          Active Scanning State
            and Connection State (Peripheral Role)
          Initiating State
            and Connection State (Central Role)
            and Central Role & Central Role
          Low Duty Cycle Directed Advertising State
          Connectable Advertising State
            and Initiating State
            and Central Role & Peripheral Role
          High Duty Cycle Directed Advertising State
            and Initiating State
            and Central Role & Peripheral Role
          Low Duty Cycle Directed Advertising State
            and Initiating State
            and Central Role & Peripheral Role
          Connectable Advertising State
            and Connection State (Central Role)
            and Central Role & Peripheral Role
          High Duty Cycle Directed Advertising State
            and Connection State (Central Role)
            and Central Role & Peripheral Role
          Low Duty Cycle Directed Advertising State
            and Connection State (Central Role)
            and Central Role & Peripheral Role
          Connectable Advertising State
            and Connection State (Peripheral Role)
            and Central Role & Peripheral Role
          High Duty Cycle Directed Advertising State
            and Connection State (Peripheral Role)
            and Peripheral Role & Peripheral Role
          Low Duty Cycle Directed Advertising State
            and Connection State (Peripheral Role)
            and Peripheral Role & Peripheral Role
          Initiating State
            and Connection State (Peripheral Role)
            and Central Role & Peripheral Role
< HCI Command: LE Read Maximum Data.. (0x08|0x002f) plen 0  #23 [hci1] 1.110208
> HCI Event: Command Complete (0x0e) plen 12                #24 [hci1] 1.110751
      LE Read Maximum Data Length (0x08|0x002f) ncmd 1
        Status: Success (0x00)
        Max TX octets: 251
        Max TX time: 2704
        Max RX octets: 251
        Max RX time: 2704
< HCI Command: LE Write Suggested D.. (0x08|0x0024) plen 4  #25 [hci1] 1.130217
        TX octets: 251
        TX time: 2704
> HCI Event: Command Complete (0x0e) plen 4                 #26 [hci1] 1.130722
      LE Write Suggested Default Data Length (0x08|0x0024) ncmd 1
        Status: Success (0x00)
< HCI Command: LE Read Resolving Li.. (0x08|0x002a) plen 0  #27 [hci1] 1.150225
> HCI Event: Command Complete (0x0e) plen 5                 #28 [hci1] 1.150629
      LE Read Resolving List Size (0x08|0x002a) ncmd 1
        Status: Success (0x00)
        Size: 8
< HCI Command: LE Set Event Mask (0x08|0x0001) plen 8       #29 [hci1] 1.170206
        Mask: 0x000002023f87fa5e
          LE Advertising Report
          LE Connection Update Complete
          LE Read Remote Used Features Complete
          LE Long Term Key Request
          LE Data Length Change
          LE Enhanced Connection Complete
          LE PHY Update Complete
          LE Extended Advertising Report
          LE Periodic Advertising Sync Established
          LE Periodic Advertising Report
          LE Periodic Advertising Sync Lost
          LE Extended Scan Timeout
          LE Extended Advertising Set Terminated
          LE Scan Request Received
          LE Periodic Advertising Sync Transfer Rvc
          LE CIS Established
          LE CIS Request
          LE Create BIG Complete
          LE Terminate BIG Complete
          LE BIG Sync Estabilished Complete
          LE BIG Sync Lost
          LE BIG Info Advertising Report
          Unknown mask (0x0000020000000000)
> HCI Event: Command Complete (0x0e) plen 4                 #30 [hci1] 1.170734
      LE Set Event Mask (0x08|0x0001) ncmd 1
        Status: Success (0x00)
< HCI Command: Set Event Mask (0x03|0x0001) plen 8          #31 [hci1] 1.190224
        Mask: 0x2000800002008890
          Disconnection Complete
          Encryption Change
          Read Remote Version Information Complete
          Hardware Error
          Data Buffer Overflow
          Encryption Key Refresh Complete
          LE Meta
> HCI Event: Command Complete (0x0e) plen 4                 #32 [hci1] 1.190776
      Set Event Mask (0x03|0x0001) ncmd 1
        Status: Success (0x00)
< HCI Command: Read BD ADDR (0x04|0x0009) plen 0            #33 [hci1] 1.210220
> HCI Event: Command Complete (0x0e) plen 10                #34 [hci1] 1.210715
      Read BD ADDR (0x04|0x0009) ncmd 1
        Status: Success (0x00)
        Address: 00:00:00:00:00:00 (OUI 00-00-00)
< HCI Command: LE Set Random Address (0x08|0x0005) plen 6   #35 [hci1] 1.230219
        Address: D5:B6:CC:31:DB:3B (Static)
> HCI Event: Command Complete (0x0e) plen 4                 #36 [hci1] 1.230693
      LE Set Random Address (0x08|0x0005) ncmd 1
        Status: Success (0x00)
< HCI Command: LE Set Extended Adv.. (0x08|0x0036) plen 25  #37 [hci1] 5.260294
        Handle: 0x00
        Properties: 0x0000
        Min advertising interval: 100.000 msec (0x00a0)
        Max advertising interval: 150.000 msec (0x00f0)
        Channel map: 37, 38, 39 (0x07)
        Own address type: Random (0x01)
        Peer address type: Public (0x00)
        Peer address: 00:00:00:00:00:00 (OUI 00-00-00)
        Filter policy: Allow Scan Request from Any, Allow Connect Request from Any (0x00)
        TX power: Host has no preference (0x7f)
        Primary PHY: LE 1M (0x01)
        Secondary max skip: 0x00
        Secondary PHY: LE 2M (0x02)
        SID: 0x00
        Scan request notifications: Disabled (0x00)
> HCI Event: Command Complete (0x0e) plen 5                 #38 [hci1] 5.261083
      LE Set Extended Advertising Parameters (0x08|0x0036) ncmd 1
        Status: Success (0x00)
        TX power (selected): 0 dbm (0x00)
< HCI Command: LE Set Advertising S.. (0x08|0x0035) plen 7  #39 [hci1] 5.270198
        Advertising handle: 0x00
        Advertising random address: D5:B6:CC:31:DB:3B (Static)
> HCI Event: Command Complete (0x0e) plen 4                 #40 [hci1] 5.270767
      LE Set Advertising Set Random Address (0x08|0x0035) ncmd 1
        Status: Success (0x00)
< HCI Command: LE Set Extended Adv.. (0x08|0x0037) plen 19  #41 [hci1] 5.290201
        Handle: 0x00
        Operation: Complete extended advertising data (0x03)
        Fragment preference: Minimize fragmentation (0x01)
        Data length: 0x0f
        Service Data: Broadcast Audio Announcement (0x1852)
        Broadcast ID: 1193046 (0x123456)
        Name (complete): Tester
> HCI Event: Command Complete (0x0e) plen 4                 #42 [hci1] 5.290870
      LE Set Extended Advertising Data (0x08|0x0037) ncmd 1
        Status: Success (0x00)
< HCI Command: LE Set Periodic Adve.. (0x08|0x003e) plen 7  #43 [hci1] 5.310220
        Handle: 0
        Min interval: 100.00 msec (0x0050)
        Max interval: 150.00 msec (0x0078)
        Properties: 0x0000
> HCI Event: Command Complete (0x0e) plen 4                 #44 [hci1] 5.310783
      LE Set Periodic Advertising Parameters (0x08|0x003e) ncmd 1
        Status: Success (0x00)
< HCI Command: LE Set Periodic Adv.. (0x08|0x003f) plen 84  #45 [hci1] 5.330198
        Handle: 0
        Operation: Complete ext advertising data (0x03)
        Data length: 0x51
        Service Data: Basic Audio Announcement (0x1851)
          Presetation Delay: 40000
          Number of Subgroups: 1
            Subgroup #0:
            Number of BIS(s): 2
            Codec: LC3 (0x06)
            Codec Specific Configuration: #0: len 0x02 type 0x01
            Codec Specific Configuration: Sampling Frequency: 16 Khz (0x03)
            Codec Specific Configuration: #1: len 0x02 type 0x02
            Codec Specific Configuration: Frame Duration: 10 ms (0x01)
            Codec Specific Configuration: #2: len 0x05 type 0x03
            Codec Specific Configuration: Location: 0x00000001
            Codec Specific Configuration: Location: Front Left (0x00000001)
            Codec Specific Configuration: #3: len 0x03 type 0x04
            Codec Specific Configuration: Frame Length: 40 (0x0028)
            Codec Specific Configuration: #4: len 0x02 type 0x05
            Codec Specific Configuration: Frame Blocks per SDU: 1 (0x01)
            Metadata: #0: len 0x03 type 0x02
            Metadata: Context: 0x0200
            Metadata: Context	Ringtone (0x0200)
              BIS #0:
              Index: 1
              Codec Specific Configuration: #0: len 0x02 type 0x01
              Codec Specific Configuration: Sampling Frequency: 16 Khz (0x03)
              Codec Specific Configuration: #1: len 0x02 type 0x02
              Codec Specific Configuration: Frame Duration: 10 ms (0x01)
              Codec Specific Configuration: #2: len 0x05 type 0x03
              Codec Specific Configuration: Location: 0x00000001
              Codec Specific Configuration: Location: Front Left (0x00000001)
              Codec Specific Configuration: #3: len 0x03 type 0x04
              Codec Specific Configuration: Frame Length: 40 (0x0028)
              Codec Specific Configuration: #4: len 0x02 type 0x05
              Codec Specific Configuration: Frame Blocks per SDU: 1 (0x01)
              BIS #1:
              Index: 2
              Codec Specific Configuration: #0: len 0x02 type 0x01
              Codec Specific Configuration: Sampling Frequency: 16 Khz (0x03)
              Codec Specific Configuration: #1: len 0x02 type 0x02
              Codec Specific Configuration: Frame Duration: 10 ms (0x01)
              Codec Specific Configuration: #2: len 0x05 type 0x03
              Codec Specific Configuration: Location: 0x00000001
              Codec Specific Configuration: Location: Front Left (0x00000001)
              Codec Specific Configuration: #3: len 0x03 type 0x04
              Codec Specific Configuration: Frame Length: 40 (0x0028)
              Codec Specific Configuration: #4: len 0x02 type 0x05
              Codec Specific Configuration: Frame Blocks per SDU: 1 (0x01)
> HCI Event: Command Complete (0x0e) plen 4                 #46 [hci1] 5.331706
      LE Set Periodic Advertising Data (0x08|0x003f) ncmd 1
        Status: Success (0x00)
< HCI Command: LE Set Extended Adve.. (0x08|0x0039) plen 6  #47 [hci1] 5.410169
        Extended advertising: Enabled (0x01)
        Number of sets: 1 (0x01)
        Entry 0
          Handle: 0x00
          Duration: 0 ms (0x00)
          Max ext adv events: 0
> HCI Event: Command Complete (0x0e) plen 4                 #48 [hci1] 5.410762
      LE Set Extended Advertising Enable (0x08|0x0039) ncmd 1
        Status: Success (0x00)
< HCI Command: LE Set Periodic Adve.. (0x08|0x0040) plen 2  #49 [hci1] 5.430193
        Periodic advertising: Enabled (0x01)
        Handle: 0
> HCI Event: Command Complete (0x0e) plen 4                 #50 [hci1] 5.430652
      LE Set Periodic Advertising Enable (0x08|0x0040) ncmd 1
        Status: Success (0x00)
< HCI Command: LE Create Broadcast.. (0x08|0x0068) plen 31  #51 [hci1] 5.500141
        Handle: 0x00
        Advertising Handle: 0x00
        Number of BIS: 2
        SDU Interval: 10000 us (0x002710)
        Maximum SDU size: 40
        Maximum Latency: 10 ms (0x000a)
        RTN: 0x02
        PHY: LE 2M (0x02)
        Packing: Sequential (0x00)
        Framing: Unframed (0x00)
        Encryption: 0x00
        Broadcast Code: 00000000000000000000000000000000
> HCI Event: Command Status (0x0f) plen 4                   #52 [hci1] 5.501135
      LE Create Broadcast Isochronous Group (0x08|0x0068) ncmd 1
        Status: Success (0x00)
> HCI Event: LE Meta Event (0x3e) plen 23                   #53 [hci1] 5.510845
      LE Broadcast Isochronous Group Complete (0x1b)
        Status: Success (0x00)
        Handle: 0x00
        BIG Synchronization Delay: 1974 us (0x0007b6)
        Transport Latency: 1974 us (0x0007b6)
        PHY: LE 2M (0x02)
        NSE: 3
        BN: 1
        PTO: 0
        IRC: 3
        Maximum PDU: 40
        ISO Interval: 10.00 msec (0x0008)
        Connection Handle #0: 983
        Connection Handle #1: 1810
< HCI Command: LE Setup Isochronou.. (0x08|0x006e) plen 13  #54 [hci1] 5.530244
        Handle: 983
        Data Path Direction: Input (Host to Controller) (0x00)
        Data Path: HCI (0x00)
        Coding Format: Transparent (0x03)
        Company Codec ID: Ericsson Technology Licensing (0)
        Vendor Codec ID: 0
        Controller Delay: 0 us (0x000000)
        Codec Configuration Length: 0
        Codec Configuration: 
> HCI Event: Command Complete (0x0e) plen 6                 #55 [hci1] 5.530917
      LE Setup Isochronous Data Path (0x08|0x006e) ncmd 1
        Status: Success (0x00)
        Handle: 983
< HCI Command: LE Setup Isochronou.. (0x08|0x006e) plen 13  #56 [hci1] 5.550469
        Handle: 1810
        Data Path Direction: Input (Host to Controller) (0x00)
        Data Path: HCI (0x00)
        Coding Format: Transparent (0x03)
        Company Codec ID: Ericsson Technology Licensing (0)
        Vendor Codec ID: 0
        Controller Delay: 0 us (0x000000)
        Codec Configuration Length: 0
        Codec Configuration: 
< ISO Data TX: Handle 983 flags 0x02 dlen 44                #57 [hci1] 5.550584
< ISO Data TX: Handle 983 flags 0x02 dlen 44                #58 [hci1] 5.550688
> HCI Event: Command Complete (0x0e) plen 6                 #59 [hci1] 5.551218
      LE Setup Isochronous Data Path (0x08|0x006e) ncmd 1
        Status: Success (0x00)
        Handle: 1810
> HCI Event: Number of Completed Packets (0x13) plen 5      #60 [hci1] 5.551934
        Num handles: 1
        Handle: 983 Address: 00:00:00:00:00:00 (OUI 00-00-00)
        Count: 1
        #57: len 44 (352 Kb/s)
        Latency: 1 msec (1-1 msec ~1 msec)
> HCI Event: Number of Completed Packets (0x13) plen 5      #61 [hci1] 5.552423
        Num handles: 1
        Handle: 983 Address: 00:00:00:00:00:00 (OUI 00-00-00)
        Count: 1
        #58: len 44 (352 Kb/s)
        Latency: 1 msec (1-1 msec ~1 msec)
< ISO Data TX: Handle 983 flags 0x02 dlen 44                #62 [hci1] 5.570487
< ISO Data TX: Handle 1810 flags 0x02 dlen 44               #63 [hci1] 5.570602
< ISO Data TX: Handle 983 flags 0x02 dlen 44                #64 [hci1] 5.570662
> HCI Event: Number of Completed Packets (0x13) plen 5      #65 [hci1] 5.571838
        Num handles: 1
        Handle: 983 Address: 00:00:00:00:00:00 (OUI 00-00-00)
        Count: 1
        #62: len 44 (352 Kb/s)
        Latency: 1 msec (1-1 msec ~1 msec)
> HCI Event: Number of Completed Packets (0x13) plen 5      #66 [hci1] 5.572572
        Num handles: 1
        Handle: 1810 Address: 00:00:00:00:00:00 (OUI 00-00-00)
        Count: 1
        #63: len 44 (352 Kb/s)
        Latency: 1 msec (1-1 msec ~1 msec)
> HCI Event: Number of Completed Packets (0x13) plen 5      #67 [hci1] 5.572965
        Num handles: 1
        Handle: 983 Address: 00:00:00:00:00:00 (OUI 00-00-00)
        Count: 1
        #64: len 44 (176 Kb/s)
        Latency: 2 msec (1-2 msec ~1 msec)
< ISO Data TX: Handle 1810 flags 0x02 dlen 44               #68 [hci1] 5.590360
< ISO Data TX: Handle 983 flags 0x02 dlen 44                #69 [hci1] 5.590454
< ISO Data TX: Handle 1810 flags 0x02 dlen 44               #70 [hci1] 5.590601
> HCI Event: Number of Completed Packets (0x13) plen 5      #71 [hci1] 5.591704
        Num handles: 1
        Handle: 1810 Address: 00:00:00:00:00:00 (OUI 00-00-00)
        Count: 1
        #68: len 44 (352 Kb/s)
        Latency: 1 msec (1-1 msec ~1 msec)
> HCI Event: Number of Completed Packets (0x13) plen 5      #72 [hci1] 5.592275
        Num handles: 1
        Handle: 983 Address: 00:00:00:00:00:00 (OUI 00-00-00)
        Count: 1
        #69: len 44 (352 Kb/s)
        Latency: 1 msec (1-2 msec ~1 msec)
> HCI Event: Number of Completed Packets (0x13) plen 5      #73 [hci1] 5.592834
        Num handles: 1
        Handle: 1810 Address: 00:00:00:00:00:00 (OUI 00-00-00)
        Count: 1
        #70: len 44 (176 Kb/s)
        Latency: 2 msec (1-2 msec ~1 msec)
< ISO Data TX: Handle 983 flags 0x02 dlen 44                #74 [hci1] 5.610342
< ISO Data TX: Handle 983 flags 0x02 dlen 44                #75 [hci1] 5.610446
< ISO Data TX: Handle 1810 flags 0x02 dlen 44               #76 [hci1] 5.610554
> HCI Event: Number of Completed Packets (0x13) plen 5      #77 [hci1] 5.611606
        Num handles: 1
        Handle: 983 Address: 00:00:00:00:00:00 (OUI 00-00-00)
        Count: 1
        #74: len 44 (352 Kb/s)
        Latency: 1 msec (1-2 msec ~1 msec)
> HCI Event: Number of Completed Packets (0x13) plen 5      #78 [hci1] 5.612275
        Num handles: 1
        Handle: 983 Address: 00:00:00:00:00:00 (OUI 00-00-00)
        Count: 1
        #75: len 44 (352 Kb/s)
        Latency: 1 msec (1-2 msec ~1 msec)
> HCI Event: Number of Completed Packets (0x13) plen 5      #79 [hci1] 5.612817
        Num handles: 1
        Handle: 1810 Address: 00:00:00:00:00:00 (OUI 00-00-00)
        Count: 1
        #76: len 44 (176 Kb/s)
        Latency: 2 msec (1-2 msec ~2 msec)
< ISO Data TX: Handle 1810 flags 0x02 dlen 44               #80 [hci1] 5.630441
< ISO Data TX: Handle 983 flags 0x02 dlen 44                #81 [hci1] 5.630607
< ISO Data TX: Handle 1810 flags 0x02 dlen 44               #82 [hci1] 5.630689
> HCI Event: Number of Completed Packets (0x13) plen 5      #83 [hci1] 5.631867
        Num handles: 1
        Handle: 1810 Address: 00:00:00:00:00:00 (OUI 00-00-00)
        Count: 1
        #80: len 44 (352 Kb/s)
        Latency: 1 msec (1-2 msec ~1 msec)
> HCI Event: Number of Completed Packets (0x13) plen 5      #84 [hci1] 5.632375
        Num handles: 1
        Handle: 983 Address: 00:00:00:00:00:00 (OUI 00-00-00)
        Count: 1
        #81: len 44 (352 Kb/s)
        Latency: 1 msec (1-2 msec ~1 msec)
> HCI Event: Number of Completed Packets (0x13) plen 5      #85 [hci1] 5.632890
        Num handles: 1
        Handle: 1810 Address: 00:00:00:00:00:00 (OUI 00-00-00)
        Count: 1
        #82: len 44 (176 Kb/s)
        Latency: 2 msec (1-2 msec ~1 msec)
< ISO Data TX: Handle 983 flags 0x02 dlen 44                #86 [hci1] 5.650351
< ISO Data TX: Handle 983 flags 0x02 dlen 44                #87 [hci1] 5.650437
< ISO Data TX: Handle 1810 flags 0x02 dlen 44               #88 [hci1] 5.650553
> HCI Event: Number of Completed Packets (0x13) plen 5      #89 [hci1] 5.651649
        Num handles: 1
        Handle: 983 Address: 00:00:00:00:00:00 (OUI 00-00-00)
        Count: 1
        #86: len 44 (352 Kb/s)
        Latency: 1 msec (1-2 msec ~1 msec)
> HCI Event: Number of Completed Packets (0x13) plen 5      #90 [hci1] 5.652382
        Num handles: 1
        Handle: 983 Address: 00:00:00:00:00:00 (OUI 00-00-00)
        Count: 1
        #87: len 44 (352 Kb/s)
        Latency: 1 msec (1-2 msec ~1 msec)
> HCI Event: Number of Completed Packets (0x13) plen 5      #91 [hci1] 5.652846
        Num handles: 1
        Handle: 1810 Address: 00:00:00:00:00:00 (OUI 00-00-00)
        Count: 1
        #88: len 44 (176 Kb/s)
        Latency: 2 msec (1-2 msec ~2 msec)
< ISO Data TX: Handle 1810 flags 0x02 dlen 44               #92 [hci1] 5.670238
< ISO Data TX: Handle 983 flags 0x02 dlen 44                #93 [hci1] 5.670410
< ISO Data TX: Handle 1810 flags 0x02 dlen 44               #94 [hci1] 5.670520
> HCI Event: Number of Completed Packets (0x13) plen 5      #95 [hci1] 5.671527
        Num handles: 1
        Handle: 1810 Address: 00:00:00:00:00:00 (OUI 00-00-00)
        Count: 1
        #92: len 44 (352 Kb/s)
        Latency: 1 msec (1-2 msec ~1 msec)
> HCI Event: Number of Completed Packets (0x13) plen 5      #96 [hci1] 5.672146
        Num handles: 1
        Handle: 983 Address: 00:00:00:00:00:00 (OUI 00-00-00)
        Count: 1
        #93: len 44 (352 Kb/s)
        Latency: 1 msec (1-2 msec ~1 msec)
> HCI Event: Number of Completed Packets (0x13) plen 5      #97 [hci1] 5.672797
        Num handles: 1
        Handle: 1810 Address: 00:00:00:00:00:00 (OUI 00-00-00)
        Count: 1
        #94: len 44 (176 Kb/s)
        Latency: 2 msec (1-2 msec ~1 msec)
< ISO Data TX: Handle 983 flags 0x02 dlen 44                #98 [hci1] 5.690520
< ISO Data TX: Handle 983 flags 0x02 dlen 44                #99 [hci1] 5.690647
< ISO Data TX: Handle 1810 flags 0x02 dlen 44              #100 [hci1] 5.690754
> HCI Event: Number of Completed Packets (0x13) plen 5     #101 [hci1] 5.691816
        Num handles: 1
        Handle: 983 Address: 00:00:00:00:00:00 (OUI 00-00-00)
        Count: 1
        #98: len 44 (352 Kb/s)
        Latency: 1 msec (1-2 msec ~1 msec)
> HCI Event: Number of Completed Packets (0x13) plen 5     #102 [hci1] 5.692515
        Num handles: 1
        Handle: 983 Address: 00:00:00:00:00:00 (OUI 00-00-00)
        Count: 1
        #99: len 44 (352 Kb/s)
        Latency: 1 msec (1-2 msec ~1 msec)
> HCI Event: Number of Completed Packets (0x13) plen 5     #103 [hci1] 5.692993
        Num handles: 1
        Handle: 1810 Address: 00:00:00:00:00:00 (OUI 00-00-00)
        Count: 1
        #100: len 44 (176 Kb/s)
        Latency: 2 msec (1-2 msec ~2 msec)
< ISO Data TX: Handle 1810 flags 0x02 dlen 44              #104 [hci1] 5.710239
< ISO Data TX: Handle 983 flags 0x02 dlen 44               #105 [hci1] 5.710419
< ISO Data TX: Handle 1810 flags 0x02 dlen 44              #106 [hci1] 5.710532
> HCI Event: Number of Completed Packets (0x13) plen 5     #107 [hci1] 5.711469
        Num handles: 1
        Handle: 1810 Address: 00:00:00:00:00:00 (OUI 00-00-00)
        Count: 1
        #104: len 44 (352 Kb/s)
        Latency: 1 msec (1-2 msec ~1 msec)
> HCI Event: Number of Completed Packets (0x13) plen 5     #108 [hci1] 5.712202
        Num handles: 1
        Handle: 983 Address: 00:00:00:00:00:00 (OUI 00-00-00)
        Count: 1
        #105: len 44 (352 Kb/s)
        Latency: 1 msec (1-2 msec ~1 msec)
> HCI Event: Number of Completed Packets (0x13) plen 5     #109 [hci1] 5.712761
        Num handles: 1
        Handle: 1810 Address: 00:00:00:00:00:00 (OUI 00-00-00)
        Count: 1
        #106: len 44 (176 Kb/s)
        Latency: 2 msec (1-2 msec ~1 msec)
< ISO Data TX: Handle 983 flags 0x02 dlen 44               #110 [hci1] 5.730328
< ISO Data TX: Handle 983 flags 0x02 dlen 44               #111 [hci1] 5.730428
< ISO Data TX: Handle 1810 flags 0x02 dlen 44              #112 [hci1] 5.730536
> HCI Event: Number of Completed Packets (0x13) plen 5     #113 [hci1] 5.731646
        Num handles: 1
        Handle: 983 Address: 00:00:00:00:00:00 (OUI 00-00-00)
        Count: 1
        #110: len 44 (352 Kb/s)
        Latency: 1 msec (1-2 msec ~1 msec)
> HCI Event: Number of Completed Packets (0x13) plen 5     #114 [hci1] 5.732243
        Num handles: 1
        Handle: 983 Address: 00:00:00:00:00:00 (OUI 00-00-00)
        Count: 1
        #111: len 44 (352 Kb/s)
        Latency: 1 msec (1-2 msec ~1 msec)
> HCI Event: Number of Completed Packets (0x13) plen 5     #115 [hci1] 5.732906
        Num handles: 1
        Handle: 1810 Address: 00:00:00:00:00:00 (OUI 00-00-00)
        Count: 1
        #112: len 44 (176 Kb/s)
        Latency: 2 msec (1-2 msec ~2 msec)
< ISO Data TX: Handle 1810 flags 0x02 dlen 44              #116 [hci1] 5.750410
< ISO Data TX: Handle 983 flags 0x02 dlen 44               #117 [hci1] 5.750589
< ISO Data TX: Handle 1810 flags 0x02 dlen 44              #118 [hci1] 5.750622
> HCI Event: Number of Completed Packets (0x13) plen 5     #119 [hci1] 5.751761
        Num handles: 1
        Handle: 1810 Address: 00:00:00:00:00:00 (OUI 00-00-00)
        Count: 1
        #116: len 44 (352 Kb/s)
        Latency: 1 msec (1-2 msec ~1 msec)
> HCI Event: Number of Completed Packets (0x13) plen 5     #120 [hci1] 5.752361
        Num handles: 1
        Handle: 983 Address: 00:00:00:00:00:00 (OUI 00-00-00)
        Count: 1
        #117: len 44 (352 Kb/s)
        Latency: 1 msec (1-2 msec ~1 msec)
> HCI Event: Number of Completed Packets (0x13) plen 5     #121 [hci1] 5.752826
        Num handles: 1
        Handle: 1810 Address: 00:00:00:00:00:00 (OUI 00-00-00)
        Count: 1
        #118: len 44 (176 Kb/s)
        Latency: 2 msec (1-2 msec ~1 msec)
< ISO Data TX: Handle 983 flags 0x02 dlen 44               #122 [hci1] 5.770365
< ISO Data TX: Handle 983 flags 0x02 dlen 44               #123 [hci1] 5.770476
< ISO Data TX: Handle 1810 flags 0x02 dlen 44              #124 [hci1] 5.770554
> HCI Event: Number of Completed Packets (0x13) plen 5     #125 [hci1] 5.771711
        Num handles: 1
        Handle: 983 Address: 00:00:00:00:00:00 (OUI 00-00-00)
        Count: 1
        #122: len 44 (352 Kb/s)
        Latency: 1 msec (1-2 msec ~1 msec)
> HCI Event: Number of Completed Packets (0x13) plen 5     #126 [hci1] 5.772229
        Num handles: 1
        Handle: 983 Address: 00:00:00:00:00:00 (OUI 00-00-00)
        Count: 1
        #123: len 44 (352 Kb/s)
        Latency: 1 msec (1-2 msec ~1 msec)
> HCI Event: Number of Completed Packets (0x13) plen 5     #127 [hci1] 5.772843
        Num handles: 1
        Handle: 1810 Address: 00:00:00:00:00:00 (OUI 00-00-00)
        Count: 1
        #124: len 44 (176 Kb/s)
        Latency: 2 msec (1-2 msec ~2 msec)
< ISO Data TX: Handle 1810 flags 0x02 dlen 44              #128 [hci1] 5.790266
< ISO Data TX: Handle 983 flags 0x02 dlen 44               #129 [hci1] 5.790496
< ISO Data TX: Handle 1810 flags 0x02 dlen 44              #130 [hci1] 5.790571
> HCI Event: Number of Completed Packets (0x13) plen 5     #131 [hci1] 5.791454
        Num handles: 1
        Handle: 1810 Address: 00:00:00:00:00:00 (OUI 00-00-00)
        Count: 1
        #128: len 44 (352 Kb/s)
        Latency: 1 msec (1-2 msec ~1 msec)
> HCI Event: Number of Completed Packets (0x13) plen 5     #132 [hci1] 5.792235
        Num handles: 1
        Handle: 983 Address: 00:00:00:00:00:00 (OUI 00-00-00)
        Count: 1
        #129: len 44 (352 Kb/s)
        Latency: 1 msec (1-2 msec ~1 msec)
> HCI Event: Number of Completed Packets (0x13) plen 5     #133 [hci1] 5.792711
        Num handles: 1
        Handle: 1810 Address: 00:00:00:00:00:00 (OUI 00-00-00)
        Count: 1
        #130: len 44 (176 Kb/s)
        Latency: 2 msec (1-2 msec ~1 msec)
< ISO Data TX: Handle 983 flags 0x02 dlen 44               #134 [hci1] 5.810388
< ISO Data TX: Handle 983 flags 0x02 dlen 44               #135 [hci1] 5.810518
< ISO Data TX: Handle 1810 flags 0x02 dlen 44              #136 [hci1] 5.810590
> HCI Event: Number of Completed Packets (0x13) plen 5     #137 [hci1] 5.811725
        Num handles: 1
        Handle: 983 Address: 00:00:00:00:00:00 (OUI 00-00-00)
        Count: 1
        #134: len 44 (352 Kb/s)
        Latency: 1 msec (1-2 msec ~1 msec)
> HCI Event: Number of Completed Packets (0x13) plen 5     #138 [hci1] 5.812267
        Num handles: 1
        Handle: 983 Address: 00:00:00:00:00:00 (OUI 00-00-00)
        Count: 1
        #135: len 44 (352 Kb/s)
        Latency: 1 msec (1-2 msec ~1 msec)
> HCI Event: Number of Completed Packets (0x13) plen 5     #139 [hci1] 5.812824
        Num handles: 1
        Handle: 1810 Address: 00:00:00:00:00:00 (OUI 00-00-00)
        Count: 1
        #136: len 44 (176 Kb/s)
        Latency: 2 msec (1-2 msec ~2 msec)
< ISO Data TX: Handle 1810 flags 0x02 dlen 44              #140 [hci1] 5.830175
< ISO Data TX: Handle 983 flags 0x02 dlen 44               #141 [hci1] 5.830409
< ISO Data TX: Handle 1810 flags 0x02 dlen 44              #142 [hci1] 5.830501
> HCI Event: Number of Completed Packets (0x13) plen 5     #143 [hci1] 5.831451
        Num handles: 1
        Handle: 1810 Address: 00:00:00:00:00:00 (OUI 00-00-00)
        Count: 1
        #140: len 44 (352 Kb/s)
        Latency: 1 msec (1-2 msec ~1 msec)
> HCI Event: Number of Completed Packets (0x13) plen 5     #144 [hci1] 5.832109
        Num handles: 1
        Handle: 983 Address: 00:00:00:00:00:00 (OUI 00-00-00)
        Count: 1
        #141: len 44 (352 Kb/s)
        Latency: 1 msec (1-2 msec ~1 msec)
> HCI Event: Number of Completed Packets (0x13) plen 5     #145 [hci1] 5.832759
        Num handles: 1
        Handle: 1810 Address: 00:00:00:00:00:00 (OUI 00-00-00)
        Count: 1
        #142: len 44 (176 Kb/s)
        Latency: 2 msec (1-2 msec ~1 msec)
< ISO Data TX: Handle 983 flags 0x02 dlen 44               #146 [hci1] 5.850377
< ISO Data TX: Handle 983 flags 0x02 dlen 44               #147 [hci1] 5.850485
< ISO Data TX: Handle 1810 flags 0x02 dlen 44              #148 [hci1] 5.850566
> HCI Event: Number of Completed Packets (0x13) plen 5     #149 [hci1] 5.851606
        Num handles: 1
        Handle: 983 Address: 00:00:00:00:00:00 (OUI 00-00-00)
        Count: 1
        #146: len 44 (352 Kb/s)
        Latency: 1 msec (1-2 msec ~1 msec)
> HCI Event: Number of Completed Packets (0x13) plen 5     #150 [hci1] 5.852255
        Num handles: 1
        Handle: 983 Address: 00:00:00:00:00:00 (OUI 00-00-00)
        Count: 1
        #147: len 44 (352 Kb/s)
        Latency: 1 msec (1-2 msec ~1 msec)
> HCI Event: Number of Completed Packets (0x13) plen 5     #151 [hci1] 5.852893
        Num handles: 1
        Handle: 1810 Address: 00:00:00:00:00:00 (OUI 00-00-00)
        Count: 1
        #148: len 44 (176 Kb/s)
        Latency: 2 msec (1-2 msec ~2 msec)
< ISO Data TX: Handle 1810 flags 0x02 dlen 44              #152 [hci1] 5.870288
< ISO Data TX: Handle 983 flags 0x02 dlen 44               #153 [hci1] 5.870494
< ISO Data TX: Handle 1810 flags 0x02 dlen 44              #154 [hci1] 5.870562
> HCI Event: Number of Completed Packets (0x13) plen 5     #155 [hci1] 5.871464
        Num handles: 1
        Handle: 1810 Address: 00:00:00:00:00:00 (OUI 00-00-00)
        Count: 1
        #152: len 44 (352 Kb/s)
        Latency: 1 msec (1-2 msec ~1 msec)
> HCI Event: Number of Completed Packets (0x13) plen 5     #156 [hci1] 5.872270
        Num handles: 1
        Handle: 983 Address: 00:00:00:00:00:00 (OUI 00-00-00)
        Count: 1
        #153: len 44 (352 Kb/s)
        Latency: 1 msec (1-2 msec ~1 msec)
> HCI Event: Number of Completed Packets (0x13) plen 5     #157 [hci1] 5.872814
        Num handles: 1
        Handle: 1810 Address: 00:00:00:00:00:00 (OUI 00-00-00)
        Count: 1
        #154: len 44 (176 Kb/s)
        Latency: 2 msec (1-2 msec ~1 msec)
< ISO Data TX: Handle 983 flags 0x02 dlen 44               #158 [hci1] 5.890290
< ISO Data TX: Handle 983 flags 0x02 dlen 44               #159 [hci1] 5.890369
< ISO Data TX: Handle 1810 flags 0x02 dlen 44              #160 [hci1] 5.890423
> HCI Event: Number of Completed Packets (0x13) plen 5     #161 [hci1] 5.891567
        Num handles: 1
        Handle: 983 Address: 00:00:00:00:00:00 (OUI 00-00-00)
        Count: 1
        #158: len 44 (352 Kb/s)
        Latency: 1 msec (1-2 msec ~1 msec)
> HCI Event: Number of Completed Packets (0x13) plen 5     #162 [hci1] 5.892139
        Num handles: 1
        Handle: 983 Address: 00:00:00:00:00:00 (OUI 00-00-00)
        Count: 1
        #159: len 44 (352 Kb/s)
        Latency: 1 msec (1-2 msec ~1 msec)
> HCI Event: Number of Completed Packets (0x13) plen 5     #163 [hci1] 5.892781
        Num handles: 1
        Handle: 1810 Address: 00:00:00:00:00:00 (OUI 00-00-00)
        Count: 1
        #160: len 44 (176 Kb/s)
        Latency: 2 msec (1-2 msec ~2 msec)
< ISO Data TX: Handle 1810 flags 0x02 dlen 44              #164 [hci1] 5.910294
< ISO Data TX: Handle 983 flags 0x02 dlen 44               #165 [hci1] 5.910440
< ISO Data TX: Handle 1810 flags 0x02 dlen 44              #166 [hci1] 5.910523
> HCI Event: Number of Completed Packets (0x13) plen 5     #167 [hci1] 5.911471
        Num handles: 1
        Handle: 1810 Address: 00:00:00:00:00:00 (OUI 00-00-00)
        Count: 1
        #164: len 44 (352 Kb/s)
        Latency: 1 msec (1-2 msec ~1 msec)
> HCI Event: Number of Completed Packets (0x13) plen 5     #168 [hci1] 5.912243
        Num handles: 1
        Handle: 983 Address: 00:00:00:00:00:00 (OUI 00-00-00)
        Count: 1
        #165: len 44 (352 Kb/s)
        Latency: 1 msec (1-2 msec ~1 msec)
> HCI Event: Number of Completed Packets (0x13) plen 5     #169 [hci1] 5.912864
        Num handles: 1
        Handle: 1810 Address: 00:00:00:00:00:00 (OUI 00-00-00)
        Count: 1
        #166: len 44 (176 Kb/s)
        Latency: 2 msec (1-2 msec ~2 msec)
< ISO Data TX: Handle 983 flags 0x02 dlen 44               #170 [hci1] 5.930318
< ISO Data TX: Handle 983 flags 0x02 dlen 44               #171 [hci1] 5.930346
< ISO Data TX: Handle 1810 flags 0x02 dlen 44              #172 [hci1] 5.930387
> HCI Event: Number of Completed Packets (0x13) plen 5     #173 [hci1] 5.931564
        Num handles: 1
        Handle: 983 Address: 00:00:00:00:00:00 (OUI 00-00-00)
        Count: 1
        #170: len 44 (352 Kb/s)
        Latency: 1 msec (1-2 msec ~1 msec)
> HCI Event: Number of Completed Packets (0x13) plen 5     #174 [hci1] 5.932236
        Num handles: 1
        Handle: 983 Address: 00:00:00:00:00:00 (OUI 00-00-00)
        Count: 1
        #171: len 44 (352 Kb/s)
        Latency: 1 msec (1-2 msec ~1 msec)
> HCI Event: Number of Completed Packets (0x13) plen 5     #175 [hci1] 5.932815
        Num handles: 1
        Handle: 1810 Address: 00:00:00:00:00:00 (OUI 00-00-00)
        Count: 1
        #172: len 44 (176 Kb/s)
        Latency: 2 msec (1-2 msec ~2 msec)
< ISO Data TX: Handle 1810 flags 0x02 dlen 44              #176 [hci1] 5.950319
< ISO Data TX: Handle 983 flags 0x02 dlen 44               #177 [hci1] 5.950521
< ISO Data TX: Handle 1810 flags 0x02 dlen 44              #178 [hci1] 5.950618
> HCI Event: Number of Completed Packets (0x13) plen 5     #179 [hci1] 5.951504
        Num handles: 1
        Handle: 1810 Address: 00:00:00:00:00:00 (OUI 00-00-00)
        Count: 1
        #176: len 44 (352 Kb/s)
        Latency: 1 msec (1-2 msec ~1 msec)
> HCI Event: Number of Completed Packets (0x13) plen 5     #180 [hci1] 5.952295
        Num handles: 1
        Handle: 983 Address: 00:00:00:00:00:00 (OUI 00-00-00)
        Count: 1
        #177: len 44 (352 Kb/s)
        Latency: 1 msec (1-2 msec ~1 msec)
> HCI Event: Number of Completed Packets (0x13) plen 5     #181 [hci1] 5.952776
        Num handles: 1
        Handle: 1810 Address: 00:00:00:00:00:00 (OUI 00-00-00)
        Count: 1
        #178: len 44 (176 Kb/s)
        Latency: 2 msec (1-2 msec ~1 msec)
< ISO Data TX: Handle 983 flags 0x02 dlen 44               #182 [hci1] 5.970367
< ISO Data TX: Handle 983 flags 0x02 dlen 44               #183 [hci1] 5.970479
< ISO Data TX: Handle 1810 flags 0x02 dlen 44              #184 [hci1] 5.970616
> HCI Event: Number of Completed Packets (0x13) plen 5     #185 [hci1] 5.971674
        Num handles: 1
        Handle: 983 Address: 00:00:00:00:00:00 (OUI 00-00-00)
        Count: 1
        #182: len 44 (352 Kb/s)
        Latency: 1 msec (1-2 msec ~1 msec)
> HCI Event: Number of Completed Packets (0x13) plen 5     #186 [hci1] 5.972290
        Num handles: 1
        Handle: 983 Address: 00:00:00:00:00:00 (OUI 00-00-00)
        Count: 1
        #183: len 44 (352 Kb/s)
        Latency: 1 msec (1-2 msec ~1 msec)
> HCI Event: Number of Completed Packets (0x13) plen 5     #187 [hci1] 5.972882
        Num handles: 1
        Handle: 1810 Address: 00:00:00:00:00:00 (OUI 00-00-00)
        Count: 1
        #184: len 44 (176 Kb/s)
        Latency: 2 msec (1-2 msec ~2 msec)
< ISO Data TX: Handle 1810 flags 0x02 dlen 44              #188 [hci1] 5.990235
< ISO Data TX: Handle 983 flags 0x02 dlen 44               #189 [hci1] 5.990419
< ISO Data TX: Handle 1810 flags 0x02 dlen 44              #190 [hci1] 5.990424
> HCI Event: Number of Completed Packets (0x13) plen 5     #191 [hci1] 5.991433
        Num handles: 1
        Handle: 1810 Address: 00:00:00:00:00:00 (OUI 00-00-00)
        Count: 1
        #188: len 44 (352 Kb/s)
        Latency: 1 msec (1-2 msec ~1 msec)
> HCI Event: Number of Completed Packets (0x13) plen 5     #192 [hci1] 5.992148
        Num handles: 1
        Handle: 983 Address: 00:00:00:00:00:00 (OUI 00-00-00)
        Count: 1
        #189: len 44 (352 Kb/s)
        Latency: 1 msec (1-2 msec ~1 msec)
> HCI Event: Number of Completed Packets (0x13) plen 5     #193 [hci1] 5.992838
        Num handles: 1
        Handle: 1810 Address: 00:00:00:00:00:00 (OUI 00-00-00)
        Count: 1
        #190: len 44 (176 Kb/s)
        Latency: 2 msec (1-2 msec ~2 msec)
< ISO Data TX: Handle 983 flags 0x02 dlen 44               #194 [hci1] 6.010364
< ISO Data TX: Handle 983 flags 0x02 dlen 44               #195 [hci1] 6.010476
< ISO Data TX: Handle 1810 flags 0x02 dlen 44              #196 [hci1] 6.010593
> HCI Event: Number of Completed Packets (0x13) plen 5     #197 [hci1] 6.011614
        Num handles: 1
        Handle: 983 Address: 00:00:00:00:00:00 (OUI 00-00-00)
        Count: 1
        #194: len 44 (352 Kb/s)
        Latency: 1 msec (1-2 msec ~1 msec)
> HCI Event: Number of Completed Packets (0x13) plen 5     #198 [hci1] 6.012296
        Num handles: 1
        Handle: 983 Address: 00:00:00:00:00:00 (OUI 00-00-00)
        Count: 1
        #195: len 44 (352 Kb/s)
        Latency: 1 msec (1-2 msec ~1 msec)
> HCI Event: Number of Completed Packets (0x13) plen 5     #199 [hci1] 6.012905
        Num handles: 1
        Handle: 1810 Address: 00:00:00:00:00:00 (OUI 00-00-00)
        Count: 1
        #196: len 44 (176 Kb/s)
        Latency: 2 msec (1-2 msec ~2 msec)
< ISO Data TX: Handle 1810 flags 0x02 dlen 44              #200 [hci1] 6.030287
< ISO Data TX: Handle 983 flags 0x02 dlen 44               #201 [hci1] 6.030475
< ISO Data TX: Handle 1810 flags 0x02 dlen 44              #202 [hci1] 6.030597
> HCI Event: Number of Completed Packets (0x13) plen 5     #203 [hci1] 6.031448
        Num handles: 1
        Handle: 1810 Address: 00:00:00:00:00:00 (OUI 00-00-00)
        Count: 1
        #200: len 44 (352 Kb/s)
        Latency: 1 msec (1-2 msec ~1 msec)
> HCI Event: Number of Completed Packets (0x13) plen 5     #204 [hci1] 6.032165
        Num handles: 1
        Handle: 983 Address: 00:00:00:00:00:00 (OUI 00-00-00)
        Count: 1
        #201: len 44 (352 Kb/s)
        Latency: 1 msec (1-2 msec ~1 msec)
> HCI Event: Number of Completed Packets (0x13) plen 5     #205 [hci1] 6.032767
        Num handles: 1
        Handle: 1810 Address: 00:00:00:00:00:00 (OUI 00-00-00)
        Count: 1
        #202: len 44 (176 Kb/s)
        Latency: 2 msec (1-2 msec ~1 msec)
< ISO Data TX: Handle 983 flags 0x02 dlen 44               #206 [hci1] 6.050524
< ISO Data TX: Handle 983 flags 0x02 dlen 44               #207 [hci1] 6.050609
< ISO Data TX: Handle 1810 flags 0x02 dlen 44              #208 [hci1] 6.050693
> HCI Event: Number of Completed Packets (0x13) plen 5     #209 [hci1] 6.051811
        Num handles: 1
        Handle: 983 Address: 00:00:00:00:00:00 (OUI 00-00-00)
        Count: 1
        #206: len 44 (352 Kb/s)
        Latency: 1 msec (1-2 msec ~1 msec)
> HCI Event: Number of Completed Packets (0x13) plen 5     #210 [hci1] 6.052484
        Num handles: 1
        Handle: 983 Address: 00:00:00:00:00:00 (OUI 00-00-00)
        Count: 1
        #207: len 44 (352 Kb/s)
        Latency: 1 msec (1-2 msec ~1 msec)
> HCI Event: Number of Completed Packets (0x13) plen 5     #211 [hci1] 6.053005
        Num handles: 1
        Handle: 1810 Address: 00:00:00:00:00:00 (OUI 00-00-00)
        Count: 1
        #208: len 44 (176 Kb/s)
        Latency: 2 msec (1-2 msec ~2 msec)
< ISO Data TX: Handle 1810 flags 0x02 dlen 44              #212 [hci1] 6.070240
< ISO Data TX: Handle 983 flags 0x02 dlen 44               #213 [hci1] 6.070429
< ISO Data TX: Handle 1810 flags 0x02 dlen 44              #214 [hci1] 6.070449
> HCI Event: Number of Completed Packets (0x13) plen 5     #215 [hci1] 6.071548
        Num handles: 1
        Handle: 1810 Address: 00:00:00:00:00:00 (OUI 00-00-00)
        Count: 1
        #212: len 44 (352 Kb/s)
        Latency: 1 msec (1-2 msec ~1 msec)
> HCI Event: Number of Completed Packets (0x13) plen 5     #216 [hci1] 6.072134
        Num handles: 1
        Handle: 983 Address: 00:00:00:00:00:00 (OUI 00-00-00)
        Count: 1
        #213: len 44 (352 Kb/s)
        Latency: 1 msec (1-2 msec ~1 msec)
> HCI Event: Number of Completed Packets (0x13) plen 5     #217 [hci1] 6.072763
        Num handles: 1
        Handle: 1810 Address: 00:00:00:00:00:00 (OUI 00-00-00)
        Count: 1
        #214: len 44 (176 Kb/s)
        Latency: 2 msec (1-2 msec ~2 msec)
< ISO Data TX: Handle 983 flags 0x02 dlen 44               #218 [hci1] 6.090379
< ISO Data TX: Handle 983 flags 0x02 dlen 44               #219 [hci1] 6.090491
< ISO Data TX: Handle 1810 flags 0x02 dlen 44              #220 [hci1] 6.090558
> HCI Event: Number of Completed Packets (0x13) plen 5     #221 [hci1] 6.091706
        Num handles: 1
        Handle: 983 Address: 00:00:00:00:00:00 (OUI 00-00-00)
        Count: 1
        #218: len 44 (352 Kb/s)
        Latency: 1 msec (1-2 msec ~1 msec)
> HCI Event: Number of Completed Packets (0x13) plen 5     #222 [hci1] 6.092308
        Num handles: 1
        Handle: 983 Address: 00:00:00:00:00:00 (OUI 00-00-00)
        Count: 1
        #219: len 44 (352 Kb/s)
        Latency: 1 msec (1-2 msec ~1 msec)
> HCI Event: Number of Completed Packets (0x13) plen 5     #223 [hci1] 6.092824
        Num handles: 1
        Handle: 1810 Address: 00:00:00:00:00:00 (OUI 00-00-00)
        Count: 1
        #220: len 44 (176 Kb/s)
        Latency: 2 msec (1-2 msec ~2 msec)
< ISO Data TX: Handle 1810 flags 0x02 dlen 44              #224 [hci1] 6.110317
< ISO Data TX: Handle 983 flags 0x02 dlen 44               #225 [hci1] 6.110414
< ISO Data TX: Handle 1810 flags 0x02 dlen 44              #226 [hci1] 6.110510
> HCI Event: Number of Completed Packets (0x13) plen 5     #227 [hci1] 6.111506
        Num handles: 1
        Handle: 1810 Address: 00:00:00:00:00:00 (OUI 00-00-00)
        Count: 1
        #224: len 44 (352 Kb/s)
        Latency: 1 msec (1-2 msec ~1 msec)
> HCI Event: Number of Completed Packets (0x13) plen 5     #228 [hci1] 6.112310
        Num handles: 1
        Handle: 983 Address: 00:00:00:00:00:00 (OUI 00-00-00)
        Count: 1
        #225: len 44 (352 Kb/s)
        Latency: 1 msec (1-2 msec ~1 msec)
> HCI Event: Number of Completed Packets (0x13) plen 5     #229 [hci1] 6.112811
        Num handles: 1
        Handle: 1810 Address: 00:00:00:00:00:00 (OUI 00-00-00)
        Count: 1
        #226: len 44 (176 Kb/s)
        Latency: 2 msec (1-2 msec ~1 msec)
< ISO Data TX: Handle 983 flags 0x02 dlen 44               #230 [hci1] 6.130482
< ISO Data TX: Handle 983 flags 0x02 dlen 44               #231 [hci1] 6.130582
< ISO Data TX: Handle 1810 flags 0x02 dlen 44              #232 [hci1] 6.130685
> HCI Event: Number of Completed Packets (0x13) plen 5     #233 [hci1] 6.131743
        Num handles: 1
        Handle: 983 Address: 00:00:00:00:00:00 (OUI 00-00-00)
        Count: 1
        #230: len 44 (352 Kb/s)
        Latency: 1 msec (1-2 msec ~1 msec)
> HCI Event: Number of Completed Packets (0x13) plen 5     #234 [hci1] 6.132483
        Num handles: 1
        Handle: 983 Address: 00:00:00:00:00:00 (OUI 00-00-00)
        Count: 1
        #231: len 44 (352 Kb/s)
        Latency: 1 msec (1-2 msec ~1 msec)
> HCI Event: Number of Completed Packets (0x13) plen 5     #235 [hci1] 6.132913
        Num handles: 1
        Handle: 1810 Address: 00:00:00:00:00:00 (OUI 00-00-00)
        Count: 1
        #232: len 44 (176 Kb/s)
        Latency: 2 msec (1-2 msec ~2 msec)
< ISO Data TX: Handle 1810 flags 0x02 dlen 44              #236 [hci1] 6.150377
< ISO Data TX: Handle 983 flags 0x02 dlen 44               #237 [hci1] 6.150612
< ISO Data TX: Handle 1810 flags 0x02 dlen 44              #238 [hci1] 6.150718
> HCI Event: Number of Completed Packets (0x13) plen 5     #239 [hci1] 6.151736
        Num handles: 1
        Handle: 1810 Address: 00:00:00:00:00:00 (OUI 00-00-00)
        Count: 1
        #236: len 44 (352 Kb/s)
        Latency: 1 msec (1-2 msec ~1 msec)
> HCI Event: Number of Completed Packets (0x13) plen 5     #240 [hci1] 6.152405
        Num handles: 1
        Handle: 983 Address: 00:00:00:00:00:00 (OUI 00-00-00)
        Count: 1
        #237: len 44 (352 Kb/s)
        Latency: 1 msec (1-2 msec ~1 msec)
> HCI Event: Number of Completed Packets (0x13) plen 5     #241 [hci1] 6.152900
        Num handles: 1
        Handle: 1810 Address: 00:00:00:00:00:00 (OUI 00-00-00)
        Count: 1
        #238: len 44 (176 Kb/s)
        Latency: 2 msec (1-2 msec ~1 msec)
< ISO Data TX: Handle 983 flags 0x02 dlen 44               #242 [hci1] 6.170504
< ISO Data TX: Handle 983 flags 0x02 dlen 44               #243 [hci1] 6.170616
< ISO Data TX: Handle 1810 flags 0x02 dlen 44              #244 [hci1] 6.170689
> HCI Event: Number of Completed Packets (0x13) plen 5     #245 [hci1] 6.171760
        Num handles: 1
        Handle: 983 Address: 00:00:00:00:00:00 (OUI 00-00-00)
        Count: 1
        #242: len 44 (352 Kb/s)
        Latency: 1 msec (1-2 msec ~1 msec)
