Bluetooth monitor ver 5.72
= Note: Linux version 6.14.0-36-generic (x86_64)                       0.081517
= Note: Bluetooth subsystem version 2.22                               0.081520
= New Index: 00:00:00:00:00:00 (Primary,UART,hci1)              [hci1] 0.081521
= New Index: 48:5F:99:8E:E0:64 (Primary,USB,hci0)               [hci0] 0.081521
= Open Index: 00:00:00:00:00:00                                 [hci1] 0.594757
= Index Info: 00:00:00:00:00:00 (Nordic Semiconductor ASA)      [hci1] 0.594762
@ USER Open: main (privileged) version 2.22            {0x0001} [hci1] 0.594765
< HCI Command: Reset (0x03|0x0003) plen 0                    #1 [hci1] 0.595187
> HCI Event: Command Complete (0x0e) plen 4                  #2 [hci1] 0.595683
      Reset (0x03|0x0003) ncmd 1
        Status: Success (0x00)
< HCI Command: Read Local Supported... (0x04|0x0003) plen 0  #3 [hci1] 0.614738
> HCI Event: Command Complete (0x0e) plen 12                 #4 [hci1] 0.615247
      Read Local Supported Features (0x04|0x0003) ncmd 1
        Status: Success (0x00)
        Features: 0x00 0x00 0x00 0x00 0x60 0x00 0x00 0x00
          BR/EDR Not Supported
          LE Supported (Controller)
< HCI Command: Read Local Version In.. (0x04|0x0001) plen 0  #5 [hci1] 0.634700
> HCI Event: Command Complete (0x0e) plen 12                 #6 [hci1] 0.635178
      Read Local Version Information (0x04|0x0001) ncmd 1
        Status: Success (0x00)
        HCI version: Reserved (0x0f) - Revision 12393 (0x3069)
        LMP version: Reserved (0x0f) - Subversion 12393 (0x3069)
        Manufacturer: Nordic Semiconductor ASA (89)
< HCI Command: Read Local Supported... (0x04|0x0002) plen 0  #7 [hci1] 0.654675
> HCI Event: Command Complete (0x0e) plen 68                 #8 [hci1] 0.655733
      Read Local Supported Commands (0x04|0x0002) ncmd 1
        Status: Success (0x00)
        Commands: 119 entries
          Disconnect (Octet 0 - Bit 5)
          Read Remote Version Information (Octet 2 - Bit 7)
          Set Event Mask (Octet 5 - Bit 6)
          Reset (Octet 5 - Bit 7)
          Read Connection Accept Timeout (Octet 7 - Bit 2)
          Write Connection Accept Timeout (Octet 7 - Bit 3)
          Read Transmit Power Level (Octet 10 - Bit 2)
          Set Controller To Host Flow Control (Octet 10 - Bit 5)
          Host Buffer Size (Octet 10 - Bit 6)
          Host Number of Completed Packets (Octet 10 - Bit 7)
          Read Local Version Information (Octet 14 - Bit 3)
          Read Local Supported Features (Octet 14 - Bit 5)
          Read BD ADDR (Octet 15 - Bit 1)
          Read RSSI (Octet 15 - Bit 5)
          Set Event Mask Page 2 (Octet 22 - Bit 2)
          LE Set Event Mask (Octet 25 - Bit 0)
          LE Read Buffer Size (Octet 25 - Bit 1)
          LE Read Local Supported Features (Octet 25 - Bit 2)
          LE Set Random Address (Octet 25 - Bit 4)
          LE Set Advertising Parameters (Octet 25 - Bit 5)
          LE Read Advertising Channel TX Power (Octet 25 - Bit 6)
          LE Set Advertising Data (Octet 25 - Bit 7)
          LE Set Scan Response Data (Octet 26 - Bit 0)
          LE Set Advertise Enable (Octet 26 - Bit 1)
          LE Set Scan Parameters (Octet 26 - Bit 2)
          LE Set Scan Enable (Octet 26 - Bit 3)
          LE Create Connection (Octet 26 - Bit 4)
          LE Create Connection Cancel (Octet 26 - Bit 5)
          LE Read Accept List Size (Octet 26 - Bit 6)
          LE Clear Accept List (Octet 26 - Bit 7)
          LE Add Device To Accept List (Octet 27 - Bit 0)
          LE Remove Device From Accept List (Octet 27 - Bit 1)
          LE Connection Update (Octet 27 - Bit 2)
          LE Set Host Channel Classification (Octet 27 - Bit 3)
          LE Read Channel Map (Octet 27 - Bit 4)
          LE Read Remote Used Features (Octet 27 - Bit 5)
          LE Encrypt (Octet 27 - Bit 6)
          LE Rand (Octet 27 - Bit 7)
          LE Start Encryption (Octet 28 - Bit 0)
          LE Long Term Key Request Reply (Octet 28 - Bit 1)
          LE Long Term Key Request Neg Reply (Octet 28 - Bit 2)
          LE Read Supported States (Octet 28 - Bit 3)
          LE Receiver Test (Octet 28 - Bit 4)
          LE Transmitter Test (Octet 28 - Bit 5)
          LE Test End (Octet 28 - Bit 6)
          Read Authenticated Payload Timeout (Octet 32 - Bit 4)
          Write Authenticated Payload Timeout (Octet 32 - Bit 5)
          LE Set Data Length (Octet 33 - Bit 6)
          LE Read Suggested Default Data Length (Octet 33 - Bit 7)
          LE Write Suggested Default Data Length (Octet 34 - Bit 0)
          LE Add Device To Resolving List (Octet 34 - Bit 3)
          LE Remove Device From Resolving List (Octet 34 - Bit 4)
          LE Clear Resolving List (Octet 34 - Bit 5)
          LE Read Resolving List Size (Octet 34 - Bit 6)
          LE Set Address Resolution Enable (Octet 35 - Bit 1)
          LE Set Resolvable Private Address Timeout (Octet 35 - Bit 2)
          LE Read Maximum Data Length (Octet 35 - Bit 3)
          LE Read PHY (Octet 35 - Bit 4)
          LE Set Default PHY (Octet 35 - Bit 5)
          LE Set PHY (Octet 35 - Bit 6)
          LE Enhanced Receiver Test (Octet 35 - Bit 7)
          LE Enhanced Transmitter Test (Octet 36 - Bit 0)
          LE Set Advertising Set Random Address (Octet 36 - Bit 1)
          LE Set Extended Advertising Parameters (Octet 36 - Bit 2)
          LE Set Extended Advertising Data (Octet 36 - Bit 3)
          LE Set Extended Scan Response Data (Octet 36 - Bit 4)
          LE Set Extended Advertising Enable (Octet 36 - Bit 5)
          LE Read Maximum Advertising Data Length (Octet 36 - Bit 6)
          LE Read Number of Supported Advertising Sets (Octet 36 - Bit 7)
          LE Remove Advertising Set (Octet 37 - Bit 0)
          LE Clear Advertising Sets (Octet 37 - Bit 1)
          LE Set Periodic Advertising Parameters (Octet 37 - Bit 2)
          LE Set Periodic Advertising Data (Octet 37 - Bit 3)
          LE Set Periodic Advertising Enable (Octet 37 - Bit 4)
          LE Set Extended Scan Parameters (Octet 37 - Bit 5)
          LE Set Extended Scan Enable (Octet 37 - Bit 6)
          LE Extended Create Connection (Octet 37 - Bit 7)
          LE Periodic Advertising Create Sync (Octet 38 - Bit 0)
          LE Periodic Advertising Create Sync Cancel (Octet 38 - Bit 1)
          LE Periodic Advertising Terminate Sync (Octet 38 - Bit 2)
          LE Add Device To Periodic Advertiser List (Octet 38 - Bit 3)
          LE Remove Device From Periodic Advertiser List (Octet 38 - Bit 4)
          LE Clear Periodic Advertiser List (Octet 38 - Bit 5)
          LE Read Periodic Advertiser List Size (Octet 38 - Bit 6)
          LE Read Transmit Power (Octet 38 - Bit 7)
          LE Read RF Path Compensation (Octet 39 - Bit 0)
          LE Write RF Path Compensation (Octet 39 - Bit 1)
          LE Set Privacy Mode (Octet 39 - Bit 2)
          LE Periodic Advertising Receive Enable (Octet 40 - Bit 5)
          LE Periodic Advertising Sync Transfer (Octet 40 - Bit 6)
          LE Periodic Advertising Set Info Transfer (Octet 40 - Bit 7)
          LE Periodic Advertising Sync Transfer Parameters (Octet 41 - Bit 0)
          LE Set Default Periodic Advertisng Sync Transfer Parameters (Octet 41 - Bit 1)
          LE Read Buffer v2 (Octet 41 - Bit 5)
          LE Read ISO TX Sync (Octet 41 - Bit 6)
          LE Set Connected Isochronous Group Parameters (Octet 41 - Bit 7)
          LE Set Connected Isochronous Group Parameters Test (Octet 42 - Bit 0)
          LE Create Connected Isochronous Stream (Octet 42 - Bit 1)
          LE Remove Connected Isochronous Group (Octet 42 - Bit 2)
          LE Accept Connected Isochronous Stream Request (Octet 42 - Bit 3)
          LE Reject Connected Isochronous Stream Request (Octet 42 - Bit 4)
          LE Create Broadcast Isochronous Group (Octet 42 - Bit 5)
          LE Create Broadcast Isochronous Group Test (Octet 42 - Bit 6)
          LE Terminate Broadcast Isochronous Group (Octet 42 - Bit 7)
          LE Broadcast Isochronous Group Create Sync (Octet 43 - Bit 0)
          LE Broadcast Isochronous Group Terminate Sync (Octet 43 - Bit 1)
          LE Request Peer SCA (Octet 43 - Bit 2)
          LE Setup Isochronous Data Path (Octet 43 - Bit 3)
          LE Remove Isochronous Data Path (Octet 43 - Bit 4)
          LE Isochronous Transmit Test (Octet 43 - Bit 5)
          LE Isochronous Receive Test (Octet 43 - Bit 6)
          LE Isochronous Read Test Counters (Octet 43 - Bit 7)
          LE Isochronous Read Test Counters (Octet 44 - Bit 0)
          LE Set Host Feature (Octet 44 - Bit 1)
          Octet 44 - Bit 2 
          Octet 45 - Bit 6 
          Octet 46 - Bit 0 
          Octet 46 - Bit 1 
          Octet 46 - Bit 2 
< HCI Command: Host Buffer Size (0x03|0x0033) plen 7         #9 [hci1] 0.674703
        ACL MTU: 255  ACL max packet: 16
        SCO MTU: 0    SCO max packet: 0
> HCI Event: Command Complete (0x0e) plen 4                 #10 [hci1] 0.675205
      Host Buffer Size (0x03|0x0033) ncmd 1
        Status: Success (0x00)
< HCI Command: Set Controller To Ho.. (0x03|0x0031) plen 1  #11 [hci1] 0.694684
        Flow control: ACL Data Packets (0x01)
> HCI Event: Command Complete (0x0e) plen 4                 #12 [hci1] 0.695195
      Set Controller To Host Flow Control (0x03|0x0031) ncmd 1
        Status: Success (0x00)
< HCI Command: LE Read Local Suppor.. (0x08|0x0003) plen 0  #13 [hci1] 0.714687
> HCI Event: Command Complete (0x0e) plen 12                #14 [hci1] 0.715266
      LE Read Local Supported Features (0x08|0x0003) ncmd 1
        Status: Success (0x00)
        Features: 0xfd 0x79 0x00 0xf7 0x30 0x01 0x00 0x00
          LE Encryption
          Extended Reject Indication
          Peripheral-initiated Features Exchange
          LE Ping
          LE Data Packet Length Extension
          LL Privacy
          Extended Scanner Filter Policies
          LE 2M PHY
          LE Coded PHY
          LE Extended Advertising
          LE Periodic Advertising
          Channel Selection Algorithm #2
          Periodic Advertising Sync Transfer - Sender
          Periodic Advertising Sync Transfer - Recipient
          Sleep Clock Accuracy Updates
          Connected Isochronous Stream - Central
          Connected Isochronous Stream - Peripheral
          Isochronous Broadcaster
          Synchronized Receiver
          Periodic Advertising ADI support
          Connection Subrating
          Unknown features (0x0000010000000000)
< HCI Command: LE Set Host Feature (0x08|0x0074) plen 2     #15 [hci1] 0.734726
        Bit Number: 32
          Connected Isochronous Stream (Host Support)
        Bit Value: 1
> HCI Event: Command Complete (0x0e) plen 4                 #16 [hci1] 0.735105
      LE Set Host Feature (0x08|0x0074) ncmd 1
        Status: Success (0x00)
< HCI Command: LE Read Buffer v2 (0x08|0x0060) plen 0       #17 [hci1] 0.754691
> HCI Event: Command Complete (0x0e) plen 10                #18 [hci1] 0.755125
      LE Read Buffer v2 (0x08|0x0060) ncmd 1
        Status: Success (0x00)
        ACL MTU: 27
        ACL max packet: 3
        ISO MTU: 318
        ISO max packet: 3
< HCI Command: LE Read Maximum Adve.. (0x08|0x003a) plen 0  #19 [hci1] 0.774719
> HCI Event: Command Complete (0x0e) plen 6                 #20 [hci1] 0.775180
      LE Read Maximum Advertising Data Length (0x08|0x003a) ncmd 1
        Status: Success (0x00)
        Max length: 1650
< HCI Command: LE Read Supported St.. (0x08|0x001c) plen 0  #21 [hci1] 0.794696
> HCI Event: Command Complete (0x0e) plen 12                #22 [hci1] 0.795220
      LE Read Supported States (0x08|0x001c) ncmd 1
        Status: Success (0x00)
        States: 0x000003ff3e0306ff
          Non-connectable Advertising State
          Scannable Advertising State
          Connectable Advertising State
          High Duty Cycle Directed Advertising State
          Passive Scanning State
          Active Scanning State
          Initiating State
            and Connection State (Central Role)
          Connection State (Peripheral Role)
          Scannable Advertising State
            and Passive Scanning State
          Connectable Advertising State
            and Passive Scanning State
          Non-connectable Advertising State
            and Initiating State
          Scannable Advertising State
            and Initiating State
          Active Scanning State
            and Connection State (Central Role)
          Passive Scanning State
            and Connection State (Peripheral Role)
          Active Scanning State
            and Connection State (Peripheral Role)
          Initiating State
            and Connection State (Central Role)
            and Central Role & Central Role
          Low Duty Cycle Directed Advertising State
          Connectable Advertising State
            and Initiating State
            and Central Role & Peripheral Role
          High Duty Cycle Directed Advertising State
            and Initiating State
            and Central Role & Peripheral Role
          Low Duty Cycle Directed Advertising State
            and Initiating State
            and Central Role & Peripheral Role
          Connectable Advertising State
            and Connection State (Central Role)
            and Central Role & Peripheral Role
          High Duty Cycle Directed Advertising State
            and Connection State (Central Role)
            and Central Role & Peripheral Role
          Low Duty Cycle Directed Advertising State
            and Connection State (Central Role)
            and Central Role & Peripheral Role
          Connectable Advertising State
            and Connection State (Peripheral Role)
            and Central Role & Peripheral Role
          High Duty Cycle Directed Advertising State
            and Connection State (Peripheral Role)
            and Peripheral Role & Peripheral Role
          Low Duty Cycle Directed Advertising State
            and Connection State (Peripheral Role)
            and Peripheral Role & Peripheral Role
          Initiating State
            and Connection State (Peripheral Role)
            and Central Role & Peripheral Role
< HCI Command: LE Read Maximum Data.. (0x08|0x002f) plen 0  #23 [hci1] 0.814719
> HCI Event: Command Complete (0x0e) plen 12                #24 [hci1] 0.815282
      LE Read Maximum Data Length (0x08|0x002f) ncmd 1
        Status: Success (0x00)
        Max TX octets: 251
        Max TX time: 2704
        Max RX octets: 251
        Max RX time: 2704
< HCI Command: LE Write Suggested D.. (0x08|0x0024) plen 4  #25 [hci1] 0.834710
        TX octets: 251
        TX time: 2704
> HCI Event: Command Complete (0x0e) plen 4                 #26 [hci1] 0.835254
      LE Write Suggested Default Data Length (0x08|0x0024) ncmd 1
        Status: Success (0x00)
< HCI Command: LE Read Resolving Li.. (0x08|0x002a) plen 0  #27 [hci1] 0.854665
> HCI Event: Command Complete (0x0e) plen 5                 #28 [hci1] 0.855037
      LE Read Resolving List Size (0x08|0x002a) ncmd 1
        Status: Success (0x00)
        Size: 8
< HCI Command: LE Set Event Mask (0x08|0x0001) plen 8       #29 [hci1] 0.874799
        Mask: 0x000002023f87fa5e
          LE Advertising Report
          LE Connection Update Complete
          LE Read Remote Used Features Complete
          LE Long Term Key Request
          LE Data Length Change
          LE Enhanced Connection Complete
          LE PHY Update Complete
          LE Extended Advertising Report
          LE Periodic Advertising Sync Established
          LE Periodic Advertising Report
          LE Periodic Advertising Sync Lost
          LE Extended Scan Timeout
          LE Extended Advertising Set Terminated
          LE Scan Request Received
          LE Periodic Advertising Sync Transfer Rvc
          LE CIS Established
          LE CIS Request
          LE Create BIG Complete
          LE Terminate BIG Complete
          LE BIG Sync Estabilished Complete
          LE BIG Sync Lost
          LE BIG Info Advertising Report
          Unknown mask (0x0000020000000000)
> HCI Event: Command Complete (0x0e) plen 4                 #30 [hci1] 0.875336
      LE Set Event Mask (0x08|0x0001) ncmd 1
        Status: Success (0x00)
< HCI Command: Set Event Mask (0x03|0x0001) plen 8          #31 [hci1] 0.894700
        Mask: 0x2000800002008890
          Disconnection Complete
          Encryption Change
          Read Remote Version Information Complete
          Hardware Error
          Data Buffer Overflow
          Encryption Key Refresh Complete
          LE Meta
> HCI Event: Command Complete (0x0e) plen 4                 #32 [hci1] 0.895208
      Set Event Mask (0x03|0x0001) ncmd 1
        Status: Success (0x00)
< HCI Command: Read BD ADDR (0x04|0x0009) plen 0            #33 [hci1] 0.914697
> HCI Event: Command Complete (0x0e) plen 10                #34 [hci1] 0.915199
      Read BD ADDR (0x04|0x0009) ncmd 1
        Status: Success (0x00)
        Address: 00:00:00:00:00:00 (OUI 00-00-00)
< HCI Command: LE Set Random Address (0x08|0x0005) plen 6   #35 [hci1] 0.934726
        Address: D5:B6:CC:31:DB:3B (Static)
> HCI Event: Command Complete (0x0e) plen 4                 #36 [hci1] 0.935258
      LE Set Random Address (0x08|0x0005) ncmd 1
        Status: Success (0x00)
< HCI Command: LE Set Extended Adv.. (0x08|0x0036) plen 25  #37 [hci1] 2.775435
        Handle: 0x00
        Properties: 0x0001
          Connectable
        Min advertising interval: 100.000 msec (0x00a0)
        Max advertising interval: 150.000 msec (0x00f0)
        Channel map: 37, 38, 39 (0x07)
        Own address type: Random (0x01)
        Peer address type: Public (0x00)
        Peer address: 00:00:00:00:00:00 (OUI 00-00-00)
        Filter policy: Allow Scan Request from Any, Allow Connect Request from Any (0x00)
        TX power: Host has no preference (0x7f)
        Primary PHY: LE 1M (0x01)
        Secondary max skip: 0x00
        Secondary PHY: LE 2M (0x02)
        SID: 0x00
        Scan request notifications: Disabled (0x00)
> HCI Event: Command Complete (0x0e) plen 5                 #38 [hci1] 2.776183
      LE Set Extended Advertising Parameters (0x08|0x0036) ncmd 1
        Status: Success (0x00)
        TX power (selected): 0 dbm (0x00)
< HCI Command: LE Set Advertising S.. (0x08|0x0035) plen 7  #39 [hci1] 2.794640
        Advertising handle: 0x00
        Advertising random address: D5:B6:CC:31:DB:3B (Static)
> HCI Event: Command Complete (0x0e) plen 4                 #40 [hci1] 2.795080
      LE Set Advertising Set Random Address (0x08|0x0035) ncmd 1
        Status: Success (0x00)
< HCI Command: LE Set Extended Adv.. (0x08|0x0037) plen 30  #41 [hci1] 2.814711
        Handle: 0x00
        Operation: Complete extended advertising data (0x03)
        Fragment preference: Minimize fragmentation (0x01)
        Data length: 0x1a
        Flags: 0x06
          LE General Discoverable Mode
          BR/EDR Not Supported
        Service Data: Common Audio (0x1853)
          Data: 01
        Service Data: Audio Stream Control (0x184e)
          Data: 014602420000
        Resolvable Set Identifier: 48-61-8E-0C-80-97
          Hash: 0x c8097
          Random: 0x48618e
> HCI Event: Command Complete (0x0e) plen 4                 #42 [hci1] 2.815683
      LE Set Extended Advertising Data (0x08|0x0037) ncmd 1
        Status: Success (0x00)
< HCI Command: LE Set Extended Adve.. (0x08|0x0039) plen 6  #43 [hci1] 2.834667
        Extended advertising: Enabled (0x01)
        Number of sets: 1 (0x01)
        Entry 0
          Handle: 0x00
          Duration: 0 ms (0x00)
          Max ext adv events: 0
> HCI Event: Command Complete (0x0e) plen 4                 #44 [hci1] 2.835173
      LE Set Extended Advertising Enable (0x08|0x0039) ncmd 1
        Status: Success (0x00)
> HCI Event: LE Meta Event (0x3e) plen 31                   #45 [hci1] 4.832261
      LE Enhanced Connection Complete (0x0a)
        Status: Success (0x00)
        Handle: 93
        Role: Peripheral (0x01)
        Peer address type: Public (0x00)
        Peer address: DF:A9:FF:F6:B1:1A (OUI DF-A9-FF)
        Local resolvable private address: 00:00:00:00:00:00 (Non-Resolvable)
        Peer resolvable private address: 00:00:00:00:00:00 (Non-Resolvable)
        Connection interval: 100.00 msec (0x0050)
        Connection latency: 0 (0x0000)
        Supervision timeout: 25120 msec (0x09d0)
        Central clock accuracy: 0x01
> HCI Event: LE Meta Event (0x3e) plen 6                    #46 [hci1] 4.832306
      LE Advertising Set Terminated (0x12)
        Status: Success (0x00)
        Handle: 0
        Connection handle: 93
        Number of completed extended advertising events: 0
< HCI Command: LE Read Remote Used... (0x08|0x0016) plen 2  #47 [hci1] 4.835051
        Handle: 93 Address: DF:A9:FF:F6:B1:1A (OUI DF-A9-FF)
< ACL Data TX: Handle 93 flags 0x00 dlen 7                  #48 [hci1] 4.835059
      ATT: Exchange MTU Request (0x02) len 2
        Client RX MTU: 251
> HCI Event: Command Status (0x0f) plen 4                   #49 [hci1] 4.835660
      LE Read Remote Used Features (0x08|0x0016) ncmd 1
        Status: Success (0x00)
> HCI Event: Number of Completed Packets (0x13) plen 5      #50 [hci1] 5.034284
        Num handles: 1
        Handle: 93 Address: DF:A9:FF:F6:B1:1A (OUI DF-A9-FF)
        Count: 1
        #48: len 7 (0 Kb/s)
        Latency: 199 msec (199-199 msec ~199 msec)
> HCI Event: LE Meta Event (0x3e) plen 12                   #51 [hci1] 5.134557
      LE Read Remote Used Features (0x04)
        Status: Success (0x00)
        Handle: 93 Address: DF:A9:FF:F6:B1:1A (OUI DF-A9-FF)
        Features: 0x2d 0x49 0x00 0xf7 0x67 0xd8 0x00 0x00
          LE Encryption
          Extended Reject Indication
          Peripheral-initiated Features Exchange
          LE Data Packet Length Extension
          LE 2M PHY
          LE Coded PHY
          Channel Selection Algorithm #2
          Periodic Advertising Sync Transfer - Sender
          Periodic Advertising Sync Transfer - Recipient
          Sleep Clock Accuracy Updates
          Connected Isochronous Stream - Central
          Connected Isochronous Stream - Peripheral
          Isochronous Broadcaster
          Synchronized Receiver
          Connected Isochronous Stream (Host Support)
          LE Power Control Request
          LE Power Control Request
          Connection Subrating
          Connection Subrating (Host Support)
          Unknown features (0x0000d80000000000)
> ACL Data RX: Handle 93 flags 0x02 dlen 7                  #52 [hci1] 5.634365
      ATT: Exchange MTU Request (0x02) len 2
        Client RX MTU: 64
< HCI Command: Host Number of Compl.. (0x03|0x0035) plen 5  #53 [hci1] 5.634672
        Num handles: 1
        Handle: 93 Address: DF:A9:FF:F6:B1:1A (OUI DF-A9-FF)
        Count: 1
< ACL Data TX: Handle 93 flags 0x00 dlen 7                  #54 [hci1] 5.634698
      ATT: Exchange MTU Response (0x03) len 2
        Server RX MTU: 251
> ACL Data RX: Handle 93 flags 0x02 dlen 7                  #55 [hci1] 5.634709
      ATT: Exchange MTU Response (0x03) len 2
        Server RX MTU: 64
< HCI Command: Host Number of Compl.. (0x03|0x0035) plen 5  #56 [hci1] 5.654779
        Num handles: 1
        Handle: 93 Address: DF:A9:FF:F6:B1:1A (OUI DF-A9-FF)
        Count: 1
> HCI Event: Number of Completed Packets (0x13) plen 5      #57 [hci1] 5.834166
        Num handles: 1
        Handle: 93 Address: DF:A9:FF:F6:B1:1A (OUI DF-A9-FF)
        Count: 1
        #54: len 7 (0 Kb/s)
        Latency: 199 msec (199-199 msec ~199 msec)
> ACL Data RX: Handle 93 flags 0x02 dlen 11                 #58 [hci1] 7.834188
      SMP: Pairing Request (0x01) len 6
        IO capability: KeyboardDisplay (0x04)
        OOB data: Authentication data not present (0x00)
        Authentication requirement: Bonding, No MITM, SC, No Keypresses (0x09)
        Max encryption key size: 16
        Initiator key distribution: EncKey IdKey Sign (0x07)
        Responder key distribution: EncKey IdKey Sign (0x07)
< HCI Command: Host Number of Compl.. (0x03|0x0035) plen 5  #59 [hci1] 7.835022
        Num handles: 1
        Handle: 93 Address: DF:A9:FF:F6:B1:1A (OUI DF-A9-FF)
        Count: 1
< ACL Data TX: Handle 93 flags 0x00 dlen 11                 #60 [hci1] 7.835189
      SMP: Pairing Response (0x02) len 6
        IO capability: NoInputNoOutput (0x03)
        OOB data: Authentication data not present (0x00)
        Authentication requirement: Bonding, No MITM, SC, No Keypresses (0x09)
        Max encryption key size: 16
        Initiator key distribution: IdKey (0x02)
        Responder key distribution: <none> (0x00)
> HCI Event: Number of Completed Packets (0x13) plen 5      #61 [hci1] 8.034300
        Num handles: 1
        Handle: 93 Address: DF:A9:FF:F6:B1:1A (OUI DF-A9-FF)
        Count: 1
        #60: len 11 (0 Kb/s)
        Latency: 199 msec (199-199 msec ~199 msec)
> ACL Data RX: Handle 93 flags 0x02 dlen 27                 #62 [hci1] 8.034543
> ACL Data RX: Handle 93 flags 0x01 dlen 27                 #63 [hci1] 8.035048
> ACL Data RX: Handle 93 flags 0x01 dlen 15                 #64 [hci1] 8.035242
      SMP: Pairing Public Key (0x0c) len 64
        X: df92e5ae7ae28fdb7d09a76b65d98615ab17884000c7808d1efd39c3183cb30b
        Y: a0bb110bfb48fa9949ef9ac0faa7857ce0342e1797482855df4f7b6fa463d8ad
< HCI Command: Host Number of Compl.. (0x03|0x0035) plen 5  #65 [hci1] 8.055109
        Num handles: 1
        Handle: 93 Address: DF:A9:FF:F6:B1:1A (OUI DF-A9-FF)
        Count: 1
< HCI Command: Host Number of Compl.. (0x03|0x0035) plen 5  #66 [hci1] 8.055268
        Num handles: 1
        Handle: 93 Address: DF:A9:FF:F6:B1:1A (OUI DF-A9-FF)
        Count: 1
< HCI Command: Host Number of Compl.. (0x03|0x0035) plen 5  #67 [hci1] 8.055522
        Num handles: 1
        Handle: 93 Address: DF:A9:FF:F6:B1:1A (OUI DF-A9-FF)
        Count: 1
< ACL Data TX: Handle 93 flags 0x00 dlen 27                 #68 [hci1] 8.055649
< ACL Data TX: Handle 93 flags 0x01 dlen 27                 #69 [hci1] 8.055663
< ACL Data TX: Handle 93 flags 0x01 dlen 15                 #70 [hci1] 8.055686
      SMP: Pairing Public Key (0x0c) len 64
        X: 98308440221e2d910f0e54b71e7ec652857aa9b5a0dc65028824cc19db1226e9
        Y: 67a4816bcb62efb21701e31fdb27561a6217575fb007a8bbdabe7e28b6f68482
> HCI Event: Number of Completed Packets (0x13) plen 5      #71 [hci1] 8.134558
        Num handles: 1
        Handle: 93 Address: DF:A9:FF:F6:B1:1A (OUI DF-A9-FF)
        Count: 1
        #68: len 27 (2 Kb/s)
        Latency: 78 msec (78-199 msec ~139 msec)
> HCI Event: Number of Completed Packets (0x13) plen 5      #72 [hci1] 8.135043
        Num handles: 1
        Handle: 93 Address: DF:A9:FF:F6:B1:1A (OUI DF-A9-FF)
        Count: 1
        #69: len 27 (2 Kb/s)
        Latency: 79 msec (78-199 msec ~109 msec)
< ACL Data TX: Handle 93 flags 0x00 dlen 21                 #73 [hci1] 8.135126
      SMP: Pairing Confirm (0x03) len 16
        Confim value: 54133e693be5bfe772ea54689a921bc2
> HCI Event: Number of Completed Packets (0x13) plen 5      #74 [hci1] 8.234187
        Num handles: 1
        Handle: 93 Address: DF:A9:FF:F6:B1:1A (OUI DF-A9-FF)
        Count: 1
        #70: len 15 (0 Kb/s)
        Latency: 178 msec (78-199 msec ~143 msec)
> HCI Event: Number of Completed Packets (0x13) plen 5      #75 [hci1] 8.334472
        Num handles: 1
        Handle: 93 Address: DF:A9:FF:F6:B1:1A (OUI DF-A9-FF)
        Count: 1
        #73: len 21 (0 Kb/s)
        Latency: 199 msec (78-199 msec ~171 msec)
> ACL Data RX: Handle 93 flags 0x02 dlen 21                 #76 [hci1] 8.334500
      SMP: Pairing Random (0x04) len 16
        Random value: 63279a597af69c490000000000000000
< HCI Command: Host Number of Compl.. (0x03|0x0035) plen 5  #77 [hci1] 8.335373
        Num handles: 1
        Handle: 93 Address: DF:A9:FF:F6:B1:1A (OUI DF-A9-FF)
        Count: 1
< ACL Data TX: Handle 93 flags 0x00 dlen 21                 #78 [hci1] 8.335497
      SMP: Pairing Random (0x04) len 16
        Random value: f966a694cbe26df70bb96773e6cc6f5d
> HCI Event: Number of Completed Packets (0x13) plen 5      #79 [hci1] 8.534142
        Num handles: 1
        Handle: 93 Address: DF:A9:FF:F6:B1:1A (OUI DF-A9-FF)
        Count: 1
        #78: len 21 (0 Kb/s)
        Latency: 198 msec (78-199 msec ~185 msec)
> ACL Data RX: Handle 93 flags 0x02 dlen 21                 #80 [hci1] 8.734335
      SMP: Pairing DHKey Check (0x0d) len 16
        E: b13761ca968557f518006b515b39fe4d
< HCI Command: Host Number of Compl.. (0x03|0x0035) plen 5  #81 [hci1] 8.735070
        Num handles: 1
        Handle: 93 Address: DF:A9:FF:F6:B1:1A (OUI DF-A9-FF)
        Count: 1
< ACL Data TX: Handle 93 flags 0x00 dlen 21                 #82 [hci1] 8.735191
      SMP: Pairing DHKey Check (0x0d) len 16
        E: 525fa7d6786ec937d9acb2e8f68d5f46
> HCI Event: Number of Completed Packets (0x13) plen 5      #83 [hci1] 8.934089
        Num handles: 1
        Handle: 93 Address: DF:A9:FF:F6:B1:1A (OUI DF-A9-FF)
        Count: 1
        #82: len 21 (0 Kb/s)
        Latency: 198 msec (78-199 msec ~192 msec)
> HCI Event: LE Meta Event (0x3e) plen 13                   #84 [hci1] 9.034592
      LE Long Term Key Request (0x05)
        Handle: 93 Address: DF:A9:FF:F6:B1:1A (OUI DF-A9-FF)
        Random number: 0x0000000000000000
        Encrypted diversifier: 0x0000
< HCI Command: LE Long Term Key Re.. (0x08|0x001a) plen 18  #85 [hci1] 9.035016
        Handle: 93 Address: DF:A9:FF:F6:B1:1A (OUI DF-A9-FF)
        Long term key: c58834429cd0078b00aeffe9fb77e2e5
> HCI Event: Command Complete (0x0e) plen 6                 #86 [hci1] 9.035924
      LE Long Term Key Request Reply (0x08|0x001a) ncmd 1
        Status: Success (0x00)
        Handle: 93 Address: DF:A9:FF:F6:B1:1A (OUI DF-A9-FF)
> HCI Event: Encryption Change (0x08) plen 4                #87 [hci1] 9.534330
        Status: Success (0x00)
        Handle: 93 Address: DF:A9:FF:F6:B1:1A (OUI DF-A9-FF)
        Encryption: Enabled with AES-CCM (0x01)
> ACL Data RX: Handle 93 flags 0x02 dlen 21                 #88 [hci1] 9.634376
      SMP: Identity Information (0x08) len 16
        Identity resolving key: 90283502748160226dcb213a52d22cfe
< HCI Command: Host Number of Compl.. (0x03|0x0035) plen 5  #89 [hci1] 9.645377
        Num handles: 1
        Handle: 93 Address: DF:A9:FF:F6:B1:1A (OUI DF-A9-FF)
        Count: 1
> ACL Data RX: Handle 93 flags 0x02 dlen 12                 #90 [hci1] 9.834221
      SMP: Identity Address Information (0x09) len 7
        Address: DF:A9:FF:F6:B1:1A (OUI DF-A9-FF)
< HCI Command: LE Add Device To Re.. (0x08|0x0027) plen 39  #91 [hci1] 9.835301
        Address type: Public (0x00)
        Address: DF:A9:FF:F6:B1:1A (OUI DF-A9-FF)
        Peer identity resolving key: 90283502748160226dcb213a52d22cfe
        Local identity resolving key: 00000000000000000000000000000000
> HCI Event: Command Complete (0x0e) plen 4                 #92 [hci1] 9.836327
      LE Add Device To Resolving List (0x08|0x0027) ncmd 1
        Status: Success (0x00)
< HCI Command: LE Set Privacy Mode (0x08|0x004e) plen 8     #93 [hci1] 9.855023
        Peer Identity address type: Public (0x00)
        Peer Identity address: DF:A9:FF:F6:B1:1A (OUI DF-A9-FF)
        Privacy Mode: Use Device Privacy (0x01)
> HCI Event: Command Complete (0x0e) plen 4                 #94 [hci1] 9.855666
      LE Set Privacy Mode (0x08|0x004e) ncmd 1
        Status: Success (0x00)
< HCI Command: LE Set Address Resol.. (0x08|0x002d) plen 1  #95 [hci1] 9.875166
        Address resolution: Enabled (0x01)
> HCI Event: Command Complete (0x0e) plen 4                 #96 [hci1] 9.875685
      LE Set Address Resolution Enable (0x08|0x002d) ncmd 1
        Status: Success (0x00)
< HCI Command: Host Number of Compl.. (0x03|0x0035) plen 5  #97 [hci1] 9.894954
        Num handles: 1
        Handle: 93 Address: DF:A9:FF:F6:B1:1A (OUI DF-A9-FF)
        Count: 1
> ACL Data RX: Handle 93 flags 0x02 dlen 13                 #98 [hci1] 9.934259
      ATT: Find By Type Value Request (0x06) len 8
        Handle range: 0x0001-0xffff
        Attribute type: Primary Service (0x2800)
          UUID: Published Audio Capabilities (0x1850)
< HCI Command: Host Number of Compl.. (0x03|0x0035) plen 5  #99 [hci1] 9.935659
        Num handles: 1
        Handle: 93 Address: DF:A9:FF:F6:B1:1A (OUI DF-A9-FF)
        Count: 1
< ACL Data TX: Handle 93 flags 0x00 dlen 9                 #100 [hci1] 9.935852
      ATT: Find By Type Value Response (0x07) len 4
        Handle range: 0x012a-0x013c
> HCI Event: Number of Completed Packets (0x13) plen 5    #101 [hci1] 10.134131
        Num handles: 1
        Handle: 93 Address: DF:A9:FF:F6:B1:1A (OUI DF-A9-FF)
        Count: 1
        #100: len 9 (0 Kb/s)
        Latency: 198 msec (78-199 msec ~195 msec)
> ACL Data RX: Handle 93 flags 0x02 dlen 13               #102 [hci1] 10.134367
      ATT: Find By Type Value Request (0x06) len 8
        Handle range: 0x013d-0xffff
        Attribute type: Primary Service (0x2800)
          UUID: Published Audio Capabilities (0x1850)
< HCI Command: Host Number of Com.. (0x03|0x0035) plen 5  #103 [hci1] 10.135500
        Num handles: 1
        Handle: 93 Address: DF:A9:FF:F6:B1:1A (OUI DF-A9-FF)
        Count: 1
< ACL Data TX: Handle 93 flags 0x00 dlen 9                #104 [hci1] 10.135598
      ATT: Error Response (0x01) len 4
        Find By Type Value Request (0x06)
        Handle: 0x013d
        Error: Attribute Not Found (0x0a)
> HCI Event: Number of Completed Packets (0x13) plen 5    #105 [hci1] 10.334175
        Num handles: 1
        Handle: 93 Address: DF:A9:FF:F6:B1:1A (OUI DF-A9-FF)
        Count: 1
        #104: len 9 (0 Kb/s)
        Latency: 198 msec (78-199 msec ~196 msec)
> ACL Data RX: Handle 93 flags 0x02 dlen 11               #106 [hci1] 10.334324
      ATT: Read By Type Request (0x08) len 6
        Handle range: 0x012a-0x013c
        Attribute type: Characteristic (0x2803)
< HCI Command: Host Number of Com.. (0x03|0x0035) plen 5  #107 [hci1] 10.335168
        Num handles: 1
        Handle: 93 Address: DF:A9:FF:F6:B1:1A (OUI DF-A9-FF)
        Count: 1
< ACL Data TX: Handle 93 flags 0x00 dlen 27               #108 [hci1] 10.335203
< ACL Data TX: Handle 93 flags 0x01 dlen 21               #109 [hci1] 10.335294
      ATT: Read By Type Response (0x09) len 43
        Attribute data length: 7
        Attribute data list: 6 entries
        Handle: 0x012b
        Value: 122c01c92b
            Properties: 0x12
              Read (0x02)
              Notify (0x10)
            Value Handle: 0x012c
            Value UUID: Sink PAC (0x2bc9)
        Handle: 0x012e
        Value: 1a2f01ca2b
            Properties: 0x1a
              Read (0x02)
              Write (0x08)
              Notify (0x10)
            Value Handle: 0x012f
            Value UUID: Sink Audio Locations (0x2bca)
        Handle: 0x0131
        Value: 123201cb2b
            Properties: 0x12
              Read (0x02)
              Notify (0x10)
            Value Handle: 0x0132
            Value UUID: Source PAC (0x2bcb)
        Handle: 0x0134
        Value: 1a3501cc2b
            Properties: 0x1a
              Read (0x02)
              Write (0x08)
              Notify (0x10)
            Value Handle: 0x0135
            Value UUID: Source Audio Locations (0x2bcc)
        Handle: 0x0137
        Value: 123801cd2b
            Properties: 0x12
              Read (0x02)
              Notify (0x10)
            Value Handle: 0x0138
            Value UUID: Available Audio Contexts (0x2bcd)
        Handle: 0x013a
        Value: 123b01ce2b
            Properties: 0x12
              Read (0x02)
              Notify (0x10)
            Value Handle: 0x013b
            Value UUID: Supported Audio Contexts (0x2bce)
> HCI Event: Number of Completed Packets (0x13) plen 5    #110 [hci1] 10.434671
        Num handles: 1
        Handle: 93 Address: DF:A9:FF:F6:B1:1A (OUI DF-A9-FF)
        Count: 1
        #108: len 27 (2 Kb/s)
        Latency: 99 msec (78-199 msec ~148 msec)
> HCI Event: Number of Completed Packets (0x13) plen 5    #111 [hci1] 10.534158
        Num handles: 1
        Handle: 93 Address: DF:A9:FF:F6:B1:1A (OUI DF-A9-FF)
        Count: 1
        #109: len 21 (0 Kb/s)
        Latency: 198 msec (78-199 msec ~173 msec)
> ACL Data RX: Handle 93 flags 0x02 dlen 11               #112 [hci1] 10.534319
      ATT: Read By Type Request (0x08) len 6
        Handle range: 0x013b-0x013c
        Attribute type: Characteristic (0x2803)
< HCI Command: Host Number of Com.. (0x03|0x0035) plen 5  #113 [hci1] 10.534956
        Num handles: 1
        Handle: 93 Address: DF:A9:FF:F6:B1:1A (OUI DF-A9-FF)
        Count: 1
< ACL Data TX: Handle 93 flags 0x00 dlen 9                #114 [hci1] 10.534985
      ATT: Error Response (0x01) len 4
        Read By Type Request (0x08)
        Handle: 0x013b
        Error: Attribute Not Found (0x0a)
> HCI Event: Number of Completed Packets (0x13) plen 5    #115 [hci1] 10.734201
        Num handles: 1
        Handle: 93 Address: DF:A9:FF:F6:B1:1A (OUI DF-A9-FF)
        Count: 1
        #114: len 9 (0 Kb/s)
        Latency: 199 msec (78-199 msec ~186 msec)
> ACL Data RX: Handle 93 flags 0x02 dlen 9                #116 [hci1] 10.734309
      ATT: Find Information Request (0x04) len 4
        Handle range: 0x012d-0x012d
< HCI Command: Host Number of Com.. (0x03|0x0035) plen 5  #117 [hci1] 10.734968
        Num handles: 1
        Handle: 93 Address: DF:A9:FF:F6:B1:1A (OUI DF-A9-FF)
        Count: 1
< ACL Data TX: Handle 93 flags 0x00 dlen 10               #118 [hci1] 10.735039
      ATT: Find Information Response (0x05) len 5
        Format: UUID-16 (0x01)
        Handle: 0x012d
        UUID: Client Characteristic Configuration (0x2902)
> HCI Event: Number of Completed Packets (0x13) plen 5    #119 [hci1] 10.934181
        Num handles: 1
        Handle: 93 Address: DF:A9:FF:F6:B1:1A (OUI DF-A9-FF)
        Count: 1
        #118: len 10 (0 Kb/s)
        Latency: 199 msec (78-199 msec ~192 msec)
> ACL Data RX: Handle 93 flags 0x02 dlen 9                #120 [hci1] 10.934328
      ATT: Find Information Request (0x04) len 4
        Handle range: 0x0130-0x0130
< HCI Command: Host Number of Com.. (0x03|0x0035) plen 5  #121 [hci1] 10.934926
        Num handles: 1
        Handle: 93 Address: DF:A9:FF:F6:B1:1A (OUI DF-A9-FF)
        Count: 1
< ACL Data TX: Handle 93 flags 0x00 dlen 10               #122 [hci1] 10.935002
      ATT: Find Information Response (0x05) len 5
        Format: UUID-16 (0x01)
        Handle: 0x0130
        UUID: Client Characteristic Configuration (0x2902)
> HCI Event: Number of Completed Packets (0x13) plen 5    #123 [hci1] 11.134208
        Num handles: 1
        Handle: 93 Address: DF:A9:FF:F6:B1:1A (OUI DF-A9-FF)
        Count: 1
        #122: len 10 (0 Kb/s)
        Latency: 199 msec (78-199 msec ~195 msec)
> ACL Data RX: Handle 93 flags 0x02 dlen 9                #124 [hci1] 11.134250
      ATT: Find Information Request (0x04) len 4
        Handle range: 0x0133-0x0133
< HCI Command: Host Number of Com.. (0x03|0x0035) plen 5  #125 [hci1] 11.135284
        Num handles: 1
        Handle: 93 Address: DF:A9:FF:F6:B1:1A (OUI DF-A9-FF)
        Count: 1
< ACL Data TX: Handle 93 flags 0x00 dlen 10               #126 [hci1] 11.135518
      ATT: Find Information Response (0x05) len 5
        Format: UUID-16 (0x01)
        Handle: 0x0133
        UUID: Client Characteristic Configuration (0x2902)
> HCI Event: Number of Completed Packets (0x13) plen 5    #127 [hci1] 11.334054
        Num handles: 1
        Handle: 93 Address: DF:A9:FF:F6:B1:1A (OUI DF-A9-FF)
        Count: 1
        #126: len 10 (0 Kb/s)
        Latency: 198 msec (78-199 msec ~197 msec)
> ACL Data RX: Handle 93 flags 0x02 dlen 9                #128 [hci1] 11.334341
      ATT: Find Information Request (0x04) len 4
        Handle range: 0x0136-0x0136
< HCI Command: Host Number of Com.. (0x03|0x0035) plen 5  #129 [hci1] 11.335103
        Num handles: 1
        Handle: 93 Address: DF:A9:FF:F6:B1:1A (OUI DF-A9-FF)
        Count: 1
< ACL Data TX: Handle 93 flags 0x00 dlen 10               #130 [hci1] 11.335199
      ATT: Find Information Response (0x05) len 5
        Format: UUID-16 (0x01)
        Handle: 0x0136
        UUID: Client Characteristic Configuration (0x2902)
> HCI Event: Number of Completed Packets (0x13) plen 5    #131 [hci1] 11.534059
        Num handles: 1
        Handle: 93 Address: DF:A9:FF:F6:B1:1A (OUI DF-A9-FF)
        Count: 1
        #130: len 10 (0 Kb/s)
        Latency: 198 msec (78-199 msec ~198 msec)
> ACL Data RX: Handle 93 flags 0x02 dlen 9                #132 [hci1] 11.534227
      ATT: Find Information Request (0x04) len 4
        Handle range: 0x0139-0x0139
< HCI Command: Host Number of Com.. (0x03|0x0035) plen 5  #133 [hci1] 11.534985
        Num handles: 1
        Handle: 93 Address: DF:A9:FF:F6:B1:1A (OUI DF-A9-FF)
        Count: 1
< ACL Data TX: Handle 93 flags 0x00 dlen 10               #134 [hci1] 11.535006
      ATT: Find Information Response (0x05) len 5
        Format: UUID-16 (0x01)
        Handle: 0x0139
        UUID: Client Characteristic Configuration (0x2902)
> HCI Event: Number of Completed Packets (0x13) plen 5    #135 [hci1] 11.734011
        Num handles: 1
        Handle: 93 Address: DF:A9:FF:F6:B1:1A (OUI DF-A9-FF)
        Count: 1
        #134: len 10 (0 Kb/s)
        Latency: 199 msec (78-199 msec ~198 msec)
> ACL Data RX: Handle 93 flags 0x02 dlen 9                #136 [hci1] 11.734253
      ATT: Find Information Request (0x04) len 4
        Handle range: 0x013c-0x013c
< HCI Command: Host Number of Com.. (0x03|0x0035) plen 5  #137 [hci1] 11.734847
        Num handles: 1
        Handle: 93 Address: DF:A9:FF:F6:B1:1A (OUI DF-A9-FF)
        Count: 1
< ACL Data TX: Handle 93 flags 0x00 dlen 10               #138 [hci1] 11.734855
      ATT: Find Information Response (0x05) len 5
        Format: UUID-16 (0x01)
        Handle: 0x013c
        UUID: Client Characteristic Configuration (0x2902)
> HCI Event: Number of Completed Packets (0x13) plen 5    #139 [hci1] 11.934073
        Num handles: 1
        Handle: 93 Address: DF:A9:FF:F6:B1:1A (OUI DF-A9-FF)
        Count: 1
        #138: len 10 (0 Kb/s)
        Latency: 199 msec (78-199 msec ~198 msec)
> ACL Data RX: Handle 93 flags 0x02 dlen 13               #140 [hci1] 11.934340
      ATT: Find By Type Value Request (0x06) len 8
        Handle range: 0x0001-0xffff
        Attribute type: Primary Service (0x2800)
          UUID: Audio Stream Control (0x184e)
< HCI Command: Host Number of Com.. (0x03|0x0035) plen 5  #141 [hci1] 11.935924
        Num handles: 1
        Handle: 93 Address: DF:A9:FF:F6:B1:1A (OUI DF-A9-FF)
        Count: 1
< ACL Data TX: Handle 93 flags 0x00 dlen 9                #142 [hci1] 11.935993
      ATT: Find By Type Value Response (0x07) len 4
        Handle range: 0x013d-0x014c
> HCI Event: Number of Completed Packets (0x13) plen 5    #143 [hci1] 12.134134
        Num handles: 1
        Handle: 93 Address: DF:A9:FF:F6:B1:1A (OUI DF-A9-FF)
        Count: 1
        #142: len 9 (0 Kb/s)
        Latency: 198 msec (78-199 msec ~198 msec)
> ACL Data RX: Handle 93 flags 0x02 dlen 13               #144 [hci1] 12.134322
      ATT: Find By Type Value Request (0x06) len 8
        Handle range: 0x014d-0xffff
        Attribute type: Primary Service (0x2800)
          UUID: Audio Stream Control (0x184e)
< HCI Command: Host Number of Com.. (0x03|0x0035) plen 5  #145 [hci1] 12.135420
        Num handles: 1
        Handle: 93 Address: DF:A9:FF:F6:B1:1A (OUI DF-A9-FF)
        Count: 1
< ACL Data TX: Handle 93 flags 0x00 dlen 9                #146 [hci1] 12.135576
      ATT: Error Response (0x01) len 4
        Find By Type Value Request (0x06)
        Handle: 0x014d
        Error: Attribute Not Found (0x0a)
> HCI Event: Number of Completed Packets (0x13) plen 5    #147 [hci1] 12.334197
        Num handles: 1
        Handle: 93 Address: DF:A9:FF:F6:B1:1A (OUI DF-A9-FF)
        Count: 1
        #146: len 9 (0 Kb/s)
        Latency: 198 msec (78-199 msec ~198 msec)
> ACL Data RX: Handle 93 flags 0x02 dlen 11               #148 [hci1] 12.334311
      ATT: Read By Type Request (0x08) len 6
        Handle range: 0x013d-0x014c
        Attribute type: Characteristic (0x2803)
< HCI Command: Host Number of Com.. (0x03|0x0035) plen 5  #149 [hci1] 12.335440
        Num handles: 1
        Handle: 93 Address: DF:A9:FF:F6:B1:1A (OUI DF-A9-FF)
        Count: 1
< ACL Data TX: Handle 93 flags 0x00 dlen 27               #150 [hci1] 12.335492
< ACL Data TX: Handle 93 flags 0x01 dlen 14               #151 [hci1] 12.335583
      ATT: Read By Type Response (0x09) len 36
        Attribute data length: 7
        Attribute data list: 5 entries
        Handle: 0x013e
        Value: 1c3f01c62b
            Properties: 0x1c
              Write Without Response (0x04)
              Write (0x08)
              Notify (0x10)
            Value Handle: 0x013f
            Value UUID: ASE Control Point (0x2bc6)
        Handle: 0x0141
        Value: 124201c42b
            Properties: 0x12
              Read (0x02)
              Notify (0x10)
            Value Handle: 0x0142
            Value UUID: Sink ASE (0x2bc4)
        Handle: 0x0144
        Value: 124501c42b
            Properties: 0x12
              Read (0x02)
              Notify (0x10)
            Value Handle: 0x0145
            Value UUID: Sink ASE (0x2bc4)
        Handle: 0x0147
        Value: 124801c52b
            Properties: 0x12
              Read (0x02)
              Notify (0x10)
            Value Handle: 0x0148
            Value UUID: Source ASE (0x2bc5)
        Handle: 0x014a
        Value: 124b01c52b
            Properties: 0x12
              Read (0x02)
              Notify (0x10)
            Value Handle: 0x014b
            Value UUID: Source ASE (0x2bc5)
> HCI Event: Number of Completed Packets (0x13) plen 5    #152 [hci1] 12.434494
        Num handles: 1
        Handle: 93 Address: DF:A9:FF:F6:B1:1A (OUI DF-A9-FF)
        Count: 1
        #150: len 27 (2 Kb/s)
        Latency: 99 msec (78-199 msec ~148 msec)
> HCI Event: Number of Completed Packets (0x13) plen 5    #153 [hci1] 12.534005
        Num handles: 1
        Handle: 93 Address: DF:A9:FF:F6:B1:1A (OUI DF-A9-FF)
        Count: 1
        #151: len 14 (0 Kb/s)
        Latency: 198 msec (78-199 msec ~173 msec)
> ACL Data RX: Handle 93 flags 0x02 dlen 11               #154 [hci1] 12.534242
      ATT: Read By Type Request (0x08) len 6
        Handle range: 0x014b-0x014c
        Attribute type: Characteristic (0x2803)
< HCI Command: Host Number of Com.. (0x03|0x0035) plen 5  #155 [hci1] 12.535070
        Num handles: 1
        Handle: 93 Address: DF:A9:FF:F6:B1:1A (OUI DF-A9-FF)
        Count: 1
< ACL Data TX: Handle 93 flags 0x00 dlen 9                #156 [hci1] 12.535149
      ATT: Error Response (0x01) len 4
        Read By Type Request (0x08)
        Handle: 0x014b
        Error: Attribute Not Found (0x0a)
> HCI Event: Number of Completed Packets (0x13) plen 5    #157 [hci1] 12.734103
        Num handles: 1
        Handle: 93 Address: DF:A9:FF:F6:B1:1A (OUI DF-A9-FF)
        Count: 1
        #156: len 9 (0 Kb/s)
        Latency: 198 msec (78-199 msec ~186 msec)
> ACL Data RX: Handle 93 flags 0x02 dlen 9                #158 [hci1] 12.734221
      ATT: Find Information Request (0x04) len 4
        Handle range: 0x0140-0x0140
< HCI Command: Host Number of Com.. (0x03|0x0035) plen 5  #159 [hci1] 12.734905
        Num handles: 1
        Handle: 93 Address: DF:A9:FF:F6:B1:1A (OUI DF-A9-FF)
        Count: 1
< ACL Data TX: Handle 93 flags 0x00 dlen 10               #160 [hci1] 12.734984
      ATT: Find Information Response (0x05) len 5
        Format: UUID-16 (0x01)
        Handle: 0x0140
        UUID: Client Characteristic Configuration (0x2902)
> HCI Event: Number of Completed Packets (0x13) plen 5    #161 [hci1] 12.934146
        Num handles: 1
        Handle: 93 Address: DF:A9:FF:F6:B1:1A (OUI DF-A9-FF)
        Count: 1
        #160: len 10 (0 Kb/s)
        Latency: 199 msec (78-199 msec ~192 msec)
> ACL Data RX: Handle 93 flags 0x02 dlen 9                #162 [hci1] 12.934213
      ATT: Find Information Request (0x04) len 4
        Handle range: 0x0143-0x0143
< HCI Command: Host Number of Com.. (0x03|0x0035) plen 5  #163 [hci1] 12.935179
        Num handles: 1
        Handle: 93 Address: DF:A9:FF:F6:B1:1A (OUI DF-A9-FF)
        Count: 1
< ACL Data TX: Handle 93 flags 0x00 dlen 10               #164 [hci1] 12.935192
      ATT: Find Information Response (0x05) len 5
        Format: UUID-16 (0x01)
        Handle: 0x0143
        UUID: Client Characteristic Configuration (0x2902)
> HCI Event: Number of Completed Packets (0x13) plen 5    #165 [hci1] 13.134175
        Num handles: 1
        Handle: 93 Address: DF:A9:FF:F6:B1:1A (OUI DF-A9-FF)
        Count: 1
        #164: len 10 (0 Kb/s)
        Latency: 198 msec (78-199 msec ~195 msec)
> ACL Data RX: Handle 93 flags 0x02 dlen 9                #166 [hci1] 13.134292
      ATT: Find Information Request (0x04) len 4
        Handle range: 0x0146-0x0146
< HCI Command: Host Number of Com.. (0x03|0x0035) plen 5  #167 [hci1] 13.135246
        Num handles: 1
        Handle: 93 Address: DF:A9:FF:F6:B1:1A (OUI DF-A9-FF)
        Count: 1
< ACL Data TX: Handle 93 flags 0x00 dlen 10               #168 [hci1] 13.135327
      ATT: Find Information Response (0x05) len 5
        Format: UUID-16 (0x01)
        Handle: 0x0146
        UUID: Client Characteristic Configuration (0x2902)
> HCI Event: Number of Completed Packets (0x13) plen 5    #169 [hci1] 13.334042
        Num handles: 1
        Handle: 93 Address: DF:A9:FF:F6:B1:1A (OUI DF-A9-FF)
        Count: 1
        #168: len 10 (0 Kb/s)
        Latency: 198 msec (78-199 msec ~197 msec)
> ACL Data RX: Handle 93 flags 0x02 dlen 9                #170 [hci1] 13.334252
      ATT: Find Information Request (0x04) len 4
        Handle range: 0x0149-0x0149
< HCI Command: Host Number of Com.. (0x03|0x0035) plen 5  #171 [hci1] 13.335005
        Num handles: 1
        Handle: 93 Address: DF:A9:FF:F6:B1:1A (OUI DF-A9-FF)
        Count: 1
< ACL Data TX: Handle 93 flags 0x00 dlen 10               #172 [hci1] 13.335045
      ATT: Find Information Response (0x05) len 5
        Format: UUID-16 (0x01)
        Handle: 0x0149
        UUID: Client Characteristic Configuration (0x2902)
> HCI Event: Number of Completed Packets (0x13) plen 5    #173 [hci1] 13.534010
        Num handles: 1
        Handle: 93 Address: DF:A9:FF:F6:B1:1A (OUI DF-A9-FF)
        Count: 1
        #172: len 10 (0 Kb/s)
        Latency: 198 msec (78-199 msec ~198 msec)
> ACL Data RX: Handle 93 flags 0x02 dlen 9                #174 [hci1] 13.534230
      ATT: Find Information Request (0x04) len 4
        Handle range: 0x014c-0x014c
< HCI Command: Host Number of Com.. (0x03|0x0035) plen 5  #175 [hci1] 13.534887
        Num handles: 1
        Handle: 93 Address: DF:A9:FF:F6:B1:1A (OUI DF-A9-FF)
        Count: 1
< ACL Data TX: Handle 93 flags 0x00 dlen 10               #176 [hci1] 13.534904
      ATT: Find Information Response (0x05) len 5
        Format: UUID-16 (0x01)
        Handle: 0x014c
        UUID: Client Characteristic Configuration (0x2902)
> HCI Event: Number of Completed Packets (0x13) plen 5    #177 [hci1] 13.734084
        Num handles: 1
        Handle: 93 Address: DF:A9:FF:F6:B1:1A (OUI DF-A9-FF)
        Count: 1
        #176: len 10 (0 Kb/s)
        Latency: 199 msec (78-199 msec ~198 msec)
> ACL Data RX: Handle 93 flags 0x02 dlen 13               #178 [hci1] 13.734339
      ATT: Find By Type Value Request (0x06) len 8
        Handle range: 0x0001-0xffff
        Attribute type: Primary Service (0x2800)
          UUID: Common Audio (0x1853)
< HCI Command: Host Number of Com.. (0x03|0x0035) plen 5  #179 [hci1] 13.735101
        Num handles: 1
        Handle: 93 Address: DF:A9:FF:F6:B1:1A (OUI DF-A9-FF)
        Count: 1
< ACL Data TX: Handle 93 flags 0x00 dlen 9                #180 [hci1] 13.735130
      ATT: Find By Type Value Response (0x07) len 4
        Handle range: 0x0159-0x015a
> HCI Event: Number of Completed Packets (0x13) plen 5    #181 [hci1] 13.934009
        Num handles: 1
        Handle: 93 Address: DF:A9:FF:F6:B1:1A (OUI DF-A9-FF)
        Count: 1
        #180: len 9 (0 Kb/s)
        Latency: 198 msec (78-199 msec ~198 msec)
> ACL Data RX: Handle 93 flags 0x02 dlen 13               #182 [hci1] 13.934318
      ATT: Find By Type Value Request (0x06) len 8
        Handle range: 0x015b-0xffff
        Attribute type: Primary Service (0x2800)
          UUID: Common Audio (0x1853)
< HCI Command: Host Number of Com.. (0x03|0x0035) plen 5  #183 [hci1] 13.935391
        Num handles: 1
        Handle: 93 Address: DF:A9:FF:F6:B1:1A (OUI DF-A9-FF)
        Count: 1
< ACL Data TX: Handle 93 flags 0x00 dlen 9                #184 [hci1] 13.935499
      ATT: Error Response (0x01) len 4
        Find By Type Value Request (0x06)
        Handle: 0x015b
        Error: Attribute Not Found (0x0a)
> HCI Event: Number of Completed Packets (0x13) plen 5    #185 [hci1] 14.133993
        Num handles: 1
        Handle: 93 Address: DF:A9:FF:F6:B1:1A (OUI DF-A9-FF)
        Count: 1
        #184: len 9 (0 Kb/s)
        Latency: 198 msec (78-199 msec ~198 msec)
> ACL Data RX: Handle 93 flags 0x02 dlen 11               #186 [hci1] 14.134259
      ATT: Read By Type Request (0x08) len 6
        Handle range: 0x0159-0x015a
        Attribute type: Include (0x2802)
< HCI Command: Host Number of Com.. (0x03|0x0035) plen 5  #187 [hci1] 14.135451
        Num handles: 1
        Handle: 93 Address: DF:A9:FF:F6:B1:1A (OUI DF-A9-FF)
        Count: 1
< ACL Data TX: Handle 93 flags 0x00 dlen 14               #188 [hci1] 14.135554
      ATT: Read By Type Response (0x09) len 9
        Attribute data length: 8
        Attribute data list: 1 entry
        Handle: 0x015a
        Value: 4d0158014618
> HCI Event: Number of Completed Packets (0x13) plen 5    #189 [hci1] 14.333979
        Num handles: 1
        Handle: 93 Address: DF:A9:FF:F6:B1:1A (OUI DF-A9-FF)
        Count: 1
        #188: len 14 (0 Kb/s)
        Latency: 198 msec (78-199 msec ~198 msec)
> ACL Data RX: Handle 93 flags 0x02 dlen 11               #190 [hci1] 14.334257
      ATT: Read By Type Request (0x08) len 6
        Handle range: 0x014d-0x0158
        Attribute type: Characteristic (0x2803)
< HCI Command: Host Number of Com.. (0x03|0x0035) plen 5  #191 [hci1] 14.335094
        Num handles: 1
        Handle: 93 Address: DF:A9:FF:F6:B1:1A (OUI DF-A9-FF)
        Count: 1
< ACL Data TX: Handle 93 flags 0x00 dlen 27               #192 [hci1] 14.335106
< ACL Data TX: Handle 93 flags 0x01 dlen 7                #193 [hci1] 14.335237
      ATT: Read By Type Response (0x09) len 29
        Attribute data length: 7
        Attribute data list: 4 entries
        Handle: 0x014e
        Value: 124f01842b
            Properties: 0x12
              Read (0x02)
              Notify (0x10)
            Value Handle: 0x014f
            Value UUID: Set Identity Resolving Key (0x2b84)
        Handle: 0x0151
        Value: 125201852b
            Properties: 0x12
              Read (0x02)
              Notify (0x10)
            Value Handle: 0x0152
            Value UUID: Coordinated Set Size (0x2b85)
        Handle: 0x0154
        Value: 1a5501862b
            Properties: 0x1a
              Read (0x02)
              Write (0x08)
              Notify (0x10)
            Value Handle: 0x0155
            Value UUID: Set Member Lock (0x2b86)
        Handle: 0x0157
        Value: 025801872b
            Properties: 0x02
              Read (0x02)
            Value Handle: 0x0158
            Value UUID: Set Member Rank (0x2b87)
> HCI Event: Number of Completed Packets (0x13) plen 5    #194 [hci1] 14.434422
        Num handles: 1
        Handle: 93 Address: DF:A9:FF:F6:B1:1A (OUI DF-A9-FF)
        Count: 1
        #192: len 27 (2 Kb/s)
        Latency: 99 msec (78-199 msec ~148 msec)
> HCI Event: Number of Completed Packets (0x13) plen 5    #195 [hci1] 14.534055
        Num handles: 1
        Handle: 93 Address: DF:A9:FF:F6:B1:1A (OUI DF-A9-FF)
        Count: 1
        #193: len 7 (0 Kb/s)
        Latency: 198 msec (78-199 msec ~173 msec)
> ACL Data RX: Handle 93 flags 0x02 dlen 11               #196 [hci1] 14.534293
      ATT: Read By Type Request (0x08) len 6
        Handle range: 0x0158-0x0158
        Attribute type: Characteristic (0x2803)
< HCI Command: Host Number of Com.. (0x03|0x0035) plen 5  #197 [hci1] 14.535185
        Num handles: 1
        Handle: 93 Address: DF:A9:FF:F6:B1:1A (OUI DF-A9-FF)
        Count: 1
< ACL Data TX: Handle 93 flags 0x00 dlen 9                #198 [hci1] 14.535254
      ATT: Error Response (0x01) len 4
        Read By Type Request (0x08)
        Handle: 0x0158
        Error: Attribute Not Found (0x0a)
> HCI Event: Number of Completed Packets (0x13) plen 5    #199 [hci1] 14.734038
        Num handles: 1
        Handle: 93 Address: DF:A9:FF:F6:B1:1A (OUI DF-A9-FF)
        Count: 1
        #198: len 9 (0 Kb/s)
        Latency: 198 msec (78-199 msec ~186 msec)
> ACL Data RX: Handle 93 flags 0x02 dlen 9                #200 [hci1] 14.734210
      ATT: Find Information Request (0x04) len 4
        Handle range: 0x0150-0x0150
< HCI Command: Host Number of Com.. (0x03|0x0035) plen 5  #201 [hci1] 14.735484
        Num handles: 1
        Handle: 93 Address: DF:A9:FF:F6:B1:1A (OUI DF-A9-FF)
        Count: 1
< ACL Data TX: Handle 93 flags 0x00 dlen 10               #202 [hci1] 14.735601
      ATT: Find Information Response (0x05) len 5
        Format: UUID-16 (0x01)
        Handle: 0x0150
        UUID: Client Characteristic Configuration (0x2902)
> HCI Event: Number of Completed Packets (0x13) plen 5    #203 [hci1] 14.933966
        Num handles: 1
        Handle: 93 Address: DF:A9:FF:F6:B1:1A (OUI DF-A9-FF)
        Count: 1
        #202: len 10 (0 Kb/s)
        Latency: 198 msec (78-199 msec ~192 msec)
> ACL Data RX: Handle 93 flags 0x02 dlen 9                #204 [hci1] 14.934155
      ATT: Find Information Request (0x04) len 4
        Handle range: 0x0153-0x0153
< HCI Command: Host Number of Com.. (0x03|0x0035) plen 5  #205 [hci1] 14.935392
        Num handles: 1
        Handle: 93 Address: DF:A9:FF:F6:B1:1A (OUI DF-A9-FF)
        Count: 1
< ACL Data TX: Handle 93 flags 0x00 dlen 10               #206 [hci1] 14.935499
      ATT: Find Information Response (0x05) len 5
        Format: UUID-16 (0x01)
        Handle: 0x0153
        UUID: Client Characteristic Configuration (0x2902)
> HCI Event: Number of Completed Packets (0x13) plen 5    #207 [hci1] 15.134103
        Num handles: 1
        Handle: 93 Address: DF:A9:FF:F6:B1:1A (OUI DF-A9-FF)
        Count: 1
        #206: len 10 (0 Kb/s)
        Latency: 198 msec (78-199 msec ~195 msec)
> ACL Data RX: Handle 93 flags 0x02 dlen 9                #208 [hci1] 15.134234
      ATT: Find Information Request (0x04) len 4
        Handle range: 0x0156-0x0156
