Bluetooth monitor ver 5.72
= Note: Linux version 6.14.0-36-generic (x86_64)                       0.458953
= Note: Bluetooth subsystem version 2.22                               0.458955
= New Index: 00:00:00:00:00:00 (Primary,UART,hci1)              [hci1] 0.458956
= New Index: 48:5F:99:8E:E0:64 (Primary,USB,hci0)               [hci0] 0.458957
= Open Index: 00:00:00:00:00:00                                 [hci1] 0.572762
= Index Info: 00:00:00:00:00:00 (Nordic Semiconductor ASA)      [hci1] 0.572780
@ USER Open: main (privileged) version 2.22            {0x0001} [hci1] 0.572788
< HCI Command: Reset (0x03|0x0003) plen 0                    #1 [hci1] 0.573973
> HCI Event: Command Complete (0x0e) plen 4                  #2 [hci1] 0.574560
      Reset (0x03|0x0003) ncmd 1
        Status: Success (0x00)
< HCI Command: Read Local Supported... (0x04|0x0003) plen 0  #3 [hci1] 0.592567
> HCI Event: Command Complete (0x0e) plen 12                 #4 [hci1] 0.593049
      Read Local Supported Features (0x04|0x0003) ncmd 1
        Status: Success (0x00)
        Features: 0x00 0x00 0x00 0x00 0x60 0x00 0x00 0x00
          BR/EDR Not Supported
          LE Supported (Controller)
< HCI Command: Read Local Version In.. (0x04|0x0001) plen 0  #5 [hci1] 0.612261
> HCI Event: Command Complete (0x0e) plen 12                 #6 [hci1] 0.612867
      Read Local Version Information (0x04|0x0001) ncmd 1
        Status: Success (0x00)
        HCI version: Reserved (0x0f) - Revision 12393 (0x3069)
        LMP version: Reserved (0x0f) - Subversion 12393 (0x3069)
        Manufacturer: Nordic Semiconductor ASA (89)
< HCI Command: Read Local Supported... (0x04|0x0002) plen 0  #7 [hci1] 0.632237
> HCI Event: Command Complete (0x0e) plen 68                 #8 [hci1] 0.633325
      Read Local Supported Commands (0x04|0x0002) ncmd 1
        Status: Success (0x00)
        Commands: 119 entries
          Disconnect (Octet 0 - Bit 5)
          Read Remote Version Information (Octet 2 - Bit 7)
          Set Event Mask (Octet 5 - Bit 6)
          Reset (Octet 5 - Bit 7)
          Read Connection Accept Timeout (Octet 7 - Bit 2)
          Write Connection Accept Timeout (Octet 7 - Bit 3)
          Read Transmit Power Level (Octet 10 - Bit 2)
          Set Controller To Host Flow Control (Octet 10 - Bit 5)
          Host Buffer Size (Octet 10 - Bit 6)
          Host Number of Completed Packets (Octet 10 - Bit 7)
          Read Local Version Information (Octet 14 - Bit 3)
          Read Local Supported Features (Octet 14 - Bit 5)
          Read BD ADDR (Octet 15 - Bit 1)
          Read RSSI (Octet 15 - Bit 5)
          Set Event Mask Page 2 (Octet 22 - Bit 2)
          LE Set Event Mask (Octet 25 - Bit 0)
          LE Read Buffer Size (Octet 25 - Bit 1)
          LE Read Local Supported Features (Octet 25 - Bit 2)
          LE Set Random Address (Octet 25 - Bit 4)
          LE Set Advertising Parameters (Octet 25 - Bit 5)
          LE Read Advertising Channel TX Power (Octet 25 - Bit 6)
          LE Set Advertising Data (Octet 25 - Bit 7)
          LE Set Scan Response Data (Octet 26 - Bit 0)
          LE Set Advertise Enable (Octet 26 - Bit 1)
          LE Set Scan Parameters (Octet 26 - Bit 2)
          LE Set Scan Enable (Octet 26 - Bit 3)
          LE Create Connection (Octet 26 - Bit 4)
          LE Create Connection Cancel (Octet 26 - Bit 5)
          LE Read Accept List Size (Octet 26 - Bit 6)
          LE Clear Accept List (Octet 26 - Bit 7)
          LE Add Device To Accept List (Octet 27 - Bit 0)
          LE Remove Device From Accept List (Octet 27 - Bit 1)
          LE Connection Update (Octet 27 - Bit 2)
          LE Set Host Channel Classification (Octet 27 - Bit 3)
          LE Read Channel Map (Octet 27 - Bit 4)
          LE Read Remote Used Features (Octet 27 - Bit 5)
          LE Encrypt (Octet 27 - Bit 6)
          LE Rand (Octet 27 - Bit 7)
          LE Start Encryption (Octet 28 - Bit 0)
          LE Long Term Key Request Reply (Octet 28 - Bit 1)
          LE Long Term Key Request Neg Reply (Octet 28 - Bit 2)
          LE Read Supported States (Octet 28 - Bit 3)
          LE Receiver Test (Octet 28 - Bit 4)
          LE Transmitter Test (Octet 28 - Bit 5)
          LE Test End (Octet 28 - Bit 6)
          Read Authenticated Payload Timeout (Octet 32 - Bit 4)
          Write Authenticated Payload Timeout (Octet 32 - Bit 5)
          LE Set Data Length (Octet 33 - Bit 6)
          LE Read Suggested Default Data Length (Octet 33 - Bit 7)
          LE Write Suggested Default Data Length (Octet 34 - Bit 0)
          LE Add Device To Resolving List (Octet 34 - Bit 3)
          LE Remove Device From Resolving List (Octet 34 - Bit 4)
          LE Clear Resolving List (Octet 34 - Bit 5)
          LE Read Resolving List Size (Octet 34 - Bit 6)
          LE Set Address Resolution Enable (Octet 35 - Bit 1)
          LE Set Resolvable Private Address Timeout (Octet 35 - Bit 2)
          LE Read Maximum Data Length (Octet 35 - Bit 3)
          LE Read PHY (Octet 35 - Bit 4)
          LE Set Default PHY (Octet 35 - Bit 5)
          LE Set PHY (Octet 35 - Bit 6)
          LE Enhanced Receiver Test (Octet 35 - Bit 7)
          LE Enhanced Transmitter Test (Octet 36 - Bit 0)
          LE Set Advertising Set Random Address (Octet 36 - Bit 1)
          LE Set Extended Advertising Parameters (Octet 36 - Bit 2)
          LE Set Extended Advertising Data (Octet 36 - Bit 3)
          LE Set Extended Scan Response Data (Octet 36 - Bit 4)
          LE Set Extended Advertising Enable (Octet 36 - Bit 5)
          LE Read Maximum Advertising Data Length (Octet 36 - Bit 6)
          LE Read Number of Supported Advertising Sets (Octet 36 - Bit 7)
          LE Remove Advertising Set (Octet 37 - Bit 0)
          LE Clear Advertising Sets (Octet 37 - Bit 1)
          LE Set Periodic Advertising Parameters (Octet 37 - Bit 2)
          LE Set Periodic Advertising Data (Octet 37 - Bit 3)
          LE Set Periodic Advertising Enable (Octet 37 - Bit 4)
          LE Set Extended Scan Parameters (Octet 37 - Bit 5)
          LE Set Extended Scan Enable (Octet 37 - Bit 6)
          LE Extended Create Connection (Octet 37 - Bit 7)
          LE Periodic Advertising Create Sync (Octet 38 - Bit 0)
          LE Periodic Advertising Create Sync Cancel (Octet 38 - Bit 1)
          LE Periodic Advertising Terminate Sync (Octet 38 - Bit 2)
          LE Add Device To Periodic Advertiser List (Octet 38 - Bit 3)
          LE Remove Device From Periodic Advertiser List (Octet 38 - Bit 4)
          LE Clear Periodic Advertiser List (Octet 38 - Bit 5)
          LE Read Periodic Advertiser List Size (Octet 38 - Bit 6)
          LE Read Transmit Power (Octet 38 - Bit 7)
          LE Read RF Path Compensation (Octet 39 - Bit 0)
          LE Write RF Path Compensation (Octet 39 - Bit 1)
          LE Set Privacy Mode (Octet 39 - Bit 2)
          LE Periodic Advertising Receive Enable (Octet 40 - Bit 5)
          LE Periodic Advertising Sync Transfer (Octet 40 - Bit 6)
          LE Periodic Advertising Set Info Transfer (Octet 40 - Bit 7)
          LE Periodic Advertising Sync Transfer Parameters (Octet 41 - Bit 0)
          LE Set Default Periodic Advertisng Sync Transfer Parameters (Octet 41 - Bit 1)
          LE Read Buffer v2 (Octet 41 - Bit 5)
          LE Read ISO TX Sync (Octet 41 - Bit 6)
          LE Set Connected Isochronous Group Parameters (Octet 41 - Bit 7)
          LE Set Connected Isochronous Group Parameters Test (Octet 42 - Bit 0)
          LE Create Connected Isochronous Stream (Octet 42 - Bit 1)
          LE Remove Connected Isochronous Group (Octet 42 - Bit 2)
          LE Accept Connected Isochronous Stream Request (Octet 42 - Bit 3)
          LE Reject Connected Isochronous Stream Request (Octet 42 - Bit 4)
          LE Create Broadcast Isochronous Group (Octet 42 - Bit 5)
          LE Create Broadcast Isochronous Group Test (Octet 42 - Bit 6)
          LE Terminate Broadcast Isochronous Group (Octet 42 - Bit 7)
          LE Broadcast Isochronous Group Create Sync (Octet 43 - Bit 0)
          LE Broadcast Isochronous Group Terminate Sync (Octet 43 - Bit 1)
          LE Request Peer SCA (Octet 43 - Bit 2)
          LE Setup Isochronous Data Path (Octet 43 - Bit 3)
          LE Remove Isochronous Data Path (Octet 43 - Bit 4)
          LE Isochronous Transmit Test (Octet 43 - Bit 5)
          LE Isochronous Receive Test (Octet 43 - Bit 6)
          LE Isochronous Read Test Counters (Octet 43 - Bit 7)
          LE Isochronous Read Test Counters (Octet 44 - Bit 0)
          LE Set Host Feature (Octet 44 - Bit 1)
          Octet 44 - Bit 2 
          Octet 45 - Bit 6 
          Octet 46 - Bit 0 
          Octet 46 - Bit 1 
          Octet 46 - Bit 2 
< HCI Command: Host Buffer Size (0x03|0x0033) plen 7         #9 [hci1] 0.652248
        ACL MTU: 255  ACL max packet: 16
        SCO MTU: 0    SCO max packet: 0
> HCI Event: Command Complete (0x0e) plen 4                 #10 [hci1] 0.652777
      Host Buffer Size (0x03|0x0033) ncmd 1
        Status: Success (0x00)
< HCI Command: Set Controller To Ho.. (0x03|0x0031) plen 1  #11 [hci1] 0.672237
        Flow control: ACL Data Packets (0x01)
> HCI Event: Command Complete (0x0e) plen 4                 #12 [hci1] 0.672674
      Set Controller To Host Flow Control (0x03|0x0031) ncmd 1
        Status: Success (0x00)
< HCI Command: LE Read Local Suppor.. (0x08|0x0003) plen 0  #13 [hci1] 0.692235
> HCI Event: Command Complete (0x0e) plen 12                #14 [hci1] 0.692724
      LE Read Local Supported Features (0x08|0x0003) ncmd 1
        Status: Success (0x00)
        Features: 0xfd 0x79 0x00 0xf7 0x30 0x01 0x00 0x00
          LE Encryption
          Extended Reject Indication
          Peripheral-initiated Features Exchange
          LE Ping
          LE Data Packet Length Extension
          LL Privacy
          Extended Scanner Filter Policies
          LE 2M PHY
          LE Coded PHY
          LE Extended Advertising
          LE Periodic Advertising
          Channel Selection Algorithm #2
          Periodic Advertising Sync Transfer - Sender
          Periodic Advertising Sync Transfer - Recipient
          Sleep Clock Accuracy Updates
          Connected Isochronous Stream - Central
          Connected Isochronous Stream - Peripheral
          Isochronous Broadcaster
          Synchronized Receiver
          Periodic Advertising ADI support
          Connection Subrating
          Unknown features (0x0000010000000000)
< HCI Command: LE Set Host Feature (0x08|0x0074) plen 2     #15 [hci1] 0.712241
        Bit Number: 32
          Connected Isochronous Stream (Host Support)
        Bit Value: 1
> HCI Event: Command Complete (0x0e) plen 4                 #16 [hci1] 0.712691
      LE Set Host Feature (0x08|0x0074) ncmd 1
        Status: Success (0x00)
< HCI Command: LE Read Buffer v2 (0x08|0x0060) plen 0       #17 [hci1] 0.732242
> HCI Event: Command Complete (0x0e) plen 10                #18 [hci1] 0.732709
      LE Read Buffer v2 (0x08|0x0060) ncmd 1
        Status: Success (0x00)
        ACL MTU: 27
        ACL max packet: 3
        ISO MTU: 318
        ISO max packet: 3
< HCI Command: LE Read Maximum Adve.. (0x08|0x003a) plen 0  #19 [hci1] 0.752260
> HCI Event: Command Complete (0x0e) plen 6                 #20 [hci1] 0.752766
      LE Read Maximum Advertising Data Length (0x08|0x003a) ncmd 1
        Status: Success (0x00)
        Max length: 1650
< HCI Command: LE Read Supported St.. (0x08|0x001c) plen 0  #21 [hci1] 0.772246
> HCI Event: Command Complete (0x0e) plen 12                #22 [hci1] 0.772818
      LE Read Supported States (0x08|0x001c) ncmd 1
        Status: Success (0x00)
        States: 0x000003ff3e0306ff
          Non-connectable Advertising State
          Scannable Advertising State
          Connectable Advertising State
          High Duty Cycle Directed Advertising State
          Passive Scanning State
          Active Scanning State
          Initiating State
            and Connection State (Central Role)
          Connection State (Peripheral Role)
          Scannable Advertising State
            and Passive Scanning State
          Connectable Advertising State
            and Passive Scanning State
          Non-connectable Advertising State
            and Initiating State
          Scannable Advertising State
            and Initiating State
          Active Scanning State
            and Connection State (Central Role)
          Passive Scanning State
            and Connection State (Peripheral Role)
          Active Scanning State
            and Connection State (Peripheral Role)
          Initiating State
            and Connection State (Central Role)
            and Central Role & Central Role
          Low Duty Cycle Directed Advertising State
          Connectable Advertising State
            and Initiating State
            and Central Role & Peripheral Role
          High Duty Cycle Directed Advertising State
            and Initiating State
            and Central Role & Peripheral Role
          Low Duty Cycle Directed Advertising State
            and Initiating State
            and Central Role & Peripheral Role
          Connectable Advertising State
            and Connection State (Central Role)
            and Central Role & Peripheral Role
          High Duty Cycle Directed Advertising State
            and Connection State (Central Role)
            and Central Role & Peripheral Role
          Low Duty Cycle Directed Advertising State
            and Connection State (Central Role)
            and Central Role & Peripheral Role
          Connectable Advertising State
            and Connection State (Peripheral Role)
            and Central Role & Peripheral Role
          High Duty Cycle Directed Advertising State
            and Connection State (Peripheral Role)
            and Peripheral Role & Peripheral Role
          Low Duty Cycle Directed Advertising State
            and Connection State (Peripheral Role)
            and Peripheral Role & Peripheral Role
          Initiating State
            and Connection State (Peripheral Role)
            and Central Role & Peripheral Role
< HCI Command: LE Read Maximum Data.. (0x08|0x002f) plen 0  #23 [hci1] 0.792238
> HCI Event: Command Complete (0x0e) plen 12                #24 [hci1] 0.792658
      LE Read Maximum Data Length (0x08|0x002f) ncmd 1
        Status: Success (0x00)
        Max TX octets: 251
        Max TX time: 2704
        Max RX octets: 251
        Max RX time: 2704
< HCI Command: LE Write Suggested D.. (0x08|0x0024) plen 4  #25 [hci1] 0.812239
        TX octets: 251
        TX time: 2704
> HCI Event: Command Complete (0x0e) plen 4                 #26 [hci1] 0.812726
      LE Write Suggested Default Data Length (0x08|0x0024) ncmd 1
        Status: Success (0x00)
< HCI Command: LE Read Resolving Li.. (0x08|0x002a) plen 0  #27 [hci1] 0.832248
> HCI Event: Command Complete (0x0e) plen 5                 #28 [hci1] 0.832687
      LE Read Resolving List Size (0x08|0x002a) ncmd 1
        Status: Success (0x00)
        Size: 8
< HCI Command: LE Set Event Mask (0x08|0x0001) plen 8       #29 [hci1] 0.852242
        Mask: 0x000002023f87fa5e
          LE Advertising Report
          LE Connection Update Complete
          LE Read Remote Used Features Complete
          LE Long Term Key Request
          LE Data Length Change
          LE Enhanced Connection Complete
          LE PHY Update Complete
          LE Extended Advertising Report
          LE Periodic Advertising Sync Established
          LE Periodic Advertising Report
          LE Periodic Advertising Sync Lost
          LE Extended Scan Timeout
          LE Extended Advertising Set Terminated
          LE Scan Request Received
          LE Periodic Advertising Sync Transfer Rvc
          LE CIS Established
          LE CIS Request
          LE Create BIG Complete
          LE Terminate BIG Complete
          LE BIG Sync Estabilished Complete
          LE BIG Sync Lost
          LE BIG Info Advertising Report
          Unknown mask (0x0000020000000000)
> HCI Event: Command Complete (0x0e) plen 4                 #30 [hci1] 0.852728
      LE Set Event Mask (0x08|0x0001) ncmd 1
        Status: Success (0x00)
< HCI Command: Set Event Mask (0x03|0x0001) plen 8          #31 [hci1] 0.872240
        Mask: 0x2000800002008890
          Disconnection Complete
          Encryption Change
          Read Remote Version Information Complete
          Hardware Error
          Data Buffer Overflow
          Encryption Key Refresh Complete
          LE Meta
> HCI Event: Command Complete (0x0e) plen 4                 #32 [hci1] 0.872740
      Set Event Mask (0x03|0x0001) ncmd 1
        Status: Success (0x00)
< HCI Command: Read BD ADDR (0x04|0x0009) plen 0            #33 [hci1] 0.892251
> HCI Event: Command Complete (0x0e) plen 10                #34 [hci1] 0.892772
      Read BD ADDR (0x04|0x0009) ncmd 1
        Status: Success (0x00)
        Address: 00:00:00:00:00:00 (OUI 00-00-00)
< HCI Command: LE Set Random Address (0x08|0x0005) plen 6   #35 [hci1] 0.912213
        Address: D5:B6:CC:31:DB:3B (Static)
> HCI Event: Command Complete (0x0e) plen 4                 #36 [hci1] 0.912721
      LE Set Random Address (0x08|0x0005) ncmd 1
        Status: Success (0x00)
< HCI Command: LE Set Extended Adv.. (0x08|0x0036) plen 25  #37 [hci1] 3.122250
        Handle: 0x00
        Properties: 0x0013
          Connectable
          Scannable
          Use legacy advertising PDUs: ADV_IND
        Min advertising interval: 100.000 msec (0x00a0)
        Max advertising interval: 150.000 msec (0x00f0)
        Channel map: 37, 38, 39 (0x07)
        Own address type: Random (0x01)
        Peer address type: Public (0x00)
        Peer address: 00:00:00:00:00:00 (OUI 00-00-00)
        Filter policy: Allow Scan Request from Any, Allow Connect Request from Any (0x00)
        TX power: Host has no preference (0x7f)
        Primary PHY: LE 1M (0x01)
        Secondary max skip: 0x00
        Secondary PHY: LE 1M (0x01)
        SID: 0x00
        Scan request notifications: Disabled (0x00)
> HCI Event: Command Complete (0x0e) plen 5                 #38 [hci1] 3.123027
      LE Set Extended Advertising Parameters (0x08|0x0036) ncmd 1
        Status: Success (0x00)
        TX power (selected): 0 dbm (0x00)
< HCI Command: LE Set Advertising S.. (0x08|0x0035) plen 7  #39 [hci1] 3.132270
        Advertising handle: 0x00
        Advertising random address: D5:B6:CC:31:DB:3B (Static)
> HCI Event: Command Complete (0x0e) plen 4                 #40 [hci1] 3.132818
      LE Set Advertising Set Random Address (0x08|0x0035) ncmd 1
        Status: Success (0x00)
< HCI Command: LE Set Extended Adv.. (0x08|0x0037) plen 22  #41 [hci1] 3.153628
        Handle: 0x00
        Operation: Complete extended advertising data (0x03)
        Fragment preference: Minimize fragmentation (0x01)
        Data length: 0x12
        Flags: 0x06
          LE General Discoverable Mode
          BR/EDR Not Supported
        Name (complete): Tester_F6B11A
> HCI Event: Command Complete (0x0e) plen 4                 #42 [hci1] 3.154461
      LE Set Extended Advertising Data (0x08|0x0037) ncmd 1
        Status: Success (0x00)
< HCI Command: LE Set Extended Scan.. (0x08|0x0038) plen 4  #43 [hci1] 3.172156
        Handle: 0x00
        Operation: Complete scan response data (0x03)
        Fragment preference: Minimize fragmentation (0x01)
        Data length: 0x00
> HCI Event: Command Complete (0x0e) plen 4                 #44 [hci1] 3.172623
      LE Set Extended Scan Response Data (0x08|0x0038) ncmd 1
        Status: Success (0x00)
< HCI Command: LE Set Extended Adve.. (0x08|0x0039) plen 6  #45 [hci1] 3.192201
        Extended advertising: Enabled (0x01)
        Number of sets: 1 (0x01)
        Entry 0
          Handle: 0x00
          Duration: 0 ms (0x00)
          Max ext adv events: 0
> HCI Event: Command Complete (0x0e) plen 4                 #46 [hci1] 3.192769
      LE Set Extended Advertising Enable (0x08|0x0039) ncmd 1
        Status: Success (0x00)
> HCI Event: LE Meta Event (0x3e) plen 31                   #47 [hci1] 3.830008
      LE Enhanced Connection Complete (0x0a)
        Status: Success (0x00)
        Handle: 3027
        Role: Peripheral (0x01)
        Peer address type: Public (0x00)
        Peer address: DF:A9:FF:F6:B1:1A (OUI DF-A9-FF)
        Local resolvable private address: 00:00:00:00:00:00 (Non-Resolvable)
        Peer resolvable private address: 00:00:00:00:00:00 (Non-Resolvable)
        Connection interval: 87.50 msec (0x0046)
        Connection latency: 0 (0x0000)
        Supervision timeout: 20000 msec (0x07d0)
        Central clock accuracy: 0x01
> HCI Event: LE Meta Event (0x3e) plen 6                    #48 [hci1] 3.830226
      LE Advertising Set Terminated (0x12)
        Status: Success (0x00)
        Handle: 0
        Connection handle: 3027
        Number of completed extended advertising events: 0
< HCI Command: LE Read Remote Used... (0x08|0x0016) plen 2  #49 [hci1] 3.833133
        Handle: 3027 Address: DF:A9:FF:F6:B1:1A (OUI DF-A9-FF)
> HCI Event: Command Status (0x0f) plen 4                   #50 [hci1] 3.833643
      LE Read Remote Used Features (0x08|0x0016) ncmd 1
        Status: Success (0x00)
> HCI Event: LE Meta Event (0x3e) plen 12                   #51 [hci1] 4.093894
      LE Read Remote Used Features (0x04)
        Status: Success (0x00)
        Handle: 3027 Address: DF:A9:FF:F6:B1:1A (OUI DF-A9-FF)
        Features: 0x2d 0x49 0x00 0xf7 0x67 0xd9 0x00 0x80
          LE Encryption
          Extended Reject Indication
          Peripheral-initiated Features Exchange
          LE Data Packet Length Extension
          LE 2M PHY
          LE Coded PHY
          Channel Selection Algorithm #2
          Periodic Advertising Sync Transfer - Sender
          Periodic Advertising Sync Transfer - Recipient
          Sleep Clock Accuracy Updates
          Connected Isochronous Stream - Central
          Connected Isochronous Stream - Peripheral
          Isochronous Broadcaster
          Synchronized Receiver
          Connected Isochronous Stream (Host Support)
          LE Power Control Request
          LE Power Control Request
          Connection Subrating
          Connection Subrating (Host Support)
          Unknown features (0x8000d90000000000)
> ACL Data RX: Handle 3027 flags 0x02 dlen 11               #52 [hci1] 4.531139
      SMP: Pairing Request (0x01) len 6
        IO capability: DisplayYesNo (0x01)
        OOB data: Authentication data not present (0x00)
        Authentication requirement: No bonding, No MITM, SC, No Keypresses (0x08)
        Max encryption key size: 16
        Initiator key distribution: <none> (0x00)
        Responder key distribution: <none> (0x00)
< HCI Command: Host Number of Compl.. (0x03|0x0035) plen 5  #53 [hci1] 4.532350
        Num handles: 1
        Handle: 3027 Address: DF:A9:FF:F6:B1:1A (OUI DF-A9-FF)
        Count: 1
< ACL Data TX: Handle 3027 flags 0x00 dlen 11               #54 [hci1] 4.532395
      SMP: Pairing Response (0x02) len 6
        IO capability: NoInputNoOutput (0x03)
        OOB data: Authentication data not present (0x00)
        Authentication requirement: No bonding, No MITM, SC, No Keypresses (0x08)
        Max encryption key size: 16
        Initiator key distribution: <none> (0x00)
        Responder key distribution: <none> (0x00)
> HCI Event: Number of Completed Packets (0x13) plen 5      #55 [hci1] 4.706245
        Num handles: 1
        Handle: 3027 Address: DF:A9:FF:F6:B1:1A (OUI DF-A9-FF)
        Count: 1
        #54: len 11 (0 Kb/s)
        Latency: 173 msec (173-173 msec ~173 msec)
> ACL Data RX: Handle 3027 flags 0x02 dlen 27               #56 [hci1] 4.706540
> ACL Data RX: Handle 3027 flags 0x01 dlen 27               #57 [hci1] 4.707079
> ACL Data RX: Handle 3027 flags 0x01 dlen 15               #58 [hci1] 4.707488
      SMP: Pairing Public Key (0x0c) len 64
        X: aff420e171b0ff864e131931aed3279ef5f6dec324941baa3c2670dfe05b4ba0
        Y: 69cf5f65cf9c6baf1cb14431f2db5d5c0afe95d7425f7b0954a9a2c334b4d275
< HCI Command: Host Number of Compl.. (0x03|0x0035) plen 5  #59 [hci1] 4.713095
        Num handles: 1
        Handle: 3027 Address: DF:A9:FF:F6:B1:1A (OUI DF-A9-FF)
        Count: 1
< HCI Command: Host Number of Compl.. (0x03|0x0035) plen 5  #60 [hci1] 4.713303
        Num handles: 1
        Handle: 3027 Address: DF:A9:FF:F6:B1:1A (OUI DF-A9-FF)
        Count: 1
< HCI Command: Host Number of Compl.. (0x03|0x0035) plen 5  #61 [hci1] 4.713659
        Num handles: 1
        Handle: 3027 Address: DF:A9:FF:F6:B1:1A (OUI DF-A9-FF)
        Count: 1
< ACL Data TX: Handle 3027 flags 0x00 dlen 27               #62 [hci1] 4.713780
< ACL Data TX: Handle 3027 flags 0x01 dlen 27               #63 [hci1] 4.713789
< ACL Data TX: Handle 3027 flags 0x01 dlen 15               #64 [hci1] 4.713818
      SMP: Pairing Public Key (0x0c) len 64
        X: 98308440221e2d910f0e54b71e7ec652857aa9b5a0dc65028824cc19db1226e9
        Y: 67a4816bcb62efb21701e31fdb27561a6217575fb007a8bbdabe7e28b6f68482
> HCI Event: Number of Completed Packets (0x13) plen 5      #65 [hci1] 4.794116
        Num handles: 1
        Handle: 3027 Address: DF:A9:FF:F6:B1:1A (OUI DF-A9-FF)
        Count: 1
        #62: len 27 (2 Kb/s)
        Latency: 80 msec (80-173 msec ~127 msec)
> HCI Event: Number of Completed Packets (0x13) plen 5      #66 [hci1] 4.794786
        Num handles: 1
        Handle: 3027 Address: DF:A9:FF:F6:B1:1A (OUI DF-A9-FF)
        Count: 1
        #63: len 27 (2 Kb/s)
        Latency: 80 msec (80-173 msec ~104 msec)
< ACL Data TX: Handle 3027 flags 0x00 dlen 21               #67 [hci1] 4.812623
      SMP: Pairing Confirm (0x03) len 16
        Confim value: cf975965683b351530d333269a3b73d1
> HCI Event: Number of Completed Packets (0x13) plen 5      #68 [hci1] 4.880952
        Num handles: 1
        Handle: 3027 Address: DF:A9:FF:F6:B1:1A (OUI DF-A9-FF)
        Count: 1
        #64: len 15 (0 Kb/s)
        Latency: 167 msec (80-173 msec ~135 msec)
> HCI Event: Number of Completed Packets (0x13) plen 5      #69 [hci1] 4.968748
        Num handles: 1
        Handle: 3027 Address: DF:A9:FF:F6:B1:1A (OUI DF-A9-FF)
        Count: 1
        #67: len 21 (1 Kb/s)
        Latency: 156 msec (80-173 msec ~145 msec)
> ACL Data RX: Handle 3027 flags 0x02 dlen 21               #70 [hci1] 4.969047
      SMP: Pairing Random (0x04) len 16
        Random value: eea8c8ae28bfe4ae0299deafc22eb442
< HCI Command: Host Number of Compl.. (0x03|0x0035) plen 5  #71 [hci1] 4.972550
        Num handles: 1
        Handle: 3027 Address: DF:A9:FF:F6:B1:1A (OUI DF-A9-FF)
        Count: 1
< ACL Data TX: Handle 3027 flags 0x00 dlen 21               #72 [hci1] 4.972588
      SMP: Pairing Random (0x04) len 16
        Random value: 8e6108f966a694cbe26df70bb96773e6
> HCI Event: Number of Completed Packets (0x13) plen 5      #73 [hci1] 5.143632
        Num handles: 1
        Handle: 3027 Address: DF:A9:FF:F6:B1:1A (OUI DF-A9-FF)
        Count: 1
        #72: len 21 (0 Kb/s)
        Latency: 171 msec (80-173 msec ~158 msec)
> ACL Data RX: Handle 3027 flags 0x02 dlen 21               #74 [hci1] 5.144062
      SMP: Pairing DHKey Check (0x0d) len 16
        E: cbda640ed7ec466fef5470373d491806
< HCI Command: Host Number of Compl.. (0x03|0x0035) plen 5  #75 [hci1] 5.153117
        Num handles: 1
        Handle: 3027 Address: DF:A9:FF:F6:B1:1A (OUI DF-A9-FF)
        Count: 1
< ACL Data TX: Handle 3027 flags 0x00 dlen 21               #76 [hci1] 5.153191
      SMP: Pairing DHKey Check (0x0d) len 16
        E: 798911ef2cc18a7958a6593240536c09
> HCI Event: Number of Completed Packets (0x13) plen 5      #77 [hci1] 5.318415
        Num handles: 1
        Handle: 3027 Address: DF:A9:FF:F6:B1:1A (OUI DF-A9-FF)
        Count: 1
        #76: len 21 (1 Kb/s)
        Latency: 165 msec (80-173 msec ~161 msec)
> HCI Event: LE Meta Event (0x3e) plen 13                   #78 [hci1] 5.406520
      LE Long Term Key Request (0x05)
        Handle: 3027 Address: DF:A9:FF:F6:B1:1A (OUI DF-A9-FF)
        Random number: 0x0000000000000000
        Encrypted diversifier: 0x0000
< HCI Command: LE Long Term Key Re.. (0x08|0x001a) plen 18  #79 [hci1] 5.412406
        Handle: 3027 Address: DF:A9:FF:F6:B1:1A (OUI DF-A9-FF)
        Long term key: be6a55ee06f0bd973692ddb3f6882b2b
> HCI Event: Command Complete (0x0e) plen 6                 #80 [hci1] 5.413089
      LE Long Term Key Request Reply (0x08|0x001a) ncmd 1
        Status: Success (0x00)
        Handle: 3027 Address: DF:A9:FF:F6:B1:1A (OUI DF-A9-FF)
> HCI Event: Encryption Change (0x08) plen 4                #81 [hci1] 5.843772
        Status: Success (0x00)
        Handle: 3027 Address: DF:A9:FF:F6:B1:1A (OUI DF-A9-FF)
        Encryption: Enabled with AES-CCM (0x01)
< ACL Data TX: Handle 3027 flags 0x00 dlen 16               #82 [hci1] 8.842652
      LE L2CAP: Connection Parameter Update Request (0x12) ident 1 len 8
        Min interval: 24
        Max interval: 40
        Peripheral latency: 0
        Timeout multiplier: 42
> HCI Event: Number of Completed Packets (0x13) plen 5      #83 [hci1] 8.993546
        Num handles: 1
        Handle: 3027 Address: DF:A9:FF:F6:B1:1A (OUI DF-A9-FF)
        Count: 1
        #82: len 16 (0 Kb/s)
        Latency: 150 msec (80-173 msec ~156 msec)
> HCI Event: Disconnect Complete (0x05) plen 4              #84 [hci1] 8.993769
        Status: Success (0x00)
        Handle: 3027 Address: DF:A9:FF:F6:B1:1A (OUI DF-A9-FF)
        Reason: Remote User Terminated Connection (0x13)
< HCI Command: LE Set Extended Ad.. (0x08|0x0036) plen 25  #85 [hci1] 10.282592
        Handle: 0x00
        Properties: 0x0013
          Connectable
          Scannable
          Use legacy advertising PDUs: ADV_IND
        Min advertising interval: 100.000 msec (0x00a0)
        Max advertising interval: 150.000 msec (0x00f0)
        Channel map: 37, 38, 39 (0x07)
        Own address type: Random (0x01)
        Peer address type: Public (0x00)
        Peer address: 00:00:00:00:00:00 (OUI 00-00-00)
        Filter policy: Allow Scan Request from Any, Allow Connect Request from Any (0x00)
        TX power: Host has no preference (0x7f)
        Primary PHY: LE 1M (0x01)
        Secondary max skip: 0x00
        Secondary PHY: LE 1M (0x01)
        SID: 0x00
        Scan request notifications: Disabled (0x00)
> HCI Event: Command Complete (0x0e) plen 5                #86 [hci1] 10.283442
      LE Set Extended Advertising Parameters (0x08|0x0036) ncmd 1
        Status: Success (0x00)
        TX power (selected): 0 dbm (0x00)
< HCI Command: LE Set Advertising... (0x08|0x0035) plen 7  #87 [hci1] 10.292418
        Advertising handle: 0x00
        Advertising random address: D5:B6:CC:31:DB:3B (Static)
> HCI Event: Command Complete (0x0e) plen 4                #88 [hci1] 10.292960
      LE Set Advertising Set Random Address (0x08|0x0035) ncmd 1
        Status: Success (0x00)
< HCI Command: LE Set Extended Ad.. (0x08|0x0037) plen 22  #89 [hci1] 10.312351
        Handle: 0x00
        Operation: Complete extended advertising data (0x03)
        Fragment preference: Minimize fragmentation (0x01)
        Data length: 0x12
        Flags: 0x06
          LE General Discoverable Mode
          BR/EDR Not Supported
        Name (complete): Tester_F6B11A
> HCI Event: Command Complete (0x0e) plen 4                #90 [hci1] 10.313114
      LE Set Extended Advertising Data (0x08|0x0037) ncmd 1
        Status: Success (0x00)
< HCI Command: LE Set Extended Sca.. (0x08|0x0038) plen 4  #91 [hci1] 10.332325
        Handle: 0x00
        Operation: Complete scan response data (0x03)
        Fragment preference: Minimize fragmentation (0x01)
        Data length: 0x00
> HCI Event: Command Complete (0x0e) plen 4                #92 [hci1] 10.332817
      LE Set Extended Scan Response Data (0x08|0x0038) ncmd 1
        Status: Success (0x00)
< HCI Command: LE Set Extended Adv.. (0x08|0x0039) plen 6  #93 [hci1] 10.352304
        Extended advertising: Enabled (0x01)
        Number of sets: 1 (0x01)
        Entry 0
          Handle: 0x00
          Duration: 0 ms (0x00)
          Max ext adv events: 0
> HCI Event: Command Complete (0x0e) plen 4                #94 [hci1] 10.352928
      LE Set Extended Advertising Enable (0x08|0x0039) ncmd 1
        Status: Success (0x00)
> HCI Event: LE Meta Event (0x3e) plen 31                  #95 [hci1] 10.684819
      LE Enhanced Connection Complete (0x0a)
        Status: Success (0x00)
        Handle: 3045
        Role: Peripheral (0x01)
        Peer address type: Public (0x00)
        Peer address: DF:A9:FF:F6:B1:1A (OUI DF-A9-FF)
        Local resolvable private address: 00:00:00:00:00:00 (Non-Resolvable)
        Peer resolvable private address: 00:00:00:00:00:00 (Non-Resolvable)
        Connection interval: 87.50 msec (0x0046)
        Connection latency: 0 (0x0000)
        Supervision timeout: 20000 msec (0x07d0)
        Central clock accuracy: 0x01
> HCI Event: LE Meta Event (0x3e) plen 6                   #96 [hci1] 10.684958
      LE Advertising Set Terminated (0x12)
        Status: Success (0x00)
        Handle: 0
        Connection handle: 3045
        Number of completed extended advertising events: 0
< HCI Command: LE Read Remote Used.. (0x08|0x0016) plen 2  #97 [hci1] 10.693158
        Handle: 3045 Address: DF:A9:FF:F6:B1:1A (OUI DF-A9-FF)
> HCI Event: Command Status (0x0f) plen 4                  #98 [hci1] 10.693761
      LE Read Remote Used Features (0x08|0x0016) ncmd 1
        Status: Success (0x00)
> HCI Event: LE Meta Event (0x3e) plen 12                  #99 [hci1] 10.948618
      LE Read Remote Used Features (0x04)
        Status: Success (0x00)
        Handle: 3045 Address: DF:A9:FF:F6:B1:1A (OUI DF-A9-FF)
        Features: 0x2d 0x49 0x00 0xf7 0x67 0xd9 0x00 0x80
          LE Encryption
          Extended Reject Indication
          Peripheral-initiated Features Exchange
          LE Data Packet Length Extension
          LE 2M PHY
          LE Coded PHY
          Channel Selection Algorithm #2
          Periodic Advertising Sync Transfer - Sender
          Periodic Advertising Sync Transfer - Recipient
          Sleep Clock Accuracy Updates
          Connected Isochronous Stream - Central
          Connected Isochronous Stream - Peripheral
          Isochronous Broadcaster
          Synchronized Receiver
          Connected Isochronous Stream (Host Support)
          LE Power Control Request
          LE Power Control Request
          Connection Subrating
          Connection Subrating (Host Support)
          Unknown features (0x8000d90000000000)
> ACL Data RX: Handle 3045 flags 0x02 dlen 11             #100 [hci1] 11.385940
      SMP: Pairing Request (0x01) len 6
        IO capability: DisplayYesNo (0x01)
        OOB data: Authentication data not present (0x00)
        Authentication requirement: No bonding, No MITM, SC, No Keypresses (0x08)
        Max encryption key size: 16
        Initiator key distribution: <none> (0x00)
        Responder key distribution: <none> (0x00)
< HCI Command: Host Number of Com.. (0x03|0x0035) plen 5  #101 [hci1] 11.392865
        Num handles: 1
        Handle: 3045 Address: DF:A9:FF:F6:B1:1A (OUI DF-A9-FF)
        Count: 1
< ACL Data TX: Handle 3045 flags 0x00 dlen 11             #102 [hci1] 11.392945
      SMP: Pairing Response (0x02) len 6
        IO capability: NoInputNoOutput (0x03)
        OOB data: Authentication data not present (0x00)
        Authentication requirement: No bonding, No MITM, SC, No Keypresses (0x08)
        Max encryption key size: 16
        Initiator key distribution: <none> (0x00)
        Responder key distribution: <none> (0x00)
> HCI Event: Number of Completed Packets (0x13) plen 5    #103 [hci1] 11.560962
        Num handles: 1
        Handle: 3045 Address: DF:A9:FF:F6:B1:1A (OUI DF-A9-FF)
        Count: 1
        #102: len 11 (0 Kb/s)
        Latency: 168 msec (168-168 msec ~168 msec)
> ACL Data RX: Handle 3045 flags 0x02 dlen 27             #104 [hci1] 11.561306
> ACL Data RX: Handle 3045 flags 0x01 dlen 27             #105 [hci1] 11.561838
> ACL Data RX: Handle 3045 flags 0x01 dlen 15             #106 [hci1] 11.562295
      SMP: Pairing Public Key (0x0c) len 64
        X: 0adf4caaf85c25f79509810ba2c9d898d88322ee005e2ebf87785a96d7f40460
        Y: bb9a0ae0ae15391025620482f199f935e3b53d4d07f72932801b8d21c4afe2a3
< HCI Command: Host Number of Com.. (0x03|0x0035) plen 5  #107 [hci1] 11.573315
        Num handles: 1
        Handle: 3045 Address: DF:A9:FF:F6:B1:1A (OUI DF-A9-FF)
        Count: 1
< HCI Command: Host Number of Com.. (0x03|0x0035) plen 5  #108 [hci1] 11.573432
        Num handles: 1
        Handle: 3045 Address: DF:A9:FF:F6:B1:1A (OUI DF-A9-FF)
        Count: 1
< HCI Command: Host Number of Com.. (0x03|0x0035) plen 5  #109 [hci1] 11.573637
        Num handles: 1
        Handle: 3045 Address: DF:A9:FF:F6:B1:1A (OUI DF-A9-FF)
        Count: 1
< ACL Data TX: Handle 3045 flags 0x00 dlen 27             #110 [hci1] 11.573821
< ACL Data TX: Handle 3045 flags 0x01 dlen 27             #111 [hci1] 11.573857
< ACL Data TX: Handle 3045 flags 0x01 dlen 15             #112 [hci1] 11.573861
      SMP: Pairing Public Key (0x0c) len 64
        X: 98308440221e2d910f0e54b71e7ec652857aa9b5a0dc65028824cc19db1226e9
        Y: 67a4816bcb62efb21701e31fdb27561a6217575fb007a8bbdabe7e28b6f68482
> HCI Event: Number of Completed Packets (0x13) plen 5    #113 [hci1] 11.648906
        Num handles: 1
        Handle: 3045 Address: DF:A9:FF:F6:B1:1A (OUI DF-A9-FF)
        Count: 1
        #110: len 27 (2 Kb/s)
        Latency: 75 msec (75-168 msec ~121 msec)
> HCI Event: Number of Completed Packets (0x13) plen 5    #114 [hci1] 11.649547
        Num handles: 1
        Handle: 3045 Address: DF:A9:FF:F6:B1:1A (OUI DF-A9-FF)
        Count: 1
        #111: len 27 (2 Kb/s)
        Latency: 75 msec (75-168 msec ~98 msec)
< ACL Data TX: Handle 3045 flags 0x00 dlen 21             #115 [hci1] 11.652446
      SMP: Pairing Confirm (0x03) len 16
        Confim value: 07fc02537a225618c8b056f2a0e254ee
> HCI Event: Number of Completed Packets (0x13) plen 5    #116 [hci1] 11.735782
        Num handles: 1
        Handle: 3045 Address: DF:A9:FF:F6:B1:1A (OUI DF-A9-FF)
        Count: 1
        #112: len 15 (0 Kb/s)
        Latency: 161 msec (75-168 msec ~130 msec)
> HCI Event: Number of Completed Packets (0x13) plen 5    #117 [hci1] 11.823415
        Num handles: 1
        Handle: 3045 Address: DF:A9:FF:F6:B1:1A (OUI DF-A9-FF)
        Count: 1
        #115: len 21 (0 Kb/s)
        Latency: 170 msec (75-170 msec ~150 msec)
> ACL Data RX: Handle 3045 flags 0x02 dlen 21             #118 [hci1] 11.823761
      SMP: Pairing Random (0x04) len 16
        Random value: 4a167ca3066cedd57cd89171a5c1ea31
< HCI Command: Host Number of Com.. (0x03|0x0035) plen 5  #119 [hci1] 11.832728
        Num handles: 1
        Handle: 3045 Address: DF:A9:FF:F6:B1:1A (OUI DF-A9-FF)
        Count: 1
< ACL Data TX: Handle 3045 flags 0x00 dlen 21             #120 [hci1] 11.832824
      SMP: Pairing Random (0x04) len 16
        Random value: 5da095555cc64d02679f89a05211af56
> HCI Event: Number of Completed Packets (0x13) plen 5    #121 [hci1] 11.998425
        Num handles: 1
        Handle: 3045 Address: DF:A9:FF:F6:B1:1A (OUI DF-A9-FF)
        Count: 1
        #120: len 21 (1 Kb/s)
        Latency: 165 msec (75-170 msec ~158 msec)
> ACL Data RX: Handle 3045 flags 0x02 dlen 21             #122 [hci1] 11.998784
      SMP: Pairing DHKey Check (0x0d) len 16
        E: ed74f522d7b73ae25223b02cb4a8ada0
< HCI Command: Host Number of Com.. (0x03|0x0035) plen 5  #123 [hci1] 12.012585
        Num handles: 1
        Handle: 3045 Address: DF:A9:FF:F6:B1:1A (OUI DF-A9-FF)
        Count: 1
< ACL Data TX: Handle 3045 flags 0x00 dlen 21             #124 [hci1] 12.012592
      SMP: Pairing DHKey Check (0x0d) len 16
        E: e668b73a1b76bc86cd075df269ccec73
> HCI Event: Number of Completed Packets (0x13) plen 5    #125 [hci1] 12.173258
        Num handles: 1
        Handle: 3045 Address: DF:A9:FF:F6:B1:1A (OUI DF-A9-FF)
        Count: 1
        #124: len 21 (1 Kb/s)
        Latency: 160 msec (75-170 msec ~159 msec)
> HCI Event: LE Meta Event (0x3e) plen 13                 #126 [hci1] 12.261293
      LE Long Term Key Request (0x05)
        Handle: 3045 Address: DF:A9:FF:F6:B1:1A (OUI DF-A9-FF)
        Random number: 0x0000000000000000
        Encrypted diversifier: 0x0000
< HCI Command: LE Long Term Key... (0x08|0x001a) plen 18  #127 [hci1] 12.272381
        Handle: 3045 Address: DF:A9:FF:F6:B1:1A (OUI DF-A9-FF)
        Long term key: 7f1885d6bbf4b6ac61a19f96fd5cba0e
> HCI Event: Command Complete (0x0e) plen 6               #128 [hci1] 12.273037
      LE Long Term Key Request Reply (0x08|0x001a) ncmd 1
        Status: Success (0x00)
        Handle: 3045 Address: DF:A9:FF:F6:B1:1A (OUI DF-A9-FF)
> HCI Event: Encryption Change (0x08) plen 4              #129 [hci1] 12.698564
        Status: Success (0x00)
        Handle: 3045 Address: DF:A9:FF:F6:B1:1A (OUI DF-A9-FF)
        Encryption: Enabled with AES-CCM (0x01)
< ACL Data TX: Handle 3045 flags 0x00 dlen 16             #130 [hci1] 15.702431
      LE L2CAP: Connection Parameter Update Request (0x12) ident 2 len 8
        Min interval: 24
        Max interval: 40
        Peripheral latency: 0
        Timeout multiplier: 42
> HCI Event: Number of Completed Packets (0x13) plen 5    #131 [hci1] 15.848181
        Num handles: 1
        Handle: 3045 Address: DF:A9:FF:F6:B1:1A (OUI DF-A9-FF)
        Count: 1
        #130: len 16 (0 Kb/s)
        Latency: 145 msec (75-170 msec ~152 msec)
> HCI Event: Disconnect Complete (0x05) plen 4            #132 [hci1] 15.848458
        Status: Success (0x00)
        Handle: 3045 Address: DF:A9:FF:F6:B1:1A (OUI DF-A9-FF)
        Reason: Remote User Terminated Connection (0x13)
< HCI Command: LE Set Extended A.. (0x08|0x0036) plen 25  #133 [hci1] 16.462439
        Handle: 0x00
        Properties: 0x0013
          Connectable
          Scannable
          Use legacy advertising PDUs: ADV_IND
        Min advertising interval: 100.000 msec (0x00a0)
        Max advertising interval: 150.000 msec (0x00f0)
        Channel map: 37, 38, 39 (0x07)
        Own address type: Random (0x01)
        Peer address type: Public (0x00)
        Peer address: 00:00:00:00:00:00 (OUI 00-00-00)
        Filter policy: Allow Scan Request from Any, Allow Connect Request from Any (0x00)
        TX power: Host has no preference (0x7f)
        Primary PHY: LE 1M (0x01)
        Secondary max skip: 0x00
        Secondary PHY: LE 1M (0x01)
        SID: 0x00
        Scan request notifications: Disabled (0x00)
> HCI Event: Command Complete (0x0e) plen 5               #134 [hci1] 16.463219
      LE Set Extended Advertising Parameters (0x08|0x0036) ncmd 1
        Status: Success (0x00)
        TX power (selected): 0 dbm (0x00)
< HCI Command: LE Set Advertising.. (0x08|0x0035) plen 7  #135 [hci1] 16.472397
        Advertising handle: 0x00
        Advertising random address: D5:B6:CC:31:DB:3B (Static)
> HCI Event: Command Complete (0x0e) plen 4               #136 [hci1] 16.472883
      LE Set Advertising Set Random Address (0x08|0x0035) ncmd 1
        Status: Success (0x00)
< HCI Command: LE Set Extended A.. (0x08|0x0037) plen 22  #137 [hci1] 16.492366
        Handle: 0x00
        Operation: Complete extended advertising data (0x03)
        Fragment preference: Minimize fragmentation (0x01)
        Data length: 0x12
        Flags: 0x06
          LE General Discoverable Mode
          BR/EDR Not Supported
        Name (complete): Tester_F6B11A
> HCI Event: Command Complete (0x0e) plen 4               #138 [hci1] 16.493096
      LE Set Extended Advertising Data (0x08|0x0037) ncmd 1
        Status: Success (0x00)
< HCI Command: LE Set Extended Sc.. (0x08|0x0038) plen 4  #139 [hci1] 16.512376
        Handle: 0x00
        Operation: Complete scan response data (0x03)
        Fragment preference: Minimize fragmentation (0x01)
        Data length: 0x00
> HCI Event: Command Complete (0x0e) plen 4               #140 [hci1] 16.512834
      LE Set Extended Scan Response Data (0x08|0x0038) ncmd 1
        Status: Success (0x00)
< HCI Command: LE Set Extended Ad.. (0x08|0x0039) plen 6  #141 [hci1] 16.532368
        Extended advertising: Enabled (0x01)
        Number of sets: 1 (0x01)
        Entry 0
          Handle: 0x00
          Duration: 0 ms (0x00)
          Max ext adv events: 0
> HCI Event: Command Complete (0x0e) plen 4               #142 [hci1] 16.532936
      LE Set Extended Advertising Enable (0x08|0x0039) ncmd 1
        Status: Success (0x00)
> HCI Event: LE Meta Event (0x3e) plen 31                 #143 [hci1] 16.861461
      LE Enhanced Connection Complete (0x0a)
        Status: Success (0x00)
        Handle: 3063
        Role: Peripheral (0x01)
        Peer address type: Public (0x00)
        Peer address: DF:A9:FF:F6:B1:1A (OUI DF-A9-FF)
        Local resolvable private address: 00:00:00:00:00:00 (Non-Resolvable)
        Peer resolvable private address: 00:00:00:00:00:00 (Non-Resolvable)
        Connection interval: 87.50 msec (0x0046)
        Connection latency: 0 (0x0000)
        Supervision timeout: 20000 msec (0x07d0)
        Central clock accuracy: 0x01
> HCI Event: LE Meta Event (0x3e) plen 6                  #144 [hci1] 16.861648
      LE Advertising Set Terminated (0x12)
        Status: Success (0x00)
        Handle: 0
        Connection handle: 3063
        Number of completed extended advertising events: 0
< HCI Command: LE Read Remote Use.. (0x08|0x0016) plen 2  #145 [hci1] 16.873367
        Handle: 3063 Address: DF:A9:FF:F6:B1:1A (OUI DF-A9-FF)
> HCI Event: Command Status (0x0f) plen 4                 #146 [hci1] 16.873852
      LE Read Remote Used Features (0x08|0x0016) ncmd 1
        Status: Success (0x00)
> HCI Event: LE Meta Event (0x3e) plen 12                 #147 [hci1] 17.125324
      LE Read Remote Used Features (0x04)
        Status: Success (0x00)
        Handle: 3063 Address: DF:A9:FF:F6:B1:1A (OUI DF-A9-FF)
        Features: 0x2d 0x49 0x00 0xf7 0x67 0xd9 0x00 0x80
          LE Encryption
          Extended Reject Indication
          Peripheral-initiated Features Exchange
          LE Data Packet Length Extension
          LE 2M PHY
          LE Coded PHY
          Channel Selection Algorithm #2
          Periodic Advertising Sync Transfer - Sender
          Periodic Advertising Sync Transfer - Recipient
          Sleep Clock Accuracy Updates
          Connected Isochronous Stream - Central
          Connected Isochronous Stream - Peripheral
          Isochronous Broadcaster
          Synchronized Receiver
          Connected Isochronous Stream (Host Support)
          LE Power Control Request
          LE Power Control Request
          Connection Subrating
          Connection Subrating (Host Support)
          Unknown features (0x8000d90000000000)
> ACL Data RX: Handle 3063 flags 0x02 dlen 11             #148 [hci1] 17.562577
      SMP: Pairing Request (0x01) len 6
        IO capability: DisplayYesNo (0x01)
        OOB data: Authentication data not present (0x00)
        Authentication requirement: No bonding, No MITM, SC, No Keypresses (0x08)
        Max encryption key size: 16
        Initiator key distribution: <none> (0x00)
        Responder key distribution: <none> (0x00)
< HCI Command: Host Number of Com.. (0x03|0x0035) plen 5  #149 [hci1] 17.572887
        Num handles: 1
        Handle: 3063 Address: DF:A9:FF:F6:B1:1A (OUI DF-A9-FF)
        Count: 1
< ACL Data TX: Handle 3063 flags 0x00 dlen 11             #150 [hci1] 17.573009
      SMP: Pairing Response (0x02) len 6
        IO capability: NoInputNoOutput (0x03)
        OOB data: Authentication data not present (0x00)
        Authentication requirement: No bonding, No MITM, SC, No Keypresses (0x08)
        Max encryption key size: 16
        Initiator key distribution: <none> (0x00)
        Responder key distribution: <none> (0x00)
> HCI Event: Number of Completed Packets (0x13) plen 5    #151 [hci1] 17.737719
        Num handles: 1
        Handle: 3063 Address: DF:A9:FF:F6:B1:1A (OUI DF-A9-FF)
        Count: 1
        #150: len 11 (0 Kb/s)
        Latency: 164 msec (164-164 msec ~164 msec)
> ACL Data RX: Handle 3063 flags 0x02 dlen 27             #152 [hci1] 17.737943
> ACL Data RX: Handle 3063 flags 0x01 dlen 27             #153 [hci1] 17.738577
> ACL Data RX: Handle 3063 flags 0x01 dlen 15             #154 [hci1] 17.738948
      SMP: Pairing Public Key (0x0c) len 64
        X: 173abf12780e5edbde7e5cce6c4aad0cbef7b352b8ba182e10241e82983e83b0
        Y: 2a16a64518463a4e0df011c45e18de49dffb6fa6c61b7bf98ef9b25251c9f611
< HCI Command: Host Number of Com.. (0x03|0x0035) plen 5  #155 [hci1] 17.752882
        Num handles: 1
        Handle: 3063 Address: DF:A9:FF:F6:B1:1A (OUI DF-A9-FF)
        Count: 1
< HCI Command: Host Number of Com.. (0x03|0x0035) plen 5  #156 [hci1] 17.753021
        Num handles: 1
        Handle: 3063 Address: DF:A9:FF:F6:B1:1A (OUI DF-A9-FF)
        Count: 1
< HCI Command: Host Number of Com.. (0x03|0x0035) plen 5  #157 [hci1] 17.753131
        Num handles: 1
        Handle: 3063 Address: DF:A9:FF:F6:B1:1A (OUI DF-A9-FF)
        Count: 1
< ACL Data TX: Handle 3063 flags 0x00 dlen 27             #158 [hci1] 17.753185
< ACL Data TX: Handle 3063 flags 0x01 dlen 27             #159 [hci1] 17.753190
< ACL Data TX: Handle 3063 flags 0x01 dlen 15             #160 [hci1] 17.753204
      SMP: Pairing Public Key (0x0c) len 64
        X: 98308440221e2d910f0e54b71e7ec652857aa9b5a0dc65028824cc19db1226e9
        Y: 67a4816bcb62efb21701e31fdb27561a6217575fb007a8bbdabe7e28b6f68482
> HCI Event: Number of Completed Packets (0x13) plen 5    #161 [hci1] 17.825517
        Num handles: 1
        Handle: 3063 Address: DF:A9:FF:F6:B1:1A (OUI DF-A9-FF)
        Count: 1
        #158: len 27 (3 Kb/s)
        Latency: 72 msec (72-164 msec ~118 msec)
> HCI Event: Number of Completed Packets (0x13) plen 5    #162 [hci1] 17.826272
        Num handles: 1
        Handle: 3063 Address: DF:A9:FF:F6:B1:1A (OUI DF-A9-FF)
        Count: 1
        #159: len 27 (2 Kb/s)
        Latency: 73 msec (72-164 msec ~95 msec)
< ACL Data TX: Handle 3063 flags 0x00 dlen 21             #163 [hci1] 17.832786
      SMP: Pairing Confirm (0x03) len 16
        Confim value: f0ebfd54b89036238285c12ee81207c4
> HCI Event: Number of Completed Packets (0x13) plen 5    #164 [hci1] 17.912399
        Num handles: 1
        Handle: 3063 Address: DF:A9:FF:F6:B1:1A (OUI DF-A9-FF)
        Count: 1
        #160: len 15 (0 Kb/s)
        Latency: 159 msec (72-164 msec ~127 msec)
> HCI Event: Number of Completed Packets (0x13) plen 5    #165 [hci1] 18.000069
        Num handles: 1
        Handle: 3063 Address: DF:A9:FF:F6:B1:1A (OUI DF-A9-FF)
        Count: 1
        #163: len 21 (1 Kb/s)
        Latency: 167 msec (72-167 msec ~147 msec)
> ACL Data RX: Handle 3063 flags 0x02 dlen 21             #166 [hci1] 18.000554
      SMP: Pairing Random (0x04) len 16
        Random value: f4496bcc8255847acc7c942bdb1e1fee
< HCI Command: Host Number of Com.. (0x03|0x0035) plen 5  #167 [hci1] 18.012723
        Num handles: 1
        Handle: 3063 Address: DF:A9:FF:F6:B1:1A (OUI DF-A9-FF)
        Count: 1
< ACL Data TX: Handle 3063 flags 0x00 dlen 21             #168 [hci1] 18.012797
      SMP: Pairing Random (0x04) len 16
        Random value: da64d21ec8845e8286bc235a02440d0c
> HCI Event: Number of Completed Packets (0x13) plen 5    #169 [hci1] 18.175105
        Num handles: 1
        Handle: 3063 Address: DF:A9:FF:F6:B1:1A (OUI DF-A9-FF)
        Count: 1
        #168: len 21 (1 Kb/s)
        Latency: 162 msec (72-167 msec ~154 msec)
> ACL Data RX: Handle 3063 flags 0x02 dlen 21             #170 [hci1] 18.175462
      SMP: Pairing DHKey Check (0x0d) len 16
        E: 8c45b6082d98c82838bfa89b80d86070
< HCI Command: Host Number of Com.. (0x03|0x0035) plen 5  #171 [hci1] 18.192588
        Num handles: 1
        Handle: 3063 Address: DF:A9:FF:F6:B1:1A (OUI DF-A9-FF)
        Count: 1
< ACL Data TX: Handle 3063 flags 0x00 dlen 21             #172 [hci1] 18.192856
      SMP: Pairing DHKey Check (0x0d) len 16
        E: eb5c85f6bc40e2f28d5882f47ee98067
> HCI Event: Number of Completed Packets (0x13) plen 5    #173 [hci1] 18.349918
        Num handles: 1
        Handle: 3063 Address: DF:A9:FF:F6:B1:1A (OUI DF-A9-FF)
        Count: 1
        #172: len 21 (1 Kb/s)
        Latency: 157 msec (72-167 msec ~155 msec)
> HCI Event: LE Meta Event (0x3e) plen 13                 #174 [hci1] 18.437972
      LE Long Term Key Request (0x05)
        Handle: 3063 Address: DF:A9:FF:F6:B1:1A (OUI DF-A9-FF)
        Random number: 0x0000000000000000
        Encrypted diversifier: 0x0000
< HCI Command: LE Long Term Key... (0x08|0x001a) plen 18  #175 [hci1] 18.452456
        Handle: 3063 Address: DF:A9:FF:F6:B1:1A (OUI DF-A9-FF)
        Long term key: 49130dc5016de60116a6a120fd967524
> HCI Event: Command Complete (0x0e) plen 6               #176 [hci1] 18.453165
      LE Long Term Key Request Reply (0x08|0x001a) ncmd 1
        Status: Success (0x00)
        Handle: 3063 Address: DF:A9:FF:F6:B1:1A (OUI DF-A9-FF)
> HCI Event: Encryption Change (0x08) plen 4              #177 [hci1] 18.875155
        Status: Success (0x00)
        Handle: 3063 Address: DF:A9:FF:F6:B1:1A (OUI DF-A9-FF)
        Encryption: Enabled with AES-CCM (0x01)
< ACL Data TX: Handle 3063 flags 0x00 dlen 16             #178 [hci1] 21.882475
      LE L2CAP: Connection Parameter Update Request (0x12) ident 3 len 8
        Min interval: 24
        Max interval: 40
        Peripheral latency: 0
        Timeout multiplier: 42
> HCI Event: Number of Completed Packets (0x13) plen 5    #179 [hci1] 22.024885
        Num handles: 1
        Handle: 3063 Address: DF:A9:FF:F6:B1:1A (OUI DF-A9-FF)
        Count: 1
        #178: len 16 (0 Kb/s)
        Latency: 142 msec (72-167 msec ~149 msec)
> HCI Event: Disconnect Complete (0x05) plen 4            #180 [hci1] 22.025135
        Status: Success (0x00)
        Handle: 3063 Address: DF:A9:FF:F6:B1:1A (OUI DF-A9-FF)
        Reason: Remote User Terminated Connection (0x13)
< HCI Command: Reset (0x03|0x0003) plen 0                 #181 [hci1] 30.882509
> HCI Event: Command Complete (0x0e) plen 4               #182 [hci1] 30.883021
      Reset (0x03|0x0003) ncmd 1
        Status: Success (0x00)
@ USER Close: main                                    {0x0001} [hci1] 30.892520
= Close Index: 00:00:00:00:00:00                               [hci1] 30.892532
