Bluetooth monitor ver 5.84
btmon[3855244]: = Note: Linux version 6.8.0-83-generic (x86_64)                                                          0.389525
btmon[3855244]: = Note: Bluetooth subsystem version 2.22                                                                 0.389527
= New Index: 00:00:00:00:00:00 (Primary,UART,hci0)                                                                       0.389528
= Open Index: 00:00:00:00:00:00                                                                                          0.896610
= Index Info: 00:00:00:00:00:00 (Nordic Semiconductor ASA)                                                               0.896614
zephyr.exe[3855246]: @ USER Open: main (privileged) version 2.22                                                {0x0001} 0.896616
zephyr.exe[3855246]: < HCI Command: Reset (0x03|0x0003) plen 0                                                        #1 0.896870
> HCI Event: Command Complete (0x0e) plen 4                                                                           #2 0.897537
      Reset (0x03|0x0003) ncmd 1
        Status: Success (0x00)
zephyr.exe[3855246]: < HCI Command: Read Local Supported Features (0x04|0x0003) plen 0                                #3 0.916557
> HCI Event: Command Complete (0x0e) plen 12                                                                          #4 0.917053
      Read Local Supported Features (0x04|0x0003) ncmd 1
        Status: Success (0x00)
        Features: 0x00 0x00 0x00 0x00 0x60 0x00 0x00 0x00
          BR/EDR Not Supported
          LE Supported (Controller)
zephyr.exe[3855246]: < HCI Command: Read Local Version Information (0x04|0x0001) plen 0                               #5 0.936526
> HCI Event: Command Complete (0x0e) plen 12                                                                          #6 0.937318
      Read Local Version Information (0x04|0x0001) ncmd 1
        Status: Success (0x00)
        HCI version: Reserved (0x0e) - Revision 12520 (0x30e8)
        LMP version: Reserved (0x0e) - Subversion 12520 (0x30e8)
        Manufacturer: Nordic Semiconductor ASA (89)
zephyr.exe[3855246]: < HCI Command: Read Local Supported Commands (0x04|0x0002) plen 0                                #7 0.956530
> HCI Event: Command Complete (0x0e) plen 68                                                                          #8 0.957768
      Read Local Supported Commands (0x04|0x0002) ncmd 1
        Status: Success (0x00)
        Commands: 119 entries
          Disconnect (Octet 0 - Bit 5)
          Read Remote Version Information (Octet 2 - Bit 7)
          Set Event Mask (Octet 5 - Bit 6)
          Reset (Octet 5 - Bit 7)
          Read Connection Accept Timeout (Octet 7 - Bit 2)
          Write Connection Accept Timeout (Octet 7 - Bit 3)
          Read Transmit Power Level (Octet 10 - Bit 2)
          Set Controller To Host Flow Control (Octet 10 - Bit 5)
          Host Buffer Size (Octet 10 - Bit 6)
          Host Number of Completed Packets (Octet 10 - Bit 7)
          Read Local Version Information (Octet 14 - Bit 3)
          Read Local Supported Features (Octet 14 - Bit 5)
          Read BD ADDR (Octet 15 - Bit 1)
          Read RSSI (Octet 15 - Bit 5)
          Set Event Mask Page 2 (Octet 22 - Bit 2)
          LE Set Event Mask (Octet 25 - Bit 0)
          LE Read Buffer Size (Octet 25 - Bit 1)
          LE Read Local Supported Features (Octet 25 - Bit 2)
          LE Set Random Address (Octet 25 - Bit 4)
          LE Set Advertising Parameters (Octet 25 - Bit 5)
          LE Read Advertising Channel TX Power (Octet 25 - Bit 6)
          LE Set Advertising Data (Octet 25 - Bit 7)
          LE Set Scan Response Data (Octet 26 - Bit 0)
          LE Set Advertise Enable (Octet 26 - Bit 1)
          LE Set Scan Parameters (Octet 26 - Bit 2)
          LE Set Scan Enable (Octet 26 - Bit 3)
          LE Create Connection (Octet 26 - Bit 4)
          LE Create Connection Cancel (Octet 26 - Bit 5)
          LE Read Accept List Size (Octet 26 - Bit 6)
          LE Clear Accept List (Octet 26 - Bit 7)
          LE Add Device To Accept List (Octet 27 - Bit 0)
          LE Remove Device From Accept List (Octet 27 - Bit 1)
          LE Connection Update (Octet 27 - Bit 2)
          LE Set Host Channel Classification (Octet 27 - Bit 3)
          LE Read Channel Map (Octet 27 - Bit 4)
          LE Read Remote Used Features (Octet 27 - Bit 5)
          LE Encrypt (Octet 27 - Bit 6)
          LE Rand (Octet 27 - Bit 7)
          LE Start Encryption (Octet 28 - Bit 0)
          LE Long Term Key Request Reply (Octet 28 - Bit 1)
          LE Long Term Key Request Neg Reply (Octet 28 - Bit 2)
          LE Read Supported States (Octet 28 - Bit 3)
          LE Receiver Test (Octet 28 - Bit 4)
          LE Transmitter Test (Octet 28 - Bit 5)
          LE Test End (Octet 28 - Bit 6)
          Read Authenticated Payload Timeout (Octet 32 - Bit 4)
          Write Authenticated Payload Timeout (Octet 32 - Bit 5)
          LE Set Data Length (Octet 33 - Bit 6)
          LE Read Suggested Default Data Length (Octet 33 - Bit 7)
          LE Write Suggested Default Data Length (Octet 34 - Bit 0)
          LE Add Device To Resolving List (Octet 34 - Bit 3)
          LE Remove Device From Resolving List (Octet 34 - Bit 4)
          LE Clear Resolving List (Octet 34 - Bit 5)
          LE Read Resolving List Size (Octet 34 - Bit 6)
          LE Set Address Resolution Enable (Octet 35 - Bit 1)
          LE Set Resolvable Private Address Timeout (Octet 35 - Bit 2)
          LE Read Maximum Data Length (Octet 35 - Bit 3)
          LE Read PHY (Octet 35 - Bit 4)
          LE Set Default PHY (Octet 35 - Bit 5)
          LE Set PHY (Octet 35 - Bit 6)
          LE Enhanced Receiver Test (Octet 35 - Bit 7)
          LE Enhanced Transmitter Test (Octet 36 - Bit 0)
          LE Set Advertising Set Random Address (Octet 36 - Bit 1)
          LE Set Extended Advertising Parameters (Octet 36 - Bit 2)
          LE Set Extended Advertising Data (Octet 36 - Bit 3)
          LE Set Extended Scan Response Data (Octet 36 - Bit 4)
          LE Set Extended Advertising Enable (Octet 36 - Bit 5)
          LE Read Maximum Advertising Data Length (Octet 36 - Bit 6)
          LE Read Number of Supported Advertising Sets (Octet 36 - Bit 7)
          LE Remove Advertising Set (Octet 37 - Bit 0)
          LE Clear Advertising Sets (Octet 37 - Bit 1)
          LE Set Periodic Advertising Parameters (Octet 37 - Bit 2)
          LE Set Periodic Advertising Data (Octet 37 - Bit 3)
          LE Set Periodic Advertising Enable (Octet 37 - Bit 4)
          LE Set Extended Scan Parameters (Octet 37 - Bit 5)
          LE Set Extended Scan Enable (Octet 37 - Bit 6)
          LE Extended Create Connection (Octet 37 - Bit 7)
          LE Periodic Advertising Create Sync (Octet 38 - Bit 0)
          LE Periodic Advertising Create Sync Cancel (Octet 38 - Bit 1)
          LE Periodic Advertising Terminate Sync (Octet 38 - Bit 2)
          LE Add Device To Periodic Advertiser List (Octet 38 - Bit 3)
          LE Remove Device From Periodic Advertiser List (Octet 38 - Bit 4)
          LE Clear Periodic Advertiser List (Octet 38 - Bit 5)
          LE Read Periodic Advertiser List Size (Octet 38 - Bit 6)
          LE Read Transmit Power (Octet 38 - Bit 7)
          LE Read RF Path Compensation (Octet 39 - Bit 0)
          LE Write RF Path Compensation (Octet 39 - Bit 1)
          LE Set Privacy Mode (Octet 39 - Bit 2)
          LE Periodic Advertising Receive Enable (Octet 40 - Bit 5)
          LE Periodic Advertising Sync Transfer (Octet 40 - Bit 6)
          LE Periodic Advertising Set Info Transfer (Octet 40 - Bit 7)
          LE Periodic Advertising Sync Transfer Parameters (Octet 41 - Bit 0)
          LE Set Default Periodic Advertisng Sync Transfer Parameters (Octet 41 - Bit 1)
          LE Read Buffer v2 (Octet 41 - Bit 5)
          LE Read ISO TX Sync (Octet 41 - Bit 6)
          LE Set Connected Isochronous Group Parameters (Octet 41 - Bit 7)
          LE Set Connected Isochronous Group Parameters Test (Octet 42 - Bit 0)
          LE Create Connected Isochronous Stream (Octet 42 - Bit 1)
          LE Remove Connected Isochronous Group (Octet 42 - Bit 2)
          LE Accept Connected Isochronous Stream Request (Octet 42 - Bit 3)
          LE Reject Connected Isochronous Stream Request (Octet 42 - Bit 4)
          LE Create Broadcast Isochronous Group (Octet 42 - Bit 5)
          LE Create Broadcast Isochronous Group Test (Octet 42 - Bit 6)
          LE Terminate Broadcast Isochronous Group (Octet 42 - Bit 7)
          LE Broadcast Isochronous Group Create Sync (Octet 43 - Bit 0)
          LE Broadcast Isochronous Group Terminate Sync (Octet 43 - Bit 1)
          LE Request Peer SCA (Octet 43 - Bit 2)
          LE Setup Isochronous Data Path (Octet 43 - Bit 3)
          LE Remove Isochronous Data Path (Octet 43 - Bit 4)
          LE Isochronous Transmit Test (Octet 43 - Bit 5)
          LE Isochronous Receive Test (Octet 43 - Bit 6)
          LE Isochronous Read Test Counters (Octet 43 - Bit 7)
          LE Isochronous Read Test Counters (Octet 44 - Bit 0)
          LE Set Host Feature (Octet 44 - Bit 1)
          LE Read ISO link quality (Octet 44 - Bit 2)
          Octet 45 - Bit 6 
          Octet 46 - Bit 0 
          Octet 46 - Bit 1 
          Octet 46 - Bit 2 
zephyr.exe[3855246]: < HCI Command: Host Buffer Size (0x03|0x0033) plen 7                                             #9 0.976550
        ACL MTU: 255  ACL max packet: 16
        SCO MTU: 0    SCO max packet: 0
> HCI Event: Command Complete (0x0e) plen 4                                                                          #10 0.977615
      Host Buffer Size (0x03|0x0033) ncmd 1
        Status: Success (0x00)
zephyr.exe[3855246]: < HCI Command: Set Controller To Host Flow Control (0x03|0x0031) plen 1                         #11 0.996508
        Flow control: ACL Data Packets (0x01)
> HCI Event: Command Complete (0x0e) plen 4                                                                          #12 0.997233
      Set Controller To Host Flow Control (0x03|0x0031) ncmd 1
        Status: Success (0x00)
zephyr.exe[3855246]: < HCI Command: LE Read Local Supported Features (0x08|0x0003) plen 0                            #13 1.016551
> HCI Event: Command Complete (0x0e) plen 12                                                                         #14 1.017210
      LE Read Local Supported Features (0x08|0x0003) ncmd 1
        Status: Success (0x00)
        Features: 0xfd 0x79 0x00 0xf7 0x30 0x01 0x00 0x00
          LE Encryption
          Extended Reject Indication
          Peripheral-initiated Features Exchange
          LE Ping
          LE Data Packet Length Extension
          LL Privacy
          Extended Scanner Filter Policies
          LE 2M PHY
          LE Coded PHY
          LE Extended Advertising
          LE Periodic Advertising
          Channel Selection Algorithm #2
          Periodic Advertising Sync Transfer - Sender
          Periodic Advertising Sync Transfer - Recipient
          Sleep Clock Accuracy Updates
          Connected Isochronous Stream - Central
          Connected Isochronous Stream - Peripheral
          Isochronous Broadcaster
          Synchronized Receiver
          Periodic Advertising ADI support
          Connection Subrating
          Unknown features (0x0000010000000000)
zephyr.exe[3855246]: < HCI Command: LE Set Host Feature (0x08|0x0074) plen 2                                         #15 1.036553
        Bit Number: 32
          Connected Isochronous Stream (Host Support)
        Bit Value: 1
> HCI Event: Command Complete (0x0e) plen 4                                                                          #16 1.037019
      LE Set Host Feature (0x08|0x0074) ncmd 1
        Status: Success (0x00)
zephyr.exe[3855246]: < HCI Command: LE Read Buffer v2 (0x08|0x0060) plen 0                                           #17 1.056564
> HCI Event: Command Complete (0x0e) plen 10                                                                         #18 1.057150
      LE Read Buffer v2 (0x08|0x0060) ncmd 1
        Status: Success (0x00)
        ACL MTU: 27
        ACL max packet: 3
        ISO MTU: 318
        ISO max packet: 3
zephyr.exe[3855246]: < HCI Command: LE Read Maximum Advertising Data Length (0x08|0x003a) plen 0                     #19 1.076555
> HCI Event: Command Complete (0x0e) plen 6                                                                          #20 1.077081
      LE Read Maximum Advertising Data Length (0x08|0x003a) ncmd 1
        Status: Success (0x00)
        Max length: 1650
zephyr.exe[3855246]: < HCI Command: LE Read Supported States (0x08|0x001c) plen 0                                    #21 1.096526
> HCI Event: Command Complete (0x0e) plen 12                                                                         #22 1.097299
      LE Read Supported States (0x08|0x001c) ncmd 1
        Status: Success (0x00)
        States: 0x000003ff3e0306ff
          Non-connectable Advertising State
          Scannable Advertising State
          Connectable Advertising State
          High Duty Cycle Directed Advertising State
          Passive Scanning State
          Active Scanning State
          Initiating State
            and Connection State (Central Role)
          Connection State (Peripheral Role)
          Scannable Advertising State
            and Passive Scanning State
          Connectable Advertising State
            and Passive Scanning State
          Non-connectable Advertising State
            and Initiating State
          Scannable Advertising State
            and Initiating State
          Active Scanning State
            and Connection State (Central Role)
          Passive Scanning State
            and Connection State (Peripheral Role)
          Active Scanning State
            and Connection State (Peripheral Role)
          Initiating State
            and Connection State (Central Role)
            and Central Role & Central Role
          Low Duty Cycle Directed Advertising State
          Connectable Advertising State
            and Initiating State
            and Central Role & Peripheral Role
          High Duty Cycle Directed Advertising State
            and Initiating State
            and Central Role & Peripheral Role
          Low Duty Cycle Directed Advertising State
            and Initiating State
            and Central Role & Peripheral Role
          Connectable Advertising State
            and Connection State (Central Role)
            and Central Role & Peripheral Role
          High Duty Cycle Directed Advertising State
            and Connection State (Central Role)
            and Central Role & Peripheral Role
          Low Duty Cycle Directed Advertising State
            and Connection State (Central Role)
            and Central Role & Peripheral Role
          Connectable Advertising State
            and Connection State (Peripheral Role)
            and Central Role & Peripheral Role
          High Duty Cycle Directed Advertising State
            and Connection State (Peripheral Role)
            and Peripheral Role & Peripheral Role
          Low Duty Cycle Directed Advertising State
            and Connection State (Peripheral Role)
            and Peripheral Role & Peripheral Role
          Initiating State
            and Connection State (Peripheral Role)
            and Central Role & Peripheral Role
zephyr.exe[3855246]: < HCI Command: LE Read Maximum Data Length (0x08|0x002f) plen 0                                 #23 1.116475
> HCI Event: Command Complete (0x0e) plen 12                                                                         #24 1.117144
      LE Read Maximum Data Length (0x08|0x002f) ncmd 1
        Status: Success (0x00)
        Max TX octets: 251
        Max TX time: 2704
        Max RX octets: 251
        Max RX time: 2704
zephyr.exe[3855246]: < HCI Command: LE Write Suggested Default Data Length (0x08|0x0024) plen 4                      #25 1.136548
        TX octets: 251
        TX time: 2704
> HCI Event: Command Complete (0x0e) plen 4                                                                          #26 1.136938
      LE Write Suggested Default Data Length (0x08|0x0024) ncmd 1
        Status: Success (0x00)
zephyr.exe[3855246]: < HCI Command: LE Read Resolving List Size (0x08|0x002a) plen 0                                 #27 1.156533
> HCI Event: Command Complete (0x0e) plen 5                                                                          #28 1.157144
      LE Read Resolving List Size (0x08|0x002a) ncmd 1
        Status: Success (0x00)
        Size: 8
zephyr.exe[3855246]: < HCI Command: LE Set Event Mask (0x08|0x0001) plen 8                                           #29 1.176562
        Mask: 0x000002023f87fa5e
          LE Advertising Report
          LE Connection Update Complete
          LE Read Remote Used Features Complete
          LE Long Term Key Request
          LE Data Length Change
          LE Enhanced Connection Complete
          LE PHY Update Complete
          LE Extended Advertising Report
          LE Periodic Advertising Sync Established
          LE Periodic Advertising Report
          LE Periodic Advertising Sync Lost
          LE Extended Scan Timeout
          LE Extended Advertising Set Terminated
          LE Scan Request Received
          LE Periodic Advertising Sync Transfer Rvc
          LE CIS Established
          LE CIS Request
          LE Create BIG Complete
          LE Terminate BIG Complete
          LE BIG Sync Established Complete
          LE BIG Sync Lost
          LE BIG Info Advertising Report
          Unknown mask (0x0000020000000000)
> HCI Event: Command Complete (0x0e) plen 4                                                                          #30 1.177256
      LE Set Event Mask (0x08|0x0001) ncmd 1
        Status: Success (0x00)
zephyr.exe[3855246]: < HCI Command: Set Event Mask (0x03|0x0001) plen 8                                              #31 1.196525
        Mask: 0x2000800002008890
          Disconnection Complete
          Encryption Change
          Read Remote Version Information Complete
          Hardware Error
          Data Buffer Overflow
          Encryption Key Refresh Complete
          LE Meta
> HCI Event: Command Complete (0x0e) plen 4                                                                          #32 1.197155
      Set Event Mask (0x03|0x0001) ncmd 1
        Status: Success (0x00)
zephyr.exe[3855246]: < HCI Command: Read BD ADDR (0x04|0x0009) plen 0                                                #33 1.216556
> HCI Event: Command Complete (0x0e) plen 10                                                                         #34 1.217045
      Read BD ADDR (0x04|0x0009) ncmd 1
        Status: Success (0x00)
        Address: 00:00:00:00:00:00 (OUI 00-00-00)
zephyr.exe[3855246]: < HCI Command: LE Set Random Address (0x08|0x0005) plen 6                                       #35 1.236543
        Address: D5:B6:CC:31:DB:3B (Static)
> HCI Event: Command Complete (0x0e) plen 4                                                                          #36 1.237397
      LE Set Random Address (0x08|0x0005) ncmd 1
        Status: Success (0x00)
zephyr.exe[3855246]: < HCI Command: LE Extended Create Connection (0x08|0x0043) plen 26                              #37 5.126575
        Filter policy: Accept list is not used (0x00)
        Own address type: Random (0x01)
        Peer address type: Public (0x00)
        Peer address: DF:A9:FF:F6:B1:1A (OUI DF-A9-FF)
        Initiating PHYs: 0x01
        Entry 0: LE 1M
          Scan interval: 60.000 msec (0x0060)
          Scan window: 60.000 msec (0x0060)
          Min connection interval: 30.00 msec (0x0018)
          Max connection interval: 50.00 msec (0x0028)
          Connection latency: 0 (0x0000)
          Supervision timeout: 4000 msec (0x0190)
          Min connection length: 0.000 msec (0x0000)
          Max connection length: 0.000 msec (0x0000)
> HCI Event: Command Status (0x0f) plen 4                                                                            #38 5.127585
      LE Extended Create Connection (0x08|0x0043) ncmd 1
        Status: Success (0x00)
> HCI Event: LE Meta Event (0x3e) plen 31                                                                            #39 5.188495
      LE Enhanced Connection Complete (0x0a)
        Status: Success (0x00)
        Handle: 450
        Role: Central (0x00)
        Peer address type: Public (0x00)
        Peer address: DF:A9:FF:F6:B1:1A (OUI DF-A9-FF)
        Local resolvable private address: 00:00:00:00:00:00 (Non-Resolvable)
        Peer resolvable private address: 00:00:00:00:00:00 (Non-Resolvable)
        Connection interval: 50.00 msec (0x0028)
        Connection latency: 0 (0x0000)
        Supervision timeout: 4000 msec (0x0190)
        Central clock accuracy: 0x00
zephyr.exe[3855246]: < HCI Command: LE Read Remote Used Features (0x08|0x0016) plen 2                                #40 5.196694
        Handle: 450 Address: DF:A9:FF:F6:B1:1A (OUI DF-A9-FF)
> HCI Event: Command Status (0x0f) plen 4                                                                            #41 5.197322
      LE Read Remote Used Features (0x08|0x0016) ncmd 1
        Status: Success (0x00)
zephyr.exe[3855246]: < HCI Command: LE Set PHY (0x08|0x0032) plen 7                                                  #42 5.216658
        Handle: 450 Address: DF:A9:FF:F6:B1:1A (OUI DF-A9-FF)
        All PHYs preference: 0x00
        TX PHYs preference: 0x02
          LE 2M
        RX PHYs preference: 0x02
          LE 2M
        PHY options preference: Reserved (0x0000)
> HCI Event: Command Status (0x0f) plen 4                                                                            #43 5.217552
      LE Set PHY (0x08|0x0032) ncmd 1
        Status: Success (0x00)
> HCI Event: LE Meta Event (0x3e) plen 12                                                                            #44 5.339966
      LE Read Remote Used Features (0x04)
        Status: Success (0x00)
        Handle: 450 Address: DF:A9:FF:F6:B1:1A (OUI DF-A9-FF)
        Features: 0x2d 0x49 0x00 0xf7 0x67 0xd8 0x00 0x00
          LE Encryption
          Extended Reject Indication
          Peripheral-initiated Features Exchange
          LE Data Packet Length Extension
          LE 2M PHY
          LE Coded PHY
          Channel Selection Algorithm #2
          Periodic Advertising Sync Transfer - Sender
          Periodic Advertising Sync Transfer - Recipient
          Sleep Clock Accuracy Updates
          Connected Isochronous Stream - Central
          Connected Isochronous Stream - Peripheral
          Isochronous Broadcaster
          Synchronized Receiver
          Connected Isochronous Stream (Host Support)
          LE Power Control Request
          LE Power Control Request
          Connection Subrating
          Connection Subrating (Host Support)
          Unknown features (0x0000d80000000000)
> HCI Event: LE Meta Event (0x3e) plen 6                                                                             #45 5.839348
      LE PHY Update Complete (0x0c)
        Status: Success (0x00)
        Handle: 450 Address: DF:A9:FF:F6:B1:1A (OUI DF-A9-FF)
        TX PHY: LE 2M (0x02)
        RX PHY: LE 2M (0x02)
zephyr.exe[3855246]: < ACL Data TX: Handle 450 [1/3] flags 0x00 dlen 11                                              #46 6.166600
      SMP: Pairing Request (0x01) len 6
        IO capability: KeyboardDisplay (0x04)
        OOB data: Authentication data not present (0x00)
        Authentication requirement: Bonding, No MITM, SC, No Keypresses (0x09)
        Max encryption key size: 16
        Initiator key distribution: EncKey Sign (0x05)
        Responder key distribution: EncKey IdKey Sign (0x07)
> HCI Event: Number of Completed Packets (0x13) plen 5                                                               #47 6.189940
        Num handles: 1
        Handle: 450 Address: DF:A9:FF:F6:B1:1A (OUI DF-A9-FF)
        Count: 1
        Buffers: 0/3
        #46: len 11 (3 Kb/s)
        Latency: 23 msec (23-23 msec ~23 msec)
> ACL Data RX: Handle 450 flags 0x02 dlen 11                                                                         #48 6.240360
      SMP: Pairing Response (0x02) len 6
        IO capability: KeyboardDisplay (0x04)
        OOB data: Authentication data not present (0x00)
        Authentication requirement: Bonding, No MITM, Legacy, No Keypresses (0x01)
        Max encryption key size: 16
        Initiator key distribution: EncKey (0x01)
        Responder key distribution: EncKey (0x01)
zephyr.exe[3855246]: < HCI Command: Host Number of Completed Packets (0x03|0x0035) plen 5                            #49 6.256735
        Num handles: 1
        Handle: 450 Address: DF:A9:FF:F6:B1:1A (OUI DF-A9-FF)
        Count: 1
zephyr.exe[3855246]: < ACL Data TX: Handle 450 [1/3] flags 0x00 dlen 21                                              #50 6.256803
      SMP: Pairing Confirm (0x03) len 16
        Confirm value[16]: 1667e18648eded1b317643f49372c83b
> HCI Event: Number of Completed Packets (0x13) plen 5                                                               #51 6.289985
        Num handles: 1
        Handle: 450 Address: DF:A9:FF:F6:B1:1A (OUI DF-A9-FF)
        Count: 1
        Buffers: 0/3
        #50: len 21 (5 Kb/s)
        Latency: 33 msec (23-33 msec ~28 msec)
> ACL Data RX: Handle 450 flags 0x02 dlen 21                                                                         #52 6.340351
      SMP: Pairing Confirm (0x03) len 16
        Confirm value[16]: 617640cc23893c21c6a086e651d9cd29
zephyr.exe[3855246]: < HCI Command: Host Number of Completed Packets (0x03|0x0035) plen 5                            #53 6.356701
        Num handles: 1
        Handle: 450 Address: DF:A9:FF:F6:B1:1A (OUI DF-A9-FF)
        Count: 1
zephyr.exe[3855246]: < ACL Data TX: Handle 450 [1/3] flags 0x00 dlen 21                                              #54 6.356754
      SMP: Pairing Random (0x04) len 16
        Random value[16]: 8e6108f966a694cbe26df70bb96773e6
> HCI Event: Number of Completed Packets (0x13) plen 5                                                               #55 6.389929
        Num handles: 1
        Handle: 450 Address: DF:A9:FF:F6:B1:1A (OUI DF-A9-FF)
        Count: 1
        Buffers: 0/3
        #54: len 21 (5 Kb/s)
        Latency: 33 msec (23-33 msec ~30 msec)
> ACL Data RX: Handle 450 flags 0x02 dlen 21                                                                         #56 6.640064
      SMP: Pairing Random (0x04) len 16
        Random value[16]: 168ee9c4ff8126b2fd44802086d6b3ca
zephyr.exe[3855246]: < HCI Command: LE Start Encryption (0x08|0x0019) plen 28                                        #57 6.656827
        Handle: 450 Address: DF:A9:FF:F6:B1:1A (OUI DF-A9-FF)
        Random number: 0x0000000000000000
        Encrypted diversifier: 0x0000
        Long term key[16]: 0b7decfc2d591c49bb82e14cb392e24a
> HCI Event: Command Status (0x0f) plen 4                                                                            #58 6.658066
      LE Start Encryption (0x08|0x0019) ncmd 1
        Status: Success (0x00)
zephyr.exe[3855246]: < HCI Command: Host Number of Completed Packets (0x03|0x0035) plen 5                            #59 6.676589
        Num handles: 1
        Handle: 450 Address: DF:A9:FF:F6:B1:1A (OUI DF-A9-FF)
        Count: 1
> HCI Event: Encryption Change (0x08) plen 4                                                                         #60 6.989782
        Status: Success (0x00)
        Handle: 450 Address: DF:A9:FF:F6:B1:1A (OUI DF-A9-FF)
        Encryption: Enabled with AES-CCM (0x01)
> ACL Data RX: Handle 450 flags 0x02 dlen 21                                                                         #61 7.041051
      SMP: Encryption Information (0x06) len 16
        Long term key[16]: 98c167ef678c001afdabc1b5988d63e4
zephyr.exe[3855246]: < HCI Command: Host Number of Completed Packets (0x03|0x0035) plen 5                            #62 7.056694
        Num handles: 1
        Handle: 450 Address: DF:A9:FF:F6:B1:1A (OUI DF-A9-FF)
        Count: 1
> ACL Data RX: Handle 450 flags 0x02 dlen 15                                                                         #63 7.140300
      SMP: Central Identification (0x07) len 10
        EDIV: 0x8a00
        Rand: 0xc74348bc0896461c
zephyr.exe[3855246]: < HCI Command: Host Number of Completed Packets (0x03|0x0035) plen 5                            #64 7.156715
        Num handles: 1
        Handle: 450 Address: DF:A9:FF:F6:B1:1A (OUI DF-A9-FF)
        Count: 1
zephyr.exe[3855246]: < ACL Data TX: Handle 450 [1/3] flags 0x00 dlen 21                                              #65 7.156721
      SMP: Encryption Information (0x06) len 16
        Long term key[16]: 5da095555cc64d02679f89a05211af56
zephyr.exe[3855246]: < ACL Data TX: Handle 450 [2/3] flags 0x00 dlen 15                                              #66 7.156722
      SMP: Central Identification (0x07) len 10
        EDIV: 0x825e
        Rand: 0x84c81ed264dab3d8
> HCI Event: Number of Completed Packets (0x13) plen 5                                                               #67 7.189795
        Num handles: 1
        Handle: 450 Address: DF:A9:FF:F6:B1:1A (OUI DF-A9-FF)
        Count: 1
        Buffers: 1/3
        #65: len 21 (5 Kb/s)
        Latency: 33 msec (23-33 msec ~31 msec)
> HCI Event: Number of Completed Packets (0x13) plen 5                                                               #68 7.190391
        Num handles: 1
        Handle: 450 Address: DF:A9:FF:F6:B1:1A (OUI DF-A9-FF)
        Count: 1
        Buffers: 0/3
        #66: len 15 (3 Kb/s)
        Latency: 33 msec (23-33 msec ~32 msec)
> HCI Event: Disconnect Complete (0x05) plen 4                                                                       #69 8.439403
        Status: Success (0x00)
        Handle: 450 Address: DF:A9:FF:F6:B1:1A (OUI DF-A9-FF)
        Reason: Remote User Terminated Connection (0x13)
zephyr.exe[3855246]: < HCI Command: LE Extended Create Connection (0x08|0x0043) plen 26                              #70 9.196664
        Filter policy: Accept list is not used (0x00)
        Own address type: Random (0x01)
        Peer address type: Public (0x00)
        Peer address: DF:A9:FF:F6:B1:1A (OUI DF-A9-FF)
        Initiating PHYs: 0x01
        Entry 0: LE 1M
          Scan interval: 60.000 msec (0x0060)
          Scan window: 60.000 msec (0x0060)
          Min connection interval: 30.00 msec (0x0018)
          Max connection interval: 50.00 msec (0x0028)
          Connection latency: 0 (0x0000)
          Supervision timeout: 4000 msec (0x0190)
          Min connection length: 0.000 msec (0x0000)
          Max connection length: 0.000 msec (0x0000)
> HCI Event: Command Status (0x0f) plen 4                                                                            #71 9.198063
      LE Extended Create Connection (0x08|0x0043) ncmd 1
        Status: Success (0x00)
> HCI Event: LE Meta Event (0x3e) plen 31                                                                            #72 9.285909
      LE Enhanced Connection Complete (0x0a)
        Status: Success (0x00)
        Handle: 468
        Role: Central (0x00)
        Peer address type: Public (0x00)
        Peer address: DF:A9:FF:F6:B1:1A (OUI DF-A9-FF)
        Local resolvable private address: 00:00:00:00:00:00 (Non-Resolvable)
        Peer resolvable private address: 00:00:00:00:00:00 (Non-Resolvable)
        Connection interval: 50.00 msec (0x0028)
        Connection latency: 0 (0x0000)
        Supervision timeout: 4000 msec (0x0190)
        Central clock accuracy: 0x00
zephyr.exe[3855246]: < HCI Command: LE Read Remote Used Features (0x08|0x0016) plen 2                                #73 9.296734
        Handle: 468 Address: DF:A9:FF:F6:B1:1A (OUI DF-A9-FF)
> HCI Event: Command Status (0x0f) plen 4                                                                            #74 9.297448
      LE Read Remote Used Features (0x08|0x0016) ncmd 1
        Status: Success (0x00)
zephyr.exe[3855246]: < HCI Command: LE Set PHY (0x08|0x0032) plen 7                                                  #75 9.316695
        Handle: 468 Address: DF:A9:FF:F6:B1:1A (OUI DF-A9-FF)
        All PHYs preference: 0x00
        TX PHYs preference: 0x02
          LE 2M
        RX PHYs preference: 0x02
          LE 2M
        PHY options preference: Reserved (0x0000)
> HCI Event: Command Status (0x0f) plen 4                                                                            #76 9.317696
      LE Set PHY (0x08|0x0032) ncmd 1
        Status: Success (0x00)
> HCI Event: LE Meta Event (0x3e) plen 12                                                                            #77 9.437925
      LE Read Remote Used Features (0x04)
        Status: Success (0x00)
        Handle: 468 Address: DF:A9:FF:F6:B1:1A (OUI DF-A9-FF)
        Features: 0x2d 0x49 0x00 0xf7 0x67 0xd8 0x00 0x00
          LE Encryption
          Extended Reject Indication
          Peripheral-initiated Features Exchange
          LE Data Packet Length Extension
          LE 2M PHY
          LE Coded PHY
          Channel Selection Algorithm #2
          Periodic Advertising Sync Transfer - Sender
          Periodic Advertising Sync Transfer - Recipient
          Sleep Clock Accuracy Updates
          Connected Isochronous Stream - Central
          Connected Isochronous Stream - Peripheral
          Isochronous Broadcaster
          Synchronized Receiver
          Connected Isochronous Stream (Host Support)
          LE Power Control Request
          LE Power Control Request
          Connection Subrating
          Connection Subrating (Host Support)
          Unknown features (0x0000d80000000000)
> HCI Event: LE Meta Event (0x3e) plen 6                                                                             #78 9.937132
      LE PHY Update Complete (0x0c)
        Status: Success (0x00)
        Handle: 468 Address: DF:A9:FF:F6:B1:1A (OUI DF-A9-FF)
        TX PHY: LE 2M (0x02)
        RX PHY: LE 2M (0x02)
zephyr.exe[3855246]: < ACL Data TX: Handle 468 [1/3] flags 0x00 dlen 7                                              #79 10.236706
      ATT: Read Request (0x0a) len 2
        Handle: 0x0007
> HCI Event: Number of Completed Packets (0x13) plen 5                                                              #80 10.287051
        Num handles: 1
        Handle: 468 Address: DF:A9:FF:F6:B1:1A (OUI DF-A9-FF)
        Count: 1
        Buffers: 0/3
        #79: len 7 (1 Kb/s)
        Latency: 50 msec (50-50 msec ~50 msec)
> ACL Data RX: Handle 468 flags 0x02 dlen 9                                                                         #81 10.337236
      ATT: Error Response (0x01) len 4
        Read Request (0x0a)
        Handle: 0x0007
        Error: Insufficient Authentication (0x05)
zephyr.exe[3855246]: < HCI Command: Host Number of Completed Packets (0x03|0x0035) plen 5                           #82 10.356751
        Num handles: 1
        Handle: 468 Address: DF:A9:FF:F6:B1:1A (OUI DF-A9-FF)
        Count: 1
zephyr.exe[3855246]: < HCI Command: LE Start Encryption (0x08|0x0019) plen 28                                       #83 11.376738
        Handle: 468 Address: DF:A9:FF:F6:B1:1A (OUI DF-A9-FF)
        Random number: 0xc74348bc0896461c
        Encrypted diversifier: 0x8a00
        Long term key[16]: 98c167ef678c001afdabc1b5988d63e4
> HCI Event: Command Status (0x0f) plen 4                                                                           #84 11.378022
      LE Start Encryption (0x08|0x0019) ncmd 1
        Status: Success (0x00)
> HCI Event: Encryption Change (0x08) plen 4                                                                        #85 11.587374
        Status: PIN or Key Missing (0x06)
        Handle: 468 Address: DF:A9:FF:F6:B1:1A (OUI DF-A9-FF)
        Encryption: Disabled (0x00)
zephyr.exe[3855246]: < ACL Data TX: Handle 468 [1/3] flags 0x00 dlen 11                                             #86 11.596784
      SMP: Pairing Request (0x01) len 6
        IO capability: KeyboardDisplay (0x04)
        OOB data: Authentication data not present (0x00)
        Authentication requirement: Bonding, No MITM, SC, No Keypresses (0x09)
        Max encryption key size: 16
        Initiator key distribution: EncKey Sign (0x05)
        Responder key distribution: EncKey IdKey Sign (0x07)
> HCI Event: Number of Completed Packets (0x13) plen 5                                                              #87 11.687395
        Num handles: 1
        Handle: 468 Address: DF:A9:FF:F6:B1:1A (OUI DF-A9-FF)
        Count: 1
        Buffers: 0/3
        #86: len 11 (0 Kb/s)
        Latency: 90 msec (50-90 msec ~70 msec)
> ACL Data RX: Handle 468 flags 0x02 dlen 11                                                                        #88 11.687469
      SMP: Pairing Response (0x02) len 6
        IO capability: KeyboardDisplay (0x04)
        OOB data: Authentication data not present (0x00)
        Authentication requirement: Bonding, No MITM, Legacy, No Keypresses (0x01)
        Max encryption key size: 16
        Initiator key distribution: EncKey (0x01)
        Responder key distribution: EncKey (0x01)
zephyr.exe[3855246]: < HCI Command: Host Number of Completed Packets (0x03|0x0035) plen 5                           #89 11.696789
        Num handles: 1
        Handle: 468 Address: DF:A9:FF:F6:B1:1A (OUI DF-A9-FF)
        Count: 1
zephyr.exe[3855246]: < ACL Data TX: Handle 468 [1/3] flags 0x00 dlen 21                                             #90 11.696839
      SMP: Pairing Confirm (0x03) len 16
        Confirm value[16]: 2fafcdce9f190f21c9584ae8b8ebabca
> HCI Event: Number of Completed Packets (0x13) plen 5                                                              #91 11.737316
        Num handles: 1
        Handle: 468 Address: DF:A9:FF:F6:B1:1A (OUI DF-A9-FF)
        Count: 1
        Buffers: 0/3
        #90: len 21 (4 Kb/s)
        Latency: 40 msec (40-90 msec ~55 msec)
> ACL Data RX: Handle 468 flags 0x02 dlen 21                                                                        #92 11.787124
      SMP: Pairing Confirm (0x03) len 16
        Confirm value[16]: a54fc5a20cbfb8ba795f8240478e98dc
zephyr.exe[3855246]: < HCI Command: Host Number of Completed Packets (0x03|0x0035) plen 5                           #93 11.796814
        Num handles: 1
        Handle: 468 Address: DF:A9:FF:F6:B1:1A (OUI DF-A9-FF)
        Count: 1
zephyr.exe[3855246]: < ACL Data TX: Handle 468 [1/3] flags 0x00 dlen 21                                             #94 11.796837
      SMP: Pairing Random (0x04) len 16
        Random value[16]: bc235a02440d0c3424a2acf8fd71a45c
> HCI Event: Number of Completed Packets (0x13) plen 5                                                              #95 11.837320
        Num handles: 1
        Handle: 468 Address: DF:A9:FF:F6:B1:1A (OUI DF-A9-FF)
        Count: 1
        Buffers: 0/3
        #94: len 21 (4 Kb/s)
        Latency: 40 msec (40-90 msec ~47 msec)
> ACL Data RX: Handle 468 flags 0x02 dlen 21                                                                        #96 12.087378
      SMP: Pairing Random (0x04) len 16
        Random value[16]: 5a6e435f056ab97bfa83f89d9dd3c692
zephyr.exe[3855246]: < HCI Command: LE Start Encryption (0x08|0x0019) plen 28                                       #97 12.096867
        Handle: 468 Address: DF:A9:FF:F6:B1:1A (OUI DF-A9-FF)
        Random number: 0x0000000000000000
        Encrypted diversifier: 0x0000
        Long term key[16]: e593682550f6098c9966c922606f0fc6
> HCI Event: Command Status (0x0f) plen 4                                                                           #98 12.098246
      LE Start Encryption (0x08|0x0019) ncmd 1
        Status: Success (0x00)
zephyr.exe[3855246]: < HCI Command: Host Number of Completed Packets (0x03|0x0035) plen 5                           #99 12.116736
        Num handles: 1
        Handle: 468 Address: DF:A9:FF:F6:B1:1A (OUI DF-A9-FF)
        Count: 1
> HCI Event: Encryption Change (0x08) plen 4                                                                       #100 12.436973
        Status: Success (0x00)
        Handle: 468 Address: DF:A9:FF:F6:B1:1A (OUI DF-A9-FF)
        Encryption: Enabled with AES-CCM (0x01)
> ACL Data RX: Handle 468 flags 0x02 dlen 21                                                                       #101 12.487514
      SMP: Encryption Information (0x06) len 16
        Long term key[16]: 1c87894e5021d74a3670e842d8e32170
zephyr.exe[3855246]: < HCI Command: Host Number of Completed Packets (0x03|0x0035) plen 5                          #102 12.496830
        Num handles: 1
        Handle: 468 Addres