Bluetooth monitor ver 5.72
= Note: Linux version 6.14.0-36-generic (x86_64)                       0.425649
= Note: Bluetooth subsystem version 2.22                               0.425651
= New Index: 00:00:00:00:00:00 (Primary,UART,hci1)              [hci1] 0.425652
= New Index: 48:5F:99:8E:E0:64 (Primary,USB,hci0)               [hci0] 0.425652
= Open Index: 00:00:00:00:00:00                                 [hci1] 0.939293
= Index Info: 00:00:00:00:00:00 (Nordic Semiconductor ASA)      [hci1] 0.939308
@ USER Open: main (privileged) version 2.22            {0x0001} [hci1] 0.939317
< HCI Command: Reset (0x03|0x0003) plen 0                    #1 [hci1] 0.940572
> HCI Event: Command Complete (0x0e) plen 4                  #2 [hci1] 0.941150
      Reset (0x03|0x0003) ncmd 1
        Status: Success (0x00)
< HCI Command: Read Local Supported... (0x04|0x0003) plen 0  #3 [hci1] 0.958822
> HCI Event: Command Complete (0x0e) plen 12                 #4 [hci1] 0.959456
      Read Local Supported Features (0x04|0x0003) ncmd 1
        Status: Success (0x00)
        Features: 0x00 0x00 0x00 0x00 0x60 0x00 0x00 0x00
          BR/EDR Not Supported
          LE Supported (Controller)
< HCI Command: Read Local Version In.. (0x04|0x0001) plen 0  #5 [hci1] 0.978804
> HCI Event: Command Complete (0x0e) plen 12                 #6 [hci1] 0.979262
      Read Local Version Information (0x04|0x0001) ncmd 1
        Status: Success (0x00)
        HCI version: Reserved (0x0f) - Revision 12393 (0x3069)
        LMP version: Reserved (0x0f) - Subversion 12393 (0x3069)
        Manufacturer: Nordic Semiconductor ASA (89)
< HCI Command: Read Local Supported... (0x04|0x0002) plen 0  #7 [hci1] 0.998801
> HCI Event: Command Complete (0x0e) plen 68                 #8 [hci1] 0.999912
      Read Local Supported Commands (0x04|0x0002) ncmd 1
        Status: Success (0x00)
        Commands: 119 entries
          Disconnect (Octet 0 - Bit 5)
          Read Remote Version Information (Octet 2 - Bit 7)
          Set Event Mask (Octet 5 - Bit 6)
          Reset (Octet 5 - Bit 7)
          Read Connection Accept Timeout (Octet 7 - Bit 2)
          Write Connection Accept Timeout (Octet 7 - Bit 3)
          Read Transmit Power Level (Octet 10 - Bit 2)
          Set Controller To Host Flow Control (Octet 10 - Bit 5)
          Host Buffer Size (Octet 10 - Bit 6)
          Host Number of Completed Packets (Octet 10 - Bit 7)
          Read Local Version Information (Octet 14 - Bit 3)
          Read Local Supported Features (Octet 14 - Bit 5)
          Read BD ADDR (Octet 15 - Bit 1)
          Read RSSI (Octet 15 - Bit 5)
          Set Event Mask Page 2 (Octet 22 - Bit 2)
          LE Set Event Mask (Octet 25 - Bit 0)
          LE Read Buffer Size (Octet 25 - Bit 1)
          LE Read Local Supported Features (Octet 25 - Bit 2)
          LE Set Random Address (Octet 25 - Bit 4)
          LE Set Advertising Parameters (Octet 25 - Bit 5)
          LE Read Advertising Channel TX Power (Octet 25 - Bit 6)
          LE Set Advertising Data (Octet 25 - Bit 7)
          LE Set Scan Response Data (Octet 26 - Bit 0)
          LE Set Advertise Enable (Octet 26 - Bit 1)
          LE Set Scan Parameters (Octet 26 - Bit 2)
          LE Set Scan Enable (Octet 26 - Bit 3)
          LE Create Connection (Octet 26 - Bit 4)
          LE Create Connection Cancel (Octet 26 - Bit 5)
          LE Read Accept List Size (Octet 26 - Bit 6)
          LE Clear Accept List (Octet 26 - Bit 7)
          LE Add Device To Accept List (Octet 27 - Bit 0)
          LE Remove Device From Accept List (Octet 27 - Bit 1)
          LE Connection Update (Octet 27 - Bit 2)
          LE Set Host Channel Classification (Octet 27 - Bit 3)
          LE Read Channel Map (Octet 27 - Bit 4)
          LE Read Remote Used Features (Octet 27 - Bit 5)
          LE Encrypt (Octet 27 - Bit 6)
          LE Rand (Octet 27 - Bit 7)
          LE Start Encryption (Octet 28 - Bit 0)
          LE Long Term Key Request Reply (Octet 28 - Bit 1)
          LE Long Term Key Request Neg Reply (Octet 28 - Bit 2)
          LE Read Supported States (Octet 28 - Bit 3)
          LE Receiver Test (Octet 28 - Bit 4)
          LE Transmitter Test (Octet 28 - Bit 5)
          LE Test End (Octet 28 - Bit 6)
          Read Authenticated Payload Timeout (Octet 32 - Bit 4)
          Write Authenticated Payload Timeout (Octet 32 - Bit 5)
          LE Set Data Length (Octet 33 - Bit 6)
          LE Read Suggested Default Data Length (Octet 33 - Bit 7)
          LE Write Suggested Default Data Length (Octet 34 - Bit 0)
          LE Add Device To Resolving List (Octet 34 - Bit 3)
          LE Remove Device From Resolving List (Octet 34 - Bit 4)
          LE Clear Resolving List (Octet 34 - Bit 5)
          LE Read Resolving List Size (Octet 34 - Bit 6)
          LE Set Address Resolution Enable (Octet 35 - Bit 1)
          LE Set Resolvable Private Address Timeout (Octet 35 - Bit 2)
          LE Read Maximum Data Length (Octet 35 - Bit 3)
          LE Read PHY (Octet 35 - Bit 4)
          LE Set Default PHY (Octet 35 - Bit 5)
          LE Set PHY (Octet 35 - Bit 6)
          LE Enhanced Receiver Test (Octet 35 - Bit 7)
          LE Enhanced Transmitter Test (Octet 36 - Bit 0)
          LE Set Advertising Set Random Address (Octet 36 - Bit 1)
          LE Set Extended Advertising Parameters (Octet 36 - Bit 2)
          LE Set Extended Advertising Data (Octet 36 - Bit 3)
          LE Set Extended Scan Response Data (Octet 36 - Bit 4)
          LE Set Extended Advertising Enable (Octet 36 - Bit 5)
          LE Read Maximum Advertising Data Length (Octet 36 - Bit 6)
          LE Read Number of Supported Advertising Sets (Octet 36 - Bit 7)
          LE Remove Advertising Set (Octet 37 - Bit 0)
          LE Clear Advertising Sets (Octet 37 - Bit 1)
          LE Set Periodic Advertising Parameters (Octet 37 - Bit 2)
          LE Set Periodic Advertising Data (Octet 37 - Bit 3)
          LE Set Periodic Advertising Enable (Octet 37 - Bit 4)
          LE Set Extended Scan Parameters (Octet 37 - Bit 5)
          LE Set Extended Scan Enable (Octet 37 - Bit 6)
          LE Extended Create Connection (Octet 37 - Bit 7)
          LE Periodic Advertising Create Sync (Octet 38 - Bit 0)
          LE Periodic Advertising Create Sync Cancel (Octet 38 - Bit 1)
          LE Periodic Advertising Terminate Sync (Octet 38 - Bit 2)
          LE Add Device To Periodic Advertiser List (Octet 38 - Bit 3)
          LE Remove Device From Periodic Advertiser List (Octet 38 - Bit 4)
          LE Clear Periodic Advertiser List (Octet 38 - Bit 5)
          LE Read Periodic Advertiser List Size (Octet 38 - Bit 6)
          LE Read Transmit Power (Octet 38 - Bit 7)
          LE Read RF Path Compensation (Octet 39 - Bit 0)
          LE Write RF Path Compensation (Octet 39 - Bit 1)
          LE Set Privacy Mode (Octet 39 - Bit 2)
          LE Periodic Advertising Receive Enable (Octet 40 - Bit 5)
          LE Periodic Advertising Sync Transfer (Octet 40 - Bit 6)
          LE Periodic Advertising Set Info Transfer (Octet 40 - Bit 7)
          LE Periodic Advertising Sync Transfer Parameters (Octet 41 - Bit 0)
          LE Set Default Periodic Advertisng Sync Transfer Parameters (Octet 41 - Bit 1)
          LE Read Buffer v2 (Octet 41 - Bit 5)
          LE Read ISO TX Sync (Octet 41 - Bit 6)
          LE Set Connected Isochronous Group Parameters (Octet 41 - Bit 7)
          LE Set Connected Isochronous Group Parameters Test (Octet 42 - Bit 0)
          LE Create Connected Isochronous Stream (Octet 42 - Bit 1)
          LE Remove Connected Isochronous Group (Octet 42 - Bit 2)
          LE Accept Connected Isochronous Stream Request (Octet 42 - Bit 3)
          LE Reject Connected Isochronous Stream Request (Octet 42 - Bit 4)
          LE Create Broadcast Isochronous Group (Octet 42 - Bit 5)
          LE Create Broadcast Isochronous Group Test (Octet 42 - Bit 6)
          LE Terminate Broadcast Isochronous Group (Octet 42 - Bit 7)
          LE Broadcast Isochronous Group Create Sync (Octet 43 - Bit 0)
          LE Broadcast Isochronous Group Terminate Sync (Octet 43 - Bit 1)
          LE Request Peer SCA (Octet 43 - Bit 2)
          LE Setup Isochronous Data Path (Octet 43 - Bit 3)
          LE Remove Isochronous Data Path (Octet 43 - Bit 4)
          LE Isochronous Transmit Test (Octet 43 - Bit 5)
          LE Isochronous Receive Test (Octet 43 - Bit 6)
          LE Isochronous Read Test Counters (Octet 43 - Bit 7)
          LE Isochronous Read Test Counters (Octet 44 - Bit 0)
          LE Set Host Feature (Octet 44 - Bit 1)
          Octet 44 - Bit 2 
          Octet 45 - Bit 6 
          Octet 46 - Bit 0 
          Octet 46 - Bit 1 
          Octet 46 - Bit 2 
< HCI Command: Host Buffer Size (0x03|0x0033) plen 7         #9 [hci1] 1.018809
        ACL MTU: 255  ACL max packet: 16
        SCO MTU: 0    SCO max packet: 0
> HCI Event: Command Complete (0x0e) plen 4                 #10 [hci1] 1.019328
      Host Buffer Size (0x03|0x0033) ncmd 1
        Status: Success (0x00)
< HCI Command: Set Controller To Ho.. (0x03|0x0031) plen 1  #11 [hci1] 1.038800
        Flow control: ACL Data Packets (0x01)
> HCI Event: Command Complete (0x0e) plen 4                 #12 [hci1] 1.039238
      Set Controller To Host Flow Control (0x03|0x0031) ncmd 1
        Status: Success (0x00)
< HCI Command: LE Read Local Suppor.. (0x08|0x0003) plen 0  #13 [hci1] 1.058799
> HCI Event: Command Complete (0x0e) plen 12                #14 [hci1] 1.059260
      LE Read Local Supported Features (0x08|0x0003) ncmd 1
        Status: Success (0x00)
        Features: 0xfd 0x79 0x00 0xf7 0x30 0x01 0x00 0x00
          LE Encryption
          Extended Reject Indication
          Peripheral-initiated Features Exchange
          LE Ping
          LE Data Packet Length Extension
          LL Privacy
          Extended Scanner Filter Policies
          LE 2M PHY
          LE Coded PHY
          LE Extended Advertising
          LE Periodic Advertising
          Channel Selection Algorithm #2
          Periodic Advertising Sync Transfer - Sender
          Periodic Advertising Sync Transfer - Recipient
          Sleep Clock Accuracy Updates
          Connected Isochronous Stream - Central
          Connected Isochronous Stream - Peripheral
          Isochronous Broadcaster
          Synchronized Receiver
          Periodic Advertising ADI support
          Connection Subrating
          Unknown features (0x0000010000000000)
< HCI Command: LE Set Host Feature (0x08|0x0074) plen 2     #15 [hci1] 1.078819
        Bit Number: 32
          Connected Isochronous Stream (Host Support)
        Bit Value: 1
> HCI Event: Command Complete (0x0e) plen 4                 #16 [hci1] 1.079260
      LE Set Host Feature (0x08|0x0074) ncmd 1
        Status: Success (0x00)
< HCI Command: LE Read Buffer v2 (0x08|0x0060) plen 0       #17 [hci1] 1.098782
> HCI Event: Command Complete (0x0e) plen 10                #18 [hci1] 1.099189
      LE Read Buffer v2 (0x08|0x0060) ncmd 1
        Status: Success (0x00)
        ACL MTU: 27
        ACL max packet: 3
        ISO MTU: 318
        ISO max packet: 3
< HCI Command: LE Read Maximum Adve.. (0x08|0x003a) plen 0  #19 [hci1] 1.118845
> HCI Event: Command Complete (0x0e) plen 6                 #20 [hci1] 1.119207
      LE Read Maximum Advertising Data Length (0x08|0x003a) ncmd 1
        Status: Success (0x00)
        Max length: 1650
< HCI Command: LE Read Supported St.. (0x08|0x001c) plen 0  #21 [hci1] 1.138811
> HCI Event: Command Complete (0x0e) plen 12                #22 [hci1] 1.139317
      LE Read Supported States (0x08|0x001c) ncmd 1
        Status: Success (0x00)
        States: 0x000003ff3e0306ff
          Non-connectable Advertising State
          Scannable Advertising State
          Connectable Advertising State
          High Duty Cycle Directed Advertising State
          Passive Scanning State
          Active Scanning State
          Initiating State
            and Connection State (Central Role)
          Connection State (Peripheral Role)
          Scannable Advertising State
            and Passive Scanning State
          Connectable Advertising State
            and Passive Scanning State
          Non-connectable Advertising State
            and Initiating State
          Scannable Advertising State
            and Initiating State
          Active Scanning State
            and Connection State (Central Role)
          Passive Scanning State
            and Connection State (Peripheral Role)
          Active Scanning State
            and Connection State (Peripheral Role)
          Initiating State
            and Connection State (Central Role)
            and Central Role & Central Role
          Low Duty Cycle Directed Advertising State
          Connectable Advertising State
            and Initiating State
            and Central Role & Peripheral Role
          High Duty Cycle Directed Advertising State
            and Initiating State
            and Central Role & Peripheral Role
          Low Duty Cycle Directed Advertising State
            and Initiating State
            and Central Role & Peripheral Role
          Connectable Advertising State
            and Connection State (Central Role)
            and Central Role & Peripheral Role
          High Duty Cycle Directed Advertising State
            and Connection State (Central Role)
            and Central Role & Peripheral Role
          Low Duty Cycle Directed Advertising State
            and Connection State (Central Role)
            and Central Role & Peripheral Role
          Connectable Advertising State
            and Connection State (Peripheral Role)
            and Central Role & Peripheral Role
          High Duty Cycle Directed Advertising State
            and Connection State (Peripheral Role)
            and Peripheral Role & Peripheral Role
          Low Duty Cycle Directed Advertising State
            and Connection State (Peripheral Role)
            and Peripheral Role & Peripheral Role
          Initiating State
            and Connection State (Peripheral Role)
            and Central Role & Peripheral Role
< HCI Command: LE Read Maximum Data.. (0x08|0x002f) plen 0  #23 [hci1] 1.158808
> HCI Event: Command Complete (0x0e) plen 12                #24 [hci1] 1.159282
      LE Read Maximum Data Length (0x08|0x002f) ncmd 1
        Status: Success (0x00)
        Max TX octets: 251
        Max TX time: 2704
        Max RX octets: 251
        Max RX time: 2704
< HCI Command: LE Write Suggested D.. (0x08|0x0024) plen 4  #25 [hci1] 1.178812
        TX octets: 251
        TX time: 2704
> HCI Event: Command Complete (0x0e) plen 4                 #26 [hci1] 1.179338
      LE Write Suggested Default Data Length (0x08|0x0024) ncmd 1
        Status: Success (0x00)
< HCI Command: LE Read Resolving Li.. (0x08|0x002a) plen 0  #27 [hci1] 1.198817
> HCI Event: Command Complete (0x0e) plen 5                 #28 [hci1] 1.199205
      LE Read Resolving List Size (0x08|0x002a) ncmd 1
        Status: Success (0x00)
        Size: 8
< HCI Command: LE Set Event Mask (0x08|0x0001) plen 8       #29 [hci1] 1.218796
        Mask: 0x000002023f87fa5e
          LE Advertising Report
          LE Connection Update Complete
          LE Read Remote Used Features Complete
          LE Long Term Key Request
          LE Data Length Change
          LE Enhanced Connection Complete
          LE PHY Update Complete
          LE Extended Advertising Report
          LE Periodic Advertising Sync Established
          LE Periodic Advertising Report
          LE Periodic Advertising Sync Lost
          LE Extended Scan Timeout
          LE Extended Advertising Set Terminated
          LE Scan Request Received
          LE Periodic Advertising Sync Transfer Rvc
          LE CIS Established
          LE CIS Request
          LE Create BIG Complete
          LE Terminate BIG Complete
          LE BIG Sync Estabilished Complete
          LE BIG Sync Lost
          LE BIG Info Advertising Report
          Unknown mask (0x0000020000000000)
> HCI Event: Command Complete (0x0e) plen 4                 #30 [hci1] 1.219327
      LE Set Event Mask (0x08|0x0001) ncmd 1
        Status: Success (0x00)
< HCI Command: Set Event Mask (0x03|0x0001) plen 8          #31 [hci1] 1.238814
        Mask: 0x2000800002008890
          Disconnection Complete
          Encryption Change
          Read Remote Version Information Complete
          Hardware Error
          Data Buffer Overflow
          Encryption Key Refresh Complete
          LE Meta
> HCI Event: Command Complete (0x0e) plen 4                 #32 [hci1] 1.239427
      Set Event Mask (0x03|0x0001) ncmd 1
        Status: Success (0x00)
< HCI Command: Read BD ADDR (0x04|0x0009) plen 0            #33 [hci1] 1.258820
> HCI Event: Command Complete (0x0e) plen 10                #34 [hci1] 1.259262
      Read BD ADDR (0x04|0x0009) ncmd 1
        Status: Success (0x00)
        Address: 00:00:00:00:00:00 (OUI 00-00-00)
< HCI Command: LE Set Random Address (0x08|0x0005) plen 6   #35 [hci1] 1.278822
        Address: D5:B6:CC:31:DB:3B (Static)
> HCI Event: Command Complete (0x0e) plen 4                 #36 [hci1] 1.279459
      LE Set Random Address (0x08|0x0005) ncmd 1
        Status: Success (0x00)
< HCI Command: LE Set Extended Adv.. (0x08|0x0036) plen 25  #37 [hci1] 3.839297
        Handle: 0x00
        Properties: 0x0013
          Connectable
          Scannable
          Use legacy advertising PDUs: ADV_IND
        Min advertising interval: 100.000 msec (0x00a0)
        Max advertising interval: 150.000 msec (0x00f0)
        Channel map: 37, 38, 39 (0x07)
        Own address type: Random (0x01)
        Peer address type: Public (0x00)
        Peer address: 00:00:00:00:00:00 (OUI 00-00-00)
        Filter policy: Allow Scan Request from Any, Allow Connect Request from Any (0x00)
        TX power: Host has no preference (0x7f)
        Primary PHY: LE 1M (0x01)
        Secondary max skip: 0x00
        Secondary PHY: LE 1M (0x01)
        SID: 0x00
        Scan request notifications: Disabled (0x00)
> HCI Event: Command Complete (0x0e) plen 5                 #38 [hci1] 3.840188
      LE Set Extended Advertising Parameters (0x08|0x0036) ncmd 1
        Status: Success (0x00)
        TX power (selected): 0 dbm (0x00)
< HCI Command: LE Set Advertising S.. (0x08|0x0035) plen 7  #39 [hci1] 3.859011
        Advertising handle: 0x00
        Advertising random address: D5:B6:CC:31:DB:3B (Static)
> HCI Event: Command Complete (0x0e) plen 4                 #40 [hci1] 3.859561
      LE Set Advertising Set Random Address (0x08|0x0035) ncmd 1
        Status: Success (0x00)
< HCI Command: LE Set Extended Adv.. (0x08|0x0037) plen 22  #41 [hci1] 3.878771
        Handle: 0x00
        Operation: Complete extended advertising data (0x03)
        Fragment preference: Minimize fragmentation (0x01)
        Data length: 0x12
        Flags: 0x06
          LE General Discoverable Mode
          BR/EDR Not Supported
        Name (complete): Tester_F6B11A
> HCI Event: Command Complete (0x0e) plen 4                 #42 [hci1] 3.879502
      LE Set Extended Advertising Data (0x08|0x0037) ncmd 1
        Status: Success (0x00)
< HCI Command: LE Set Extended Scan.. (0x08|0x0038) plen 4  #43 [hci1] 3.898834
        Handle: 0x00
        Operation: Complete scan response data (0x03)
        Fragment preference: Minimize fragmentation (0x01)
        Data length: 0x00
> HCI Event: Command Complete (0x0e) plen 4                 #44 [hci1] 3.899272
      LE Set Extended Scan Response Data (0x08|0x0038) ncmd 1
        Status: Success (0x00)
< HCI Command: LE Set Extended Adve.. (0x08|0x0039) plen 6  #45 [hci1] 3.918835
        Extended advertising: Enabled (0x01)
        Number of sets: 1 (0x01)
        Entry 0
          Handle: 0x00
          Duration: 0 ms (0x00)
          Max ext adv events: 0
> HCI Event: Command Complete (0x0e) plen 4                 #46 [hci1] 3.919477
      LE Set Extended Advertising Enable (0x08|0x0039) ncmd 1
        Status: Success (0x00)
> HCI Event: LE Meta Event (0x3e) plen 31                   #47 [hci1] 4.032742
      LE Enhanced Connection Complete (0x0a)
        Status: Success (0x00)
        Handle: 129
        Role: Peripheral (0x01)
        Peer address type: Public (0x00)
        Peer address: DF:A9:FF:F6:B1:1A (OUI DF-A9-FF)
        Local resolvable private address: 00:00:00:00:00:00 (Non-Resolvable)
        Peer resolvable private address: 00:00:00:00:00:00 (Non-Resolvable)
        Connection interval: 87.50 msec (0x0046)
        Connection latency: 0 (0x0000)
        Supervision timeout: 25120 msec (0x09d0)
        Central clock accuracy: 0x01
> HCI Event: LE Meta Event (0x3e) plen 6                    #48 [hci1] 4.032973
      LE Advertising Set Terminated (0x12)
        Status: Success (0x00)
        Handle: 0
        Connection handle: 129
        Number of completed extended advertising events: 0
< HCI Command: LE Read Remote Used... (0x08|0x0016) plen 2  #49 [hci1] 4.039189
        Handle: 129 Address: DF:A9:FF:F6:B1:1A (OUI DF-A9-FF)
< ACL Data TX: Handle 129 flags 0x00 dlen 7                 #50 [hci1] 4.039200
      ATT: Exchange MTU Request (0x02) len 2
        Client RX MTU: 251
> HCI Event: Command Status (0x0f) plen 4                   #51 [hci1] 4.039741
      LE Read Remote Used Features (0x08|0x0016) ncmd 1
        Status: Success (0x00)
> HCI Event: Number of Completed Packets (0x13) plen 5      #52 [hci1] 4.208888
        Num handles: 1
        Handle: 129 Address: DF:A9:FF:F6:B1:1A (OUI DF-A9-FF)
        Count: 1
        #50: len 7 (0 Kb/s)
        Latency: 169 msec (169-169 msec ~169 msec)
> HCI Event: LE Meta Event (0x3e) plen 12                   #53 [hci1] 4.296826
      LE Read Remote Used Features (0x04)
        Status: Success (0x00)
        Handle: 129 Address: DF:A9:FF:F6:B1:1A (OUI DF-A9-FF)
        Features: 0x2d 0x49 0x00 0xf7 0x67 0xd8 0x00 0x00
          LE Encryption
          Extended Reject Indication
          Peripheral-initiated Features Exchange
          LE Data Packet Length Extension
          LE 2M PHY
          LE Coded PHY
          Channel Selection Algorithm #2
          Periodic Advertising Sync Transfer - Sender
          Periodic Advertising Sync Transfer - Recipient
          Sleep Clock Accuracy Updates
          Connected Isochronous Stream - Central
          Connected Isochronous Stream - Peripheral
          Isochronous Broadcaster
          Synchronized Receiver
          Connected Isochronous Stream (Host Support)
          LE Power Control Request
          LE Power Control Request
          Connection Subrating
          Connection Subrating (Host Support)
          Unknown features (0x0000d80000000000)
> ACL Data RX: Handle 129 flags 0x02 dlen 11                #54 [hci1] 6.746329
      SMP: Pairing Request (0x01) len 6
        IO capability: KeyboardDisplay (0x04)
        OOB data: Authentication data not present (0x00)
        Authentication requirement: Bonding, MITM, SC, No Keypresses (0x0d)
        Max encryption key size: 16
        Initiator key distribution: EncKey IdKey (0x03)
        Responder key distribution: EncKey IdKey Sign (0x07)
> ACL Data RX: Handle 129 flags 0x02 dlen 7                 #55 [hci1] 6.746803
      ATT: Exchange MTU Response (0x03) len 2
        Server RX MTU: 23
< HCI Command: Host Number of Compl.. (0x03|0x0035) plen 5  #56 [hci1] 6.759387
        Num handles: 1
        Handle: 129 Address: DF:A9:FF:F6:B1:1A (OUI DF-A9-FF)
        Count: 1
< ACL Data TX: Handle 129 flags 0x00 dlen 11                #57 [hci1] 6.759598
      SMP: Pairing Response (0x02) len 6
        IO capability: DisplayOnly (0x00)
        OOB data: Authentication data not present (0x00)
        Authentication requirement: Bonding, No MITM, SC, No Keypresses (0x09)
        Max encryption key size: 16
        Initiator key distribution: IdKey (0x02)
        Responder key distribution: <none> (0x00)
< HCI Command: Host Number of Compl.. (0x03|0x0035) plen 5  #58 [hci1] 6.759789
        Num handles: 1
        Handle: 129 Address: DF:A9:FF:F6:B1:1A (OUI DF-A9-FF)
        Count: 1
> HCI Event: Number of Completed Packets (0x13) plen 5      #59 [hci1] 6.921589
        Num handles: 1
        Handle: 129 Address: DF:A9:FF:F6:B1:1A (OUI DF-A9-FF)
        Count: 1
        #57: len 11 (0 Kb/s)
        Latency: 161 msec (161-169 msec ~165 msec)
> ACL Data RX: Handle 129 flags 0x02 dlen 27                #60 [hci1] 6.921846
> ACL Data RX: Handle 129 flags 0x01 dlen 27                #61 [hci1] 6.922280
> ACL Data RX: Handle 129 flags 0x01 dlen 15                #62 [hci1] 6.922744
      SMP: Pairing Public Key (0x0c) len 64
        X: caf11593c3cff9bd5d65af0b26a8fcabd73e0eb36fb171c279ce9584b5980683
        Y: c67180c1f792e1085e002b61b3f5e792183fb896d848373ee6312084634b2eea
< HCI Command: Host Number of Compl.. (0x03|0x0035) plen 5  #63 [hci1] 6.939717
        Num handles: 1
        Handle: 129 Address: DF:A9:FF:F6:B1:1A (OUI DF-A9-FF)
        Count: 1
< HCI Command: Host Number of Compl.. (0x03|0x0035) plen 5  #64 [hci1] 6.939997
        Num handles: 1
        Handle: 129 Address: DF:A9:FF:F6:B1:1A (OUI DF-A9-FF)
        Count: 1
< HCI Command: Host Number of Compl.. (0x03|0x0035) plen 5  #65 [hci1] 6.940373
        Num handles: 1
        Handle: 129 Address: DF:A9:FF:F6:B1:1A (OUI DF-A9-FF)
        Count: 1
< ACL Data TX: Handle 129 flags 0x00 dlen 27                #66 [hci1] 6.940461
< ACL Data TX: Handle 129 flags 0x01 dlen 27                #67 [hci1] 6.940471
< ACL Data TX: Handle 129 flags 0x01 dlen 15                #68 [hci1] 6.940495
      SMP: Pairing Public Key (0x0c) len 64
        X: 98308440221e2d910f0e54b71e7ec652857aa9b5a0dc65028824cc19db1226e9
        Y: 67a4816bcb62efb21701e31fdb27561a6217575fb007a8bbdabe7e28b6f68482
> HCI Event: Number of Completed Packets (0x13) plen 5      #69 [hci1] 7.009327
        Num handles: 1
        Handle: 129 Address: DF:A9:FF:F6:B1:1A (OUI DF-A9-FF)
        Count: 1
        #66: len 27 (3 Kb/s)
        Latency: 68 msec (68-169 msec ~117 msec)
> HCI Event: Number of Completed Packets (0x13) plen 5      #70 [hci1] 7.010056
        Num handles: 1
        Handle: 129 Address: DF:A9:FF:F6:B1:1A (OUI DF-A9-FF)
        Count: 1
        #67: len 27 (3 Kb/s)
        Latency: 69 msec (68-169 msec ~93 msec)
> HCI Event: Number of Completed Packets (0x13) plen 5      #71 [hci1] 7.096205
        Num handles: 1
        Handle: 129 Address: DF:A9:FF:F6:B1:1A (OUI DF-A9-FF)
        Count: 1
        #68: len 15 (0 Kb/s)
        Latency: 155 msec (68-169 msec ~124 msec)
> ACL Data RX: Handle 129 flags 0x02 dlen 21                #72 [hci1] 8.058965
      SMP: Pairing Confirm (0x03) len 16
        Confim value: 1fcf92932c613074a69b21a56d9eb700
< HCI Command: Host Number of Compl.. (0x03|0x0035) plen 5  #73 [hci1] 8.079528
        Num handles: 1
        Handle: 129 Address: DF:A9:FF:F6:B1:1A (OUI DF-A9-FF)
        Count: 1
< ACL Data TX: Handle 129 flags 0x00 dlen 21                #74 [hci1] 8.079760
      SMP: Pairing Confirm (0x03) len 16
        Confim value: fcc839de83add95a6879d06ed304c9ff
> HCI Event: Number of Completed Packets (0x13) plen 5      #75 [hci1] 8.233854
        Num handles: 1
        Handle: 129 Address: DF:A9:FF:F6:B1:1A (OUI DF-A9-FF)
        Count: 1
        #74: len 21 (1 Kb/s)
        Latency: 154 msec (68-169 msec ~139 msec)
> ACL Data RX: Handle 129 flags 0x02 dlen 21                #76 [hci1] 8.234221
      SMP: Pairing Random (0x04) len 16
        Random value: 97e54c02049a2f2b0000000000000000
< HCI Command: Host Number of Compl.. (0x03|0x0035) plen 5  #77 [hci1] 8.239566
        Num handles: 1
        Handle: 129 Address: DF:A9:FF:F6:B1:1A (OUI DF-A9-FF)
        Count: 1
< ACL Data TX: Handle 129 flags 0x00 dlen 21                #78 [hci1] 8.239645
      SMP: Pairing Random (0x04) len 16
        Random value: 8e6108f966a694cbe26df70bb96773e6
> HCI Event: Number of Completed Packets (0x13) plen 5      #79 [hci1] 8.408610
        Num handles: 1
        Handle: 129 Address: DF:A9:FF:F6:B1:1A (OUI DF-A9-FF)
        Count: 1
        #78: len 21 (1 Kb/s)
        Latency: 168 msec (68-169 msec ~154 msec)
> ACL Data RX: Handle 129 flags 0x02 dlen 21                #80 [hci1] 8.496584
      SMP: Pairing Confirm (0x03) len 16
        Confim value: 6fa8e1322214879292bc0b7702168e32
< HCI Command: Host Number of Compl.. (0x03|0x0035) plen 5  #81 [hci1] 8.499170
        Num handles: 1
        Handle: 129 Address: DF:A9:FF:F6:B1:1A (OUI DF-A9-FF)
        Count: 1
< ACL Data TX: Handle 129 flags 0x00 dlen 21                #82 [hci1] 8.499317
      SMP: Pairing Confirm (0x03) len 16
        Confim value: 541ab79af2813dbcdb27897305de6385
> HCI Event: Number of Completed Packets (0x13) plen 5      #83 [hci1] 8.671317
        Num handles: 1
        Handle: 129 Address: DF:A9:FF:F6:B1:1A (OUI DF-A9-FF)
        Count: 1
        #82: len 21 (0 Kb/s)
        Latency: 172 msec (68-172 msec ~163 msec)
> ACL Data RX: Handle 129 flags 0x02 dlen 21                #84 [hci1] 8.671707
      SMP: Pairing Random (0x04) len 16
        Random value: 041214d1a2f0f4370000000000000000
< HCI Command: Host Number of Compl.. (0x03|0x0035) plen 5  #85 [hci1] 8.679592
        Num handles: 1
        Handle: 129 Address: DF:A9:FF:F6:B1:1A (OUI DF-A9-FF)
        Count: 1
< ACL Data TX: Handle 129 flags 0x00 dlen 21                #86 [hci1] 8.679714
      SMP: Pairing Random (0x04) len 16
        Random value: 4d02679f89a05211af56d8b3da64d21e
> HCI Event: Number of Completed Packets (0x13) plen 5      #87 [hci1] 8.846131
        Num handles: 1
        Handle: 129 Address: DF:A9:FF:F6:B1:1A (OUI DF-A9-FF)
        Count: 1
        #86: len 21 (1 Kb/s)
        Latency: 166 msec (68-172 msec ~164 msec)
> ACL Data RX: Handle 129 flags 0x02 dlen 21                #88 [hci1] 8.933999
      SMP: Pairing Confirm (0x03) len 16
        Confim value: 9a8bfd9eaa498e33073367719fc18790
< HCI Command: Host Number of Compl.. (0x03|0x0035) plen 5  #89 [hci1] 8.939425
        Num handles: 1
        Handle: 129 Address: DF:A9:FF:F6:B1:1A (OUI DF-A9-FF)
        Count: 1
< ACL Data TX: Handle 129 flags 0x00 dlen 21                #90 [hci1] 8.939591
      SMP: Pairing Confirm (0x03) len 16
        Confim value: e864e695ce51d20954d706f5bf5e0d5e
> HCI Event: Number of Completed Packets (0x13) plen 5      #91 [hci1] 9.108769
        Num handles: 1
        Handle: 129 Address: DF:A9:FF:F6:B1:1A (OUI DF-A9-FF)
        Count: 1
        #90: len 21 (0 Kb/s)
        Latency: 169 msec (68-172 msec ~166 msec)
> ACL Data RX: Handle 129 flags 0x02 dlen 21                #92 [hci1] 9.109226
      SMP: Pairing Random (0x04) len 16
        Random value: 9d34b0137f4331820000000000000000
< HCI Command: Host Number of Compl.. (0x03|0x0035) plen 5  #93 [hci1] 9.119560
        Num handles: 1
        Handle: 129 Address: DF:A9:FF:F6:B1:1A (OUI DF-A9-FF)
        Count: 1
< ACL Data TX: Handle 129 flags 0x00 dlen 21                #94 [hci1] 9.119736
      SMP: Pairing Random (0x04) len 16
        Random value: 5e8286bc235a02440d0c3424a2acf8fd
> HCI Event: Number of Completed Packets (0x13) plen 5      #95 [hci1] 9.283680
        Num handles: 1
        Handle: 129 Address: DF:A9:FF:F6:B1:1A (OUI DF-A9-FF)
        Count: 1
        #94: len 21 (1 Kb/s)
        Latency: 163 msec (68-172 msec ~165 msec)
> ACL Data RX: Handle 129 flags 0x02 dlen 21                #96 [hci1] 9.371440
      SMP: Pairing Confirm (0x03) len 16
        Confim value: a4ace22febf53f61e502c9f562e77c2a
< HCI Command: Host Number of Compl.. (0x03|0x0035) plen 5  #97 [hci1] 9.379389
        Num handles: 1
        Handle: 129 Address: DF:A9:FF:F6:B1:1A (OUI DF-A9-FF)
        Count: 1
< ACL Data TX: Handle 129 flags 0x00 dlen 21                #98 [hci1] 9.379612
      SMP: Pairing Confirm (0x03) len 16
        Confim value: c16a7d0f5ec7b93c0fe2a3d24e99e1ef
> HCI Event: Number of Completed Packets (0x13) plen 5      #99 [hci1] 9.546264
        Num handles: 1
        Handle: 129 Address: DF:A9:FF:F6:B1:1A (OUI DF-A9-FF)
        Count: 1
        #98: len 21 (1 Kb/s)
        Latency: 166 msec (68-172 msec ~166 msec)
> ACL Data RX: Handle 129 flags 0x02 dlen 21               #100 [hci1] 9.546699
      SMP: Pairing Random (0x04) len 16
        Random value: 8046be9d0bf203630000000000000000
< HCI Command: Host Number of Comp.. (0x03|0x0035) plen 5  #101 [hci1] 9.559489
        Num handles: 1
        Handle: 129 Address: DF:A9:FF:F6:B1:1A (OUI DF-A9-FF)
        Count: 1
< ACL Data TX: Handle 129 flags 0x00 dlen 21               #102 [hci1] 9.559645
      SMP: Pairing Random (0x04) len 16
        Random value: 5c4a1bcadd27bd58e945097b00bad7ac
> HCI Event: Number of Completed Packets (0x13) plen 5     #103 [hci1] 9.721091
        Num handles: 1
        Handle: 129 Address: DF:A9:FF:F6:B1:1A (OUI DF-A9-FF)
        Count: 1
        #102: len 21 (1 Kb/s)
        Latency: 161 msec (68-172 msec ~163 msec)
> ACL Data RX: Handle 129 flags 0x02 dlen 21               #104 [hci1] 9.809077
      SMP: Pairing Confirm (0x03) len 16
        Confim value: 0db651c22a511481d0aea425c71bb6e6
< HCI Command: Host Number of Comp.. (0x03|0x0035) plen 5  #105 [hci1] 9.819463
        Num handles: 1
        Handle: 129 Address: DF:A9:FF:F6:B1:1A (OUI DF-A9-FF)
        Count: 1
< ACL Data TX: Handle 129 flags 0x00 dlen 21               #106 [hci1] 9.819623
      SMP: Pairing Confirm (0x03) len 16
        Confim value: f5e88906700c5a18d77b7eabe713bc1c
> HCI Event: Number of Completed Packets (0x13) plen 5     #107 [hci1] 9.983861
        Num handles: 1
        Handle: 129 Address: DF:A9:FF:F6:B1:1A (OUI DF-A9-FF)
        Count: 1
        #106: len 21 (1 Kb/s)
        Latency: 164 msec (68-172 msec ~163 msec)
> ACL Data RX: Handle 129 flags 0x02 dlen 21               #108 [hci1] 9.984139
      SMP: Pairing Random (0x04) len 16
        Random value: 043df8af189c37230000000000000000
< HCI Command: Host Number of Comp.. (0x03|0x0035) plen 5  #109 [hci1] 9.999615
        Num handles: 1
        Handle: 129 Address: DF:A9:FF:F6:B1:1A (OUI DF-A9-FF)
        Count: 1
< ACL Data TX: Handle 129 flags 0x00 dlen 21               #110 [hci1] 9.999684
      SMP: Pairing Random (0x04) len 16
        Random value: 32527e6e64e79f33b2e374394db8ab2d
> HCI Event: Number of Completed Packets (0x13) plen 5    #111 [hci1] 10.158616
        Num handles: 1
        Handle: 129 Address: DF:A9:FF:F6:B1:1A (OUI DF-A9-FF)
        Count: 1
        #110: len 21 (1 Kb/s)
        Latency: 158 msec (68-172 msec ~161 msec)
> ACL Data RX: Handle 129 flags 0x02 dlen 21              #112 [hci1] 10.246524
      SMP: Pairing Confirm (0x03) len 16
        Confim value: 52ddb1455d0eb6be8d9d021d2eaafff7
< HCI Command: Host Number of Com.. (0x03|0x0035) plen 5  #113 [hci1] 10.259087
        Num handles: 1
        Handle: 129 Address: DF:A9:FF:F6:B1:1A (OUI DF-A9-FF)
        Count: 1
< ACL Data TX: Handle 129 flags 0x00 dlen 21              #114 [hci1] 10.259211
      SMP: Pairing Confirm (0x03) len 16
        Confim value: f5a10e2812c89db97d609b12e15b479f
> HCI Event: Number of Completed Packets (0x13) plen 5    #115 [hci1] 10.421322
        Num handles: 1
        Handle: 129 Address: DF:A9:FF:F6:B1:1A (OUI DF-A9-FF)
        Count: 1
        #114: len 21 (1 Kb/s)
        Latency: 162 msec (68-172 msec ~161 msec)
> ACL Data RX: Handle 129 flags 0x02 dlen 21              #116 [hci1] 10.421753
      SMP: Pairing Random (0x04) len 16
        Random value: 95dd6ba3eea0f3b10000000000000000
< HCI Command: Host Number of Com.. (0x03|0x0035) plen 5  #117 [hci1] 10.439639
        Num handles: 1
        Handle: 129 Address: DF:A9:FF:F6:B1:1A (OUI DF-A9-FF)
        Count: 1
< ACL Data TX: Handle 129 flags 0x00 dlen 21              #118 [hci1] 10.439757
      SMP: Pairing Random (0x04) len 16
        Random value: dddbdfe2838e9a8cc6964353c850fef7
> HCI Event: Number of Completed Packets (0x13) plen 5    #119 [hci1] 10.596032
        Num handles: 1
        Handle: 129 Address: DF:A9:FF:F6:B1:1A (OUI DF-A9-FF)
        Count: 1
        #118: len 21 (1 Kb/s)
        Latency: 156 msec (68-172 msec ~159 msec)
> ACL Data RX: Handle 129 flags 0x02 dlen 21              #120 [hci1] 10.683946
      SMP: Pairing Confirm (0x03) len 16
        Confim value: 1c488c86188b9b121a6f4e7e38ea70c4
< HCI Command: Host Number of Com.. (0x03|0x0035) plen 5  #121 [hci1] 10.699402
        Num handles: 1
        Handle: 129 Address: DF:A9:FF:F6:B1:1A (OUI DF-A9-FF)
        Count: 1
< ACL Data TX: Handle 129 flags 0x00 dlen 21              #122 [hci1] 10.699617
      SMP: Pairing Confirm (0x03) len 16
        Confim value: 0f1efe5a8e84d30a7f6a1977f06d6a58
> HCI Event: Number of Completed Packets (0x13) plen 5    #123 [hci1] 10.858873
        Num handles: 1
        Handle: 129 Address: DF:A9:FF:F6:B1:1A (OUI DF-A9-FF)
        Count: 1
        #122: len 21 (1 Kb/s)
        Latency: 159 msec (68-172 msec ~159 msec)
> ACL Data RX: Handle 129 flags 0x02 dlen 21              #124 [hci1] 10.859170
      SMP: Pairing Random (0x04) len 16
        Random value: 8731cbde192286430000000000000000
< HCI Command: Host Number of Com.. (0x03|0x0035) plen 5  #125 [hci1] 10.879454
        Num handles: 1
        Handle: 129 Address: DF:A9:FF:F6:B1:1A (OUI DF-A9-FF)
        Count: 1
< ACL Data TX: Handle 129 flags 0x00 dlen 21              #126 [hci1] 10.879633
      SMP: Pairing Random (0x04) len 16
        Random value: eb9f1915536596b6fc3db1c86b2b1970
> HCI Event: Number of Completed Packets (0x13) plen 5    #127 [hci1] 11.033657
        Num handles: 1
        Handle: 129 Address: DF:A9:FF:F6:B1:1A (OUI DF-A9-FF)
        Count: 1
        #126: len 21 (1 Kb/s)
        Latency: 154 msec (68-172 msec ~156 msec)
> ACL Data RX: Handle 129 flags 0x02 dlen 21              #128 [hci1] 11.121483
      SMP: Pairing Confirm (0x03) len 16
        Confim value: 400a3bad1d8a51e8a503d801a6896eec
< HCI Command: Host Number of Com.. (0x03|0x0035) plen 5  #129 [hci1] 11.139502
        Num handles: 1
        Handle: 129 Address: DF:A9:FF:F6:B1:1A (OUI DF-A9-FF)
        Count: 1
< ACL Data TX: Handle 129 flags 0x00 dlen 21              #130 [hci1] 11.139716
      SMP: Pairing Confirm (0x03) len 16
        Confim value: dd76494a48ff7945a4d727c53cb19a96
> HCI Event: Number of Completed Packets (0x13) plen 5    #131 [hci1] 11.296257
        Num handles: 1
        Handle: 129 Address: DF:A9:FF:F6:B1:1A (OUI DF-A9-FF)
        Count: 1
        #130: len 21 (1 Kb/s)
        Latency: 156 msec (68-172 msec ~156 msec)
> ACL Data RX: Handle 129 flags 0x02 dlen 21              #132 [hci1] 11.296701
      SMP: Pairing Random (0x04) len 16
        Random value: bacd2660004493d20000000000000000
< HCI Command: Host Number of Com.. (0x03|0x0035) plen 5  #133 [hci1] 11.299574
        Num handles: 1
        Handle: 129 Address: DF:A9:FF:F6:B1:1A (OUI DF-A9-FF)
        Count: 1
< ACL Data TX: Handle 129 flags 0x00 dlen 21              #134 [hci1] 11.299685
      SMP: Pairing Random (0x04) len 16
        Random value: 5c794dc9ad9f2c3f295ebd5ad5e1c3cf
> HCI Event: Number of Completed Packets (0x13) plen 5    #135 [hci1] 11.471056
        Num handles: 1
        Handle: 129 Address: DF:A9:FF:F6:B1:1A (OUI DF-A9-FF)
        Count: 1
        #134: len 21 (0 Kb/s)
        Latency: 171 msec (68-172 msec ~163 msec)
> ACL Data RX: Handle 129 flags 0x02 dlen 21              #136 [hci1] 11.558973
      SMP: Pairing Confirm (0x03) len 16
        Confim value: 37af39f1508474876c8688e83f19c913
< HCI Command: Host Number of Com.. (0x03|0x0035) plen 5  #137 [hci1] 11.579169
        Num handles: 1
        Handle: 129 Address: DF:A9:FF:F6:B1:1A (OUI DF-A9-FF)
        Count: 1
< ACL Data TX: Handle 129 flags 0x00 dlen 21              #138 [hci1] 11.579294
      SMP: Pairing Confirm (0x03) len 16
        Confim value: 91e80f10f37beb02d1dc77862080b4be
> HCI Event: Number of Completed Packets (0x13) plen 5    #139 [hci1] 11.733697
        Num handles: 1
        Handle: 129 Address: DF:A9:FF:F6:B1:1A (OUI DF-A9-FF)
        Count: 1
        #138: len 21 (1 Kb/s)
        Latency: 154 msec (68-172 msec ~159 msec)
> ACL Data RX: Handle 129 flags 0x02 dlen 21              #140 [hci1] 11.734098
      SMP: Pairing Random (0x04) len 16
        Random value: 21105fa2dd4815600000000000000000
< HCI Command: Host Number of Com.. (0x03|0x0035) plen 5  #141 [hci1] 11.739545
        Num handles: 1
        Handle: 129 Address: DF:A9:FF:F6:B1:1A (OUI DF-A9-FF)
        Count: 1
< ACL Data TX: Handle 129 flags 0x00 dlen 21              #142 [hci1] 11.739697
      SMP: Pairing Random (0x04) len 16
        Random value: 5c2fff312cdf99c9491988e877355a9a
> HCI Event: Number of Completed Packets (0x13) plen 5    #143 [hci1] 11.908594
        Num handles: 1
        Handle: 129 Address: DF:A9:FF:F6:B1:1A (OUI DF-A9-FF)
        Count: 1
        #142: len 21 (1 Kb/s)
        Latency: 168 msec (68-172 msec ~164 msec)
> ACL Data RX: Handle 129 flags 0x02 dlen 21              #144 [hci1] 11.996402
      SMP: Pairing Confirm (0x03) len 16
        Confim value: 85b5f8fc0e73553fc8b0504ea23d7734
< HCI Command: Host Number of Com.. (0x03|0x0035) plen 5  #145 [hci1] 11.999348
        Num handles: 1
        Handle: 129 Address: DF:A9:FF:F6:B1:1A (OUI DF-A9-FF)
        Count: 1
< ACL Data TX: Handle 129 flags 0x00 dlen 21              #146 [hci1] 11.999546
      SMP: Pairing Confirm (0x03) len 16
        Confim value: e488cc14515df2c215968a3369c614de
> HCI Event: Number of Completed Packets (0x13) plen 5    #147 [hci1] 12.171178
        Num handles: 1
        Handle: 129 Address: DF:A9:FF:F6:B1:1A (OUI DF-A9-FF)
        Count: 1
        #146: len 21 (0 Kb/s)
        Latency: 171 msec (68-172 msec ~167 msec)
> ACL Data RX: Handle 129 flags 0x02 dlen 21              #148 [hci1] 12.171608
      SMP: Pairing Random (0x04) len 16
        Random value: a66e21c269b63c130000000000000000
< HCI Command: Host Number of Com.. (0x03|0x0035) plen 5  #149 [hci1] 12.179547
        Num handles: 1
        Handle: 129 Address: DF:A9:FF:F6:B1:1A (OUI DF-A9-FF)
        Count: 1
< ACL Data TX: Handle 129 flags 0x00 dlen 21              #150 [hci1] 12.179633
      SMP: Pairing Random (0x04) len 16
        Random value: c629a3a987d808e808655d558dfc1155
> HCI Event: Number of Completed Packets (0x13) plen 5    #151 [hci1] 12.346006
        Num handles: 1
        Handle: 129 Address: DF:A9:FF:F6:B1:1A (OUI DF-A9-FF)
        Count: 1
        #150: len 21 (1 Kb/s)
        Latency: 166 msec (68-172 msec ~167 msec)
> ACL Data RX: Handle 129 flags 0x02 dlen 21              #152 [hci1] 12.433794
      SMP: Pairing Confirm (0x03) len 16
        Confim value: 0440fbdd44d5e7f9ed37a36238b1c7d2
< HCI Command: Host Number of Com.. (0x03|0x0035) plen 5  #153 [hci1] 12.439445
        Num handles: 1
        Handle: 129 Address: DF:A9:FF:F6:B1:1A (OUI DF-A9-FF)
        Count: 1
< ACL Data TX: Handle 129 flags 0x00 dlen 21              #154 [hci1] 12.439668
      SMP: Pairing Confirm (0x03) len 16
        Confim value: 706eb650eea05806f14ceab2965fda8d
> HCI Event: Number of Completed Packets (0x13) plen 5    #155 [hci1] 12.608758
        Num handles: 1
        Handle: 129 Address: DF:A9:FF:F6:B1:1A (OUI DF-A9-FF)
        Count: 1
        #154: len 21 (0 Kb/s)
        Latency: 169 msec (68-172 msec ~168 msec)
> ACL Data RX: Handle 129 flags 0x02 dlen 21              #156 [hci1] 12.609011
      SMP: Pairing Random (0x04) len 16
        Random value: 78d88f38becea6070000000000000000
< HCI Command: Host Number of Com.. (0x03|0x0035) plen 5  #157 [hci1] 12.619572
        Num handles: 1
        Handle: 129 Address: DF:A9:FF:F6:B1:1A (OUI DF-A9-FF)
        Count: 1
< ACL Data TX: Handle 129 flags 0x00 dlen 21              #158 [hci1] 12.619733
      SMP: Pairing Random (0x04) len 16
        Random value: 92f20f6ad8f13724432c7fd6001c45ff
> HCI Event: Number of Completed Packets (0x13) plen 5    #159 [hci1] 12.783514
        Num handles: 1
        Handle: 129 Address: DF:A9:FF:F6:B1:1A (OUI DF-A9-FF)
        Count: 1
        #158: len 21 (1 Kb/s)
        Latency: 163 msec (68-172 msec ~165 msec)
> ACL Data RX: Handle 129 flags 0x02 dlen 21              #160 [hci1] 12.871277
      SMP: Pairing Confirm (0x03) len 16
        Confim value: bb13edea6f1f98583820b5cae449b0ae
< HCI Command: Host Number of Com.. (0x03|0x0035) plen 5  #161 [hci1] 12.879143
        Num handles: 1
        Handle: 129 Address: DF:A9:FF:F6:B1:1A (OUI DF-A9-FF)
        Count: 1
< ACL Data TX: Handle 129 flags 0x00 dlen 21              #162 [hci1] 12.879260
      SMP: Pairing Confirm (0x03) len 16
        Confim value: 64febc2878bfd9e91c59f9b617d928d7
> HCI Event: Number of Completed Packets (0x13) plen 5    #163 [hci1] 13.046267
        Num handles: 1
        Handle: 129 Address: DF:A9:FF:F6:B1:1A (OUI DF-A9-FF)
        Count: 1
        #162: len 21 (1 Kb/s)
        Latency: 167 msec (68-172 msec ~166 msec)
> ACL Data RX: Handle 129 flags 0x02 dlen 21              #164 [hci1] 13.046563
      SMP: Pairing Random (0x04) len 16
        Random value: bed14f50ac18f9a10000000000000000
< HCI Command: Host Number of Com.. (0x03|0x0035) plen 5  #165 [hci1] 13.059528
        Num handles: 1
        Handle: 129 Address: DF:A9:FF:F6:B1:1A (OUI DF-A9-FF)
        Count: 1
< ACL Data TX: Handle 129 flags 0x00 dlen 21              #166 [hci1] 13.059600
      SMP: Pairing Random (0x04) len 16
        Random value: 23ac32ebbb5e14c8a6b9622f296d277f
> HCI Event: Number of Completed Packets (0x13) plen 5    #167 [hci1] 13.221037
        Num handles: 1
        Handle: 129 Address: DF:A9:FF:F6:B1:1A (OUI DF-A9-FF)
        Count: 1
        #166: len 21 (1 Kb/s)
        Latency: 161 msec (68-172 msec ~163 msec)
> ACL Data RX: Handle 129 flags 0x02 dlen 21              #168 [hci1] 13.308911
      SMP: Pairing Confirm (0x03) len 16
        Confim value: b8bf5f704fa5c4d852224fc1d92b443f
< HCI Command: Host Number of Com.. (0x03|0x0035) plen 5  #169 [hci1] 13.319358
        Num handles: 1
        Handle: 129 Address: DF:A9:FF:F6:B1:1A (OUI DF-A9-FF)
        Count: 1
< ACL Data TX: Handle 129 flags 0x00 dlen 21              #170 [hci1] 13.319453
      SMP: Pairing Confirm (0x03) len 16
        Confim value: 9e2aa380eabf7cb840b6dbfc0cde79bb
> HCI Event: Number of Completed Packets (0x13) plen 5    #171 [hci1] 13.483703
        Num handles: 1
        Handle: 129 Address: DF:A9:FF:F6:B1:1A (OUI DF-A9-FF)
        Count: 1
        #170: len 21 (1 Kb/s)
        Latency: 164 msec (68-172 msec ~164 msec)
> ACL Data RX: Handle 129 flags 0x02 dlen 21              #172 [hci1] 13.484075
      SMP: Pairing Random (0x04) len 16
        Random value: 58e93d8e133d33a60000000000000000
< HCI Command: Host Number of Com.. (0x03|0x0035) plen 5  #173 [hci1] 13.499567
        Num handles: 1
        Handle: 129 Address: DF:A9:FF:F6:B1:1A (OUI DF-A9-FF)
        Count: 1
< ACL Data TX: Handle 129 flags 0x00 dlen 21              #174 [hci1] 13.499663
      SMP: Pairing Random (0x04) len 16
        Random value: 297efe85e67448a15f56bd27e3a3cf1d
> HCI Event: Number of Completed Packets (0x13) plen 5    #175 [hci1] 13.658464
        Num handles: 1
        Handle: 129 Address: DF:A9:FF:F6:B1:1A (OUI DF-A9-FF)
        Count: 1
        #174: len 21 (1 Kb/s)
        Latency: 158 msec (68-172 msec ~161 msec)
> ACL Data RX: Handle 129 flags 0x02 dlen 21              #176 [hci1] 13.746286
      SMP: Pairing Confirm (0x03) len 16
        Confim value: db33fa5bcf5bd224e6122c5655994cee
< HCI Command: Host Number of Com.. (0x03|0x0035) plen 5  #177 [hci1] 13.759428
        Num handles: 1
        Handle: 129 Address: DF:A9:FF:F6:B1:1A (OUI DF-A9-FF)
        Count: 1
< ACL Data TX: Handle 129 flags 0x00 dlen 21              #178 [hci1] 13.759664
      SMP: Pairing Confirm (0x03) len 16
        Confim value: b1a254c70b308d00591ccdfc60d05980
> HCI Event: Number of Completed Packets (0x13) plen 5    #179 [hci1] 13.921223
        Num handles: 1
        Handle: 129 Address: DF:A9:FF:F6:B1:1A (OUI DF-A9-FF)
        Count: 1
        #178: len 21 (1 Kb/s)
        Latency: 161 msec (68-172 msec ~161 msec)
> ACL Data RX: Handle 129 flags 0x02 dlen 21              #180 [hci1] 13.921588
      SMP: Pairing Random (0x04) len 16
        Random value: 2ffd3dae09c2bf000000000000000000
< HCI Command: Host Number of Com.. (0x03|0x0035) plen 5  #181 [hci1] 13.939614
        Num handles: 1
        Handle: 129 Address: DF:A9:FF:F6:B1:1A (OUI DF-A9-FF)
        Count: 1
< ACL Data TX: Handle 129 flags 0x00 dlen 21              #182 [hci1] 13.939701
      SMP: Pairing Random (0x04) len 16
        Random value: 25a9493fd3ce4faf02be7293595bb7c6
> HCI Event: Number of Completed Packets (0x13) plen 5    #183 [hci1] 14.095944
        Num handles: 1
        Handle: 129 Address: DF:A9:FF:F6:B1:1A (OUI DF-A9-FF)
        Count: 1
        #182: len 21 (1 Kb/s)
        Latency: 156 msec (68-172 msec ~158 msec)
> ACL Data RX: Handle 129 flags 0x02 dlen 21              #184 [hci1] 14.183947
      SMP: Pairing Confirm (0x03) len 16
        Confim value: 6cbc52e634d58b0504db0953e73400c1
< HCI Command: Host Number of Com.. (0x03|0x0035) plen 5  #185 [hci1] 14.199300
        Num handles: 1
        Handle: 129 Address: DF:A9:FF:F6:B1:1A (OUI DF-A9-FF)
        Count: 1
< ACL Data TX: Handle 129 flags 0x00 dlen 21              #186 [hci1] 14.199466
      SMP: Pairing Confirm (0x03) len 16
        Confim value: 6d214a165f4282a5815bf87e8fcdc3e2
> HCI Event: Number of Completed Packets (0x13) plen 5    #187 [hci1] 14.358660
        Num handles: 1
        Handle: 129 Address: DF:A9:FF:F6:B1:1A (OUI DF-A9-FF)
        Count: 1
        #186: len 21 (1 Kb/s)
        Latency: 159 msec (68-172 msec ~159 msec)
> ACL Data RX: Handle 129 flags 0x02 dlen 21              #188 [hci1] 14.359019
      SMP: Pairing Random (0x04) len 16
        Random value: 3497c6b04711c8c80000000000000000
< HCI Command: Host Number of Com.. (0x03|0x0035) plen 5  #189 [hci1] 14.359599
        Num handles: 1
        Handle: 129 Address: DF:A9:FF:F6:B1:1A (OUI DF-A9-FF)
        Count: 1
< ACL Data TX: Handle 129 flags 0x00 dlen 21              #190 [hci1] 14.359768
      SMP: Pairing Random (0x04) len 16
        Random value: 58f6b41f855a6f6c3560debd84e2affc
> HCI Event: Number of Completed Packets (0x13) plen 5    #191 [hci1] 14.533479
        Num handles: 1
        Handle: 129 Address: DF:A9:FF:F6:B1:1A (OUI DF-A9-FF)
        Count: 1
        #190: len 21 (0 Kb/s)
        Latency: 173 msec (68-173 msec ~166 msec)
> ACL Data RX: Handle 129 flags 0x02 dlen 21              #192 [hci1] 14.621313
      SMP: Pairing Confirm (0x03) len 16
        Confim value: f1b2d7d983015640f8217d0bea153748
< HCI Command: Host Number of Com.. (0x03|0x0035) plen 5  #193 [hci1] 14.639449
        Num handles: 1
        Handle: 129 Address: DF:A9:FF:F6:B1:1A (OUI DF-A9-FF)
        Count: 1
< ACL Data TX: Handle 129 flags 0x00 dlen 21              #194 [hci1] 14.639601
      SMP: Pairing Confirm (0x03) len 16
        Confim value: 73a1a5425312d157d100e10f3b6bba35
> HCI Event: Number of Completed Packets (0x13) plen 5    #195 [hci1] 14.796108
        Num handles: 1
        Handle: 129 Address: DF:A9:FF:F6:B1:1A (OUI DF-A9-FF)
        Count: 1
        #194: len 21 (1 Kb/s)
        Latency: 156 msec (68-173 msec ~161 msec)
> ACL Data RX: Handle 129 flags 0x02 dlen 21              #196 [hci1] 14.796572
      SMP: Pairing Random (0x04) len 16
        Random value: 1911797be3c01e650000000000000000
< HCI Command: Host Number of Com.. (0x03|0x0035) plen 5  #197 [hci1] 14.799748
        Num handles: 1
        Handle: 129 Address: DF:A9:FF:F6:B1:1A (OUI DF-A9-FF)
        Count: 1
< ACL Data TX: Handle 129 flags 0x00 dlen 21              #198 [hci1] 14.799838
      SMP: Pairing Random (0x04) len 16
        Random value: b67e7216d5bf664139eda2b542549666
> HCI Event: Number of Completed Packets (0x13) plen 5    #199 [hci1] 14.970909
        Num handles: 1
        Handle: 129 Address: DF:A9:FF:F6:B1:1A (OUI DF-A9-FF)
        Count: 1
        #198: len 21 (0 Kb/s)
        Latency: 171 msec (68-173 msec ~166 msec)
> ACL Data RX: Handle 129 flags 0x02 dlen 21              #200 [hci1] 15.058758
      SMP: Pairing Confirm (0x03) len 16
        Confim value: a26f17c397234117c2ac258efe3943ed
< HCI Command: Host Number of Com.. (0x03|0x0035) plen 5  #201 [hci1] 15.059505
        Num handles: 1
        Handle: 129 Address: DF:A9:FF:F6:B1:1A (OUI DF-A9-FF)
        Count: 1
< ACL Data TX: Handle 129 flags 0x00 dlen 21              #202 [hci1] 15.059722
      SMP: Pairing Confirm (0x03) len 16
        Confim value: e415035ac5838ee514d1a0a2bd6cb3bd
> HCI Event: Number of Completed Packets (0x13) plen 5    #203 [hci1] 15.233627
        Num handles: 1
        Handle: 129 Address: DF:A9:FF:F6:B1:1A (OUI DF-A9-FF)
        Count: 1
        #202: len 21 (0 Kb/s)
        Latency: 173 msec (68-173 msec ~170 msec)
> ACL Data RX: Handle 129 flags 0x02 dlen 21              #204 [hci1] 15.234006
      SMP: Pairing Random (0x04) len 16
        Random value: 51560432482f6c070000000000000000
< HCI Command: Host Number of Com.. (0x03|0x0035) plen 5  #205 [hci1] 15.239495
        Num handles: 1
        Handle: 129 Address: DF:A9:FF:F6:B1:1A (OUI DF-A9-FF)
        Count: 1
< ACL Data TX: Handle 129 flags 0x00 dlen 21              #206 [hci1] 15.239566
      SMP: Pairing Random (0x04) len 16
        Random value: ed17f76500c95219dd01e09d1e63f87b
> HCI Event: Number of Completed Packets (0x13) plen 5    #207 [hci1] 15.408499
        Num handles: 1
        Handle: 129 Address: DF:A9:FF:F6:B1:1A (OUI DF-A9-FF)
        Count: 1
        #206: len 21 (1 Kb/s)
        Latency: 168 msec (68-173 msec ~169 msec)
> ACL Data RX: Handle 129 flags 0x02 dlen 21              #208 [hci1] 15.496248
      SMP: Pairing Confirm (0x03) len 16
        Confim value: 43aed4dd42fa6e7c04c9c494d03bc190
< HCI Command: Host Number of Com.. (0x03|0x0035) plen 5  #209 [hci1] 15.499487
        Num handles: 1
        Handle: 129 Address: DF:A9:FF:F6:B1:1A (OUI DF-A9-FF)
        Count: 1
< ACL Data TX: Handle 129 flags 0x00 dlen 21              #210 [hci1] 15.499694
      SMP: Pairing Confirm (0x03) len 16
        Confim value: fd968358334bb9152689fcaa76751add
> HCI Event: Number of Completed Packets (0x13) plen 5    #211 [hci1] 15.671097
        Num handles: 1
        Handle: 129 Address: DF:A9:FF:F6:B1:1A (OUI DF-A9-FF)
        Count: 1
        #210: len 21 (0 Kb/s)
        Latency: 171 msec (68-173 msec ~170 msec)
> ACL Data RX: Handle 129 flags 0x02 dlen 21              #212 [hci1] 15.671508
      SMP: Pairing Random (0x04) len 16
        Random value: 2383e8d964c7a0990000000000000000
< HCI Command: Host Number of Com.. (0x03|0x0035) plen 5  #213 [hci1] 15.679551
        Num handles: 1
        Handle: 129 Address: DF:A9:FF:F6:B1:1A (OUI DF-A9-FF)
        Count: 1
< ACL Data TX: Handle 129 flags 0x00 dlen 21              #214 [hci1] 15.679687
      SMP: Pairing Random (0x04) len 16
        Random value: 81d35d47e1f6006d79c974bd9d9e1ee3
> HCI Event: Number of Completed Packets (0x13) plen 5    #215 [hci1] 15.845821
        Num handles: 1
        Handle: 129 Address: DF:A9:FF:F6:B1:1A (OUI DF-A9-FF)
        Count: 1
        #214: len 21 (1 Kb/s)
        Latency: 166 msec (68-173 msec ~168 msec)
> ACL Data RX: Handle 129 flags 0x02 dlen 21              #216 [hci1] 15.933788
      SMP: Pairing Confirm (0x03) len 16
        Confim value: f000a570de7f5b40eef7550041a8a2cf
< HCI Command: Host Number of Com.. (0x03|0x0035) plen 5  #217 [hci1] 15.939254
        Num handles: 1
        Handle: 129 Address: DF:A9:FF:F6:B1:1A (OUI DF-A9-FF)
        Count: 1
< ACL Data TX: Handle 129 flags 0x00 dlen 21              #218 [hci1] 15.939326
      SMP: Pairing Confirm (0x03) len 16
        Confim value: 40abb0d26876148c8a1268596ba7f651
> HCI Event: Number of Completed Packets (0x13) plen 5    #219 [hci1] 16.108685
        Num handles: 1
        Handle: 129 Address: DF:A9:FF:F6:B1:1A (OUI DF-A9-FF)
        Count: 1
        #218: len 21 (0 Kb/s)
        Latency: 169 msec (68-173 msec ~168 msec)
> ACL Data RX: Handle 129 flags 0x02 dlen 21              #220 [hci1] 16.108918
      SMP: Pairing Random (0x04) len 16
        Random value: 2af9a0a523da169f0000000000000000
< HCI Command: Host Number of Com.. (0x03|0x0035) plen 5  #221 [hci1] 16.119540
        Num handles: 1
        Handle: 129 Address: DF:A9:FF:F6:B1:1A (OUI DF-A9-FF)
        Count: 1
< ACL Data TX: Handle 129 flags 0x00 dlen 21              #222 [hci1] 16.119703
      SMP: Pairing Random (0x04) len 16
        Random value: e7f7e0c2476823e41736a7e381bafb7c
> HCI Event: Number of Completed Packets (0x13) plen 5    #223 [hci1] 16.283410
        Num handles: 1
        Handle: 129 Address: DF:A9:FF:F6:B1:1A (OUI DF-A9-FF)
        Count: 1
        #222: len 21 (1 Kb/s)
        Latency: 163 msec (68-173 msec ~166 msec)
> ACL Data RX: Handle 129 flags 0x02 dlen 21              #224 [hci1] 16.371249
      SMP: Pairing Confirm (0x03) len 16
        Confim value: bd301e011c0682fc26e439ff7d7cff65
< HCI Command: Host Number of Com.. (0x03|0x0035) plen 5  #225 [hci1] 16.379525
        Num handles: 1
        Handle: 129 Address: DF:A9:FF:F6:B1:1A (OUI DF-A9-FF)
        Count: 1
< ACL Data TX: Handle 129 flags 0x00 dlen 21              #226 [hci1] 16.379740
      SMP: Pairing Confirm (0x03) len 16
        Confim value: 534c228889a98d05c5f9290dbe84d781
> HCI Event: Number of Completed Packets (0x13) plen 5    #227 [hci1] 16.546122
        Num handles: 1
        Handle: 129 Address: DF:A9:FF:F6:B1:1A (OUI DF-A9-FF)
        Count: 1
        #226: len 21 (1 Kb/s)
        Latency: 166 msec (68-173 msec ~166 msec)
> ACL Data RX: Handle 129 flags 0x02 dlen 21              #228 [hci1] 16.546448
      SMP: Pairing Random (0x04) len 16
        Random value: 46ffe55afbacff7e0000000000000000
< HCI Command: Host Number of Com.. (0x03|0x0035) plen 5  #229 [hci1] 16.559769
        Num handles: 1
        Handle: 129 Address: DF:A9:FF:F6:B1:1A (OUI DF-A9-FF)
        Count: 1
