Bluetooth monitor ver 5.72
= Note: Linux version 6.14.0-36-generic (x86_64)                       0.255850
= Note: Bluetooth subsystem version 2.22                               0.255853
= New Index: 00:00:00:00:00:00 (Primary,UART,hci1)              [hci1] 0.255854
= New Index: 48:5F:99:8E:E0:64 (Primary,USB,hci0)               [hci0] 0.255855
= Open Index: 00:00:00:00:00:00                                 [hci1] 0.770419
= Index Info: 00:00:00:00:00:00 (Nordic Semiconductor ASA)      [hci1] 0.770431
@ USER Open: main (privileged) version 2.22            {0x0001} [hci1] 0.770438
< HCI Command: Reset (0x03|0x0003) plen 0                    #1 [hci1] 0.771500
> HCI Event: Command Complete (0x0e) plen 4                  #2 [hci1] 0.772066
      Reset (0x03|0x0003) ncmd 1
        Status: Success (0x00)
< HCI Command: Read Local Supported... (0x04|0x0003) plen 0  #3 [hci1] 0.790264
> HCI Event: Command Complete (0x0e) plen 12                 #4 [hci1] 0.790844
      Read Local Supported Features (0x04|0x0003) ncmd 1
        Status: Success (0x00)
        Features: 0x00 0x00 0x00 0x00 0x60 0x00 0x00 0x00
          BR/EDR Not Supported
          LE Supported (Controller)
< HCI Command: Read Local Version In.. (0x04|0x0001) plen 0  #5 [hci1] 0.810029
> HCI Event: Command Complete (0x0e) plen 12                 #6 [hci1] 0.810484
      Read Local Version Information (0x04|0x0001) ncmd 1
        Status: Success (0x00)
        HCI version: Reserved (0x0f) - Revision 12393 (0x3069)
        LMP version: Reserved (0x0f) - Subversion 12393 (0x3069)
        Manufacturer: Nordic Semiconductor ASA (89)
< HCI Command: Read Local Supported... (0x04|0x0002) plen 0  #7 [hci1] 0.829898
> HCI Event: Command Complete (0x0e) plen 68                 #8 [hci1] 0.830948
      Read Local Supported Commands (0x04|0x0002) ncmd 1
        Status: Success (0x00)
        Commands: 119 entries
          Disconnect (Octet 0 - Bit 5)
          Read Remote Version Information (Octet 2 - Bit 7)
          Set Event Mask (Octet 5 - Bit 6)
          Reset (Octet 5 - Bit 7)
          Read Connection Accept Timeout (Octet 7 - Bit 2)
          Write Connection Accept Timeout (Octet 7 - Bit 3)
          Read Transmit Power Level (Octet 10 - Bit 2)
          Set Controller To Host Flow Control (Octet 10 - Bit 5)
          Host Buffer Size (Octet 10 - Bit 6)
          Host Number of Completed Packets (Octet 10 - Bit 7)
          Read Local Version Information (Octet 14 - Bit 3)
          Read Local Supported Features (Octet 14 - Bit 5)
          Read BD ADDR (Octet 15 - Bit 1)
          Read RSSI (Octet 15 - Bit 5)
          Set Event Mask Page 2 (Octet 22 - Bit 2)
          LE Set Event Mask (Octet 25 - Bit 0)
          LE Read Buffer Size (Octet 25 - Bit 1)
          LE Read Local Supported Features (Octet 25 - Bit 2)
          LE Set Random Address (Octet 25 - Bit 4)
          LE Set Advertising Parameters (Octet 25 - Bit 5)
          LE Read Advertising Channel TX Power (Octet 25 - Bit 6)
          LE Set Advertising Data (Octet 25 - Bit 7)
          LE Set Scan Response Data (Octet 26 - Bit 0)
          LE Set Advertise Enable (Octet 26 - Bit 1)
          LE Set Scan Parameters (Octet 26 - Bit 2)
          LE Set Scan Enable (Octet 26 - Bit 3)
          LE Create Connection (Octet 26 - Bit 4)
          LE Create Connection Cancel (Octet 26 - Bit 5)
          LE Read Accept List Size (Octet 26 - Bit 6)
          LE Clear Accept List (Octet 26 - Bit 7)
          LE Add Device To Accept List (Octet 27 - Bit 0)
          LE Remove Device From Accept List (Octet 27 - Bit 1)
          LE Connection Update (Octet 27 - Bit 2)
          LE Set Host Channel Classification (Octet 27 - Bit 3)
          LE Read Channel Map (Octet 27 - Bit 4)
          LE Read Remote Used Features (Octet 27 - Bit 5)
          LE Encrypt (Octet 27 - Bit 6)
          LE Rand (Octet 27 - Bit 7)
          LE Start Encryption (Octet 28 - Bit 0)
          LE Long Term Key Request Reply (Octet 28 - Bit 1)
          LE Long Term Key Request Neg Reply (Octet 28 - Bit 2)
          LE Read Supported States (Octet 28 - Bit 3)
          LE Receiver Test (Octet 28 - Bit 4)
          LE Transmitter Test (Octet 28 - Bit 5)
          LE Test End (Octet 28 - Bit 6)
          Read Authenticated Payload Timeout (Octet 32 - Bit 4)
          Write Authenticated Payload Timeout (Octet 32 - Bit 5)
          LE Set Data Length (Octet 33 - Bit 6)
          LE Read Suggested Default Data Length (Octet 33 - Bit 7)
          LE Write Suggested Default Data Length (Octet 34 - Bit 0)
          LE Add Device To Resolving List (Octet 34 - Bit 3)
          LE Remove Device From Resolving List (Octet 34 - Bit 4)
          LE Clear Resolving List (Octet 34 - Bit 5)
          LE Read Resolving List Size (Octet 34 - Bit 6)
          LE Set Address Resolution Enable (Octet 35 - Bit 1)
          LE Set Resolvable Private Address Timeout (Octet 35 - Bit 2)
          LE Read Maximum Data Length (Octet 35 - Bit 3)
          LE Read PHY (Octet 35 - Bit 4)
          LE Set Default PHY (Octet 35 - Bit 5)
          LE Set PHY (Octet 35 - Bit 6)
          LE Enhanced Receiver Test (Octet 35 - Bit 7)
          LE Enhanced Transmitter Test (Octet 36 - Bit 0)
          LE Set Advertising Set Random Address (Octet 36 - Bit 1)
          LE Set Extended Advertising Parameters (Octet 36 - Bit 2)
          LE Set Extended Advertising Data (Octet 36 - Bit 3)
          LE Set Extended Scan Response Data (Octet 36 - Bit 4)
          LE Set Extended Advertising Enable (Octet 36 - Bit 5)
          LE Read Maximum Advertising Data Length (Octet 36 - Bit 6)
          LE Read Number of Supported Advertising Sets (Octet 36 - Bit 7)
          LE Remove Advertising Set (Octet 37 - Bit 0)
          LE Clear Advertising Sets (Octet 37 - Bit 1)
          LE Set Periodic Advertising Parameters (Octet 37 - Bit 2)
          LE Set Periodic Advertising Data (Octet 37 - Bit 3)
          LE Set Periodic Advertising Enable (Octet 37 - Bit 4)
          LE Set Extended Scan Parameters (Octet 37 - Bit 5)
          LE Set Extended Scan Enable (Octet 37 - Bit 6)
          LE Extended Create Connection (Octet 37 - Bit 7)
          LE Periodic Advertising Create Sync (Octet 38 - Bit 0)
          LE Periodic Advertising Create Sync Cancel (Octet 38 - Bit 1)
          LE Periodic Advertising Terminate Sync (Octet 38 - Bit 2)
          LE Add Device To Periodic Advertiser List (Octet 38 - Bit 3)
          LE Remove Device From Periodic Advertiser List (Octet 38 - Bit 4)
          LE Clear Periodic Advertiser List (Octet 38 - Bit 5)
          LE Read Periodic Advertiser List Size (Octet 38 - Bit 6)
          LE Read Transmit Power (Octet 38 - Bit 7)
          LE Read RF Path Compensation (Octet 39 - Bit 0)
          LE Write RF Path Compensation (Octet 39 - Bit 1)
          LE Set Privacy Mode (Octet 39 - Bit 2)
          LE Periodic Advertising Receive Enable (Octet 40 - Bit 5)
          LE Periodic Advertising Sync Transfer (Octet 40 - Bit 6)
          LE Periodic Advertising Set Info Transfer (Octet 40 - Bit 7)
          LE Periodic Advertising Sync Transfer Parameters (Octet 41 - Bit 0)
          LE Set Default Periodic Advertisng Sync Transfer Parameters (Octet 41 - Bit 1)
          LE Read Buffer v2 (Octet 41 - Bit 5)
          LE Read ISO TX Sync (Octet 41 - Bit 6)
          LE Set Connected Isochronous Group Parameters (Octet 41 - Bit 7)
          LE Set Connected Isochronous Group Parameters Test (Octet 42 - Bit 0)
          LE Create Connected Isochronous Stream (Octet 42 - Bit 1)
          LE Remove Connected Isochronous Group (Octet 42 - Bit 2)
          LE Accept Connected Isochronous Stream Request (Octet 42 - Bit 3)
          LE Reject Connected Isochronous Stream Request (Octet 42 - Bit 4)
          LE Create Broadcast Isochronous Group (Octet 42 - Bit 5)
          LE Create Broadcast Isochronous Group Test (Octet 42 - Bit 6)
          LE Terminate Broadcast Isochronous Group (Octet 42 - Bit 7)
          LE Broadcast Isochronous Group Create Sync (Octet 43 - Bit 0)
          LE Broadcast Isochronous Group Terminate Sync (Octet 43 - Bit 1)
          LE Request Peer SCA (Octet 43 - Bit 2)
          LE Setup Isochronous Data Path (Octet 43 - Bit 3)
          LE Remove Isochronous Data Path (Octet 43 - Bit 4)
          LE Isochronous Transmit Test (Octet 43 - Bit 5)
          LE Isochronous Receive Test (Octet 43 - Bit 6)
          LE Isochronous Read Test Counters (Octet 43 - Bit 7)
          LE Isochronous Read Test Counters (Octet 44 - Bit 0)
          LE Set Host Feature (Octet 44 - Bit 1)
          Octet 44 - Bit 2 
          Octet 45 - Bit 6 
          Octet 46 - Bit 0 
          Octet 46 - Bit 1 
          Octet 46 - Bit 2 
< HCI Command: Host Buffer Size (0x03|0x0033) plen 7         #9 [hci1] 0.849979
        ACL MTU: 255  ACL max packet: 16
        SCO MTU: 0    SCO max packet: 0
> HCI Event: Command Complete (0x0e) plen 4                 #10 [hci1] 0.850459
      Host Buffer Size (0x03|0x0033) ncmd 1
        Status: Success (0x00)
< HCI Command: Set Controller To Ho.. (0x03|0x0031) plen 1  #11 [hci1] 0.869960
        Flow control: ACL Data Packets (0x01)
> HCI Event: Command Complete (0x0e) plen 4                 #12 [hci1] 0.870351
      Set Controller To Host Flow Control (0x03|0x0031) ncmd 1
        Status: Success (0x00)
< HCI Command: LE Read Local Suppor.. (0x08|0x0003) plen 0  #13 [hci1] 0.889921
> HCI Event: Command Complete (0x0e) plen 12                #14 [hci1] 0.890351
      LE Read Local Supported Features (0x08|0x0003) ncmd 1
        Status: Success (0x00)
        Features: 0xfd 0x79 0x00 0xf7 0x30 0x01 0x00 0x00
          LE Encryption
          Extended Reject Indication
          Peripheral-initiated Features Exchange
          LE Ping
          LE Data Packet Length Extension
          LL Privacy
          Extended Scanner Filter Policies
          LE 2M PHY
          LE Coded PHY
          LE Extended Advertising
          LE Periodic Advertising
          Channel Selection Algorithm #2
          Periodic Advertising Sync Transfer - Sender
          Periodic Advertising Sync Transfer - Recipient
          Sleep Clock Accuracy Updates
          Connected Isochronous Stream - Central
          Connected Isochronous Stream - Peripheral
          Isochronous Broadcaster
          Synchronized Receiver
          Periodic Advertising ADI support
          Connection Subrating
          Unknown features (0x0000010000000000)
< HCI Command: LE Set Host Feature (0x08|0x0074) plen 2     #15 [hci1] 0.909951
        Bit Number: 32
          Connected Isochronous Stream (Host Support)
        Bit Value: 1
> HCI Event: Command Complete (0x0e) plen 4                 #16 [hci1] 0.910368
      LE Set Host Feature (0x08|0x0074) ncmd 1
        Status: Success (0x00)
< HCI Command: LE Read Buffer v2 (0x08|0x0060) plen 0       #17 [hci1] 0.929969
> HCI Event: Command Complete (0x0e) plen 10                #18 [hci1] 0.930418
      LE Read Buffer v2 (0x08|0x0060) ncmd 1
        Status: Success (0x00)
        ACL MTU: 27
        ACL max packet: 3
        ISO MTU: 318
        ISO max packet: 3
< HCI Command: LE Read Maximum Adve.. (0x08|0x003a) plen 0  #19 [hci1] 0.949976
> HCI Event: Command Complete (0x0e) plen 6                 #20 [hci1] 0.950415
      LE Read Maximum Advertising Data Length (0x08|0x003a) ncmd 1
        Status: Success (0x00)
        Max length: 1650
< HCI Command: LE Read Supported St.. (0x08|0x001c) plen 0  #21 [hci1] 0.969945
> HCI Event: Command Complete (0x0e) plen 12                #22 [hci1] 0.970414
      LE Read Supported States (0x08|0x001c) ncmd 1
        Status: Success (0x00)
        States: 0x000003ff3e0306ff
          Non-connectable Advertising State
          Scannable Advertising State
          Connectable Advertising State
          High Duty Cycle Directed Advertising State
          Passive Scanning State
          Active Scanning State
          Initiating State
            and Connection State (Central Role)
          Connection State (Peripheral Role)
          Scannable Advertising State
            and Passive Scanning State
          Connectable Advertising State
            and Passive Scanning State
          Non-connectable Advertising State
            and Initiating State
          Scannable Advertising State
            and Initiating State
          Active Scanning State
            and Connection State (Central Role)
          Passive Scanning State
            and Connection State (Peripheral Role)
          Active Scanning State
            and Connection State (Peripheral Role)
          Initiating State
            and Connection State (Central Role)
            and Central Role & Central Role
          Low Duty Cycle Directed Advertising State
          Connectable Advertising State
            and Initiating State
            and Central Role & Peripheral Role
          High Duty Cycle Directed Advertising State
            and Initiating State
            and Central Role & Peripheral Role
          Low Duty Cycle Directed Advertising State
            and Initiating State
            and Central Role & Peripheral Role
          Connectable Advertising State
            and Connection State (Central Role)
            and Central Role & Peripheral Role
          High Duty Cycle Directed Advertising State
            and Connection State (Central Role)
            and Central Role & Peripheral Role
          Low Duty Cycle Directed Advertising State
            and Connection State (Central Role)
            and Central Role & Peripheral Role
          Connectable Advertising State
            and Connection State (Peripheral Role)
            and Central Role & Peripheral Role
          High Duty Cycle Directed Advertising State
            and Connection State (Peripheral Role)
            and Peripheral Role & Peripheral Role
          Low Duty Cycle Directed Advertising State
            and Connection State (Peripheral Role)
            and Peripheral Role & Peripheral Role
          Initiating State
            and Connection State (Peripheral Role)
            and Central Role & Peripheral Role
< HCI Command: LE Read Maximum Data.. (0x08|0x002f) plen 0  #23 [hci1] 0.989949
> HCI Event: Command Complete (0x0e) plen 12                #24 [hci1] 0.990451
      LE Read Maximum Data Length (0x08|0x002f) ncmd 1
        Status: Success (0x00)
        Max TX octets: 251
        Max TX time: 2704
        Max RX octets: 251
        Max RX time: 2704
< HCI Command: LE Write Suggested D.. (0x08|0x0024) plen 4  #25 [hci1] 1.009944
        TX octets: 251
        TX time: 2704
> HCI Event: Command Complete (0x0e) plen 4                 #26 [hci1] 1.010577
      LE Write Suggested Default Data Length (0x08|0x0024) ncmd 1
        Status: Success (0x00)
< HCI Command: LE Read Resolving Li.. (0x08|0x002a) plen 0  #27 [hci1] 1.029968
> HCI Event: Command Complete (0x0e) plen 5                 #28 [hci1] 1.030357
      LE Read Resolving List Size (0x08|0x002a) ncmd 1
        Status: Success (0x00)
        Size: 8
< HCI Command: LE Set Event Mask (0x08|0x0001) plen 8       #29 [hci1] 1.049944
        Mask: 0x000002023f87fa5e
          LE Advertising Report
          LE Connection Update Complete
          LE Read Remote Used Features Complete
          LE Long Term Key Request
          LE Data Length Change
          LE Enhanced Connection Complete
          LE PHY Update Complete
          LE Extended Advertising Report
          LE Periodic Advertising Sync Established
          LE Periodic Advertising Report
          LE Periodic Advertising Sync Lost
          LE Extended Scan Timeout
          LE Extended Advertising Set Terminated
          LE Scan Request Received
          LE Periodic Advertising Sync Transfer Rvc
          LE CIS Established
          LE CIS Request
          LE Create BIG Complete
          LE Terminate BIG Complete
          LE BIG Sync Estabilished Complete
          LE BIG Sync Lost
          LE BIG Info Advertising Report
          Unknown mask (0x0000020000000000)
> HCI Event: Command Complete (0x0e) plen 4                 #30 [hci1] 1.050537
      LE Set Event Mask (0x08|0x0001) ncmd 1
        Status: Success (0x00)
< HCI Command: Set Event Mask (0x03|0x0001) plen 8          #31 [hci1] 1.069959
        Mask: 0x2000800002008890
          Disconnection Complete
          Encryption Change
          Read Remote Version Information Complete
          Hardware Error
          Data Buffer Overflow
          Encryption Key Refresh Complete
          LE Meta
> HCI Event: Command Complete (0x0e) plen 4                 #32 [hci1] 1.070473
      Set Event Mask (0x03|0x0001) ncmd 1
        Status: Success (0x00)
< HCI Command: Read BD ADDR (0x04|0x0009) plen 0            #33 [hci1] 1.089946
> HCI Event: Command Complete (0x0e) plen 10                #34 [hci1] 1.090439
      Read BD ADDR (0x04|0x0009) ncmd 1
        Status: Success (0x00)
        Address: 00:00:00:00:00:00 (OUI 00-00-00)
< HCI Command: LE Set Random Address (0x08|0x0005) plen 6   #35 [hci1] 1.109990
        Address: D5:B6:CC:31:DB:3B (Static)
> HCI Event: Command Complete (0x0e) plen 4                 #36 [hci1] 1.110533
      LE Set Random Address (0x08|0x0005) ncmd 1
        Status: Success (0x00)
< HCI Command: LE Set Extended Adv.. (0x08|0x0036) plen 25  #37 [hci1] 3.640189
        Handle: 0x00
        Properties: 0x0013
          Connectable
          Scannable
          Use legacy advertising PDUs: ADV_IND
        Min advertising interval: 100.000 msec (0x00a0)
        Max advertising interval: 150.000 msec (0x00f0)
        Channel map: 37, 38, 39 (0x07)
        Own address type: Random (0x01)
        Peer address type: Public (0x00)
        Peer address: 00:00:00:00:00:00 (OUI 00-00-00)
        Filter policy: Allow Scan Request from Any, Allow Connect Request from Any (0x00)
        TX power: Host has no preference (0x7f)
        Primary PHY: LE 1M (0x01)
        Secondary max skip: 0x00
        Secondary PHY: LE 1M (0x01)
        SID: 0x00
        Scan request notifications: Disabled (0x00)
> HCI Event: Command Complete (0x0e) plen 5                 #38 [hci1] 3.641103
      LE Set Extended Advertising Parameters (0x08|0x0036) ncmd 1
        Status: Success (0x00)
        TX power (selected): 0 dbm (0x00)
< HCI Command: LE Set Advertising S.. (0x08|0x0035) plen 7  #39 [hci1] 3.650087
        Advertising handle: 0x00
        Advertising random address: D5:B6:CC:31:DB:3B (Static)
> HCI Event: Command Complete (0x0e) plen 4                 #40 [hci1] 3.650696
      LE Set Advertising Set Random Address (0x08|0x0035) ncmd 1
        Status: Success (0x00)
< HCI Command: LE Set Extended Adv.. (0x08|0x0037) plen 22  #41 [hci1] 3.669990
        Handle: 0x00
        Operation: Complete extended advertising data (0x03)
        Fragment preference: Minimize fragmentation (0x01)
        Data length: 0x12
        Flags: 0x06
          LE General Discoverable Mode
          BR/EDR Not Supported
        Name (complete): Tester_F6B11A
> HCI Event: Command Complete (0x0e) plen 4                 #42 [hci1] 3.670657
      LE Set Extended Advertising Data (0x08|0x0037) ncmd 1
        Status: Success (0x00)
< HCI Command: LE Set Extended Scan.. (0x08|0x0038) plen 4  #43 [hci1] 3.689988
        Handle: 0x00
        Operation: Complete scan response data (0x03)
        Fragment preference: Minimize fragmentation (0x01)
        Data length: 0x00
> HCI Event: Command Complete (0x0e) plen 4                 #44 [hci1] 3.690451
      LE Set Extended Scan Response Data (0x08|0x0038) ncmd 1
        Status: Success (0x00)
< HCI Command: LE Set Extended Adve.. (0x08|0x0039) plen 6  #45 [hci1] 3.710028
        Extended advertising: Enabled (0x01)
        Number of sets: 1 (0x01)
        Entry 0
          Handle: 0x00
          Duration: 0 ms (0x00)
          Max ext adv events: 0
> HCI Event: Command Complete (0x0e) plen 4                 #46 [hci1] 3.710667
      LE Set Extended Advertising Enable (0x08|0x0039) ncmd 1
        Status: Success (0x00)
> HCI Event: LE Meta Event (0x3e) plen 31                   #47 [hci1] 3.826257
      LE Enhanced Connection Complete (0x0a)
        Status: Success (0x00)
        Handle: 1515
        Role: Peripheral (0x01)
        Peer address type: Public (0x00)
        Peer address: DF:A9:FF:F6:B1:1A (OUI DF-A9-FF)
        Local resolvable private address: 00:00:00:00:00:00 (Non-Resolvable)
        Peer resolvable private address: 00:00:00:00:00:00 (Non-Resolvable)
        Connection interval: 87.50 msec (0x0046)
        Connection latency: 0 (0x0000)
        Supervision timeout: 25120 msec (0x09d0)
        Central clock accuracy: 0x01
> HCI Event: LE Meta Event (0x3e) plen 6                    #48 [hci1] 3.826353
      LE Advertising Set Terminated (0x12)
        Status: Success (0x00)
        Handle: 0
        Connection handle: 1515
        Number of completed extended advertising events: 0
< HCI Command: LE Read Remote Used... (0x08|0x0016) plen 2  #49 [hci1] 3.830166
        Handle: 1515 Address: DF:A9:FF:F6:B1:1A (OUI DF-A9-FF)
< ACL Data TX: Handle 1515 flags 0x00 dlen 7                #50 [hci1] 3.830173
      ATT: Exchange MTU Request (0x02) len 2
        Client RX MTU: 251
> HCI Event: Command Status (0x0f) plen 4                   #51 [hci1] 3.830667
      LE Read Remote Used Features (0x08|0x0016) ncmd 1
        Status: Success (0x00)
> HCI Event: Number of Completed Packets (0x13) plen 5      #52 [hci1] 4.002251
        Num handles: 1
        Handle: 1515 Address: DF:A9:FF:F6:B1:1A (OUI DF-A9-FF)
        Count: 1
        #50: len 7 (0 Kb/s)
        Latency: 172 msec (172-172 msec ~172 msec)
> HCI Event: LE Meta Event (0x3e) plen 12                   #53 [hci1] 4.090139
      LE Read Remote Used Features (0x04)
        Status: Success (0x00)
        Handle: 1515 Address: DF:A9:FF:F6:B1:1A (OUI DF-A9-FF)
        Features: 0x2d 0x49 0x00 0xf7 0x67 0xd8 0x00 0x00
          LE Encryption
          Extended Reject Indication
          Peripheral-initiated Features Exchange
          LE Data Packet Length Extension
          LE 2M PHY
          LE Coded PHY
          Channel Selection Algorithm #2
          Periodic Advertising Sync Transfer - Sender
          Periodic Advertising Sync Transfer - Recipient
          Sleep Clock Accuracy Updates
          Connected Isochronous Stream - Central
          Connected Isochronous Stream - Peripheral
          Isochronous Broadcaster
          Synchronized Receiver
          Connected Isochronous Stream (Host Support)
          LE Power Control Request
          LE Power Control Request
          Connection Subrating
          Connection Subrating (Host Support)
          Unknown features (0x0000d80000000000)
> ACL Data RX: Handle 1515 flags 0x02 dlen 11               #54 [hci1] 6.539852
      SMP: Pairing Request (0x01) len 6
        IO capability: KeyboardDisplay (0x04)
        OOB data: Authentication data not present (0x00)
        Authentication requirement: Bonding, MITM, SC, No Keypresses (0x0d)
        Max encryption key size: 16
        Initiator key distribution: EncKey IdKey (0x03)
        Responder key distribution: EncKey IdKey Sign (0x07)
> ACL Data RX: Handle 1515 flags 0x02 dlen 7                #55 [hci1] 6.540289
      ATT: Exchange MTU Response (0x03) len 2
        Server RX MTU: 23
< HCI Command: Host Number of Compl.. (0x03|0x0035) plen 5  #56 [hci1] 6.550144
        Num handles: 1
        Handle: 1515 Address: DF:A9:FF:F6:B1:1A (OUI DF-A9-FF)
        Count: 1
< ACL Data TX: Handle 1515 flags 0x00 dlen 11               #57 [hci1] 6.550251
      SMP: Pairing Response (0x02) len 6
        IO capability: DisplayOnly (0x00)
        OOB data: Authentication data not present (0x00)
        Authentication requirement: Bonding, No MITM, SC, No Keypresses (0x09)
        Max encryption key size: 16
        Initiator key distribution: IdKey (0x02)
        Responder key distribution: <none> (0x00)
< HCI Command: Host Number of Compl.. (0x03|0x0035) plen 5  #58 [hci1] 6.550253
        Num handles: 1
        Handle: 1515 Address: DF:A9:FF:F6:B1:1A (OUI DF-A9-FF)
        Count: 1
> HCI Event: Number of Completed Packets (0x13) plen 5      #59 [hci1] 6.714897
        Num handles: 1
        Handle: 1515 Address: DF:A9:FF:F6:B1:1A (OUI DF-A9-FF)
        Count: 1
        #57: len 11 (0 Kb/s)
        Latency: 164 msec (164-172 msec ~168 msec)
> ACL Data RX: Handle 1515 flags 0x02 dlen 27               #60 [hci1] 6.715242
> ACL Data RX: Handle 1515 flags 0x01 dlen 27               #61 [hci1] 6.715790
> ACL Data RX: Handle 1515 flags 0x01 dlen 15               #62 [hci1] 6.716317
      SMP: Pairing Public Key (0x0c) len 64
        X: f8f0959b90dbeb361c18df1ab39bc16db0c7e44bb461f1044b180dfaf8e92c6f
        Y: 22df2e4635d438c591abb5d37e0e261d27e464767a13d3588630dcb3b95b3431
< HCI Command: Host Number of Compl.. (0x03|0x0035) plen 5  #63 [hci1] 6.730301
        Num handles: 1
        Handle: 1515 Address: DF:A9:FF:F6:B1:1A (OUI DF-A9-FF)
        Count: 1
< HCI Command: Host Number of Compl.. (0x03|0x0035) plen 5  #64 [hci1] 6.730308
        Num handles: 1
        Handle: 1515 Address: DF:A9:FF:F6:B1:1A (OUI DF-A9-FF)
        Count: 1
< HCI Command: Host Number of Compl.. (0x03|0x0035) plen 5  #65 [hci1] 6.730438
        Num handles: 1
        Handle: 1515 Address: DF:A9:FF:F6:B1:1A (OUI DF-A9-FF)
        Count: 1
< ACL Data TX: Handle 1515 flags 0x00 dlen 27               #66 [hci1] 6.730501
< ACL Data TX: Handle 1515 flags 0x01 dlen 27               #67 [hci1] 6.730505
< ACL Data TX: Handle 1515 flags 0x01 dlen 15               #68 [hci1] 6.730506
      SMP: Pairing Public Key (0x0c) len 64
        X: 98308440221e2d910f0e54b71e7ec652857aa9b5a0dc65028824cc19db1226e9
        Y: 67a4816bcb62efb21701e31fdb27561a6217575fb007a8bbdabe7e28b6f68482
> HCI Event: Number of Completed Packets (0x13) plen 5      #69 [hci1] 6.802790
        Num handles: 1
        Handle: 1515 Address: DF:A9:FF:F6:B1:1A (OUI DF-A9-FF)
        Count: 1
        #66: len 27 (3 Kb/s)
        Latency: 72 msec (72-172 msec ~120 msec)
> HCI Event: Number of Completed Packets (0x13) plen 5      #70 [hci1] 6.803433
        Num handles: 1
        Handle: 1515 Address: DF:A9:FF:F6:B1:1A (OUI DF-A9-FF)
        Count: 1
        #67: len 27 (3 Kb/s)
        Latency: 72 msec (72-172 msec ~96 msec)
> HCI Event: Number of Completed Packets (0x13) plen 5      #71 [hci1] 6.889742
        Num handles: 1
        Handle: 1515 Address: DF:A9:FF:F6:B1:1A (OUI DF-A9-FF)
        Count: 1
        #68: len 15 (0 Kb/s)
        Latency: 159 msec (72-172 msec ~127 msec)
> ACL Data RX: Handle 1515 flags 0x02 dlen 21               #72 [hci1] 7.852454
      SMP: Pairing Confirm (0x03) len 16
        Confim value: c80af2e8ad4eb04e0ffd4cc642bfd405
< HCI Command: Host Number of Compl.. (0x03|0x0035) plen 5  #73 [hci1] 7.870137
        Num handles: 1
        Handle: 1515 Address: DF:A9:FF:F6:B1:1A (OUI DF-A9-FF)
        Count: 1
< ACL Data TX: Handle 1515 flags 0x00 dlen 21               #74 [hci1] 7.870213
      SMP: Pairing Confirm (0x03) len 16
        Confim value: 701b4a82542a39ae732437d873174fed
> HCI Event: Number of Completed Packets (0x13) plen 5      #75 [hci1] 8.027328
        Num handles: 1
        Handle: 1515 Address: DF:A9:FF:F6:B1:1A (OUI DF-A9-FF)
        Count: 1
        #74: len 21 (1 Kb/s)
        Latency: 157 msec (72-172 msec ~142 msec)
> ACL Data RX: Handle 1515 flags 0x02 dlen 21               #76 [hci1] 8.027682
      SMP: Pairing Random (0x04) len 16
        Random value: be54131b9188c3cd0000000000000000
< HCI Command: Host Number of Compl.. (0x03|0x0035) plen 5  #77 [hci1] 8.030473
        Num handles: 1
        Handle: 1515 Address: DF:A9:FF:F6:B1:1A (OUI DF-A9-FF)
        Count: 1
< ACL Data TX: Handle 1515 flags 0x00 dlen 21               #78 [hci1] 8.030543
      SMP: Pairing Random (0x04) len 16
        Random value: 8e6108f966a694cbe26df70bb96773e6
> HCI Event: Number of Completed Packets (0x13) plen 5      #79 [hci1] 8.202115
        Num handles: 1
        Handle: 1515 Address: DF:A9:FF:F6:B1:1A (OUI DF-A9-FF)
        Count: 1
        #78: len 21 (0 Kb/s)
        Latency: 171 msec (72-172 msec ~157 msec)
> ACL Data RX: Handle 1515 flags 0x02 dlen 21               #80 [hci1] 8.290022
      SMP: Pairing Confirm (0x03) len 16
        Confim value: 9c32ad3739c76e377bb8c5cfdaf47a6c
< HCI Command: Host Number of Compl.. (0x03|0x0035) plen 5  #81 [hci1] 8.310328
        Num handles: 1
        Handle: 1515 Address: DF:A9:FF:F6:B1:1A (OUI DF-A9-FF)
        Count: 1
< ACL Data TX: Handle 1515 flags 0x00 dlen 21               #82 [hci1] 8.310462
      SMP: Pairing Confirm (0x03) len 16
        Confim value: 1c4215d621916ab36fab8458c35382f8
> HCI Event: Number of Completed Packets (0x13) plen 5      #83 [hci1] 8.465010
        Num handles: 1
        Handle: 1515 Address: DF:A9:FF:F6:B1:1A (OUI DF-A9-FF)
        Count: 1
        #82: len 21 (1 Kb/s)
        Latency: 154 msec (72-172 msec ~155 msec)
> ACL Data RX: Handle 1515 flags 0x02 dlen 21               #84 [hci1] 8.465199
      SMP: Pairing Random (0x04) len 16
        Random value: acf8c2794ec50ffa0000000000000000
< HCI Command: Host Number of Compl.. (0x03|0x0035) plen 5  #85 [hci1] 8.470294
        Num handles: 1
        Handle: 1515 Address: DF:A9:FF:F6:B1:1A (OUI DF-A9-FF)
        Count: 1
< ACL Data TX: Handle 1515 flags 0x00 dlen 21               #86 [hci1] 8.470316
      SMP: Pairing Random (0x04) len 16
        Random value: 4d02679f89a05211af56d8b3da64d21e
> HCI Event: Number of Completed Packets (0x13) plen 5      #87 [hci1] 8.639617
        Num handles: 1
        Handle: 1515 Address: DF:A9:FF:F6:B1:1A (OUI DF-A9-FF)
        Count: 1
        #86: len 21 (0 Kb/s)
        Latency: 169 msec (72-172 msec ~162 msec)
> ACL Data RX: Handle 1515 flags 0x02 dlen 21               #88 [hci1] 8.727440
      SMP: Pairing Confirm (0x03) len 16
        Confim value: aff6984681d686efe5de6a5d45264dd8
< HCI Command: Host Number of Compl.. (0x03|0x0035) plen 5  #89 [hci1] 8.730536
        Num handles: 1
        Handle: 1515 Address: DF:A9:FF:F6:B1:1A (OUI DF-A9-FF)
        Count: 1
< ACL Data TX: Handle 1515 flags 0x00 dlen 21               #90 [hci1] 8.730695
      SMP: Pairing Confirm (0x03) len 16
        Confim value: 017e812ac9ebc2b3105d2fea811f9325
> HCI Event: Number of Completed Packets (0x13) plen 5      #91 [hci1] 8.902248
        Num handles: 1
        Handle: 1515 Address: DF:A9:FF:F6:B1:1A (OUI DF-A9-FF)
        Count: 1
        #90: len 21 (0 Kb/s)
        Latency: 171 msec (72-172 msec ~167 msec)
> ACL Data RX: Handle 1515 flags 0x02 dlen 21               #92 [hci1] 8.902623
      SMP: Pairing Random (0x04) len 16
        Random value: 56d885d068b61ddc0000000000000000
< HCI Command: Host Number of Compl.. (0x03|0x0035) plen 5  #93 [hci1] 8.910242
        Num handles: 1
        Handle: 1515 Address: DF:A9:FF:F6:B1:1A (OUI DF-A9-FF)
        Count: 1
< ACL Data TX: Handle 1515 flags 0x00 dlen 21               #94 [hci1] 8.910355
      SMP: Pairing Random (0x04) len 16
        Random value: 5e8286bc235a02440d0c3424a2acf8fd
> HCI Event: Number of Completed Packets (0x13) plen 5      #95 [hci1] 9.077047
        Num handles: 1
        Handle: 1515 Address: DF:A9:FF:F6:B1:1A (OUI DF-A9-FF)
        Count: 1
        #94: len 21 (1 Kb/s)
        Latency: 166 msec (72-172 msec ~166 msec)
> ACL Data RX: Handle 1515 flags 0x02 dlen 21               #96 [hci1] 9.164944
      SMP: Pairing Confirm (0x03) len 16
        Confim value: b89c835efb74b3322175342463d3cb56
< HCI Command: Host Number of Compl.. (0x03|0x0035) plen 5  #97 [hci1] 9.170297
        Num handles: 1
        Handle: 1515 Address: DF:A9:FF:F6:B1:1A (OUI DF-A9-FF)
        Count: 1
< ACL Data TX: Handle 1515 flags 0x00 dlen 21               #98 [hci1] 9.170410
      SMP: Pairing Confirm (0x03) len 16
        Confim value: b0e3a62a47ba1d9456d3ae61aea31722
> HCI Event: Number of Completed Packets (0x13) plen 5      #99 [hci1] 9.339864
        Num handles: 1
        Handle: 1515 Address: DF:A9:FF:F6:B1:1A (OUI DF-A9-FF)
        Count: 1
        #98: len 21 (0 Kb/s)
        Latency: 169 msec (72-172 msec ~168 msec)
> ACL Data RX: Handle 1515 flags 0x02 dlen 21              #100 [hci1] 9.340088
      SMP: Pairing Random (0x04) len 16
        Random value: 2a2a81a8d2270ec50000000000000000
< HCI Command: Host Number of Comp.. (0x03|0x0035) plen 5  #101 [hci1] 9.350467
        Num handles: 1
        Handle: 1515 Address: DF:A9:FF:F6:B1:1A (OUI DF-A9-FF)
        Count: 1
< ACL Data TX: Handle 1515 flags 0x00 dlen 21              #102 [hci1] 9.350533
      SMP: Pairing Random (0x04) len 16
        Random value: 5c4a1bcadd27bd58e945097b00bad7ac
> HCI Event: Number of Completed Packets (0x13) plen 5     #103 [hci1] 9.514602
        Num handles: 1
        Handle: 1515 Address: DF:A9:FF:F6:B1:1A (OUI DF-A9-FF)
        Count: 1
        #102: len 21 (1 Kb/s)
        Latency: 164 msec (72-172 msec ~166 msec)
> ACL Data RX: Handle 1515 flags 0x02 dlen 21              #104 [hci1] 9.602483
      SMP: Pairing Confirm (0x03) len 16
        Confim value: aa0c6763071dfaa62aaefebbf7701d0a
< HCI Command: Host Number of Comp.. (0x03|0x0035) plen 5  #105 [hci1] 9.610526
        Num handles: 1
        Handle: 1515 Address: DF:A9:FF:F6:B1:1A (OUI DF-A9-FF)
        Count: 1
< ACL Data TX: Handle 1515 flags 0x00 dlen 21              #106 [hci1] 9.610709
      SMP: Pairing Confirm (0x03) len 16
        Confim value: 6c90dbefdb544a0a3de065a97284d0b8
> HCI Event: Number of Completed Packets (0x13) plen 5     #107 [hci1] 9.777333
        Num handles: 1
        Handle: 1515 Address: DF:A9:FF:F6:B1:1A (OUI DF-A9-FF)
        Count: 1
        #106: len 21 (1 Kb/s)
        Latency: 166 msec (72-172 msec ~166 msec)
> ACL Data RX: Handle 1515 flags 0x02 dlen 21              #108 [hci1] 9.777613
      SMP: Pairing Random (0x04) len 16
        Random value: eb175799b1a08c850000000000000000
< HCI Command: Host Number of Comp.. (0x03|0x0035) plen 5  #109 [hci1] 9.790705
        Num handles: 1
        Handle: 1515 Address: DF:A9:FF:F6:B1:1A (OUI DF-A9-FF)
        Count: 1
< ACL Data TX: Handle 1515 flags 0x00 dlen 21              #110 [hci1] 9.790818
      SMP: Pairing Random (0x04) len 16
        Random value: 32527e6e64e79f33b2e374394db8ab2d
> HCI Event: Number of Completed Packets (0x13) plen 5     #111 [hci1] 9.952083
        Num handles: 1
        Handle: 1515 Address: DF:A9:FF:F6:B1:1A (OUI DF-A9-FF)
        Count: 1
        #110: len 21 (1 Kb/s)
        Latency: 161 msec (72-172 msec ~163 msec)
> ACL Data RX: Handle 1515 flags 0x02 dlen 21             #112 [hci1] 10.039876
      SMP: Pairing Confirm (0x03) len 16
        Confim value: 4ca367a4766a200abae83f0b58d88107
< HCI Command: Host Number of Com.. (0x03|0x0035) plen 5  #113 [hci1] 10.050311
        Num handles: 1
        Handle: 1515 Address: DF:A9:FF:F6:B1:1A (OUI DF-A9-FF)
        Count: 1
< ACL Data TX: Handle 1515 flags 0x00 dlen 21             #114 [hci1] 10.050433
      SMP: Pairing Confirm (0x03) len 16
        Confim value: 577bcaf5be486b4e1f2ace99974b4d54
> HCI Event: Number of Completed Packets (0x13) plen 5    #115 [hci1] 10.214825
        Num handles: 1
        Handle: 1515 Address: DF:A9:FF:F6:B1:1A (OUI DF-A9-FF)
        Count: 1
        #114: len 21 (1 Kb/s)
        Latency: 164 msec (72-172 msec ~164 msec)
> ACL Data RX: Handle 1515 flags 0x02 dlen 21             #116 [hci1] 10.215133
      SMP: Pairing Random (0x04) len 16
        Random value: 5e2b0132c19b6d2c0000000000000000
< HCI Command: Host Number of Com.. (0x03|0x0035) plen 5  #117 [hci1] 10.230483
        Num handles: 1
        Handle: 1515 Address: DF:A9:FF:F6:B1:1A (OUI DF-A9-FF)
        Count: 1
< ACL Data TX: Handle 1515 flags 0x00 dlen 21             #118 [hci1] 10.230564
      SMP: Pairing Random (0x04) len 16
        Random value: dddbdfe2838e9a8cc6964353c850fef7
> HCI Event: Number of Completed Packets (0x13) plen 5    #119 [hci1] 10.389474
        Num handles: 1
        Handle: 1515 Address: DF:A9:FF:F6:B1:1A (OUI DF-A9-FF)
        Count: 1
        #118: len 21 (1 Kb/s)
        Latency: 158 msec (72-172 msec ~161 msec)
> ACL Data RX: Handle 1515 flags 0x02 dlen 21             #120 [hci1] 10.477441
      SMP: Pairing Confirm (0x03) len 16
        Confim value: 3d414c17596bc3b1161802ff4ec2bb72
< HCI Command: Host Number of Com.. (0x03|0x0035) plen 5  #121 [hci1] 10.490525
        Num handles: 1
        Handle: 1515 Address: DF:A9:FF:F6:B1:1A (OUI DF-A9-FF)
        Count: 1
< ACL Data TX: Handle 1515 flags 0x00 dlen 21             #122 [hci1] 10.490740
      SMP: Pairing Confirm (0x03) len 16
        Confim value: 77206f4399658235e1f136949c1d70a4
> HCI Event: Number of Completed Packets (0x13) plen 5    #123 [hci1] 10.652170
        Num handles: 1
        Handle: 1515 Address: DF:A9:FF:F6:B1:1A (OUI DF-A9-FF)
        Count: 1
        #122: len 21 (1 Kb/s)
        Latency: 161 msec (72-172 msec ~161 msec)
> ACL Data RX: Handle 1515 flags 0x02 dlen 21             #124 [hci1] 10.652560
      SMP: Pairing Random (0x04) len 16
        Random value: 2035c93629541cf90000000000000000
< HCI Command: Host Number of Com.. (0x03|0x0035) plen 5  #125 [hci1] 10.670414
        Num handles: 1
        Handle: 1515 Address: DF:A9:FF:F6:B1:1A (OUI DF-A9-FF)
        Count: 1
< ACL Data TX: Handle 1515 flags 0x00 dlen 21             #126 [hci1] 10.670427
      SMP: Pairing Random (0x04) len 16
        Random value: eb9f1915536596b6fc3db1c86b2b1970
> HCI Event: Number of Completed Packets (0x13) plen 5    #127 [hci1] 10.827029
        Num handles: 1
        Handle: 1515 Address: DF:A9:FF:F6:B1:1A (OUI DF-A9-FF)
        Count: 1
        #126: len 21 (1 Kb/s)
        Latency: 156 msec (72-172 msec ~159 msec)
> ACL Data RX: Handle 1515 flags 0x02 dlen 21             #128 [hci1] 10.914861
      SMP: Pairing Confirm (0x03) len 16
        Confim value: 176ebd89556b330803f1dead66420f59
< HCI Command: Host Number of Com.. (0x03|0x0035) plen 5  #129 [hci1] 10.930172
        Num handles: 1
        Handle: 1515 Address: DF:A9:FF:F6:B1:1A (OUI DF-A9-FF)
        Count: 1
< ACL Data TX: Handle 1515 flags 0x00 dlen 21             #130 [hci1] 10.930239
      SMP: Pairing Confirm (0x03) len 16
        Confim value: 9954b64ee7de66b52f71d9fea65e10d8
> HCI Event: Number of Completed Packets (0x13) plen 5    #131 [hci1] 11.089795
        Num handles: 1
        Handle: 1515 Address: DF:A9:FF:F6:B1:1A (OUI DF-A9-FF)
        Count: 1
        #130: len 21 (1 Kb/s)
        Latency: 159 msec (72-172 msec ~159 msec)
> ACL Data RX: Handle 1515 flags 0x02 dlen 21             #132 [hci1] 11.090038
      SMP: Pairing Random (0x04) len 16
        Random value: f11d82961451ad6c0000000000000000
< HCI Command: Host Number of Com.. (0x03|0x0035) plen 5  #133 [hci1] 11.110253
        Num handles: 1
        Handle: 1515 Address: DF:A9:FF:F6:B1:1A (OUI DF-A9-FF)
        Count: 1
< ACL Data TX: Handle 1515 flags 0x00 dlen 21             #134 [hci1] 11.110297
      SMP: Pairing Random (0x04) len 16
        Random value: 5c794dc9ad9f2c3f295ebd5ad5e1c3cf
> HCI Event: Number of Completed Packets (0x13) plen 5    #135 [hci1] 11.264467
        Num handles: 1
        Handle: 1515 Address: DF:A9:FF:F6:B1:1A (OUI DF-A9-FF)
        Count: 1
        #134: len 21 (1 Kb/s)
        Latency: 154 msec (72-172 msec ~156 msec)
> ACL Data RX: Handle 1515 flags 0x02 dlen 21             #136 [hci1] 11.352316
      SMP: Pairing Confirm (0x03) len 16
        Confim value: b5c31d56702ccb30edc02a9136248027
< HCI Command: Host Number of Com.. (0x03|0x0035) plen 5  #137 [hci1] 11.370384
        Num handles: 1
        Handle: 1515 Address: DF:A9:FF:F6:B1:1A (OUI DF-A9-FF)
        Count: 1
< ACL Data TX: Handle 1515 flags 0x00 dlen 21             #138 [hci1] 11.370439
      SMP: Pairing Confirm (0x03) len 16
        Confim value: 8e020d9b550d93840170e5b9f1a35afb
> HCI Event: Number of Completed Packets (0x13) plen 5    #139 [hci1] 11.527159
        Num handles: 1
        Handle: 1515 Address: DF:A9:FF:F6:B1:1A (OUI DF-A9-FF)
        Count: 1
        #138: len 21 (1 Kb/s)
        Latency: 156 msec (72-172 msec ~156 msec)
> ACL Data RX: Handle 1515 flags 0x02 dlen 21             #140 [hci1] 11.527586
      SMP: Pairing Random (0x04) len 16
        Random value: 8d7597a648c045f60000000000000000
< HCI Command: Host Number of Com.. (0x03|0x0035) plen 5  #141 [hci1] 11.530537
        Num handles: 1
        Handle: 1515 Address: DF:A9:FF:F6:B1:1A (OUI DF-A9-FF)
        Count: 1
< ACL Data TX: Handle 1515 flags 0x00 dlen 21             #142 [hci1] 11.530675
      SMP: Pairing Random (0x04) len 16
        Random value: 5c2fff312cdf99c9491988e877355a9a
> HCI Event: Number of Completed Packets (0x13) plen 5    #143 [hci1] 11.702065
        Num handles: 1
        Handle: 1515 Address: DF:A9:FF:F6:B1:1A (OUI DF-A9-FF)
        Count: 1
        #142: len 21 (0 Kb/s)
        Latency: 171 msec (72-172 msec ~164 msec)
> ACL Data RX: Handle 1515 flags 0x02 dlen 21             #144 [hci1] 11.789905
      SMP: Pairing Confirm (0x03) len 16
        Confim value: e3b11806884373020a73755389629c62
< HCI Command: Host Number of Com.. (0x03|0x0035) plen 5  #145 [hci1] 11.810223
        Num handles: 1
        Handle: 1515 Address: DF:A9:FF:F6:B1:1A (OUI DF-A9-FF)
        Count: 1
< ACL Data TX: Handle 1515 flags 0x00 dlen 21             #146 [hci1] 11.810285
      SMP: Pairing Confirm (0x03) len 16
        Confim value: 2e0f4411d9a468fa5ef303ee00600bc9
> HCI Event: Number of Completed Packets (0x13) plen 5    #147 [hci1] 11.964646
        Num handles: 1
        Handle: 1515 Address: DF:A9:FF:F6:B1:1A (OUI DF-A9-FF)
        Count: 1
        #146: len 21 (1 Kb/s)
        Latency: 154 msec (72-172 msec ~159 msec)
> ACL Data RX: Handle 1515 flags 0x02 dlen 21             #148 [hci1] 11.965060
      SMP: Pairing Random (0x04) len 16
        Random value: 39641a14b372cfe10000000000000000
< HCI Command: Host Number of Com.. (0x03|0x0035) plen 5  #149 [hci1] 11.970482
        Num handles: 1
        Handle: 1515 Address: DF:A9:FF:F6:B1:1A (OUI DF-A9-FF)
        Count: 1
< ACL Data TX: Handle 1515 flags 0x00 dlen 21             #150 [hci1] 11.970545
      SMP: Pairing Random (0x04) len 16
        Random value: c629a3a987d808e808655d558dfc1155
> HCI Event: Number of Completed Packets (0x13) plen 5    #151 [hci1] 12.139529
        Num handles: 1
        Handle: 1515 Address: DF:A9:FF:F6:B1:1A (OUI DF-A9-FF)
        Count: 1
        #150: len 21 (1 Kb/s)
        Latency: 168 msec (72-172 msec ~164 msec)
> ACL Data RX: Handle 1515 flags 0x02 dlen 21             #152 [hci1] 12.227326
      SMP: Pairing Confirm (0x03) len 16
        Confim value: f6dcd2692a86631790d9c5ace168c0a6
< HCI Command: Host Number of Com.. (0x03|0x0035) plen 5  #153 [hci1] 12.230282
        Num handles: 1
        Handle: 1515 Address: DF:A9:FF:F6:B1:1A (OUI DF-A9-FF)
        Count: 1
< ACL Data TX: Handle 1515 flags 0x00 dlen 21             #154 [hci1] 12.230439
      SMP: Pairing Confirm (0x03) len 16
        Confim value: 16807add86efa86a46c69f63a84094b3
> HCI Event: Number of Completed Packets (0x13) plen 5    #155 [hci1] 12.402140
        Num handles: 1
        Handle: 1515 Address: DF:A9:FF:F6:B1:1A (OUI DF-A9-FF)
        Count: 1
        #154: len 21 (0 Kb/s)
        Latency: 171 msec (72-172 msec ~167 msec)
> ACL Data RX: Handle 1515 flags 0x02 dlen 21             #156 [hci1] 12.402449
      SMP: Pairing Random (0x04) len 16
        Random value: d10ef32592c2ed200000000000000000
< HCI Command: Host Number of Com.. (0x03|0x0035) plen 5  #157 [hci1] 12.410244
        Num handles: 1
        Handle: 1515 Address: DF:A9:FF:F6:B1:1A (OUI DF-A9-FF)
        Count: 1
< ACL Data TX: Handle 1515 flags 0x00 dlen 21             #158 [hci1] 12.410280
      SMP: Pairing Random (0x04) len 16
        Random value: 92f20f6ad8f13724432c7fd6001c45ff
> HCI Event: Number of Completed Packets (0x13) plen 5    #159 [hci1] 12.577020
        Num handles: 1
        Handle: 1515 Address: DF:A9:FF:F6:B1:1A (OUI DF-A9-FF)
        Count: 1
        #158: len 21 (1 Kb/s)
        Latency: 166 msec (72-172 msec ~167 msec)
> ACL Data RX: Handle 1515 flags 0x02 dlen 21             #160 [hci1] 12.664886
      SMP: Pairing Confirm (0x03) len 16
        Confim value: 4e692b8f14760ffeb12b72bebc5bf8b8
< HCI Command: Host Number of Com.. (0x03|0x0035) plen 5  #161 [hci1] 12.670221
        Num handles: 1
        Handle: 1515 Address: DF:A9:FF:F6:B1:1A (OUI DF-A9-FF)
        Count: 1
< ACL Data TX: Handle 1515 flags 0x00 dlen 21             #162 [hci1] 12.670290
      SMP: Pairing Confirm (0x03) len 16
        Confim value: ae58eb6351a4b2c09c9f3765d536b882
> HCI Event: Number of Completed Packets (0x13) plen 5    #163 [hci1] 12.839924
        Num handles: 1
        Handle: 1515 Address: DF:A9:FF:F6:B1:1A (OUI DF-A9-FF)
        Count: 1
        #162: len 21 (0 Kb/s)
        Latency: 169 msec (72-172 msec ~168 msec)
> ACL Data RX: Handle 1515 flags 0x02 dlen 21             #164 [hci1] 12.840012
      SMP: Pairing Random (0x04) len 16
        Random value: c0f6b2a5b22288690000000000000000
< HCI Command: Host Number of Com.. (0x03|0x0035) plen 5  #165 [hci1] 12.850375
        Num handles: 1
        Handle: 1515 Address: DF:A9:FF:F6:B1:1A (OUI DF-A9-FF)
        Count: 1
< ACL Data TX: Handle 1515 flags 0x00 dlen 21             #166 [hci1] 12.850385
      SMP: Pairing Random (0x04) len 16
        Random value: 23ac32ebbb5e14c8a6b9622f296d277f
> HCI Event: Number of Completed Packets (0x13) plen 5    #167 [hci1] 13.014436
        Num handles: 1
        Handle: 1515 Address: DF:A9:FF:F6:B1:1A (OUI DF-A9-FF)
        Count: 1
        #166: len 21 (1 Kb/s)
        Latency: 164 msec (72-172 msec ~166 msec)
> ACL Data RX: Handle 1515 flags 0x02 dlen 21             #168 [hci1] 13.102281
      SMP: Pairing Confirm (0x03) len 16
        Confim value: dc943ef4fccca62f3db5e8aed6a1cd46
< HCI Command: Host Number of Com.. (0x03|0x0035) plen 5  #169 [hci1] 13.110497
        Num handles: 1
        Handle: 1515 Address: DF:A9:FF:F6:B1:1A (OUI DF-A9-FF)
        Count: 1
< ACL Data TX: Handle 1515 flags 0x00 dlen 21             #170 [hci1] 13.110694
      SMP: Pairing Confirm (0x03) len 16
        Confim value: 1b31a51bef4544c210f4e0a4ec1365cd
> HCI Event: Number of Completed Packets (0x13) plen 5    #171 [hci1] 13.277250
        Num handles: 1
        Handle: 1515 Address: DF:A9:FF:F6:B1:1A (OUI DF-A9-FF)
        Count: 1
        #170: len 21 (1 Kb/s)
        Latency: 166 msec (72-172 msec ~166 msec)
> ACL Data RX: Handle 1515 flags 0x02 dlen 21             #172 [hci1] 13.277514
      SMP: Pairing Random (0x04) len 16
        Random value: e223a58ef32d7a980000000000000000
< HCI Command: Host Number of Com.. (0x03|0x0035) plen 5  #173 [hci1] 13.290810
        Num handles: 1
        Handle: 1515 Address: DF:A9:FF:F6:B1:1A (OUI DF-A9-FF)
        Count: 1
< ACL Data TX: Handle 1515 flags 0x00 dlen 21             #174 [hci1] 13.290913
      SMP: Pairing Random (0x04) len 16
        Random value: 297efe85e67448a15f56bd27e3a3cf1d
> HCI Event: Number of Completed Packets (0x13) plen 5    #175 [hci1] 13.451974
        Num handles: 1
        Handle: 1515 Address: DF:A9:FF:F6:B1:1A (OUI DF-A9-FF)
        Count: 1
        #174: len 21 (1 Kb/s)
        Latency: 161 msec (72-172 msec ~163 msec)
> ACL Data RX: Handle 1515 flags 0x02 dlen 21             #176 [hci1] 13.539845
      SMP: Pairing Confirm (0x03) len 16
        Confim value: 4bad1597ca062ff357b4f7721048df18
< HCI Command: Host Number of Com.. (0x03|0x0035) plen 5  #177 [hci1] 13.550528
        Num handles: 1
        Handle: 1515 Address: DF:A9:FF:F6:B1:1A (OUI DF-A9-FF)
        Count: 1
< ACL Data TX: Handle 1515 flags 0x00 dlen 21             #178 [hci1] 13.550725
      SMP: Pairing Confirm (0x03) len 16
        Confim value: 4a6bfb5915db748cd147b8b6f7d6d082
> HCI Event: Number of Completed Packets (0x13) plen 5    #179 [hci1] 13.714704
        Num handles: 1
        Handle: 1515 Address: DF:A9:FF:F6:B1:1A (OUI DF-A9-FF)
        Count: 1
        #178: len 21 (1 Kb/s)
        Latency: 163 msec (72-172 msec ~163 msec)
> ACL Data RX: Handle 1515 flags 0x02 dlen 21             #180 [hci1] 13.715018
      SMP: Pairing Random (0x04) len 16
        Random value: d172bc23849970460000000000000000
< HCI Command: Host Number of Com.. (0x03|0x0035) plen 5  #181 [hci1] 13.730767
        Num handles: 1
        Handle: 1515 Address: DF:A9:FF:F6:B1:1A (OUI DF-A9-FF)
        Count: 1
< ACL Data TX: Handle 1515 flags 0x00 dlen 21             #182 [hci1] 13.730877
      SMP: Pairing Random (0x04) len 16
        Random value: 25a9493fd3ce4faf02be7293595bb7c6
> HCI Event: Number of Completed Packets (0x13) plen 5    #183 [hci1] 13.889456
        Num handles: 1
        Handle: 1515 Address: DF:A9:FF:F6:B1:1A (OUI DF-A9-FF)
        Count: 1
        #182: len 21 (1 Kb/s)
        Latency: 158 msec (72-172 msec ~161 msec)
> ACL Data RX: Handle 1515 flags 0x02 dlen 21             #184 [hci1] 13.977206
      SMP: Pairing Confirm (0x03) len 16
        Confim value: 2c5ac8cfee7fc83beaa143f9c7f49052
< HCI Command: Host Number of Com.. (0x03|0x0035) plen 5  #185 [hci1] 13.990495
        Num handles: 1
        Handle: 1515 Address: DF:A9:FF:F6:B1:1A (OUI DF-A9-FF)
        Count: 1
< ACL Data TX: Handle 1515 flags 0x00 dlen 21             #186 [hci1] 13.990737
      SMP: Pairing Confirm (0x03) len 16
        Confim value: f97b8556ed2664ca70cbcfee4b3ad319
> HCI Event: Number of Completed Packets (0x13) plen 5    #187 [hci1] 14.152109
        Num handles: 1
        Handle: 1515 Address: DF:A9:FF:F6:B1:1A (OUI DF-A9-FF)
        Count: 1
        #186: len 21 (1 Kb/s)
        Latency: 161 msec (72-172 msec ~161 msec)
> ACL Data RX: Handle 1515 flags 0x02 dlen 21             #188 [hci1] 14.152465
      SMP: Pairing Random (0x04) len 16
        Random value: 95abde27710d20f30000000000000000
< HCI Command: Host Number of Com.. (0x03|0x0035) plen 5  #189 [hci1] 14.170420
        Num handles: 1
        Handle: 1515 Address: DF:A9:FF:F6:B1:1A (OUI DF-A9-FF)
        Count: 1
< ACL Data TX: Handle 1515 flags 0x00 dlen 21             #190 [hci1] 14.170471
      SMP: Pairing Random (0x04) len 16
        Random value: 58f6b41f855a6f6c3560debd84e2affc
> HCI Event: Number of Completed Packets (0x13) plen 5    #191 [hci1] 14.326890
        Num handles: 1
        Handle: 1515 Address: DF:A9:FF:F6:B1:1A (OUI DF-A9-FF)
        Count: 1
        #190: len 21 (1 Kb/s)
        Latency: 156 msec (72-172 msec ~158 msec)
> ACL Data RX: Handle 1515 flags 0x02 dlen 21             #192 [hci1] 14.414848
      SMP: Pairing Confirm (0x03) len 16
        Confim value: 68a72ea92a43238c7787c6dc9aa5ff99
< HCI Command: Host Number of Com.. (0x03|0x0035) plen 5  #193 [hci1] 14.430598
        Num handles: 1
        Handle: 1515 Address: DF:A9:FF:F6:B1:1A (OUI DF-A9-FF)
        Count: 1
< ACL Data TX: Handle 1515 flags 0x00 dlen 21             #194 [hci1] 14.430814
      SMP: Pairing Confirm (0x03) len 16
        Confim value: e153c79da280fe749707eff584cb8f24
> HCI Event: Number of Completed Packets (0x13) plen 5    #195 [hci1] 14.589685
        Num handles: 1
        Handle: 1515 Address: DF:A9:FF:F6:B1:1A (OUI DF-A9-FF)
        Count: 1
        #194: len 21 (1 Kb/s)
        Latency: 158 msec (72-172 msec ~158 msec)
> ACL Data RX: Handle 1515 flags 0x02 dlen 21             #196 [hci1] 14.590024
      SMP: Pairing Random (0x04) len 16
        Random value: ad977b4900cefc100000000000000000
< HCI Command: Host Number of Com.. (0x03|0x0035) plen 5  #197 [hci1] 14.590542
        Num handles: 1
        Handle: 1515 Address: DF:A9:FF:F6:B1:1A (OUI DF-A9-FF)
        Count: 1
< ACL Data TX: Handle 1515 flags 0x00 dlen 21             #198 [hci1] 14.590662
      SMP: Pairing Random (0x04) len 16
        Random value: b67e7216d5bf664139eda2b542549666
> HCI Event: Number of Completed Packets (0x13) plen 5    #199 [hci1] 14.764423
        Num handles: 1
        Handle: 1515 Address: DF:A9:FF:F6:B1:1A (OUI DF-A9-FF)
        Count: 1
        #198: len 21 (0 Kb/s)
        Latency: 173 msec (72-173 msec ~166 msec)
> ACL Data RX: Handle 1515 flags 0x02 dlen 21             #200 [hci1] 14.852286
      SMP: Pairing Confirm (0x03) len 16
        Confim value: 01a535a8be0de249b039b077f9bb0686
< HCI Command: Host Number of Com.. (0x03|0x0035) plen 5  #201 [hci1] 14.870276
        Num handles: 1
        Handle: 1515 Address: DF:A9:FF:F6:B1:1A (OUI DF-A9-FF)
        Count: 1
< ACL Data TX: Handle 1515 flags 0x00 dlen 21             #202 [hci1] 14.870367
      SMP: Pairing Confirm (0x03) len 16
        Confim value: dea11151a5e25bf076f54b647dbda803
> HCI Event: Number of Completed Packets (0x13) plen 5    #203 [hci1] 15.027208
        Num handles: 1
        Handle: 1515 Address: DF:A9:FF:F6:B1:1A (OUI DF-A9-FF)
        Count: 1
        #202: len 21 (1 Kb/s)
        Latency: 156 msec (72-173 msec ~161 msec)
> ACL Data RX: Handle 1515 flags 0x02 dlen 21             #204 [hci1] 15.027414
      SMP: Pairing Random (0x04) len 16
        Random value: 06e8cb1588ce268a0000000000000000
< HCI Command: Host Number of Com.. (0x03|0x0035) plen 5  #205 [hci1] 15.030355
        Num handles: 1
        Handle: 1515 Address: DF:A9:FF:F6:B1:1A (OUI DF-A9-FF)
        Count: 1
< ACL Data TX: Handle 1515 flags 0x00 dlen 21             #206 [hci1] 15.030402
      SMP: Pairing Random (0x04) len 16
        Random value: ed17f76500c95219dd01e09d1e63f87b
> HCI Event: Number of Completed Packets (0x13) plen 5    #207 [hci1] 15.201911
        Num handles: 1
        Handle: 1515 Address: DF:A9:FF:F6:B1:1A (OUI DF-A9-FF)
        Count: 1
        #206: len 21 (0 Kb/s)
        Latency: 171 msec (72-173 msec ~166 msec)
> ACL Data RX: Handle 1515 flags 0x02 dlen 21             #208 [hci1] 15.289772
      SMP: Pairing Confirm (0x03) len 16
        Confim value: 02f42b146d30f30d0afbe402a0b78b3b
< HCI Command: Host Number of Com.. (0x03|0x0035) plen 5  #209 [hci1] 15.290204
        Num handles: 1
        Handle: 1515 Address: DF:A9:FF:F6:B1:1A (OUI DF-A9-FF)
        Count: 1
< ACL Data TX: Handle 1515 flags 0x00 dlen 21             #210 [hci1] 15.290240
      SMP: Pairing Confirm (0x03) len 16
        Confim value: caff5946a999d331475dead5058d4543
> HCI Event: Number of Completed Packets (0x13) plen 5    #211 [hci1] 15.464545
        Num handles: 1
        Handle: 1515 Address: DF:A9:FF:F6:B1:1A (OUI DF-A9-FF)
        Count: 1
        #210: len 21 (0 Kb/s)
        Latency: 174 msec (72-174 msec ~170 msec)
> ACL Data RX: Handle 1515 flags 0x02 dlen 21             #212 [hci1] 15.465014
      SMP: Pairing Random (0x04) len 16
        Random value: aeda6f5ae76b172f0000000000000000
< HCI Command: Host Number of Com.. (0x03|0x0035) plen 5  #213 [hci1] 15.470382
        Num handles: 1
        Handle: 1515 Address: DF:A9:FF:F6:B1:1A (OUI DF-A9-FF)
        Count: 1
< ACL Data TX: Handle 1515 flags 0x00 dlen 21             #214 [hci1] 15.470392
      SMP: Pairing Random (0x04) len 16
        Random value: 81d35d47e1f6006d79c974bd9d9e1ee3
> HCI Event: Number of Completed Packets (0x13) plen 5    #215 [hci1] 15.639394
        Num handles: 1
        Handle: 1515 Address: DF:A9:FF:F6:B1:1A (OUI DF-A9-FF)
        Count: 1
        #214: len 21 (0 Kb/s)
        Latency: 169 msec (72-174 msec ~169 msec)
> ACL Data RX: Handle 1515 flags 0x02 dlen 21             #216 [hci1] 15.727197
      SMP: Pairing Confirm (0x03) len 16
        Confim value: 8056374884febfd3c798a475b8c48e0a
< HCI Command: Host Number of Com.. (0x03|0x0035) plen 5  #217 [hci1] 15.730195
        Num handles: 1
        Handle: 1515 Address: DF:A9:FF:F6:B1:1A (OUI DF-A9-FF)
        Count: 1
< ACL Data TX: Handle 1515 flags 0x00 dlen 21             #218 [hci1] 15.730264
      SMP: Pairing Confirm (0x03) len 16
        Confim value: 893e888438fc02439a4d3c6947ce5a09
> HCI Event: Number of Completed Packets (0x13) plen 5    #219 [hci1] 15.902088
        Num handles: 1
        Handle: 1515 Address: DF:A9:FF:F6:B1:1A (OUI DF-A9-FF)
        Count: 1
        #218: len 21 (0 Kb/s)
        Latency: 171 msec (72-174 msec ~170 msec)
> ACL Data RX: Handle 1515 flags 0x02 dlen 21             #220 [hci1] 15.902356
      SMP: Pairing Random (0x04) len 16
        Random value: 84290690c870959e0000000000000000
< HCI Command: Host Number of Com.. (0x03|0x0035) plen 5  #221 [hci1] 15.910327
        Num handles: 1
        Handle: 1515 Address: DF:A9:FF:F6:B1:1A (OUI DF-A9-FF)
        Count: 1
< ACL Data TX: Handle 1515 flags 0x00 dlen 21             #222 [hci1] 15.910404
      SMP: Pairing Random (0x04) len 16
        Random value: e7f7e0c2476823e41736a7e381bafb7c
> HCI Event: Number of Completed Packets (0x13) plen 5    #223 [hci1] 16.076814
        Num handles: 1
        Handle: 1515 Address: DF:A9:FF:F6:B1:1A (OUI DF-A9-FF)
        Count: 1
        #222: len 21 (1 Kb/s)
        Latency: 166 msec (72-174 msec ~168 msec)
> ACL Data RX: Handle 1515 flags 0x02 dlen 21             #224 [hci1] 16.164658
      SMP: Pairing Confirm (0x03) len 16
        Confim value: a94d9225a4cad356fe0c2901121eb0d0
< HCI Command: Host Number of Com.. (0x03|0x0035) plen 5  #225 [hci1] 16.170665
        Num handles: 1
        Handle: 1515 Address: DF:A9:FF:F6:B1:1A (OUI DF-A9-FF)
        Count: 1
< ACL Data TX: Handle 1515 flags 0x00 dlen 21             #226 [hci1] 16.170893
      SMP: Pairing Confirm (0x03) len 16
        Confim value: 6bffbe66a74a7dc63800347901ebdee5
> HCI Event: Number of Completed Packets (0x13) plen 5    #227 [hci1] 16.339581
        Num handles: 1
        Handle: 1515 Address: DF:A9:FF:F6:B1:1A (OUI DF-A9-FF)
        Count: 1
        #226: len 21 (1 Kb/s)
        Latency: 168 msec (72-174 msec ~168 msec)
> ACL Data RX: Handle 1515 flags 0x02 dlen 21             #228 [hci1] 16.339926
      SMP: Pairing Random (0x04) len 16
        Random value: 72ec03ad7c40fcd40000000000000000
