Bluetooth monitor ver 5.72
= Note: Linux version 6.14.0-36-generic (x86_64)                       0.429779
= Note: Bluetooth subsystem version 2.22                               0.429782
= New Index: 00:00:00:00:00:00 (Primary,UART,hci1)              [hci1] 0.429783
= New Index: 48:5F:99:8E:E0:64 (Primary,USB,hci0)               [hci0] 0.429783
= Open Index: 00:00:00:00:00:00                                 [hci1] 0.553009
= Index Info: 00:00:00:00:00:00 (Nordic Semiconductor ASA)      [hci1] 0.553014
@ USER Open: main (privileged) version 2.22            {0x0001} [hci1] 0.553017
< HCI Command: Reset (0x03|0x0003) plen 0                    #1 [hci1] 0.553365
> HCI Event: Command Complete (0x0e) plen 4                  #2 [hci1] 0.553873
      Reset (0x03|0x0003) ncmd 1
        Status: Success (0x00)
< HCI Command: Read Local Supported... (0x04|0x0003) plen 0  #3 [hci1] 0.573028
> HCI Event: Command Complete (0x0e) plen 12                 #4 [hci1] 0.573517
      Read Local Supported Features (0x04|0x0003) ncmd 1
        Status: Success (0x00)
        Features: 0x00 0x00 0x00 0x00 0x60 0x00 0x00 0x00
          BR/EDR Not Supported
          LE Supported (Controller)
< HCI Command: Read Local Version In.. (0x04|0x0001) plen 0  #5 [hci1] 0.593018
> HCI Event: Command Complete (0x0e) plen 12                 #6 [hci1] 0.593518
      Read Local Version Information (0x04|0x0001) ncmd 1
        Status: Success (0x00)
        HCI version: Reserved (0x0f) - Revision 12393 (0x3069)
        LMP version: Reserved (0x0f) - Subversion 12393 (0x3069)
        Manufacturer: Nordic Semiconductor ASA (89)
< HCI Command: Read Local Supported... (0x04|0x0002) plen 0  #7 [hci1] 0.613003
> HCI Event: Command Complete (0x0e) plen 68                 #8 [hci1] 0.614119
      Read Local Supported Commands (0x04|0x0002) ncmd 1
        Status: Success (0x00)
        Commands: 119 entries
          Disconnect (Octet 0 - Bit 5)
          Read Remote Version Information (Octet 2 - Bit 7)
          Set Event Mask (Octet 5 - Bit 6)
          Reset (Octet 5 - Bit 7)
          Read Connection Accept Timeout (Octet 7 - Bit 2)
          Write Connection Accept Timeout (Octet 7 - Bit 3)
          Read Transmit Power Level (Octet 10 - Bit 2)
          Set Controller To Host Flow Control (Octet 10 - Bit 5)
          Host Buffer Size (Octet 10 - Bit 6)
          Host Number of Completed Packets (Octet 10 - Bit 7)
          Read Local Version Information (Octet 14 - Bit 3)
          Read Local Supported Features (Octet 14 - Bit 5)
          Read BD ADDR (Octet 15 - Bit 1)
          Read RSSI (Octet 15 - Bit 5)
          Set Event Mask Page 2 (Octet 22 - Bit 2)
          LE Set Event Mask (Octet 25 - Bit 0)
          LE Read Buffer Size (Octet 25 - Bit 1)
          LE Read Local Supported Features (Octet 25 - Bit 2)
          LE Set Random Address (Octet 25 - Bit 4)
          LE Set Advertising Parameters (Octet 25 - Bit 5)
          LE Read Advertising Channel TX Power (Octet 25 - Bit 6)
          LE Set Advertising Data (Octet 25 - Bit 7)
          LE Set Scan Response Data (Octet 26 - Bit 0)
          LE Set Advertise Enable (Octet 26 - Bit 1)
          LE Set Scan Parameters (Octet 26 - Bit 2)
          LE Set Scan Enable (Octet 26 - Bit 3)
          LE Create Connection (Octet 26 - Bit 4)
          LE Create Connection Cancel (Octet 26 - Bit 5)
          LE Read Accept List Size (Octet 26 - Bit 6)
          LE Clear Accept List (Octet 26 - Bit 7)
          LE Add Device To Accept List (Octet 27 - Bit 0)
          LE Remove Device From Accept List (Octet 27 - Bit 1)
          LE Connection Update (Octet 27 - Bit 2)
          LE Set Host Channel Classification (Octet 27 - Bit 3)
          LE Read Channel Map (Octet 27 - Bit 4)
          LE Read Remote Used Features (Octet 27 - Bit 5)
          LE Encrypt (Octet 27 - Bit 6)
          LE Rand (Octet 27 - Bit 7)
          LE Start Encryption (Octet 28 - Bit 0)
          LE Long Term Key Request Reply (Octet 28 - Bit 1)
          LE Long Term Key Request Neg Reply (Octet 28 - Bit 2)
          LE Read Supported States (Octet 28 - Bit 3)
          LE Receiver Test (Octet 28 - Bit 4)
          LE Transmitter Test (Octet 28 - Bit 5)
          LE Test End (Octet 28 - Bit 6)
          Read Authenticated Payload Timeout (Octet 32 - Bit 4)
          Write Authenticated Payload Timeout (Octet 32 - Bit 5)
          LE Set Data Length (Octet 33 - Bit 6)
          LE Read Suggested Default Data Length (Octet 33 - Bit 7)
          LE Write Suggested Default Data Length (Octet 34 - Bit 0)
          LE Add Device To Resolving List (Octet 34 - Bit 3)
          LE Remove Device From Resolving List (Octet 34 - Bit 4)
          LE Clear Resolving List (Octet 34 - Bit 5)
          LE Read Resolving List Size (Octet 34 - Bit 6)
          LE Set Address Resolution Enable (Octet 35 - Bit 1)
          LE Set Resolvable Private Address Timeout (Octet 35 - Bit 2)
          LE Read Maximum Data Length (Octet 35 - Bit 3)
          LE Read PHY (Octet 35 - Bit 4)
          LE Set Default PHY (Octet 35 - Bit 5)
          LE Set PHY (Octet 35 - Bit 6)
          LE Enhanced Receiver Test (Octet 35 - Bit 7)
          LE Enhanced Transmitter Test (Octet 36 - Bit 0)
          LE Set Advertising Set Random Address (Octet 36 - Bit 1)
          LE Set Extended Advertising Parameters (Octet 36 - Bit 2)
          LE Set Extended Advertising Data (Octet 36 - Bit 3)
          LE Set Extended Scan Response Data (Octet 36 - Bit 4)
          LE Set Extended Advertising Enable (Octet 36 - Bit 5)
          LE Read Maximum Advertising Data Length (Octet 36 - Bit 6)
          LE Read Number of Supported Advertising Sets (Octet 36 - Bit 7)
          LE Remove Advertising Set (Octet 37 - Bit 0)
          LE Clear Advertising Sets (Octet 37 - Bit 1)
          LE Set Periodic Advertising Parameters (Octet 37 - Bit 2)
          LE Set Periodic Advertising Data (Octet 37 - Bit 3)
          LE Set Periodic Advertising Enable (Octet 37 - Bit 4)
          LE Set Extended Scan Parameters (Octet 37 - Bit 5)
          LE Set Extended Scan Enable (Octet 37 - Bit 6)
          LE Extended Create Connection (Octet 37 - Bit 7)
          LE Periodic Advertising Create Sync (Octet 38 - Bit 0)
          LE Periodic Advertising Create Sync Cancel (Octet 38 - Bit 1)
          LE Periodic Advertising Terminate Sync (Octet 38 - Bit 2)
          LE Add Device To Periodic Advertiser List (Octet 38 - Bit 3)
          LE Remove Device From Periodic Advertiser List (Octet 38 - Bit 4)
          LE Clear Periodic Advertiser List (Octet 38 - Bit 5)
          LE Read Periodic Advertiser List Size (Octet 38 - Bit 6)
          LE Read Transmit Power (Octet 38 - Bit 7)
          LE Read RF Path Compensation (Octet 39 - Bit 0)
          LE Write RF Path Compensation (Octet 39 - Bit 1)
          LE Set Privacy Mode (Octet 39 - Bit 2)
          LE Periodic Advertising Receive Enable (Octet 40 - Bit 5)
          LE Periodic Advertising Sync Transfer (Octet 40 - Bit 6)
          LE Periodic Advertising Set Info Transfer (Octet 40 - Bit 7)
          LE Periodic Advertising Sync Transfer Parameters (Octet 41 - Bit 0)
          LE Set Default Periodic Advertisng Sync Transfer Parameters (Octet 41 - Bit 1)
          LE Read Buffer v2 (Octet 41 - Bit 5)
          LE Read ISO TX Sync (Octet 41 - Bit 6)
          LE Set Connected Isochronous Group Parameters (Octet 41 - Bit 7)
          LE Set Connected Isochronous Group Parameters Test (Octet 42 - Bit 0)
          LE Create Connected Isochronous Stream (Octet 42 - Bit 1)
          LE Remove Connected Isochronous Group (Octet 42 - Bit 2)
          LE Accept Connected Isochronous Stream Request (Octet 42 - Bit 3)
          LE Reject Connected Isochronous Stream Request (Octet 42 - Bit 4)
          LE Create Broadcast Isochronous Group (Octet 42 - Bit 5)
          LE Create Broadcast Isochronous Group Test (Octet 42 - Bit 6)
          LE Terminate Broadcast Isochronous Group (Octet 42 - Bit 7)
          LE Broadcast Isochronous Group Create Sync (Octet 43 - Bit 0)
          LE Broadcast Isochronous Group Terminate Sync (Octet 43 - Bit 1)
          LE Request Peer SCA (Octet 43 - Bit 2)
          LE Setup Isochronous Data Path (Octet 43 - Bit 3)
          LE Remove Isochronous Data Path (Octet 43 - Bit 4)
          LE Isochronous Transmit Test (Octet 43 - Bit 5)
          LE Isochronous Receive Test (Octet 43 - Bit 6)
          LE Isochronous Read Test Counters (Octet 43 - Bit 7)
          LE Isochronous Read Test Counters (Octet 44 - Bit 0)
          LE Set Host Feature (Octet 44 - Bit 1)
          Octet 44 - Bit 2 
          Octet 45 - Bit 6 
          Octet 46 - Bit 0 
          Octet 46 - Bit 1 
          Octet 46 - Bit 2 
< HCI Command: Host Buffer Size (0x03|0x0033) plen 7         #9 [hci1] 0.633031
        ACL MTU: 255  ACL max packet: 16
        SCO MTU: 0    SCO max packet: 0
> HCI Event: Command Complete (0x0e) plen 4                 #10 [hci1] 0.633541
      Host Buffer Size (0x03|0x0033) ncmd 1
        Status: Success (0x00)
< HCI Command: Set Controller To Ho.. (0x03|0x0031) plen 1  #11 [hci1] 0.653024
        Flow control: ACL Data Packets (0x01)
> HCI Event: Command Complete (0x0e) plen 4                 #12 [hci1] 0.653511
      Set Controller To Host Flow Control (0x03|0x0031) ncmd 1
        Status: Success (0x00)
< HCI Command: LE Read Local Suppor.. (0x08|0x0003) plen 0  #13 [hci1] 0.673020
> HCI Event: Command Complete (0x0e) plen 12                #14 [hci1] 0.673510
      LE Read Local Supported Features (0x08|0x0003) ncmd 1
        Status: Success (0x00)
        Features: 0xfd 0x79 0x00 0xf7 0x30 0x01 0x00 0x00
          LE Encryption
          Extended Reject Indication
          Peripheral-initiated Features Exchange
          LE Ping
          LE Data Packet Length Extension
          LL Privacy
          Extended Scanner Filter Policies
          LE 2M PHY
          LE Coded PHY
          LE Extended Advertising
          LE Periodic Advertising
          Channel Selection Algorithm #2
          Periodic Advertising Sync Transfer - Sender
          Periodic Advertising Sync Transfer - Recipient
          Sleep Clock Accuracy Updates
          Connected Isochronous Stream - Central
          Connected Isochronous Stream - Peripheral
          Isochronous Broadcaster
          Synchronized Receiver
          Periodic Advertising ADI support
          Connection Subrating
          Unknown features (0x0000010000000000)
< HCI Command: LE Set Host Feature (0x08|0x0074) plen 2     #15 [hci1] 0.692995
        Bit Number: 32
          Connected Isochronous Stream (Host Support)
        Bit Value: 1
> HCI Event: Command Complete (0x0e) plen 4                 #16 [hci1] 0.693440
      LE Set Host Feature (0x08|0x0074) ncmd 1
        Status: Success (0x00)
< HCI Command: LE Read Buffer v2 (0x08|0x0060) plen 0       #17 [hci1] 0.713032
> HCI Event: Command Complete (0x0e) plen 10                #18 [hci1] 0.713468
      LE Read Buffer v2 (0x08|0x0060) ncmd 1
        Status: Success (0x00)
        ACL MTU: 27
        ACL max packet: 3
        ISO MTU: 318
        ISO max packet: 3
< HCI Command: LE Read Maximum Adve.. (0x08|0x003a) plen 0  #19 [hci1] 0.733050
> HCI Event: Command Complete (0x0e) plen 6                 #20 [hci1] 0.733527
      LE Read Maximum Advertising Data Length (0x08|0x003a) ncmd 1
        Status: Success (0x00)
        Max length: 1650
< HCI Command: LE Read Supported St.. (0x08|0x001c) plen 0  #21 [hci1] 0.753025
> HCI Event: Command Complete (0x0e) plen 12                #22 [hci1] 0.753547
      LE Read Supported States (0x08|0x001c) ncmd 1
        Status: Success (0x00)
        States: 0x000003ff3e0306ff
          Non-connectable Advertising State
          Scannable Advertising State
          Connectable Advertising State
          High Duty Cycle Directed Advertising State
          Passive Scanning State
          Active Scanning State
          Initiating State
            and Connection State (Central Role)
          Connection State (Peripheral Role)
          Scannable Advertising State
            and Passive Scanning State
          Connectable Advertising State
            and Passive Scanning State
          Non-connectable Advertising State
            and Initiating State
          Scannable Advertising State
            and Initiating State
          Active Scanning State
            and Connection State (Central Role)
          Passive Scanning State
            and Connection State (Peripheral Role)
          Active Scanning State
            and Connection State (Peripheral Role)
          Initiating State
            and Connection State (Central Role)
            and Central Role & Central Role
          Low Duty Cycle Directed Advertising State
          Connectable Advertising State
            and Initiating State
            and Central Role & Peripheral Role
          High Duty Cycle Directed Advertising State
            and Initiating State
            and Central Role & Peripheral Role
          Low Duty Cycle Directed Advertising State
            and Initiating State
            and Central Role & Peripheral Role
          Connectable Advertising State
            and Connection State (Central Role)
            and Central Role & Peripheral Role
          High Duty Cycle Directed Advertising State
            and Connection State (Central Role)
            and Central Role & Peripheral Role
          Low Duty Cycle Directed Advertising State
            and Connection State (Central Role)
            and Central Role & Peripheral Role
          Connectable Advertising State
            and Connection State (Peripheral Role)
            and Central Role & Peripheral Role
          High Duty Cycle Directed Advertising State
            and Connection State (Peripheral Role)
            and Peripheral Role & Peripheral Role
          Low Duty Cycle Directed Advertising State
            and Connection State (Peripheral Role)
            and Peripheral Role & Peripheral Role
          Initiating State
            and Connection State (Peripheral Role)
            and Central Role & Peripheral Role
< HCI Command: LE Read Maximum Data.. (0x08|0x002f) plen 0  #23 [hci1] 0.773005
> HCI Event: Command Complete (0x0e) plen 12                #24 [hci1] 0.773493
      LE Read Maximum Data Length (0x08|0x002f) ncmd 1
        Status: Success (0x00)
        Max TX octets: 251
        Max TX time: 2704
        Max RX octets: 251
        Max RX time: 2704
< HCI Command: LE Write Suggested D.. (0x08|0x0024) plen 4  #25 [hci1] 0.793017
        TX octets: 251
        TX time: 2704
> HCI Event: Command Complete (0x0e) plen 4                 #26 [hci1] 0.793498
      LE Write Suggested Default Data Length (0x08|0x0024) ncmd 1
        Status: Success (0x00)
< HCI Command: LE Read Resolving Li.. (0x08|0x002a) plen 0  #27 [hci1] 0.813028
> HCI Event: Command Complete (0x0e) plen 5                 #28 [hci1] 0.813516
      LE Read Resolving List Size (0x08|0x002a) ncmd 1
        Status: Success (0x00)
        Size: 8
< HCI Command: LE Set Host Feature (0x08|0x0074) plen 2     #29 [hci1] 0.833026
        Bit Number: 38
          Connection Subrating (Host Support)
        Bit Value: 1
> HCI Event: Command Complete (0x0e) plen 4                 #30 [hci1] 0.833529
      LE Set Host Feature (0x08|0x0074) ncmd 1
        Status: Success (0x00)
< HCI Command: LE Set Event Mask (0x08|0x0001) plen 8       #31 [hci1] 0.852997
        Mask: 0x000002063f87fa5e
          LE Advertising Report
          LE Connection Update Complete
          LE Read Remote Used Features Complete
          LE Long Term Key Request
          LE Data Length Change
          LE Enhanced Connection Complete
          LE PHY Update Complete
          LE Extended Advertising Report
          LE Periodic Advertising Sync Established
          LE Periodic Advertising Report
          LE Periodic Advertising Sync Lost
          LE Extended Scan Timeout
          LE Extended Advertising Set Terminated
          LE Scan Request Received
          LE Periodic Advertising Sync Transfer Rvc
          LE CIS Established
          LE CIS Request
          LE Create BIG Complete
          LE Terminate BIG Complete
          LE BIG Sync Estabilished Complete
          LE BIG Sync Lost
          LE BIG Info Advertising Report
          LE Subrate Change
          Unknown mask (0x0000020000000000)
> HCI Event: Command Complete (0x0e) plen 4                 #32 [hci1] 0.853549
      LE Set Event Mask (0x08|0x0001) ncmd 1
        Status: Success (0x00)
< HCI Command: Set Event Mask (0x03|0x0001) plen 8          #33 [hci1] 0.873032
        Mask: 0x2000800002008890
          Disconnection Complete
          Encryption Change
          Read Remote Version Information Complete
          Hardware Error
          Data Buffer Overflow
          Encryption Key Refresh Complete
          LE Meta
> HCI Event: Command Complete (0x0e) plen 4                 #34 [hci1] 0.873531
      Set Event Mask (0x03|0x0001) ncmd 1
        Status: Success (0x00)
< HCI Command: Read BD ADDR (0x04|0x0009) plen 0            #35 [hci1] 0.893019
> HCI Event: Command Complete (0x0e) plen 10                #36 [hci1] 0.893485
      Read BD ADDR (0x04|0x0009) ncmd 1
        Status: Success (0x00)
        Address: 00:00:00:00:00:00 (OUI 00-00-00)
< HCI Command: LE Set Random Address (0x08|0x0005) plen 6   #37 [hci1] 0.913063
        Address: D5:B6:CC:31:DB:3B (Static)
> HCI Event: Command Complete (0x0e) plen 4                 #38 [hci1] 0.913612
      LE Set Random Address (0x08|0x0005) ncmd 1
        Status: Success (0x00)
< HCI Command: LE Extended Create... (0x08|0x0043) plen 26  #39 [hci1] 3.518581
        Filter policy: Accept list is not used (0x00)
        Own address type: Random (0x01)
        Peer address type: Public (0x00)
        Peer address: DF:A9:FF:F6:B1:1A (OUI DF-A9-FF)
        Initiating PHYs: 0x01
        Entry 0: LE 1M
          Scan interval: 60.000 msec (0x0060)
          Scan window: 60.000 msec (0x0060)
          Min connection interval: 50.00 msec (0x0028)
          Max connection interval: 70.00 msec (0x0038)
          Connection latency: 0 (0x0000)
          Supervision timeout: 4000 msec (0x0190)
          Min connection length: 0.000 msec (0x0000)
          Max connection length: 0.000 msec (0x0000)
> HCI Event: Command Status (0x0f) plen 4                   #40 [hci1] 3.519506
      LE Extended Create Connection (0x08|0x0043) ncmd 1
        Status: Success (0x00)
> HCI Event: LE Meta Event (0x3e) plen 31                   #41 [hci1] 3.575727
      LE Enhanced Connection Complete (0x0a)
        Status: Success (0x00)
        Handle: 1422
        Role: Central (0x00)
        Peer address type: Public (0x00)
        Peer address: DF:A9:FF:F6:B1:1A (OUI DF-A9-FF)
        Local resolvable private address: 00:00:00:00:00:00 (Non-Resolvable)
        Peer resolvable private address: 00:00:00:00:00:00 (Non-Resolvable)
        Connection interval: 70.00 msec (0x0038)
        Connection latency: 0 (0x0000)
        Supervision timeout: 4000 msec (0x0190)
        Central clock accuracy: 0x00
< HCI Command: LE Read Remote Used... (0x08|0x0016) plen 2  #42 [hci1] 3.593290
        Handle: 1422 Address: DF:A9:FF:F6:B1:1A (OUI DF-A9-FF)
< ACL Data TX: Handle 1422 flags 0x00 dlen 7                #43 [hci1] 3.593312
      ATT: Exchange MTU Request (0x02) len 2
        Client RX MTU: 251
> HCI Event: Command Status (0x0f) plen 4                   #44 [hci1] 3.593809
      LE Read Remote Used Features (0x08|0x0016) ncmd 1
        Status: Success (0x00)
< HCI Command: LE Set PHY (0x08|0x0032) plen 7              #45 [hci1] 3.613112
        Handle: 1422 Address: DF:A9:FF:F6:B1:1A (OUI DF-A9-FF)
        All PHYs preference: 0x00
        TX PHYs preference: 0x02
          LE 2M
        RX PHYs preference: 0x02
          LE 2M
        PHY options preference: Reserved (0x0000)
> HCI Event: Command Status (0x0f) plen 4                   #46 [hci1] 3.613672
      LE Set PHY (0x08|0x0032) ncmd 1
        Status: Success (0x00)
> HCI Event: Number of Completed Packets (0x13) plen 5      #47 [hci1] 3.648041
        Num handles: 1
        Handle: 1422 Address: DF:A9:FF:F6:B1:1A (OUI DF-A9-FF)
        Count: 1
        #43: len 7 (1 Kb/s)
        Latency: 54 msec (54-54 msec ~54 msec)
> HCI Event: LE Meta Event (0x3e) plen 12                   #48 [hci1] 3.788130
      LE Read Remote Used Features (0x04)
        Status: Success (0x00)
        Handle: 1422 Address: DF:A9:FF:F6:B1:1A (OUI DF-A9-FF)
        Features: 0x2d 0x49 0x00 0xf7 0x67 0xd9 0x00 0x80
          LE Encryption
          Extended Reject Indication
          Peripheral-initiated Features Exchange
          LE Data Packet Length Extension
          LE 2M PHY
          LE Coded PHY
          Channel Selection Algorithm #2
          Periodic Advertising Sync Transfer - Sender
          Periodic Advertising Sync Transfer - Recipient
          Sleep Clock Accuracy Updates
          Connected Isochronous Stream - Central
          Connected Isochronous Stream - Peripheral
          Isochronous Broadcaster
          Synchronized Receiver
          Connected Isochronous Stream (Host Support)
          LE Power Control Request
          LE Power Control Request
          Connection Subrating
          Connection Subrating (Host Support)
          Unknown features (0x8000d90000000000)
> HCI Event: LE Meta Event (0x3e) plen 6                    #49 [hci1] 4.487433
      LE PHY Update Complete (0x0c)
        Status: Success (0x00)
        Handle: 1422 Address: DF:A9:FF:F6:B1:1A (OUI DF-A9-FF)
        TX PHY: LE 2M (0x02)
        RX PHY: LE 2M (0x02)
> ACL Data RX: Handle 1422 flags 0x02 dlen 6                #50 [hci1] 4.627901
      SMP: Security Request (0x0b) len 1
        Authentication requirement: Bonding, No MITM, SC, No Keypresses (0x09)
> ACL Data RX: Handle 1422 flags 0x02 dlen 7                #51 [hci1] 4.628375
      ATT: Exchange MTU Response (0x03) len 2
        Server RX MTU: 23
< HCI Command: Host Number of Compl.. (0x03|0x0035) plen 5  #52 [hci1] 4.633127
        Num handles: 1
        Handle: 1422 Address: DF:A9:FF:F6:B1:1A (OUI DF-A9-FF)
        Count: 1
< ACL Data TX: Handle 1422 flags 0x00 dlen 11               #53 [hci1] 4.633200
      SMP: Pairing Request (0x01) len 6
        IO capability: DisplayOnly (0x00)
        OOB data: Authentication data not present (0x00)
        Authentication requirement: Bonding, No MITM, SC, No Keypresses (0x09)
        Max encryption key size: 16
        Initiator key distribution: EncKey (0x01)
        Responder key distribution: EncKey IdKey (0x03)
< HCI Command: Host Number of Compl.. (0x03|0x0035) plen 5  #54 [hci1] 4.633354
        Num handles: 1
        Handle: 1422 Address: DF:A9:FF:F6:B1:1A (OUI DF-A9-FF)
        Count: 1
> HCI Event: Number of Completed Packets (0x13) plen 5      #55 [hci1] 4.697886
        Num handles: 1
        Handle: 1422 Address: DF:A9:FF:F6:B1:1A (OUI DF-A9-FF)
        Count: 1
        #53: len 11 (1 Kb/s)
        Latency: 64 msec (54-64 msec ~59 msec)
> ACL Data RX: Handle 1422 flags 0x02 dlen 11               #56 [hci1] 4.768018
      SMP: Pairing Response (0x02) len 6
        IO capability: KeyboardDisplay (0x04)
        OOB data: Authentication data not present (0x00)
        Authentication requirement: Bonding, No MITM, SC, No Keypresses (0x09)
        Max encryption key size: 16
        Initiator key distribution: EncKey (0x01)
        Responder key distribution: EncKey IdKey (0x03)
< HCI Command: Host Number of Compl.. (0x03|0x0035) plen 5  #57 [hci1] 4.773556
        Num handles: 1
        Handle: 1422 Address: DF:A9:FF:F6:B1:1A (OUI DF-A9-FF)
        Count: 1
< ACL Data TX: Handle 1422 flags 0x00 dlen 27               #58 [hci1] 4.773581
< ACL Data TX: Handle 1422 flags 0x01 dlen 27               #59 [hci1] 4.773618
< ACL Data TX: Handle 1422 flags 0x01 dlen 15               #60 [hci1] 4.773643
      SMP: Pairing Public Key (0x0c) len 64
        X: 98308440221e2d910f0e54b71e7ec652857aa9b5a0dc65028824cc19db1226e9
        Y: 67a4816bcb62efb21701e31fdb27561a6217575fb007a8bbdabe7e28b6f68482
> HCI Event: Number of Completed Packets (0x13) plen 5      #61 [hci1] 4.837888
        Num handles: 1
        Handle: 1422 Address: DF:A9:FF:F6:B1:1A (OUI DF-A9-FF)
        Count: 1
        #58: len 27 (3 Kb/s)
        Latency: 64 msec (54-64 msec ~62 msec)
> HCI Event: Number of Completed Packets (0x13) plen 5      #62 [hci1] 4.838362
        Num handles: 1
        Handle: 1422 Address: DF:A9:FF:F6:B1:1A (OUI DF-A9-FF)
        Count: 1
        #59: len 27 (3 Kb/s)
        Latency: 64 msec (54-64 msec ~63 msec)
> HCI Event: Number of Completed Packets (0x13) plen 5      #63 [hci1] 4.838985
        Num handles: 1
        Handle: 1422 Address: DF:A9:FF:F6:B1:1A (OUI DF-A9-FF)
        Count: 1
        #60: len 15 (1 Kb/s)
        Latency: 65 msec (54-65 msec ~64 msec)
> ACL Data RX: Handle 1422 flags 0x02 dlen 27               #64 [hci1] 4.908118
> ACL Data RX: Handle 1422 flags 0x01 dlen 27               #65 [hci1] 4.908683
> ACL Data RX: Handle 1422 flags 0x01 dlen 15               #66 [hci1] 4.909015
      SMP: Pairing Public Key (0x0c) len 64
        X: 927345a6674c917b80c45b711221e9ea609b2612dc75644722dd68aa2c98d04c
        Y: 583be0489d2936e1ae63b5722bbb958aeb10f25138d132dddce2e195a1fe07cc
< HCI Command: Host Number of Compl.. (0x03|0x0035) plen 5  #67 [hci1] 4.913715
        Num handles: 1
        Handle: 1422 Address: DF:A9:FF:F6:B1:1A (OUI DF-A9-FF)
        Count: 1
< HCI Command: Host Number of Compl.. (0x03|0x0035) plen 5  #68 [hci1] 4.913893
        Num handles: 1
        Handle: 1422 Address: DF:A9:FF:F6:B1:1A (OUI DF-A9-FF)
        Count: 1
< HCI Command: Host Number of Compl.. (0x03|0x0035) plen 5  #69 [hci1] 4.914033
        Num handles: 1
        Handle: 1422 Address: DF:A9:FF:F6:B1:1A (OUI DF-A9-FF)
        Count: 1
> ACL Data RX: Handle 1422 flags 0x02 dlen 21               #70 [hci1] 4.978096
      SMP: Pairing Confirm (0x03) len 16
        Confim value: d23bec880631f298759942c9a0315006
< HCI Command: Host Number of Compl.. (0x03|0x0035) plen 5  #71 [hci1] 4.993297
        Num handles: 1
        Handle: 1422 Address: DF:A9:FF:F6:B1:1A (OUI DF-A9-FF)
        Count: 1
< ACL Data TX: Handle 1422 flags 0x00 dlen 21               #72 [hci1] 4.993404
      SMP: Pairing Random (0x04) len 16
        Random value: 8e6108f966a694cbe26df70bb96773e6
> HCI Event: Number of Completed Packets (0x13) plen 5      #73 [hci1] 5.047982
        Num handles: 1
        Handle: 1422 Address: DF:A9:FF:F6:B1:1A (OUI DF-A9-FF)
        Count: 1
        #72: len 21 (3 Kb/s)
        Latency: 54 msec (54-65 msec ~59 msec)
> ACL Data RX: Handle 1422 flags 0x02 dlen 21               #74 [hci1] 5.118242
      SMP: Pairing Random (0x04) len 16
        Random value: 1ece1d64d69156a00000000000000000
< HCI Command: Host Number of Compl.. (0x03|0x0035) plen 5  #75 [hci1] 5.133306
        Num handles: 1
        Handle: 1422 Address: DF:A9:FF:F6:B1:1A (OUI DF-A9-FF)
        Count: 1
< ACL Data TX: Handle 1422 flags 0x00 dlen 21               #76 [hci1] 5.133324
      SMP: Pairing DHKey Check (0x0d) len 16
        E: 3d0106bc60bf4b5276191202dd69ad81
> HCI Event: Number of Completed Packets (0x13) plen 5      #77 [hci1] 5.187903
        Num handles: 1
        Handle: 1422 Address: DF:A9:FF:F6:B1:1A (OUI DF-A9-FF)
        Count: 1
        #76: len 21 (3 Kb/s)
        Latency: 54 msec (54-65 msec ~57 msec)
> ACL Data RX: Handle 1422 flags 0x02 dlen 21               #78 [hci1] 5.468034
      SMP: Pairing DHKey Check (0x0d) len 16
        E: 1c8056d1ab0bc04f3bdecaa9340f48a9
< HCI Command: LE Start Encryption (0x08|0x0019) plen 28    #79 [hci1] 5.473613
        Handle: 1422 Address: DF:A9:FF:F6:B1:1A (OUI DF-A9-FF)
        Random number: 0x0000000000000000
        Encrypted diversifier: 0x0000
        Long term key: 13a40bef867775938637fc9cb7c31f4e
> HCI Event: Command Status (0x0f) plen 4                   #80 [hci1] 5.474466
      LE Start Encryption (0x08|0x0019) ncmd 1
        Status: Success (0x00)
< HCI Command: Host Number of Compl.. (0x03|0x0035) plen 5  #81 [hci1] 5.493175
        Num handles: 1
        Handle: 1422 Address: DF:A9:FF:F6:B1:1A (OUI DF-A9-FF)
        Count: 1
> HCI Event: Encryption Change (0x08) plen 4                #82 [hci1] 5.957773
        Status: Success (0x00)
        Handle: 1422 Address: DF:A9:FF:F6:B1:1A (OUI DF-A9-FF)
        Encryption: Enabled with AES-CCM (0x01)
> ACL Data RX: Handle 1422 flags 0x02 dlen 21               #83 [hci1] 6.028169
      SMP: Identity Information (0x08) len 16
        Identity resolving key: 71e5b10169da80d1822ee0db28342c1d
< HCI Command: Host Number of Compl.. (0x03|0x0035) plen 5  #84 [hci1] 6.033348
        Num handles: 1
        Handle: 1422 Address: DF:A9:FF:F6:B1:1A (OUI DF-A9-FF)
        Count: 1
< ACL Data TX: Handle 1422 flags 0x00 dlen 13               #85 [hci1] 6.053511
      ATT: Find By Type Value Request (0x06) len 8
        Handle range: 0x0001-0xffff
        Attribute type: Primary Service (0x2800)
          UUID: Microphone Control (0x184d)
> HCI Event: Number of Completed Packets (0x13) plen 5      #86 [hci1] 6.098009
        Num handles: 1
        Handle: 1422 Address: DF:A9:FF:F6:B1:1A (OUI DF-A9-FF)
        Count: 1
        #85: len 13 (2 Kb/s)
        Latency: 44 msec (44-65 msec ~50 msec)
> ACL Data RX: Handle 1422 flags 0x02 dlen 12               #87 [hci1] 6.168016
      SMP: Identity Address Information (0x09) len 7
        Address: DF:A9:FF:F6:B1:1A (OUI DF-A9-FF)
< HCI Command: LE Add Device To Re.. (0x08|0x0027) plen 39  #88 [hci1] 6.173645
        Address type: Public (0x00)
        Address: DF:A9:FF:F6:B1:1A (OUI DF-A9-FF)
        Peer identity resolving key: 71e5b10169da80d1822ee0db28342c1d
        Local identity resolving key: 00000000000000000000000000000000
> HCI Event: Command Complete (0x0e) plen 4                 #89 [hci1] 6.174642
      LE Add Device To Resolving List (0x08|0x0027) ncmd 1
        Status: Success (0x00)
< HCI Command: LE Set Privacy Mode (0x08|0x004e) plen 8     #90 [hci1] 6.193520
        Peer Identity address type: Public (0x00)
        Peer Identity address: DF:A9:FF:F6:B1:1A (OUI DF-A9-FF)
        Privacy Mode: Use Device Privacy (0x01)
> HCI Event: Command Complete (0x0e) plen 4                 #91 [hci1] 6.194101
      LE Set Privacy Mode (0x08|0x004e) ncmd 1
        Status: Success (0x00)
< HCI Command: LE Set Address Resol.. (0x08|0x002d) plen 1  #92 [hci1] 6.213447
        Address resolution: Enabled (0x01)
> HCI Event: Command Complete (0x0e) plen 4                 #93 [hci1] 6.213890
      LE Set Address Resolution Enable (0x08|0x002d) ncmd 1
        Status: Success (0x00)
< HCI Command: Host Number of Compl.. (0x03|0x0035) plen 5  #94 [hci1] 6.233342
        Num handles: 1
        Handle: 1422 Address: DF:A9:FF:F6:B1:1A (OUI DF-A9-FF)
        Count: 1
> ACL Data RX: Handle 1422 flags 0x02 dlen 9                #95 [hci1] 6.237979
      ATT: Find By Type Value Response (0x07) len 4
        Handle range: 0x00d0-0x00d4
< HCI Command: Host Number of Compl.. (0x03|0x0035) plen 5  #96 [hci1] 6.253605
        Num handles: 1
        Handle: 1422 Address: DF:A9:FF:F6:B1:1A (OUI DF-A9-FF)
        Count: 1
< ACL Data TX: Handle 1422 flags 0x00 dlen 11               #97 [hci1] 6.253702
      ATT: Read By Type Request (0x08) len 6
        Handle range: 0x00d1-0x00d4
        Attribute type: Characteristic (0x2803)
> HCI Event: Number of Completed Packets (0x13) plen 5      #98 [hci1] 6.307842
        Num handles: 1
        Handle: 1422 Address: DF:A9:FF:F6:B1:1A (OUI DF-A9-FF)
        Count: 1
        #97: len 11 (1 Kb/s)
        Latency: 54 msec (44-65 msec ~52 msec)
> ACL Data RX: Handle 1422 flags 0x02 dlen 13               #99 [hci1] 6.378007
      ATT: Read By Type Response (0x09) len 8
        Attribute data length: 7
        Attribute data list: 1 entry
        Handle: 0x00d2
        Value: 1ad300c32b
            Properties: 0x1a
              Read (0x02)
              Write (0x08)
              Notify (0x10)
            Value Handle: 0x00d3
            Value UUID: Mute (0x2bc3)
< HCI Command: Host Number of Comp.. (0x03|0x0035) plen 5  #100 [hci1] 6.393599
        Num handles: 1
        Handle: 1422 Address: DF:A9:FF:F6:B1:1A (OUI DF-A9-FF)
        Count: 1
< ACL Data TX: Handle 1422 flags 0x00 dlen 9               #101 [hci1] 6.393754
      ATT: Find Information Request (0x04) len 4
        Handle range: 0x00d3-0x00d4
> HCI Event: Number of Completed Packets (0x13) plen 5     #102 [hci1] 6.447924
        Num handles: 1
        Handle: 1422 Address: DF:A9:FF:F6:B1:1A (OUI DF-A9-FF)
        Count: 1
        #101: len 9 (1 Kb/s)
        Latency: 54 msec (44-65 msec ~53 msec)
> ACL Data RX: Handle 1422 flags 0x02 dlen 14              #103 [hci1] 6.517996
      ATT: Find Information Response (0x05) len 9
        Format: UUID-16 (0x01)
        Handle: 0x00d3
        UUID: Mute (0x2bc3)
        Handle: 0x00d4
        UUID: Client Characteristic Configuration (0x2902)
< HCI Command: Host Number of Comp.. (0x03|0x0035) plen 5  #104 [hci1] 6.533197
        Num handles: 1
        Handle: 1422 Address: DF:A9:FF:F6:B1:1A (OUI DF-A9-FF)
        Count: 1
< ACL Data TX: Handle 1422 flags 0x00 dlen 11              #105 [hci1] 6.533273
      ATT: Read By Type Request (0x08) len 6
        Handle range: 0x00d3-0x00d4
        Attribute type: Characteristic (0x2803)
> HCI Event: Number of Completed Packets (0x13) plen 5     #106 [hci1] 6.587826
        Num handles: 1
        Handle: 1422 Address: DF:A9:FF:F6:B1:1A (OUI DF-A9-FF)
        Count: 1
        #105: len 11 (1 Kb/s)
        Latency: 54 msec (44-65 msec ~53 msec)
> ACL Data RX: Handle 1422 flags 0x02 dlen 9               #107 [hci1] 6.657922
      ATT: Error Response (0x01) len 4
        Read By Type Request (0x08)
        Handle: 0x00d3
        Error: Attribute Not Found (0x0a)
< HCI Command: Host Number of Comp.. (0x03|0x0035) plen 5  #108 [hci1] 6.673636
        Num handles: 1
        Handle: 1422 Address: DF:A9:FF:F6:B1:1A (OUI DF-A9-FF)
        Count: 1
< ACL Data TX: Handle 1422 flags 0x00 dlen 9               #109 [hci1] 6.673736
      ATT: Write Request (0x12) len 4
        Handle: 0x00d4
          Data: 0100
> HCI Event: Number of Completed Packets (0x13) plen 5     #110 [hci1] 6.727857
        Num handles: 1
        Handle: 1422 Address: DF:A9:FF:F6:B1:1A (OUI DF-A9-FF)
        Count: 1
        #109: len 9 (1 Kb/s)
        Latency: 54 msec (44-65 msec ~54 msec)
> ACL Data RX: Handle 1422 flags 0x02 dlen 5               #111 [hci1] 6.797846
      ATT: Write Response (0x13) len 0
< HCI Command: Host Number of Comp.. (0x03|0x0035) plen 5  #112 [hci1] 6.813578
        Num handles: 1
        Handle: 1422 Address: DF:A9:FF:F6:B1:1A (OUI DF-A9-FF)
        Count: 1
< ACL Data TX: Handle 1422 flags 0x00 dlen 11              #113 [hci1] 6.813674
      ATT: Read By Type Request (0x08) len 6
        Handle range: 0x00d1-0x00d4
        Attribute type: Include (0x2802)
> HCI Event: Number of Completed Packets (0x13) plen 5     #114 [hci1] 6.867882
        Num handles: 1
        Handle: 1422 Address: DF:A9:FF:F6:B1:1A (OUI DF-A9-FF)
        Count: 1
        #113: len 11 (1 Kb/s)
        Latency: 54 msec (44-65 msec ~54 msec)
> ACL Data RX: Handle 1422 flags 0x02 dlen 14              #115 [hci1] 6.937970
      ATT: Read By Type Response (0x09) len 9
        Attribute data length: 8
        Attribute data list: 1 entry
        Handle: 0x00d1
        Value: f000ff004318
< HCI Command: Host Number of Comp.. (0x03|0x0035) plen 5  #116 [hci1] 6.953655
        Num handles: 1
        Handle: 1422 Address: DF:A9:FF:F6:B1:1A (OUI DF-A9-FF)
        Count: 1
< ACL Data TX: Handle 1422 flags 0x00 dlen 11              #117 [hci1] 6.953769
      ATT: Read By Type Request (0x08) len 6
        Handle range: 0x00f0-0x00ff
        Attribute type: Characteristic (0x2803)
> HCI Event: Number of Completed Packets (0x13) plen 5     #118 [hci1] 7.007900
        Num handles: 1
        Handle: 1422 Address: DF:A9:FF:F6:B1:1A (OUI DF-A9-FF)
        Count: 1
        #117: len 11 (1 Kb/s)
        Latency: 54 msec (44-65 msec ~54 msec)
> ACL Data RX: Handle 1422 flags 0x02 dlen 27              #119 [hci1] 7.078151
      ATT: Read By Type Response (0x09) len 22
        Attribute data length: 7
        Attribute data list: 3 entries
        Handle: 0x00f1
        Value: 12f200772b
            Properties: 0x12
              Read (0x02)
              Notify (0x10)
            Value Handle: 0x00f2
            Value UUID: Audio Input State (0x2b77)
        Handle: 0x00f4
        Value: 02f500782b
            Properties: 0x02
              Read (0x02)
            Value Handle: 0x00f5
            Value UUID: Gain Settings Attribute (0x2b78)
        Handle: 0x00f6
        Value: 02f700792b
            Properties: 0x02
              Read (0x02)
            Value Handle: 0x00f7
            Value UUID: Audio Input Type (0x2b79)
< HCI Command: Host Number of Comp.. (0x03|0x0035) plen 5  #120 [hci1] 7.093373
        Num handles: 1
        Handle: 1422 Address: DF:A9:FF:F6:B1:1A (OUI DF-A9-FF)
        Count: 1
< ACL Data TX: Handle 1422 flags 0x00 dlen 9               #121 [hci1] 7.093426
      ATT: Write Request (0x12) len 4
        Handle: 0x00f3
          Data: 0100
> HCI Event: Number of Completed Packets (0x13) plen 5     #122 [hci1] 7.147831
        Num handles: 1
        Handle: 1422 Address: DF:A9:FF:F6:B1:1A (OUI DF-A9-FF)
        Count: 1
        #121: len 9 (1 Kb/s)
        Latency: 54 msec (44-65 msec ~54 msec)
> ACL Data RX: Handle 1422 flags 0x02 dlen 5               #123 [hci1] 7.217797
      ATT: Write Response (0x13) len 0
< HCI Command: Host Number of Comp.. (0x03|0x0035) plen 5  #124 [hci1] 7.233114
        Num handles: 1
        Handle: 1422 Address: DF:A9:FF:F6:B1:1A (OUI DF-A9-FF)
        Count: 1
< ACL Data TX: Handle 1422 flags 0x00 dlen 11              #125 [hci1] 7.233145
      ATT: Read By Type Request (0x08) len 6
        Handle range: 0x00f7-0x00ff
        Attribute type: Characteristic (0x2803)
> HCI Event: Number of Completed Packets (0x13) plen 5     #126 [hci1] 7.287882
        Num handles: 1
        Handle: 1422 Address: DF:A9:FF:F6:B1:1A (OUI DF-A9-FF)
        Count: 1
        #125: len 11 (1 Kb/s)
        Latency: 54 msec (44-65 msec ~54 msec)
> ACL Data RX: Handle 1422 flags 0x02 dlen 27              #127 [hci1] 7.358195
      ATT: Read By Type Response (0x09) len 22
        Attribute data length: 7
        Attribute data list: 3 entries
        Handle: 0x00f8
        Value: 12f9007a2b
            Properties: 0x12
              Read (0x02)
              Notify (0x10)
            Value Handle: 0x00f9
            Value UUID: Audio Input Status (0x2b7a)
        Handle: 0x00fb
        Value: 08fc007b2b
            Properties: 0x08
              Write (0x08)
            Value Handle: 0x00fc
            Value UUID: Audio Input Control Point (0x2b7b)
        Handle: 0x00fd
        Value: 16fe007c2b
            Properties: 0x16
              Read (0x02)
              Write Without Response (0x04)
              Notify (0x10)
            Value Handle: 0x00fe
            Value UUID: Audio Input Description (0x2b7c)
< HCI Command: Host Number of Comp.. (0x03|0x0035) plen 5  #128 [hci1] 7.373700
        Num handles: 1
        Handle: 1422 Address: DF:A9:FF:F6:B1:1A (OUI DF-A9-FF)
        Count: 1
< ACL Data TX: Handle 1422 flags 0x00 dlen 9               #129 [hci1] 7.373860
      ATT: Write Request (0x12) len 4
        Handle: 0x00fa
          Data: 0100
> HCI Event: Number of Completed Packets (0x13) plen 5     #130 [hci1] 7.427795
        Num handles: 1
        Handle: 1422 Address: DF:A9:FF:F6:B1:1A (OUI DF-A9-FF)
        Count: 1
        #129: len 9 (1 Kb/s)
        Latency: 53 msec (44-65 msec ~54 msec)
> ACL Data RX: Handle 1422 flags 0x02 dlen 5               #131 [hci1] 7.497855
      ATT: Write Response (0x13) len 0
< HCI Command: Host Number of Comp.. (0x03|0x0035) plen 5  #132 [hci1] 7.513415
        Num handles: 1
        Handle: 1422 Address: DF:A9:FF:F6:B1:1A (OUI DF-A9-FF)
        Count: 1
< ACL Data TX: Handle 1422 flags 0x00 dlen 9               #133 [hci1] 7.513456
      ATT: Write Request (0x12) len 4
        Handle: 0x00ff
          Data: 0100
> HCI Event: Number of Completed Packets (0x13) plen 5     #134 [hci1] 7.567816
        Num handles: 1
        Handle: 1422 Address: DF:A9:FF:F6:B1:1A (OUI DF-A9-FF)
        Count: 1
        #133: len 9 (1 Kb/s)
        Latency: 54 msec (44-65 msec ~54 msec)
> ACL Data RX: Handle 1422 flags 0x02 dlen 5               #135 [hci1] 7.637834
      ATT: Write Response (0x13) len 0
< HCI Command: Host Number of Comp.. (0x03|0x0035) plen 5  #136 [hci1] 7.653207
        Num handles: 1
        Handle: 1422 Address: DF:A9:FF:F6:B1:1A (OUI DF-A9-FF)
        Count: 1
< ACL Data TX: Handle 1422 flags 0x00 dlen 11              #137 [hci1] 7.653245
      ATT: Read By Type Request (0x08) len 6
        Handle range: 0x00fe-0x00ff
        Attribute type: Characteristic (0x2803)
> HCI Event: Number of Completed Packets (0x13) plen 5     #138 [hci1] 7.707898
        Num handles: 1
        Handle: 1422 Address: DF:A9:FF:F6:B1:1A (OUI DF-A9-FF)
        Count: 1
        #137: len 11 (1 Kb/s)
        Latency: 54 msec (44-65 msec ~54 msec)
> ACL Data RX: Handle 1422 flags 0x02 dlen 9               #139 [hci1] 7.777914
      ATT: Error Response (0x01) len 4
        Read By Type Request (0x08)
        Handle: 0x00fe
        Error: Attribute Not Found (0x0a)
< HCI Command: Host Number of Comp.. (0x03|0x0035) plen 5  #140 [hci1] 7.793286
        Num handles: 1
        Handle: 1422 Address: DF:A9:FF:F6:B1:1A (OUI DF-A9-FF)
        Count: 1
< ACL Data TX: Handle 1422 flags 0x00 dlen 11              #141 [hci1] 7.793373
      ATT: Read By Type Request (0x08) len 6
        Handle range: 0x00d2-0x00d4
        Attribute type: Include (0x2802)
> HCI Event: Number of Completed Packets (0x13) plen 5     #142 [hci1] 7.847806
        Num handles: 1
        Handle: 1422 Address: DF:A9:FF:F6:B1:1A (OUI DF-A9-FF)
        Count: 1
        #141: len 11 (1 Kb/s)
        Latency: 54 msec (44-65 msec ~54 msec)
> ACL Data RX: Handle 1422 flags 0x02 dlen 9               #143 [hci1] 7.917979
      ATT: Error Response (0x01) len 4
        Read By Type Request (0x08)
        Handle: 0x00d2
        Error: Attribute Not Found (0x0a)
< HCI Command: Host Number of Comp.. (0x03|0x0035) plen 5  #144 [hci1] 7.933977
        Num handles: 1
        Handle: 1422 Address: DF:A9:FF:F6:B1:1A (OUI DF-A9-FF)
        Count: 1
< ACL Data TX: Handle 1422 flags 0x00 dlen 7              #145 [hci1] 10.003796
      ATT: Read Request (0x0a) len 2
        Handle: 0x00f2
> HCI Event: Number of Completed Packets (0x13) plen 5    #146 [hci1] 10.017805
        Num handles: 1
        Handle: 1422 Address: DF:A9:FF:F6:B1:1A (OUI DF-A9-FF)
        Count: 1
        #145: len 7 (4 Kb/s)
        Latency: 14 msec (14-65 msec ~34 msec)
> ACL Data RX: Handle 1422 flags 0x02 dlen 9              #147 [hci1] 10.087921
      ATT: Read Response (0x0b) len 4
< HCI Command: Host Number of Com.. (0x03|0x0035) plen 5  #148 [hci1] 10.093947
        Num handles: 1
        Handle: 1422 Address: DF:A9:FF:F6:B1:1A (OUI DF-A9-FF)
        Count: 1
< ACL Data TX: Handle 1422 flags 0x00 dlen 10             #149 [hci1] 11.143893
      ATT: Write Request (0x12) len 5
        Handle: 0x00fc
          Data: 010502
> HCI Event: Number of Completed Packets (0x13) plen 5    #150 [hci1] 11.207822
        Num handles: 1
        Handle: 1422 Address: DF:A9:FF:F6:B1:1A (OUI DF-A9-FF)
        Count: 1
        #149: len 10 (1 Kb/s)
        Latency: 63 msec (14-65 msec ~49 msec)
> ACL Data RX: Handle 1422 flags 0x02 dlen 9              #151 [hci1] 11.277944
      ATT: Error Response (0x01) len 4
        Write Request (0x12)
        Handle: 0x00fc
        Error: Reserved (0x80)
< HCI Command: Host Number of Com.. (0x03|0x0035) plen 5  #152 [hci1] 11.293791
        Num handles: 1
        Handle: 1422 Address: DF:A9:FF:F6:B1:1A (OUI DF-A9-FF)
        Count: 1
< ACL Data TX: Handle 1422 flags 0x00 dlen 7              #153 [hci1] 11.293916
      ATT: Read Request (0x0a) len 2
        Handle: 0x00f2
> HCI Event: Number of Completed Packets (0x13) plen 5    #154 [hci1] 11.347793
        Num handles: 1
        Handle: 1422 Address: DF:A9:FF:F6:B1:1A (OUI DF-A9-FF)
        Count: 1
        #153: len 7 (1 Kb/s)
        Latency: 53 msec (14-65 msec ~51 msec)
> ACL Data RX: Handle 1422 flags 0x02 dlen 9              #155 [hci1] 11.417835
      ATT: Read Response (0x0b) len 4
< HCI Command: Host Number of Com.. (0x03|0x0035) plen 5  #156 [hci1] 11.433658
        Num handles: 1
        Handle: 1422 Address: DF:A9:FF:F6:B1:1A (OUI DF-A9-FF)
        Count: 1
< ACL Data TX: Handle 1422 flags 0x00 dlen 10             #157 [hci1] 11.433780
      ATT: Write Request (0x12) len 5
        Handle: 0x00fc
          Data: 010502
> HCI Event: Number of Completed Packets (0x13) plen 5    #158 [hci1] 11.487902
        Num handles: 1
        Handle: 1422 Address: DF:A9:FF:F6:B1:1A (OUI DF-A9-FF)
        Count: 1
        #157: len 10 (1 Kb/s)
        Latency: 54 msec (14-65 msec ~52 msec)
> ACL Data RX: Handle 1422 flags 0x02 dlen 5              #159 [hci1] 11.557837
      ATT: Write Response (0x13) len 0
< HCI Command: Host Number of Com.. (0x03|0x0035) plen 5  #160 [hci1] 11.573980
        Num handles: 1
        Handle: 1422 Address: DF:A9:FF:F6:B1:1A (OUI DF-A9-FF)
        Count: 1
> HCI Event: Disconnect Complete (0x05) plen 4            #161 [hci1] 12.747457
        Status: Success (0x00)
        Handle: 1422 Address: DF:A9:FF:F6:B1:1A (OUI DF-A9-FF)
        Reason: Remote User Terminated Connection (0x13)
< HCI Command: Reset (0x03|0x0003) plen 0                 #162 [hci1] 18.543261
> HCI Event: Command Complete (0x0e) plen 4               #163 [hci1] 18.543825
      Reset (0x03|0x0003) ncmd 1
        Status: Success (0x00)
@ USER Close: main                                    {0x0001} [hci1] 18.553179
= Close Index: 00:00:00:00:00:00                               [hci1] 18.553186
