Bluetooth monitor ver 5.72
= Note: Linux version 6.14.0-36-generic (x86_64)                       0.602877
= Note: Bluetooth subsystem version 2.22                               0.602879
= New Index: 00:00:00:00:00:00 (Primary,UART,hci1)              [hci1] 0.602879
= New Index: 48:5F:99:8E:E0:64 (Primary,USB,hci0)               [hci0] 0.602880
= Open Index: 00:00:00:00:00:00                                 [hci1] 0.717031
= Index Info: 00:00:00:00:00:00 (Nordic Semiconductor ASA)      [hci1] 0.717049
@ USER Open: main (privileged) version 2.22            {0x0001} [hci1] 0.717057
< HCI Command: Reset (0x03|0x0003) plen 0                    #1 [hci1] 0.718255
> HCI Event: Command Complete (0x0e) plen 4                  #2 [hci1] 0.718773
      Reset (0x03|0x0003) ncmd 1
        Status: Success (0x00)
< HCI Command: Read Local Supported... (0x04|0x0003) plen 0  #3 [hci1] 0.736708
> HCI Event: Command Complete (0x0e) plen 12                 #4 [hci1] 0.737249
      Read Local Supported Features (0x04|0x0003) ncmd 1
        Status: Success (0x00)
        Features: 0x00 0x00 0x00 0x00 0x60 0x00 0x00 0x00
          BR/EDR Not Supported
          LE Supported (Controller)
< HCI Command: Read Local Version In.. (0x04|0x0001) plen 0  #5 [hci1] 0.756412
> HCI Event: Command Complete (0x0e) plen 12                 #6 [hci1] 0.756953
      Read Local Version Information (0x04|0x0001) ncmd 1
        Status: Success (0x00)
        HCI version: Reserved (0x0f) - Revision 12393 (0x3069)
        LMP version: Reserved (0x0f) - Subversion 12393 (0x3069)
        Manufacturer: Nordic Semiconductor ASA (89)
< HCI Command: Read Local Supported... (0x04|0x0002) plen 0  #7 [hci1] 0.776438
> HCI Event: Command Complete (0x0e) plen 68                 #8 [hci1] 0.777542
      Read Local Supported Commands (0x04|0x0002) ncmd 1
        Status: Success (0x00)
        Commands: 119 entries
          Disconnect (Octet 0 - Bit 5)
          Read Remote Version Information (Octet 2 - Bit 7)
          Set Event Mask (Octet 5 - Bit 6)
          Reset (Octet 5 - Bit 7)
          Read Connection Accept Timeout (Octet 7 - Bit 2)
          Write Connection Accept Timeout (Octet 7 - Bit 3)
          Read Transmit Power Level (Octet 10 - Bit 2)
          Set Controller To Host Flow Control (Octet 10 - Bit 5)
          Host Buffer Size (Octet 10 - Bit 6)
          Host Number of Completed Packets (Octet 10 - Bit 7)
          Read Local Version Information (Octet 14 - Bit 3)
          Read Local Supported Features (Octet 14 - Bit 5)
          Read BD ADDR (Octet 15 - Bit 1)
          Read RSSI (Octet 15 - Bit 5)
          Set Event Mask Page 2 (Octet 22 - Bit 2)
          LE Set Event Mask (Octet 25 - Bit 0)
          LE Read Buffer Size (Octet 25 - Bit 1)
          LE Read Local Supported Features (Octet 25 - Bit 2)
          LE Set Random Address (Octet 25 - Bit 4)
          LE Set Advertising Parameters (Octet 25 - Bit 5)
          LE Read Advertising Channel TX Power (Octet 25 - Bit 6)
          LE Set Advertising Data (Octet 25 - Bit 7)
          LE Set Scan Response Data (Octet 26 - Bit 0)
          LE Set Advertise Enable (Octet 26 - Bit 1)
          LE Set Scan Parameters (Octet 26 - Bit 2)
          LE Set Scan Enable (Octet 26 - Bit 3)
          LE Create Connection (Octet 26 - Bit 4)
          LE Create Connection Cancel (Octet 26 - Bit 5)
          LE Read Accept List Size (Octet 26 - Bit 6)
          LE Clear Accept List (Octet 26 - Bit 7)
          LE Add Device To Accept List (Octet 27 - Bit 0)
          LE Remove Device From Accept List (Octet 27 - Bit 1)
          LE Connection Update (Octet 27 - Bit 2)
          LE Set Host Channel Classification (Octet 27 - Bit 3)
          LE Read Channel Map (Octet 27 - Bit 4)
          LE Read Remote Used Features (Octet 27 - Bit 5)
          LE Encrypt (Octet 27 - Bit 6)
          LE Rand (Octet 27 - Bit 7)
          LE Start Encryption (Octet 28 - Bit 0)
          LE Long Term Key Request Reply (Octet 28 - Bit 1)
          LE Long Term Key Request Neg Reply (Octet 28 - Bit 2)
          LE Read Supported States (Octet 28 - Bit 3)
          LE Receiver Test (Octet 28 - Bit 4)
          LE Transmitter Test (Octet 28 - Bit 5)
          LE Test End (Octet 28 - Bit 6)
          Read Authenticated Payload Timeout (Octet 32 - Bit 4)
          Write Authenticated Payload Timeout (Octet 32 - Bit 5)
          LE Set Data Length (Octet 33 - Bit 6)
          LE Read Suggested Default Data Length (Octet 33 - Bit 7)
          LE Write Suggested Default Data Length (Octet 34 - Bit 0)
          LE Add Device To Resolving List (Octet 34 - Bit 3)
          LE Remove Device From Resolving List (Octet 34 - Bit 4)
          LE Clear Resolving List (Octet 34 - Bit 5)
          LE Read Resolving List Size (Octet 34 - Bit 6)
          LE Set Address Resolution Enable (Octet 35 - Bit 1)
          LE Set Resolvable Private Address Timeout (Octet 35 - Bit 2)
          LE Read Maximum Data Length (Octet 35 - Bit 3)
          LE Read PHY (Octet 35 - Bit 4)
          LE Set Default PHY (Octet 35 - Bit 5)
          LE Set PHY (Octet 35 - Bit 6)
          LE Enhanced Receiver Test (Octet 35 - Bit 7)
          LE Enhanced Transmitter Test (Octet 36 - Bit 0)
          LE Set Advertising Set Random Address (Octet 36 - Bit 1)
          LE Set Extended Advertising Parameters (Octet 36 - Bit 2)
          LE Set Extended Advertising Data (Octet 36 - Bit 3)
          LE Set Extended Scan Response Data (Octet 36 - Bit 4)
          LE Set Extended Advertising Enable (Octet 36 - Bit 5)
          LE Read Maximum Advertising Data Length (Octet 36 - Bit 6)
          LE Read Number of Supported Advertising Sets (Octet 36 - Bit 7)
          LE Remove Advertising Set (Octet 37 - Bit 0)
          LE Clear Advertising Sets (Octet 37 - Bit 1)
          LE Set Periodic Advertising Parameters (Octet 37 - Bit 2)
          LE Set Periodic Advertising Data (Octet 37 - Bit 3)
          LE Set Periodic Advertising Enable (Octet 37 - Bit 4)
          LE Set Extended Scan Parameters (Octet 37 - Bit 5)
          LE Set Extended Scan Enable (Octet 37 - Bit 6)
          LE Extended Create Connection (Octet 37 - Bit 7)
          LE Periodic Advertising Create Sync (Octet 38 - Bit 0)
          LE Periodic Advertising Create Sync Cancel (Octet 38 - Bit 1)
          LE Periodic Advertising Terminate Sync (Octet 38 - Bit 2)
          LE Add Device To Periodic Advertiser List (Octet 38 - Bit 3)
          LE Remove Device From Periodic Advertiser List (Octet 38 - Bit 4)
          LE Clear Periodic Advertiser List (Octet 38 - Bit 5)
          LE Read Periodic Advertiser List Size (Octet 38 - Bit 6)
          LE Read Transmit Power (Octet 38 - Bit 7)
          LE Read RF Path Compensation (Octet 39 - Bit 0)
          LE Write RF Path Compensation (Octet 39 - Bit 1)
          LE Set Privacy Mode (Octet 39 - Bit 2)
          LE Periodic Advertising Receive Enable (Octet 40 - Bit 5)
          LE Periodic Advertising Sync Transfer (Octet 40 - Bit 6)
          LE Periodic Advertising Set Info Transfer (Octet 40 - Bit 7)
          LE Periodic Advertising Sync Transfer Parameters (Octet 41 - Bit 0)
          LE Set Default Periodic Advertisng Sync Transfer Parameters (Octet 41 - Bit 1)
          LE Read Buffer v2 (Octet 41 - Bit 5)
          LE Read ISO TX Sync (Octet 41 - Bit 6)
          LE Set Connected Isochronous Group Parameters (Octet 41 - Bit 7)
          LE Set Connected Isochronous Group Parameters Test (Octet 42 - Bit 0)
          LE Create Connected Isochronous Stream (Octet 42 - Bit 1)
          LE Remove Connected Isochronous Group (Octet 42 - Bit 2)
          LE Accept Connected Isochronous Stream Request (Octet 42 - Bit 3)
          LE Reject Connected Isochronous Stream Request (Octet 42 - Bit 4)
          LE Create Broadcast Isochronous Group (Octet 42 - Bit 5)
          LE Create Broadcast Isochronous Group Test (Octet 42 - Bit 6)
          LE Terminate Broadcast Isochronous Group (Octet 42 - Bit 7)
          LE Broadcast Isochronous Group Create Sync (Octet 43 - Bit 0)
          LE Broadcast Isochronous Group Terminate Sync (Octet 43 - Bit 1)
          LE Request Peer SCA (Octet 43 - Bit 2)
          LE Setup Isochronous Data Path (Octet 43 - Bit 3)
          LE Remove Isochronous Data Path (Octet 43 - Bit 4)
          LE Isochronous Transmit Test (Octet 43 - Bit 5)
          LE Isochronous Receive Test (Octet 43 - Bit 6)
          LE Isochronous Read Test Counters (Octet 43 - Bit 7)
          LE Isochronous Read Test Counters (Octet 44 - Bit 0)
          LE Set Host Feature (Octet 44 - Bit 1)
          Octet 44 - Bit 2 
          Octet 45 - Bit 6 
          Octet 46 - Bit 0 
          Octet 46 - Bit 1 
          Octet 46 - Bit 2 
< HCI Command: Host Buffer Size (0x03|0x0033) plen 7         #9 [hci1] 0.796472
        ACL MTU: 255  ACL max packet: 16
        SCO MTU: 0    SCO max packet: 0
> HCI Event: Command Complete (0x0e) plen 4                 #10 [hci1] 0.797035
      Host Buffer Size (0x03|0x0033) ncmd 1
        Status: Success (0x00)
< HCI Command: Set Controller To Ho.. (0x03|0x0031) plen 1  #11 [hci1] 0.816484
        Flow control: ACL Data Packets (0x01)
> HCI Event: Command Complete (0x0e) plen 4                 #12 [hci1] 0.816888
      Set Controller To Host Flow Control (0x03|0x0031) ncmd 1
        Status: Success (0x00)
< HCI Command: LE Read Local Suppor.. (0x08|0x0003) plen 0  #13 [hci1] 0.836472
> HCI Event: Command Complete (0x0e) plen 12                #14 [hci1] 0.836962
      LE Read Local Supported Features (0x08|0x0003) ncmd 1
        Status: Success (0x00)
        Features: 0xfd 0x79 0x00 0xf7 0x30 0x01 0x00 0x00
          LE Encryption
          Extended Reject Indication
          Peripheral-initiated Features Exchange
          LE Ping
          LE Data Packet Length Extension
          LL Privacy
          Extended Scanner Filter Policies
          LE 2M PHY
          LE Coded PHY
          LE Extended Advertising
          LE Periodic Advertising
          Channel Selection Algorithm #2
          Periodic Advertising Sync Transfer - Sender
          Periodic Advertising Sync Transfer - Recipient
          Sleep Clock Accuracy Updates
          Connected Isochronous Stream - Central
          Connected Isochronous Stream - Peripheral
          Isochronous Broadcaster
          Synchronized Receiver
          Periodic Advertising ADI support
          Connection Subrating
          Unknown features (0x0000010000000000)
< HCI Command: LE Set Host Feature (0x08|0x0074) plen 2     #15 [hci1] 0.856438
        Bit Number: 32
          Connected Isochronous Stream (Host Support)
        Bit Value: 1
> HCI Event: Command Complete (0x0e) plen 4                 #16 [hci1] 0.856808
      LE Set Host Feature (0x08|0x0074) ncmd 1
        Status: Success (0x00)
< HCI Command: LE Read Buffer v2 (0x08|0x0060) plen 0       #17 [hci1] 0.876483
> HCI Event: Command Complete (0x0e) plen 10                #18 [hci1] 0.876954
      LE Read Buffer v2 (0x08|0x0060) ncmd 1
        Status: Success (0x00)
        ACL MTU: 27
        ACL max packet: 3
        ISO MTU: 318
        ISO max packet: 3
< HCI Command: LE Read Maximum Adve.. (0x08|0x003a) plen 0  #19 [hci1] 0.896506
> HCI Event: Command Complete (0x0e) plen 6                 #20 [hci1] 0.896918
      LE Read Maximum Advertising Data Length (0x08|0x003a) ncmd 1
        Status: Success (0x00)
        Max length: 1650
< HCI Command: LE Read Supported St.. (0x08|0x001c) plen 0  #21 [hci1] 0.916490
> HCI Event: Command Complete (0x0e) plen 12                #22 [hci1] 0.916967
      LE Read Supported States (0x08|0x001c) ncmd 1
        Status: Success (0x00)
        States: 0x000003ff3e0306ff
          Non-connectable Advertising State
          Scannable Advertising State
          Connectable Advertising State
          High Duty Cycle Directed Advertising State
          Passive Scanning State
          Active Scanning State
          Initiating State
            and Connection State (Central Role)
          Connection State (Peripheral Role)
          Scannable Advertising State
            and Passive Scanning State
          Connectable Advertising State
            and Passive Scanning State
          Non-connectable Advertising State
            and Initiating State
          Scannable Advertising State
            and Initiating State
          Active Scanning State
            and Connection State (Central Role)
          Passive Scanning State
            and Connection State (Peripheral Role)
          Active Scanning State
            and Connection State (Peripheral Role)
          Initiating State
            and Connection State (Central Role)
            and Central Role & Central Role
          Low Duty Cycle Directed Advertising State
          Connectable Advertising State
            and Initiating State
            and Central Role & Peripheral Role
          High Duty Cycle Directed Advertising State
            and Initiating State
            and Central Role & Peripheral Role
          Low Duty Cycle Directed Advertising State
            and Initiating State
            and Central Role & Peripheral Role
          Connectable Advertising State
            and Connection State (Central Role)
            and Central Role & Peripheral Role
          High Duty Cycle Directed Advertising State
            and Connection State (Central Role)
            and Central Role & Peripheral Role
          Low Duty Cycle Directed Advertising State
            and Connection State (Central Role)
            and Central Role & Peripheral Role
          Connectable Advertising State
            and Connection State (Peripheral Role)
            and Central Role & Peripheral Role
          High Duty Cycle Directed Advertising State
            and Connection State (Peripheral Role)
            and Peripheral Role & Peripheral Role
          Low Duty Cycle Directed Advertising State
            and Connection State (Peripheral Role)
            and Peripheral Role & Peripheral Role
          Initiating State
            and Connection State (Peripheral Role)
            and Central Role & Peripheral Role
< HCI Command: LE Read Maximum Data.. (0x08|0x002f) plen 0  #23 [hci1] 0.936442
> HCI Event: Command Complete (0x0e) plen 12                #24 [hci1] 0.936888
      LE Read Maximum Data Length (0x08|0x002f) ncmd 1
        Status: Success (0x00)
        Max TX octets: 251
        Max TX time: 2704
        Max RX octets: 251
        Max RX time: 2704
< HCI Command: LE Write Suggested D.. (0x08|0x0024) plen 4  #25 [hci1] 0.956470
        TX octets: 251
        TX time: 2704
> HCI Event: Command Complete (0x0e) plen 4                 #26 [hci1] 0.957036
      LE Write Suggested Default Data Length (0x08|0x0024) ncmd 1
        Status: Success (0x00)
< HCI Command: LE Read Resolving Li.. (0x08|0x002a) plen 0  #27 [hci1] 0.976470
> HCI Event: Command Complete (0x0e) plen 5                 #28 [hci1] 0.976982
      LE Read Resolving List Size (0x08|0x002a) ncmd 1
        Status: Success (0x00)
        Size: 8
< HCI Command: LE Set Event Mask (0x08|0x0001) plen 8       #29 [hci1] 0.996472
        Mask: 0x000002023f87fa5e
          LE Advertising Report
          LE Connection Update Complete
          LE Read Remote Used Features Complete
          LE Long Term Key Request
          LE Data Length Change
          LE Enhanced Connection Complete
          LE PHY Update Complete
          LE Extended Advertising Report
          LE Periodic Advertising Sync Established
          LE Periodic Advertising Report
          LE Periodic Advertising Sync Lost
          LE Extended Scan Timeout
          LE Extended Advertising Set Terminated
          LE Scan Request Received
          LE Periodic Advertising Sync Transfer Rvc
          LE CIS Established
          LE CIS Request
          LE Create BIG Complete
          LE Terminate BIG Complete
          LE BIG Sync Estabilished Complete
          LE BIG Sync Lost
          LE BIG Info Advertising Report
          Unknown mask (0x0000020000000000)
> HCI Event: Command Complete (0x0e) plen 4                 #30 [hci1] 0.996942
      LE Set Event Mask (0x08|0x0001) ncmd 1
        Status: Success (0x00)
< HCI Command: Set Event Mask (0x03|0x0001) plen 8          #31 [hci1] 1.016448
        Mask: 0x2000800002008890
          Disconnection Complete
          Encryption Change
          Read Remote Version Information Complete
          Hardware Error
          Data Buffer Overflow
          Encryption Key Refresh Complete
          LE Meta
> HCI Event: Command Complete (0x0e) plen 4                 #32 [hci1] 1.016956
      Set Event Mask (0x03|0x0001) ncmd 1
        Status: Success (0x00)
< HCI Command: Read BD ADDR (0x04|0x0009) plen 0            #33 [hci1] 1.036441
> HCI Event: Command Complete (0x0e) plen 10                #34 [hci1] 1.036960
      Read BD ADDR (0x04|0x0009) ncmd 1
        Status: Success (0x00)
        Address: 00:00:00:00:00:00 (OUI 00-00-00)
< HCI Command: LE Set Random Address (0x08|0x0005) plen 6   #35 [hci1] 1.056448
        Address: D5:B6:CC:31:DB:3B (Static)
> HCI Event: Command Complete (0x0e) plen 4                 #36 [hci1] 1.056984
      LE Set Random Address (0x08|0x0005) ncmd 1
        Status: Success (0x00)
< HCI Command: LE Set Extended Adv.. (0x08|0x0036) plen 25  #37 [hci1] 6.587032
        Handle: 0x00
        Properties: 0x0013
          Connectable
          Scannable
          Use legacy advertising PDUs: ADV_IND
        Min advertising interval: 100.000 msec (0x00a0)
        Max advertising interval: 150.000 msec (0x00f0)
        Channel map: 37, 38, 39 (0x07)
        Own address type: Random (0x01)
        Peer address type: Public (0x00)
        Peer address: 00:00:00:00:00:00 (OUI 00-00-00)
        Filter policy: Allow Scan Request from Any, Allow Connect Request from Any (0x00)
        TX power: Host has no preference (0x7f)
        Primary PHY: LE 1M (0x01)
        Secondary max skip: 0x00
        Secondary PHY: LE 1M (0x01)
        SID: 0x00
        Scan request notifications: Disabled (0x00)
> HCI Event: Command Complete (0x0e) plen 5                 #38 [hci1] 6.587900
      LE Set Extended Advertising Parameters (0x08|0x0036) ncmd 1
        Status: Success (0x00)
        TX power (selected): 0 dbm (0x00)
< HCI Command: LE Set Advertising S.. (0x08|0x0035) plen 7  #39 [hci1] 6.596528
        Advertising handle: 0x00
        Advertising random address: D5:B6:CC:31:DB:3B (Static)
> HCI Event: Command Complete (0x0e) plen 4                 #40 [hci1] 6.597034
      LE Set Advertising Set Random Address (0x08|0x0035) ncmd 1
        Status: Success (0x00)
< HCI Command: LE Set Extended Adv.. (0x08|0x0037) plen 22  #41 [hci1] 6.616653
        Handle: 0x00
        Operation: Complete extended advertising data (0x03)
        Fragment preference: Minimize fragmentation (0x01)
        Data length: 0x12
        Flags: 0x06
          LE General Discoverable Mode
          BR/EDR Not Supported
        Name (complete): Tester_F6B11A
> HCI Event: Command Complete (0x0e) plen 4                 #42 [hci1] 6.617339
      LE Set Extended Advertising Data (0x08|0x0037) ncmd 1
        Status: Success (0x00)
< HCI Command: LE Set Extended Scan.. (0x08|0x0038) plen 4  #43 [hci1] 6.636522
        Handle: 0x00
        Operation: Complete scan response data (0x03)
        Fragment preference: Minimize fragmentation (0x01)
        Data length: 0x00
> HCI Event: Command Complete (0x0e) plen 4                 #44 [hci1] 6.637000
      LE Set Extended Scan Response Data (0x08|0x0038) ncmd 1
        Status: Success (0x00)
< HCI Command: LE Set Extended Adve.. (0x08|0x0039) plen 6  #45 [hci1] 6.656517
        Extended advertising: Enabled (0x01)
        Number of sets: 1 (0x01)
        Entry 0
          Handle: 0x00
          Duration: 0 ms (0x00)
          Max ext adv events: 0
> HCI Event: Command Complete (0x0e) plen 4                 #46 [hci1] 6.657132
      LE Set Extended Advertising Enable (0x08|0x0039) ncmd 1
        Status: Success (0x00)
> HCI Event: LE Meta Event (0x3e) plen 31                   #47 [hci1] 6.764067
      LE Enhanced Connection Complete (0x0a)
        Status: Success (0x00)
        Handle: 3495
        Role: Peripheral (0x01)
        Peer address type: Public (0x00)
        Peer address: DF:A9:FF:F6:B1:1A (OUI DF-A9-FF)
        Local resolvable private address: 00:00:00:00:00:00 (Non-Resolvable)
        Peer resolvable private address: 00:00:00:00:00:00 (Non-Resolvable)
        Connection interval: 87.50 msec (0x0046)
        Connection latency: 0 (0x0000)
        Supervision timeout: 25120 msec (0x09d0)
        Central clock accuracy: 0x01
> HCI Event: LE Meta Event (0x3e) plen 6                    #48 [hci1] 6.764183
      LE Advertising Set Terminated (0x12)
        Status: Success (0x00)
        Handle: 0
        Connection handle: 3495
        Number of completed extended advertising events: 0
< HCI Command: LE Read Remote Used... (0x08|0x0016) plen 2  #49 [hci1] 6.777775
        Handle: 3495 Address: DF:A9:FF:F6:B1:1A (OUI DF-A9-FF)
< ACL Data TX: Handle 3495 flags 0x00 dlen 7                #50 [hci1] 6.777799
      ATT: Exchange MTU Request (0x02) len 2
        Client RX MTU: 251
> HCI Event: Command Status (0x0f) plen 4                   #51 [hci1] 6.778213
      LE Read Remote Used Features (0x08|0x0016) ncmd 1
        Status: Success (0x00)
> HCI Event: Number of Completed Packets (0x13) plen 5      #52 [hci1] 6.940070
        Num handles: 1
        Handle: 3495 Address: DF:A9:FF:F6:B1:1A (OUI DF-A9-FF)
        Count: 1
        #50: len 7 (0 Kb/s)
        Latency: 162 msec (162-162 msec ~162 msec)
> HCI Event: LE Meta Event (0x3e) plen 12                   #53 [hci1] 7.027901
      LE Read Remote Used Features (0x04)
        Status: Success (0x00)
        Handle: 3495 Address: DF:A9:FF:F6:B1:1A (OUI DF-A9-FF)
        Features: 0x2d 0x49 0x00 0xf7 0x67 0xd9 0x00 0x80
          LE Encryption
          Extended Reject Indication
          Peripheral-initiated Features Exchange
          LE Data Packet Length Extension
          LE 2M PHY
          LE Coded PHY
          Channel Selection Algorithm #2
          Periodic Advertising Sync Transfer - Sender
          Periodic Advertising Sync Transfer - Recipient
          Sleep Clock Accuracy Updates
          Connected Isochronous Stream - Central
          Connected Isochronous Stream - Peripheral
          Isochronous Broadcaster
          Synchronized Receiver
          Connected Isochronous Stream (Host Support)
          LE Power Control Request
          LE Power Control Request
          Connection Subrating
          Connection Subrating (Host Support)
          Unknown features (0x8000d90000000000)
> ACL Data RX: Handle 3495 flags 0x02 dlen 11               #54 [hci1] 9.477630
      SMP: Pairing Request (0x01) len 6
        IO capability: KeyboardDisplay (0x04)
        OOB data: Authentication data not present (0x00)
        Authentication requirement: Bonding, MITM, SC, No Keypresses (0x0d)
        Max encryption key size: 16
        Initiator key distribution: EncKey IdKey (0x03)
        Responder key distribution: EncKey IdKey Sign (0x07)
< HCI Command: Host Number of Compl.. (0x03|0x0035) plen 5  #55 [hci1] 9.496764
        Num handles: 1
        Handle: 3495 Address: DF:A9:FF:F6:B1:1A (OUI DF-A9-FF)
        Count: 1
< ACL Data TX: Handle 3495 flags 0x00 dlen 11               #56 [hci1] 9.496815
      SMP: Pairing Response (0x02) len 6
        IO capability: DisplayOnly (0x00)
        OOB data: Authentication data not present (0x00)
        Authentication requirement: Bonding, No MITM, SC, No Keypresses (0x09)
        Max encryption key size: 16
        Initiator key distribution: IdKey (0x02)
        Responder key distribution: <none> (0x00)
> ACL Data RX: Handle 3495 flags 0x02 dlen 7                #57 [hci1] 9.565154
      ATT: Exchange MTU Response (0x03) len 2
        Server RX MTU: 23
< HCI Command: Host Number of Compl.. (0x03|0x0035) plen 5  #58 [hci1] 9.577034
        Num handles: 1
        Handle: 3495 Address: DF:A9:FF:F6:B1:1A (OUI DF-A9-FF)
        Count: 1
> HCI Event: Number of Completed Packets (0x13) plen 5      #59 [hci1] 9.652751
        Num handles: 1
        Handle: 3495 Address: DF:A9:FF:F6:B1:1A (OUI DF-A9-FF)
        Count: 1
        #56: len 11 (0 Kb/s)
        Latency: 155 msec (155-162 msec ~159 msec)
> ACL Data RX: Handle 3495 flags 0x02 dlen 27               #60 [hci1] 9.653236
> ACL Data RX: Handle 3495 flags 0x01 dlen 27               #61 [hci1] 9.653595
> ACL Data RX: Handle 3495 flags 0x01 dlen 15               #62 [hci1] 9.654067
      SMP: Pairing Public Key (0x0c) len 64
        X: 443740d1cfb526b5b782394b746c97c64a2fc4e24493d6431d9a338356a683b3
        Y: 22aa3be87816665433a1231f34c5f3d6dbc68b560b3ad7589e30cdbb13f0d8e9
< HCI Command: Host Number of Compl.. (0x03|0x0035) plen 5  #63 [hci1] 9.657439
        Num handles: 1
        Handle: 3495 Address: DF:A9:FF:F6:B1:1A (OUI DF-A9-FF)
        Count: 1
< HCI Command: Host Number of Compl.. (0x03|0x0035) plen 5  #64 [hci1] 9.657706
        Num handles: 1
        Handle: 3495 Address: DF:A9:FF:F6:B1:1A (OUI DF-A9-FF)
        Count: 1
< HCI Command: Host Number of Compl.. (0x03|0x0035) plen 5  #65 [hci1] 9.658087
        Num handles: 1
        Handle: 3495 Address: DF:A9:FF:F6:B1:1A (OUI DF-A9-FF)
        Count: 1
< ACL Data TX: Handle 3495 flags 0x00 dlen 27               #66 [hci1] 9.658230
< ACL Data TX: Handle 3495 flags 0x01 dlen 27               #67 [hci1] 9.658267
< ACL Data TX: Handle 3495 flags 0x01 dlen 15               #68 [hci1] 9.658306
      SMP: Pairing Public Key (0x0c) len 64
        X: 98308440221e2d910f0e54b71e7ec652857aa9b5a0dc65028824cc19db1226e9
        Y: 67a4816bcb62efb21701e31fdb27561a6217575fb007a8bbdabe7e28b6f68482
> HCI Event: Number of Completed Packets (0x13) plen 5      #69 [hci1] 9.740621
        Num handles: 1
        Handle: 3495 Address: DF:A9:FF:F6:B1:1A (OUI DF-A9-FF)
        Count: 1
        #66: len 27 (2 Kb/s)
        Latency: 82 msec (82-162 msec ~120 msec)
> HCI Event: Number of Completed Packets (0x13) plen 5      #70 [hci1] 9.741345
        Num handles: 1
        Handle: 3495 Address: DF:A9:FF:F6:B1:1A (OUI DF-A9-FF)
        Count: 1
        #67: len 27 (2 Kb/s)
        Latency: 83 msec (82-162 msec ~101 msec)
> HCI Event: Number of Completed Packets (0x13) plen 5      #71 [hci1] 9.827547
        Num handles: 1
        Handle: 3495 Address: DF:A9:FF:F6:B1:1A (OUI DF-A9-FF)
        Count: 1
        #68: len 15 (0 Kb/s)
        Latency: 169 msec (82-169 msec ~135 msec)
> ACL Data RX: Handle 3495 flags 0x02 dlen 21              #72 [hci1] 10.790281
      SMP: Pairing Confirm (0x03) len 16
        Confim value: 229131825819925fa352eca21b89ae3e
< HCI Command: Host Number of Comp.. (0x03|0x0035) plen 5  #73 [hci1] 10.796874
        Num handles: 1
        Handle: 3495 Address: DF:A9:FF:F6:B1:1A (OUI DF-A9-FF)
        Count: 1
< ACL Data TX: Handle 3495 flags 0x00 dlen 21              #74 [hci1] 10.796976
      SMP: Pairing Confirm (0x03) len 16
        Confim value: 558e893bc532c9a69a9409bd1b184219
> HCI Event: Number of Completed Packets (0x13) plen 5     #75 [hci1] 10.965210
        Num handles: 1
        Handle: 3495 Address: DF:A9:FF:F6:B1:1A (OUI DF-A9-FF)
        Count: 1
        #74: len 21 (1 Kb/s)
        Latency: 168 msec (82-169 msec ~151 msec)
> ACL Data RX: Handle 3495 flags 0x02 dlen 21              #76 [hci1] 10.965517
      SMP: Pairing Random (0x04) len 16
        Random value: a095c125b9a5e1790000000000000000
< HCI Command: Host Number of Comp.. (0x03|0x0035) plen 5  #77 [hci1] 10.977468
        Num handles: 1
        Handle: 3495 Address: DF:A9:FF:F6:B1:1A (OUI DF-A9-FF)
        Count: 1
< ACL Data TX: Handle 3495 flags 0x00 dlen 21              #78 [hci1] 10.977664
      SMP: Pairing Random (0x04) len 16
        Random value: 8e6108f966a694cbe26df70bb96773e6
> HCI Event: Number of Completed Packets (0x13) plen 5     #79 [hci1] 11.139951
        Num handles: 1
        Handle: 3495 Address: DF:A9:FF:F6:B1:1A (OUI DF-A9-FF)
        Count: 1
        #78: len 21 (1 Kb/s)
        Latency: 162 msec (82-169 msec ~157 msec)
> ACL Data RX: Handle 3495 flags 0x02 dlen 21              #80 [hci1] 11.227783
      SMP: Pairing Confirm (0x03) len 16
        Confim value: 5209023989bca946917495a518abdbf4
< HCI Command: Host Number of Comp.. (0x03|0x0035) plen 5  #81 [hci1] 11.236614
        Num handles: 1
        Handle: 3495 Address: DF:A9:FF:F6:B1:1A (OUI DF-A9-FF)
        Count: 1
< ACL Data TX: Handle 3495 flags 0x00 dlen 21              #82 [hci1] 11.236687
      SMP: Pairing Confirm (0x03) len 16
        Confim value: 54e460ac8f42b9aaaf4e262976ce2cb9
> HCI Event: Number of Completed Packets (0x13) plen 5     #83 [hci1] 11.402634
        Num handles: 1
        Handle: 3495 Address: DF:A9:FF:F6:B1:1A (OUI DF-A9-FF)
        Count: 1
        #82: len 21 (1 Kb/s)
        Latency: 165 msec (82-169 msec ~161 msec)
> ACL Data RX: Handle 3495 flags 0x02 dlen 21              #84 [hci1] 11.403097
      SMP: Pairing Random (0x04) len 16
        Random value: 66fe542787dbcaab0000000000000000
< HCI Command: Host Number of Comp.. (0x03|0x0035) plen 5  #85 [hci1] 11.417607
        Num handles: 1
        Handle: 3495 Address: DF:A9:FF:F6:B1:1A (OUI DF-A9-FF)
        Count: 1
< ACL Data TX: Handle 3495 flags 0x00 dlen 21              #86 [hci1] 11.417790
      SMP: Pairing Random (0x04) len 16
        Random value: 4d02679f89a05211af56d8b3da64d21e
> HCI Event: Number of Completed Packets (0x13) plen 5     #87 [hci1] 11.577620
        Num handles: 1
        Handle: 3495 Address: DF:A9:FF:F6:B1:1A (OUI DF-A9-FF)
        Count: 1
        #86: len 21 (1 Kb/s)
        Latency: 159 msec (82-169 msec ~160 msec)
> ACL Data RX: Handle 3495 flags 0x02 dlen 21              #88 [hci1] 11.665289
      SMP: Pairing Confirm (0x03) len 16
        Confim value: 74bc1fecee79d1ce97d1d055284d3d30
< HCI Command: Host Number of Comp.. (0x03|0x0035) plen 5  #89 [hci1] 11.677291
        Num handles: 1
        Handle: 3495 Address: DF:A9:FF:F6:B1:1A (OUI DF-A9-FF)
        Count: 1
< ACL Data TX: Handle 3495 flags 0x00 dlen 21              #90 [hci1] 11.677427
      SMP: Pairing Confirm (0x03) len 16
        Confim value: c32359bf886188ef6934282797214757
> HCI Event: Number of Completed Packets (0x13) plen 5     #91 [hci1] 11.840251
        Num handles: 1
        Handle: 3495 Address: DF:A9:FF:F6:B1:1A (OUI DF-A9-FF)
        Count: 1
        #90: len 21 (1 Kb/s)
        Latency: 162 msec (82-169 msec ~161 msec)
> ACL Data RX: Handle 3495 flags 0x02 dlen 21              #92 [hci1] 11.840571
      SMP: Pairing Random (0x04) len 16
        Random value: f71f90d0770b4b3d0000000000000000
< HCI Command: Host Number of Comp.. (0x03|0x0035) plen 5  #93 [hci1] 11.857461
        Num handles: 1
        Handle: 3495 Address: DF:A9:FF:F6:B1:1A (OUI DF-A9-FF)
        Count: 1
< ACL Data TX: Handle 3495 flags 0x00 dlen 21              #94 [hci1] 11.857649
      SMP: Pairing Random (0x04) len 16
        Random value: 5e8286bc235a02440d0c3424a2acf8fd
> HCI Event: Number of Completed Packets (0x13) plen 5     #95 [hci1] 12.014924
        Num handles: 1
        Handle: 3495 Address: DF:A9:FF:F6:B1:1A (OUI DF-A9-FF)
        Count: 1
        #94: len 21 (1 Kb/s)
        Latency: 157 msec (82-169 msec ~159 msec)
> ACL Data RX: Handle 3495 flags 0x02 dlen 21              #96 [hci1] 12.102894
      SMP: Pairing Confirm (0x03) len 16
        Confim value: 447a63b84a860591e9c11dd5d716ea90
< HCI Command: Host Number of Comp.. (0x03|0x0035) plen 5  #97 [hci1] 12.117179
        Num handles: 1
        Handle: 3495 Address: DF:A9:FF:F6:B1:1A (OUI DF-A9-FF)
        Count: 1
< ACL Data TX: Handle 3495 flags 0x00 dlen 21              #98 [hci1] 12.117276
      SMP: Pairing Confirm (0x03) len 16
        Confim value: dd256b4074776a148e464e2ede8f7b8f
> HCI Event: Number of Completed Packets (0x13) plen 5     #99 [hci1] 12.277644
        Num handles: 1
        Handle: 3495 Address: DF:A9:FF:F6:B1:1A (OUI DF-A9-FF)
        Count: 1
        #98: len 21 (1 Kb/s)
        Latency: 160 msec (82-169 msec ~159 msec)
> ACL Data RX: Handle 3495 flags 0x02 dlen 21             #100 [hci1] 12.278053
      SMP: Pairing Random (0x04) len 16
        Random value: c8937d88f7e264730000000000000000
< HCI Command: Host Number of Com.. (0x03|0x0035) plen 5  #101 [hci1] 12.297456
        Num handles: 1
        Handle: 3495 Address: DF:A9:FF:F6:B1:1A (OUI DF-A9-FF)
        Count: 1
< ACL Data TX: Handle 3495 flags 0x00 dlen 21             #102 [hci1] 12.297631
      SMP: Pairing Random (0x04) len 16
        Random value: 5c4a1bcadd27bd58e945097b00bad7ac
> HCI Event: Number of Completed Packets (0x13) plen 5    #103 [hci1] 12.452461
        Num handles: 1
        Handle: 3495 Address: DF:A9:FF:F6:B1:1A (OUI DF-A9-FF)
        Count: 1
        #102: len 21 (1 Kb/s)
        Latency: 154 msec (82-169 msec ~157 msec)
> ACL Data RX: Handle 3495 flags 0x02 dlen 21             #104 [hci1] 12.540341
      SMP: Pairing Confirm (0x03) len 16
        Confim value: be9a6e91eb058bba5f4f81a87c9c6f46
< HCI Command: Host Number of Com.. (0x03|0x0035) plen 5  #105 [hci1] 12.557185
        Num handles: 1
        Handle: 3495 Address: DF:A9:FF:F6:B1:1A (OUI DF-A9-FF)
        Count: 1
< ACL Data TX: Handle 3495 flags 0x00 dlen 21             #106 [hci1] 12.557290
      SMP: Pairing Confirm (0x03) len 16
        Confim value: a0332933115f11b2ac6c65fefbf7240f
> HCI Event: Number of Completed Packets (0x13) plen 5    #107 [hci1] 12.715279
        Num handles: 1
        Handle: 3495 Address: DF:A9:FF:F6:B1:1A (OUI DF-A9-FF)
        Count: 1
        #106: len 21 (1 Kb/s)
        Latency: 157 msec (82-169 msec ~157 msec)
> ACL Data RX: Handle 3495 flags 0x02 dlen 21             #108 [hci1] 12.715477
      SMP: Pairing Random (0x04) len 16
        Random value: 614e8e740924f9560000000000000000
< HCI Command: Host Number of Com.. (0x03|0x0035) plen 5  #109 [hci1] 12.717356
        Num handles: 1
        Handle: 3495 Address: DF:A9:FF:F6:B1:1A (OUI DF-A9-FF)
        Count: 1
< ACL Data TX: Handle 3495 flags 0x00 dlen 21             #110 [hci1] 12.717535
      SMP: Pairing Random (0x04) len 16
        Random value: 32527e6e64e79f33b2e374394db8ab2d
> HCI Event: Number of Completed Packets (0x13) plen 5    #111 [hci1] 12.889917
        Num handles: 1
        Handle: 3495 Address: DF:A9:FF:F6:B1:1A (OUI DF-A9-FF)
        Count: 1
        #110: len 21 (0 Kb/s)
        Latency: 172 msec (82-172 msec ~165 msec)
> ACL Data RX: Handle 3495 flags 0x02 dlen 21             #112 [hci1] 12.977770
      SMP: Pairing Confirm (0x03) len 16
        Confim value: e279f68502903ba6ddbb3ddd454a4c40
< HCI Command: Host Number of Com.. (0x03|0x0035) plen 5  #113 [hci1] 12.997065
        Num handles: 1
        Handle: 3495 Address: DF:A9:FF:F6:B1:1A (OUI DF-A9-FF)
        Count: 1
< ACL Data TX: Handle 3495 flags 0x00 dlen 21             #114 [hci1] 12.997192
      SMP: Pairing Confirm (0x03) len 16
        Confim value: 015e3ae3842758e2f6c34ddecb67b9f1
> HCI Event: Number of Completed Packets (0x13) plen 5    #115 [hci1] 13.152705
        Num handles: 1
        Handle: 3495 Address: DF:A9:FF:F6:B1:1A (OUI DF-A9-FF)
        Count: 1
        #114: len 21 (1 Kb/s)
        Latency: 155 msec (82-172 msec ~160 msec)
> ACL Data RX: Handle 3495 flags 0x02 dlen 21             #116 [hci1] 13.152967
      SMP: Pairing Random (0x04) len 16
        Random value: 4e0de5e19c9e4da40000000000000000
< HCI Command: Host Number of Com.. (0x03|0x0035) plen 5  #117 [hci1] 13.157342
        Num handles: 1
        Handle: 3495 Address: DF:A9:FF:F6:B1:1A (OUI DF-A9-FF)
        Count: 1
< ACL Data TX: Handle 3495 flags 0x00 dlen 21             #118 [hci1] 13.157495
      SMP: Pairing Random (0x04) len 16
        Random value: dddbdfe2838e9a8cc6964353c850fef7
> HCI Event: Number of Completed Packets (0x13) plen 5    #119 [hci1] 13.327516
        Num handles: 1
        Handle: 3495 Address: DF:A9:FF:F6:B1:1A (OUI DF-A9-FF)
        Count: 1
        #118: len 21 (0 Kb/s)
        Latency: 170 msec (82-172 msec ~165 msec)
> ACL Data RX: Handle 3495 flags 0x02 dlen 21             #120 [hci1] 13.415281
      SMP: Pairing Confirm (0x03) len 16
        Confim value: 7e1c5f80199f263ded3dc60a1f56b74f
< HCI Command: Host Number of Com.. (0x03|0x0035) plen 5  #121 [hci1] 13.416887
        Num handles: 1
        Handle: 3495 Address: DF:A9:FF:F6:B1:1A (OUI DF-A9-FF)
        Count: 1
< ACL Data TX: Handle 3495 flags 0x00 dlen 21             #122 [hci1] 13.416988
      SMP: Pairing Confirm (0x03) len 16
        Confim value: 9e812e9e8acf374b80d2aabe7a60a42b
> HCI Event: Number of Completed Packets (0x13) plen 5    #123 [hci1] 13.590165
        Num handles: 1
        Handle: 3495 Address: DF:A9:FF:F6:B1:1A (OUI DF-A9-FF)
        Count: 1
        #122: len 21 (0 Kb/s)
        Latency: 173 msec (82-173 msec ~169 msec)
> ACL Data RX: Handle 3495 flags 0x02 dlen 21             #124 [hci1] 13.590555
      SMP: Pairing Random (0x04) len 16
        Random value: ff05017d3ac9807f0000000000000000
< HCI Command: Host Number of Com.. (0x03|0x0035) plen 5  #125 [hci1] 13.597403
        Num handles: 1
        Handle: 3495 Address: DF:A9:FF:F6:B1:1A (OUI DF-A9-FF)
        Count: 1
< ACL Data TX: Handle 3495 flags 0x00 dlen 21             #126 [hci1] 13.597578
      SMP: Pairing Random (0x04) len 16
        Random value: eb9f1915536596b6fc3db1c86b2b1970
> HCI Event: Number of Completed Packets (0x13) plen 5    #127 [hci1] 13.765041
        Num handles: 1
        Handle: 3495 Address: DF:A9:FF:F6:B1:1A (OUI DF-A9-FF)
        Count: 1
        #126: len 21 (1 Kb/s)
        Latency: 167 msec (82-173 msec ~168 msec)
> ACL Data RX: Handle 3495 flags 0x02 dlen 21             #128 [hci1] 13.852812
      SMP: Pairing Confirm (0x03) len 16
        Confim value: 54898da5af6efd179578abbb6724b437
< HCI Command: Host Number of Com.. (0x03|0x0035) plen 5  #129 [hci1] 13.857166
        Num handles: 1
        Handle: 3495 Address: DF:A9:FF:F6:B1:1A (OUI DF-A9-FF)
        Count: 1
< ACL Data TX: Handle 3495 flags 0x00 dlen 21             #130 [hci1] 13.857264
      SMP: Pairing Confirm (0x03) len 16
        Confim value: 725fc434cc894558eae3cbb0d0f9b30d
> HCI Event: Number of Completed Packets (0x13) plen 5    #131 [hci1] 14.027658
        Num handles: 1
        Handle: 3495 Address: DF:A9:FF:F6:B1:1A (OUI DF-A9-FF)
        Count: 1
        #130: len 21 (0 Kb/s)
        Latency: 170 msec (82-173 msec ~169 msec)
> ACL Data RX: Handle 3495 flags 0x02 dlen 21             #132 [hci1] 14.027984
      SMP: Pairing Random (0x04) len 16
        Random value: b25bc10fe22a2be20000000000000000
< HCI Command: Host Number of Com.. (0x03|0x0035) plen 5  #133 [hci1] 14.037453
        Num handles: 1
        Handle: 3495 Address: DF:A9:FF:F6:B1:1A (OUI DF-A9-FF)
        Count: 1
< ACL Data TX: Handle 3495 flags 0x00 dlen 21             #134 [hci1] 14.037550
      SMP: Pairing Random (0x04) len 16
        Random value: 5c794dc9ad9f2c3f295ebd5ad5e1c3cf
> HCI Event: Number of Completed Packets (0x13) plen 5    #135 [hci1] 14.202415
        Num handles: 1
        Handle: 3495 Address: DF:A9:FF:F6:B1:1A (OUI DF-A9-FF)
        Count: 1
        #134: len 21 (1 Kb/s)
        Latency: 164 msec (82-173 msec ~167 msec)
> ACL Data RX: Handle 3495 flags 0x02 dlen 21             #136 [hci1] 14.290261
      SMP: Pairing Confirm (0x03) len 16
        Confim value: 77930db9447b8aa71975fc5755bfa77a
< HCI Command: Host Number of Com.. (0x03|0x0035) plen 5  #137 [hci1] 14.297076
        Num handles: 1
        Handle: 3495 Address: DF:A9:FF:F6:B1:1A (OUI DF-A9-FF)
        Count: 1
< ACL Data TX: Handle 3495 flags 0x00 dlen 21             #138 [hci1] 14.297151
      SMP: Pairing Confirm (0x03) len 16
        Confim value: 43d5e726ee7f11f63a7afc482dd3a001
> HCI Event: Number of Completed Packets (0x13) plen 5    #139 [hci1] 14.465086
        Num handles: 1
        Handle: 3495 Address: DF:A9:FF:F6:B1:1A (OUI DF-A9-FF)
        Count: 1
        #138: len 21 (1 Kb/s)
        Latency: 167 msec (82-173 msec ~167 msec)
> ACL Data RX: Handle 3495 flags 0x02 dlen 21             #140 [hci1] 14.465458
      SMP: Pairing Random (0x04) len 16
        Random value: ec4c4fc9309a704d0000000000000000
< HCI Command: Host Number of Com.. (0x03|0x0035) plen 5  #141 [hci1] 14.476912
        Num handles: 1
        Handle: 3495 Address: DF:A9:FF:F6:B1:1A (OUI DF-A9-FF)
        Count: 1
< ACL Data TX: Handle 3495 flags 0x00 dlen 21             #142 [hci1] 14.476989
      SMP: Pairing Random (0x04) len 16
        Random value: 5c2fff312cdf99c9491988e877355a9a
> HCI Event: Number of Completed Packets (0x13) plen 5    #143 [hci1] 14.639944
        Num handles: 1
        Handle: 3495 Address: DF:A9:FF:F6:B1:1A (OUI DF-A9-FF)
        Count: 1
        #142: len 21 (1 Kb/s)
        Latency: 162 msec (82-173 msec ~165 msec)
> ACL Data RX: Handle 3495 flags 0x02 dlen 21             #144 [hci1] 14.727823
      SMP: Pairing Confirm (0x03) len 16
        Confim value: e53e20117d31030729b3efdb3523f069
< HCI Command: Host Number of Com.. (0x03|0x0035) plen 5  #145 [hci1] 14.737117
        Num handles: 1
        Handle: 3495 Address: DF:A9:FF:F6:B1:1A (OUI DF-A9-FF)
        Count: 1
< ACL Data TX: Handle 3495 flags 0x00 dlen 21             #146 [hci1] 14.737232
      SMP: Pairing Confirm (0x03) len 16
        Confim value: 9a0a4b6c6da99ce29059ec36c2272bb4
> HCI Event: Number of Completed Packets (0x13) plen 5    #147 [hci1] 14.902744
        Num handles: 1
        Handle: 3495 Address: DF:A9:FF:F6:B1:1A (OUI DF-A9-FF)
        Count: 1
        #146: len 21 (1 Kb/s)
        Latency: 165 msec (82-173 msec ~165 msec)
> ACL Data RX: Handle 3495 flags 0x02 dlen 21             #148 [hci1] 14.903045
      SMP: Pairing Random (0x04) len 16
        Random value: 705e3e0c6b12f3fa0000000000000000
< HCI Command: Host Number of Com.. (0x03|0x0035) plen 5  #149 [hci1] 14.917281
        Num handles: 1
        Handle: 3495 Address: DF:A9:FF:F6:B1:1A (OUI DF-A9-FF)
        Count: 1
< ACL Data TX: Handle 3495 flags 0x00 dlen 21             #150 [hci1] 14.917518
      SMP: Pairing Random (0x04) len 16
        Random value: c629a3a987d808e808655d558dfc1155
> HCI Event: Number of Completed Packets (0x13) plen 5    #151 [hci1] 15.077380
        Num handles: 1
        Handle: 3495 Address: DF:A9:FF:F6:B1:1A (OUI DF-A9-FF)
        Count: 1
        #150: len 21 (1 Kb/s)
        Latency: 159 msec (82-173 msec ~162 msec)
> ACL Data RX: Handle 3495 flags 0x02 dlen 21             #152 [hci1] 15.165317
      SMP: Pairing Confirm (0x03) len 16
        Confim value: 52e8d821a7e2afb00b8fe734813478af
< HCI Command: Host Number of Com.. (0x03|0x0035) plen 5  #153 [hci1] 15.177096
        Num handles: 1
        Handle: 3495 Address: DF:A9:FF:F6:B1:1A (OUI DF-A9-FF)
        Count: 1
< ACL Data TX: Handle 3495 flags 0x00 dlen 21             #154 [hci1] 15.177224
      SMP: Pairing Confirm (0x03) len 16
        Confim value: 0d20d9f4616c27638fde06e0054b33b0
> HCI Event: Number of Completed Packets (0x13) plen 5    #155 [hci1] 15.340137
        Num handles: 1
        Handle: 3495 Address: DF:A9:FF:F6:B1:1A (OUI DF-A9-FF)
        Count: 1
        #154: len 21 (1 Kb/s)
        Latency: 162 msec (82-173 msec ~162 msec)
> ACL Data RX: Handle 3495 flags 0x02 dlen 21             #156 [hci1] 15.340556
      SMP: Pairing Random (0x04) len 16
        Random value: 0e8b8bed8a502d1c0000000000000000
< HCI Command: Host Number of Com.. (0x03|0x0035) plen 5  #157 [hci1] 15.357505
        Num handles: 1
        Handle: 3495 Address: DF:A9:FF:F6:B1:1A (OUI DF-A9-FF)
        Count: 1
< ACL Data TX: Handle 3495 flags 0x00 dlen 21             #158 [hci1] 15.357685
      SMP: Pairing Random (0x04) len 16
        Random value: 92f20f6ad8f13724432c7fd6001c45ff
> HCI Event: Number of Completed Packets (0x13) plen 5    #159 [hci1] 15.514960
        Num handles: 1
        Handle: 3495 Address: DF:A9:FF:F6:B1:1A (OUI DF-A9-FF)
        Count: 1
        #158: len 21 (1 Kb/s)
        Latency: 157 msec (82-173 msec ~160 msec)
> ACL Data RX: Handle 3495 flags 0x02 dlen 21             #160 [hci1] 15.602767
      SMP: Pairing Confirm (0x03) len 16
        Confim value: a9ab34658aee097e403d0fe5479dac64
< HCI Command: Host Number of Com.. (0x03|0x0035) plen 5  #161 [hci1] 15.617278
        Num handles: 1
        Handle: 3495 Address: DF:A9:FF:F6:B1:1A (OUI DF-A9-FF)
        Count: 1
< ACL Data TX: Handle 3495 flags 0x00 dlen 21             #162 [hci1] 15.617397
      SMP: Pairing Confirm (0x03) len 16
        Confim value: 79e38f660e731fa96afdcd05c88d5310
> HCI Event: Number of Completed Packets (0x13) plen 5    #163 [hci1] 15.777603
        Num handles: 1
        Handle: 3495 Address: DF:A9:FF:F6:B1:1A (OUI DF-A9-FF)
        Count: 1
        #162: len 21 (1 Kb/s)
        Latency: 160 msec (82-173 msec ~160 msec)
> ACL Data RX: Handle 3495 flags 0x02 dlen 21             #164 [hci1] 15.777969
      SMP: Pairing Random (0x04) len 16
        Random value: da0de132d4dad5ca0000000000000000
< HCI Command: Host Number of Com.. (0x03|0x0035) plen 5  #165 [hci1] 15.797554
        Num handles: 1
        Handle: 3495 Address: DF:A9:FF:F6:B1:1A (OUI DF-A9-FF)
        Count: 1
< ACL Data TX: Handle 3495 flags 0x00 dlen 21             #166 [hci1] 15.797682
      SMP: Pairing Random (0x04) len 16
        Random value: 23ac32ebbb5e14c8a6b9622f296d277f
> HCI Event: Number of Completed Packets (0x13) plen 5    #167 [hci1] 15.952463
        Num handles: 1
        Handle: 3495 Address: DF:A9:FF:F6:B1:1A (OUI DF-A9-FF)
        Count: 1
        #166: len 21 (1 Kb/s)
        Latency: 154 msec (82-173 msec ~157 msec)
> ACL Data RX: Handle 3495 flags 0x02 dlen 21             #168 [hci1] 16.040334
      SMP: Pairing Confirm (0x03) len 16
        Confim value: 280a2d9da4be9628a21e87507d769b62
< HCI Command: Host Number of Com.. (0x03|0x0035) plen 5  #169 [hci1] 16.056699
        Num handles: 1
        Handle: 3495 Address: DF:A9:FF:F6:B1:1A (OUI DF-A9-FF)
        Count: 1
< ACL Data TX: Handle 3495 flags 0x00 dlen 21             #170 [hci1] 16.056779
      SMP: Pairing Confirm (0x03) len 16
        Confim value: 51fc9225b6fb02dca2fa6db7da1b88c7
> HCI Event: Number of Completed Packets (0x13) plen 5    #171 [hci1] 16.215158
        Num handles: 1
        Handle: 3495 Address: DF:A9:FF:F6:B1:1A (OUI DF-A9-FF)
        Count: 1
        #170: len 21 (1 Kb/s)
        Latency: 158 msec (82-173 msec ~157 msec)
> ACL Data RX: Handle 3495 flags 0x02 dlen 21             #172 [hci1] 16.215461
      SMP: Pairing Random (0x04) len 16
        Random value: da51fef67e91d1170000000000000000
< HCI Command: Host Number of Com.. (0x03|0x0035) plen 5  #173 [hci1] 16.217041
        Num handles: 1
        Handle: 3495 Address: DF:A9:FF:F6:B1:1A (OUI DF-A9-FF)
        Count: 1
< ACL Data TX: Handle 3495 flags 0x00 dlen 21             #174 [hci1] 16.217125
      SMP: Pairing Random (0x04) len 16
        Random value: 297efe85e67448a15f56bd27e3a3cf1d
> HCI Event: Number of Completed Packets (0x13) plen 5    #175 [hci1] 16.389960
        Num handles: 1
        Handle: 3495 Address: DF:A9:FF:F6:B1:1A (OUI DF-A9-FF)
        Count: 1
        #174: len 21 (0 Kb/s)
        Latency: 172 msec (82-173 msec ~165 msec)
> ACL Data RX: Handle 3495 flags 0x02 dlen 21             #176 [hci1] 16.477717
      SMP: Pairing Confirm (0x03) len 16
        Confim value: 09af2690342df8818f97ad54ac8c5741
< HCI Command: Host Number of Com.. (0x03|0x0035) plen 5  #177 [hci1] 16.497355
        Num handles: 1
        Handle: 3495 Address: DF:A9:FF:F6:B1:1A (OUI DF-A9-FF)
        Count: 1
< ACL Data TX: Handle 3495 flags 0x00 dlen 21             #178 [hci1] 16.497534
      SMP: Pairing Confirm (0x03) len 16
        Confim value: dd9134c21c934f8b584ead14228c26e9
> HCI Event: Number of Completed Packets (0x13) plen 5    #179 [hci1] 16.652558
        Num handles: 1
        Handle: 3495 Address: DF:A9:FF:F6:B1:1A (OUI DF-A9-FF)
        Count: 1
        #178: len 21 (1 Kb/s)
        Latency: 155 msec (82-173 msec ~160 msec)
> ACL Data RX: Handle 3495 flags 0x02 dlen 21             #180 [hci1] 16.652978
      SMP: Pairing Random (0x04) len 16
        Random value: 083c5fb5216174bd0000000000000000
< HCI Command: Host Number of Com.. (0x03|0x0035) plen 5  #181 [hci1] 16.657610
        Num handles: 1
        Handle: 3495 Address: DF:A9:FF:F6:B1:1A (OUI DF-A9-FF)
        Count: 1
< ACL Data TX: Handle 3495 flags 0x00 dlen 21             #182 [hci1] 16.657736
      SMP: Pairing Random (0x04) len 16
        Random value: 25a9493fd3ce4faf02be7293595bb7c6
> HCI Event: Number of Completed Packets (0x13) plen 5    #183 [hci1] 16.827451
        Num handles: 1
        Handle: 3495 Address: DF:A9:FF:F6:B1:1A (OUI DF-A9-FF)
        Count: 1
        #182: len 21 (0 Kb/s)
        Latency: 169 msec (82-173 msec ~164 msec)
> ACL Data RX: Handle 3495 flags 0x02 dlen 21             #184 [hci1] 16.915292
      SMP: Pairing Confirm (0x03) len 16
        Confim value: e98f58a6768ba0d314f5e86ed8ce81e9
< HCI Command: Host Number of Com.. (0x03|0x0035) plen 5  #185 [hci1] 16.917223
        Num handles: 1
        Handle: 3495 Address: DF:A9:FF:F6:B1:1A (OUI DF-A9-FF)
        Count: 1
< ACL Data TX: Handle 3495 flags 0x00 dlen 21             #186 [hci1] 16.917326
      SMP: Pairing Confirm (0x03) len 16
        Confim value: 837e9b369808d81f2457d4e19cb3d262
> HCI Event: Number of Completed Packets (0x13) plen 5    #187 [hci1] 17.090078
        Num handles: 1
        Handle: 3495 Address: DF:A9:FF:F6:B1:1A (OUI DF-A9-FF)
        Count: 1
        #186: len 21 (0 Kb/s)
        Latency: 172 msec (82-173 msec ~168 msec)
> ACL Data RX: Handle 3495 flags 0x02 dlen 21             #188 [hci1] 17.090460
      SMP: Pairing Random (0x04) len 16
        Random value: b1dc287a661479ff0000000000000000
< HCI Command: Host Number of Com.. (0x03|0x0035) plen 5  #189 [hci1] 17.097613
        Num handles: 1
        Handle: 3495 Address: DF:A9:FF:F6:B1:1A (OUI DF-A9-FF)
        Count: 1
< ACL Data TX: Handle 3495 flags 0x00 dlen 21             #190 [hci1] 17.097782
      SMP: Pairing Random (0x04) len 16
        Random value: 58f6b41f855a6f6c3560debd84e2affc
> HCI Event: Number of Completed Packets (0x13) plen 5    #191 [hci1] 17.264922
        Num handles: 1
        Handle: 3495 Address: DF:A9:FF:F6:B1:1A (OUI DF-A9-FF)
        Count: 1
        #190: len 21 (1 Kb/s)
        Latency: 167 msec (82-173 msec ~167 msec)
> ACL Data RX: Handle 3495 flags 0x02 dlen 21             #192 [hci1] 17.352728
      SMP: Pairing Confirm (0x03) len 16
        Confim value: cca5a57b84280aef2101799bfa23a854
< HCI Command: Host Number of Com.. (0x03|0x0035) plen 5  #193 [hci1] 17.357397
        Num handles: 1
        Handle: 3495 Address: DF:A9:FF:F6:B1:1A (OUI DF-A9-FF)
        Count: 1
< ACL Data TX: Handle 3495 flags 0x00 dlen 21             #194 [hci1] 17.357500
      SMP: Pairing Confirm (0x03) len 16
        Confim value: 6efcab9ee4fb80d86e222e95d16a8e4c
> HCI Event: Number of Completed Packets (0x13) plen 5    #195 [hci1] 17.527668
        Num handles: 1
        Handle: 3495 Address: DF:A9:FF:F6:B1:1A (OUI DF-A9-FF)
        Count: 1
        #194: len 21 (0 Kb/s)
        Latency: 170 msec (82-173 msec ~169 msec)
> ACL Data RX: Handle 3495 flags 0x02 dlen 21             #196 [hci1] 17.527985
      SMP: Pairing Random (0x04) len 16
        Random value: 05c5c8e9d647a6f00000000000000000
< HCI Command: Host Number of Com.. (0x03|0x0035) plen 5  #197 [hci1] 17.537445
        Num handles: 1
        Handle: 3495 Address: DF:A9:FF:F6:B1:1A (OUI DF-A9-FF)
        Count: 1
< ACL Data TX: Handle 3495 flags 0x00 dlen 21             #198 [hci1] 17.537610
      SMP: Pairing Random (0x04) len 16
        Random value: b67e7216d5bf664139eda2b542549666
> HCI Event: Number of Completed Packets (0x13) plen 5    #199 [hci1] 17.702322
        Num handles: 1
        Handle: 3495 Address: DF:A9:FF:F6:B1:1A (OUI DF-A9-FF)
        Count: 1
        #198: len 21 (1 Kb/s)
        Latency: 164 msec (82-173 msec ~166 msec)
> ACL Data RX: Handle 3495 flags 0x02 dlen 21             #200 [hci1] 17.790198
      SMP: Pairing Confirm (0x03) len 16
        Confim value: e749b9f8ea201bfef1c58fa252c14238
< HCI Command: Host Number of Com.. (0x03|0x0035) plen 5  #201 [hci1] 17.796921
        Num handles: 1
        Handle: 3495 Address: DF:A9:FF:F6:B1:1A (OUI DF-A9-FF)
        Count: 1
< ACL Data TX: Handle 3495 flags 0x00 dlen 21             #202 [hci1] 17.797023
      SMP: Pairing Confirm (0x03) len 16
        Confim value: ac0a971c3ccd9132651d650e931ee841
> HCI Event: Number of Completed Packets (0x13) plen 5    #203 [hci1] 17.965157
        Num handles: 1
        Handle: 3495 Address: DF:A9:FF:F6:B1:1A (OUI DF-A9-FF)
        Count: 1
        #202: len 21 (1 Kb/s)
        Latency: 168 msec (82-173 msec ~167 msec)
> ACL Data RX: Handle 3495 flags 0x02 dlen 21             #204 [hci1] 17.965455
      SMP: Pairing Random (0x04) len 16
        Random value: e1362395b1a137c00000000000000000
< HCI Command: Host Number of Com.. (0x03|0x0035) plen 5  #205 [hci1] 17.977575
        Num handles: 1
        Handle: 3495 Address: DF:A9:FF:F6:B1:1A (OUI DF-A9-FF)
        Count: 1
< ACL Data TX: Handle 3495 flags 0x00 dlen 21             #206 [hci1] 17.977714
      SMP: Pairing Random (0x04) len 16
        Random value: ed17f76500c95219dd01e09d1e63f87b
> HCI Event: Number of Completed Packets (0x13) plen 5    #207 [hci1] 18.139864
        Num handles: 1
        Handle: 3495 Address: DF:A9:FF:F6:B1:1A (OUI DF-A9-FF)
        Count: 1
        #206: len 21 (1 Kb/s)
        Latency: 162 msec (82-173 msec ~164 msec)
> ACL Data RX: Handle 3495 flags 0x02 dlen 21             #208 [hci1] 18.227904
      SMP: Pairing Confirm (0x03) len 16
        Confim value: 52170d4cacabf734dd3dafba3191fde6
< HCI Command: Host Number of Com.. (0x03|0x0035) plen 5  #209 [hci1] 18.237305
        Num handles: 1
        Handle: 3495 Address: DF:A9:FF:F6:B1:1A (OUI DF-A9-FF)
        Count: 1
< ACL Data TX: Handle 3495 flags 0x00 dlen 21             #210 [hci1] 18.237483
      SMP: Pairing Confirm (0x03) len 16
        Confim value: 3cef22e2f1651d1b922b951312c7a7e9
> HCI Event: Number of Completed Packets (0x13) plen 5    #211 [hci1] 18.402497
        Num handles: 1
        Handle: 3495 Address: DF:A9:FF:F6:B1:1A (OUI DF-A9-FF)
        Count: 1
        #210: len 21 (1 Kb/s)
        Latency: 165 msec (82-173 msec ~164 msec)
> ACL Data RX: Handle 3495 flags 0x02 dlen 21             #212 [hci1] 18.402819
      SMP: Pairing Random (0x04) len 16
        Random value: 8221a2fbbc4567820000000000000000
< HCI Command: Host Number of Com.. (0x03|0x0035) plen 5  #213 [hci1] 18.417553
        Num handles: 1
        Handle: 3495 Address: DF:A9:FF:F6:B1:1A (OUI DF-A9-FF)
        Count: 1
< ACL Data TX: Handle 3495 flags 0x00 dlen 21             #214 [hci1] 18.417721
      SMP: Pairing Random (0x04) len 16
        Random value: 81d35d47e1f6006d79c974bd9d9e1ee3
> HCI Event: Number of Completed Packets (0x13) plen 5    #215 [hci1] 18.577391
        Num handles: 1
        Handle: 3495 Address: DF:A9:FF:F6:B1:1A (OUI DF-A9-FF)
        Count: 1
        #214: len 21 (1 Kb/s)
        Latency: 159 msec (82-173 msec ~162 msec)
> ACL Data RX: Handle 3495 flags 0x02 dlen 21             #216 [hci1] 18.665220
      SMP: Pairing Confirm (0x03) len 16
        Confim value: 1154c4e124b895fdffd249bb5fbc4be4
< HCI Command: Host Number of Com.. (0x03|0x0035) plen 5  #217 [hci1] 18.677279
        Num handles: 1
        Handle: 3495 Address: DF:A9:FF:F6:B1:1A (OUI DF-A9-FF)
        Count: 1
< ACL Data TX: Handle 3495 flags 0x00 dlen 21             #218 [hci1] 18.677414
      SMP: Pairing Confirm (0x03) len 16
        Confim value: 1d40035f3c112b08cbd8b5a90177a0e8
> HCI Event: Number of Completed Packets (0x13) plen 5    #219 [hci1] 18.840054
        Num handles: 1
        Handle: 3495 Address: DF:A9:FF:F6:B1:1A (OUI DF-A9-FF)
        Count: 1
        #218: len 21 (1 Kb/s)
        Latency: 162 msec (82-173 msec ~162 msec)
> ACL Data RX: Handle 3495 flags 0x02 dlen 21             #220 [hci1] 18.840461
      SMP: Pairing Random (0x04) len 16
        Random value: 3e1adbe1c47586540000000000000000
< HCI Command: Host Number of Com.. (0x03|0x0035) plen 5  #221 [hci1] 18.857546
        Num handles: 1
        Handle: 3495 Address: DF:A9:FF:F6:B1:1A (OUI DF-A9-FF)
        Count: 1
< ACL Data TX: Handle 3495 flags 0x00 dlen 21             #222 [hci1] 18.857651
      SMP: Pairing Random (0x04) len 16
        Random value: e7f7e0c2476823e41736a7e381bafb7c
> HCI Event: Number of Completed Packets (0x13) plen 5    #223 [hci1] 19.014886
        Num handles: 1
        Handle: 3495 Address: DF:A9:FF:F6:B1:1A (OUI DF-A9-FF)
        Count: 1
        #222: len 21 (1 Kb/s)
        Latency: 157 msec (82-173 msec ~159 msec)
> ACL Data RX: Handle 3495 flags 0x02 dlen 21             #224 [hci1] 19.102676
      SMP: Pairing Confirm (0x03) len 16
        Confim value: caf2a453a014e2a2d15003dad125369f
< HCI Command: Host Number of Com.. (0x03|0x0035) plen 5  #225 [hci1] 19.117238
        Num handles: 1
        Handle: 3495 Address: DF:A9:FF:F6:B1:1A (OUI DF-A9-FF)
        Count: 1
< ACL Data TX: Handle 3495 flags 0x00 dlen 21             #226 [hci1] 19.117353
      SMP: Pairing Confirm (0x03) len 16
        Confim value: f706cbcf5b3703d47151baf978dfee81
> HCI Event: Number of Completed Packets (0x13) plen 5    #227 [hci1] 19.277506
        Num handles: 1
        Handle: 3495 Address: DF:A9:FF:F6:B1:1A (OUI DF-A9-FF)
        Count: 1
        #226: len 21 (1 Kb/s)
        Latency: 160 msec (82-173 msec ~160 msec)
> ACL Data RX: Handle 3495 flags 0x02 dlen 21             #228 [hci1] 19.278005
      SMP: Pairing Random (0x04) len 16
        Random value: 50668213b54e6f2f0000000000000000
