Bluetooth monitor ver 5.72
= Note: Linux version 6.14.0-36-generic (x86_64)                       0.839962
= Note: Bluetooth subsystem version 2.22                               0.839964
= New Index: 00:00:00:00:00:00 (Primary,UART,hci1)              [hci1] 0.839965
= New Index: 48:5F:99:8E:E0:64 (Primary,USB,hci0)               [hci0] 0.839966
= Open Index: 00:00:00:00:00:00                                 [hci1] 1.353655
= Index Info: 00:00:00:00:00:00 (Nordic Semiconductor ASA)      [hci1] 1.353668
@ USER Open: main (privileged) version 2.22            {0x0001} [hci1] 1.353677
< HCI Command: Reset (0x03|0x0003) plen 0                    #1 [hci1] 1.354964
> HCI Event: Command Complete (0x0e) plen 4                  #2 [hci1] 1.355480
      Reset (0x03|0x0003) ncmd 1
        Status: Success (0x00)
< HCI Command: Read Local Supported... (0x04|0x0003) plen 0  #3 [hci1] 1.373148
> HCI Event: Command Complete (0x0e) plen 12                 #4 [hci1] 1.373671
      Read Local Supported Features (0x04|0x0003) ncmd 1
        Status: Success (0x00)
        Features: 0x00 0x00 0x00 0x00 0x60 0x00 0x00 0x00
          BR/EDR Not Supported
          LE Supported (Controller)
< HCI Command: Read Local Version In.. (0x04|0x0001) plen 0  #5 [hci1] 1.393099
> HCI Event: Command Complete (0x0e) plen 12                 #6 [hci1] 1.393729
      Read Local Version Information (0x04|0x0001) ncmd 1
        Status: Success (0x00)
        HCI version: Reserved (0x0f) - Revision 12393 (0x3069)
        LMP version: Reserved (0x0f) - Subversion 12393 (0x3069)
        Manufacturer: Nordic Semiconductor ASA (89)
< HCI Command: Read Local Supported... (0x04|0x0002) plen 0  #7 [hci1] 1.413088
> HCI Event: Command Complete (0x0e) plen 68                 #8 [hci1] 1.414198
      Read Local Supported Commands (0x04|0x0002) ncmd 1
        Status: Success (0x00)
        Commands: 119 entries
          Disconnect (Octet 0 - Bit 5)
          Read Remote Version Information (Octet 2 - Bit 7)
          Set Event Mask (Octet 5 - Bit 6)
          Reset (Octet 5 - Bit 7)
          Read Connection Accept Timeout (Octet 7 - Bit 2)
          Write Connection Accept Timeout (Octet 7 - Bit 3)
          Read Transmit Power Level (Octet 10 - Bit 2)
          Set Controller To Host Flow Control (Octet 10 - Bit 5)
          Host Buffer Size (Octet 10 - Bit 6)
          Host Number of Completed Packets (Octet 10 - Bit 7)
          Read Local Version Information (Octet 14 - Bit 3)
          Read Local Supported Features (Octet 14 - Bit 5)
          Read BD ADDR (Octet 15 - Bit 1)
          Read RSSI (Octet 15 - Bit 5)
          Set Event Mask Page 2 (Octet 22 - Bit 2)
          LE Set Event Mask (Octet 25 - Bit 0)
          LE Read Buffer Size (Octet 25 - Bit 1)
          LE Read Local Supported Features (Octet 25 - Bit 2)
          LE Set Random Address (Octet 25 - Bit 4)
          LE Set Advertising Parameters (Octet 25 - Bit 5)
          LE Read Advertising Channel TX Power (Octet 25 - Bit 6)
          LE Set Advertising Data (Octet 25 - Bit 7)
          LE Set Scan Response Data (Octet 26 - Bit 0)
          LE Set Advertise Enable (Octet 26 - Bit 1)
          LE Set Scan Parameters (Octet 26 - Bit 2)
          LE Set Scan Enable (Octet 26 - Bit 3)
          LE Create Connection (Octet 26 - Bit 4)
          LE Create Connection Cancel (Octet 26 - Bit 5)
          LE Read Accept List Size (Octet 26 - Bit 6)
          LE Clear Accept List (Octet 26 - Bit 7)
          LE Add Device To Accept List (Octet 27 - Bit 0)
          LE Remove Device From Accept List (Octet 27 - Bit 1)
          LE Connection Update (Octet 27 - Bit 2)
          LE Set Host Channel Classification (Octet 27 - Bit 3)
          LE Read Channel Map (Octet 27 - Bit 4)
          LE Read Remote Used Features (Octet 27 - Bit 5)
          LE Encrypt (Octet 27 - Bit 6)
          LE Rand (Octet 27 - Bit 7)
          LE Start Encryption (Octet 28 - Bit 0)
          LE Long Term Key Request Reply (Octet 28 - Bit 1)
          LE Long Term Key Request Neg Reply (Octet 28 - Bit 2)
          LE Read Supported States (Octet 28 - Bit 3)
          LE Receiver Test (Octet 28 - Bit 4)
          LE Transmitter Test (Octet 28 - Bit 5)
          LE Test End (Octet 28 - Bit 6)
          Read Authenticated Payload Timeout (Octet 32 - Bit 4)
          Write Authenticated Payload Timeout (Octet 32 - Bit 5)
          LE Set Data Length (Octet 33 - Bit 6)
          LE Read Suggested Default Data Length (Octet 33 - Bit 7)
          LE Write Suggested Default Data Length (Octet 34 - Bit 0)
          LE Add Device To Resolving List (Octet 34 - Bit 3)
          LE Remove Device From Resolving List (Octet 34 - Bit 4)
          LE Clear Resolving List (Octet 34 - Bit 5)
          LE Read Resolving List Size (Octet 34 - Bit 6)
          LE Set Address Resolution Enable (Octet 35 - Bit 1)
          LE Set Resolvable Private Address Timeout (Octet 35 - Bit 2)
          LE Read Maximum Data Length (Octet 35 - Bit 3)
          LE Read PHY (Octet 35 - Bit 4)
          LE Set Default PHY (Octet 35 - Bit 5)
          LE Set PHY (Octet 35 - Bit 6)
          LE Enhanced Receiver Test (Octet 35 - Bit 7)
          LE Enhanced Transmitter Test (Octet 36 - Bit 0)
          LE Set Advertising Set Random Address (Octet 36 - Bit 1)
          LE Set Extended Advertising Parameters (Octet 36 - Bit 2)
          LE Set Extended Advertising Data (Octet 36 - Bit 3)
          LE Set Extended Scan Response Data (Octet 36 - Bit 4)
          LE Set Extended Advertising Enable (Octet 36 - Bit 5)
          LE Read Maximum Advertising Data Length (Octet 36 - Bit 6)
          LE Read Number of Supported Advertising Sets (Octet 36 - Bit 7)
          LE Remove Advertising Set (Octet 37 - Bit 0)
          LE Clear Advertising Sets (Octet 37 - Bit 1)
          LE Set Periodic Advertising Parameters (Octet 37 - Bit 2)
          LE Set Periodic Advertising Data (Octet 37 - Bit 3)
          LE Set Periodic Advertising Enable (Octet 37 - Bit 4)
          LE Set Extended Scan Parameters (Octet 37 - Bit 5)
          LE Set Extended Scan Enable (Octet 37 - Bit 6)
          LE Extended Create Connection (Octet 37 - Bit 7)
          LE Periodic Advertising Create Sync (Octet 38 - Bit 0)
          LE Periodic Advertising Create Sync Cancel (Octet 38 - Bit 1)
          LE Periodic Advertising Terminate Sync (Octet 38 - Bit 2)
          LE Add Device To Periodic Advertiser List (Octet 38 - Bit 3)
          LE Remove Device From Periodic Advertiser List (Octet 38 - Bit 4)
          LE Clear Periodic Advertiser List (Octet 38 - Bit 5)
          LE Read Periodic Advertiser List Size (Octet 38 - Bit 6)
          LE Read Transmit Power (Octet 38 - Bit 7)
          LE Read RF Path Compensation (Octet 39 - Bit 0)
          LE Write RF Path Compensation (Octet 39 - Bit 1)
          LE Set Privacy Mode (Octet 39 - Bit 2)
          LE Periodic Advertising Receive Enable (Octet 40 - Bit 5)
          LE Periodic Advertising Sync Transfer (Octet 40 - Bit 6)
          LE Periodic Advertising Set Info Transfer (Octet 40 - Bit 7)
          LE Periodic Advertising Sync Transfer Parameters (Octet 41 - Bit 0)
          LE Set Default Periodic Advertisng Sync Transfer Parameters (Octet 41 - Bit 1)
          LE Read Buffer v2 (Octet 41 - Bit 5)
          LE Read ISO TX Sync (Octet 41 - Bit 6)
          LE Set Connected Isochronous Group Parameters (Octet 41 - Bit 7)
          LE Set Connected Isochronous Group Parameters Test (Octet 42 - Bit 0)
          LE Create Connected Isochronous Stream (Octet 42 - Bit 1)
          LE Remove Connected Isochronous Group (Octet 42 - Bit 2)
          LE Accept Connected Isochronous Stream Request (Octet 42 - Bit 3)
          LE Reject Connected Isochronous Stream Request (Octet 42 - Bit 4)
          LE Create Broadcast Isochronous Group (Octet 42 - Bit 5)
          LE Create Broadcast Isochronous Group Test (Octet 42 - Bit 6)
          LE Terminate Broadcast Isochronous Group (Octet 42 - Bit 7)
          LE Broadcast Isochronous Group Create Sync (Octet 43 - Bit 0)
          LE Broadcast Isochronous Group Terminate Sync (Octet 43 - Bit 1)
          LE Request Peer SCA (Octet 43 - Bit 2)
          LE Setup Isochronous Data Path (Octet 43 - Bit 3)
          LE Remove Isochronous Data Path (Octet 43 - Bit 4)
          LE Isochronous Transmit Test (Octet 43 - Bit 5)
          LE Isochronous Receive Test (Octet 43 - Bit 6)
          LE Isochronous Read Test Counters (Octet 43 - Bit 7)
          LE Isochronous Read Test Counters (Octet 44 - Bit 0)
          LE Set Host Feature (Octet 44 - Bit 1)
          Octet 44 - Bit 2 
          Octet 45 - Bit 6 
          Octet 46 - Bit 0 
          Octet 46 - Bit 1 
          Octet 46 - Bit 2 
< HCI Command: Host Buffer Size (0x03|0x0033) plen 7         #9 [hci1] 1.433103
        ACL MTU: 255  ACL max packet: 16
        SCO MTU: 0    SCO max packet: 0
> HCI Event: Command Complete (0x0e) plen 4                 #10 [hci1] 1.433607
      Host Buffer Size (0x03|0x0033) ncmd 1
        Status: Success (0x00)
< HCI Command: Set Controller To Ho.. (0x03|0x0031) plen 1  #11 [hci1] 1.453095
        Flow control: ACL Data Packets (0x01)
> HCI Event: Command Complete (0x0e) plen 4                 #12 [hci1] 1.453572
      Set Controller To Host Flow Control (0x03|0x0031) ncmd 1
        Status: Success (0x00)
< HCI Command: LE Read Local Suppor.. (0x08|0x0003) plen 0  #13 [hci1] 1.473066
> HCI Event: Command Complete (0x0e) plen 12                #14 [hci1] 1.473618
      LE Read Local Supported Features (0x08|0x0003) ncmd 1
        Status: Success (0x00)
        Features: 0xfd 0x79 0x00 0xf7 0x30 0x01 0x00 0x00
          LE Encryption
          Extended Reject Indication
          Peripheral-initiated Features Exchange
          LE Ping
          LE Data Packet Length Extension
          LL Privacy
          Extended Scanner Filter Policies
          LE 2M PHY
          LE Coded PHY
          LE Extended Advertising
          LE Periodic Advertising
          Channel Selection Algorithm #2
          Periodic Advertising Sync Transfer - Sender
          Periodic Advertising Sync Transfer - Recipient
          Sleep Clock Accuracy Updates
          Connected Isochronous Stream - Central
          Connected Isochronous Stream - Peripheral
          Isochronous Broadcaster
          Synchronized Receiver
          Periodic Advertising ADI support
          Connection Subrating
          Unknown features (0x0000010000000000)
< HCI Command: LE Set Host Feature (0x08|0x0074) plen 2     #15 [hci1] 1.493105
        Bit Number: 32
          Connected Isochronous Stream (Host Support)
        Bit Value: 1
> HCI Event: Command Complete (0x0e) plen 4                 #16 [hci1] 1.493609
      LE Set Host Feature (0x08|0x0074) ncmd 1
        Status: Success (0x00)
< HCI Command: LE Read Buffer v2 (0x08|0x0060) plen 0       #17 [hci1] 1.513090
> HCI Event: Command Complete (0x0e) plen 10                #18 [hci1] 1.513613
      LE Read Buffer v2 (0x08|0x0060) ncmd 1
        Status: Success (0x00)
        ACL MTU: 27
        ACL max packet: 3
        ISO MTU: 318
        ISO max packet: 3
< HCI Command: LE Read Maximum Adve.. (0x08|0x003a) plen 0  #19 [hci1] 1.533118
> HCI Event: Command Complete (0x0e) plen 6                 #20 [hci1] 1.533603
      LE Read Maximum Advertising Data Length (0x08|0x003a) ncmd 1
        Status: Success (0x00)
        Max length: 1650
< HCI Command: LE Read Supported St.. (0x08|0x001c) plen 0  #21 [hci1] 1.553097
> HCI Event: Command Complete (0x0e) plen 12                #22 [hci1] 1.553683
      LE Read Supported States (0x08|0x001c) ncmd 1
        Status: Success (0x00)
        States: 0x000003ff3e0306ff
          Non-connectable Advertising State
          Scannable Advertising State
          Connectable Advertising State
          High Duty Cycle Directed Advertising State
          Passive Scanning State
          Active Scanning State
          Initiating State
            and Connection State (Central Role)
          Connection State (Peripheral Role)
          Scannable Advertising State
            and Passive Scanning State
          Connectable Advertising State
            and Passive Scanning State
          Non-connectable Advertising State
            and Initiating State
          Scannable Advertising State
            and Initiating State
          Active Scanning State
            and Connection State (Central Role)
          Passive Scanning State
            and Connection State (Peripheral Role)
          Active Scanning State
            and Connection State (Peripheral Role)
          Initiating State
            and Connection State (Central Role)
            and Central Role & Central Role
          Low Duty Cycle Directed Advertising State
          Connectable Advertising State
            and Initiating State
            and Central Role & Peripheral Role
          High Duty Cycle Directed Advertising State
            and Initiating State
            and Central Role & Peripheral Role
          Low Duty Cycle Directed Advertising State
            and Initiating State
            and Central Role & Peripheral Role
          Connectable Advertising State
            and Connection State (Central Role)
            and Central Role & Peripheral Role
          High Duty Cycle Directed Advertising State
            and Connection State (Central Role)
            and Central Role & Peripheral Role
          Low Duty Cycle Directed Advertising State
            and Connection State (Central Role)
            and Central Role & Peripheral Role
          Connectable Advertising State
            and Connection State (Peripheral Role)
            and Central Role & Peripheral Role
          High Duty Cycle Directed Advertising State
            and Connection State (Peripheral Role)
            and Peripheral Role & Peripheral Role
          Low Duty Cycle Directed Advertising State
            and Connection State (Peripheral Role)
            and Peripheral Role & Peripheral Role
          Initiating State
            and Connection State (Peripheral Role)
            and Central Role & Peripheral Role
< HCI Command: LE Read Maximum Data.. (0x08|0x002f) plen 0  #23 [hci1] 1.573109
> HCI Event: Command Complete (0x0e) plen 12                #24 [hci1] 1.573641
      LE Read Maximum Data Length (0x08|0x002f) ncmd 1
        Status: Success (0x00)
        Max TX octets: 251
        Max TX time: 2704
        Max RX octets: 251
        Max RX time: 2704
< HCI Command: LE Write Suggested D.. (0x08|0x0024) plen 4  #25 [hci1] 1.593099
        TX octets: 251
        TX time: 2704
> HCI Event: Command Complete (0x0e) plen 4                 #26 [hci1] 1.593609
      LE Write Suggested Default Data Length (0x08|0x0024) ncmd 1
        Status: Success (0x00)
< HCI Command: LE Read Resolving Li.. (0x08|0x002a) plen 0  #27 [hci1] 1.613099
> HCI Event: Command Complete (0x0e) plen 5                 #28 [hci1] 1.613480
      LE Read Resolving List Size (0x08|0x002a) ncmd 1
        Status: Success (0x00)
        Size: 8
< HCI Command: LE Set Event Mask (0x08|0x0001) plen 8       #29 [hci1] 1.633137
        Mask: 0x000002023f87fa5e
          LE Advertising Report
          LE Connection Update Complete
          LE Read Remote Used Features Complete
          LE Long Term Key Request
          LE Data Length Change
          LE Enhanced Connection Complete
          LE PHY Update Complete
          LE Extended Advertising Report
          LE Periodic Advertising Sync Established
          LE Periodic Advertising Report
          LE Periodic Advertising Sync Lost
          LE Extended Scan Timeout
          LE Extended Advertising Set Terminated
          LE Scan Request Received
          LE Periodic Advertising Sync Transfer Rvc
          LE CIS Established
          LE CIS Request
          LE Create BIG Complete
          LE Terminate BIG Complete
          LE BIG Sync Estabilished Complete
          LE BIG Sync Lost
          LE BIG Info Advertising Report
          Unknown mask (0x0000020000000000)
> HCI Event: Command Complete (0x0e) plen 4                 #30 [hci1] 1.633659
      LE Set Event Mask (0x08|0x0001) ncmd 1
        Status: Success (0x00)
< HCI Command: Set Event Mask (0x03|0x0001) plen 8          #31 [hci1] 1.653091
        Mask: 0x2000800002008890
          Disconnection Complete
          Encryption Change
          Read Remote Version Information Complete
          Hardware Error
          Data Buffer Overflow
          Encryption Key Refresh Complete
          LE Meta
> HCI Event: Command Complete (0x0e) plen 4                 #32 [hci1] 1.653622
      Set Event Mask (0x03|0x0001) ncmd 1
        Status: Success (0x00)
< HCI Command: Read BD ADDR (0x04|0x0009) plen 0            #33 [hci1] 1.673107
> HCI Event: Command Complete (0x0e) plen 10                #34 [hci1] 1.673557
      Read BD ADDR (0x04|0x0009) ncmd 1
        Status: Success (0x00)
        Address: 00:00:00:00:00:00 (OUI 00-00-00)
< HCI Command: LE Set Random Address (0x08|0x0005) plen 6   #35 [hci1] 1.693097
        Address: D5:B6:CC:31:DB:3B (Static)
> HCI Event: Command Complete (0x0e) plen 4                 #36 [hci1] 1.693581
      LE Set Random Address (0x08|0x0005) ncmd 1
        Status: Success (0x00)
< HCI Command: LE Set Extended Adv.. (0x08|0x0036) plen 25  #37 [hci1] 4.193580
        Handle: 0x00
        Properties: 0x0013
          Connectable
          Scannable
          Use legacy advertising PDUs: ADV_IND
        Min advertising interval: 100.000 msec (0x00a0)
        Max advertising interval: 150.000 msec (0x00f0)
        Channel map: 37, 38, 39 (0x07)
        Own address type: Random (0x01)
        Peer address type: Public (0x00)
        Peer address: 00:00:00:00:00:00 (OUI 00-00-00)
        Filter policy: Allow Scan Request from Any, Allow Connect Request from Any (0x00)
        TX power: Host has no preference (0x7f)
        Primary PHY: LE 1M (0x01)
        Secondary max skip: 0x00
        Secondary PHY: LE 1M (0x01)
        SID: 0x00
        Scan request notifications: Disabled (0x00)
> HCI Event: Command Complete (0x0e) plen 5                 #38 [hci1] 4.194516
      LE Set Extended Advertising Parameters (0x08|0x0036) ncmd 1
        Status: Success (0x00)
        TX power (selected): 0 dbm (0x00)
< HCI Command: LE Set Advertising S.. (0x08|0x0035) plen 7  #39 [hci1] 4.213387
        Advertising handle: 0x00
        Advertising random address: D5:B6:CC:31:DB:3B (Static)
> HCI Event: Command Complete (0x0e) plen 4                 #40 [hci1] 4.213960
      LE Set Advertising Set Random Address (0x08|0x0035) ncmd 1
        Status: Success (0x00)
< HCI Command: LE Set Extended Adv.. (0x08|0x0037) plen 22  #41 [hci1] 4.233223
        Handle: 0x00
        Operation: Complete extended advertising data (0x03)
        Fragment preference: Minimize fragmentation (0x01)
        Data length: 0x12
        Flags: 0x06
          LE General Discoverable Mode
          BR/EDR Not Supported
        Name (complete): Tester_F6B11A
> HCI Event: Command Complete (0x0e) plen 4                 #42 [hci1] 4.233925
      LE Set Extended Advertising Data (0x08|0x0037) ncmd 1
        Status: Success (0x00)
< HCI Command: LE Set Extended Scan.. (0x08|0x0038) plen 4  #43 [hci1] 4.253137
        Handle: 0x00
        Operation: Complete scan response data (0x03)
        Fragment preference: Minimize fragmentation (0x01)
        Data length: 0x00
> HCI Event: Command Complete (0x0e) plen 4                 #44 [hci1] 4.253678
      LE Set Extended Scan Response Data (0x08|0x0038) ncmd 1
        Status: Success (0x00)
< HCI Command: LE Set Extended Adve.. (0x08|0x0039) plen 6  #45 [hci1] 4.273128
        Extended advertising: Enabled (0x01)
        Number of sets: 1 (0x01)
        Entry 0
          Handle: 0x00
          Duration: 0 ms (0x00)
          Max ext adv events: 0
> HCI Event: Command Complete (0x0e) plen 4                 #46 [hci1] 4.273611
      LE Set Extended Advertising Enable (0x08|0x0039) ncmd 1
        Status: Success (0x00)
> HCI Event: LE Meta Event (0x3e) plen 31                   #47 [hci1] 4.385409
      LE Enhanced Connection Complete (0x0a)
        Status: Success (0x00)
        Handle: 147
        Role: Peripheral (0x01)
        Peer address type: Public (0x00)
        Peer address: DF:A9:FF:F6:B1:1A (OUI DF-A9-FF)
        Local resolvable private address: 00:00:00:00:00:00 (Non-Resolvable)
        Peer resolvable private address: 00:00:00:00:00:00 (Non-Resolvable)
        Connection interval: 87.50 msec (0x0046)
        Connection latency: 0 (0x0000)
        Supervision timeout: 25120 msec (0x09d0)
        Central clock accuracy: 0x01
> HCI Event: LE Meta Event (0x3e) plen 6                    #48 [hci1] 4.385460
      LE Advertising Set Terminated (0x12)
        Status: Success (0x00)
        Handle: 0
        Connection handle: 147
        Number of completed extended advertising events: 0
< HCI Command: LE Read Remote Used... (0x08|0x0016) plen 2  #49 [hci1] 4.394144
        Handle: 147 Address: DF:A9:FF:F6:B1:1A (OUI DF-A9-FF)
< ACL Data TX: Handle 147 flags 0x00 dlen 7                 #50 [hci1] 4.394170
      ATT: Exchange MTU Request (0x02) len 2
        Client RX MTU: 251
> HCI Event: Command Status (0x0f) plen 4                   #51 [hci1] 4.394787
      LE Read Remote Used Features (0x08|0x0016) ncmd 1
        Status: Success (0x00)
> HCI Event: Number of Completed Packets (0x13) plen 5      #52 [hci1] 4.561454
        Num handles: 1
        Handle: 147 Address: DF:A9:FF:F6:B1:1A (OUI DF-A9-FF)
        Count: 1
        #50: len 7 (0 Kb/s)
        Latency: 167 msec (167-167 msec ~167 msec)
> HCI Event: LE Meta Event (0x3e) plen 12                   #53 [hci1] 4.649338
      LE Read Remote Used Features (0x04)
        Status: Success (0x00)
        Handle: 147 Address: DF:A9:FF:F6:B1:1A (OUI DF-A9-FF)
        Features: 0x2d 0x49 0x00 0xf7 0x67 0xd8 0x00 0x00
          LE Encryption
          Extended Reject Indication
          Peripheral-initiated Features Exchange
          LE Data Packet Length Extension
          LE 2M PHY
          LE Coded PHY
          Channel Selection Algorithm #2
          Periodic Advertising Sync Transfer - Sender
          Periodic Advertising Sync Transfer - Recipient
          Sleep Clock Accuracy Updates
          Connected Isochronous Stream - Central
          Connected Isochronous Stream - Peripheral
          Isochronous Broadcaster
          Synchronized Receiver
          Connected Isochronous Stream (Host Support)
          LE Power Control Request
          LE Power Control Request
          Connection Subrating
          Connection Subrating (Host Support)
          Unknown features (0x0000d80000000000)
> ACL Data RX: Handle 147 flags 0x02 dlen 11                #54 [hci1] 7.099137
      SMP: Pairing Request (0x01) len 6
        IO capability: KeyboardDisplay (0x04)
        OOB data: Authentication data not present (0x00)
        Authentication requirement: Bonding, MITM, SC, No Keypresses (0x0d)
        Max encryption key size: 16
        Initiator key distribution: EncKey IdKey (0x03)
        Responder key distribution: EncKey IdKey Sign (0x07)
< HCI Command: Host Number of Compl.. (0x03|0x0035) plen 5  #55 [hci1] 7.113592
        Num handles: 1
        Handle: 147 Address: DF:A9:FF:F6:B1:1A (OUI DF-A9-FF)
        Count: 1
< ACL Data TX: Handle 147 flags 0x00 dlen 11                #56 [hci1] 7.113794
      SMP: Pairing Response (0x02) len 6
        IO capability: DisplayOnly (0x00)
        OOB data: Authentication data not present (0x00)
        Authentication requirement: Bonding, No MITM, SC, No Keypresses (0x09)
        Max encryption key size: 16
        Initiator key distribution: IdKey (0x02)
        Responder key distribution: <none> (0x00)
> ACL Data RX: Handle 147 flags 0x02 dlen 7                 #57 [hci1] 7.186515
      ATT: Exchange MTU Response (0x03) len 2
        Server RX MTU: 23
< HCI Command: Host Number of Compl.. (0x03|0x0035) plen 5  #58 [hci1] 7.193525
        Num handles: 1
        Handle: 147 Address: DF:A9:FF:F6:B1:1A (OUI DF-A9-FF)
        Count: 1
> HCI Event: Number of Completed Packets (0x13) plen 5      #59 [hci1] 7.274189
        Num handles: 1
        Handle: 147 Address: DF:A9:FF:F6:B1:1A (OUI DF-A9-FF)
        Count: 1
        #56: len 11 (0 Kb/s)
        Latency: 160 msec (160-167 msec ~163 msec)
> ACL Data RX: Handle 147 flags 0x02 dlen 27                #60 [hci1] 7.274412
> ACL Data RX: Handle 147 flags 0x01 dlen 27                #61 [hci1] 7.274890
> ACL Data RX: Handle 147 flags 0x01 dlen 15                #62 [hci1] 7.275372
      SMP: Pairing Public Key (0x0c) len 64
        X: 674224c3372dc403444181cc0b36e2e4e4746f1b9193270b3e09643a314fca14
        Y: f2dd598a71987aa4c9fca676f199678e2f883629911a8353617b4282a0c2ac33
< HCI Command: Host Number of Compl.. (0x03|0x0035) plen 5  #63 [hci1] 7.294123
        Num handles: 1
        Handle: 147 Address: DF:A9:FF:F6:B1:1A (OUI DF-A9-FF)
        Count: 1
< HCI Command: Host Number of Compl.. (0x03|0x0035) plen 5  #64 [hci1] 7.294356
        Num handles: 1
        Handle: 147 Address: DF:A9:FF:F6:B1:1A (OUI DF-A9-FF)
        Count: 1
< HCI Command: Host Number of Compl.. (0x03|0x0035) plen 5  #65 [hci1] 7.294704
        Num handles: 1
        Handle: 147 Address: DF:A9:FF:F6:B1:1A (OUI DF-A9-FF)
        Count: 1
< ACL Data TX: Handle 147 flags 0x00 dlen 27                #66 [hci1] 7.294868
< ACL Data TX: Handle 147 flags 0x01 dlen 27                #67 [hci1] 7.294886
< ACL Data TX: Handle 147 flags 0x01 dlen 15                #68 [hci1] 7.294889
      SMP: Pairing Public Key (0x0c) len 64
        X: 98308440221e2d910f0e54b71e7ec652857aa9b5a0dc65028824cc19db1226e9
        Y: 67a4816bcb62efb21701e31fdb27561a6217575fb007a8bbdabe7e28b6f68482
> HCI Event: Number of Completed Packets (0x13) plen 5      #69 [hci1] 7.361942
        Num handles: 1
        Handle: 147 Address: DF:A9:FF:F6:B1:1A (OUI DF-A9-FF)
        Count: 1
        #66: len 27 (3 Kb/s)
        Latency: 67 msec (67-167 msec ~115 msec)
> HCI Event: Number of Completed Packets (0x13) plen 5      #70 [hci1] 7.362609
        Num handles: 1
        Handle: 147 Address: DF:A9:FF:F6:B1:1A (OUI DF-A9-FF)
        Count: 1
        #67: len 27 (3 Kb/s)
        Latency: 67 msec (67-167 msec ~91 msec)
> HCI Event: Number of Completed Packets (0x13) plen 5      #71 [hci1] 7.448854
        Num handles: 1
        Handle: 147 Address: DF:A9:FF:F6:B1:1A (OUI DF-A9-FF)
        Count: 1
        #68: len 15 (0 Kb/s)
        Latency: 153 msec (67-167 msec ~122 msec)
> ACL Data RX: Handle 147 flags 0x02 dlen 21                #72 [hci1] 8.411691
      SMP: Pairing Confirm (0x03) len 16
        Confim value: e9b1b62b2e3f0d4b4e3a04dbbea45100
< HCI Command: Host Number of Compl.. (0x03|0x0035) plen 5  #73 [hci1] 8.413826
        Num handles: 1
        Handle: 147 Address: DF:A9:FF:F6:B1:1A (OUI DF-A9-FF)
        Count: 1
< ACL Data TX: Handle 147 flags 0x00 dlen 21                #74 [hci1] 8.414090
      SMP: Pairing Confirm (0x03) len 16
        Confim value: 54f70701900d73fc1a629b9cacb9a09a
> HCI Event: Number of Completed Packets (0x13) plen 5      #75 [hci1] 8.586494
        Num handles: 1
        Handle: 147 Address: DF:A9:FF:F6:B1:1A (OUI DF-A9-FF)
        Count: 1
        #74: len 21 (0 Kb/s)
        Latency: 172 msec (67-172 msec ~147 msec)
> ACL Data RX: Handle 147 flags 0x02 dlen 21                #76 [hci1] 8.586833
      SMP: Pairing Random (0x04) len 16
        Random value: 1e40614af21b1a440000000000000000
< HCI Command: Host Number of Compl.. (0x03|0x0035) plen 5  #77 [hci1] 8.593574
        Num handles: 1
        Handle: 147 Address: DF:A9:FF:F6:B1:1A (OUI DF-A9-FF)
        Count: 1
< ACL Data TX: Handle 147 flags 0x00 dlen 21                #78 [hci1] 8.593625
      SMP: Pairing Random (0x04) len 16
        Random value: 8e6108f966a694cbe26df70bb96773e6
> HCI Event: Number of Completed Packets (0x13) plen 5      #79 [hci1] 8.761284
        Num handles: 1
        Handle: 147 Address: DF:A9:FF:F6:B1:1A (OUI DF-A9-FF)
        Count: 1
        #78: len 21 (1 Kb/s)
        Latency: 167 msec (67-172 msec ~157 msec)
> ACL Data RX: Handle 147 flags 0x02 dlen 21                #80 [hci1] 8.849171
      SMP: Pairing Confirm (0x03) len 16
        Confim value: 467854c16bc52993a9b63e60faf70b2d
< HCI Command: Host Number of Compl.. (0x03|0x0035) plen 5  #81 [hci1] 8.853413
        Num handles: 1
        Handle: 147 Address: DF:A9:FF:F6:B1:1A (OUI DF-A9-FF)
        Count: 1
< ACL Data TX: Handle 147 flags 0x00 dlen 21                #82 [hci1] 8.853481
      SMP: Pairing Confirm (0x03) len 16
        Confim value: cdd1064ccfc587ed4ec04e4ffe51358e
> HCI Event: Number of Completed Packets (0x13) plen 5      #83 [hci1] 9.023966
        Num handles: 1
        Handle: 147 Address: DF:A9:FF:F6:B1:1A (OUI DF-A9-FF)
        Count: 1
        #82: len 21 (0 Kb/s)
        Latency: 170 msec (67-172 msec ~164 msec)
> ACL Data RX: Handle 147 flags 0x02 dlen 21                #84 [hci1] 9.024356
      SMP: Pairing Random (0x04) len 16
        Random value: a123a22705d035cc0000000000000000
< HCI Command: Host Number of Compl.. (0x03|0x0035) plen 5  #85 [hci1] 9.033635
        Num handles: 1
        Handle: 147 Address: DF:A9:FF:F6:B1:1A (OUI DF-A9-FF)
        Count: 1
< ACL Data TX: Handle 147 flags 0x00 dlen 21                #86 [hci1] 9.033659
      SMP: Pairing Random (0x04) len 16
        Random value: 4d02679f89a05211af56d8b3da64d21e
> HCI Event: Number of Completed Packets (0x13) plen 5      #87 [hci1] 9.198727
        Num handles: 1
        Handle: 147 Address: DF:A9:FF:F6:B1:1A (OUI DF-A9-FF)
        Count: 1
        #86: len 21 (1 Kb/s)
        Latency: 165 msec (67-172 msec ~164 msec)
> ACL Data RX: Handle 147 flags 0x02 dlen 21                #88 [hci1] 9.286628
      SMP: Pairing Confirm (0x03) len 16
        Confim value: aed274549153f614bebfd74106ffed54
< HCI Command: Host Number of Compl.. (0x03|0x0035) plen 5  #89 [hci1] 9.293683
        Num handles: 1
        Handle: 147 Address: DF:A9:FF:F6:B1:1A (OUI DF-A9-FF)
        Count: 1
< ACL Data TX: Handle 147 flags 0x00 dlen 21                #90 [hci1] 9.293901
      SMP: Pairing Confirm (0x03) len 16
        Confim value: 39d125250fbea83a623b246dade1d68c
> HCI Event: Number of Completed Packets (0x13) plen 5      #91 [hci1] 9.461437
        Num handles: 1
        Handle: 147 Address: DF:A9:FF:F6:B1:1A (OUI DF-A9-FF)
        Count: 1
        #90: len 21 (1 Kb/s)
        Latency: 167 msec (67-172 msec ~166 msec)
> ACL Data RX: Handle 147 flags 0x02 dlen 21                #92 [hci1] 9.461779
      SMP: Pairing Random (0x04) len 16
        Random value: 5ebfbfd8a2b6c9610000000000000000
< HCI Command: Host Number of Compl.. (0x03|0x0035) plen 5  #93 [hci1] 9.473829
        Num handles: 1
        Handle: 147 Address: DF:A9:FF:F6:B1:1A (OUI DF-A9-FF)
        Count: 1
< ACL Data TX: Handle 147 flags 0x00 dlen 21                #94 [hci1] 9.473851
      SMP: Pairing Random (0x04) len 16
        Random value: 5e8286bc235a02440d0c3424a2acf8fd
> HCI Event: Number of Completed Packets (0x13) plen 5      #95 [hci1] 9.636212
        Num handles: 1
        Handle: 147 Address: DF:A9:FF:F6:B1:1A (OUI DF-A9-FF)
        Count: 1
        #94: len 21 (1 Kb/s)
        Latency: 162 msec (67-172 msec ~164 msec)
> ACL Data RX: Handle 147 flags 0x02 dlen 21                #96 [hci1] 9.724144
      SMP: Pairing Confirm (0x03) len 16
        Confim value: 81a818d6c81c1a5a6086253aa2c27dca
< HCI Command: Host Number of Compl.. (0x03|0x0035) plen 5  #97 [hci1] 9.733697
        Num handles: 1
        Handle: 147 Address: DF:A9:FF:F6:B1:1A (OUI DF-A9-FF)
        Count: 1
< ACL Data TX: Handle 147 flags 0x00 dlen 21                #98 [hci1] 9.733897
      SMP: Pairing Confirm (0x03) len 16
        Confim value: b73b037b48b0cf59c3a952cd74c617c6
> HCI Event: Number of Completed Packets (0x13) plen 5      #99 [hci1] 9.898983
        Num handles: 1
        Handle: 147 Address: DF:A9:FF:F6:B1:1A (OUI DF-A9-FF)
        Count: 1
        #98: len 21 (1 Kb/s)
        Latency: 165 msec (67-172 msec ~164 msec)
> ACL Data RX: Handle 147 flags 0x02 dlen 21               #100 [hci1] 9.899245
      SMP: Pairing Random (0x04) len 16
        Random value: ccd3204aaa6079dd0000000000000000
< HCI Command: Host Number of Comp.. (0x03|0x0035) plen 5  #101 [hci1] 9.913811
        Num handles: 1
        Handle: 147 Address: DF:A9:FF:F6:B1:1A (OUI DF-A9-FF)
        Count: 1
< ACL Data TX: Handle 147 flags 0x00 dlen 21               #102 [hci1] 9.913928
      SMP: Pairing Random (0x04) len 16
        Random value: 5c4a1bcadd27bd58e945097b00bad7ac
> HCI Event: Number of Completed Packets (0x13) plen 5    #103 [hci1] 10.073755
        Num handles: 1
        Handle: 147 Address: DF:A9:FF:F6:B1:1A (OUI DF-A9-FF)
        Count: 1
        #102: len 21 (1 Kb/s)
        Latency: 159 msec (67-172 msec ~162 msec)
> ACL Data RX: Handle 147 flags 0x02 dlen 21              #104 [hci1] 10.161596
      SMP: Pairing Confirm (0x03) len 16
        Confim value: e4b951a59cfa5cb3c09d289f7721b56d
< HCI Command: Host Number of Com.. (0x03|0x0035) plen 5  #105 [hci1] 10.173806
        Num handles: 1
        Handle: 147 Address: DF:A9:FF:F6:B1:1A (OUI DF-A9-FF)
        Count: 1
< ACL Data TX: Handle 147 flags 0x00 dlen 21              #106 [hci1] 10.174066
      SMP: Pairing Confirm (0x03) len 16
        Confim value: d920a5b1c7a54955c34f35f009adaa72
> HCI Event: Number of Completed Packets (0x13) plen 5    #107 [hci1] 10.336554
        Num handles: 1
        Handle: 147 Address: DF:A9:FF:F6:B1:1A (OUI DF-A9-FF)
        Count: 1
        #106: len 21 (1 Kb/s)
        Latency: 162 msec (67-172 msec ~162 msec)
> ACL Data RX: Handle 147 flags 0x02 dlen 21              #108 [hci1] 10.336762
      SMP: Pairing Random (0x04) len 16
        Random value: 35edca3fd12d056f0000000000000000
< HCI Command: Host Number of Com.. (0x03|0x0035) plen 5  #109 [hci1] 10.353918
        Num handles: 1
        Handle: 147 Address: DF:A9:FF:F6:B1:1A (OUI DF-A9-FF)
        Count: 1
< ACL Data TX: Handle 147 flags 0x00 dlen 21              #110 [hci1] 10.353991
      SMP: Pairing Random (0x04) len 16
        Random value: 32527e6e64e79f33b2e374394db8ab2d
> HCI Event: Number of Completed Packets (0x13) plen 5    #111 [hci1] 10.511226
        Num handles: 1
        Handle: 147 Address: DF:A9:FF:F6:B1:1A (OUI DF-A9-FF)
        Count: 1
        #110: len 21 (1 Kb/s)
        Latency: 157 msec (67-172 msec ~159 msec)
> ACL Data RX: Handle 147 flags 0x02 dlen 21              #112 [hci1] 10.599185
      SMP: Pairing Confirm (0x03) len 16
        Confim value: be3d7c7928ae875e1ce67eb0626c59e4
< HCI Command: Host Number of Com.. (0x03|0x0035) plen 5  #113 [hci1] 10.613636
        Num handles: 1
        Handle: 147 Address: DF:A9:FF:F6:B1:1A (OUI DF-A9-FF)
        Count: 1
< ACL Data TX: Handle 147 flags 0x00 dlen 21              #114 [hci1] 10.613901
      SMP: Pairing Confirm (0x03) len 16
        Confim value: a8f11e05c1ec48ea21ee0e502da4f9be
> HCI Event: Number of Completed Packets (0x13) plen 5    #115 [hci1] 10.773924
        Num handles: 1
        Handle: 147 Address: DF:A9:FF:F6:B1:1A (OUI DF-A9-FF)
        Count: 1
        #114: len 21 (1 Kb/s)
        Latency: 160 msec (67-172 msec ~159 msec)
> ACL Data RX: Handle 147 flags 0x02 dlen 21              #116 [hci1] 10.774223
      SMP: Pairing Random (0x04) len 16
        Random value: 03bcb706ce1c53cd0000000000000000
< HCI Command: Host Number of Com.. (0x03|0x0035) plen 5  #117 [hci1] 10.793975
        Num handles: 1
        Handle: 147 Address: DF:A9:FF:F6:B1:1A (OUI DF-A9-FF)
        Count: 1
< ACL Data TX: Handle 147 flags 0x00 dlen 21              #118 [hci1] 10.794101
      SMP: Pairing Random (0x04) len 16
        Random value: dddbdfe2838e9a8cc6964353c850fef7
> HCI Event: Number of Completed Packets (0x13) plen 5    #119 [hci1] 10.948702
        Num handles: 1
        Handle: 147 Address: DF:A9:FF:F6:B1:1A (OUI DF-A9-FF)
        Count: 1
        #118: len 21 (1 Kb/s)
        Latency: 154 msec (67-172 msec ~157 msec)
> ACL Data RX: Handle 147 flags 0x02 dlen 21              #120 [hci1] 11.036613
      SMP: Pairing Confirm (0x03) len 16
        Confim value: 324990a6fb2484670b091017bcfc5fc4
< HCI Command: Host Number of Com.. (0x03|0x0035) plen 5  #121 [hci1] 11.053680
        Num handles: 1
        Handle: 147 Address: DF:A9:FF:F6:B1:1A (OUI DF-A9-FF)
        Count: 1
< ACL Data TX: Handle 147 flags 0x00 dlen 21              #122 [hci1] 11.053960
      SMP: Pairing Confirm (0x03) len 16
        Confim value: 71c299dd1a1129dd8551830adebb52a4
> HCI Event: Number of Completed Packets (0x13) plen 5    #123 [hci1] 11.211386
        Num handles: 1
        Handle: 147 Address: DF:A9:FF:F6:B1:1A (OUI DF-A9-FF)
        Count: 1
        #122: len 21 (1 Kb/s)
        Latency: 157 msec (67-172 msec ~157 msec)
> ACL Data RX: Handle 147 flags 0x02 dlen 21              #124 [hci1] 11.211724
      SMP: Pairing Random (0x04) len 16
        Random value: a97c2c81e5a8bd100000000000000000
< HCI Command: Host Number of Com.. (0x03|0x0035) plen 5  #125 [hci1] 11.213899
        Num handles: 1
        Handle: 147 Address: DF:A9:FF:F6:B1:1A (OUI DF-A9-FF)
        Count: 1
< ACL Data TX: Handle 147 flags 0x00 dlen 21              #126 [hci1] 11.214013
      SMP: Pairing Random (0x04) len 16
        Random value: eb9f1915536596b6fc3db1c86b2b1970
> HCI Event: Number of Completed Packets (0x13) plen 5    #127 [hci1] 11.386099
        Num handles: 1
        Handle: 147 Address: DF:A9:FF:F6:B1:1A (OUI DF-A9-FF)
        Count: 1
        #126: len 21 (0 Kb/s)
        Latency: 172 msec (67-172 msec ~164 msec)
> ACL Data RX: Handle 147 flags 0x02 dlen 21              #128 [hci1] 11.474199
      SMP: Pairing Confirm (0x03) len 16
        Confim value: d3d7e3d559c9eab3765889a60d79948b
< HCI Command: Host Number of Com.. (0x03|0x0035) plen 5  #129 [hci1] 11.493701
        Num handles: 1
        Handle: 147 Address: DF:A9:FF:F6:B1:1A (OUI DF-A9-FF)
        Count: 1
< ACL Data TX: Handle 147 flags 0x00 dlen 21              #130 [hci1] 11.493918
      SMP: Pairing Confirm (0x03) len 16
        Confim value: 72cf8364656a25e3938801155d02ed62
> HCI Event: Number of Completed Packets (0x13) plen 5    #131 [hci1] 11.648855
        Num handles: 1
        Handle: 147 Address: DF:A9:FF:F6:B1:1A (OUI DF-A9-FF)
        Count: 1
        #130: len 21 (1 Kb/s)
        Latency: 154 msec (67-172 msec ~159 msec)
> ACL Data RX: Handle 147 flags 0x02 dlen 21              #132 [hci1] 11.649302
      SMP: Pairing Random (0x04) len 16
        Random value: cbab14adf9c69ef30000000000000000
< HCI Command: Host Number of Com.. (0x03|0x0035) plen 5  #133 [hci1] 11.653927
        Num handles: 1
        Handle: 147 Address: DF:A9:FF:F6:B1:1A (OUI DF-A9-FF)
        Count: 1
< ACL Data TX: Handle 147 flags 0x00 dlen 21              #134 [hci1] 11.654042
      SMP: Pairing Random (0x04) len 16
        Random value: 5c794dc9ad9f2c3f295ebd5ad5e1c3cf
> HCI Event: Number of Completed Packets (0x13) plen 5    #135 [hci1] 11.823648
        Num handles: 1
        Handle: 147 Address: DF:A9:FF:F6:B1:1A (OUI DF-A9-FF)
        Count: 1
        #134: len 21 (0 Kb/s)
        Latency: 169 msec (67-172 msec ~164 msec)
> ACL Data RX: Handle 147 flags 0x02 dlen 21              #136 [hci1] 11.911523
      SMP: Pairing Confirm (0x03) len 16
        Confim value: d8f6e6db976bfc1cce73ee6b0c2626c1
< HCI Command: Host Number of Com.. (0x03|0x0035) plen 5  #137 [hci1] 11.913576
        Num handles: 1
        Handle: 147 Address: DF:A9:FF:F6:B1:1A (OUI DF-A9-FF)
        Count: 1
< ACL Data TX: Handle 147 flags 0x00 dlen 21              #138 [hci1] 11.913796
      SMP: Pairing Confirm (0x03) len 16
        Confim value: 40314aca0fc661127d3c1c31c61e023b
> HCI Event: Number of Completed Packets (0x13) plen 5    #139 [hci1] 12.086358
        Num handles: 1
        Handle: 147 Address: DF:A9:FF:F6:B1:1A (OUI DF-A9-FF)
        Count: 1
        #138: len 21 (0 Kb/s)
        Latency: 172 msec (67-172 msec ~168 msec)
> ACL Data RX: Handle 147 flags 0x02 dlen 21              #140 [hci1] 12.086767
      SMP: Pairing Random (0x04) len 16
        Random value: e84bb889c5a1395c0000000000000000
< HCI Command: Host Number of Com.. (0x03|0x0035) plen 5  #141 [hci1] 12.093963
        Num handles: 1
        Handle: 147 Address: DF:A9:FF:F6:B1:1A (OUI DF-A9-FF)
        Count: 1
< ACL Data TX: Handle 147 flags 0x00 dlen 21              #142 [hci1] 12.094033
      SMP: Pairing Random (0x04) len 16
        Random value: 5c2fff312cdf99c9491988e877355a9a
> HCI Event: Number of Completed Packets (0x13) plen 5    #143 [hci1] 12.261243
        Num handles: 1
        Handle: 147 Address: DF:A9:FF:F6:B1:1A (OUI DF-A9-FF)
        Count: 1
        #142: len 21 (1 Kb/s)
        Latency: 167 msec (67-172 msec ~167 msec)
> ACL Data RX: Handle 147 flags 0x02 dlen 21              #144 [hci1] 12.349059
      SMP: Pairing Confirm (0x03) len 16
        Confim value: f574f9656e98e490d4ff8a1bd4811e4a
< HCI Command: Host Number of Com.. (0x03|0x0035) plen 5  #145 [hci1] 12.353644
        Num handles: 1
        Handle: 147 Address: DF:A9:FF:F6:B1:1A (OUI DF-A9-FF)
        Count: 1
< ACL Data TX: Handle 147 flags 0x00 dlen 21              #146 [hci1] 12.353837
      SMP: Pairing Confirm (0x03) len 16
        Confim value: 3511e019d747fb18322c2c88dc0c1e33
> HCI Event: Number of Completed Packets (0x13) plen 5    #147 [hci1] 12.523869
        Num handles: 1
        Handle: 147 Address: DF:A9:FF:F6:B1:1A (OUI DF-A9-FF)
        Count: 1
        #146: len 21 (0 Kb/s)
        Latency: 170 msec (67-172 msec ~168 msec)
> ACL Data RX: Handle 147 flags 0x02 dlen 21              #148 [hci1] 12.524161
      SMP: Pairing Random (0x04) len 16
        Random value: 2520399f8287554d0000000000000000
< HCI Command: Host Number of Com.. (0x03|0x0035) plen 5  #149 [hci1] 12.533924
        Num handles: 1
        Handle: 147 Address: DF:A9:FF:F6:B1:1A (OUI DF-A9-FF)
        Count: 1
< ACL Data TX: Handle 147 flags 0x00 dlen 21              #150 [hci1] 12.534035
      SMP: Pairing Random (0x04) len 16
        Random value: c629a3a987d808e808655d558dfc1155
> HCI Event: Number of Completed Packets (0x13) plen 5    #151 [hci1] 12.698620
        Num handles: 1
        Handle: 147 Address: DF:A9:FF:F6:B1:1A (OUI DF-A9-FF)
        Count: 1
        #150: len 21 (1 Kb/s)
        Latency: 164 msec (67-172 msec ~166 msec)
> ACL Data RX: Handle 147 flags 0x02 dlen 21              #152 [hci1] 12.786515
      SMP: Pairing Confirm (0x03) len 16
        Confim value: 4dd77a34a7bb2f2ef046d4b65a8463d4
< HCI Command: Host Number of Com.. (0x03|0x0035) plen 5  #153 [hci1] 12.793769
        Num handles: 1
        Handle: 147 Address: DF:A9:FF:F6:B1:1A (OUI DF-A9-FF)
        Count: 1
< ACL Data TX: Handle 147 flags 0x00 dlen 21              #154 [hci1] 12.793994
      SMP: Pairing Confirm (0x03) len 16
        Confim value: 3ffa3695a861bd413a0dfa60a7917188
> HCI Event: Number of Completed Packets (0x13) plen 5    #155 [hci1] 12.961368
        Num handles: 1
        Handle: 147 Address: DF:A9:FF:F6:B1:1A (OUI DF-A9-FF)
        Count: 1
        #154: len 21 (1 Kb/s)
        Latency: 167 msec (67-172 msec ~167 msec)
> ACL Data RX: Handle 147 flags 0x02 dlen 21              #156 [hci1] 12.961687
      SMP: Pairing Random (0x04) len 16
        Random value: 0a315e1d29ecf9410000000000000000
< HCI Command: Host Number of Com.. (0x03|0x0035) plen 5  #157 [hci1] 12.973945
        Num handles: 1
        Handle: 147 Address: DF:A9:FF:F6:B1:1A (OUI DF-A9-FF)
        Count: 1
< ACL Data TX: Handle 147 flags 0x00 dlen 21              #158 [hci1] 12.974050
      SMP: Pairing Random (0x04) len 16
        Random value: 92f20f6ad8f13724432c7fd6001c45ff
> HCI Event: Number of Completed Packets (0x13) plen 5    #159 [hci1] 13.136150
        Num handles: 1
        Handle: 147 Address: DF:A9:FF:F6:B1:1A (OUI DF-A9-FF)
        Count: 1
        #158: len 21 (1 Kb/s)
        Latency: 162 msec (67-172 msec ~164 msec)
> ACL Data RX: Handle 147 flags 0x02 dlen 21              #160 [hci1] 13.224049
      SMP: Pairing Confirm (0x03) len 16
        Confim value: 76c1c1e7d41098151338a2fa45b98ba4
< HCI Command: Host Number of Com.. (0x03|0x0035) plen 5  #161 [hci1] 13.233364
        Num handles: 1
        Handle: 147 Address: DF:A9:FF:F6:B1:1A (OUI DF-A9-FF)
        Count: 1
< ACL Data TX: Handle 147 flags 0x00 dlen 21              #162 [hci1] 13.233528
      SMP: Pairing Confirm (0x03) len 16
        Confim value: 4003725b43d40d898b7d548030e9f1ba
> HCI Event: Number of Completed Packets (0x13) plen 5    #163 [hci1] 13.398765
        Num handles: 1
        Handle: 147 Address: DF:A9:FF:F6:B1:1A (OUI DF-A9-FF)
        Count: 1
        #162: len 21 (1 Kb/s)
        Latency: 165 msec (67-172 msec ~164 msec)
> ACL Data RX: Handle 147 flags 0x02 dlen 21              #164 [hci1] 13.399285
      SMP: Pairing Random (0x04) len 16
        Random value: 156343a0f1c95c1f0000000000000000
< HCI Command: Host Number of Com.. (0x03|0x0035) plen 5  #165 [hci1] 13.413989
        Num handles: 1
        Handle: 147 Address: DF:A9:FF:F6:B1:1A (OUI DF-A9-FF)
        Count: 1
< ACL Data TX: Handle 147 flags 0x00 dlen 21              #166 [hci1] 13.414062
      SMP: Pairing Random (0x04) len 16
        Random value: 23ac32ebbb5e14c8a6b9622f296d277f
> HCI Event: Number of Completed Packets (0x13) plen 5    #167 [hci1] 13.573644
        Num handles: 1
        Handle: 147 Address: DF:A9:FF:F6:B1:1A (OUI DF-A9-FF)
        Count: 1
        #166: len 21 (1 Kb/s)
        Latency: 159 msec (67-172 msec ~162 msec)
> ACL Data RX: Handle 147 flags 0x02 dlen 21              #168 [hci1] 13.661596
      SMP: Pairing Confirm (0x03) len 16
        Confim value: 1db458fd283329998ae12632aae6f294
< HCI Command: Host Number of Com.. (0x03|0x0035) plen 5  #169 [hci1] 13.673620
        Num handles: 1
        Handle: 147 Address: DF:A9:FF:F6:B1:1A (OUI DF-A9-FF)
        Count: 1
< ACL Data TX: Handle 147 flags 0x00 dlen 21              #170 [hci1] 13.673842
      SMP: Pairing Confirm (0x03) len 16
        Confim value: 8cc32a411ff56956d0f393dda500eaa6
> HCI Event: Number of Completed Packets (0x13) plen 5    #171 [hci1] 13.836363
        Num handles: 1
        Handle: 147 Address: DF:A9:FF:F6:B1:1A (OUI DF-A9-FF)
        Count: 1
        #170: len 21 (1 Kb/s)
        Latency: 162 msec (67-172 msec ~162 msec)
> ACL Data RX: Handle 147 flags 0x02 dlen 21              #172 [hci1] 13.836666
      SMP: Pairing Random (0x04) len 16
        Random value: 6f2e0b165fbe2a0a0000000000000000
< HCI Command: Host Number of Com.. (0x03|0x0035) plen 5  #173 [hci1] 13.853373
        Num handles: 1
        Handle: 147 Address: DF:A9:FF:F6:B1:1A (OUI DF-A9-FF)
        Count: 1
< ACL Data TX: Handle 147 flags 0x00 dlen 21              #174 [hci1] 13.853429
      SMP: Pairing Random (0x04) len 16
        Random value: 297efe85e67448a15f56bd27e3a3cf1d
> HCI Event: Number of Completed Packets (0x13) plen 5    #175 [hci1] 14.011124
        Num handles: 1
        Handle: 147 Address: DF:A9:FF:F6:B1:1A (OUI DF-A9-FF)
        Count: 1
        #174: len 21 (1 Kb/s)
        Latency: 157 msec (67-172 msec ~160 msec)
> ACL Data RX: Handle 147 flags 0x02 dlen 21              #176 [hci1] 14.098919
      SMP: Pairing Confirm (0x03) len 16
        Confim value: dfc668f37eae1b5d2f72183a472a6872
< HCI Command: Host Number of Com.. (0x03|0x0035) plen 5  #177 [hci1] 14.113524
        Num handles: 1
        Handle: 147 Address: DF:A9:FF:F6:B1:1A (OUI DF-A9-FF)
        Count: 1
< ACL Data TX: Handle 147 flags 0x00 dlen 21              #178 [hci1] 14.113676
      SMP: Pairing Confirm (0x03) len 16
        Confim value: 055fbf032a2e7d8e3ce36071cae1468a
> HCI Event: Number of Completed Packets (0x13) plen 5    #179 [hci1] 14.273769
        Num handles: 1
        Handle: 147 Address: DF:A9:FF:F6:B1:1A (OUI DF-A9-FF)
        Count: 1
        #178: len 21 (1 Kb/s)
        Latency: 160 msec (67-172 msec ~160 msec)
> ACL Data RX: Handle 147 flags 0x02 dlen 21              #180 [hci1] 14.274224
      SMP: Pairing Random (0x04) len 16
        Random value: 44b08ce41cc090960000000000000000
< HCI Command: Host Number of Com.. (0x03|0x0035) plen 5  #181 [hci1] 14.293766
        Num handles: 1
        Handle: 147 Address: DF:A9:FF:F6:B1:1A (OUI DF-A9-FF)
        Count: 1
< ACL Data TX: Handle 147 flags 0x00 dlen 21              #182 [hci1] 14.293898
      SMP: Pairing Random (0x04) len 16
        Random value: 25a9493fd3ce4faf02be7293595bb7c6
> HCI Event: Number of Completed Packets (0x13) plen 5    #183 [hci1] 14.448617
        Num handles: 1
        Handle: 147 Address: DF:A9:FF:F6:B1:1A (OUI DF-A9-FF)
        Count: 1
        #182: len 21 (1 Kb/s)
        Latency: 154 msec (67-172 msec ~157 msec)
> ACL Data RX: Handle 147 flags 0x02 dlen 21              #184 [hci1] 14.536453
      SMP: Pairing Confirm (0x03) len 16
        Confim value: a59dddbf8936de07d2a3440c9a0ab9c9
< HCI Command: Host Number of Com.. (0x03|0x0035) plen 5  #185 [hci1] 14.553656
        Num handles: 1
        Handle: 147 Address: DF:A9:FF:F6:B1:1A (OUI DF-A9-FF)
        Count: 1
< ACL Data TX: Handle 147 flags 0x00 dlen 21              #186 [hci1] 14.553889
      SMP: Pairing Confirm (0x03) len 16
        Confim value: b98df7cd1fd4f7d9b7efafdecc942519
> HCI Event: Number of Completed Packets (0x13) plen 5    #187 [hci1] 14.711308
        Num handles: 1
        Handle: 147 Address: DF:A9:FF:F6:B1:1A (OUI DF-A9-FF)
        Count: 1
        #186: len 21 (1 Kb/s)
        Latency: 157 msec (67-172 msec ~157 msec)
> ACL Data RX: Handle 147 flags 0x02 dlen 21              #188 [hci1] 14.711587
      SMP: Pairing Random (0x04) len 16
        Random value: 6f2320e28c105e760000000000000000
< HCI Command: Host Number of Com.. (0x03|0x0035) plen 5  #189 [hci1] 14.713758
        Num handles: 1
        Handle: 147 Address: DF:A9:FF:F6:B1:1A (OUI DF-A9-FF)
        Count: 1
< ACL Data TX: Handle 147 flags 0x00 dlen 21              #190 [hci1] 14.713843
      SMP: Pairing Random (0x04) len 16
        Random value: 58f6b41f855a6f6c3560debd84e2affc
> HCI Event: Number of Completed Packets (0x13) plen 5    #191 [hci1] 14.886133
        Num handles: 1
        Handle: 147 Address: DF:A9:FF:F6:B1:1A (OUI DF-A9-FF)
        Count: 1
        #190: len 21 (0 Kb/s)
        Latency: 172 msec (67-172 msec ~164 msec)
> ACL Data RX: Handle 147 flags 0x02 dlen 21              #192 [hci1] 14.973932
      SMP: Pairing Confirm (0x03) len 16
        Confim value: 1d5f9c6d706944dfae36d417a8da8d8a
< HCI Command: Host Number of Com.. (0x03|0x0035) plen 5  #193 [hci1] 14.993712
        Num handles: 1
        Handle: 147 Address: DF:A9:FF:F6:B1:1A (OUI DF-A9-FF)
        Count: 1
< ACL Data TX: Handle 147 flags 0x00 dlen 21              #194 [hci1] 14.993922
      SMP: Pairing Confirm (0x03) len 16
        Confim value: 6a45fd09572317d624f2445b2765533e
> HCI Event: Number of Completed Packets (0x13) plen 5    #195 [hci1] 15.148759
        Num handles: 1
        Handle: 147 Address: DF:A9:FF:F6:B1:1A (OUI DF-A9-FF)
        Count: 1
        #194: len 21 (1 Kb/s)
        Latency: 154 msec (67-172 msec ~159 msec)
> ACL Data RX: Handle 147 flags 0x02 dlen 21              #196 [hci1] 15.149076
      SMP: Pairing Random (0x04) len 16
        Random value: e2bdea67aeb8a8c50000000000000000
< HCI Command: Host Number of Com.. (0x03|0x0035) plen 5  #197 [hci1] 15.153979
        Num handles: 1
        Handle: 147 Address: DF:A9:FF:F6:B1:1A (OUI DF-A9-FF)
        Count: 1
< ACL Data TX: Handle 147 flags 0x00 dlen 21              #198 [hci1] 15.154051
      SMP: Pairing Random (0x04) len 16
        Random value: b67e7216d5bf664139eda2b542549666
> HCI Event: Number of Completed Packets (0x13) plen 5    #199 [hci1] 15.323607
        Num handles: 1
        Handle: 147 Address: DF:A9:FF:F6:B1:1A (OUI DF-A9-FF)
        Count: 1
        #198: len 21 (0 Kb/s)
        Latency: 169 msec (67-172 msec ~164 msec)
> ACL Data RX: Handle 147 flags 0x02 dlen 21              #200 [hci1] 15.411373
      SMP: Pairing Confirm (0x03) len 16
        Confim value: f0dcdf5e9a89e0333533629e90cc7a12
< HCI Command: Host Number of Com.. (0x03|0x0035) plen 5  #201 [hci1] 15.413749
        Num handles: 1
        Handle: 147 Address: DF:A9:FF:F6:B1:1A (OUI DF-A9-FF)
        Count: 1
< ACL Data TX: Handle 147 flags 0x00 dlen 21              #202 [hci1] 15.413994
      SMP: Pairing Confirm (0x03) len 16
        Confim value: 89c9bdb8ea74cd5343acc149f24d5d44
> HCI Event: Number of Completed Packets (0x13) plen 5    #203 [hci1] 15.586287
        Num handles: 1
        Handle: 147 Address: DF:A9:FF:F6:B1:1A (OUI DF-A9-FF)
        Count: 1
        #202: len 21 (0 Kb/s)
        Latency: 172 msec (67-172 msec ~168 msec)
> ACL Data RX: Handle 147 flags 0x02 dlen 21              #204 [hci1] 15.586568
      SMP: Pairing Random (0x04) len 16
        Random value: 8790d23d3e42b91c0000000000000000
< HCI Command: Host Number of Com.. (0x03|0x0035) plen 5  #205 [hci1] 15.593954
        Num handles: 1
        Handle: 147 Address: DF:A9:FF:F6:B1:1A (OUI DF-A9-FF)
        Count: 1
< ACL Data TX: Handle 147 flags 0x00 dlen 21              #206 [hci1] 15.594032
      SMP: Pairing Random (0x04) len 16
        Random value: ed17f76500c95219dd01e09d1e63f87b
> HCI Event: Number of Completed Packets (0x13) plen 5    #207 [hci1] 15.761061
        Num handles: 1
        Handle: 147 Address: DF:A9:FF:F6:B1:1A (OUI DF-A9-FF)
        Count: 1
        #206: len 21 (1 Kb/s)
        Latency: 167 msec (67-172 msec ~167 msec)
> ACL Data RX: Handle 147 flags 0x02 dlen 21              #208 [hci1] 15.848957
      SMP: Pairing Confirm (0x03) len 16
        Confim value: ad163c28006e2d652d38c020a3fed533
< HCI Command: Host Number of Com.. (0x03|0x0035) plen 5  #209 [hci1] 15.853388
        Num handles: 1
        Handle: 147 Address: DF:A9:FF:F6:B1:1A (OUI DF-A9-FF)
        Count: 1
< ACL Data TX: Handle 147 flags 0x00 dlen 21              #210 [hci1] 15.853426
      SMP: Pairing Confirm (0x03) len 16
        Confim value: f7477bf7dd6a958672b93a2949fb61bb
> HCI Event: Number of Completed Packets (0x13) plen 5    #211 [hci1] 16.023715
        Num handles: 1
        Handle: 147 Address: DF:A9:FF:F6:B1:1A (OUI DF-A9-FF)
        Count: 1
        #210: len 21 (0 Kb/s)
        Latency: 170 msec (67-172 msec ~169 msec)
> ACL Data RX: Handle 147 flags 0x02 dlen 21              #212 [hci1] 16.024156
      SMP: Pairing Random (0x04) len 16
        Random value: dbf590651471336c0000000000000000
< HCI Command: Host Number of Com.. (0x03|0x0035) plen 5  #213 [hci1] 16.033971
        Num handles: 1
        Handle: 147 Address: DF:A9:FF:F6:B1:1A (OUI DF-A9-FF)
        Count: 1
< ACL Data TX: Handle 147 flags 0x00 dlen 21              #214 [hci1] 16.034063
      SMP: Pairing Random (0x04) len 16
        Random value: 81d35d47e1f6006d79c974bd9d9e1ee3
> HCI Event: Number of Completed Packets (0x13) plen 5    #215 [hci1] 16.198630
        Num handles: 1
        Handle: 147 Address: DF:A9:FF:F6:B1:1A (OUI DF-A9-FF)
        Count: 1
        #214: len 21 (1 Kb/s)
        Latency: 164 msec (67-172 msec ~166 msec)
> ACL Data RX: Handle 147 flags 0x02 dlen 21              #216 [hci1] 16.286353
      SMP: Pairing Confirm (0x03) len 16
        Confim value: b6493b5d1d58bf3bb928c6eae8d03b72
< HCI Command: Host Number of Com.. (0x03|0x0035) plen 5  #217 [hci1] 16.293531
        Num handles: 1
        Handle: 147 Address: DF:A9:FF:F6:B1:1A (OUI DF-A9-FF)
        Count: 1
< ACL Data TX: Handle 147 flags 0x00 dlen 21              #218 [hci1] 16.293674
      SMP: Pairing Confirm (0x03) len 16
        Confim value: b731bf28a35b213fd0b54f38138177af
> HCI Event: Number of Completed Packets (0x13) plen 5    #219 [hci1] 16.461456
        Num handles: 1
        Handle: 147 Address: DF:A9:FF:F6:B1:1A (OUI DF-A9-FF)
        Count: 1
        #218: len 21 (1 Kb/s)
        Latency: 167 msec (67-172 msec ~167 msec)
> ACL Data RX: Handle 147 flags 0x02 dlen 21              #220 [hci1] 16.461586
      SMP: Pairing Random (0x04) len 16
        Random value: be40a5e335f8246d0000000000000000
< HCI Command: Host Number of Com.. (0x03|0x0035) plen 5  #221 [hci1] 16.473606
        Num handles: 1
        Handle: 147 Address: DF:A9:FF:F6:B1:1A (OUI DF-A9-FF)
        Count: 1
< ACL Data TX: Handle 147 flags 0x00 dlen 21              #222 [hci1] 16.473705
      SMP: Pairing Random (0x04) len 16
        Random value: e7f7e0c2476823e41736a7e381bafb7c
> HCI Event: Number of Completed Packets (0x13) plen 5    #223 [hci1] 16.635997
        Num handles: 1
        Handle: 147 Address: DF:A9:FF:F6:B1:1A (OUI DF-A9-FF)
        Count: 1
        #222: len 21 (1 Kb/s)
        Latency: 162 msec (67-172 msec ~164 msec)
> ACL Data RX: Handle 147 flags 0x02 dlen 21              #224 [hci1] 16.723931
      SMP: Pairing Confirm (0x03) len 16
        Confim value: 076a7fb6eeb087e0b7729cd33eaadf9c
< HCI Command: Host Number of Com.. (0x03|0x0035) plen 5  #225 [hci1] 16.733521
        Num handles: 1
        Handle: 147 Address: DF:A9:FF:F6:B1:1A (OUI DF-A9-FF)
        Count: 1
< ACL Data TX: Handle 147 flags 0x00 dlen 21              #226 [hci1] 16.733621
      SMP: Pairing Confirm (0x03) len 16
        Confim value: 0deed6e596aa942a152fe6178c8786a7
> HCI Event: Number of Completed Packets (0x13) plen 5    #227 [hci1] 16.898709
        Num handles: 1
        Handle: 147 Address: DF:A9:FF:F6:B1:1A (OUI DF-A9-FF)
        Count: 1
        #226: len 21 (1 Kb/s)
        Latency: 165 msec (67-172 msec ~164 msec)
> ACL Data RX: Handle 147 flags 0x02 dlen 21              #228 [hci1] 16.899182
      SMP: Pairing Random (0x04) len 16
        Random value: 3de51f9f5ee483710000000000000000
< HCI Command: Host Number of Com.. (0x03|0x0035) plen 5  #229 [hci1] 16.913918
        Num handles: 1
        Handle: 147 Address: DF:A9:FF:F6:B1:1A (OUI DF-A9-FF)
        Count: 1
