Bluetooth monitor ver 5.72
= Note: Linux version 6.14.0-36-generic (x86_64)                       0.652880
= Note: Bluetooth subsystem version 2.22                               0.652882
= New Index: 00:00:00:00:00:00 (Primary,UART,hci1)              [hci1] 0.652883
= New Index: 48:5F:99:8E:E0:64 (Primary,USB,hci0)               [hci0] 0.652884
= Open Index: 00:00:00:00:00:00                                 [hci1] 0.816082
= Index Info: 00:00:00:00:00:00 (Nordic Semiconductor ASA)      [hci1] 0.816087
@ USER Open: main (privileged) version 2.22            {0x0001} [hci1] 0.816089
< HCI Command: Reset (0x03|0x0003) plen 0                    #1 [hci1] 0.816455
> HCI Event: Command Complete (0x0e) plen 4                  #2 [hci1] 0.816951
      Reset (0x03|0x0003) ncmd 1
        Status: Success (0x00)
< HCI Command: Read Local Supported... (0x04|0x0003) plen 0  #3 [hci1] 0.836035
> HCI Event: Command Complete (0x0e) plen 12                 #4 [hci1] 0.836519
      Read Local Supported Features (0x04|0x0003) ncmd 1
        Status: Success (0x00)
        Features: 0x00 0x00 0x00 0x00 0x60 0x00 0x00 0x00
          BR/EDR Not Supported
          LE Supported (Controller)
< HCI Command: Read Local Version In.. (0x04|0x0001) plen 0  #5 [hci1] 0.856066
> HCI Event: Command Complete (0x0e) plen 12                 #6 [hci1] 0.856535
      Read Local Version Information (0x04|0x0001) ncmd 1
        Status: Success (0x00)
        HCI version: Reserved (0x0f) - Revision 12393 (0x3069)
        LMP version: Reserved (0x0f) - Subversion 12393 (0x3069)
        Manufacturer: Nordic Semiconductor ASA (89)
< HCI Command: Read Local Supported... (0x04|0x0002) plen 0  #7 [hci1] 0.876073
> HCI Event: Command Complete (0x0e) plen 68                 #8 [hci1] 0.877111
      Read Local Supported Commands (0x04|0x0002) ncmd 1
        Status: Success (0x00)
        Commands: 119 entries
          Disconnect (Octet 0 - Bit 5)
          Read Remote Version Information (Octet 2 - Bit 7)
          Set Event Mask (Octet 5 - Bit 6)
          Reset (Octet 5 - Bit 7)
          Read Connection Accept Timeout (Octet 7 - Bit 2)
          Write Connection Accept Timeout (Octet 7 - Bit 3)
          Read Transmit Power Level (Octet 10 - Bit 2)
          Set Controller To Host Flow Control (Octet 10 - Bit 5)
          Host Buffer Size (Octet 10 - Bit 6)
          Host Number of Completed Packets (Octet 10 - Bit 7)
          Read Local Version Information (Octet 14 - Bit 3)
          Read Local Supported Features (Octet 14 - Bit 5)
          Read BD ADDR (Octet 15 - Bit 1)
          Read RSSI (Octet 15 - Bit 5)
          Set Event Mask Page 2 (Octet 22 - Bit 2)
          LE Set Event Mask (Octet 25 - Bit 0)
          LE Read Buffer Size (Octet 25 - Bit 1)
          LE Read Local Supported Features (Octet 25 - Bit 2)
          LE Set Random Address (Octet 25 - Bit 4)
          LE Set Advertising Parameters (Octet 25 - Bit 5)
          LE Read Advertising Channel TX Power (Octet 25 - Bit 6)
          LE Set Advertising Data (Octet 25 - Bit 7)
          LE Set Scan Response Data (Octet 26 - Bit 0)
          LE Set Advertise Enable (Octet 26 - Bit 1)
          LE Set Scan Parameters (Octet 26 - Bit 2)
          LE Set Scan Enable (Octet 26 - Bit 3)
          LE Create Connection (Octet 26 - Bit 4)
          LE Create Connection Cancel (Octet 26 - Bit 5)
          LE Read Accept List Size (Octet 26 - Bit 6)
          LE Clear Accept List (Octet 26 - Bit 7)
          LE Add Device To Accept List (Octet 27 - Bit 0)
          LE Remove Device From Accept List (Octet 27 - Bit 1)
          LE Connection Update (Octet 27 - Bit 2)
          LE Set Host Channel Classification (Octet 27 - Bit 3)
          LE Read Channel Map (Octet 27 - Bit 4)
          LE Read Remote Used Features (Octet 27 - Bit 5)
          LE Encrypt (Octet 27 - Bit 6)
          LE Rand (Octet 27 - Bit 7)
          LE Start Encryption (Octet 28 - Bit 0)
          LE Long Term Key Request Reply (Octet 28 - Bit 1)
          LE Long Term Key Request Neg Reply (Octet 28 - Bit 2)
          LE Read Supported States (Octet 28 - Bit 3)
          LE Receiver Test (Octet 28 - Bit 4)
          LE Transmitter Test (Octet 28 - Bit 5)
          LE Test End (Octet 28 - Bit 6)
          Read Authenticated Payload Timeout (Octet 32 - Bit 4)
          Write Authenticated Payload Timeout (Octet 32 - Bit 5)
          LE Set Data Length (Octet 33 - Bit 6)
          LE Read Suggested Default Data Length (Octet 33 - Bit 7)
          LE Write Suggested Default Data Length (Octet 34 - Bit 0)
          LE Add Device To Resolving List (Octet 34 - Bit 3)
          LE Remove Device From Resolving List (Octet 34 - Bit 4)
          LE Clear Resolving List (Octet 34 - Bit 5)
          LE Read Resolving List Size (Octet 34 - Bit 6)
          LE Set Address Resolution Enable (Octet 35 - Bit 1)
          LE Set Resolvable Private Address Timeout (Octet 35 - Bit 2)
          LE Read Maximum Data Length (Octet 35 - Bit 3)
          LE Read PHY (Octet 35 - Bit 4)
          LE Set Default PHY (Octet 35 - Bit 5)
          LE Set PHY (Octet 35 - Bit 6)
          LE Enhanced Receiver Test (Octet 35 - Bit 7)
          LE Enhanced Transmitter Test (Octet 36 - Bit 0)
          LE Set Advertising Set Random Address (Octet 36 - Bit 1)
          LE Set Extended Advertising Parameters (Octet 36 - Bit 2)
          LE Set Extended Advertising Data (Octet 36 - Bit 3)
          LE Set Extended Scan Response Data (Octet 36 - Bit 4)
          LE Set Extended Advertising Enable (Octet 36 - Bit 5)
          LE Read Maximum Advertising Data Length (Octet 36 - Bit 6)
          LE Read Number of Supported Advertising Sets (Octet 36 - Bit 7)
          LE Remove Advertising Set (Octet 37 - Bit 0)
          LE Clear Advertising Sets (Octet 37 - Bit 1)
          LE Set Periodic Advertising Parameters (Octet 37 - Bit 2)
          LE Set Periodic Advertising Data (Octet 37 - Bit 3)
          LE Set Periodic Advertising Enable (Octet 37 - Bit 4)
          LE Set Extended Scan Parameters (Octet 37 - Bit 5)
          LE Set Extended Scan Enable (Octet 37 - Bit 6)
          LE Extended Create Connection (Octet 37 - Bit 7)
          LE Periodic Advertising Create Sync (Octet 38 - Bit 0)
          LE Periodic Advertising Create Sync Cancel (Octet 38 - Bit 1)
          LE Periodic Advertising Terminate Sync (Octet 38 - Bit 2)
          LE Add Device To Periodic Advertiser List (Octet 38 - Bit 3)
          LE Remove Device From Periodic Advertiser List (Octet 38 - Bit 4)
          LE Clear Periodic Advertiser List (Octet 38 - Bit 5)
          LE Read Periodic Advertiser List Size (Octet 38 - Bit 6)
          LE Read Transmit Power (Octet 38 - Bit 7)
          LE Read RF Path Compensation (Octet 39 - Bit 0)
          LE Write RF Path Compensation (Octet 39 - Bit 1)
          LE Set Privacy Mode (Octet 39 - Bit 2)
          LE Periodic Advertising Receive Enable (Octet 40 - Bit 5)
          LE Periodic Advertising Sync Transfer (Octet 40 - Bit 6)
          LE Periodic Advertising Set Info Transfer (Octet 40 - Bit 7)
          LE Periodic Advertising Sync Transfer Parameters (Octet 41 - Bit 0)
          LE Set Default Periodic Advertisng Sync Transfer Parameters (Octet 41 - Bit 1)
          LE Read Buffer v2 (Octet 41 - Bit 5)
          LE Read ISO TX Sync (Octet 41 - Bit 6)
          LE Set Connected Isochronous Group Parameters (Octet 41 - Bit 7)
          LE Set Connected Isochronous Group Parameters Test (Octet 42 - Bit 0)
          LE Create Connected Isochronous Stream (Octet 42 - Bit 1)
          LE Remove Connected Isochronous Group (Octet 42 - Bit 2)
          LE Accept Connected Isochronous Stream Request (Octet 42 - Bit 3)
          LE Reject Connected Isochronous Stream Request (Octet 42 - Bit 4)
          LE Create Broadcast Isochronous Group (Octet 42 - Bit 5)
          LE Create Broadcast Isochronous Group Test (Octet 42 - Bit 6)
          LE Terminate Broadcast Isochronous Group (Octet 42 - Bit 7)
          LE Broadcast Isochronous Group Create Sync (Octet 43 - Bit 0)
          LE Broadcast Isochronous Group Terminate Sync (Octet 43 - Bit 1)
          LE Request Peer SCA (Octet 43 - Bit 2)
          LE Setup Isochronous Data Path (Octet 43 - Bit 3)
          LE Remove Isochronous Data Path (Octet 43 - Bit 4)
          LE Isochronous Transmit Test (Octet 43 - Bit 5)
          LE Isochronous Receive Test (Octet 43 - Bit 6)
          LE Isochronous Read Test Counters (Octet 43 - Bit 7)
          LE Isochronous Read Test Counters (Octet 44 - Bit 0)
          LE Set Host Feature (Octet 44 - Bit 1)
          Octet 44 - Bit 2 
          Octet 45 - Bit 6 
          Octet 46 - Bit 0 
          Octet 46 - Bit 1 
          Octet 46 - Bit 2 
< HCI Command: Host Buffer Size (0x03|0x0033) plen 7         #9 [hci1] 0.896069
        ACL MTU: 255  ACL max packet: 16
        SCO MTU: 0    SCO max packet: 0
> HCI Event: Command Complete (0x0e) plen 4                 #10 [hci1] 0.896651
      Host Buffer Size (0x03|0x0033) ncmd 1
        Status: Success (0x00)
< HCI Command: Set Controller To Ho.. (0x03|0x0031) plen 1  #11 [hci1] 0.916074
        Flow control: ACL Data Packets (0x01)
> HCI Event: Command Complete (0x0e) plen 4                 #12 [hci1] 0.916532
      Set Controller To Host Flow Control (0x03|0x0031) ncmd 1
        Status: Success (0x00)
< HCI Command: LE Read Local Suppor.. (0x08|0x0003) plen 0  #13 [hci1] 0.936067
> HCI Event: Command Complete (0x0e) plen 12                #14 [hci1] 0.936526
      LE Read Local Supported Features (0x08|0x0003) ncmd 1
        Status: Success (0x00)
        Features: 0xfd 0x79 0x00 0xf7 0x30 0x01 0x00 0x00
          LE Encryption
          Extended Reject Indication
          Peripheral-initiated Features Exchange
          LE Ping
          LE Data Packet Length Extension
          LL Privacy
          Extended Scanner Filter Policies
          LE 2M PHY
          LE Coded PHY
          LE Extended Advertising
          LE Periodic Advertising
          Channel Selection Algorithm #2
          Periodic Advertising Sync Transfer - Sender
          Periodic Advertising Sync Transfer - Recipient
          Sleep Clock Accuracy Updates
          Connected Isochronous Stream - Central
          Connected Isochronous Stream - Peripheral
          Isochronous Broadcaster
          Synchronized Receiver
          Periodic Advertising ADI support
          Connection Subrating
          Unknown features (0x0000010000000000)
< HCI Command: LE Set Host Feature (0x08|0x0074) plen 2     #15 [hci1] 0.956067
        Bit Number: 32
          Connected Isochronous Stream (Host Support)
        Bit Value: 1
> HCI Event: Command Complete (0x0e) plen 4                 #16 [hci1] 0.956467
      LE Set Host Feature (0x08|0x0074) ncmd 1
        Status: Success (0x00)
< HCI Command: LE Read Buffer v2 (0x08|0x0060) plen 0       #17 [hci1] 0.976068
> HCI Event: Command Complete (0x0e) plen 10                #18 [hci1] 0.976556
      LE Read Buffer v2 (0x08|0x0060) ncmd 1
        Status: Success (0x00)
        ACL MTU: 27
        ACL max packet: 3
        ISO MTU: 318
        ISO max packet: 3
< HCI Command: LE Read Maximum Adve.. (0x08|0x003a) plen 0  #19 [hci1] 0.996102
> HCI Event: Command Complete (0x0e) plen 6                 #20 [hci1] 0.996595
      LE Read Maximum Advertising Data Length (0x08|0x003a) ncmd 1
        Status: Success (0x00)
        Max length: 1650
< HCI Command: LE Read Supported St.. (0x08|0x001c) plen 0  #21 [hci1] 1.016071
> HCI Event: Command Complete (0x0e) plen 12                #22 [hci1] 1.016631
      LE Read Supported States (0x08|0x001c) ncmd 1
        Status: Success (0x00)
        States: 0x000003ff3e0306ff
          Non-connectable Advertising State
          Scannable Advertising State
          Connectable Advertising State
          High Duty Cycle Directed Advertising State
          Passive Scanning State
          Active Scanning State
          Initiating State
            and Connection State (Central Role)
          Connection State (Peripheral Role)
          Scannable Advertising State
            and Passive Scanning State
          Connectable Advertising State
            and Passive Scanning State
          Non-connectable Advertising State
            and Initiating State
          Scannable Advertising State
            and Initiating State
          Active Scanning State
            and Connection State (Central Role)
          Passive Scanning State
            and Connection State (Peripheral Role)
          Active Scanning State
            and Connection State (Peripheral Role)
          Initiating State
            and Connection State (Central Role)
            and Central Role & Central Role
          Low Duty Cycle Directed Advertising State
          Connectable Advertising State
            and Initiating State
            and Central Role & Peripheral Role
          High Duty Cycle Directed Advertising State
            and Initiating State
            and Central Role & Peripheral Role
          Low Duty Cycle Directed Advertising State
            and Initiating State
            and Central Role & Peripheral Role
          Connectable Advertising State
            and Connection State (Central Role)
            and Central Role & Peripheral Role
          High Duty Cycle Directed Advertising State
            and Connection State (Central Role)
            and Central Role & Peripheral Role
          Low Duty Cycle Directed Advertising State
            and Connection State (Central Role)
            and Central Role & Peripheral Role
          Connectable Advertising State
            and Connection State (Peripheral Role)
            and Central Role & Peripheral Role
          High Duty Cycle Directed Advertising State
            and Connection State (Peripheral Role)
            and Peripheral Role & Peripheral Role
          Low Duty Cycle Directed Advertising State
            and Connection State (Peripheral Role)
            and Peripheral Role & Peripheral Role
          Initiating State
            and Connection State (Peripheral Role)
            and Central Role & Peripheral Role
< HCI Command: LE Read Maximum Data.. (0x08|0x002f) plen 0  #23 [hci1] 1.036074
> HCI Event: Command Complete (0x0e) plen 12                #24 [hci1] 1.036615
      LE Read Maximum Data Length (0x08|0x002f) ncmd 1
        Status: Success (0x00)
        Max TX octets: 251
        Max TX time: 2704
        Max RX octets: 251
        Max RX time: 2704
< HCI Command: LE Write Suggested D.. (0x08|0x0024) plen 4  #25 [hci1] 1.056075
        TX octets: 251
        TX time: 2704
> HCI Event: Command Complete (0x0e) plen 4                 #26 [hci1] 1.056552
      LE Write Suggested Default Data Length (0x08|0x0024) ncmd 1
        Status: Success (0x00)
< HCI Command: LE Read Resolving Li.. (0x08|0x002a) plen 0  #27 [hci1] 1.076073
> HCI Event: Command Complete (0x0e) plen 5                 #28 [hci1] 1.076462
      LE Read Resolving List Size (0x08|0x002a) ncmd 1
        Status: Success (0x00)
        Size: 8
< HCI Command: LE Set Event Mask (0x08|0x0001) plen 8       #29 [hci1] 1.096074
        Mask: 0x000002023f87fa5e
          LE Advertising Report
          LE Connection Update Complete
          LE Read Remote Used Features Complete
          LE Long Term Key Request
          LE Data Length Change
          LE Enhanced Connection Complete
          LE PHY Update Complete
          LE Extended Advertising Report
          LE Periodic Advertising Sync Established
          LE Periodic Advertising Report
          LE Periodic Advertising Sync Lost
          LE Extended Scan Timeout
          LE Extended Advertising Set Terminated
          LE Scan Request Received
          LE Periodic Advertising Sync Transfer Rvc
          LE CIS Established
          LE CIS Request
          LE Create BIG Complete
          LE Terminate BIG Complete
          LE BIG Sync Estabilished Complete
          LE BIG Sync Lost
          LE BIG Info Advertising Report
          Unknown mask (0x0000020000000000)
> HCI Event: Command Complete (0x0e) plen 4                 #30 [hci1] 1.096636
      LE Set Event Mask (0x08|0x0001) ncmd 1
        Status: Success (0x00)
< HCI Command: Set Event Mask (0x03|0x0001) plen 8          #31 [hci1] 1.116080
        Mask: 0x2000800002008890
          Disconnection Complete
          Encryption Change
          Read Remote Version Information Complete
          Hardware Error
          Data Buffer Overflow
          Encryption Key Refresh Complete
          LE Meta
> HCI Event: Command Complete (0x0e) plen 4                 #32 [hci1] 1.116576
      Set Event Mask (0x03|0x0001) ncmd 1
        Status: Success (0x00)
< HCI Command: Read BD ADDR (0x04|0x0009) plen 0            #33 [hci1] 1.136086
> HCI Event: Command Complete (0x0e) plen 10                #34 [hci1] 1.136533
      Read BD ADDR (0x04|0x0009) ncmd 1
        Status: Success (0x00)
        Address: 00:00:00:00:00:00 (OUI 00-00-00)
< HCI Command: LE Set Random Address (0x08|0x0005) plen 6   #35 [hci1] 1.156086
        Address: D5:B6:CC:31:DB:3B (Static)
> HCI Event: Command Complete (0x0e) plen 4                 #36 [hci1] 1.156555
      LE Set Random Address (0x08|0x0005) ncmd 1
        Status: Success (0x00)
< HCI Command: LE Set Extended Adv.. (0x08|0x0036) plen 25  #37 [hci1] 3.666580
        Handle: 0x00
        Properties: 0x0013
          Connectable
          Scannable
          Use legacy advertising PDUs: ADV_IND
        Min advertising interval: 100.000 msec (0x00a0)
        Max advertising interval: 150.000 msec (0x00f0)
        Channel map: 37, 38, 39 (0x07)
        Own address type: Random (0x01)
        Peer address type: Public (0x00)
        Peer address: 00:00:00:00:00:00 (OUI 00-00-00)
        Filter policy: Allow Scan Request from Any, Allow Connect Request from Any (0x00)
        TX power: Host has no preference (0x7f)
        Primary PHY: LE 1M (0x01)
        Secondary max skip: 0x00
        Secondary PHY: LE 1M (0x01)
        SID: 0x00
        Scan request notifications: Disabled (0x00)
> HCI Event: Command Complete (0x0e) plen 5                 #38 [hci1] 3.667356
      LE Set Extended Advertising Parameters (0x08|0x0036) ncmd 1
        Status: Success (0x00)
        TX power (selected): 0 dbm (0x00)
< HCI Command: LE Set Advertising S.. (0x08|0x0035) plen 7  #39 [hci1] 3.676313
        Advertising handle: 0x00
        Advertising random address: D5:B6:CC:31:DB:3B (Static)
> HCI Event: Command Complete (0x0e) plen 4                 #40 [hci1] 3.676857
      LE Set Advertising Set Random Address (0x08|0x0035) ncmd 1
        Status: Success (0x00)
< HCI Command: LE Set Extended Adv.. (0x08|0x0037) plen 22  #41 [hci1] 3.696205
        Handle: 0x00
        Operation: Complete extended advertising data (0x03)
        Fragment preference: Minimize fragmentation (0x01)
        Data length: 0x12
        Flags: 0x06
          LE General Discoverable Mode
          BR/EDR Not Supported
        Name (complete): Tester_F6B11A
> HCI Event: Command Complete (0x0e) plen 4                 #42 [hci1] 3.696963
      LE Set Extended Advertising Data (0x08|0x0037) ncmd 1
        Status: Success (0x00)
< HCI Command: LE Set Extended Scan.. (0x08|0x0038) plen 4  #43 [hci1] 3.716115
        Handle: 0x00
        Operation: Complete scan response data (0x03)
        Fragment preference: Minimize fragmentation (0x01)
        Data length: 0x00
> HCI Event: Command Complete (0x0e) plen 4                 #44 [hci1] 3.716566
      LE Set Extended Scan Response Data (0x08|0x0038) ncmd 1
        Status: Success (0x00)
< HCI Command: LE Set Extended Adve.. (0x08|0x0039) plen 6  #45 [hci1] 3.736114
        Extended advertising: Enabled (0x01)
        Number of sets: 1 (0x01)
        Entry 0
          Handle: 0x00
          Duration: 0 ms (0x00)
          Max ext adv events: 0
> HCI Event: Command Complete (0x0e) plen 4                 #46 [hci1] 3.736669
      LE Set Extended Advertising Enable (0x08|0x0039) ncmd 1
        Status: Success (0x00)
> HCI Event: LE Meta Event (0x3e) plen 31                   #47 [hci1] 3.853694
      LE Enhanced Connection Complete (0x0a)
        Status: Success (0x00)
        Handle: 1443
        Role: Peripheral (0x01)
        Peer address type: Public (0x00)
        Peer address: DF:A9:FF:F6:B1:1A (OUI DF-A9-FF)
        Local resolvable private address: 00:00:00:00:00:00 (Non-Resolvable)
        Peer resolvable private address: 00:00:00:00:00:00 (Non-Resolvable)
        Connection interval: 87.50 msec (0x0046)
        Connection latency: 0 (0x0000)
        Supervision timeout: 25120 msec (0x09d0)
        Central clock accuracy: 0x01
> HCI Event: LE Meta Event (0x3e) plen 6                    #48 [hci1] 3.853749
      LE Advertising Set Terminated (0x12)
        Status: Success (0x00)
        Handle: 0
        Connection handle: 1443
        Number of completed extended advertising events: 0
< HCI Command: LE Read Remote Used... (0x08|0x0016) plen 2  #49 [hci1] 3.857076
        Handle: 1443 Address: DF:A9:FF:F6:B1:1A (OUI DF-A9-FF)
< ACL Data TX: Handle 1443 flags 0x00 dlen 7                #50 [hci1] 3.857301
      ATT: Exchange MTU Request (0x02) len 2
        Client RX MTU: 251
> HCI Event: Command Status (0x0f) plen 4                   #51 [hci1] 3.857836
      LE Read Remote Used Features (0x08|0x0016) ncmd 1
        Status: Success (0x00)
> HCI Event: Number of Completed Packets (0x13) plen 5      #52 [hci1] 4.029572
        Num handles: 1
        Handle: 1443 Address: DF:A9:FF:F6:B1:1A (OUI DF-A9-FF)
        Count: 1
        #50: len 7 (0 Kb/s)
        Latency: 172 msec (172-172 msec ~172 msec)
> HCI Event: LE Meta Event (0x3e) plen 12                   #53 [hci1] 4.117479
      LE Read Remote Used Features (0x04)
        Status: Success (0x00)
        Handle: 1443 Address: DF:A9:FF:F6:B1:1A (OUI DF-A9-FF)
        Features: 0x2d 0x49 0x00 0xf7 0x67 0xd9 0x00 0x80
          LE Encryption
          Extended Reject Indication
          Peripheral-initiated Features Exchange
          LE Data Packet Length Extension
          LE 2M PHY
          LE Coded PHY
          Channel Selection Algorithm #2
          Periodic Advertising Sync Transfer - Sender
          Periodic Advertising Sync Transfer - Recipient
          Sleep Clock Accuracy Updates
          Connected Isochronous Stream - Central
          Connected Isochronous Stream - Peripheral
          Isochronous Broadcaster
          Synchronized Receiver
          Connected Isochronous Stream (Host Support)
          LE Power Control Request
          LE Power Control Request
          Connection Subrating
          Connection Subrating (Host Support)
          Unknown features (0x8000d90000000000)
> ACL Data RX: Handle 1443 flags 0x02 dlen 7                #54 [hci1] 4.554662
      ATT: Exchange MTU Request (0x02) len 2
        Client RX MTU: 64
> ACL Data RX: Handle 1443 flags 0x02 dlen 7                #55 [hci1] 4.555117
      ATT: Exchange MTU Response (0x03) len 2
        Server RX MTU: 64
< HCI Command: Host Number of Compl.. (0x03|0x0035) plen 5  #56 [hci1] 4.556595
        Num handles: 1
        Handle: 1443 Address: DF:A9:FF:F6:B1:1A (OUI DF-A9-FF)
        Count: 1
< ACL Data TX: Handle 1443 flags 0x00 dlen 7                #57 [hci1] 4.556699
      ATT: Exchange MTU Response (0x03) len 2
        Server RX MTU: 251
< HCI Command: Host Number of Compl.. (0x03|0x0035) plen 5  #58 [hci1] 4.557067
        Num handles: 1
        Handle: 1443 Address: DF:A9:FF:F6:B1:1A (OUI DF-A9-FF)
        Count: 1
> HCI Event: Number of Completed Packets (0x13) plen 5      #59 [hci1] 4.729590
        Num handles: 1
        Handle: 1443 Address: DF:A9:FF:F6:B1:1A (OUI DF-A9-FF)
        Count: 1
        #57: len 7 (0 Kb/s)
        Latency: 172 msec (172-172 msec ~172 msec)
> ACL Data RX: Handle 1443 flags 0x02 dlen 11               #60 [hci1] 6.654671
      SMP: Pairing Request (0x01) len 6
        IO capability: KeyboardDisplay (0x04)
        OOB data: Authentication data not present (0x00)
        Authentication requirement: Bonding, No MITM, SC, No Keypresses (0x09)
        Max encryption key size: 16
        Initiator key distribution: EncKey IdKey (0x03)
        Responder key distribution: EncKey IdKey Sign (0x07)
< HCI Command: Host Number of Compl.. (0x03|0x0035) plen 5  #61 [hci1] 6.656137
        Num handles: 1
        Handle: 1443 Address: DF:A9:FF:F6:B1:1A (OUI DF-A9-FF)
        Count: 1
< ACL Data TX: Handle 1443 flags 0x00 dlen 11               #62 [hci1] 6.656180
      SMP: Pairing Response (0x02) len 6
        IO capability: NoInputNoOutput (0x03)
        OOB data: Authentication data not present (0x00)
        Authentication requirement: Bonding, No MITM, SC, No Keypresses (0x09)
        Max encryption key size: 16
        Initiator key distribution: IdKey (0x02)
        Responder key distribution: <none> (0x00)
> HCI Event: Number of Completed Packets (0x13) plen 5      #63 [hci1] 6.829863
        Num handles: 1
        Handle: 1443 Address: DF:A9:FF:F6:B1:1A (OUI DF-A9-FF)
        Count: 1
        #62: len 11 (0 Kb/s)
        Latency: 173 msec (172-173 msec ~173 msec)
> ACL Data RX: Handle 1443 flags 0x02 dlen 27               #64 [hci1] 6.830128
> ACL Data RX: Handle 1443 flags 0x01 dlen 27               #65 [hci1] 6.830625
> ACL Data RX: Handle 1443 flags 0x01 dlen 15               #66 [hci1] 6.831047
      SMP: Pairing Public Key (0x0c) len 64
        X: 13c68d42dd12964ead5f942faac47e7423ca8ce8d30af18bd34c09a4e39713d4
        Y: d4dc0e83c95d5d606667e926536dee8415ee6dd6a6818c4268291bcb54676640
< HCI Command: Host Number of Compl.. (0x03|0x0035) plen 5  #67 [hci1] 6.837019
        Num handles: 1
        Handle: 1443 Address: DF:A9:FF:F6:B1:1A (OUI DF-A9-FF)
        Count: 1
< HCI Command: Host Number of Compl.. (0x03|0x0035) plen 5  #68 [hci1] 6.837159
        Num handles: 1
        Handle: 1443 Address: DF:A9:FF:F6:B1:1A (OUI DF-A9-FF)
        Count: 1
< HCI Command: Host Number of Compl.. (0x03|0x0035) plen 5  #69 [hci1] 6.837486
        Num handles: 1
        Handle: 1443 Address: DF:A9:FF:F6:B1:1A (OUI DF-A9-FF)
        Count: 1
< ACL Data TX: Handle 1443 flags 0x00 dlen 27               #70 [hci1] 6.837560
< ACL Data TX: Handle 1443 flags 0x01 dlen 27               #71 [hci1] 6.837587
< ACL Data TX: Handle 1443 flags 0x01 dlen 15               #72 [hci1] 6.837637
      SMP: Pairing Public Key (0x0c) len 64
        X: 98308440221e2d910f0e54b71e7ec652857aa9b5a0dc65028824cc19db1226e9
        Y: 67a4816bcb62efb21701e31fdb27561a6217575fb007a8bbdabe7e28b6f68482
> HCI Event: Number of Completed Packets (0x13) plen 5      #73 [hci1] 6.917650
        Num handles: 1
        Handle: 1443 Address: DF:A9:FF:F6:B1:1A (OUI DF-A9-FF)
        Count: 1
        #70: len 27 (2 Kb/s)
        Latency: 80 msec (80-173 msec ~126 msec)
> HCI Event: Number of Completed Packets (0x13) plen 5      #74 [hci1] 6.918456
        Num handles: 1
        Handle: 1443 Address: DF:A9:FF:F6:B1:1A (OUI DF-A9-FF)
        Count: 1
        #71: len 27 (2 Kb/s)
        Latency: 80 msec (80-173 msec ~103 msec)
< ACL Data TX: Handle 1443 flags 0x00 dlen 21               #75 [hci1] 6.936472
      SMP: Pairing Confirm (0x03) len 16
        Confim value: 7a419fb80cdfe5ab0f97aaf2f0682c7b
> HCI Event: Number of Completed Packets (0x13) plen 5      #76 [hci1] 7.004558
        Num handles: 1
        Handle: 1443 Address: DF:A9:FF:F6:B1:1A (OUI DF-A9-FF)
        Count: 1
        #72: len 15 (0 Kb/s)
        Latency: 166 msec (80-173 msec ~135 msec)
> HCI Event: Number of Completed Packets (0x13) plen 5      #77 [hci1] 7.092284
        Num handles: 1
        Handle: 1443 Address: DF:A9:FF:F6:B1:1A (OUI DF-A9-FF)
        Count: 1
        #75: len 21 (1 Kb/s)
        Latency: 155 msec (80-173 msec ~145 msec)
> ACL Data RX: Handle 1443 flags 0x02 dlen 21               #78 [hci1] 7.092580
      SMP: Pairing Random (0x04) len 16
        Random value: 44a1020de7433ec30000000000000000
< HCI Command: Host Number of Compl.. (0x03|0x0035) plen 5  #79 [hci1] 7.096808
        Num handles: 1
        Handle: 1443 Address: DF:A9:FF:F6:B1:1A (OUI DF-A9-FF)
        Count: 1
< ACL Data TX: Handle 1443 flags 0x00 dlen 21               #80 [hci1] 7.096894
      SMP: Pairing Random (0x04) len 16
        Random value: 8e6108f966a694cbe26df70bb96773e6
> HCI Event: Number of Completed Packets (0x13) plen 5      #81 [hci1] 7.267061
        Num handles: 1
        Handle: 1443 Address: DF:A9:FF:F6:B1:1A (OUI DF-A9-FF)
        Count: 1
        #80: len 21 (0 Kb/s)
        Latency: 170 msec (80-173 msec ~157 msec)
> ACL Data RX: Handle 1443 flags 0x02 dlen 21               #82 [hci1] 7.442497
      SMP: Pairing DHKey Check (0x0d) len 16
        E: aeea2a53813811876940ca3cdc817880
< HCI Command: Host Number of Compl.. (0x03|0x0035) plen 5  #83 [hci1] 7.457073
        Num handles: 1
        Handle: 1443 Address: DF:A9:FF:F6:B1:1A (OUI DF-A9-FF)
        Count: 1
< ACL Data TX: Handle 1443 flags 0x00 dlen 21               #84 [hci1] 7.457193
      SMP: Pairing DHKey Check (0x0d) len 16
        E: 5a1610dfcc69c3e0fb290a188481acf4
> HCI Event: Number of Completed Packets (0x13) plen 5      #85 [hci1] 7.617095
        Num handles: 1
        Handle: 1443 Address: DF:A9:FF:F6:B1:1A (OUI DF-A9-FF)
        Count: 1
        #84: len 21 (1 Kb/s)
        Latency: 159 msec (80-173 msec ~158 msec)
> HCI Event: LE Meta Event (0x3e) plen 13                   #86 [hci1] 7.705113
      LE Long Term Key Request (0x05)
        Handle: 1443 Address: DF:A9:FF:F6:B1:1A (OUI DF-A9-FF)
        Random number: 0x0000000000000000
        Encrypted diversifier: 0x0000
< HCI Command: LE Long Term Key Re.. (0x08|0x001a) plen 18  #87 [hci1] 7.716582
        Handle: 1443 Address: DF:A9:FF:F6:B1:1A (OUI DF-A9-FF)
        Long term key: bdc15cd6bab42ff511d0e43e0c0c3f16
> HCI Event: Command Complete (0x0e) plen 6                 #88 [hci1] 7.717271
      LE Long Term Key Request Reply (0x08|0x001a) ncmd 1
        Status: Success (0x00)
        Handle: 1443 Address: DF:A9:FF:F6:B1:1A (OUI DF-A9-FF)
> HCI Event: Encryption Change (0x08) plen 4                #89 [hci1] 8.142453
        Status: Success (0x00)
        Handle: 1443 Address: DF:A9:FF:F6:B1:1A (OUI DF-A9-FF)
        Encryption: Enabled with AES-CCM (0x01)
> ACL Data RX: Handle 1443 flags 0x02 dlen 21               #90 [hci1] 8.229898
      SMP: Identity Information (0x08) len 16
        Identity resolving key: 73ad7f7964881f45455f730416fca880
< HCI Command: Host Number of Compl.. (0x03|0x0035) plen 5  #91 [hci1] 8.266850
        Num handles: 1
        Handle: 1443 Address: DF:A9:FF:F6:B1:1A (OUI DF-A9-FF)
        Count: 1
> ACL Data RX: Handle 1443 flags 0x02 dlen 12               #92 [hci1] 8.404766
      SMP: Identity Address Information (0x09) len 7
        Address: DF:A9:FF:F6:B1:1A (OUI DF-A9-FF)
< HCI Command: LE Add Device To Re.. (0x08|0x0027) plen 39  #93 [hci1] 8.416434
        Address type: Public (0x00)
        Address: DF:A9:FF:F6:B1:1A (OUI DF-A9-FF)
        Peer identity resolving key: 73ad7f7964881f45455f730416fca880
        Local identity resolving key: 00000000000000000000000000000000
> HCI Event: Command Complete (0x0e) plen 4                 #94 [hci1] 8.417492
      LE Add Device To Resolving List (0x08|0x0027) ncmd 1
        Status: Success (0x00)
< HCI Command: LE Set Privacy Mode (0x08|0x004e) plen 8     #95 [hci1] 8.436254
        Peer Identity address type: Public (0x00)
        Peer Identity address: DF:A9:FF:F6:B1:1A (OUI DF-A9-FF)
        Privacy Mode: Use Device Privacy (0x01)
> HCI Event: Command Complete (0x0e) plen 4                 #96 [hci1] 8.436885
      LE Set Privacy Mode (0x08|0x004e) ncmd 1
        Status: Success (0x00)
< HCI Command: LE Set Address Resol.. (0x08|0x002d) plen 1  #97 [hci1] 8.456246
        Address resolution: Enabled (0x01)
> HCI Event: Command Complete (0x0e) plen 4                 #98 [hci1] 8.456727
      LE Set Address Resolution Enable (0x08|0x002d) ncmd 1
        Status: Success (0x00)
< HCI Command: Host Number of Compl.. (0x03|0x0035) plen 5  #99 [hci1] 8.476182
        Num handles: 1
        Handle: 1443 Address: DF:A9:FF:F6:B1:1A (OUI DF-A9-FF)
        Count: 1
> ACL Data RX: Handle 1443 flags 0x02 dlen 11              #100 [hci1] 8.492186
      ATT: Read By Group Type Request (0x10) len 6
        Handle range: 0x0001-0xffff
        Attribute group type: Primary Service (0x2800)
< HCI Command: Host Number of Comp.. (0x03|0x0035) plen 5  #101 [hci1] 8.496384
        Num handles: 1
        Handle: 1443 Address: DF:A9:FF:F6:B1:1A (OUI DF-A9-FF)
        Count: 1
< ACL Data TX: Handle 1443 flags 0x00 dlen 27              #102 [hci1] 8.496494
< ACL Data TX: Handle 1443 flags 0x01 dlen 15              #103 [hci1] 8.496504
      ATT: Read By Group Type Response (0x11) len 37
        Attribute data length: 6
        Attribute group list: 6 entries
        Handle range: 0x0001-0x000a
        UUID: Generic Attribute Profile (0x1801)
        Handle range: 0x000b-0x0011
        UUID: Generic Access Profile (0x1800)
        Handle range: 0x0012-0x0026
        UUID: Device Information (0x180a)
        Handle range: 0x0027-0x0029
        UUID: Immediate Alert (0x1802)
        Handle range: 0x002a-0x003c
        UUID: Published Audio Capabilities (0x1850)
        Handle range: 0x003d-0x004c
        UUID: Audio Stream Control (0x184e)
> HCI Event: Number of Completed Packets (0x13) plen 5     #104 [hci1] 8.580227
        Num handles: 1
        Handle: 1443 Address: DF:A9:FF:F6:B1:1A (OUI DF-A9-FF)
        Count: 1
        #102: len 27 (2 Kb/s)
        Latency: 83 msec (80-173 msec ~121 msec)
> HCI Event: Number of Completed Packets (0x13) plen 5     #105 [hci1] 8.667188
        Num handles: 1
        Handle: 1443 Address: DF:A9:FF:F6:B1:1A (OUI DF-A9-FF)
        Count: 1
        #103: len 15 (0 Kb/s)
        Latency: 170 msec (80-173 msec ~145 msec)
> ACL Data RX: Handle 1443 flags 0x02 dlen 11              #106 [hci1] 8.667496
      ATT: Read By Group Type Request (0x10) len 6
        Handle range: 0x004d-0xffff
        Attribute group type: Primary Service (0x2800)
< HCI Command: Host Number of Comp.. (0x03|0x0035) plen 5  #107 [hci1] 8.676931
        Num handles: 1
        Handle: 1443 Address: DF:A9:FF:F6:B1:1A (OUI DF-A9-FF)
        Count: 1
< ACL Data TX: Handle 1443 flags 0x00 dlen 9               #108 [hci1] 8.677128
      ATT: Error Response (0x01) len 4
        Read By Group Type Request (0x10)
        Handle: 0x004d
        Error: Attribute Not Found (0x0a)
> HCI Event: Number of Completed Packets (0x13) plen 5     #109 [hci1] 8.842139
        Num handles: 1
        Handle: 1443 Address: DF:A9:FF:F6:B1:1A (OUI DF-A9-FF)
        Count: 1
        #108: len 9 (0 Kb/s)
        Latency: 165 msec (80-173 msec ~155 msec)
> ACL Data RX: Handle 1443 flags 0x02 dlen 11              #110 [hci1] 8.842513
      ATT: Read By Type Request (0x08) len 6
        Handle range: 0x0001-0x000a
        Attribute type: Characteristic (0x2803)
< HCI Command: Host Number of Comp.. (0x03|0x0035) plen 5  #111 [hci1] 8.856862
        Num handles: 1
        Handle: 1443 Address: DF:A9:FF:F6:B1:1A (OUI DF-A9-FF)
        Count: 1
< ACL Data TX: Handle 1443 flags 0x00 dlen 27              #112 [hci1] 8.856939
< ACL Data TX: Handle 1443 flags 0x01 dlen 7               #113 [hci1] 8.856961
      ATT: Read By Type Response (0x09) len 29
        Attribute data length: 7
        Attribute data list: 4 entries
        Handle: 0x0002
        Value: 200300052a
            Properties: 0x20
              Indicate (0x20)
            Value Handle: 0x0003
            Value UUID: Service Changed (0x2a05)
        Handle: 0x0005
        Value: 0a0600292b
            Properties: 0x0a
              Read (0x02)
              Write (0x08)
            Value Handle: 0x0006
            Value UUID: Client Supported Features (0x2b29)
        Handle: 0x0007
        Value: 0208002a2b
            Properties: 0x02
              Read (0x02)
            Value Handle: 0x0008
            Value UUID: Database Hash (0x2b2a)
        Handle: 0x0009
        Value: 020a003a2b
            Properties: 0x02
              Read (0x02)
            Value Handle: 0x000a
            Value UUID: Server Supported Features (0x2b3a)
> HCI Event: Number of Completed Packets (0x13) plen 5     #114 [hci1] 8.930181
        Num handles: 1
        Handle: 1443 Address: DF:A9:FF:F6:B1:1A (OUI DF-A9-FF)
        Count: 1
        #112: len 27 (2 Kb/s)
        Latency: 73 msec (73-173 msec ~114 msec)
> HCI Event: Number of Completed Packets (0x13) plen 5     #115 [hci1] 9.017268
        Num handles: 1
        Handle: 1443 Address: DF:A9:FF:F6:B1:1A (OUI DF-A9-FF)
        Count: 1
        #113: len 7 (0 Kb/s)
        Latency: 160 msec (73-173 msec ~137 msec)
> ACL Data RX: Handle 1443 flags 0x02 dlen 11              #116 [hci1] 9.017429
      ATT: Read By Type Request (0x08) len 6
        Handle range: 0x000a-0x000a
        Attribute type: Characteristic (0x2803)
< HCI Command: Host Number of Comp.. (0x03|0x0035) plen 5  #117 [hci1] 9.036869
        Num handles: 1
        Handle: 1443 Address: DF:A9:FF:F6:B1:1A (OUI DF-A9-FF)
        Count: 1
< ACL Data TX: Handle 1443 flags 0x00 dlen 9               #118 [hci1] 9.037110
      ATT: Error Response (0x01) len 4
        Read By Type Request (0x08)
        Handle: 0x000a
        Error: Attribute Not Found (0x0a)
> HCI Event: Number of Completed Packets (0x13) plen 5     #119 [hci1] 9.192240
        Num handles: 1
        Handle: 1443 Address: DF:A9:FF:F6:B1:1A (OUI DF-A9-FF)
        Count: 1
        #118: len 9 (0 Kb/s)
        Latency: 155 msec (73-173 msec ~146 msec)
> ACL Data RX: Handle 1443 flags 0x02 dlen 9               #120 [hci1] 9.192472
      ATT: Find Information Request (0x04) len 4
        Handle range: 0x0004-0x0004
< HCI Command: Host Number of Comp.. (0x03|0x0035) plen 5  #121 [hci1] 9.196773
        Num handles: 1
        Handle: 1443 Address: DF:A9:FF:F6:B1:1A (OUI DF-A9-FF)
        Count: 1
< ACL Data TX: Handle 1443 flags 0x00 dlen 10              #122 [hci1] 9.196884
      ATT: Find Information Response (0x05) len 5
        Format: UUID-16 (0x01)
        Handle: 0x0004
        UUID: Client Characteristic Configuration (0x2902)
> HCI Event: Number of Completed Packets (0x13) plen 5     #123 [hci1] 9.367169
        Num handles: 1
        Handle: 1443 Address: DF:A9:FF:F6:B1:1A (OUI DF-A9-FF)
        Count: 1
        #122: len 10 (0 Kb/s)
        Latency: 170 msec (73-173 msec ~158 msec)
> ACL Data RX: Handle 1443 flags 0x02 dlen 11              #124 [hci1] 9.367470
      ATT: Read By Type Request (0x08) len 6
        Handle range: 0x000b-0x0011
        Attribute type: Characteristic (0x2803)
< HCI Command: Host Number of Comp.. (0x03|0x0035) plen 5  #125 [hci1] 9.376813
        Num handles: 1
        Handle: 1443 Address: DF:A9:FF:F6:B1:1A (OUI DF-A9-FF)
        Count: 1
< ACL Data TX: Handle 1443 flags 0x00 dlen 27              #126 [hci1] 9.376860
      ATT: Read By Type Response (0x09) len 22
        Attribute data length: 7
        Attribute data list: 3 entries
        Handle: 0x000c
        Value: 0a0d00002a
            Properties: 0x0a
              Read (0x02)
              Write (0x08)
            Value Handle: 0x000d
            Value UUID: Device Name (0x2a00)
        Handle: 0x000e
        Value: 0a0f00012a
            Properties: 0x0a
              Read (0x02)
              Write (0x08)
            Value Handle: 0x000f
            Value UUID: Appearance (0x2a01)
        Handle: 0x0010
        Value: 021100042a
            Properties: 0x02
              Read (0x02)
            Value Handle: 0x0011
            Value UUID: Peripheral Preferred Connection Parameters (0x2a04)
> HCI Event: Number of Completed Packets (0x13) plen 5     #127 [hci1] 9.542135
        Num handles: 1
        Handle: 1443 Address: DF:A9:FF:F6:B1:1A (OUI DF-A9-FF)
        Count: 1
        #126: len 27 (1 Kb/s)
        Latency: 165 msec (73-173 msec ~161 msec)
> ACL Data RX: Handle 1443 flags 0x02 dlen 11              #128 [hci1] 9.542404
      ATT: Read By Type Request (0x08) len 6
        Handle range: 0x0011-0x0011
        Attribute type: Characteristic (0x2803)
< HCI Command: Host Number of Comp.. (0x03|0x0035) plen 5  #129 [hci1] 9.556850
        Num handles: 1
        Handle: 1443 Address: DF:A9:FF:F6:B1:1A (OUI DF-A9-FF)
        Count: 1
< ACL Data TX: Handle 1443 flags 0x00 dlen 9               #130 [hci1] 9.557027
      ATT: Error Response (0x01) len 4
        Read By Type Request (0x08)
        Handle: 0x0011
        Error: Attribute Not Found (0x0a)
> HCI Event: Number of Completed Packets (0x13) plen 5     #131 [hci1] 9.717129
        Num handles: 1
        Handle: 1443 Address: DF:A9:FF:F6:B1:1A (OUI DF-A9-FF)
        Count: 1
        #130: len 9 (0 Kb/s)
        Latency: 160 msec (73-173 msec ~160 msec)
> ACL Data RX: Handle 1443 flags 0x02 dlen 11              #132 [hci1] 9.717432
      ATT: Read By Type Request (0x08) len 6
        Handle range: 0x0012-0x0026
        Attribute type: Characteristic (0x2803)
< HCI Command: Host Number of Comp.. (0x03|0x0035) plen 5  #133 [hci1] 9.736918
        Num handles: 1
        Handle: 1443 Address: DF:A9:FF:F6:B1:1A (OUI DF-A9-FF)
        Count: 1
< ACL Data TX: Handle 1443 flags 0x00 dlen 27              #134 [hci1] 9.737076
< ACL Data TX: Handle 1443 flags 0x01 dlen 27              #135 [hci1] 9.737092
< ACL Data TX: Handle 1443 flags 0x01 dlen 8               #136 [hci1] 9.737122
      ATT: Read By Type Response (0x09) len 57
        Attribute data length: 7
        Attribute data list: 8 entries
        Handle: 0x0013
        Value: 021400242a
            Properties: 0x02
              Read (0x02)
            Value Handle: 0x0014
            Value UUID: Model Number String (0x2a24)
        Handle: 0x0015
        Value: 021600292a
            Properties: 0x02
              Read (0x02)
            Value Handle: 0x0016
            Value UUID: Manufacturer Name String (0x2a29)
        Handle: 0x0017
        Value: 021800502a
            Properties: 0x02
              Read (0x02)
            Value Handle: 0x0018
            Value UUID: PnP ID (0x2a50)
        Handle: 0x0019
        Value: 021a00252a
            Properties: 0x02
              Read (0x02)
            Value Handle: 0x001a
            Value UUID: Serial Number String (0x2a25)
        Handle: 0x001b
        Value: 021c00262a
            Properties: 0x02
              Read (0x02)
            Value Handle: 0x001c
            Value UUID: Firmware Revision String (0x2a26)
        Handle: 0x001d
        Value: 021e00272a
            Properties: 0x02
              Read (0x02)
            Value Handle: 0x001e
            Value UUID: Hardware Revision String (0x2a27)
        Handle: 0x001f
        Value: 022000282a
            Properties: 0x02
              Read (0x02)
            Value Handle: 0x0020
            Value UUID: Software Revision String (0x2a28)
        Handle: 0x0021
        Value: 022200ff2b
            Properties: 0x02
              Read (0x02)
            Value Handle: 0x0022
            Value UUID: Unknown (0x2bff)
> HCI Event: Number of Completed Packets (0x13) plen 5     #137 [hci1] 9.805213
        Num handles: 1
        Handle: 1443 Address: DF:A9:FF:F6:B1:1A (OUI DF-A9-FF)
        Count: 1
        #134: len 27 (3 Kb/s)
        Latency: 68 msec (68-173 msec ~114 msec)
> HCI Event: Number of Completed Packets (0x13) plen 5     #138 [hci1] 9.805891
        Num handles: 1
        Handle: 1443 Address: DF:A9:FF:F6:B1:1A (OUI DF-A9-FF)
        Count: 1
        #135: len 27 (3 Kb/s)
        Latency: 68 msec (68-173 msec ~91 msec)
> HCI Event: Number of Completed Packets (0x13) plen 5     #139 [hci1] 9.892160
        Num handles: 1
        Handle: 1443 Address: DF:A9:FF:F6:B1:1A (OUI DF-A9-FF)
        Count: 1
        #136: len 8 (0 Kb/s)
        Latency: 155 msec (68-173 msec ~123 msec)
> ACL Data RX: Handle 1443 flags 0x02 dlen 11              #140 [hci1] 9.892373
      ATT: Read By Type Request (0x08) len 6
        Handle range: 0x0022-0x0026
        Attribute type: Characteristic (0x2803)
< HCI Command: Host Number of Comp.. (0x03|0x0035) plen 5  #141 [hci1] 9.896813
        Num handles: 1
        Handle: 1443 Address: DF:A9:FF:F6:B1:1A (OUI DF-A9-FF)
        Count: 1
< ACL Data TX: Handle 1443 flags 0x00 dlen 20              #142 [hci1] 9.896951
      ATT: Read By Type Response (0x09) len 15
        Attribute data length: 7
        Attribute data list: 2 entries
        Handle: 0x0023
        Value: 022400232a
            Properties: 0x02
              Read (0x02)
            Value Handle: 0x0024
            Value UUID: System ID (0x2a23)
        Handle: 0x0025
        Value: 0226002a2a
            Properties: 0x02
              Read (0x02)
            Value Handle: 0x0026
            Value UUID: IEEE 11073-20601 Regulatory Cert. Data List (0x2a2a)
> HCI Event: Number of Completed Packets (0x13) plen 5    #143 [hci1] 10.067111
        Num handles: 1
        Handle: 1443 Address: DF:A9:FF:F6:B1:1A (OUI DF-A9-FF)
        Count: 1
        #142: len 20 (0 Kb/s)
        Latency: 170 msec (68-173 msec ~146 msec)
> ACL Data RX: Handle 1443 flags 0x02 dlen 11             #144 [hci1] 10.067457
      ATT: Read By Type Request (0x08) len 6
        Handle range: 0x0026-0x0026
        Attribute type: Characteristic (0x2803)
< HCI Command: Host Number of Com.. (0x03|0x0035) plen 5  #145 [hci1] 10.076898
        Num handles: 1
        Handle: 1443 Address: DF:A9:FF:F6:B1:1A (OUI DF-A9-FF)
        Count: 1
< ACL Data TX: Handle 1443 flags 0x00 dlen 9              #146 [hci1] 10.077100
      ATT: Error Response (0x01) len 4
        Read By Type Request (0x08)
        Handle: 0x0026
        Error: Attribute Not Found (0x0a)
> HCI Event: Number of Completed Packets (0x13) plen 5    #147 [hci1] 10.242189
        Num handles: 1
        Handle: 1443 Address: DF:A9:FF:F6:B1:1A (OUI DF-A9-FF)
        Count: 1
        #146: len 9 (0 Kb/s)
        Latency: 165 msec (68-173 msec ~155 msec)
> ACL Data RX: Handle 1443 flags 0x02 dlen 11             #148 [hci1] 10.242409
      ATT: Read By Type Request (0x08) len 6
        Handle range: 0x0027-0x0029
        Attribute type: Characteristic (0x2803)
< HCI Command: Host Number of Com.. (0x03|0x0035) plen 5  #149 [hci1] 10.256894
        Num handles: 1
        Handle: 1443 Address: DF:A9:FF:F6:B1:1A (OUI DF-A9-FF)
        Count: 1
< ACL Data TX: Handle 1443 flags 0x00 dlen 13             #150 [hci1] 10.256914
      ATT: Read By Type Response (0x09) len 8
        Attribute data length: 7
        Attribute data list: 1 entry
        Handle: 0x0028
        Value: 042900062a
            Properties: 0x04
              Write Without Response (0x04)
            Value Handle: 0x0029
            Value UUID: Alert Level (0x2a06)
> HCI Event: Number of Completed Packets (0x13) plen 5    #151 [hci1] 10.417267
        Num handles: 1
        Handle: 1443 Address: DF:A9:FF:F6:B1:1A (OUI DF-A9-FF)
        Count: 1
        #150: len 13 (0 Kb/s)
        Latency: 160 msec (68-173 msec ~158 msec)
> ACL Data RX: Handle 1443 flags 0x02 dlen 11             #152 [hci1] 10.417391
      ATT: Read By Type Request (0x08) len 6
        Handle range: 0x0029-0x0029
        Attribute type: Characteristic (0x2803)
< HCI Command: Host Number of Com.. (0x03|0x0035) plen 5  #153 [hci1] 10.436862
        Num handles: 1
        Handle: 1443 Address: DF:A9:FF:F6:B1:1A (OUI DF-A9-FF)
        Count: 1
< ACL Data TX: Handle 1443 flags 0x00 dlen 9              #154 [hci1] 10.437077
      ATT: Error Response (0x01) len 4
        Read By Type Request (0x08)
        Handle: 0x0029
        Error: Attribute Not Found (0x0a)
> HCI Event: Number of Completed Packets (0x13) plen 5    #155 [hci1] 10.592139
        Num handles: 1
        Handle: 1443 Address: DF:A9:FF:F6:B1:1A (OUI DF-A9-FF)
        Count: 1
        #154: len 9 (0 Kb/s)
        Latency: 155 msec (68-173 msec ~156 msec)
> ACL Data RX: Handle 1443 flags 0x02 dlen 11             #156 [hci1] 10.592410
      ATT: Read By Type Request (0x08) len 6
        Handle range: 0x002a-0x003c
        Attribute type: Characteristic (0x2803)
< HCI Command: Host Number of Com.. (0x03|0x0035) plen 5  #157 [hci1] 10.596876
        Num handles: 1
        Handle: 1443 Address: DF:A9:FF:F6:B1:1A (OUI DF-A9-FF)
        Count: 1
< ACL Data TX: Handle 1443 flags 0x00 dlen 27             #158 [hci1] 10.596952
< ACL Data TX: Handle 1443 flags 0x01 dlen 21             #159 [hci1] 10.596975
      ATT: Read By Type Response (0x09) len 43
        Attribute data length: 7
        Attribute data list: 6 entries
        Handle: 0x002b
        Value: 122c00c92b
            Properties: 0x12
              Read (0x02)
              Notify (0x10)
            Value Handle: 0x002c
            Value UUID: Sink PAC (0x2bc9)
        Handle: 0x002e
        Value: 1a2f00ca2b
            Properties: 0x1a
              Read (0x02)
              Write (0x08)
              Notify (0x10)
            Value Handle: 0x002f
            Value UUID: Sink Audio Locations (0x2bca)
        Handle: 0x0031
        Value: 123200cb2b
            Properties: 0x12
              Read (0x02)
              Notify (0x10)
            Value Handle: 0x0032
            Value UUID: Source PAC (0x2bcb)
        Handle: 0x0034
        Value: 1a3500cc2b
            Properties: 0x1a
              Read (0x02)
              Write (0x08)
              Notify (0x10)
            Value Handle: 0x0035
            Value UUID: Source Audio Locations (0x2bcc)
        Handle: 0x0037
        Value: 123800cd2b
            Properties: 0x12
              Read (0x02)
              Notify (0x10)
            Value Handle: 0x0038
            Value UUID: Available Audio Contexts (0x2bcd)
        Handle: 0x003a
        Value: 123b00ce2b
            Properties: 0x12
              Read (0x02)
              Notify (0x10)
            Value Handle: 0x003b
            Value UUID: Supported Audio Contexts (0x2bce)
> HCI Event: Number of Completed Packets (0x13) plen 5    #160 [hci1] 10.680160
        Num handles: 1
        Handle: 1443 Address: DF:A9:FF:F6:B1:1A (OUI DF-A9-FF)
        Count: 1
        #158: len 27 (2 Kb/s)
        Latency: 83 msec (68-173 msec ~119 msec)
> HCI Event: Number of Completed Packets (0x13) plen 5    #161 [hci1] 10.767118
        Num handles: 1
        Handle: 1443 Address: DF:A9:FF:F6:B1:1A (OUI DF-A9-FF)
        Count: 1
        #159: len 21 (0 Kb/s)
        Latency: 170 msec (68-173 msec ~145 msec)
> ACL Data RX: Handle 1443 flags 0x02 dlen 11             #162 [hci1] 10.767419
      ATT: Read By Type Request (0x08) len 6
        Handle range: 0x003b-0x003c
        Attribute type: Characteristic (0x2803)
< HCI Command: Host Number of Com.. (0x03|0x0035) plen 5  #163 [hci1] 10.776829
        Num handles: 1
        Handle: 1443 Address: DF:A9:FF:F6:B1:1A (OUI DF-A9-FF)
        Count: 1
< ACL Data TX: Handle 1443 flags 0x00 dlen 9              #164 [hci1] 10.777017
      ATT: Error Response (0x01) len 4
        Read By Type Request (0x08)
        Handle: 0x003b
        Error: Attribute Not Found (0x0a)
> HCI Event: Number of Completed Packets (0x13) plen 5    #165 [hci1] 10.942160
        Num handles: 1
        Handle: 1443 Address: DF:A9:FF:F6:B1:1A (OUI DF-A9-FF)
        Count: 1
        #164: len 9 (0 Kb/s)
        Latency: 165 msec (68-173 msec ~155 msec)
> ACL Data RX: Handle 1443 flags 0x02 dlen 9              #166 [hci1] 10.942343
      ATT: Find Information Request (0x04) len 4
        Handle range: 0x002d-0x002d
< HCI Command: Host Number of Com.. (0x03|0x0035) plen 5  #167 [hci1] 10.956872
        Num handles: 1
        Handle: 1443 Address: DF:A9:FF:F6:B1:1A (OUI DF-A9-FF)
        Count: 1
< ACL Data TX: Handle 1443 flags 0x00 dlen 10             #168 [hci1] 10.956949
      ATT: Find Information Response (0x05) len 5
        Format: UUID-16 (0x01)
        Handle: 0x002d
        UUID: Client Characteristic Configuration (0x2902)
> HCI Event: Number of Completed Packets (0x13) plen 5    #169 [hci1] 11.117127
        Num handles: 1
        Handle: 1443 Address: DF:A9:FF:F6:B1:1A (OUI DF-A9-FF)
        Count: 1
        #168: len 10 (0 Kb/s)
        Latency: 160 msec (68-173 msec ~157 msec)
> ACL Data RX: Handle 1443 flags 0x02 dlen 9              #170 [hci1] 11.117493
      ATT: Find Information Request (0x04) len 4
        Handle range: 0x0030-0x0030
< HCI Command: Host Number of Com.. (0x03|0x0035) plen 5  #171 [hci1] 11.136860
        Num handles: 1
        Handle: 1443 Address: DF:A9:FF:F6:B1:1A (OUI DF-A9-FF)
        Count: 1
< ACL Data TX: Handle 1443 flags 0x00 dlen 10             #172 [hci1] 11.137000
      ATT: Find Information Response (0x05) len 5
        Format: UUID-16 (0x01)
        Handle: 0x0030
        UUID: Client Characteristic Configuration (0x2902)
> HCI Event: Number of Completed Packets (0x13) plen 5    #173 [hci1] 11.292103
        Num handles: 1
        Handle: 1443 Address: DF:A9:FF:F6:B1:1A (OUI DF-A9-FF)
        Count: 1
        #172: len 10 (0 Kb/s)
        Latency: 155 msec (68-173 msec ~156 msec)
> ACL Data RX: Handle 1443 flags 0x02 dlen 9              #174 [hci1] 11.292321
      ATT: Find Information Request (0x04) len 4
        Handle range: 0x0033-0x0033
< HCI Command: Host Number of Com.. (0x03|0x0035) plen 5  #175 [hci1] 11.296882
        Num handles: 1
        Handle: 1443 Address: DF:A9:FF:F6:B1:1A (OUI DF-A9-FF)
        Count: 1
< ACL Data TX: Handle 1443 flags 0x00 dlen 10             #176 [hci1] 11.296963
      ATT: Find Information Response (0x05) len 5
        Format: UUID-16 (0x01)
        Handle: 0x0033
        UUID: Client Characteristic Configuration (0x2902)
> HCI Event: Number of Completed Packets (0x13) plen 5    #177 [hci1] 11.467136
        Num handles: 1
        Handle: 1443 Address: DF:A9:FF:F6:B1:1A (OUI DF-A9-FF)
        Count: 1
        #176: len 10 (0 Kb/s)
        Latency: 170 msec (68-173 msec ~163 msec)
> ACL Data RX: Handle 1443 flags 0x02 dlen 9              #178 [hci1] 11.467418
      ATT: Find Information Request (0x04) len 4
        Handle range: 0x0036-0x0036
< HCI Command: Host Number of Com.. (0x03|0x0035) plen 5  #179 [hci1] 11.476719
        Num handles: 1
        Handle: 1443 Address: DF:A9:FF:F6:B1:1A (OUI DF-A9-FF)
        Count: 1
< ACL Data TX: Handle 1443 flags 0x00 dlen 10             #180 [hci1] 11.476794
      ATT: Find Information Response (0x05) len 5
        Format: UUID-16 (0x01)
        Handle: 0x0036
        UUID: Client Characteristic Configuration (0x2902)
> HCI Event: Number of Completed Packets (0x13) plen 5    #181 [hci1] 11.642144
        Num handles: 1
        Handle: 1443 Address: DF:A9:FF:F6:B1:1A (OUI DF-A9-FF)
        Count: 1
        #180: len 10 (0 Kb/s)
        Latency: 165 msec (68-173 msec ~164 msec)
> ACL Data RX: Handle 1443 flags 0x02 dlen 9              #182 [hci1] 11.642477
      ATT: Find Information Request (0x04) len 4
        Handle range: 0x0039-0x0039
< HCI Command: Host Number of Com.. (0x03|0x0035) plen 5  #183 [hci1] 11.656893
        Num handles: 1
        Handle: 1443 Address: DF:A9:FF:F6:B1:1A (OUI DF-A9-FF)
        Count: 1
< ACL Data TX: Handle 1443 flags 0x00 dlen 10             #184 [hci1] 11.657038
      ATT: Find Information Response (0x05) len 5
        Format: UUID-16 (0x01)
        Handle: 0x0039
        UUID: Client Characteristic Configuration (0x2902)
> HCI Event: Number of Completed Packets (0x13) plen 5    #185 [hci1] 11.817148
        Num handles: 1
        Handle: 1443 Address: DF:A9:FF:F6:B1:1A (OUI DF-A9-FF)
        Count: 1
        #184: len 10 (0 Kb/s)
        Latency: 160 msec (68-173 msec ~162 msec)
> ACL Data RX: Handle 1443 flags 0x02 dlen 9              #186 [hci1] 11.817427
      ATT: Find Information Request (0x04) len 4
        Handle range: 0x003c-0x003c
< HCI Command: Host Number of Com.. (0x03|0x0035) plen 5  #187 [hci1] 11.836778
        Num handles: 1
        Handle: 1443 Address: DF:A9:FF:F6:B1:1A (OUI DF-A9-FF)
        Count: 1
< ACL Data TX: Handle 1443 flags 0x00 dlen 10             #188 [hci1] 11.836923
      ATT: Find Information Response (0x05) len 5
        Format: UUID-16 (0x01)
        Handle: 0x003c
        UUID: Client Characteristic Configuration (0x2902)
> HCI Event: Number of Completed Packets (0x13) plen 5    #189 [hci1] 11.992169
        Num handles: 1
        Handle: 1443 Address: DF:A9:FF:F6:B1:1A (OUI DF-A9-FF)
        Count: 1
        #188: len 10 (0 Kb/s)
        Latency: 155 msec (68-173 msec ~158 msec)
> ACL Data RX: Handle 1443 flags 0x02 dlen 11             #190 [hci1] 11.992492
      ATT: Read By Type Request (0x08) len 6
        Handle range: 0x003d-0x004c
        Attribute type: Characteristic (0x2803)
< HCI Command: Host Number of Com.. (0x03|0x0035) plen 5  #191 [hci1] 11.996820
        Num handles: 1
        Handle: 1443 Address: DF:A9:FF:F6:B1:1A (OUI DF-A9-FF)
        Count: 1
< ACL Data TX: Handle 1443 flags 0x00 dlen 27             #192 [hci1] 11.996872
< ACL Data TX: Handle 1443 flags 0x01 dlen 14             #193 [hci1] 11.997014
      ATT: Read By Type Response (0x09) len 36
        Attribute data length: 7
        Attribute data list: 5 entries
        Handle: 0x003e
        Value: 1c3f00c62b
            Properties: 0x1c
              Write Without Response (0x04)
              Write (0x08)
              Notify (0x10)
            Value Handle: 0x003f
            Value UUID: ASE Control Point (0x2bc6)
        Handle: 0x0041
        Value: 124200c42b
            Properties: 0x12
              Read (0x02)
              Notify (0x10)
            Value Handle: 0x0042
            Value UUID: Sink ASE (0x2bc4)
        Handle: 0x0044
        Value: 124500c42b
            Properties: 0x12
              Read (0x02)
              Notify (0x10)
            Value Handle: 0x0045
            Value UUID: Sink ASE (0x2bc4)
        Handle: 0x0047
        Value: 124800c52b
            Properties: 0x12
              Read (0x02)
              Notify (0x10)
            Value Handle: 0x0048
            Value UUID: Source ASE (0x2bc5)
        Handle: 0x004a
        Value: 124b00c52b
            Properties: 0x12
              Read (0x02)
              Notify (0x10)
            Value Handle: 0x004b
            Value UUID: Source ASE (0x2bc5)
> HCI Event: Number of Completed Packets (0x13) plen 5    #194 [hci1] 12.080174
        Num handles: 1
        Handle: 1443 Address: DF:A9:FF:F6:B1:1A (OUI DF-A9-FF)
        Count: 1
        #192: len 27 (2 Kb/s)
        Latency: 83 msec (68-173 msec ~121 msec)
> HCI Event: Number of Completed Packets (0x13) plen 5    #195 [hci1] 12.167211
        Num handles: 1
        Handle: 1443 Address: DF:A9:FF:F6:B1:1A (OUI DF-A9-FF)
        Count: 1
        #193: len 14 (0 Kb/s)
        Latency: 170 msec (68-173 msec ~145 msec)
> ACL Data RX: Handle 1443 flags 0x02 dlen 11             #196 [hci1] 12.167417
      ATT: Read By Type Request (0x08) len 6
        Handle range: 0x004b-0x004c
        Attribute type: Characteristic (0x2803)
< HCI Command: Host Number of Com.. (0x03|0x0035) plen 5  #197 [hci1] 12.176872
        Num handles: 1
        Handle: 1443 Address: DF:A9:FF:F6:B1:1A (OUI DF-A9-FF)
        Count: 1
< ACL Data TX: Handle 1443 flags 0x00 dlen 9              #198 [hci1] 12.177101
      ATT: Error Response (0x01) len 4
        Read By Type Request (0x08)
        Handle: 0x004b
        Error: Attribute Not Found (0x0a)
> HCI Event: Number of Completed Packets (0x13) plen 5    #199 [hci1] 12.342123
        Num handles: 1
        Handle: 1443 Address: DF:A9:FF:F6:B1:1A (OUI DF-A9-FF)
        Count: 1
        #198: len 9 (0 Kb/s)
        Latency: 165 msec (68-173 msec ~155 msec)
> ACL Data RX: Handle 1443 flags 0x02 dlen 9              #200 [hci1] 12.342333
      ATT: Find Information Request (0x04) len 4
        Handle range: 0x0040-0x0040
< HCI Command: Host Number of Com.. (0x03|0x0035) plen 5  #201 [hci1] 12.356844
        Num handles: 1
        Handle: 1443 Address: DF:A9:FF:F6:B1:1A (OUI DF-A9-FF)
        Count: 1
< ACL Data TX: Handle 1443 flags 0x00 dlen 10             #202 [hci1] 12.356918
      ATT: Find Information Response (0x05) len 5
        Format: UUID-16 (0x01)
        Handle: 0x0040
        UUID: Client Characteristic Configuration (0x2902)
> HCI Event: Number of Completed Packets (0x13) plen 5    #203 [hci1] 12.517139
        Num handles: 1
        Handle: 1443 Address: DF:A9:FF:F6:B1:1A (OUI DF-A9-FF)
        Count: 1
        #202: len 10 (0 Kb/s)
        Latency: 160 msec (68-173 msec ~157 msec)
> ACL Data RX: Handle 1443 flags 0x02 dlen 9              #204 [hci1] 12.517330
      ATT: Find Information Request (0x04) len 4
        Handle range: 0x0043-0x0043
< HCI Command: Host Number of Com.. (0x03|0x0035) plen 5  #205 [hci1] 12.536848
        Num handles: 1
        Handle: 1443 Address: DF:A9:FF:F6:B1:1A (OUI DF-A9-FF)
        Count: 1
< ACL Data TX: Handle 1443 flags 0x00 dlen 10             #206 [hci1] 12.536902
      ATT: Find Information Response (0x05) len 5
        Format: UUID-16 (0x01)
        Handle: 0x0043
        UUID: Client Characteristic Configuration (0x2902)
> HCI Event: Number of Completed Packets (0x13) plen 5    #207 [hci1] 12.692163
        Num handles: 1
        Handle: 1443 Address: DF:A9:FF:F6:B1:1A (OUI DF-A9-FF)
        Count: 1
        #206: len 10 (0 Kb/s)
        Latency: 155 msec (68-173 msec ~156 msec)
> ACL Data RX: Handle 1443 flags 0x02 dlen 9              #208 [hci1] 12.692342
      ATT: Find Information Request (0x04) len 4
        Handle range: 0x0046-0x0046
< HCI Command: Host Number of Com.. (0x03|0x0035) plen 5  #209 [hci1] 12.696685
        Num handles: 1
        Handle: 1443 Address: DF:A9:FF:F6:B1:1A (OUI DF-A9-FF)
        Count: 1
< ACL Data TX: Handle 1443 flags 0x00 dlen 10             #210 [hci1] 12.696792
      ATT: Find Information Response (0x05) len 5
        Format: UUID-16 (0x01)
        Handle: 0x0046
        UUID: Client Characteristic Configuration (0x2902)
> HCI Event: Number of Completed Packets (0x13) plen 5    #211 [hci1] 12.867061
        Num handles: 1
        Handle: 1443 Address: DF:A9:FF:F6:B1:1A (OUI DF-A9-FF)
        Count: 1
        #210: len 10 (0 Kb/s)
        Latency: 170 msec (68-173 msec ~163 msec)
> ACL Data RX: Handle 1443 flags 0x02 dlen 9              #212 [hci1] 12.867282
      ATT: Find Information Request (0x04) len 4
        Handle range: 0x0049-0x0049
< HCI Command: Host Number of Com.. (0x03|0x0035) plen 5  #213 [hci1] 12.876757
        Num handles: 1
        Handle: 1443 Address: DF:A9:FF:F6:B1:1A (OUI DF-A9-FF)
        Count: 1
< ACL Data TX: Handle 1443 flags 0x00 dlen 10             #214 [hci1] 12.876856
      ATT: Find Information Response (0x05) len 5
        Format: UUID-16 (0x01)
        Handle: 0x0049
        UUID: Client Characteristic Configuration (0x2902)
> HCI Event: Number of Completed Packets (0x13) plen 5    #215 [hci1] 13.042172
        Num handles: 1
        Handle: 1443 Address: DF:A9:FF:F6:B1:1A (OUI DF-A9-FF)
        Count: 1
        #214: len 10 (0 Kb/s)
        Latency: 165 msec (68-173 msec ~164 msec)
> ACL Data RX: Handle 1443 flags 0x02 dlen 9              #216 [hci1] 13.042336
      ATT: Find Information Request (0x04) len 4
        Handle range: 0x004c-0x004c
< HCI Command: Host Number of Com.. (0x03|0x0035) plen 5  #217 [hci1] 13.056935
        Num handles: 1
        Handle: 1443 Address: DF:A9:FF:F6:B1:1A (OUI DF-A9-FF)
        Count: 1
< ACL Data TX: Handle 1443 flags 0x00 dlen 10             #218 [hci1] 13.057055
      ATT: Find Information Response (0x05) len 5
        Format: UUID-16 (0x01)
        Handle: 0x004c
        UUID: Client Characteristic Configuration (0x2902)
> HCI Event: Number of Completed Packets (0x13) plen 5    #219 [hci1] 13.217159
        Num handles: 1
        Handle: 1443 Address: DF:A9:FF:F6:B1:1A (OUI DF-A9-FF)
        Count: 1
        #218: len 10 (0 Kb/s)
        Latency: 160 msec (68-173 msec ~162 msec)
> ACL Data RX: Handle 1443 flags 0x02 dlen 11             #220 [hci1] 13.217308
      ATT: Read By Type Request (0x08) len 6
        Handle range: 0x0001-0xffff
        Attribute type: Include (0x2802)
< HCI Command: Host Number of Com.. (0x03|0x0035) plen 5  #221 [hci1] 13.236931
        Num handles: 1
        Handle: 1443 Address: DF:A9:FF:F6:B1:1A (OUI DF-A9-FF)
        Count: 1
< ACL Data TX: Handle 1443 flags 0x00 dlen 9              #222 [hci1] 13.237156
      ATT: Error Response (0x01) len 4
        Read By Type Request (0x08)
        Handle: 0x0001
        Error: Attribute Not Found (0x0a)
> HCI Event: Number of Completed Packets (0x13) plen 5    #223 [hci1] 13.392046
        Num handles: 1
        Handle: 1443 Address: DF:A9:FF:F6:B1:1A (OUI DF-A9-FF)
        Count: 1
        #222: len 9 (0 Kb/s)
        Latency: 154 msec (68-173 msec ~158 msec)
> ACL Data RX: Handle 1443 flags 0x02 dlen 9              #224 [hci1] 13.392334
      ATT: Write Request (0x12) len 4
        Handle: 0x0040 Type: Client Characteristic Configuration (0x2902)
        Value Handle: 0x004b Type: Source ASE (0x2bc5)
          Data: 0000
< HCI Command: Host Number of Com.. (0x03|0x0035) plen 5  #225 [hci1] 13.396821
        Num handles: 1
        Handle: 1443 Address: DF:A9:FF:F6:B1:1A (OUI DF-A9-FF)
        Count: 1
< ACL Data TX: Handle 1443 flags 0x00 dlen 5              #226 [hci1] 13.396916
      ATT: Write Response (0x13) len 0
> HCI Event: Number of Completed Packets (0x13) plen 5    #227 [hci1] 13.567097
        Num handles: 1
        Handle: 1443 Address: DF:A9:FF:F6:B1:1A (OUI DF-A9-FF)
        Count: 1
        #226: len 5 (0 Kb/s)
        Latency: 170 msec (68-173 msec ~164 msec)
> ACL Data RX: Handle 1443 flags 0x02 dlen 9              #228 [hci1] 13.567322
      ATT: Write Request (0x12) len 4
        Handle: 0x0040 Type: Client Characteristic Configuration (0x2902)
        Value Handle: 0x004b Type: Source ASE (0x2bc5)
          Data: 0100
            Notification (0x01)
< HCI Command: Host Number of Com.. (0x03|0x0035) plen 5  #229 [hci1] 13.576915
        Num handles: 1
        Handle: 1443 Address: DF:A9:FF:F6:B1:1A (OUI DF-A9-FF)
        Count: 1
< ACL Data TX: Handle 1443 flags 0x00 dlen 5              #230 [hci1] 13.577012
      ATT: Write Response (0x13) len 0
> HCI Event: Number of Completed Packets (0x13) plen 5    #231 [hci1] 13.742112
        Num handles: 1
        Handle: 1443 Address: DF:A9:FF:F6:B1:1A (OUI DF-A9-FF)
        Count: 1
        #230: len 5 (0 Kb/s)
        Latency: 165 msec (68-173 msec ~164 msec)
> ACL Data RX: Handle 1443 flags 0x02 dlen 9              #232 [hci1] 13.742553
      ATT: Write Request (0x12) len 4
        Handle: 0x0043 Type: Client Characteristic Configuration (0x2902)
        Value Handle: 0x004b Type: Source ASE (0x2bc5)
          Data: 0000
< HCI Command: Host Number of Com.. (0x03|0x0035) plen 5  #233 [hci1] 13.756880
        Num handles: 1
        Handle: 1443 Address: DF:A9:FF:F6:B1:1A (OUI DF-A9-FF)
        Count: 1
< ACL Data TX: Handle 1443 flags 0x00 dlen 5              #234 [hci1] 13.756971
      ATT: Write Response (0x13) len 0
> HCI Event: Number of Completed Packets (0x13) plen 5    #235 [hci1] 13.917139
        Num handles: 1
        Handle: 1443 Address: DF:A9:FF:F6:B1:1A (OUI DF-A9-FF)
        Count: 1
        #234: len 5 (0 Kb/s)
        Latency: 160 msec (68-173 msec ~162 msec)
> ACL Data RX: Handle 1443 flags 0x02 dlen 9              #236 [hci1] 13.917360
      ATT: Write Request (0x12) len 4
        Handle: 0x0043 Type: Client Characteristic Configuration (0x2902)
        Value Handle: 0x004b Type: Source ASE (0x2bc5)
          Data: 0100
            Notification (0x01)
< HCI Command: Host Number of Com.. (0x03|0x0035) plen 5  #237 [hci1] 13.937052
        Num handles: 1
        Handle: 1443 Address: DF:A9:FF:F6:B1:1A (OUI DF-A9-FF)
        Count: 1
< ACL Data TX: Handle 1443 flags 0x00 dlen 5              #238 [hci1] 13.937160
      ATT: Write Response (0x13) len 0
> HCI Event: Number of Completed Packets (0x13) plen 5    #239 [hci1] 14.092032
        Num handles: 1
        Handle: 1443 Address: DF:A9:FF:F6:B1:1A (OUI DF-A9-FF)
        Count: 1
        #238: len 5 (0 Kb/s)
        Latency: 154 msec (68-173 msec ~158 msec)
> ACL Data RX: Handle 1443 flags 0x02 dlen 9              #240 [hci1] 14.092333
      ATT: Write Request (0x12) len 4
        Handle: 0x0046 Type: Client Characteristic Configuration (0x2902)
        Value Handle: 0x004b Type: Source ASE (0x2bc5)
          Data: 0000
< HCI Command: Host Number of Com.. (0x03|0x0035) plen 5  #241 [hci1] 14.096543
        Num handles: 1
        Handle: 1443 Address: DF:A9:FF:F6:B1:1A (OUI DF-A9-FF)
        Count: 1
< ACL Data TX: Handle 1443 flags 0x00 dlen 5              #242 [hci1] 14.096554
      ATT: Write Response (0x13) len 0
> HCI Event: Number of Completed Packets (0x13) plen 5    #243 [hci1] 14.267141
        Num handles: 1
        Handle: 1443 Address: DF:A9:FF:F6:B1:1A (OUI DF-A9-FF)
        Count: 1
        #242: len 5 (0 Kb/s)
        Latency: 170 msec (68-173 msec ~164 msec)
> ACL Data RX: Handle 1443 flags 0x02 dlen 9              #244 [hci1] 14.267281
      ATT: Write Request (0x12) len 4
        Handle: 0x0046 Type: Client Characteristic Configuration (0x2902)
        Value Handle: 0x004b Type: Source ASE (0x2bc5)
          Data: 0100
            Notification (0x01)
< HCI Command: Host Number of Com.. (0x03|0x0035) plen 5  #245 [hci1] 14.276929
        Num handles: 1
        Handle: 1443 Address: DF:A9:FF:F6:B1:1A (OUI DF-A9-FF)
        Count: 1
< ACL Data TX: Handle 1443 flags 0x00 dlen 5              #246 [hci1] 14.277024
      ATT: Write Response (0x13) len 0
> HCI Event: Number of Completed Packets (0x13) plen 5    #247 [hci1] 14.442092
        Num handles: 1
        Handle: 1443 Address: DF:A9:FF:F6:B1:1A (OUI DF-A9-FF)
        Count: 1
        #246: len 5 (0 Kb/s)
        Latency: 165 msec (68-173 msec ~164 msec)
> ACL Data RX: Handle 1443 flags 0x02 dlen 9              #248 [hci1] 14.442302
      ATT: Write Request (0x12) len 4
        Handle: 0x0049 Type: Client Characteristic Configuration (0x2902)
        Value Handle: 0x004b Type: Source ASE (0x2bc5)
          Data: 0000
< HCI Command: Host Number of Com.. (0x03|0x0035) plen 5  #249 [hci1] 14.456868
        Num handles: 1
        Handle: 1443 Address: DF:A9:FF:F6:B1:1A (OUI DF-A9-FF)
        Count: 1
< ACL Data TX: Handle 1443 flags 0x00 dlen 5              #250 [hci1] 14.456889
      ATT: Write Response (0x13) len 0
> HCI Event: Number of Completed Packets (0x13) plen 5    #251 [hci1] 14.617116
        Num handles: 1
        Handle: 1443 Address: DF:A9:FF:F6:B1:1A (OUI DF-A9-FF)
        Count: 1
        #250: len 5 (0 Kb/s)
        Latency: 160 msec (68-173 msec ~162 msec)
> ACL Data RX: Handle 1443 flags 0x02 dlen 9              #252 [hci1] 14.617371
      ATT: Write Request (0x12) len 4
        Handle: 0x0049 Type: Client Characteristic Configuration (0x2902)
        Value Handle: 0x004b Type: Source ASE (0x2bc5)
          Data: 0100
            Notification (0x01)
< HCI Command: Host Number of Com.. (0x03|0x0035) plen 5  #253 [hci1] 14.636911
        Num handles: 1
        Handle: 1443 Address: DF:A9:FF:F6:B1:1A (OUI DF-A9-FF)
        Count: 1
< ACL Data TX: Handle 1443 flags 0x00 dlen 5              #254 [hci1] 14.636964
      ATT: Write Response (0x13) len 0
> HCI Event: Number of Completed Packets (0x13) plen 5    #255 [hci1] 14.792077
        Num handles: 1
        Handle: 1443 Address: DF:A9:FF:F6:B1:1A (OUI DF-A9-FF)
        Count: 1
        #254: len 5 (0 Kb/s)
        Latency: 155 msec (68-173 msec ~158 msec)
> ACL Data RX: Handle 1443 flags 0x02 dlen 9              #256 [hci1] 14.792270
      ATT: Write Request (0x12) len 4
        Handle: 0x004c Type: Client Characteristic Configuration (0x2902)
        Value Handle: 0x004b Type: Source ASE (0x2bc5)
          Data: 0000
< HCI Command: Host Number of Com.. (0x03|0x0035) plen 5  #257 [hci1] 14.796874
        Num handles: 1
        Handle: 1443 Address: DF:A9:FF:F6:B1:1A (OUI DF-A9-FF)
        Count: 1
< ACL Data TX: Handle 1443 flags 0x00 dlen 5              #258 [hci1] 14.796957
      ATT: Write Response (0x13) len 0
> HCI Event: Number of Completed Packets (0x13) plen 5    #259 [hci1] 14.967142
        Num handles: 1
        Handle: 1443 Address: DF:A9:FF:F6:B1:1A (OUI DF-A9-FF)
        Count: 1
        #258: len 5 (0 Kb/s)
        Latency: 170 msec (68-173 msec ~164 msec)
> ACL Data RX: Handle 1443 flags 0x02 dlen 9              #260 [hci1] 14.967289
      ATT: Write Request (0x12) len 4
        Handle: 0x004c Type: Client Characteristic Configuration (0x2902)
        Value Handle: 0x004b Type: Source ASE (0x2bc5)
          Data: 0100
            Notification (0x01)
< HCI Command: Host Number of Com.. (0x03|0x0035) plen 5  #261 [hci1] 14.976894
        Num handles: 1
        Handle: 1443 Address: DF:A9:FF:F6:B1:1A (OUI DF-A9-FF)
        Count: 1
< ACL Data TX: Handle 1443 flags 0x00 dlen 5              #262 [hci1] 14.977015
      ATT: Write Response (0x13) len 0
> HCI Event: Number of Completed Packets (0x13) plen 5    #263 [hci1] 15.142021
        Num handles: 1
        Handle: 1443 Address: DF:A9:FF:F6:B1:1A (OUI DF-A9-FF)
        Count: 1
        #262: len 5 (0 Kb/s)
        Latency: 165 msec (68-173 msec ~164 msec)
> ACL Data RX: Handle 1443 flags 0x02 dlen 7              #264 [hci1] 15.142226
      ATT: Read Request (0x0a) len 2
        Handle: 0x0042 Type: Sink ASE (0x2bc4)
< HCI Command: Host Number of Com.. (0x03|0x0035) plen 5  #265 [hci1] 15.156985
        Num handles: 1
        Handle: 1443 Address: DF:A9:FF:F6:B1:1A (OUI DF-A9-FF)
        Count: 1
< ACL Data TX: Handle 1443 flags 0x00 dlen 7              #266 [hci1] 15.157035
      ATT: Read Response (0x0b) len 2
        Handle: 0x0042 Type: Sink ASE (0x2bc4)
        Value: 0100
            ASE ID: 1
            State: Idle (0x00)
> HCI Event: Number of Completed Packets (0x13) plen 5    #267 [hci1] 15.317190
        Num handles: 1
        Handle: 1443 Address: DF:A9:FF:F6:B1:1A (OUI DF-A9-FF)
        Count: 1
        #266: len 7 (0 Kb/s)
        Latency: 160 msec (68-173 msec ~162 msec)
> ACL Data RX: Handle 1443 flags 0x02 dlen 7              #268 [hci1] 15.317241
      ATT: Read Request (0x0a) len 2
        Handle: 0x0045 Type: Sink ASE (0x2bc4)
< HCI Command: Host Number of Com.. (0x03|0x0035) plen 5  #269 [hci1] 15.336945
        Num handles: 1
        Handle: 1443 Address: DF:A9:FF:F6:B1:1A (OUI DF-A9-FF)
        Count: 1
< ACL Data TX: Handle 1443 flags 0x00 dlen 7              #270 [hci1] 15.337047
      ATT: Read Response (0x0b) len 2
        Handle: 0x0045 Type: Sink ASE (0x2bc4)
        Value: 0200
            ASE ID: 2
            State: Idle (0x00)
> HCI Event: Number of Completed Packets (0x13) plen 5    #271 [hci1] 15.492046
        Num handles: 1
        Handle: 1443 Address: DF:A9:FF:F6:B1:1A (OUI DF-A9-FF)
        Count: 1
        #270: len 7 (0 Kb/s)
        Latency: 154 msec (68-173 msec ~158 msec)
> ACL Data RX: Handle 1443 flags 0x02 dlen 7              #272 [hci1] 15.492311
      ATT: Read Request (0x0a) len 2
        Handle: 0x0048 Type: Source ASE (0x2bc5)
< HCI Command: Host Number of Com.. (0x03|0x0035) plen 5  #273 [hci1] 15.496890
        Num handles: 1
        Handle: 1443 Address: DF:A9:FF:F6:B1:1A (OUI DF-A9-FF)
        Count: 1
< ACL Data TX: Handle 1443 flags 0x00 dlen 7              #274 [hci1] 15.496986
      ATT: Read Response (0x0b) len 2
        Handle: 0x0048 Type: Source ASE (0x2bc5)
        Value: 0300
            ASE ID: 3
            State: Idle (0x00)
> HCI Event: Number of Completed Packets (0x13) plen 5    #275 [hci1] 15.667058
        Num handles: 1
        Handle: 1443 Address: DF:A9:FF:F6:B1:1A (OUI DF-A9-FF)
        Count: 1
        #274: len 7 (0 Kb/s)
        Latency: 170 msec (68-173 msec ~164 msec)
> ACL Data RX: Handle 1443 flags 0x02 dlen 7              #276 [hci1] 15.667217
      ATT: Read Request (0x0a) len 2
        Handle: 0x004b Type: Source ASE (0x2bc5)
< HCI Command: Host Number of Com.. (0x03|0x0035) plen 5  #277 [hci1] 15.677026
        Num handles: 1
        Handle: 1443 Address: DF:A9:FF:F6:B1:1A (OUI DF-A9-FF)
        Count: 1
< ACL Data TX: Handle 1443 flags 0x00 dlen 7              #278 [hci1] 15.677101
      ATT: Read Response (0x0b) len 2
        Handle: 0x004b Type: Source ASE (0x2bc5)
        Value: 0400
            ASE ID: 4
            State: Idle (0x00)
> HCI Event: Number of Completed Packets (0x13) plen 5    #279 [hci1] 15.841941
        Num handles: 1
        Handle: 1443 Address: DF:A9:FF:F6:B1:1A (OUI DF-A9-FF)
        Count: 1
        #278: len 7 (0 Kb/s)
        Latency: 164 msec (68-173 msec ~164 msec)
> ACL Data RX: Handle 1443 flags 0x02 dlen 27             #280 [hci1] 15.929916
> ACL Data RX: Handle 1443 flags 0x01 dlen 7              #281 [hci1] 15.930262
      ATT: Write Command (0x52) len 29
        Handle: 0x003f Type: ASE Control Point (0x2bc6)
          Data: 010103010206000000001002010302020105030100000003042800
            Opcode: Codec Configuration (0x01)
            Number of ASE(s): 1
            ASE: #0
            ASE ID: 0x03
            Target Latency: Low Latency (0x01)
            PHY: 0x02
            LE 2M PHY (0x02)
            Codec: LC3 (0x06)
            Codec Specific Configuration: #0: len 0x02 type 0x01
              Sampling Frequency: 16 Khz (0x03)
            Codec Specific Configuration: #1: len 0x02 type 0x02
              Frame Duration: 10 ms (0x01)
            Codec Specific Configuration: #2: len 0x05 type 0x03
           Location: 0x00000001
              Front Left (0x00000001)
            Codec Specific Configuration: #3: len 0x03 type 0x04
              Frame Length: 40 (0x0028)
< HCI Command: Host Number of Com.. (0x03|0x0035) plen 5  #282 [hci1] 15.936511
        Num handles: 1
        Handle: 1443 Address: DF:A9:FF:F6:B1:1A (OUI DF-A9-FF)
        Count: 1
< HCI Command: Host Number of Com.. (0x03|0x0035) plen 5  #283 [hci1] 15.937217
        Num handles: 1
        Handle: 1443 Address: DF:A9:FF:F6:B1:1A (OUI DF-A9-FF)
        Count: 1
< ACL Data TX: Handle 1443 flags 0x00 dlen 12             #284 [hci1] 15.937518
      ATT: Handle Value Notification (0x1b) len 7
        Handle: 0x003f Type: ASE Control Point (0x2bc6)
          Data: 0101030000
            Opcode: Codec Configuration (0x01)
            Number of ASE(s): 1
            ASE: #0
            ASE ID: 0x03
            ASE Response Code: Success (0x00)
            ASE Response Reason: None (0x00)
< ACL Data TX: Handle 1443 flags 0x00 dlen 27             #285 [hci1] 15.937677
< ACL Data TX: Handle 1443 flags 0x01 dlen 21             #286 [hci1] 15.937682
      ATT: Handle Value Notification (0x1b) len 43
        Handle: 0x0048 Type: Source ASE (0x2bc5)
          Data: 03010002020a00102700409c00102700409c0006000000001002010302020105030100000003042800
            ASE ID: 3
            State: Codec Configured (0x01)
            Framing: Unframed PDUs supported (0x00)
            PHY: 0x02
            LE 2M PHY preferred (0x02)
            RTN: 2
            Max Transport Latency: 10
            Presentation Delay Min: 10000 us
            Presentation Delay Max: 40000 us
            Preferred Presentation Delay Min: 10000 us
            Preferred Presentation Delay Max: 40000 us
            Codec: LC3 (0x06)
            Codec Specific Configuration: #0: len 0x02 type 0x01
              Sampling Frequency: 16 Khz (0x03)
            Codec Specific Configuration: #1: len 0x02 type 0x02
              Frame Duration: 10 ms (0x01)
            Codec Specific Configuration: #2: len 0x05 type 0x03
           Location: 0x00000001
              Front Left (0x00000001)
            Codec Specific Configuration: #3: len 0x03 type 0x04
              Frame Length: 40 (0x0028)
> HCI Event: Number of Completed Packets (0x13) plen 5    #287 [hci1] 16.017564
        Num handles: 1
        Handle: 1443 Address: DF:A9:FF:F6:B1:1A (OUI DF-A9-FF)
        Count: 1
        #284: len 12 (1 Kb/s)
        Latency: 80 msec (68-173 msec ~122 msec)
> HCI Event: Number of Completed Packets (0x13) plen 5    #288 [hci1] 16.018179
        Num handles: 1
        Handle: 1443 Address: DF:A9:FF:F6:B1:1A (OUI DF-A9-FF)
        Count: 1
        #285: len 27 (2 Kb/s)
        Latency: 80 msec (68-173 msec ~101 msec)
> HCI Event: Number of Completed Packets (0x13) plen 5    #289 [hci1] 16.104662
        Num handles: 1
        Handle: 1443 Address: DF:A9:FF:F6:B1:1A (OUI DF-A9-FF)
        Count: 1
        #286: len 21 (1 Kb/s)
        Latency: 166 msec (68-173 msec ~134 msec)
> ACL Data RX: Handle 1443 flags 0x02 dlen 25             #290 [hci1] 16.105076
      ATT: Write Command (0x52) len 20
        Handle: 0x003f Type: ASE Control Point (0x2bc6)
          Data: 020103010110270000022800020a00a86100
            Opcode: QoS Configuration (0x02)
            Number of ASE(s): 1
            ASE: #0
            ASE ID: 0x03
            CIG ID: 0x01
            CIS ID: 0x01
            SDU Interval: 10000 usec
            Framing: Unframed (0x00)
            PHY: 0x02
            LE 2M PHY (0x02)
            Max SDU: 40
            RTN: 2
            Max Transport Latency: 10
            Presentation Delay: 25000 us
< HCI Command: Host Number of Com.. (0x03|0x0035) plen 5  #291 [hci1] 16.117098
        Num handles: 1
        Handle: 1443 Address: DF:A9:FF:F6:B1:1A (OUI DF-A9-FF)
        Count: 1
< ACL Data TX: Handle 1443 flags 0x00 dlen 12             #292 [hci1] 16.117670
      ATT: Handle Value Notification (0x1b) len 7
        Handle: 0x003f Type: ASE Control Point (0x2bc6)
          Data: 0201030000
            Opcode: QoS Configuration (0x02)
            Number of ASE(s): 1
            ASE: #0
            ASE ID: 0x03
            ASE Response Code: Success (0x00)
            ASE Response Reason: None (0x00)
< ACL Data TX: Handle 1443 flags 0x00 dlen 24             #293 [hci1] 16.117874
      ATT: Handle Value Notification (0x1b) len 19
        Handle: 0x0048 Type: Source ASE (0x2bc5)
          Data: 0302010110270000022800020a00a86100
            ASE ID: 3
            State: QoS Configured (0x02)
            CIG ID: 0x01
            CIS ID: 0x01
            SDU Interval: 10000 usec
            Framing: Unframed (0x00)
            PHY: 0x02
            LE 2M PHY (0x02)
            Max SDU: 40
            RTN: 2
            Max Transport Latency: 10
            Presentation Delay: 25000 us
> HCI Event: Number of Completed Packets (0x13) plen 5    #294 [hci1] 16.192613
        Num handles: 1
        Handle: 1443 Address: DF:A9:FF:F6:B1:1A (OUI DF-A9-FF)
        Count: 1
        #292: len 12 (1 Kb/s)
        Latency: 74 msec (68-173 msec ~104 msec)
> HCI Event: Number of Completed Packets (0x13) plen 5    #295 [hci1] 16.279641
        Num handles: 1
        Handle: 1443 Address: DF:A9:FF:F6:B1:1A (OUI DF-A9-FF)
        Count: 1
        #293: len 24 (1 Kb/s)
        Latency: 161 msec (68-173 msec ~133 msec)
> ACL Data RX: Handle 1443 flags 0x02 dlen 15             #296 [hci1] 16.279854
      ATT: Write Command (0x52) len 10
        Handle: 0x003f Type: ASE Control Point (0x2bc6)
          Data: 0301030403020100
            Opcode: Enable (0x03)
            Number of ASE(s): 1
            ASE: #0
            ASE ID: 0x03
            Metadata: #0: len 0x03 type 0x02
              Context: 0x0001
                Unspecified (0x0001)
< HCI Command: Host Number of Com.. (0x03|0x0035) plen 5  #297 [hci1] 16.296537
        Num handles: 1
        Handle: 1443 Address: DF:A9:FF:F6:B1:1A (OUI DF-A9-FF)
        Count: 1
< ACL Data TX: Handle 1443 flags 0x00 dlen 12             #298 [hci1] 16.296718
      ATT: Handle Value Notification (0x1b) len 7
        Handle: 0x003f Type: ASE Control Point (0x2bc6)
          Data: 0301030000
            Opcode: Enable (0x03)
            Number of ASE(s): 1
            ASE: #0
            ASE ID: 0x03
            ASE Response Code: Success (0x00)
            ASE Response Reason: None (0x00)
< ACL Data TX: Handle 1443 flags 0x00 dlen 16             #299 [hci1] 16.296813
      ATT: Handle Value Notification (0x1b) len 11
        Handle: 0x0048 Type: Source ASE (0x2bc5)
          Data: 030301010403020100
            ASE ID: 3
            State: Enabling (0x03)
            CIG ID: 0x01
            CIS ID: 0x01
            Metadata: #0: len 0x03 type 0x02
              Context: 0x0001
                Unspecified (0x0001)
> HCI Event: Number of Completed Packets (0x13) plen 5    #300 [hci1] 16.367483
        Num handles: 1
        Handle: 1443 Address: DF:A9:FF:F6:B1:1A (OUI DF-A9-FF)
        Count: 1
        #298: len 12 (1 Kb/s)
        Latency: 70 msec (68-173 msec ~101 msec)
> HCI Event: Number of Completed Packets (0x13) plen 5    #301 [hci1] 16.454596
        Num handles: 1
        Handle: 1443 Address: DF:A9:FF:F6:B1:1A (OUI DF-A9-FF)
        Count: 1
        #299: len 16 (0 Kb/s)
        Latency: 157 msec (68-173 msec ~129 msec)
> ACL Data RX: Handle 1443 flags 0x02 dlen 10             #302 [hci1] 16.454800
      ATT: Write Command (0x52) len 5
        Handle: 0x003f Type: ASE Control Point (0x2bc6)
          Data: 050103
            Opcode: Disable (0x05)
            Number of ASE(s): 1
            ASE: #0
            ASE ID: 0x03
< HCI Command: Host Number of Com.. (0x03|0x0035) plen 5  #303 [hci1] 16.456371
        Num handles: 1
        Handle: 1443 Address: DF:A9:FF:F6:B1:1A (OUI DF-A9-FF)
        Count: 1
< ACL Data TX: Handle 1443 flags 0x00 dlen 12             #304 [hci1] 16.456561
      ATT: Handle Value Notification (0x1b) len 7
        Handle: 0x003f Type: ASE Control Point (0x2bc6)
          Data: 0501030000
            Opcode: Disable (0x05)
            Number of ASE(s): 1
            ASE: #0
            ASE ID: 0x03
            ASE Response Code: Success (0x00)
            ASE Response Reason: None (0x00)
< ACL Data TX: Handle 1443 flags 0x00 dlen 16             #305 [hci1] 16.456686
      ATT: Handle Value Notification (0x1b) len 11
        Handle: 0x0048 Type: Source ASE (0x2bc5)
          Data: 030501010403020100
            ASE ID: 3
            State: Disabling (0x05)
            CIG ID: 0x01
            CIS ID: 0x01
            Metadata: #0: len 0x03 type 0x02
              Context: 0x0001
                Unspecified (0x0001)
> HCI Event: Number of Completed Packets (0x13) plen 5    #306 [hci1] 16.542536
        Num handles: 1
        Handle: 1443 Address: DF:A9:FF:F6:B1:1A (OUI DF-A9-FF)
        Count: 1
        #304: len 12 (1 Kb/s)
        Latency: 85 msec (68-173 msec ~107 msec)
> HCI Event: Number of Completed Packets (0x13) plen 5    #307 [hci1] 16.629421
        Num handles: 1
        Handle: 1443 Address: DF:A9:FF:F6:B1:1A (OUI DF-A9-FF)
        Count: 1
        #305: len 16 (0 Kb/s)
        Latency: 172 msec (68-173 msec ~140 msec)
> ACL Data RX: Handle 1443 flags 0x02 dlen 27             #308 [hci1] 16.717455
> ACL Data RX: Handle 1443 flags 0x01 dlen 7              #309 [hci1] 16.717735
      ATT: Write Command (0x52) len 29
        Handle: 0x003f Type: ASE Control Point (0x2bc6)
          Data: 010103010206000000001002010302020105030100000003042800
            Opcode: Codec Configuration (0x01)
            Number of ASE(s): 1
            ASE: #0
            ASE ID: 0x03
            Target Latency: Low Latency (0x01)
            PHY: 0x02
            LE 2M PHY (0x02)
            Codec: LC3 (0x06)
            Codec Specific Configuration: #0: len 0x02 type 0x01
              Sampling Frequency: 16 Khz (0x03)
            Codec Specific Configuration: #1: len 0x02 type 0x02
              Frame Duration: 10 ms (0x01)
            Codec Specific Configuration: #2: len 0x05 type 0x03
           Location: 0x00000001
              Front Left (0x00000001)
            Codec Specific Configuration: #3: len 0x03 type 0x04
              Frame Length: 40 (0x0028)
< HCI Command: Host Number of Com.. (0x03|0x0035) plen 5  #310 [hci1] 16.737078
        Num handles: 1
        Handle: 1443 Address: DF:A9:FF:F6:B1:1A (OUI DF-A9-FF)
        Count: 1
< HCI Command: Host Number of Com.. (0x03|0x0035) plen 5  #311 [hci1] 16.737318
        Num handles: 1
        Handle: 1443 Address: DF:A9:FF:F6:B1:1A (OUI DF-A9-FF)
        Count: 1
< ACL Data TX: Handle 1443 flags 0x00 dlen 12             #312 [hci1] 16.737468
      ATT: Handle Value Notification (0x1b) len 7
        Handle: 0x003f Type: ASE Control Point (0x2bc6)
          Data: 0101030400
            Opcode: Codec Configuration (0x01)
            Number of ASE(s): 1
            ASE: #0
            ASE ID: 0x03
            ASE Response Code: Invalid ASE State (0x04)
            ASE Response Reason: None (0x00)
> HCI Event: Number of Completed Packets (0x13) plen 5    #313 [hci1] 16.891978
        Num handles: 1
        Handle: 1443 Address: DF:A9:FF:F6:B1:1A (OUI DF-A9-FF)
        Count: 1
        #312: len 12 (0 Kb/s)
        Latency: 154 msec (68-173 msec ~147 msec)
> ACL Data RX: Handle 1443 flags 0x02 dlen 25             #314 [hci1] 36.929612
      ATT: Write Command (0x52) len 20
        Handle: 0x003f Type: ASE Control Point (0x2bc6)
          Data: 020103010110270000022800020a00a86100
            Opcode: QoS Configuration (0x02)
            Number of ASE(s): 1
            ASE: #0
            ASE ID: 0x03
            CIG ID: 0x01
            CIS ID: 0x01
            SDU Interval: 10000 usec
            Framing: Unframed (0x00)
            PHY: 0x02
            LE 2M PHY (0x02)
            Max SDU: 40
            RTN: 2
            Max Transport Latency: 10
            Presentation Delay: 25000 us
< HCI Command: Host Number of Com.. (0x03|0x0035) plen 5  #315 [hci1] 36.936748
        Num handles: 1
        Handle: 1443 Address: DF:A9:FF:F6:B1:1A (OUI DF-A9-FF)
        Count: 1
< ACL Data TX: Handle 1443 flags 0x00 dlen 12             #316 [hci1] 36.936786
      ATT: Handle Value Notification (0x1b) len 7
        Handle: 0x003f Type: ASE Control Point (0x2bc6)
          Data: 0201030400
            Opcode: QoS Configuration (0x02)
            Number of ASE(s): 1
            ASE: #0
            ASE ID: 0x03
            ASE Response Code: Invalid ASE State (0x04)
            ASE Response Reason: None (0x00)
> HCI Event: Number of Completed Packets (0x13) plen 5    #317 [hci1] 37.104126
        Num handles: 1
        Handle: 1443 Address: DF:A9:FF:F6:B1:1A (OUI DF-A9-FF)
        Count: 1
        #316: len 12 (0 Kb/s)
        Latency: 167 msec (68-173 msec ~157 msec)
> ACL Data RX: Handle 1443 flags 0x02 dlen 15             #318 [hci1] 57.141649
      ATT: Write Command (0x52) len 10
        Handle: 0x003f Type: ASE Control Point (0x2bc6)
          Data: 0301030403020100
            Opcode: Enable (0x03)
            Number of ASE(s): 1
            ASE: #0
            ASE ID: 0x03
            Metadata: #0: len 0x03 type 0x02
              Context: 0x0001
                Unspecified (0x0001)
< HCI Command: Host Number of Com.. (0x03|0x0035) plen 5  #319 [hci1] 57.157091
        Num handles: 1
        Handle: 1443 Address: DF:A9:FF:F6:B1:1A (OUI DF-A9-FF)
        Count: 1
< ACL Data TX: Handle 1443 flags 0x00 dlen 12             #320 [hci1] 57.157125
      ATT: Handle Value Notification (0x1b) len 7
        Handle: 0x003f Type: ASE Control Point (0x2bc6)
          Data: 0301030400
            Opcode: Enable (0x03)
            Number of ASE(s): 1
            ASE: #0
            ASE ID: 0x03
            ASE Response Code: Invalid ASE State (0x04)
            ASE Response Reason: None (0x00)
> HCI Event: Number of Completed Packets (0x13) plen 5    #321 [hci1] 57.316431
        Num handles: 1
        Handle: 1443 Address: DF:A9:FF:F6:B1:1A (OUI DF-A9-FF)
        Count: 1
        #320: len 12 (0 Kb/s)
        Latency: 159 msec (68-173 msec ~158 msec)
> ACL Data RX: Handle 1443 flags 0x02 dlen 10             #322 [hci1] 77.353793
      ATT: Write Command (0x52) len 5
        Handle: 0x003f Type: ASE Control Point (0x2bc6)
          Data: 040103
            Opcode: Receiver Start Ready (0x04)
            Number of ASE(s): 1
            ASE: #0
            ASE ID: 0x03
< HCI Command: Host Number of Com.. (0x03|0x0035) plen 5  #323 [hci1] 77.357253
        Num handles: 1
        Handle: 1443 Address: DF:A9:FF:F6:B1:1A (OUI DF-A9-FF)
        Count: 1
< ACL Data TX: Handle 1443 flags 0x00 dlen 12             #324 [hci1] 77.357291
      ATT: Handle Value Notification (0x1b) len 7
        Handle: 0x003f Type: ASE Control Point (0x2bc6)
          Data: 0401030400
            Opcode: Receiver Start Ready (0x04)
            Number of ASE(s): 1
            ASE: #0
            ASE ID: 0x03
            ASE Response Code: Invalid ASE State (0x04)
            ASE Response Reason: None (0x00)
> HCI Event: Number of Completed Packets (0x13) plen 5    #325 [hci1] 77.528610
        Num handles: 1
        Handle: 1443 Address: DF:A9:FF:F6:B1:1A (OUI DF-A9-FF)
        Count: 1
        #324: len 12 (0 Kb/s)
        Latency: 171 msec (68-173 msec ~164 msec)
> ACL Data RX: Handle 1443 flags 0x02 dlen 10             #326 [hci1] 97.566001
      ATT: Write Command (0x52) len 5
        Handle: 0x003f Type: ASE Control Point (0x2bc6)
          Data: 050103
            Opcode: Disable (0x05)
            Number of ASE(s): 1
            ASE: #0
            ASE ID: 0x03
< HCI Command: Host Number of Com.. (0x03|0x0035) plen 5  #327 [hci1] 97.577706
        Num handles: 1
        Handle: 1443 Address: DF:A9:FF:F6:B1:1A (OUI DF-A9-FF)
        Count: 1
< ACL Data TX: Handle 1443 flags 0x00 dlen 12             #328 [hci1] 97.577795
      ATT: Handle Value Notification (0x1b) len 7
        Handle: 0x003f Type: ASE Control Point (0x2bc6)
          Data: 0501030400
            Opcode: Disable (0x05)
            Number of ASE(s): 1
            ASE: #0
            ASE ID: 0x03
            ASE Response Code: Invalid ASE State (0x04)
            ASE Response Reason: None (0x00)
> HCI Event: Number of Completed Packets (0x13) plen 5    #329 [hci1] 97.740846
        Num handles: 1
        Handle: 1443 Address: DF:A9:FF:F6:B1:1A (OUI DF-A9-FF)
        Count: 1
        #328: len 12 (0 Kb/s)
        Latency: 163 msec (68-173 msec ~163 msec)
> ACL Data RX: Handle 1443 flags 0x02 dlen 15            #330 [hci1] 117.778355
      ATT: Write Command (0x52) len 10
        Handle: 0x003f Type: ASE Control Point (0x2bc6)
          Data: 0701030403020100
            Opcode: Update Metadata (0x07)
            Number of ASE(s): 1
            ASE: #0
            ASE ID: 0x03
            Metadata: #0: len 0x03 type 0x02
              Context: 0x0001
                Unspecified (0x0001)
< HCI Command: Host Number of Co.. (0x03|0x0035) plen 5  #331 [hci1] 117.797867
        Num handles: 1
        Handle: 1443 Address: DF:A9:FF:F6:B1:1A (OUI DF-A9-FF)
        Count: 1
< ACL Data TX: Handle 1443 flags 0x00 dlen 12            #332 [hci1] 117.797969
      ATT: Handle Value Notification (0x1b) len 7
        Handle: 0x003f Type: ASE Control Point (0x2bc6)
          Data: 0701030400
            Opcode: Update Metadata (0x07)
            Number of ASE(s): 1
            ASE: #0
            ASE ID: 0x03
            ASE Response Code: Invalid ASE State (0x04)
            ASE Response Reason: None (0x00)
> HCI Event: Number of Completed Packets (0x13) plen 5   #333 [hci1] 117.953092
        Num handles: 1
        Handle: 1443 Address: DF:A9:FF:F6:B1:1A (OUI DF-A9-FF)
        Count: 1
        #332: len 12 (0 Kb/s)
        Latency: 155 msec (68-173 msec ~159 msec)
> HCI Event: Disconnect Complete (0x05) plen 4           #334 [hci1] 139.390529
        Status: Success (0x00)
        Handle: 1443 Address: DF:A9:FF:F6:B1:1A (OUI DF-A9-FF)
        Reason: Remote User Terminated Connection (0x13)
< HCI Command: Reset (0x03|0x0003) plen 0                #335 [hci1] 144.128043
> HCI Event: Command Complete (0x0e) plen 4              #336 [hci1] 144.128483
      Reset (0x03|0x0003) ncmd 1
        Status: Success (0x00)
@ USER Close: main                                   {0x0001} [hci1] 144.137958
= Close Index: 00:00:00:00:00:00                              [hci1] 144.137965
