Bluetooth monitor ver 5.72
= Note: Linux version 6.14.0-36-generic (x86_64)                       0.685394
= Note: Bluetooth subsystem version 2.22                               0.685397
= New Index: 00:00:00:00:00:00 (Primary,UART,hci1)              [hci1] 0.685398
= New Index: 48:5F:99:8E:E0:64 (Primary,USB,hci0)               [hci0] 0.685398
= Open Index: 00:00:00:00:00:00                                 [hci1] 1.199300
= Index Info: 00:00:00:00:00:00 (Nordic Semiconductor ASA)      [hci1] 1.199322
@ USER Open: main (privileged) version 2.22            {0x0001} [hci1] 1.199331
< HCI Command: Reset (0x03|0x0003) plen 0                    #1 [hci1] 1.200637
> HCI Event: Command Complete (0x0e) plen 4                  #2 [hci1] 1.201144
      Reset (0x03|0x0003) ncmd 1
        Status: Success (0x00)
< HCI Command: Read Local Supported... (0x04|0x0003) plen 0  #3 [hci1] 1.218709
> HCI Event: Command Complete (0x0e) plen 12                 #4 [hci1] 1.219220
      Read Local Supported Features (0x04|0x0003) ncmd 1
        Status: Success (0x00)
        Features: 0x00 0x00 0x00 0x00 0x60 0x00 0x00 0x00
          BR/EDR Not Supported
          LE Supported (Controller)
< HCI Command: Read Local Version In.. (0x04|0x0001) plen 0  #5 [hci1] 1.238713
> HCI Event: Command Complete (0x0e) plen 12                 #6 [hci1] 1.239134
      Read Local Version Information (0x04|0x0001) ncmd 1
        Status: Success (0x00)
        HCI version: Reserved (0x0f) - Revision 12393 (0x3069)
        LMP version: Reserved (0x0f) - Subversion 12393 (0x3069)
        Manufacturer: Nordic Semiconductor ASA (89)
< HCI Command: Read Local Supported... (0x04|0x0002) plen 0  #7 [hci1] 1.258719
> HCI Event: Command Complete (0x0e) plen 68                 #8 [hci1] 1.259820
      Read Local Supported Commands (0x04|0x0002) ncmd 1
        Status: Success (0x00)
        Commands: 119 entries
          Disconnect (Octet 0 - Bit 5)
          Read Remote Version Information (Octet 2 - Bit 7)
          Set Event Mask (Octet 5 - Bit 6)
          Reset (Octet 5 - Bit 7)
          Read Connection Accept Timeout (Octet 7 - Bit 2)
          Write Connection Accept Timeout (Octet 7 - Bit 3)
          Read Transmit Power Level (Octet 10 - Bit 2)
          Set Controller To Host Flow Control (Octet 10 - Bit 5)
          Host Buffer Size (Octet 10 - Bit 6)
          Host Number of Completed Packets (Octet 10 - Bit 7)
          Read Local Version Information (Octet 14 - Bit 3)
          Read Local Supported Features (Octet 14 - Bit 5)
          Read BD ADDR (Octet 15 - Bit 1)
          Read RSSI (Octet 15 - Bit 5)
          Set Event Mask Page 2 (Octet 22 - Bit 2)
          LE Set Event Mask (Octet 25 - Bit 0)
          LE Read Buffer Size (Octet 25 - Bit 1)
          LE Read Local Supported Features (Octet 25 - Bit 2)
          LE Set Random Address (Octet 25 - Bit 4)
          LE Set Advertising Parameters (Octet 25 - Bit 5)
          LE Read Advertising Channel TX Power (Octet 25 - Bit 6)
          LE Set Advertising Data (Octet 25 - Bit 7)
          LE Set Scan Response Data (Octet 26 - Bit 0)
          LE Set Advertise Enable (Octet 26 - Bit 1)
          LE Set Scan Parameters (Octet 26 - Bit 2)
          LE Set Scan Enable (Octet 26 - Bit 3)
          LE Create Connection (Octet 26 - Bit 4)
          LE Create Connection Cancel (Octet 26 - Bit 5)
          LE Read Accept List Size (Octet 26 - Bit 6)
          LE Clear Accept List (Octet 26 - Bit 7)
          LE Add Device To Accept List (Octet 27 - Bit 0)
          LE Remove Device From Accept List (Octet 27 - Bit 1)
          LE Connection Update (Octet 27 - Bit 2)
          LE Set Host Channel Classification (Octet 27 - Bit 3)
          LE Read Channel Map (Octet 27 - Bit 4)
          LE Read Remote Used Features (Octet 27 - Bit 5)
          LE Encrypt (Octet 27 - Bit 6)
          LE Rand (Octet 27 - Bit 7)
          LE Start Encryption (Octet 28 - Bit 0)
          LE Long Term Key Request Reply (Octet 28 - Bit 1)
          LE Long Term Key Request Neg Reply (Octet 28 - Bit 2)
          LE Read Supported States (Octet 28 - Bit 3)
          LE Receiver Test (Octet 28 - Bit 4)
          LE Transmitter Test (Octet 28 - Bit 5)
          LE Test End (Octet 28 - Bit 6)
          Read Authenticated Payload Timeout (Octet 32 - Bit 4)
          Write Authenticated Payload Timeout (Octet 32 - Bit 5)
          LE Set Data Length (Octet 33 - Bit 6)
          LE Read Suggested Default Data Length (Octet 33 - Bit 7)
          LE Write Suggested Default Data Length (Octet 34 - Bit 0)
          LE Add Device To Resolving List (Octet 34 - Bit 3)
          LE Remove Device From Resolving List (Octet 34 - Bit 4)
          LE Clear Resolving List (Octet 34 - Bit 5)
          LE Read Resolving List Size (Octet 34 - Bit 6)
          LE Set Address Resolution Enable (Octet 35 - Bit 1)
          LE Set Resolvable Private Address Timeout (Octet 35 - Bit 2)
          LE Read Maximum Data Length (Octet 35 - Bit 3)
          LE Read PHY (Octet 35 - Bit 4)
          LE Set Default PHY (Octet 35 - Bit 5)
          LE Set PHY (Octet 35 - Bit 6)
          LE Enhanced Receiver Test (Octet 35 - Bit 7)
          LE Enhanced Transmitter Test (Octet 36 - Bit 0)
          LE Set Advertising Set Random Address (Octet 36 - Bit 1)
          LE Set Extended Advertising Parameters (Octet 36 - Bit 2)
          LE Set Extended Advertising Data (Octet 36 - Bit 3)
          LE Set Extended Scan Response Data (Octet 36 - Bit 4)
          LE Set Extended Advertising Enable (Octet 36 - Bit 5)
          LE Read Maximum Advertising Data Length (Octet 36 - Bit 6)
          LE Read Number of Supported Advertising Sets (Octet 36 - Bit 7)
          LE Remove Advertising Set (Octet 37 - Bit 0)
          LE Clear Advertising Sets (Octet 37 - Bit 1)
          LE Set Periodic Advertising Parameters (Octet 37 - Bit 2)
          LE Set Periodic Advertising Data (Octet 37 - Bit 3)
          LE Set Periodic Advertising Enable (Octet 37 - Bit 4)
          LE Set Extended Scan Parameters (Octet 37 - Bit 5)
          LE Set Extended Scan Enable (Octet 37 - Bit 6)
          LE Extended Create Connection (Octet 37 - Bit 7)
          LE Periodic Advertising Create Sync (Octet 38 - Bit 0)
          LE Periodic Advertising Create Sync Cancel (Octet 38 - Bit 1)
          LE Periodic Advertising Terminate Sync (Octet 38 - Bit 2)
          LE Add Device To Periodic Advertiser List (Octet 38 - Bit 3)
          LE Remove Device From Periodic Advertiser List (Octet 38 - Bit 4)
          LE Clear Periodic Advertiser List (Octet 38 - Bit 5)
          LE Read Periodic Advertiser List Size (Octet 38 - Bit 6)
          LE Read Transmit Power (Octet 38 - Bit 7)
          LE Read RF Path Compensation (Octet 39 - Bit 0)
          LE Write RF Path Compensation (Octet 39 - Bit 1)
          LE Set Privacy Mode (Octet 39 - Bit 2)
          LE Periodic Advertising Receive Enable (Octet 40 - Bit 5)
          LE Periodic Advertising Sync Transfer (Octet 40 - Bit 6)
          LE Periodic Advertising Set Info Transfer (Octet 40 - Bit 7)
          LE Periodic Advertising Sync Transfer Parameters (Octet 41 - Bit 0)
          LE Set Default Periodic Advertisng Sync Transfer Parameters (Octet 41 - Bit 1)
          LE Read Buffer v2 (Octet 41 - Bit 5)
          LE Read ISO TX Sync (Octet 41 - Bit 6)
          LE Set Connected Isochronous Group Parameters (Octet 41 - Bit 7)
          LE Set Connected Isochronous Group Parameters Test (Octet 42 - Bit 0)
          LE Create Connected Isochronous Stream (Octet 42 - Bit 1)
          LE Remove Connected Isochronous Group (Octet 42 - Bit 2)
          LE Accept Connected Isochronous Stream Request (Octet 42 - Bit 3)
          LE Reject Connected Isochronous Stream Request (Octet 42 - Bit 4)
          LE Create Broadcast Isochronous Group (Octet 42 - Bit 5)
          LE Create Broadcast Isochronous Group Test (Octet 42 - Bit 6)
          LE Terminate Broadcast Isochronous Group (Octet 42 - Bit 7)
          LE Broadcast Isochronous Group Create Sync (Octet 43 - Bit 0)
          LE Broadcast Isochronous Group Terminate Sync (Octet 43 - Bit 1)
          LE Request Peer SCA (Octet 43 - Bit 2)
          LE Setup Isochronous Data Path (Octet 43 - Bit 3)
          LE Remove Isochronous Data Path (Octet 43 - Bit 4)
          LE Isochronous Transmit Test (Octet 43 - Bit 5)
          LE Isochronous Receive Test (Octet 43 - Bit 6)
          LE Isochronous Read Test Counters (Octet 43 - Bit 7)
          LE Isochronous Read Test Counters (Octet 44 - Bit 0)
          LE Set Host Feature (Octet 44 - Bit 1)
          Octet 44 - Bit 2 
          Octet 45 - Bit 6 
          Octet 46 - Bit 0 
          Octet 46 - Bit 1 
          Octet 46 - Bit 2 
< HCI Command: Host Buffer Size (0x03|0x0033) plen 7         #9 [hci1] 1.278757
        ACL MTU: 255  ACL max packet: 16
        SCO MTU: 0    SCO max packet: 0
> HCI Event: Command Complete (0x0e) plen 4                 #10 [hci1] 1.279242
      Host Buffer Size (0x03|0x0033) ncmd 1
        Status: Success (0x00)
< HCI Command: Set Controller To Ho.. (0x03|0x0031) plen 1  #11 [hci1] 1.298750
        Flow control: ACL Data Packets (0x01)
> HCI Event: Command Complete (0x0e) plen 4                 #12 [hci1] 1.299205
      Set Controller To Host Flow Control (0x03|0x0031) ncmd 1
        Status: Success (0x00)
< HCI Command: LE Read Local Suppor.. (0x08|0x0003) plen 0  #13 [hci1] 1.318744
> HCI Event: Command Complete (0x0e) plen 12                #14 [hci1] 1.319256
      LE Read Local Supported Features (0x08|0x0003) ncmd 1
        Status: Success (0x00)
        Features: 0xfd 0x79 0x00 0xf7 0x30 0x01 0x00 0x00
          LE Encryption
          Extended Reject Indication
          Peripheral-initiated Features Exchange
          LE Ping
          LE Data Packet Length Extension
          LL Privacy
          Extended Scanner Filter Policies
          LE 2M PHY
          LE Coded PHY
          LE Extended Advertising
          LE Periodic Advertising
          Channel Selection Algorithm #2
          Periodic Advertising Sync Transfer - Sender
          Periodic Advertising Sync Transfer - Recipient
          Sleep Clock Accuracy Updates
          Connected Isochronous Stream - Central
          Connected Isochronous Stream - Peripheral
          Isochronous Broadcaster
          Synchronized Receiver
          Periodic Advertising ADI support
          Connection Subrating
          Unknown features (0x0000010000000000)
< HCI Command: LE Set Host Feature (0x08|0x0074) plen 2     #15 [hci1] 1.338759
        Bit Number: 32
          Connected Isochronous Stream (Host Support)
        Bit Value: 1
> HCI Event: Command Complete (0x0e) plen 4                 #16 [hci1] 1.339198
      LE Set Host Feature (0x08|0x0074) ncmd 1
        Status: Success (0x00)
< HCI Command: LE Read Buffer v2 (0x08|0x0060) plen 0       #17 [hci1] 1.358754
> HCI Event: Command Complete (0x0e) plen 10                #18 [hci1] 1.359215
      LE Read Buffer v2 (0x08|0x0060) ncmd 1
        Status: Success (0x00)
        ACL MTU: 27
        ACL max packet: 3
        ISO MTU: 318
        ISO max packet: 3
< HCI Command: LE Read Maximum Adve.. (0x08|0x003a) plen 0  #19 [hci1] 1.378821
> HCI Event: Command Complete (0x0e) plen 6                 #20 [hci1] 1.379284
      LE Read Maximum Advertising Data Length (0x08|0x003a) ncmd 1
        Status: Success (0x00)
        Max length: 1650
< HCI Command: LE Read Supported St.. (0x08|0x001c) plen 0  #21 [hci1] 1.398741
> HCI Event: Command Complete (0x0e) plen 12                #22 [hci1] 1.399231
      LE Read Supported States (0x08|0x001c) ncmd 1
        Status: Success (0x00)
        States: 0x000003ff3e0306ff
          Non-connectable Advertising State
          Scannable Advertising State
          Connectable Advertising State
          High Duty Cycle Directed Advertising State
          Passive Scanning State
          Active Scanning State
          Initiating State
            and Connection State (Central Role)
          Connection State (Peripheral Role)
          Scannable Advertising State
            and Passive Scanning State
          Connectable Advertising State
            and Passive Scanning State
          Non-connectable Advertising State
            and Initiating State
          Scannable Advertising State
            and Initiating State
          Active Scanning State
            and Connection State (Central Role)
          Passive Scanning State
            and Connection State (Peripheral Role)
          Active Scanning State
            and Connection State (Peripheral Role)
          Initiating State
            and Connection State (Central Role)
            and Central Role & Central Role
          Low Duty Cycle Directed Advertising State
          Connectable Advertising State
            and Initiating State
            and Central Role & Peripheral Role
          High Duty Cycle Directed Advertising State
            and Initiating State
            and Central Role & Peripheral Role
          Low Duty Cycle Directed Advertising State
            and Initiating State
            and Central Role & Peripheral Role
          Connectable Advertising State
            and Connection State (Central Role)
            and Central Role & Peripheral Role
          High Duty Cycle Directed Advertising State
            and Connection State (Central Role)
            and Central Role & Peripheral Role
          Low Duty Cycle Directed Advertising State
            and Connection State (Central Role)
            and Central Role & Peripheral Role
          Connectable Advertising State
            and Connection State (Peripheral Role)
            and Central Role & Peripheral Role
          High Duty Cycle Directed Advertising State
            and Connection State (Peripheral Role)
            and Peripheral Role & Peripheral Role
          Low Duty Cycle Directed Advertising State
            and Connection State (Peripheral Role)
            and Peripheral Role & Peripheral Role
          Initiating State
            and Connection State (Peripheral Role)
            and Central Role & Peripheral Role
< HCI Command: LE Read Maximum Data.. (0x08|0x002f) plen 0  #23 [hci1] 1.418718
> HCI Event: Command Complete (0x0e) plen 12                #24 [hci1] 1.419187
      LE Read Maximum Data Length (0x08|0x002f) ncmd 1
        Status: Success (0x00)
        Max TX octets: 251
        Max TX time: 2704
        Max RX octets: 251
        Max RX time: 2704
< HCI Command: LE Write Suggested D.. (0x08|0x0024) plen 4  #25 [hci1] 1.438724
        TX octets: 251
        TX time: 2704
> HCI Event: Command Complete (0x0e) plen 4                 #26 [hci1] 1.439233
      LE Write Suggested Default Data Length (0x08|0x0024) ncmd 1
        Status: Success (0x00)
< HCI Command: LE Read Resolving Li.. (0x08|0x002a) plen 0  #27 [hci1] 1.458746
> HCI Event: Command Complete (0x0e) plen 5                 #28 [hci1] 1.459130
      LE Read Resolving List Size (0x08|0x002a) ncmd 1
        Status: Success (0x00)
        Size: 8
< HCI Command: LE Set Event Mask (0x08|0x0001) plen 8       #29 [hci1] 1.478744
        Mask: 0x000002023f87fa5e
          LE Advertising Report
          LE Connection Update Complete
          LE Read Remote Used Features Complete
          LE Long Term Key Request
          LE Data Length Change
          LE Enhanced Connection Complete
          LE PHY Update Complete
          LE Extended Advertising Report
          LE Periodic Advertising Sync Established
          LE Periodic Advertising Report
          LE Periodic Advertising Sync Lost
          LE Extended Scan Timeout
          LE Extended Advertising Set Terminated
          LE Scan Request Received
          LE Periodic Advertising Sync Transfer Rvc
          LE CIS Established
          LE CIS Request
          LE Create BIG Complete
          LE Terminate BIG Complete
          LE BIG Sync Estabilished Complete
          LE BIG Sync Lost
          LE BIG Info Advertising Report
          Unknown mask (0x0000020000000000)
> HCI Event: Command Complete (0x0e) plen 4                 #30 [hci1] 1.479268
      LE Set Event Mask (0x08|0x0001) ncmd 1
        Status: Success (0x00)
< HCI Command: Set Event Mask (0x03|0x0001) plen 8          #31 [hci1] 1.498760
        Mask: 0x2000800002008890
          Disconnection Complete
          Encryption Change
          Read Remote Version Information Complete
          Hardware Error
          Data Buffer Overflow
          Encryption Key Refresh Complete
          LE Meta
> HCI Event: Command Complete (0x0e) plen 4                 #32 [hci1] 1.499292
      Set Event Mask (0x03|0x0001) ncmd 1
        Status: Success (0x00)
< HCI Command: Read BD ADDR (0x04|0x0009) plen 0            #33 [hci1] 1.518728
> HCI Event: Command Complete (0x0e) plen 10                #34 [hci1] 1.519135
      Read BD ADDR (0x04|0x0009) ncmd 1
        Status: Success (0x00)
        Address: 00:00:00:00:00:00 (OUI 00-00-00)
< HCI Command: LE Set Random Address (0x08|0x0005) plen 6   #35 [hci1] 1.538763
        Address: D5:B6:CC:31:DB:3B (Static)
> HCI Event: Command Complete (0x0e) plen 4                 #36 [hci1] 1.539240
      LE Set Random Address (0x08|0x0005) ncmd 1
        Status: Success (0x00)
< HCI Command: LE Set Extended Adv.. (0x08|0x0036) plen 25  #37 [hci1] 4.109202
        Handle: 0x00
        Properties: 0x0013
          Connectable
          Scannable
          Use legacy advertising PDUs: ADV_IND
        Min advertising interval: 100.000 msec (0x00a0)
        Max advertising interval: 150.000 msec (0x00f0)
        Channel map: 37, 38, 39 (0x07)
        Own address type: Random (0x01)
        Peer address type: Public (0x00)
        Peer address: 00:00:00:00:00:00 (OUI 00-00-00)
        Filter policy: Allow Scan Request from Any, Allow Connect Request from Any (0x00)
        TX power: Host has no preference (0x7f)
        Primary PHY: LE 1M (0x01)
        Secondary max skip: 0x00
        Secondary PHY: LE 1M (0x01)
        SID: 0x00
        Scan request notifications: Disabled (0x00)
> HCI Event: Command Complete (0x0e) plen 5                 #38 [hci1] 4.110084
      LE Set Extended Advertising Parameters (0x08|0x0036) ncmd 1
        Status: Success (0x00)
        TX power (selected): 0 dbm (0x00)
< HCI Command: LE Set Advertising S.. (0x08|0x0035) plen 7  #39 [hci1] 4.118698
        Advertising handle: 0x00
        Advertising random address: D5:B6:CC:31:DB:3B (Static)
> HCI Event: Command Complete (0x0e) plen 4                 #40 [hci1] 4.119223
      LE Set Advertising Set Random Address (0x08|0x0035) ncmd 1
        Status: Success (0x00)
< HCI Command: LE Set Extended Adv.. (0x08|0x0037) plen 22  #41 [hci1] 4.138773
        Handle: 0x00
        Operation: Complete extended advertising data (0x03)
        Fragment preference: Minimize fragmentation (0x01)
        Data length: 0x12
        Flags: 0x06
          LE General Discoverable Mode
          BR/EDR Not Supported
        Name (complete): Tester_F6B11A
> HCI Event: Command Complete (0x0e) plen 4                 #42 [hci1] 4.139551
      LE Set Extended Advertising Data (0x08|0x0037) ncmd 1
        Status: Success (0x00)
< HCI Command: LE Set Extended Scan.. (0x08|0x0038) plen 4  #43 [hci1] 4.158755
        Handle: 0x00
        Operation: Complete scan response data (0x03)
        Fragment preference: Minimize fragmentation (0x01)
        Data length: 0x00
> HCI Event: Command Complete (0x0e) plen 4                 #44 [hci1] 4.159255
      LE Set Extended Scan Response Data (0x08|0x0038) ncmd 1
        Status: Success (0x00)
< HCI Command: LE Set Extended Adve.. (0x08|0x0039) plen 6  #45 [hci1] 4.178840
        Extended advertising: Enabled (0x01)
        Number of sets: 1 (0x01)
        Entry 0
          Handle: 0x00
          Duration: 0 ms (0x00)
          Max ext adv events: 0
> HCI Event: Command Complete (0x0e) plen 4                 #46 [hci1] 4.179572
      LE Set Extended Advertising Enable (0x08|0x0039) ncmd 1
        Status: Success (0x00)
> HCI Event: LE Meta Event (0x3e) plen 31                   #47 [hci1] 4.936800
      LE Enhanced Connection Complete (0x0a)
        Status: Success (0x00)
        Handle: 129
        Role: Peripheral (0x01)
        Peer address type: Public (0x00)
        Peer address: DF:A9:FF:F6:B1:1A (OUI DF-A9-FF)
        Local resolvable private address: 00:00:00:00:00:00 (Non-Resolvable)
        Peer resolvable private address: 00:00:00:00:00:00 (Non-Resolvable)
        Connection interval: 87.50 msec (0x0046)
        Connection latency: 0 (0x0000)
        Supervision timeout: 25120 msec (0x09d0)
        Central clock accuracy: 0x01
> HCI Event: LE Meta Event (0x3e) plen 6                    #48 [hci1] 4.936805
      LE Advertising Set Terminated (0x12)
        Status: Success (0x00)
        Handle: 0
        Connection handle: 129
        Number of completed extended advertising events: 0
< HCI Command: LE Read Remote Used... (0x08|0x0016) plen 2  #49 [hci1] 4.939869
        Handle: 129 Address: DF:A9:FF:F6:B1:1A (OUI DF-A9-FF)
< ACL Data TX: Handle 129 flags 0x00 dlen 7                 #50 [hci1] 4.939891
      ATT: Exchange MTU Request (0x02) len 2
        Client RX MTU: 251
> HCI Event: Command Status (0x0f) plen 4                   #51 [hci1] 4.940472
      LE Read Remote Used Features (0x08|0x0016) ncmd 1
        Status: Success (0x00)
> HCI Event: Number of Completed Packets (0x13) plen 5      #52 [hci1] 5.112704
        Num handles: 1
        Handle: 129 Address: DF:A9:FF:F6:B1:1A (OUI DF-A9-FF)
        Count: 1
        #50: len 7 (0 Kb/s)
        Latency: 172 msec (172-172 msec ~172 msec)
> HCI Event: LE Meta Event (0x3e) plen 12                   #53 [hci1] 5.200655
      LE Read Remote Used Features (0x04)
        Status: Success (0x00)
        Handle: 129 Address: DF:A9:FF:F6:B1:1A (OUI DF-A9-FF)
        Features: 0x2d 0x49 0x00 0xf7 0x67 0xd8 0x00 0x00
          LE Encryption
          Extended Reject Indication
          Peripheral-initiated Features Exchange
          LE Data Packet Length Extension
          LE 2M PHY
          LE Coded PHY
          Channel Selection Algorithm #2
          Periodic Advertising Sync Transfer - Sender
          Periodic Advertising Sync Transfer - Recipient
          Sleep Clock Accuracy Updates
          Connected Isochronous Stream - Central
          Connected Isochronous Stream - Peripheral
          Isochronous Broadcaster
          Synchronized Receiver
          Connected Isochronous Stream (Host Support)
          LE Power Control Request
          LE Power Control Request
          Connection Subrating
          Connection Subrating (Host Support)
          Unknown features (0x0000d80000000000)
> ACL Data RX: Handle 129 flags 0x02 dlen 11                #54 [hci1] 7.650364
      SMP: Pairing Request (0x01) len 6
        IO capability: KeyboardDisplay (0x04)
        OOB data: Authentication data not present (0x00)
        Authentication requirement: Bonding, MITM, SC, No Keypresses (0x0d)
        Max encryption key size: 16
        Initiator key distribution: EncKey IdKey (0x03)
        Responder key distribution: EncKey IdKey Sign (0x07)
> ACL Data RX: Handle 129 flags 0x02 dlen 7                 #55 [hci1] 7.650876
      ATT: Exchange MTU Response (0x03) len 2
        Server RX MTU: 23
< HCI Command: Host Number of Compl.. (0x03|0x0035) plen 5  #56 [hci1] 7.659301
        Num handles: 1
        Handle: 129 Address: DF:A9:FF:F6:B1:1A (OUI DF-A9-FF)
        Count: 1
< ACL Data TX: Handle 129 flags 0x00 dlen 11                #57 [hci1] 7.659591
      SMP: Pairing Response (0x02) len 6
        IO capability: DisplayOnly (0x00)
        OOB data: Authentication data not present (0x00)
        Authentication requirement: Bonding, No MITM, SC, No Keypresses (0x09)
        Max encryption key size: 16
        Initiator key distribution: IdKey (0x02)
        Responder key distribution: <none> (0x00)
< HCI Command: Host Number of Compl.. (0x03|0x0035) plen 5  #58 [hci1] 7.659735
        Num handles: 1
        Handle: 129 Address: DF:A9:FF:F6:B1:1A (OUI DF-A9-FF)
        Count: 1
> HCI Event: Number of Completed Packets (0x13) plen 5      #59 [hci1] 7.825512
        Num handles: 1
        Handle: 129 Address: DF:A9:FF:F6:B1:1A (OUI DF-A9-FF)
        Count: 1
        #57: len 11 (0 Kb/s)
        Latency: 165 msec (165-172 msec ~169 msec)
> ACL Data RX: Handle 129 flags 0x02 dlen 27                #60 [hci1] 7.825730
> ACL Data RX: Handle 129 flags 0x01 dlen 27                #61 [hci1] 7.826310
> ACL Data RX: Handle 129 flags 0x01 dlen 15                #62 [hci1] 7.826707
      SMP: Pairing Public Key (0x0c) len 64
        X: 48507a92c81aafb52c61eae96792eb6f1e20358eb31e0cc6a5edd5d50e007e5b
        Y: 2b220b2b60a6103e00b85005341194c0e091c35ca47468819a29f8867285fafe
< HCI Command: Host Number of Compl.. (0x03|0x0035) plen 5  #63 [hci1] 7.839644
        Num handles: 1
        Handle: 129 Address: DF:A9:FF:F6:B1:1A (OUI DF-A9-FF)
        Count: 1
< HCI Command: Host Number of Compl.. (0x03|0x0035) plen 5  #64 [hci1] 7.839691
        Num handles: 1
        Handle: 129 Address: DF:A9:FF:F6:B1:1A (OUI DF-A9-FF)
        Count: 1
< HCI Command: Host Number of Compl.. (0x03|0x0035) plen 5  #65 [hci1] 7.840093
        Num handles: 1
        Handle: 129 Address: DF:A9:FF:F6:B1:1A (OUI DF-A9-FF)
        Count: 1
< ACL Data TX: Handle 129 flags 0x00 dlen 27                #66 [hci1] 7.840215
< ACL Data TX: Handle 129 flags 0x01 dlen 27                #67 [hci1] 7.840235
< ACL Data TX: Handle 129 flags 0x01 dlen 15                #68 [hci1] 7.840238
      SMP: Pairing Public Key (0x0c) len 64
        X: 98308440221e2d910f0e54b71e7ec652857aa9b5a0dc65028824cc19db1226e9
        Y: 67a4816bcb62efb21701e31fdb27561a6217575fb007a8bbdabe7e28b6f68482
> HCI Event: Number of Completed Packets (0x13) plen 5      #69 [hci1] 7.913446
        Num handles: 1
        Handle: 129 Address: DF:A9:FF:F6:B1:1A (OUI DF-A9-FF)
        Count: 1
        #66: len 27 (2 Kb/s)
        Latency: 73 msec (73-172 msec ~121 msec)
> HCI Event: Number of Completed Packets (0x13) plen 5      #70 [hci1] 7.914023
        Num handles: 1
        Handle: 129 Address: DF:A9:FF:F6:B1:1A (OUI DF-A9-FF)
        Count: 1
        #67: len 27 (2 Kb/s)
        Latency: 73 msec (73-172 msec ~97 msec)
> HCI Event: Number of Completed Packets (0x13) plen 5      #71 [hci1] 8.000167
        Num handles: 1
        Handle: 129 Address: DF:A9:FF:F6:B1:1A (OUI DF-A9-FF)
        Count: 1
        #68: len 15 (0 Kb/s)
        Latency: 159 msec (73-172 msec ~128 msec)
> ACL Data RX: Handle 129 flags 0x02 dlen 21                #72 [hci1] 8.350621
      SMP: Pairing Confirm (0x03) len 16
        Confim value: 941bcc82100250b1f23d04d744f71fe1
< HCI Command: Host Number of Compl.. (0x03|0x0035) plen 5  #73 [hci1] 8.359417
        Num handles: 1
        Handle: 129 Address: DF:A9:FF:F6:B1:1A (OUI DF-A9-FF)
        Count: 1
< ACL Data TX: Handle 129 flags 0x00 dlen 21                #74 [hci1] 8.359645
      SMP: Pairing Confirm (0x03) len 16
        Confim value: 99cc83cd63bc412c0e442b89caf6f2a0
> HCI Event: Number of Completed Packets (0x13) plen 5      #75 [hci1] 8.525436
        Num handles: 1
        Handle: 129 Address: DF:A9:FF:F6:B1:1A (OUI DF-A9-FF)
        Count: 1
        #74: len 21 (1 Kb/s)
        Latency: 165 msec (73-172 msec ~147 msec)
> ACL Data RX: Handle 129 flags 0x02 dlen 21                #76 [hci1] 8.525686
      SMP: Pairing Random (0x04) len 16
        Random value: 44eabf5d52a7c8590000000000000000
< HCI Command: Host Number of Compl.. (0x03|0x0035) plen 5  #77 [hci1] 8.539609
        Num handles: 1
        Handle: 129 Address: DF:A9:FF:F6:B1:1A (OUI DF-A9-FF)
        Count: 1
< ACL Data TX: Handle 129 flags 0x00 dlen 21                #78 [hci1] 8.539699
      SMP: Pairing Random (0x04) len 16
        Random value: 8e6108f966a694cbe26df70bb96773e6
> HCI Event: Number of Completed Packets (0x13) plen 5      #79 [hci1] 8.700092
        Num handles: 1
        Handle: 129 Address: DF:A9:FF:F6:B1:1A (OUI DF-A9-FF)
        Count: 1
        #78: len 21 (1 Kb/s)
        Latency: 160 msec (73-172 msec ~153 msec)
> ACL Data RX: Handle 129 flags 0x02 dlen 21                #80 [hci1] 8.788033
      SMP: Pairing Confirm (0x03) len 16
        Confim value: 045d6a7ec437272237ae7888c7d2cdff
< HCI Command: Host Number of Compl.. (0x03|0x0035) plen 5  #81 [hci1] 8.799464
        Num handles: 1
        Handle: 129 Address: DF:A9:FF:F6:B1:1A (OUI DF-A9-FF)
        Count: 1
< ACL Data TX: Handle 129 flags 0x00 dlen 21                #82 [hci1] 8.799664
      SMP: Pairing Confirm (0x03) len 16
        Confim value: f46a08c281f6e1086f2d5940ce27f73c
> HCI Event: Number of Completed Packets (0x13) plen 5      #83 [hci1] 8.962824
        Num handles: 1
        Handle: 129 Address: DF:A9:FF:F6:B1:1A (OUI DF-A9-FF)
        Count: 1
        #82: len 21 (1 Kb/s)
        Latency: 163 msec (73-172 msec ~158 msec)
> ACL Data RX: Handle 129 flags 0x02 dlen 21                #84 [hci1] 8.963156
      SMP: Pairing Random (0x04) len 16
        Random value: 15692ed6da14bacd0000000000000000
< HCI Command: Host Number of Compl.. (0x03|0x0035) plen 5  #85 [hci1] 8.979243
        Num handles: 1
        Handle: 129 Address: DF:A9:FF:F6:B1:1A (OUI DF-A9-FF)
        Count: 1
< ACL Data TX: Handle 129 flags 0x00 dlen 21                #86 [hci1] 8.979293
      SMP: Pairing Random (0x04) len 16
        Random value: 4d02679f89a05211af56d8b3da64d21e
> HCI Event: Number of Completed Packets (0x13) plen 5      #87 [hci1] 9.137653
        Num handles: 1
        Handle: 129 Address: DF:A9:FF:F6:B1:1A (OUI DF-A9-FF)
        Count: 1
        #86: len 21 (1 Kb/s)
        Latency: 158 msec (73-172 msec ~158 msec)
> ACL Data RX: Handle 129 flags 0x02 dlen 21                #88 [hci1] 9.225440
      SMP: Pairing Confirm (0x03) len 16
        Confim value: d066916f2b2bbb4809b8618851c46b41
< HCI Command: Host Number of Compl.. (0x03|0x0035) plen 5  #89 [hci1] 9.239163
        Num handles: 1
        Handle: 129 Address: DF:A9:FF:F6:B1:1A (OUI DF-A9-FF)
        Count: 1
< ACL Data TX: Handle 129 flags 0x00 dlen 21                #90 [hci1] 9.239266
      SMP: Pairing Confirm (0x03) len 16
        Confim value: ef1a7df4da26f58f1d2229b4d63742a5
> HCI Event: Number of Completed Packets (0x13) plen 5      #91 [hci1] 9.400287
        Num handles: 1
        Handle: 129 Address: DF:A9:FF:F6:B1:1A (OUI DF-A9-FF)
        Count: 1
        #90: len 21 (1 Kb/s)
        Latency: 161 msec (73-172 msec ~159 msec)
> ACL Data RX: Handle 129 flags 0x02 dlen 21                #92 [hci1] 9.400733
      SMP: Pairing Random (0x04) len 16
        Random value: ac2cd02477b8b69d0000000000000000
< HCI Command: Host Number of Compl.. (0x03|0x0035) plen 5  #93 [hci1] 9.419605
        Num handles: 1
        Handle: 129 Address: DF:A9:FF:F6:B1:1A (OUI DF-A9-FF)
        Count: 1
< ACL Data TX: Handle 129 flags 0x00 dlen 21                #94 [hci1] 9.419741
      SMP: Pairing Random (0x04) len 16
        Random value: 5e8286bc235a02440d0c3424a2acf8fd
> HCI Event: Number of Completed Packets (0x13) plen 5      #95 [hci1] 9.575088
        Num handles: 1
        Handle: 129 Address: DF:A9:FF:F6:B1:1A (OUI DF-A9-FF)
        Count: 1
        #94: len 21 (1 Kb/s)
        Latency: 155 msec (73-172 msec ~157 msec)
> ACL Data RX: Handle 129 flags 0x02 dlen 21                #96 [hci1] 9.663011
      SMP: Pairing Confirm (0x03) len 16
        Confim value: 2ea777a3aed9242e30b86b4a023a4642
< HCI Command: Host Number of Compl.. (0x03|0x0035) plen 5  #97 [hci1] 9.679016
        Num handles: 1
        Handle: 129 Address: DF:A9:FF:F6:B1:1A (OUI DF-A9-FF)
        Count: 1
< ACL Data TX: Handle 129 flags 0x00 dlen 21                #98 [hci1] 9.679120
      SMP: Pairing Confirm (0x03) len 16
        Confim value: 24d26b91af49c102b33e3a79b58194c0
> HCI Event: Number of Completed Packets (0x13) plen 5      #99 [hci1] 9.837806
        Num handles: 1
        Handle: 129 Address: DF:A9:FF:F6:B1:1A (OUI DF-A9-FF)
        Count: 1
        #98: len 21 (1 Kb/s)
        Latency: 158 msec (73-172 msec ~158 msec)
> ACL Data RX: Handle 129 flags 0x02 dlen 21               #100 [hci1] 9.838110
      SMP: Pairing Random (0x04) len 16
        Random value: ddd85218319ceb060000000000000000
< HCI Command: Host Number of Comp.. (0x03|0x0035) plen 5  #101 [hci1] 9.839431
        Num handles: 1
        Handle: 129 Address: DF:A9:FF:F6:B1:1A (OUI DF-A9-FF)
        Count: 1
< ACL Data TX: Handle 129 flags 0x00 dlen 21               #102 [hci1] 9.839537
      SMP: Pairing Random (0x04) len 16
        Random value: 5c4a1bcadd27bd58e945097b00bad7ac
> HCI Event: Number of Completed Packets (0x13) plen 5    #103 [hci1] 10.012612
        Num handles: 1
        Handle: 129 Address: DF:A9:FF:F6:B1:1A (OUI DF-A9-FF)
        Count: 1
        #102: len 21 (0 Kb/s)
        Latency: 173 msec (73-173 msec ~165 msec)
> ACL Data RX: Handle 129 flags 0x02 dlen 21              #104 [hci1] 10.100417
      SMP: Pairing Confirm (0x03) len 16
        Confim value: 029d4d37fe004244b4b7c7c794eb6737
< HCI Command: Host Number of Com.. (0x03|0x0035) plen 5  #105 [hci1] 10.119237
        Num handles: 1
        Handle: 129 Address: DF:A9:FF:F6:B1:1A (OUI DF-A9-FF)
        Count: 1
< ACL Data TX: Handle 129 flags 0x00 dlen 21              #106 [hci1] 10.119408
      SMP: Pairing Confirm (0x03) len 16
        Confim value: 32384ec7a41ac635f916e63d931bcfcc
> HCI Event: Number of Completed Packets (0x13) plen 5    #107 [hci1] 10.275311
        Num handles: 1
        Handle: 129 Address: DF:A9:FF:F6:B1:1A (OUI DF-A9-FF)
        Count: 1
        #106: len 21 (1 Kb/s)
        Latency: 155 msec (73-173 msec ~160 msec)
> ACL Data RX: Handle 129 flags 0x02 dlen 21              #108 [hci1] 10.275739
      SMP: Pairing Random (0x04) len 16
        Random value: a78ce016246c4ea30000000000000000
< HCI Command: Host Number of Com.. (0x03|0x0035) plen 5  #109 [hci1] 10.279557
        Num handles: 1
        Handle: 129 Address: DF:A9:FF:F6:B1:1A (OUI DF-A9-FF)
        Count: 1
< ACL Data TX: Handle 129 flags 0x00 dlen 21              #110 [hci1] 10.279578
      SMP: Pairing Random (0x04) len 16
        Random value: 32527e6e64e79f33b2e374394db8ab2d
> HCI Event: Number of Completed Packets (0x13) plen 5    #111 [hci1] 10.450136
        Num handles: 1
        Handle: 129 Address: DF:A9:FF:F6:B1:1A (OUI DF-A9-FF)
        Count: 1
        #110: len 21 (0 Kb/s)
        Latency: 170 msec (73-173 msec ~165 msec)
> ACL Data RX: Handle 129 flags 0x02 dlen 21              #112 [hci1] 10.537910
      SMP: Pairing Confirm (0x03) len 16
        Confim value: bc1cb4300399a004273d694e9cb71a2e
< HCI Command: Host Number of Com.. (0x03|0x0035) plen 5  #113 [hci1] 10.539018
        Num handles: 1
        Handle: 129 Address: DF:A9:FF:F6:B1:1A (OUI DF-A9-FF)
        Count: 1
< ACL Data TX: Handle 129 flags 0x00 dlen 21              #114 [hci1] 10.539186
      SMP: Pairing Confirm (0x03) len 16
        Confim value: 8e0f386a6b1473829ef3d3bee012fbd7
> HCI Event: Number of Completed Packets (0x13) plen 5    #115 [hci1] 10.712935
        Num handles: 1
        Handle: 129 Address: DF:A9:FF:F6:B1:1A (OUI DF-A9-FF)
        Count: 1
        #114: len 21 (0 Kb/s)
        Latency: 173 msec (73-173 msec ~169 msec)
> ACL Data RX: Handle 129 flags 0x02 dlen 21              #116 [hci1] 10.713126
      SMP: Pairing Random (0x04) len 16
        Random value: 8d3d7b62c558ab0d0000000000000000
< HCI Command: Host Number of Com.. (0x03|0x0035) plen 5  #117 [hci1] 10.719530
        Num handles: 1
        Handle: 129 Address: DF:A9:FF:F6:B1:1A (OUI DF-A9-FF)
        Count: 1
< ACL Data TX: Handle 129 flags 0x00 dlen 21              #118 [hci1] 10.719630
      SMP: Pairing Random (0x04) len 16
        Random value: dddbdfe2838e9a8cc6964353c850fef7
> HCI Event: Number of Completed Packets (0x13) plen 5    #119 [hci1] 10.887640
        Num handles: 1
        Handle: 129 Address: DF:A9:FF:F6:B1:1A (OUI DF-A9-FF)
        Count: 1
        #118: len 21 (1 Kb/s)
        Latency: 168 msec (73-173 msec ~168 msec)
> ACL Data RX: Handle 129 flags 0x02 dlen 21              #120 [hci1] 10.975374
      SMP: Pairing Confirm (0x03) len 16
        Confim value: 2881194557cdb56231363dd7c6a14c94
< HCI Command: Host Number of Com.. (0x03|0x0035) plen 5  #121 [hci1] 10.979517
        Num handles: 1
        Handle: 129 Address: DF:A9:FF:F6:B1:1A (OUI DF-A9-FF)
        Count: 1
< ACL Data TX: Handle 129 flags 0x00 dlen 21              #122 [hci1] 10.979762
      SMP: Pairing Confirm (0x03) len 16
        Confim value: f9de335e258e7a175d9f9eeec7758506
> HCI Event: Number of Completed Packets (0x13) plen 5    #123 [hci1] 11.150272
        Num handles: 1
        Handle: 129 Address: DF:A9:FF:F6:B1:1A (OUI DF-A9-FF)
        Count: 1
        #122: len 21 (0 Kb/s)
        Latency: 170 msec (73-173 msec ~169 msec)
> ACL Data RX: Handle 129 flags 0x02 dlen 21              #124 [hci1] 11.150675
      SMP: Pairing Random (0x04) len 16
        Random value: 37831e57af7ce7750000000000000000
< HCI Command: Host Number of Com.. (0x03|0x0035) plen 5  #125 [hci1] 11.159588
        Num handles: 1
        Handle: 129 Address: DF:A9:FF:F6:B1:1A (OUI DF-A9-FF)
        Count: 1
< ACL Data TX: Handle 129 flags 0x00 dlen 21              #126 [hci1] 11.159710
      SMP: Pairing Random (0x04) len 16
        Random value: eb9f1915536596b6fc3db1c86b2b1970
> HCI Event: Number of Completed Packets (0x13) plen 5    #127 [hci1] 11.325166
        Num handles: 1
        Handle: 129 Address: DF:A9:FF:F6:B1:1A (OUI DF-A9-FF)
        Count: 1
        #126: len 21 (1 Kb/s)
        Latency: 165 msec (73-173 msec ~167 msec)
> ACL Data RX: Handle 129 flags 0x02 dlen 21              #128 [hci1] 11.412885
      SMP: Pairing Confirm (0x03) len 16
        Confim value: 71d105bc620bdcf417069905fb5451db
< HCI Command: Host Number of Com.. (0x03|0x0035) plen 5  #129 [hci1] 11.419389
        Num handles: 1
        Handle: 129 Address: DF:A9:FF:F6:B1:1A (OUI DF-A9-FF)
        Count: 1
< ACL Data TX: Handle 129 flags 0x00 dlen 21              #130 [hci1] 11.419550
      SMP: Pairing Confirm (0x03) len 16
        Confim value: 7e935f5bdffd7bdd03ad43fd629c39e2
> HCI Event: Number of Completed Packets (0x13) plen 5    #131 [hci1] 11.587757
        Num handles: 1
        Handle: 129 Address: DF:A9:FF:F6:B1:1A (OUI DF-A9-FF)
        Count: 1
        #130: len 21 (1 Kb/s)
        Latency: 168 msec (73-173 msec ~167 msec)
> ACL Data RX: Handle 129 flags 0x02 dlen 21              #132 [hci1] 11.588106
      SMP: Pairing Random (0x04) len 16
        Random value: 24a417737d43f8670000000000000000
< HCI Command: Host Number of Com.. (0x03|0x0035) plen 5  #133 [hci1] 11.599545
        Num handles: 1
        Handle: 129 Address: DF:A9:FF:F6:B1:1A (OUI DF-A9-FF)
        Count: 1
< ACL Data TX: Handle 129 flags 0x00 dlen 21              #134 [hci1] 11.599568
      SMP: Pairing Random (0x04) len 16
        Random value: 5c794dc9ad9f2c3f295ebd5ad5e1c3cf
> HCI Event: Number of Completed Packets (0x13) plen 5    #135 [hci1] 11.762603
        Num handles: 1
        Handle: 129 Address: DF:A9:FF:F6:B1:1A (OUI DF-A9-FF)
        Count: 1
        #134: len 21 (1 Kb/s)
        Latency: 163 msec (73-173 msec ~165 msec)
> ACL Data RX: Handle 129 flags 0x02 dlen 21              #136 [hci1] 11.850437
      SMP: Pairing Confirm (0x03) len 16
        Confim value: c813a9fa7215471001e60fb66950b61a
< HCI Command: Host Number of Com.. (0x03|0x0035) plen 5  #137 [hci1] 11.859453
        Num handles: 1
        Handle: 129 Address: DF:A9:FF:F6:B1:1A (OUI DF-A9-FF)
        Count: 1
< ACL Data TX: Handle 129 flags 0x00 dlen 21              #138 [hci1] 11.859700
      SMP: Pairing Confirm (0x03) len 16
        Confim value: c3311d3514c72ac8043190daf85b5e9d
> HCI Event: Number of Completed Packets (0x13) plen 5    #139 [hci1] 12.025323
        Num handles: 1
        Handle: 129 Address: DF:A9:FF:F6:B1:1A (OUI DF-A9-FF)
        Count: 1
        #138: len 21 (1 Kb/s)
        Latency: 165 msec (73-173 msec ~165 msec)
> ACL Data RX: Handle 129 flags 0x02 dlen 21              #140 [hci1] 12.025555
      SMP: Pairing Random (0x04) len 16
        Random value: 485cbb62118ec9d00000000000000000
< HCI Command: Host Number of Com.. (0x03|0x0035) plen 5  #141 [hci1] 12.039578
        Num handles: 1
        Handle: 129 Address: DF:A9:FF:F6:B1:1A (OUI DF-A9-FF)
        Count: 1
< ACL Data TX: Handle 129 flags 0x00 dlen 21              #142 [hci1] 12.039673
      SMP: Pairing Random (0x04) len 16
        Random value: 5c2fff312cdf99c9491988e877355a9a
> HCI Event: Number of Completed Packets (0x13) plen 5    #143 [hci1] 12.200009
        Num handles: 1
        Handle: 129 Address: DF:A9:FF:F6:B1:1A (OUI DF-A9-FF)
        Count: 1
        #142: len 21 (1 Kb/s)
        Latency: 160 msec (73-173 msec ~162 msec)
> ACL Data RX: Handle 129 flags 0x02 dlen 21              #144 [hci1] 12.287889
      SMP: Pairing Confirm (0x03) len 16
        Confim value: a36544026cd872832d812d5ea96aa500
< HCI Command: Host Number of Com.. (0x03|0x0035) plen 5  #145 [hci1] 12.299236
        Num handles: 1
        Handle: 129 Address: DF:A9:FF:F6:B1:1A (OUI DF-A9-FF)
        Count: 1
< ACL Data TX: Handle 129 flags 0x00 dlen 21              #146 [hci1] 12.299356
      SMP: Pairing Confirm (0x03) len 16
        Confim value: 6056d192e6d08e2fab9eb8e339dab7a4
> HCI Event: Number of Completed Packets (0x13) plen 5    #147 [hci1] 12.462783
        Num handles: 1
        Handle: 129 Address: DF:A9:FF:F6:B1:1A (OUI DF-A9-FF)
        Count: 1
        #146: len 21 (1 Kb/s)
        Latency: 163 msec (73-173 msec ~163 msec)
> ACL Data RX: Handle 129 flags 0x02 dlen 21              #148 [hci1] 12.463077
      SMP: Pairing Random (0x04) len 16
        Random value: 97f36d71697542be0000000000000000
< HCI Command: Host Number of Com.. (0x03|0x0035) plen 5  #149 [hci1] 12.479645
        Num handles: 1
        Handle: 129 Address: DF:A9:FF:F6:B1:1A (OUI DF-A9-FF)
        Count: 1
< ACL Data TX: Handle 129 flags 0x00 dlen 21              #150 [hci1] 12.479740
      SMP: Pairing Random (0x04) len 16
        Random value: c629a3a987d808e808655d558dfc1155
> HCI Event: Number of Completed Packets (0x13) plen 5    #151 [hci1] 12.637555
        Num handles: 1
        Handle: 129 Address: DF:A9:FF:F6:B1:1A (OUI DF-A9-FF)
        Count: 1
        #150: len 21 (1 Kb/s)
        Latency: 157 msec (73-173 msec ~160 msec)
> ACL Data RX: Handle 129 flags 0x02 dlen 21              #152 [hci1] 12.725481
      SMP: Pairing Confirm (0x03) len 16
        Confim value: a7d2b63d33a9fd2f3010ce1d0c2c47d6
< HCI Command: Host Number of Com.. (0x03|0x0035) plen 5  #153 [hci1] 12.739238
        Num handles: 1
        Handle: 129 Address: DF:A9:FF:F6:B1:1A (OUI DF-A9-FF)
        Count: 1
< ACL Data TX: Handle 129 flags 0x00 dlen 21              #154 [hci1] 12.739419
      SMP: Pairing Confirm (0x03) len 16
        Confim value: cd5b3d28dd8fd966faf98758fc3c1787
> HCI Event: Number of Completed Packets (0x13) plen 5    #155 [hci1] 12.900216
        Num handles: 1
        Handle: 129 Address: DF:A9:FF:F6:B1:1A (OUI DF-A9-FF)
        Count: 1
        #154: len 21 (1 Kb/s)
        Latency: 160 msec (73-173 msec ~160 msec)
> ACL Data RX: Handle 129 flags 0x02 dlen 21              #156 [hci1] 12.900595
      SMP: Pairing Random (0x04) len 16
        Random value: 9b39c54b7ecec6da0000000000000000
< HCI Command: Host Number of Com.. (0x03|0x0035) plen 5  #157 [hci1] 12.919704
        Num handles: 1
        Handle: 129 Address: DF:A9:FF:F6:B1:1A (OUI DF-A9-FF)
        Count: 1
< ACL Data TX: Handle 129 flags 0x00 dlen 21              #158 [hci1] 12.919793
      SMP: Pairing Random (0x04) len 16
        Random value: 92f20f6ad8f13724432c7fd6001c45ff
> HCI Event: Number of Completed Packets (0x13) plen 5    #159 [hci1] 13.075052
        Num handles: 1
        Handle: 129 Address: DF:A9:FF:F6:B1:1A (OUI DF-A9-FF)
        Count: 1
        #158: len 21 (1 Kb/s)
        Latency: 155 msec (73-173 msec ~157 msec)
> ACL Data RX: Handle 129 flags 0x02 dlen 21              #160 [hci1] 13.162907
      SMP: Pairing Confirm (0x03) len 16
        Confim value: 7b541a677863876135e60fbba2618f0e
< HCI Command: Host Number of Com.. (0x03|0x0035) plen 5  #161 [hci1] 13.179531
        Num handles: 1
        Handle: 129 Address: DF:A9:FF:F6:B1:1A (OUI DF-A9-FF)
        Count: 1
< ACL Data TX: Handle 129 flags 0x00 dlen 21              #162 [hci1] 13.179755
      SMP: Pairing Confirm (0x03) len 16
        Confim value: 187a075feb3f6dac714477e8f98498ce
> HCI Event: Number of Completed Packets (0x13) plen 5    #163 [hci1] 13.337769
        Num handles: 1
        Handle: 129 Address: DF:A9:FF:F6:B1:1A (OUI DF-A9-FF)
        Count: 1
        #162: len 21 (1 Kb/s)
        Latency: 158 msec (73-173 msec ~157 msec)
> ACL Data RX: Handle 129 flags 0x02 dlen 21              #164 [hci1] 13.337996
      SMP: Pairing Random (0x04) len 16
        Random value: b48e3ab967dfc5b20000000000000000
< HCI Command: Host Number of Com.. (0x03|0x0035) plen 5  #165 [hci1] 13.339580
        Num handles: 1
        Handle: 129 Address: DF:A9:FF:F6:B1:1A (OUI DF-A9-FF)
        Count: 1
< ACL Data TX: Handle 129 flags 0x00 dlen 21              #166 [hci1] 13.339682
      SMP: Pairing Random (0x04) len 16
        Random value: 23ac32ebbb5e14c8a6b9622f296d277f
> HCI Event: Number of Completed Packets (0x13) plen 5    #167 [hci1] 13.512486
        Num handles: 1
        Handle: 129 Address: DF:A9:FF:F6:B1:1A (OUI DF-A9-FF)
        Count: 1
        #166: len 21 (0 Kb/s)
        Latency: 172 msec (73-173 msec ~165 msec)
> ACL Data RX: Handle 129 flags 0x02 dlen 21              #168 [hci1] 13.600350
      SMP: Pairing Confirm (0x03) len 16
        Confim value: 500c352eaeb6a5a039ff14afe72c97eb
< HCI Command: Host Number of Com.. (0x03|0x0035) plen 5  #169 [hci1] 13.619309
        Num handles: 1
        Handle: 129 Address: DF:A9:FF:F6:B1:1A (OUI DF-A9-FF)
        Count: 1
< ACL Data TX: Handle 129 flags 0x00 dlen 21              #170 [hci1] 13.619335
      SMP: Pairing Confirm (0x03) len 16
        Confim value: 8ce4951c2bad7e7146f7714a4f585fd5
> HCI Event: Number of Completed Packets (0x13) plen 5    #171 [hci1] 13.775231
        Num handles: 1
        Handle: 129 Address: DF:A9:FF:F6:B1:1A (OUI DF-A9-FF)
        Count: 1
        #170: len 21 (1 Kb/s)
        Latency: 155 msec (73-173 msec ~160 msec)
> ACL Data RX: Handle 129 flags 0x02 dlen 21              #172 [hci1] 13.775528
      SMP: Pairing Random (0x04) len 16
        Random value: e23a84049b1808130000000000000000
< HCI Command: Host Number of Com.. (0x03|0x0035) plen 5  #173 [hci1] 13.778845
        Num handles: 1
        Handle: 129 Address: DF:A9:FF:F6:B1:1A (OUI DF-A9-FF)
        Count: 1
< ACL Data TX: Handle 129 flags 0x00 dlen 21              #174 [hci1] 13.779059
      SMP: Pairing Random (0x04) len 16
        Random value: 297efe85e67448a15f56bd27e3a3cf1d
> HCI Event: Number of Completed Packets (0x13) plen 5    #175 [hci1] 13.949922
        Num handles: 1
        Handle: 129 Address: DF:A9:FF:F6:B1:1A (OUI DF-A9-FF)
        Count: 1
        #174: len 21 (0 Kb/s)
        Latency: 170 msec (73-173 msec ~165 msec)
> ACL Data RX: Handle 129 flags 0x02 dlen 21              #176 [hci1] 14.037793
      SMP: Pairing Confirm (0x03) len 16
        Confim value: b8e4137bdc4d27ec5740ca7cdb13ce36
< HCI Command: Host Number of Com.. (0x03|0x0035) plen 5  #177 [hci1] 14.038896
        Num handles: 1
        Handle: 129 Address: DF:A9:FF:F6:B1:1A (OUI DF-A9-FF)
        Count: 1
< ACL Data TX: Handle 129 flags 0x00 dlen 21              #178 [hci1] 14.038957
      SMP: Pairing Confirm (0x03) len 16
        Confim value: 485d80fe6357a24afd051aa3b574310f
> HCI Event: Number of Completed Packets (0x13) plen 5    #179 [hci1] 14.212751
        Num handles: 1
        Handle: 129 Address: DF:A9:FF:F6:B1:1A (OUI DF-A9-FF)
        Count: 1
        #178: len 21 (0 Kb/s)
        Latency: 173 msec (73-173 msec ~169 msec)
> ACL Data RX: Handle 129 flags 0x02 dlen 21              #180 [hci1] 14.213011
      SMP: Pairing Random (0x04) len 16
        Random value: 3342a772c70f76b40000000000000000
< HCI Command: Host Number of Com.. (0x03|0x0035) plen 5  #181 [hci1] 14.219059
        Num handles: 1
        Handle: 129 Address: DF:A9:FF:F6:B1:1A (OUI DF-A9-FF)
        Count: 1
< ACL Data TX: Handle 129 flags 0x00 dlen 21              #182 [hci1] 14.219068
      SMP: Pairing Random (0x04) len 16
        Random value: 25a9493fd3ce4faf02be7293595bb7c6
> HCI Event: Number of Completed Packets (0x13) plen 5    #183 [hci1] 14.387598
        Num handles: 1
        Handle: 129 Address: DF:A9:FF:F6:B1:1A (OUI DF-A9-FF)
        Count: 1
        #182: len 21 (1 Kb/s)
        Latency: 168 msec (73-173 msec ~169 msec)
> ACL Data RX: Handle 129 flags 0x02 dlen 21              #184 [hci1] 14.388004
      SMP: Pairing Confirm (0x03) len 16
        Confim value: 4f4905be36f50b27d250556f4d47cd58
< HCI Command: Host Number of Com.. (0x03|0x0035) plen 5  #185 [hci1] 14.399119
        Num handles: 1
        Handle: 129 Address: DF:A9:FF:F6:B1:1A (OUI DF-A9-FF)
        Count: 1
< ACL Data TX: Handle 129 flags 0x00 dlen 21              #186 [hci1] 14.399149
      SMP: Pairing Confirm (0x03) len 16
        Confim value: 4f8743cd04985973fdf38ab7e2fe285c
> HCI Event: Number of Completed Packets (0x13) plen 5    #187 [hci1] 14.562815
        Num handles: 1
        Handle: 129 Address: DF:A9:FF:F6:B1:1A (OUI DF-A9-FF)
        Count: 1
        #186: len 21 (1 Kb/s)
        Latency: 163 msec (73-173 msec ~166 msec)
> ACL Data RX: Handle 129 flags 0x02 dlen 21              #188 [hci1] 14.563046
      SMP: Pairing Random (0x04) len 16
        Random value: ab36429f086e85f30000000000000000
< HCI Command: Host Number of Com.. (0x03|0x0035) plen 5  #189 [hci1] 14.579619
        Num handles: 1
        Handle: 129 Address: DF:A9:FF:F6:B1:1A (OUI DF-A9-FF)
        Count: 1
< ACL Data TX: Handle 129 flags 0x00 dlen 21              #190 [hci1] 14.579704
      SMP: Pairing Random (0x04) len 16
        Random value: 58f6b41f855a6f6c3560debd84e2affc
> HCI Event: Number of Completed Packets (0x13) plen 5    #191 [hci1] 14.737456
        Num handles: 1
        Handle: 129 Address: DF:A9:FF:F6:B1:1A (OUI DF-A9-FF)
        Count: 1
        #190: len 21 (1 Kb/s)
        Latency: 157 msec (73-173 msec ~162 msec)
> ACL Data RX: Handle 129 flags 0x02 dlen 21              #192 [hci1] 14.825290
      SMP: Pairing Confirm (0x03) len 16
        Confim value: b2ba575a5ef0e627a10f7d22c3d0895e
< HCI Command: Host Number of Com.. (0x03|0x0035) plen 5  #193 [hci1] 14.839215
        Num handles: 1
        Handle: 129 Address: DF:A9:FF:F6:B1:1A (OUI DF-A9-FF)
        Count: 1
< ACL Data TX: Handle 129 flags 0x00 dlen 21              #194 [hci1] 14.839323
      SMP: Pairing Confirm (0x03) len 16
        Confim value: 8ecfa2d22274b77542610ff7202abcab
> HCI Event: Number of Completed Packets (0x13) plen 5    #195 [hci1] 15.000159
        Num handles: 1
        Handle: 129 Address: DF:A9:FF:F6:B1:1A (OUI DF-A9-FF)
        Count: 1
        #194: len 21 (1 Kb/s)
        Latency: 160 msec (73-173 msec ~161 msec)
> ACL Data RX: Handle 129 flags 0x02 dlen 21              #196 [hci1] 15.000475
      SMP: Pairing Random (0x04) len 16
        Random value: 946ad18219cc913d0000000000000000
< HCI Command: Host Number of Com.. (0x03|0x0035) plen 5  #197 [hci1] 15.019719
        Num handles: 1
        Handle: 129 Address: DF:A9:FF:F6:B1:1A (OUI DF-A9-FF)
        Count: 1
< ACL Data TX: Handle 129 flags 0x00 dlen 21              #198 [hci1] 15.019803
      SMP: Pairing Random (0x04) len 16
        Random value: b67e7216d5bf664139eda2b542549666
> HCI Event: Number of Completed Packets (0x13) plen 5    #199 [hci1] 15.174906
        Num handles: 1
        Handle: 129 Address: DF:A9:FF:F6:B1:1A (OUI DF-A9-FF)
        Count: 1
        #198: len 21 (1 Kb/s)
        Latency: 155 msec (73-173 msec ~158 msec)
> ACL Data RX: Handle 129 flags 0x02 dlen 21              #200 [hci1] 15.262769
      SMP: Pairing Confirm (0x03) len 16
        Confim value: a349924a6a28e6e22425924d10023828
< HCI Command: Host Number of Com.. (0x03|0x0035) plen 5  #201 [hci1] 15.279457
        Num handles: 1
        Handle: 129 Address: DF:A9:FF:F6:B1:1A (OUI DF-A9-FF)
        Count: 1
< ACL Data TX: Handle 129 flags 0x00 dlen 21              #202 [hci1] 15.279651
      SMP: Pairing Confirm (0x03) len 16
        Confim value: 76b2e36fb719bca6b732458245b293f9
> HCI Event: Number of Completed Packets (0x13) plen 5    #203 [hci1] 15.437638
        Num handles: 1
        Handle: 129 Address: DF:A9:FF:F6:B1:1A (OUI DF-A9-FF)
        Count: 1
        #202: len 21 (1 Kb/s)
        Latency: 157 msec (73-173 msec ~158 msec)
> ACL Data RX: Handle 129 flags 0x02 dlen 21              #204 [hci1] 15.437981
      SMP: Pairing Random (0x04) len 16
        Random value: 2ddb73357f6251450000000000000000
< HCI Command: Host Number of Com.. (0x03|0x0035) plen 5  #205 [hci1] 15.439475
        Num handles: 1
        Handle: 129 Address: DF:A9:FF:F6:B1:1A (OUI DF-A9-FF)
        Count: 1
< ACL Data TX: Handle 129 flags 0x00 dlen 21              #206 [hci1] 15.439590
      SMP: Pairing Random (0x04) len 16
        Random value: ed17f76500c95219dd01e09d1e63f87b
> HCI Event: Number of Completed Packets (0x13) plen 5    #207 [hci1] 15.612471
        Num handles: 1
        Handle: 129 Address: DF:A9:FF:F6:B1:1A (OUI DF-A9-FF)
        Count: 1
        #206: len 21 (0 Kb/s)
        Latency: 172 msec (73-173 msec ~165 msec)
> ACL Data RX: Handle 129 flags 0x02 dlen 21              #208 [hci1] 15.700258
      SMP: Pairing Confirm (0x03) len 16
        Confim value: 76a3feeee3c4ce6fde26e16f65a89a24
< HCI Command: Host Number of Com.. (0x03|0x0035) plen 5  #209 [hci1] 15.719486
        Num handles: 1
        Handle: 129 Address: DF:A9:FF:F6:B1:1A (OUI DF-A9-FF)
        Count: 1
< ACL Data TX: Handle 129 flags 0x00 dlen 21              #210 [hci1] 15.719675
      SMP: Pairing Confirm (0x03) len 16
        Confim value: 9bf0f11a8090d26d65a4f682aa1ca73c
> HCI Event: Number of Completed Packets (0x13) plen 5    #211 [hci1] 15.875175
        Num handles: 1
        Handle: 129 Address: DF:A9:FF:F6:B1:1A (OUI DF-A9-FF)
        Count: 1
        #210: len 21 (1 Kb/s)
        Latency: 155 msec (73-173 msec ~160 msec)
> ACL Data RX: Handle 129 flags 0x02 dlen 21              #212 [hci1] 15.875514
      SMP: Pairing Random (0x04) len 16
        Random value: ac8354b9ac56800a0000000000000000
< HCI Command: Host Number of Com.. (0x03|0x0035) plen 5  #213 [hci1] 15.879546
        Num handles: 1
        Handle: 129 Address: DF:A9:FF:F6:B1:1A (OUI DF-A9-FF)
        Count: 1
< ACL Data TX: Handle 129 flags 0x00 dlen 21              #214 [hci1] 15.879669
      SMP: Pairing Random (0x04) len 16
        Random value: 81d35d47e1f6006d79c974bd9d9e1ee3
> HCI Event: Number of Completed Packets (0x13) plen 5    #215 [hci1] 16.049970
        Num handles: 1
        Handle: 129 Address: DF:A9:FF:F6:B1:1A (OUI DF-A9-FF)
        Count: 1
        #214: len 21 (0 Kb/s)
        Latency: 170 msec (73-173 msec ~165 msec)
> ACL Data RX: Handle 129 flags 0x02 dlen 21              #216 [hci1] 16.137761
      SMP: Pairing Confirm (0x03) len 16
        Confim value: 3a007dcd733a29a5d7c71aa37bb02905
< HCI Command: Host Number of Com.. (0x03|0x0035) plen 5  #217 [hci1] 16.139488
        Num handles: 1
        Handle: 129 Address: DF:A9:FF:F6:B1:1A (OUI DF-A9-FF)
        Count: 1
< ACL Data TX: Handle 129 flags 0x00 dlen 21              #218 [hci1] 16.139683
      SMP: Pairing Confirm (0x03) len 16
        Confim value: 1998234fe315d0b5a9a70eeaa9584138
> HCI Event: Number of Completed Packets (0x13) plen 5    #219 [hci1] 16.312831
        Num handles: 1
        Handle: 129 Address: DF:A9:FF:F6:B1:1A (OUI DF-A9-FF)
        Count: 1
        #218: len 21 (0 Kb/s)
        Latency: 173 msec (73-173 msec ~169 msec)
> ACL Data RX: Handle 129 flags 0x02 dlen 21              #220 [hci1] 16.313050
      SMP: Pairing Random (0x04) len 16
        Random value: 0ddc63896fa445750000000000000000
< HCI Command: Host Number of Com.. (0x03|0x0035) plen 5  #221 [hci1] 16.319678
        Num handles: 1
        Handle: 129 Address: DF:A9:FF:F6:B1:1A (OUI DF-A9-FF)
        Count: 1
< ACL Data TX: Handle 129 flags 0x00 dlen 21              #222 [hci1] 16.319728
      SMP: Pairing Random (0x04) len 16
        Random value: e7f7e0c2476823e41736a7e381bafb7c
> HCI Event: Number of Completed Packets (0x13) plen 5    #223 [hci1] 16.487353
        Num handles: 1
        Handle: 129 Address: DF:A9:FF:F6:B1:1A (OUI DF-A9-FF)
        Count: 1
        #222: len 21 (1 Kb/s)
        Latency: 167 msec (73-173 msec ~168 msec)
> ACL Data RX: Handle 129 flags 0x02 dlen 21              #224 [hci1] 16.575221
      SMP: Pairing Confirm (0x03) len 16
        Confim value: fe1614fc47bf5c4c10f116f8a1c73b65
< HCI Command: Host Number of Com.. (0x03|0x0035) plen 5  #225 [hci1] 16.579477
        Num handles: 1
        Handle: 129 Address: DF:A9:FF:F6:B1:1A (OUI DF-A9-FF)
        Count: 1
< ACL Data TX: Handle 129 flags 0x00 dlen 21              #226 [hci1] 16.579660
      SMP: Pairing Confirm (0x03) len 16
        Confim value: e496d1321f290270c32058dcbe559843
> HCI Event: Number of Completed Packets (0x13) plen 5    #227 [hci1] 16.750068
        Num handles: 1
        Handle: 129 Address: DF:A9:FF:F6:B1:1A (OUI DF-A9-FF)
        Count: 1
        #226: len 21 (0 Kb/s)
        Latency: 170 msec (73-173 msec ~169 msec)
> ACL Data RX: Handle 129 flags 0x02 dlen 21              #228 [hci1] 16.750491
      SMP: Pairing Random (0x04) len 16
        Random value: 9ce1fd560004c67b0000000000000000
< HCI Command: Host Number of Com.. (0x03|0x0035) plen 5  #229 [hci1] 16.759575
        Num handles: 1
        Handle: 129 Address: DF:A9:FF:F6:B1:1A (OUI DF-A9-FF)
        Count: 1
