Bluetooth monitor ver 5.84
btmon[3335723]: = Note: Linux version 6.8.0-83-generic (x86_64)                                                          0.244953
btmon[3335723]: = Note: Bluetooth subsystem version 2.22                                                                 0.244955
= New Index: 00:00:00:00:00:00 (Primary,UART,hci0)                                                                       0.244956
= Open Index: 00:00:00:00:00:00                                                                                          0.749523
= Index Info: 00:00:00:00:00:00 (Nordic Semiconductor ASA)                                                               0.749527
zephyr.exe[3335725]: @ USER Open: main (privileged) version 2.22                                                {0x0001} 0.749530
zephyr.exe[3335725]: < HCI Command: Reset (0x03|0x0003) plen 0                                                        #1 0.749717
> HCI Event: Command Complete (0x0e) plen 4                                                                           #2 0.750444
      Reset (0x03|0x0003) ncmd 1
        Status: Success (0x00)
zephyr.exe[3335725]: < HCI Command: Read Local Supported Features (0x04|0x0003) plen 0                                #3 0.769502
> HCI Event: Command Complete (0x0e) plen 12                                                                          #4 0.770283
      Read Local Supported Features (0x04|0x0003) ncmd 1
        Status: Success (0x00)
        Features: 0x00 0x00 0x00 0x00 0x60 0x00 0x00 0x00
          BR/EDR Not Supported
          LE Supported (Controller)
zephyr.exe[3335725]: < HCI Command: Read Local Version Information (0x04|0x0001) plen 0                               #5 0.789646
> HCI Event: Command Complete (0x0e) plen 12                                                                          #6 0.790228
      Read Local Version Information (0x04|0x0001) ncmd 1
        Status: Success (0x00)
        HCI version: Reserved (0x0e) - Revision 12520 (0x30e8)
        LMP version: Reserved (0x0e) - Subversion 12520 (0x30e8)
        Manufacturer: Nordic Semiconductor ASA (89)
zephyr.exe[3335725]: < HCI Command: Read Local Supported Commands (0x04|0x0002) plen 0                                #7 0.809528
> HCI Event: Command Complete (0x0e) plen 68                                                                          #8 0.811566
      Read Local Supported Commands (0x04|0x0002) ncmd 1
        Status: Success (0x00)
        Commands: 119 entries
          Disconnect (Octet 0 - Bit 5)
          Read Remote Version Information (Octet 2 - Bit 7)
          Set Event Mask (Octet 5 - Bit 6)
          Reset (Octet 5 - Bit 7)
          Read Connection Accept Timeout (Octet 7 - Bit 2)
          Write Connection Accept Timeout (Octet 7 - Bit 3)
          Read Transmit Power Level (Octet 10 - Bit 2)
          Set Controller To Host Flow Control (Octet 10 - Bit 5)
          Host Buffer Size (Octet 10 - Bit 6)
          Host Number of Completed Packets (Octet 10 - Bit 7)
          Read Local Version Information (Octet 14 - Bit 3)
          Read Local Supported Features (Octet 14 - Bit 5)
          Read BD ADDR (Octet 15 - Bit 1)
          Read RSSI (Octet 15 - Bit 5)
          Set Event Mask Page 2 (Octet 22 - Bit 2)
          LE Set Event Mask (Octet 25 - Bit 0)
          LE Read Buffer Size (Octet 25 - Bit 1)
          LE Read Local Supported Features (Octet 25 - Bit 2)
          LE Set Random Address (Octet 25 - Bit 4)
          LE Set Advertising Parameters (Octet 25 - Bit 5)
          LE Read Advertising Channel TX Power (Octet 25 - Bit 6)
          LE Set Advertising Data (Octet 25 - Bit 7)
          LE Set Scan Response Data (Octet 26 - Bit 0)
          LE Set Advertise Enable (Octet 26 - Bit 1)
          LE Set Scan Parameters (Octet 26 - Bit 2)
          LE Set Scan Enable (Octet 26 - Bit 3)
          LE Create Connection (Octet 26 - Bit 4)
          LE Create Connection Cancel (Octet 26 - Bit 5)
          LE Read Accept List Size (Octet 26 - Bit 6)
          LE Clear Accept List (Octet 26 - Bit 7)
          LE Add Device To Accept List (Octet 27 - Bit 0)
          LE Remove Device From Accept List (Octet 27 - Bit 1)
          LE Connection Update (Octet 27 - Bit 2)
          LE Set Host Channel Classification (Octet 27 - Bit 3)
          LE Read Channel Map (Octet 27 - Bit 4)
          LE Read Remote Used Features (Octet 27 - Bit 5)
          LE Encrypt (Octet 27 - Bit 6)
          LE Rand (Octet 27 - Bit 7)
          LE Start Encryption (Octet 28 - Bit 0)
          LE Long Term Key Request Reply (Octet 28 - Bit 1)
          LE Long Term Key Request Neg Reply (Octet 28 - Bit 2)
          LE Read Supported States (Octet 28 - Bit 3)
          LE Receiver Test (Octet 28 - Bit 4)
          LE Transmitter Test (Octet 28 - Bit 5)
          LE Test End (Octet 28 - Bit 6)
          Read Authenticated Payload Timeout (Octet 32 - Bit 4)
          Write Authenticated Payload Timeout (Octet 32 - Bit 5)
          LE Set Data Length (Octet 33 - Bit 6)
          LE Read Suggested Default Data Length (Octet 33 - Bit 7)
          LE Write Suggested Default Data Length (Octet 34 - Bit 0)
          LE Add Device To Resolving List (Octet 34 - Bit 3)
          LE Remove Device From Resolving List (Octet 34 - Bit 4)
          LE Clear Resolving List (Octet 34 - Bit 5)
          LE Read Resolving List Size (Octet 34 - Bit 6)
          LE Set Address Resolution Enable (Octet 35 - Bit 1)
          LE Set Resolvable Private Address Timeout (Octet 35 - Bit 2)
          LE Read Maximum Data Length (Octet 35 - Bit 3)
          LE Read PHY (Octet 35 - Bit 4)
          LE Set Default PHY (Octet 35 - Bit 5)
          LE Set PHY (Octet 35 - Bit 6)
          LE Enhanced Receiver Test (Octet 35 - Bit 7)
          LE Enhanced Transmitter Test (Octet 36 - Bit 0)
          LE Set Advertising Set Random Address (Octet 36 - Bit 1)
          LE Set Extended Advertising Parameters (Octet 36 - Bit 2)
          LE Set Extended Advertising Data (Octet 36 - Bit 3)
          LE Set Extended Scan Response Data (Octet 36 - Bit 4)
          LE Set Extended Advertising Enable (Octet 36 - Bit 5)
          LE Read Maximum Advertising Data Length (Octet 36 - Bit 6)
          LE Read Number of Supported Advertising Sets (Octet 36 - Bit 7)
          LE Remove Advertising Set (Octet 37 - Bit 0)
          LE Clear Advertising Sets (Octet 37 - Bit 1)
          LE Set Periodic Advertising Parameters (Octet 37 - Bit 2)
          LE Set Periodic Advertising Data (Octet 37 - Bit 3)
          LE Set Periodic Advertising Enable (Octet 37 - Bit 4)
          LE Set Extended Scan Parameters (Octet 37 - Bit 5)
          LE Set Extended Scan Enable (Octet 37 - Bit 6)
          LE Extended Create Connection (Octet 37 - Bit 7)
          LE Periodic Advertising Create Sync (Octet 38 - Bit 0)
          LE Periodic Advertising Create Sync Cancel (Octet 38 - Bit 1)
          LE Periodic Advertising Terminate Sync (Octet 38 - Bit 2)
          LE Add Device To Periodic Advertiser List (Octet 38 - Bit 3)
          LE Remove Device From Periodic Advertiser List (Octet 38 - Bit 4)
          LE Clear Periodic Advertiser List (Octet 38 - Bit 5)
          LE Read Periodic Advertiser List Size (Octet 38 - Bit 6)
          LE Read Transmit Power (Octet 38 - Bit 7)
          LE Read RF Path Compensation (Octet 39 - Bit 0)
          LE Write RF Path Compensation (Octet 39 - Bit 1)
          LE Set Privacy Mode (Octet 39 - Bit 2)
          LE Periodic Advertising Receive Enable (Octet 40 - Bit 5)
          LE Periodic Advertising Sync Transfer (Octet 40 - Bit 6)
          LE Periodic Advertising Set Info Transfer (Octet 40 - Bit 7)
          LE Periodic Advertising Sync Transfer Parameters (Octet 41 - Bit 0)
          LE Set Default Periodic Advertisng Sync Transfer Parameters (Octet 41 - Bit 1)
          LE Read Buffer v2 (Octet 41 - Bit 5)
          LE Read ISO TX Sync (Octet 41 - Bit 6)
          LE Set Connected Isochronous Group Parameters (Octet 41 - Bit 7)
          LE Set Connected Isochronous Group Parameters Test (Octet 42 - Bit 0)
          LE Create Connected Isochronous Stream (Octet 42 - Bit 1)
          LE Remove Connected Isochronous Group (Octet 42 - Bit 2)
          LE Accept Connected Isochronous Stream Request (Octet 42 - Bit 3)
          LE Reject Connected Isochronous Stream Request (Octet 42 - Bit 4)
          LE Create Broadcast Isochronous Group (Octet 42 - Bit 5)
          LE Create Broadcast Isochronous Group Test (Octet 42 - Bit 6)
          LE Terminate Broadcast Isochronous Group (Octet 42 - Bit 7)
          LE Broadcast Isochronous Group Create Sync (Octet 43 - Bit 0)
          LE Broadcast Isochronous Group Terminate Sync (Octet 43 - Bit 1)
          LE Request Peer SCA (Octet 43 - Bit 2)
          LE Setup Isochronous Data Path (Octet 43 - Bit 3)
          LE Remove Isochronous Data Path (Octet 43 - Bit 4)
          LE Isochronous Transmit Test (Octet 43 - Bit 5)
          LE Isochronous Receive Test (Octet 43 - Bit 6)
          LE Isochronous Read Test Counters (Octet 43 - Bit 7)
          LE Isochronous Read Test Counters (Octet 44 - Bit 0)
          LE Set Host Feature (Octet 44 - Bit 1)
          LE Read ISO link quality (Octet 44 - Bit 2)
          Octet 45 - Bit 6 
          Octet 46 - Bit 0 
          Octet 46 - Bit 1 
          Octet 46 - Bit 2 
zephyr.exe[3335725]: < HCI Command: Host Buffer Size (0x03|0x0033) plen 7                                             #9 0.829504
        ACL MTU: 255  ACL max packet: 16
        SCO MTU: 0    SCO max packet: 0
> HCI Event: Command Complete (0x0e) plen 4                                                                          #10 0.830001
      Host Buffer Size (0x03|0x0033) ncmd 1
        Status: Success (0x00)
zephyr.exe[3335725]: < HCI Command: Set Controller To Host Flow Control (0x03|0x0031) plen 1                         #11 0.849501
        Flow control: ACL Data Packets (0x01)
> HCI Event: Command Complete (0x0e) plen 4                                                                          #12 0.850873
      Set Controller To Host Flow Control (0x03|0x0031) ncmd 1
        Status: Success (0x00)
zephyr.exe[3335725]: < HCI Command: LE Read Local Supported Features (0x08|0x0003) plen 0                            #13 0.869529
> HCI Event: Command Complete (0x0e) plen 12                                                                         #14 0.870198
      LE Read Local Supported Features (0x08|0x0003) ncmd 1
        Status: Success (0x00)
        Features: 0xfd 0x79 0x00 0xf7 0x30 0x01 0x00 0x00
          LE Encryption
          Extended Reject Indication
          Peripheral-initiated Features Exchange
          LE Ping
          LE Data Packet Length Extension
          LL Privacy
          Extended Scanner Filter Policies
          LE 2M PHY
          LE Coded PHY
          LE Extended Advertising
          LE Periodic Advertising
          Channel Selection Algorithm #2
          Periodic Advertising Sync Transfer - Sender
          Periodic Advertising Sync Transfer - Recipient
          Sleep Clock Accuracy Updates
          Connected Isochronous Stream - Central
          Connected Isochronous Stream - Peripheral
          Isochronous Broadcaster
          Synchronized Receiver
          Periodic Advertising ADI support
          Connection Subrating
          Unknown features (0x0000010000000000)
zephyr.exe[3335725]: < HCI Command: LE Set Host Feature (0x08|0x0074) plen 2                                         #15 0.889519
        Bit Number: 32
          Connected Isochronous Stream (Host Support)
        Bit Value: 1
> HCI Event: Command Complete (0x0e) plen 4                                                                          #16 0.890263
      LE Set Host Feature (0x08|0x0074) ncmd 1
        Status: Success (0x00)
zephyr.exe[3335725]: < HCI Command: LE Read Buffer v2 (0x08|0x0060) plen 0                                           #17 0.909499
> HCI Event: Command Complete (0x0e) plen 10                                                                         #18 0.910219
      LE Read Buffer v2 (0x08|0x0060) ncmd 1
        Status: Success (0x00)
        ACL MTU: 27
        ACL max packet: 3
        ISO MTU: 318
        ISO max packet: 3
zephyr.exe[3335725]: < HCI Command: LE Read Maximum Advertising Data Length (0x08|0x003a) plen 0                     #19 0.929514
> HCI Event: Command Complete (0x0e) plen 6                                                                          #20 0.930169
      LE Read Maximum Advertising Data Length (0x08|0x003a) ncmd 1
        Status: Success (0x00)
        Max length: 1650
zephyr.exe[3335725]: < HCI Command: LE Read Supported States (0x08|0x001c) plen 0                                    #21 0.949529
> HCI Event: Command Complete (0x0e) plen 12                                                                         #22 0.950669
      LE Read Supported States (0x08|0x001c) ncmd 1
        Status: Success (0x00)
        States: 0x000003ff3e0306ff
          Non-connectable Advertising State
          Scannable Advertising State
          Connectable Advertising State
          High Duty Cycle Directed Advertising State
          Passive Scanning State
          Active Scanning State
          Initiating State
            and Connection State (Central Role)
          Connection State (Peripheral Role)
          Scannable Advertising State
            and Passive Scanning State
          Connectable Advertising State
            and Passive Scanning State
          Non-connectable Advertising State
            and Initiating State
          Scannable Advertising State
            and Initiating State
          Active Scanning State
            and Connection State (Central Role)
          Passive Scanning State
            and Connection State (Peripheral Role)
          Active Scanning State
            and Connection State (Peripheral Role)
          Initiating State
            and Connection State (Central Role)
            and Central Role & Central Role
          Low Duty Cycle Directed Advertising State
          Connectable Advertising State
            and Initiating State
            and Central Role & Peripheral Role
          High Duty Cycle Directed Advertising State
            and Initiating State
            and Central Role & Peripheral Role
          Low Duty Cycle Directed Advertising State
            and Initiating State
            and Central Role & Peripheral Role
          Connectable Advertising State
            and Connection State (Central Role)
            and Central Role & Peripheral Role
          High Duty Cycle Directed Advertising State
            and Connection State (Central Role)
            and Central Role & Peripheral Role
          Low Duty Cycle Directed Advertising State
            and Connection State (Central Role)
            and Central Role & Peripheral Role
          Connectable Advertising State
            and Connection State (Peripheral Role)
            and Central Role & Peripheral Role
          High Duty Cycle Directed Advertising State
            and Connection State (Peripheral Role)
            and Peripheral Role & Peripheral Role
          Low Duty Cycle Directed Advertising State
            and Connection State (Peripheral Role)
            and Peripheral Role & Peripheral Role
          Initiating State
            and Connection State (Peripheral Role)
            and Central Role & Peripheral Role
zephyr.exe[3335725]: < HCI Command: LE Read Maximum Data Length (0x08|0x002f) plen 0                                 #23 0.969498
> HCI Event: Command Complete (0x0e) plen 12                                                                         #24 0.970344
      LE Read Maximum Data Length (0x08|0x002f) ncmd 1
        Status: Success (0x00)
        Max TX octets: 251
        Max TX time: 2704
        Max RX octets: 251
        Max RX time: 2704
zephyr.exe[3335725]: < HCI Command: LE Write Suggested Default Data Length (0x08|0x0024) plen 4                      #25 0.989487
        TX octets: 251
        TX time: 2704
> HCI Event: Command Complete (0x0e) plen 4                                                                          #26 0.990005
      LE Write Suggested Default Data Length (0x08|0x0024) ncmd 1
        Status: Success (0x00)
zephyr.exe[3335725]: < HCI Command: LE Read Resolving List Size (0x08|0x002a) plen 0                                 #27 1.009507
> HCI Event: Command Complete (0x0e) plen 5                                                                          #28 1.010065
      LE Read Resolving List Size (0x08|0x002a) ncmd 1
        Status: Success (0x00)
        Size: 8
zephyr.exe[3335725]: < HCI Command: LE Set Event Mask (0x08|0x0001) plen 8                                           #29 1.029531
        Mask: 0x000002023f87fa5e
          LE Advertising Report
          LE Connection Update Complete
          LE Read Remote Used Features Complete
          LE Long Term Key Request
          LE Data Length Change
          LE Enhanced Connection Complete
          LE PHY Update Complete
          LE Extended Advertising Report
          LE Periodic Advertising Sync Established
          LE Periodic Advertising Report
          LE Periodic Advertising Sync Lost
          LE Extended Scan Timeout
          LE Extended Advertising Set Terminated
          LE Scan Request Received
          LE Periodic Advertising Sync Transfer Rvc
          LE CIS Established
          LE CIS Request
          LE Create BIG Complete
          LE Terminate BIG Complete
          LE BIG Sync Established Complete
          LE BIG Sync Lost
          LE BIG Info Advertising Report
          Unknown mask (0x0000020000000000)
> HCI Event: Command Complete (0x0e) plen 4                                                                          #30 1.030783
      LE Set Event Mask (0x08|0x0001) ncmd 1
        Status: Success (0x00)
zephyr.exe[3335725]: < HCI Command: Set Event Mask (0x03|0x0001) plen 8                                              #31 1.049531
        Mask: 0x2000800002008890
          Disconnection Complete
          Encryption Change
          Read Remote Version Information Complete
          Hardware Error
          Data Buffer Overflow
          Encryption Key Refresh Complete
          LE Meta
> HCI Event: Command Complete (0x0e) plen 4                                                                          #32 1.050255
      Set Event Mask (0x03|0x0001) ncmd 1
        Status: Success (0x00)
zephyr.exe[3335725]: < HCI Command: Read BD ADDR (0x04|0x0009) plen 0                                                #33 1.069473
> HCI Event: Command Complete (0x0e) plen 10                                                                         #34 1.070294
      Read BD ADDR (0x04|0x0009) ncmd 1
        Status: Success (0x00)
        Address: 00:00:00:00:00:00 (OUI 00-00-00)
zephyr.exe[3335725]: < HCI Command: LE Set Random Address (0x08|0x0005) plen 6                                       #35 1.089539
        Address: D5:B6:CC:31:DB:3B (Static)
> HCI Event: Command Complete (0x0e) plen 4                                                                          #36 1.090159
      LE Set Random Address (0x08|0x0005) ncmd 1
        Status: Success (0x00)
zephyr.exe[3335725]: < HCI Command: LE Set Extended Advertising Parameters (0x08|0x0036) plen 25                     #37 7.369652
        Handle: 0x00
        Properties: 0x0013
          Connectable
          Scannable
          Use legacy advertising PDUs: ADV_IND
        Min advertising interval: 100.000 msec (0x00a0)
        Max advertising interval: 150.000 msec (0x00f0)
        Channel map: 37, 38, 39 (0x07)
        Own address type: Random (0x01)
        Peer address type: Public (0x00)
        Peer address: 00:00:00:00:00:00 (OUI 00-00-00)
        Filter policy: Allow Scan Request from Any, Allow Connect Request from Any (0x00)
        TX power: Host has no preference (0x7f)
        Primary PHY: LE 1M (0x01)
        Secondary max skip: 0x00
        Secondary PHY: LE 1M (0x01)
        SID: 0x00
        Scan request notifications: Disabled (0x00)
> HCI Event: Command Complete (0x0e) plen 5                                                                          #38 7.370558
      LE Set Extended Advertising Parameters (0x08|0x0036) ncmd 1
        Status: Success (0x00)
        TX power (selected): 0 dbm (0x00)
zephyr.exe[3335725]: < HCI Command: LE Set Advertising Set Random Address (0x08|0x0035) plen 7                       #39 7.389613
        Advertising handle: 0x00
        Advertising random address: D5:B6:CC:31:DB:3B (Static)
> HCI Event: Command Complete (0x0e) plen 4                                                                          #40 7.390718
      LE Set Advertising Set Random Address (0x08|0x0035) ncmd 1
        Status: Success (0x00)
zephyr.exe[3335725]: < HCI Command: LE Set Extended Advertising Data (0x08|0x0037) plen 22                           #41 7.409621
        Handle: 0x00
        Operation: Complete extended advertising data (0x03)
        Fragment preference: Minimize fragmentation (0x01)
        Data length: 0x12
        Flags: 0x06
          LE General Discoverable Mode
          BR/EDR Not Supported
        Name (complete): Tester_F6B11A
> HCI Event: Command Complete (0x0e) plen 4                                                                          #42 7.410824
      LE Set Extended Advertising Data (0x08|0x0037) ncmd 1
        Status: Success (0x00)
zephyr.exe[3335725]: < HCI Command: LE Set Extended Scan Response Data (0x08|0x0038) plen 4                          #43 7.429613
        Handle: 0x00
        Operation: Complete scan response data (0x03)
        Fragment preference: Minimize fragmentation (0x01)
        Data length: 0x00
> HCI Event: Command Complete (0x0e) plen 4                                                                          #44 7.430384
      LE Set Extended Scan Response Data (0x08|0x0038) ncmd 1
        Status: Success (0x00)
zephyr.exe[3335725]: < HCI Command: LE Set Extended Advertising Enable (0x08|0x0039) plen 6                          #45 7.449626
        Extended advertising: Enabled (0x01)
        Number of sets: 1 (0x01)
        Entry 0
          Handle: 0x00
          Duration: 0 ms (0x00)
          Max ext adv events: 0
> HCI Event: Command Complete (0x0e) plen 4                                                                          #46 7.450552
      LE Set Extended Advertising Enable (0x08|0x0039) ncmd 1
        Status: Success (0x00)
> HCI Event: LE Meta Event (0x3e) plen 31                                                                            #47 7.773132
      LE Enhanced Connection Complete (0x0a)
        Status: Success (0x00)
        Handle: 3
        Role: Peripheral (0x01)
        Peer address type: Public (0x00)
        Peer address: DF:A9:FF:F6:B1:1A (OUI DF-A9-FF)
        Local resolvable private address: 00:00:00:00:00:00 (Non-Resolvable)
        Peer resolvable private address: 00:00:00:00:00:00 (Non-Resolvable)
        Connection interval: 87.50 msec (0x0046)
        Connection latency: 0 (0x0000)
        Supervision timeout: 20000 msec (0x07d0)
        Central clock accuracy: 0x01
> HCI Event: LE Meta Event (0x3e) plen 6                                                                             #48 7.773134
      LE Advertising Set Terminated (0x12)
        Status: Success (0x00)
        Handle: 0
        Connection handle: 3
        Number of completed extended advertising events: 0
zephyr.exe[3335725]: < HCI Command: LE Read Remote Used Features (0x08|0x0016) plen 2                                #49 7.789713
        Handle: 3 Address: DF:A9:FF:F6:B1:1A (OUI DF-A9-FF)
> HCI Event: Command Status (0x0f) plen 4                                                                            #50 7.790284
      LE Read Remote Used Features (0x08|0x0016) ncmd 1
        Status: Success (0x00)
> HCI Event: LE Meta Event (0x3e) plen 12                                                                            #51 8.036955
      LE Read Remote Used Features (0x04)
        Status: Success (0x00)
        Handle: 3 Address: DF:A9:FF:F6:B1:1A (OUI DF-A9-FF)
        Features: 0x2d 0x49 0x00 0xf7 0x67 0xd8 0x00 0x00
          LE Encryption
          Extended Reject Indication
          Peripheral-initiated Features Exchange
          LE Data Packet Length Extension
          LE 2M PHY
          LE Coded PHY
          Channel Selection Algorithm #2
          Periodic Advertising Sync Transfer - Sender
          Periodic Advertising Sync Transfer - Recipient
          Sleep Clock Accuracy Updates
          Connected Isochronous Stream - Central
          Connected Isochronous Stream - Peripheral
          Isochronous Broadcaster
          Synchronized Receiver
          Connected Isochronous Stream (Host Support)
          LE Power Control Request
          LE Power Control Request
          Connection Subrating
          Connection Subrating (Host Support)
          Unknown features (0x0000d80000000000)
zephyr.exe[3335725]: < ACL Data TX: Handle 3 [1/3] flags 0x00 dlen 16                                               #52 12.799595
      LE L2CAP: Connection Parameter Update Request (0x12) ident 1 len 8
        Min interval: 24
        Max interval: 40
        Peripheral latency: 0
        Timeout multiplier: 42
> HCI Event: Number of Completed Packets (0x13) plen 5                                                              #53 12.936466
        Num handles: 1
        Handle: 3 Address: DF:A9:FF:F6:B1:1A (OUI DF-A9-FF)
        Count: 1
        Buffers: 0/3
        #52: len 16 (0 Kb/s)
        Latency: 136 msec (136-136 msec ~136 msec)
> ACL Data RX: Handle 3 flags 0x02 dlen 10                                                                          #54 12.936759
      LE L2CAP: Connection Parameter Update Response (0x13) ident 1 len 2
        Result: Connection Parameters accepted (0x0000)
zephyr.exe[3335725]: < HCI Command: Host Number of Completed Packets (0x03|0x0035) plen 5                           #55 12.949743
        Num handles: 1
        Handle: 3 Address: DF:A9:FF:F6:B1:1A (OUI DF-A9-FF)
        Count: 1
> ACL Data RX: Handle 3 flags 0x02 dlen 11                                                                          #56 15.561379
      SMP: Pairing Request (0x01) len 6
        IO capability: KeyboardDisplay (0x04)
        OOB data: Authentication data not present (0x00)
        Authentication requirement: Bonding, No MITM, Legacy, No Keypresses (0x01)
        Max encryption key size: 16
        Initiator key distribution: EncKey IdKey Sign (0x07)
        Responder key distribution: EncKey IdKey Sign (0x07)
zephyr.exe[3335725]: < HCI Command: Host Number of Completed Packets (0x03|0x0035) plen 5                           #57 15.569747
        Num handles: 1
        Handle: 3 Address: DF:A9:FF:F6:B1:1A (OUI DF-A9-FF)
        Count: 1
zephyr.exe[3335725]: < ACL Data TX: Handle 3 [1/3] flags 0x00 dlen 11                                               #58 15.569792
      SMP: Pairing Response (0x02) len 6
        IO capability: NoInputNoOutput (0x03)
        OOB data: Authentication data not present (0x00)
        Authentication requirement: Bonding, No MITM, Legacy, No Keypresses (0x01)
        Max encryption key size: 16
        Initiator key distribution: EncKey IdKey Sign (0x07)
        Responder key distribution: EncKey Sign (0x05)
> HCI Event: Number of Completed Packets (0x13) plen 5                                                              #59 15.737145
        Num handles: 1
        Handle: 3 Address: DF:A9:FF:F6:B1:1A (OUI DF-A9-FF)
        Count: 1
        Buffers: 0/3
        #58: len 11 (0 Kb/s)
        Latency: 167 msec (136-167 msec ~152 msec)
> ACL Data RX: Handle 3 flags 0x02 dlen 21                                                                          #60 15.737146
      SMP: Pairing Confirm (0x03) len 16
        Confirm value[16]: ff2f15d4389b9ac183d3a1f0bc18d0e2
zephyr.exe[3335725]: < HCI Command: Host Number of Completed Packets (0x03|0x0035) plen 5                           #61 15.749893
        Num handles: 1
        Handle: 3 Address: DF:A9:FF:F6:B1:1A (OUI DF-A9-FF)
        Count: 1
zephyr.exe[3335725]: < ACL Data TX: Handle 3 [1/3] flags 0x00 dlen 21                                               #62 15.749913
      SMP: Pairing Confirm (0x03) len 16
        Confirm value[16]: 372f6c353da1be04f36b544431c7f9dd
> HCI Event: Number of Completed Packets (0x13) plen 5                                                              #63 15.911693
        Num handles: 1
        Handle: 3 Address: DF:A9:FF:F6:B1:1A (OUI DF-A9-FF)
        Count: 1
        Buffers: 0/3
        #62: len 21 (1 Kb/s)
        Latency: 161 msec (136-167 msec ~156 msec)
> ACL Data RX: Handle 3 flags 0x02 dlen 21                                                                          #64 15.912035
      SMP: Pairing Random (0x04) len 16
        Random value[16]: b56262a263a26e960000000000000000
zephyr.exe[3335725]: < HCI Command: Host Number of Completed Packets (0x03|0x0035) plen 5                           #65 15.929789
        Num handles: 1
        Handle: 3 Address: DF:A9:FF:F6:B1:1A (OUI DF-A9-FF)
        Count: 1
zephyr.exe[3335725]: < ACL Data TX: Handle 3 [1/3] flags 0x00 dlen 21                                               #66 15.929810
      SMP: Pairing Random (0x04) len 16
        Random value[16]: 8e6108f966a694cbe26df70bb96773e6
> HCI Event: Number of Completed Packets (0x13) plen 5                                                              #67 16.086519
        Num handles: 1
        Handle: 3 Address: DF:A9:FF:F6:B1:1A (OUI DF-A9-FF)
        Count: 1
        Buffers: 0/3
        #66: len 21 (1 Kb/s)
        Latency: 156 msec (136-167 msec ~156 msec)
> HCI Event: LE Meta Event (0x3e) plen 13                                                                           #68 16.174396
      LE Long Term Key Request (0x05)
        Handle: 3 Address: DF:A9:FF:F6:B1:1A (OUI DF-A9-FF)
        Random number: 0x0000000000000000
        Encrypted diversifier: 0x0000
zephyr.exe[3335725]: < HCI Command: LE Long Term Key Request Reply (0x08|0x001a) plen 18                            #69 16.189817
        Handle: 3 Address: DF:A9:FF:F6:B1:1A (OUI DF-A9-FF)
        Long term key[16]: ab12691190a101a486b6de40ceb3d659
> HCI Event: Command Complete (0x0e) plen 6                                                                         #70 16.190736
      LE Long Term Key Request Reply (0x08|0x001a) ncmd 1
        Status: Success (0x00)
        Handle: 3 Address: DF:A9:FF:F6:B1:1A (OUI DF-A9-FF)
> HCI Event: Encryption Change (0x08) plen 4                                                                        #71 16.611823
        Status: Success (0x00)
        Handle: 3 Address: DF:A9:FF:F6:B1:1A (OUI DF-A9-FF)
        Encryption: Enabled with AES-CCM (0x01)
zephyr.exe[3335725]: < ACL Data TX: Handle 3 [1/3] flags 0x00 dlen 21                                               #72 16.739834
      SMP: Encryption Information (0x06) len 16
        Long term key[16]: 5da095555cc64d02679f89a05211af56
zephyr.exe[3335725]: < ACL Data TX: Handle 3 [2/3] flags 0x00 dlen 15                                               #73 16.739843
      SMP: Central Identification (0x07) len 10
        EDIV: 0x825e
        Rand: 0x84c81ed264dab3d8
zephyr.exe[3335725]: < ACL Data TX: Handle 3 [3/3] flags 0x00 dlen 21                                               #74 16.739844
      SMP: Signing Information (0x0a) len 16
        Signature key[16]: bc235a02440d0c3424a2acf8fd71a45c
> HCI Event: Number of Completed Packets (0x13) plen 5                                                              #75 16.786927
        Num handles: 1
        Handle: 3 Address: DF:A9:FF:F6:B1:1A (OUI DF-A9-FF)
        Count: 1
        Buffers: 2/3
        #72: len 21 (3 Kb/s)
        Latency: 47 msec (47-167 msec ~101 msec)
> HCI Event: Number of Completed Packets (0x13) plen 5                                                              #76 16.787560
        Num handles: 1
        Handle: 3 Address: DF:A9:FF:F6:B1:1A (OUI DF-A9-FF)
        Count: 1
        Buffers: 1/3
        #73: len 15 (2 Kb/s)
        Latency: 47 msec (47-167 msec ~74 msec)
> HCI Event: Number of Completed Packets (0x13) plen 5                                                              #77 16.874317
        Num handles: 1
        Handle: 3 Address: DF:A9:FF:F6:B1:1A (OUI DF-A9-FF)
        Count: 1
        Buffers: 0/3
        #74: len 21 (1 Kb/s)
        Latency: 134 msec (47-167 msec ~104 msec)
> ACL Data RX: Handle 3 flags 0x02 dlen 21                                                                          #78 16.874320
      SMP: Encryption Information (0x06) len 16
        Long term key[16]: d0979161a5ed4754d19ed9f71c5fefe3
> ACL Data RX: Handle 3 flags 0x02 dlen 15                                                                          #79 16.874746
      SMP: Central Identification (0x07) len 10
        EDIV: 0x2b6e
        Rand: 0x7dc579574dfda70e
> ACL Data RX: Handle 3 flags 0x02 dlen 21                                                                          #80 16.875455
      SMP: Identity Information (0x08) len 16
        Identity resolving key[16]: 7d1d827756f2256a308d1b7298157f93
zephyr.exe[3335725]: < HCI Command: Host Number of Completed Packets (0x03|0x0035) plen 5                           #81 16.889812
        Num handles: 1
        Handle: 3 Address: DF:A9:FF:F6:B1:1A (OUI DF-A9-FF)
        Count: 1
zephyr.exe[3335725]: < HCI Command: Host Number of Completed Packets (0x03|0x0035) plen 5                           #82 16.889922
        Num handles: 1
        Handle: 3 Address: DF:A9:FF:F6:B1:1A (OUI DF-A9-FF)
        Count: 1
zephyr.exe[3335725]: < HCI Command: Host Number of Completed Packets (0x03|0x0035) plen 5                           #83 16.889965
        Num handles: 1
        Handle: 3 Address: DF:A9:FF:F6:B1:1A (OUI DF-A9-FF)
        Count: 1
> ACL Data RX: Handle 3 flags 0x02 dlen 12                                                                          #84 16.961529
      SMP: Identity Address Information (0x09) len 7
        Address: DF:A9:FF:F6:B1:1A (OUI DF-A9-FF)
> ACL Data RX: Handle 3 flags 0x02 dlen 21                                                                          #85 16.962453
      SMP: Signing Information (0x0a) len 16
        Signature key[16]: 91557f90e4c0550cb7b279ef61f9140b
> ACL Data RX: Handle 3 flags 0x02 dlen 26                                                                          #86 16.963275
      LE L2CAP: Enhanced Credit Connection Request (0x17) ident 1 len 18
        PSM: 39 (0x0027)
        MTU: 64
        MPS: 64
        Credits: 5
        Source CID: 84
        Source CID: 83
        Source CID: 82
        Source CID: 81
        Source CID: 80
zephyr.exe[3335725]: < HCI Command: LE Add Device To Resolving List (0x08|0x0027) plen 39                           #87 16.969848
        Address type: Public (0x00)
        Address: DF:A9:FF:F6:B1:1A (OUI DF-A9-FF)
        Peer identity resolving key[16]: 7d1d827756f2256a308d1b7298157f93
        Local identity resolving key[16]: 00000000000000000000000000000000
> HCI Event: Command Complete (0x0e) plen 4                                                                         #88 16.970974
      LE Add Device To Resolving List (0x08|0x0027) ncmd 1
        Status: Success (0x00)
zephyr.exe[3335725]: < HCI Command: LE Set Privacy Mode (0x08|0x004e) plen 8                                        #89 16.989759
        Peer Identity address type: Public (0x00)
        Peer Identity address: DF:A9:FF:F6:B1:1A (OUI DF-A9-FF)
        Privacy Mode: Use Device Privacy (0x01)
> HCI Event: Command Complete (0x0e) plen 4                                                                         #90 16.990536
      LE Set Privacy Mode (0x08|0x004e) ncmd 1
        Status: Success (0x00)
zephyr.exe[3335725]: < HCI Command: LE Set Address Resolution Enable (0x08|0x002d) plen 1                           #91 17.009744
        Address resolution: Enabled (0x01)
> HCI Event: Command Complete (0x0e) plen 4                                                                         #92 17.010305
      LE Set Address Resolution Enable (0x08|0x002d) ncmd 1
        Status: Success (0x00)
zephyr.exe[3335725]: < HCI Command: Host Number of Completed Packets (0x03|0x0035) plen 5                           #93 17.029719
        Num handles: 1
        Handle: 3 Address: DF:A9:FF:F6:B1:1A (OUI DF-A9-FF)
        Count: 1
zephyr.exe[3335725]: < HCI Command: Host Number of Completed Packets (0x03|0x0035) plen 5                           #94 17.029810
        Num handles: 1
        Handle: 3 Address: DF:A9:FF:F6:B1:1A (OUI DF-A9-FF)
        Count: 1
zephyr.exe[3335725]: < HCI Command: Host Number of Completed Packets (0x03|0x0035) plen 5                           #95 17.029903
        Num handles: 1
        Handle: 3 Address: DF:A9:FF:F6:B1:1A (OUI DF-A9-FF)
        Count: 1
zephyr.exe[3335725]: < ACL Data TX: Handle 3 [1/3] flags 0x00 dlen 26                                               #96 17.029967
      LE L2CAP: Enhanced Credit Connection Response (0x18) ident 1 len 18
        MTU: 249
        MPS: 251
        Credits: 1
        Result: Connection successful (0x0000)
        Destination CID: 64
        Destination CID: 65
        Destination CID: 66
        Destination CID: 67
        Destination CID: 68
> HCI Event: Number of Completed Packets (0x13) plen 5                                                              #97 17.136320
        Num handles: 1
        Handle: 3 Address: DF:A9:FF:F6:B1:1A (OUI DF-A9-FF)
        Count: 1
        Buffers: 0/3
        #96: len 26 (1 Kb/s)
        Latency: 106 msec (47-167 msec ~105 msec)
zephyr.exe[3335725]: < ACL Data TX: Handle 3 [1/3] flags 0x00 dlen 13                                               #98 19.829816
      Channel: 80 len 9 sdu 7 [PSM 39 mode Enhanced Credit (0x81)] {chan 4}
      ATT: Read By Type Request (0x08) len 6
        Handle range: 0x0001-0x0023
        Attribute type: Characteristic (0x2803)
> HCI Event: Number of Completed Packets (0x13) plen 5                                                              #99 19.936412
        Num handles: 1
        Handle: 3 Address: DF:A9:FF:F6:B1:1A (OUI DF-A9-FF)
        Count: 1
        Buffers: 0/3
        #98: len 13 (0 Kb/s)
        Latency: 106 msec (47-167 msec ~106 msec)
        Channel: 80 [PSM 39 mode Enhanced Credit (0x81)] {chan 4}
        Channel Latency: 106 msec (106-106 msec ~106 msec)
> ACL Data RX: Handle 3 flags 0x02 dlen 15                                                                         #100 19.936685
      Channel: 68 len 11 sdu 9 [PSM 39 mode Enhanced Credit (0x81)] {chan 4}
      ATT: Read By Type Response (0x09) len 8
        Attribute data length: 7
        Attribute data list: 1 entry
        Handle: 0x0003
        Value[5]: 0204000cb0
            Properties: 0x02
              Read (0x02)
            Value Handle: 0x0004
            Value UUID: Unknown (0xb00c)
zephyr.exe[3335725]: < HCI Command: Host Number of Completed Packets (0x03|0x0035) plen 5                          #101 19.949805
        Num handles: 1
        Handle: 3 Address: DF:A9:FF:F6:B1:1A (OUI DF-A9-FF)
        Count: 1
zephyr.exe[3335725]: < ACL Data TX: Handle 3 [1/3] flags 0x00 dlen 13                                              #102 19.949865
      Channel: 80 len 9 sdu 7 [PSM 39 mode Enhanced Credit (0x81)] {chan 4}
      ATT: Read By Type Request (0x08) len 6
        Handle range: 0x0004-0x0023
        Attribute type: Characteristic (0x2803)
zephyr.exe[3335725]: < ACL Data TX: Handle 3 [2/3] flags 0x00 dlen 12                                              #103 19.949869
      LE L2CAP: LE Flow Control Credit (0x16) ident 2 len 4
        Source CID: 68
        Credits: 1
> HCI Event: Number of Completed Packets (0x13) plen 5                                                             #104 20.024343
        Num handles: 1
        Handle: 3 Address: DF:A9:FF:F6:B1:1A (OUI DF-A9-FF)
        Count: 1
        Buffers: 1/3
        #102: len 13 (1 Kb/s)
        Latency: 74 msec (47-167 msec ~90 msec)
        Channel: 80 [PSM 39 mode Enhanced Credit (0x81)] {chan 4}
        Channel Latency: 74 msec (74-106 msec ~90 msec)
> HCI Event: Number of Completed Packets (0x13) plen 5                                                             #105 20.111483
        Num handles: 1
        Handle: 3 Address: DF:A9:FF:F6:B1:1A (OUI DF-A9-FF)
        Count: 1
        Buffers: 0/3
        #103: len 12 (0 Kb/s)
        Latency: 161 msec (47-167 msec ~125 msec)
        Channel: 80 [PSM 39 mode Enhanced Credit (0x81)] {chan 4}
        Channel Latency: 161 msec (74-161 msec ~126 msec)
> ACL Data RX: Handle 3 flags 0x02 dlen 27                                                                         #106 20.111848
> ACL Data RX: Handle 3 flags 0x01 dlen 2                                                                          #107 20.111978
      Channel: 68 len 25 sdu 23 [PSM 39 mode Enhanced Credit (0x81)] {chan 4}
      ATT: Read By Type Response (0x09) len 22
        Attribute data length: 21
        Attribute data list: 1 entry
        Handle: 0x0005
        Value[19]: 020600efcdab8967452301000000000bb00000
            Properties: 0x02
              Read (0x02)
            Value Handle: 0x0006
            Value UUID: Vendor specific (0000b00b-0000-0000-0123-456789abcdef)
zephyr.exe[3335725]: < HCI Command: Host Number of Completed Packets (0x03|0x0035) plen 5                          #108 20.129908
        Num handles: 1
        Handle: 3 Address: DF:A9:FF:F6:B1:1A (OUI DF-A9-FF)
        Count: 1
zephyr.exe[3335725]: < HCI Command: Host Number of Completed Packets (0x03|0x0035) plen 5                          #109 20.129914
        Num handles: 1
        Handle: 3 Address: DF:A9:FF:F6:B1:1A (OUI DF-A9-FF)
        Count: 1
zephyr.exe[3335725]: < ACL Data TX: Handle 3 [1/3] flags 0x00 dlen 13                                              #110 20.129964
      Channel: 80 len 9 sdu 7 [PSM 39 mode Enhanced Credit (0x81)] {chan 4}
      ATT: Read By Type Request (0x08) len 6
        Handle range: 0x0006-0x0023
        Attribute type: Characteristic (0x2803)
zephyr.exe[3335725]: < ACL Data TX: Handle 3 [2/3] flags 0x00 dlen 12                                              #111 20.129968
      LE L2CAP: LE Flow Control Credit (0x16) ident 3 len 4
        Source CID: 68
        Credits: 1
> HCI Event: Number of Completed Packets (0x13) plen 5                                                             #112 20.199251
        Num handles: 1
        Handle: 3 Address: DF:A9:FF:F6:B1:1A (OUI DF-A9-FF)
        Count: 1
        Buffers: 1/3
        #110: len 13 (1 Kb/s)
        Latency: 69 msec (47-167 msec ~97 msec)
        Channel: 80 [PSM 39 mode Enhanced Credit (0x81)] {chan 4}
        Channel Latency: 69 msec (69-161 msec ~97 msec)
> HCI Event: Number of Completed Packets (0x13) plen 5                                                             #113 20.286470
        Num handles: 1
        Handle: 3 Address: DF:A9:FF:F6:B1:1A (OUI DF-A9-FF)
        Count: 1
        Buffers: 0/3
        #111: len 12 (0 Kb/s)
        Latency: 156 msec (47-167 msec ~127 msec)
> ACL Data RX: Handle 3 flags 0x02 dlen 15                                                                         #114 20.287064
      Channel: 68 len 11 sdu 9 [PSM 39 mode Enhanced Credit (0x81)] {chan 4}
      ATT: Read By Type Response (0x09) len 8
        Attribute data length: 7
        Attribute data list: 1 entry
        Handle: 0x0021
        Value[5]: 202200052a
            Properties: 0x20
              Indicate (0x20)
            Value Handle: 0x0022
            Value UUID: Service Changed (0x2a05)
zephyr.exe[3335725]: < HCI Command: Host Number of Completed Packets (0x03|0x0035) plen 5                          #115 20.289837
        Num handles: 1
        Handle: 3 Address: DF:A9:FF:F6:B1:1A (OUI DF-A9-FF)
        Count: 1
zephyr.exe[3335725]: < ACL Data TX: Handle 3 [1/3] flags 0x00 dlen 13                                              #116 20.289887
      Channel: 80 len 9 sdu 7 [PSM 39 mode Enhanced Credit (0x81)] {chan 4}
      ATT: Read By Type Request (0x08) len 6
        Handle range: 0x0022-0x0023
        Attribute type: Characteristic (0x2803)
zephyr.exe[3335725]: < ACL Data TX: Handle 3 [2/3] flags 0x00 dlen 12                                              #117 20.289891
      LE L2CAP: LE Flow Control Credit (0x16) ident 4 len 4
        Source CID: 68
        Credits: 1
> HCI Event: Number of Completed Packets (0x13) plen 5                                                             #118 20.374231
        Num handles: 1
        Handle: 3 Address: DF:A9:FF:F6:B1:1A (OUI DF-A9-FF)
        Count: 1
        Buffers: 1/3
        #116: len 13 (1 Kb/s)
        Laten