Bluetooth monitor ver 5.72
= Note: Linux version 6.14.0-36-generic (x86_64)                       0.084760
= Note: Bluetooth subsystem version 2.22                               0.084762
= New Index: 00:00:00:00:00:00 (Primary,UART,hci1)              [hci1] 0.084763
= New Index: 48:5F:99:8E:E0:64 (Primary,USB,hci0)               [hci0] 0.084764
= Open Index: 00:00:00:00:00:00                                 [hci1] 0.598555
= Index Info: 00:00:00:00:00:00 (Nordic Semiconductor ASA)      [hci1] 0.598566
@ USER Open: main (privileged) version 2.22            {0x0001} [hci1] 0.598573
< HCI Command: Reset (0x03|0x0003) plen 0                    #1 [hci1] 0.599716
> HCI Event: Command Complete (0x0e) plen 4                  #2 [hci1] 0.600198
      Reset (0x03|0x0003) ncmd 1
        Status: Success (0x00)
< HCI Command: Read Local Supported... (0x04|0x0003) plen 0  #3 [hci1] 0.618354
> HCI Event: Command Complete (0x0e) plen 12                 #4 [hci1] 0.618875
      Read Local Supported Features (0x04|0x0003) ncmd 1
        Status: Success (0x00)
        Features: 0x00 0x00 0x00 0x00 0x60 0x00 0x00 0x00
          BR/EDR Not Supported
          LE Supported (Controller)
< HCI Command: Read Local Version In.. (0x04|0x0001) plen 0  #5 [hci1] 0.638103
> HCI Event: Command Complete (0x0e) plen 12                 #6 [hci1] 0.638574
      Read Local Version Information (0x04|0x0001) ncmd 1
        Status: Success (0x00)
        HCI version: Reserved (0x0f) - Revision 12393 (0x3069)
        LMP version: Reserved (0x0f) - Subversion 12393 (0x3069)
        Manufacturer: Nordic Semiconductor ASA (89)
< HCI Command: Read Local Supported... (0x04|0x0002) plen 0  #7 [hci1] 0.658000
> HCI Event: Command Complete (0x0e) plen 68                 #8 [hci1] 0.659045
      Read Local Supported Commands (0x04|0x0002) ncmd 1
        Status: Success (0x00)
        Commands: 119 entries
          Disconnect (Octet 0 - Bit 5)
          Read Remote Version Information (Octet 2 - Bit 7)
          Set Event Mask (Octet 5 - Bit 6)
          Reset (Octet 5 - Bit 7)
          Read Connection Accept Timeout (Octet 7 - Bit 2)
          Write Connection Accept Timeout (Octet 7 - Bit 3)
          Read Transmit Power Level (Octet 10 - Bit 2)
          Set Controller To Host Flow Control (Octet 10 - Bit 5)
          Host Buffer Size (Octet 10 - Bit 6)
          Host Number of Completed Packets (Octet 10 - Bit 7)
          Read Local Version Information (Octet 14 - Bit 3)
          Read Local Supported Features (Octet 14 - Bit 5)
          Read BD ADDR (Octet 15 - Bit 1)
          Read RSSI (Octet 15 - Bit 5)
          Set Event Mask Page 2 (Octet 22 - Bit 2)
          LE Set Event Mask (Octet 25 - Bit 0)
          LE Read Buffer Size (Octet 25 - Bit 1)
          LE Read Local Supported Features (Octet 25 - Bit 2)
          LE Set Random Address (Octet 25 - Bit 4)
          LE Set Advertising Parameters (Octet 25 - Bit 5)
          LE Read Advertising Channel TX Power (Octet 25 - Bit 6)
          LE Set Advertising Data (Octet 25 - Bit 7)
          LE Set Scan Response Data (Octet 26 - Bit 0)
          LE Set Advertise Enable (Octet 26 - Bit 1)
          LE Set Scan Parameters (Octet 26 - Bit 2)
          LE Set Scan Enable (Octet 26 - Bit 3)
          LE Create Connection (Octet 26 - Bit 4)
          LE Create Connection Cancel (Octet 26 - Bit 5)
          LE Read Accept List Size (Octet 26 - Bit 6)
          LE Clear Accept List (Octet 26 - Bit 7)
          LE Add Device To Accept List (Octet 27 - Bit 0)
          LE Remove Device From Accept List (Octet 27 - Bit 1)
          LE Connection Update (Octet 27 - Bit 2)
          LE Set Host Channel Classification (Octet 27 - Bit 3)
          LE Read Channel Map (Octet 27 - Bit 4)
          LE Read Remote Used Features (Octet 27 - Bit 5)
          LE Encrypt (Octet 27 - Bit 6)
          LE Rand (Octet 27 - Bit 7)
          LE Start Encryption (Octet 28 - Bit 0)
          LE Long Term Key Request Reply (Octet 28 - Bit 1)
          LE Long Term Key Request Neg Reply (Octet 28 - Bit 2)
          LE Read Supported States (Octet 28 - Bit 3)
          LE Receiver Test (Octet 28 - Bit 4)
          LE Transmitter Test (Octet 28 - Bit 5)
          LE Test End (Octet 28 - Bit 6)
          Read Authenticated Payload Timeout (Octet 32 - Bit 4)
          Write Authenticated Payload Timeout (Octet 32 - Bit 5)
          LE Set Data Length (Octet 33 - Bit 6)
          LE Read Suggested Default Data Length (Octet 33 - Bit 7)
          LE Write Suggested Default Data Length (Octet 34 - Bit 0)
          LE Add Device To Resolving List (Octet 34 - Bit 3)
          LE Remove Device From Resolving List (Octet 34 - Bit 4)
          LE Clear Resolving List (Octet 34 - Bit 5)
          LE Read Resolving List Size (Octet 34 - Bit 6)
          LE Set Address Resolution Enable (Octet 35 - Bit 1)
          LE Set Resolvable Private Address Timeout (Octet 35 - Bit 2)
          LE Read Maximum Data Length (Octet 35 - Bit 3)
          LE Read PHY (Octet 35 - Bit 4)
          LE Set Default PHY (Octet 35 - Bit 5)
          LE Set PHY (Octet 35 - Bit 6)
          LE Enhanced Receiver Test (Octet 35 - Bit 7)
          LE Enhanced Transmitter Test (Octet 36 - Bit 0)
          LE Set Advertising Set Random Address (Octet 36 - Bit 1)
          LE Set Extended Advertising Parameters (Octet 36 - Bit 2)
          LE Set Extended Advertising Data (Octet 36 - Bit 3)
          LE Set Extended Scan Response Data (Octet 36 - Bit 4)
          LE Set Extended Advertising Enable (Octet 36 - Bit 5)
          LE Read Maximum Advertising Data Length (Octet 36 - Bit 6)
          LE Read Number of Supported Advertising Sets (Octet 36 - Bit 7)
          LE Remove Advertising Set (Octet 37 - Bit 0)
          LE Clear Advertising Sets (Octet 37 - Bit 1)
          LE Set Periodic Advertising Parameters (Octet 37 - Bit 2)
          LE Set Periodic Advertising Data (Octet 37 - Bit 3)
          LE Set Periodic Advertising Enable (Octet 37 - Bit 4)
          LE Set Extended Scan Parameters (Octet 37 - Bit 5)
          LE Set Extended Scan Enable (Octet 37 - Bit 6)
          LE Extended Create Connection (Octet 37 - Bit 7)
          LE Periodic Advertising Create Sync (Octet 38 - Bit 0)
          LE Periodic Advertising Create Sync Cancel (Octet 38 - Bit 1)
          LE Periodic Advertising Terminate Sync (Octet 38 - Bit 2)
          LE Add Device To Periodic Advertiser List (Octet 38 - Bit 3)
          LE Remove Device From Periodic Advertiser List (Octet 38 - Bit 4)
          LE Clear Periodic Advertiser List (Octet 38 - Bit 5)
          LE Read Periodic Advertiser List Size (Octet 38 - Bit 6)
          LE Read Transmit Power (Octet 38 - Bit 7)
          LE Read RF Path Compensation (Octet 39 - Bit 0)
          LE Write RF Path Compensation (Octet 39 - Bit 1)
          LE Set Privacy Mode (Octet 39 - Bit 2)
          LE Periodic Advertising Receive Enable (Octet 40 - Bit 5)
          LE Periodic Advertising Sync Transfer (Octet 40 - Bit 6)
          LE Periodic Advertising Set Info Transfer (Octet 40 - Bit 7)
          LE Periodic Advertising Sync Transfer Parameters (Octet 41 - Bit 0)
          LE Set Default Periodic Advertisng Sync Transfer Parameters (Octet 41 - Bit 1)
          LE Read Buffer v2 (Octet 41 - Bit 5)
          LE Read ISO TX Sync (Octet 41 - Bit 6)
          LE Set Connected Isochronous Group Parameters (Octet 41 - Bit 7)
          LE Set Connected Isochronous Group Parameters Test (Octet 42 - Bit 0)
          LE Create Connected Isochronous Stream (Octet 42 - Bit 1)
          LE Remove Connected Isochronous Group (Octet 42 - Bit 2)
          LE Accept Connected Isochronous Stream Request (Octet 42 - Bit 3)
          LE Reject Connected Isochronous Stream Request (Octet 42 - Bit 4)
          LE Create Broadcast Isochronous Group (Octet 42 - Bit 5)
          LE Create Broadcast Isochronous Group Test (Octet 42 - Bit 6)
          LE Terminate Broadcast Isochronous Group (Octet 42 - Bit 7)
          LE Broadcast Isochronous Group Create Sync (Octet 43 - Bit 0)
          LE Broadcast Isochronous Group Terminate Sync (Octet 43 - Bit 1)
          LE Request Peer SCA (Octet 43 - Bit 2)
          LE Setup Isochronous Data Path (Octet 43 - Bit 3)
          LE Remove Isochronous Data Path (Octet 43 - Bit 4)
          LE Isochronous Transmit Test (Octet 43 - Bit 5)
          LE Isochronous Receive Test (Octet 43 - Bit 6)
          LE Isochronous Read Test Counters (Octet 43 - Bit 7)
          LE Isochronous Read Test Counters (Octet 44 - Bit 0)
          LE Set Host Feature (Octet 44 - Bit 1)
          Octet 44 - Bit 2 
          Octet 45 - Bit 6 
          Octet 46 - Bit 0 
          Octet 46 - Bit 1 
          Octet 46 - Bit 2 
< HCI Command: Host Buffer Size (0x03|0x0033) plen 7         #9 [hci1] 0.678043
        ACL MTU: 255  ACL max packet: 16
        SCO MTU: 0    SCO max packet: 0
> HCI Event: Command Complete (0x0e) plen 4                 #10 [hci1] 0.678583
      Host Buffer Size (0x03|0x0033) ncmd 1
        Status: Success (0x00)
< HCI Command: Set Controller To Ho.. (0x03|0x0031) plen 1  #11 [hci1] 0.698025
        Flow control: ACL Data Packets (0x01)
> HCI Event: Command Complete (0x0e) plen 4                 #12 [hci1] 0.698471
      Set Controller To Host Flow Control (0x03|0x0031) ncmd 1
        Status: Success (0x00)
< HCI Command: LE Read Local Suppor.. (0x08|0x0003) plen 0  #13 [hci1] 0.718041
> HCI Event: Command Complete (0x0e) plen 12                #14 [hci1] 0.718489
      LE Read Local Supported Features (0x08|0x0003) ncmd 1
        Status: Success (0x00)
        Features: 0xfd 0x79 0x00 0xf7 0x30 0x01 0x00 0x00
          LE Encryption
          Extended Reject Indication
          Peripheral-initiated Features Exchange
          LE Ping
          LE Data Packet Length Extension
          LL Privacy
          Extended Scanner Filter Policies
          LE 2M PHY
          LE Coded PHY
          LE Extended Advertising
          LE Periodic Advertising
          Channel Selection Algorithm #2
          Periodic Advertising Sync Transfer - Sender
          Periodic Advertising Sync Transfer - Recipient
          Sleep Clock Accuracy Updates
          Connected Isochronous Stream - Central
          Connected Isochronous Stream - Peripheral
          Isochronous Broadcaster
          Synchronized Receiver
          Periodic Advertising ADI support
          Connection Subrating
          Unknown features (0x0000010000000000)
< HCI Command: LE Set Host Feature (0x08|0x0074) plen 2     #15 [hci1] 0.738037
        Bit Number: 32
          Connected Isochronous Stream (Host Support)
        Bit Value: 1
> HCI Event: Command Complete (0x0e) plen 4                 #16 [hci1] 0.738443
      LE Set Host Feature (0x08|0x0074) ncmd 1
        Status: Success (0x00)
< HCI Command: LE Read Buffer v2 (0x08|0x0060) plen 0       #17 [hci1] 0.757993
> HCI Event: Command Complete (0x0e) plen 10                #18 [hci1] 0.758467
      LE Read Buffer v2 (0x08|0x0060) ncmd 1
        Status: Success (0x00)
        ACL MTU: 27
        ACL max packet: 3
        ISO MTU: 318
        ISO max packet: 3
< HCI Command: LE Read Maximum Adve.. (0x08|0x003a) plen 0  #19 [hci1] 0.778026
> HCI Event: Command Complete (0x0e) plen 6                 #20 [hci1] 0.778601
      LE Read Maximum Advertising Data Length (0x08|0x003a) ncmd 1
        Status: Success (0x00)
        Max length: 1650
< HCI Command: LE Read Supported St.. (0x08|0x001c) plen 0  #21 [hci1] 0.797995
> HCI Event: Command Complete (0x0e) plen 12                #22 [hci1] 0.798506
      LE Read Supported States (0x08|0x001c) ncmd 1
        Status: Success (0x00)
        States: 0x000003ff3e0306ff
          Non-connectable Advertising State
          Scannable Advertising State
          Connectable Advertising State
          High Duty Cycle Directed Advertising State
          Passive Scanning State
          Active Scanning State
          Initiating State
            and Connection State (Central Role)
          Connection State (Peripheral Role)
          Scannable Advertising State
            and Passive Scanning State
          Connectable Advertising State
            and Passive Scanning State
          Non-connectable Advertising State
            and Initiating State
          Scannable Advertising State
            and Initiating State
          Active Scanning State
            and Connection State (Central Role)
          Passive Scanning State
            and Connection State (Peripheral Role)
          Active Scanning State
            and Connection State (Peripheral Role)
          Initiating State
            and Connection State (Central Role)
            and Central Role & Central Role
          Low Duty Cycle Directed Advertising State
          Connectable Advertising State
            and Initiating State
            and Central Role & Peripheral Role
          High Duty Cycle Directed Advertising State
            and Initiating State
            and Central Role & Peripheral Role
          Low Duty Cycle Directed Advertising State
            and Initiating State
            and Central Role & Peripheral Role
          Connectable Advertising State
            and Connection State (Central Role)
            and Central Role & Peripheral Role
          High Duty Cycle Directed Advertising State
            and Connection State (Central Role)
            and Central Role & Peripheral Role
          Low Duty Cycle Directed Advertising State
            and Connection State (Central Role)
            and Central Role & Peripheral Role
          Connectable Advertising State
            and Connection State (Peripheral Role)
            and Central Role & Peripheral Role
          High Duty Cycle Directed Advertising State
            and Connection State (Peripheral Role)
            and Peripheral Role & Peripheral Role
          Low Duty Cycle Directed Advertising State
            and Connection State (Peripheral Role)
            and Peripheral Role & Peripheral Role
          Initiating State
            and Connection State (Peripheral Role)
            and Central Role & Peripheral Role
< HCI Command: LE Read Maximum Data.. (0x08|0x002f) plen 0  #23 [hci1] 0.818021
> HCI Event: Command Complete (0x0e) plen 12                #24 [hci1] 0.818545
      LE Read Maximum Data Length (0x08|0x002f) ncmd 1
        Status: Success (0x00)
        Max TX octets: 251
        Max TX time: 2704
        Max RX octets: 251
        Max RX time: 2704
< HCI Command: LE Write Suggested D.. (0x08|0x0024) plen 4  #25 [hci1] 0.838027
        TX octets: 251
        TX time: 2704
> HCI Event: Command Complete (0x0e) plen 4                 #26 [hci1] 0.838597
      LE Write Suggested Default Data Length (0x08|0x0024) ncmd 1
        Status: Success (0x00)
< HCI Command: LE Read Resolving Li.. (0x08|0x002a) plen 0  #27 [hci1] 0.857995
> HCI Event: Command Complete (0x0e) plen 5                 #28 [hci1] 0.858511
      LE Read Resolving List Size (0x08|0x002a) ncmd 1
        Status: Success (0x00)
        Size: 8
< HCI Command: LE Set Event Mask (0x08|0x0001) plen 8       #29 [hci1] 0.878071
        Mask: 0x000002023f87fa5e
          LE Advertising Report
          LE Connection Update Complete
          LE Read Remote Used Features Complete
          LE Long Term Key Request
          LE Data Length Change
          LE Enhanced Connection Complete
          LE PHY Update Complete
          LE Extended Advertising Report
          LE Periodic Advertising Sync Established
          LE Periodic Advertising Report
          LE Periodic Advertising Sync Lost
          LE Extended Scan Timeout
          LE Extended Advertising Set Terminated
          LE Scan Request Received
          LE Periodic Advertising Sync Transfer Rvc
          LE CIS Established
          LE CIS Request
          LE Create BIG Complete
          LE Terminate BIG Complete
          LE BIG Sync Estabilished Complete
          LE BIG Sync Lost
          LE BIG Info Advertising Report
          Unknown mask (0x0000020000000000)
> HCI Event: Command Complete (0x0e) plen 4                 #30 [hci1] 0.878790
      LE Set Event Mask (0x08|0x0001) ncmd 1
        Status: Success (0x00)
< HCI Command: Set Event Mask (0x03|0x0001) plen 8          #31 [hci1] 0.898008
        Mask: 0x2000800002008890
          Disconnection Complete
          Encryption Change
          Read Remote Version Information Complete
          Hardware Error
          Data Buffer Overflow
          Encryption Key Refresh Complete
          LE Meta
> HCI Event: Command Complete (0x0e) plen 4                 #32 [hci1] 0.898628
      Set Event Mask (0x03|0x0001) ncmd 1
        Status: Success (0x00)
< HCI Command: Read BD ADDR (0x04|0x0009) plen 0            #33 [hci1] 0.917968
> HCI Event: Command Complete (0x0e) plen 10                #34 [hci1] 0.918393
      Read BD ADDR (0x04|0x0009) ncmd 1
        Status: Success (0x00)
        Address: 00:00:00:00:00:00 (OUI 00-00-00)
< HCI Command: LE Set Random Address (0x08|0x0005) plen 6   #35 [hci1] 0.938024
        Address: D5:B6:CC:31:DB:3B (Static)
> HCI Event: Command Complete (0x0e) plen 4                 #36 [hci1] 0.938533
      LE Set Random Address (0x08|0x0005) ncmd 1
        Status: Success (0x00)
< HCI Command: LE Set Extended Adv.. (0x08|0x0036) plen 25  #37 [hci1] 3.378254
        Handle: 0x00
        Properties: 0x0013
          Connectable
          Scannable
          Use legacy advertising PDUs: ADV_IND
        Min advertising interval: 100.000 msec (0x00a0)
        Max advertising interval: 150.000 msec (0x00f0)
        Channel map: 37, 38, 39 (0x07)
        Own address type: Random (0x01)
        Peer address type: Public (0x00)
        Peer address: 00:00:00:00:00:00 (OUI 00-00-00)
        Filter policy: Allow Scan Request from Any, Allow Connect Request from Any (0x00)
        TX power: Host has no preference (0x7f)
        Primary PHY: LE 1M (0x01)
        Secondary max skip: 0x00
        Secondary PHY: LE 1M (0x01)
        SID: 0x00
        Scan request notifications: Disabled (0x00)
> HCI Event: Command Complete (0x0e) plen 5                 #38 [hci1] 3.379051
      LE Set Extended Advertising Parameters (0x08|0x0036) ncmd 1
        Status: Success (0x00)
        TX power (selected): 0 dbm (0x00)
< HCI Command: LE Set Advertising S.. (0x08|0x0035) plen 7  #39 [hci1] 3.398209
        Advertising handle: 0x00
        Advertising random address: D5:B6:CC:31:DB:3B (Static)
> HCI Event: Command Complete (0x0e) plen 4                 #40 [hci1] 3.398783
      LE Set Advertising Set Random Address (0x08|0x0035) ncmd 1
        Status: Success (0x00)
< HCI Command: LE Set Extended Adv.. (0x08|0x0037) plen 22  #41 [hci1] 3.418036
        Handle: 0x00
        Operation: Complete extended advertising data (0x03)
        Fragment preference: Minimize fragmentation (0x01)
        Data length: 0x12
        Flags: 0x06
          LE General Discoverable Mode
          BR/EDR Not Supported
        Name (complete): Tester_F6B11A
> HCI Event: Command Complete (0x0e) plen 4                 #42 [hci1] 3.418781
      LE Set Extended Advertising Data (0x08|0x0037) ncmd 1
        Status: Success (0x00)
< HCI Command: LE Set Extended Scan.. (0x08|0x0038) plen 4  #43 [hci1] 3.438024
        Handle: 0x00
        Operation: Complete scan response data (0x03)
        Fragment preference: Minimize fragmentation (0x01)
        Data length: 0x00
> HCI Event: Command Complete (0x0e) plen 4                 #44 [hci1] 3.438462
      LE Set Extended Scan Response Data (0x08|0x0038) ncmd 1
        Status: Success (0x00)
< HCI Command: LE Set Extended Adve.. (0x08|0x0039) plen 6  #45 [hci1] 3.458043
        Extended advertising: Enabled (0x01)
        Number of sets: 1 (0x01)
        Entry 0
          Handle: 0x00
          Duration: 0 ms (0x00)
          Max ext adv events: 0
> HCI Event: Command Complete (0x0e) plen 4                 #46 [hci1] 3.458590
      LE Set Extended Advertising Enable (0x08|0x0039) ncmd 1
        Status: Success (0x00)
> HCI Event: LE Meta Event (0x3e) plen 31                   #47 [hci1] 3.572495
      LE Enhanced Connection Complete (0x0a)
        Status: Success (0x00)
        Handle: 1047
        Role: Peripheral (0x01)
        Peer address type: Public (0x00)
        Peer address: DF:A9:FF:F6:B1:1A (OUI DF-A9-FF)
        Local resolvable private address: 00:00:00:00:00:00 (Non-Resolvable)
        Peer resolvable private address: 00:00:00:00:00:00 (Non-Resolvable)
        Connection interval: 87.50 msec (0x0046)
        Connection latency: 0 (0x0000)
        Supervision timeout: 25120 msec (0x09d0)
        Central clock accuracy: 0x01
> HCI Event: LE Meta Event (0x3e) plen 6                    #48 [hci1] 3.572708
      LE Advertising Set Terminated (0x12)
        Status: Success (0x00)
        Handle: 0
        Connection handle: 1047
        Number of completed extended advertising events: 0
< HCI Command: LE Read Remote Used... (0x08|0x0016) plen 2  #49 [hci1] 3.578613
        Handle: 1047 Address: DF:A9:FF:F6:B1:1A (OUI DF-A9-FF)
< ACL Data TX: Handle 1047 flags 0x00 dlen 7                #50 [hci1] 3.578627
      ATT: Exchange MTU Request (0x02) len 2
        Client RX MTU: 251
> HCI Event: Command Status (0x0f) plen 4                   #51 [hci1] 3.579149
      LE Read Remote Used Features (0x08|0x0016) ncmd 1
        Status: Success (0x00)
> HCI Event: Number of Completed Packets (0x13) plen 5      #52 [hci1] 3.748516
        Num handles: 1
        Handle: 1047 Address: DF:A9:FF:F6:B1:1A (OUI DF-A9-FF)
        Count: 1
        #50: len 7 (0 Kb/s)
        Latency: 169 msec (169-169 msec ~169 msec)
> HCI Event: LE Meta Event (0x3e) plen 12                   #53 [hci1] 3.836520
      LE Read Remote Used Features (0x04)
        Status: Success (0x00)
        Handle: 1047 Address: DF:A9:FF:F6:B1:1A (OUI DF-A9-FF)
        Features: 0x2d 0x49 0x00 0xf7 0x67 0xd8 0x00 0x00
          LE Encryption
          Extended Reject Indication
          Peripheral-initiated Features Exchange
          LE Data Packet Length Extension
          LE 2M PHY
          LE Coded PHY
          Channel Selection Algorithm #2
          Periodic Advertising Sync Transfer - Sender
          Periodic Advertising Sync Transfer - Recipient
          Sleep Clock Accuracy Updates
          Connected Isochronous Stream - Central
          Connected Isochronous Stream - Peripheral
          Isochronous Broadcaster
          Synchronized Receiver
          Connected Isochronous Stream (Host Support)
          LE Power Control Request
          LE Power Control Request
          Connection Subrating
          Connection Subrating (Host Support)
          Unknown features (0x0000d80000000000)
> ACL Data RX: Handle 1047 flags 0x02 dlen 11               #54 [hci1] 6.286100
      SMP: Pairing Request (0x01) len 6
        IO capability: KeyboardDisplay (0x04)
        OOB data: Authentication data not present (0x00)
        Authentication requirement: Bonding, MITM, SC, No Keypresses (0x0d)
        Max encryption key size: 16
        Initiator key distribution: EncKey IdKey (0x03)
        Responder key distribution: EncKey IdKey Sign (0x07)
> ACL Data RX: Handle 1047 flags 0x02 dlen 7                #55 [hci1] 6.286537
      ATT: Exchange MTU Response (0x03) len 2
        Server RX MTU: 23
< HCI Command: Host Number of Compl.. (0x03|0x0035) plen 5  #56 [hci1] 6.298667
        Num handles: 1
        Handle: 1047 Address: DF:A9:FF:F6:B1:1A (OUI DF-A9-FF)
        Count: 1
< ACL Data TX: Handle 1047 flags 0x00 dlen 11               #57 [hci1] 6.298892
      SMP: Pairing Response (0x02) len 6
        IO capability: DisplayOnly (0x00)
        OOB data: Authentication data not present (0x00)
        Authentication requirement: Bonding, No MITM, SC, No Keypresses (0x09)
        Max encryption key size: 16
        Initiator key distribution: IdKey (0x02)
        Responder key distribution: <none> (0x00)
< HCI Command: Host Number of Compl.. (0x03|0x0035) plen 5  #58 [hci1] 6.299087
        Num handles: 1
        Handle: 1047 Address: DF:A9:FF:F6:B1:1A (OUI DF-A9-FF)
        Count: 1
> HCI Event: Number of Completed Packets (0x13) plen 5      #59 [hci1] 6.461273
        Num handles: 1
        Handle: 1047 Address: DF:A9:FF:F6:B1:1A (OUI DF-A9-FF)
        Count: 1
        #57: len 11 (0 Kb/s)
        Latency: 162 msec (162-169 msec ~166 msec)
> ACL Data RX: Handle 1047 flags 0x02 dlen 27               #60 [hci1] 6.461498
> ACL Data RX: Handle 1047 flags 0x01 dlen 27               #61 [hci1] 6.462036
> ACL Data RX: Handle 1047 flags 0x01 dlen 15               #62 [hci1] 6.462498
      SMP: Pairing Public Key (0x0c) len 64
        X: eb9eaebcc36b49725e8d746721022dcd3c874582fe2b6e0e09bde9ab72135239
        Y: 8d8d6b8aca92d00c4cd167949c5500c60ef81b5ef1de1d579b515e4936716d19
< HCI Command: Host Number of Compl.. (0x03|0x0035) plen 5  #63 [hci1] 6.478417
        Num handles: 1
        Handle: 1047 Address: DF:A9:FF:F6:B1:1A (OUI DF-A9-FF)
        Count: 1
< HCI Command: Host Number of Compl.. (0x03|0x0035) plen 5  #64 [hci1] 6.478429
        Num handles: 1
        Handle: 1047 Address: DF:A9:FF:F6:B1:1A (OUI DF-A9-FF)
        Count: 1
< HCI Command: Host Number of Compl.. (0x03|0x0035) plen 5  #65 [hci1] 6.478619
        Num handles: 1
        Handle: 1047 Address: DF:A9:FF:F6:B1:1A (OUI DF-A9-FF)
        Count: 1
< ACL Data TX: Handle 1047 flags 0x00 dlen 27               #66 [hci1] 6.478711
< ACL Data TX: Handle 1047 flags 0x01 dlen 27               #67 [hci1] 6.478718
< ACL Data TX: Handle 1047 flags 0x01 dlen 15               #68 [hci1] 6.478719
      SMP: Pairing Public Key (0x0c) len 64
        X: 98308440221e2d910f0e54b71e7ec652857aa9b5a0dc65028824cc19db1226e9
        Y: 67a4816bcb62efb21701e31fdb27561a6217575fb007a8bbdabe7e28b6f68482
> HCI Event: Number of Completed Packets (0x13) plen 5      #69 [hci1] 6.549211
        Num handles: 1
        Handle: 1047 Address: DF:A9:FF:F6:B1:1A (OUI DF-A9-FF)
        Count: 1
        #66: len 27 (3 Kb/s)
        Latency: 70 msec (70-169 msec ~118 msec)
> HCI Event: Number of Completed Packets (0x13) plen 5      #70 [hci1] 6.549699
        Num handles: 1
        Handle: 1047 Address: DF:A9:FF:F6:B1:1A (OUI DF-A9-FF)
        Count: 1
        #67: len 27 (3 Kb/s)
        Latency: 70 msec (70-169 msec ~94 msec)
> HCI Event: Number of Completed Packets (0x13) plen 5      #71 [hci1] 6.636010
        Num handles: 1
        Handle: 1047 Address: DF:A9:FF:F6:B1:1A (OUI DF-A9-FF)
        Count: 1
        #68: len 15 (0 Kb/s)
        Latency: 157 msec (70-169 msec ~125 msec)
> ACL Data RX: Handle 1047 flags 0x02 dlen 21               #72 [hci1] 7.598810
      SMP: Pairing Confirm (0x03) len 16
        Confim value: fed7c0df2d6fcc33a39b0048a9b50061
< HCI Command: Host Number of Compl.. (0x03|0x0035) plen 5  #73 [hci1] 7.618393
        Num handles: 1
        Handle: 1047 Address: DF:A9:FF:F6:B1:1A (OUI DF-A9-FF)
        Count: 1
< ACL Data TX: Handle 1047 flags 0x00 dlen 21               #74 [hci1] 7.618534
      SMP: Pairing Confirm (0x03) len 16
        Confim value: 94c11d1929b9a1fe3401a82dfbc51fb3
> HCI Event: Number of Completed Packets (0x13) plen 5      #75 [hci1] 7.773569
        Num handles: 1
        Handle: 1047 Address: DF:A9:FF:F6:B1:1A (OUI DF-A9-FF)
        Count: 1
        #74: len 21 (1 Kb/s)
        Latency: 155 msec (70-169 msec ~140 msec)
> ACL Data RX: Handle 1047 flags 0x02 dlen 21               #76 [hci1] 7.773911
      SMP: Pairing Random (0x04) len 16
        Random value: 78d1986b55b766c50000000000000000
< HCI Command: Host Number of Compl.. (0x03|0x0035) plen 5  #77 [hci1] 7.778818
        Num handles: 1
        Handle: 1047 Address: DF:A9:FF:F6:B1:1A (OUI DF-A9-FF)
        Count: 1
< ACL Data TX: Handle 1047 flags 0x00 dlen 21               #78 [hci1] 7.778911
      SMP: Pairing Random (0x04) len 16
        Random value: 8e6108f966a694cbe26df70bb96773e6
> HCI Event: Number of Completed Packets (0x13) plen 5      #79 [hci1] 7.948398
        Num handles: 1
        Handle: 1047 Address: DF:A9:FF:F6:B1:1A (OUI DF-A9-FF)
        Count: 1
        #78: len 21 (0 Kb/s)
        Latency: 169 msec (70-169 msec ~154 msec)
> ACL Data RX: Handle 1047 flags 0x02 dlen 21               #80 [hci1] 8.036253
      SMP: Pairing Confirm (0x03) len 16
        Confim value: cdec43adca358dece41be28ca1811131
< HCI Command: Host Number of Compl.. (0x03|0x0035) plen 5  #81 [hci1] 8.038624
        Num handles: 1
        Handle: 1047 Address: DF:A9:FF:F6:B1:1A (OUI DF-A9-FF)
        Count: 1
< ACL Data TX: Handle 1047 flags 0x00 dlen 21               #82 [hci1] 8.038872
      SMP: Pairing Confirm (0x03) len 16
        Confim value: 3457ec0f51fcec266ce174fa9ca7b6a9
> HCI Event: Number of Completed Packets (0x13) plen 5      #83 [hci1] 8.211036
        Num handles: 1
        Handle: 1047 Address: DF:A9:FF:F6:B1:1A (OUI DF-A9-FF)
        Count: 1
        #82: len 21 (0 Kb/s)
        Latency: 172 msec (70-172 msec ~163 msec)
> ACL Data RX: Handle 1047 flags 0x02 dlen 21               #84 [hci1] 8.211356
      SMP: Pairing Random (0x04) len 16
        Random value: 4c721aeaa84fae770000000000000000
< HCI Command: Host Number of Compl.. (0x03|0x0035) plen 5  #85 [hci1] 8.218246
        Num handles: 1
        Handle: 1047 Address: DF:A9:FF:F6:B1:1A (OUI DF-A9-FF)
        Count: 1
< ACL Data TX: Handle 1047 flags 0x00 dlen 21               #86 [hci1] 8.218282
      SMP: Pairing Random (0x04) len 16
        Random value: 4d02679f89a05211af56d8b3da64d21e
> HCI Event: Number of Completed Packets (0x13) plen 5      #87 [hci1] 8.385933
        Num handles: 1
        Handle: 1047 Address: DF:A9:FF:F6:B1:1A (OUI DF-A9-FF)
        Count: 1
        #86: len 21 (1 Kb/s)
        Latency: 167 msec (70-172 msec ~165 msec)
> ACL Data RX: Handle 1047 flags 0x02 dlen 21               #88 [hci1] 8.473845
      SMP: Pairing Confirm (0x03) len 16
        Confim value: da6deb6ca498a8565ebe0851a53bff6e
< HCI Command: Host Number of Compl.. (0x03|0x0035) plen 5  #89 [hci1] 8.478500
        Num handles: 1
        Handle: 1047 Address: DF:A9:FF:F6:B1:1A (OUI DF-A9-FF)
        Count: 1
< ACL Data TX: Handle 1047 flags 0x00 dlen 21               #90 [hci1] 8.478684
      SMP: Pairing Confirm (0x03) len 16
        Confim value: 798d790aa3df5d4d3959f45e0cc7a04d
> HCI Event: Number of Completed Packets (0x13) plen 5      #91 [hci1] 8.648563
        Num handles: 1
        Handle: 1047 Address: DF:A9:FF:F6:B1:1A (OUI DF-A9-FF)
        Count: 1
        #90: len 21 (0 Kb/s)
        Latency: 169 msec (70-172 msec ~167 msec)
> ACL Data RX: Handle 1047 flags 0x02 dlen 21               #92 [hci1] 8.648904
      SMP: Pairing Random (0x04) len 16
        Random value: f5ac2ea54b36d8ca0000000000000000
< HCI Command: Host Number of Compl.. (0x03|0x0035) plen 5  #93 [hci1] 8.658458
        Num handles: 1
        Handle: 1047 Address: DF:A9:FF:F6:B1:1A (OUI DF-A9-FF)
        Count: 1
< ACL Data TX: Handle 1047 flags 0x00 dlen 21               #94 [hci1] 8.658635
      SMP: Pairing Random (0x04) len 16
        Random value: 5e8286bc235a02440d0c3424a2acf8fd
> HCI Event: Number of Completed Packets (0x13) plen 5      #95 [hci1] 8.823339
        Num handles: 1
        Handle: 1047 Address: DF:A9:FF:F6:B1:1A (OUI DF-A9-FF)
        Count: 1
        #94: len 21 (1 Kb/s)
        Latency: 164 msec (70-172 msec ~166 msec)
> ACL Data RX: Handle 1047 flags 0x02 dlen 21               #96 [hci1] 8.911189
      SMP: Pairing Confirm (0x03) len 16
        Confim value: 7548fad49cc2c7005998ee3991348d20
< HCI Command: Host Number of Compl.. (0x03|0x0035) plen 5  #97 [hci1] 8.918760
        Num handles: 1
        Handle: 1047 Address: DF:A9:FF:F6:B1:1A (OUI DF-A9-FF)
        Count: 1
< ACL Data TX: Handle 1047 flags 0x00 dlen 21               #98 [hci1] 8.918971
      SMP: Pairing Confirm (0x03) len 16
        Confim value: 0fa2f1f24eb910040c6a48e8db4c165c
> HCI Event: Number of Completed Packets (0x13) plen 5      #99 [hci1] 9.086064
        Num handles: 1
        Handle: 1047 Address: DF:A9:FF:F6:B1:1A (OUI DF-A9-FF)
        Count: 1
        #98: len 21 (1 Kb/s)
        Latency: 167 msec (70-172 msec ~166 msec)
> ACL Data RX: Handle 1047 flags 0x02 dlen 21              #100 [hci1] 9.086415
      SMP: Pairing Random (0x04) len 16
        Random value: bb7ad6a9624c4f990000000000000000
< HCI Command: Host Number of Comp.. (0x03|0x0035) plen 5  #101 [hci1] 9.098800
        Num handles: 1
        Handle: 1047 Address: DF:A9:FF:F6:B1:1A (OUI DF-A9-FF)
        Count: 1
< ACL Data TX: Handle 1047 flags 0x00 dlen 21              #102 [hci1] 9.098902
      SMP: Pairing Random (0x04) len 16
        Random value: 5c4a1bcadd27bd58e945097b00bad7ac
> HCI Event: Number of Completed Packets (0x13) plen 5     #103 [hci1] 9.260890
        Num handles: 1
        Handle: 1047 Address: DF:A9:FF:F6:B1:1A (OUI DF-A9-FF)
        Count: 1
        #102: len 21 (1 Kb/s)
        Latency: 161 msec (70-172 msec ~164 msec)
> ACL Data RX: Handle 1047 flags 0x02 dlen 21              #104 [hci1] 9.348700
      SMP: Pairing Confirm (0x03) len 16
        Confim value: 286dfd315cef126688df52dafa3a98d7
< HCI Command: Host Number of Comp.. (0x03|0x0035) plen 5  #105 [hci1] 9.358315
        Num handles: 1
        Handle: 1047 Address: DF:A9:FF:F6:B1:1A (OUI DF-A9-FF)
        Count: 1
< ACL Data TX: Handle 1047 flags 0x00 dlen 21              #106 [hci1] 9.358350
      SMP: Pairing Confirm (0x03) len 16
        Confim value: 2a6ce3af7214235eff6be17275157452
> HCI Event: Number of Completed Packets (0x13) plen 5     #107 [hci1] 9.523600
        Num handles: 1
        Handle: 1047 Address: DF:A9:FF:F6:B1:1A (OUI DF-A9-FF)
        Count: 1
        #106: len 21 (1 Kb/s)
        Latency: 165 msec (70-172 msec ~164 msec)
> ACL Data RX: Handle 1047 flags 0x02 dlen 21              #108 [hci1] 9.523883
      SMP: Pairing Random (0x04) len 16
        Random value: 1cd6b6087ca9e5ee0000000000000000
< HCI Command: Host Number of Comp.. (0x03|0x0035) plen 5  #109 [hci1] 9.538787
        Num handles: 1
        Handle: 1047 Address: DF:A9:FF:F6:B1:1A (OUI DF-A9-FF)
        Count: 1
< ACL Data TX: Handle 1047 flags 0x00 dlen 21              #110 [hci1] 9.538841
      SMP: Pairing Random (0x04) len 16
        Random value: 32527e6e64e79f33b2e374394db8ab2d
> HCI Event: Number of Completed Packets (0x13) plen 5     #111 [hci1] 9.698301
        Num handles: 1
        Handle: 1047 Address: DF:A9:FF:F6:B1:1A (OUI DF-A9-FF)
        Count: 1
        #110: len 21 (1 Kb/s)
        Latency: 159 msec (70-172 msec ~162 msec)
> ACL Data RX: Handle 1047 flags 0x02 dlen 21              #112 [hci1] 9.786214
      SMP: Pairing Confirm (0x03) len 16
        Confim value: 20de09473d83d41a34ee2a3164aa3cb7
< HCI Command: Host Number of Comp.. (0x03|0x0035) plen 5  #113 [hci1] 9.798527
        Num handles: 1
        Handle: 1047 Address: DF:A9:FF:F6:B1:1A (OUI DF-A9-FF)
        Count: 1
< ACL Data TX: Handle 1047 flags 0x00 dlen 21              #114 [hci1] 9.798699
      SMP: Pairing Confirm (0x03) len 16
        Confim value: b8e969027769080c35322ac66ec49b2e
> HCI Event: Number of Completed Packets (0x13) plen 5     #115 [hci1] 9.961047
        Num handles: 1
        Handle: 1047 Address: DF:A9:FF:F6:B1:1A (OUI DF-A9-FF)
        Count: 1
        #114: len 21 (1 Kb/s)
        Latency: 162 msec (70-172 msec ~162 msec)
> ACL Data RX: Handle 1047 flags 0x02 dlen 21              #116 [hci1] 9.961415
      SMP: Pairing Random (0x04) len 16
        Random value: b5f78b28900b2cff0000000000000000
< HCI Command: Host Number of Comp.. (0x03|0x0035) plen 5  #117 [hci1] 9.978827
        Num handles: 1
        Handle: 1047 Address: DF:A9:FF:F6:B1:1A (OUI DF-A9-FF)
        Count: 1
< ACL Data TX: Handle 1047 flags 0x00 dlen 21              #118 [hci1] 9.978847
      SMP: Pairing Random (0x04) len 16
        Random value: dddbdfe2838e9a8cc6964353c850fef7
> HCI Event: Number of Completed Packets (0x13) plen 5    #119 [hci1] 10.135989
        Num handles: 1
        Handle: 1047 Address: DF:A9:FF:F6:B1:1A (OUI DF-A9-FF)
        Count: 1
        #118: len 21 (1 Kb/s)
        Latency: 157 msec (70-172 msec ~159 msec)
> ACL Data RX: Handle 1047 flags 0x02 dlen 21             #120 [hci1] 10.223700
      SMP: Pairing Confirm (0x03) len 16
        Confim value: 3802b973f544c2dfe2f5789f5bc4a840
< HCI Command: Host Number of Com.. (0x03|0x0035) plen 5  #121 [hci1] 10.238395
        Num handles: 1
        Handle: 1047 Address: DF:A9:FF:F6:B1:1A (OUI DF-A9-FF)
        Count: 1
< ACL Data TX: Handle 1047 flags 0x00 dlen 21             #122 [hci1] 10.238405
      SMP: Pairing Confirm (0x03) len 16
        Confim value: 10c534671066be96ec53e7c56802c8f6
> HCI Event: Number of Completed Packets (0x13) plen 5    #123 [hci1] 10.398545
        Num handles: 1
        Handle: 1047 Address: DF:A9:FF:F6:B1:1A (OUI DF-A9-FF)
        Count: 1
        #122: len 21 (1 Kb/s)
        Latency: 160 msec (70-172 msec ~159 msec)
> ACL Data RX: Handle 1047 flags 0x02 dlen 21             #124 [hci1] 10.398832
      SMP: Pairing Random (0x04) len 16
        Random value: c35048d40cc9f0ef0000000000000000
< HCI Command: Host Number of Com.. (0x03|0x0035) plen 5  #125 [hci1] 10.418398
        Num handles: 1
        Handle: 1047 Address: DF:A9:FF:F6:B1:1A (OUI DF-A9-FF)
        Count: 1
< ACL Data TX: Handle 1047 flags 0x00 dlen 21             #126 [hci1] 10.418484
      SMP: Pairing Random (0x04) len 16
        Random value: eb9f1915536596b6fc3db1c86b2b1970
> HCI Event: Number of Completed Packets (0x13) plen 5    #127 [hci1] 10.573335
        Num handles: 1
        Handle: 1047 Address: DF:A9:FF:F6:B1:1A (OUI DF-A9-FF)
        Count: 1
        #126: len 21 (1 Kb/s)
        Latency: 154 msec (70-172 msec ~157 msec)
> ACL Data RX: Handle 1047 flags 0x02 dlen 21             #128 [hci1] 10.661211
      SMP: Pairing Confirm (0x03) len 16
        Confim value: a928c6faeda22683debefb34ca317a4b
< HCI Command: Host Number of Com.. (0x03|0x0035) plen 5  #129 [hci1] 10.678344
        Num handles: 1
        Handle: 1047 Address: DF:A9:FF:F6:B1:1A (OUI DF-A9-FF)
        Count: 1
< ACL Data TX: Handle 1047 flags 0x00 dlen 21             #130 [hci1] 10.678453
      SMP: Pairing Confirm (0x03) len 16
        Confim value: b65c2977d25585f36e7f707174b66cff
> HCI Event: Number of Completed Packets (0x13) plen 5    #131 [hci1] 10.836107
        Num handles: 1
        Handle: 1047 Address: DF:A9:FF:F6:B1:1A (OUI DF-A9-FF)
        Count: 1
        #130: len 21 (1 Kb/s)
        Latency: 157 msec (70-172 msec ~157 msec)
> ACL Data RX: Handle 1047 flags 0x02 dlen 21             #132 [hci1] 10.836292
      SMP: Pairing Random (0x04) len 16
        Random value: 749bb91bb384b0320000000000000000
< HCI Command: Host Number of Com.. (0x03|0x0035) plen 5  #133 [hci1] 10.838383
        Num handles: 1
        Handle: 1047 Address: DF:A9:FF:F6:B1:1A (OUI DF-A9-FF)
        Count: 1
< ACL Data TX: Handle 1047 flags 0x00 dlen 21             #134 [hci1] 10.838420
      SMP: Pairing Random (0x04) len 16
        Random value: 5c794dc9ad9f2c3f295ebd5ad5e1c3cf
> HCI Event: Number of Completed Packets (0x13) plen 5    #135 [hci1] 11.010839
        Num handles: 1
        Handle: 1047 Address: DF:A9:FF:F6:B1:1A (OUI DF-A9-FF)
        Count: 1
        #134: len 21 (0 Kb/s)
        Latency: 172 msec (70-172 msec ~164 msec)
> ACL Data RX: Handle 1047 flags 0x02 dlen 21             #136 [hci1] 11.098622
      SMP: Pairing Confirm (0x03) len 16
        Confim value: ce8ed48aba843b79ee40f29d957cf7ca
< HCI Command: Host Number of Com.. (0x03|0x0035) plen 5  #137 [hci1] 11.118566
        Num handles: 1
        Handle: 1047 Address: DF:A9:FF:F6:B1:1A (OUI DF-A9-FF)
        Count: 1
< ACL Data TX: Handle 1047 flags 0x00 dlen 21             #138 [hci1] 11.118770
      SMP: Pairing Confirm (0x03) len 16
        Confim value: 0401ac6dfa0018766debcb99605fc375
> HCI Event: Number of Completed Packets (0x13) plen 5    #139 [hci1] 11.273557
        Num handles: 1
        Handle: 1047 Address: DF:A9:FF:F6:B1:1A (OUI DF-A9-FF)
        Count: 1
        #138: len 21 (1 Kb/s)
        Latency: 154 msec (70-172 msec ~159 msec)
> ACL Data RX: Handle 1047 flags 0x02 dlen 21             #140 [hci1] 11.273926
      SMP: Pairing Random (0x04) len 16
        Random value: c070be90a6a56e840000000000000000
< HCI Command: Host Number of Com.. (0x03|0x0035) plen 5  #141 [hci1] 11.278522
        Num handles: 1
        Handle: 1047 Address: DF:A9:FF:F6:B1:1A (OUI DF-A9-FF)
        Count: 1
< ACL Data TX: Handle 1047 flags 0x00 dlen 21             #142 [hci1] 11.278592
      SMP: Pairing Random (0x04) len 16
        Random value: 5c2fff312cdf99c9491988e877355a9a
> HCI Event: Number of Completed Packets (0x13) plen 5    #143 [hci1] 11.448360
        Num handles: 1
        Handle: 1047 Address: DF:A9:FF:F6:B1:1A (OUI DF-A9-FF)
        Count: 1
        #142: len 21 (0 Kb/s)
        Latency: 169 msec (70-172 msec ~164 msec)
> ACL Data RX: Handle 1047 flags 0x02 dlen 21             #144 [hci1] 11.536161
      SMP: Pairing Confirm (0x03) len 16
        Confim value: 81c3cbf4771b24e40f12e52c577493a5
< HCI Command: Host Number of Com.. (0x03|0x0035) plen 5  #145 [hci1] 11.538592
        Num handles: 1
        Handle: 1047 Address: DF:A9:FF:F6:B1:1A (OUI DF-A9-FF)
        Count: 1
< ACL Data TX: Handle 1047 flags 0x00 dlen 21             #146 [hci1] 11.538774
      SMP: Pairing Confirm (0x03) len 16
        Confim value: f0a700920f8263849c8fe0f43cbaa968
> HCI Event: Number of Completed Packets (0x13) plen 5    #147 [hci1] 11.711029
        Num handles: 1
        Handle: 1047 Address: DF:A9:FF:F6:B1:1A (OUI DF-A9-FF)
        Count: 1
        #146: len 21 (0 Kb/s)
        Latency: 172 msec (70-172 msec ~168 msec)
> ACL Data RX: Handle 1047 flags 0x02 dlen 21             #148 [hci1] 11.711277
      SMP: Pairing Random (0x04) len 16
        Random value: 74000207a13d86d40000000000000000
< HCI Command: Host Number of Com.. (0x03|0x0035) plen 5  #149 [hci1] 11.718379
        Num handles: 1
        Handle: 1047 Address: DF:A9:FF:F6:B1:1A (OUI DF-A9-FF)
        Count: 1
< ACL Data TX: Handle 1047 flags 0x00 dlen 21             #150 [hci1] 11.718462
      SMP: Pairing Random (0x04) len 16
        Random value: c629a3a987d808e808655d558dfc1155
> HCI Event: Number of Completed Packets (0x13) plen 5    #151 [hci1] 11.885696
        Num handles: 1
        Handle: 1047 Address: DF:A9:FF:F6:B1:1A (OUI DF-A9-FF)
        Count: 1
        #150: len 21 (1 Kb/s)
        Latency: 167 msec (70-172 msec ~167 msec)
> ACL Data RX: Handle 1047 flags 0x02 dlen 21             #152 [hci1] 11.973639
      SMP: Pairing Confirm (0x03) len 16
        Confim value: a735af2f19745971f126d1c930c24738
< HCI Command: Host Number of Com.. (0x03|0x0035) plen 5  #153 [hci1] 11.978333
        Num handles: 1
        Handle: 1047 Address: DF:A9:FF:F6:B1:1A (OUI DF-A9-FF)
        Count: 1
< ACL Data TX: Handle 1047 flags 0x00 dlen 21             #154 [hci1] 11.978364
      SMP: Pairing Confirm (0x03) len 16
        Confim value: 17e5cc9b07a6d2b15004914b6fa68da9
> HCI Event: Number of Completed Packets (0x13) plen 5    #155 [hci1] 12.148541
        Num handles: 1
        Handle: 1047 Address: DF:A9:FF:F6:B1:1A (OUI DF-A9-FF)
        Count: 1
        #154: len 21 (0 Kb/s)
        Latency: 170 msec (70-172 msec ~169 msec)
> ACL Data RX: Handle 1047 flags 0x02 dlen 21             #156 [hci1] 12.148832
      SMP: Pairing Random (0x04) len 16
        Random value: 8e31d37eac6abad70000000000000000
< HCI Command: Host Number of Com.. (0x03|0x0035) plen 5  #157 [hci1] 12.158809
        Num handles: 1
        Handle: 1047 Address: DF:A9:FF:F6:B1:1A (OUI DF-A9-FF)
        Count: 1
< ACL Data TX: Handle 1047 flags 0x00 dlen 21             #158 [hci1] 12.158880
      SMP: Pairing Random (0x04) len 16
        Random value: 92f20f6ad8f13724432c7fd6001c45ff
> HCI Event: Number of Completed Packets (0x13) plen 5    #159 [hci1] 12.323203
        Num handles: 1
        Handle: 1047 Address: DF:A9:FF:F6:B1:1A (OUI DF-A9-FF)
        Count: 1
        #158: len 21 (1 Kb/s)
        Latency: 164 msec (70-172 msec ~166 msec)
> ACL Data RX: Handle 1047 flags 0x02 dlen 21             #160 [hci1] 12.411062
      SMP: Pairing Confirm (0x03) len 16
        Confim value: 4d3759daaf1f5c1aaeb8aad72bee06ab
< HCI Command: Host Number of Com.. (0x03|0x0035) plen 5  #161 [hci1] 12.418269
        Num handles: 1
        Handle: 1047 Address: DF:A9:FF:F6:B1:1A (OUI DF-A9-FF)
        Count: 1
< ACL Data TX: Handle 1047 flags 0x00 dlen 21             #162 [hci1] 12.418344
      SMP: Pairing Confirm (0x03) len 16
        Confim value: 05ebb6a7d3e5e33503cfe0c3fe3aa74c
> HCI Event: Number of Completed Packets (0x13) plen 5    #163 [hci1] 12.586005
        Num handles: 1
        Handle: 1047 Address: DF:A9:FF:F6:B1:1A (OUI DF-A9-FF)
        Count: 1
        #162: len 21 (1 Kb/s)
        Latency: 167 msec (70-172 msec ~167 msec)
> ACL Data RX: Handle 1047 flags 0x02 dlen 21             #164 [hci1] 12.586273
      SMP: Pairing Random (0x04) len 16
        Random value: 139da818684bac150000000000000000
< HCI Command: Host Number of Com.. (0x03|0x0035) plen 5  #165 [hci1] 12.598873
        Num handles: 1
        Handle: 1047 Address: DF:A9:FF:F6:B1:1A (OUI DF-A9-FF)
        Count: 1
< ACL Data TX: Handle 1047 flags 0x00 dlen 21             #166 [hci1] 12.598986
      SMP: Pairing Random (0x04) len 16
        Random value: 23ac32ebbb5e14c8a6b9622f296d277f
> HCI Event: Number of Completed Packets (0x13) plen 5    #167 [hci1] 12.760652
        Num handles: 1
        Handle: 1047 Address: DF:A9:FF:F6:B1:1A (OUI DF-A9-FF)
        Count: 1
        #166: len 21 (1 Kb/s)
        Latency: 161 msec (70-172 msec ~164 msec)
> ACL Data RX: Handle 1047 flags 0x02 dlen 21             #168 [hci1] 12.848573
      SMP: Pairing Confirm (0x03) len 16
        Confim value: 3564d49876b74093a265550c287f1d6e
< HCI Command: Host Number of Com.. (0x03|0x0035) plen 5  #169 [hci1] 12.858399
        Num handles: 1
        Handle: 1047 Address: DF:A9:FF:F6:B1:1A (OUI DF-A9-FF)
        Count: 1
< ACL Data TX: Handle 1047 flags 0x00 dlen 21             #170 [hci1] 12.858570
      SMP: Pairing Confirm (0x03) len 16
        Confim value: 58bf645d4b6abaabdc86a719837130a4
> HCI Event: Number of Completed Packets (0x13) plen 5    #171 [hci1] 13.023433
        Num handles: 1
        Handle: 1047 Address: DF:A9:FF:F6:B1:1A (OUI DF-A9-FF)
        Count: 1
        #170: len 21 (1 Kb/s)
        Latency: 164 msec (70-172 msec ~164 msec)
> ACL Data RX: Handle 1047 flags 0x02 dlen 21             #172 [hci1] 13.023755
      SMP: Pairing Random (0x04) len 16
        Random value: 9e085332ec19216d0000000000000000
< HCI Command: Host Number of Com.. (0x03|0x0035) plen 5  #173 [hci1] 13.038943
        Num handles: 1
        Handle: 1047 Address: DF:A9:FF:F6:B1:1A (OUI DF-A9-FF)
        Count: 1
< ACL Data TX: Handle 1047 flags 0x00 dlen 21             #174 [hci1] 13.039042
      SMP: Pairing Random (0x04) len 16
        Random value: 297efe85e67448a15f56bd27e3a3cf1d
> HCI Event: Number of Completed Packets (0x13) plen 5    #175 [hci1] 13.198193
        Num handles: 1
        Handle: 1047 Address: DF:A9:FF:F6:B1:1A (OUI DF-A9-FF)
        Count: 1
        #174: len 21 (1 Kb/s)
        Latency: 159 msec (70-172 msec ~161 msec)
> ACL Data RX: Handle 1047 flags 0x02 dlen 21             #176 [hci1] 13.286137
      SMP: Pairing Confirm (0x03) len 16
        Confim value: 4cf4314161076761e2d718bc03328fa2
< HCI Command: Host Number of Com.. (0x03|0x0035) plen 5  #177 [hci1] 13.298552
        Num handles: 1
        Handle: 1047 Address: DF:A9:FF:F6:B1:1A (OUI DF-A9-FF)
        Count: 1
< ACL Data TX: Handle 1047 flags 0x00 dlen 21             #178 [hci1] 13.298740
      SMP: Pairing Confirm (0x03) len 16
        Confim value: 4f866aa907a38860677777c079073540
> HCI Event: Number of Completed Packets (0x13) plen 5    #179 [hci1] 13.461002
        Num handles: 1
        Handle: 1047 Address: DF:A9:FF:F6:B1:1A (OUI DF-A9-FF)
        Count: 1
        #178: len 21 (1 Kb/s)
        Latency: 162 msec (70-172 msec ~162 msec)
> ACL Data RX: Handle 1047 flags 0x02 dlen 21             #180 [hci1] 13.461155
      SMP: Pairing Random (0x04) len 16
        Random value: bafaf0f1386bf21c0000000000000000
< HCI Command: Host Number of Com.. (0x03|0x0035) plen 5  #181 [hci1] 13.478405
        Num handles: 1
        Handle: 1047 Address: DF:A9:FF:F6:B1:1A (OUI DF-A9-FF)
        Count: 1
< ACL Data TX: Handle 1047 flags 0x00 dlen 21             #182 [hci1] 13.478411
      SMP: Pairing Random (0x04) len 16
        Random value: 25a9493fd3ce4faf02be7293595bb7c6
> HCI Event: Number of Completed Packets (0x13) plen 5    #183 [hci1] 13.635711
        Num handles: 1
        Handle: 1047 Address: DF:A9:FF:F6:B1:1A (OUI DF-A9-FF)
        Count: 1
        #182: len 21 (1 Kb/s)
        Latency: 157 msec (70-172 msec ~159 msec)
> ACL Data RX: Handle 1047 flags 0x02 dlen 21             #184 [hci1] 13.723563
      SMP: Pairing Confirm (0x03) len 16
        Confim value: 115ec587886d7502fe07bc8923c5749b
< HCI Command: Host Number of Com.. (0x03|0x0035) plen 5  #185 [hci1] 13.738661
        Num handles: 1
        Handle: 1047 Address: DF:A9:FF:F6:B1:1A (OUI DF-A9-FF)
        Count: 1
< ACL Data TX: Handle 1047 flags 0x00 dlen 21             #186 [hci1] 13.738877
      SMP: Pairing Confirm (0x03) len 16
        Confim value: e8b74375780cfafaa44f82d78e273bf2
> HCI Event: Number of Completed Packets (0x13) plen 5    #187 [hci1] 13.898448
        Num handles: 1
        Handle: 1047 Address: DF:A9:FF:F6:B1:1A (OUI DF-A9-FF)
        Count: 1
        #186: len 21 (1 Kb/s)
        Latency: 159 msec (70-172 msec ~159 msec)
> ACL Data RX: Handle 1047 flags 0x02 dlen 21             #188 [hci1] 13.898764
      SMP: Pairing Random (0x04) len 16
        Random value: 3db8ea1c3a40980a0000000000000000
< HCI Command: Host Number of Com.. (0x03|0x0035) plen 5  #189 [hci1] 13.918347
        Num handles: 1
        Handle: 1047 Address: DF:A9:FF:F6:B1:1A (OUI DF-A9-FF)
        Count: 1
< ACL Data TX: Handle 1047 flags 0x00 dlen 21             #190 [hci1] 13.918381
      SMP: Pairing Random (0x04) len 16
        Random value: 58f6b41f855a6f6c3560debd84e2affc
> HCI Event: Number of Completed Packets (0x13) plen 5    #191 [hci1] 14.073224
        Num handles: 1
        Handle: 1047 Address: DF:A9:FF:F6:B1:1A (OUI DF-A9-FF)
        Count: 1
        #190: len 21 (1 Kb/s)
        Latency: 154 msec (70-172 msec ~157 msec)
> ACL Data RX: Handle 1047 flags 0x02 dlen 21             #192 [hci1] 14.161044
      SMP: Pairing Confirm (0x03) len 16
        Confim value: 645ca959265eeed6e7f17048019e3216
< HCI Command: Host Number of Com.. (0x03|0x0035) plen 5  #193 [hci1] 14.178343
        Num handles: 1
        Handle: 1047 Address: DF:A9:FF:F6:B1:1A (OUI DF-A9-FF)
        Count: 1
< ACL Data TX: Handle 1047 flags 0x00 dlen 21             #194 [hci1] 14.178473
      SMP: Pairing Confirm (0x03) len 16
        Confim value: 207408da8bec70d098eea9ed3c89b588
> HCI Event: Number of Completed Packets (0x13) plen 5    #195 [hci1] 14.335885
        Num handles: 1
        Handle: 1047 Address: DF:A9:FF:F6:B1:1A (OUI DF-A9-FF)
        Count: 1
        #194: len 21 (1 Kb/s)
        Latency: 157 msec (70-172 msec ~157 msec)
> ACL Data RX: Handle 1047 flags 0x02 dlen 21             #196 [hci1] 14.336205
      SMP: Pairing Random (0x04) len 16
        Random value: 7df6abd0da5433410000000000000000
< HCI Command: Host Number of Com.. (0x03|0x0035) plen 5  #197 [hci1] 14.338621
        Num handles: 1
        Handle: 1047 Address: DF:A9:FF:F6:B1:1A (OUI DF-A9-FF)
        Count: 1
< ACL Data TX: Handle 1047 flags 0x00 dlen 21             #198 [hci1] 14.338674
      SMP: Pairing Random (0x04) len 16
        Random value: b67e7216d5bf664139eda2b542549666
> HCI Event: Number of Completed Packets (0x13) plen 5    #199 [hci1] 14.510565
        Num handles: 1
        Handle: 1047 Address: DF:A9:FF:F6:B1:1A (OUI DF-A9-FF)
        Count: 1
        #198: len 21 (0 Kb/s)
        Latency: 171 msec (70-172 msec ~164 msec)
> ACL Data RX: Handle 1047 flags 0x02 dlen 21             #200 [hci1] 14.598518
      SMP: Pairing Confirm (0x03) len 16
        Confim value: 6408e9c4c715b9b830b1b0a1c25cd2ef
< HCI Command: Host Number of Com.. (0x03|0x0035) plen 5  #201 [hci1] 14.618533
        Num handles: 1
        Handle: 1047 Address: DF:A9:FF:F6:B1:1A (OUI DF-A9-FF)
        Count: 1
< ACL Data TX: Handle 1047 flags 0x00 dlen 21             #202 [hci1] 14.618739
      SMP: Pairing Confirm (0x03) len 16
        Confim value: 8708ffd97853546dc13830a1d6956583
> HCI Event: Number of Completed Packets (0x13) plen 5    #203 [hci1] 14.773349
        Num handles: 1
        Handle: 1047 Address: DF:A9:FF:F6:B1:1A (OUI DF-A9-FF)
        Count: 1
        #202: len 21 (1 Kb/s)
        Latency: 154 msec (70-172 msec ~159 msec)
> ACL Data RX: Handle 1047 flags 0x02 dlen 21             #204 [hci1] 14.773918
      SMP: Pairing Random (0x04) len 16
        Random value: 7efe8f991c1702e20000000000000000
< HCI Command: Host Number of Com.. (0x03|0x0035) plen 5  #205 [hci1] 14.778536
        Num handles: 1
        Handle: 1047 Address: DF:A9:FF:F6:B1:1A (OUI DF-A9-FF)
        Count: 1
< ACL Data TX: Handle 1047 flags 0x00 dlen 21             #206 [hci1] 14.778596
      SMP: Pairing Random (0x04) len 16
        Random value: ed17f76500c95219dd01e09d1e63f87b
> HCI Event: Number of Completed Packets (0x13) plen 5    #207 [hci1] 14.948171
        Num handles: 1
        Handle: 1047 Address: DF:A9:FF:F6:B1:1A (OUI DF-A9-FF)
        Count: 1
        #206: len 21 (0 Kb/s)
        Latency: 169 msec (70-172 msec ~164 msec)
> ACL Data RX: Handle 1047 flags 0x02 dlen 21             #208 [hci1] 15.036097
      SMP: Pairing Confirm (0x03) len 16
        Confim value: bd4853d7808f14e801f4444b3859c0a7
< HCI Command: Host Number of Com.. (0x03|0x0035) plen 5  #209 [hci1] 15.038660
        Num handles: 1
        Handle: 1047 Address: DF:A9:FF:F6:B1:1A (OUI DF-A9-FF)
        Count: 1
< ACL Data TX: Handle 1047 flags 0x00 dlen 21             #210 [hci1] 15.038752
      SMP: Pairing Confirm (0x03) len 16
        Confim value: 97a5beb7a7790ffd7412ebb7b0ded5ac
> HCI Event: Number of Completed Packets (0x13) plen 5    #211 [hci1] 15.210961
        Num handles: 1
        Handle: 1047 Address: DF:A9:FF:F6:B1:1A (OUI DF-A9-FF)
        Count: 1
        #210: len 21 (0 Kb/s)
        Latency: 172 msec (70-172 msec ~168 msec)
> ACL Data RX: Handle 1047 flags 0x02 dlen 21             #212 [hci1] 15.211461
      SMP: Pairing Random (0x04) len 16
        Random value: bce6b7209d2acaba0000000000000000
< HCI Command: Host Number of Com.. (0x03|0x0035) plen 5  #213 [hci1] 15.218815
        Num handles: 1
        Handle: 1047 Address: DF:A9:FF:F6:B1:1A (OUI DF-A9-FF)
        Count: 1
< ACL Data TX: Handle 1047 flags 0x00 dlen 21             #214 [hci1] 15.218927
      SMP: Pairing Random (0x04) len 16
        Random value: 81d35d47e1f6006d79c974bd9d9e1ee3
> HCI Event: Number of Completed Packets (0x13) plen 5    #215 [hci1] 15.385628
        Num handles: 1
        Handle: 1047 Address: DF:A9:FF:F6:B1:1A (OUI DF-A9-FF)
        Count: 1
        #214: len 21 (1 Kb/s)
        Latency: 166 msec (70-172 msec ~167 msec)
> ACL Data RX: Handle 1047 flags 0x02 dlen 21             #216 [hci1] 15.473522
      SMP: Pairing Confirm (0x03) len 16
        Confim value: ceb49434ee213f71804fcfda62c647bb
< HCI Command: Host Number of Com.. (0x03|0x0035) plen 5  #217 [hci1] 15.478506
        Num handles: 1
        Handle: 1047 Address: DF:A9:FF:F6:B1:1A (OUI DF-A9-FF)
        Count: 1
< ACL Data TX: Handle 1047 flags 0x00 dlen 21             #218 [hci1] 15.478683
      SMP: Pairing Confirm (0x03) len 16
        Confim value: 016734d26cdee162b953bb85c7b55b89
> HCI Event: Number of Completed Packets (0x13) plen 5    #219 [hci1] 15.648367
        Num handles: 1
        Handle: 1047 Address: DF:A9:FF:F6:B1:1A (OUI DF-A9-FF)
        Count: 1
        #218: len 21 (0 Kb/s)
        Latency: 169 msec (70-172 msec ~168 msec)
> ACL Data RX: Handle 1047 flags 0x02 dlen 21             #220 [hci1] 15.648644
      SMP: Pairing Random (0x04) len 16
        Random value: 87463008ff88f02b0000000000000000
< HCI Command: Host Number of Com.. (0x03|0x0035) plen 5  #221 [hci1] 15.658925
        Num handles: 1
        Handle: 1047 Address: DF:A9:FF:F6:B1:1A (OUI DF-A9-FF)
        Count: 1
< ACL Data TX: Handle 1047 flags 0x00 dlen 21             #222 [hci1] 15.659083
      SMP: Pairing Random (0x04) len 16
        Random value: e7f7e0c2476823e41736a7e381bafb7c
> HCI Event: Number of Completed Packets (0x13) plen 5    #223 [hci1] 15.823145
        Num handles: 1
        Handle: 1047 Address: DF:A9:FF:F6:B1:1A (OUI DF-A9-FF)
        Count: 1
        #222: len 21 (1 Kb/s)
        Latency: 164 msec (70-172 msec ~166 msec)
> ACL Data RX: Handle 1047 flags 0x02 dlen 21             #224 [hci1] 15.911008
      SMP: Pairing Confirm (0x03) len 16
        Confim value: 4b9f52ecf6670dcf311e8b67efc9c9ae
< HCI Command: Host Number of Com.. (0x03|0x0035) plen 5  #225 [hci1] 15.918693
        Num handles: 1
        Handle: 1047 Address: DF:A9:FF:F6:B1:1A (OUI DF-A9-FF)
        Count: 1
< ACL Data TX: Handle 1047 flags 0x00 dlen 21             #226 [hci1] 15.918910
      SMP: Pairing Confirm (0x03) len 16
        Confim value: 7d105ae7035c3bd49f56e87d70ddee19
> HCI Event: Number of Completed Packets (0x13) plen 5    #227 [hci1] 16.085800
        Num handles: 1
        Handle: 1047 Address: DF:A9:FF:F6:B1:1A (OUI DF-A9-FF)
        Count: 1
        #226: len 21 (1 Kb/s)
        Latency: 166 msec (70-172 msec ~166 msec)
> ACL Data RX: Handle 1047 flags 0x02 dlen 21             #228 [hci1] 16.086123
      SMP: Pairing Random (0x04) len 16
        Random value: 529c4cf943da12c30000000000000000
