Bluetooth monitor ver 5.72
= Note: Linux version 6.14.0-36-generic (x86_64)                       0.133504
= Note: Bluetooth subsystem version 2.22                               0.133506
= New Index: 00:00:00:00:00:00 (Primary,UART,hci1)              [hci1] 0.133507
= New Index: 48:5F:99:8E:E0:64 (Primary,USB,hci0)               [hci0] 0.133508
= Open Index: 00:00:00:00:00:00                                 [hci1] 0.247235
= Index Info: 00:00:00:00:00:00 (Nordic Semiconductor ASA)      [hci1] 0.247246
@ USER Open: main (privileged) version 2.22            {0x0001} [hci1] 0.247254
< HCI Command: Reset (0x03|0x0003) plen 0                    #1 [hci1] 0.248346
> HCI Event: Command Complete (0x0e) plen 4                  #2 [hci1] 0.248915
      Reset (0x03|0x0003) ncmd 1
        Status: Success (0x00)
< HCI Command: Read Local Supported... (0x04|0x0003) plen 0  #3 [hci1] 0.267057
> HCI Event: Command Complete (0x0e) plen 12                 #4 [hci1] 0.267551
      Read Local Supported Features (0x04|0x0003) ncmd 1
        Status: Success (0x00)
        Features: 0x00 0x00 0x00 0x00 0x60 0x00 0x00 0x00
          BR/EDR Not Supported
          LE Supported (Controller)
< HCI Command: Read Local Version In.. (0x04|0x0001) plen 0  #5 [hci1] 0.286916
> HCI Event: Command Complete (0x0e) plen 12                 #6 [hci1] 0.287462
      Read Local Version Information (0x04|0x0001) ncmd 1
        Status: Success (0x00)
        HCI version: Reserved (0x0f) - Revision 12393 (0x3069)
        LMP version: Reserved (0x0f) - Subversion 12393 (0x3069)
        Manufacturer: Nordic Semiconductor ASA (89)
< HCI Command: Read Local Supported... (0x04|0x0002) plen 0  #7 [hci1] 0.306732
> HCI Event: Command Complete (0x0e) plen 68                 #8 [hci1] 0.307809
      Read Local Supported Commands (0x04|0x0002) ncmd 1
        Status: Success (0x00)
        Commands: 119 entries
          Disconnect (Octet 0 - Bit 5)
          Read Remote Version Information (Octet 2 - Bit 7)
          Set Event Mask (Octet 5 - Bit 6)
          Reset (Octet 5 - Bit 7)
          Read Connection Accept Timeout (Octet 7 - Bit 2)
          Write Connection Accept Timeout (Octet 7 - Bit 3)
          Read Transmit Power Level (Octet 10 - Bit 2)
          Set Controller To Host Flow Control (Octet 10 - Bit 5)
          Host Buffer Size (Octet 10 - Bit 6)
          Host Number of Completed Packets (Octet 10 - Bit 7)
          Read Local Version Information (Octet 14 - Bit 3)
          Read Local Supported Features (Octet 14 - Bit 5)
          Read BD ADDR (Octet 15 - Bit 1)
          Read RSSI (Octet 15 - Bit 5)
          Set Event Mask Page 2 (Octet 22 - Bit 2)
          LE Set Event Mask (Octet 25 - Bit 0)
          LE Read Buffer Size (Octet 25 - Bit 1)
          LE Read Local Supported Features (Octet 25 - Bit 2)
          LE Set Random Address (Octet 25 - Bit 4)
          LE Set Advertising Parameters (Octet 25 - Bit 5)
          LE Read Advertising Channel TX Power (Octet 25 - Bit 6)
          LE Set Advertising Data (Octet 25 - Bit 7)
          LE Set Scan Response Data (Octet 26 - Bit 0)
          LE Set Advertise Enable (Octet 26 - Bit 1)
          LE Set Scan Parameters (Octet 26 - Bit 2)
          LE Set Scan Enable (Octet 26 - Bit 3)
          LE Create Connection (Octet 26 - Bit 4)
          LE Create Connection Cancel (Octet 26 - Bit 5)
          LE Read Accept List Size (Octet 26 - Bit 6)
          LE Clear Accept List (Octet 26 - Bit 7)
          LE Add Device To Accept List (Octet 27 - Bit 0)
          LE Remove Device From Accept List (Octet 27 - Bit 1)
          LE Connection Update (Octet 27 - Bit 2)
          LE Set Host Channel Classification (Octet 27 - Bit 3)
          LE Read Channel Map (Octet 27 - Bit 4)
          LE Read Remote Used Features (Octet 27 - Bit 5)
          LE Encrypt (Octet 27 - Bit 6)
          LE Rand (Octet 27 - Bit 7)
          LE Start Encryption (Octet 28 - Bit 0)
          LE Long Term Key Request Reply (Octet 28 - Bit 1)
          LE Long Term Key Request Neg Reply (Octet 28 - Bit 2)
          LE Read Supported States (Octet 28 - Bit 3)
          LE Receiver Test (Octet 28 - Bit 4)
          LE Transmitter Test (Octet 28 - Bit 5)
          LE Test End (Octet 28 - Bit 6)
          Read Authenticated Payload Timeout (Octet 32 - Bit 4)
          Write Authenticated Payload Timeout (Octet 32 - Bit 5)
          LE Set Data Length (Octet 33 - Bit 6)
          LE Read Suggested Default Data Length (Octet 33 - Bit 7)
          LE Write Suggested Default Data Length (Octet 34 - Bit 0)
          LE Add Device To Resolving List (Octet 34 - Bit 3)
          LE Remove Device From Resolving List (Octet 34 - Bit 4)
          LE Clear Resolving List (Octet 34 - Bit 5)
          LE Read Resolving List Size (Octet 34 - Bit 6)
          LE Set Address Resolution Enable (Octet 35 - Bit 1)
          LE Set Resolvable Private Address Timeout (Octet 35 - Bit 2)
          LE Read Maximum Data Length (Octet 35 - Bit 3)
          LE Read PHY (Octet 35 - Bit 4)
          LE Set Default PHY (Octet 35 - Bit 5)
          LE Set PHY (Octet 35 - Bit 6)
          LE Enhanced Receiver Test (Octet 35 - Bit 7)
          LE Enhanced Transmitter Test (Octet 36 - Bit 0)
          LE Set Advertising Set Random Address (Octet 36 - Bit 1)
          LE Set Extended Advertising Parameters (Octet 36 - Bit 2)
          LE Set Extended Advertising Data (Octet 36 - Bit 3)
          LE Set Extended Scan Response Data (Octet 36 - Bit 4)
          LE Set Extended Advertising Enable (Octet 36 - Bit 5)
          LE Read Maximum Advertising Data Length (Octet 36 - Bit 6)
          LE Read Number of Supported Advertising Sets (Octet 36 - Bit 7)
          LE Remove Advertising Set (Octet 37 - Bit 0)
          LE Clear Advertising Sets (Octet 37 - Bit 1)
          LE Set Periodic Advertising Parameters (Octet 37 - Bit 2)
          LE Set Periodic Advertising Data (Octet 37 - Bit 3)
          LE Set Periodic Advertising Enable (Octet 37 - Bit 4)
          LE Set Extended Scan Parameters (Octet 37 - Bit 5)
          LE Set Extended Scan Enable (Octet 37 - Bit 6)
          LE Extended Create Connection (Octet 37 - Bit 7)
          LE Periodic Advertising Create Sync (Octet 38 - Bit 0)
          LE Periodic Advertising Create Sync Cancel (Octet 38 - Bit 1)
          LE Periodic Advertising Terminate Sync (Octet 38 - Bit 2)
          LE Add Device To Periodic Advertiser List (Octet 38 - Bit 3)
          LE Remove Device From Periodic Advertiser List (Octet 38 - Bit 4)
          LE Clear Periodic Advertiser List (Octet 38 - Bit 5)
          LE Read Periodic Advertiser List Size (Octet 38 - Bit 6)
          LE Read Transmit Power (Octet 38 - Bit 7)
          LE Read RF Path Compensation (Octet 39 - Bit 0)
          LE Write RF Path Compensation (Octet 39 - Bit 1)
          LE Set Privacy Mode (Octet 39 - Bit 2)
          LE Periodic Advertising Receive Enable (Octet 40 - Bit 5)
          LE Periodic Advertising Sync Transfer (Octet 40 - Bit 6)
          LE Periodic Advertising Set Info Transfer (Octet 40 - Bit 7)
          LE Periodic Advertising Sync Transfer Parameters (Octet 41 - Bit 0)
          LE Set Default Periodic Advertisng Sync Transfer Parameters (Octet 41 - Bit 1)
          LE Read Buffer v2 (Octet 41 - Bit 5)
          LE Read ISO TX Sync (Octet 41 - Bit 6)
          LE Set Connected Isochronous Group Parameters (Octet 41 - Bit 7)
          LE Set Connected Isochronous Group Parameters Test (Octet 42 - Bit 0)
          LE Create Connected Isochronous Stream (Octet 42 - Bit 1)
          LE Remove Connected Isochronous Group (Octet 42 - Bit 2)
          LE Accept Connected Isochronous Stream Request (Octet 42 - Bit 3)
          LE Reject Connected Isochronous Stream Request (Octet 42 - Bit 4)
          LE Create Broadcast Isochronous Group (Octet 42 - Bit 5)
          LE Create Broadcast Isochronous Group Test (Octet 42 - Bit 6)
          LE Terminate Broadcast Isochronous Group (Octet 42 - Bit 7)
          LE Broadcast Isochronous Group Create Sync (Octet 43 - Bit 0)
          LE Broadcast Isochronous Group Terminate Sync (Octet 43 - Bit 1)
          LE Request Peer SCA (Octet 43 - Bit 2)
          LE Setup Isochronous Data Path (Octet 43 - Bit 3)
          LE Remove Isochronous Data Path (Octet 43 - Bit 4)
          LE Isochronous Transmit Test (Octet 43 - Bit 5)
          LE Isochronous Receive Test (Octet 43 - Bit 6)
          LE Isochronous Read Test Counters (Octet 43 - Bit 7)
          LE Isochronous Read Test Counters (Octet 44 - Bit 0)
          LE Set Host Feature (Octet 44 - Bit 1)
          Octet 44 - Bit 2 
          Octet 45 - Bit 6 
          Octet 46 - Bit 0 
          Octet 46 - Bit 1 
          Octet 46 - Bit 2 
< HCI Command: Host Buffer Size (0x03|0x0033) plen 7         #9 [hci1] 0.326726
        ACL MTU: 255  ACL max packet: 16
        SCO MTU: 0    SCO max packet: 0
> HCI Event: Command Complete (0x0e) plen 4                 #10 [hci1] 0.327292
      Host Buffer Size (0x03|0x0033) ncmd 1
        Status: Success (0x00)
< HCI Command: Set Controller To Ho.. (0x03|0x0031) plen 1  #11 [hci1] 0.346723
        Flow control: ACL Data Packets (0x01)
> HCI Event: Command Complete (0x0e) plen 4                 #12 [hci1] 0.347104
      Set Controller To Host Flow Control (0x03|0x0031) ncmd 1
        Status: Success (0x00)
< HCI Command: LE Read Local Suppor.. (0x08|0x0003) plen 0  #13 [hci1] 0.366700
> HCI Event: Command Complete (0x0e) plen 12                #14 [hci1] 0.367126
      LE Read Local Supported Features (0x08|0x0003) ncmd 1
        Status: Success (0x00)
        Features: 0xfd 0x79 0x00 0xf7 0x30 0x01 0x00 0x00
          LE Encryption
          Extended Reject Indication
          Peripheral-initiated Features Exchange
          LE Ping
          LE Data Packet Length Extension
          LL Privacy
          Extended Scanner Filter Policies
          LE 2M PHY
          LE Coded PHY
          LE Extended Advertising
          LE Periodic Advertising
          Channel Selection Algorithm #2
          Periodic Advertising Sync Transfer - Sender
          Periodic Advertising Sync Transfer - Recipient
          Sleep Clock Accuracy Updates
          Connected Isochronous Stream - Central
          Connected Isochronous Stream - Peripheral
          Isochronous Broadcaster
          Synchronized Receiver
          Periodic Advertising ADI support
          Connection Subrating
          Unknown features (0x0000010000000000)
< HCI Command: LE Set Host Feature (0x08|0x0074) plen 2     #15 [hci1] 0.386726
        Bit Number: 32
          Connected Isochronous Stream (Host Support)
        Bit Value: 1
> HCI Event: Command Complete (0x0e) plen 4                 #16 [hci1] 0.387228
      LE Set Host Feature (0x08|0x0074) ncmd 1
        Status: Success (0x00)
< HCI Command: LE Read Buffer v2 (0x08|0x0060) plen 0       #17 [hci1] 0.406724
> HCI Event: Command Complete (0x0e) plen 10                #18 [hci1] 0.407276
      LE Read Buffer v2 (0x08|0x0060) ncmd 1
        Status: Success (0x00)
        ACL MTU: 27
        ACL max packet: 3
        ISO MTU: 318
        ISO max packet: 3
< HCI Command: LE Read Maximum Adve.. (0x08|0x003a) plen 0  #19 [hci1] 0.426756
> HCI Event: Command Complete (0x0e) plen 6                 #20 [hci1] 0.427179
      LE Read Maximum Advertising Data Length (0x08|0x003a) ncmd 1
        Status: Success (0x00)
        Max length: 1650
< HCI Command: LE Read Supported St.. (0x08|0x001c) plen 0  #21 [hci1] 0.446748
> HCI Event: Command Complete (0x0e) plen 12                #22 [hci1] 0.447279
      LE Read Supported States (0x08|0x001c) ncmd 1
        Status: Success (0x00)
        States: 0x000003ff3e0306ff
          Non-connectable Advertising State
          Scannable Advertising State
          Connectable Advertising State
          High Duty Cycle Directed Advertising State
          Passive Scanning State
          Active Scanning State
          Initiating State
            and Connection State (Central Role)
          Connection State (Peripheral Role)
          Scannable Advertising State
            and Passive Scanning State
          Connectable Advertising State
            and Passive Scanning State
          Non-connectable Advertising State
            and Initiating State
          Scannable Advertising State
            and Initiating State
          Active Scanning State
            and Connection State (Central Role)
          Passive Scanning State
            and Connection State (Peripheral Role)
          Active Scanning State
            and Connection State (Peripheral Role)
          Initiating State
            and Connection State (Central Role)
            and Central Role & Central Role
          Low Duty Cycle Directed Advertising State
          Connectable Advertising State
            and Initiating State
            and Central Role & Peripheral Role
          High Duty Cycle Directed Advertising State
            and Initiating State
            and Central Role & Peripheral Role
          Low Duty Cycle Directed Advertising State
            and Initiating State
            and Central Role & Peripheral Role
          Connectable Advertising State
            and Connection State (Central Role)
            and Central Role & Peripheral Role
          High Duty Cycle Directed Advertising State
            and Connection State (Central Role)
            and Central Role & Peripheral Role
          Low Duty Cycle Directed Advertising State
            and Connection State (Central Role)
            and Central Role & Peripheral Role
          Connectable Advertising State
            and Connection State (Peripheral Role)
            and Central Role & Peripheral Role
          High Duty Cycle Directed Advertising State
            and Connection State (Peripheral Role)
            and Peripheral Role & Peripheral Role
          Low Duty Cycle Directed Advertising State
            and Connection State (Peripheral Role)
            and Peripheral Role & Peripheral Role
          Initiating State
            and Connection State (Peripheral Role)
            and Central Role & Peripheral Role
< HCI Command: LE Read Maximum Data.. (0x08|0x002f) plen 0  #23 [hci1] 0.466715
> HCI Event: Command Complete (0x0e) plen 12                #24 [hci1] 0.467287
      LE Read Maximum Data Length (0x08|0x002f) ncmd 1
        Status: Success (0x00)
        Max TX octets: 251
        Max TX time: 2704
        Max RX octets: 251
        Max RX time: 2704
< HCI Command: LE Write Suggested D.. (0x08|0x0024) plen 4  #25 [hci1] 0.486747
        TX octets: 251
        TX time: 2704
> HCI Event: Command Complete (0x0e) plen 4                 #26 [hci1] 0.487230
      LE Write Suggested Default Data Length (0x08|0x0024) ncmd 1
        Status: Success (0x00)
< HCI Command: LE Read Resolving Li.. (0x08|0x002a) plen 0  #27 [hci1] 0.506735
> HCI Event: Command Complete (0x0e) plen 5                 #28 [hci1] 0.507130
      LE Read Resolving List Size (0x08|0x002a) ncmd 1
        Status: Success (0x00)
        Size: 8
< HCI Command: LE Set Event Mask (0x08|0x0001) plen 8       #29 [hci1] 0.526687
        Mask: 0x000002023f87fa5e
          LE Advertising Report
          LE Connection Update Complete
          LE Read Remote Used Features Complete
          LE Long Term Key Request
          LE Data Length Change
          LE Enhanced Connection Complete
          LE PHY Update Complete
          LE Extended Advertising Report
          LE Periodic Advertising Sync Established
          LE Periodic Advertising Report
          LE Periodic Advertising Sync Lost
          LE Extended Scan Timeout
          LE Extended Advertising Set Terminated
          LE Scan Request Received
          LE Periodic Advertising Sync Transfer Rvc
          LE CIS Established
          LE CIS Request
          LE Create BIG Complete
          LE Terminate BIG Complete
          LE BIG Sync Estabilished Complete
          LE BIG Sync Lost
          LE BIG Info Advertising Report
          Unknown mask (0x0000020000000000)
> HCI Event: Command Complete (0x0e) plen 4                 #30 [hci1] 0.527154
      LE Set Event Mask (0x08|0x0001) ncmd 1
        Status: Success (0x00)
< HCI Command: Set Event Mask (0x03|0x0001) plen 8          #31 [hci1] 0.546727
        Mask: 0x2000800002008890
          Disconnection Complete
          Encryption Change
          Read Remote Version Information Complete
          Hardware Error
          Data Buffer Overflow
          Encryption Key Refresh Complete
          LE Meta
> HCI Event: Command Complete (0x0e) plen 4                 #32 [hci1] 0.547291
      Set Event Mask (0x03|0x0001) ncmd 1
        Status: Success (0x00)
< HCI Command: Read BD ADDR (0x04|0x0009) plen 0            #33 [hci1] 0.566726
> HCI Event: Command Complete (0x0e) plen 10                #34 [hci1] 0.567267
      Read BD ADDR (0x04|0x0009) ncmd 1
        Status: Success (0x00)
        Address: 00:00:00:00:00:00 (OUI 00-00-00)
< HCI Command: LE Set Random Address (0x08|0x0005) plen 6   #35 [hci1] 0.586726
        Address: D5:B6:CC:31:DB:3B (Static)
> HCI Event: Command Complete (0x0e) plen 4                 #36 [hci1] 0.587274
      LE Set Random Address (0x08|0x0005) ncmd 1
        Status: Success (0x00)
< HCI Command: LE Set Extended Adv.. (0x08|0x0036) plen 25  #37 [hci1] 3.106930
        Handle: 0x00
        Properties: 0x0013
          Connectable
          Scannable
          Use legacy advertising PDUs: ADV_IND
        Min advertising interval: 100.000 msec (0x00a0)
        Max advertising interval: 150.000 msec (0x00f0)
        Channel map: 37, 38, 39 (0x07)
        Own address type: Random (0x01)
        Peer address type: Public (0x00)
        Peer address: 00:00:00:00:00:00 (OUI 00-00-00)
        Filter policy: Allow Scan Request from Any, Allow Connect Request from Any (0x00)
        TX power: Host has no preference (0x7f)
        Primary PHY: LE 1M (0x01)
        Secondary max skip: 0x00
        Secondary PHY: LE 1M (0x01)
        SID: 0x00
        Scan request notifications: Disabled (0x00)
> HCI Event: Command Complete (0x0e) plen 5                 #38 [hci1] 3.107736
      LE Set Extended Advertising Parameters (0x08|0x0036) ncmd 1
        Status: Success (0x00)
        TX power (selected): 0 dbm (0x00)
< HCI Command: LE Set Advertising S.. (0x08|0x0035) plen 7  #39 [hci1] 3.126782
        Advertising handle: 0x00
        Advertising random address: D5:B6:CC:31:DB:3B (Static)
> HCI Event: Command Complete (0x0e) plen 4                 #40 [hci1] 3.127288
      LE Set Advertising Set Random Address (0x08|0x0035) ncmd 1
        Status: Success (0x00)
< HCI Command: LE Set Extended Adv.. (0x08|0x0037) plen 22  #41 [hci1] 3.146765
        Handle: 0x00
        Operation: Complete extended advertising data (0x03)
        Fragment preference: Minimize fragmentation (0x01)
        Data length: 0x12
        Flags: 0x06
          LE General Discoverable Mode
          BR/EDR Not Supported
        Name (complete): Tester_F6B11A
> HCI Event: Command Complete (0x0e) plen 4                 #42 [hci1] 3.147546
      LE Set Extended Advertising Data (0x08|0x0037) ncmd 1
        Status: Success (0x00)
< HCI Command: LE Set Extended Scan.. (0x08|0x0038) plen 4  #43 [hci1] 3.166764
        Handle: 0x00
        Operation: Complete scan response data (0x03)
        Fragment preference: Minimize fragmentation (0x01)
        Data length: 0x00
> HCI Event: Command Complete (0x0e) plen 4                 #44 [hci1] 3.167264
      LE Set Extended Scan Response Data (0x08|0x0038) ncmd 1
        Status: Success (0x00)
< HCI Command: LE Set Extended Adve.. (0x08|0x0039) plen 6  #45 [hci1] 3.186834
        Extended advertising: Enabled (0x01)
        Number of sets: 1 (0x01)
        Entry 0
          Handle: 0x00
          Duration: 0 ms (0x00)
          Max ext adv events: 0
> HCI Event: Command Complete (0x0e) plen 4                 #46 [hci1] 3.187476
      LE Set Extended Advertising Enable (0x08|0x0039) ncmd 1
        Status: Success (0x00)
> HCI Event: LE Meta Event (0x3e) plen 31                   #47 [hci1] 3.300376
      LE Enhanced Connection Complete (0x0a)
        Status: Success (0x00)
        Handle: 543
        Role: Peripheral (0x01)
        Peer address type: Public (0x00)
        Peer address: DF:A9:FF:F6:B1:1A (OUI DF-A9-FF)
        Local resolvable private address: 00:00:00:00:00:00 (Non-Resolvable)
        Peer resolvable private address: 00:00:00:00:00:00 (Non-Resolvable)
        Connection interval: 87.50 msec (0x0046)
        Connection latency: 0 (0x0000)
        Supervision timeout: 25120 msec (0x09d0)
        Central clock accuracy: 0x01
> HCI Event: LE Meta Event (0x3e) plen 6                    #48 [hci1] 3.300505
      LE Advertising Set Terminated (0x12)
        Status: Success (0x00)
        Handle: 0
        Connection handle: 543
        Number of completed extended advertising events: 0
< HCI Command: LE Read Remote Used... (0x08|0x0016) plen 2  #49 [hci1] 3.307047
        Handle: 543 Address: DF:A9:FF:F6:B1:1A (OUI DF-A9-FF)
< ACL Data TX: Handle 543 flags 0x00 dlen 7                 #50 [hci1] 3.307068
      ATT: Exchange MTU Request (0x02) len 2
        Client RX MTU: 251
> HCI Event: Command Status (0x0f) plen 4                   #51 [hci1] 3.307557
      LE Read Remote Used Features (0x08|0x0016) ncmd 1
        Status: Success (0x00)
> HCI Event: Number of Completed Packets (0x13) plen 5      #52 [hci1] 3.476315
        Num handles: 1
        Handle: 543 Address: DF:A9:FF:F6:B1:1A (OUI DF-A9-FF)
        Count: 1
        #50: len 7 (0 Kb/s)
        Latency: 169 msec (169-169 msec ~169 msec)
> HCI Event: LE Meta Event (0x3e) plen 12                   #53 [hci1] 3.564269
      LE Read Remote Used Features (0x04)
        Status: Success (0x00)
        Handle: 543 Address: DF:A9:FF:F6:B1:1A (OUI DF-A9-FF)
        Features: 0x2d 0x49 0x00 0xf7 0x67 0xd9 0x00 0x80
          LE Encryption
          Extended Reject Indication
          Peripheral-initiated Features Exchange
          LE Data Packet Length Extension
          LE 2M PHY
          LE Coded PHY
          Channel Selection Algorithm #2
          Periodic Advertising Sync Transfer - Sender
          Periodic Advertising Sync Transfer - Recipient
          Sleep Clock Accuracy Updates
          Connected Isochronous Stream - Central
          Connected Isochronous Stream - Peripheral
          Isochronous Broadcaster
          Synchronized Receiver
          Connected Isochronous Stream (Host Support)
          LE Power Control Request
          LE Power Control Request
          Connection Subrating
          Connection Subrating (Host Support)
          Unknown features (0x8000d90000000000)
> ACL Data RX: Handle 543 flags 0x02 dlen 11                #54 [hci1] 6.014026
      SMP: Pairing Request (0x01) len 6
        IO capability: KeyboardDisplay (0x04)
        OOB data: Authentication data not present (0x00)
        Authentication requirement: Bonding, MITM, SC, No Keypresses (0x0d)
        Max encryption key size: 16
        Initiator key distribution: EncKey IdKey (0x03)
        Responder key distribution: EncKey IdKey Sign (0x07)
> ACL Data RX: Handle 543 flags 0x02 dlen 7                 #55 [hci1] 6.014447
      ATT: Exchange MTU Response (0x03) len 2
        Server RX MTU: 23
< HCI Command: Host Number of Compl.. (0x03|0x0035) plen 5  #56 [hci1] 6.026979
        Num handles: 1
        Handle: 543 Address: DF:A9:FF:F6:B1:1A (OUI DF-A9-FF)
        Count: 1
< ACL Data TX: Handle 543 flags 0x00 dlen 11                #57 [hci1] 6.027038
      SMP: Pairing Response (0x02) len 6
        IO capability: DisplayOnly (0x00)
        OOB data: Authentication data not present (0x00)
        Authentication requirement: Bonding, No MITM, SC, No Keypresses (0x09)
        Max encryption key size: 16
        Initiator key distribution: IdKey (0x02)
        Responder key distribution: <none> (0x00)
< HCI Command: Host Number of Compl.. (0x03|0x0035) plen 5  #58 [hci1] 6.027417
        Num handles: 1
        Handle: 543 Address: DF:A9:FF:F6:B1:1A (OUI DF-A9-FF)
        Count: 1
> HCI Event: Number of Completed Packets (0x13) plen 5      #59 [hci1] 6.189000
        Num handles: 1
        Handle: 543 Address: DF:A9:FF:F6:B1:1A (OUI DF-A9-FF)
        Count: 1
        #57: len 11 (0 Kb/s)
        Latency: 161 msec (161-169 msec ~165 msec)
> ACL Data RX: Handle 543 flags 0x02 dlen 27                #60 [hci1] 6.189407
> ACL Data RX: Handle 543 flags 0x01 dlen 27                #61 [hci1] 6.189871
> ACL Data RX: Handle 543 flags 0x01 dlen 15                #62 [hci1] 6.190309
      SMP: Pairing Public Key (0x0c) len 64
        X: 4b65a27b21170a7a28c7435ce105613dc4056a8d9941b6a40f659cd9eea1ed5f
        Y: db64a57213b5371cf46e7d547af80d56a6b31a6b5b14dc664c11fc4be210db9b
< HCI Command: Host Number of Compl.. (0x03|0x0035) plen 5  #63 [hci1] 6.207637
        Num handles: 1
        Handle: 543 Address: DF:A9:FF:F6:B1:1A (OUI DF-A9-FF)
        Count: 1
< HCI Command: Host Number of Compl.. (0x03|0x0035) plen 5  #64 [hci1] 6.207909
        Num handles: 1
        Handle: 543 Address: DF:A9:FF:F6:B1:1A (OUI DF-A9-FF)
        Count: 1
< HCI Command: Host Number of Compl.. (0x03|0x0035) plen 5  #65 [hci1] 6.208348
        Num handles: 1
        Handle: 543 Address: DF:A9:FF:F6:B1:1A (OUI DF-A9-FF)
        Count: 1
< ACL Data TX: Handle 543 flags 0x00 dlen 27                #66 [hci1] 6.208458
< ACL Data TX: Handle 543 flags 0x01 dlen 27                #67 [hci1] 6.208473
< ACL Data TX: Handle 543 flags 0x01 dlen 15                #68 [hci1] 6.208476
      SMP: Pairing Public Key (0x0c) len 64
        X: 98308440221e2d910f0e54b71e7ec652857aa9b5a0dc65028824cc19db1226e9
        Y: 67a4816bcb62efb21701e31fdb27561a6217575fb007a8bbdabe7e28b6f68482
> HCI Event: Number of Completed Packets (0x13) plen 5      #69 [hci1] 6.276936
        Num handles: 1
        Handle: 543 Address: DF:A9:FF:F6:B1:1A (OUI DF-A9-FF)
        Count: 1
        #66: len 27 (3 Kb/s)
        Latency: 68 msec (68-169 msec ~117 msec)
> HCI Event: Number of Completed Packets (0x13) plen 5      #70 [hci1] 6.277587
        Num handles: 1
        Handle: 543 Address: DF:A9:FF:F6:B1:1A (OUI DF-A9-FF)
        Count: 1
        #67: len 27 (3 Kb/s)
        Latency: 69 msec (68-169 msec ~93 msec)
> HCI Event: Number of Completed Packets (0x13) plen 5      #71 [hci1] 6.363756
        Num handles: 1
        Handle: 543 Address: DF:A9:FF:F6:B1:1A (OUI DF-A9-FF)
        Count: 1
        #68: len 15 (0 Kb/s)
        Latency: 155 msec (68-169 msec ~124 msec)
> ACL Data RX: Handle 543 flags 0x02 dlen 21                #72 [hci1] 7.414114
      SMP: Pairing Confirm (0x03) len 16
        Confim value: d7b4e9facad8939d4a885dce8970e28c
< HCI Command: Host Number of Compl.. (0x03|0x0035) plen 5  #73 [hci1] 7.427463
        Num handles: 1
        Handle: 543 Address: DF:A9:FF:F6:B1:1A (OUI DF-A9-FF)
        Count: 1
< ACL Data TX: Handle 543 flags 0x00 dlen 21                #74 [hci1] 7.427585
      SMP: Pairing Confirm (0x03) len 16
        Confim value: f3c357f72d5f856a3648662546a18bf7
> HCI Event: Number of Completed Packets (0x13) plen 5      #75 [hci1] 7.588942
        Num handles: 1
        Handle: 543 Address: DF:A9:FF:F6:B1:1A (OUI DF-A9-FF)
        Count: 1
        #74: len 21 (1 Kb/s)
        Latency: 161 msec (68-169 msec ~142 msec)
> ACL Data RX: Handle 543 flags 0x02 dlen 21                #76 [hci1] 7.589326
      SMP: Pairing Random (0x04) len 16
        Random value: 1383667d20171e950000000000000000
< HCI Command: Host Number of Compl.. (0x03|0x0035) plen 5  #77 [hci1] 7.607810
        Num handles: 1
        Handle: 543 Address: DF:A9:FF:F6:B1:1A (OUI DF-A9-FF)
        Count: 1
< ACL Data TX: Handle 543 flags 0x00 dlen 21                #78 [hci1] 7.607967
      SMP: Pairing Random (0x04) len 16
        Random value: 8e6108f966a694cbe26df70bb96773e6
> HCI Event: Number of Completed Packets (0x13) plen 5      #79 [hci1] 7.763720
        Num handles: 1
        Handle: 543 Address: DF:A9:FF:F6:B1:1A (OUI DF-A9-FF)
        Count: 1
        #78: len 21 (1 Kb/s)
        Latency: 155 msec (68-169 msec ~149 msec)
> ACL Data RX: Handle 543 flags 0x02 dlen 21                #80 [hci1] 7.851625
      SMP: Pairing Confirm (0x03) len 16
        Confim value: 5d583c4f782ba74781b21d15b45889ad
< HCI Command: Host Number of Compl.. (0x03|0x0035) plen 5  #81 [hci1] 7.867113
        Num handles: 1
        Handle: 543 Address: DF:A9:FF:F6:B1:1A (OUI DF-A9-FF)
        Count: 1
< ACL Data TX: Handle 543 flags 0x00 dlen 21                #82 [hci1] 7.867124
      SMP: Pairing Confirm (0x03) len 16
        Confim value: b6c84539dc7eb07f79fd31696ed1a100
> HCI Event: Number of Completed Packets (0x13) plen 5      #83 [hci1] 8.026443
        Num handles: 1
        Handle: 543 Address: DF:A9:FF:F6:B1:1A (OUI DF-A9-FF)
        Count: 1
        #82: len 21 (1 Kb/s)
        Latency: 159 msec (68-169 msec ~154 msec)
> ACL Data RX: Handle 543 flags 0x02 dlen 21                #84 [hci1] 8.026761
      SMP: Pairing Random (0x04) len 16
        Random value: e6c39d131f5528ff0000000000000000
< HCI Command: Host Number of Compl.. (0x03|0x0035) plen 5  #85 [hci1] 8.027420
        Num handles: 1
        Handle: 543 Address: DF:A9:FF:F6:B1:1A (OUI DF-A9-FF)
        Count: 1
< ACL Data TX: Handle 543 flags 0x00 dlen 21                #86 [hci1] 8.027547
      SMP: Pairing Random (0x04) len 16
        Random value: 4d02679f89a05211af56d8b3da64d21e
> HCI Event: Number of Completed Packets (0x13) plen 5      #87 [hci1] 8.201320
        Num handles: 1
        Handle: 543 Address: DF:A9:FF:F6:B1:1A (OUI DF-A9-FF)
        Count: 1
        #86: len 21 (0 Kb/s)
        Latency: 173 msec (68-173 msec ~164 msec)
> ACL Data RX: Handle 543 flags 0x02 dlen 21                #88 [hci1] 8.289088
      SMP: Pairing Confirm (0x03) len 16
        Confim value: 4b3b26bbe722b5285131e1811b4ba70b
< HCI Command: Host Number of Compl.. (0x03|0x0035) plen 5  #89 [hci1] 8.306970
        Num handles: 1
        Handle: 543 Address: DF:A9:FF:F6:B1:1A (OUI DF-A9-FF)
        Count: 1
< ACL Data TX: Handle 543 flags 0x00 dlen 21                #90 [hci1] 8.307056
      SMP: Pairing Confirm (0x03) len 16
        Confim value: c56a4b8e8bf026d025b31a8c08d98d9f
> HCI Event: Number of Completed Packets (0x13) plen 5      #91 [hci1] 8.463936
        Num handles: 1
        Handle: 543 Address: DF:A9:FF:F6:B1:1A (OUI DF-A9-FF)
        Count: 1
        #90: len 21 (1 Kb/s)
        Latency: 156 msec (68-173 msec ~160 msec)
> ACL Data RX: Handle 543 flags 0x02 dlen 21                #92 [hci1] 8.464249
      SMP: Pairing Random (0x04) len 16
        Random value: efeb955b0a3351440000000000000000
< HCI Command: Host Number of Compl.. (0x03|0x0035) plen 5  #93 [hci1] 8.467391
        Num handles: 1
        Handle: 543 Address: DF:A9:FF:F6:B1:1A (OUI DF-A9-FF)
        Count: 1
< ACL Data TX: Handle 543 flags 0x00 dlen 21                #94 [hci1] 8.467504
      SMP: Pairing Random (0x04) len 16
        Random value: 5e8286bc235a02440d0c3424a2acf8fd
> HCI Event: Number of Completed Packets (0x13) plen 5      #95 [hci1] 8.638693
        Num handles: 1
        Handle: 543 Address: DF:A9:FF:F6:B1:1A (OUI DF-A9-FF)
        Count: 1
        #94: len 21 (0 Kb/s)
        Latency: 171 msec (68-173 msec ~165 msec)
> ACL Data RX: Handle 543 flags 0x02 dlen 21                #96 [hci1] 8.726726
      SMP: Pairing Confirm (0x03) len 16
        Confim value: fb8238ceee774b36def724c8b2773015
< HCI Command: Host Number of Compl.. (0x03|0x0035) plen 5  #97 [hci1] 8.727438
        Num handles: 1
        Handle: 543 Address: DF:A9:FF:F6:B1:1A (OUI DF-A9-FF)
        Count: 1
< ACL Data TX: Handle 543 flags 0x00 dlen 21                #98 [hci1] 8.727585
      SMP: Pairing Confirm (0x03) len 16
        Confim value: 6d17165c7439a0054e645402cb0bc91f
> HCI Event: Number of Completed Packets (0x13) plen 5      #99 [hci1] 8.901461
        Num handles: 1
        Handle: 543 Address: DF:A9:FF:F6:B1:1A (OUI DF-A9-FF)
        Count: 1
        #98: len 21 (0 Kb/s)
        Latency: 173 msec (68-173 msec ~169 msec)
> ACL Data RX: Handle 543 flags 0x02 dlen 21               #100 [hci1] 8.901853
      SMP: Pairing Random (0x04) len 16
        Random value: a7f5196a656997380000000000000000
< HCI Command: Host Number of Comp.. (0x03|0x0035) plen 5  #101 [hci1] 8.907122
        Num handles: 1
        Handle: 543 Address: DF:A9:FF:F6:B1:1A (OUI DF-A9-FF)
        Count: 1
< ACL Data TX: Handle 543 flags 0x00 dlen 21               #102 [hci1] 8.907226
      SMP: Pairing Random (0x04) len 16
        Random value: 5c4a1bcadd27bd58e945097b00bad7ac
> HCI Event: Number of Completed Packets (0x13) plen 5     #103 [hci1] 9.076174
        Num handles: 1
        Handle: 543 Address: DF:A9:FF:F6:B1:1A (OUI DF-A9-FF)
        Count: 1
        #102: len 21 (1 Kb/s)
        Latency: 168 msec (68-173 msec ~169 msec)
> ACL Data RX: Handle 543 flags 0x02 dlen 21               #104 [hci1] 9.164068
      SMP: Pairing Confirm (0x03) len 16
        Confim value: 5f73a2927b9bb3af77e86628fd286cec
< HCI Command: Host Number of Comp.. (0x03|0x0035) plen 5  #105 [hci1] 9.167427
        Num handles: 1
        Handle: 543 Address: DF:A9:FF:F6:B1:1A (OUI DF-A9-FF)
        Count: 1
< ACL Data TX: Handle 543 flags 0x00 dlen 21               #106 [hci1] 9.167616
      SMP: Pairing Confirm (0x03) len 16
        Confim value: 007d7ba230002400a97a177018f78b1d
> HCI Event: Number of Completed Packets (0x13) plen 5     #107 [hci1] 9.338961
        Num handles: 1
        Handle: 543 Address: DF:A9:FF:F6:B1:1A (OUI DF-A9-FF)
        Count: 1
        #106: len 21 (0 Kb/s)
        Latency: 171 msec (68-173 msec ~170 msec)
> ACL Data RX: Handle 543 flags 0x02 dlen 21               #108 [hci1] 9.339250
      SMP: Pairing Random (0x04) len 16
        Random value: 51587b0e086e55460000000000000000
< HCI Command: Host Number of Comp.. (0x03|0x0035) plen 5  #109 [hci1] 9.347027
        Num handles: 1
        Handle: 543 Address: DF:A9:FF:F6:B1:1A (OUI DF-A9-FF)
        Count: 1
< ACL Data TX: Handle 543 flags 0x00 dlen 21               #110 [hci1] 9.347084
      SMP: Pairing Random (0x04) len 16
        Random value: 32527e6e64e79f33b2e374394db8ab2d
> HCI Event: Number of Completed Packets (0x13) plen 5     #111 [hci1] 9.513704
        Num handles: 1
        Handle: 543 Address: DF:A9:FF:F6:B1:1A (OUI DF-A9-FF)
        Count: 1
        #110: len 21 (1 Kb/s)
        Latency: 166 msec (68-173 msec ~168 msec)
> ACL Data RX: Handle 543 flags 0x02 dlen 21               #112 [hci1] 9.601602
      SMP: Pairing Confirm (0x03) len 16
        Confim value: a1b432e65f34a6ae4486f5e1edcff9bd
< HCI Command: Host Number of Comp.. (0x03|0x0035) plen 5  #113 [hci1] 9.606949
        Num handles: 1
        Handle: 543 Address: DF:A9:FF:F6:B1:1A (OUI DF-A9-FF)
        Count: 1
< ACL Data TX: Handle 543 flags 0x00 dlen 21               #114 [hci1] 9.606973
      SMP: Pairing Confirm (0x03) len 16
        Confim value: 0d6636470ef0746369426ad93603322b
> HCI Event: Number of Completed Packets (0x13) plen 5     #115 [hci1] 9.776415
        Num handles: 1
        Handle: 543 Address: DF:A9:FF:F6:B1:1A (OUI DF-A9-FF)
        Count: 1
        #114: len 21 (0 Kb/s)
        Latency: 169 msec (68-173 msec ~168 msec)
> ACL Data RX: Handle 543 flags 0x02 dlen 21               #116 [hci1] 9.776746
      SMP: Pairing Random (0x04) len 16
        Random value: b5661162cdb92c150000000000000000
< HCI Command: Host Number of Comp.. (0x03|0x0035) plen 5  #117 [hci1] 9.787595
        Num handles: 1
        Handle: 543 Address: DF:A9:FF:F6:B1:1A (OUI DF-A9-FF)
        Count: 1
< ACL Data TX: Handle 543 flags 0x00 dlen 21               #118 [hci1] 9.787784
      SMP: Pairing Random (0x04) len 16
        Random value: dddbdfe2838e9a8cc6964353c850fef7
> HCI Event: Number of Completed Packets (0x13) plen 5     #119 [hci1] 9.951194
        Num handles: 1
        Handle: 543 Address: DF:A9:FF:F6:B1:1A (OUI DF-A9-FF)
        Count: 1
        #118: len 21 (1 Kb/s)
        Latency: 163 msec (68-173 msec ~166 msec)
> ACL Data RX: Handle 543 flags 0x02 dlen 21              #120 [hci1] 10.039057
      SMP: Pairing Confirm (0x03) len 16
        Confim value: 44d58471dbeaaa212b7549608de30cb1
< HCI Command: Host Number of Com.. (0x03|0x0035) plen 5  #121 [hci1] 10.047305
        Num handles: 1
        Handle: 543 Address: DF:A9:FF:F6:B1:1A (OUI DF-A9-FF)
        Count: 1
< ACL Data TX: Handle 543 flags 0x00 dlen 21              #122 [hci1] 10.047428
      SMP: Pairing Confirm (0x03) len 16
        Confim value: 916a7854913d1361b2b9e93146645c68
> HCI Event: Number of Completed Packets (0x13) plen 5    #123 [hci1] 10.213957
        Num handles: 1
        Handle: 543 Address: DF:A9:FF:F6:B1:1A (OUI DF-A9-FF)
        Count: 1
        #122: len 21 (1 Kb/s)
        Latency: 166 msec (68-173 msec ~166 msec)
> ACL Data RX: Handle 543 flags 0x02 dlen 21              #124 [hci1] 10.214335
      SMP: Pairing Random (0x04) len 16
        Random value: e373871de4e5d02e0000000000000000
< HCI Command: Host Number of Com.. (0x03|0x0035) plen 5  #125 [hci1] 10.227808
        Num handles: 1
        Handle: 543 Address: DF:A9:FF:F6:B1:1A (OUI DF-A9-FF)
        Count: 1
< ACL Data TX: Handle 543 flags 0x00 dlen 21              #126 [hci1] 10.227967
      SMP: Pairing Random (0x04) len 16
        Random value: eb9f1915536596b6fc3db1c86b2b1970
> HCI Event: Number of Completed Packets (0x13) plen 5    #127 [hci1] 10.388793
        Num handles: 1
        Handle: 543 Address: DF:A9:FF:F6:B1:1A (OUI DF-A9-FF)
        Count: 1
        #126: len 21 (1 Kb/s)
        Latency: 160 msec (68-173 msec ~163 msec)
> ACL Data RX: Handle 543 flags 0x02 dlen 21              #128 [hci1] 10.476666
      SMP: Pairing Confirm (0x03) len 16
        Confim value: e9ebb529602b001d544f3104c31c3573
< HCI Command: Host Number of Com.. (0x03|0x0035) plen 5  #129 [hci1] 10.487368
        Num handles: 1
        Handle: 543 Address: DF:A9:FF:F6:B1:1A (OUI DF-A9-FF)
        Count: 1
< ACL Data TX: Handle 543 flags 0x00 dlen 21              #130 [hci1] 10.487519
      SMP: Pairing Confirm (0x03) len 16
        Confim value: 1c37cfa302716ba60e88e24e82f02e9a
> HCI Event: Number of Completed Packets (0x13) plen 5    #131 [hci1] 10.651350
        Num handles: 1
        Handle: 543 Address: DF:A9:FF:F6:B1:1A (OUI DF-A9-FF)
        Count: 1
        #130: len 21 (1 Kb/s)
        Latency: 163 msec (68-173 msec ~163 msec)
> ACL Data RX: Handle 543 flags 0x02 dlen 21              #132 [hci1] 10.651749
      SMP: Pairing Random (0x04) len 16
        Random value: 586059a994582db50000000000000000
< HCI Command: Host Number of Com.. (0x03|0x0035) plen 5  #133 [hci1] 10.667592
        Num handles: 1
        Handle: 543 Address: DF:A9:FF:F6:B1:1A (OUI DF-A9-FF)
        Count: 1
< ACL Data TX: Handle 543 flags 0x00 dlen 21              #134 [hci1] 10.667736
      SMP: Pairing Random (0x04) len 16
        Random value: 5c794dc9ad9f2c3f295ebd5ad5e1c3cf
> HCI Event: Number of Completed Packets (0x13) plen 5    #135 [hci1] 10.826249
        Num handles: 1
        Handle: 543 Address: DF:A9:FF:F6:B1:1A (OUI DF-A9-FF)
        Count: 1
        #134: len 21 (1 Kb/s)
        Latency: 158 msec (68-173 msec ~161 msec)
> ACL Data RX: Handle 543 flags 0x02 dlen 21              #136 [hci1] 10.914049
      SMP: Pairing Confirm (0x03) len 16
        Confim value: f354bea18944ae0f83d9721700c58f09
< HCI Command: Host Number of Com.. (0x03|0x0035) plen 5  #137 [hci1] 10.927107
        Num handles: 1
        Handle: 543 Address: DF:A9:FF:F6:B1:1A (OUI DF-A9-FF)
        Count: 1
< ACL Data TX: Handle 543 flags 0x00 dlen 21              #138 [hci1] 10.927154
      SMP: Pairing Confirm (0x03) len 16
        Confim value: b083f1bb9a6bc45861c8ab86786d051e
> HCI Event: Number of Completed Packets (0x13) plen 5    #139 [hci1] 11.088914
        Num handles: 1
        Handle: 543 Address: DF:A9:FF:F6:B1:1A (OUI DF-A9-FF)
        Count: 1
        #138: len 21 (1 Kb/s)
        Latency: 161 msec (68-173 msec ~161 msec)
> ACL Data RX: Handle 543 flags 0x02 dlen 21              #140 [hci1] 11.089236
      SMP: Pairing Random (0x04) len 16
        Random value: 8ac2ba220427dca40000000000000000
< HCI Command: Host Number of Com.. (0x03|0x0035) plen 5  #141 [hci1] 11.107591
        Num handles: 1
        Handle: 543 Address: DF:A9:FF:F6:B1:1A (OUI DF-A9-FF)
        Count: 1
< ACL Data TX: Handle 543 flags 0x00 dlen 21              #142 [hci1] 11.107765
      SMP: Pairing Random (0x04) len 16
        Random value: 5c2fff312cdf99c9491988e877355a9a
> HCI Event: Number of Completed Packets (0x13) plen 5    #143 [hci1] 11.263679
        Num handles: 1
        Handle: 543 Address: DF:A9:FF:F6:B1:1A (OUI DF-A9-FF)
        Count: 1
        #142: len 21 (1 Kb/s)
        Latency: 155 msec (68-173 msec ~158 msec)
> ACL Data RX: Handle 543 flags 0x02 dlen 21              #144 [hci1] 11.351510
      SMP: Pairing Confirm (0x03) len 16
        Confim value: 54dc707bf4d895d322a96fd543f0f056
< HCI Command: Host Number of Com.. (0x03|0x0035) plen 5  #145 [hci1] 11.367038
        Num handles: 1
        Handle: 543 Address: DF:A9:FF:F6:B1:1A (OUI DF-A9-FF)
        Count: 1
< ACL Data TX: Handle 543 flags 0x00 dlen 21              #146 [hci1] 11.367115
      SMP: Pairing Confirm (0x03) len 16
        Confim value: d759e2581477ee50248f6a71fd0661ce
> HCI Event: Number of Completed Packets (0x13) plen 5    #147 [hci1] 11.526410
        Num handles: 1
        Handle: 543 Address: DF:A9:FF:F6:B1:1A (OUI DF-A9-FF)
        Count: 1
        #146: len 21 (1 Kb/s)
        Latency: 159 msec (68-173 msec ~158 msec)
> ACL Data RX: Handle 543 flags 0x02 dlen 21              #148 [hci1] 11.526750
      SMP: Pairing Random (0x04) len 16
        Random value: a12fa24c8becbe3f0000000000000000
< HCI Command: Host Number of Com.. (0x03|0x0035) plen 5  #149 [hci1] 11.527350
        Num handles: 1
        Handle: 543 Address: DF:A9:FF:F6:B1:1A (OUI DF-A9-FF)
        Count: 1
< ACL Data TX: Handle 543 flags 0x00 dlen 21              #150 [hci1] 11.527381
      SMP: Pairing Random (0x04) len 16
        Random value: c629a3a987d808e808655d558dfc1155
> HCI Event: Number of Completed Packets (0x13) plen 5    #151 [hci1] 11.701160
        Num handles: 1
        Handle: 543 Address: DF:A9:FF:F6:B1:1A (OUI DF-A9-FF)
        Count: 1
        #150: len 21 (0 Kb/s)
        Latency: 173 msec (68-173 msec ~166 msec)
> ACL Data RX: Handle 543 flags 0x02 dlen 21              #152 [hci1] 11.789028
      SMP: Pairing Confirm (0x03) len 16
        Confim value: 612cd0e19e3dc6639ea347d6cd367306
< HCI Command: Host Number of Com.. (0x03|0x0035) plen 5  #153 [hci1] 11.807158
        Num handles: 1
        Handle: 543 Address: DF:A9:FF:F6:B1:1A (OUI DF-A9-FF)
        Count: 1
< ACL Data TX: Handle 543 flags 0x00 dlen 21              #154 [hci1] 11.807271
      SMP: Pairing Confirm (0x03) len 16
        Confim value: 0d87969067109977da57d516ca6ba7f1
> HCI Event: Number of Completed Packets (0x13) plen 5    #155 [hci1] 11.963909
        Num handles: 1
        Handle: 543 Address: DF:A9:FF:F6:B1:1A (OUI DF-A9-FF)
        Count: 1
        #154: len 21 (1 Kb/s)
        Latency: 156 msec (68-173 msec ~161 msec)
> ACL Data RX: Handle 543 flags 0x02 dlen 21              #156 [hci1] 11.964273
      SMP: Pairing Random (0x04) len 16
        Random value: 308891b54d3e210c0000000000000000
< HCI Command: Host Number of Com.. (0x03|0x0035) plen 5  #157 [hci1] 11.967809
        Num handles: 1
        Handle: 543 Address: DF:A9:FF:F6:B1:1A (OUI DF-A9-FF)
        Count: 1
< ACL Data TX: Handle 543 flags 0x00 dlen 21              #158 [hci1] 11.967957
      SMP: Pairing Random (0x04) len 16
        Random value: 92f20f6ad8f13724432c7fd6001c45ff
> HCI Event: Number of Completed Packets (0x13) plen 5    #159 [hci1] 12.138760
        Num handles: 1
        Handle: 543 Address: DF:A9:FF:F6:B1:1A (OUI DF-A9-FF)
        Count: 1
        #158: len 21 (0 Kb/s)
        Latency: 170 msec (68-173 msec ~166 msec)
> ACL Data RX: Handle 543 flags 0x02 dlen 21              #160 [hci1] 12.226496
      SMP: Pairing Confirm (0x03) len 16
        Confim value: b0f680e6e2ebd8d5ccded0e549312ad0
< HCI Command: Host Number of Com.. (0x03|0x0035) plen 5  #161 [hci1] 12.227406
        Num handles: 1
        Handle: 543 Address: DF:A9:FF:F6:B1:1A (OUI DF-A9-FF)
        Count: 1
< ACL Data TX: Handle 543 flags 0x00 dlen 21              #162 [hci1] 12.227559
      SMP: Pairing Confirm (0x03) len 16
        Confim value: 01046f1aafe76378fd70fe7b09340eb2
> HCI Event: Number of Completed Packets (0x13) plen 5    #163 [hci1] 12.401386
        Num handles: 1
        Handle: 543 Address: DF:A9:FF:F6:B1:1A (OUI DF-A9-FF)
        Count: 1
        #162: len 21 (0 Kb/s)
        Latency: 173 msec (68-173 msec ~169 msec)
> ACL Data RX: Handle 543 flags 0x02 dlen 21              #164 [hci1] 12.401714
      SMP: Pairing Random (0x04) len 16
        Random value: f3b2e157ef8671530000000000000000
< HCI Command: Host Number of Com.. (0x03|0x0035) plen 5  #165 [hci1] 12.407088
        Num handles: 1
        Handle: 543 Address: DF:A9:FF:F6:B1:1A (OUI DF-A9-FF)
        Count: 1
< ACL Data TX: Handle 543 flags 0x00 dlen 21              #166 [hci1] 12.407121
      SMP: Pairing Random (0x04) len 16
        Random value: 23ac32ebbb5e14c8a6b9622f296d277f
> HCI Event: Number of Completed Packets (0x13) plen 5    #167 [hci1] 12.576108
        Num handles: 1
        Handle: 543 Address: DF:A9:FF:F6:B1:1A (OUI DF-A9-FF)
        Count: 1
        #166: len 21 (1 Kb/s)
        Latency: 168 msec (68-173 msec ~169 msec)
> ACL Data RX: Handle 543 flags 0x02 dlen 21              #168 [hci1] 12.664062
      SMP: Pairing Confirm (0x03) len 16
        Confim value: 8faaa59f1903902910395107671313d6
< HCI Command: Host Number of Com.. (0x03|0x0035) plen 5  #169 [hci1] 12.666932
        Num handles: 1
        Handle: 543 Address: DF:A9:FF:F6:B1:1A (OUI DF-A9-FF)
        Count: 1
< ACL Data TX: Handle 543 flags 0x00 dlen 21              #170 [hci1] 12.666999
      SMP: Pairing Confirm (0x03) len 16
        Confim value: 5241c27c41783c09190908d8676251e6
> HCI Event: Number of Completed Packets (0x13) plen 5    #171 [hci1] 12.838822
        Num handles: 1
        Handle: 543 Address: DF:A9:FF:F6:B1:1A (OUI DF-A9-FF)
        Count: 1
        #170: len 21 (0 Kb/s)
        Latency: 171 msec (68-173 msec ~170 msec)
> ACL Data RX: Handle 543 flags 0x02 dlen 21              #172 [hci1] 12.839241
      SMP: Pairing Random (0x04) len 16
        Random value: fb3d2cf16fd3daca0000000000000000
< HCI Command: Host Number of Com.. (0x03|0x0035) plen 5  #173 [hci1] 12.847281
        Num handles: 1
        Handle: 543 Address: DF:A9:FF:F6:B1:1A (OUI DF-A9-FF)
        Count: 1
< ACL Data TX: Handle 543 flags 0x00 dlen 21              #174 [hci1] 12.847344
      SMP: Pairing Random (0x04) len 16
        Random value: 297efe85e67448a15f56bd27e3a3cf1d
> HCI Event: Number of Completed Packets (0x13) plen 5    #175 [hci1] 13.013633
        Num handles: 1
        Handle: 543 Address: DF:A9:FF:F6:B1:1A (OUI DF-A9-FF)
        Count: 1
        #174: len 21 (1 Kb/s)
        Latency: 166 msec (68-173 msec ~168 msec)
> ACL Data RX: Handle 543 flags 0x02 dlen 21              #176 [hci1] 13.101636
      SMP: Pairing Confirm (0x03) len 16
        Confim value: 8efa96ea1f25d710abfde331381c4372
< HCI Command: Host Number of Com.. (0x03|0x0035) plen 5  #177 [hci1] 13.106982
        Num handles: 1
        Handle: 543 Address: DF:A9:FF:F6:B1:1A (OUI DF-A9-FF)
        Count: 1
< ACL Data TX: Handle 543 flags 0x00 dlen 21              #178 [hci1] 13.107050
      SMP: Pairing Confirm (0x03) len 16
        Confim value: f77cd81b1235739dad780ad77f3dc186
> HCI Event: Number of Completed Packets (0x13) plen 5    #179 [hci1] 13.276367
        Num handles: 1
        Handle: 543 Address: DF:A9:FF:F6:B1:1A (OUI DF-A9-FF)
        Count: 1
        #178: len 21 (0 Kb/s)
        Latency: 169 msec (68-173 msec ~168 msec)
> ACL Data RX: Handle 543 flags 0x02 dlen 21              #180 [hci1] 13.276724
      SMP: Pairing Random (0x04) len 16
        Random value: d7935aa33f4fc6e80000000000000000
< HCI Command: Host Number of Com.. (0x03|0x0035) plen 5  #181 [hci1] 13.287739
        Num handles: 1
        Handle: 543 Address: DF:A9:FF:F6:B1:1A (OUI DF-A9-FF)
        Count: 1
< ACL Data TX: Handle 543 flags 0x00 dlen 21              #182 [hci1] 13.287921
      SMP: Pairing Random (0x04) len 16
        Random value: 25a9493fd3ce4faf02be7293595bb7c6
> HCI Event: Number of Completed Packets (0x13) plen 5    #183 [hci1] 13.451193
        Num handles: 1
        Handle: 543 Address: DF:A9:FF:F6:B1:1A (OUI DF-A9-FF)
        Count: 1
        #182: len 21 (1 Kb/s)
        Latency: 163 msec (68-173 msec ~166 msec)
> ACL Data RX: Handle 543 flags 0x02 dlen 21              #184 [hci1] 13.539096
      SMP: Pairing Confirm (0x03) len 16
        Confim value: e10ef635352914c710310277c66d5737
< HCI Command: Host Number of Com.. (0x03|0x0035) plen 5  #185 [hci1] 13.547504
        Num handles: 1
        Handle: 543 Address: DF:A9:FF:F6:B1:1A (OUI DF-A9-FF)
        Count: 1
< ACL Data TX: Handle 543 flags 0x00 dlen 21              #186 [hci1] 13.547649
      SMP: Pairing Confirm (0x03) len 16
        Confim value: f468db482e3c2e3d99b7c4db755da439
> HCI Event: Number of Completed Packets (0x13) plen 5    #187 [hci1] 13.713853
        Num handles: 1
        Handle: 543 Address: DF:A9:FF:F6:B1:1A (OUI DF-A9-FF)
        Count: 1
        #186: len 21 (1 Kb/s)
        Latency: 166 msec (68-173 msec ~166 msec)
> ACL Data RX: Handle 543 flags 0x02 dlen 21              #188 [hci1] 13.714224
      SMP: Pairing Random (0x04) len 16
        Random value: 72c2dc2bc6cbd2b60000000000000000
< HCI Command: Host Number of Com.. (0x03|0x0035) plen 5  #189 [hci1] 13.727772
        Num handles: 1
        Handle: 543 Address: DF:A9:FF:F6:B1:1A (OUI DF-A9-FF)
        Count: 1
< ACL Data TX: Handle 543 flags 0x00 dlen 21              #190 [hci1] 13.727914
      SMP: Pairing Random (0x04) len 16
        Random value: 58f6b41f855a6f6c3560debd84e2affc
> HCI Event: Number of Completed Packets (0x13) plen 5    #191 [hci1] 13.888588
        Num handles: 1
        Handle: 543 Address: DF:A9:FF:F6:B1:1A (OUI DF-A9-FF)
        Count: 1
        #190: len 21 (1 Kb/s)
        Latency: 160 msec (68-173 msec ~163 msec)
> ACL Data RX: Handle 543 flags 0x02 dlen 21              #192 [hci1] 13.976635
      SMP: Pairing Confirm (0x03) len 16
        Confim value: 7419979bbf16add0e285e6fc05b916c4
< HCI Command: Host Number of Com.. (0x03|0x0035) plen 5  #193 [hci1] 13.987006
        Num handles: 1
        Handle: 543 Address: DF:A9:FF:F6:B1:1A (OUI DF-A9-FF)
        Count: 1
< ACL Data TX: Handle 543 flags 0x00 dlen 21              #194 [hci1] 13.987038
      SMP: Pairing Confirm (0x03) len 16
        Confim value: ea118675a0d7125ab6681071a4d59227
> HCI Event: Number of Completed Packets (0x13) plen 5    #195 [hci1] 14.151345
        Num handles: 1
        Handle: 543 Address: DF:A9:FF:F6:B1:1A (OUI DF-A9-FF)
        Count: 1
        #194: len 21 (1 Kb/s)
        Latency: 164 msec (68-173 msec ~163 msec)
> ACL Data RX: Handle 543 flags 0x02 dlen 21              #196 [hci1] 14.151659
      SMP: Pairing Random (0x04) len 16
        Random value: fd57f7c7b2eb0ad10000000000000000
< HCI Command: Host Number of Com.. (0x03|0x0035) plen 5  #197 [hci1] 14.167781
        Num handles: 1
        Handle: 543 Address: DF:A9:FF:F6:B1:1A (OUI DF-A9-FF)
        Count: 1
< ACL Data TX: Handle 543 flags 0x00 dlen 21              #198 [hci1] 14.167935
      SMP: Pairing Random (0x04) len 16
        Random value: b67e7216d5bf664139eda2b542549666
> HCI Event: Number of Completed Packets (0x13) plen 5    #199 [hci1] 14.326133
        Num handles: 1
        Handle: 543 Address: DF:A9:FF:F6:B1:1A (OUI DF-A9-FF)
        Count: 1
        #198: len 21 (1 Kb/s)
        Latency: 158 msec (68-173 msec ~161 msec)
> ACL Data RX: Handle 543 flags 0x02 dlen 21              #200 [hci1] 14.414056
      SMP: Pairing Confirm (0x03) len 16
        Confim value: f8f9ef0945b233921564c30314a2a9bb
< HCI Command: Host Number of Com.. (0x03|0x0035) plen 5  #201 [hci1] 14.427218
        Num handles: 1
        Handle: 543 Address: DF:A9:FF:F6:B1:1A (OUI DF-A9-FF)
        Count: 1
< ACL Data TX: Handle 543 flags 0x00 dlen 21              #202 [hci1] 14.427356
      SMP: Pairing Confirm (0x03) len 16
        Confim value: 51bd80525d1ad0b5c72a4773f7cee3c5
> HCI Event: Number of Completed Packets (0x13) plen 5    #203 [hci1] 14.588845
        Num handles: 1
        Handle: 543 Address: DF:A9:FF:F6:B1:1A (OUI DF-A9-FF)
        Count: 1
        #202: len 21 (1 Kb/s)
        Latency: 161 msec (68-173 msec ~161 msec)
> ACL Data RX: Handle 543 flags 0x02 dlen 21              #204 [hci1] 14.589142
      SMP: Pairing Random (0x04) len 16
        Random value: 9a38b4128ef69eb70000000000000000
< HCI Command: Host Number of Com.. (0x03|0x0035) plen 5  #205 [hci1] 14.607724
        Num handles: 1
        Handle: 543 Address: DF:A9:FF:F6:B1:1A (OUI DF-A9-FF)
        Count: 1
< ACL Data TX: Handle 543 flags 0x00 dlen 21              #206 [hci1] 14.607807
      SMP: Pairing Random (0x04) len 16
        Random value: ed17f76500c95219dd01e09d1e63f87b
> HCI Event: Number of Completed Packets (0x13) plen 5    #207 [hci1] 14.763687
        Num handles: 1
        Handle: 543 Address: DF:A9:FF:F6:B1:1A (OUI DF-A9-FF)
        Count: 1
        #206: len 21 (1 Kb/s)
        Latency: 155 msec (68-173 msec ~158 msec)
> ACL Data RX: Handle 543 flags 0x02 dlen 21              #208 [hci1] 14.851544
      SMP: Pairing Confirm (0x03) len 16
        Confim value: 2e4336b0d81cc865fed8c1a1cf572a5e
< HCI Command: Host Number of Com.. (0x03|0x0035) plen 5  #209 [hci1] 14.867126
        Num handles: 1
        Handle: 543 Address: DF:A9:FF:F6:B1:1A (OUI DF-A9-FF)
        Count: 1
< ACL Data TX: Handle 543 flags 0x00 dlen 21              #210 [hci1] 14.867179
      SMP: Pairing Confirm (0x03) len 16
        Confim value: 48d00832ef44bb1ad0cf9fbc4431fb52
> HCI Event: Number of Completed Packets (0x13) plen 5    #211 [hci1] 15.026341
        Num handles: 1
        Handle: 543 Address: DF:A9:FF:F6:B1:1A (OUI DF-A9-FF)
        Count: 1
        #210: len 21 (1 Kb/s)
        Latency: 159 msec (68-173 msec ~158 msec)
> ACL Data RX: Handle 543 flags 0x02 dlen 21              #212 [hci1] 15.026668
      SMP: Pairing Random (0x04) len 16
        Random value: 31a2078dfe6998880000000000000000
< HCI Command: Host Number of Com.. (0x03|0x0035) plen 5  #213 [hci1] 15.027013
        Num handles: 1
        Handle: 543 Address: DF:A9:FF:F6:B1:1A (OUI DF-A9-FF)
        Count: 1
< ACL Data TX: Handle 543 flags 0x00 dlen 21              #214 [hci1] 15.027049
      SMP: Pairing Random (0x04) len 16
        Random value: 81d35d47e1f6006d79c974bd9d9e1ee3
> HCI Event: Number of Completed Packets (0x13) plen 5    #215 [hci1] 15.201095
        Num handles: 1
        Handle: 543 Address: DF:A9:FF:F6:B1:1A (OUI DF-A9-FF)
        Count: 1
        #214: len 21 (0 Kb/s)
        Latency: 174 msec (68-174 msec ~166 msec)
> ACL Data RX: Handle 543 flags 0x02 dlen 21              #216 [hci1] 15.288955
      SMP: Pairing Confirm (0x03) len 16
        Confim value: 1d122479d720f760d7ceb2a4b4c53e01
< HCI Command: Host Number of Com.. (0x03|0x0035) plen 5  #217 [hci1] 15.307511
        Num handles: 1
        Handle: 543 Address: DF:A9:FF:F6:B1:1A (OUI DF-A9-FF)
        Count: 1
< ACL Data TX: Handle 543 flags 0x00 dlen 21              #218 [hci1] 15.307634
      SMP: Pairing Confirm (0x03) len 16
        Confim value: 8fc66315421695d926c90d3b5a8e8766
> HCI Event: Number of Completed Packets (0x13) plen 5    #219 [hci1] 15.463868
        Num handles: 1
        Handle: 543 Address: DF:A9:FF:F6:B1:1A (OUI DF-A9-FF)
        Count: 1
        #218: len 21 (1 Kb/s)
        Latency: 156 msec (68-174 msec ~161 msec)
> ACL Data RX: Handle 543 flags 0x02 dlen 21              #220 [hci1] 15.464142
      SMP: Pairing Random (0x04) len 16
        Random value: 9890f513068324cc0000000000000000
< HCI Command: Host Number of Com.. (0x03|0x0035) plen 5  #221 [hci1] 15.467428
        Num handles: 1
        Handle: 543 Address: DF:A9:FF:F6:B1:1A (OUI DF-A9-FF)
        Count: 1
< ACL Data TX: Handle 543 flags 0x00 dlen 21              #222 [hci1] 15.467494
      SMP: Pairing Random (0x04) len 16
        Random value: e7f7e0c2476823e41736a7e381bafb7c
> HCI Event: Number of Completed Packets (0x13) plen 5    #223 [hci1] 15.638653
        Num handles: 1
        Handle: 543 Address: DF:A9:FF:F6:B1:1A (OUI DF-A9-FF)
        Count: 1
        #222: len 21 (0 Kb/s)
        Latency: 171 msec (68-174 msec ~166 msec)
> ACL Data RX: Handle 543 flags 0x02 dlen 21              #224 [hci1] 15.726543
      SMP: Pairing Confirm (0x03) len 16
        Confim value: 20dad34f55642881fd09bf69158a88a1
< HCI Command: Host Number of Com.. (0x03|0x0035) plen 5  #225 [hci1] 15.726969
        Num handles: 1
        Handle: 543 Address: DF:A9:FF:F6:B1:1A (OUI DF-A9-FF)
        Count: 1
< ACL Data TX: Handle 543 flags 0x00 dlen 21              #226 [hci1] 15.727023
      SMP: Pairing Confirm (0x03) len 16
        Confim value: bb3660f5775936130c43471bf6ed766b
> HCI Event: Number of Completed Packets (0x13) plen 5    #227 [hci1] 15.901438
        Num handles: 1
        Handle: 543 Address: DF:A9:FF:F6:B1:1A (OUI DF-A9-FF)
        Count: 1
        #226: len 21 (0 Kb/s)
        Latency: 174 msec (68-174 msec ~170 msec)
> ACL Data RX: Handle 543 flags 0x02 dlen 21              #228 [hci1] 15.901640
      SMP: Pairing Random (0x04) len 16
        Random value: 7f4e193418dad1050000000000000000
< HCI Command: Host Number of Com.. (0x03|0x0035) plen 5  #229 [hci1] 15.907741
        Num handles: 1
        Handle: 543 Address: DF:A9:FF:F6:B1:1A (OUI DF-A9-FF)
        Count: 1
