Bluetooth monitor ver 5.72
= Note: Linux version 6.14.0-36-generic (x86_64)                       0.978506
= Note: Bluetooth subsystem version 2.22                               0.978508
= New Index: 00:00:00:00:00:00 (Primary,UART,hci1)              [hci1] 0.978509
= New Index: 48:5F:99:8E:E0:64 (Primary,USB,hci0)               [hci0] 0.978510
= Open Index: 00:00:00:00:00:00                                 [hci1] 1.092170
= Index Info: 00:00:00:00:00:00 (Nordic Semiconductor ASA)      [hci1] 1.092184
@ USER Open: main (privileged) version 2.22            {0x0001} [hci1] 1.092194
< HCI Command: Reset (0x03|0x0003) plen 0                    #1 [hci1] 1.093276
> HCI Event: Command Complete (0x0e) plen 4                  #2 [hci1] 1.093888
      Reset (0x03|0x0003) ncmd 1
        Status: Success (0x00)
< HCI Command: Read Local Supported... (0x04|0x0003) plen 0  #3 [hci1] 1.111979
> HCI Event: Command Complete (0x0e) plen 12                 #4 [hci1] 1.112545
      Read Local Supported Features (0x04|0x0003) ncmd 1
        Status: Success (0x00)
        Features: 0x00 0x00 0x00 0x00 0x60 0x00 0x00 0x00
          BR/EDR Not Supported
          LE Supported (Controller)
< HCI Command: Read Local Version In.. (0x04|0x0001) plen 0  #5 [hci1] 1.131748
> HCI Event: Command Complete (0x0e) plen 12                 #6 [hci1] 1.132172
      Read Local Version Information (0x04|0x0001) ncmd 1
        Status: Success (0x00)
        HCI version: Reserved (0x0f) - Revision 12393 (0x3069)
        LMP version: Reserved (0x0f) - Subversion 12393 (0x3069)
        Manufacturer: Nordic Semiconductor ASA (89)
< HCI Command: Read Local Supported... (0x04|0x0002) plen 0  #7 [hci1] 1.151649
> HCI Event: Command Complete (0x0e) plen 68                 #8 [hci1] 1.152756
      Read Local Supported Commands (0x04|0x0002) ncmd 1
        Status: Success (0x00)
        Commands: 119 entries
          Disconnect (Octet 0 - Bit 5)
          Read Remote Version Information (Octet 2 - Bit 7)
          Set Event Mask (Octet 5 - Bit 6)
          Reset (Octet 5 - Bit 7)
          Read Connection Accept Timeout (Octet 7 - Bit 2)
          Write Connection Accept Timeout (Octet 7 - Bit 3)
          Read Transmit Power Level (Octet 10 - Bit 2)
          Set Controller To Host Flow Control (Octet 10 - Bit 5)
          Host Buffer Size (Octet 10 - Bit 6)
          Host Number of Completed Packets (Octet 10 - Bit 7)
          Read Local Version Information (Octet 14 - Bit 3)
          Read Local Supported Features (Octet 14 - Bit 5)
          Read BD ADDR (Octet 15 - Bit 1)
          Read RSSI (Octet 15 - Bit 5)
          Set Event Mask Page 2 (Octet 22 - Bit 2)
          LE Set Event Mask (Octet 25 - Bit 0)
          LE Read Buffer Size (Octet 25 - Bit 1)
          LE Read Local Supported Features (Octet 25 - Bit 2)
          LE Set Random Address (Octet 25 - Bit 4)
          LE Set Advertising Parameters (Octet 25 - Bit 5)
          LE Read Advertising Channel TX Power (Octet 25 - Bit 6)
          LE Set Advertising Data (Octet 25 - Bit 7)
          LE Set Scan Response Data (Octet 26 - Bit 0)
          LE Set Advertise Enable (Octet 26 - Bit 1)
          LE Set Scan Parameters (Octet 26 - Bit 2)
          LE Set Scan Enable (Octet 26 - Bit 3)
          LE Create Connection (Octet 26 - Bit 4)
          LE Create Connection Cancel (Octet 26 - Bit 5)
          LE Read Accept List Size (Octet 26 - Bit 6)
          LE Clear Accept List (Octet 26 - Bit 7)
          LE Add Device To Accept List (Octet 27 - Bit 0)
          LE Remove Device From Accept List (Octet 27 - Bit 1)
          LE Connection Update (Octet 27 - Bit 2)
          LE Set Host Channel Classification (Octet 27 - Bit 3)
          LE Read Channel Map (Octet 27 - Bit 4)
          LE Read Remote Used Features (Octet 27 - Bit 5)
          LE Encrypt (Octet 27 - Bit 6)
          LE Rand (Octet 27 - Bit 7)
          LE Start Encryption (Octet 28 - Bit 0)
          LE Long Term Key Request Reply (Octet 28 - Bit 1)
          LE Long Term Key Request Neg Reply (Octet 28 - Bit 2)
          LE Read Supported States (Octet 28 - Bit 3)
          LE Receiver Test (Octet 28 - Bit 4)
          LE Transmitter Test (Octet 28 - Bit 5)
          LE Test End (Octet 28 - Bit 6)
          Read Authenticated Payload Timeout (Octet 32 - Bit 4)
          Write Authenticated Payload Timeout (Octet 32 - Bit 5)
          LE Set Data Length (Octet 33 - Bit 6)
          LE Read Suggested Default Data Length (Octet 33 - Bit 7)
          LE Write Suggested Default Data Length (Octet 34 - Bit 0)
          LE Add Device To Resolving List (Octet 34 - Bit 3)
          LE Remove Device From Resolving List (Octet 34 - Bit 4)
          LE Clear Resolving List (Octet 34 - Bit 5)
          LE Read Resolving List Size (Octet 34 - Bit 6)
          LE Set Address Resolution Enable (Octet 35 - Bit 1)
          LE Set Resolvable Private Address Timeout (Octet 35 - Bit 2)
          LE Read Maximum Data Length (Octet 35 - Bit 3)
          LE Read PHY (Octet 35 - Bit 4)
          LE Set Default PHY (Octet 35 - Bit 5)
          LE Set PHY (Octet 35 - Bit 6)
          LE Enhanced Receiver Test (Octet 35 - Bit 7)
          LE Enhanced Transmitter Test (Octet 36 - Bit 0)
          LE Set Advertising Set Random Address (Octet 36 - Bit 1)
          LE Set Extended Advertising Parameters (Octet 36 - Bit 2)
          LE Set Extended Advertising Data (Octet 36 - Bit 3)
          LE Set Extended Scan Response Data (Octet 36 - Bit 4)
          LE Set Extended Advertising Enable (Octet 36 - Bit 5)
          LE Read Maximum Advertising Data Length (Octet 36 - Bit 6)
          LE Read Number of Supported Advertising Sets (Octet 36 - Bit 7)
          LE Remove Advertising Set (Octet 37 - Bit 0)
          LE Clear Advertising Sets (Octet 37 - Bit 1)
          LE Set Periodic Advertising Parameters (Octet 37 - Bit 2)
          LE Set Periodic Advertising Data (Octet 37 - Bit 3)
          LE Set Periodic Advertising Enable (Octet 37 - Bit 4)
          LE Set Extended Scan Parameters (Octet 37 - Bit 5)
          LE Set Extended Scan Enable (Octet 37 - Bit 6)
          LE Extended Create Connection (Octet 37 - Bit 7)
          LE Periodic Advertising Create Sync (Octet 38 - Bit 0)
          LE Periodic Advertising Create Sync Cancel (Octet 38 - Bit 1)
          LE Periodic Advertising Terminate Sync (Octet 38 - Bit 2)
          LE Add Device To Periodic Advertiser List (Octet 38 - Bit 3)
          LE Remove Device From Periodic Advertiser List (Octet 38 - Bit 4)
          LE Clear Periodic Advertiser List (Octet 38 - Bit 5)
          LE Read Periodic Advertiser List Size (Octet 38 - Bit 6)
          LE Read Transmit Power (Octet 38 - Bit 7)
          LE Read RF Path Compensation (Octet 39 - Bit 0)
          LE Write RF Path Compensation (Octet 39 - Bit 1)
          LE Set Privacy Mode (Octet 39 - Bit 2)
          LE Periodic Advertising Receive Enable (Octet 40 - Bit 5)
          LE Periodic Advertising Sync Transfer (Octet 40 - Bit 6)
          LE Periodic Advertising Set Info Transfer (Octet 40 - Bit 7)
          LE Periodic Advertising Sync Transfer Parameters (Octet 41 - Bit 0)
          LE Set Default Periodic Advertisng Sync Transfer Parameters (Octet 41 - Bit 1)
          LE Read Buffer v2 (Octet 41 - Bit 5)
          LE Read ISO TX Sync (Octet 41 - Bit 6)
          LE Set Connected Isochronous Group Parameters (Octet 41 - Bit 7)
          LE Set Connected Isochronous Group Parameters Test (Octet 42 - Bit 0)
          LE Create Connected Isochronous Stream (Octet 42 - Bit 1)
          LE Remove Connected Isochronous Group (Octet 42 - Bit 2)
          LE Accept Connected Isochronous Stream Request (Octet 42 - Bit 3)
          LE Reject Connected Isochronous Stream Request (Octet 42 - Bit 4)
          LE Create Broadcast Isochronous Group (Octet 42 - Bit 5)
          LE Create Broadcast Isochronous Group Test (Octet 42 - Bit 6)
          LE Terminate Broadcast Isochronous Group (Octet 42 - Bit 7)
          LE Broadcast Isochronous Group Create Sync (Octet 43 - Bit 0)
          LE Broadcast Isochronous Group Terminate Sync (Octet 43 - Bit 1)
          LE Request Peer SCA (Octet 43 - Bit 2)
          LE Setup Isochronous Data Path (Octet 43 - Bit 3)
          LE Remove Isochronous Data Path (Octet 43 - Bit 4)
          LE Isochronous Transmit Test (Octet 43 - Bit 5)
          LE Isochronous Receive Test (Octet 43 - Bit 6)
          LE Isochronous Read Test Counters (Octet 43 - Bit 7)
          LE Isochronous Read Test Counters (Octet 44 - Bit 0)
          LE Set Host Feature (Octet 44 - Bit 1)
          Octet 44 - Bit 2 
          Octet 45 - Bit 6 
          Octet 46 - Bit 0 
          Octet 46 - Bit 1 
          Octet 46 - Bit 2 
< HCI Command: Host Buffer Size (0x03|0x0033) plen 7         #9 [hci1] 1.171661
        ACL MTU: 255  ACL max packet: 16
        SCO MTU: 0    SCO max packet: 0
> HCI Event: Command Complete (0x0e) plen 4                 #10 [hci1] 1.172152
      Host Buffer Size (0x03|0x0033) ncmd 1
        Status: Success (0x00)
< HCI Command: Set Controller To Ho.. (0x03|0x0031) plen 1  #11 [hci1] 1.191655
        Flow control: ACL Data Packets (0x01)
> HCI Event: Command Complete (0x0e) plen 4                 #12 [hci1] 1.192091
      Set Controller To Host Flow Control (0x03|0x0031) ncmd 1
        Status: Success (0x00)
< HCI Command: LE Read Local Suppor.. (0x08|0x0003) plen 0  #13 [hci1] 1.211646
> HCI Event: Command Complete (0x0e) plen 12                #14 [hci1] 1.212109
      LE Read Local Supported Features (0x08|0x0003) ncmd 1
        Status: Success (0x00)
        Features: 0xfd 0x79 0x00 0xf7 0x30 0x01 0x00 0x00
          LE Encryption
          Extended Reject Indication
          Peripheral-initiated Features Exchange
          LE Ping
          LE Data Packet Length Extension
          LL Privacy
          Extended Scanner Filter Policies
          LE 2M PHY
          LE Coded PHY
          LE Extended Advertising
          LE Periodic Advertising
          Channel Selection Algorithm #2
          Periodic Advertising Sync Transfer - Sender
          Periodic Advertising Sync Transfer - Recipient
          Sleep Clock Accuracy Updates
          Connected Isochronous Stream - Central
          Connected Isochronous Stream - Peripheral
          Isochronous Broadcaster
          Synchronized Receiver
          Periodic Advertising ADI support
          Connection Subrating
          Unknown features (0x0000010000000000)
< HCI Command: LE Set Host Feature (0x08|0x0074) plen 2     #15 [hci1] 1.231660
        Bit Number: 32
          Connected Isochronous Stream (Host Support)
        Bit Value: 1
> HCI Event: Command Complete (0x0e) plen 4                 #16 [hci1] 1.232116
      LE Set Host Feature (0x08|0x0074) ncmd 1
        Status: Success (0x00)
< HCI Command: LE Read Buffer v2 (0x08|0x0060) plen 0       #17 [hci1] 1.251537
> HCI Event: Command Complete (0x0e) plen 10                #18 [hci1] 1.252037
      LE Read Buffer v2 (0x08|0x0060) ncmd 1
        Status: Success (0x00)
        ACL MTU: 27
        ACL max packet: 3
        ISO MTU: 318
        ISO max packet: 3
< HCI Command: LE Read Maximum Adve.. (0x08|0x003a) plen 0  #19 [hci1] 1.271677
> HCI Event: Command Complete (0x0e) plen 6                 #20 [hci1] 1.272084
      LE Read Maximum Advertising Data Length (0x08|0x003a) ncmd 1
        Status: Success (0x00)
        Max length: 1650
< HCI Command: LE Read Supported St.. (0x08|0x001c) plen 0  #21 [hci1] 1.291625
> HCI Event: Command Complete (0x0e) plen 12                #22 [hci1] 1.292075
      LE Read Supported States (0x08|0x001c) ncmd 1
        Status: Success (0x00)
        States: 0x000003ff3e0306ff
          Non-connectable Advertising State
          Scannable Advertising State
          Connectable Advertising State
          High Duty Cycle Directed Advertising State
          Passive Scanning State
          Active Scanning State
          Initiating State
            and Connection State (Central Role)
          Connection State (Peripheral Role)
          Scannable Advertising State
            and Passive Scanning State
          Connectable Advertising State
            and Passive Scanning State
          Non-connectable Advertising State
            and Initiating State
          Scannable Advertising State
            and Initiating State
          Active Scanning State
            and Connection State (Central Role)
          Passive Scanning State
            and Connection State (Peripheral Role)
          Active Scanning State
            and Connection State (Peripheral Role)
          Initiating State
            and Connection State (Central Role)
            and Central Role & Central Role
          Low Duty Cycle Directed Advertising State
          Connectable Advertising State
            and Initiating State
            and Central Role & Peripheral Role
          High Duty Cycle Directed Advertising State
            and Initiating State
            and Central Role & Peripheral Role
          Low Duty Cycle Directed Advertising State
            and Initiating State
            and Central Role & Peripheral Role
          Connectable Advertising State
            and Connection State (Central Role)
            and Central Role & Peripheral Role
          High Duty Cycle Directed Advertising State
            and Connection State (Central Role)
            and Central Role & Peripheral Role
          Low Duty Cycle Directed Advertising State
            and Connection State (Central Role)
            and Central Role & Peripheral Role
          Connectable Advertising State
            and Connection State (Peripheral Role)
            and Central Role & Peripheral Role
          High Duty Cycle Directed Advertising State
            and Connection State (Peripheral Role)
            and Peripheral Role & Peripheral Role
          Low Duty Cycle Directed Advertising State
            and Connection State (Peripheral Role)
            and Peripheral Role & Peripheral Role
          Initiating State
            and Connection State (Peripheral Role)
            and Central Role & Peripheral Role
< HCI Command: LE Read Maximum Data.. (0x08|0x002f) plen 0  #23 [hci1] 1.311593
> HCI Event: Command Complete (0x0e) plen 12                #24 [hci1] 1.312092
      LE Read Maximum Data Length (0x08|0x002f) ncmd 1
        Status: Success (0x00)
        Max TX octets: 251
        Max TX time: 2704
        Max RX octets: 251
        Max RX time: 2704
< HCI Command: LE Write Suggested D.. (0x08|0x0024) plen 4  #25 [hci1] 1.331653
        TX octets: 251
        TX time: 2704
> HCI Event: Command Complete (0x0e) plen 4                 #26 [hci1] 1.332085
      LE Write Suggested Default Data Length (0x08|0x0024) ncmd 1
        Status: Success (0x00)
< HCI Command: LE Read Resolving Li.. (0x08|0x002a) plen 0  #27 [hci1] 1.351622
> HCI Event: Command Complete (0x0e) plen 5                 #28 [hci1] 1.352086
      LE Read Resolving List Size (0x08|0x002a) ncmd 1
        Status: Success (0x00)
        Size: 8
< HCI Command: LE Set Event Mask (0x08|0x0001) plen 8       #29 [hci1] 1.371626
        Mask: 0x000002023f87fa5e
          LE Advertising Report
          LE Connection Update Complete
          LE Read Remote Used Features Complete
          LE Long Term Key Request
          LE Data Length Change
          LE Enhanced Connection Complete
          LE PHY Update Complete
          LE Extended Advertising Report
          LE Periodic Advertising Sync Established
          LE Periodic Advertising Report
          LE Periodic Advertising Sync Lost
          LE Extended Scan Timeout
          LE Extended Advertising Set Terminated
          LE Scan Request Received
          LE Periodic Advertising Sync Transfer Rvc
          LE CIS Established
          LE CIS Request
          LE Create BIG Complete
          LE Terminate BIG Complete
          LE BIG Sync Estabilished Complete
          LE BIG Sync Lost
          LE BIG Info Advertising Report
          Unknown mask (0x0000020000000000)
> HCI Event: Command Complete (0x0e) plen 4                 #30 [hci1] 1.372200
      LE Set Event Mask (0x08|0x0001) ncmd 1
        Status: Success (0x00)
< HCI Command: Set Event Mask (0x03|0x0001) plen 8          #31 [hci1] 1.391656
        Mask: 0x2000800002008890
          Disconnection Complete
          Encryption Change
          Read Remote Version Information Complete
          Hardware Error
          Data Buffer Overflow
          Encryption Key Refresh Complete
          LE Meta
> HCI Event: Command Complete (0x0e) plen 4                 #32 [hci1] 1.392189
      Set Event Mask (0x03|0x0001) ncmd 1
        Status: Success (0x00)
< HCI Command: Read BD ADDR (0x04|0x0009) plen 0            #33 [hci1] 1.411621
> HCI Event: Command Complete (0x0e) plen 10                #34 [hci1] 1.412118
      Read BD ADDR (0x04|0x0009) ncmd 1
        Status: Success (0x00)
        Address: 00:00:00:00:00:00 (OUI 00-00-00)
< HCI Command: LE Set Random Address (0x08|0x0005) plen 6   #35 [hci1] 1.431656
        Address: D5:B6:CC:31:DB:3B (Static)
> HCI Event: Command Complete (0x0e) plen 4                 #36 [hci1] 1.432209
      LE Set Random Address (0x08|0x0005) ncmd 1
        Status: Success (0x00)
< HCI Command: LE Set Extended Adv.. (0x08|0x0036) plen 25  #37 [hci1] 2.121630
        Handle: 0x00
        Properties: 0x0001
          Connectable
        Min advertising interval: 100.000 msec (0x00a0)
        Max advertising interval: 150.000 msec (0x00f0)
        Channel map: 37, 38, 39 (0x07)
        Own address type: Random (0x01)
        Peer address type: Public (0x00)
        Peer address: 00:00:00:00:00:00 (OUI 00-00-00)
        Filter policy: Allow Scan Request from Any, Allow Connect Request from Any (0x00)
        TX power: Host has no preference (0x7f)
        Primary PHY: LE 1M (0x01)
        Secondary max skip: 0x00
        Secondary PHY: LE 2M (0x02)
        SID: 0x00
        Scan request notifications: Disabled (0x00)
> HCI Event: Command Complete (0x0e) plen 5                 #38 [hci1] 2.122450
      LE Set Extended Advertising Parameters (0x08|0x0036) ncmd 1
        Status: Success (0x00)
        TX power (selected): 0 dbm (0x00)
< HCI Command: LE Set Advertising S.. (0x08|0x0035) plen 7  #39 [hci1] 2.131636
        Advertising handle: 0x00
        Advertising random address: D5:B6:CC:31:DB:3B (Static)
> HCI Event: Command Complete (0x0e) plen 4                 #40 [hci1] 2.132160
      LE Set Advertising Set Random Address (0x08|0x0035) ncmd 1
        Status: Success (0x00)
< HCI Command: LE Set Extended Adv.. (0x08|0x0037) plen 39  #41 [hci1] 2.151644
        Handle: 0x00
        Operation: Complete extended advertising data (0x03)
        Fragment preference: Minimize fragmentation (0x01)
        Data length: 0x23
        Flags: 0x06
          LE General Discoverable Mode
          BR/EDR Not Supported
        Name (complete): Tester_F6B11A
        Flags: 0x06
          LE General Discoverable Mode
          BR/EDR Not Supported
        16-bit Service UUIDs (complete): 1 entry
          Audio Stream Control (0x184e)
        Service Data: Audio Stream Control (0x184e)
          Data: 01ff0fff0f00
> HCI Event: Command Complete (0x0e) plen 4                 #42 [hci1] 2.152586
      LE Set Extended Advertising Data (0x08|0x0037) ncmd 1
        Status: Success (0x00)
< HCI Command: LE Set Extended Adve.. (0x08|0x0039) plen 6  #43 [hci1] 2.171639
        Extended advertising: Enabled (0x01)
        Number of sets: 1 (0x01)
        Entry 0
          Handle: 0x00
          Duration: 0 ms (0x00)
          Max ext adv events: 0
> HCI Event: Command Complete (0x0e) plen 4                 #44 [hci1] 2.172235
      LE Set Extended Advertising Enable (0x08|0x0039) ncmd 1
        Status: Success (0x00)
> HCI Event: LE Meta Event (0x3e) plen 31                   #45 [hci1] 4.610355
      LE Enhanced Connection Complete (0x0a)
        Status: Success (0x00)
        Handle: 831
        Role: Peripheral (0x01)
        Peer address type: Public (0x00)
        Peer address: DF:A9:FF:F6:B1:1A (OUI DF-A9-FF)
        Local resolvable private address: 00:00:00:00:00:00 (Non-Resolvable)
        Peer resolvable private address: 00:00:00:00:00:00 (Non-Resolvable)
        Connection interval: 80.00 msec (0x0040)
        Connection latency: 0 (0x0000)
        Supervision timeout: 25120 msec (0x09d0)
        Central clock accuracy: 0x01
> HCI Event: LE Meta Event (0x3e) plen 6                    #46 [hci1] 4.610486
      LE Advertising Set Terminated (0x12)
        Status: Success (0x00)
        Handle: 0
        Connection handle: 831
        Number of completed extended advertising events: 0
< HCI Command: LE Read Remote Used... (0x08|0x0016) plen 2  #47 [hci1] 4.612728
        Handle: 831 Address: DF:A9:FF:F6:B1:1A (OUI DF-A9-FF)
< ACL Data TX: Handle 831 flags 0x00 dlen 7                 #48 [hci1] 4.612753
      ATT: Exchange MTU Request (0x02) len 2
        Client RX MTU: 251
> HCI Event: Command Status (0x0f) plen 4                   #49 [hci1] 4.613256
      LE Read Remote Used Features (0x08|0x0016) ncmd 1
        Status: Success (0x00)
> HCI Event: Number of Completed Packets (0x13) plen 5      #50 [hci1] 4.772376
        Num handles: 1
        Handle: 831 Address: DF:A9:FF:F6:B1:1A (OUI DF-A9-FF)
        Count: 1
        #48: len 7 (0 Kb/s)
        Latency: 159 msec (159-159 msec ~159 msec)
> HCI Event: LE Meta Event (0x3e) plen 12                   #51 [hci1] 4.852693
      LE Read Remote Used Features (0x04)
        Status: Success (0x00)
        Handle: 831 Address: DF:A9:FF:F6:B1:1A (OUI DF-A9-FF)
        Features: 0x2d 0x49 0x00 0xf7 0x67 0xd9 0x00 0x80
          LE Encryption
          Extended Reject Indication
          Peripheral-initiated Features Exchange
          LE Data Packet Length Extension
          LE 2M PHY
          LE Coded PHY
          Channel Selection Algorithm #2
          Periodic Advertising Sync Transfer - Sender
          Periodic Advertising Sync Transfer - Recipient
          Sleep Clock Accuracy Updates
          Connected Isochronous Stream - Central
          Connected Isochronous Stream - Peripheral
          Isochronous Broadcaster
          Synchronized Receiver
          Connected Isochronous Stream (Host Support)
          LE Power Control Request
          LE Power Control Request
          Connection Subrating
          Connection Subrating (Host Support)
          Unknown features (0x8000d90000000000)
< HCI Command: LE Remove Advertisin.. (0x08|0x003c) plen 1  #52 [hci1] 5.252161
        Handle: 0
> ACL Data RX: Handle 831 flags 0x02 dlen 7                 #53 [hci1] 5.252409
      ATT: Exchange MTU Request (0x02) len 2
        Client RX MTU: 64
> HCI Event: Command Complete (0x0e) plen 4                 #54 [hci1] 5.252608
      LE Remove Advertising Set (0x08|0x003c) ncmd 1
        Status: Success (0x00)
> ACL Data RX: Handle 831 flags 0x02 dlen 7                 #55 [hci1] 5.252853
      ATT: Exchange MTU Response (0x03) len 2
        Server RX MTU: 64
< HCI Command: LE Set Extended Adv.. (0x08|0x0036) plen 25  #56 [hci1] 5.271990
        Handle: 0x00
        Properties: 0x0001
          Connectable
        Min advertising interval: 100.000 msec (0x00a0)
        Max advertising interval: 150.000 msec (0x00f0)
        Channel map: 37, 38, 39 (0x07)
        Own address type: Random (0x01)
        Peer address type: Public (0x00)
        Peer address: 00:00:00:00:00:00 (OUI 00-00-00)
        Filter policy: Allow Scan Request from Any, Allow Connect Request from Any (0x00)
        TX power: Host has no preference (0x7f)
        Primary PHY: LE 1M (0x01)
        Secondary max skip: 0x00
        Secondary PHY: LE 2M (0x02)
        SID: 0x01
        Scan request notifications: Disabled (0x00)
< HCI Command: Host Number of Compl.. (0x03|0x0035) plen 5  #57 [hci1] 5.272229
        Num handles: 1
        Handle: 831 Address: DF:A9:FF:F6:B1:1A (OUI DF-A9-FF)
        Count: 1
< ACL Data TX: Handle 831 flags 0x00 dlen 7                 #58 [hci1] 5.272283
      ATT: Exchange MTU Response (0x03) len 2
        Server RX MTU: 251
< HCI Command: Host Number of Compl.. (0x03|0x0035) plen 5  #59 [hci1] 5.272359
        Num handles: 1
        Handle: 831 Address: DF:A9:FF:F6:B1:1A (OUI DF-A9-FF)
        Count: 1
> HCI Event: Command Complete (0x0e) plen 5                 #60 [hci1] 5.272953
      LE Set Extended Advertising Parameters (0x08|0x0036) ncmd 1
        Status: Success (0x00)
        TX power (selected): 0 dbm (0x00)
< HCI Command: LE Set Advertising S.. (0x08|0x0035) plen 7  #61 [hci1] 5.291706
        Advertising handle: 0x00
        Advertising random address: D5:B6:CC:31:DB:3B (Static)
> HCI Event: Command Complete (0x0e) plen 4                 #62 [hci1] 5.292263
      LE Set Advertising Set Random Address (0x08|0x0035) ncmd 1
        Status: Success (0x00)
< HCI Command: LE Set Extended Adv.. (0x08|0x0037) plen 39  #63 [hci1] 5.311620
        Handle: 0x00
        Operation: Complete extended advertising data (0x03)
        Fragment preference: Minimize fragmentation (0x01)
        Data length: 0x23
        Flags: 0x06
          LE General Discoverable Mode
          BR/EDR Not Supported
        Name (complete): Tester_F6B11A
        Flags: 0x06
          LE General Discoverable Mode
          BR/EDR Not Supported
        16-bit Service UUIDs (complete): 1 entry
          Audio Stream Control (0x184e)
        Service Data: Audio Stream Control (0x184e)
          Data: 01ff0fff0f00
> HCI Event: Command Complete (0x0e) plen 4                 #64 [hci1] 5.312507
      LE Set Extended Advertising Data (0x08|0x0037) ncmd 1
        Status: Success (0x00)
< HCI Command: LE Set Extended Adve.. (0x08|0x0039) plen 6  #65 [hci1] 5.331683
        Extended advertising: Enabled (0x01)
        Number of sets: 1 (0x01)
        Entry 0
          Handle: 0x00
          Duration: 0 ms (0x00)
          Max ext adv events: 0
> HCI Event: Command Complete (0x0e) plen 4                 #66 [hci1] 5.332263
      LE Set Extended Advertising Enable (0x08|0x0039) ncmd 1
        Status: Success (0x00)
> HCI Event: Number of Completed Packets (0x13) plen 5      #67 [hci1] 5.412418
        Num handles: 1
        Handle: 831 Address: DF:A9:FF:F6:B1:1A (OUI DF-A9-FF)
        Count: 1
        #58: len 7 (0 Kb/s)
        Latency: 140 msec (140-159 msec ~149 msec)
> ACL Data RX: Handle 831 flags 0x02 dlen 11                #68 [hci1] 7.412788
      SMP: Pairing Request (0x01) len 6
        IO capability: KeyboardDisplay (0x04)
        OOB data: Authentication data not present (0x00)
        Authentication requirement: Bonding, No MITM, SC, No Keypresses (0x09)
        Max encryption key size: 16
        Initiator key distribution: EncKey IdKey Sign (0x07)
        Responder key distribution: EncKey IdKey Sign (0x07)
< HCI Command: Host Number of Compl.. (0x03|0x0035) plen 5  #69 [hci1] 7.432119
        Num handles: 1
        Handle: 831 Address: DF:A9:FF:F6:B1:1A (OUI DF-A9-FF)
        Count: 1
< ACL Data TX: Handle 831 flags 0x00 dlen 11                #70 [hci1] 7.432243
      SMP: Pairing Response (0x02) len 6
        IO capability: NoInputNoOutput (0x03)
        OOB data: Authentication data not present (0x00)
        Authentication requirement: Bonding, No MITM, SC, No Keypresses (0x09)
        Max encryption key size: 16
        Initiator key distribution: IdKey (0x02)
        Responder key distribution: <none> (0x00)
> HCI Event: Number of Completed Packets (0x13) plen 5      #71 [hci1] 7.572418
        Num handles: 1
        Handle: 831 Address: DF:A9:FF:F6:B1:1A (OUI DF-A9-FF)
        Count: 1
        #70: len 11 (0 Kb/s)
        Latency: 140 msec (140-159 msec ~145 msec)
> ACL Data RX: Handle 831 flags 0x02 dlen 27                #72 [hci1] 7.572741
> ACL Data RX: Handle 831 flags 0x01 dlen 27                #73 [hci1] 7.573125
> ACL Data RX: Handle 831 flags 0x01 dlen 15                #74 [hci1] 7.573421
      SMP: Pairing Public Key (0x0c) len 64
        X: 0e2792e7c93994beaa00c1f21937d938e9965227fc87fd4401ee7b71379ceb1b
        Y: 6b4ae0fc9348133d47b7d42f29aab2c06e1e5b16962e6f11713f68c308d4ea6b
< HCI Command: Host Number of Compl.. (0x03|0x0035) plen 5  #75 [hci1] 7.592319
        Num handles: 1
        Handle: 831 Address: DF:A9:FF:F6:B1:1A (OUI DF-A9-FF)
        Count: 1
< HCI Command: Host Number of Compl.. (0x03|0x0035) plen 5  #76 [hci1] 7.592527
        Num handles: 1
        Handle: 831 Address: DF:A9:FF:F6:B1:1A (OUI DF-A9-FF)
        Count: 1
< HCI Command: Host Number of Compl.. (0x03|0x0035) plen 5  #77 [hci1] 7.592826
        Num handles: 1
        Handle: 831 Address: DF:A9:FF:F6:B1:1A (OUI DF-A9-FF)
        Count: 1
< ACL Data TX: Handle 831 flags 0x00 dlen 27                #78 [hci1] 7.592917
< ACL Data TX: Handle 831 flags 0x01 dlen 27                #79 [hci1] 7.592934
< ACL Data TX: Handle 831 flags 0x01 dlen 15                #80 [hci1] 7.592982
      SMP: Pairing Public Key (0x0c) len 64
        X: 98308440221e2d910f0e54b71e7ec652857aa9b5a0dc65028824cc19db1226e9
        Y: 67a4816bcb62efb21701e31fdb27561a6217575fb007a8bbdabe7e28b6f68482
> HCI Event: Number of Completed Packets (0x13) plen 5      #81 [hci1] 7.652800
        Num handles: 1
        Handle: 831 Address: DF:A9:FF:F6:B1:1A (OUI DF-A9-FF)
        Count: 1
        #78: len 27 (3 Kb/s)
        Latency: 59 msec (59-159 msec ~102 msec)
> HCI Event: Number of Completed Packets (0x13) plen 5      #82 [hci1] 7.653294
        Num handles: 1
        Handle: 831 Address: DF:A9:FF:F6:B1:1A (OUI DF-A9-FF)
        Count: 1
        #79: len 27 (3 Kb/s)
        Latency: 60 msec (59-159 msec ~81 msec)
< ACL Data TX: Handle 831 flags 0x00 dlen 21                #83 [hci1] 7.672013
      SMP: Pairing Confirm (0x03) len 16
        Confim value: 6cdb63147ff875854fd6d2367b36713a
> HCI Event: Number of Completed Packets (0x13) plen 5      #84 [hci1] 7.732366
        Num handles: 1
        Handle: 831 Address: DF:A9:FF:F6:B1:1A (OUI DF-A9-FF)
        Count: 1
        #80: len 15 (0 Kb/s)
        Latency: 139 msec (59-159 msec ~110 msec)
> HCI Event: Number of Completed Packets (0x13) plen 5      #85 [hci1] 7.812496
        Num handles: 1
        Handle: 831 Address: DF:A9:FF:F6:B1:1A (OUI DF-A9-FF)
        Count: 1
        #83: len 21 (1 Kb/s)
        Latency: 140 msec (59-159 msec ~125 msec)
> ACL Data RX: Handle 831 flags 0x02 dlen 21                #86 [hci1] 7.812727
      SMP: Pairing Random (0x04) len 16
        Random value: 08fe996a00ca1f960000000000000000
< HCI Command: Host Number of Compl.. (0x03|0x0035) plen 5  #87 [hci1] 7.832354
        Num handles: 1
        Handle: 831 Address: DF:A9:FF:F6:B1:1A (OUI DF-A9-FF)
        Count: 1
< ACL Data TX: Handle 831 flags 0x00 dlen 21                #88 [hci1] 7.832448
      SMP: Pairing Random (0x04) len 16
        Random value: 8e6108f966a694cbe26df70bb96773e6
> HCI Event: Number of Completed Packets (0x13) plen 5      #89 [hci1] 7.972312
        Num handles: 1
        Handle: 831 Address: DF:A9:FF:F6:B1:1A (OUI DF-A9-FF)
        Count: 1
        #88: len 21 (1 Kb/s)
        Latency: 139 msec (59-159 msec ~132 msec)
> ACL Data RX: Handle 831 flags 0x02 dlen 21                #90 [hci1] 8.132562
      SMP: Pairing DHKey Check (0x0d) len 16
        E: bbffd36f9670fd6c7da5850c9f0f8e24
< HCI Command: Host Number of Compl.. (0x03|0x0035) plen 5  #91 [hci1] 8.151876
        Num handles: 1
        Handle: 831 Address: DF:A9:FF:F6:B1:1A (OUI DF-A9-FF)
        Count: 1
< ACL Data TX: Handle 831 flags 0x00 dlen 21                #92 [hci1] 8.151949
      SMP: Pairing DHKey Check (0x0d) len 16
        E: 1f852d05ef98bfbea64045090f05a9c5
> HCI Event: Number of Completed Packets (0x13) plen 5      #93 [hci1] 8.292272
        Num handles: 1
        Handle: 831 Address: DF:A9:FF:F6:B1:1A (OUI DF-A9-FF)
        Count: 1
        #92: len 21 (1 Kb/s)
        Latency: 140 msec (59-159 msec ~136 msec)
> HCI Event: LE Meta Event (0x3e) plen 13                   #94 [hci1] 8.372762
      LE Long Term Key Request (0x05)
        Handle: 831 Address: DF:A9:FF:F6:B1:1A (OUI DF-A9-FF)
        Random number: 0x0000000000000000
        Encrypted diversifier: 0x0000
< HCI Command: LE Long Term Key Re.. (0x08|0x001a) plen 18  #95 [hci1] 8.391962
        Handle: 831 Address: DF:A9:FF:F6:B1:1A (OUI DF-A9-FF)
        Long term key: e74a99da48917ec8c43d5870c536b545
> HCI Event: Command Complete (0x0e) plen 6                 #96 [hci1] 8.392635
      LE Long Term Key Request Reply (0x08|0x001a) ncmd 1
        Status: Success (0x00)
        Handle: 831 Address: DF:A9:FF:F6:B1:1A (OUI DF-A9-FF)
> HCI Event: Encryption Change (0x08) plen 4                #97 [hci1] 8.772569
        Status: Success (0x00)
        Handle: 831 Address: DF:A9:FF:F6:B1:1A (OUI DF-A9-FF)
        Encryption: Enabled with AES-CCM (0x01)
> ACL Data RX: Handle 831 flags 0x02 dlen 21                #98 [hci1] 8.852624
      SMP: Identity Information (0x08) len 16
        Identity resolving key: 77140296b00c6ca1f550adfcca5f1449
< HCI Command: Host Number of Compl.. (0x03|0x0035) plen 5  #99 [hci1] 8.901848
        Num handles: 1
        Handle: 831 Address: DF:A9:FF:F6:B1:1A (OUI DF-A9-FF)
        Count: 1
> ACL Data RX: Handle 831 flags 0x02 dlen 12               #100 [hci1] 9.012525
      SMP: Identity Address Information (0x09) len 7
        Address: DF:A9:FF:F6:B1:1A (OUI DF-A9-FF)
< HCI Command: LE Set Extended Adv.. (0x08|0x0039) plen 6  #101 [hci1] 9.032272
        Extended advertising: Disabled (0x00)
        Number of sets: 1 (0x01)
        Entry 0
          Handle: 0x00
          Duration: 0 ms (0x00)
          Max ext adv events: 0
> HCI Event: Command Complete (0x0e) plen 4                #102 [hci1] 9.032796
      LE Set Extended Advertising Enable (0x08|0x0039) ncmd 1
        Status: Success (0x00)
< HCI Command: LE Add Device To R.. (0x08|0x0027) plen 39  #103 [hci1] 9.052124
        Address type: Public (0x00)
        Address: DF:A9:FF:F6:B1:1A (OUI DF-A9-FF)
        Peer identity resolving key: 77140296b00c6ca1f550adfcca5f1449
        Local identity resolving key: 00000000000000000000000000000000
> HCI Event: Command Complete (0x0e) plen 4                #104 [hci1] 9.053189
      LE Add Device To Resolving List (0x08|0x0027) ncmd 1
        Status: Success (0x00)
< HCI Command: LE Set Privacy Mode (0x08|0x004e) plen 8    #105 [hci1] 9.072042
        Peer Identity address type: Public (0x00)
        Peer Identity address: DF:A9:FF:F6:B1:1A (OUI DF-A9-FF)
        Privacy Mode: Use Device Privacy (0x01)
> HCI Event: Command Complete (0x0e) plen 4                #106 [hci1] 9.072655
      LE Set Privacy Mode (0x08|0x004e) ncmd 1
        Status: Success (0x00)
< HCI Command: LE Set Address Reso.. (0x08|0x002d) plen 1  #107 [hci1] 9.092054
        Address resolution: Enabled (0x01)
> ACL Data RX: Handle 831 flags 0x02 dlen 13               #108 [hci1] 9.092527
      ATT: Find By Type Value Request (0x06) len 8
        Handle range: 0x0001-0xffff
        Attribute type: Primary Service (0x2800)
          UUID: Published Audio Capabilities (0x1850)
> HCI Event: Command Complete (0x0e) plen 4                #109 [hci1] 9.092655
      LE Set Address Resolution Enable (0x08|0x002d) ncmd 1
        Status: Success (0x00)
< HCI Command: LE Set Extended Adv.. (0x08|0x0039) plen 6  #110 [hci1] 9.112096
        Extended advertising: Enabled (0x01)
        Number of sets: 1 (0x01)
        Entry 0
          Handle: 0x00
          Duration: 0 ms (0x00)
          Max ext adv events: 0
> HCI Event: Command Complete (0x0e) plen 4                #111 [hci1] 9.112721
      LE Set Extended Advertising Enable (0x08|0x0039) ncmd 1
        Status: Success (0x00)
< HCI Command: Host Number of Comp.. (0x03|0x0035) plen 5  #112 [hci1] 9.131905
        Num handles: 1
        Handle: 831 Address: DF:A9:FF:F6:B1:1A (OUI DF-A9-FF)
        Count: 1
< HCI Command: Host Number of Comp.. (0x03|0x0035) plen 5  #113 [hci1] 9.132361
        Num handles: 1
        Handle: 831 Address: DF:A9:FF:F6:B1:1A (OUI DF-A9-FF)
        Count: 1
< ACL Data TX: Handle 831 flags 0x00 dlen 9                #114 [hci1] 9.132505
      ATT: Find By Type Value Response (0x07) len 4
        Handle range: 0x002a-0x003c
> HCI Event: Number of Completed Packets (0x13) plen 5     #115 [hci1] 9.252465
        Num handles: 1
        Handle: 831 Address: DF:A9:FF:F6:B1:1A (OUI DF-A9-FF)
        Count: 1
        #114: len 9 (0 Kb/s)
        Latency: 119 msec (59-159 msec ~128 msec)
> ACL Data RX: Handle 831 flags 0x02 dlen 13               #116 [hci1] 9.252610
      ATT: Find By Type Value Request (0x06) len 8
        Handle range: 0x003d-0xffff
        Attribute type: Primary Service (0x2800)
          UUID: Published Audio Capabilities (0x1850)
< HCI Command: Host Number of Comp.. (0x03|0x0035) plen 5  #117 [hci1] 9.272409
        Num handles: 1
        Handle: 831 Address: DF:A9:FF:F6:B1:1A (OUI DF-A9-FF)
        Count: 1
< ACL Data TX: Handle 831 flags 0x00 dlen 9                #118 [hci1] 9.272481
      ATT: Error Response (0x01) len 4
        Find By Type Value Request (0x06)
        Handle: 0x003d
        Error: Attribute Not Found (0x0a)
> HCI Event: Number of Completed Packets (0x13) plen 5     #119 [hci1] 9.412424
        Num handles: 1
        Handle: 831 Address: DF:A9:FF:F6:B1:1A (OUI DF-A9-FF)
        Count: 1
        #118: len 9 (0 Kb/s)
        Latency: 139 msec (59-159 msec ~134 msec)
> ACL Data RX: Handle 831 flags 0x02 dlen 11               #120 [hci1] 9.412644
      ATT: Read By Type Request (0x08) len 6
        Handle range: 0x002a-0x003c
        Attribute type: Characteristic (0x2803)
< HCI Command: Host Number of Comp.. (0x03|0x0035) plen 5  #121 [hci1] 9.432406
        Num handles: 1
        Handle: 831 Address: DF:A9:FF:F6:B1:1A (OUI DF-A9-FF)
        Count: 1
< ACL Data TX: Handle 831 flags 0x00 dlen 27               #122 [hci1] 9.432476
< ACL Data TX: Handle 831 flags 0x01 dlen 21               #123 [hci1] 9.432495
      ATT: Read By Type Response (0x09) len 43
        Attribute data length: 7
        Attribute data list: 6 entries
        Handle: 0x002b
        Value: 122c00c92b
            Properties: 0x12
              Read (0x02)
              Notify (0x10)
            Value Handle: 0x002c
            Value UUID: Sink PAC (0x2bc9)
        Handle: 0x002e
        Value: 1a2f00ca2b
            Properties: 0x1a
              Read (0x02)
              Write (0x08)
              Notify (0x10)
            Value Handle: 0x002f
            Value UUID: Sink Audio Locations (0x2bca)
        Handle: 0x0031
        Value: 123200cb2b
            Properties: 0x12
              Read (0x02)
              Notify (0x10)
            Value Handle: 0x0032
            Value UUID: Source PAC (0x2bcb)
        Handle: 0x0034
        Value: 1a3500cc2b
            Properties: 0x1a
              Read (0x02)
              Write (0x08)
              Notify (0x10)
            Value Handle: 0x0035
            Value UUID: Source Audio Locations (0x2bcc)
        Handle: 0x0037
        Value: 123800cd2b
            Properties: 0x12
              Read (0x02)
              Notify (0x10)
            Value Handle: 0x0038
            Value UUID: Available Audio Contexts (0x2bcd)
        Handle: 0x003a
        Value: 123b00ce2b
            Properties: 0x12
              Read (0x02)
              Notify (0x10)
            Value Handle: 0x003b
            Value UUID: Supported Audio Contexts (0x2bce)
> HCI Event: Number of Completed Packets (0x13) plen 5     #124 [hci1] 9.492795
        Num handles: 1
        Handle: 831 Address: DF:A9:FF:F6:B1:1A (OUI DF-A9-FF)
        Count: 1
        #122: len 27 (3 Kb/s)
        Latency: 60 msec (59-159 msec ~97 msec)
> HCI Event: Number of Completed Packets (0x13) plen 5     #125 [hci1] 9.572359
        Num handles: 1
        Handle: 831 Address: DF:A9:FF:F6:B1:1A (OUI DF-A9-FF)
        Count: 1
        #123: len 21 (1 Kb/s)
        Latency: 139 msec (59-159 msec ~118 msec)
> ACL Data RX: Handle 831 flags 0x02 dlen 11               #126 [hci1] 9.572618
      ATT: Read By Type Request (0x08) len 6
        Handle range: 0x003b-0x003c
        Attribute type: Characteristic (0x2803)
< HCI Command: Host Number of Comp.. (0x03|0x0035) plen 5  #127 [hci1] 9.592335
        Num handles: 1
        Handle: 831 Address: DF:A9:FF:F6:B1:1A (OUI DF-A9-FF)
        Count: 1
< ACL Data TX: Handle 831 flags 0x00 dlen 9                #128 [hci1] 9.592641
      ATT: Error Response (0x01) len 4
        Read By Type Request (0x08)
        Handle: 0x003b
        Error: Attribute Not Found (0x0a)
> HCI Event: Number of Completed Packets (0x13) plen 5     #129 [hci1] 9.732414
        Num handles: 1
        Handle: 831 Address: DF:A9:FF:F6:B1:1A (OUI DF-A9-FF)
        Count: 1
        #128: len 9 (0 Kb/s)
        Latency: 139 msec (59-159 msec ~129 msec)
> ACL Data RX: Handle 831 flags 0x02 dlen 9                #130 [hci1] 9.732597
      ATT: Find Information Request (0x04) len 4
        Handle range: 0x002d-0x002d
< HCI Command: Host Number of Comp.. (0x03|0x0035) plen 5  #131 [hci1] 9.752443
        Num handles: 1
        Handle: 831 Address: DF:A9:FF:F6:B1:1A (OUI DF-A9-FF)
        Count: 1
< ACL Data TX: Handle 831 flags 0x00 dlen 10               #132 [hci1] 9.752556
      ATT: Find Information Response (0x05) len 5
        Format: UUID-16 (0x01)
        Handle: 0x002d
        UUID: Client Characteristic Configuration (0x2902)
> HCI Event: Number of Completed Packets (0x13) plen 5     #133 [hci1] 9.892452
        Num handles: 1
        Handle: 831 Address: DF:A9:FF:F6:B1:1A (OUI DF-A9-FF)
        Count: 1
        #132: len 10 (0 Kb/s)
        Latency: 139 msec (59-159 msec ~134 msec)
> ACL Data RX: Handle 831 flags 0x02 dlen 9                #134 [hci1] 9.892598
      ATT: Find Information Request (0x04) len 4
        Handle range: 0x0030-0x0030
< HCI Command: Host Number of Comp.. (0x03|0x0035) plen 5  #135 [hci1] 9.912261
        Num handles: 1
        Handle: 831 Address: DF:A9:FF:F6:B1:1A (OUI DF-A9-FF)
        Count: 1
< ACL Data TX: Handle 831 flags 0x00 dlen 10               #136 [hci1] 9.912346
      ATT: Find Information Response (0x05) len 5
        Format: UUID-16 (0x01)
        Handle: 0x0030
        UUID: Client Characteristic Configuration (0x2902)
> HCI Event: Number of Completed Packets (0x13) plen 5    #137 [hci1] 10.052452
        Num handles: 1
        Handle: 831 Address: DF:A9:FF:F6:B1:1A (OUI DF-A9-FF)
        Count: 1
        #136: len 10 (0 Kb/s)
        Latency: 140 msec (59-159 msec ~137 msec)
> ACL Data RX: Handle 831 flags 0x02 dlen 9               #138 [hci1] 10.052664
      ATT: Find Information Request (0x04) len 4
        Handle range: 0x0033-0x0033
< HCI Command: Host Number of Com.. (0x03|0x0035) plen 5  #139 [hci1] 10.072347
        Num handles: 1
        Handle: 831 Address: DF:A9:FF:F6:B1:1A (OUI DF-A9-FF)
        Count: 1
< ACL Data TX: Handle 831 flags 0x00 dlen 10              #140 [hci1] 10.072496
      ATT: Find Information Response (0x05) len 5
        Format: UUID-16 (0x01)
        Handle: 0x0033
        UUID: Client Characteristic Configuration (0x2902)
> HCI Event: Number of Completed Packets (0x13) plen 5    #141 [hci1] 10.212368
        Num handles: 1
        Handle: 831 Address: DF:A9:FF:F6:B1:1A (OUI DF-A9-FF)
        Count: 1
        #140: len 10 (0 Kb/s)
        Latency: 139 msec (59-159 msec ~138 msec)
> ACL Data RX: Handle 831 flags 0x02 dlen 9               #142 [hci1] 10.212609
      ATT: Find Information Request (0x04) len 4
        Handle range: 0x0036-0x0036
< HCI Command: Host Number of Com.. (0x03|0x0035) plen 5  #143 [hci1] 10.232337
        Num handles: 1
        Handle: 831 Address: DF:A9:FF:F6:B1:1A (OUI DF-A9-FF)
        Count: 1
< ACL Data TX: Handle 831 flags 0x00 dlen 10              #144 [hci1] 10.232448
      ATT: Find Information Response (0x05) len 5
        Format: UUID-16 (0x01)
        Handle: 0x0036
        UUID: Client Characteristic Configuration (0x2902)
> HCI Event: Number of Completed Packets (0x13) plen 5    #145 [hci1] 10.372354
        Num handles: 1
        Handle: 831 Address: DF:A9:FF:F6:B1:1A (OUI DF-A9-FF)
        Count: 1
        #144: len 10 (0 Kb/s)
        Latency: 139 msec (59-159 msec ~139 msec)
> ACL Data RX: Handle 831 flags 0x02 dlen 9               #146 [hci1] 10.372588
      ATT: Find Information Request (0x04) len 4
        Handle range: 0x0039-0x0039
< HCI Command: Host Number of Com.. (0x03|0x0035) plen 5  #147 [hci1] 10.392356
        Num handles: 1
        Handle: 831 Address: DF:A9:FF:F6:B1:1A (OUI DF-A9-FF)
        Count: 1
< ACL Data TX: Handle 831 flags 0x00 dlen 10              #148 [hci1] 10.392521
      ATT: Find Information Response (0x05) len 5
        Format: UUID-16 (0x01)
        Handle: 0x0039
        UUID: Client Characteristic Configuration (0x2902)
> HCI Event: Number of Completed Packets (0x13) plen 5    #149 [hci1] 10.532366
        Num handles: 1
        Handle: 831 Address: DF:A9:FF:F6:B1:1A (OUI DF-A9-FF)
        Count: 1
        #148: len 10 (0 Kb/s)
        Latency: 139 msec (59-159 msec ~139 msec)
> ACL Data RX: Handle 831 flags 0x02 dlen 9               #150 [hci1] 10.532689
      ATT: Find Information Request (0x04) len 4
        Handle range: 0x003c-0x003c
< HCI Command: Host Number of Com.. (0x03|0x0035) plen 5  #151 [hci1] 10.552316
        Num handles: 1
        Handle: 831 Address: DF:A9:FF:F6:B1:1A (OUI DF-A9-FF)
        Count: 1
< ACL Data TX: Handle 831 flags 0x00 dlen 10              #152 [hci1] 10.552431
      ATT: Find Information Response (0x05) len 5
        Format: UUID-16 (0x01)
        Handle: 0x003c
        UUID: Client Characteristic Configuration (0x2902)
> HCI Event: Number of Completed Packets (0x13) plen 5    #153 [hci1] 10.692401
        Num handles: 1
        Handle: 831 Address: DF:A9:FF:F6:B1:1A (OUI DF-A9-FF)
        Count: 1
        #152: len 10 (0 Kb/s)
        Latency: 139 msec (59-159 msec ~139 msec)
> ACL Data RX: Handle 831 flags 0x02 dlen 13              #154 [hci1] 10.692741
      ATT: Find By Type Value Request (0x06) len 8
        Handle range: 0x0001-0xffff
        Attribute type: Primary Service (0x2800)
          UUID: Audio Stream Control (0x184e)
< HCI Command: Host Number of Com.. (0x03|0x0035) plen 5  #155 [hci1] 10.712551
        Num handles: 1
        Handle: 831 Address: DF:A9:FF:F6:B1:1A (OUI DF-A9-FF)
        Count: 1
< ACL Data TX: Handle 831 flags 0x00 dlen 9               #156 [hci1] 10.712573
      ATT: Find By Type Value Response (0x07) len 4
        Handle range: 0x003d-0x004c
> HCI Event: Number of Completed Packets (0x13) plen 5    #157 [hci1] 10.852366
        Num handles: 1
        Handle: 831 Address: DF:A9:FF:F6:B1:1A (OUI DF-A9-FF)
        Count: 1
        #156: len 9 (0 Kb/s)
        Latency: 139 msec (59-159 msec ~139 msec)
> ACL Data RX: Handle 831 flags 0x02 dlen 13              #158 [hci1] 10.852546
      ATT: Find By Type Value Request (0x06) len 8
        Handle range: 0x004d-0xffff
        Attribute type: Primary Service (0x2800)
          UUID: Audio Stream Control (0x184e)
< HCI Command: Host Number of Com.. (0x03|0x0035) plen 5  #159 [hci1] 10.872449
        Num handles: 1
        Handle: 831 Address: DF:A9:FF:F6:B1:1A (OUI DF-A9-FF)
        Count: 1
< ACL Data TX: Handle 831 flags 0x00 dlen 9               #160 [hci1] 10.872655
      ATT: Error Response (0x01) len 4
        Find By Type Value Request (0x06)
        Handle: 0x004d
        Error: Attribute Not Found (0x0a)
> HCI Event: Number of Completed Packets (0x13) plen 5    #161 [hci1] 11.012370
        Num handles: 1
        Handle: 831 Address: DF:A9:FF:F6:B1:1A (OUI DF-A9-FF)
        Count: 1
        #160: len 9 (0 Kb/s)
        Latency: 139 msec (59-159 msec ~139 msec)
> ACL Data RX: Handle 831 flags 0x02 dlen 11              #162 [hci1] 11.012572
      ATT: Read By Type Request (0x08) len 6
        Handle range: 0x003d-0x004c
        Attribute type: Characteristic (0x2803)
< HCI Command: Host Number of Com.. (0x03|0x0035) plen 5  #163 [hci1] 11.032501
        Num handles: 1
        Handle: 831 Address: DF:A9:FF:F6:B1:1A (OUI DF-A9-FF)
        Count: 1
< ACL Data TX: Handle 831 flags 0x00 dlen 27              #164 [hci1] 11.032616
< ACL Data TX: Handle 831 flags 0x01 dlen 14              #165 [hci1] 11.032635
      ATT: Read By Type Response (0x09) len 36
        Attribute data length: 7
        Attribute data list: 5 entries
        Handle: 0x003e
        Value: 1c3f00c62b
            Properties: 0x1c
              Write Without Response (0x04)
              Write (0x08)
              Notify (0x10)
            Value Handle: 0x003f
            Value UUID: ASE Control Point (0x2bc6)
        Handle: 0x0041
        Value: 124200c42b
            Properties: 0x12
              Read (0x02)
              Notify (0x10)
            Value Handle: 0x0042
            Value UUID: Sink ASE (0x2bc4)
        Handle: 0x0044
        Value: 124500c42b
            Properties: 0x12
              Read (0x02)
              Notify (0x10)
            Value Handle: 0x0045
            Value UUID: Sink ASE (0x2bc4)
        Handle: 0x0047
        Value: 124800c52b
            Properties: 0x12
              Read (0x02)
              Notify (0x10)
            Value Handle: 0x0048
            Value UUID: Source ASE (0x2bc5)
        Handle: 0x004a
        Value: 124b00c52b
            Properties: 0x12
              Read (0x02)
              Notify (0x10)
            Value Handle: 0x004b
            Value UUID: Source ASE (0x2bc5)
> HCI Event: Number of Completed Packets (0x13) plen 5    #166 [hci1] 11.092851
        Num handles: 1
        Handle: 831 Address: DF:A9:FF:F6:B1:1A (OUI DF-A9-FF)
        Count: 1
        #164: len 27 (3 Kb/s)
        Latency: 60 msec (59-159 msec ~99 msec)
> HCI Event: Number of Completed Packets (0x13) plen 5    #167 [hci1] 11.172400
        Num handles: 1
        Handle: 831 Address: DF:A9:FF:F6:B1:1A (OUI DF-A9-FF)
        Count: 1
        #165: len 14 (0 Kb/s)
        Latency: 139 msec (59-159 msec ~119 msec)
> ACL Data RX: Handle 831 flags 0x02 dlen 11              #168 [hci1] 11.172640
      ATT: Read By Type Request (0x08) len 6
        Handle range: 0x004b-0x004c
        Attribute type: Characteristic (0x2803)
< HCI Command: Host Number of Com.. (0x03|0x0035) plen 5  #169 [hci1] 11.192271
        Num handles: 1
        Handle: 831 Address: DF:A9:FF:F6:B1:1A (OUI DF-A9-FF)
        Count: 1
< ACL Data TX: Handle 831 flags 0x00 dlen 9               #170 [hci1] 11.192429
      ATT: Error Response (0x01) len 4
        Read By Type Request (0x08)
        Handle: 0x004b
        Error: Attribute Not Found (0x0a)
> HCI Event: Number of Completed Packets (0x13) plen 5    #171 [hci1] 11.332529
        Num handles: 1
        Handle: 831 Address: DF:A9:FF:F6:B1:1A (OUI DF-A9-FF)
        Count: 1
        #170: len 9 (0 Kb/s)
        Latency: 140 msec (59-159 msec ~129 msec)
> ACL Data RX: Handle 831 flags 0x02 dlen 9               #172 [hci1] 11.332537
      ATT: Find Information Request (0x04) len 4
        Handle range: 0x0040-0x0040
< HCI Command: Host Number of Com.. (0x03|0x0035) plen 5  #173 [hci1] 11.352387
        Num handles: 1
        Handle: 831 Address: DF:A9:FF:F6:B1:1A (OUI DF-A9-FF)
        Count: 1
< ACL Data TX: Handle 831 flags 0x00 dlen 10              #174 [hci1] 11.352480
      ATT: Find Information Response (0x05) len 5
        Format: UUID-16 (0x01)
        Handle: 0x0040
        UUID: Client Characteristic Configuration (0x2902)
> HCI Event: Number of Completed Packets (0x13) plen 5    #175 [hci1] 11.492343
        Num handles: 1
        Handle: 831 Address: DF:A9:FF:F6:B1:1A (OUI DF-A9-FF)
        Count: 1
        #174: len 10 (0 Kb/s)
        Latency: 139 msec (59-159 msec ~134 msec)
> ACL Data RX: Handle 831 flags 0x02 dlen 9               #176 [hci1] 11.492600
      ATT: Find Information Request (0x04) len 4
        Handle range: 0x0043-0x0043
< HCI Command: Host Number of Com.. (0x03|0x0035) plen 5  #177 [hci1] 11.512299
        Num handles: 1
        Handle: 831 Address: DF:A9:FF:F6:B1:1A (OUI DF-A9-FF)
        Count: 1
< ACL Data TX: Handle 831 flags 0x00 dlen 10              #178 [hci1] 11.512485
      ATT: Find Information Response (0x05) len 5
        Format: UUID-16 (0x01)
        Handle: 0x0043
        UUID: Client Characteristic Configuration (0x2902)
> HCI Event: Number of Completed Packets (0x13) plen 5    #179 [hci1] 11.732407
        Num handles: 1
        Handle: 831 Address: DF:A9:FF:F6:B1:1A (OUI DF-A9-FF)
        Count: 1
        #178: len 10 (0 Kb/s)
        Latency: 219 msec (59-219 msec ~177 msec)
> ACL Data RX: Handle 831 flags 0x02 dlen 9               #180 [hci1] 11.732541
      ATT: Find Information Request (0x04) len 4
        Handle range: 0x0046-0x0046
< HCI Command: Host Number of Com.. (0x03|0x0035) plen 5  #181 [hci1] 11.752348
        Num handles: 1
        Handle: 831 Address: DF:A9:FF:F6:B1:1A (OUI DF-A9-FF)
        Count: 1
< ACL Data TX: Handle 831 flags 0x00 dlen 10              #182 [hci1] 11.752445
      ATT: Find Information Response (0x05) len 5
        Format: UUID-16 (0x01)
        Handle: 0x0046
        UUID: Client Characteristic Configuration (0x2902)
> HCI Event: Number of Completed Packets (0x13) plen 5    #183 [hci1] 11.892328
        Num handles: 1
        Handle: 831 Address: DF:A9:FF:F6:B1:1A (OUI DF-A9-FF)
        Count: 1
        #182: len 10 (0 Kb/s)
        Latency: 139 msec (59-219 msec ~158 msec)
> ACL Data RX: Handle 831 flags 0x02 dlen 9               #184 [hci1] 11.892575
      ATT: Find Information Request (0x04) len 4
        Handle range: 0x0049-0x0049
< HCI Command: Host Number of Com.. (0x03|0x0035) plen 5  #185 [hci1] 11.912458
        Num handles: 1
        Handle: 831 Address: DF:A9:FF:F6:B1:1A (OUI DF-A9-FF)
        Count: 1
< ACL Data TX: Handle 831 flags 0x00 dlen 10              #186 [hci1] 11.912516
      ATT: Find Information Response (0x05) len 5
        Format: UUID-16 (0x01)
        Handle: 0x0049
        UUID: Client Characteristic Configuration (0x2902)
> HCI Event: Number of Completed Packets (0x13) plen 5    #187 [hci1] 12.052404
        Num handles: 1
        Handle: 831 Address: DF:A9:FF:F6:B1:1A (OUI DF-A9-FF)
        Count: 1
        #186: len 10 (0 Kb/s)
        Latency: 139 msec (59-219 msec ~149 msec)
> ACL Data RX: Handle 831 flags 0x02 dlen 9               #188 [hci1] 12.052654
      ATT: Find Information Request (0x04) len 4
        Handle range: 0x004c-0x004c
< HCI Command: Host Number of Com.. (0x03|0x0035) plen 5  #189 [hci1] 12.072321
        Num handles: 1
        Handle: 831 Address: DF:A9:FF:F6:B1:1A (OUI DF-A9-FF)
        Count: 1
< ACL Data TX: Handle 831 flags 0x00 dlen 10              #190 [hci1] 12.072457
      ATT: Find Information Response (0x05) len 5
        Format: UUID-16 (0x01)
        Handle: 0x004c
        UUID: Client Characteristic Configuration (0x2902)
> HCI Event: Number of Completed Packets (0x13) plen 5    #191 [hci1] 12.212389
        Num handles: 1
        Handle: 831 Address: DF:A9:FF:F6:B1:1A (OUI DF-A9-FF)
        Count: 1
        #190: len 10 (0 Kb/s)
        Latency: 139 msec (59-219 msec ~144 msec)
> ACL Data RX: Handle 831 flags 0x02 dlen 9               #192 [hci1] 12.212540
      ATT: Write Request (0x12) len 4
        Handle: 0x0039
          Data: 0000
< HCI Command: Host Number of Com.. (0x03|0x0035) plen 5  #193 [hci1] 12.232061
        Num handles: 1
        Handle: 831 Address: DF:A9:FF:F6:B1:1A (OUI DF-A9-FF)
        Count: 1
< ACL Data TX: Handle 831 flags 0x00 dlen 5               #194 [hci1] 12.232140
      ATT: Write Response (0x13) len 0
> HCI Event: Number of Completed Packets (0x13) plen 5    #195 [hci1] 12.372308
        Num handles: 1
        Handle: 831 Address: DF:A9:FF:F6:B1:1A (OUI DF-A9-FF)
        Count: 1
        #194: len 5 (0 Kb/s)
        Latency: 140 msec (59-219 msec ~142 msec)
> ACL Data RX: Handle 831 flags 0x02 dlen 9               #196 [hci1] 12.372559
      ATT: Write Request (0x12) len 4
        Handle: 0x0039
          Data: 0100
< HCI Command: Host Number of Com.. (0x03|0x0035) plen 5  #197 [hci1] 12.392603
        Num handles: 1
        Handle: 831 Address: DF:A9:FF:F6:B1:1A (OUI DF-A9-FF)
        Count: 1
< ACL Data TX: Handle 831 flags 0x00 dlen 5               #198 [hci1] 12.392655
      ATT: Write Response (0x13) len 0
> HCI Event: Number of Completed Packets (0x13) plen 5    #199 [hci1] 12.532341
        Num handles: 1
        Handle: 831 Address: DF:A9:FF:F6:B1:1A (OUI DF-A9-FF)
        Count: 1
        #198: len 5 (0 Kb/s)
        Latency: 139 msec (59-219 msec ~141 msec)
> ACL Data RX: Handle 831 flags 0x02 dlen 9               #200 [hci1] 12.532581
      ATT: Write Request (0x12) len 4
        Handle: 0x0040
          Data: 0000
< HCI Command: Host Number of Com.. (0x03|0x0035) plen 5  #201 [hci1] 12.552428
        Num handles: 1
        Handle: 831 Address: DF:A9:FF:F6:B1:1A (OUI DF-A9-FF)
        Count: 1
< ACL Data TX: Handle 831 flags 0x00 dlen 5               #202 [hci1] 12.552514
      ATT: Write Response (0x13) len 0
> HCI Event: Number of Completed Packets (0x13) plen 5    #203 [hci1] 12.692367
        Num handles: 1
        Handle: 831 Address: DF:A9:FF:F6:B1:1A (OUI DF-A9-FF)
        Count: 1
        #202: len 5 (0 Kb/s)
        Latency: 139 msec (59-219 msec ~140 msec)
> ACL Data RX: Handle 831 flags 0x02 dlen 9               #204 [hci1] 12.692536
      ATT: Write Request (0x12) len 4
        Handle: 0x0040
          Data: 0100
< HCI Command: Host Number of Com.. (0x03|0x0035) plen 5  #205 [hci1] 12.712446
        Num handles: 1
        Handle: 831 Address: DF:A9:FF:F6:B1:1A (OUI DF-A9-FF)
        Count: 1
< ACL Data TX: Handle 831 flags 0x00 dlen 5               #206 [hci1] 12.712499
      ATT: Write Response (0x13) len 0
> HCI Event: Number of Completed Packets (0x13) plen 5    #207 [hci1] 12.852324
        Num handles: 1
        Handle: 831 Address: DF:A9:FF:F6:B1:1A (OUI DF-A9-FF)
        Count: 1
        #206: len 5 (0 Kb/s)
        Latency: 139 msec (59-219 msec ~140 msec)
> ACL Data RX: Handle 831 flags 0x02 dlen 9               #208 [hci1] 12.852536
      ATT: Write Request (0x12) len 4
        Handle: 0x0043
          Data: 0000
< HCI Command: Host Number of Com.. (0x03|0x0035) plen 5  #209 [hci1] 12.871991
        Num handles: 1
        Handle: 831 Address: DF:A9:FF:F6:B1:1A (OUI DF-A9-FF)
        Count: 1
< ACL Data TX: Handle 831 flags 0x00 dlen 5               #210 [hci1] 12.872060
      ATT: Write Response (0x13) len 0
> HCI Event: Number of Completed Packets (0x13) plen 5    #211 [hci1] 13.012306
        Num handles: 1
        Handle: 831 Address: DF:A9:FF:F6:B1:1A (OUI DF-A9-FF)
        Count: 1
        #210: len 5 (0 Kb/s)
        Latency: 140 msec (59-219 msec ~140 msec)
> ACL Data RX: Handle 831 flags 0x02 dlen 9               #212 [hci1] 13.012551
      ATT: Write Request (0x12) len 4
        Handle: 0x0043
          Data: 0100
< HCI Command: Host Number of Com.. (0x03|0x0035) plen 5  #213 [hci1] 13.032353
        Num handles: 1
        Handle: 831 Address: DF:A9:FF:F6:B1:1A (OUI DF-A9-FF)
        Count: 1
< ACL Data TX: Handle 831 flags 0x00 dlen 5               #214 [hci1] 13.032515
      ATT: Write Response (0x13) len 0
> HCI Event: Number of Completed Packets (0x13) plen 5    #215 [hci1] 13.172294
        Num handles: 1
        Handle: 831 Address: DF:A9:FF:F6:B1:1A (OUI DF-A9-FF)
        Count: 1
        #214: len 5 (0 Kb/s)
        Latency: 139 msec (59-219 msec ~139 msec)
> ACL Data RX: Handle 831 flags 0x02 dlen 9               #216 [hci1] 13.172526
      ATT: Write Request (0x12) len 4
        Handle: 0x0046
          Data: 0000
< HCI Command: Host Number of Com.. (0x03|0x0035) plen 5  #217 [hci1] 13.192218
        Num handles: 1
        Handle: 831 Address: DF:A9:FF:F6:B1:1A (OUI DF-A9-FF)
        Count: 1
< ACL Data TX: Handle 831 flags 0x00 dlen 5               #218 [hci1] 13.192276
      ATT: Write Response (0x13) len 0
> HCI Event: Number of Completed Packets (0x13) plen 5    #219 [hci1] 13.332321
        Num handles: 1
        Handle: 831 Address: DF:A9:FF:F6:B1:1A (OUI DF-A9-FF)
        Count: 1
        #218: len 5 (0 Kb/s)
        Latency: 140 msec (59-219 msec ~140 msec)
> ACL Data RX: Handle 831 flags 0x02 dlen 9               #220 [hci1] 13.332484
      ATT: Write Request (0x12) len 4
        Handle: 0x0046
          Data: 0100
< HCI Command: Host Number of Com.. (0x03|0x0035) plen 5  #221 [hci1] 13.352348
        Num handles: 1
        Handle: 831 Address: DF:A9:FF:F6:B1:1A (OUI DF-A9-FF)
        Count: 1
< ACL Data TX: Handle 831 flags 0x00 dlen 5               #222 [hci1] 13.352515
      ATT: Write Response (0x13) len 0
> HCI Event: Number of Completed Packets (0x13) plen 5    #223 [hci1] 13.492293
        Num handles: 1
        Handle: 831 Address: DF:A9:FF:F6:B1:1A (OUI DF-A9-FF)
        Count: 1
        #222: len 5 (0 Kb/s)
        Latency: 139 msec (59-219 msec ~139 msec)
> ACL Data RX: Handle 831 flags 0x02 dlen 9               #224 [hci1] 13.492572
      ATT: Write Request (0x12) len 4
        Handle: 0x0049
          Data: 0000
< HCI Command: Host Number of Com.. (0x03|0x0035) plen 5  #225 [hci1] 13.512335
        Num handles: 1
        Handle: 831 Address: DF:A9:FF:F6:B1:1A (OUI DF-A9-FF)
        Count: 1
< ACL Data TX: Handle 831 flags 0x00 dlen 5               #226 [hci1] 13.512437
      ATT: Write Response (0x13) len 0
> HCI Event: Number of Completed Packets (0x13) plen 5    #227 [hci1] 13.652320
        Num handles: 1
        Handle: 831 Address: DF:A9:FF:F6:B1:1A (OUI DF-A9-FF)
        Count: 1
        #226: len 5 (0 Kb/s)
        Latency: 139 msec (59-219 msec ~139 msec)
> ACL Data RX: Handle 831 flags 0x02 dlen 9               #228 [hci1] 13.652509
      ATT: Write Request (0x12) len 4
        Handle: 0x0049
          Data: 0100
< HCI Command: Host Number of Com.. (0x03|0x0035) plen 5  #229 [hci1] 13.672484
        Num handles: 1
        Handle: 831 Address: DF:A9:FF:F6:B1:1A (OUI DF-A9-FF)
        Count: 1
< ACL Data TX: Handle 831 flags 0x00 dlen 5               #230 [hci1] 13.672632
      ATT: Write Response (0x13) len 0
> HCI Event: Number of Completed Packets (0x13) plen 5    #231 [hci1] 13.812319
        Num handles: 1
        Handle: 831 Address: DF:A9:FF:F6:B1:1A (OUI DF-A9-FF)
        Count: 1
        #230: len 5 (0 Kb/s)
        Latency: 139 msec (59-219 msec ~139 msec)
> ACL Data RX: Handle 831 flags 0x02 dlen 9               #232 [hci1] 13.812525
      ATT: Write Request (0x12) len 4
        Handle: 0x004c
          Data: 0000
< HCI Command: Host Number of Com.. (0x03|0x0035) plen 5  #233 [hci1] 13.832424
        Num handles: 1
        Handle: 831 Address: DF:A9:FF:F6:B1:1A (OUI DF-A9-FF)
        Count: 1
< ACL Data TX: Handle 831 flags 0x00 dlen 5               #234 [hci1] 13.832474
      ATT: Write Response (0x13) len 0
> HCI Event: Number of Completed Packets (0x13) plen 5    #235 [hci1] 13.972292
        Num handles: 1
        Handle: 831 Address: DF:A9:FF:F6:B1:1A (OUI DF-A9-FF)
        Count: 1
        #234: len 5 (0 Kb/s)
        Latency: 139 msec (59-219 msec ~139 msec)
> ACL Data RX: Handle 831 flags 0x02 dlen 9               #236 [hci1] 13.972513
      ATT: Write Request (0x12) len 4
        Handle: 0x004c
          Data: 0100
< HCI Command: Host Number of Com.. (0x03|0x0035) plen 5  #237 [hci1] 13.992470
        Num handles: 1
        Handle: 831 Address: DF:A9:FF:F6:B1:1A (OUI DF-A9-FF)
        Count: 1
< ACL Data TX: Handle 831 flags 0x00 dlen 5               #238 [hci1] 13.992622
      ATT: Write Response (0x13) len 0
> HCI Event: Number of Completed Packets (0x13) plen 5    #239 [hci1] 14.132326
        Num handles: 1
        Handle: 831 Address: DF:A9:FF:F6:B1:1A (OUI DF-A9-FF)
        Count: 1
        #238: len 5 (0 Kb/s)
        Latency: 139 msec (59-219 msec ~139 msec)
> ACL Data RX: Handle 831 flags 0x02 dlen 7               #240 [hci1] 14.132462
      ATT: Read Request (0x0a) len 2
        Handle: 0x0042
< HCI Command: Host Number of Com.. (0x03|0x0035) plen 5  #241 [hci1] 14.152431
        Num handles: 1
        Handle: 831 Address: DF:A9:FF:F6:B1:1A (OUI DF-A9-FF)
        Count: 1
< ACL Data TX: Handle 831 flags 0x00 dlen 7               #242 [hci1] 14.152500
      ATT: Read Response (0x0b) len 2
> HCI Event: Number of Completed Packets (0x13) plen 5    #243 [hci1] 14.292293
        Num handles: 1
        Handle: 831 Address: DF:A9:FF:F6:B1:1A (OUI DF-A9-FF)
        Count: 1
        #242: len 7 (0 Kb/s)
        Latency: 139 msec (59-219 msec ~139 msec)
> ACL Data RX: Handle 831 flags 0x02 dlen 7               #244 [hci1] 14.292487
      ATT: Read Request (0x0a) len 2
        Handle: 0x0045
< HCI Command: Host Number of Com.. (0x03|0x0035) plen 5  #245 [hci1] 14.312268
        Num handles: 1
        Handle: 831 Address: DF:A9:FF:F6:B1:1A (OUI DF-A9-FF)
        Count: 1
< ACL Data TX: Handle 831 flags 0x00 dlen 7               #246 [hci1] 14.312325
      ATT: Read Response (0x0b) len 2
> HCI Event: Number of Completed Packets (0x13) plen 5    #247 [hci1] 14.452284
        Num handles: 1
        Handle: 831 Address: DF:A9:FF:F6:B1:1A (OUI DF-A9-FF)
        Count: 1
        #246: len 7 (0 Kb/s)
        Latency: 139 msec (59-219 msec ~139 msec)
> ACL Data RX: Handle 831 flags 0x02 dlen 7               #248 [hci1] 14.452488
      ATT: Read Request (0x0a) len 2
        Handle: 0x0048
< HCI Command: Host Number of Com.. (0x03|0x0035) plen 5  #249 [hci1] 14.472388
        Num handles: 1
        Handle: 831 Address: DF:A9:FF:F6:B1:1A (OUI DF-A9-FF)
        Count: 1
< ACL Data TX: Handle 831 flags 0x00 dlen 7               #250 [hci1] 14.472438
      ATT: Read Response (0x0b) len 2
> HCI Event: Number of Completed Packets (0x13) plen 5    #251 [hci1] 14.612323
        Num handles: 1
        Handle: 831 Address: DF:A9:FF:F6:B1:1A (OUI DF-A9-FF)
        Count: 1
        #250: len 7 (0 Kb/s)
        Latency: 139 msec (59-219 msec ~139 msec)
> ACL Data RX: Handle 831 flags 0x02 dlen 7               #252 [hci1] 14.612527
      ATT: Read Request (0x0a) len 2
        Handle: 0x004b
< HCI Command: Host Number of Com.. (0x03|0x0035) plen 5  #253 [hci1] 14.632316
        Num handles: 1
        Handle: 831 Address: DF:A9:FF:F6:B1:1A (OUI DF-A9-FF)
        Count: 1
< ACL Data TX: Handle 831 flags 0x00 dlen 7               #254 [hci1] 14.632440
      ATT: Read Response (0x0b) len 2
> HCI Event: Number of Completed Packets (0x13) plen 5    #255 [hci1] 14.772295
        Num handles: 1
        Handle: 831 Address: DF:A9:FF:F6:B1:1A (OUI DF-A9-FF)
        Count: 1
        #254: len 7 (0 Kb/s)
        Latency: 139 msec (59-219 msec ~139 msec)
> ACL Data RX: Handle 831 flags 0x02 dlen 7               #256 [hci1] 14.772494
      ATT: Read Request (0x0a) len 2
        Handle: 0x0035
< HCI Command: Host Number of Com.. (0x03|0x0035) plen 5  #257 [hci1] 14.792327
        Num handles: 1
        Handle: 831 Address: DF:A9:FF:F6:B1:1A (OUI DF-A9-FF)
        Count: 1
< ACL Data TX: Handle 831 flags 0x00 dlen 9               #258 [hci1] 14.792402
      ATT: Read Response (0x0b) len 4
> HCI Event: Number of Completed Packets (0x13) plen 5    #259 [hci1] 14.932308
        Num handles: 1
        Handle: 831 Address: DF:A9:FF:F6:B1:1A (OUI DF-A9-FF)
        Count: 1
        #258: len 9 (0 Kb/s)
        Latency: 139 msec (59-219 msec ~139 msec)
> ACL Data RX: Handle 831 flags 0x02 dlen 7               #260 [hci1] 14.932466
      ATT: Read Request (0x0a) len 2
        Handle: 0x0032
< HCI Command: Host Number of Com.. (0x03|0x0035) plen 5  #261 [hci1] 14.952464
        Num handles: 1
        Handle: 831 Address: DF:A9:FF:F6:B1:1A (OUI DF-A9-FF)
        Count: 1
< ACL Data TX: Handle 831 flags 0x00 dlen 27              #262 [hci1] 14.952518
< ACL Data TX: Handle 831 flags 0x01 dlen 27              #263 [hci1] 14.952607
< ACL Data TX: Handle 831 flags 0x01 dlen 12              #264 [hci1] 14.952620
      ATT: Read Response (0x0b) len 61
> HCI Event: Number of Completed Packets (0x13) plen 5    #265 [hci1] 15.012705
        Num handles: 1
        Handle: 831 Address: DF:A9:FF:F6:B1:1A (OUI DF-A9-FF)
        Count: 1
        #262: len 27 (3 Kb/s)
        Latency: 60 msec (59-219 msec ~100 msec)
> HCI Event: Number of Completed Packets (0x13) plen 5    #266 [hci1] 15.013246
        Num handles: 1
        Handle: 831 Address: DF:A9:FF:F6:B1:1A (OUI DF-A9-FF)
        Count: 1
        #263: len 27 (3 Kb/s)
        Latency: 60 msec (59-219 msec ~80 msec)
> HCI Event: Number of Completed Packets (0x13) plen 5    #267 [hci1] 15.092206
        Num handles: 1
        Handle: 831 Address: DF:A9:FF:F6:B1:1A (OUI DF-A9-FF)
        Count: 1
        #264: len 12 (0 Kb/s)
        Latency: 139 msec (59-219 msec ~109 msec)
> ACL Data RX: Handle 831 flags 0x02 dlen 7               #268 [hci1] 15.172305
      ATT: Read Request (0x0a) len 2
        Handle: 0x0038
< HCI Command: Host Number of Com.. (0x03|0x0035) plen 5  #269 [hci1] 15.192197
        Num handles: 1
        Handle: 831 Address: DF:A9:FF:F6:B1:1A (OUI DF-A9-FF)
        Count: 1
< ACL Data TX: Handle 831 flags 0x00 dlen 9               #270 [hci1] 15.192274
      ATT: Read Response (0x0b) len 4
> HCI Event: Number of Completed Packets (0x13) plen 5    #271 [hci1] 15.332388
        Num handles: 1
        Handle: 831 Address: DF:A9:FF:F6:B1:1A (OUI DF-A9-FF)
        Count: 1
        #270: len 9 (0 Kb/s)
        Latency: 140 msec (59-219 msec ~125 msec)
> ACL Data RX: Handle 831 flags 0x02 dlen 7               #272 [hci1] 15.332423
      ATT: Read Request (0x0a) len 2
        Handle: 0x003b
< HCI Command: Host Number of Com.. (0x03|0x0035) plen 5  #273 [hci1] 15.352268
        Num handles: 1
        Handle: 831 Address: DF:A9:FF:F6:B1:1A (OUI DF-A9-FF)
        Count: 1
< ACL Data TX: Handle 831 flags 0x00 dlen 9               #274 [hci1] 15.352332
      ATT: Read Response (0x0b) len 4
> HCI Event: Number of Completed Packets (0x13) plen 5    #275 [hci1] 15.492235
        Num handles: 1
        Handle: 831 Address: DF:A9:FF:F6:B1:1A (OUI DF-A9-FF)
        Count: 1
        #274: len 9 (0 Kb/s)
        Latency: 139 msec (59-219 msec ~132 msec)
> ACL Data RX: Handle 831 flags 0x02 dlen 27              #276 [hci1] 15.572544
> ACL Data RX: Handle 831 flags 0x01 dlen 7               #277 [hci1] 15.572794
      ATT: Write Command (0x52) len 29
        Handle: 0x003f
          Data: 010103010206000000001002010302020103042800050301000000
< HCI Command: Host Number of Com.. (0x03|0x0035) plen 5  #278 [hci1] 15.592406
        Num handles: 1
        Handle: 831 Address: DF:A9:FF:F6:B1:1A (OUI DF-A9-FF)
        Count: 1
< HCI Command: Host Number of Com.. (0x03|0x0035) plen 5  #279 [hci1] 15.594000
        Num handles: 1
        Handle: 831 Address: DF:A9:FF:F6:B1:1A (OUI DF-A9-FF)
        Count: 1
< ACL Data TX: Handle 831 flags 0x00 dlen 12              #280 [hci1] 15.594456
      ATT: Handle Value Notification (0x1b) len 7
        Handle: 0x003f
          Data: 0101030000
< ACL Data TX: Handle 831 flags 0x00 dlen 27              #281 [hci1] 15.594726
< ACL Data TX: Handle 831 flags 0x01 dlen 21              #282 [hci1] 15.594737
      ATT: Handle Value Notification (0x1b) len 43
        Handle: 0x0048
          Data: 03010002020a00102700409c00102700409c0006000000001002010302020103042800050301000000
> HCI Event: Number of Completed Packets (0x13) plen 5    #283 [hci1] 15.652699
        Num handles: 1
        Handle: 831 Address: DF:A9:FF:F6:B1:1A (OUI DF-A9-FF)
        Count: 1
        #280: len 12 (1 Kb/s)
        Latency: 58 msec (58-219 msec ~95 msec)
> HCI Event: Number of Completed Packets (0x13) plen 5    #284 [hci1] 15.653265
        Num handles: 1
        Handle: 831 Address: DF:A9:FF:F6:B1:1A (OUI DF-A9-FF)
        Count: 1
        #281: len 27 (3 Kb/s)
        Latency: 58 msec (58-219 msec ~76 msec)
> HCI Event: Number of Completed Packets (0x13) plen 5    #285 [hci1] 15.732215
        Num handles: 1
        Handle: 831 Address: DF:A9:FF:F6:B1:1A (OUI DF-A9-FF)
        Count: 1
        #282: len 21 (1 Kb/s)
        Latency: 137 msec (58-219 msec ~107 msec)
> ACL Data RX: Handle 831 flags 0x02 dlen 25              #286 [hci1] 15.812571
      ATT: Write Command (0x52) len 20
        Handle: 0x003f
          Data: 020103010110270000022800020a00a86100
< HCI Command: Host Number of Com.. (0x03|0x0035) plen 5  #287 [hci1] 15.832540
        Num handles: 1
        Handle: 831 Address: DF:A9:FF:F6:B1:1A (OUI DF-A9-FF)
        Count: 1
< ACL Data TX: Handle 831 flags 0x00 dlen 12              #288 [hci1] 15.833039
      ATT: Handle Value Notification (0x1b) len 7
        Handle: 0x003f
          Data: 0201030000
< ACL Data TX: Handle 831 flags 0x00 dlen 24              #289 [hci1] 15.833520
      ATT: Handle Value Notification (0x1b) len 19
        Handle: 0x0048
          Data: 0302010110270000022800020a00a86100
> HCI Event: Number of Completed Packets (0x13) plen 5    #290 [hci1] 15.892679
        Num handles: 1
        Handle: 831 Address: DF:A9:FF:F6:B1:1A (OUI DF-A9-FF)
        Count: 1
        #288: len 12 (1 Kb/s)
        Latency: 59 msec (58-219 msec ~83 msec)
> HCI Event: Number of Completed Packets (0x13) plen 5    #291 [hci1] 15.972204
        Num handles: 1
        Handle: 831 Address: DF:A9:FF:F6:B1:1A (OUI DF-A9-FF)
        Count: 1
        #289: len 24 (1 Kb/s)
        Latency: 138 msec (58-219 msec ~111 msec)
> ACL Data RX: Handle 831 flags 0x02 dlen 15              #292 [hci1] 16.052418
      ATT: Write Command (0x52) len 10
        Handle: 0x003f
          Data: 030103040302ff0f
< HCI Command: Host Number of Com.. (0x03|0x0035) plen 5  #293 [hci1] 16.072511
        Num handles: 1
        Handle: 831 Address: DF:A9:FF:F6:B1:1A (OUI DF-A9-FF)
        Count: 1
< ACL Data TX: Handle 831 flags 0x00 dlen 12              #294 [hci1] 16.072982
      ATT: Handle Value Notification (0x1b) len 7
        Handle: 0x003f
          Data: 0301030000
< ACL Data TX: Handle 831 flags 0x00 dlen 16              #295 [hci1] 16.073350
      ATT: Handle Value Notification (0x1b) len 11
        Handle: 0x0048
          Data: 03030101040302ff0f
> HCI Event: Number of Completed Packets (0x13) plen 5    #296 [hci1] 16.132739
        Num handles: 1
        Handle: 831 Address: DF:A9:FF:F6:B1:1A (OUI DF-A9-FF)
        Count: 1
        #294: len 12 (1 Kb/s)
        Latency: 59 msec (58-219 msec ~85 msec)
> HCI Event: Number of Completed Packets (0x13) plen 5    #297 [hci1] 16.212203
        Num handles: 1
        Handle: 831 Address: DF:A9:FF:F6:B1:1A (OUI DF-A9-FF)
        Count: 1
        #295: len 16 (0 Kb/s)
        Latency: 138 msec (58-219 msec ~112 msec)
> HCI Event: LE Meta Event (0x3e) plen 7                  #298 [hci1] 16.292642
      LE Connected Isochronous Stream Request (0x1a)
        ACL Handle: 831
        CIS Handle: 1970
        CIG ID: 0x01
        CIS ID: 0x01
< HCI Command: LE Accept Connecte.. (0x08|0x0066) plen 2  #299 [hci1] 16.312110
        CIS Handle: 1970
> HCI Event: Command Status (0x0f) plen 4                 #300 [hci1] 16.312615
      LE Accept Connected Isochronous Stream Request (0x08|0x0066) ncmd 1
        Status: Success (0x00)
> HCI Event: LE Meta Event (0x3e) plen 43                 #301 [hci1] 16.540344
      Unknown (0x2a)
        00 b2 07 d2 06 00 d2 06 00 d2 06 00 d2 06 00 02  ................
        02 03 00 01 01 01 00 00 28 00 08 00 46 02 00 00  ........(...F...
        00 28 00 10 27 00 10 27 00 00                    .(..'..'..      
> ACL Data RX: Handle 831 flags 0x02 dlen 10              #302 [hci1] 16.612386
      ATT: Write Command (0x52) len 5
        Handle: 0x003f
          Data: 040103
< HCI Command: Host Number of Com.. (0x03|0x0035) plen 5  #303 [hci1] 16.632048
        Num handles: 1
        Handle: 831 Address: DF:A9:FF:F6:B1:1A (OUI DF-A9-FF)
        Count: 1
< HCI Command: LE Setup Isochron.. (0x08|0x006e) plen 13  #304 [hci1] 16.632198
        Handle: 1970
        Data Path Direction: Input (Host to Controller) (0x00)
        Data Path: HCI (0x00)
        Coding Format: Transparent (0x03)
        Company Codec ID: Ericsson Technology Licensing (0)
        Vendor Codec ID: 0
        Controller Delay: 0 us (0x000000)
        Codec Configuration Length: 0
        Codec Configuration: 
< ACL Data TX: Handle 831 flags 0x00 dlen 12              #305 [hci1] 16.632207
      ATT: Handle Value Notification (0x1b) len 7
        Handle: 0x003f
          Data: 0401030000
< ACL Data TX: Handle 831 flags 0x00 dlen 16              #306 [hci1] 16.632208
      ATT: Handle Value Notification (0x1b) len 11
        Handle: 0x0048
          Data: 03040101040302ff0f
> HCI Event: Command Complete (0x0e) plen 6               #307 [hci1] 16.632929
      LE Setup Isochronous Data Path (0x08|0x006e) ncmd 1
        Status: Success (0x00)
        Handle: 1970
< ISO Data TX: Handle 1970 flags 0x02 dlen 44             #308 [hci1] 16.662018
< ISO Data TX: Handle 1970 flags 0x02 dlen 44             #309 [hci1] 16.662283
> HCI Event: Number of Completed Packets (0x13) plen 5    #310 [hci1] 16.663275
        Num handles: 1
        Handle: 1970
        Count: 1
> HCI Event: Number of Completed Packets (0x13) plen 5    #311 [hci1] 16.663690
        Num handles: 1
        Handle: 1970
        Count: 1
< ISO Data TX: Handle 1970 flags 0x02 dlen 44             #312 [hci1] 16.682017
< ISO Data TX: Handle 1970 flags 0x02 dlen 44             #313 [hci1] 16.682267
> HCI Event: Number of Completed Packets (0x13) plen 5    #314 [hci1] 16.683257
        Num handles: 1
        Handle: 1970
        Count: 1
> HCI Event: Number of Completed Packets (0x13) plen 5    #315 [hci1] 16.683689
        Num handles: 1
        Handle: 1970
        Count: 1
> HCI Event: Number of Completed Packets (0x13) plen 5    #316 [hci1] 16.692691
        Num handles: 1
        Handle: 831 Address: DF:A9:FF:F6:B1:1A (OUI DF-A9-FF)
        Count: 1
        #305: len 12 (1 Kb/s)
        Latency: 60 msec (58-219 msec ~86 msec)
< ISO Data TX: Handle 1970 flags 0x02 dlen 44             #317 [hci1] 16.702055
< ISO Data TX: Handle 1970 flags 0x02 dlen 44             #318 [hci1] 16.702267
> HCI Event: Number of Completed Packets (0x13) plen 5    #319 [hci1] 16.703335
        Num handles: 1
        Handle: 1970
        Count: 1
> HCI Event: Number of Completed Packets (0x13) plen 5    #320 [hci1] 16.703751
        Num handles: 1
        Handle: 1970
        Count: 1
< ISO Data TX: Handle 1970 flags 0x02 dlen 44             #321 [hci1] 16.721958
< ISO Data TX: Handle 1970 flags 0x02 dlen 44             #322 [hci1] 16.722141
> HCI Event: Number of Completed Packets (0x13) plen 5    #323 [hci1] 16.723190
        Num handles: 1
        Handle: 1970
        Count: 1
> HCI Event: Number of Completed Packets (0x13) plen 5    #324 [hci1] 16.723681
        Num handles: 1
        Handle: 1970
        Count: 1
< ISO Data TX: Handle 1970 flags 0x02 dlen 44             #325 [hci1] 16.741829
< ISO Data TX: Handle 1970 flags 0x02 dlen 44             #326 [hci1] 16.741923
> HCI Event: Number of Completed Packets (0x13) plen 5    #327 [hci1] 16.742962
        Num handles: 1
        Handle: 1970
        Count: 1
> HCI Event: Number of Completed Packets (0x13) plen 5    #328 [hci1] 16.743459
        Num handles: 1
        Handle: 1970
        Count: 1
< ISO Data TX: Handle 1970 flags 0x02 dlen 44             #329 [hci1] 16.761751
< ISO Data TX: Handle 1970 flags 0x02 dlen 44             #330 [hci1] 16.761810
> HCI Event: Number of Completed Packets (0x13) plen 5    #331 [hci1] 16.762977
        Num handles: 1
        Handle: 1970
        Count: 1
> HCI Event: Number of Completed Packets (0x13) plen 5    #332 [hci1] 16.763437
        Num handles: 1
        Handle: 1970
        Count: 1
> HCI Event: Number of Completed Packets (0x13) plen 5    #333 [hci1] 16.772212
        Num handles: 1
        Handle: 831 Address: DF:A9:FF:F6:B1:1A (OUI DF-A9-FF)
        Count: 1
        #306: len 16 (0 Kb/s)
        Latency: 140 msec (58-219 msec ~113 msec)
< ISO Data TX: Handle 1970 flags 0x02 dlen 44             #334 [hci1] 16.781792
< ISO Data TX: Handle 1970 flags 0x02 dlen 44             #335 [hci1] 16.781859
> HCI Event: Number of Completed Packets (0x13) plen 5    #336 [hci1] 16.782961
        Num handles: 1
        Handle: 1970
        Count: 1
> HCI Event: Number of Completed Packets (0x13) plen 5    #337 [hci1] 16.783465
        Num handles: 1
        Handle: 1970
        Count: 1
< ISO Data TX: Handle 1970 flags 0x02 dlen 44             #338 [hci1] 16.801786
< ISO Data TX: Handle 1970 flags 0x02 dlen 44             #339 [hci1] 16.801792
> HCI Event: Number of Completed Packets (0x13) plen 5    #340 [hci1] 16.802997
        Num handles: 1
        Handle: 1970
        Count: 1
> HCI Event: Number of Completed Packets (0x13) plen 5    #341 [hci1] 16.803445
        Num handles: 1
        Handle: 1970
        Count: 1
< ISO Data TX: Handle 1970 flags 0x02 dlen 44             #342 [hci1] 16.821846
< ISO Data TX: Handle 1970 flags 0x02 dlen 44             #343 [hci1] 16.821990
> HCI Event: Number of Completed Packets (0x13) plen 5    #344 [hci1] 16.823065
        Num handles: 1
        Handle: 1970
        Count: 1
> HCI Event: Number of Completed Packets (0x13) plen 5    #345 [hci1] 16.823519
        Num handles: 1
        Handle: 1970
        Count: 1
< ISO Data TX: Handle 1970 flags 0x02 dlen 44             #346 [hci1] 16.841928
< ISO Data TX: Handle 1970 flags 0x02 dlen 44             #347 [hci1] 16.842068
> HCI Event: Number of Completed Packets (0x13) plen 5    #348 [hci1] 16.843160
        Num handles: 1
        Handle: 1970
        Count: 1
> HCI Event: Number of Completed Packets (0x13) plen 5    #349 [hci1] 16.843631
        Num handles: 1
        Handle: 1970
        Count: 1
< ISO Data TX: Handle 1970 flags 0x02 dlen 44             #350 [hci1] 16.861909
< ISO Data TX: Handle 1970 flags 0x02 dlen 44             #351 [hci1] 16.862031
> HCI Event: Number of Completed Packets (0x13) plen 5    #352 [hci1] 16.863172
        Num handles: 1
        Handle: 1970
        Count: 1
> HCI Event: Number of Completed Packets (0x13) plen 5    #353 [hci1] 16.863624
        Num handles: 1
        Handle: 1970
        Count: 1
< ISO Data TX: Handle 1970 flags 0x02 dlen 44             #354 [hci1] 16.882174
< ISO Data TX: Handle 1970 flags 0x02 dlen 44             #355 [hci1] 16.882478
> HCI Event: Number of Completed Packets (0x13) plen 5    #356 [hci1] 16.883441
        Num handles: 1
        Handle: 1970
        Count: 1
> HCI Event: Number of Completed Packets (0x13) plen 5    #357 [hci1] 16.883854
        Num handles: 1
        Handle: 1970
        Count: 1
< ISO Data TX: Handle 1970 flags 0x02 dlen 44             #358 [hci1] 16.902019
< ISO Data TX: Handle 1970 flags 0x02 dlen 44             #359 [hci1] 16.902298
> HCI Event: Number of Completed Packets (0x13) plen 5    #360 [hci1] 16.903264
        Num handles: 1
        Handle: 1970
        Count: 1
> HCI Event: Number of Completed Packets (0x13) plen 5    #361 [hci1] 16.903778
        Num handles: 1
        Handle: 1970
        Count: 1
< ISO Data TX: Handle 1970 flags 0x02 dlen 44             #362 [hci1] 16.922094
< ISO Data TX: Handle 1970 flags 0x02 dlen 44             #363 [hci1] 16.922302
> HCI Event: Number of Completed Packets (0x13) plen 5    #364 [hci1] 16.923319
        Num handles: 1
        Handle: 1970
        Count: 1
> HCI Event: Number of Completed Packets (0x13) plen 5    #365 [hci1] 16.923746
        Num handles: 1
        Handle: 1970
        Count: 1
< ISO Data TX: Handle 1970 flags 0x02 dlen 44             #366 [hci1] 16.942015
< ISO Data TX: Handle 1970 flags 0x02 dlen 44             #367 [hci1] 16.942248
> HCI Event: Number of Completed Packets (0x13) plen 5    #368 [hci1] 16.943194
        Num handles: 1
        Handle: 1970
        Count: 1
> HCI Event: Number of Completed Packets (0x13) plen 5    #369 [hci1] 16.943672
        Num handles: 1
        Handle: 1970
        Count: 1
< ISO Data TX: Handle 1970 flags 0x02 dlen 44             #370 [hci1] 16.962012
< ISO Data TX: Handle 1970 flags 0x02 dlen 44             #371 [hci1] 16.962297
> HCI Event: Number of Completed Packets (0x13) plen 5    #372 [hci1] 16.963267
        Num handles: 1
        Handle: 1970
        Count: 1
> HCI Event: Number of Completed Packets (0x13) plen 5    #373 [hci1] 16.963709
        Num handles: 1
        Handle: 1970
        Count: 1
< ISO Data TX: Handle 1970 flags 0x02 dlen 44             #374 [hci1] 16.981983
< ISO Data TX: Handle 1970 flags 0x02 dlen 44             #375 [hci1] 16.982175
> HCI Event: Number of Completed Packets (0x13) plen 5    #376 [hci1] 16.983215
        Num handles: 1
        Handle: 1970
        Count: 1
> HCI Event: Number of Completed Packets (0x13) plen 5    #377 [hci1] 16.983652
        Num handles: 1
        Handle: 1970
        Count: 1
< ISO Data TX: Handle 1970 flags 0x02 dlen 44             #378 [hci1] 17.001918
< ISO Data TX: Handle 1970 flags 0x02 dlen 44             #379 [hci1] 17.002083
> HCI Event: Number of Completed Packets (0x13) plen 5    #380 [hci1] 17.003244
        Num handles: 1
        Handle: 1970
        Count: 1
> HCI Event: Number of Completed Packets (0x13) plen 5    #381 [hci1] 17.003605
        Num handles: 1
        Handle: 1970
        Count: 1
< ISO Data TX: Handle 1970 flags 0x02 dlen 44             #382 [hci1] 17.021919
< ISO Data TX: Handle 1970 flags 0x02 dlen 44             #383 [hci1] 17.022138
> HCI Event: Number of Completed Packets (0x13) plen 5    #384 [hci1] 17.023145
        Num handles: 1
        Handle: 1970
        Count: 1
> HCI Event: Number of Completed Packets (0x13) plen 5    #385 [hci1] 17.023581
        Num handles: 1
        Handle: 1970
        Count: 1
< ISO Data TX: Handle 1970 flags 0x02 dlen 44             #386 [hci1] 17.041940
< ISO Data TX: Handle 1970 flags 0x02 dlen 44             #387 [hci1] 17.042082
> HCI Event: Number of Completed Packets (0x13) plen 5    #388 [hci1] 17.043196
        Num handles: 1
        Handle: 1970
        Count: 1
> HCI Event: Number of Completed Packets (0x13) plen 5    #389 [hci1] 17.043719
        Num handles: 1
        Handle: 1970
        Count: 1
< ISO Data TX: Handle 1970 flags 0x02 dlen 44             #390 [hci1] 17.061942
< ISO Data TX: Handle 1970 flags 0x02 dlen 44             #391 [hci1] 17.062148
> HCI Event: Number of Completed Packets (0x13) plen 5    #392 [hci1] 17.063097
        Num handles: 1
        Handle: 1970
        Count: 1
> HCI Event: Number of Completed Packets (0x13) plen 5    #393 [hci1] 17.063584
        Num handles: 1
        Handle: 1970
        Count: 1
< ISO Data TX: Handle 1970 flags 0x02 dlen 44             #394 [hci1] 17.081947
< ISO Data TX: Handle 1970 flags 0x02 dlen 44             #395 [hci1] 17.082199
> HCI Event: Number of Completed Packets (0x13) plen 5    #396 [hci1] 17.083123
        Num handles: 1
        Handle: 1970
        Count: 1
> HCI Event: Number of Completed Packets (0x13) plen 5    #397 [hci1] 17.083637
        Num handles: 1
        Handle: 1970
        Count: 1
< ISO Data TX: Handle 1970 flags 0x02 dlen 44             #398 [hci1] 17.101932
< ISO Data TX: Handle 1970 flags 0x02 dlen 44             #399 [hci1] 17.102127
> HCI Event: Number of Completed Packets (0x13) plen 5    #400 [hci1] 17.103243
        Num handles: 1
        Handle: 1970
        Count: 1
> HCI Event: Number of Completed Packets (0x13) plen 5    #401 [hci1] 17.103614
        Num handles: 1
        Handle: 1970
        Count: 1
< ISO Data TX: Handle 1970 flags 0x02 dlen 44             #402 [hci1] 17.121998
< ISO Data TX: Handle 1970 flags 0x02 dlen 44             #403 [hci1] 17.122189
> HCI Event: Number of Completed Packets (0x13) plen 5    #404 [hci1] 17.123205
        Num handles: 1
        Handle: 1970
        Count: 1
> HCI Event: Number of Completed Packets (0x13) plen 5    #405 [hci1] 17.123706
        Num handles: 1
        Handle: 1970
        Count: 1
< ISO Data TX: Handle 1970 flags 0x02 dlen 44             #406 [hci1] 17.141986
< ISO Data TX: Handle 1970 flags 0x02 dlen 44             #407 [hci1] 17.142229
> HCI Event: Number of Completed Packets (0x13) plen 5    #408 [hci1] 17.143261
        Num handles: 1
        Handle: 1970
        Count: 1
> HCI Event: Number of Completed Packets (0x13) plen 5    #409 [hci1] 17.143680
        Num handles: 1
        Handle: 1970
        Count: 1
< ISO Data TX: Handle 1970 flags 0x02 dlen 44             #410 [hci1] 17.161993
< ISO Data TX: Handle 1970 flags 0x02 dlen 44             #411 [hci1] 17.162232
> HCI Event: Number of Completed Packets (0x13) plen 5    #412 [hci1] 17.163275
        Num handles: 1
        Handle: 1970
        Count: 1
> HCI Event: Number of Completed Packets (0x13) plen 5    #413 [hci1] 17.163656
        Num handles: 1
        Handle: 1970
        Count: 1
< ISO Data TX: Handle 1970 flags 0x02 dlen 44             #414 [hci1] 17.182062
< ISO Data TX: Handle 1970 flags 0x02 dlen 44             #415 [hci1] 17.182296
> HCI Event: Number of Completed Packets (0x13) plen 5    #416 [hci1] 17.183319
        Num handles: 1
        Handle: 1970
        Count: 1
> HCI Event: Number of Completed Packets (0x13) plen 5    #417 [hci1] 17.183813
        Num handles: 1
        Handle: 1970
        Count: 1
< ISO Data TX: Handle 1970 flags 0x02 dlen 44             #418 [hci1] 17.201990
< ISO Data TX: Handle 1970 flags 0x02 dlen 44             #419 [hci1] 17.202182
> HCI Event: Number of Completed Packets (0x13) plen 5    #420 [hci1] 17.203216
        Num handles: 1
        Handle: 1970
        Count: 1
> HCI Event: Number of Completed Packets (0x13) plen 5    #421 [hci1] 17.203731
        Num handles: 1
        Handle: 1970
        Count: 1
< ISO Data TX: Handle 1970 flags 0x02 dlen 44             #422 [hci1] 17.222034
< ISO Data TX: Handle 1970 flags 0x02 dlen 44             #423 [hci1] 17.222200
> HCI Event: Number of Completed Packets (0x13) plen 5    #424 [hci1] 17.223245
        Num handles: 1
        Handle: 1970
        Count: 1
> HCI Event: Number of Completed Packets (0x13) plen 5    #425 [hci1] 17.223755
        Num handles: 1
        Handle: 1970
        Count: 1
< ISO Data TX: Handle 1970 flags 0x02 dlen 44             #426 [hci1] 17.241886
< ISO Data TX: Handle 1970 flags 0x02 dlen 44             #427 [hci1] 17.242109
> HCI Event: Number of Completed Packets (0x13) plen 5    #428 [hci1] 17.243130
        Num handles: 1
        Handle: 1970
        Count: 1
> HCI Event: Number of Completed Packets (0x13) plen 5    #429 [hci1] 17.243661
        Num handles: 1
        Handle: 1970
        Count: 1
< ISO Data TX: Handle 1970 flags 0x02 dlen 44             #430 [hci1] 17.261962
< ISO Data TX: Handle 1970 flags 0x02 dlen 44             #431 [hci1] 17.262147
> HCI Event: Number of Completed Packets (0x13) plen 5    #432 [hci1] 17.263081
        Num handles: 1
        Handle: 1970
        Count: 1
> HCI Event: Number of Completed Packets (0x13) plen 5    #433 [hci1] 17.263627
        Num handles: 1
        Handle: 1970
        Count: 1
< ISO Data TX: Handle 1970 flags 0x02 dlen 44             #434 [hci1] 17.282014
< ISO Data TX: Handle 1970 flags 0x02 dlen 44             #435 [hci1] 17.282231
> HCI Event: Number of Completed Packets (0x13) plen 5    #436 [hci1] 17.283296
        Num handles: 1
        Handle: 1970
        Count: 1
> HCI Event: Number of Completed Packets (0x13) plen 5    #437 [hci1] 17.283658
        Num handles: 1
        Handle: 1970
        Count: 1
< ISO Data TX: Handle 1970 flags 0x02 dlen 44             #438 [hci1] 17.302036
< ISO Data TX: Handle 1970 flags 0x02 dlen 44             #439 [hci1] 17.302265
> HCI Event: Number of Completed Packets (0x13) plen 5    #440 [hci1] 17.303205
        Num handles: 1
        Handle: 1970
        Count: 1
> HCI Event: Number of Completed Packets (0x13) plen 5    #441 [hci1] 17.303741
        Num handles: 1
        Handle: 1970
        Count: 1
< ISO Data TX: Handle 1970 flags 0x02 dlen 44             #442 [hci1] 17.322010
< ISO Data TX: Handle 1970 flags 0x02 dlen 44             #443 [hci1] 17.322199
> HCI Event: Number of Completed Packets (0x13) plen 5    #444 [hci1] 17.323254
        Num handles: 1
        Handle: 1970
        Count: 1
> HCI Event: Number of Completed Packets (0x13) plen 5    #445 [hci1] 17.323771
        Num handles: 1
        Handle: 1970
        Count: 1
< ISO Data TX: Handle 1970 flags 0x02 dlen 44             #446 [hci1] 17.342060
< ISO Data TX: Handle 1970 flags 0x02 dlen 44             #447 [hci1] 17.342320
> HCI Event: Number of Completed Packets (0x13) plen 5    #448 [hci1] 17.343276
        Num handles: 1
        Handle: 1970
        Count: 1
> HCI Event: Number of Completed Packets (0x13) plen 5    #449 [hci1] 17.343792
        Num handles: 1
        Handle: 1970
        Count: 1
< ISO Data TX: Handle 1970 flags 0x02 dlen 44             #450 [hci1] 17.362038
< ISO Data TX: Handle 1970 flags 0x02 dlen 44             #451 [hci1] 17.362300
> HCI Event: Number of Completed Packets (0x13) plen 5    #452 [hci1] 17.363310
        Num handles: 1
        Handle: 1970
        Count: 1
> HCI Event: Number of Completed Packets (0x13) plen 5    #453 [hci1] 17.363764
        Num handles: 1
        Handle: 1970
        Count: 1
< HCI Command: LE Remove Isochron.. (0x08|0x006f) plen 3  #454 [hci1] 17.372877
        Connection Handle: 1970
        Data Path Direction: Output (Controller to Host) (0x01)
< ACL Data TX: Handle 831 flags 0x00 dlen 16              #455 [hci1] 17.372900
      ATT: Handle Value Notification (0x1b) len 11
        Handle: 0x0048
          Data: 03050101040302ff0f
> HCI Event: Command Complete (0x0e) plen 6               #456 [hci1] 17.373412
      LE Remove Isochronous Data Path (0x08|0x006f) ncmd 1
        Status: Success (0x00)
        Connection handle: 178
> HCI Event: Number of Completed Packets (0x13) plen 5    #457 [hci1] 17.492220
        Num handles: 1
        Handle: 831 Address: DF:A9:FF:F6:B1:1A (OUI DF-A9-FF)
        Count: 1
        #455: len 16 (1 Kb/s)
        Latency: 119 msec (58-219 msec ~116 msec)
> ACL Data RX: Handle 831 flags 0x02 dlen 10              #458 [hci1] 17.492450
      ATT: Write Command (0x52) len 5
        Handle: 0x003f
          Data: 060103
< HCI Command: Host Number of Com.. (0x03|0x0035) plen 5  #459 [hci1] 17.512393
        Num handles: 1
        Handle: 831 Address: DF:A9:FF:F6:B1:1A (OUI DF-A9-FF)
        Count: 1
< ACL Data TX: Handle 831 flags 0x00 dlen 12              #460 [hci1] 17.512851
      ATT: Handle Value Notification (0x1b) len 7
        Handle: 0x003f
          Data: 0601030000
< ACL Data TX: Handle 831 flags 0x00 dlen 24              #461 [hci1] 17.513016
      ATT: Handle Value Notification (0x1b) len 19
        Handle: 0x0048
          Data: 0302010110270000022800020a00a86100
> HCI Event: Number of Completed Packets (0x13) plen 5    #462 [hci1] 17.572582
        Num handles: 1
        Handle: 831 Address: DF:A9:FF:F6:B1:1A (OUI DF-A9-FF)
        Count: 1
        #460: len 12 (1 Kb/s)
        Latency: 59 msec (58-219 msec ~87 msec)
> HCI Event: Number of Completed Packets (0x13) plen 5    #463 [hci1] 17.652167
        Num handles: 1
        Handle: 831 Address: DF:A9:FF:F6:B1:1A (OUI DF-A9-FF)
        Count: 1
        #461: len 24 (1 Kb/s)
        Latency: 139 msec (58-219 msec ~113 msec)
< HCI Command: Disconnect (0x01|0x0006) plen 3            #464 [hci1] 18.022012
        Handle: 1970
        Reason: Remote User Terminated Connection (0x13)
> HCI Event: Command Status (0x0f) plen 4                 #465 [hci1] 18.022479
      Disconnect (0x01|0x0006) ncmd 1
        Status: Success (0x00)
> HCI Event: Disconnect Complete (0x05) plen 4            #466 [hci1] 18.219702
        Status: Success (0x00)
        Handle: 1970
        Reason: Connection Terminated By Local Host (0x16)
> HCI Event: Disconnect Complete (0x05) plen 4            #467 [hci1] 19.172483
        Status: Success (0x00)
        Handle: 831 Address: DF:A9:FF:F6:B1:1A (OUI DF-A9-FF)
        Reason: Remote User Terminated Connection (0x13)
< HCI Command: Reset (0x03|0x0003) plen 0                 #468 [hci1] 24.181993
> HCI Event: Command Complete (0x0e) plen 4               #469 [hci1] 24.182507
      Reset (0x03|0x0003) ncmd 1
        Status: Success (0x00)
@ USER Close: main                                    {0x0001} [hci1] 24.191813
= Close Index: 00:00:00:00:00:00                               [hci1] 24.191822
