Bluetooth monitor ver 5.72
= Note: Linux version 6.14.0-36-generic (x86_64)                       0.782503
= Note: Bluetooth subsystem version 2.22                               0.782505
= New Index: 00:00:00:00:00:00 (Primary,UART,hci1)              [hci1] 0.782506
= New Index: 48:5F:99:8E:E0:64 (Primary,USB,hci0)               [hci0] 0.782507
= Open Index: 00:00:00:00:00:00                                 [hci1] 1.296289
= Index Info: 00:00:00:00:00:00 (Nordic Semiconductor ASA)      [hci1] 1.296302
@ USER Open: main (privileged) version 2.22            {0x0001} [hci1] 1.296311
< HCI Command: Reset (0x03|0x0003) plen 0                    #1 [hci1] 1.297630
> HCI Event: Command Complete (0x0e) plen 4                  #2 [hci1] 1.298200
      Reset (0x03|0x0003) ncmd 1
        Status: Success (0x00)
< HCI Command: Read Local Supported... (0x04|0x0003) plen 0  #3 [hci1] 1.315673
> HCI Event: Command Complete (0x0e) plen 12                 #4 [hci1] 1.316169
      Read Local Supported Features (0x04|0x0003) ncmd 1
        Status: Success (0x00)
        Features: 0x00 0x00 0x00 0x00 0x60 0x00 0x00 0x00
          BR/EDR Not Supported
          LE Supported (Controller)
< HCI Command: Read Local Version In.. (0x04|0x0001) plen 0  #5 [hci1] 1.335634
> HCI Event: Command Complete (0x0e) plen 12                 #6 [hci1] 1.336137
      Read Local Version Information (0x04|0x0001) ncmd 1
        Status: Success (0x00)
        HCI version: Reserved (0x0f) - Revision 12393 (0x3069)
        LMP version: Reserved (0x0f) - Subversion 12393 (0x3069)
        Manufacturer: Nordic Semiconductor ASA (89)
< HCI Command: Read Local Supported... (0x04|0x0002) plen 0  #7 [hci1] 1.355582
> HCI Event: Command Complete (0x0e) plen 68                 #8 [hci1] 1.356735
      Read Local Supported Commands (0x04|0x0002) ncmd 1
        Status: Success (0x00)
        Commands: 119 entries
          Disconnect (Octet 0 - Bit 5)
          Read Remote Version Information (Octet 2 - Bit 7)
          Set Event Mask (Octet 5 - Bit 6)
          Reset (Octet 5 - Bit 7)
          Read Connection Accept Timeout (Octet 7 - Bit 2)
          Write Connection Accept Timeout (Octet 7 - Bit 3)
          Read Transmit Power Level (Octet 10 - Bit 2)
          Set Controller To Host Flow Control (Octet 10 - Bit 5)
          Host Buffer Size (Octet 10 - Bit 6)
          Host Number of Completed Packets (Octet 10 - Bit 7)
          Read Local Version Information (Octet 14 - Bit 3)
          Read Local Supported Features (Octet 14 - Bit 5)
          Read BD ADDR (Octet 15 - Bit 1)
          Read RSSI (Octet 15 - Bit 5)
          Set Event Mask Page 2 (Octet 22 - Bit 2)
          LE Set Event Mask (Octet 25 - Bit 0)
          LE Read Buffer Size (Octet 25 - Bit 1)
          LE Read Local Supported Features (Octet 25 - Bit 2)
          LE Set Random Address (Octet 25 - Bit 4)
          LE Set Advertising Parameters (Octet 25 - Bit 5)
          LE Read Advertising Channel TX Power (Octet 25 - Bit 6)
          LE Set Advertising Data (Octet 25 - Bit 7)
          LE Set Scan Response Data (Octet 26 - Bit 0)
          LE Set Advertise Enable (Octet 26 - Bit 1)
          LE Set Scan Parameters (Octet 26 - Bit 2)
          LE Set Scan Enable (Octet 26 - Bit 3)
          LE Create Connection (Octet 26 - Bit 4)
          LE Create Connection Cancel (Octet 26 - Bit 5)
          LE Read Accept List Size (Octet 26 - Bit 6)
          LE Clear Accept List (Octet 26 - Bit 7)
          LE Add Device To Accept List (Octet 27 - Bit 0)
          LE Remove Device From Accept List (Octet 27 - Bit 1)
          LE Connection Update (Octet 27 - Bit 2)
          LE Set Host Channel Classification (Octet 27 - Bit 3)
          LE Read Channel Map (Octet 27 - Bit 4)
          LE Read Remote Used Features (Octet 27 - Bit 5)
          LE Encrypt (Octet 27 - Bit 6)
          LE Rand (Octet 27 - Bit 7)
          LE Start Encryption (Octet 28 - Bit 0)
          LE Long Term Key Request Reply (Octet 28 - Bit 1)
          LE Long Term Key Request Neg Reply (Octet 28 - Bit 2)
          LE Read Supported States (Octet 28 - Bit 3)
          LE Receiver Test (Octet 28 - Bit 4)
          LE Transmitter Test (Octet 28 - Bit 5)
          LE Test End (Octet 28 - Bit 6)
          Read Authenticated Payload Timeout (Octet 32 - Bit 4)
          Write Authenticated Payload Timeout (Octet 32 - Bit 5)
          LE Set Data Length (Octet 33 - Bit 6)
          LE Read Suggested Default Data Length (Octet 33 - Bit 7)
          LE Write Suggested Default Data Length (Octet 34 - Bit 0)
          LE Add Device To Resolving List (Octet 34 - Bit 3)
          LE Remove Device From Resolving List (Octet 34 - Bit 4)
          LE Clear Resolving List (Octet 34 - Bit 5)
          LE Read Resolving List Size (Octet 34 - Bit 6)
          LE Set Address Resolution Enable (Octet 35 - Bit 1)
          LE Set Resolvable Private Address Timeout (Octet 35 - Bit 2)
          LE Read Maximum Data Length (Octet 35 - Bit 3)
          LE Read PHY (Octet 35 - Bit 4)
          LE Set Default PHY (Octet 35 - Bit 5)
          LE Set PHY (Octet 35 - Bit 6)
          LE Enhanced Receiver Test (Octet 35 - Bit 7)
          LE Enhanced Transmitter Test (Octet 36 - Bit 0)
          LE Set Advertising Set Random Address (Octet 36 - Bit 1)
          LE Set Extended Advertising Parameters (Octet 36 - Bit 2)
          LE Set Extended Advertising Data (Octet 36 - Bit 3)
          LE Set Extended Scan Response Data (Octet 36 - Bit 4)
          LE Set Extended Advertising Enable (Octet 36 - Bit 5)
          LE Read Maximum Advertising Data Length (Octet 36 - Bit 6)
          LE Read Number of Supported Advertising Sets (Octet 36 - Bit 7)
          LE Remove Advertising Set (Octet 37 - Bit 0)
          LE Clear Advertising Sets (Octet 37 - Bit 1)
          LE Set Periodic Advertising Parameters (Octet 37 - Bit 2)
          LE Set Periodic Advertising Data (Octet 37 - Bit 3)
          LE Set Periodic Advertising Enable (Octet 37 - Bit 4)
          LE Set Extended Scan Parameters (Octet 37 - Bit 5)
          LE Set Extended Scan Enable (Octet 37 - Bit 6)
          LE Extended Create Connection (Octet 37 - Bit 7)
          LE Periodic Advertising Create Sync (Octet 38 - Bit 0)
          LE Periodic Advertising Create Sync Cancel (Octet 38 - Bit 1)
          LE Periodic Advertising Terminate Sync (Octet 38 - Bit 2)
          LE Add Device To Periodic Advertiser List (Octet 38 - Bit 3)
          LE Remove Device From Periodic Advertiser List (Octet 38 - Bit 4)
          LE Clear Periodic Advertiser List (Octet 38 - Bit 5)
          LE Read Periodic Advertiser List Size (Octet 38 - Bit 6)
          LE Read Transmit Power (Octet 38 - Bit 7)
          LE Read RF Path Compensation (Octet 39 - Bit 0)
          LE Write RF Path Compensation (Octet 39 - Bit 1)
          LE Set Privacy Mode (Octet 39 - Bit 2)
          LE Periodic Advertising Receive Enable (Octet 40 - Bit 5)
          LE Periodic Advertising Sync Transfer (Octet 40 - Bit 6)
          LE Periodic Advertising Set Info Transfer (Octet 40 - Bit 7)
          LE Periodic Advertising Sync Transfer Parameters (Octet 41 - Bit 0)
          LE Set Default Periodic Advertisng Sync Transfer Parameters (Octet 41 - Bit 1)
          LE Read Buffer v2 (Octet 41 - Bit 5)
          LE Read ISO TX Sync (Octet 41 - Bit 6)
          LE Set Connected Isochronous Group Parameters (Octet 41 - Bit 7)
          LE Set Connected Isochronous Group Parameters Test (Octet 42 - Bit 0)
          LE Create Connected Isochronous Stream (Octet 42 - Bit 1)
          LE Remove Connected Isochronous Group (Octet 42 - Bit 2)
          LE Accept Connected Isochronous Stream Request (Octet 42 - Bit 3)
          LE Reject Connected Isochronous Stream Request (Octet 42 - Bit 4)
          LE Create Broadcast Isochronous Group (Octet 42 - Bit 5)
          LE Create Broadcast Isochronous Group Test (Octet 42 - Bit 6)
          LE Terminate Broadcast Isochronous Group (Octet 42 - Bit 7)
          LE Broadcast Isochronous Group Create Sync (Octet 43 - Bit 0)
          LE Broadcast Isochronous Group Terminate Sync (Octet 43 - Bit 1)
          LE Request Peer SCA (Octet 43 - Bit 2)
          LE Setup Isochronous Data Path (Octet 43 - Bit 3)
          LE Remove Isochronous Data Path (Octet 43 - Bit 4)
          LE Isochronous Transmit Test (Octet 43 - Bit 5)
          LE Isochronous Receive Test (Octet 43 - Bit 6)
          LE Isochronous Read Test Counters (Octet 43 - Bit 7)
          LE Isochronous Read Test Counters (Octet 44 - Bit 0)
          LE Set Host Feature (Octet 44 - Bit 1)
          Octet 44 - Bit 2 
          Octet 45 - Bit 6 
          Octet 46 - Bit 0 
          Octet 46 - Bit 1 
          Octet 46 - Bit 2 
< HCI Command: Host Buffer Size (0x03|0x0033) plen 7         #9 [hci1] 1.375478
        ACL MTU: 255  ACL max packet: 16
        SCO MTU: 0    SCO max packet: 0
> HCI Event: Command Complete (0x0e) plen 4                 #10 [hci1] 1.377969
      Host Buffer Size (0x03|0x0033) ncmd 1
        Status: Success (0x00)
< HCI Command: Set Controller To Ho.. (0x03|0x0031) plen 1  #11 [hci1] 1.395641
        Flow control: ACL Data Packets (0x01)
> HCI Event: Command Complete (0x0e) plen 4                 #12 [hci1] 1.396044
      Set Controller To Host Flow Control (0x03|0x0031) ncmd 1
        Status: Success (0x00)
< HCI Command: LE Read Local Suppor.. (0x08|0x0003) plen 0  #13 [hci1] 1.415471
> HCI Event: Command Complete (0x0e) plen 12                #14 [hci1] 1.415931
      LE Read Local Supported Features (0x08|0x0003) ncmd 1
        Status: Success (0x00)
        Features: 0xfd 0x79 0x00 0xf7 0x30 0x01 0x00 0x00
          LE Encryption
          Extended Reject Indication
          Peripheral-initiated Features Exchange
          LE Ping
          LE Data Packet Length Extension
          LL Privacy
          Extended Scanner Filter Policies
          LE 2M PHY
          LE Coded PHY
          LE Extended Advertising
          LE Periodic Advertising
          Channel Selection Algorithm #2
          Periodic Advertising Sync Transfer - Sender
          Periodic Advertising Sync Transfer - Recipient
          Sleep Clock Accuracy Updates
          Connected Isochronous Stream - Central
          Connected Isochronous Stream - Peripheral
          Isochronous Broadcaster
          Synchronized Receiver
          Periodic Advertising ADI support
          Connection Subrating
          Unknown features (0x0000010000000000)
< HCI Command: LE Set Host Feature (0x08|0x0074) plen 2     #15 [hci1] 1.436349
        Bit Number: 32
          Connected Isochronous Stream (Host Support)
        Bit Value: 1
> HCI Event: Command Complete (0x0e) plen 4                 #16 [hci1] 1.436830
      LE Set Host Feature (0x08|0x0074) ncmd 1
        Status: Success (0x00)
< HCI Command: LE Read Buffer v2 (0x08|0x0060) plen 0       #17 [hci1] 1.455505
> HCI Event: Command Complete (0x0e) plen 10                #18 [hci1] 1.455990
      LE Read Buffer v2 (0x08|0x0060) ncmd 1
        Status: Success (0x00)
        ACL MTU: 27
        ACL max packet: 3
        ISO MTU: 318
        ISO max packet: 3
< HCI Command: LE Read Maximum Adve.. (0x08|0x003a) plen 0  #19 [hci1] 1.475625
> HCI Event: Command Complete (0x0e) plen 6                 #20 [hci1] 1.476043
      LE Read Maximum Advertising Data Length (0x08|0x003a) ncmd 1
        Status: Success (0x00)
        Max length: 1650
< HCI Command: LE Read Supported St.. (0x08|0x001c) plen 0  #21 [hci1] 1.495589
> HCI Event: Command Complete (0x0e) plen 12                #22 [hci1] 1.496052
      LE Read Supported States (0x08|0x001c) ncmd 1
        Status: Success (0x00)
        States: 0x000003ff3e0306ff
          Non-connectable Advertising State
          Scannable Advertising State
          Connectable Advertising State
          High Duty Cycle Directed Advertising State
          Passive Scanning State
          Active Scanning State
          Initiating State
            and Connection State (Central Role)
          Connection State (Peripheral Role)
          Scannable Advertising State
            and Passive Scanning State
          Connectable Advertising State
            and Passive Scanning State
          Non-connectable Advertising State
            and Initiating State
          Scannable Advertising State
            and Initiating State
          Active Scanning State
            and Connection State (Central Role)
          Passive Scanning State
            and Connection State (Peripheral Role)
          Active Scanning State
            and Connection State (Peripheral Role)
          Initiating State
            and Connection State (Central Role)
            and Central Role & Central Role
          Low Duty Cycle Directed Advertising State
          Connectable Advertising State
            and Initiating State
            and Central Role & Peripheral Role
          High Duty Cycle Directed Advertising State
            and Initiating State
            and Central Role & Peripheral Role
          Low Duty Cycle Directed Advertising State
            and Initiating State
            and Central Role & Peripheral Role
          Connectable Advertising State
            and Connection State (Central Role)
            and Central Role & Peripheral Role
          High Duty Cycle Directed Advertising State
            and Connection State (Central Role)
            and Central Role & Peripheral Role
          Low Duty Cycle Directed Advertising State
            and Connection State (Central Role)
            and Central Role & Peripheral Role
          Connectable Advertising State
            and Connection State (Peripheral Role)
            and Central Role & Peripheral Role
          High Duty Cycle Directed Advertising State
            and Connection State (Peripheral Role)
            and Peripheral Role & Peripheral Role
          Low Duty Cycle Directed Advertising State
            and Connection State (Peripheral Role)
            and Peripheral Role & Peripheral Role
          Initiating State
            and Connection State (Peripheral Role)
            and Central Role & Peripheral Role
< HCI Command: LE Read Maximum Data.. (0x08|0x002f) plen 0  #23 [hci1] 1.515457
> HCI Event: Command Complete (0x0e) plen 12                #24 [hci1] 1.515928
      LE Read Maximum Data Length (0x08|0x002f) ncmd 1
        Status: Success (0x00)
        Max TX octets: 251
        Max TX time: 2704
        Max RX octets: 251
        Max RX time: 2704
< HCI Command: LE Write Suggested D.. (0x08|0x0024) plen 4  #25 [hci1] 1.536009
        TX octets: 251
        TX time: 2704
> HCI Event: Command Complete (0x0e) plen 4                 #26 [hci1] 1.536775
      LE Write Suggested Default Data Length (0x08|0x0024) ncmd 1
        Status: Success (0x00)
< HCI Command: LE Read Resolving Li.. (0x08|0x002a) plen 0  #27 [hci1] 1.556165
> HCI Event: Command Complete (0x0e) plen 5                 #28 [hci1] 1.556594
      LE Read Resolving List Size (0x08|0x002a) ncmd 1
        Status: Success (0x00)
        Size: 8
< HCI Command: LE Set Event Mask (0x08|0x0001) plen 8       #29 [hci1] 1.575452
        Mask: 0x000002023f87fa5e
          LE Advertising Report
          LE Connection Update Complete
          LE Read Remote Used Features Complete
          LE Long Term Key Request
          LE Data Length Change
          LE Enhanced Connection Complete
          LE PHY Update Complete
          LE Extended Advertising Report
          LE Periodic Advertising Sync Established
          LE Periodic Advertising Report
          LE Periodic Advertising Sync Lost
          LE Extended Scan Timeout
          LE Extended Advertising Set Terminated
          LE Scan Request Received
          LE Periodic Advertising Sync Transfer Rvc
          LE CIS Established
          LE CIS Request
          LE Create BIG Complete
          LE Terminate BIG Complete
          LE BIG Sync Estabilished Complete
          LE BIG Sync Lost
          LE BIG Info Advertising Report
          Unknown mask (0x0000020000000000)
> HCI Event: Command Complete (0x0e) plen 4                 #30 [hci1] 1.575921
      LE Set Event Mask (0x08|0x0001) ncmd 1
        Status: Success (0x00)
< HCI Command: Set Event Mask (0x03|0x0001) plen 8          #31 [hci1] 1.595467
        Mask: 0x2000800002008890
          Disconnection Complete
          Encryption Change
          Read Remote Version Information Complete
          Hardware Error
          Data Buffer Overflow
          Encryption Key Refresh Complete
          LE Meta
> HCI Event: Command Complete (0x0e) plen 4                 #32 [hci1] 1.596348
      Set Event Mask (0x03|0x0001) ncmd 1
        Status: Success (0x00)
< HCI Command: Read BD ADDR (0x04|0x0009) plen 0            #33 [hci1] 1.615622
> HCI Event: Command Complete (0x0e) plen 10                #34 [hci1] 1.616116
      Read BD ADDR (0x04|0x0009) ncmd 1
        Status: Success (0x00)
        Address: 00:00:00:00:00:00 (OUI 00-00-00)
< HCI Command: LE Set Random Address (0x08|0x0005) plen 6   #35 [hci1] 1.635493
        Address: D5:B6:CC:31:DB:3B (Static)
> HCI Event: Command Complete (0x0e) plen 4                 #36 [hci1] 1.635979
      LE Set Random Address (0x08|0x0005) ncmd 1
        Status: Success (0x00)
< HCI Command: LE Extended Create... (0x08|0x0043) plen 26  #37 [hci1] 3.796323
        Filter policy: Accept list is not used (0x00)
        Own address type: Random (0x01)
        Peer address type: Public (0x00)
        Peer address: DF:A9:FF:F6:B1:1A (OUI DF-A9-FF)
        Initiating PHYs: 0x01
        Entry 0: LE 1M
          Scan interval: 60.000 msec (0x0060)
          Scan window: 60.000 msec (0x0060)
          Min connection interval: 30.00 msec (0x0018)
          Max connection interval: 50.00 msec (0x0028)
          Connection latency: 0 (0x0000)
          Supervision timeout: 4000 msec (0x0190)
          Min connection length: 0.000 msec (0x0000)
          Max connection length: 0.000 msec (0x0000)
> HCI Event: Command Status (0x0f) plen 4                   #38 [hci1] 3.797266
      LE Extended Create Connection (0x08|0x0043) ncmd 1
        Status: Success (0x00)
> HCI Event: LE Meta Event (0x3e) plen 31                   #39 [hci1] 3.900731
      LE Enhanced Connection Complete (0x0a)
        Status: Success (0x00)
        Handle: 2142
        Role: Central (0x00)
        Peer address type: Public (0x00)
        Peer address: DF:A9:FF:F6:B1:1A (OUI DF-A9-FF)
        Local resolvable private address: 00:00:00:00:00:00 (Non-Resolvable)
        Peer resolvable private address: 00:00:00:00:00:00 (Non-Resolvable)
        Connection interval: 50.00 msec (0x0028)
        Connection latency: 0 (0x0000)
        Supervision timeout: 4000 msec (0x0190)
        Central clock accuracy: 0x00
< HCI Command: LE Read Remote Used... (0x08|0x0016) plen 2  #40 [hci1] 3.915821
        Handle: 2142 Address: DF:A9:FF:F6:B1:1A (OUI DF-A9-FF)
> HCI Event: Command Status (0x0f) plen 4                   #41 [hci1] 3.916213
      LE Read Remote Used Features (0x08|0x0016) ncmd 1
        Status: Success (0x00)
< HCI Command: LE Set PHY (0x08|0x0032) plen 7              #42 [hci1] 3.935662
        Handle: 2142 Address: DF:A9:FF:F6:B1:1A (OUI DF-A9-FF)
        All PHYs preference: 0x00
        TX PHYs preference: 0x02
          LE 2M
        RX PHYs preference: 0x02
          LE 2M
        PHY options preference: Reserved (0x0000)
> HCI Event: Command Status (0x0f) plen 4                   #43 [hci1] 3.936201
      LE Set PHY (0x08|0x0032) ncmd 1
        Status: Success (0x00)
> HCI Event: LE Meta Event (0x3e) plen 12                   #44 [hci1] 4.052187
      LE Read Remote Used Features (0x04)
        Status: Success (0x00)
        Handle: 2142 Address: DF:A9:FF:F6:B1:1A (OUI DF-A9-FF)
        Features: 0x2d 0x49 0x00 0xf7 0x67 0xd8 0x00 0x00
          LE Encryption
          Extended Reject Indication
          Peripheral-initiated Features Exchange
          LE Data Packet Length Extension
          LE 2M PHY
          LE Coded PHY
          Channel Selection Algorithm #2
          Periodic Advertising Sync Transfer - Sender
          Periodic Advertising Sync Transfer - Recipient
          Sleep Clock Accuracy Updates
          Connected Isochronous Stream - Central
          Connected Isochronous Stream - Peripheral
          Isochronous Broadcaster
          Synchronized Receiver
          Connected Isochronous Stream (Host Support)
          LE Power Control Request
          LE Power Control Request
          Connection Subrating
          Connection Subrating (Host Support)
          Unknown features (0x0000d80000000000)
> HCI Event: LE Meta Event (0x3e) plen 6                    #45 [hci1] 4.551676
      LE PHY Update Complete (0x0c)
        Status: Success (0x00)
        Handle: 2142 Address: DF:A9:FF:F6:B1:1A (OUI DF-A9-FF)
        TX PHY: LE 2M (0x02)
        RX PHY: LE 2M (0x02)
< ACL Data TX: Handle 2142 flags 0x00 dlen 11               #46 [hci1] 4.995732
      SMP: Pairing Request (0x01) len 6
        IO capability: NoInputNoOutput (0x03)
        OOB data: Authentication data not present (0x00)
        Authentication requirement: No bonding, No MITM, SC, No Keypresses (0x08)
        Max encryption key size: 16
        Initiator key distribution: <none> (0x00)
        Responder key distribution: <none> (0x00)
> HCI Event: Number of Completed Packets (0x13) plen 5      #47 [hci1] 5.001979
        Num handles: 1
        Handle: 2142 Address: DF:A9:FF:F6:B1:1A (OUI DF-A9-FF)
        Count: 1
        #46: len 11 (14 Kb/s)
        Latency: 6 msec (6-6 msec ~6 msec)
> ACL Data RX: Handle 2142 flags 0x02 dlen 11               #48 [hci1] 5.052061
      SMP: Pairing Response (0x02) len 6
        IO capability: DisplayYesNo (0x01)
        OOB data: Authentication data not present (0x00)
        Authentication requirement: No bonding, No MITM, SC, No Keypresses (0x08)
        Max encryption key size: 16
        Initiator key distribution: <none> (0x00)
        Responder key distribution: <none> (0x00)
< HCI Command: Host Number of Compl.. (0x03|0x0035) plen 5  #49 [hci1] 5.056169
        Num handles: 1
        Handle: 2142 Address: DF:A9:FF:F6:B1:1A (OUI DF-A9-FF)
        Count: 1
< ACL Data TX: Handle 2142 flags 0x00 dlen 27               #50 [hci1] 5.056338
< ACL Data TX: Handle 2142 flags 0x01 dlen 27               #51 [hci1] 5.056400
< ACL Data TX: Handle 2142 flags 0x01 dlen 15               #52 [hci1] 5.056419
      SMP: Pairing Public Key (0x0c) len 64
        X: 98308440221e2d910f0e54b71e7ec652857aa9b5a0dc65028824cc19db1226e9
        Y: 67a4816bcb62efb21701e31fdb27561a6217575fb007a8bbdabe7e28b6f68482
> HCI Event: Number of Completed Packets (0x13) plen 5      #53 [hci1] 5.102063
        Num handles: 1
        Handle: 2142 Address: DF:A9:FF:F6:B1:1A (OUI DF-A9-FF)
        Count: 1
        #50: len 27 (4 Kb/s)
        Latency: 45 msec (6-45 msec ~25 msec)
> HCI Event: Number of Completed Packets (0x13) plen 5      #54 [hci1] 5.102464
        Num handles: 1
        Handle: 2142 Address: DF:A9:FF:F6:B1:1A (OUI DF-A9-FF)
        Count: 1
        #51: len 27 (4 Kb/s)
        Latency: 46 msec (6-46 msec ~36 msec)
> HCI Event: Number of Completed Packets (0x13) plen 5      #55 [hci1] 5.103009
        Num handles: 1
        Handle: 2142 Address: DF:A9:FF:F6:B1:1A (OUI DF-A9-FF)
        Count: 1
        #52: len 15 (2 Kb/s)
        Latency: 46 msec (6-46 msec ~41 msec)
> ACL Data RX: Handle 2142 flags 0x02 dlen 27               #56 [hci1] 5.152230
> ACL Data RX: Handle 2142 flags 0x01 dlen 27               #57 [hci1] 5.152699
> ACL Data RX: Handle 2142 flags 0x01 dlen 15               #58 [hci1] 5.153124
      SMP: Pairing Public Key (0x0c) len 64
        X: 7a6fc6a382c087855a2fe25fb1663304199f8c69b18182580dca848a1dec3702
        Y: 9d2caff29bf61b1eb6f5d7cd4c63b388c9a73bada5434190a9015d999115d6aa
< HCI Command: Host Number of Compl.. (0x03|0x0035) plen 5  #59 [hci1] 5.155867
        Num handles: 1
        Handle: 2142 Address: DF:A9:FF:F6:B1:1A (OUI DF-A9-FF)
        Count: 1
< HCI Command: Host Number of Compl.. (0x03|0x0035) plen 5  #60 [hci1] 5.155874
        Num handles: 1
        Handle: 2142 Address: DF:A9:FF:F6:B1:1A (OUI DF-A9-FF)
        Count: 1
< HCI Command: Host Number of Compl.. (0x03|0x0035) plen 5  #61 [hci1] 5.155896
        Num handles: 1
        Handle: 2142 Address: DF:A9:FF:F6:B1:1A (OUI DF-A9-FF)
        Count: 1
> ACL Data RX: Handle 2142 flags 0x02 dlen 21               #62 [hci1] 5.252207
      SMP: Pairing Confirm (0x03) len 16
        Confim value: 65ba7fd5fd93167727be3175dcf340af
< HCI Command: Host Number of Compl.. (0x03|0x0035) plen 5  #63 [hci1] 5.255971
        Num handles: 1
        Handle: 2142 Address: DF:A9:FF:F6:B1:1A (OUI DF-A9-FF)
        Count: 1
< ACL Data TX: Handle 2142 flags 0x00 dlen 21               #64 [hci1] 5.256149
      SMP: Pairing Random (0x04) len 16
        Random value: 8e6108f966a694cbe26df70bb96773e6
> HCI Event: Number of Completed Packets (0x13) plen 5      #65 [hci1] 5.302001
        Num handles: 1
        Handle: 2142 Address: DF:A9:FF:F6:B1:1A (OUI DF-A9-FF)
        Count: 1
        #64: len 21 (3 Kb/s)
        Latency: 45 msec (6-46 msec ~43 msec)
> ACL Data RX: Handle 2142 flags 0x02 dlen 21               #66 [hci1] 5.552212
      SMP: Pairing Random (0x04) len 16
        Random value: a9ab523923d3e91e1e614be2c2813900
< HCI Command: Host Number of Compl.. (0x03|0x0035) plen 5  #67 [hci1] 5.556966
        Num handles: 1
        Handle: 2142 Address: DF:A9:FF:F6:B1:1A (OUI DF-A9-FF)
        Count: 1
< ACL Data TX: Handle 2142 flags 0x00 dlen 21               #68 [hci1] 5.557183
      SMP: Pairing DHKey Check (0x0d) len 16
        E: 3cd9f342130c3a5913830d17ec1e6257
> HCI Event: Number of Completed Packets (0x13) plen 5      #69 [hci1] 5.602021
        Num handles: 1
        Handle: 2142 Address: DF:A9:FF:F6:B1:1A (OUI DF-A9-FF)
        Count: 1
        #68: len 21 (3 Kb/s)
        Latency: 44 msec (6-46 msec ~44 msec)
> ACL Data RX: Handle 2142 flags 0x02 dlen 21               #70 [hci1] 5.652214
      SMP: Pairing DHKey Check (0x0d) len 16
        E: 0a3a6061750da3b826ce15040b56530a
< HCI Command: LE Start Encryption (0x08|0x0019) plen 28    #71 [hci1] 5.655905
        Handle: 2142 Address: DF:A9:FF:F6:B1:1A (OUI DF-A9-FF)
        Random number: 0x0000000000000000
        Encrypted diversifier: 0x0000
        Long term key: c433b358ae55203b62922b1e82aa8af5
> HCI Event: Command Status (0x0f) plen 4                   #72 [hci1] 5.656700
      LE Start Encryption (0x08|0x0019) ncmd 1
        Status: Success (0x00)
< HCI Command: Host Number of Compl.. (0x03|0x0035) plen 5  #73 [hci1] 5.675589
        Num handles: 1
        Handle: 2142 Address: DF:A9:FF:F6:B1:1A (OUI DF-A9-FF)
        Count: 1
> HCI Event: Encryption Change (0x08) plen 4                #74 [hci1] 6.001960
        Status: Success (0x00)
        Handle: 2142 Address: DF:A9:FF:F6:B1:1A (OUI DF-A9-FF)
        Encryption: Enabled with AES-CCM (0x01)
< HCI Command: Disconnect (0x01|0x0006) plen 3              #75 [hci1] 7.006091
        Handle: 2142 Address: DF:A9:FF:F6:B1:1A (OUI DF-A9-FF)
        Reason: Remote User Terminated Connection (0x13)
> HCI Event: Command Status (0x0f) plen 4                   #76 [hci1] 7.006561
      Disconnect (0x01|0x0006) ncmd 1
        Status: Success (0x00)
> HCI Event: Disconnect Complete (0x05) plen 4              #77 [hci1] 7.101972
        Status: Success (0x00)
        Handle: 2142 Address: DF:A9:FF:F6:B1:1A (OUI DF-A9-FF)
        Reason: Connection Terminated By Local Host (0x16)
< HCI Command: LE Extended Create... (0x08|0x0043) plen 26  #78 [hci1] 8.196299
        Filter policy: Accept list is not used (0x00)
        Own address type: Random (0x01)
        Peer address type: Public (0x00)
        Peer address: DF:A9:FF:F6:B1:1A (OUI DF-A9-FF)
        Initiating PHYs: 0x01
        Entry 0: LE 1M
          Scan interval: 60.000 msec (0x0060)
          Scan window: 60.000 msec (0x0060)
          Min connection interval: 30.00 msec (0x0018)
          Max connection interval: 50.00 msec (0x0028)
          Connection latency: 0 (0x0000)
          Supervision timeout: 4000 msec (0x0190)
          Min connection length: 0.000 msec (0x0000)
          Max connection length: 0.000 msec (0x0000)
> HCI Event: Command Status (0x0f) plen 4                   #79 [hci1] 8.197204
      LE Extended Create Connection (0x08|0x0043) ncmd 1
        Status: Success (0x00)
> HCI Event: LE Meta Event (0x3e) plen 31                   #80 [hci1] 8.260649
      LE Enhanced Connection Complete (0x0a)
        Status: Success (0x00)
        Handle: 2160
        Role: Central (0x00)
        Peer address type: Public (0x00)
        Peer address: DF:A9:FF:F6:B1:1A (OUI DF-A9-FF)
        Local resolvable private address: 00:00:00:00:00:00 (Non-Resolvable)
        Peer resolvable private address: 00:00:00:00:00:00 (Non-Resolvable)
        Connection interval: 50.00 msec (0x0028)
        Connection latency: 0 (0x0000)
        Supervision timeout: 4000 msec (0x0190)
        Central clock accuracy: 0x00
< HCI Command: LE Read Remote Used... (0x08|0x0016) plen 2  #81 [hci1] 8.275806
        Handle: 2160 Address: DF:A9:FF:F6:B1:1A (OUI DF-A9-FF)
> HCI Event: Command Status (0x0f) plen 4                   #82 [hci1] 8.276280
      LE Read Remote Used Features (0x08|0x0016) ncmd 1
        Status: Success (0x00)
< HCI Command: LE Set PHY (0x08|0x0032) plen 7              #83 [hci1] 8.295691
        Handle: 2160 Address: DF:A9:FF:F6:B1:1A (OUI DF-A9-FF)
        All PHYs preference: 0x00
        TX PHYs preference: 0x02
          LE 2M
        RX PHYs preference: 0x02
          LE 2M
        PHY options preference: Reserved (0x0000)
> HCI Event: Command Status (0x0f) plen 4                   #84 [hci1] 8.296231
      LE Set PHY (0x08|0x0032) ncmd 1
        Status: Success (0x00)
> HCI Event: LE Meta Event (0x3e) plen 12                   #85 [hci1] 8.411952
      LE Read Remote Used Features (0x04)
        Status: Success (0x00)
        Handle: 2160 Address: DF:A9:FF:F6:B1:1A (OUI DF-A9-FF)
        Features: 0x2d 0x49 0x00 0xf7 0x67 0xd8 0x00 0x00
          LE Encryption
          Extended Reject Indication
          Peripheral-initiated Features Exchange
          LE Data Packet Length Extension
          LE 2M PHY
          LE Coded PHY
          Channel Selection Algorithm #2
          Periodic Advertising Sync Transfer - Sender
          Periodic Advertising Sync Transfer - Recipient
          Sleep Clock Accuracy Updates
          Connected Isochronous Stream - Central
          Connected Isochronous Stream - Peripheral
          Isochronous Broadcaster
          Synchronized Receiver
          Connected Isochronous Stream (Host Support)
          LE Power Control Request
          LE Power Control Request
          Connection Subrating
          Connection Subrating (Host Support)
          Unknown features (0x0000d80000000000)
> HCI Event: LE Meta Event (0x3e) plen 6                    #86 [hci1] 8.911355
      LE PHY Update Complete (0x0c)
        Status: Success (0x00)
        Handle: 2160 Address: DF:A9:FF:F6:B1:1A (OUI DF-A9-FF)
        TX PHY: LE 2M (0x02)
        RX PHY: LE 2M (0x02)
< ACL Data TX: Handle 2160 flags 0x00 dlen 11               #87 [hci1] 9.305819
      SMP: Pairing Request (0x01) len 6
        IO capability: NoInputNoOutput (0x03)
        OOB data: Authentication data not present (0x00)
        Authentication requirement: No bonding, No MITM, SC, No Keypresses (0x08)
        Max encryption key size: 16
        Initiator key distribution: <none> (0x00)
        Responder key distribution: <none> (0x00)
> HCI Event: Number of Completed Packets (0x13) plen 5      #88 [hci1] 9.311871
        Num handles: 1
        Handle: 2160 Address: DF:A9:FF:F6:B1:1A (OUI DF-A9-FF)
        Count: 1
        #87: len 11 (14 Kb/s)
        Latency: 6 msec (6-6 msec ~6 msec)
> ACL Data RX: Handle 2160 flags 0x02 dlen 11               #89 [hci1] 9.361853
      SMP: Pairing Response (0x02) len 6
        IO capability: DisplayYesNo (0x01)
        OOB data: Authentication data not present (0x00)
        Authentication requirement: No bonding, No MITM, SC, No Keypresses (0x08)
        Max encryption key size: 16
        Initiator key distribution: <none> (0x00)
        Responder key distribution: <none> (0x00)
< HCI Command: Host Number of Compl.. (0x03|0x0035) plen 5  #90 [hci1] 9.375838
        Num handles: 1
        Handle: 2160 Address: DF:A9:FF:F6:B1:1A (OUI DF-A9-FF)
        Count: 1
< ACL Data TX: Handle 2160 flags 0x00 dlen 27               #91 [hci1] 9.375963
< ACL Data TX: Handle 2160 flags 0x01 dlen 27               #92 [hci1] 9.375967
< ACL Data TX: Handle 2160 flags 0x01 dlen 15               #93 [hci1] 9.375968
      SMP: Pairing Public Key (0x0c) len 64
        X: 98308440221e2d910f0e54b71e7ec652857aa9b5a0dc65028824cc19db1226e9
        Y: 67a4816bcb62efb21701e31fdb27561a6217575fb007a8bbdabe7e28b6f68482
> HCI Event: Number of Completed Packets (0x13) plen 5      #94 [hci1] 9.411779
        Num handles: 1
        Handle: 2160 Address: DF:A9:FF:F6:B1:1A (OUI DF-A9-FF)
        Count: 1
        #91: len 27 (6 Kb/s)
        Latency: 35 msec (6-35 msec ~20 msec)
> HCI Event: Number of Completed Packets (0x13) plen 5      #95 [hci1] 9.412235
        Num handles: 1
        Handle: 2160 Address: DF:A9:FF:F6:B1:1A (OUI DF-A9-FF)
        Count: 1
        #92: len 27 (6 Kb/s)
        Latency: 36 msec (6-36 msec ~28 msec)
> HCI Event: Number of Completed Packets (0x13) plen 5      #96 [hci1] 9.412836
        Num handles: 1
        Handle: 2160 Address: DF:A9:FF:F6:B1:1A (OUI DF-A9-FF)
        Count: 1
        #93: len 15 (3 Kb/s)
        Latency: 36 msec (6-36 msec ~32 msec)
> ACL Data RX: Handle 2160 flags 0x02 dlen 27               #97 [hci1] 9.462040
> ACL Data RX: Handle 2160 flags 0x01 dlen 27               #98 [hci1] 9.462551
> ACL Data RX: Handle 2160 flags 0x01 dlen 15               #99 [hci1] 9.462923
      SMP: Pairing Public Key (0x0c) len 64
        X: af9f4469090dde97d3b5db35374d03700fb527f971f52cafd4c19bac0dc44c3f
        Y: 5af8278cef69da3841729f4dd395a6a70d09ddc36f37af12c39149c816f55615
< HCI Command: Host Number of Comp.. (0x03|0x0035) plen 5  #100 [hci1] 9.476399
        Num handles: 1
        Handle: 2160 Address: DF:A9:FF:F6:B1:1A (OUI DF-A9-FF)
        Count: 1
< HCI Command: Host Number of Comp.. (0x03|0x0035) plen 5  #101 [hci1] 9.476607
        Num handles: 1
        Handle: 2160 Address: DF:A9:FF:F6:B1:1A (OUI DF-A9-FF)
        Count: 1
< HCI Command: Host Number of Comp.. (0x03|0x0035) plen 5  #102 [hci1] 9.476809
        Num handles: 1
        Handle: 2160 Address: DF:A9:FF:F6:B1:1A (OUI DF-A9-FF)
        Count: 1
> ACL Data RX: Handle 2160 flags 0x02 dlen 21              #103 [hci1] 9.562047
      SMP: Pairing Confirm (0x03) len 16
        Confim value: deb8814df719b2fb774e48956645c0c1
< HCI Command: Host Number of Comp.. (0x03|0x0035) plen 5  #104 [hci1] 9.575867
        Num handles: 1
        Handle: 2160 Address: DF:A9:FF:F6:B1:1A (OUI DF-A9-FF)
        Count: 1
< ACL Data TX: Handle 2160 flags 0x00 dlen 21              #105 [hci1] 9.575977
      SMP: Pairing Random (0x04) len 16
        Random value: 5da095555cc64d02679f89a05211af56
> HCI Event: Number of Completed Packets (0x13) plen 5     #106 [hci1] 9.611928
        Num handles: 1
        Handle: 2160 Address: DF:A9:FF:F6:B1:1A (OUI DF-A9-FF)
        Count: 1
        #105: len 21 (4 Kb/s)
        Latency: 35 msec (6-36 msec ~34 msec)
> ACL Data RX: Handle 2160 flags 0x02 dlen 21              #107 [hci1] 9.862061
      SMP: Pairing Random (0x04) len 16
        Random value: fd69edc4f6b0b7d820a72335968046e2
< HCI Command: Host Number of Comp.. (0x03|0x0035) plen 5  #108 [hci1] 9.876593
        Num handles: 1
        Handle: 2160 Address: DF:A9:FF:F6:B1:1A (OUI DF-A9-FF)
        Count: 1
< ACL Data TX: Handle 2160 flags 0x00 dlen 21              #109 [hci1] 9.876838
      SMP: Pairing DHKey Check (0x0d) len 16
        E: 17c495fdec87de5c3bba0b9df45a60a6
> HCI Event: Number of Completed Packets (0x13) plen 5     #110 [hci1] 9.911918
        Num handles: 1
        Handle: 2160 Address: DF:A9:FF:F6:B1:1A (OUI DF-A9-FF)
        Count: 1
        #109: len 21 (4 Kb/s)
        Latency: 35 msec (6-36 msec ~34 msec)
> ACL Data RX: Handle 2160 flags 0x02 dlen 21              #111 [hci1] 9.962042
      SMP: Pairing DHKey Check (0x0d) len 16
        E: 817ba162998ec1669a636f820ee8fcde
< HCI Command: LE Start Encryption (0x08|0x0019) plen 28   #112 [hci1] 9.976048
        Handle: 2160 Address: DF:A9:FF:F6:B1:1A (OUI DF-A9-FF)
        Random number: 0x0000000000000000
        Encrypted diversifier: 0x0000
        Long term key: e174ab6f02d8b5b0b374d461e228b0b4
> HCI Event: Command Status (0x0f) plen 4                  #113 [hci1] 9.976868
      LE Start Encryption (0x08|0x0019) ncmd 1
        Status: Success (0x00)
< HCI Command: Host Number of Comp.. (0x03|0x0035) plen 5  #114 [hci1] 9.995721
        Num handles: 1
        Handle: 2160 Address: DF:A9:FF:F6:B1:1A (OUI DF-A9-FF)
        Count: 1
> HCI Event: Encryption Change (0x08) plen 4              #115 [hci1] 10.311729
        Status: Success (0x00)
        Handle: 2160 Address: DF:A9:FF:F6:B1:1A (OUI DF-A9-FF)
        Encryption: Enabled with AES-CCM (0x01)
< HCI Command: Disconnect (0x01|0x0006) plen 3            #116 [hci1] 11.336435
        Handle: 2160 Address: DF:A9:FF:F6:B1:1A (OUI DF-A9-FF)
        Reason: Remote User Terminated Connection (0x13)
> HCI Event: Command Status (0x0f) plen 4                 #117 [hci1] 11.336915
      Disconnect (0x01|0x0006) ncmd 1
        Status: Success (0x00)
> HCI Event: Disconnect Complete (0x05) plen 4            #118 [hci1] 11.411846
        Status: Success (0x00)
        Handle: 2160 Address: DF:A9:FF:F6:B1:1A (OUI DF-A9-FF)
        Reason: Connection Terminated By Local Host (0x16)
< HCI Command: LE Extended Creat.. (0x08|0x0043) plen 26  #119 [hci1] 12.436272
        Filter policy: Accept list is not used (0x00)
        Own address type: Random (0x01)
        Peer address type: Public (0x00)
        Peer address: DF:A9:FF:F6:B1:1A (OUI DF-A9-FF)
        Initiating PHYs: 0x01
        Entry 0: LE 1M
          Scan interval: 60.000 msec (0x0060)
          Scan window: 60.000 msec (0x0060)
          Min connection interval: 30.00 msec (0x0018)
          Max connection interval: 50.00 msec (0x0028)
          Connection latency: 0 (0x0000)
          Supervision timeout: 4000 msec (0x0190)
          Min connection length: 0.000 msec (0x0000)
          Max connection length: 0.000 msec (0x0000)
> HCI Event: Command Status (0x0f) plen 4                 #120 [hci1] 12.437193
      LE Extended Create Connection (0x08|0x0043) ncmd 1
        Status: Success (0x00)
> HCI Event: LE Meta Event (0x3e) plen 31                 #121 [hci1] 12.514437
      LE Enhanced Connection Complete (0x0a)
        Status: Success (0x00)
        Handle: 2178
        Role: Central (0x00)
        Peer address type: Public (0x00)
        Peer address: DF:A9:FF:F6:B1:1A (OUI DF-A9-FF)
        Local resolvable private address: 00:00:00:00:00:00 (Non-Resolvable)
        Peer resolvable private address: 00:00:00:00:00:00 (Non-Resolvable)
        Connection interval: 50.00 msec (0x0028)
        Connection latency: 0 (0x0000)
        Supervision timeout: 4000 msec (0x0190)
        Central clock accuracy: 0x00
< HCI Command: LE Read Remote Use.. (0x08|0x0016) plen 2  #122 [hci1] 12.515833
        Handle: 2178 Address: DF:A9:FF:F6:B1:1A (OUI DF-A9-FF)
> HCI Event: Command Status (0x0f) plen 4                 #123 [hci1] 12.516238
      LE Read Remote Used Features (0x08|0x0016) ncmd 1
        Status: Success (0x00)
< HCI Command: LE Set PHY (0x08|0x0032) plen 7            #124 [hci1] 12.535736
        Handle: 2178 Address: DF:A9:FF:F6:B1:1A (OUI DF-A9-FF)
        All PHYs preference: 0x00
        TX PHYs preference: 0x02
          LE 2M
        RX PHYs preference: 0x02
          LE 2M
        PHY options preference: Reserved (0x0000)
> HCI Event: Command Status (0x0f) plen 4                 #125 [hci1] 12.536262
      LE Set PHY (0x08|0x0032) ncmd 1
        Status: Success (0x00)
> HCI Event: LE Meta Event (0x3e) plen 12                 #126 [hci1] 12.665955
      LE Read Remote Used Features (0x04)
        Status: Success (0x00)
        Handle: 2178 Address: DF:A9:FF:F6:B1:1A (OUI DF-A9-FF)
        Features: 0x2d 0x49 0x00 0xf7 0x67 0xd8 0x00 0x00
          LE Encryption
          Extended Reject Indication
          Peripheral-initiated Features Exchange
          LE Data Packet Length Extension
          LE 2M PHY
          LE Coded PHY
          Channel Selection Algorithm #2
          Periodic Advertising Sync Transfer - Sender
          Periodic Advertising Sync Transfer - Recipient
          Sleep Clock Accuracy Updates
          Connected Isochronous Stream - Central
          Connected Isochronous Stream - Peripheral
          Isochronous Broadcaster
          Synchronized Receiver
          Connected Isochronous Stream (Host Support)
          LE Power Control Request
          LE Power Control Request
          Connection Subrating
          Connection Subrating (Host Support)
          Unknown features (0x0000d80000000000)
> HCI Event: LE Meta Event (0x3e) plen 6                  #127 [hci1] 13.165238
      LE PHY Update Complete (0x0c)
        Status: Success (0x00)
        Handle: 2178 Address: DF:A9:FF:F6:B1:1A (OUI DF-A9-FF)
        TX PHY: LE 2M (0x02)
        RX PHY: LE 2M (0x02)
< ACL Data TX: Handle 2178 flags 0x00 dlen 11             #128 [hci1] 13.556606
      SMP: Pairing Request (0x01) len 6
        IO capability: NoInputNoOutput (0x03)
        OOB data: Authentication data not present (0x00)
        Authentication requirement: No bonding, No MITM, SC, No Keypresses (0x08)
        Max encryption key size: 16
        Initiator key distribution: <none> (0x00)
        Responder key distribution: <none> (0x00)
> HCI Event: Number of Completed Packets (0x13) plen 5    #129 [hci1] 13.565628
        Num handles: 1
        Handle: 2178 Address: DF:A9:FF:F6:B1:1A (OUI DF-A9-FF)
        Count: 1
        #128: len 11 (9 Kb/s)
        Latency: 9 msec (9-9 msec ~9 msec)
> ACL Data RX: Handle 2178 flags 0x02 dlen 11             #130 [hci1] 13.615648
      SMP: Pairing Response (0x02) len 6
        IO capability: DisplayYesNo (0x01)
        OOB data: Authentication data not present (0x00)
        Authentication requirement: No bonding, No MITM, SC, No Keypresses (0x08)
        Max encryption key size: 16
        Initiator key distribution: <none> (0x00)
        Responder key distribution: <none> (0x00)
< HCI Command: Host Number of Com.. (0x03|0x0035) plen 5  #131 [hci1] 13.635801
        Num handles: 1
        Handle: 2178 Address: DF:A9:FF:F6:B1:1A (OUI DF-A9-FF)
        Count: 1
< ACL Data TX: Handle 2178 flags 0x00 dlen 27             #132 [hci1] 13.635922
< ACL Data TX: Handle 2178 flags 0x01 dlen 27             #133 [hci1] 13.635927
< ACL Data TX: Handle 2178 flags 0x01 dlen 15             #134 [hci1] 13.635938
      SMP: Pairing Public Key (0x0c) len 64
        X: 98308440221e2d910f0e54b71e7ec652857aa9b5a0dc65028824cc19db1226e9
        Y: 67a4816bcb62efb21701e31fdb27561a6217575fb007a8bbdabe7e28b6f68482
> HCI Event: Number of Completed Packets (0x13) plen 5    #135 [hci1] 13.665640
        Num handles: 1
        Handle: 2178 Address: DF:A9:FF:F6:B1:1A (OUI DF-A9-FF)
        Count: 1
        #132: len 27 (7 Kb/s)
        Latency: 29 msec (9-29 msec ~19 msec)
> HCI Event: Number of Completed Packets (0x13) plen 5    #136 [hci1] 13.666240
        Num handles: 1
        Handle: 2178 Address: DF:A9:FF:F6:B1:1A (OUI DF-A9-FF)
        Count: 1
        #133: len 27 (7 Kb/s)
        Latency: 30 msec (9-30 msec ~24 msec)
> HCI Event: Number of Completed Packets (0x13) plen 5    #137 [hci1] 13.666627
        Num handles: 1
        Handle: 2178 Address: DF:A9:FF:F6:B1:1A (OUI DF-A9-FF)
        Count: 1
        #134: len 15 (4 Kb/s)
        Latency: 30 msec (9-30 msec ~27 msec)
> ACL Data RX: Handle 2178 flags 0x02 dlen 27             #138 [hci1] 13.716036
> ACL Data RX: Handle 2178 flags 0x01 dlen 27             #139 [hci1] 13.716374
> ACL Data RX: Handle 2178 flags 0x01 dlen 15             #140 [hci1] 13.716817
      SMP: Pairing Public Key (0x0c) len 64
        X: 7bf11ea362171eff3ef7e9152e3f4dc4f0c6bb39baf30955b607ff77704dbd07
        Y: e35ea73b4809c6c10db6d20ed158ca24118d90396e701e9aad339c033bc27cc8
< HCI Command: Host Number of Com.. (0x03|0x0035) plen 5  #141 [hci1] 13.736558
        Num handles: 1
        Handle: 2178 Address: DF:A9:FF:F6:B1:1A (OUI DF-A9-FF)
        Count: 1
< HCI Command: Host Number of Com.. (0x03|0x0035) plen 5  #142 [hci1] 13.736838
        Num handles: 1
        Handle: 2178 Address: DF:A9:FF:F6:B1:1A (OUI DF-A9-FF)
        Count: 1
< HCI Command: Host Number of Com.. (0x03|0x0035) plen 5  #143 [hci1] 13.736988
        Num handles: 1
        Handle: 2178 Address: DF:A9:FF:F6:B1:1A (OUI DF-A9-FF)
        Count: 1
> ACL Data RX: Handle 2178 flags 0x02 dlen 21             #144 [hci1] 13.815968
      SMP: Pairing Confirm (0x03) len 16
        Confim value: d46ebcadeda508aa2bce67f3e1d7b3a5
< HCI Command: Host Number of Com.. (0x03|0x0035) plen 5  #145 [hci1] 13.835955
        Num handles: 1
        Handle: 2178 Address: DF:A9:FF:F6:B1:1A (OUI DF-A9-FF)
        Count: 1
< ACL Data TX: Handle 2178 flags 0x00 dlen 21             #146 [hci1] 13.836067
      SMP: Pairing Random (0x04) len 16
        Random value: da64d21ec8845e8286bc235a02440d0c
> HCI Event: Number of Completed Packets (0x13) plen 5    #147 [hci1] 13.865614
        Num handles: 1
        Handle: 2178 Address: DF:A9:FF:F6:B1:1A (OUI DF-A9-FF)
        Count: 1
        #146: len 21 (5 Kb/s)
        Latency: 29 msec (9-30 msec ~28 msec)
> ACL Data RX: Handle 2178 flags 0x02 dlen 21             #148 [hci1] 14.115956
      SMP: Pairing Random (0x04) len 16
        Random value: dd5cab4d70c9a17af6d4d869bca1163e
< HCI Command: Host Number of Com.. (0x03|0x0035) plen 5  #149 [hci1] 14.136501
        Num handles: 1
        Handle: 2178 Address: DF:A9:FF:F6:B1:1A (OUI DF-A9-FF)
        Count: 1
< ACL Data TX: Handle 2178 flags 0x00 dlen 21             #150 [hci1] 14.136758
      SMP: Pairing DHKey Check (0x0d) len 16
        E: 52b2a80938a409ea379d90cdba4419f2
> HCI Event: Number of Completed Packets (0x13) plen 5    #151 [hci1] 14.165705
        Num handles: 1
        Handle: 2178 Address: DF:A9:FF:F6:B1:1A (OUI DF-A9-FF)
        Count: 1
        #150: len 21 (6 Kb/s)
        Latency: 28 msec (9-30 msec ~28 msec)
> ACL Data RX: Handle 2178 flags 0x02 dlen 21             #152 [hci1] 14.215891
      SMP: Pairing DHKey Check (0x0d) len 16
        E: aa4c490f2e72fb32a130b60d6022517b
< HCI Command: LE Start Encryption (0x08|0x0019) plen 28  #153 [hci1] 14.236634
        Handle: 2178 Address: DF:A9:FF:F6:B1:1A (OUI DF-A9-FF)
        Random number: 0x0000000000000000
        Encrypted diversifier: 0x0000
        Long term key: 82fe2f143e36bdedeefa80067031a8c2
> HCI Event: Command Status (0x0f) plen 4                 #154 [hci1] 14.237545
      LE Start Encryption (0x08|0x0019) ncmd 1
        Status: Success (0x00)
< HCI Command: Host Number of Com.. (0x03|0x0035) plen 5  #155 [hci1] 14.256106
        Num handles: 1
        Handle: 2178 Address: DF:A9:FF:F6:B1:1A (OUI DF-A9-FF)
        Count: 1
> HCI Event: Encryption Change (0x08) plen 4              #156 [hci1] 14.565636
        Status: Success (0x00)
        Handle: 2178 Address: DF:A9:FF:F6:B1:1A (OUI DF-A9-FF)
        Encryption: Enabled with AES-CCM (0x01)
< HCI Command: Disconnect (0x01|0x0006) plen 3            #157 [hci1] 15.586916
        Handle: 2178 Address: DF:A9:FF:F6:B1:1A (OUI DF-A9-FF)
        Reason: Remote User Terminated Connection (0x13)
> HCI Event: Command Status (0x0f) plen 4                 #158 [hci1] 15.587393
      Disconnect (0x01|0x0006) ncmd 1
        Status: Success (0x00)
> HCI Event: Disconnect Complete (0x05) plen 4            #159 [hci1] 15.665600
        Status: Success (0x00)
        Handle: 2178 Address: DF:A9:FF:F6:B1:1A (OUI DF-A9-FF)
        Reason: Connection Terminated By Local Host (0x16)
< HCI Command: Reset (0x03|0x0003) plen 0                 #160 [hci1] 22.655897
> HCI Event: Command Complete (0x0e) plen 4               #161 [hci1] 22.656373
      Reset (0x03|0x0003) ncmd 1
        Status: Success (0x00)
@ USER Close: main                                    {0x0001} [hci1] 22.675800
= Close Index: 00:00:00:00:00:00                               [hci1] 22.675809
