Bluetooth monitor ver 5.72
= Note: Linux version 6.14.0-36-generic (x86_64)                       0.258531
= Note: Bluetooth subsystem version 2.22                               0.258533
= New Index: 00:00:00:00:00:00 (Primary,UART,hci2)              [hci2] 0.258534
= New Index: 00:00:00:00:00:00 (Primary,UART,hci1)              [hci1] 0.258534
= New Index: 48:5F:99:8E:E0:64 (Primary,USB,hci0)               [hci0] 0.258535
= Open Index: 00:00:00:00:00:00                                 [hci1] 0.372203
= Index Info: 00:00:00:00:00:00 (Nordic Semiconductor ASA)      [hci1] 0.372224
@ USER Open: main (privileged) version 2.22            {0x0001} [hci1] 0.372234
< HCI Command: Reset (0x03|0x0003) plen 0                    #1 [hci1] 0.373548
> HCI Event: Command Complete (0x0e) plen 4                  #2 [hci1] 0.374131
      Reset (0x03|0x0003) ncmd 1
        Status: Success (0x00)
< HCI Command: Read Local Supported... (0x04|0x0003) plen 0  #3 [hci1] 0.392038
> HCI Event: Command Complete (0x0e) plen 12                 #4 [hci1] 0.392736
      Read Local Supported Features (0x04|0x0003) ncmd 1
        Status: Success (0x00)
        Features: 0x00 0x00 0x00 0x00 0x60 0x00 0x00 0x00
          BR/EDR Not Supported
          LE Supported (Controller)
< HCI Command: Read Local Version In.. (0x04|0x0001) plen 0  #5 [hci1] 0.411704
> HCI Event: Command Complete (0x0e) plen 12                 #6 [hci1] 0.412285
      Read Local Version Information (0x04|0x0001) ncmd 1
        Status: Success (0x00)
        HCI version: Reserved (0x0f) - Revision 12393 (0x3069)
        LMP version: Reserved (0x0f) - Subversion 12393 (0x3069)
        Manufacturer: Nordic Semiconductor ASA (89)
< HCI Command: Read Local Supported... (0x04|0x0002) plen 0  #7 [hci1] 0.431654
> HCI Event: Command Complete (0x0e) plen 68                 #8 [hci1] 0.432837
      Read Local Supported Commands (0x04|0x0002) ncmd 1
        Status: Success (0x00)
        Commands: 119 entries
          Disconnect (Octet 0 - Bit 5)
          Read Remote Version Information (Octet 2 - Bit 7)
          Set Event Mask (Octet 5 - Bit 6)
          Reset (Octet 5 - Bit 7)
          Read Connection Accept Timeout (Octet 7 - Bit 2)
          Write Connection Accept Timeout (Octet 7 - Bit 3)
          Read Transmit Power Level (Octet 10 - Bit 2)
          Set Controller To Host Flow Control (Octet 10 - Bit 5)
          Host Buffer Size (Octet 10 - Bit 6)
          Host Number of Completed Packets (Octet 10 - Bit 7)
          Read Local Version Information (Octet 14 - Bit 3)
          Read Local Supported Features (Octet 14 - Bit 5)
          Read BD ADDR (Octet 15 - Bit 1)
          Read RSSI (Octet 15 - Bit 5)
          Set Event Mask Page 2 (Octet 22 - Bit 2)
          LE Set Event Mask (Octet 25 - Bit 0)
          LE Read Buffer Size (Octet 25 - Bit 1)
          LE Read Local Supported Features (Octet 25 - Bit 2)
          LE Set Random Address (Octet 25 - Bit 4)
          LE Set Advertising Parameters (Octet 25 - Bit 5)
          LE Read Advertising Channel TX Power (Octet 25 - Bit 6)
          LE Set Advertising Data (Octet 25 - Bit 7)
          LE Set Scan Response Data (Octet 26 - Bit 0)
          LE Set Advertise Enable (Octet 26 - Bit 1)
          LE Set Scan Parameters (Octet 26 - Bit 2)
          LE Set Scan Enable (Octet 26 - Bit 3)
          LE Create Connection (Octet 26 - Bit 4)
          LE Create Connection Cancel (Octet 26 - Bit 5)
          LE Read Accept List Size (Octet 26 - Bit 6)
          LE Clear Accept List (Octet 26 - Bit 7)
          LE Add Device To Accept List (Octet 27 - Bit 0)
          LE Remove Device From Accept List (Octet 27 - Bit 1)
          LE Connection Update (Octet 27 - Bit 2)
          LE Set Host Channel Classification (Octet 27 - Bit 3)
          LE Read Channel Map (Octet 27 - Bit 4)
          LE Read Remote Used Features (Octet 27 - Bit 5)
          LE Encrypt (Octet 27 - Bit 6)
          LE Rand (Octet 27 - Bit 7)
          LE Start Encryption (Octet 28 - Bit 0)
          LE Long Term Key Request Reply (Octet 28 - Bit 1)
          LE Long Term Key Request Neg Reply (Octet 28 - Bit 2)
          LE Read Supported States (Octet 28 - Bit 3)
          LE Receiver Test (Octet 28 - Bit 4)
          LE Transmitter Test (Octet 28 - Bit 5)
          LE Test End (Octet 28 - Bit 6)
          Read Authenticated Payload Timeout (Octet 32 - Bit 4)
          Write Authenticated Payload Timeout (Octet 32 - Bit 5)
          LE Set Data Length (Octet 33 - Bit 6)
          LE Read Suggested Default Data Length (Octet 33 - Bit 7)
          LE Write Suggested Default Data Length (Octet 34 - Bit 0)
          LE Add Device To Resolving List (Octet 34 - Bit 3)
          LE Remove Device From Resolving List (Octet 34 - Bit 4)
          LE Clear Resolving List (Octet 34 - Bit 5)
          LE Read Resolving List Size (Octet 34 - Bit 6)
          LE Set Address Resolution Enable (Octet 35 - Bit 1)
          LE Set Resolvable Private Address Timeout (Octet 35 - Bit 2)
          LE Read Maximum Data Length (Octet 35 - Bit 3)
          LE Read PHY (Octet 35 - Bit 4)
          LE Set Default PHY (Octet 35 - Bit 5)
          LE Set PHY (Octet 35 - Bit 6)
          LE Enhanced Receiver Test (Octet 35 - Bit 7)
          LE Enhanced Transmitter Test (Octet 36 - Bit 0)
          LE Set Advertising Set Random Address (Octet 36 - Bit 1)
          LE Set Extended Advertising Parameters (Octet 36 - Bit 2)
          LE Set Extended Advertising Data (Octet 36 - Bit 3)
          LE Set Extended Scan Response Data (Octet 36 - Bit 4)
          LE Set Extended Advertising Enable (Octet 36 - Bit 5)
          LE Read Maximum Advertising Data Length (Octet 36 - Bit 6)
          LE Read Number of Supported Advertising Sets (Octet 36 - Bit 7)
          LE Remove Advertising Set (Octet 37 - Bit 0)
          LE Clear Advertising Sets (Octet 37 - Bit 1)
          LE Set Periodic Advertising Parameters (Octet 37 - Bit 2)
          LE Set Periodic Advertising Data (Octet 37 - Bit 3)
          LE Set Periodic Advertising Enable (Octet 37 - Bit 4)
          LE Set Extended Scan Parameters (Octet 37 - Bit 5)
          LE Set Extended Scan Enable (Octet 37 - Bit 6)
          LE Extended Create Connection (Octet 37 - Bit 7)
          LE Periodic Advertising Create Sync (Octet 38 - Bit 0)
          LE Periodic Advertising Create Sync Cancel (Octet 38 - Bit 1)
          LE Periodic Advertising Terminate Sync (Octet 38 - Bit 2)
          LE Add Device To Periodic Advertiser List (Octet 38 - Bit 3)
          LE Remove Device From Periodic Advertiser List (Octet 38 - Bit 4)
          LE Clear Periodic Advertiser List (Octet 38 - Bit 5)
          LE Read Periodic Advertiser List Size (Octet 38 - Bit 6)
          LE Read Transmit Power (Octet 38 - Bit 7)
          LE Read RF Path Compensation (Octet 39 - Bit 0)
          LE Write RF Path Compensation (Octet 39 - Bit 1)
          LE Set Privacy Mode (Octet 39 - Bit 2)
          LE Periodic Advertising Receive Enable (Octet 40 - Bit 5)
          LE Periodic Advertising Sync Transfer (Octet 40 - Bit 6)
          LE Periodic Advertising Set Info Transfer (Octet 40 - Bit 7)
          LE Periodic Advertising Sync Transfer Parameters (Octet 41 - Bit 0)
          LE Set Default Periodic Advertisng Sync Transfer Parameters (Octet 41 - Bit 1)
          LE Read Buffer v2 (Octet 41 - Bit 5)
          LE Read ISO TX Sync (Octet 41 - Bit 6)
          LE Set Connected Isochronous Group Parameters (Octet 41 - Bit 7)
          LE Set Connected Isochronous Group Parameters Test (Octet 42 - Bit 0)
          LE Create Connected Isochronous Stream (Octet 42 - Bit 1)
          LE Remove Connected Isochronous Group (Octet 42 - Bit 2)
          LE Accept Connected Isochronous Stream Request (Octet 42 - Bit 3)
          LE Reject Connected Isochronous Stream Request (Octet 42 - Bit 4)
          LE Create Broadcast Isochronous Group (Octet 42 - Bit 5)
          LE Create Broadcast Isochronous Group Test (Octet 42 - Bit 6)
          LE Terminate Broadcast Isochronous Group (Octet 42 - Bit 7)
          LE Broadcast Isochronous Group Create Sync (Octet 43 - Bit 0)
          LE Broadcast Isochronous Group Terminate Sync (Octet 43 - Bit 1)
          LE Request Peer SCA (Octet 43 - Bit 2)
          LE Setup Isochronous Data Path (Octet 43 - Bit 3)
          LE Remove Isochronous Data Path (Octet 43 - Bit 4)
          LE Isochronous Transmit Test (Octet 43 - Bit 5)
          LE Isochronous Receive Test (Octet 43 - Bit 6)
          LE Isochronous Read Test Counters (Octet 43 - Bit 7)
          LE Isochronous Read Test Counters (Octet 44 - Bit 0)
          LE Set Host Feature (Octet 44 - Bit 1)
          Octet 44 - Bit 2 
          Octet 45 - Bit 6 
          Octet 46 - Bit 0 
          Octet 46 - Bit 1 
          Octet 46 - Bit 2 
< HCI Command: Host Buffer Size (0x03|0x0033) plen 7         #9 [hci1] 0.451649
        ACL MTU: 255  ACL max packet: 16
        SCO MTU: 0    SCO max packet: 0
> HCI Event: Command Complete (0x0e) plen 4                 #10 [hci1] 0.452311
      Host Buffer Size (0x03|0x0033) ncmd 1
        Status: Success (0x00)
< HCI Command: Set Controller To Ho.. (0x03|0x0031) plen 1  #11 [hci1] 0.471781
        Flow control: ACL Data Packets (0x01)
> HCI Event: Command Complete (0x0e) plen 4                 #12 [hci1] 0.472288
      Set Controller To Host Flow Control (0x03|0x0031) ncmd 1
        Status: Success (0x00)
< HCI Command: LE Read Local Suppor.. (0x08|0x0003) plen 0  #13 [hci1] 0.491767
> HCI Event: Command Complete (0x0e) plen 12                #14 [hci1] 0.492329
      LE Read Local Supported Features (0x08|0x0003) ncmd 1
        Status: Success (0x00)
        Features: 0xfd 0x79 0x00 0xf7 0x30 0x01 0x00 0x00
          LE Encryption
          Extended Reject Indication
          Peripheral-initiated Features Exchange
          LE Ping
          LE Data Packet Length Extension
          LL Privacy
          Extended Scanner Filter Policies
          LE 2M PHY
          LE Coded PHY
          LE Extended Advertising
          LE Periodic Advertising
          Channel Selection Algorithm #2
          Periodic Advertising Sync Transfer - Sender
          Periodic Advertising Sync Transfer - Recipient
          Sleep Clock Accuracy Updates
          Connected Isochronous Stream - Central
          Connected Isochronous Stream - Peripheral
          Isochronous Broadcaster
          Synchronized Receiver
          Periodic Advertising ADI support
          Connection Subrating
          Unknown features (0x0000010000000000)
< HCI Command: LE Set Host Feature (0x08|0x0074) plen 2     #15 [hci1] 0.511661
        Bit Number: 32
          Connected Isochronous Stream (Host Support)
        Bit Value: 1
> HCI Event: Command Complete (0x0e) plen 4                 #16 [hci1] 0.512217
      LE Set Host Feature (0x08|0x0074) ncmd 1
        Status: Success (0x00)
< HCI Command: LE Read Buffer v2 (0x08|0x0060) plen 0       #17 [hci1] 0.531678
> HCI Event: Command Complete (0x0e) plen 10                #18 [hci1] 0.532238
      LE Read Buffer v2 (0x08|0x0060) ncmd 1
        Status: Success (0x00)
        ACL MTU: 27
        ACL max packet: 3
        ISO MTU: 318
        ISO max packet: 3
< HCI Command: LE Read Maximum Adve.. (0x08|0x003a) plen 0  #19 [hci1] 0.551619
> HCI Event: Command Complete (0x0e) plen 6                 #20 [hci1] 0.552132
      LE Read Maximum Advertising Data Length (0x08|0x003a) ncmd 1
        Status: Success (0x00)
        Max length: 1650
< HCI Command: LE Read Supported St.. (0x08|0x001c) plen 0  #21 [hci1] 0.571628
> HCI Event: Command Complete (0x0e) plen 12                #22 [hci1] 0.572241
      LE Read Supported States (0x08|0x001c) ncmd 1
        Status: Success (0x00)
        States: 0x000003ff3e0306ff
          Non-connectable Advertising State
          Scannable Advertising State
          Connectable Advertising State
          High Duty Cycle Directed Advertising State
          Passive Scanning State
          Active Scanning State
          Initiating State
            and Connection State (Central Role)
          Connection State (Peripheral Role)
          Scannable Advertising State
            and Passive Scanning State
          Connectable Advertising State
            and Passive Scanning State
          Non-connectable Advertising State
            and Initiating State
          Scannable Advertising State
            and Initiating State
          Active Scanning State
            and Connection State (Central Role)
          Passive Scanning State
            and Connection State (Peripheral Role)
          Active Scanning State
            and Connection State (Peripheral Role)
          Initiating State
            and Connection State (Central Role)
            and Central Role & Central Role
          Low Duty Cycle Directed Advertising State
          Connectable Advertising State
            and Initiating State
            and Central Role & Peripheral Role
          High Duty Cycle Directed Advertising State
            and Initiating State
            and Central Role & Peripheral Role
          Low Duty Cycle Directed Advertising State
            and Initiating State
            and Central Role & Peripheral Role
          Connectable Advertising State
            and Connection State (Central Role)
            and Central Role & Peripheral Role
          High Duty Cycle Directed Advertising State
            and Connection State (Central Role)
            and Central Role & Peripheral Role
          Low Duty Cycle Directed Advertising State
            and Connection State (Central Role)
            and Central Role & Peripheral Role
          Connectable Advertising State
            and Connection State (Peripheral Role)
            and Central Role & Peripheral Role
          High Duty Cycle Directed Advertising State
            and Connection State (Peripheral Role)
            and Peripheral Role & Peripheral Role
          Low Duty Cycle Directed Advertising State
            and Connection State (Peripheral Role)
            and Peripheral Role & Peripheral Role
          Initiating State
            and Connection State (Peripheral Role)
            and Central Role & Peripheral Role
< HCI Command: LE Read Maximum Data.. (0x08|0x002f) plen 0  #23 [hci1] 0.591684
> HCI Event: Command Complete (0x0e) plen 12                #24 [hci1] 0.592227
      LE Read Maximum Data Length (0x08|0x002f) ncmd 1
        Status: Success (0x00)
        Max TX octets: 251
        Max TX time: 2704
        Max RX octets: 251
        Max RX time: 2704
< HCI Command: LE Write Suggested D.. (0x08|0x0024) plen 4  #25 [hci1] 0.611680
        TX octets: 251
        TX time: 2704
> HCI Event: Command Complete (0x0e) plen 4                 #26 [hci1] 0.612234
      LE Write Suggested Default Data Length (0x08|0x0024) ncmd 1
        Status: Success (0x00)
< HCI Command: LE Read Resolving Li.. (0x08|0x002a) plen 0  #27 [hci1] 0.631640
> HCI Event: Command Complete (0x0e) plen 5                 #28 [hci1] 0.632089
      LE Read Resolving List Size (0x08|0x002a) ncmd 1
        Status: Success (0x00)
        Size: 8
< HCI Command: LE Set Event Mask (0x08|0x0001) plen 8       #29 [hci1] 0.651624
        Mask: 0x000002023f87fa5e
          LE Advertising Report
          LE Connection Update Complete
          LE Read Remote Used Features Complete
          LE Long Term Key Request
          LE Data Length Change
          LE Enhanced Connection Complete
          LE PHY Update Complete
          LE Extended Advertising Report
          LE Periodic Advertising Sync Established
          LE Periodic Advertising Report
          LE Periodic Advertising Sync Lost
          LE Extended Scan Timeout
          LE Extended Advertising Set Terminated
          LE Scan Request Received
          LE Periodic Advertising Sync Transfer Rvc
          LE CIS Established
          LE CIS Request
          LE Create BIG Complete
          LE Terminate BIG Complete
          LE BIG Sync Estabilished Complete
          LE BIG Sync Lost
          LE BIG Info Advertising Report
          Unknown mask (0x0000020000000000)
> HCI Event: Command Complete (0x0e) plen 4                 #30 [hci1] 0.652235
      LE Set Event Mask (0x08|0x0001) ncmd 1
        Status: Success (0x00)
< HCI Command: Set Event Mask (0x03|0x0001) plen 8          #31 [hci1] 0.671654
        Mask: 0x2000800002008890
          Disconnection Complete
          Encryption Change
          Read Remote Version Information Complete
          Hardware Error
          Data Buffer Overflow
          Encryption Key Refresh Complete
          LE Meta
> HCI Event: Command Complete (0x0e) plen 4                 #32 [hci1] 0.672216
      Set Event Mask (0x03|0x0001) ncmd 1
        Status: Success (0x00)
< HCI Command: Read BD ADDR (0x04|0x0009) plen 0            #33 [hci1] 0.691659
> HCI Event: Command Complete (0x0e) plen 10                #34 [hci1] 0.692236
      Read BD ADDR (0x04|0x0009) ncmd 1
        Status: Success (0x00)
        Address: 00:00:00:00:00:00 (OUI 00-00-00)
< HCI Command: LE Set Random Address (0x08|0x0005) plen 6   #35 [hci1] 0.711617
        Address: D5:B6:CC:31:DB:3B (Static)
> HCI Event: Command Complete (0x0e) plen 4                 #36 [hci1] 0.712164
      LE Set Random Address (0x08|0x0005) ncmd 1
        Status: Success (0x00)
< HCI Command: LE Set Extended Adv.. (0x08|0x0036) plen 25  #37 [hci1] 2.961752
        Handle: 0x00
        Properties: 0x0013
          Connectable
          Scannable
          Use legacy advertising PDUs: ADV_IND
        Min advertising interval: 100.000 msec (0x00a0)
        Max advertising interval: 150.000 msec (0x00f0)
        Channel map: 37, 38, 39 (0x07)
        Own address type: Random (0x01)
        Peer address type: Public (0x00)
        Peer address: 00:00:00:00:00:00 (OUI 00-00-00)
        Filter policy: Allow Scan Request from Any, Allow Connect Request from Any (0x00)
        TX power: Host has no preference (0x7f)
        Primary PHY: LE 1M (0x01)
        Secondary max skip: 0x00
        Secondary PHY: LE 1M (0x01)
        SID: 0x00
        Scan request notifications: Disabled (0x00)
> HCI Event: Command Complete (0x0e) plen 5                 #38 [hci1] 2.962578
      LE Set Extended Advertising Parameters (0x08|0x0036) ncmd 1
        Status: Success (0x00)
        TX power (selected): 0 dbm (0x00)
< HCI Command: LE Set Advertising S.. (0x08|0x0035) plen 7  #39 [hci1] 2.971702
        Advertising handle: 0x00
        Advertising random address: D5:B6:CC:31:DB:3B (Static)
> HCI Event: Command Complete (0x0e) plen 4                 #40 [hci1] 2.972280
      LE Set Advertising Set Random Address (0x08|0x0035) ncmd 1
        Status: Success (0x00)
< HCI Command: LE Set Extended Adv.. (0x08|0x0037) plen 22  #41 [hci1] 2.991700
        Handle: 0x00
        Operation: Complete extended advertising data (0x03)
        Fragment preference: Minimize fragmentation (0x01)
        Data length: 0x12
        Flags: 0x06
          LE General Discoverable Mode
          BR/EDR Not Supported
        Name (complete): Tester_F6B11A
> HCI Event: Command Complete (0x0e) plen 4                 #42 [hci1] 2.992595
      LE Set Extended Advertising Data (0x08|0x0037) ncmd 1
        Status: Success (0x00)
< HCI Command: LE Set Extended Scan.. (0x08|0x0038) plen 4  #43 [hci1] 3.011685
        Handle: 0x00
        Operation: Complete scan response data (0x03)
        Fragment preference: Minimize fragmentation (0x01)
        Data length: 0x00
> HCI Event: Command Complete (0x0e) plen 4                 #44 [hci1] 3.012285
      LE Set Extended Scan Response Data (0x08|0x0038) ncmd 1
        Status: Success (0x00)
< HCI Command: LE Set Extended Adve.. (0x08|0x0039) plen 6  #45 [hci1] 3.031698
        Extended advertising: Enabled (0x01)
        Number of sets: 1 (0x01)
        Entry 0
          Handle: 0x00
          Duration: 0 ms (0x00)
          Max ext adv events: 0
> HCI Event: Command Complete (0x0e) plen 4                 #46 [hci1] 3.032304
      LE Set Extended Advertising Enable (0x08|0x0039) ncmd 1
        Status: Success (0x00)
> HCI Event: LE Meta Event (0x3e) plen 31                   #47 [hci1] 3.462208
      LE Enhanced Connection Complete (0x0a)
        Status: Success (0x00)
        Handle: 3711
        Role: Peripheral (0x01)
        Peer address type: Public (0x00)
        Peer address: DF:A9:FF:F6:B1:1A (OUI DF-A9-FF)
        Local resolvable private address: 00:00:00:00:00:00 (Non-Resolvable)
        Peer resolvable private address: 00:00:00:00:00:00 (Non-Resolvable)
        Connection interval: 87.50 msec (0x0046)
        Connection latency: 0 (0x0000)
        Supervision timeout: 20000 msec (0x07d0)
        Central clock accuracy: 0x01
> HCI Event: LE Meta Event (0x3e) plen 6                    #48 [hci1] 3.462259
      LE Advertising Set Terminated (0x12)
        Status: Success (0x00)
        Handle: 0
        Connection handle: 3711
        Number of completed extended advertising events: 0
< HCI Command: LE Read Remote Used... (0x08|0x0016) plen 2  #49 [hci1] 3.473114
        Handle: 3711 Address: DF:A9:FF:F6:B1:1A (OUI DF-A9-FF)
> HCI Event: Command Status (0x0f) plen 4                   #50 [hci1] 3.473604
      LE Read Remote Used Features (0x08|0x0016) ncmd 1
        Status: Success (0x00)
> HCI Event: LE Meta Event (0x3e) plen 12                   #51 [hci1] 3.726157
      LE Read Remote Used Features (0x04)
        Status: Success (0x00)
        Handle: 3711 Address: DF:A9:FF:F6:B1:1A (OUI DF-A9-FF)
        Features: 0x2d 0x49 0x00 0xf7 0x67 0xd9 0x00 0x80
          LE Encryption
          Extended Reject Indication
          Peripheral-initiated Features Exchange
          LE Data Packet Length Extension
          LE 2M PHY
          LE Coded PHY
          Channel Selection Algorithm #2
          Periodic Advertising Sync Transfer - Sender
          Periodic Advertising Sync Transfer - Recipient
          Sleep Clock Accuracy Updates
          Connected Isochronous Stream - Central
          Connected Isochronous Stream - Peripheral
          Isochronous Broadcaster
          Synchronized Receiver
          Connected Isochronous Stream (Host Support)
          LE Power Control Request
          LE Power Control Request
          Connection Subrating
          Connection Subrating (Host Support)
          Unknown features (0x8000d90000000000)
> ACL Data RX: Handle 3711 flags 0x02 dlen 11               #52 [hci1] 4.163548
      SMP: Pairing Request (0x01) len 6
        IO capability: KeyboardOnly (0x02)
        OOB data: Authentication data not present (0x00)
        Authentication requirement: No bonding, MITM, SC, No Keypresses (0xcc)
        Max encryption key size: 16
        Initiator key distribution: <none> (0x00)
        Responder key distribution: <none> (0x00)
< HCI Command: Host Number of Compl.. (0x03|0x0035) plen 5  #53 [hci1] 4.172268
        Num handles: 1
        Handle: 3711 Address: DF:A9:FF:F6:B1:1A (OUI DF-A9-FF)
        Count: 1
< ACL Data TX: Handle 3711 flags 0x00 dlen 11               #54 [hci1] 4.172411
      SMP: Pairing Response (0x02) len 6
        IO capability: DisplayOnly (0x00)
        OOB data: Authentication data not present (0x00)
        Authentication requirement: Bonding, No MITM, SC, No Keypresses (0x09)
        Max encryption key size: 16
        Initiator key distribution: <none> (0x00)
        Responder key distribution: <none> (0x00)
> HCI Event: Number of Completed Packets (0x13) plen 5      #55 [hci1] 4.338532
        Num handles: 1
        Handle: 3711 Address: DF:A9:FF:F6:B1:1A (OUI DF-A9-FF)
        Count: 1
        #54: len 11 (0 Kb/s)
        Latency: 166 msec (166-166 msec ~166 msec)
> ACL Data RX: Handle 3711 flags 0x02 dlen 27               #56 [hci1] 4.338790
> ACL Data RX: Handle 3711 flags 0x01 dlen 27               #57 [hci1] 4.339315
> ACL Data RX: Handle 3711 flags 0x01 dlen 15               #58 [hci1] 4.339713
      SMP: Pairing Public Key (0x0c) len 64
        X: b4ec5e3d1a74028cacfcdcfb173a43cdbd45acdc6aa42fb96732dfaa406f920f
        Y: 579224c35d3b1fdfd8cf446f9c25551269d284f490e22d9bebcc2b527a5b7eb9
< HCI Command: Host Number of Compl.. (0x03|0x0035) plen 5  #59 [hci1] 4.351980
        Num handles: 1
        Handle: 3711 Address: DF:A9:FF:F6:B1:1A (OUI DF-A9-FF)
        Count: 1
< HCI Command: Host Number of Compl.. (0x03|0x0035) plen 5  #60 [hci1] 4.352080
        Num handles: 1
        Handle: 3711 Address: DF:A9:FF:F6:B1:1A (OUI DF-A9-FF)
        Count: 1
< HCI Command: Host Number of Compl.. (0x03|0x0035) plen 5  #61 [hci1] 4.352181
        Num handles: 1
        Handle: 3711 Address: DF:A9:FF:F6:B1:1A (OUI DF-A9-FF)
        Count: 1
< ACL Data TX: Handle 3711 flags 0x00 dlen 27               #62 [hci1] 4.352217
< ACL Data TX: Handle 3711 flags 0x01 dlen 27               #63 [hci1] 4.352251
< ACL Data TX: Handle 3711 flags 0x01 dlen 15               #64 [hci1] 4.352253
      SMP: Pairing Public Key (0x0c) len 64
        X: 98308440221e2d910f0e54b71e7ec652857aa9b5a0dc65028824cc19db1226e9
        Y: 67a4816bcb62efb21701e31fdb27561a6217575fb007a8bbdabe7e28b6f68482
> HCI Event: Number of Completed Packets (0x13) plen 5      #65 [hci1] 4.426361
        Num handles: 1
        Handle: 3711 Address: DF:A9:FF:F6:B1:1A (OUI DF-A9-FF)
        Count: 1
        #62: len 27 (2 Kb/s)
        Latency: 74 msec (74-166 msec ~120 msec)
> HCI Event: Number of Completed Packets (0x13) plen 5      #66 [hci1] 4.427117
        Num handles: 1
        Handle: 3711 Address: DF:A9:FF:F6:B1:1A (OUI DF-A9-FF)
        Count: 1
        #63: len 27 (2 Kb/s)
        Latency: 74 msec (74-166 msec ~97 msec)
> HCI Event: Number of Completed Packets (0x13) plen 5      #67 [hci1] 4.513269
        Num handles: 1
        Handle: 3711 Address: DF:A9:FF:F6:B1:1A (OUI DF-A9-FF)
        Count: 1
        #64: len 15 (0 Kb/s)
        Latency: 161 msec (74-166 msec ~129 msec)
> ACL Data RX: Handle 3711 flags 0x02 dlen 21               #68 [hci1] 5.126013
      SMP: Pairing Confirm (0x03) len 16
        Confim value: 36e05b3812ce01ded027260628e75d34
< HCI Command: Host Number of Compl.. (0x03|0x0035) plen 5  #69 [hci1] 5.132136
        Num handles: 1
        Handle: 3711 Address: DF:A9:FF:F6:B1:1A (OUI DF-A9-FF)
        Count: 1
< ACL Data TX: Handle 3711 flags 0x00 dlen 21               #70 [hci1] 5.132222
      SMP: Pairing Confirm (0x03) len 16
        Confim value: 8b046dbc625fe0e1007ec4971f1bf783
> HCI Event: Number of Completed Packets (0x13) plen 5      #71 [hci1] 5.300876
        Num handles: 1
        Handle: 3711 Address: DF:A9:FF:F6:B1:1A (OUI DF-A9-FF)
        Count: 1
        #70: len 21 (1 Kb/s)
        Latency: 168 msec (74-168 msec ~148 msec)
> ACL Data RX: Handle 3711 flags 0x02 dlen 21               #72 [hci1] 5.301262
      SMP: Pairing Random (0x04) len 16
        Random value: 700eb5d336f272fba99a7ddb61381496
< HCI Command: Host Number of Compl.. (0x03|0x0035) plen 5  #73 [hci1] 5.312393
        Num handles: 1
        Handle: 3711 Address: DF:A9:FF:F6:B1:1A (OUI DF-A9-FF)
        Count: 1
< ACL Data TX: Handle 3711 flags 0x00 dlen 21               #74 [hci1] 5.312445
      SMP: Pairing Random (0x04) len 16
        Random value: 8e6108f966a694cbe26df70bb96773e6
> HCI Event: Number of Completed Packets (0x13) plen 5      #75 [hci1] 5.475905
        Num handles: 1
        Handle: 3711 Address: DF:A9:FF:F6:B1:1A (OUI DF-A9-FF)
        Count: 1
        #74: len 21 (1 Kb/s)
        Latency: 163 msec (74-168 msec ~156 msec)
> ACL Data RX: Handle 3711 flags 0x02 dlen 21               #76 [hci1] 5.476265
      SMP: Pairing Confirm (0x03) len 16
        Confim value: 1a5c501d57c3f6a0b6974d9afef552a4
< HCI Command: Host Number of Compl.. (0x03|0x0035) plen 5  #77 [hci1] 5.491881
        Num handles: 1
        Handle: 3711 Address: DF:A9:FF:F6:B1:1A (OUI DF-A9-FF)
        Count: 1
< ACL Data TX: Handle 3711 flags 0x00 dlen 21               #78 [hci1] 5.491888
      SMP: Pairing Confirm (0x03) len 16
        Confim value: 59928467f279ef228629fa51f23da478
> HCI Event: Number of Completed Packets (0x13) plen 5      #79 [hci1] 5.650893
        Num handles: 1
        Handle: 3711 Address: DF:A9:FF:F6:B1:1A (OUI DF-A9-FF)
        Count: 1
        #78: len 21 (1 Kb/s)
        Latency: 159 msec (74-168 msec ~157 msec)
> ACL Data RX: Handle 3711 flags 0x02 dlen 21               #80 [hci1] 5.651341
      SMP: Pairing Random (0x04) len 16
        Random value: abb8b01940aaf6c8a01763a5dd0799b5
< HCI Command: Host Number of Compl.. (0x03|0x0035) plen 5  #81 [hci1] 5.652256
        Num handles: 1
        Handle: 3711 Address: DF:A9:FF:F6:B1:1A (OUI DF-A9-FF)
        Count: 1
< ACL Data TX: Handle 3711 flags 0x00 dlen 21               #82 [hci1] 5.652340
      SMP: Pairing Random (0x04) len 16
        Random value: 4d02679f89a05211af56d8b3da64d21e
> HCI Event: Number of Completed Packets (0x13) plen 5      #83 [hci1] 5.825960
        Num handles: 1
        Handle: 3711 Address: DF:A9:FF:F6:B1:1A (OUI DF-A9-FF)
        Count: 1
        #82: len 21 (0 Kb/s)
        Latency: 173 msec (74-173 msec ~165 msec)
> ACL Data RX: Handle 3711 flags 0x02 dlen 21               #84 [hci1] 5.826295
      SMP: Pairing Confirm (0x03) len 16
        Confim value: 43c6642ef01d706316b974cdb023d637
< HCI Command: Host Number of Compl.. (0x03|0x0035) plen 5  #85 [hci1] 5.832458
        Num handles: 1
        Handle: 3711 Address: DF:A9:FF:F6:B1:1A (OUI DF-A9-FF)
        Count: 1
< ACL Data TX: Handle 3711 flags 0x00 dlen 21               #86 [hci1] 5.832570
      SMP: Pairing Confirm (0x03) len 16
        Confim value: 24326a63f5433342c9ba4c1ab777b3a8
> HCI Event: Number of Completed Packets (0x13) plen 5      #87 [hci1] 6.001013
        Num handles: 1
        Handle: 3711 Address: DF:A9:FF:F6:B1:1A (OUI DF-A9-FF)
        Count: 1
        #86: len 21 (1 Kb/s)
        Latency: 168 msec (74-173 msec ~167 msec)
> ACL Data RX: Handle 3711 flags 0x02 dlen 21               #88 [hci1] 6.001208
      SMP: Pairing Random (0x04) len 16
        Random value: dfe96d795d377945777a985b7b518f5e
< HCI Command: Host Number of Compl.. (0x03|0x0035) plen 5  #89 [hci1] 6.012057
        Num handles: 1
        Handle: 3711 Address: DF:A9:FF:F6:B1:1A (OUI DF-A9-FF)
        Count: 1
< ACL Data TX: Handle 3711 flags 0x00 dlen 21               #90 [hci1] 6.012102
      SMP: Pairing Random (0x04) len 16
        Random value: 5e8286bc235a02440d0c3424a2acf8fd
> HCI Event: Number of Completed Packets (0x13) plen 5      #91 [hci1] 6.175985
        Num handles: 1
        Handle: 3711 Address: DF:A9:FF:F6:B1:1A (OUI DF-A9-FF)
        Count: 1
        #90: len 21 (1 Kb/s)
        Latency: 163 msec (74-173 msec ~165 msec)
> ACL Data RX: Handle 3711 flags 0x02 dlen 21               #92 [hci1] 6.176271
      SMP: Pairing Confirm (0x03) len 16
        Confim value: fc5c49466a6ba495b93c26dcb9bf3368
< HCI Command: Host Number of Compl.. (0x03|0x0035) plen 5  #93 [hci1] 6.192535
        Num handles: 1
        Handle: 3711 Address: DF:A9:FF:F6:B1:1A (OUI DF-A9-FF)
        Count: 1
< ACL Data TX: Handle 3711 flags 0x00 dlen 21               #94 [hci1] 6.192633
      SMP: Pairing Confirm (0x03) len 16
        Confim value: 0f8e1ec8dc8c322866dc39f190f1e89e
> HCI Event: Number of Completed Packets (0x13) plen 5      #95 [hci1] 6.350928
        Num handles: 1
        Handle: 3711 Address: DF:A9:FF:F6:B1:1A (OUI DF-A9-FF)
        Count: 1
        #94: len 21 (1 Kb/s)
        Latency: 158 msec (74-173 msec ~161 msec)
> ACL Data RX: Handle 3711 flags 0x02 dlen 21               #96 [hci1] 6.351263
      SMP: Pairing Random (0x04) len 16
        Random value: ab17c500dd7e036f2f1754e8ebda606e
< HCI Command: Host Number of Compl.. (0x03|0x0035) plen 5  #97 [hci1] 6.352563
        Num handles: 1
        Handle: 3711 Address: DF:A9:FF:F6:B1:1A (OUI DF-A9-FF)
        Count: 1
< ACL Data TX: Handle 3711 flags 0x00 dlen 21               #98 [hci1] 6.352649
      SMP: Pairing Random (0x04) len 16
        Random value: 5c4a1bcadd27bd58e945097b00bad7ac
> HCI Event: Number of Completed Packets (0x13) plen 5      #99 [hci1] 6.525876
        Num handles: 1
        Handle: 3711 Address: DF:A9:FF:F6:B1:1A (OUI DF-A9-FF)
        Count: 1
        #98: len 21 (0 Kb/s)
        Latency: 173 msec (74-173 msec ~167 msec)
> ACL Data RX: Handle 3711 flags 0x02 dlen 21              #100 [hci1] 6.526290
      SMP: Pairing Confirm (0x03) len 16
        Confim value: 2687756129cab55b0c1cef79d49c9c54
< HCI Command: Host Number of Comp.. (0x03|0x0035) plen 5  #101 [hci1] 6.532514
        Num handles: 1
        Handle: 3711 Address: DF:A9:FF:F6:B1:1A (OUI DF-A9-FF)
        Count: 1
< ACL Data TX: Handle 3711 flags 0x00 dlen 21              #102 [hci1] 6.532611
      SMP: Pairing Confirm (0x03) len 16
        Confim value: 1c84562012ad8b78d43832ec2bf1b8a7
> HCI Event: Number of Completed Packets (0x13) plen 5     #103 [hci1] 6.700866
        Num handles: 1
        Handle: 3711 Address: DF:A9:FF:F6:B1:1A (OUI DF-A9-FF)
        Count: 1
        #102: len 21 (1 Kb/s)
        Latency: 168 msec (74-173 msec ~167 msec)
> ACL Data RX: Handle 3711 flags 0x02 dlen 21              #104 [hci1] 6.701315
      SMP: Pairing Random (0x04) len 16
        Random value: f2f7d3fb51a3dd8409830f7b1fa8b502
< HCI Command: Host Number of Comp.. (0x03|0x0035) plen 5  #105 [hci1] 6.712432
        Num handles: 1
        Handle: 3711 Address: DF:A9:FF:F6:B1:1A (OUI DF-A9-FF)
        Count: 1
< ACL Data TX: Handle 3711 flags 0x00 dlen 21              #106 [hci1] 6.712482
      SMP: Pairing Random (0x04) len 16
        Random value: 32527e6e64e79f33b2e374394db8ab2d
> HCI Event: Number of Completed Packets (0x13) plen 5     #107 [hci1] 6.875902
        Num handles: 1
        Handle: 3711 Address: DF:A9:FF:F6:B1:1A (OUI DF-A9-FF)
        Count: 1
        #106: len 21 (1 Kb/s)
        Latency: 163 msec (74-173 msec ~165 msec)
> ACL Data RX: Handle 3711 flags 0x02 dlen 21              #108 [hci1] 6.876176
      SMP: Pairing Confirm (0x03) len 16
        Confim value: 20b63065e5f7f42025f4adf42c067324
< HCI Command: Host Number of Comp.. (0x03|0x0035) plen 5  #109 [hci1] 6.891956
        Num handles: 1
        Handle: 3711 Address: DF:A9:FF:F6:B1:1A (OUI DF-A9-FF)
        Count: 1
< ACL Data TX: Handle 3711 flags 0x00 dlen 21              #110 [hci1] 6.892021
      SMP: Pairing Confirm (0x03) len 16
        Confim value: 179b23f8c07b74e24b697941d5d36f49
> HCI Event: Number of Completed Packets (0x13) plen 5     #111 [hci1] 7.051011
        Num handles: 1
        Handle: 3711 Address: DF:A9:FF:F6:B1:1A (OUI DF-A9-FF)
        Count: 1
        #110: len 21 (1 Kb/s)
        Latency: 158 msec (74-173 msec ~162 msec)
> ACL Data RX: Handle 3711 flags 0x02 dlen 21              #112 [hci1] 7.051386
      SMP: Pairing Random (0x04) len 16
        Random value: d57eeef68a0c91018694858147fe7777
< HCI Command: Host Number of Comp.. (0x03|0x0035) plen 5  #113 [hci1] 7.052017
        Num handles: 1
        Handle: 3711 Address: DF:A9:FF:F6:B1:1A (OUI DF-A9-FF)
        Count: 1
< ACL Data TX: Handle 3711 flags 0x00 dlen 21              #114 [hci1] 7.052044
      SMP: Pairing Random (0x04) len 16
        Random value: dddbdfe2838e9a8cc6964353c850fef7
> HCI Event: Number of Completed Packets (0x13) plen 5     #115 [hci1] 7.225897
        Num handles: 1
        Handle: 3711 Address: DF:A9:FF:F6:B1:1A (OUI DF-A9-FF)
        Count: 1
        #114: len 21 (0 Kb/s)
        Latency: 173 msec (74-173 msec ~168 msec)
> ACL Data RX: Handle 3711 flags 0x02 dlen 21              #116 [hci1] 7.226229
      SMP: Pairing Confirm (0x03) len 16
        Confim value: 99e69dbe656f2f8b0f65c79cc998ef14
< HCI Command: Host Number of Comp.. (0x03|0x0035) plen 5  #117 [hci1] 7.232517
        Num handles: 1
        Handle: 3711 Address: DF:A9:FF:F6:B1:1A (OUI DF-A9-FF)
        Count: 1
< ACL Data TX: Handle 3711 flags 0x00 dlen 21              #118 [hci1] 7.232685
      SMP: Pairing Confirm (0x03) len 16
        Confim value: 17a8392289264f2ebd5cd91c42d444d2
> HCI Event: Number of Completed Packets (0x13) plen 5     #119 [hci1] 7.401043
        Num handles: 1
        Handle: 3711 Address: DF:A9:FF:F6:B1:1A (OUI DF-A9-FF)
        Count: 1
        #118: len 21 (1 Kb/s)
        Latency: 168 msec (74-173 msec ~168 msec)
> ACL Data RX: Handle 3711 flags 0x02 dlen 21              #120 [hci1] 7.401164
      SMP: Pairing Random (0x04) len 16
        Random value: b3e1b0bf995de7a2665eaca6d562cf6a
< HCI Command: Host Number of Comp.. (0x03|0x0035) plen 5  #121 [hci1] 7.412457
        Num handles: 1
        Handle: 3711 Address: DF:A9:FF:F6:B1:1A (OUI DF-A9-FF)
        Count: 1
< ACL Data TX: Handle 3711 flags 0x00 dlen 21              #122 [hci1] 7.412551
      SMP: Pairing Random (0x04) len 16
        Random value: eb9f1915536596b6fc3db1c86b2b1970
> HCI Event: Number of Completed Packets (0x13) plen 5     #123 [hci1] 7.575908
        Num handles: 1
        Handle: 3711 Address: DF:A9:FF:F6:B1:1A (OUI DF-A9-FF)
        Count: 1
        #122: len 21 (1 Kb/s)
        Latency: 163 msec (74-173 msec ~165 msec)
> ACL Data RX: Handle 3711 flags 0x02 dlen 21              #124 [hci1] 7.576110
      SMP: Pairing Confirm (0x03) len 16
        Confim value: 4360f6f8db0630248a8dc6f4808fe37f
< HCI Command: Host Number of Comp.. (0x03|0x0035) plen 5  #125 [hci1] 7.592194
        Num handles: 1
        Handle: 3711 Address: DF:A9:FF:F6:B1:1A (OUI DF-A9-FF)
        Count: 1
< ACL Data TX: Handle 3711 flags 0x00 dlen 21              #126 [hci1] 7.592258
      SMP: Pairing Confirm (0x03) len 16
        Confim value: 4fdc36c85d2751bdcbf42c8228b3692d
> HCI Event: Number of Completed Packets (0x13) plen 5     #127 [hci1] 7.750818
        Num handles: 1
        Handle: 3711 Address: DF:A9:FF:F6:B1:1A (OUI DF-A9-FF)
        Count: 1
        #126: len 21 (1 Kb/s)
        Latency: 158 msec (74-173 msec ~162 msec)
> ACL Data RX: Handle 3711 flags 0x02 dlen 21              #128 [hci1] 7.751262
      SMP: Pairing Random (0x04) len 16
        Random value: 2f95f163cf7ce964ab37bed6799a26b8
< HCI Command: Host Number of Comp.. (0x03|0x0035) plen 5  #129 [hci1] 7.752442
        Num handles: 1
        Handle: 3711 Address: DF:A9:FF:F6:B1:1A (OUI DF-A9-FF)
        Count: 1
< ACL Data TX: Handle 3711 flags 0x00 dlen 21              #130 [hci1] 7.752568
      SMP: Pairing Random (0x04) len 16
        Random value: 5c794dc9ad9f2c3f295ebd5ad5e1c3cf
> HCI Event: Number of Completed Packets (0x13) plen 5     #131 [hci1] 7.925872
        Num handles: 1
        Handle: 3711 Address: DF:A9:FF:F6:B1:1A (OUI DF-A9-FF)
        Count: 1
        #130: len 21 (0 Kb/s)
        Latency: 173 msec (74-173 msec ~167 msec)
> ACL Data RX: Handle 3711 flags 0x02 dlen 21              #132 [hci1] 7.926229
      SMP: Pairing Confirm (0x03) len 16
        Confim value: 0b00388ef44faedc54cfa3b7d7f1da3e
< HCI Command: Host Number of Comp.. (0x03|0x0035) plen 5  #133 [hci1] 7.932561
        Num handles: 1
        Handle: 3711 Address: DF:A9:FF:F6:B1:1A (OUI DF-A9-FF)
        Count: 1
< ACL Data TX: Handle 3711 flags 0x00 dlen 21              #134 [hci1] 7.932668
      SMP: Pairing Confirm (0x03) len 16
        Confim value: 797b17a168aa9362a67c1aec89b9407d
> HCI Event: Number of Completed Packets (0x13) plen 5     #135 [hci1] 8.100844
        Num handles: 1
        Handle: 3711 Address: DF:A9:FF:F6:B1:1A (OUI DF-A9-FF)
        Count: 1
        #134: len 21 (1 Kb/s)
        Latency: 168 msec (74-173 msec ~167 msec)
> ACL Data RX: Handle 3711 flags 0x02 dlen 21              #136 [hci1] 8.101204
      SMP: Pairing Random (0x04) len 16
        Random value: 2a4ecb2fbd8edf8596b3354125aa247f
< HCI Command: Host Number of Comp.. (0x03|0x0035) plen 5  #137 [hci1] 8.112428
        Num handles: 1
        Handle: 3711 Address: DF:A9:FF:F6:B1:1A (OUI DF-A9-FF)
        Count: 1
< ACL Data TX: Handle 3711 flags 0x00 dlen 21              #138 [hci1] 8.112517
      SMP: Pairing Random (0x04) len 16
        Random value: 5c2fff312cdf99c9491988e877355a9a
> HCI Event: Number of Completed Packets (0x13) plen 5     #139 [hci1] 8.275897
        Num handles: 1
        Handle: 3711 Address: DF:A9:FF:F6:B1:1A (OUI DF-A9-FF)
        Count: 1
        #138: len 21 (1 Kb/s)
        Latency: 163 msec (74-173 msec ~165 msec)
> ACL Data RX: Handle 3711 flags 0x02 dlen 21              #140 [hci1] 8.276458
      SMP: Pairing Confirm (0x03) len 16
        Confim value: 32ab75aedb7af292947aa3604fd520b2
< HCI Command: Host Number of Comp.. (0x03|0x0035) plen 5  #141 [hci1] 8.292552
        Num handles: 1
        Handle: 3711 Address: DF:A9:FF:F6:B1:1A (OUI DF-A9-FF)
        Count: 1
< ACL Data TX: Handle 3711 flags 0x00 dlen 21              #142 [hci1] 8.292656
      SMP: Pairing Confirm (0x03) len 16
        Confim value: f4f04804f1f2a984e42e5f0b0cab7d18
> HCI Event: Number of Completed Packets (0x13) plen 5     #143 [hci1] 8.450876
        Num handles: 1
        Handle: 3711 Address: DF:A9:FF:F6:B1:1A (OUI DF-A9-FF)
        Count: 1
        #142: len 21 (1 Kb/s)
        Latency: 158 msec (74-173 msec ~161 msec)
> ACL Data RX: Handle 3711 flags 0x02 dlen 21              #144 [hci1] 8.451193
      SMP: Pairing Random (0x04) len 16
        Random value: c40397af34f75382a8a8c9510ad7b41a
< HCI Command: Host Number of Comp.. (0x03|0x0035) plen 5  #145 [hci1] 8.452370
        Num handles: 1
        Handle: 3711 Address: DF:A9:FF:F6:B1:1A (OUI DF-A9-FF)
        Count: 1
< ACL Data TX: Handle 3711 flags 0x00 dlen 21              #146 [hci1] 8.452504
      SMP: Pairing Random (0x04) len 16
        Random value: c629a3a987d808e808655d558dfc1155
< ACL Data TX: Handle 3711 flags 0x00 dlen 16              #147 [hci1] 8.482000
      LE L2CAP: Connection Parameter Update Request (0x12) ident 1 len 8
        Min interval: 24
        Max interval: 40
        Peripheral latency: 0
        Timeout multiplier: 42
> HCI Event: Number of Completed Packets (0x13) plen 5     #148 [hci1] 8.538694
        Num handles: 1
        Handle: 3711 Address: DF:A9:FF:F6:B1:1A (OUI DF-A9-FF)
        Count: 1
        #146: len 21 (1 Kb/s)
        Latency: 86 msec (74-173 msec ~124 msec)
> HCI Event: Number of Completed Packets (0x13) plen 5     #149 [hci1] 8.625896
        Num handles: 1
        Handle: 3711 Address: DF:A9:FF:F6:B1:1A (OUI DF-A9-FF)
        Count: 1
        #147: len 16 (0 Kb/s)
        Latency: 143 msec (74-173 msec ~133 msec)
> ACL Data RX: Handle 3711 flags 0x02 dlen 21              #150 [hci1] 8.626200
      SMP: Pairing Confirm (0x03) len 16
        Confim value: abe29e9583571d99d39455832dc81fe8
< HCI Command: Host Number of Comp.. (0x03|0x0035) plen 5  #151 [hci1] 8.631883
        Num handles: 1
        Handle: 3711 Address: DF:A9:FF:F6:B1:1A (OUI DF-A9-FF)
        Count: 1
< ACL Data TX: Handle 3711 flags 0x00 dlen 21              #152 [hci1] 8.631924
      SMP: Pairing Confirm (0x03) len 16
        Confim value: fd6f3c1bc11a98cf65d144e66ab0c7b8
> ACL Data RX: Handle 3711 flags 0x02 dlen 10              #153 [hci1] 8.713269
      LE L2CAP: Connection Parameter Update Response (0x13) ident 1 len 2
        Result: Connection Parameters accepted (0x0000)
< HCI Command: Host Number of Comp.. (0x03|0x0035) plen 5  #154 [hci1] 8.732227
        Num handles: 1
        Handle: 3711 Address: DF:A9:FF:F6:B1:1A (OUI DF-A9-FF)
        Count: 1
> HCI Event: Number of Completed Packets (0x13) plen 5     #155 [hci1] 8.800959
        Num handles: 1
        Handle: 3711 Address: DF:A9:FF:F6:B1:1A (OUI DF-A9-FF)
        Count: 1
        #152: len 21 (0 Kb/s)
        Latency: 169 msec (74-173 msec ~151 msec)
> ACL Data RX: Handle 3711 flags 0x02 dlen 21              #156 [hci1] 8.801247
      SMP: Pairing Random (0x04) len 16
        Random value: 5ee7eeb1455d0d17a22973b598a6fe27
< HCI Command: Host Number of Comp.. (0x03|0x0035) plen 5  #157 [hci1] 8.812485
        Num handles: 1
        Handle: 3711 Address: DF:A9:FF:F6:B1:1A (OUI DF-A9-FF)
        Count: 1
< ACL Data TX: Handle 3711 flags 0x00 dlen 21              #158 [hci1] 8.812594
      SMP: Pairing Random (0x04) len 16
        Random value: 92f20f6ad8f13724432c7fd6001c45ff
> HCI Event: Number of Completed Packets (0x13) plen 5     #159 [hci1] 8.975814
        Num handles: 1
        Handle: 3711 Address: DF:A9:FF:F6:B1:1A (OUI DF-A9-FF)
        Count: 1
        #158: len 21 (1 Kb/s)
        Latency: 163 msec (74-173 msec ~157 msec)
> ACL Data RX: Handle 3711 flags 0x02 dlen 21              #160 [hci1] 8.976183
      SMP: Pairing Confirm (0x03) len 16
        Confim value: 4c39e8223beef9d3cf1189215670a292
< HCI Command: Host Number of Comp.. (0x03|0x0035) plen 5  #161 [hci1] 8.992463
        Num handles: 1
        Handle: 3711 Address: DF:A9:FF:F6:B1:1A (OUI DF-A9-FF)
        Count: 1
< ACL Data TX: Handle 3711 flags 0x00 dlen 21              #162 [hci1] 8.992543
      SMP: Pairing Confirm (0x03) len 16
        Confim value: 7f24411ce29aa35906a71d0e397f1f3b
> HCI Event: Number of Completed Packets (0x13) plen 5     #163 [hci1] 9.150837
        Num handles: 1
        Handle: 3711 Address: DF:A9:FF:F6:B1:1A (OUI DF-A9-FF)
        Count: 1
        #162: len 21 (1 Kb/s)
        Latency: 158 msec (74-173 msec ~157 msec)
> ACL Data RX: Handle 3711 flags 0x02 dlen 21              #164 [hci1] 9.151236
      SMP: Pairing Random (0x04) len 16
        Random value: 9971a84242a51641858e6d5981dc6b83
< HCI Command: Host Number of Comp.. (0x03|0x0035) plen 5  #165 [hci1] 9.151733
        Num handles: 1
        Handle: 3711 Address: DF:A9:FF:F6:B1:1A (OUI DF-A9-FF)
        Count: 1
< ACL Data TX: Handle 3711 flags 0x00 dlen 21              #166 [hci1] 9.151780
      SMP: Pairing Random (0x04) len 16
        Random value: 23ac32ebbb5e14c8a6b9622f296d277f
> HCI Event: Number of Completed Packets (0x13) plen 5     #167 [hci1] 9.325863
        Num handles: 1
        Handle: 3711 Address: DF:A9:FF:F6:B1:1A (OUI DF-A9-FF)
        Count: 1
        #166: len 21 (0 Kb/s)
        Latency: 174 msec (74-174 msec ~165 msec)
> ACL Data RX: Handle 3711 flags 0x02 dlen 21              #168 [hci1] 9.326156
      SMP: Pairing Confirm (0x03) len 16
        Confim value: 694afcb1661abcd92bfaad7f3bf7c491
< HCI Command: Host Number of Comp.. (0x03|0x0035) plen 5  #169 [hci1] 9.332467
        Num handles: 1
        Handle: 3711 Address: DF:A9:FF:F6:B1:1A (OUI DF-A9-FF)
        Count: 1
< ACL Data TX: Handle 3711 flags 0x00 dlen 21              #170 [hci1] 9.332657
      SMP: Pairing Confirm (0x03) len 16
        Confim value: 3a2daced9a2581ff8550833c2cd5cb82
> HCI Event: Number of Completed Packets (0x13) plen 5     #171 [hci1] 9.500889
        Num handles: 1
        Handle: 3711 Address: DF:A9:FF:F6:B1:1A (OUI DF-A9-FF)
        Count: 1
        #170: len 21 (1 Kb/s)
        Latency: 168 msec (74-174 msec ~167 msec)
> ACL Data RX: Handle 3711 flags 0x02 dlen 21              #172 [hci1] 9.501263
      SMP: Pairing Random (0x04) len 16
        Random value: 5754dfafbaf3b83e91692e6ab57ea34b
< HCI Command: Host Number of Comp.. (0x03|0x0035) plen 5  #173 [hci1] 9.512520
        Num handles: 1
        Handle: 3711 Address: DF:A9:FF:F6:B1:1A (OUI DF-A9-FF)
        Count: 1
< ACL Data TX: Handle 3711 flags 0x00 dlen 21              #174 [hci1] 9.512573
      SMP: Pairing Random (0x04) len 16
        Random value: 297efe85e67448a15f56bd27e3a3cf1d
> HCI Event: Number of Completed Packets (0x13) plen 5     #175 [hci1] 9.675887
        Num handles: 1
        Handle: 3711 Address: DF:A9:FF:F6:B1:1A (OUI DF-A9-FF)
        Count: 1
        #174: len 21 (1 Kb/s)
        Latency: 163 msec (74-174 msec ~165 msec)
> ACL Data RX: Handle 3711 flags 0x02 dlen 21              #176 [hci1] 9.676193
      SMP: Pairing Confirm (0x03) len 16
        Confim value: 45bf3c9f1b59c878699b201da85f1ee5
< HCI Command: Host Number of Comp.. (0x03|0x0035) plen 5  #177 [hci1] 9.692096
        Num handles: 1
        Handle: 3711 Address: DF:A9:FF:F6:B1:1A (OUI DF-A9-FF)
        Count: 1
< ACL Data TX: Handle 3711 flags 0x00 dlen 21              #178 [hci1] 9.692181
      SMP: Pairing Confirm (0x03) len 16
        Confim value: 6a448349515aba2638201701e2fe86b1
> HCI Event: Number of Completed Packets (0x13) plen 5     #179 [hci1] 9.850857
        Num handles: 1
        Handle: 3711 Address: DF:A9:FF:F6:B1:1A (OUI DF-A9-FF)
        Count: 1
        #178: len 21 (1 Kb/s)
        Latency: 158 msec (74-174 msec ~161 msec)
> ACL Data RX: Handle 3711 flags 0x02 dlen 21              #180 [hci1] 9.851077
      SMP: Pairing Random (0x04) len 16
        Random value: b886ec8580ad7c8b4891715566d291dc
< HCI Command: Host Number of Comp.. (0x03|0x0035) plen 5  #181 [hci1] 9.852289
        Num handles: 1
        Handle: 3711 Address: DF:A9:FF:F6:B1:1A (OUI DF-A9-FF)
        Count: 1
< ACL Data TX: Handle 3711 flags 0x00 dlen 21              #182 [hci1] 9.852404
      SMP: Pairing Random (0x04) len 16
        Random value: 25a9493fd3ce4faf02be7293595bb7c6
> HCI Event: Number of Completed Packets (0x13) plen 5    #183 [hci1] 10.025784
        Num handles: 1
        Handle: 3711 Address: DF:A9:FF:F6:B1:1A (OUI DF-A9-FF)
        Count: 1
        #182: len 21 (0 Kb/s)
        Latency: 173 msec (74-174 msec ~167 msec)
> ACL Data RX: Handle 3711 flags 0x02 dlen 21             #184 [hci1] 10.026127
      SMP: Pairing Confirm (0x03) len 16
        Confim value: c92a558b0e598a57ac509c4394d85658
< HCI Command: Host Number of Com.. (0x03|0x0035) plen 5  #185 [hci1] 10.032422
        Num handles: 1
        Handle: 3711 Address: DF:A9:FF:F6:B1:1A (OUI DF-A9-FF)
        Count: 1
< ACL Data TX: Handle 3711 flags 0x00 dlen 21             #186 [hci1] 10.032521
      SMP: Pairing Confirm (0x03) len 16
        Confim value: 7ae37f7cd1e4544c5de7e8df0709f49d
> HCI Event: Number of Completed Packets (0x13) plen 5    #187 [hci1] 10.200854
        Num handles: 1
        Handle: 3711 Address: DF:A9:FF:F6:B1:1A (OUI DF-A9-FF)
        Count: 1
        #186: len 21 (1 Kb/s)
        Latency: 168 msec (74-174 msec ~167 msec)
> ACL Data RX: Handle 3711 flags 0x02 dlen 21             #188 [hci1] 10.201086
      SMP: Pairing Random (0x04) len 16
        Random value: 1d3c6790a4772ae46b1b2ec8045b5cd4
< HCI Command: Host Number of Com.. (0x03|0x0035) plen 5  #189 [hci1] 10.211929
        Num handles: 1
        Handle: 3711 Address: DF:A9:FF:F6:B1:1A (OUI DF-A9-FF)
        Count: 1
< ACL Data TX: Handle 3711 flags 0x00 dlen 21             #190 [hci1] 10.212000
      SMP: Pairing Random (0x04) len 16
        Random value: 58f6b41f855a6f6c3560debd84e2affc
> HCI Event: Number of Completed Packets (0x13) plen 5    #191 [hci1] 10.375820
        Num handles: 1
        Handle: 3711 Address: DF:A9:FF:F6:B1:1A (OUI DF-A9-FF)
        Count: 1
        #190: len 21 (1 Kb/s)
        Latency: 163 msec (74-174 msec ~165 msec)
> ACL Data RX: Handle 3711 flags 0x02 dlen 21             #192 [hci1] 10.376189
      SMP: Pairing Confirm (0x03) len 16
        Confim value: 9160541a8ec7502babaefc933fd988c1
< HCI Command: Host Number of Com.. (0x03|0x0035) plen 5  #193 [hci1] 10.392520
        Num handles: 1
        Handle: 3711 Address: DF:A9:FF:F6:B1:1A (OUI DF-A9-FF)
        Count: 1
< ACL Data TX: Handle 3711 flags 0x00 dlen 21             #194 [hci1] 10.392627
      SMP: Pairing Confirm (0x03) len 16
        Confim value: 756917c85ab8687dce1db933f6d8b688
> HCI Event: Number of Completed Packets (0x13) plen 5    #195 [hci1] 10.550843
        Num handles: 1
        Handle: 3711 Address: DF:A9:FF:F6:B1:1A (OUI DF-A9-FF)
        Count: 1
        #194: len 21 (1 Kb/s)
        Latency: 158 msec (74-174 msec ~162 msec)
> ACL Data RX: Handle 3711 flags 0x02 dlen 21             #196 [hci1] 10.551129
      SMP: Pairing Random (0x04) len 16
        Random value: 28eb2bde7637cb47fb5a9eaf42e06f0e
< HCI Command: Host Number of Com.. (0x03|0x0035) plen 5  #197 [hci1] 10.552175
        Num handles: 1
        Handle: 3711 Address: DF:A9:FF:F6:B1:1A (OUI DF-A9-FF)
        Count: 1
< ACL Data TX: Handle 3711 flags 0x00 dlen 21             #198 [hci1] 10.552285
      SMP: Pairing Random (0x04) len 16
        Random value: b67e7216d5bf664139eda2b542549666
> HCI Event: Number of Completed Packets (0x13) plen 5    #199 [hci1] 10.725784
        Num handles: 1
        Handle: 3711 Address: DF:A9:FF:F6:B1:1A (OUI DF-A9-FF)
        Count: 1
        #198: len 21 (0 Kb/s)
        Latency: 173 msec (74-174 msec ~167 msec)
> ACL Data RX: Handle 3711 flags 0x02 dlen 21             #200 [hci1] 10.726190
      SMP: Pairing Confirm (0x03) len 16
        Confim value: 2165ab7b0315a86cfb93a7c84820d026
< HCI Command: Host Number of Com.. (0x03|0x0035) plen 5  #201 [hci1] 10.732148
        Num handles: 1
        Handle: 3711 Address: DF:A9:FF:F6:B1:1A (OUI DF-A9-FF)
        Count: 1
< ACL Data TX: Handle 3711 flags 0x00 dlen 21             #202 [hci1] 10.732205
      SMP: Pairing Confirm (0x03) len 16
        Confim value: 9d6ed89d629639e785edbd4d71441911
> HCI Event: Number of Completed Packets (0x13) plen 5    #203 [hci1] 10.900845
        Num handles: 1
        Handle: 3711 Address: DF:A9:FF:F6:B1:1A (OUI DF-A9-FF)
        Count: 1
        #202: len 21 (1 Kb/s)
        Latency: 168 msec (74-174 msec ~168 msec)
> ACL Data RX: Handle 3711 flags 0x02 dlen 21             #204 [hci1] 10.901098
      SMP: Pairing Random (0x04) len 16
        Random value: b9484ebc8912a9f039e63a380e6571a8
< HCI Command: Host Number of Com.. (0x03|0x0035) plen 5  #205 [hci1] 10.912498
        Num handles: 1
        Handle: 3711 Address: DF:A9:FF:F6:B1:1A (OUI DF-A9-FF)
        Count: 1
< ACL Data TX: Handle 3711 flags 0x00 dlen 21             #206 [hci1] 10.912660
      SMP: Pairing Random (0x04) len 16
        Random value: ed17f76500c95219dd01e09d1e63f87b
> HCI Event: Number of Completed Packets (0x13) plen 5    #207 [hci1] 11.075805
        Num handles: 1
        Handle: 3711 Address: DF:A9:FF:F6:B1:1A (OUI DF-A9-FF)
        Count: 1
        #206: len 21 (1 Kb/s)
        Latency: 163 msec (74-174 msec ~165 msec)
> ACL Data RX: Handle 3711 flags 0x02 dlen 21             #208 [hci1] 11.076179
      SMP: Pairing Confirm (0x03) len 16
        Confim value: 4d6f926d259ca71a58aec8f9e5e1f931
< HCI Command: Host Number of Com.. (0x03|0x0035) plen 5  #209 [hci1] 11.092587
        Num handles: 1
        Handle: 3711 Address: DF:A9:FF:F6:B1:1A (OUI DF-A9-FF)
        Count: 1
< ACL Data TX: Handle 3711 flags 0x00 dlen 21             #210 [hci1] 11.092674
      SMP: Pairing Confirm (0x03) len 16
        Confim value: 40762a831a49008dedf830626677a81f
> HCI Event: Number of Completed Packets (0x13) plen 5    #211 [hci1] 11.250878
        Num handles: 1
        Handle: 3711 Address: DF:A9:FF:F6:B1:1A (OUI DF-A9-FF)
        Count: 1
        #210: len 21 (1 Kb/s)
        Latency: 158 msec (74-174 msec ~161 msec)
> ACL Data RX: Handle 3711 flags 0x02 dlen 21             #212 [hci1] 11.251223
      SMP: Pairing Random (0x04) len 16
        Random value: f1472cb6ad6d4c5da591bcce9b2f4d00
< HCI Command: Host Number of Com.. (0x03|0x0035) plen 5  #213 [hci1] 11.252179
        Num handles: 1
        Handle: 3711 Address: DF:A9:FF:F6:B1:1A (OUI DF-A9-FF)
        Count: 1
< ACL Data TX: Handle 3711 flags 0x00 dlen 21             #214 [hci1] 11.252199
      SMP: Pairing Random (0x04) len 16
        Random value: 81d35d47e1f6006d79c974bd9d9e1ee3
> HCI Event: Number of Completed Packets (0x13) plen 5    #215 [hci1] 11.425770
        Num handles: 1
        Handle: 3711 Address: DF:A9:FF:F6:B1:1A (OUI DF-A9-FF)
        Count: 1
        #214: len 21 (0 Kb/s)
        Latency: 173 msec (74-174 msec ~167 msec)
> ACL Data RX: Handle 3711 flags 0x02 dlen 21             #216 [hci1] 11.426187
      SMP: Pairing Confirm (0x03) len 16
        Confim value: 0a21257d80ce4878aad6b31914ea9e08
< HCI Command: Host Number of Com.. (0x03|0x0035) plen 5  #217 [hci1] 11.432459
        Num handles: 1
        Handle: 3711 Address: DF:A9:FF:F6:B1:1A (OUI DF-A9-FF)
        Count: 1
< ACL Data TX: Handle 3711 flags 0x00 dlen 21             #218 [hci1] 11.432511
      SMP: Pairing Confirm (0x03) len 16
        Confim value: e862f7d483b489603d0b845390dc8550
> HCI Event: Number of Completed Packets (0x13) plen 5    #219 [hci1] 11.600750
        Num handles: 1
        Handle: 3711 Address: DF:A9:FF:F6:B1:1A (OUI DF-A9-FF)
        Count: 1
        #218: len 21 (1 Kb/s)
        Latency: 168 msec (74-174 msec ~167 msec)
> ACL Data RX: Handle 3711 flags 0x02 dlen 21             #220 [hci1] 11.601241
      SMP: Pairing Random (0x04) len 16
        Random value: 321f5c9bf3ec7e4a02721c205ac32ab1
< HCI Command: Host Number of Com.. (0x03|0x0035) plen 5  #221 [hci1] 11.612649
        Num handles: 1
        Handle: 3711 Address: DF:A9:FF:F6:B1:1A (OUI DF-A9-FF)
        Count: 1
< ACL Data TX: Handle 3711 flags 0x00 dlen 21             #222 [hci1] 11.612766
      SMP: Pairing Random (0x04) len 16
        Random value: e7f7e0c2476823e41736a7e381bafb7c
> HCI Event: Number of Completed Packets (0x13) plen 5    #223 [hci1] 11.775796
        Num handles: 1
        Handle: 3711 Address: DF:A9:FF:F6:B1:1A (OUI DF-A9-FF)
        Count: 1
        #222: len 21 (1 Kb/s)
        Latency: 163 msec (74-174 msec ~165 msec)
> ACL Data RX: Handle 3711 flags 0x02 dlen 21             #224 [hci1] 11.776096
      SMP: Pairing Confirm (0x03) len 16
        Confim value: e6f2c49c5749554e9e217513a996b038
< HCI Command: Host Number of Com.. (0x03|0x0035) plen 5  #225 [hci1] 11.792485
        Num handles: 1
        Handle: 3711 Address: DF:A9:FF:F6:B1:1A (OUI DF-A9-FF)
        Count: 1
< ACL Data TX: Handle 3711 flags 0x00 dlen 21             #226 [hci1] 11.792535
      SMP: Pairing Confirm (0x03) len 16
        Confim value: 6ba81e404cf086c5fea21f1e8e0985c3
> HCI Event: Number of Completed Packets (0x13) plen 5    #227 [hci1] 11.950784
        Num handles: 1
        Handle: 3711 Address: DF:A9:FF:F6:B1:1A (OUI DF-A9-FF)
        Count: 1
        #226: len 21 (1 Kb/s)
        Latency: 158 msec (74-174 msec ~161 msec)
> ACL Data RX: Handle 3711 flags 0x02 dlen 21             #228 [hci1] 11.951040
      SMP: Pairing Random (0x04) len 16
        Random value: 1c43b876ac7547b44fde931afce67399
< HCI Command: Host Number of Com.. (0x03|0x0035) plen 5  #229 [hci1] 11.952595
        Num handles: 1
        Handle: 3711 Address: DF:A9:FF:F6:B1:1A (OUI DF-A9-FF)
        Count: 1
< ACL Data TX: Handle 3711 flags 0x00 dlen 21             #230 [hci1] 11.952714
      SMP: Pairing Random (0x04) len 16
        Random value: fc8b40d9b0b09bc4296bf8753a8f6e1f
> HCI Event: Number of Completed Packets (0x13) plen 5    #231 [hci1] 12.125694
        Num handles: 1
        Handle: 3711 Address: DF:A9:FF:F6:B1:1A (OUI DF-A9-FF)
        Count: 1
        #230: len 21 (0 Kb/s)
        Latency: 172 msec (74-174 msec ~167 msec)
> ACL Data RX: Handle 3711 flags 0x02 dlen 21             #232 [hci1] 12.126137
      SMP: Pairing DHKey Check (0x0d) len 16
        E: 25b52964a4bdcb42b6d0e6600e840544
< HCI Command: Host Number of Com.. (0x03|0x0035) plen 5  #233 [hci1] 12.133031
        Num handles: 1
        Handle: 3711 Address: DF:A9:FF:F6:B1:1A (OUI DF-A9-FF)
        Count: 1
< ACL Data TX: Handle 3711 flags 0x00 dlen 21             #234 [hci1] 12.133138
      SMP: Pairing DHKey Check (0x0d) len 16
        E: 30b70a5858215fdc3350fb866caebc31
> HCI Event: Number of Completed Packets (0x13) plen 5    #235 [hci1] 12.300538
        Num handles: 1
        Handle: 3711 Address: DF:A9:FF:F6:B1:1A (OUI DF-A9-FF)
        Count: 1
        #234: len 21 (1 Kb/s)
        Latency: 167 msec (74-174 msec ~167 msec)
> HCI Event: LE Meta Event (0x3e) plen 13                 #236 [hci1] 12.388674
      LE Long Term Key Request (0x05)
        Handle: 3711 Address: DF:A9:FF:F6:B1:1A (OUI DF-A9-FF)
        Random number: 0x0000000000000000
        Encrypted diversifier: 0x0000
< HCI Command: LE Long Term Key... (0x08|0x001a) plen 18  #237 [hci1] 12.391783
        Handle: 3711 Address: DF:A9:FF:F6:B1:1A (OUI DF-A9-FF)
        Long term key: 20e30845c5c25c57d96b93c73db835a4
> HCI Event: Command Complete (0x0e) plen 6               #238 [hci1] 12.392532
      LE Long Term Key Request Reply (0x08|0x001a) ncmd 1
        Status: Success (0x00)
        Handle: 3711 Address: DF:A9:FF:F6:B1:1A (OUI DF-A9-FF)
> HCI Event: Encryption Change (0x08) plen 4              #239 [hci1] 12.826095
        Status: Success (0x00)
        Handle: 3711 Address: DF:A9:FF:F6:B1:1A (OUI DF-A9-FF)
        Encryption: Enabled with AES-CCM (0x01)
> HCI Event: Disconnect Complete (0x05) plen 4            #240 [hci1] 15.975793
        Status: Success (0x00)
        Handle: 3711 Address: DF:A9:FF:F6:B1:1A (OUI DF-A9-FF)
        Reason: Remote User Terminated Connection (0x13)
< HCI Command: Reset (0x03|0x0003) plen 0                 #241 [hci1] 21.701861
> HCI Event: Command Complete (0x0e) plen 4               #242 [hci1] 21.702368
      Reset (0x03|0x0003) ncmd 1
        Status: Success (0x00)
@ USER Close: main                                    {0x0001} [hci1] 21.711790
= Close Index: 00:00:00:00:00:00                               [hci1] 21.711797
