Bluetooth monitor ver 5.72
= Note: Linux version 6.14.0-36-generic (x86_64)                       0.529947
= Note: Bluetooth subsystem version 2.22                               0.529949
= New Index: 00:00:00:00:00:00 (Primary,UART,hci1)              [hci1] 0.529950
= New Index: 48:5F:99:8E:E0:64 (Primary,USB,hci0)               [hci0] 0.529951
= Open Index: 00:00:00:00:00:00                                 [hci1] 1.043775
= Index Info: 00:00:00:00:00:00 (Nordic Semiconductor ASA)      [hci1] 1.043794
@ USER Open: main (privileged) version 2.22            {0x0001} [hci1] 1.043805
< HCI Command: Reset (0x03|0x0003) plen 0                    #1 [hci1] 1.045046
> HCI Event: Command Complete (0x0e) plen 4                  #2 [hci1] 1.045552
      Reset (0x03|0x0003) ncmd 1
        Status: Success (0x00)
< HCI Command: Read Local Supported... (0x04|0x0003) plen 0  #3 [hci1] 1.063148
> HCI Event: Command Complete (0x0e) plen 12                 #4 [hci1] 1.063781
      Read Local Supported Features (0x04|0x0003) ncmd 1
        Status: Success (0x00)
        Features: 0x00 0x00 0x00 0x00 0x60 0x00 0x00 0x00
          BR/EDR Not Supported
          LE Supported (Controller)
< HCI Command: Read Local Version In.. (0x04|0x0001) plen 0  #5 [hci1] 1.083172
> HCI Event: Command Complete (0x0e) plen 12                 #6 [hci1] 1.083692
      Read Local Version Information (0x04|0x0001) ncmd 1
        Status: Success (0x00)
        HCI version: Reserved (0x0f) - Revision 12393 (0x3069)
        LMP version: Reserved (0x0f) - Subversion 12393 (0x3069)
        Manufacturer: Nordic Semiconductor ASA (89)
< HCI Command: Read Local Supported... (0x04|0x0002) plen 0  #7 [hci1] 1.103155
> HCI Event: Command Complete (0x0e) plen 68                 #8 [hci1] 1.104302
      Read Local Supported Commands (0x04|0x0002) ncmd 1
        Status: Success (0x00)
        Commands: 119 entries
          Disconnect (Octet 0 - Bit 5)
          Read Remote Version Information (Octet 2 - Bit 7)
          Set Event Mask (Octet 5 - Bit 6)
          Reset (Octet 5 - Bit 7)
          Read Connection Accept Timeout (Octet 7 - Bit 2)
          Write Connection Accept Timeout (Octet 7 - Bit 3)
          Read Transmit Power Level (Octet 10 - Bit 2)
          Set Controller To Host Flow Control (Octet 10 - Bit 5)
          Host Buffer Size (Octet 10 - Bit 6)
          Host Number of Completed Packets (Octet 10 - Bit 7)
          Read Local Version Information (Octet 14 - Bit 3)
          Read Local Supported Features (Octet 14 - Bit 5)
          Read BD ADDR (Octet 15 - Bit 1)
          Read RSSI (Octet 15 - Bit 5)
          Set Event Mask Page 2 (Octet 22 - Bit 2)
          LE Set Event Mask (Octet 25 - Bit 0)
          LE Read Buffer Size (Octet 25 - Bit 1)
          LE Read Local Supported Features (Octet 25 - Bit 2)
          LE Set Random Address (Octet 25 - Bit 4)
          LE Set Advertising Parameters (Octet 25 - Bit 5)
          LE Read Advertising Channel TX Power (Octet 25 - Bit 6)
          LE Set Advertising Data (Octet 25 - Bit 7)
          LE Set Scan Response Data (Octet 26 - Bit 0)
          LE Set Advertise Enable (Octet 26 - Bit 1)
          LE Set Scan Parameters (Octet 26 - Bit 2)
          LE Set Scan Enable (Octet 26 - Bit 3)
          LE Create Connection (Octet 26 - Bit 4)
          LE Create Connection Cancel (Octet 26 - Bit 5)
          LE Read Accept List Size (Octet 26 - Bit 6)
          LE Clear Accept List (Octet 26 - Bit 7)
          LE Add Device To Accept List (Octet 27 - Bit 0)
          LE Remove Device From Accept List (Octet 27 - Bit 1)
          LE Connection Update (Octet 27 - Bit 2)
          LE Set Host Channel Classification (Octet 27 - Bit 3)
          LE Read Channel Map (Octet 27 - Bit 4)
          LE Read Remote Used Features (Octet 27 - Bit 5)
          LE Encrypt (Octet 27 - Bit 6)
          LE Rand (Octet 27 - Bit 7)
          LE Start Encryption (Octet 28 - Bit 0)
          LE Long Term Key Request Reply (Octet 28 - Bit 1)
          LE Long Term Key Request Neg Reply (Octet 28 - Bit 2)
          LE Read Supported States (Octet 28 - Bit 3)
          LE Receiver Test (Octet 28 - Bit 4)
          LE Transmitter Test (Octet 28 - Bit 5)
          LE Test End (Octet 28 - Bit 6)
          Read Authenticated Payload Timeout (Octet 32 - Bit 4)
          Write Authenticated Payload Timeout (Octet 32 - Bit 5)
          LE Set Data Length (Octet 33 - Bit 6)
          LE Read Suggested Default Data Length (Octet 33 - Bit 7)
          LE Write Suggested Default Data Length (Octet 34 - Bit 0)
          LE Add Device To Resolving List (Octet 34 - Bit 3)
          LE Remove Device From Resolving List (Octet 34 - Bit 4)
          LE Clear Resolving List (Octet 34 - Bit 5)
          LE Read Resolving List Size (Octet 34 - Bit 6)
          LE Set Address Resolution Enable (Octet 35 - Bit 1)
          LE Set Resolvable Private Address Timeout (Octet 35 - Bit 2)
          LE Read Maximum Data Length (Octet 35 - Bit 3)
          LE Read PHY (Octet 35 - Bit 4)
          LE Set Default PHY (Octet 35 - Bit 5)
          LE Set PHY (Octet 35 - Bit 6)
          LE Enhanced Receiver Test (Octet 35 - Bit 7)
          LE Enhanced Transmitter Test (Octet 36 - Bit 0)
          LE Set Advertising Set Random Address (Octet 36 - Bit 1)
          LE Set Extended Advertising Parameters (Octet 36 - Bit 2)
          LE Set Extended Advertising Data (Octet 36 - Bit 3)
          LE Set Extended Scan Response Data (Octet 36 - Bit 4)
          LE Set Extended Advertising Enable (Octet 36 - Bit 5)
          LE Read Maximum Advertising Data Length (Octet 36 - Bit 6)
          LE Read Number of Supported Advertising Sets (Octet 36 - Bit 7)
          LE Remove Advertising Set (Octet 37 - Bit 0)
          LE Clear Advertising Sets (Octet 37 - Bit 1)
          LE Set Periodic Advertising Parameters (Octet 37 - Bit 2)
          LE Set Periodic Advertising Data (Octet 37 - Bit 3)
          LE Set Periodic Advertising Enable (Octet 37 - Bit 4)
          LE Set Extended Scan Parameters (Octet 37 - Bit 5)
          LE Set Extended Scan Enable (Octet 37 - Bit 6)
          LE Extended Create Connection (Octet 37 - Bit 7)
          LE Periodic Advertising Create Sync (Octet 38 - Bit 0)
          LE Periodic Advertising Create Sync Cancel (Octet 38 - Bit 1)
          LE Periodic Advertising Terminate Sync (Octet 38 - Bit 2)
          LE Add Device To Periodic Advertiser List (Octet 38 - Bit 3)
          LE Remove Device From Periodic Advertiser List (Octet 38 - Bit 4)
          LE Clear Periodic Advertiser List (Octet 38 - Bit 5)
          LE Read Periodic Advertiser List Size (Octet 38 - Bit 6)
          LE Read Transmit Power (Octet 38 - Bit 7)
          LE Read RF Path Compensation (Octet 39 - Bit 0)
          LE Write RF Path Compensation (Octet 39 - Bit 1)
          LE Set Privacy Mode (Octet 39 - Bit 2)
          LE Periodic Advertising Receive Enable (Octet 40 - Bit 5)
          LE Periodic Advertising Sync Transfer (Octet 40 - Bit 6)
          LE Periodic Advertising Set Info Transfer (Octet 40 - Bit 7)
          LE Periodic Advertising Sync Transfer Parameters (Octet 41 - Bit 0)
          LE Set Default Periodic Advertisng Sync Transfer Parameters (Octet 41 - Bit 1)
          LE Read Buffer v2 (Octet 41 - Bit 5)
          LE Read ISO TX Sync (Octet 41 - Bit 6)
          LE Set Connected Isochronous Group Parameters (Octet 41 - Bit 7)
          LE Set Connected Isochronous Group Parameters Test (Octet 42 - Bit 0)
          LE Create Connected Isochronous Stream (Octet 42 - Bit 1)
          LE Remove Connected Isochronous Group (Octet 42 - Bit 2)
          LE Accept Connected Isochronous Stream Request (Octet 42 - Bit 3)
          LE Reject Connected Isochronous Stream Request (Octet 42 - Bit 4)
          LE Create Broadcast Isochronous Group (Octet 42 - Bit 5)
          LE Create Broadcast Isochronous Group Test (Octet 42 - Bit 6)
          LE Terminate Broadcast Isochronous Group (Octet 42 - Bit 7)
          LE Broadcast Isochronous Group Create Sync (Octet 43 - Bit 0)
          LE Broadcast Isochronous Group Terminate Sync (Octet 43 - Bit 1)
          LE Request Peer SCA (Octet 43 - Bit 2)
          LE Setup Isochronous Data Path (Octet 43 - Bit 3)
          LE Remove Isochronous Data Path (Octet 43 - Bit 4)
          LE Isochronous Transmit Test (Octet 43 - Bit 5)
          LE Isochronous Receive Test (Octet 43 - Bit 6)
          LE Isochronous Read Test Counters (Octet 43 - Bit 7)
          LE Isochronous Read Test Counters (Octet 44 - Bit 0)
          LE Set Host Feature (Octet 44 - Bit 1)
          Octet 44 - Bit 2 
          Octet 45 - Bit 6 
          Octet 46 - Bit 0 
          Octet 46 - Bit 1 
          Octet 46 - Bit 2 
< HCI Command: Host Buffer Size (0x03|0x0033) plen 7         #9 [hci1] 1.123116
        ACL MTU: 255  ACL max packet: 16
        SCO MTU: 0    SCO max packet: 0
> HCI Event: Command Complete (0x0e) plen 4                 #10 [hci1] 1.123674
      Host Buffer Size (0x03|0x0033) ncmd 1
        Status: Success (0x00)
< HCI Command: Set Controller To Ho.. (0x03|0x0031) plen 1  #11 [hci1] 1.143108
        Flow control: ACL Data Packets (0x01)
> HCI Event: Command Complete (0x0e) plen 4                 #12 [hci1] 1.143540
      Set Controller To Host Flow Control (0x03|0x0031) ncmd 1
        Status: Success (0x00)
< HCI Command: LE Read Local Suppor.. (0x08|0x0003) plen 0  #13 [hci1] 1.163140
> HCI Event: Command Complete (0x0e) plen 12                #14 [hci1] 1.163645
      LE Read Local Supported Features (0x08|0x0003) ncmd 1
        Status: Success (0x00)
        Features: 0xfd 0x79 0x00 0xf7 0x30 0x01 0x00 0x00
          LE Encryption
          Extended Reject Indication
          Peripheral-initiated Features Exchange
          LE Ping
          LE Data Packet Length Extension
          LL Privacy
          Extended Scanner Filter Policies
          LE 2M PHY
          LE Coded PHY
          LE Extended Advertising
          LE Periodic Advertising
          Channel Selection Algorithm #2
          Periodic Advertising Sync Transfer - Sender
          Periodic Advertising Sync Transfer - Recipient
          Sleep Clock Accuracy Updates
          Connected Isochronous Stream - Central
          Connected Isochronous Stream - Peripheral
          Isochronous Broadcaster
          Synchronized Receiver
          Periodic Advertising ADI support
          Connection Subrating
          Unknown features (0x0000010000000000)
< HCI Command: LE Set Host Feature (0x08|0x0074) plen 2     #15 [hci1] 1.183147
        Bit Number: 32
          Connected Isochronous Stream (Host Support)
        Bit Value: 1
> HCI Event: Command Complete (0x0e) plen 4                 #16 [hci1] 1.183658
      LE Set Host Feature (0x08|0x0074) ncmd 1
        Status: Success (0x00)
< HCI Command: LE Read Buffer v2 (0x08|0x0060) plen 0       #17 [hci1] 1.203148
> HCI Event: Command Complete (0x0e) plen 10                #18 [hci1] 1.203614
      LE Read Buffer v2 (0x08|0x0060) ncmd 1
        Status: Success (0x00)
        ACL MTU: 27
        ACL max packet: 3
        ISO MTU: 318
        ISO max packet: 3
< HCI Command: LE Read Maximum Adve.. (0x08|0x003a) plen 0  #19 [hci1] 1.223166
> HCI Event: Command Complete (0x0e) plen 6                 #20 [hci1] 1.223679
      LE Read Maximum Advertising Data Length (0x08|0x003a) ncmd 1
        Status: Success (0x00)
        Max length: 1650
< HCI Command: LE Read Supported St.. (0x08|0x001c) plen 0  #21 [hci1] 1.243141
> HCI Event: Command Complete (0x0e) plen 12                #22 [hci1] 1.243636
      LE Read Supported States (0x08|0x001c) ncmd 1
        Status: Success (0x00)
        States: 0x000003ff3e0306ff
          Non-connectable Advertising State
          Scannable Advertising State
          Connectable Advertising State
          High Duty Cycle Directed Advertising State
          Passive Scanning State
          Active Scanning State
          Initiating State
            and Connection State (Central Role)
          Connection State (Peripheral Role)
          Scannable Advertising State
            and Passive Scanning State
          Connectable Advertising State
            and Passive Scanning State
          Non-connectable Advertising State
            and Initiating State
          Scannable Advertising State
            and Initiating State
          Active Scanning State
            and Connection State (Central Role)
          Passive Scanning State
            and Connection State (Peripheral Role)
          Active Scanning State
            and Connection State (Peripheral Role)
          Initiating State
            and Connection State (Central Role)
            and Central Role & Central Role
          Low Duty Cycle Directed Advertising State
          Connectable Advertising State
            and Initiating State
            and Central Role & Peripheral Role
          High Duty Cycle Directed Advertising State
            and Initiating State
            and Central Role & Peripheral Role
          Low Duty Cycle Directed Advertising State
            and Initiating State
            and Central Role & Peripheral Role
          Connectable Advertising State
            and Connection State (Central Role)
            and Central Role & Peripheral Role
          High Duty Cycle Directed Advertising State
            and Connection State (Central Role)
            and Central Role & Peripheral Role
          Low Duty Cycle Directed Advertising State
            and Connection State (Central Role)
            and Central Role & Peripheral Role
          Connectable Advertising State
            and Connection State (Peripheral Role)
            and Central Role & Peripheral Role
          High Duty Cycle Directed Advertising State
            and Connection State (Peripheral Role)
            and Peripheral Role & Peripheral Role
          Low Duty Cycle Directed Advertising State
            and Connection State (Peripheral Role)
            and Peripheral Role & Peripheral Role
          Initiating State
            and Connection State (Peripheral Role)
            and Central Role & Peripheral Role
< HCI Command: LE Read Maximum Data.. (0x08|0x002f) plen 0  #23 [hci1] 1.263142
> HCI Event: Command Complete (0x0e) plen 12                #24 [hci1] 1.263683
      LE Read Maximum Data Length (0x08|0x002f) ncmd 1
        Status: Success (0x00)
        Max TX octets: 251
        Max TX time: 2704
        Max RX octets: 251
        Max RX time: 2704
< HCI Command: LE Write Suggested D.. (0x08|0x0024) plen 4  #25 [hci1] 1.283140
        TX octets: 251
        TX time: 2704
> HCI Event: Command Complete (0x0e) plen 4                 #26 [hci1] 1.283651
      LE Write Suggested Default Data Length (0x08|0x0024) ncmd 1
        Status: Success (0x00)
< HCI Command: LE Read Resolving Li.. (0x08|0x002a) plen 0  #27 [hci1] 1.303154
> HCI Event: Command Complete (0x0e) plen 5                 #28 [hci1] 1.303567
      LE Read Resolving List Size (0x08|0x002a) ncmd 1
        Status: Success (0x00)
        Size: 8
< HCI Command: LE Set Event Mask (0x08|0x0001) plen 8       #29 [hci1] 1.323150
        Mask: 0x000002023f87fa5e
          LE Advertising Report
          LE Connection Update Complete
          LE Read Remote Used Features Complete
          LE Long Term Key Request
          LE Data Length Change
          LE Enhanced Connection Complete
          LE PHY Update Complete
          LE Extended Advertising Report
          LE Periodic Advertising Sync Established
          LE Periodic Advertising Report
          LE Periodic Advertising Sync Lost
          LE Extended Scan Timeout
          LE Extended Advertising Set Terminated
          LE Scan Request Received
          LE Periodic Advertising Sync Transfer Rvc
          LE CIS Established
          LE CIS Request
          LE Create BIG Complete
          LE Terminate BIG Complete
          LE BIG Sync Estabilished Complete
          LE BIG Sync Lost
          LE BIG Info Advertising Report
          Unknown mask (0x0000020000000000)
> HCI Event: Command Complete (0x0e) plen 4                 #30 [hci1] 1.323740
      LE Set Event Mask (0x08|0x0001) ncmd 1
        Status: Success (0x00)
< HCI Command: Set Event Mask (0x03|0x0001) plen 8          #31 [hci1] 1.343147
        Mask: 0x2000800002008890
          Disconnection Complete
          Encryption Change
          Read Remote Version Information Complete
          Hardware Error
          Data Buffer Overflow
          Encryption Key Refresh Complete
          LE Meta
> HCI Event: Command Complete (0x0e) plen 4                 #32 [hci1] 1.343698
      Set Event Mask (0x03|0x0001) ncmd 1
        Status: Success (0x00)
< HCI Command: Read BD ADDR (0x04|0x0009) plen 0            #33 [hci1] 1.363142
> HCI Event: Command Complete (0x0e) plen 10                #34 [hci1] 1.363667
      Read BD ADDR (0x04|0x0009) ncmd 1
        Status: Success (0x00)
        Address: 00:00:00:00:00:00 (OUI 00-00-00)
< HCI Command: LE Set Random Address (0x08|0x0005) plen 6   #35 [hci1] 1.383154
        Address: D5:B6:CC:31:DB:3B (Static)
> HCI Event: Command Complete (0x0e) plen 4                 #36 [hci1] 1.383653
      LE Set Random Address (0x08|0x0005) ncmd 1
        Status: Success (0x00)
< HCI Command: LE Set Extended Adv.. (0x08|0x0036) plen 25  #37 [hci1] 3.983243
        Handle: 0x00
        Properties: 0x0013
          Connectable
          Scannable
          Use legacy advertising PDUs: ADV_IND
        Min advertising interval: 100.000 msec (0x00a0)
        Max advertising interval: 150.000 msec (0x00f0)
        Channel map: 37, 38, 39 (0x07)
        Own address type: Random (0x01)
        Peer address type: Public (0x00)
        Peer address: 00:00:00:00:00:00 (OUI 00-00-00)
        Filter policy: Allow Scan Request from Any, Allow Connect Request from Any (0x00)
        TX power: Host has no preference (0x7f)
        Primary PHY: LE 1M (0x01)
        Secondary max skip: 0x00
        Secondary PHY: LE 1M (0x01)
        SID: 0x00
        Scan request notifications: Disabled (0x00)
> HCI Event: Command Complete (0x0e) plen 5                 #38 [hci1] 3.984087
      LE Set Extended Advertising Parameters (0x08|0x0036) ncmd 1
        Status: Success (0x00)
        TX power (selected): 0 dbm (0x00)
< HCI Command: LE Set Advertising S.. (0x08|0x0035) plen 7  #39 [hci1] 4.003177
        Advertising handle: 0x00
        Advertising random address: D5:B6:CC:31:DB:3B (Static)
> HCI Event: Command Complete (0x0e) plen 4                 #40 [hci1] 4.003701
      LE Set Advertising Set Random Address (0x08|0x0035) ncmd 1
        Status: Success (0x00)
< HCI Command: LE Set Extended Adv.. (0x08|0x0037) plen 22  #41 [hci1] 4.023163
        Handle: 0x00
        Operation: Complete extended advertising data (0x03)
        Fragment preference: Minimize fragmentation (0x01)
        Data length: 0x12
        Flags: 0x06
          LE General Discoverable Mode
          BR/EDR Not Supported
        Name (complete): Tester_F6B11A
> HCI Event: Command Complete (0x0e) plen 4                 #42 [hci1] 4.023865
      LE Set Extended Advertising Data (0x08|0x0037) ncmd 1
        Status: Success (0x00)
< HCI Command: LE Set Extended Scan.. (0x08|0x0038) plen 4  #43 [hci1] 4.043168
        Handle: 0x00
        Operation: Complete scan response data (0x03)
        Fragment preference: Minimize fragmentation (0x01)
        Data length: 0x00
> HCI Event: Command Complete (0x0e) plen 4                 #44 [hci1] 4.043624
      LE Set Extended Scan Response Data (0x08|0x0038) ncmd 1
        Status: Success (0x00)
< HCI Command: LE Set Extended Adve.. (0x08|0x0039) plen 6  #45 [hci1] 4.063168
        Extended advertising: Enabled (0x01)
        Number of sets: 1 (0x01)
        Entry 0
          Handle: 0x00
          Duration: 0 ms (0x00)
          Max ext adv events: 0
> HCI Event: Command Complete (0x0e) plen 4                 #46 [hci1] 4.063755
      LE Set Extended Advertising Enable (0x08|0x0039) ncmd 1
        Status: Success (0x00)
> HCI Event: LE Meta Event (0x3e) plen 31                   #47 [hci1] 4.184272
      LE Enhanced Connection Complete (0x0a)
        Status: Success (0x00)
        Handle: 147
        Role: Peripheral (0x01)
        Peer address type: Public (0x00)
        Peer address: DF:A9:FF:F6:B1:1A (OUI DF-A9-FF)
        Local resolvable private address: 00:00:00:00:00:00 (Non-Resolvable)
        Peer resolvable private address: 00:00:00:00:00:00 (Non-Resolvable)
        Connection interval: 87.50 msec (0x0046)
        Connection latency: 0 (0x0000)
        Supervision timeout: 25120 msec (0x09d0)
        Central clock accuracy: 0x01
> HCI Event: LE Meta Event (0x3e) plen 6                    #48 [hci1] 4.184282
      LE Advertising Set Terminated (0x12)
        Status: Success (0x00)
        Handle: 0
        Connection handle: 147
        Number of completed extended advertising events: 0
< HCI Command: LE Read Remote Used... (0x08|0x0016) plen 2  #49 [hci1] 4.204173
        Handle: 147 Address: DF:A9:FF:F6:B1:1A (OUI DF-A9-FF)
< ACL Data TX: Handle 147 flags 0x00 dlen 7                 #50 [hci1] 4.204198
      ATT: Exchange MTU Request (0x02) len 2
        Client RX MTU: 251
> HCI Event: Command Status (0x0f) plen 4                   #51 [hci1] 4.204760
      LE Read Remote Used Features (0x08|0x0016) ncmd 1
        Status: Success (0x00)
> HCI Event: Number of Completed Packets (0x13) plen 5      #52 [hci1] 4.360121
        Num handles: 1
        Handle: 147 Address: DF:A9:FF:F6:B1:1A (OUI DF-A9-FF)
        Count: 1
        #50: len 7 (0 Kb/s)
        Latency: 155 msec (155-155 msec ~155 msec)
> HCI Event: LE Meta Event (0x3e) plen 12                   #53 [hci1] 4.448110
      LE Read Remote Used Features (0x04)
        Status: Success (0x00)
        Handle: 147 Address: DF:A9:FF:F6:B1:1A (OUI DF-A9-FF)
        Features: 0x2d 0x49 0x00 0xf7 0x67 0xd8 0x00 0x00
          LE Encryption
          Extended Reject Indication
          Peripheral-initiated Features Exchange
          LE Data Packet Length Extension
          LE 2M PHY
          LE Coded PHY
          Channel Selection Algorithm #2
          Periodic Advertising Sync Transfer - Sender
          Periodic Advertising Sync Transfer - Recipient
          Sleep Clock Accuracy Updates
          Connected Isochronous Stream - Central
          Connected Isochronous Stream - Peripheral
          Isochronous Broadcaster
          Synchronized Receiver
          Connected Isochronous Stream (Host Support)
          LE Power Control Request
          LE Power Control Request
          Connection Subrating
          Connection Subrating (Host Support)
          Unknown features (0x0000d80000000000)
> ACL Data RX: Handle 147 flags 0x02 dlen 11                #54 [hci1] 6.897754
      SMP: Pairing Request (0x01) len 6
        IO capability: KeyboardDisplay (0x04)
        OOB data: Authentication data not present (0x00)
        Authentication requirement: Bonding, MITM, SC, No Keypresses (0x0d)
        Max encryption key size: 16
        Initiator key distribution: EncKey IdKey (0x03)
        Responder key distribution: EncKey IdKey Sign (0x07)
> ACL Data RX: Handle 147 flags 0x02 dlen 7                 #55 [hci1] 6.898105
      ATT: Exchange MTU Response (0x03) len 2
        Server RX MTU: 23
< HCI Command: Host Number of Compl.. (0x03|0x0035) plen 5  #56 [hci1] 6.903615
        Num handles: 1
        Handle: 147 Address: DF:A9:FF:F6:B1:1A (OUI DF-A9-FF)
        Count: 1
< ACL Data TX: Handle 147 flags 0x00 dlen 11                #57 [hci1] 6.903888
      SMP: Pairing Response (0x02) len 6
        IO capability: DisplayOnly (0x00)
        OOB data: Authentication data not present (0x00)
        Authentication requirement: Bonding, No MITM, SC, No Keypresses (0x09)
        Max encryption key size: 16
        Initiator key distribution: IdKey (0x02)
        Responder key distribution: <none> (0x00)
< HCI Command: Host Number of Compl.. (0x03|0x0035) plen 5  #58 [hci1] 6.904229
        Num handles: 1
        Handle: 147 Address: DF:A9:FF:F6:B1:1A (OUI DF-A9-FF)
        Count: 1
> HCI Event: Number of Completed Packets (0x13) plen 5      #59 [hci1] 7.072892
        Num handles: 1
        Handle: 147 Address: DF:A9:FF:F6:B1:1A (OUI DF-A9-FF)
        Count: 1
        #57: len 11 (0 Kb/s)
        Latency: 169 msec (155-169 msec ~162 msec)
> ACL Data RX: Handle 147 flags 0x02 dlen 27                #60 [hci1] 7.073176
> ACL Data RX: Handle 147 flags 0x01 dlen 27                #61 [hci1] 7.073838
> ACL Data RX: Handle 147 flags 0x01 dlen 15                #62 [hci1] 7.074071
      SMP: Pairing Public Key (0x0c) len 64
        X: aa986a1aea378cfe9c15784ba7400a798e9138ad537c051a7f03b7b588da4559
        Y: a59542fcc8eacd29785462ae5f24d8111198f82e4556736414d05447dd3ad326
< HCI Command: Host Number of Compl.. (0x03|0x0035) plen 5  #63 [hci1] 7.084047
        Num handles: 1
        Handle: 147 Address: DF:A9:FF:F6:B1:1A (OUI DF-A9-FF)
        Count: 1
< HCI Command: Host Number of Compl.. (0x03|0x0035) plen 5  #64 [hci1] 7.084271
        Num handles: 1
        Handle: 147 Address: DF:A9:FF:F6:B1:1A (OUI DF-A9-FF)
        Count: 1
< HCI Command: Host Number of Compl.. (0x03|0x0035) plen 5  #65 [hci1] 7.084668
        Num handles: 1
        Handle: 147 Address: DF:A9:FF:F6:B1:1A (OUI DF-A9-FF)
        Count: 1
< ACL Data TX: Handle 147 flags 0x00 dlen 27                #66 [hci1] 7.084843
< ACL Data TX: Handle 147 flags 0x01 dlen 27                #67 [hci1] 7.084860
< ACL Data TX: Handle 147 flags 0x01 dlen 15                #68 [hci1] 7.084864
      SMP: Pairing Public Key (0x0c) len 64
        X: 98308440221e2d910f0e54b71e7ec652857aa9b5a0dc65028824cc19db1226e9
        Y: 67a4816bcb62efb21701e31fdb27561a6217575fb007a8bbdabe7e28b6f68482
> HCI Event: Number of Completed Packets (0x13) plen 5      #69 [hci1] 7.160720
        Num handles: 1
        Handle: 147 Address: DF:A9:FF:F6:B1:1A (OUI DF-A9-FF)
        Count: 1
        #66: len 27 (2 Kb/s)
        Latency: 75 msec (75-169 msec ~119 msec)
> HCI Event: Number of Completed Packets (0x13) plen 5      #70 [hci1] 7.161492
        Num handles: 1
        Handle: 147 Address: DF:A9:FF:F6:B1:1A (OUI DF-A9-FF)
        Count: 1
        #67: len 27 (2 Kb/s)
        Latency: 76 msec (75-169 msec ~97 msec)
> HCI Event: Number of Completed Packets (0x13) plen 5      #71 [hci1] 7.247548
        Num handles: 1
        Handle: 147 Address: DF:A9:FF:F6:B1:1A (OUI DF-A9-FF)
        Count: 1
        #68: len 15 (0 Kb/s)
        Latency: 162 msec (75-169 msec ~130 msec)
> ACL Data RX: Handle 147 flags 0x02 dlen 21                #72 [hci1] 8.210320
      SMP: Pairing Confirm (0x03) len 16
        Confim value: 9402a6bf28938bd22c817beae7e10d11
< HCI Command: Host Number of Compl.. (0x03|0x0035) plen 5  #73 [hci1] 8.223524
        Num handles: 1
        Handle: 147 Address: DF:A9:FF:F6:B1:1A (OUI DF-A9-FF)
        Count: 1
< ACL Data TX: Handle 147 flags 0x00 dlen 21                #74 [hci1] 8.223667
      SMP: Pairing Confirm (0x03) len 16
        Confim value: 85739718fc6692cf8ed7c5fa410ba892
> HCI Event: Number of Completed Packets (0x13) plen 5      #75 [hci1] 8.385160
        Num handles: 1
        Handle: 147 Address: DF:A9:FF:F6:B1:1A (OUI DF-A9-FF)
        Count: 1
        #74: len 21 (1 Kb/s)
        Latency: 161 msec (75-169 msec ~145 msec)
> ACL Data RX: Handle 147 flags 0x02 dlen 21                #76 [hci1] 8.385529
      SMP: Pairing Random (0x04) len 16
        Random value: dfc45ebc3f40055e0000000000000000
< HCI Command: Host Number of Compl.. (0x03|0x0035) plen 5  #77 [hci1] 8.403982
        Num handles: 1
        Handle: 147 Address: DF:A9:FF:F6:B1:1A (OUI DF-A9-FF)
        Count: 1
< ACL Data TX: Handle 147 flags 0x00 dlen 21                #78 [hci1] 8.404077
      SMP: Pairing Random (0x04) len 16
        Random value: 8e6108f966a694cbe26df70bb96773e6
> HCI Event: Number of Completed Packets (0x13) plen 5      #79 [hci1] 8.559951
        Num handles: 1
        Handle: 147 Address: DF:A9:FF:F6:B1:1A (OUI DF-A9-FF)
        Count: 1
        #78: len 21 (1 Kb/s)
        Latency: 155 msec (75-169 msec ~150 msec)
> ACL Data RX: Handle 147 flags 0x02 dlen 21                #80 [hci1] 8.647801
      SMP: Pairing Confirm (0x03) len 16
        Confim value: 42236340cd7ac6d5e01d14d618fb0ff8
< HCI Command: Host Number of Compl.. (0x03|0x0035) plen 5  #81 [hci1] 8.663394
        Num handles: 1
        Handle: 147 Address: DF:A9:FF:F6:B1:1A (OUI DF-A9-FF)
        Count: 1
< ACL Data TX: Handle 147 flags 0x00 dlen 21                #82 [hci1] 8.663499
      SMP: Pairing Confirm (0x03) len 16
        Confim value: 48ac34d8faa86c83024f241069f4c809
> HCI Event: Number of Completed Packets (0x13) plen 5      #83 [hci1] 8.822741
        Num handles: 1
        Handle: 147 Address: DF:A9:FF:F6:B1:1A (OUI DF-A9-FF)
        Count: 1
        #82: len 21 (1 Kb/s)
        Latency: 159 msec (75-169 msec ~155 msec)
> ACL Data RX: Handle 147 flags 0x02 dlen 21                #84 [hci1] 8.823145
      SMP: Pairing Random (0x04) len 16
        Random value: 5504f63ab2ab26f50000000000000000
< HCI Command: Host Number of Compl.. (0x03|0x0035) plen 5  #85 [hci1] 8.823858
        Num handles: 1
        Handle: 147 Address: DF:A9:FF:F6:B1:1A (OUI DF-A9-FF)
        Count: 1
< ACL Data TX: Handle 147 flags 0x00 dlen 21                #86 [hci1] 8.823949
      SMP: Pairing Random (0x04) len 16
        Random value: 4d02679f89a05211af56d8b3da64d21e
> HCI Event: Number of Completed Packets (0x13) plen 5      #87 [hci1] 8.997425
        Num handles: 1
        Handle: 147 Address: DF:A9:FF:F6:B1:1A (OUI DF-A9-FF)
        Count: 1
        #86: len 21 (0 Kb/s)
        Latency: 173 msec (75-173 msec ~164 msec)
> ACL Data RX: Handle 147 flags 0x02 dlen 21                #88 [hci1] 9.085283
      SMP: Pairing Confirm (0x03) len 16
        Confim value: 4692623c6456016af7581e97a4f91589
< HCI Command: Host Number of Compl.. (0x03|0x0035) plen 5  #89 [hci1] 9.103667
        Num handles: 1
        Handle: 147 Address: DF:A9:FF:F6:B1:1A (OUI DF-A9-FF)
        Count: 1
< ACL Data TX: Handle 147 flags 0x00 dlen 21                #90 [hci1] 9.103866
      SMP: Pairing Confirm (0x03) len 16
        Confim value: d57dcf4274c79b0da736046b792bb6fe
> HCI Event: Number of Completed Packets (0x13) plen 5      #91 [hci1] 9.260170
        Num handles: 1
        Handle: 147 Address: DF:A9:FF:F6:B1:1A (OUI DF-A9-FF)
        Count: 1
        #90: len 21 (1 Kb/s)
        Latency: 156 msec (75-173 msec ~160 msec)
> ACL Data RX: Handle 147 flags 0x02 dlen 21                #92 [hci1] 9.260464
      SMP: Pairing Random (0x04) len 16
        Random value: b002a2316f22d3ec0000000000000000
< HCI Command: Host Number of Compl.. (0x03|0x0035) plen 5  #93 [hci1] 9.263864
        Num handles: 1
        Handle: 147 Address: DF:A9:FF:F6:B1:1A (OUI DF-A9-FF)
        Count: 1
< ACL Data TX: Handle 147 flags 0x00 dlen 21                #94 [hci1] 9.264002
      SMP: Pairing Random (0x04) len 16
        Random value: 5e8286bc235a02440d0c3424a2acf8fd
> HCI Event: Number of Completed Packets (0x13) plen 5      #95 [hci1] 9.434986
        Num handles: 1
        Handle: 147 Address: DF:A9:FF:F6:B1:1A (OUI DF-A9-FF)
        Count: 1
        #94: len 21 (0 Kb/s)
        Latency: 170 msec (75-173 msec ~165 msec)
> ACL Data RX: Handle 147 flags 0x02 dlen 21                #96 [hci1] 9.522873
      SMP: Pairing Confirm (0x03) len 16
        Confim value: ef8702ed2f1903b48f3dd60a8971e9f6
< HCI Command: Host Number of Compl.. (0x03|0x0035) plen 5  #97 [hci1] 9.523574
        Num handles: 1
        Handle: 147 Address: DF:A9:FF:F6:B1:1A (OUI DF-A9-FF)
        Count: 1
< ACL Data TX: Handle 147 flags 0x00 dlen 21                #98 [hci1] 9.523617
      SMP: Pairing Confirm (0x03) len 16
        Confim value: 9d7147a8ed9fd2f4c630326f9dfa1a8a
> HCI Event: Number of Completed Packets (0x13) plen 5      #99 [hci1] 9.697721
        Num handles: 1
        Handle: 147 Address: DF:A9:FF:F6:B1:1A (OUI DF-A9-FF)
        Count: 1
        #98: len 21 (0 Kb/s)
        Latency: 174 msec (75-174 msec ~169 msec)
> ACL Data RX: Handle 147 flags 0x02 dlen 21               #100 [hci1] 9.697963
      SMP: Pairing Random (0x04) len 16
        Random value: a954e748a69983cb0000000000000000
< HCI Command: Host Number of Comp.. (0x03|0x0035) plen 5  #101 [hci1] 9.703909
        Num handles: 1
        Handle: 147 Address: DF:A9:FF:F6:B1:1A (OUI DF-A9-FF)
        Count: 1
< ACL Data TX: Handle 147 flags 0x00 dlen 21               #102 [hci1] 9.704043
      SMP: Pairing Random (0x04) len 16
        Random value: 5c4a1bcadd27bd58e945097b00bad7ac
> HCI Event: Number of Completed Packets (0x13) plen 5     #103 [hci1] 9.872482
        Num handles: 1
        Handle: 147 Address: DF:A9:FF:F6:B1:1A (OUI DF-A9-FF)
        Count: 1
        #102: len 21 (1 Kb/s)
        Latency: 168 msec (75-174 msec ~169 msec)
> ACL Data RX: Handle 147 flags 0x02 dlen 21               #104 [hci1] 9.960280
      SMP: Pairing Confirm (0x03) len 16
        Confim value: ac831e01fe8b702755543e03278c5785
< HCI Command: Host Number of Comp.. (0x03|0x0035) plen 5  #105 [hci1] 9.963780
        Num handles: 1
        Handle: 147 Address: DF:A9:FF:F6:B1:1A (OUI DF-A9-FF)
        Count: 1
< ACL Data TX: Handle 147 flags 0x00 dlen 21               #106 [hci1] 9.963987
      SMP: Pairing Confirm (0x03) len 16
        Confim value: 5a791ab0c571bd7d207e7e3907b86f12
> HCI Event: Number of Completed Packets (0x13) plen 5    #107 [hci1] 10.135140
        Num handles: 1
        Handle: 147 Address: DF:A9:FF:F6:B1:1A (OUI DF-A9-FF)
        Count: 1
        #106: len 21 (0 Kb/s)
        Latency: 171 msec (75-174 msec ~170 msec)
> ACL Data RX: Handle 147 flags 0x02 dlen 21              #108 [hci1] 10.135463
      SMP: Pairing Random (0x04) len 16
        Random value: 44cbf8a4d8f209110000000000000000
< HCI Command: Host Number of Com.. (0x03|0x0035) plen 5  #109 [hci1] 10.143938
        Num handles: 1
        Handle: 147 Address: DF:A9:FF:F6:B1:1A (OUI DF-A9-FF)
        Count: 1
< ACL Data TX: Handle 147 flags 0x00 dlen 21              #110 [hci1] 10.144058
      SMP: Pairing Random (0x04) len 16
        Random value: 32527e6e64e79f33b2e374394db8ab2d
> HCI Event: Number of Completed Packets (0x13) plen 5    #111 [hci1] 10.309965
        Num handles: 1
        Handle: 147 Address: DF:A9:FF:F6:B1:1A (OUI DF-A9-FF)
        Count: 1
        #110: len 21 (1 Kb/s)
        Latency: 165 msec (75-174 msec ~168 msec)
> ACL Data RX: Handle 147 flags 0x02 dlen 21              #112 [hci1] 10.397911
      SMP: Pairing Confirm (0x03) len 16
        Confim value: f6153f3c8b153838a264c9724ed29efc
< HCI Command: Host Number of Com.. (0x03|0x0035) plen 5  #113 [hci1] 10.403728
        Num handles: 1
        Handle: 147 Address: DF:A9:FF:F6:B1:1A (OUI DF-A9-FF)
        Count: 1
< ACL Data TX: Handle 147 flags 0x00 dlen 21              #114 [hci1] 10.403945
      SMP: Pairing Confirm (0x03) len 16
        Confim value: 7a188356bb0de4fa3217238e56b97b95
> HCI Event: Number of Completed Packets (0x13) plen 5    #115 [hci1] 10.572691
        Num handles: 1
        Handle: 147 Address: DF:A9:FF:F6:B1:1A (OUI DF-A9-FF)
        Count: 1
        #114: len 21 (1 Kb/s)
        Latency: 168 msec (75-174 msec ~168 msec)
> ACL Data RX: Handle 147 flags 0x02 dlen 21              #116 [hci1] 10.572981
      SMP: Pairing Random (0x04) len 16
        Random value: 2c62e135ca4720db0000000000000000
< HCI Command: Host Number of Com.. (0x03|0x0035) plen 5  #117 [hci1] 10.583597
        Num handles: 1
        Handle: 147 Address: DF:A9:FF:F6:B1:1A (OUI DF-A9-FF)
        Count: 1
< ACL Data TX: Handle 147 flags 0x00 dlen 21              #118 [hci1] 10.583711
      SMP: Pairing Random (0x04) len 16
        Random value: dddbdfe2838e9a8cc6964353c850fef7
> HCI Event: Number of Completed Packets (0x13) plen 5    #119 [hci1] 10.747528
        Num handles: 1
        Handle: 147 Address: DF:A9:FF:F6:B1:1A (OUI DF-A9-FF)
        Count: 1
        #118: len 21 (1 Kb/s)
        Latency: 163 msec (75-174 msec ~166 msec)
> ACL Data RX: Handle 147 flags 0x02 dlen 21              #120 [hci1] 10.835249
      SMP: Pairing Confirm (0x03) len 16
        Confim value: 3f22ff22ef87a9a57a5dba5736e868f5
< HCI Command: Host Number of Com.. (0x03|0x0035) plen 5  #121 [hci1] 10.843727
        Num handles: 1
        Handle: 147 Address: DF:A9:FF:F6:B1:1A (OUI DF-A9-FF)
        Count: 1
< ACL Data TX: Handle 147 flags 0x00 dlen 21              #122 [hci1] 10.843966
      SMP: Pairing Confirm (0x03) len 16
        Confim value: b1e8db864fa59ef5c204762abd7023a6
> HCI Event: Number of Completed Packets (0x13) plen 5    #123 [hci1] 11.010365
        Num handles: 1
        Handle: 147 Address: DF:A9:FF:F6:B1:1A (OUI DF-A9-FF)
        Count: 1
        #122: len 21 (1 Kb/s)
        Latency: 166 msec (75-174 msec ~166 msec)
> ACL Data RX: Handle 147 flags 0x02 dlen 21              #124 [hci1] 11.010576
      SMP: Pairing Random (0x04) len 16
        Random value: d150b184879ea82d0000000000000000
< HCI Command: Host Number of Com.. (0x03|0x0035) plen 5  #125 [hci1] 11.023926
        Num handles: 1
        Handle: 147 Address: DF:A9:FF:F6:B1:1A (OUI DF-A9-FF)
        Count: 1
< ACL Data TX: Handle 147 flags 0x00 dlen 21              #126 [hci1] 11.024098
      SMP: Pairing Random (0x04) len 16
        Random value: eb9f1915536596b6fc3db1c86b2b1970
> HCI Event: Number of Completed Packets (0x13) plen 5    #127 [hci1] 11.184845
        Num handles: 1
        Handle: 147 Address: DF:A9:FF:F6:B1:1A (OUI DF-A9-FF)
        Count: 1
        #126: len 21 (1 Kb/s)
        Latency: 160 msec (75-174 msec ~163 msec)
> ACL Data RX: Handle 147 flags 0x02 dlen 21              #128 [hci1] 11.272728
      SMP: Pairing Confirm (0x03) len 16
        Confim value: 8310175738eb142da94c373dc884ac11
< HCI Command: Host Number of Com.. (0x03|0x0035) plen 5  #129 [hci1] 11.283769
        Num handles: 1
        Handle: 147 Address: DF:A9:FF:F6:B1:1A (OUI DF-A9-FF)
        Count: 1
< ACL Data TX: Handle 147 flags 0x00 dlen 21              #130 [hci1] 11.283961
      SMP: Pairing Confirm (0x03) len 16
        Confim value: 9a345833ffde9be133f4f504755cc76a
> HCI Event: Number of Completed Packets (0x13) plen 5    #131 [hci1] 11.447754
        Num handles: 1
        Handle: 147 Address: DF:A9:FF:F6:B1:1A (OUI DF-A9-FF)
        Count: 1
        #130: len 21 (1 Kb/s)
        Latency: 163 msec (75-174 msec ~163 msec)
> ACL Data RX: Handle 147 flags 0x02 dlen 21              #132 [hci1] 11.448062
      SMP: Pairing Random (0x04) len 16
        Random value: 619a1ca91b3c76000000000000000000
< HCI Command: Host Number of Com.. (0x03|0x0035) plen 5  #133 [hci1] 11.463908
        Num handles: 1
        Handle: 147 Address: DF:A9:FF:F6:B1:1A (OUI DF-A9-FF)
        Count: 1
< ACL Data TX: Handle 147 flags 0x00 dlen 21              #134 [hci1] 11.463993
      SMP: Pairing Random (0x04) len 16
        Random value: 5c794dc9ad9f2c3f295ebd5ad5e1c3cf
> HCI Event: Number of Completed Packets (0x13) plen 5    #135 [hci1] 11.622534
        Num handles: 1
        Handle: 147 Address: DF:A9:FF:F6:B1:1A (OUI DF-A9-FF)
        Count: 1
        #134: len 21 (1 Kb/s)
        Latency: 158 msec (75-174 msec ~161 msec)
> ACL Data RX: Handle 147 flags 0x02 dlen 21              #136 [hci1] 11.710263
      SMP: Pairing Confirm (0x03) len 16
        Confim value: 974c224f2916dfdcad10658b26e2f66e
< HCI Command: Host Number of Com.. (0x03|0x0035) plen 5  #137 [hci1] 11.723763
        Num handles: 1
        Handle: 147 Address: DF:A9:FF:F6:B1:1A (OUI DF-A9-FF)
        Count: 1
< ACL Data TX: Handle 147 flags 0x00 dlen 21              #138 [hci1] 11.723966
      SMP: Pairing Confirm (0x03) len 16
        Confim value: a9be165a91544a987dc9cb7cd4e31d81
> HCI Event: Number of Completed Packets (0x13) plen 5    #139 [hci1] 11.885100
        Num handles: 1
        Handle: 147 Address: DF:A9:FF:F6:B1:1A (OUI DF-A9-FF)
        Count: 1
        #138: len 21 (1 Kb/s)
        Latency: 161 msec (75-174 msec ~161 msec)
> ACL Data RX: Handle 147 flags 0x02 dlen 21              #140 [hci1] 11.885427
      SMP: Pairing Random (0x04) len 16
        Random value: 1af03f73e62d9d450000000000000000
< HCI Command: Host Number of Com.. (0x03|0x0035) plen 5  #141 [hci1] 11.903993
        Num handles: 1
        Handle: 147 Address: DF:A9:FF:F6:B1:1A (OUI DF-A9-FF)
        Count: 1
< ACL Data TX: Handle 147 flags 0x00 dlen 21              #142 [hci1] 11.904156
      SMP: Pairing Random (0x04) len 16
        Random value: 5c2fff312cdf99c9491988e877355a9a
> HCI Event: Number of Completed Packets (0x13) plen 5    #143 [hci1] 12.060033
        Num handles: 1
        Handle: 147 Address: DF:A9:FF:F6:B1:1A (OUI DF-A9-FF)
        Count: 1
        #142: len 21 (1 Kb/s)
        Latency: 155 msec (75-174 msec ~158 msec)
> ACL Data RX: Handle 147 flags 0x02 dlen 21              #144 [hci1] 12.147710
      SMP: Pairing Confirm (0x03) len 16
        Confim value: f79ce0eb4e574216930dc1d8d9e1c230
< HCI Command: Host Number of Com.. (0x03|0x0035) plen 5  #145 [hci1] 12.163679
        Num handles: 1
        Handle: 147 Address: DF:A9:FF:F6:B1:1A (OUI DF-A9-FF)
        Count: 1
< ACL Data TX: Handle 147 flags 0x00 dlen 21              #146 [hci1] 12.163911
      SMP: Pairing Confirm (0x03) len 16
        Confim value: 58698ef0f14bac540b08f14d4f31099b
> HCI Event: Number of Completed Packets (0x13) plen 5    #147 [hci1] 12.322629
        Num handles: 1
        Handle: 147 Address: DF:A9:FF:F6:B1:1A (OUI DF-A9-FF)
        Count: 1
        #146: len 21 (1 Kb/s)
        Latency: 158 msec (75-174 msec ~158 msec)
> ACL Data RX: Handle 147 flags 0x02 dlen 21              #148 [hci1] 12.322935
      SMP: Pairing Random (0x04) len 16
        Random value: 767f77228528bb4f0000000000000000
< HCI Command: Host Number of Com.. (0x03|0x0035) plen 5  #149 [hci1] 12.323804
        Num handles: 1
        Handle: 147 Address: DF:A9:FF:F6:B1:1A (OUI DF-A9-FF)
        Count: 1
< ACL Data TX: Handle 147 flags 0x00 dlen 21              #150 [hci1] 12.323826
      SMP: Pairing Random (0x04) len 16
        Random value: c629a3a987d808e808655d558dfc1155
> HCI Event: Number of Completed Packets (0x13) plen 5    #151 [hci1] 12.497463
        Num handles: 1
        Handle: 147 Address: DF:A9:FF:F6:B1:1A (OUI DF-A9-FF)
        Count: 1
        #150: len 21 (0 Kb/s)
        Latency: 173 msec (75-174 msec ~166 msec)
> ACL Data RX: Handle 147 flags 0x02 dlen 21              #152 [hci1] 12.585286
      SMP: Pairing Confirm (0x03) len 16
        Confim value: aafa8d141d30f797166c48d4a8cb8b43
< HCI Command: Host Number of Com.. (0x03|0x0035) plen 5  #153 [hci1] 12.603621
        Num handles: 1
        Handle: 147 Address: DF:A9:FF:F6:B1:1A (OUI DF-A9-FF)
        Count: 1
< ACL Data TX: Handle 147 flags 0x00 dlen 21              #154 [hci1] 12.603804
      SMP: Pairing Confirm (0x03) len 16
        Confim value: bf0584975fab86d6a15f3d5e0ab1d5d4
> HCI Event: Number of Completed Packets (0x13) plen 5    #155 [hci1] 12.760070
        Num handles: 1
        Handle: 147 Address: DF:A9:FF:F6:B1:1A (OUI DF-A9-FF)
        Count: 1
        #154: len 21 (1 Kb/s)
        Latency: 156 msec (75-174 msec ~161 msec)
> ACL Data RX: Handle 147 flags 0x02 dlen 21              #156 [hci1] 12.760406
      SMP: Pairing Random (0x04) len 16
        Random value: 19907759296d144d0000000000000000
< HCI Command: Host Number of Com.. (0x03|0x0035) plen 5  #157 [hci1] 12.763989
        Num handles: 1
        Handle: 147 Address: DF:A9:FF:F6:B1:1A (OUI DF-A9-FF)
        Count: 1
< ACL Data TX: Handle 147 flags 0x00 dlen 21              #158 [hci1] 12.764067
      SMP: Pairing Random (0x04) len 16
        Random value: 92f20f6ad8f13724432c7fd6001c45ff
> HCI Event: Number of Completed Packets (0x13) plen 5    #159 [hci1] 12.934841
        Num handles: 1
        Handle: 147 Address: DF:A9:FF:F6:B1:1A (OUI DF-A9-FF)
        Count: 1
        #158: len 21 (0 Kb/s)
        Latency: 170 msec (75-174 msec ~165 msec)
> ACL Data RX: Handle 147 flags 0x02 dlen 21              #160 [hci1] 13.022695
      SMP: Pairing Confirm (0x03) len 16
        Confim value: c7c70214defd80e7ed041a3f0637c65a
< HCI Command: Host Number of Com.. (0x03|0x0035) plen 5  #161 [hci1] 13.023566
        Num handles: 1
        Handle: 147 Address: DF:A9:FF:F6:B1:1A (OUI DF-A9-FF)
        Count: 1
< ACL Data TX: Handle 147 flags 0x00 dlen 21              #162 [hci1] 13.023705
      SMP: Pairing Confirm (0x03) len 16
        Confim value: 30d896aea2ac4a0399884760ce1d36e8
> HCI Event: Number of Completed Packets (0x13) plen 5    #163 [hci1] 13.197514
        Num handles: 1
        Handle: 147 Address: DF:A9:FF:F6:B1:1A (OUI DF-A9-FF)
        Count: 1
        #162: len 21 (0 Kb/s)
        Latency: 173 msec (75-174 msec ~169 msec)
> ACL Data RX: Handle 147 flags 0x02 dlen 21              #164 [hci1] 13.197914
      SMP: Pairing Random (0x04) len 16
        Random value: a2eb1f9036d8e6b50000000000000000
< HCI Command: Host Number of Com.. (0x03|0x0035) plen 5  #165 [hci1] 13.203809
        Num handles: 1
        Handle: 147 Address: DF:A9:FF:F6:B1:1A (OUI DF-A9-FF)
        Count: 1
< ACL Data TX: Handle 147 flags 0x00 dlen 21              #166 [hci1] 13.203834
      SMP: Pairing Random (0x04) len 16
        Random value: 23ac32ebbb5e14c8a6b9622f296d277f
> HCI Event: Number of Completed Packets (0x13) plen 5    #167 [hci1] 13.372351
        Num handles: 1
        Handle: 147 Address: DF:A9:FF:F6:B1:1A (OUI DF-A9-FF)
        Count: 1
        #166: len 21 (1 Kb/s)
        Latency: 168 msec (75-174 msec ~169 msec)
> ACL Data RX: Handle 147 flags 0x02 dlen 21              #168 [hci1] 13.460179
      SMP: Pairing Confirm (0x03) len 16
        Confim value: 5af4e1722d148dd127ad039f761f9be9
< HCI Command: Host Number of Com.. (0x03|0x0035) plen 5  #169 [hci1] 13.463761
        Num handles: 1
        Handle: 147 Address: DF:A9:FF:F6:B1:1A (OUI DF-A9-FF)
        Count: 1
< ACL Data TX: Handle 147 flags 0x00 dlen 21              #170 [hci1] 13.463933
      SMP: Pairing Confirm (0x03) len 16
        Confim value: 9641b0fd43d726f6774fa2ed0a7c869d
> HCI Event: Number of Completed Packets (0x13) plen 5    #171 [hci1] 13.635093
        Num handles: 1
        Handle: 147 Address: DF:A9:FF:F6:B1:1A (OUI DF-A9-FF)
        Count: 1
        #170: len 21 (0 Kb/s)
        Latency: 171 msec (75-174 msec ~170 msec)
> ACL Data RX: Handle 147 flags 0x02 dlen 21              #172 [hci1] 13.635385
      SMP: Pairing Random (0x04) len 16
        Random value: 9f2a2b34e7d677450000000000000000
< HCI Command: Host Number of Com.. (0x03|0x0035) plen 5  #173 [hci1] 13.643889
        Num handles: 1
        Handle: 147 Address: DF:A9:FF:F6:B1:1A (OUI DF-A9-FF)
        Count: 1
< ACL Data TX: Handle 147 flags 0x00 dlen 21              #174 [hci1] 13.643989
      SMP: Pairing Random (0x04) len 16
        Random value: 297efe85e67448a15f56bd27e3a3cf1d
> HCI Event: Number of Completed Packets (0x13) plen 5    #175 [hci1] 13.809795
        Num handles: 1
        Handle: 147 Address: DF:A9:FF:F6:B1:1A (OUI DF-A9-FF)
        Count: 1
        #174: len 21 (1 Kb/s)
        Latency: 165 msec (75-174 msec ~167 msec)
> ACL Data RX: Handle 147 flags 0x02 dlen 21              #176 [hci1] 13.897716
      SMP: Pairing Confirm (0x03) len 16
        Confim value: c5a02ea774755788779ae4a7423d8d97
< HCI Command: Host Number of Com.. (0x03|0x0035) plen 5  #177 [hci1] 13.903563
        Num handles: 1
        Handle: 147 Address: DF:A9:FF:F6:B1:1A (OUI DF-A9-FF)
        Count: 1
< ACL Data TX: Handle 147 flags 0x00 dlen 21              #178 [hci1] 13.903698
      SMP: Pairing Confirm (0x03) len 16
        Confim value: 5517e68ad685a50b9d637d69368649bc
> HCI Event: Number of Completed Packets (0x13) plen 5    #179 [hci1] 14.072490
        Num handles: 1
        Handle: 147 Address: DF:A9:FF:F6:B1:1A (OUI DF-A9-FF)
        Count: 1
        #178: len 21 (1 Kb/s)
        Latency: 168 msec (75-174 msec ~168 msec)
> ACL Data RX: Handle 147 flags 0x02 dlen 21              #180 [hci1] 14.072853
      SMP: Pairing Random (0x04) len 16
        Random value: f9f159caecef1e140000000000000000
< HCI Command: Host Number of Com.. (0x03|0x0035) plen 5  #181 [hci1] 14.083992
        Num handles: 1
        Handle: 147 Address: DF:A9:FF:F6:B1:1A (OUI DF-A9-FF)
        Count: 1
< ACL Data TX: Handle 147 flags 0x00 dlen 21              #182 [hci1] 14.084085
      SMP: Pairing Random (0x04) len 16
        Random value: 25a9493fd3ce4faf02be7293595bb7c6
> HCI Event: Number of Completed Packets (0x13) plen 5    #183 [hci1] 14.247250
        Num handles: 1
        Handle: 147 Address: DF:A9:FF:F6:B1:1A (OUI DF-A9-FF)
        Count: 1
        #182: len 21 (1 Kb/s)
        Latency: 163 msec (75-174 msec ~165 msec)
> ACL Data RX: Handle 147 flags 0x02 dlen 21              #184 [hci1] 14.335155
      SMP: Pairing Confirm (0x03) len 16
        Confim value: 8506f9d4229490ac8c5247c81d97b348
< HCI Command: Host Number of Com.. (0x03|0x0035) plen 5  #185 [hci1] 14.343826
        Num handles: 1
        Handle: 147 Address: DF:A9:FF:F6:B1:1A (OUI DF-A9-FF)
        Count: 1
< ACL Data TX: Handle 147 flags 0x00 dlen 21              #186 [hci1] 14.344036
      SMP: Pairing Confirm (0x03) len 16
        Confim value: 0ab733c7bf11a10d1d9692b95a3712c9
> HCI Event: Number of Completed Packets (0x13) plen 5    #187 [hci1] 14.509960
        Num handles: 1
        Handle: 147 Address: DF:A9:FF:F6:B1:1A (OUI DF-A9-FF)
        Count: 1
        #186: len 21 (1 Kb/s)
        Latency: 165 msec (75-174 msec ~165 msec)
> ACL Data RX: Handle 147 flags 0x02 dlen 21              #188 [hci1] 14.510455
      SMP: Pairing Random (0x04) len 16
        Random value: 84e6320c772a6f100000000000000000
< HCI Command: Host Number of Com.. (0x03|0x0035) plen 5  #189 [hci1] 14.524057
        Num handles: 1
        Handle: 147 Address: DF:A9:FF:F6:B1:1A (OUI DF-A9-FF)
        Count: 1
< ACL Data TX: Handle 147 flags 0x00 dlen 21              #190 [hci1] 14.524143
      SMP: Pairing Random (0x04) len 16
        Random value: 58f6b41f855a6f6c3560debd84e2affc
> HCI Event: Number of Completed Packets (0x13) plen 5    #191 [hci1] 14.684771
        Num handles: 1
        Handle: 147 Address: DF:A9:FF:F6:B1:1A (OUI DF-A9-FF)
        Count: 1
        #190: len 21 (1 Kb/s)
        Latency: 160 msec (75-174 msec ~163 msec)
> ACL Data RX: Handle 147 flags 0x02 dlen 21              #192 [hci1] 14.772640
      SMP: Pairing Confirm (0x03) len 16
        Confim value: e73d188f2dec8e0a92b605c6e5492fea
< HCI Command: Host Number of Com.. (0x03|0x0035) plen 5  #193 [hci1] 14.783748
        Num handles: 1
        Handle: 147 Address: DF:A9:FF:F6:B1:1A (OUI DF-A9-FF)
        Count: 1
< ACL Data TX: Handle 147 flags 0x00 dlen 21              #194 [hci1] 14.783940
      SMP: Pairing Confirm (0x03) len 16
        Confim value: ea07c989a50bbcc04b4be95d06c5bc9d
> HCI Event: Number of Completed Packets (0x13) plen 5    #195 [hci1] 14.947533
        Num handles: 1
        Handle: 147 Address: DF:A9:FF:F6:B1:1A (OUI DF-A9-FF)
        Count: 1
        #194: len 21 (1 Kb/s)
        Latency: 163 msec (75-174 msec ~163 msec)
> ACL Data RX: Handle 147 flags 0x02 dlen 21              #196 [hci1] 14.947895
      SMP: Pairing Random (0x04) len 16
        Random value: 9ddfb3abf5fc93850000000000000000
< HCI Command: Host Number of Com.. (0x03|0x0035) plen 5  #197 [hci1] 14.963664
        Num handles: 1
        Handle: 147 Address: DF:A9:FF:F6:B1:1A (OUI DF-A9-FF)
        Count: 1
< ACL Data TX: Handle 147 flags 0x00 dlen 21              #198 [hci1] 14.963729
      SMP: Pairing Random (0x04) len 16
        Random value: b67e7216d5bf664139eda2b542549666
> HCI Event: Number of Completed Packets (0x13) plen 5    #199 [hci1] 15.122236
        Num handles: 1
        Handle: 147 Address: DF:A9:FF:F6:B1:1A (OUI DF-A9-FF)
        Count: 1
        #198: len 21 (1 Kb/s)
        Latency: 158 msec (75-174 msec ~160 msec)
> ACL Data RX: Handle 147 flags 0x02 dlen 21              #200 [hci1] 15.210067
      SMP: Pairing Confirm (0x03) len 16
        Confim value: 2cb3600ddc746fd53490d412b729b4d1
< HCI Command: Host Number of Com.. (0x03|0x0035) plen 5  #201 [hci1] 15.223381
        Num handles: 1
        Handle: 147 Address: DF:A9:FF:F6:B1:1A (OUI DF-A9-FF)
        Count: 1
< ACL Data TX: Handle 147 flags 0x00 dlen 21              #202 [hci1] 15.223515
      SMP: Pairing Confirm (0x03) len 16
        Confim value: b65bb113c6db9ba55e38081219f37f4e
> HCI Event: Number of Completed Packets (0x13) plen 5    #203 [hci1] 15.384973
        Num handles: 1
        Handle: 147 Address: DF:A9:FF:F6:B1:1A (OUI DF-A9-FF)
        Count: 1
        #202: len 21 (1 Kb/s)
        Latency: 161 msec (75-174 msec ~161 msec)
> ACL Data RX: Handle 147 flags 0x02 dlen 21              #204 [hci1] 15.385417
      SMP: Pairing Random (0x04) len 16
        Random value: c79beb78f75a17210000000000000000
< HCI Command: Host Number of Com.. (0x03|0x0035) plen 5  #205 [hci1] 15.403965
        Num handles: 1
        Handle: 147 Address: DF:A9:FF:F6:B1:1A (OUI DF-A9-FF)
        Count: 1
< ACL Data TX: Handle 147 flags 0x00 dlen 21              #206 [hci1] 15.404075
      SMP: Pairing Random (0x04) len 16
        Random value: ed17f76500c95219dd01e09d1e63f87b
> HCI Event: Number of Completed Packets (0x13) plen 5    #207 [hci1] 15.559787
        Num handles: 1
        Handle: 147 Address: DF:A9:FF:F6:B1:1A (OUI DF-A9-FF)
        Count: 1
        #206: len 21 (1 Kb/s)
        Latency: 155 msec (75-174 msec ~158 msec)
> ACL Data RX: Handle 147 flags 0x02 dlen 21              #208 [hci1] 15.647579
      SMP: Pairing Confirm (0x03) len 16
        Confim value: 687a0da0417fd6ac9df2b537c5eac264
< HCI Command: Host Number of Com.. (0x03|0x0035) plen 5  #209 [hci1] 15.663804
        Num handles: 1
        Handle: 147 Address: DF:A9:FF:F6:B1:1A (OUI DF-A9-FF)
        Count: 1
< ACL Data TX: Handle 147 flags 0x00 dlen 21              #210 [hci1] 15.664033
      SMP: Pairing Confirm (0x03) len 16
        Confim value: 1632bb695b7f31a0ed44c8da709df2d5
> HCI Event: Number of Completed Packets (0x13) plen 5    #211 [hci1] 15.822491
        Num handles: 1
        Handle: 147 Address: DF:A9:FF:F6:B1:1A (OUI DF-A9-FF)
        Count: 1
        #210: len 21 (1 Kb/s)
        Latency: 158 msec (75-174 msec ~158 msec)
> ACL Data RX: Handle 147 flags 0x02 dlen 21              #212 [hci1] 15.822818
      SMP: Pairing Random (0x04) len 16
        Random value: 82c55511650ecdc70000000000000000
< HCI Command: Host Number of Com.. (0x03|0x0035) plen 5  #213 [hci1] 15.823838
        Num handles: 1
        Handle: 147 Address: DF:A9:FF:F6:B1:1A (OUI DF-A9-FF)
        Count: 1
< ACL Data TX: Handle 147 flags 0x00 dlen 21              #214 [hci1] 15.823987
      SMP: Pairing Random (0x04) len 16
        Random value: 81d35d47e1f6006d79c974bd9d9e1ee3
> HCI Event: Number of Completed Packets (0x13) plen 5    #215 [hci1] 15.997218
        Num handles: 1
        Handle: 147 Address: DF:A9:FF:F6:B1:1A (OUI DF-A9-FF)
        Count: 1
        #214: len 21 (0 Kb/s)
        Latency: 173 msec (75-174 msec ~165 msec)
> ACL Data RX: Handle 147 flags 0x02 dlen 21              #216 [hci1] 16.085096
      SMP: Pairing Confirm (0x03) len 16
        Confim value: 9ec2f0c08f022a1681bd13e3b4449913
< HCI Command: Host Number of Com.. (0x03|0x0035) plen 5  #217 [hci1] 16.103894
        Num handles: 1
        Handle: 147 Address: DF:A9:FF:F6:B1:1A (OUI DF-A9-FF)
        Count: 1
< ACL Data TX: Handle 147 flags 0x00 dlen 21              #218 [hci1] 16.104089
      SMP: Pairing Confirm (0x03) len 16
        Confim value: 55569ff6b61106963b8b055ad9e425ba
> HCI Event: Number of Completed Packets (0x13) plen 5    #219 [hci1] 16.259983
        Num handles: 1
        Handle: 147 Address: DF:A9:FF:F6:B1:1A (OUI DF-A9-FF)
        Count: 1
        #218: len 21 (1 Kb/s)
        Latency: 155 msec (75-174 msec ~160 msec)
> ACL Data RX: Handle 147 flags 0x02 dlen 21              #220 [hci1] 16.260369
      SMP: Pairing Random (0x04) len 16
        Random value: 39367f5f4787c6090000000000000000
< HCI Command: Host Number of Com.. (0x03|0x0035) plen 5  #221 [hci1] 16.263912
        Num handles: 1
        Handle: 147 Address: DF:A9:FF:F6:B1:1A (OUI DF-A9-FF)
        Count: 1
< ACL Data TX: Handle 147 flags 0x00 dlen 21              #222 [hci1] 16.264095
      SMP: Pairing Random (0x04) len 16
        Random value: e7f7e0c2476823e41736a7e381bafb7c
> HCI Event: Number of Completed Packets (0x13) plen 5    #223 [hci1] 16.434755
        Num handles: 1
        Handle: 147 Address: DF:A9:FF:F6:B1:1A (OUI DF-A9-FF)
        Count: 1
        #222: len 21 (0 Kb/s)
        Latency: 170 msec (75-174 msec ~165 msec)
> ACL Data RX: Handle 147 flags 0x02 dlen 21              #224 [hci1] 16.522565
      SMP: Pairing Confirm (0x03) len 16
        Confim value: 3794a4a5ed0df707a807f31d17dd3bce
< HCI Command: Host Number of Com.. (0x03|0x0035) plen 5  #225 [hci1] 16.523548
        Num handles: 1
        Handle: 147 Address: DF:A9:FF:F6:B1:1A (OUI DF-A9-FF)
        Count: 1
< ACL Data TX: Handle 147 flags 0x00 dlen 21              #226 [hci1] 16.523698
      SMP: Pairing Confirm (0x03) len 16
        Confim value: 650c0050882c953f667a30a388b68275
> HCI Event: Number of Completed Packets (0x13) plen 5    #227 [hci1] 16.697432
        Num handles: 1
        Handle: 147 Address: DF:A9:FF:F6:B1:1A (OUI DF-A9-FF)
        Count: 1
        #226: len 21 (0 Kb/s)
        Latency: 173 msec (75-174 msec ~169 msec)
> ACL Data RX: Handle 147 flags 0x02 dlen 21              #228 [hci1] 16.697831
      SMP: Pairing Random (0x04) len 16
        Random value: 0dd873b921e1a61e0000000000000000
< HCI Command: Host Number of Com.. (0x03|0x0035) plen 5  #229 [hci1] 16.703847
        Num handles: 1
        Handle: 147 Address: DF:A9:FF:F6:B1:1A (OUI DF-A9-FF)
        Count: 1
