Bluetooth monitor ver 5.72
= Note: Linux version 6.14.0-36-generic (x86_64)                       0.656226
= Note: Bluetooth subsystem version 2.22                               0.656229
= New Index: 00:00:00:00:00:00 (Primary,UART,hci1)              [hci1] 0.656230
= New Index: 48:5F:99:8E:E0:64 (Primary,USB,hci0)               [hci0] 0.656231
= Open Index: 00:00:00:00:00:00                                 [hci1] 0.772511
= Index Info: 00:00:00:00:00:00 (Nordic Semiconductor ASA)      [hci1] 0.772527
@ USER Open: main (privileged) version 2.22            {0x0001} [hci1] 0.772536
< HCI Command: Reset (0x03|0x0003) plen 0                    #1 [hci1] 0.773897
> HCI Event: Command Complete (0x0e) plen 4                  #2 [hci1] 0.774464
      Reset (0x03|0x0003) ncmd 1
        Status: Success (0x00)
< HCI Command: Read Local Supported... (0x04|0x0003) plen 0  #3 [hci1] 0.792329
> HCI Event: Command Complete (0x0e) plen 12                 #4 [hci1] 0.792847
      Read Local Supported Features (0x04|0x0003) ncmd 1
        Status: Success (0x00)
        Features: 0x00 0x00 0x00 0x00 0x60 0x00 0x00 0x00
          BR/EDR Not Supported
          LE Supported (Controller)
< HCI Command: Read Local Version In.. (0x04|0x0001) plen 0  #5 [hci1] 0.811977
> HCI Event: Command Complete (0x0e) plen 12                 #6 [hci1] 0.812442
      Read Local Version Information (0x04|0x0001) ncmd 1
        Status: Success (0x00)
        HCI version: Reserved (0x0f) - Revision 12393 (0x3069)
        LMP version: Reserved (0x0f) - Subversion 12393 (0x3069)
        Manufacturer: Nordic Semiconductor ASA (89)
< HCI Command: Read Local Supported... (0x04|0x0002) plen 0  #7 [hci1] 0.831877
> HCI Event: Command Complete (0x0e) plen 68                 #8 [hci1] 0.832911
      Read Local Supported Commands (0x04|0x0002) ncmd 1
        Status: Success (0x00)
        Commands: 119 entries
          Disconnect (Octet 0 - Bit 5)
          Read Remote Version Information (Octet 2 - Bit 7)
          Set Event Mask (Octet 5 - Bit 6)
          Reset (Octet 5 - Bit 7)
          Read Connection Accept Timeout (Octet 7 - Bit 2)
          Write Connection Accept Timeout (Octet 7 - Bit 3)
          Read Transmit Power Level (Octet 10 - Bit 2)
          Set Controller To Host Flow Control (Octet 10 - Bit 5)
          Host Buffer Size (Octet 10 - Bit 6)
          Host Number of Completed Packets (Octet 10 - Bit 7)
          Read Local Version Information (Octet 14 - Bit 3)
          Read Local Supported Features (Octet 14 - Bit 5)
          Read BD ADDR (Octet 15 - Bit 1)
          Read RSSI (Octet 15 - Bit 5)
          Set Event Mask Page 2 (Octet 22 - Bit 2)
          LE Set Event Mask (Octet 25 - Bit 0)
          LE Read Buffer Size (Octet 25 - Bit 1)
          LE Read Local Supported Features (Octet 25 - Bit 2)
          LE Set Random Address (Octet 25 - Bit 4)
          LE Set Advertising Parameters (Octet 25 - Bit 5)
          LE Read Advertising Channel TX Power (Octet 25 - Bit 6)
          LE Set Advertising Data (Octet 25 - Bit 7)
          LE Set Scan Response Data (Octet 26 - Bit 0)
          LE Set Advertise Enable (Octet 26 - Bit 1)
          LE Set Scan Parameters (Octet 26 - Bit 2)
          LE Set Scan Enable (Octet 26 - Bit 3)
          LE Create Connection (Octet 26 - Bit 4)
          LE Create Connection Cancel (Octet 26 - Bit 5)
          LE Read Accept List Size (Octet 26 - Bit 6)
          LE Clear Accept List (Octet 26 - Bit 7)
          LE Add Device To Accept List (Octet 27 - Bit 0)
          LE Remove Device From Accept List (Octet 27 - Bit 1)
          LE Connection Update (Octet 27 - Bit 2)
          LE Set Host Channel Classification (Octet 27 - Bit 3)
          LE Read Channel Map (Octet 27 - Bit 4)
          LE Read Remote Used Features (Octet 27 - Bit 5)
          LE Encrypt (Octet 27 - Bit 6)
          LE Rand (Octet 27 - Bit 7)
          LE Start Encryption (Octet 28 - Bit 0)
          LE Long Term Key Request Reply (Octet 28 - Bit 1)
          LE Long Term Key Request Neg Reply (Octet 28 - Bit 2)
          LE Read Supported States (Octet 28 - Bit 3)
          LE Receiver Test (Octet 28 - Bit 4)
          LE Transmitter Test (Octet 28 - Bit 5)
          LE Test End (Octet 28 - Bit 6)
          Read Authenticated Payload Timeout (Octet 32 - Bit 4)
          Write Authenticated Payload Timeout (Octet 32 - Bit 5)
          LE Set Data Length (Octet 33 - Bit 6)
          LE Read Suggested Default Data Length (Octet 33 - Bit 7)
          LE Write Suggested Default Data Length (Octet 34 - Bit 0)
          LE Add Device To Resolving List (Octet 34 - Bit 3)
          LE Remove Device From Resolving List (Octet 34 - Bit 4)
          LE Clear Resolving List (Octet 34 - Bit 5)
          LE Read Resolving List Size (Octet 34 - Bit 6)
          LE Set Address Resolution Enable (Octet 35 - Bit 1)
          LE Set Resolvable Private Address Timeout (Octet 35 - Bit 2)
          LE Read Maximum Data Length (Octet 35 - Bit 3)
          LE Read PHY (Octet 35 - Bit 4)
          LE Set Default PHY (Octet 35 - Bit 5)
          LE Set PHY (Octet 35 - Bit 6)
          LE Enhanced Receiver Test (Octet 35 - Bit 7)
          LE Enhanced Transmitter Test (Octet 36 - Bit 0)
          LE Set Advertising Set Random Address (Octet 36 - Bit 1)
          LE Set Extended Advertising Parameters (Octet 36 - Bit 2)
          LE Set Extended Advertising Data (Octet 36 - Bit 3)
          LE Set Extended Scan Response Data (Octet 36 - Bit 4)
          LE Set Extended Advertising Enable (Octet 36 - Bit 5)
          LE Read Maximum Advertising Data Length (Octet 36 - Bit 6)
          LE Read Number of Supported Advertising Sets (Octet 36 - Bit 7)
          LE Remove Advertising Set (Octet 37 - Bit 0)
          LE Clear Advertising Sets (Octet 37 - Bit 1)
          LE Set Periodic Advertising Parameters (Octet 37 - Bit 2)
          LE Set Periodic Advertising Data (Octet 37 - Bit 3)
          LE Set Periodic Advertising Enable (Octet 37 - Bit 4)
          LE Set Extended Scan Parameters (Octet 37 - Bit 5)
          LE Set Extended Scan Enable (Octet 37 - Bit 6)
          LE Extended Create Connection (Octet 37 - Bit 7)
          LE Periodic Advertising Create Sync (Octet 38 - Bit 0)
          LE Periodic Advertising Create Sync Cancel (Octet 38 - Bit 1)
          LE Periodic Advertising Terminate Sync (Octet 38 - Bit 2)
          LE Add Device To Periodic Advertiser List (Octet 38 - Bit 3)
          LE Remove Device From Periodic Advertiser List (Octet 38 - Bit 4)
          LE Clear Periodic Advertiser List (Octet 38 - Bit 5)
          LE Read Periodic Advertiser List Size (Octet 38 - Bit 6)
          LE Read Transmit Power (Octet 38 - Bit 7)
          LE Read RF Path Compensation (Octet 39 - Bit 0)
          LE Write RF Path Compensation (Octet 39 - Bit 1)
          LE Set Privacy Mode (Octet 39 - Bit 2)
          LE Periodic Advertising Receive Enable (Octet 40 - Bit 5)
          LE Periodic Advertising Sync Transfer (Octet 40 - Bit 6)
          LE Periodic Advertising Set Info Transfer (Octet 40 - Bit 7)
          LE Periodic Advertising Sync Transfer Parameters (Octet 41 - Bit 0)
          LE Set Default Periodic Advertisng Sync Transfer Parameters (Octet 41 - Bit 1)
          LE Read Buffer v2 (Octet 41 - Bit 5)
          LE Read ISO TX Sync (Octet 41 - Bit 6)
          LE Set Connected Isochronous Group Parameters (Octet 41 - Bit 7)
          LE Set Connected Isochronous Group Parameters Test (Octet 42 - Bit 0)
          LE Create Connected Isochronous Stream (Octet 42 - Bit 1)
          LE Remove Connected Isochronous Group (Octet 42 - Bit 2)
          LE Accept Connected Isochronous Stream Request (Octet 42 - Bit 3)
          LE Reject Connected Isochronous Stream Request (Octet 42 - Bit 4)
          LE Create Broadcast Isochronous Group (Octet 42 - Bit 5)
          LE Create Broadcast Isochronous Group Test (Octet 42 - Bit 6)
          LE Terminate Broadcast Isochronous Group (Octet 42 - Bit 7)
          LE Broadcast Isochronous Group Create Sync (Octet 43 - Bit 0)
          LE Broadcast Isochronous Group Terminate Sync (Octet 43 - Bit 1)
          LE Request Peer SCA (Octet 43 - Bit 2)
          LE Setup Isochronous Data Path (Octet 43 - Bit 3)
          LE Remove Isochronous Data Path (Octet 43 - Bit 4)
          LE Isochronous Transmit Test (Octet 43 - Bit 5)
          LE Isochronous Receive Test (Octet 43 - Bit 6)
          LE Isochronous Read Test Counters (Octet 43 - Bit 7)
          LE Isochronous Read Test Counters (Octet 44 - Bit 0)
          LE Set Host Feature (Octet 44 - Bit 1)
          Octet 44 - Bit 2 
          Octet 45 - Bit 6 
          Octet 46 - Bit 0 
          Octet 46 - Bit 1 
          Octet 46 - Bit 2 
< HCI Command: Host Buffer Size (0x03|0x0033) plen 7         #9 [hci1] 0.851851
        ACL MTU: 255  ACL max packet: 16
        SCO MTU: 0    SCO max packet: 0
> HCI Event: Command Complete (0x0e) plen 4                 #10 [hci1] 0.852354
      Host Buffer Size (0x03|0x0033) ncmd 1
        Status: Success (0x00)
< HCI Command: Set Controller To Ho.. (0x03|0x0031) plen 1  #11 [hci1] 0.871874
        Flow control: ACL Data Packets (0x01)
> HCI Event: Command Complete (0x0e) plen 4                 #12 [hci1] 0.872324
      Set Controller To Host Flow Control (0x03|0x0031) ncmd 1
        Status: Success (0x00)
< HCI Command: LE Read Local Suppor.. (0x08|0x0003) plen 0  #13 [hci1] 0.891864
> HCI Event: Command Complete (0x0e) plen 12                #14 [hci1] 0.892370
      LE Read Local Supported Features (0x08|0x0003) ncmd 1
        Status: Success (0x00)
        Features: 0xfd 0x79 0x00 0xf7 0x30 0x01 0x00 0x00
          LE Encryption
          Extended Reject Indication
          Peripheral-initiated Features Exchange
          LE Ping
          LE Data Packet Length Extension
          LL Privacy
          Extended Scanner Filter Policies
          LE 2M PHY
          LE Coded PHY
          LE Extended Advertising
          LE Periodic Advertising
          Channel Selection Algorithm #2
          Periodic Advertising Sync Transfer - Sender
          Periodic Advertising Sync Transfer - Recipient
          Sleep Clock Accuracy Updates
          Connected Isochronous Stream - Central
          Connected Isochronous Stream - Peripheral
          Isochronous Broadcaster
          Synchronized Receiver
          Periodic Advertising ADI support
          Connection Subrating
          Unknown features (0x0000010000000000)
< HCI Command: LE Set Host Feature (0x08|0x0074) plen 2     #15 [hci1] 0.911879
        Bit Number: 32
          Connected Isochronous Stream (Host Support)
        Bit Value: 1
> HCI Event: Command Complete (0x0e) plen 4                 #16 [hci1] 0.912295
      LE Set Host Feature (0x08|0x0074) ncmd 1
        Status: Success (0x00)
< HCI Command: LE Read Buffer v2 (0x08|0x0060) plen 0       #17 [hci1] 0.931866
> HCI Event: Command Complete (0x0e) plen 10                #18 [hci1] 0.932365
      LE Read Buffer v2 (0x08|0x0060) ncmd 1
        Status: Success (0x00)
        ACL MTU: 27
        ACL max packet: 3
        ISO MTU: 318
        ISO max packet: 3
< HCI Command: LE Read Maximum Adve.. (0x08|0x003a) plen 0  #19 [hci1] 0.951920
> HCI Event: Command Complete (0x0e) plen 6                 #20 [hci1] 0.952383
      LE Read Maximum Advertising Data Length (0x08|0x003a) ncmd 1
        Status: Success (0x00)
        Max length: 1650
< HCI Command: LE Read Supported St.. (0x08|0x001c) plen 0  #21 [hci1] 0.971873
> HCI Event: Command Complete (0x0e) plen 12                #22 [hci1] 0.972378
      LE Read Supported States (0x08|0x001c) ncmd 1
        Status: Success (0x00)
        States: 0x000003ff3e0306ff
          Non-connectable Advertising State
          Scannable Advertising State
          Connectable Advertising State
          High Duty Cycle Directed Advertising State
          Passive Scanning State
          Active Scanning State
          Initiating State
            and Connection State (Central Role)
          Connection State (Peripheral Role)
          Scannable Advertising State
            and Passive Scanning State
          Connectable Advertising State
            and Passive Scanning State
          Non-connectable Advertising State
            and Initiating State
          Scannable Advertising State
            and Initiating State
          Active Scanning State
            and Connection State (Central Role)
          Passive Scanning State
            and Connection State (Peripheral Role)
          Active Scanning State
            and Connection State (Peripheral Role)
          Initiating State
            and Connection State (Central Role)
            and Central Role & Central Role
          Low Duty Cycle Directed Advertising State
          Connectable Advertising State
            and Initiating State
            and Central Role & Peripheral Role
          High Duty Cycle Directed Advertising State
            and Initiating State
            and Central Role & Peripheral Role
          Low Duty Cycle Directed Advertising State
            and Initiating State
            and Central Role & Peripheral Role
          Connectable Advertising State
            and Connection State (Central Role)
            and Central Role & Peripheral Role
          High Duty Cycle Directed Advertising State
            and Connection State (Central Role)
            and Central Role & Peripheral Role
          Low Duty Cycle Directed Advertising State
            and Connection State (Central Role)
            and Central Role & Peripheral Role
          Connectable Advertising State
            and Connection State (Peripheral Role)
            and Central Role & Peripheral Role
          High Duty Cycle Directed Advertising State
            and Connection State (Peripheral Role)
            and Peripheral Role & Peripheral Role
          Low Duty Cycle Directed Advertising State
            and Connection State (Peripheral Role)
            and Peripheral Role & Peripheral Role
          Initiating State
            and Connection State (Peripheral Role)
            and Central Role & Peripheral Role
< HCI Command: LE Read Maximum Data.. (0x08|0x002f) plen 0  #23 [hci1] 0.991870
> HCI Event: Command Complete (0x0e) plen 12                #24 [hci1] 0.992375
      LE Read Maximum Data Length (0x08|0x002f) ncmd 1
        Status: Success (0x00)
        Max TX octets: 251
        Max TX time: 2704
        Max RX octets: 251
        Max RX time: 2704
< HCI Command: LE Write Suggested D.. (0x08|0x0024) plen 4  #25 [hci1] 1.011811
        TX octets: 251
        TX time: 2704
> HCI Event: Command Complete (0x0e) plen 4                 #26 [hci1] 1.012290
      LE Write Suggested Default Data Length (0x08|0x0024) ncmd 1
        Status: Success (0x00)
< HCI Command: LE Read Resolving Li.. (0x08|0x002a) plen 0  #27 [hci1] 1.031855
> HCI Event: Command Complete (0x0e) plen 5                 #28 [hci1] 1.032283
      LE Read Resolving List Size (0x08|0x002a) ncmd 1
        Status: Success (0x00)
        Size: 8
< HCI Command: LE Set Event Mask (0x08|0x0001) plen 8       #29 [hci1] 1.051869
        Mask: 0x000002023f87fa5e
          LE Advertising Report
          LE Connection Update Complete
          LE Read Remote Used Features Complete
          LE Long Term Key Request
          LE Data Length Change
          LE Enhanced Connection Complete
          LE PHY Update Complete
          LE Extended Advertising Report
          LE Periodic Advertising Sync Established
          LE Periodic Advertising Report
          LE Periodic Advertising Sync Lost
          LE Extended Scan Timeout
          LE Extended Advertising Set Terminated
          LE Scan Request Received
          LE Periodic Advertising Sync Transfer Rvc
          LE CIS Established
          LE CIS Request
          LE Create BIG Complete
          LE Terminate BIG Complete
          LE BIG Sync Estabilished Complete
          LE BIG Sync Lost
          LE BIG Info Advertising Report
          Unknown mask (0x0000020000000000)
> HCI Event: Command Complete (0x0e) plen 4                 #30 [hci1] 1.052326
      LE Set Event Mask (0x08|0x0001) ncmd 1
        Status: Success (0x00)
< HCI Command: Set Event Mask (0x03|0x0001) plen 8          #31 [hci1] 1.071877
        Mask: 0x2000800002008890
          Disconnection Complete
          Encryption Change
          Read Remote Version Information Complete
          Hardware Error
          Data Buffer Overflow
          Encryption Key Refresh Complete
          LE Meta
> HCI Event: Command Complete (0x0e) plen 4                 #32 [hci1] 1.072377
      Set Event Mask (0x03|0x0001) ncmd 1
        Status: Success (0x00)
< HCI Command: Read BD ADDR (0x04|0x0009) plen 0            #33 [hci1] 1.091873
> HCI Event: Command Complete (0x0e) plen 10                #34 [hci1] 1.092317
      Read BD ADDR (0x04|0x0009) ncmd 1
        Status: Success (0x00)
        Address: 00:00:00:00:00:00 (OUI 00-00-00)
< HCI Command: LE Set Random Address (0x08|0x0005) plen 6   #35 [hci1] 1.111876
        Address: D5:B6:CC:31:DB:3B (Static)
> HCI Event: Command Complete (0x0e) plen 4                 #36 [hci1] 1.112383
      LE Set Random Address (0x08|0x0005) ncmd 1
        Status: Success (0x00)
< HCI Command: LE Extended Create... (0x08|0x0043) plen 26  #37 [hci1] 6.122362
        Filter policy: Accept list is not used (0x00)
        Own address type: Random (0x01)
        Peer address type: Public (0x00)
        Peer address: DF:A9:FF:F6:B1:1A (OUI DF-A9-FF)
        Initiating PHYs: 0x01
        Entry 0: LE 1M
          Scan interval: 60.000 msec (0x0060)
          Scan window: 60.000 msec (0x0060)
          Min connection interval: 50.00 msec (0x0028)
          Max connection interval: 70.00 msec (0x0038)
          Connection latency: 0 (0x0000)
          Supervision timeout: 4000 msec (0x0190)
          Min connection length: 0.000 msec (0x0000)
          Max connection length: 0.000 msec (0x0000)
> HCI Event: Command Status (0x0f) plen 4                   #38 [hci1] 6.123347
      LE Extended Create Connection (0x08|0x0043) ncmd 1
        Status: Success (0x00)
> HCI Event: LE Meta Event (0x3e) plen 31                   #39 [hci1] 6.209669
      LE Enhanced Connection Complete (0x0a)
        Status: Success (0x00)
        Handle: 1170
        Role: Central (0x00)
        Peer address type: Public (0x00)
        Peer address: DF:A9:FF:F6:B1:1A (OUI DF-A9-FF)
        Local resolvable private address: 00:00:00:00:00:00 (Non-Resolvable)
        Peer resolvable private address: 00:00:00:00:00:00 (Non-Resolvable)
        Connection interval: 70.00 msec (0x0038)
        Connection latency: 0 (0x0000)
        Supervision timeout: 4000 msec (0x0190)
        Central clock accuracy: 0x00
< HCI Command: LE Read Remote Used... (0x08|0x0016) plen 2  #40 [hci1] 6.212861
        Handle: 1170 Address: DF:A9:FF:F6:B1:1A (OUI DF-A9-FF)
< ACL Data TX: Handle 1170 flags 0x00 dlen 7                #41 [hci1] 6.212882
      ATT: Exchange MTU Request (0x02) len 2
        Client RX MTU: 251
> HCI Event: Command Status (0x0f) plen 4                   #42 [hci1] 6.213448
      LE Read Remote Used Features (0x08|0x0016) ncmd 1
        Status: Success (0x00)
< HCI Command: LE Set PHY (0x08|0x0032) plen 7              #43 [hci1] 6.232358
        Handle: 1170 Address: DF:A9:FF:F6:B1:1A (OUI DF-A9-FF)
        All PHYs preference: 0x00
        TX PHYs preference: 0x02
          LE 2M
        RX PHYs preference: 0x02
          LE 2M
        PHY options preference: Reserved (0x0000)
> HCI Event: Command Status (0x0f) plen 4                   #44 [hci1] 6.232995
      LE Set PHY (0x08|0x0032) ncmd 1
        Status: Success (0x00)
> HCI Event: Number of Completed Packets (0x13) plen 5      #45 [hci1] 6.281931
        Num handles: 1
        Handle: 1170 Address: DF:A9:FF:F6:B1:1A (OUI DF-A9-FF)
        Count: 1
        #41: len 7 (0 Kb/s)
        Latency: 69 msec (69-69 msec ~69 msec)
> HCI Event: LE Meta Event (0x3e) plen 12                   #46 [hci1] 6.421978
      LE Read Remote Used Features (0x04)
        Status: Success (0x00)
        Handle: 1170 Address: DF:A9:FF:F6:B1:1A (OUI DF-A9-FF)
        Features: 0x2d 0x49 0x00 0xf7 0x67 0xd9 0x00 0x80
          LE Encryption
          Extended Reject Indication
          Peripheral-initiated Features Exchange
          LE Data Packet Length Extension
          LE 2M PHY
          LE Coded PHY
          Channel Selection Algorithm #2
          Periodic Advertising Sync Transfer - Sender
          Periodic Advertising Sync Transfer - Recipient
          Sleep Clock Accuracy Updates
          Connected Isochronous Stream - Central
          Connected Isochronous Stream - Peripheral
          Isochronous Broadcaster
          Synchronized Receiver
          Connected Isochronous Stream (Host Support)
          LE Power Control Request
          LE Power Control Request
          Connection Subrating
          Connection Subrating (Host Support)
          Unknown features (0x8000d90000000000)
> HCI Event: LE Meta Event (0x3e) plen 6                    #47 [hci1] 7.121367
      LE PHY Update Complete (0x0c)
        Status: Success (0x00)
        Handle: 1170 Address: DF:A9:FF:F6:B1:1A (OUI DF-A9-FF)
        TX PHY: LE 2M (0x02)
        RX PHY: LE 2M (0x02)
> ACL Data RX: Handle 1170 flags 0x02 dlen 6                #48 [hci1] 7.261790
      SMP: Security Request (0x0b) len 1
        Authentication requirement: Bonding, No MITM, SC, No Keypresses (0x09)
> ACL Data RX: Handle 1170 flags 0x02 dlen 7                #49 [hci1] 7.262169
      ATT: Exchange MTU Response (0x03) len 2
        Server RX MTU: 64
< HCI Command: Host Number of Compl.. (0x03|0x0035) plen 5  #50 [hci1] 7.272563
        Num handles: 1
        Handle: 1170 Address: DF:A9:FF:F6:B1:1A (OUI DF-A9-FF)
        Count: 1
< ACL Data TX: Handle 1170 flags 0x00 dlen 11               #51 [hci1] 7.272738
      SMP: Pairing Request (0x01) len 6
        IO capability: NoInputNoOutput (0x03)
        OOB data: Authentication data not present (0x00)
        Authentication requirement: Bonding, No MITM, SC, No Keypresses (0x09)
        Max encryption key size: 16
        Initiator key distribution: EncKey (0x01)
        Responder key distribution: EncKey IdKey (0x03)
< HCI Command: Host Number of Compl.. (0x03|0x0035) plen 5  #52 [hci1] 7.273224
        Num handles: 1
        Handle: 1170 Address: DF:A9:FF:F6:B1:1A (OUI DF-A9-FF)
        Count: 1
> HCI Event: Number of Completed Packets (0x13) plen 5      #53 [hci1] 7.331823
        Num handles: 1
        Handle: 1170 Address: DF:A9:FF:F6:B1:1A (OUI DF-A9-FF)
        Count: 1
        #51: len 11 (1 Kb/s)
        Latency: 59 msec (59-69 msec ~64 msec)
> ACL Data RX: Handle 1170 flags 0x02 dlen 11               #54 [hci1] 7.401887
      SMP: Pairing Response (0x02) len 6
        IO capability: KeyboardDisplay (0x04)
        OOB data: Authentication data not present (0x00)
        Authentication requirement: Bonding, No MITM, SC, No Keypresses (0x09)
        Max encryption key size: 16
        Initiator key distribution: EncKey (0x01)
        Responder key distribution: EncKey IdKey (0x03)
< HCI Command: Host Number of Compl.. (0x03|0x0035) plen 5  #55 [hci1] 7.412426
        Num handles: 1
        Handle: 1170 Address: DF:A9:FF:F6:B1:1A (OUI DF-A9-FF)
        Count: 1
< ACL Data TX: Handle 1170 flags 0x00 dlen 27               #56 [hci1] 7.412576
< ACL Data TX: Handle 1170 flags 0x01 dlen 27               #57 [hci1] 7.412594
< ACL Data TX: Handle 1170 flags 0x01 dlen 15               #58 [hci1] 7.412598
      SMP: Pairing Public Key (0x0c) len 64
        X: 98308440221e2d910f0e54b71e7ec652857aa9b5a0dc65028824cc19db1226e9
        Y: 67a4816bcb62efb21701e31fdb27561a6217575fb007a8bbdabe7e28b6f68482
> HCI Event: Number of Completed Packets (0x13) plen 5      #59 [hci1] 7.471818
        Num handles: 1
        Handle: 1170 Address: DF:A9:FF:F6:B1:1A (OUI DF-A9-FF)
        Count: 1
        #56: len 27 (3 Kb/s)
        Latency: 59 msec (59-69 msec ~61 msec)
> HCI Event: Number of Completed Packets (0x13) plen 5      #60 [hci1] 7.472226
        Num handles: 1
        Handle: 1170 Address: DF:A9:FF:F6:B1:1A (OUI DF-A9-FF)
        Count: 1
        #57: len 27 (3 Kb/s)
        Latency: 59 msec (59-69 msec ~60 msec)
> HCI Event: Number of Completed Packets (0x13) plen 5      #61 [hci1] 7.472807
        Num handles: 1
        Handle: 1170 Address: DF:A9:FF:F6:B1:1A (OUI DF-A9-FF)
        Count: 1
        #58: len 15 (2 Kb/s)
        Latency: 60 msec (59-69 msec ~60 msec)
> ACL Data RX: Handle 1170 flags 0x02 dlen 27               #62 [hci1] 7.541955
> ACL Data RX: Handle 1170 flags 0x01 dlen 27               #63 [hci1] 7.542423
> ACL Data RX: Handle 1170 flags 0x01 dlen 15               #64 [hci1] 7.542793
      SMP: Pairing Public Key (0x0c) len 64
        X: 1d844433e96ccad1d77e0a6551aa3d699ea697cb2d1f80e88c66b3610067a69d
        Y: 0d6708b12819b735adf6a387a41f681747499f3c925031dbed449e25fb6d4fdd
< HCI Command: Host Number of Compl.. (0x03|0x0035) plen 5  #65 [hci1] 7.552189
        Num handles: 1
        Handle: 1170 Address: DF:A9:FF:F6:B1:1A (OUI DF-A9-FF)
        Count: 1
< HCI Command: Host Number of Compl.. (0x03|0x0035) plen 5  #66 [hci1] 7.552202
        Num handles: 1
        Handle: 1170 Address: DF:A9:FF:F6:B1:1A (OUI DF-A9-FF)
        Count: 1
< HCI Command: Host Number of Compl.. (0x03|0x0035) plen 5  #67 [hci1] 7.552310
        Num handles: 1
        Handle: 1170 Address: DF:A9:FF:F6:B1:1A (OUI DF-A9-FF)
        Count: 1
> ACL Data RX: Handle 1170 flags 0x02 dlen 21               #68 [hci1] 7.612130
      SMP: Pairing Confirm (0x03) len 16
        Confim value: 1b0a7797acabd21a1fbf1ceaeadefe76
< HCI Command: Host Number of Compl.. (0x03|0x0035) plen 5  #69 [hci1] 7.632393
        Num handles: 1
        Handle: 1170 Address: DF:A9:FF:F6:B1:1A (OUI DF-A9-FF)
        Count: 1
< ACL Data TX: Handle 1170 flags 0x00 dlen 21               #70 [hci1] 7.632464
      SMP: Pairing Random (0x04) len 16
        Random value: 8e6108f966a694cbe26df70bb96773e6
> HCI Event: Number of Completed Packets (0x13) plen 5      #71 [hci1] 7.681789
        Num handles: 1
        Handle: 1170 Address: DF:A9:FF:F6:B1:1A (OUI DF-A9-FF)
        Count: 1
        #70: len 21 (3 Kb/s)
        Latency: 49 msec (49-69 msec ~54 msec)
> ACL Data RX: Handle 1170 flags 0x02 dlen 21               #72 [hci1] 7.752004
      SMP: Pairing Random (0x04) len 16
        Random value: 5368c5d740d288720000000000000000
< HCI Command: Host Number of Compl.. (0x03|0x0035) plen 5  #73 [hci1] 7.772978
        Num handles: 1
        Handle: 1170 Address: DF:A9:FF:F6:B1:1A (OUI DF-A9-FF)
        Count: 1
< ACL Data TX: Handle 1170 flags 0x00 dlen 21               #74 [hci1] 7.773074
      SMP: Pairing DHKey Check (0x0d) len 16
        E: 9246482842ea44223122296cffcbfb06
> HCI Event: Number of Completed Packets (0x13) plen 5      #75 [hci1] 7.821783
        Num handles: 1
        Handle: 1170 Address: DF:A9:FF:F6:B1:1A (OUI DF-A9-FF)
        Count: 1
        #74: len 21 (3 Kb/s)
        Latency: 48 msec (48-69 msec ~51 msec)
> ACL Data RX: Handle 1170 flags 0x02 dlen 21               #76 [hci1] 8.101945
      SMP: Pairing DHKey Check (0x0d) len 16
        E: ab66fc356b4c6a408fb3dec5674efe3d
< HCI Command: LE Start Encryption (0x08|0x0019) plen 28    #77 [hci1] 8.112240
        Handle: 1170 Address: DF:A9:FF:F6:B1:1A (OUI DF-A9-FF)
        Random number: 0x0000000000000000
        Encrypted diversifier: 0x0000
        Long term key: e56911ec007ebb443cf24959e800713d
> HCI Event: Command Status (0x0f) plen 4                   #78 [hci1] 8.113147
      LE Start Encryption (0x08|0x0019) ncmd 1
        Status: Success (0x00)
< HCI Command: Host Number of Compl.. (0x03|0x0035) plen 5  #79 [hci1] 8.132189
        Num handles: 1
        Handle: 1170 Address: DF:A9:FF:F6:B1:1A (OUI DF-A9-FF)
        Count: 1
> HCI Event: Encryption Change (0x08) plen 4                #80 [hci1] 8.591714
        Status: Success (0x00)
        Handle: 1170 Address: DF:A9:FF:F6:B1:1A (OUI DF-A9-FF)
        Encryption: Enabled with AES-CCM (0x01)
> ACL Data RX: Handle 1170 flags 0x02 dlen 21               #81 [hci1] 8.661960
      SMP: Identity Information (0x08) len 16
        Identity resolving key: 4dfd441b7cdbad18234a6cf775c9d54b
< HCI Command: Host Number of Compl.. (0x03|0x0035) plen 5  #82 [hci1] 8.672512
        Num handles: 1
        Handle: 1170 Address: DF:A9:FF:F6:B1:1A (OUI DF-A9-FF)
        Count: 1
> ACL Data RX: Handle 1170 flags 0x02 dlen 12               #83 [hci1] 8.801882
      SMP: Identity Address Information (0x09) len 7
        Address: DF:A9:FF:F6:B1:1A (OUI DF-A9-FF)
< HCI Command: LE Add Device To Re.. (0x08|0x0027) plen 39  #84 [hci1] 8.812552
        Address type: Public (0x00)
        Address: DF:A9:FF:F6:B1:1A (OUI DF-A9-FF)
        Peer identity resolving key: 4dfd441b7cdbad18234a6cf775c9d54b
        Local identity resolving key: 00000000000000000000000000000000
> HCI Event: Command Complete (0x0e) plen 4                 #85 [hci1] 8.813512
      LE Add Device To Resolving List (0x08|0x0027) ncmd 1
        Status: Success (0x00)
< HCI Command: LE Set Privacy Mode (0x08|0x004e) plen 8     #86 [hci1] 8.832113
        Peer Identity address type: Public (0x00)
        Peer Identity address: DF:A9:FF:F6:B1:1A (OUI DF-A9-FF)
        Privacy Mode: Use Device Privacy (0x01)
> HCI Event: Command Complete (0x0e) plen 4                 #87 [hci1] 8.832713
      LE Set Privacy Mode (0x08|0x004e) ncmd 1
        Status: Success (0x00)
< HCI Command: LE Set Address Resol.. (0x08|0x002d) plen 1  #88 [hci1] 8.851937
        Address resolution: Enabled (0x01)
> HCI Event: Command Complete (0x0e) plen 4                 #89 [hci1] 8.852393
      LE Set Address Resolution Enable (0x08|0x002d) ncmd 1
        Status: Success (0x00)
< HCI Command: Host Number of Compl.. (0x03|0x0035) plen 5  #90 [hci1] 8.871912
        Num handles: 1
        Handle: 1170 Address: DF:A9:FF:F6:B1:1A (OUI DF-A9-FF)
        Count: 1
< ACL Data TX: Handle 1170 flags 0x00 dlen 13               #91 [hci1] 9.262046
      ATT: Find By Type Value Request (0x06) len 8
        Handle range: 0x0001-0xffff
        Attribute type: Primary Service (0x2800)
          UUID: Common Audio (0x1853)
> HCI Event: Number of Completed Packets (0x13) plen 5      #92 [hci1] 9.291672
        Num handles: 1
        Handle: 1170 Address: DF:A9:FF:F6:B1:1A (OUI DF-A9-FF)
        Count: 1
        #91: len 13 (3 Kb/s)
        Latency: 29 msec (29-69 msec ~40 msec)
> ACL Data RX: Handle 1170 flags 0x02 dlen 9                #93 [hci1] 9.361796
      ATT: Find By Type Value Response (0x07) len 4
        Handle range: 0x02c0-0x02c0
< HCI Command: Host Number of Compl.. (0x03|0x0035) plen 5  #94 [hci1] 9.372228
        Num handles: 1
        Handle: 1170 Address: DF:A9:FF:F6:B1:1A (OUI DF-A9-FF)
        Count: 1
< ACL Data TX: Handle 1170 flags 0x00 dlen 11               #95 [hci1] 9.382169
      ATT: Read By Type Request (0x08) len 6
        Handle range: 0x0001-0xffff
        Attribute type: Characteristic (0x2803)
> HCI Event: Number of Completed Packets (0x13) plen 5      #96 [hci1] 9.431698
        Num handles: 1
        Handle: 1170 Address: DF:A9:FF:F6:B1:1A (OUI DF-A9-FF)
        Count: 1
        #95: len 11 (1 Kb/s)
        Latency: 49 msec (29-69 msec ~45 msec)
> ACL Data RX: Handle 1170 flags 0x02 dlen 27               #97 [hci1] 9.502078
> ACL Data RX: Handle 1170 flags 0x01 dlen 27               #98 [hci1] 9.502440
> ACL Data RX: Handle 1170 flags 0x01 dlen 8                #99 [hci1] 9.502858
      ATT: Read By Type Response (0x09) len 57
        Attribute data length: 7
        Attribute data list: 8 entries
        Handle: 0x0002
        Value: 0a0300002a
            Properties: 0x0a
              Read (0x02)
              Write (0x08)
            Value Handle: 0x0003
            Value UUID: Device Name (0x2a00)
        Handle: 0x0004
        Value: 0a0500012a
            Properties: 0x0a
              Read (0x02)
              Write (0x08)
            Value Handle: 0x0005
            Value UUID: Appearance (0x2a01)
        Handle: 0x0006
        Value: 4e07000945
            Properties: 0x4e
              Read (0x02)
              Write Without Response (0x04)
              Write (0x08)
              Authorize (0x40)
              Extended Properties (0x80)
            Value Handle: 0x0007
            Value UUID: Unknown (0x4509)
        Handle: 0x0008
        Value: 020900042a
            Properties: 0x02
              Read (0x02)
            Value Handle: 0x0009
            Value UUID: Peripheral Preferred Connection Parameters (0x2a04)
        Handle: 0x000a
        Value: 120b00192a
            Properties: 0x12
              Read (0x02)
              Notify (0x10)
            Value Handle: 0x000b
            Value UUID: Battery Level (0x2a19)
        Handle: 0x000e
        Value: 020f00a62a
            Properties: 0x02
              Read (0x02)
            Value Handle: 0x000f
            Value UUID: Central Address Resolution (0x2aa6)
        Handle: 0x0041
        Value: 204200052a
            Properties: 0x20
              Indicate (0x20)
            Value Handle: 0x0042
            Value UUID: Service Changed (0x2a05)
        Handle: 0x0044
        Value: 0a4500292b
            Properties: 0x0a
              Read (0x02)
              Write (0x08)
            Value Handle: 0x0045
            Value UUID: Client Supported Features (0x2b29)
< HCI Command: Host Number of Comp.. (0x03|0x0035) plen 5  #100 [hci1] 9.512744
        Num handles: 1
        Handle: 1170 Address: DF:A9:FF:F6:B1:1A (OUI DF-A9-FF)
        Count: 1
< HCI Command: Host Number of Comp.. (0x03|0x0035) plen 5  #101 [hci1] 9.513066
        Num handles: 1
        Handle: 1170 Address: DF:A9:FF:F6:B1:1A (OUI DF-A9-FF)
        Count: 1
< HCI Command: Host Number of Comp.. (0x03|0x0035) plen 5  #102 [hci1] 9.513113
        Num handles: 1
        Handle: 1170 Address: DF:A9:FF:F6:B1:1A (OUI DF-A9-FF)
        Count: 1
< ACL Data TX: Handle 1170 flags 0x00 dlen 11              #103 [hci1] 9.513383
      ATT: Read By Type Request (0x08) len 6
        Handle range: 0x0045-0xffff
        Attribute type: Characteristic (0x2803)
> HCI Event: Number of Completed Packets (0x13) plen 5     #104 [hci1] 9.571685
        Num handles: 1
        Handle: 1170 Address: DF:A9:FF:F6:B1:1A (OUI DF-A9-FF)
        Count: 1
        #103: len 11 (1 Kb/s)
        Latency: 58 msec (29-69 msec ~51 msec)
> ACL Data RX: Handle 1170 flags 0x02 dlen 27              #105 [hci1] 9.642016
> ACL Data RX: Handle 1170 flags 0x01 dlen 27              #106 [hci1] 9.642622
> ACL Data RX: Handle 1170 flags 0x01 dlen 8               #107 [hci1] 9.642766
      ATT: Read By Type Response (0x09) len 57
        Attribute data length: 7
        Attribute data list: 8 entries
        Handle: 0x0046
        Value: 0247003a2b
            Properties: 0x02
              Read (0x02)
            Value Handle: 0x0047
            Value UUID: Server Supported Features (0x2b3a)
        Handle: 0x0081
        Value: 0282000945
            Properties: 0x02
              Read (0x02)
            Value Handle: 0x0082
            Value UUID: Unknown (0x4509)
        Handle: 0x0083
        Value: 028400232a
            Properties: 0x02
              Read (0x02)
            Value Handle: 0x0084
            Value UUID: System ID (0x2a23)
        Handle: 0x0085
        Value: 028600242a
            Properties: 0x02
              Read (0x02)
            Value Handle: 0x0086
            Value UUID: Model Number String (0x2a24)
        Handle: 0x0087
        Value: 028800252a
            Properties: 0x02
              Read (0x02)
            Value Handle: 0x0088
            Value UUID: Serial Number String (0x2a25)
        Handle: 0x0089
        Value: 028a00262a
            Properties: 0x02
              Read (0x02)
            Value Handle: 0x008a
            Value UUID: Firmware Revision String (0x2a26)
        Handle: 0x008b
        Value: 028c00272a
            Properties: 0x02
              Read (0x02)
            Value Handle: 0x008c
            Value UUID: Hardware Revision String (0x2a27)
        Handle: 0x008d
        Value: 028e00282a
            Properties: 0x02
              Read (0x02)
            Value Handle: 0x008e
            Value UUID: Software Revision String (0x2a28)
< HCI Command: Host Number of Comp.. (0x03|0x0035) plen 5  #108 [hci1] 9.652670
        Num handles: 1
        Handle: 1170 Address: DF:A9:FF:F6:B1:1A (OUI DF-A9-FF)
        Count: 1
< HCI Command: Host Number of Comp.. (0x03|0x0035) plen 5  #109 [hci1] 9.652947
        Num handles: 1
        Handle: 1170 Address: DF:A9:FF:F6:B1:1A (OUI DF-A9-FF)
        Count: 1
< HCI Command: Host Number of Comp.. (0x03|0x0035) plen 5  #110 [hci1] 9.653128
        Num handles: 1
        Handle: 1170 Address: DF:A9:FF:F6:B1:1A (OUI DF-A9-FF)
        Count: 1
< ACL Data TX: Handle 1170 flags 0x00 dlen 11              #111 [hci1] 9.653498
      ATT: Read By Type Request (0x08) len 6
        Handle range: 0x008e-0xffff
        Attribute type: Characteristic (0x2803)
> HCI Event: Number of Completed Packets (0x13) plen 5     #112 [hci1] 9.711661
        Num handles: 1
        Handle: 1170 Address: DF:A9:FF:F6:B1:1A (OUI DF-A9-FF)
        Count: 1
        #111: len 11 (1 Kb/s)
        Latency: 58 msec (29-69 msec ~54 msec)
> ACL Data RX: Handle 1170 flags 0x02 dlen 27              #113 [hci1] 9.781991
> ACL Data RX: Handle 1170 flags 0x01 dlen 27              #114 [hci1] 9.782416
> ACL Data RX: Handle 1170 flags 0x01 dlen 8               #115 [hci1] 9.782858
      ATT: Read By Type Response (0x09) len 57
        Attribute data length: 7
        Attribute data list: 8 entries
        Handle: 0x008f
        Value: 029000292a
            Properties: 0x02
              Read (0x02)
            Value Handle: 0x0090
            Value UUID: Manufacturer Name String (0x2a29)
        Handle: 0x0091
        Value: 0292002a2a
            Properties: 0x02
              Read (0x02)
            Value Handle: 0x0092
            Value UUID: IEEE 11073-20601 Regulatory Cert. Data List (0x2a2a)
        Handle: 0x0093
        Value: 029400502a
            Properties: 0x02
              Read (0x02)
            Value Handle: 0x0094
            Value UUID: PnP ID (0x2a50)
        Handle: 0x0095
        Value: 0296002234
            Properties: 0x02
              Read (0x02)
            Value Handle: 0x0096
            Value UUID: Unknown (0x3422)
        Handle: 0x0098
        Value: 029900ff2b
            Properties: 0x02
              Read (0x02)
            Value Handle: 0x0099
            Value UUID: Unknown (0x2bff)
        Handle: 0x00d1
        Value: 12d200b32b
            Properties: 0x12
              Read (0x02)
              Notify (0x10)
            Value Handle: 0x00d2
            Value UUID: Bearer Provider Name (0x2bb3)
        Handle: 0x00d4
        Value: 02d500b42b
            Properties: 0x02
              Read (0x02)
            Value Handle: 0x00d5
            Value UUID: Bearer UCI (0x2bb4)
        Handle: 0x00d6
        Value: 12d700b52b
            Properties: 0x12
              Read (0x02)
              Notify (0x10)
            Value Handle: 0x00d7
            Value UUID: Bearer Technology (0x2bb5)
< HCI Command: Host Number of Comp.. (0x03|0x0035) plen 5  #116 [hci1] 9.792753
        Num handles: 1
        Handle: 1170 Address: DF:A9:FF:F6:B1:1A (OUI DF-A9-FF)
        Count: 1
< HCI Command: Host Number of Comp.. (0x03|0x0035) plen 5  #117 [hci1] 9.793044
        Num handles: 1
        Handle: 1170 Address: DF:A9:FF:F6:B1:1A (OUI DF-A9-FF)
        Count: 1
< HCI Command: Host Number of Comp.. (0x03|0x0035) plen 5  #118 [hci1] 9.793139
        Num handles: 1
        Handle: 1170 Address: DF:A9:FF:F6:B1:1A (OUI DF-A9-FF)
        Count: 1
< ACL Data TX: Handle 1170 flags 0x00 dlen 11              #119 [hci1] 9.793257
      ATT: Read By Type Request (0x08) len 6
        Handle range: 0x00d7-0xffff
        Attribute type: Characteristic (0x2803)
> HCI Event: Number of Completed Packets (0x13) plen 5     #120 [hci1] 9.851639
        Num handles: 1
        Handle: 1170 Address: DF:A9:FF:F6:B1:1A (OUI DF-A9-FF)
        Count: 1
        #119: len 11 (1 Kb/s)
        Latency: 58 msec (29-69 msec ~56 msec)
> ACL Data RX: Handle 1170 flags 0x02 dlen 27              #121 [hci1] 9.921915
> ACL Data RX: Handle 1170 flags 0x01 dlen 27              #122 [hci1] 9.922426
> ACL Data RX: Handle 1170 flags 0x01 dlen 8               #123 [hci1] 9.922739
      ATT: Read By Type Response (0x09) len 57
        Attribute data length: 7
        Attribute data list: 8 entries
        Handle: 0x00d9
        Value: 12da00b62b
            Properties: 0x12
              Read (0x02)
              Notify (0x10)
            Value Handle: 0x00da
            Value UUID: Bearer URI Schemes Supported List (0x2bb6)
        Handle: 0x00dc
        Value: 12dd00b72b
            Properties: 0x12
              Read (0x02)
              Notify (0x10)
            Value Handle: 0x00dd
            Value UUID: Bearer Signal Strength (0x2bb7)
        Handle: 0x00df
        Value: 0ee000b82b
            Properties: 0x0e
              Read (0x02)
              Write Without Response (0x04)
              Write (0x08)
            Value Handle: 0x00e0
            Value UUID: Bearer Signal Strength Reporting Interval (0x2bb8)
        Handle: 0x00e1
        Value: 12e200b92b
            Properties: 0x12
              Read (0x02)
              Notify (0x10)
            Value Handle: 0x00e2
            Value UUID: Bearer List Current Calls (0x2bb9)
        Handle: 0x00e4
        Value: 02e500ba2b
            Properties: 0x02
              Read (0x02)
            Value Handle: 0x00e5
            Value UUID: Content Control ID (0x2bba)
        Handle: 0x00e6
        Value: 12e700bc2b
            Properties: 0x12
              Read (0x02)
              Notify (0x10)
            Value Handle: 0x00e7
            Value UUID: Incoming Call Target Bearer URI (0x2bbc)
        Handle: 0x00e9
        Value: 12ea00bb2b
            Properties: 0x12
              Read (0x02)
              Notify (0x10)
            Value Handle: 0x00ea
            Value UUID: Status Flags (0x2bbb)
        Handle: 0x00ec
        Value: 12ed00bd2b
            Properties: 0x12
              Read (0x02)
              Notify (0x10)
            Value Handle: 0x00ed
            Value UUID: Call State (0x2bbd)
< HCI Command: Host Number of Comp.. (0x03|0x0035) plen 5  #124 [hci1] 9.932702
        Num handles: 1
        Handle: 1170 Address: DF:A9:FF:F6:B1:1A (OUI DF-A9-FF)
        Count: 1
< HCI Command: Host Number of Comp.. (0x03|0x0035) plen 5  #125 [hci1] 9.932904
        Num handles: 1
        Handle: 1170 Address: DF:A9:FF:F6:B1:1A (OUI DF-A9-FF)
        Count: 1
< HCI Command: Host Number of Comp.. (0x03|0x0035) plen 5  #126 [hci1] 9.933029
        Num handles: 1
        Handle: 1170 Address: DF:A9:FF:F6:B1:1A (OUI DF-A9-FF)
        Count: 1
< ACL Data TX: Handle 1170 flags 0x00 dlen 11              #127 [hci1] 9.933164
      ATT: Read By Type Request (0x08) len 6
        Handle range: 0x00ed-0xffff
        Attribute type: Characteristic (0x2803)
> HCI Event: Number of Completed Packets (0x13) plen 5     #128 [hci1] 9.991774
        Num handles: 1
        Handle: 1170 Address: DF:A9:FF:F6:B1:1A (OUI DF-A9-FF)
        Count: 1
        #127: len 11 (1 Kb/s)
        Latency: 58 msec (29-69 msec ~57 msec)
> ACL Data RX: Handle 1170 flags 0x02 dlen 27             #129 [hci1] 10.061911
> ACL Data RX: Handle 1170 flags 0x01 dlen 27             #130 [hci1] 10.062412
> ACL Data RX: Handle 1170 flags 0x01 dlen 8              #131 [hci1] 10.062771
      ATT: Read By Type Response (0x09) len 57
        Attribute data length: 7
        Attribute data list: 8 entries
        Handle: 0x00ef
        Value: 1cf000be2b
            Properties: 0x1c
              Write Without Response (0x04)
              Write (0x08)
              Notify (0x10)
            Value Handle: 0x00f0
            Value UUID: Call Control Point (0x2bbe)
        Handle: 0x00f2
        Value: 10f300c02b
            Properties: 0x10
              Notify (0x10)
            Value Handle: 0x00f3
            Value UUID: Termination Reason (0x2bc0)
        Handle: 0x00f5
        Value: 12f600c12b
            Properties: 0x12
              Read (0x02)
              Notify (0x10)
            Value Handle: 0x00f6
            Value UUID: Incoming Call (0x2bc1)
        Handle: 0x00f8
        Value: 12f900c22b
            Properties: 0x12
              Read (0x02)
              Notify (0x10)
            Value Handle: 0x00f9
            Value UUID: Call Friendly Name (0x2bc2)
        Handle: 0x00fb
        Value: 02fc00bf2b
            Properties: 0x02
              Read (0x02)
            Value Handle: 0x00fc
            Value UUID: Call Control Point Optional Opcodes (0x2bbf)
        Handle: 0x0111
        Value: 121201b32b
            Properties: 0x12
              Read (0x02)
              Notify (0x10)
            Value Handle: 0x0112
            Value UUID: Bearer Provider Name (0x2bb3)
        Handle: 0x0114
        Value: 021501b42b
            Properties: 0x02
              Read (0x02)
            Value Handle: 0x0115
            Value UUID: Bearer UCI (0x2bb4)
        Handle: 0x0116
        Value: 121701b52b
            Properties: 0x12
              Read (0x02)
              Notify (0x10)
            Value Handle: 0x0117
            Value UUID: Bearer Technology (0x2bb5)
< HCI Command: Host Number of Com.. (0x03|0x0035) plen 5  #132 [hci1] 10.072812
        Num handles: 1
        Handle: 1170 Address: DF:A9:FF:F6:B1:1A (OUI DF-A9-FF)
        Count: 1
< HCI Command: Host Number of Com.. (0x03|0x0035) plen 5  #133 [hci1] 10.073048
        Num handles: 1
        Handle: 1170 Address: DF:A9:FF:F6:B1:1A (OUI DF-A9-FF)
        Count: 1
< HCI Command: Host Number of Com.. (0x03|0x0035) plen 5  #134 [hci1] 10.073113
        Num handles: 1
        Handle: 1170 Address: DF:A9:FF:F6:B1:1A (OUI DF-A9-FF)
        Count: 1
< ACL Data TX: Handle 1170 flags 0x00 dlen 11             #135 [hci1] 10.073318
      ATT: Read By Type Request (0x08) len 6
        Handle range: 0x0117-0xffff
        Attribute type: Characteristic (0x2803)
> HCI Event: Number of Completed Packets (0x13) plen 5    #136 [hci1] 10.131669
        Num handles: 1
        Handle: 1170 Address: DF:A9:FF:F6:B1:1A (OUI DF-A9-FF)
        Count: 1
        #135: len 11 (1 Kb/s)
        Latency: 58 msec (29-69 msec ~57 msec)
> ACL Data RX: Handle 1170 flags 0x02 dlen 27             #137 [hci1] 10.201913
> ACL Data RX: Handle 1170 flags 0x01 dlen 27             #138 [hci1] 10.202415
> ACL Data RX: Handle 1170 flags 0x01 dlen 8              #139 [hci1] 10.202761
      ATT: Read By Type Response (0x09) len 57
        Attribute data length: 7
        Attribute data list: 8 entries
        Handle: 0x0119
        Value: 121a01b62b
            Properties: 0x12
              Read (0x02)
              Notify (0x10)
            Value Handle: 0x011a
            Value UUID: Bearer URI Schemes Supported List (0x2bb6)
        Handle: 0x011c
        Value: 121d01b72b
            Properties: 0x12
              Read (0x02)
              Notify (0x10)
            Value Handle: 0x011d
            Value UUID: Bearer Signal Strength (0x2bb7)
        Handle: 0x011f
        Value: 0e2001b82b
            Properties: 0x0e
              Read (0x02)
              Write Without Response (0x04)
              Write (0x08)
            Value Handle: 0x0120
            Value UUID: Bearer Signal Strength Reporting Interval (0x2bb8)
        Handle: 0x0121
        Value: 122201b92b
            Properties: 0x12
              Read (0x02)
              Notify (0x10)
            Value Handle: 0x0122
            Value UUID: Bearer List Current Calls (0x2bb9)
        Handle: 0x0124
        Value: 022501ba2b
            Properties: 0x02
              Read (0x02)
            Value Handle: 0x0125
            Value UUID: Content Control ID (0x2bba)
        Handle: 0x0126
        Value: 122701bc2b
            Properties: 0x12
              Read (0x02)
              Notify (0x10)
            Value Handle: 0x0127
            Value UUID: Incoming Call Target Bearer URI (0x2bbc)
        Handle: 0x0129
        Value: 122a01bb2b
            Properties: 0x12
              Read (0x02)
              Notify (0x10)
            Value Handle: 0x012a
            Value UUID: Status Flags (0x2bbb)
        Handle: 0x012c
        Value: 122d01bd2b
            Properties: 0x12
              Read (0x02)
              Notify (0x10)
            Value Handle: 0x012d
            Value UUID: Call State (0x2bbd)
< HCI Command: Host Number of Com.. (0x03|0x0035) plen 5  #140 [hci1] 10.212628
        Num handles: 1
        Handle: 1170 Address: DF:A9:FF:F6:B1:1A (OUI DF-A9-FF)
        Count: 1
< HCI Command: Host Number of Com.. (0x03|0x0035) plen 5  #141 [hci1] 10.212862
        Num handles: 1
        Handle: 1170 Address: DF:A9:FF:F6:B1:1A (OUI DF-A9-FF)
        Count: 1
< HCI Command: Host Number of Com.. (0x03|0x0035) plen 5  #142 [hci1] 10.212952
        Num handles: 1
        Handle: 1170 Address: DF:A9:FF:F6:B1:1A (OUI DF-A9-FF)
        Count: 1
< ACL Data TX: Handle 1170 flags 0x00 dlen 11             #143 [hci1] 10.213104
      ATT: Read By Type Request (0x08) len 6
        Handle range: 0x012d-0xffff
        Attribute type: Characteristic (0x2803)
> HCI Event: Number of Completed Packets (0x13) plen 5    #144 [hci1] 10.271692
        Num handles: 1
        Handle: 1170 Address: DF:A9:FF:F6:B1:1A (OUI DF-A9-FF)
        Count: 1
        #143: len 11 (1 Kb/s)
        Latency: 58 msec (29-69 msec ~58 msec)
> ACL Data RX: Handle 1170 flags 0x02 dlen 27             #145 [hci1] 10.341923
> ACL Data RX: Handle 1170 flags 0x01 dlen 27             #146 [hci1] 10.342458
> ACL Data RX: Handle 1170 flags 0x01 dlen 8              #147 [hci1] 10.342849
      ATT: Read By Type Response (0x09) len 57
        Attribute data length: 7
        Attribute data list: 8 entries
        Handle: 0x012f
        Value: 1c3001be2b
            Properties: 0x1c
              Write Without Response (0x04)
              Write (0x08)
              Notify (0x10)
            Value Handle: 0x0130
            Value UUID: Call Control Point (0x2bbe)
        Handle: 0x0132
        Value: 103301c02b
            Properties: 0x10
              Notify (0x10)
            Value Handle: 0x0133
            Value UUID: Termination Reason (0x2bc0)
        Handle: 0x0135
        Value: 123601c12b
            Properties: 0x12
              Read (0x02)
              Notify (0x10)
            Value Handle: 0x0136
            Value UUID: Incoming Call (0x2bc1)
        Handle: 0x0138
        Value: 123901c22b
            Properties: 0x12
              Read (0x02)
              Notify (0x10)
            Value Handle: 0x0139
            Value UUID: Call Friendly Name (0x2bc2)
        Handle: 0x013b
        Value: 023c01bf2b
            Properties: 0x02
              Read (0x02)
            Value Handle: 0x013c
            Value UUID: Call Control Point Optional Opcodes (0x2bbf)
        Handle: 0x0171
        Value: 127201c92b
            Properties: 0x12
              Read (0x02)
              Notify (0x10)
            Value Handle: 0x0172
            Value UUID: Sink PAC (0x2bc9)
        Handle: 0x0174
        Value: 1a7501ca2b
            Properties: 0x1a
              Read (0x02)
              Write (0x08)
              Notify (0x10)
            Value Handle: 0x0175
            Value UUID: Sink Audio Locations (0x2bca)
        Handle: 0x0177
        Value: 127801cb2b
            Properties: 0x12
              Read (0x02)
              Notify (0x10)
            Value Handle: 0x0178
            Value UUID: Source PAC (0x2bcb)
< HCI Command: Host Number of Com.. (0x03|0x0035) plen 5  #148 [hci1] 10.352467
        Num handles: 1
        Handle: 1170 Address: DF:A9:FF:F6:B1:1A (OUI DF-A9-FF)
        Count: 1
< HCI Command: Host Number of Com.. (0x03|0x0035) plen 5  #149 [hci1] 10.352624
        Num handles: 1
        Handle: 1170 Address: DF:A9:FF:F6:B1:1A (OUI DF-A9-FF)
        Count: 1
< HCI Command: Host Number of Com.. (0x03|0x0035) plen 5  #150 [hci1] 10.352703
        Num handles: 1
        Handle: 1170 Address: DF:A9:FF:F6:B1:1A (OUI DF-A9-FF)
        Count: 1
< ACL Data TX: Handle 1170 flags 0x00 dlen 7              #151 [hci1] 10.352744
      ATT: Read Request (0x0a) len 2
        Handle: 0x0172
> HCI Event: Number of Completed Packets (0x13) plen 5    #152 [hci1] 10.411662
        Num handles: 1
        Handle: 1170 Address: DF:A9:FF:F6:B1:1A (OUI DF-A9-FF)
        Count: 1
        #151: len 7 (0 Kb/s)
        Latency: 58 msec (29-69 msec ~58 msec)
> ACL Data RX: Handle 1170 flags 0x02 dlen 27             #153 [hci1] 10.481947
> ACL Data RX: Handle 1170 flags 0x01 dlen 6              #154 [hci1] 10.482288
      ATT: Read Response (0x0b) len 28
< HCI Command: Host Number of Com.. (0x03|0x0035) plen 5  #155 [hci1] 10.492702
        Num handles: 1
        Handle: 1170 Address: DF:A9:FF:F6:B1:1A (OUI DF-A9-FF)
        Count: 1
< HCI Command: Host Number of Com.. (0x03|0x0035) plen 5  #156 [hci1] 10.494569
        Num handles: 1
        Handle: 1170 Address: DF:A9:FF:F6:B1:1A (OUI DF-A9-FF)
        Count: 1
< ACL Data TX: Handle 1170 flags 0x00 dlen 11             #157 [hci1] 10.494735
      ATT: Read By Type Request (0x08) len 6
        Handle range: 0x0001-0xffff
        Attribute type: Characteristic (0x2803)
> HCI Event: Number of Completed Packets (0x13) plen 5    #158 [hci1] 10.551775
        Num handles: 1
        Handle: 1170 Address: DF:A9:FF:F6:B1:1A (OUI DF-A9-FF)
        Count: 1
        #157: len 11 (1 Kb/s)
        Latency: 57 msec (29-69 msec ~57 msec)
> ACL Data RX: Handle 1170 flags 0x02 dlen 27             #159 [hci1] 10.621863
> ACL Data RX: Handle 1170 flags 0x01 dlen 27             #160 [hci1] 10.622426
> ACL Data RX: Handle 1170 flags 0x01 dlen 8              #161 [hci1] 10.622824
      ATT: Read By Type Response (0x09) len 57
        Attribute data length: 7
        Attribute data list: 8 entries
        Handle: 0x0002
        Value: 0a0300002a
            Properties: 0x0a
              Read (0x02)
              Write (0x08)
            Value Handle: 0x0003
            Value UUID: Device Name (0x2a00)
        Handle: 0x0004
        Value: 0a0500012a
            Properties: 0x0a
              Read (0x02)
              Write (0x08)
            Value Handle: 0x0005
            Value UUID: Appearance (0x2a01)
        Handle: 0x0006
        Value: 4e07000945
            Properties: 0x4e
              Read (0x02)
              Write Without Response (0x04)
              Write (0x08)
              Authorize (0x40)
              Extended Properties (0x80)
            Value Handle: 0x0007
            Value UUID: Unknown (0x4509)
        Handle: 0x0008
        Value: 020900042a
            Properties: 0x02
              Read (0x02)
            Value Handle: 0x0009
            Value UUID: Peripheral Preferred Connection Parameters (0x2a04)
        Handle: 0x000a
        Value: 120b00192a
            Properties: 0x12
              Read (0x02)
              Notify (0x10)
            Value Handle: 0x000b
            Value UUID: Battery Level (0x2a19)
        Handle: 0x000e
        Value: 020f00a62a
            Properties: 0x02
              Read (0x02)
            Value Handle: 0x000f
            Value UUID: Central Address Resolution (0x2aa6)
        Handle: 0x0041
        Value: 204200052a
            Properties: 0x20
              Indicate (0x20)
            Value Handle: 0x0042
            Value UUID: Service Changed (0x2a05)
        Handle: 0x0044
        Value: 0a4500292b
            Properties: 0x0a
              Read (0x02)
              Write (0x08)
            Value Handle: 0x0045
            Value UUID: Client Supported Features (0x2b29)
< HCI Command: Host Number of Com.. (0x03|0x0035) plen 5  #162 [hci1] 10.632743
        Num handles: 1
        Handle: 1170 Address: DF:A9:FF:F6:B1:1A (OUI DF-A9-FF)
        Count: 1
< HCI Command: Host Number of Com.. (0x03|0x0035) plen 5  #163 [hci1] 10.633022
        Num handles: 1
        Handle: 1170 Address: DF:A9:FF:F6:B1:1A (OUI DF-A9-FF)
        Count: 1
< HCI Command: Host Number of Com.. (0x03|0x0035) plen 5  #164 [hci1] 10.633069
        Num handles: 1
        Handle: 1170 Address: DF:A9:FF:F6:B1:1A (OUI DF-A9-FF)
        Count: 1
< ACL Data TX: Handle 1170 flags 0x00 dlen 11             #165 [hci1] 10.633338
      ATT: Read By Type Request (0x08) len 6
        Handle range: 0x0045-0xffff
        Attribute type: Characteristic (0x2803)
> HCI Event: Number of Completed Packets (0x13) plen 5    #166 [hci1] 10.691652
        Num handles: 1
        Handle: 1170 Address: DF:A9:FF:F6:B1:1A (OUI DF-A9-FF)
        Count: 1
        #165: len 11 (1 Kb/s)
        Latency: 58 msec (29-69 msec ~58 msec)
> ACL Data RX: Handle 1170 flags 0x02 dlen 27             #167 [hci1] 10.761948
> ACL Data RX: Handle 1170 flags 0x01 dlen 27             #168 [hci1] 10.762484
> ACL Data RX: Handle 1170 flags 0x01 dlen 8              #169 [hci1] 10.762850
      ATT: Read By Type Response (0x09) len 57
        Attribute data length: 7
        Attribute data list: 8 entries
        Handle: 0x0046
        Value: 0247003a2b
            Properties: 0x02
              Read (0x02)
            Value Handle: 0x0047
            Value UUID: Server Supported Features (0x2b3a)
        Handle: 0x0081
        Value: 0282000945
            Properties: 0x02
              Read (0x02)
            Value Handle: 0x0082
            Value UUID: Unknown (0x4509)
        Handle: 0x0083
        Value: 028400232a
            Properties: 0x02
              Read (0x02)
            Value Handle: 0x0084
            Value UUID: System ID (0x2a23)
        Handle: 0x0085
        Value: 028600242a
            Properties: 0x02
              Read (0x02)
            Value Handle: 0x0086
            Value UUID: Model Number String (0x2a24)
        Handle: 0x0087
        Value: 028800252a
            Properties: 0x02
              Read (0x02)
            Value Handle: 0x0088
            Value UUID: Serial Number String (0x2a25)
        Handle: 0x0089
        Value: 028a00262a
            Properties: 0x02
              Read (0x02)
            Value Handle: 0x008a
            Value UUID: Firmware Revision String (0x2a26)
        Handle: 0x008b
        Value: 028c00272a
            Properties: 0x02
              Read (0x02)
            Value Handle: 0x008c
            Value UUID: Hardware Revision String (0x2a27)
        Handle: 0x008d
        Value: 028e00282a
            Properties: 0x02
              Read (0x02)
            Value Handle: 0x008e
            Value UUID: Software Revision String (0x2a28)
< HCI Command: Host Number of Com.. (0x03|0x0035) plen 5  #170 [hci1] 10.772784
        Num handles: 1
        Handle: 1170 Address: DF:A9:FF:F6:B1:1A (OUI DF-A9-FF)
        Count: 1
< HCI Command: Host Number of Com.. (0x03|0x0035) plen 5  #171 [hci1] 10.773060
        Num handles: 1
        Handle: 1170 Address: DF:A9:FF:F6:B1:1A (OUI DF-A9-FF)
        Count: 1
< HCI Command: Host Number of Com.. (0x03|0x0035) plen 5  #172 [hci1] 10.773107
        Num handles: 1
        Handle: 1170 Address: DF:A9:FF:F6:B1:1A (OUI DF-A9-FF)
        Count: 1
< ACL Data TX: Handle 1170 flags 0x00 dlen 11             #173 [hci1] 10.773321
      ATT: Read By Type Request (0x08) len 6
        Handle range: 0x008e-0xffff
        Attribute type: Characteristic (0x2803)
> HCI Event: Number of Completed Packets (0x13) plen 5    #174 [hci1] 10.831816
        Num handles: 1
        Handle: 1170 Address: DF:A9:FF:F6:B1:1A (OUI DF-A9-FF)
        Count: 1
        #173: len 11 (1 Kb/s)
        Latency: 58 msec (29-69 msec ~58 msec)
> ACL Data RX: Handle 1170 flags 0x02 dlen 27             #175 [hci1] 10.902006
> ACL Data RX: Handle 1170 flags 0x01 dlen 27             #176 [hci1] 10.902445
> ACL Data RX: Handle 1170 flags 0x01 dlen 8              #177 [hci1] 10.902778
      ATT: Read By Type Response (0x09) len 57
        Attribute data length: 7
        Attribute data list: 8 entries
        Handle: 0x008f
        Value: 029000292a
            Properties: 0x02
              Read (0x02)
            Value Handle: 0x0090
            Value UUID: Manufacturer Name String (0x2a29)
        Handle: 0x0091
        Value: 0292002a2a
            Properties: 0x02
              Read (0x02)
            Value Handle: 0x0092
            Value UUID: IEEE 11073-20601 Regulatory Cert. Data List (0x2a2a)
        Handle: 0x0093
        Value: 029400502a
            Properties: 0x02
              Read (0x02)
            Value Handle: 0x0094
            Value UUID: PnP ID (0x2a50)
        Handle: 0x0095
        Value: 0296002234
            Properties: 0x02
              Read (0x02)
            Value Handle: 0x0096
            Value UUID: Unknown (0x3422)
        Handle: 0x0098
        Value: 029900ff2b
            Properties: 0x02
              Read (0x02)
            Value Handle: 0x0099
            Value UUID: Unknown (0x2bff)
        Handle: 0x00d1
        Value: 12d200b32b
            Properties: 0x12
              Read (0x02)
              Notify (0x10)
            Value Handle: 0x00d2
            Value UUID: Bearer Provider Name (0x2bb3)
        Handle: 0x00d4
        Value: 02d500b42b
            Properties: 0x02
              Read (0x02)
            Value Handle: 0x00d5
            Value UUID: Bearer UCI (0x2bb4)
        Handle: 0x00d6
        Value: 12d700b52b
            Properties: 0x12
              Read (0x02)
              Notify (0x10)
            Value Handle: 0x00d7
            Value UUID: Bearer Technology (0x2bb5)
