Bluetooth monitor ver 5.72
= Note: Linux version 7.0.0-31-generic (x86_64)                        0.010881
= Note: Bluetooth subsystem version 2.22                               0.010883
= New Index: 00:00:00:00:00:00 (Primary,UART,hci1)              [hci1] 0.010884
= New Index: 48:5F:99:8E:E0:64 (Primary,USB,hci0)               [hci0] 0.010884
= Open Index: 00:00:00:00:00:00                                 [hci1] 0.143871
= Index Info: 00:00:00:00:00:00 (Nordic Semiconductor ASA)      [hci1] 0.143876
@ USER Open: main (privileged) version 2.22            {0x0001} [hci1] 0.143879
< HCI Command: Reset (0x03|0x0003) plen 0                    #1 [hci1] 0.144225
> HCI Event: Command Complete (0x0e) plen 4                  #2 [hci1] 0.144803
      Reset (0x03|0x0003) ncmd 1
        Status: Success (0x00)
< HCI Command: Read Local Supported... (0x04|0x0003) plen 0  #3 [hci1] 0.163867
> HCI Event: Command Complete (0x0e) plen 12                 #4 [hci1] 0.164311
      Read Local Supported Features (0x04|0x0003) ncmd 1
        Status: Success (0x00)
        Features: 0x00 0x00 0x00 0x00 0x60 0x00 0x00 0x00
          BR/EDR Not Supported
          LE Supported (Controller)
< HCI Command: Read Local Version In.. (0x04|0x0001) plen 0  #5 [hci1] 0.183852
> HCI Event: Command Complete (0x0e) plen 12                 #6 [hci1] 0.184324
      Read Local Version Information (0x04|0x0001) ncmd 1
        Status: Success (0x00)
        HCI version: Reserved (0x11) - Revision 12345 (0x3039)
        LMP version: Reserved (0x11) - Subversion 12345 (0x3039)
        Manufacturer: Nordic Semiconductor ASA (89)
< HCI Command: Read Local Supported... (0x04|0x0002) plen 0  #7 [hci1] 0.203848
> HCI Event: Command Complete (0x0e) plen 68                 #8 [hci1] 0.204935
      Read Local Supported Commands (0x04|0x0002) ncmd 1
        Status: Success (0x00)
        Commands: 115 entries
          Disconnect (Octet 0 - Bit 5)
          Read Remote Version Information (Octet 2 - Bit 7)
          Set Event Mask (Octet 5 - Bit 6)
          Reset (Octet 5 - Bit 7)
          Read Connection Accept Timeout (Octet 7 - Bit 2)
          Write Connection Accept Timeout (Octet 7 - Bit 3)
          Read Transmit Power Level (Octet 10 - Bit 2)
          Set Controller To Host Flow Control (Octet 10 - Bit 5)
          Host Buffer Size (Octet 10 - Bit 6)
          Host Number of Completed Packets (Octet 10 - Bit 7)
          Read Local Version Information (Octet 14 - Bit 3)
          Read Local Supported Features (Octet 14 - Bit 5)
          Read BD ADDR (Octet 15 - Bit 1)
          Read RSSI (Octet 15 - Bit 5)
          Set Event Mask Page 2 (Octet 22 - Bit 2)
          LE Set Event Mask (Octet 25 - Bit 0)
          LE Read Buffer Size (Octet 25 - Bit 1)
          LE Read Local Supported Features (Octet 25 - Bit 2)
          LE Set Random Address (Octet 25 - Bit 4)
          LE Set Advertising Parameters (Octet 25 - Bit 5)
          LE Read Advertising Channel TX Power (Octet 25 - Bit 6)
          LE Set Advertising Data (Octet 25 - Bit 7)
          LE Set Scan Response Data (Octet 26 - Bit 0)
          LE Set Advertise Enable (Octet 26 - Bit 1)
          LE Set Scan Parameters (Octet 26 - Bit 2)
          LE Set Scan Enable (Octet 26 - Bit 3)
          LE Create Connection (Octet 26 - Bit 4)
          LE Create Connection Cancel (Octet 26 - Bit 5)
          LE Read Accept List Size (Octet 26 - Bit 6)
          LE Clear Accept List (Octet 26 - Bit 7)
          LE Add Device To Accept List (Octet 27 - Bit 0)
          LE Remove Device From Accept List (Octet 27 - Bit 1)
          LE Connection Update (Octet 27 - Bit 2)
          LE Set Host Channel Classification (Octet 27 - Bit 3)
          LE Read Channel Map (Octet 27 - Bit 4)
          LE Read Remote Used Features (Octet 27 - Bit 5)
          LE Encrypt (Octet 27 - Bit 6)
          LE Rand (Octet 27 - Bit 7)
          LE Start Encryption (Octet 28 - Bit 0)
          LE Long Term Key Request Reply (Octet 28 - Bit 1)
          LE Long Term Key Request Neg Reply (Octet 28 - Bit 2)
          LE Read Supported States (Octet 28 - Bit 3)
          Read Authenticated Payload Timeout (Octet 32 - Bit 4)
          Write Authenticated Payload Timeout (Octet 32 - Bit 5)
          LE Set Data Length (Octet 33 - Bit 6)
          LE Read Suggested Default Data Length (Octet 33 - Bit 7)
          LE Write Suggested Default Data Length (Octet 34 - Bit 0)
          LE Add Device To Resolving List (Octet 34 - Bit 3)
          LE Remove Device From Resolving List (Octet 34 - Bit 4)
          LE Clear Resolving List (Octet 34 - Bit 5)
          LE Read Resolving List Size (Octet 34 - Bit 6)
          LE Set Address Resolution Enable (Octet 35 - Bit 1)
          LE Set Resolvable Private Address Timeout (Octet 35 - Bit 2)
          LE Read Maximum Data Length (Octet 35 - Bit 3)
          LE Read PHY (Octet 35 - Bit 4)
          LE Set Default PHY (Octet 35 - Bit 5)
          LE Set PHY (Octet 35 - Bit 6)
          LE Set Advertising Set Random Address (Octet 36 - Bit 1)
          LE Set Extended Advertising Parameters (Octet 36 - Bit 2)
          LE Set Extended Advertising Data (Octet 36 - Bit 3)
          LE Set Extended Scan Response Data (Octet 36 - Bit 4)
          LE Set Extended Advertising Enable (Octet 36 - Bit 5)
          LE Read Maximum Advertising Data Length (Octet 36 - Bit 6)
          LE Read Number of Supported Advertising Sets (Octet 36 - Bit 7)
          LE Remove Advertising Set (Octet 37 - Bit 0)
          LE Clear Advertising Sets (Octet 37 - Bit 1)
          LE Set Periodic Advertising Parameters (Octet 37 - Bit 2)
          LE Set Periodic Advertising Data (Octet 37 - Bit 3)
          LE Set Periodic Advertising Enable (Octet 37 - Bit 4)
          LE Set Extended Scan Parameters (Octet 37 - Bit 5)
          LE Set Extended Scan Enable (Octet 37 - Bit 6)
          LE Extended Create Connection (Octet 37 - Bit 7)
          LE Periodic Advertising Create Sync (Octet 38 - Bit 0)
          LE Periodic Advertising Create Sync Cancel (Octet 38 - Bit 1)
          LE Periodic Advertising Terminate Sync (Octet 38 - Bit 2)
          LE Add Device To Periodic Advertiser List (Octet 38 - Bit 3)
          LE Remove Device From Periodic Advertiser List (Octet 38 - Bit 4)
          LE Clear Periodic Advertiser List (Octet 38 - Bit 5)
          LE Read Periodic Advertiser List Size (Octet 38 - Bit 6)
          LE Read Transmit Power (Octet 38 - Bit 7)
          LE Read RF Path Compensation (Octet 39 - Bit 0)
          LE Write RF Path Compensation (Octet 39 - Bit 1)
          LE Set Privacy Mode (Octet 39 - Bit 2)
          LE Periodic Advertising Receive Enable (Octet 40 - Bit 5)
          LE Periodic Advertising Sync Transfer (Octet 40 - Bit 6)
          LE Periodic Advertising Set Info Transfer (Octet 40 - Bit 7)
          LE Periodic Advertising Sync Transfer Parameters (Octet 41 - Bit 0)
          LE Set Default Periodic Advertisng Sync Transfer Parameters (Octet 41 - Bit 1)
          LE Read Buffer v2 (Octet 41 - Bit 5)
          LE Read ISO TX Sync (Octet 41 - Bit 6)
          LE Set Connected Isochronous Group Parameters (Octet 41 - Bit 7)
          LE Set Connected Isochronous Group Parameters Test (Octet 42 - Bit 0)
          LE Create Connected Isochronous Stream (Octet 42 - Bit 1)
          LE Remove Connected Isochronous Group (Octet 42 - Bit 2)
          LE Accept Connected Isochronous Stream Request (Octet 42 - Bit 3)
          LE Reject Connected Isochronous Stream Request (Octet 42 - Bit 4)
          LE Create Broadcast Isochronous Group (Octet 42 - Bit 5)
          LE Create Broadcast Isochronous Group Test (Octet 42 - Bit 6)
          LE Terminate Broadcast Isochronous Group (Octet 42 - Bit 7)
          LE Broadcast Isochronous Group Create Sync (Octet 43 - Bit 0)
          LE Broadcast Isochronous Group Terminate Sync (Octet 43 - Bit 1)
          LE Request Peer SCA (Octet 43 - Bit 2)
          LE Setup Isochronous Data Path (Octet 43 - Bit 3)
          LE Remove Isochronous Data Path (Octet 43 - Bit 4)
          LE Isochronous Transmit Test (Octet 43 - Bit 5)
          LE Isochronous Receive Test (Octet 43 - Bit 6)
          LE Isochronous Read Test Counters (Octet 43 - Bit 7)
          LE Isochronous Read Test Counters (Octet 44 - Bit 0)
          LE Set Host Feature (Octet 44 - Bit 1)
          Octet 44 - Bit 2 
          Octet 45 - Bit 6 
          Octet 46 - Bit 0 
          Octet 46 - Bit 1 
          Octet 46 - Bit 2 
          Octet 47 - Bit 4 
< HCI Command: Host Buffer Size (0x03|0x0033) plen 7         #9 [hci1] 0.223865
        ACL MTU: 255  ACL max packet: 16
        SCO MTU: 0    SCO max packet: 0
> HCI Event: Command Complete (0x0e) plen 4                 #10 [hci1] 0.224366
      Host Buffer Size (0x03|0x0033) ncmd 1
        Status: Success (0x00)
< HCI Command: Set Controller To Ho.. (0x03|0x0031) plen 1  #11 [hci1] 0.243856
        Flow control: ACL Data Packets (0x01)
> HCI Event: Command Complete (0x0e) plen 4                 #12 [hci1] 0.244330
      Set Controller To Host Flow Control (0x03|0x0031) ncmd 1
        Status: Success (0x00)
< HCI Command: LE Read Local Suppor.. (0x08|0x0003) plen 0  #13 [hci1] 0.263864
> HCI Event: Command Complete (0x0e) plen 12                #14 [hci1] 0.264329
      LE Read Local Supported Features (0x08|0x0003) ncmd 1
        Status: Success (0x00)
        Features: 0xfd 0x79 0x00 0xf7 0x30 0x01 0x00 0x00
          LE Encryption
          Extended Reject Indication
          Peripheral-initiated Features Exchange
          LE Ping
          LE Data Packet Length Extension
          LL Privacy
          Extended Scanner Filter Policies
          LE 2M PHY
          LE Coded PHY
          LE Extended Advertising
          LE Periodic Advertising
          Channel Selection Algorithm #2
          Periodic Advertising Sync Transfer - Sender
          Periodic Advertising Sync Transfer - Recipient
          Sleep Clock Accuracy Updates
          Connected Isochronous Stream - Central
          Connected Isochronous Stream - Peripheral
          Isochronous Broadcaster
          Synchronized Receiver
          Periodic Advertising ADI support
          Connection Subrating
          Unknown features (0x0000010000000000)
< HCI Command: LE Set Host Feature (0x08|0x0074) plen 2     #15 [hci1] 0.283873
        Bit Number: 32
          Connected Isochronous Stream (Host Support)
        Bit Value: 1
> HCI Event: Command Complete (0x0e) plen 4                 #16 [hci1] 0.284382
      LE Set Host Feature (0x08|0x0074) ncmd 1
        Status: Success (0x00)
< HCI Command: LE Read Buffer v2 (0x08|0x0060) plen 0       #17 [hci1] 0.303824
> HCI Event: Command Complete (0x0e) plen 10                #18 [hci1] 0.304320
      LE Read Buffer v2 (0x08|0x0060) ncmd 1
        Status: Success (0x00)
        ACL MTU: 27
        ACL max packet: 3
        ISO MTU: 318
        ISO max packet: 3
< HCI Command: LE Read Maximum Adve.. (0x08|0x003a) plen 0  #19 [hci1] 0.323887
> HCI Event: Command Complete (0x0e) plen 6                 #20 [hci1] 0.324226
      LE Read Maximum Advertising Data Length (0x08|0x003a) ncmd 1
        Status: Success (0x00)
        Max length: 1650
< HCI Command: LE Read Supported St.. (0x08|0x001c) plen 0  #21 [hci1] 0.343847
> HCI Event: Command Complete (0x0e) plen 12                #22 [hci1] 0.344267
      LE Read Supported States (0x08|0x001c) ncmd 1
        Status: Success (0x00)
        States: 0x000003ff3e0306ff
          Non-connectable Advertising State
          Scannable Advertising State
          Connectable Advertising State
          High Duty Cycle Directed Advertising State
          Passive Scanning State
          Active Scanning State
          Initiating State
            and Connection State (Central Role)
          Connection State (Peripheral Role)
          Scannable Advertising State
            and Passive Scanning State
          Connectable Advertising State
            and Passive Scanning State
          Non-connectable Advertising State
            and Initiating State
          Scannable Advertising State
            and Initiating State
          Active Scanning State
            and Connection State (Central Role)
          Passive Scanning State
            and Connection State (Peripheral Role)
          Active Scanning State
            and Connection State (Peripheral Role)
          Initiating State
            and Connection State (Central Role)
            and Central Role & Central Role
          Low Duty Cycle Directed Advertising State
          Connectable Advertising State
            and Initiating State
            and Central Role & Peripheral Role
          High Duty Cycle Directed Advertising State
            and Initiating State
            and Central Role & Peripheral Role
          Low Duty Cycle Directed Advertising State
            and Initiating State
            and Central Role & Peripheral Role
          Connectable Advertising State
            and Connection State (Central Role)
            and Central Role & Peripheral Role
          High Duty Cycle Directed Advertising State
            and Connection State (Central Role)
            and Central Role & Peripheral Role
          Low Duty Cycle Directed Advertising State
            and Connection State (Central Role)
            and Central Role & Peripheral Role
          Connectable Advertising State
            and Connection State (Peripheral Role)
            and Central Role & Peripheral Role
          High Duty Cycle Directed Advertising State
            and Connection State (Peripheral Role)
            and Peripheral Role & Peripheral Role
          Low Duty Cycle Directed Advertising State
            and Connection State (Peripheral Role)
            and Peripheral Role & Peripheral Role
          Initiating State
            and Connection State (Peripheral Role)
            and Central Role & Peripheral Role
< HCI Command: LE Read Maximum Data.. (0x08|0x002f) plen 0  #23 [hci1] 0.363860
> HCI Event: Command Complete (0x0e) plen 12                #24 [hci1] 0.364392
      LE Read Maximum Data Length (0x08|0x002f) ncmd 1
        Status: Success (0x00)
        Max TX octets: 251
        Max TX time: 2704
        Max RX octets: 251
        Max RX time: 2704
< HCI Command: LE Write Suggested D.. (0x08|0x0024) plen 4  #25 [hci1] 0.383773
        TX octets: 251
        TX time: 2704
> HCI Event: Command Complete (0x0e) plen 4                 #26 [hci1] 0.384267
      LE Write Suggested Default Data Length (0x08|0x0024) ncmd 1
        Status: Success (0x00)
< HCI Command: LE Set Resolvable Pr.. (0x08|0x002e) plen 2  #27 [hci1] 0.403859
        Timeout: 30 seconds
> HCI Event: Command Complete (0x0e) plen 4                 #28 [hci1] 0.404265
      LE Set Resolvable Private Address Timeout (0x08|0x002e) ncmd 1
        Status: Success (0x00)
< HCI Command: LE Read Resolving Li.. (0x08|0x002a) plen 0  #29 [hci1] 0.423853
> HCI Event: Command Complete (0x0e) plen 5                 #30 [hci1] 0.424273
      LE Read Resolving List Size (0x08|0x002a) ncmd 1
        Status: Success (0x00)
        Size: 8
< HCI Command: LE Set Host Feature (0x08|0x0074) plen 2     #31 [hci1] 0.443857
        Bit Number: 38
          Connection Subrating (Host Support)
        Bit Value: 1
> HCI Event: Command Complete (0x0e) plen 4                 #32 [hci1] 0.444270
      LE Set Host Feature (0x08|0x0074) ncmd 1
        Status: Success (0x00)
< HCI Command: LE Set Event Mask (0x08|0x0001) plen 8       #33 [hci1] 0.463855
        Mask: 0x000002063f87fa5e
          LE Advertising Report
          LE Connection Update Complete
          LE Read Remote Used Features Complete
          LE Long Term Key Request
          LE Data Length Change
          LE Enhanced Connection Complete
          LE PHY Update Complete
          LE Extended Advertising Report
          LE Periodic Advertising Sync Established
          LE Periodic Advertising Report
          LE Periodic Advertising Sync Lost
          LE Extended Scan Timeout
          LE Extended Advertising Set Terminated
          LE Scan Request Received
          LE Periodic Advertising Sync Transfer Rvc
          LE CIS Established
          LE CIS Request
          LE Create BIG Complete
          LE Terminate BIG Complete
          LE BIG Sync Estabilished Complete
          LE BIG Sync Lost
          LE BIG Info Advertising Report
          LE Subrate Change
          Unknown mask (0x0000020000000000)
> HCI Event: Command Complete (0x0e) plen 4                 #34 [hci1] 0.464340
      LE Set Event Mask (0x08|0x0001) ncmd 1
        Status: Success (0x00)
< HCI Command: Set Event Mask (0x03|0x0001) plen 8          #35 [hci1] 0.483879
        Mask: 0x2000800002008890
          Disconnection Complete
          Encryption Change
          Read Remote Version Information Complete
          Hardware Error
          Data Buffer Overflow
          Encryption Key Refresh Complete
          LE Meta
> HCI Event: Command Complete (0x0e) plen 4                 #36 [hci1] 0.484361
      Set Event Mask (0x03|0x0001) ncmd 1
        Status: Success (0x00)
< HCI Command: Read BD ADDR (0x04|0x0009) plen 0            #37 [hci1] 0.503869
> HCI Event: Command Complete (0x0e) plen 10                #38 [hci1] 0.504315
      Read BD ADDR (0x04|0x0009) ncmd 1
        Status: Success (0x00)
        Address: 00:00:00:00:00:00 (OUI 00-00-00)
< HCI Command: LE Set Random Address (0x08|0x0005) plen 6   #39 [hci1] 0.523864
        Address: D5:B6:CC:31:DB:3B (Static)
> HCI Event: Command Complete (0x0e) plen 4                 #40 [hci1] 0.524329
      LE Set Random Address (0x08|0x0005) ncmd 1
        Status: Success (0x00)
< HCI Command: LE Set Random Address (0x08|0x0005) plen 6   #41 [hci1] 0.603905
        Address: 48:61:8E:DB:C6:F9 (Resolvable)
> HCI Event: Command Complete (0x0e) plen 4                 #42 [hci1] 0.604388
      LE Set Random Address (0x08|0x0005) ncmd 1
        Status: Success (0x00)
< HCI Command: LE Extended Create... (0x08|0x0043) plen 26  #43 [hci1] 6.024111
        Filter policy: Accept list is not used (0x00)
        Own address type: Random (0x03)
        Peer address type: Public (0x00)
        Peer address: DF:A9:FF:F6:B1:1A (OUI DF-A9-FF)
        Initiating PHYs: 0x01
        Entry 0: LE 1M
          Scan interval: 60.000 msec (0x0060)
          Scan window: 60.000 msec (0x0060)
          Min connection interval: 50.00 msec (0x0028)
          Max connection interval: 70.00 msec (0x0038)
          Connection latency: 0 (0x0000)
          Supervision timeout: 4000 msec (0x0190)
          Min connection length: 0.000 msec (0x0000)
          Max connection length: 0.000 msec (0x0000)
> HCI Event: Command Status (0x0f) plen 4                   #44 [hci1] 6.025030
      LE Extended Create Connection (0x08|0x0043) ncmd 1
        Status: Success (0x00)
> HCI Event: LE Meta Event (0x3e) plen 31                   #45 [hci1] 6.087609
      LE Enhanced Connection Complete (0x0a)
        Status: Success (0x00)
        Handle: 1710
        Role: Central (0x00)
        Peer address type: Public (0x00)
        Peer address: DF:A9:FF:F6:B1:1A (OUI DF-A9-FF)
        Local resolvable private address: 48:61:8E:DB:C6:F9 (Resolvable)
        Peer resolvable private address: 00:00:00:00:00:00 (Non-Resolvable)
        Connection interval: 70.00 msec (0x0038)
        Connection latency: 0 (0x0000)
        Supervision timeout: 4000 msec (0x0190)
        Central clock accuracy: 0x00
< HCI Command: LE Read Remote Used... (0x08|0x0016) plen 2  #46 [hci1] 6.104145
        Handle: 1710 Address: DF:A9:FF:F6:B1:1A (OUI DF-A9-FF)
< ACL Data TX: Handle 1710 flags 0x00 dlen 7                #47 [hci1] 6.104157
      ATT: Exchange MTU Request (0x02) len 2
        Client RX MTU: 251
> HCI Event: Command Status (0x0f) plen 4                   #48 [hci1] 6.104714
      LE Read Remote Used Features (0x08|0x0016) ncmd 1
        Status: Success (0x00)
< HCI Command: LE Set PHY (0x08|0x0032) plen 7              #49 [hci1] 6.124122
        Handle: 1710 Address: DF:A9:FF:F6:B1:1A (OUI DF-A9-FF)
        All PHYs preference: 0x00
        TX PHYs preference: 0x02
          LE 2M
        RX PHYs preference: 0x02
          LE 2M
        PHY options preference: Reserved (0x0000)
> HCI Event: Command Status (0x0f) plen 4                   #50 [hci1] 6.124658
      LE Set PHY (0x08|0x0032) ncmd 1
        Status: Success (0x00)
> HCI Event: Number of Completed Packets (0x13) plen 5      #51 [hci1] 6.159914
        Num handles: 1
        Handle: 1710 Address: DF:A9:FF:F6:B1:1A (OUI DF-A9-FF)
        Count: 1
        #47: len 7 (1 Kb/s)
        Latency: 55 msec (55-55 msec ~55 msec)
> HCI Event: LE Meta Event (0x3e) plen 12                   #52 [hci1] 6.299973
      LE Read Remote Used Features (0x04)
        Status: Success (0x00)
        Handle: 1710 Address: DF:A9:FF:F6:B1:1A (OUI DF-A9-FF)
        Features: 0x2d 0x49 0x00 0xf7 0x67 0xd9 0x00 0x80
          LE Encryption
          Extended Reject Indication
          Peripheral-initiated Features Exchange
          LE Data Packet Length Extension
          LE 2M PHY
          LE Coded PHY
          Channel Selection Algorithm #2
          Periodic Advertising Sync Transfer - Sender
          Periodic Advertising Sync Transfer - Recipient
          Sleep Clock Accuracy Updates
          Connected Isochronous Stream - Central
          Connected Isochronous Stream - Peripheral
          Isochronous Broadcaster
          Synchronized Receiver
          Connected Isochronous Stream (Host Support)
          LE Power Control Request
          LE Power Control Request
          Connection Subrating
          Connection Subrating (Host Support)
          Unknown features (0x8000d90000000000)
> HCI Event: LE Meta Event (0x3e) plen 6                    #53 [hci1] 6.929403
      LE PHY Update Complete (0x0c)
        Status: Success (0x00)
        Handle: 1710 Address: DF:A9:FF:F6:B1:1A (OUI DF-A9-FF)
        TX PHY: LE 2M (0x02)
        RX PHY: LE 2M (0x02)
> ACL Data RX: Handle 1710 flags 0x02 dlen 6                #54 [hci1] 7.139827
      SMP: Security Request (0x0b) len 1
        Authentication requirement: Bonding, No MITM, SC, No Keypresses (0x09)
< HCI Command: Host Number of Compl.. (0x03|0x0035) plen 5  #55 [hci1] 7.144007
        Num handles: 1
        Handle: 1710 Address: DF:A9:FF:F6:B1:1A (OUI DF-A9-FF)
        Count: 1
< ACL Data TX: Handle 1710 flags 0x00 dlen 11               #56 [hci1] 7.144015
      SMP: Pairing Request (0x01) len 6
        IO capability: NoInputNoOutput (0x03)
        OOB data: Authentication data not present (0x00)
        Authentication requirement: Bonding, No MITM, SC, No Keypresses (0x09)
        Max encryption key size: 16
        Initiator key distribution: EncKey IdKey (0x03)
        Responder key distribution: EncKey IdKey (0x03)
> ACL Data RX: Handle 1710 flags 0x02 dlen 7                #57 [hci1] 7.209733
      ATT: Exchange MTU Response (0x03) len 2
        Server RX MTU: 23
> HCI Event: Number of Completed Packets (0x13) plen 5      #58 [hci1] 7.210193
        Num handles: 1
        Handle: 1710 Address: DF:A9:FF:F6:B1:1A (OUI DF-A9-FF)
        Count: 1
        #56: len 11 (1 Kb/s)
        Latency: 66 msec (55-66 msec ~60 msec)
< HCI Command: Host Number of Compl.. (0x03|0x0035) plen 5  #59 [hci1] 7.224047
        Num handles: 1
        Handle: 1710 Address: DF:A9:FF:F6:B1:1A (OUI DF-A9-FF)
        Count: 1
> ACL Data RX: Handle 1710 flags 0x02 dlen 11               #60 [hci1] 7.279846
      SMP: Pairing Response (0x02) len 6
        IO capability: KeyboardDisplay (0x04)
        OOB data: Authentication data not present (0x00)
        Authentication requirement: Bonding, No MITM, SC, No Keypresses (0x09)
        Max encryption key size: 16
        Initiator key distribution: EncKey IdKey (0x03)
        Responder key distribution: EncKey IdKey (0x03)
< HCI Command: Host Number of Compl.. (0x03|0x0035) plen 5  #61 [hci1] 7.284061
        Num handles: 1
        Handle: 1710 Address: DF:A9:FF:F6:B1:1A (OUI DF-A9-FF)
        Count: 1
< ACL Data TX: Handle 1710 flags 0x00 dlen 27               #62 [hci1] 7.284169
< ACL Data TX: Handle 1710 flags 0x01 dlen 27               #63 [hci1] 7.284188
< ACL Data TX: Handle 1710 flags 0x01 dlen 15               #64 [hci1] 7.284191
      SMP: Pairing Public Key (0x0c) len 64
        X: 68f6ada634ce84d11617383d57f070fe3445c38b33b569efa5eb771a0dc8aea5
        Y: 83c407aaa8337331fdc418e55085d75e6c1c6e5d42f8bf9c18fb5a2a7d4f31aa
> HCI Event: Number of Completed Packets (0x13) plen 5      #65 [hci1] 7.349831
        Num handles: 1
        Handle: 1710 Address: DF:A9:FF:F6:B1:1A (OUI DF-A9-FF)
        Count: 1
        #62: len 27 (3 Kb/s)
        Latency: 65 msec (55-66 msec ~63 msec)
> HCI Event: Number of Completed Packets (0x13) plen 5      #66 [hci1] 7.350318
        Num handles: 1
        Handle: 1710 Address: DF:A9:FF:F6:B1:1A (OUI DF-A9-FF)
        Count: 1
        #63: len 27 (3 Kb/s)
        Latency: 66 msec (55-66 msec ~64 msec)
> HCI Event: Number of Completed Packets (0x13) plen 5      #67 [hci1] 7.350770
        Num handles: 1
        Handle: 1710 Address: DF:A9:FF:F6:B1:1A (OUI DF-A9-FF)
        Count: 1
        #64: len 15 (1 Kb/s)
        Latency: 66 msec (55-66 msec ~65 msec)
> ACL Data RX: Handle 1710 flags 0x02 dlen 27               #68 [hci1] 7.419970
> ACL Data RX: Handle 1710 flags 0x01 dlen 27               #69 [hci1] 7.420506
> ACL Data RX: Handle 1710 flags 0x01 dlen 15               #70 [hci1] 7.420878
      SMP: Pairing Public Key (0x0c) len 64
        X: b2d4484f42c1944514e1442baf543bd3176126958e90fa45db00ecc0dc435f4a
        Y: df85452b04002dd85fad0e7ac7eb611722692235abadf5bb813616465285e807
> ACL Data RX: Handle 1710 flags 0x02 dlen 21               #71 [hci1] 7.421451
      SMP: Pairing Confirm (0x03) len 16
        Confim value: 8a58e78b08ba25ff049b6ff984366efe
< HCI Command: Host Number of Compl.. (0x03|0x0035) plen 5  #72 [hci1] 7.424079
        Num handles: 1
        Handle: 1710 Address: DF:A9:FF:F6:B1:1A (OUI DF-A9-FF)
        Count: 1
< HCI Command: Host Number of Compl.. (0x03|0x0035) plen 5  #73 [hci1] 7.424100
        Num handles: 1
        Handle: 1710 Address: DF:A9:FF:F6:B1:1A (OUI DF-A9-FF)
        Count: 1
< HCI Command: Host Number of Compl.. (0x03|0x0035) plen 5  #74 [hci1] 7.424182
        Num handles: 1
        Handle: 1710 Address: DF:A9:FF:F6:B1:1A (OUI DF-A9-FF)
        Count: 1
< HCI Command: Host Number of Compl.. (0x03|0x0035) plen 5  #75 [hci1] 7.424287
        Num handles: 1
        Handle: 1710 Address: DF:A9:FF:F6:B1:1A (OUI DF-A9-FF)
        Count: 1
< ACL Data TX: Handle 1710 flags 0x00 dlen 21               #76 [hci1] 7.424354
      SMP: Pairing Random (0x04) len 16
        Random value: 555cc64d02679f89a05211af56d8b3da
> HCI Event: Number of Completed Packets (0x13) plen 5      #77 [hci1] 7.489761
        Num handles: 1
        Handle: 1710 Address: DF:A9:FF:F6:B1:1A (OUI DF-A9-FF)
        Count: 1
        #76: len 21 (2 Kb/s)
        Latency: 65 msec (55-66 msec ~65 msec)
> ACL Data RX: Handle 1710 flags 0x02 dlen 21               #78 [hci1] 7.559996
      SMP: Pairing Random (0x04) len 16
        Random value: dc87ba6f8a4017e90000000000000000
< HCI Command: Host Number of Compl.. (0x03|0x0035) plen 5  #79 [hci1] 7.564887
        Num handles: 1
        Handle: 1710 Address: DF:A9:FF:F6:B1:1A (OUI DF-A9-FF)
        Count: 1
< ACL Data TX: Handle 1710 flags 0x00 dlen 21               #80 [hci1] 7.564973
      SMP: Pairing DHKey Check (0x0d) len 16
        E: ee4293cde6c5b94c573523f6fb56a37f
> HCI Event: Number of Completed Packets (0x13) plen 5      #81 [hci1] 7.629885
        Num handles: 1
        Handle: 1710 Address: DF:A9:FF:F6:B1:1A (OUI DF-A9-FF)
        Count: 1
        #80: len 21 (2 Kb/s)
        Latency: 64 msec (55-66 msec ~65 msec)
> ACL Data RX: Handle 1710 flags 0x02 dlen 21               #82 [hci1] 7.839941
      SMP: Pairing DHKey Check (0x0d) len 16
        E: 3670c67db5cfd230f22dca738aaca0d4
< HCI Command: LE Start Encryption (0x08|0x0019) plen 28    #83 [hci1] 7.844085
        Handle: 1710 Address: DF:A9:FF:F6:B1:1A (OUI DF-A9-FF)
        Random number: 0x0000000000000000
        Encrypted diversifier: 0x0000
        Long term key: 822b2b315ae2abdcf252799781f402cf
> HCI Event: Command Status (0x0f) plen 4                   #84 [hci1] 7.844908
      LE Start Encryption (0x08|0x0019) ncmd 1
        Status: Success (0x00)
< HCI Command: Host Number of Compl.. (0x03|0x0035) plen 5  #85 [hci1] 7.863944
        Num handles: 1
        Handle: 1710 Address: DF:A9:FF:F6:B1:1A (OUI DF-A9-FF)
        Count: 1
> HCI Event: Encryption Change (0x08) plen 4                #86 [hci1] 8.329801
        Status: Success (0x00)
        Handle: 1710 Address: DF:A9:FF:F6:B1:1A (OUI DF-A9-FF)
        Encryption: Enabled with AES-CCM (0x01)
< HCI Command: LE Extended Create... (0x08|0x0043) plen 26  #87 [hci1] 8.364016
        Filter policy: Accept list is not used (0x00)
        Own address type: Random (0x03)
        Peer address type: Public (0x00)
        Peer address: 64:23:B5:94:C5:F1 (OUI 64-23-B5)
        Initiating PHYs: 0x01
        Entry 0: LE 1M
          Scan interval: 60.000 msec (0x0060)
          Scan window: 60.000 msec (0x0060)
          Min connection interval: 50.00 msec (0x0028)
          Max connection interval: 70.00 msec (0x0038)
          Connection latency: 0 (0x0000)
          Supervision timeout: 4000 msec (0x0190)
          Min connection length: 0.000 msec (0x0000)
          Max connection length: 0.000 msec (0x0000)
> HCI Event: Command Status (0x0f) plen 4                   #88 [hci1] 8.364877
      LE Extended Create Connection (0x08|0x0043) ncmd 1
        Status: Success (0x00)
> HCI Event: LE Meta Event (0x3e) plen 31                   #89 [hci1] 8.395899
      LE Enhanced Connection Complete (0x0a)
        Status: Success (0x00)
        Handle: 2719
        Role: Central (0x00)
        Peer address type: Public (0x00)
        Peer address: 64:23:B5:94:C5:F1 (OUI 64-23-B5)
        Local resolvable private address: 48:61:8E:DB:C6:F9 (Resolvable)
        Peer resolvable private address: 00:00:00:00:00:00 (Non-Resolvable)
        Connection interval: 70.00 msec (0x0038)
        Connection latency: 0 (0x0000)
        Supervision timeout: 4000 msec (0x0190)
        Central clock accuracy: 0x00
> ACL Data RX: Handle 1710 flags 0x02 dlen 21               #90 [hci1] 8.399946
      SMP: Identity Information (0x08) len 16
        Identity resolving key: e51752db81fdb2c000362553c7a3d3a9
< HCI Command: LE Read Remote Used... (0x08|0x0016) plen 2  #91 [hci1] 8.404077
        Handle: 2719 Address: 64:23:B5:94:C5:F1 (OUI 64-23-B5)
< ACL Data TX: Handle 2719 flags 0x00 dlen 7                #92 [hci1] 8.404085
      ATT: Exchange MTU Request (0x02) len 2
        Client RX MTU: 251
> HCI Event: Command Status (0x0f) plen 4                   #93 [hci1] 8.404508
      LE Read Remote Used Features (0x08|0x0016) ncmd 1
        Status: Success (0x00)
< HCI Command: LE Set PHY (0x08|0x0032) plen 7              #94 [hci1] 8.423986
        Handle: 2719 Address: 64:23:B5:94:C5:F1 (OUI 64-23-B5)
        All PHYs preference: 0x00
        TX PHYs preference: 0x02
          LE 2M
        RX PHYs preference: 0x02
          LE 2M
        PHY options preference: Reserved (0x0000)
> HCI Event: Command Status (0x0f) plen 4                   #95 [hci1] 8.424446
      LE Set PHY (0x08|0x0032) ncmd 1
        Status: Success (0x00)
> HCI Event: Number of Completed Packets (0x13) plen 5      #96 [hci1] 8.429879
        Num handles: 1
        Handle: 2719 Address: 64:23:B5:94:C5:F1 (OUI 64-23-B5)
        Count: 1
        #92: len 7 (2 Kb/s)
        Latency: 25 msec (25-25 msec ~25 msec)
< HCI Command: Host Number of Compl.. (0x03|0x0035) plen 5  #97 [hci1] 8.444039
        Num handles: 1
        Handle: 1710 Address: DF:A9:FF:F6:B1:1A (OUI DF-A9-FF)
        Count: 1
> ACL Data RX: Handle 1710 flags 0x02 dlen 12               #98 [hci1] 8.469832
      SMP: Identity Address Information (0x09) len 7
        Address: DF:A9:FF:F6:B1:1A (OUI DF-A9-FF)
< HCI Command: LE Add Device To Re.. (0x08|0x0027) plen 39  #99 [hci1] 8.484046
        Address type: Public (0x00)
        Address: DF:A9:FF:F6:B1:1A (OUI DF-A9-FF)
        Peer identity resolving key: e51752db81fdb2c000362553c7a3d3a9
        Local identity resolving key: 08aad2e1be87e47b88aeb19de6889efb
> HCI Event: Command Complete (0x0e) plen 4                #100 [hci1] 8.484956
      LE Add Device To Resolving List (0x08|0x0027) ncmd 1
        Status: Success (0x00)
> ACL Data RX: Handle 2719 flags 0x02 dlen 7               #101 [hci1] 8.500004
      ATT: Exchange MTU Response (0x03) len 2
        Server RX MTU: 23
< HCI Command: LE Set Privacy Mode (0x08|0x004e) plen 8    #102 [hci1] 8.504024
        Peer Identity address type: Public (0x00)
        Peer Identity address: DF:A9:FF:F6:B1:1A (OUI DF-A9-FF)
        Privacy Mode: Use Device Privacy (0x01)
> HCI Event: Command Complete (0x0e) plen 4                #103 [hci1] 8.504523
      LE Set Privacy Mode (0x08|0x004e) ncmd 1
        Status: Success (0x00)
< HCI Command: LE Set Address Reso.. (0x08|0x002d) plen 1  #104 [hci1] 8.524043
        Address resolution: Enabled (0x01)
> HCI Event: Command Complete (0x0e) plen 4                #105 [hci1] 8.524443
      LE Set Address Resolution Enable (0x08|0x002d) ncmd 1
        Status: Success (0x00)
< HCI Command: Host Number of Comp.. (0x03|0x0035) plen 5  #106 [hci1] 8.544079
        Num handles: 1
        Handle: 1710 Address: DF:A9:FF:F6:B1:1A (OUI DF-A9-FF)
        Count: 1
< ACL Data TX: Handle 1710 flags 0x00 dlen 21              #107 [hci1] 8.544232
      SMP: Identity Information (0x08) len 16
        Identity resolving key: 08aad2e1be87e47b88aeb19de6889efb
< ACL Data TX: Handle 1710 flags 0x00 dlen 12              #108 [hci1] 8.544357
      SMP: Identity Address Information (0x09) len 7
        Address: D5:B6:CC:31:DB:3B (Static)
< HCI Command: Host Number of Comp.. (0x03|0x0035) plen 5  #109 [hci1] 8.544520
        Num handles: 1
        Handle: 2719 Address: 64:23:B5:94:C5:F1 (OUI 64-23-B5)
        Count: 1
> HCI Event: LE Meta Event (0x3e) plen 12                  #110 [hci1] 8.569889
      LE Read Remote Used Features (0x04)
        Status: Success (0x00)
        Handle: 2719 Address: 64:23:B5:94:C5:F1 (OUI 64-23-B5)
        Features: 0x2d 0x49 0x00 0xf7 0x67 0xd9 0x00 0x80
          LE Encryption
          Extended Reject Indication
          Peripheral-initiated Features Exchange
          LE Data Packet Length Extension
          LE 2M PHY
          LE Coded PHY
          Channel Selection Algorithm #2
          Periodic Advertising Sync Transfer - Sender
          Periodic Advertising Sync Transfer - Recipient
          Sleep Clock Accuracy Updates
          Connected Isochronous Stream - Central
          Connected Isochronous Stream - Peripheral
          Isochronous Broadcaster
          Synchronized Receiver
          Connected Isochronous Stream (Host Support)
          LE Power Control Request
          LE Power Control Request
          Connection Subrating
          Connection Subrating (Host Support)
          Unknown features (0x8000d90000000000)
> HCI Event: Number of Completed Packets (0x13) plen 5     #111 [hci1] 8.609739
        Num handles: 1
        Handle: 1710 Address: DF:A9:FF:F6:B1:1A (OUI DF-A9-FF)
        Count: 1
        #107: len 21 (2 Kb/s)
        Latency: 65 msec (55-66 msec ~65 msec)
> HCI Event: Number of Completed Packets (0x13) plen 5     #112 [hci1] 8.610210
        Num handles: 1
        Handle: 1710 Address: DF:A9:FF:F6:B1:1A (OUI DF-A9-FF)
        Count: 1
        #108: len 12 (1 Kb/s)
        Latency: 65 msec (55-66 msec ~65 msec)
> HCI Event: LE Meta Event (0x3e) plen 6                   #113 [hci1] 9.199280
      LE PHY Update Complete (0x0c)
        Status: Success (0x00)
        Handle: 2719 Address: 64:23:B5:94:C5:F1 (OUI 64-23-B5)
        TX PHY: LE 2M (0x02)
        RX PHY: LE 2M (0x02)
< ACL Data TX: Handle 2719 flags 0x00 dlen 11             #114 [hci1] 18.514732
      SMP: Pairing Request (0x01) len 6
        IO capability: NoInputNoOutput (0x03)
        OOB data: Authentication data not present (0x00)
        Authentication requirement: Bonding, No MITM, SC, No Keypresses (0x09)
        Max encryption key size: 16
        Initiator key distribution: EncKey IdKey (0x03)
        Responder key distribution: EncKey IdKey (0x03)
> HCI Event: Number of Completed Packets (0x13) plen 5    #115 [hci1] 18.579602
        Num handles: 1
        Handle: 2719 Address: 64:23:B5:94:C5:F1 (OUI 64-23-B5)
        Count: 1
        #114: len 11 (1 Kb/s)
        Latency: 64 msec (25-64 msec ~45 msec)
> ACL Data RX: Handle 2719 flags 0x02 dlen 11             #116 [hci1] 18.649609
      SMP: Pairing Response (0x02) len 6
        IO capability: KeyboardDisplay (0x04)
        OOB data: Authentication data not present (0x00)
        Authentication requirement: Bonding, No MITM, SC, No Keypresses (0x09)
        Max encryption key size: 16
        Initiator key distribution: EncKey IdKey (0x03)
        Responder key distribution: EncKey IdKey (0x03)
< HCI Command: Host Number of Com.. (0x03|0x0035) plen 5  #117 [hci1] 18.664155
        Num handles: 1
        Handle: 2719 Address: 64:23:B5:94:C5:F1 (OUI 64-23-B5)
        Count: 1
< ACL Data TX: Handle 2719 flags 0x00 dlen 27             #118 [hci1] 18.664168
< ACL Data TX: Handle 2719 flags 0x01 dlen 27             #119 [hci1] 18.664192
< ACL Data TX: Handle 2719 flags 0x01 dlen 15             #120 [hci1] 18.664194
      SMP: Pairing Public Key (0x0c) len 64
        X: 68f6ada634ce84d11617383d57f070fe3445c38b33b569efa5eb771a0dc8aea5
        Y: 83c407aaa8337331fdc418e55085d75e6c1c6e5d42f8bf9c18fb5a2a7d4f31aa
> HCI Event: Number of Completed Packets (0x13) plen 5    #121 [hci1] 18.719528
        Num handles: 1
        Handle: 2719 Address: 64:23:B5:94:C5:F1 (OUI 64-23-B5)
        Count: 1
        #118: len 27 (3 Kb/s)
        Latency: 55 msec (25-64 msec ~50 msec)
> HCI Event: Number of Completed Packets (0x13) plen 5    #122 [hci1] 18.720053
        Num handles: 1
        Handle: 2719 Address: 64:23:B5:94:C5:F1 (OUI 64-23-B5)
        Count: 1
        #119: len 27 (3 Kb/s)
        Latency: 55 msec (25-64 msec ~53 msec)
> HCI Event: Number of Completed Packets (0x13) plen 5    #123 [hci1] 18.720544
        Num handles: 1
        Handle: 2719 Address: 64:23:B5:94:C5:F1 (OUI 64-23-B5)
        Count: 1
        #120: len 15 (2 Kb/s)
        Latency: 56 msec (25-64 msec ~54 msec)
> ACL Data RX: Handle 2719 flags 0x02 dlen 27             #124 [hci1] 18.789789
> ACL Data RX: Handle 2719 flags 0x01 dlen 27             #125 [hci1] 18.790234
> ACL Data RX: Handle 2719 flags 0x01 dlen 15             #126 [hci1] 18.790637
      SMP: Pairing Public Key (0x0c) len 64
        X: d2d02acca3a4858baec35f8ddb4ce38cc617b187b9f0750a1b19dc6a79fc30fd
        Y: d3d41f55bbe4e82b75c3b56547406a76e0e29c8fdaeecb07866abf49f7405174
< HCI Command: Host Number of Com.. (0x03|0x0035) plen 5  #127 [hci1] 18.804481
        Num handles: 1
        Handle: 2719 Address: 64:23:B5:94:C5:F1 (OUI 64-23-B5)
        Count: 1
< HCI Command: Host Number of Com.. (0x03|0x0035) plen 5  #128 [hci1] 18.804603
        Num handles: 1
        Handle: 2719 Address: 64:23:B5:94:C5:F1 (OUI 64-23-B5)
        Count: 1
< HCI Command: Host Number of Com.. (0x03|0x0035) plen 5  #129 [hci1] 18.804656
        Num handles: 1
        Handle: 2719 Address: 64:23:B5:94:C5:F1 (OUI 64-23-B5)
        Count: 1
> ACL Data RX: Handle 2719 flags 0x02 dlen 21             #130 [hci1] 18.859745
      SMP: Pairing Confirm (0x03) len 16
        Confim value: 8517099150af049d2724f642f630e634
< HCI Command: Host Number of Com.. (0x03|0x0035) plen 5  #131 [hci1] 18.864360
        Num handles: 1
        Handle: 2719 Address: 64:23:B5:94:C5:F1 (OUI 64-23-B5)
        Count: 1
< ACL Data TX: Handle 2719 flags 0x00 dlen 21             #132 [hci1] 18.864466
      SMP: Pairing Random (0x04) len 16
        Random value: 1ec8845e8286bc235a02440d0c3424a2
> HCI Event: Number of Completed Packets (0x13) plen 5    #133 [hci1] 18.929580
        Num handles: 1
        Handle: 2719 Address: 64:23:B5:94:C5:F1 (OUI 64-23-B5)
        Count: 1
        #132: len 21 (2 Kb/s)
        Latency: 65 msec (25-65 msec ~59 msec)
> ACL Data RX: Handle 2719 flags 0x02 dlen 21             #134 [hci1] 18.999703
      SMP: Pairing Random (0x04) len 16
        Random value: 677b00cb6c14f7e40000000000000000
< HCI Command: Host Number of Com.. (0x03|0x0035) plen 5  #135 [hci1] 19.004271
        Num handles: 1
        Handle: 2719 Address: 64:23:B5:94:C5:F1 (OUI 64-23-B5)
        Count: 1
< ACL Data TX: Handle 2719 flags 0x00 dlen 21             #136 [hci1] 19.004341
      SMP: Pairing DHKey Check (0x0d) len 16
        E: 31942f0d85d96f14dddf7d995ad3e0cd
> HCI Event: Number of Completed Packets (0x13) plen 5    #137 [hci1] 19.069520
        Num handles: 1
        Handle: 2719 Address: 64:23:B5:94:C5:F1 (OUI 64-23-B5)
        Count: 1
        #136: len 21 (2 Kb/s)
        Latency: 65 msec (25-65 msec ~62 msec)
> ACL Data RX: Handle 2719 flags 0x02 dlen 21             #138 [hci1] 19.349732
      SMP: Pairing DHKey Check (0x0d) len 16
        E: a52f987cf1c8be067dc07d3b8baa3692
< HCI Command: LE Start Encryption (0x08|0x0019) plen 28  #139 [hci1] 19.364620
        Handle: 2719 Address: 64:23:B5:94:C5:F1 (OUI 64-23-B5)
        Random number: 0x0000000000000000
        Encrypted diversifier: 0x0000
        Long term key: d21e7f36edf6ef6d5113ee5de3fe46fc
> HCI Event: Command Status (0x0f) plen 4                 #140 [hci1] 19.365640
      LE Start Encryption (0x08|0x0019) ncmd 1
        Status: Success (0x00)
< HCI Command: Host Number of Com.. (0x03|0x0035) plen 5  #141 [hci1] 19.384287
        Num handles: 1
        Handle: 2719 Address: 64:23:B5:94:C5:F1 (OUI 64-23-B5)
        Count: 1
> HCI Event: Encryption Change (0x08) plen 4              #142 [hci1] 19.839461
        Status: Success (0x00)
        Handle: 2719 Address: 64:23:B5:94:C5:F1 (OUI 64-23-B5)
        Encryption: Enabled with AES-CCM (0x01)
> ACL Data RX: Handle 2719 flags 0x02 dlen 21             #143 [hci1] 19.909706
      SMP: Identity Information (0x08) len 16
        Identity resolving key: 7ce609ac0cbf1bd99d0f6c67b0d93e9e
< HCI Command: Host Number of Com.. (0x03|0x0035) plen 5  #144 [hci1] 19.924471
        Num handles: 1
        Handle: 2719 Address: 64:23:B5:94:C5:F1 (OUI 64-23-B5)
        Count: 1
< HCI Command: LE Extended Creat.. (0x08|0x0043) plen 26  #145 [hci1] 19.944338
        Filter policy: Accept list is not used (0x00)
        Own address type: Random (0x03)
        Peer address type: Public (0x00)
        Peer address: B8:7C:99:F9:E0:AE (OUI B8-7C-99)
        Initiating PHYs: 0x01
        Entry 0: LE 1M
          Scan interval: 60.000 msec (0x0060)
          Scan window: 60.000 msec (0x0060)
          Min connection interval: 50.00 msec (0x0028)
          Max connection interval: 70.00 msec (0x0038)
          Connection latency: 0 (0x0000)
          Supervision timeout: 4000 msec (0x0190)
          Min connection length: 0.000 msec (0x0000)
          Max connection length: 0.000 msec (0x0000)
> HCI Event: Command Status (0x0f) plen 4                 #146 [hci1] 19.945303
      LE Extended Create Connection (0x08|0x0043) ncmd 1
        Status: Success (0x00)
> ACL Data RX: Handle 2719 flags 0x02 dlen 12             #147 [hci1] 19.979592
      SMP: Identity Address Information (0x09) len 7
        Address: 64:23:B5:94:C5:F1 (OUI 64-23-B5)
< HCI Command: Host Number of Com.. (0x03|0x0035) plen 5  #148 [hci1] 19.984144
        Num handles: 1
        Handle: 2719 Address: 64:23:B5:94:C5:F1 (OUI 64-23-B5)
        Count: 1
< ACL Data TX: Handle 2719 flags 0x00 dlen 21             #149 [hci1] 19.984201
      SMP: Identity Information (0x08) len 16
        Identity resolving key: 08aad2e1be87e47b88aeb19de6889efb
< ACL Data TX: Handle 2719 flags 0x00 dlen 12             #150 [hci1] 19.984209
      SMP: Identity Address Information (0x09) len 7
        Address: D5:B6:CC:31:DB:3B (Static)
> HCI Event: LE Meta Event (0x3e) plen 31                 #151 [hci1] 20.025969
      LE Enhanced Connection Complete (0x0a)
        Status: Success (0x00)
        Handle: 326
        Role: Central (0x00)
        Peer address type: Public (0x00)
        Peer address: B8:7C:99:F9:E0:AE (OUI B8-7C-99)
        Local resolvable private address: 48:61:8E:DB:C6:F9 (Resolvable)
          Identity type: Random (0x01)
          Identity: D5:B6:CC:31:DB:3B (Static)
        Peer resolvable private address: 00:00:00:00:00:00 (Non-Resolvable)
        Connection interval: 70.00 msec (0x0038)
        Connection latency: 0 (0x0000)
        Supervision timeout: 4000 msec (0x0190)
        Central clock accuracy: 0x00
< HCI Command: LE Read Remote Use.. (0x08|0x0016) plen 2  #152 [hci1] 20.044249
        Handle: 326 Address: B8:7C:99:F9:E0:AE (OUI B8-7C-99)
< ACL Data TX: Handle 326 flags 0x00 dlen 7               #153 [hci1] 20.044258
      ATT: Exchange MTU Request (0x02) len 2
        Client RX MTU: 251
> HCI Event: Command Status (0x0f) plen 4                 #154 [hci1] 20.044755
      LE Read Remote Used Features (0x08|0x0016) ncmd 1
        Status: Success (0x00)
> HCI Event: Number of Completed Packets (0x13) plen 5    #155 [hci1] 20.049478
        Num handles: 1
        Handle: 2719 Address: 64:23:B5:94:C5:F1 (OUI 64-23-B5)
        Count: 1
        #149: len 21 (2 Kb/s)
        Latency: 65 msec (25-65 msec ~63 msec)
> HCI Event: Number of Completed Packets (0x13) plen 5    #156 [hci1] 20.049996
        Num handles: 1
        Handle: 2719 Address: 64:23:B5:94:C5:F1 (OUI 64-23-B5)
        Count: 1
        #150: len 12 (1 Kb/s)
        Latency: 65 msec (25-65 msec ~64 msec)
< HCI Command: LE Set PHY (0x08|0x0032) plen 7            #157 [hci1] 20.064337
        Handle: 326 Address: B8:7C:99:F9:E0:AE (OUI B8-7C-99)
        All PHYs preference: 0x00
        TX PHYs preference: 0x02
          LE 2M
        RX PHYs preference: 0x02
          LE 2M
        PHY options preference: Reserved (0x0000)
> HCI Event: Command Status (0x0f) plen 4                 #158 [hci1] 20.064929
      LE Set PHY (0x08|0x0032) ncmd 1
        Status: Success (0x00)
> HCI Event: Number of Completed Packets (0x13) plen 5    #159 [hci1] 20.079579
        Num handles: 1
        Handle: 326 Address: B8:7C:99:F9:E0:AE (OUI B8-7C-99)
        Count: 1
        #153: len 7 (1 Kb/s)
        Latency: 35 msec (35-35 msec ~35 msec)
> ACL Data RX: Handle 326 flags 0x02 dlen 7               #160 [hci1] 20.149692
      ATT: Exchange MTU Response (0x03) len 2
        Server RX MTU: 23
< HCI Command: Host Number of Com.. (0x03|0x0035) plen 5  #161 [hci1] 20.164279
        Num handles: 1
        Handle: 326 Address: B8:7C:99:F9:E0:AE (OUI B8-7C-99)
        Count: 1
> HCI Event: LE Meta Event (0x3e) plen 12                 #162 [hci1] 20.219741
      LE Read Remote Used Features (0x04)
        Status: Success (0x00)
        Handle: 326 Address: B8:7C:99:F9:E0:AE (OUI B8-7C-99)
        Features: 0x2d 0x49 0x00 0xf7 0x67 0xd9 0x00 0x80
          LE Encryption
          Extended Reject Indication
          Peripheral-initiated Features Exchange
          LE Data Packet Length Extension
          LE 2M PHY
          LE Coded PHY
          Channel Selection Algorithm #2
          Periodic Advertising Sync Transfer - Sender
          Periodic Advertising Sync Transfer - Recipient
          Sleep Clock Accuracy Updates
          Connected Isochronous Stream - Central
          Connected Isochronous Stream - Peripheral
          Isochronous Broadcaster
          Synchronized Receiver
          Connected Isochronous Stream (Host Support)
          LE Power Control Request
          LE Power Control Request
          Connection Subrating
          Connection Subrating (Host Support)
          Unknown features (0x8000d90000000000)
> HCI Event: LE Meta Event (0x3e) plen 6                  #163 [hci1] 20.849127
      LE PHY Update Complete (0x0c)
        Status: Success (0x00)
        Handle: 326 Address: B8:7C:99:F9:E0:AE (OUI B8-7C-99)
        TX PHY: LE 2M (0x02)
        RX PHY: LE 2M (0x02)
< ACL Data TX: Handle 326 flags 0x00 dlen 11              #164 [hci1] 30.084832
      SMP: Pairing Request (0x01) len 6
        IO capability: NoInputNoOutput (0x03)
        OOB data: Authentication data not present (0x00)
        Authentication requirement: Bonding, No MITM, SC, No Keypresses (0x09)
        Max encryption key size: 16
        Initiator key distribution: EncKey IdKey (0x03)
        Responder key distribution: EncKey IdKey (0x03)
> HCI Event: Number of Completed Packets (0x13) plen 5    #165 [hci1] 30.089291
        Num handles: 1
        Handle: 326 Address: B8:7C:99:F9:E0:AE (OUI B8-7C-99)
        Count: 1
        #164: len 11 (22 Kb/s)
        Latency: 4 msec (4-35 msec ~19 msec)
> ACL Data RX: Handle 326 flags 0x02 dlen 11              #166 [hci1] 30.159375
      SMP: Pairing Response (0x02) len 6
        IO capability: KeyboardDisplay (0x04)
        OOB data: Authentication data not present (0x00)
        Authentication requirement: Bonding, No MITM, SC, No Keypresses (0x09)
        Max encryption key size: 16
        Initiator key distribution: EncKey IdKey (0x03)
        Responder key distribution: EncKey IdKey (0x03)
< HCI Command: Host Number of Com.. (0x03|0x0035) plen 5  #167 [hci1] 30.164695
        Num handles: 1
        Handle: 326 Address: B8:7C:99:F9:E0:AE (OUI B8-7C-99)
        Count: 1
< ACL Data TX: Handle 326 flags 0x00 dlen 27              #168 [hci1] 30.164829
< ACL Data TX: Handle 326 flags 0x01 dlen 27              #169 [hci1] 30.164837
< ACL Data TX: Handle 326 flags 0x01 dlen 15              #170 [hci1] 30.164868
      SMP: Pairing Public Key (0x0c) len 64
        X: 68f6ada634ce84d11617383d57f070fe3445c38b33b569efa5eb771a0dc8aea5
        Y: 83c407aaa8337331fdc418e55085d75e6c1c6e5d42f8bf9c18fb5a2a7d4f31aa
> HCI Event: Number of Completed Packets (0x13) plen 5    #171 [hci1] 30.229295
        Num handles: 1
        Handle: 326 Address: B8:7C:99:F9:E0:AE (OUI B8-7C-99)
        Count: 1
        #168: len 27 (3 Kb/s)
        Latency: 64 msec (4-64 msec ~42 msec)
> HCI Event: Number of Completed Packets (0x13) plen 5    #172 [hci1] 30.229734
        Num handles: 1
        Handle: 326 Address: B8:7C:99:F9:E0:AE (OUI B8-7C-99)
        Count: 1
        #169: len 27 (3 Kb/s)
        Latency: 64 msec (4-64 msec ~53 msec)
> HCI Event: Number of Completed Packets (0x13) plen 5    #173 [hci1] 30.230267
        Num handles: 1
        Handle: 326 Address: B8:7C:99:F9:E0:AE (OUI B8-7C-99)
        Count: 1
        #170: len 15 (1 Kb/s)
        Latency: 65 msec (4-65 msec ~59 msec)
> ACL Data RX: Handle 326 flags 0x02 dlen 27              #174 [hci1] 30.299519
> ACL Data RX: Handle 326 flags 0x01 dlen 27              #175 [hci1] 30.300084
> ACL Data RX: Handle 326 flags 0x01 dlen 15              #176 [hci1] 30.300354
      SMP: Pairing Public Key (0x0c) len 64
        X: 0ebe5abaa36f4d198e0be49df904929a66dda2a157b545f92f2f884c73e2466c
        Y: d43a62392505cd4fc1da49543d48d234edf7c641f435e686351cfa61ad09c73b
< HCI Command: Host Number of Com.. (0x03|0x0035) plen 5  #177 [hci1] 30.304402
        Num handles: 1
        Handle: 326 Address: B8:7C:99:F9:E0:AE (OUI B8-7C-99)
        Count: 1
< HCI Command: Host Number of Com.. (0x03|0x0035) plen 5  #178 [hci1] 30.304507
        Num handles: 1
        Handle: 326 Address: B8:7C:99:F9:E0:AE (OUI B8-7C-99)
        Count: 1
< HCI Command: Host Number of Com.. (0x03|0x0035) plen 5  #179 [hci1] 30.304511
        Num handles: 1
        Handle: 326 Address: B8:7C:99:F9:E0:AE (OUI B8-7C-99)
        Count: 1
> ACL Data RX: Handle 326 flags 0x02 dlen 21              #180 [hci1] 30.369447
      SMP: Pairing Confirm (0x03) len 16
        Confim value: ec610cc06a2f31cbb482e128011022dc
< HCI Command: Host Number of Com.. (0x03|0x0035) plen 5  #181 [hci1] 30.384280
        Num handles: 1
        Handle: 326 Address: B8:7C:99:F9:E0:AE (OUI B8-7C-99)
        Count: 1
< ACL Data TX: Handle 326 flags 0x00 dlen 21              #182 [hci1] 30.384306
      SMP: Pairing Random (0x04) len 16
        Random value: fd71a45c4a1bcadd27bd58e945097b00
> HCI Event: Number of Completed Packets (0x13) plen 5    #183 [hci1] 30.439265
        Num handles: 1
        Handle: 326 Address: B8:7C:99:F9:E0:AE (OUI B8-7C-99)
        Count: 1
        #182: len 21 (3 Kb/s)
        Latency: 54 msec (4-65 msec ~57 msec)
> ACL Data RX: Handle 326 flags 0x02 dlen 21              #184 [hci1] 30.509563
      SMP: Pairing Random (0x04) len 16
        Random value: 34572afa97fa0b920000000000000000
< HCI Command: Host Number of Com.. (0x03|0x0035) plen 5  #185 [hci1] 30.524408
        Num handles: 1
        Handle: 326 Address: B8:7C:99:F9:E0:AE (OUI B8-7C-99)
        Count: 1
< ACL Data TX: Handle 326 flags 0x00 dlen 21              #186 [hci1] 30.524443
      SMP: Pairing DHKey Check (0x0d) len 16
        E: 24faafecc1cc128d9cbf08f8a7df9e51
> HCI Event: Number of Completed Packets (0x13) plen 5    #187 [hci1] 30.579313
        Num handles: 1
        Handle: 326 Address: B8:7C:99:F9:E0:AE (OUI B8-7C-99)
        Count: 1
        #186: len 21 (3 Kb/s)
        Latency: 54 msec (4-65 msec ~56 msec)
> ACL Data RX: Handle 326 flags 0x02 dlen 21              #188 [hci1] 30.859510
      SMP: Pairing DHKey Check (0x0d) len 16
        E: 8a1ff8839e56328b9101e4a3947e9d22
< HCI Command: LE Start Encryption (0x08|0x0019) plen 28  #189 [hci1] 30.864443
        Handle: 326 Address: B8:7C:99:F9:E0:AE (OUI B8-7C-99)
        Random number: 0x0000000000000000
        Encrypted diversifier: 0x0000
        Long term key: 5e58eb5ab20059bd00da2b7562638d7b
> HCI Event: Command Status (0x0f) plen 4                 #190 [hci1] 30.865353
      LE Start Encryption (0x08|0x0019) ncmd 1
        Status: Success (0x00)
< HCI Command: Host Number of Com.. (0x03|0x0035) plen 5  #191 [hci1] 30.884239
        Num handles: 1
        Handle: 326 Address: B8:7C:99:F9:E0:AE (OUI B8-7C-99)
        Count: 1
> HCI Event: Encryption Change (0x08) plen 4              #192 [hci1] 31.349151
        Status: Success (0x00)
        Handle: 326 Address: B8:7C:99:F9:E0:AE (OUI B8-7C-99)
        Encryption: Enabled with AES-CCM (0x01)
> ACL Data RX: Handle 326 flags 0x02 dlen 21              #193 [hci1] 31.419492
      SMP: Identity Information (0x08) len 16
        Identity resolving key: 13b5c07d988185f139e8b37b990faa93
< HCI Command: Host Number of Com.. (0x03|0x0035) plen 5  #194 [hci1] 31.424180
        Num handles: 1
        Handle: 326 Address: B8:7C:99:F9:E0:AE (OUI B8-7C-99)
        Count: 1
> ACL Data RX: Handle 326 flags 0x02 dlen 12              #195 [hci1] 31.489392
      SMP: Identity Address Information (0x09) len 7
        Address: B8:7C:99:F9:E0:AE (OUI B8-7C-99)
< HCI Command: LE Set Address Res.. (0x08|0x002d) plen 1  #196 [hci1] 31.504260
        Address resolution: Disabled (0x00)
> HCI Event: Command Complete (0x0e) plen 4               #197 [hci1] 31.504651
      LE Set Address Resolution Enable (0x08|0x002d) ncmd 1
        Status: Success (0x00)
< HCI Command: LE Add Device To... (0x08|0x0027) plen 39  #198 [hci1] 31.524219
        Address type: Public (0x00)
        Address: B8:7C:99:F9:E0:AE (OUI B8-7C-99)
        Peer identity resolving key: 13b5c07d988185f139e8b37b990faa93
        Local identity resolving key: 08aad2e1be87e47b88aeb19de6889efb
> HCI Event: Command Complete (0x0e) plen 4               #199 [hci1] 31.525190
      LE Add Device To Resolving List (0x08|0x0027) ncmd 1
        Status: Success (0x00)
< HCI Command: LE Set Privacy Mode (0x08|0x004e) plen 8   #200 [hci1] 31.544186
        Peer Identity address type: Public (0x00)
        Peer Identity address: B8:7C:99:F9:E0:AE (OUI B8-7C-99)
        Privacy Mode: Use Device Privacy (0x01)
> HCI Event: Command Complete (0x0e) plen 4               #201 [hci1] 31.544725
      LE Set Privacy Mode (0x08|0x004e) ncmd 1
        Status: Success (0x00)
< HCI Command: LE Set Address Res.. (0x08|0x002d) plen 1  #202 [hci1] 31.564179
        Address resolution: Enabled (0x01)
> HCI Event: Command Complete (0x0e) plen 4               #203 [hci1] 31.564547
      LE Set Address Resolution Enable (0x08|0x002d) ncmd 1
        Status: Success (0x00)
< HCI Command: Host Number of Com.. (0x03|0x0035) plen 5  #204 [hci1] 31.584227
        Num handles: 1
        Handle: 326 Address: B8:7C:99:F9:E0:AE (OUI B8-7C-99)
        Count: 1
< ACL Data TX: Handle 326 flags 0x00 dlen 21              #205 [hci1] 31.584257
      SMP: Identity Information (0x08) len 16
        Identity resolving key: 08aad2e1be87e47b88aeb19de6889efb
< ACL Data TX: Handle 326 flags 0x00 dlen 12              #206 [hci1] 31.584258
      SMP: Identity Address Information (0x09) len 7
        Address: D5:B6:CC:31:DB:3B (Static)
> HCI Event: Number of Completed Packets (0x13) plen 5    #207 [hci1] 31.629301
        Num handles: 1
        Handle: 326 Address: B8:7C:99:F9:E0:AE (OUI B8-7C-99)
        Count: 1
        #205: len 21 (3 Kb/s)
        Latency: 45 msec (4-65 msec ~50 msec)
> HCI Event: Number of Completed Packets (0x13) plen 5    #208 [hci1] 31.629714
        Num handles: 1
        Handle: 326 Address: B8:7C:99:F9:E0:AE (OUI B8-7C-99)
        Count: 1
        #206: len 12 (2 Kb/s)
        Latency: 45 msec (4-65 msec ~47 msec)
< ACL Data TX: Handle 1710 flags 0x00 dlen 13             #209 [hci1] 32.404727
      ATT: Find By Type Value Request (0x06) len 8
        Handle range: 0x0001-0xffff
        Attribute type: Primary Service (0x2800)
          UUID: Coordinated Set Identification (0x1846)
> HCI Event: Number of Completed Packets (0x13) plen 5    #210 [hci1] 32.409233
        Num handles: 1
        Handle: 1710 Address: DF:A9:FF:F6:B1:1A (OUI DF-A9-FF)
        Count: 1
        #209: len 13 (26 Kb/s)
        Latency: 4 msec (4-66 msec ~35 msec)
> ACL Data RX: Handle 1710 flags 0x02 dlen 9              #211 [hci1] 32.479338
      ATT: Find By Type Value Response (0x07) len 4
        Handle range: 0x0160-0x016e
< HCI Command: Host Number of Com.. (0x03|0x0035) plen 5  #212 [hci1] 32.484421
        Num handles: 1
        Handle: 1710 Address: DF:A9:FF:F6:B1:1A (OUI DF-A9-FF)
        Count: 1
< ACL Data TX: Handle 1710 flags 0x00 dlen 13             #213 [hci1] 32.484471
      ATT: Find By Type Value Request (0x06) len 8
        Handle range: 0x016f-0xffff
        Attribute type: Primary Service (0x2800)
          UUID: Coordinated Set Identification (0x1846)
> HCI Event: Number of Completed Packets (0x13) plen 5    #214 [hci1] 32.549260
        Num handles: 1
        Handle: 1710 Address: DF:A9:FF:F6:B1:1A (OUI DF-A9-FF)
        Count: 1
        #213: len 13 (1 Kb/s)
        Latency: 64 msec (4-66 msec ~49 msec)
> ACL Data RX: Handle 1710 flags 0x02 dlen 9              #215 [hci1] 32.619340
      ATT: Error Response (0x01) len 4
        Find By Type Value Request (0x06)
        Handle: 0x016f
        Error: Attribute Not Found (0x0a)
< HCI Command: Host Number of Com.. (0x03|0x0035) plen 5  #216 [hci1] 32.624717
        Num handles: 1
        Handle: 1710 Address: DF:A9:FF:F6:B1:1A (OUI DF-A9-FF)
        Count: 1
< ACL Data TX: Handle 1710 flags 0x00 dlen 11             #217 [hci1] 32.624863
      ATT: Read By Type Request (0x08) len 6
        Handle range: 0x0160-0x016e
        Attribute type: Characteristic (0x2803)
> HCI Event: Number of Completed Packets (0x13) plen 5    #218 [hci1] 32.689261
        Num handles: 1
        Handle: 1710 Address: DF:A9:FF:F6:B1:1A (OUI DF-A9-FF)
        Count: 1
        #217: len 11 (1 Kb/s)
        Latency: 64 msec (4-66 msec ~57 msec)
> ACL Data RX: Handle 1710 flags 0x02 dlen 27             #219 [hci1] 32.759496
      ATT: Read By Type Response (0x09) len 22
        Attribute data length: 7
        Attribute data list: 3 entries
        Handle: 0x0161
        Value: 126201842b
            Properties: 0x12
              Read (0x02)
              Notify (0x10)
            Value Handle: 0x0162
            Value UUID: Set Identity Resolving Key (0x2b84)
        Handle: 0x0164
        Value: 1a6501862b
            Properties: 0x1a
              Read (0x02)
              Write (0x08)
              Notify (0x10)
            Value Handle: 0x0165
            Value UUID: Set Member Lock (0x2b86)
        Handle: 0x0167
        Value: 126801852b
            Properties: 0x12
              Read (0x02)
              Notify (0x10)
            Value Handle: 0x0168
            Value UUID: Coordinated Set Size (0x2b85)
< HCI Command: Host Number of Com.. (0x03|0x0035) plen 5  #220 [hci1] 32.764294
        Num handles: 1
        Handle: 1710 Address: DF:A9:FF:F6:B1:1A (OUI DF-A9-FF)
        Count: 1
< ACL Data TX: Handle 1710 flags 0x00 dlen 9              #221 [hci1] 32.764337
      ATT: Find Information Request (0x04) len 4
        Handle range: 0x0162-0x016e
> HCI Event: Number of Completed Packets (0x13) plen 5    #222 [hci1] 32.829228
        Num handles: 1
        Handle: 1710 Address: DF:A9:FF:F6:B1:1A (OUI DF-A9-FF)
        Count: 1
        #221: len 9 (1 Kb/s)
        Latency: 64 msec (4-66 msec ~61 msec)
> ACL Data RX: Handle 1710 flags 0x02 dlen 26             #223 [hci1] 32.899550
      ATT: Find Information Response (0x05) len 21
        Format: UUID-16 (0x01)
        Handle: 0x0162
        UUID: Set Identity Resolving Key (0x2b84)
        Handle: 0x0163
        UUID: Client Characteristic Configuration (0x2902)
        Handle: 0x0164
        UUID: Characteristic (0x2803)
        Handle: 0x0165
        UUID: Set Member Lock (0x2b86)
        Handle: 0x0166
        UUID: Client Characteristic Configuration (0x2902)
< HCI Command: Host Number of Com.. (0x03|0x0035) plen 5  #224 [hci1] 32.904409
        Num handles: 1
        Handle: 1710 Address: DF:A9:FF:F6:B1:1A (OUI DF-A9-FF)
        Count: 1
< ACL Data TX: Handle 1710 flags 0x00 dlen 9              #225 [hci1] 32.904454
      ATT: Find Information Request (0x04) len 4
        Handle range: 0x0165-0x016e
> HCI Event: Number of Completed Packets (0x13) plen 5    #226 [hci1] 32.969182
        Num handles: 1
        Handle: 1710 Address: DF:A9:FF:F6:B1:1A (OUI DF-A9-FF)
        Count: 1
        #225: len 9 (1 Kb/s)
        Latency: 64 msec (4-66 msec ~62 msec)
> ACL Data RX: Handle 1710 flags 0x02 dlen 26             #227 [hci1] 33.039610
      ATT: Find Information Response (0x05) len 21
        Format: UUID-16 (0x01)
        Handle: 0x0165
        UUID: Set Member Lock (0x2b86)
        Handle: 0x0166
        UUID: Client Characteristic Configuration (0x2902)
        Handle: 0x0167
        UUID: Characteristic (0x2803)
        Handle: 0x0168
        UUID: Coordinated Set Size (0x2b85)
        Handle: 0x0169
        UUID: Client Characteristic Configuration (0x2902)
< HCI Command: Host Number of Com.. (0x03|0x0035) plen 5  #228 [hci1] 33.044582
        Num handles: 1
        Handle: 1710 Address: DF:A9:FF:F6:B1:1A (OUI DF-A9-FF)
        Count: 1
< ACL Data TX: Handle 1710 flags 0x00 dlen 9              #229 [hci1] 33.044638
      ATT: Find Information Request (0x04) len 4
        Handle range: 0x0168-0x016e
> HCI Event: Number of Completed Packets (0x13) plen 5    #230 [hci1] 33.109342
        Num handles: 1
        Handle: 1710 Address: DF:A9:FF:F6:B1:1A (OUI DF-A9-FF)
        Count: 1
        #229: len 9 (1 Kb/s)
        Latency: 64 msec (4-66 msec ~63 msec)
> ACL Data RX: Handle 1710 flags 0x02 dlen 26             #231 [hci1] 33.179539
      ATT: Find Information Response (0x05) len 21
        Format: UUID-16 (0x01)
        Handle: 0x0168
        UUID: Coordinated Set Size (0x2b85)
        Handle: 0x0169
        UUID: Client Characteristic Configuration (0x2902)
        Handle: 0x016a
        UUID: Characteristic (0x2803)
        Handle: 0x016b
        UUID: Set Member Rank (0x2b87)
        Handle: 0x016c
        UUID: Characteristic (0x2803)
< HCI Command: Host Number of Com.. (0x03|0x0035) plen 5  #232 [hci1] 33.184637
        Num handles: 1
        Handle: 1710 Address: DF:A9:FF:F6:B1:1A (OUI DF-A9-FF)
        Count: 1
< ACL Data TX: Handle 1710 flags 0x00 dlen 11             #233 [hci1] 33.184709
      ATT: Read By Type Request (0x08) len 6
        Handle range: 0x0168-0x016e
        Attribute type: Characteristic (0x2803)
> HCI Event: Number of Completed Packets (0x13) plen 5    #234 [hci1] 33.249215
        Num handles: 1
        Handle: 1710 Address: DF:A9:FF:F6:B1:1A (OUI DF-A9-FF)
        Count: 1
        #233: len 11 (1 Kb/s)
        Latency: 64 msec (4-66 msec ~64 msec)
> ACL Data RX: Handle 1710 flags 0x02 dlen 20             #235 [hci1] 33.319470
      ATT: Read By Type Response (0x09) len 15
        Attribute data length: 7
        Attribute data list: 2 entries
        Handle: 0x016a
        Value: 026b01872b
            Properties: 0x02
              Read (0x02)
            Value Handle: 0x016b
            Value UUID: Set Member Rank (0x2b87)
        Handle: 0x016c
        Value: 1a6d011a2c
            Properties: 0x1a
              Read (0x02)
              Write (0x08)
              Notify (0x10)
            Value Handle: 0x016d
            Value UUID: Unknown (0x2c1a)
< HCI Command: Host Number of Com.. (0x03|0x0035) plen 5  #236 [hci1] 33.324349
        Num handles: 1
        Handle: 1710 Address: DF:A9:FF:F6:B1:1A (OUI DF-A9-FF)
        Count: 1
< ACL Data TX: Handle 1710 flags 0x00 dlen 9              #237 [hci1] 33.324376
      ATT: Write Request (0x12) len 4
        Handle: 0x0163
          Data: 0100
> HCI Event: Number of Completed Packets (0x13) plen 5    #238 [hci1] 33.389219
        Num handles: 1
        Handle: 1710 Address: DF:A9:FF:F6:B1:1A (OUI DF-A9-FF)
        Count: 1
        #237: len 9 (1 Kb/s)
        Latency: 64 msec (4-66 msec ~64 msec)
> ACL Data RX: Handle 1710 flags 0x02 dlen 5              #239 [hci1] 33.459165
      ATT: Write Response (0x13) len 0
< HCI Command: Host Number of Com.. (0x03|0x0035) plen 5  #240 [hci1] 33.464362
        Num handles: 1
        Handle: 1710 Address: DF:A9:FF:F6:B1:1A (OUI DF-A9-FF)
        Count: 1
< ACL Data TX: Handle 1710 flags 0x00 dlen 9              #241 [hci1] 33.464427
      ATT: Write Request (0x12) len 4
        Handle: 0x0166
          Data: 0100
> HCI Event: Number of Completed Packets (0x13) plen 5    #242 [hci1] 33.529182
        Num handles: 1
        Handle: 1710 Address: DF:A9:FF:F6:B1:1A (OUI DF-A9-FF)
        Count: 1
        #241: len 9 (1 Kb/s)
        Latency: 64 msec (4-66 msec ~64 msec)
> ACL Data RX: Handle 1710 flags 0x02 dlen 5              #243 [hci1] 33.599181
      ATT: Write Response (0x13) len 0
< HCI Command: Host Number of Com.. (0x03|0x0035) plen 5  #244 [hci1] 33.604369
        Num handles: 1
        Handle: 1710 Address: DF:A9:FF:F6:B1:1A (OUI DF-A9-FF)
        Count: 1
< ACL Data TX: Handle 1710 flags 0x00 dlen 9              #245 [hci1] 33.604390
      ATT: Write Request (0x12) len 4
        Handle: 0x0169
          Data: 0100
> HCI Event: Number of Completed Packets (0x13) plen 5    #246 [hci1] 33.669349
        Num handles: 1
        Handle: 1710 Address: DF:A9:FF:F6:B1:1A (OUI DF-A9-FF)
        Count: 1
        #245: len 9 (1 Kb/s)
        Latency: 64 msec (4-66 msec ~64 msec)
> ACL Data RX: Handle 1710 flags 0x02 dlen 5              #247 [hci1] 33.739315
      ATT: Write Response (0x13) len 0
< HCI Command: Host Number of Com.. (0x03|0x0035) plen 5  #248 [hci1] 33.744257
        Num handles: 1
        Handle: 1710 Address: DF:A9:FF:F6:B1:1A (OUI DF-A9-FF)
        Count: 1
< ACL Data TX: Handle 1710 flags 0x00 dlen 11             #249 [hci1] 33.744330
      ATT: Read By Type Request (0x08) len 6
        Handle range: 0x016d-0x016e
        Attribute type: Characteristic (0x2803)
> HCI Event: Number of Completed Packets (0x13) plen 5    #250 [hci1] 33.809198
        Num handles: 1
        Handle: 1710 Address: DF:A9:FF:F6:B1:1A (OUI DF-A9-FF)
        Count: 1
        #249: len 11 (1 Kb/s)
        Latency: 64 msec (4-66 msec ~64 msec)
> ACL Data RX: Handle 1710 flags 0x02 dlen 9              #251 [hci1] 33.879238
      ATT: Error Response (0x01) len 4
        Read By Type Request (0x08)
        Handle: 0x016d
        Error: Attribute Not Found (0x0a)
< HCI Command: Host Number of Com.. (0x03|0x0035) plen 5  #252 [hci1] 33.884432
        Num handles: 1
        Handle: 1710 Address: DF:A9:FF:F6:B1:1A (OUI DF-A9-FF)
        Count: 1
< ACL Data TX: Handle 1710 flags 0x00 dlen 7              #253 [hci1] 33.884518
      ATT: Read Request (0x0a) len 2
        Handle: 0x0162
> HCI Event: Number of Completed Packets (0x13) plen 5    #254 [hci1] 33.949286
        Num handles: 1
        Handle: 1710 Address: DF:A9:FF:F6:B1:1A (OUI DF-A9-FF)
        Count: 1
        #253: len 7 (0 Kb/s)
        Latency: 64 msec (4-66 msec ~64 msec)
> ACL Data RX: Handle 1710 flags 0x02 dlen 22             #255 [hci1] 34.019374
      ATT: Read Response (0x0b) len 17
< HCI Command: Host Number of Com.. (0x03|0x0035) plen 5  #256 [hci1] 34.024300
        Num handles: 1
        Handle: 1710 Address: DF:A9:FF:F6:B1:1A (OUI DF-A9-FF)
        Count: 1
< ACL Data TX: Handle 1710 flags 0x00 dlen 7              #257 [hci1] 34.024329
      ATT: Read Request (0x0a) len 2
        Handle: 0x0168
> HCI Event: Number of Completed Packets (0x13) plen 5    #258 [hci1] 34.089235
        Num handles: 1
        Handle: 1710 Address: DF:A9:FF:F6:B1:1A (OUI DF-A9-FF)
        Count: 1
        #257: len 7 (0 Kb/s)
        Latency: 64 msec (4-66 msec ~64 msec)
> ACL Data RX: Handle 1710 flags 0x02 dlen 6              #259 [hci1] 34.159256
      ATT: Read Response (0x0b) len 1
< HCI Command: Host Number of Com.. (0x03|0x0035) plen 5  #260 [hci1] 34.164394
        Num handles: 1
        Handle: 1710 Address: DF:A9:FF:F6:B1:1A (OUI DF-A9-FF)
        Count: 1
< ACL Data TX: Handle 1710 flags 0x00 dlen 7              #261 [hci1] 34.164480
      ATT: Read Request (0x0a) len 2
        Handle: 0x016b
> HCI Event: Number of Completed Packets (0x13) plen 5    #262 [hci1] 34.229179
        Num handles: 1
        Handle: 1710 Address: DF:A9:FF:F6:B1:1A (OUI DF-A9-FF)
        Count: 1
        #261: len 7 (0 Kb/s)
        Latency: 64 msec (4-66 msec ~64 msec)
> ACL Data RX: Handle 1710 flags 0x02 dlen 6              #263 [hci1] 34.299249
      ATT: Read Response (0x0b) len 1
< HCI Command: Host Number of Com.. (0x03|0x0035) plen 5  #264 [hci1] 34.304598
        Num handles: 1
        Handle: 1710 Address: DF:A9:FF:F6:B1:1A (OUI DF-A9-FF)
        Count: 1
< ACL Data TX: Handle 2719 flags 0x00 dlen 13             #265 [hci1] 34.324303
      ATT: Find By Type Value Request (0x06) len 8
        Handle range: 0x0001-0xffff
        Attribute type: Primary Service (0x2800)
          UUID: Coordinated Set Identification (0x1846)
> HCI Event: Number of Completed Packets (0x13) plen 5    #266 [hci1] 34.329256
        Num handles: 1
        Handle: 2719 Address: 64:23:B5:94:C5:F1 (OUI 64-23-B5)
        Count: 1
        #265: len 13 (26 Kb/s)
        Latency: 4 msec (4-65 msec ~34 msec)
> ACL Data RX: Handle 2719 flags 0x02 dlen 9              #267 [hci1] 34.399209
      ATT: Find By Type Value Response (0x07) len 4
        Handle range: 0x0160-0x016e
< HCI Command: Host Number of Com.. (0x03|0x0035) plen 5  #268 [hci1] 34.404732
        Num handles: 1
        Handle: 2719 Address: 64:23:B5:94:C5:F1 (OUI 64-23-B5)
        Count: 1
< ACL Data TX: Handle 2719 flags 0x00 dlen 13             #269 [hci1] 34.404887
      ATT: Find By Type Value Request (0x06) len 8
        Handle range: 0x016f-0xffff
        Attribute type: Primary Service (0x2800)
          UUID: Coordinated Set Identification (0x1846)
> HCI Event: Number of Completed Packets (0x13) plen 5    #270 [hci1] 34.469227
        Num handles: 1
        Handle: 2719 Address: 64:23:B5:94:C5:F1 (OUI 64-23-B5)
        Count: 1
        #269: len 13 (1 Kb/s)
        Latency: 64 msec (4-65 msec ~49 msec)
> ACL Data RX: Handle 2719 flags 0x02 dlen 9              #271 [hci1] 34.539229
      ATT: Error Response (0x01) len 4
        Find By Type Value Request (0x06)
        Handle: 0x016f
        Error: Attribute Not Found (0x0a)
< HCI Command: Host Number of Com.. (0x03|0x0035) plen 5  #272 [hci1] 34.544387
        Num handles: 1
        Handle: 2719 Address: 64:23:B5:94:C5:F1 (OUI 64-23-B5)
        Count: 1
< ACL Data TX: Handle 2719 flags 0x00 dlen 11             #273 [hci1] 34.544417
      ATT: Read By Type Request (0x08) len 6
        Handle range: 0x0160-0x016e
        Attribute type: Characteristic (0x2803)
> HCI Event: Number of Completed Packets (0x13) plen 5    #274 [hci1] 34.609215
        Num handles: 1
        Handle: 2719 Address: 64:23:B5:94:C5:F1 (OUI 64-23-B5)
        Count: 1
        #273: len 11 (1 Kb/s)
        Latency: 64 msec (4-65 msec ~57 msec)
> ACL Data RX: Handle 2719 flags 0x02 dlen 27             #275 [hci1] 34.679450
      ATT: Read By Type Response (0x09) len 22
        Attribute data length: 7
        Attribute data list: 3 entries
        Handle: 0x0161
        Value: 126201842b
            Properties: 0x12
              Read (0x02)
              Notify (0x10)
            Value Handle: 0x0162
            Value UUID: Set Identity Resolving Key (0x2b84)
        Handle: 0x0164
        Value: 1a6501862b
            Properties: 0x1a
              Read (0x02)
              Write (0x08)
              Notify (0x10)
            Value Handle: 0x0165
            Value UUID: Set Member Lock (0x2b86)
        Handle: 0x0167
        Value: 126801852b
            Properties: 0x12
              Read (0x02)
              Notify (0x10)
            Value Handle: 0x0168
            Value UUID: Coordinated Set Size (0x2b85)
< HCI Command: Host Number of Com.. (0x03|0x0035) plen 5  #276 [hci1] 34.684751
        Num handles: 1
        Handle: 2719 Address: 64:23:B5:94:C5:F1 (OUI 64-23-B5)
        Count: 1
< ACL Data TX: Handle 2719 flags 0x00 dlen 9              #277 [hci1] 34.684853
      ATT: Find Information Request (0x04) len 4
        Handle range: 0x0162-0x016e
> HCI Event: Number of Completed Packets (0x13) plen 5    #278 [hci1] 34.749200
        Num handles: 1
        Handle: 2719 Address: 64:23:B5:94:C5:F1 (OUI 64-23-B5)
        Count: 1
        #277: len 9 (1 Kb/s)
        Latency: 64 msec (4-65 msec ~60 msec)
> ACL Data RX: Handle 2719 flags 0x02 dlen 26             #279 [hci1] 34.819537
      ATT: Find Information Response (0x05) len 21
        Format: UUID-16 (0x01)
        Handle: 0x0162
        UUID: Set Identity Resolving Key (0x2b84)
        Handle: 0x0163
        UUID: Client Characteristic Configuration (0x2902)
        Handle: 0x0164
        UUID: Characteristic (0x2803)
        Handle: 0x0165
        UUID: Set Member Lock (0x2b86)
        Handle: 0x0166
        UUID: Client Characteristic Configuration (0x2902)
< HCI Command: Host Number of Com.. (0x03|0x0035) plen 5  #280 [hci1] 34.824755
        Num handles: 1
        Handle: 2719 Address: 64:23:B5:94:C5:F1 (OUI 64-23-B5)
        Count: 1
< ACL Data TX: Handle 2719 flags 0x00 dlen 9              #281 [hci1] 34.824927
      ATT: Find Information Request (0x04) len 4
        Handle range: 0x0165-0x016e
> HCI Event: Number of Completed Packets (0x13) plen 5    #282 [hci1] 34.889175
        Num handles: 1
        Handle: 2719 Address: 64:23:B5:94:C5:F1 (OUI 64-23-B5)
        Count: 1
        #281: len 9 (1 Kb/s)
        Latency: 64 msec (4-65 msec ~62 msec)
> ACL Data RX: Handle 2719 flags 0x02 dlen 26             #283 [hci1] 34.959454
      ATT: Find Information Response (0x05) len 21
        Format: UUID-16 (0x01)
        Handle: 0x0165
        UUID: Set Member Lock (0x2b86)
        Handle: 0x0166
        UUID: Client Characteristic Configuration (0x2902)
        Handle: 0x0167
        UUID: Characteristic (0x2803)
        Handle: 0x0168
        UUID: Coordinated Set Size (0x2b85)
        Handle: 0x0169
        UUID: Client Characteristic Configuration (0x2902)
< HCI Command: Host Number of Com.. (0x03|0x0035) plen 5  #284 [hci1] 34.964383
        Num handles: 1
        Handle: 2719 Address: 64:23:B5:94:C5:F1 (OUI 64-23-B5)
        Count: 1
< ACL Data TX: Handle 2719 flags 0x00 dlen 9              #285 [hci1] 34.964457
      ATT: Find Information Request (0x04) len 4
        Handle range: 0x0168-0x016e
> HCI Event: Number of Completed Packets (0x13) plen 5    #286 [hci1] 35.029269
        Num handles: 1
        Handle: 2719 Address: 64:23:B5:94:C5:F1 (OUI 64-23-B5)
        Count: 1
        #285: len 9 (1 Kb/s)
        Latency: 64 msec (4-65 msec ~63 msec)
> ACL Data RX: Handle 2719 flags 0x02 dlen 26             #287 [hci1] 35.099485
      ATT: Find Information Response (0x05) len 21
        Format: UUID-16 (0x01)
        Handle: 0x0168
        UUID: Coordinated Set Size (0x2b85)
        Handle: 0x0169
        UUID: Client Characteristic Configuration (0x2902)
        Handle: 0x016a
        UUID: Characteristic (0x2803)
        Handle: 0x016b
        UUID: Set Member Rank (0x2b87)
        Handle: 0x016c
        UUID: Characteristic (0x2803)
< HCI Command: Host Number of Com.. (0x03|0x0035) plen 5  #288 [hci1] 35.104373
        Num handles: 1
        Handle: 2719 Address: 64:23:B5:94:C5:F1 (OUI 64-23-B5)
        Count: 1
< ACL Data TX: Handle 2719 flags 0x00 dlen 11             #289 [hci1] 35.104450
      ATT: Read By Type Request (0x08) len 6
        Handle range: 0x0168-0x016e
        Attribute type: Characteristic (0x2803)
> HCI Event: Number of Completed Packets (0x13) plen 5    #290 [hci1] 35.169188
        Num handles: 1
        Handle: 2719 Address: 64:23:B5:94:C5:F1 (OUI 64-23-B5)
        Count: 1
        #289: len 11 (1 Kb/s)
        Latency: 64 msec (4-65 msec ~64 msec)
> ACL Data RX: Handle 2719 flags 0x02 dlen 20             #291 [hci1] 35.239346
      ATT: Read By Type Response (0x09) len 15
        Attribute data length: 7
        Attribute data list: 2 entries
        Handle: 0x016a
        Value: 026b01872b
            Properties: 0x02
              Read (0x02)
            Value Handle: 0x016b
            Value UUID: Set Member Rank (0x2b87)
        Handle: 0x016c
        Value: 1a6d011a2c
            Properties: 0x1a
              Read (0x02)
              Write (0x08)
              Notify (0x10)
            Value Handle: 0x016d
            Value UUID: Unknown (0x2c1a)
< HCI Command: Host Number of Com.. (0x03|0x0035) plen 5  #292 [hci1] 35.244634
        Num handles: 1
        Handle: 2719 Address: 64:23:B5:94:C5:F1 (OUI 64-23-B5)
        Count: 1
< ACL Data TX: Handle 2719 flags 0x00 dlen 9              #293 [hci1] 35.244698
      ATT: Write Request (0x12) len 4
        Handle: 0x0163
          Data: 0100
> HCI Event: Number of Completed Packets (0x13) plen 5    #294 [hci1] 35.309115
        Num handles: 1
        Handle: 2719 Address: 64:23:B5:94:C5:F1 (OUI 64-23-B5)
        Count: 1
        #293: len 9 (1 Kb/s)
        Latency: 64 msec (4-65 msec ~64 msec)
> ACL Data RX: Handle 2719 flags 0x02 dlen 5              #295 [hci1] 35.379147
      ATT: Write Response (0x13) len 0
< HCI Command: Host Number of Com.. (0x03|0x0035) plen 5  #296 [hci1] 35.384366
        Num handles: 1
        Handle: 2719 Address: 64:23:B5:94:C5:F1 (OUI 64-23-B5)
        Count: 1
< ACL Data TX: Handle 2719 flags 0x00 dlen 9              #297 [hci1] 35.384393
      ATT: Write Request (0x12) len 4
        Handle: 0x0166
          Data: 0100
> HCI Event: Number of Completed Packets (0x13) plen 5    #298 [hci1] 35.449225
        Num handles: 1
        Handle: 2719 Address: 64:23:B5:94:C5:F1 (OUI 64-23-B5)
        Count: 1
        #297: len 9 (1 Kb/s)
        Latency: 64 msec (4-65 msec ~64 msec)
> ACL Data RX: Handle 2719 flags 0x02 dlen 5              #299 [hci1] 35.519115
      ATT: Write Response (0x13) len 0
< HCI Command: Host Number of Com.. (0x03|0x0035) plen 5  #300 [hci1] 35.524390
        Num handles: 1
        Handle: 2719 Address: 64:23:B5:94:C5:F1 (OUI 64-23-B5)
        Count: 1
< ACL Data TX: Handle 2719 flags 0x00 dlen 9              #301 [hci1] 35.524444
      ATT: Write Request (0x12) len 4
        Handle: 0x0169
          Data: 0100
> HCI Event: Number of Completed Packets (0x13) plen 5    #302 [hci1] 35.589199
        Num handles: 1
        Handle: 2719 Address: 64:23:B5:94:C5:F1 (OUI 64-23-B5)
        Count: 1
        #301: len 9 (1 Kb/s)
        Latency: 64 msec (4-65 msec ~64 msec)
> ACL Data RX: Handle 2719 flags 0x02 dlen 5              #303 [hci1] 35.659182
      ATT: Write Response (0x13) len 0
< HCI Command: Host Number of Com.. (0x03|0x0035) plen 5  #304 [hci1] 35.664405
        Num handles: 1
        Handle: 2719 Address: 64:23:B5:94:C5:F1 (OUI 64-23-B5)
        Count: 1
< ACL Data TX: Handle 2719 flags 0x00 dlen 11             #305 [hci1] 35.664511
      ATT: Read By Type Request (0x08) len 6
        Handle range: 0x016d-0x016e
        Attribute type: Characteristic (0x2803)
> HCI Event: Number of Completed Packets (0x13) plen 5    #306 [hci1] 35.729151
        Num handles: 1
        Handle: 2719 Address: 64:23:B5:94:C5:F1 (OUI 64-23-B5)
        Count: 1
        #305: len 11 (1 Kb/s)
        Latency: 64 msec (4-65 msec ~64 msec)
> ACL Data RX: Handle 2719 flags 0x02 dlen 9              #307 [hci1] 35.799295
      ATT: Error Response (0x01) len 4
        Read By Type Request (0x08)
        Handle: 0x016d
        Error: Attribute Not Found (0x0a)
< HCI Command: Host Number of Com.. (0x03|0x0035) plen 5  #308 [hci1] 35.804834
        Num handles: 1
        Handle: 2719 Address: 64:23:B5:94:C5:F1 (OUI 64-23-B5)
        Count: 1
< ACL Data TX: Handle 2719 flags 0x00 dlen 7              #309 [hci1] 35.804933
      ATT: Read Request (0x0a) len 2
        Handle: 0x0162
> HCI Event: Number of Completed Packets (0x13) plen 5    #310 [hci1] 35.869171
        Num handles: 1
        Handle: 2719 Address: 64:23:B5:94:C5:F1 (OUI 64-23-B5)
        Count: 1
        #309: len 7 (0 Kb/s)
        Latency: 64 msec (4-65 msec ~64 msec)
> ACL Data RX: Handle 2719 flags 0x02 dlen 22             #311 [hci1] 35.939423
      ATT: Read Response (0x0b) len 17
< HCI Command: Host Number of Com.. (0x03|0x0035) plen 5  #312 [hci1] 35.944463
        Num handles: 1
        Handle: 2719 Address: 64:23:B5:94:C5:F1 (OUI 64-23-B5)
        Count: 1
< ACL Data TX: Handle 2719 flags 0x00 dlen 7              #313 [hci1] 35.944506
      ATT: Read Request (0x0a) len 2
        Handle: 0x0168
> HCI Event: Number of Completed Packets (0x13) plen 5    #314 [hci1] 36.009049
        Num handles: 1
        Handle: 2719 Address: 64:23:B5:94:C5:F1 (OUI 64-23-B5)
        Count: 1
        #313: len 7 (0 Kb/s)
        Latency: 64 msec (4-65 msec ~64 msec)
> ACL Data RX: Handle 2719 flags 0x02 dlen 6              #315 [hci1] 36.079207
      ATT: Read Response (0x0b) len 1
< HCI Command: Host Number of Com.. (0x03|0x0035) plen 5  #316 [hci1] 36.084550
        Num handles: 1
        Handle: 2719 Address: 64:23:B5:94:C5:F1 (OUI 64-23-B5)
        Count: 1
< ACL Data TX: Handle 2719 flags 0x00 dlen 7              #317 [hci1] 36.084641
      ATT: Read Request (0x0a) len 2
        Handle: 0x016b
> HCI Event: Number of Completed Packets (0x13) plen 5    #318 [hci1] 36.149087
        Num handles: 1
        Handle: 2719 Address: 64:23:B5:94:C5:F1 (OUI 64-23-B5)
        Count: 1
        #317: len 7 (0 Kb/s)
        Latency: 64 msec (4-65 msec ~64 msec)
> ACL Data RX: Handle 2719 flags 0x02 dlen 6              #319 [hci1] 36.219150
      ATT: Read Response (0x0b) len 1
< HCI Command: Host Number of Com.. (0x03|0x0035) plen 5  #320 [hci1] 36.224760
        Num handles: 1
        Handle: 2719 Address: 64:23:B5:94:C5:F1 (OUI 64-23-B5)
        Count: 1
< ACL Data TX: Handle 326 flags 0x00 dlen 13              #321 [hci1] 36.264710
      ATT: Find By Type Value Request (0x06) len 8
        Handle range: 0x0001-0xffff
        Attribute type: Primary Service (0x2800)
          UUID: Coordinated Set Identification (0x1846)
> HCI Event: Number of Completed Packets (0x13) plen 5    #322 [hci1] 36.319200
        Num handles: 1
        Handle: 326 Address: B8:7C:99:F9:E0:AE (OUI B8-7C-99)
        Count: 1
        #321: len 13 (1 Kb/s)
        Latency: 54 msec (4-65 msec ~51 msec)
> ACL Data RX: Handle 326 flags 0x02 dlen 9               #323 [hci1] 36.389190
      ATT: Find By Type Value Response (0x07) len 4
        Handle range: 0x0160-0x016e
< HCI Command: Host Number of Com.. (0x03|0x0035) plen 5  #324 [hci1] 36.404858
        Num handles: 1
        Handle: 326 Address: B8:7C:99:F9:E0:AE (OUI B8-7C-99)
        Count: 1
< ACL Data TX: Handle 326 flags 0x00 dlen 13              #325 [hci1] 36.404984
      ATT: Find By Type Value Request (0x06) len 8
        Handle range: 0x016f-0xffff
        Attribute type: Primary Service (0x2800)
          UUID: Coordinated Set Identification (0x1846)
> HCI Event: Number of Completed Packets (0x13) plen 5    #326 [hci1] 36.459160
        Num handles: 1
        Handle: 326 Address: B8:7C:99:F9:E0:AE (OUI B8-7C-99)
        Count: 1
        #325: len 13 (1 Kb/s)
        Latency: 54 msec (4-65 msec ~52 msec)
> ACL Data RX: Handle 326 flags 0x02 dlen 9               #327 [hci1] 36.529266
      ATT: Error Response (0x01) len 4
        Find By Type Value Request (0x06)
        Handle: 0x016f
        Error: Attribute Not Found (0x0a)
< HCI Command: Host Number of Com.. (0x03|0x0035) plen 5  #328 [hci1] 36.544355
        Num handles: 1
        Handle: 326 Address: B8:7C:99:F9:E0:AE (OUI B8-7C-99)
        Count: 1
< ACL Data TX: Handle 326 flags 0x00 dlen 11              #329 [hci1] 36.544432
      ATT: Read By Type Request (0x08) len 6
        Handle range: 0x0160-0x016e
        Attribute type: Characteristic (0x2803)
> HCI Event: Number of Completed Packets (0x13) plen 5    #330 [hci1] 36.599201
        Num handles: 1
        Handle: 326 Address: B8:7C:99:F9:E0:AE (OUI B8-7C-99)
        Count: 1
        #329: len 11 (1 Kb/s)
        Latency: 54 msec (4-65 msec ~53 msec)
> ACL Data RX: Handle 326 flags 0x02 dlen 27              #331 [hci1] 36.669516
      ATT: Read By Type Response (0x09) len 22
        Attribute data length: 7
        Attribute data list: 3 entries
        Handle: 0x0161
        Value: 126201842b
            Properties: 0x12
              Read (0x02)
              Notify (0x10)
            Value Handle: 0x0162
            Value UUID: Set Identity Resolving Key (0x2b84)
        Handle: 0x0164
        Value: 1a6501862b
            Properties: 0x1a
              Read (0x02)
              Write (0x08)
              Notify (0x10)
            Value Handle: 0x0165
            Value UUID: Set Member Lock (0x2b86)
        Handle: 0x0167
        Value: 126801852b
            Properties: 0x12
              Read (0x02)
              Notify (0x10)
            Value Handle: 0x0168
            Value UUID: Coordinated Set Size (0x2b85)
< HCI Command: Host Number of Com.. (0x03|0x0035) plen 5  #332 [hci1] 36.684390
        Num handles: 1
        Handle: 326 Address: B8:7C:99:F9:E0:AE (OUI B8-7C-99)
        Count: 1
< ACL Data TX: Handle 326 flags 0x00 dlen 9               #333 [hci1] 36.684426
      ATT: Find Information Request (0x04) len 4
        Handle range: 0x0162-0x016e
> HCI Event: Number of Completed Packets (0x13) plen 5    #334 [hci1] 36.739105
        Num handles: 1
        Handle: 326 Address: B8:7C:99:F9:E0:AE (OUI B8-7C-99)
        Count: 1
        #333: len 9 (1 Kb/s)
        Latency: 54 msec (4-65 msec ~54 msec)
> ACL Data RX: Handle 326 flags 0x02 dlen 26              #335 [hci1] 36.809418
      ATT: Find Information Response (0x05) len 21
        Format: UUID-16 (0x01)
        Handle: 0x0162
        UUID: Set Identity Resolving Key (0x2b84)
        Handle: 0x0163
        UUID: Client Characteristic Configuration (0x2902)
        Handle: 0x0164
        UUID: Characteristic (0x2803)
        Handle: 0x0165
        UUID: Set Member Lock (0x2b86)
        Handle: 0x0166
        UUID: Client Characteristic Configuration (0x2902)
< HCI Command: Host Number of Com.. (0x03|0x0035) plen 5  #336 [hci1] 36.824528
        Num handles: 1
        Handle: 326 Address: B8:7C:99:F9:E0:AE (OUI B8-7C-99)
        Count: 1
< ACL Data TX: Handle 326 flags 0x00 dlen 9               #337 [hci1] 36.824559
      ATT: Find Information Request (0x04) len 4
        Handle range: 0x0165-0x016e
> HCI Event: Number of Completed Packets (0x13) plen 5    #338 [hci1] 36.879114
        Num handles: 1
        Handle: 326 Address: B8:7C:99:F9:E0:AE (OUI B8-7C-99)
        Count: 1
        #337: len 9 (1 Kb/s)
        Latency: 54 msec (4-65 msec ~54 msec)
> ACL Data RX: Handle 326 flags 0x02 dlen 26              #339 [hci1] 36.949557
      ATT: Find Information Response (0x05) len 21
        Format: UUID-16 (0x01)
        Handle: 0x0165
        UUID: Set Member Lock (0x2b86)
        Handle: 0x0166
        UUID: Client Characteristic Configuration (0x2902)
        Handle: 0x0167
        UUID: Characteristic (0x2803)
        Handle: 0x0168
        UUID: Coordinated Set Size (0x2b85)
        Handle: 0x0169
        UUID: Client Characteristic Configuration (0x2902)
< HCI Command: Host Number of Com.. (0x03|0x0035) plen 5  #340 [hci1] 36.964416
        Num handles: 1
        Handle: 326 Address: B8:7C:99:F9:E0:AE (OUI B8-7C-99)
        Count: 1
< ACL Data TX: Handle 326 flags 0x00 dlen 9               #341 [hci1] 36.964496
      ATT: Find Information Request (0x04) len 4
        Handle range: 0x0168-0x016e
> HCI Event: Number of Completed Packets (0x13) plen 5    #342 [hci1] 37.019115
        Num handles: 1
        Handle: 326 Address: B8:7C:99:F9:E0:AE (OUI B8-7C-99)
        Count: 1
        #341: len 9 (1 Kb/s)
        Latency: 54 msec (4-65 msec ~54 msec)
> ACL Data RX: Handle 326 flags 0x02 dlen 26              #343 [hci1] 37.089454
      ATT: Find Information Response (0x05) len 21
        Format: UUID-16 (0x01)
        Handle: 0x0168
        UUID: Coordinated Set Size (0x2b85)
        Handle: 0x0169
        UUID: Client Characteristic Configuration (0x2902)
        Handle: 0x016a
        UUID: Characteristic (0x2803)
        Handle: 0x016b
        UUID: Set Member Rank (0x2b87)
        Handle: 0x016c
        UUID: Characteristic (0x2803)
< HCI Command: Host Number of Com.. (0x03|0x0035) plen 5  #344 [hci1] 37.104425
        Num handles: 1
        Handle: 326 Address: B8:7C:99:F9:E0:AE (OUI B8-7C-99)
        Count: 1
< ACL Data TX: Handle 326 flags 0x00 dlen 11              #345 [hci1] 37.104516
      ATT: Read By Type Request (0x08) len 6
        Handle range: 0x0168-0x016e
        Attribute type: Characteristic (0x2803)
> HCI Event: Number of Completed Packets (0x13) plen 5    #346 [hci1] 37.159157
        Num handles: 1
        Handle: 326 Address: B8:7C:99:F9:E0:AE (OUI B8-7C-99)
        Count: 1
        #345: len 11 (1 Kb/s)
        Latency: 54 msec (4-65 msec ~54 msec)
> ACL Data RX: Handle 326 flags 0x02 dlen 20              #347 [hci1] 37.229372
      ATT: Read By Type Response (0x09) len 15
        Attribute data length: 7
        Attribute data list: 2 entries
        Handle: 0x016a
        Value: 026b01872b
            Properties: 0x02
              Read (0x02)
            Value Handle: 0x016b
            Value UUID: Set Member Rank (0x2b87)
        Handle: 0x016c
        Value: 1a6d011a2c
            Properties: 0x1a
              Read (0x02)
              Write (0x08)
              Notify (0x10)
            Value Handle: 0x016d
            Value UUID: Unknown (0x2c1a)
< HCI Command: Host Number of Com.. (0x03|0x0035) plen 5  #348 [hci1] 37.244463
        Num handles: 1
        Handle: 326 Address: B8:7C:99:F9:E0:AE (OUI B8-7C-99)
        Count: 1
< ACL Data TX: Handle 326 flags 0x00 dlen 9               #349 [hci1] 37.244540
      ATT: Write Request (0x12) len 4
        Handle: 0x0163
          Data: 0100
> HCI Event: Number of Completed Packets (0x13) plen 5    #350 [hci1] 37.299226
        Num handles: 1
        Handle: 326 Address: B8:7C:99:F9:E0:AE (OUI B8-7C-99)
        Count: 1
        #349: len 9 (1 Kb/s)
        Latency: 54 msec (4-65 msec ~54 msec)
> ACL Data RX: Handle 326 flags 0x02 dlen 5               #351 [hci1] 37.369170
      ATT: Write Response (0x13) len 0
< HCI Command: Host Number of Com.. (0x03|0x0035) plen 5  #352 [hci1] 37.384540
        Num handles: 1
        Handle: 326 Address: B8:7C:99:F9:E0:AE (OUI B8-7C-99)
        Count: 1
< ACL Data TX: Handle 326 flags 0x00 dlen 9               #353 [hci1] 37.384628
      ATT: Write Request (0x12) len 4
        Handle: 0x0166
          Data: 0100
> HCI Event: Number of Completed Packets (0x13) plen 5    #354 [hci1] 37.439118
        Num handles: 1
        Handle: 326 Address: B8:7C:99:F9:E0:AE (OUI B8-7C-99)
        Count: 1
        #353: len 9 (1 Kb/s)
        Latency: 54 msec (4-65 msec ~54 msec)
> ACL Data RX: Handle 326 flags 0x02 dlen 5               #355 [hci1] 37.509061
      ATT: Write Response (0x13) len 0
< HCI Command: Host Number of Com.. (0x03|0x0035) plen 5  #356 [hci1] 37.524372
        Num handles: 1
        Handle: 326 Address: B8:7C:99:F9:E0:AE (OUI B8-7C-99)
        Count: 1
< ACL Data TX: Handle 326 flags 0x00 dlen 9               #357 [hci1] 37.524404
      ATT: Write Request (0x12) len 4
        Handle: 0x0169
          Data: 0100
> HCI Event: Number of Completed Packets (0x13) plen 5    #358 [hci1] 37.579114
        Num handles: 1
        Handle: 326 Address: B8:7C:99:F9:E0:AE (OUI B8-7C-99)
        Count: 1
        #357: len 9 (1 Kb/s)
        Latency: 54 msec (4-65 msec ~54 msec)
> ACL Data RX: Handle 326 flags 0x02 dlen 5               #359 [hci1] 37.649085
      ATT: Write Response (0x13) len 0
< HCI Command: Host Number of Com.. (0x03|0x0035) plen 5  #360 [hci1] 37.664374
        Num handles: 1
        Handle: 326 Address: B8:7C:99:F9:E0:AE (OUI B8-7C-99)
        Count: 1
< ACL Data TX: Handle 326 flags 0x00 dlen 11              #361 [hci1] 37.664408
      ATT: Read By Type Request (0x08) len 6
        Handle range: 0x016d-0x016e
        Attribute type: Characteristic (0x2803)
> HCI Event: Number of Completed Packets (0x13) plen 5    #362 [hci1] 37.719091
        Num handles: 1
        Handle: 326 Address: B8:7C:99:F9:E0:AE (OUI B8-7C-99)
        Count: 1
        #361: len 11 (1 Kb/s)
        Latency: 54 msec (4-65 msec ~54 msec)
> ACL Data RX: Handle 326 flags 0x02 dlen 9               #363 [hci1] 37.789220
      ATT: Error Response (0x01) len 4
        Read By Type Request (0x08)
        Handle: 0x016d
        Error: Attribute Not Found (0x0a)
< HCI Command: Host Number of Com.. (0x03|0x0035) plen 5  #364 [hci1] 37.804515
        Num handles: 1
        Handle: 326 Address: B8:7C:99:F9:E0:AE (OUI B8-7C-99)
        Count: 1
< ACL Data TX: Handle 326 flags 0x00 dlen 7               #365 [hci1] 37.804617
      ATT: Read Request (0x0a) len 2
        Handle: 0x0162
> HCI Event: Number of Completed Packets (0x13) plen 5    #366 [hci1] 37.859113
        Num handles: 1
        Handle: 326 Address: B8:7C:99:F9:E0:AE (OUI B8-7C-99)
        Count: 1
        #365: len 7 (1 Kb/s)
        Latency: 54 msec (4-65 msec ~54 msec)
> ACL Data RX: Handle 326 flags 0x02 dlen 22              #367 [hci1] 37.929309
      ATT: Read Response (0x0b) len 17
< HCI Command: Host Number of Com.. (0x03|0x0035) plen 5  #368 [hci1] 37.944850
        Num handles: 1
        Handle: 326 Address: B8:7C:99:F9:E0:AE (OUI B8-7C-99)
        Count: 1
< ACL Data TX: Handle 326 flags 0x00 dlen 7               #369 [hci1] 37.944942
      ATT: Read Request (0x0a) len 2
        Handle: 0x0168
> HCI Event: Number of Completed Packets (0x13) plen 5    #370 [hci1] 37.999204
        Num handles: 1
        Handle: 326 Address: B8:7C:99:F9:E0:AE (OUI B8-7C-99)
        Count: 1
        #369: len 7 (1 Kb/s)
        Latency: 54 msec (4-65 msec ~54 msec)
> ACL Data RX: Handle 326 flags 0x02 dlen 6               #371 [hci1] 38.069089
      ATT: Read Response (0x0b) len 1
< HCI Command: Host Number of Com.. (0x03|0x0035) plen 5  #372 [hci1] 38.084581
        Num handles: 1
        Handle: 326 Address: B8:7C:99:F9:E0:AE (OUI B8-7C-99)
        Count: 1
< ACL Data TX: Handle 326 flags 0x00 dlen 7               #373 [hci1] 38.084627
      ATT: Read Request (0x0a) len 2
        Handle: 0x016b
> HCI Event: Number of Completed Packets (0x13) plen 5    #374 [hci1] 38.139137
        Num handles: 1
        Handle: 326 Address: B8:7C:99:F9:E0:AE (OUI B8-7C-99)
        Count: 1
        #373: len 7 (1 Kb/s)
        Latency: 54 msec (4-65 msec ~54 msec)
> ACL Data RX: Handle 326 flags 0x02 dlen 6               #375 [hci1] 38.209138
      ATT: Read Response (0x0b) len 1
< HCI Command: Host Number of Com.. (0x03|0x0035) plen 5  #376 [hci1] 38.224887
        Num handles: 1
        Handle: 326 Address: B8:7C:99:F9:E0:AE (OUI B8-7C-99)
        Count: 1
< HCI Command: Disconnect (0x01|0x0006) plen 3            #377 [hci1] 39.294710
        Handle: 1710 Address: DF:A9:FF:F6:B1:1A (OUI DF-A9-FF)
        Reason: Remote User Terminated Connection (0x13)
> HCI Event: Command Status (0x0f) plen 4                 #378 [hci1] 39.295207
      Disconnect (0x01|0x0006) ncmd 1
        Status: Success (0x00)
< HCI Command: Disconnect (0x01|0x0006) plen 3            #379 [hci1] 39.334387
        Handle: 2719 Address: 64:23:B5:94:C5:F1 (OUI 64-23-B5)
        Reason: Remote User Terminated Connection (0x13)
> HCI Event: Command Status (0x0f) plen 4                 #380 [hci1] 39.334835
      Disconnect (0x01|0x0006) ncmd 1
        Status: Success (0x00)
< HCI Command: Disconnect (0x01|0x0006) plen 3            #381 [hci1] 39.364428
        Handle: 326 Address: B8:7C:99:F9:E0:AE (OUI B8-7C-99)
        Reason: Remote User Terminated Connection (0x13)
> HCI Event: Command Status (0x0f) plen 4                 #382 [hci1] 39.364890
      Disconnect (0x01|0x0006) ncmd 1
        Status: Success (0x00)
> HCI Event: Disconnect Complete (0x05) plen 4            #383 [hci1] 39.409038
        Status: Success (0x00)
        Handle: 1710 Address: DF:A9:FF:F6:B1:1A (OUI DF-A9-FF)
        Reason: Connection Terminated By Local Host (0x16)
> HCI Event: Disconnect Complete (0x05) plen 4            #384 [hci1] 39.439116
        Status: Success (0x00)
        Handle: 2719 Address: 64:23:B5:94:C5:F1 (OUI 64-23-B5)
        Reason: Connection Terminated By Local Host (0x16)
> HCI Event: Disconnect Complete (0x05) plen 4            #385 [hci1] 39.469052
        Status: Success (0x00)
        Handle: 326 Address: B8:7C:99:F9:E0:AE (OUI B8-7C-99)
        Reason: Connection Terminated By Local Host (0x16)
< HCI Command: Reset (0x03|0x0003) plen 0                #386 [hci1] 366.478075
> HCI Event: Command Complete (0x0e) plen 4              #387 [hci1] 366.478540
      Reset (0x03|0x0003) ncmd 1
        Status: Success (0x00)
@ USER Close: main                                   {0x0001} [hci1] 366.488011
= Close Index: 00:00:00:00:00:00                              [hci1] 366.491204
