Bluetooth monitor ver 5.72
btmon[2341266]: = Note: Linux version 6.14.0-36-generic (x86_64)                                                         0.905325
btmon[2341266]: = Note: Bluetooth subsystem version 2.22                                                                 0.905327
= New Index: 00:00:00:00:00:00 (Primary,UART,hci1)                                                                       0.905328
= New Index: 48:5F:99:8E:E0:64 (Primary,USB,hci0)                                                                        0.905328
= Open Index: 00:00:00:00:00:00                                                                                          0.918419
= Index Info: 00:00:00:00:00:00 (Nordic Semiconductor ASA)                                                               0.918424
zephyr.exe[2341268]: @ USER Open: main (privileged) version 2.22                                                {0x0001} 0.918427
zephyr.exe[2341268]: < HCI Command: Reset (0x03|0x0003) plen 0                                                        #1 0.918785
> HCI Event: Command Complete (0x0e) plen 4                                                                           #2 0.919335
      Reset (0x03|0x0003) ncmd 1
        Status: Success (0x00)
zephyr.exe[2341268]: < HCI Command: Read Local Supported Features (0x04|0x0003) plen 0                                #3 0.938347
> HCI Event: Command Complete (0x0e) plen 12                                                                          #4 0.938840
      Read Local Supported Features (0x04|0x0003) ncmd 1
        Status: Success (0x00)
        Features: 0x00 0x00 0x00 0x00 0x60 0x00 0x00 0x00
          BR/EDR Not Supported
          LE Supported (Controller)
zephyr.exe[2341268]: < HCI Command: Read Local Version Information (0x04|0x0001) plen 0                               #5 0.958312
> HCI Event: Command Complete (0x0e) plen 12                                                                          #6 0.958936
      Read Local Version Information (0x04|0x0001) ncmd 1
        Status: Success (0x00)
        HCI version: Reserved (0x0f) - Revision 12393 (0x3069)
        LMP version: Reserved (0x0f) - Subversion 12393 (0x3069)
        Manufacturer: Nordic Semiconductor ASA (89)
zephyr.exe[2341268]: < HCI Command: Read Local Supported Commands (0x04|0x0002) plen 0                                #7 0.978349
> HCI Event: Command Complete (0x0e) plen 68                                                                          #8 0.979430
      Read Local Supported Commands (0x04|0x0002) ncmd 1
        Status: Success (0x00)
        Commands: 119 entries
          Disconnect (Octet 0 - Bit 5)
          Read Remote Version Information (Octet 2 - Bit 7)
          Set Event Mask (Octet 5 - Bit 6)
          Reset (Octet 5 - Bit 7)
          Read Connection Accept Timeout (Octet 7 - Bit 2)
          Write Connection Accept Timeout (Octet 7 - Bit 3)
          Read Transmit Power Level (Octet 10 - Bit 2)
          Set Controller To Host Flow Control (Octet 10 - Bit 5)
          Host Buffer Size (Octet 10 - Bit 6)
          Host Number of Completed Packets (Octet 10 - Bit 7)
          Read Local Version Information (Octet 14 - Bit 3)
          Read Local Supported Features (Octet 14 - Bit 5)
          Read BD ADDR (Octet 15 - Bit 1)
          Read RSSI (Octet 15 - Bit 5)
          Set Event Mask Page 2 (Octet 22 - Bit 2)
          LE Set Event Mask (Octet 25 - Bit 0)
          LE Read Buffer Size (Octet 25 - Bit 1)
          LE Read Local Supported Features (Octet 25 - Bit 2)
          LE Set Random Address (Octet 25 - Bit 4)
          LE Set Advertising Parameters (Octet 25 - Bit 5)
          LE Read Advertising Channel TX Power (Octet 25 - Bit 6)
          LE Set Advertising Data (Octet 25 - Bit 7)
          LE Set Scan Response Data (Octet 26 - Bit 0)
          LE Set Advertise Enable (Octet 26 - Bit 1)
          LE Set Scan Parameters (Octet 26 - Bit 2)
          LE Set Scan Enable (Octet 26 - Bit 3)
          LE Create Connection (Octet 26 - Bit 4)
          LE Create Connection Cancel (Octet 26 - Bit 5)
          LE Read Accept List Size (Octet 26 - Bit 6)
          LE Clear Accept List (Octet 26 - Bit 7)
          LE Add Device To Accept List (Octet 27 - Bit 0)
          LE Remove Device From Accept List (Octet 27 - Bit 1)
          LE Connection Update (Octet 27 - Bit 2)
          LE Set Host Channel Classification (Octet 27 - Bit 3)
          LE Read Channel Map (Octet 27 - Bit 4)
          LE Read Remote Used Features (Octet 27 - Bit 5)
          LE Encrypt (Octet 27 - Bit 6)
          LE Rand (Octet 27 - Bit 7)
          LE Start Encryption (Octet 28 - Bit 0)
          LE Long Term Key Request Reply (Octet 28 - Bit 1)
          LE Long Term Key Request Neg Reply (Octet 28 - Bit 2)
          LE Read Supported States (Octet 28 - Bit 3)
          LE Receiver Test (Octet 28 - Bit 4)
          LE Transmitter Test (Octet 28 - Bit 5)
          LE Test End (Octet 28 - Bit 6)
          Read Authenticated Payload Timeout (Octet 32 - Bit 4)
          Write Authenticated Payload Timeout (Octet 32 - Bit 5)
          LE Set Data Length (Octet 33 - Bit 6)
          LE Read Suggested Default Data Length (Octet 33 - Bit 7)
          LE Write Suggested Default Data Length (Octet 34 - Bit 0)
          LE Add Device To Resolving List (Octet 34 - Bit 3)
          LE Remove Device From Resolving List (Octet 34 - Bit 4)
          LE Clear Resolving List (Octet 34 - Bit 5)
          LE Read Resolving List Size (Octet 34 - Bit 6)
          LE Set Address Resolution Enable (Octet 35 - Bit 1)
          LE Set Resolvable Private Address Timeout (Octet 35 - Bit 2)
          LE Read Maximum Data Length (Octet 35 - Bit 3)
          LE Read PHY (Octet 35 - Bit 4)
          LE Set Default PHY (Octet 35 - Bit 5)
          LE Set PHY (Octet 35 - Bit 6)
          LE Enhanced Receiver Test (Octet 35 - Bit 7)
          LE Enhanced Transmitter Test (Octet 36 - Bit 0)
          LE Set Advertising Set Random Address (Octet 36 - Bit 1)
          LE Set Extended Advertising Parameters (Octet 36 - Bit 2)
          LE Set Extended Advertising Data (Octet 36 - Bit 3)
          LE Set Extended Scan Response Data (Octet 36 - Bit 4)
          LE Set Extended Advertising Enable (Octet 36 - Bit 5)
          LE Read Maximum Advertising Data Length (Octet 36 - Bit 6)
          LE Read Number of Supported Advertising Sets (Octet 36 - Bit 7)
          LE Remove Advertising Set (Octet 37 - Bit 0)
          LE Clear Advertising Sets (Octet 37 - Bit 1)
          LE Set Periodic Advertising Parameters (Octet 37 - Bit 2)
          LE Set Periodic Advertising Data (Octet 37 - Bit 3)
          LE Set Periodic Advertising Enable (Octet 37 - Bit 4)
          LE Set Extended Scan Parameters (Octet 37 - Bit 5)
          LE Set Extended Scan Enable (Octet 37 - Bit 6)
          LE Extended Create Connection (Octet 37 - Bit 7)
          LE Periodic Advertising Create Sync (Octet 38 - Bit 0)
          LE Periodic Advertising Create Sync Cancel (Octet 38 - Bit 1)
          LE Periodic Advertising Terminate Sync (Octet 38 - Bit 2)
          LE Add Device To Periodic Advertiser List (Octet 38 - Bit 3)
          LE Remove Device From Periodic Advertiser List (Octet 38 - Bit 4)
          LE Clear Periodic Advertiser List (Octet 38 - Bit 5)
          LE Read Periodic Advertiser List Size (Octet 38 - Bit 6)
          LE Read Transmit Power (Octet 38 - Bit 7)
          LE Read RF Path Compensation (Octet 39 - Bit 0)
          LE Write RF Path Compensation (Octet 39 - Bit 1)
          LE Set Privacy Mode (Octet 39 - Bit 2)
          LE Periodic Advertising Receive Enable (Octet 40 - Bit 5)
          LE Periodic Advertising Sync Transfer (Octet 40 - Bit 6)
          LE Periodic Advertising Set Info Transfer (Octet 40 - Bit 7)
          LE Periodic Advertising Sync Transfer Parameters (Octet 41 - Bit 0)
          LE Set Default Periodic Advertisng Sync Transfer Parameters (Octet 41 - Bit 1)
          LE Read Buffer v2 (Octet 41 - Bit 5)
          LE Read ISO TX Sync (Octet 41 - Bit 6)
          LE Set Connected Isochronous Group Parameters (Octet 41 - Bit 7)
          LE Set Connected Isochronous Group Parameters Test (Octet 42 - Bit 0)
          LE Create Connected Isochronous Stream (Octet 42 - Bit 1)
          LE Remove Connected Isochronous Group (Octet 42 - Bit 2)
          LE Accept Connected Isochronous Stream Request (Octet 42 - Bit 3)
          LE Reject Connected Isochronous Stream Request (Octet 42 - Bit 4)
          LE Create Broadcast Isochronous Group (Octet 42 - Bit 5)
          LE Create Broadcast Isochronous Group Test (Octet 42 - Bit 6)
          LE Terminate Broadcast Isochronous Group (Octet 42 - Bit 7)
          LE Broadcast Isochronous Group Create Sync (Octet 43 - Bit 0)
          LE Broadcast Isochronous Group Terminate Sync (Octet 43 - Bit 1)
          LE Request Peer SCA (Octet 43 - Bit 2)
          LE Setup Isochronous Data Path (Octet 43 - Bit 3)
          LE Remove Isochronous Data Path (Octet 43 - Bit 4)
          LE Isochronous Transmit Test (Octet 43 - Bit 5)
          LE Isochronous Receive Test (Octet 43 - Bit 6)
          LE Isochronous Read Test Counters (Octet 43 - Bit 7)
          LE Isochronous Read Test Counters (Octet 44 - Bit 0)
          LE Set Host Feature (Octet 44 - Bit 1)
          Octet 44 - Bit 2 
          Octet 45 - Bit 6 
          Octet 46 - Bit 0 
          Octet 46 - Bit 1 
          Octet 46 - Bit 2 
zephyr.exe[2341268]: < HCI Command: Host Buffer Size (0x03|0x0033) plen 7                                             #9 0.998330
        ACL MTU: 255  ACL max packet: 16
        SCO MTU: 0    SCO max packet: 0
> HCI Event: Command Complete (0x0e) plen 4                                                                          #10 0.998892
      Host Buffer Size (0x03|0x0033) ncmd 1
        Status: Success (0x00)
zephyr.exe[2341268]: < HCI Command: Set Controller To Host Flow Control (0x03|0x0031) plen 1                         #11 1.018316
        Flow control: ACL Data Packets (0x01)
> HCI Event: Command Complete (0x0e) plen 4                                                                          #12 1.018763
      Set Controller To Host Flow Control (0x03|0x0031) ncmd 1
        Status: Success (0x00)
zephyr.exe[2341268]: < HCI Command: LE Read Local Supported Features (0x08|0x0003) plen 0                            #13 1.038280
> HCI Event: Command Complete (0x0e) plen 12                                                                         #14 1.038802
      LE Read Local Supported Features (0x08|0x0003) ncmd 1
        Status: Success (0x00)
        Features: 0xfd 0x79 0x00 0xf7 0x30 0x01 0x00 0x00
          LE Encryption
          Extended Reject Indication
          Peripheral-initiated Features Exchange
          LE Ping
          LE Data Packet Length Extension
          LL Privacy
          Extended Scanner Filter Policies
          LE 2M PHY
          LE Coded PHY
          LE Extended Advertising
          LE Periodic Advertising
          Channel Selection Algorithm #2
          Periodic Advertising Sync Transfer - Sender
          Periodic Advertising Sync Transfer - Recipient
          Sleep Clock Accuracy Updates
          Connected Isochronous Stream - Central
          Connected Isochronous Stream - Peripheral
          Isochronous Broadcaster
          Synchronized Receiver
          Periodic Advertising ADI support
          Connection Subrating
          Unknown features (0x0000010000000000)
zephyr.exe[2341268]: < HCI Command: LE Set Host Feature (0x08|0x0074) plen 2                                         #15 1.058353
        Bit Number: 32
          Connected Isochronous Stream (Host Support)
        Bit Value: 1
> HCI Event: Command Complete (0x0e) plen 4                                                                          #16 1.058812
      LE Set Host Feature (0x08|0x0074) ncmd 1
        Status: Success (0x00)
zephyr.exe[2341268]: < HCI Command: LE Read Buffer v2 (0x08|0x0060) plen 0                                           #17 1.078355
> HCI Event: Command Complete (0x0e) plen 10                                                                         #18 1.078894
      LE Read Buffer v2 (0x08|0x0060) ncmd 1
        Status: Success (0x00)
        ACL MTU: 27
        ACL max packet: 3
        ISO MTU: 318
        ISO max packet: 3
zephyr.exe[2341268]: < HCI Command: LE Read Maximum Advertising Data Length (0x08|0x003a) plen 0                     #19 1.098367
> HCI Event: Command Complete (0x0e) plen 6                                                                          #20 1.098823
      LE Read Maximum Advertising Data Length (0x08|0x003a) ncmd 1
        Status: Success (0x00)
        Max length: 1650
zephyr.exe[2341268]: < HCI Command: LE Read Supported States (0x08|0x001c) plen 0                                    #21 1.118351
> HCI Event: Command Complete (0x0e) plen 12                                                                         #22 1.119026
      LE Read Supported States (0x08|0x001c) ncmd 1
        Status: Success (0x00)
        States: 0x000003ff3e0306ff
          Non-connectable Advertising State
          Scannable Advertising State
          Connectable Advertising State
          High Duty Cycle Directed Advertising State
          Passive Scanning State
          Active Scanning State
          Initiating State
            and Connection State (Central Role)
          Connection State (Peripheral Role)
          Scannable Advertising State
            and Passive Scanning State
          Connectable Advertising State
            and Passive Scanning State
          Non-connectable Advertising State
            and Initiating State
          Scannable Advertising State
            and Initiating State
          Active Scanning State
            and Connection State (Central Role)
          Passive Scanning State
            and Connection State (Peripheral Role)
          Active Scanning State
            and Connection State (Peripheral Role)
          Initiating State
            and Connection State (Central Role)
            and Central Role & Central Role
          Low Duty Cycle Directed Advertising State
          Connectable Advertising State
            and Initiating State
            and Central Role & Peripheral Role
          High Duty Cycle Directed Advertising State
            and Initiating State
            and Central Role & Peripheral Role
          Low Duty Cycle Directed Advertising State
            and Initiating State
            and Central Role & Peripheral Role
          Connectable Advertising State
            and Connection State (Central Role)
            and Central Role & Peripheral Role
          High Duty Cycle Directed Advertising State
            and Connection State (Central Role)
            and Central Role & Peripheral Role
          Low Duty Cycle Directed Advertising State
            and Connection State (Central Role)
            and Central Role & Peripheral Role
          Connectable Advertising State
            and Connection State (Peripheral Role)
            and Central Role & Peripheral Role
          High Duty Cycle Directed Advertising State
            and Connection State (Peripheral Role)
            and Peripheral Role & Peripheral Role
          Low Duty Cycle Directed Advertising State
            and Connection State (Peripheral Role)
            and Peripheral Role & Peripheral Role
          Initiating State
            and Connection State (Peripheral Role)
            and Central Role & Peripheral Role
zephyr.exe[2341268]: < HCI Command: LE Read Maximum Data Length (0x08|0x002f) plen 0                                 #23 1.138340
> HCI Event: Command Complete (0x0e) plen 12                                                                         #24 1.138805
      LE Read Maximum Data Length (0x08|0x002f) ncmd 1
        Status: Success (0x00)
        Max TX octets: 251
        Max TX time: 2704
        Max RX octets: 251
        Max RX time: 2704
zephyr.exe[2341268]: < HCI Command: LE Write Suggested Default Data Length (0x08|0x0024) plen 4                      #25 1.158331
        TX octets: 251
        TX time: 2704
> HCI Event: Command Complete (0x0e) plen 4                                                                          #26 1.158815
      LE Write Suggested Default Data Length (0x08|0x0024) ncmd 1
        Status: Success (0x00)
zephyr.exe[2341268]: < HCI Command: LE Read Resolving List Size (0x08|0x002a) plen 0                                 #27 1.178337
> HCI Event: Command Complete (0x0e) plen 5                                                                          #28 1.178826
      LE Read Resolving List Size (0x08|0x002a) ncmd 1
        Status: Success (0x00)
        Size: 8
zephyr.exe[2341268]: < HCI Command: LE Set Event Mask (0x08|0x0001) plen 8                                           #29 1.198373
        Mask: 0x000002023f87fa5e
          LE Advertising Report
          LE Connection Update Complete
          LE Read Remote Used Features Complete
          LE Long Term Key Request
          LE Data Length Change
          LE Enhanced Connection Complete
          LE PHY Update Complete
          LE Extended Advertising Report
          LE Periodic Advertising Sync Established
          LE Periodic Advertising Report
          LE Periodic Advertising Sync Lost
          LE Extended Scan Timeout
          LE Extended Advertising Set Terminated
          LE Scan Request Received
          LE Periodic Advertising Sync Transfer Rvc
          LE CIS Established
          LE CIS Request
          LE Create BIG Complete
          LE Terminate BIG Complete
          LE BIG Sync Estabilished Complete
          LE BIG Sync Lost
          LE BIG Info Advertising Report
          Unknown mask (0x0000020000000000)
> HCI Event: Command Complete (0x0e) plen 4                                                                          #30 1.198891
      LE Set Event Mask (0x08|0x0001) ncmd 1
        Status: Success (0x00)
zephyr.exe[2341268]: < HCI Command: Set Event Mask (0x03|0x0001) plen 8                                              #31 1.218422
        Mask: 0x2000800002008890
          Disconnection Complete
          Encryption Change
          Read Remote Version Information Complete
          Hardware Error
          Data Buffer Overflow
          Encryption Key Refresh Complete
          LE Meta
> HCI Event: Command Complete (0x0e) plen 4                                                                          #32 1.219023
      Set Event Mask (0x03|0x0001) ncmd 1
        Status: Success (0x00)
zephyr.exe[2341268]: < HCI Command: Read BD ADDR (0x04|0x0009) plen 0                                                #33 1.238347
> HCI Event: Command Complete (0x0e) plen 10                                                                         #34 1.238835
      Read BD ADDR (0x04|0x0009) ncmd 1
        Status: Success (0x00)
        Address: 00:00:00:00:00:00 (OUI 00-00-00)
zephyr.exe[2341268]: < HCI Command: LE Set Random Address (0x08|0x0005) plen 6                                       #35 1.258402
        Address: D5:B6:CC:31:DB:3B (Static)
> HCI Event: Command Complete (0x0e) plen 4                                                                          #36 1.258908
      LE Set Random Address (0x08|0x0005) ncmd 1
        Status: Success (0x00)
zephyr.exe[2341268]: < HCI Command: LE Extended Create Connection (0x08|0x0043) plen 26                              #37 3.468366
        Filter policy: Accept list is not used (0x00)
        Own address type: Random (0x01)
        Peer address type: Public (0x00)
        Peer address: DF:A9:FF:F6:B1:1A (OUI DF-A9-FF)
        Initiating PHYs: 0x01
        Entry 0: LE 1M
          Scan interval: 60.000 msec (0x0060)
          Scan window: 60.000 msec (0x0060)
          Min connection interval: 30.00 msec (0x0018)
          Max connection interval: 50.00 msec (0x0028)
          Connection latency: 0 (0x0000)
          Supervision timeout: 4000 msec (0x0190)
          Min connection length: 0.000 msec (0x0000)
          Max connection length: 0.000 msec (0x0000)
> HCI Event: Command Status (0x0f) plen 4                                                                            #38 3.469284
      LE Extended Create Connection (0x08|0x0043) ncmd 1
        Status: Success (0x00)
> HCI Event: LE Meta Event (0x3e) plen 31                                                                            #39 3.539813
      LE Enhanced Connection Complete (0x0a)
        Status: Success (0x00)
        Handle: 486
        Role: Central (0x00)
        Peer address type: Public (0x00)
        Peer address: DF:A9:FF:F6:B1:1A (OUI DF-A9-FF)
        Local resolvable private address: 00:00:00:00:00:00 (Non-Resolvable)
        Peer resolvable private address: 00:00:00:00:00:00 (Non-Resolvable)
        Connection interval: 50.00 msec (0x0028)
        Connection latency: 0 (0x0000)
        Supervision timeout: 4000 msec (0x0190)
        Central clock accuracy: 0x00
zephyr.exe[2341268]: < HCI Command: LE Read Remote Used Features (0x08|0x0016) plen 2                                #40 3.558528
        Handle: 486 Address: DF:A9:FF:F6:B1:1A (OUI DF-A9-FF)
> HCI Event: Command Status (0x0f) plen 4                                                                            #41 3.558998
      LE Read Remote Used Features (0x08|0x0016) ncmd 1
        Status: Success (0x00)
zephyr.exe[2341268]: < HCI Command: LE Set PHY (0x08|0x0032) plen 7                                                  #42 3.578367
        Handle: 486 Address: DF:A9:FF:F6:B1:1A (OUI DF-A9-FF)
        All PHYs preference: 0x00
        TX PHYs preference: 0x02
          LE 2M
        RX PHYs preference: 0x02
          LE 2M
        PHY options preference: Reserved (0x0000)
> HCI Event: Command Status (0x0f) plen 4                                                                            #43 3.578895
      LE Set PHY (0x08|0x0032) ncmd 1
        Status: Success (0x00)
> ACL Data RX: Handle 486 flags 0x02 dlen 6                                                                          #44 3.591089
      SMP: Security Request (0x0b) len 1
        Authentication requirement: No bonding, MITM, SC, No Keypresses (0x0c)
zephyr.exe[2341268]: < HCI Command: Host Number of Completed Packets (0x03|0x0035) plen 5                            #45 3.598576
        Num handles: 1
        Handle: 486 Address: DF:A9:FF:F6:B1:1A (OUI DF-A9-FF)
        Count: 1
zephyr.exe[2341268]: < ACL Data TX: Handle 486 flags 0x00 dlen 11                                                    #46 3.598687
      SMP: Pairing Request (0x01) len 6
        IO capability: DisplayOnly (0x00)
        OOB data: Authentication data not present (0x00)
        Authentication requirement: Bonding, No MITM, SC, No Keypresses (0x09)
        Max encryption key size: 16
        Initiator key distribution: EncKey (0x01)
        Responder key distribution: EncKey IdKey (0x03)
> HCI Event: Number of Completed Packets (0x13) plen 5                                                               #47 3.691114
        Num handles: 1
        Handle: 486 Address: DF:A9:FF:F6:B1:1A (OUI DF-A9-FF)
        Count: 1
        #46: len 11 (0 Kb/s)
        Latency: 92 msec (92-92 msec ~92 msec)
> HCI Event: LE Meta Event (0x3e) plen 12                                                                            #48 3.691395
      LE Read Remote Used Features (0x04)
        Status: Success (0x00)
        Handle: 486 Address: DF:A9:FF:F6:B1:1A (OUI DF-A9-FF)
        Features: 0x2d 0x49 0x00 0xf7 0x67 0xd8 0x00 0x00
          LE Encryption
          Extended Reject Indication
          Peripheral-initiated Features Exchange
          LE Data Packet Length Extension
          LE 2M PHY
          LE Coded PHY
          Channel Selection Algorithm #2
          Periodic Advertising Sync Transfer - Sender
          Periodic Advertising Sync Transfer - Recipient
          Sleep Clock Accuracy Updates
          Connected Isochronous Stream - Central
          Connected Isochronous Stream - Peripheral
          Isochronous Broadcaster
          Synchronized Receiver
          Connected Isochronous Stream (Host Support)
          LE Power Control Request
          LE Power Control Request
          Connection Subrating
          Connection Subrating (Host Support)
          Unknown features (0x0000d80000000000)
> ACL Data RX: Handle 486 flags 0x02 dlen 11                                                                         #49 3.741200
      SMP: Pairing Response (0x02) len 6
        IO capability: KeyboardDisplay (0x04)
        OOB data: Authentication data not present (0x00)
        Authentication requirement: No bonding, MITM, SC, No Keypresses (0x0c)
        Max encryption key size: 16
        Initiator key distribution: <none> (0x00)
        Responder key distribution: <none> (0x00)
zephyr.exe[2341268]: < HCI Command: Host Number of Completed Packets (0x03|0x0035) plen 5                            #50 3.758521
        Num handles: 1
        Handle: 486 Address: DF:A9:FF:F6:B1:1A (OUI DF-A9-FF)
        Count: 1
zephyr.exe[2341268]: < ACL Data TX: Handle 486 flags 0x00 dlen 27                                                    #51 3.758621
zephyr.exe[2341268]: < ACL Data TX: Handle 486 flags 0x01 dlen 27                                                    #52 3.758625
zephyr.exe[2341268]: < ACL Data TX: Handle 486 flags 0x01 dlen 15                                                    #53 3.758626
      SMP: Pairing Public Key (0x0c) len 64
        X: 98308440221e2d910f0e54b71e7ec652857aa9b5a0dc65028824cc19db1226e9
        Y: 67a4816bcb62efb21701e31fdb27561a6217575fb007a8bbdabe7e28b6f68482
> HCI Event: Number of Completed Packets (0x13) plen 5                                                               #54 3.791163
        Num handles: 1
        Handle: 486 Address: DF:A9:FF:F6:B1:1A (OUI DF-A9-FF)
        Count: 1
        #51: len 27 (6 Kb/s)
        Latency: 32 msec (32-92 msec ~62 msec)
> HCI Event: Number of Completed Packets (0x13) plen 5                                                               #55 3.841233
        Num handles: 1
        Handle: 486 Address: DF:A9:FF:F6:B1:1A (OUI DF-A9-FF)
        Count: 1
        #52: len 27 (2 Kb/s)
        Latency: 82 msec (32-92 msec ~72 msec)
> HCI Event: Number of Completed Packets (0x13) plen 5                                                               #56 3.941110
        Num handles: 1
        Handle: 486 Address: DF:A9:FF:F6:B1:1A (OUI DF-A9-FF)
        Count: 1
        #53: len 15 (0 Kb/s)
        Latency: 182 msec (32-182 msec ~127 msec)
> ACL Data RX: Handle 486 flags 0x02 dlen 27                                                                         #57 3.991361
> ACL Data RX: Handle 486 flags 0x01 dlen 27                                                                         #58 3.992025
> ACL Data RX: Handle 486 flags 0x01 dlen 15                                                                         #59 3.992557
      SMP: Pairing Public Key (0x0c) len 64
        X: de26ff09ea2bdd235f859750f1957922a060b2dca2fd6b813932a8432e7f1712
        Y: cf85d8e40f1910e132632aaed9747471e8c491e896d3ebddbf2800e862891754
zephyr.exe[2341268]: < HCI Command: Host Number of Completed Packets (0x03|0x0035) plen 5                            #60 3.998996
        Num handles: 1
        Handle: 486 Address: DF:A9:FF:F6:B1:1A (OUI DF-A9-FF)
        Count: 1
zephyr.exe[2341268]: < HCI Command: Host Number of Completed Packets (0x03|0x0035) plen 5                            #61 3.999125
        Num handles: 1
        Handle: 486 Address: DF:A9:FF:F6:B1:1A (OUI DF-A9-FF)
        Count: 1
zephyr.exe[2341268]: < HCI Command: Host Number of Completed Packets (0x03|0x0035) plen 5                            #62 3.999631
        Num handles: 1
        Handle: 486 Address: DF:A9:FF:F6:B1:1A (OUI DF-A9-FF)
        Count: 1
zephyr.exe[2341268]: < ACL Data TX: Handle 486 flags 0x00 dlen 21                                                    #63 3.999679
      SMP: Pairing Confirm (0x03) len 16
        Confim value: b9edd7cb2c4e56a7e9b33a636d3e1fc0
> HCI Event: Number of Completed Packets (0x13) plen 5                                                               #64 4.041262
        Num handles: 1
        Handle: 486 Address: DF:A9:FF:F6:B1:1A (OUI DF-A9-FF)
        Count: 1
        #63: len 21 (4 Kb/s)
        Latency: 41 msec (32-182 msec ~84 msec)
> HCI Event: LE Meta Event (0x3e) plen 6                                                                             #65 4.190508
      LE PHY Update Complete (0x0c)
        Status: Success (0x00)
        Handle: 486 Address: DF:A9:FF:F6:B1:1A (OUI DF-A9-FF)
        TX PHY: LE 2M (0x02)
        RX PHY: LE 2M (0x02)
> ACL Data RX: Handle 486 flags 0x02 dlen 21                                                                         #66 4.691318
      SMP: Pairing Confirm (0x03) len 16
        Confim value: e093b3beb6880efa21ba3ceaeea1aa74
zephyr.exe[2341268]: < HCI Command: Host Number of Completed Packets (0x03|0x0035) plen 5                            #67 4.698597
        Num handles: 1
        Handle: 486 Address: DF:A9:FF:F6:B1:1A (OUI DF-A9-FF)
        Count: 1
zephyr.exe[2341268]: < ACL Data TX: Handle 486 flags 0x00 dlen 21                                                    #68 4.698733
      SMP: Pairing Random (0x04) len 16
        Random value: 8e6108f966a694cbe26df70bb96773e6
> HCI Event: Number of Completed Packets (0x13) plen 5                                                               #69 4.740962
        Num handles: 1
        Handle: 486 Address: DF:A9:FF:F6:B1:1A (OUI DF-A9-FF)
        Count: 1
        #68: len 21 (4 Kb/s)
        Latency: 42 msec (32-182 msec ~63 msec)
> ACL Data RX: Handle 486 flags 0x02 dlen 21                                                                         #70 4.991162
      SMP: Pairing Random (0x04) len 16
        Random value: 5ea7c9411a0519175f9bdf5fd9573062
zephyr.exe[2341268]: < HCI Command: Host Number of Completed Packets (0x03|0x0035) plen 5                            #71 4.999204
        Num handles: 1
        Handle: 486 Address: DF:A9:FF:F6:B1:1A (OUI DF-A9-FF)
        Count: 1
zephyr.exe[2341268]: < ACL Data TX: Handle 486 flags 0x00 dlen 21                                                    #72 4.999464
      SMP: Pairing Confirm (0x03) len 16
        Confim value: 7cbe8b3ac03a21a19f4271655c73e321
> HCI Event: Number of Completed Packets (0x13) plen 5                                                               #73 5.041028
        Num handles: 1
        Handle: 486 Address: DF:A9:FF:F6:B1:1A (OUI DF-A9-FF)
        Count: 1
        #72: len 21 (4 Kb/s)
        Latency: 41 msec (32-182 msec ~52 msec)
> ACL Data RX: Handle 486 flags 0x02 dlen 21                                                                         #74 5.091240
      SMP: Pairing Confirm (0x03) len 16
        Confim value: 9cf01381520ff8278d4c789c67a2d852
zephyr.exe[2341268]: < HCI Command: Host Number of Completed Packets (0x03|0x0035) plen 5                            #75 5.098907
        Num handles: 1
        Handle: 486 Address: DF:A9:FF:F6:B1:1A (OUI DF-A9-FF)
        Count: 1
zephyr.exe[2341268]: < ACL Data TX: Handle 486 flags 0x00 dlen 21                                                    #76 5.099172
      SMP: Pairing Random (0x04) len 16
        Random value: 4d02679f89a05211af56d8b3da64d21e
> HCI Event: Number of Completed Packets (0x13) plen 5                                                               #77 5.140937
        Num handles: 1
        Handle: 486 Address: DF:A9:FF:F6:B1:1A (OUI DF-A9-FF)
        Count: 1
        #76: len 21 (4 Kb/s)
        Latency: 41 msec (32-182 msec ~47 msec)
> ACL Data RX: Handle 486 flags 0x02 dlen 21                                                                         #78 5.391285
      SMP: Pairing Random (0x04) len 16
        Random value: 889a222440d2fe2ffdda87af58fa0b2f
zephyr.exe[2341268]: < HCI Command: Host Number of Completed Packets (0x03|0x0035) plen 5                            #79 5.398680
        Num handles: 1
        Handle: 486 Address: DF:A9:FF:F6:B1:1A (OUI DF-A9-FF)
        Count: 1
zephyr.exe[2341268]: < ACL Data TX: Handle 486 flags 0x00 dlen 21                                                    #80 5.398693
      SMP: Pairing Confirm (0x03) len 16
        Confim value: 1af4606afa1ed6d8b0857911962047f1
> HCI Event: Number of Completed Packets (0x13) plen 5                                                               #81 5.441004
        Num handles: 1
        Handle: 486 Address: DF:A9:FF:F6:B1:1A (OUI DF-A9-FF)
        Count: 1
        #80: len 21 (4 Kb/s)
        Latency: 42 msec (32-182 msec ~44 msec)
> ACL Data RX: Handle 486 flags 0x02 dlen 21                                                                         #82 5.491271
      SMP: Pairing Confirm (0x03) len 16
        Confim value: 189e7ac3bf5d9652ab49c5736115f0e0
zephyr.exe[2341268]: < HCI Command: Host Number of Completed Packets (0x03|0x0035) plen 5                            #83 5.498718
        Num handles: 1
        Handle: 486 Address: DF:A9:FF:F6:B1:1A (OUI DF-A9-FF)
        Count: 1
zephyr.exe[2341268]: < ACL Data TX: Handle 486 flags 0x00 dlen 21                                                    #84 5.498862
      SMP: Pairing Random (0x04) len 16
        Random value: 5e8286bc235a02440d0c3424a2acf8fd
> HCI Event: Number of Completed Packets (0x13) plen 5                                                               #85 5.540930
        Num handles: 1
        Handle: 486 Address: DF:A9:FF:F6:B1:1A (OUI DF-A9-FF)
        Count: 1
        #84: len 21 (4 Kb/s)
        Latency: 42 msec (32-182 msec ~43 msec)
> ACL Data RX: Handle 486 flags 0x02 dlen 21                                                                         #86 5.791169
      SMP: Pairing Random (0x04) len 16
        Random value: cf9ea63dafa211d17141a77161deabac
zephyr.exe[2341268]: < HCI Command: Host Number of Completed Packets (0x03|0x0035) plen 5                            #87 5.798699
        Num handles: 1
        Handle: 486 Address: DF:A9:FF:F6:B1:1A (OUI DF-A9-FF)
        Count: 1
zephyr.exe[2341268]: < ACL Data TX: Handle 486 flags 0x00 dlen 21                                                    #88 5.798832
      SMP: Pairing Confirm (0x03) len 16
        Confim value: 6afd796cbd0ba67f2965b8becac81789
> HCI Event: Number of Completed Packets (0x13) plen 5                                                               #89 5.841084
        Num handles: 1
        Handle: 486 Address: DF:A9:FF:F6:B1:1A (OUI DF-A9-FF)
        Count: 1
        #88: len 21 (4 Kb/s)
        Latency: 42 msec (32-182 msec ~42 msec)
> ACL Data RX: Handle 486 flags 0x02 dlen 21                                                                         #90 5.891097
      SMP: Pairing Confirm (0x03) len 16
        Confim value: 1c17b841e36c4991cd01f520c175457d
zephyr.exe[2341268]: < HCI Command: Host Number of Completed Packets (0x03|0x0035) plen 5                            #91 5.898454
        Num handles: 1
        Handle: 486 Address: DF:A9:FF:F6:B1:1A (OUI DF-A9-FF)
        Count: 1
zephyr.exe[2341268]: < ACL Data TX: Handle 486 flags 0x00 dlen 21                                                    #92 5.898563
      SMP: Pairing Random (0x04) len 16
        Random value: 5c4a1bcadd27bd58e945097b00bad7ac
> HCI Event: Number of Completed Packets (0x13) plen 5                                                               #93 5.940969
        Num handles: 1
        Handle: 486 Address: DF:A9:FF:F6:B1:1A (OUI DF-A9-FF)
        Count: 1
        #92: len 21 (4 Kb/s)
        Latency: 42 msec (32-182 msec ~42 msec)
> ACL Data RX: Handle 486 flags 0x02 dlen 21                                                                         #94 6.191192
      SMP: Pairing Random (0x04) len 16
        Random value: 71f3e907926659a8da72b4800056f4df
zephyr.exe[2341268]: < HCI Command: Host Number of Completed Packets (0x03|0x0035) plen 5                            #95 6.199066
        Num handles: 1
        Handle: 486 Address: DF:A9:FF:F6:B1:1A (OUI DF-A9-FF)
        Count: 1
zephyr.exe[2341268]: < ACL Data TX: Handle 486 flags 0x00 dlen 21                                                    #96 6.199227
      SMP: Pairing Confirm (0x03) len 16
        Confim value: 7d02301c411101065aff1fac7eb5e293
> HCI Event: Number of Completed Packets (0x13) plen 5                                                               #97 6.240972
        Num handles: 1
        Handle: 486 Address: DF:A9:FF:F6:B1:1A (OUI DF-A9-FF)
        Count: 1
        #96: len 21 (4 Kb/s)
        Latency: 41 msec (32-182 msec ~42 msec)
> ACL Data RX: Handle 486 flags 0x02 dlen 21                                                                         #98 6.291120
      SMP: Pairing Confirm (0x03) len 16
        Confim value: 14b8122ab7beb24625b5423fd96e09dd
zephyr.exe[2341268]: < HCI Command: Host Number of Completed Packets (0x03|0x0035) plen 5                            #99 6.298625
        Num handles: 1
        Handle: 486 Address: DF:A9:FF:F6:B1:1A (OUI DF-A9-FF)
        Count: 1
zephyr.exe[2341268]: < ACL Data TX: Handle 486 flags 0x00 dlen 21                                                   #100 6.298758
      SMP: Pairing Random (0x04) len 16
        Random value: 32527e6e64e79f33b2e374394db8ab2d
> HCI Event: Number of Completed Packets (0x13) plen 5                                                              #101 6.340976
        Num handles: 1
        Handle: 486 Address: DF:A9:FF:F6:B1:1A (OUI DF-A9-FF)
        Count: 1
        #100: len 21 (4 Kb/s)
        Latency: 42 msec (32-182 msec ~42 msec)
> ACL Data RX: Handle 486 flags 0x02 dlen 21                                                                        #102 6.591231
      SMP: Pairing Random (0x04) len 16
        Random value: ea1cc13a584e1a9c944d63f384f10c13
zephyr.exe[2341268]: < HCI Command: Host Number of Completed Packets (0x03|0x0035) plen 5                           #103 6.598995
        Num handles: 1
        Handle: 486 Address: DF:A9:FF:F6:B1:1A (OUI DF-A9-FF)
        Count: 1
zephyr.exe[2341268]: < ACL Data TX: Handle 486 flags 0x00 dlen 21                                                   #104 6.599140
      SMP: Pairing Confirm (0x03) len 16
        Confim value: f68a3c842bdbe668fe9976910ad7d48b
> HCI Event: Number of Completed Packets (0x13) plen 5                                                              #105 6.640912
        Num handles: 1
        Handle: 486 Address: DF:A9:FF:F6:B1:1A (OUI DF-A9-FF)
        Count: 1
        #104: len 21 (4 Kb/s)
        Latency: 41 msec (32-182 msec ~41 msec)
> ACL Data RX: Handle 486 flags 0x02 dlen 21                                                                        #106 6.691152
      SMP: Pairing Confirm (0x03) len 16
        Confim value: 81b8689c4639150cb891a5ea276cb6ea
zephyr.exe[2341268]: < HCI Command: Host Number of Completed Packets (0x03|0x0035) plen 5                           #107 6.698776
        Num handles: 1
        Handle: 486 Address: DF:A9:FF:F6:B1:1A (OUI DF-A9-FF)
        Count: 1
zephyr.exe[2341268]: < ACL Data TX: Handle 486 flags 0x00 dlen 21                                                   #108 6.699003
      SMP: Pairing Random (0x04) len 16
        Random value: dddbdfe2838e9a8cc6964353c850fef7
> HCI Event: Number of Completed Packets (0x13) plen 5                                                              #109 6.740977
        Num handles: 1
        Handle: 486 Address: DF:A9:FF:F6:B1:1A (OUI DF-A9-FF)
        Count: 1
        #108: len 21 (4 Kb/s)
        Latency: 41 msec (32-182 msec ~41 msec)
> ACL Data RX: Handle 486 flags 0x02 dlen 21                                                                        #110 6.991173
      SMP: Pairing Random (0x04) len 16
        Random value: f8d842cfaecbdad63cf3a824788257d1
zephyr.exe[2341268]: < HCI Command: Host Number of Completed Packets (0x03|0x0035) plen 5                           #111 6.999118
        Num handles: 1
        Handle: 486 Address: DF:A9:FF:F6:B1:1A (OUI DF-A9-FF)
        Count: 1
zephyr.exe[2341268]: < ACL Data TX: Handle 486 flags 0x00 dlen 21                                                   #112 6.999352
      SMP: Pairing Confirm (0x03) len 16
        Confim value: b2212915d4974ab1a46dafd49576b710
> HCI Event: Number of Completed Packets (0x13) plen 5                                                              #113 7.040947
        Num handles: 1
        Handle: 486 Address: DF:A9:FF:F6:B1:1A (OUI DF-A9-FF)
        Count: 1
        #112: len 21 (4 Kb/s)
        Latency: 41 msec (32-182 msec ~41 msec)
> ACL Data RX: Handle 486 flags 0x02 dlen 21                                                                        #114 7.091177
      SMP: Pairing Confirm (0x03) len 16
        Confim value: 04787b878b5f5c76d30fd817a036d809
zephyr.exe[2341268]: < HCI Command: Host Number of Completed Packets (0x03|0x0035) plen 5                           #115 7.098906
        Num handles: 1
        Handle: 486 Address: DF:A9:FF:F6:B1:1A (OUI DF-A9-FF)
        Count: 1
zephyr.exe[2341268]: < ACL Data TX: Handle 486 flags 0x00 dlen 21                                                   #116 7.099129
      SMP: Pairing Random (0x04) len 16
        Random value: eb9f1915536596b6fc3db1c86b2b1970
> HCI Event: Number of Completed Packets (0x13) plen 5                                                              #117 7.141047
        Num handles: 1
        Handle: 486 Address: DF:A9:FF:F6:B1:1A (OUI DF-A9-FF)
        Count: 1
        #116: len 21 (4 Kb/s)
        Latency: 41 msec (32-182 msec ~41 msec)
> ACL Data RX: Handle 486 flags 0x02 dlen 21                                                                        #118 7.391130
      SMP: Pairing Random (0x04) len 16
        Random value: 9729c1ff808f5cbeafc5baabaa197ce1
zephyr.exe[2341268]: < HCI Command: Host Number of Completed Packets (0x03|0x0035) plen 5                           #119 7.398566
        Num handles: 1
        Handle: 486 Address: DF:A9:FF:F6:B1:1A (OUI DF-A9-FF)
        Count: 1
zephyr.exe[2341268]: < ACL Data TX: Handle 486 flags 0x00 dlen 21                                                   #120 7.398667
      SMP: Pairing Confirm (0x03) len 16
        Confim value: 96a669456ed530e9c99d2a53e6e7c4d3
> HCI Event: Number of Completed Packets (0x13) plen 5                                                              #121 7.441035
        Num handles: 1
        Handle: 486 Address: DF:A9:FF:F6:B1:1A (OUI DF-A9-FF)
        Count: 1
        #120: len 21 (4 Kb/s)
        Latency: 42 msec (32-182 msec ~42 msec)
> ACL Data RX: Handle 486 flags 0x02 dlen 21                                                                        #122 7.491146
      SMP: Pairing Confirm (0x03) len 16
        Confim value: ca57da03c84e89158c82cc36063e0c8f
zephyr.exe[2341268]: < HCI Command: Host Number of Completed Packets (0x03|0x0035) plen 5                           #123 7.498860
        Num handles: 1
        Handle: 486 Address: DF:A9:FF:F6:B1:1A (OUI DF-A9-FF)
        Count: 1
zephyr.exe[2341268]: < ACL Data TX: Handle 486 flags 0x00 dlen 21                                                   #124 7.499054
      SMP: Pairing Random (0x04) len 16
        Random value: 5c794dc9ad9f2c3f295ebd5ad5e1c3cf
> HCI Event: Number of Completed Packets (0x13) plen 5                                                              #125 7.540928
        Num handles: 1
        Handle: 486 Address: DF:A9:FF:F6:B1:1A (OUI DF-A9-FF)
        Count: 1
        #124: len 21 (4 Kb/s)
        Latency: 41 msec (32-182 msec ~41 msec)
> ACL Data RX: Handle 486 flags 0x02 dlen 21                                                                        #126 7.791170
      SMP: Pairing Random (0x04) len 16
        Random value: 0550d444fa8ba6ff0a650c6327075d4d
zephyr.exe[2341268]: < HCI Command: Host Number of Completed Packets (0x03|0x0035) plen 5                           #127 7.798694
        Num handles: 1
        Handle: 486 Address: DF:A9:FF:F6:B1:1A (OUI DF-A9-FF)
        Count: 1
zephyr.exe[2341268]: < ACL Data TX: Handle 486 flags 0x00 dlen 21                                                   #128 7.798841
      SMP: Pairing Confirm (0x03) len 16
        Confim value: 6a7e6ac10c551d78b6e032c96b531600
> HCI Event: Number of Completed Packets (0x13) plen 5                                                              #129 7.840949
        Num handles: 1
        Handle: 486 Address: DF:A9:FF:F6:B1:1A (OUI DF-A9-FF)
        Count: 1
        #128: len 21 (4 Kb/s)
        Latency: 42 msec (32-182 msec ~42 msec)
> ACL Data RX: Handle 486 flags 0x02 dlen 21                                                                        #130 7.891054
      SMP: Pairing Confirm (0x03) len 16
        Confim value: 3c937ca81d2224eeb55fc699c5027197
zephyr.exe[2341268]: < HCI Command: Host Number of Completed Packets (0x03|0x0035) plen 5                           #131 7.898911
        Num handles: 1
        Handle: 486 Address: DF:A9:FF:F6:B1:1A (OUI DF-A9-FF)
        Count: 1
zephyr.exe[2341268]: < ACL Data TX: Handle 486 flags 0x00 dlen 21                                                   #132 7.899141
      SMP: Pairing Random (0x04) len 16
        Random value: 5c2fff312cdf99c9491988e877355a9a
> HCI Event: Number of Completed Packets (0x13) plen 5                                                              #133 7.940905
        Num handles: 1
        Handle: 486 Address: DF:A9:FF:F6:B1:1A (OUI DF-A9-FF)
        Count: 1
        #132: len 21 (4 Kb/s)
        Latency: 41 msec (32-182 msec ~41 msec)
> ACL Data RX: Handle 486 flags 0x02 dlen 21                                                                        #134 8.191194
      SMP: Pairing Random (0x04) len 16
        Random value: becd4f558cf0fe80aab355633bdd225c
zephyr.exe[2341268]: < HCI Command: Host Number of Completed Packets (0x03|0x0035) plen 5                           #135 8.199095
        Num handles: 1
        Handle: 486 Address: DF:A9:FF:F6:B1:1A (OUI DF-A9-FF)
        Count: 1
zephyr.exe[2341268]: < ACL Data TX: Handle 486 flags 0x00 dlen 21                                                   #136 8.199325
      SMP: Pairing Confirm (0x03) len 16
        Confim value: d629ad5e6bc26431d102ab5da63b3591
> HCI Event: Number of Completed Packets (0x13) plen 5                                                              #137 8.240868
        Num handles: 1
        Handle: 486 Address: DF:A9:FF:F6:B1:1A (OUI DF-A9-FF)
        Count: 1
        #136: len 21 (4 Kb/s)
        Latency: 41 msec (32-182 msec ~41 msec)
> ACL Data RX: Handle 486 flags 0x02 dlen 21                                                                        #138 8.291197
      SMP: Pairing Confirm (0x03) len 16
        Confim value: 60ed8ab59e1b3c9788ca9f12e18a5c78
zephyr.exe[2341268]: < HCI Command: Host Number of Completed Packets (0x03|0x0035) plen 5                           #139 8.298905
        Num handles: 1
        Handle: 486 Address: DF:A9:FF:F6:B1:1A (OUI DF-A9-FF)
        Count: 1
zephyr.exe[2341268]: < ACL Data TX: Handle 486 flags 0x00 dlen 21                                                   #140 8.299109
      SMP: Pairing Random (0x04) len 16
        Random value: c629a3a987d808e808655d558dfc1155
> HCI Event: Number of Completed Packets (0x13) plen 5                                                              #141 8.340948
        Num handles: 1
        Handle: 486 Address: DF:A9:FF:F6:B1:1A (OUI DF-A9-FF)
        Count: 1
        #140: len 21 (4 Kb/s)
        Latency: 41 msec (32-182 msec ~41 msec)
> ACL Data RX: Handle 486 flags 0x02 dlen 21                                                                        #142 8.591097
      SMP: Pairing Random (0x04) len 16
        Random value: 8063482de02ee86c2cd18804746c2e9a
zephyr.exe[2341268]: < HCI Command: Host Number of Completed Packets (0x03|0x0035) plen 5                           #143 8.599047
        Num handles: 1
        Handle: 486 Address: DF:A9:FF:F6:B1:1A (OUI DF-A9-FF)
        Count: 1
zephyr.exe[2341268]: < ACL Data TX: Handle 486 flags 0x00 dlen 21                                                   #144 8.599286
      SMP: Pairing Confirm (0x03) len 16
        Confim value: 7ba6c6088ab45d7234d81383370b3ec2
> HCI Event: Number of Completed Packets (0x13) plen 5                                                              #145 8.640842
        Num handles: 1
        Handle: 486 Address: DF:A9:FF:F6:B1:1A (OUI DF-A9-FF)
        Count: 1
        #144: len 21 (4 Kb/s)
        Latency: 41 msec (32-182 msec ~41 msec)
> ACL Data RX: Handle 486 flags 0x02 dlen 21                                                                        #146 8.691037
      SMP: Pairing Confirm (0x03) len 16
        Confim value: e662a0d96afd2aa020e3963ed9990503
zephyr.exe[2341268]: < HCI Command: Host Number of Completed Packets (0x03|0x0035) plen 5                           #147 8.698931
        Num handles: 1
        Handle: 486 Address: DF:A9:FF:F6:B1:1A (OUI DF-A9-FF)
        Count: 1
zephyr.exe[2341268]: < ACL Data TX: Handle 486 flags 0x00 dlen 21                                                   #148 8.699117
      SMP: Pairing Random (0x04) len 16
        Random value: 92f20f6ad8f13724432c7fd6001c45ff
> HCI Event: Number of Completed Packets (0x13) plen 5                                                              #149 8.740846
        Num handles: 1
        Handle: 486 Address: DF:A9:FF:F6:B1:1A (OUI DF-A9-FF)
        Count: 1
        #148: len 21 (4 Kb/s)
        Latency: 41 msec (32-182 msec ~41 msec)
> ACL Data RX: Handle 486 flags 0x02 dlen 21                                                                        #150 8.991050
      SMP: Pairing Random (0x04) len 16
        Random value: 47111304e5f6292a6d1edbe19fc527ce
zephyr.exe[2341268]: < HCI Command: Host Number of Completed Packets (0x03|0x0035) plen 5                           #151 8.998672
        Num handles: 1
        Handle: 486 Address: DF:A9:FF:F6:B1:1A (OUI DF-A9-FF)
        Count: 1
zephyr.exe[2341268]: < ACL Data TX: Handle 486 flags 0x00 dlen 21                                                   #152 8.998781
      SMP: Pairing Confirm (0x03) len 16
        Confim value: abb813147280880030ea0d4b5443227e
> HCI Event: Number of Completed Packets (0x13) plen 5                                                              #153 9.040829
        Num handles: 1
        Handle: 486 Address: DF:A9:FF:F6:B1:1A (OUI DF-A9-FF)
        Count: 1
        #152: len 21 (4 Kb/s)
        Latency: 42 msec (32-182 msec ~41 msec)
> ACL Data RX: Handle 486 flags 0x02 dlen 21                                                                        #154 9.091215
      SMP: Pairing Confirm (0x03) len 16
        Confim value: aadf9aa39de2c4344de72900cc6388e1
zephyr.exe[2341268]: < HCI Command: Host Number of Completed Packets (0x03|0x0035) plen 5                           #155 9.099055
        Num handles: 1
        Handle: 486 Address: DF:A9:FF:F6:B1:1A (OUI DF-A9-FF)
        Count: 1
zephyr.exe[2341268]: < ACL Data TX: Handle 486 flags 0x00 dlen 21                                                   #156 9.099232
      SMP: Pairing Random (0x04) len 16
        Random value: 23ac32ebbb5e14c8a6b9622f296d277f
> HCI Event: Number of Completed Packets (0x13) plen 5                                                              #157 9.140878
        Num handles: 1
        Handle: 486 Address: DF:A9:FF:F6:B1:1A (OUI DF-A9-FF)
        Count: 1
        #156: len 21 (4 Kb/s)
        Latency: 41 msec (32-182 msec ~41 msec)
> ACL Data RX: Handle 486 flags 0x02 dlen 21                                                                        #158 9.391057
      SMP: Pairing Random (0x04) len 16
        Random value: 51194553c73ac665893ec3d1c939f101
zephyr.exe[2341268]: < HCI Command: Host Number of Completed Packets (0x03|0x0035) plen 5                           #159 9.398969
        Num handles: 1
        Handle: 486 Address: DF:A9:FF:F6:B1:1A (OUI DF-A9-FF)
        Count: 1
zephyr.exe[2341268]: < ACL Data TX: Handle 486 flags 0x00 dlen 21                                                   #160 9.399179
      SMP: Pairing Confirm (0x03) len 16
        Confim value: d9c8b0f6f1c725a713ce055d290d4e1a
> HCI Event: Number of Completed Packets (0x13) plen 5                                                              #161 9.440987
        Num handles: 1
        Handle: 486 Address: DF:A9:FF:F6:B1:1A (OUI DF-A9-FF)
        Count: 1
        #160: len 21 (4 Kb/s)
        Latency: 41 msec (32-182 msec ~41 msec)
> ACL Data RX: Handle 486 flags 0x02 dlen 21                                                                        #162 9.491099
      SMP: Pairing Confirm (0x03) len 16
        Confim value: a644bb4a737002a37450217818f4d0c2
zephyr.exe[2341268]: < HCI Command: Host Number of Completed Packets (0x03|0x0035) plen 5                           #163 9.498803
        Num handles: 1
        Handle: 486 Address: DF:A9:FF:F6:B1:1A (OUI DF-A9-FF)
        Count: 1
zephyr.exe[2341268]: < ACL Data TX: Handle 486 flags 0x00 dlen 21                                                   #164 9.499013
      SMP: Pairing Random (0x04) len 16
        Random value: 297efe85e67448a15f56bd27e3a3cf1d
> HCI Event: Number of Completed Packets (0x13) plen 5                                                              #165 9.540823
        Num handles: 1
        Handle: 486 Address: DF:A9:FF:F6:B1:1A (OUI DF-A9-FF)
        Count: 1
        #164: len 21 (4 Kb/s)
        Latency: 41 msec (32-182 msec ~41 msec)
> ACL Data RX: Handle 486 flags 0x02 dlen 21                                                                        #166 9.791032
      SMP: Pairing Random (0x04) len 16
        Random value: 1afcb4d4f32b0404df0ff5ee3e59b27d
zephyr.exe[2341268]: < HCI Command: Host Number of Completed Packets (0x03|0x0035) plen 5                           #167 9.799034
        Num handles: 1
        Handle: 486 Address: DF:A9:FF:F6:B1:1A (OUI DF-A9-FF)
        Count: 1
zephyr.exe[2341268]: < ACL Data TX: Handle 486 flags 0x00 dlen 21                                                   #168 9.799153
      SMP: Pairing Confirm (0x03) len 16
        Confim value: 12b626fb264377f2f66f05add28967d2
> HCI Event: Number of Completed Packets (0x13) plen 5                                                              #169 9.840931
        Num handles: 1
        Handle: 486 Address: DF:A9:FF:F6:B1:1A (OUI DF-A9-FF)
        Count: 1
        #168: len 21 (4 Kb/s)
        Latency: 41 msec (32-182 msec ~41 msec)
> ACL Data RX: Handle 486 flags 0x02 dlen 21                                                                        #170 9.891048
      SMP: Pairing Confirm (0x03) len 16
        Confim value: ad02f256e8208176aaf96699d9414275
zephyr.exe[2341268]: < HCI Command: Host Number of Completed Packets (0x03|0x0035) plen 5                           #171 9.898603
        Num handles: 1
        Handle: 486 Address: DF:A9:FF:F6:B1:1A (OUI DF-A9-FF)
        Count: 1
zephyr.exe[2341268]: < ACL Data TX: Handle 486 flags 0x00 dlen 21                                                   #172 9.898696
      SMP: Pairing Random (0x04) len 16
        Random value: 25a9493fd3ce4faf02be7293595bb7c6
> HCI Event: Number of Completed Packets (0x13) plen 5                                                              #173 9.940895
        Num handles: 1
        Handle: 486 Address: DF:A9:FF:F6:B1:1A (OUI DF-A9-FF)
        Count: 1
        #172: len 21 (4 Kb/s)
        Latency: 42 msec (32-182 msec ~41 msec)
> ACL Data RX: Handle 486 flags 0x02 dlen 21                                                                       #174 10.191115
      SMP: Pairing Random (0x04) len 16
        Random value: 607b747f173968310bb466908df7cfca
zephyr.exe[2341268]: < HCI Command: Host Number of Completed Packets (0x03|0x0035) plen 5                          #175 10.199042
        Num handles: 1
        Handle: 486 Address: DF:A9:FF:F6:B1:1A (OUI DF-A9-FF)
        Count: 1
zephyr.exe[2341268]: < ACL Data TX: Handle 486 flags 0x00 dlen 21                                                  #176 10.199153
      SMP: Pairing Confirm (0x03) len 16
        Confim value: 2ce7114b9897133644d62514802a454f
> HCI Event: Number of Completed Packets (0x13) plen 5                                                             #177 10.240927
        Num handles: 1
        Handle: 486 Address: DF:A9:FF:F6:B1:1A (OUI DF-A9-FF)
        Count: 1
        #176: len 21 (4 Kb/s)
        Latency: 41 msec (32-182 msec ~41 msec)
> ACL Data RX: Handle 486 flags 0x02 dlen 21                                                                       #178 10.291086
      SMP: Pairing Confirm (0x03) len 16
        Confim value: 43fc0770b03f262500dee299b09fc2d0
zephyr.exe[2341268]: < HCI Command: Host Number of Completed Packets (0x03|0x0035) plen 5                          #179 10.298920
        Num handles: 1
        Handle: 486 Address: DF:A9:FF:F6:B1:1A (OUI DF-A9-FF)
        Count: 1
zephyr.exe[2341268]: < ACL Data TX: Handle 486 flags 0x00 dlen 21                                                  #180 10.299117
      SMP: Pairing Random (0x04) len 16
        Random value: 58f6b41f855a6f6c3560debd84e2affc
> HCI Event: Number of Completed Packets (0x13) plen 5                                                             #181 10.340980
        Num handles: 1
        Handle: 486 Address: DF:A9:FF:F6:B1:1A (OUI DF-A9-FF)
        Count: 1
        #180: len 21 (4 Kb/s)
        Latency: 41 msec (32-182 msec ~41 msec)
> ACL Data RX: Handle 486 flags 0x02 dlen 21                                                                       #182 10.591151
      SMP: Pairing Random (0x04) len 16
        Random value: 2097db8d1e16b856ea8d4b518122ecb2
zephyr.exe[2341268]: < HCI Command: Host Number of Completed Packets (0x03|0x0035) plen 5                          #183 10.599094
        Num handles: 1
        Handle: 486 Address: DF:A9:FF:F6:B1:1A (OUI DF-A9-FF)
        Count: 1
zephyr.exe[2341268]: < ACL Data TX: Handle 486 flags 0x00 dlen 21                                                  #184 10.599337
      SMP: Pairing Confirm (0x03) len 16
        Confim value: 3c128f7a0f4ab9f7183a498b926c0444
> HCI Event: Number of Completed Packets (0x13) plen 5                                                             #185 10.640834
        Num handles: 1
        Handle: 486 Address: DF:A9:FF:F6:B1:1A (OUI DF-A9-FF)
        Count: 1
        #184: len 21 (4 Kb/s)
        Latency: 41 msec (32-182 msec ~41 msec)
> ACL Data RX: Handle 486 flags 0x02 dlen 21                                                                       #186 10.691074
      SMP: Pairing Confirm (0x03) len 16
        Confim value: 6e5b5dba78f48746b41bd8f055976cb3
zephyr.exe[2341268]: < HCI Command: Host Number of Completed Packets (0x03|0x0035) plen 5                          #187 10.698975
        Num handles: 1
        Handle: 486 Address: DF:A9:FF:F6:B1:1A (OUI DF-A9-FF)
        Count: 1
zephyr.exe[2341268]: < ACL Data TX: Handle 486 flags 0x00 dlen 21                                                  #188 10.699176
      SMP: Pairing Random (0x04) len 16
        Random value: b67e7216d5bf664139eda2b542549666
> HCI Event: Number of Completed Packets (0x13) plen 5                                                             #189 10.740945
        Num handles: 1
        Handle: 486 Address: DF:A9:FF:F6:B1:1A (OUI DF-A9-FF)
        Count: 1
        #188: len 21 (4 Kb/s)
        Latency: 41 msec (32-182 msec ~41 msec)
> ACL Data RX: Handle 486 flags 0x02 dlen 21                                                                       #190 10.991034
      SMP: Pairing Random (0x04) len 16
        Random value: 95907c7737b2f71a993b180a272def3d
zephyr.exe[2341268]: < HCI Command: Host Number of Completed Packets (0x03|0x0035) plen 5                          #191 10.999004
        Num handles: 1
        Handle: 486 Address: DF:A9:FF:F6:B1:1A (OUI DF-A9-FF)
        Count: 1
zephyr.exe[2341268]: < ACL Data TX: Handle 486 flags 0x00 dlen 21                                                  #192 10.999104
      SMP: Pairing Confirm (0x03) len 16
        Confim value: 445ba1e203e8876c8162669f697dac0f
> HCI Event: Number of Completed Packets (0x13) plen 5                                                             #193 11.040924
        Num handles: 1
        Handle: 486 Address: DF:A9:FF:F6:B1:1A (OUI DF-A9-FF)
        Count: 1
        #192: len 21 (4 Kb/s)
        Latency: 41 msec (32-182 msec ~41 msec)
> ACL Data RX: Handle 486 flags 0x02 dlen 21                                                                       #194 11.091097
      SMP: Pairing Confirm (0x03) len 16
        Confim value: 4c094f8cc716d62af7925617ccfd862d
zephyr.exe[2341268]: < HCI Command: Host Number of Completed Packets (0x03|0x0035) plen 5                          #195 11.098959
        Num handles: 1
        Handle: 486 Address: DF:A9:FF:F6:B1:1A (OUI DF-A9-FF)
        Count: 1
zephyr.exe[2341268]: < ACL Data TX: Handle 486 flags 0x00 dlen 21                                                  #196 11.099199
      SMP: Pairing Random (0x04) len 16
        Random value: ed17f76500c95219dd01e09d1e63f87b
> HCI Event: Number of Completed Packets (0x13) plen 5                                                             #197 11.140855
        Num handles: 1
        Handle: 486 Address: DF:A9:FF:F6:B1:1A (OUI DF-A9-FF)
        Count: 1
        #196: len 21 (4 Kb/s)
        Latency: 41 msec (32-182 msec ~41 msec)
> ACL Data RX: Handle 486 flags 0x02 dlen 21                                                                       #198 11.391112
      SMP: Pairing Random (0x04) len 16
        Random value: 3fe92ff6cf3f6c6775a084d4cea7fcb4
zephyr.exe[2341268]: < HCI Command: Host Number of Completed Packets (0x03|0x0035) plen 5                          #199 11.399101
        Num handles: 1
        Handle: 486 Address: DF:A9:FF:F6:B1:1A (OUI DF-A9-FF)
        Count: 1
zephyr.exe[2341268]: < ACL Data TX: Handle 486 flags 0x00 dlen 21                                                  #200 11.399323
      SMP: Pairing Confirm (0x03) len 16
        Confim value: 133c5d1ff827b62655d9839be15b8ff2
> HCI Event: Number of Completed Packets (0x13) plen 5                                                             #201 11.440828
        Num handles: 1
        Handle: 486 Address: DF:A9:FF:F6:B1:1A (OUI DF-A9-FF)
        Count: 1
        #200: len 21 (4 Kb/s)
        Latency: 41 msec (32-182 msec ~41 msec)
> ACL Data RX: Handle 486 flags 0x02 dlen 21                                                                       #202 11.491046
      SMP: Pairing Confirm (0x03) len 16
        Confim value: d99ba2df7d68ffa3fae8732fb6e38ed3
zephyr.exe[2341268]: < HCI Command: Host Number of Completed Packets (0x03|0x0035) plen 5                          #203 11.498975
        Num handles: 1
        Handle: 486 Address: DF:A9:FF:F6:B1:1A (OUI DF-A9-FF)
        Count: 1
zephyr.exe[2341268]: < ACL Data TX: Handle 486 flags 0x00 dlen 21                                                  #204 11.499147
      SMP: Pairing Random (0x04) len 16
        Random value: 81d35d47e1f6006d79c974bd9d9e1ee3
> HCI Event: Number of Completed Packets (0x13) plen 5                                                             #205 11.540843
        Num handles: 1
        Handle: 486 Address: DF:A9:FF:F6:B1:1A (OUI DF-A9-FF)
        Count: 1
        #204: len 21 (4 Kb/s)
        Latency: 41 msec (32-182 msec ~41 msec)
> ACL Data RX: Handle 486 flags 0x02 dlen 21                                                                       #206 11.790942
      SMP: Pairing Random (0x04) len 16
        Random value: d9610703912e9b661bdc820701637aa1
zephyr.exe[2341268]: < HCI Command: Host Number of Completed Packets (0x03|0x0035) plen 5                          #207 11.799065
        Num handles: 1
        Handle: 486 Address: DF:A9:FF:F6:B1:1A (OUI DF-A9-FF)
        Count: 1
zephyr.exe[2341268]: < ACL Data TX: Handle 486 flags 0x00 dlen 21                                                  #208 11.799309
      SMP: Pairing Confirm (0x03) len 16
        Confim value: 6a619ce4859b4b6dd0959a789f67a545
> HCI Event: Number of Completed Packets (0x13) plen 5                                                             #209 11.840821
        Num handles: 1
        Handle: 486 Address: DF:A9:FF:F6:B1:1A (OUI DF-A9-FF)
        Count: 1
        #208: len 21 (4 Kb/s)
        Latency: 41 msec (32-182 msec ~41 msec)
> ACL Data RX: Handle 486 flags 0x02 dlen 21                                                                       #210 11.891058
      SMP: Pairing Confirm (0x03) len 16
        Confim value: 3069af7f2d9dcc7235ac6e3da9477566
zephyr.exe[2341268]: < HCI Command: Host Number of Completed Packets (0x03|0x0035) plen 5                          #211 11.898979
        Num handles: 1
        Handle: 486 Address: DF:A9:FF:F6:B1:1A (OUI DF-A9-FF)
        Count: 1
zephyr.exe[2341268]: < ACL Data TX: Handle 486 flags 0x00 dlen 21                                                  #212 11.899093
      SMP: Pairing Random (0x04) len 16
        Random value: e7f7e0c2476823e41736a7e381bafb7c
> HCI Event: Number of Completed Packets (0x13) plen 5                                                             #213 11.940833
        Num handles: 1
        Handle: 486 Address: DF:A9:FF:F6:B1:1A (OUI DF-A9-FF)
  