Bluetooth monitor ver 5.72
= Note: Linux version 6.14.0-36-generic (x86_64)                       0.681163
= Note: Bluetooth subsystem version 2.22                               0.681164
= New Index: 00:00:00:00:00:00 (Primary,UART,hci2)              [hci2] 0.681166
= New Index: 00:00:00:00:00:00 (Primary,UART,hci1)              [hci1] 0.681167
= New Index: 48:5F:99:8E:E0:64 (Primary,USB,hci0)               [hci0] 0.681167
= Open Index: 00:00:00:00:00:00                                 [hci1] 0.704409
= Index Info: 00:00:00:00:00:00 (Nordic Semiconductor ASA)      [hci1] 0.704414
@ USER Open: main (privileged) version 2.22            {0x0001} [hci1] 0.704417
< HCI Command: Reset (0x03|0x0003) plen 0                    #1 [hci1] 0.704807
> HCI Event: Command Complete (0x0e) plen 4                  #2 [hci1] 0.705277
      Reset (0x03|0x0003) ncmd 1
        Status: Success (0x00)
< HCI Command: Read Local Supported... (0x04|0x0003) plen 0  #3 [hci1] 0.724341
> HCI Event: Command Complete (0x0e) plen 12                 #4 [hci1] 0.724895
      Read Local Supported Features (0x04|0x0003) ncmd 1
        Status: Success (0x00)
        Features: 0x00 0x00 0x00 0x00 0x60 0x00 0x00 0x00
          BR/EDR Not Supported
          LE Supported (Controller)
< HCI Command: Read Local Version In.. (0x04|0x0001) plen 0  #5 [hci1] 0.744305
> HCI Event: Command Complete (0x0e) plen 12                 #6 [hci1] 0.745057
      Read Local Version Information (0x04|0x0001) ncmd 1
        Status: Success (0x00)
        HCI version: Reserved (0x0f) - Revision 12393 (0x3069)
        LMP version: Reserved (0x0f) - Subversion 12393 (0x3069)
        Manufacturer: Nordic Semiconductor ASA (89)
< HCI Command: Read Local Supported... (0x04|0x0002) plen 0  #7 [hci1] 0.764299
> HCI Event: Command Complete (0x0e) plen 68                 #8 [hci1] 0.765375
      Read Local Supported Commands (0x04|0x0002) ncmd 1
        Status: Success (0x00)
        Commands: 119 entries
          Disconnect (Octet 0 - Bit 5)
          Read Remote Version Information (Octet 2 - Bit 7)
          Set Event Mask (Octet 5 - Bit 6)
          Reset (Octet 5 - Bit 7)
          Read Connection Accept Timeout (Octet 7 - Bit 2)
          Write Connection Accept Timeout (Octet 7 - Bit 3)
          Read Transmit Power Level (Octet 10 - Bit 2)
          Set Controller To Host Flow Control (Octet 10 - Bit 5)
          Host Buffer Size (Octet 10 - Bit 6)
          Host Number of Completed Packets (Octet 10 - Bit 7)
          Read Local Version Information (Octet 14 - Bit 3)
          Read Local Supported Features (Octet 14 - Bit 5)
          Read BD ADDR (Octet 15 - Bit 1)
          Read RSSI (Octet 15 - Bit 5)
          Set Event Mask Page 2 (Octet 22 - Bit 2)
          LE Set Event Mask (Octet 25 - Bit 0)
          LE Read Buffer Size (Octet 25 - Bit 1)
          LE Read Local Supported Features (Octet 25 - Bit 2)
          LE Set Random Address (Octet 25 - Bit 4)
          LE Set Advertising Parameters (Octet 25 - Bit 5)
          LE Read Advertising Channel TX Power (Octet 25 - Bit 6)
          LE Set Advertising Data (Octet 25 - Bit 7)
          LE Set Scan Response Data (Octet 26 - Bit 0)
          LE Set Advertise Enable (Octet 26 - Bit 1)
          LE Set Scan Parameters (Octet 26 - Bit 2)
          LE Set Scan Enable (Octet 26 - Bit 3)
          LE Create Connection (Octet 26 - Bit 4)
          LE Create Connection Cancel (Octet 26 - Bit 5)
          LE Read Accept List Size (Octet 26 - Bit 6)
          LE Clear Accept List (Octet 26 - Bit 7)
          LE Add Device To Accept List (Octet 27 - Bit 0)
          LE Remove Device From Accept List (Octet 27 - Bit 1)
          LE Connection Update (Octet 27 - Bit 2)
          LE Set Host Channel Classification (Octet 27 - Bit 3)
          LE Read Channel Map (Octet 27 - Bit 4)
          LE Read Remote Used Features (Octet 27 - Bit 5)
          LE Encrypt (Octet 27 - Bit 6)
          LE Rand (Octet 27 - Bit 7)
          LE Start Encryption (Octet 28 - Bit 0)
          LE Long Term Key Request Reply (Octet 28 - Bit 1)
          LE Long Term Key Request Neg Reply (Octet 28 - Bit 2)
          LE Read Supported States (Octet 28 - Bit 3)
          LE Receiver Test (Octet 28 - Bit 4)
          LE Transmitter Test (Octet 28 - Bit 5)
          LE Test End (Octet 28 - Bit 6)
          Read Authenticated Payload Timeout (Octet 32 - Bit 4)
          Write Authenticated Payload Timeout (Octet 32 - Bit 5)
          LE Set Data Length (Octet 33 - Bit 6)
          LE Read Suggested Default Data Length (Octet 33 - Bit 7)
          LE Write Suggested Default Data Length (Octet 34 - Bit 0)
          LE Add Device To Resolving List (Octet 34 - Bit 3)
          LE Remove Device From Resolving List (Octet 34 - Bit 4)
          LE Clear Resolving List (Octet 34 - Bit 5)
          LE Read Resolving List Size (Octet 34 - Bit 6)
          LE Set Address Resolution Enable (Octet 35 - Bit 1)
          LE Set Resolvable Private Address Timeout (Octet 35 - Bit 2)
          LE Read Maximum Data Length (Octet 35 - Bit 3)
          LE Read PHY (Octet 35 - Bit 4)
          LE Set Default PHY (Octet 35 - Bit 5)
          LE Set PHY (Octet 35 - Bit 6)
          LE Enhanced Receiver Test (Octet 35 - Bit 7)
          LE Enhanced Transmitter Test (Octet 36 - Bit 0)
          LE Set Advertising Set Random Address (Octet 36 - Bit 1)
          LE Set Extended Advertising Parameters (Octet 36 - Bit 2)
          LE Set Extended Advertising Data (Octet 36 - Bit 3)
          LE Set Extended Scan Response Data (Octet 36 - Bit 4)
          LE Set Extended Advertising Enable (Octet 36 - Bit 5)
          LE Read Maximum Advertising Data Length (Octet 36 - Bit 6)
          LE Read Number of Supported Advertising Sets (Octet 36 - Bit 7)
          LE Remove Advertising Set (Octet 37 - Bit 0)
          LE Clear Advertising Sets (Octet 37 - Bit 1)
          LE Set Periodic Advertising Parameters (Octet 37 - Bit 2)
          LE Set Periodic Advertising Data (Octet 37 - Bit 3)
          LE Set Periodic Advertising Enable (Octet 37 - Bit 4)
          LE Set Extended Scan Parameters (Octet 37 - Bit 5)
          LE Set Extended Scan Enable (Octet 37 - Bit 6)
          LE Extended Create Connection (Octet 37 - Bit 7)
          LE Periodic Advertising Create Sync (Octet 38 - Bit 0)
          LE Periodic Advertising Create Sync Cancel (Octet 38 - Bit 1)
          LE Periodic Advertising Terminate Sync (Octet 38 - Bit 2)
          LE Add Device To Periodic Advertiser List (Octet 38 - Bit 3)
          LE Remove Device From Periodic Advertiser List (Octet 38 - Bit 4)
          LE Clear Periodic Advertiser List (Octet 38 - Bit 5)
          LE Read Periodic Advertiser List Size (Octet 38 - Bit 6)
          LE Read Transmit Power (Octet 38 - Bit 7)
          LE Read RF Path Compensation (Octet 39 - Bit 0)
          LE Write RF Path Compensation (Octet 39 - Bit 1)
          LE Set Privacy Mode (Octet 39 - Bit 2)
          LE Periodic Advertising Receive Enable (Octet 40 - Bit 5)
          LE Periodic Advertising Sync Transfer (Octet 40 - Bit 6)
          LE Periodic Advertising Set Info Transfer (Octet 40 - Bit 7)
          LE Periodic Advertising Sync Transfer Parameters (Octet 41 - Bit 0)
          LE Set Default Periodic Advertisng Sync Transfer Parameters (Octet 41 - Bit 1)
          LE Read Buffer v2 (Octet 41 - Bit 5)
          LE Read ISO TX Sync (Octet 41 - Bit 6)
          LE Set Connected Isochronous Group Parameters (Octet 41 - Bit 7)
          LE Set Connected Isochronous Group Parameters Test (Octet 42 - Bit 0)
          LE Create Connected Isochronous Stream (Octet 42 - Bit 1)
          LE Remove Connected Isochronous Group (Octet 42 - Bit 2)
          LE Accept Connected Isochronous Stream Request (Octet 42 - Bit 3)
          LE Reject Connected Isochronous Stream Request (Octet 42 - Bit 4)
          LE Create Broadcast Isochronous Group (Octet 42 - Bit 5)
          LE Create Broadcast Isochronous Group Test (Octet 42 - Bit 6)
          LE Terminate Broadcast Isochronous Group (Octet 42 - Bit 7)
          LE Broadcast Isochronous Group Create Sync (Octet 43 - Bit 0)
          LE Broadcast Isochronous Group Terminate Sync (Octet 43 - Bit 1)
          LE Request Peer SCA (Octet 43 - Bit 2)
          LE Setup Isochronous Data Path (Octet 43 - Bit 3)
          LE Remove Isochronous Data Path (Octet 43 - Bit 4)
          LE Isochronous Transmit Test (Octet 43 - Bit 5)
          LE Isochronous Receive Test (Octet 43 - Bit 6)
          LE Isochronous Read Test Counters (Octet 43 - Bit 7)
          LE Isochronous Read Test Counters (Octet 44 - Bit 0)
          LE Set Host Feature (Octet 44 - Bit 1)
          Octet 44 - Bit 2 
          Octet 45 - Bit 6 
          Octet 46 - Bit 0 
          Octet 46 - Bit 1 
          Octet 46 - Bit 2 
< HCI Command: Host Buffer Size (0x03|0x0033) plen 7         #9 [hci1] 0.784305
        ACL MTU: 255  ACL max packet: 16
        SCO MTU: 0    SCO max packet: 0
> HCI Event: Command Complete (0x0e) plen 4                 #10 [hci1] 0.784787
      Host Buffer Size (0x03|0x0033) ncmd 1
        Status: Success (0x00)
< HCI Command: Set Controller To Ho.. (0x03|0x0031) plen 1  #11 [hci1] 0.804341
        Flow control: ACL Data Packets (0x01)
> HCI Event: Command Complete (0x0e) plen 4                 #12 [hci1] 0.804845
      Set Controller To Host Flow Control (0x03|0x0031) ncmd 1
        Status: Success (0x00)
< HCI Command: LE Read Local Suppor.. (0x08|0x0003) plen 0  #13 [hci1] 0.824363
> HCI Event: Command Complete (0x0e) plen 12                #14 [hci1] 0.824835
      LE Read Local Supported Features (0x08|0x0003) ncmd 1
        Status: Success (0x00)
        Features: 0xfd 0x79 0x00 0xf7 0x30 0x01 0x00 0x00
          LE Encryption
          Extended Reject Indication
          Peripheral-initiated Features Exchange
          LE Ping
          LE Data Packet Length Extension
          LL Privacy
          Extended Scanner Filter Policies
          LE 2M PHY
          LE Coded PHY
          LE Extended Advertising
          LE Periodic Advertising
          Channel Selection Algorithm #2
          Periodic Advertising Sync Transfer - Sender
          Periodic Advertising Sync Transfer - Recipient
          Sleep Clock Accuracy Updates
          Connected Isochronous Stream - Central
          Connected Isochronous Stream - Peripheral
          Isochronous Broadcaster
          Synchronized Receiver
          Periodic Advertising ADI support
          Connection Subrating
          Unknown features (0x0000010000000000)
< HCI Command: LE Set Host Feature (0x08|0x0074) plen 2     #15 [hci1] 0.844376
        Bit Number: 32
          Connected Isochronous Stream (Host Support)
        Bit Value: 1
> HCI Event: Command Complete (0x0e) plen 4                 #16 [hci1] 0.844858
      LE Set Host Feature (0x08|0x0074) ncmd 1
        Status: Success (0x00)
< HCI Command: LE Read Buffer v2 (0x08|0x0060) plen 0       #17 [hci1] 0.864366
> HCI Event: Command Complete (0x0e) plen 10                #18 [hci1] 0.864801
      LE Read Buffer v2 (0x08|0x0060) ncmd 1
        Status: Success (0x00)
        ACL MTU: 27
        ACL max packet: 3
        ISO MTU: 318
        ISO max packet: 3
< HCI Command: LE Read Maximum Adve.. (0x08|0x003a) plen 0  #19 [hci1] 0.884402
> HCI Event: Command Complete (0x0e) plen 6                 #20 [hci1] 0.885019
      LE Read Maximum Advertising Data Length (0x08|0x003a) ncmd 1
        Status: Success (0x00)
        Max length: 1650
< HCI Command: LE Read Supported St.. (0x08|0x001c) plen 0  #21 [hci1] 0.904337
> HCI Event: Command Complete (0x0e) plen 12                #22 [hci1] 0.904895
      LE Read Supported States (0x08|0x001c) ncmd 1
        Status: Success (0x00)
        States: 0x000003ff3e0306ff
          Non-connectable Advertising State
          Scannable Advertising State
          Connectable Advertising State
          High Duty Cycle Directed Advertising State
          Passive Scanning State
          Active Scanning State
          Initiating State
            and Connection State (Central Role)
          Connection State (Peripheral Role)
          Scannable Advertising State
            and Passive Scanning State
          Connectable Advertising State
            and Passive Scanning State
          Non-connectable Advertising State
            and Initiating State
          Scannable Advertising State
            and Initiating State
          Active Scanning State
            and Connection State (Central Role)
          Passive Scanning State
            and Connection State (Peripheral Role)
          Active Scanning State
            and Connection State (Peripheral Role)
          Initiating State
            and Connection State (Central Role)
            and Central Role & Central Role
          Low Duty Cycle Directed Advertising State
          Connectable Advertising State
            and Initiating State
            and Central Role & Peripheral Role
          High Duty Cycle Directed Advertising State
            and Initiating State
            and Central Role & Peripheral Role
          Low Duty Cycle Directed Advertising State
            and Initiating State
            and Central Role & Peripheral Role
          Connectable Advertising State
            and Connection State (Central Role)
            and Central Role & Peripheral Role
          High Duty Cycle Directed Advertising State
            and Connection State (Central Role)
            and Central Role & Peripheral Role
          Low Duty Cycle Directed Advertising State
            and Connection State (Central Role)
            and Central Role & Peripheral Role
          Connectable Advertising State
            and Connection State (Peripheral Role)
            and Central Role & Peripheral Role
          High Duty Cycle Directed Advertising State
            and Connection State (Peripheral Role)
            and Peripheral Role & Peripheral Role
          Low Duty Cycle Directed Advertising State
            and Connection State (Peripheral Role)
            and Peripheral Role & Peripheral Role
          Initiating State
            and Connection State (Peripheral Role)
            and Central Role & Peripheral Role
< HCI Command: LE Read Maximum Data.. (0x08|0x002f) plen 0  #23 [hci1] 0.924339
> HCI Event: Command Complete (0x0e) plen 12                #24 [hci1] 0.924792
      LE Read Maximum Data Length (0x08|0x002f) ncmd 1
        Status: Success (0x00)
        Max TX octets: 251
        Max TX time: 2704
        Max RX octets: 251
        Max RX time: 2704
< HCI Command: LE Write Suggested D.. (0x08|0x0024) plen 4  #25 [hci1] 0.944325
        TX octets: 251
        TX time: 2704
> HCI Event: Command Complete (0x0e) plen 4                 #26 [hci1] 0.944917
      LE Write Suggested Default Data Length (0x08|0x0024) ncmd 1
        Status: Success (0x00)
< HCI Command: LE Read Resolving Li.. (0x08|0x002a) plen 0  #27 [hci1] 0.964338
> HCI Event: Command Complete (0x0e) plen 5                 #28 [hci1] 0.964756
      LE Read Resolving List Size (0x08|0x002a) ncmd 1
        Status: Success (0x00)
        Size: 8
< HCI Command: LE Set Event Mask (0x08|0x0001) plen 8       #29 [hci1] 0.984330
        Mask: 0x000002023f87fa5e
          LE Advertising Report
          LE Connection Update Complete
          LE Read Remote Used Features Complete
          LE Long Term Key Request
          LE Data Length Change
          LE Enhanced Connection Complete
          LE PHY Update Complete
          LE Extended Advertising Report
          LE Periodic Advertising Sync Established
          LE Periodic Advertising Report
          LE Periodic Advertising Sync Lost
          LE Extended Scan Timeout
          LE Extended Advertising Set Terminated
          LE Scan Request Received
          LE Periodic Advertising Sync Transfer Rvc
          LE CIS Established
          LE CIS Request
          LE Create BIG Complete
          LE Terminate BIG Complete
          LE BIG Sync Estabilished Complete
          LE BIG Sync Lost
          LE BIG Info Advertising Report
          Unknown mask (0x0000020000000000)
> HCI Event: Command Complete (0x0e) plen 4                 #30 [hci1] 0.984870
      LE Set Event Mask (0x08|0x0001) ncmd 1
        Status: Success (0x00)
< HCI Command: Set Event Mask (0x03|0x0001) plen 8          #31 [hci1] 1.004298
        Mask: 0x2000800002008890
          Disconnection Complete
          Encryption Change
          Read Remote Version Information Complete
          Hardware Error
          Data Buffer Overflow
          Encryption Key Refresh Complete
          LE Meta
> HCI Event: Command Complete (0x0e) plen 4                 #32 [hci1] 1.004878
      Set Event Mask (0x03|0x0001) ncmd 1
        Status: Success (0x00)
< HCI Command: Read BD ADDR (0x04|0x0009) plen 0            #33 [hci1] 1.024380
> HCI Event: Command Complete (0x0e) plen 10                #34 [hci1] 1.024869
      Read BD ADDR (0x04|0x0009) ncmd 1
        Status: Success (0x00)
        Address: 00:00:00:00:00:00 (OUI 00-00-00)
< HCI Command: LE Set Random Address (0x08|0x0005) plen 6   #35 [hci1] 1.044390
        Address: D5:B6:CC:31:DB:3B (Static)
> HCI Event: Command Complete (0x0e) plen 4                 #36 [hci1] 1.044992
      LE Set Random Address (0x08|0x0005) ncmd 1
        Status: Success (0x00)
< HCI Command: LE Set Extended Adv.. (0x08|0x0036) plen 25  #37 [hci1] 3.314442
        Handle: 0x00
        Properties: 0x0013
          Connectable
          Scannable
          Use legacy advertising PDUs: ADV_IND
        Min advertising interval: 100.000 msec (0x00a0)
        Max advertising interval: 150.000 msec (0x00f0)
        Channel map: 37, 38, 39 (0x07)
        Own address type: Random (0x01)
        Peer address type: Public (0x00)
        Peer address: 00:00:00:00:00:00 (OUI 00-00-00)
        Filter policy: Allow Scan Request from Any, Allow Connect Request from Any (0x00)
        TX power: Host has no preference (0x7f)
        Primary PHY: LE 1M (0x01)
        Secondary max skip: 0x00
        Secondary PHY: LE 1M (0x01)
        SID: 0x00
        Scan request notifications: Disabled (0x00)
> HCI Event: Command Complete (0x0e) plen 5                 #38 [hci1] 3.315354
      LE Set Extended Advertising Parameters (0x08|0x0036) ncmd 1
        Status: Success (0x00)
        TX power (selected): 0 dbm (0x00)
< HCI Command: LE Set Advertising S.. (0x08|0x0035) plen 7  #39 [hci1] 3.324339
        Advertising handle: 0x00
        Advertising random address: D5:B6:CC:31:DB:3B (Static)
> HCI Event: Command Complete (0x0e) plen 4                 #40 [hci1] 3.324894
      LE Set Advertising Set Random Address (0x08|0x0035) ncmd 1
        Status: Success (0x00)
< HCI Command: LE Set Extended Adv.. (0x08|0x0037) plen 22  #41 [hci1] 3.344374
        Handle: 0x00
        Operation: Complete extended advertising data (0x03)
        Fragment preference: Minimize fragmentation (0x01)
        Data length: 0x12
        Flags: 0x06
          LE General Discoverable Mode
          BR/EDR Not Supported
        Name (complete): Tester_F6B11A
> HCI Event: Command Complete (0x0e) plen 4                 #42 [hci1] 3.345103
      LE Set Extended Advertising Data (0x08|0x0037) ncmd 1
        Status: Success (0x00)
< HCI Command: LE Set Extended Scan.. (0x08|0x0038) plen 4  #43 [hci1] 3.364355
        Handle: 0x00
        Operation: Complete scan response data (0x03)
        Fragment preference: Minimize fragmentation (0x01)
        Data length: 0x00
> HCI Event: Command Complete (0x0e) plen 4                 #44 [hci1] 3.364890
      LE Set Extended Scan Response Data (0x08|0x0038) ncmd 1
        Status: Success (0x00)
< HCI Command: LE Set Extended Adve.. (0x08|0x0039) plen 6  #45 [hci1] 3.384406
        Extended advertising: Enabled (0x01)
        Number of sets: 1 (0x01)
        Entry 0
          Handle: 0x00
          Duration: 0 ms (0x00)
          Max ext adv events: 0
> HCI Event: Command Complete (0x0e) plen 4                 #46 [hci1] 3.385071
      LE Set Extended Advertising Enable (0x08|0x0039) ncmd 1
        Status: Success (0x00)
> HCI Event: LE Meta Event (0x3e) plen 31                   #47 [hci1] 3.912525
      LE Enhanced Connection Complete (0x0a)
        Status: Success (0x00)
        Handle: 2163
        Role: Peripheral (0x01)
        Peer address type: Public (0x00)
        Peer address: DF:A9:FF:F6:B1:1A (OUI DF-A9-FF)
        Local resolvable private address: 00:00:00:00:00:00 (Non-Resolvable)
        Peer resolvable private address: 00:00:00:00:00:00 (Non-Resolvable)
        Connection interval: 87.50 msec (0x0046)
        Connection latency: 0 (0x0000)
        Supervision timeout: 20000 msec (0x07d0)
        Central clock accuracy: 0x01
> HCI Event: LE Meta Event (0x3e) plen 6                    #48 [hci1] 3.912528
      LE Advertising Set Terminated (0x12)
        Status: Success (0x00)
        Handle: 0
        Connection handle: 2163
        Number of completed extended advertising events: 0
< HCI Command: LE Read Remote Used... (0x08|0x0016) plen 2  #49 [hci1] 3.924791
        Handle: 2163 Address: DF:A9:FF:F6:B1:1A (OUI DF-A9-FF)
> HCI Event: Command Status (0x0f) plen 4                   #50 [hci1] 3.925228
      LE Read Remote Used Features (0x08|0x0016) ncmd 1
        Status: Success (0x00)
> HCI Event: LE Meta Event (0x3e) plen 12                   #51 [hci1] 4.176281
      LE Read Remote Used Features (0x04)
        Status: Success (0x00)
        Handle: 2163 Address: DF:A9:FF:F6:B1:1A (OUI DF-A9-FF)
        Features: 0x2d 0x49 0x00 0xf7 0x67 0xd9 0x00 0x80
          LE Encryption
          Extended Reject Indication
          Peripheral-initiated Features Exchange
          LE Data Packet Length Extension
          LE 2M PHY
          LE Coded PHY
          Channel Selection Algorithm #2
          Periodic Advertising Sync Transfer - Sender
          Periodic Advertising Sync Transfer - Recipient
          Sleep Clock Accuracy Updates
          Connected Isochronous Stream - Central
          Connected Isochronous Stream - Peripheral
          Isochronous Broadcaster
          Synchronized Receiver
          Connected Isochronous Stream (Host Support)
          LE Power Control Request
          LE Power Control Request
          Connection Subrating
          Connection Subrating (Host Support)
          Unknown features (0x8000d90000000000)
> ACL Data RX: Handle 2163 flags 0x02 dlen 11               #52 [hci1] 4.613646
      SMP: Pairing Request (0x01) len 6
        IO capability: KeyboardOnly (0x02)
        OOB data: Authentication data not present (0x00)
        Authentication requirement: No bonding, MITM, SC, No Keypresses (0xcc)
        Max encryption key size: 16
        Initiator key distribution: <none> (0x00)
        Responder key distribution: <none> (0x00)
< HCI Command: Host Number of Compl.. (0x03|0x0035) plen 5  #53 [hci1] 4.624900
        Num handles: 1
        Handle: 2163 Address: DF:A9:FF:F6:B1:1A (OUI DF-A9-FF)
        Count: 1
< ACL Data TX: Handle 2163 flags 0x00 dlen 11               #54 [hci1] 4.624956
      SMP: Pairing Response (0x02) len 6
        IO capability: DisplayOnly (0x00)
        OOB data: Authentication data not present (0x00)
        Authentication requirement: Bonding, No MITM, SC, No Keypresses (0x09)
        Max encryption key size: 16
        Initiator key distribution: <none> (0x00)
        Responder key distribution: <none> (0x00)
> HCI Event: Number of Completed Packets (0x13) plen 5      #55 [hci1] 4.788770
        Num handles: 1
        Handle: 2163 Address: DF:A9:FF:F6:B1:1A (OUI DF-A9-FF)
        Count: 1
        #54: len 11 (0 Kb/s)
        Latency: 163 msec (163-163 msec ~163 msec)
> ACL Data RX: Handle 2163 flags 0x02 dlen 27               #56 [hci1] 4.789095
> ACL Data RX: Handle 2163 flags 0x01 dlen 27               #57 [hci1] 4.789642
> ACL Data RX: Handle 2163 flags 0x01 dlen 15               #58 [hci1] 4.790044
      SMP: Pairing Public Key (0x0c) len 64
        X: 66f25df0ab1651e8436eaaefff6b7cba1132e72cb70681403183b409945f4dd3
        Y: d2eb680b054252a93f77d77fe43552532309b566039ce472f671959f7647e837
< HCI Command: Host Number of Compl.. (0x03|0x0035) plen 5  #59 [hci1] 4.805144
        Num handles: 1
        Handle: 2163 Address: DF:A9:FF:F6:B1:1A (OUI DF-A9-FF)
        Count: 1
< HCI Command: Host Number of Compl.. (0x03|0x0035) plen 5  #60 [hci1] 4.805272
        Num handles: 1
        Handle: 2163 Address: DF:A9:FF:F6:B1:1A (OUI DF-A9-FF)
        Count: 1
< HCI Command: Host Number of Compl.. (0x03|0x0035) plen 5  #61 [hci1] 4.805552
        Num handles: 1
        Handle: 2163 Address: DF:A9:FF:F6:B1:1A (OUI DF-A9-FF)
        Count: 1
< ACL Data TX: Handle 2163 flags 0x00 dlen 27               #62 [hci1] 4.805602
< ACL Data TX: Handle 2163 flags 0x01 dlen 27               #63 [hci1] 4.805633
< ACL Data TX: Handle 2163 flags 0x01 dlen 15               #64 [hci1] 4.805637
      SMP: Pairing Public Key (0x0c) len 64
        X: 98308440221e2d910f0e54b71e7ec652857aa9b5a0dc65028824cc19db1226e9
        Y: 67a4816bcb62efb21701e31fdb27561a6217575fb007a8bbdabe7e28b6f68482
> HCI Event: Number of Completed Packets (0x13) plen 5      #65 [hci1] 4.876538
        Num handles: 1
        Handle: 2163 Address: DF:A9:FF:F6:B1:1A (OUI DF-A9-FF)
        Count: 1
        #62: len 27 (3 Kb/s)
        Latency: 70 msec (70-163 msec ~117 msec)
> HCI Event: Number of Completed Packets (0x13) plen 5      #66 [hci1] 4.877252
        Num handles: 1
        Handle: 2163 Address: DF:A9:FF:F6:B1:1A (OUI DF-A9-FF)
        Count: 1
        #63: len 27 (3 Kb/s)
        Latency: 71 msec (70-163 msec ~94 msec)
> HCI Event: Number of Completed Packets (0x13) plen 5      #67 [hci1] 4.963488
        Num handles: 1
        Handle: 2163 Address: DF:A9:FF:F6:B1:1A (OUI DF-A9-FF)
        Count: 1
        #64: len 15 (0 Kb/s)
        Latency: 157 msec (70-163 msec ~126 msec)
> ACL Data RX: Handle 2163 flags 0x02 dlen 21               #68 [hci1] 5.488691
      SMP: Pairing Confirm (0x03) len 16
        Confim value: c29891df776500ed16992b46ada70d22
< HCI Command: Host Number of Compl.. (0x03|0x0035) plen 5  #69 [hci1] 5.505190
        Num handles: 1
        Handle: 2163 Address: DF:A9:FF:F6:B1:1A (OUI DF-A9-FF)
        Count: 1
< ACL Data TX: Handle 2163 flags 0x00 dlen 21               #70 [hci1] 5.505276
      SMP: Pairing Confirm (0x03) len 16
        Confim value: fe4eb5a063f8dfba4e7019a69d36a739
> HCI Event: Number of Completed Packets (0x13) plen 5      #71 [hci1] 5.663690
        Num handles: 1
        Handle: 2163 Address: DF:A9:FF:F6:B1:1A (OUI DF-A9-FF)
        Count: 1
        #70: len 21 (1 Kb/s)
        Latency: 158 msec (70-163 msec ~142 msec)
> ACL Data RX: Handle 2163 flags 0x02 dlen 21               #72 [hci1] 5.664024
      SMP: Pairing Random (0x04) len 16
        Random value: e7dc5fe05a199520e9e4840df084bcb3
< HCI Command: Host Number of Compl.. (0x03|0x0035) plen 5  #73 [hci1] 5.665140
        Num handles: 1
        Handle: 2163 Address: DF:A9:FF:F6:B1:1A (OUI DF-A9-FF)
        Count: 1
< ACL Data TX: Handle 2163 flags 0x00 dlen 21               #74 [hci1] 5.665276
      SMP: Pairing Random (0x04) len 16
        Random value: 8e6108f966a694cbe26df70bb96773e6
> HCI Event: Number of Completed Packets (0x13) plen 5      #75 [hci1] 5.838628
        Num handles: 1
        Handle: 2163 Address: DF:A9:FF:F6:B1:1A (OUI DF-A9-FF)
        Count: 1
        #74: len 21 (0 Kb/s)
        Latency: 173 msec (70-173 msec ~157 msec)
> ACL Data RX: Handle 2163 flags 0x02 dlen 21               #76 [hci1] 5.838950
      SMP: Pairing Confirm (0x03) len 16
        Confim value: 3fffba680f0a2b612889fe6ef0e3eaf1
< HCI Command: Host Number of Compl.. (0x03|0x0035) plen 5  #77 [hci1] 5.845233
        Num handles: 1
        Handle: 2163 Address: DF:A9:FF:F6:B1:1A (OUI DF-A9-FF)
        Count: 1
< ACL Data TX: Handle 2163 flags 0x00 dlen 21               #78 [hci1] 5.845313
      SMP: Pairing Confirm (0x03) len 16
        Confim value: d88ddea406dd36a0df1ba81b1a0af72b
> HCI Event: Number of Completed Packets (0x13) plen 5      #79 [hci1] 6.013743
        Num handles: 1
        Handle: 2163 Address: DF:A9:FF:F6:B1:1A (OUI DF-A9-FF)
        Count: 1
        #78: len 21 (1 Kb/s)
        Latency: 168 msec (70-173 msec ~163 msec)
> ACL Data RX: Handle 2163 flags 0x02 dlen 21               #80 [hci1] 6.014014
      SMP: Pairing Random (0x04) len 16
        Random value: a9c576d4d15807e9c8aa5914d4084bf0
< HCI Command: Host Number of Compl.. (0x03|0x0035) plen 5  #81 [hci1] 6.024970
        Num handles: 1
        Handle: 2163 Address: DF:A9:FF:F6:B1:1A (OUI DF-A9-FF)
        Count: 1
< ACL Data TX: Handle 2163 flags 0x00 dlen 21               #82 [hci1] 6.025014
      SMP: Pairing Random (0x04) len 16
        Random value: 4d02679f89a05211af56d8b3da64d21e
> HCI Event: Number of Completed Packets (0x13) plen 5      #83 [hci1] 6.188709
        Num handles: 1
        Handle: 2163 Address: DF:A9:FF:F6:B1:1A (OUI DF-A9-FF)
        Count: 1
        #82: len 21 (1 Kb/s)
        Latency: 163 msec (70-173 msec ~163 msec)
> ACL Data RX: Handle 2163 flags 0x02 dlen 21               #84 [hci1] 6.189025
      SMP: Pairing Confirm (0x03) len 16
        Confim value: 987abf790b49da0f9dcdd4f34e191fb0
< HCI Command: Host Number of Compl.. (0x03|0x0035) plen 5  #85 [hci1] 6.204601
        Num handles: 1
        Handle: 2163 Address: DF:A9:FF:F6:B1:1A (OUI DF-A9-FF)
        Count: 1
< ACL Data TX: Handle 2163 flags 0x00 dlen 21               #86 [hci1] 6.204639
      SMP: Pairing Confirm (0x03) len 16
        Confim value: 2387ab0c8e3d11b6f83e89ced9503703
> HCI Event: Number of Completed Packets (0x13) plen 5      #87 [hci1] 6.363797
        Num handles: 1
        Handle: 2163 Address: DF:A9:FF:F6:B1:1A (OUI DF-A9-FF)
        Count: 1
        #86: len 21 (1 Kb/s)
        Latency: 159 msec (70-173 msec ~161 msec)
> ACL Data RX: Handle 2163 flags 0x02 dlen 21               #88 [hci1] 6.364029
      SMP: Pairing Random (0x04) len 16
        Random value: de0c074ee140ddec5966ccec3892c838
< HCI Command: Host Number of Compl.. (0x03|0x0035) plen 5  #89 [hci1] 6.365201
        Num handles: 1
        Handle: 2163 Address: DF:A9:FF:F6:B1:1A (OUI DF-A9-FF)
        Count: 1
< ACL Data TX: Handle 2163 flags 0x00 dlen 21               #90 [hci1] 6.365256
      SMP: Pairing Random (0x04) len 16
        Random value: 5e8286bc235a02440d0c3424a2acf8fd
> HCI Event: Number of Completed Packets (0x13) plen 5      #91 [hci1] 6.538628
        Num handles: 1
        Handle: 2163 Address: DF:A9:FF:F6:B1:1A (OUI DF-A9-FF)
        Count: 1
        #90: len 21 (0 Kb/s)
        Latency: 173 msec (70-173 msec ~167 msec)
> ACL Data RX: Handle 2163 flags 0x02 dlen 21               #92 [hci1] 6.538915
      SMP: Pairing Confirm (0x03) len 16
        Confim value: e97a5f73144762a9cf43707ae0276a8b
< HCI Command: Host Number of Compl.. (0x03|0x0035) plen 5  #93 [hci1] 6.544758
        Num handles: 1
        Handle: 2163 Address: DF:A9:FF:F6:B1:1A (OUI DF-A9-FF)
        Count: 1
< ACL Data TX: Handle 2163 flags 0x00 dlen 21               #94 [hci1] 6.544794
      SMP: Pairing Confirm (0x03) len 16
        Confim value: 533cefe649ae42688d1e94cdfd595088
> HCI Event: Number of Completed Packets (0x13) plen 5      #95 [hci1] 6.713529
        Num handles: 1
        Handle: 2163 Address: DF:A9:FF:F6:B1:1A (OUI DF-A9-FF)
        Count: 1
        #94: len 21 (1 Kb/s)
        Latency: 168 msec (70-173 msec ~168 msec)
> ACL Data RX: Handle 2163 flags 0x02 dlen 21               #96 [hci1] 6.713911
      SMP: Pairing Random (0x04) len 16
        Random value: 76b8bd6d2a45ee35eefbe6911c756c78
< HCI Command: Host Number of Compl.. (0x03|0x0035) plen 5  #97 [hci1] 6.724727
        Num handles: 1
        Handle: 2163 Address: DF:A9:FF:F6:B1:1A (OUI DF-A9-FF)
        Count: 1
< ACL Data TX: Handle 2163 flags 0x00 dlen 21               #98 [hci1] 6.724798
      SMP: Pairing Random (0x04) len 16
        Random value: 5c4a1bcadd27bd58e945097b00bad7ac
> HCI Event: Number of Completed Packets (0x13) plen 5      #99 [hci1] 6.888524
        Num handles: 1
        Handle: 2163 Address: DF:A9:FF:F6:B1:1A (OUI DF-A9-FF)
        Count: 1
        #98: len 21 (1 Kb/s)
        Latency: 163 msec (70-173 msec ~165 msec)
> ACL Data RX: Handle 2163 flags 0x02 dlen 21              #100 [hci1] 6.889005
      SMP: Pairing Confirm (0x03) len 16
        Confim value: ec91458eeac85aa71dbbf7600802e120
< HCI Command: Host Number of Comp.. (0x03|0x0035) plen 5  #101 [hci1] 6.905280
        Num handles: 1
        Handle: 2163 Address: DF:A9:FF:F6:B1:1A (OUI DF-A9-FF)
        Count: 1
< ACL Data TX: Handle 2163 flags 0x00 dlen 21              #102 [hci1] 6.905412
      SMP: Pairing Confirm (0x03) len 16
        Confim value: a3c7921dc5f72419fe344a39d4f7656d
> HCI Event: Number of Completed Packets (0x13) plen 5     #103 [hci1] 7.063655
        Num handles: 1
        Handle: 2163 Address: DF:A9:FF:F6:B1:1A (OUI DF-A9-FF)
        Count: 1
        #102: len 21 (1 Kb/s)
        Latency: 158 msec (70-173 msec ~162 msec)
> ACL Data RX: Handle 2163 flags 0x02 dlen 21              #104 [hci1] 7.063916
      SMP: Pairing Random (0x04) len 16
        Random value: a30d7f8c8e1b5412168ef140c248b0de
< HCI Command: Host Number of Comp.. (0x03|0x0035) plen 5  #105 [hci1] 7.065155
        Num handles: 1
        Handle: 2163 Address: DF:A9:FF:F6:B1:1A (OUI DF-A9-FF)
        Count: 1
< ACL Data TX: Handle 2163 flags 0x00 dlen 21              #106 [hci1] 7.065208
      SMP: Pairing Random (0x04) len 16
        Random value: 32527e6e64e79f33b2e374394db8ab2d
> HCI Event: Number of Completed Packets (0x13) plen 5     #107 [hci1] 7.238681
        Num handles: 1
        Handle: 2163 Address: DF:A9:FF:F6:B1:1A (OUI DF-A9-FF)
        Count: 1
        #106: len 21 (0 Kb/s)
        Latency: 173 msec (70-173 msec ~167 msec)
> ACL Data RX: Handle 2163 flags 0x02 dlen 21              #108 [hci1] 7.238935
      SMP: Pairing Confirm (0x03) len 16
        Confim value: 44e1e2a6586a9caec7dfbdbf7233b27c
< HCI Command: Host Number of Comp.. (0x03|0x0035) plen 5  #109 [hci1] 7.244649
        Num handles: 1
        Handle: 2163 Address: DF:A9:FF:F6:B1:1A (OUI DF-A9-FF)
        Count: 1
< ACL Data TX: Handle 2163 flags 0x00 dlen 21              #110 [hci1] 7.244657
      SMP: Pairing Confirm (0x03) len 16
        Confim value: d0eb012d22f7512e7b6bccfde8c59789
> HCI Event: Number of Completed Packets (0x13) plen 5     #111 [hci1] 7.413634
        Num handles: 1
        Handle: 2163 Address: DF:A9:FF:F6:B1:1A (OUI DF-A9-FF)
        Count: 1
        #110: len 21 (1 Kb/s)
        Latency: 168 msec (70-173 msec ~168 msec)
> ACL Data RX: Handle 2163 flags 0x02 dlen 21              #112 [hci1] 7.414021
      SMP: Pairing Random (0x04) len 16
        Random value: d590784a2db96810a3867677abe04ed6
< HCI Command: Host Number of Comp.. (0x03|0x0035) plen 5  #113 [hci1] 7.425309
        Num handles: 1
        Handle: 2163 Address: DF:A9:FF:F6:B1:1A (OUI DF-A9-FF)
        Count: 1
< ACL Data TX: Handle 2163 flags 0x00 dlen 21              #114 [hci1] 7.425418
      SMP: Pairing Random (0x04) len 16
        Random value: dddbdfe2838e9a8cc6964353c850fef7
> HCI Event: Number of Completed Packets (0x13) plen 5     #115 [hci1] 7.588648
        Num handles: 1
        Handle: 2163 Address: DF:A9:FF:F6:B1:1A (OUI DF-A9-FF)
        Count: 1
        #114: len 21 (1 Kb/s)
        Latency: 163 msec (70-173 msec ~165 msec)
> ACL Data RX: Handle 2163 flags 0x02 dlen 21              #116 [hci1] 7.589006
      SMP: Pairing Confirm (0x03) len 16
        Confim value: a862b30258fc16c20a34165948b087ac
< HCI Command: Host Number of Comp.. (0x03|0x0035) plen 5  #117 [hci1] 7.605258
        Num handles: 1
        Handle: 2163 Address: DF:A9:FF:F6:B1:1A (OUI DF-A9-FF)
        Count: 1
< ACL Data TX: Handle 2163 flags 0x00 dlen 21              #118 [hci1] 7.605342
      SMP: Pairing Confirm (0x03) len 16
        Confim value: b9e44620b6ca0b67ff13718dcfffa915
> HCI Event: Number of Completed Packets (0x13) plen 5     #119 [hci1] 7.763666
        Num handles: 1
        Handle: 2163 Address: DF:A9:FF:F6:B1:1A (OUI DF-A9-FF)
        Count: 1
        #118: len 21 (1 Kb/s)
        Latency: 158 msec (70-173 msec ~162 msec)
> ACL Data RX: Handle 2163 flags 0x02 dlen 21              #120 [hci1] 7.763982
      SMP: Pairing Random (0x04) len 16
        Random value: be060f836852c2fca7853cf398503e0d
< HCI Command: Host Number of Comp.. (0x03|0x0035) plen 5  #121 [hci1] 7.765240
        Num handles: 1
        Handle: 2163 Address: DF:A9:FF:F6:B1:1A (OUI DF-A9-FF)
        Count: 1
< ACL Data TX: Handle 2163 flags 0x00 dlen 21              #122 [hci1] 7.765265
      SMP: Pairing Random (0x04) len 16
        Random value: eb9f1915536596b6fc3db1c86b2b1970
> HCI Event: Number of Completed Packets (0x13) plen 5     #123 [hci1] 7.938561
        Num handles: 1
        Handle: 2163 Address: DF:A9:FF:F6:B1:1A (OUI DF-A9-FF)
        Count: 1
        #122: len 21 (0 Kb/s)
        Latency: 173 msec (70-173 msec ~167 msec)
> ACL Data RX: Handle 2163 flags 0x02 dlen 21              #124 [hci1] 7.938917
      SMP: Pairing Confirm (0x03) len 16
        Confim value: 700685825112997fb15b3ab7a6122f60
< HCI Command: Host Number of Comp.. (0x03|0x0035) plen 5  #125 [hci1] 7.944706
        Num handles: 1
        Handle: 2163 Address: DF:A9:FF:F6:B1:1A (OUI DF-A9-FF)
        Count: 1
< ACL Data TX: Handle 2163 flags 0x00 dlen 21              #126 [hci1] 7.944731
      SMP: Pairing Confirm (0x03) len 16
        Confim value: 76059948ff6c4b012baaabd06085ebf2
> HCI Event: Number of Completed Packets (0x13) plen 5     #127 [hci1] 8.113702
        Num handles: 1
        Handle: 2163 Address: DF:A9:FF:F6:B1:1A (OUI DF-A9-FF)
        Count: 1
        #126: len 21 (1 Kb/s)
        Latency: 168 msec (70-173 msec ~168 msec)
> ACL Data RX: Handle 2163 flags 0x02 dlen 21              #128 [hci1] 8.113939
      SMP: Pairing Random (0x04) len 16
        Random value: 4e74ee53e15c3ce272734fb08aefb970
< HCI Command: Host Number of Comp.. (0x03|0x0035) plen 5  #129 [hci1] 8.125267
        Num handles: 1
        Handle: 2163 Address: DF:A9:FF:F6:B1:1A (OUI DF-A9-FF)
        Count: 1
< ACL Data TX: Handle 2163 flags 0x00 dlen 21              #130 [hci1] 8.125424
      SMP: Pairing Random (0x04) len 16
        Random value: 5c794dc9ad9f2c3f295ebd5ad5e1c3cf
> HCI Event: Number of Completed Packets (0x13) plen 5     #131 [hci1] 8.288690
        Num handles: 1
        Handle: 2163 Address: DF:A9:FF:F6:B1:1A (OUI DF-A9-FF)
        Count: 1
        #130: len 21 (1 Kb/s)
        Latency: 163 msec (70-173 msec ~165 msec)
> ACL Data RX: Handle 2163 flags 0x02 dlen 21              #132 [hci1] 8.288889
      SMP: Pairing Confirm (0x03) len 16
        Confim value: 09e824de93243c164c8778747462645c
< HCI Command: Host Number of Comp.. (0x03|0x0035) plen 5  #133 [hci1] 8.305321
        Num handles: 1
        Handle: 2163 Address: DF:A9:FF:F6:B1:1A (OUI DF-A9-FF)
        Count: 1
< ACL Data TX: Handle 2163 flags 0x00 dlen 21              #134 [hci1] 8.305449
      SMP: Pairing Confirm (0x03) len 16
        Confim value: 2ec8e2587e124211989bf2b380d20edb
> HCI Event: Number of Completed Packets (0x13) plen 5     #135 [hci1] 8.463574
        Num handles: 1
        Handle: 2163 Address: DF:A9:FF:F6:B1:1A (OUI DF-A9-FF)
        Count: 1
        #134: len 21 (1 Kb/s)
        Latency: 158 msec (70-173 msec ~161 msec)
> ACL Data RX: Handle 2163 flags 0x02 dlen 21              #136 [hci1] 8.463956
      SMP: Pairing Random (0x04) len 16
        Random value: b81fff19778def109473f5ebc252382d
< HCI Command: Host Number of Comp.. (0x03|0x0035) plen 5  #137 [hci1] 8.465196
        Num handles: 1
        Handle: 2163 Address: DF:A9:FF:F6:B1:1A (OUI DF-A9-FF)
        Count: 1
< ACL Data TX: Handle 2163 flags 0x00 dlen 21              #138 [hci1] 8.465224
      SMP: Pairing Random (0x04) len 16
        Random value: 5c2fff312cdf99c9491988e877355a9a
> HCI Event: Number of Completed Packets (0x13) plen 5     #139 [hci1] 8.638557
        Num handles: 1
        Handle: 2163 Address: DF:A9:FF:F6:B1:1A (OUI DF-A9-FF)
        Count: 1
        #138: len 21 (0 Kb/s)
        Latency: 173 msec (70-173 msec ~167 msec)
> ACL Data RX: Handle 2163 flags 0x02 dlen 21              #140 [hci1] 8.639019
      SMP: Pairing Confirm (0x03) len 16
        Confim value: f36618e098765b8df9b588b872011268
< HCI Command: Host Number of Comp.. (0x03|0x0035) plen 5  #141 [hci1] 8.645133
        Num handles: 1
        Handle: 2163 Address: DF:A9:FF:F6:B1:1A (OUI DF-A9-FF)
        Count: 1
< ACL Data TX: Handle 2163 flags 0x00 dlen 21              #142 [hci1] 8.645204
      SMP: Pairing Confirm (0x03) len 16
        Confim value: f040f208b6455d5e4da246acb337929e
> HCI Event: Number of Completed Packets (0x13) plen 5     #143 [hci1] 8.813626
        Num handles: 1
        Handle: 2163 Address: DF:A9:FF:F6:B1:1A (OUI DF-A9-FF)
        Count: 1
        #142: len 21 (1 Kb/s)
        Latency: 168 msec (70-173 msec ~168 msec)
> ACL Data RX: Handle 2163 flags 0x02 dlen 21              #144 [hci1] 8.813866
      SMP: Pairing Random (0x04) len 16
        Random value: 6a8d69714ed83313e0ebb922c04d75b0
< HCI Command: Host Number of Comp.. (0x03|0x0035) plen 5  #145 [hci1] 8.824866
        Num handles: 1
        Handle: 2163 Address: DF:A9:FF:F6:B1:1A (OUI DF-A9-FF)
        Count: 1
< ACL Data TX: Handle 2163 flags 0x00 dlen 21              #146 [hci1] 8.824954
      SMP: Pairing Random (0x04) len 16
        Random value: c629a3a987d808e808655d558dfc1155
< ACL Data TX: Handle 2163 flags 0x00 dlen 16              #147 [hci1] 8.934746
      LE L2CAP: Connection Parameter Update Request (0x12) ident 1 len 8
        Min interval: 24
        Max interval: 40
        Peripheral latency: 0
        Timeout multiplier: 42
> HCI Event: Number of Completed Packets (0x13) plen 5     #148 [hci1] 8.988559
        Num handles: 1
        Handle: 2163 Address: DF:A9:FF:F6:B1:1A (OUI DF-A9-FF)
        Count: 1
        #146: len 21 (1 Kb/s)
        Latency: 163 msec (70-173 msec ~165 msec)
> ACL Data RX: Handle 2163 flags 0x02 dlen 21              #149 [hci1] 8.988967
      SMP: Pairing Confirm (0x03) len 16
        Confim value: 20749ecb4a0acc400851afdde6480473
< HCI Command: Host Number of Comp.. (0x03|0x0035) plen 5  #150 [hci1] 9.005119
        Num handles: 1
        Handle: 2163 Address: DF:A9:FF:F6:B1:1A (OUI DF-A9-FF)
        Count: 1
< ACL Data TX: Handle 2163 flags 0x00 dlen 21              #151 [hci1] 9.005192
      SMP: Pairing Confirm (0x03) len 16
        Confim value: 8a65ff4447334fca4ba2044b55cdd7fa
> HCI Event: Number of Completed Packets (0x13) plen 5     #152 [hci1] 9.075991
        Num handles: 1
        Handle: 2163 Address: DF:A9:FF:F6:B1:1A (OUI DF-A9-FF)
        Count: 1
        #147: len 16 (0 Kb/s)
        Latency: 141 msec (70-173 msec ~153 msec)
> ACL Data RX: Handle 2163 flags 0x02 dlen 10              #153 [hci1] 9.076135
      LE L2CAP: Connection Parameter Update Response (0x13) ident 1 len 2
        Result: Connection Parameters accepted (0x0000)
< HCI Command: Host Number of Comp.. (0x03|0x0035) plen 5  #154 [hci1] 9.084801
        Num handles: 1
        Handle: 2163 Address: DF:A9:FF:F6:B1:1A (OUI DF-A9-FF)
        Count: 1
> HCI Event: Number of Completed Packets (0x13) plen 5     #155 [hci1] 9.163705
        Num handles: 1
        Handle: 2163 Address: DF:A9:FF:F6:B1:1A (OUI DF-A9-FF)
        Count: 1
        #151: len 21 (1 Kb/s)
        Latency: 158 msec (70-173 msec ~156 msec)
> ACL Data RX: Handle 2163 flags 0x02 dlen 21              #156 [hci1] 9.163944
      SMP: Pairing Random (0x04) len 16
        Random value: 17829637c473a2b86680641246f567a6
< HCI Command: Host Number of Comp.. (0x03|0x0035) plen 5  #157 [hci1] 9.165167
        Num handles: 1
        Handle: 2163 Address: DF:A9:FF:F6:B1:1A (OUI DF-A9-FF)
        Count: 1
< ACL Data TX: Handle 2163 flags 0x00 dlen 21              #158 [hci1] 9.165278
      SMP: Pairing Random (0x04) len 16
        Random value: 92f20f6ad8f13724432c7fd6001c45ff
> HCI Event: Number of Completed Packets (0x13) plen 5     #159 [hci1] 9.338617
        Num handles: 1
        Handle: 2163 Address: DF:A9:FF:F6:B1:1A (OUI DF-A9-FF)
        Count: 1
        #158: len 21 (0 Kb/s)
        Latency: 173 msec (70-173 msec ~164 msec)
> ACL Data RX: Handle 2163 flags 0x02 dlen 21              #160 [hci1] 9.338804
      SMP: Pairing Confirm (0x03) len 16
        Confim value: 472b8aa43761925dde4a16cce17a7f32
< HCI Command: Host Number of Comp.. (0x03|0x0035) plen 5  #161 [hci1] 9.345287
        Num handles: 1
        Handle: 2163 Address: DF:A9:FF:F6:B1:1A (OUI DF-A9-FF)
        Count: 1
< ACL Data TX: Handle 2163 flags 0x00 dlen 21              #162 [hci1] 9.345388
      SMP: Pairing Confirm (0x03) len 16
        Confim value: 6fd2098ea568816a55fc3f4688e8e1a8
> HCI Event: Number of Completed Packets (0x13) plen 5     #163 [hci1] 9.513587
        Num handles: 1
        Handle: 2163 Address: DF:A9:FF:F6:B1:1A (OUI DF-A9-FF)
        Count: 1
        #162: len 21 (1 Kb/s)
        Latency: 168 msec (70-173 msec ~166 msec)
> ACL Data RX: Handle 2163 flags 0x02 dlen 21              #164 [hci1] 9.513830
      SMP: Pairing Random (0x04) len 16
        Random value: b0022f8a7cd2150b7716feb755a049fd
< HCI Command: Host Number of Comp.. (0x03|0x0035) plen 5  #165 [hci1] 9.525192
        Num handles: 1
        Handle: 2163 Address: DF:A9:FF:F6:B1:1A (OUI DF-A9-FF)
        Count: 1
< ACL Data TX: Handle 2163 flags 0x00 dlen 21              #166 [hci1] 9.525281
      SMP: Pairing Random (0x04) len 16
        Random value: 23ac32ebbb5e14c8a6b9622f296d277f
> HCI Event: Number of Completed Packets (0x13) plen 5     #167 [hci1] 9.688615
        Num handles: 1
        Handle: 2163 Address: DF:A9:FF:F6:B1:1A (OUI DF-A9-FF)
        Count: 1
        #166: len 21 (1 Kb/s)
        Latency: 163 msec (70-173 msec ~164 msec)
> ACL Data RX: Handle 2163 flags 0x02 dlen 21              #168 [hci1] 9.688818
      SMP: Pairing Confirm (0x03) len 16
        Confim value: fb6d77fa078866741bc1fac7c1ab1625
< HCI Command: Host Number of Comp.. (0x03|0x0035) plen 5  #169 [hci1] 9.704958
        Num handles: 1
        Handle: 2163 Address: DF:A9:FF:F6:B1:1A (OUI DF-A9-FF)
        Count: 1
< ACL Data TX: Handle 2163 flags 0x00 dlen 21              #170 [hci1] 9.705014
      SMP: Pairing Confirm (0x03) len 16
        Confim value: cea20ad2a92aa6cf2f222ab9c1068672
> HCI Event: Number of Completed Packets (0x13) plen 5     #171 [hci1] 9.863626
        Num handles: 1
        Handle: 2163 Address: DF:A9:FF:F6:B1:1A (OUI DF-A9-FF)
        Count: 1
        #170: len 21 (1 Kb/s)
        Latency: 158 msec (70-173 msec ~161 msec)
> ACL Data RX: Handle 2163 flags 0x02 dlen 21              #172 [hci1] 9.863851
      SMP: Pairing Random (0x04) len 16
        Random value: 66541dc656aca55ba4d2d14e2ee293e0
< HCI Command: Host Number of Comp.. (0x03|0x0035) plen 5  #173 [hci1] 9.865228
        Num handles: 1
        Handle: 2163 Address: DF:A9:FF:F6:B1:1A (OUI DF-A9-FF)
        Count: 1
< ACL Data TX: Handle 2163 flags 0x00 dlen 21              #174 [hci1] 9.865348
      SMP: Pairing Random (0x04) len 16
        Random value: 297efe85e67448a15f56bd27e3a3cf1d
> HCI Event: Number of Completed Packets (0x13) plen 5    #175 [hci1] 10.038492
        Num handles: 1
        Handle: 2163 Address: DF:A9:FF:F6:B1:1A (OUI DF-A9-FF)
        Count: 1
        #174: len 21 (0 Kb/s)
        Latency: 173 msec (70-173 msec ~167 msec)
> ACL Data RX: Handle 2163 flags 0x02 dlen 21             #176 [hci1] 10.038873
      SMP: Pairing Confirm (0x03) len 16
        Confim value: 96fb5f08d787a294c25f2d00442c3eab
< HCI Command: Host Number of Com.. (0x03|0x0035) plen 5  #177 [hci1] 10.045252
        Num handles: 1
        Handle: 2163 Address: DF:A9:FF:F6:B1:1A (OUI DF-A9-FF)
        Count: 1
< ACL Data TX: Handle 2163 flags 0x00 dlen 21             #178 [hci1] 10.045347
      SMP: Pairing Confirm (0x03) len 16
        Confim value: ae10a47ed0a059517af97893d963f0c3
> HCI Event: Number of Completed Packets (0x13) plen 5    #179 [hci1] 10.213530
        Num handles: 1
        Handle: 2163 Address: DF:A9:FF:F6:B1:1A (OUI DF-A9-FF)
        Count: 1
        #178: len 21 (1 Kb/s)
        Latency: 168 msec (70-173 msec ~167 msec)
> ACL Data RX: Handle 2163 flags 0x02 dlen 21             #180 [hci1] 10.213901
      SMP: Pairing Random (0x04) len 16
        Random value: a9fc898774f5aa33be1b65555291febe
< HCI Command: Host Number of Com.. (0x03|0x0035) plen 5  #181 [hci1] 10.225282
        Num handles: 1
        Handle: 2163 Address: DF:A9:FF:F6:B1:1A (OUI DF-A9-FF)
        Count: 1
< ACL Data TX: Handle 2163 flags 0x00 dlen 21             #182 [hci1] 10.225413
      SMP: Pairing Random (0x04) len 16
        Random value: 25a9493fd3ce4faf02be7293595bb7c6
> HCI Event: Number of Completed Packets (0x13) plen 5    #183 [hci1] 10.388503
        Num handles: 1
        Handle: 2163 Address: DF:A9:FF:F6:B1:1A (OUI DF-A9-FF)
        Count: 1
        #182: len 21 (1 Kb/s)
        Latency: 163 msec (70-173 msec ~165 msec)
> ACL Data RX: Handle 2163 flags 0x02 dlen 21             #184 [hci1] 10.388944
      SMP: Pairing Confirm (0x03) len 16
        Confim value: 3f47fdf17c72cdbd1b2985f22ed6d3be
< HCI Command: Host Number of Com.. (0x03|0x0035) plen 5  #185 [hci1] 10.405100
        Num handles: 1
        Handle: 2163 Address: DF:A9:FF:F6:B1:1A (OUI DF-A9-FF)
        Count: 1
< ACL Data TX: Handle 2163 flags 0x00 dlen 21             #186 [hci1] 10.405157
      SMP: Pairing Confirm (0x03) len 16
        Confim value: a40de011a5322c903255965ad53432aa
> HCI Event: Number of Completed Packets (0x13) plen 5    #187 [hci1] 10.563467
        Num handles: 1
        Handle: 2163 Address: DF:A9:FF:F6:B1:1A (OUI DF-A9-FF)
        Count: 1
        #186: len 21 (1 Kb/s)
        Latency: 158 msec (70-173 msec ~161 msec)
> ACL Data RX: Handle 2163 flags 0x02 dlen 21             #188 [hci1] 10.563926
      SMP: Pairing Random (0x04) len 16
        Random value: 2ac0dcac36e1be60d694838982c18444
< HCI Command: Host Number of Com.. (0x03|0x0035) plen 5  #189 [hci1] 10.565267
        Num handles: 1
        Handle: 2163 Address: DF:A9:FF:F6:B1:1A (OUI DF-A9-FF)
        Count: 1
< ACL Data TX: Handle 2163 flags 0x00 dlen 21             #190 [hci1] 10.565396
      SMP: Pairing Random (0x04) len 16
        Random value: 58f6b41f855a6f6c3560debd84e2affc
> HCI Event: Number of Completed Packets (0x13) plen 5    #191 [hci1] 10.738505
        Num handles: 1
        Handle: 2163 Address: DF:A9:FF:F6:B1:1A (OUI DF-A9-FF)
        Count: 1
        #190: len 21 (0 Kb/s)
        Latency: 173 msec (70-173 msec ~167 msec)
> ACL Data RX: Handle 2163 flags 0x02 dlen 21             #192 [hci1] 10.739005
      SMP: Pairing Confirm (0x03) len 16
        Confim value: 617a12c1e3afc2b1ff8bbb39d1cff1f9
< HCI Command: Host Number of Com.. (0x03|0x0035) plen 5  #193 [hci1] 10.745128
        Num handles: 1
        Handle: 2163 Address: DF:A9:FF:F6:B1:1A (OUI DF-A9-FF)
        Count: 1
< ACL Data TX: Handle 2163 flags 0x00 dlen 21             #194 [hci1] 10.745202
      SMP: Pairing Confirm (0x03) len 16
        Confim value: 4064c6963353081cea97e327748675ec
> HCI Event: Number of Completed Packets (0x13) plen 5    #195 [hci1] 10.913644
        Num handles: 1
        Handle: 2163 Address: DF:A9:FF:F6:B1:1A (OUI DF-A9-FF)
        Count: 1
        #194: len 21 (1 Kb/s)
        Latency: 168 msec (70-173 msec ~167 msec)
> ACL Data RX: Handle 2163 flags 0x02 dlen 21             #196 [hci1] 10.913886
      SMP: Pairing Random (0x04) len 16
        Random value: dba3bf513de6b9f13d2235e6bec75c5d
< HCI Command: Host Number of Com.. (0x03|0x0035) plen 5  #197 [hci1] 10.925219
        Num handles: 1
        Handle: 2163 Address: DF:A9:FF:F6:B1:1A (OUI DF-A9-FF)
        Count: 1
< ACL Data TX: Handle 2163 flags 0x00 dlen 21             #198 [hci1] 10.925317
      SMP: Pairing Random (0x04) len 16
        Random value: b67e7216d5bf664139eda2b542549666
> HCI Event: Number of Completed Packets (0x13) plen 5    #199 [hci1] 11.088483
        Num handles: 1
        Handle: 2163 Address: DF:A9:FF:F6:B1:1A (OUI DF-A9-FF)
        Count: 1
        #198: len 21 (1 Kb/s)
        Latency: 163 msec (70-173 msec ~165 msec)
> ACL Data RX: Handle 2163 flags 0x02 dlen 21             #200 [hci1] 11.088909
      SMP: Pairing Confirm (0x03) len 16
        Confim value: ee7c7ad24fbc759d43ae44313704cbd4
< HCI Command: Host Number of Com.. (0x03|0x0035) plen 5  #201 [hci1] 11.105221
        Num handles: 1
        Handle: 2163 Address: DF:A9:FF:F6:B1:1A (OUI DF-A9-FF)
        Count: 1
< ACL Data TX: Handle 2163 flags 0x00 dlen 21             #202 [hci1] 11.105341
      SMP: Pairing Confirm (0x03) len 16
        Confim value: e5bac0c31709e625f382d965c511ca08
> HCI Event: Number of Completed Packets (0x13) plen 5    #203 [hci1] 11.263546
        Num handles: 1
        Handle: 2163 Address: DF:A9:FF:F6:B1:1A (OUI DF-A9-FF)
        Count: 1
        #202: len 21 (1 Kb/s)
        Latency: 158 msec (70-173 msec ~161 msec)
> ACL Data RX: Handle 2163 flags 0x02 dlen 21             #204 [hci1] 11.263888
      SMP: Pairing Random (0x04) len 16
        Random value: edeb1bd36abab63185ecc3aa48390138
< HCI Command: Host Number of Com.. (0x03|0x0035) plen 5  #205 [hci1] 11.265094
        Num handles: 1
        Handle: 2163 Address: DF:A9:FF:F6:B1:1A (OUI DF-A9-FF)
        Count: 1
< ACL Data TX: Handle 2163 flags 0x00 dlen 21             #206 [hci1] 11.265144
      SMP: Pairing Random (0x04) len 16
        Random value: ed17f76500c95219dd01e09d1e63f87b
> HCI Event: Number of Completed Packets (0x13) plen 5    #207 [hci1] 11.438518
        Num handles: 1
        Handle: 2163 Address: DF:A9:FF:F6:B1:1A (OUI DF-A9-FF)
        Count: 1
        #206: len 21 (0 Kb/s)
        Latency: 173 msec (70-173 msec ~167 msec)
> ACL Data RX: Handle 2163 flags 0x02 dlen 21             #208 [hci1] 11.438801
      SMP: Pairing Confirm (0x03) len 16
        Confim value: 8952e3e4d023f61ba370d372a74c8be2
< HCI Command: Host Number of Com.. (0x03|0x0035) plen 5  #209 [hci1] 11.445233
        Num handles: 1
        Handle: 2163 Address: DF:A9:FF:F6:B1:1A (OUI DF-A9-FF)
        Count: 1
< ACL Data TX: Handle 2163 flags 0x00 dlen 21             #210 [hci1] 11.445316
      SMP: Pairing Confirm (0x03) len 16
        Confim value: dd53cf1cd641836b6e89f99cfcdcc9e0
> HCI Event: Number of Completed Packets (0x13) plen 5    #211 [hci1] 11.613518
        Num handles: 1
        Handle: 2163 Address: DF:A9:FF:F6:B1:1A (OUI DF-A9-FF)
        Count: 1
        #210: len 21 (1 Kb/s)
        Latency: 168 msec (70-173 msec ~167 msec)
> ACL Data RX: Handle 2163 flags 0x02 dlen 21             #212 [hci1] 11.613943
      SMP: Pairing Random (0x04) len 16
        Random value: d01e19cedf500cae7d55b751a1eb2b41
< HCI Command: Host Number of Com.. (0x03|0x0035) plen 5  #213 [hci1] 11.625348
        Num handles: 1
        Handle: 2163 Address: DF:A9:FF:F6:B1:1A (OUI DF-A9-FF)
        Count: 1
< ACL Data TX: Handle 2163 flags 0x00 dlen 21             #214 [hci1] 11.625393
      SMP: Pairing Random (0x04) len 16
        Random value: 81d35d47e1f6006d79c974bd9d9e1ee3
> HCI Event: Number of Completed Packets (0x13) plen 5    #215 [hci1] 11.788612
        Num handles: 1
        Handle: 2163 Address: DF:A9:FF:F6:B1:1A (OUI DF-A9-FF)
        Count: 1
        #214: len 21 (1 Kb/s)
        Latency: 163 msec (70-173 msec ~165 msec)
> ACL Data RX: Handle 2163 flags 0x02 dlen 21             #216 [hci1] 11.788856
      SMP: Pairing Confirm (0x03) len 16
        Confim value: a8b6a02d4e26888682bef391aee5837e
< HCI Command: Host Number of Com.. (0x03|0x0035) plen 5  #217 [hci1] 11.804782
        Num handles: 1
        Handle: 2163 Address: DF:A9:FF:F6:B1:1A (OUI DF-A9-FF)
        Count: 1
< ACL Data TX: Handle 2163 flags 0x00 dlen 21             #218 [hci1] 11.804848
      SMP: Pairing Confirm (0x03) len 16
        Confim value: 9811e6850764efecc397e786f5f57f09
> HCI Event: Number of Completed Packets (0x13) plen 5    #219 [hci1] 11.963629
        Num handles: 1
        Handle: 2163 Address: DF:A9:FF:F6:B1:1A (OUI DF-A9-FF)
        Count: 1
        #218: len 21 (1 Kb/s)
        Latency: 158 msec (70-173 msec ~162 msec)
> ACL Data RX: Handle 2163 flags 0x02 dlen 21             #220 [hci1] 11.963885
      SMP: Pairing Random (0x04) len 16
        Random value: 36002221fcde54353802d9998af2d425
< HCI Command: Host Number of Com.. (0x03|0x0035) plen 5  #221 [hci1] 11.965269
        Num handles: 1
        Handle: 2163 Address: DF:A9:FF:F6:B1:1A (OUI DF-A9-FF)
        Count: 1
< ACL Data TX: Handle 2163 flags 0x00 dlen 21             #222 [hci1] 11.965349
      SMP: Pairing Random (0x04) len 16
        Random value: e7f7e0c2476823e41736a7e381bafb7c
> HCI Event: Number of Completed Packets (0x13) plen 5    #223 [hci1] 12.138536
        Num handles: 1
        Handle: 2163 Address: DF:A9:FF:F6:B1:1A (OUI DF-A9-FF)
        Count: 1
        #222: len 21 (0 Kb/s)
        Latency: 173 msec (70-173 msec ~167 msec)
> ACL Data RX: Handle 2163 flags 0x02 dlen 21             #224 [hci1] 12.138810
      SMP: Pairing Confirm (0x03) len 16
        Confim value: a1eaa78ac20db495c65bbe86089375b6
< HCI Command: Host Number of Com.. (0x03|0x0035) plen 5  #225 [hci1] 12.145200
        Num handles: 1
        Handle: 2163 Address: DF:A9:FF:F6:B1:1A (OUI DF-A9-FF)
        Count: 1
< ACL Data TX: Handle 2163 flags 0x00 dlen 21             #226 [hci1] 12.145315
      SMP: Pairing Confirm (0x03) len 16
        Confim value: fe9ea153ca082bdb400e9b37136bd37f
> HCI Event: Number of Completed Packets (0x13) plen 5    #227 [hci1] 12.313609
        Num handles: 1
        Handle: 2163 Address: DF:A9:FF:F6:B1:1A (OUI DF-A9-FF)
        Count: 1
        #226: len 21 (1 Kb/s)
        Latency: 168 msec (70-173 msec ~167 msec)
> ACL Data RX: Handle 2163 flags 0x02 dlen 21             #228 [hci1] 12.313971
      SMP: Pairing Random (0x04) len 16
        Random value: 1096dfe863d969d305da337e04a433d2
< HCI Command: Host Number of Com.. (0x03|0x0035) plen 5  #229 [hci1] 12.325315
        Num handles: 1
        Handle: 2163 Address: DF:A9:FF:F6:B1:1A (OUI DF-A9-FF)
        Count: 1
< ACL Data TX: Handle 2163 flags 0x00 dlen 21             #230 [hci1] 12.325461
      SMP: Pairing Random (0x04) len 16
        Random value: fc8b40d9b0b09bc4296bf8753a8f6e1f
> HCI Event: Number of Completed Packets (0x13) plen 5    #231 [hci1] 12.488529
        Num handles: 1
        Handle: 2163 Address: DF:A9:FF:F6:B1:1A (OUI DF-A9-FF)
        Count: 1
        #230: len 21 (1 Kb/s)
        Latency: 163 msec (70-173 msec ~165 msec)
> ACL Data RX: Handle 2163 flags 0x02 dlen 21             #232 [hci1] 12.488808
      SMP: Pairing DHKey Check (0x0d) len 16
        E: 68871e858d802a380a2f2ee4439b7c0b
< HCI Command: Host Number of Com.. (0x03|0x0035) plen 5  #233 [hci1] 12.505734
        Num handles: 1
        Handle: 2163 Address: DF:A9:FF:F6:B1:1A (OUI DF-A9-FF)
        Count: 1
< ACL Data TX: Handle 2163 flags 0x00 dlen 21             #234 [hci1] 12.505900
      SMP: Pairing DHKey Check (0x0d) len 16
        E: 6fc38088bb9f4fac04d8c91ff152b64c
> HCI Event: Number of Completed Packets (0x13) plen 5    #235 [hci1] 12.663348
        Num handles: 1
        Handle: 2163 Address: DF:A9:FF:F6:B1:1A (OUI DF-A9-FF)
        Count: 1
        #234: len 21 (1 Kb/s)
        Latency: 157 msec (70-173 msec ~161 msec)
> HCI Event: LE Meta Event (0x3e) plen 13                 #236 [hci1] 12.751405
      LE Long Term Key Request (0x05)
        Handle: 2163 Address: DF:A9:FF:F6:B1:1A (OUI DF-A9-FF)
        Random number: 0x0000000000000000
        Encrypted diversifier: 0x0000
< HCI Command: LE Long Term Key... (0x08|0x001a) plen 18  #237 [hci1] 12.764892
        Handle: 2163 Address: DF:A9:FF:F6:B1:1A (OUI DF-A9-FF)
        Long term key: d3e23e79ec6ed1979b4c3ed4cb202eec
> HCI Event: Command Complete (0x0e) plen 6               #238 [hci1] 12.765693
      LE Long Term Key Request Reply (0x08|0x001a) ncmd 1
        Status: Success (0x00)
        Handle: 2163 Address: DF:A9:FF:F6:B1:1A (OUI DF-A9-FF)
> HCI Event: Encryption Change (0x08) plen 4              #239 [hci1] 13.188551
        Status: Success (0x00)
        Handle: 2163 Address: DF:A9:FF:F6:B1:1A (OUI DF-A9-FF)
        Encryption: Enabled with AES-CCM (0x01)
> HCI Event: Disconnect Complete (0x05) plen 4            #240 [hci1] 16.338542
        Status: Success (0x00)
        Handle: 2163 Address: DF:A9:FF:F6:B1:1A (OUI DF-A9-FF)
        Reason: Remote User Terminated Connection (0x13)
< HCI Command: Reset (0x03|0x0003) plen 0                 #241 [hci1] 22.414909
> HCI Event: Command Complete (0x0e) plen 4               #242 [hci1] 22.415470
      Reset (0x03|0x0003) ncmd 1
        Status: Success (0x00)
@ USER Close: main                                    {0x0001} [hci1] 22.424560
= Close Index: 00:00:00:00:00:00                               [hci1] 22.424567
