Bluetooth monitor ver 5.84
btmon[3854437]: = Note: Linux version 6.8.0-83-generic (x86_64)                                                          0.116755
btmon[3854437]: = Note: Bluetooth subsystem version 2.22                                                                 0.116757
= New Index: 00:00:00:00:00:00 (Primary,UART,hci0)                                                                       0.116757
= Open Index: 00:00:00:00:00:00                                                                                          0.124356
= Index Info: 00:00:00:00:00:00 (Nordic Semiconductor ASA)                                                               0.124360
zephyr.exe[3854439]: @ USER Open: main (privileged) version 2.22                                                {0x0001} 0.124362
zephyr.exe[3854439]: < HCI Command: Reset (0x03|0x0003) plen 0                                                        #1 0.124630
> HCI Event: Command Complete (0x0e) plen 4                                                                           #2 0.125285
      Reset (0x03|0x0003) ncmd 1
        Status: Success (0x00)
zephyr.exe[3854439]: < HCI Command: Read Local Supported Features (0x04|0x0003) plen 0                                #3 0.143947
> HCI Event: Command Complete (0x0e) plen 12                                                                          #4 0.144554
      Read Local Supported Features (0x04|0x0003) ncmd 1
        Status: Success (0x00)
        Features: 0x00 0x00 0x00 0x00 0x60 0x00 0x00 0x00
          BR/EDR Not Supported
          LE Supported (Controller)
zephyr.exe[3854439]: < HCI Command: Read Local Version Information (0x04|0x0001) plen 0                               #5 0.163911
> HCI Event: Command Complete (0x0e) plen 12                                                                          #6 0.164450
      Read Local Version Information (0x04|0x0001) ncmd 1
        Status: Success (0x00)
        HCI version: Reserved (0x0e) - Revision 12520 (0x30e8)
        LMP version: Reserved (0x0e) - Subversion 12520 (0x30e8)
        Manufacturer: Nordic Semiconductor ASA (89)
zephyr.exe[3854439]: < HCI Command: Read Local Supported Commands (0x04|0x0002) plen 0                                #7 0.183940
> HCI Event: Command Complete (0x0e) plen 68                                                                          #8 0.185179
      Read Local Supported Commands (0x04|0x0002) ncmd 1
        Status: Success (0x00)
        Commands: 119 entries
          Disconnect (Octet 0 - Bit 5)
          Read Remote Version Information (Octet 2 - Bit 7)
          Set Event Mask (Octet 5 - Bit 6)
          Reset (Octet 5 - Bit 7)
          Read Connection Accept Timeout (Octet 7 - Bit 2)
          Write Connection Accept Timeout (Octet 7 - Bit 3)
          Read Transmit Power Level (Octet 10 - Bit 2)
          Set Controller To Host Flow Control (Octet 10 - Bit 5)
          Host Buffer Size (Octet 10 - Bit 6)
          Host Number of Completed Packets (Octet 10 - Bit 7)
          Read Local Version Information (Octet 14 - Bit 3)
          Read Local Supported Features (Octet 14 - Bit 5)
          Read BD ADDR (Octet 15 - Bit 1)
          Read RSSI (Octet 15 - Bit 5)
          Set Event Mask Page 2 (Octet 22 - Bit 2)
          LE Set Event Mask (Octet 25 - Bit 0)
          LE Read Buffer Size (Octet 25 - Bit 1)
          LE Read Local Supported Features (Octet 25 - Bit 2)
          LE Set Random Address (Octet 25 - Bit 4)
          LE Set Advertising Parameters (Octet 25 - Bit 5)
          LE Read Advertising Channel TX Power (Octet 25 - Bit 6)
          LE Set Advertising Data (Octet 25 - Bit 7)
          LE Set Scan Response Data (Octet 26 - Bit 0)
          LE Set Advertise Enable (Octet 26 - Bit 1)
          LE Set Scan Parameters (Octet 26 - Bit 2)
          LE Set Scan Enable (Octet 26 - Bit 3)
          LE Create Connection (Octet 26 - Bit 4)
          LE Create Connection Cancel (Octet 26 - Bit 5)
          LE Read Accept List Size (Octet 26 - Bit 6)
          LE Clear Accept List (Octet 26 - Bit 7)
          LE Add Device To Accept List (Octet 27 - Bit 0)
          LE Remove Device From Accept List (Octet 27 - Bit 1)
          LE Connection Update (Octet 27 - Bit 2)
          LE Set Host Channel Classification (Octet 27 - Bit 3)
          LE Read Channel Map (Octet 27 - Bit 4)
          LE Read Remote Used Features (Octet 27 - Bit 5)
          LE Encrypt (Octet 27 - Bit 6)
          LE Rand (Octet 27 - Bit 7)
          LE Start Encryption (Octet 28 - Bit 0)
          LE Long Term Key Request Reply (Octet 28 - Bit 1)
          LE Long Term Key Request Neg Reply (Octet 28 - Bit 2)
          LE Read Supported States (Octet 28 - Bit 3)
          LE Receiver Test (Octet 28 - Bit 4)
          LE Transmitter Test (Octet 28 - Bit 5)
          LE Test End (Octet 28 - Bit 6)
          Read Authenticated Payload Timeout (Octet 32 - Bit 4)
          Write Authenticated Payload Timeout (Octet 32 - Bit 5)
          LE Set Data Length (Octet 33 - Bit 6)
          LE Read Suggested Default Data Length (Octet 33 - Bit 7)
          LE Write Suggested Default Data Length (Octet 34 - Bit 0)
          LE Add Device To Resolving List (Octet 34 - Bit 3)
          LE Remove Device From Resolving List (Octet 34 - Bit 4)
          LE Clear Resolving List (Octet 34 - Bit 5)
          LE Read Resolving List Size (Octet 34 - Bit 6)
          LE Set Address Resolution Enable (Octet 35 - Bit 1)
          LE Set Resolvable Private Address Timeout (Octet 35 - Bit 2)
          LE Read Maximum Data Length (Octet 35 - Bit 3)
          LE Read PHY (Octet 35 - Bit 4)
          LE Set Default PHY (Octet 35 - Bit 5)
          LE Set PHY (Octet 35 - Bit 6)
          LE Enhanced Receiver Test (Octet 35 - Bit 7)
          LE Enhanced Transmitter Test (Octet 36 - Bit 0)
          LE Set Advertising Set Random Address (Octet 36 - Bit 1)
          LE Set Extended Advertising Parameters (Octet 36 - Bit 2)
          LE Set Extended Advertising Data (Octet 36 - Bit 3)
          LE Set Extended Scan Response Data (Octet 36 - Bit 4)
          LE Set Extended Advertising Enable (Octet 36 - Bit 5)
          LE Read Maximum Advertising Data Length (Octet 36 - Bit 6)
          LE Read Number of Supported Advertising Sets (Octet 36 - Bit 7)
          LE Remove Advertising Set (Octet 37 - Bit 0)
          LE Clear Advertising Sets (Octet 37 - Bit 1)
          LE Set Periodic Advertising Parameters (Octet 37 - Bit 2)
          LE Set Periodic Advertising Data (Octet 37 - Bit 3)
          LE Set Periodic Advertising Enable (Octet 37 - Bit 4)
          LE Set Extended Scan Parameters (Octet 37 - Bit 5)
          LE Set Extended Scan Enable (Octet 37 - Bit 6)
          LE Extended Create Connection (Octet 37 - Bit 7)
          LE Periodic Advertising Create Sync (Octet 38 - Bit 0)
          LE Periodic Advertising Create Sync Cancel (Octet 38 - Bit 1)
          LE Periodic Advertising Terminate Sync (Octet 38 - Bit 2)
          LE Add Device To Periodic Advertiser List (Octet 38 - Bit 3)
          LE Remove Device From Periodic Advertiser List (Octet 38 - Bit 4)
          LE Clear Periodic Advertiser List (Octet 38 - Bit 5)
          LE Read Periodic Advertiser List Size (Octet 38 - Bit 6)
          LE Read Transmit Power (Octet 38 - Bit 7)
          LE Read RF Path Compensation (Octet 39 - Bit 0)
          LE Write RF Path Compensation (Octet 39 - Bit 1)
          LE Set Privacy Mode (Octet 39 - Bit 2)
          LE Periodic Advertising Receive Enable (Octet 40 - Bit 5)
          LE Periodic Advertising Sync Transfer (Octet 40 - Bit 6)
          LE Periodic Advertising Set Info Transfer (Octet 40 - Bit 7)
          LE Periodic Advertising Sync Transfer Parameters (Octet 41 - Bit 0)
          LE Set Default Periodic Advertisng Sync Transfer Parameters (Octet 41 - Bit 1)
          LE Read Buffer v2 (Octet 41 - Bit 5)
          LE Read ISO TX Sync (Octet 41 - Bit 6)
          LE Set Connected Isochronous Group Parameters (Octet 41 - Bit 7)
          LE Set Connected Isochronous Group Parameters Test (Octet 42 - Bit 0)
          LE Create Connected Isochronous Stream (Octet 42 - Bit 1)
          LE Remove Connected Isochronous Group (Octet 42 - Bit 2)
          LE Accept Connected Isochronous Stream Request (Octet 42 - Bit 3)
          LE Reject Connected Isochronous Stream Request (Octet 42 - Bit 4)
          LE Create Broadcast Isochronous Group (Octet 42 - Bit 5)
          LE Create Broadcast Isochronous Group Test (Octet 42 - Bit 6)
          LE Terminate Broadcast Isochronous Group (Octet 42 - Bit 7)
          LE Broadcast Isochronous Group Create Sync (Octet 43 - Bit 0)
          LE Broadcast Isochronous Group Terminate Sync (Octet 43 - Bit 1)
          LE Request Peer SCA (Octet 43 - Bit 2)
          LE Setup Isochronous Data Path (Octet 43 - Bit 3)
          LE Remove Isochronous Data Path (Octet 43 - Bit 4)
          LE Isochronous Transmit Test (Octet 43 - Bit 5)
          LE Isochronous Receive Test (Octet 43 - Bit 6)
          LE Isochronous Read Test Counters (Octet 43 - Bit 7)
          LE Isochronous Read Test Counters (Octet 44 - Bit 0)
          LE Set Host Feature (Octet 44 - Bit 1)
          LE Read ISO link quality (Octet 44 - Bit 2)
          Octet 45 - Bit 6 
          Octet 46 - Bit 0 
          Octet 46 - Bit 1 
          Octet 46 - Bit 2 
zephyr.exe[3854439]: < HCI Command: Host Buffer Size (0x03|0x0033) plen 7                                             #9 0.203926
        ACL MTU: 255  ACL max packet: 16
        SCO MTU: 0    SCO max packet: 0
> HCI Event: Command Complete (0x0e) plen 4                                                                          #10 0.205062
      Host Buffer Size (0x03|0x0033) ncmd 1
        Status: Success (0x00)
zephyr.exe[3854439]: < HCI Command: Set Controller To Host Flow Control (0x03|0x0031) plen 1                         #11 0.223942
        Flow control: ACL Data Packets (0x01)
> HCI Event: Command Complete (0x0e) plen 4                                                                          #12 0.224711
      Set Controller To Host Flow Control (0x03|0x0031) ncmd 1
        Status: Success (0x00)
zephyr.exe[3854439]: < HCI Command: LE Read Local Supported Features (0x08|0x0003) plen 0                            #13 0.243939
> HCI Event: Command Complete (0x0e) plen 12                                                                         #14 0.244497
      LE Read Local Supported Features (0x08|0x0003) ncmd 1
        Status: Success (0x00)
        Features: 0xfd 0x79 0x00 0xf7 0x30 0x01 0x00 0x00
          LE Encryption
          Extended Reject Indication
          Peripheral-initiated Features Exchange
          LE Ping
          LE Data Packet Length Extension
          LL Privacy
          Extended Scanner Filter Policies
          LE 2M PHY
          LE Coded PHY
          LE Extended Advertising
          LE Periodic Advertising
          Channel Selection Algorithm #2
          Periodic Advertising Sync Transfer - Sender
          Periodic Advertising Sync Transfer - Recipient
          Sleep Clock Accuracy Updates
          Connected Isochronous Stream - Central
          Connected Isochronous Stream - Peripheral
          Isochronous Broadcaster
          Synchronized Receiver
          Periodic Advertising ADI support
          Connection Subrating
          Unknown features (0x0000010000000000)
zephyr.exe[3854439]: < HCI Command: LE Set Host Feature (0x08|0x0074) plen 2                                         #15 0.263942
        Bit Number: 32
          Connected Isochronous Stream (Host Support)
        Bit Value: 1
> HCI Event: Command Complete (0x0e) plen 4                                                                          #16 0.264885
      LE Set Host Feature (0x08|0x0074) ncmd 1
        Status: Success (0x00)
zephyr.exe[3854439]: < HCI Command: LE Read Buffer v2 (0x08|0x0060) plen 0                                           #17 0.283956
> HCI Event: Command Complete (0x0e) plen 10                                                                         #18 0.285434
      LE Read Buffer v2 (0x08|0x0060) ncmd 1
        Status: Success (0x00)
        ACL MTU: 27
        ACL max packet: 3
        ISO MTU: 318
        ISO max packet: 3
zephyr.exe[3854439]: < HCI Command: LE Read Maximum Advertising Data Length (0x08|0x003a) plen 0                     #19 0.303948
> HCI Event: Command Complete (0x0e) plen 6                                                                          #20 0.304692
      LE Read Maximum Advertising Data Length (0x08|0x003a) ncmd 1
        Status: Success (0x00)
        Max length: 1650
zephyr.exe[3854439]: < HCI Command: LE Read Supported States (0x08|0x001c) plen 0                                    #21 0.323918
> HCI Event: Command Complete (0x0e) plen 12                                                                         #22 0.324530
      LE Read Supported States (0x08|0x001c) ncmd 1
        Status: Success (0x00)
        States: 0x000003ff3e0306ff
          Non-connectable Advertising State
          Scannable Advertising State
          Connectable Advertising State
          High Duty Cycle Directed Advertising State
          Passive Scanning State
          Active Scanning State
          Initiating State
            and Connection State (Central Role)
          Connection State (Peripheral Role)
          Scannable Advertising State
            and Passive Scanning State
          Connectable Advertising State
            and Passive Scanning State
          Non-connectable Advertising State
            and Initiating State
          Scannable Advertising State
            and Initiating State
          Active Scanning State
            and Connection State (Central Role)
          Passive Scanning State
            and Connection State (Peripheral Role)
          Active Scanning State
            and Connection State (Peripheral Role)
          Initiating State
            and Connection State (Central Role)
            and Central Role & Central Role
          Low Duty Cycle Directed Advertising State
          Connectable Advertising State
            and Initiating State
            and Central Role & Peripheral Role
          High Duty Cycle Directed Advertising State
            and Initiating State
            and Central Role & Peripheral Role
          Low Duty Cycle Directed Advertising State
            and Initiating State
            and Central Role & Peripheral Role
          Connectable Advertising State
            and Connection State (Central Role)
            and Central Role & Peripheral Role
          High Duty Cycle Directed Advertising State
            and Connection State (Central Role)
            and Central Role & Peripheral Role
          Low Duty Cycle Directed Advertising State
            and Connection State (Central Role)
            and Central Role & Peripheral Role
          Connectable Advertising State
            and Connection State (Peripheral Role)
            and Central Role & Peripheral Role
          High Duty Cycle Directed Advertising State
            and Connection State (Peripheral Role)
            and Peripheral Role & Peripheral Role
          Low Duty Cycle Directed Advertising State
            and Connection State (Peripheral Role)
            and Peripheral Role & Peripheral Role
          Initiating State
            and Connection State (Peripheral Role)
            and Central Role & Peripheral Role
zephyr.exe[3854439]: < HCI Command: LE Read Maximum Data Length (0x08|0x002f) plen 0                                 #23 0.343938
> HCI Event: Command Complete (0x0e) plen 12                                                                         #24 0.344899
      LE Read Maximum Data Length (0x08|0x002f) ncmd 1
        Status: Success (0x00)
        Max TX octets: 251
        Max TX time: 2704
        Max RX octets: 251
        Max RX time: 2704
zephyr.exe[3854439]: < HCI Command: LE Write Suggested Default Data Length (0x08|0x0024) plen 4                      #25 0.363944
        TX octets: 251
        TX time: 2704
> HCI Event: Command Complete (0x0e) plen 4                                                                          #26 0.364578
      LE Write Suggested Default Data Length (0x08|0x0024) ncmd 1
        Status: Success (0x00)
zephyr.exe[3854439]: < HCI Command: LE Read Resolving List Size (0x08|0x002a) plen 0                                 #27 0.383931
> HCI Event: Command Complete (0x0e) plen 5                                                                          #28 0.384461
      LE Read Resolving List Size (0x08|0x002a) ncmd 1
        Status: Success (0x00)
        Size: 8
zephyr.exe[3854439]: < HCI Command: LE Set Event Mask (0x08|0x0001) plen 8                                           #29 0.403927
        Mask: 0x000002023f87fa5e
          LE Advertising Report
          LE Connection Update Complete
          LE Read Remote Used Features Complete
          LE Long Term Key Request
          LE Data Length Change
          LE Enhanced Connection Complete
          LE PHY Update Complete
          LE Extended Advertising Report
          LE Periodic Advertising Sync Established
          LE Periodic Advertising Report
          LE Periodic Advertising Sync Lost
          LE Extended Scan Timeout
          LE Extended Advertising Set Terminated
          LE Scan Request Received
          LE Periodic Advertising Sync Transfer Rvc
          LE CIS Established
          LE CIS Request
          LE Create BIG Complete
          LE Terminate BIG Complete
          LE BIG Sync Established Complete
          LE BIG Sync Lost
          LE BIG Info Advertising Report
          Unknown mask (0x0000020000000000)
> HCI Event: Command Complete (0x0e) plen 4                                                                          #30 0.405010
      LE Set Event Mask (0x08|0x0001) ncmd 1
        Status: Success (0x00)
zephyr.exe[3854439]: < HCI Command: Set Event Mask (0x03|0x0001) plen 8                                              #31 0.423939
        Mask: 0x2000800002008890
          Disconnection Complete
          Encryption Change
          Read Remote Version Information Complete
          Hardware Error
          Data Buffer Overflow
          Encryption Key Refresh Complete
          LE Meta
> HCI Event: Command Complete (0x0e) plen 4                                                                          #32 0.424640
      Set Event Mask (0x03|0x0001) ncmd 1
        Status: Success (0x00)
zephyr.exe[3854439]: < HCI Command: Read BD ADDR (0x04|0x0009) plen 0                                                #33 0.443917
> HCI Event: Command Complete (0x0e) plen 10                                                                         #34 0.444902
      Read BD ADDR (0x04|0x0009) ncmd 1
        Status: Success (0x00)
        Address: 00:00:00:00:00:00 (OUI 00-00-00)
zephyr.exe[3854439]: < HCI Command: LE Set Random Address (0x08|0x0005) plen 6                                       #35 0.463921
        Address: D5:B6:CC:31:DB:3B (Static)
> HCI Event: Command Complete (0x0e) plen 4                                                                          #36 0.464548
      LE Set Random Address (0x08|0x0005) ncmd 1
        Status: Success (0x00)
zephyr.exe[3854439]: < HCI Command: LE Extended Create Connection (0x08|0x0043) plen 26                              #37 5.484006
        Filter policy: Accept list is not used (0x00)
        Own address type: Random (0x01)
        Peer address type: Public (0x00)
        Peer address: DF:A9:FF:F6:B1:1A (OUI DF-A9-FF)
        Initiating PHYs: 0x01
        Entry 0: LE 1M
          Scan interval: 60.000 msec (0x0060)
          Scan window: 60.000 msec (0x0060)
          Min connection interval: 30.00 msec (0x0018)
          Max connection interval: 50.00 msec (0x0028)
          Connection latency: 0 (0x0000)
          Supervision timeout: 4000 msec (0x0190)
          Min connection length: 0.000 msec (0x0000)
          Max connection length: 0.000 msec (0x0000)
> HCI Event: Command Status (0x0f) plen 4                                                                            #38 5.485331
      LE Extended Create Connection (0x08|0x0043) ncmd 1
        Status: Success (0x00)
> HCI Event: LE Meta Event (0x3e) plen 31                                                                            #39 5.584292
      LE Enhanced Connection Complete (0x0a)
        Status: Success (0x00)
        Handle: 252
        Role: Central (0x00)
        Peer address type: Public (0x00)
        Peer address: DF:A9:FF:F6:B1:1A (OUI DF-A9-FF)
        Local resolvable private address: 00:00:00:00:00:00 (Non-Resolvable)
        Peer resolvable private address: 00:00:00:00:00:00 (Non-Resolvable)
        Connection interval: 50.00 msec (0x0028)
        Connection latency: 0 (0x0000)
        Supervision timeout: 4000 msec (0x0190)
        Central clock accuracy: 0x00
zephyr.exe[3854439]: < HCI Command: LE Read Remote Used Features (0x08|0x0016) plen 2                                #40 5.604200
        Handle: 252 Address: DF:A9:FF:F6:B1:1A (OUI DF-A9-FF)
> HCI Event: Command Status (0x0f) plen 4                                                                            #41 5.604845
      LE Read Remote Used Features (0x08|0x0016) ncmd 1
        Status: Success (0x00)
zephyr.exe[3854439]: < HCI Command: LE Set PHY (0x08|0x0032) plen 7                                                  #42 5.623960
        Handle: 252 Address: DF:A9:FF:F6:B1:1A (OUI DF-A9-FF)
        All PHYs preference: 0x00
        TX PHYs preference: 0x02
          LE 2M
        RX PHYs preference: 0x02
          LE 2M
        PHY options preference: Reserved (0x0000)
> HCI Event: Command Status (0x0f) plen 4                                                                            #43 5.624613
      LE Set PHY (0x08|0x0032) ncmd 1
        Status: Success (0x00)
> HCI Event: LE Meta Event (0x3e) plen 12                                                                            #44 5.735831
      LE Read Remote Used Features (0x04)
        Status: Success (0x00)
        Handle: 252 Address: DF:A9:FF:F6:B1:1A (OUI DF-A9-FF)
        Features: 0x2d 0x49 0x00 0xf7 0x67 0xd8 0x00 0x00
          LE Encryption
          Extended Reject Indication
          Peripheral-initiated Features Exchange
          LE Data Packet Length Extension
          LE 2M PHY
          LE Coded PHY
          Channel Selection Algorithm #2
          Periodic Advertising Sync Transfer - Sender
          Periodic Advertising Sync Transfer - Recipient
          Sleep Clock Accuracy Updates
          Connected Isochronous Stream - Central
          Connected Isochronous Stream - Peripheral
          Isochronous Broadcaster
          Synchronized Receiver
          Connected Isochronous Stream (Host Support)
          LE Power Control Request
          LE Power Control Request
          Connection Subrating
          Connection Subrating (Host Support)
          Unknown features (0x0000d80000000000)
> HCI Event: LE Meta Event (0x3e) plen 6                                                                             #45 6.234983
      LE PHY Update Complete (0x0c)
        Status: Success (0x00)
        Handle: 252 Address: DF:A9:FF:F6:B1:1A (OUI DF-A9-FF)
        TX PHY: LE 2M (0x02)
        RX PHY: LE 2M (0x02)
zephyr.exe[3854439]: < ACL Data TX: Handle 252 [1/3] flags 0x00 dlen 11                                              #46 6.524040
      SMP: Pairing Request (0x01) len 6
        IO capability: NoInputNoOutput (0x03)
        OOB data: Authentication data not present (0x00)
        Authentication requirement: Bonding, No MITM, SC, No Keypresses (0x09)
        Max encryption key size: 16
        Initiator key distribution: EncKey Sign (0x05)
        Responder key distribution: EncKey IdKey Sign (0x07)
> HCI Event: Number of Completed Packets (0x13) plen 5                                                               #47 6.535392
        Num handles: 1
        Handle: 252 Address: DF:A9:FF:F6:B1:1A (OUI DF-A9-FF)
        Count: 1
        Buffers: 0/3
        #46: len 11 (8 Kb/s)
        Latency: 11 msec (11-11 msec ~11 msec)
> ACL Data RX: Handle 252 flags 0x02 dlen 11                                                                         #48 6.585928
      SMP: Pairing Response (0x02) len 6
        IO capability: KeyboardDisplay (0x04)
        OOB data: Authentication data not present (0x00)
        Authentication requirement: Bonding, No MITM, SC, No Keypresses (0x09)
        Max encryption key size: 16
        Initiator key distribution: EncKey Sign (0x05)
        Responder key distribution: EncKey IdKey Sign (0x07)
zephyr.exe[3854439]: < HCI Command: Host Number of Completed Packets (0x03|0x0035) plen 5                            #49 6.604026
        Num handles: 1
        Handle: 252 Address: DF:A9:FF:F6:B1:1A (OUI DF-A9-FF)
        Count: 1
zephyr.exe[3854439]: < ACL Data TX: Handle 252 [1/3] flags 0x00 dlen 27                                              #50 6.604045
zephyr.exe[3854439]: < ACL Data TX: Handle 252 flags 0x01 dlen 27                                                    #51 6.604049
zephyr.exe[3854439]: < ACL Data TX: Handle 252 flags 0x01 dlen 15                                                    #52 6.604054
      SMP: Pairing Public Key (0x0c) len 64
        X[32]: 98308440221e2d910f0e54b71e7ec652857aa9b5a0dc65028824cc19db1226e9
        Y[32]: 67a4816bcb62efb21701e31fdb27561a6217575fb007a8bbdabe7e28b6f68482
> HCI Event: Number of Completed Packets (0x13) plen 5                                                               #53 6.635626
        Num handles: 1
        Handle: 252 Address: DF:A9:FF:F6:B1:1A (OUI DF-A9-FF)
        Count: 1
        Buffers: 0/3
        #50: len 27 (6 Kb/s)
        Latency: 31 msec (11-31 msec ~21 msec)
> HCI Event: Number of Completed Packets (0x13) plen 5                                                               #54 6.635921
        Num handles: 1
        Handle: 252 Address: DF:A9:FF:F6:B1:1A (OUI DF-A9-FF)
        Count: 1
        Buffers: underflow/3
        #51: len 27 (6 Kb/s)
        Latency: 31 msec (11-31 msec ~26 msec)
> HCI Event: Number of Completed Packets (0x13) plen 5                                                               #55 6.636350
        Num handles: 1
        Handle: 252 Address: DF:A9:FF:F6:B1:1A (OUI DF-A9-FF)
        Count: 1
        Buffers: underflow/3
        #52: len 15 (3 Kb/s)
        Latency: 32 msec (11-32 msec ~29 msec)
> ACL Data RX: Handle 252 flags 0x02 dlen 27                                                                         #56 6.686261
> ACL Data RX: Handle 252 flags 0x01 dlen 27                                                                         #57 6.686334
> ACL Data RX: Handle 252 flags 0x01 dlen 15                                                                         #58 6.686648
      SMP: Pairing Public Key (0x0c) len 64
        X[32]: 27c1e466c4c864487a3d27a767799bd22c21cf1395fee61c38834b1a78f44d96
        Y[32]: 5105689e8ebbcdbaf0507495b8df4d2ea7719efc9fd4704f725f2a0a928487a7
zephyr.exe[3854439]: < HCI Command: Host Number of Completed Packets (0x03|0x0035) plen 5                            #59 6.703971
        Num handles: 1
        Handle: 252 Address: DF:A9:FF:F6:B1:1A (OUI DF-A9-FF)
        Count: 1
zephyr.exe[3854439]: < HCI Command: Host Number of Completed Packets (0x03|0x0035) plen 5                            #60 6.703992
        Num handles: 1
        Handle: 252 Address: DF:A9:FF:F6:B1:1A (OUI DF-A9-FF)
        Count: 1
zephyr.exe[3854439]: < HCI Command: Host Number of Completed Packets (0x03|0x0035) plen 5                            #61 6.704008
        Num handles: 1
        Handle: 252 Address: DF:A9:FF:F6:B1:1A (OUI DF-A9-FF)
        Count: 1
> ACL Data RX: Handle 252 flags 0x02 dlen 21                                                                         #62 6.735946
      SMP: Pairing Confirm (0x03) len 16
        Confirm value[16]: ed2abb72b5e5ad7c3b24c85685190f09
zephyr.exe[3854439]: < HCI Command: Host Number of Completed Packets (0x03|0x0035) plen 5                            #63 6.744089
        Num handles: 1
        Handle: 252 Address: DF:A9:FF:F6:B1:1A (OUI DF-A9-FF)
        Count: 1
zephyr.exe[3854439]: < ACL Data TX: Handle 252 [1/3] flags 0x00 dlen 21                                              #64 6.744094
      SMP: Pairing Random (0x04) len 16
        Random value[16]: 8e6108f966a694cbe26df70bb96773e6
> HCI Event: Number of Completed Packets (0x13) plen 5                                                               #65 6.785359
        Num handles: 1
        Handle: 252 Address: DF:A9:FF:F6:B1:1A (OUI DF-A9-FF)
        Count: 1
        Buffers: 0/3
        #64: len 21 (4 Kb/s)
        Latency: 41 msec (11-41 msec ~35 msec)
> ACL Data RX: Handle 252 flags 0x02 dlen 21                                                                         #66 6.835648
      SMP: Pairing Random (0x04) len 16
        Random value[16]: e3b19df013f6fc8a0000000000000000
zephyr.exe[3854439]: < HCI Command: Host Number of Completed Packets (0x03|0x0035) plen 5                            #67 6.844205
        Num handles: 1
        Handle: 252 Address: DF:A9:FF:F6:B1:1A (OUI DF-A9-FF)
        Count: 1
zephyr.exe[3854439]: < ACL Data TX: Handle 252 [1/3] flags 0x00 dlen 21                                              #68 6.844226
      SMP: Pairing DHKey Check (0x0d) len 16
        E[16]: 2cff78e7a2c41f3f9452f6eb72b3ee39
> HCI Event: Number of Completed Packets (0x13) plen 5                                                               #69 6.885268
        Num handles: 1
        Handle: 252 Address: DF:A9:FF:F6:B1:1A (OUI DF-A9-FF)
        Count: 1
        Buffers: 0/3
        #68: len 21 (4 Kb/s)
        Latency: 41 msec (11-41 msec ~38 msec)
> ACL Data RX: Handle 252 flags 0x02 dlen 21                                                                         #70 7.085790
      SMP: Pairing DHKey Check (0x0d) len 16
        E[16]: 19c85ec9483527b1ec1d80d99d8b4118
zephyr.exe[3854439]: < HCI Command: LE Start Encryption (0x08|0x0019) plen 28                                        #71 7.104296
        Handle: 252 Address: DF:A9:FF:F6:B1:1A (OUI DF-A9-FF)
        Random number: 0x0000000000000000
        Encrypted diversifier: 0x0000
        Long term key[16]: b79d4761333be3552087181c8282633c
> HCI Event: Command Status (0x0f) plen 4                                                                            #72 7.105431
      LE Start Encryption (0x08|0x0019) ncmd 1
        Status: Success (0x00)
zephyr.exe[3854439]: < HCI Command: Host Number of Completed Packets (0x03|0x0035) plen 5                            #73 7.124023
        Num handles: 1
        Handle: 252 Address: DF:A9:FF:F6:B1:1A (OUI DF-A9-FF)
        Count: 1
> HCI Event: Encryption Change (0x08) plen 4                                                                         #74 7.435228
        Status: Success (0x00)
        Handle: 252 Address: DF:A9:FF:F6:B1:1A (OUI DF-A9-FF)
        Encryption: Enabled with AES-CCM (0x01)
> ACL Data RX: Handle 252 flags 0x02 dlen 21                                                                         #75 7.485613
      SMP: Identity Information (0x08) len 16
        Identity resolving key[16]: 802e3422c835c2cff93544fc943de341
zephyr.exe[3854439]: < HCI Command: Host Number of Completed Packets (0x03|0x0035) plen 5                            #76 7.504151
        Num handles: 1
        Handle: 252 Address: DF:A9:FF:F6:B1:1A (OUI DF-A9-FF)
        Count: 1
> ACL Data RX: Handle 252 flags 0x02 dlen 12                                                                         #77 7.535519
      SMP: Identity Address Information (0x09) len 7
        Address: DF:A9:FF:F6:B1:1A (OUI DF-A9-FF)
> ACL Data RX: Handle 252 flags 0x02 dlen 21                                                                         #78 7.536011
      SMP: Signing Information (0x0a) len 16
        Signature key[16]: a2c288f1f5dc41f2b0b3e6cc0a33fcff
zephyr.exe[3854439]: < HCI Command: LE Add Device To Resolving List (0x08|0x0027) plen 39                            #79 7.544038
        Address type: Public (0x00)
        Address: DF:A9:FF:F6:B1:1A (OUI DF-A9-FF)
        Peer identity resolving key[16]: 802e3422c835c2cff93544fc943de341
        Local identity resolving key[16]: 00000000000000000000000000000000
> HCI Event: Command Complete (0x0e) plen 4                                                                          #80 7.545187
      LE Add Device To Resolving List (0x08|0x0027) ncmd 1
        Status: Success (0x00)
zephyr.exe[3854439]: < HCI Command: LE Set Privacy Mode (0x08|0x004e) plen 8                                         #81 7.564032
        Peer Identity address type: Public (0x00)
        Peer Identity address: DF:A9:FF:F6:B1:1A (OUI DF-A9-FF)
        Privacy Mode: Use Device Privacy (0x01)
> HCI Event: Command Complete (0x0e) plen 4                                                                          #82 7.565752
      LE Set Privacy Mode (0x08|0x004e) ncmd 1
        Status: Success (0x00)
zephyr.exe[3854439]: < HCI Command: LE Set Address Resolution Enable (0x08|0x002d) plen 1                            #83 7.583994
        Address resolution: Enabled (0x01)
> HCI Event: Command Complete (0x0e) plen 4                                                                          #84 7.584639
      LE Set Address Resolution Enable (0x08|0x002d) ncmd 1
        Status: Success (0x00)
zephyr.exe[3854439]: < HCI Command: Host Number of Completed Packets (0x03|0x0035) plen 5                            #85 7.604001
        Num handles: 1
        Handle: 252 Address: DF:A9:FF:F6:B1:1A (OUI DF-A9-FF)
        Count: 1
zephyr.exe[3854439]: < HCI Command: Host Number of Completed Packets (0x03|0x0035) plen 5                            #86 7.604043
        Num handles: 1
        Handle: 252 Address: DF:A9:FF:F6:B1:1A (OUI DF-A9-FF)
        Count: 1
zephyr.exe[3854439]: < ACL Data TX: Handle 252 [1/3] flags 0x00 dlen 21                                              #87 7.604094
      SMP: Signing Information (0x0a) len 16
        Signature key[16]: 5da095555cc64d02679f89a05211af56
> HCI Event: Number of Completed Packets (0x13) plen 5                                                               #88 7.635565
        Num handles: 1
        Handle: 252 Address: DF:A9:FF:F6:B1:1A (OUI DF-A9-FF)
        Count: 1
        Buffers: 0/3
        #87: len 21 (5 Kb/s)
        Latency: 31 msec (11-41 msec ~34 msec)
zephyr.exe[3854439]: < ACL Data TX: Handle 252 [1/3] flags 0x00 dlen 11                                             #89 10.544106
      ATT: Read By Type Request (0x08) len 6
        Handle range: 0x0001-0x000d
        Attribute type: Characteristic (0x2803)
> HCI Event: Number of Completed Packets (0x13) plen 5                                                              #90 10.585189
        Num handles: 1
        Handle: 252 Address: DF:A9:FF:F6:B1:1A (OUI DF-A9-FF)
        Count: 1
        Buffers: 0/3
        #89: len 11 (2 Kb/s)
        Latency: 41 msec (11-41 msec ~37 msec)
> ACL Data RX: Handle 252 flags 0x02 dlen 27                                                                        #91 10.635813
      ATT: Read By Type Response (0x09) len 22
        Attribute data length: 7
        Attribute data list: 3 entries
        Handle: 0x0002
        Value[5]: 0a0300002a
            Properties: 0x0a
              Read (0x02)
              Write (0x08)
            Value Handle: 0x0003
            Value UUID: Device Name (0x2a00)
        Handle: 0x0004
        Value[5]: 0a0500012a
            Properties: 0x0a
              Read (0x02)
              Write (0x08)
            Value Handle: 0x0005
            Value UUID: Appearance (0x2a01)
        Handle: 0x0006
        Value[5]: 4e07000945
            Properties: 0x4e
              Read (0x02)
              Write Without Response (0x04)
              Write (0x08)
              Authorize (0x40)
              Extended Properties (0x80)
            Value Handle: 0x0007
            Value UUID: Unknown (0x4509)
zephyr.exe[3854439]: < HCI Command: Host Number of Completed Packets (0x03|0x0035) plen 5                           #92 10.644099
        Num handles: 1
        Handle: 252 Address: DF:A9:FF:F6:B1:1A (OUI DF-A9-FF)
        Count: 1
zephyr.exe[3854439]: < ACL Data TX: Handle 252 [1/3] flags 0x00 dlen 11                                             #93 10.644112
      ATT: Read By Type Request (0x08) len 6
        Handle range: 0x0007-0x000d
        Attribute type: Characteristic (0x2803)
> HCI Event: Number of Completed Packets (0x13) plen 5                                                              #94 10.685194
        Num handles: 1
        Handle: 252 Address: DF:A9:FF:F6:B1:1A (OUI DF-A9-FF)
        Count: 1
        Buffers: 0/3
        #93: len 11 (2 Kb/s)
        Latency: 41 msec (11-41 msec ~39 msec)
> ACL Data RX: Handle 252 flags 0x02 dlen 20                                                                        #95 10.735671
      ATT: Read By Type Response (0x09) len 15
        Attribute data length: 7
        Attribute data list: 2 entries
        Handle: 0x0008
        Value[5]: 020900042a
            Properties: 0x02
              Read (0x02)
            Value Handle: 0x0009
            Value UUID: Peripheral Preferred Connection Parameters (0x2a04)
        Handle: 0x000a
        Value[5]: 320b00192a
            Properties: 0x32
              Read (0x02)
              Notify (0x10)
              Indicate (0x20)
            Value Handle: 0x000b
            Value UUID: Battery Level (0x2a19)
zephyr.exe[3854439]: < HCI Command: Host Number of Completed Packets (0x03|0x0035) plen 5                           #96 10.744071
        Num handles: 1
        Handle: 252 Address: DF:A9:FF:F6:B1:1A (OUI DF-A9-FF)
        Count: 1
zephyr.exe[3854439]: < ACL Data TX: Handle 252 [1/3] flags 0x00 dlen 11                                             #97 10.744128
      ATT: Read By Type Request (0x08) len 6
        Handle range: 0x000b-0x000d
        Attribute type: Characteristic (0x2803)
> HCI Event: Number of Completed Packets (0x13) plen 5                                                              #98 10.785162
        Num handles: 1
        Handle: 252 Address: DF:A9:FF:F6:B1:1A (OUI DF-A9-FF)
        Count: 1
        Buffers: 0/3
        #97: len 11 (2 Kb/s)
        Latency: 41 msec (11-41 msec ~40 msec)
> ACL Data RX: Handle 252 flags 0x02 dlen 9                                                                         #99 10.835348
      ATT: Error Response (0x01) len 4
        Read By Type Request (0x08)
        Handle: 0x000b
        Error: Attribute Not Found (0x0a)
zephyr.exe[3854439]: < HCI Command: Host Number of Completed Packets (0x03|0x0035) plen 5                          #100 10.844064
        Num handles: 1
        Handle: 252 Address: DF:A9:FF:F6:B1:1A (OUI DF-A9-FF)
        Count: 1
zephyr.exe[3854439]: < ACL Data TX: Handle 252 [1/3] flags 0x00 dlen 9                                             #101 10.844237
      ATT: Write Request (0x12) len 4
        Handle: 0x000d
          Data[2]: 0100
> HCI Event: Number of Completed Packets (0x13) plen 5                                                             #102 10.885189
        Num handles: 1
        Handle: 252 Address: DF:A9:FF:F6:B1:1A (OUI DF-A9-FF)
        Count: 1
        Buffers: 0/3
        #101: len 9 (1 Kb/s)
        Latency: 40 msec (11-41 msec ~40 msec)
> ACL Data RX: Handle 252 flags 0x02 dlen 5                                                                        #103 10.935298
      ATT: Write Response (0x13) len 0
zephyr.exe[3854439]: < HCI Command: Host Number of Completed Packets (0x03|0x0035) plen 5                          #104 10.944107
        Num handles: 1
        Handle: 252 Address: DF:A9:FF:F6:B1:1A (OUI DF-A9-FF)
        Count: 1
> HCI Event: Disconnect Complete (0x05) plen 4                                                                     #105 12.134830
        Status: Success (0x00)
        Handle: 252 Address: DF:A9:FF:F6:B1:1A (OUI DF-A9-FF)
        Reason: Remote User Terminated Connection (0x13)
zephyr.exe[3854439]: < HCI Command: LE Extended Create Connection (0x08|0x0043) plen 26                            #106 12.874218
        Filter policy: Accept list is not used (0x00)
        Own address type: Random (0x01)
        Peer address type: Public (0x00)
        Peer address: DF:A9:FF:F6:B1:1A (OUI DF-A9-FF)
        Initiating PHYs: 0x01
        Entry 0: LE 1M
          Scan interval: 60.000 msec (0x0060)
          Scan window: 60.000 msec (0x0060)
          Min connection interval: 30.00 msec (0x0018)
          Max connection interval: 50.00 msec (0x0028)
          Connection latency: 0 (0x0000)
          Superv