Bluetooth monitor ver 5.72
= Note: Linux version 6.14.0-36-generic (x86_64)                       0.416557
= Note: Bluetooth subsystem version 2.22                               0.416560
= New Index: 00:00:00:00:00:00 (Primary,UART,hci1)              [hci1] 0.416562
= New Index: 48:5F:99:8E:E0:64 (Primary,USB,hci0)               [hci0] 0.416563
= Open Index: 00:00:00:00:00:00                                 [hci1] 0.532133
= Index Info: 00:00:00:00:00:00 (Nordic Semiconductor ASA)      [hci1] 0.532138
@ USER Open: main (privileged) version 2.22            {0x0001} [hci1] 0.532140
< HCI Command: Reset (0x03|0x0003) plen 0                    #1 [hci1] 0.532483
> HCI Event: Command Complete (0x0e) plen 4                  #2 [hci1] 0.532926
      Reset (0x03|0x0003) ncmd 1
        Status: Success (0x00)
< HCI Command: Read Local Supported... (0x04|0x0003) plen 0  #3 [hci1] 0.552199
> HCI Event: Command Complete (0x0e) plen 12                 #4 [hci1] 0.552686
      Read Local Supported Features (0x04|0x0003) ncmd 1
        Status: Success (0x00)
        Features: 0x00 0x00 0x00 0x00 0x60 0x00 0x00 0x00
          BR/EDR Not Supported
          LE Supported (Controller)
< HCI Command: Read Local Version In.. (0x04|0x0001) plen 0  #5 [hci1] 0.572128
> HCI Event: Command Complete (0x0e) plen 12                 #6 [hci1] 0.572674
      Read Local Version Information (0x04|0x0001) ncmd 1
        Status: Success (0x00)
        HCI version: Reserved (0x0f) - Revision 12393 (0x3069)
        LMP version: Reserved (0x0f) - Subversion 12393 (0x3069)
        Manufacturer: Nordic Semiconductor ASA (89)
< HCI Command: Read Local Supported... (0x04|0x0002) plen 0  #7 [hci1] 0.592144
> HCI Event: Command Complete (0x0e) plen 68                 #8 [hci1] 0.593175
      Read Local Supported Commands (0x04|0x0002) ncmd 1
        Status: Success (0x00)
        Commands: 119 entries
          Disconnect (Octet 0 - Bit 5)
          Read Remote Version Information (Octet 2 - Bit 7)
          Set Event Mask (Octet 5 - Bit 6)
          Reset (Octet 5 - Bit 7)
          Read Connection Accept Timeout (Octet 7 - Bit 2)
          Write Connection Accept Timeout (Octet 7 - Bit 3)
          Read Transmit Power Level (Octet 10 - Bit 2)
          Set Controller To Host Flow Control (Octet 10 - Bit 5)
          Host Buffer Size (Octet 10 - Bit 6)
          Host Number of Completed Packets (Octet 10 - Bit 7)
          Read Local Version Information (Octet 14 - Bit 3)
          Read Local Supported Features (Octet 14 - Bit 5)
          Read BD ADDR (Octet 15 - Bit 1)
          Read RSSI (Octet 15 - Bit 5)
          Set Event Mask Page 2 (Octet 22 - Bit 2)
          LE Set Event Mask (Octet 25 - Bit 0)
          LE Read Buffer Size (Octet 25 - Bit 1)
          LE Read Local Supported Features (Octet 25 - Bit 2)
          LE Set Random Address (Octet 25 - Bit 4)
          LE Set Advertising Parameters (Octet 25 - Bit 5)
          LE Read Advertising Channel TX Power (Octet 25 - Bit 6)
          LE Set Advertising Data (Octet 25 - Bit 7)
          LE Set Scan Response Data (Octet 26 - Bit 0)
          LE Set Advertise Enable (Octet 26 - Bit 1)
          LE Set Scan Parameters (Octet 26 - Bit 2)
          LE Set Scan Enable (Octet 26 - Bit 3)
          LE Create Connection (Octet 26 - Bit 4)
          LE Create Connection Cancel (Octet 26 - Bit 5)
          LE Read Accept List Size (Octet 26 - Bit 6)
          LE Clear Accept List (Octet 26 - Bit 7)
          LE Add Device To Accept List (Octet 27 - Bit 0)
          LE Remove Device From Accept List (Octet 27 - Bit 1)
          LE Connection Update (Octet 27 - Bit 2)
          LE Set Host Channel Classification (Octet 27 - Bit 3)
          LE Read Channel Map (Octet 27 - Bit 4)
          LE Read Remote Used Features (Octet 27 - Bit 5)
          LE Encrypt (Octet 27 - Bit 6)
          LE Rand (Octet 27 - Bit 7)
          LE Start Encryption (Octet 28 - Bit 0)
          LE Long Term Key Request Reply (Octet 28 - Bit 1)
          LE Long Term Key Request Neg Reply (Octet 28 - Bit 2)
          LE Read Supported States (Octet 28 - Bit 3)
          LE Receiver Test (Octet 28 - Bit 4)
          LE Transmitter Test (Octet 28 - Bit 5)
          LE Test End (Octet 28 - Bit 6)
          Read Authenticated Payload Timeout (Octet 32 - Bit 4)
          Write Authenticated Payload Timeout (Octet 32 - Bit 5)
          LE Set Data Length (Octet 33 - Bit 6)
          LE Read Suggested Default Data Length (Octet 33 - Bit 7)
          LE Write Suggested Default Data Length (Octet 34 - Bit 0)
          LE Add Device To Resolving List (Octet 34 - Bit 3)
          LE Remove Device From Resolving List (Octet 34 - Bit 4)
          LE Clear Resolving List (Octet 34 - Bit 5)
          LE Read Resolving List Size (Octet 34 - Bit 6)
          LE Set Address Resolution Enable (Octet 35 - Bit 1)
          LE Set Resolvable Private Address Timeout (Octet 35 - Bit 2)
          LE Read Maximum Data Length (Octet 35 - Bit 3)
          LE Read PHY (Octet 35 - Bit 4)
          LE Set Default PHY (Octet 35 - Bit 5)
          LE Set PHY (Octet 35 - Bit 6)
          LE Enhanced Receiver Test (Octet 35 - Bit 7)
          LE Enhanced Transmitter Test (Octet 36 - Bit 0)
          LE Set Advertising Set Random Address (Octet 36 - Bit 1)
          LE Set Extended Advertising Parameters (Octet 36 - Bit 2)
          LE Set Extended Advertising Data (Octet 36 - Bit 3)
          LE Set Extended Scan Response Data (Octet 36 - Bit 4)
          LE Set Extended Advertising Enable (Octet 36 - Bit 5)
          LE Read Maximum Advertising Data Length (Octet 36 - Bit 6)
          LE Read Number of Supported Advertising Sets (Octet 36 - Bit 7)
          LE Remove Advertising Set (Octet 37 - Bit 0)
          LE Clear Advertising Sets (Octet 37 - Bit 1)
          LE Set Periodic Advertising Parameters (Octet 37 - Bit 2)
          LE Set Periodic Advertising Data (Octet 37 - Bit 3)
          LE Set Periodic Advertising Enable (Octet 37 - Bit 4)
          LE Set Extended Scan Parameters (Octet 37 - Bit 5)
          LE Set Extended Scan Enable (Octet 37 - Bit 6)
          LE Extended Create Connection (Octet 37 - Bit 7)
          LE Periodic Advertising Create Sync (Octet 38 - Bit 0)
          LE Periodic Advertising Create Sync Cancel (Octet 38 - Bit 1)
          LE Periodic Advertising Terminate Sync (Octet 38 - Bit 2)
          LE Add Device To Periodic Advertiser List (Octet 38 - Bit 3)
          LE Remove Device From Periodic Advertiser List (Octet 38 - Bit 4)
          LE Clear Periodic Advertiser List (Octet 38 - Bit 5)
          LE Read Periodic Advertiser List Size (Octet 38 - Bit 6)
          LE Read Transmit Power (Octet 38 - Bit 7)
          LE Read RF Path Compensation (Octet 39 - Bit 0)
          LE Write RF Path Compensation (Octet 39 - Bit 1)
          LE Set Privacy Mode (Octet 39 - Bit 2)
          LE Periodic Advertising Receive Enable (Octet 40 - Bit 5)
          LE Periodic Advertising Sync Transfer (Octet 40 - Bit 6)
          LE Periodic Advertising Set Info Transfer (Octet 40 - Bit 7)
          LE Periodic Advertising Sync Transfer Parameters (Octet 41 - Bit 0)
          LE Set Default Periodic Advertisng Sync Transfer Parameters (Octet 41 - Bit 1)
          LE Read Buffer v2 (Octet 41 - Bit 5)
          LE Read ISO TX Sync (Octet 41 - Bit 6)
          LE Set Connected Isochronous Group Parameters (Octet 41 - Bit 7)
          LE Set Connected Isochronous Group Parameters Test (Octet 42 - Bit 0)
          LE Create Connected Isochronous Stream (Octet 42 - Bit 1)
          LE Remove Connected Isochronous Group (Octet 42 - Bit 2)
          LE Accept Connected Isochronous Stream Request (Octet 42 - Bit 3)
          LE Reject Connected Isochronous Stream Request (Octet 42 - Bit 4)
          LE Create Broadcast Isochronous Group (Octet 42 - Bit 5)
          LE Create Broadcast Isochronous Group Test (Octet 42 - Bit 6)
          LE Terminate Broadcast Isochronous Group (Octet 42 - Bit 7)
          LE Broadcast Isochronous Group Create Sync (Octet 43 - Bit 0)
          LE Broadcast Isochronous Group Terminate Sync (Octet 43 - Bit 1)
          LE Request Peer SCA (Octet 43 - Bit 2)
          LE Setup Isochronous Data Path (Octet 43 - Bit 3)
          LE Remove Isochronous Data Path (Octet 43 - Bit 4)
          LE Isochronous Transmit Test (Octet 43 - Bit 5)
          LE Isochronous Receive Test (Octet 43 - Bit 6)
          LE Isochronous Read Test Counters (Octet 43 - Bit 7)
          LE Isochronous Read Test Counters (Octet 44 - Bit 0)
          LE Set Host Feature (Octet 44 - Bit 1)
          Octet 44 - Bit 2 
          Octet 45 - Bit 6 
          Octet 46 - Bit 0 
          Octet 46 - Bit 1 
          Octet 46 - Bit 2 
< HCI Command: Host Buffer Size (0x03|0x0033) plen 7         #9 [hci1] 0.612138
        ACL MTU: 255  ACL max packet: 16
        SCO MTU: 0    SCO max packet: 0
> HCI Event: Command Complete (0x0e) plen 4                 #10 [hci1] 0.612691
      Host Buffer Size (0x03|0x0033) ncmd 1
        Status: Success (0x00)
< HCI Command: Set Controller To Ho.. (0x03|0x0031) plen 1  #11 [hci1] 0.632120
        Flow control: ACL Data Packets (0x01)
> HCI Event: Command Complete (0x0e) plen 4                 #12 [hci1] 0.632505
      Set Controller To Host Flow Control (0x03|0x0031) ncmd 1
        Status: Success (0x00)
< HCI Command: LE Read Local Suppor.. (0x08|0x0003) plen 0  #13 [hci1] 0.652142
> HCI Event: Command Complete (0x0e) plen 12                #14 [hci1] 0.652627
      LE Read Local Supported Features (0x08|0x0003) ncmd 1
        Status: Success (0x00)
        Features: 0xfd 0x79 0x00 0xf7 0x30 0x01 0x00 0x00
          LE Encryption
          Extended Reject Indication
          Peripheral-initiated Features Exchange
          LE Ping
          LE Data Packet Length Extension
          LL Privacy
          Extended Scanner Filter Policies
          LE 2M PHY
          LE Coded PHY
          LE Extended Advertising
          LE Periodic Advertising
          Channel Selection Algorithm #2
          Periodic Advertising Sync Transfer - Sender
          Periodic Advertising Sync Transfer - Recipient
          Sleep Clock Accuracy Updates
          Connected Isochronous Stream - Central
          Connected Isochronous Stream - Peripheral
          Isochronous Broadcaster
          Synchronized Receiver
          Periodic Advertising ADI support
          Connection Subrating
          Unknown features (0x0000010000000000)
< HCI Command: LE Set Host Feature (0x08|0x0074) plen 2     #15 [hci1] 0.672181
        Bit Number: 32
          Connected Isochronous Stream (Host Support)
        Bit Value: 1
> HCI Event: Command Complete (0x0e) plen 4                 #16 [hci1] 0.672567
      LE Set Host Feature (0x08|0x0074) ncmd 1
        Status: Success (0x00)
< HCI Command: LE Read Buffer v2 (0x08|0x0060) plen 0       #17 [hci1] 0.692184
> HCI Event: Command Complete (0x0e) plen 10                #18 [hci1] 0.692751
      LE Read Buffer v2 (0x08|0x0060) ncmd 1
        Status: Success (0x00)
        ACL MTU: 27
        ACL max packet: 3
        ISO MTU: 318
        ISO max packet: 3
< HCI Command: LE Read Maximum Adve.. (0x08|0x003a) plen 0  #19 [hci1] 0.712215
> HCI Event: Command Complete (0x0e) plen 6                 #20 [hci1] 0.712680
      LE Read Maximum Advertising Data Length (0x08|0x003a) ncmd 1
        Status: Success (0x00)
        Max length: 1650
< HCI Command: LE Read Supported St.. (0x08|0x001c) plen 0  #21 [hci1] 0.732126
> HCI Event: Command Complete (0x0e) plen 12                #22 [hci1] 0.732640
      LE Read Supported States (0x08|0x001c) ncmd 1
        Status: Success (0x00)
        States: 0x000003ff3e0306ff
          Non-connectable Advertising State
          Scannable Advertising State
          Connectable Advertising State
          High Duty Cycle Directed Advertising State
          Passive Scanning State
          Active Scanning State
          Initiating State
            and Connection State (Central Role)
          Connection State (Peripheral Role)
          Scannable Advertising State
            and Passive Scanning State
          Connectable Advertising State
            and Passive Scanning State
          Non-connectable Advertising State
            and Initiating State
          Scannable Advertising State
            and Initiating State
          Active Scanning State
            and Connection State (Central Role)
          Passive Scanning State
            and Connection State (Peripheral Role)
          Active Scanning State
            and Connection State (Peripheral Role)
          Initiating State
            and Connection State (Central Role)
            and Central Role & Central Role
          Low Duty Cycle Directed Advertising State
          Connectable Advertising State
            and Initiating State
            and Central Role & Peripheral Role
          High Duty Cycle Directed Advertising State
            and Initiating State
            and Central Role & Peripheral Role
          Low Duty Cycle Directed Advertising State
            and Initiating State
            and Central Role & Peripheral Role
          Connectable Advertising State
            and Connection State (Central Role)
            and Central Role & Peripheral Role
          High Duty Cycle Directed Advertising State
            and Connection State (Central Role)
            and Central Role & Peripheral Role
          Low Duty Cycle Directed Advertising State
            and Connection State (Central Role)
            and Central Role & Peripheral Role
          Connectable Advertising State
            and Connection State (Peripheral Role)
            and Central Role & Peripheral Role
          High Duty Cycle Directed Advertising State
            and Connection State (Peripheral Role)
            and Peripheral Role & Peripheral Role
          Low Duty Cycle Directed Advertising State
            and Connection State (Peripheral Role)
            and Peripheral Role & Peripheral Role
          Initiating State
            and Connection State (Peripheral Role)
            and Central Role & Peripheral Role
< HCI Command: LE Read Maximum Data.. (0x08|0x002f) plen 0  #23 [hci1] 0.752181
> HCI Event: Command Complete (0x0e) plen 12                #24 [hci1] 0.752730
      LE Read Maximum Data Length (0x08|0x002f) ncmd 1
        Status: Success (0x00)
        Max TX octets: 251
        Max TX time: 2704
        Max RX octets: 251
        Max RX time: 2704
< HCI Command: LE Write Suggested D.. (0x08|0x0024) plen 4  #25 [hci1] 0.772159
        TX octets: 251
        TX time: 2704
> HCI Event: Command Complete (0x0e) plen 4                 #26 [hci1] 0.772695
      LE Write Suggested Default Data Length (0x08|0x0024) ncmd 1
        Status: Success (0x00)
< HCI Command: LE Read Resolving Li.. (0x08|0x002a) plen 0  #27 [hci1] 0.792149
> HCI Event: Command Complete (0x0e) plen 5                 #28 [hci1] 0.792602
      LE Read Resolving List Size (0x08|0x002a) ncmd 1
        Status: Success (0x00)
        Size: 8
< HCI Command: LE Set Event Mask (0x08|0x0001) plen 8       #29 [hci1] 0.812119
        Mask: 0x000002023f87fa5e
          LE Advertising Report
          LE Connection Update Complete
          LE Read Remote Used Features Complete
          LE Long Term Key Request
          LE Data Length Change
          LE Enhanced Connection Complete
          LE PHY Update Complete
          LE Extended Advertising Report
          LE Periodic Advertising Sync Established
          LE Periodic Advertising Report
          LE Periodic Advertising Sync Lost
          LE Extended Scan Timeout
          LE Extended Advertising Set Terminated
          LE Scan Request Received
          LE Periodic Advertising Sync Transfer Rvc
          LE CIS Established
          LE CIS Request
          LE Create BIG Complete
          LE Terminate BIG Complete
          LE BIG Sync Estabilished Complete
          LE BIG Sync Lost
          LE BIG Info Advertising Report
          Unknown mask (0x0000020000000000)
> HCI Event: Command Complete (0x0e) plen 4                 #30 [hci1] 0.812714
      LE Set Event Mask (0x08|0x0001) ncmd 1
        Status: Success (0x00)
< HCI Command: Set Event Mask (0x03|0x0001) plen 8          #31 [hci1] 0.832178
        Mask: 0x2000800002008890
          Disconnection Complete
          Encryption Change
          Read Remote Version Information Complete
          Hardware Error
          Data Buffer Overflow
          Encryption Key Refresh Complete
          LE Meta
> HCI Event: Command Complete (0x0e) plen 4                 #32 [hci1] 0.832767
      Set Event Mask (0x03|0x0001) ncmd 1
        Status: Success (0x00)
< HCI Command: Read BD ADDR (0x04|0x0009) plen 0            #33 [hci1] 0.852089
> HCI Event: Command Complete (0x0e) plen 10                #34 [hci1] 0.852540
      Read BD ADDR (0x04|0x0009) ncmd 1
        Status: Success (0x00)
        Address: 00:00:00:00:00:00 (OUI 00-00-00)
< HCI Command: LE Set Random Address (0x08|0x0005) plen 6   #35 [hci1] 0.872110
        Address: D5:B6:CC:31:DB:3B (Static)
> HCI Event: Command Complete (0x0e) plen 4                 #36 [hci1] 0.872569
      LE Set Random Address (0x08|0x0005) ncmd 1
        Status: Success (0x00)
< HCI Command: LE Set Extended Adv.. (0x08|0x0036) plen 25  #37 [hci1] 3.412261
        Handle: 0x00
        Properties: 0x0013
          Connectable
          Scannable
          Use legacy advertising PDUs: ADV_IND
        Min advertising interval: 100.000 msec (0x00a0)
        Max advertising interval: 150.000 msec (0x00f0)
        Channel map: 37, 38, 39 (0x07)
        Own address type: Random (0x01)
        Peer address type: Public (0x00)
        Peer address: 00:00:00:00:00:00 (OUI 00-00-00)
        Filter policy: Allow Scan Request from Any, Allow Connect Request from Any (0x00)
        TX power: Host has no preference (0x7f)
        Primary PHY: LE 1M (0x01)
        Secondary max skip: 0x00
        Secondary PHY: LE 1M (0x01)
        SID: 0x00
        Scan request notifications: Disabled (0x00)
> HCI Event: Command Complete (0x0e) plen 5                 #38 [hci1] 3.413129
      LE Set Extended Advertising Parameters (0x08|0x0036) ncmd 1
        Status: Success (0x00)
        TX power (selected): 0 dbm (0x00)
< HCI Command: LE Set Advertising S.. (0x08|0x0035) plen 7  #39 [hci1] 3.432173
        Advertising handle: 0x00
        Advertising random address: D5:B6:CC:31:DB:3B (Static)
> HCI Event: Command Complete (0x0e) plen 4                 #40 [hci1] 3.432740
      LE Set Advertising Set Random Address (0x08|0x0035) ncmd 1
        Status: Success (0x00)
< HCI Command: LE Set Extended Adv.. (0x08|0x0037) plen 22  #41 [hci1] 3.452154
        Handle: 0x00
        Operation: Complete extended advertising data (0x03)
        Fragment preference: Minimize fragmentation (0x01)
        Data length: 0x12
        Flags: 0x06
          LE General Discoverable Mode
          BR/EDR Not Supported
        Name (complete): Tester_F6B11A
> HCI Event: Command Complete (0x0e) plen 4                 #42 [hci1] 3.452844
      LE Set Extended Advertising Data (0x08|0x0037) ncmd 1
        Status: Success (0x00)
< HCI Command: LE Set Extended Scan.. (0x08|0x0038) plen 4  #43 [hci1] 3.472185
        Handle: 0x00
        Operation: Complete scan response data (0x03)
        Fragment preference: Minimize fragmentation (0x01)
        Data length: 0x00
> HCI Event: Command Complete (0x0e) plen 4                 #44 [hci1] 3.472803
      LE Set Extended Scan Response Data (0x08|0x0038) ncmd 1
        Status: Success (0x00)
< HCI Command: LE Set Extended Adve.. (0x08|0x0039) plen 6  #45 [hci1] 3.492167
        Extended advertising: Enabled (0x01)
        Number of sets: 1 (0x01)
        Entry 0
          Handle: 0x00
          Duration: 0 ms (0x00)
          Max ext adv events: 0
> HCI Event: Command Complete (0x0e) plen 4                 #46 [hci1] 3.492775
      LE Set Extended Advertising Enable (0x08|0x0039) ncmd 1
        Status: Success (0x00)
> HCI Event: LE Meta Event (0x3e) plen 31                   #47 [hci1] 3.601839
      LE Enhanced Connection Complete (0x0a)
        Status: Success (0x00)
        Handle: 2721
        Role: Peripheral (0x01)
        Peer address type: Public (0x00)
        Peer address: DF:A9:FF:F6:B1:1A (OUI DF-A9-FF)
        Local resolvable private address: 00:00:00:00:00:00 (Non-Resolvable)
        Peer resolvable private address: 00:00:00:00:00:00 (Non-Resolvable)
        Connection interval: 87.50 msec (0x0046)
        Connection latency: 0 (0x0000)
        Supervision timeout: 25120 msec (0x09d0)
        Central clock accuracy: 0x01
> HCI Event: LE Meta Event (0x3e) plen 6                    #48 [hci1] 3.601960
      LE Advertising Set Terminated (0x12)
        Status: Success (0x00)
        Handle: 0
        Connection handle: 2721
        Number of completed extended advertising events: 0
< HCI Command: LE Read Remote Used... (0x08|0x0016) plen 2  #49 [hci1] 3.613214
        Handle: 2721 Address: DF:A9:FF:F6:B1:1A (OUI DF-A9-FF)
< ACL Data TX: Handle 2721 flags 0x00 dlen 7                #50 [hci1] 3.613233
      ATT: Exchange MTU Request (0x02) len 2
        Client RX MTU: 251
> HCI Event: Command Status (0x0f) plen 4                   #51 [hci1] 3.613847
      LE Read Remote Used Features (0x08|0x0016) ncmd 1
        Status: Success (0x00)
> HCI Event: Number of Completed Packets (0x13) plen 5      #52 [hci1] 3.777884
        Num handles: 1
        Handle: 2721 Address: DF:A9:FF:F6:B1:1A (OUI DF-A9-FF)
        Count: 1
        #50: len 7 (0 Kb/s)
        Latency: 164 msec (164-164 msec ~164 msec)
> HCI Event: LE Meta Event (0x3e) plen 12                   #53 [hci1] 3.865798
      LE Read Remote Used Features (0x04)
        Status: Success (0x00)
        Handle: 2721 Address: DF:A9:FF:F6:B1:1A (OUI DF-A9-FF)
        Features: 0x2d 0x49 0x00 0xf7 0x67 0xd9 0x00 0x80
          LE Encryption
          Extended Reject Indication
          Peripheral-initiated Features Exchange
          LE Data Packet Length Extension
          LE 2M PHY
          LE Coded PHY
          Channel Selection Algorithm #2
          Periodic Advertising Sync Transfer - Sender
          Periodic Advertising Sync Transfer - Recipient
          Sleep Clock Accuracy Updates
          Connected Isochronous Stream - Central
          Connected Isochronous Stream - Peripheral
          Isochronous Broadcaster
          Synchronized Receiver
          Connected Isochronous Stream (Host Support)
          LE Power Control Request
          LE Power Control Request
          Connection Subrating
          Connection Subrating (Host Support)
          Unknown features (0x8000d90000000000)
> ACL Data RX: Handle 2721 flags 0x02 dlen 11               #54 [hci1] 6.315546
      SMP: Pairing Request (0x01) len 6
        IO capability: KeyboardDisplay (0x04)
        OOB data: Authentication data not present (0x00)
        Authentication requirement: Bonding, MITM, SC, No Keypresses (0x0d)
        Max encryption key size: 16
        Initiator key distribution: EncKey IdKey (0x03)
        Responder key distribution: EncKey IdKey Sign (0x07)
> ACL Data RX: Handle 2721 flags 0x02 dlen 7                #55 [hci1] 6.316008
      ATT: Exchange MTU Response (0x03) len 2
        Server RX MTU: 23
< HCI Command: Host Number of Compl.. (0x03|0x0035) plen 5  #56 [hci1] 6.332786
        Num handles: 1
        Handle: 2721 Address: DF:A9:FF:F6:B1:1A (OUI DF-A9-FF)
        Count: 1
< ACL Data TX: Handle 2721 flags 0x00 dlen 11               #57 [hci1] 6.332956
      SMP: Pairing Response (0x02) len 6
        IO capability: DisplayOnly (0x00)
        OOB data: Authentication data not present (0x00)
        Authentication requirement: Bonding, No MITM, SC, No Keypresses (0x09)
        Max encryption key size: 16
        Initiator key distribution: IdKey (0x02)
        Responder key distribution: <none> (0x00)
< HCI Command: Host Number of Compl.. (0x03|0x0035) plen 5  #58 [hci1] 6.333391
        Num handles: 1
        Handle: 2721 Address: DF:A9:FF:F6:B1:1A (OUI DF-A9-FF)
        Count: 1
> HCI Event: Number of Completed Packets (0x13) plen 5      #59 [hci1] 6.490545
        Num handles: 1
        Handle: 2721 Address: DF:A9:FF:F6:B1:1A (OUI DF-A9-FF)
        Count: 1
        #57: len 11 (0 Kb/s)
        Latency: 157 msec (157-164 msec ~161 msec)
> ACL Data RX: Handle 2721 flags 0x02 dlen 27               #60 [hci1] 6.490875
> ACL Data RX: Handle 2721 flags 0x01 dlen 27               #61 [hci1] 6.491398
> ACL Data RX: Handle 2721 flags 0x01 dlen 15               #62 [hci1] 6.491875
      SMP: Pairing Public Key (0x0c) len 64
        X: 516168cc61412a8e7406187e9ff9ec05bb535bbb198b693b6456d55d776235b6
        Y: bbb4c339ef0139b7aab9eccb44309f8a5e4accb6b63a031123eb9bc84729ae96
< HCI Command: Host Number of Compl.. (0x03|0x0035) plen 5  #63 [hci1] 6.492898
        Num handles: 1
        Handle: 2721 Address: DF:A9:FF:F6:B1:1A (OUI DF-A9-FF)
        Count: 1
< HCI Command: Host Number of Compl.. (0x03|0x0035) plen 5  #64 [hci1] 6.493014
        Num handles: 1
        Handle: 2721 Address: DF:A9:FF:F6:B1:1A (OUI DF-A9-FF)
        Count: 1
< HCI Command: Host Number of Compl.. (0x03|0x0035) plen 5  #65 [hci1] 6.493393
        Num handles: 1
        Handle: 2721 Address: DF:A9:FF:F6:B1:1A (OUI DF-A9-FF)
        Count: 1
< ACL Data TX: Handle 2721 flags 0x00 dlen 27               #66 [hci1] 6.493482
< ACL Data TX: Handle 2721 flags 0x01 dlen 27               #67 [hci1] 6.493506
< ACL Data TX: Handle 2721 flags 0x01 dlen 15               #68 [hci1] 6.493538
      SMP: Pairing Public Key (0x0c) len 64
        X: 98308440221e2d910f0e54b71e7ec652857aa9b5a0dc65028824cc19db1226e9
        Y: 67a4816bcb62efb21701e31fdb27561a6217575fb007a8bbdabe7e28b6f68482
> HCI Event: Number of Completed Packets (0x13) plen 5      #69 [hci1] 6.578457
        Num handles: 1
        Handle: 2721 Address: DF:A9:FF:F6:B1:1A (OUI DF-A9-FF)
        Count: 1
        #66: len 27 (2 Kb/s)
        Latency: 84 msec (84-164 msec ~123 msec)
> HCI Event: Number of Completed Packets (0x13) plen 5      #70 [hci1] 6.579087
        Num handles: 1
        Handle: 2721 Address: DF:A9:FF:F6:B1:1A (OUI DF-A9-FF)
        Count: 1
        #67: len 27 (2 Kb/s)
        Latency: 85 msec (84-164 msec ~104 msec)
> HCI Event: Number of Completed Packets (0x13) plen 5      #71 [hci1] 6.665265
        Num handles: 1
        Handle: 2721 Address: DF:A9:FF:F6:B1:1A (OUI DF-A9-FF)
        Count: 1
        #68: len 15 (0 Kb/s)
        Latency: 171 msec (84-171 msec ~138 msec)
> ACL Data RX: Handle 2721 flags 0x02 dlen 21               #72 [hci1] 7.628070
      SMP: Pairing Confirm (0x03) len 16
        Confim value: dfb5f5ace08a9ee127c425acb02ca9a8
< HCI Command: Host Number of Compl.. (0x03|0x0035) plen 5  #73 [hci1] 7.633041
        Num handles: 1
        Handle: 2721 Address: DF:A9:FF:F6:B1:1A (OUI DF-A9-FF)
        Count: 1
< ACL Data TX: Handle 2721 flags 0x00 dlen 21               #74 [hci1] 7.633123
      SMP: Pairing Confirm (0x03) len 16
        Confim value: d11c5ec92663fd652000ef844898f6c6
> HCI Event: Number of Completed Packets (0x13) plen 5      #75 [hci1] 7.802967
        Num handles: 1
        Handle: 2721 Address: DF:A9:FF:F6:B1:1A (OUI DF-A9-FF)
        Count: 1
        #74: len 21 (0 Kb/s)
        Latency: 169 msec (84-171 msec ~153 msec)
> ACL Data RX: Handle 2721 flags 0x02 dlen 21               #76 [hci1] 7.803418
      SMP: Pairing Random (0x04) len 16
        Random value: 08881e05ba9feca40000000000000000
< HCI Command: Host Number of Compl.. (0x03|0x0035) plen 5  #77 [hci1] 7.813124
        Num handles: 1
        Handle: 2721 Address: DF:A9:FF:F6:B1:1A (OUI DF-A9-FF)
        Count: 1
< ACL Data TX: Handle 2721 flags 0x00 dlen 21               #78 [hci1] 7.813315
      SMP: Pairing Random (0x04) len 16
        Random value: 8e6108f966a694cbe26df70bb96773e6
> HCI Event: Number of Completed Packets (0x13) plen 5      #79 [hci1] 7.977811
        Num handles: 1
        Handle: 2721 Address: DF:A9:FF:F6:B1:1A (OUI DF-A9-FF)
        Count: 1
        #78: len 21 (1 Kb/s)
        Latency: 164 msec (84-171 msec ~159 msec)
> ACL Data RX: Handle 2721 flags 0x02 dlen 21               #80 [hci1] 8.065629
      SMP: Pairing Confirm (0x03) len 16
        Confim value: b1c35da0f8ca1123e567521eb2ffbf40
< HCI Command: Host Number of Compl.. (0x03|0x0035) plen 5  #81 [hci1] 8.072754
        Num handles: 1
        Handle: 2721 Address: DF:A9:FF:F6:B1:1A (OUI DF-A9-FF)
        Count: 1
< ACL Data TX: Handle 2721 flags 0x00 dlen 21               #82 [hci1] 8.072859
      SMP: Pairing Confirm (0x03) len 16
        Confim value: c9a27fbd63cd03534194ec42eead5086
> HCI Event: Number of Completed Packets (0x13) plen 5      #83 [hci1] 8.240436
        Num handles: 1
        Handle: 2721 Address: DF:A9:FF:F6:B1:1A (OUI DF-A9-FF)
        Count: 1
        #82: len 21 (1 Kb/s)
        Latency: 167 msec (84-171 msec ~163 msec)
> ACL Data RX: Handle 2721 flags 0x02 dlen 21               #84 [hci1] 8.240824
      SMP: Pairing Random (0x04) len 16
        Random value: 5b10fcd2709ee7820000000000000000
< HCI Command: Host Number of Compl.. (0x03|0x0035) plen 5  #85 [hci1] 8.253163
        Num handles: 1
        Handle: 2721 Address: DF:A9:FF:F6:B1:1A (OUI DF-A9-FF)
        Count: 1
< ACL Data TX: Handle 2721 flags 0x00 dlen 21               #86 [hci1] 8.253372
      SMP: Pairing Random (0x04) len 16
        Random value: 4d02679f89a05211af56d8b3da64d21e
> HCI Event: Number of Completed Packets (0x13) plen 5      #87 [hci1] 8.415265
        Num handles: 1
        Handle: 2721 Address: DF:A9:FF:F6:B1:1A (OUI DF-A9-FF)
        Count: 1
        #86: len 21 (1 Kb/s)
        Latency: 161 msec (84-171 msec ~162 msec)
> ACL Data RX: Handle 2721 flags 0x02 dlen 21               #88 [hci1] 8.503102
      SMP: Pairing Confirm (0x03) len 16
        Confim value: dd1517826792b45803cb86b9c99f453f
< HCI Command: Host Number of Compl.. (0x03|0x0035) plen 5  #89 [hci1] 8.512562
        Num handles: 1
        Handle: 2721 Address: DF:A9:FF:F6:B1:1A (OUI DF-A9-FF)
        Count: 1
< ACL Data TX: Handle 2721 flags 0x00 dlen 21               #90 [hci1] 8.512646
      SMP: Pairing Confirm (0x03) len 16
        Confim value: 1f7ebf196dd163c11f77210bd0ab24cb
> HCI Event: Number of Completed Packets (0x13) plen 5      #91 [hci1] 8.678000
        Num handles: 1
        Handle: 2721 Address: DF:A9:FF:F6:B1:1A (OUI DF-A9-FF)
        Count: 1
        #90: len 21 (1 Kb/s)
        Latency: 165 msec (84-171 msec ~163 msec)
> ACL Data RX: Handle 2721 flags 0x02 dlen 21               #92 [hci1] 8.678425
      SMP: Pairing Random (0x04) len 16
        Random value: d4254b83e2fe36d00000000000000000
< HCI Command: Host Number of Compl.. (0x03|0x0035) plen 5  #93 [hci1] 8.693260
        Num handles: 1
        Handle: 2721 Address: DF:A9:FF:F6:B1:1A (OUI DF-A9-FF)
        Count: 1
< ACL Data TX: Handle 2721 flags 0x00 dlen 21               #94 [hci1] 8.693373
      SMP: Pairing Random (0x04) len 16
        Random value: 5e8286bc235a02440d0c3424a2acf8fd
> HCI Event: Number of Completed Packets (0x13) plen 5      #95 [hci1] 8.852801
        Num handles: 1
        Handle: 2721 Address: DF:A9:FF:F6:B1:1A (OUI DF-A9-FF)
        Count: 1
        #94: len 21 (1 Kb/s)
        Latency: 159 msec (84-171 msec ~161 msec)
> ACL Data RX: Handle 2721 flags 0x02 dlen 21               #96 [hci1] 8.940698
      SMP: Pairing Confirm (0x03) len 16
        Confim value: d26959f906d1dccad09a0c24beacfbbd
< HCI Command: Host Number of Compl.. (0x03|0x0035) plen 5  #97 [hci1] 8.952462
        Num handles: 1
        Handle: 2721 Address: DF:A9:FF:F6:B1:1A (OUI DF-A9-FF)
        Count: 1
< ACL Data TX: Handle 2721 flags 0x00 dlen 21               #98 [hci1] 8.952558
      SMP: Pairing Confirm (0x03) len 16
        Confim value: 68d6320615b9461277c1d88f4dcc0769
> HCI Event: Number of Completed Packets (0x13) plen 5      #99 [hci1] 9.115439
        Num handles: 1
        Handle: 2721 Address: DF:A9:FF:F6:B1:1A (OUI DF-A9-FF)
        Count: 1
        #98: len 21 (1 Kb/s)
        Latency: 162 msec (84-171 msec ~162 msec)
> ACL Data RX: Handle 2721 flags 0x02 dlen 21              #100 [hci1] 9.115865
      SMP: Pairing Random (0x04) len 16
        Random value: 840308d97dd2a37d0000000000000000
< HCI Command: Host Number of Comp.. (0x03|0x0035) plen 5  #101 [hci1] 9.132595
        Num handles: 1
        Handle: 2721 Address: DF:A9:FF:F6:B1:1A (OUI DF-A9-FF)
        Count: 1
< ACL Data TX: Handle 2721 flags 0x00 dlen 21              #102 [hci1] 9.132676
      SMP: Pairing Random (0x04) len 16
        Random value: 5c4a1bcadd27bd58e945097b00bad7ac
> HCI Event: Number of Completed Packets (0x13) plen 5     #103 [hci1] 9.290222
        Num handles: 1
        Handle: 2721 Address: DF:A9:FF:F6:B1:1A (OUI DF-A9-FF)
        Count: 1
        #102: len 21 (1 Kb/s)
        Latency: 157 msec (84-171 msec ~159 msec)
> ACL Data RX: Handle 2721 flags 0x02 dlen 21              #104 [hci1] 9.378194
      SMP: Pairing Confirm (0x03) len 16
        Confim value: 538f5f8a514ff3dda0345617689fe780
< HCI Command: Host Number of Comp.. (0x03|0x0035) plen 5  #105 [hci1] 9.392899
        Num handles: 1
        Handle: 2721 Address: DF:A9:FF:F6:B1:1A (OUI DF-A9-FF)
        Count: 1
< ACL Data TX: Handle 2721 flags 0x00 dlen 21              #106 [hci1] 9.393006
      SMP: Pairing Confirm (0x03) len 16
        Confim value: 9f6b8f5f588a164e334d238b4a4d1251
> HCI Event: Number of Completed Packets (0x13) plen 5     #107 [hci1] 9.553037
        Num handles: 1
        Handle: 2721 Address: DF:A9:FF:F6:B1:1A (OUI DF-A9-FF)
        Count: 1
        #106: len 21 (1 Kb/s)
        Latency: 160 msec (84-171 msec ~159 msec)
> ACL Data RX: Handle 2721 flags 0x02 dlen 21              #108 [hci1] 9.553310
      SMP: Pairing Random (0x04) len 16
        Random value: b10fef9bd26b7fb10000000000000000
< HCI Command: Host Number of Comp.. (0x03|0x0035) plen 5  #109 [hci1] 9.572587
        Num handles: 1
        Handle: 2721 Address: DF:A9:FF:F6:B1:1A (OUI DF-A9-FF)
        Count: 1
< ACL Data TX: Handle 2721 flags 0x00 dlen 21              #110 [hci1] 9.572614
      SMP: Pairing Random (0x04) len 16
        Random value: 32527e6e64e79f33b2e374394db8ab2d
> HCI Event: Number of Completed Packets (0x13) plen 5     #111 [hci1] 9.727811
        Num handles: 1
        Handle: 2721 Address: DF:A9:FF:F6:B1:1A (OUI DF-A9-FF)
        Count: 1
        #110: len 21 (1 Kb/s)
        Latency: 155 msec (84-171 msec ~157 msec)
> ACL Data RX: Handle 2721 flags 0x02 dlen 21              #112 [hci1] 9.815667
      SMP: Pairing Confirm (0x03) len 16
        Confim value: b372657e7a3b7b36e7e8cdac8b6ca4ef
< HCI Command: Host Number of Comp.. (0x03|0x0035) plen 5  #113 [hci1] 9.832982
        Num handles: 1
        Handle: 2721 Address: DF:A9:FF:F6:B1:1A (OUI DF-A9-FF)
        Count: 1
< ACL Data TX: Handle 2721 flags 0x00 dlen 21              #114 [hci1] 9.833098
      SMP: Pairing Confirm (0x03) len 16
        Confim value: ddab1b2b10b2e0740135bf626419e676
> HCI Event: Number of Completed Packets (0x13) plen 5     #115 [hci1] 9.990519
        Num handles: 1
        Handle: 2721 Address: DF:A9:FF:F6:B1:1A (OUI DF-A9-FF)
        Count: 1
        #114: len 21 (1 Kb/s)
        Latency: 157 msec (84-171 msec ~157 msec)
> ACL Data RX: Handle 2721 flags 0x02 dlen 21              #116 [hci1] 9.990863
      SMP: Pairing Random (0x04) len 16
        Random value: 393ad58076de61460000000000000000
< HCI Command: Host Number of Comp.. (0x03|0x0035) plen 5  #117 [hci1] 9.993114
        Num handles: 1
        Handle: 2721 Address: DF:A9:FF:F6:B1:1A (OUI DF-A9-FF)
        Count: 1
< ACL Data TX: Handle 2721 flags 0x00 dlen 21              #118 [hci1] 9.993269
      SMP: Pairing Random (0x04) len 16
        Random value: dddbdfe2838e9a8cc6964353c850fef7
> HCI Event: Number of Completed Packets (0x13) plen 5    #119 [hci1] 10.165331
        Num handles: 1
        Handle: 2721 Address: DF:A9:FF:F6:B1:1A (OUI DF-A9-FF)
        Count: 1
        #118: len 21 (0 Kb/s)
        Latency: 172 msec (84-172 msec ~164 msec)
> ACL Data RX: Handle 2721 flags 0x02 dlen 21             #120 [hci1] 10.253084
      SMP: Pairing Confirm (0x03) len 16
        Confim value: 7fc6667f33f31aede60896e8f91889ce
< HCI Command: Host Number of Com.. (0x03|0x0035) plen 5  #121 [hci1] 10.272898
        Num handles: 1
        Handle: 2721 Address: DF:A9:FF:F6:B1:1A (OUI DF-A9-FF)
        Count: 1
< ACL Data TX: Handle 2721 flags 0x00 dlen 21             #122 [hci1] 10.273019
      SMP: Pairing Confirm (0x03) len 16
        Confim value: fc89f9e06604b69b01b8a48d8a746e53
> HCI Event: Number of Completed Packets (0x13) plen 5    #123 [hci1] 10.428052
        Num handles: 1
        Handle: 2721 Address: DF:A9:FF:F6:B1:1A (OUI DF-A9-FF)
        Count: 1
        #122: len 21 (1 Kb/s)
        Latency: 155 msec (84-172 msec ~159 msec)
> ACL Data RX: Handle 2721 flags 0x02 dlen 21             #124 [hci1] 10.428254
      SMP: Pairing Random (0x04) len 16
        Random value: fcd2bceb35ad32f80000000000000000
< HCI Command: Host Number of Com.. (0x03|0x0035) plen 5  #125 [hci1] 10.433152
        Num handles: 1
        Handle: 2721 Address: DF:A9:FF:F6:B1:1A (OUI DF-A9-FF)
        Count: 1
< ACL Data TX: Handle 2721 flags 0x00 dlen 21             #126 [hci1] 10.433282
      SMP: Pairing Random (0x04) len 16
        Random value: eb9f1915536596b6fc3db1c86b2b1970
> HCI Event: Number of Completed Packets (0x13) plen 5    #127 [hci1] 10.602724
        Num handles: 1
        Handle: 2721 Address: DF:A9:FF:F6:B1:1A (OUI DF-A9-FF)
        Count: 1
        #126: len 21 (0 Kb/s)
        Latency: 169 msec (84-172 msec ~164 msec)
> ACL Data RX: Handle 2721 flags 0x02 dlen 21             #128 [hci1] 10.690696
      SMP: Pairing Confirm (0x03) len 16
        Confim value: c93f9f69a3b9d8bd19e6a37a83673ab8
< HCI Command: Host Number of Com.. (0x03|0x0035) plen 5  #129 [hci1] 10.692949
        Num handles: 1
        Handle: 2721 Address: DF:A9:FF:F6:B1:1A (OUI DF-A9-FF)
        Count: 1
< ACL Data TX: Handle 2721 flags 0x00 dlen 21             #130 [hci1] 10.693049
      SMP: Pairing Confirm (0x03) len 16
        Confim value: 1fe71fcac9d27faee8168fdc8ea0115e
> HCI Event: Number of Completed Packets (0x13) plen 5    #131 [hci1] 10.865480
        Num handles: 1
        Handle: 2721 Address: DF:A9:FF:F6:B1:1A (OUI DF-A9-FF)
        Count: 1
        #130: len 21 (0 Kb/s)
        Latency: 172 msec (84-172 msec ~168 msec)
> ACL Data RX: Handle 2721 flags 0x02 dlen 21             #132 [hci1] 10.865744
      SMP: Pairing Random (0x04) len 16
        Random value: 6d052c404704bf010000000000000000
< HCI Command: Host Number of Com.. (0x03|0x0035) plen 5  #133 [hci1] 10.872674
        Num handles: 1
        Handle: 2721 Address: DF:A9:FF:F6:B1:1A (OUI DF-A9-FF)
        Count: 1
< ACL Data TX: Handle 2721 flags 0x00 dlen 21             #134 [hci1] 10.872757
      SMP: Pairing Random (0x04) len 16
        Random value: 5c794dc9ad9f2c3f295ebd5ad5e1c3cf
> HCI Event: Number of Completed Packets (0x13) plen 5    #135 [hci1] 11.040314
        Num handles: 1
        Handle: 2721 Address: DF:A9:FF:F6:B1:1A (OUI DF-A9-FF)
        Count: 1
        #134: len 21 (1 Kb/s)
        Latency: 167 msec (84-172 msec ~168 msec)
> ACL Data RX: Handle 2721 flags 0x02 dlen 21             #136 [hci1] 11.128056
      SMP: Pairing Confirm (0x03) len 16
        Confim value: 403e1c5410ca5d185ba617500e3319eb
< HCI Command: Host Number of Com.. (0x03|0x0035) plen 5  #137 [hci1] 11.132871
        Num handles: 1
        Handle: 2721 Address: DF:A9:FF:F6:B1:1A (OUI DF-A9-FF)
        Count: 1
< ACL Data TX: Handle 2721 flags 0x00 dlen 21             #138 [hci1] 11.133026
      SMP: Pairing Confirm (0x03) len 16
        Confim value: 02ff8c2f3fcad8a19ef225cba3a03682
> HCI Event: Number of Completed Packets (0x13) plen 5    #139 [hci1] 11.302931
        Num handles: 1
        Handle: 2721 Address: DF:A9:FF:F6:B1:1A (OUI DF-A9-FF)
        Count: 1
        #138: len 21 (0 Kb/s)
        Latency: 169 msec (84-172 msec ~168 msec)
> ACL Data RX: Handle 2721 flags 0x02 dlen 21             #140 [hci1] 11.303337
      SMP: Pairing Random (0x04) len 16
        Random value: c3420a7c9958a8330000000000000000
< HCI Command: Host Number of Com.. (0x03|0x0035) plen 5  #141 [hci1] 11.312499
        Num handles: 1
        Handle: 2721 Address: DF:A9:FF:F6:B1:1A (OUI DF-A9-FF)
        Count: 1
< ACL Data TX: Handle 2721 flags 0x00 dlen 21             #142 [hci1] 11.312561
      SMP: Pairing Random (0x04) len 16
        Random value: 5c2fff312cdf99c9491988e877355a9a
> HCI Event: Number of Completed Packets (0x13) plen 5    #143 [hci1] 11.477741
        Num handles: 1
        Handle: 2721 Address: DF:A9:FF:F6:B1:1A (OUI DF-A9-FF)
        Count: 1
        #142: len 21 (1 Kb/s)
        Latency: 165 msec (84-172 msec ~167 msec)
> ACL Data RX: Handle 2721 flags 0x02 dlen 21             #144 [hci1] 11.565611
      SMP: Pairing Confirm (0x03) len 16
        Confim value: 0b1c6a003925cb10620b72ad5a25a1ec
< HCI Command: Host Number of Com.. (0x03|0x0035) plen 5  #145 [hci1] 11.572437
        Num handles: 1
        Handle: 2721 Address: DF:A9:FF:F6:B1:1A (OUI DF-A9-FF)
        Count: 1
< ACL Data TX: Handle 2721 flags 0x00 dlen 21             #146 [hci1] 11.572499
      SMP: Pairing Confirm (0x03) len 16
        Confim value: b6934dc6cc5fd3de5c0c4416bcb7121c
> HCI Event: Number of Completed Packets (0x13) plen 5    #147 [hci1] 11.740438
        Num handles: 1
        Handle: 2721 Address: DF:A9:FF:F6:B1:1A (OUI DF-A9-FF)
        Count: 1
        #146: len 21 (1 Kb/s)
        Latency: 167 msec (84-172 msec ~167 msec)
> ACL Data RX: Handle 2721 flags 0x02 dlen 21             #148 [hci1] 11.740745
      SMP: Pairing Random (0x04) len 16
        Random value: 10a4a0bc3ce100cd0000000000000000
< HCI Command: Host Number of Com.. (0x03|0x0035) plen 5  #149 [hci1] 11.753188
        Num handles: 1
        Handle: 2721 Address: DF:A9:FF:F6:B1:1A (OUI DF-A9-FF)
        Count: 1
< ACL Data TX: Handle 2721 flags 0x00 dlen 21             #150 [hci1] 11.753355
      SMP: Pairing Random (0x04) len 16
        Random value: c629a3a987d808e808655d558dfc1155
> HCI Event: Number of Completed Packets (0x13) plen 5    #151 [hci1] 11.915257
        Num handles: 1
        Handle: 2721 Address: DF:A9:FF:F6:B1:1A (OUI DF-A9-FF)
        Count: 1
        #150: len 21 (1 Kb/s)
        Latency: 161 msec (84-172 msec ~164 msec)
> ACL Data RX: Handle 2721 flags 0x02 dlen 21             #152 [hci1] 12.003072
      SMP: Pairing Confirm (0x03) len 16
        Confim value: 9ee9847457336033ff7fbcfaeaf6efcf
< HCI Command: Host Number of Com.. (0x03|0x0035) plen 5  #153 [hci1] 12.012928
        Num handles: 1
        Handle: 2721 Address: DF:A9:FF:F6:B1:1A (OUI DF-A9-FF)
        Count: 1
< ACL Data TX: Handle 2721 flags 0x00 dlen 21             #154 [hci1] 12.013034
      SMP: Pairing Confirm (0x03) len 16
        Confim value: d10d1b7ed8d38d71fc600121e5e67050
> HCI Event: Number of Completed Packets (0x13) plen 5    #155 [hci1] 12.177910
        Num handles: 1
        Handle: 2721 Address: DF:A9:FF:F6:B1:1A (OUI DF-A9-FF)
        Count: 1
        #154: len 21 (1 Kb/s)
        Latency: 164 msec (84-172 msec ~164 msec)
> ACL Data RX: Handle 2721 flags 0x02 dlen 21             #156 [hci1] 12.178271
      SMP: Pairing Random (0x04) len 16
        Random value: 6bb3a62c060bce340000000000000000
< HCI Command: Host Number of Com.. (0x03|0x0035) plen 5  #157 [hci1] 12.193253
        Num handles: 1
        Handle: 2721 Address: DF:A9:FF:F6:B1:1A (OUI DF-A9-FF)
        Count: 1
< ACL Data TX: Handle 2721 flags 0x00 dlen 21             #158 [hci1] 12.193352
      SMP: Pairing Random (0x04) len 16
        Random value: 92f20f6ad8f13724432c7fd6001c45ff
> HCI Event: Number of Completed Packets (0x13) plen 5    #159 [hci1] 12.352664
        Num handles: 1
        Handle: 2721 Address: DF:A9:FF:F6:B1:1A (OUI DF-A9-FF)
        Count: 1
        #158: len 21 (1 Kb/s)
        Latency: 159 msec (84-172 msec ~162 msec)
> ACL Data RX: Handle 2721 flags 0x02 dlen 21             #160 [hci1] 12.440579
      SMP: Pairing Confirm (0x03) len 16
        Confim value: 3dab59c1a1a571d05c6b25b4c100708f
< HCI Command: Host Number of Com.. (0x03|0x0035) plen 5  #161 [hci1] 12.452993
        Num handles: 1
        Handle: 2721 Address: DF:A9:FF:F6:B1:1A (OUI DF-A9-FF)
        Count: 1
< ACL Data TX: Handle 2721 flags 0x00 dlen 21             #162 [hci1] 12.453106
      SMP: Pairing Confirm (0x03) len 16
        Confim value: 036ecd7ef1049f7c8907d276b222be4c
> HCI Event: Number of Completed Packets (0x13) plen 5    #163 [hci1] 12.615428
        Num handles: 1
        Handle: 2721 Address: DF:A9:FF:F6:B1:1A (OUI DF-A9-FF)
        Count: 1
        #162: len 21 (1 Kb/s)
        Latency: 162 msec (84-172 msec ~162 msec)
> ACL Data RX: Handle 2721 flags 0x02 dlen 21             #164 [hci1] 12.615765
      SMP: Pairing Random (0x04) len 16
        Random value: da86cbd7e344face0000000000000000
< HCI Command: Host Number of Com.. (0x03|0x0035) plen 5  #165 [hci1] 12.632594
        Num handles: 1
        Handle: 2721 Address: DF:A9:FF:F6:B1:1A (OUI DF-A9-FF)
        Count: 1
< ACL Data TX: Handle 2721 flags 0x00 dlen 21             #166 [hci1] 12.632628
      SMP: Pairing Random (0x04) len 16
        Random value: 23ac32ebbb5e14c8a6b9622f296d277f
> HCI Event: Number of Completed Packets (0x13) plen 5    #167 [hci1] 12.790245
        Num handles: 1
        Handle: 2721 Address: DF:A9:FF:F6:B1:1A (OUI DF-A9-FF)
        Count: 1
        #166: len 21 (1 Kb/s)
        Latency: 157 msec (84-172 msec ~159 msec)
> ACL Data RX: Handle 2721 flags 0x02 dlen 21             #168 [hci1] 12.878054
      SMP: Pairing Confirm (0x03) len 16
        Confim value: ea1de520f078063ec21b07832d9e4e37
< HCI Command: Host Number of Com.. (0x03|0x0035) plen 5  #169 [hci1] 12.892762
        Num handles: 1
        Handle: 2721 Address: DF:A9:FF:F6:B1:1A (OUI DF-A9-FF)
        Count: 1
< ACL Data TX: Handle 2721 flags 0x00 dlen 21             #170 [hci1] 12.892823
      SMP: Pairing Confirm (0x03) len 16
        Confim value: 06d5010e26a0a25204aeeb33f23c3161
> HCI Event: Number of Completed Packets (0x13) plen 5    #171 [hci1] 13.052919
        Num handles: 1
        Handle: 2721 Address: DF:A9:FF:F6:B1:1A (OUI DF-A9-FF)
        Count: 1
        #170: len 21 (1 Kb/s)
        Latency: 160 msec (84-172 msec ~159 msec)
> ACL Data RX: Handle 2721 flags 0x02 dlen 21             #172 [hci1] 13.053359
      SMP: Pairing Random (0x04) len 16
        Random value: fbda1155eca50c170000000000000000
< HCI Command: Host Number of Com.. (0x03|0x0035) plen 5  #173 [hci1] 13.073238
        Num handles: 1
        Handle: 2721 Address: DF:A9:FF:F6:B1:1A (OUI DF-A9-FF)
        Count: 1
< ACL Data TX: Handle 2721 flags 0x00 dlen 21             #174 [hci1] 13.073325
      SMP: Pairing Random (0x04) len 16
        Random value: 297efe85e67448a15f56bd27e3a3cf1d
> HCI Event: Number of Completed Packets (0x13) plen 5    #175 [hci1] 13.227715
        Num handles: 1
        Handle: 2721 Address: DF:A9:FF:F6:B1:1A (OUI DF-A9-FF)
        Count: 1
        #174: len 21 (1 Kb/s)
        Latency: 154 msec (84-172 msec ~157 msec)
> ACL Data RX: Handle 2721 flags 0x02 dlen 21             #176 [hci1] 13.315547
      SMP: Pairing Confirm (0x03) len 16
        Confim value: c9e3004f656f0f2fe7832b04adf4e3ea
< HCI Command: Host Number of Com.. (0x03|0x0035) plen 5  #177 [hci1] 13.332677
        Num handles: 1
        Handle: 2721 Address: DF:A9:FF:F6:B1:1A (OUI DF-A9-FF)
        Count: 1
< ACL Data TX: Handle 2721 flags 0x00 dlen 21             #178 [hci1] 13.332815
      SMP: Pairing Confirm (0x03) len 16
        Confim value: c0946f7266e6be8200ad91f8751c4e10
> HCI Event: Number of Completed Packets (0x13) plen 5    #179 [hci1] 13.490329
        Num handles: 1
        Handle: 2721 Address: DF:A9:FF:F6:B1:1A (OUI DF-A9-FF)
        Count: 1
        #178: len 21 (1 Kb/s)
        Latency: 157 msec (84-172 msec ~157 msec)
> ACL Data RX: Handle 2721 flags 0x02 dlen 21             #180 [hci1] 13.490765
      SMP: Pairing Random (0x04) len 16
        Random value: c12abd690187daf50000000000000000
< HCI Command: Host Number of Com.. (0x03|0x0035) plen 5  #181 [hci1] 13.493082
        Num handles: 1
        Handle: 2721 Address: DF:A9:FF:F6:B1:1A (OUI DF-A9-FF)
        Count: 1
< ACL Data TX: Handle 2721 flags 0x00 dlen 21             #182 [hci1] 13.493252
      SMP: Pairing Random (0x04) len 16
        Random value: 25a9493fd3ce4faf02be7293595bb7c6
> HCI Event: Number of Completed Packets (0x13) plen 5    #183 [hci1] 13.665161
        Num handles: 1
        Handle: 2721 Address: DF:A9:FF:F6:B1:1A (OUI DF-A9-FF)
        Count: 1
        #182: len 21 (0 Kb/s)
        Latency: 171 msec (84-172 msec ~164 msec)
> ACL Data RX: Handle 2721 flags 0x02 dlen 21             #184 [hci1] 13.753046
      SMP: Pairing Confirm (0x03) len 16
        Confim value: 1869ed7f9d4989779f42989eecfe3295
< HCI Command: Host Number of Com.. (0x03|0x0035) plen 5  #185 [hci1] 13.772931
        Num handles: 1
        Handle: 2721 Address: DF:A9:FF:F6:B1:1A (OUI DF-A9-FF)
        Count: 1
< ACL Data TX: Handle 2721 flags 0x00 dlen 21             #186 [hci1] 13.773030
      SMP: Pairing Confirm (0x03) len 16
        Confim value: 634442eccf9ee74fbc5535ca588b8503
> HCI Event: Number of Completed Packets (0x13) plen 5    #187 [hci1] 13.927990
        Num handles: 1
        Handle: 2721 Address: DF:A9:FF:F6:B1:1A (OUI DF-A9-FF)
        Count: 1
        #186: len 21 (1 Kb/s)
        Latency: 154 msec (84-172 msec ~159 msec)
> ACL Data RX: Handle 2721 flags 0x02 dlen 21             #188 [hci1] 13.928301
      SMP: Pairing Random (0x04) len 16
        Random value: cd75790c01a3e5710000000000000000
< HCI Command: Host Number of Com.. (0x03|0x0035) plen 5  #189 [hci1] 13.933093
        Num handles: 1
        Handle: 2721 Address: DF:A9:FF:F6:B1:1A (OUI DF-A9-FF)
        Count: 1
< ACL Data TX: Handle 2721 flags 0x00 dlen 21             #190 [hci1] 13.933324
      SMP: Pairing Random (0x04) len 16
        Random value: 58f6b41f855a6f6c3560debd84e2affc
> HCI Event: Number of Completed Packets (0x13) plen 5    #191 [hci1] 14.102730
        Num handles: 1
        Handle: 2721 Address: DF:A9:FF:F6:B1:1A (OUI DF-A9-FF)
        Count: 1
        #190: len 21 (0 Kb/s)
        Latency: 169 msec (84-172 msec ~164 msec)
> ACL Data RX: Handle 2721 flags 0x02 dlen 21             #192 [hci1] 14.190684
      SMP: Pairing Confirm (0x03) len 16
        Confim value: 23234c0941540380442fe418d260217f
< HCI Command: Host Number of Com.. (0x03|0x0035) plen 5  #193 [hci1] 14.192751
        Num handles: 1
        Handle: 2721 Address: DF:A9:FF:F6:B1:1A (OUI DF-A9-FF)
        Count: 1
< ACL Data TX: Handle 2721 flags 0x00 dlen 21             #194 [hci1] 14.192874
      SMP: Pairing Confirm (0x03) len 16
        Confim value: a830bf59712cf92e6406fa8ed359ac7c
> HCI Event: Number of Completed Packets (0x13) plen 5    #195 [hci1] 14.365477
        Num handles: 1
        Handle: 2721 Address: DF:A9:FF:F6:B1:1A (OUI DF-A9-FF)
        Count: 1
        #194: len 21 (0 Kb/s)
        Latency: 172 msec (84-172 msec ~168 msec)
> ACL Data RX: Handle 2721 flags 0x02 dlen 21             #196 [hci1] 14.365794
      SMP: Pairing Random (0x04) len 16
        Random value: 158c0ef673480f0c0000000000000000
< HCI Command: Host Number of Com.. (0x03|0x0035) plen 5  #197 [hci1] 14.373084
        Num handles: 1
        Handle: 2721 Address: DF:A9:FF:F6:B1:1A (OUI DF-A9-FF)
        Count: 1
< ACL Data TX: Handle 2721 flags 0x00 dlen 21             #198 [hci1] 14.373206
      SMP: Pairing Random (0x04) len 16
        Random value: b67e7216d5bf664139eda2b542549666
> HCI Event: Number of Completed Packets (0x13) plen 5    #199 [hci1] 14.540283
        Num handles: 1
        Handle: 2721 Address: DF:A9:FF:F6:B1:1A (OUI DF-A9-FF)
        Count: 1
        #198: len 21 (1 Kb/s)
        Latency: 167 msec (84-172 msec ~167 msec)
> ACL Data RX: Handle 2721 flags 0x02 dlen 21             #200 [hci1] 14.628025
      SMP: Pairing Confirm (0x03) len 16
        Confim value: 0829bc0290570e80326c36e57a72a04f
< HCI Command: Host Number of Com.. (0x03|0x0035) plen 5  #201 [hci1] 14.632979
        Num handles: 1
        Handle: 2721 Address: DF:A9:FF:F6:B1:1A (OUI DF-A9-FF)
        Count: 1
< ACL Data TX: Handle 2721 flags 0x00 dlen 21             #202 [hci1] 14.633089
      SMP: Pairing Confirm (0x03) len 16
        Confim value: 7f9644ee78025321bd4446c262ea4a20
> HCI Event: Number of Completed Packets (0x13) plen 5    #203 [hci1] 14.802934
        Num handles: 1
        Handle: 2721 Address: DF:A9:FF:F6:B1:1A (OUI DF-A9-FF)
        Count: 1
        #202: len 21 (0 Kb/s)
        Latency: 169 msec (84-172 msec ~168 msec)
> ACL Data RX: Handle 2721 flags 0x02 dlen 21             #204 [hci1] 14.803200
      SMP: Pairing Random (0x04) len 16
        Random value: 9fc654e323500b180000000000000000
< HCI Command: Host Number of Com.. (0x03|0x0035) plen 5  #205 [hci1] 14.813241
        Num handles: 1
        Handle: 2721 Address: DF:A9:FF:F6:B1:1A (OUI DF-A9-FF)
        Count: 1
< ACL Data TX: Handle 2721 flags 0x00 dlen 21             #206 [hci1] 14.813399
      SMP: Pairing Random (0x04) len 16
        Random value: ed17f76500c95219dd01e09d1e63f87b
> HCI Event: Number of Completed Packets (0x13) plen 5    #207 [hci1] 14.977669
        Num handles: 1
        Handle: 2721 Address: DF:A9:FF:F6:B1:1A (OUI DF-A9-FF)
        Count: 1
        #206: len 21 (1 Kb/s)
        Latency: 164 msec (84-172 msec ~166 msec)
> ACL Data RX: Handle 2721 flags 0x02 dlen 21             #208 [hci1] 15.065494
      SMP: Pairing Confirm (0x03) len 16
        Confim value: 655a439b319421b088237343e68d139d
< HCI Command: Host Number of Com.. (0x03|0x0035) plen 5  #209 [hci1] 15.072926
        Num handles: 1
        Handle: 2721 Address: DF:A9:FF:F6:B1:1A (OUI DF-A9-FF)
        Count: 1
< ACL Data TX: Handle 2721 flags 0x00 dlen 21             #210 [hci1] 15.073053
      SMP: Pairing Confirm (0x03) len 16
        Confim value: 204fa53e6be62a3df9f571c4fac82c08
> HCI Event: Number of Completed Packets (0x13) plen 5    #211 [hci1] 15.240373
        Num handles: 1
        Handle: 2721 Address: DF:A9:FF:F6:B1:1A (OUI DF-A9-FF)
        Count: 1
        #210: len 21 (1 Kb/s)
        Latency: 167 msec (84-172 msec ~166 msec)
> ACL Data RX: Handle 2721 flags 0x02 dlen 21             #212 [hci1] 15.240764
      SMP: Pairing Random (0x04) len 16
        Random value: 20f124527ce829e60000000000000000
< HCI Command: Host Number of Com.. (0x03|0x0035) plen 5  #213 [hci1] 15.253258
        Num handles: 1
        Handle: 2721 Address: DF:A9:FF:F6:B1:1A (OUI DF-A9-FF)
        Count: 1
< ACL Data TX: Handle 2721 flags 0x00 dlen 21             #214 [hci1] 15.253356
      SMP: Pairing Random (0x04) len 16
        Random value: 81d35d47e1f6006d79c974bd9d9e1ee3
> HCI Event: Number of Completed Packets (0x13) plen 5    #215 [hci1] 15.415129
        Num handles: 1
        Handle: 2721 Address: DF:A9:FF:F6:B1:1A (OUI DF-A9-FF)
        Count: 1
        #214: len 21 (1 Kb/s)
        Latency: 161 msec (84-172 msec ~164 msec)
> ACL Data RX: Handle 2721 flags 0x02 dlen 21             #216 [hci1] 15.502969
      SMP: Pairing Confirm (0x03) len 16
        Confim value: 60a440f4d57f2cb0936ed18ad1104a28
< HCI Command: Host Number of Com.. (0x03|0x0035) plen 5  #217 [hci1] 15.512359
        Num handles: 1
        Handle: 2721 Address: DF:A9:FF:F6:B1:1A (OUI DF-A9-FF)
        Count: 1
< ACL Data TX: Handle 2721 flags 0x00 dlen 21             #218 [hci1] 15.512413
      SMP: Pairing Confirm (0x03) len 16
        Confim value: c6121afb9f7e58fcec0824a5e5695f7a
> HCI Event: Number of Completed Packets (0x13) plen 5    #219 [hci1] 15.677877
        Num handles: 1
        Handle: 2721 Address: DF:A9:FF:F6:B1:1A (OUI DF-A9-FF)
        Count: 1
        #218: len 21 (1 Kb/s)
        Latency: 165 msec (84-172 msec ~164 msec)
> ACL Data RX: Handle 2721 flags 0x02 dlen 21             #220 [hci1] 15.678289
      SMP: Pairing Random (0x04) len 16
        Random value: 3e1ecded516ce53f0000000000000000
< HCI Command: Host Number of Com.. (0x03|0x0035) plen 5  #221 [hci1] 15.693105
        Num handles: 1
        Handle: 2721 Address: DF:A9:FF:F6:B1:1A (OUI DF-A9-FF)
        Count: 1
< ACL Data TX: Handle 2721 flags 0x00 dlen 21             #222 [hci1] 15.693263
      SMP: Pairing Random (0x04) len 16
        Random value: e7f7e0c2476823e41736a7e381bafb7c
> HCI Event: Number of Completed Packets (0x13) plen 5    #223 [hci1] 15.852669
        Num handles: 1
        Handle: 2721 Address: DF:A9:FF:F6:B1:1A (OUI DF-A9-FF)
        Count: 1
        #222: len 21 (1 Kb/s)
        Latency: 159 msec (84-172 msec ~162 msec)
> ACL Data RX: Handle 2721 flags 0x02 dlen 21             #224 [hci1] 15.940581
      SMP: Pairing Confirm (0x03) len 16
        Confim value: 95c1145f7923141b352287638b0d09cf
< HCI Command: Host Number of Com.. (0x03|0x0035) plen 5  #225 [hci1] 15.953121
        Num handles: 1
        Handle: 2721 Address: DF:A9:FF:F6:B1:1A (OUI DF-A9-FF)
        Count: 1
< ACL Data TX: Handle 2721 flags 0x00 dlen 21             #226 [hci1] 15.953301
      SMP: Pairing Confirm (0x03) len 16
        Confim value: d716c7bfa2a100328cde785a2dcfd7ad
> HCI Event: Number of Completed Packets (0x13) plen 5    #227 [hci1] 16.115308
        Num handles: 1
        Handle: 2721 Address: DF:A9:FF:F6:B1:1A (OUI DF-A9-FF)
        Count: 1
        #226: len 21 (1 Kb/s)
        Latency: 162 msec (84-172 msec ~162 msec)
> ACL Data RX: Handle 2721 flags 0x02 dlen 21             #228 [hci1] 16.115725
      SMP: Pairing Random (0x04) len 16
        Random value: d2f361ceed317edf0000000000000000
