Bluetooth monitor ver 5.84
btmon[242433]: = Note: Linux version 6.8.0-83-generic (x86_64)                                                           0.164277
btmon[242433]: = Note: Bluetooth subsystem version 2.22                                                                  0.164279
= New Index: 00:00:00:00:00:00 (Primary,UART,hci0)                                                                       0.164280
= Open Index: 00:00:00:00:00:00                                                                                          0.171410
= Index Info: 00:00:00:00:00:00 (Nordic Semiconductor ASA)                                                               0.171413
zephyr.exe[242435]: @ USER Open: main (privileged) version 2.22                                                 {0x0001} 0.171415
zephyr.exe[242435]: < HCI Command: Reset (0x03|0x0003) plen 0                                                         #1 0.171580
> HCI Event: Command Complete (0x0e) plen 4                                                                           #2 0.172634
      Reset (0x03|0x0003) ncmd 1
        Status: Success (0x00)
zephyr.exe[242435]: < HCI Command: Read Local Supported Features (0x04|0x0003) plen 0                                 #3 0.191371
> HCI Event: Command Complete (0x0e) plen 12                                                                          #4 0.192197
      Read Local Supported Features (0x04|0x0003) ncmd 1
        Status: Success (0x00)
        Features: 0x00 0x00 0x00 0x00 0x60 0x00 0x00 0x00
          BR/EDR Not Supported
          LE Supported (Controller)
zephyr.exe[242435]: < HCI Command: Read Local Version Information (0x04|0x0001) plen 0                                #5 0.211407
> HCI Event: Command Complete (0x0e) plen 12                                                                          #6 0.212063
      Read Local Version Information (0x04|0x0001) ncmd 1
        Status: Success (0x00)
        HCI version: Reserved (0x0e) - Revision 12520 (0x30e8)
        LMP version: Reserved (0x0e) - Subversion 12520 (0x30e8)
        Manufacturer: Nordic Semiconductor ASA (89)
zephyr.exe[242435]: < HCI Command: Read Local Supported Commands (0x04|0x0002) plen 0                                 #7 0.231361
> HCI Event: Command Complete (0x0e) plen 68                                                                          #8 0.232643
      Read Local Supported Commands (0x04|0x0002) ncmd 1
        Status: Success (0x00)
        Commands: 119 entries
          Disconnect (Octet 0 - Bit 5)
          Read Remote Version Information (Octet 2 - Bit 7)
          Set Event Mask (Octet 5 - Bit 6)
          Reset (Octet 5 - Bit 7)
          Read Connection Accept Timeout (Octet 7 - Bit 2)
          Write Connection Accept Timeout (Octet 7 - Bit 3)
          Read Transmit Power Level (Octet 10 - Bit 2)
          Set Controller To Host Flow Control (Octet 10 - Bit 5)
          Host Buffer Size (Octet 10 - Bit 6)
          Host Number of Completed Packets (Octet 10 - Bit 7)
          Read Local Version Information (Octet 14 - Bit 3)
          Read Local Supported Features (Octet 14 - Bit 5)
          Read BD ADDR (Octet 15 - Bit 1)
          Read RSSI (Octet 15 - Bit 5)
          Set Event Mask Page 2 (Octet 22 - Bit 2)
          LE Set Event Mask (Octet 25 - Bit 0)
          LE Read Buffer Size (Octet 25 - Bit 1)
          LE Read Local Supported Features (Octet 25 - Bit 2)
          LE Set Random Address (Octet 25 - Bit 4)
          LE Set Advertising Parameters (Octet 25 - Bit 5)
          LE Read Advertising Channel TX Power (Octet 25 - Bit 6)
          LE Set Advertising Data (Octet 25 - Bit 7)
          LE Set Scan Response Data (Octet 26 - Bit 0)
          LE Set Advertise Enable (Octet 26 - Bit 1)
          LE Set Scan Parameters (Octet 26 - Bit 2)
          LE Set Scan Enable (Octet 26 - Bit 3)
          LE Create Connection (Octet 26 - Bit 4)
          LE Create Connection Cancel (Octet 26 - Bit 5)
          LE Read Accept List Size (Octet 26 - Bit 6)
          LE Clear Accept List (Octet 26 - Bit 7)
          LE Add Device To Accept List (Octet 27 - Bit 0)
          LE Remove Device From Accept List (Octet 27 - Bit 1)
          LE Connection Update (Octet 27 - Bit 2)
          LE Set Host Channel Classification (Octet 27 - Bit 3)
          LE Read Channel Map (Octet 27 - Bit 4)
          LE Read Remote Used Features (Octet 27 - Bit 5)
          LE Encrypt (Octet 27 - Bit 6)
          LE Rand (Octet 27 - Bit 7)
          LE Start Encryption (Octet 28 - Bit 0)
          LE Long Term Key Request Reply (Octet 28 - Bit 1)
          LE Long Term Key Request Neg Reply (Octet 28 - Bit 2)
          LE Read Supported States (Octet 28 - Bit 3)
          LE Receiver Test (Octet 28 - Bit 4)
          LE Transmitter Test (Octet 28 - Bit 5)
          LE Test End (Octet 28 - Bit 6)
          Read Authenticated Payload Timeout (Octet 32 - Bit 4)
          Write Authenticated Payload Timeout (Octet 32 - Bit 5)
          LE Set Data Length (Octet 33 - Bit 6)
          LE Read Suggested Default Data Length (Octet 33 - Bit 7)
          LE Write Suggested Default Data Length (Octet 34 - Bit 0)
          LE Add Device To Resolving List (Octet 34 - Bit 3)
          LE Remove Device From Resolving List (Octet 34 - Bit 4)
          LE Clear Resolving List (Octet 34 - Bit 5)
          LE Read Resolving List Size (Octet 34 - Bit 6)
          LE Set Address Resolution Enable (Octet 35 - Bit 1)
          LE Set Resolvable Private Address Timeout (Octet 35 - Bit 2)
          LE Read Maximum Data Length (Octet 35 - Bit 3)
          LE Read PHY (Octet 35 - Bit 4)
          LE Set Default PHY (Octet 35 - Bit 5)
          LE Set PHY (Octet 35 - Bit 6)
          LE Enhanced Receiver Test (Octet 35 - Bit 7)
          LE Enhanced Transmitter Test (Octet 36 - Bit 0)
          LE Set Advertising Set Random Address (Octet 36 - Bit 1)
          LE Set Extended Advertising Parameters (Octet 36 - Bit 2)
          LE Set Extended Advertising Data (Octet 36 - Bit 3)
          LE Set Extended Scan Response Data (Octet 36 - Bit 4)
          LE Set Extended Advertising Enable (Octet 36 - Bit 5)
          LE Read Maximum Advertising Data Length (Octet 36 - Bit 6)
          LE Read Number of Supported Advertising Sets (Octet 36 - Bit 7)
          LE Remove Advertising Set (Octet 37 - Bit 0)
          LE Clear Advertising Sets (Octet 37 - Bit 1)
          LE Set Periodic Advertising Parameters (Octet 37 - Bit 2)
          LE Set Periodic Advertising Data (Octet 37 - Bit 3)
          LE Set Periodic Advertising Enable (Octet 37 - Bit 4)
          LE Set Extended Scan Parameters (Octet 37 - Bit 5)
          LE Set Extended Scan Enable (Octet 37 - Bit 6)
          LE Extended Create Connection (Octet 37 - Bit 7)
          LE Periodic Advertising Create Sync (Octet 38 - Bit 0)
          LE Periodic Advertising Create Sync Cancel (Octet 38 - Bit 1)
          LE Periodic Advertising Terminate Sync (Octet 38 - Bit 2)
          LE Add Device To Periodic Advertiser List (Octet 38 - Bit 3)
          LE Remove Device From Periodic Advertiser List (Octet 38 - Bit 4)
          LE Clear Periodic Advertiser List (Octet 38 - Bit 5)
          LE Read Periodic Advertiser List Size (Octet 38 - Bit 6)
          LE Read Transmit Power (Octet 38 - Bit 7)
          LE Read RF Path Compensation (Octet 39 - Bit 0)
          LE Write RF Path Compensation (Octet 39 - Bit 1)
          LE Set Privacy Mode (Octet 39 - Bit 2)
          LE Periodic Advertising Receive Enable (Octet 40 - Bit 5)
          LE Periodic Advertising Sync Transfer (Octet 40 - Bit 6)
          LE Periodic Advertising Set Info Transfer (Octet 40 - Bit 7)
          LE Periodic Advertising Sync Transfer Parameters (Octet 41 - Bit 0)
          LE Set Default Periodic Advertisng Sync Transfer Parameters (Octet 41 - Bit 1)
          LE Read Buffer v2 (Octet 41 - Bit 5)
          LE Read ISO TX Sync (Octet 41 - Bit 6)
          LE Set Connected Isochronous Group Parameters (Octet 41 - Bit 7)
          LE Set Connected Isochronous Group Parameters Test (Octet 42 - Bit 0)
          LE Create Connected Isochronous Stream (Octet 42 - Bit 1)
          LE Remove Connected Isochronous Group (Octet 42 - Bit 2)
          LE Accept Connected Isochronous Stream Request (Octet 42 - Bit 3)
          LE Reject Connected Isochronous Stream Request (Octet 42 - Bit 4)
          LE Create Broadcast Isochronous Group (Octet 42 - Bit 5)
          LE Create Broadcast Isochronous Group Test (Octet 42 - Bit 6)
          LE Terminate Broadcast Isochronous Group (Octet 42 - Bit 7)
          LE Broadcast Isochronous Group Create Sync (Octet 43 - Bit 0)
          LE Broadcast Isochronous Group Terminate Sync (Octet 43 - Bit 1)
          LE Request Peer SCA (Octet 43 - Bit 2)
          LE Setup Isochronous Data Path (Octet 43 - Bit 3)
          LE Remove Isochronous Data Path (Octet 43 - Bit 4)
          LE Isochronous Transmit Test (Octet 43 - Bit 5)
          LE Isochronous Receive Test (Octet 43 - Bit 6)
          LE Isochronous Read Test Counters (Octet 43 - Bit 7)
          LE Isochronous Read Test Counters (Octet 44 - Bit 0)
          LE Set Host Feature (Octet 44 - Bit 1)
          LE Read ISO link quality (Octet 44 - Bit 2)
          Octet 45 - Bit 6 
          Octet 46 - Bit 0 
          Octet 46 - Bit 1 
          Octet 46 - Bit 2 
zephyr.exe[242435]: < HCI Command: Host Buffer Size (0x03|0x0033) plen 7                                              #9 0.251382
        ACL MTU: 255  ACL max packet: 16
        SCO MTU: 0    SCO max packet: 0
> HCI Event: Command Complete (0x0e) plen 4                                                                          #10 0.252086
      Host Buffer Size (0x03|0x0033) ncmd 1
        Status: Success (0x00)
zephyr.exe[242435]: < HCI Command: Set Controller To Host Flow Control (0x03|0x0031) plen 1                          #11 0.271359
        Flow control: ACL Data Packets (0x01)
> HCI Event: Command Complete (0x0e) plen 4                                                                          #12 0.272252
      Set Controller To Host Flow Control (0x03|0x0031) ncmd 1
        Status: Success (0x00)
zephyr.exe[242435]: < HCI Command: LE Read Local Supported Features (0x08|0x0003) plen 0                             #13 0.291368
> HCI Event: Command Complete (0x0e) plen 12                                                                         #14 0.292258
      LE Read Local Supported Features (0x08|0x0003) ncmd 1
        Status: Success (0x00)
        Features: 0xfd 0x79 0x00 0xf7 0x30 0x01 0x00 0x00
          LE Encryption
          Extended Reject Indication
          Peripheral-initiated Features Exchange
          LE Ping
          LE Data Packet Length Extension
          LL Privacy
          Extended Scanner Filter Policies
          LE 2M PHY
          LE Coded PHY
          LE Extended Advertising
          LE Periodic Advertising
          Channel Selection Algorithm #2
          Periodic Advertising Sync Transfer - Sender
          Periodic Advertising Sync Transfer - Recipient
          Sleep Clock Accuracy Updates
          Connected Isochronous Stream - Central
          Connected Isochronous Stream - Peripheral
          Isochronous Broadcaster
          Synchronized Receiver
          Periodic Advertising ADI support
          Connection Subrating
          Unknown features (0x0000010000000000)
zephyr.exe[242435]: < HCI Command: LE Set Host Feature (0x08|0x0074) plen 2                                          #15 0.311355
        Bit Number: 32
          Connected Isochronous Stream (Host Support)
        Bit Value: 1
> HCI Event: Command Complete (0x0e) plen 4                                                                          #16 0.312060
      LE Set Host Feature (0x08|0x0074) ncmd 1
        Status: Success (0x00)
zephyr.exe[242435]: < HCI Command: LE Read Buffer v2 (0x08|0x0060) plen 0                                            #17 0.331353
> HCI Event: Command Complete (0x0e) plen 10                                                                         #18 0.332049
      LE Read Buffer v2 (0x08|0x0060) ncmd 1
        Status: Success (0x00)
        ACL MTU: 27
        ACL max packet: 3
        ISO MTU: 318
        ISO max packet: 3
zephyr.exe[242435]: < HCI Command: LE Read Maximum Advertising Data Length (0x08|0x003a) plen 0                      #19 0.351415
> HCI Event: Command Complete (0x0e) plen 6                                                                          #20 0.352370
      LE Read Maximum Advertising Data Length (0x08|0x003a) ncmd 1
        Status: Success (0x00)
        Max length: 1650
zephyr.exe[242435]: < HCI Command: LE Read Supported States (0x08|0x001c) plen 0                                     #21 0.371412
> HCI Event: Command Complete (0x0e) plen 12                                                                         #22 0.372083
      LE Read Supported States (0x08|0x001c) ncmd 1
        Status: Success (0x00)
        States: 0x000003ff3e0306ff
          Non-connectable Advertising State
          Scannable Advertising State
          Connectable Advertising State
          High Duty Cycle Directed Advertising State
          Passive Scanning State
          Active Scanning State
          Initiating State
            and Connection State (Central Role)
          Connection State (Peripheral Role)
          Scannable Advertising State
            and Passive Scanning State
          Connectable Advertising State
            and Passive Scanning State
          Non-connectable Advertising State
            and Initiating State
          Scannable Advertising State
            and Initiating State
          Active Scanning State
            and Connection State (Central Role)
          Passive Scanning State
            and Connection State (Peripheral Role)
          Active Scanning State
            and Connection State (Peripheral Role)
          Initiating State
            and Connection State (Central Role)
            and Central Role & Central Role
          Low Duty Cycle Directed Advertising State
          Connectable Advertising State
            and Initiating State
            and Central Role & Peripheral Role
          High Duty Cycle Directed Advertising State
            and Initiating State
            and Central Role & Peripheral Role
          Low Duty Cycle Directed Advertising State
            and Initiating State
            and Central Role & Peripheral Role
          Connectable Advertising State
            and Connection State (Central Role)
            and Central Role & Peripheral Role
          High Duty Cycle Directed Advertising State
            and Connection State (Central Role)
            and Central Role & Peripheral Role
          Low Duty Cycle Directed Advertising State
            and Connection State (Central Role)
            and Central Role & Peripheral Role
          Connectable Advertising State
            and Connection State (Peripheral Role)
            and Central Role & Peripheral Role
          High Duty Cycle Directed Advertising State
            and Connection State (Peripheral Role)
            and Peripheral Role & Peripheral Role
          Low Duty Cycle Directed Advertising State
            and Connection State (Peripheral Role)
            and Peripheral Role & Peripheral Role
          Initiating State
            and Connection State (Peripheral Role)
            and Central Role & Peripheral Role
zephyr.exe[242435]: < HCI Command: LE Read Maximum Data Length (0x08|0x002f) plen 0                                  #23 0.391404
> HCI Event: Command Complete (0x0e) plen 12                                                                         #24 0.392072
      LE Read Maximum Data Length (0x08|0x002f) ncmd 1
        Status: Success (0x00)
        Max TX octets: 251
        Max TX time: 2704
        Max RX octets: 251
        Max RX time: 2704
zephyr.exe[242435]: < HCI Command: LE Write Suggested Default Data Length (0x08|0x0024) plen 4                       #25 0.411391
        TX octets: 251
        TX time: 2704
> HCI Event: Command Complete (0x0e) plen 4                                                                          #26 0.411953
      LE Write Suggested Default Data Length (0x08|0x0024) ncmd 1
        Status: Success (0x00)
zephyr.exe[242435]: < HCI Command: LE Read Resolving List Size (0x08|0x002a) plen 0                                  #27 0.431354
> HCI Event: Command Complete (0x0e) plen 5                                                                          #28 0.432473
      LE Read Resolving List Size (0x08|0x002a) ncmd 1
        Status: Success (0x00)
        Size: 8
zephyr.exe[242435]: < HCI Command: LE Set Event Mask (0x08|0x0001) plen 8                                            #29 0.451406
        Mask: 0x000002023f87fa5e
          LE Advertising Report
          LE Connection Update Complete
          LE Read Remote Used Features Complete
          LE Long Term Key Request
          LE Data Length Change
          LE Enhanced Connection Complete
          LE PHY Update Complete
          LE Extended Advertising Report
          LE Periodic Advertising Sync Established
          LE Periodic Advertising Report
          LE Periodic Advertising Sync Lost
          LE Extended Scan Timeout
          LE Extended Advertising Set Terminated
          LE Scan Request Received
          LE Periodic Advertising Sync Transfer Rvc
          LE CIS Established
          LE CIS Request
          LE Create BIG Complete
          LE Terminate BIG Complete
          LE BIG Sync Established Complete
          LE BIG Sync Lost
          LE BIG Info Advertising Report
          Unknown mask (0x0000020000000000)
> HCI Event: Command Complete (0x0e) plen 4                                                                          #30 0.452459
      LE Set Event Mask (0x08|0x0001) ncmd 1
        Status: Success (0x00)
zephyr.exe[242435]: < HCI Command: Set Event Mask (0x03|0x0001) plen 8                                               #31 0.471406
        Mask: 0x2000800002008890
          Disconnection Complete
          Encryption Change
          Read Remote Version Information Complete
          Hardware Error
          Data Buffer Overflow
          Encryption Key Refresh Complete
          LE Meta
> HCI Event: Command Complete (0x0e) plen 4                                                                          #32 0.471967
      Set Event Mask (0x03|0x0001) ncmd 1
        Status: Success (0x00)
zephyr.exe[242435]: < HCI Command: Read BD ADDR (0x04|0x0009) plen 0                                                 #33 0.491360
> HCI Event: Command Complete (0x0e) plen 10                                                                         #34 0.492148
      Read BD ADDR (0x04|0x0009) ncmd 1
        Status: Success (0x00)
        Address: 00:00:00:00:00:00 (OUI 00-00-00)
zephyr.exe[242435]: < HCI Command: LE Set Random Address (0x08|0x0005) plen 6                                        #35 0.511360
        Address: D5:B6:CC:31:DB:3B (Static)
> HCI Event: Command Complete (0x0e) plen 4                                                                          #36 0.512089
      LE Set Random Address (0x08|0x0005) ncmd 1
        Status: Success (0x00)
zephyr.exe[242435]: < HCI Command: LE Periodic Advertising Create Sync (0x08|0x0044) plen 14                         #37 4.411487
        Options: 0x0000
        Use advertising SID, Advertiser Address Type and address
        Reporting initially enabled
        SID: 0x00
        Adv address type: Public (0x00)
        Adv address: DF:A9:FF:F6:B1:1A (OUI DF-A9-FF)
        Skip: 0x0000
        Sync timeout: 5000 msec (0x01f4)
        Sync CTE type: 0x0000
> HCI Event: Command Status (0x0f) plen 4                                                                            #38 4.412401
      LE Periodic Advertising Create Sync (0x08|0x0044) ncmd 1
        Status: Success (0x00)
zephyr.exe[242435]: < HCI Command: LE Set Random Address (0x08|0x0005) plen 6                                        #39 4.431457
        Address: 26:66:F9:08:61:8E (Non-Resolvable)
> HCI Event: Command Complete (0x0e) plen 4                                                                          #40 4.432316
      LE Set Random Address (0x08|0x0005) ncmd 1
        Status: Success (0x00)
zephyr.exe[242435]: < HCI Command: LE Set Extended Scan Parameters (0x08|0x0041) plen 13                             #41 4.451447
        Own address type: Random (0x01)
        Filter policy: Accept all advertisement (0x00)
        PHYs: 0x05
        Entry 0: LE 1M
          Type: Passive (0x00)
          Interval: 60.000 msec (0x0060)
          Window: 30.000 msec (0x0030)
        Entry 1: LE Coded
          Type: Passive (0x00)
          Interval: 60.000 msec (0x0060)
          Window: 30.000 msec (0x0030)
> HCI Event: Command Complete (0x0e) plen 4                                                                          #42 4.452138
      LE Set Extended Scan Parameters (0x08|0x0041) ncmd 1
        Status: Success (0x00)
zephyr.exe[242435]: < HCI Command: LE Set Extended Scan Enable (0x08|0x0042) plen 6                                  #43 4.471451
        Extended scan: Enabled (0x01)
        Filter duplicates: Enabled (0x01)
        Duration: 0 msec (0x0000)
        Period: 0.00 sec (0x0000)
> HCI Event: Command Complete (0x0e) plen 4                                                                          #44 4.472195
      LE Set Extended Scan Enable (0x08|0x0042) ncmd 1
        Status: Success (0x00)
> HCI Event: LE Meta Event (0x3e) plen 55                                                                            #45 4.475384
      LE Extended Advertising Report (0x0d)
        Num reports: 1
        Entry 0
          Event type: 0x0010
            Props: 0x0010
              Use legacy advertising PDUs
            Data status: [0;32mComplete[0m
          Legacy PDU Type: ADV_NONCONN_IND (0x0010)
          Address type: Random (0x01)
          Address: 2E:49:48:AE:A9:68 (Non-Resolvable)
          Primary PHY: LE 1M
          Secondary PHY: No packets
          SID: no ADI field (0xff)
          TX power: 127 dBm
          RSSI: -82 dBm (0xae)
          Periodic advertising interval: 0.00 msec (0x0000)
          Direct address type: Reserved (0xff)
          Direct address: 00-00-00-00-00-00
          Data length: 0x1d
        1c ff 06 00 01 09 21 0a 4d e0 8a 52 d2 d4 4c 41  ......!.M..R..LA
        50 54 4f 50 2d 45 35 32 45 4f 44 32 49           PTOP-E52EOD2I   
        Company: Microsoft (6)
          Data[25]: 0109210a4de08a52d2d44c4150544f502d453532454f443249
> HCI Event: LE Meta Event (0x3e) plen 55                                                                            #46 4.486807
      LE Extended Advertising Report (0x0d)
        Num reports: 1
        Entry 0
          Event type: 0x0013
            Props: 0x0013
              Connectable
              Scannable
              Use legacy advertising PDUs
            Data status: [0;32mComplete[0m
          Legacy PDU Type: ADV_IND (0x0013)
          Address type: Random (0x01)
          Address: 07:14:13:DA:7C:2F (Non-Resolvable)
          Primary PHY: LE 1M
          Secondary PHY: No packets
          SID: no ADI field (0xff)
          TX power: 127 dBm
          RSSI: -86 dBm (0xaa)
          Periodic advertising interval: 0.00 msec (0x0000)
          Direct address type: Reserved (0xff)
          Direct address: 00-00-00-00-00-00
          Data length: 0x1d
        02 01 02 19 16 f1 fc 04 f0 10 f8 26 4a 07 37 68  ...........&J.7h
        0b ce 5c b9 ff 48 4c 35 52 eb 8d 4a 24           ..\..HL5R..J$   
        Flags: 0x02
          LE General Discoverable Mode
        Service Data: Unknown (0xfcf1)
          Data[22]: 04f010f8264a0737680bce5cb9ff484c3552eb8d4a24
> HCI Event: LE Meta Event (0x3e) plen 57                                                                            #47 4.564884
      LE Extended Advertising Report (0x0d)
        Num reports: 1
        Entry 0
          Event type: 0x0010
            Props: 0x0010
              Use legacy advertising PDUs
            Data status: [0;32mComplete[0m
          Legacy PDU Type: ADV_NONCONN_IND (0x0010)
          Address type: Random (0x01)
          Address: 3A:40:B7:D2:DD:04 (Non-Resolvable)
          Primary PHY: LE 1M
          Secondary PHY: No packets
          SID: no ADI field (0xff)
          TX power: 127 dBm
          RSSI: -89 dBm (0xa7)
          Periodic advertising interval: 0.00 msec (0x0000)
          Direct address type: Reserved (0xff)
          Direct address: 00-00-00-00-00-00
          Data length: 0x1f
        1e ff 06 00 01 09 20 22 6a ca 86 1b 87 38 9b 5d  ...... "j....8.]
        45 13 17 40 8c 5b e1 66 d0 ec 61 7d 55 8c 1d     E..@.[.f..a}U.. 
        Company: Microsoft (6)
          Data[27]: 010920226aca861b87389b5d451317408c5be166d0ec617d558c1d
> HCI Event: LE Meta Event (0x3e) plen 51                                                                            #48 4.610356
      LE Extended Advertising Report (0x0d)
        Num reports: 1
        Entry 0
          Event type: 0x0013
            Props: 0x0013
              Connectable
              Scannable
              Use legacy advertising PDUs
            Data status: [0;32mComplete[0m
          Legacy PDU Type: ADV_IND (0x0013)
          Address type: Public (0x00)
          Address: F0:18:98:96:04:94 (Apple, Inc.)
          Primary PHY: LE 1M
          Secondary PHY: No packets
          SID: no ADI field (0xff)
          TX power: 127 dBm
          RSSI: -81 dBm (0xaf)
          Periodic advertising interval: 0.00 msec (0x0000)
          Direct address type: Reserved (0xff)
          Direct address: 00-00-00-00-00-00
          Data length: 0x19
        02 01 06 11 07 00 00 00 00 00 00 00 00 00 00 00  ................
        00 00 01 31 5a 03 09 7a 6d                       ...1Z..zm       
        Flags: 0x06
          LE General Discoverable Mode
          BR/EDR Not Supported
        128-bit Service UUIDs (complete): 1 entry
          Vendor specific
        Name (complete): zm
> HCI Event: LE Meta Event (0x3e) plen 41                                                                            #49 4.613240
      LE Extended Advertising Report (0x0d)
        Num reports: 1
        Entry 0
          Event type: 0x0010
            Props: 0x0010
              Use legacy advertising PDUs
            Data status: [0;32mComplete[0m
          Legacy PDU Type: ADV_NONCONN_IND (0x0010)
          Address type: Random (0x01)
          Address: 2E:43:D5:B1:0F:A0 (Non-Resolvable)
          Primary PHY: LE 1M
          Secondary PHY: No packets
          SID: no ADI field (0xff)
          TX power: 127 dBm
          RSSI: -80 dBm (0xb0)
          Periodic advertising interval: 0.00 msec (0x0000)
          Direct address type: Reserved (0xff)
          Direct address: 00-00-00-00-00-00
          Data length: 0x0f
        02 01 1a 0b ff 4c 00 09 06 03 06 0a 03 0a 49     .....L........I 
        Flags: 0x1a
          LE General Discoverable Mode
          Simultaneous LE and BR/EDR (Controller)
          Simultaneous LE and BR/EDR (Host)
        Company: Apple, Inc. (76)
          Type: Apple TV (9)
          Data[6]: 03060a030a49
> HCI Event: LE Meta Event (0x3e) plen 26                                                                            #50 4.620008
      LE Extended Advertising Report (0x0d)
        Num reports: 1
        Entry 0
          Event type: 0x0000
            Props: 0x0000
            Data status: [0;32mComplete[0m
          Address type: Public (0x00)
          Address: DF:A9:FF:F6:B1:1A (OUI DF-A9-FF)
          Primary PHY: LE 1M
          Secondary PHY: LE 1M
          SID: 0x00
          TX power: 127 dBm
          RSSI: -17 dBm (0xef)
          Periodic advertising interval: 1000.00 msec (0x0320)
          Direct address type: Reserved (0xff)
          Direct address: 00-00-00-00-00-00
          Data length: 0x00
> HCI Event: LE Meta Event (0x3e) plen 57                                                                            #51 4.671504
      LE Extended Advertising Report (0x0d)
        Num reports: 1
        Entry 0
          Event type: 0x0010
            Props: 0x0010
              Use legacy advertising PDUs
            Data status: [0;32mComplete[0m
          Legacy PDU Type: ADV_NONCONN_IND (0x0010)
          Address type: Random (0x01)
          Address: 3A:40:B7:D2:DD:04 (Non-Resolvable)
          Primary PHY: LE 1M
          Secondary PHY: No packets
          SID: no ADI field (0xff)
          TX power: 127 dBm
          RSSI: -89 dBm (0xa7)
          Periodic advertising interval: 0.00 msec (0x0000)
          Direct address type: Reserved (0xff)
          Direct address: 00-00-00-00-00-00
          Data length: 0x1f
        1e ff 06 00 01 09 20 22 6a ca 86 1b 87 38 9b 5d  ...... "j....8.]
        45 13 17 40 8c 5b e1 66 d0 ec 61 7d 55 8c 1d     E..@.[.f..a}U.. 
        Company: Microsoft (6)
          Data[27]: 010920226aca861b87389b5d451317408c5be166d0ec617d558c1d
> HCI Event: LE Meta Event (0x3e) plen 55                                                                            #52 4.683419
      LE Extended Advertising Report (0x0d)
        Num reports: 1
        Entry 0
          Event type: 0x0010
            Props: 0x0010
              Use legacy advertising PDUs
            Data status: [0;32mComplete[0m
          Legacy PDU Type: ADV_NONCONN_IND (0x0010)
          Address type: Random (0x01)
          Address: 2E:49:48:AE:A9:68 (Non-Resolvable)
          Primary PHY: LE 1M
          Secondary PHY: No packets
          SID: no ADI field (0xff)
          TX power: 127 dBm
          RSSI: -81 dBm (0xaf)
          Periodic advertising interval: 0.00 msec (0x0000)
          Direct address type: Reserved (0xff)
          Direct address: 00-00-00-00-00-00
          Data length: 0x1d
        1c ff 06 00 01 09 21 0a 4d e0 8a 52 d2 d4 4c 41  ......!.M..R..LA
        50 54 4f 50 2d 45 35 32 45 4f 44 32 49           PTOP-E52EOD2I   
        Company: Microsoft (6)
          Data[25]: 0109210a4de08a52d2d44c4150544f502d453532454f443249
> HCI Event: LE Meta Event (0x3e) plen 54                                                                            #53 4.718405
      LE Extended Advertising Report (0x0d)
        Num reports: 1
        Entry 0
          Event type: 0x0010
            Props: 0x0010
              Use legacy advertising PDUs
            Data status: [0;32mComplete[0m
          Legacy PDU Type: ADV_NONCONN_IND (0x0010)
          Address type: Public (0x00)
          Address: A4:30:7A:95:74:FB (Samsung Electronics Co.,Ltd)
          Primary PHY: LE 1M
          Secondary PHY: No packets
          SID: no ADI field (0xff)
          TX power: 127 dBm
          RSSI: -87 dBm (0xa9)
          Periodic advertising interval: 0.00 msec (0x0000)
          Direct address type: Reserved (0xff)
          Direct address: 00-00-00-00-00-00
          Data length: 0x1c
        1b ff 75 00 42 04 01 80 6e a4 30 7a 95 74 fb a6  ..u.B...n.0z.t..
        30 7a 95 74 fa 01 d8 41 c5 d9 00 00              0z.t...A....    
        Company: Samsung Electronics Co. Ltd. (117)
          Data[24]: 420401806ea4307a9574fba6307a9574fa01d841c5d90000
> HCI Event: LE Meta Event (0x3e) plen 26                                                                            #54 4.725537
      LE Extended Advertising Report (0x0d)
        Num reports: 1
        Entry 0
          Event type: 0x0000
            Props: 0x0000
            Data status: [0;32mComplete[0m
          Address type: Public (0x00)
          Address: DF:A9:FF:F6:B1:1A (OUI DF-A9-FF)
          Primary PHY: LE 1M
          Secondary PHY: LE 1M
          SID: 0x00
          TX power: 127 dBm
          RSSI: -17 dBm (0xef)
          Periodic advertising interval: 1000.00 msec (0x0320)
          Direct address type: Reserved (0xff)
          Direct address: 00-00-00-00-00-00
          Data length: 0x00
> HCI Event: LE Meta Event (0x3e) plen 38                                                                            #55 4.729266
      LE Extended Advertising Report (0x0d)
        Num reports: 1
        Entry 0
          Event type: 0x0012
            Props: 0x0012
              Scannable
              Use legacy advertising PDUs
            Data status: [0;32mComplete[0m
          Legacy PDU Type: ADV_SCAN_IND (0x0012)
          Address type: Random (0x01)
          Address: 42:E9:03:C6:1B:AF (Resolvable)
          Primary PHY: LE 1M
          Secondary PHY: No packets
          SID: no ADI field (0xff)
          TX power: 127 dBm
          RSSI: -91 dBm (0xa5)
          Periodic advertising interval: 0.00 msec (0x0000)
          Direct address type: Reserved (0xff)
          Direct address: 00-00-00-00-00-00
          Data length: 0x0c
        0b ff 4c 00 09 06 03 00 0a 03 0a 2d              ..L........-    
        Company: Apple, Inc. (76)
          Type: Apple TV (9)
          Data[6]: 03000a030a2d
> HCI Event: LE Meta Event (0x3e) plen 50                                                                            #56 4.777035
      LE Extended Advertising Report (0x0d)
        Num reports: 1
        Entry 0
          Event type: 0x0013
            Props: 0x0013
              Connectable
              Scannable
              Use legacy advertising PDUs
            Data status: [0;32mComplete[0m
          Legacy PDU Type: ADV_IND (0x0013)
          Address type: Public (0x00)
          Address: 7C:49:EB:2C:13:D2 (XIAOMI Electronics,CO.,LTD)
          Primary PHY: LE 1M
          Secondary PHY: No packets
          SID: no ADI field (0xff)
          TX power: 127 dBm
          RSSI: -95 dBm (0xa1)
          Periodic advertising interval: 0.00 msec (0x0000)
          Direct address type: Reserved (0xff)
          Direct address: 00-00-00-00-00-00
          Data length: 0x18
        02 01 06 14 16 95 fe 71 20 13 01 d6 d2 13 2c eb  .......q .....,.
        49 7c 09 05 10 02 00 1d                          I|......        
        Flags: 0x06
          LE General Discoverable Mode
          BR/EDR Not Supported
        Service Data: Xiaomi Inc. (0xfe95)
          Data[17]: 71201301d6d2132ceb497c09051002001d
> HCI Event: LE Meta Event (0x3e) plen 57                                                                            #57 4.779768
      LE Extended Advertising Report (0x0d)
        Num reports: 1
        Entry 0
          Event type: 0x0010
            Props: 0x0010
              Use legacy advertising PDUs
            Data status: [0;32mComplete[0m
          Legacy PDU Type: ADV_NONCONN_IND (0x0010)
          Address type: Random (0x01)
          Address: 3A:40:B7:D2:DD:04 (Non-Resolvable)
          Primary PHY: LE 1M
          Secondary PHY: No packets
          SID: no ADI field (0xff)
          TX power: 127 dBm
          RSSI: -88 dBm (0xa8)
          Periodic advertising interval: 0.00 msec (0x0000)
          Direct address type: Reserved (0xff)
          Direct address: 00-00-00-00-00-00
          Data length: 0x1f
        1e ff 06 00 01 09 20 22 6a ca 86 1b 87 38 9b 5d  ...... "j....8.]
        45 13 17 40 8c 5b e1 66 d0 ec 61 7d 55 8c 1d     E..@.[.f..a}U.. 
        Company: Microsoft (6)
          Data[27]: 010920226aca861b87389b5d451317408c5be166d0ec617d558c1d
> HCI Event: LE Meta Event (0x3e) plen 55                                                                            #58 4.788601
      LE Extended Advertising Report (0x0d)
        Num reports: 1
        Entry 0
          Event type: 0x0010
            Props: 0x0010
              Use legacy advertising PDUs
            Data status: [0;32mComplete[0m
          Legacy PDU Type: ADV_NONCONN_IND (0x0010)
          Address type: Random (0x01)
          Address: 2E:49:48:AE:A9:68 (Non-Resolvable)
          Primary PHY: LE 1M
          Secondary PHY: No packets
          SID: no ADI field (0xff)
          TX power: 127 dBm
          RSSI: -84 dBm (0xac)
          Periodic advertising interval: 0.00 msec (0x0000)
          Direct address type: Reserved (0xff)
          Direct address: 00-00-00-00-00-00
          Data length: 0x1d
        1c ff 06 00 01 09 21 0a 4d e0 8a 52 d2 d4 4c 41  ......!.M..R..LA
        50 54 4f 50 2d 45 35 32 45 4f 44 32 49           PTOP-E52EOD2I   
        Company: Microsoft (6)
          Data[25]: 0109210a4de08a52d2d44c4150544f502d453532454f443249
> HCI Event: LE Meta Event (0x3e) plen 51                                                                            #59 4.791662
      LE Extended Advertising Report (0x0d)
        Num reports: 1
        Entry 0
          Event type: 0x0013
            Props: 0x0013
              Connectable
              Scannable
              Use legacy advertising PDUs
            Data status: [0;32mComplete[0m
          Legacy PDU Type: ADV_IND (0x0013)
          Address type: Public (0x00)
          Address: F0:18:98:96:04:94 (Apple, Inc.)
          Primary PHY: LE 1M
          Secondary PHY: No packets
          SID: no ADI field (0xff)
          TX power: 127 dBm
          RSSI: -81 dBm (0xaf)
          Periodic advertising interval: 0.00 msec (0x0000)
          Direct address type: Reserved (0xff)
          Direct address: 00-00-00-00-00-00
          Data length: 0x19
        02 01 06 11 07 00 00 00 00 00 00 00 00 00 00 00  ................
        00 00 01 31 5a 03 09 7a 6d                       ...1Z..zm       
        Flags: 0x06
          LE General Discoverable Mode
          BR/EDR Not Supported
        128-bit Service UUIDs (complete): 1 entry
          Vendor specific
        Name (complete): zm
> HCI Event: LE Meta Event (0x3e) plen 41                                                                            #60 4.804378
      LE Extended Advertising Report (0x0d)
        Num reports: 1
        Entry 0
          Event type: 0x0010
            Props: 0x0010
              Use legacy advertising PDUs
            Data status: [0;32mComplete[0m
          Legacy PDU Type: ADV_NONCONN_IND (0x0010)
          Address type: Random (0x01)
          Address: 2E:43:D5:B1:0F:A0 (Non-Resolvable)
          Primary PHY: LE 1M
          Secondary PHY: No packets
          SID: no ADI field (0xff)
          TX power: 127 dBm
          RSSI: -80 dBm (0xb0)
          Periodic advertising interval: 0.00 msec (0x0000)
          Direct address type: Reserved (0xff)
          Direct address: 00-00-00-00-00-00
          Data length: 0x0f
        02 01 1a 0b ff 4c 00 09 06 03 06 0a 03 0a 49     .....L........I 
        Flags: 0x1a
          LE General Discoverable Mode
          Simultaneous LE and BR/EDR (Controller)
          Simultaneous LE and BR/EDR (Host)
        Company: Apple, Inc. (76)
          Type: Apple TV (9)
          Data[6]: 03060a030a49
> HCI Event: LE Meta Event (0x3e) plen 50                                                                            #61 4.847443
      LE Extended Advertising Report (0x0d)
        Num reports: 1
        Entry 0
          Event type: 0x0013
            Props: 0x0013
              Connectable
              Scannable
              Use legacy advertising PDUs
            Data status: [0;32mComplete[0m
          Legacy PDU Type: ADV_IND (0x0013)
          Address type: Public (0x00)
          Address: 7C:49:EB:2C:13:D2 (XIAOMI Electronics,CO.,LTD)
          Primary PHY: LE 1M
          Secondary PHY: No packets
          SID: no ADI field (0xff)
          TX power: 127 dBm
          RSSI: -93 dBm (0xa3)
          Periodic advertising interval: 0.00 msec (0x0000)
          Direct address type: Reserved (0xff)
          Direct address: 00-00-00-00-00-00
          Data length: 0x18
        02 01 06 14 16 95 fe 71 20 13 01 d6 d2 13 2c eb  .......q .....,.
        49 7c 09 05 10 02 00 1d                          I|......        
        Flags: 0x06
          LE General Discoverable Mode
          BR/EDR Not Supported
        Service Data: Xiaomi Inc. (0xfe95)
          Data[17]: 71201301d6d2132ceb497c09051002001d
> HCI Event: LE Meta Event (0x3e) plen 38                                                                            #62 4.864038
      LE Extended Advertising Report (0x0d)
        Num reports: 1
        Entry 0
          Event type: 0x0012
            Props: 0x0012
              Scannable
              Use legacy advertising PDUs
            Data status: [0;32mComplete[0m
          Legacy PDU Type: ADV_SCAN_IND (0x0012)
          Address type: Random (0x01)
          Address: 42:E9:03:C6:1B:AF (Resolvable)
          Primary PHY: LE 1M
          Secondary PHY: No packets
          SID: no ADI field (0xff)
          TX power: 127 dBm
          RSSI: -88 dBm (0xa8)
          Periodic advertising interval: 0.00 msec (0x0000)
          Direct address type: Reserved (0xff)
          Direct address: 00-00-00-00-00-00
          Data length: 0x0c
        0b ff 4c 00 09 06 03 00 0a 03 0a 2d              ..L........-    
        Company: Apple, Inc. (76)
          Type: Apple TV (9)
          Data[6]: 03000a030a2d
> HCI Event: LE Meta Event (0x3e) plen 43                                                                            #63 4.918254
      LE Extended Advertising Report (0x0d)
        Num reports: 1
        Entry 0
          Event type: 0x0013
            Props: 0x0013
              Connectable
              Scannable
              Use legacy advertising PDUs
            Data status: [0;32mComplete[0m
          Legacy PDU Type: ADV_IND (0x0013)
          Address type: Random (0x01)
          Address: 5E:90:F9:8C:B3:A6 (Resolvable)
          Primary PHY: LE 1M
          Secondary PHY: No packets
          SID: no ADI field (0xff)
          TX power: 127 dBm
          RSSI: -82 dBm (0xae)
          Periodic advertising interval: 0.00 msec (0x0000)
          Direct address type: Reserved (0xff)
          Direct address: 00-00-00-00-00-00
          Data length: 0x11
        02 01 1a 02 0a 01 0a ff 4c 00 10 05 05 18 d7 2b  ........L......+
        f5                                               .               
        Flags: 0x1a
          LE General Discoverable Mode
          Simultaneous LE and BR/EDR (Controller)
          Simultaneous LE and BR/EDR (Host)
        TX power: 1 dBm
        Company: Apple, Inc. (76)
          Type: Unknown (16)
          Data[5]: 0518d72bf5
> HCI Event: LE Meta Event (0x3e) plen 43                                                                            #64 4.974602
      LE Extended Advertising Report (0x0d)
        Num reports: 1
        Entry 0
          Event type: 0x0013
            Props: 0x0013
              Connectable
              Scannable
              Use legacy advertising PDUs
            Data status: [0;32mComplete[0m
          Legacy PDU Type: ADV_IND (0x0013)
          Address type: Random (0x01)
          Address: 43:AD:14:83:CA:ED (Resolvable)
          Primary PHY: LE 1M
          Secondary PHY: No packets
          SID: no ADI field (0xff)
          TX power: 127 dBm
          RSSI: -79 dBm (0xb1)
          Periodic advertising interval: 0.00 msec (0x0000)
          Direct address type: Reserved (0xff)
          Direct address: 00-00-00-00-00-00
          Data length: 0x11
        02 01 1a 02 0a 01 0a ff 4c 00 10 05 05 18 d7 2b  ........L......+
        f5                                               .               
        Flags: 0x1a
          LE General Discoverable Mode
          Simultaneous LE and BR/EDR (Controller)
          Simultaneous LE and BR/EDR (Host)
        TX power: 1 dBm
        Company: Apple, Inc. (76)
          Type: Unknown (16)
          Data[5]: 0518d72bf5
> HCI Event: LE Meta Event (0x3e) plen 51                                                                            #65 4.976731
      LE Extended Advertising Report (0x0d)
        Num reports: 1
        Entry 0
          Event type: 0x0013
            Props: 0x0013
              Connectable
              Scannable
              Use legacy advertising PDUs
            Data status: [0;32mComplete[0m
          Legacy PDU Type: ADV_IND (0x0013)
          Address type: Public (0x00)
          Address: F0:18:98:96:04:94 (Apple, Inc.)
          Primary PHY: LE 1M
          Secondary PHY: No packets
          SID: no ADI field (0xff)
          TX power: 127 dBm
          RSSI: -81 dBm (0xaf)
          Periodic advertising interval: 0.00 msec (0x0000)
          Direct address type: Reserved (0xff)
          Direct address: 00-00-00-00-00-00
          Data length: 0x19
        02 01 06 11 07 00 00 00 00 00 00 00 00 00 00 00  ................
        00 00 01 31 5a 03 09 7a 6d                       ...1Z..zm       
        Flags: 0x06
          LE General Discoverable Mode
          BR/EDR Not Supported
        128-bit Service UUIDs (complete): 1 entry
          Vendor specific
        Name (complete): zm
> HCI Event: LE Meta Event (0x3e) plen 54                                                                            #66 5.025364
      LE Extended Advertising Report (0x0d)
        Num reports: 1
        Entry 0
          Event type: 0x0010
            Props: 0x0010
              Use legacy advertising PDUs
            Data status: [0;32mComplete[0m
          Legacy PDU Type: ADV_NONCONN_IND (0x0010)
          Address type: Public (0x00)
          Address: A4:30:7A:95:74:FB (Samsung Electronics Co.,Ltd)
          Primary PHY: LE 1M
          Secondary PHY: No packets
          SID: no ADI field (0xff)
          TX power: 127 dBm
          RSSI: -88 dBm (0xa8)
          Periodic advertising interval: 0.00 msec (0x0000)
          Direct address type: Reserved (0xff)
          Direct address: 00-00-00-00-00-00
          Data length: 0x1c
        1b ff 75 00 42 04 01 80 6e a4 30 7a 95 74 fb a6  ..u.B...n.0z.t..
        30 7a 95 74 fa 01 d8 41 c5 d9 00 00              0z.t...A....    
        Company: Samsung Electronics Co. Ltd. (117)
          Data[24]: 420401806ea4307a9574fba6307a9574fa01d841c5d90000
> HCI Event: LE Meta Event (0x3e) plen 26                                                                            #67 5.037873
      LE Extended Advertising Report (0x0d)
        Num reports: 1
        Entry 0
          Event type: 0x0000
            Props: 0x0000
            Data status: [0;32mComplete[0m
          Address type: Public (0x00)
          Address: DF:A9:FF:F6:B1:1A (OUI DF-A9-FF)
          Primary PHY: LE 1M
          Secondary PHY: LE 1M
          SID: 0x00
          TX power: 127 dBm
          RSSI: -17 dBm (0xef)
          Periodic advertising interval: 1000.00 msec (0x0320)
          Direct address type: Reserved (0xff)
          Direct address: 00-00-00-00-00-00
          Data length: 0x00
> HCI Event: LE Meta Event (0x3e) plen 26                                                                            #68 5.142974
      LE Extended Advertising Report (0x0d)
        Num reports: 1
        Entry 0
          Event type: 0x0000
            Props: 0x0000
            Data status: [0;32mComplete[0m
          Address type: Public (0x00)
          Address: DF:A9:FF:F6:B1:1A (OUI DF-A9-FF)
          Primary PHY: LE 1M
          Secondary PHY: LE 1M
          SID: 0x00
          TX power: 127 dBm
          RSSI: -16 dBm (0xf0)
          Periodic advertising interval: 1000.00 msec (0x0320)
          Direct address type: Reserved (0xff)
          Direct address: 00-00-00-00-00-00
          Data length: 0x00
> HCI Event: LE Meta Event (0x3e) plen 51                                                                            #69 5.157623
      LE Extended Advertising Report (0x0d)
        Num reports: 1
        Entry 0
          Event type: 0x0013
            Props: 0x0013
              Connectable
              Scannable
              Use legacy advertising PDUs
            Data status: [0;32mComplete[0m
          Legacy PDU Type: ADV_IND (0x0013)
          Address type: Public (0x00)
          Address: F0:18:98:96:04:94 (Apple, Inc.)
          Primary PHY: LE 1M
          Secondary PHY: No packets
          SID: no ADI field (0xff)
          TX power: 127 dBm
          RSSI: -81 dBm (0xaf)
          Periodic advertising interval: 0.00 msec (0x0000)
          Direct address type: Reserved (0xff)
          Direct address: 00-00-00-00-00-00
          Data length: 0x19
        02 01 06 11 07 00 00 00 00 00 00 00 00 00 00 00  ................
        00 00 01 31 5a 03 09 7a 6d                       ...1Z..zm       
        Flags: 0x06
          LE General Discoverable Mode
          BR/EDR Not Supported
        128-bit Service UUIDs (complete): 1 entry
          Vendor specific
        Name (complete): zm
> HCI Event: LE Meta Event (0x3e) plen 55                                                                            #70 5.208012
      LE Extended Advertising Report (0x0d)
        Num reports: 1
        Entry 0
          Event type: 0x0010
            Props: 0x0010
              Use legacy advertising PDUs
            Data status: [0;32mComplete[0m
          Legacy PDU Type: ADV_NONCONN_IND (0x0010)
          Address type: Random (0x01)
          Address: 2E:49:48:AE:A9:68 (Non-Resolvable)
          Primary PHY: LE 1M
          Secondary PHY: No packets
          SID: no ADI field (0xff)
          TX power: 127 dBm
          RSSI: -81 dBm (0xaf)
          Periodic advertising interval: 0.00 msec (0x0000)
          Direct address type: Reserved (0xff)
          Direct address: 00-00-00-00-00-00
          Data length: 0x1d
        1c ff 06 00 01 09 21 0a 4d e0 8a 52 d2 d4 4c 41  ......!.M..R..LA
        50 54 4f 50 2d 45 35 32 45 4f 44 32 49           PTOP-E52EOD2I   
        Company: Microsoft (6)
          Data[25]: 0109210a4de08a52d2d44c4150544f502d453532454f443249
> HCI Event: LE Meta Event (0x3e) plen 57                                                                            #71 5.209909
      LE Extended Advertising Report (0x0d)
        Num reports: 1
        Entry 0
          Event type: 0x0010
            Props: 0x0010
              Use legacy advertising PDUs
            Data status: [0;32mComplete[0m
          Legacy PDU Type: ADV_NONCONN_IND (0x0010)
          Address type: Random (0x01)
          Address: 3A:40:B7:D2:DD:04 (Non-Resolvable)
          Primary PHY: LE 1M
          Secondary PHY: No packets
          SID: no ADI field (0xff)
          TX power: 127 dBm
          RSSI: -90 dBm (0xa6)
          Periodic advertising interval: 0.00 msec (0x0000)
          Direct address type: Reserved (0xff)
          Direct address: 00-00-00-00-00-00
          Data length: 0x1f
        1e ff 06 00 01 09 20 22 6a ca 86 1b 87 38 9b 5d  ...... "j....8.]
        45 13 17 40 8c 5b e1 66 d0 ec 61 7d 55 8c 1d     E..@.[.f..a}U.. 
        Company: Microsoft (6)
          Data[27]: 010920226aca861b87389b5d451317408c5be166d0ec617d558c1d
> HCI Event: LE Meta Event (0x3e) plen 26                                                                            #72 5.217281
      LE Extended Advertising Report (0x0d)
        Num reports: 1
        Entry 0
          Event type: 0x0010
            Props: 0x0010
              Use legacy advertising PDUs
            Data status: [0;32mComplete[0m
          Legacy PDU Type: ADV_NONCONN_IND (0x0010)
          Address type: Public (0x00)
          Address: 90:CD:B6:41:AD:52 (Hon Hai Precision Ind. Co.,Ltd.)
          Primary PHY: LE 1M
          Secondary PHY: No packets
          SID: no ADI field (0xff)
          TX power: 127 dBm
          RSSI: -83 dBm (0xad)
          Periodic advertising interval: 0.00 msec (0x0000)
          Direct address type: Reserved (0xff)
          Direct address: 00-00-00-00-00-00
          Data length: 0x00
> HCI Event: LE Meta Event (0x3e) plen 38                                                                            #73 5.271726
      LE Extended Advertising Report (0x0d)
        Num reports: 1
        Entry 0
          Event type: 0x0012
            Props: 0x0012
              Scannable
              Use legacy advertising PDUs
            Data status: [0;32mComplete[0m
          Legacy PDU Type: ADV_SCAN_IND (0x0012)
          Address type: Random (0x01)
          Address: 42:E9:03:C6:1B:AF (Resolvable)
          Primary PHY: LE 1M
          Secondary PHY: No packets
          SID: no ADI field (0xff)
          TX power: 127 dBm
          RSSI: -92 dBm (0xa4)
          Periodic advertising interval: 0.00 msec (0x0000)
          Direct address type: Reserved (0xff)
          Direct address: 00-00-00-00-00-00
          Data length: 0x0c
        0b ff 4c 00 09 06 03 00 0a 03 0a 2d              ..L........-    
        Company: Apple, Inc. (76)
          Type: Apple TV (9)
          Data[6]: 03000a030a2d
> HCI Event: LE Meta Event (0x3e) plen 51                                                                            #74 5.338813
      LE Extended Advertising Report (0x0d)
        Num reports: 1
        Entry 0
          Event type: 0x0013
            Props: 0x0013
              Connectable
              Scannable
              Use legacy advertising PDUs
            Data status: [0;32mComplete[0m
          Legacy PDU Type: ADV_IND (0x0013)
          Address type: Public (0x00)
          Address: F0:18:98:96:04:94 (Apple, Inc.)
          Primary PHY: LE 1M
          Secondary PHY: No packets
          SID: no ADI field (0xff)
          TX power: 127 dBm
          RSSI: -80 dBm (0xb0)
          Periodic advertising interval: 0.00 msec (0x0000)
          Direct address type: Reserved (0xff)
          Direct address: 00-00-00-00-00-00
          Data length: 0x19
        02 01 06 11 07 00 00 00 00 00 00 00 00 00 00 00  ................
        00 00 01 31 5a 03 09 7a 6d                       ...1Z..zm       
        Flags: 0x06
          LE General Discoverable Mode
          BR/EDR Not Supported
        128-bit Service UUIDs (complete): 1 entry
          Vendor specific
        Name (complete): zm
> HCI Event: LE Meta Event (0x3e) plen 50                                                                            #75 5.395023
      LE Extended Advertising Report (0x0d)
        Num reports: 1
        Entry 0
          Event type: 0x0013
            Props: 0x0013
              Connectable
              Scannable
              Use legacy advertising PDUs
            Data status: [0;32mComplete[0m
          Legacy PDU Type: ADV_IND (0x0013)
          Address type: Public (0x00)
          Address: 7C:49:EB:2C:13:D2 (XIAOMI Electronics,CO.,LTD)
          Primary PHY: LE 1M
          Secondary PHY: No packets
          SID: no ADI field (0xff)
          TX power: 127 dBm
          RSSI: -94 dBm (0xa2)
          Periodic advertising interval: 0.00 msec (0x0000)
          Direct address type: Reserved (0xff)
          Direct address: 00-00-00-00-00-00
          Data length: 0x18
        02 01 06 14 16 95 fe 71 20 13 01 d6 d2 13 2c eb  .......q .....,.
        49 7c 09 05 10 02 00 1d                          I|......        
        Flags: 0x06
          LE General Discoverable Mode
          BR/EDR Not Supported
        Service Data: Xiaomi Inc. (0xfe95)
          Data[17]: 71201301d6d2132ceb497c09051002001d
> HCI Event: LE Meta Event (0x3e) plen 38                                                                            #76 5.397703
      LE Extended Advertising Report (0x0d)
        Num reports: 1
        Entry 0
          Event type: 0x0012
            Props: 0x0012
              Scannable
              Use legacy advertising PDUs
            Data status: [0;32mComplete[0m
          Legacy PDU Type: ADV_SCAN_IND (0x0012)
          Address type: Random (0x01)
          Address: 42:E9:03:C6:1B:AF (Resolvable)
          Primary PHY: LE 1M
          Secondary PHY: No packets
          SID: no ADI field (0xff)
          TX power: 127 dBm
          RSSI: -88 dBm (0xa8)
          Periodic advertising interval: 0.00 msec (0x0000)
          Direct address type: Reserved (0xff)
          Direct address: 00-00-00-00-00-00
          Data length: 0x0c
        0b ff 4c 00 09 06 03 00 0a 03 0a 2d              ..L........-    
        Company: Apple, Inc. (76)
          Type: Apple TV (9)
          Data[6]: 03000a030a2d
> HCI Event: LE Meta Event (0x3e) plen 56                                                                            #77 5.404393
      LE Extended Advertising Report (0x0d)
        Num reports: 1
        Entry 0
          Event type: 0x0013
            Props: 0x0013
              Connectable
              Scannable
              Use legacy advertising PDUs
            Data status: [0;32mComplete[0m
          Legacy PDU Type: ADV_IND (0x0013)
          Address type: Random (0x01)
          Address: 7A:7A:DB:BC:84:76 (Resolvable)
          Primary PHY: LE 1M
          Secondary PHY: No packets
          SID: no ADI field (0xff)
          TX power: 127 dBm
          RSSI: -89 dBm (0xa7)
          Periodic advertising interval: 0.00 msec (0x0000)
          Direct address type: Reserved (0xff)
          Direct address: 00-00-00-00-00-00
          Data length: 0x1e
        02 01 02 1a ff 4c 00 02 15 18 a5 47 93 5c 75 49  .....L.....G.\uI
        ae af 6d 3e dd a8 4d ff c3 49 40 c1 43 c5        ..m>..M..I@.C.  
        Flags: 0x02
          LE General Discoverable Mode
        Company: Apple, Inc. (76)
          Type: iBeacon (2)
          UUID: c3ff4da8-dd3e-6daf-ae49-755c9347a518
          Version: 16457.17345
          TX power: -59 dB
> HCI Event: LE Meta Event (0x3e) plen 26                                                                            #78 5.458371
      LE Extended Advertising Report (0x0d)
        Num reports: 1
        Entry 0
          Event type: 0x0000
            Props: 0x0000
            Data status: [0;32mComplete[0m
          Address type: Public (0x00)
          Address: DF:A9:FF:F6:B1:1A (OUI DF-A9-FF)
          Primary PHY: LE 1M
          Secondary PHY: LE 1M
          SID: 0x00
          TX power: 127 dBm
          RSSI: -16 dBm (0xf0)
          Periodic advertising interval: 1000.00 msec (0x0320)
          Direct address type: Reserved (0xff)
          Direct address: 00-00-00-00-00-00
          Data length: 0x00
> HCI Event: LE Meta Event (0x3e) plen 16                                                                            #79 5.463638
      LE Periodic Advertising Sync Established (0x0e)
        Status: Success (0x00)
        Sync handle: 110
        Advertising SID: 0x00
        Advertiser address type: Public (0x00)
        Advertiser address: DF:A9:FF:F6:B1:1A (OUI DF-A9-FF)
        Advertiser PHY: LE 1M (0x01)
        Periodic advertising interval: 1000.00 msec (0x0320)
        Advertiser clock accuracy: 0x01
> HCI Event: LE Meta Event (0x3e) plen 11                                                                            #80 5.463735
      LE Periodic Advertising Report (0x0f)
        Sync handle: 110
        TX power: 127 dbm (0x7f)
        RSSI: -16 dBm (0xf0)
        CTE Type: No Constant Tone Extension (0xff)
        Data status: [0;32mComplete[0m
        Data length: 0x03
        Flags: 0x1a
          LE General Discoverable Mode
          Simultaneous LE and BR/EDR (Controller)
          Simultaneous LE and BR/EDR (Host)
> HCI Event: LE Meta Event (0x3e) plen 43                                                                            #81 5.464786
      LE Extended Advertising Report (0x0d)
        Num reports: 1
        Entry 0
          Event type: 0x0013
            Props: 0x0013
              Connectable
              Scannable
              Use legacy advertising PDUs
            Data status: [0;32mComplete[0m
          Legacy PDU Type: ADV_IND (0x0013)
          Address type: Random (0x01)
          Address: 5E:90:F9:8C:B3:A6 (Resolvable)
          Primary PHY: LE 1M
          Secondary PHY: No packets
          SID: no ADI field (0xff)
          TX power: 127 dBm
          RSSI: -82 dBm (0xae)
          Periodic advertising interval: 0.00 msec (0x0000)
          Direct address type: Reserved (0xff)
          Direct address: 00-00-00-00-00-00
          Data length: 0x11
        02 01 1a 02 0a 01 0a ff 4c 00 10 05 05 18 d7 2b  ........L......+
        f5                                               .               
        Flags: 0x1a
          LE General Discoverable Mode
          Simultaneous LE and BR/EDR (Controller)
          Simultaneous LE and BR/EDR (Host)
        TX power: 1 dBm
        Company: Apple, Inc. (76)
          Type: Unknown (16)
          Data[5]: 0518d72bf5
zephyr.exe[242435]: < HCI Command: LE Set Extended Scan Enable (0x08|0x0042) plen 6                                  #82 5.471481
        Extended scan: Disabled (0x00)
        Filter duplicates: Disabled (0x00)
        Duration: 0 msec (0x0000)
        Period: 0.00 sec (0x0000)
> HCI Event: Command Complete (0x0e) plen 4                                                                          #83 5.473876
      LE Set Extended Scan Enable (0x08|0x0042) ncmd 1
        Status: Success (0x00)
> HCI Event: LE Meta Event (0x3e) plen 11                                                                            #84 6.464061
      LE Periodic Advertising Report (0x0f)
        Sync handle: 110
        TX power: 127 dbm (0x7f)
        RSSI: -17 dBm (0xef)
        CTE Type: No Constant Tone Extension (0xff)
        Data status: [0;32mComplete[0m
        Data length: 0x03
        Flags: 0x1a
          LE General Discoverable Mode
          Simultaneous LE and BR/EDR (Controller)
          Simultaneous LE and BR/EDR (Host)
> HCI Event: LE Meta Event (0x3e) plen 20                                                                            #85 6.464169
      LE Broadcast Isochronous Group Info Advertising Report (0x22)
        Sync Handle: 0x006e
        Number BIS: 1
        NSE: 3
        ISO Interval: 10.00 msec (0x0008)
        BN: 1
        PTO: 1
        IRC: 3
        Maximum PDU: 20
        SDU Interval: 10000 us (0x002710)
        Maximum SDU: 20
        PHY: LE 1M (0x01)
        Framing: Unframed (0x00)
        Encryption: 0x00
zephyr.exe[242435]: < HCI Command: LE Broadcast Isochronous Group Create Sync (0x08|0x006b) plen 25                  #86 6.651542
        BIG Handle: 0x00
        BIG Sync Handle: 0x006e
        Encryption: Unencrypted (0x00)
        Broadcast Code[16]: 00000000000000000000000000000000
        Maximum Number Subevents: 0x00
        Timeout: 2550 ms (0x00ff)
        Number of BIS: 1
        BIS ID: 0x01
> HCI Event: Command Status (0x0f) plen 4                                                                            #87 6.652550
      LE Broadcast Isochronous Group Create Sync (0x08|0x006b) ncmd 1
        Status: Success (0x00)
> HCI Event: LE Meta Event (0x3e) plen 11                                                                            #88 7.463938
      LE Periodic Advertising Report (0x0f)
        Sync handle: 110
        TX power: 127 dbm (0x7f)
        RSSI: -17 dBm (0xef)
        CTE Type: No Constant Tone Extension (0xff)
        Data status: [0;32mComplete[0m
        Data length: 0x03
        Flags: 0x1a
          LE General Discoverable Mode
          Simultaneous LE and BR/EDR (Controller)
          Simultaneous LE and BR/EDR (Host)
> HCI Event: LE Meta Event (0x3e) plen 20                                                                            #89 7.464016
      LE Broadcast Isochronous Group Info Advertising Report (0x22)
        Sync Handle: 0x006e
        Number BIS: 1
        NSE: 3
        ISO Interval: 10.00 msec (0x0008)
        BN: 1
        PTO: 1
        IRC: 3
        Maximum PDU: 20
        SDU Interval: 10000 us (0x002710)
        Maximum SDU: 20
        PHY: LE 1M (0x01)
        Framing: Unframed (0x00)
        Encryption: 0x00
> HCI Event: LE Meta Event (0x3e) plen 17                                                                            #90 7.471299
      LE Broadcast Isochronous Group Sync Established (0x1d)
        Status: Success (0x00)
        BIG Handle: 0x00
        Transport Latency: 1020 us (0x0003fc)
        NSE: 3
        BN: 1
        PTO: 1
        IRC: 3
        Maximum PDU: 20
        ISO Interval: 10.00 msec (0x0008)
        Connection Handle #0: 14
zephyr.exe[242435]: < HCI Command: LE Setup Isochronous Data Path (0x08|0x006e) plen 13                              #91 7.471584
        Handle: 14
        Data Path Direction: Output (Controller to Host) (0x01)
        Data Path: HCI (0x00)
        Coding Format: Transparent (0x03)
        Company Codec ID: Ericsson Technology Licensing (0)
        Vendor Codec ID: 0
        Controller Delay: 0 us (0x000000)
        Codec Configuration Length: 0
        Codec Configuration[0]: 
> HCI Event: Command Complete (0x0e) plen 6                                                                          #92 7.472775
      LE Setup Isochronous Data Path (0x08|0x006e) ncmd 1
        Status: Success (0x00)
        Handle: 14
> ISO Data RX: Handle 14 SN 183 flags 0x06 dlen 8 slen 32768                                                         #93 7.481585
        invalid packet size (4 != 8)
        b7 00 00 80                                      ....            
> ISO Data RX: Handle 14 SN 184 flags 0x06 dlen 8 slen 32768                                                         #94 7.491260
        invalid packet size (4 != 8)
        b8 00 00 80                                      ....            
> ISO Data RX: Handle 14 SN 185 flags 0x06 dlen 8 slen 32768                                                         #95 7.501530
        invalid packet size (4 != 8)
        b9 00 00 80                                      ....            
> ISO Data RX: Handle 14 SN 186 flags 0x06 dlen 8 slen 32768                                                         #96 7.511439
        invalid packet size (4 != 8)
        ba 00 00 80                                      ....            
> ISO Data RX: Handle 14 SN 187 flags 0x06 dlen 8 slen 32768                                                         #97 7.521274
        invalid packet size (4 != 8)
        bb 00 00 80                                      ....            
> ISO Data RX: Handle 14 SN 188 flags 0x06 dlen 8 slen 32768                                                         #98 7.531370
        invalid packet size (4 != 8)
        bc 00 00 80                                      ....            
> ISO Data RX: Handle 14 SN 189 flags 0x06 dlen 8 slen 32768                                                         #99 7.541350
        invalid packet size (4 != 8)
        bd 00 00 80                                      ....            
> ISO Data RX: Handle 14 SN 190 flags 0x06 dlen 8 slen 32768                                                        #100 7.551219
        invalid packet size (4 != 8)
        be 00 00 80                                      ....            
> ISO Data RX: Handle 14 SN 191 flags 0x06 dlen 8 slen 32768                                                        #101 7.561518
        invalid packet size (4 != 8)
        bf 00 00 80                                      ....            
> ISO Data RX: Handle 14 SN 192 flags 0x06 dlen 8 slen 32768                                                        #102 7.571780
        invalid packet size (4 != 8)
        c0 00 00 80                                      ....            
> ISO Data RX: Handle 14 SN 193 flags 0x06 dlen 8 slen 32768                                                        #103 7.581304
        invalid packet size (4 != 8)
        c1 00 00 80                                      ....            
> ISO Data RX: Handle 14 SN 194 flags 0x06 dlen 8 slen 32768                                                        #104 7.591801
        invalid packet size (4 != 8)
        c2 00 00 80                                      ....            
> ISO Data RX: Handle 14 SN 195 flags 0x06 dlen 8 slen 32768                                                        #105 7.601198
        invalid packet size (4 != 8)
        c3 00 00 80                                      ....            
> ISO Data RX: Handle 14 SN 196 flags 0x06 dlen 8 slen 32768                                                        #106 7.611347
        invalid packet size (4 != 8)
        c4 00 00 80                                      ....            
> ISO Data RX: Handle 14 SN 197 flags 0x06 dlen 8 slen 32768                                                        #107 7.621242
        invalid packet size (4 != 8)
        c5 00 00 80                                      ....            
> ISO Data RX: Handle 14 SN 198 flags 0x06 dlen 8 slen 32768                                                        #108 7.631086
        invalid packet size (4 != 8)
        c6 00 00 80                                      ....            
> ISO Data RX: Handle 14 SN 199 flags 0x06 dlen 8 slen 32768                                                        #109 7.641186
        invalid packet size (4 != 8)
        c7 00 00 80                                      ....            
> ISO Data RX: Handle 14 SN 200 flags 0x06 dlen 8 slen 32768                                                        #110 7.651230
        invalid packet size (4 != 8)
        c8 00 00 80                                      ....            
> ISO Data RX: Handle 14 SN 201 flags 0x06 dlen 8 slen 32768                                                        #111 7.661225
        invalid packet size (4 != 8)
        c9 00 00 80                                      ....            
> ISO Data RX: Handle 14 SN 202 flags 0x06 dlen 8 slen 32768                                                        #112 7.671240
        invalid packet size (4 != 8)
        ca 00 00 80                                      ....            
> ISO Data RX: Handle 14 SN 203 flags 0x06 dlen 8 slen 32768                                                        #113 7.681257
        invalid packet size (4 != 8)
        cb 00 00 80                                      ....            
> ISO Data RX: Handle 14 SN 204 flags 0x06 dlen 8 slen 32768                                                        #114 7.691251
        invalid packet size (4 != 8)
        cc 00 00 80                                      ....            
> ISO Data RX: Handle 14 SN 205 flags 0x06 dlen 8 slen 32768                                                        #115 7.701251
        invalid packet size (4 != 8)
        cd 00 00 80                                      ....            
> ISO Data RX: Handle 14 SN 206 flags 0x06 dlen 18 slen 10                                                          #116 7.711706
        invalid packet size (14 != 18)
        ce 00 0a 00 01 02 03 04 05 06 07 08 09 0a        ..............  
> ISO Data RX: Handle 14 SN 207 flags 0x06 dlen 18 slen 10                                                          #117 7.721838
        invalid packet size (14 != 18)
        cf 00 0a 00 01 02 03 04 05 06 07 08 09 0a        ..............  
> ISO Data RX: Handle 14 SN 208 flags 0x06 dlen 18 slen 10                                                          #118 7.731567
        invalid packet size (14 != 18)
        d0 00 0a 00 01 02 03 04 05 06 07 08 09 0a        ..............  
> ISO Data RX: Handle 14 SN 209 flags 0x06 dlen 18 slen 10                                                          #119 7.741845
        invalid packet size (14 != 18)
        d1 00 0a 00 01 02 03 04 05 06 07 08 09 0a        ..............  
> ISO Data RX: Handle 14 SN 210 flags 0x06 dlen 18 slen 10                                                          #120 7.751528
        invalid packet size (14 != 18)
        d2 00 0a 00 01 02 03 04 05 06 07 08 09 0a        ..............  
> ISO Data RX: Handle 14 SN 211 flags 0x06 dlen 18 slen 10                                                          #121 7.761315
        invalid packet size (14 != 18)
        d3 00 0a 00 01 02 03 04 05 06 07 08 09 0a        ..............  
> ISO Data RX: Handle 14 SN 212 flags 0x06 dlen 18 slen 10                                                          #122 7.771300
        invalid packet size (14 != 18)
        d4 00 0a 00 01 02 03 04 05 06 07 08 09 0a        ..............  
> ISO Data RX: Handle 14 SN 213 flags 0x06 dlen 18 slen 10                                                          #123 7.781708
        invalid packet size (14 != 18)
        d5 00 0a 00 01 02 03 04 05 06 07 08 09 0a        ..............  
> ISO Data RX: Handle 14 SN 214 flags 0x06 dlen 8 slen 32768                                                        #124 7.792166
        invalid packet size (4 != 8)
        d6 00 00 80                                      ....            
> ISO Data RX: Handle 14 SN 215 flags 0x06 dlen 8 slen 32768                                                        #125 7.802227
        invalid packet size (4 != 8)
        d7 00 00 80                                      ....            
> ISO Data RX: Handle 14 SN 216 flags 0x06 dlen 8 slen 32768                                                        #126 7.811942
        invalid packet size (4 != 8)
        d8 00 00 80                                      ....            
> ISO Data RX: Handle 14 SN 217 flags 0x06 dlen 8 slen 32768                                                        #127 7.822092
        invalid packet size (4 != 8)
        d9 00 00 80                                      ....            
> ISO Data RX: Handle 14 SN 218 flags 0x06 dlen 8 slen 32768                                                        #128 7.832671
        invalid packet size (4 != 8)
        da 00 00 80                                      ....            
> ISO Data RX: Handle 14 SN 219 flags 0x06 dlen 8 slen 32768                                                        #129 7.842062
        invalid packet size (4 != 8)
        db 00 00 80                                      ....            
> ISO Data RX: Handle 14 SN 220 flags 0x06 dlen 8 slen 32768                                                        #130 7.851964
        invalid packet size (4 != 8)
        dc 00 00 80                                      ....            
> ISO Data RX: Handle 14 SN 221 flags 0x06 dlen 8 slen 32768                                                        #131 7.862202
        invalid packet size (4 != 8)
        dd 00 00 80                                      ....            
> ISO Data RX: Handle 14 SN 222 flags 0x06 dlen 8 slen 32768                                                        #132 7.871848
        invalid packet size (4 != 8)
        de 00 00 80                                      ....            
> ISO Data RX: Handle 14 SN 223 flags 0x06 dlen 8 slen 32768                                                        #133 7.882309
        invalid packet size (4 != 8)
        df 00 00 80                                      ....            
> ISO Data RX: Handle 14 SN 224 flags 0x06 dlen 8 slen 32768                                                        #134 7.892281
        invalid packet size (4 != 8)
        e0 00 00 80                                      ....            
> ISO Data RX: Handle 14 SN 225 flags 0x06 dlen 8 slen 32768                                                        #135 7.902089
        invalid packet size (4 != 8)
        e1 00 00 80                                      ....            
> ISO Data RX: Handle 14 SN 226 flags 0x06 dlen 8 slen 32768                                                        #136 7.912715
        invalid packet size (4 != 8)
        e2 00 00 80                                      ....            
> ISO Data RX: Handle 14 SN 227 flags 0x06 dlen 8 slen 32768                                                        #137 7.922005
        invalid packet size (4 != 8)
        e3 00 00 80                                      ....            
> ISO Data RX: Handle 14 SN 228 flags 0x06 dlen 8 slen 32768                                                        #138 7.932246
        invalid packet size (4 != 8)
        e4 00 00 80                                      ....            
> ISO Data RX: Handle 14 SN 229 flags 0x06 dlen 8 slen 32768                                                        #139 7.942194
        invalid packet size (4 != 8)
        e5 00 00 80                                      ....            
> ISO Data RX: Handle 14 SN 230 flags 0x06 dlen 8 slen 32768                                                        #140 7.952033
        invalid packet size (4 != 8)
        e6 00 00 80                                      ....            
> ISO Data RX: Handle 14 SN 231 flags 0x06 dlen 8 slen 32768                                                        #141 7.962068
        invalid packet size (4 != 8)
        e7 00 00 80                                      ....            
> ISO Data RX: Handle 14 SN 232 flags 0x06 dlen 8 slen 32768                                                        #142 7.971916
        invalid packet size (4 != 8)
        e8 00 00 80                                      ....            
> ISO Data RX: Handle 14 SN 233 flags 0x06 dlen 8 slen 32768                                                        #143 7.982171
        invalid packet size (4 != 8)
        e9 00 00 80                                      ....            
> ISO Data RX: Handle 14 SN 234 flags 0x06 dlen 8 slen 32768                                                        #144 7.992066
        invalid packet size (4 != 8)
        ea 00 00 80                                      ....            
> ISO Data RX: Handle 14 SN 235 flags 0x06 dlen 8 slen 32768                                                        #145 8.001892
        invalid packet size (4 != 8)
        eb 00 00 80                  