Bluetooth monitor ver 5.72
= Note: Linux version 6.14.0-36-generic (x86_64)                       0.010465
= Note: Bluetooth subsystem version 2.22                               0.010466
= New Index: 00:00:00:00:00:00 (Primary,UART,hci1)              [hci1] 0.010467
= New Index: 48:5F:99:8E:E0:64 (Primary,USB,hci0)               [hci0] 0.010468
= Open Index: 00:00:00:00:00:00                                 [hci1] 0.524103
= Index Info: 00:00:00:00:00:00 (Nordic Semiconductor ASA)      [hci1] 0.524138
@ USER Open: main (privileged) version 2.22            {0x0001} [hci1] 0.524148
< HCI Command: Reset (0x03|0x0003) plen 0                    #1 [hci1] 0.525409
> HCI Event: Command Complete (0x0e) plen 4                  #2 [hci1] 0.525946
      Reset (0x03|0x0003) ncmd 1
        Status: Success (0x00)
< HCI Command: Read Local Supported... (0x04|0x0003) plen 0  #3 [hci1] 0.543893
> HCI Event: Command Complete (0x0e) plen 12                 #4 [hci1] 0.544429
      Read Local Supported Features (0x04|0x0003) ncmd 1
        Status: Success (0x00)
        Features: 0x00 0x00 0x00 0x00 0x60 0x00 0x00 0x00
          BR/EDR Not Supported
          LE Supported (Controller)
< HCI Command: Read Local Version In.. (0x04|0x0001) plen 0  #5 [hci1] 0.563671
> HCI Event: Command Complete (0x0e) plen 12                 #6 [hci1] 0.564192
      Read Local Version Information (0x04|0x0001) ncmd 1
        Status: Success (0x00)
        HCI version: Reserved (0x0f) - Revision 12393 (0x3069)
        LMP version: Reserved (0x0f) - Subversion 12393 (0x3069)
        Manufacturer: Nordic Semiconductor ASA (89)
< HCI Command: Read Local Supported... (0x04|0x0002) plen 0  #7 [hci1] 0.583564
> HCI Event: Command Complete (0x0e) plen 68                 #8 [hci1] 0.584576
      Read Local Supported Commands (0x04|0x0002) ncmd 1
        Status: Success (0x00)
        Commands: 119 entries
          Disconnect (Octet 0 - Bit 5)
          Read Remote Version Information (Octet 2 - Bit 7)
          Set Event Mask (Octet 5 - Bit 6)
          Reset (Octet 5 - Bit 7)
          Read Connection Accept Timeout (Octet 7 - Bit 2)
          Write Connection Accept Timeout (Octet 7 - Bit 3)
          Read Transmit Power Level (Octet 10 - Bit 2)
          Set Controller To Host Flow Control (Octet 10 - Bit 5)
          Host Buffer Size (Octet 10 - Bit 6)
          Host Number of Completed Packets (Octet 10 - Bit 7)
          Read Local Version Information (Octet 14 - Bit 3)
          Read Local Supported Features (Octet 14 - Bit 5)
          Read BD ADDR (Octet 15 - Bit 1)
          Read RSSI (Octet 15 - Bit 5)
          Set Event Mask Page 2 (Octet 22 - Bit 2)
          LE Set Event Mask (Octet 25 - Bit 0)
          LE Read Buffer Size (Octet 25 - Bit 1)
          LE Read Local Supported Features (Octet 25 - Bit 2)
          LE Set Random Address (Octet 25 - Bit 4)
          LE Set Advertising Parameters (Octet 25 - Bit 5)
          LE Read Advertising Channel TX Power (Octet 25 - Bit 6)
          LE Set Advertising Data (Octet 25 - Bit 7)
          LE Set Scan Response Data (Octet 26 - Bit 0)
          LE Set Advertise Enable (Octet 26 - Bit 1)
          LE Set Scan Parameters (Octet 26 - Bit 2)
          LE Set Scan Enable (Octet 26 - Bit 3)
          LE Create Connection (Octet 26 - Bit 4)
          LE Create Connection Cancel (Octet 26 - Bit 5)
          LE Read Accept List Size (Octet 26 - Bit 6)
          LE Clear Accept List (Octet 26 - Bit 7)
          LE Add Device To Accept List (Octet 27 - Bit 0)
          LE Remove Device From Accept List (Octet 27 - Bit 1)
          LE Connection Update (Octet 27 - Bit 2)
          LE Set Host Channel Classification (Octet 27 - Bit 3)
          LE Read Channel Map (Octet 27 - Bit 4)
          LE Read Remote Used Features (Octet 27 - Bit 5)
          LE Encrypt (Octet 27 - Bit 6)
          LE Rand (Octet 27 - Bit 7)
          LE Start Encryption (Octet 28 - Bit 0)
          LE Long Term Key Request Reply (Octet 28 - Bit 1)
          LE Long Term Key Request Neg Reply (Octet 28 - Bit 2)
          LE Read Supported States (Octet 28 - Bit 3)
          LE Receiver Test (Octet 28 - Bit 4)
          LE Transmitter Test (Octet 28 - Bit 5)
          LE Test End (Octet 28 - Bit 6)
          Read Authenticated Payload Timeout (Octet 32 - Bit 4)
          Write Authenticated Payload Timeout (Octet 32 - Bit 5)
          LE Set Data Length (Octet 33 - Bit 6)
          LE Read Suggested Default Data Length (Octet 33 - Bit 7)
          LE Write Suggested Default Data Length (Octet 34 - Bit 0)
          LE Add Device To Resolving List (Octet 34 - Bit 3)
          LE Remove Device From Resolving List (Octet 34 - Bit 4)
          LE Clear Resolving List (Octet 34 - Bit 5)
          LE Read Resolving List Size (Octet 34 - Bit 6)
          LE Set Address Resolution Enable (Octet 35 - Bit 1)
          LE Set Resolvable Private Address Timeout (Octet 35 - Bit 2)
          LE Read Maximum Data Length (Octet 35 - Bit 3)
          LE Read PHY (Octet 35 - Bit 4)
          LE Set Default PHY (Octet 35 - Bit 5)
          LE Set PHY (Octet 35 - Bit 6)
          LE Enhanced Receiver Test (Octet 35 - Bit 7)
          LE Enhanced Transmitter Test (Octet 36 - Bit 0)
          LE Set Advertising Set Random Address (Octet 36 - Bit 1)
          LE Set Extended Advertising Parameters (Octet 36 - Bit 2)
          LE Set Extended Advertising Data (Octet 36 - Bit 3)
          LE Set Extended Scan Response Data (Octet 36 - Bit 4)
          LE Set Extended Advertising Enable (Octet 36 - Bit 5)
          LE Read Maximum Advertising Data Length (Octet 36 - Bit 6)
          LE Read Number of Supported Advertising Sets (Octet 36 - Bit 7)
          LE Remove Advertising Set (Octet 37 - Bit 0)
          LE Clear Advertising Sets (Octet 37 - Bit 1)
          LE Set Periodic Advertising Parameters (Octet 37 - Bit 2)
          LE Set Periodic Advertising Data (Octet 37 - Bit 3)
          LE Set Periodic Advertising Enable (Octet 37 - Bit 4)
          LE Set Extended Scan Parameters (Octet 37 - Bit 5)
          LE Set Extended Scan Enable (Octet 37 - Bit 6)
          LE Extended Create Connection (Octet 37 - Bit 7)
          LE Periodic Advertising Create Sync (Octet 38 - Bit 0)
          LE Periodic Advertising Create Sync Cancel (Octet 38 - Bit 1)
          LE Periodic Advertising Terminate Sync (Octet 38 - Bit 2)
          LE Add Device To Periodic Advertiser List (Octet 38 - Bit 3)
          LE Remove Device From Periodic Advertiser List (Octet 38 - Bit 4)
          LE Clear Periodic Advertiser List (Octet 38 - Bit 5)
          LE Read Periodic Advertiser List Size (Octet 38 - Bit 6)
          LE Read Transmit Power (Octet 38 - Bit 7)
          LE Read RF Path Compensation (Octet 39 - Bit 0)
          LE Write RF Path Compensation (Octet 39 - Bit 1)
          LE Set Privacy Mode (Octet 39 - Bit 2)
          LE Periodic Advertising Receive Enable (Octet 40 - Bit 5)
          LE Periodic Advertising Sync Transfer (Octet 40 - Bit 6)
          LE Periodic Advertising Set Info Transfer (Octet 40 - Bit 7)
          LE Periodic Advertising Sync Transfer Parameters (Octet 41 - Bit 0)
          LE Set Default Periodic Advertisng Sync Transfer Parameters (Octet 41 - Bit 1)
          LE Read Buffer v2 (Octet 41 - Bit 5)
          LE Read ISO TX Sync (Octet 41 - Bit 6)
          LE Set Connected Isochronous Group Parameters (Octet 41 - Bit 7)
          LE Set Connected Isochronous Group Parameters Test (Octet 42 - Bit 0)
          LE Create Connected Isochronous Stream (Octet 42 - Bit 1)
          LE Remove Connected Isochronous Group (Octet 42 - Bit 2)
          LE Accept Connected Isochronous Stream Request (Octet 42 - Bit 3)
          LE Reject Connected Isochronous Stream Request (Octet 42 - Bit 4)
          LE Create Broadcast Isochronous Group (Octet 42 - Bit 5)
          LE Create Broadcast Isochronous Group Test (Octet 42 - Bit 6)
          LE Terminate Broadcast Isochronous Group (Octet 42 - Bit 7)
          LE Broadcast Isochronous Group Create Sync (Octet 43 - Bit 0)
          LE Broadcast Isochronous Group Terminate Sync (Octet 43 - Bit 1)
          LE Request Peer SCA (Octet 43 - Bit 2)
          LE Setup Isochronous Data Path (Octet 43 - Bit 3)
          LE Remove Isochronous Data Path (Octet 43 - Bit 4)
          LE Isochronous Transmit Test (Octet 43 - Bit 5)
          LE Isochronous Receive Test (Octet 43 - Bit 6)
          LE Isochronous Read Test Counters (Octet 43 - Bit 7)
          LE Isochronous Read Test Counters (Octet 44 - Bit 0)
          LE Set Host Feature (Octet 44 - Bit 1)
          Octet 44 - Bit 2 
          Octet 45 - Bit 6 
          Octet 46 - Bit 0 
          Octet 46 - Bit 1 
          Octet 46 - Bit 2 
< HCI Command: Host Buffer Size (0x03|0x0033) plen 7         #9 [hci1] 0.603520
        ACL MTU: 255  ACL max packet: 16
        SCO MTU: 0    SCO max packet: 0
> HCI Event: Command Complete (0x0e) plen 4                 #10 [hci1] 0.604092
      Host Buffer Size (0x03|0x0033) ncmd 1
        Status: Success (0x00)
< HCI Command: Set Controller To Ho.. (0x03|0x0031) plen 1  #11 [hci1] 0.623572
        Flow control: ACL Data Packets (0x01)
> HCI Event: Command Complete (0x0e) plen 4                 #12 [hci1] 0.623953
      Set Controller To Host Flow Control (0x03|0x0031) ncmd 1
        Status: Success (0x00)
< HCI Command: LE Read Local Suppor.. (0x08|0x0003) plen 0  #13 [hci1] 0.643560
> HCI Event: Command Complete (0x0e) plen 12                #14 [hci1] 0.644068
      LE Read Local Supported Features (0x08|0x0003) ncmd 1
        Status: Success (0x00)
        Features: 0xfd 0x79 0x00 0xf7 0x30 0x01 0x00 0x00
          LE Encryption
          Extended Reject Indication
          Peripheral-initiated Features Exchange
          LE Ping
          LE Data Packet Length Extension
          LL Privacy
          Extended Scanner Filter Policies
          LE 2M PHY
          LE Coded PHY
          LE Extended Advertising
          LE Periodic Advertising
          Channel Selection Algorithm #2
          Periodic Advertising Sync Transfer - Sender
          Periodic Advertising Sync Transfer - Recipient
          Sleep Clock Accuracy Updates
          Connected Isochronous Stream - Central
          Connected Isochronous Stream - Peripheral
          Isochronous Broadcaster
          Synchronized Receiver
          Periodic Advertising ADI support
          Connection Subrating
          Unknown features (0x0000010000000000)
< HCI Command: LE Set Host Feature (0x08|0x0074) plen 2     #15 [hci1] 0.663511
        Bit Number: 32
          Connected Isochronous Stream (Host Support)
        Bit Value: 1
> HCI Event: Command Complete (0x0e) plen 4                 #16 [hci1] 0.663913
      LE Set Host Feature (0x08|0x0074) ncmd 1
        Status: Success (0x00)
< HCI Command: LE Read Buffer v2 (0x08|0x0060) plen 0       #17 [hci1] 0.683555
> HCI Event: Command Complete (0x0e) plen 10                #18 [hci1] 0.684061
      LE Read Buffer v2 (0x08|0x0060) ncmd 1
        Status: Success (0x00)
        ACL MTU: 27
        ACL max packet: 3
        ISO MTU: 318
        ISO max packet: 3
< HCI Command: LE Read Maximum Adve.. (0x08|0x003a) plen 0  #19 [hci1] 0.703599
> HCI Event: Command Complete (0x0e) plen 6                 #20 [hci1] 0.704078
      LE Read Maximum Advertising Data Length (0x08|0x003a) ncmd 1
        Status: Success (0x00)
        Max length: 1650
< HCI Command: LE Read Supported St.. (0x08|0x001c) plen 0  #21 [hci1] 0.723562
> HCI Event: Command Complete (0x0e) plen 12                #22 [hci1] 0.724068
      LE Read Supported States (0x08|0x001c) ncmd 1
        Status: Success (0x00)
        States: 0x000003ff3e0306ff
          Non-connectable Advertising State
          Scannable Advertising State
          Connectable Advertising State
          High Duty Cycle Directed Advertising State
          Passive Scanning State
          Active Scanning State
          Initiating State
            and Connection State (Central Role)
          Connection State (Peripheral Role)
          Scannable Advertising State
            and Passive Scanning State
          Connectable Advertising State
            and Passive Scanning State
          Non-connectable Advertising State
            and Initiating State
          Scannable Advertising State
            and Initiating State
          Active Scanning State
            and Connection State (Central Role)
          Passive Scanning State
            and Connection State (Peripheral Role)
          Active Scanning State
            and Connection State (Peripheral Role)
          Initiating State
            and Connection State (Central Role)
            and Central Role & Central Role
          Low Duty Cycle Directed Advertising State
          Connectable Advertising State
            and Initiating State
            and Central Role & Peripheral Role
          High Duty Cycle Directed Advertising State
            and Initiating State
            and Central Role & Peripheral Role
          Low Duty Cycle Directed Advertising State
            and Initiating State
            and Central Role & Peripheral Role
          Connectable Advertising State
            and Connection State (Central Role)
            and Central Role & Peripheral Role
          High Duty Cycle Directed Advertising State
            and Connection State (Central Role)
            and Central Role & Peripheral Role
          Low Duty Cycle Directed Advertising State
            and Connection State (Central Role)
            and Central Role & Peripheral Role
          Connectable Advertising State
            and Connection State (Peripheral Role)
            and Central Role & Peripheral Role
          High Duty Cycle Directed Advertising State
            and Connection State (Peripheral Role)
            and Peripheral Role & Peripheral Role
          Low Duty Cycle Directed Advertising State
            and Connection State (Peripheral Role)
            and Peripheral Role & Peripheral Role
          Initiating State
            and Connection State (Peripheral Role)
            and Central Role & Peripheral Role
< HCI Command: LE Read Maximum Data.. (0x08|0x002f) plen 0  #23 [hci1] 0.743574
> HCI Event: Command Complete (0x0e) plen 12                #24 [hci1] 0.744068
      LE Read Maximum Data Length (0x08|0x002f) ncmd 1
        Status: Success (0x00)
        Max TX octets: 251
        Max TX time: 2704
        Max RX octets: 251
        Max RX time: 2704
< HCI Command: LE Write Suggested D.. (0x08|0x0024) plen 4  #25 [hci1] 0.763568
        TX octets: 251
        TX time: 2704
> HCI Event: Command Complete (0x0e) plen 4                 #26 [hci1] 0.764029
      LE Write Suggested Default Data Length (0x08|0x0024) ncmd 1
        Status: Success (0x00)
< HCI Command: LE Read Resolving Li.. (0x08|0x002a) plen 0  #27 [hci1] 0.783568
> HCI Event: Command Complete (0x0e) plen 5                 #28 [hci1] 0.784012
      LE Read Resolving List Size (0x08|0x002a) ncmd 1
        Status: Success (0x00)
        Size: 8
< HCI Command: LE Set Event Mask (0x08|0x0001) plen 8       #29 [hci1] 0.803578
        Mask: 0x000002023f87fa5e
          LE Advertising Report
          LE Connection Update Complete
          LE Read Remote Used Features Complete
          LE Long Term Key Request
          LE Data Length Change
          LE Enhanced Connection Complete
          LE PHY Update Complete
          LE Extended Advertising Report
          LE Periodic Advertising Sync Established
          LE Periodic Advertising Report
          LE Periodic Advertising Sync Lost
          LE Extended Scan Timeout
          LE Extended Advertising Set Terminated
          LE Scan Request Received
          LE Periodic Advertising Sync Transfer Rvc
          LE CIS Established
          LE CIS Request
          LE Create BIG Complete
          LE Terminate BIG Complete
          LE BIG Sync Estabilished Complete
          LE BIG Sync Lost
          LE BIG Info Advertising Report
          Unknown mask (0x0000020000000000)
> HCI Event: Command Complete (0x0e) plen 4                 #30 [hci1] 0.804165
      LE Set Event Mask (0x08|0x0001) ncmd 1
        Status: Success (0x00)
< HCI Command: Set Event Mask (0x03|0x0001) plen 8          #31 [hci1] 0.823597
        Mask: 0x2000800002008890
          Disconnection Complete
          Encryption Change
          Read Remote Version Information Complete
          Hardware Error
          Data Buffer Overflow
          Encryption Key Refresh Complete
          LE Meta
> HCI Event: Command Complete (0x0e) plen 4                 #32 [hci1] 0.824132
      Set Event Mask (0x03|0x0001) ncmd 1
        Status: Success (0x00)
< HCI Command: Read BD ADDR (0x04|0x0009) plen 0            #33 [hci1] 0.843576
> HCI Event: Command Complete (0x0e) plen 10                #34 [hci1] 0.844096
      Read BD ADDR (0x04|0x0009) ncmd 1
        Status: Success (0x00)
        Address: 00:00:00:00:00:00 (OUI 00-00-00)
< HCI Command: LE Set Random Address (0x08|0x0005) plen 6   #35 [hci1] 0.863583
        Address: D5:B6:CC:31:DB:3B (Static)
> HCI Event: Command Complete (0x0e) plen 4                 #36 [hci1] 0.864085
      LE Set Random Address (0x08|0x0005) ncmd 1
        Status: Success (0x00)
< HCI Command: LE Set Extended Adv.. (0x08|0x0036) plen 25  #37 [hci1] 3.426380
        Handle: 0x00
        Properties: 0x0013
          Connectable
          Scannable
          Use legacy advertising PDUs: ADV_IND
        Min advertising interval: 100.000 msec (0x00a0)
        Max advertising interval: 150.000 msec (0x00f0)
        Channel map: 37, 38, 39 (0x07)
        Own address type: Random (0x01)
        Peer address type: Public (0x00)
        Peer address: 00:00:00:00:00:00 (OUI 00-00-00)
        Filter policy: Allow Scan Request from Any, Allow Connect Request from Any (0x00)
        TX power: Host has no preference (0x7f)
        Primary PHY: LE 1M (0x01)
        Secondary max skip: 0x00
        Secondary PHY: LE 1M (0x01)
        SID: 0x00
        Scan request notifications: Disabled (0x00)
> HCI Event: Command Complete (0x0e) plen 5                 #38 [hci1] 3.427113
      LE Set Extended Advertising Parameters (0x08|0x0036) ncmd 1
        Status: Success (0x00)
        TX power (selected): 0 dbm (0x00)
< HCI Command: LE Set Advertising S.. (0x08|0x0035) plen 7  #39 [hci1] 3.443545
        Advertising handle: 0x00
        Advertising random address: D5:B6:CC:31:DB:3B (Static)
> HCI Event: Command Complete (0x0e) plen 4                 #40 [hci1] 3.444037
      LE Set Advertising Set Random Address (0x08|0x0035) ncmd 1
        Status: Success (0x00)
< HCI Command: LE Set Extended Adv.. (0x08|0x0037) plen 22  #41 [hci1] 3.463571
        Handle: 0x00
        Operation: Complete extended advertising data (0x03)
        Fragment preference: Minimize fragmentation (0x01)
        Data length: 0x12
        Flags: 0x06
          LE General Discoverable Mode
          BR/EDR Not Supported
        Name (complete): Tester_F6B11A
> HCI Event: Command Complete (0x0e) plen 4                 #42 [hci1] 3.464232
      LE Set Extended Advertising Data (0x08|0x0037) ncmd 1
        Status: Success (0x00)
< HCI Command: LE Set Extended Scan.. (0x08|0x0038) plen 4  #43 [hci1] 3.483622
        Handle: 0x00
        Operation: Complete scan response data (0x03)
        Fragment preference: Minimize fragmentation (0x01)
        Data length: 0x00
> HCI Event: Command Complete (0x0e) plen 4                 #44 [hci1] 3.484104
      LE Set Extended Scan Response Data (0x08|0x0038) ncmd 1
        Status: Success (0x00)
< HCI Command: LE Set Extended Adve.. (0x08|0x0039) plen 6  #45 [hci1] 3.503648
        Extended advertising: Enabled (0x01)
        Number of sets: 1 (0x01)
        Entry 0
          Handle: 0x00
          Duration: 0 ms (0x00)
          Max ext adv events: 0
> HCI Event: Command Complete (0x0e) plen 4                 #46 [hci1] 3.504222
      LE Set Extended Advertising Enable (0x08|0x0039) ncmd 1
        Status: Success (0x00)
> HCI Event: LE Meta Event (0x3e) plen 31                   #47 [hci1] 3.613451
      LE Enhanced Connection Complete (0x0a)
        Status: Success (0x00)
        Handle: 363
        Role: Peripheral (0x01)
        Peer address type: Public (0x00)
        Peer address: DF:A9:FF:F6:B1:1A (OUI DF-A9-FF)
        Local resolvable private address: 00:00:00:00:00:00 (Non-Resolvable)
        Peer resolvable private address: 00:00:00:00:00:00 (Non-Resolvable)
        Connection interval: 87.50 msec (0x0046)
        Connection latency: 0 (0x0000)
        Supervision timeout: 25120 msec (0x09d0)
        Central clock accuracy: 0x01
> HCI Event: LE Meta Event (0x3e) plen 6                    #48 [hci1] 3.613575
      LE Advertising Set Terminated (0x12)
        Status: Success (0x00)
        Handle: 0
        Connection handle: 363
        Number of completed extended advertising events: 0
< HCI Command: LE Read Remote Used... (0x08|0x0016) plen 2  #49 [hci1] 3.623895
        Handle: 363 Address: DF:A9:FF:F6:B1:1A (OUI DF-A9-FF)
< ACL Data TX: Handle 363 flags 0x00 dlen 7                 #50 [hci1] 3.623904
      ATT: Exchange MTU Request (0x02) len 2
        Client RX MTU: 251
> HCI Event: Command Status (0x0f) plen 4                   #51 [hci1] 3.624373
      LE Read Remote Used Features (0x08|0x0016) ncmd 1
        Status: Success (0x00)
> HCI Event: Number of Completed Packets (0x13) plen 5      #52 [hci1] 3.789443
        Num handles: 1
        Handle: 363 Address: DF:A9:FF:F6:B1:1A (OUI DF-A9-FF)
        Count: 1
        #50: len 7 (0 Kb/s)
        Latency: 165 msec (165-165 msec ~165 msec)
> HCI Event: LE Meta Event (0x3e) plen 12                   #53 [hci1] 3.877313
      LE Read Remote Used Features (0x04)
        Status: Success (0x00)
        Handle: 363 Address: DF:A9:FF:F6:B1:1A (OUI DF-A9-FF)
        Features: 0x2d 0x49 0x00 0xf7 0x67 0xd8 0x00 0x00
          LE Encryption
          Extended Reject Indication
          Peripheral-initiated Features Exchange
          LE Data Packet Length Extension
          LE 2M PHY
          LE Coded PHY
          Channel Selection Algorithm #2
          Periodic Advertising Sync Transfer - Sender
          Periodic Advertising Sync Transfer - Recipient
          Sleep Clock Accuracy Updates
          Connected Isochronous Stream - Central
          Connected Isochronous Stream - Peripheral
          Isochronous Broadcaster
          Synchronized Receiver
          Connected Isochronous Stream (Host Support)
          LE Power Control Request
          LE Power Control Request
          Connection Subrating
          Connection Subrating (Host Support)
          Unknown features (0x0000d80000000000)
> ACL Data RX: Handle 363 flags 0x02 dlen 11                #54 [hci1] 6.326967
      SMP: Pairing Request (0x01) len 6
        IO capability: KeyboardDisplay (0x04)
        OOB data: Authentication data not present (0x00)
        Authentication requirement: Bonding, MITM, SC, No Keypresses (0x0d)
        Max encryption key size: 16
        Initiator key distribution: EncKey IdKey (0x03)
        Responder key distribution: EncKey IdKey Sign (0x07)
> ACL Data RX: Handle 363 flags 0x02 dlen 7                 #55 [hci1] 6.327492
      ATT: Exchange MTU Response (0x03) len 2
        Server RX MTU: 23
< HCI Command: Host Number of Compl.. (0x03|0x0035) plen 5  #56 [hci1] 6.344252
        Num handles: 1
        Handle: 363 Address: DF:A9:FF:F6:B1:1A (OUI DF-A9-FF)
        Count: 1
< ACL Data TX: Handle 363 flags 0x00 dlen 11                #57 [hci1] 6.344488
      SMP: Pairing Response (0x02) len 6
        IO capability: DisplayOnly (0x00)
        OOB data: Authentication data not present (0x00)
        Authentication requirement: Bonding, No MITM, SC, No Keypresses (0x09)
        Max encryption key size: 16
        Initiator key distribution: IdKey (0x02)
        Responder key distribution: <none> (0x00)
< HCI Command: Host Number of Compl.. (0x03|0x0035) plen 5  #58 [hci1] 6.344761
        Num handles: 1
        Handle: 363 Address: DF:A9:FF:F6:B1:1A (OUI DF-A9-FF)
        Count: 1
> HCI Event: Number of Completed Packets (0x13) plen 5      #59 [hci1] 6.502094
        Num handles: 1
        Handle: 363 Address: DF:A9:FF:F6:B1:1A (OUI DF-A9-FF)
        Count: 1
        #57: len 11 (0 Kb/s)
        Latency: 157 msec (157-165 msec ~161 msec)
> ACL Data RX: Handle 363 flags 0x02 dlen 27                #60 [hci1] 6.502383
> ACL Data RX: Handle 363 flags 0x01 dlen 27                #61 [hci1] 6.502923
> ACL Data RX: Handle 363 flags 0x01 dlen 15                #62 [hci1] 6.503464
      SMP: Pairing Public Key (0x0c) len 64
        X: 2bf49a1bfd9ba946cdb4f3db571df885507cb9be54164bdc08bbc6e0ce03b617
        Y: 8a9844d4b83fede76938c78092abbc1c1ea409e3e0a6ea6bad15aa3821a35f04
< HCI Command: Host Number of Compl.. (0x03|0x0035) plen 5  #63 [hci1] 6.504502
        Num handles: 1
        Handle: 363 Address: DF:A9:FF:F6:B1:1A (OUI DF-A9-FF)
        Count: 1
< HCI Command: Host Number of Compl.. (0x03|0x0035) plen 5  #64 [hci1] 6.504751
        Num handles: 1
        Handle: 363 Address: DF:A9:FF:F6:B1:1A (OUI DF-A9-FF)
        Count: 1
< HCI Command: Host Number of Compl.. (0x03|0x0035) plen 5  #65 [hci1] 6.505173
        Num handles: 1
        Handle: 363 Address: DF:A9:FF:F6:B1:1A (OUI DF-A9-FF)
        Count: 1
< ACL Data TX: Handle 363 flags 0x00 dlen 27                #66 [hci1] 6.505305
< ACL Data TX: Handle 363 flags 0x01 dlen 27                #67 [hci1] 6.505323
< ACL Data TX: Handle 363 flags 0x01 dlen 15                #68 [hci1] 6.505394
      SMP: Pairing Public Key (0x0c) len 64
        X: 98308440221e2d910f0e54b71e7ec652857aa9b5a0dc65028824cc19db1226e9
        Y: 67a4816bcb62efb21701e31fdb27561a6217575fb007a8bbdabe7e28b6f68482
> HCI Event: Number of Completed Packets (0x13) plen 5      #69 [hci1] 6.590053
        Num handles: 1
        Handle: 363 Address: DF:A9:FF:F6:B1:1A (OUI DF-A9-FF)
        Count: 1
        #66: len 27 (2 Kb/s)
        Latency: 84 msec (84-165 msec ~123 msec)
> HCI Event: Number of Completed Packets (0x13) plen 5      #70 [hci1] 6.590737
        Num handles: 1
        Handle: 363 Address: DF:A9:FF:F6:B1:1A (OUI DF-A9-FF)
        Count: 1
        #67: len 27 (2 Kb/s)
        Latency: 85 msec (84-165 msec ~104 msec)
> HCI Event: Number of Completed Packets (0x13) plen 5      #71 [hci1] 6.676798
        Num handles: 1
        Handle: 363 Address: DF:A9:FF:F6:B1:1A (OUI DF-A9-FF)
        Count: 1
        #68: len 15 (0 Kb/s)
        Latency: 171 msec (84-171 msec ~137 msec)
> ACL Data RX: Handle 363 flags 0x02 dlen 21                #72 [hci1] 7.639620
      SMP: Pairing Confirm (0x03) len 16
        Confim value: 99c3de6b242b96bd84718963491c25bb
< HCI Command: Host Number of Compl.. (0x03|0x0035) plen 5  #73 [hci1] 7.643809
        Num handles: 1
        Handle: 363 Address: DF:A9:FF:F6:B1:1A (OUI DF-A9-FF)
        Count: 1
< ACL Data TX: Handle 363 flags 0x00 dlen 21                #74 [hci1] 7.643907
      SMP: Pairing Confirm (0x03) len 16
        Confim value: 9bcd71358d5e3e11a3c73e0f68c1c6c8
> HCI Event: Number of Completed Packets (0x13) plen 5      #75 [hci1] 7.814515
        Num handles: 1
        Handle: 363 Address: DF:A9:FF:F6:B1:1A (OUI DF-A9-FF)
        Count: 1
        #74: len 21 (0 Kb/s)
        Latency: 170 msec (84-171 msec ~154 msec)
> ACL Data RX: Handle 363 flags 0x02 dlen 21                #76 [hci1] 7.814783
      SMP: Pairing Random (0x04) len 16
        Random value: 353e53989cfe8bf30000000000000000
< HCI Command: Host Number of Compl.. (0x03|0x0035) plen 5  #77 [hci1] 7.824525
        Num handles: 1
        Handle: 363 Address: DF:A9:FF:F6:B1:1A (OUI DF-A9-FF)
        Count: 1
< ACL Data TX: Handle 363 flags 0x00 dlen 21                #78 [hci1] 7.824700
      SMP: Pairing Random (0x04) len 16
        Random value: 8e6108f966a694cbe26df70bb96773e6
> HCI Event: Number of Completed Packets (0x13) plen 5      #79 [hci1] 7.989296
        Num handles: 1
        Handle: 363 Address: DF:A9:FF:F6:B1:1A (OUI DF-A9-FF)
        Count: 1
        #78: len 21 (1 Kb/s)
        Latency: 164 msec (84-171 msec ~159 msec)
> ACL Data RX: Handle 363 flags 0x02 dlen 21                #80 [hci1] 8.077219
      SMP: Pairing Confirm (0x03) len 16
        Confim value: 229c37ed3e637ceaad7c235e1ff58381
< HCI Command: Host Number of Compl.. (0x03|0x0035) plen 5  #81 [hci1] 8.084270
        Num handles: 1
        Handle: 363 Address: DF:A9:FF:F6:B1:1A (OUI DF-A9-FF)
        Count: 1
< ACL Data TX: Handle 363 flags 0x00 dlen 21                #82 [hci1] 8.084511
      SMP: Pairing Confirm (0x03) len 16
        Confim value: 272affad5a68d4fefaa189dd3f3a7bf5
> HCI Event: Number of Completed Packets (0x13) plen 5      #83 [hci1] 8.252044
        Num handles: 1
        Handle: 363 Address: DF:A9:FF:F6:B1:1A (OUI DF-A9-FF)
        Count: 1
        #82: len 21 (1 Kb/s)
        Latency: 167 msec (84-171 msec ~163 msec)
> ACL Data RX: Handle 363 flags 0x02 dlen 21                #84 [hci1] 8.252330
      SMP: Pairing Random (0x04) len 16
        Random value: af1ae9012e6f852e0000000000000000
< HCI Command: Host Number of Compl.. (0x03|0x0035) plen 5  #85 [hci1] 8.264496
        Num handles: 1
        Handle: 363 Address: DF:A9:FF:F6:B1:1A (OUI DF-A9-FF)
        Count: 1
< ACL Data TX: Handle 363 flags 0x00 dlen 21                #86 [hci1] 8.264582
      SMP: Pairing Random (0x04) len 16
        Random value: 4d02679f89a05211af56d8b3da64d21e
> HCI Event: Number of Completed Packets (0x13) plen 5      #87 [hci1] 8.426735
        Num handles: 1
        Handle: 363 Address: DF:A9:FF:F6:B1:1A (OUI DF-A9-FF)
        Count: 1
        #86: len 21 (1 Kb/s)
        Latency: 162 msec (84-171 msec ~162 msec)
> ACL Data RX: Handle 363 flags 0x02 dlen 21                #88 [hci1] 8.514581
      SMP: Pairing Confirm (0x03) len 16
        Confim value: 3332a5effaa758a8b6d7d7c1e5e03722
< HCI Command: Host Number of Compl.. (0x03|0x0035) plen 5  #89 [hci1] 8.523929
        Num handles: 1
        Handle: 363 Address: DF:A9:FF:F6:B1:1A (OUI DF-A9-FF)
        Count: 1
< ACL Data TX: Handle 363 flags 0x00 dlen 21                #90 [hci1] 8.524077
      SMP: Pairing Confirm (0x03) len 16
        Confim value: c526e98d804a8234478637ddd78da214
> HCI Event: Number of Completed Packets (0x13) plen 5      #91 [hci1] 8.689432
        Num handles: 1
        Handle: 363 Address: DF:A9:FF:F6:B1:1A (OUI DF-A9-FF)
        Count: 1
        #90: len 21 (1 Kb/s)
        Latency: 165 msec (84-171 msec ~164 msec)
> ACL Data RX: Handle 363 flags 0x02 dlen 21                #92 [hci1] 8.689904
      SMP: Pairing Random (0x04) len 16
        Random value: 3ba63363bd43db070000000000000000
< HCI Command: Host Number of Compl.. (0x03|0x0035) plen 5  #93 [hci1] 8.704529
        Num handles: 1
        Handle: 363 Address: DF:A9:FF:F6:B1:1A (OUI DF-A9-FF)
        Count: 1
< ACL Data TX: Handle 363 flags 0x00 dlen 21                #94 [hci1] 8.704624
      SMP: Pairing Random (0x04) len 16
        Random value: 5e8286bc235a02440d0c3424a2acf8fd
> HCI Event: Number of Completed Packets (0x13) plen 5      #95 [hci1] 8.864209
        Num handles: 1
        Handle: 363 Address: DF:A9:FF:F6:B1:1A (OUI DF-A9-FF)
        Count: 1
        #94: len 21 (1 Kb/s)
        Latency: 159 msec (84-171 msec ~161 msec)
> ACL Data RX: Handle 363 flags 0x02 dlen 21                #96 [hci1] 8.952173
      SMP: Pairing Confirm (0x03) len 16
        Confim value: 31b6a890093504a54327c7118414affd
< HCI Command: Host Number of Compl.. (0x03|0x0035) plen 5  #97 [hci1] 8.964239
        Num handles: 1
        Handle: 363 Address: DF:A9:FF:F6:B1:1A (OUI DF-A9-FF)
        Count: 1
< ACL Data TX: Handle 363 flags 0x00 dlen 21                #98 [hci1] 8.964331
      SMP: Pairing Confirm (0x03) len 16
        Confim value: 58748f82503cb5acd198a85e6f9426aa
> HCI Event: Number of Completed Packets (0x13) plen 5      #99 [hci1] 9.126893
        Num handles: 1
        Handle: 363 Address: DF:A9:FF:F6:B1:1A (OUI DF-A9-FF)
        Count: 1
        #98: len 21 (1 Kb/s)
        Latency: 162 msec (84-171 msec ~162 msec)
> ACL Data RX: Handle 363 flags 0x02 dlen 21               #100 [hci1] 9.127260
      SMP: Pairing Random (0x04) len 16
        Random value: 602ef0d3dcc830fa0000000000000000
< HCI Command: Host Number of Comp.. (0x03|0x0035) plen 5  #101 [hci1] 9.144540
        Num handles: 1
        Handle: 363 Address: DF:A9:FF:F6:B1:1A (OUI DF-A9-FF)
        Count: 1
< ACL Data TX: Handle 363 flags 0x00 dlen 21               #102 [hci1] 9.144723
      SMP: Pairing Random (0x04) len 16
        Random value: 5c4a1bcadd27bd58e945097b00bad7ac
> HCI Event: Number of Completed Packets (0x13) plen 5     #103 [hci1] 9.301759
        Num handles: 1
        Handle: 363 Address: DF:A9:FF:F6:B1:1A (OUI DF-A9-FF)
        Count: 1
        #102: len 21 (1 Kb/s)
        Latency: 157 msec (84-171 msec ~159 msec)
> ACL Data RX: Handle 363 flags 0x02 dlen 21               #104 [hci1] 9.389581
      SMP: Pairing Confirm (0x03) len 16
        Confim value: 2c0f0a02cc42e69beb0ce583e97db205
< HCI Command: Host Number of Comp.. (0x03|0x0035) plen 5  #105 [hci1] 9.404150
        Num handles: 1
        Handle: 363 Address: DF:A9:FF:F6:B1:1A (OUI DF-A9-FF)
        Count: 1
< ACL Data TX: Handle 363 flags 0x00 dlen 21               #106 [hci1] 9.404355
      SMP: Pairing Confirm (0x03) len 16
        Confim value: 46727fa08d9ad173c6138fd3fa945eb0
> HCI Event: Number of Completed Packets (0x13) plen 5     #107 [hci1] 9.564394
        Num handles: 1
        Handle: 363 Address: DF:A9:FF:F6:B1:1A (OUI DF-A9-FF)
        Count: 1
        #106: len 21 (1 Kb/s)
        Latency: 160 msec (84-171 msec ~159 msec)
> ACL Data RX: Handle 363 flags 0x02 dlen 21               #108 [hci1] 9.564765
      SMP: Pairing Random (0x04) len 16
        Random value: a0f1ea83f472f6c30000000000000000
< HCI Command: Host Number of Comp.. (0x03|0x0035) plen 5  #109 [hci1] 9.584578
        Num handles: 1
        Handle: 363 Address: DF:A9:FF:F6:B1:1A (OUI DF-A9-FF)
        Count: 1
< ACL Data TX: Handle 363 flags 0x00 dlen 21               #110 [hci1] 9.584710
      SMP: Pairing Random (0x04) len 16
        Random value: 32527e6e64e79f33b2e374394db8ab2d
> HCI Event: Number of Completed Packets (0x13) plen 5     #111 [hci1] 9.739234
        Num handles: 1
        Handle: 363 Address: DF:A9:FF:F6:B1:1A (OUI DF-A9-FF)
        Count: 1
        #110: len 21 (1 Kb/s)
        Latency: 154 msec (84-171 msec ~157 msec)
> ACL Data RX: Handle 363 flags 0x02 dlen 21               #112 [hci1] 9.827119
      SMP: Pairing Confirm (0x03) len 16
        Confim value: 9e8dbe574b738cfdb30e8468134a357f
< HCI Command: Host Number of Comp.. (0x03|0x0035) plen 5  #113 [hci1] 9.844275
        Num handles: 1
        Handle: 363 Address: DF:A9:FF:F6:B1:1A (OUI DF-A9-FF)
        Count: 1
< ACL Data TX: Handle 363 flags 0x00 dlen 21               #114 [hci1] 9.844591
      SMP: Pairing Confirm (0x03) len 16
        Confim value: f8ebe6ea513cf65457f1f803aa32352e
> HCI Event: Number of Completed Packets (0x13) plen 5    #115 [hci1] 10.001921
        Num handles: 1
        Handle: 363 Address: DF:A9:FF:F6:B1:1A (OUI DF-A9-FF)
        Count: 1
        #114: len 21 (1 Kb/s)
        Latency: 157 msec (84-171 msec ~157 msec)
> ACL Data RX: Handle 363 flags 0x02 dlen 21              #116 [hci1] 10.002212
      SMP: Pairing Random (0x04) len 16
        Random value: 898f31e1611f8b270000000000000000
< HCI Command: Host Number of Com.. (0x03|0x0035) plen 5  #117 [hci1] 10.004525
        Num handles: 1
        Handle: 363 Address: DF:A9:FF:F6:B1:1A (OUI DF-A9-FF)
        Count: 1
< ACL Data TX: Handle 363 flags 0x00 dlen 21              #118 [hci1] 10.004665
      SMP: Pairing Random (0x04) len 16
        Random value: dddbdfe2838e9a8cc6964353c850fef7
> HCI Event: Number of Completed Packets (0x13) plen 5    #119 [hci1] 10.176731
        Num handles: 1
        Handle: 363 Address: DF:A9:FF:F6:B1:1A (OUI DF-A9-FF)
        Count: 1
        #118: len 21 (0 Kb/s)
        Latency: 172 msec (84-172 msec ~164 msec)
> ACL Data RX: Handle 363 flags 0x02 dlen 21              #120 [hci1] 10.264525
      SMP: Pairing Confirm (0x03) len 16
        Confim value: 565c424e9efed9fd8c800c6dbd4565e2
< HCI Command: Host Number of Com.. (0x03|0x0035) plen 5  #121 [hci1] 10.284263
        Num handles: 1
        Handle: 363 Address: DF:A9:FF:F6:B1:1A (OUI DF-A9-FF)
        Count: 1
< ACL Data TX: Handle 363 flags 0x00 dlen 21              #122 [hci1] 10.284535
      SMP: Pairing Confirm (0x03) len 16
        Confim value: 56eae1bd519451a8213cacf64c680728
> HCI Event: Number of Completed Packets (0x13) plen 5    #123 [hci1] 10.439407
        Num handles: 1
        Handle: 363 Address: DF:A9:FF:F6:B1:1A (OUI DF-A9-FF)
        Count: 1
        #122: len 21 (1 Kb/s)
        Latency: 154 msec (84-172 msec ~159 msec)
> ACL Data RX: Handle 363 flags 0x02 dlen 21              #124 [hci1] 10.439692
      SMP: Pairing Random (0x04) len 16
        Random value: 4f216e5912e1226b0000000000000000
< HCI Command: Host Number of Com.. (0x03|0x0035) plen 5  #125 [hci1] 10.444014
        Num handles: 1
        Handle: 363 Address: DF:A9:FF:F6:B1:1A (OUI DF-A9-FF)
        Count: 1
< ACL Data TX: Handle 363 flags 0x00 dlen 21              #126 [hci1] 10.444102
      SMP: Pairing Random (0x04) len 16
        Random value: eb9f1915536596b6fc3db1c86b2b1970
> HCI Event: Number of Completed Packets (0x13) plen 5    #127 [hci1] 10.614177
        Num handles: 1
        Handle: 363 Address: DF:A9:FF:F6:B1:1A (OUI DF-A9-FF)
        Count: 1
        #126: len 21 (0 Kb/s)
        Latency: 170 msec (84-172 msec ~164 msec)
> ACL Data RX: Handle 363 flags 0x02 dlen 21              #128 [hci1] 10.702049
      SMP: Pairing Confirm (0x03) len 16
        Confim value: a1a78f2ce3b37bf02885b996b7378d47
< HCI Command: Host Number of Com.. (0x03|0x0035) plen 5  #129 [hci1] 10.703854
        Num handles: 1
        Handle: 363 Address: DF:A9:FF:F6:B1:1A (OUI DF-A9-FF)
        Count: 1
< ACL Data TX: Handle 363 flags 0x00 dlen 21              #130 [hci1] 10.703999
      SMP: Pairing Confirm (0x03) len 16
        Confim value: 6a104d0989207ff5d381ac8657660383
> HCI Event: Number of Completed Packets (0x13) plen 5    #131 [hci1] 10.876859
        Num handles: 1
        Handle: 363 Address: DF:A9:FF:F6:B1:1A (OUI DF-A9-FF)
        Count: 1
        #130: len 21 (0 Kb/s)
        Latency: 172 msec (84-172 msec ~168 msec)
> ACL Data RX: Handle 363 flags 0x02 dlen 21              #132 [hci1] 10.877231
      SMP: Pairing Random (0x04) len 16
        Random value: 964faf74dd39a2c10000000000000000
< HCI Command: Host Number of Com.. (0x03|0x0035) plen 5  #133 [hci1] 10.884476
        Num handles: 1
        Handle: 363 Address: DF:A9:FF:F6:B1:1A (OUI DF-A9-FF)
        Count: 1
< ACL Data TX: Handle 363 flags 0x00 dlen 21              #134 [hci1] 10.884596
      SMP: Pairing Random (0x04) len 16
        Random value: 5c794dc9ad9f2c3f295ebd5ad5e1c3cf
> HCI Event: Number of Completed Packets (0x13) plen 5    #135 [hci1] 11.051687
        Num handles: 1
        Handle: 363 Address: DF:A9:FF:F6:B1:1A (OUI DF-A9-FF)
        Count: 1
        #134: len 21 (1 Kb/s)
        Latency: 167 msec (84-172 msec ~167 msec)
> ACL Data RX: Handle 363 flags 0x02 dlen 21              #136 [hci1] 11.139542
      SMP: Pairing Confirm (0x03) len 16
        Confim value: 2ff2e91572036430e37d627769398f05
< HCI Command: Host Number of Com.. (0x03|0x0035) plen 5  #137 [hci1] 11.144388
        Num handles: 1
        Handle: 363 Address: DF:A9:FF:F6:B1:1A (OUI DF-A9-FF)
        Count: 1
< ACL Data TX: Handle 363 flags 0x00 dlen 21              #138 [hci1] 11.144615
      SMP: Pairing Confirm (0x03) len 16
        Confim value: 0e133f16f5efe2da29a1d3a66386bbf9
> HCI Event: Number of Completed Packets (0x13) plen 5    #139 [hci1] 11.314358
        Num handles: 1
        Handle: 363 Address: DF:A9:FF:F6:B1:1A (OUI DF-A9-FF)
        Count: 1
        #138: len 21 (0 Kb/s)
        Latency: 169 msec (84-172 msec ~168 msec)
> ACL Data RX: Handle 363 flags 0x02 dlen 21              #140 [hci1] 11.314764
      SMP: Pairing Random (0x04) len 16
        Random value: 5be62083ee28ed320000000000000000
< HCI Command: Host Number of Com.. (0x03|0x0035) plen 5  #141 [hci1] 11.324501
        Num handles: 1
        Handle: 363 Address: DF:A9:FF:F6:B1:1A (OUI DF-A9-FF)
        Count: 1
< ACL Data TX: Handle 363 flags 0x00 dlen 21              #142 [hci1] 11.324636
      SMP: Pairing Random (0x04) len 16
        Random value: 5c2fff312cdf99c9491988e877355a9a
> HCI Event: Number of Completed Packets (0x13) plen 5    #143 [hci1] 11.489213
        Num handles: 1
        Handle: 363 Address: DF:A9:FF:F6:B1:1A (OUI DF-A9-FF)
        Count: 1
        #142: len 21 (1 Kb/s)
        Latency: 164 msec (84-172 msec ~166 msec)
> ACL Data RX: Handle 363 flags 0x02 dlen 21              #144 [hci1] 11.577027
      SMP: Pairing Confirm (0x03) len 16
        Confim value: e07b43723163ef4fa68157c672b36b94
< HCI Command: Host Number of Com.. (0x03|0x0035) plen 5  #145 [hci1] 11.584293
        Num handles: 1
        Handle: 363 Address: DF:A9:FF:F6:B1:1A (OUI DF-A9-FF)
        Count: 1
< ACL Data TX: Handle 363 flags 0x00 dlen 21              #146 [hci1] 11.584575
      SMP: Pairing Confirm (0x03) len 16
        Confim value: 0501f37516fd02e170b78b0a612c574d
> HCI Event: Number of Completed Packets (0x13) plen 5    #147 [hci1] 11.751874
        Num handles: 1
        Handle: 363 Address: DF:A9:FF:F6:B1:1A (OUI DF-A9-FF)
        Count: 1
        #146: len 21 (1 Kb/s)
        Latency: 167 msec (84-172 msec ~167 msec)
> ACL Data RX: Handle 363 flags 0x02 dlen 21              #148 [hci1] 11.752202
      SMP: Pairing Random (0x04) len 16
        Random value: f3d2e1f06508f7bc0000000000000000
< HCI Command: Host Number of Com.. (0x03|0x0035) plen 5  #149 [hci1] 11.764368
        Num handles: 1
        Handle: 363 Address: DF:A9:FF:F6:B1:1A (OUI DF-A9-FF)
        Count: 1
< ACL Data TX: Handle 363 flags 0x00 dlen 21              #150 [hci1] 11.764468
      SMP: Pairing Random (0x04) len 16
        Random value: c629a3a987d808e808655d558dfc1155
> HCI Event: Number of Completed Packets (0x13) plen 5    #151 [hci1] 11.926578
        Num handles: 1
        Handle: 363 Address: DF:A9:FF:F6:B1:1A (OUI DF-A9-FF)
        Count: 1
        #150: len 21 (1 Kb/s)
        Latency: 162 msec (84-172 msec ~164 msec)
> ACL Data RX: Handle 363 flags 0x02 dlen 21              #152 [hci1] 12.014547
      SMP: Pairing Confirm (0x03) len 16
        Confim value: cc6c98def99e99b13a6ffede543d8060
< HCI Command: Host Number of Com.. (0x03|0x0035) plen 5  #153 [hci1] 12.024413
        Num handles: 1
        Handle: 363 Address: DF:A9:FF:F6:B1:1A (OUI DF-A9-FF)
        Count: 1
< ACL Data TX: Handle 363 flags 0x00 dlen 21              #154 [hci1] 12.024709
      SMP: Pairing Confirm (0x03) len 16
        Confim value: 28343c994241356505c59e7551e8fd39
> HCI Event: Number of Completed Packets (0x13) plen 5    #155 [hci1] 12.189326
        Num handles: 1
        Handle: 363 Address: DF:A9:FF:F6:B1:1A (OUI DF-A9-FF)
        Count: 1
        #154: len 21 (1 Kb/s)
        Latency: 164 msec (84-172 msec ~164 msec)
> ACL Data RX: Handle 363 flags 0x02 dlen 21              #156 [hci1] 12.189705
      SMP: Pairing Random (0x04) len 16
        Random value: 696be487b1eba2e30000000000000000
< HCI Command: Host Number of Com.. (0x03|0x0035) plen 5  #157 [hci1] 12.204662
        Num handles: 1
        Handle: 363 Address: DF:A9:FF:F6:B1:1A (OUI DF-A9-FF)
        Count: 1
< ACL Data TX: Handle 363 flags 0x00 dlen 21              #158 [hci1] 12.204845
      SMP: Pairing Random (0x04) len 16
        Random value: 92f20f6ad8f13724432c7fd6001c45ff
> HCI Event: Number of Completed Packets (0x13) plen 5    #159 [hci1] 12.364224
        Num handles: 1
        Handle: 363 Address: DF:A9:FF:F6:B1:1A (OUI DF-A9-FF)
        Count: 1
        #158: len 21 (1 Kb/s)
        Latency: 159 msec (84-172 msec ~161 msec)
> ACL Data RX: Handle 363 flags 0x02 dlen 21              #160 [hci1] 12.452054
      SMP: Pairing Confirm (0x03) len 16
        Confim value: d01be7e8d1258e09d556556efdeb3057
< HCI Command: Host Number of Com.. (0x03|0x0035) plen 5  #161 [hci1] 12.464360
        Num handles: 1
        Handle: 363 Address: DF:A9:FF:F6:B1:1A (OUI DF-A9-FF)
        Count: 1
< ACL Data TX: Handle 363 flags 0x00 dlen 21              #162 [hci1] 12.464619
      SMP: Pairing Confirm (0x03) len 16
        Confim value: 3bce47747729812ec0a59bd2841cddf1
> HCI Event: Number of Completed Packets (0x13) plen 5    #163 [hci1] 12.626807
        Num handles: 1
        Handle: 363 Address: DF:A9:FF:F6:B1:1A (OUI DF-A9-FF)
        Count: 1
        #162: len 21 (1 Kb/s)
        Latency: 162 msec (84-172 msec ~162 msec)
> ACL Data RX: Handle 363 flags 0x02 dlen 21              #164 [hci1] 12.627218
      SMP: Pairing Random (0x04) len 16
        Random value: b17f7859ec2411a30000000000000000
< HCI Command: Host Number of Com.. (0x03|0x0035) plen 5  #165 [hci1] 12.644532
        Num handles: 1
        Handle: 363 Address: DF:A9:FF:F6:B1:1A (OUI DF-A9-FF)
        Count: 1
< ACL Data TX: Handle 363 flags 0x00 dlen 21              #166 [hci1] 12.644622
      SMP: Pairing Random (0x04) len 16
        Random value: 23ac32ebbb5e14c8a6b9622f296d277f
> HCI Event: Number of Completed Packets (0x13) plen 5    #167 [hci1] 12.801605
        Num handles: 1
        Handle: 363 Address: DF:A9:FF:F6:B1:1A (OUI DF-A9-FF)
        Count: 1
        #166: len 21 (1 Kb/s)
        Latency: 156 msec (84-172 msec ~159 msec)
> ACL Data RX: Handle 363 flags 0x02 dlen 21              #168 [hci1] 12.889524
      SMP: Pairing Confirm (0x03) len 16
        Confim value: 3c0ef4e1d41f6d50fb259fb83fa5ce2c
< HCI Command: Host Number of Com.. (0x03|0x0035) plen 5  #169 [hci1] 12.904058
        Num handles: 1
        Handle: 363 Address: DF:A9:FF:F6:B1:1A (OUI DF-A9-FF)
        Count: 1
< ACL Data TX: Handle 363 flags 0x00 dlen 21              #170 [hci1] 12.904221
      SMP: Pairing Confirm (0x03) len 16
        Confim value: 2de7da560f7d117cde8d449074f57a08
> HCI Event: Number of Completed Packets (0x13) plen 5    #171 [hci1] 13.064362
        Num handles: 1
        Handle: 363 Address: DF:A9:FF:F6:B1:1A (OUI DF-A9-FF)
        Count: 1
        #170: len 21 (1 Kb/s)
        Latency: 160 msec (84-172 msec ~159 msec)
> ACL Data RX: Handle 363 flags 0x02 dlen 21              #172 [hci1] 13.064656
      SMP: Pairing Random (0x04) len 16
        Random value: a84806fd8d2f1dc20000000000000000
< HCI Command: Host Number of Com.. (0x03|0x0035) plen 5  #173 [hci1] 13.084656
        Num handles: 1
        Handle: 363 Address: DF:A9:FF:F6:B1:1A (OUI DF-A9-FF)
        Count: 1
< ACL Data TX: Handle 363 flags 0x00 dlen 21              #174 [hci1] 13.084751
      SMP: Pairing Random (0x04) len 16
        Random value: 297efe85e67448a15f56bd27e3a3cf1d
> HCI Event: Number of Completed Packets (0x13) plen 5    #175 [hci1] 13.239147
        Num handles: 1
        Handle: 363 Address: DF:A9:FF:F6:B1:1A (OUI DF-A9-FF)
        Count: 1
        #174: len 21 (1 Kb/s)
        Latency: 154 msec (84-172 msec ~157 msec)
> ACL Data RX: Handle 363 flags 0x02 dlen 21              #176 [hci1] 13.326934
      SMP: Pairing Confirm (0x03) len 16
        Confim value: 9e432ebf5edb977a8a026b54208e6169
< HCI Command: Host Number of Com.. (0x03|0x0035) plen 5  #177 [hci1] 13.344406
        Num handles: 1
        Handle: 363 Address: DF:A9:FF:F6:B1:1A (OUI DF-A9-FF)
        Count: 1
< ACL Data TX: Handle 363 flags 0x00 dlen 21              #178 [hci1] 13.344725
      SMP: Pairing Confirm (0x03) len 16
        Confim value: 98012a67111e4e397b169a1883714a23
> HCI Event: Number of Completed Packets (0x13) plen 5    #179 [hci1] 13.501816
        Num handles: 1
        Handle: 363 Address: DF:A9:FF:F6:B1:1A (OUI DF-A9-FF)
        Count: 1
        #178: len 21 (1 Kb/s)
        Latency: 157 msec (84-172 msec ~157 msec)
> ACL Data RX: Handle 363 flags 0x02 dlen 21              #180 [hci1] 13.502252
      SMP: Pairing Random (0x04) len 16
        Random value: f5d576a0da0bb8700000000000000000
< HCI Command: Host Number of Com.. (0x03|0x0035) plen 5  #181 [hci1] 13.504093
        Num handles: 1
        Handle: 363 Address: DF:A9:FF:F6:B1:1A (OUI DF-A9-FF)
        Count: 1
< ACL Data TX: Handle 363 flags 0x00 dlen 21              #182 [hci1] 13.504191
      SMP: Pairing Random (0x04) len 16
        Random value: 25a9493fd3ce4faf02be7293595bb7c6
> HCI Event: Number of Completed Packets (0x13) plen 5    #183 [hci1] 13.676603
        Num handles: 1
        Handle: 363 Address: DF:A9:FF:F6:B1:1A (OUI DF-A9-FF)
        Count: 1
        #182: len 21 (0 Kb/s)
        Latency: 172 msec (84-172 msec ~164 msec)
> ACL Data RX: Handle 363 flags 0x02 dlen 21              #184 [hci1] 13.764466
      SMP: Pairing Confirm (0x03) len 16
        Confim value: a5b2cdb970fc9d92ba319425c09085c0
< HCI Command: Host Number of Com.. (0x03|0x0035) plen 5  #185 [hci1] 13.784399
        Num handles: 1
        Handle: 363 Address: DF:A9:FF:F6:B1:1A (OUI DF-A9-FF)
        Count: 1
< ACL Data TX: Handle 363 flags 0x00 dlen 21              #186 [hci1] 13.784660
      SMP: Pairing Confirm (0x03) len 16
        Confim value: fdd724f1555afa43045cb193d6f59aba
> HCI Event: Number of Completed Packets (0x13) plen 5    #187 [hci1] 13.939312
        Num handles: 1
        Handle: 363 Address: DF:A9:FF:F6:B1:1A (OUI DF-A9-FF)
        Count: 1
        #186: len 21 (1 Kb/s)
        Latency: 154 msec (84-172 msec ~159 msec)
> ACL Data RX: Handle 363 flags 0x02 dlen 21              #188 [hci1] 13.939745
      SMP: Pairing Random (0x04) len 16
        Random value: 92279fa60f4a31b20000000000000000
< HCI Command: Host Number of Com.. (0x03|0x0035) plen 5  #189 [hci1] 13.944518
        Num handles: 1
        Handle: 363 Address: DF:A9:FF:F6:B1:1A (OUI DF-A9-FF)
        Count: 1
< ACL Data TX: Handle 363 flags 0x00 dlen 21              #190 [hci1] 13.944612
      SMP: Pairing Random (0x04) len 16
        Random value: 58f6b41f855a6f6c3560debd84e2affc
> HCI Event: Number of Completed Packets (0x13) plen 5    #191 [hci1] 14.114065
        Num handles: 1
        Handle: 363 Address: DF:A9:FF:F6:B1:1A (OUI DF-A9-FF)
        Count: 1
        #190: len 21 (0 Kb/s)
        Latency: 169 msec (84-172 msec ~164 msec)
> ACL Data RX: Handle 363 flags 0x02 dlen 21              #192 [hci1] 14.201942
      SMP: Pairing Confirm (0x03) len 16
        Confim value: 5ac0a951ffd94ba4e681bf14d2e812a8
< HCI Command: Host Number of Com.. (0x03|0x0035) plen 5  #193 [hci1] 14.204058
        Num handles: 1
        Handle: 363 Address: DF:A9:FF:F6:B1:1A (OUI DF-A9-FF)
        Count: 1
< ACL Data TX: Handle 363 flags 0x00 dlen 21              #194 [hci1] 14.204212
      SMP: Pairing Confirm (0x03) len 16
        Confim value: 88470d5ae00b45ec84ce1fd05014b113
> HCI Event: Number of Completed Packets (0x13) plen 5    #195 [hci1] 14.376780
        Num handles: 1
        Handle: 363 Address: DF:A9:FF:F6:B1:1A (OUI DF-A9-FF)
        Count: 1
        #194: len 21 (0 Kb/s)
        Latency: 172 msec (84-172 msec ~168 msec)
> ACL Data RX: Handle 363 flags 0x02 dlen 21              #196 [hci1] 14.377089
      SMP: Pairing Random (0x04) len 16
        Random value: 47fc8f61a042d8cd0000000000000000
< HCI Command: Host Number of Com.. (0x03|0x0035) plen 5  #197 [hci1] 14.384538
        Num handles: 1
        Handle: 363 Address: DF:A9:FF:F6:B1:1A (OUI DF-A9-FF)
        Count: 1
< ACL Data TX: Handle 363 flags 0x00 dlen 21              #198 [hci1] 14.384703
      SMP: Pairing Random (0x04) len 16
        Random value: b67e7216d5bf664139eda2b542549666
> HCI Event: Number of Completed Packets (0x13) plen 5    #199 [hci1] 14.551578
        Num handles: 1
        Handle: 363 Address: DF:A9:FF:F6:B1:1A (OUI DF-A9-FF)
        Count: 1
        #198: len 21 (1 Kb/s)
        Latency: 166 msec (84-172 msec ~167 msec)
> ACL Data RX: Handle 363 flags 0x02 dlen 21              #200 [hci1] 14.639431
      SMP: Pairing Confirm (0x03) len 16
        Confim value: bb2e67101a14c3e210cee0fd515a9978
< HCI Command: Host Number of Com.. (0x03|0x0035) plen 5  #201 [hci1] 14.644300
        Num handles: 1
        Handle: 363 Address: DF:A9:FF:F6:B1:1A (OUI DF-A9-FF)
        Count: 1
< ACL Data TX: Handle 363 flags 0x00 dlen 21              #202 [hci1] 14.644505
      SMP: Pairing Confirm (0x03) len 16
        Confim value: f2e16c3ecf653d17c2b1c34181d2d04b
> HCI Event: Number of Completed Packets (0x13) plen 5    #203 [hci1] 14.814241
        Num handles: 1
        Handle: 363 Address: DF:A9:FF:F6:B1:1A (OUI DF-A9-FF)
        Count: 1
        #202: len 21 (0 Kb/s)
        Latency: 169 msec (84-172 msec ~168 msec)
> ACL Data RX: Handle 363 flags 0x02 dlen 21              #204 [hci1] 14.814585
      SMP: Pairing Random (0x04) len 16
        Random value: 456ec5abb27857ca0000000000000000
< HCI Command: Host Number of Com.. (0x03|0x0035) plen 5  #205 [hci1] 14.824622
        Num handles: 1
        Handle: 363 Address: DF:A9:FF:F6:B1:1A (OUI DF-A9-FF)
        Count: 1
< ACL Data TX: Handle 363 flags 0x00 dlen 21              #206 [hci1] 14.824767
      SMP: Pairing Random (0x04) len 16
        Random value: ed17f76500c95219dd01e09d1e63f87b
> HCI Event: Number of Completed Packets (0x13) plen 5    #207 [hci1] 14.989070
        Num handles: 1
        Handle: 363 Address: DF:A9:FF:F6:B1:1A (OUI DF-A9-FF)
        Count: 1
        #206: len 21 (1 Kb/s)
        Latency: 164 msec (84-172 msec ~166 msec)
> ACL Data RX: Handle 363 flags 0x02 dlen 21              #208 [hci1] 15.076908
      SMP: Pairing Confirm (0x03) len 16
        Confim value: c6933abeabca04c2af3a76d13db41e42
< HCI Command: Host Number of Com.. (0x03|0x0035) plen 5  #209 [hci1] 15.084297
        Num handles: 1
        Handle: 363 Address: DF:A9:FF:F6:B1:1A (OUI DF-A9-FF)
        Count: 1
< ACL Data TX: Handle 363 flags 0x00 dlen 21              #210 [hci1] 15.084506
      SMP: Pairing Confirm (0x03) len 16
        Confim value: 01923d8630bcf00a133b27f4cae6d004
> HCI Event: Number of Completed Packets (0x13) plen 5    #211 [hci1] 15.251884
        Num handles: 1
        Handle: 363 Address: DF:A9:FF:F6:B1:1A (OUI DF-A9-FF)
        Count: 1
        #210: len 21 (1 Kb/s)
        Latency: 167 msec (84-172 msec ~166 msec)
> ACL Data RX: Handle 363 flags 0x02 dlen 21              #212 [hci1] 15.252125
      SMP: Pairing Random (0x04) len 16
        Random value: b611c2930ce705e80000000000000000
< HCI Command: Host Number of Com.. (0x03|0x0035) plen 5  #213 [hci1] 15.264576
        Num handles: 1
        Handle: 363 Address: DF:A9:FF:F6:B1:1A (OUI DF-A9-FF)
        Count: 1
< ACL Data TX: Handle 363 flags 0x00 dlen 21              #214 [hci1] 15.264769
      SMP: Pairing Random (0x04) len 16
        Random value: 81d35d47e1f6006d79c974bd9d9e1ee3
> HCI Event: Number of Completed Packets (0x13) plen 5    #215 [hci1] 15.426528
        Num handles: 1
        Handle: 363 Address: DF:A9:FF:F6:B1:1A (OUI DF-A9-FF)
        Count: 1
        #214: len 21 (1 Kb/s)
        Latency: 161 msec (84-172 msec ~164 msec)
> ACL Data RX: Handle 363 flags 0x02 dlen 21              #216 [hci1] 15.514381
      SMP: Pairing Confirm (0x03) len 16
        Confim value: c0cd500db9075f23dff35518020f6c03
< HCI Command: Host Number of Com.. (0x03|0x0035) plen 5  #217 [hci1] 15.524320
        Num handles: 1
        Handle: 363 Address: DF:A9:FF:F6:B1:1A (OUI DF-A9-FF)
        Count: 1
< ACL Data TX: Handle 363 flags 0x00 dlen 21              #218 [hci1] 15.524510
      SMP: Pairing Confirm (0x03) len 16
        Confim value: 3dcf5fe96352efab4ad85b3d7d07568c
> HCI Event: Number of Completed Packets (0x13) plen 5    #219 [hci1] 15.689307
        Num handles: 1
        Handle: 363 Address: DF:A9:FF:F6:B1:1A (OUI DF-A9-FF)
        Count: 1
        #218: len 21 (1 Kb/s)
        Latency: 164 msec (84-172 msec ~164 msec)
> ACL Data RX: Handle 363 flags 0x02 dlen 21              #220 [hci1] 15.689557
      SMP: Pairing Random (0x04) len 16
        Random value: 4dac0f1816fbb3570000000000000000
< HCI Command: Host Number of Com.. (0x03|0x0035) plen 5  #221 [hci1] 15.704598
        Num handles: 1
        Handle: 363 Address: DF:A9:FF:F6:B1:1A (OUI DF-A9-FF)
        Count: 1
< ACL Data TX: Handle 363 flags 0x00 dlen 21              #222 [hci1] 15.704756
      SMP: Pairing Random (0x04) len 16
        Random value: e7f7e0c2476823e41736a7e381bafb7c
> HCI Event: Number of Completed Packets (0x13) plen 5    #223 [hci1] 15.864042
        Num handles: 1
        Handle: 363 Address: DF:A9:FF:F6:B1:1A (OUI DF-A9-FF)
        Count: 1
        #222: len 21 (1 Kb/s)
        Latency: 159 msec (84-172 msec ~161 msec)
> ACL Data RX: Handle 363 flags 0x02 dlen 21              #224 [hci1] 15.951859
      SMP: Pairing Confirm (0x03) len 16
        Confim value: e83096b1e6ff3351653b4f8e5d1e140a
< HCI Command: Host Number of Com.. (0x03|0x0035) plen 5  #225 [hci1] 15.964495
        Num handles: 1
        Handle: 363 Address: DF:A9:FF:F6:B1:1A (OUI DF-A9-FF)
        Count: 1
< ACL Data TX: Handle 363 flags 0x00 dlen 21              #226 [hci1] 15.964746
      SMP: Pairing Confirm (0x03) len 16
        Confim value: f0c7d21ccb72e87cda628532a9f27ff6
> HCI Event: Number of Completed Packets (0x13) plen 5    #227 [hci1] 16.126756
        Num handles: 1
        Handle: 363 Address: DF:A9:FF:F6:B1:1A (OUI DF-A9-FF)
        Count: 1
        #226: len 21 (1 Kb/s)
        Latency: 162 msec (84-172 msec ~161 msec)
> ACL Data RX: Handle 363 flags 0x02 dlen 21              #228 [hci1] 16.127065
      SMP: Pairing Random (0x04) len 16
        Random value: 1cd07c478e3ffd4f0000000000000000
< HCI Command: Host Number of Com.. (0x03|0x0035) plen 5  #229 [hci1] 16.144512
        Num handles: 1
        Handle: 363 Address: DF:A9:FF:F6:B1:1A (OUI DF-A9-FF)
        Count: 1
